[I 2025-11-03 13:21:50,555] Trial 148 finished with value: 0.11018457368535005 and parameters: {'model_type': 'gcn', 'hidden_dims': '[256, 128, 64]', 'dropout': 0.23560315092419762, 'batch_norm': True, 'lr': 0.000794521822402691, 'weight_decay': 1.9069280669712413e-05, 'epochs': 255, 'loss': 'mse', 'optimizer': 'adam', 'graph_mode': 'off', 'use_snp_selection': False}. Best is trial 53 with value: 0.12218763160211579.
[I 2025-11-03 13:21:52,072] Trial 149 finished with value: 0.016503313436008193 and parameters: {'model_type': 'gcn', 'hidden_dims': '[256, 128, 64]', 'dropout': 0.5315778492664566, 'batch_norm': True, 'lr': 8.258206234636614e-05, 'weight_decay': 1.828354831155612e-05, 'epochs': 244, 'loss': 'mse', 'optimizer': 'adam', 'graph_mode': 'off', 'use_snp_selection': False}. Best is trial 53 with value: 0.12218763160211579.
[I 2025-11-03 13:21:54,029] Trial 0 finished with value: 0.009752934097201897 and parameters: {'model_type': 'gcn', 'hidden_dims': '[128, 64]', 'dropout': 0.199031432379812, 'batch_norm': True, 'lr': 1.8408544111075837e-06, 'weight_decay': 5.5136510071208614e-05, 'epochs': 336, 'loss': 'mae', 'optimizer': 'adam', 'graph_mode': 'off', 'use_snp_selection': True, 'num_snps': 43862}. Best is trial 0 with value: 0.009752934097201897.
[I 2025-11-03 13:21:55,443] Trial 1 finished with value: 0.03817815054951633 and parameters: {'model_type': 'gcn', 'hidden_dims': '[256, 128]', 'dropout': 0.4370668075331726, 'batch_norm': True, 'lr': 7.133471581159139e-05, 'weight_decay': 1.128633586803549e-05, 'epochs': 242, 'loss': 'mae', 'optimizer': 'adam', 'graph_mode': 'off', 'use_snp_selection': False}. Best is trial 1 with value: 0.03817815054951633.
[I 2025-11-03 13:21:56,485] Trial 2 finished with value: -0.002373445358139017 and parameters: {'model_type': 'gcn', 'hidden_dims': '[256, 128, 64]', 'dropout': 0.41314357415569625, 'batch_norm': False, 'lr': 3.952233718592101e-06, 'weight_decay': 0.00026754769258252603, 'epochs': 149, 'loss': 'mse', 'optimizer': 'adam', 'graph_mode': 'off', 'use_snp_selection': True, 'num_snps': 11571}. Best is trial 1 with value: 0.03817815054951633.
[I 2025-11-03 13:21:58,838] Trial 3 finished with value: 0.04515772235313238 and parameters: {'model_type': 'gcn', 'hidden_dims': '[512, 64]', 'dropout': 0.5938127374509361, 'batch_norm': False, 'lr': 5.67704586114731e-06, 'weight_decay': 2.4518087630137052e-05, 'epochs': 320, 'loss': 'mae', 'optimizer': 'adam', 'graph_mode': 'off', 'use_snp_selection': False}. Best is trial 3 with value: 0.04515772235313238.
[I 2025-11-03 13:22:01,018] Trial 4 finished with value: 0.006702533395102578 and parameters: {'model_type': 'gcn', 'hidden_dims': '[512, 128]', 'dropout': 0.25746343592134413, 'batch_norm': True, 'lr': 1.3467657668402788e-06, 'weight_decay': 0.00033087251918647806, 'epochs': 277, 'loss': 'mse', 'optimizer': 'adam', 'graph_mode': 'off', 'use_snp_selection': True, 'num_snps': 36675}. Best is trial 3 with value: 0.04515772235313238.
[I 2025-11-03 13:22:02,627] Trial 5 finished with value: 0.022210845301944757 and parameters: {'model_type': 'gcn', 'hidden_dims': '[512, 64]', 'dropout': 0.38275350994408375, 'batch_norm': True, 'lr': 1.5586664309232824e-06, 'weight_decay': 0.0008227664668621182, 'epochs': 145, 'loss': 'mae', 'optimizer': 'adam', 'graph_mode': 'off', 'use_snp_selection': True, 'num_snps': 32148}. Best is trial 3 with value: 0.04515772235313238.
[I 2025-11-03 13:22:03,868] Trial 6 finished with value: 0.011670775079799044 and parameters: {'model_type': 'gcn', 'hidden_dims': '[256, 128]', 'dropout': 0.3930109900265879, 'batch_norm': False, 'lr': 4.892964372128395e-05, 'weight_decay': 1.5809549317992182e-06, 'epochs': 199, 'loss': 'mse', 'optimizer': 'adam', 'graph_mode': 'off', 'use_snp_selection': False}. Best is trial 3 with value: 0.04515772235313238.
[I 2025-11-03 13:22:05,083] Trial 7 finished with value: 0.06645700838686963 and parameters: {'model_type': 'gcn', 'hidden_dims': '[512, 256]', 'dropout': 0.15343979219678458, 'batch_norm': True, 'lr': 6.234003099047341e-05, 'weight_decay': 3.894760610535477e-07, 'epochs': 97, 'loss': 'mse', 'optimizer': 'adam', 'graph_mode': 'off', 'use_snp_selection': False}. Best is trial 7 with value: 0.06645700838686963.
[I 2025-11-03 13:22:07,501] Trial 8 finished with value: 0.048523105651436964 and parameters: {'model_type': 'gcn', 'hidden_dims': '[512, 128]', 'dropout': 0.10743001231661406, 'batch_norm': True, 'lr': 0.00023728538449271062, 'weight_decay': 1.7629071578048637e-05, 'epochs': 312, 'loss': 'mae', 'optimizer': 'adam', 'graph_mode': 'off', 'use_snp_selection': False}. Best is trial 7 with value: 0.06645700838686963.
[I 2025-11-03 13:22:09,171] Trial 9 finished with value: 0.033169526664807596 and parameters: {'model_type': 'gcn', 'hidden_dims': '[512, 64]', 'dropout': 0.14505336736221927, 'batch_norm': True, 'lr': 5.8619638388111826e-05, 'weight_decay': 6.200156172669308e-07, 'epochs': 175, 'loss': 'mse', 'optimizer': 'adam', 'graph_mode': 'off', 'use_snp_selection': False}. Best is trial 7 with value: 0.06645700838686963.
[I 2025-11-03 13:22:10,133] Trial 10 finished with value: -0.004353037029229269 and parameters: {'model_type': 'gcn', 'hidden_dims': '[512, 256]', 'dropout': 0.2736992815328032, 'batch_norm': False, 'lr': 0.00032393778075602147, 'weight_decay': 1.1511946696017091e-07, 'epochs': 41, 'loss': 'mse', 'optimizer': 'adam', 'graph_mode': 'off', 'use_snp_selection': False}. Best is trial 7 with value: 0.06645700838686963.
[I 2025-11-03 13:22:11,221] Trial 11 finished with value: 0.04528825207811659 and parameters: {'model_type': 'gcn', 'hidden_dims': '[512, 128]', 'dropout': 0.10095648685224448, 'batch_norm': True, 'lr': 0.0007666984023899754, 'weight_decay': 2.512571353186099e-06, 'epochs': 70, 'loss': 'mae', 'optimizer': 'adam', 'graph_mode': 'off', 'use_snp_selection': False}. Best is trial 7 with value: 0.06645700838686963.
[I 2025-11-03 13:22:12,439] Trial 12 finished with value: 0.036660331791220906 and parameters: {'model_type': 'gcn', 'hidden_dims': '[512, 256]', 'dropout': 0.18206399419301494, 'batch_norm': True, 'lr': 0.00026576228959612443, 'weight_decay': 1.3081036432574914e-07, 'epochs': 88, 'loss': 'mae', 'optimizer': 'adam', 'graph_mode': 'off', 'use_snp_selection': False}. Best is trial 7 with value: 0.06645700838686963.
[I 2025-11-03 13:22:14,420] Trial 13 finished with value: 0.012079127303370369 and parameters: {'model_type': 'gcn', 'hidden_dims': '[512, 128]', 'dropout': 0.28178980110198326, 'batch_norm': True, 'lr': 1.620313997304389e-05, 'weight_decay': 3.475237872468419e-06, 'epochs': 237, 'loss': 'mse', 'optimizer': 'adam', 'graph_mode': 'off', 'use_snp_selection': False}. Best is trial 7 with value: 0.06645700838686963.
[I 2025-11-03 13:22:15,814] Trial 14 finished with value: 0.03245614213682213 and parameters: {'model_type': 'gcn', 'hidden_dims': '[512, 256]', 'dropout': 0.12319334351899142, 'batch_norm': True, 'lr': 0.00017558188744418174, 'weight_decay': 6.057825071170492e-05, 'epochs': 119, 'loss': 'mse', 'optimizer': 'adam', 'graph_mode': 'off', 'use_snp_selection': False}. Best is trial 7 with value: 0.06645700838686963.
[I 2025-11-03 13:22:17,096] Trial 15 finished with value: 0.05468868048793382 and parameters: {'model_type': 'gcn', 'hidden_dims': '[128, 64]', 'dropout': 0.2144644905818855, 'batch_norm': True, 'lr': 2.002944590579291e-05, 'weight_decay': 5.056071213029491e-07, 'epochs': 297, 'loss': 'mae', 'optimizer': 'adam', 'graph_mode': 'off', 'use_snp_selection': False}. Best is trial 7 with value: 0.06645700838686963.
[I 2025-11-03 13:22:18,153] Trial 16 finished with value: 0.023587175753443226 and parameters: {'model_type': 'gcn', 'hidden_dims': '[128, 64]', 'dropout': 0.22222337490690977, 'batch_norm': True, 'lr': 1.4098012456697182e-05, 'weight_decay': 4.833299252951357e-07, 'epochs': 220, 'loss': 'mae', 'optimizer': 'adam', 'graph_mode': 'off', 'use_snp_selection': False}. Best is trial 7 with value: 0.06645700838686963.
[I 2025-11-03 13:22:19,411] Trial 17 finished with value: 0.02306346354143948 and parameters: {'model_type': 'gcn', 'hidden_dims': '[128, 64]', 'dropout': 0.32888830259108426, 'batch_norm': True, 'lr': 2.349300150160791e-05, 'weight_decay': 3.6392708945165584e-07, 'epochs': 275, 'loss': 'mse', 'optimizer': 'adam', 'graph_mode': 'off', 'use_snp_selection': False}. Best is trial 7 with value: 0.06645700838686963.
[I 2025-11-03 13:22:22,091] Trial 18 finished with value: -0.009544453842353445 and parameters: {'model_type': 'gcn', 'hidden_dims': '[256, 128, 64]', 'dropout': 0.5098431992326697, 'batch_norm': False, 'lr': 0.00011002413714488088, 'weight_decay': 1.2664493946510444e-06, 'epochs': 282, 'loss': 'mae', 'optimizer': 'adam', 'graph_mode': 'off', 'use_snp_selection': True, 'num_snps': 58241}. Best is trial 7 with value: 0.06645700838686963.
[I 2025-11-03 13:22:23,474] Trial 19 finished with value: 0.03246658912818068 and parameters: {'model_type': 'gcn', 'hidden_dims': '[512, 256]', 'dropout': 0.3283027164458897, 'batch_norm': True, 'lr': 7.449216952554795e-06, 'weight_decay': 5.616604511856019e-06, 'epochs': 118, 'loss': 'mse', 'optimizer': 'adam', 'graph_mode': 'off', 'use_snp_selection': False}. Best is trial 7 with value: 0.06645700838686963.
[I 2025-11-03 13:22:24,418] Trial 20 finished with value: -0.0014534256615302416 and parameters: {'model_type': 'gcn', 'hidden_dims': '[128, 64]', 'dropout': 0.1683003999978968, 'batch_norm': True, 'lr': 1.1857669757062644e-05, 'weight_decay': 2.748407622134108e-07, 'epochs': 179, 'loss': 'mse', 'optimizer': 'adam', 'graph_mode': 'off', 'use_snp_selection': False}. Best is trial 7 with value: 0.06645700838686963.
[I 2025-11-03 13:22:26,760] Trial 21 finished with value: 0.05419160471190257 and parameters: {'model_type': 'gcn', 'hidden_dims': '[512, 128]', 'dropout': 0.10369083852141449, 'batch_norm': True, 'lr': 3.262791773108692e-05, 'weight_decay': 1.2860718105339766e-05, 'epochs': 307, 'loss': 'mae', 'optimizer': 'adam', 'graph_mode': 'off', 'use_snp_selection': False}. Best is trial 7 with value: 0.06645700838686963.
[I 2025-11-03 13:22:28,176] Trial 22 finished with value: 0.0101157469030881 and parameters: {'model_type': 'gcn', 'hidden_dims': '[128, 64]', 'dropout': 0.23805910511732892, 'batch_norm': True, 'lr': 3.511276726977528e-05, 'weight_decay': 9.606832583545451e-07, 'epochs': 342, 'loss': 'mae', 'optimizer': 'adam', 'graph_mode': 'off', 'use_snp_selection': False}. Best is trial 7 with value: 0.06645700838686963.
[I 2025-11-03 13:22:30,495] Trial 23 finished with value: 0.03846575060665049 and parameters: {'model_type': 'gcn', 'hidden_dims': '[512, 256]', 'dropout': 0.16618080486152126, 'batch_norm': True, 'lr': 2.8517819821540043e-05, 'weight_decay': 5.58915042973321e-06, 'epochs': 298, 'loss': 'mae', 'optimizer': 'adam', 'graph_mode': 'off', 'use_snp_selection': False}. Best is trial 7 with value: 0.06645700838686963.
[I 2025-11-03 13:22:32,600] Trial 24 finished with value: 0.036464024046106235 and parameters: {'model_type': 'gcn', 'hidden_dims': '[512, 128]', 'dropout': 0.14914400237472583, 'batch_norm': True, 'lr': 0.00012933696064794652, 'weight_decay': 2.2450450035383515e-07, 'epochs': 256, 'loss': 'mae', 'optimizer': 'adam', 'graph_mode': 'off', 'use_snp_selection': False}. Best is trial 7 with value: 0.06645700838686963.
[I 2025-11-03 13:22:34,121] Trial 25 finished with value: 0.03357197565913878 and parameters: {'model_type': 'gcn', 'hidden_dims': '[256, 128, 64]', 'dropout': 0.20777382632073504, 'batch_norm': True, 'lr': 8.073054368769597e-05, 'weight_decay': 7.852156273440315e-05, 'epochs': 212, 'loss': 'mae', 'optimizer': 'adam', 'graph_mode': 'off', 'use_snp_selection': False}. Best is trial 7 with value: 0.06645700838686963.
[I 2025-11-03 13:22:35,308] Trial 26 finished with value: 0.0054950527983794 and parameters: {'model_type': 'gcn', 'hidden_dims': '[256, 128]', 'dropout': 0.30176664300860595, 'batch_norm': False, 'lr': 3.9119945261009484e-05, 'weight_decay': 2.443643243280606e-06, 'epochs': 346, 'loss': 'mae', 'optimizer': 'adam', 'graph_mode': 'off', 'use_snp_selection': True, 'num_snps': 3842}. Best is trial 7 with value: 0.06645700838686963.
[I 2025-11-03 13:22:36,610] Trial 27 finished with value: 0.03371398744228964 and parameters: {'model_type': 'gcn', 'hidden_dims': '[128, 64]', 'dropout': 0.13438400656633542, 'batch_norm': True, 'lr': 2.1551193220774986e-05, 'weight_decay': 2.6086871179536294e-05, 'epochs': 297, 'loss': 'mae', 'optimizer': 'adam', 'graph_mode': 'off', 'use_snp_selection': False}. Best is trial 7 with value: 0.06645700838686963.
[I 2025-11-03 13:22:38,753] Trial 28 finished with value: 0.0035521514359823547 and parameters: {'model_type': 'gcn', 'hidden_dims': '[512, 128]', 'dropout': 0.2203948418791679, 'batch_norm': True, 'lr': 1.094990034050885e-05, 'weight_decay': 7.370451434969851e-07, 'epochs': 259, 'loss': 'mse', 'optimizer': 'adam', 'graph_mode': 'off', 'use_snp_selection': False}. Best is trial 7 with value: 0.06645700838686963.
[I 2025-11-03 13:22:40,484] Trial 29 finished with value: -0.0030117919568366782 and parameters: {'model_type': 'gcn', 'hidden_dims': '[512, 256]', 'dropout': 0.20151159662347776, 'batch_norm': True, 'lr': 2.8966762461994946e-06, 'weight_decay': 8.112790520217662e-06, 'epochs': 322, 'loss': 'mae', 'optimizer': 'adam', 'graph_mode': 'off', 'use_snp_selection': True, 'num_snps': 19468}. Best is trial 7 with value: 0.06645700838686963.
[I 2025-11-03 13:22:41,192] Trial 30 finished with value: 0.03568937176302239 and parameters: {'model_type': 'gcn', 'hidden_dims': '[128, 64]', 'dropout': 0.19300221130355566, 'batch_norm': True, 'lr': 0.00047204887109720867, 'weight_decay': 0.00010803940086829997, 'epochs': 87, 'loss': 'mae', 'optimizer': 'adam', 'graph_mode': 'off', 'use_snp_selection': False}. Best is trial 7 with value: 0.06645700838686963.
[I 2025-11-03 13:22:43,579] Trial 31 finished with value: 0.043684446869396085 and parameters: {'model_type': 'gcn', 'hidden_dims': '[512, 128]', 'dropout': 0.10131407579169126, 'batch_norm': True, 'lr': 0.0001650768395690206, 'weight_decay': 1.970610374444092e-05, 'epochs': 315, 'loss': 'mae', 'optimizer': 'adam', 'graph_mode': 'off', 'use_snp_selection': False}. Best is trial 7 with value: 0.06645700838686963.
[I 2025-11-03 13:22:46,003] Trial 32 finished with value: 0.04674850950028413 and parameters: {'model_type': 'gcn', 'hidden_dims': '[512, 128]', 'dropout': 0.12118466879553662, 'batch_norm': True, 'lr': 7.908504796345224e-05, 'weight_decay': 1.2280316042782232e-05, 'epochs': 304, 'loss': 'mae', 'optimizer': 'adam', 'graph_mode': 'off', 'use_snp_selection': False}. Best is trial 7 with value: 0.06645700838686963.
[I 2025-11-03 13:22:48,515] Trial 33 finished with value: 0.05044789044299059 and parameters: {'model_type': 'gcn', 'hidden_dims': '[512, 128]', 'dropout': 0.167452311173247, 'batch_norm': True, 'lr': 0.0002322591413640177, 'weight_decay': 1.4039712017063597e-05, 'epochs': 329, 'loss': 'mae', 'optimizer': 'adam', 'graph_mode': 'off', 'use_snp_selection': False}. Best is trial 7 with value: 0.06645700838686963.
[I 2025-11-03 13:22:51,091] Trial 34 finished with value: 0.031275169093021665 and parameters: {'model_type': 'gcn', 'hidden_dims': '[512, 128]', 'dropout': 0.15988327527226776, 'batch_norm': True, 'lr': 0.0006616286906720633, 'weight_decay': 4.0756877343209605e-05, 'epochs': 344, 'loss': 'mae', 'optimizer': 'adam', 'graph_mode': 'off', 'use_snp_selection': False}. Best is trial 7 with value: 0.06645700838686963.
[I 2025-11-03 13:22:53,060] Trial 35 finished with value: 0.03787124055116855 and parameters: {'model_type': 'gcn', 'hidden_dims': '[256, 128, 64]', 'dropout': 0.4765625079717057, 'batch_norm': False, 'lr': 5.9716777666001604e-05, 'weight_decay': 8.846449483409963e-06, 'epochs': 328, 'loss': 'mae', 'optimizer': 'adam', 'graph_mode': 'off', 'use_snp_selection': False}. Best is trial 7 with value: 0.06645700838686963.
[I 2025-11-03 13:22:55,457] Trial 36 finished with value: 0.03936196268576406 and parameters: {'model_type': 'gcn', 'hidden_dims': '[256, 128]', 'dropout': 0.2437170857430706, 'batch_norm': True, 'lr': 6.6659135934546175e-06, 'weight_decay': 4.075779983740124e-06, 'epochs': 245, 'loss': 'mae', 'optimizer': 'adam', 'graph_mode': 'off', 'use_snp_selection': True, 'num_snps': 58661}. Best is trial 7 with value: 0.06645700838686963.
[I 2025-11-03 13:22:57,674] Trial 37 finished with value: 0.02398441367406333 and parameters: {'model_type': 'gcn', 'hidden_dims': '[512, 64]', 'dropout': 0.18241320041607362, 'batch_norm': True, 'lr': 0.00011069221758574932, 'weight_decay': 1.9085423867870994e-07, 'epochs': 285, 'loss': 'mse', 'optimizer': 'adam', 'graph_mode': 'off', 'use_snp_selection': False}. Best is trial 7 with value: 0.06645700838686963.
[I 2025-11-03 13:22:58,892] Trial 38 finished with value: 0.030165054593253013 and parameters: {'model_type': 'gcn', 'hidden_dims': '[512, 128]', 'dropout': 0.574982269382311, 'batch_norm': False, 'lr': 4.400133175878049e-05, 'weight_decay': 3.539266060385762e-05, 'epochs': 159, 'loss': 'mae', 'optimizer': 'adam', 'graph_mode': 'off', 'use_snp_selection': True, 'num_snps': 19911}. Best is trial 7 with value: 0.06645700838686963.
[I 2025-11-03 13:23:01,062] Trial 39 finished with value: 0.0977451340706182 and parameters: {'model_type': 'gcn', 'hidden_dims': '[512, 128]', 'dropout': 0.13957813682720854, 'batch_norm': True, 'lr': 4.188612730575317e-06, 'weight_decay': 0.00023838990493181032, 'epochs': 270, 'loss': 'mse', 'optimizer': 'adam', 'graph_mode': 'off', 'use_snp_selection': False}. Best is trial 39 with value: 0.0977451340706182.
[I 2025-11-03 13:23:03,236] Trial 40 finished with value: 0.0037900413242040387 and parameters: {'model_type': 'gcn', 'hidden_dims': '[512, 64]', 'dropout': 0.1449502487485662, 'batch_norm': True, 'lr': 2.4226860673472218e-06, 'weight_decay': 0.0003007516294320507, 'epochs': 265, 'loss': 'mse', 'optimizer': 'adam', 'graph_mode': 'off', 'use_snp_selection': False}. Best is trial 39 with value: 0.0977451340706182.
[I 2025-11-03 13:23:05,478] Trial 41 finished with value: -0.002653842127838891 and parameters: {'model_type': 'gcn', 'hidden_dims': '[512, 128]', 'dropout': 0.12396512517816119, 'batch_norm': True, 'lr': 5.258043854275788e-06, 'weight_decay': 0.00016807320533150004, 'epochs': 292, 'loss': 'mse', 'optimizer': 'adam', 'graph_mode': 'off', 'use_snp_selection': False}. Best is trial 39 with value: 0.0977451340706182.
[I 2025-11-03 13:23:07,943] Trial 42 finished with value: 0.03465891941202519 and parameters: {'model_type': 'gcn', 'hidden_dims': '[512, 128]', 'dropout': 0.1617725849190439, 'batch_norm': True, 'lr': 0.0003903733102844566, 'weight_decay': 0.0007599638748439694, 'epochs': 327, 'loss': 'mse', 'optimizer': 'adam', 'graph_mode': 'off', 'use_snp_selection': False}. Best is trial 39 with value: 0.0977451340706182.
[I 2025-11-03 13:23:10,352] Trial 43 finished with value: -0.0019824616623127975 and parameters: {'model_type': 'gcn', 'hidden_dims': '[512, 128]', 'dropout': 0.13618663823667937, 'batch_norm': True, 'lr': 8.985410613107178e-06, 'weight_decay': 1.5627455517781027e-06, 'epochs': 309, 'loss': 'mse', 'optimizer': 'adam', 'graph_mode': 'off', 'use_snp_selection': False}. Best is trial 39 with value: 0.0977451340706182.
[I 2025-11-03 13:23:12,858] Trial 44 finished with value: 0.047406516901030184 and parameters: {'model_type': 'gcn', 'hidden_dims': '[512, 128]', 'dropout': 0.1817479335045761, 'batch_norm': True, 'lr': 2.3163948412550143e-05, 'weight_decay': 1.2766967760349538e-05, 'epochs': 332, 'loss': 'mse', 'optimizer': 'adam', 'graph_mode': 'off', 'use_snp_selection': False}. Best is trial 39 with value: 0.0977451340706182.
[I 2025-11-03 13:23:14,836] Trial 45 finished with value: 0.01911614672791649 and parameters: {'model_type': 'gcn', 'hidden_dims': '[512, 256]', 'dropout': 0.1002539084155061, 'batch_norm': True, 'lr': 3.273012137232803e-06, 'weight_decay': 0.00015207709121030483, 'epochs': 235, 'loss': 'mse', 'optimizer': 'adam', 'graph_mode': 'off', 'use_snp_selection': False}. Best is trial 39 with value: 0.0977451340706182.
[I 2025-11-03 13:23:15,577] Trial 46 finished with value: 0.013568802400128302 and parameters: {'model_type': 'gcn', 'hidden_dims': '[256, 128]', 'dropout': 0.2707974526016119, 'batch_norm': False, 'lr': 1.7502548637372453e-06, 'weight_decay': 0.0005073196168236188, 'epochs': 49, 'loss': 'mae', 'optimizer': 'adam', 'graph_mode': 'off', 'use_snp_selection': False}. Best is trial 39 with value: 0.0977451340706182.
[I 2025-11-03 13:23:17,758] Trial 47 finished with value: 0.039052917176039516 and parameters: {'model_type': 'gcn', 'hidden_dims': '[512, 128]', 'dropout': 0.23063175846434253, 'batch_norm': True, 'lr': 4.922872931504969e-06, 'weight_decay': 1.0144112315840621e-07, 'epochs': 272, 'loss': 'mse', 'optimizer': 'adam', 'graph_mode': 'off', 'use_snp_selection': False}. Best is trial 39 with value: 0.0977451340706182.
[I 2025-11-03 13:23:18,621] Trial 48 finished with value: 0.01887931402407777 and parameters: {'model_type': 'gcn', 'hidden_dims': '[128, 64]', 'dropout': 0.25265542838589905, 'batch_norm': True, 'lr': 1.1170552432785515e-06, 'weight_decay': 2.3325770324738375e-06, 'epochs': 138, 'loss': 'mae', 'optimizer': 'adam', 'graph_mode': 'off', 'use_snp_selection': False}. Best is trial 39 with value: 0.0977451340706182.
[I 2025-11-03 13:23:20,885] Trial 49 finished with value: 0.005684427990941636 and parameters: {'model_type': 'gcn', 'hidden_dims': '[512, 256]', 'dropout': 0.37552058304187724, 'batch_norm': True, 'lr': 1.6833038813960553e-05, 'weight_decay': 4.866843248583871e-07, 'epochs': 188, 'loss': 'mse', 'optimizer': 'adam', 'graph_mode': 'off', 'use_snp_selection': True, 'num_snps': 46888}. Best is trial 39 with value: 0.0977451340706182.
