[I 2025-11-03 12:23:53,687] Trial 52 finished with value: 0.03854565303394178 and parameters: {'model_type': 'gcn', 'hidden_dims': '[128, 64]', 'dropout': 0.32030082180734487, 'batch_norm': False, 'lr': 0.0001495269632593887, 'weight_decay': 9.515139470464882e-06, 'epochs': 113, 'loss': 'mae', 'optimizer': 'adam', 'graph_mode': 'cutoff', 'cutoff': 0.7240104789440848, 'grm_norm': 'cosine', 'self_loops': True, 'use_snp_selection': True, 'num_snps': 2215}. Best is trial 32 with value: 0.058217567068497234.
[I 2025-11-03 12:23:56,099] Trial 53 finished with value: 0.023396394017806313 and parameters: {'model_type': 'gcn', 'hidden_dims': '[128, 64]', 'dropout': 0.27267822847503037, 'batch_norm': False, 'lr': 0.00043086211220738814, 'weight_decay': 2.8962363583981496e-05, 'epochs': 142, 'loss': 'mae', 'optimizer': 'adam', 'graph_mode': 'cutoff', 'cutoff': 0.5548129747482201, 'grm_norm': 'gcn', 'self_loops': False, 'use_snp_selection': True, 'num_snps': 31021}. Best is trial 32 with value: 0.058217567068497234.
[I 2025-11-03 12:23:58,455] Trial 54 finished with value: 0.025600484763297713 and parameters: {'model_type': 'gcn', 'hidden_dims': '[512, 128]', 'dropout': 0.21655866845025362, 'batch_norm': False, 'lr': 0.00025199240847433106, 'weight_decay': 1.4116570322813e-05, 'epochs': 82, 'loss': 'mae', 'optimizer': 'adam', 'graph_mode': 'cutoff', 'cutoff': 0.6093716745371056, 'grm_norm': 'cosine', 'self_loops': True, 'use_snp_selection': True, 'num_snps': 26902}. Best is trial 32 with value: 0.058217567068497234.
[I 2025-11-03 12:24:00,252] Trial 55 finished with value: 0.02733143937944331 and parameters: {'model_type': 'gcn', 'hidden_dims': '[128, 64]', 'dropout': 0.38508163696285136, 'batch_norm': False, 'lr': 0.0003360908747779701, 'weight_decay': 0.00010017578156377692, 'epochs': 123, 'loss': 'mae', 'optimizer': 'adam', 'graph_mode': 'cutoff', 'cutoff': 0.6568223797798791, 'grm_norm': 'none', 'self_loops': True, 'use_snp_selection': True, 'num_snps': 15056}. Best is trial 32 with value: 0.058217567068497234.
[I 2025-11-03 12:24:02,047] Trial 56 finished with value: 0.008365528985831136 and parameters: {'model_type': 'gcn', 'hidden_dims': '[512, 128]', 'dropout': 0.18579272247618128, 'batch_norm': False, 'lr': 0.0004848074434606031, 'weight_decay': 5.283711410384069e-06, 'epochs': 165, 'loss': 'mae', 'optimizer': 'adam', 'graph_mode': 'cutoff', 'cutoff': 0.5101324142601557, 'grm_norm': 'gcn', 'self_loops': False, 'use_snp_selection': True, 'num_snps': 9801}. Best is trial 32 with value: 0.058217567068497234.
[I 2025-11-03 12:24:05,019] Trial 57 finished with value: 0.015836980974775434 and parameters: {'model_type': 'gcn', 'hidden_dims': '[512, 256]', 'dropout': 0.4751269541275076, 'batch_norm': False, 'lr': 0.00019354548645139982, 'weight_decay': 0.0006154641874720654, 'epochs': 206, 'loss': 'mae', 'optimizer': 'adam', 'graph_mode': 'cutoff', 'cutoff': 0.5847419698313008, 'grm_norm': 'cosine', 'self_loops': True, 'use_snp_selection': True, 'num_snps': 30759}. Best is trial 32 with value: 0.058217567068497234.
[I 2025-11-03 12:24:07,540] Trial 58 finished with value: 0.03351843673782578 and parameters: {'model_type': 'gcn', 'hidden_dims': '[512, 128]', 'dropout': 0.41375538456929656, 'batch_norm': False, 'lr': 0.00014743358456040928, 'weight_decay': 0.00027456394665000894, 'epochs': 179, 'loss': 'mae', 'optimizer': 'adam', 'graph_mode': 'cutoff', 'cutoff': 0.6982526237863826, 'grm_norm': 'cosine', 'self_loops': False, 'use_snp_selection': True, 'num_snps': 23136}. Best is trial 32 with value: 0.058217567068497234.
[I 2025-11-03 12:24:09,147] Trial 59 finished with value: 0.05548238779388721 and parameters: {'model_type': 'gcn', 'hidden_dims': '[128, 64]', 'dropout': 0.24368208668911046, 'batch_norm': False, 'lr': 0.00025636322468244134, 'weight_decay': 1.6858556451009174e-06, 'epochs': 143, 'loss': 'mae', 'optimizer': 'adam', 'graph_mode': 'cutoff', 'cutoff': 0.7404820698532251, 'grm_norm': 'none', 'self_loops': True, 'use_snp_selection': True, 'num_snps': 7947}. Best is trial 32 with value: 0.058217567068497234.
[I 2025-11-03 12:24:10,403] Trial 60 finished with value: -0.007004798338462872 and parameters: {'model_type': 'gcn', 'hidden_dims': '[512, 128]', 'dropout': 0.24787893296463043, 'batch_norm': False, 'lr': 0.0008048804025825371, 'weight_decay': 2.047328546254768e-06, 'epochs': 8, 'loss': 'mse', 'optimizer': 'adam', 'graph_mode': 'cutoff', 'cutoff': 0.7373748613826716, 'grm_norm': 'none', 'self_loops': True, 'use_snp_selection': True, 'num_snps': 6940}. Best is trial 32 with value: 0.058217567068497234.
[I 2025-11-03 12:24:12,190] Trial 61 finished with value: 0.0353766190071263 and parameters: {'model_type': 'gcn', 'hidden_dims': '[128, 64]', 'dropout': 0.28922562617626635, 'batch_norm': False, 'lr': 0.0002550274757878429, 'weight_decay': 4.525868371820412e-06, 'epochs': 143, 'loss': 'mae', 'optimizer': 'adam', 'graph_mode': 'cutoff', 'cutoff': 0.6319477612575198, 'grm_norm': 'none', 'self_loops': True, 'use_snp_selection': True, 'num_snps': 13380}. Best is trial 32 with value: 0.058217567068497234.
[I 2025-11-03 12:24:13,708] Trial 62 finished with value: -0.00012342803502255536 and parameters: {'model_type': 'gcn', 'hidden_dims': '[128, 64]', 'dropout': 0.23757915163741733, 'batch_norm': False, 'lr': 0.00037349333424161553, 'weight_decay': 2.014079935067969e-06, 'epochs': 106, 'loss': 'mae', 'optimizer': 'adam', 'graph_mode': 'cutoff', 'cutoff': 0.7535817860936984, 'grm_norm': 'none', 'self_loops': True, 'use_snp_selection': True, 'num_snps': 8089}. Best is trial 32 with value: 0.058217567068497234.
[I 2025-11-03 12:24:15,367] Trial 63 finished with value: 0.03352300221244514 and parameters: {'model_type': 'gcn', 'hidden_dims': '[128, 64]', 'dropout': 0.25855409833585524, 'batch_norm': False, 'lr': 0.0003099400101743377, 'weight_decay': 2.3548547417284553e-05, 'epochs': 125, 'loss': 'mae', 'optimizer': 'adam', 'graph_mode': 'cutoff', 'cutoff': 0.8479823768804904, 'grm_norm': 'none', 'self_loops': True, 'use_snp_selection': True, 'num_snps': 10871}. Best is trial 32 with value: 0.058217567068497234.
[I 2025-11-03 12:24:18,494] Trial 64 finished with value: 0.04162428181322391 and parameters: {'model_type': 'gcn', 'hidden_dims': '[128, 64]', 'dropout': 0.2067526959585781, 'batch_norm': False, 'lr': 0.00021888695873166034, 'weight_decay': 8.638942051784965e-06, 'epochs': 84, 'loss': 'mae', 'optimizer': 'adam', 'graph_mode': 'cutoff', 'cutoff': 0.6683115422089183, 'grm_norm': 'gcn', 'self_loops': True, 'use_snp_selection': True, 'num_snps': 54817}. Best is trial 32 with value: 0.058217567068497234.
[I 2025-11-03 12:24:21,745] Trial 65 finished with value: 0.010469448245754553 and parameters: {'model_type': 'gcn', 'hidden_dims': '[256, 128]', 'dropout': 0.16393434406354587, 'batch_norm': False, 'lr': 0.0001240973436673634, 'weight_decay': 6.446572740501048e-07, 'epochs': 179, 'loss': 'mae', 'optimizer': 'adam', 'graph_mode': 'cutoff', 'cutoff': 0.5706336678867935, 'grm_norm': 'none', 'self_loops': False, 'use_snp_selection': True, 'num_snps': 46577}. Best is trial 32 with value: 0.058217567068497234.
[I 2025-11-03 12:24:23,291] Trial 66 finished with value: 0.041189830875383304 and parameters: {'model_type': 'gcn', 'hidden_dims': '[512, 128]', 'dropout': 0.3171321989746484, 'batch_norm': False, 'lr': 0.0005698594288017302, 'weight_decay': 0.0009696384244853285, 'epochs': 148, 'loss': 'mae', 'optimizer': 'adam', 'graph_mode': 'cutoff', 'cutoff': 0.5062239339644279, 'grm_norm': 'cosine', 'self_loops': True, 'use_snp_selection': True, 'num_snps': 4432}. Best is trial 32 with value: 0.058217567068497234.
[I 2025-11-03 12:24:26,678] Trial 67 finished with value: 0.03817686371952124 and parameters: {'model_type': 'gcn', 'hidden_dims': '[512, 128]', 'dropout': 0.3637820390910702, 'batch_norm': False, 'lr': 0.00017490799099912317, 'weight_decay': 0.0001774365804027791, 'epochs': 160, 'loss': 'mae', 'optimizer': 'adam', 'graph_mode': 'cutoff', 'cutoff': 0.6935694203444055, 'grm_norm': 'cosine_then_gcn', 'self_loops': True, 'use_snp_selection': True, 'num_snps': 41704}. Best is trial 32 with value: 0.058217567068497234.
[I 2025-11-03 12:24:28,810] Trial 68 finished with value: 0.01713063860211086 and parameters: {'model_type': 'gcn', 'hidden_dims': '[128, 64]', 'dropout': 0.5406731465946204, 'batch_norm': False, 'lr': 8.155043247227978e-05, 'weight_decay': 1.304494792501917e-05, 'epochs': 204, 'loss': 'mae', 'optimizer': 'adam', 'graph_mode': 'cutoff', 'cutoff': 0.8391360023063723, 'grm_norm': 'cosine', 'self_loops': True, 'use_snp_selection': True, 'num_snps': 18505}. Best is trial 32 with value: 0.058217567068497234.
[I 2025-11-03 12:24:31,614] Trial 69 finished with value: -0.04560722454342183 and parameters: {'model_type': 'gcn', 'hidden_dims': '[512, 128]', 'dropout': 0.1815476707909502, 'batch_norm': False, 'lr': 9.230898138482453e-06, 'weight_decay': 1.534936017271334e-06, 'epochs': 117, 'loss': 'mae', 'optimizer': 'adam', 'graph_mode': 'cutoff', 'cutoff': 0.2604718579932881, 'grm_norm': 'none', 'self_loops': True, 'use_snp_selection': True, 'num_snps': 33754}. Best is trial 32 with value: 0.058217567068497234.
[I 2025-11-03 12:24:34,388] Trial 70 finished with value: 0.030137440656512644 and parameters: {'model_type': 'gcn', 'hidden_dims': '[512, 256]', 'dropout': 0.11838693203114879, 'batch_norm': False, 'lr': 0.00037708508327710877, 'weight_decay': 9.28584197337819e-07, 'epochs': 218, 'loss': 'mae', 'optimizer': 'adam', 'graph_mode': 'cutoff', 'cutoff': 0.7704126976031569, 'grm_norm': 'cosine_then_gcn', 'self_loops': True, 'use_snp_selection': True, 'num_snps': 25429}. Best is trial 32 with value: 0.058217567068497234.
[I 2025-11-03 12:24:37,634] Trial 71 finished with value: 0.022433802742364402 and parameters: {'model_type': 'gcn', 'hidden_dims': '[128, 64]', 'dropout': 0.20543860015927617, 'batch_norm': False, 'lr': 0.0002367029954666065, 'weight_decay': 8.898864885292047e-06, 'epochs': 92, 'loss': 'mae', 'optimizer': 'adam', 'graph_mode': 'cutoff', 'cutoff': 0.6617476772105637, 'grm_norm': 'gcn', 'self_loops': True, 'use_snp_selection': True, 'num_snps': 56985}. Best is trial 32 with value: 0.058217567068497234.
[I 2025-11-03 12:24:40,527] Trial 72 finished with value: 0.01773054407887226 and parameters: {'model_type': 'gcn', 'hidden_dims': '[128, 64]', 'dropout': 0.22948033666714693, 'batch_norm': False, 'lr': 0.000219532516806201, 'weight_decay': 2.795477520004958e-06, 'epochs': 50, 'loss': 'mae', 'optimizer': 'adam', 'graph_mode': 'cutoff', 'cutoff': 0.586774059901355, 'grm_norm': 'gcn', 'self_loops': True, 'use_snp_selection': True, 'num_snps': 51454}. Best is trial 32 with value: 0.058217567068497234.
[I 2025-11-03 12:24:43,845] Trial 73 finished with value: 0.02516896614522728 and parameters: {'model_type': 'gcn', 'hidden_dims': '[128, 64]', 'dropout': 0.21430392419800642, 'batch_norm': False, 'lr': 5.759478768858896e-05, 'weight_decay': 0.00034031502940660643, 'epochs': 134, 'loss': 'mae', 'optimizer': 'adam', 'graph_mode': 'cutoff', 'cutoff': 0.6673761093350705, 'grm_norm': 'gcn', 'self_loops': True, 'use_snp_selection': True, 'num_snps': 55403}. Best is trial 32 with value: 0.058217567068497234.
[I 2025-11-03 12:24:46,968] Trial 74 finished with value: -0.004079214951576839 and parameters: {'model_type': 'gcn', 'hidden_dims': '[128, 64]', 'dropout': 0.15495224390656048, 'batch_norm': False, 'lr': 0.00028349118117664864, 'weight_decay': 5.5807259838824816e-05, 'epochs': 25, 'loss': 'mae', 'optimizer': 'adam', 'graph_mode': 'cutoff', 'cutoff': 0.6268651948424102, 'grm_norm': 'gcn', 'self_loops': True, 'use_snp_selection': True, 'num_snps': 59393}. Best is trial 32 with value: 0.058217567068497234.
[I 2025-11-03 12:24:50,515] Trial 75 finished with value: -0.01421669626147127 and parameters: {'model_type': 'gcn', 'hidden_dims': '[512, 128]', 'dropout': 0.29296102178076316, 'batch_norm': False, 'lr': 0.00012578228314722695, 'weight_decay': 4.0317694894237535e-06, 'epochs': 101, 'loss': 'mae', 'optimizer': 'adam', 'graph_mode': 'cutoff', 'cutoff': 0.44613215127885064, 'grm_norm': 'cosine_then_gcn', 'self_loops': True, 'use_snp_selection': True, 'num_snps': 50793}. Best is trial 32 with value: 0.058217567068497234.
[I 2025-11-03 12:24:53,658] Trial 76 finished with value: 0.005344232758781988 and parameters: {'model_type': 'gcn', 'hidden_dims': '[128, 64]', 'dropout': 0.26557995162613135, 'batch_norm': False, 'lr': 0.0004719572763071575, 'weight_decay': 0.0006338820452285353, 'epochs': 76, 'loss': 'mae', 'optimizer': 'adam', 'graph_mode': 'cutoff', 'cutoff': 0.6915869717553204, 'grm_norm': 'cosine', 'self_loops': True, 'use_snp_selection': True, 'num_snps': 55175}. Best is trial 32 with value: 0.058217567068497234.
[I 2025-11-03 12:24:55,145] Trial 77 finished with value: -0.0065898540759720785 and parameters: {'model_type': 'gcn', 'hidden_dims': '[512, 128]', 'dropout': 0.17509614342314433, 'batch_norm': False, 'lr': 3.360211706267381e-05, 'weight_decay': 7.432596568076504e-06, 'epochs': 139, 'loss': 'mse', 'optimizer': 'adam', 'graph_mode': 'cutoff', 'cutoff': 0.5572818631644618, 'grm_norm': 'cosine_then_gcn', 'self_loops': True, 'use_snp_selection': True, 'num_snps': 4386}. Best is trial 32 with value: 0.058217567068497234.
[I 2025-11-03 12:24:58,240] Trial 78 finished with value: -0.009685188603755588 and parameters: {'model_type': 'gcn', 'hidden_dims': '[128, 64]', 'dropout': 0.19352998489137882, 'batch_norm': False, 'lr': 0.0002071282363998634, 'weight_decay': 0.0004988008214173691, 'epochs': 188, 'loss': 'mae', 'optimizer': 'adam', 'graph_mode': 'cutoff', 'cutoff': 0.5963174336934464, 'grm_norm': 'none', 'self_loops': True, 'use_snp_selection': True, 'num_snps': 47971}. Best is trial 32 with value: 0.058217567068497234.
[I 2025-11-03 12:25:01,338] Trial 79 finished with value: 0.02041637550909534 and parameters: {'model_type': 'gcn', 'hidden_dims': '[256, 128]', 'dropout': 0.20281417745181404, 'batch_norm': False, 'lr': 0.0006419685857356061, 'weight_decay': 0.00010771516923768597, 'epochs': 163, 'loss': 'mae', 'optimizer': 'adam', 'graph_mode': 'cutoff', 'cutoff': 0.5214166463951905, 'grm_norm': 'cosine', 'self_loops': True, 'use_snp_selection': True, 'num_snps': 42734}. Best is trial 32 with value: 0.058217567068497234.
[I 2025-11-03 12:25:03,231] Trial 80 finished with value: 0.01886527469498088 and parameters: {'model_type': 'gcn', 'hidden_dims': '[512, 128]', 'dropout': 0.23637167766383232, 'batch_norm': False, 'lr': 0.00016655214793070972, 'weight_decay': 3.072771492465687e-05, 'epochs': 154, 'loss': 'mae', 'optimizer': 'adam', 'graph_mode': 'cutoff', 'cutoff': 0.8405905494488793, 'grm_norm': 'cosine_then_gcn', 'self_loops': True, 'use_snp_selection': True, 'num_snps': 12019}. Best is trial 32 with value: 0.058217567068497234.
[I 2025-11-03 12:25:04,768] Trial 81 finished with value: 0.036032415148117086 and parameters: {'model_type': 'gcn', 'hidden_dims': '[512, 128]', 'dropout': 0.3152469558177949, 'batch_norm': False, 'lr': 0.00036793551426931513, 'weight_decay': 0.00075310783803196, 'epochs': 148, 'loss': 'mae', 'optimizer': 'adam', 'graph_mode': 'cutoff', 'cutoff': 0.4926527248691969, 'grm_norm': 'cosine', 'self_loops': True, 'use_snp_selection': True, 'num_snps': 4347}. Best is trial 32 with value: 0.058217567068497234.
[I 2025-11-03 12:25:06,175] Trial 82 finished with value: 0.015915480392850217 and parameters: {'model_type': 'gcn', 'hidden_dims': '[512, 128]', 'dropout': 0.34966213752439823, 'batch_norm': False, 'lr': 0.0005803427913520569, 'weight_decay': 0.000945871245016842, 'epochs': 129, 'loss': 'mae', 'optimizer': 'adam', 'graph_mode': 'cutoff', 'cutoff': 0.5026802579157812, 'grm_norm': 'cosine', 'self_loops': True, 'use_snp_selection': True, 'num_snps': 2076}. Best is trial 32 with value: 0.058217567068497234.
[I 2025-11-03 12:25:07,746] Trial 83 finished with value: 0.020058147658086306 and parameters: {'model_type': 'gcn', 'hidden_dims': '[512, 128]', 'dropout': 0.32798054696035817, 'batch_norm': False, 'lr': 0.0005063930905824211, 'weight_decay': 5.885945886231852e-07, 'epochs': 118, 'loss': 'mae', 'optimizer': 'adam', 'graph_mode': 'cutoff', 'cutoff': 0.4697117359825042, 'grm_norm': 'cosine', 'self_loops': True, 'use_snp_selection': True, 'num_snps': 7255}. Best is trial 32 with value: 0.058217567068497234.
[I 2025-11-03 12:25:09,535] Trial 84 finished with value: 0.023491653249828975 and parameters: {'model_type': 'gcn', 'hidden_dims': '[512, 128]', 'dropout': 0.2964040891563946, 'batch_norm': False, 'lr': 0.0008571721861643888, 'weight_decay': 0.0005009988922392023, 'epochs': 173, 'loss': 'mae', 'optimizer': 'adam', 'graph_mode': 'cutoff', 'cutoff': 0.433532862039608, 'grm_norm': 'cosine', 'self_loops': True, 'use_snp_selection': True, 'num_snps': 9256}. Best is trial 32 with value: 0.058217567068497234.
[I 2025-11-03 12:25:10,956] Trial 85 finished with value: 0.033314952427078576 and parameters: {'model_type': 'gcn', 'hidden_dims': '[512, 128]', 'dropout': 0.24929795859699755, 'batch_norm': False, 'lr': 0.0006764250805651198, 'weight_decay': 2.0366161248863262e-05, 'epochs': 83, 'loss': 'mae', 'optimizer': 'adam', 'graph_mode': 'cutoff', 'cutoff': 0.5494991031230092, 'grm_norm': 'cosine', 'self_loops': True, 'use_snp_selection': True, 'num_snps': 5708}. Best is trial 32 with value: 0.058217567068497234.
[I 2025-11-03 12:25:12,319] Trial 86 finished with value: -0.011726396164570324 and parameters: {'model_type': 'gcn', 'hidden_dims': '[128, 64]', 'dropout': 0.28256186299571584, 'batch_norm': False, 'lr': 0.00028762544222543884, 'weight_decay': 1.241428839647943e-06, 'epochs': 98, 'loss': 'mae', 'optimizer': 'adam', 'graph_mode': 'cutoff', 'cutoff': 0.7119203123065055, 'grm_norm': 'gcn', 'self_loops': False, 'use_snp_selection': True, 'num_snps': 3700}. Best is trial 32 with value: 0.058217567068497234.
[I 2025-11-03 12:25:17,091] Trial 87 finished with value: 0.030107713002144692 and parameters: {'model_type': 'gcn', 'hidden_dims': '[512, 128]', 'dropout': 0.22334496415113475, 'batch_norm': False, 'lr': 0.0004156858729294696, 'weight_decay': 0.000306419706707433, 'epochs': 256, 'loss': 'mae', 'optimizer': 'adam', 'graph_mode': 'cutoff', 'cutoff': 0.6393080900570741, 'grm_norm': 'cosine_then_gcn', 'self_loops': True, 'use_snp_selection': True, 'num_snps': 57681}. Best is trial 32 with value: 0.058217567068497234.
[I 2025-11-03 12:25:19,301] Trial 88 finished with value: 0.03324041049235588 and parameters: {'model_type': 'gcn', 'hidden_dims': '[128, 64]', 'dropout': 0.1626607793956325, 'batch_norm': False, 'lr': 3.7371792666384214e-06, 'weight_decay': 0.0004309558721942021, 'epochs': 200, 'loss': 'mae', 'optimizer': 'adam', 'graph_mode': 'cutoff', 'cutoff': 0.5287216738085386, 'grm_norm': 'cosine', 'self_loops': True, 'use_snp_selection': True, 'num_snps': 20944}. Best is trial 32 with value: 0.058217567068497234.
[I 2025-11-03 12:25:21,654] Trial 89 finished with value: 0.05019414648836868 and parameters: {'model_type': 'gcn', 'hidden_dims': '[256, 128, 64]', 'dropout': 0.1427047600485149, 'batch_norm': False, 'lr': 0.00010182119236680498, 'weight_decay': 0.0009956298220870944, 'epochs': 226, 'loss': 'mse', 'optimizer': 'adam', 'graph_mode': 'knn', 'source': 'grm', 'knn_k': 9, 'weighted_edges': False, 'symmetrize_mode': 'mutual', 'use_snp_selection': True, 'num_snps': 14544}. Best is trial 32 with value: 0.058217567068497234.
[I 2025-11-03 12:25:23,902] Trial 90 finished with value: 0.053643742155736744 and parameters: {'model_type': 'gcn', 'hidden_dims': '[256, 128, 64]', 'dropout': 0.1436965679774399, 'batch_norm': True, 'lr': 9.938186101321017e-05, 'weight_decay': 0.0007453697762650866, 'epochs': 198, 'loss': 'mse', 'optimizer': 'adam', 'graph_mode': 'knn', 'source': 'grm', 'knn_k': 10, 'weighted_edges': False, 'symmetrize_mode': 'mutual', 'use_snp_selection': False}. Best is trial 32 with value: 0.058217567068497234.
[I 2025-11-03 12:25:26,292] Trial 91 finished with value: 0.004564765390552483 and parameters: {'model_type': 'gcn', 'hidden_dims': '[256, 128, 64]', 'dropout': 0.11931505413170049, 'batch_norm': True, 'lr': 0.00010054261571859963, 'weight_decay': 0.0005329291102282268, 'epochs': 227, 'loss': 'mse', 'optimizer': 'adam', 'graph_mode': 'knn', 'source': 'grm', 'knn_k': 10, 'weighted_edges': False, 'symmetrize_mode': 'mutual', 'use_snp_selection': False}. Best is trial 32 with value: 0.058217567068497234.
[I 2025-11-03 12:25:28,530] Trial 92 finished with value: 0.021715919180734965 and parameters: {'model_type': 'gcn', 'hidden_dims': '[256, 128, 64]', 'dropout': 0.14140772069780383, 'batch_norm': True, 'lr': 4.6790772053020884e-05, 'weight_decay': 0.0007670067105799219, 'epochs': 198, 'loss': 'mse', 'optimizer': 'adam', 'graph_mode': 'knn', 'source': 'grm', 'knn_k': 9, 'weighted_edges': False, 'symmetrize_mode': 'mutual', 'use_snp_selection': False}. Best is trial 32 with value: 0.058217567068497234.
[I 2025-11-03 12:25:30,858] Trial 93 finished with value: -0.024758466317818636 and parameters: {'model_type': 'gcn', 'hidden_dims': '[256, 128, 64]', 'dropout': 0.1255507091304608, 'batch_norm': True, 'lr': 7.079530389962799e-05, 'weight_decay': 0.0007019222281581904, 'epochs': 216, 'loss': 'mse', 'optimizer': 'adam', 'graph_mode': 'knn', 'source': 'grm', 'knn_k': 8, 'weighted_edges': False, 'symmetrize_mode': 'mutual', 'use_snp_selection': False}. Best is trial 32 with value: 0.058217567068497234.
[I 2025-11-03 12:25:33,163] Trial 94 finished with value: 0.03321077098742889 and parameters: {'model_type': 'gcn', 'hidden_dims': '[256, 128, 64]', 'dropout': 0.10048332380905659, 'batch_norm': True, 'lr': 0.00013990006558406022, 'weight_decay': 1.636644398436345e-06, 'epochs': 211, 'loss': 'mse', 'optimizer': 'adam', 'graph_mode': 'knn', 'source': 'grm', 'knn_k': 9, 'weighted_edges': False, 'symmetrize_mode': 'mutual', 'use_snp_selection': False}. Best is trial 32 with value: 0.058217567068497234.
