[I 2025-11-13 22:18:36,740] Trial 115 finished with value: 0.27503273292970903 and parameters: {'model_type': 'graphsage', 'hidden_dims': '[128, 64]', 'dropout': 0.5832720095955721, 'batch_norm': True, 'lr': 0.0006218151590335558, 'weight_decay': 1.265912515376064e-07, 'epochs': 61, 'loss': 'mse', 'optimizer': 'adam', 'graph_mode': 'cutoff', 'cutoff': 0.4527295928517759, 'grm_norm': 'none', 'self_loops': False, 'use_snp_selection': False}. Best is trial 61 with value: 0.28362455932970543.
[I 2025-11-13 22:19:16,087] Trial 116 finished with value: 0.26496843210219867 and parameters: {'model_type': 'graphsage', 'hidden_dims': '[256, 128]', 'dropout': 0.5978384812094829, 'batch_norm': True, 'lr': 0.0003155867426922024, 'weight_decay': 1.2854876137788318e-07, 'epochs': 54, 'loss': 'mse', 'optimizer': 'adam', 'graph_mode': 'cutoff', 'cutoff': 0.47527651101294954, 'grm_norm': 'none', 'self_loops': False, 'use_snp_selection': False}. Best is trial 61 with value: 0.28362455932970543.
[I 2025-11-13 22:20:14,750] Trial 117 finished with value: 0.2674958205941254 and parameters: {'model_type': 'graphsage', 'hidden_dims': '[128, 64]', 'dropout': 0.5799665951300093, 'batch_norm': True, 'lr': 0.0004562826062271481, 'weight_decay': 1.6078531030842133e-07, 'epochs': 148, 'loss': 'mse', 'optimizer': 'adam', 'graph_mode': 'cutoff', 'cutoff': 0.4467931860393293, 'grm_norm': 'none', 'self_loops': False, 'use_snp_selection': False}. Best is trial 61 with value: 0.28362455932970543.
[I 2025-11-13 22:20:55,372] Trial 118 finished with value: 0.26366860787470486 and parameters: {'model_type': 'graphsage', 'hidden_dims': '[128, 64]', 'dropout': 0.5860514632910344, 'batch_norm': True, 'lr': 0.0005889632211568336, 'weight_decay': 2.0007332670655527e-07, 'epochs': 83, 'loss': 'mse', 'optimizer': 'adam', 'graph_mode': 'cutoff', 'cutoff': 0.3966580679956636, 'grm_norm': 'cosine_then_gcn', 'self_loops': False, 'use_snp_selection': False}. Best is trial 61 with value: 0.28362455932970543.
[I 2025-11-13 22:22:01,732] Trial 119 finished with value: 0.260931164805152 and parameters: {'model_type': 'graphsage', 'hidden_dims': '[256, 128, 64]', 'dropout': 0.5664834572025158, 'batch_norm': True, 'lr': 0.00026956899694869724, 'weight_decay': 3.357924879776996e-07, 'epochs': 113, 'loss': 'mse', 'optimizer': 'adam', 'graph_mode': 'cutoff', 'cutoff': 0.4569082351483964, 'grm_norm': 'none', 'self_loops': False, 'use_snp_selection': False}. Best is trial 61 with value: 0.28362455932970543.
[I 2025-11-13 22:22:47,020] Trial 120 finished with value: 0.2870897643578651 and parameters: {'model_type': 'graphsage', 'hidden_dims': '[128, 64]', 'dropout': 0.5995702737691805, 'batch_norm': True, 'lr': 0.0008493819364299599, 'weight_decay': 1.2965918604810226e-07, 'epochs': 91, 'loss': 'mae', 'optimizer': 'adam', 'graph_mode': 'cutoff', 'cutoff': 0.3381004163427109, 'grm_norm': 'none', 'self_loops': False, 'use_snp_selection': False}. Best is trial 120 with value: 0.2870897643578651.
[I 2025-11-13 22:24:10,861] Trial 121 finished with value: 0.26851607556826546 and parameters: {'model_type': 'graphsage', 'hidden_dims': '[128, 64]', 'dropout': 0.59947364513116, 'batch_norm': True, 'lr': 0.00083633295159041, 'weight_decay': 1.0481918867071628e-07, 'epochs': 200, 'loss': 'mae', 'optimizer': 'adam', 'graph_mode': 'cutoff', 'cutoff': 0.3403804890856443, 'grm_norm': 'none', 'self_loops': False, 'use_snp_selection': False}. Best is trial 120 with value: 0.2870897643578651.
[I 2025-11-13 22:24:57,340] Trial 122 finished with value: 0.2793987298860374 and parameters: {'model_type': 'graphsage', 'hidden_dims': '[128, 64]', 'dropout': 0.5801149264684865, 'batch_norm': True, 'lr': 0.0006062870833855973, 'weight_decay': 1.338951832761429e-07, 'epochs': 89, 'loss': 'mae', 'optimizer': 'adam', 'graph_mode': 'cutoff', 'cutoff': 0.3197123425707028, 'grm_norm': 'none', 'self_loops': False, 'use_snp_selection': False}. Best is trial 120 with value: 0.2870897643578651.
[I 2025-11-13 22:25:57,247] Trial 123 finished with value: 0.2750422037007726 and parameters: {'model_type': 'graphsage', 'hidden_dims': '[128, 64]', 'dropout': 0.5759455989604586, 'batch_norm': True, 'lr': 0.0006269891134136253, 'weight_decay': 1.4307222061477352e-07, 'epochs': 124, 'loss': 'mae', 'optimizer': 'adam', 'graph_mode': 'cutoff', 'cutoff': 0.31809690266333607, 'grm_norm': 'none', 'self_loops': False, 'use_snp_selection': False}. Best is trial 120 with value: 0.2870897643578651.
[I 2025-11-13 22:26:59,286] Trial 124 finished with value: 0.27509053566817826 and parameters: {'model_type': 'graphsage', 'hidden_dims': '[128, 64]', 'dropout': 0.5773224807523188, 'batch_norm': True, 'lr': 0.0006732234785300419, 'weight_decay': 1.4052832747337764e-07, 'epochs': 128, 'loss': 'mae', 'optimizer': 'adam', 'graph_mode': 'cutoff', 'cutoff': 0.31553776306877324, 'grm_norm': 'none', 'self_loops': False, 'use_snp_selection': False}. Best is trial 120 with value: 0.2870897643578651.
[I 2025-11-13 22:28:00,645] Trial 125 finished with value: 0.2707036789628738 and parameters: {'model_type': 'graphsage', 'hidden_dims': '[128, 64]', 'dropout': 0.5823341465148469, 'batch_norm': True, 'lr': 0.000873655708293463, 'weight_decay': 1.252145253855433e-07, 'epochs': 125, 'loss': 'mae', 'optimizer': 'adam', 'graph_mode': 'cutoff', 'cutoff': 0.3129290727756562, 'grm_norm': 'none', 'self_loops': False, 'use_snp_selection': False}. Best is trial 120 with value: 0.2870897643578651.
[I 2025-11-13 22:29:00,348] Trial 126 finished with value: 0.2846326358923786 and parameters: {'model_type': 'graphsage', 'hidden_dims': '[128, 64]', 'dropout': 0.5778286040884347, 'batch_norm': True, 'lr': 0.0008119184241795834, 'weight_decay': 1.3702215212766323e-07, 'epochs': 123, 'loss': 'mae', 'optimizer': 'adam', 'graph_mode': 'cutoff', 'cutoff': 0.3172119348153637, 'grm_norm': 'none', 'self_loops': False, 'use_snp_selection': False}. Best is trial 120 with value: 0.2870897643578651.
[I 2025-11-13 22:30:03,357] Trial 127 finished with value: 0.28650805599751533 and parameters: {'model_type': 'graphsage', 'hidden_dims': '[128, 64]', 'dropout': 0.5751437536091684, 'batch_norm': True, 'lr': 0.0008597659758526218, 'weight_decay': 1.378631043642839e-07, 'epochs': 136, 'loss': 'mae', 'optimizer': 'adam', 'graph_mode': 'cutoff', 'cutoff': 0.3270145363397125, 'grm_norm': 'none', 'self_loops': False, 'use_snp_selection': False}. Best is trial 120 with value: 0.2870897643578651.
[I 2025-11-13 22:31:43,447] Trial 128 finished with value: 0.0 and parameters: {'model_type': 'graphsage', 'hidden_dims': '[128, 64]', 'dropout': 0.5768399373637101, 'batch_norm': False, 'lr': 0.0007493138038133741, 'weight_decay': 1.3819753286448566e-07, 'epochs': 140, 'loss': 'mae', 'optimizer': 'adam', 'graph_mode': 'cutoff', 'cutoff': 0.33796005836367615, 'grm_norm': 'none', 'self_loops': False, 'use_snp_selection': True, 'num_snps': 36528}. Best is trial 120 with value: 0.2870897643578651.
[I 2025-11-13 22:32:41,656] Trial 129 finished with value: 0.2773235854688686 and parameters: {'model_type': 'graphsage', 'hidden_dims': '[128, 64]', 'dropout': 0.5704021457094814, 'batch_norm': True, 'lr': 0.0006769125748736788, 'weight_decay': 1.0411934782715563e-07, 'epochs': 121, 'loss': 'mae', 'optimizer': 'adam', 'graph_mode': 'cutoff', 'cutoff': 0.3207228252183769, 'grm_norm': 'none', 'self_loops': True, 'use_snp_selection': False}. Best is trial 120 with value: 0.2870897643578651.
[I 2025-11-13 22:34:43,138] Trial 130 finished with value: 0.25715516288936846 and parameters: {'model_type': 'graphsage', 'hidden_dims': '[512, 64]', 'dropout': 0.5705144638474909, 'batch_norm': True, 'lr': 0.0006591615582571807, 'weight_decay': 1.0061520765492656e-07, 'epochs': 130, 'loss': 'mae', 'optimizer': 'adam', 'graph_mode': 'knn', 'source': 'grm', 'knn_k': 3, 'weighted_edges': True, 'symmetrize_mode': 'union', 'use_snp_selection': False}. Best is trial 120 with value: 0.2870897643578651.
[I 2025-11-13 22:35:42,042] Trial 131 finished with value: 0.2805796325106868 and parameters: {'model_type': 'graphsage', 'hidden_dims': '[128, 64]', 'dropout': 0.5623289872600046, 'batch_norm': True, 'lr': 0.0005203785015559389, 'weight_decay': 1.382668006926496e-07, 'epochs': 120, 'loss': 'mae', 'optimizer': 'adam', 'graph_mode': 'cutoff', 'cutoff': 0.31570534118228455, 'grm_norm': 'none', 'self_loops': True, 'use_snp_selection': False}. Best is trial 120 with value: 0.2870897643578651.
[I 2025-11-13 22:36:46,354] Trial 132 finished with value: 0.2728721073932342 and parameters: {'model_type': 'graphsage', 'hidden_dims': '[128, 64]', 'dropout': 0.5623704598448498, 'batch_norm': True, 'lr': 0.0008347066168541465, 'weight_decay': 1.3678252482251868e-07, 'epochs': 121, 'loss': 'mae', 'optimizer': 'adam', 'graph_mode': 'cutoff', 'cutoff': 0.2926475715008614, 'grm_norm': 'none', 'self_loops': True, 'use_snp_selection': False}. Best is trial 120 with value: 0.2870897643578651.
[I 2025-11-13 22:37:42,871] Trial 133 finished with value: 0.2773518052311731 and parameters: {'model_type': 'graphsage', 'hidden_dims': '[128, 64]', 'dropout': 0.5453297738294013, 'batch_norm': True, 'lr': 0.0005033623322198417, 'weight_decay': 1.518295868317539e-07, 'epochs': 114, 'loss': 'mae', 'optimizer': 'adam', 'graph_mode': 'cutoff', 'cutoff': 0.31598775011977054, 'grm_norm': 'none', 'self_loops': True, 'use_snp_selection': False}. Best is trial 120 with value: 0.2870897643578651.
[I 2025-11-13 22:38:38,440] Trial 134 finished with value: 0.2761453468919043 and parameters: {'model_type': 'graphsage', 'hidden_dims': '[128, 64]', 'dropout': 0.5473810228147873, 'batch_norm': True, 'lr': 0.0004776392082262116, 'weight_decay': 1.2060455266162003e-07, 'epochs': 113, 'loss': 'mae', 'optimizer': 'adam', 'graph_mode': 'cutoff', 'cutoff': 0.3194486469891908, 'grm_norm': 'none', 'self_loops': True, 'use_snp_selection': False}. Best is trial 120 with value: 0.2870897643578651.
[I 2025-11-13 22:39:31,860] Trial 135 finished with value: 0.2706446466415123 and parameters: {'model_type': 'graphsage', 'hidden_dims': '[128, 64]', 'dropout': 0.5468007411331212, 'batch_norm': True, 'lr': 0.0005094114332787801, 'weight_decay': 1.1987089495196065e-07, 'epochs': 108, 'loss': 'mae', 'optimizer': 'adam', 'graph_mode': 'cutoff', 'cutoff': 0.3210305478650315, 'grm_norm': 'none', 'self_loops': True, 'use_snp_selection': False}. Best is trial 120 with value: 0.2870897643578651.
[I 2025-11-13 22:40:30,477] Trial 136 finished with value: 0.2721097411786213 and parameters: {'model_type': 'graphsage', 'hidden_dims': '[128, 64]', 'dropout': 0.5596566657756904, 'batch_norm': True, 'lr': 0.0004847385487381969, 'weight_decay': 1.5146624774560447e-07, 'epochs': 113, 'loss': 'mae', 'optimizer': 'adam', 'graph_mode': 'cutoff', 'cutoff': 0.3025975881841646, 'grm_norm': 'none', 'self_loops': True, 'use_snp_selection': False}. Best is trial 120 with value: 0.2870897643578651.
[I 2025-11-13 22:41:35,526] Trial 137 finished with value: 0.2857871016625534 and parameters: {'model_type': 'graphsage', 'hidden_dims': '[128, 64]', 'dropout': 0.5446749390549047, 'batch_norm': True, 'lr': 0.0006552571417309688, 'weight_decay': 1.1271972181823511e-07, 'epochs': 118, 'loss': 'mae', 'optimizer': 'adam', 'graph_mode': 'cutoff', 'cutoff': 0.2855201439511472, 'grm_norm': 'none', 'self_loops': True, 'use_snp_selection': False}. Best is trial 120 with value: 0.2870897643578651.
[I 2025-11-13 22:42:40,347] Trial 138 finished with value: 0.2764147089223944 and parameters: {'model_type': 'graphsage', 'hidden_dims': '[128, 64]', 'dropout': 0.1532271459825278, 'batch_norm': True, 'lr': 0.000647546628329408, 'weight_decay': 1.0147651740940936e-07, 'epochs': 119, 'loss': 'mae', 'optimizer': 'adam', 'graph_mode': 'cutoff', 'cutoff': 0.2877173733759854, 'grm_norm': 'none', 'self_loops': True, 'use_snp_selection': False}. Best is trial 120 with value: 0.2870897643578651.
[I 2025-11-13 22:43:55,784] Trial 139 finished with value: 0.26913200558195205 and parameters: {'model_type': 'graphsage', 'hidden_dims': '[128, 64]', 'dropout': 0.19583178872279192, 'batch_norm': True, 'lr': 0.0005282469379743679, 'weight_decay': 1.009694635426621e-07, 'epochs': 118, 'loss': 'mae', 'optimizer': 'adam', 'graph_mode': 'cutoff', 'cutoff': 0.2546772783587341, 'grm_norm': 'none', 'self_loops': True, 'use_snp_selection': False}. Best is trial 120 with value: 0.2870897643578651.
[I 2025-11-13 22:45:04,343] Trial 140 finished with value: 0.25266046452711743 and parameters: {'model_type': 'graphsage', 'hidden_dims': '[128, 64]', 'dropout': 0.14952474892512974, 'batch_norm': True, 'lr': 0.0007425718945214676, 'weight_decay': 1.6517426263720528e-07, 'epochs': 122, 'loss': 'mae', 'optimizer': 'adam', 'graph_mode': 'cutoff', 'cutoff': 0.279930905308001, 'grm_norm': 'none', 'self_loops': True, 'use_snp_selection': False}. Best is trial 120 with value: 0.2870897643578651.
[I 2025-11-13 22:45:58,982] Trial 141 finished with value: 0.2546271143306205 and parameters: {'model_type': 'graphsage', 'hidden_dims': '[128, 64]', 'dropout': 0.2873037192185332, 'batch_norm': True, 'lr': 0.0006051729925496832, 'weight_decay': 1.257498586426456e-07, 'epochs': 107, 'loss': 'mae', 'optimizer': 'adam', 'graph_mode': 'cutoff', 'cutoff': 0.3110969895646517, 'grm_norm': 'none', 'self_loops': True, 'use_snp_selection': False}. Best is trial 120 with value: 0.2870897643578651.
[I 2025-11-13 22:47:03,015] Trial 142 finished with value: 0.2704936799083814 and parameters: {'model_type': 'graphsage', 'hidden_dims': '[128, 64]', 'dropout': 0.5863502491706689, 'batch_norm': True, 'lr': 0.000669963320336579, 'weight_decay': 1.1815741503180266e-07, 'epochs': 116, 'loss': 'mae', 'optimizer': 'adam', 'graph_mode': 'cutoff', 'cutoff': 0.2869408814528798, 'grm_norm': 'none', 'self_loops': True, 'use_snp_selection': False}. Best is trial 120 with value: 0.2870897643578651.
[I 2025-11-13 22:47:53,099] Trial 143 finished with value: 0.25590333009747523 and parameters: {'model_type': 'graphsage', 'hidden_dims': '[128, 64]', 'dropout': 0.5993601641402102, 'batch_norm': True, 'lr': 5.352246407641962e-05, 'weight_decay': 1.4251081128951967e-07, 'epochs': 99, 'loss': 'mae', 'optimizer': 'adam', 'graph_mode': 'cutoff', 'cutoff': 0.32276816550872856, 'grm_norm': 'none', 'self_loops': True, 'use_snp_selection': False}. Best is trial 120 with value: 0.2870897643578651.
[I 2025-11-13 22:48:56,320] Trial 144 finished with value: 0.269661625486073 and parameters: {'model_type': 'graphsage', 'hidden_dims': '[128, 64]', 'dropout': 0.5463055094946836, 'batch_norm': True, 'lr': 0.0004395076179116953, 'weight_decay': 1.0065269928032651e-07, 'epochs': 122, 'loss': 'mae', 'optimizer': 'adam', 'graph_mode': 'cutoff', 'cutoff': 0.2996746204730986, 'grm_norm': 'none', 'self_loops': True, 'use_snp_selection': False}. Best is trial 120 with value: 0.2870897643578651.
[I 2025-11-13 22:49:53,942] Trial 145 finished with value: 0.2545917051210663 and parameters: {'model_type': 'graphsage', 'hidden_dims': '[128, 64]', 'dropout': 0.37508532122433835, 'batch_norm': True, 'lr': 0.0009888931177919776, 'weight_decay': 1.5806336639176625e-07, 'epochs': 90, 'loss': 'mae', 'optimizer': 'adam', 'graph_mode': 'cutoff', 'cutoff': 0.2661069036151574, 'grm_norm': 'none', 'self_loops': True, 'use_snp_selection': False}. Best is trial 120 with value: 0.2870897643578651.
[I 2025-11-13 22:50:43,894] Trial 146 finished with value: 0.2696303926833573 and parameters: {'model_type': 'graphsage', 'hidden_dims': '[128, 64]', 'dropout': 0.585678078209716, 'batch_norm': True, 'lr': 0.0005374263733474838, 'weight_decay': 1.3294926675829353e-07, 'epochs': 105, 'loss': 'mae', 'optimizer': 'adam', 'graph_mode': 'cutoff', 'cutoff': 0.34437766830072264, 'grm_norm': 'none', 'self_loops': True, 'use_snp_selection': False}. Best is trial 120 with value: 0.2870897643578651.
[I 2025-11-13 22:51:38,567] Trial 147 finished with value: 0.12797700612814358 and parameters: {'model_type': 'graphsage', 'hidden_dims': '[128, 64]', 'dropout': 0.5614609357168339, 'batch_norm': True, 'lr': 1.4434464889626162e-06, 'weight_decay': 1.7179693046232837e-07, 'epochs': 115, 'loss': 'mae', 'optimizer': 'adam', 'graph_mode': 'cutoff', 'cutoff': 0.3333219472734847, 'grm_norm': 'none', 'self_loops': True, 'use_snp_selection': False}. Best is trial 120 with value: 0.2870897643578651.
[I 2025-11-13 22:52:28,771] Trial 148 finished with value: 0.27619483303458797 and parameters: {'model_type': 'graphsage', 'hidden_dims': '[128, 64]', 'dropout': 0.5505876028283215, 'batch_norm': True, 'lr': 0.0006599170516122054, 'weight_decay': 1.198701137019207e-07, 'epochs': 98, 'loss': 'mae', 'optimizer': 'adam', 'graph_mode': 'cutoff', 'cutoff': 0.3188091854880847, 'grm_norm': 'none', 'self_loops': True, 'use_snp_selection': False}. Best is trial 120 with value: 0.2870897643578651.
[I 2025-11-13 22:53:18,169] Trial 149 finished with value: 0.2705575809896031 and parameters: {'model_type': 'graphsage', 'hidden_dims': '[128, 64]', 'dropout': 0.2473741386554298, 'batch_norm': True, 'lr': 0.0007607356186472117, 'weight_decay': 2.6318472887092955e-07, 'epochs': 95, 'loss': 'mae', 'optimizer': 'adam', 'graph_mode': 'cutoff', 'cutoff': 0.3163195173845994, 'grm_norm': 'none', 'self_loops': True, 'use_snp_selection': False}. Best is trial 120 with value: 0.2870897643578651.
