[I 2025-11-03 13:19:25,328] Trial 44 finished with value: 0.08453801948267267 and parameters: {'model_type': 'gcn', 'hidden_dims': '[256, 128, 64]', 'dropout': 0.22314423677752834, 'batch_norm': True, 'lr': 0.0005718295754267274, 'weight_decay': 6.46195120851612e-06, 'epochs': 189, 'loss': 'mse', 'optimizer': 'adam', 'graph_mode': 'off', 'use_snp_selection': False}. Best is trial 15 with value: 0.10803986111032476.
[I 2025-11-03 13:19:27,244] Trial 45 finished with value: 0.08441754309228323 and parameters: {'model_type': 'gcn', 'hidden_dims': '[512, 64]', 'dropout': 0.4040741554249228, 'batch_norm': True, 'lr': 0.0002762315031174389, 'weight_decay': 1.896569430940331e-05, 'epochs': 285, 'loss': 'mae', 'optimizer': 'adam', 'graph_mode': 'off', 'use_snp_selection': False}. Best is trial 15 with value: 0.10803986111032476.
[I 2025-11-03 13:19:28,799] Trial 46 finished with value: 0.09360660229625832 and parameters: {'model_type': 'gcn', 'hidden_dims': '[256, 128]', 'dropout': 0.310817841542043, 'batch_norm': True, 'lr': 0.0009850359330911445, 'weight_decay': 3.7287980956899818e-06, 'epochs': 313, 'loss': 'mae', 'optimizer': 'adam', 'graph_mode': 'off', 'use_snp_selection': False}. Best is trial 15 with value: 0.10803986111032476.
[I 2025-11-03 13:19:30,041] Trial 47 finished with value: 0.024146555930757884 and parameters: {'model_type': 'gcn', 'hidden_dims': '[512, 128]', 'dropout': 0.3438941316335527, 'batch_norm': False, 'lr': 0.0004573525188203457, 'weight_decay': 1.0831844361904851e-05, 'epochs': 123, 'loss': 'mae', 'optimizer': 'adam', 'graph_mode': 'off', 'use_snp_selection': False}. Best is trial 15 with value: 0.10803986111032476.
[I 2025-11-03 13:19:31,201] Trial 48 finished with value: 0.10631723994686378 and parameters: {'model_type': 'gcn', 'hidden_dims': '[128, 64]', 'dropout': 0.23766354733964734, 'batch_norm': True, 'lr': 0.0007010997392089107, 'weight_decay': 0.00017204812733387926, 'epochs': 264, 'loss': 'mse', 'optimizer': 'adam', 'graph_mode': 'off', 'use_snp_selection': False}. Best is trial 15 with value: 0.10803986111032476.
[I 2025-11-03 13:19:33,023] Trial 49 finished with value: 0.09097356882831564 and parameters: {'model_type': 'gcn', 'hidden_dims': '[128, 64]', 'dropout': 0.12995355960276653, 'batch_norm': True, 'lr': 0.00024379906269713698, 'weight_decay': 0.0003623732576377006, 'epochs': 263, 'loss': 'mse', 'optimizer': 'adam', 'graph_mode': 'off', 'use_snp_selection': True, 'num_snps': 46888}. Best is trial 15 with value: 0.10803986111032476.
[I 2025-11-03 13:19:34,142] Trial 50 finished with value: 0.08770165632508489 and parameters: {'model_type': 'gcn', 'hidden_dims': '[128, 64]', 'dropout': 0.23584024304386986, 'batch_norm': True, 'lr': 9.177914514808617e-05, 'weight_decay': 0.00017266700082227765, 'epochs': 249, 'loss': 'mse', 'optimizer': 'adam', 'graph_mode': 'off', 'use_snp_selection': False}. Best is trial 15 with value: 0.10803986111032476.
[I 2025-11-03 13:19:35,337] Trial 51 finished with value: 0.10433772183172998 and parameters: {'model_type': 'gcn', 'hidden_dims': '[128, 64]', 'dropout': 0.2707935818936041, 'batch_norm': True, 'lr': 0.0007155279290877274, 'weight_decay': 8.546601173200302e-05, 'epochs': 278, 'loss': 'mse', 'optimizer': 'adam', 'graph_mode': 'off', 'use_snp_selection': False}. Best is trial 15 with value: 0.10803986111032476.
[I 2025-11-03 13:19:36,526] Trial 52 finished with value: 0.10079767441406114 and parameters: {'model_type': 'gcn', 'hidden_dims': '[128, 64]', 'dropout': 0.26728608515029306, 'batch_norm': True, 'lr': 0.0006890348852005844, 'weight_decay': 0.000269795189524939, 'epochs': 274, 'loss': 'mse', 'optimizer': 'adam', 'graph_mode': 'off', 'use_snp_selection': False}. Best is trial 15 with value: 0.10803986111032476.
[I 2025-11-03 13:19:37,604] Trial 53 finished with value: 0.12218763160211579 and parameters: {'model_type': 'gcn', 'hidden_dims': '[128, 64]', 'dropout': 0.19942362661665355, 'batch_norm': True, 'lr': 0.00039678726338539857, 'weight_decay': 8.909650376171736e-05, 'epochs': 226, 'loss': 'mse', 'optimizer': 'adam', 'graph_mode': 'off', 'use_snp_selection': False}. Best is trial 53 with value: 0.12218763160211579.
[I 2025-11-03 13:19:38,743] Trial 54 finished with value: 0.08491481523329471 and parameters: {'model_type': 'gcn', 'hidden_dims': '[128, 64]', 'dropout': 0.24011821393890276, 'batch_norm': True, 'lr': 0.0003797739396179456, 'weight_decay': 7.802761796675127e-05, 'epochs': 243, 'loss': 'mse', 'optimizer': 'adam', 'graph_mode': 'off', 'use_snp_selection': False}. Best is trial 53 with value: 0.12218763160211579.
[I 2025-11-03 13:19:39,350] Trial 55 finished with value: 0.09893697162902296 and parameters: {'model_type': 'gcn', 'hidden_dims': '[128, 64]', 'dropout': 0.17551002756311238, 'batch_norm': True, 'lr': 0.0007352481949197342, 'weight_decay': 4.716791317377091e-05, 'epochs': 42, 'loss': 'mse', 'optimizer': 'adam', 'graph_mode': 'off', 'use_snp_selection': False}. Best is trial 53 with value: 0.12218763160211579.
[I 2025-11-03 13:19:40,341] Trial 56 finished with value: 0.08718445185997495 and parameters: {'model_type': 'gcn', 'hidden_dims': '[128, 64]', 'dropout': 0.449810222978798, 'batch_norm': True, 'lr': 0.0007349233484474776, 'weight_decay': 2.7773658871131034e-05, 'epochs': 200, 'loss': 'mse', 'optimizer': 'adam', 'graph_mode': 'off', 'use_snp_selection': False}. Best is trial 53 with value: 0.12218763160211579.
[I 2025-11-03 13:19:41,612] Trial 57 finished with value: 0.09834144242794039 and parameters: {'model_type': 'gcn', 'hidden_dims': '[128, 64]', 'dropout': 0.18673230078778838, 'batch_norm': True, 'lr': 0.0004177498224701884, 'weight_decay': 8.020124328860514e-05, 'epochs': 297, 'loss': 'mse', 'optimizer': 'adam', 'graph_mode': 'off', 'use_snp_selection': False}. Best is trial 53 with value: 0.12218763160211579.
[I 2025-11-03 13:19:42,747] Trial 58 finished with value: 0.04932248755708655 and parameters: {'model_type': 'gcn', 'hidden_dims': '[128, 64]', 'dropout': 0.2769413534316332, 'batch_norm': False, 'lr': 0.00023142612925215156, 'weight_decay': 0.00010873361868807651, 'epochs': 274, 'loss': 'mse', 'optimizer': 'adam', 'graph_mode': 'off', 'use_snp_selection': False}. Best is trial 53 with value: 0.12218763160211579.
[I 2025-11-03 13:19:43,954] Trial 59 finished with value: 0.08687575146365639 and parameters: {'model_type': 'gcn', 'hidden_dims': '[128, 64]', 'dropout': 0.2144135307442835, 'batch_norm': True, 'lr': 0.00018638228264579774, 'weight_decay': 0.00016047411118735608, 'epochs': 284, 'loss': 'mse', 'optimizer': 'adam', 'graph_mode': 'off', 'use_snp_selection': False}. Best is trial 53 with value: 0.12218763160211579.
[I 2025-11-03 13:19:45,119] Trial 60 finished with value: 0.09797172111253852 and parameters: {'model_type': 'gcn', 'hidden_dims': '[128, 64]', 'dropout': 0.33026750787099546, 'batch_norm': True, 'lr': 0.000590768845867559, 'weight_decay': 4.571297902440803e-05, 'epochs': 264, 'loss': 'mse', 'optimizer': 'adam', 'graph_mode': 'off', 'use_snp_selection': False}. Best is trial 53 with value: 0.12218763160211579.
[I 2025-11-03 13:19:46,863] Trial 61 finished with value: 0.09762116403605951 and parameters: {'model_type': 'gcn', 'hidden_dims': '[512, 128]', 'dropout': 0.21299758204317404, 'batch_norm': True, 'lr': 0.000537334014597829, 'weight_decay': 0.00014183767178243642, 'epochs': 238, 'loss': 'mse', 'optimizer': 'adam', 'graph_mode': 'off', 'use_snp_selection': False}. Best is trial 53 with value: 0.12218763160211579.
[I 2025-11-03 13:19:48,503] Trial 62 finished with value: 0.10315016641169368 and parameters: {'model_type': 'gcn', 'hidden_dims': '[512, 128]', 'dropout': 0.1957964933894089, 'batch_norm': True, 'lr': 0.00033685057014304625, 'weight_decay': 0.00033481470480163194, 'epochs': 220, 'loss': 'mse', 'optimizer': 'adam', 'graph_mode': 'off', 'use_snp_selection': False}. Best is trial 53 with value: 0.12218763160211579.
[I 2025-11-03 13:19:49,536] Trial 63 finished with value: 0.0925598056808716 and parameters: {'model_type': 'gcn', 'hidden_dims': '[128, 64]', 'dropout': 0.1579660106165656, 'batch_norm': True, 'lr': 0.000820033917877245, 'weight_decay': 0.0002284703371704589, 'epochs': 202, 'loss': 'mse', 'optimizer': 'adam', 'graph_mode': 'off', 'use_snp_selection': False}. Best is trial 53 with value: 0.12218763160211579.
[I 2025-11-03 13:19:51,290] Trial 64 finished with value: 0.10286240481198944 and parameters: {'model_type': 'gcn', 'hidden_dims': '[512, 256]', 'dropout': 0.24692453532653208, 'batch_norm': True, 'lr': 0.000526509716785972, 'weight_decay': 6.471396843893003e-05, 'epochs': 249, 'loss': 'mse', 'optimizer': 'adam', 'graph_mode': 'off', 'use_snp_selection': False}. Best is trial 53 with value: 0.12218763160211579.
[I 2025-11-03 13:19:52,963] Trial 65 finished with value: 0.09733630322402813 and parameters: {'model_type': 'gcn', 'hidden_dims': '[512, 128]', 'dropout': 0.23064506795543163, 'batch_norm': True, 'lr': 0.0002812364907388015, 'weight_decay': 0.000601132344097291, 'epochs': 226, 'loss': 'mse', 'optimizer': 'adam', 'graph_mode': 'off', 'use_snp_selection': False}. Best is trial 53 with value: 0.12218763160211579.
[I 2025-11-03 13:19:54,628] Trial 66 finished with value: 0.08370545200352521 and parameters: {'model_type': 'gcn', 'hidden_dims': '[512, 64]', 'dropout': 0.2801369399903323, 'batch_norm': True, 'lr': 0.0004475263960798751, 'weight_decay': 0.00011958282736843426, 'epochs': 304, 'loss': 'mae', 'optimizer': 'adam', 'graph_mode': 'off', 'use_snp_selection': True, 'num_snps': 22881}. Best is trial 53 with value: 0.12218763160211579.
[I 2025-11-03 13:19:55,530] Trial 67 finished with value: -0.014915331583877221 and parameters: {'model_type': 'gcn', 'hidden_dims': '[128, 64]', 'dropout': 0.20418053609466358, 'batch_norm': True, 'lr': 1.0387880921401811e-06, 'weight_decay': 8.575292974648644e-05, 'epochs': 165, 'loss': 'mae', 'optimizer': 'adam', 'graph_mode': 'off', 'use_snp_selection': False}. Best is trial 53 with value: 0.12218763160211579.
[I 2025-11-03 13:19:57,032] Trial 68 finished with value: 0.0805857496678205 and parameters: {'model_type': 'gcn', 'hidden_dims': '[512, 128]', 'dropout': 0.5297900142307244, 'batch_norm': True, 'lr': 0.0007860485826206033, 'weight_decay': 3.86049038170538e-05, 'epochs': 189, 'loss': 'mse', 'optimizer': 'adam', 'graph_mode': 'off', 'use_snp_selection': False}. Best is trial 53 with value: 0.12218763160211579.
[I 2025-11-03 13:19:58,525] Trial 69 finished with value: 0.05021426191194472 and parameters: {'model_type': 'gcn', 'hidden_dims': '[256, 128]', 'dropout': 0.15263109196352656, 'batch_norm': False, 'lr': 0.0006566326950930418, 'weight_decay': 0.00027530732793832046, 'epochs': 324, 'loss': 'mae', 'optimizer': 'adam', 'graph_mode': 'off', 'use_snp_selection': False}. Best is trial 53 with value: 0.12218763160211579.
[I 2025-11-03 13:19:59,620] Trial 70 finished with value: 0.09646252468716211 and parameters: {'model_type': 'gcn', 'hidden_dims': '[128, 64]', 'dropout': 0.4864266154673461, 'batch_norm': True, 'lr': 0.0003822585889589598, 'weight_decay': 2.418524659861847e-05, 'epochs': 235, 'loss': 'mae', 'optimizer': 'adam', 'graph_mode': 'off', 'use_snp_selection': False}. Best is trial 53 with value: 0.12218763160211579.
[I 2025-11-03 13:20:01,329] Trial 71 finished with value: 0.10908132192175042 and parameters: {'model_type': 'gcn', 'hidden_dims': '[256, 128, 64]', 'dropout': 0.30703243580737954, 'batch_norm': True, 'lr': 0.0009061084166438734, 'weight_decay': 1.5075691722926978e-05, 'epochs': 293, 'loss': 'mae', 'optimizer': 'adam', 'graph_mode': 'off', 'use_snp_selection': False}. Best is trial 53 with value: 0.12218763160211579.
[I 2025-11-03 13:20:03,128] Trial 72 finished with value: 0.09146194505977323 and parameters: {'model_type': 'gcn', 'hidden_dims': '[512, 128]', 'dropout': 0.3125005557781503, 'batch_norm': True, 'lr': 0.0009803342328680925, 'weight_decay': 1.6880573675724662e-05, 'epochs': 256, 'loss': 'mae', 'optimizer': 'adam', 'graph_mode': 'off', 'use_snp_selection': False}. Best is trial 53 with value: 0.12218763160211579.
[I 2025-11-03 13:20:04,818] Trial 73 finished with value: 0.09774445331234088 and parameters: {'model_type': 'gcn', 'hidden_dims': '[256, 128, 64]', 'dropout': 0.25443223338819265, 'batch_norm': True, 'lr': 0.0005154419030099924, 'weight_decay': 5.0061714626008604e-05, 'epochs': 290, 'loss': 'mae', 'optimizer': 'adam', 'graph_mode': 'off', 'use_snp_selection': False}. Best is trial 53 with value: 0.12218763160211579.
[I 2025-11-03 13:20:06,002] Trial 74 finished with value: 0.11299541850723993 and parameters: {'model_type': 'gcn', 'hidden_dims': '[128, 64]', 'dropout': 0.29435311164025213, 'batch_norm': True, 'lr': 0.0006165999991869945, 'weight_decay': 3.243650360052038e-05, 'epochs': 277, 'loss': 'mae', 'optimizer': 'adam', 'graph_mode': 'off', 'use_snp_selection': False}. Best is trial 53 with value: 0.12218763160211579.
[I 2025-11-03 13:20:07,173] Trial 75 finished with value: 0.10147690399539319 and parameters: {'model_type': 'gcn', 'hidden_dims': '[128, 64]', 'dropout': 0.3288710839173965, 'batch_norm': True, 'lr': 0.0008011496011665337, 'weight_decay': 1.2845157603694269e-05, 'epochs': 266, 'loss': 'mae', 'optimizer': 'adam', 'graph_mode': 'off', 'use_snp_selection': False}. Best is trial 53 with value: 0.12218763160211579.
[I 2025-11-03 13:20:08,502] Trial 76 finished with value: 0.08774909625652004 and parameters: {'model_type': 'gcn', 'hidden_dims': '[128, 64]', 'dropout': 0.3625081738213042, 'batch_norm': True, 'lr': 0.0006360220537382787, 'weight_decay': 3.086642253597269e-05, 'epochs': 281, 'loss': 'mae', 'optimizer': 'adam', 'graph_mode': 'off', 'use_snp_selection': False}. Best is trial 53 with value: 0.12218763160211579.
[I 2025-11-03 13:20:09,776] Trial 77 finished with value: 0.044033446509078096 and parameters: {'model_type': 'gcn', 'hidden_dims': '[128, 64]', 'dropout': 0.2858866922339401, 'batch_norm': True, 'lr': 9.03570102470964e-06, 'weight_decay': 1.8581365101099293e-05, 'epochs': 304, 'loss': 'mae', 'optimizer': 'adam', 'graph_mode': 'off', 'use_snp_selection': False}. Best is trial 53 with value: 0.12218763160211579.
[I 2025-11-03 13:20:10,859] Trial 78 finished with value: 0.059833279948930285 and parameters: {'model_type': 'gcn', 'hidden_dims': '[128, 64]', 'dropout': 0.2718858282974319, 'batch_norm': True, 'lr': 0.0003089454584149029, 'weight_decay': 6.092435239166576e-06, 'epochs': 293, 'loss': 'mae', 'optimizer': 'adam', 'graph_mode': 'off', 'use_snp_selection': True, 'num_snps': 2246}. Best is trial 53 with value: 0.12218763160211579.
[I 2025-11-03 13:20:12,729] Trial 79 finished with value: 0.09091345829238132 and parameters: {'model_type': 'gcn', 'hidden_dims': '[512, 256]', 'dropout': 0.30098569048073714, 'batch_norm': True, 'lr': 4.7398986786285675e-05, 'weight_decay': 7.019596510491312e-05, 'epochs': 277, 'loss': 'mse', 'optimizer': 'adam', 'graph_mode': 'off', 'use_snp_selection': False}. Best is trial 53 with value: 0.12218763160211579.
[I 2025-11-03 13:20:14,291] Trial 80 finished with value: 0.08343384060523135 and parameters: {'model_type': 'gcn', 'hidden_dims': '[256, 128, 64]', 'dropout': 0.31800142433527795, 'batch_norm': True, 'lr': 0.000848352185620244, 'weight_decay': 3.716119590956696e-05, 'epochs': 248, 'loss': 'mae', 'optimizer': 'adam', 'graph_mode': 'off', 'use_snp_selection': False}. Best is trial 53 with value: 0.12218763160211579.
[I 2025-11-03 13:20:15,921] Trial 81 finished with value: 0.08780200280806466 and parameters: {'model_type': 'gcn', 'hidden_dims': '[512, 128]', 'dropout': 0.22275621641907156, 'batch_norm': True, 'lr': 0.00046251763151829617, 'weight_decay': 0.00010343294817067451, 'epochs': 218, 'loss': 'mae', 'optimizer': 'adam', 'graph_mode': 'off', 'use_snp_selection': False}. Best is trial 53 with value: 0.12218763160211579.
[I 2025-11-03 13:20:18,065] Trial 82 finished with value: 0.10227712559206024 and parameters: {'model_type': 'gcn', 'hidden_dims': '[512, 64]', 'dropout': 0.24188533658063505, 'batch_norm': True, 'lr': 0.0005709163648886891, 'weight_decay': 2.2971014983016242e-05, 'epochs': 337, 'loss': 'mae', 'optimizer': 'adam', 'graph_mode': 'off', 'use_snp_selection': False}. Best is trial 53 with value: 0.12218763160211579.
[I 2025-11-03 13:20:20,177] Trial 83 finished with value: 0.09765966704995867 and parameters: {'model_type': 'gcn', 'hidden_dims': '[512, 128]', 'dropout': 0.25513333312046804, 'batch_norm': True, 'lr': 0.000681307162442945, 'weight_decay': 0.0001483045234005776, 'epochs': 322, 'loss': 'mae', 'optimizer': 'adam', 'graph_mode': 'off', 'use_snp_selection': False}. Best is trial 53 with value: 0.12218763160211579.
[I 2025-11-03 13:20:21,332] Trial 84 finished with value: 0.07655486380818907 and parameters: {'model_type': 'gcn', 'hidden_dims': '[128, 64]', 'dropout': 0.38904593665457465, 'batch_norm': True, 'lr': 0.00039108294340830683, 'weight_decay': 5.047247894244306e-05, 'epochs': 259, 'loss': 'mae', 'optimizer': 'adam', 'graph_mode': 'off', 'use_snp_selection': False}. Best is trial 53 with value: 0.12218763160211579.
[I 2025-11-03 13:20:22,701] Trial 85 finished with value: 0.0500329712934526 and parameters: {'model_type': 'gcn', 'hidden_dims': '[256, 128]', 'dropout': 0.2902818575683862, 'batch_norm': False, 'lr': 2.038482957118591e-05, 'weight_decay': 8.975819938491783e-05, 'epochs': 272, 'loss': 'mae', 'optimizer': 'adam', 'graph_mode': 'off', 'use_snp_selection': False}. Best is trial 53 with value: 0.12218763160211579.
[I 2025-11-03 13:20:23,775] Trial 86 finished with value: 0.1050576719478322 and parameters: {'model_type': 'gcn', 'hidden_dims': '[128, 64]', 'dropout': 0.18673120306421703, 'batch_norm': True, 'lr': 0.0008472895030010737, 'weight_decay': 0.00022237092742770655, 'epochs': 229, 'loss': 'mae', 'optimizer': 'adam', 'graph_mode': 'off', 'use_snp_selection': False}. Best is trial 53 with value: 0.12218763160211579.
[I 2025-11-03 13:20:25,119] Trial 87 finished with value: 0.08722696065012402 and parameters: {'model_type': 'gcn', 'hidden_dims': '[128, 64]', 'dropout': 0.18684396402322445, 'batch_norm': True, 'lr': 0.0008559237449975759, 'weight_decay': 0.00019304038016987215, 'epochs': 330, 'loss': 'mae', 'optimizer': 'adam', 'graph_mode': 'off', 'use_snp_selection': False}. Best is trial 53 with value: 0.12218763160211579.
[I 2025-11-03 13:20:26,151] Trial 88 finished with value: 0.08946026580047395 and parameters: {'model_type': 'gcn', 'hidden_dims': '[128, 64]', 'dropout': 0.5692276327074908, 'batch_norm': True, 'lr': 0.0006092540562301167, 'weight_decay': 0.00045388471975469453, 'epochs': 206, 'loss': 'mse', 'optimizer': 'adam', 'graph_mode': 'off', 'use_snp_selection': False}. Best is trial 53 with value: 0.12218763160211579.
[I 2025-11-03 13:20:27,449] Trial 89 finished with value: 0.10053902784101437 and parameters: {'model_type': 'gcn', 'hidden_dims': '[128, 64]', 'dropout': 0.11968477229677499, 'batch_norm': True, 'lr': 0.0009736852845581508, 'weight_decay': 6.362472969410916e-05, 'epochs': 76, 'loss': 'mae', 'optimizer': 'adam', 'graph_mode': 'off', 'use_snp_selection': True, 'num_snps': 45058}. Best is trial 53 with value: 0.12218763160211579.
[I 2025-11-03 13:20:28,571] Trial 90 finished with value: 0.09068714230361238 and parameters: {'model_type': 'gcn', 'hidden_dims': '[128, 64]', 'dropout': 0.3485412654568318, 'batch_norm': True, 'lr': 0.0007486487990726688, 'weight_decay': 0.00023023479573631154, 'epochs': 245, 'loss': 'mae', 'optimizer': 'adam', 'graph_mode': 'off', 'use_snp_selection': False}. Best is trial 53 with value: 0.12218763160211579.
[I 2025-11-03 13:20:30,029] Trial 91 finished with value: 0.09477507311156301 and parameters: {'model_type': 'gcn', 'hidden_dims': '[256, 128, 64]', 'dropout': 0.16639917787290362, 'batch_norm': True, 'lr': 0.0004978803116914656, 'weight_decay': 0.00010294179795218239, 'epochs': 228, 'loss': 'mae', 'optimizer': 'adam', 'graph_mode': 'off', 'use_snp_selection': False}. Best is trial 53 with value: 0.12218763160211579.
[I 2025-11-03 13:20:31,630] Trial 92 finished with value: 0.08584773354996944 and parameters: {'model_type': 'gcn', 'hidden_dims': '[512, 128]', 'dropout': 0.20652772295690613, 'batch_norm': True, 'lr': 0.00042517810695956356, 'weight_decay': 0.00013898117684848905, 'epochs': 211, 'loss': 'mae', 'optimizer': 'adam', 'graph_mode': 'off', 'use_snp_selection': False}. Best is trial 53 with value: 0.12218763160211579.
[I 2025-11-03 13:20:32,866] Trial 93 finished with value: 0.08757625052704118 and parameters: {'model_type': 'gcn', 'hidden_dims': '[128, 64]', 'dropout': 0.2622227071530504, 'batch_norm': True, 'lr': 0.00023151054025903316, 'weight_decay': 3.074612829508667e-05, 'epochs': 290, 'loss': 'mae', 'optimizer': 'adam', 'graph_mode': 'off', 'use_snp_selection': False}. Best is trial 53 with value: 0.12218763160211579.
[I 2025-11-03 13:20:34,147] Trial 94 finished with value: 0.11054932572001216 and parameters: {'model_type': 'gcn', 'hidden_dims': '[128, 64]', 'dropout': 0.2237476122187393, 'batch_norm': True, 'lr': 0.0005862139162852714, 'weight_decay': 1.650795162324625e-05, 'epochs': 310, 'loss': 'mae', 'optimizer': 'adam', 'graph_mode': 'off', 'use_snp_selection': False}. Best is trial 53 with value: 0.12218763160211579.
[I 2025-11-03 13:20:35,437] Trial 95 finished with value: 0.09241069637001652 and parameters: {'model_type': 'gcn', 'hidden_dims': '[128, 64]', 'dropout': 0.22950549765321096, 'batch_norm': True, 'lr': 0.0006201406910924316, 'weight_decay': 1.5727174414456406e-05, 'epochs': 306, 'loss': 'mae', 'optimizer': 'adam', 'graph_mode': 'off', 'use_snp_selection': False}. Best is trial 53 with value: 0.12218763160211579.
