[I 2025-11-03 11:48:34,214] Trial 108 finished with value: 0.03840273621206354 and parameters: {'model_type': 'gcn', 'hidden_dims': '[256, 128]', 'dropout': 0.2874064322786825, 'batch_norm': True, 'lr': 0.00012726495751644816, 'weight_decay': 0.0001668846742144506, 'epochs': 279, 'loss': 'mse', 'optimizer': 'adam', 'graph_mode': 'off', 'use_snp_selection': True, 'num_snps': 5511}. Best is trial 24 with value: 0.07345968974271269.
[I 2025-11-03 11:48:36,078] Trial 109 finished with value: 0.048923386772362555 and parameters: {'model_type': 'gcn', 'hidden_dims': '[512, 256]', 'dropout': 0.10524467411490987, 'batch_norm': False, 'lr': 4.631785025130352e-05, 'weight_decay': 5.63698940075276e-05, 'epochs': 178, 'loss': 'mse', 'optimizer': 'adam', 'graph_mode': 'off', 'use_snp_selection': False}. Best is trial 24 with value: 0.07345968974271269.
[I 2025-11-03 11:48:37,411] Trial 110 finished with value: 0.047450570427705535 and parameters: {'model_type': 'gcn', 'hidden_dims': '[512, 128]', 'dropout': 0.3852170402735433, 'batch_norm': False, 'lr': 8.474047716898272e-05, 'weight_decay': 1.53512162342503e-05, 'epochs': 192, 'loss': 'mse', 'optimizer': 'adam', 'graph_mode': 'off', 'use_snp_selection': True, 'num_snps': 16740}. Best is trial 24 with value: 0.07345968974271269.
[I 2025-11-03 11:48:38,602] Trial 111 finished with value: 0.04690503142519725 and parameters: {'model_type': 'gcn', 'hidden_dims': '[128, 64]', 'dropout': 0.3334007032088328, 'batch_norm': True, 'lr': 7.497153641417328e-05, 'weight_decay': 2.4095819306623873e-05, 'epochs': 211, 'loss': 'mse', 'optimizer': 'adam', 'graph_mode': 'off', 'use_snp_selection': True, 'num_snps': 12883}. Best is trial 24 with value: 0.07345968974271269.
[I 2025-11-03 11:48:40,317] Trial 112 finished with value: 0.05265857050014448 and parameters: {'model_type': 'gcn', 'hidden_dims': '[512, 64]', 'dropout': 0.33489780488489856, 'batch_norm': True, 'lr': 5.613646581304361e-05, 'weight_decay': 0.0003586339285388719, 'epochs': 219, 'loss': 'mse', 'optimizer': 'adam', 'graph_mode': 'off', 'use_snp_selection': True, 'num_snps': 23599}. Best is trial 24 with value: 0.07345968974271269.
[I 2025-11-03 11:48:41,660] Trial 113 finished with value: 0.044450159744741306 and parameters: {'model_type': 'gcn', 'hidden_dims': '[128, 64]', 'dropout': 0.3480524967089631, 'batch_norm': True, 'lr': 0.0007316235475599078, 'weight_decay': 2.1124870137432976e-05, 'epochs': 216, 'loss': 'mse', 'optimizer': 'adam', 'graph_mode': 'off', 'use_snp_selection': True, 'num_snps': 19818}. Best is trial 24 with value: 0.07345968974271269.
[I 2025-11-03 11:48:44,433] Trial 114 finished with value: 0.0472457595640928 and parameters: {'model_type': 'gcn', 'hidden_dims': '[512, 128]', 'dropout': 0.32499452576124027, 'batch_norm': True, 'lr': 6.37715163300012e-05, 'weight_decay': 4.43969789944308e-05, 'epochs': 198, 'loss': 'mse', 'optimizer': 'adam', 'graph_mode': 'off', 'use_snp_selection': True, 'num_snps': 55966}. Best is trial 24 with value: 0.07345968974271269.
[I 2025-11-03 11:48:45,921] Trial 115 finished with value: 0.0600423056447242 and parameters: {'model_type': 'gcn', 'hidden_dims': '[512, 256]', 'dropout': 0.3521236361256199, 'batch_norm': True, 'lr': 9.890996491132446e-05, 'weight_decay': 3.5099454859865665e-05, 'epochs': 238, 'loss': 'mse', 'optimizer': 'adam', 'graph_mode': 'off', 'use_snp_selection': True, 'num_snps': 15809}. Best is trial 24 with value: 0.07345968974271269.
[I 2025-11-03 11:48:47,370] Trial 116 finished with value: 0.09558626312955487 and parameters: {'model_type': 'gcn', 'hidden_dims': '[128, 64]', 'dropout': 0.36335248324966063, 'batch_norm': True, 'lr': 7.816627006659818e-05, 'weight_decay': 1.2508832628374953e-05, 'epochs': 206, 'loss': 'mse', 'optimizer': 'adam', 'graph_mode': 'off', 'use_snp_selection': True, 'num_snps': 26863}. Best is trial 116 with value: 0.09558626312955487.
[I 2025-11-03 11:48:48,390] Trial 117 finished with value: 0.01619179866472215 and parameters: {'model_type': 'gcn', 'hidden_dims': '[512, 128]', 'dropout': 0.5226931773550648, 'batch_norm': False, 'lr': 8.537931894210025e-05, 'weight_decay': 7.929086562864691e-05, 'epochs': 41, 'loss': 'mse', 'optimizer': 'adam', 'graph_mode': 'off', 'use_snp_selection': False}. Best is trial 116 with value: 0.09558626312955487.
[I 2025-11-03 11:48:49,742] Trial 118 finished with value: 0.005527353114863178 and parameters: {'model_type': 'gcn', 'hidden_dims': '[128, 64]', 'dropout': 0.36924290781276037, 'batch_norm': False, 'lr': 6.944269868083473e-06, 'weight_decay': 1.650908549859352e-05, 'epochs': 185, 'loss': 'mse', 'optimizer': 'adam', 'graph_mode': 'off', 'use_snp_selection': True, 'num_snps': 25920}. Best is trial 116 with value: 0.09558626312955487.
[I 2025-11-03 11:48:51,752] Trial 119 finished with value: 0.0376395380043473 and parameters: {'model_type': 'gcn', 'hidden_dims': '[512, 256]', 'dropout': 0.5746442526504263, 'batch_norm': True, 'lr': 0.0004301859715562421, 'weight_decay': 1.237150956963732e-05, 'epochs': 207, 'loss': 'mse', 'optimizer': 'adam', 'graph_mode': 'off', 'use_snp_selection': False}. Best is trial 116 with value: 0.09558626312955487.
[I 2025-11-03 11:48:53,117] Trial 120 finished with value: 0.022362005137021607 and parameters: {'model_type': 'gcn', 'hidden_dims': '[512, 128]', 'dropout': 0.35860136248463587, 'batch_norm': False, 'lr': 0.00011475997574357667, 'weight_decay': 2.995715016167696e-05, 'epochs': 78, 'loss': 'mse', 'optimizer': 'adam', 'graph_mode': 'off', 'use_snp_selection': True, 'num_snps': 28029}. Best is trial 116 with value: 0.09558626312955487.
[I 2025-11-03 11:48:54,809] Trial 121 finished with value: 0.06303250190852056 and parameters: {'model_type': 'gcn', 'hidden_dims': '[128, 64]', 'dropout': 0.3409099053302862, 'batch_norm': True, 'lr': 6.897608319813864e-05, 'weight_decay': 2.3677069697908757e-05, 'epochs': 248, 'loss': 'mse', 'optimizer': 'adam', 'graph_mode': 'off', 'use_snp_selection': True, 'num_snps': 32193}. Best is trial 116 with value: 0.09558626312955487.
[I 2025-11-03 11:48:56,343] Trial 122 finished with value: 0.03106046658026831 and parameters: {'model_type': 'gcn', 'hidden_dims': '[128, 64]', 'dropout': 0.3097422765357156, 'batch_norm': True, 'lr': 4.59519101986339e-05, 'weight_decay': 2.1559705418063038e-05, 'epochs': 260, 'loss': 'mse', 'optimizer': 'adam', 'graph_mode': 'off', 'use_snp_selection': True, 'num_snps': 22307}. Best is trial 116 with value: 0.09558626312955487.
[I 2025-11-03 11:48:58,201] Trial 123 finished with value: 0.008512066437083758 and parameters: {'model_type': 'gcn', 'hidden_dims': '[128, 64]', 'dropout': 0.39337989876254953, 'batch_norm': True, 'lr': 2.3514012870365593e-05, 'weight_decay': 5.6766738745643826e-05, 'epochs': 286, 'loss': 'mse', 'optimizer': 'adam', 'graph_mode': 'off', 'use_snp_selection': True, 'num_snps': 35071}. Best is trial 116 with value: 0.09558626312955487.
[I 2025-11-03 11:48:59,821] Trial 124 finished with value: 0.07265436119873842 and parameters: {'model_type': 'gcn', 'hidden_dims': '[128, 64]', 'dropout': 0.3443335182432093, 'batch_norm': True, 'lr': 5.636104277980437e-05, 'weight_decay': 3.87605492983628e-05, 'epochs': 248, 'loss': 'mse', 'optimizer': 'adam', 'graph_mode': 'off', 'use_snp_selection': True, 'num_snps': 32154}. Best is trial 116 with value: 0.09558626312955487.
[I 2025-11-03 11:49:01,511] Trial 125 finished with value: 0.02119969282204118 and parameters: {'model_type': 'gcn', 'hidden_dims': '[128, 64]', 'dropout': 0.37839335914286604, 'batch_norm': True, 'lr': 2.968935892672871e-05, 'weight_decay': 3.844350180516999e-05, 'epochs': 262, 'loss': 'mse', 'optimizer': 'adam', 'graph_mode': 'off', 'use_snp_selection': True, 'num_snps': 32661}. Best is trial 116 with value: 0.09558626312955487.
[I 2025-11-03 11:49:03,346] Trial 126 finished with value: 0.05832735371194845 and parameters: {'model_type': 'gcn', 'hidden_dims': '[256, 128]', 'dropout': 0.40955067466662404, 'batch_norm': True, 'lr': 5.246175860027822e-05, 'weight_decay': 4.482517894785123e-05, 'epochs': 273, 'loss': 'mae', 'optimizer': 'adam', 'graph_mode': 'off', 'use_snp_selection': True, 'num_snps': 31497}. Best is trial 116 with value: 0.09558626312955487.
[I 2025-11-03 11:49:05,018] Trial 127 finished with value: 0.05489854385587489 and parameters: {'model_type': 'gcn', 'hidden_dims': '[128, 64]', 'dropout': 0.35422740740746383, 'batch_norm': False, 'lr': 3.946467442999754e-05, 'weight_decay': 6.705568734047481e-05, 'epochs': 169, 'loss': 'mse', 'optimizer': 'adam', 'graph_mode': 'off', 'use_snp_selection': True, 'num_snps': 41540}. Best is trial 116 with value: 0.09558626312955487.
[I 2025-11-03 11:49:07,250] Trial 128 finished with value: 0.03902103396065597 and parameters: {'model_type': 'gcn', 'hidden_dims': '[512, 256]', 'dropout': 0.3189864835797083, 'batch_norm': False, 'lr': 1.8605397069449256e-05, 'weight_decay': 9.183340703509553e-05, 'epochs': 251, 'loss': 'mse', 'optimizer': 'adam', 'graph_mode': 'off', 'use_snp_selection': False}. Best is trial 116 with value: 0.09558626312955487.
[I 2025-11-03 11:49:09,025] Trial 129 finished with value: 0.05346540409517863 and parameters: {'model_type': 'gcn', 'hidden_dims': '[128, 64]', 'dropout': 0.3699993804008261, 'batch_norm': True, 'lr': 9.689690330732629e-05, 'weight_decay': 2.8032518830280942e-05, 'epochs': 232, 'loss': 'mse', 'optimizer': 'adam', 'graph_mode': 'off', 'use_snp_selection': True, 'num_snps': 36404}. Best is trial 116 with value: 0.09558626312955487.
[I 2025-11-03 11:49:10,904] Trial 130 finished with value: 0.057460306913165664 and parameters: {'model_type': 'gcn', 'hidden_dims': '[512, 128]', 'dropout': 0.24827077089862154, 'batch_norm': False, 'lr': 8.707075441137397e-05, 'weight_decay': 4.871274707996222e-05, 'epochs': 241, 'loss': 'mse', 'optimizer': 'adam', 'graph_mode': 'off', 'use_snp_selection': True, 'num_snps': 27288}. Best is trial 116 with value: 0.09558626312955487.
[I 2025-11-03 11:49:12,527] Trial 131 finished with value: 0.03317643378664694 and parameters: {'model_type': 'gcn', 'hidden_dims': '[128, 64]', 'dropout': 0.33929332980606913, 'batch_norm': True, 'lr': 5.739338942795418e-05, 'weight_decay': 1.2912957457700923e-05, 'epochs': 225, 'loss': 'mse', 'optimizer': 'adam', 'graph_mode': 'off', 'use_snp_selection': True, 'num_snps': 29874}. Best is trial 116 with value: 0.09558626312955487.
[I 2025-11-03 11:49:13,836] Trial 132 finished with value: 0.06490883140970448 and parameters: {'model_type': 'gcn', 'hidden_dims': '[128, 64]', 'dropout': 0.4926823099879182, 'batch_norm': True, 'lr': 6.941043070318838e-05, 'weight_decay': 2.467589459168405e-05, 'epochs': 245, 'loss': 'mse', 'optimizer': 'adam', 'graph_mode': 'off', 'use_snp_selection': True, 'num_snps': 14108}. Best is trial 116 with value: 0.09558626312955487.
[I 2025-11-03 11:49:15,004] Trial 133 finished with value: 0.09524731811582043 and parameters: {'model_type': 'gcn', 'hidden_dims': '[128, 64]', 'dropout': 0.5032059851926557, 'batch_norm': True, 'lr': 7.65303343019282e-05, 'weight_decay': 2.3923273405044123e-05, 'epochs': 192, 'loss': 'mse', 'optimizer': 'adam', 'graph_mode': 'off', 'use_snp_selection': True, 'num_snps': 14473}. Best is trial 116 with value: 0.09558626312955487.
[I 2025-11-03 11:49:16,437] Trial 134 finished with value: 0.04965062910093579 and parameters: {'model_type': 'gcn', 'hidden_dims': '[128, 64]', 'dropout': 0.49286184545177486, 'batch_norm': True, 'lr': 0.00032657156479771446, 'weight_decay': 2.8397240765009752e-05, 'epochs': 248, 'loss': 'mse', 'optimizer': 'adam', 'graph_mode': 'off', 'use_snp_selection': True, 'num_snps': 19154}. Best is trial 116 with value: 0.09558626312955487.
[I 2025-11-03 11:49:17,639] Trial 135 finished with value: 0.023997867276068962 and parameters: {'model_type': 'gcn', 'hidden_dims': '[128, 64]', 'dropout': 0.5070206356327283, 'batch_norm': True, 'lr': 8.087440798853652e-05, 'weight_decay': 2.286782201820159e-05, 'epochs': 196, 'loss': 'mse', 'optimizer': 'adam', 'graph_mode': 'off', 'use_snp_selection': True, 'num_snps': 13983}. Best is trial 116 with value: 0.09558626312955487.
[I 2025-11-03 11:49:18,676] Trial 136 finished with value: 0.05744166769973026 and parameters: {'model_type': 'gcn', 'hidden_dims': '[128, 64]', 'dropout': 0.4673755117882132, 'batch_norm': True, 'lr': 1.3219695046095614e-05, 'weight_decay': 1.9728618822983305e-05, 'epochs': 181, 'loss': 'mse', 'optimizer': 'adam', 'graph_mode': 'off', 'use_snp_selection': False}. Best is trial 116 with value: 0.09558626312955487.
[I 2025-11-03 11:49:19,968] Trial 137 finished with value: 0.05823634531057747 and parameters: {'model_type': 'gcn', 'hidden_dims': '[128, 64]', 'dropout': 0.5432386716340825, 'batch_norm': False, 'lr': 0.00011437225650272524, 'weight_decay': 3.2762743368886916e-05, 'epochs': 163, 'loss': 'mse', 'optimizer': 'adam', 'graph_mode': 'off', 'use_snp_selection': True, 'num_snps': 25179}. Best is trial 116 with value: 0.09558626312955487.
[I 2025-11-03 11:49:21,275] Trial 138 finished with value: 0.03161761003396716 and parameters: {'model_type': 'gcn', 'hidden_dims': '[128, 64]', 'dropout': 0.5325223518863726, 'batch_norm': True, 'lr': 0.0001369328959182659, 'weight_decay': 4.112380329617387e-05, 'epochs': 190, 'loss': 'mse', 'optimizer': 'adam', 'graph_mode': 'off', 'use_snp_selection': True, 'num_snps': 20544}. Best is trial 116 with value: 0.09558626312955487.
[I 2025-11-03 11:49:22,333] Trial 139 finished with value: 0.0426972813198975 and parameters: {'model_type': 'gcn', 'hidden_dims': '[128, 64]', 'dropout': 0.5180008083167699, 'batch_norm': True, 'lr': 0.0005447713234335516, 'weight_decay': 2.433553859577341e-05, 'epochs': 175, 'loss': 'mse', 'optimizer': 'adam', 'graph_mode': 'off', 'use_snp_selection': False}. Best is trial 116 with value: 0.09558626312955487.
[I 2025-11-03 11:49:23,471] Trial 140 finished with value: 0.042104515941501636 and parameters: {'model_type': 'gcn', 'hidden_dims': '[512, 64]', 'dropout': 0.4772650014687847, 'batch_norm': False, 'lr': 0.00017348691948331982, 'weight_decay': 1.952929679463707e-07, 'epochs': 204, 'loss': 'mse', 'optimizer': 'adam', 'graph_mode': 'off', 'use_snp_selection': True, 'num_snps': 10216}. Best is trial 116 with value: 0.09558626312955487.
[I 2025-11-03 11:49:24,740] Trial 141 finished with value: 0.03750834625117171 and parameters: {'model_type': 'gcn', 'hidden_dims': '[128, 64]', 'dropout': 0.48898522285853224, 'batch_norm': True, 'lr': 7.251301188831817e-05, 'weight_decay': 3.695639068364484e-05, 'epochs': 243, 'loss': 'mse', 'optimizer': 'adam', 'graph_mode': 'off', 'use_snp_selection': True, 'num_snps': 11992}. Best is trial 116 with value: 0.09558626312955487.
[I 2025-11-03 11:49:26,298] Trial 142 finished with value: 0.049901675442243616 and parameters: {'model_type': 'gcn', 'hidden_dims': '[256, 128, 64]', 'dropout': 0.4606644474405622, 'batch_norm': True, 'lr': 5.9390585110321284e-05, 'weight_decay': 5.296756688832146e-05, 'epochs': 236, 'loss': 'mse', 'optimizer': 'adam', 'graph_mode': 'off', 'use_snp_selection': True, 'num_snps': 14527}. Best is trial 116 with value: 0.09558626312955487.
[I 2025-11-03 11:49:27,567] Trial 143 finished with value: 0.023299745744519186 and parameters: {'model_type': 'gcn', 'hidden_dims': '[128, 64]', 'dropout': 0.49559389934804526, 'batch_norm': True, 'lr': 6.431481394541345e-05, 'weight_decay': 1.5500736832497188e-05, 'epochs': 198, 'loss': 'mse', 'optimizer': 'adam', 'graph_mode': 'off', 'use_snp_selection': True, 'num_snps': 18389}. Best is trial 116 with value: 0.09558626312955487.
[I 2025-11-03 11:49:29,077] Trial 144 finished with value: 0.012265577931986004 and parameters: {'model_type': 'gcn', 'hidden_dims': '[512, 128]', 'dropout': 0.5073731633316606, 'batch_norm': True, 'lr': 9.215597005393178e-05, 'weight_decay': 2.5902608899406025e-05, 'epochs': 227, 'loss': 'mse', 'optimizer': 'adam', 'graph_mode': 'off', 'use_snp_selection': True, 'num_snps': 17228}. Best is trial 116 with value: 0.09558626312955487.
[I 2025-11-03 11:49:30,860] Trial 145 finished with value: 0.05109847471502588 and parameters: {'model_type': 'gcn', 'hidden_dims': '[512, 256]', 'dropout': 0.34972732759445346, 'batch_norm': True, 'lr': 0.0002644416243271773, 'weight_decay': 6.247164746184165e-05, 'epochs': 256, 'loss': 'mse', 'optimizer': 'adam', 'graph_mode': 'off', 'use_snp_selection': True, 'num_snps': 23031}. Best is trial 116 with value: 0.09558626312955487.
[I 2025-11-03 11:49:31,960] Trial 146 finished with value: 0.03727107057535092 and parameters: {'model_type': 'gcn', 'hidden_dims': '[128, 64]', 'dropout': 0.3281443397424568, 'batch_norm': True, 'lr': 5.23404645665104e-05, 'weight_decay': 3.285820868832766e-05, 'epochs': 192, 'loss': 'mse', 'optimizer': 'adam', 'graph_mode': 'off', 'use_snp_selection': True, 'num_snps': 9604}. Best is trial 116 with value: 0.09558626312955487.
[I 2025-11-03 11:49:34,396] Trial 147 finished with value: 0.054869118244798155 and parameters: {'model_type': 'gcn', 'hidden_dims': '[512, 128]', 'dropout': 0.5835166926773211, 'batch_norm': False, 'lr': 7.197368841415744e-05, 'weight_decay': 1.843608438252787e-05, 'epochs': 286, 'loss': 'mae', 'optimizer': 'adam', 'graph_mode': 'off', 'use_snp_selection': False}. Best is trial 116 with value: 0.09558626312955487.
[I 2025-11-03 11:49:35,803] Trial 148 finished with value: 0.021202391649668056 and parameters: {'model_type': 'gcn', 'hidden_dims': '[128, 64]', 'dropout': 0.5585385467282592, 'batch_norm': True, 'lr': 4.413953003309964e-05, 'weight_decay': 9.611053352728375e-06, 'epochs': 311, 'loss': 'mse', 'optimizer': 'adam', 'graph_mode': 'off', 'use_snp_selection': True, 'num_snps': 11954}. Best is trial 116 with value: 0.09558626312955487.
[I 2025-11-03 11:49:37,176] Trial 149 finished with value: 0.07315663133015517 and parameters: {'model_type': 'gcn', 'hidden_dims': '[512, 256]', 'dropout': 0.36194656104439304, 'batch_norm': False, 'lr': 2.6058182381907793e-06, 'weight_decay': 4.241676421505336e-05, 'epochs': 337, 'loss': 'mse', 'optimizer': 'adam', 'graph_mode': 'off', 'use_snp_selection': True, 'num_snps': 8021}. Best is trial 116 with value: 0.09558626312955487.
[I 2025-11-03 11:49:39,216] Trial 0 finished with value: 0.05227042117329645 and parameters: {'model_type': 'gcn', 'hidden_dims': '[128, 64]', 'dropout': 0.199031432379812, 'batch_norm': True, 'lr': 1.8408544111075837e-06, 'weight_decay': 5.5136510071208614e-05, 'epochs': 336, 'loss': 'mae', 'optimizer': 'adam', 'graph_mode': 'off', 'use_snp_selection': True, 'num_snps': 43862}. Best is trial 0 with value: 0.05227042117329645.
[I 2025-11-03 11:49:40,718] Trial 1 finished with value: 0.02669290484907913 and parameters: {'model_type': 'gcn', 'hidden_dims': '[256, 128]', 'dropout': 0.4370668075331726, 'batch_norm': True, 'lr': 7.133471581159139e-05, 'weight_decay': 1.128633586803549e-05, 'epochs': 242, 'loss': 'mae', 'optimizer': 'adam', 'graph_mode': 'off', 'use_snp_selection': False}. Best is trial 0 with value: 0.05227042117329645.
[I 2025-11-03 11:49:41,793] Trial 2 finished with value: 0.015237373549289732 and parameters: {'model_type': 'gcn', 'hidden_dims': '[256, 128, 64]', 'dropout': 0.41314357415569625, 'batch_norm': False, 'lr': 3.952233718592101e-06, 'weight_decay': 0.00026754769258252603, 'epochs': 149, 'loss': 'mse', 'optimizer': 'adam', 'graph_mode': 'off', 'use_snp_selection': True, 'num_snps': 11571}. Best is trial 0 with value: 0.05227042117329645.
[I 2025-11-03 11:49:44,248] Trial 3 finished with value: 0.006086781219389668 and parameters: {'model_type': 'gcn', 'hidden_dims': '[512, 64]', 'dropout': 0.5938127374509361, 'batch_norm': False, 'lr': 5.67704586114731e-06, 'weight_decay': 2.4518087630137052e-05, 'epochs': 320, 'loss': 'mae', 'optimizer': 'adam', 'graph_mode': 'off', 'use_snp_selection': False}. Best is trial 0 with value: 0.05227042117329645.
[I 2025-11-03 11:49:46,490] Trial 4 finished with value: 0.027930520569187045 and parameters: {'model_type': 'gcn', 'hidden_dims': '[512, 128]', 'dropout': 0.25746343592134413, 'batch_norm': True, 'lr': 1.3467657668402788e-06, 'weight_decay': 0.00033087251918647806, 'epochs': 277, 'loss': 'mse', 'optimizer': 'adam', 'graph_mode': 'off', 'use_snp_selection': True, 'num_snps': 36675}. Best is trial 0 with value: 0.05227042117329645.
[I 2025-11-03 11:49:48,126] Trial 5 finished with value: -0.0021987969860995183 and parameters: {'model_type': 'gcn', 'hidden_dims': '[512, 64]', 'dropout': 0.38275350994408375, 'batch_norm': True, 'lr': 1.5586664309232824e-06, 'weight_decay': 0.0008227664668621182, 'epochs': 145, 'loss': 'mae', 'optimizer': 'adam', 'graph_mode': 'off', 'use_snp_selection': True, 'num_snps': 32148}. Best is trial 0 with value: 0.05227042117329645.
[I 2025-11-03 11:49:49,419] Trial 6 finished with value: 0.052200213817686615 and parameters: {'model_type': 'gcn', 'hidden_dims': '[256, 128]', 'dropout': 0.3930109900265879, 'batch_norm': False, 'lr': 4.892964372128395e-05, 'weight_decay': 1.5809549317992182e-06, 'epochs': 199, 'loss': 'mse', 'optimizer': 'adam', 'graph_mode': 'off', 'use_snp_selection': False}. Best is trial 0 with value: 0.05227042117329645.
[I 2025-11-03 11:49:50,733] Trial 7 finished with value: 0.05119808727439372 and parameters: {'model_type': 'gcn', 'hidden_dims': '[512, 256]', 'dropout': 0.15343979219678458, 'batch_norm': True, 'lr': 6.234003099047341e-05, 'weight_decay': 3.894760610535477e-07, 'epochs': 97, 'loss': 'mse', 'optimizer': 'adam', 'graph_mode': 'off', 'use_snp_selection': False}. Best is trial 0 with value: 0.05227042117329645.
[I 2025-11-03 11:49:53,193] Trial 8 finished with value: 0.04641131477502569 and parameters: {'model_type': 'gcn', 'hidden_dims': '[512, 128]', 'dropout': 0.10743001231661406, 'batch_norm': True, 'lr': 0.00023728538449271062, 'weight_decay': 1.7629071578048637e-05, 'epochs': 312, 'loss': 'mae', 'optimizer': 'adam', 'graph_mode': 'off', 'use_snp_selection': False}. Best is trial 0 with value: 0.05227042117329645.
