[I 2025-11-03 14:51:49,894] Trial 8 finished with value: 0.08478034611130732 and parameters: {'model_type': 'graphsage', 'hidden_dims': '[512, 128]', 'dropout': 0.5066580418354021, 'batch_norm': True, 'lr': 0.00039213678276659976, 'weight_decay': 3.43655320802934e-06, 'epochs': 120, 'loss': 'mse', 'optimizer': 'adam', 'graph_mode': 'cutoff', 'cutoff': 0.34923059576505366, 'grm_norm': 'cosine', 'self_loops': True, 'use_snp_selection': False}. Best is trial 7 with value: 0.12018701237006751.
[I 2025-11-03 14:51:51,860] Trial 9 finished with value: 0.04393480738973468 and parameters: {'model_type': 'graphsage', 'hidden_dims': '[512, 256]', 'dropout': 0.301734920240333, 'batch_norm': False, 'lr': 6.650961854953448e-06, 'weight_decay': 6.861575656590315e-05, 'epochs': 150, 'loss': 'mae', 'optimizer': 'adam', 'graph_mode': 'cutoff', 'cutoff': 0.2857569870061939, 'grm_norm': 'cosine_then_gcn', 'self_loops': False, 'use_snp_selection': True, 'num_snps': 12722}. Best is trial 7 with value: 0.12018701237006751.
[I 2025-11-03 14:51:56,018] Trial 10 finished with value: 0.06651803403470051 and parameters: {'model_type': 'graphsage', 'hidden_dims': '[512, 64]', 'dropout': 0.2491228540815774, 'batch_norm': True, 'lr': 1.080428984628536e-05, 'weight_decay': 1.6060239611529646e-07, 'epochs': 275, 'loss': 'mse', 'optimizer': 'adam', 'graph_mode': 'cutoff', 'cutoff': 0.8740100033033124, 'grm_norm': 'gcn', 'self_loops': True, 'use_snp_selection': False}. Best is trial 7 with value: 0.12018701237006751.
[I 2025-11-03 14:52:00,026] Trial 11 finished with value: 0.09364940882239847 and parameters: {'model_type': 'graphsage', 'hidden_dims': '[512, 256]', 'dropout': 0.33158647695857435, 'batch_norm': True, 'lr': 0.0001113083271410056, 'weight_decay': 0.00028491289627808323, 'epochs': 242, 'loss': 'mae', 'optimizer': 'adam', 'graph_mode': 'knn', 'source': 'grm', 'knn_k': 1, 'weighted_edges': True, 'symmetrize_mode': 'union', 'use_snp_selection': False}. Best is trial 7 with value: 0.12018701237006751.
[I 2025-11-03 14:52:04,185] Trial 12 finished with value: 0.09107027682676726 and parameters: {'model_type': 'graphsage', 'hidden_dims': '[512, 256]', 'dropout': 0.16298549083475847, 'batch_norm': True, 'lr': 1.0835479002658624e-05, 'weight_decay': 2.215502086408347e-06, 'epochs': 237, 'loss': 'mae', 'optimizer': 'adam', 'graph_mode': 'cutoff', 'cutoff': 0.823146584864209, 'grm_norm': 'gcn', 'self_loops': False, 'use_snp_selection': False}. Best is trial 7 with value: 0.12018701237006751.
[I 2025-11-03 14:52:08,095] Trial 13 finished with value: 0.11347437258700123 and parameters: {'model_type': 'graphsage', 'hidden_dims': '[512, 256]', 'dropout': 0.10325172884852192, 'batch_norm': True, 'lr': 0.00012103625691899355, 'weight_decay': 8.457002167539323e-06, 'epochs': 222, 'loss': 'mse', 'optimizer': 'adam', 'graph_mode': 'knn', 'source': 'grm', 'knn_k': 3, 'weighted_edges': True, 'symmetrize_mode': 'mutual', 'use_snp_selection': False}. Best is trial 7 with value: 0.12018701237006751.
[I 2025-11-03 14:52:12,461] Trial 14 finished with value: 0.11518202220132162 and parameters: {'model_type': 'graphsage', 'hidden_dims': '[512, 256]', 'dropout': 0.11105908832458855, 'batch_norm': True, 'lr': 8.773526967482465e-05, 'weight_decay': 5.098763140321504e-06, 'epochs': 280, 'loss': 'mse', 'optimizer': 'adam', 'graph_mode': 'knn', 'source': 'grm', 'knn_k': 4, 'weighted_edges': True, 'symmetrize_mode': 'mutual', 'use_snp_selection': False}. Best is trial 7 with value: 0.12018701237006751.
[I 2025-11-03 14:52:16,901] Trial 15 finished with value: 0.09287201185518393 and parameters: {'model_type': 'graphsage', 'hidden_dims': '[512, 64]', 'dropout': 0.2518887181552659, 'batch_norm': True, 'lr': 5.4361053196810865e-05, 'weight_decay': 3.532695175036362e-07, 'epochs': 309, 'loss': 'mse', 'optimizer': 'adam', 'graph_mode': 'cutoff', 'cutoff': 0.700008243195548, 'grm_norm': 'cosine', 'self_loops': False, 'use_snp_selection': False}. Best is trial 7 with value: 0.12018701237006751.
[I 2025-11-03 14:52:20,049] Trial 16 finished with value: 0.06396238929682417 and parameters: {'model_type': 'graphsage', 'hidden_dims': '[256, 128, 64]', 'dropout': 0.19745289718829856, 'batch_norm': True, 'lr': 3.9874850051940265e-06, 'weight_decay': 5.597407767532387e-06, 'epochs': 285, 'loss': 'mse', 'optimizer': 'adam', 'graph_mode': 'cutoff', 'cutoff': 0.44543870555027765, 'grm_norm': 'none', 'self_loops': True, 'use_snp_selection': False}. Best is trial 7 with value: 0.12018701237006751.
[I 2025-11-03 14:52:25,213] Trial 17 finished with value: 0.06410540777243409 and parameters: {'model_type': 'graphsage', 'hidden_dims': '[512, 128]', 'dropout': 0.11916295170404015, 'batch_norm': True, 'lr': 1.4392408278884217e-05, 'weight_decay': 8.847749486924231e-07, 'epochs': 348, 'loss': 'mse', 'optimizer': 'adam', 'graph_mode': 'knn', 'source': 'grm', 'knn_k': 4, 'weighted_edges': False, 'symmetrize_mode': 'union', 'use_snp_selection': False}. Best is trial 7 with value: 0.12018701237006751.
[I 2025-11-03 14:52:28,715] Trial 18 finished with value: 0.10384852773894894 and parameters: {'model_type': 'graphsage', 'hidden_dims': '[512, 256]', 'dropout': 0.24087459266755995, 'batch_norm': True, 'lr': 2.104235401344553e-05, 'weight_decay': 6.670310667104972e-05, 'epochs': 189, 'loss': 'mse', 'optimizer': 'adam', 'graph_mode': 'cutoff', 'cutoff': 0.7074628960861822, 'grm_norm': 'cosine_then_gcn', 'self_loops': False, 'use_snp_selection': False}. Best is trial 7 with value: 0.12018701237006751.
[I 2025-11-03 14:52:33,228] Trial 19 finished with value: 0.09950915502944467 and parameters: {'model_type': 'graphsage', 'hidden_dims': '[512, 256]', 'dropout': 0.17219191310081194, 'batch_norm': True, 'lr': 7.196733253377153e-05, 'weight_decay': 0.00016989942696257648, 'epochs': 266, 'loss': 'mse', 'optimizer': 'adam', 'graph_mode': 'knn', 'source': 'grm', 'knn_k': 10, 'weighted_edges': True, 'symmetrize_mode': 'mutual', 'use_snp_selection': False}. Best is trial 7 with value: 0.12018701237006751.
[I 2025-11-03 14:52:37,677] Trial 20 finished with value: 0.02341708548583786 and parameters: {'model_type': 'graphsage', 'hidden_dims': '[512, 256]', 'dropout': 0.10458350007343897, 'batch_norm': True, 'lr': 1.4317900303755302e-06, 'weight_decay': 9.21549324630546e-06, 'epochs': 310, 'loss': 'mse', 'optimizer': 'adam', 'graph_mode': 'cutoff', 'cutoff': 0.5095587587193762, 'grm_norm': 'gcn', 'self_loops': True, 'use_snp_selection': False}. Best is trial 7 with value: 0.12018701237006751.
[I 2025-11-03 14:52:41,584] Trial 21 finished with value: 0.11642459214967338 and parameters: {'model_type': 'graphsage', 'hidden_dims': '[512, 256]', 'dropout': 0.10012641613546697, 'batch_norm': True, 'lr': 0.00015770993587217096, 'weight_decay': 8.301673085457391e-06, 'epochs': 220, 'loss': 'mse', 'optimizer': 'adam', 'graph_mode': 'knn', 'source': 'grm', 'knn_k': 4, 'weighted_edges': True, 'symmetrize_mode': 'mutual', 'use_snp_selection': False}. Best is trial 7 with value: 0.12018701237006751.
[I 2025-11-03 14:52:45,464] Trial 22 finished with value: 0.09683027281167696 and parameters: {'model_type': 'graphsage', 'hidden_dims': '[512, 256]', 'dropout': 0.15612069453792793, 'batch_norm': True, 'lr': 0.0009937552563647927, 'weight_decay': 4.635925321928001e-06, 'epochs': 213, 'loss': 'mse', 'optimizer': 'adam', 'graph_mode': 'knn', 'source': 'grm', 'knn_k': 4, 'weighted_edges': True, 'symmetrize_mode': 'mutual', 'use_snp_selection': False}. Best is trial 7 with value: 0.12018701237006751.
[I 2025-11-03 14:52:49,670] Trial 23 finished with value: 0.11703132066783074 and parameters: {'model_type': 'graphsage', 'hidden_dims': '[512, 256]', 'dropout': 0.22489659628860753, 'batch_norm': True, 'lr': 0.0002539848133688425, 'weight_decay': 1.1376350683959151e-06, 'epochs': 255, 'loss': 'mse', 'optimizer': 'adam', 'graph_mode': 'knn', 'source': 'grm', 'knn_k': 4, 'weighted_edges': True, 'symmetrize_mode': 'mutual', 'use_snp_selection': False}. Best is trial 7 with value: 0.12018701237006751.
[I 2025-11-03 14:52:53,176] Trial 24 finished with value: 0.0905565602309228 and parameters: {'model_type': 'graphsage', 'hidden_dims': '[512, 256]', 'dropout': 0.21117525174444046, 'batch_norm': True, 'lr': 0.0002636387678944316, 'weight_decay': 9.443901657367388e-07, 'epochs': 171, 'loss': 'mse', 'optimizer': 'adam', 'graph_mode': 'knn', 'source': 'grm', 'knn_k': 3, 'weighted_edges': True, 'symmetrize_mode': 'mutual', 'use_snp_selection': False}. Best is trial 7 with value: 0.12018701237006751.
[I 2025-11-03 14:52:55,855] Trial 25 finished with value: 0.1029036066167849 and parameters: {'model_type': 'graphsage', 'hidden_dims': '[256, 128, 64]', 'dropout': 0.2952809894593051, 'batch_norm': True, 'lr': 0.00022217758218546718, 'weight_decay': 1.3141221504554366e-07, 'epochs': 206, 'loss': 'mse', 'optimizer': 'adam', 'graph_mode': 'knn', 'source': 'grm', 'knn_k': 5, 'weighted_edges': False, 'symmetrize_mode': 'union', 'use_snp_selection': False}. Best is trial 7 with value: 0.12018701237006751.
[I 2025-11-03 14:53:01,555] Trial 26 finished with value: 0.09452147336002985 and parameters: {'model_type': 'graphsage', 'hidden_dims': '[512, 128]', 'dropout': 0.15302273172368666, 'batch_norm': False, 'lr': 2.0077727126147438e-05, 'weight_decay': 3.6287981794017153e-07, 'epochs': 249, 'loss': 'mse', 'optimizer': 'adam', 'graph_mode': 'knn', 'source': 'grm', 'knn_k': 6, 'weighted_edges': True, 'symmetrize_mode': 'mutual', 'use_snp_selection': True, 'num_snps': 59005}. Best is trial 7 with value: 0.12018701237006751.
[I 2025-11-03 14:53:03,700] Trial 27 finished with value: 0.10518554171067078 and parameters: {'model_type': 'graphsage', 'hidden_dims': '[256, 128]', 'dropout': 0.21976351309705155, 'batch_norm': True, 'lr': 0.0001908581733705448, 'weight_decay': 1.7753346697644524e-06, 'epochs': 132, 'loss': 'mse', 'optimizer': 'adam', 'graph_mode': 'knn', 'source': 'grm', 'knn_k': 3, 'weighted_edges': True, 'symmetrize_mode': 'mutual', 'use_snp_selection': False}. Best is trial 7 with value: 0.12018701237006751.
[I 2025-11-03 14:53:07,720] Trial 28 finished with value: 0.09294186394653321 and parameters: {'model_type': 'graphsage', 'hidden_dims': '[512, 64]', 'dropout': 0.26947513049093097, 'batch_norm': True, 'lr': 5.799323691814563e-05, 'weight_decay': 1.5167970220199268e-05, 'epochs': 251, 'loss': 'mse', 'optimizer': 'adam', 'graph_mode': 'cutoff', 'cutoff': 0.7613419213869919, 'grm_norm': 'gcn', 'self_loops': False, 'use_snp_selection': False}. Best is trial 7 with value: 0.12018701237006751.
[I 2025-11-03 14:53:10,161] Trial 29 finished with value: 0.058583876780269356 and parameters: {'model_type': 'graphsage', 'hidden_dims': '[128, 64]', 'dropout': 0.1881763221627632, 'batch_norm': True, 'lr': 2.8057913749286002e-06, 'weight_decay': 3.7807176788661624e-05, 'epochs': 312, 'loss': 'mse', 'optimizer': 'adam', 'graph_mode': 'knn', 'source': 'grm', 'knn_k': 8, 'weighted_edges': True, 'symmetrize_mode': 'mutual', 'use_snp_selection': False}. Best is trial 7 with value: 0.12018701237006751.
[I 2025-11-03 14:53:13,921] Trial 30 finished with value: 0.10930214433299004 and parameters: {'model_type': 'graphsage', 'hidden_dims': '[512, 256]', 'dropout': 0.1340583899399897, 'batch_norm': True, 'lr': 0.0003450472280084836, 'weight_decay': 3.932248856189873e-07, 'epochs': 198, 'loss': 'mse', 'optimizer': 'adam', 'graph_mode': 'knn', 'source': 'grm', 'knn_k': 2, 'weighted_edges': False, 'symmetrize_mode': 'union', 'use_snp_selection': False}. Best is trial 7 with value: 0.12018701237006751.
[I 2025-11-03 14:53:18,456] Trial 31 finished with value: 0.10118075475984269 and parameters: {'model_type': 'graphsage', 'hidden_dims': '[512, 256]', 'dropout': 0.13936959242340358, 'batch_norm': True, 'lr': 8.41802056365424e-05, 'weight_decay': 3.4475714482884617e-06, 'epochs': 289, 'loss': 'mse', 'optimizer': 'adam', 'graph_mode': 'knn', 'source': 'grm', 'knn_k': 5, 'weighted_edges': True, 'symmetrize_mode': 'mutual', 'use_snp_selection': False}. Best is trial 7 with value: 0.12018701237006751.
[I 2025-11-03 14:53:22,708] Trial 32 finished with value: 0.07735313454714499 and parameters: {'model_type': 'graphsage', 'hidden_dims': '[512, 256]', 'dropout': 0.10492690635092905, 'batch_norm': True, 'lr': 2.4803633883324607e-05, 'weight_decay': 7.699705347626554e-06, 'epochs': 260, 'loss': 'mse', 'optimizer': 'adam', 'graph_mode': 'knn', 'source': 'grm', 'knn_k': 4, 'weighted_edges': True, 'symmetrize_mode': 'mutual', 'use_snp_selection': False}. Best is trial 7 with value: 0.12018701237006751.
[I 2025-11-03 14:53:27,525] Trial 33 finished with value: 0.1120925564255692 and parameters: {'model_type': 'graphsage', 'hidden_dims': '[512, 256]', 'dropout': 0.18586386592625465, 'batch_norm': True, 'lr': 0.00014965930071492652, 'weight_decay': 1.4955699232005196e-06, 'epochs': 326, 'loss': 'mse', 'optimizer': 'adam', 'graph_mode': 'knn', 'source': 'grm', 'knn_k': 5, 'weighted_edges': True, 'symmetrize_mode': 'mutual', 'use_snp_selection': False}. Best is trial 7 with value: 0.12018701237006751.
[I 2025-11-03 14:53:29,616] Trial 34 finished with value: 0.11844758296221808 and parameters: {'model_type': 'graphsage', 'hidden_dims': '[128, 64]', 'dropout': 0.21938119453385957, 'batch_norm': True, 'lr': 0.0004358738195211114, 'weight_decay': 3.7895819918587054e-05, 'epochs': 237, 'loss': 'mse', 'optimizer': 'adam', 'graph_mode': 'knn', 'source': 'grm', 'knn_k': 4, 'weighted_edges': True, 'symmetrize_mode': 'mutual', 'use_snp_selection': False}. Best is trial 7 with value: 0.12018701237006751.
[I 2025-11-03 14:53:31,394] Trial 35 finished with value: 0.06118384193616338 and parameters: {'model_type': 'graphsage', 'hidden_dims': '[128, 64]', 'dropout': 0.3882577241405019, 'batch_norm': False, 'lr': 0.0006249910135479621, 'weight_decay': 0.00012434637527084424, 'epochs': 229, 'loss': 'mse', 'optimizer': 'adam', 'graph_mode': 'knn', 'source': 'grm', 'knn_k': 2, 'weighted_edges': True, 'symmetrize_mode': 'mutual', 'use_snp_selection': True, 'num_snps': 2074}. Best is trial 7 with value: 0.12018701237006751.
[I 2025-11-03 14:53:32,969] Trial 36 finished with value: 0.10366682133721906 and parameters: {'model_type': 'graphsage', 'hidden_dims': '[128, 64]', 'dropout': 0.21737479472114973, 'batch_norm': True, 'lr': 0.00048686740820709615, 'weight_decay': 3.636591748879344e-05, 'epochs': 93, 'loss': 'mse', 'optimizer': 'adam', 'graph_mode': 'knn', 'source': 'grm', 'knn_k': 3, 'weighted_edges': True, 'symmetrize_mode': 'mutual', 'use_snp_selection': False}. Best is trial 7 with value: 0.12018701237006751.
[I 2025-11-03 14:53:35,013] Trial 37 finished with value: 0.07554032961054148 and parameters: {'model_type': 'graphsage', 'hidden_dims': '[128, 64]', 'dropout': 0.4579193794196349, 'batch_norm': False, 'lr': 0.0007255970020387019, 'weight_decay': 1.2960239347554293e-05, 'epochs': 176, 'loss': 'mae', 'optimizer': 'adam', 'graph_mode': 'cutoff', 'cutoff': 0.206765711677402, 'grm_norm': 'cosine_then_gcn', 'self_loops': False, 'use_snp_selection': True, 'num_snps': 15344}. Best is trial 7 with value: 0.12018701237006751.
[I 2025-11-03 14:53:37,550] Trial 38 finished with value: 0.0472914568353841 and parameters: {'model_type': 'graphsage', 'hidden_dims': '[256, 128]', 'dropout': 0.5983997675135191, 'batch_norm': True, 'lr': 3.911591415264511e-05, 'weight_decay': 0.0004209286944223204, 'epochs': 200, 'loss': 'mse', 'optimizer': 'adam', 'graph_mode': 'knn', 'source': 'grm', 'knn_k': 6, 'weighted_edges': True, 'symmetrize_mode': 'mutual', 'use_snp_selection': False}. Best is trial 7 with value: 0.12018701237006751.
[I 2025-11-03 14:53:41,079] Trial 39 finished with value: 0.08256460604251656 and parameters: {'model_type': 'graphsage', 'hidden_dims': '[128, 64]', 'dropout': 0.28882999642989843, 'batch_norm': False, 'lr': 0.0003677737626727741, 'weight_decay': 4.4226850869548375e-05, 'epochs': 161, 'loss': 'mae', 'optimizer': 'adam', 'graph_mode': 'knn', 'source': 'grm', 'knn_k': 2, 'weighted_edges': False, 'symmetrize_mode': 'union', 'use_snp_selection': True, 'num_snps': 58379}. Best is trial 7 with value: 0.12018701237006751.
[I 2025-11-03 14:53:43,622] Trial 40 finished with value: 0.10051973228067022 and parameters: {'model_type': 'graphsage', 'hidden_dims': '[256, 128, 64]', 'dropout': 0.3258197142970495, 'batch_norm': True, 'lr': 0.00018542799203000328, 'weight_decay': 0.00010920338164921508, 'epochs': 215, 'loss': 'mse', 'optimizer': 'adam', 'graph_mode': 'cutoff', 'cutoff': 0.5996291576697037, 'grm_norm': 'cosine', 'self_loops': True, 'use_snp_selection': False}. Best is trial 7 with value: 0.12018701237006751.
[I 2025-11-03 14:53:48,089] Trial 41 finished with value: 0.11339740183575632 and parameters: {'model_type': 'graphsage', 'hidden_dims': '[512, 256]', 'dropout': 0.128696838356873, 'batch_norm': True, 'lr': 0.00010228761171382722, 'weight_decay': 2.5136240564172472e-05, 'epochs': 285, 'loss': 'mse', 'optimizer': 'adam', 'graph_mode': 'knn', 'source': 'grm', 'knn_k': 4, 'weighted_edges': True, 'symmetrize_mode': 'mutual', 'use_snp_selection': False}. Best is trial 7 with value: 0.12018701237006751.
[I 2025-11-03 14:53:52,410] Trial 42 finished with value: 0.10867047504572337 and parameters: {'model_type': 'graphsage', 'hidden_dims': '[512, 256]', 'dropout': 0.1632546122367408, 'batch_norm': True, 'lr': 0.00029254905248303037, 'weight_decay': 2.243632166487735e-05, 'epochs': 272, 'loss': 'mse', 'optimizer': 'adam', 'graph_mode': 'knn', 'source': 'grm', 'knn_k': 4, 'weighted_edges': True, 'symmetrize_mode': 'mutual', 'use_snp_selection': False}. Best is trial 7 with value: 0.12018701237006751.
[I 2025-11-03 14:53:54,504] Trial 43 finished with value: 0.10227330427700769 and parameters: {'model_type': 'graphsage', 'hidden_dims': '[128, 64]', 'dropout': 0.3707893694355504, 'batch_norm': True, 'lr': 0.00015415953490035723, 'weight_decay': 2.9897696877288913e-06, 'epochs': 233, 'loss': 'mse', 'optimizer': 'adam', 'graph_mode': 'knn', 'source': 'grm', 'knn_k': 5, 'weighted_edges': True, 'symmetrize_mode': 'mutual', 'use_snp_selection': False}. Best is trial 7 with value: 0.12018701237006751.
[I 2025-11-03 14:53:58,644] Trial 44 finished with value: 0.09603581785084007 and parameters: {'model_type': 'graphsage', 'hidden_dims': '[512, 256]', 'dropout': 0.13682241369052828, 'batch_norm': True, 'lr': 0.0005226591343055468, 'weight_decay': 1.2466124099743462e-05, 'epochs': 250, 'loss': 'mse', 'optimizer': 'adam', 'graph_mode': 'knn', 'source': 'grm', 'knn_k': 3, 'weighted_edges': True, 'symmetrize_mode': 'mutual', 'use_snp_selection': False}. Best is trial 7 with value: 0.12018701237006751.
[I 2025-11-03 14:54:00,822] Trial 45 finished with value: 0.08838033428043564 and parameters: {'model_type': 'graphsage', 'hidden_dims': '[256, 128]', 'dropout': 0.10055524309177126, 'batch_norm': True, 'lr': 3.151702590436011e-05, 'weight_decay': 5.351110388180581e-07, 'epochs': 148, 'loss': 'mae', 'optimizer': 'adam', 'graph_mode': 'knn', 'source': 'grm', 'knn_k': 4, 'weighted_edges': True, 'symmetrize_mode': 'mutual', 'use_snp_selection': False}. Best is trial 7 with value: 0.12018701237006751.
[I 2025-11-03 14:54:05,253] Trial 46 finished with value: 0.10594509755390995 and parameters: {'model_type': 'graphsage', 'hidden_dims': '[512, 64]', 'dropout': 0.18651789594442647, 'batch_norm': True, 'lr': 5.4127622570826494e-05, 'weight_decay': 4.35554839717314e-06, 'epochs': 301, 'loss': 'mse', 'optimizer': 'adam', 'graph_mode': 'cutoff', 'cutoff': 0.42351781247681297, 'grm_norm': 'none', 'self_loops': False, 'use_snp_selection': False}. Best is trial 7 with value: 0.12018701237006751.
[I 2025-11-03 14:54:09,843] Trial 47 finished with value: 0.088716043833225 and parameters: {'model_type': 'graphsage', 'hidden_dims': '[512, 128]', 'dropout': 0.241988508940452, 'batch_norm': False, 'lr': 0.00013327389830746156, 'weight_decay': 6.663438966590111e-06, 'epochs': 260, 'loss': 'mse', 'optimizer': 'adam', 'graph_mode': 'knn', 'source': 'grm', 'knn_k': 7, 'weighted_edges': True, 'symmetrize_mode': 'mutual', 'use_snp_selection': True, 'num_snps': 43485}. Best is trial 7 with value: 0.12018701237006751.
[I 2025-11-03 14:54:13,368] Trial 48 finished with value: 0.11736235846666304 and parameters: {'model_type': 'graphsage', 'hidden_dims': '[512, 256]', 'dropout': 0.15023714738242355, 'batch_norm': True, 'lr': 8.428150100138773e-05, 'weight_decay': 1.2769495802372561e-06, 'epochs': 185, 'loss': 'mse', 'optimizer': 'adam', 'graph_mode': 'cutoff', 'cutoff': 0.7986630605367047, 'grm_norm': 'gcn', 'self_loops': False, 'use_snp_selection': False}. Best is trial 7 with value: 0.12018701237006751.
[I 2025-11-03 14:54:16,951] Trial 49 finished with value: 0.0957468898552367 and parameters: {'model_type': 'graphsage', 'hidden_dims': '[512, 256]', 'dropout': 0.17268875789694363, 'batch_norm': True, 'lr': 0.0008990614286955042, 'weight_decay': 1.2996172367294638e-06, 'epochs': 194, 'loss': 'mae', 'optimizer': 'adam', 'graph_mode': 'cutoff', 'cutoff': 0.8895090898499304, 'grm_norm': 'gcn', 'self_loops': False, 'use_snp_selection': False}. Best is trial 7 with value: 0.12018701237006751.
[I 2025-11-03 14:54:20,769] Trial 50 finished with value: 0.1048049499260722 and parameters: {'model_type': 'graphsage', 'hidden_dims': '[512, 256]', 'dropout': 0.2652860316301122, 'batch_norm': True, 'lr': 0.0004210868769248116, 'weight_decay': 2.3480452337585674e-06, 'epochs': 223, 'loss': 'mse', 'optimizer': 'adam', 'graph_mode': 'cutoff', 'cutoff': 0.7859493200800136, 'grm_norm': 'gcn', 'self_loops': False, 'use_snp_selection': False}. Best is trial 7 with value: 0.12018701237006751.
