[I 2025-11-03 12:48:21,961] Trial 18 finished with value: 0.05613984196902712 and parameters: {'model_type': 'gcn', 'hidden_dims': '[512, 256]', 'dropout': 0.4268935812784051, 'batch_norm': True, 'lr': 1.7884828734025456e-05, 'weight_decay': 8.794937491545104e-06, 'epochs': 260, 'loss': 'mse', 'optimizer': 'adam', 'graph_mode': 'cutoff', 'cutoff': 0.5920313189691022, 'grm_norm': 'gcn', 'self_loops': False, 'use_snp_selection': False}. Best is trial 9 with value: 0.06659124926087946.
[I 2025-11-03 12:48:24,040] Trial 19 finished with value: 0.060161837910061876 and parameters: {'model_type': 'gcn', 'hidden_dims': '[512, 256]', 'dropout': 0.44116545380856886, 'batch_norm': False, 'lr': 7.950690266990195e-05, 'weight_decay': 4.8314949242920706e-06, 'epochs': 254, 'loss': 'mae', 'optimizer': 'adam', 'graph_mode': 'cutoff', 'cutoff': 0.3894480265741518, 'grm_norm': 'gcn', 'self_loops': False, 'use_snp_selection': True, 'num_snps': 16237}. Best is trial 9 with value: 0.06659124926087946.
[I 2025-11-03 12:48:26,260] Trial 20 finished with value: 0.05252297730308049 and parameters: {'model_type': 'gcn', 'hidden_dims': '[512, 256]', 'dropout': 0.46403928297445124, 'batch_norm': False, 'lr': 7.85489418757519e-05, 'weight_decay': 1.4559395726160366e-06, 'epochs': 295, 'loss': 'mae', 'optimizer': 'adam', 'graph_mode': 'cutoff', 'cutoff': 0.3388699950752968, 'grm_norm': 'cosine_then_gcn', 'self_loops': True, 'use_snp_selection': True, 'num_snps': 16410}. Best is trial 9 with value: 0.06659124926087946.
[I 2025-11-03 12:48:28,347] Trial 21 finished with value: 0.00711885579480027 and parameters: {'model_type': 'gcn', 'hidden_dims': '[512, 256]', 'dropout': 0.3731813208027274, 'batch_norm': False, 'lr': 1.852014052562991e-05, 'weight_decay': 5.116947355179461e-06, 'epochs': 257, 'loss': 'mae', 'optimizer': 'adam', 'graph_mode': 'cutoff', 'cutoff': 0.41002918257340853, 'grm_norm': 'gcn', 'self_loops': False, 'use_snp_selection': True, 'num_snps': 15908}. Best is trial 9 with value: 0.06659124926087946.
[I 2025-11-03 12:48:30,779] Trial 22 finished with value: 0.02830059613839273 and parameters: {'model_type': 'gcn', 'hidden_dims': '[512, 256]', 'dropout': 0.31463782539599705, 'batch_norm': False, 'lr': 5.711775988877142e-05, 'weight_decay': 3.988061195661038e-05, 'epochs': 294, 'loss': 'mae', 'optimizer': 'adam', 'graph_mode': 'cutoff', 'cutoff': 0.5456584613869584, 'grm_norm': 'gcn', 'self_loops': False, 'use_snp_selection': True, 'num_snps': 22202}. Best is trial 9 with value: 0.06659124926087946.
[I 2025-11-03 12:48:32,508] Trial 23 finished with value: 0.025025008316468825 and parameters: {'model_type': 'gcn', 'hidden_dims': '[512, 256]', 'dropout': 0.44436130799740414, 'batch_norm': False, 'lr': 4.681154255444208e-06, 'weight_decay': 1.4924106917104117e-05, 'epochs': 228, 'loss': 'mae', 'optimizer': 'adam', 'graph_mode': 'cutoff', 'cutoff': 0.2846810121985348, 'grm_norm': 'gcn', 'self_loops': False, 'use_snp_selection': True, 'num_snps': 10357}. Best is trial 9 with value: 0.06659124926087946.
[I 2025-11-03 12:48:35,936] Trial 24 finished with value: 0.04923266160938772 and parameters: {'model_type': 'gcn', 'hidden_dims': '[512, 256]', 'dropout': 0.39253207951784347, 'batch_norm': False, 'lr': 0.00015649624794451407, 'weight_decay': 3.185829872383896e-06, 'epochs': 335, 'loss': 'mae', 'optimizer': 'adam', 'graph_mode': 'cutoff', 'cutoff': 0.4489829370557827, 'grm_norm': 'gcn', 'self_loops': False, 'use_snp_selection': True, 'num_snps': 38821}. Best is trial 9 with value: 0.06659124926087946.
[I 2025-11-03 12:48:37,829] Trial 25 finished with value: -0.0026811333585262873 and parameters: {'model_type': 'gcn', 'hidden_dims': '[256, 128]', 'dropout': 0.4711538436675908, 'batch_norm': False, 'lr': 1.2480346597508582e-05, 'weight_decay': 7.893847372804498e-06, 'epochs': 257, 'loss': 'mae', 'optimizer': 'adam', 'graph_mode': 'cutoff', 'cutoff': 0.3383502517538436, 'grm_norm': 'cosine', 'self_loops': False, 'use_snp_selection': True, 'num_snps': 13250}. Best is trial 9 with value: 0.06659124926087946.
[I 2025-11-03 12:48:40,626] Trial 26 finished with value: 0.023637397107853324 and parameters: {'model_type': 'gcn', 'hidden_dims': '[512, 64]', 'dropout': 0.30163987278627263, 'batch_norm': True, 'lr': 3.510788485691285e-06, 'weight_decay': 4.1605385376434736e-07, 'epochs': 279, 'loss': 'mse', 'optimizer': 'adam', 'graph_mode': 'knn', 'source': 'grm', 'knn_k': 10, 'weighted_edges': False, 'symmetrize_mode': 'union', 'use_snp_selection': False}. Best is trial 9 with value: 0.06659124926087946.
[I 2025-11-03 12:48:42,958] Trial 27 finished with value: 0.014544787655300996 and parameters: {'model_type': 'gcn', 'hidden_dims': '[256, 128, 64]', 'dropout': 0.3465205458541816, 'batch_norm': False, 'lr': 2.7377853655679113e-05, 'weight_decay': 7.999903858968592e-05, 'epochs': 206, 'loss': 'mae', 'optimizer': 'adam', 'graph_mode': 'cutoff', 'cutoff': 0.6151690732976375, 'grm_norm': 'none', 'self_loops': False, 'use_snp_selection': True, 'num_snps': 24870}. Best is trial 9 with value: 0.06659124926087946.
[I 2025-11-03 12:48:44,947] Trial 28 finished with value: 0.033763375907831225 and parameters: {'model_type': 'gcn', 'hidden_dims': '[512, 128]', 'dropout': 0.5749822693823109, 'batch_norm': True, 'lr': 9.788905749566376e-05, 'weight_decay': 1.6858821921848408e-06, 'epochs': 131, 'loss': 'mse', 'optimizer': 'adam', 'graph_mode': 'cutoff', 'cutoff': 0.39632345570375294, 'grm_norm': 'cosine_then_gcn', 'self_loops': True, 'use_snp_selection': False}. Best is trial 9 with value: 0.06659124926087946.
[I 2025-11-03 12:48:47,053] Trial 29 finished with value: 0.06396348120725631 and parameters: {'model_type': 'gcn', 'hidden_dims': '[128, 64]', 'dropout': 0.4231191278518485, 'batch_norm': True, 'lr': 5.107037620841206e-05, 'weight_decay': 3.8226919977699045e-05, 'epochs': 346, 'loss': 'mae', 'optimizer': 'adam', 'graph_mode': 'knn', 'source': 'grm', 'knn_k': 3, 'weighted_edges': False, 'symmetrize_mode': 'union', 'use_snp_selection': False}. Best is trial 9 with value: 0.06659124926087946.
[I 2025-11-03 12:48:49,874] Trial 30 finished with value: 0.033877266485759 and parameters: {'model_type': 'gcn', 'hidden_dims': '[128, 64]', 'dropout': 0.4907687769594799, 'batch_norm': False, 'lr': 0.00017172301669153724, 'weight_decay': 3.5973660615865955e-05, 'epochs': 346, 'loss': 'mae', 'optimizer': 'adam', 'graph_mode': 'knn', 'source': 'grm', 'knn_k': 4, 'weighted_edges': False, 'symmetrize_mode': 'union', 'use_snp_selection': True, 'num_snps': 35107}. Best is trial 9 with value: 0.06659124926087946.
[I 2025-11-03 12:48:51,912] Trial 31 finished with value: 0.018973870648722264 and parameters: {'model_type': 'gcn', 'hidden_dims': '[128, 64]', 'dropout': 0.43485533332260184, 'batch_norm': True, 'lr': 4.6432624879610924e-05, 'weight_decay': 8.544407954201187e-05, 'epochs': 321, 'loss': 'mae', 'optimizer': 'adam', 'graph_mode': 'knn', 'source': 'grm', 'knn_k': 4, 'weighted_edges': False, 'symmetrize_mode': 'union', 'use_snp_selection': False}. Best is trial 9 with value: 0.06659124926087946.
[I 2025-11-03 12:48:53,939] Trial 32 finished with value: -0.029153154252708598 and parameters: {'model_type': 'gcn', 'hidden_dims': '[128, 64]', 'dropout': 0.4025679949440325, 'batch_norm': True, 'lr': 6.384200881373149e-06, 'weight_decay': 3.514391702263353e-05, 'epochs': 321, 'loss': 'mae', 'optimizer': 'adam', 'graph_mode': 'knn', 'source': 'grm', 'knn_k': 3, 'weighted_edges': False, 'symmetrize_mode': 'union', 'use_snp_selection': False}. Best is trial 9 with value: 0.06659124926087946.
[I 2025-11-03 12:48:55,827] Trial 33 finished with value: -0.0014136631249191639 and parameters: {'model_type': 'gcn', 'hidden_dims': '[128, 64]', 'dropout': 0.3758771731188386, 'batch_norm': True, 'lr': 1.1698210525765902e-05, 'weight_decay': 9.869917301704838e-06, 'epochs': 277, 'loss': 'mae', 'optimizer': 'adam', 'graph_mode': 'knn', 'source': 'grm', 'knn_k': 3, 'weighted_edges': True, 'symmetrize_mode': 'union', 'use_snp_selection': False}. Best is trial 9 with value: 0.06659124926087946.
[I 2025-11-03 12:48:58,839] Trial 34 finished with value: -0.025910837132419155 and parameters: {'model_type': 'gcn', 'hidden_dims': '[512, 256]', 'dropout': 0.4196365734873878, 'batch_norm': True, 'lr': 2.4495013104805403e-05, 'weight_decay': 0.0002747942807856569, 'epochs': 317, 'loss': 'mae', 'optimizer': 'adam', 'graph_mode': 'knn', 'source': 'grm', 'knn_k': 10, 'weighted_edges': False, 'symmetrize_mode': 'union', 'use_snp_selection': False}. Best is trial 9 with value: 0.06659124926087946.
[I 2025-11-03 12:49:00,004] Trial 35 finished with value: 0.017441334232948018 and parameters: {'model_type': 'gcn', 'hidden_dims': '[128, 64]', 'dropout': 0.5372847681731148, 'batch_norm': True, 'lr': 5.546622482096214e-05, 'weight_decay': 3.678501798458785e-06, 'epochs': 52, 'loss': 'mse', 'optimizer': 'adam', 'graph_mode': 'knn', 'source': 'grm', 'knn_k': 5, 'weighted_edges': False, 'symmetrize_mode': 'union', 'use_snp_selection': False}. Best is trial 9 with value: 0.06659124926087946.
[I 2025-11-03 12:49:01,840] Trial 36 finished with value: 0.01593360060959137 and parameters: {'model_type': 'gcn', 'hidden_dims': '[256, 128]', 'dropout': 0.34506259040966764, 'batch_norm': True, 'lr': 3.7198007574291304e-05, 'weight_decay': 2.6775206606144967e-05, 'epochs': 191, 'loss': 'mae', 'optimizer': 'adam', 'graph_mode': 'knn', 'source': 'grm', 'knn_k': 2, 'weighted_edges': True, 'symmetrize_mode': 'mutual', 'use_snp_selection': False}. Best is trial 9 with value: 0.06659124926087946.
[I 2025-11-03 12:49:03,724] Trial 37 finished with value: 0.010417722105734249 and parameters: {'model_type': 'gcn', 'hidden_dims': '[256, 128, 64]', 'dropout': 0.4585481252961241, 'batch_norm': False, 'lr': 0.0009781345626285317, 'weight_decay': 1.5429218551782782e-05, 'epochs': 231, 'loss': 'mse', 'optimizer': 'adam', 'graph_mode': 'cutoff', 'cutoff': 0.48762298840821233, 'grm_norm': 'gcn', 'self_loops': False, 'use_snp_selection': True, 'num_snps': 8205}. Best is trial 9 with value: 0.06659124926087946.
[I 2025-11-03 12:49:04,874] Trial 38 finished with value: -0.02561490573238888 and parameters: {'model_type': 'gcn', 'hidden_dims': '[512, 256]', 'dropout': 0.5388072348995446, 'batch_norm': False, 'lr': 0.00029754742168112985, 'weight_decay': 5.123620498698759e-05, 'epochs': 82, 'loss': 'mae', 'optimizer': 'adam', 'graph_mode': 'knn', 'source': 'grm', 'knn_k': 8, 'weighted_edges': False, 'symmetrize_mode': 'union', 'use_snp_selection': True, 'num_snps': 2537}. Best is trial 9 with value: 0.06659124926087946.
[I 2025-11-03 12:49:06,369] Trial 39 finished with value: 0.015806008313061747 and parameters: {'model_type': 'gcn', 'hidden_dims': '[128, 64]', 'dropout': 0.4090916535953034, 'batch_norm': True, 'lr': 1.7803943140710877e-05, 'weight_decay': 0.00013061290900623357, 'epochs': 165, 'loss': 'mae', 'optimizer': 'adam', 'graph_mode': 'cutoff', 'cutoff': 0.20571050227168952, 'grm_norm': 'gcn', 'self_loops': False, 'use_snp_selection': False}. Best is trial 9 with value: 0.06659124926087946.
[I 2025-11-03 12:49:07,653] Trial 40 finished with value: 0.04843463551134461 and parameters: {'model_type': 'gcn', 'hidden_dims': '[512, 256]', 'dropout': 0.2853479738069612, 'batch_norm': True, 'lr': 0.00012459287449718368, 'weight_decay': 2.205722768188561e-05, 'epochs': 3, 'loss': 'mse', 'optimizer': 'adam', 'graph_mode': 'cutoff', 'cutoff': 0.3057168212184874, 'grm_norm': 'cosine_then_gcn', 'self_loops': False, 'use_snp_selection': False}. Best is trial 9 with value: 0.06659124926087946.
[I 2025-11-03 12:49:10,049] Trial 41 finished with value: 0.0253308900504528 and parameters: {'model_type': 'gcn', 'hidden_dims': '[512, 256]', 'dropout': 0.48533177059721383, 'batch_norm': False, 'lr': 7.299544893421003e-05, 'weight_decay': 1.4679726806026635e-06, 'epochs': 300, 'loss': 'mae', 'optimizer': 'adam', 'graph_mode': 'cutoff', 'cutoff': 0.347406027490814, 'grm_norm': 'cosine_then_gcn', 'self_loops': True, 'use_snp_selection': True, 'num_snps': 19540}. Best is trial 9 with value: 0.06659124926087946.
[I 2025-11-03 12:49:12,033] Trial 42 finished with value: 0.032903791416515456 and parameters: {'model_type': 'gcn', 'hidden_dims': '[512, 256]', 'dropout': 0.4488553402733211, 'batch_norm': False, 'lr': 3.0427391687802047e-05, 'weight_decay': 8.148002269067291e-07, 'epochs': 274, 'loss': 'mae', 'optimizer': 'adam', 'graph_mode': 'cutoff', 'cutoff': 0.3801871944622816, 'grm_norm': 'cosine_then_gcn', 'self_loops': True, 'use_snp_selection': True, 'num_snps': 12427}. Best is trial 9 with value: 0.06659124926087946.
[I 2025-11-03 12:49:14,543] Trial 43 finished with value: -0.008967299192846815 and parameters: {'model_type': 'gcn', 'hidden_dims': '[512, 256]', 'dropout': 0.3741066089505542, 'batch_norm': False, 'lr': 6.984998234279138e-05, 'weight_decay': 2.601489980000073e-06, 'epochs': 346, 'loss': 'mae', 'optimizer': 'adam', 'graph_mode': 'cutoff', 'cutoff': 0.27941985332235847, 'grm_norm': 'cosine_then_gcn', 'self_loops': True, 'use_snp_selection': True, 'num_snps': 19329}. Best is trial 9 with value: 0.06659124926087946.
[I 2025-11-03 12:49:16,670] Trial 44 finished with value: -0.02331323378170541 and parameters: {'model_type': 'gcn', 'hidden_dims': '[512, 256]', 'dropout': 0.5067517327742869, 'batch_norm': False, 'lr': 0.00010275834168858907, 'weight_decay': 1.0638461280748838e-06, 'epochs': 110, 'loss': 'mae', 'optimizer': 'adam', 'graph_mode': 'cutoff', 'cutoff': 0.6256425499096449, 'grm_norm': 'cosine_then_gcn', 'self_loops': True, 'use_snp_selection': True, 'num_snps': 28264}. Best is trial 9 with value: 0.06659124926087946.
[I 2025-11-03 12:49:18,710] Trial 45 finished with value: 0.020022022915975227 and parameters: {'model_type': 'gcn', 'hidden_dims': '[256, 128]', 'dropout': 0.48682674588461083, 'batch_norm': False, 'lr': 0.0002441599557387693, 'weight_decay': 5.53314539329784e-06, 'epochs': 309, 'loss': 'mae', 'optimizer': 'adam', 'graph_mode': 'cutoff', 'cutoff': 0.5774675519507224, 'grm_norm': 'gcn', 'self_loops': True, 'use_snp_selection': True, 'num_snps': 13675}. Best is trial 9 with value: 0.06659124926087946.
[I 2025-11-03 12:49:21,199] Trial 46 finished with value: 0.053519240111430416 and parameters: {'model_type': 'gcn', 'hidden_dims': '[512, 128]', 'dropout': 0.24318550824042118, 'batch_norm': False, 'lr': 4.583425193543202e-05, 'weight_decay': 4.785578974743143e-07, 'epochs': 286, 'loss': 'mse', 'optimizer': 'adam', 'graph_mode': 'cutoff', 'cutoff': 0.5241202761462198, 'grm_norm': 'cosine', 'self_loops': False, 'use_snp_selection': True, 'num_snps': 23623}. Best is trial 9 with value: 0.06659124926087946.
[I 2025-11-03 12:49:23,584] Trial 47 finished with value: 0.05417115253962105 and parameters: {'model_type': 'gcn', 'hidden_dims': '[512, 128]', 'dropout': 0.22977579942702053, 'batch_norm': False, 'lr': 4.0000795747215506e-05, 'weight_decay': 2.1930466838532376e-07, 'epochs': 244, 'loss': 'mse', 'optimizer': 'adam', 'graph_mode': 'knn', 'source': 'grm', 'knn_k': 5, 'weighted_edges': False, 'symmetrize_mode': 'union', 'use_snp_selection': True, 'num_snps': 23122}. Best is trial 9 with value: 0.06659124926087946.
[I 2025-11-03 12:49:26,090] Trial 48 finished with value: 0.011250843728563739 and parameters: {'model_type': 'gcn', 'hidden_dims': '[512, 128]', 'dropout': 0.173040392250072, 'batch_norm': True, 'lr': 1.1268668551436562e-05, 'weight_decay': 0.000859327516751154, 'epochs': 223, 'loss': 'mse', 'optimizer': 'adam', 'graph_mode': 'knn', 'source': 'grm', 'knn_k': 5, 'weighted_edges': False, 'symmetrize_mode': 'union', 'use_snp_selection': False}. Best is trial 9 with value: 0.06659124926087946.
[I 2025-11-03 12:49:28,981] Trial 49 finished with value: 0.05554784938199712 and parameters: {'model_type': 'gcn', 'hidden_dims': '[512, 128]', 'dropout': 0.22923271720441257, 'batch_norm': False, 'lr': 2.2110066934338026e-05, 'weight_decay': 1.872809586618044e-07, 'epochs': 266, 'loss': 'mse', 'optimizer': 'adam', 'graph_mode': 'knn', 'source': 'grm', 'knn_k': 3, 'weighted_edges': False, 'symmetrize_mode': 'union', 'use_snp_selection': True, 'num_snps': 32990}. Best is trial 9 with value: 0.06659124926087946.
[I 2025-11-03 12:49:31,693] Trial 50 finished with value: 0.030681523024921116 and parameters: {'model_type': 'gcn', 'hidden_dims': '[512, 64]', 'dropout': 0.14391939073866755, 'batch_norm': True, 'lr': 6.228681381340129e-06, 'weight_decay': 1.492632440945769e-07, 'epochs': 262, 'loss': 'mse', 'optimizer': 'adam', 'graph_mode': 'knn', 'source': 'grm', 'knn_k': 3, 'weighted_edges': False, 'symmetrize_mode': 'union', 'use_snp_selection': False}. Best is trial 9 with value: 0.06659124926087946.
[I 2025-11-03 12:49:34,228] Trial 51 finished with value: 0.01879244719636826 and parameters: {'model_type': 'gcn', 'hidden_dims': '[512, 128]', 'dropout': 0.21665895784647624, 'batch_norm': False, 'lr': 2.0387915679069064e-05, 'weight_decay': 1.5288261048888512e-07, 'epochs': 154, 'loss': 'mse', 'optimizer': 'adam', 'graph_mode': 'knn', 'source': 'grm', 'knn_k': 4, 'weighted_edges': False, 'symmetrize_mode': 'union', 'use_snp_selection': True, 'num_snps': 33618}. Best is trial 9 with value: 0.06659124926087946.
[I 2025-11-03 12:49:36,968] Trial 52 finished with value: 0.04950683048452628 and parameters: {'model_type': 'gcn', 'hidden_dims': '[512, 128]', 'dropout': 0.19400648297777467, 'batch_norm': False, 'lr': 3.5509692383814137e-05, 'weight_decay': 2.4789430056368535e-07, 'epochs': 250, 'loss': 'mse', 'optimizer': 'adam', 'graph_mode': 'knn', 'source': 'grm', 'knn_k': 2, 'weighted_edges': False, 'symmetrize_mode': 'union', 'use_snp_selection': True, 'num_snps': 30397}. Best is trial 9 with value: 0.06659124926087946.
[I 2025-11-03 12:49:39,314] Trial 53 finished with value: 0.02733776759641919 and parameters: {'model_type': 'gcn', 'hidden_dims': '[512, 128]', 'dropout': 0.2300041009944226, 'batch_norm': False, 'lr': 2.1772142350313764e-06, 'weight_decay': 2.1675305413671884e-07, 'epochs': 182, 'loss': 'mse', 'optimizer': 'adam', 'graph_mode': 'knn', 'source': 'grm', 'knn_k': 6, 'weighted_edges': False, 'symmetrize_mode': 'union', 'use_snp_selection': True, 'num_snps': 26496}. Best is trial 9 with value: 0.06659124926087946.
[I 2025-11-03 12:49:41,615] Trial 54 finished with value: 0.051139199485203256 and parameters: {'model_type': 'gcn', 'hidden_dims': '[512, 128]', 'dropout': 0.2867903214061083, 'batch_norm': False, 'lr': 6.174113675757354e-05, 'weight_decay': 2.950769193340189e-07, 'epochs': 247, 'loss': 'mse', 'optimizer': 'adam', 'graph_mode': 'knn', 'source': 'grm', 'knn_k': 2, 'weighted_edges': False, 'symmetrize_mode': 'union', 'use_snp_selection': True, 'num_snps': 20994}. Best is trial 9 with value: 0.06659124926087946.
[I 2025-11-03 12:49:44,718] Trial 55 finished with value: 0.020055879494608752 and parameters: {'model_type': 'gcn', 'hidden_dims': '[512, 128]', 'dropout': 0.25997959170419643, 'batch_norm': False, 'lr': 1.5915137482021504e-05, 'weight_decay': 1.0676527338218405e-07, 'epochs': 266, 'loss': 'mse', 'optimizer': 'adam', 'graph_mode': 'knn', 'source': 'grm', 'knn_k': 4, 'weighted_edges': False, 'symmetrize_mode': 'union', 'use_snp_selection': True, 'num_snps': 36795}. Best is trial 9 with value: 0.06659124926087946.
[I 2025-11-03 12:49:47,898] Trial 56 finished with value: 0.037755133484270974 and parameters: {'model_type': 'gcn', 'hidden_dims': '[512, 128]', 'dropout': 0.32858005269778173, 'batch_norm': False, 'lr': 2.4975714606360753e-05, 'weight_decay': 0.00027223785209197065, 'epochs': 218, 'loss': 'mse', 'optimizer': 'adam', 'graph_mode': 'knn', 'source': 'grm', 'knn_k': 5, 'weighted_edges': False, 'symmetrize_mode': 'union', 'use_snp_selection': True, 'num_snps': 41405}. Best is trial 9 with value: 0.06659124926087946.
[I 2025-11-03 12:49:50,578] Trial 57 finished with value: 0.043715442917587985 and parameters: {'model_type': 'gcn', 'hidden_dims': '[256, 128, 64]', 'dropout': 0.17976559066411366, 'batch_norm': False, 'lr': 4.45608210335371e-05, 'weight_decay': 1.2599193769355934e-05, 'epochs': 240, 'loss': 'mse', 'optimizer': 'adam', 'graph_mode': 'knn', 'source': 'grm', 'knn_k': 3, 'weighted_edges': False, 'symmetrize_mode': 'union', 'use_snp_selection': True, 'num_snps': 29220}. Best is trial 9 with value: 0.06659124926087946.
[I 2025-11-03 12:49:52,623] Trial 58 finished with value: -0.025892066094394584 and parameters: {'model_type': 'gcn', 'hidden_dims': '[512, 64]', 'dropout': 0.42704034922734274, 'batch_norm': True, 'lr': 1.3857699686811886e-05, 'weight_decay': 7.412169050114619e-06, 'epochs': 137, 'loss': 'mse', 'optimizer': 'adam', 'graph_mode': 'knn', 'source': 'grm', 'knn_k': 7, 'weighted_edges': False, 'symmetrize_mode': 'union', 'use_snp_selection': False}. Best is trial 9 with value: 0.06659124926087946.
[I 2025-11-03 12:49:55,653] Trial 59 finished with value: 0.014757744911260187 and parameters: {'model_type': 'gcn', 'hidden_dims': '[128, 64]', 'dropout': 0.2738005631361277, 'batch_norm': False, 'lr': 1.3897755470756385e-06, 'weight_decay': 0.00010136230764414373, 'epochs': 214, 'loss': 'mse', 'optimizer': 'adam', 'graph_mode': 'knn', 'source': 'grm', 'knn_k': 2, 'weighted_edges': True, 'symmetrize_mode': 'mutual', 'use_snp_selection': True, 'num_snps': 53568}. Best is trial 9 with value: 0.06659124926087946.
[I 2025-11-03 12:49:57,216] Trial 60 finished with value: 0.014529112328881068 and parameters: {'model_type': 'gcn', 'hidden_dims': '[512, 256]', 'dropout': 0.22050041984942662, 'batch_norm': False, 'lr': 3.3241038235302406e-06, 'weight_decay': 6.182650461959145e-07, 'epochs': 194, 'loss': 'mse', 'optimizer': 'adam', 'graph_mode': 'cutoff', 'cutoff': 0.7585901132123708, 'grm_norm': 'none', 'self_loops': False, 'use_snp_selection': True, 'num_snps': 8531}. Best is trial 9 with value: 0.06659124926087946.
