[I 2025-11-03 12:21:46,040] Trial 93 finished with value: 0.07669916984826422 and parameters: {'model_type': 'gcn', 'hidden_dims': '[256, 128, 64]', 'dropout': 0.4174264554334282, 'batch_norm': True, 'lr': 0.00030534786741244827, 'weight_decay': 0.00011185674373389785, 'epochs': 188, 'loss': 'mae', 'optimizer': 'adam', 'graph_mode': 'off', 'use_snp_selection': False}. Best is trial 54 with value: 0.08969683603280788.
[I 2025-11-03 12:21:47,543] Trial 94 finished with value: 0.04360828832042279 and parameters: {'model_type': 'gcn', 'hidden_dims': '[256, 128, 64]', 'dropout': 0.4041274902754033, 'batch_norm': False, 'lr': 0.0007233293809762107, 'weight_decay': 2.7551024046296294e-07, 'epochs': 231, 'loss': 'mae', 'optimizer': 'adam', 'graph_mode': 'off', 'use_snp_selection': False}. Best is trial 54 with value: 0.08969683603280788.
[I 2025-11-03 12:21:49,034] Trial 95 finished with value: 0.07936931747663369 and parameters: {'model_type': 'gcn', 'hidden_dims': '[256, 128, 64]', 'dropout': 0.5149739610953326, 'batch_norm': True, 'lr': 0.0005343580420937792, 'weight_decay': 0.00031457699900199593, 'epochs': 212, 'loss': 'mae', 'optimizer': 'adam', 'graph_mode': 'off', 'use_snp_selection': False}. Best is trial 54 with value: 0.08969683603280788.
[I 2025-11-03 12:21:50,208] Trial 96 finished with value: 0.08911506222954266 and parameters: {'model_type': 'gcn', 'hidden_dims': '[512, 64]', 'dropout': 0.5904347999205949, 'batch_norm': True, 'lr': 0.0006221668490045337, 'weight_decay': 0.0005475063212848997, 'epochs': 78, 'loss': 'mae', 'optimizer': 'adam', 'graph_mode': 'off', 'use_snp_selection': False}. Best is trial 54 with value: 0.08969683603280788.
[I 2025-11-03 12:21:51,605] Trial 97 finished with value: 0.06882334379401059 and parameters: {'model_type': 'gcn', 'hidden_dims': '[512, 64]', 'dropout': 0.5742896961103224, 'batch_norm': True, 'lr': 0.0006198203474674235, 'weight_decay': 0.000652926302996077, 'epochs': 124, 'loss': 'mae', 'optimizer': 'adam', 'graph_mode': 'off', 'use_snp_selection': False}. Best is trial 54 with value: 0.08969683603280788.
[I 2025-11-03 12:21:53,641] Trial 98 finished with value: 0.07660761257146445 and parameters: {'model_type': 'gcn', 'hidden_dims': '[512, 64]', 'dropout': 0.5633401149037703, 'batch_norm': True, 'lr': 0.0008066500434947086, 'weight_decay': 0.0006903969996364898, 'epochs': 254, 'loss': 'mae', 'optimizer': 'adam', 'graph_mode': 'off', 'use_snp_selection': False}. Best is trial 54 with value: 0.08969683603280788.
[I 2025-11-03 12:21:54,739] Trial 99 finished with value: 0.07135913620019052 and parameters: {'model_type': 'gcn', 'hidden_dims': '[512, 64]', 'dropout': 0.48624001423290397, 'batch_norm': True, 'lr': 0.0009856937869028577, 'weight_decay': 0.000991801166583101, 'epochs': 62, 'loss': 'mae', 'optimizer': 'adam', 'graph_mode': 'off', 'use_snp_selection': False}. Best is trial 54 with value: 0.08969683603280788.
[I 2025-11-03 12:21:55,908] Trial 100 finished with value: 0.063215950007737 and parameters: {'model_type': 'gcn', 'hidden_dims': '[512, 64]', 'dropout': 0.5633836966610063, 'batch_norm': True, 'lr': 0.0003703711802509903, 'weight_decay': 0.0004082671445679744, 'epochs': 89, 'loss': 'mae', 'optimizer': 'adam', 'graph_mode': 'off', 'use_snp_selection': False}. Best is trial 54 with value: 0.08969683603280788.
[I 2025-11-03 12:21:57,085] Trial 101 finished with value: 0.0657327643569631 and parameters: {'model_type': 'gcn', 'hidden_dims': '[512, 128]', 'dropout': 0.3906998408666944, 'batch_norm': True, 'lr': 0.0004957607177549383, 'weight_decay': 0.0005137542920001817, 'epochs': 81, 'loss': 'mae', 'optimizer': 'adam', 'graph_mode': 'off', 'use_snp_selection': False}. Best is trial 54 with value: 0.08969683603280788.
[I 2025-11-03 12:21:58,419] Trial 102 finished with value: 0.06668081178556468 and parameters: {'model_type': 'gcn', 'hidden_dims': '[512, 256]', 'dropout': 0.4657043066901488, 'batch_norm': True, 'lr': 0.0006560284834028388, 'weight_decay': 0.00014165123022903667, 'epochs': 111, 'loss': 'mae', 'optimizer': 'adam', 'graph_mode': 'off', 'use_snp_selection': False}. Best is trial 54 with value: 0.08969683603280788.
[I 2025-11-03 12:21:59,707] Trial 103 finished with value: -0.016900288627373878 and parameters: {'model_type': 'gcn', 'hidden_dims': '[256, 128, 64]', 'dropout': 0.5513847938372518, 'batch_norm': False, 'lr': 0.00042723716347768106, 'weight_decay': 4.7809996872007524e-05, 'epochs': 170, 'loss': 'mae', 'optimizer': 'adam', 'graph_mode': 'off', 'use_snp_selection': False}. Best is trial 54 with value: 0.08969683603280788.
[I 2025-11-03 12:22:01,075] Trial 104 finished with value: 0.05006470754355183 and parameters: {'model_type': 'gcn', 'hidden_dims': '[128, 64]', 'dropout': 0.581295506056894, 'batch_norm': True, 'lr': 0.0005732279676048737, 'weight_decay': 0.00023464681236176057, 'epochs': 325, 'loss': 'mae', 'optimizer': 'adam', 'graph_mode': 'off', 'use_snp_selection': False}. Best is trial 54 with value: 0.08969683603280788.
[I 2025-11-03 12:22:02,066] Trial 105 finished with value: 0.07448838533228319 and parameters: {'model_type': 'gcn', 'hidden_dims': '[512, 64]', 'dropout': 0.5906643124332328, 'batch_norm': True, 'lr': 0.0008309401724506302, 'weight_decay': 9.795166891202108e-05, 'epochs': 45, 'loss': 'mae', 'optimizer': 'adam', 'graph_mode': 'off', 'use_snp_selection': False}. Best is trial 54 with value: 0.08969683603280788.
[I 2025-11-03 12:22:03,397] Trial 106 finished with value: 0.0760638383112062 and parameters: {'model_type': 'gcn', 'hidden_dims': '[128, 64]', 'dropout': 0.3486436927782374, 'batch_norm': True, 'lr': 0.00022348855925895893, 'weight_decay': 7.329757366655717e-05, 'epochs': 307, 'loss': 'mae', 'optimizer': 'adam', 'graph_mode': 'off', 'use_snp_selection': False}. Best is trial 54 with value: 0.08969683603280788.
[I 2025-11-03 12:22:04,506] Trial 107 finished with value: 0.05437414381583275 and parameters: {'model_type': 'gcn', 'hidden_dims': '[128, 64]', 'dropout': 0.45444224916102655, 'batch_norm': True, 'lr': 0.00029745222355550215, 'weight_decay': 0.0003269008512943955, 'epochs': 226, 'loss': 'mse', 'optimizer': 'adam', 'graph_mode': 'off', 'use_snp_selection': False}. Best is trial 54 with value: 0.08969683603280788.
[I 2025-11-03 12:22:05,981] Trial 108 finished with value: 0.07496364325716487 and parameters: {'model_type': 'gcn', 'hidden_dims': '[256, 128, 64]', 'dropout': 0.591702213810532, 'batch_norm': False, 'lr': 0.000700433802520513, 'weight_decay': 0.00017682711575053544, 'epochs': 298, 'loss': 'mae', 'optimizer': 'adam', 'graph_mode': 'off', 'use_snp_selection': True, 'num_snps': 9040}. Best is trial 54 with value: 0.08969683603280788.
[I 2025-11-03 12:22:08,490] Trial 109 finished with value: 0.07339367912104801 and parameters: {'model_type': 'gcn', 'hidden_dims': '[512, 256]', 'dropout': 0.4388000645636584, 'batch_norm': True, 'lr': 0.0004627785738121873, 'weight_decay': 1.3515144851304146e-05, 'epochs': 344, 'loss': 'mae', 'optimizer': 'adam', 'graph_mode': 'off', 'use_snp_selection': False}. Best is trial 54 with value: 0.08969683603280788.
[I 2025-11-03 12:22:10,753] Trial 110 finished with value: 0.013259996029359289 and parameters: {'model_type': 'gcn', 'hidden_dims': '[256, 128]', 'dropout': 0.2946461813995024, 'batch_norm': True, 'lr': 1.1867792730745386e-05, 'weight_decay': 1.0673774969110604e-07, 'epochs': 280, 'loss': 'mae', 'optimizer': 'adam', 'graph_mode': 'off', 'use_snp_selection': True, 'num_snps': 52924}. Best is trial 54 with value: 0.08969683603280788.
[I 2025-11-03 12:22:12,221] Trial 111 finished with value: 0.06802053067588118 and parameters: {'model_type': 'gcn', 'hidden_dims': '[256, 128, 64]', 'dropout': 0.32052466307037847, 'batch_norm': True, 'lr': 0.0006556927185306043, 'weight_decay': 0.0004077468744006708, 'epochs': 201, 'loss': 'mae', 'optimizer': 'adam', 'graph_mode': 'off', 'use_snp_selection': False}. Best is trial 54 with value: 0.08969683603280788.
[I 2025-11-03 12:22:13,590] Trial 112 finished with value: 0.08028411715237965 and parameters: {'model_type': 'gcn', 'hidden_dims': '[256, 128, 64]', 'dropout': 0.48279024620019, 'batch_norm': True, 'lr': 0.0007394117247717722, 'weight_decay': 7.717042746828628e-06, 'epochs': 184, 'loss': 'mae', 'optimizer': 'adam', 'graph_mode': 'off', 'use_snp_selection': False}. Best is trial 54 with value: 0.08969683603280788.
[I 2025-11-03 12:22:14,865] Trial 113 finished with value: 0.06718455498318009 and parameters: {'model_type': 'gcn', 'hidden_dims': '[256, 128, 64]', 'dropout': 0.5323700738665594, 'batch_norm': True, 'lr': 0.0005257208926173797, 'weight_decay': 0.00030883633268954404, 'epochs': 160, 'loss': 'mae', 'optimizer': 'adam', 'graph_mode': 'off', 'use_snp_selection': False}. Best is trial 54 with value: 0.08969683603280788.
[I 2025-11-03 12:22:16,298] Trial 114 finished with value: 0.05729303404963103 and parameters: {'model_type': 'gcn', 'hidden_dims': '[256, 128, 64]', 'dropout': 0.4939271545460792, 'batch_norm': True, 'lr': 0.0008695179677386541, 'weight_decay': 0.00012961219526613394, 'epochs': 197, 'loss': 'mae', 'optimizer': 'adam', 'graph_mode': 'off', 'use_snp_selection': False}. Best is trial 54 with value: 0.08969683603280788.
[I 2025-11-03 12:22:17,368] Trial 115 finished with value: 0.05928733850775668 and parameters: {'model_type': 'gcn', 'hidden_dims': '[128, 64]', 'dropout': 0.36357246009023064, 'batch_norm': True, 'lr': 0.00034042950998195966, 'weight_decay': 0.00046036369151916516, 'epochs': 211, 'loss': 'mae', 'optimizer': 'adam', 'graph_mode': 'off', 'use_snp_selection': False}. Best is trial 54 with value: 0.08969683603280788.
[I 2025-11-03 12:22:18,455] Trial 116 finished with value: 0.0656739671932982 and parameters: {'model_type': 'gcn', 'hidden_dims': '[128, 64]', 'dropout': 0.5224735836045571, 'batch_norm': True, 'lr': 0.00045469179231645123, 'weight_decay': 0.0006144117975152561, 'epochs': 220, 'loss': 'mae', 'optimizer': 'adam', 'graph_mode': 'off', 'use_snp_selection': False}. Best is trial 54 with value: 0.08969683603280788.
[I 2025-11-03 12:22:20,684] Trial 117 finished with value: 0.07167445172729942 and parameters: {'model_type': 'gcn', 'hidden_dims': '[256, 128, 64]', 'dropout': 0.40130094312927245, 'batch_norm': True, 'lr': 0.0007454390502187351, 'weight_decay': 6.333192847755357e-05, 'epochs': 332, 'loss': 'mae', 'optimizer': 'adam', 'graph_mode': 'off', 'use_snp_selection': True, 'num_snps': 34521}. Best is trial 54 with value: 0.08969683603280788.
[I 2025-11-03 12:22:23,093] Trial 118 finished with value: 0.055244815957022644 and parameters: {'model_type': 'gcn', 'hidden_dims': '[512, 128]', 'dropout': 0.4158292496492212, 'batch_norm': False, 'lr': 0.0005937052137989265, 'weight_decay': 0.00035362917671440564, 'epochs': 317, 'loss': 'mae', 'optimizer': 'adam', 'graph_mode': 'off', 'use_snp_selection': False}. Best is trial 54 with value: 0.08969683603280788.
[I 2025-11-03 12:22:24,072] Trial 119 finished with value: 0.06860453945265221 and parameters: {'model_type': 'gcn', 'hidden_dims': '[128, 64]', 'dropout': 0.3086856896386637, 'batch_norm': True, 'lr': 0.0009715576346787941, 'weight_decay': 0.00020395109964848216, 'epochs': 179, 'loss': 'mae', 'optimizer': 'adam', 'graph_mode': 'off', 'use_snp_selection': False}. Best is trial 54 with value: 0.08969683603280788.
[I 2025-11-03 12:22:25,111] Trial 120 finished with value: 0.06483876211360652 and parameters: {'model_type': 'gcn', 'hidden_dims': '[512, 64]', 'dropout': 0.33047703204937995, 'batch_norm': True, 'lr': 0.00025972575278746283, 'weight_decay': 9.056972590013707e-05, 'epochs': 192, 'loss': 'mae', 'optimizer': 'adam', 'graph_mode': 'off', 'use_snp_selection': True, 'num_snps': 8124}. Best is trial 54 with value: 0.08969683603280788.
[I 2025-11-03 12:22:26,530] Trial 121 finished with value: 0.07985279442234165 and parameters: {'model_type': 'gcn', 'hidden_dims': '[128, 64]', 'dropout': 0.38236393711448413, 'batch_norm': True, 'lr': 0.0003814961695782694, 'weight_decay': 7.964419319768727e-05, 'epochs': 294, 'loss': 'mae', 'optimizer': 'adam', 'graph_mode': 'off', 'use_snp_selection': True, 'num_snps': 17189}. Best is trial 54 with value: 0.08969683603280788.
[I 2025-11-03 12:22:28,115] Trial 122 finished with value: 0.07431460802786555 and parameters: {'model_type': 'gcn', 'hidden_dims': '[128, 64]', 'dropout': 0.37504999496914326, 'batch_norm': True, 'lr': 0.00043759672949406596, 'weight_decay': 0.0002496719751620547, 'epochs': 272, 'loss': 'mae', 'optimizer': 'adam', 'graph_mode': 'off', 'use_snp_selection': True, 'num_snps': 29043}. Best is trial 54 with value: 0.08969683603280788.
[I 2025-11-03 12:22:29,720] Trial 123 finished with value: 0.08004389806153725 and parameters: {'model_type': 'gcn', 'hidden_dims': '[128, 64]', 'dropout': 0.35489930622159127, 'batch_norm': True, 'lr': 0.000540533549991987, 'weight_decay': 0.00012648943900127617, 'epochs': 302, 'loss': 'mae', 'optimizer': 'adam', 'graph_mode': 'off', 'use_snp_selection': True, 'num_snps': 24533}. Best is trial 54 with value: 0.08969683603280788.
[I 2025-11-03 12:22:31,133] Trial 124 finished with value: 0.0881010792539468 and parameters: {'model_type': 'gcn', 'hidden_dims': '[128, 64]', 'dropout': 0.4254610215817538, 'batch_norm': True, 'lr': 0.00067281927894225, 'weight_decay': 0.00010101894793784996, 'epochs': 285, 'loss': 'mae', 'optimizer': 'adam', 'graph_mode': 'off', 'use_snp_selection': True, 'num_snps': 18744}. Best is trial 54 with value: 0.08969683603280788.
[I 2025-11-03 12:22:32,591] Trial 125 finished with value: 0.07318968786647623 and parameters: {'model_type': 'gcn', 'hidden_dims': '[128, 64]', 'dropout': 0.4470860426451923, 'batch_norm': True, 'lr': 0.0006535138741057616, 'weight_decay': 0.00018180656343453271, 'epochs': 309, 'loss': 'mae', 'optimizer': 'adam', 'graph_mode': 'off', 'use_snp_selection': True, 'num_snps': 17893}. Best is trial 54 with value: 0.08969683603280788.
[I 2025-11-03 12:22:34,332] Trial 126 finished with value: 0.0927953677337659 and parameters: {'model_type': 'gcn', 'hidden_dims': '[256, 128, 64]', 'dropout': 0.42964645548602076, 'batch_norm': True, 'lr': 0.0007333338878235492, 'weight_decay': 0.00011305971722956918, 'epochs': 284, 'loss': 'mse', 'optimizer': 'adam', 'graph_mode': 'off', 'use_snp_selection': True, 'num_snps': 20632}. Best is trial 126 with value: 0.0927953677337659.
[I 2025-11-03 12:22:35,739] Trial 127 finished with value: 0.09001513359548988 and parameters: {'model_type': 'gcn', 'hidden_dims': '[128, 64]', 'dropout': 0.42076089620486734, 'batch_norm': True, 'lr': 0.0008108691924251231, 'weight_decay': 0.00010704405252302831, 'epochs': 268, 'loss': 'mse', 'optimizer': 'adam', 'graph_mode': 'off', 'use_snp_selection': True, 'num_snps': 20285}. Best is trial 126 with value: 0.0927953677337659.
[I 2025-11-03 12:22:37,124] Trial 128 finished with value: 0.08255272520110297 and parameters: {'model_type': 'gcn', 'hidden_dims': '[128, 64]', 'dropout': 0.4297279631037223, 'batch_norm': True, 'lr': 0.0008080859353720754, 'weight_decay': 0.00013960040630348302, 'epochs': 265, 'loss': 'mse', 'optimizer': 'adam', 'graph_mode': 'off', 'use_snp_selection': True, 'num_snps': 20672}. Best is trial 126 with value: 0.0927953677337659.
[I 2025-11-03 12:22:38,333] Trial 129 finished with value: 0.08003748797347543 and parameters: {'model_type': 'gcn', 'hidden_dims': '[128, 64]', 'dropout': 0.42418092670491936, 'batch_norm': True, 'lr': 0.0008396880397015298, 'weight_decay': 0.00010132204801220817, 'epochs': 243, 'loss': 'mse', 'optimizer': 'adam', 'graph_mode': 'off', 'use_snp_selection': True, 'num_snps': 12650}. Best is trial 126 with value: 0.0927953677337659.
[I 2025-11-03 12:22:39,753] Trial 130 finished with value: 0.05786411740852699 and parameters: {'model_type': 'gcn', 'hidden_dims': '[128, 64]', 'dropout': 0.4148436954925416, 'batch_norm': True, 'lr': 4.2996792486418956e-05, 'weight_decay': 6.359854192557636e-05, 'epochs': 257, 'loss': 'mse', 'optimizer': 'adam', 'graph_mode': 'off', 'use_snp_selection': True, 'num_snps': 22725}. Best is trial 126 with value: 0.0927953677337659.
[I 2025-11-03 12:22:41,068] Trial 131 finished with value: 0.07234664025630072 and parameters: {'model_type': 'gcn', 'hidden_dims': '[128, 64]', 'dropout': 0.39771292979249784, 'batch_norm': True, 'lr': 0.0005965015023915704, 'weight_decay': 5.116181371411948e-05, 'epochs': 278, 'loss': 'mse', 'optimizer': 'adam', 'graph_mode': 'off', 'use_snp_selection': True, 'num_snps': 15427}. Best is trial 126 with value: 0.0927953677337659.
[I 2025-11-03 12:22:42,880] Trial 132 finished with value: 0.06776668815426043 and parameters: {'model_type': 'gcn', 'hidden_dims': '[512, 256]', 'dropout': 0.43632922128461216, 'batch_norm': True, 'lr': 0.0007199798355666027, 'weight_decay': 0.00011130801658753202, 'epochs': 283, 'loss': 'mse', 'optimizer': 'adam', 'graph_mode': 'off', 'use_snp_selection': True, 'num_snps': 25456}. Best is trial 126 with value: 0.0927953677337659.
[I 2025-11-03 12:22:44,318] Trial 133 finished with value: 0.09386096844397478 and parameters: {'model_type': 'gcn', 'hidden_dims': '[128, 64]', 'dropout': 0.45890385911985143, 'batch_norm': True, 'lr': 0.0004986155510841493, 'weight_decay': 8.122477297835959e-05, 'epochs': 293, 'loss': 'mse', 'optimizer': 'adam', 'graph_mode': 'off', 'use_snp_selection': True, 'num_snps': 19591}. Best is trial 133 with value: 0.09386096844397478.
[I 2025-11-03 12:22:45,697] Trial 134 finished with value: 0.0862042301056917 and parameters: {'model_type': 'gcn', 'hidden_dims': '[128, 64]', 'dropout': 0.4600231979251263, 'batch_norm': True, 'lr': 0.0008999209999484794, 'weight_decay': 7.375742618600137e-05, 'epochs': 269, 'loss': 'mse', 'optimizer': 'adam', 'graph_mode': 'off', 'use_snp_selection': True, 'num_snps': 19215}. Best is trial 133 with value: 0.09386096844397478.
[I 2025-11-03 12:22:47,115] Trial 135 finished with value: 0.07044275402987762 and parameters: {'model_type': 'gcn', 'hidden_dims': '[128, 64]', 'dropout': 0.47219482865579093, 'batch_norm': True, 'lr': 0.0009998098971201537, 'weight_decay': 3.575650860832158e-05, 'epochs': 270, 'loss': 'mse', 'optimizer': 'adam', 'graph_mode': 'off', 'use_snp_selection': True, 'num_snps': 19241}. Best is trial 133 with value: 0.09386096844397478.
[I 2025-11-03 12:22:48,396] Trial 136 finished with value: 0.07937346463910176 and parameters: {'model_type': 'gcn', 'hidden_dims': '[128, 64]', 'dropout': 0.46069330277748194, 'batch_norm': True, 'lr': 0.0008754917318315491, 'weight_decay': 8.11586276087298e-05, 'epochs': 292, 'loss': 'mse', 'optimizer': 'adam', 'graph_mode': 'off', 'use_snp_selection': True, 'num_snps': 10315}. Best is trial 133 with value: 0.09386096844397478.
[I 2025-11-03 12:22:49,765] Trial 137 finished with value: 0.05325618604124928 and parameters: {'model_type': 'gcn', 'hidden_dims': '[128, 64]', 'dropout': 0.5024199186090894, 'batch_norm': True, 'lr': 2.3681295730926597e-06, 'weight_decay': 5.867312770006839e-05, 'epochs': 287, 'loss': 'mse', 'optimizer': 'adam', 'graph_mode': 'off', 'use_snp_selection': True, 'num_snps': 15182}. Best is trial 133 with value: 0.09386096844397478.
[I 2025-11-03 12:22:51,171] Trial 138 finished with value: 0.07439041750459058 and parameters: {'model_type': 'gcn', 'hidden_dims': '[128, 64]', 'dropout': 0.4079545454413798, 'batch_norm': True, 'lr': 0.0005387477122371001, 'weight_decay': 7.162225747769264e-05, 'epochs': 263, 'loss': 'mse', 'optimizer': 'adam', 'graph_mode': 'off', 'use_snp_selection': True, 'num_snps': 21898}. Best is trial 133 with value: 0.09386096844397478.
[I 2025-11-03 12:22:52,576] Trial 139 finished with value: 0.07340764052383258 and parameters: {'model_type': 'gcn', 'hidden_dims': '[128, 64]', 'dropout': 0.45310750726469834, 'batch_norm': True, 'lr': 0.0007546710602684787, 'weight_decay': 7.671996778911511e-07, 'epochs': 277, 'loss': 'mse', 'optimizer': 'adam', 'graph_mode': 'off', 'use_snp_selection': True, 'num_snps': 19361}. Best is trial 133 with value: 0.09386096844397478.
[I 2025-11-03 12:22:53,831] Trial 140 finished with value: 0.09761039542478162 and parameters: {'model_type': 'gcn', 'hidden_dims': '[128, 64]', 'dropout': 0.3886709479035726, 'batch_norm': True, 'lr': 0.0008658217573006374, 'weight_decay': 4.238814243066436e-05, 'epochs': 248, 'loss': 'mse', 'optimizer': 'adam', 'graph_mode': 'off', 'use_snp_selection': True, 'num_snps': 15419}. Best is trial 140 with value: 0.09761039542478162.
[I 2025-11-03 12:22:55,082] Trial 141 finished with value: 0.07809303842836868 and parameters: {'model_type': 'gcn', 'hidden_dims': '[128, 64]', 'dropout': 0.3823479125836931, 'batch_norm': True, 'lr': 0.0008448681788374227, 'weight_decay': 4.031946818771466e-05, 'epochs': 243, 'loss': 'mse', 'optimizer': 'adam', 'graph_mode': 'off', 'use_snp_selection': True, 'num_snps': 15871}. Best is trial 140 with value: 0.09761039542478162.
[I 2025-11-03 12:22:56,524] Trial 142 finished with value: 0.0806151376376484 and parameters: {'model_type': 'gcn', 'hidden_dims': '[128, 64]', 'dropout': 0.39235571114238643, 'batch_norm': True, 'lr': 0.0006457034231686995, 'weight_decay': 2.190386169748116e-05, 'epochs': 272, 'loss': 'mse', 'optimizer': 'adam', 'graph_mode': 'off', 'use_snp_selection': True, 'num_snps': 20921}. Best is trial 140 with value: 0.09761039542478162.
[I 2025-11-03 12:22:57,962] Trial 143 finished with value: 0.08314317211814469 and parameters: {'model_type': 'gcn', 'hidden_dims': '[128, 64]', 'dropout': 0.4247010618605717, 'batch_norm': True, 'lr': 0.0009906483562212064, 'weight_decay': 0.00010718074408596171, 'epochs': 257, 'loss': 'mse', 'optimizer': 'adam', 'graph_mode': 'off', 'use_snp_selection': True, 'num_snps': 23691}. Best is trial 140 with value: 0.09761039542478162.
