[I 2025-11-03 12:49:59,709] Trial 61 finished with value: 0.06287742050795833 and parameters: {'model_type': 'gcn', 'hidden_dims': '[512, 128]', 'dropout': 0.24958244950335434, 'batch_norm': False, 'lr': 4.676319922239062e-05, 'weight_decay': 5.209235401105112e-07, 'epochs': 286, 'loss': 'mse', 'optimizer': 'adam', 'graph_mode': 'cutoff', 'cutoff': 0.4901223483296676, 'grm_norm': 'cosine', 'self_loops': False, 'use_snp_selection': True, 'num_snps': 24362}. Best is trial 9 with value: 0.06659124926087946.
[I 2025-11-03 12:50:02,369] Trial 62 finished with value: 0.014962546535000799 and parameters: {'model_type': 'gcn', 'hidden_dims': '[512, 128]', 'dropout': 0.2503899283238279, 'batch_norm': False, 'lr': 3.29074986739242e-05, 'weight_decay': 1.519299124689145e-07, 'epochs': 331, 'loss': 'mse', 'optimizer': 'adam', 'graph_mode': 'cutoff', 'cutoff': 0.4631537194414713, 'grm_norm': 'cosine', 'self_loops': False, 'use_snp_selection': True, 'num_snps': 25149}. Best is trial 9 with value: 0.06659124926087946.
[I 2025-11-03 12:50:05,293] Trial 63 finished with value: 0.006013116779925271 and parameters: {'model_type': 'gcn', 'hidden_dims': '[512, 128]', 'dropout': 0.30918533967116163, 'batch_norm': False, 'lr': 5.3148586111293966e-05, 'weight_decay': 3.359400557750254e-07, 'epochs': 287, 'loss': 'mse', 'optimizer': 'adam', 'graph_mode': 'cutoff', 'cutoff': 0.5790989789819976, 'grm_norm': 'cosine', 'self_loops': False, 'use_snp_selection': True, 'num_snps': 33349}. Best is trial 9 with value: 0.06659124926087946.
[I 2025-11-03 12:50:07,394] Trial 64 finished with value: 0.024670761699518075 and parameters: {'model_type': 'gcn', 'hidden_dims': '[512, 128]', 'dropout': 0.24049257911695654, 'batch_norm': False, 'lr': 2.1423425972164563e-05, 'weight_decay': 5.246036033892486e-05, 'epochs': 270, 'loss': 'mse', 'optimizer': 'adam', 'graph_mode': 'cutoff', 'cutoff': 0.48914727337769304, 'grm_norm': 'cosine', 'self_loops': False, 'use_snp_selection': True, 'num_snps': 15700}. Best is trial 9 with value: 0.06659124926087946.
[I 2025-11-03 12:50:10,881] Trial 65 finished with value: 0.003132629366551197 and parameters: {'model_type': 'gcn', 'hidden_dims': '[512, 128]', 'dropout': 0.3906857385239651, 'batch_norm': False, 'lr': 0.00011010282711667239, 'weight_decay': 0.00019180076079353242, 'epochs': 233, 'loss': 'mse', 'optimizer': 'adam', 'graph_mode': 'cutoff', 'cutoff': 0.38648700224968446, 'grm_norm': 'gcn', 'self_loops': False, 'use_snp_selection': True, 'num_snps': 49069}. Best is trial 9 with value: 0.06659124926087946.
[I 2025-11-03 12:50:12,886] Trial 66 finished with value: -0.0038310171807175364 and parameters: {'model_type': 'gcn', 'hidden_dims': '[256, 128]', 'dropout': 0.2039067348655757, 'batch_norm': True, 'lr': 9.953682246568858e-06, 'weight_decay': 1.948241026204694e-07, 'epochs': 244, 'loss': 'mae', 'optimizer': 'adam', 'graph_mode': 'cutoff', 'cutoff': 0.6531860348358933, 'grm_norm': 'cosine', 'self_loops': False, 'use_snp_selection': False}. Best is trial 9 with value: 0.06659124926087946.
[I 2025-11-03 12:50:15,202] Trial 67 finished with value: 0.03624871223416364 and parameters: {'model_type': 'gcn', 'hidden_dims': '[512, 256]', 'dropout': 0.32718150409716457, 'batch_norm': False, 'lr': 8.31316132566867e-05, 'weight_decay': 2.4455211603618375e-06, 'epochs': 256, 'loss': 'mse', 'optimizer': 'adam', 'graph_mode': 'cutoff', 'cutoff': 0.24169721149079987, 'grm_norm': 'gcn', 'self_loops': False, 'use_snp_selection': True, 'num_snps': 21891}. Best is trial 9 with value: 0.06659124926087946.
[I 2025-11-03 12:50:17,214] Trial 68 finished with value: 0.03252422634777704 and parameters: {'model_type': 'gcn', 'hidden_dims': '[128, 64]', 'dropout': 0.2912954020987716, 'batch_norm': True, 'lr': 0.000176038842934349, 'weight_decay': 6.312906077183917e-07, 'epochs': 312, 'loss': 'mae', 'optimizer': 'adam', 'graph_mode': 'knn', 'source': 'grm', 'knn_k': 4, 'weighted_edges': False, 'symmetrize_mode': 'union', 'use_snp_selection': False}. Best is trial 9 with value: 0.06659124926087946.
[I 2025-11-03 12:50:19,471] Trial 69 finished with value: 0.027495251167753258 and parameters: {'model_type': 'gcn', 'hidden_dims': '[512, 256]', 'dropout': 0.26599918744333867, 'batch_norm': False, 'lr': 7.167956129679954e-06, 'weight_decay': 4.1793052669901775e-06, 'epochs': 302, 'loss': 'mae', 'optimizer': 'adam', 'graph_mode': 'cutoff', 'cutoff': 0.4252235903451016, 'grm_norm': 'none', 'self_loops': False, 'use_snp_selection': True, 'num_snps': 17092}. Best is trial 9 with value: 0.06659124926087946.
[I 2025-11-03 12:50:21,145] Trial 70 finished with value: 0.01960577500047465 and parameters: {'model_type': 'gcn', 'hidden_dims': '[256, 128, 64]', 'dropout': 0.4422762311443246, 'batch_norm': True, 'lr': 3.853901111949236e-05, 'weight_decay': 2.5280265113031197e-05, 'epochs': 116, 'loss': 'mse', 'optimizer': 'adam', 'graph_mode': 'knn', 'source': 'grm', 'knn_k': 6, 'weighted_edges': True, 'symmetrize_mode': 'mutual', 'use_snp_selection': False}. Best is trial 9 with value: 0.06659124926087946.
[I 2025-11-03 12:50:23,617] Trial 71 finished with value: 0.031851057971649104 and parameters: {'model_type': 'gcn', 'hidden_dims': '[512, 128]', 'dropout': 0.24435935491179406, 'batch_norm': False, 'lr': 4.654645822129817e-05, 'weight_decay': 3.245488952857974e-07, 'epochs': 290, 'loss': 'mse', 'optimizer': 'adam', 'graph_mode': 'cutoff', 'cutoff': 0.5088101177850196, 'grm_norm': 'cosine', 'self_loops': False, 'use_snp_selection': True, 'num_snps': 23106}. Best is trial 9 with value: 0.06659124926087946.
[I 2025-11-03 12:50:26,483] Trial 72 finished with value: 0.039545224935390845 and parameters: {'model_type': 'gcn', 'hidden_dims': '[512, 128]', 'dropout': 0.23508392480613693, 'batch_norm': False, 'lr': 5.572069442218885e-05, 'weight_decay': 4.927834993931718e-07, 'epochs': 287, 'loss': 'mse', 'optimizer': 'adam', 'graph_mode': 'cutoff', 'cutoff': 0.5397730465605967, 'grm_norm': 'cosine', 'self_loops': False, 'use_snp_selection': True, 'num_snps': 31767}. Best is trial 9 with value: 0.06659124926087946.
[I 2025-11-03 12:50:29,009] Trial 73 finished with value: 0.020988605996424825 and parameters: {'model_type': 'gcn', 'hidden_dims': '[512, 128]', 'dropout': 0.2161121124684975, 'batch_norm': False, 'lr': 2.8555026151760326e-05, 'weight_decay': 9.817174861787385e-07, 'epochs': 281, 'loss': 'mse', 'optimizer': 'adam', 'graph_mode': 'cutoff', 'cutoff': 0.5991123820314921, 'grm_norm': 'cosine', 'self_loops': False, 'use_snp_selection': True, 'num_snps': 24200}. Best is trial 9 with value: 0.06659124926087946.
[I 2025-11-03 12:50:31,805] Trial 74 finished with value: -0.010539121498983221 and parameters: {'model_type': 'gcn', 'hidden_dims': '[512, 128]', 'dropout': 0.27735581659226255, 'batch_norm': False, 'lr': 6.749471285535026e-05, 'weight_decay': 4.362734927689355e-07, 'epochs': 331, 'loss': 'mse', 'optimizer': 'adam', 'graph_mode': 'cutoff', 'cutoff': 0.5294105492988715, 'grm_norm': 'cosine', 'self_loops': False, 'use_snp_selection': True, 'num_snps': 27507}. Best is trial 9 with value: 0.06659124926087946.
[I 2025-11-03 12:50:34,070] Trial 75 finished with value: 0.010397468407952519 and parameters: {'model_type': 'gcn', 'hidden_dims': '[512, 128]', 'dropout': 0.41663861059440305, 'batch_norm': False, 'lr': 4.267902512057855e-05, 'weight_decay': 6.26303042263218e-07, 'epochs': 269, 'loss': 'mse', 'optimizer': 'adam', 'graph_mode': 'cutoff', 'cutoff': 0.462287114682959, 'grm_norm': 'cosine', 'self_loops': False, 'use_snp_selection': True, 'num_snps': 19383}. Best is trial 9 with value: 0.06659124926087946.
[I 2025-11-03 12:50:35,711] Trial 76 finished with value: 0.013314818683791788 and parameters: {'model_type': 'gcn', 'hidden_dims': '[512, 256]', 'dropout': 0.47317838171259985, 'batch_norm': False, 'lr': 0.0001359291587762827, 'weight_decay': 1.0224142914756299e-07, 'epochs': 254, 'loss': 'mae', 'optimizer': 'adam', 'graph_mode': 'cutoff', 'cutoff': 0.7081924959614039, 'grm_norm': 'gcn', 'self_loops': False, 'use_snp_selection': True, 'num_snps': 4991}. Best is trial 9 with value: 0.06659124926087946.
[I 2025-11-03 12:50:37,581] Trial 77 finished with value: -0.016599846764252316 and parameters: {'model_type': 'gcn', 'hidden_dims': '[128, 64]', 'dropout': 0.15639330152148043, 'batch_norm': False, 'lr': 3.10460140631349e-05, 'weight_decay': 9.696236830408857e-06, 'epochs': 280, 'loss': 'mae', 'optimizer': 'adam', 'graph_mode': 'cutoff', 'cutoff': 0.6465806628025225, 'grm_norm': 'gcn', 'self_loops': False, 'use_snp_selection': True, 'num_snps': 11099}. Best is trial 9 with value: 0.06659124926087946.
[I 2025-11-03 12:50:40,169] Trial 78 finished with value: 0.021522809725354634 and parameters: {'model_type': 'gcn', 'hidden_dims': '[512, 64]', 'dropout': 0.38944019010178943, 'batch_norm': True, 'lr': 1.5012659376398627e-05, 'weight_decay': 1.6658158880764063e-05, 'epochs': 237, 'loss': 'mse', 'optimizer': 'adam', 'graph_mode': 'knn', 'source': 'grm', 'knn_k': 7, 'weighted_edges': False, 'symmetrize_mode': 'union', 'use_snp_selection': False}. Best is trial 9 with value: 0.06659124926087946.
[I 2025-11-03 12:50:42,324] Trial 79 finished with value: 0.029263032988741538 and parameters: {'model_type': 'gcn', 'hidden_dims': '[512, 256]', 'dropout': 0.35269093059072476, 'batch_norm': False, 'lr': 8.98888175335043e-05, 'weight_decay': 6.746304627490748e-05, 'epochs': 302, 'loss': 'mae', 'optimizer': 'adam', 'graph_mode': 'cutoff', 'cutoff': 0.3740108842739843, 'grm_norm': 'cosine', 'self_loops': False, 'use_snp_selection': True, 'num_snps': 14495}. Best is trial 9 with value: 0.06659124926087946.
[I 2025-11-03 12:50:43,779] Trial 80 finished with value: -0.01590764718227636 and parameters: {'model_type': 'gcn', 'hidden_dims': '[512, 128]', 'dropout': 0.3008009115845123, 'batch_norm': True, 'lr': 2.301353603175799e-05, 'weight_decay': 3.9907283495458583e-05, 'epochs': 43, 'loss': 'mse', 'optimizer': 'adam', 'graph_mode': 'cutoff', 'cutoff': 0.3085391127698945, 'grm_norm': 'none', 'self_loops': False, 'use_snp_selection': False}. Best is trial 9 with value: 0.06659124926087946.
[I 2025-11-03 12:50:45,945] Trial 81 finished with value: 0.013316756201422817 and parameters: {'model_type': 'gcn', 'hidden_dims': '[512, 256]', 'dropout': 0.468424992355683, 'batch_norm': False, 'lr': 7.699737730050003e-05, 'weight_decay': 1.2704044517744336e-06, 'epochs': 262, 'loss': 'mae', 'optimizer': 'adam', 'graph_mode': 'cutoff', 'cutoff': 0.32987428893747106, 'grm_norm': 'cosine_then_gcn', 'self_loops': True, 'use_snp_selection': True, 'num_snps': 17310}. Best is trial 9 with value: 0.06659124926087946.
[I 2025-11-03 12:50:48,341] Trial 82 finished with value: 0.04049767566928468 and parameters: {'model_type': 'gcn', 'hidden_dims': '[512, 256]', 'dropout': 0.5211161678389821, 'batch_norm': False, 'lr': 5.0730147477601194e-05, 'weight_decay': 2.3985389074178754e-06, 'epochs': 306, 'loss': 'mae', 'optimizer': 'adam', 'graph_mode': 'cutoff', 'cutoff': 0.2584206940673795, 'grm_norm': 'cosine_then_gcn', 'self_loops': True, 'use_snp_selection': True, 'num_snps': 19510}. Best is trial 9 with value: 0.06659124926087946.
[I 2025-11-03 12:50:50,237] Trial 83 finished with value: 0.02030180962550723 and parameters: {'model_type': 'gcn', 'hidden_dims': '[512, 256]', 'dropout': 0.20377105745717985, 'batch_norm': False, 'lr': 3.8743839310887194e-05, 'weight_decay': 2.0241453640886975e-06, 'epochs': 294, 'loss': 'mae', 'optimizer': 'adam', 'graph_mode': 'cutoff', 'cutoff': 0.5645158506876726, 'grm_norm': 'cosine_then_gcn', 'self_loops': True, 'use_snp_selection': True, 'num_snps': 9637}. Best is trial 9 with value: 0.06659124926087946.
[I 2025-11-03 12:50:52,176] Trial 84 finished with value: -0.015476590827214753 and parameters: {'model_type': 'gcn', 'hidden_dims': '[512, 256]', 'dropout': 0.4307783912719249, 'batch_norm': False, 'lr': 0.00011634977844823687, 'weight_decay': 4.743347110467812e-06, 'epochs': 73, 'loss': 'mae', 'optimizer': 'adam', 'graph_mode': 'cutoff', 'cutoff': 0.41770601185008494, 'grm_norm': 'cosine_then_gcn', 'self_loops': False, 'use_snp_selection': True, 'num_snps': 26433}. Best is trial 9 with value: 0.06659124926087946.
[I 2025-11-03 12:50:54,617] Trial 85 finished with value: 0.05758694077996576 and parameters: {'model_type': 'gcn', 'hidden_dims': '[256, 128]', 'dropout': 0.18740260723471538, 'batch_norm': False, 'lr': 6.428583604925896e-05, 'weight_decay': 7.101173905331934e-06, 'epochs': 342, 'loss': 'mae', 'optimizer': 'adam', 'graph_mode': 'knn', 'source': 'grm', 'knn_k': 5, 'weighted_edges': True, 'symmetrize_mode': 'union', 'use_snp_selection': True, 'num_snps': 22415}. Best is trial 9 with value: 0.06659124926087946.
[I 2025-11-03 12:50:57,064] Trial 86 finished with value: 0.04337881562892629 and parameters: {'model_type': 'gcn', 'hidden_dims': '[256, 128]', 'dropout': 0.17936187066306522, 'batch_norm': False, 'lr': 6.338547104819136e-05, 'weight_decay': 6.650623449831078e-06, 'epochs': 349, 'loss': 'mae', 'optimizer': 'adam', 'graph_mode': 'knn', 'source': 'grm', 'knn_k': 5, 'weighted_edges': True, 'symmetrize_mode': 'union', 'use_snp_selection': True, 'num_snps': 22092}. Best is trial 9 with value: 0.06659124926087946.
[I 2025-11-03 12:50:59,558] Trial 87 finished with value: 0.00819942183609431 and parameters: {'model_type': 'gcn', 'hidden_dims': '[256, 128]', 'dropout': 0.2256736253701279, 'batch_norm': False, 'lr': 1.9299633089960816e-05, 'weight_decay': 8.607627444136648e-06, 'epochs': 336, 'loss': 'mae', 'optimizer': 'adam', 'graph_mode': 'knn', 'source': 'grm', 'knn_k': 3, 'weighted_edges': True, 'symmetrize_mode': 'union', 'use_snp_selection': True, 'num_snps': 24434}. Best is trial 9 with value: 0.06659124926087946.
[I 2025-11-03 12:51:01,914] Trial 88 finished with value: 0.016073557504157034 and parameters: {'model_type': 'gcn', 'hidden_dims': '[256, 128]', 'dropout': 0.18725890425349984, 'batch_norm': True, 'lr': 2.5079022464301383e-05, 'weight_decay': 2.154320968035227e-05, 'epochs': 334, 'loss': 'mse', 'optimizer': 'adam', 'graph_mode': 'knn', 'source': 'grm', 'knn_k': 6, 'weighted_edges': True, 'symmetrize_mode': 'union', 'use_snp_selection': False}. Best is trial 9 with value: 0.06659124926087946.
[I 2025-11-03 12:51:04,221] Trial 89 finished with value: 0.031120710769881748 and parameters: {'model_type': 'gcn', 'hidden_dims': '[256, 128]', 'dropout': 0.16586477736588345, 'batch_norm': False, 'lr': 3.298556912632948e-05, 'weight_decay': 1.1926934101433468e-05, 'epochs': 325, 'loss': 'mae', 'optimizer': 'adam', 'graph_mode': 'knn', 'source': 'grm', 'knn_k': 1, 'weighted_edges': True, 'symmetrize_mode': 'mutual', 'use_snp_selection': True, 'num_snps': 20570}. Best is trial 9 with value: 0.06659124926087946.
[I 2025-11-03 12:51:06,780] Trial 90 finished with value: 0.02128450652545988 and parameters: {'model_type': 'gcn', 'hidden_dims': '[128, 64]', 'dropout': 0.25428068898849454, 'batch_norm': False, 'lr': 4.928384162378203e-06, 'weight_decay': 1.9786633240693746e-07, 'epochs': 312, 'loss': 'mse', 'optimizer': 'adam', 'graph_mode': 'knn', 'source': 'grm', 'knn_k': 5, 'weighted_edges': True, 'symmetrize_mode': 'union', 'use_snp_selection': True, 'num_snps': 30958}. Best is trial 9 with value: 0.06659124926087946.
[I 2025-11-03 12:51:08,965] Trial 91 finished with value: 0.025371057461916216 and parameters: {'model_type': 'gcn', 'hidden_dims': '[512, 256]', 'dropout': 0.20730668686922438, 'batch_norm': False, 'lr': 8.137468859771117e-05, 'weight_decay': 3.252550675604837e-06, 'epochs': 340, 'loss': 'mae', 'optimizer': 'adam', 'graph_mode': 'knn', 'source': 'grm', 'knn_k': 9, 'weighted_edges': True, 'symmetrize_mode': 'mutual', 'use_snp_selection': True, 'num_snps': 11962}. Best is trial 9 with value: 0.06659124926087946.
[I 2025-11-03 12:51:11,191] Trial 92 finished with value: -0.005076742044112698 and parameters: {'model_type': 'gcn', 'hidden_dims': '[512, 128]', 'dropout': 0.4523177800957199, 'batch_norm': False, 'lr': 4.9424843771735085e-05, 'weight_decay': 2.675273981719692e-07, 'epochs': 321, 'loss': 'mae', 'optimizer': 'adam', 'graph_mode': 'cutoff', 'cutoff': 0.36745435329266496, 'grm_norm': 'gcn', 'self_loops': False, 'use_snp_selection': True, 'num_snps': 15064}. Best is trial 9 with value: 0.06659124926087946.
[I 2025-11-03 12:51:13,412] Trial 93 finished with value: 0.028877612379908886 and parameters: {'model_type': 'gcn', 'hidden_dims': '[512, 256]', 'dropout': 0.12615991027904416, 'batch_norm': False, 'lr': 9.752921167532006e-05, 'weight_decay': 5.263426224067736e-07, 'epochs': 274, 'loss': 'mae', 'optimizer': 'adam', 'graph_mode': 'knn', 'source': 'grm', 'knn_k': 4, 'weighted_edges': False, 'symmetrize_mode': 'union', 'use_snp_selection': True, 'num_snps': 17558}. Best is trial 9 with value: 0.06659124926087946.
[I 2025-11-03 12:51:16,442] Trial 94 finished with value: 0.032204283077257555 and parameters: {'model_type': 'gcn', 'hidden_dims': '[512, 128]', 'dropout': 0.46166228471001824, 'batch_norm': False, 'lr': 6.479525433039983e-05, 'weight_decay': 8.271218484722141e-07, 'epochs': 262, 'loss': 'mae', 'optimizer': 'adam', 'graph_mode': 'cutoff', 'cutoff': 0.3121638425220595, 'grm_norm': 'gcn', 'self_loops': True, 'use_snp_selection': True, 'num_snps': 36765}. Best is trial 9 with value: 0.06659124926087946.
[I 2025-11-03 12:51:18,826] Trial 95 finished with value: -0.017758617901277637 and parameters: {'model_type': 'gcn', 'hidden_dims': '[256, 128]', 'dropout': 0.4920307912586104, 'batch_norm': False, 'lr': 4.0504708738467e-05, 'weight_decay': 3.596393243490846e-07, 'epochs': 225, 'loss': 'mae', 'optimizer': 'adam', 'graph_mode': 'knn', 'source': 'grm', 'knn_k': 7, 'weighted_edges': False, 'symmetrize_mode': 'union', 'use_snp_selection': True, 'num_snps': 28414}. Best is trial 9 with value: 0.06659124926087946.
[I 2025-11-03 12:51:20,386] Trial 96 finished with value: 0.06371829623445137 and parameters: {'model_type': 'gcn', 'hidden_dims': '[256, 128, 64]', 'dropout': 0.23474993061943933, 'batch_norm': True, 'lr': 2.762914705177571e-05, 'weight_decay': 3.0470934096578066e-05, 'epochs': 99, 'loss': 'mse', 'optimizer': 'adam', 'graph_mode': 'cutoff', 'cutoff': 0.48413233388202936, 'grm_norm': 'cosine_then_gcn', 'self_loops': False, 'use_snp_selection': False}. Best is trial 9 with value: 0.06659124926087946.
[I 2025-11-03 12:51:21,919] Trial 97 finished with value: -0.029769875850240348 and parameters: {'model_type': 'gcn', 'hidden_dims': '[256, 128, 64]', 'dropout': 0.2384481900577518, 'batch_norm': True, 'lr': 1.683883498577257e-05, 'weight_decay': 3.0712714785504575e-05, 'epochs': 98, 'loss': 'mse', 'optimizer': 'adam', 'graph_mode': 'cutoff', 'cutoff': 0.5157181775404258, 'grm_norm': 'cosine_then_gcn', 'self_loops': False, 'use_snp_selection': False}. Best is trial 9 with value: 0.06659124926087946.
[I 2025-11-03 12:51:23,461] Trial 98 finished with value: 0.013471106230853843 and parameters: {'model_type': 'gcn', 'hidden_dims': '[256, 128, 64]', 'dropout': 0.21487501890780705, 'batch_norm': True, 'lr': 2.7841785664724095e-05, 'weight_decay': 4.3688499242175045e-05, 'epochs': 101, 'loss': 'mse', 'optimizer': 'adam', 'graph_mode': 'cutoff', 'cutoff': 0.48392251339800413, 'grm_norm': 'cosine', 'self_loops': False, 'use_snp_selection': False}. Best is trial 9 with value: 0.06659124926087946.
[I 2025-11-03 12:51:25,361] Trial 99 finished with value: 0.0021321113450526105 and parameters: {'model_type': 'gcn', 'hidden_dims': '[256, 128, 64]', 'dropout': 0.36358929207868507, 'batch_norm': True, 'lr': 1.290237650310328e-05, 'weight_decay': 6.418383784291041e-05, 'epochs': 170, 'loss': 'mse', 'optimizer': 'adam', 'graph_mode': 'knn', 'source': 'grm', 'knn_k': 1, 'weighted_edges': True, 'symmetrize_mode': 'union', 'use_snp_selection': False}. Best is trial 9 with value: 0.06659124926087946.
[I 2025-11-03 12:51:27,048] Trial 100 finished with value: 0.027125931402300046 and parameters: {'model_type': 'gcn', 'hidden_dims': '[256, 128, 64]', 'dropout': 0.1915380763057714, 'batch_norm': True, 'lr': 2.122215361668803e-05, 'weight_decay': 0.00012149203050093792, 'epochs': 132, 'loss': 'mse', 'optimizer': 'adam', 'graph_mode': 'cutoff', 'cutoff': 0.4364823529471776, 'grm_norm': 'gcn', 'self_loops': False, 'use_snp_selection': False}. Best is trial 9 with value: 0.06659124926087946.
[I 2025-11-03 12:51:28,399] Trial 101 finished with value: 0.01809295338016134 and parameters: {'model_type': 'gcn', 'hidden_dims': '[128, 64]', 'dropout': 0.40739183127960177, 'batch_norm': True, 'lr': 5.764779643720993e-05, 'weight_decay': 3.129466959836403e-05, 'epochs': 121, 'loss': 'mse', 'optimizer': 'adam', 'graph_mode': 'cutoff', 'cutoff': 0.5602093324213885, 'grm_norm': 'cosine_then_gcn', 'self_loops': False, 'use_snp_selection': False}. Best is trial 9 with value: 0.06659124926087946.
[I 2025-11-03 12:51:30,206] Trial 102 finished with value: 0.0315749791779634 and parameters: {'model_type': 'gcn', 'hidden_dims': '[512, 256]', 'dropout': 0.2620136655301837, 'batch_norm': False, 'lr': 3.56328872182804e-05, 'weight_decay': 1.4513390665285532e-05, 'epochs': 79, 'loss': 'mse', 'optimizer': 'adam', 'graph_mode': 'cutoff', 'cutoff': 0.40387757357144044, 'grm_norm': 'cosine_then_gcn', 'self_loops': False, 'use_snp_selection': True, 'num_snps': 23042}. Best is trial 9 with value: 0.06659124926087946.
[I 2025-11-03 12:51:32,977] Trial 103 finished with value: 0.029313253684971022 and parameters: {'model_type': 'gcn', 'hidden_dims': '[512, 64]', 'dropout': 0.2492032285360068, 'batch_norm': True, 'lr': 7.524841014873896e-05, 'weight_decay': 1.951075406181996e-05, 'epochs': 284, 'loss': 'mae', 'optimizer': 'adam', 'graph_mode': 'cutoff', 'cutoff': 0.2807049376263471, 'grm_norm': 'cosine_then_gcn', 'self_loops': True, 'use_snp_selection': False}. Best is trial 9 with value: 0.06659124926087946.
