[I 2025-11-03 13:13:50,684] Trial 137 finished with value: 0.06901190796741458 and parameters: {'model_type': 'gcn', 'hidden_dims': '[512, 64]', 'dropout': 0.2075575921278936, 'batch_norm': True, 'lr': 0.0009577589480325506, 'weight_decay': 8.947720863058792e-07, 'epochs': 161, 'loss': 'mae', 'optimizer': 'adam', 'graph_mode': 'off', 'use_snp_selection': True, 'num_snps': 8494}. Best is trial 137 with value: 0.06901190796741458.
[I 2025-11-03 13:13:51,639] Trial 138 finished with value: 0.05599572761381498 and parameters: {'model_type': 'gcn', 'hidden_dims': '[512, 64]', 'dropout': 0.20524730867748398, 'batch_norm': True, 'lr': 0.0008545808827103432, 'weight_decay': 2.810479479171056e-06, 'epochs': 161, 'loss': 'mae', 'optimizer': 'adam', 'graph_mode': 'off', 'use_snp_selection': True, 'num_snps': 7494}. Best is trial 137 with value: 0.06901190796741458.
[I 2025-11-03 13:13:52,574] Trial 139 finished with value: 0.04874340663327577 and parameters: {'model_type': 'gcn', 'hidden_dims': '[512, 64]', 'dropout': 0.18329513631052624, 'batch_norm': True, 'lr': 0.0008904662102503794, 'weight_decay': 1.0020125872540016e-06, 'epochs': 165, 'loss': 'mae', 'optimizer': 'adam', 'graph_mode': 'off', 'use_snp_selection': True, 'num_snps': 6201}. Best is trial 137 with value: 0.06901190796741458.
[I 2025-11-03 13:13:53,815] Trial 140 finished with value: 0.028505714658308406 and parameters: {'model_type': 'gcn', 'hidden_dims': '[512, 64]', 'dropout': 0.20539376009872493, 'batch_norm': True, 'lr': 0.0006649082425393987, 'weight_decay': 7.818544506906634e-07, 'epochs': 191, 'loss': 'mse', 'optimizer': 'adam', 'graph_mode': 'off', 'use_snp_selection': True, 'num_snps': 15341}. Best is trial 137 with value: 0.06901190796741458.
[I 2025-11-03 13:13:54,742] Trial 141 finished with value: 0.05931680685645213 and parameters: {'model_type': 'gcn', 'hidden_dims': '[512, 64]', 'dropout': 0.1892876651045737, 'batch_norm': True, 'lr': 0.0009949552130961196, 'weight_decay': 2.4246899045392797e-06, 'epochs': 165, 'loss': 'mae', 'optimizer': 'adam', 'graph_mode': 'off', 'use_snp_selection': True, 'num_snps': 6587}. Best is trial 137 with value: 0.06901190796741458.
[I 2025-11-03 13:13:55,722] Trial 142 finished with value: 0.05148291250467216 and parameters: {'model_type': 'gcn', 'hidden_dims': '[512, 64]', 'dropout': 0.19628810380893413, 'batch_norm': True, 'lr': 0.0009725345886050259, 'weight_decay': 2.5882294702747928e-06, 'epochs': 173, 'loss': 'mae', 'optimizer': 'adam', 'graph_mode': 'off', 'use_snp_selection': True, 'num_snps': 7681}. Best is trial 137 with value: 0.06901190796741458.
[I 2025-11-03 13:13:56,701] Trial 143 finished with value: 0.05193454400130762 and parameters: {'model_type': 'gcn', 'hidden_dims': '[512, 64]', 'dropout': 0.198284749918534, 'batch_norm': True, 'lr': 0.000987861514571504, 'weight_decay': 2.4490746186198206e-06, 'epochs': 170, 'loss': 'mae', 'optimizer': 'adam', 'graph_mode': 'off', 'use_snp_selection': True, 'num_snps': 7685}. Best is trial 137 with value: 0.06901190796741458.
[I 2025-11-03 13:13:57,644] Trial 144 finished with value: 0.0657683318269729 and parameters: {'model_type': 'gcn', 'hidden_dims': '[512, 64]', 'dropout': 0.1777286865703024, 'batch_norm': True, 'lr': 0.0009419833399612473, 'weight_decay': 2.4660602655406905e-06, 'epochs': 163, 'loss': 'mae', 'optimizer': 'adam', 'graph_mode': 'off', 'use_snp_selection': True, 'num_snps': 6739}. Best is trial 137 with value: 0.06901190796741458.
[I 2025-11-03 13:13:58,609] Trial 145 finished with value: 0.06343238469228424 and parameters: {'model_type': 'gcn', 'hidden_dims': '[512, 64]', 'dropout': 0.17740948676173227, 'batch_norm': True, 'lr': 0.000965012655166208, 'weight_decay': 2.4127148340090108e-06, 'epochs': 169, 'loss': 'mae', 'optimizer': 'adam', 'graph_mode': 'off', 'use_snp_selection': True, 'num_snps': 7075}. Best is trial 137 with value: 0.06901190796741458.
[I 2025-11-03 13:13:59,570] Trial 146 finished with value: 0.05448345200243428 and parameters: {'model_type': 'gcn', 'hidden_dims': '[512, 64]', 'dropout': 0.17663092234061106, 'batch_norm': True, 'lr': 0.0008963013742637459, 'weight_decay': 2.300123364759487e-06, 'epochs': 170, 'loss': 'mae', 'optimizer': 'adam', 'graph_mode': 'off', 'use_snp_selection': True, 'num_snps': 7078}. Best is trial 137 with value: 0.06901190796741458.
[I 2025-11-03 13:14:00,531] Trial 147 finished with value: 0.05616101993147485 and parameters: {'model_type': 'gcn', 'hidden_dims': '[512, 64]', 'dropout': 0.18080208400387054, 'batch_norm': True, 'lr': 0.0009401342419606836, 'weight_decay': 1.6080767011644186e-06, 'epochs': 170, 'loss': 'mae', 'optimizer': 'adam', 'graph_mode': 'off', 'use_snp_selection': True, 'num_snps': 7113}. Best is trial 137 with value: 0.06901190796741458.
[I 2025-11-03 13:14:01,472] Trial 148 finished with value: 0.03348414799805363 and parameters: {'model_type': 'gcn', 'hidden_dims': '[512, 64]', 'dropout': 0.1767241360761869, 'batch_norm': True, 'lr': 0.000988518645140309, 'weight_decay': 1.1782654393596518e-06, 'epochs': 168, 'loss': 'mae', 'optimizer': 'adam', 'graph_mode': 'off', 'use_snp_selection': True, 'num_snps': 6221}. Best is trial 137 with value: 0.06901190796741458.
[I 2025-11-03 13:14:02,394] Trial 149 finished with value: 0.053000562349667685 and parameters: {'model_type': 'gcn', 'hidden_dims': '[512, 64]', 'dropout': 0.1633375678636288, 'batch_norm': True, 'lr': 0.0008338103678143723, 'weight_decay': 1.5554146882445402e-06, 'epochs': 162, 'loss': 'mae', 'optimizer': 'adam', 'graph_mode': 'off', 'use_snp_selection': True, 'num_snps': 6578}. Best is trial 137 with value: 0.06901190796741458.
[I 2025-11-03 13:14:18,768] Trial 0 finished with value: 0.05222342559177535 and parameters: {'model_type': 'gcn', 'hidden_dims': '[128, 64]', 'dropout': 0.199031432379812, 'batch_norm': True, 'lr': 1.8408544111075837e-06, 'weight_decay': 5.5136510071208614e-05, 'epochs': 336, 'loss': 'mae', 'optimizer': 'adam', 'graph_mode': 'off', 'use_snp_selection': True, 'num_snps': 43862}. Best is trial 0 with value: 0.05222342559177535.
[I 2025-11-03 13:14:20,080] Trial 1 finished with value: 0.03282738946626126 and parameters: {'model_type': 'gcn', 'hidden_dims': '[256, 128]', 'dropout': 0.4370668075331726, 'batch_norm': True, 'lr': 7.133471581159139e-05, 'weight_decay': 1.128633586803549e-05, 'epochs': 242, 'loss': 'mae', 'optimizer': 'adam', 'graph_mode': 'off', 'use_snp_selection': False}. Best is trial 0 with value: 0.05222342559177535.
[I 2025-11-03 13:14:21,081] Trial 2 finished with value: -0.047900303540957104 and parameters: {'model_type': 'gcn', 'hidden_dims': '[256, 128, 64]', 'dropout': 0.41314357415569625, 'batch_norm': False, 'lr': 3.952233718592101e-06, 'weight_decay': 0.00026754769258252603, 'epochs': 149, 'loss': 'mse', 'optimizer': 'adam', 'graph_mode': 'off', 'use_snp_selection': True, 'num_snps': 11571}. Best is trial 0 with value: 0.05222342559177535.
[I 2025-11-03 13:14:23,231] Trial 3 finished with value: -0.01359477438319572 and parameters: {'model_type': 'gcn', 'hidden_dims': '[512, 64]', 'dropout': 0.5938127374509361, 'batch_norm': False, 'lr': 5.67704586114731e-06, 'weight_decay': 2.4518087630137052e-05, 'epochs': 320, 'loss': 'mae', 'optimizer': 'adam', 'graph_mode': 'off', 'use_snp_selection': False}. Best is trial 0 with value: 0.05222342559177535.
[I 2025-11-03 13:14:25,211] Trial 4 finished with value: -0.021459260848874347 and parameters: {'model_type': 'gcn', 'hidden_dims': '[512, 128]', 'dropout': 0.25746343592134413, 'batch_norm': True, 'lr': 1.3467657668402788e-06, 'weight_decay': 0.00033087251918647806, 'epochs': 277, 'loss': 'mse', 'optimizer': 'adam', 'graph_mode': 'off', 'use_snp_selection': True, 'num_snps': 36675}. Best is trial 0 with value: 0.05222342559177535.
[I 2025-11-03 13:14:26,702] Trial 5 finished with value: 0.022202546152813717 and parameters: {'model_type': 'gcn', 'hidden_dims': '[512, 64]', 'dropout': 0.38275350994408375, 'batch_norm': True, 'lr': 1.5586664309232824e-06, 'weight_decay': 0.0008227664668621182, 'epochs': 145, 'loss': 'mae', 'optimizer': 'adam', 'graph_mode': 'off', 'use_snp_selection': True, 'num_snps': 32148}. Best is trial 0 with value: 0.05222342559177535.
[I 2025-11-03 13:14:27,850] Trial 6 finished with value: -0.0015687611697743622 and parameters: {'model_type': 'gcn', 'hidden_dims': '[256, 128]', 'dropout': 0.3930109900265879, 'batch_norm': False, 'lr': 4.892964372128395e-05, 'weight_decay': 1.5809549317992182e-06, 'epochs': 199, 'loss': 'mse', 'optimizer': 'adam', 'graph_mode': 'off', 'use_snp_selection': False}. Best is trial 0 with value: 0.05222342559177535.
[I 2025-11-03 13:14:29,021] Trial 7 finished with value: 0.06041828029103481 and parameters: {'model_type': 'gcn', 'hidden_dims': '[512, 256]', 'dropout': 0.15343979219678458, 'batch_norm': True, 'lr': 6.234003099047341e-05, 'weight_decay': 3.894760610535477e-07, 'epochs': 97, 'loss': 'mse', 'optimizer': 'adam', 'graph_mode': 'off', 'use_snp_selection': False}. Best is trial 7 with value: 0.06041828029103481.
[I 2025-11-03 13:14:31,230] Trial 8 finished with value: 0.04234970242472718 and parameters: {'model_type': 'gcn', 'hidden_dims': '[512, 128]', 'dropout': 0.10743001231661406, 'batch_norm': True, 'lr': 0.00023728538449271062, 'weight_decay': 1.7629071578048637e-05, 'epochs': 312, 'loss': 'mae', 'optimizer': 'adam', 'graph_mode': 'off', 'use_snp_selection': False}. Best is trial 7 with value: 0.06041828029103481.
[I 2025-11-03 13:14:32,730] Trial 9 finished with value: 0.024961713276967154 and parameters: {'model_type': 'gcn', 'hidden_dims': '[512, 64]', 'dropout': 0.14505336736221927, 'batch_norm': True, 'lr': 5.8619638388111826e-05, 'weight_decay': 6.200156172669308e-07, 'epochs': 175, 'loss': 'mse', 'optimizer': 'adam', 'graph_mode': 'off', 'use_snp_selection': False}. Best is trial 7 with value: 0.06041828029103481.
[I 2025-11-03 13:14:33,652] Trial 10 finished with value: 0.027109799566633216 and parameters: {'model_type': 'gcn', 'hidden_dims': '[512, 256]', 'dropout': 0.2736992815328032, 'batch_norm': False, 'lr': 0.00032393778075602147, 'weight_decay': 1.1511946696017091e-07, 'epochs': 41, 'loss': 'mse', 'optimizer': 'adam', 'graph_mode': 'off', 'use_snp_selection': False}. Best is trial 7 with value: 0.06041828029103481.
[I 2025-11-03 13:14:35,232] Trial 11 finished with value: 0.027554483064881077 and parameters: {'model_type': 'gcn', 'hidden_dims': '[128, 64]', 'dropout': 0.20575649780603572, 'batch_norm': True, 'lr': 1.533469452994329e-05, 'weight_decay': 6.927904595719805e-05, 'epochs': 72, 'loss': 'mae', 'optimizer': 'adam', 'graph_mode': 'off', 'use_snp_selection': True, 'num_snps': 59915}. Best is trial 7 with value: 0.06041828029103481.
[I 2025-11-03 13:14:37,096] Trial 12 finished with value: 0.05054923985055923 and parameters: {'model_type': 'gcn', 'hidden_dims': '[512, 256]', 'dropout': 0.19280032873546485, 'batch_norm': True, 'lr': 0.0008000655871733662, 'weight_decay': 1.7707601073886124e-06, 'epochs': 99, 'loss': 'mae', 'optimizer': 'adam', 'graph_mode': 'off', 'use_snp_selection': True, 'num_snps': 53668}. Best is trial 7 with value: 0.06041828029103481.
[I 2025-11-03 13:14:38,460] Trial 13 finished with value: 0.014556230623887972 and parameters: {'model_type': 'gcn', 'hidden_dims': '[128, 64]', 'dropout': 0.29458192381558046, 'batch_norm': True, 'lr': 1.505600827765556e-05, 'weight_decay': 2.758565125101626e-07, 'epochs': 348, 'loss': 'mse', 'optimizer': 'adam', 'graph_mode': 'off', 'use_snp_selection': True, 'num_snps': 10373}. Best is trial 7 with value: 0.06041828029103481.
[I 2025-11-03 13:14:39,543] Trial 14 finished with value: 0.0342982588911609 and parameters: {'model_type': 'gcn', 'hidden_dims': '[128, 64]', 'dropout': 0.18204718396241185, 'batch_norm': True, 'lr': 0.00013444552145941421, 'weight_decay': 3.3175944679884834e-06, 'epochs': 234, 'loss': 'mae', 'optimizer': 'adam', 'graph_mode': 'off', 'use_snp_selection': False}. Best is trial 7 with value: 0.06041828029103481.
[I 2025-11-03 13:14:41,311] Trial 15 finished with value: 0.04754011693815866 and parameters: {'model_type': 'gcn', 'hidden_dims': '[512, 256]', 'dropout': 0.10855491845411447, 'batch_norm': True, 'lr': 1.881687628296091e-05, 'weight_decay': 6.915559732023192e-05, 'epochs': 120, 'loss': 'mse', 'optimizer': 'adam', 'graph_mode': 'off', 'use_snp_selection': True, 'num_snps': 45389}. Best is trial 7 with value: 0.06041828029103481.
[I 2025-11-03 13:14:42,735] Trial 16 finished with value: 0.0033469479427758065 and parameters: {'model_type': 'gcn', 'hidden_dims': '[256, 128, 64]', 'dropout': 0.33587209601766577, 'batch_norm': True, 'lr': 4.695336915352456e-06, 'weight_decay': 5.183566262465886e-06, 'epochs': 208, 'loss': 'mae', 'optimizer': 'adam', 'graph_mode': 'off', 'use_snp_selection': False}. Best is trial 7 with value: 0.06041828029103481.
[I 2025-11-03 13:14:44,225] Trial 17 finished with value: -0.039708178264338 and parameters: {'model_type': 'gcn', 'hidden_dims': '[128, 64]', 'dropout': 0.4978127166512159, 'batch_norm': True, 'lr': 7.401977968654633e-06, 'weight_decay': 3.9049357454211614e-05, 'epochs': 273, 'loss': 'mse', 'optimizer': 'adam', 'graph_mode': 'off', 'use_snp_selection': True, 'num_snps': 25400}. Best is trial 7 with value: 0.06041828029103481.
[I 2025-11-03 13:14:45,772] Trial 18 finished with value: 0.007793422538404793 and parameters: {'model_type': 'gcn', 'hidden_dims': '[512, 256]', 'dropout': 0.23668545027886506, 'batch_norm': False, 'lr': 2.6615913728336986e-05, 'weight_decay': 4.301765474639332e-07, 'epochs': 80, 'loss': 'mae', 'optimizer': 'adam', 'graph_mode': 'off', 'use_snp_selection': True, 'num_snps': 42723}. Best is trial 7 with value: 0.06041828029103481.
[I 2025-11-03 13:14:46,666] Trial 19 finished with value: 0.007090790154472493 and parameters: {'model_type': 'gcn', 'hidden_dims': '[128, 64]', 'dropout': 0.3223334118442611, 'batch_norm': True, 'lr': 2.343388704248642e-06, 'weight_decay': 0.0001479071923087137, 'epochs': 161, 'loss': 'mse', 'optimizer': 'adam', 'graph_mode': 'off', 'use_snp_selection': False}. Best is trial 7 with value: 0.06041828029103481.
[I 2025-11-03 13:14:47,590] Trial 20 finished with value: 0.054782789645442725 and parameters: {'model_type': 'gcn', 'hidden_dims': '[512, 256]', 'dropout': 0.1552554081865764, 'batch_norm': True, 'lr': 0.00013071523842129602, 'weight_decay': 1.0573861856708456e-07, 'epochs': 48, 'loss': 'mse', 'optimizer': 'adam', 'graph_mode': 'off', 'use_snp_selection': False}. Best is trial 7 with value: 0.06041828029103481.
[I 2025-11-03 13:14:48,584] Trial 21 finished with value: 0.06424033980810925 and parameters: {'model_type': 'gcn', 'hidden_dims': '[512, 256]', 'dropout': 0.15271689212205583, 'batch_norm': True, 'lr': 0.00012494186908621662, 'weight_decay': 1.0832046886610728e-07, 'epochs': 53, 'loss': 'mse', 'optimizer': 'adam', 'graph_mode': 'off', 'use_snp_selection': False}. Best is trial 21 with value: 0.06424033980810925.
[I 2025-11-03 13:14:49,488] Trial 22 finished with value: 0.06896585557607034 and parameters: {'model_type': 'gcn', 'hidden_dims': '[512, 256]', 'dropout': 0.15230121725786155, 'batch_norm': True, 'lr': 0.00011140724096605452, 'weight_decay': 1.2197125429945502e-07, 'epochs': 40, 'loss': 'mse', 'optimizer': 'adam', 'graph_mode': 'off', 'use_snp_selection': False}. Best is trial 22 with value: 0.06896585557607034.
[I 2025-11-03 13:14:50,742] Trial 23 finished with value: 0.045671570506235756 and parameters: {'model_type': 'gcn', 'hidden_dims': '[512, 256]', 'dropout': 0.1432972846015528, 'batch_norm': True, 'lr': 0.0004536823738596522, 'weight_decay': 2.5747368440794024e-07, 'epochs': 113, 'loss': 'mse', 'optimizer': 'adam', 'graph_mode': 'off', 'use_snp_selection': False}. Best is trial 22 with value: 0.06896585557607034.
[I 2025-11-03 13:14:51,804] Trial 24 finished with value: 0.055689950706217975 and parameters: {'model_type': 'gcn', 'hidden_dims': '[512, 256]', 'dropout': 0.23576066125140682, 'batch_norm': True, 'lr': 0.00012097063396496938, 'weight_decay': 7.124459546710191e-07, 'epochs': 68, 'loss': 'mse', 'optimizer': 'adam', 'graph_mode': 'off', 'use_snp_selection': False}. Best is trial 22 with value: 0.06896585557607034.
[I 2025-11-03 13:14:52,979] Trial 25 finished with value: 0.044212840861014215 and parameters: {'model_type': 'gcn', 'hidden_dims': '[512, 256]', 'dropout': 0.1114360361732552, 'batch_norm': True, 'lr': 0.0001994238904915005, 'weight_decay': 1.967743132725034e-07, 'epochs': 96, 'loss': 'mse', 'optimizer': 'adam', 'graph_mode': 'off', 'use_snp_selection': False}. Best is trial 22 with value: 0.06896585557607034.
[I 2025-11-03 13:14:53,941] Trial 26 finished with value: 0.0011655701371614709 and parameters: {'model_type': 'gcn', 'hidden_dims': '[512, 256]', 'dropout': 0.16509925973897774, 'batch_norm': False, 'lr': 8.62543952190633e-05, 'weight_decay': 9.178121139811863e-07, 'epochs': 56, 'loss': 'mse', 'optimizer': 'adam', 'graph_mode': 'off', 'use_snp_selection': False}. Best is trial 22 with value: 0.06896585557607034.
[I 2025-11-03 13:14:54,880] Trial 27 finished with value: 0.02927718798641767 and parameters: {'model_type': 'gcn', 'hidden_dims': '[512, 256]', 'dropout': 0.2296869975784268, 'batch_norm': True, 'lr': 3.593930581907483e-05, 'weight_decay': 1.0330786507533101e-07, 'epochs': 40, 'loss': 'mse', 'optimizer': 'adam', 'graph_mode': 'off', 'use_snp_selection': False}. Best is trial 22 with value: 0.06896585557607034.
[I 2025-11-03 13:14:56,001] Trial 28 finished with value: 0.06973059670628973 and parameters: {'model_type': 'gcn', 'hidden_dims': '[512, 256]', 'dropout': 0.2870083375267846, 'batch_norm': True, 'lr': 0.0006795983013440398, 'weight_decay': 3.8430712513356246e-07, 'epochs': 82, 'loss': 'mse', 'optimizer': 'adam', 'graph_mode': 'off', 'use_snp_selection': False}. Best is trial 28 with value: 0.06973059670628973.
[I 2025-11-03 13:14:57,109] Trial 29 finished with value: 0.04607380899156124 and parameters: {'model_type': 'gcn', 'hidden_dims': '[256, 128, 64]', 'dropout': 0.29126838923312404, 'batch_norm': True, 'lr': 0.0007974801866007125, 'weight_decay': 1.7439870926263151e-07, 'epochs': 128, 'loss': 'mse', 'optimizer': 'adam', 'graph_mode': 'off', 'use_snp_selection': False}. Best is trial 28 with value: 0.06973059670628973.
[I 2025-11-03 13:14:58,246] Trial 30 finished with value: 0.045159646494874174 and parameters: {'model_type': 'gcn', 'hidden_dims': '[512, 128]', 'dropout': 0.4791977708931562, 'batch_norm': True, 'lr': 0.00046542647588231295, 'weight_decay': 1.0081692501070578e-06, 'epochs': 80, 'loss': 'mse', 'optimizer': 'adam', 'graph_mode': 'off', 'use_snp_selection': False}. Best is trial 28 with value: 0.06973059670628973.
[I 2025-11-03 13:14:59,451] Trial 31 finished with value: 0.05133436557114149 and parameters: {'model_type': 'gcn', 'hidden_dims': '[512, 256]', 'dropout': 0.20692114661931404, 'batch_norm': True, 'lr': 0.00022252649168792203, 'weight_decay': 3.751211124526514e-07, 'epochs': 95, 'loss': 'mse', 'optimizer': 'adam', 'graph_mode': 'off', 'use_snp_selection': False}. Best is trial 28 with value: 0.06973059670628973.
[I 2025-11-03 13:15:00,222] Trial 32 finished with value: 0.02926554604614722 and parameters: {'model_type': 'gcn', 'hidden_dims': '[256, 128]', 'dropout': 0.1348747253894609, 'batch_norm': True, 'lr': 8.844843830007214e-05, 'weight_decay': 4.6706423312896654e-07, 'epochs': 65, 'loss': 'mse', 'optimizer': 'adam', 'graph_mode': 'off', 'use_snp_selection': False}. Best is trial 28 with value: 0.06973059670628973.
[I 2025-11-03 13:15:01,367] Trial 33 finished with value: 0.02235997756813027 and parameters: {'model_type': 'gcn', 'hidden_dims': '[512, 256]', 'dropout': 0.16315498817570093, 'batch_norm': True, 'lr': 4.129608772194939e-05, 'weight_decay': 1.8925263085928503e-07, 'epochs': 84, 'loss': 'mse', 'optimizer': 'adam', 'graph_mode': 'off', 'use_snp_selection': False}. Best is trial 28 with value: 0.06973059670628973.
[I 2025-11-03 13:15:02,685] Trial 34 finished with value: 0.04903092146408932 and parameters: {'model_type': 'gcn', 'hidden_dims': '[512, 256]', 'dropout': 0.1948304940395879, 'batch_norm': True, 'lr': 0.0004522660098225872, 'weight_decay': 5.7566440423679684e-06, 'epochs': 131, 'loss': 'mse', 'optimizer': 'adam', 'graph_mode': 'off', 'use_snp_selection': False}. Best is trial 28 with value: 0.06973059670628973.
[I 2025-11-03 13:15:03,645] Trial 35 finished with value: 0.009197831353151217 and parameters: {'model_type': 'gcn', 'hidden_dims': '[512, 256]', 'dropout': 0.5949969563699535, 'batch_norm': False, 'lr': 2.5426840142950367e-05, 'weight_decay': 2.4657872974963767e-06, 'epochs': 60, 'loss': 'mse', 'optimizer': 'adam', 'graph_mode': 'off', 'use_snp_selection': False}. Best is trial 28 with value: 0.06973059670628973.
[I 2025-11-03 13:15:04,574] Trial 36 finished with value: 0.04464586962290164 and parameters: {'model_type': 'gcn', 'hidden_dims': '[256, 128]', 'dropout': 0.44730191403146535, 'batch_norm': True, 'lr': 7.346660299262358e-05, 'weight_decay': 3.1314798084955864e-07, 'epochs': 106, 'loss': 'mse', 'optimizer': 'adam', 'graph_mode': 'off', 'use_snp_selection': False}. Best is trial 28 with value: 0.06973059670628973.
[I 2025-11-03 13:15:05,541] Trial 37 finished with value: 0.007301456823227712 and parameters: {'model_type': 'gcn', 'hidden_dims': '[512, 64]', 'dropout': 0.3730906829284106, 'batch_norm': True, 'lr': 8.488784293437861e-06, 'weight_decay': 1.2689567517745076e-06, 'epochs': 55, 'loss': 'mse', 'optimizer': 'adam', 'graph_mode': 'off', 'use_snp_selection': False}. Best is trial 28 with value: 0.06973059670628973.
