[I 2025-11-03 13:36:06,869] Trial 113 finished with value: 0.15070839306265427 and parameters: {'model_type': 'gcn', 'hidden_dims': '[512, 256]', 'dropout': 0.10168681640839962, 'batch_norm': True, 'lr': 0.00026418253183757193, 'weight_decay': 1.0822525037535993e-06, 'epochs': 114, 'loss': 'mae', 'optimizer': 'adam', 'graph_mode': 'off', 'use_snp_selection': True, 'num_snps': 30859}. Best is trial 112 with value: 0.18151155069920277.
[I 2025-11-03 13:36:09,245] Trial 114 finished with value: 0.16485911620991323 and parameters: {'model_type': 'gcn', 'hidden_dims': '[512, 256]', 'dropout': 0.11828260185347288, 'batch_norm': True, 'lr': 0.0003716322907130804, 'weight_decay': 4.619475954595332e-07, 'epochs': 106, 'loss': 'mae', 'optimizer': 'adam', 'graph_mode': 'off', 'use_snp_selection': True, 'num_snps': 40646}. Best is trial 112 with value: 0.18151155069920277.
[I 2025-11-03 13:36:11,164] Trial 115 finished with value: 0.15623258263690784 and parameters: {'model_type': 'gcn', 'hidden_dims': '[512, 256]', 'dropout': 0.13740785547427434, 'batch_norm': True, 'lr': 0.0006551326153168904, 'weight_decay': 7.39551032367663e-07, 'epochs': 95, 'loss': 'mae', 'optimizer': 'adam', 'graph_mode': 'off', 'use_snp_selection': True, 'num_snps': 30857}. Best is trial 112 with value: 0.18151155069920277.
[I 2025-11-03 13:36:13,709] Trial 116 finished with value: 0.13945495067524458 and parameters: {'model_type': 'gcn', 'hidden_dims': '[256, 128, 64]', 'dropout': 0.1020974914302953, 'batch_norm': False, 'lr': 0.00032541084209751617, 'weight_decay': 3.539434598702264e-07, 'epochs': 153, 'loss': 'mae', 'optimizer': 'adam', 'graph_mode': 'off', 'use_snp_selection': True, 'num_snps': 49788}. Best is trial 112 with value: 0.18151155069920277.
[I 2025-11-03 13:36:15,642] Trial 117 finished with value: 0.16514290058584502 and parameters: {'model_type': 'gcn', 'hidden_dims': '[512, 256]', 'dropout': 0.14768038485471238, 'batch_norm': True, 'lr': 0.0007592009035232788, 'weight_decay': 5.60076891413475e-07, 'epochs': 123, 'loss': 'mae', 'optimizer': 'adam', 'graph_mode': 'off', 'use_snp_selection': True, 'num_snps': 26584}. Best is trial 112 with value: 0.18151155069920277.
[I 2025-11-03 13:36:18,514] Trial 118 finished with value: 0.1604147078529531 and parameters: {'model_type': 'gcn', 'hidden_dims': '[512, 128]', 'dropout': 0.12663507165690327, 'batch_norm': True, 'lr': 0.0005297687337993607, 'weight_decay': 1.9274803214008618e-07, 'epochs': 178, 'loss': 'mae', 'optimizer': 'adam', 'graph_mode': 'off', 'use_snp_selection': True, 'num_snps': 40304}. Best is trial 112 with value: 0.18151155069920277.
[I 2025-11-03 13:36:22,017] Trial 119 finished with value: 0.16020606301705986 and parameters: {'model_type': 'gcn', 'hidden_dims': '[512, 256]', 'dropout': 0.11078302210314854, 'batch_norm': True, 'lr': 0.0009586520806374446, 'weight_decay': 6.943819847596536e-06, 'epochs': 170, 'loss': 'mse', 'optimizer': 'adam', 'graph_mode': 'off', 'use_snp_selection': True, 'num_snps': 54901}. Best is trial 112 with value: 0.18151155069920277.
[I 2025-11-03 13:36:25,258] Trial 120 finished with value: 0.15861821818281258 and parameters: {'model_type': 'gcn', 'hidden_dims': '[512, 256]', 'dropout': 0.28314644444154075, 'batch_norm': True, 'lr': 0.00040922257725053453, 'weight_decay': 1.682196408245533e-07, 'epochs': 189, 'loss': 'mae', 'optimizer': 'adam', 'graph_mode': 'off', 'use_snp_selection': True, 'num_snps': 46217}. Best is trial 112 with value: 0.18151155069920277.
[I 2025-11-03 13:36:26,975] Trial 121 finished with value: 0.16076069761939368 and parameters: {'model_type': 'gcn', 'hidden_dims': '[512, 256]', 'dropout': 0.1990428395280351, 'batch_norm': True, 'lr': 0.0004379876768839371, 'weight_decay': 2.863933472573157e-07, 'epochs': 88, 'loss': 'mae', 'optimizer': 'adam', 'graph_mode': 'off', 'use_snp_selection': False}. Best is trial 112 with value: 0.18151155069920277.
[I 2025-11-03 13:36:28,598] Trial 122 finished with value: 0.17423182819223149 and parameters: {'model_type': 'gcn', 'hidden_dims': '[512, 256]', 'dropout': 0.2552754706496737, 'batch_norm': True, 'lr': 0.00028406361043052317, 'weight_decay': 3.1711455507394456e-07, 'epochs': 81, 'loss': 'mae', 'optimizer': 'adam', 'graph_mode': 'off', 'use_snp_selection': False}. Best is trial 112 with value: 0.18151155069920277.
[I 2025-11-03 13:36:30,425] Trial 123 finished with value: 0.14097404833837826 and parameters: {'model_type': 'gcn', 'hidden_dims': '[512, 256]', 'dropout': 0.2543504214309901, 'batch_norm': True, 'lr': 0.0001780115863161502, 'weight_decay': 4.0630933286573406e-07, 'epochs': 98, 'loss': 'mae', 'optimizer': 'adam', 'graph_mode': 'off', 'use_snp_selection': False}. Best is trial 112 with value: 0.18151155069920277.
[I 2025-11-03 13:36:33,455] Trial 124 finished with value: 0.15586040648779145 and parameters: {'model_type': 'gcn', 'hidden_dims': '[512, 256]', 'dropout': 0.13004636328671298, 'batch_norm': True, 'lr': 0.00023999535779593847, 'weight_decay': 6.793970585160317e-07, 'epochs': 242, 'loss': 'mae', 'optimizer': 'adam', 'graph_mode': 'off', 'use_snp_selection': True, 'num_snps': 32632}. Best is trial 112 with value: 0.18151155069920277.
[I 2025-11-03 13:36:35,457] Trial 125 finished with value: 0.1718496887855111 and parameters: {'model_type': 'gcn', 'hidden_dims': '[512, 256]', 'dropout': 0.30894840820413616, 'batch_norm': True, 'lr': 0.00031391829178792314, 'weight_decay': 1.287934083756025e-07, 'epochs': 113, 'loss': 'mae', 'optimizer': 'adam', 'graph_mode': 'off', 'use_snp_selection': False}. Best is trial 112 with value: 0.18151155069920277.
[I 2025-11-03 13:36:39,523] Trial 126 finished with value: 0.04726061501870986 and parameters: {'model_type': 'gcn', 'hidden_dims': '[512, 64]', 'dropout': 0.11251832706638847, 'batch_norm': True, 'lr': 2.3732095640054574e-06, 'weight_decay': 8.634776600249373e-07, 'epochs': 291, 'loss': 'mae', 'optimizer': 'adam', 'graph_mode': 'off', 'use_snp_selection': False}. Best is trial 112 with value: 0.18151155069920277.
[I 2025-11-03 13:36:44,213] Trial 127 finished with value: 0.15767795891974498 and parameters: {'model_type': 'gcn', 'hidden_dims': '[512, 256]', 'dropout': 0.24021544227281408, 'batch_norm': True, 'lr': 0.0005992185674002944, 'weight_decay': 2.3178395902901569e-07, 'epochs': 342, 'loss': 'mae', 'optimizer': 'adam', 'graph_mode': 'off', 'use_snp_selection': False}. Best is trial 112 with value: 0.18151155069920277.
[I 2025-11-03 13:36:46,491] Trial 128 finished with value: 0.1527065118634718 and parameters: {'model_type': 'gcn', 'hidden_dims': '[512, 128]', 'dropout': 0.15733911890001098, 'batch_norm': True, 'lr': 0.0002029551663642218, 'weight_decay': 5.168561569654832e-07, 'epochs': 137, 'loss': 'mae', 'optimizer': 'adam', 'graph_mode': 'off', 'use_snp_selection': False}. Best is trial 112 with value: 0.18151155069920277.
[I 2025-11-03 13:36:48,777] Trial 129 finished with value: 0.14661011768077403 and parameters: {'model_type': 'gcn', 'hidden_dims': '[512, 256]', 'dropout': 0.26057337544752585, 'batch_norm': True, 'lr': 0.0002780287571324436, 'weight_decay': 2.0865040391401437e-05, 'epochs': 81, 'loss': 'mae', 'optimizer': 'adam', 'graph_mode': 'off', 'use_snp_selection': True, 'num_snps': 43879}. Best is trial 112 with value: 0.18151155069920277.
[I 2025-11-03 13:36:52,536] Trial 130 finished with value: 0.16136914243462705 and parameters: {'model_type': 'gcn', 'hidden_dims': '[512, 256]', 'dropout': 0.10128155547150447, 'batch_norm': True, 'lr': 0.00038449586469420523, 'weight_decay': 3.309806617341607e-07, 'epochs': 267, 'loss': 'mae', 'optimizer': 'adam', 'graph_mode': 'off', 'use_snp_selection': False}. Best is trial 112 with value: 0.18151155069920277.
[I 2025-11-03 13:36:54,071] Trial 131 finished with value: 0.16642244517100377 and parameters: {'model_type': 'gcn', 'hidden_dims': '[512, 256]', 'dropout': 0.21692154283487308, 'batch_norm': True, 'lr': 0.0004742910273155786, 'weight_decay': 2.849147069980614e-07, 'epochs': 70, 'loss': 'mae', 'optimizer': 'adam', 'graph_mode': 'off', 'use_snp_selection': False}. Best is trial 112 with value: 0.18151155069920277.
[I 2025-11-03 13:36:55,633] Trial 132 finished with value: 0.15796002635707673 and parameters: {'model_type': 'gcn', 'hidden_dims': '[512, 256]', 'dropout': 0.17958715675792275, 'batch_norm': True, 'lr': 0.000565628243743568, 'weight_decay': 4.2417740843641456e-07, 'epochs': 75, 'loss': 'mae', 'optimizer': 'adam', 'graph_mode': 'off', 'use_snp_selection': False}. Best is trial 112 with value: 0.18151155069920277.
[I 2025-11-03 13:36:57,497] Trial 133 finished with value: 0.1670604874970368 and parameters: {'model_type': 'gcn', 'hidden_dims': '[512, 256]', 'dropout': 0.2307696073034902, 'batch_norm': True, 'lr': 0.0004790357784577795, 'weight_decay': 3.314136476197419e-07, 'epochs': 98, 'loss': 'mae', 'optimizer': 'adam', 'graph_mode': 'off', 'use_snp_selection': False}. Best is trial 112 with value: 0.18151155069920277.
[I 2025-11-03 13:36:59,567] Trial 134 finished with value: 0.16072611373656912 and parameters: {'model_type': 'gcn', 'hidden_dims': '[512, 256]', 'dropout': 0.20559255406388066, 'batch_norm': True, 'lr': 0.00035320435236844196, 'weight_decay': 2.48247955298609e-07, 'epochs': 120, 'loss': 'mae', 'optimizer': 'adam', 'graph_mode': 'off', 'use_snp_selection': False}. Best is trial 112 with value: 0.18151155069920277.
[I 2025-11-03 13:37:00,527] Trial 135 finished with value: 0.1599683655256947 and parameters: {'model_type': 'gcn', 'hidden_dims': '[256, 128]', 'dropout': 0.27839963461942124, 'batch_norm': True, 'lr': 0.00029116453354181425, 'weight_decay': 5.873417533409109e-07, 'epochs': 57, 'loss': 'mae', 'optimizer': 'adam', 'graph_mode': 'off', 'use_snp_selection': False}. Best is trial 112 with value: 0.18151155069920277.
[I 2025-11-03 13:37:02,871] Trial 136 finished with value: 0.1364158214047719 and parameters: {'model_type': 'gcn', 'hidden_dims': '[512, 256]', 'dropout': 0.12068512693811612, 'batch_norm': False, 'lr': 0.0006845211740531395, 'weight_decay': 1.7461014456642194e-07, 'epochs': 146, 'loss': 'mae', 'optimizer': 'adam', 'graph_mode': 'off', 'use_snp_selection': False}. Best is trial 112 with value: 0.18151155069920277.
[I 2025-11-03 13:37:05,392] Trial 137 finished with value: 0.17492804670315598 and parameters: {'model_type': 'gcn', 'hidden_dims': '[512, 256]', 'dropout': 0.18915407768351788, 'batch_norm': True, 'lr': 0.0008298762811176194, 'weight_decay': 4.6572499814231804e-07, 'epochs': 159, 'loss': 'mae', 'optimizer': 'adam', 'graph_mode': 'off', 'use_snp_selection': False}. Best is trial 112 with value: 0.18151155069920277.
[I 2025-11-03 13:37:06,626] Trial 138 finished with value: 0.15933799389734996 and parameters: {'model_type': 'gcn', 'hidden_dims': '[128, 64]', 'dropout': 0.18941836195145775, 'batch_norm': True, 'lr': 0.0007076796645881226, 'weight_decay': 0.0009043936909643864, 'epochs': 157, 'loss': 'mae', 'optimizer': 'adam', 'graph_mode': 'off', 'use_snp_selection': False}. Best is trial 112 with value: 0.18151155069920277.
[I 2025-11-03 13:37:09,201] Trial 139 finished with value: 0.16394611930673275 and parameters: {'model_type': 'gcn', 'hidden_dims': '[512, 128]', 'dropout': 0.1451316005614964, 'batch_norm': True, 'lr': 0.0008046210779772741, 'weight_decay': 2.784731289221599e-05, 'epochs': 161, 'loss': 'mse', 'optimizer': 'adam', 'graph_mode': 'off', 'use_snp_selection': False}. Best is trial 112 with value: 0.18151155069920277.
[I 2025-11-03 13:37:10,408] Trial 140 finished with value: 0.11360117880876858 and parameters: {'model_type': 'gcn', 'hidden_dims': '[512, 256]', 'dropout': 0.1686455080910191, 'batch_norm': True, 'lr': 0.0008393398160703735, 'weight_decay': 4.897792434233662e-07, 'epochs': 108, 'loss': 'mae', 'optimizer': 'adam', 'graph_mode': 'off', 'use_snp_selection': True, 'num_snps': 8965}. Best is trial 112 with value: 0.18151155069920277.
[I 2025-11-03 13:37:13,136] Trial 141 finished with value: 0.15696808712049964 and parameters: {'model_type': 'gcn', 'hidden_dims': '[512, 256]', 'dropout': 0.20178172574674946, 'batch_norm': True, 'lr': 0.0005461872647467922, 'weight_decay': 3.9193569527727814e-07, 'epochs': 175, 'loss': 'mae', 'optimizer': 'adam', 'graph_mode': 'off', 'use_snp_selection': False}. Best is trial 112 with value: 0.18151155069920277.
[I 2025-11-03 13:37:14,575] Trial 142 finished with value: 0.1660594534958996 and parameters: {'model_type': 'gcn', 'hidden_dims': '[512, 256]', 'dropout': 0.22242310387177633, 'batch_norm': True, 'lr': 0.0004141502243524934, 'weight_decay': 6.469136312191879e-07, 'epochs': 62, 'loss': 'mae', 'optimizer': 'adam', 'graph_mode': 'off', 'use_snp_selection': False}. Best is trial 112 with value: 0.18151155069920277.
[I 2025-11-03 13:37:15,835] Trial 143 finished with value: 0.14668798520897375 and parameters: {'model_type': 'gcn', 'hidden_dims': '[512, 256]', 'dropout': 0.21121969483078784, 'batch_norm': True, 'lr': 0.0006464766965838587, 'weight_decay': 1.5141184581113783e-05, 'epochs': 50, 'loss': 'mae', 'optimizer': 'adam', 'graph_mode': 'off', 'use_snp_selection': False}. Best is trial 112 with value: 0.18151155069920277.
[I 2025-11-03 13:37:17,599] Trial 144 finished with value: 0.09888174603693885 and parameters: {'model_type': 'gcn', 'hidden_dims': '[512, 256]', 'dropout': 0.24913640436905538, 'batch_norm': True, 'lr': 3.9562289979889884e-05, 'weight_decay': 3.057318004728366e-07, 'epochs': 90, 'loss': 'mae', 'optimizer': 'adam', 'graph_mode': 'off', 'use_snp_selection': False}. Best is trial 112 with value: 0.18151155069920277.
[I 2025-11-03 13:37:19,276] Trial 145 finished with value: 0.1449283528803359 and parameters: {'model_type': 'gcn', 'hidden_dims': '[512, 256]', 'dropout': 0.18801323727834834, 'batch_norm': True, 'lr': 0.0004503682386744097, 'weight_decay': 4.333690070779355e-07, 'epochs': 84, 'loss': 'mae', 'optimizer': 'adam', 'graph_mode': 'off', 'use_snp_selection': False}. Best is trial 112 with value: 0.18151155069920277.
[I 2025-11-03 13:37:21,016] Trial 146 finished with value: 0.1691551804295722 and parameters: {'model_type': 'gcn', 'hidden_dims': '[256, 128, 64]', 'dropout': 0.2307741902441438, 'batch_norm': True, 'lr': 0.0003425563340294969, 'weight_decay': 8.620085823678202e-07, 'epochs': 150, 'loss': 'mae', 'optimizer': 'adam', 'graph_mode': 'off', 'use_snp_selection': False}. Best is trial 112 with value: 0.18151155069920277.
[I 2025-11-03 13:37:24,071] Trial 147 finished with value: 0.15743773070943715 and parameters: {'model_type': 'gcn', 'hidden_dims': '[512, 256]', 'dropout': 0.13435917690511298, 'batch_norm': True, 'lr': 0.0005018898430739892, 'weight_decay': 2.152536293470843e-07, 'epochs': 202, 'loss': 'mae', 'optimizer': 'adam', 'graph_mode': 'off', 'use_snp_selection': False}. Best is trial 112 with value: 0.18151155069920277.
[I 2025-11-03 13:37:26,376] Trial 148 finished with value: 0.0901043988065444 and parameters: {'model_type': 'gcn', 'hidden_dims': '[512, 256]', 'dropout': 0.17721882605885178, 'batch_norm': True, 'lr': 7.157126401318773e-06, 'weight_decay': 1.0198960644935872e-07, 'epochs': 134, 'loss': 'mae', 'optimizer': 'adam', 'graph_mode': 'off', 'use_snp_selection': False}. Best is trial 112 with value: 0.18151155069920277.
[I 2025-11-03 13:37:28,528] Trial 149 finished with value: 0.16486189634895532 and parameters: {'model_type': 'gcn', 'hidden_dims': '[512, 128]', 'dropout': 0.11367554281690422, 'batch_norm': True, 'lr': 0.00024875856241052876, 'weight_decay': 5.352263516498238e-07, 'epochs': 128, 'loss': 'mae', 'optimizer': 'adam', 'graph_mode': 'off', 'use_snp_selection': False}. Best is trial 112 with value: 0.18151155069920277.
[I 2025-11-03 13:37:30,615] Trial 0 finished with value: 0.017987189709976995 and parameters: {'model_type': 'gcn', 'hidden_dims': '[128, 64]', 'dropout': 0.199031432379812, 'batch_norm': True, 'lr': 1.8408544111075837e-06, 'weight_decay': 5.5136510071208614e-05, 'epochs': 336, 'loss': 'mae', 'optimizer': 'adam', 'graph_mode': 'off', 'use_snp_selection': True, 'num_snps': 43862}. Best is trial 0 with value: 0.017987189709976995.
[I 2025-11-03 13:37:32,189] Trial 1 finished with value: 0.07553454606252541 and parameters: {'model_type': 'gcn', 'hidden_dims': '[256, 128]', 'dropout': 0.4370668075331726, 'batch_norm': True, 'lr': 7.133471581159139e-05, 'weight_decay': 1.128633586803549e-05, 'epochs': 242, 'loss': 'mae', 'optimizer': 'adam', 'graph_mode': 'off', 'use_snp_selection': False}. Best is trial 1 with value: 0.07553454606252541.
[I 2025-11-03 13:37:33,264] Trial 2 finished with value: 0.0013627316718470175 and parameters: {'model_type': 'gcn', 'hidden_dims': '[256, 128, 64]', 'dropout': 0.41314357415569625, 'batch_norm': False, 'lr': 3.952233718592101e-06, 'weight_decay': 0.00026754769258252603, 'epochs': 149, 'loss': 'mse', 'optimizer': 'adam', 'graph_mode': 'off', 'use_snp_selection': True, 'num_snps': 11571}. Best is trial 1 with value: 0.07553454606252541.
[I 2025-11-03 13:37:36,002] Trial 3 finished with value: 0.035241373447591956 and parameters: {'model_type': 'gcn', 'hidden_dims': '[512, 64]', 'dropout': 0.5938127374509361, 'batch_norm': False, 'lr': 5.67704586114731e-06, 'weight_decay': 2.4518087630137052e-05, 'epochs': 320, 'loss': 'mae', 'optimizer': 'adam', 'graph_mode': 'off', 'use_snp_selection': False}. Best is trial 1 with value: 0.07553454606252541.
[I 2025-11-03 13:37:38,404] Trial 4 finished with value: 0.06542995499433835 and parameters: {'model_type': 'gcn', 'hidden_dims': '[512, 128]', 'dropout': 0.25746343592134413, 'batch_norm': True, 'lr': 1.3467657668402788e-06, 'weight_decay': 0.00033087251918647806, 'epochs': 277, 'loss': 'mse', 'optimizer': 'adam', 'graph_mode': 'off', 'use_snp_selection': True, 'num_snps': 36675}. Best is trial 1 with value: 0.07553454606252541.
[I 2025-11-03 13:37:40,107] Trial 5 finished with value: 0.0025011716008077095 and parameters: {'model_type': 'gcn', 'hidden_dims': '[512, 64]', 'dropout': 0.38275350994408375, 'batch_norm': True, 'lr': 1.5586664309232824e-06, 'weight_decay': 0.0008227664668621182, 'epochs': 145, 'loss': 'mae', 'optimizer': 'adam', 'graph_mode': 'off', 'use_snp_selection': True, 'num_snps': 32148}. Best is trial 1 with value: 0.07553454606252541.
[I 2025-11-03 13:37:41,465] Trial 6 finished with value: 0.09066211709680792 and parameters: {'model_type': 'gcn', 'hidden_dims': '[256, 128]', 'dropout': 0.3930109900265879, 'batch_norm': False, 'lr': 4.892964372128395e-05, 'weight_decay': 1.5809549317992182e-06, 'epochs': 199, 'loss': 'mse', 'optimizer': 'adam', 'graph_mode': 'off', 'use_snp_selection': False}. Best is trial 6 with value: 0.09066211709680792.
[I 2025-11-03 13:37:42,815] Trial 7 finished with value: 0.09700715487009681 and parameters: {'model_type': 'gcn', 'hidden_dims': '[512, 256]', 'dropout': 0.15343979219678458, 'batch_norm': True, 'lr': 6.234003099047341e-05, 'weight_decay': 3.894760610535477e-07, 'epochs': 97, 'loss': 'mse', 'optimizer': 'adam', 'graph_mode': 'off', 'use_snp_selection': False}. Best is trial 7 with value: 0.09700715487009681.
[I 2025-11-03 13:37:45,549] Trial 8 finished with value: 0.12197922729834741 and parameters: {'model_type': 'gcn', 'hidden_dims': '[512, 128]', 'dropout': 0.10743001231661406, 'batch_norm': True, 'lr': 0.00023728538449271062, 'weight_decay': 1.7629071578048637e-05, 'epochs': 312, 'loss': 'mae', 'optimizer': 'adam', 'graph_mode': 'off', 'use_snp_selection': False}. Best is trial 8 with value: 0.12197922729834741.
[I 2025-11-03 13:37:47,382] Trial 9 finished with value: 0.12328648436160775 and parameters: {'model_type': 'gcn', 'hidden_dims': '[512, 64]', 'dropout': 0.14505336736221927, 'batch_norm': True, 'lr': 5.8619638388111826e-05, 'weight_decay': 6.200156172669308e-07, 'epochs': 175, 'loss': 'mse', 'optimizer': 'adam', 'graph_mode': 'off', 'use_snp_selection': False}. Best is trial 9 with value: 0.12328648436160775.
[I 2025-11-03 13:37:48,396] Trial 10 finished with value: -0.0054126051495437906 and parameters: {'model_type': 'gcn', 'hidden_dims': '[512, 64]', 'dropout': 0.2753166624526289, 'batch_norm': False, 'lr': 0.00032393778075602147, 'weight_decay': 1.1714031539166645e-07, 'epochs': 44, 'loss': 'mse', 'optimizer': 'adam', 'graph_mode': 'off', 'use_snp_selection': False}. Best is trial 9 with value: 0.12328648436160775.
[I 2025-11-03 13:37:50,522] Trial 11 finished with value: 0.1317034944140768 and parameters: {'model_type': 'gcn', 'hidden_dims': '[512, 128]', 'dropout': 0.10095648685224448, 'batch_norm': True, 'lr': 0.0007381466848241794, 'weight_decay': 1.969664044175748e-06, 'epochs': 216, 'loss': 'mae', 'optimizer': 'adam', 'graph_mode': 'off', 'use_snp_selection': False}. Best is trial 11 with value: 0.1317034944140768.
[I 2025-11-03 13:37:52,657] Trial 12 finished with value: 0.14073705287297883 and parameters: {'model_type': 'gcn', 'hidden_dims': '[512, 128]', 'dropout': 0.10344600881777158, 'batch_norm': True, 'lr': 0.0006753264773209732, 'weight_decay': 2.0975627484345868e-06, 'epochs': 208, 'loss': 'mae', 'optimizer': 'adam', 'graph_mode': 'off', 'use_snp_selection': False}. Best is trial 12 with value: 0.14073705287297883.
[I 2025-11-03 13:37:54,928] Trial 13 finished with value: 0.1426536166699519 and parameters: {'model_type': 'gcn', 'hidden_dims': '[512, 128]', 'dropout': 0.24637176605202246, 'batch_norm': True, 'lr': 0.0006882846823941375, 'weight_decay': 2.6819409307287284e-06, 'epochs': 236, 'loss': 'mae', 'optimizer': 'adam', 'graph_mode': 'off', 'use_snp_selection': False}. Best is trial 13 with value: 0.1426536166699519.
[I 2025-11-03 13:37:57,337] Trial 14 finished with value: 0.12977569872989864 and parameters: {'model_type': 'gcn', 'hidden_dims': '[512, 128]', 'dropout': 0.2896280300541336, 'batch_norm': True, 'lr': 0.000923030482500558, 'weight_decay': 3.4312897322914332e-06, 'epochs': 253, 'loss': 'mae', 'optimizer': 'adam', 'graph_mode': 'off', 'use_snp_selection': False}. Best is trial 13 with value: 0.1426536166699519.
