[I 2025-12-05 19:33:21,997] Trial 109 finished with value: 0.18784606126077313 and parameters: {'model_type': 'mlp', 'hidden_dims': '[512, 64]', 'dropout': 0.5554607683016224, 'batch_norm': False, 'lr': 8.18552106699609e-06, 'weight_decay': 0.00024185970599755415, 'epochs': 108, 'loss': 'mae', 'optimizer': 'adam', 'graph_mode': 'off', 'use_snp_selection': True, 'num_snps': 11399}. Best is trial 104 with value: 0.20611400028218546.
[I 2025-12-05 19:34:01,498] Trial 110 finished with value: 0.18352522530947174 and parameters: {'model_type': 'mlp', 'hidden_dims': '[512, 64]', 'dropout': 0.5848521209364814, 'batch_norm': False, 'lr': 6.861415974562123e-06, 'weight_decay': 0.00017014668169150555, 'epochs': 114, 'loss': 'mse', 'optimizer': 'adam', 'graph_mode': 'off', 'use_snp_selection': False}. Best is trial 104 with value: 0.20611400028218546.
[I 2025-12-05 19:34:33,977] Trial 111 finished with value: 0.18410745815368876 and parameters: {'model_type': 'mlp', 'hidden_dims': '[512, 64]', 'dropout': 0.5255009185878489, 'batch_norm': False, 'lr': 4.121052529216503e-06, 'weight_decay': 0.0007050832422150757, 'epochs': 88, 'loss': 'mae', 'optimizer': 'adam', 'graph_mode': 'off', 'use_snp_selection': False}. Best is trial 104 with value: 0.20611400028218546.
[I 2025-12-05 19:35:25,236] Trial 112 finished with value: 0.18679735402681202 and parameters: {'model_type': 'mlp', 'hidden_dims': '[512, 64]', 'dropout': 0.4965436811108648, 'batch_norm': False, 'lr': 5.428763031126368e-06, 'weight_decay': 9.805577619729673e-05, 'epochs': 154, 'loss': 'mae', 'optimizer': 'adam', 'graph_mode': 'off', 'use_snp_selection': False}. Best is trial 104 with value: 0.20611400028218546.
[I 2025-12-05 19:36:25,918] Trial 113 finished with value: 0.19348980122361303 and parameters: {'model_type': 'mlp', 'hidden_dims': '[512, 64]', 'dropout': 0.47927085158689414, 'batch_norm': False, 'lr': 1.4430129219224575e-05, 'weight_decay': 0.00012191512032791659, 'epochs': 188, 'loss': 'mae', 'optimizer': 'adam', 'graph_mode': 'off', 'use_snp_selection': False}. Best is trial 104 with value: 0.20611400028218546.
[I 2025-12-05 19:37:24,434] Trial 114 finished with value: 0.18091471791360253 and parameters: {'model_type': 'mlp', 'hidden_dims': '[512, 64]', 'dropout': 0.4792058186809264, 'batch_norm': False, 'lr': 1.4723907437925516e-05, 'weight_decay': 0.0003140140881509097, 'epochs': 180, 'loss': 'mae', 'optimizer': 'adam', 'graph_mode': 'off', 'use_snp_selection': False}. Best is trial 104 with value: 0.20611400028218546.
[I 2025-12-05 19:38:29,726] Trial 115 finished with value: 0.17606157163762376 and parameters: {'model_type': 'mlp', 'hidden_dims': '[512, 64]', 'dropout': 0.5088484330011026, 'batch_norm': False, 'lr': 8.851463764603396e-06, 'weight_decay': 0.000203259788962276, 'epochs': 203, 'loss': 'mae', 'optimizer': 'adam', 'graph_mode': 'off', 'use_snp_selection': False}. Best is trial 104 with value: 0.20611400028218546.
[I 2025-12-05 19:39:17,630] Trial 116 finished with value: 0.19316553960023114 and parameters: {'model_type': 'mlp', 'hidden_dims': '[512, 64]', 'dropout': 0.5322513454017611, 'batch_norm': False, 'lr': 1.1517699439151096e-05, 'weight_decay': 5.2305234701703955e-05, 'epochs': 142, 'loss': 'mae', 'optimizer': 'adam', 'graph_mode': 'off', 'use_snp_selection': False}. Best is trial 104 with value: 0.20611400028218546.
[I 2025-12-05 19:40:05,860] Trial 117 finished with value: 0.1845433377800069 and parameters: {'model_type': 'mlp', 'hidden_dims': '[512, 256]', 'dropout': 0.5485215482468259, 'batch_norm': False, 'lr': 2.0106116043366048e-05, 'weight_decay': 4.8579533553352186e-05, 'epochs': 143, 'loss': 'mae', 'optimizer': 'adam', 'graph_mode': 'off', 'use_snp_selection': False}. Best is trial 104 with value: 0.20611400028218546.
[I 2025-12-05 19:41:06,093] Trial 118 finished with value: 0.18460590416441316 and parameters: {'model_type': 'mlp', 'hidden_dims': '[512, 64]', 'dropout': 0.5335350728064244, 'batch_norm': False, 'lr': 1.2544618055587295e-05, 'weight_decay': 6.167670345756178e-05, 'epochs': 186, 'loss': 'mae', 'optimizer': 'adam', 'graph_mode': 'off', 'use_snp_selection': False}. Best is trial 104 with value: 0.20611400028218546.
[I 2025-12-05 19:41:53,291] Trial 119 finished with value: 0.18380025479186904 and parameters: {'model_type': 'mlp', 'hidden_dims': '[512, 64]', 'dropout': 0.45117563224444074, 'batch_norm': False, 'lr': 7.353254342219499e-06, 'weight_decay': 8.252892990902722e-05, 'epochs': 139, 'loss': 'mae', 'optimizer': 'adam', 'graph_mode': 'off', 'use_snp_selection': False}. Best is trial 104 with value: 0.20611400028218546.
[I 2025-12-05 19:42:35,681] Trial 120 finished with value: 0.19586920803165925 and parameters: {'model_type': 'mlp', 'hidden_dims': '[512, 128]', 'dropout': 0.5677321730557259, 'batch_norm': False, 'lr': 1.5181343326519737e-05, 'weight_decay': 3.438138635797102e-05, 'epochs': 123, 'loss': 'mae', 'optimizer': 'adam', 'graph_mode': 'off', 'use_snp_selection': False}. Best is trial 104 with value: 0.20611400028218546.
[I 2025-12-05 19:43:16,952] Trial 121 finished with value: 0.18440796451644678 and parameters: {'model_type': 'mlp', 'hidden_dims': '[512, 128]', 'dropout': 0.5648648986421833, 'batch_norm': False, 'lr': 1.5082729137803055e-05, 'weight_decay': 3.690222262786683e-05, 'epochs': 119, 'loss': 'mae', 'optimizer': 'adam', 'graph_mode': 'off', 'use_snp_selection': False}. Best is trial 104 with value: 0.20611400028218546.
[I 2025-12-05 19:43:52,358] Trial 122 finished with value: 0.187154504882338 and parameters: {'model_type': 'mlp', 'hidden_dims': '[512, 128]', 'dropout': 0.5542204051672756, 'batch_norm': False, 'lr': 1.1517903264432268e-05, 'weight_decay': 4.4065898328457356e-05, 'epochs': 98, 'loss': 'mae', 'optimizer': 'adam', 'graph_mode': 'off', 'use_snp_selection': False}. Best is trial 104 with value: 0.20611400028218546.
[I 2025-12-05 19:44:47,392] Trial 123 finished with value: 0.18999682148228636 and parameters: {'model_type': 'mlp', 'hidden_dims': '[512, 128]', 'dropout': 0.575360877666773, 'batch_norm': False, 'lr': 1.7264153582814465e-05, 'weight_decay': 2.2450278515163176e-05, 'epochs': 168, 'loss': 'mae', 'optimizer': 'adam', 'graph_mode': 'off', 'use_snp_selection': False}. Best is trial 104 with value: 0.20611400028218546.
[I 2025-12-05 19:45:30,594] Trial 124 finished with value: 0.18379614711028633 and parameters: {'model_type': 'mlp', 'hidden_dims': '[512, 128]', 'dropout': 0.48424881373528617, 'batch_norm': False, 'lr': 2.0664975280044364e-05, 'weight_decay': 2.7274766419957497e-05, 'epochs': 126, 'loss': 'mae', 'optimizer': 'adam', 'graph_mode': 'off', 'use_snp_selection': False}. Best is trial 104 with value: 0.20611400028218546.
[I 2025-12-05 19:46:04,278] Trial 125 finished with value: 0.18978173014976793 and parameters: {'model_type': 'mlp', 'hidden_dims': '[512, 64]', 'dropout': 0.5116162118840367, 'batch_norm': False, 'lr': 9.539458028435166e-06, 'weight_decay': 0.00014639225555327195, 'epochs': 92, 'loss': 'mae', 'optimizer': 'adam', 'graph_mode': 'off', 'use_snp_selection': False}. Best is trial 104 with value: 0.20611400028218546.
[I 2025-12-05 19:46:54,077] Trial 126 finished with value: 0.19228651393079116 and parameters: {'model_type': 'mlp', 'hidden_dims': '[512, 64]', 'dropout': 0.542477869042842, 'batch_norm': False, 'lr': 8.377086562287255e-06, 'weight_decay': 6.881732751748296e-05, 'epochs': 149, 'loss': 'mae', 'optimizer': 'adam', 'graph_mode': 'off', 'use_snp_selection': False}. Best is trial 104 with value: 0.20611400028218546.
[I 2025-12-05 19:47:22,442] Trial 127 finished with value: 0.18732642721850712 and parameters: {'model_type': 'mlp', 'hidden_dims': '[256, 128]', 'dropout': 0.5421641401594459, 'batch_norm': False, 'lr': 1.3062632707005874e-05, 'weight_decay': 0.0001229434575531877, 'epochs': 151, 'loss': 'mae', 'optimizer': 'adam', 'graph_mode': 'off', 'use_snp_selection': False}. Best is trial 104 with value: 0.20611400028218546.
[I 2025-12-05 19:48:00,565] Trial 128 finished with value: 0.18811182736849605 and parameters: {'model_type': 'mlp', 'hidden_dims': '[512, 64]', 'dropout': 0.4984823195279477, 'batch_norm': True, 'lr': 2.39635302044093e-05, 'weight_decay': 7.001376405418949e-05, 'epochs': 106, 'loss': 'mae', 'optimizer': 'adam', 'graph_mode': 'off', 'use_snp_selection': False}. Best is trial 104 with value: 0.20611400028218546.
[I 2025-12-05 19:48:47,128] Trial 129 finished with value: 0.18799116724471118 and parameters: {'model_type': 'mlp', 'hidden_dims': '[512, 64]', 'dropout': 0.5749248060503391, 'batch_norm': False, 'lr': 8.1662737039237e-06, 'weight_decay': 0.0002474989890606827, 'epochs': 137, 'loss': 'mae', 'optimizer': 'adam', 'graph_mode': 'off', 'use_snp_selection': False}. Best is trial 104 with value: 0.20611400028218546.
[I 2025-12-05 19:49:31,101] Trial 130 finished with value: 0.1845471189734213 and parameters: {'model_type': 'mlp', 'hidden_dims': '[512, 64]', 'dropout': 0.5267991190780409, 'batch_norm': False, 'lr': 1.0235071269689e-05, 'weight_decay': 8.521608464009838e-05, 'epochs': 128, 'loss': 'mae', 'optimizer': 'adam', 'graph_mode': 'off', 'use_snp_selection': False}. Best is trial 104 with value: 0.20611400028218546.
[I 2025-12-05 19:50:19,680] Trial 131 finished with value: 0.1903664245641016 and parameters: {'model_type': 'mlp', 'hidden_dims': '[512, 64]', 'dropout': 0.4620967525809925, 'batch_norm': False, 'lr': 6.874026434855384e-06, 'weight_decay': 6.010195940606117e-05, 'epochs': 144, 'loss': 'mae', 'optimizer': 'adam', 'graph_mode': 'off', 'use_snp_selection': False}. Best is trial 104 with value: 0.20611400028218546.
[I 2025-12-05 19:51:00,134] Trial 132 finished with value: 0.19080125446763097 and parameters: {'model_type': 'mlp', 'hidden_dims': '[512, 64]', 'dropout': 0.5312032546356406, 'batch_norm': False, 'lr': 1.587045338677507e-05, 'weight_decay': 4.7610275767984294e-05, 'epochs': 116, 'loss': 'mae', 'optimizer': 'adam', 'graph_mode': 'off', 'use_snp_selection': False}. Best is trial 104 with value: 0.20611400028218546.
[I 2025-12-05 19:51:54,892] Trial 133 finished with value: 0.1813428370077566 and parameters: {'model_type': 'mlp', 'hidden_dims': '[512, 64]', 'dropout': 0.547468115023647, 'batch_norm': False, 'lr': 1.1834842040972783e-05, 'weight_decay': 3.333046233585894e-05, 'epochs': 166, 'loss': 'mae', 'optimizer': 'adam', 'graph_mode': 'off', 'use_snp_selection': False}. Best is trial 104 with value: 0.20611400028218546.
[I 2025-12-05 19:52:46,567] Trial 134 finished with value: 0.1840144761597871 and parameters: {'model_type': 'mlp', 'hidden_dims': '[512, 64]', 'dropout': 0.1259263264217749, 'batch_norm': False, 'lr': 8.641602019307834e-06, 'weight_decay': 5.397204059006867e-05, 'epochs': 154, 'loss': 'mae', 'optimizer': 'adam', 'graph_mode': 'off', 'use_snp_selection': False}. Best is trial 104 with value: 0.20611400028218546.
[I 2025-12-05 19:53:28,217] Trial 135 finished with value: 0.18754916681410286 and parameters: {'model_type': 'mlp', 'hidden_dims': '[512, 64]', 'dropout': 0.5570728755917204, 'batch_norm': False, 'lr': 5.920343052091928e-06, 'weight_decay': 9.727557753643761e-05, 'epochs': 120, 'loss': 'mae', 'optimizer': 'adam', 'graph_mode': 'off', 'use_snp_selection': False}. Best is trial 104 with value: 0.20611400028218546.
[I 2025-12-05 19:54:39,330] Trial 136 finished with value: 0.19072995394421027 and parameters: {'model_type': 'mlp', 'hidden_dims': '[512, 128]', 'dropout': 0.11534963213775637, 'batch_norm': False, 'lr': 6.558912958546531e-06, 'weight_decay': 0.00016588990038066964, 'epochs': 222, 'loss': 'mae', 'optimizer': 'adam', 'graph_mode': 'off', 'use_snp_selection': False}. Best is trial 104 with value: 0.20611400028218546.
[I 2025-12-05 19:55:43,396] Trial 137 finished with value: 0.18522170640525668 and parameters: {'model_type': 'mlp', 'hidden_dims': '[512, 64]', 'dropout': 0.16401575934385898, 'batch_norm': False, 'lr': 4.516646533640052e-06, 'weight_decay': 0.0001287835294695927, 'epochs': 198, 'loss': 'mse', 'optimizer': 'adam', 'graph_mode': 'off', 'use_snp_selection': False}. Best is trial 104 with value: 0.20611400028218546.
[I 2025-12-05 19:56:40,325] Trial 138 finished with value: 0.18360864480680789 and parameters: {'model_type': 'mlp', 'hidden_dims': '[512, 64]', 'dropout': 0.18381849254755075, 'batch_norm': False, 'lr': 4.0856315230082895e-06, 'weight_decay': 4.000397537676407e-05, 'epochs': 173, 'loss': 'mae', 'optimizer': 'adam', 'graph_mode': 'off', 'use_snp_selection': False}. Best is trial 104 with value: 0.20611400028218546.
[I 2025-12-05 19:57:47,050] Trial 139 finished with value: 0.1858218559488538 and parameters: {'model_type': 'mlp', 'hidden_dims': '[512, 64]', 'dropout': 0.14806877033299806, 'batch_norm': False, 'lr': 7.268050502667805e-06, 'weight_decay': 0.00020406802423873866, 'epochs': 208, 'loss': 'mae', 'optimizer': 'adam', 'graph_mode': 'off', 'use_snp_selection': False}. Best is trial 104 with value: 0.20611400028218546.
[I 2025-12-05 19:58:34,353] Trial 140 finished with value: 0.18441714655017213 and parameters: {'model_type': 'mlp', 'hidden_dims': '[512, 256]', 'dropout': 0.5988455016255042, 'batch_norm': False, 'lr': 1.3680391352178235e-05, 'weight_decay': 7.11080532098275e-05, 'epochs': 140, 'loss': 'mae', 'optimizer': 'adam', 'graph_mode': 'off', 'use_snp_selection': False}. Best is trial 104 with value: 0.20611400028218546.
[I 2025-12-05 19:59:51,935] Trial 141 finished with value: 0.17604140433320645 and parameters: {'model_type': 'mlp', 'hidden_dims': '[512, 64]', 'dropout': 0.5152733394585205, 'batch_norm': False, 'lr': 5.985811014059638e-06, 'weight_decay': 0.00012349866754644408, 'epochs': 149, 'loss': 'mae', 'optimizer': 'adam', 'graph_mode': 'off', 'use_snp_selection': True, 'num_snps': 46348}. Best is trial 104 with value: 0.20611400028218546.
[I 2025-12-05 20:00:59,469] Trial 142 finished with value: 0.18901219192969038 and parameters: {'model_type': 'mlp', 'hidden_dims': '[512, 64]', 'dropout': 0.5050346249577684, 'batch_norm': False, 'lr': 9.675459229685496e-06, 'weight_decay': 0.00016258815849677982, 'epochs': 132, 'loss': 'mae', 'optimizer': 'adam', 'graph_mode': 'off', 'use_snp_selection': True, 'num_snps': 40661}. Best is trial 104 with value: 0.20611400028218546.
[I 2025-12-05 20:01:57,490] Trial 143 finished with value: 0.18829750887870572 and parameters: {'model_type': 'mlp', 'hidden_dims': '[512, 64]', 'dropout': 0.4742314207571121, 'batch_norm': False, 'lr': 5.013619640887857e-06, 'weight_decay': 8.725304125034952e-05, 'epochs': 108, 'loss': 'mae', 'optimizer': 'adam', 'graph_mode': 'off', 'use_snp_selection': True, 'num_snps': 34143}. Best is trial 104 with value: 0.20611400028218546.
[I 2025-12-05 20:03:12,283] Trial 144 finished with value: 0.18773895976826738 and parameters: {'model_type': 'mlp', 'hidden_dims': '[512, 64]', 'dropout': 0.4892385429158877, 'batch_norm': False, 'lr': 3.5732874432484314e-06, 'weight_decay': 2.0309021909899e-05, 'epochs': 240, 'loss': 'mae', 'optimizer': 'adam', 'graph_mode': 'off', 'use_snp_selection': False}. Best is trial 104 with value: 0.20611400028218546.
[I 2025-12-05 20:04:13,365] Trial 145 finished with value: 0.18498411235008388 and parameters: {'model_type': 'mlp', 'hidden_dims': '[512, 64]', 'dropout': 0.5398179924848282, 'batch_norm': False, 'lr': 7.300398710490096e-06, 'weight_decay': 3.092305952131692e-05, 'epochs': 189, 'loss': 'mae', 'optimizer': 'adam', 'graph_mode': 'off', 'use_snp_selection': False}. Best is trial 104 with value: 0.20611400028218546.
[I 2025-12-05 20:05:06,676] Trial 146 finished with value: 0.18605967411278274 and parameters: {'model_type': 'mlp', 'hidden_dims': '[512, 64]', 'dropout': 0.5191706851597983, 'batch_norm': False, 'lr': 8.536066352861029e-06, 'weight_decay': 0.00022080376098914382, 'epochs': 161, 'loss': 'mae', 'optimizer': 'adam', 'graph_mode': 'off', 'use_snp_selection': False}. Best is trial 104 with value: 0.20611400028218546.
[I 2025-12-05 20:06:42,621] Trial 147 finished with value: 0.16164557242005434 and parameters: {'model_type': 'mlp', 'hidden_dims': '[512, 64]', 'dropout': 0.4366657088583522, 'batch_norm': False, 'lr': 1.359381263542008e-06, 'weight_decay': 0.0002811642163258192, 'epochs': 177, 'loss': 'mae', 'optimizer': 'adam', 'graph_mode': 'off', 'use_snp_selection': True, 'num_snps': 56836}. Best is trial 104 with value: 0.20611400028218546.
[I 2025-12-05 20:07:07,062] Trial 148 finished with value: 0.1124106986227015 and parameters: {'model_type': 'mlp', 'hidden_dims': '[256, 128]', 'dropout': 0.49559744498070635, 'batch_norm': True, 'lr': 1.0845888937496636e-06, 'weight_decay': 0.0001017490335200307, 'epochs': 124, 'loss': 'mae', 'optimizer': 'adam', 'graph_mode': 'off', 'use_snp_selection': False}. Best is trial 104 with value: 0.20611400028218546.
[I 2025-12-05 20:08:52,171] Trial 149 finished with value: 0.18675888201053273 and parameters: {'model_type': 'mlp', 'hidden_dims': '[512, 64]', 'dropout': 0.5292244781762839, 'batch_norm': False, 'lr': 5.8019949663300644e-06, 'weight_decay': 1.494610585452216e-05, 'epochs': 344, 'loss': 'mae', 'optimizer': 'adam', 'graph_mode': 'off', 'use_snp_selection': False}. Best is trial 104 with value: 0.20611400028218546.
[I 2025-12-05 20:09:58,038] Trial 0 finished with value: 0.1598320477012367 and parameters: {'model_type': 'mlp', 'hidden_dims': '[128, 64]', 'dropout': 0.199031432379812, 'batch_norm': True, 'lr': 1.8408544111075837e-06, 'weight_decay': 5.5136510071208614e-05, 'epochs': 336, 'loss': 'mae', 'optimizer': 'adam', 'graph_mode': 'off', 'use_snp_selection': True, 'num_snps': 43862}. Best is trial 0 with value: 0.1598320477012367.
[I 2025-12-05 20:10:38,337] Trial 1 finished with value: 0.20271349155362425 and parameters: {'model_type': 'mlp', 'hidden_dims': '[256, 128]', 'dropout': 0.4370668075331726, 'batch_norm': True, 'lr': 7.133471581159139e-05, 'weight_decay': 1.128633586803549e-05, 'epochs': 242, 'loss': 'mae', 'optimizer': 'adam', 'graph_mode': 'off', 'use_snp_selection': False}. Best is trial 1 with value: 0.20271349155362425.
[I 2025-12-05 20:11:14,584] Trial 2 finished with value: 0.18854705828383184 and parameters: {'model_type': 'mlp', 'hidden_dims': '[256, 128, 64]', 'dropout': 0.41314357415569625, 'batch_norm': False, 'lr': 3.952233718592101e-06, 'weight_decay': 0.00026754769258252603, 'epochs': 149, 'loss': 'mse', 'optimizer': 'adam', 'graph_mode': 'off', 'use_snp_selection': True, 'num_snps': 11571}. Best is trial 1 with value: 0.20271349155362425.
[I 2025-12-05 20:12:48,098] Trial 3 finished with value: 0.20502317767582853 and parameters: {'model_type': 'mlp', 'hidden_dims': '[512, 64]', 'dropout': 0.5938127374509361, 'batch_norm': False, 'lr': 5.67704586114731e-06, 'weight_decay': 2.4518087630137052e-05, 'epochs': 320, 'loss': 'mae', 'optimizer': 'adam', 'graph_mode': 'off', 'use_snp_selection': False}. Best is trial 3 with value: 0.20502317767582853.
[I 2025-12-05 20:14:12,302] Trial 4 finished with value: 0.1907389252879068 and parameters: {'model_type': 'mlp', 'hidden_dims': '[512, 128]', 'dropout': 0.25746343592134413, 'batch_norm': True, 'lr': 1.3467657668402788e-06, 'weight_decay': 0.00033087251918647806, 'epochs': 277, 'loss': 'mse', 'optimizer': 'adam', 'graph_mode': 'off', 'use_snp_selection': True, 'num_snps': 36675}. Best is trial 3 with value: 0.20502317767582853.
[I 2025-12-05 20:15:11,125] Trial 5 finished with value: 0.13270107399250533 and parameters: {'model_type': 'mlp', 'hidden_dims': '[512, 64]', 'dropout': 0.38275350994408375, 'batch_norm': True, 'lr': 1.5586664309232824e-06, 'weight_decay': 0.0008227664668621182, 'epochs': 145, 'loss': 'mae', 'optimizer': 'adam', 'graph_mode': 'off', 'use_snp_selection': True, 'num_snps': 32148}. Best is trial 3 with value: 0.20502317767582853.
[I 2025-12-05 20:15:44,345] Trial 6 finished with value: 0.21718718115606386 and parameters: {'model_type': 'mlp', 'hidden_dims': '[256, 128]', 'dropout': 0.3930109900265879, 'batch_norm': False, 'lr': 4.892964372128395e-05, 'weight_decay': 1.5809549317992182e-06, 'epochs': 199, 'loss': 'mse', 'optimizer': 'adam', 'graph_mode': 'off', 'use_snp_selection': False}. Best is trial 6 with value: 0.21718718115606386.
[I 2025-12-05 20:16:18,165] Trial 7 finished with value: 0.2159172871376694 and parameters: {'model_type': 'mlp', 'hidden_dims': '[512, 256]', 'dropout': 0.15343979219678458, 'batch_norm': True, 'lr': 6.234003099047341e-05, 'weight_decay': 3.894760610535477e-07, 'epochs': 97, 'loss': 'mse', 'optimizer': 'adam', 'graph_mode': 'off', 'use_snp_selection': False}. Best is trial 6 with value: 0.21718718115606386.
[I 2025-12-05 20:17:50,834] Trial 8 finished with value: 0.21202275043798688 and parameters: {'model_type': 'mlp', 'hidden_dims': '[512, 128]', 'dropout': 0.10743001231661406, 'batch_norm': True, 'lr': 0.00023728538449271062, 'weight_decay': 1.7629071578048637e-05, 'epochs': 312, 'loss': 'mae', 'optimizer': 'adam', 'graph_mode': 'off', 'use_snp_selection': False}. Best is trial 6 with value: 0.21718718115606386.
[I 2025-12-05 20:18:46,091] Trial 9 finished with value: 0.21084590896757627 and parameters: {'model_type': 'mlp', 'hidden_dims': '[512, 64]', 'dropout': 0.14505336736221927, 'batch_norm': True, 'lr': 5.8619638388111826e-05, 'weight_decay': 6.200156172669308e-07, 'epochs': 175, 'loss': 'mse', 'optimizer': 'adam', 'graph_mode': 'off', 'use_snp_selection': False}. Best is trial 6 with value: 0.21718718115606386.
[I 2025-12-05 20:18:58,722] Trial 10 finished with value: 0.162855474434011 and parameters: {'model_type': 'mlp', 'hidden_dims': '[256, 128]', 'dropout': 0.5267360651501256, 'batch_norm': False, 'lr': 0.00032393778075602147, 'weight_decay': 1.936962886850364e-06, 'epochs': 46, 'loss': 'mse', 'optimizer': 'adam', 'graph_mode': 'off', 'use_snp_selection': False}. Best is trial 6 with value: 0.21718718115606386.
