[I 2025-12-05 15:35:01,622] Trial 26 finished with value: 0.022341128679979776 and parameters: {'model_type': 'mlp', 'hidden_dims': '[512, 64]', 'dropout': 0.10794692241394847, 'batch_norm': True, 'lr': 2.2890692442621568e-06, 'weight_decay': 1.1450971183128133e-06, 'epochs': 66, 'loss': 'mse', 'optimizer': 'adam', 'graph_mode': 'off', 'use_snp_selection': True, 'num_snps': 23425}. Best is trial 0 with value: 0.07830712685738.
[I 2025-12-05 15:35:02,809] Trial 27 finished with value: -0.02449171085828505 and parameters: {'model_type': 'mlp', 'hidden_dims': '[512, 64]', 'dropout': 0.18917156569112978, 'batch_norm': False, 'lr': 0.00011481247559317581, 'weight_decay': 4.609716160574835e-07, 'epochs': 85, 'loss': 'mse', 'optimizer': 'adam', 'graph_mode': 'off', 'use_snp_selection': False}. Best is trial 0 with value: 0.07830712685738.
[I 2025-12-05 15:35:05,703] Trial 28 finished with value: 0.013632968121026344 and parameters: {'model_type': 'mlp', 'hidden_dims': '[512, 128]', 'dropout': 0.23070166493559494, 'batch_norm': True, 'lr': 3.6697661881817595e-05, 'weight_decay': 3.101516303461325e-06, 'epochs': 150, 'loss': 'mse', 'optimizer': 'adam', 'graph_mode': 'off', 'use_snp_selection': True, 'num_snps': 48356}. Best is trial 0 with value: 0.07830712685738.
[I 2025-12-05 15:35:07,466] Trial 29 finished with value: 0.049197763859908705 and parameters: {'model_type': 'mlp', 'hidden_dims': '[512, 256]', 'dropout': 0.13096074802738172, 'batch_norm': True, 'lr': 0.00010821374911652203, 'weight_decay': 6.257077207011983e-06, 'epochs': 213, 'loss': 'mse', 'optimizer': 'adam', 'graph_mode': 'off', 'use_snp_selection': False}. Best is trial 0 with value: 0.07830712685738.
[I 2025-12-05 15:35:08,628] Trial 30 finished with value: 0.03871833550000593 and parameters: {'model_type': 'mlp', 'hidden_dims': '[256, 128, 64]', 'dropout': 0.29379467755195376, 'batch_norm': True, 'lr': 1.0882334010994473e-05, 'weight_decay': 1.1016024715755902e-07, 'epochs': 190, 'loss': 'mse', 'optimizer': 'adam', 'graph_mode': 'off', 'use_snp_selection': False}. Best is trial 0 with value: 0.07830712685738.
[I 2025-12-05 15:35:10,138] Trial 31 finished with value: 0.057201169580390426 and parameters: {'model_type': 'mlp', 'hidden_dims': '[512, 64]', 'dropout': 0.10957838801731666, 'batch_norm': True, 'lr': 0.0004868398921718177, 'weight_decay': 7.924574392242997e-07, 'epochs': 160, 'loss': 'mse', 'optimizer': 'adam', 'graph_mode': 'off', 'use_snp_selection': False}. Best is trial 0 with value: 0.07830712685738.
[I 2025-12-05 15:35:11,481] Trial 32 finished with value: 0.053778297190661496 and parameters: {'model_type': 'mlp', 'hidden_dims': '[512, 64]', 'dropout': 0.13048455700544595, 'batch_norm': True, 'lr': 0.00029751957577269335, 'weight_decay': 8.02083235914302e-07, 'epochs': 132, 'loss': 'mse', 'optimizer': 'adam', 'graph_mode': 'off', 'use_snp_selection': False}. Best is trial 0 with value: 0.07830712685738.
[I 2025-12-05 15:35:13,037] Trial 33 finished with value: 0.036257018549829226 and parameters: {'model_type': 'mlp', 'hidden_dims': '[512, 64]', 'dropout': 0.17375038122621256, 'batch_norm': True, 'lr': 0.00046049919877052045, 'weight_decay': 1.5878750481567962e-06, 'epochs': 168, 'loss': 'mse', 'optimizer': 'adam', 'graph_mode': 'off', 'use_snp_selection': False}. Best is trial 0 with value: 0.07830712685738.
[I 2025-12-05 15:35:14,726] Trial 34 finished with value: 0.016140383235534867 and parameters: {'model_type': 'mlp', 'hidden_dims': '[512, 64]', 'dropout': 0.10485057612117188, 'batch_norm': False, 'lr': 0.0006760789675004212, 'weight_decay': 2.984385481716399e-07, 'epochs': 199, 'loss': 'mse', 'optimizer': 'adam', 'graph_mode': 'off', 'use_snp_selection': False}. Best is trial 0 with value: 0.07830712685738.
[I 2025-12-05 15:35:16,137] Trial 35 finished with value: -0.00512984716566171 and parameters: {'model_type': 'mlp', 'hidden_dims': '[512, 64]', 'dropout': 0.240844481425324, 'batch_norm': True, 'lr': 1.0470349376083176e-06, 'weight_decay': 0.0002007164914124834, 'epochs': 134, 'loss': 'mse', 'optimizer': 'adam', 'graph_mode': 'off', 'use_snp_selection': False}. Best is trial 0 with value: 0.07830712685738.
[I 2025-12-05 15:35:17,257] Trial 36 finished with value: 0.030799926488854268 and parameters: {'model_type': 'mlp', 'hidden_dims': '[256, 128, 64]', 'dropout': 0.18098206927807853, 'batch_norm': True, 'lr': 0.00015101508824218505, 'weight_decay': 0.0006410314954536251, 'epochs': 227, 'loss': 'mse', 'optimizer': 'adam', 'graph_mode': 'off', 'use_snp_selection': True, 'num_snps': 3546}. Best is trial 0 with value: 0.07830712685738.
[I 2025-12-05 15:35:18,238] Trial 37 finished with value: 0.03322309840550219 and parameters: {'model_type': 'mlp', 'hidden_dims': '[128, 64]', 'dropout': 0.1372813503185722, 'batch_norm': False, 'lr': 5.7625497357462386e-06, 'weight_decay': 2.2569901610054654e-06, 'epochs': 264, 'loss': 'mse', 'optimizer': 'adam', 'graph_mode': 'off', 'use_snp_selection': False}. Best is trial 0 with value: 0.07830712685738.
[I 2025-12-05 15:35:19,983] Trial 38 finished with value: 0.028880989251666735 and parameters: {'model_type': 'mlp', 'hidden_dims': '[512, 64]', 'dropout': 0.10172502926374573, 'batch_norm': True, 'lr': 0.00030106549699617153, 'weight_decay': 1.1507882677872156e-06, 'epochs': 113, 'loss': 'mse', 'optimizer': 'adam', 'graph_mode': 'off', 'use_snp_selection': True, 'num_snps': 29011}. Best is trial 0 with value: 0.07830712685738.
[I 2025-12-05 15:35:21,481] Trial 39 finished with value: 0.04760768496237866 and parameters: {'model_type': 'mlp', 'hidden_dims': '[512, 128]', 'dropout': 0.15761302702650554, 'batch_norm': True, 'lr': 4.0530004958526936e-05, 'weight_decay': 2.2609747512202944e-05, 'epochs': 156, 'loss': 'mse', 'optimizer': 'adam', 'graph_mode': 'off', 'use_snp_selection': False}. Best is trial 0 with value: 0.07830712685738.
[I 2025-12-05 15:35:23,060] Trial 40 finished with value: 0.055719348155212435 and parameters: {'model_type': 'mlp', 'hidden_dims': '[512, 64]', 'dropout': 0.12705604849437419, 'batch_norm': False, 'lr': 7.239852785979439e-05, 'weight_decay': 1.479928235581174e-05, 'epochs': 176, 'loss': 'mse', 'optimizer': 'adam', 'graph_mode': 'off', 'use_snp_selection': False}. Best is trial 0 with value: 0.07830712685738.
[I 2025-12-05 15:35:24,575] Trial 41 finished with value: 0.056296889902380846 and parameters: {'model_type': 'mlp', 'hidden_dims': '[512, 64]', 'dropout': 0.12649271705141418, 'batch_norm': True, 'lr': 0.0005361936494120463, 'weight_decay': 6.770233322844007e-07, 'epochs': 158, 'loss': 'mse', 'optimizer': 'adam', 'graph_mode': 'off', 'use_snp_selection': False}. Best is trial 0 with value: 0.07830712685738.
[I 2025-12-05 15:35:26,240] Trial 42 finished with value: 0.06399477653331603 and parameters: {'model_type': 'mlp', 'hidden_dims': '[512, 64]', 'dropout': 0.16012608995882452, 'batch_norm': True, 'lr': 0.00039590088451389597, 'weight_decay': 8.343257761352827e-07, 'epochs': 191, 'loss': 'mse', 'optimizer': 'adam', 'graph_mode': 'off', 'use_snp_selection': False}. Best is trial 0 with value: 0.07830712685738.
[I 2025-12-05 15:35:27,907] Trial 43 finished with value: 0.050841939965457016 and parameters: {'model_type': 'mlp', 'hidden_dims': '[512, 64]', 'dropout': 0.16108157533954204, 'batch_norm': True, 'lr': 0.00025013441531433116, 'weight_decay': 4.486733464680936e-07, 'epochs': 197, 'loss': 'mse', 'optimizer': 'adam', 'graph_mode': 'off', 'use_snp_selection': False}. Best is trial 0 with value: 0.07830712685738.
[I 2025-12-05 15:35:29,542] Trial 44 finished with value: 0.031933422633091825 and parameters: {'model_type': 'mlp', 'hidden_dims': '[512, 64]', 'dropout': 0.2247266134990321, 'batch_norm': True, 'lr': 8.303664733050911e-05, 'weight_decay': 1.2744584314084792e-06, 'epochs': 186, 'loss': 'mse', 'optimizer': 'adam', 'graph_mode': 'off', 'use_snp_selection': False}. Best is trial 0 with value: 0.07830712685738.
[I 2025-12-05 15:35:30,514] Trial 45 finished with value: 0.04631918601238902 and parameters: {'model_type': 'mlp', 'hidden_dims': '[128, 64]', 'dropout': 0.19052350509921853, 'batch_norm': True, 'lr': 0.00017723585831479346, 'weight_decay': 2.574652203481123e-07, 'epochs': 232, 'loss': 'mse', 'optimizer': 'adam', 'graph_mode': 'off', 'use_snp_selection': False}. Best is trial 0 with value: 0.07830712685738.
[I 2025-12-05 15:35:33,970] Trial 46 finished with value: 0.031613332983597316 and parameters: {'model_type': 'mlp', 'hidden_dims': '[512, 64]', 'dropout': 0.14213046132466023, 'batch_norm': True, 'lr': 0.0007552273499630088, 'weight_decay': 2.5168098494118294e-06, 'epochs': 323, 'loss': 'mse', 'optimizer': 'adam', 'graph_mode': 'off', 'use_snp_selection': True, 'num_snps': 50743}. Best is trial 0 with value: 0.07830712685738.
[I 2025-12-05 15:35:35,402] Trial 47 finished with value: 0.03409161314535344 and parameters: {'model_type': 'mlp', 'hidden_dims': '[512, 256]', 'dropout': 0.27363142631239745, 'batch_norm': True, 'lr': 0.0003449318544120052, 'weight_decay': 5.064769706286744e-07, 'epochs': 142, 'loss': 'mse', 'optimizer': 'adam', 'graph_mode': 'off', 'use_snp_selection': False}. Best is trial 0 with value: 0.07830712685738.
[I 2025-12-05 15:35:37,951] Trial 48 finished with value: 0.0059447234510076885 and parameters: {'model_type': 'mlp', 'hidden_dims': '[512, 128]', 'dropout': 0.5818790095748201, 'batch_norm': True, 'lr': 2.599602768263313e-06, 'weight_decay': 4.005970433016132e-06, 'epochs': 203, 'loss': 'mae', 'optimizer': 'adam', 'graph_mode': 'off', 'use_snp_selection': True, 'num_snps': 39245}. Best is trial 0 with value: 0.07830712685738.
[I 2025-12-05 15:35:38,832] Trial 49 finished with value: 0.04560959318953882 and parameters: {'model_type': 'mlp', 'hidden_dims': '[128, 64]', 'dropout': 0.24887914291778546, 'batch_norm': True, 'lr': 0.0009872138807913162, 'weight_decay': 1.8519816376086258e-06, 'epochs': 170, 'loss': 'mae', 'optimizer': 'adam', 'graph_mode': 'off', 'use_snp_selection': False}. Best is trial 0 with value: 0.07830712685738.
[I 2025-12-05 15:35:39,802] Trial 50 finished with value: 0.02611463486809927 and parameters: {'model_type': 'mlp', 'hidden_dims': '[256, 128, 64]', 'dropout': 0.40548508768479846, 'batch_norm': True, 'lr': 2.3593700322497763e-05, 'weight_decay': 9.222831352040531e-07, 'epochs': 110, 'loss': 'mse', 'optimizer': 'adam', 'graph_mode': 'off', 'use_snp_selection': False}. Best is trial 0 with value: 0.07830712685738.
[I 2025-12-05 15:35:41,330] Trial 51 finished with value: 0.06761293554679149 and parameters: {'model_type': 'mlp', 'hidden_dims': '[512, 64]', 'dropout': 0.10052407510677054, 'batch_norm': True, 'lr': 0.00043215096286399314, 'weight_decay': 8.100983318420912e-07, 'epochs': 165, 'loss': 'mse', 'optimizer': 'adam', 'graph_mode': 'off', 'use_snp_selection': False}. Best is trial 0 with value: 0.07830712685738.
[I 2025-12-05 15:35:42,849] Trial 52 finished with value: 0.05927697367417547 and parameters: {'model_type': 'mlp', 'hidden_dims': '[512, 64]', 'dropout': 0.12302155546478077, 'batch_norm': True, 'lr': 0.0006116656658327053, 'weight_decay': 3.46606723217285e-07, 'epochs': 166, 'loss': 'mse', 'optimizer': 'adam', 'graph_mode': 'off', 'use_snp_selection': False}. Best is trial 0 with value: 0.07830712685738.
[I 2025-12-05 15:35:44,248] Trial 53 finished with value: 0.021056096977428294 and parameters: {'model_type': 'mlp', 'hidden_dims': '[512, 64]', 'dropout': 0.14599056579845468, 'batch_norm': True, 'lr': 0.00022794313630615095, 'weight_decay': 3.166644104865541e-07, 'epochs': 144, 'loss': 'mse', 'optimizer': 'adam', 'graph_mode': 'off', 'use_snp_selection': False}. Best is trial 0 with value: 0.07830712685738.
[I 2025-12-05 15:35:45,825] Trial 54 finished with value: 0.03499867669908394 and parameters: {'model_type': 'mlp', 'hidden_dims': '[512, 64]', 'dropout': 0.12304179497736867, 'batch_norm': True, 'lr': 0.0005981668494452644, 'weight_decay': 1.4834029926894505e-07, 'epochs': 186, 'loss': 'mse', 'optimizer': 'adam', 'graph_mode': 'off', 'use_snp_selection': False}. Best is trial 0 with value: 0.07830712685738.
[I 2025-12-05 15:35:47,128] Trial 55 finished with value: 0.05162421384732194 and parameters: {'model_type': 'mlp', 'hidden_dims': '[512, 64]', 'dropout': 0.363253008197575, 'batch_norm': True, 'lr': 0.0007129378910036375, 'weight_decay': 6.400168081518098e-07, 'epochs': 122, 'loss': 'mae', 'optimizer': 'adam', 'graph_mode': 'off', 'use_snp_selection': False}. Best is trial 0 with value: 0.07830712685738.
[I 2025-12-05 15:35:48,753] Trial 56 finished with value: 0.042107404199877387 and parameters: {'model_type': 'mlp', 'hidden_dims': '[256, 128]', 'dropout': 0.1661313242868716, 'batch_norm': True, 'lr': 0.00013570203671488712, 'weight_decay': 1.9190941991955446e-07, 'epochs': 202, 'loss': 'mse', 'optimizer': 'adam', 'graph_mode': 'off', 'use_snp_selection': True, 'num_snps': 23218}. Best is trial 0 with value: 0.07830712685738.
[I 2025-12-05 15:35:49,710] Trial 57 finished with value: 0.030988649534402595 and parameters: {'model_type': 'mlp', 'hidden_dims': '[128, 64]', 'dropout': 0.20293507668717714, 'batch_norm': False, 'lr': 0.00040164905784314197, 'weight_decay': 3.747485447368322e-07, 'epochs': 247, 'loss': 'mae', 'optimizer': 'adam', 'graph_mode': 'off', 'use_snp_selection': False}. Best is trial 0 with value: 0.07830712685738.
[I 2025-12-05 15:35:51,476] Trial 58 finished with value: 0.039704444056337856 and parameters: {'model_type': 'mlp', 'hidden_dims': '[512, 64]', 'dropout': 0.14857398414565468, 'batch_norm': True, 'lr': 1.4467607058425249e-05, 'weight_decay': 9.016929896808303e-05, 'epochs': 220, 'loss': 'mse', 'optimizer': 'adam', 'graph_mode': 'off', 'use_snp_selection': False}. Best is trial 0 with value: 0.07830712685738.
[I 2025-12-05 15:35:54,656] Trial 59 finished with value: 0.03006020762765576 and parameters: {'model_type': 'mlp', 'hidden_dims': '[512, 256]', 'dropout': 0.11543118986351862, 'batch_norm': True, 'lr': 4.590870329446526e-06, 'weight_decay': 4.5493379307120685e-05, 'epochs': 162, 'loss': 'mae', 'optimizer': 'adam', 'graph_mode': 'off', 'use_snp_selection': True, 'num_snps': 59394}. Best is trial 0 with value: 0.07830712685738.
[I 2025-12-05 15:35:56,201] Trial 60 finished with value: 0.03395457721847001 and parameters: {'model_type': 'mlp', 'hidden_dims': '[512, 64]', 'dropout': 0.18856409686514963, 'batch_norm': True, 'lr': 0.00026382025781689013, 'weight_decay': 7.872427547654156e-06, 'epochs': 179, 'loss': 'mse', 'optimizer': 'adam', 'graph_mode': 'off', 'use_snp_selection': False}. Best is trial 0 with value: 0.07830712685738.
[I 2025-12-05 15:35:57,718] Trial 61 finished with value: 0.03521312278331712 and parameters: {'model_type': 'mlp', 'hidden_dims': '[512, 64]', 'dropout': 0.10311138082083642, 'batch_norm': True, 'lr': 0.00040180525017011166, 'weight_decay': 1.0607701107629667e-06, 'epochs': 170, 'loss': 'mse', 'optimizer': 'adam', 'graph_mode': 'off', 'use_snp_selection': False}. Best is trial 0 with value: 0.07830712685738.
[I 2025-12-05 15:35:59,141] Trial 62 finished with value: 0.06702978976788793 and parameters: {'model_type': 'mlp', 'hidden_dims': '[512, 64]', 'dropout': 0.11888299761005547, 'batch_norm': True, 'lr': 0.0008767551451329427, 'weight_decay': 5.712846038248621e-07, 'epochs': 149, 'loss': 'mse', 'optimizer': 'adam', 'graph_mode': 'off', 'use_snp_selection': False}. Best is trial 0 with value: 0.07830712685738.
[I 2025-12-05 15:36:00,600] Trial 63 finished with value: 0.0519600533016589 and parameters: {'model_type': 'mlp', 'hidden_dims': '[512, 64]', 'dropout': 0.1473244810236613, 'batch_norm': True, 'lr': 0.0008419012065693696, 'weight_decay': 4.994817380784418e-07, 'epochs': 150, 'loss': 'mse', 'optimizer': 'adam', 'graph_mode': 'off', 'use_snp_selection': False}. Best is trial 0 with value: 0.07830712685738.
[I 2025-12-05 15:36:02,002] Trial 64 finished with value: 0.056331071232184914 and parameters: {'model_type': 'mlp', 'hidden_dims': '[512, 64]', 'dropout': 0.1228153429559875, 'batch_norm': True, 'lr': 0.0005784689699977698, 'weight_decay': 1.4350708125682586e-06, 'epochs': 138, 'loss': 'mse', 'optimizer': 'adam', 'graph_mode': 'off', 'use_snp_selection': False}. Best is trial 0 with value: 0.07830712685738.
[I 2025-12-05 15:36:03,727] Trial 65 finished with value: 0.048421301936183755 and parameters: {'model_type': 'mlp', 'hidden_dims': '[512, 64]', 'dropout': 0.1689430547050263, 'batch_norm': True, 'lr': 0.00018916289454837558, 'weight_decay': 2.1184395623763313e-07, 'epochs': 209, 'loss': 'mse', 'optimizer': 'adam', 'graph_mode': 'off', 'use_snp_selection': False}. Best is trial 0 with value: 0.07830712685738.
[I 2025-12-05 15:36:04,746] Trial 66 finished with value: 0.06291372528850363 and parameters: {'model_type': 'mlp', 'hidden_dims': '[128, 64]', 'dropout': 0.13425473008275285, 'batch_norm': True, 'lr': 5.604410883506684e-05, 'weight_decay': 0.00021657897397759363, 'epochs': 298, 'loss': 'mse', 'optimizer': 'adam', 'graph_mode': 'off', 'use_snp_selection': False}. Best is trial 0 with value: 0.07830712685738.
[I 2025-12-05 15:36:06,755] Trial 67 finished with value: 0.05364327222808415 and parameters: {'model_type': 'mlp', 'hidden_dims': '[128, 64]', 'dropout': 0.10073084686213651, 'batch_norm': True, 'lr': 5.69036659502522e-05, 'weight_decay': 0.0002242011319573159, 'epochs': 336, 'loss': 'mae', 'optimizer': 'adam', 'graph_mode': 'off', 'use_snp_selection': True, 'num_snps': 30702}. Best is trial 0 with value: 0.07830712685738.
[I 2025-12-05 15:36:07,802] Trial 68 finished with value: 0.051391581981687966 and parameters: {'model_type': 'mlp', 'hidden_dims': '[128, 64]', 'dropout': 0.13889008859275484, 'batch_norm': False, 'lr': 4.979019694878983e-05, 'weight_decay': 0.0003789635944898059, 'epochs': 313, 'loss': 'mse', 'optimizer': 'adam', 'graph_mode': 'off', 'use_snp_selection': False}. Best is trial 0 with value: 0.07830712685738.
[I 2025-12-05 15:36:08,853] Trial 69 finished with value: 0.06401902501145691 and parameters: {'model_type': 'mlp', 'hidden_dims': '[128, 64]', 'dropout': 0.22004284972149096, 'batch_norm': True, 'lr': 3.845078149149536e-05, 'weight_decay': 0.00014177709971089774, 'epochs': 298, 'loss': 'mse', 'optimizer': 'adam', 'graph_mode': 'off', 'use_snp_selection': False}. Best is trial 0 with value: 0.07830712685738.
[I 2025-12-05 15:36:09,955] Trial 70 finished with value: 0.01740541165877012 and parameters: {'model_type': 'mlp', 'hidden_dims': '[128, 64]', 'dropout': 0.2168934618130191, 'batch_norm': True, 'lr': 6.951576019741458e-06, 'weight_decay': 0.00013696852647244006, 'epochs': 328, 'loss': 'mse', 'optimizer': 'adam', 'graph_mode': 'off', 'use_snp_selection': False}. Best is trial 0 with value: 0.07830712685738.
[I 2025-12-05 15:36:10,990] Trial 71 finished with value: 0.046659797287925325 and parameters: {'model_type': 'mlp', 'hidden_dims': '[128, 64]', 'dropout': 0.19255408757298165, 'batch_norm': True, 'lr': 3.132366177887733e-05, 'weight_decay': 0.00015524179282453289, 'epochs': 296, 'loss': 'mse', 'optimizer': 'adam', 'graph_mode': 'off', 'use_snp_selection': False}. Best is trial 0 with value: 0.07830712685738.
[I 2025-12-05 15:36:12,035] Trial 72 finished with value: 0.03161788050646843 and parameters: {'model_type': 'mlp', 'hidden_dims': '[128, 64]', 'dropout': 0.16302057109772033, 'batch_norm': True, 'lr': 8.994653829598157e-05, 'weight_decay': 0.0003664310127592536, 'epochs': 301, 'loss': 'mse', 'optimizer': 'adam', 'graph_mode': 'off', 'use_snp_selection': False}. Best is trial 0 with value: 0.07830712685738.
[I 2025-12-05 15:36:13,049] Trial 73 finished with value: 0.052924593308559635 and parameters: {'model_type': 'mlp', 'hidden_dims': '[128, 64]', 'dropout': 0.1762492060393694, 'batch_norm': True, 'lr': 4.418794453805814e-05, 'weight_decay': 0.0005728189985847374, 'epochs': 277, 'loss': 'mse', 'optimizer': 'adam', 'graph_mode': 'off', 'use_snp_selection': False}. Best is trial 0 with value: 0.07830712685738.
[I 2025-12-05 15:36:14,058] Trial 74 finished with value: 0.00427859491581167 and parameters: {'model_type': 'mlp', 'hidden_dims': '[128, 64]', 'dropout': 0.12042935117472778, 'batch_norm': True, 'lr': 1.941249652976307e-05, 'weight_decay': 6.423096663564044e-05, 'epochs': 310, 'loss': 'mse', 'optimizer': 'adam', 'graph_mode': 'off', 'use_snp_selection': False}. Best is trial 0 with value: 0.07830712685738.
[I 2025-12-05 15:36:15,462] Trial 75 finished with value: 0.05664166164538385 and parameters: {'model_type': 'mlp', 'hidden_dims': '[256, 128]', 'dropout': 0.1352780421011231, 'batch_norm': True, 'lr': 3.4126049807936975e-05, 'weight_decay': 0.0002933725843442118, 'epochs': 285, 'loss': 'mse', 'optimizer': 'adam', 'graph_mode': 'off', 'use_snp_selection': False}. Best is trial 0 with value: 0.07830712685738.
[I 2025-12-05 15:36:18,610] Trial 76 finished with value: -0.011612417211683358 and parameters: {'model_type': 'mlp', 'hidden_dims': '[512, 128]', 'dropout': 0.15307130558161006, 'batch_norm': True, 'lr': 1.682302228366086e-06, 'weight_decay': 0.00010549601216028461, 'epochs': 340, 'loss': 'mse', 'optimizer': 'adam', 'graph_mode': 'off', 'use_snp_selection': True, 'num_snps': 43422}. Best is trial 0 with value: 0.07830712685738.
[I 2025-12-05 15:36:19,952] Trial 77 finished with value: 0.011948119829301065 and parameters: {'model_type': 'mlp', 'hidden_dims': '[256, 128, 64]', 'dropout': 0.30275971682028835, 'batch_norm': True, 'lr': 2.8406172480209997e-05, 'weight_decay': 2.7827628584932172e-05, 'epochs': 261, 'loss': 'mae', 'optimizer': 'adam', 'graph_mode': 'off', 'use_snp_selection': False}. Best is trial 0 with value: 0.07830712685738.
