[I 2025-12-05 15:17:22,157] Trial 54 finished with value: 0.05784546843156053 and parameters: {'model_type': 'mlp', 'hidden_dims': '[512, 64]', 'dropout': 0.21075652290414132, 'batch_norm': False, 'lr': 1.2739965555947294e-05, 'weight_decay': 1.39095484454103e-07, 'epochs': 285, 'loss': 'mse', 'optimizer': 'adam', 'graph_mode': 'off', 'use_snp_selection': False}. Best is trial 23 with value: 0.09964413095608972.
[I 2025-12-05 15:17:23,844] Trial 55 finished with value: 0.05295806749699878 and parameters: {'model_type': 'mlp', 'hidden_dims': '[512, 64]', 'dropout': 0.3297553067118635, 'batch_norm': True, 'lr': 0.0001327655804035707, 'weight_decay': 7.943457763789121e-07, 'epochs': 227, 'loss': 'mae', 'optimizer': 'adam', 'graph_mode': 'off', 'use_snp_selection': False}. Best is trial 23 with value: 0.09964413095608972.
[I 2025-12-05 15:17:25,398] Trial 56 finished with value: 0.0680722766282262 and parameters: {'model_type': 'mlp', 'hidden_dims': '[512, 256]', 'dropout': 0.182482135091324, 'batch_norm': True, 'lr': 0.000593362446618454, 'weight_decay': 4.3598779306987335e-07, 'epochs': 197, 'loss': 'mse', 'optimizer': 'adam', 'graph_mode': 'off', 'use_snp_selection': False}. Best is trial 23 with value: 0.09964413095608972.
[I 2025-12-05 15:17:26,698] Trial 57 finished with value: 0.060284376870414436 and parameters: {'model_type': 'mlp', 'hidden_dims': '[512, 64]', 'dropout': 0.16034811381032563, 'batch_norm': False, 'lr': 0.00010292827922676529, 'weight_decay': 8.587174474154092e-06, 'epochs': 135, 'loss': 'mse', 'optimizer': 'adam', 'graph_mode': 'off', 'use_snp_selection': False}. Best is trial 23 with value: 0.09964413095608972.
[I 2025-12-05 15:17:27,822] Trial 58 finished with value: 0.06877664999692644 and parameters: {'model_type': 'mlp', 'hidden_dims': '[512, 128]', 'dropout': 0.10752256973264794, 'batch_norm': True, 'lr': 4.713263094603128e-05, 'weight_decay': 2.5778733318476377e-07, 'epochs': 87, 'loss': 'mae', 'optimizer': 'adam', 'graph_mode': 'off', 'use_snp_selection': False}. Best is trial 23 with value: 0.09964413095608972.
[I 2025-12-05 15:17:29,542] Trial 59 finished with value: 0.06589603038589135 and parameters: {'model_type': 'mlp', 'hidden_dims': '[512, 64]', 'dropout': 0.13024872993423542, 'batch_norm': True, 'lr': 0.00021809285218372636, 'weight_decay': 3.676265866449801e-06, 'epochs': 301, 'loss': 'mse', 'optimizer': 'adam', 'graph_mode': 'off', 'use_snp_selection': True, 'num_snps': 22979}. Best is trial 23 with value: 0.09964413095608972.
[I 2025-12-05 15:17:30,368] Trial 60 finished with value: 0.06456431711118021 and parameters: {'model_type': 'mlp', 'hidden_dims': '[128, 64]', 'dropout': 0.4808151265107677, 'batch_norm': False, 'lr': 0.0001595929018914829, 'weight_decay': 1.877521172656239e-05, 'epochs': 210, 'loss': 'mae', 'optimizer': 'adam', 'graph_mode': 'off', 'use_snp_selection': False}. Best is trial 23 with value: 0.09964413095608972.
[I 2025-12-05 15:17:31,373] Trial 61 finished with value: 0.08397225752236445 and parameters: {'model_type': 'mlp', 'hidden_dims': '[512, 128]', 'dropout': 0.10943281949733644, 'batch_norm': True, 'lr': 0.00026195995674453107, 'weight_decay': 1.2663549060259867e-06, 'epochs': 63, 'loss': 'mse', 'optimizer': 'adam', 'graph_mode': 'off', 'use_snp_selection': False}. Best is trial 23 with value: 0.09964413095608972.
[I 2025-12-05 15:17:32,331] Trial 62 finished with value: 0.08442516696468706 and parameters: {'model_type': 'mlp', 'hidden_dims': '[512, 128]', 'dropout': 0.10266780788483892, 'batch_norm': True, 'lr': 0.00034266321753431255, 'weight_decay': 2.050076372569944e-06, 'epochs': 51, 'loss': 'mse', 'optimizer': 'adam', 'graph_mode': 'off', 'use_snp_selection': False}. Best is trial 23 with value: 0.09964413095608972.
[I 2025-12-05 15:17:33,296] Trial 63 finished with value: 0.07196958432126248 and parameters: {'model_type': 'mlp', 'hidden_dims': '[512, 128]', 'dropout': 0.11859019218037134, 'batch_norm': True, 'lr': 0.00031586479881273873, 'weight_decay': 1.8325258210159032e-06, 'epochs': 53, 'loss': 'mse', 'optimizer': 'adam', 'graph_mode': 'off', 'use_snp_selection': False}. Best is trial 23 with value: 0.09964413095608972.
[I 2025-12-05 15:17:34,219] Trial 64 finished with value: 0.07641669283299915 and parameters: {'model_type': 'mlp', 'hidden_dims': '[512, 128]', 'dropout': 0.1044352697773218, 'batch_norm': True, 'lr': 0.0004668853279408498, 'weight_decay': 2.735643443374927e-05, 'epochs': 42, 'loss': 'mse', 'optimizer': 'adam', 'graph_mode': 'off', 'use_snp_selection': False}. Best is trial 23 with value: 0.09964413095608972.
[I 2025-12-05 15:17:35,274] Trial 65 finished with value: 0.07867622820833357 and parameters: {'model_type': 'mlp', 'hidden_dims': '[512, 128]', 'dropout': 0.14836439991602302, 'batch_norm': True, 'lr': 0.0006866597507236672, 'weight_decay': 2.4162195828989077e-06, 'epochs': 75, 'loss': 'mse', 'optimizer': 'adam', 'graph_mode': 'off', 'use_snp_selection': False}. Best is trial 23 with value: 0.09964413095608972.
[I 2025-12-05 15:17:36,306] Trial 66 finished with value: 0.09058494362666063 and parameters: {'model_type': 'mlp', 'hidden_dims': '[512, 128]', 'dropout': 0.10180112088256903, 'batch_norm': True, 'lr': 0.0002195887712335022, 'weight_decay': 9.082461025042172e-07, 'epochs': 70, 'loss': 'mse', 'optimizer': 'adam', 'graph_mode': 'off', 'use_snp_selection': False}. Best is trial 23 with value: 0.09964413095608972.
[I 2025-12-05 15:17:37,452] Trial 67 finished with value: 0.06463704804906963 and parameters: {'model_type': 'mlp', 'hidden_dims': '[512, 128]', 'dropout': 0.12651200503557578, 'batch_norm': True, 'lr': 0.0002017911840335082, 'weight_decay': 1.0388672602938546e-05, 'epochs': 99, 'loss': 'mse', 'optimizer': 'adam', 'graph_mode': 'off', 'use_snp_selection': False}. Best is trial 23 with value: 0.09964413095608972.
[I 2025-12-05 15:17:38,440] Trial 68 finished with value: 0.0698014033892648 and parameters: {'model_type': 'mlp', 'hidden_dims': '[512, 128]', 'dropout': 0.19918086299360663, 'batch_norm': True, 'lr': 0.0004323519420839887, 'weight_decay': 1.0684994172342334e-07, 'epochs': 52, 'loss': 'mse', 'optimizer': 'adam', 'graph_mode': 'off', 'use_snp_selection': False}. Best is trial 23 with value: 0.09964413095608972.
[I 2025-12-05 15:17:39,804] Trial 69 finished with value: 0.09854065893011155 and parameters: {'model_type': 'mlp', 'hidden_dims': '[256, 128]', 'dropout': 0.17439644811564792, 'batch_norm': True, 'lr': 0.00013579794743223537, 'weight_decay': 5.106167776907482e-07, 'epochs': 321, 'loss': 'mae', 'optimizer': 'adam', 'graph_mode': 'off', 'use_snp_selection': False}. Best is trial 23 with value: 0.09964413095608972.
[I 2025-12-05 15:17:42,417] Trial 70 finished with value: 0.06802386959728689 and parameters: {'model_type': 'mlp', 'hidden_dims': '[256, 128]', 'dropout': 0.22083275049938106, 'batch_norm': True, 'lr': 0.0001065604801152895, 'weight_decay': 2.381927339749111e-07, 'epochs': 320, 'loss': 'mae', 'optimizer': 'adam', 'graph_mode': 'off', 'use_snp_selection': True, 'num_snps': 47487}. Best is trial 23 with value: 0.09964413095608972.
[I 2025-12-05 15:17:43,244] Trial 71 finished with value: 0.07378202044534735 and parameters: {'model_type': 'mlp', 'hidden_dims': '[256, 128]', 'dropout': 0.1751172926475391, 'batch_norm': True, 'lr': 0.000150844263286614, 'weight_decay': 4.867895636372366e-07, 'epochs': 70, 'loss': 'mae', 'optimizer': 'adam', 'graph_mode': 'off', 'use_snp_selection': False}. Best is trial 23 with value: 0.09964413095608972.
[I 2025-12-05 15:17:44,573] Trial 72 finished with value: 0.08656667731897844 and parameters: {'model_type': 'mlp', 'hidden_dims': '[256, 128]', 'dropout': 0.16677453282295163, 'batch_norm': True, 'lr': 0.0002292202826274115, 'weight_decay': 9.001802391673684e-07, 'epochs': 309, 'loss': 'mae', 'optimizer': 'adam', 'graph_mode': 'off', 'use_snp_selection': False}. Best is trial 23 with value: 0.09964413095608972.
[I 2025-12-05 15:17:45,931] Trial 73 finished with value: 0.013630789497503673 and parameters: {'model_type': 'mlp', 'hidden_dims': '[256, 128]', 'dropout': 0.1718814251618522, 'batch_norm': True, 'lr': 1.7904162785900732e-06, 'weight_decay': 8.832081294706758e-07, 'epochs': 345, 'loss': 'mae', 'optimizer': 'adam', 'graph_mode': 'off', 'use_snp_selection': False}. Best is trial 23 with value: 0.09964413095608972.
[I 2025-12-05 15:17:47,249] Trial 74 finished with value: 0.05558403753085098 and parameters: {'model_type': 'mlp', 'hidden_dims': '[256, 128]', 'dropout': 0.1546591166054443, 'batch_norm': True, 'lr': 0.0002194656926158915, 'weight_decay': 1.5294388355094686e-07, 'epochs': 327, 'loss': 'mae', 'optimizer': 'adam', 'graph_mode': 'off', 'use_snp_selection': False}. Best is trial 23 with value: 0.09964413095608972.
[I 2025-12-05 15:17:48,521] Trial 75 finished with value: 0.07230781643059586 and parameters: {'model_type': 'mlp', 'hidden_dims': '[256, 128]', 'dropout': 0.18940913806410817, 'batch_norm': True, 'lr': 8.261643673280512e-05, 'weight_decay': 3.2332719244526013e-07, 'epochs': 305, 'loss': 'mae', 'optimizer': 'adam', 'graph_mode': 'off', 'use_snp_selection': False}. Best is trial 23 with value: 0.09964413095608972.
[I 2025-12-05 15:17:49,744] Trial 76 finished with value: 0.06306536004738159 and parameters: {'model_type': 'mlp', 'hidden_dims': '[256, 128]', 'dropout': 0.13659564537837693, 'batch_norm': False, 'lr': 5.240477220691913e-06, 'weight_decay': 3.882938322601102e-05, 'epochs': 291, 'loss': 'mae', 'optimizer': 'adam', 'graph_mode': 'off', 'use_snp_selection': False}. Best is trial 23 with value: 0.09964413095608972.
[I 2025-12-05 15:17:51,056] Trial 77 finished with value: 0.0839462887583105 and parameters: {'model_type': 'mlp', 'hidden_dims': '[256, 128]', 'dropout': 0.24170304977886767, 'batch_norm': True, 'lr': 0.00014953241631672254, 'weight_decay': 1.078615840280096e-06, 'epochs': 312, 'loss': 'mae', 'optimizer': 'adam', 'graph_mode': 'off', 'use_snp_selection': False}. Best is trial 23 with value: 0.09964413095608972.
[I 2025-12-05 15:17:52,435] Trial 78 finished with value: 0.03566502033641552 and parameters: {'model_type': 'mlp', 'hidden_dims': '[256, 128, 64]', 'dropout': 0.3857444067849761, 'batch_norm': True, 'lr': 0.00012271819269422135, 'weight_decay': 9.520099185899152e-05, 'epochs': 342, 'loss': 'mae', 'optimizer': 'adam', 'graph_mode': 'off', 'use_snp_selection': False}. Best is trial 23 with value: 0.09964413095608972.
[I 2025-12-05 15:17:54,260] Trial 79 finished with value: 0.07493415970212582 and parameters: {'model_type': 'mlp', 'hidden_dims': '[512, 256]', 'dropout': 0.16896687436748464, 'batch_norm': True, 'lr': 9.582968370224438e-05, 'weight_decay': 5.235321752202834e-07, 'epochs': 273, 'loss': 'mae', 'optimizer': 'adam', 'graph_mode': 'off', 'use_snp_selection': False}. Best is trial 23 with value: 0.09964413095608972.
[I 2025-12-05 15:17:55,572] Trial 80 finished with value: 0.06394724355172111 and parameters: {'model_type': 'mlp', 'hidden_dims': '[256, 128]', 'dropout': 0.2216129696651052, 'batch_norm': False, 'lr': 0.00028765854352382555, 'weight_decay': 1.7021484455789495e-05, 'epochs': 307, 'loss': 'mae', 'optimizer': 'adam', 'graph_mode': 'off', 'use_snp_selection': False}. Best is trial 23 with value: 0.09964413095608972.
[I 2025-12-05 15:17:57,647] Trial 81 finished with value: 0.05011500299665269 and parameters: {'model_type': 'mlp', 'hidden_dims': '[512, 128]', 'dropout': 0.12112007573144801, 'batch_norm': True, 'lr': 0.0003714984073264565, 'weight_decay': 7.916237836616087e-07, 'epochs': 324, 'loss': 'mse', 'optimizer': 'adam', 'graph_mode': 'off', 'use_snp_selection': False}. Best is trial 23 with value: 0.09964413095608972.
[I 2025-12-05 15:17:59,760] Trial 82 finished with value: 0.07157931485994434 and parameters: {'model_type': 'mlp', 'hidden_dims': '[512, 128]', 'dropout': 0.13713171775140365, 'batch_norm': True, 'lr': 0.00016473851763134566, 'weight_decay': 6.385297085306391e-07, 'epochs': 337, 'loss': 'mae', 'optimizer': 'adam', 'graph_mode': 'off', 'use_snp_selection': False}. Best is trial 23 with value: 0.09964413095608972.
[I 2025-12-05 15:18:00,882] Trial 83 finished with value: 0.049834066177048296 and parameters: {'model_type': 'mlp', 'hidden_dims': '[512, 64]', 'dropout': 0.10192068759179423, 'batch_norm': True, 'lr': 0.00020487776885253216, 'weight_decay': 1.90446353886379e-06, 'epochs': 82, 'loss': 'mse', 'optimizer': 'adam', 'graph_mode': 'off', 'use_snp_selection': False}. Best is trial 23 with value: 0.09964413095608972.
[I 2025-12-05 15:18:01,906] Trial 84 finished with value: 0.020940442090074098 and parameters: {'model_type': 'mlp', 'hidden_dims': '[512, 128]', 'dropout': 0.1512850867121457, 'batch_norm': True, 'lr': 2.715164838610728e-06, 'weight_decay': 3.705330988689585e-07, 'epochs': 51, 'loss': 'mse', 'optimizer': 'adam', 'graph_mode': 'off', 'use_snp_selection': False}. Best is trial 23 with value: 0.09964413095608972.
[I 2025-12-05 15:18:02,686] Trial 85 finished with value: 0.10366893036924316 and parameters: {'model_type': 'mlp', 'hidden_dims': '[128, 64]', 'dropout': 0.1338421589308838, 'batch_norm': True, 'lr': 0.00024980082774703666, 'weight_decay': 5.903278474047292e-06, 'epochs': 93, 'loss': 'mae', 'optimizer': 'adam', 'graph_mode': 'off', 'use_snp_selection': False}. Best is trial 85 with value: 0.10366893036924316.
[I 2025-12-05 15:18:03,502] Trial 86 finished with value: 0.052133625369020546 and parameters: {'model_type': 'mlp', 'hidden_dims': '[128, 64]', 'dropout': 0.1948730592354483, 'batch_norm': True, 'lr': 0.00013130797100904164, 'weight_decay': 6.088273608273624e-06, 'epochs': 118, 'loss': 'mae', 'optimizer': 'adam', 'graph_mode': 'off', 'use_snp_selection': False}. Best is trial 85 with value: 0.10366893036924316.
[I 2025-12-05 15:18:04,346] Trial 87 finished with value: 0.032713842304721095 and parameters: {'model_type': 'mlp', 'hidden_dims': '[512, 64]', 'dropout': 0.16219161988594671, 'batch_norm': True, 'lr': 0.0002596709878647283, 'weight_decay': 1.8522298963229964e-07, 'epochs': 114, 'loss': 'mae', 'optimizer': 'adam', 'graph_mode': 'off', 'use_snp_selection': True, 'num_snps': 3166}. Best is trial 85 with value: 0.10366893036924316.
[I 2025-12-05 15:18:05,323] Trial 88 finished with value: 0.07415971011756381 and parameters: {'model_type': 'mlp', 'hidden_dims': '[128, 64]', 'dropout': 0.1822106412266921, 'batch_norm': True, 'lr': 0.0001732303469760638, 'weight_decay': 4.617949447119585e-06, 'epochs': 249, 'loss': 'mae', 'optimizer': 'adam', 'graph_mode': 'off', 'use_snp_selection': False}. Best is trial 85 with value: 0.10366893036924316.
[I 2025-12-05 15:18:06,051] Trial 89 finished with value: 0.02983179122083694 and parameters: {'model_type': 'mlp', 'hidden_dims': '[128, 64]', 'dropout': 0.597043245220482, 'batch_norm': False, 'lr': 7.766071670898753e-05, 'weight_decay': 5.2617592428246625e-05, 'epochs': 93, 'loss': 'mae', 'optimizer': 'adam', 'graph_mode': 'off', 'use_snp_selection': False}. Best is trial 85 with value: 0.10366893036924316.
[I 2025-12-05 15:18:06,778] Trial 90 finished with value: 0.05834168286299554 and parameters: {'model_type': 'mlp', 'hidden_dims': '[128, 64]', 'dropout': 0.20391139500075206, 'batch_norm': True, 'lr': 0.0002275719812429165, 'weight_decay': 2.5917315170595303e-05, 'epochs': 71, 'loss': 'mae', 'optimizer': 'adam', 'graph_mode': 'off', 'use_snp_selection': False}. Best is trial 85 with value: 0.10366893036924316.
[I 2025-12-05 15:18:07,919] Trial 91 finished with value: 0.07331004226176989 and parameters: {'model_type': 'mlp', 'hidden_dims': '[512, 64]', 'dropout': 0.12765056127707972, 'batch_norm': True, 'lr': 0.0003354230701922795, 'weight_decay': 1.277300710309108e-07, 'epochs': 85, 'loss': 'mse', 'optimizer': 'adam', 'graph_mode': 'off', 'use_snp_selection': False}. Best is trial 85 with value: 0.10366893036924316.
[I 2025-12-05 15:18:08,705] Trial 92 finished with value: 0.06663449924657178 and parameters: {'model_type': 'mlp', 'hidden_dims': '[256, 128]', 'dropout': 0.14216215332708532, 'batch_norm': True, 'lr': 0.00018317356338251045, 'weight_decay': 3.5907915394341386e-06, 'epochs': 62, 'loss': 'mae', 'optimizer': 'adam', 'graph_mode': 'off', 'use_snp_selection': False}. Best is trial 85 with value: 0.10366893036924316.
[I 2025-12-05 15:18:09,438] Trial 93 finished with value: 0.10319968447593497 and parameters: {'model_type': 'mlp', 'hidden_dims': '[256, 128, 64]', 'dropout': 0.1175762590847862, 'batch_norm': True, 'lr': 0.00039892251605550244, 'weight_decay': 1.4830239818718132e-05, 'epochs': 40, 'loss': 'mse', 'optimizer': 'adam', 'graph_mode': 'off', 'use_snp_selection': False}. Best is trial 85 with value: 0.10366893036924316.
[I 2025-12-05 15:18:10,363] Trial 94 finished with value: 0.07047318243742848 and parameters: {'model_type': 'mlp', 'hidden_dims': '[256, 128, 64]', 'dropout': 0.12184883262468642, 'batch_norm': True, 'lr': 0.000423278730974671, 'weight_decay': 1.3744350696192376e-05, 'epochs': 131, 'loss': 'mse', 'optimizer': 'adam', 'graph_mode': 'off', 'use_snp_selection': False}. Best is trial 85 with value: 0.10366893036924316.
[I 2025-12-05 15:18:11,664] Trial 95 finished with value: 0.06156928868163028 and parameters: {'model_type': 'mlp', 'hidden_dims': '[256, 128, 64]', 'dropout': 0.15018630990135473, 'batch_norm': True, 'lr': 0.000517421738771341, 'weight_decay': 7.802862241311727e-06, 'epochs': 283, 'loss': 'mae', 'optimizer': 'adam', 'graph_mode': 'off', 'use_snp_selection': False}. Best is trial 85 with value: 0.10366893036924316.
[I 2025-12-05 15:18:13,048] Trial 96 finished with value: 0.0722274840049135 and parameters: {'model_type': 'mlp', 'hidden_dims': '[256, 128, 64]', 'dropout': 0.13586381879974474, 'batch_norm': True, 'lr': 0.000289826267688283, 'weight_decay': 1.1079338058981584e-05, 'epochs': 318, 'loss': 'mse', 'optimizer': 'adam', 'graph_mode': 'off', 'use_snp_selection': False}. Best is trial 85 with value: 0.10366893036924316.
[I 2025-12-05 15:18:13,942] Trial 97 finished with value: 0.06928875699219848 and parameters: {'model_type': 'mlp', 'hidden_dims': '[256, 128, 64]', 'dropout': 0.11296806544607235, 'batch_norm': True, 'lr': 0.0002335507583626006, 'weight_decay': 1.5678883977390796e-05, 'epochs': 97, 'loss': 'mae', 'optimizer': 'adam', 'graph_mode': 'off', 'use_snp_selection': False}. Best is trial 85 with value: 0.10366893036924316.
[I 2025-12-05 15:18:14,904] Trial 98 finished with value: 0.03320792323691654 and parameters: {'model_type': 'mlp', 'hidden_dims': '[512, 64]', 'dropout': 0.4936098101952421, 'batch_norm': True, 'lr': 0.00011494156506353505, 'weight_decay': 0.00013451002070600197, 'epochs': 40, 'loss': 'mse', 'optimizer': 'adam', 'graph_mode': 'off', 'use_snp_selection': False}. Best is trial 85 with value: 0.10366893036924316.
[I 2025-12-05 15:18:17,020] Trial 99 finished with value: 0.07944111018808764 and parameters: {'model_type': 'mlp', 'hidden_dims': '[512, 64]', 'dropout': 0.15741280937814017, 'batch_norm': False, 'lr': 5.3503871204199554e-05, 'weight_decay': 3.6658152925418647e-07, 'epochs': 337, 'loss': 'mae', 'optimizer': 'adam', 'graph_mode': 'off', 'use_snp_selection': False}. Best is trial 85 with value: 0.10366893036924316.
[I 2025-12-05 15:18:18,503] Trial 100 finished with value: 0.06924927728995167 and parameters: {'model_type': 'mlp', 'hidden_dims': '[512, 256]', 'dropout': 0.16702419952561431, 'batch_norm': True, 'lr': 2.9289084854327876e-05, 'weight_decay': 3.127039121351382e-05, 'epochs': 294, 'loss': 'mse', 'optimizer': 'adam', 'graph_mode': 'off', 'use_snp_selection': True, 'num_snps': 13625}. Best is trial 85 with value: 0.10366893036924316.
[I 2025-12-05 15:18:19,525] Trial 101 finished with value: 0.05045375748451632 and parameters: {'model_type': 'mlp', 'hidden_dims': '[512, 128]', 'dropout': 0.11864125880585671, 'batch_norm': True, 'lr': 0.00031464692261762626, 'weight_decay': 1.3936357304276757e-06, 'epochs': 57, 'loss': 'mse', 'optimizer': 'adam', 'graph_mode': 'off', 'use_snp_selection': False}. Best is trial 85 with value: 0.10366893036924316.
[I 2025-12-05 15:18:20,207] Trial 102 finished with value: 0.07744432312991698 and parameters: {'model_type': 'mlp', 'hidden_dims': '[128, 64]', 'dropout': 0.12871451792592015, 'batch_norm': True, 'lr': 0.0006890060808536001, 'weight_decay': 1.0390329065036228e-06, 'epochs': 47, 'loss': 'mse', 'optimizer': 'adam', 'graph_mode': 'off', 'use_snp_selection': False}. Best is trial 85 with value: 0.10366893036924316.
[I 2025-12-05 15:18:21,251] Trial 103 finished with value: 0.07214497107391454 and parameters: {'model_type': 'mlp', 'hidden_dims': '[512, 128]', 'dropout': 0.10598519694642085, 'batch_norm': True, 'lr': 0.0003765030376627172, 'weight_decay': 2.1730922211328013e-06, 'epochs': 66, 'loss': 'mse', 'optimizer': 'adam', 'graph_mode': 'off', 'use_snp_selection': False}. Best is trial 85 with value: 0.10366893036924316.
[I 2025-12-05 15:18:22,344] Trial 104 finished with value: 0.05786636036419643 and parameters: {'model_type': 'mlp', 'hidden_dims': '[512, 64]', 'dropout': 0.14341359638594733, 'batch_norm': True, 'lr': 6.821473114728374e-05, 'weight_decay': 2.2515436610029308e-07, 'epochs': 79, 'loss': 'mse', 'optimizer': 'adam', 'graph_mode': 'off', 'use_snp_selection': False}. Best is trial 85 with value: 0.10366893036924316.
[I 2025-12-05 15:18:23,166] Trial 105 finished with value: 0.06736331543121438 and parameters: {'model_type': 'mlp', 'hidden_dims': '[256, 128]', 'dropout': 0.10192314666043896, 'batch_norm': True, 'lr': 0.0001394819014090501, 'weight_decay': 2.1987574161651022e-05, 'epochs': 72, 'loss': 'mse', 'optimizer': 'adam', 'graph_mode': 'off', 'use_snp_selection': False}. Best is trial 85 with value: 0.10366893036924316.
