[I 2025-12-05 14:42:05,180] Trial 69 finished with value: 0.1368852703732852 and parameters: {'model_type': 'mlp', 'hidden_dims': '[256, 128, 64]', 'dropout': 0.31946095607612834, 'batch_norm': True, 'lr': 0.0004954702353991971, 'weight_decay': 0.00016171232059203778, 'epochs': 230, 'loss': 'mae', 'optimizer': 'adam', 'graph_mode': 'off', 'use_snp_selection': False}. Best is trial 34 with value: 0.15284138160430905.
[I 2025-12-05 14:42:09,032] Trial 70 finished with value: 0.1359612196577053 and parameters: {'model_type': 'mlp', 'hidden_dims': '[512, 128]', 'dropout': 0.26136004743784536, 'batch_norm': True, 'lr': 0.0003822585889589598, 'weight_decay': 1.5555865101394457e-07, 'epochs': 264, 'loss': 'mae', 'optimizer': 'adam', 'graph_mode': 'off', 'use_snp_selection': False}. Best is trial 34 with value: 0.15284138160430905.
[I 2025-12-05 14:42:12,217] Trial 71 finished with value: 0.12974912217344425 and parameters: {'model_type': 'mlp', 'hidden_dims': '[512, 256]', 'dropout': 0.5634562974241759, 'batch_norm': True, 'lr': 0.0007044396669836269, 'weight_decay': 8.473376473894385e-05, 'epochs': 207, 'loss': 'mae', 'optimizer': 'adam', 'graph_mode': 'off', 'use_snp_selection': False}. Best is trial 34 with value: 0.15284138160430905.
[I 2025-12-05 14:42:15,356] Trial 72 finished with value: 0.1519454597286098 and parameters: {'model_type': 'mlp', 'hidden_dims': '[512, 256]', 'dropout': 0.582333150555867, 'batch_norm': True, 'lr': 0.0006156133010816907, 'weight_decay': 2.4706043137123614e-05, 'epochs': 203, 'loss': 'mae', 'optimizer': 'adam', 'graph_mode': 'off', 'use_snp_selection': False}. Best is trial 34 with value: 0.15284138160430905.
[I 2025-12-05 14:42:17,815] Trial 73 finished with value: 0.13986355458938038 and parameters: {'model_type': 'mlp', 'hidden_dims': '[512, 256]', 'dropout': 0.5257108483413145, 'batch_norm': True, 'lr': 0.000981102922249362, 'weight_decay': 1.891514947776444e-05, 'epochs': 145, 'loss': 'mae', 'optimizer': 'adam', 'graph_mode': 'off', 'use_snp_selection': False}. Best is trial 34 with value: 0.15284138160430905.
[I 2025-12-05 14:42:20,967] Trial 74 finished with value: 0.13955527924890682 and parameters: {'model_type': 'mlp', 'hidden_dims': '[512, 256]', 'dropout': 0.5848346769391891, 'batch_norm': True, 'lr': 0.0005750090076679636, 'weight_decay': 2.5122283907538695e-05, 'epochs': 204, 'loss': 'mae', 'optimizer': 'adam', 'graph_mode': 'off', 'use_snp_selection': False}. Best is trial 34 with value: 0.15284138160430905.
[I 2025-12-05 14:42:23,789] Trial 75 finished with value: 0.14097574300864396 and parameters: {'model_type': 'mlp', 'hidden_dims': '[512, 256]', 'dropout': 0.5613121465820373, 'batch_norm': True, 'lr': 0.0004491316939664951, 'weight_decay': 1.2039188711587157e-05, 'epochs': 176, 'loss': 'mae', 'optimizer': 'adam', 'graph_mode': 'off', 'use_snp_selection': False}. Best is trial 34 with value: 0.15284138160430905.
[I 2025-12-05 14:42:25,419] Trial 76 finished with value: 0.13735100701224623 and parameters: {'model_type': 'mlp', 'hidden_dims': '[512, 256]', 'dropout': 0.5349794380955301, 'batch_norm': True, 'lr': 0.0002915376642598548, 'weight_decay': 8.839334061995747e-06, 'epochs': 189, 'loss': 'mae', 'optimizer': 'adam', 'graph_mode': 'off', 'use_snp_selection': True, 'num_snps': 3325}. Best is trial 34 with value: 0.15284138160430905.
[I 2025-12-05 14:42:27,081] Trial 77 finished with value: 0.1287814327388872 and parameters: {'model_type': 'mlp', 'hidden_dims': '[256, 128]', 'dropout': 0.44810152007989124, 'batch_norm': True, 'lr': 0.0008224929210464283, 'weight_decay': 5.711234169001391e-06, 'epochs': 160, 'loss': 'mae', 'optimizer': 'adam', 'graph_mode': 'off', 'use_snp_selection': False}. Best is trial 34 with value: 0.15284138160430905.
[I 2025-12-05 14:42:30,670] Trial 78 finished with value: 0.12224038356124087 and parameters: {'model_type': 'mlp', 'hidden_dims': '[512, 128]', 'dropout': 0.4977976156536737, 'batch_norm': True, 'lr': 0.0006326399047169239, 'weight_decay': 2.624611047786835e-05, 'epochs': 241, 'loss': 'mse', 'optimizer': 'adam', 'graph_mode': 'off', 'use_snp_selection': False}. Best is trial 34 with value: 0.15284138160430905.
[I 2025-12-05 14:42:35,038] Trial 79 finished with value: 0.10782889244036926 and parameters: {'model_type': 'mlp', 'hidden_dims': '[512, 64]', 'dropout': 0.5902690056747167, 'batch_norm': True, 'lr': 2.3143489677545154e-05, 'weight_decay': 5.1267115108479764e-05, 'epochs': 309, 'loss': 'mae', 'optimizer': 'adam', 'graph_mode': 'off', 'use_snp_selection': False}. Best is trial 34 with value: 0.15284138160430905.
[I 2025-12-05 14:42:38,488] Trial 80 finished with value: 0.1326514418757775 and parameters: {'model_type': 'mlp', 'hidden_dims': '[512, 256]', 'dropout': 0.5762825297274367, 'batch_norm': False, 'lr': 0.00011606202002993947, 'weight_decay': 1.2239078946474997e-05, 'epochs': 229, 'loss': 'mae', 'optimizer': 'adam', 'graph_mode': 'off', 'use_snp_selection': False}. Best is trial 34 with value: 0.15284138160430905.
[I 2025-12-05 14:42:41,519] Trial 81 finished with value: 0.14988324826482752 and parameters: {'model_type': 'mlp', 'hidden_dims': '[512, 256]', 'dropout': 0.5533936722915614, 'batch_norm': True, 'lr': 0.0006637663598692569, 'weight_decay': 9.701637050928452e-05, 'epochs': 193, 'loss': 'mae', 'optimizer': 'adam', 'graph_mode': 'off', 'use_snp_selection': False}. Best is trial 34 with value: 0.15284138160430905.
[I 2025-12-05 14:42:44,622] Trial 82 finished with value: 0.14518681085277949 and parameters: {'model_type': 'mlp', 'hidden_dims': '[512, 256]', 'dropout': 0.5498045918416459, 'batch_norm': True, 'lr': 0.00036242851350228066, 'weight_decay': 0.0001718305123926095, 'epochs': 199, 'loss': 'mae', 'optimizer': 'adam', 'graph_mode': 'off', 'use_snp_selection': False}. Best is trial 34 with value: 0.15284138160430905.
[I 2025-12-05 14:42:47,466] Trial 83 finished with value: 0.14718663820462288 and parameters: {'model_type': 'mlp', 'hidden_dims': '[512, 256]', 'dropout': 0.553915741233772, 'batch_norm': True, 'lr': 0.0003829180373649628, 'weight_decay': 0.000347004085906394, 'epochs': 178, 'loss': 'mae', 'optimizer': 'adam', 'graph_mode': 'off', 'use_snp_selection': False}. Best is trial 34 with value: 0.15284138160430905.
[I 2025-12-05 14:42:50,479] Trial 84 finished with value: 0.14255644732259426 and parameters: {'model_type': 'mlp', 'hidden_dims': '[512, 256]', 'dropout': 0.5206634291827139, 'batch_norm': True, 'lr': 0.0001612778909930425, 'weight_decay': 0.0002975380841685736, 'epochs': 192, 'loss': 'mae', 'optimizer': 'adam', 'graph_mode': 'off', 'use_snp_selection': False}. Best is trial 34 with value: 0.15284138160430905.
[I 2025-12-05 14:42:53,361] Trial 85 finished with value: 0.1315041157954104 and parameters: {'model_type': 'mlp', 'hidden_dims': '[512, 256]', 'dropout': 0.574409971582629, 'batch_norm': True, 'lr': 0.00036184791070262664, 'weight_decay': 0.00018829022038383572, 'epochs': 181, 'loss': 'mae', 'optimizer': 'adam', 'graph_mode': 'off', 'use_snp_selection': False}. Best is trial 34 with value: 0.15284138160430905.
[I 2025-12-05 14:42:57,607] Trial 86 finished with value: 0.13323315015079584 and parameters: {'model_type': 'mlp', 'hidden_dims': '[512, 128]', 'dropout': 0.5509822850169616, 'batch_norm': True, 'lr': 0.00023234395472860846, 'weight_decay': 0.0006062003373428045, 'epochs': 298, 'loss': 'mae', 'optimizer': 'adam', 'graph_mode': 'off', 'use_snp_selection': False}. Best is trial 34 with value: 0.15284138160430905.
[I 2025-12-05 14:43:00,415] Trial 87 finished with value: 0.13026932369979005 and parameters: {'model_type': 'mlp', 'hidden_dims': '[512, 256]', 'dropout': 0.5976252495583486, 'batch_norm': True, 'lr': 0.0005926989858766158, 'weight_decay': 0.00034901850152457473, 'epochs': 174, 'loss': 'mae', 'optimizer': 'adam', 'graph_mode': 'off', 'use_snp_selection': False}. Best is trial 34 with value: 0.15284138160430905.
[I 2025-12-05 14:43:03,578] Trial 88 finished with value: 0.0992633476543752 and parameters: {'model_type': 'mlp', 'hidden_dims': '[128, 64]', 'dropout': 0.5066459657031771, 'batch_norm': True, 'lr': 0.00029191771915547637, 'weight_decay': 0.0004182648790486387, 'epochs': 218, 'loss': 'mae', 'optimizer': 'adam', 'graph_mode': 'off', 'use_snp_selection': True, 'num_snps': 48766}. Best is trial 34 with value: 0.15284138160430905.
[I 2025-12-05 14:43:07,507] Trial 89 finished with value: 0.14707845998863847 and parameters: {'model_type': 'mlp', 'hidden_dims': '[512, 128]', 'dropout': 0.14066163647699306, 'batch_norm': True, 'lr': 0.0004966197842712862, 'weight_decay': 0.00025663816374883036, 'epochs': 271, 'loss': 'mae', 'optimizer': 'adam', 'graph_mode': 'off', 'use_snp_selection': False}. Best is trial 34 with value: 0.15284138160430905.
[I 2025-12-05 14:43:11,975] Trial 90 finished with value: 0.13285982231921578 and parameters: {'model_type': 'mlp', 'hidden_dims': '[512, 128]', 'dropout': 0.1265839171685989, 'batch_norm': True, 'lr': 0.0006737992962790412, 'weight_decay': 0.0007941536367691674, 'epochs': 317, 'loss': 'mse', 'optimizer': 'adam', 'graph_mode': 'off', 'use_snp_selection': False}. Best is trial 34 with value: 0.15284138160430905.
[I 2025-12-05 14:43:15,888] Trial 91 finished with value: 0.14620291699948523 and parameters: {'model_type': 'mlp', 'hidden_dims': '[512, 128]', 'dropout': 0.10198422820826787, 'batch_norm': True, 'lr': 0.0005250188960730847, 'weight_decay': 0.00024151605644665854, 'epochs': 268, 'loss': 'mae', 'optimizer': 'adam', 'graph_mode': 'off', 'use_snp_selection': False}. Best is trial 34 with value: 0.15284138160430905.
[I 2025-12-05 14:43:19,771] Trial 92 finished with value: 0.14855432749329714 and parameters: {'model_type': 'mlp', 'hidden_dims': '[512, 128]', 'dropout': 0.10754484961632836, 'batch_norm': True, 'lr': 0.0005184732578393399, 'weight_decay': 0.0002607949796813262, 'epochs': 267, 'loss': 'mae', 'optimizer': 'adam', 'graph_mode': 'off', 'use_snp_selection': False}. Best is trial 34 with value: 0.15284138160430905.
[I 2025-12-05 14:43:23,500] Trial 93 finished with value: 0.14390837880765034 and parameters: {'model_type': 'mlp', 'hidden_dims': '[512, 128]', 'dropout': 0.14882098120813816, 'batch_norm': True, 'lr': 0.0004702236302875167, 'weight_decay': 0.0005485112696445842, 'epochs': 253, 'loss': 'mae', 'optimizer': 'adam', 'graph_mode': 'off', 'use_snp_selection': False}. Best is trial 34 with value: 0.15284138160430905.
[I 2025-12-05 14:43:27,526] Trial 94 finished with value: 0.1445812836197644 and parameters: {'model_type': 'mlp', 'hidden_dims': '[512, 128]', 'dropout': 0.12670299819521047, 'batch_norm': True, 'lr': 0.0007281057788848117, 'weight_decay': 0.0002697552090583033, 'epochs': 279, 'loss': 'mae', 'optimizer': 'adam', 'graph_mode': 'off', 'use_snp_selection': False}. Best is trial 34 with value: 0.15284138160430905.
[I 2025-12-05 14:43:32,356] Trial 95 finished with value: 0.14833265231808582 and parameters: {'model_type': 'mlp', 'hidden_dims': '[512, 128]', 'dropout': 0.13514375920192762, 'batch_norm': True, 'lr': 0.0005514140500616592, 'weight_decay': 4.1744902475370075e-07, 'epochs': 347, 'loss': 'mae', 'optimizer': 'adam', 'graph_mode': 'off', 'use_snp_selection': False}. Best is trial 34 with value: 0.15284138160430905.
[I 2025-12-05 14:43:36,930] Trial 96 finished with value: 0.12960633965687735 and parameters: {'model_type': 'mlp', 'hidden_dims': '[512, 128]', 'dropout': 0.16088156958425914, 'batch_norm': True, 'lr': 0.00039803765638154174, 'weight_decay': 0.0001487295558732522, 'epochs': 326, 'loss': 'mae', 'optimizer': 'adam', 'graph_mode': 'off', 'use_snp_selection': False}. Best is trial 34 with value: 0.15284138160430905.
[I 2025-12-05 14:43:41,717] Trial 97 finished with value: 0.1359157257519699 and parameters: {'model_type': 'mlp', 'hidden_dims': '[512, 128]', 'dropout': 0.13621997286421134, 'batch_norm': True, 'lr': 0.0005447573824973044, 'weight_decay': 2.942498809212598e-07, 'epochs': 344, 'loss': 'mae', 'optimizer': 'adam', 'graph_mode': 'off', 'use_snp_selection': False}. Best is trial 34 with value: 0.15284138160430905.
[I 2025-12-05 14:43:46,491] Trial 98 finished with value: 0.14548800315119084 and parameters: {'model_type': 'mlp', 'hidden_dims': '[512, 128]', 'dropout': 0.18672319811128102, 'batch_norm': True, 'lr': 0.0008731317559622089, 'weight_decay': 0.00010002665871913786, 'epochs': 343, 'loss': 'mae', 'optimizer': 'adam', 'graph_mode': 'off', 'use_snp_selection': False}. Best is trial 34 with value: 0.15284138160430905.
[I 2025-12-05 14:43:48,970] Trial 99 finished with value: 0.09219617291089335 and parameters: {'model_type': 'mlp', 'hidden_dims': '[256, 128, 64]', 'dropout': 0.11223720645517699, 'batch_norm': False, 'lr': 2.3294687156157485e-06, 'weight_decay': 3.8834178757896604e-07, 'epochs': 291, 'loss': 'mae', 'optimizer': 'adam', 'graph_mode': 'off', 'use_snp_selection': False}. Best is trial 34 with value: 0.15284138160430905.
[I 2025-12-05 14:43:53,581] Trial 100 finished with value: 0.14156061321521057 and parameters: {'model_type': 'mlp', 'hidden_dims': '[512, 128]', 'dropout': 0.13977613838596545, 'batch_norm': True, 'lr': 0.00033530123922699545, 'weight_decay': 0.0009978946341971363, 'epochs': 328, 'loss': 'mae', 'optimizer': 'adam', 'graph_mode': 'off', 'use_snp_selection': False}. Best is trial 34 with value: 0.15284138160430905.
[I 2025-12-05 14:43:57,531] Trial 101 finished with value: 0.1369362451890612 and parameters: {'model_type': 'mlp', 'hidden_dims': '[512, 128]', 'dropout': 0.11919012969927736, 'batch_norm': True, 'lr': 0.0006435496644840174, 'weight_decay': 1.667515979857445e-05, 'epochs': 272, 'loss': 'mae', 'optimizer': 'adam', 'graph_mode': 'off', 'use_snp_selection': False}. Best is trial 34 with value: 0.15284138160430905.
[I 2025-12-05 14:44:01,945] Trial 102 finished with value: 0.1428244621310645 and parameters: {'model_type': 'mlp', 'hidden_dims': '[512, 128]', 'dropout': 0.11122524612801, 'batch_norm': True, 'lr': 0.0004876222407261893, 'weight_decay': 1.0482941777728969e-07, 'epochs': 312, 'loss': 'mae', 'optimizer': 'adam', 'graph_mode': 'off', 'use_snp_selection': False}. Best is trial 34 with value: 0.15284138160430905.
[I 2025-12-05 14:44:06,210] Trial 103 finished with value: 0.13370781583098024 and parameters: {'model_type': 'mlp', 'hidden_dims': '[512, 128]', 'dropout': 0.1669880399364349, 'batch_norm': True, 'lr': 0.0007324033365382958, 'weight_decay': 8.105717400218296e-07, 'epochs': 299, 'loss': 'mae', 'optimizer': 'adam', 'graph_mode': 'off', 'use_snp_selection': False}. Best is trial 34 with value: 0.15284138160430905.
[I 2025-12-05 14:44:09,845] Trial 104 finished with value: 0.12698792344816787 and parameters: {'model_type': 'mlp', 'hidden_dims': '[512, 128]', 'dropout': 0.1814485717049632, 'batch_norm': True, 'lr': 0.0004187257965057701, 'weight_decay': 1.626821375704719e-07, 'epochs': 245, 'loss': 'mae', 'optimizer': 'adam', 'graph_mode': 'off', 'use_snp_selection': False}. Best is trial 34 with value: 0.15284138160430905.
[I 2025-12-05 14:44:13,641] Trial 105 finished with value: 0.1060387836421763 and parameters: {'model_type': 'mlp', 'hidden_dims': '[512, 64]', 'dropout': 0.12837647770297436, 'batch_norm': True, 'lr': 4.936371661780476e-06, 'weight_decay': 4.4640722304417745e-07, 'epochs': 259, 'loss': 'mae', 'optimizer': 'adam', 'graph_mode': 'off', 'use_snp_selection': False}. Best is trial 34 with value: 0.15284138160430905.
[I 2025-12-05 14:44:15,778] Trial 106 finished with value: 0.14444130123286214 and parameters: {'model_type': 'mlp', 'hidden_dims': '[256, 128]', 'dropout': 0.15228180213640896, 'batch_norm': True, 'lr': 0.0008909898773821536, 'weight_decay': 6.315004960220016e-07, 'epochs': 235, 'loss': 'mae', 'optimizer': 'adam', 'graph_mode': 'off', 'use_snp_selection': False}. Best is trial 34 with value: 0.15284138160430905.
[I 2025-12-05 14:44:19,670] Trial 107 finished with value: 0.1396933698846885 and parameters: {'model_type': 'mlp', 'hidden_dims': '[512, 128]', 'dropout': 0.10138465324638556, 'batch_norm': True, 'lr': 0.00018325221352636636, 'weight_decay': 1.433947346835651e-06, 'epochs': 214, 'loss': 'mae', 'optimizer': 'adam', 'graph_mode': 'off', 'use_snp_selection': True, 'num_snps': 37972}. Best is trial 34 with value: 0.15284138160430905.
[I 2025-12-05 14:44:23,775] Trial 108 finished with value: 0.14185288537349944 and parameters: {'model_type': 'mlp', 'hidden_dims': '[512, 128]', 'dropout': 0.19961294078168706, 'batch_norm': True, 'lr': 0.000562082053648717, 'weight_decay': 0.0003180591954385675, 'epochs': 285, 'loss': 'mae', 'optimizer': 'adam', 'graph_mode': 'off', 'use_snp_selection': False}. Best is trial 34 with value: 0.15284138160430905.
[I 2025-12-05 14:44:26,780] Trial 109 finished with value: 0.07152666813204683 and parameters: {'model_type': 'mlp', 'hidden_dims': '[512, 128]', 'dropout': 0.35939428111526767, 'batch_norm': True, 'lr': 1.1221908914200985e-05, 'weight_decay': 3.4916623090194914e-05, 'epochs': 192, 'loss': 'mse', 'optimizer': 'adam', 'graph_mode': 'off', 'use_snp_selection': False}. Best is trial 34 with value: 0.15284138160430905.
[I 2025-12-05 14:44:28,028] Trial 110 finished with value: 0.13640591386171008 and parameters: {'model_type': 'mlp', 'hidden_dims': '[128, 64]', 'dropout': 0.5855492625884533, 'batch_norm': True, 'lr': 0.00023795886984091837, 'weight_decay': 0.0004014174748025779, 'epochs': 225, 'loss': 'mae', 'optimizer': 'adam', 'graph_mode': 'off', 'use_snp_selection': False}. Best is trial 34 with value: 0.15284138160430905.
[I 2025-12-05 14:44:31,945] Trial 111 finished with value: 0.15164184702166453 and parameters: {'model_type': 'mlp', 'hidden_dims': '[512, 128]', 'dropout': 0.10194860573582985, 'batch_norm': True, 'lr': 0.0005180508262072868, 'weight_decay': 0.00020434095622525432, 'epochs': 269, 'loss': 'mae', 'optimizer': 'adam', 'graph_mode': 'off', 'use_snp_selection': False}. Best is trial 34 with value: 0.15284138160430905.
[I 2025-12-05 14:44:35,959] Trial 112 finished with value: 0.14295566685593156 and parameters: {'model_type': 'mlp', 'hidden_dims': '[512, 128]', 'dropout': 0.11245566889552082, 'batch_norm': True, 'lr': 0.0006212926316405857, 'weight_decay': 0.0001377150704117954, 'epochs': 278, 'loss': 'mae', 'optimizer': 'adam', 'graph_mode': 'off', 'use_snp_selection': False}. Best is trial 34 with value: 0.15284138160430905.
[I 2025-12-05 14:44:39,766] Trial 113 finished with value: 0.12893285844485247 and parameters: {'model_type': 'mlp', 'hidden_dims': '[512, 128]', 'dropout': 0.13608351818848663, 'batch_norm': True, 'lr': 0.0007580589608158188, 'weight_decay': 0.00022244858617225273, 'epochs': 259, 'loss': 'mae', 'optimizer': 'adam', 'graph_mode': 'off', 'use_snp_selection': False}. Best is trial 34 with value: 0.15284138160430905.
[I 2025-12-05 14:44:44,097] Trial 114 finished with value: 0.1415901358430719 and parameters: {'model_type': 'mlp', 'hidden_dims': '[512, 128]', 'dropout': 0.5630273061378521, 'batch_norm': True, 'lr': 0.0004884178601288915, 'weight_decay': 9.87406012437637e-05, 'epochs': 305, 'loss': 'mae', 'optimizer': 'adam', 'graph_mode': 'off', 'use_snp_selection': False}. Best is trial 34 with value: 0.15284138160430905.
[I 2025-12-05 14:44:48,783] Trial 115 finished with value: 0.13679763514846022 and parameters: {'model_type': 'mlp', 'hidden_dims': '[512, 256]', 'dropout': 0.5428522440644865, 'batch_norm': True, 'lr': 0.0003086099852769281, 'weight_decay': 2.2629290464313324e-05, 'epochs': 334, 'loss': 'mae', 'optimizer': 'adam', 'graph_mode': 'off', 'use_snp_selection': False}. Best is trial 34 with value: 0.15284138160430905.
[I 2025-12-05 14:44:52,673] Trial 116 finished with value: 0.13599784828659334 and parameters: {'model_type': 'mlp', 'hidden_dims': '[512, 128]', 'dropout': 0.12392505333641028, 'batch_norm': True, 'lr': 0.0003852678763948046, 'weight_decay': 0.00025354615722392366, 'epochs': 267, 'loss': 'mae', 'optimizer': 'adam', 'graph_mode': 'off', 'use_snp_selection': False}. Best is trial 34 with value: 0.15284138160430905.
[I 2025-12-05 14:44:55,514] Trial 117 finished with value: 0.11428961498600236 and parameters: {'model_type': 'mlp', 'hidden_dims': '[512, 256]', 'dropout': 0.419560222064739, 'batch_norm': False, 'lr': 0.00043410939269015233, 'weight_decay': 0.0001898318313858735, 'epochs': 179, 'loss': 'mae', 'optimizer': 'adam', 'graph_mode': 'off', 'use_snp_selection': False}. Best is trial 34 with value: 0.15284138160430905.
[I 2025-12-05 14:44:58,227] Trial 118 finished with value: 0.14587545183682726 and parameters: {'model_type': 'mlp', 'hidden_dims': '[512, 256]', 'dropout': 0.10875028415613185, 'batch_norm': True, 'lr': 0.0006678822939716043, 'weight_decay': 6.799801477886382e-05, 'epochs': 166, 'loss': 'mae', 'optimizer': 'adam', 'graph_mode': 'off', 'use_snp_selection': False}. Best is trial 34 with value: 0.15284138160430905.
[I 2025-12-05 14:45:01,136] Trial 119 finished with value: 0.13758337450450459 and parameters: {'model_type': 'mlp', 'hidden_dims': '[256, 128, 64]', 'dropout': 0.14090863932696432, 'batch_norm': True, 'lr': 0.0009826583259754872, 'weight_decay': 0.0004657146714585792, 'epochs': 350, 'loss': 'mae', 'optimizer': 'adam', 'graph_mode': 'off', 'use_snp_selection': False}. Best is trial 34 with value: 0.15284138160430905.
[I 2025-12-05 14:45:04,278] Trial 120 finished with value: 0.14546175184814586 and parameters: {'model_type': 'mlp', 'hidden_dims': '[512, 128]', 'dropout': 0.5294580167129048, 'batch_norm': True, 'lr': 0.0005588756452755255, 'weight_decay': 0.00034798770437476556, 'epochs': 203, 'loss': 'mae', 'optimizer': 'adam', 'graph_mode': 'off', 'use_snp_selection': False}. Best is trial 34 with value: 0.15284138160430905.
