[I 2025-12-05 14:24:43,674] Trial 50 finished with value: 0.03578221255146514 and parameters: {'model_type': 'mlp', 'hidden_dims': '[512, 256]', 'dropout': 0.17534824098462984, 'batch_norm': False, 'lr': 7.55585065385466e-05, 'weight_decay': 2.8595363373612348e-05, 'epochs': 306, 'loss': 'mae', 'optimizer': 'adam', 'graph_mode': 'off', 'use_snp_selection': True, 'num_snps': 7711}. Best is trial 33 with value: 0.04555024989504239.
[I 2025-12-05 14:24:44,643] Trial 51 finished with value: 0.0011484605368961749 and parameters: {'model_type': 'mlp', 'hidden_dims': '[512, 256]', 'dropout': 0.13766039461886811, 'batch_norm': False, 'lr': 0.00019203765723500586, 'weight_decay': 3.3796827614339304e-05, 'epochs': 290, 'loss': 'mae', 'optimizer': 'adam', 'graph_mode': 'off', 'use_snp_selection': True, 'num_snps': 7117}. Best is trial 33 with value: 0.04555024989504239.
[I 2025-12-05 14:24:45,596] Trial 52 finished with value: 0.03231632916275415 and parameters: {'model_type': 'mlp', 'hidden_dims': '[512, 256]', 'dropout': 0.18059525573694415, 'batch_norm': False, 'lr': 4.768212693020064e-05, 'weight_decay': 2.131767273910549e-05, 'epochs': 321, 'loss': 'mae', 'optimizer': 'adam', 'graph_mode': 'off', 'use_snp_selection': True, 'num_snps': 5179}. Best is trial 33 with value: 0.04555024989504239.
[I 2025-12-05 14:24:46,655] Trial 53 finished with value: 0.03546864868415754 and parameters: {'model_type': 'mlp', 'hidden_dims': '[512, 256]', 'dropout': 0.3548339469045658, 'batch_norm': False, 'lr': 8.363667496493836e-05, 'weight_decay': 5.954168421193943e-05, 'epochs': 288, 'loss': 'mae', 'optimizer': 'adam', 'graph_mode': 'off', 'use_snp_selection': True, 'num_snps': 9556}. Best is trial 33 with value: 0.04555024989504239.
[I 2025-12-05 14:24:47,729] Trial 54 finished with value: 0.011180881062388816 and parameters: {'model_type': 'mlp', 'hidden_dims': '[512, 256]', 'dropout': 0.1791105760217696, 'batch_norm': False, 'lr': 7.19446020691556e-05, 'weight_decay': 7.211923087304879e-05, 'epochs': 313, 'loss': 'mae', 'optimizer': 'adam', 'graph_mode': 'off', 'use_snp_selection': True, 'num_snps': 9453}. Best is trial 33 with value: 0.04555024989504239.
[I 2025-12-05 14:24:49,127] Trial 55 finished with value: 0.023264551598663204 and parameters: {'model_type': 'mlp', 'hidden_dims': '[512, 256]', 'dropout': 0.5424577783121889, 'batch_norm': False, 'lr': 6.251188902099762e-05, 'weight_decay': 4.2953242765911716e-05, 'epochs': 293, 'loss': 'mae', 'optimizer': 'adam', 'graph_mode': 'off', 'use_snp_selection': True, 'num_snps': 20238}. Best is trial 33 with value: 0.04555024989504239.
[I 2025-12-05 14:24:50,381] Trial 56 finished with value: 0.026385021429219765 and parameters: {'model_type': 'mlp', 'hidden_dims': '[512, 256]', 'dropout': 0.357832254799496, 'batch_norm': False, 'lr': 8.698971521729655e-05, 'weight_decay': 2.742977112725769e-05, 'epochs': 279, 'loss': 'mae', 'optimizer': 'adam', 'graph_mode': 'off', 'use_snp_selection': True, 'num_snps': 14234}. Best is trial 33 with value: 0.04555024989504239.
[I 2025-12-05 14:24:51,421] Trial 57 finished with value: -0.00653500256162734 and parameters: {'model_type': 'mlp', 'hidden_dims': '[512, 256]', 'dropout': 0.10300913171424142, 'batch_norm': True, 'lr': 3.753289742760971e-05, 'weight_decay': 6.063585601238957e-05, 'epochs': 71, 'loss': 'mae', 'optimizer': 'adam', 'graph_mode': 'off', 'use_snp_selection': False}. Best is trial 33 with value: 0.04555024989504239.
[I 2025-12-05 14:24:53,338] Trial 58 finished with value: 0.04356555485309463 and parameters: {'model_type': 'mlp', 'hidden_dims': '[512, 256]', 'dropout': 0.2478811525664928, 'batch_norm': False, 'lr': 0.00016015255551930348, 'weight_decay': 1.2224309110730815e-05, 'epochs': 339, 'loss': 'mae', 'optimizer': 'adam', 'graph_mode': 'off', 'use_snp_selection': True, 'num_snps': 28298}. Best is trial 33 with value: 0.04555024989504239.
[I 2025-12-05 14:24:55,205] Trial 59 finished with value: 0.03447767548415726 and parameters: {'model_type': 'mlp', 'hidden_dims': '[512, 256]', 'dropout': 0.20616896618900862, 'batch_norm': False, 'lr': 0.00015566649756709576, 'weight_decay': 1.361098052581288e-05, 'epochs': 331, 'loss': 'mae', 'optimizer': 'adam', 'graph_mode': 'off', 'use_snp_selection': True, 'num_snps': 27194}. Best is trial 33 with value: 0.04555024989504239.
[I 2025-12-05 14:24:58,589] Trial 60 finished with value: -0.00929658536608991 and parameters: {'model_type': 'mlp', 'hidden_dims': '[512, 256]', 'dropout': 0.23345386605266513, 'batch_norm': False, 'lr': 3.0549052784511446e-06, 'weight_decay': 7.579180117552071e-06, 'epochs': 344, 'loss': 'mae', 'optimizer': 'adam', 'graph_mode': 'off', 'use_snp_selection': True, 'num_snps': 56394}. Best is trial 33 with value: 0.04555024989504239.
[I 2025-12-05 14:25:00,040] Trial 61 finished with value: 0.012257590840205695 and parameters: {'model_type': 'mlp', 'hidden_dims': '[512, 256]', 'dropout': 0.2926879987551781, 'batch_norm': False, 'lr': 0.00026521251575170005, 'weight_decay': 2.2759813927363418e-05, 'epochs': 329, 'loss': 'mae', 'optimizer': 'adam', 'graph_mode': 'off', 'use_snp_selection': True, 'num_snps': 17052}. Best is trial 33 with value: 0.04555024989504239.
[I 2025-12-05 14:25:01,959] Trial 62 finished with value: 0.035868155707053276 and parameters: {'model_type': 'mlp', 'hidden_dims': '[512, 256]', 'dropout': 0.12947011300556693, 'batch_norm': False, 'lr': 0.00013134978176284704, 'weight_decay': 4.166702617585981e-05, 'epochs': 190, 'loss': 'mae', 'optimizer': 'adam', 'graph_mode': 'off', 'use_snp_selection': True, 'num_snps': 33982}. Best is trial 33 with value: 0.04555024989504239.
[I 2025-12-05 14:25:03,999] Trial 63 finished with value: 0.038406615770105484 and parameters: {'model_type': 'mlp', 'hidden_dims': '[512, 256]', 'dropout': 0.12467722380882636, 'batch_norm': False, 'lr': 0.0003632449065770181, 'weight_decay': 4.006947312831384e-05, 'epochs': 186, 'loss': 'mae', 'optimizer': 'adam', 'graph_mode': 'off', 'use_snp_selection': True, 'num_snps': 35865}. Best is trial 33 with value: 0.04555024989504239.
[I 2025-12-05 14:25:05,765] Trial 64 finished with value: 0.03678941297420111 and parameters: {'model_type': 'mlp', 'hidden_dims': '[512, 256]', 'dropout': 0.12365968186448704, 'batch_norm': False, 'lr': 0.0003676527598499582, 'weight_decay': 0.00011119308210875868, 'epochs': 192, 'loss': 'mae', 'optimizer': 'adam', 'graph_mode': 'off', 'use_snp_selection': True, 'num_snps': 29820}. Best is trial 33 with value: 0.04555024989504239.
[I 2025-12-05 14:25:07,403] Trial 65 finished with value: 0.01823224498404239 and parameters: {'model_type': 'mlp', 'hidden_dims': '[128, 64]', 'dropout': 0.13302197746481598, 'batch_norm': False, 'lr': 0.0002909252060849823, 'weight_decay': 0.0001295277788445372, 'epochs': 205, 'loss': 'mae', 'optimizer': 'adam', 'graph_mode': 'off', 'use_snp_selection': True, 'num_snps': 29325}. Best is trial 33 with value: 0.04555024989504239.
[I 2025-12-05 14:25:09,548] Trial 66 finished with value: 0.008780046801116171 and parameters: {'model_type': 'mlp', 'hidden_dims': '[512, 256]', 'dropout': 0.15771017155308165, 'batch_norm': False, 'lr': 0.0003566536374153513, 'weight_decay': 9.831673613023462e-05, 'epochs': 173, 'loss': 'mae', 'optimizer': 'adam', 'graph_mode': 'off', 'use_snp_selection': True, 'num_snps': 38880}. Best is trial 33 with value: 0.04555024989504239.
[I 2025-12-05 14:25:11,472] Trial 67 finished with value: 0.01939852169471008 and parameters: {'model_type': 'mlp', 'hidden_dims': '[512, 64]', 'dropout': 0.1144038988549634, 'batch_norm': False, 'lr': 0.00043969635611618884, 'weight_decay': 0.00019459865326718138, 'epochs': 182, 'loss': 'mae', 'optimizer': 'adam', 'graph_mode': 'off', 'use_snp_selection': True, 'num_snps': 33502}. Best is trial 33 with value: 0.04555024989504239.
[I 2025-12-05 14:25:13,628] Trial 68 finished with value: 0.032852270635294785 and parameters: {'model_type': 'mlp', 'hidden_dims': '[512, 256]', 'dropout': 0.1554288609995106, 'batch_norm': False, 'lr': 0.00021214361575265097, 'weight_decay': 1.0976572314712745e-07, 'epochs': 229, 'loss': 'mae', 'optimizer': 'adam', 'graph_mode': 'off', 'use_snp_selection': True, 'num_snps': 36639}. Best is trial 33 with value: 0.04555024989504239.
[I 2025-12-05 14:25:15,406] Trial 69 finished with value: 0.043916921819559376 and parameters: {'model_type': 'mlp', 'hidden_dims': '[512, 256]', 'dropout': 0.24629472464514515, 'batch_norm': False, 'lr': 0.0005644533449216867, 'weight_decay': 1.760146617678066e-05, 'epochs': 215, 'loss': 'mse', 'optimizer': 'adam', 'graph_mode': 'off', 'use_snp_selection': True, 'num_snps': 29973}. Best is trial 33 with value: 0.04555024989504239.
[I 2025-12-05 14:25:16,849] Trial 70 finished with value: 0.039757284441417656 and parameters: {'model_type': 'mlp', 'hidden_dims': '[512, 256]', 'dropout': 0.2541450460932202, 'batch_norm': False, 'lr': 0.0005960611756814423, 'weight_decay': 1.6658605331113375e-05, 'epochs': 212, 'loss': 'mse', 'optimizer': 'adam', 'graph_mode': 'off', 'use_snp_selection': False}. Best is trial 33 with value: 0.04555024989504239.
[I 2025-12-05 14:25:18,335] Trial 71 finished with value: 0.0047742874898452125 and parameters: {'model_type': 'mlp', 'hidden_dims': '[512, 256]', 'dropout': 0.25295395678043386, 'batch_norm': False, 'lr': 0.0005951992300539484, 'weight_decay': 1.0074613598866904e-05, 'epochs': 224, 'loss': 'mse', 'optimizer': 'adam', 'graph_mode': 'off', 'use_snp_selection': False}. Best is trial 33 with value: 0.04555024989504239.
[I 2025-12-05 14:25:19,738] Trial 72 finished with value: -0.014035905521294016 and parameters: {'model_type': 'mlp', 'hidden_dims': '[512, 256]', 'dropout': 0.19367090418794433, 'batch_norm': False, 'lr': 0.0008414207765756405, 'weight_decay': 1.4840846563397232e-05, 'epochs': 210, 'loss': 'mse', 'optimizer': 'adam', 'graph_mode': 'off', 'use_snp_selection': False}. Best is trial 33 with value: 0.04555024989504239.
[I 2025-12-05 14:25:21,026] Trial 73 finished with value: 0.030036989047119916 and parameters: {'model_type': 'mlp', 'hidden_dims': '[512, 256]', 'dropout': 0.23564285613069064, 'batch_norm': False, 'lr': 0.0005479063603264202, 'weight_decay': 5.9311411857981435e-06, 'epochs': 162, 'loss': 'mse', 'optimizer': 'adam', 'graph_mode': 'off', 'use_snp_selection': False}. Best is trial 33 with value: 0.04555024989504239.
[I 2025-12-05 14:25:22,123] Trial 74 finished with value: 0.041512556606662664 and parameters: {'model_type': 'mlp', 'hidden_dims': '[256, 128]', 'dropout': 0.2177857719313645, 'batch_norm': False, 'lr': 0.0003918169153508408, 'weight_decay': 3.5706077948913966e-05, 'epochs': 252, 'loss': 'mse', 'optimizer': 'adam', 'graph_mode': 'off', 'use_snp_selection': False}. Best is trial 33 with value: 0.04555024989504239.
[I 2025-12-05 14:25:23,126] Trial 75 finished with value: 0.027452623606618216 and parameters: {'model_type': 'mlp', 'hidden_dims': '[256, 128]', 'dropout': 0.22541299444655655, 'batch_norm': False, 'lr': 0.00042133973026298416, 'weight_decay': 1.7612935371850928e-05, 'epochs': 205, 'loss': 'mse', 'optimizer': 'adam', 'graph_mode': 'off', 'use_snp_selection': False}. Best is trial 33 with value: 0.04555024989504239.
[I 2025-12-05 14:25:24,238] Trial 76 finished with value: 0.005050691947681041 and parameters: {'model_type': 'mlp', 'hidden_dims': '[256, 128]', 'dropout': 0.255064938329026, 'batch_norm': False, 'lr': 0.0009609091218993133, 'weight_decay': 3.9609118529347896e-05, 'epochs': 267, 'loss': 'mse', 'optimizer': 'adam', 'graph_mode': 'off', 'use_snp_selection': False}. Best is trial 33 with value: 0.04555024989504239.
[I 2025-12-05 14:25:25,310] Trial 77 finished with value: 0.03817051825198319 and parameters: {'model_type': 'mlp', 'hidden_dims': '[256, 128]', 'dropout': 0.2198013241569869, 'batch_norm': True, 'lr': 0.00034400380784071637, 'weight_decay': 7.701760226584387e-05, 'epochs': 230, 'loss': 'mse', 'optimizer': 'adam', 'graph_mode': 'off', 'use_snp_selection': False}. Best is trial 33 with value: 0.04555024989504239.
[I 2025-12-05 14:25:26,430] Trial 78 finished with value: 0.033443350261045106 and parameters: {'model_type': 'mlp', 'hidden_dims': '[256, 128]', 'dropout': 0.27953333457214563, 'batch_norm': True, 'lr': 0.00024316032453006994, 'weight_decay': 7.15511150108597e-05, 'epochs': 253, 'loss': 'mse', 'optimizer': 'adam', 'graph_mode': 'off', 'use_snp_selection': False}. Best is trial 33 with value: 0.04555024989504239.
[I 2025-12-05 14:25:27,504] Trial 79 finished with value: 0.021773426132224587 and parameters: {'model_type': 'mlp', 'hidden_dims': '[256, 128]', 'dropout': 0.30554197454374066, 'batch_norm': True, 'lr': 0.00033318651331153387, 'weight_decay': 3.6033895427070058e-06, 'epochs': 237, 'loss': 'mse', 'optimizer': 'adam', 'graph_mode': 'off', 'use_snp_selection': False}. Best is trial 33 with value: 0.04555024989504239.
[I 2025-12-05 14:25:28,549] Trial 80 finished with value: 0.012404253917923463 and parameters: {'model_type': 'mlp', 'hidden_dims': '[256, 128]', 'dropout': 0.20964774944230824, 'batch_norm': True, 'lr': 0.0006989503886333521, 'weight_decay': 1.7468537570588334e-05, 'epochs': 217, 'loss': 'mse', 'optimizer': 'adam', 'graph_mode': 'off', 'use_snp_selection': False}. Best is trial 33 with value: 0.04555024989504239.
[I 2025-12-05 14:25:29,620] Trial 81 finished with value: 0.02619702012326995 and parameters: {'model_type': 'mlp', 'hidden_dims': '[256, 128]', 'dropout': 0.22132883667481618, 'batch_norm': True, 'lr': 0.0004977287718606613, 'weight_decay': 3.5863473832755075e-05, 'epochs': 246, 'loss': 'mse', 'optimizer': 'adam', 'graph_mode': 'off', 'use_snp_selection': False}. Best is trial 33 with value: 0.04555024989504239.
[I 2025-12-05 14:25:30,693] Trial 82 finished with value: 0.019398640941943317 and parameters: {'model_type': 'mlp', 'hidden_dims': '[256, 128]', 'dropout': 0.19822608892069601, 'batch_norm': True, 'lr': 0.00018456506221191184, 'weight_decay': 4.9129278133614444e-05, 'epochs': 232, 'loss': 'mse', 'optimizer': 'adam', 'graph_mode': 'off', 'use_snp_selection': False}. Best is trial 33 with value: 0.04555024989504239.
[I 2025-12-05 14:25:31,374] Trial 83 finished with value: 0.020422400423324383 and parameters: {'model_type': 'mlp', 'hidden_dims': '[128, 64]', 'dropout': 0.24778516635354936, 'batch_norm': False, 'lr': 0.0003511269405158411, 'weight_decay': 1.1528170020434386e-05, 'epochs': 50, 'loss': 'mse', 'optimizer': 'adam', 'graph_mode': 'off', 'use_snp_selection': False}. Best is trial 33 with value: 0.04555024989504239.
[I 2025-12-05 14:25:32,824] Trial 84 finished with value: 0.010630513724717208 and parameters: {'model_type': 'mlp', 'hidden_dims': '[512, 128]', 'dropout': 0.26722407150251926, 'batch_norm': False, 'lr': 0.0004530398829565195, 'weight_decay': 0.00011197862649388259, 'epochs': 218, 'loss': 'mse', 'optimizer': 'adam', 'graph_mode': 'off', 'use_snp_selection': False}. Best is trial 33 with value: 0.04555024989504239.
[I 2025-12-05 14:25:33,833] Trial 85 finished with value: 0.021332850143493527 and parameters: {'model_type': 'mlp', 'hidden_dims': '[256, 128]', 'dropout': 0.1722315034483577, 'batch_norm': True, 'lr': 0.00029857253651804265, 'weight_decay': 8.697456766301188e-05, 'epochs': 198, 'loss': 'mse', 'optimizer': 'adam', 'graph_mode': 'off', 'use_snp_selection': False}. Best is trial 33 with value: 0.04555024989504239.
[I 2025-12-05 14:25:34,953] Trial 86 finished with value: 0.010427656845388312 and parameters: {'model_type': 'mlp', 'hidden_dims': '[512, 64]', 'dropout': 0.26300958786198314, 'batch_norm': False, 'lr': 0.0006121781551557102, 'weight_decay': 0.00015197169288599154, 'epochs': 106, 'loss': 'mse', 'optimizer': 'adam', 'graph_mode': 'off', 'use_snp_selection': False}. Best is trial 33 with value: 0.04555024989504239.
[I 2025-12-05 14:25:36,150] Trial 87 finished with value: 0.012323928493163197 and parameters: {'model_type': 'mlp', 'hidden_dims': '[512, 256]', 'dropout': 0.11963825691207246, 'batch_norm': False, 'lr': 0.0003921725494749242, 'weight_decay': 2.73093320719762e-05, 'epochs': 134, 'loss': 'mse', 'optimizer': 'adam', 'graph_mode': 'off', 'use_snp_selection': False}. Best is trial 33 with value: 0.04555024989504239.
[I 2025-12-05 14:25:37,487] Trial 88 finished with value: 0.03872499623991601 and parameters: {'model_type': 'mlp', 'hidden_dims': '[512, 128]', 'dropout': 0.18756209880219207, 'batch_norm': False, 'lr': 0.0008017247851965509, 'weight_decay': 0.00024652230651068776, 'epochs': 211, 'loss': 'mse', 'optimizer': 'adam', 'graph_mode': 'off', 'use_snp_selection': True, 'num_snps': 20617}. Best is trial 33 with value: 0.04555024989504239.
[I 2025-12-05 14:25:38,552] Trial 89 finished with value: 0.0151399825572478 and parameters: {'model_type': 'mlp', 'hidden_dims': '[512, 128]', 'dropout': 0.19254253993652426, 'batch_norm': False, 'lr': 0.0007345092688403869, 'weight_decay': 0.0002828784164461957, 'epochs': 87, 'loss': 'mse', 'optimizer': 'adam', 'graph_mode': 'off', 'use_snp_selection': False}. Best is trial 33 with value: 0.04555024989504239.
[I 2025-12-05 14:25:39,998] Trial 90 finished with value: 0.0105092232562889 and parameters: {'model_type': 'mlp', 'hidden_dims': '[512, 128]', 'dropout': 0.22292000378902885, 'batch_norm': False, 'lr': 0.0009661866377960228, 'weight_decay': 7.0218259050804305e-06, 'epochs': 248, 'loss': 'mse', 'optimizer': 'adam', 'graph_mode': 'off', 'use_snp_selection': True, 'num_snps': 21106}. Best is trial 33 with value: 0.04555024989504239.
[I 2025-12-05 14:25:41,580] Trial 91 finished with value: 0.0339933875749026 and parameters: {'model_type': 'mlp', 'hidden_dims': '[512, 128]', 'dropout': 0.14457608808582845, 'batch_norm': False, 'lr': 0.0005470973163169121, 'weight_decay': 0.0002082993864536296, 'epochs': 208, 'loss': 'mse', 'optimizer': 'adam', 'graph_mode': 'off', 'use_snp_selection': True, 'num_snps': 25513}. Best is trial 33 with value: 0.04555024989504239.
[I 2025-12-05 14:25:43,347] Trial 92 finished with value: 0.004755150289777531 and parameters: {'model_type': 'mlp', 'hidden_dims': '[512, 128]', 'dropout': 0.24691777882859478, 'batch_norm': False, 'lr': 0.000487441487786636, 'weight_decay': 7.084839981513305e-05, 'epochs': 195, 'loss': 'mse', 'optimizer': 'adam', 'graph_mode': 'off', 'use_snp_selection': True, 'num_snps': 30081}. Best is trial 33 with value: 0.04555024989504239.
[I 2025-12-05 14:25:44,848] Trial 93 finished with value: 0.029877343409372353 and parameters: {'model_type': 'mlp', 'hidden_dims': '[512, 256]', 'dropout': 0.16120948038657817, 'batch_norm': False, 'lr': 0.00025824553938154083, 'weight_decay': 0.00041552836038438387, 'epochs': 214, 'loss': 'mse', 'optimizer': 'adam', 'graph_mode': 'off', 'use_snp_selection': True, 'num_snps': 23491}. Best is trial 33 with value: 0.04555024989504239.
[I 2025-12-05 14:25:46,427] Trial 94 finished with value: 0.03753655757025669 and parameters: {'model_type': 'mlp', 'hidden_dims': '[256, 128]', 'dropout': 0.1686114506682269, 'batch_norm': False, 'lr': 0.0002119765771923369, 'weight_decay': 5.304884778587726e-05, 'epochs': 234, 'loss': 'mse', 'optimizer': 'adam', 'graph_mode': 'off', 'use_snp_selection': True, 'num_snps': 25268}. Best is trial 33 with value: 0.04555024989504239.
[I 2025-12-05 14:25:47,837] Trial 95 finished with value: 0.03168086863769661 and parameters: {'model_type': 'mlp', 'hidden_dims': '[256, 128]', 'dropout': 0.20642079486145687, 'batch_norm': False, 'lr': 0.00021919933977335816, 'weight_decay': 4.9575451616385956e-05, 'epochs': 262, 'loss': 'mse', 'optimizer': 'adam', 'graph_mode': 'off', 'use_snp_selection': True, 'num_snps': 21344}. Best is trial 33 with value: 0.04555024989504239.
[I 2025-12-05 14:25:49,476] Trial 96 finished with value: 0.01366088333714508 and parameters: {'model_type': 'mlp', 'hidden_dims': '[256, 128]', 'dropout': 0.23822346842357747, 'batch_norm': False, 'lr': 0.00011480986466662242, 'weight_decay': 1.1269301117138697e-05, 'epochs': 223, 'loss': 'mse', 'optimizer': 'adam', 'graph_mode': 'off', 'use_snp_selection': True, 'num_snps': 27396}. Best is trial 33 with value: 0.04555024989504239.
[I 2025-12-05 14:25:51,080] Trial 97 finished with value: 0.018077987388137946 and parameters: {'model_type': 'mlp', 'hidden_dims': '[256, 128]', 'dropout': 0.18715021277287203, 'batch_norm': True, 'lr': 0.00031642629271223186, 'weight_decay': 3.144098226493628e-05, 'epochs': 235, 'loss': 'mse', 'optimizer': 'adam', 'graph_mode': 'off', 'use_snp_selection': True, 'num_snps': 25217}. Best is trial 33 with value: 0.04555024989504239.
[I 2025-12-05 14:25:52,444] Trial 98 finished with value: 0.027400791379801264 and parameters: {'model_type': 'mlp', 'hidden_dims': '[256, 128]', 'dropout': 0.2869916454804342, 'batch_norm': False, 'lr': 0.0001668097792887868, 'weight_decay': 1.972402616767327e-05, 'epochs': 275, 'loss': 'mse', 'optimizer': 'adam', 'graph_mode': 'off', 'use_snp_selection': True, 'num_snps': 18960}. Best is trial 33 with value: 0.04555024989504239.
[I 2025-12-05 14:25:54,107] Trial 99 finished with value: -0.01620532502361997 and parameters: {'model_type': 'mlp', 'hidden_dims': '[512, 128]', 'dropout': 0.1458705662270566, 'batch_norm': False, 'lr': 0.0008284859835758843, 'weight_decay': 5.6174278087226215e-05, 'epochs': 66, 'loss': 'mse', 'optimizer': 'adam', 'graph_mode': 'off', 'use_snp_selection': True, 'num_snps': 31475}. Best is trial 33 with value: 0.04555024989504239.
[I 2025-12-05 14:25:56,180] Trial 100 finished with value: 0.04361648508767658 and parameters: {'model_type': 'mlp', 'hidden_dims': '[256, 128, 64]', 'dropout': 0.16747215930631265, 'batch_norm': False, 'lr': 0.00014508619630670331, 'weight_decay': 2.527183409120623e-05, 'epochs': 228, 'loss': 'mse', 'optimizer': 'adam', 'graph_mode': 'off', 'use_snp_selection': True, 'num_snps': 41341}. Best is trial 33 with value: 0.04555024989504239.
