[I 2025-12-05 21:25:08,704] Trial 11 finished with value: 0.30836475257410256 and parameters: {'model_type': 'mlp', 'hidden_dims': '[512, 64]', 'dropout': 0.583942291816117, 'batch_norm': False, 'lr': 1.422933652790185e-05, 'weight_decay': 1.2045055692919657e-07, 'epochs': 213, 'loss': 'mse', 'optimizer': 'adam', 'graph_mode': 'off', 'use_snp_selection': False}. Best is trial 3 with value: 0.30968944964839273.
[I 2025-12-05 21:25:57,182] Trial 12 finished with value: 0.3084910830185036 and parameters: {'model_type': 'mlp', 'hidden_dims': '[512, 64]', 'dropout': 0.593097749012682, 'batch_norm': False, 'lr': 1.1374686318732863e-05, 'weight_decay': 1.3081036432574914e-07, 'epochs': 250, 'loss': 'mae', 'optimizer': 'adam', 'graph_mode': 'off', 'use_snp_selection': False}. Best is trial 3 with value: 0.30968944964839273.
[I 2025-12-05 21:26:51,701] Trial 13 finished with value: 0.304930733345142 and parameters: {'model_type': 'mlp', 'hidden_dims': '[512, 64]', 'dropout': 0.5043641748401543, 'batch_norm': False, 'lr': 1.262035332095525e-05, 'weight_decay': 4.80586993129494e-05, 'epochs': 285, 'loss': 'mae', 'optimizer': 'adam', 'graph_mode': 'off', 'use_snp_selection': False}. Best is trial 3 with value: 0.30968944964839273.
[I 2025-12-05 21:27:13,908] Trial 14 finished with value: 0.29550413264637343 and parameters: {'model_type': 'mlp', 'hidden_dims': '[128, 64]', 'dropout': 0.5300180653494536, 'batch_norm': False, 'lr': 5.096356034191146e-06, 'weight_decay': 3.0607358611649674e-06, 'epochs': 346, 'loss': 'mae', 'optimizer': 'adam', 'graph_mode': 'off', 'use_snp_selection': False}. Best is trial 3 with value: 0.30968944964839273.
[I 2025-12-05 21:28:03,869] Trial 15 finished with value: 0.3057489694304435 and parameters: {'model_type': 'mlp', 'hidden_dims': '[512, 256]', 'dropout': 0.29817671914947536, 'batch_norm': False, 'lr': 1.8411764708572348e-05, 'weight_decay': 1.232049712459595e-07, 'epochs': 257, 'loss': 'mae', 'optimizer': 'adam', 'graph_mode': 'off', 'use_snp_selection': False}. Best is trial 3 with value: 0.30968944964839273.
[I 2025-12-05 21:28:36,007] Trial 16 finished with value: 0.29383628964073233 and parameters: {'model_type': 'mlp', 'hidden_dims': '[256, 128, 64]', 'dropout': 0.4985027776477374, 'batch_norm': False, 'lr': 0.00017549215405955411, 'weight_decay': 9.796037636714031e-05, 'epochs': 303, 'loss': 'mae', 'optimizer': 'adam', 'graph_mode': 'off', 'use_snp_selection': False}. Best is trial 3 with value: 0.30968944964839273.
[I 2025-12-05 21:29:22,585] Trial 17 finished with value: 0.039463829896849004 and parameters: {'model_type': 'mlp', 'hidden_dims': '[512, 64]', 'dropout': 0.46956397995943144, 'batch_norm': False, 'lr': 0.000906375209920231, 'weight_decay': 6.503919561253859e-06, 'epochs': 239, 'loss': 'mae', 'optimizer': 'adam', 'graph_mode': 'off', 'use_snp_selection': False}. Best is trial 3 with value: 0.30968944964839273.
[I 2025-12-05 21:30:51,152] Trial 18 finished with value: 0.3005781576459868 and parameters: {'model_type': 'mlp', 'hidden_dims': '[512, 64]', 'dropout': 0.5468831937008775, 'batch_norm': False, 'lr': 3.329079977138569e-06, 'weight_decay': 3.5310916592806245e-07, 'epochs': 318, 'loss': 'mae', 'optimizer': 'adam', 'graph_mode': 'off', 'use_snp_selection': True, 'num_snps': 58241}. Best is trial 3 with value: 0.30968944964839273.
[I 2025-12-05 21:31:43,901] Trial 19 finished with value: 0.3008515115836484 and parameters: {'model_type': 'mlp', 'hidden_dims': '[512, 64]', 'dropout': 0.314966108518357, 'batch_norm': False, 'lr': 2.519576707011501e-05, 'weight_decay': 2.8130326038007742e-05, 'epochs': 275, 'loss': 'mae', 'optimizer': 'adam', 'graph_mode': 'off', 'use_snp_selection': False}. Best is trial 3 with value: 0.30968944964839273.
[I 2025-12-05 21:32:27,609] Trial 20 finished with value: 0.30085848109877616 and parameters: {'model_type': 'mlp', 'hidden_dims': '[512, 128]', 'dropout': 0.594798346761148, 'batch_norm': False, 'lr': 6.91107062941075e-06, 'weight_decay': 7.168217351131645e-06, 'epochs': 222, 'loss': 'mae', 'optimizer': 'adam', 'graph_mode': 'off', 'use_snp_selection': False}. Best is trial 3 with value: 0.30968944964839273.
[I 2025-12-05 21:33:09,965] Trial 21 finished with value: 0.30622185499163257 and parameters: {'model_type': 'mlp', 'hidden_dims': '[512, 64]', 'dropout': 0.5621194742996412, 'batch_norm': False, 'lr': 1.4175360854883036e-05, 'weight_decay': 1.091206403306812e-07, 'epochs': 215, 'loss': 'mse', 'optimizer': 'adam', 'graph_mode': 'off', 'use_snp_selection': False}. Best is trial 3 with value: 0.30968944964839273.
[I 2025-12-05 21:34:00,321] Trial 22 finished with value: 0.3062031662271744 and parameters: {'model_type': 'mlp', 'hidden_dims': '[512, 64]', 'dropout': 0.5954392114625428, 'batch_norm': False, 'lr': 2.9212984238335026e-06, 'weight_decay': 8.989119046731185e-07, 'epochs': 260, 'loss': 'mse', 'optimizer': 'adam', 'graph_mode': 'off', 'use_snp_selection': False}. Best is trial 3 with value: 0.30968944964839273.
[I 2025-12-05 21:34:36,082] Trial 23 finished with value: 0.3095058170758763 and parameters: {'model_type': 'mlp', 'hidden_dims': '[512, 64]', 'dropout': 0.45700288156596985, 'batch_norm': False, 'lr': 8.858195193774784e-06, 'weight_decay': 2.1721378502942493e-07, 'epochs': 176, 'loss': 'mse', 'optimizer': 'adam', 'graph_mode': 'off', 'use_snp_selection': False}. Best is trial 3 with value: 0.30968944964839273.
[I 2025-12-05 21:35:10,654] Trial 24 finished with value: 0.31165430358932245 and parameters: {'model_type': 'mlp', 'hidden_dims': '[512, 64]', 'dropout': 0.46153440048753713, 'batch_norm': False, 'lr': 8.395295804357471e-06, 'weight_decay': 2.4880589022782093e-07, 'epochs': 169, 'loss': 'mse', 'optimizer': 'adam', 'graph_mode': 'off', 'use_snp_selection': False}. Best is trial 24 with value: 0.31165430358932245.
[I 2025-12-05 21:35:45,280] Trial 25 finished with value: 0.312270583456807 and parameters: {'model_type': 'mlp', 'hidden_dims': '[512, 256]', 'dropout': 0.45614153956865355, 'batch_norm': False, 'lr': 6.125073415787728e-06, 'weight_decay': 2.7135650278957826e-07, 'epochs': 168, 'loss': 'mse', 'optimizer': 'adam', 'graph_mode': 'off', 'use_snp_selection': False}. Best is trial 25 with value: 0.312270583456807.
[I 2025-12-05 21:36:08,667] Trial 26 finished with value: 0.2589561599548499 and parameters: {'model_type': 'mlp', 'hidden_dims': '[512, 256]', 'dropout': 0.36816437632645177, 'batch_norm': False, 'lr': 5.574521828207366e-06, 'weight_decay': 9.236324340009406e-07, 'epochs': 120, 'loss': 'mse', 'optimizer': 'adam', 'graph_mode': 'off', 'use_snp_selection': True, 'num_snps': 3842}. Best is trial 25 with value: 0.312270583456807.
[I 2025-12-05 21:36:30,445] Trial 27 finished with value: 0.2840099826944868 and parameters: {'model_type': 'mlp', 'hidden_dims': '[512, 256]', 'dropout': 0.5030180829712423, 'batch_norm': False, 'lr': 2.4057936279633706e-06, 'weight_decay': 3.156696647004365e-06, 'epochs': 95, 'loss': 'mse', 'optimizer': 'adam', 'graph_mode': 'off', 'use_snp_selection': False}. Best is trial 25 with value: 0.312270583456807.
[I 2025-12-05 21:37:04,811] Trial 28 finished with value: 0.28500044155415855 and parameters: {'model_type': 'mlp', 'hidden_dims': '[512, 256]', 'dropout': 0.3254314863734792, 'batch_norm': False, 'lr': 1.053372816198497e-06, 'weight_decay': 2.905899669856459e-07, 'epochs': 167, 'loss': 'mse', 'optimizer': 'adam', 'graph_mode': 'off', 'use_snp_selection': False}. Best is trial 25 with value: 0.312270583456807.
[I 2025-12-05 21:37:33,103] Trial 29 finished with value: 0.3000878594829512 and parameters: {'model_type': 'mlp', 'hidden_dims': '[128, 64]', 'dropout': 0.25374568389265495, 'batch_norm': False, 'lr': 3.062278678938924e-05, 'weight_decay': 0.00010774073487650296, 'epochs': 128, 'loss': 'mse', 'optimizer': 'adam', 'graph_mode': 'off', 'use_snp_selection': True, 'num_snps': 19468}. Best is trial 25 with value: 0.312270583456807.
[I 2025-12-05 21:37:54,764] Trial 30 finished with value: 0.3035006315680152 and parameters: {'model_type': 'mlp', 'hidden_dims': '[256, 128]', 'dropout': 0.42226508606354, 'batch_norm': False, 'lr': 2.1580634888464615e-06, 'weight_decay': 1.6086554048019763e-06, 'epochs': 188, 'loss': 'mse', 'optimizer': 'adam', 'graph_mode': 'off', 'use_snp_selection': False}. Best is trial 25 with value: 0.312270583456807.
[I 2025-12-05 21:38:14,066] Trial 31 finished with value: 0.3025795374875606 and parameters: {'model_type': 'mlp', 'hidden_dims': '[256, 128, 64]', 'dropout': 0.4635766244150709, 'batch_norm': False, 'lr': 6.3247582528376425e-06, 'weight_decay': 2.3067680642911222e-07, 'epochs': 161, 'loss': 'mse', 'optimizer': 'adam', 'graph_mode': 'off', 'use_snp_selection': False}. Best is trial 25 with value: 0.312270583456807.
[I 2025-12-05 21:38:28,258] Trial 32 finished with value: 0.3055555200155145 and parameters: {'model_type': 'mlp', 'hidden_dims': '[128, 64]', 'dropout': 0.4387478094763146, 'batch_norm': False, 'lr': 2.2111051326345754e-05, 'weight_decay': 5.908887889133433e-07, 'epochs': 191, 'loss': 'mse', 'optimizer': 'adam', 'graph_mode': 'off', 'use_snp_selection': False}. Best is trial 25 with value: 0.312270583456807.
[I 2025-12-05 21:38:56,458] Trial 33 finished with value: 0.3133915102850672 and parameters: {'model_type': 'mlp', 'hidden_dims': '[512, 256]', 'dropout': 0.47059732260276255, 'batch_norm': False, 'lr': 9.29166437904145e-06, 'weight_decay': 2.3927010923836583e-05, 'epochs': 132, 'loss': 'mse', 'optimizer': 'adam', 'graph_mode': 'off', 'use_snp_selection': False}. Best is trial 33 with value: 0.3133915102850672.
[I 2025-12-05 21:39:24,542] Trial 34 finished with value: 0.28848653180852146 and parameters: {'model_type': 'mlp', 'hidden_dims': '[512, 256]', 'dropout': 0.5341776312410886, 'batch_norm': True, 'lr': 4.041906235787804e-06, 'weight_decay': 1.3469007483013366e-05, 'epochs': 130, 'loss': 'mse', 'optimizer': 'adam', 'graph_mode': 'off', 'use_snp_selection': False}. Best is trial 33 with value: 0.3133915102850672.
[I 2025-12-05 21:40:17,695] Trial 35 finished with value: 0.30683554891032483 and parameters: {'model_type': 'mlp', 'hidden_dims': '[512, 256]', 'dropout': 0.4825062716790201, 'batch_norm': False, 'lr': 8.723109158961934e-06, 'weight_decay': 3.777479197444609e-05, 'epochs': 95, 'loss': 'mse', 'optimizer': 'adam', 'graph_mode': 'off', 'use_snp_selection': True, 'num_snps': 57586}. Best is trial 33 with value: 0.3133915102850672.
[I 2025-12-05 21:40:35,096] Trial 36 finished with value: 0.29819863159086857 and parameters: {'model_type': 'mlp', 'hidden_dims': '[512, 256]', 'dropout': 0.4014660442260706, 'batch_norm': False, 'lr': 4.118672758171215e-05, 'weight_decay': 9.823391957772508e-05, 'epochs': 70, 'loss': 'mse', 'optimizer': 'adam', 'graph_mode': 'off', 'use_snp_selection': False}. Best is trial 33 with value: 0.3133915102850672.
[I 2025-12-05 21:41:06,963] Trial 37 finished with value: 0.27551998119519683 and parameters: {'model_type': 'mlp', 'hidden_dims': '[256, 128]', 'dropout': 0.4340807701936132, 'batch_norm': True, 'lr': 4.446294938689996e-06, 'weight_decay': 2.3411037566092015e-05, 'epochs': 143, 'loss': 'mse', 'optimizer': 'adam', 'graph_mode': 'off', 'use_snp_selection': True, 'num_snps': 22282}. Best is trial 33 with value: 0.3133915102850672.
[I 2025-12-05 21:41:31,975] Trial 38 finished with value: 0.28301694019223245 and parameters: {'model_type': 'mlp', 'hidden_dims': '[512, 256]', 'dropout': 0.36041178025196585, 'batch_norm': False, 'lr': 1.5166330036620776e-06, 'weight_decay': 7.068774448470774e-06, 'epochs': 114, 'loss': 'mse', 'optimizer': 'adam', 'graph_mode': 'off', 'use_snp_selection': False}. Best is trial 33 with value: 0.3133915102850672.
[I 2025-12-05 21:42:03,610] Trial 39 finished with value: 0.2972439760689053 and parameters: {'model_type': 'mlp', 'hidden_dims': '[512, 128]', 'dropout': 0.5280629099514725, 'batch_norm': True, 'lr': 0.00010324444906755619, 'weight_decay': 0.0003702039745093979, 'epochs': 151, 'loss': 'mse', 'optimizer': 'adam', 'graph_mode': 'off', 'use_snp_selection': False}. Best is trial 33 with value: 0.3133915102850672.
[I 2025-12-05 21:42:18,156] Trial 40 finished with value: 0.28977260075054684 and parameters: {'model_type': 'mlp', 'hidden_dims': '[256, 128, 64]', 'dropout': 0.561471949322541, 'batch_norm': False, 'lr': 1.785652718921049e-05, 'weight_decay': 7.269664285470936e-05, 'epochs': 108, 'loss': 'mse', 'optimizer': 'adam', 'graph_mode': 'off', 'use_snp_selection': False}. Best is trial 33 with value: 0.3133915102850672.
[I 2025-12-05 21:42:54,209] Trial 41 finished with value: 0.30778934615733167 and parameters: {'model_type': 'mlp', 'hidden_dims': '[512, 64]', 'dropout': 0.47395169378945484, 'batch_norm': False, 'lr': 8.880708654030429e-06, 'weight_decay': 2.1993611229359861e-07, 'epochs': 178, 'loss': 'mse', 'optimizer': 'adam', 'graph_mode': 'off', 'use_snp_selection': False}. Best is trial 33 with value: 0.3133915102850672.
[I 2025-12-05 21:43:35,095] Trial 42 finished with value: 0.30735738655680944 and parameters: {'model_type': 'mlp', 'hidden_dims': '[512, 64]', 'dropout': 0.4512621465990667, 'batch_norm': False, 'lr': 9.149945756693816e-06, 'weight_decay': 0.00020179061218468687, 'epochs': 206, 'loss': 'mse', 'optimizer': 'adam', 'graph_mode': 'off', 'use_snp_selection': False}. Best is trial 33 with value: 0.3133915102850672.
[I 2025-12-05 21:44:20,568] Trial 43 finished with value: 0.3061320323745519 and parameters: {'model_type': 'mlp', 'hidden_dims': '[512, 256]', 'dropout': 0.39963160184942104, 'batch_norm': False, 'lr': 3.324687763158029e-06, 'weight_decay': 2.02256860137804e-07, 'epochs': 230, 'loss': 'mse', 'optimizer': 'adam', 'graph_mode': 'off', 'use_snp_selection': False}. Best is trial 33 with value: 0.3133915102850672.
[I 2025-12-05 21:44:52,518] Trial 44 finished with value: 0.3087092913295696 and parameters: {'model_type': 'mlp', 'hidden_dims': '[512, 64]', 'dropout': 0.4225936303854665, 'batch_norm': False, 'lr': 7.416929716548112e-06, 'weight_decay': 4.857411837452318e-07, 'epochs': 154, 'loss': 'mse', 'optimizer': 'adam', 'graph_mode': 'off', 'use_snp_selection': False}. Best is trial 33 with value: 0.3133915102850672.
[I 2025-12-05 21:45:13,799] Trial 45 finished with value: 0.2823879768480633 and parameters: {'model_type': 'mlp', 'hidden_dims': '[256, 128]', 'dropout': 0.3823667793729495, 'batch_norm': True, 'lr': 1.2054581384033916e-05, 'weight_decay': 1.4436945775303004e-06, 'epochs': 182, 'loss': 'mse', 'optimizer': 'adam', 'graph_mode': 'off', 'use_snp_selection': False}. Best is trial 33 with value: 0.3133915102850672.
[I 2025-12-05 21:45:48,471] Trial 46 finished with value: 0.29414574720465353 and parameters: {'model_type': 'mlp', 'hidden_dims': '[512, 64]', 'dropout': 0.5136760976328608, 'batch_norm': False, 'lr': 4.802265662190421e-06, 'weight_decay': 1.174625651002402e-05, 'epochs': 170, 'loss': 'mae', 'optimizer': 'adam', 'graph_mode': 'off', 'use_snp_selection': False}. Best is trial 33 with value: 0.3133915102850672.
[I 2025-12-05 21:46:28,043] Trial 47 finished with value: 0.3082258840330329 and parameters: {'model_type': 'mlp', 'hidden_dims': '[512, 64]', 'dropout': 0.4868486245706701, 'batch_norm': False, 'lr': 2.3917778077612596e-06, 'weight_decay': 4.511468487717736e-06, 'epochs': 198, 'loss': 'mse', 'optimizer': 'adam', 'graph_mode': 'off', 'use_snp_selection': False}. Best is trial 33 with value: 0.3133915102850672.
[I 2025-12-05 21:46:57,572] Trial 48 finished with value: 0.3020303509611791 and parameters: {'model_type': 'mlp', 'hidden_dims': '[512, 128]', 'dropout': 0.4508843264473871, 'batch_norm': False, 'lr': 1.8171626636639635e-05, 'weight_decay': 1.842361605752993e-07, 'epochs': 140, 'loss': 'mae', 'optimizer': 'adam', 'graph_mode': 'off', 'use_snp_selection': False}. Best is trial 33 with value: 0.3133915102850672.
[I 2025-12-05 21:47:36,343] Trial 49 finished with value: 0.30694178966220215 and parameters: {'model_type': 'mlp', 'hidden_dims': '[128, 64]', 'dropout': 0.24027748099690846, 'batch_norm': False, 'lr': 1.09413958721935e-05, 'weight_decay': 2.3664465067352138e-05, 'epochs': 135, 'loss': 'mse', 'optimizer': 'adam', 'graph_mode': 'off', 'use_snp_selection': True, 'num_snps': 46888}. Best is trial 33 with value: 0.3133915102850672.
[I 2025-12-05 21:48:39,528] Trial 50 finished with value: 0.29866872326823 and parameters: {'model_type': 'mlp', 'hidden_dims': '[512, 256]', 'dropout': 0.3499179239991065, 'batch_norm': True, 'lr': 6.510204366328776e-06, 'weight_decay': 4.2743051996059046e-07, 'epochs': 330, 'loss': 'mae', 'optimizer': 'adam', 'graph_mode': 'off', 'use_snp_selection': False}. Best is trial 33 with value: 0.3133915102850672.
[I 2025-12-05 21:49:11,961] Trial 51 finished with value: 0.30796512504573936 and parameters: {'model_type': 'mlp', 'hidden_dims': '[512, 64]', 'dropout': 0.4202724720994747, 'batch_norm': False, 'lr': 7.1609621768721e-06, 'weight_decay': 4.923269393170799e-07, 'epochs': 156, 'loss': 'mse', 'optimizer': 'adam', 'graph_mode': 'off', 'use_snp_selection': False}. Best is trial 33 with value: 0.3133915102850672.
[I 2025-12-05 21:49:43,886] Trial 52 finished with value: 0.30960376798534306 and parameters: {'model_type': 'mlp', 'hidden_dims': '[512, 64]', 'dropout': 0.45724940309672324, 'batch_norm': False, 'lr': 8.273001840599444e-06, 'weight_decay': 1.4846011119593066e-07, 'epochs': 154, 'loss': 'mse', 'optimizer': 'adam', 'graph_mode': 'off', 'use_snp_selection': False}. Best is trial 33 with value: 0.3133915102850672.
[I 2025-12-05 21:50:18,491] Trial 53 finished with value: 0.3088752291611004 and parameters: {'model_type': 'mlp', 'hidden_dims': '[512, 64]', 'dropout': 0.5670253207587176, 'batch_norm': False, 'lr': 1.494825502140044e-05, 'weight_decay': 1.416090581383494e-07, 'epochs': 170, 'loss': 'mse', 'optimizer': 'adam', 'graph_mode': 'off', 'use_snp_selection': False}. Best is trial 33 with value: 0.3133915102850672.
[I 2025-12-05 21:50:56,380] Trial 54 finished with value: 0.30779762450257947 and parameters: {'model_type': 'mlp', 'hidden_dims': '[512, 64]', 'dropout': 0.4552283332961595, 'batch_norm': False, 'lr': 9.832184191078905e-06, 'weight_decay': 1.5890839229308065e-05, 'epochs': 189, 'loss': 'mse', 'optimizer': 'adam', 'graph_mode': 'off', 'use_snp_selection': False}. Best is trial 33 with value: 0.3133915102850672.
[I 2025-12-05 21:51:14,619] Trial 55 finished with value: 0.29062513371366727 and parameters: {'model_type': 'mlp', 'hidden_dims': '[512, 64]', 'dropout': 0.5153396283792924, 'batch_norm': False, 'lr': 4.038210721021067e-06, 'weight_decay': 2.8362610768629385e-07, 'epochs': 75, 'loss': 'mse', 'optimizer': 'adam', 'graph_mode': 'off', 'use_snp_selection': False}. Best is trial 33 with value: 0.3133915102850672.
[I 2025-12-05 21:51:54,963] Trial 56 finished with value: 0.11423371076681406 and parameters: {'model_type': 'mlp', 'hidden_dims': '[512, 64]', 'dropout': 0.48852018492482124, 'batch_norm': False, 'lr': 0.0007171669415635536, 'weight_decay': 8.288525807887541e-07, 'epochs': 203, 'loss': 'mae', 'optimizer': 'adam', 'graph_mode': 'off', 'use_snp_selection': False}. Best is trial 33 with value: 0.3133915102850672.
[I 2025-12-05 21:52:13,160] Trial 57 finished with value: 0.3049555860244375 and parameters: {'model_type': 'mlp', 'hidden_dims': '[256, 128, 64]', 'dropout': 0.5463000719016272, 'batch_norm': False, 'lr': 2.7569494225400933e-05, 'weight_decay': 3.237331108347986e-07, 'epochs': 149, 'loss': 'mse', 'optimizer': 'adam', 'graph_mode': 'off', 'use_snp_selection': False}. Best is trial 33 with value: 0.3133915102850672.
[I 2025-12-05 21:52:39,754] Trial 58 finished with value: 0.29788393761079424 and parameters: {'model_type': 'mlp', 'hidden_dims': '[512, 64]', 'dropout': 0.20660483606825308, 'batch_norm': False, 'lr': 5.438111590964651e-06, 'weight_decay': 1.7470722664148865e-07, 'epochs': 123, 'loss': 'mae', 'optimizer': 'adam', 'graph_mode': 'off', 'use_snp_selection': False}. Best is trial 33 with value: 0.3133915102850672.
[I 2025-12-05 21:53:03,265] Trial 59 finished with value: 0.2992465273927408 and parameters: {'model_type': 'mlp', 'hidden_dims': '[512, 256]', 'dropout': 0.3358244254655301, 'batch_norm': False, 'lr': 3.078150421801978e-06, 'weight_decay': 4.61723406591515e-05, 'epochs': 105, 'loss': 'mse', 'optimizer': 'adam', 'graph_mode': 'off', 'use_snp_selection': False}. Best is trial 33 with value: 0.3133915102850672.
[I 2025-12-05 21:53:26,854] Trial 60 finished with value: 0.2552102390229625 and parameters: {'model_type': 'mlp', 'hidden_dims': '[512, 64]', 'dropout': 0.4089899092286544, 'batch_norm': False, 'lr': 3.708381580035796e-05, 'weight_decay': 1.5454702485547212e-07, 'epochs': 290, 'loss': 'mse', 'optimizer': 'adam', 'graph_mode': 'off', 'use_snp_selection': True, 'num_snps': 2400}. Best is trial 33 with value: 0.3133915102850672.
[I 2025-12-05 21:54:00,602] Trial 61 finished with value: 0.30757929371136145 and parameters: {'model_type': 'mlp', 'hidden_dims': '[512, 64]', 'dropout': 0.5671600973435181, 'batch_norm': False, 'lr': 1.378096331752862e-05, 'weight_decay': 1.264400578950234e-07, 'epochs': 165, 'loss': 'mse', 'optimizer': 'adam', 'graph_mode': 'off', 'use_snp_selection': False}. Best is trial 33 with value: 0.3133915102850672.
[I 2025-12-05 21:54:34,694] Trial 62 finished with value: 0.3055327568528804 and parameters: {'model_type': 'mlp', 'hidden_dims': '[512, 64]', 'dropout': 0.5783999343442736, 'batch_norm': False, 'lr': 2.0676121926389774e-05, 'weight_decay': 1.0671621911670306e-07, 'epochs': 167, 'loss': 'mse', 'optimizer': 'adam', 'graph_mode': 'off', 'use_snp_selection': False}. Best is trial 33 with value: 0.3133915102850672.
