[I 2025-12-06 05:17:41,649] Trial 117 finished with value: 0.20170635336800613 and parameters: {'model_type': 'mlp', 'hidden_dims': '[512, 64]', 'dropout': 0.16036025552946367, 'batch_norm': False, 'lr': 3.69551524011807e-05, 'weight_decay': 9.65525397493676e-05, 'epochs': 296, 'loss': 'mae', 'optimizer': 'adam', 'graph_mode': 'off', 'use_snp_selection': True, 'num_snps': 11095}. Best is trial 108 with value: 0.22747687994382543.
[I 2025-12-06 05:17:57,924] Trial 118 finished with value: 0.20994094276531672 and parameters: {'model_type': 'mlp', 'hidden_dims': '[128, 64]', 'dropout': 0.14813684888642195, 'batch_norm': True, 'lr': 7.109592464047605e-06, 'weight_decay': 1.7088512616974598e-05, 'epochs': 154, 'loss': 'mae', 'optimizer': 'adam', 'graph_mode': 'off', 'use_snp_selection': False}. Best is trial 108 with value: 0.22747687994382543.
[I 2025-12-06 05:19:34,067] Trial 119 finished with value: 0.21524689661706087 and parameters: {'model_type': 'mlp', 'hidden_dims': '[512, 64]', 'dropout': 0.1330908490787965, 'batch_norm': True, 'lr': 3.0054103304226722e-05, 'weight_decay': 4.3353390469063614e-05, 'epochs': 341, 'loss': 'mae', 'optimizer': 'adam', 'graph_mode': 'off', 'use_snp_selection': False}. Best is trial 108 with value: 0.22747687994382543.
[I 2025-12-06 05:21:02,369] Trial 120 finished with value: 0.20419808619600954 and parameters: {'model_type': 'mlp', 'hidden_dims': '[512, 256]', 'dropout': 0.49701839079970805, 'batch_norm': True, 'lr': 1.7842143743989218e-05, 'weight_decay': 8.327997541931074e-05, 'epochs': 308, 'loss': 'mae', 'optimizer': 'adam', 'graph_mode': 'off', 'use_snp_selection': False}. Best is trial 108 with value: 0.22747687994382543.
[I 2025-12-06 05:22:29,053] Trial 121 finished with value: 0.21280432749633124 and parameters: {'model_type': 'mlp', 'hidden_dims': '[512, 64]', 'dropout': 0.18263954912475044, 'batch_norm': True, 'lr': 4.932445644301604e-05, 'weight_decay': 5.971685222179259e-05, 'epochs': 302, 'loss': 'mae', 'optimizer': 'adam', 'graph_mode': 'off', 'use_snp_selection': False}. Best is trial 108 with value: 0.22747687994382543.
[I 2025-12-06 05:24:02,091] Trial 122 finished with value: 0.20513184402184578 and parameters: {'model_type': 'mlp', 'hidden_dims': '[512, 64]', 'dropout': 0.1874885056300919, 'batch_norm': True, 'lr': 6.324768220292669e-05, 'weight_decay': 3.589722030563151e-05, 'epochs': 326, 'loss': 'mae', 'optimizer': 'adam', 'graph_mode': 'off', 'use_snp_selection': False}. Best is trial 108 with value: 0.22747687994382543.
[I 2025-12-06 05:25:24,667] Trial 123 finished with value: 0.21253663411431475 and parameters: {'model_type': 'mlp', 'hidden_dims': '[512, 64]', 'dropout': 0.20320453741928904, 'batch_norm': True, 'lr': 0.00011172611423128357, 'weight_decay': 6.95449595648956e-05, 'epochs': 287, 'loss': 'mae', 'optimizer': 'adam', 'graph_mode': 'off', 'use_snp_selection': False}. Best is trial 108 with value: 0.22747687994382543.
[I 2025-12-06 05:26:44,266] Trial 124 finished with value: 0.22760174918992035 and parameters: {'model_type': 'mlp', 'hidden_dims': '[512, 64]', 'dropout': 0.22961803751226373, 'batch_norm': True, 'lr': 4.095949316602392e-05, 'weight_decay': 5.284086655995148e-05, 'epochs': 275, 'loss': 'mae', 'optimizer': 'adam', 'graph_mode': 'off', 'use_snp_selection': False}. Best is trial 124 with value: 0.22760174918992035.
[I 2025-12-06 05:27:57,799] Trial 125 finished with value: 0.2166301443116218 and parameters: {'model_type': 'mlp', 'hidden_dims': '[512, 64]', 'dropout': 0.24161383654853463, 'batch_norm': True, 'lr': 4.204093979679662e-05, 'weight_decay': 5.005705432992303e-05, 'epochs': 252, 'loss': 'mae', 'optimizer': 'adam', 'graph_mode': 'off', 'use_snp_selection': False}. Best is trial 124 with value: 0.22760174918992035.
[I 2025-12-06 05:28:40,906] Trial 126 finished with value: 0.21654247705984253 and parameters: {'model_type': 'mlp', 'hidden_dims': '[256, 128, 64]', 'dropout': 0.23021502956562281, 'batch_norm': True, 'lr': 2.144464509914292e-05, 'weight_decay': 2.489274394140358e-05, 'epochs': 273, 'loss': 'mae', 'optimizer': 'adam', 'graph_mode': 'off', 'use_snp_selection': False}. Best is trial 124 with value: 0.22760174918992035.
[I 2025-12-06 05:29:21,730] Trial 127 finished with value: 0.2027378525699784 and parameters: {'model_type': 'mlp', 'hidden_dims': '[256, 128]', 'dropout': 0.25747602700796174, 'batch_norm': True, 'lr': 1.0126289372683727e-05, 'weight_decay': 3.0413200029894417e-05, 'epochs': 258, 'loss': 'mae', 'optimizer': 'adam', 'graph_mode': 'off', 'use_snp_selection': False}. Best is trial 124 with value: 0.22760174918992035.
[I 2025-12-06 05:30:57,478] Trial 128 finished with value: 0.2157928710825387 and parameters: {'model_type': 'mlp', 'hidden_dims': '[512, 64]', 'dropout': 0.29125875951250174, 'batch_norm': True, 'lr': 3.5115820013641406e-05, 'weight_decay': 4.06174943994419e-05, 'epochs': 337, 'loss': 'mae', 'optimizer': 'adam', 'graph_mode': 'off', 'use_snp_selection': False}. Best is trial 124 with value: 0.22760174918992035.
[I 2025-12-06 05:31:51,074] Trial 129 finished with value: 0.21175295822182044 and parameters: {'model_type': 'mlp', 'hidden_dims': '[512, 128]', 'dropout': 0.22209343163670092, 'batch_norm': False, 'lr': 2.7034059984905636e-05, 'weight_decay': 5.3844119266302226e-05, 'epochs': 180, 'loss': 'mae', 'optimizer': 'adam', 'graph_mode': 'off', 'use_snp_selection': False}. Best is trial 124 with value: 0.22760174918992035.
[I 2025-12-06 05:32:29,156] Trial 130 finished with value: 0.21830908331257043 and parameters: {'model_type': 'mlp', 'hidden_dims': '[256, 128, 64]', 'dropout': 0.12111210318271122, 'batch_norm': True, 'lr': 5.671804198933295e-05, 'weight_decay': 1.4144578093307178e-07, 'epochs': 236, 'loss': 'mae', 'optimizer': 'adam', 'graph_mode': 'off', 'use_snp_selection': False}. Best is trial 124 with value: 0.22760174918992035.
[I 2025-12-06 05:33:51,300] Trial 131 finished with value: 0.20709093530722802 and parameters: {'model_type': 'mlp', 'hidden_dims': '[512, 64]', 'dropout': 0.1936233296767038, 'batch_norm': True, 'lr': 5.1983841112915015e-05, 'weight_decay': 0.00013454772214832586, 'epochs': 285, 'loss': 'mae', 'optimizer': 'adam', 'graph_mode': 'off', 'use_snp_selection': False}. Best is trial 124 with value: 0.22760174918992035.
[I 2025-12-06 05:35:22,100] Trial 132 finished with value: 0.21938341740258363 and parameters: {'model_type': 'mlp', 'hidden_dims': '[512, 64]', 'dropout': 0.2683175077157047, 'batch_norm': True, 'lr': 3.2393092740316206e-05, 'weight_decay': 7.72384321391908e-05, 'epochs': 318, 'loss': 'mae', 'optimizer': 'adam', 'graph_mode': 'off', 'use_snp_selection': False}. Best is trial 124 with value: 0.22760174918992035.
[I 2025-12-06 05:36:52,523] Trial 133 finished with value: 0.21157659298751158 and parameters: {'model_type': 'mlp', 'hidden_dims': '[512, 64]', 'dropout': 0.26149829453640044, 'batch_norm': True, 'lr': 1.4903370806644324e-05, 'weight_decay': 7.65498085283026e-05, 'epochs': 316, 'loss': 'mae', 'optimizer': 'adam', 'graph_mode': 'off', 'use_snp_selection': False}. Best is trial 124 with value: 0.22760174918992035.
[I 2025-12-06 05:37:53,781] Trial 134 finished with value: 0.21388278818776998 and parameters: {'model_type': 'mlp', 'hidden_dims': '[512, 64]', 'dropout': 0.2484703698956127, 'batch_norm': True, 'lr': 3.277030467546762e-05, 'weight_decay': 0.00010423668524112932, 'epochs': 205, 'loss': 'mae', 'optimizer': 'adam', 'graph_mode': 'off', 'use_snp_selection': False}. Best is trial 124 with value: 0.22760174918992035.
[I 2025-12-06 05:39:31,689] Trial 135 finished with value: 0.2150829606824367 and parameters: {'model_type': 'mlp', 'hidden_dims': '[512, 64]', 'dropout': 0.21174673248153375, 'batch_norm': True, 'lr': 2.5717142354770503e-05, 'weight_decay': 4.58191205264169e-05, 'epochs': 344, 'loss': 'mae', 'optimizer': 'adam', 'graph_mode': 'off', 'use_snp_selection': False}. Best is trial 124 with value: 0.22760174918992035.
[I 2025-12-06 05:41:05,256] Trial 136 finished with value: 0.21538852842210415 and parameters: {'model_type': 'mlp', 'hidden_dims': '[512, 64]', 'dropout': 0.2687758968860261, 'batch_norm': True, 'lr': 3.9562045014578983e-05, 'weight_decay': 6.556513317417323e-05, 'epochs': 328, 'loss': 'mae', 'optimizer': 'adam', 'graph_mode': 'off', 'use_snp_selection': False}. Best is trial 124 with value: 0.22760174918992035.
[I 2025-12-06 05:42:36,413] Trial 137 finished with value: 0.2107746955754734 and parameters: {'model_type': 'mlp', 'hidden_dims': '[512, 64]', 'dropout': 0.4730473301562516, 'batch_norm': True, 'lr': 1.3091115600233833e-06, 'weight_decay': 3.2183172901020134e-05, 'epochs': 319, 'loss': 'mse', 'optimizer': 'adam', 'graph_mode': 'off', 'use_snp_selection': False}. Best is trial 124 with value: 0.22760174918992035.
[I 2025-12-06 05:43:27,976] Trial 138 finished with value: 0.1975264757606534 and parameters: {'model_type': 'mlp', 'hidden_dims': '[256, 128, 64]', 'dropout': 0.539265457296074, 'batch_norm': True, 'lr': 3.057270005298371e-05, 'weight_decay': 2.293046863158712e-05, 'epochs': 334, 'loss': 'mae', 'optimizer': 'adam', 'graph_mode': 'off', 'use_snp_selection': False}. Best is trial 124 with value: 0.22760174918992035.
[I 2025-12-06 05:44:38,754] Trial 139 finished with value: 0.20946799308899083 and parameters: {'model_type': 'mlp', 'hidden_dims': '[512, 64]', 'dropout': 0.29965979061995446, 'batch_norm': True, 'lr': 4.422758607903831e-05, 'weight_decay': 3.8167711932237964e-05, 'epochs': 311, 'loss': 'mae', 'optimizer': 'adam', 'graph_mode': 'off', 'use_snp_selection': True, 'num_snps': 26014}. Best is trial 124 with value: 0.22760174918992035.
[I 2025-12-06 05:46:09,384] Trial 140 finished with value: 0.20846973586293777 and parameters: {'model_type': 'mlp', 'hidden_dims': '[512, 64]', 'dropout': 0.14140092060464193, 'batch_norm': False, 'lr': 2.1896301271059425e-05, 'weight_decay': 0.0001685440235480157, 'epochs': 323, 'loss': 'mae', 'optimizer': 'adam', 'graph_mode': 'off', 'use_snp_selection': False}. Best is trial 124 with value: 0.22760174918992035.
[I 2025-12-06 05:47:37,164] Trial 141 finished with value: 0.2201269074388253 and parameters: {'model_type': 'mlp', 'hidden_dims': '[512, 64]', 'dropout': 0.16735741605734386, 'batch_norm': True, 'lr': 4.716399497405199e-05, 'weight_decay': 7.734280732838934e-05, 'epochs': 306, 'loss': 'mae', 'optimizer': 'adam', 'graph_mode': 'off', 'use_snp_selection': False}. Best is trial 124 with value: 0.22760174918992035.
[I 2025-12-06 05:49:04,656] Trial 142 finished with value: 0.21706782852503664 and parameters: {'model_type': 'mlp', 'hidden_dims': '[512, 64]', 'dropout': 0.15510867006263301, 'batch_norm': True, 'lr': 3.68241543558918e-05, 'weight_decay': 8.874477687413784e-05, 'epochs': 305, 'loss': 'mae', 'optimizer': 'adam', 'graph_mode': 'off', 'use_snp_selection': False}. Best is trial 124 with value: 0.22760174918992035.
[I 2025-12-06 05:50:29,246] Trial 143 finished with value: 0.20591079215895491 and parameters: {'model_type': 'mlp', 'hidden_dims': '[512, 64]', 'dropout': 0.5873924034294059, 'batch_norm': True, 'lr': 2.8582261244297193e-05, 'weight_decay': 6.921335921114197e-07, 'epochs': 294, 'loss': 'mae', 'optimizer': 'adam', 'graph_mode': 'off', 'use_snp_selection': False}. Best is trial 124 with value: 0.22760174918992035.
[I 2025-12-06 05:52:08,524] Trial 144 finished with value: 0.2160242256946013 and parameters: {'model_type': 'mlp', 'hidden_dims': '[512, 64]', 'dropout': 0.1330668325119622, 'batch_norm': True, 'lr': 7.333707227983878e-05, 'weight_decay': 5.7221721385814894e-05, 'epochs': 350, 'loss': 'mae', 'optimizer': 'adam', 'graph_mode': 'off', 'use_snp_selection': False}. Best is trial 124 with value: 0.22760174918992035.
[I 2025-12-06 05:52:40,626] Trial 145 finished with value: 0.2122099056563585 and parameters: {'model_type': 'mlp', 'hidden_dims': '[256, 128, 64]', 'dropout': 0.17571491408878362, 'batch_norm': True, 'lr': 4.482333455861191e-05, 'weight_decay': 7.04778207241516e-05, 'epochs': 191, 'loss': 'mae', 'optimizer': 'adam', 'graph_mode': 'off', 'use_snp_selection': False}. Best is trial 124 with value: 0.22760174918992035.
[I 2025-12-06 05:54:14,430] Trial 146 finished with value: 0.22431815937245095 and parameters: {'model_type': 'mlp', 'hidden_dims': '[512, 128]', 'dropout': 0.16606156203904063, 'batch_norm': True, 'lr': 1.8820975175632004e-05, 'weight_decay': 0.00010968671227613103, 'epochs': 329, 'loss': 'mae', 'optimizer': 'adam', 'graph_mode': 'off', 'use_snp_selection': False}. Best is trial 124 with value: 0.22760174918992035.
[I 2025-12-06 05:55:51,245] Trial 147 finished with value: 0.2117929315820038 and parameters: {'model_type': 'mlp', 'hidden_dims': '[512, 128]', 'dropout': 0.1645942824552898, 'batch_norm': True, 'lr': 1.700688161099032e-05, 'weight_decay': 4.66497697473174e-05, 'epochs': 340, 'loss': 'mae', 'optimizer': 'adam', 'graph_mode': 'off', 'use_snp_selection': False}. Best is trial 124 with value: 0.22760174918992035.
[I 2025-12-06 05:57:25,371] Trial 148 finished with value: 0.2153613568727355 and parameters: {'model_type': 'mlp', 'hidden_dims': '[512, 128]', 'dropout': 0.1495882300450954, 'batch_norm': True, 'lr': 1.881212132491235e-05, 'weight_decay': 0.00010714036915625986, 'epochs': 330, 'loss': 'mae', 'optimizer': 'adam', 'graph_mode': 'off', 'use_snp_selection': False}. Best is trial 124 with value: 0.22760174918992035.
[I 2025-12-06 05:58:46,017] Trial 149 finished with value: 0.18874664147987685 and parameters: {'model_type': 'mlp', 'hidden_dims': '[512, 128]', 'dropout': 0.11244251187527071, 'batch_norm': True, 'lr': 1.2387627411206671e-05, 'weight_decay': 2.8403625739809607e-05, 'epochs': 279, 'loss': 'mae', 'optimizer': 'adam', 'graph_mode': 'off', 'use_snp_selection': False}. Best is trial 124 with value: 0.22760174918992035.
[I 2025-12-06 05:59:54,991] Trial 0 finished with value: 0.1648343462509992 and parameters: {'model_type': 'mlp', 'hidden_dims': '[128, 64]', 'dropout': 0.199031432379812, 'batch_norm': True, 'lr': 1.8408544111075837e-06, 'weight_decay': 5.5136510071208614e-05, 'epochs': 336, 'loss': 'mae', 'optimizer': 'adam', 'graph_mode': 'off', 'use_snp_selection': True, 'num_snps': 43862}. Best is trial 0 with value: 0.1648343462509992.
[I 2025-12-06 06:00:34,501] Trial 1 finished with value: 0.20315118509274138 and parameters: {'model_type': 'mlp', 'hidden_dims': '[256, 128]', 'dropout': 0.4370668075331726, 'batch_norm': True, 'lr': 7.133471581159139e-05, 'weight_decay': 1.128633586803549e-05, 'epochs': 242, 'loss': 'mae', 'optimizer': 'adam', 'graph_mode': 'off', 'use_snp_selection': False}. Best is trial 1 with value: 0.20315118509274138.
[I 2025-12-06 06:01:11,004] Trial 2 finished with value: 0.14256646853640204 and parameters: {'model_type': 'mlp', 'hidden_dims': '[256, 128, 64]', 'dropout': 0.41314357415569625, 'batch_norm': False, 'lr': 3.952233718592101e-06, 'weight_decay': 0.00026754769258252603, 'epochs': 149, 'loss': 'mse', 'optimizer': 'adam', 'graph_mode': 'off', 'use_snp_selection': True, 'num_snps': 11571}. Best is trial 1 with value: 0.20315118509274138.
[I 2025-12-06 06:02:42,012] Trial 3 finished with value: 0.2077240439383361 and parameters: {'model_type': 'mlp', 'hidden_dims': '[512, 64]', 'dropout': 0.5938127374509361, 'batch_norm': False, 'lr': 5.67704586114731e-06, 'weight_decay': 2.4518087630137052e-05, 'epochs': 320, 'loss': 'mae', 'optimizer': 'adam', 'graph_mode': 'off', 'use_snp_selection': False}. Best is trial 3 with value: 0.2077240439383361.
[I 2025-12-06 06:04:05,531] Trial 4 finished with value: 0.1407280465597655 and parameters: {'model_type': 'mlp', 'hidden_dims': '[512, 128]', 'dropout': 0.25746343592134413, 'batch_norm': True, 'lr': 1.3467657668402788e-06, 'weight_decay': 0.00033087251918647806, 'epochs': 277, 'loss': 'mse', 'optimizer': 'adam', 'graph_mode': 'off', 'use_snp_selection': True, 'num_snps': 36675}. Best is trial 3 with value: 0.2077240439383361.
[I 2025-12-06 06:05:04,396] Trial 5 finished with value: 0.12857605374784561 and parameters: {'model_type': 'mlp', 'hidden_dims': '[512, 64]', 'dropout': 0.38275350994408375, 'batch_norm': True, 'lr': 1.5586664309232824e-06, 'weight_decay': 0.0008227664668621182, 'epochs': 145, 'loss': 'mae', 'optimizer': 'adam', 'graph_mode': 'off', 'use_snp_selection': True, 'num_snps': 32148}. Best is trial 3 with value: 0.2077240439383361.
[I 2025-12-06 06:05:37,128] Trial 6 finished with value: 0.19865243057741763 and parameters: {'model_type': 'mlp', 'hidden_dims': '[256, 128]', 'dropout': 0.3930109900265879, 'batch_norm': False, 'lr': 4.892964372128395e-05, 'weight_decay': 1.5809549317992182e-06, 'epochs': 199, 'loss': 'mse', 'optimizer': 'adam', 'graph_mode': 'off', 'use_snp_selection': False}. Best is trial 3 with value: 0.2077240439383361.
[I 2025-12-06 06:06:10,318] Trial 7 finished with value: 0.19532812841086708 and parameters: {'model_type': 'mlp', 'hidden_dims': '[512, 256]', 'dropout': 0.15343979219678458, 'batch_norm': True, 'lr': 6.234003099047341e-05, 'weight_decay': 3.894760610535477e-07, 'epochs': 97, 'loss': 'mse', 'optimizer': 'adam', 'graph_mode': 'off', 'use_snp_selection': False}. Best is trial 3 with value: 0.2077240439383361.
[I 2025-12-06 06:07:40,746] Trial 8 finished with value: 0.204456813196362 and parameters: {'model_type': 'mlp', 'hidden_dims': '[512, 128]', 'dropout': 0.10743001231661406, 'batch_norm': True, 'lr': 0.00023728538449271062, 'weight_decay': 1.7629071578048637e-05, 'epochs': 312, 'loss': 'mae', 'optimizer': 'adam', 'graph_mode': 'off', 'use_snp_selection': False}. Best is trial 3 with value: 0.2077240439383361.
[I 2025-12-06 06:08:34,780] Trial 9 finished with value: 0.19439207550402177 and parameters: {'model_type': 'mlp', 'hidden_dims': '[512, 64]', 'dropout': 0.14505336736221927, 'batch_norm': True, 'lr': 5.8619638388111826e-05, 'weight_decay': 6.200156172669308e-07, 'epochs': 175, 'loss': 'mse', 'optimizer': 'adam', 'graph_mode': 'off', 'use_snp_selection': False}. Best is trial 3 with value: 0.2077240439383361.
[I 2025-12-06 06:08:56,675] Trial 10 finished with value: 0.18125590681801945 and parameters: {'model_type': 'mlp', 'hidden_dims': '[512, 64]', 'dropout': 0.5885461262002587, 'batch_norm': False, 'lr': 8.769366258768696e-06, 'weight_decay': 2.78273193871783e-06, 'epochs': 55, 'loss': 'mae', 'optimizer': 'adam', 'graph_mode': 'off', 'use_snp_selection': False}. Best is trial 3 with value: 0.2077240439383361.
[I 2025-12-06 06:10:33,074] Trial 11 finished with value: 0.1889110299182267 and parameters: {'model_type': 'mlp', 'hidden_dims': '[512, 128]', 'dropout': 0.583942291816117, 'batch_norm': False, 'lr': 0.0007607980626791682, 'weight_decay': 2.11387030344014e-05, 'epochs': 346, 'loss': 'mae', 'optimizer': 'adam', 'graph_mode': 'off', 'use_snp_selection': False}. Best is trial 3 with value: 0.2077240439383361.
[I 2025-12-06 06:11:56,541] Trial 12 finished with value: 0.2063306765060179 and parameters: {'model_type': 'mlp', 'hidden_dims': '[512, 128]', 'dropout': 0.2637316882220091, 'batch_norm': False, 'lr': 0.000384886887018818, 'weight_decay': 6.23587291883057e-05, 'epochs': 294, 'loss': 'mae', 'optimizer': 'adam', 'graph_mode': 'off', 'use_snp_selection': False}. Best is trial 3 with value: 0.2077240439383361.
[I 2025-12-06 06:12:20,411] Trial 13 finished with value: 0.20562434728901632 and parameters: {'model_type': 'mlp', 'hidden_dims': '[128, 64]', 'dropout': 0.28178980110198326, 'batch_norm': False, 'lr': 1.3373175420781734e-05, 'weight_decay': 7.287276573694029e-05, 'epochs': 258, 'loss': 'mae', 'optimizer': 'adam', 'graph_mode': 'off', 'use_snp_selection': False}. Best is trial 3 with value: 0.2077240439383361.
[I 2025-12-06 06:13:05,169] Trial 14 finished with value: 0.1636054736793522 and parameters: {'model_type': 'mlp', 'hidden_dims': '[256, 128, 64]', 'dropout': 0.49945838328795056, 'batch_norm': False, 'lr': 0.000875907548496985, 'weight_decay': 1.1414924884997386e-07, 'epochs': 288, 'loss': 'mae', 'optimizer': 'adam', 'graph_mode': 'off', 'use_snp_selection': False}. Best is trial 3 with value: 0.2077240439383361.
[I 2025-12-06 06:14:12,301] Trial 15 finished with value: 0.2067425656155777 and parameters: {'model_type': 'mlp', 'hidden_dims': '[512, 256]', 'dropout': 0.3150448977110323, 'batch_norm': False, 'lr': 0.00025082177630769887, 'weight_decay': 6.682546297843178e-05, 'epochs': 231, 'loss': 'mae', 'optimizer': 'adam', 'graph_mode': 'off', 'use_snp_selection': False}. Best is trial 3 with value: 0.2077240439383361.
[I 2025-12-06 06:15:18,320] Trial 16 finished with value: 0.20112465874121638 and parameters: {'model_type': 'mlp', 'hidden_dims': '[512, 256]', 'dropout': 0.32991052690448897, 'batch_norm': False, 'lr': 2.1517090787442848e-05, 'weight_decay': 5.098763140321504e-06, 'epochs': 223, 'loss': 'mae', 'optimizer': 'adam', 'graph_mode': 'off', 'use_snp_selection': False}. Best is trial 3 with value: 0.2077240439383361.
[I 2025-12-06 06:16:18,056] Trial 17 finished with value: 0.20204116491507107 and parameters: {'model_type': 'mlp', 'hidden_dims': '[512, 256]', 'dropout': 0.49621638297688087, 'batch_norm': False, 'lr': 0.00015757341301155474, 'weight_decay': 0.0001926407929958507, 'epochs': 202, 'loss': 'mae', 'optimizer': 'adam', 'graph_mode': 'off', 'use_snp_selection': False}. Best is trial 3 with value: 0.2077240439383361.
[I 2025-12-06 06:18:05,716] Trial 18 finished with value: 0.20290694393532466 and parameters: {'model_type': 'mlp', 'hidden_dims': '[512, 256]', 'dropout': 0.48966784326139867, 'batch_norm': False, 'lr': 5.4850663591507836e-06, 'weight_decay': 3.8406508332565465e-05, 'epochs': 246, 'loss': 'mae', 'optimizer': 'adam', 'graph_mode': 'off', 'use_snp_selection': True, 'num_snps': 58241}. Best is trial 3 with value: 0.2077240439383361.
