[I 2025-12-05 15:56:25,020] Trial 144 finished with value: 0.05591967156298842 and parameters: {'model_type': 'mlp', 'hidden_dims': '[128, 64]', 'dropout': 0.22377664856328114, 'batch_norm': True, 'lr': 3.7210636502859436e-05, 'weight_decay': 6.676281642056515e-05, 'epochs': 136, 'loss': 'mae', 'optimizer': 'adam', 'graph_mode': 'off', 'use_snp_selection': True, 'num_snps': 16618}. Best is trial 71 with value: 0.07073722804276542.
[I 2025-12-05 15:56:27,481] Trial 145 finished with value: 0.02835738265626495 and parameters: {'model_type': 'mlp', 'hidden_dims': '[256, 128]', 'dropout': 0.2262073620101696, 'batch_norm': True, 'lr': 3.784838846922813e-05, 'weight_decay': 7.581783470553849e-05, 'epochs': 137, 'loss': 'mae', 'optimizer': 'adam', 'graph_mode': 'off', 'use_snp_selection': True, 'num_snps': 56374}. Best is trial 71 with value: 0.07073722804276542.
[I 2025-12-05 15:56:28,171] Trial 146 finished with value: 0.0380767883738721 and parameters: {'model_type': 'mlp', 'hidden_dims': '[128, 64]', 'dropout': 0.3489835140702593, 'batch_norm': True, 'lr': 4.826890737753001e-05, 'weight_decay': 4.679632504248418e-07, 'epochs': 111, 'loss': 'mae', 'optimizer': 'adam', 'graph_mode': 'off', 'use_snp_selection': False}. Best is trial 71 with value: 0.07073722804276542.
[I 2025-12-05 15:56:29,290] Trial 147 finished with value: 0.025236458587980664 and parameters: {'model_type': 'mlp', 'hidden_dims': '[256, 128]', 'dropout': 0.5974329447371, 'batch_norm': True, 'lr': 2.7730265995921883e-05, 'weight_decay': 6.294049675924041e-05, 'epochs': 149, 'loss': 'mae', 'optimizer': 'adam', 'graph_mode': 'off', 'use_snp_selection': True, 'num_snps': 14475}. Best is trial 71 with value: 0.07073722804276542.
[I 2025-12-05 15:56:30,470] Trial 148 finished with value: -0.01122684088061244 and parameters: {'model_type': 'mlp', 'hidden_dims': '[256, 128, 64]', 'dropout': 0.20193080606843267, 'batch_norm': True, 'lr': 2.2792001563869586e-05, 'weight_decay': 9.228511190247011e-05, 'epochs': 124, 'loss': 'mse', 'optimizer': 'adam', 'graph_mode': 'off', 'use_snp_selection': True, 'num_snps': 16715}. Best is trial 71 with value: 0.07073722804276542.
[I 2025-12-05 15:56:31,741] Trial 149 finished with value: 0.003375773254622542 and parameters: {'model_type': 'mlp', 'hidden_dims': '[512, 128]', 'dropout': 0.3087980125010185, 'batch_norm': True, 'lr': 3.145771824224328e-05, 'weight_decay': 0.00010917025397877539, 'epochs': 132, 'loss': 'mae', 'optimizer': 'adam', 'graph_mode': 'off', 'use_snp_selection': False}. Best is trial 71 with value: 0.07073722804276542.
[I 2025-12-05 15:56:34,233] Trial 0 finished with value: 0.035993006585225834 and parameters: {'model_type': 'mlp', 'hidden_dims': '[128, 64]', 'dropout': 0.199031432379812, 'batch_norm': True, 'lr': 1.8408544111075837e-06, 'weight_decay': 5.5136510071208614e-05, 'epochs': 336, 'loss': 'mae', 'optimizer': 'adam', 'graph_mode': 'off', 'use_snp_selection': True, 'num_snps': 43862}. Best is trial 0 with value: 0.035993006585225834.
[I 2025-12-05 15:56:35,730] Trial 1 finished with value: 0.08095667610460798 and parameters: {'model_type': 'mlp', 'hidden_dims': '[256, 128]', 'dropout': 0.4370668075331726, 'batch_norm': True, 'lr': 7.133471581159139e-05, 'weight_decay': 1.128633586803549e-05, 'epochs': 242, 'loss': 'mae', 'optimizer': 'adam', 'graph_mode': 'off', 'use_snp_selection': False}. Best is trial 1 with value: 0.08095667610460798.
[I 2025-12-05 15:56:37,054] Trial 2 finished with value: 0.05959388910062094 and parameters: {'model_type': 'mlp', 'hidden_dims': '[256, 128, 64]', 'dropout': 0.41314357415569625, 'batch_norm': False, 'lr': 3.952233718592101e-06, 'weight_decay': 0.00026754769258252603, 'epochs': 149, 'loss': 'mse', 'optimizer': 'adam', 'graph_mode': 'off', 'use_snp_selection': True, 'num_snps': 11571}. Best is trial 1 with value: 0.08095667610460798.
[I 2025-12-05 15:56:40,173] Trial 3 finished with value: 0.054995868237972964 and parameters: {'model_type': 'mlp', 'hidden_dims': '[512, 64]', 'dropout': 0.5938127374509361, 'batch_norm': False, 'lr': 5.67704586114731e-06, 'weight_decay': 2.4518087630137052e-05, 'epochs': 320, 'loss': 'mae', 'optimizer': 'adam', 'graph_mode': 'off', 'use_snp_selection': False}. Best is trial 1 with value: 0.08095667610460798.
[I 2025-12-05 15:56:43,292] Trial 4 finished with value: 0.03852098578429375 and parameters: {'model_type': 'mlp', 'hidden_dims': '[512, 128]', 'dropout': 0.25746343592134413, 'batch_norm': True, 'lr': 1.3467657668402788e-06, 'weight_decay': 0.00033087251918647806, 'epochs': 277, 'loss': 'mse', 'optimizer': 'adam', 'graph_mode': 'off', 'use_snp_selection': True, 'num_snps': 36675}. Best is trial 1 with value: 0.08095667610460798.
[I 2025-12-05 15:56:45,582] Trial 5 finished with value: 0.039558501643175446 and parameters: {'model_type': 'mlp', 'hidden_dims': '[512, 64]', 'dropout': 0.38275350994408375, 'batch_norm': True, 'lr': 1.5586664309232824e-06, 'weight_decay': 0.0008227664668621182, 'epochs': 145, 'loss': 'mae', 'optimizer': 'adam', 'graph_mode': 'off', 'use_snp_selection': True, 'num_snps': 32148}. Best is trial 1 with value: 0.08095667610460798.
[I 2025-12-05 15:56:46,868] Trial 6 finished with value: 0.08584733484147597 and parameters: {'model_type': 'mlp', 'hidden_dims': '[256, 128]', 'dropout': 0.3930109900265879, 'batch_norm': False, 'lr': 4.892964372128395e-05, 'weight_decay': 1.5809549317992182e-06, 'epochs': 199, 'loss': 'mse', 'optimizer': 'adam', 'graph_mode': 'off', 'use_snp_selection': False}. Best is trial 6 with value: 0.08584733484147597.
[I 2025-12-05 15:56:48,275] Trial 7 finished with value: 0.07395295245761326 and parameters: {'model_type': 'mlp', 'hidden_dims': '[512, 256]', 'dropout': 0.15343979219678458, 'batch_norm': True, 'lr': 6.234003099047341e-05, 'weight_decay': 3.894760610535477e-07, 'epochs': 97, 'loss': 'mse', 'optimizer': 'adam', 'graph_mode': 'off', 'use_snp_selection': False}. Best is trial 6 with value: 0.08584733484147597.
[I 2025-12-05 15:56:51,356] Trial 8 finished with value: 0.07440607715154024 and parameters: {'model_type': 'mlp', 'hidden_dims': '[512, 128]', 'dropout': 0.10743001231661406, 'batch_norm': True, 'lr': 0.00023728538449271062, 'weight_decay': 1.7629071578048637e-05, 'epochs': 312, 'loss': 'mae', 'optimizer': 'adam', 'graph_mode': 'off', 'use_snp_selection': False}. Best is trial 6 with value: 0.08584733484147597.
[I 2025-12-05 15:56:53,373] Trial 9 finished with value: 0.06812941365352017 and parameters: {'model_type': 'mlp', 'hidden_dims': '[512, 64]', 'dropout': 0.14505336736221927, 'batch_norm': True, 'lr': 5.8619638388111826e-05, 'weight_decay': 6.200156172669308e-07, 'epochs': 175, 'loss': 'mse', 'optimizer': 'adam', 'graph_mode': 'off', 'use_snp_selection': False}. Best is trial 6 with value: 0.08584733484147597.
[I 2025-12-05 15:56:54,121] Trial 10 finished with value: 0.0024693348063115845 and parameters: {'model_type': 'mlp', 'hidden_dims': '[256, 128]', 'dropout': 0.5267360651501256, 'batch_norm': False, 'lr': 0.00032393778075602147, 'weight_decay': 1.936962886850364e-06, 'epochs': 46, 'loss': 'mse', 'optimizer': 'adam', 'graph_mode': 'off', 'use_snp_selection': False}. Best is trial 6 with value: 0.08584733484147597.
[I 2025-12-05 15:56:55,572] Trial 11 finished with value: 0.12971328550290812 and parameters: {'model_type': 'mlp', 'hidden_dims': '[256, 128]', 'dropout': 0.4514665825009126, 'batch_norm': False, 'lr': 1.6474108386126448e-05, 'weight_decay': 3.590337640024813e-06, 'epochs': 239, 'loss': 'mae', 'optimizer': 'adam', 'graph_mode': 'off', 'use_snp_selection': False}. Best is trial 11 with value: 0.12971328550290812.
[I 2025-12-05 15:56:56,977] Trial 12 finished with value: 0.10737914306911328 and parameters: {'model_type': 'mlp', 'hidden_dims': '[256, 128]', 'dropout': 0.33506312640228997, 'batch_norm': False, 'lr': 1.3209655691727925e-05, 'weight_decay': 3.1223714224386214e-06, 'epochs': 227, 'loss': 'mae', 'optimizer': 'adam', 'graph_mode': 'off', 'use_snp_selection': False}. Best is trial 11 with value: 0.12971328550290812.
[I 2025-12-05 15:56:58,418] Trial 13 finished with value: 0.11749094876768168 and parameters: {'model_type': 'mlp', 'hidden_dims': '[256, 128]', 'dropout': 0.30281943413967993, 'batch_norm': False, 'lr': 1.3193050083253986e-05, 'weight_decay': 1.2635724518505535e-07, 'epochs': 237, 'loss': 'mae', 'optimizer': 'adam', 'graph_mode': 'off', 'use_snp_selection': False}. Best is trial 11 with value: 0.12971328550290812.
[I 2025-12-05 15:56:59,967] Trial 14 finished with value: 0.08384019612733837 and parameters: {'model_type': 'mlp', 'hidden_dims': '[256, 128]', 'dropout': 0.2931147636427303, 'batch_norm': False, 'lr': 1.3038848019201869e-05, 'weight_decay': 1.0666292410715431e-07, 'epochs': 265, 'loss': 'mae', 'optimizer': 'adam', 'graph_mode': 'off', 'use_snp_selection': False}. Best is trial 11 with value: 0.12971328550290812.
[I 2025-12-05 15:57:00,848] Trial 15 finished with value: 0.08033867271076156 and parameters: {'model_type': 'mlp', 'hidden_dims': '[128, 64]', 'dropout': 0.48263162073930665, 'batch_norm': False, 'lr': 2.261769449401969e-05, 'weight_decay': 1.181991247987921e-07, 'epochs': 200, 'loss': 'mae', 'optimizer': 'adam', 'graph_mode': 'off', 'use_snp_selection': False}. Best is trial 11 with value: 0.12971328550290812.
[I 2025-12-05 15:57:02,506] Trial 16 finished with value: 0.07944424995404559 and parameters: {'model_type': 'mlp', 'hidden_dims': '[256, 128, 64]', 'dropout': 0.31954604159045763, 'batch_norm': False, 'lr': 4.836185922202058e-06, 'weight_decay': 4.559982412961932e-06, 'epochs': 290, 'loss': 'mae', 'optimizer': 'adam', 'graph_mode': 'off', 'use_snp_selection': False}. Best is trial 11 with value: 0.12971328550290812.
[I 2025-12-05 15:57:05,006] Trial 17 finished with value: 0.08996588641026992 and parameters: {'model_type': 'mlp', 'hidden_dims': '[512, 256]', 'dropout': 0.22909827516912912, 'batch_norm': False, 'lr': 0.000906375209920231, 'weight_decay': 5.040966574720533e-07, 'epochs': 239, 'loss': 'mae', 'optimizer': 'adam', 'graph_mode': 'off', 'use_snp_selection': False}. Best is trial 11 with value: 0.12971328550290812.
[I 2025-12-05 15:57:07,813] Trial 18 finished with value: 0.0715206777732842 and parameters: {'model_type': 'mlp', 'hidden_dims': '[256, 128]', 'dropout': 0.48358025976083846, 'batch_norm': False, 'lr': 1.9672460212919806e-05, 'weight_decay': 7.197637349971628e-05, 'epochs': 111, 'loss': 'mae', 'optimizer': 'adam', 'graph_mode': 'off', 'use_snp_selection': True, 'num_snps': 58241}. Best is trial 11 with value: 0.12971328550290812.
[I 2025-12-05 15:57:09,163] Trial 19 finished with value: 0.08110471959030328 and parameters: {'model_type': 'mlp', 'hidden_dims': '[256, 128]', 'dropout': 0.5463690211280188, 'batch_norm': False, 'lr': 0.00014334793979738487, 'weight_decay': 2.4579390183246175e-07, 'epochs': 219, 'loss': 'mae', 'optimizer': 'adam', 'graph_mode': 'off', 'use_snp_selection': False}. Best is trial 11 with value: 0.12971328550290812.
[I 2025-12-05 15:57:10,338] Trial 20 finished with value: 0.05609605387554035 and parameters: {'model_type': 'mlp', 'hidden_dims': '[256, 128]', 'dropout': 0.4641704620828375, 'batch_norm': False, 'lr': 7.951283186534742e-06, 'weight_decay': 9.70318335083137e-07, 'epochs': 163, 'loss': 'mae', 'optimizer': 'adam', 'graph_mode': 'off', 'use_snp_selection': False}. Best is trial 11 with value: 0.12971328550290812.
[I 2025-12-05 15:57:11,806] Trial 21 finished with value: 0.0787631729163852 and parameters: {'model_type': 'mlp', 'hidden_dims': '[256, 128]', 'dropout': 0.3426036956588672, 'batch_norm': False, 'lr': 1.1053809257434978e-05, 'weight_decay': 4.190997596394386e-06, 'epochs': 245, 'loss': 'mae', 'optimizer': 'adam', 'graph_mode': 'off', 'use_snp_selection': False}. Best is trial 11 with value: 0.12971328550290812.
[I 2025-12-05 15:57:13,204] Trial 22 finished with value: 0.1110870940007282 and parameters: {'model_type': 'mlp', 'hidden_dims': '[256, 128]', 'dropout': 0.28972438035857384, 'batch_norm': False, 'lr': 3.1852868483515375e-05, 'weight_decay': 4.734915102093419e-06, 'epochs': 220, 'loss': 'mae', 'optimizer': 'adam', 'graph_mode': 'off', 'use_snp_selection': False}. Best is trial 11 with value: 0.12971328550290812.
[I 2025-12-05 15:57:14,745] Trial 23 finished with value: 0.10577659618690777 and parameters: {'model_type': 'mlp', 'hidden_dims': '[256, 128]', 'dropout': 0.29726844013384485, 'batch_norm': False, 'lr': 3.142913833509796e-05, 'weight_decay': 6.379502683189162e-06, 'epochs': 264, 'loss': 'mae', 'optimizer': 'adam', 'graph_mode': 'off', 'use_snp_selection': False}. Best is trial 11 with value: 0.12971328550290812.
[I 2025-12-05 15:57:15,990] Trial 24 finished with value: 0.06194689001127299 and parameters: {'model_type': 'mlp', 'hidden_dims': '[256, 128]', 'dropout': 0.26101105057190166, 'batch_norm': False, 'lr': 2.744435834672367e-06, 'weight_decay': 1.3867216483618105e-06, 'epochs': 185, 'loss': 'mae', 'optimizer': 'adam', 'graph_mode': 'off', 'use_snp_selection': False}. Best is trial 11 with value: 0.12971328550290812.
[I 2025-12-05 15:57:18,911] Trial 25 finished with value: 0.10175833136603986 and parameters: {'model_type': 'mlp', 'hidden_dims': '[512, 256]', 'dropout': 0.37969472499978774, 'batch_norm': False, 'lr': 0.00011125990818422283, 'weight_decay': 4.0138034275367464e-05, 'epochs': 297, 'loss': 'mae', 'optimizer': 'adam', 'graph_mode': 'off', 'use_snp_selection': False}. Best is trial 11 with value: 0.12971328550290812.
[I 2025-12-05 15:57:20,087] Trial 26 finished with value: 0.0540951883603585 and parameters: {'model_type': 'mlp', 'hidden_dims': '[512, 128]', 'dropout': 0.2015571580007755, 'batch_norm': False, 'lr': 3.068362029847407e-05, 'weight_decay': 9.401980319645843e-06, 'epochs': 214, 'loss': 'mae', 'optimizer': 'adam', 'graph_mode': 'off', 'use_snp_selection': True, 'num_snps': 3842}. Best is trial 11 with value: 0.12971328550290812.
[I 2025-12-05 15:57:21,616] Trial 27 finished with value: 0.09624351330151466 and parameters: {'model_type': 'mlp', 'hidden_dims': '[256, 128, 64]', 'dropout': 0.2760820615508461, 'batch_norm': False, 'lr': 1.789194266785624e-05, 'weight_decay': 2.72658051347216e-07, 'epochs': 258, 'loss': 'mae', 'optimizer': 'adam', 'graph_mode': 'off', 'use_snp_selection': False}. Best is trial 11 with value: 0.12971328550290812.
[I 2025-12-05 15:57:22,772] Trial 28 finished with value: 0.07744685585626566 and parameters: {'model_type': 'mlp', 'hidden_dims': '[128, 64]', 'dropout': 0.3603085313777098, 'batch_norm': False, 'lr': 6.805688140322742e-06, 'weight_decay': 0.00011837572117061313, 'epochs': 347, 'loss': 'mae', 'optimizer': 'adam', 'graph_mode': 'off', 'use_snp_selection': False}. Best is trial 11 with value: 0.12971328550290812.
[I 2025-12-05 15:57:24,361] Trial 29 finished with value: 0.007186548610817532 and parameters: {'model_type': 'mlp', 'hidden_dims': '[128, 64]', 'dropout': 0.2263146481889952, 'batch_norm': False, 'lr': 2.8966762461994946e-06, 'weight_decay': 2.405137320226163e-06, 'epochs': 215, 'loss': 'mae', 'optimizer': 'adam', 'graph_mode': 'off', 'use_snp_selection': True, 'num_snps': 19468}. Best is trial 11 with value: 0.12971328550290812.
[I 2025-12-05 15:57:25,967] Trial 30 finished with value: 0.08754722636856058 and parameters: {'model_type': 'mlp', 'hidden_dims': '[256, 128]', 'dropout': 0.4485007649909121, 'batch_norm': False, 'lr': 3.963645507545436e-05, 'weight_decay': 9.570296546785167e-07, 'epochs': 284, 'loss': 'mae', 'optimizer': 'adam', 'graph_mode': 'off', 'use_snp_selection': False}. Best is trial 11 with value: 0.12971328550290812.
[I 2025-12-05 15:57:27,357] Trial 31 finished with value: 0.08538722116971387 and parameters: {'model_type': 'mlp', 'hidden_dims': '[256, 128]', 'dropout': 0.3331917430031538, 'batch_norm': False, 'lr': 1.129610638660479e-05, 'weight_decay': 3.3111835171804637e-06, 'epochs': 224, 'loss': 'mae', 'optimizer': 'adam', 'graph_mode': 'off', 'use_snp_selection': False}. Best is trial 11 with value: 0.12971328550290812.
[I 2025-12-05 15:57:28,785] Trial 32 finished with value: 0.11085803962492541 and parameters: {'model_type': 'mlp', 'hidden_dims': '[256, 128]', 'dropout': 0.3169950533770708, 'batch_norm': False, 'lr': 1.4893737749589691e-05, 'weight_decay': 1.1285423278623966e-05, 'epochs': 235, 'loss': 'mae', 'optimizer': 'adam', 'graph_mode': 'off', 'use_snp_selection': False}. Best is trial 11 with value: 0.12971328550290812.
[I 2025-12-05 15:57:30,238] Trial 33 finished with value: 0.07517534173875774 and parameters: {'model_type': 'mlp', 'hidden_dims': '[256, 128]', 'dropout': 0.4214194631434034, 'batch_norm': False, 'lr': 2.135616757674849e-05, 'weight_decay': 1.23393489447477e-05, 'epochs': 242, 'loss': 'mae', 'optimizer': 'adam', 'graph_mode': 'off', 'use_snp_selection': False}. Best is trial 11 with value: 0.12971328550290812.
[I 2025-12-05 15:57:31,521] Trial 34 finished with value: 0.10699244934799873 and parameters: {'model_type': 'mlp', 'hidden_dims': '[256, 128]', 'dropout': 0.3095835674037848, 'batch_norm': False, 'lr': 8.652929890287204e-06, 'weight_decay': 2.6213764752666e-05, 'epochs': 197, 'loss': 'mae', 'optimizer': 'adam', 'graph_mode': 'off', 'use_snp_selection': False}. Best is trial 11 with value: 0.12971328550290812.
[I 2025-12-05 15:57:33,056] Trial 35 finished with value: 0.05115279257707386 and parameters: {'model_type': 'mlp', 'hidden_dims': '[256, 128]', 'dropout': 0.24986435138049415, 'batch_norm': True, 'lr': 3.024881050479685e-05, 'weight_decay': 8.270318035686954e-06, 'epochs': 252, 'loss': 'mae', 'optimizer': 'adam', 'graph_mode': 'off', 'use_snp_selection': False}. Best is trial 11 with value: 0.12971328550290812.
[I 2025-12-05 15:57:36,492] Trial 36 finished with value: 0.07663936359960118 and parameters: {'model_type': 'mlp', 'hidden_dims': '[512, 64]', 'dropout': 0.36569606035596297, 'batch_norm': False, 'lr': 8.965797288693421e-05, 'weight_decay': 1.6542260082322586e-05, 'epochs': 139, 'loss': 'mse', 'optimizer': 'adam', 'graph_mode': 'off', 'use_snp_selection': True, 'num_snps': 58661}. Best is trial 11 with value: 0.12971328550290812.
[I 2025-12-05 15:57:37,743] Trial 37 finished with value: 0.032118297073397535 and parameters: {'model_type': 'mlp', 'hidden_dims': '[256, 128, 64]', 'dropout': 0.4202360958901096, 'batch_norm': False, 'lr': 4.446294938689996e-06, 'weight_decay': 0.0001442134759670993, 'epochs': 178, 'loss': 'mae', 'optimizer': 'adam', 'graph_mode': 'off', 'use_snp_selection': False}. Best is trial 11 with value: 0.12971328550290812.
[I 2025-12-05 15:57:39,524] Trial 38 finished with value: 0.08203843274441096 and parameters: {'model_type': 'mlp', 'hidden_dims': '[256, 128]', 'dropout': 0.19476585940222219, 'batch_norm': True, 'lr': 1.546321191512704e-05, 'weight_decay': 3.349475290250644e-05, 'epochs': 315, 'loss': 'mse', 'optimizer': 'adam', 'graph_mode': 'off', 'use_snp_selection': True, 'num_snps': 19911}. Best is trial 11 with value: 0.12971328550290812.
[I 2025-12-05 15:57:42,250] Trial 39 finished with value: 0.10293589872794612 and parameters: {'model_type': 'mlp', 'hidden_dims': '[512, 128]', 'dropout': 0.593444752072398, 'batch_norm': False, 'lr': 4.148549146315588e-05, 'weight_decay': 0.000494866061743946, 'epochs': 271, 'loss': 'mae', 'optimizer': 'adam', 'graph_mode': 'off', 'use_snp_selection': False}. Best is trial 11 with value: 0.12971328550290812.
[I 2025-12-05 15:57:44,713] Trial 40 finished with value: 0.016476760320276482 and parameters: {'model_type': 'mlp', 'hidden_dims': '[512, 256]', 'dropout': 0.39604135807788127, 'batch_norm': True, 'lr': 6.38192556685651e-06, 'weight_decay': 6.748297651898713e-06, 'epochs': 231, 'loss': 'mae', 'optimizer': 'adam', 'graph_mode': 'off', 'use_snp_selection': False}. Best is trial 11 with value: 0.12971328550290812.
[I 2025-12-05 15:57:46,029] Trial 41 finished with value: 0.0994498136132914 and parameters: {'model_type': 'mlp', 'hidden_dims': '[256, 128]', 'dropout': 0.2825586803093868, 'batch_norm': False, 'lr': 1.2593927064292944e-05, 'weight_decay': 2.8344113480100644e-06, 'epochs': 205, 'loss': 'mae', 'optimizer': 'adam', 'graph_mode': 'off', 'use_snp_selection': False}. Best is trial 11 with value: 0.12971328550290812.
[I 2025-12-05 15:57:47,451] Trial 42 finished with value: 0.10676934783712981 and parameters: {'model_type': 'mlp', 'hidden_dims': '[256, 128]', 'dropout': 0.3467696211109297, 'batch_norm': False, 'lr': 2.4308867739670925e-05, 'weight_decay': 1.5417572853792975e-05, 'epochs': 226, 'loss': 'mae', 'optimizer': 'adam', 'graph_mode': 'off', 'use_snp_selection': False}. Best is trial 11 with value: 0.12971328550290812.
[I 2025-12-05 15:57:48,878] Trial 43 finished with value: 0.08994050082850033 and parameters: {'model_type': 'mlp', 'hidden_dims': '[256, 128]', 'dropout': 0.3145713865508677, 'batch_norm': False, 'lr': 9.216525147137947e-06, 'weight_decay': 1.1707650576429931e-06, 'epochs': 234, 'loss': 'mae', 'optimizer': 'adam', 'graph_mode': 'off', 'use_snp_selection': False}. Best is trial 11 with value: 0.12971328550290812.
[I 2025-12-05 15:57:50,771] Trial 44 finished with value: 0.08628225192194319 and parameters: {'model_type': 'mlp', 'hidden_dims': '[512, 64]', 'dropout': 0.32738954528982556, 'batch_norm': False, 'lr': 1.492075485677175e-05, 'weight_decay': 5.332180019452125e-06, 'epochs': 161, 'loss': 'mse', 'optimizer': 'adam', 'graph_mode': 'off', 'use_snp_selection': False}. Best is trial 11 with value: 0.12971328550290812.
[I 2025-12-05 15:57:52,022] Trial 45 finished with value: 0.04001645835687183 and parameters: {'model_type': 'mlp', 'hidden_dims': '[256, 128]', 'dropout': 0.3974303041687652, 'batch_norm': False, 'lr': 3.1335971234682417e-06, 'weight_decay': 1.910787894466096e-06, 'epochs': 187, 'loss': 'mae', 'optimizer': 'adam', 'graph_mode': 'off', 'use_snp_selection': False}. Best is trial 11 with value: 0.12971328550290812.
