[I 2025-12-05 14:47:24,249] Trial 23 finished with value: 0.07241151411912075 and parameters: {'model_type': 'mlp', 'hidden_dims': '[512, 128]', 'dropout': 0.4479565970622254, 'batch_norm': True, 'lr': 0.0001239870569445819, 'weight_decay': 5.0120379461963505e-06, 'epochs': 170, 'loss': 'mae', 'optimizer': 'adam', 'graph_mode': 'off', 'use_snp_selection': False}. Best is trial 20 with value: 0.10210523843739283.
[I 2025-12-05 14:47:25,235] Trial 24 finished with value: 0.06580879990723731 and parameters: {'model_type': 'mlp', 'hidden_dims': '[256, 128, 64]', 'dropout': 0.18237301855211313, 'batch_norm': True, 'lr': 3.585887275038824e-05, 'weight_decay': 8.853988869872034e-07, 'epochs': 126, 'loss': 'mae', 'optimizer': 'adam', 'graph_mode': 'off', 'use_snp_selection': False}. Best is trial 20 with value: 0.10210523843739283.
[I 2025-12-05 14:47:27,114] Trial 25 finished with value: 0.05589472733093943 and parameters: {'model_type': 'mlp', 'hidden_dims': '[512, 256]', 'dropout': 0.30479213177379894, 'batch_norm': True, 'lr': 6.52901522236232e-05, 'weight_decay': 2.733865889033683e-07, 'epochs': 200, 'loss': 'mae', 'optimizer': 'adam', 'graph_mode': 'off', 'use_snp_selection': False}. Best is trial 20 with value: 0.10210523843739283.
[I 2025-12-05 14:47:28,190] Trial 26 finished with value: 0.020887103406771163 and parameters: {'model_type': 'mlp', 'hidden_dims': '[128, 64]', 'dropout': 0.23465528013299208, 'batch_norm': True, 'lr': 9.41515330557756e-05, 'weight_decay': 1.622795757888081e-05, 'epochs': 232, 'loss': 'mse', 'optimizer': 'adam', 'graph_mode': 'off', 'use_snp_selection': True, 'num_snps': 3842}. Best is trial 20 with value: 0.10210523843739283.
[I 2025-12-05 14:47:29,182] Trial 27 finished with value: 0.05940275187629582 and parameters: {'model_type': 'mlp', 'hidden_dims': '[512, 64]', 'dropout': 0.5260554932000863, 'batch_norm': False, 'lr': 2.985754561963787e-05, 'weight_decay': 3.7728781986273995e-05, 'epochs': 44, 'loss': 'mae', 'optimizer': 'adam', 'graph_mode': 'off', 'use_snp_selection': False}. Best is trial 20 with value: 0.10210523843739283.
[I 2025-12-05 14:47:30,131] Trial 28 finished with value: 0.07707659865741712 and parameters: {'model_type': 'mlp', 'hidden_dims': '[256, 128]', 'dropout': 0.15347474322355525, 'batch_norm': True, 'lr': 0.00017436255186096872, 'weight_decay': 1.3909913252092776e-06, 'epochs': 117, 'loss': 'mse', 'optimizer': 'adam', 'graph_mode': 'off', 'use_snp_selection': False}. Best is trial 20 with value: 0.10210523843739283.
[I 2025-12-05 14:47:31,439] Trial 29 finished with value: 0.07883618641157489 and parameters: {'model_type': 'mlp', 'hidden_dims': '[128, 64]', 'dropout': 0.35743458784442395, 'batch_norm': True, 'lr': 0.00037716649199767173, 'weight_decay': 7.556740997596572e-05, 'epochs': 75, 'loss': 'mae', 'optimizer': 'adam', 'graph_mode': 'off', 'use_snp_selection': True, 'num_snps': 19468}. Best is trial 20 with value: 0.10210523843739283.
[I 2025-12-05 14:47:33,413] Trial 30 finished with value: 0.04789363962489803 and parameters: {'model_type': 'mlp', 'hidden_dims': '[512, 128]', 'dropout': 0.29846590681652335, 'batch_norm': True, 'lr': 9.501328241747665e-06, 'weight_decay': 6.543361634594358e-06, 'epochs': 217, 'loss': 'mae', 'optimizer': 'adam', 'graph_mode': 'off', 'use_snp_selection': False}. Best is trial 20 with value: 0.10210523843739283.
[I 2025-12-05 14:47:34,649] Trial 31 finished with value: 0.08083520546012896 and parameters: {'model_type': 'mlp', 'hidden_dims': '[256, 128]', 'dropout': 0.4426944016156372, 'batch_norm': True, 'lr': 0.00013274105840700197, 'weight_decay': 3.363094103055413e-06, 'epochs': 222, 'loss': 'mae', 'optimizer': 'adam', 'graph_mode': 'off', 'use_snp_selection': False}. Best is trial 20 with value: 0.10210523843739283.
[I 2025-12-05 14:47:35,737] Trial 32 finished with value: 0.09966073577086448 and parameters: {'model_type': 'mlp', 'hidden_dims': '[256, 128]', 'dropout': 0.4692734227314509, 'batch_norm': True, 'lr': 8.162453736102398e-05, 'weight_decay': 4.366050974737973e-06, 'epochs': 170, 'loss': 'mae', 'optimizer': 'adam', 'graph_mode': 'off', 'use_snp_selection': False}. Best is trial 20 with value: 0.10210523843739283.
[I 2025-12-05 14:47:36,810] Trial 33 finished with value: 0.10152087067594733 and parameters: {'model_type': 'mlp', 'hidden_dims': '[256, 128]', 'dropout': 0.5544032918210683, 'batch_norm': True, 'lr': 7.774617820171277e-05, 'weight_decay': 9.350348791627662e-06, 'epochs': 163, 'loss': 'mae', 'optimizer': 'adam', 'graph_mode': 'off', 'use_snp_selection': False}. Best is trial 20 with value: 0.10210523843739283.
[I 2025-12-05 14:47:37,894] Trial 34 finished with value: 0.011597167637774878 and parameters: {'model_type': 'mlp', 'hidden_dims': '[256, 128]', 'dropout': 0.570479665348044, 'batch_norm': True, 'lr': 3.491831213682078e-05, 'weight_decay': 4.673931680425398e-07, 'epochs': 167, 'loss': 'mae', 'optimizer': 'adam', 'graph_mode': 'off', 'use_snp_selection': False}. Best is trial 20 with value: 0.10210523843739283.
[I 2025-12-05 14:47:38,883] Trial 35 finished with value: 0.036839608284883044 and parameters: {'model_type': 'mlp', 'hidden_dims': '[256, 128]', 'dropout': 0.5401727567639245, 'batch_norm': False, 'lr': 8.352521439375965e-05, 'weight_decay': 2.0968664461476673e-06, 'epochs': 135, 'loss': 'mae', 'optimizer': 'adam', 'graph_mode': 'off', 'use_snp_selection': False}. Best is trial 20 with value: 0.10210523843739283.
[I 2025-12-05 14:47:41,700] Trial 36 finished with value: 0.09483868039753779 and parameters: {'model_type': 'mlp', 'hidden_dims': '[256, 128, 64]', 'dropout': 0.47737327595387524, 'batch_norm': True, 'lr': 0.00025567063757854486, 'weight_decay': 9.979681827149632e-07, 'epochs': 172, 'loss': 'mae', 'optimizer': 'adam', 'graph_mode': 'off', 'use_snp_selection': True, 'num_snps': 58661}. Best is trial 20 with value: 0.10210523843739283.
[I 2025-12-05 14:47:43,264] Trial 37 finished with value: 0.06502925222641621 and parameters: {'model_type': 'mlp', 'hidden_dims': '[512, 64]', 'dropout': 0.59184705230193, 'batch_norm': True, 'lr': 4.350549331735279e-05, 'weight_decay': 2.9865154965069446e-05, 'epochs': 145, 'loss': 'mse', 'optimizer': 'adam', 'graph_mode': 'off', 'use_snp_selection': False}. Best is trial 20 with value: 0.10210523843739283.
[I 2025-12-05 14:47:44,687] Trial 38 finished with value: 0.04503020443294019 and parameters: {'model_type': 'mlp', 'hidden_dims': '[512, 128]', 'dropout': 0.3969811707782744, 'batch_norm': False, 'lr': 2.5636704628746288e-05, 'weight_decay': 1.7035170650755268e-07, 'epochs': 103, 'loss': 'mae', 'optimizer': 'adam', 'graph_mode': 'off', 'use_snp_selection': True, 'num_snps': 19911}. Best is trial 20 with value: 0.10210523843739283.
[I 2025-12-05 14:47:45,751] Trial 39 finished with value: 0.04695020471516477 and parameters: {'model_type': 'mlp', 'hidden_dims': '[256, 128]', 'dropout': 0.5554778978044231, 'batch_norm': True, 'lr': 0.00016404177638709415, 'weight_decay': 0.0001641146975902591, 'epochs': 158, 'loss': 'mse', 'optimizer': 'adam', 'graph_mode': 'off', 'use_snp_selection': False}. Best is trial 20 with value: 0.10210523843739283.
[I 2025-12-05 14:47:46,955] Trial 40 finished with value: 0.07376619431643752 and parameters: {'model_type': 'mlp', 'hidden_dims': '[512, 64]', 'dropout': 0.4917985715146458, 'batch_norm': True, 'lr': 0.0005355631332513197, 'weight_decay': 1.4301181496976352e-05, 'epochs': 77, 'loss': 'mae', 'optimizer': 'adam', 'graph_mode': 'off', 'use_snp_selection': False}. Best is trial 20 with value: 0.10210523843739283.
[I 2025-12-05 14:47:49,651] Trial 41 finished with value: 0.06616118125862655 and parameters: {'model_type': 'mlp', 'hidden_dims': '[256, 128, 64]', 'dropout': 0.5174918419696597, 'batch_norm': True, 'lr': 0.0002589001764553669, 'weight_decay': 1.1853669434685549e-06, 'epochs': 178, 'loss': 'mae', 'optimizer': 'adam', 'graph_mode': 'off', 'use_snp_selection': True, 'num_snps': 54847}. Best is trial 20 with value: 0.10210523843739283.
[I 2025-12-05 14:47:52,124] Trial 42 finished with value: 0.07467595044797463 and parameters: {'model_type': 'mlp', 'hidden_dims': '[256, 128, 64]', 'dropout': 0.47488903392007314, 'batch_norm': True, 'lr': 6.677858446529724e-05, 'weight_decay': 5.639846151230144e-07, 'epochs': 200, 'loss': 'mae', 'optimizer': 'adam', 'graph_mode': 'off', 'use_snp_selection': True, 'num_snps': 47489}. Best is trial 20 with value: 0.10210523843739283.
[I 2025-12-05 14:47:54,402] Trial 43 finished with value: 0.07584231663240064 and parameters: {'model_type': 'mlp', 'hidden_dims': '[256, 128, 64]', 'dropout': 0.3737586647869938, 'batch_norm': True, 'lr': 0.000253685715924342, 'weight_decay': 7.213643279975927e-06, 'epochs': 156, 'loss': 'mae', 'optimizer': 'adam', 'graph_mode': 'off', 'use_snp_selection': True, 'num_snps': 44468}. Best is trial 20 with value: 0.10210523843739283.
[I 2025-12-05 14:47:56,460] Trial 44 finished with value: 0.03586518236265686 and parameters: {'model_type': 'mlp', 'hidden_dims': '[256, 128, 64]', 'dropout': 0.4156551031617657, 'batch_norm': True, 'lr': 2.471558655518794e-06, 'weight_decay': 1.0828208336713519e-06, 'epochs': 348, 'loss': 'mae', 'optimizer': 'adam', 'graph_mode': 'off', 'use_snp_selection': True, 'num_snps': 27389}. Best is trial 20 with value: 0.10210523843739283.
[I 2025-12-05 14:47:59,412] Trial 45 finished with value: 0.05938436175823877 and parameters: {'model_type': 'mlp', 'hidden_dims': '[512, 256]', 'dropout': 0.4581044676851534, 'batch_norm': True, 'lr': 8.37909415269222e-05, 'weight_decay': 2.0055229141189188e-06, 'epochs': 141, 'loss': 'mae', 'optimizer': 'adam', 'graph_mode': 'off', 'use_snp_selection': True, 'num_snps': 52160}. Best is trial 20 with value: 0.10210523843739283.
[I 2025-12-05 14:48:01,464] Trial 46 finished with value: 0.057535270623510125 and parameters: {'model_type': 'mlp', 'hidden_dims': '[256, 128]', 'dropout': 0.5136736550525554, 'batch_norm': False, 'lr': 0.00021405574742142886, 'weight_decay': 3.5169083844186863e-06, 'epochs': 172, 'loss': 'mse', 'optimizer': 'adam', 'graph_mode': 'off', 'use_snp_selection': True, 'num_snps': 38360}. Best is trial 20 with value: 0.10210523843739283.
[I 2025-12-05 14:48:03,383] Trial 47 finished with value: 0.06184349779454305 and parameters: {'model_type': 'mlp', 'hidden_dims': '[512, 128]', 'dropout': 0.5975462423407835, 'batch_norm': True, 'lr': 4.904977413260374e-05, 'weight_decay': 1.900410123019037e-07, 'epochs': 206, 'loss': 'mae', 'optimizer': 'adam', 'graph_mode': 'off', 'use_snp_selection': False}. Best is trial 20 with value: 0.10210523843739283.
[I 2025-12-05 14:48:04,545] Trial 48 finished with value: 0.05201607296861391 and parameters: {'model_type': 'mlp', 'hidden_dims': '[256, 128, 64]', 'dropout': 0.2572123919557545, 'batch_norm': True, 'lr': 0.00014294653314031547, 'weight_decay': 4.481964883739252e-06, 'epochs': 185, 'loss': 'mse', 'optimizer': 'adam', 'graph_mode': 'off', 'use_snp_selection': False}. Best is trial 20 with value: 0.10210523843739283.
[I 2025-12-05 14:48:05,325] Trial 49 finished with value: 0.06730326120734213 and parameters: {'model_type': 'mlp', 'hidden_dims': '[128, 64]', 'dropout': 0.5522945135793617, 'batch_norm': True, 'lr': 0.0003109171911436207, 'weight_decay': 8.924908778280792e-07, 'epochs': 131, 'loss': 'mae', 'optimizer': 'adam', 'graph_mode': 'off', 'use_snp_selection': False}. Best is trial 20 with value: 0.10210523843739283.
[I 2025-12-05 14:48:06,683] Trial 50 finished with value: 0.03039336802217253 and parameters: {'model_type': 'mlp', 'hidden_dims': '[512, 64]', 'dropout': 0.4953703695489874, 'batch_norm': True, 'lr': 1.3721945949274433e-05, 'weight_decay': 1.1588672225224373e-05, 'epochs': 107, 'loss': 'mae', 'optimizer': 'adam', 'graph_mode': 'off', 'use_snp_selection': False}. Best is trial 20 with value: 0.10210523843739283.
[I 2025-12-05 14:48:07,753] Trial 51 finished with value: 0.07448240845769269 and parameters: {'model_type': 'mlp', 'hidden_dims': '[256, 128]', 'dropout': 0.47167538389726155, 'batch_norm': True, 'lr': 6.878090821483192e-05, 'weight_decay': 2.5381955581338673e-05, 'epochs': 159, 'loss': 'mae', 'optimizer': 'adam', 'graph_mode': 'off', 'use_snp_selection': False}. Best is trial 20 with value: 0.10210523843739283.
[I 2025-12-05 14:48:09,083] Trial 52 finished with value: 0.07438016536401032 and parameters: {'model_type': 'mlp', 'hidden_dims': '[256, 128]', 'dropout': 0.38350386843301276, 'batch_norm': True, 'lr': 0.00011977108492154372, 'weight_decay': 8.352054281157462e-06, 'epochs': 254, 'loss': 'mae', 'optimizer': 'adam', 'graph_mode': 'off', 'use_snp_selection': False}. Best is trial 20 with value: 0.10210523843739283.
[I 2025-12-05 14:48:10,460] Trial 53 finished with value: 0.09027378085728135 and parameters: {'model_type': 'mlp', 'hidden_dims': '[256, 128]', 'dropout': 0.4231296450790735, 'batch_norm': True, 'lr': 9.069237014867131e-05, 'weight_decay': 5.128288648921087e-06, 'epochs': 272, 'loss': 'mae', 'optimizer': 'adam', 'graph_mode': 'off', 'use_snp_selection': False}. Best is trial 20 with value: 0.10210523843739283.
[I 2025-12-05 14:48:11,885] Trial 54 finished with value: 0.09341085072489166 and parameters: {'model_type': 'mlp', 'hidden_dims': '[256, 128]', 'dropout': 0.3203308304585723, 'batch_norm': True, 'lr': 4.477274123370287e-05, 'weight_decay': 2.69842411651573e-06, 'epochs': 285, 'loss': 'mse', 'optimizer': 'adam', 'graph_mode': 'off', 'use_snp_selection': False}. Best is trial 20 with value: 0.10210523843739283.
[I 2025-12-05 14:48:13,329] Trial 55 finished with value: 0.06474139788117743 and parameters: {'model_type': 'mlp', 'hidden_dims': '[256, 128]', 'dropout': 0.328587878145846, 'batch_norm': True, 'lr': 4.613245683909033e-05, 'weight_decay': 2.816773617605078e-06, 'epochs': 298, 'loss': 'mse', 'optimizer': 'adam', 'graph_mode': 'off', 'use_snp_selection': False}. Best is trial 20 with value: 0.10210523843739283.
[I 2025-12-05 14:48:15,856] Trial 56 finished with value: 0.07106683620253942 and parameters: {'model_type': 'mlp', 'hidden_dims': '[512, 128]', 'dropout': 0.2716436940867097, 'batch_norm': True, 'lr': 0.0005361807719839151, 'weight_decay': 1.829686519378582e-06, 'epochs': 313, 'loss': 'mse', 'optimizer': 'adam', 'graph_mode': 'off', 'use_snp_selection': False}. Best is trial 20 with value: 0.10210523843739283.
[I 2025-12-05 14:48:17,812] Trial 57 finished with value: 0.08331925744467304 and parameters: {'model_type': 'mlp', 'hidden_dims': '[512, 256]', 'dropout': 0.3162231326631373, 'batch_norm': True, 'lr': 3.780943318727936e-05, 'weight_decay': 7.125883019055021e-07, 'epochs': 212, 'loss': 'mse', 'optimizer': 'adam', 'graph_mode': 'off', 'use_snp_selection': False}. Best is trial 20 with value: 0.10210523843739283.
[I 2025-12-05 14:48:19,731] Trial 58 finished with value: 0.07043561728057564 and parameters: {'model_type': 'mlp', 'hidden_dims': '[512, 64]', 'dropout': 0.1926704647551926, 'batch_norm': False, 'lr': 5.717945924398783e-05, 'weight_decay': 4.1443879679137555e-07, 'epochs': 190, 'loss': 'mse', 'optimizer': 'adam', 'graph_mode': 'off', 'use_snp_selection': True, 'num_snps': 26798}. Best is trial 20 with value: 0.10210523843739283.
[I 2025-12-05 14:48:20,605] Trial 59 finished with value: 0.051249797071547115 and parameters: {'model_type': 'mlp', 'hidden_dims': '[256, 128]', 'dropout': 0.36460511732581996, 'batch_norm': True, 'lr': 2.3338682799913217e-05, 'weight_decay': 2.6443843072560784e-06, 'epochs': 85, 'loss': 'mse', 'optimizer': 'adam', 'graph_mode': 'off', 'use_snp_selection': False}. Best is trial 20 with value: 0.10210523843739283.
[I 2025-12-05 14:48:21,668] Trial 60 finished with value: 0.08865525239995004 and parameters: {'model_type': 'mlp', 'hidden_dims': '[256, 128, 64]', 'dropout': 0.1301591858428434, 'batch_norm': True, 'lr': 0.00010420759840196374, 'weight_decay': 1.2015189641836569e-06, 'epochs': 150, 'loss': 'mse', 'optimizer': 'adam', 'graph_mode': 'off', 'use_snp_selection': False}. Best is trial 20 with value: 0.10210523843739283.
[I 2025-12-05 14:48:23,108] Trial 61 finished with value: 0.07323370806407414 and parameters: {'model_type': 'mlp', 'hidden_dims': '[256, 128]', 'dropout': 0.40779169070056354, 'batch_norm': True, 'lr': 6.825762986230696e-05, 'weight_decay': 2.0355687064778315e-05, 'epochs': 295, 'loss': 'mae', 'optimizer': 'adam', 'graph_mode': 'off', 'use_snp_selection': False}. Best is trial 20 with value: 0.10210523843739283.
[I 2025-12-05 14:48:24,371] Trial 62 finished with value: 0.08872453968020148 and parameters: {'model_type': 'mlp', 'hidden_dims': '[256, 128]', 'dropout': 0.44290542259576066, 'batch_norm': True, 'lr': 0.00015996827404631748, 'weight_decay': 9.889786332123768e-06, 'epochs': 230, 'loss': 'mae', 'optimizer': 'adam', 'graph_mode': 'off', 'use_snp_selection': False}. Best is trial 20 with value: 0.10210523843739283.
[I 2025-12-05 14:48:25,685] Trial 63 finished with value: 0.05369613147220257 and parameters: {'model_type': 'mlp', 'hidden_dims': '[256, 128]', 'dropout': 0.4591003270661481, 'batch_norm': True, 'lr': 3.064789752540887e-05, 'weight_decay': 0.0006902748445006628, 'epochs': 248, 'loss': 'mae', 'optimizer': 'adam', 'graph_mode': 'off', 'use_snp_selection': False}. Best is trial 20 with value: 0.10210523843739283.
[I 2025-12-05 14:48:27,223] Trial 64 finished with value: 0.08188452602968227 and parameters: {'model_type': 'mlp', 'hidden_dims': '[256, 128]', 'dropout': 0.4000722298265387, 'batch_norm': True, 'lr': 7.917096350135372e-05, 'weight_decay': 5.3307291333948285e-06, 'epochs': 333, 'loss': 'mae', 'optimizer': 'adam', 'graph_mode': 'off', 'use_snp_selection': False}. Best is trial 20 with value: 0.10210523843739283.
[I 2025-12-05 14:48:28,981] Trial 65 finished with value: 0.06924882387711233 and parameters: {'model_type': 'mlp', 'hidden_dims': '[512, 128]', 'dropout': 0.2869666094554196, 'batch_norm': True, 'lr': 4.207955265367019e-05, 'weight_decay': 3.689901046930411e-06, 'epochs': 177, 'loss': 'mse', 'optimizer': 'adam', 'graph_mode': 'off', 'use_snp_selection': False}. Best is trial 20 with value: 0.10210523843739283.
[I 2025-12-05 14:48:29,991] Trial 66 finished with value: 0.09790874806717949 and parameters: {'model_type': 'mlp', 'hidden_dims': '[128, 64]', 'dropout': 0.21813912660325246, 'batch_norm': True, 'lr': 0.00022218096136502314, 'weight_decay': 4.2109293260396496e-05, 'epochs': 287, 'loss': 'mae', 'optimizer': 'adam', 'graph_mode': 'off', 'use_snp_selection': False}. Best is trial 20 with value: 0.10210523843739283.
[I 2025-12-05 14:48:30,837] Trial 67 finished with value: 0.08862370142807781 and parameters: {'model_type': 'mlp', 'hidden_dims': '[128, 64]', 'dropout': 0.2166937615986554, 'batch_norm': True, 'lr': 0.00020365353982156306, 'weight_decay': 5.4333782496396146e-05, 'epochs': 166, 'loss': 'mae', 'optimizer': 'adam', 'graph_mode': 'off', 'use_snp_selection': False}. Best is trial 20 with value: 0.10210523843739283.
[I 2025-12-05 14:48:31,515] Trial 68 finished with value: 0.08449383792113205 and parameters: {'model_type': 'mlp', 'hidden_dims': '[128, 64]', 'dropout': 0.1519974887923891, 'batch_norm': True, 'lr': 0.00032923991747270544, 'weight_decay': 0.00016062344225651587, 'epochs': 60, 'loss': 'mae', 'optimizer': 'adam', 'graph_mode': 'off', 'use_snp_selection': False}. Best is trial 20 with value: 0.10210523843739283.
[I 2025-12-05 14:48:34,040] Trial 69 finished with value: 0.08071088664765355 and parameters: {'model_type': 'mlp', 'hidden_dims': '[128, 64]', 'dropout': 0.24407368436267635, 'batch_norm': False, 'lr': 0.0004594919956568347, 'weight_decay': 1.6937770817728015e-06, 'epochs': 115, 'loss': 'mse', 'optimizer': 'adam', 'graph_mode': 'off', 'use_snp_selection': True, 'num_snps': 59124}. Best is trial 20 with value: 0.10210523843739283.
[I 2025-12-05 14:48:35,026] Trial 70 finished with value: 0.09440892229090252 and parameters: {'model_type': 'mlp', 'hidden_dims': '[128, 64]', 'dropout': 0.12444166450667407, 'batch_norm': True, 'lr': 0.00010669206461426053, 'weight_decay': 5.382968569562047e-07, 'epochs': 279, 'loss': 'mae', 'optimizer': 'adam', 'graph_mode': 'off', 'use_snp_selection': False}. Best is trial 20 with value: 0.10210523843739283.
[I 2025-12-05 14:48:36,039] Trial 71 finished with value: 0.06920646677756156 and parameters: {'model_type': 'mlp', 'hidden_dims': '[128, 64]', 'dropout': 0.12250427744594866, 'batch_norm': True, 'lr': 0.00011141304226157128, 'weight_decay': 2.9087477600817643e-07, 'epochs': 295, 'loss': 'mae', 'optimizer': 'adam', 'graph_mode': 'off', 'use_snp_selection': False}. Best is trial 20 with value: 0.10210523843739283.
[I 2025-12-05 14:48:37,047] Trial 72 finished with value: 0.09463320688176424 and parameters: {'model_type': 'mlp', 'hidden_dims': '[128, 64]', 'dropout': 0.15250453990497537, 'batch_norm': True, 'lr': 0.00014414515645309913, 'weight_decay': 5.532332993625823e-07, 'epochs': 282, 'loss': 'mae', 'optimizer': 'adam', 'graph_mode': 'off', 'use_snp_selection': False}. Best is trial 20 with value: 0.10210523843739283.
[I 2025-12-05 14:48:38,108] Trial 73 finished with value: 0.08074784829092446 and parameters: {'model_type': 'mlp', 'hidden_dims': '[128, 64]', 'dropout': 0.16514857714892583, 'batch_norm': True, 'lr': 0.00014343981891857724, 'weight_decay': 5.96305151004956e-07, 'epochs': 328, 'loss': 'mae', 'optimizer': 'adam', 'graph_mode': 'off', 'use_snp_selection': False}. Best is trial 20 with value: 0.10210523843739283.
[I 2025-12-05 14:48:39,076] Trial 74 finished with value: 0.09622801182475954 and parameters: {'model_type': 'mlp', 'hidden_dims': '[128, 64]', 'dropout': 0.100232432262373, 'batch_norm': True, 'lr': 0.000292337212959809, 'weight_decay': 9.269905108569552e-07, 'epochs': 265, 'loss': 'mae', 'optimizer': 'adam', 'graph_mode': 'off', 'use_snp_selection': False}. Best is trial 20 with value: 0.10210523843739283.
