[I 2025-12-06 01:00:01,251] Trial 111 finished with value: 0.26059461565316916 and parameters: {'model_type': 'mlp', 'hidden_dims': '[512, 256]', 'dropout': 0.25904559601890564, 'batch_norm': False, 'lr': 5.164334469705172e-05, 'weight_decay': 0.00011189938780631088, 'epochs': 118, 'loss': 'mse', 'optimizer': 'adam', 'graph_mode': 'off', 'use_snp_selection': True, 'num_snps': 18672}. Best is trial 37 with value: 0.26732035923459463.
[I 2025-12-06 01:00:41,508] Trial 112 finished with value: 0.2588622786058967 and parameters: {'model_type': 'mlp', 'hidden_dims': '[512, 256]', 'dropout': 0.25425684268126647, 'batch_norm': False, 'lr': 5.449146957627303e-05, 'weight_decay': 8.652557343765163e-05, 'epochs': 113, 'loss': 'mse', 'optimizer': 'adam', 'graph_mode': 'off', 'use_snp_selection': True, 'num_snps': 18474}. Best is trial 37 with value: 0.26732035923459463.
[I 2025-12-06 01:01:22,061] Trial 113 finished with value: 0.24939018743667477 and parameters: {'model_type': 'mlp', 'hidden_dims': '[512, 256]', 'dropout': 0.26199886317020477, 'batch_norm': False, 'lr': 5.128790406699076e-05, 'weight_decay': 9.924824743761954e-05, 'epochs': 119, 'loss': 'mse', 'optimizer': 'adam', 'graph_mode': 'off', 'use_snp_selection': True, 'num_snps': 18445}. Best is trial 37 with value: 0.26732035923459463.
[I 2025-12-06 01:01:57,064] Trial 114 finished with value: 0.235095368882261 and parameters: {'model_type': 'mlp', 'hidden_dims': '[512, 256]', 'dropout': 0.2514292874830689, 'batch_norm': False, 'lr': 5.861518388581454e-05, 'weight_decay': 0.00015937304800985494, 'epochs': 92, 'loss': 'mse', 'optimizer': 'adam', 'graph_mode': 'off', 'use_snp_selection': True, 'num_snps': 12885}. Best is trial 37 with value: 0.26732035923459463.
[I 2025-12-06 01:02:35,381] Trial 115 finished with value: 0.25374955445539593 and parameters: {'model_type': 'mlp', 'hidden_dims': '[512, 256]', 'dropout': 0.27700517847654615, 'batch_norm': False, 'lr': 3.721688869951183e-05, 'weight_decay': 7.426806637897326e-05, 'epochs': 112, 'loss': 'mse', 'optimizer': 'adam', 'graph_mode': 'off', 'use_snp_selection': True, 'num_snps': 15978}. Best is trial 37 with value: 0.26732035923459463.
[I 2025-12-06 01:03:12,060] Trial 116 finished with value: 0.248175377745485 and parameters: {'model_type': 'mlp', 'hidden_dims': '[512, 256]', 'dropout': 0.23168469616520845, 'batch_norm': False, 'lr': 4.1548986428603625e-05, 'weight_decay': 0.00012119437056857892, 'epochs': 103, 'loss': 'mse', 'optimizer': 'adam', 'graph_mode': 'off', 'use_snp_selection': True, 'num_snps': 14758}. Best is trial 37 with value: 0.26732035923459463.
[I 2025-12-06 01:03:52,545] Trial 117 finished with value: 0.25589687223351987 and parameters: {'model_type': 'mlp', 'hidden_dims': '[512, 256]', 'dropout': 0.2876800739401974, 'batch_norm': False, 'lr': 4.5370209165198156e-05, 'weight_decay': 0.00022071402896982887, 'epochs': 126, 'loss': 'mse', 'optimizer': 'adam', 'graph_mode': 'off', 'use_snp_selection': True, 'num_snps': 18405}. Best is trial 37 with value: 0.26732035923459463.
[I 2025-12-06 01:04:37,808] Trial 118 finished with value: 0.2521079089297704 and parameters: {'model_type': 'mlp', 'hidden_dims': '[512, 256]', 'dropout': 0.2575497358804839, 'batch_norm': False, 'lr': 2.5788757542873172e-05, 'weight_decay': 8.351549642027555e-05, 'epochs': 147, 'loss': 'mse', 'optimizer': 'adam', 'graph_mode': 'off', 'use_snp_selection': True, 'num_snps': 22386}. Best is trial 37 with value: 0.26732035923459463.
[I 2025-12-06 01:05:17,286] Trial 119 finished with value: 0.25009987438926073 and parameters: {'model_type': 'mlp', 'hidden_dims': '[512, 256]', 'dropout': 0.3032116068960019, 'batch_norm': False, 'lr': 0.0005072245103502624, 'weight_decay': 0.00010605283629533105, 'epochs': 131, 'loss': 'mse', 'optimizer': 'adam', 'graph_mode': 'off', 'use_snp_selection': True, 'num_snps': 16932}. Best is trial 37 with value: 0.26732035923459463.
[I 2025-12-06 01:05:57,896] Trial 120 finished with value: 0.2570243246105698 and parameters: {'model_type': 'mlp', 'hidden_dims': '[512, 256]', 'dropout': 0.21770620150134157, 'batch_norm': False, 'lr': 0.00011133181766487677, 'weight_decay': 4.9742429295739276e-05, 'epochs': 117, 'loss': 'mse', 'optimizer': 'adam', 'graph_mode': 'off', 'use_snp_selection': True, 'num_snps': 19150}. Best is trial 37 with value: 0.26732035923459463.
[I 2025-12-06 01:06:38,575] Trial 121 finished with value: 0.25600651993434353 and parameters: {'model_type': 'mlp', 'hidden_dims': '[512, 256]', 'dropout': 0.232339136904548, 'batch_norm': False, 'lr': 0.00010240757683557407, 'weight_decay': 4.769250470206978e-05, 'epochs': 116, 'loss': 'mse', 'optimizer': 'adam', 'graph_mode': 'off', 'use_snp_selection': True, 'num_snps': 19255}. Best is trial 37 with value: 0.26732035923459463.
[I 2025-12-06 01:07:40,411] Trial 122 finished with value: 0.23935786380051732 and parameters: {'model_type': 'mlp', 'hidden_dims': '[512, 256]', 'dropout': 0.21622017536882226, 'batch_norm': False, 'lr': 0.00012509998018103724, 'weight_decay': 3.182816142271132e-05, 'epochs': 109, 'loss': 'mse', 'optimizer': 'adam', 'graph_mode': 'off', 'use_snp_selection': True, 'num_snps': 49735}. Best is trial 37 with value: 0.26732035923459463.
[I 2025-12-06 01:08:20,727] Trial 123 finished with value: 0.2536978915798662 and parameters: {'model_type': 'mlp', 'hidden_dims': '[512, 256]', 'dropout': 0.19229975635852004, 'batch_norm': False, 'lr': 8.323980258572856e-05, 'weight_decay': 0.0001493351870441705, 'epochs': 121, 'loss': 'mse', 'optimizer': 'adam', 'graph_mode': 'off', 'use_snp_selection': True, 'num_snps': 17927}. Best is trial 37 with value: 0.26732035923459463.
[I 2025-12-06 01:09:04,112] Trial 124 finished with value: 0.25158429837060964 and parameters: {'model_type': 'mlp', 'hidden_dims': '[512, 256]', 'dropout': 0.27356468389292843, 'batch_norm': False, 'lr': 0.00016918667022459733, 'weight_decay': 5.727309450521865e-05, 'epochs': 134, 'loss': 'mse', 'optimizer': 'adam', 'graph_mode': 'off', 'use_snp_selection': True, 'num_snps': 20834}. Best is trial 37 with value: 0.26732035923459463.
[I 2025-12-06 01:09:42,173] Trial 125 finished with value: 0.24363516587651984 and parameters: {'model_type': 'mlp', 'hidden_dims': '[512, 256]', 'dropout': 0.22012759988033923, 'batch_norm': False, 'lr': 6.22378686680702e-05, 'weight_decay': 6.269662607530523e-05, 'epochs': 126, 'loss': 'mse', 'optimizer': 'adam', 'graph_mode': 'off', 'use_snp_selection': True, 'num_snps': 15047}. Best is trial 37 with value: 0.26732035923459463.
[I 2025-12-06 01:10:24,212] Trial 126 finished with value: 0.25210564576667627 and parameters: {'model_type': 'mlp', 'hidden_dims': '[512, 128]', 'dropout': 0.24609022159281727, 'batch_norm': False, 'lr': 3.0020244941415025e-05, 'weight_decay': 0.0003152478448255589, 'epochs': 97, 'loss': 'mse', 'optimizer': 'adam', 'graph_mode': 'off', 'use_snp_selection': True, 'num_snps': 23020}. Best is trial 37 with value: 0.26732035923459463.
[I 2025-12-06 01:11:04,840] Trial 127 finished with value: 0.24608959597748087 and parameters: {'model_type': 'mlp', 'hidden_dims': '[512, 256]', 'dropout': 0.1792777892315254, 'batch_norm': False, 'lr': 5.1947043348834026e-05, 'weight_decay': 0.00018190281439152186, 'epochs': 114, 'loss': 'mse', 'optimizer': 'adam', 'graph_mode': 'off', 'use_snp_selection': True, 'num_snps': 19161}. Best is trial 37 with value: 0.26732035923459463.
[I 2025-12-06 01:11:42,638] Trial 128 finished with value: 0.21267329828194076 and parameters: {'model_type': 'mlp', 'hidden_dims': '[512, 256]', 'dropout': 0.37539085708218184, 'batch_norm': True, 'lr': 3.5681345345438504e-05, 'weight_decay': 3.844007914227995e-05, 'epochs': 147, 'loss': 'mse', 'optimizer': 'adam', 'graph_mode': 'off', 'use_snp_selection': True, 'num_snps': 13171}. Best is trial 37 with value: 0.26732035923459463.
[I 2025-12-06 01:12:19,063] Trial 129 finished with value: 0.24723395122613567 and parameters: {'model_type': 'mlp', 'hidden_dims': '[512, 256]', 'dropout': 0.32054396619192654, 'batch_norm': False, 'lr': 7.109096572370956e-05, 'weight_decay': 2.550865628681407e-05, 'epochs': 78, 'loss': 'mse', 'optimizer': 'adam', 'graph_mode': 'off', 'use_snp_selection': True, 'num_snps': 17154}. Best is trial 37 with value: 0.26732035923459463.
[I 2025-12-06 01:12:54,375] Trial 130 finished with value: 0.25215571611031445 and parameters: {'model_type': 'mlp', 'hidden_dims': '[128, 64]', 'dropout': 0.28388365635514906, 'batch_norm': False, 'lr': 4.3443695221802406e-05, 'weight_decay': 4.2892593570962905e-05, 'epochs': 120, 'loss': 'mse', 'optimizer': 'adam', 'graph_mode': 'off', 'use_snp_selection': True, 'num_snps': 21280}. Best is trial 37 with value: 0.26732035923459463.
[I 2025-12-06 01:13:41,043] Trial 131 finished with value: 0.250851430301564 and parameters: {'model_type': 'mlp', 'hidden_dims': '[512, 256]', 'dropout': 0.4036735131311839, 'batch_norm': False, 'lr': 0.00021516741255484385, 'weight_decay': 0.00012348658408409206, 'epochs': 186, 'loss': 'mse', 'optimizer': 'adam', 'graph_mode': 'off', 'use_snp_selection': True, 'num_snps': 20679}. Best is trial 37 with value: 0.26732035923459463.
[I 2025-12-06 01:14:24,036] Trial 132 finished with value: 0.2522757716361469 and parameters: {'model_type': 'mlp', 'hidden_dims': '[512, 256]', 'dropout': 0.36438061188183307, 'batch_norm': False, 'lr': 1.5277804585912326e-05, 'weight_decay': 9.259009446179816e-05, 'epochs': 141, 'loss': 'mse', 'optimizer': 'adam', 'graph_mode': 'off', 'use_snp_selection': True, 'num_snps': 20088}. Best is trial 37 with value: 0.26732035923459463.
[I 2025-12-06 01:15:10,001] Trial 133 finished with value: 0.255015079429967 and parameters: {'model_type': 'mlp', 'hidden_dims': '[512, 256]', 'dropout': 0.34455332116702947, 'batch_norm': False, 'lr': 1.9325495765725136e-05, 'weight_decay': 0.00022504622220475724, 'epochs': 156, 'loss': 'mse', 'optimizer': 'adam', 'graph_mode': 'off', 'use_snp_selection': True, 'num_snps': 22168}. Best is trial 37 with value: 0.26732035923459463.
[I 2025-12-06 01:15:54,014] Trial 134 finished with value: 0.24878362079756378 and parameters: {'model_type': 'mlp', 'hidden_dims': '[512, 256]', 'dropout': 0.23886460971090376, 'batch_norm': False, 'lr': 2.6954791959514074e-05, 'weight_decay': 7.133381368658618e-05, 'epochs': 106, 'loss': 'mse', 'optimizer': 'adam', 'graph_mode': 'off', 'use_snp_selection': True, 'num_snps': 25027}. Best is trial 37 with value: 0.26732035923459463.
[I 2025-12-06 01:16:42,639] Trial 135 finished with value: 0.26686743934230706 and parameters: {'model_type': 'mlp', 'hidden_dims': '[512, 64]', 'dropout': 0.38351962139634427, 'batch_norm': False, 'lr': 3.285347684372692e-05, 'weight_decay': 3.384602002497737e-05, 'epochs': 240, 'loss': 'mse', 'optimizer': 'adam', 'graph_mode': 'off', 'use_snp_selection': True, 'num_snps': 18927}. Best is trial 37 with value: 0.26732035923459463.
[I 2025-12-06 01:17:20,024] Trial 136 finished with value: 0.2374490620376974 and parameters: {'model_type': 'mlp', 'hidden_dims': '[512, 64]', 'dropout': 0.19657665386006007, 'batch_norm': False, 'lr': 3.134834693088804e-05, 'weight_decay': 2.9171998406014136e-05, 'epochs': 127, 'loss': 'mse', 'optimizer': 'adam', 'graph_mode': 'off', 'use_snp_selection': False}. Best is trial 37 with value: 0.26732035923459463.
[I 2025-12-06 01:18:07,722] Trial 137 finished with value: 0.25683724792002405 and parameters: {'model_type': 'mlp', 'hidden_dims': '[512, 64]', 'dropout': 0.38885688456033124, 'batch_norm': False, 'lr': 3.716351467191969e-05, 'weight_decay': 3.5015661728778255e-05, 'epochs': 270, 'loss': 'mse', 'optimizer': 'adam', 'graph_mode': 'off', 'use_snp_selection': True, 'num_snps': 16166}. Best is trial 37 with value: 0.26732035923459463.
[I 2025-12-06 01:18:49,434] Trial 138 finished with value: 0.2585082060136926 and parameters: {'model_type': 'mlp', 'hidden_dims': '[512, 64]', 'dropout': 0.26782538963228253, 'batch_norm': False, 'lr': 4.951027351377469e-05, 'weight_decay': 1.9742022598617596e-05, 'epochs': 134, 'loss': 'mse', 'optimizer': 'adam', 'graph_mode': 'off', 'use_snp_selection': True, 'num_snps': 19060}. Best is trial 37 with value: 0.26732035923459463.
[I 2025-12-06 01:19:29,000] Trial 139 finished with value: 0.2540494132443901 and parameters: {'model_type': 'mlp', 'hidden_dims': '[512, 64]', 'dropout': 0.4112586929109988, 'batch_norm': False, 'lr': 4.719314739366761e-05, 'weight_decay': 1.900260399324562e-05, 'epochs': 133, 'loss': 'mae', 'optimizer': 'adam', 'graph_mode': 'off', 'use_snp_selection': True, 'num_snps': 16739}. Best is trial 37 with value: 0.26732035923459463.
[I 2025-12-06 01:20:12,897] Trial 140 finished with value: 0.24908117339498198 and parameters: {'model_type': 'mlp', 'hidden_dims': '[512, 64]', 'dropout': 0.11146871999672953, 'batch_norm': False, 'lr': 2.179952978063687e-05, 'weight_decay': 1.1729618359381624e-05, 'epochs': 244, 'loss': 'mse', 'optimizer': 'adam', 'graph_mode': 'off', 'use_snp_selection': True, 'num_snps': 14309}. Best is trial 37 with value: 0.26732035923459463.
[I 2025-12-06 01:21:05,103] Trial 141 finished with value: 0.25388223388472475 and parameters: {'model_type': 'mlp', 'hidden_dims': '[512, 64]', 'dropout': 0.2678126362818775, 'batch_norm': False, 'lr': 5.580639016903158e-05, 'weight_decay': 5.139378007097951e-05, 'epochs': 290, 'loss': 'mse', 'optimizer': 'adam', 'graph_mode': 'off', 'use_snp_selection': True, 'num_snps': 18985}. Best is trial 37 with value: 0.26732035923459463.
[I 2025-12-06 01:21:46,857] Trial 142 finished with value: 0.25444205394610636 and parameters: {'model_type': 'mlp', 'hidden_dims': '[512, 64]', 'dropout': 0.2606971432200676, 'batch_norm': False, 'lr': 3.948880976737467e-05, 'weight_decay': 2.212806396938961e-05, 'epochs': 149, 'loss': 'mse', 'optimizer': 'adam', 'graph_mode': 'off', 'use_snp_selection': True, 'num_snps': 17387}. Best is trial 37 with value: 0.26732035923459463.
[I 2025-12-06 01:22:35,893] Trial 143 finished with value: 0.2679350268088468 and parameters: {'model_type': 'mlp', 'hidden_dims': '[512, 64]', 'dropout': 0.38001191188668615, 'batch_norm': False, 'lr': 3.2796357187803e-05, 'weight_decay': 3.369908824571828e-05, 'epochs': 256, 'loss': 'mse', 'optimizer': 'adam', 'graph_mode': 'off', 'use_snp_selection': True, 'num_snps': 18200}. Best is trial 143 with value: 0.2679350268088468.
[I 2025-12-06 01:23:17,084] Trial 144 finished with value: 0.2552008739779189 and parameters: {'model_type': 'mlp', 'hidden_dims': '[512, 64]', 'dropout': 0.3719750802622407, 'batch_norm': False, 'lr': 3.4200727719709225e-05, 'weight_decay': 1.6306738402775803e-05, 'epochs': 138, 'loss': 'mse', 'optimizer': 'adam', 'graph_mode': 'off', 'use_snp_selection': True, 'num_snps': 18013}. Best is trial 143 with value: 0.2679350268088468.
[I 2025-12-06 01:24:08,468] Trial 145 finished with value: 0.24923690706877305 and parameters: {'model_type': 'mlp', 'hidden_dims': '[512, 64]', 'dropout': 0.35694267288608655, 'batch_norm': False, 'lr': 2.5172022729116802e-05, 'weight_decay': 3.095828848928064e-05, 'epochs': 252, 'loss': 'mse', 'optimizer': 'adam', 'graph_mode': 'off', 'use_snp_selection': True, 'num_snps': 20047}. Best is trial 143 with value: 0.2679350268088468.
[I 2025-12-06 01:24:53,519] Trial 146 finished with value: 0.24707743277205158 and parameters: {'model_type': 'mlp', 'hidden_dims': '[512, 64]', 'dropout': 0.3850151034751625, 'batch_norm': False, 'lr': 4.908980120599525e-05, 'weight_decay': 0.00029772299965343695, 'epochs': 254, 'loss': 'mse', 'optimizer': 'adam', 'graph_mode': 'off', 'use_snp_selection': True, 'num_snps': 15201}. Best is trial 143 with value: 0.2679350268088468.
[I 2025-12-06 01:25:41,035] Trial 147 finished with value: 0.24963432396049517 and parameters: {'model_type': 'mlp', 'hidden_dims': '[512, 64]', 'dropout': 0.3018959034772441, 'batch_norm': False, 'lr': 2.8490719435926377e-05, 'weight_decay': 2.452358438621759e-05, 'epochs': 159, 'loss': 'mse', 'optimizer': 'adam', 'graph_mode': 'off', 'use_snp_selection': True, 'num_snps': 23907}. Best is trial 143 with value: 0.2679350268088468.
[I 2025-12-06 01:26:16,234] Trial 148 finished with value: 0.2351985139771831 and parameters: {'model_type': 'mlp', 'hidden_dims': '[512, 64]', 'dropout': 0.1423344500972714, 'batch_norm': False, 'lr': 6.176780805133395e-05, 'weight_decay': 0.00015947408023720663, 'epochs': 145, 'loss': 'mse', 'optimizer': 'adam', 'graph_mode': 'off', 'use_snp_selection': True, 'num_snps': 10612}. Best is trial 143 with value: 0.2679350268088468.
[I 2025-12-06 01:27:29,155] Trial 149 finished with value: 0.23278182467466194 and parameters: {'model_type': 'mlp', 'hidden_dims': '[512, 128]', 'dropout': 0.32185193144645813, 'batch_norm': True, 'lr': 4.1848815772028145e-05, 'weight_decay': 4.230330959288022e-05, 'epochs': 264, 'loss': 'mse', 'optimizer': 'adam', 'graph_mode': 'off', 'use_snp_selection': True, 'num_snps': 35867}. Best is trial 143 with value: 0.2679350268088468.
[I 2025-12-06 01:28:20,394] Trial 0 finished with value: 0.20306144477287655 and parameters: {'model_type': 'mlp', 'hidden_dims': '[128, 64]', 'dropout': 0.199031432379812, 'batch_norm': True, 'lr': 1.8408544111075837e-06, 'weight_decay': 5.5136510071208614e-05, 'epochs': 336, 'loss': 'mae', 'optimizer': 'adam', 'graph_mode': 'off', 'use_snp_selection': True, 'num_snps': 43862}. Best is trial 0 with value: 0.20306144477287655.
[I 2025-12-06 01:28:51,102] Trial 1 finished with value: 0.2084023458455686 and parameters: {'model_type': 'mlp', 'hidden_dims': '[256, 128]', 'dropout': 0.4370668075331726, 'batch_norm': True, 'lr': 7.133471581159139e-05, 'weight_decay': 1.128633586803549e-05, 'epochs': 242, 'loss': 'mae', 'optimizer': 'adam', 'graph_mode': 'off', 'use_snp_selection': False}. Best is trial 1 with value: 0.2084023458455686.
[I 2025-12-06 01:29:18,945] Trial 2 finished with value: 0.17173178488897453 and parameters: {'model_type': 'mlp', 'hidden_dims': '[256, 128, 64]', 'dropout': 0.41314357415569625, 'batch_norm': False, 'lr': 3.952233718592101e-06, 'weight_decay': 0.00026754769258252603, 'epochs': 149, 'loss': 'mse', 'optimizer': 'adam', 'graph_mode': 'off', 'use_snp_selection': True, 'num_snps': 11571}. Best is trial 1 with value: 0.2084023458455686.
[I 2025-12-06 01:30:30,272] Trial 3 finished with value: 0.21638559535495677 and parameters: {'model_type': 'mlp', 'hidden_dims': '[512, 64]', 'dropout': 0.5938127374509361, 'batch_norm': False, 'lr': 5.67704586114731e-06, 'weight_decay': 2.4518087630137052e-05, 'epochs': 320, 'loss': 'mae', 'optimizer': 'adam', 'graph_mode': 'off', 'use_snp_selection': False}. Best is trial 3 with value: 0.21638559535495677.
[I 2025-12-06 01:31:34,579] Trial 4 finished with value: 0.18477809145355242 and parameters: {'model_type': 'mlp', 'hidden_dims': '[512, 128]', 'dropout': 0.25746343592134413, 'batch_norm': True, 'lr': 1.3467657668402788e-06, 'weight_decay': 0.00033087251918647806, 'epochs': 277, 'loss': 'mse', 'optimizer': 'adam', 'graph_mode': 'off', 'use_snp_selection': True, 'num_snps': 36675}. Best is trial 3 with value: 0.21638559535495677.
[I 2025-12-06 01:32:19,882] Trial 5 finished with value: 0.16854056621571006 and parameters: {'model_type': 'mlp', 'hidden_dims': '[512, 64]', 'dropout': 0.38275350994408375, 'batch_norm': True, 'lr': 1.5586664309232824e-06, 'weight_decay': 0.0008227664668621182, 'epochs': 145, 'loss': 'mae', 'optimizer': 'adam', 'graph_mode': 'off', 'use_snp_selection': True, 'num_snps': 32148}. Best is trial 3 with value: 0.21638559535495677.
[I 2025-12-06 01:32:45,589] Trial 6 finished with value: 0.20800544495273887 and parameters: {'model_type': 'mlp', 'hidden_dims': '[256, 128]', 'dropout': 0.3930109900265879, 'batch_norm': False, 'lr': 4.892964372128395e-05, 'weight_decay': 1.5809549317992182e-06, 'epochs': 199, 'loss': 'mse', 'optimizer': 'adam', 'graph_mode': 'off', 'use_snp_selection': False}. Best is trial 3 with value: 0.21638559535495677.
[I 2025-12-06 01:33:12,005] Trial 7 finished with value: 0.21073626214025185 and parameters: {'model_type': 'mlp', 'hidden_dims': '[512, 256]', 'dropout': 0.15343979219678458, 'batch_norm': True, 'lr': 6.234003099047341e-05, 'weight_decay': 3.894760610535477e-07, 'epochs': 97, 'loss': 'mse', 'optimizer': 'adam', 'graph_mode': 'off', 'use_snp_selection': False}. Best is trial 3 with value: 0.21638559535495677.
[I 2025-12-06 01:34:22,955] Trial 8 finished with value: 0.20847219458145289 and parameters: {'model_type': 'mlp', 'hidden_dims': '[512, 128]', 'dropout': 0.10743001231661406, 'batch_norm': True, 'lr': 0.00023728538449271062, 'weight_decay': 1.7629071578048637e-05, 'epochs': 312, 'loss': 'mae', 'optimizer': 'adam', 'graph_mode': 'off', 'use_snp_selection': False}. Best is trial 3 with value: 0.21638559535495677.
[I 2025-12-06 01:35:05,640] Trial 9 finished with value: 0.2120143956914713 and parameters: {'model_type': 'mlp', 'hidden_dims': '[512, 64]', 'dropout': 0.14505336736221927, 'batch_norm': True, 'lr': 5.8619638388111826e-05, 'weight_decay': 6.200156172669308e-07, 'epochs': 175, 'loss': 'mse', 'optimizer': 'adam', 'graph_mode': 'off', 'use_snp_selection': False}. Best is trial 3 with value: 0.21638559535495677.
[I 2025-12-06 01:35:23,380] Trial 10 finished with value: 0.20723398104473575 and parameters: {'model_type': 'mlp', 'hidden_dims': '[512, 64]', 'dropout': 0.5885461262002587, 'batch_norm': False, 'lr': 8.769366258768696e-06, 'weight_decay': 2.78273193871783e-06, 'epochs': 55, 'loss': 'mae', 'optimizer': 'adam', 'graph_mode': 'off', 'use_snp_selection': False}. Best is trial 3 with value: 0.21638559535495677.
