[I 2025-12-05 15:06:34,738] Trial 42 finished with value: 0.04937300662978735 and parameters: {'model_type': 'mlp', 'hidden_dims': '[512, 256]', 'dropout': 0.3147314402704772, 'batch_norm': True, 'lr': 0.00039037331028445656, 'weight_decay': 1.0319268479137975e-07, 'epochs': 348, 'loss': 'mse', 'optimizer': 'adam', 'graph_mode': 'off', 'use_snp_selection': False}. Best is trial 19 with value: 0.06757389302384245.
[I 2025-12-05 15:06:35,645] Trial 43 finished with value: 0.05941181633664767 and parameters: {'model_type': 'mlp', 'hidden_dims': '[512, 256]', 'dropout': 0.244002528450195, 'batch_norm': True, 'lr': 0.0005958225114656695, 'weight_decay': 1.575761006147244e-07, 'epochs': 53, 'loss': 'mse', 'optimizer': 'adam', 'graph_mode': 'off', 'use_snp_selection': False}. Best is trial 19 with value: 0.06757389302384245.
[I 2025-12-05 15:06:36,544] Trial 44 finished with value: 0.05266713722196421 and parameters: {'model_type': 'mlp', 'hidden_dims': '[512, 256]', 'dropout': 0.17093816551235222, 'batch_norm': True, 'lr': 0.0005501006837217938, 'weight_decay': 4.5531687865811864e-07, 'epochs': 54, 'loss': 'mse', 'optimizer': 'adam', 'graph_mode': 'off', 'use_snp_selection': False}. Best is trial 19 with value: 0.06757389302384245.
[I 2025-12-05 15:06:37,213] Trial 45 finished with value: 0.04796853493160737 and parameters: {'model_type': 'mlp', 'hidden_dims': '[256, 128]', 'dropout': 0.23711298754656426, 'batch_norm': True, 'lr': 0.00028324681602048964, 'weight_decay': 9.126528409694215e-07, 'epochs': 40, 'loss': 'mse', 'optimizer': 'adam', 'graph_mode': 'off', 'use_snp_selection': False}. Best is trial 19 with value: 0.06757389302384245.
[I 2025-12-05 15:06:38,171] Trial 46 finished with value: -0.029282911238297477 and parameters: {'model_type': 'mlp', 'hidden_dims': '[512, 256]', 'dropout': 0.3390653452624705, 'batch_norm': False, 'lr': 0.000988255510330907, 'weight_decay': 2.140669802398178e-06, 'epochs': 75, 'loss': 'mse', 'optimizer': 'adam', 'graph_mode': 'off', 'use_snp_selection': False}. Best is trial 19 with value: 0.06757389302384245.
[I 2025-12-05 15:06:39,222] Trial 47 finished with value: 0.03622805724353468 and parameters: {'model_type': 'mlp', 'hidden_dims': '[512, 256]', 'dropout': 0.1209774128196194, 'batch_norm': True, 'lr': 0.00021768970809360146, 'weight_decay': 1.0323876001426363e-05, 'epochs': 106, 'loss': 'mse', 'optimizer': 'adam', 'graph_mode': 'off', 'use_snp_selection': False}. Best is trial 19 with value: 0.06757389302384245.
[I 2025-12-05 15:06:40,096] Trial 48 finished with value: 0.006074572495582682 and parameters: {'model_type': 'mlp', 'hidden_dims': '[512, 128]', 'dropout': 0.21367583398842652, 'batch_norm': True, 'lr': 1.1170552432785515e-06, 'weight_decay': 1.7592276030959952e-07, 'epochs': 56, 'loss': 'mse', 'optimizer': 'adam', 'graph_mode': 'off', 'use_snp_selection': False}. Best is trial 19 with value: 0.06757389302384245.
[I 2025-12-05 15:06:42,190] Trial 49 finished with value: 0.05249118199471603 and parameters: {'model_type': 'mlp', 'hidden_dims': '[512, 256]', 'dropout': 0.36167318450128966, 'batch_norm': True, 'lr': 0.00044172441605952776, 'weight_decay': 4.4203391731511046e-07, 'epochs': 70, 'loss': 'mse', 'optimizer': 'adam', 'graph_mode': 'off', 'use_snp_selection': True, 'num_snps': 46888}. Best is trial 19 with value: 0.06757389302384245.
[I 2025-12-05 15:06:43,010] Trial 50 finished with value: 0.03009284399067398 and parameters: {'model_type': 'mlp', 'hidden_dims': '[128, 64]', 'dropout': 0.24678338654193582, 'batch_norm': True, 'lr': 0.00016294498136968332, 'weight_decay': 2.8302342532213556e-06, 'epochs': 210, 'loss': 'mse', 'optimizer': 'adam', 'graph_mode': 'off', 'use_snp_selection': False}. Best is trial 19 with value: 0.06757389302384245.
[I 2025-12-05 15:06:44,032] Trial 51 finished with value: 0.05068780496719126 and parameters: {'model_type': 'mlp', 'hidden_dims': '[512, 256]', 'dropout': 0.30662751579742326, 'batch_norm': True, 'lr': 0.00071016249461313, 'weight_decay': 1.5381178368524434e-07, 'epochs': 97, 'loss': 'mse', 'optimizer': 'adam', 'graph_mode': 'off', 'use_snp_selection': False}. Best is trial 19 with value: 0.06757389302384245.
[I 2025-12-05 15:06:45,057] Trial 52 finished with value: 0.045564075974648094 and parameters: {'model_type': 'mlp', 'hidden_dims': '[512, 256]', 'dropout': 0.2958415030486126, 'batch_norm': True, 'lr': 0.0006171976404356833, 'weight_decay': 1.1446452591146896e-07, 'epochs': 83, 'loss': 'mse', 'optimizer': 'adam', 'graph_mode': 'off', 'use_snp_selection': False}. Best is trial 19 with value: 0.06757389302384245.
[I 2025-12-05 15:06:46,234] Trial 53 finished with value: 0.049315215535926986 and parameters: {'model_type': 'mlp', 'hidden_dims': '[512, 256]', 'dropout': 0.2033583111737578, 'batch_norm': True, 'lr': 0.0003632704648014508, 'weight_decay': 0.0007871230623739149, 'epochs': 126, 'loss': 'mse', 'optimizer': 'adam', 'graph_mode': 'off', 'use_snp_selection': False}. Best is trial 19 with value: 0.06757389302384245.
[I 2025-12-05 15:06:47,116] Trial 54 finished with value: 0.027312622438359614 and parameters: {'model_type': 'mlp', 'hidden_dims': '[512, 256]', 'dropout': 0.31981688761838145, 'batch_norm': True, 'lr': 0.0008173942127406064, 'weight_decay': 2.602088680797751e-07, 'epochs': 46, 'loss': 'mse', 'optimizer': 'adam', 'graph_mode': 'off', 'use_snp_selection': False}. Best is trial 19 with value: 0.06757389302384245.
[I 2025-12-05 15:06:48,022] Trial 55 finished with value: 0.016909529781180273 and parameters: {'model_type': 'mlp', 'hidden_dims': '[256, 128, 64]', 'dropout': 0.27496312304805465, 'batch_norm': True, 'lr': 1.92404829247017e-05, 'weight_decay': 8.789796105468439e-07, 'epochs': 155, 'loss': 'mse', 'optimizer': 'adam', 'graph_mode': 'off', 'use_snp_selection': False}. Best is trial 19 with value: 0.06757389302384245.
[I 2025-12-05 15:06:49,587] Trial 56 finished with value: 0.041033993535571876 and parameters: {'model_type': 'mlp', 'hidden_dims': '[512, 256]', 'dropout': 0.1440677783101293, 'batch_norm': True, 'lr': 0.0004694915619846846, 'weight_decay': 2.1622153135330907e-07, 'epochs': 248, 'loss': 'mse', 'optimizer': 'adam', 'graph_mode': 'off', 'use_snp_selection': False}. Best is trial 19 with value: 0.06757389302384245.
[I 2025-12-05 15:06:50,629] Trial 57 finished with value: 0.05551469348737965 and parameters: {'model_type': 'mlp', 'hidden_dims': '[512, 64]', 'dropout': 0.40548673238616295, 'batch_norm': False, 'lr': 0.00027001207264173315, 'weight_decay': 3.5760377732395004e-07, 'epochs': 105, 'loss': 'mse', 'optimizer': 'adam', 'graph_mode': 'off', 'use_snp_selection': False}. Best is trial 19 with value: 0.06757389302384245.
[I 2025-12-05 15:06:51,708] Trial 58 finished with value: 0.0069162844296153875 and parameters: {'model_type': 'mlp', 'hidden_dims': '[512, 64]', 'dropout': 0.40228275019692983, 'batch_norm': False, 'lr': 0.0002872368918512772, 'weight_decay': 4.2949467828979977e-07, 'epochs': 116, 'loss': 'mae', 'optimizer': 'adam', 'graph_mode': 'off', 'use_snp_selection': False}. Best is trial 19 with value: 0.06757389302384245.
[I 2025-12-05 15:06:52,854] Trial 59 finished with value: 0.04571564450333292 and parameters: {'model_type': 'mlp', 'hidden_dims': '[512, 64]', 'dropout': 0.1771825505223273, 'batch_norm': False, 'lr': 9.915926444034234e-05, 'weight_decay': 1.4203657642774682e-06, 'epochs': 136, 'loss': 'mse', 'optimizer': 'adam', 'graph_mode': 'off', 'use_snp_selection': False}. Best is trial 19 with value: 0.06757389302384245.
[I 2025-12-05 15:06:54,157] Trial 60 finished with value: 0.018101188026142516 and parameters: {'model_type': 'mlp', 'hidden_dims': '[512, 64]', 'dropout': 0.3727461475815432, 'batch_norm': False, 'lr': 5.457099733884696e-05, 'weight_decay': 2.9337199812300775e-07, 'epochs': 68, 'loss': 'mse', 'optimizer': 'adam', 'graph_mode': 'off', 'use_snp_selection': True, 'num_snps': 24139}. Best is trial 19 with value: 0.06757389302384245.
[I 2025-12-05 15:06:55,249] Trial 61 finished with value: 0.05641228866435751 and parameters: {'model_type': 'mlp', 'hidden_dims': '[512, 64]', 'dropout': 0.3375049037388426, 'batch_norm': False, 'lr': 3.6012025195937744e-05, 'weight_decay': 1.363536719989495e-07, 'epochs': 105, 'loss': 'mse', 'optimizer': 'adam', 'graph_mode': 'off', 'use_snp_selection': False}. Best is trial 19 with value: 0.06757389302384245.
[I 2025-12-05 15:06:56,329] Trial 62 finished with value: 0.05474183593092863 and parameters: {'model_type': 'mlp', 'hidden_dims': '[512, 64]', 'dropout': 0.4273011316012388, 'batch_norm': False, 'lr': 3.126828857595114e-05, 'weight_decay': 1.4636163899022425e-07, 'epochs': 100, 'loss': 'mse', 'optimizer': 'adam', 'graph_mode': 'off', 'use_snp_selection': False}. Best is trial 19 with value: 0.06757389302384245.
[I 2025-12-05 15:06:57,417] Trial 63 finished with value: 0.009287611030623111 and parameters: {'model_type': 'mlp', 'hidden_dims': '[512, 64]', 'dropout': 0.4614802403474547, 'batch_norm': False, 'lr': 3.676449676606778e-05, 'weight_decay': 1.4937135578759607e-07, 'epochs': 102, 'loss': 'mse', 'optimizer': 'adam', 'graph_mode': 'off', 'use_snp_selection': False}. Best is trial 19 with value: 0.06757389302384245.
[I 2025-12-05 15:06:58,616] Trial 64 finished with value: 0.06673562058141395 and parameters: {'model_type': 'mlp', 'hidden_dims': '[512, 64]', 'dropout': 0.41863797135047304, 'batch_norm': False, 'lr': 2.656253907066665e-05, 'weight_decay': 1.355406531166076e-07, 'epochs': 140, 'loss': 'mse', 'optimizer': 'adam', 'graph_mode': 'off', 'use_snp_selection': False}. Best is trial 19 with value: 0.06757389302384245.
[I 2025-12-05 15:06:59,802] Trial 65 finished with value: 0.052524630012029914 and parameters: {'model_type': 'mlp', 'hidden_dims': '[512, 64]', 'dropout': 0.4056553434413169, 'batch_norm': False, 'lr': 1.225220983952449e-05, 'weight_decay': 2.3267147049700946e-07, 'epochs': 139, 'loss': 'mse', 'optimizer': 'adam', 'graph_mode': 'off', 'use_snp_selection': False}. Best is trial 19 with value: 0.06757389302384245.
[I 2025-12-05 15:07:00,889] Trial 66 finished with value: 0.032130997123964146 and parameters: {'model_type': 'mlp', 'hidden_dims': '[512, 64]', 'dropout': 0.389880933768503, 'batch_norm': False, 'lr': 1.683271453542922e-05, 'weight_decay': 1.2697365916041345e-07, 'epochs': 118, 'loss': 'mse', 'optimizer': 'adam', 'graph_mode': 'off', 'use_snp_selection': False}. Best is trial 19 with value: 0.06757389302384245.
[I 2025-12-05 15:07:02,136] Trial 67 finished with value: 0.0465675099951384 and parameters: {'model_type': 'mlp', 'hidden_dims': '[512, 64]', 'dropout': 0.34011862723275993, 'batch_norm': False, 'lr': 6.270191208415454e-05, 'weight_decay': 1.0026291031959321e-07, 'epochs': 164, 'loss': 'mse', 'optimizer': 'adam', 'graph_mode': 'off', 'use_snp_selection': False}. Best is trial 19 with value: 0.06757389302384245.
[I 2025-12-05 15:07:03,030] Trial 68 finished with value: 0.018614317481026522 and parameters: {'model_type': 'mlp', 'hidden_dims': '[512, 64]', 'dropout': 0.46546589590122034, 'batch_norm': False, 'lr': 9.107531356504733e-06, 'weight_decay': 1.7024156459235408e-05, 'epochs': 61, 'loss': 'mse', 'optimizer': 'adam', 'graph_mode': 'off', 'use_snp_selection': False}. Best is trial 19 with value: 0.06757389302384245.
[I 2025-12-05 15:07:04,147] Trial 69 finished with value: 0.030477652535039843 and parameters: {'model_type': 'mlp', 'hidden_dims': '[512, 64]', 'dropout': 0.10581166303183756, 'batch_norm': False, 'lr': 2.631735624448703e-05, 'weight_decay': 3.398234131177942e-07, 'epochs': 126, 'loss': 'mae', 'optimizer': 'adam', 'graph_mode': 'off', 'use_snp_selection': False}. Best is trial 19 with value: 0.06757389302384245.
[I 2025-12-05 15:07:05,060] Trial 70 finished with value: 0.04176620386155224 and parameters: {'model_type': 'mlp', 'hidden_dims': '[256, 128]', 'dropout': 0.42024020614100016, 'batch_norm': False, 'lr': 3.729748251237841e-05, 'weight_decay': 7.194350296172256e-06, 'epochs': 188, 'loss': 'mse', 'optimizer': 'adam', 'graph_mode': 'off', 'use_snp_selection': False}. Best is trial 19 with value: 0.06757389302384245.
[I 2025-12-05 15:07:06,152] Trial 71 finished with value: 0.032740142459229224 and parameters: {'model_type': 'mlp', 'hidden_dims': '[512, 64]', 'dropout': 0.43326045787735695, 'batch_norm': False, 'lr': 2.0164548827847188e-05, 'weight_decay': 1.5151095665233569e-07, 'epochs': 104, 'loss': 'mse', 'optimizer': 'adam', 'graph_mode': 'off', 'use_snp_selection': False}. Best is trial 19 with value: 0.06757389302384245.
[I 2025-12-05 15:07:07,389] Trial 72 finished with value: 0.026145304383332253 and parameters: {'model_type': 'mlp', 'hidden_dims': '[512, 64]', 'dropout': 0.4538542878824737, 'batch_norm': False, 'lr': 4.5503941370827116e-05, 'weight_decay': 2.2293153315336236e-07, 'epochs': 146, 'loss': 'mse', 'optimizer': 'adam', 'graph_mode': 'off', 'use_snp_selection': False}. Best is trial 19 with value: 0.06757389302384245.
[I 2025-12-05 15:07:08,499] Trial 73 finished with value: 0.04065753047569278 and parameters: {'model_type': 'mlp', 'hidden_dims': '[512, 64]', 'dropout': 0.41743679957222984, 'batch_norm': False, 'lr': 2.839335893219696e-05, 'weight_decay': 5.666615008261805e-07, 'epochs': 112, 'loss': 'mse', 'optimizer': 'adam', 'graph_mode': 'off', 'use_snp_selection': False}. Best is trial 19 with value: 0.06757389302384245.
[I 2025-12-05 15:07:09,931] Trial 74 finished with value: 0.06455952865970944 and parameters: {'model_type': 'mlp', 'hidden_dims': '[512, 64]', 'dropout': 0.493739814193096, 'batch_norm': False, 'lr': 1.0484293688932914e-05, 'weight_decay': 1.4149706744624625e-07, 'epochs': 208, 'loss': 'mse', 'optimizer': 'adam', 'graph_mode': 'off', 'use_snp_selection': False}. Best is trial 19 with value: 0.06757389302384245.
[I 2025-12-05 15:07:10,692] Trial 75 finished with value: -0.00487151104410528 and parameters: {'model_type': 'mlp', 'hidden_dims': '[128, 64]', 'dropout': 0.5376873172393803, 'batch_norm': False, 'lr': 6.52498741310575e-06, 'weight_decay': 3.246980486988285e-07, 'epochs': 203, 'loss': 'mse', 'optimizer': 'adam', 'graph_mode': 'off', 'use_snp_selection': False}. Best is trial 19 with value: 0.06757389302384245.
[I 2025-12-05 15:07:11,507] Trial 76 finished with value: 0.00900725087465446 and parameters: {'model_type': 'mlp', 'hidden_dims': '[512, 128]', 'dropout': 0.5481434280442701, 'batch_norm': False, 'lr': 9.204924171859737e-06, 'weight_decay': 1.8026446122937844e-07, 'epochs': 217, 'loss': 'mse', 'optimizer': 'adam', 'graph_mode': 'off', 'use_snp_selection': True, 'num_snps': 3325}. Best is trial 19 with value: 0.06757389302384245.
[I 2025-12-05 15:07:12,558] Trial 77 finished with value: 0.04468903627080553 and parameters: {'model_type': 'mlp', 'hidden_dims': '[256, 128, 64]', 'dropout': 0.1500524725200933, 'batch_norm': False, 'lr': 1.412822261486413e-05, 'weight_decay': 1.229085300108912e-07, 'epochs': 257, 'loss': 'mse', 'optimizer': 'adam', 'graph_mode': 'off', 'use_snp_selection': False}. Best is trial 19 with value: 0.06757389302384245.
[I 2025-12-05 15:07:14,033] Trial 78 finished with value: 0.04247574160443406 and parameters: {'model_type': 'mlp', 'hidden_dims': '[512, 64]', 'dropout': 0.4983463754595757, 'batch_norm': False, 'lr': 0.00016446092778006792, 'weight_decay': 7.051562383896798e-07, 'epochs': 230, 'loss': 'mse', 'optimizer': 'adam', 'graph_mode': 'off', 'use_snp_selection': False}. Best is trial 19 with value: 0.06757389302384245.
[I 2025-12-05 15:07:15,530] Trial 79 finished with value: 0.05467895460374947 and parameters: {'model_type': 'mlp', 'hidden_dims': '[512, 64]', 'dropout': 0.480359510161032, 'batch_norm': False, 'lr': 5.455049840283866e-06, 'weight_decay': 3.5440696586496e-05, 'epochs': 235, 'loss': 'mse', 'optimizer': 'adam', 'graph_mode': 'off', 'use_snp_selection': False}. Best is trial 19 with value: 0.06757389302384245.
[I 2025-12-05 15:07:16,893] Trial 80 finished with value: 0.0367404519790358 and parameters: {'model_type': 'mlp', 'hidden_dims': '[512, 64]', 'dropout': 0.1250857239146761, 'batch_norm': False, 'lr': 6.792894880434349e-05, 'weight_decay': 0.00010754363072905691, 'epochs': 179, 'loss': 'mae', 'optimizer': 'adam', 'graph_mode': 'off', 'use_snp_selection': False}. Best is trial 19 with value: 0.06757389302384245.
[I 2025-12-05 15:07:17,940] Trial 81 finished with value: 0.05559574083433402 and parameters: {'model_type': 'mlp', 'hidden_dims': '[512, 64]', 'dropout': 0.3561933790112956, 'batch_norm': False, 'lr': 3.203241398110971e-05, 'weight_decay': 1.3587400642313985e-07, 'epochs': 90, 'loss': 'mse', 'optimizer': 'adam', 'graph_mode': 'off', 'use_snp_selection': False}. Best is trial 19 with value: 0.06757389302384245.
[I 2025-12-05 15:07:18,832] Trial 82 finished with value: 0.038887665792773835 and parameters: {'model_type': 'mlp', 'hidden_dims': '[512, 64]', 'dropout': 0.35784855735413756, 'batch_norm': False, 'lr': 2.211670107600748e-05, 'weight_decay': 2.477512868513248e-07, 'epochs': 48, 'loss': 'mse', 'optimizer': 'adam', 'graph_mode': 'off', 'use_snp_selection': False}. Best is trial 19 with value: 0.06757389302384245.
[I 2025-12-05 15:07:19,834] Trial 83 finished with value: 0.015529609508915373 and parameters: {'model_type': 'mlp', 'hidden_dims': '[512, 64]', 'dropout': 0.3241739277792608, 'batch_norm': False, 'lr': 1.6454150530344556e-05, 'weight_decay': 1.86054683339943e-07, 'epochs': 83, 'loss': 'mse', 'optimizer': 'adam', 'graph_mode': 'off', 'use_snp_selection': False}. Best is trial 19 with value: 0.06757389302384245.
[I 2025-12-05 15:07:20,766] Trial 84 finished with value: 0.018530133007515895 and parameters: {'model_type': 'mlp', 'hidden_dims': '[512, 64]', 'dropout': 0.37527223294000533, 'batch_norm': False, 'lr': 1.011119642822234e-05, 'weight_decay': 3.2743193788162424e-07, 'epochs': 66, 'loss': 'mse', 'optimizer': 'adam', 'graph_mode': 'off', 'use_snp_selection': False}. Best is trial 19 with value: 0.06757389302384245.
[I 2025-12-05 15:07:21,498] Trial 85 finished with value: 0.04134392879232091 and parameters: {'model_type': 'mlp', 'hidden_dims': '[256, 128]', 'dropout': 0.40097859446647843, 'batch_norm': False, 'lr': 3.778294829641293e-05, 'weight_decay': 1.3648638725557112e-07, 'epochs': 87, 'loss': 'mse', 'optimizer': 'adam', 'graph_mode': 'off', 'use_snp_selection': False}. Best is trial 19 with value: 0.06757389302384245.
[I 2025-12-05 15:07:22,889] Trial 86 finished with value: 0.03987714760598549 and parameters: {'model_type': 'mlp', 'hidden_dims': '[512, 256]', 'dropout': 0.33342030689603136, 'batch_norm': False, 'lr': 0.00010252035435434448, 'weight_decay': 5.327781964643878e-07, 'epochs': 204, 'loss': 'mse', 'optimizer': 'adam', 'graph_mode': 'off', 'use_snp_selection': False}. Best is trial 19 with value: 0.06757389302384245.
[I 2025-12-05 15:07:23,900] Trial 87 finished with value: 0.02478185948752932 and parameters: {'model_type': 'mlp', 'hidden_dims': '[512, 128]', 'dropout': 0.1963570057554866, 'batch_norm': True, 'lr': 4.480937311573919e-05, 'weight_decay': 1.067801436075238e-07, 'epochs': 93, 'loss': 'mse', 'optimizer': 'adam', 'graph_mode': 'off', 'use_snp_selection': False}. Best is trial 19 with value: 0.06757389302384245.
[I 2025-12-05 15:07:26,108] Trial 88 finished with value: 0.04689987519116725 and parameters: {'model_type': 'mlp', 'hidden_dims': '[128, 64]', 'dropout': 0.3525924660375329, 'batch_norm': False, 'lr': 4.8085346985396465e-06, 'weight_decay': 1.9419764483563112e-07, 'epochs': 227, 'loss': 'mse', 'optimizer': 'adam', 'graph_mode': 'off', 'use_snp_selection': True, 'num_snps': 48766}. Best is trial 19 with value: 0.06757389302384245.
[I 2025-12-05 15:07:27,564] Trial 89 finished with value: 0.04109860635884924 and parameters: {'model_type': 'mlp', 'hidden_dims': '[512, 256]', 'dropout': 0.5178501005217553, 'batch_norm': True, 'lr': 1.0757051342118088e-05, 'weight_decay': 2.612491159524316e-07, 'epochs': 191, 'loss': 'mse', 'optimizer': 'adam', 'graph_mode': 'off', 'use_snp_selection': False}. Best is trial 19 with value: 0.06757389302384245.
[I 2025-12-05 15:07:28,549] Trial 90 finished with value: 0.021116957395790673 and parameters: {'model_type': 'mlp', 'hidden_dims': '[512, 64]', 'dropout': 0.15945455413753523, 'batch_norm': True, 'lr': 3.985321770728554e-06, 'weight_decay': 3.7915749363450367e-07, 'epochs': 75, 'loss': 'mse', 'optimizer': 'adam', 'graph_mode': 'off', 'use_snp_selection': False}. Best is trial 19 with value: 0.06757389302384245.
[I 2025-12-05 15:07:29,683] Trial 91 finished with value: 0.050937844536978756 and parameters: {'model_type': 'mlp', 'hidden_dims': '[512, 64]', 'dropout': 0.4423197754417961, 'batch_norm': False, 'lr': 2.863847898027315e-05, 'weight_decay': 1.5784667111512784e-07, 'epochs': 121, 'loss': 'mse', 'optimizer': 'adam', 'graph_mode': 'off', 'use_snp_selection': False}. Best is trial 19 with value: 0.06757389302384245.
[I 2025-12-05 15:07:30,714] Trial 92 finished with value: 0.02110174163878531 and parameters: {'model_type': 'mlp', 'hidden_dims': '[512, 64]', 'dropout': 0.3913071889148251, 'batch_norm': False, 'lr': 5.2331876974119244e-05, 'weight_decay': 1.3428217587186534e-07, 'epochs': 100, 'loss': 'mse', 'optimizer': 'adam', 'graph_mode': 'off', 'use_snp_selection': False}. Best is trial 19 with value: 0.06757389302384245.
[I 2025-12-05 15:07:31,598] Trial 93 finished with value: 0.03724149166509822 and parameters: {'model_type': 'mlp', 'hidden_dims': '[512, 64]', 'dropout': 0.42127785459622846, 'batch_norm': False, 'lr': 3.111112965442434e-05, 'weight_decay': 2.100738747579891e-07, 'epochs': 56, 'loss': 'mse', 'optimizer': 'adam', 'graph_mode': 'off', 'use_snp_selection': False}. Best is trial 19 with value: 0.06757389302384245.
