[I 2025-12-05 15:50:12,498] Trial 85 finished with value: 0.057089480177356905 and parameters: {'model_type': 'mlp', 'hidden_dims': '[512, 128]', 'dropout': 0.5842233879579929, 'batch_norm': False, 'lr': 5.2961967725873444e-05, 'weight_decay': 8.298579060915255e-06, 'epochs': 181, 'loss': 'mae', 'optimizer': 'adam', 'graph_mode': 'off', 'use_snp_selection': True, 'num_snps': 15065}. Best is trial 44 with value: 0.05876329844938989.
[I 2025-12-05 15:50:13,514] Trial 86 finished with value: 0.02103519845970128 and parameters: {'model_type': 'mlp', 'hidden_dims': '[512, 128]', 'dropout': 0.5801837301435763, 'batch_norm': False, 'lr': 8.867022792361128e-05, 'weight_decay': 4.2314189673045004e-06, 'epochs': 199, 'loss': 'mae', 'optimizer': 'adam', 'graph_mode': 'off', 'use_snp_selection': True, 'num_snps': 10651}. Best is trial 44 with value: 0.05876329844938989.
[I 2025-12-05 15:50:14,785] Trial 87 finished with value: 0.01929107904802414 and parameters: {'model_type': 'mlp', 'hidden_dims': '[256, 128, 64]', 'dropout': 0.323726130524252, 'batch_norm': False, 'lr': 7.547125922431166e-05, 'weight_decay': 1.1213914988800087e-07, 'epochs': 345, 'loss': 'mse', 'optimizer': 'adam', 'graph_mode': 'off', 'use_snp_selection': False}. Best is trial 44 with value: 0.05876329844938989.
[I 2025-12-05 15:50:15,540] Trial 88 finished with value: 0.007836680792516164 and parameters: {'model_type': 'mlp', 'hidden_dims': '[256, 128]', 'dropout': 0.48699666366217137, 'batch_norm': True, 'lr': 0.00020972020427547806, 'weight_decay': 4.29148370736031e-07, 'epochs': 149, 'loss': 'mae', 'optimizer': 'adam', 'graph_mode': 'off', 'use_snp_selection': True, 'num_snps': 3337}. Best is trial 44 with value: 0.05876329844938989.
[I 2025-12-05 15:50:16,685] Trial 89 finished with value: 0.012148625949556284 and parameters: {'model_type': 'mlp', 'hidden_dims': '[128, 64]', 'dropout': 0.30643310412839203, 'batch_norm': False, 'lr': 5.129008738200262e-05, 'weight_decay': 1.8037342227750567e-07, 'epochs': 258, 'loss': 'mae', 'optimizer': 'adam', 'graph_mode': 'off', 'use_snp_selection': True, 'num_snps': 14971}. Best is trial 44 with value: 0.05876329844938989.
[I 2025-12-05 15:50:17,805] Trial 90 finished with value: 0.010600536513486284 and parameters: {'model_type': 'mlp', 'hidden_dims': '[512, 256]', 'dropout': 0.5479181416784897, 'batch_norm': False, 'lr': 0.00026366154270631, 'weight_decay': 9.951209701592787e-07, 'epochs': 327, 'loss': 'mae', 'optimizer': 'adam', 'graph_mode': 'off', 'use_snp_selection': True, 'num_snps': 7898}. Best is trial 44 with value: 0.05876329844938989.
[I 2025-12-05 15:50:18,709] Trial 91 finished with value: 0.06042739557159946 and parameters: {'model_type': 'mlp', 'hidden_dims': '[512, 128]', 'dropout': 0.5672129547688641, 'batch_norm': False, 'lr': 2.8004822011085134e-05, 'weight_decay': 2.7657499214494293e-05, 'epochs': 184, 'loss': 'mae', 'optimizer': 'adam', 'graph_mode': 'off', 'use_snp_selection': True, 'num_snps': 6533}. Best is trial 91 with value: 0.06042739557159946.
[I 2025-12-05 15:50:19,720] Trial 92 finished with value: 0.030604736845280964 and parameters: {'model_type': 'mlp', 'hidden_dims': '[512, 128]', 'dropout': 0.5847595041496297, 'batch_norm': False, 'lr': 2.4885241623658774e-05, 'weight_decay': 3.226355902340171e-05, 'epochs': 214, 'loss': 'mae', 'optimizer': 'adam', 'graph_mode': 'off', 'use_snp_selection': True, 'num_snps': 8999}. Best is trial 91 with value: 0.06042739557159946.
[I 2025-12-05 15:50:20,553] Trial 93 finished with value: 0.04117331476399763 and parameters: {'model_type': 'mlp', 'hidden_dims': '[512, 128]', 'dropout': 0.5211776490212591, 'batch_norm': False, 'lr': 3.842934522360112e-05, 'weight_decay': 1.3220402897539247e-05, 'epochs': 182, 'loss': 'mae', 'optimizer': 'adam', 'graph_mode': 'off', 'use_snp_selection': True, 'num_snps': 5201}. Best is trial 91 with value: 0.06042739557159946.
[I 2025-12-05 15:50:21,425] Trial 94 finished with value: 0.0349407545981679 and parameters: {'model_type': 'mlp', 'hidden_dims': '[512, 128]', 'dropout': 0.537041765492162, 'batch_norm': False, 'lr': 2.6733007907647413e-05, 'weight_decay': 0.00044148851692813867, 'epochs': 168, 'loss': 'mae', 'optimizer': 'adam', 'graph_mode': 'off', 'use_snp_selection': True, 'num_snps': 7199}. Best is trial 91 with value: 0.06042739557159946.
[I 2025-12-05 15:50:22,409] Trial 95 finished with value: 0.04928678465863329 and parameters: {'model_type': 'mlp', 'hidden_dims': '[512, 128]', 'dropout': 0.46084043910107075, 'batch_norm': False, 'lr': 0.0009538148347314699, 'weight_decay': 0.0002532725531126989, 'epochs': 189, 'loss': 'mae', 'optimizer': 'adam', 'graph_mode': 'off', 'use_snp_selection': True, 'num_snps': 11113}. Best is trial 91 with value: 0.06042739557159946.
[I 2025-12-05 15:50:23,390] Trial 96 finished with value: 0.011172590532650328 and parameters: {'model_type': 'mlp', 'hidden_dims': '[512, 128]', 'dropout': 0.45845579635422745, 'batch_norm': False, 'lr': 0.000894163368114591, 'weight_decay': 0.00018246097560939984, 'epochs': 181, 'loss': 'mse', 'optimizer': 'adam', 'graph_mode': 'off', 'use_snp_selection': True, 'num_snps': 11659}. Best is trial 91 with value: 0.06042739557159946.
[I 2025-12-05 15:50:24,542] Trial 97 finished with value: 0.039691419087390364 and parameters: {'model_type': 'mlp', 'hidden_dims': '[512, 128]', 'dropout': 0.4282071217750246, 'batch_norm': False, 'lr': 6.332343534072269e-05, 'weight_decay': 0.0003012950773826845, 'epochs': 198, 'loss': 'mae', 'optimizer': 'adam', 'graph_mode': 'off', 'use_snp_selection': True, 'num_snps': 14332}. Best is trial 91 with value: 0.06042739557159946.
[I 2025-12-05 15:50:25,662] Trial 98 finished with value: 0.03545573801938233 and parameters: {'model_type': 'mlp', 'hidden_dims': '[512, 128]', 'dropout': 0.10636056205300809, 'batch_norm': False, 'lr': 0.0009768187636892125, 'weight_decay': 9.298902095868117e-05, 'epochs': 175, 'loss': 'mae', 'optimizer': 'adam', 'graph_mode': 'off', 'use_snp_selection': True, 'num_snps': 12878}. Best is trial 91 with value: 0.06042739557159946.
[I 2025-12-05 15:50:26,662] Trial 99 finished with value: 0.0391450844952316 and parameters: {'model_type': 'mlp', 'hidden_dims': '[512, 128]', 'dropout': 0.5626094196803209, 'batch_norm': False, 'lr': 2.0476442484257394e-05, 'weight_decay': 0.000661717167922172, 'epochs': 192, 'loss': 'mae', 'optimizer': 'adam', 'graph_mode': 'off', 'use_snp_selection': True, 'num_snps': 9400}. Best is trial 91 with value: 0.06042739557159946.
[I 2025-12-05 15:50:27,620] Trial 100 finished with value: 0.024647057133412593 and parameters: {'model_type': 'mlp', 'hidden_dims': '[256, 128, 64]', 'dropout': 0.3992098363585895, 'batch_norm': False, 'lr': 0.00010943667942724062, 'weight_decay': 0.0009635702106651015, 'epochs': 154, 'loss': 'mae', 'optimizer': 'adam', 'graph_mode': 'off', 'use_snp_selection': False}. Best is trial 91 with value: 0.06042739557159946.
[I 2025-12-05 15:50:28,554] Trial 101 finished with value: 0.03810394175875524 and parameters: {'model_type': 'mlp', 'hidden_dims': '[256, 128]', 'dropout': 0.500579621638227, 'batch_norm': False, 'lr': 0.000556266468359503, 'weight_decay': 0.0003841720385715932, 'epochs': 307, 'loss': 'mae', 'optimizer': 'adam', 'graph_mode': 'off', 'use_snp_selection': True, 'num_snps': 3764}. Best is trial 91 with value: 0.06042739557159946.
[I 2025-12-05 15:50:29,568] Trial 102 finished with value: 0.04223660980990834 and parameters: {'model_type': 'mlp', 'hidden_dims': '[512, 128]', 'dropout': 0.47158219398974344, 'batch_norm': False, 'lr': 0.0007480872843120715, 'weight_decay': 5.658723347084318e-06, 'epochs': 334, 'loss': 'mae', 'optimizer': 'adam', 'graph_mode': 'off', 'use_snp_selection': True, 'num_snps': 6692}. Best is trial 91 with value: 0.06042739557159946.
[I 2025-12-05 15:50:30,344] Trial 103 finished with value: 0.019935161422992356 and parameters: {'model_type': 'mlp', 'hidden_dims': '[512, 128]', 'dropout': 0.4451074148088693, 'batch_norm': True, 'lr': 0.00014228921276618177, 'weight_decay': 0.00013872518604317606, 'epochs': 186, 'loss': 'mae', 'optimizer': 'adam', 'graph_mode': 'off', 'use_snp_selection': True, 'num_snps': 2045}. Best is trial 91 with value: 0.06042739557159946.
[I 2025-12-05 15:50:32,708] Trial 104 finished with value: 0.05235184384984989 and parameters: {'model_type': 'mlp', 'hidden_dims': '[512, 64]', 'dropout': 0.48168354338581426, 'batch_norm': False, 'lr': 0.0005983952036021896, 'weight_decay': 6.431160363807872e-05, 'epochs': 209, 'loss': 'mae', 'optimizer': 'adam', 'graph_mode': 'off', 'use_snp_selection': True, 'num_snps': 42325}. Best is trial 91 with value: 0.06042739557159946.
[I 2025-12-05 15:50:34,829] Trial 105 finished with value: -0.018435375417162354 and parameters: {'model_type': 'mlp', 'hidden_dims': '[512, 64]', 'dropout': 0.4829636429785784, 'batch_norm': False, 'lr': 0.0004899982417648637, 'weight_decay': 0.0005999482839876164, 'epochs': 213, 'loss': 'mae', 'optimizer': 'adam', 'graph_mode': 'off', 'use_snp_selection': True, 'num_snps': 37906}. Best is trial 91 with value: 0.06042739557159946.
[I 2025-12-05 15:50:37,091] Trial 106 finished with value: -0.03002362565785211 and parameters: {'model_type': 'mlp', 'hidden_dims': '[512, 64]', 'dropout': 0.422679815002592, 'batch_norm': False, 'lr': 0.0006716379700339577, 'weight_decay': 5.0582607197375074e-05, 'epochs': 174, 'loss': 'mse', 'optimizer': 'adam', 'graph_mode': 'off', 'use_snp_selection': True, 'num_snps': 45916}. Best is trial 91 with value: 0.06042739557159946.
[I 2025-12-05 15:50:39,762] Trial 107 finished with value: -0.015214780767108825 and parameters: {'model_type': 'mlp', 'hidden_dims': '[512, 64]', 'dropout': 0.45762990048527574, 'batch_norm': False, 'lr': 0.000612483651396944, 'weight_decay': 6.2927246159952e-05, 'epochs': 140, 'loss': 'mae', 'optimizer': 'adam', 'graph_mode': 'off', 'use_snp_selection': True, 'num_snps': 52646}. Best is trial 91 with value: 0.06042739557159946.
[I 2025-12-05 15:50:41,650] Trial 108 finished with value: 0.04454435941278631 and parameters: {'model_type': 'mlp', 'hidden_dims': '[512, 256]', 'dropout': 0.29403219119040586, 'batch_norm': False, 'lr': 0.0008274337892551255, 'weight_decay': 3.873128039512375e-05, 'epochs': 202, 'loss': 'mae', 'optimizer': 'adam', 'graph_mode': 'off', 'use_snp_selection': True, 'num_snps': 32572}. Best is trial 91 with value: 0.06042739557159946.
[I 2025-12-05 15:50:43,968] Trial 109 finished with value: 0.018774881586213703 and parameters: {'model_type': 'mlp', 'hidden_dims': '[512, 64]', 'dropout': 0.27904468384404496, 'batch_norm': False, 'lr': 0.00032555609507012605, 'weight_decay': 0.0002544811424029554, 'epochs': 164, 'loss': 'mae', 'optimizer': 'adam', 'graph_mode': 'off', 'use_snp_selection': True, 'num_snps': 48644}. Best is trial 91 with value: 0.06042739557159946.
[I 2025-12-05 15:50:45,805] Trial 110 finished with value: 0.003146818139285682 and parameters: {'model_type': 'mlp', 'hidden_dims': '[256, 128, 64]', 'dropout': 0.44221966035238147, 'batch_norm': False, 'lr': 0.00016882402018739877, 'weight_decay': 6.923123302917678e-05, 'epochs': 88, 'loss': 'mae', 'optimizer': 'adam', 'graph_mode': 'off', 'use_snp_selection': True, 'num_snps': 39277}. Best is trial 91 with value: 0.06042739557159946.
[I 2025-12-05 15:50:46,835] Trial 111 finished with value: 0.028210632132930083 and parameters: {'model_type': 'mlp', 'hidden_dims': '[256, 128]', 'dropout': 0.5156851797896704, 'batch_norm': False, 'lr': 0.0008790107860831055, 'weight_decay': 1.8122432071782727e-05, 'epochs': 195, 'loss': 'mae', 'optimizer': 'adam', 'graph_mode': 'off', 'use_snp_selection': True, 'num_snps': 10809}. Best is trial 91 with value: 0.06042739557159946.
[I 2025-12-05 15:50:48,332] Trial 112 finished with value: 0.010093534603691244 and parameters: {'model_type': 'mlp', 'hidden_dims': '[256, 128]', 'dropout': 0.49286838287781726, 'batch_norm': False, 'lr': 0.0003819589965517649, 'weight_decay': 1.9449207086449126e-06, 'epochs': 226, 'loss': 'mae', 'optimizer': 'adam', 'graph_mode': 'off', 'use_snp_selection': True, 'num_snps': 24980}. Best is trial 91 with value: 0.06042739557159946.
[I 2025-12-05 15:50:49,238] Trial 113 finished with value: 0.014161410383675879 and parameters: {'model_type': 'mlp', 'hidden_dims': '[512, 128]', 'dropout': 0.4761865170951505, 'batch_norm': True, 'lr': 0.0006063756306286321, 'weight_decay': 1.410681088248924e-06, 'epochs': 208, 'loss': 'mae', 'optimizer': 'adam', 'graph_mode': 'off', 'use_snp_selection': True, 'num_snps': 5123}. Best is trial 91 with value: 0.06042739557159946.
[I 2025-12-05 15:50:50,253] Trial 114 finished with value: 0.04631117609335858 and parameters: {'model_type': 'mlp', 'hidden_dims': '[512, 64]', 'dropout': 0.4114195346738271, 'batch_norm': False, 'lr': 0.0004577926140289277, 'weight_decay': 8.938999077417794e-06, 'epochs': 287, 'loss': 'mae', 'optimizer': 'adam', 'graph_mode': 'off', 'use_snp_selection': True, 'num_snps': 8489}. Best is trial 91 with value: 0.06042739557159946.
[I 2025-12-05 15:50:51,217] Trial 115 finished with value: 0.0067444922275593806 and parameters: {'model_type': 'mlp', 'hidden_dims': '[256, 128, 64]', 'dropout': 0.5999747726215213, 'batch_norm': False, 'lr': 0.00070732607286368, 'weight_decay': 0.00011714098894630734, 'epochs': 238, 'loss': 'mae', 'optimizer': 'adam', 'graph_mode': 'off', 'use_snp_selection': True, 'num_snps': 7425}. Best is trial 91 with value: 0.06042739557159946.
[I 2025-12-05 15:50:52,313] Trial 116 finished with value: 0.018815374185108272 and parameters: {'model_type': 'mlp', 'hidden_dims': '[128, 64]', 'dropout': 0.5522680640959597, 'batch_norm': False, 'lr': 0.000506857486485293, 'weight_decay': 2.6647874269990303e-06, 'epochs': 300, 'loss': 'mse', 'optimizer': 'adam', 'graph_mode': 'off', 'use_snp_selection': True, 'num_snps': 9571}. Best is trial 91 with value: 0.06042739557159946.
[I 2025-12-05 15:50:53,684] Trial 117 finished with value: 0.03602427560430815 and parameters: {'model_type': 'mlp', 'hidden_dims': '[256, 128]', 'dropout': 0.5085399403680363, 'batch_norm': False, 'lr': 5.319430617138635e-05, 'weight_decay': 1.2405459662927425e-07, 'epochs': 317, 'loss': 'mae', 'optimizer': 'adam', 'graph_mode': 'off', 'use_snp_selection': True, 'num_snps': 17316}. Best is trial 91 with value: 0.06042739557159946.
[I 2025-12-05 15:50:54,597] Trial 118 finished with value: 0.04868559133609022 and parameters: {'model_type': 'mlp', 'hidden_dims': '[512, 128]', 'dropout': 0.38416782662408233, 'batch_norm': False, 'lr': 4.360952669501444e-05, 'weight_decay': 1.1232974990135828e-06, 'epochs': 218, 'loss': 'mae', 'optimizer': 'adam', 'graph_mode': 'off', 'use_snp_selection': True, 'num_snps': 5817}. Best is trial 91 with value: 0.06042739557159946.
[I 2025-12-05 15:50:55,404] Trial 119 finished with value: 0.040572819350930496 and parameters: {'model_type': 'mlp', 'hidden_dims': '[512, 128]', 'dropout': 0.3805349036146221, 'batch_norm': False, 'lr': 7.90851209636904e-05, 'weight_decay': 2.8707546219673314e-05, 'epochs': 122, 'loss': 'mae', 'optimizer': 'adam', 'graph_mode': 'off', 'use_snp_selection': True, 'num_snps': 5712}. Best is trial 91 with value: 0.06042739557159946.
[I 2025-12-05 15:50:56,973] Trial 120 finished with value: 0.004849353108462047 and parameters: {'model_type': 'mlp', 'hidden_dims': '[512, 128]', 'dropout': 0.3358373399326751, 'batch_norm': False, 'lr': 3.974421483563101e-05, 'weight_decay': 1.6723240805501172e-06, 'epochs': 221, 'loss': 'mae', 'optimizer': 'adam', 'graph_mode': 'off', 'use_snp_selection': False}. Best is trial 91 with value: 0.06042739557159946.
[I 2025-12-05 15:50:57,832] Trial 121 finished with value: 0.03976013231543672 and parameters: {'model_type': 'mlp', 'hidden_dims': '[512, 128]', 'dropout': 0.3667836733594109, 'batch_norm': False, 'lr': 3.426656288902411e-05, 'weight_decay': 1.0737592864592086e-05, 'epochs': 279, 'loss': 'mae', 'optimizer': 'adam', 'graph_mode': 'off', 'use_snp_selection': True, 'num_snps': 3270}. Best is trial 91 with value: 0.06042739557159946.
[I 2025-12-05 15:50:58,659] Trial 122 finished with value: 0.011209409232395294 and parameters: {'model_type': 'mlp', 'hidden_dims': '[512, 128]', 'dropout': 0.3532664704277302, 'batch_norm': False, 'lr': 4.334172090120437e-05, 'weight_decay': 1.0919517786791572e-06, 'epochs': 186, 'loss': 'mae', 'optimizer': 'adam', 'graph_mode': 'off', 'use_snp_selection': True, 'num_snps': 5908}. Best is trial 91 with value: 0.06042739557159946.
[I 2025-12-05 15:50:59,566] Trial 123 finished with value: 0.011763654445167384 and parameters: {'model_type': 'mlp', 'hidden_dims': '[512, 256]', 'dropout': 0.5664643244936962, 'batch_norm': False, 'lr': 0.0009819636343494766, 'weight_decay': 2.119464364687219e-06, 'epochs': 250, 'loss': 'mae', 'optimizer': 'adam', 'graph_mode': 'off', 'use_snp_selection': True, 'num_snps': 4315}. Best is trial 91 with value: 0.06042739557159946.
[I 2025-12-05 15:51:00,613] Trial 124 finished with value: 0.036149011402528824 and parameters: {'model_type': 'mlp', 'hidden_dims': '[512, 128]', 'dropout': 0.3945664423914988, 'batch_norm': True, 'lr': 3.0571482946073956e-05, 'weight_decay': 4.673300174649583e-06, 'epochs': 211, 'loss': 'mae', 'optimizer': 'adam', 'graph_mode': 'off', 'use_snp_selection': True, 'num_snps': 7661}. Best is trial 91 with value: 0.06042739557159946.
[I 2025-12-05 15:51:01,620] Trial 125 finished with value: 0.04409818340371326 and parameters: {'model_type': 'mlp', 'hidden_dims': '[256, 128]', 'dropout': 0.5204715082183466, 'batch_norm': False, 'lr': 0.0001259657109674009, 'weight_decay': 6.656592714752004e-07, 'epochs': 176, 'loss': 'mae', 'optimizer': 'adam', 'graph_mode': 'off', 'use_snp_selection': True, 'num_snps': 10245}. Best is trial 91 with value: 0.06042739557159946.
[I 2025-12-05 15:51:02,684] Trial 126 finished with value: 0.03823545345067006 and parameters: {'model_type': 'mlp', 'hidden_dims': '[256, 128, 64]', 'dropout': 0.3104326884681019, 'batch_norm': False, 'lr': 0.0007817630000038029, 'weight_decay': 3.488232557558437e-06, 'epochs': 192, 'loss': 'mae', 'optimizer': 'adam', 'graph_mode': 'off', 'use_snp_selection': True, 'num_snps': 11446}. Best is trial 91 with value: 0.06042739557159946.
[I 2025-12-05 15:51:05,233] Trial 127 finished with value: 0.013621127458925965 and parameters: {'model_type': 'mlp', 'hidden_dims': '[512, 128]', 'dropout': 0.537216321866402, 'batch_norm': False, 'lr': 6.811280351233992e-05, 'weight_decay': 2.2614944245301348e-07, 'epochs': 348, 'loss': 'mse', 'optimizer': 'adam', 'graph_mode': 'off', 'use_snp_selection': True, 'num_snps': 40932}. Best is trial 91 with value: 0.06042739557159946.
[I 2025-12-05 15:51:06,257] Trial 128 finished with value: 0.06205779707559564 and parameters: {'model_type': 'mlp', 'hidden_dims': '[512, 128]', 'dropout': 0.2524704122803796, 'batch_norm': False, 'lr': 0.0002867685345331508, 'weight_decay': 2.7414358608011646e-06, 'epochs': 338, 'loss': 'mae', 'optimizer': 'adam', 'graph_mode': 'off', 'use_snp_selection': True, 'num_snps': 6905}. Best is trial 128 with value: 0.06205779707559564.
[I 2025-12-05 15:51:07,396] Trial 129 finished with value: 0.04236203074222146 and parameters: {'model_type': 'mlp', 'hidden_dims': '[512, 128]', 'dropout': 0.1886774790788668, 'batch_norm': False, 'lr': 0.00019874027867841843, 'weight_decay': 5.845023214818008e-07, 'epochs': 334, 'loss': 'mae', 'optimizer': 'adam', 'graph_mode': 'off', 'use_snp_selection': True, 'num_snps': 8866}. Best is trial 128 with value: 0.06205779707559564.
[I 2025-12-05 15:51:08,423] Trial 130 finished with value: 0.058338488303728044 and parameters: {'model_type': 'mlp', 'hidden_dims': '[512, 128]', 'dropout': 0.20883139838558237, 'batch_norm': False, 'lr': 0.0002500961538986447, 'weight_decay': 1.2109313681168543e-06, 'epochs': 340, 'loss': 'mae', 'optimizer': 'adam', 'graph_mode': 'off', 'use_snp_selection': True, 'num_snps': 4704}. Best is trial 128 with value: 0.06205779707559564.
[I 2025-12-05 15:51:09,503] Trial 131 finished with value: 0.05879640605461778 and parameters: {'model_type': 'mlp', 'hidden_dims': '[512, 128]', 'dropout': 0.2465225938935396, 'batch_norm': False, 'lr': 0.00026830118226834054, 'weight_decay': 1.2495542571299031e-06, 'epochs': 338, 'loss': 'mae', 'optimizer': 'adam', 'graph_mode': 'off', 'use_snp_selection': True, 'num_snps': 6891}. Best is trial 128 with value: 0.06205779707559564.
[I 2025-12-05 15:51:10,499] Trial 132 finished with value: 0.041307943168885565 and parameters: {'model_type': 'mlp', 'hidden_dims': '[512, 128]', 'dropout': 0.23644543478565952, 'batch_norm': False, 'lr': 0.0002567588928207265, 'weight_decay': 1.5698551420181239e-06, 'epochs': 340, 'loss': 'mae', 'optimizer': 'adam', 'graph_mode': 'off', 'use_snp_selection': True, 'num_snps': 4629}. Best is trial 128 with value: 0.06205779707559564.
[I 2025-12-05 15:51:11,526] Trial 133 finished with value: 0.04283935355254395 and parameters: {'model_type': 'mlp', 'hidden_dims': '[512, 128]', 'dropout': 0.17277239253434934, 'batch_norm': False, 'lr': 0.00028846637782895337, 'weight_decay': 9.02383062259178e-07, 'epochs': 325, 'loss': 'mae', 'optimizer': 'adam', 'graph_mode': 'off', 'use_snp_selection': True, 'num_snps': 6955}. Best is trial 128 with value: 0.06205779707559564.
[I 2025-12-05 15:51:12,463] Trial 134 finished with value: 0.026909002188656064 and parameters: {'model_type': 'mlp', 'hidden_dims': '[512, 128]', 'dropout': 0.2632820641916542, 'batch_norm': False, 'lr': 0.00023435237130968686, 'weight_decay': 1.5387751297793342e-07, 'epochs': 344, 'loss': 'mae', 'optimizer': 'adam', 'graph_mode': 'off', 'use_snp_selection': True, 'num_snps': 3525}. Best is trial 128 with value: 0.06205779707559564.
