[I 2025-12-05 15:36:40,397] Trial 18 finished with value: 0.03869881121401159 and parameters: {'model_type': 'mlp', 'hidden_dims': '[256, 128, 64]', 'dropout': 0.5098431992326697, 'batch_norm': False, 'lr': 0.0009897499817860137, 'weight_decay': 7.197637349971628e-05, 'epochs': 282, 'loss': 'mse', 'optimizer': 'adam', 'graph_mode': 'off', 'use_snp_selection': True, 'num_snps': 58241}. Best is trial 15 with value: 0.12411614544257442.
[I 2025-12-05 15:36:41,879] Trial 19 finished with value: 0.08621501505958655 and parameters: {'model_type': 'mlp', 'hidden_dims': '[512, 128]', 'dropout': 0.2205394223251104, 'batch_norm': True, 'lr': 1.7154942323106222e-05, 'weight_decay': 8.364670006934218e-06, 'epochs': 190, 'loss': 'mse', 'optimizer': 'adam', 'graph_mode': 'off', 'use_snp_selection': False}. Best is trial 15 with value: 0.12411614544257442.
[I 2025-12-05 15:36:42,556] Trial 20 finished with value: 0.11255427679136457 and parameters: {'model_type': 'mlp', 'hidden_dims': '[128, 64]', 'dropout': 0.3319159614797602, 'batch_norm': True, 'lr': 0.0002488783744352656, 'weight_decay': 3.794001318841326e-06, 'epochs': 91, 'loss': 'mse', 'optimizer': 'adam', 'graph_mode': 'off', 'use_snp_selection': False}. Best is trial 15 with value: 0.12411614544257442.
[I 2025-12-05 15:36:43,538] Trial 21 finished with value: 0.1085971244329337 and parameters: {'model_type': 'mlp', 'hidden_dims': '[512, 256]', 'dropout': 0.1709783051793473, 'batch_norm': True, 'lr': 0.00041016442550397946, 'weight_decay': 3.006868986467895e-07, 'epochs': 69, 'loss': 'mse', 'optimizer': 'adam', 'graph_mode': 'off', 'use_snp_selection': False}. Best is trial 15 with value: 0.12411614544257442.
[I 2025-12-05 15:36:44,675] Trial 22 finished with value: 0.11204966479555242 and parameters: {'model_type': 'mlp', 'hidden_dims': '[512, 128]', 'dropout': 0.24472330375724913, 'batch_norm': True, 'lr': 0.00013125309290784544, 'weight_decay': 2.4390289388342944e-07, 'epochs': 109, 'loss': 'mse', 'optimizer': 'adam', 'graph_mode': 'off', 'use_snp_selection': False}. Best is trial 15 with value: 0.12411614544257442.
[I 2025-12-05 15:36:45,881] Trial 23 finished with value: 0.12110379647486466 and parameters: {'model_type': 'mlp', 'hidden_dims': '[512, 256]', 'dropout': 0.18199297671511705, 'batch_norm': True, 'lr': 0.00011760922646500526, 'weight_decay': 7.921995680112938e-07, 'epochs': 135, 'loss': 'mse', 'optimizer': 'adam', 'graph_mode': 'off', 'use_snp_selection': False}. Best is trial 15 with value: 0.12411614544257442.
[I 2025-12-05 15:36:46,588] Trial 24 finished with value: 0.09896335112279166 and parameters: {'model_type': 'mlp', 'hidden_dims': '[128, 64]', 'dropout': 0.18178320975949974, 'batch_norm': True, 'lr': 0.00010674937937381335, 'weight_decay': 9.330629954684281e-07, 'epochs': 142, 'loss': 'mse', 'optimizer': 'adam', 'graph_mode': 'off', 'use_snp_selection': False}. Best is trial 15 with value: 0.12411614544257442.
[I 2025-12-05 15:36:47,519] Trial 25 finished with value: 0.08629463301486455 and parameters: {'model_type': 'mlp', 'hidden_dims': '[256, 128, 64]', 'dropout': 0.2888752735642953, 'batch_norm': True, 'lr': 2.495808813728521e-05, 'weight_decay': 6.569550148775418e-07, 'epochs': 170, 'loss': 'mse', 'optimizer': 'adam', 'graph_mode': 'off', 'use_snp_selection': False}. Best is trial 15 with value: 0.12411614544257442.
[I 2025-12-05 15:36:48,292] Trial 26 finished with value: 0.06401060870940511 and parameters: {'model_type': 'mlp', 'hidden_dims': '[256, 128]', 'dropout': 0.21447075737899016, 'batch_norm': True, 'lr': 1.2550693142833744e-05, 'weight_decay': 6.01623104717687e-06, 'epochs': 127, 'loss': 'mse', 'optimizer': 'adam', 'graph_mode': 'off', 'use_snp_selection': True, 'num_snps': 3842}. Best is trial 15 with value: 0.12411614544257442.
[I 2025-12-05 15:36:49,932] Trial 27 finished with value: 0.0746067307983011 and parameters: {'model_type': 'mlp', 'hidden_dims': '[512, 128]', 'dropout': 0.3062841017181145, 'batch_norm': False, 'lr': 3.708794373669967e-05, 'weight_decay': 1.6689553141049956e-06, 'epochs': 258, 'loss': 'mse', 'optimizer': 'adam', 'graph_mode': 'off', 'use_snp_selection': False}. Best is trial 15 with value: 0.12411614544257442.
[I 2025-12-05 15:36:50,725] Trial 28 finished with value: 0.09820251367789479 and parameters: {'model_type': 'mlp', 'hidden_dims': '[128, 64]', 'dropout': 0.14238937763344275, 'batch_norm': True, 'lr': 0.00010263955246173568, 'weight_decay': 1.7885653303467218e-07, 'epochs': 206, 'loss': 'mse', 'optimizer': 'adam', 'graph_mode': 'off', 'use_snp_selection': False}. Best is trial 15 with value: 0.12411614544257442.
[I 2025-12-05 15:36:52,103] Trial 29 finished with value: 0.08502190496150913 and parameters: {'model_type': 'mlp', 'hidden_dims': '[512, 256]', 'dropout': 0.1961929820334097, 'batch_norm': True, 'lr': 0.0001668415436705659, 'weight_decay': 5.522710335772481e-05, 'epochs': 171, 'loss': 'mse', 'optimizer': 'adam', 'graph_mode': 'off', 'use_snp_selection': True, 'num_snps': 19468}. Best is trial 15 with value: 0.12411614544257442.
[I 2025-12-05 15:36:52,768] Trial 30 finished with value: 0.10936528577278481 and parameters: {'model_type': 'mlp', 'hidden_dims': '[128, 64]', 'dropout': 0.2523135802350327, 'batch_norm': True, 'lr': 0.00037051724697189953, 'weight_decay': 5.793495333866542e-07, 'epochs': 74, 'loss': 'mse', 'optimizer': 'adam', 'graph_mode': 'off', 'use_snp_selection': False}. Best is trial 15 with value: 0.12411614544257442.
[I 2025-12-05 15:36:53,785] Trial 31 finished with value: 0.11574268594652264 and parameters: {'model_type': 'mlp', 'hidden_dims': '[512, 256]', 'dropout': 0.10425915441161626, 'batch_norm': True, 'lr': 0.00028747525178745334, 'weight_decay': 1.0128374732826168e-07, 'epochs': 77, 'loss': 'mse', 'optimizer': 'adam', 'graph_mode': 'off', 'use_snp_selection': False}. Best is trial 15 with value: 0.12411614544257442.
[I 2025-12-05 15:36:54,842] Trial 32 finished with value: 0.10747334815381578 and parameters: {'model_type': 'mlp', 'hidden_dims': '[512, 256]', 'dropout': 0.13635813740515265, 'batch_norm': True, 'lr': 0.0002879661083004595, 'weight_decay': 1.1430745819866395e-07, 'epochs': 91, 'loss': 'mse', 'optimizer': 'adam', 'graph_mode': 'off', 'use_snp_selection': False}. Best is trial 15 with value: 0.12411614544257442.
[I 2025-12-05 15:36:56,024] Trial 33 finished with value: 0.0961928159209528 and parameters: {'model_type': 'mlp', 'hidden_dims': '[512, 256]', 'dropout': 0.18518754557033928, 'batch_norm': True, 'lr': 8.613404321373549e-05, 'weight_decay': 4.279847920561997e-07, 'epochs': 127, 'loss': 'mse', 'optimizer': 'adam', 'graph_mode': 'off', 'use_snp_selection': False}. Best is trial 15 with value: 0.12411614544257442.
[I 2025-12-05 15:36:57,105] Trial 34 finished with value: 0.09562052883564814 and parameters: {'model_type': 'mlp', 'hidden_dims': '[512, 256]', 'dropout': 0.4776495763450488, 'batch_norm': True, 'lr': 0.0007036275498461669, 'weight_decay': 2.400918998336605e-07, 'epochs': 102, 'loss': 'mae', 'optimizer': 'adam', 'graph_mode': 'off', 'use_snp_selection': False}. Best is trial 15 with value: 0.12411614544257442.
[I 2025-12-05 15:36:57,781] Trial 35 finished with value: 0.07262311746825215 and parameters: {'model_type': 'mlp', 'hidden_dims': '[256, 128, 64]', 'dropout': 0.1683120547078507, 'batch_norm': False, 'lr': 0.00017472090850394908, 'weight_decay': 1.0631653455710715e-06, 'epochs': 51, 'loss': 'mse', 'optimizer': 'adam', 'graph_mode': 'off', 'use_snp_selection': False}. Best is trial 15 with value: 0.12411614544257442.
[I 2025-12-05 15:37:00,446] Trial 36 finished with value: 0.10300656140694858 and parameters: {'model_type': 'mlp', 'hidden_dims': '[256, 128]', 'dropout': 0.12551700598074536, 'batch_norm': True, 'lr': 0.000594238867456555, 'weight_decay': 1.9585452573457304e-05, 'epochs': 260, 'loss': 'mse', 'optimizer': 'adam', 'graph_mode': 'off', 'use_snp_selection': True, 'num_snps': 58661}. Best is trial 15 with value: 0.12411614544257442.
[I 2025-12-05 15:37:01,740] Trial 37 finished with value: 0.09213491515983692 and parameters: {'model_type': 'mlp', 'hidden_dims': '[512, 64]', 'dropout': 0.23659392267442045, 'batch_norm': True, 'lr': 4.446294938689996e-06, 'weight_decay': 1.0489616736577451e-07, 'epochs': 147, 'loss': 'mae', 'optimizer': 'adam', 'graph_mode': 'off', 'use_snp_selection': False}. Best is trial 15 with value: 0.12411614544257442.
[I 2025-12-05 15:37:03,105] Trial 38 finished with value: 0.07371428109762428 and parameters: {'model_type': 'mlp', 'hidden_dims': '[512, 128]', 'dropout': 0.19804196330988377, 'batch_norm': False, 'lr': 0.0002859350690164303, 'weight_decay': 2.154160401377309e-06, 'epochs': 159, 'loss': 'mse', 'optimizer': 'adam', 'graph_mode': 'off', 'use_snp_selection': True, 'num_snps': 19911}. Best is trial 15 with value: 0.12411614544257442.
[I 2025-12-05 15:37:04,949] Trial 39 finished with value: 0.0655422734703423 and parameters: {'model_type': 'mlp', 'hidden_dims': '[512, 256]', 'dropout': 0.593444752072398, 'batch_norm': True, 'lr': 1.0779022253881051e-05, 'weight_decay': 1.6848451309758648e-07, 'epochs': 298, 'loss': 'mse', 'optimizer': 'adam', 'graph_mode': 'off', 'use_snp_selection': False}. Best is trial 15 with value: 0.12411614544257442.
[I 2025-12-05 15:37:05,743] Trial 40 finished with value: 0.12606267566660975 and parameters: {'model_type': 'mlp', 'hidden_dims': '[256, 128]', 'dropout': 0.2660018599092984, 'batch_norm': True, 'lr': 7.210131760842061e-05, 'weight_decay': 7.87727696702013e-07, 'epochs': 80, 'loss': 'mae', 'optimizer': 'adam', 'graph_mode': 'off', 'use_snp_selection': False}. Best is trial 40 with value: 0.12606267566660975.
[I 2025-12-05 15:37:06,498] Trial 41 finished with value: 0.08880548881633181 and parameters: {'model_type': 'mlp', 'hidden_dims': '[256, 128]', 'dropout': 0.3587083232464429, 'batch_norm': True, 'lr': 4.319722832939693e-05, 'weight_decay': 5.755186574982408e-06, 'epochs': 82, 'loss': 'mae', 'optimizer': 'adam', 'graph_mode': 'off', 'use_snp_selection': False}. Best is trial 40 with value: 0.12606267566660975.
[I 2025-12-05 15:37:07,770] Trial 42 finished with value: 0.10242472988450703 and parameters: {'model_type': 'mlp', 'hidden_dims': '[256, 128]', 'dropout': 0.25941965113610005, 'batch_norm': True, 'lr': 8.372928127130468e-05, 'weight_decay': 8.328864730615302e-07, 'epochs': 348, 'loss': 'mae', 'optimizer': 'adam', 'graph_mode': 'off', 'use_snp_selection': False}. Best is trial 40 with value: 0.12606267566660975.
[I 2025-12-05 15:37:08,570] Trial 43 finished with value: 0.09365636290882559 and parameters: {'model_type': 'mlp', 'hidden_dims': '[256, 128]', 'dropout': 0.16721649992558799, 'batch_norm': True, 'lr': 6.882114593484904e-05, 'weight_decay': 4.511625625270562e-07, 'epochs': 114, 'loss': 'mae', 'optimizer': 'adam', 'graph_mode': 'off', 'use_snp_selection': False}. Best is trial 40 with value: 0.12606267566660975.
[I 2025-12-05 15:37:09,465] Trial 44 finished with value: 0.09784533017878579 and parameters: {'model_type': 'mlp', 'hidden_dims': '[512, 64]', 'dropout': 0.2697015048052274, 'batch_norm': True, 'lr': 0.00013980407319542177, 'weight_decay': 1.1201132899816576e-05, 'epochs': 56, 'loss': 'mae', 'optimizer': 'adam', 'graph_mode': 'off', 'use_snp_selection': False}. Best is trial 40 with value: 0.12606267566660975.
[I 2025-12-05 15:37:10,304] Trial 45 finished with value: 0.09595984819323052 and parameters: {'model_type': 'mlp', 'hidden_dims': '[256, 128]', 'dropout': 0.2158841238076764, 'batch_norm': True, 'lr': 0.00017921016036360506, 'weight_decay': 1.7919791963584647e-07, 'epochs': 133, 'loss': 'mae', 'optimizer': 'adam', 'graph_mode': 'off', 'use_snp_selection': False}. Best is trial 40 with value: 0.12606267566660975.
[I 2025-12-05 15:37:11,296] Trial 46 finished with value: 0.10399287313541562 and parameters: {'model_type': 'mlp', 'hidden_dims': '[512, 128]', 'dropout': 0.12574107579707483, 'batch_norm': True, 'lr': 5.132713086905542e-05, 'weight_decay': 2.140669802398178e-06, 'epochs': 81, 'loss': 'mae', 'optimizer': 'adam', 'graph_mode': 'off', 'use_snp_selection': False}. Best is trial 40 with value: 0.12606267566660975.
[I 2025-12-05 15:37:12,126] Trial 47 finished with value: -0.016715276854133022 and parameters: {'model_type': 'mlp', 'hidden_dims': '[512, 256]', 'dropout': 0.3034625927784656, 'batch_norm': False, 'lr': 0.00033626540432750977, 'weight_decay': 3.184998275725864e-05, 'epochs': 40, 'loss': 'mse', 'optimizer': 'adam', 'graph_mode': 'off', 'use_snp_selection': False}. Best is trial 40 with value: 0.12606267566660975.
[I 2025-12-05 15:37:12,811] Trial 48 finished with value: 0.002344988863973843 and parameters: {'model_type': 'mlp', 'hidden_dims': '[128, 64]', 'dropout': 0.23252167435424217, 'batch_norm': True, 'lr': 1.1170552432785515e-06, 'weight_decay': 4.450880003763499e-06, 'epochs': 99, 'loss': 'mse', 'optimizer': 'adam', 'graph_mode': 'off', 'use_snp_selection': False}. Best is trial 40 with value: 0.12606267566660975.
[I 2025-12-05 15:37:15,534] Trial 49 finished with value: 0.10124380248950018 and parameters: {'model_type': 'mlp', 'hidden_dims': '[512, 256]', 'dropout': 0.15373244949717563, 'batch_norm': True, 'lr': 0.00011109413424854321, 'weight_decay': 0.000287191443674494, 'epochs': 219, 'loss': 'mae', 'optimizer': 'adam', 'graph_mode': 'off', 'use_snp_selection': True, 'num_snps': 46888}. Best is trial 40 with value: 0.12606267566660975.
[I 2025-12-05 15:37:16,541] Trial 50 finished with value: 0.0556653434993184 and parameters: {'model_type': 'mlp', 'hidden_dims': '[512, 128]', 'dropout': 0.3598813612307641, 'batch_norm': True, 'lr': 2.6693831717472616e-06, 'weight_decay': 3.3708026344956745e-07, 'epochs': 61, 'loss': 'mse', 'optimizer': 'adam', 'graph_mode': 'off', 'use_snp_selection': False}. Best is trial 40 with value: 0.12606267566660975.
[I 2025-12-05 15:37:17,555] Trial 51 finished with value: 0.09925399917211436 and parameters: {'model_type': 'mlp', 'hidden_dims': '[512, 256]', 'dropout': 0.12837690793145357, 'batch_norm': True, 'lr': 0.000504055208572344, 'weight_decay': 2.357357225382004e-07, 'epochs': 83, 'loss': 'mse', 'optimizer': 'adam', 'graph_mode': 'off', 'use_snp_selection': False}. Best is trial 40 with value: 0.12606267566660975.
[I 2025-12-05 15:37:18,511] Trial 52 finished with value: 0.10706672674822378 and parameters: {'model_type': 'mlp', 'hidden_dims': '[512, 256]', 'dropout': 0.2035967913212913, 'batch_norm': True, 'lr': 0.00024325417481040526, 'weight_decay': 0.00015708254017785187, 'epochs': 71, 'loss': 'mse', 'optimizer': 'adam', 'graph_mode': 'off', 'use_snp_selection': False}. Best is trial 40 with value: 0.12606267566660975.
[I 2025-12-05 15:37:19,617] Trial 53 finished with value: 0.11392220174973902 and parameters: {'model_type': 'mlp', 'hidden_dims': '[512, 256]', 'dropout': 0.10039021530349765, 'batch_norm': True, 'lr': 0.0009657599315606532, 'weight_decay': 5.170190485522264e-07, 'epochs': 109, 'loss': 'mse', 'optimizer': 'adam', 'graph_mode': 'off', 'use_snp_selection': False}. Best is trial 40 with value: 0.12606267566660975.
[I 2025-12-05 15:37:20,717] Trial 54 finished with value: 0.12024289590167404 and parameters: {'model_type': 'mlp', 'hidden_dims': '[512, 256]', 'dropout': 0.11773196554858609, 'batch_norm': True, 'lr': 0.0007821447581857436, 'weight_decay': 5.619810056136609e-07, 'epochs': 109, 'loss': 'mse', 'optimizer': 'adam', 'graph_mode': 'off', 'use_snp_selection': False}. Best is trial 40 with value: 0.12606267566660975.
[I 2025-12-05 15:37:21,544] Trial 55 finished with value: 0.09346004005296721 and parameters: {'model_type': 'mlp', 'hidden_dims': '[256, 128, 64]', 'dropout': 0.15419767791621158, 'batch_norm': True, 'lr': 0.0002141342090291161, 'weight_decay': 1.2868882118568139e-06, 'epochs': 119, 'loss': 'mse', 'optimizer': 'adam', 'graph_mode': 'off', 'use_snp_selection': False}. Best is trial 40 with value: 0.12606267566660975.
[I 2025-12-05 15:37:22,402] Trial 56 finished with value: 0.12094793996790092 and parameters: {'model_type': 'mlp', 'hidden_dims': '[128, 64]', 'dropout': 0.12042718306850292, 'batch_norm': True, 'lr': 0.000772335177067586, 'weight_decay': 8.429862631271364e-07, 'epochs': 241, 'loss': 'mse', 'optimizer': 'adam', 'graph_mode': 'off', 'use_snp_selection': False}. Best is trial 40 with value: 0.12606267566660975.
[I 2025-12-05 15:37:23,192] Trial 57 finished with value: 0.0778687342399308 and parameters: {'model_type': 'mlp', 'hidden_dims': '[128, 64]', 'dropout': 0.17930181019283242, 'batch_norm': False, 'lr': 0.0008088816319967441, 'weight_decay': 6.734953172134553e-07, 'epochs': 241, 'loss': 'mse', 'optimizer': 'adam', 'graph_mode': 'off', 'use_snp_selection': False}. Best is trial 40 with value: 0.12606267566660975.
[I 2025-12-05 15:37:23,996] Trial 58 finished with value: 0.10033698712702055 and parameters: {'model_type': 'mlp', 'hidden_dims': '[128, 64]', 'dropout': 0.12044424059861024, 'batch_norm': True, 'lr': 0.00042784226479290153, 'weight_decay': 2.624409029231773e-06, 'epochs': 191, 'loss': 'mse', 'optimizer': 'adam', 'graph_mode': 'off', 'use_snp_selection': False}. Best is trial 40 with value: 0.12606267566660975.
[I 2025-12-05 15:37:24,868] Trial 59 finished with value: 0.10491606550252913 and parameters: {'model_type': 'mlp', 'hidden_dims': '[128, 64]', 'dropout': 0.15391115846889913, 'batch_norm': True, 'lr': 0.0005289013820760082, 'weight_decay': 1.7107738163389278e-06, 'epochs': 255, 'loss': 'mse', 'optimizer': 'adam', 'graph_mode': 'off', 'use_snp_selection': False}. Best is trial 40 with value: 0.12606267566660975.
[I 2025-12-05 15:37:26,438] Trial 60 finished with value: 0.06772840907086208 and parameters: {'model_type': 'mlp', 'hidden_dims': '[128, 64]', 'dropout': 0.41315624733227385, 'batch_norm': True, 'lr': 6.213674899553342e-05, 'weight_decay': 8.379734647289669e-07, 'epochs': 282, 'loss': 'mse', 'optimizer': 'adam', 'graph_mode': 'off', 'use_snp_selection': True, 'num_snps': 24139}. Best is trial 40 with value: 0.12606267566660975.
[I 2025-12-05 15:37:28,019] Trial 61 finished with value: 0.10767652589647961 and parameters: {'model_type': 'mlp', 'hidden_dims': '[512, 64]', 'dropout': 0.11773895070300787, 'batch_norm': True, 'lr': 0.0007156103978662749, 'weight_decay': 1.6678895433945654e-07, 'epochs': 237, 'loss': 'mse', 'optimizer': 'adam', 'graph_mode': 'off', 'use_snp_selection': False}. Best is trial 40 with value: 0.12606267566660975.
[I 2025-12-05 15:37:29,538] Trial 62 finished with value: 0.12578509334278867 and parameters: {'model_type': 'mlp', 'hidden_dims': '[512, 256]', 'dropout': 0.11367346512453348, 'batch_norm': True, 'lr': 0.00014287090437009722, 'weight_decay': 1.157559025201108e-06, 'epochs': 218, 'loss': 'mse', 'optimizer': 'adam', 'graph_mode': 'off', 'use_snp_selection': False}. Best is trial 40 with value: 0.12606267566660975.
[I 2025-12-05 15:37:31,028] Trial 63 finished with value: 0.11280702011777761 and parameters: {'model_type': 'mlp', 'hidden_dims': '[512, 128]', 'dropout': 0.19401118787460891, 'batch_norm': True, 'lr': 0.0001350713278835273, 'weight_decay': 1.058237602442343e-06, 'epochs': 210, 'loss': 'mse', 'optimizer': 'adam', 'graph_mode': 'off', 'use_snp_selection': False}. Best is trial 40 with value: 0.12606267566660975.
[I 2025-12-05 15:37:31,920] Trial 64 finished with value: 0.11930976737050569 and parameters: {'model_type': 'mlp', 'hidden_dims': '[128, 64]', 'dropout': 0.14008100028449916, 'batch_norm': True, 'lr': 9.204384419878463e-05, 'weight_decay': 1.294091687569356e-06, 'epochs': 268, 'loss': 'mse', 'optimizer': 'adam', 'graph_mode': 'off', 'use_snp_selection': False}. Best is trial 40 with value: 0.12606267566660975.
[I 2025-12-05 15:37:32,957] Trial 65 finished with value: 0.09047414989233689 and parameters: {'model_type': 'mlp', 'hidden_dims': '[256, 128]', 'dropout': 0.16235530923963398, 'batch_norm': True, 'lr': 0.00019559768587881752, 'weight_decay': 3.7450877448537096e-06, 'epochs': 228, 'loss': 'mse', 'optimizer': 'adam', 'graph_mode': 'off', 'use_snp_selection': False}. Best is trial 40 with value: 0.12606267566660975.
[I 2025-12-05 15:37:34,578] Trial 66 finished with value: 0.0972074278997085 and parameters: {'model_type': 'mlp', 'hidden_dims': '[512, 256]', 'dropout': 0.2440620604907203, 'batch_norm': True, 'lr': 7.353889087676606e-05, 'weight_decay': 6.655203855828981e-07, 'epochs': 246, 'loss': 'mse', 'optimizer': 'adam', 'graph_mode': 'off', 'use_snp_selection': False}. Best is trial 40 with value: 0.12606267566660975.
[I 2025-12-05 15:37:35,320] Trial 67 finished with value: 0.08467876747697524 and parameters: {'model_type': 'mlp', 'hidden_dims': '[128, 64]', 'dropout': 0.22832200861068574, 'batch_norm': True, 'lr': 3.501193403908469e-05, 'weight_decay': 0.0009446634395666513, 'epochs': 159, 'loss': 'mse', 'optimizer': 'adam', 'graph_mode': 'off', 'use_snp_selection': False}. Best is trial 40 with value: 0.12606267566660975.
[I 2025-12-05 15:37:36,698] Trial 68 finished with value: 0.10571674573615898 and parameters: {'model_type': 'mlp', 'hidden_dims': '[512, 256]', 'dropout': 0.27362268399046946, 'batch_norm': True, 'lr': 0.00015305344930200356, 'weight_decay': 3.677700939435545e-07, 'epochs': 181, 'loss': 'mae', 'optimizer': 'adam', 'graph_mode': 'off', 'use_snp_selection': False}. Best is trial 40 with value: 0.12606267566660975.
[I 2025-12-05 15:37:38,147] Trial 69 finished with value: 0.08951978342115952 and parameters: {'model_type': 'mlp', 'hidden_dims': '[512, 128]', 'dropout': 0.2933007202189488, 'batch_norm': False, 'lr': 2.8485139061354194e-05, 'weight_decay': 2.2280880243683963e-06, 'epochs': 198, 'loss': 'mse', 'optimizer': 'adam', 'graph_mode': 'off', 'use_snp_selection': False}. Best is trial 40 with value: 0.12606267566660975.
