[I 2025-12-05 15:12:07,496] Trial 2 finished with value: 0.03399124864860673 and parameters: {'model_type': 'mlp', 'hidden_dims': '[256, 128, 64]', 'dropout': 0.41314357415569625, 'batch_norm': False, 'lr': 3.952233718592101e-06, 'weight_decay': 0.00026754769258252603, 'epochs': 149, 'loss': 'mse', 'optimizer': 'adam', 'graph_mode': 'off', 'use_snp_selection': True, 'num_snps': 11571}. Best is trial 1 with value: 0.11808800374138019.
[I 2025-12-05 15:12:09,571] Trial 3 finished with value: 0.07307976719544752 and parameters: {'model_type': 'mlp', 'hidden_dims': '[512, 64]', 'dropout': 0.5938127374509361, 'batch_norm': False, 'lr': 5.67704586114731e-06, 'weight_decay': 2.4518087630137052e-05, 'epochs': 320, 'loss': 'mae', 'optimizer': 'adam', 'graph_mode': 'off', 'use_snp_selection': False}. Best is trial 1 with value: 0.11808800374138019.
[I 2025-12-05 15:12:11,899] Trial 4 finished with value: 0.05237207354922657 and parameters: {'model_type': 'mlp', 'hidden_dims': '[512, 128]', 'dropout': 0.25746343592134413, 'batch_norm': True, 'lr': 1.3467657668402788e-06, 'weight_decay': 0.00033087251918647806, 'epochs': 277, 'loss': 'mse', 'optimizer': 'adam', 'graph_mode': 'off', 'use_snp_selection': True, 'num_snps': 36675}. Best is trial 1 with value: 0.11808800374138019.
[I 2025-12-05 15:12:13,760] Trial 5 finished with value: 0.08565065797364535 and parameters: {'model_type': 'mlp', 'hidden_dims': '[512, 64]', 'dropout': 0.38275350994408375, 'batch_norm': True, 'lr': 1.5586664309232824e-06, 'weight_decay': 0.0008227664668621182, 'epochs': 145, 'loss': 'mae', 'optimizer': 'adam', 'graph_mode': 'off', 'use_snp_selection': True, 'num_snps': 32148}. Best is trial 1 with value: 0.11808800374138019.
[I 2025-12-05 15:12:14,846] Trial 6 finished with value: 0.11167231581401074 and parameters: {'model_type': 'mlp', 'hidden_dims': '[256, 128]', 'dropout': 0.3930109900265879, 'batch_norm': False, 'lr': 4.892964372128395e-05, 'weight_decay': 1.5809549317992182e-06, 'epochs': 199, 'loss': 'mse', 'optimizer': 'adam', 'graph_mode': 'off', 'use_snp_selection': False}. Best is trial 1 with value: 0.11808800374138019.
[I 2025-12-05 15:12:15,986] Trial 7 finished with value: 0.10136552338819454 and parameters: {'model_type': 'mlp', 'hidden_dims': '[512, 256]', 'dropout': 0.15343979219678458, 'batch_norm': True, 'lr': 6.234003099047341e-05, 'weight_decay': 3.894760610535477e-07, 'epochs': 97, 'loss': 'mse', 'optimizer': 'adam', 'graph_mode': 'off', 'use_snp_selection': False}. Best is trial 1 with value: 0.11808800374138019.
[I 2025-12-05 15:12:18,011] Trial 8 finished with value: 0.11660971113579104 and parameters: {'model_type': 'mlp', 'hidden_dims': '[512, 128]', 'dropout': 0.10743001231661406, 'batch_norm': True, 'lr': 0.00023728538449271062, 'weight_decay': 1.7629071578048637e-05, 'epochs': 312, 'loss': 'mae', 'optimizer': 'adam', 'graph_mode': 'off', 'use_snp_selection': False}. Best is trial 1 with value: 0.11808800374138019.
[I 2025-12-05 15:12:19,455] Trial 9 finished with value: 0.09750802100262383 and parameters: {'model_type': 'mlp', 'hidden_dims': '[512, 64]', 'dropout': 0.14505336736221927, 'batch_norm': True, 'lr': 5.8619638388111826e-05, 'weight_decay': 6.200156172669308e-07, 'epochs': 175, 'loss': 'mse', 'optimizer': 'adam', 'graph_mode': 'off', 'use_snp_selection': False}. Best is trial 1 with value: 0.11808800374138019.
[I 2025-12-05 15:12:20,625] Trial 10 finished with value: 0.1060495504975388 and parameters: {'model_type': 'mlp', 'hidden_dims': '[256, 128]', 'dropout': 0.5365714961141473, 'batch_norm': False, 'lr': 0.00032955828969150785, 'weight_decay': 3.381683344261174e-06, 'epochs': 236, 'loss': 'mae', 'optimizer': 'adam', 'graph_mode': 'off', 'use_snp_selection': False}. Best is trial 1 with value: 0.11808800374138019.
[I 2025-12-05 15:12:22,542] Trial 11 finished with value: 0.1069093659608137 and parameters: {'model_type': 'mlp', 'hidden_dims': '[512, 128]', 'dropout': 0.2851700052976396, 'batch_norm': True, 'lr': 0.0005194831231105461, 'weight_decay': 7.0869802591332905e-06, 'epochs': 292, 'loss': 'mae', 'optimizer': 'adam', 'graph_mode': 'off', 'use_snp_selection': False}. Best is trial 1 with value: 0.11808800374138019.
[I 2025-12-05 15:12:24,304] Trial 12 finished with value: 0.11840053742489272 and parameters: {'model_type': 'mlp', 'hidden_dims': '[512, 128]', 'dropout': 0.4779690972965961, 'batch_norm': True, 'lr': 0.00026576228959612443, 'weight_decay': 3.319617863684014e-05, 'epochs': 246, 'loss': 'mae', 'optimizer': 'adam', 'graph_mode': 'off', 'use_snp_selection': False}. Best is trial 12 with value: 0.11840053742489272.
[I 2025-12-05 15:12:25,459] Trial 13 finished with value: 0.10058542308798223 and parameters: {'model_type': 'mlp', 'hidden_dims': '[256, 128]', 'dropout': 0.48916749677222215, 'batch_norm': True, 'lr': 0.00015553205185400706, 'weight_decay': 8.427566375784555e-05, 'epochs': 237, 'loss': 'mae', 'optimizer': 'adam', 'graph_mode': 'off', 'use_snp_selection': False}. Best is trial 12 with value: 0.11840053742489272.
[I 2025-12-05 15:12:26,141] Trial 14 finished with value: 0.07256715868445042 and parameters: {'model_type': 'mlp', 'hidden_dims': '[128, 64]', 'dropout': 0.47122472341281907, 'batch_norm': True, 'lr': 1.3794312407790804e-05, 'weight_decay': 1.1414924884997386e-07, 'epochs': 42, 'loss': 'mae', 'optimizer': 'adam', 'graph_mode': 'off', 'use_snp_selection': False}. Best is trial 12 with value: 0.11840053742489272.
[I 2025-12-05 15:12:27,358] Trial 15 finished with value: 0.1056951346576982 and parameters: {'model_type': 'mlp', 'hidden_dims': '[256, 128, 64]', 'dropout': 0.3179232639766164, 'batch_norm': True, 'lr': 0.0001300623160463598, 'weight_decay': 7.236536090132001e-06, 'epochs': 246, 'loss': 'mae', 'optimizer': 'adam', 'graph_mode': 'off', 'use_snp_selection': False}. Best is trial 12 with value: 0.11840053742489272.
[I 2025-12-05 15:12:28,932] Trial 16 finished with value: 0.11477145442852489 and parameters: {'model_type': 'mlp', 'hidden_dims': '[512, 256]', 'dropout': 0.4610919536169237, 'batch_norm': True, 'lr': 0.0007236437471302109, 'weight_decay': 7.363319138383542e-05, 'epochs': 206, 'loss': 'mae', 'optimizer': 'adam', 'graph_mode': 'off', 'use_snp_selection': False}. Best is trial 12 with value: 0.11840053742489272.
[I 2025-12-05 15:12:30,128] Trial 17 finished with value: 0.08663592624848945 and parameters: {'model_type': 'mlp', 'hidden_dims': '[256, 128]', 'dropout': 0.5755819959837862, 'batch_norm': True, 'lr': 2.349300150160787e-05, 'weight_decay': 2.5157504144511443e-05, 'epochs': 253, 'loss': 'mae', 'optimizer': 'adam', 'graph_mode': 'off', 'use_snp_selection': False}. Best is trial 12 with value: 0.11840053742489272.
[I 2025-12-05 15:12:33,506] Trial 18 finished with value: 0.10154225824641633 and parameters: {'model_type': 'mlp', 'hidden_dims': '[512, 128]', 'dropout': 0.5202965987697896, 'batch_norm': False, 'lr': 0.0009735993119677173, 'weight_decay': 2.9908660712327044e-06, 'epochs': 273, 'loss': 'mae', 'optimizer': 'adam', 'graph_mode': 'off', 'use_snp_selection': True, 'num_snps': 58241}. Best is trial 12 with value: 0.11840053742489272.
[I 2025-12-05 15:12:35,179] Trial 19 finished with value: 0.10655249000528164 and parameters: {'model_type': 'mlp', 'hidden_dims': '[512, 128]', 'dropout': 0.42887889798689083, 'batch_norm': True, 'lr': 9.609568325800303e-05, 'weight_decay': 0.00017554947736104132, 'epochs': 218, 'loss': 'mae', 'optimizer': 'adam', 'graph_mode': 'off', 'use_snp_selection': False}. Best is trial 12 with value: 0.11840053742489272.
[I 2025-12-05 15:12:36,184] Trial 20 finished with value: 0.0604808914998308 and parameters: {'model_type': 'mlp', 'hidden_dims': '[256, 128]', 'dropout': 0.34699893229782636, 'batch_norm': True, 'lr': 1.8325806904091275e-05, 'weight_decay': 1.0710814822721478e-05, 'epochs': 171, 'loss': 'mae', 'optimizer': 'adam', 'graph_mode': 'off', 'use_snp_selection': False}. Best is trial 12 with value: 0.11840053742489272.
[I 2025-12-05 15:12:38,165] Trial 21 finished with value: 0.10660929663200547 and parameters: {'model_type': 'mlp', 'hidden_dims': '[512, 128]', 'dropout': 0.2398960702664363, 'batch_norm': True, 'lr': 0.0002653433610323151, 'weight_decay': 2.180457433128581e-05, 'epochs': 308, 'loss': 'mae', 'optimizer': 'adam', 'graph_mode': 'off', 'use_snp_selection': False}. Best is trial 12 with value: 0.11840053742489272.
[I 2025-12-05 15:12:40,282] Trial 22 finished with value: 0.0925985288639778 and parameters: {'model_type': 'mlp', 'hidden_dims': '[512, 128]', 'dropout': 0.4477617025669458, 'batch_norm': True, 'lr': 0.00021860760145497453, 'weight_decay': 1.7049679549913898e-05, 'epochs': 345, 'loss': 'mae', 'optimizer': 'adam', 'graph_mode': 'off', 'use_snp_selection': False}. Best is trial 12 with value: 0.11840053742489272.
[I 2025-12-05 15:12:42,194] Trial 23 finished with value: 0.11569105409007359 and parameters: {'model_type': 'mlp', 'hidden_dims': '[512, 128]', 'dropout': 0.5202396303974055, 'batch_norm': True, 'lr': 0.0003016140254855497, 'weight_decay': 4.592285846945853e-05, 'epochs': 292, 'loss': 'mae', 'optimizer': 'adam', 'graph_mode': 'off', 'use_snp_selection': False}. Best is trial 12 with value: 0.11840053742489272.
[I 2025-12-05 15:12:44,011] Trial 24 finished with value: 0.12485782695779535 and parameters: {'model_type': 'mlp', 'hidden_dims': '[512, 128]', 'dropout': 0.11378991231435236, 'batch_norm': True, 'lr': 0.00011620507566862266, 'weight_decay': 3.811495116556715e-06, 'epochs': 269, 'loss': 'mae', 'optimizer': 'adam', 'graph_mode': 'off', 'use_snp_selection': False}. Best is trial 24 with value: 0.12485782695779535.
[I 2025-12-05 15:12:45,829] Trial 25 finished with value: 0.11063805766018656 and parameters: {'model_type': 'mlp', 'hidden_dims': '[512, 256]', 'dropout': 0.37656414946855676, 'batch_norm': True, 'lr': 3.4253284702056064e-05, 'weight_decay': 3.2188237064413086e-06, 'epochs': 269, 'loss': 'mae', 'optimizer': 'adam', 'graph_mode': 'off', 'use_snp_selection': False}. Best is trial 24 with value: 0.12485782695779535.
[I 2025-12-05 15:12:46,848] Trial 26 finished with value: 0.10271809647138738 and parameters: {'model_type': 'mlp', 'hidden_dims': '[256, 128, 64]', 'dropout': 0.3314890674619219, 'batch_norm': True, 'lr': 9.41515330557756e-05, 'weight_decay': 8.374698296008222e-07, 'epochs': 221, 'loss': 'mse', 'optimizer': 'adam', 'graph_mode': 'off', 'use_snp_selection': True, 'num_snps': 3842}. Best is trial 24 with value: 0.12485782695779535.
[I 2025-12-05 15:12:47,720] Trial 27 finished with value: 0.056956663639921926 and parameters: {'model_type': 'mlp', 'hidden_dims': '[128, 64]', 'dropout': 0.5627475224868568, 'batch_norm': False, 'lr': 0.0005324499379430711, 'weight_decay': 4.881339110858778e-06, 'epochs': 258, 'loss': 'mae', 'optimizer': 'adam', 'graph_mode': 'off', 'use_snp_selection': False}. Best is trial 24 with value: 0.12485782695779535.
[I 2025-12-05 15:12:48,745] Trial 28 finished with value: 0.1018346342153275 and parameters: {'model_type': 'mlp', 'hidden_dims': '[256, 128]', 'dropout': 0.20283647112152728, 'batch_norm': True, 'lr': 1.094990034050885e-05, 'weight_decay': 1.973842484620069e-06, 'epochs': 181, 'loss': 'mae', 'optimizer': 'adam', 'graph_mode': 'off', 'use_snp_selection': False}. Best is trial 24 with value: 0.12485782695779535.
[I 2025-12-05 15:12:50,289] Trial 29 finished with value: 0.08658811473834553 and parameters: {'model_type': 'mlp', 'hidden_dims': '[128, 64]', 'dropout': 0.4785776285433228, 'batch_norm': True, 'lr': 9.670498830669657e-05, 'weight_decay': 5.5227103357724904e-05, 'epochs': 329, 'loss': 'mae', 'optimizer': 'adam', 'graph_mode': 'off', 'use_snp_selection': True, 'num_snps': 19468}. Best is trial 24 with value: 0.12485782695779535.
[I 2025-12-05 15:12:52,223] Trial 30 finished with value: 0.0947690861845335 and parameters: {'model_type': 'mlp', 'hidden_dims': '[512, 128]', 'dropout': 0.3112239631916609, 'batch_norm': True, 'lr': 3.1861705971816615e-05, 'weight_decay': 1.191092048485094e-05, 'epochs': 289, 'loss': 'mae', 'optimizer': 'adam', 'graph_mode': 'off', 'use_snp_selection': False}. Best is trial 24 with value: 0.12485782695779535.
[I 2025-12-05 15:12:54,210] Trial 31 finished with value: 0.11652244068598185 and parameters: {'model_type': 'mlp', 'hidden_dims': '[512, 128]', 'dropout': 0.10131407579169126, 'batch_norm': True, 'lr': 0.00016887867396865006, 'weight_decay': 3.1517544124973306e-05, 'epochs': 310, 'loss': 'mae', 'optimizer': 'adam', 'graph_mode': 'off', 'use_snp_selection': False}. Best is trial 24 with value: 0.12485782695779535.
[I 2025-12-05 15:12:56,178] Trial 32 finished with value: 0.10558985342255328 and parameters: {'model_type': 'mlp', 'hidden_dims': '[512, 128]', 'dropout': 0.10325635992281684, 'batch_norm': True, 'lr': 0.00047679472826850643, 'weight_decay': 1.182241750609532e-05, 'epochs': 304, 'loss': 'mae', 'optimizer': 'adam', 'graph_mode': 'off', 'use_snp_selection': False}. Best is trial 24 with value: 0.12485782695779535.
[I 2025-12-05 15:12:58,328] Trial 33 finished with value: 0.10812843117319837 and parameters: {'model_type': 'mlp', 'hidden_dims': '[512, 128]', 'dropout': 0.16745231117324713, 'batch_norm': True, 'lr': 0.00020546418785766837, 'weight_decay': 0.00014369187106943305, 'epochs': 350, 'loss': 'mae', 'optimizer': 'adam', 'graph_mode': 'off', 'use_snp_selection': False}. Best is trial 24 with value: 0.12485782695779535.
[I 2025-12-05 15:13:01,520] Trial 34 finished with value: 0.11244318158622112 and parameters: {'model_type': 'mlp', 'hidden_dims': '[512, 128]', 'dropout': 0.19976918759413487, 'batch_norm': False, 'lr': 0.00012462085800388762, 'weight_decay': 6.270141987717733e-06, 'epochs': 227, 'loss': 'mse', 'optimizer': 'adam', 'graph_mode': 'off', 'use_snp_selection': True, 'num_snps': 58283}. Best is trial 24 with value: 0.12485782695779535.
[I 2025-12-05 15:13:03,618] Trial 35 finished with value: 0.07360859781939028 and parameters: {'model_type': 'mlp', 'hidden_dims': '[512, 64]', 'dropout': 0.13717864587562753, 'batch_norm': True, 'lr': 3.7076321611887164e-06, 'weight_decay': 3.552810802854085e-05, 'epochs': 329, 'loss': 'mae', 'optimizer': 'adam', 'graph_mode': 'off', 'use_snp_selection': False}. Best is trial 24 with value: 0.12485782695779535.
[I 2025-12-05 15:13:05,403] Trial 36 finished with value: 0.09685842592292587 and parameters: {'model_type': 'mlp', 'hidden_dims': '[512, 128]', 'dropout': 0.4129921740471365, 'batch_norm': True, 'lr': 0.00039656681642768327, 'weight_decay': 1.5929944860269343e-05, 'epochs': 261, 'loss': 'mae', 'optimizer': 'adam', 'graph_mode': 'off', 'use_snp_selection': False}. Best is trial 24 with value: 0.12485782695779535.
[I 2025-12-05 15:13:06,922] Trial 37 finished with value: 0.10801434071453526 and parameters: {'model_type': 'mlp', 'hidden_dims': '[256, 128, 64]', 'dropout': 0.2294105538380643, 'batch_norm': False, 'lr': 4.6029796337746954e-05, 'weight_decay': 0.0006562118741840971, 'epochs': 281, 'loss': 'mse', 'optimizer': 'adam', 'graph_mode': 'off', 'use_snp_selection': True, 'num_snps': 22282}. Best is trial 24 with value: 0.12485782695779535.
[I 2025-12-05 15:13:07,895] Trial 38 finished with value: 0.11424308372133406 and parameters: {'model_type': 'mlp', 'hidden_dims': '[256, 128]', 'dropout': 0.1679389978680837, 'batch_norm': True, 'lr': 6.393729861524781e-05, 'weight_decay': 1.5199822575384071e-06, 'epochs': 151, 'loss': 'mae', 'optimizer': 'adam', 'graph_mode': 'off', 'use_snp_selection': False}. Best is trial 24 with value: 0.12485782695779535.
[I 2025-12-05 15:13:09,459] Trial 39 finished with value: 0.10662945914417303 and parameters: {'model_type': 'mlp', 'hidden_dims': '[512, 64]', 'dropout': 0.12621696378936748, 'batch_norm': True, 'lr': 8.295091555484676e-05, 'weight_decay': 0.00010412398872024411, 'epochs': 203, 'loss': 'mse', 'optimizer': 'adam', 'graph_mode': 'off', 'use_snp_selection': False}. Best is trial 24 with value: 0.12485782695779535.
[I 2025-12-05 15:13:11,173] Trial 40 finished with value: 0.12063460321509194 and parameters: {'model_type': 'mlp', 'hidden_dims': '[512, 256]', 'dropout': 0.2836937401811041, 'batch_norm': False, 'lr': 0.0002226591182593418, 'weight_decay': 4.926161963696128e-06, 'epochs': 246, 'loss': 'mae', 'optimizer': 'adam', 'graph_mode': 'off', 'use_snp_selection': False}. Best is trial 24 with value: 0.12485782695779535.
[I 2025-12-05 15:13:12,907] Trial 41 finished with value: 0.10269012476622609 and parameters: {'model_type': 'mlp', 'hidden_dims': '[512, 256]', 'dropout': 0.3716081310069049, 'batch_norm': False, 'lr': 0.00021402694140943936, 'weight_decay': 4.4282888255613135e-06, 'epochs': 242, 'loss': 'mae', 'optimizer': 'adam', 'graph_mode': 'off', 'use_snp_selection': False}. Best is trial 24 with value: 0.12485782695779535.
[I 2025-12-05 15:13:14,726] Trial 42 finished with value: 0.1163978937763633 and parameters: {'model_type': 'mlp', 'hidden_dims': '[512, 256]', 'dropout': 0.4067404904284281, 'batch_norm': False, 'lr': 0.0003460917046763052, 'weight_decay': 2.083653108980123e-06, 'epochs': 271, 'loss': 'mae', 'optimizer': 'adam', 'graph_mode': 'off', 'use_snp_selection': False}. Best is trial 24 with value: 0.12485782695779535.
[I 2025-12-05 15:13:16,738] Trial 43 finished with value: 0.1112121299619368 and parameters: {'model_type': 'mlp', 'hidden_dims': '[512, 256]', 'dropout': 0.2625830263663376, 'batch_norm': False, 'lr': 0.0001646234770307967, 'weight_decay': 7.493510681065699e-06, 'epochs': 317, 'loss': 'mae', 'optimizer': 'adam', 'graph_mode': 'off', 'use_snp_selection': False}. Best is trial 24 with value: 0.12485782695779535.
[I 2025-12-05 15:13:18,381] Trial 44 finished with value: 0.10200732251868566 and parameters: {'model_type': 'mlp', 'hidden_dims': '[512, 256]', 'dropout': 0.4379305931998006, 'batch_norm': False, 'lr': 0.00012413372225295635, 'weight_decay': 9.734382745160036e-07, 'epochs': 218, 'loss': 'mae', 'optimizer': 'adam', 'graph_mode': 'off', 'use_snp_selection': False}. Best is trial 24 with value: 0.12485782695779535.
[I 2025-12-05 15:13:19,516] Trial 45 finished with value: 0.07493887304298244 and parameters: {'model_type': 'mlp', 'hidden_dims': '[256, 128]', 'dropout': 0.17684136777400572, 'batch_norm': False, 'lr': 4.452533147028259e-05, 'weight_decay': 1.8143249450089866e-05, 'epochs': 234, 'loss': 'mae', 'optimizer': 'adam', 'graph_mode': 'off', 'use_snp_selection': False}. Best is trial 24 with value: 0.12485782695779535.
[I 2025-12-05 15:13:21,319] Trial 46 finished with value: 0.10061705181205503 and parameters: {'model_type': 'mlp', 'hidden_dims': '[512, 128]', 'dropout': 0.2880612633679474, 'batch_norm': True, 'lr': 7.118854299451144e-05, 'weight_decay': 4.0420224533656057e-07, 'epochs': 255, 'loss': 'mae', 'optimizer': 'adam', 'graph_mode': 'off', 'use_snp_selection': False}. Best is trial 24 with value: 0.12485782695779535.
[I 2025-12-05 15:13:22,026] Trial 47 finished with value: 0.07460378090564584 and parameters: {'model_type': 'mlp', 'hidden_dims': '[128, 64]', 'dropout': 0.5084522846653824, 'batch_norm': False, 'lr': 0.0007653983466276416, 'weight_decay': 4.128975881978747e-05, 'epochs': 98, 'loss': 'mse', 'optimizer': 'adam', 'graph_mode': 'off', 'use_snp_selection': False}. Best is trial 24 with value: 0.12485782695779535.
[I 2025-12-05 15:13:24,401] Trial 48 finished with value: 0.08660239688524055 and parameters: {'model_type': 'mlp', 'hidden_dims': '[256, 128, 64]', 'dropout': 0.4965392175291404, 'batch_norm': True, 'lr': 0.0002560678577835175, 'weight_decay': 9.354513025486695e-06, 'epochs': 296, 'loss': 'mae', 'optimizer': 'adam', 'graph_mode': 'off', 'use_snp_selection': True, 'num_snps': 43224}. Best is trial 24 with value: 0.12485782695779535.
[I 2025-12-05 15:13:26,337] Trial 49 finished with value: 0.10826062298020804 and parameters: {'model_type': 'mlp', 'hidden_dims': '[512, 128]', 'dropout': 0.12385865275020295, 'batch_norm': True, 'lr': 0.00012500676954650908, 'weight_decay': 5.057866708278841e-06, 'epochs': 283, 'loss': 'mae', 'optimizer': 'adam', 'graph_mode': 'off', 'use_snp_selection': False}. Best is trial 24 with value: 0.12485782695779535.
[I 2025-12-05 15:13:27,395] Trial 50 finished with value: 0.09867445466535256 and parameters: {'model_type': 'mlp', 'hidden_dims': '[256, 128]', 'dropout': 0.5498627388336519, 'batch_norm': True, 'lr': 0.0005877459629808991, 'weight_decay': 2.5219159710022676e-05, 'epochs': 191, 'loss': 'mae', 'optimizer': 'adam', 'graph_mode': 'off', 'use_snp_selection': False}. Best is trial 24 with value: 0.12485782695779535.
[I 2025-12-05 15:13:29,418] Trial 51 finished with value: 0.10778663634444416 and parameters: {'model_type': 'mlp', 'hidden_dims': '[512, 128]', 'dropout': 0.11642629919609454, 'batch_norm': True, 'lr': 0.00017844720148376387, 'weight_decay': 2.8369347088427724e-05, 'epochs': 318, 'loss': 'mae', 'optimizer': 'adam', 'graph_mode': 'off', 'use_snp_selection': False}. Best is trial 24 with value: 0.12485782695779535.
[I 2025-12-05 15:13:31,410] Trial 52 finished with value: 0.06938896391625098 and parameters: {'model_type': 'mlp', 'hidden_dims': '[512, 128]', 'dropout': 0.15724837154085453, 'batch_norm': True, 'lr': 1.0921708743861942e-06, 'weight_decay': 6.776710995196693e-05, 'epochs': 311, 'loss': 'mae', 'optimizer': 'adam', 'graph_mode': 'off', 'use_snp_selection': False}. Best is trial 24 with value: 0.12485782695779535.
[I 2025-12-05 15:13:33,393] Trial 53 finished with value: 0.10568963202226962 and parameters: {'model_type': 'mlp', 'hidden_dims': '[512, 128]', 'dropout': 0.10030528576340968, 'batch_norm': True, 'lr': 0.00015287215055530853, 'weight_decay': 1.6378141679736883e-05, 'epochs': 300, 'loss': 'mae', 'optimizer': 'adam', 'graph_mode': 'off', 'use_snp_selection': False}. Best is trial 24 with value: 0.12485782695779535.
