[I 2025-12-05 15:16:36,136] Trial 3 finished with value: 0.0634759178484035 and parameters: {'model_type': 'mlp', 'hidden_dims': '[512, 64]', 'dropout': 0.5938127374509361, 'batch_norm': False, 'lr': 5.67704586114731e-06, 'weight_decay': 2.4518087630137052e-05, 'epochs': 320, 'loss': 'mae', 'optimizer': 'adam', 'graph_mode': 'off', 'use_snp_selection': False}. Best is trial 3 with value: 0.0634759178484035.
[I 2025-12-05 15:16:39,296] Trial 4 finished with value: 0.02445314645578285 and parameters: {'model_type': 'mlp', 'hidden_dims': '[512, 128]', 'dropout': 0.25746343592134413, 'batch_norm': True, 'lr': 1.3467657668402788e-06, 'weight_decay': 0.00033087251918647806, 'epochs': 277, 'loss': 'mse', 'optimizer': 'adam', 'graph_mode': 'off', 'use_snp_selection': True, 'num_snps': 36675}. Best is trial 3 with value: 0.0634759178484035.
[I 2025-12-05 15:16:41,880] Trial 5 finished with value: -0.03664846775214883 and parameters: {'model_type': 'mlp', 'hidden_dims': '[512, 64]', 'dropout': 0.38275350994408375, 'batch_norm': True, 'lr': 1.5586664309232824e-06, 'weight_decay': 0.0008227664668621182, 'epochs': 145, 'loss': 'mae', 'optimizer': 'adam', 'graph_mode': 'off', 'use_snp_selection': True, 'num_snps': 32148}. Best is trial 3 with value: 0.0634759178484035.
[I 2025-12-05 15:16:43,218] Trial 6 finished with value: 0.06747427401321617 and parameters: {'model_type': 'mlp', 'hidden_dims': '[256, 128]', 'dropout': 0.3930109900265879, 'batch_norm': False, 'lr': 4.892964372128395e-05, 'weight_decay': 1.5809549317992182e-06, 'epochs': 199, 'loss': 'mse', 'optimizer': 'adam', 'graph_mode': 'off', 'use_snp_selection': False}. Best is trial 6 with value: 0.06747427401321617.
[I 2025-12-05 15:16:44,662] Trial 7 finished with value: 0.08431559764024452 and parameters: {'model_type': 'mlp', 'hidden_dims': '[512, 256]', 'dropout': 0.15343979219678458, 'batch_norm': True, 'lr': 6.234003099047341e-05, 'weight_decay': 3.894760610535477e-07, 'epochs': 97, 'loss': 'mse', 'optimizer': 'adam', 'graph_mode': 'off', 'use_snp_selection': False}. Best is trial 7 with value: 0.08431559764024452.
[I 2025-12-05 15:16:47,770] Trial 8 finished with value: 0.08591511750985631 and parameters: {'model_type': 'mlp', 'hidden_dims': '[512, 128]', 'dropout': 0.10743001231661406, 'batch_norm': True, 'lr': 0.00023728538449271062, 'weight_decay': 1.7629071578048637e-05, 'epochs': 312, 'loss': 'mae', 'optimizer': 'adam', 'graph_mode': 'off', 'use_snp_selection': False}. Best is trial 8 with value: 0.08591511750985631.
[I 2025-12-05 15:16:49,812] Trial 9 finished with value: 0.07860493659637847 and parameters: {'model_type': 'mlp', 'hidden_dims': '[512, 64]', 'dropout': 0.14505336736221927, 'batch_norm': True, 'lr': 5.8619638388111826e-05, 'weight_decay': 6.200156172669308e-07, 'epochs': 175, 'loss': 'mse', 'optimizer': 'adam', 'graph_mode': 'off', 'use_snp_selection': False}. Best is trial 8 with value: 0.08591511750985631.
[I 2025-12-05 15:16:50,958] Trial 10 finished with value: -0.010812801205671636 and parameters: {'model_type': 'mlp', 'hidden_dims': '[512, 128]', 'dropout': 0.2800030442581858, 'batch_norm': False, 'lr': 0.0004919806695968258, 'weight_decay': 2.9953888095455486e-06, 'epochs': 55, 'loss': 'mae', 'optimizer': 'adam', 'graph_mode': 'off', 'use_snp_selection': False}. Best is trial 8 with value: 0.08591511750985631.
[I 2025-12-05 15:16:52,246] Trial 11 finished with value: 0.056146219662866925 and parameters: {'model_type': 'mlp', 'hidden_dims': '[512, 256]', 'dropout': 0.10095648685224448, 'batch_norm': True, 'lr': 0.0003926892266729099, 'weight_decay': 3.172181990533228e-07, 'epochs': 70, 'loss': 'mse', 'optimizer': 'adam', 'graph_mode': 'off', 'use_snp_selection': False}. Best is trial 8 with value: 0.08591511750985631.
[I 2025-12-05 15:16:53,865] Trial 12 finished with value: 0.081116103577647 and parameters: {'model_type': 'mlp', 'hidden_dims': '[512, 256]', 'dropout': 0.18206399419301494, 'batch_norm': True, 'lr': 0.00026576228959612443, 'weight_decay': 1.3081036432574914e-07, 'epochs': 115, 'loss': 'mae', 'optimizer': 'adam', 'graph_mode': 'off', 'use_snp_selection': False}. Best is trial 8 with value: 0.08591511750985631.
[I 2025-12-05 15:16:56,364] Trial 13 finished with value: 0.07355558947726955 and parameters: {'model_type': 'mlp', 'hidden_dims': '[512, 256]', 'dropout': 0.28178980110198326, 'batch_norm': True, 'lr': 0.0001448400953749671, 'weight_decay': 3.475237872468419e-06, 'epochs': 232, 'loss': 'mse', 'optimizer': 'adam', 'graph_mode': 'off', 'use_snp_selection': False}. Best is trial 8 with value: 0.08591511750985631.
[I 2025-12-05 15:16:57,775] Trial 14 finished with value: 0.039521779610826584 and parameters: {'model_type': 'mlp', 'hidden_dims': '[512, 128]', 'dropout': 0.12319334351899142, 'batch_norm': True, 'lr': 1.6126431293848547e-05, 'weight_decay': 6.0578250711704925e-05, 'epochs': 93, 'loss': 'mse', 'optimizer': 'adam', 'graph_mode': 'off', 'use_snp_selection': False}. Best is trial 8 with value: 0.08591511750985631.
[I 2025-12-05 15:16:58,888] Trial 15 finished with value: 0.06633669222795996 and parameters: {'model_type': 'mlp', 'hidden_dims': '[128, 64]', 'dropout': 0.2144644905818855, 'batch_norm': True, 'lr': 2.002944590579291e-05, 'weight_decay': 7.236536090132001e-06, 'epochs': 297, 'loss': 'mae', 'optimizer': 'adam', 'graph_mode': 'off', 'use_snp_selection': False}. Best is trial 8 with value: 0.08591511750985631.
[I 2025-12-05 15:17:00,473] Trial 16 finished with value: 0.07076917748586968 and parameters: {'model_type': 'mlp', 'hidden_dims': '[256, 128, 64]', 'dropout': 0.558513902174278, 'batch_norm': True, 'lr': 0.0001512632734045256, 'weight_decay': 7.089073588272327e-07, 'epochs': 258, 'loss': 'mae', 'optimizer': 'adam', 'graph_mode': 'off', 'use_snp_selection': False}. Best is trial 8 with value: 0.08591511750985631.
[I 2025-12-05 15:17:02,776] Trial 17 finished with value: 0.06854950083972422 and parameters: {'model_type': 'mlp', 'hidden_dims': '[512, 128]', 'dropout': 0.32888830259108426, 'batch_norm': True, 'lr': 0.000906375209920231, 'weight_decay': 2.5157504144511443e-05, 'epochs': 202, 'loss': 'mse', 'optimizer': 'adam', 'graph_mode': 'off', 'use_snp_selection': False}. Best is trial 8 with value: 0.08591511750985631.
[I 2025-12-05 15:17:06,334] Trial 18 finished with value: 0.06043377122716136 and parameters: {'model_type': 'mlp', 'hidden_dims': '[512, 256]', 'dropout': 0.5005423020298181, 'batch_norm': False, 'lr': 0.00010178167867639588, 'weight_decay': 2.427593612355222e-07, 'epochs': 112, 'loss': 'mae', 'optimizer': 'adam', 'graph_mode': 'off', 'use_snp_selection': True, 'num_snps': 58241}. Best is trial 8 with value: 0.08591511750985631.
[I 2025-12-05 15:17:08,331] Trial 19 finished with value: 0.046153361954172745 and parameters: {'model_type': 'mlp', 'hidden_dims': '[512, 128]', 'dropout': 0.15554717684689037, 'batch_norm': True, 'lr': 2.212519359055588e-05, 'weight_decay': 1.0530737528724215e-06, 'epochs': 156, 'loss': 'mse', 'optimizer': 'adam', 'graph_mode': 'off', 'use_snp_selection': False}. Best is trial 8 with value: 0.08591511750985631.
[I 2025-12-05 15:17:09,350] Trial 20 finished with value: 0.02217341293392148 and parameters: {'model_type': 'mlp', 'hidden_dims': '[512, 256]', 'dropout': 0.2263663991477394, 'batch_norm': True, 'lr': 9.550837657878982e-06, 'weight_decay': 6.363898158648573e-06, 'epochs': 43, 'loss': 'mse', 'optimizer': 'adam', 'graph_mode': 'off', 'use_snp_selection': False}. Best is trial 8 with value: 0.08591511750985631.
[I 2025-12-05 15:17:10,955] Trial 21 finished with value: 0.071600022133169 and parameters: {'model_type': 'mlp', 'hidden_dims': '[512, 256]', 'dropout': 0.1760549570982352, 'batch_norm': True, 'lr': 0.0002653433610323151, 'weight_decay': 1.0421381452602179e-07, 'epochs': 118, 'loss': 'mae', 'optimizer': 'adam', 'graph_mode': 'off', 'use_snp_selection': False}. Best is trial 8 with value: 0.08591511750985631.
[I 2025-12-05 15:17:12,330] Trial 22 finished with value: 0.05635576307070886 and parameters: {'model_type': 'mlp', 'hidden_dims': '[512, 256]', 'dropout': 0.11075575778434753, 'batch_norm': True, 'lr': 0.00021860760145497453, 'weight_decay': 1.19094083920789e-07, 'epochs': 89, 'loss': 'mae', 'optimizer': 'adam', 'graph_mode': 'off', 'use_snp_selection': False}. Best is trial 8 with value: 0.08591511750985631.
[I 2025-12-05 15:17:14,004] Trial 23 finished with value: 0.061744021487776655 and parameters: {'model_type': 'mlp', 'hidden_dims': '[512, 256]', 'dropout': 0.1676856573969142, 'batch_norm': True, 'lr': 0.000896403030905129, 'weight_decay': 3.2666120737763034e-07, 'epochs': 127, 'loss': 'mae', 'optimizer': 'adam', 'graph_mode': 'off', 'use_snp_selection': False}. Best is trial 8 with value: 0.08591511750985631.
[I 2025-12-05 15:17:15,428] Trial 24 finished with value: 0.06303551122443869 and parameters: {'model_type': 'mlp', 'hidden_dims': '[512, 256]', 'dropout': 0.32169788581351544, 'batch_norm': True, 'lr': 3.5720896500451895e-05, 'weight_decay': 1.794022213356721e-06, 'epochs': 95, 'loss': 'mae', 'optimizer': 'adam', 'graph_mode': 'off', 'use_snp_selection': False}. Best is trial 8 with value: 0.08591511750985631.
[I 2025-12-05 15:17:17,394] Trial 25 finished with value: 0.06679942711472049 and parameters: {'model_type': 'mlp', 'hidden_dims': '[256, 128, 64]', 'dropout': 0.2190693272481038, 'batch_norm': True, 'lr': 0.0004073161436133631, 'weight_decay': 1.6933571481426704e-07, 'epochs': 347, 'loss': 'mae', 'optimizer': 'adam', 'graph_mode': 'off', 'use_snp_selection': False}. Best is trial 8 with value: 0.08591511750985631.
[I 2025-12-05 15:17:18,504] Trial 26 finished with value: 0.014027919918572832 and parameters: {'model_type': 'mlp', 'hidden_dims': '[256, 128]', 'dropout': 0.14291930259320273, 'batch_norm': True, 'lr': 0.0001304995521644319, 'weight_decay': 5.276323094385049e-07, 'epochs': 73, 'loss': 'mae', 'optimizer': 'adam', 'graph_mode': 'off', 'use_snp_selection': True, 'num_snps': 3842}. Best is trial 8 with value: 0.08591511750985631.
[I 2025-12-05 15:17:19,384] Trial 27 finished with value: 0.08246878780879426 and parameters: {'model_type': 'mlp', 'hidden_dims': '[128, 64]', 'dropout': 0.18686530443771213, 'batch_norm': False, 'lr': 0.0002641652316942584, 'weight_decay': 8.411503092769373e-05, 'epochs': 174, 'loss': 'mae', 'optimizer': 'adam', 'graph_mode': 'off', 'use_snp_selection': False}. Best is trial 8 with value: 0.08591511750985631.
[I 2025-12-05 15:17:20,369] Trial 28 finished with value: 0.07693472370572436 and parameters: {'model_type': 'mlp', 'hidden_dims': '[128, 64]', 'dropout': 0.26673595624506075, 'batch_norm': False, 'lr': 0.00010118004692841974, 'weight_decay': 0.00011837572117061313, 'epochs': 228, 'loss': 'mse', 'optimizer': 'adam', 'graph_mode': 'off', 'use_snp_selection': False}. Best is trial 8 with value: 0.08591511750985631.
[I 2025-12-05 15:17:22,001] Trial 29 finished with value: 0.08342427770513729 and parameters: {'model_type': 'mlp', 'hidden_dims': '[128, 64]', 'dropout': 0.19720691825241685, 'batch_norm': False, 'lr': 0.0005388560200940643, 'weight_decay': 2.1712880852006744e-05, 'epochs': 179, 'loss': 'mae', 'optimizer': 'adam', 'graph_mode': 'off', 'use_snp_selection': True, 'num_snps': 19468}. Best is trial 8 with value: 0.08591511750985631.
[I 2025-12-05 15:17:23,673] Trial 30 finished with value: 0.08702388513371731 and parameters: {'model_type': 'mlp', 'hidden_dims': '[128, 64]', 'dropout': 0.2399144776530863, 'batch_norm': False, 'lr': 0.000705763992895651, 'weight_decay': 2.516323160269944e-05, 'epochs': 284, 'loss': 'mae', 'optimizer': 'adam', 'graph_mode': 'off', 'use_snp_selection': True, 'num_snps': 18365}. Best is trial 30 with value: 0.08702388513371731.
[I 2025-12-05 15:17:25,384] Trial 31 finished with value: 0.07899876675263323 and parameters: {'model_type': 'mlp', 'hidden_dims': '[128, 64]', 'dropout': 0.23451755140258893, 'batch_norm': False, 'lr': 0.0005174321889812961, 'weight_decay': 2.3678600232524124e-05, 'epochs': 324, 'loss': 'mae', 'optimizer': 'adam', 'graph_mode': 'off', 'use_snp_selection': True, 'num_snps': 18314}. Best is trial 30 with value: 0.08702388513371731.
[I 2025-12-05 15:17:27,195] Trial 32 finished with value: 0.08577885851746642 and parameters: {'model_type': 'mlp', 'hidden_dims': '[128, 64]', 'dropout': 0.12694833291594962, 'batch_norm': False, 'lr': 0.0006456418574050837, 'weight_decay': 1.3778276571718567e-05, 'epochs': 296, 'loss': 'mae', 'optimizer': 'adam', 'graph_mode': 'off', 'use_snp_selection': True, 'num_snps': 22353}. Best is trial 30 with value: 0.08702388513371731.
[I 2025-12-05 15:17:29,026] Trial 33 finished with value: 0.08692662115287475 and parameters: {'model_type': 'mlp', 'hidden_dims': '[128, 64]', 'dropout': 0.1297723103484163, 'batch_norm': False, 'lr': 0.0009962078738984493, 'weight_decay': 9.91210207332804e-06, 'epochs': 294, 'loss': 'mae', 'optimizer': 'adam', 'graph_mode': 'off', 'use_snp_selection': True, 'num_snps': 22960}. Best is trial 30 with value: 0.08702388513371731.
[I 2025-12-05 15:17:30,856] Trial 34 finished with value: 0.07792540464932614 and parameters: {'model_type': 'mlp', 'hidden_dims': '[128, 64]', 'dropout': 0.12205798897446193, 'batch_norm': False, 'lr': 0.0009899244693579116, 'weight_decay': 1.0222210981455366e-05, 'epochs': 298, 'loss': 'mae', 'optimizer': 'adam', 'graph_mode': 'off', 'use_snp_selection': True, 'num_snps': 22708}. Best is trial 30 with value: 0.08702388513371731.
[I 2025-12-05 15:17:32,933] Trial 35 finished with value: 0.08945993021704046 and parameters: {'model_type': 'mlp', 'hidden_dims': '[128, 64]', 'dropout': 0.10153492354021396, 'batch_norm': False, 'lr': 0.0006874808150302064, 'weight_decay': 1.5008661139930016e-05, 'epochs': 298, 'loss': 'mae', 'optimizer': 'adam', 'graph_mode': 'off', 'use_snp_selection': True, 'num_snps': 26035}. Best is trial 35 with value: 0.08945993021704046.
[I 2025-12-05 15:17:35,008] Trial 36 finished with value: 0.09650977875600154 and parameters: {'model_type': 'mlp', 'hidden_dims': '[128, 64]', 'dropout': 0.10271975578001741, 'batch_norm': False, 'lr': 0.000684845960520582, 'weight_decay': 4.426316245390822e-05, 'epochs': 270, 'loss': 'mae', 'optimizer': 'adam', 'graph_mode': 'off', 'use_snp_selection': True, 'num_snps': 28536}. Best is trial 36 with value: 0.09650977875600154.
[I 2025-12-05 15:17:37,038] Trial 37 finished with value: 0.07551469500603607 and parameters: {'model_type': 'mlp', 'hidden_dims': '[128, 64]', 'dropout': 0.24655837931435803, 'batch_norm': False, 'lr': 0.0007077723889673812, 'weight_decay': 3.470630634783905e-05, 'epochs': 266, 'loss': 'mae', 'optimizer': 'adam', 'graph_mode': 'off', 'use_snp_selection': True, 'num_snps': 30002}. Best is trial 36 with value: 0.09650977875600154.
[I 2025-12-05 15:17:39,001] Trial 38 finished with value: 0.06965357316028739 and parameters: {'model_type': 'mlp', 'hidden_dims': '[128, 64]', 'dropout': 0.4314081794810973, 'batch_norm': False, 'lr': 0.00037014974941533535, 'weight_decay': 0.00021991303320198, 'epochs': 274, 'loss': 'mae', 'optimizer': 'adam', 'graph_mode': 'off', 'use_snp_selection': True, 'num_snps': 27648}. Best is trial 36 with value: 0.09650977875600154.
[I 2025-12-05 15:17:40,540] Trial 39 finished with value: 0.018075335264535454 and parameters: {'model_type': 'mlp', 'hidden_dims': '[128, 64]', 'dropout': 0.30991279220138634, 'batch_norm': False, 'lr': 3.2211467597109637e-06, 'weight_decay': 4.403570030515189e-05, 'epochs': 257, 'loss': 'mae', 'optimizer': 'adam', 'graph_mode': 'off', 'use_snp_selection': True, 'num_snps': 14585}. Best is trial 36 with value: 0.09650977875600154.
[I 2025-12-05 15:17:42,877] Trial 40 finished with value: 0.05063808616901815 and parameters: {'model_type': 'mlp', 'hidden_dims': '[128, 64]', 'dropout': 0.3716081310069049, 'batch_norm': False, 'lr': 0.0006523020230399006, 'weight_decay': 5.539374136389054e-06, 'epochs': 333, 'loss': 'mae', 'optimizer': 'adam', 'graph_mode': 'off', 'use_snp_selection': True, 'num_snps': 37961}. Best is trial 36 with value: 0.09650977875600154.
[I 2025-12-05 15:17:45,489] Trial 41 finished with value: 0.0863543798130228 and parameters: {'model_type': 'mlp', 'hidden_dims': '[512, 64]', 'dropout': 0.13564656997125266, 'batch_norm': False, 'lr': 0.00036922807696696956, 'weight_decay': 1.1945329468948588e-05, 'epochs': 310, 'loss': 'mae', 'optimizer': 'adam', 'graph_mode': 'off', 'use_snp_selection': True, 'num_snps': 25591}. Best is trial 36 with value: 0.09650977875600154.
[I 2025-12-05 15:17:48,146] Trial 42 finished with value: 0.08949755295424941 and parameters: {'model_type': 'mlp', 'hidden_dims': '[512, 64]', 'dropout': 0.14699421156468487, 'batch_norm': False, 'lr': 0.0003576337923986088, 'weight_decay': 0.00013582300898905945, 'epochs': 311, 'loss': 'mae', 'optimizer': 'adam', 'graph_mode': 'off', 'use_snp_selection': True, 'num_snps': 25477}. Best is trial 36 with value: 0.09650977875600154.
[I 2025-12-05 15:17:50,840] Trial 43 finished with value: 0.08283880900439244 and parameters: {'model_type': 'mlp', 'hidden_dims': '[512, 64]', 'dropout': 0.10027820975536636, 'batch_norm': False, 'lr': 0.0007915739495236776, 'weight_decay': 0.00014007913684475684, 'epochs': 284, 'loss': 'mae', 'optimizer': 'adam', 'graph_mode': 'off', 'use_snp_selection': True, 'num_snps': 27191}. Best is trial 36 with value: 0.09650977875600154.
[I 2025-12-05 15:17:52,498] Trial 44 finished with value: 0.07286932136243578 and parameters: {'model_type': 'mlp', 'hidden_dims': '[512, 64]', 'dropout': 0.15691282324286981, 'batch_norm': False, 'lr': 0.0005501464572457899, 'weight_decay': 6.814779242806216e-05, 'epochs': 242, 'loss': 'mae', 'optimizer': 'adam', 'graph_mode': 'off', 'use_snp_selection': True, 'num_snps': 13636}. Best is trial 36 with value: 0.09650977875600154.
[I 2025-12-05 15:17:54,873] Trial 45 finished with value: 0.09238814801541337 and parameters: {'model_type': 'mlp', 'hidden_dims': '[256, 128]', 'dropout': 0.20173805620079688, 'batch_norm': False, 'lr': 0.00035332571825684596, 'weight_decay': 0.0003129415910980513, 'epochs': 284, 'loss': 'mae', 'optimizer': 'adam', 'graph_mode': 'off', 'use_snp_selection': True, 'num_snps': 33423}. Best is trial 36 with value: 0.09650977875600154.
[I 2025-12-05 15:17:57,484] Trial 46 finished with value: 0.08035358353190572 and parameters: {'model_type': 'mlp', 'hidden_dims': '[256, 128]', 'dropout': 0.20141796681751378, 'batch_norm': False, 'lr': 0.00018443136090470037, 'weight_decay': 0.000831150487128374, 'epochs': 315, 'loss': 'mae', 'optimizer': 'adam', 'graph_mode': 'off', 'use_snp_selection': True, 'num_snps': 35696}. Best is trial 36 with value: 0.09650977875600154.
[I 2025-12-05 15:17:59,953] Trial 47 finished with value: 0.06370955012599445 and parameters: {'model_type': 'mlp', 'hidden_dims': '[256, 128]', 'dropout': 0.16700439036419082, 'batch_norm': False, 'lr': 0.00033257886052545226, 'weight_decay': 0.0004549605673941776, 'epochs': 281, 'loss': 'mae', 'optimizer': 'adam', 'graph_mode': 'off', 'use_snp_selection': True, 'num_snps': 32411}. Best is trial 36 with value: 0.09650977875600154.
[I 2025-12-05 15:18:02,845] Trial 48 finished with value: 0.06893563125041298 and parameters: {'model_type': 'mlp', 'hidden_dims': '[256, 128]', 'dropout': 0.20105902628289507, 'batch_norm': False, 'lr': 8.059916134711636e-05, 'weight_decay': 0.0003556926033472846, 'epochs': 218, 'loss': 'mae', 'optimizer': 'adam', 'graph_mode': 'off', 'use_snp_selection': True, 'num_snps': 44953}. Best is trial 36 with value: 0.09650977875600154.
[I 2025-12-05 15:18:06,335] Trial 49 finished with value: 0.09008345915073407 and parameters: {'model_type': 'mlp', 'hidden_dims': '[512, 64]', 'dropout': 0.2818979448018076, 'batch_norm': False, 'lr': 0.0001922561511709361, 'weight_decay': 0.0002047638465195446, 'epochs': 247, 'loss': 'mae', 'optimizer': 'adam', 'graph_mode': 'off', 'use_snp_selection': True, 'num_snps': 42467}. Best is trial 36 with value: 0.09650977875600154.
[I 2025-12-05 15:18:09,938] Trial 50 finished with value: 0.07457928054217398 and parameters: {'model_type': 'mlp', 'hidden_dims': '[512, 64]', 'dropout': 0.3004358198865853, 'batch_norm': False, 'lr': 0.00018755473981516387, 'weight_decay': 0.00019639875152673274, 'epochs': 251, 'loss': 'mae', 'optimizer': 'adam', 'graph_mode': 'off', 'use_snp_selection': True, 'num_snps': 44939}. Best is trial 36 with value: 0.09650977875600154.
[I 2025-12-05 15:18:13,452] Trial 51 finished with value: 0.08979848009209267 and parameters: {'model_type': 'mlp', 'hidden_dims': '[512, 64]', 'dropout': 0.34584694621000533, 'batch_norm': False, 'lr': 0.00045910847619921093, 'weight_decay': 0.00010735584484896373, 'epochs': 269, 'loss': 'mae', 'optimizer': 'adam', 'graph_mode': 'off', 'use_snp_selection': True, 'num_snps': 40070}. Best is trial 36 with value: 0.09650977875600154.
[I 2025-12-05 15:18:16,929] Trial 52 finished with value: 0.08777122683737283 and parameters: {'model_type': 'mlp', 'hidden_dims': '[512, 64]', 'dropout': 0.34512640298383646, 'batch_norm': False, 'lr': 0.00031534957768170925, 'weight_decay': 0.00010881547442235797, 'epochs': 269, 'loss': 'mae', 'optimizer': 'adam', 'graph_mode': 'off', 'use_snp_selection': True, 'num_snps': 41102}. Best is trial 36 with value: 0.09650977875600154.
[I 2025-12-05 15:18:20,865] Trial 53 finished with value: 0.09202281691464896 and parameters: {'model_type': 'mlp', 'hidden_dims': '[512, 64]', 'dropout': 0.36535795084836975, 'batch_norm': False, 'lr': 0.00044955400688123296, 'weight_decay': 0.0005516776234376712, 'epochs': 245, 'loss': 'mae', 'optimizer': 'adam', 'graph_mode': 'off', 'use_snp_selection': True, 'num_snps': 51107}. Best is trial 36 with value: 0.09650977875600154.
