[I 2025-12-05 15:41:14,949] Trial 28 finished with value: 0.07548008540035496 and parameters: {'model_type': 'mlp', 'hidden_dims': '[512, 256]', 'dropout': 0.3599422744688665, 'batch_norm': False, 'lr': 7.667493766207837e-06, 'weight_decay': 2.905899669856459e-07, 'epochs': 258, 'loss': 'mse', 'optimizer': 'adam', 'graph_mode': 'off', 'use_snp_selection': False}. Best is trial 20 with value: 0.08667014115822665.
[I 2025-12-05 15:41:16,119] Trial 29 finished with value: 0.030265061209406467 and parameters: {'model_type': 'mlp', 'hidden_dims': '[128, 64]', 'dropout': 0.20353373585189605, 'batch_norm': False, 'lr': 2.8966762461994946e-06, 'weight_decay': 1.5684987622716442e-06, 'epochs': 78, 'loss': 'mse', 'optimizer': 'adam', 'graph_mode': 'off', 'use_snp_selection': True, 'num_snps': 19468}. Best is trial 20 with value: 0.08667014115822665.
[I 2025-12-05 15:41:17,119] Trial 30 finished with value: 0.08752465843225296 and parameters: {'model_type': 'mlp', 'hidden_dims': '[256, 128]', 'dropout': 0.1643682238690179, 'batch_norm': False, 'lr': 1.4552307045784162e-05, 'weight_decay': 4.588676129678789e-06, 'epochs': 158, 'loss': 'mse', 'optimizer': 'adam', 'graph_mode': 'off', 'use_snp_selection': False}. Best is trial 30 with value: 0.08752465843225296.
[I 2025-12-05 15:41:18,125] Trial 31 finished with value: 0.07310698713420853 and parameters: {'model_type': 'mlp', 'hidden_dims': '[256, 128]', 'dropout': 0.1171198082843598, 'batch_norm': False, 'lr': 1.4329317322602429e-05, 'weight_decay': 4.165110723298102e-06, 'epochs': 184, 'loss': 'mse', 'optimizer': 'adam', 'graph_mode': 'off', 'use_snp_selection': False}. Best is trial 30 with value: 0.08752465843225296.
[I 2025-12-05 15:41:19,075] Trial 32 finished with value: 0.07233583237345657 and parameters: {'model_type': 'mlp', 'hidden_dims': '[256, 128]', 'dropout': 0.16408033164605973, 'batch_norm': False, 'lr': 2.733282219057703e-05, 'weight_decay': 1.0942555073108242e-05, 'epochs': 150, 'loss': 'mse', 'optimizer': 'adam', 'graph_mode': 'off', 'use_snp_selection': False}. Best is trial 30 with value: 0.08752465843225296.
[I 2025-12-05 15:41:20,023] Trial 33 finished with value: 0.07585354975518063 and parameters: {'model_type': 'mlp', 'hidden_dims': '[256, 128]', 'dropout': 0.21302742992307389, 'batch_norm': False, 'lr': 4.934638830913207e-06, 'weight_decay': 3.238836625886298e-05, 'epochs': 154, 'loss': 'mse', 'optimizer': 'adam', 'graph_mode': 'off', 'use_snp_selection': False}. Best is trial 30 with value: 0.08752465843225296.
[I 2025-12-05 15:41:20,959] Trial 34 finished with value: 0.09046739377115193 and parameters: {'model_type': 'mlp', 'hidden_dims': '[256, 128]', 'dropout': 0.18130264145429617, 'batch_norm': False, 'lr': 2.05689560554885e-05, 'weight_decay': 1.610795018802872e-05, 'epochs': 135, 'loss': 'mae', 'optimizer': 'adam', 'graph_mode': 'off', 'use_snp_selection': False}. Best is trial 34 with value: 0.09046739377115193.
[I 2025-12-05 15:41:21,844] Trial 35 finished with value: 0.09430204188087088 and parameters: {'model_type': 'mlp', 'hidden_dims': '[256, 128]', 'dropout': 0.43024169205778806, 'batch_norm': False, 'lr': 4.797623526773746e-05, 'weight_decay': 1.7479081285587815e-05, 'epochs': 120, 'loss': 'mae', 'optimizer': 'adam', 'graph_mode': 'off', 'use_snp_selection': False}. Best is trial 35 with value: 0.09430204188087088.
[I 2025-12-05 15:41:24,264] Trial 36 finished with value: 0.06478481917926031 and parameters: {'model_type': 'mlp', 'hidden_dims': '[256, 128]', 'dropout': 0.43010550849475154, 'batch_norm': False, 'lr': 2.06158796160611e-05, 'weight_decay': 1.732199200214087e-05, 'epochs': 69, 'loss': 'mae', 'optimizer': 'adam', 'graph_mode': 'off', 'use_snp_selection': True, 'num_snps': 58661}. Best is trial 35 with value: 0.09430204188087088.
[I 2025-12-05 15:41:25,195] Trial 37 finished with value: 0.07478624461651655 and parameters: {'model_type': 'mlp', 'hidden_dims': '[256, 128]', 'dropout': 0.13119271843743263, 'batch_norm': False, 'lr': 4.350549331735279e-05, 'weight_decay': 0.00011004416366466665, 'epochs': 122, 'loss': 'mae', 'optimizer': 'adam', 'graph_mode': 'off', 'use_snp_selection': False}. Best is trial 35 with value: 0.09430204188087088.
[I 2025-12-05 15:41:26,459] Trial 38 finished with value: 0.08402558487328451 and parameters: {'model_type': 'mlp', 'hidden_dims': '[256, 128]', 'dropout': 0.1711813977231098, 'batch_norm': False, 'lr': 8.82173817320597e-05, 'weight_decay': 1.994950524070798e-05, 'epochs': 138, 'loss': 'mae', 'optimizer': 'adam', 'graph_mode': 'off', 'use_snp_selection': True, 'num_snps': 19911}. Best is trial 35 with value: 0.09430204188087088.
[I 2025-12-05 15:41:27,582] Trial 39 finished with value: 0.06267239353396702 and parameters: {'model_type': 'mlp', 'hidden_dims': '[512, 64]', 'dropout': 0.593444752072398, 'batch_norm': False, 'lr': 2.9464864058396072e-06, 'weight_decay': 3.8455018339969256e-05, 'epochs': 89, 'loss': 'mae', 'optimizer': 'adam', 'graph_mode': 'off', 'use_snp_selection': False}. Best is trial 35 with value: 0.09430204188087088.
[I 2025-12-05 15:41:28,449] Trial 40 finished with value: 0.06503471495132211 and parameters: {'model_type': 'mlp', 'hidden_dims': '[256, 128]', 'dropout': 0.2706857982056391, 'batch_norm': False, 'lr': 4.767147905519569e-06, 'weight_decay': 1.3069498289289636e-05, 'epochs': 112, 'loss': 'mae', 'optimizer': 'adam', 'graph_mode': 'off', 'use_snp_selection': False}. Best is trial 35 with value: 0.09430204188087088.
[I 2025-12-05 15:41:29,749] Trial 41 finished with value: 0.07113950374431327 and parameters: {'model_type': 'mlp', 'hidden_dims': '[256, 128]', 'dropout': 0.16682146983724253, 'batch_norm': False, 'lr': 0.00011223683809777552, 'weight_decay': 2.018430350681522e-05, 'epochs': 132, 'loss': 'mae', 'optimizer': 'adam', 'graph_mode': 'off', 'use_snp_selection': True, 'num_snps': 22510}. Best is trial 35 with value: 0.09430204188087088.
[I 2025-12-05 15:41:31,026] Trial 42 finished with value: 0.07845356257176132 and parameters: {'model_type': 'mlp', 'hidden_dims': '[256, 128]', 'dropout': 0.21918757845587905, 'batch_norm': False, 'lr': 8.435830449304602e-05, 'weight_decay': 2.4719425289686546e-05, 'epochs': 137, 'loss': 'mae', 'optimizer': 'adam', 'graph_mode': 'off', 'use_snp_selection': True, 'num_snps': 20305}. Best is trial 35 with value: 0.09430204188087088.
[I 2025-12-05 15:41:33,130] Trial 43 finished with value: 0.10089845680659124 and parameters: {'model_type': 'mlp', 'hidden_dims': '[256, 128]', 'dropout': 0.17559457692160926, 'batch_norm': False, 'lr': 7.973530082497911e-05, 'weight_decay': 0.00014350288182642, 'epochs': 155, 'loss': 'mae', 'optimizer': 'adam', 'graph_mode': 'off', 'use_snp_selection': True, 'num_snps': 46160}. Best is trial 43 with value: 0.10089845680659124.
[I 2025-12-05 15:41:35,607] Trial 44 finished with value: 0.0749847128053907 and parameters: {'model_type': 'mlp', 'hidden_dims': '[256, 128, 64]', 'dropout': 0.10040531005816639, 'batch_norm': False, 'lr': 4.320964907077078e-05, 'weight_decay': 0.0005108155899917878, 'epochs': 348, 'loss': 'mae', 'optimizer': 'adam', 'graph_mode': 'off', 'use_snp_selection': True, 'num_snps': 46780}. Best is trial 43 with value: 0.10089845680659124.
[I 2025-12-05 15:41:37,878] Trial 45 finished with value: 0.08265952846710418 and parameters: {'model_type': 'mlp', 'hidden_dims': '[256, 128]', 'dropout': 0.1345000323979797, 'batch_norm': False, 'lr': 2.058797591297439e-05, 'weight_decay': 0.00020176472427780806, 'epochs': 156, 'loss': 'mae', 'optimizer': 'adam', 'graph_mode': 'off', 'use_snp_selection': True, 'num_snps': 48375}. Best is trial 43 with value: 0.10089845680659124.
[I 2025-12-05 15:41:40,110] Trial 46 finished with value: 0.07594390745930041 and parameters: {'model_type': 'mlp', 'hidden_dims': '[512, 64]', 'dropout': 0.22695671679914037, 'batch_norm': True, 'lr': 0.0004580506570088552, 'weight_decay': 0.00012510469726048222, 'epochs': 188, 'loss': 'mae', 'optimizer': 'adam', 'graph_mode': 'off', 'use_snp_selection': True, 'num_snps': 39190}. Best is trial 43 with value: 0.10089845680659124.
[I 2025-12-05 15:41:41,242] Trial 47 finished with value: 0.06911043521041894 and parameters: {'model_type': 'mlp', 'hidden_dims': '[512, 128]', 'dropout': 0.4621795472213078, 'batch_norm': False, 'lr': 5.1121635655895786e-05, 'weight_decay': 0.0009669331628569803, 'epochs': 97, 'loss': 'mae', 'optimizer': 'adam', 'graph_mode': 'off', 'use_snp_selection': False}. Best is trial 43 with value: 0.10089845680659124.
[I 2025-12-05 15:41:42,207] Trial 48 finished with value: 0.09234974618452958 and parameters: {'model_type': 'mlp', 'hidden_dims': '[256, 128]', 'dropout': 0.3308582091326991, 'batch_norm': False, 'lr': 8.001204076447349e-06, 'weight_decay': 0.00034738817961141386, 'epochs': 161, 'loss': 'mae', 'optimizer': 'adam', 'graph_mode': 'off', 'use_snp_selection': False}. Best is trial 43 with value: 0.10089845680659124.
[I 2025-12-05 15:41:43,188] Trial 49 finished with value: 0.04711105962779756 and parameters: {'model_type': 'mlp', 'hidden_dims': '[256, 128]', 'dropout': 0.4762113293761182, 'batch_norm': True, 'lr': 7.691223860042502e-05, 'weight_decay': 0.0004261603944656728, 'epochs': 158, 'loss': 'mae', 'optimizer': 'adam', 'graph_mode': 'off', 'use_snp_selection': False}. Best is trial 43 with value: 0.10089845680659124.
[I 2025-12-05 15:41:43,953] Trial 50 finished with value: 0.0278523932022736 and parameters: {'model_type': 'mlp', 'hidden_dims': '[256, 128]', 'dropout': 0.4015495736324988, 'batch_norm': False, 'lr': 1.1156806786959957e-06, 'weight_decay': 0.0006160639641161827, 'epochs': 51, 'loss': 'mae', 'optimizer': 'adam', 'graph_mode': 'off', 'use_snp_selection': False}. Best is trial 43 with value: 0.10089845680659124.
[I 2025-12-05 15:41:44,849] Trial 51 finished with value: 0.07413250911153682 and parameters: {'model_type': 'mlp', 'hidden_dims': '[256, 128]', 'dropout': 0.33059529712967173, 'batch_norm': False, 'lr': 7.728375029360754e-06, 'weight_decay': 0.0002506832453378559, 'epochs': 124, 'loss': 'mae', 'optimizer': 'adam', 'graph_mode': 'off', 'use_snp_selection': False}. Best is trial 43 with value: 0.10089845680659124.
[I 2025-12-05 15:41:46,421] Trial 52 finished with value: 0.06870606853738288 and parameters: {'model_type': 'mlp', 'hidden_dims': '[512, 256]', 'dropout': 0.3102929461674502, 'batch_norm': False, 'lr': 1.4624763128843183e-05, 'weight_decay': 0.00012017234742138019, 'epochs': 216, 'loss': 'mae', 'optimizer': 'adam', 'graph_mode': 'off', 'use_snp_selection': False}. Best is trial 43 with value: 0.10089845680659124.
[I 2025-12-05 15:41:47,428] Trial 53 finished with value: 0.07476991494314955 and parameters: {'model_type': 'mlp', 'hidden_dims': '[256, 128]', 'dropout': 0.2594107497895387, 'batch_norm': False, 'lr': 7.067285021439594e-06, 'weight_decay': 5.284373850045355e-05, 'epochs': 163, 'loss': 'mae', 'optimizer': 'adam', 'graph_mode': 'off', 'use_snp_selection': False}. Best is trial 43 with value: 0.10089845680659124.
[I 2025-12-05 15:41:48,361] Trial 54 finished with value: 0.05920204701604375 and parameters: {'model_type': 'mlp', 'hidden_dims': '[256, 128]', 'dropout': 0.3717117768720074, 'batch_norm': False, 'lr': 3.718393212623347e-06, 'weight_decay': 7.61679537693564e-06, 'epochs': 143, 'loss': 'mae', 'optimizer': 'adam', 'graph_mode': 'off', 'use_snp_selection': False}. Best is trial 43 with value: 0.10089845680659124.
[I 2025-12-05 15:41:49,858] Trial 55 finished with value: 0.05419339129788983 and parameters: {'model_type': 'mlp', 'hidden_dims': '[512, 128]', 'dropout': 0.33275309969145944, 'batch_norm': False, 'lr': 1.1904534404179036e-05, 'weight_decay': 0.00037547975381969223, 'epochs': 195, 'loss': 'mae', 'optimizer': 'adam', 'graph_mode': 'off', 'use_snp_selection': False}. Best is trial 43 with value: 0.10089845680659124.
[I 2025-12-05 15:41:50,733] Trial 56 finished with value: 0.08057358660863324 and parameters: {'model_type': 'mlp', 'hidden_dims': '[256, 128]', 'dropout': 0.18228946921575506, 'batch_norm': False, 'lr': 0.00018186067634717783, 'weight_decay': 7.841607369522931e-05, 'epochs': 107, 'loss': 'mae', 'optimizer': 'adam', 'graph_mode': 'off', 'use_snp_selection': False}. Best is trial 43 with value: 0.10089845680659124.
[I 2025-12-05 15:41:52,171] Trial 57 finished with value: 0.005704196071679519 and parameters: {'model_type': 'mlp', 'hidden_dims': '[512, 64]', 'dropout': 0.29525345552450155, 'batch_norm': True, 'lr': 1.942872363503226e-05, 'weight_decay': 4.45190311438196e-05, 'epochs': 178, 'loss': 'mae', 'optimizer': 'adam', 'graph_mode': 'off', 'use_snp_selection': False}. Best is trial 43 with value: 0.10089845680659124.
[I 2025-12-05 15:41:54,591] Trial 58 finished with value: 0.07799742398737515 and parameters: {'model_type': 'mlp', 'hidden_dims': '[256, 128, 64]', 'dropout': 0.15110394948139788, 'batch_norm': False, 'lr': 2.7989222266116898e-05, 'weight_decay': 3.592124208650208e-06, 'epochs': 205, 'loss': 'mae', 'optimizer': 'adam', 'graph_mode': 'off', 'use_snp_selection': True, 'num_snps': 52459}. Best is trial 43 with value: 0.10089845680659124.
[I 2025-12-05 15:41:55,739] Trial 59 finished with value: 0.07077042089964858 and parameters: {'model_type': 'mlp', 'hidden_dims': '[256, 128]', 'dropout': 0.22936548377365917, 'batch_norm': False, 'lr': 8.209720479657697e-06, 'weight_decay': 2.664514404718101e-05, 'epochs': 228, 'loss': 'mae', 'optimizer': 'adam', 'graph_mode': 'off', 'use_snp_selection': False}. Best is trial 43 with value: 0.10089845680659124.
[I 2025-12-05 15:41:56,990] Trial 60 finished with value: 0.06121157500866228 and parameters: {'model_type': 'mlp', 'hidden_dims': '[512, 256]', 'dropout': 0.12160756905112396, 'batch_norm': False, 'lr': 1.9613605655742917e-06, 'weight_decay': 0.0002907879559548783, 'epochs': 128, 'loss': 'mae', 'optimizer': 'adam', 'graph_mode': 'off', 'use_snp_selection': False}. Best is trial 43 with value: 0.10089845680659124.
[I 2025-12-05 15:41:58,517] Trial 61 finished with value: 0.08557875164561304 and parameters: {'model_type': 'mlp', 'hidden_dims': '[256, 128]', 'dropout': 0.179681079728632, 'batch_norm': False, 'lr': 9.614291359188652e-05, 'weight_decay': 1.553725342845367e-05, 'epochs': 140, 'loss': 'mae', 'optimizer': 'adam', 'graph_mode': 'off', 'use_snp_selection': True, 'num_snps': 28122}. Best is trial 43 with value: 0.10089845680659124.
[I 2025-12-05 15:42:00,047] Trial 62 finished with value: 0.07382690501478023 and parameters: {'model_type': 'mlp', 'hidden_dims': '[256, 128]', 'dropout': 0.14565543681264487, 'batch_norm': False, 'lr': 3.688365902207777e-05, 'weight_decay': 1.349848533818909e-05, 'epochs': 143, 'loss': 'mae', 'optimizer': 'adam', 'graph_mode': 'off', 'use_snp_selection': True, 'num_snps': 28537}. Best is trial 43 with value: 0.10089845680659124.
[I 2025-12-05 15:42:01,606] Trial 63 finished with value: 0.0802587037169404 and parameters: {'model_type': 'mlp', 'hidden_dims': '[256, 128]', 'dropout': 0.17575092244205393, 'batch_norm': False, 'lr': 6.214166635381208e-05, 'weight_decay': 8.686933991984728e-06, 'epochs': 186, 'loss': 'mae', 'optimizer': 'adam', 'graph_mode': 'off', 'use_snp_selection': True, 'num_snps': 27292}. Best is trial 43 with value: 0.10089845680659124.
[I 2025-12-05 15:42:03,421] Trial 64 finished with value: 0.0856842986368129 and parameters: {'model_type': 'mlp', 'hidden_dims': '[256, 128]', 'dropout': 0.19562351533636183, 'batch_norm': False, 'lr': 0.00015489192786846066, 'weight_decay': 5.998034390566158e-06, 'epochs': 150, 'loss': 'mae', 'optimizer': 'adam', 'graph_mode': 'off', 'use_snp_selection': True, 'num_snps': 38333}. Best is trial 43 with value: 0.10089845680659124.
[I 2025-12-05 15:42:05,183] Trial 65 finished with value: 0.07431706336166308 and parameters: {'model_type': 'mlp', 'hidden_dims': '[128, 64]', 'dropout': 0.1998076577571573, 'batch_norm': False, 'lr': 0.00019616131018660167, 'weight_decay': 5.744578406622589e-06, 'epochs': 164, 'loss': 'mae', 'optimizer': 'adam', 'graph_mode': 'off', 'use_snp_selection': True, 'num_snps': 35930}. Best is trial 43 with value: 0.10089845680659124.
[I 2025-12-05 15:42:06,231] Trial 66 finished with value: 0.08149199977803782 and parameters: {'model_type': 'mlp', 'hidden_dims': '[256, 128]', 'dropout': 0.2580082679629932, 'batch_norm': False, 'lr': 0.00012855861783392627, 'weight_decay': 3.2454634709682945e-06, 'epochs': 151, 'loss': 'mse', 'optimizer': 'adam', 'graph_mode': 'off', 'use_snp_selection': False}. Best is trial 43 with value: 0.10089845680659124.
[I 2025-12-05 15:42:08,151] Trial 67 finished with value: 0.06480281332947806 and parameters: {'model_type': 'mlp', 'hidden_dims': '[256, 128]', 'dropout': 0.5081155955869765, 'batch_norm': False, 'lr': 0.0003616900933677151, 'weight_decay': 5.480660830100602e-06, 'epochs': 100, 'loss': 'mse', 'optimizer': 'adam', 'graph_mode': 'off', 'use_snp_selection': True, 'num_snps': 42419}. Best is trial 43 with value: 0.10089845680659124.
[I 2025-12-05 15:42:08,901] Trial 68 finished with value: 0.0012658995393831918 and parameters: {'model_type': 'mlp', 'hidden_dims': '[128, 64]', 'dropout': 0.285254042033786, 'batch_norm': True, 'lr': 5.686048251317024e-06, 'weight_decay': 8.511595032810937e-05, 'epochs': 88, 'loss': 'mae', 'optimizer': 'adam', 'graph_mode': 'off', 'use_snp_selection': False}. Best is trial 43 with value: 0.10089845680659124.
[I 2025-12-05 15:42:10,052] Trial 69 finished with value: 0.08033528167993904 and parameters: {'model_type': 'mlp', 'hidden_dims': '[256, 128]', 'dropout': 0.34568712446785366, 'batch_norm': False, 'lr': 1.713422813704628e-05, 'weight_decay': 0.00015833942322297947, 'epochs': 251, 'loss': 'mse', 'optimizer': 'adam', 'graph_mode': 'off', 'use_snp_selection': False}. Best is trial 43 with value: 0.10089845680659124.
[I 2025-12-05 15:42:12,280] Trial 70 finished with value: 0.06496946041045293 and parameters: {'model_type': 'mlp', 'hidden_dims': '[256, 128]', 'dropout': 0.24819107071220117, 'batch_norm': False, 'lr': 2.4912228122970148e-05, 'weight_decay': 9.635717974662387e-06, 'epochs': 115, 'loss': 'mae', 'optimizer': 'adam', 'graph_mode': 'off', 'use_snp_selection': True, 'num_snps': 51400}. Best is trial 43 with value: 0.10089845680659124.
[I 2025-12-05 15:42:13,981] Trial 71 finished with value: 0.0882874217991153 and parameters: {'model_type': 'mlp', 'hidden_dims': '[256, 128]', 'dropout': 0.1904870099432661, 'batch_norm': False, 'lr': 9.933273843236108e-05, 'weight_decay': 1.6336212649739337e-05, 'epochs': 143, 'loss': 'mae', 'optimizer': 'adam', 'graph_mode': 'off', 'use_snp_selection': True, 'num_snps': 32704}. Best is trial 43 with value: 0.10089845680659124.
[I 2025-12-05 15:42:15,666] Trial 72 finished with value: 0.09026282892077168 and parameters: {'model_type': 'mlp', 'hidden_dims': '[256, 128]', 'dropout': 0.15511683423529712, 'batch_norm': False, 'lr': 6.0894984136825706e-05, 'weight_decay': 3.0960344936897196e-05, 'epochs': 166, 'loss': 'mae', 'optimizer': 'adam', 'graph_mode': 'off', 'use_snp_selection': True, 'num_snps': 33098}. Best is trial 43 with value: 0.10089845680659124.
[I 2025-12-05 15:42:17,425] Trial 73 finished with value: 0.08020909727676953 and parameters: {'model_type': 'mlp', 'hidden_dims': '[256, 128]', 'dropout': 0.15567326943238452, 'batch_norm': False, 'lr': 5.718033520995238e-05, 'weight_decay': 3.1291046355261205e-05, 'epochs': 166, 'loss': 'mae', 'optimizer': 'adam', 'graph_mode': 'off', 'use_snp_selection': True, 'num_snps': 34187}. Best is trial 43 with value: 0.10089845680659124.
[I 2025-12-05 15:42:18,938] Trial 74 finished with value: 0.08494461751822527 and parameters: {'model_type': 'mlp', 'hidden_dims': '[512, 128]', 'dropout': 0.13770045424833202, 'batch_norm': False, 'lr': 9.385790927705026e-06, 'weight_decay': 1.5237628785021358e-05, 'epochs': 181, 'loss': 'mae', 'optimizer': 'adam', 'graph_mode': 'off', 'use_snp_selection': True, 'num_snps': 24306}. Best is trial 43 with value: 0.10089845680659124.
[I 2025-12-05 15:42:20,941] Trial 75 finished with value: 0.1034338442096587 and parameters: {'model_type': 'mlp', 'hidden_dims': '[256, 128]', 'dropout': 0.12107372978180708, 'batch_norm': False, 'lr': 3.681541475781234e-05, 'weight_decay': 4.606329950218479e-05, 'epochs': 193, 'loss': 'mae', 'optimizer': 'adam', 'graph_mode': 'off', 'use_snp_selection': True, 'num_snps': 42098}. Best is trial 75 with value: 0.1034338442096587.
[I 2025-12-05 15:42:22,898] Trial 76 finished with value: 0.08567172643167988 and parameters: {'model_type': 'mlp', 'hidden_dims': '[256, 128]', 'dropout': 0.10893724352395875, 'batch_norm': False, 'lr': 3.98079702102227e-05, 'weight_decay': 6.008249668831347e-05, 'epochs': 122, 'loss': 'mae', 'optimizer': 'adam', 'graph_mode': 'off', 'use_snp_selection': True, 'num_snps': 41523}. Best is trial 75 with value: 0.1034338442096587.
[I 2025-12-05 15:42:24,604] Trial 77 finished with value: 0.08298003104952867 and parameters: {'model_type': 'mlp', 'hidden_dims': '[256, 128]', 'dropout': 0.16145070977189374, 'batch_norm': False, 'lr': 7.18569374902563e-05, 'weight_decay': 5.020014527838496e-05, 'epochs': 196, 'loss': 'mae', 'optimizer': 'adam', 'graph_mode': 'off', 'use_snp_selection': True, 'num_snps': 32541}. Best is trial 75 with value: 0.1034338442096587.
[I 2025-12-05 15:42:26,805] Trial 78 finished with value: 0.09781622863258617 and parameters: {'model_type': 'mlp', 'hidden_dims': '[256, 128]', 'dropout': 0.12067716745501401, 'batch_norm': False, 'lr': 3.188781741723995e-05, 'weight_decay': 1.8495096020020282e-05, 'epochs': 175, 'loss': 'mae', 'optimizer': 'adam', 'graph_mode': 'off', 'use_snp_selection': True, 'num_snps': 46435}. Best is trial 75 with value: 0.1034338442096587.
