[I 2025-12-05 14:59:10,503] Trial 37 finished with value: 0.05038516428396848 and parameters: {'model_type': 'mlp', 'hidden_dims': '[128, 64]', 'dropout': 0.36903430494405876, 'batch_norm': False, 'lr': 9.157069800781199e-06, 'weight_decay': 4.1237635127609005e-05, 'epochs': 204, 'loss': 'mae', 'optimizer': 'adam', 'graph_mode': 'off', 'use_snp_selection': True, 'num_snps': 11032}. Best is trial 35 with value: 0.09758881551140278.
[I 2025-12-05 14:59:11,847] Trial 38 finished with value: 0.06625270958903942 and parameters: {'model_type': 'mlp', 'hidden_dims': '[128, 64]', 'dropout': 0.4314081794810973, 'batch_norm': False, 'lr': 3.088486149235527e-06, 'weight_decay': 1.4089006700519878e-05, 'epochs': 156, 'loss': 'mse', 'optimizer': 'adam', 'graph_mode': 'off', 'use_snp_selection': True, 'num_snps': 23830}. Best is trial 35 with value: 0.09758881551140278.
[I 2025-12-05 14:59:12,842] Trial 39 finished with value: 0.04950079816365047 and parameters: {'model_type': 'mlp', 'hidden_dims': '[128, 64]', 'dropout': 0.33687385764209404, 'batch_norm': False, 'lr': 3.794001566335862e-05, 'weight_decay': 0.0005464716995015377, 'epochs': 119, 'loss': 'mae', 'optimizer': 'adam', 'graph_mode': 'off', 'use_snp_selection': True, 'num_snps': 10954}. Best is trial 35 with value: 0.09758881551140278.
[I 2025-12-05 14:59:14,641] Trial 40 finished with value: 0.03427108334476012 and parameters: {'model_type': 'mlp', 'hidden_dims': '[256, 128]', 'dropout': 0.5273019276339408, 'batch_norm': False, 'lr': 2.320370617557869e-06, 'weight_decay': 3.12986195051014e-05, 'epochs': 178, 'loss': 'mae', 'optimizer': 'adam', 'graph_mode': 'off', 'use_snp_selection': True, 'num_snps': 35258}. Best is trial 35 with value: 0.09758881551140278.
[I 2025-12-05 14:59:16,013] Trial 41 finished with value: 0.07677064156598691 and parameters: {'model_type': 'mlp', 'hidden_dims': '[128, 64]', 'dropout': 0.2780592091414337, 'batch_norm': True, 'lr': 0.00011970543125807379, 'weight_decay': 8.846753863003926e-05, 'epochs': 246, 'loss': 'mae', 'optimizer': 'adam', 'graph_mode': 'off', 'use_snp_selection': True, 'num_snps': 17778}. Best is trial 35 with value: 0.09758881551140278.
[I 2025-12-05 14:59:17,606] Trial 42 finished with value: 0.06891152502047286 and parameters: {'model_type': 'mlp', 'hidden_dims': '[128, 64]', 'dropout': 0.3562308141694975, 'batch_norm': False, 'lr': 5.091842282036079e-05, 'weight_decay': 8.576947935570057e-05, 'epochs': 264, 'loss': 'mae', 'optimizer': 'adam', 'graph_mode': 'off', 'use_snp_selection': True, 'num_snps': 27387}. Best is trial 35 with value: 0.09758881551140278.
[I 2025-12-05 14:59:19,035] Trial 43 finished with value: -0.011939625415080155 and parameters: {'model_type': 'mlp', 'hidden_dims': '[128, 64]', 'dropout': 0.2533276537367929, 'batch_norm': True, 'lr': 5.780844752264523e-06, 'weight_decay': 0.000216879596194659, 'epochs': 289, 'loss': 'mae', 'optimizer': 'adam', 'graph_mode': 'off', 'use_snp_selection': True, 'num_snps': 15528}. Best is trial 35 with value: 0.09758881551140278.
[I 2025-12-05 14:59:20,812] Trial 44 finished with value: 0.09426143617758818 and parameters: {'model_type': 'mlp', 'hidden_dims': '[128, 64]', 'dropout': 0.2962545120269751, 'batch_norm': True, 'lr': 7.554632809250841e-05, 'weight_decay': 0.0001384524069547802, 'epochs': 327, 'loss': 'mse', 'optimizer': 'adam', 'graph_mode': 'off', 'use_snp_selection': True, 'num_snps': 25134}. Best is trial 35 with value: 0.09758881551140278.
[I 2025-12-05 14:59:22,700] Trial 45 finished with value: 0.0949335285900667 and parameters: {'model_type': 'mlp', 'hidden_dims': '[512, 256]', 'dropout': 0.22742087414696208, 'batch_norm': False, 'lr': 2.5287930782234613e-05, 'weight_decay': 0.0007695725039476272, 'epochs': 330, 'loss': 'mse', 'optimizer': 'adam', 'graph_mode': 'off', 'use_snp_selection': True, 'num_snps': 26663}. Best is trial 35 with value: 0.09758881551140278.
[I 2025-12-05 14:59:24,465] Trial 46 finished with value: 0.08924881906975574 and parameters: {'model_type': 'mlp', 'hidden_dims': '[256, 128, 64]', 'dropout': 0.3994712136727298, 'batch_norm': False, 'lr': 2.760785359647102e-05, 'weight_decay': 0.0009669331628569803, 'epochs': 327, 'loss': 'mse', 'optimizer': 'adam', 'graph_mode': 'off', 'use_snp_selection': True, 'num_snps': 26111}. Best is trial 35 with value: 0.09758881551140278.
[I 2025-12-05 14:59:26,367] Trial 47 finished with value: 0.09095834651732597 and parameters: {'model_type': 'mlp', 'hidden_dims': '[512, 128]', 'dropout': 0.24108967522249206, 'batch_norm': False, 'lr': 1.3467162929659568e-05, 'weight_decay': 0.0005542794834756085, 'epochs': 308, 'loss': 'mse', 'optimizer': 'adam', 'graph_mode': 'off', 'use_snp_selection': True, 'num_snps': 25442}. Best is trial 35 with value: 0.09758881551140278.
[I 2025-12-05 14:59:28,231] Trial 48 finished with value: 0.09749988483643376 and parameters: {'model_type': 'mlp', 'hidden_dims': '[128, 64]', 'dropout': 0.3377722655814143, 'batch_norm': False, 'lr': 6.12540924349345e-05, 'weight_decay': 0.00030613739795795234, 'epochs': 321, 'loss': 'mse', 'optimizer': 'adam', 'graph_mode': 'off', 'use_snp_selection': True, 'num_snps': 32130}. Best is trial 35 with value: 0.09758881551140278.
[I 2025-12-05 14:59:30,985] Trial 49 finished with value: 0.08010354688235136 and parameters: {'model_type': 'mlp', 'hidden_dims': '[512, 256]', 'dropout': 0.3287993431475715, 'batch_norm': False, 'lr': 4.388878257389126e-05, 'weight_decay': 0.000252116020012402, 'epochs': 315, 'loss': 'mse', 'optimizer': 'adam', 'graph_mode': 'off', 'use_snp_selection': True, 'num_snps': 42467}. Best is trial 35 with value: 0.09758881551140278.
[I 2025-12-05 14:59:32,907] Trial 50 finished with value: 0.08677119422584918 and parameters: {'model_type': 'mlp', 'hidden_dims': '[128, 64]', 'dropout': 0.22468280724464673, 'batch_norm': False, 'lr': 1.5927965232864202e-05, 'weight_decay': 0.0003804469696514866, 'epochs': 335, 'loss': 'mse', 'optimizer': 'adam', 'graph_mode': 'off', 'use_snp_selection': True, 'num_snps': 31315}. Best is trial 35 with value: 0.09758881551140278.
[I 2025-12-05 14:59:34,466] Trial 51 finished with value: 0.07715850669991832 and parameters: {'model_type': 'mlp', 'hidden_dims': '[128, 64]', 'dropout': 0.29943061098430773, 'batch_norm': False, 'lr': 6.788859554648527e-05, 'weight_decay': 0.00012175592252051999, 'epochs': 319, 'loss': 'mse', 'optimizer': 'adam', 'graph_mode': 'off', 'use_snp_selection': True, 'num_snps': 23124}. Best is trial 35 with value: 0.09758881551140278.
[I 2025-12-05 14:59:36,209] Trial 52 finished with value: 0.0979971606221654 and parameters: {'model_type': 'mlp', 'hidden_dims': '[128, 64]', 'dropout': 0.26135023552718484, 'batch_norm': False, 'lr': 2.516378293932779e-05, 'weight_decay': 0.0006257198960999199, 'epochs': 348, 'loss': 'mse', 'optimizer': 'adam', 'graph_mode': 'off', 'use_snp_selection': True, 'num_snps': 29695}. Best is trial 52 with value: 0.0979971606221654.
[I 2025-12-05 14:59:38,209] Trial 53 finished with value: 0.06131183014449334 and parameters: {'model_type': 'mlp', 'hidden_dims': '[128, 64]', 'dropout': 0.25891610293641376, 'batch_norm': False, 'lr': 2.932817678999959e-05, 'weight_decay': 0.0007300965908870003, 'epochs': 338, 'loss': 'mse', 'optimizer': 'adam', 'graph_mode': 'off', 'use_snp_selection': True, 'num_snps': 34276}. Best is trial 52 with value: 0.0979971606221654.
[I 2025-12-05 14:59:40,438] Trial 54 finished with value: 0.08931785729456411 and parameters: {'model_type': 'mlp', 'hidden_dims': '[256, 128]', 'dropout': 0.34565883153242727, 'batch_norm': False, 'lr': 2.1693655865400713e-05, 'weight_decay': 0.0002787336875866184, 'epochs': 346, 'loss': 'mse', 'optimizer': 'adam', 'graph_mode': 'off', 'use_snp_selection': True, 'num_snps': 38914}. Best is trial 52 with value: 0.0979971606221654.
[I 2025-12-05 14:59:42,576] Trial 55 finished with value: 0.0959121012011841 and parameters: {'model_type': 'mlp', 'hidden_dims': '[512, 256]', 'dropout': 0.1756026829325592, 'batch_norm': False, 'lr': 6.2472660111677514e-06, 'weight_decay': 0.000561020926620534, 'epochs': 296, 'loss': 'mse', 'optimizer': 'adam', 'graph_mode': 'off', 'use_snp_selection': True, 'num_snps': 29491}. Best is trial 52 with value: 0.0979971606221654.
[I 2025-12-05 14:59:44,601] Trial 56 finished with value: 0.0899821115382994 and parameters: {'model_type': 'mlp', 'hidden_dims': '[512, 256]', 'dropout': 0.1704027074528515, 'batch_norm': False, 'lr': 5.766869593887652e-06, 'weight_decay': 0.0004781249371012179, 'epochs': 274, 'loss': 'mse', 'optimizer': 'adam', 'graph_mode': 'off', 'use_snp_selection': True, 'num_snps': 29831}. Best is trial 52 with value: 0.0979971606221654.
[I 2025-12-05 14:59:46,748] Trial 57 finished with value: 0.05184754746183598 and parameters: {'model_type': 'mlp', 'hidden_dims': '[512, 256]', 'dropout': 0.3772716253029255, 'batch_norm': False, 'lr': 9.326830514161685e-06, 'weight_decay': 0.0006954578518557136, 'epochs': 315, 'loss': 'mse', 'optimizer': 'adam', 'graph_mode': 'off', 'use_snp_selection': True, 'num_snps': 31123}. Best is trial 52 with value: 0.0979971606221654.
[I 2025-12-05 14:59:48,840] Trial 58 finished with value: 0.06652517134054642 and parameters: {'model_type': 'mlp', 'hidden_dims': '[512, 256]', 'dropout': 0.20962266567985016, 'batch_norm': False, 'lr': 4.709461316396829e-06, 'weight_decay': 0.0003215520695544814, 'epochs': 43, 'loss': 'mse', 'optimizer': 'adam', 'graph_mode': 'off', 'use_snp_selection': True, 'num_snps': 39687}. Best is trial 52 with value: 0.0979971606221654.
[I 2025-12-05 14:59:50,945] Trial 59 finished with value: 0.08909441320385757 and parameters: {'model_type': 'mlp', 'hidden_dims': '[512, 256]', 'dropout': 0.25782721335564496, 'batch_norm': False, 'lr': 1.1059400658729337e-05, 'weight_decay': 0.0009168035810883383, 'epochs': 306, 'loss': 'mse', 'optimizer': 'adam', 'graph_mode': 'off', 'use_snp_selection': True, 'num_snps': 29355}. Best is trial 52 with value: 0.0979971606221654.
[I 2025-12-05 14:59:52,274] Trial 60 finished with value: 0.06608810404407651 and parameters: {'model_type': 'mlp', 'hidden_dims': '[512, 256]', 'dropout': 0.41872847662934437, 'batch_norm': False, 'lr': 1.6046191587988826e-05, 'weight_decay': 0.000669933119068479, 'epochs': 328, 'loss': 'mse', 'optimizer': 'adam', 'graph_mode': 'off', 'use_snp_selection': True, 'num_snps': 14434}. Best is trial 52 with value: 0.0979971606221654.
[I 2025-12-05 14:59:53,908] Trial 61 finished with value: 0.09084723669676165 and parameters: {'model_type': 'mlp', 'hidden_dims': '[128, 64]', 'dropout': 0.18937961285434568, 'batch_norm': False, 'lr': 6.220781037185603e-05, 'weight_decay': 0.00018127137865687318, 'epochs': 295, 'loss': 'mse', 'optimizer': 'adam', 'graph_mode': 'off', 'use_snp_selection': True, 'num_snps': 22751}. Best is trial 52 with value: 0.0979971606221654.
[I 2025-12-05 14:59:55,734] Trial 62 finished with value: 0.07921777168662156 and parameters: {'model_type': 'mlp', 'hidden_dims': '[512, 128]', 'dropout': 0.16053466840425296, 'batch_norm': False, 'lr': 7.588506222504426e-06, 'weight_decay': 0.00041522165479152917, 'epochs': 206, 'loss': 'mse', 'optimizer': 'adam', 'graph_mode': 'off', 'use_snp_selection': True, 'num_snps': 27879}. Best is trial 52 with value: 0.0979971606221654.
[I 2025-12-05 14:59:57,616] Trial 63 finished with value: 0.09606555254610312 and parameters: {'model_type': 'mlp', 'hidden_dims': '[256, 128, 64]', 'dropout': 0.193941650773729, 'batch_norm': False, 'lr': 0.00014703181030489542, 'weight_decay': 0.00018186918513338107, 'epochs': 293, 'loss': 'mse', 'optimizer': 'adam', 'graph_mode': 'off', 'use_snp_selection': True, 'num_snps': 32973}. Best is trial 52 with value: 0.0979971606221654.
[I 2025-12-05 14:59:59,599] Trial 64 finished with value: 0.09299985024837899 and parameters: {'model_type': 'mlp', 'hidden_dims': '[256, 128, 64]', 'dropout': 0.12961975301696313, 'batch_norm': False, 'lr': 0.00022900474167202741, 'weight_decay': 0.0002886822007385341, 'epochs': 276, 'loss': 'mse', 'optimizer': 'adam', 'graph_mode': 'off', 'use_snp_selection': True, 'num_snps': 33390}. Best is trial 52 with value: 0.0979971606221654.
[I 2025-12-05 15:00:02,173] Trial 65 finished with value: 0.0924282762065664 and parameters: {'model_type': 'mlp', 'hidden_dims': '[256, 128, 64]', 'dropout': 0.22847756752362527, 'batch_norm': False, 'lr': 0.0001510811629548524, 'weight_decay': 5.697630965715976e-05, 'epochs': 233, 'loss': 'mse', 'optimizer': 'adam', 'graph_mode': 'off', 'use_snp_selection': True, 'num_snps': 50015}. Best is trial 52 with value: 0.0979971606221654.
[I 2025-12-05 15:00:04,374] Trial 66 finished with value: 0.09792292820217156 and parameters: {'model_type': 'mlp', 'hidden_dims': '[256, 128, 64]', 'dropout': 0.2158919326791135, 'batch_norm': False, 'lr': 5.2062631191372766e-05, 'weight_decay': 0.00021096003729160147, 'epochs': 349, 'loss': 'mse', 'optimizer': 'adam', 'graph_mode': 'off', 'use_snp_selection': True, 'num_snps': 37091}. Best is trial 52 with value: 0.0979971606221654.
[I 2025-12-05 15:00:06,719] Trial 67 finished with value: 0.0821790734266312 and parameters: {'model_type': 'mlp', 'hidden_dims': '[256, 128, 64]', 'dropout': 0.1762106498476385, 'batch_norm': False, 'lr': 5.115405001889524e-05, 'weight_decay': 0.00017822106136755283, 'epochs': 347, 'loss': 'mse', 'optimizer': 'adam', 'graph_mode': 'off', 'use_snp_selection': True, 'num_snps': 38067}. Best is trial 52 with value: 0.0979971606221654.
[I 2025-12-05 15:00:09,297] Trial 68 finished with value: 0.09148248269032896 and parameters: {'model_type': 'mlp', 'hidden_dims': '[256, 128, 64]', 'dropout': 0.12564702926417756, 'batch_norm': False, 'lr': 0.0003546797105879707, 'weight_decay': 6.834620791258628e-05, 'epochs': 350, 'loss': 'mse', 'optimizer': 'adam', 'graph_mode': 'off', 'use_snp_selection': True, 'num_snps': 45642}. Best is trial 52 with value: 0.0979971606221654.
[I 2025-12-05 15:00:11,513] Trial 69 finished with value: 0.025364789763797867 and parameters: {'model_type': 'mlp', 'hidden_dims': '[256, 128, 64]', 'dropout': 0.5984760164748781, 'batch_norm': False, 'lr': 1.783141081667098e-05, 'weight_decay': 0.00023169761192895345, 'epochs': 305, 'loss': 'mse', 'optimizer': 'adam', 'graph_mode': 'off', 'use_snp_selection': True, 'num_snps': 36665}. Best is trial 52 with value: 0.0979971606221654.
[I 2025-12-05 15:00:13,622] Trial 70 finished with value: 0.04669104322085155 and parameters: {'model_type': 'mlp', 'hidden_dims': '[256, 128, 64]', 'dropout': 0.20749959300821091, 'batch_norm': False, 'lr': 1.0185647520527938e-06, 'weight_decay': 4.1178230225326567e-05, 'epochs': 339, 'loss': 'mse', 'optimizer': 'adam', 'graph_mode': 'off', 'use_snp_selection': True, 'num_snps': 32827}. Best is trial 52 with value: 0.0979971606221654.
[I 2025-12-05 15:00:15,528] Trial 71 finished with value: 0.07814723796870843 and parameters: {'model_type': 'mlp', 'hidden_dims': '[256, 128, 64]', 'dropout': 0.192328051126873, 'batch_norm': False, 'lr': 3.5699410130905906e-05, 'weight_decay': 0.0005246158850200169, 'epochs': 321, 'loss': 'mse', 'optimizer': 'adam', 'graph_mode': 'off', 'use_snp_selection': True, 'num_snps': 29294}. Best is trial 52 with value: 0.0979971606221654.
[I 2025-12-05 15:00:17,942] Trial 72 finished with value: 0.10602043593100756 and parameters: {'model_type': 'mlp', 'hidden_dims': '[512, 256]', 'dropout': 0.26669613479617166, 'batch_norm': False, 'lr': 2.520275279564614e-05, 'weight_decay': 0.0003395888793091459, 'epochs': 331, 'loss': 'mse', 'optimizer': 'adam', 'graph_mode': 'off', 'use_snp_selection': True, 'num_snps': 34971}. Best is trial 72 with value: 0.10602043593100756.
[I 2025-12-05 15:00:19,864] Trial 73 finished with value: 0.06164222204162165 and parameters: {'model_type': 'mlp', 'hidden_dims': '[256, 128, 64]', 'dropout': 0.27330261204297657, 'batch_norm': False, 'lr': 4.150539276349491e-06, 'weight_decay': 9.775896641734374e-05, 'epochs': 291, 'loss': 'mse', 'optimizer': 'adam', 'graph_mode': 'off', 'use_snp_selection': True, 'num_snps': 35167}. Best is trial 72 with value: 0.10602043593100756.
[I 2025-12-05 15:00:21,767] Trial 74 finished with value: 0.08755375174754419 and parameters: {'model_type': 'mlp', 'hidden_dims': '[256, 128]', 'dropout': 0.24599319444035778, 'batch_norm': False, 'lr': 8.5444333886478e-05, 'weight_decay': 0.00035870717822728617, 'epochs': 339, 'loss': 'mse', 'optimizer': 'adam', 'graph_mode': 'off', 'use_snp_selection': True, 'num_snps': 32118}. Best is trial 72 with value: 0.10602043593100756.
[I 2025-12-05 15:00:23,961] Trial 75 finished with value: 0.06605898275162835 and parameters: {'model_type': 'mlp', 'hidden_dims': '[512, 128]', 'dropout': 0.21667569458565947, 'batch_norm': False, 'lr': 1.1838080157774265e-05, 'weight_decay': 0.00014418798284530844, 'epochs': 74, 'loss': 'mse', 'optimizer': 'adam', 'graph_mode': 'off', 'use_snp_selection': True, 'num_snps': 42339}. Best is trial 72 with value: 0.10602043593100756.
[I 2025-12-05 15:00:26,382] Trial 76 finished with value: 0.07935197215008616 and parameters: {'model_type': 'mlp', 'hidden_dims': '[512, 256]', 'dropout': 0.31293540748146587, 'batch_norm': False, 'lr': 0.00013071939529413651, 'weight_decay': 0.00022091347641192596, 'epochs': 312, 'loss': 'mse', 'optimizer': 'adam', 'graph_mode': 'off', 'use_snp_selection': True, 'num_snps': 36488}. Best is trial 72 with value: 0.10602043593100756.
[I 2025-12-05 15:00:27,873] Trial 77 finished with value: 0.08264774385776602 and parameters: {'model_type': 'mlp', 'hidden_dims': '[128, 64]', 'dropout': 0.15908964984969481, 'batch_norm': False, 'lr': 4.6714439641490504e-05, 'weight_decay': 0.00046093448884487205, 'epochs': 281, 'loss': 'mse', 'optimizer': 'adam', 'graph_mode': 'off', 'use_snp_selection': True, 'num_snps': 21679}. Best is trial 72 with value: 0.10602043593100756.
[I 2025-12-05 15:00:28,997] Trial 78 finished with value: 0.09660589997321417 and parameters: {'model_type': 'mlp', 'hidden_dims': '[128, 64]', 'dropout': 0.36088599720349407, 'batch_norm': False, 'lr': 3.331434844702349e-05, 'weight_decay': 0.00031678575218791155, 'epochs': 323, 'loss': 'mse', 'optimizer': 'adam', 'graph_mode': 'off', 'use_snp_selection': True, 'num_snps': 7320}. Best is trial 72 with value: 0.10602043593100756.
[I 2025-12-05 15:00:31,513] Trial 79 finished with value: 0.08356573189098067 and parameters: {'model_type': 'mlp', 'hidden_dims': '[256, 128, 64]', 'dropout': 0.3966559222226237, 'batch_norm': False, 'lr': 3.121594357315009e-05, 'weight_decay': 0.00033077219357581977, 'epochs': 321, 'loss': 'mse', 'optimizer': 'adam', 'graph_mode': 'off', 'use_snp_selection': True, 'num_snps': 46123}. Best is trial 72 with value: 0.10602043593100756.
[I 2025-12-05 15:00:32,438] Trial 80 finished with value: 0.07948384430132023 and parameters: {'model_type': 'mlp', 'hidden_dims': '[128, 64]', 'dropout': 0.3554320403455364, 'batch_norm': False, 'lr': 7.149217458244682e-06, 'weight_decay': 0.0006660009387409378, 'epochs': 299, 'loss': 'mse', 'optimizer': 'adam', 'graph_mode': 'off', 'use_snp_selection': True, 'num_snps': 3231}. Best is trial 72 with value: 0.10602043593100756.
[I 2025-12-05 15:00:33,473] Trial 81 finished with value: 0.09929504481664202 and parameters: {'model_type': 'mlp', 'hidden_dims': '[128, 64]', 'dropout': 0.3231185824154077, 'batch_norm': False, 'lr': 5.716942528755222e-05, 'weight_decay': 0.00017383285079867566, 'epochs': 331, 'loss': 'mse', 'optimizer': 'adam', 'graph_mode': 'off', 'use_snp_selection': True, 'num_snps': 6343}. Best is trial 72 with value: 0.10602043593100756.
[I 2025-12-05 15:00:34,615] Trial 82 finished with value: 0.04519069009315356 and parameters: {'model_type': 'mlp', 'hidden_dims': '[128, 64]', 'dropout': 0.36620984708985477, 'batch_norm': False, 'lr': 1.963063442436215e-05, 'weight_decay': 0.0002044835967105186, 'epochs': 331, 'loss': 'mse', 'optimizer': 'adam', 'graph_mode': 'off', 'use_snp_selection': True, 'num_snps': 7678}. Best is trial 72 with value: 0.10602043593100756.
[I 2025-12-05 15:00:35,725] Trial 83 finished with value: 0.10463438972168826 and parameters: {'model_type': 'mlp', 'hidden_dims': '[128, 64]', 'dropout': 0.3189230817548369, 'batch_norm': False, 'lr': 3.790396347310878e-05, 'weight_decay': 0.00030367939937993245, 'epochs': 342, 'loss': 'mse', 'optimizer': 'adam', 'graph_mode': 'off', 'use_snp_selection': True, 'num_snps': 6261}. Best is trial 72 with value: 0.10602043593100756.
[I 2025-12-05 15:00:36,814] Trial 84 finished with value: 0.08974020846587287 and parameters: {'model_type': 'mlp', 'hidden_dims': '[128, 64]', 'dropout': 0.32283679531410947, 'batch_norm': False, 'lr': 4.17061673587591e-05, 'weight_decay': 0.000266762560284211, 'epochs': 339, 'loss': 'mse', 'optimizer': 'adam', 'graph_mode': 'off', 'use_snp_selection': True, 'num_snps': 6206}. Best is trial 72 with value: 0.10602043593100756.
[I 2025-12-05 15:00:37,866] Trial 85 finished with value: 0.07172578542145708 and parameters: {'model_type': 'mlp', 'hidden_dims': '[128, 64]', 'dropout': 0.31442401422394967, 'batch_norm': False, 'lr': 5.615242092471644e-05, 'weight_decay': 8.463649524196475e-06, 'epochs': 346, 'loss': 'mse', 'optimizer': 'adam', 'graph_mode': 'off', 'use_snp_selection': True, 'num_snps': 5600}. Best is trial 72 with value: 0.10602043593100756.
[I 2025-12-05 15:00:38,966] Trial 86 finished with value: 0.07396463455844328 and parameters: {'model_type': 'mlp', 'hidden_dims': '[128, 64]', 'dropout': 0.3386539567614256, 'batch_norm': False, 'lr': 2.418431359613595e-05, 'weight_decay': 0.0003630399536457702, 'epochs': 323, 'loss': 'mse', 'optimizer': 'adam', 'graph_mode': 'off', 'use_snp_selection': True, 'num_snps': 8685}. Best is trial 72 with value: 0.10602043593100756.
