[I 2025-12-05 16:03:08,202] Trial 58 finished with value: 0.051800578657890145 and parameters: {'model_type': 'mlp', 'hidden_dims': '[256, 128]', 'dropout': 0.26348049858066636, 'batch_norm': False, 'lr': 0.0006009351673196924, 'weight_decay': 3.2660340489622824e-07, 'epochs': 53, 'loss': 'mae', 'optimizer': 'adam', 'graph_mode': 'off', 'use_snp_selection': True, 'num_snps': 52474}. Best is trial 30 with value: 0.11646223412731632.
[I 2025-12-05 16:03:09,713] Trial 59 finished with value: 0.1092627776085642 and parameters: {'model_type': 'mlp', 'hidden_dims': '[256, 128, 64]', 'dropout': 0.17712874659008504, 'batch_norm': True, 'lr': 5.573996573981588e-05, 'weight_decay': 1.5836596093259849e-07, 'epochs': 235, 'loss': 'mae', 'optimizer': 'adam', 'graph_mode': 'off', 'use_snp_selection': False}. Best is trial 30 with value: 0.11646223412731632.
[I 2025-12-05 16:03:12,313] Trial 60 finished with value: 0.09716568781704923 and parameters: {'model_type': 'mlp', 'hidden_dims': '[512, 64]', 'dropout': 0.21570468872886553, 'batch_norm': True, 'lr': 0.00018270366787467016, 'weight_decay': 1.5457952159526504e-07, 'epochs': 244, 'loss': 'mae', 'optimizer': 'adam', 'graph_mode': 'off', 'use_snp_selection': False}. Best is trial 30 with value: 0.11646223412731632.
[I 2025-12-05 16:03:13,729] Trial 61 finished with value: 0.06713678985010556 and parameters: {'model_type': 'mlp', 'hidden_dims': '[256, 128, 64]', 'dropout': 0.17678353711084846, 'batch_norm': True, 'lr': 4.992407162200649e-05, 'weight_decay': 1.1151157981372272e-07, 'epochs': 205, 'loss': 'mae', 'optimizer': 'adam', 'graph_mode': 'off', 'use_snp_selection': False}. Best is trial 30 with value: 0.11646223412731632.
[I 2025-12-05 16:03:15,217] Trial 62 finished with value: 0.06899453363048967 and parameters: {'model_type': 'mlp', 'hidden_dims': '[256, 128, 64]', 'dropout': 0.19324927131858252, 'batch_norm': True, 'lr': 8.951040947597848e-05, 'weight_decay': 2.817792800011823e-07, 'epochs': 229, 'loss': 'mae', 'optimizer': 'adam', 'graph_mode': 'off', 'use_snp_selection': False}. Best is trial 30 with value: 0.11646223412731632.
[I 2025-12-05 16:03:16,740] Trial 63 finished with value: 0.09205665235588936 and parameters: {'model_type': 'mlp', 'hidden_dims': '[256, 128, 64]', 'dropout': 0.11985178199746194, 'batch_norm': True, 'lr': 0.00010402007723054376, 'weight_decay': 4.92706392308529e-07, 'epochs': 236, 'loss': 'mae', 'optimizer': 'adam', 'graph_mode': 'off', 'use_snp_selection': False}. Best is trial 30 with value: 0.11646223412731632.
[I 2025-12-05 16:03:17,522] Trial 64 finished with value: 0.023241898391467092 and parameters: {'model_type': 'mlp', 'hidden_dims': '[256, 128, 64]', 'dropout': 0.231569032539008, 'batch_norm': True, 'lr': 3.124407779665477e-05, 'weight_decay': 2.3855621111697626e-07, 'epochs': 40, 'loss': 'mae', 'optimizer': 'adam', 'graph_mode': 'off', 'use_snp_selection': False}. Best is trial 30 with value: 0.11646223412731632.
[I 2025-12-05 16:03:19,875] Trial 65 finished with value: 0.11425267006844791 and parameters: {'model_type': 'mlp', 'hidden_dims': '[256, 128]', 'dropout': 0.5780157941581504, 'batch_norm': False, 'lr': 6.76305324719395e-05, 'weight_decay': 6.236072349725551e-06, 'epochs': 181, 'loss': 'mae', 'optimizer': 'adam', 'graph_mode': 'off', 'use_snp_selection': True, 'num_snps': 41726}. Best is trial 30 with value: 0.11646223412731632.
[I 2025-12-05 16:03:22,315] Trial 66 finished with value: 0.06829246955194787 and parameters: {'model_type': 'mlp', 'hidden_dims': '[256, 128]', 'dropout': 0.5539461579667251, 'batch_norm': True, 'lr': 6.706112711150923e-05, 'weight_decay': 1.0161936288362044e-07, 'epochs': 177, 'loss': 'mae', 'optimizer': 'adam', 'graph_mode': 'off', 'use_snp_selection': True, 'num_snps': 40743}. Best is trial 30 with value: 0.11646223412731632.
[I 2025-12-05 16:03:25,306] Trial 67 finished with value: 0.052537277424542055 and parameters: {'model_type': 'mlp', 'hidden_dims': '[256, 128]', 'dropout': 0.5297900142307245, 'batch_norm': False, 'lr': 4.6117670515403074e-05, 'weight_decay': 1.7041679123264103e-07, 'epochs': 163, 'loss': 'mae', 'optimizer': 'adam', 'graph_mode': 'off', 'use_snp_selection': True, 'num_snps': 50650}. Best is trial 30 with value: 0.11646223412731632.
[I 2025-12-05 16:03:27,460] Trial 68 finished with value: 0.09481357590017679 and parameters: {'model_type': 'mlp', 'hidden_dims': '[256, 128]', 'dropout': 0.5981563542086725, 'batch_norm': False, 'lr': 0.00034380874717213636, 'weight_decay': 7.380428258490781e-07, 'epochs': 183, 'loss': 'mae', 'optimizer': 'adam', 'graph_mode': 'off', 'use_snp_selection': True, 'num_snps': 32816}. Best is trial 30 with value: 0.11646223412731632.
[I 2025-12-05 16:03:30,012] Trial 69 finished with value: 0.0767916242031615 and parameters: {'model_type': 'mlp', 'hidden_dims': '[256, 128]', 'dropout': 0.5615092995627822, 'batch_norm': True, 'lr': 0.0001288118985973245, 'weight_decay': 0.00038606717753040593, 'epochs': 210, 'loss': 'mae', 'optimizer': 'adam', 'graph_mode': 'off', 'use_snp_selection': True, 'num_snps': 43308}. Best is trial 30 with value: 0.11646223412731632.
[I 2025-12-05 16:03:33,585] Trial 70 finished with value: 0.09630111641339127 and parameters: {'model_type': 'mlp', 'hidden_dims': '[512, 256]', 'dropout': 0.49592941390393536, 'batch_norm': False, 'lr': 5.7957941738193525e-05, 'weight_decay': 4.291457655493634e-07, 'epochs': 197, 'loss': 'mse', 'optimizer': 'adam', 'graph_mode': 'off', 'use_snp_selection': True, 'num_snps': 53827}. Best is trial 30 with value: 0.11646223412731632.
[I 2025-12-05 16:03:34,478] Trial 71 finished with value: 0.049229150822744934 and parameters: {'model_type': 'mlp', 'hidden_dims': '[256, 128, 64]', 'dropout': 0.48098211760179266, 'batch_norm': False, 'lr': 4.050668188640389e-05, 'weight_decay': 6.825538604577095e-06, 'epochs': 65, 'loss': 'mae', 'optimizer': 'adam', 'graph_mode': 'off', 'use_snp_selection': False}. Best is trial 30 with value: 0.11646223412731632.
[I 2025-12-05 16:03:36,283] Trial 72 finished with value: 0.09951658666747537 and parameters: {'model_type': 'mlp', 'hidden_dims': '[128, 64]', 'dropout': 0.17755696259429546, 'batch_norm': False, 'lr': 2.7936781830313606e-05, 'weight_decay': 4.802565811863191e-06, 'epochs': 112, 'loss': 'mae', 'optimizer': 'adam', 'graph_mode': 'off', 'use_snp_selection': True, 'num_snps': 26903}. Best is trial 30 with value: 0.11646223412731632.
[I 2025-12-05 16:03:37,256] Trial 73 finished with value: 0.088227148353713 and parameters: {'model_type': 'mlp', 'hidden_dims': '[256, 128, 64]', 'dropout': 0.2022049425251699, 'batch_norm': False, 'lr': 1.7712732686303026e-05, 'weight_decay': 8.235588133978581e-06, 'epochs': 89, 'loss': 'mae', 'optimizer': 'adam', 'graph_mode': 'off', 'use_snp_selection': False}. Best is trial 30 with value: 0.11646223412731632.
[I 2025-12-05 16:03:38,823] Trial 74 finished with value: 0.08736178110933118 and parameters: {'model_type': 'mlp', 'hidden_dims': '[256, 128]', 'dropout': 0.5683513489623175, 'batch_norm': False, 'lr': 9.018772391248236e-05, 'weight_decay': 3.045962811292553e-06, 'epochs': 258, 'loss': 'mae', 'optimizer': 'adam', 'graph_mode': 'off', 'use_snp_selection': False}. Best is trial 30 with value: 0.11646223412731632.
[I 2025-12-05 16:03:41,855] Trial 75 finished with value: 0.0754844320899259 and parameters: {'model_type': 'mlp', 'hidden_dims': '[512, 128]', 'dropout': 0.5835478726486636, 'batch_norm': False, 'lr': 0.0001124973158242905, 'weight_decay': 1.3592591092004832e-05, 'epochs': 153, 'loss': 'mae', 'optimizer': 'adam', 'graph_mode': 'off', 'use_snp_selection': True, 'num_snps': 44621}. Best is trial 30 with value: 0.11646223412731632.
[I 2025-12-05 16:03:43,310] Trial 76 finished with value: 0.07586513088316552 and parameters: {'model_type': 'mlp', 'hidden_dims': '[256, 128, 64]', 'dropout': 0.52696798993883, 'batch_norm': False, 'lr': 1.1909841163966147e-05, 'weight_decay': 2.1020879047060337e-05, 'epochs': 226, 'loss': 'mae', 'optimizer': 'adam', 'graph_mode': 'off', 'use_snp_selection': False}. Best is trial 30 with value: 0.11646223412731632.
[I 2025-12-05 16:03:45,025] Trial 77 finished with value: 0.09530356274655577 and parameters: {'model_type': 'mlp', 'hidden_dims': '[256, 128]', 'dropout': 0.24563948488409842, 'batch_norm': False, 'lr': 2.1450049307848973e-06, 'weight_decay': 5.442485452820822e-06, 'epochs': 297, 'loss': 'mse', 'optimizer': 'adam', 'graph_mode': 'off', 'use_snp_selection': False}. Best is trial 30 with value: 0.11646223412731632.
[I 2025-12-05 16:03:47,538] Trial 78 finished with value: 0.042485683229059885 and parameters: {'model_type': 'mlp', 'hidden_dims': '[512, 256]', 'dropout': 0.1525716551327643, 'batch_norm': True, 'lr': 5.2645900001402844e-06, 'weight_decay': 3.33236423404125e-05, 'epochs': 134, 'loss': 'mae', 'optimizer': 'adam', 'graph_mode': 'off', 'use_snp_selection': True, 'num_snps': 34643}. Best is trial 30 with value: 0.11646223412731632.
[I 2025-12-05 16:03:48,921] Trial 79 finished with value: 0.07448940501925044 and parameters: {'model_type': 'mlp', 'hidden_dims': '[256, 128, 64]', 'dropout': 0.131584742303246, 'batch_norm': False, 'lr': 0.000732843462655572, 'weight_decay': 3.7314021311522433e-06, 'epochs': 206, 'loss': 'mse', 'optimizer': 'adam', 'graph_mode': 'off', 'use_snp_selection': False}. Best is trial 30 with value: 0.11646223412731632.
[I 2025-12-05 16:03:50,435] Trial 80 finished with value: 0.09973779473529429 and parameters: {'model_type': 'mlp', 'hidden_dims': '[256, 128]', 'dropout': 0.282590639189167, 'batch_norm': False, 'lr': 7.341836158390578e-05, 'weight_decay': 2.0973098527745138e-06, 'epochs': 245, 'loss': 'mae', 'optimizer': 'adam', 'graph_mode': 'off', 'use_snp_selection': False}. Best is trial 30 with value: 0.11646223412731632.
[I 2025-12-05 16:03:52,660] Trial 81 finished with value: 0.07818791996881119 and parameters: {'model_type': 'mlp', 'hidden_dims': '[512, 256]', 'dropout': 0.20716347873232516, 'batch_norm': False, 'lr': 0.00024146143201410404, 'weight_decay': 1.4264269072707797e-07, 'epochs': 203, 'loss': 'mae', 'optimizer': 'adam', 'graph_mode': 'off', 'use_snp_selection': False}. Best is trial 30 with value: 0.11646223412731632.
[I 2025-12-05 16:03:54,798] Trial 82 finished with value: 0.08991568130138726 and parameters: {'model_type': 'mlp', 'hidden_dims': '[512, 256]', 'dropout': 0.22211141719000826, 'batch_norm': False, 'lr': 5.537375784796181e-05, 'weight_decay': 2.190786113394414e-07, 'epochs': 185, 'loss': 'mae', 'optimizer': 'adam', 'graph_mode': 'off', 'use_snp_selection': False}. Best is trial 30 with value: 0.11646223412731632.
[I 2025-12-05 16:03:56,994] Trial 83 finished with value: 0.08674976928128131 and parameters: {'model_type': 'mlp', 'hidden_dims': '[512, 256]', 'dropout': 0.1882082568155891, 'batch_norm': False, 'lr': 0.0001467606251571092, 'weight_decay': 1.0000923866013437e-06, 'epochs': 191, 'loss': 'mae', 'optimizer': 'adam', 'graph_mode': 'off', 'use_snp_selection': False}. Best is trial 30 with value: 0.11646223412731632.
[I 2025-12-05 16:03:58,991] Trial 84 finished with value: 0.1002548218016623 and parameters: {'model_type': 'mlp', 'hidden_dims': '[512, 256]', 'dropout': 0.10019444601336598, 'batch_norm': False, 'lr': 0.00016906898817906473, 'weight_decay': 1.334552001373161e-07, 'epochs': 165, 'loss': 'mae', 'optimizer': 'adam', 'graph_mode': 'off', 'use_snp_selection': False}. Best is trial 30 with value: 0.11646223412731632.
[I 2025-12-05 16:04:00,292] Trial 85 finished with value: 0.10849447677952345 and parameters: {'model_type': 'mlp', 'hidden_dims': '[512, 256]', 'dropout': 0.17092759135983648, 'batch_norm': False, 'lr': 3.566143293104614e-05, 'weight_decay': 1.3518914711793715e-07, 'epochs': 70, 'loss': 'mae', 'optimizer': 'adam', 'graph_mode': 'off', 'use_snp_selection': False}. Best is trial 30 with value: 0.11646223412731632.
[I 2025-12-05 16:04:01,201] Trial 86 finished with value: 0.06321912019404659 and parameters: {'model_type': 'mlp', 'hidden_dims': '[256, 128, 64]', 'dropout': 0.17117064444918487, 'batch_norm': False, 'lr': 4.117426122168831e-05, 'weight_decay': 8.105825425434237e-06, 'epochs': 71, 'loss': 'mse', 'optimizer': 'adam', 'graph_mode': 'off', 'use_snp_selection': False}. Best is trial 30 with value: 0.11646223412731632.
[I 2025-12-05 16:04:02,388] Trial 87 finished with value: 0.02918322381192856 and parameters: {'model_type': 'mlp', 'hidden_dims': '[512, 64]', 'dropout': 0.15150664876181902, 'batch_norm': True, 'lr': 3.339655967366364e-05, 'weight_decay': 0.00018257047920097456, 'epochs': 58, 'loss': 'mae', 'optimizer': 'adam', 'graph_mode': 'off', 'use_snp_selection': False}. Best is trial 30 with value: 0.11646223412731632.
[I 2025-12-05 16:04:04,647] Trial 88 finished with value: 0.017985617928267958 and parameters: {'model_type': 'mlp', 'hidden_dims': '[128, 64]', 'dropout': 0.4131349588996338, 'batch_norm': False, 'lr': 3.839104591504781e-06, 'weight_decay': 6.525376641112008e-05, 'epochs': 82, 'loss': 'mae', 'optimizer': 'adam', 'graph_mode': 'off', 'use_snp_selection': True, 'num_snps': 49533}. Best is trial 30 with value: 0.11646223412731632.
[I 2025-12-05 16:04:05,434] Trial 89 finished with value: 0.051080210385550516 and parameters: {'model_type': 'mlp', 'hidden_dims': '[256, 128]', 'dropout': 0.23190144684006753, 'batch_norm': False, 'lr': 2.536898935240786e-05, 'weight_decay': 1.8995490621928226e-07, 'epochs': 49, 'loss': 'mse', 'optimizer': 'adam', 'graph_mode': 'off', 'use_snp_selection': False}. Best is trial 30 with value: 0.11646223412731632.
[I 2025-12-05 16:04:06,403] Trial 90 finished with value: 0.010322142800202536 and parameters: {'model_type': 'mlp', 'hidden_dims': '[256, 128, 64]', 'dropout': 0.4644865184313488, 'batch_norm': True, 'lr': 1.819032753432503e-05, 'weight_decay': 3.3811538496381364e-07, 'epochs': 90, 'loss': 'mae', 'optimizer': 'adam', 'graph_mode': 'off', 'use_snp_selection': False}. Best is trial 30 with value: 0.11646223412731632.
[I 2025-12-05 16:04:08,646] Trial 91 finished with value: 0.09712148773680375 and parameters: {'model_type': 'mlp', 'hidden_dims': '[512, 256]', 'dropout': 0.2055391421471069, 'batch_norm': False, 'lr': 6.050375989673049e-05, 'weight_decay': 1.1187536780090267e-07, 'epochs': 198, 'loss': 'mae', 'optimizer': 'adam', 'graph_mode': 'off', 'use_snp_selection': False}. Best is trial 30 with value: 0.11646223412731632.
[I 2025-12-05 16:04:11,015] Trial 92 finished with value: 0.11023801677709139 and parameters: {'model_type': 'mlp', 'hidden_dims': '[512, 256]', 'dropout': 0.19352974864261913, 'batch_norm': False, 'lr': 8.661599023620352e-05, 'weight_decay': 1.392351469666757e-07, 'epochs': 215, 'loss': 'mae', 'optimizer': 'adam', 'graph_mode': 'off', 'use_snp_selection': False}. Best is trial 30 with value: 0.11646223412731632.
[I 2025-12-05 16:04:13,369] Trial 93 finished with value: 0.09513664527004319 and parameters: {'model_type': 'mlp', 'hidden_dims': '[512, 256]', 'dropout': 0.16393002335374263, 'batch_norm': False, 'lr': 8.523033963477568e-05, 'weight_decay': 2.397827043667595e-07, 'epochs': 213, 'loss': 'mae', 'optimizer': 'adam', 'graph_mode': 'off', 'use_snp_selection': False}. Best is trial 30 with value: 0.11646223412731632.
[I 2025-12-05 16:04:15,765] Trial 94 finished with value: 0.08896465694568795 and parameters: {'model_type': 'mlp', 'hidden_dims': '[512, 256]', 'dropout': 0.1805827290044048, 'batch_norm': False, 'lr': 4.657539816580427e-05, 'weight_decay': 1.5279446674413052e-07, 'epochs': 222, 'loss': 'mae', 'optimizer': 'adam', 'graph_mode': 'off', 'use_snp_selection': False}. Best is trial 30 with value: 0.11646223412731632.
[I 2025-12-05 16:04:18,246] Trial 95 finished with value: 0.09683362132252783 and parameters: {'model_type': 'mlp', 'hidden_dims': '[512, 256]', 'dropout': 0.2583268275171843, 'batch_norm': False, 'lr': 0.00010229914031743663, 'weight_decay': 2.755102404629629e-07, 'epochs': 231, 'loss': 'mae', 'optimizer': 'adam', 'graph_mode': 'off', 'use_snp_selection': False}. Best is trial 30 with value: 0.11646223412731632.
[I 2025-12-05 16:04:19,283] Trial 96 finished with value: 0.09198206396293757 and parameters: {'model_type': 'mlp', 'hidden_dims': '[256, 128, 64]', 'dropout': 0.21950224256323375, 'batch_norm': False, 'lr': 6.410932075324403e-05, 'weight_decay': 1.4027781703137184e-05, 'epochs': 102, 'loss': 'mae', 'optimizer': 'adam', 'graph_mode': 'off', 'use_snp_selection': False}. Best is trial 30 with value: 0.11646223412731632.
[I 2025-12-05 16:04:20,203] Trial 97 finished with value: 0.09384636819591749 and parameters: {'model_type': 'mlp', 'hidden_dims': '[256, 128]', 'dropout': 0.18973419710842762, 'batch_norm': False, 'lr': 3.903433013394823e-05, 'weight_decay': 0.000929389976138904, 'epochs': 73, 'loss': 'mse', 'optimizer': 'adam', 'graph_mode': 'off', 'use_snp_selection': False}. Best is trial 30 with value: 0.11646223412731632.
[I 2025-12-05 16:04:23,297] Trial 98 finished with value: 0.08466327941285606 and parameters: {'model_type': 'mlp', 'hidden_dims': '[512, 128]', 'dropout': 0.12811498231490348, 'batch_norm': False, 'lr': 5.2198397172191874e-05, 'weight_decay': 5.278049397217075e-07, 'epochs': 237, 'loss': 'mae', 'optimizer': 'adam', 'graph_mode': 'off', 'use_snp_selection': True, 'num_snps': 40316}. Best is trial 30 with value: 0.11646223412731632.
[I 2025-12-05 16:04:25,363] Trial 99 finished with value: 0.06087698817769957 and parameters: {'model_type': 'mlp', 'hidden_dims': '[512, 256]', 'dropout': 0.11238486204572357, 'batch_norm': True, 'lr': 7.175726957311162e-05, 'weight_decay': 2.035800807536546e-07, 'epochs': 179, 'loss': 'mae', 'optimizer': 'adam', 'graph_mode': 'off', 'use_snp_selection': False}. Best is trial 30 with value: 0.11646223412731632.
[I 2025-12-05 16:04:26,432] Trial 100 finished with value: 0.11148412635634555 and parameters: {'model_type': 'mlp', 'hidden_dims': '[256, 128, 64]', 'dropout': 0.30599290868007395, 'batch_norm': False, 'lr': 2.5550702444139637e-05, 'weight_decay': 3.6880789911757504e-07, 'epochs': 118, 'loss': 'mae', 'optimizer': 'adam', 'graph_mode': 'off', 'use_snp_selection': False}. Best is trial 30 with value: 0.11646223412731632.
[I 2025-12-05 16:04:27,514] Trial 101 finished with value: 0.09628355478391591 and parameters: {'model_type': 'mlp', 'hidden_dims': '[256, 128, 64]', 'dropout': 0.30960637279950287, 'batch_norm': False, 'lr': 3.204489642702571e-05, 'weight_decay': 1.2599100646156752e-07, 'epochs': 116, 'loss': 'mae', 'optimizer': 'adam', 'graph_mode': 'off', 'use_snp_selection': False}. Best is trial 30 with value: 0.11646223412731632.
[I 2025-12-05 16:04:28,664] Trial 102 finished with value: 0.08274471344938979 and parameters: {'model_type': 'mlp', 'hidden_dims': '[256, 128, 64]', 'dropout': 0.2723660430794519, 'batch_norm': False, 'lr': 2.458550009930096e-05, 'weight_decay': 3.9619183301852327e-07, 'epochs': 132, 'loss': 'mae', 'optimizer': 'adam', 'graph_mode': 'off', 'use_snp_selection': False}. Best is trial 30 with value: 0.11646223412731632.
[I 2025-12-05 16:04:29,851] Trial 103 finished with value: 0.08005624484465673 and parameters: {'model_type': 'mlp', 'hidden_dims': '[256, 128, 64]', 'dropout': 0.34308181472713456, 'batch_norm': False, 'lr': 3.5999117258183854e-05, 'weight_decay': 1.5367732186116117e-07, 'epochs': 142, 'loss': 'mae', 'optimizer': 'adam', 'graph_mode': 'off', 'use_snp_selection': False}. Best is trial 30 with value: 0.11646223412731632.
[I 2025-12-05 16:04:31,299] Trial 104 finished with value: 0.04882595998035974 and parameters: {'model_type': 'mlp', 'hidden_dims': '[256, 128, 64]', 'dropout': 0.4288988380540186, 'batch_norm': False, 'lr': 9.301225324944036e-06, 'weight_decay': 1.0479383572142601e-07, 'epochs': 216, 'loss': 'mae', 'optimizer': 'adam', 'graph_mode': 'off', 'use_snp_selection': False}. Best is trial 30 with value: 0.11646223412731632.
[I 2025-12-05 16:04:32,308] Trial 105 finished with value: 0.07349050363238649 and parameters: {'model_type': 'mlp', 'hidden_dims': '[256, 128, 64]', 'dropout': 0.23566705474935576, 'batch_norm': False, 'lr': 1.3009064442689678e-05, 'weight_decay': 8.45022863929826e-06, 'epochs': 94, 'loss': 'mae', 'optimizer': 'adam', 'graph_mode': 'off', 'use_snp_selection': False}. Best is trial 30 with value: 0.11646223412731632.
[I 2025-12-05 16:04:35,420] Trial 106 finished with value: 0.07527378399589667 and parameters: {'model_type': 'mlp', 'hidden_dims': '[256, 128]', 'dropout': 0.2961650993070265, 'batch_norm': False, 'lr': 4.441752647467953e-05, 'weight_decay': 1.0005364123514909e-07, 'epochs': 171, 'loss': 'mse', 'optimizer': 'adam', 'graph_mode': 'off', 'use_snp_selection': True, 'num_snps': 59497}. Best is trial 30 with value: 0.11646223412731632.
[I 2025-12-05 16:04:36,623] Trial 107 finished with value: 0.07778430876175917 and parameters: {'model_type': 'mlp', 'hidden_dims': '[512, 64]', 'dropout': 0.14808556997096634, 'batch_norm': True, 'lr': 2.961040375722203e-05, 'weight_decay': 1.7791489745158358e-07, 'epochs': 65, 'loss': 'mae', 'optimizer': 'adam', 'graph_mode': 'off', 'use_snp_selection': False}. Best is trial 30 with value: 0.11646223412731632.
[I 2025-12-05 16:04:37,604] Trial 108 finished with value: 0.10201171123060998 and parameters: {'model_type': 'mlp', 'hidden_dims': '[256, 128, 64]', 'dropout': 0.24724375444401775, 'batch_norm': False, 'lr': 1.8781852329174177e-05, 'weight_decay': 2.79576319450152e-07, 'epochs': 106, 'loss': 'mae', 'optimizer': 'adam', 'graph_mode': 'off', 'use_snp_selection': False}. Best is trial 30 with value: 0.11646223412731632.
[I 2025-12-05 16:04:38,505] Trial 109 finished with value: 0.0742952452804642 and parameters: {'model_type': 'mlp', 'hidden_dims': '[256, 128]', 'dropout': 0.19902820622826728, 'batch_norm': False, 'lr': 8.027407903734496e-05, 'weight_decay': 5.846681364078357e-06, 'epochs': 85, 'loss': 'mae', 'optimizer': 'adam', 'graph_mode': 'off', 'use_snp_selection': False}. Best is trial 30 with value: 0.11646223412731632.
