[I 2025-12-06 11:10:23,422] Trial 131 finished with value: 0.3795209117443436 and parameters: {'model_type': 'mlp', 'hidden_dims': '[256, 128]', 'dropout': 0.5044032943810464, 'batch_norm': False, 'lr': 2.769449031556069e-06, 'weight_decay': 2.142235500034268e-06, 'epochs': 291, 'loss': 'mse', 'optimizer': 'adam', 'graph_mode': 'off', 'use_snp_selection': False}. Best is trial 118 with value: 0.3832441092397473.
[I 2025-12-06 11:10:54,214] Trial 132 finished with value: 0.3802590010905524 and parameters: {'model_type': 'mlp', 'hidden_dims': '[256, 128]', 'dropout': 0.47526497268730383, 'batch_norm': False, 'lr': 4.630206786351631e-06, 'weight_decay': 1.27186758649983e-06, 'epochs': 260, 'loss': 'mse', 'optimizer': 'adam', 'graph_mode': 'off', 'use_snp_selection': False}. Best is trial 118 with value: 0.3832441092397473.
[I 2025-12-06 11:11:25,300] Trial 133 finished with value: 0.3872254423298133 and parameters: {'model_type': 'mlp', 'hidden_dims': '[256, 128]', 'dropout': 0.4713176154610179, 'batch_norm': False, 'lr': 2.3504995670768953e-06, 'weight_decay': 3.0265263349985703e-06, 'epochs': 262, 'loss': 'mse', 'optimizer': 'adam', 'graph_mode': 'off', 'use_snp_selection': False}. Best is trial 133 with value: 0.3872254423298133.
[I 2025-12-06 11:11:56,612] Trial 134 finished with value: 0.3792186413993747 and parameters: {'model_type': 'mlp', 'hidden_dims': '[256, 128]', 'dropout': 0.47594680721668525, 'batch_norm': False, 'lr': 2.3632425258349548e-06, 'weight_decay': 8.606356048696174e-07, 'epochs': 264, 'loss': 'mse', 'optimizer': 'adam', 'graph_mode': 'off', 'use_snp_selection': False}. Best is trial 133 with value: 0.3872254423298133.
[I 2025-12-06 11:12:24,023] Trial 135 finished with value: 0.38024190351637505 and parameters: {'model_type': 'mlp', 'hidden_dims': '[256, 128]', 'dropout': 0.4878774512263361, 'batch_norm': False, 'lr': 4.419697449389924e-06, 'weight_decay': 1.3964748701764344e-06, 'epochs': 226, 'loss': 'mse', 'optimizer': 'adam', 'graph_mode': 'off', 'use_snp_selection': False}. Best is trial 133 with value: 0.3872254423298133.
[I 2025-12-06 11:12:49,997] Trial 136 finished with value: 0.38035305307939227 and parameters: {'model_type': 'mlp', 'hidden_dims': '[256, 128]', 'dropout': 0.487011016850049, 'batch_norm': False, 'lr': 3.881705658967535e-06, 'weight_decay': 5.014690023255194e-07, 'epochs': 212, 'loss': 'mse', 'optimizer': 'adam', 'graph_mode': 'off', 'use_snp_selection': False}. Best is trial 133 with value: 0.3872254423298133.
[I 2025-12-06 11:13:15,265] Trial 137 finished with value: 0.37051891962361083 and parameters: {'model_type': 'mlp', 'hidden_dims': '[256, 128]', 'dropout': 0.4403773850812813, 'batch_norm': False, 'lr': 6.8078666358023645e-06, 'weight_decay': 1.3126420248247269e-06, 'epochs': 205, 'loss': 'mse', 'optimizer': 'adam', 'graph_mode': 'off', 'use_snp_selection': False}. Best is trial 133 with value: 0.3872254423298133.
[I 2025-12-06 11:13:43,126] Trial 138 finished with value: 0.3794170687773571 and parameters: {'model_type': 'mlp', 'hidden_dims': '[256, 128]', 'dropout': 0.4849825643463951, 'batch_norm': False, 'lr': 4.713458265063246e-06, 'weight_decay': 4.427222875405351e-07, 'epochs': 231, 'loss': 'mse', 'optimizer': 'adam', 'graph_mode': 'off', 'use_snp_selection': False}. Best is trial 133 with value: 0.3872254423298133.
[I 2025-12-06 11:14:13,983] Trial 139 finished with value: 0.3763534855804377 and parameters: {'model_type': 'mlp', 'hidden_dims': '[256, 128]', 'dropout': 0.45989537220097026, 'batch_norm': False, 'lr': 3.901414484126163e-06, 'weight_decay': 1.456572070100098e-06, 'epochs': 261, 'loss': 'mse', 'optimizer': 'adam', 'graph_mode': 'off', 'use_snp_selection': False}. Best is trial 133 with value: 0.3872254423298133.
[I 2025-12-06 11:14:41,628] Trial 140 finished with value: 0.3739297926476953 and parameters: {'model_type': 'mlp', 'hidden_dims': '[256, 128]', 'dropout': 0.4899345056648308, 'batch_norm': False, 'lr': 6.083769154737031e-06, 'weight_decay': 5.543567733169183e-07, 'epochs': 229, 'loss': 'mse', 'optimizer': 'adam', 'graph_mode': 'off', 'use_snp_selection': False}. Best is trial 133 with value: 0.3872254423298133.
[I 2025-12-06 11:15:08,593] Trial 141 finished with value: 0.3839009985258703 and parameters: {'model_type': 'mlp', 'hidden_dims': '[256, 128]', 'dropout': 0.46935990858312554, 'batch_norm': False, 'lr': 3.645452897942279e-06, 'weight_decay': 9.154466940669462e-07, 'epochs': 222, 'loss': 'mse', 'optimizer': 'adam', 'graph_mode': 'off', 'use_snp_selection': False}. Best is trial 133 with value: 0.3872254423298133.
[I 2025-12-06 11:15:35,407] Trial 142 finished with value: 0.3790010486740309 and parameters: {'model_type': 'mlp', 'hidden_dims': '[256, 128]', 'dropout': 0.4654418637985773, 'batch_norm': False, 'lr': 3.462800403409908e-06, 'weight_decay': 7.030689082348514e-07, 'epochs': 221, 'loss': 'mse', 'optimizer': 'adam', 'graph_mode': 'off', 'use_snp_selection': False}. Best is trial 133 with value: 0.3872254423298133.
[I 2025-12-06 11:16:04,522] Trial 143 finished with value: 0.3781038968120621 and parameters: {'model_type': 'mlp', 'hidden_dims': '[256, 128]', 'dropout': 0.4803056218344364, 'batch_norm': False, 'lr': 4.272444251860998e-06, 'weight_decay': 3.0609671889176113e-07, 'epochs': 244, 'loss': 'mse', 'optimizer': 'adam', 'graph_mode': 'off', 'use_snp_selection': False}. Best is trial 133 with value: 0.3872254423298133.
[I 2025-12-06 11:16:31,245] Trial 144 finished with value: 0.3771665494990204 and parameters: {'model_type': 'mlp', 'hidden_dims': '[256, 128]', 'dropout': 0.44996859603988143, 'batch_norm': False, 'lr': 2.712971404451495e-06, 'weight_decay': 1.6448827243335134e-06, 'epochs': 220, 'loss': 'mse', 'optimizer': 'adam', 'graph_mode': 'off', 'use_snp_selection': False}. Best is trial 133 with value: 0.3872254423298133.
[I 2025-12-06 11:16:59,463] Trial 145 finished with value: 0.3772836275911223 and parameters: {'model_type': 'mlp', 'hidden_dims': '[256, 128]', 'dropout': 0.4746396462790659, 'batch_norm': False, 'lr': 2.010631423247238e-06, 'weight_decay': 9.018925501532946e-07, 'epochs': 235, 'loss': 'mse', 'optimizer': 'adam', 'graph_mode': 'off', 'use_snp_selection': False}. Best is trial 133 with value: 0.3872254423298133.
[I 2025-12-06 11:17:25,278] Trial 146 finished with value: 0.3876341413330123 and parameters: {'model_type': 'mlp', 'hidden_dims': '[256, 128]', 'dropout': 0.4927900214601868, 'batch_norm': False, 'lr': 3.6948399043428998e-06, 'weight_decay': 3.0526313812529495e-06, 'epochs': 211, 'loss': 'mse', 'optimizer': 'adam', 'graph_mode': 'off', 'use_snp_selection': False}. Best is trial 146 with value: 0.3876341413330123.
[I 2025-12-06 11:17:51,074] Trial 147 finished with value: 0.38482258608618714 and parameters: {'model_type': 'mlp', 'hidden_dims': '[256, 128]', 'dropout': 0.47060254397990525, 'batch_norm': False, 'lr': 3.1619400948009706e-06, 'weight_decay': 2.962161289928466e-06, 'epochs': 211, 'loss': 'mse', 'optimizer': 'adam', 'graph_mode': 'off', 'use_snp_selection': False}. Best is trial 146 with value: 0.3876341413330123.
[I 2025-12-06 11:18:17,024] Trial 148 finished with value: 0.377835827521077 and parameters: {'model_type': 'mlp', 'hidden_dims': '[256, 128]', 'dropout': 0.4296520308139843, 'batch_norm': False, 'lr': 2.4125252910137026e-06, 'weight_decay': 3.0925004084993075e-06, 'epochs': 212, 'loss': 'mse', 'optimizer': 'adam', 'graph_mode': 'off', 'use_snp_selection': False}. Best is trial 146 with value: 0.3876341413330123.
[I 2025-12-06 11:18:42,462] Trial 149 finished with value: 0.3456174202210113 and parameters: {'model_type': 'mlp', 'hidden_dims': '[256, 128]', 'dropout': 0.5134058089305962, 'batch_norm': True, 'lr': 3.415295082854901e-06, 'weight_decay': 2.428451494950766e-06, 'epochs': 205, 'loss': 'mse', 'optimizer': 'adam', 'graph_mode': 'off', 'use_snp_selection': False}. Best is trial 146 with value: 0.3876341413330123.
[I 2025-12-06 11:19:35,646] Trial 0 finished with value: 0.2947674014916225 and parameters: {'model_type': 'mlp', 'hidden_dims': '[128, 64]', 'dropout': 0.199031432379812, 'batch_norm': True, 'lr': 1.8408544111075837e-06, 'weight_decay': 5.5136510071208614e-05, 'epochs': 336, 'loss': 'mae', 'optimizer': 'adam', 'graph_mode': 'off', 'use_snp_selection': True, 'num_snps': 43862}. Best is trial 0 with value: 0.2947674014916225.
[I 2025-12-06 11:20:04,685] Trial 1 finished with value: 0.33603233195312593 and parameters: {'model_type': 'mlp', 'hidden_dims': '[256, 128]', 'dropout': 0.4370668075331726, 'batch_norm': True, 'lr': 7.133471581159139e-05, 'weight_decay': 1.128633586803549e-05, 'epochs': 242, 'loss': 'mae', 'optimizer': 'adam', 'graph_mode': 'off', 'use_snp_selection': False}. Best is trial 1 with value: 0.33603233195312593.
[I 2025-12-06 11:20:32,446] Trial 2 finished with value: 0.3403331776809567 and parameters: {'model_type': 'mlp', 'hidden_dims': '[256, 128, 64]', 'dropout': 0.41314357415569625, 'batch_norm': False, 'lr': 3.952233718592101e-06, 'weight_decay': 0.00026754769258252603, 'epochs': 149, 'loss': 'mse', 'optimizer': 'adam', 'graph_mode': 'off', 'use_snp_selection': True, 'num_snps': 11571}. Best is trial 2 with value: 0.3403331776809567.
[I 2025-12-06 11:21:38,163] Trial 3 finished with value: 0.37008565912961217 and parameters: {'model_type': 'mlp', 'hidden_dims': '[512, 64]', 'dropout': 0.5938127374509361, 'batch_norm': False, 'lr': 5.67704586114731e-06, 'weight_decay': 2.4518087630137052e-05, 'epochs': 320, 'loss': 'mae', 'optimizer': 'adam', 'graph_mode': 'off', 'use_snp_selection': False}. Best is trial 3 with value: 0.37008565912961217.
[I 2025-12-06 11:22:42,778] Trial 4 finished with value: 0.30654586073491397 and parameters: {'model_type': 'mlp', 'hidden_dims': '[512, 128]', 'dropout': 0.25746343592134413, 'batch_norm': True, 'lr': 1.3467657668402788e-06, 'weight_decay': 0.00033087251918647806, 'epochs': 277, 'loss': 'mse', 'optimizer': 'adam', 'graph_mode': 'off', 'use_snp_selection': True, 'num_snps': 36675}. Best is trial 3 with value: 0.37008565912961217.
[I 2025-12-06 11:23:28,126] Trial 5 finished with value: 0.2927157626724354 and parameters: {'model_type': 'mlp', 'hidden_dims': '[512, 64]', 'dropout': 0.38275350994408375, 'batch_norm': True, 'lr': 1.5586664309232824e-06, 'weight_decay': 0.0008227664668621182, 'epochs': 145, 'loss': 'mae', 'optimizer': 'adam', 'graph_mode': 'off', 'use_snp_selection': True, 'num_snps': 32148}. Best is trial 3 with value: 0.37008565912961217.
[I 2025-12-06 11:23:51,964] Trial 6 finished with value: 0.3481472807018626 and parameters: {'model_type': 'mlp', 'hidden_dims': '[256, 128]', 'dropout': 0.3930109900265879, 'batch_norm': False, 'lr': 4.892964372128395e-05, 'weight_decay': 1.5809549317992182e-06, 'epochs': 199, 'loss': 'mse', 'optimizer': 'adam', 'graph_mode': 'off', 'use_snp_selection': False}. Best is trial 3 with value: 0.37008565912961217.
[I 2025-12-06 11:24:15,913] Trial 7 finished with value: 0.35241829950847575 and parameters: {'model_type': 'mlp', 'hidden_dims': '[512, 256]', 'dropout': 0.15343979219678458, 'batch_norm': True, 'lr': 6.234003099047341e-05, 'weight_decay': 3.894760610535477e-07, 'epochs': 97, 'loss': 'mse', 'optimizer': 'adam', 'graph_mode': 'off', 'use_snp_selection': False}. Best is trial 3 with value: 0.37008565912961217.
[I 2025-12-06 11:25:21,510] Trial 8 finished with value: 0.34180803866698295 and parameters: {'model_type': 'mlp', 'hidden_dims': '[512, 128]', 'dropout': 0.10743001231661406, 'batch_norm': True, 'lr': 0.00023728538449271062, 'weight_decay': 1.7629071578048637e-05, 'epochs': 312, 'loss': 'mae', 'optimizer': 'adam', 'graph_mode': 'off', 'use_snp_selection': False}. Best is trial 3 with value: 0.37008565912961217.
[I 2025-12-06 11:26:00,699] Trial 9 finished with value: 0.34371187074923737 and parameters: {'model_type': 'mlp', 'hidden_dims': '[512, 64]', 'dropout': 0.14505336736221927, 'batch_norm': True, 'lr': 5.8619638388111826e-05, 'weight_decay': 6.200156172669308e-07, 'epochs': 175, 'loss': 'mse', 'optimizer': 'adam', 'graph_mode': 'off', 'use_snp_selection': False}. Best is trial 3 with value: 0.37008565912961217.
[I 2025-12-06 11:26:16,448] Trial 10 finished with value: 0.3462728151062763 and parameters: {'model_type': 'mlp', 'hidden_dims': '[512, 64]', 'dropout': 0.5885461262002587, 'batch_norm': False, 'lr': 8.769366258768696e-06, 'weight_decay': 2.78273193871783e-06, 'epochs': 55, 'loss': 'mae', 'optimizer': 'adam', 'graph_mode': 'off', 'use_snp_selection': False}. Best is trial 3 with value: 0.37008565912961217.
[I 2025-12-06 11:26:36,344] Trial 11 finished with value: 0.3738278946674904 and parameters: {'model_type': 'mlp', 'hidden_dims': '[512, 256]', 'dropout': 0.583942291816117, 'batch_norm': False, 'lr': 1.422933652790185e-05, 'weight_decay': 1.18635098029648e-07, 'epochs': 77, 'loss': 'mse', 'optimizer': 'adam', 'graph_mode': 'off', 'use_snp_selection': False}. Best is trial 11 with value: 0.3738278946674904.
[I 2025-12-06 11:26:49,267] Trial 12 finished with value: 0.3166721862931945 and parameters: {'model_type': 'mlp', 'hidden_dims': '[512, 256]', 'dropout': 0.593097749012682, 'batch_norm': False, 'lr': 1.1374686318732863e-05, 'weight_decay': 1.3081036432574914e-07, 'epochs': 40, 'loss': 'mae', 'optimizer': 'adam', 'graph_mode': 'off', 'use_snp_selection': False}. Best is trial 11 with value: 0.3738278946674904.
[I 2025-12-06 11:27:39,304] Trial 13 finished with value: 0.3458184494955171 and parameters: {'model_type': 'mlp', 'hidden_dims': '[512, 256]', 'dropout': 0.5043641748401543, 'batch_norm': False, 'lr': 1.4304506621636526e-05, 'weight_decay': 5.0135437753417527e-05, 'epochs': 235, 'loss': 'mse', 'optimizer': 'adam', 'graph_mode': 'off', 'use_snp_selection': False}. Best is trial 11 with value: 0.3738278946674904.
[I 2025-12-06 11:27:48,896] Trial 14 finished with value: 0.34001723471768536 and parameters: {'model_type': 'mlp', 'hidden_dims': '[128, 64]', 'dropout': 0.5300180653494536, 'batch_norm': False, 'lr': 5.096356034191146e-06, 'weight_decay': 3.0607358611649674e-06, 'epochs': 93, 'loss': 'mse', 'optimizer': 'adam', 'graph_mode': 'off', 'use_snp_selection': False}. Best is trial 11 with value: 0.3738278946674904.
[I 2025-12-06 11:28:21,485] Trial 15 finished with value: 0.3566792892476292 and parameters: {'model_type': 'mlp', 'hidden_dims': '[256, 128, 64]', 'dropout': 0.29817671914947536, 'batch_norm': False, 'lr': 1.8411764708572348e-05, 'weight_decay': 4.4084956876871386e-05, 'epochs': 278, 'loss': 'mae', 'optimizer': 'adam', 'graph_mode': 'off', 'use_snp_selection': False}. Best is trial 11 with value: 0.3738278946674904.
[I 2025-12-06 11:29:32,085] Trial 16 finished with value: 0.3327356678874556 and parameters: {'model_type': 'mlp', 'hidden_dims': '[512, 256]', 'dropout': 0.4992385332513618, 'batch_norm': False, 'lr': 0.00017549215405955411, 'weight_decay': 1.3070443894198984e-07, 'epochs': 350, 'loss': 'mse', 'optimizer': 'adam', 'graph_mode': 'off', 'use_snp_selection': False}. Best is trial 11 with value: 0.3738278946674904.
[I 2025-12-06 11:29:58,336] Trial 17 finished with value: 0.16022500690081115 and parameters: {'model_type': 'mlp', 'hidden_dims': '[512, 64]', 'dropout': 0.543474321376226, 'batch_norm': False, 'lr': 0.000906375209920231, 'weight_decay': 6.503919561253859e-06, 'epochs': 113, 'loss': 'mae', 'optimizer': 'adam', 'graph_mode': 'off', 'use_snp_selection': False}. Best is trial 11 with value: 0.3738278946674904.
[I 2025-12-06 11:31:15,109] Trial 18 finished with value: 0.371794727876596 and parameters: {'model_type': 'mlp', 'hidden_dims': '[512, 256]', 'dropout': 0.4928065509878574, 'batch_norm': False, 'lr': 3.8282888633697165e-06, 'weight_decay': 0.00015435589843114137, 'epochs': 214, 'loss': 'mse', 'optimizer': 'adam', 'graph_mode': 'off', 'use_snp_selection': True, 'num_snps': 58241}. Best is trial 11 with value: 0.3738278946674904.
[I 2025-12-06 11:32:28,229] Trial 19 finished with value: 0.37260884401832667 and parameters: {'model_type': 'mlp', 'hidden_dims': '[512, 256]', 'dropout': 0.47355279224247543, 'batch_norm': False, 'lr': 2.7960991179492955e-06, 'weight_decay': 0.00023472361224431218, 'epochs': 205, 'loss': 'mse', 'optimizer': 'adam', 'graph_mode': 'off', 'use_snp_selection': True, 'num_snps': 55667}. Best is trial 11 with value: 0.3738278946674904.
[I 2025-12-06 11:33:33,093] Trial 20 finished with value: 0.3516739612506862 and parameters: {'model_type': 'mlp', 'hidden_dims': '[512, 256]', 'dropout': 0.44795937657049567, 'batch_norm': False, 'lr': 2.0712546311667824e-05, 'weight_decay': 6.528910746817569e-07, 'epochs': 151, 'loss': 'mse', 'optimizer': 'adam', 'graph_mode': 'off', 'use_snp_selection': True, 'num_snps': 57703}. Best is trial 11 with value: 0.3738278946674904.
[I 2025-12-06 11:34:52,301] Trial 21 finished with value: 0.3771881954265961 and parameters: {'model_type': 'mlp', 'hidden_dims': '[512, 256]', 'dropout': 0.4727088783203093, 'batch_norm': False, 'lr': 2.43890066869663e-06, 'weight_decay': 0.00011727750911803841, 'epochs': 218, 'loss': 'mse', 'optimizer': 'adam', 'graph_mode': 'off', 'use_snp_selection': True, 'num_snps': 59811}. Best is trial 21 with value: 0.3771881954265961.
[I 2025-12-06 11:35:56,410] Trial 22 finished with value: 0.37127070165081755 and parameters: {'model_type': 'mlp', 'hidden_dims': '[512, 256]', 'dropout': 0.34979026414918357, 'batch_norm': False, 'lr': 2.543746209555761e-06, 'weight_decay': 0.0009163497437076293, 'epochs': 182, 'loss': 'mse', 'optimizer': 'adam', 'graph_mode': 'off', 'use_snp_selection': True, 'num_snps': 49936}. Best is trial 21 with value: 0.3771881954265961.
[I 2025-12-06 11:36:36,239] Trial 23 finished with value: 0.3346538571801879 and parameters: {'model_type': 'mlp', 'hidden_dims': '[512, 256]', 'dropout': 0.4623046741749175, 'batch_norm': False, 'lr': 1.1065579745136327e-06, 'weight_decay': 0.00010611392546152063, 'epochs': 231, 'loss': 'mse', 'optimizer': 'adam', 'graph_mode': 'off', 'use_snp_selection': True, 'num_snps': 18234}. Best is trial 21 with value: 0.3771881954265961.
[I 2025-12-06 11:38:03,636] Trial 24 finished with value: 0.3569321425906557 and parameters: {'model_type': 'mlp', 'hidden_dims': '[512, 256]', 'dropout': 0.5262192084810595, 'batch_norm': False, 'lr': 7.649233349571165e-06, 'weight_decay': 0.00029393993375487546, 'epochs': 265, 'loss': 'mse', 'optimizer': 'adam', 'graph_mode': 'off', 'use_snp_selection': True, 'num_snps': 59652}. Best is trial 21 with value: 0.3771881954265961.
[I 2025-12-06 11:39:09,984] Trial 25 finished with value: 0.3707026999214216 and parameters: {'model_type': 'mlp', 'hidden_dims': '[512, 256]', 'dropout': 0.34495473522829434, 'batch_norm': False, 'lr': 2.7689932790983773e-06, 'weight_decay': 0.00011955747205751155, 'epochs': 203, 'loss': 'mse', 'optimizer': 'adam', 'graph_mode': 'off', 'use_snp_selection': True, 'num_snps': 48648}. Best is trial 21 with value: 0.3771881954265961.
[I 2025-12-06 11:39:45,151] Trial 26 finished with value: 0.3484148986629636 and parameters: {'model_type': 'mlp', 'hidden_dims': '[512, 256]', 'dropout': 0.5456045201575097, 'batch_norm': False, 'lr': 2.8536705488145353e-05, 'weight_decay': 0.0004801316087926616, 'epochs': 126, 'loss': 'mse', 'optimizer': 'adam', 'graph_mode': 'off', 'use_snp_selection': True, 'num_snps': 20214}. Best is trial 21 with value: 0.3771881954265961.
[I 2025-12-06 11:40:23,328] Trial 27 finished with value: 0.32856340077923135 and parameters: {'model_type': 'mlp', 'hidden_dims': '[256, 128]', 'dropout': 0.4708547314852128, 'batch_norm': False, 'lr': 2.6935111278015146e-06, 'weight_decay': 7.069784141307719e-06, 'epochs': 76, 'loss': 'mse', 'optimizer': 'adam', 'graph_mode': 'off', 'use_snp_selection': True, 'num_snps': 41193}. Best is trial 21 with value: 0.3771881954265961.
[I 2025-12-06 11:41:06,596] Trial 28 finished with value: 0.376492248567483 and parameters: {'model_type': 'mlp', 'hidden_dims': '[128, 64]', 'dropout': 0.5640525039270534, 'batch_norm': False, 'lr': 9.618095650416881e-06, 'weight_decay': 8.467302236900665e-05, 'epochs': 174, 'loss': 'mse', 'optimizer': 'adam', 'graph_mode': 'off', 'use_snp_selection': True, 'num_snps': 51336}. Best is trial 21 with value: 0.3771881954265961.
[I 2025-12-06 11:41:48,773] Trial 29 finished with value: 0.36500033155722245 and parameters: {'model_type': 'mlp', 'hidden_dims': '[128, 64]', 'dropout': 0.5622943377862464, 'batch_norm': False, 'lr': 3.547203788190554e-05, 'weight_decay': 8.58970861149538e-05, 'epochs': 174, 'loss': 'mse', 'optimizer': 'adam', 'graph_mode': 'off', 'use_snp_selection': True, 'num_snps': 48806}. Best is trial 21 with value: 0.3771881954265961.
[I 2025-12-06 11:42:23,385] Trial 30 finished with value: 0.37088472898313607 and parameters: {'model_type': 'mlp', 'hidden_dims': '[128, 64]', 'dropout': 0.5682721143668068, 'batch_norm': False, 'lr': 6.741132494144597e-06, 'weight_decay': 2.349033921256001e-05, 'epochs': 255, 'loss': 'mse', 'optimizer': 'adam', 'graph_mode': 'off', 'use_snp_selection': True, 'num_snps': 26307}. Best is trial 21 with value: 0.3771881954265961.
[I 2025-12-06 11:43:09,236] Trial 31 finished with value: 0.3592432371961425 and parameters: {'model_type': 'mlp', 'hidden_dims': '[128, 64]', 'dropout': 0.5080356171855642, 'batch_norm': False, 'lr': 2.111588588217818e-06, 'weight_decay': 0.0001846465777739665, 'epochs': 215, 'loss': 'mse', 'optimizer': 'adam', 'graph_mode': 'off', 'use_snp_selection': True, 'num_snps': 53525}. Best is trial 21 with value: 0.3771881954265961.
[I 2025-12-06 11:43:52,502] Trial 32 finished with value: 0.36553315256118735 and parameters: {'model_type': 'mlp', 'hidden_dims': '[128, 64]', 'dropout': 0.47598488773563274, 'batch_norm': False, 'lr': 1.135073621375006e-05, 'weight_decay': 4.653845550036817e-05, 'epochs': 163, 'loss': 'mse', 'optimizer': 'adam', 'graph_mode': 'off', 'use_snp_selection': True, 'num_snps': 52230}. Best is trial 21 with value: 0.3771881954265961.
