[I 2025-12-05 15:16:06,718] Trial 2 finished with value: 0.015191539940517926 and parameters: {'model_type': 'mlp', 'hidden_dims': '[256, 128, 64]', 'dropout': 0.41314357415569625, 'batch_norm': False, 'lr': 3.952233718592101e-06, 'weight_decay': 0.00026754769258252603, 'epochs': 149, 'loss': 'mse', 'optimizer': 'adam', 'graph_mode': 'off', 'use_snp_selection': True, 'num_snps': 11571}. Best is trial 1 with value: 0.03550675306439405.
[I 2025-12-05 15:16:08,680] Trial 3 finished with value: 0.08810847384066328 and parameters: {'model_type': 'mlp', 'hidden_dims': '[512, 64]', 'dropout': 0.5938127374509361, 'batch_norm': False, 'lr': 5.67704586114731e-06, 'weight_decay': 2.4518087630137052e-05, 'epochs': 320, 'loss': 'mae', 'optimizer': 'adam', 'graph_mode': 'off', 'use_snp_selection': False}. Best is trial 3 with value: 0.08810847384066328.
[I 2025-12-05 15:16:10,908] Trial 4 finished with value: 0.010967595048756705 and parameters: {'model_type': 'mlp', 'hidden_dims': '[512, 128]', 'dropout': 0.25746343592134413, 'batch_norm': True, 'lr': 1.3467657668402788e-06, 'weight_decay': 0.00033087251918647806, 'epochs': 277, 'loss': 'mse', 'optimizer': 'adam', 'graph_mode': 'off', 'use_snp_selection': True, 'num_snps': 36675}. Best is trial 3 with value: 0.08810847384066328.
[I 2025-12-05 15:16:12,688] Trial 5 finished with value: 0.017547412778127793 and parameters: {'model_type': 'mlp', 'hidden_dims': '[512, 64]', 'dropout': 0.38275350994408375, 'batch_norm': True, 'lr': 1.5586664309232824e-06, 'weight_decay': 0.0008227664668621182, 'epochs': 145, 'loss': 'mae', 'optimizer': 'adam', 'graph_mode': 'off', 'use_snp_selection': True, 'num_snps': 32148}. Best is trial 3 with value: 0.08810847384066328.
[I 2025-12-05 15:16:13,715] Trial 6 finished with value: 0.04876449637810256 and parameters: {'model_type': 'mlp', 'hidden_dims': '[256, 128]', 'dropout': 0.3930109900265879, 'batch_norm': False, 'lr': 4.892964372128395e-05, 'weight_decay': 1.5809549317992182e-06, 'epochs': 199, 'loss': 'mse', 'optimizer': 'adam', 'graph_mode': 'off', 'use_snp_selection': False}. Best is trial 3 with value: 0.08810847384066328.
[I 2025-12-05 15:16:14,840] Trial 7 finished with value: 0.07821467714173314 and parameters: {'model_type': 'mlp', 'hidden_dims': '[512, 256]', 'dropout': 0.15343979219678458, 'batch_norm': True, 'lr': 6.234003099047341e-05, 'weight_decay': 3.894760610535477e-07, 'epochs': 97, 'loss': 'mse', 'optimizer': 'adam', 'graph_mode': 'off', 'use_snp_selection': False}. Best is trial 3 with value: 0.08810847384066328.
[I 2025-12-05 15:16:16,809] Trial 8 finished with value: 0.08520830153530681 and parameters: {'model_type': 'mlp', 'hidden_dims': '[512, 128]', 'dropout': 0.10743001231661406, 'batch_norm': True, 'lr': 0.00023728538449271062, 'weight_decay': 1.7629071578048637e-05, 'epochs': 312, 'loss': 'mae', 'optimizer': 'adam', 'graph_mode': 'off', 'use_snp_selection': False}. Best is trial 3 with value: 0.08810847384066328.
[I 2025-12-05 15:16:18,301] Trial 9 finished with value: 0.08106078918725311 and parameters: {'model_type': 'mlp', 'hidden_dims': '[512, 64]', 'dropout': 0.14505336736221927, 'batch_norm': True, 'lr': 5.8619638388111826e-05, 'weight_decay': 6.200156172669308e-07, 'epochs': 175, 'loss': 'mse', 'optimizer': 'adam', 'graph_mode': 'off', 'use_snp_selection': False}. Best is trial 3 with value: 0.08810847384066328.
[I 2025-12-05 15:16:19,320] Trial 10 finished with value: 0.02642352445337524 and parameters: {'model_type': 'mlp', 'hidden_dims': '[512, 64]', 'dropout': 0.5885461262002587, 'batch_norm': False, 'lr': 8.769366258768696e-06, 'weight_decay': 2.78273193871783e-06, 'epochs': 55, 'loss': 'mae', 'optimizer': 'adam', 'graph_mode': 'off', 'use_snp_selection': False}. Best is trial 3 with value: 0.08810847384066328.
[I 2025-12-05 15:16:21,437] Trial 11 finished with value: 0.04166368783566469 and parameters: {'model_type': 'mlp', 'hidden_dims': '[512, 128]', 'dropout': 0.583942291816117, 'batch_norm': False, 'lr': 0.0007607980626791682, 'weight_decay': 2.11387030344014e-05, 'epochs': 346, 'loss': 'mae', 'optimizer': 'adam', 'graph_mode': 'off', 'use_snp_selection': False}. Best is trial 3 with value: 0.08810847384066328.
[I 2025-12-05 15:16:23,366] Trial 12 finished with value: 0.06865230040529363 and parameters: {'model_type': 'mlp', 'hidden_dims': '[512, 128]', 'dropout': 0.2637316882220091, 'batch_norm': False, 'lr': 0.000384886887018818, 'weight_decay': 6.23587291883057e-05, 'epochs': 294, 'loss': 'mae', 'optimizer': 'adam', 'graph_mode': 'off', 'use_snp_selection': False}. Best is trial 3 with value: 0.08810847384066328.
[I 2025-12-05 15:16:24,270] Trial 13 finished with value: 0.03426063695988743 and parameters: {'model_type': 'mlp', 'hidden_dims': '[128, 64]', 'dropout': 0.5255276925359322, 'batch_norm': False, 'lr': 1.3373175420781734e-05, 'weight_decay': 2.875929917712265e-06, 'epochs': 285, 'loss': 'mae', 'optimizer': 'adam', 'graph_mode': 'off', 'use_snp_selection': False}. Best is trial 3 with value: 0.08810847384066328.
[I 2025-12-05 15:16:25,416] Trial 14 finished with value: 0.07399204756858878 and parameters: {'model_type': 'mlp', 'hidden_dims': '[256, 128, 64]', 'dropout': 0.3012984444538551, 'batch_norm': True, 'lr': 0.0002108574938852793, 'weight_decay': 1.1414924884997386e-07, 'epochs': 237, 'loss': 'mae', 'optimizer': 'adam', 'graph_mode': 'off', 'use_snp_selection': False}. Best is trial 3 with value: 0.08810847384066328.
[I 2025-12-05 15:16:27,378] Trial 15 finished with value: 0.0341528834777462 and parameters: {'model_type': 'mlp', 'hidden_dims': '[512, 256]', 'dropout': 0.48263162073930665, 'batch_norm': False, 'lr': 1.8411764708572348e-05, 'weight_decay': 4.4084956876871386e-05, 'epochs': 314, 'loss': 'mae', 'optimizer': 'adam', 'graph_mode': 'off', 'use_snp_selection': False}. Best is trial 3 with value: 0.08810847384066328.
[I 2025-12-05 15:16:29,084] Trial 16 finished with value: 0.07463944786204074 and parameters: {'model_type': 'mlp', 'hidden_dims': '[512, 128]', 'dropout': 0.32560328266296623, 'batch_norm': True, 'lr': 0.00017549215405955411, 'weight_decay': 6.80662468241148e-06, 'epochs': 244, 'loss': 'mae', 'optimizer': 'adam', 'graph_mode': 'off', 'use_snp_selection': False}. Best is trial 3 with value: 0.08810847384066328.
[I 2025-12-05 15:16:31,189] Trial 17 finished with value: 0.05823172612624277 and parameters: {'model_type': 'mlp', 'hidden_dims': '[512, 64]', 'dropout': 0.10230308008198463, 'batch_norm': False, 'lr': 7.28449232493469e-06, 'weight_decay': 0.00010542713361476925, 'epochs': 350, 'loss': 'mae', 'optimizer': 'adam', 'graph_mode': 'off', 'use_snp_selection': False}. Best is trial 3 with value: 0.08810847384066328.
[I 2025-12-05 15:16:34,622] Trial 18 finished with value: 0.05912031266990536 and parameters: {'model_type': 'mlp', 'hidden_dims': '[512, 128]', 'dropout': 0.5098431992326697, 'batch_norm': False, 'lr': 2.568379894723034e-05, 'weight_decay': 1.4785860713169379e-05, 'epochs': 268, 'loss': 'mae', 'optimizer': 'adam', 'graph_mode': 'off', 'use_snp_selection': True, 'num_snps': 58241}. Best is trial 3 with value: 0.08810847384066328.
[I 2025-12-05 15:16:36,623] Trial 19 finished with value: 0.0313559049997831 and parameters: {'model_type': 'mlp', 'hidden_dims': '[512, 64]', 'dropout': 0.22426752700825467, 'batch_norm': True, 'lr': 4.238115837317623e-06, 'weight_decay': 5.539609312143884e-06, 'epochs': 314, 'loss': 'mae', 'optimizer': 'adam', 'graph_mode': 'off', 'use_snp_selection': False}. Best is trial 3 with value: 0.08810847384066328.
[I 2025-12-05 15:16:37,459] Trial 20 finished with value: 0.01935015219203175 and parameters: {'model_type': 'mlp', 'hidden_dims': '[128, 64]', 'dropout': 0.35590240931164197, 'batch_norm': False, 'lr': 0.00027854139843726527, 'weight_decay': 2.417613357794622e-05, 'epochs': 209, 'loss': 'mae', 'optimizer': 'adam', 'graph_mode': 'off', 'use_snp_selection': False}. Best is trial 3 with value: 0.08810847384066328.
[I 2025-12-05 15:16:38,979] Trial 21 finished with value: 0.07524359025552745 and parameters: {'model_type': 'mlp', 'hidden_dims': '[512, 64]', 'dropout': 0.10290428437530558, 'batch_norm': True, 'lr': 0.00011381681729990368, 'weight_decay': 1.0046574161536312e-06, 'epochs': 190, 'loss': 'mse', 'optimizer': 'adam', 'graph_mode': 'off', 'use_snp_selection': False}. Best is trial 3 with value: 0.08810847384066328.
[I 2025-12-05 15:16:40,345] Trial 22 finished with value: 0.07535019007378724 and parameters: {'model_type': 'mlp', 'hidden_dims': '[512, 64]', 'dropout': 0.16444385974746437, 'batch_norm': True, 'lr': 0.0005536409606027752, 'weight_decay': 6.344835971964851e-07, 'epochs': 157, 'loss': 'mse', 'optimizer': 'adam', 'graph_mode': 'off', 'use_snp_selection': False}. Best is trial 3 with value: 0.08810847384066328.
[I 2025-12-05 15:16:41,520] Trial 23 finished with value: 0.09964413095608972 and parameters: {'model_type': 'mlp', 'hidden_dims': '[512, 64]', 'dropout': 0.16507216694258064, 'batch_norm': True, 'lr': 0.00011784093978953475, 'weight_decay': 1.012383328701358e-07, 'epochs': 110, 'loss': 'mse', 'optimizer': 'adam', 'graph_mode': 'off', 'use_snp_selection': False}. Best is trial 23 with value: 0.09964413095608972.
[I 2025-12-05 15:16:42,643] Trial 24 finished with value: 0.08720547475665301 and parameters: {'model_type': 'mlp', 'hidden_dims': '[512, 64]', 'dropout': 0.20922327262990512, 'batch_norm': True, 'lr': 0.00012933696064794652, 'weight_decay': 2.3832504364511422e-07, 'epochs': 93, 'loss': 'mse', 'optimizer': 'adam', 'graph_mode': 'off', 'use_snp_selection': False}. Best is trial 23 with value: 0.09964413095608972.
[I 2025-12-05 15:16:43,870] Trial 25 finished with value: 0.06680099413494892 and parameters: {'model_type': 'mlp', 'hidden_dims': '[512, 64]', 'dropout': 0.20659399060640368, 'batch_norm': True, 'lr': 0.00012131764530965085, 'weight_decay': 1.5961362269513254e-07, 'epochs': 121, 'loss': 'mse', 'optimizer': 'adam', 'graph_mode': 'off', 'use_snp_selection': False}. Best is trial 23 with value: 0.09964413095608972.
[I 2025-12-05 15:16:44,558] Trial 26 finished with value: 0.022415632372124034 and parameters: {'model_type': 'mlp', 'hidden_dims': '[512, 64]', 'dropout': 0.2760660089207859, 'batch_norm': True, 'lr': 3.615903011707705e-05, 'weight_decay': 2.7640412500987703e-07, 'epochs': 47, 'loss': 'mse', 'optimizer': 'adam', 'graph_mode': 'off', 'use_snp_selection': True, 'num_snps': 3842}. Best is trial 23 with value: 0.09964413095608972.
[I 2025-12-05 15:16:45,592] Trial 27 finished with value: 0.05052907523081147 and parameters: {'model_type': 'mlp', 'hidden_dims': '[512, 64]', 'dropout': 0.23335818868205901, 'batch_norm': True, 'lr': 0.00011831276800468882, 'weight_decay': 1.882742159144935e-07, 'epochs': 74, 'loss': 'mse', 'optimizer': 'adam', 'graph_mode': 'off', 'use_snp_selection': False}. Best is trial 23 with value: 0.09964413095608972.
[I 2025-12-05 15:16:46,732] Trial 28 finished with value: 0.05376477785567892 and parameters: {'model_type': 'mlp', 'hidden_dims': '[512, 64]', 'dropout': 0.17851703300573502, 'batch_norm': False, 'lr': 3.3570467780936194e-06, 'weight_decay': 1.0006549205113703e-07, 'epochs': 103, 'loss': 'mse', 'optimizer': 'adam', 'graph_mode': 'off', 'use_snp_selection': False}. Best is trial 23 with value: 0.09964413095608972.
[I 2025-12-05 15:16:47,939] Trial 29 finished with value: 0.0524028010576898 and parameters: {'model_type': 'mlp', 'hidden_dims': '[512, 256]', 'dropout': 0.4540184348968538, 'batch_norm': True, 'lr': 2.5087654566083747e-06, 'weight_decay': 2.9981351687588504e-07, 'epochs': 78, 'loss': 'mse', 'optimizer': 'adam', 'graph_mode': 'off', 'use_snp_selection': True, 'num_snps': 19468}. Best is trial 23 with value: 0.09964413095608972.
[I 2025-12-05 15:16:48,835] Trial 30 finished with value: 0.06837199799716502 and parameters: {'model_type': 'mlp', 'hidden_dims': '[256, 128]', 'dropout': 0.1878054182790142, 'batch_norm': True, 'lr': 2.8028673460034328e-05, 'weight_decay': 1.6086554048019763e-06, 'epochs': 124, 'loss': 'mse', 'optimizer': 'adam', 'graph_mode': 'off', 'use_snp_selection': False}. Best is trial 23 with value: 0.09964413095608972.
[I 2025-12-05 15:16:50,203] Trial 31 finished with value: 0.06378005891803219 and parameters: {'model_type': 'mlp', 'hidden_dims': '[256, 128, 64]', 'dropout': 0.12386776584538133, 'batch_norm': True, 'lr': 0.0003721781898765201, 'weight_decay': 3.1861742521835046e-05, 'epochs': 315, 'loss': 'mse', 'optimizer': 'adam', 'graph_mode': 'off', 'use_snp_selection': False}. Best is trial 23 with value: 0.09964413095608972.
[I 2025-12-05 15:16:51,307] Trial 32 finished with value: 0.05037693522208109 and parameters: {'model_type': 'mlp', 'hidden_dims': '[128, 64]', 'dropout': 0.13456299344726227, 'batch_norm': True, 'lr': 9.294047028768083e-05, 'weight_decay': 7.375179725038466e-06, 'epochs': 331, 'loss': 'mae', 'optimizer': 'adam', 'graph_mode': 'off', 'use_snp_selection': False}. Best is trial 23 with value: 0.09964413095608972.
[I 2025-12-05 15:16:52,590] Trial 33 finished with value: 0.06490681307812596 and parameters: {'model_type': 'mlp', 'hidden_dims': '[512, 128]', 'dropout': 0.21186312325604695, 'batch_norm': True, 'lr': 0.0001710516761684201, 'weight_decay': 8.822340236655884e-05, 'epochs': 119, 'loss': 'mae', 'optimizer': 'adam', 'graph_mode': 'off', 'use_snp_selection': False}. Best is trial 23 with value: 0.09964413095608972.
[I 2025-12-05 15:16:53,727] Trial 34 finished with value: 0.07856711794452591 and parameters: {'model_type': 'mlp', 'hidden_dims': '[256, 128]', 'dropout': 0.17414354324164255, 'batch_norm': True, 'lr': 0.0002596538865852156, 'weight_decay': 1.3469007483013366e-05, 'epochs': 222, 'loss': 'mse', 'optimizer': 'adam', 'graph_mode': 'off', 'use_snp_selection': False}. Best is trial 23 with value: 0.09964413095608972.
[I 2025-12-05 15:16:57,057] Trial 35 finished with value: 0.055027585309400294 and parameters: {'model_type': 'mlp', 'hidden_dims': '[512, 64]', 'dropout': 0.23949198277036607, 'batch_norm': True, 'lr': 8.083341012148012e-05, 'weight_decay': 4.776282286501531e-06, 'epochs': 263, 'loss': 'mse', 'optimizer': 'adam', 'graph_mode': 'off', 'use_snp_selection': True, 'num_snps': 57586}. Best is trial 23 with value: 0.09964413095608972.
[I 2025-12-05 15:16:57,859] Trial 36 finished with value: 0.02391601350109862 and parameters: {'model_type': 'mlp', 'hidden_dims': '[256, 128, 64]', 'dropout': 0.5459997075999099, 'batch_norm': True, 'lr': 0.00046985369568986867, 'weight_decay': 0.00019009559896090284, 'epochs': 79, 'loss': 'mae', 'optimizer': 'adam', 'graph_mode': 'off', 'use_snp_selection': False}. Best is trial 23 with value: 0.09964413095608972.
[I 2025-12-05 15:16:59,234] Trial 37 finished with value: 0.007905786151668792 and parameters: {'model_type': 'mlp', 'hidden_dims': '[512, 128]', 'dropout': 0.3021279247204888, 'batch_norm': True, 'lr': 1.08570214541948e-06, 'weight_decay': 1.2221049456819325e-05, 'epochs': 139, 'loss': 'mse', 'optimizer': 'adam', 'graph_mode': 'off', 'use_snp_selection': True, 'num_snps': 22282}. Best is trial 23 with value: 0.09964413095608972.
[I 2025-12-05 15:17:00,647] Trial 38 finished with value: 0.007578414110083396 and parameters: {'model_type': 'mlp', 'hidden_dims': '[512, 64]', 'dropout': 0.43830859068955674, 'batch_norm': False, 'lr': 0.0009211515938309644, 'weight_decay': 0.00046644832351108945, 'epochs': 172, 'loss': 'mae', 'optimizer': 'adam', 'graph_mode': 'off', 'use_snp_selection': False}. Best is trial 23 with value: 0.09964413095608972.
[I 2025-12-05 15:17:02,562] Trial 39 finished with value: 0.03435734188246751 and parameters: {'model_type': 'mlp', 'hidden_dims': '[512, 64]', 'dropout': 0.12621696378936748, 'batch_norm': True, 'lr': 7.203148076203913e-06, 'weight_decay': 4.0141818300499064e-07, 'epochs': 298, 'loss': 'mse', 'optimizer': 'adam', 'graph_mode': 'off', 'use_snp_selection': False}. Best is trial 23 with value: 0.09964413095608972.
[I 2025-12-05 15:17:03,684] Trial 40 finished with value: 0.05310874129811357 and parameters: {'model_type': 'mlp', 'hidden_dims': '[512, 256]', 'dropout': 0.3661996274100975, 'batch_norm': False, 'lr': 5.214533155285163e-05, 'weight_decay': 4.037681095046061e-05, 'epochs': 92, 'loss': 'mae', 'optimizer': 'adam', 'graph_mode': 'off', 'use_snp_selection': False}. Best is trial 23 with value: 0.09964413095608972.
[I 2025-12-05 15:17:05,130] Trial 41 finished with value: 0.049327230065807005 and parameters: {'model_type': 'mlp', 'hidden_dims': '[512, 64]', 'dropout': 0.15668832668840532, 'batch_norm': True, 'lr': 3.8707035497274933e-05, 'weight_decay': 6.032061129613079e-07, 'epochs': 178, 'loss': 'mse', 'optimizer': 'adam', 'graph_mode': 'off', 'use_snp_selection': False}. Best is trial 23 with value: 0.09964413095608972.
[I 2025-12-05 15:17:06,159] Trial 42 finished with value: 0.08771541699594043 and parameters: {'model_type': 'mlp', 'hidden_dims': '[512, 64]', 'dropout': 0.1393010237141237, 'batch_norm': True, 'lr': 7.233210653950225e-05, 'weight_decay': 2.1623380375768881e-07, 'epochs': 56, 'loss': 'mse', 'optimizer': 'adam', 'graph_mode': 'off', 'use_snp_selection': False}. Best is trial 23 with value: 0.09964413095608972.
[I 2025-12-05 15:17:07,226] Trial 43 finished with value: 0.06400277691633757 and parameters: {'model_type': 'mlp', 'hidden_dims': '[512, 64]', 'dropout': 0.19352959407094214, 'batch_norm': True, 'lr': 0.00014408322472574453, 'weight_decay': 1.67370024018515e-07, 'epochs': 64, 'loss': 'mse', 'optimizer': 'adam', 'graph_mode': 'off', 'use_snp_selection': False}. Best is trial 23 with value: 0.09964413095608972.
[I 2025-12-05 15:17:08,025] Trial 44 finished with value: 0.028926189919220264 and parameters: {'model_type': 'mlp', 'hidden_dims': '[256, 128]', 'dropout': 0.40976114755964765, 'batch_norm': True, 'lr': 8.871960689126508e-05, 'weight_decay': 2.050900145663778e-07, 'epochs': 43, 'loss': 'mse', 'optimizer': 'adam', 'graph_mode': 'off', 'use_snp_selection': False}. Best is trial 23 with value: 0.09964413095608972.
[I 2025-12-05 15:17:09,241] Trial 45 finished with value: 0.04538387702273461 and parameters: {'model_type': 'mlp', 'hidden_dims': '[512, 64]', 'dropout': 0.1455774679864292, 'batch_norm': True, 'lr': 5.919475406971933e-05, 'weight_decay': 2.7616794717163247e-06, 'epochs': 106, 'loss': 'mse', 'optimizer': 'adam', 'graph_mode': 'off', 'use_snp_selection': False}. Best is trial 23 with value: 0.09964413095608972.
[I 2025-12-05 15:17:10,268] Trial 46 finished with value: 0.07987855122404172 and parameters: {'model_type': 'mlp', 'hidden_dims': '[512, 128]', 'dropout': 0.11329181168892047, 'batch_norm': True, 'lr': 0.00025342498867937093, 'weight_decay': 1.2375863686587095e-06, 'epochs': 59, 'loss': 'mse', 'optimizer': 'adam', 'graph_mode': 'off', 'use_snp_selection': False}. Best is trial 23 with value: 0.09964413095608972.
[I 2025-12-05 15:17:11,400] Trial 47 finished with value: 0.07943358627679889 and parameters: {'model_type': 'mlp', 'hidden_dims': '[512, 64]', 'dropout': 0.13884236897274627, 'batch_norm': False, 'lr': 1.7554686665276633e-05, 'weight_decay': 4.310295844542276e-07, 'epochs': 88, 'loss': 'mae', 'optimizer': 'adam', 'graph_mode': 'off', 'use_snp_selection': False}. Best is trial 23 with value: 0.09964413095608972.
[I 2025-12-05 15:17:13,334] Trial 48 finished with value: 0.02312549120423932 and parameters: {'model_type': 'mlp', 'hidden_dims': '[128, 64]', 'dropout': 0.25265542838589905, 'batch_norm': True, 'lr': 7.278565544669846e-05, 'weight_decay': 1.2103557583228745e-07, 'epochs': 65, 'loss': 'mae', 'optimizer': 'adam', 'graph_mode': 'off', 'use_snp_selection': True, 'num_snps': 43224}. Best is trial 23 with value: 0.09964413095608972.
[I 2025-12-05 15:17:15,065] Trial 49 finished with value: 0.025093274229656667 and parameters: {'model_type': 'mlp', 'hidden_dims': '[512, 128]', 'dropout': 0.16266440690504338, 'batch_norm': False, 'lr': 0.00019037397123206634, 'weight_decay': 6.134880493119498e-05, 'epochs': 257, 'loss': 'mse', 'optimizer': 'adam', 'graph_mode': 'off', 'use_snp_selection': False}. Best is trial 23 with value: 0.09964413095608972.
[I 2025-12-05 15:17:16,408] Trial 50 finished with value: 0.07864704870253472 and parameters: {'model_type': 'mlp', 'hidden_dims': '[256, 128, 64]', 'dropout': 0.28333206929318205, 'batch_norm': True, 'lr': 0.00033338432950258786, 'weight_decay': 1.975453923099614e-05, 'epochs': 331, 'loss': 'mae', 'optimizer': 'adam', 'graph_mode': 'off', 'use_snp_selection': False}. Best is trial 23 with value: 0.09964413095608972.
[I 2025-12-05 15:17:17,707] Trial 51 finished with value: 0.07216168963412589 and parameters: {'model_type': 'mlp', 'hidden_dims': '[512, 64]', 'dropout': 0.14460135940179908, 'batch_norm': True, 'lr': 4.140264796828771e-05, 'weight_decay': 6.600795446959059e-07, 'epochs': 142, 'loss': 'mse', 'optimizer': 'adam', 'graph_mode': 'off', 'use_snp_selection': False}. Best is trial 23 with value: 0.09964413095608972.
[I 2025-12-05 15:17:18,914] Trial 52 finished with value: 0.06833665799545963 and parameters: {'model_type': 'mlp', 'hidden_dims': '[512, 64]', 'dropout': 0.11408297236722865, 'batch_norm': True, 'lr': 2.0585156373306174e-05, 'weight_decay': 3.1123044887105237e-07, 'epochs': 109, 'loss': 'mse', 'optimizer': 'adam', 'graph_mode': 'off', 'use_snp_selection': False}. Best is trial 23 with value: 0.09964413095608972.
[I 2025-12-05 15:17:20,278] Trial 53 finished with value: 0.05762454448737854 and parameters: {'model_type': 'mlp', 'hidden_dims': '[512, 64]', 'dropout': 0.5615014650532635, 'batch_norm': True, 'lr': 6.513201565754912e-05, 'weight_decay': 2.123036670589512e-07, 'epochs': 158, 'loss': 'mse', 'optimizer': 'adam', 'graph_mode': 'off', 'use_snp_selection': False}. Best is trial 23 with value: 0.09964413095608972.
