[I 2025-12-05 16:18:22,466] Trial 7 finished with value: 0.134119187901134 and parameters: {'model_type': 'mlp', 'hidden_dims': '[512, 256]', 'dropout': 0.15343979219678458, 'batch_norm': True, 'lr': 6.234003099047341e-05, 'weight_decay': 3.894760610535477e-07, 'epochs': 97, 'loss': 'mse', 'optimizer': 'adam', 'graph_mode': 'off', 'use_snp_selection': False}. Best is trial 7 with value: 0.134119187901134.
[I 2025-12-05 16:18:24,301] Trial 8 finished with value: 0.12135605828496782 and parameters: {'model_type': 'mlp', 'hidden_dims': '[512, 128]', 'dropout': 0.10743001231661406, 'batch_norm': True, 'lr': 0.00023728538449271062, 'weight_decay': 1.7629071578048637e-05, 'epochs': 312, 'loss': 'mae', 'optimizer': 'adam', 'graph_mode': 'off', 'use_snp_selection': False}. Best is trial 7 with value: 0.134119187901134.
[I 2025-12-05 16:18:25,639] Trial 9 finished with value: 0.0682168233217701 and parameters: {'model_type': 'mlp', 'hidden_dims': '[512, 64]', 'dropout': 0.14505336736221927, 'batch_norm': True, 'lr': 5.8619638388111826e-05, 'weight_decay': 6.200156172669308e-07, 'epochs': 175, 'loss': 'mse', 'optimizer': 'adam', 'graph_mode': 'off', 'use_snp_selection': False}. Best is trial 7 with value: 0.134119187901134.
[I 2025-12-05 16:18:26,457] Trial 10 finished with value: 0.019472954052810847 and parameters: {'model_type': 'mlp', 'hidden_dims': '[512, 256]', 'dropout': 0.2736992815328032, 'batch_norm': False, 'lr': 0.00032393778075602147, 'weight_decay': 1.1511946696017092e-07, 'epochs': 41, 'loss': 'mse', 'optimizer': 'adam', 'graph_mode': 'off', 'use_snp_selection': False}. Best is trial 7 with value: 0.134119187901134.
[I 2025-12-05 16:18:27,386] Trial 11 finished with value: 0.1322360227276575 and parameters: {'model_type': 'mlp', 'hidden_dims': '[512, 128]', 'dropout': 0.10095648685224448, 'batch_norm': True, 'lr': 0.0007666984023899753, 'weight_decay': 2.512571353186099e-06, 'epochs': 70, 'loss': 'mae', 'optimizer': 'adam', 'graph_mode': 'off', 'use_snp_selection': False}. Best is trial 7 with value: 0.134119187901134.
[I 2025-12-05 16:18:28,286] Trial 12 finished with value: 0.11771104551337988 and parameters: {'model_type': 'mlp', 'hidden_dims': '[512, 256]', 'dropout': 0.10344600881777158, 'batch_norm': True, 'lr': 0.0006753264773209732, 'weight_decay': 1.2006458821839938e-06, 'epochs': 63, 'loss': 'mae', 'optimizer': 'adam', 'graph_mode': 'off', 'use_snp_selection': False}. Best is trial 7 with value: 0.134119187901134.
[I 2025-12-05 16:18:29,300] Trial 13 finished with value: 0.055551502414844564 and parameters: {'model_type': 'mlp', 'hidden_dims': '[512, 256]', 'dropout': 0.206733630507397, 'batch_norm': True, 'lr': 1.3373175420781734e-05, 'weight_decay': 1.8965593394883618e-07, 'epochs': 92, 'loss': 'mse', 'optimizer': 'adam', 'graph_mode': 'off', 'use_snp_selection': False}. Best is trial 7 with value: 0.134119187901134.
[I 2025-12-05 16:18:30,379] Trial 14 finished with value: 0.12441440026541893 and parameters: {'model_type': 'mlp', 'hidden_dims': '[512, 128]', 'dropout': 0.3012984444538551, 'batch_norm': True, 'lr': 0.0009000048932733863, 'weight_decay': 3.2568808920327207e-06, 'epochs': 110, 'loss': 'mae', 'optimizer': 'adam', 'graph_mode': 'off', 'use_snp_selection': False}. Best is trial 7 with value: 0.134119187901134.
[I 2025-12-05 16:18:31,023] Trial 15 finished with value: 0.13034650950594193 and parameters: {'model_type': 'mlp', 'hidden_dims': '[128, 64]', 'dropout': 0.18406139084679396, 'batch_norm': True, 'lr': 0.0001572871022003765, 'weight_decay': 3.717609129469701e-07, 'epochs': 100, 'loss': 'mse', 'optimizer': 'adam', 'graph_mode': 'off', 'use_snp_selection': False}. Best is trial 7 with value: 0.134119187901134.
[I 2025-12-05 16:18:31,747] Trial 16 finished with value: 0.07725425498818052 and parameters: {'model_type': 'mlp', 'hidden_dims': '[256, 128, 64]', 'dropout': 0.558513902174278, 'batch_norm': True, 'lr': 2.1517090787442848e-05, 'weight_decay': 5.098763140321504e-06, 'epochs': 69, 'loss': 'mae', 'optimizer': 'adam', 'graph_mode': 'off', 'use_snp_selection': False}. Best is trial 7 with value: 0.134119187901134.
[I 2025-12-05 16:18:32,881] Trial 17 finished with value: 0.12165607494707593 and parameters: {'model_type': 'mlp', 'hidden_dims': '[512, 128]', 'dropout': 0.15847318111315195, 'batch_norm': True, 'lr': 0.00011620307138345767, 'weight_decay': 4.7456925405414646e-07, 'epochs': 124, 'loss': 'mse', 'optimizer': 'adam', 'graph_mode': 'off', 'use_snp_selection': False}. Best is trial 7 with value: 0.134119187901134.
[I 2025-12-05 16:18:35,772] Trial 18 finished with value: 0.058239074659909046 and parameters: {'model_type': 'mlp', 'hidden_dims': '[512, 256]', 'dropout': 0.5005423020298181, 'batch_norm': False, 'lr': 0.0004833669444396415, 'weight_decay': 2.627558449918227e-06, 'epochs': 210, 'loss': 'mae', 'optimizer': 'adam', 'graph_mode': 'off', 'use_snp_selection': True, 'num_snps': 58241}. Best is trial 7 with value: 0.134119187901134.
[I 2025-12-05 16:18:36,662] Trial 19 finished with value: 0.10477910257250952 and parameters: {'model_type': 'mlp', 'hidden_dims': '[512, 128]', 'dropout': 0.31692091263899563, 'batch_norm': True, 'lr': 1.352570837276448e-05, 'weight_decay': 6.12239461682469e-05, 'epochs': 46, 'loss': 'mse', 'optimizer': 'adam', 'graph_mode': 'off', 'use_snp_selection': False}. Best is trial 7 with value: 0.134119187901134.
[I 2025-12-05 16:18:37,645] Trial 20 finished with value: 0.10319912867341413 and parameters: {'model_type': 'mlp', 'hidden_dims': '[512, 256]', 'dropout': 0.23887975920589624, 'batch_norm': True, 'lr': 0.00010790565258321806, 'weight_decay': 9.109499921670077e-07, 'epochs': 80, 'loss': 'mse', 'optimizer': 'adam', 'graph_mode': 'off', 'use_snp_selection': False}. Best is trial 7 with value: 0.134119187901134.
[I 2025-12-05 16:18:38,294] Trial 21 finished with value: 0.10753990871377613 and parameters: {'model_type': 'mlp', 'hidden_dims': '[128, 64]', 'dropout': 0.16914449639955972, 'batch_norm': True, 'lr': 0.00019759029217809756, 'weight_decay': 2.97981272278809e-07, 'epochs': 113, 'loss': 'mse', 'optimizer': 'adam', 'graph_mode': 'off', 'use_snp_selection': False}. Best is trial 7 with value: 0.134119187901134.
[I 2025-12-05 16:18:38,981] Trial 22 finished with value: 0.12749547665979927 and parameters: {'model_type': 'mlp', 'hidden_dims': '[128, 64]', 'dropout': 0.13096596943730135, 'batch_norm': True, 'lr': 0.0001469195772711647, 'weight_decay': 2.480249991328217e-07, 'epochs': 147, 'loss': 'mse', 'optimizer': 'adam', 'graph_mode': 'off', 'use_snp_selection': False}. Best is trial 7 with value: 0.134119187901134.
[I 2025-12-05 16:18:39,601] Trial 23 finished with value: 0.11967901548413856 and parameters: {'model_type': 'mlp', 'hidden_dims': '[128, 64]', 'dropout': 0.19163013215934924, 'batch_norm': True, 'lr': 0.00039519349395928055, 'weight_decay': 1.0087615614171423e-07, 'epochs': 98, 'loss': 'mse', 'optimizer': 'adam', 'graph_mode': 'off', 'use_snp_selection': False}. Best is trial 7 with value: 0.134119187901134.
[I 2025-12-05 16:18:40,323] Trial 24 finished with value: 0.08095126585135427 and parameters: {'model_type': 'mlp', 'hidden_dims': '[128, 64]', 'dropout': 0.21647421535872935, 'batch_norm': True, 'lr': 3.159290428929018e-05, 'weight_decay': 4.533285667525052e-07, 'epochs': 172, 'loss': 'mse', 'optimizer': 'adam', 'graph_mode': 'off', 'use_snp_selection': False}. Best is trial 7 with value: 0.134119187901134.
[I 2025-12-05 16:18:41,149] Trial 25 finished with value: 0.11717577747160784 and parameters: {'model_type': 'mlp', 'hidden_dims': '[256, 128, 64]', 'dropout': 0.14212668828661743, 'batch_norm': True, 'lr': 0.0009666931625151181, 'weight_decay': 5.74191053042755e-06, 'epochs': 132, 'loss': 'mse', 'optimizer': 'adam', 'graph_mode': 'off', 'use_snp_selection': False}. Best is trial 7 with value: 0.134119187901134.
[I 2025-12-05 16:18:41,816] Trial 26 finished with value: 0.06698164053258729 and parameters: {'model_type': 'mlp', 'hidden_dims': '[256, 128]', 'dropout': 0.10165690757234191, 'batch_norm': True, 'lr': 8.332146644802021e-05, 'weight_decay': 1.9226379235910757e-06, 'epochs': 66, 'loss': 'mae', 'optimizer': 'adam', 'graph_mode': 'off', 'use_snp_selection': True, 'num_snps': 3842}. Best is trial 7 with value: 0.134119187901134.
[I 2025-12-05 16:18:42,805] Trial 27 finished with value: 0.06770908026182322 and parameters: {'model_type': 'mlp', 'hidden_dims': '[512, 128]', 'dropout': 0.33073699906954945, 'batch_norm': False, 'lr': 0.0002641652316942584, 'weight_decay': 9.358191051589186e-07, 'epochs': 88, 'loss': 'mse', 'optimizer': 'adam', 'graph_mode': 'off', 'use_snp_selection': False}. Best is trial 7 with value: 0.134119187901134.
[I 2025-12-05 16:18:43,625] Trial 28 finished with value: 0.08602022405046064 and parameters: {'model_type': 'mlp', 'hidden_dims': '[128, 64]', 'dropout': 0.16891115720667543, 'batch_norm': True, 'lr': 3.0292603455622743e-05, 'weight_decay': 2.905899669856459e-07, 'epochs': 228, 'loss': 'mae', 'optimizer': 'adam', 'graph_mode': 'off', 'use_snp_selection': False}. Best is trial 7 with value: 0.134119187901134.
[I 2025-12-05 16:18:44,893] Trial 29 finished with value: 0.11554855486611343 and parameters: {'model_type': 'mlp', 'hidden_dims': '[512, 256]', 'dropout': 0.23254207574773847, 'batch_norm': True, 'lr': 0.0005388560200940643, 'weight_decay': 5.5227103357724904e-05, 'epochs': 172, 'loss': 'mae', 'optimizer': 'adam', 'graph_mode': 'off', 'use_snp_selection': True, 'num_snps': 19468}. Best is trial 7 with value: 0.134119187901134.
[I 2025-12-05 16:18:45,455] Trial 30 finished with value: 0.10533376802532764 and parameters: {'model_type': 'mlp', 'hidden_dims': '[128, 64]', 'dropout': 0.19202459044245498, 'batch_norm': True, 'lr': 0.0001787155823809422, 'weight_decay': 4.993414306146163e-06, 'epochs': 53, 'loss': 'mse', 'optimizer': 'adam', 'graph_mode': 'off', 'use_snp_selection': False}. Best is trial 7 with value: 0.134119187901134.
[I 2025-12-05 16:18:46,145] Trial 31 finished with value: 0.10607132633640275 and parameters: {'model_type': 'mlp', 'hidden_dims': '[128, 64]', 'dropout': 0.1368438069199349, 'batch_norm': True, 'lr': 0.00014745311965856507, 'weight_decay': 1.8908862157236828e-07, 'epochs': 145, 'loss': 'mse', 'optimizer': 'adam', 'graph_mode': 'off', 'use_snp_selection': False}. Best is trial 7 with value: 0.134119187901134.
[I 2025-12-05 16:18:46,794] Trial 32 finished with value: 0.10841296304984901 and parameters: {'model_type': 'mlp', 'hidden_dims': '[128, 64]', 'dropout': 0.12692772612420508, 'batch_norm': True, 'lr': 5.163856487532752e-05, 'weight_decay': 2.9158388302714034e-07, 'epochs': 117, 'loss': 'mse', 'optimizer': 'adam', 'graph_mode': 'off', 'use_snp_selection': False}. Best is trial 7 with value: 0.134119187901134.
[I 2025-12-05 16:18:47,495] Trial 33 finished with value: 0.13387914594053094 and parameters: {'model_type': 'mlp', 'hidden_dims': '[128, 64]', 'dropout': 0.17439623514783847, 'batch_norm': True, 'lr': 8.613404321373549e-05, 'weight_decay': 6.991195421462774e-07, 'epochs': 159, 'loss': 'mse', 'optimizer': 'adam', 'graph_mode': 'off', 'use_snp_selection': False}. Best is trial 7 with value: 0.134119187901134.
[I 2025-12-05 16:18:48,141] Trial 34 finished with value: 0.09494324622983491 and parameters: {'model_type': 'mlp', 'hidden_dims': '[128, 64]', 'dropout': 0.28099625383530513, 'batch_norm': True, 'lr': 8.343519187717451e-05, 'weight_decay': 5.835211738859762e-07, 'epochs': 97, 'loss': 'mse', 'optimizer': 'adam', 'graph_mode': 'off', 'use_snp_selection': False}. Best is trial 7 with value: 0.134119187901134.
[I 2025-12-05 16:18:48,834] Trial 35 finished with value: 0.0638121301575037 and parameters: {'model_type': 'mlp', 'hidden_dims': '[256, 128]', 'dropout': 0.1750979862271189, 'batch_norm': False, 'lr': 2.0463570704610496e-05, 'weight_decay': 8.260180661255546e-07, 'epochs': 73, 'loss': 'mse', 'optimizer': 'adam', 'graph_mode': 'off', 'use_snp_selection': False}. Best is trial 7 with value: 0.134119187901134.
[I 2025-12-05 16:18:51,911] Trial 36 finished with value: 0.050056477708199765 and parameters: {'model_type': 'mlp', 'hidden_dims': '[512, 64]', 'dropout': 0.24189447635482061, 'batch_norm': True, 'lr': 1.029382153849406e-05, 'weight_decay': 1.0687295154404784e-05, 'epochs': 262, 'loss': 'mae', 'optimizer': 'adam', 'graph_mode': 'off', 'use_snp_selection': True, 'num_snps': 58661}. Best is trial 7 with value: 0.134119187901134.
[I 2025-12-05 16:18:52,808] Trial 37 finished with value: 0.035606881315565594 and parameters: {'model_type': 'mlp', 'hidden_dims': '[256, 128, 64]', 'dropout': 0.20999793465172753, 'batch_norm': True, 'lr': 4.446294938689996e-06, 'weight_decay': 1.8267958780274027e-06, 'epochs': 130, 'loss': 'mse', 'optimizer': 'adam', 'graph_mode': 'off', 'use_snp_selection': False}. Best is trial 7 with value: 0.134119187901134.
[I 2025-12-05 16:18:54,054] Trial 38 finished with value: 0.08180999114446932 and parameters: {'model_type': 'mlp', 'hidden_dims': '[512, 128]', 'dropout': 0.44948497928834, 'batch_norm': False, 'lr': 4.642355957045609e-05, 'weight_decay': 2.5802062582311853e-06, 'epochs': 161, 'loss': 'mae', 'optimizer': 'adam', 'graph_mode': 'off', 'use_snp_selection': True, 'num_snps': 19911}. Best is trial 7 with value: 0.134119187901134.
[I 2025-12-05 16:18:54,813] Trial 39 finished with value: 0.10774884716774168 and parameters: {'model_type': 'mlp', 'hidden_dims': '[128, 64]', 'dropout': 0.1248681456532579, 'batch_norm': True, 'lr': 0.0003032976852959893, 'weight_decay': 2.4538590652103414e-05, 'epochs': 197, 'loss': 'mse', 'optimizer': 'adam', 'graph_mode': 'off', 'use_snp_selection': False}. Best is trial 7 with value: 0.134119187901134.
[I 2025-12-05 16:18:55,869] Trial 40 finished with value: 0.11637923134771293 and parameters: {'model_type': 'mlp', 'hidden_dims': '[512, 64]', 'dropout': 0.18100664360727906, 'batch_norm': True, 'lr': 0.00010299837783030175, 'weight_decay': 1.290242300344237e-06, 'epochs': 106, 'loss': 'mse', 'optimizer': 'adam', 'graph_mode': 'off', 'use_snp_selection': False}. Best is trial 7 with value: 0.134119187901134.
[I 2025-12-05 16:18:56,546] Trial 41 finished with value: 0.018054735531268167 and parameters: {'model_type': 'mlp', 'hidden_dims': '[128, 64]', 'dropout': 0.12778823178328882, 'batch_norm': True, 'lr': 2.320370617557869e-06, 'weight_decay': 1.819235939815267e-07, 'epochs': 138, 'loss': 'mse', 'optimizer': 'adam', 'graph_mode': 'off', 'use_snp_selection': False}. Best is trial 7 with value: 0.134119187901134.
[I 2025-12-05 16:18:57,500] Trial 42 finished with value: 0.12571450635015682 and parameters: {'model_type': 'mlp', 'hidden_dims': '[128, 64]', 'dropout': 0.1561474946563349, 'batch_norm': True, 'lr': 0.00015319331355983086, 'weight_decay': 3.851378473710237e-07, 'epochs': 348, 'loss': 'mse', 'optimizer': 'adam', 'graph_mode': 'off', 'use_snp_selection': False}. Best is trial 7 with value: 0.134119187901134.
[I 2025-12-05 16:18:58,203] Trial 43 finished with value: 0.11271060547673017 and parameters: {'model_type': 'mlp', 'hidden_dims': '[128, 64]', 'dropout': 0.36985336739550534, 'batch_norm': True, 'lr': 6.012549979059375e-05, 'weight_decay': 1.6878683405023355e-07, 'epochs': 158, 'loss': 'mse', 'optimizer': 'adam', 'graph_mode': 'off', 'use_snp_selection': False}. Best is trial 7 with value: 0.134119187901134.
[I 2025-12-05 16:18:59,557] Trial 44 finished with value: 0.1201833173871137 and parameters: {'model_type': 'mlp', 'hidden_dims': '[512, 256]', 'dropout': 0.10281192336497869, 'batch_norm': True, 'lr': 4.038391540724434e-05, 'weight_decay': 5.859693583868747e-07, 'epochs': 183, 'loss': 'mse', 'optimizer': 'adam', 'graph_mode': 'off', 'use_snp_selection': False}. Best is trial 7 with value: 0.134119187901134.
[I 2025-12-05 16:19:00,288] Trial 45 finished with value: 0.10516785577205774 and parameters: {'model_type': 'mlp', 'hidden_dims': '[256, 128]', 'dropout': 0.2616974933405334, 'batch_norm': True, 'lr': 0.0002283151715412108, 'weight_decay': 7.623555331450901e-07, 'epochs': 80, 'loss': 'mse', 'optimizer': 'adam', 'graph_mode': 'off', 'use_snp_selection': False}. Best is trial 7 with value: 0.134119187901134.
[I 2025-12-05 16:19:01,518] Trial 46 finished with value: 0.11166292619311381 and parameters: {'model_type': 'mlp', 'hidden_dims': '[512, 128]', 'dropout': 0.14815653687741906, 'batch_norm': False, 'lr': 7.771663282021038e-05, 'weight_decay': 2.751798912236654e-07, 'epochs': 154, 'loss': 'mae', 'optimizer': 'adam', 'graph_mode': 'off', 'use_snp_selection': False}. Best is trial 7 with value: 0.134119187901134.
[I 2025-12-05 16:19:02,088] Trial 47 finished with value: 0.1060392211204355 and parameters: {'model_type': 'mlp', 'hidden_dims': '[128, 64]', 'dropout': 0.12242089177743082, 'batch_norm': True, 'lr': 0.0006412840520005035, 'weight_decay': 1.2838188738655082e-07, 'epochs': 58, 'loss': 'mse', 'optimizer': 'adam', 'graph_mode': 'off', 'use_snp_selection': False}. Best is trial 7 with value: 0.134119187901134.
[I 2025-12-05 16:19:03,568] Trial 48 finished with value: 0.09995250922126035 and parameters: {'model_type': 'mlp', 'hidden_dims': '[512, 256]', 'dropout': 0.22218796443941513, 'batch_norm': True, 'lr': 0.00013000400625935276, 'weight_decay': 1.3273879093258433e-06, 'epochs': 217, 'loss': 'mae', 'optimizer': 'adam', 'graph_mode': 'off', 'use_snp_selection': False}. Best is trial 7 with value: 0.134119187901134.
[I 2025-12-05 16:19:05,710] Trial 49 finished with value: 0.12827360706633317 and parameters: {'model_type': 'mlp', 'hidden_dims': '[512, 128]', 'dropout': 0.18625137157737043, 'batch_norm': True, 'lr': 0.00032743873796456125, 'weight_decay': 3.946637445760036e-07, 'epochs': 104, 'loss': 'mse', 'optimizer': 'adam', 'graph_mode': 'off', 'use_snp_selection': True, 'num_snps': 46888}. Best is trial 7 with value: 0.134119187901134.
[I 2025-12-05 16:19:07,907] Trial 50 finished with value: 0.11817900094472801 and parameters: {'model_type': 'mlp', 'hidden_dims': '[512, 128]', 'dropout': 0.188704950333105, 'batch_norm': True, 'lr': 0.0004209131049983362, 'weight_decay': 3.7183843182709386e-06, 'epochs': 105, 'loss': 'mse', 'optimizer': 'adam', 'graph_mode': 'off', 'use_snp_selection': True, 'num_snps': 46345}. Best is trial 7 with value: 0.134119187901134.
[I 2025-12-05 16:19:10,145] Trial 51 finished with value: 0.12049979593933603 and parameters: {'model_type': 'mlp', 'hidden_dims': '[512, 128]', 'dropout': 0.1568656927937389, 'batch_norm': True, 'lr': 0.0003046248842986546, 'weight_decay': 5.099694822770859e-07, 'epochs': 123, 'loss': 'mse', 'optimizer': 'adam', 'graph_mode': 'off', 'use_snp_selection': True, 'num_snps': 47105}. Best is trial 7 with value: 0.134119187901134.
[I 2025-12-05 16:19:11,421] Trial 52 finished with value: 0.128548889388863 and parameters: {'model_type': 'mlp', 'hidden_dims': '[512, 128]', 'dropout': 0.11526103286911933, 'batch_norm': True, 'lr': 0.0003710498844549497, 'weight_decay': 3.704020309456311e-07, 'epochs': 82, 'loss': 'mse', 'optimizer': 'adam', 'graph_mode': 'off', 'use_snp_selection': True, 'num_snps': 22057}. Best is trial 7 with value: 0.134119187901134.
[I 2025-12-05 16:19:12,711] Trial 53 finished with value: 0.09943673983377255 and parameters: {'model_type': 'mlp', 'hidden_dims': '[512, 128]', 'dropout': 0.2004426414680912, 'batch_norm': True, 'lr': 0.0005901550799757389, 'weight_decay': 4.1381118464161214e-07, 'epochs': 83, 'loss': 'mse', 'optimizer': 'adam', 'graph_mode': 'off', 'use_snp_selection': True, 'num_snps': 22509}. Best is trial 7 with value: 0.134119187901134.
[I 2025-12-05 16:19:14,071] Trial 54 finished with value: 0.11252176487198137 and parameters: {'model_type': 'mlp', 'hidden_dims': '[512, 128]', 'dropout': 0.11619781483117918, 'batch_norm': True, 'lr': 0.0003677885294691565, 'weight_decay': 7.007884447661453e-07, 'epochs': 42, 'loss': 'mse', 'optimizer': 'adam', 'graph_mode': 'off', 'use_snp_selection': True, 'num_snps': 27666}. Best is trial 7 with value: 0.134119187901134.
[I 2025-12-05 16:19:15,841] Trial 55 finished with value: 0.1146799584040822 and parameters: {'model_type': 'mlp', 'hidden_dims': '[512, 128]', 'dropout': 0.1698598436804168, 'batch_norm': True, 'lr': 0.0007645522440285188, 'weight_decay': 0.00037547975381969223, 'epochs': 72, 'loss': 'mse', 'optimizer': 'adam', 'graph_mode': 'off', 'use_snp_selection': True, 'num_snps': 36855}. Best is trial 7 with value: 0.134119187901134.
[I 2025-12-05 16:19:16,728] Trial 56 finished with value: 0.08624685812200432 and parameters: {'model_type': 'mlp', 'hidden_dims': '[512, 128]', 'dropout': 0.14759850035577962, 'batch_norm': True, 'lr': 0.00020511833318440805, 'weight_decay': 1.0808331012563005e-06, 'epochs': 90, 'loss': 'mae', 'optimizer': 'adam', 'graph_mode': 'off', 'use_snp_selection': True, 'num_snps': 9385}. Best is trial 7 with value: 0.134119187901134.
[I 2025-12-05 16:19:19,059] Trial 57 finished with value: 0.05452892676200741 and parameters: {'model_type': 'mlp', 'hidden_dims': '[512, 128]', 'dropout': 0.42116747366049057, 'batch_norm': False, 'lr': 0.00047362937417304453, 'weight_decay': 3.693819618773859e-07, 'epochs': 57, 'loss': 'mse', 'optimizer': 'adam', 'graph_mode': 'off', 'use_snp_selection': True, 'num_snps': 52781}. Best is trial 7 with value: 0.134119187901134.
[I 2025-12-05 16:19:21,288] Trial 58 finished with value: 0.11196299926264348 and parameters: {'model_type': 'mlp', 'hidden_dims': '[256, 128, 64]', 'dropout': 0.2496595238297138, 'batch_norm': True, 'lr': 0.0007871308192917681, 'weight_decay': 1.2939916385184533e-07, 'epochs': 299, 'loss': 'mse', 'optimizer': 'adam', 'graph_mode': 'off', 'use_snp_selection': True, 'num_snps': 39373}. Best is trial 7 with value: 0.134119187901134.
