[I 2025-12-06 06:09:15,324] Trial 90 finished with value: 0.30723893892390985 and parameters: {'model_type': 'mlp', 'hidden_dims': '[512, 128]', 'dropout': 0.5255833721358014, 'batch_norm': True, 'lr': 2.747190931462984e-05, 'weight_decay': 3.311557299657941e-05, 'epochs': 246, 'loss': 'mae', 'optimizer': 'adam', 'graph_mode': 'off', 'use_snp_selection': True, 'num_snps': 48165}. Best is trial 71 with value: 0.31394110948476106.
[I 2025-12-06 06:10:07,847] Trial 91 finished with value: 0.31126971147315713 and parameters: {'model_type': 'mlp', 'hidden_dims': '[512, 256]', 'dropout': 0.4930712183803012, 'batch_norm': True, 'lr': 5.23493785400497e-05, 'weight_decay': 1.589712628478455e-05, 'epochs': 269, 'loss': 'mae', 'optimizer': 'adam', 'graph_mode': 'off', 'use_snp_selection': False}. Best is trial 71 with value: 0.31394110948476106.
[I 2025-12-06 06:10:57,794] Trial 92 finished with value: 0.30447007974772344 and parameters: {'model_type': 'mlp', 'hidden_dims': '[512, 256]', 'dropout': 0.5341767935650014, 'batch_norm': True, 'lr': 1.2273408861939438e-05, 'weight_decay': 4.8998680071964266e-05, 'epochs': 254, 'loss': 'mae', 'optimizer': 'adam', 'graph_mode': 'off', 'use_snp_selection': False}. Best is trial 71 with value: 0.31394110948476106.
[I 2025-12-06 06:11:48,089] Trial 93 finished with value: 0.30984340756549866 and parameters: {'model_type': 'mlp', 'hidden_dims': '[512, 256]', 'dropout': 0.3210660986514284, 'batch_norm': True, 'lr': 9.441203014372381e-05, 'weight_decay': 6.314527035763301e-06, 'epochs': 256, 'loss': 'mae', 'optimizer': 'adam', 'graph_mode': 'off', 'use_snp_selection': False}. Best is trial 71 with value: 0.31394110948476106.
[I 2025-12-06 06:12:19,749] Trial 94 finished with value: 0.31053470994181964 and parameters: {'model_type': 'mlp', 'hidden_dims': '[512, 256]', 'dropout': 0.5090400203896052, 'batch_norm': True, 'lr': 0.00013217525528580863, 'weight_decay': 8.00831796236401e-05, 'epochs': 150, 'loss': 'mae', 'optimizer': 'adam', 'graph_mode': 'off', 'use_snp_selection': False}. Best is trial 71 with value: 0.31394110948476106.
[I 2025-12-06 06:13:17,674] Trial 95 finished with value: 0.31202193849586246 and parameters: {'model_type': 'mlp', 'hidden_dims': '[512, 256]', 'dropout': 0.4767096234739928, 'batch_norm': True, 'lr': 2.4435172815531554e-05, 'weight_decay': 1.3559546954341327e-07, 'epochs': 299, 'loss': 'mse', 'optimizer': 'adam', 'graph_mode': 'off', 'use_snp_selection': False}. Best is trial 71 with value: 0.31394110948476106.
[I 2025-12-06 06:14:15,287] Trial 96 finished with value: 0.3095029909524515 and parameters: {'model_type': 'mlp', 'hidden_dims': '[512, 64]', 'dropout': 0.47899842860369696, 'batch_norm': True, 'lr': 2.1062505347052557e-05, 'weight_decay': 2.1255751956615433e-05, 'epochs': 299, 'loss': 'mae', 'optimizer': 'adam', 'graph_mode': 'off', 'use_snp_selection': False}. Best is trial 71 with value: 0.31394110948476106.
[I 2025-12-06 06:14:50,326] Trial 97 finished with value: 0.30414867786342786 and parameters: {'model_type': 'mlp', 'hidden_dims': '[256, 128, 64]', 'dropout': 0.3933518772740252, 'batch_norm': True, 'lr': 1.7783463464647393e-05, 'weight_decay': 9.886976489572118e-05, 'epochs': 328, 'loss': 'mse', 'optimizer': 'adam', 'graph_mode': 'off', 'use_snp_selection': False}. Best is trial 71 with value: 0.31394110948476106.
[I 2025-12-06 06:15:51,778] Trial 98 finished with value: 0.3134731214020824 and parameters: {'model_type': 'mlp', 'hidden_dims': '[512, 256]', 'dropout': 0.5014244001313509, 'batch_norm': True, 'lr': 2.3937563443790205e-05, 'weight_decay': 4.7455944196760006e-07, 'epochs': 319, 'loss': 'mse', 'optimizer': 'adam', 'graph_mode': 'off', 'use_snp_selection': False}. Best is trial 71 with value: 0.31394110948476106.
[I 2025-12-06 06:16:53,679] Trial 99 finished with value: 0.3063052743830913 and parameters: {'model_type': 'mlp', 'hidden_dims': '[512, 256]', 'dropout': 0.5280381353717053, 'batch_norm': True, 'lr': 7.693089134745922e-06, 'weight_decay': 1.5524194212965615e-06, 'epochs': 321, 'loss': 'mae', 'optimizer': 'adam', 'graph_mode': 'off', 'use_snp_selection': False}. Best is trial 71 with value: 0.31394110948476106.
[I 2025-12-06 06:17:36,665] Trial 100 finished with value: 0.3116041709072698 and parameters: {'model_type': 'mlp', 'hidden_dims': '[512, 256]', 'dropout': 0.4413642454845329, 'batch_norm': True, 'lr': 3.6606474015397946e-05, 'weight_decay': 2.243554070015595e-06, 'epochs': 214, 'loss': 'mse', 'optimizer': 'adam', 'graph_mode': 'off', 'use_snp_selection': False}. Best is trial 71 with value: 0.31394110948476106.
[I 2025-12-06 06:18:36,516] Trial 101 finished with value: 0.30804204862583356 and parameters: {'model_type': 'mlp', 'hidden_dims': '[512, 256]', 'dropout': 0.48448534189567327, 'batch_norm': True, 'lr': 2.422421019377006e-05, 'weight_decay': 1.3200450550459418e-07, 'epochs': 310, 'loss': 'mse', 'optimizer': 'adam', 'graph_mode': 'off', 'use_snp_selection': False}. Best is trial 71 with value: 0.31394110948476106.
[I 2025-12-06 06:19:42,188] Trial 102 finished with value: 0.30927020558359297 and parameters: {'model_type': 'mlp', 'hidden_dims': '[512, 256]', 'dropout': 0.4727248856667683, 'batch_norm': True, 'lr': 3.0455620747760986e-05, 'weight_decay': 5.540893925043832e-07, 'epochs': 343, 'loss': 'mse', 'optimizer': 'adam', 'graph_mode': 'off', 'use_snp_selection': False}. Best is trial 71 with value: 0.31394110948476106.
[I 2025-12-06 06:20:43,928] Trial 103 finished with value: 0.30906313531240465 and parameters: {'model_type': 'mlp', 'hidden_dims': '[512, 256]', 'dropout': 0.5133172700548525, 'batch_norm': True, 'lr': 2.326576682457569e-05, 'weight_decay': 2.895499336993057e-07, 'epochs': 321, 'loss': 'mse', 'optimizer': 'adam', 'graph_mode': 'off', 'use_snp_selection': False}. Best is trial 71 with value: 0.31394110948476106.
[I 2025-12-06 06:21:47,945] Trial 104 finished with value: 0.30498211281399223 and parameters: {'model_type': 'mlp', 'hidden_dims': '[512, 256]', 'dropout': 0.4575975256370739, 'batch_norm': True, 'lr': 1.520167560151067e-05, 'weight_decay': 8.85315154007235e-07, 'epochs': 334, 'loss': 'mse', 'optimizer': 'adam', 'graph_mode': 'off', 'use_snp_selection': False}. Best is trial 71 with value: 0.31394110948476106.
[I 2025-12-06 06:22:26,365] Trial 105 finished with value: 0.3038800488446702 and parameters: {'model_type': 'mlp', 'hidden_dims': '[512, 256]', 'dropout': 0.5055483245638046, 'batch_norm': True, 'lr': 1.3039791066838223e-05, 'weight_decay': 4.3302494442807995e-07, 'epochs': 188, 'loss': 'mse', 'optimizer': 'adam', 'graph_mode': 'off', 'use_snp_selection': False}. Best is trial 71 with value: 0.31394110948476106.
[I 2025-12-06 06:23:13,589] Trial 106 finished with value: 0.31027913623826125 and parameters: {'model_type': 'mlp', 'hidden_dims': '[512, 256]', 'dropout': 0.5007928024315471, 'batch_norm': True, 'lr': 4.570849553199022e-05, 'weight_decay': 6.460222365412619e-05, 'epochs': 238, 'loss': 'mse', 'optimizer': 'adam', 'graph_mode': 'off', 'use_snp_selection': False}. Best is trial 71 with value: 0.31394110948476106.
[I 2025-12-06 06:24:13,052] Trial 107 finished with value: 0.30152452627523574 and parameters: {'model_type': 'mlp', 'hidden_dims': '[512, 64]', 'dropout': 0.11643684705299115, 'batch_norm': True, 'lr': 9.440290549629069e-06, 'weight_decay': 1.2428278622508126e-07, 'epochs': 309, 'loss': 'mae', 'optimizer': 'adam', 'graph_mode': 'off', 'use_snp_selection': False}. Best is trial 71 with value: 0.31394110948476106.
[I 2025-12-06 06:24:53,783] Trial 108 finished with value: 0.3127510130402877 and parameters: {'model_type': 'mlp', 'hidden_dims': '[512, 256]', 'dropout': 0.12815057054407922, 'batch_norm': True, 'lr': 5.7759307030021416e-05, 'weight_decay': 0.0002797136630376145, 'epochs': 201, 'loss': 'mse', 'optimizer': 'adam', 'graph_mode': 'off', 'use_snp_selection': False}. Best is trial 71 with value: 0.31394110948476106.
[I 2025-12-06 06:25:32,294] Trial 109 finished with value: 0.3090149314167673 and parameters: {'model_type': 'mlp', 'hidden_dims': '[256, 128]', 'dropout': 0.12577923839820773, 'batch_norm': True, 'lr': 5.7257381265938774e-05, 'weight_decay': 0.0002714820840565347, 'epochs': 226, 'loss': 'mae', 'optimizer': 'adam', 'graph_mode': 'off', 'use_snp_selection': True, 'num_snps': 28308}. Best is trial 71 with value: 0.31394110948476106.
[I 2025-12-06 06:26:12,538] Trial 110 finished with value: 0.30852319923538196 and parameters: {'model_type': 'mlp', 'hidden_dims': '[512, 256]', 'dropout': 0.15272723771080063, 'batch_norm': True, 'lr': 6.87322669616438e-05, 'weight_decay': 0.0002182063808938595, 'epochs': 199, 'loss': 'mse', 'optimizer': 'adam', 'graph_mode': 'off', 'use_snp_selection': False}. Best is trial 71 with value: 0.31394110948476106.
[I 2025-12-06 06:26:54,614] Trial 111 finished with value: 0.30245190119782367 and parameters: {'model_type': 'mlp', 'hidden_dims': '[512, 256]', 'dropout': 0.14552012880189313, 'batch_norm': True, 'lr': 3.513042304493097e-05, 'weight_decay': 0.0004777878079232849, 'epochs': 209, 'loss': 'mse', 'optimizer': 'adam', 'graph_mode': 'off', 'use_snp_selection': False}. Best is trial 71 with value: 0.31394110948476106.
[I 2025-12-06 06:27:47,835] Trial 112 finished with value: 0.30990887524962907 and parameters: {'model_type': 'mlp', 'hidden_dims': '[512, 256]', 'dropout': 0.13390224949513252, 'batch_norm': True, 'lr': 8.152220083864949e-05, 'weight_decay': 0.0006636183943977925, 'epochs': 272, 'loss': 'mse', 'optimizer': 'adam', 'graph_mode': 'off', 'use_snp_selection': False}. Best is trial 71 with value: 0.31394110948476106.
[I 2025-12-06 06:28:45,780] Trial 113 finished with value: 0.3112513537405761 and parameters: {'model_type': 'mlp', 'hidden_dims': '[512, 256]', 'dropout': 0.43149310617944947, 'batch_norm': True, 'lr': 3.97618700535172e-05, 'weight_decay': 0.00020387284847389652, 'epochs': 299, 'loss': 'mse', 'optimizer': 'adam', 'graph_mode': 'off', 'use_snp_selection': False}. Best is trial 71 with value: 0.31394110948476106.
[I 2025-12-06 06:29:22,065] Trial 114 finished with value: 0.30415974556105413 and parameters: {'model_type': 'mlp', 'hidden_dims': '[512, 256]', 'dropout': 0.5594275493878224, 'batch_norm': True, 'lr': 2.805294005415607e-05, 'weight_decay': 1.0109390543369208e-05, 'epochs': 176, 'loss': 'mse', 'optimizer': 'adam', 'graph_mode': 'off', 'use_snp_selection': False}. Best is trial 71 with value: 0.31394110948476106.
[I 2025-12-06 06:29:55,678] Trial 115 finished with value: 0.31245958423769304 and parameters: {'model_type': 'mlp', 'hidden_dims': '[512, 256]', 'dropout': 0.5203895445732615, 'batch_norm': True, 'lr': 5.509810393941603e-05, 'weight_decay': 0.0003941233505876475, 'epochs': 161, 'loss': 'mse', 'optimizer': 'adam', 'graph_mode': 'off', 'use_snp_selection': False}. Best is trial 71 with value: 0.31394110948476106.
[I 2025-12-06 06:30:08,809] Trial 116 finished with value: 0.3014087047877986 and parameters: {'model_type': 'mlp', 'hidden_dims': '[128, 64]', 'dropout': 0.10899464486348195, 'batch_norm': True, 'lr': 5.4225220267475805e-05, 'weight_decay': 0.00029154131612145094, 'epochs': 168, 'loss': 'mse', 'optimizer': 'adam', 'graph_mode': 'off', 'use_snp_selection': False}. Best is trial 71 with value: 0.31394110948476106.
[I 2025-12-06 06:30:49,618] Trial 117 finished with value: 0.31428281915791 and parameters: {'model_type': 'mlp', 'hidden_dims': '[512, 256]', 'dropout': 0.5394126403115802, 'batch_norm': True, 'lr': 6.750163962801303e-05, 'weight_decay': 0.00038050835795620997, 'epochs': 202, 'loss': 'mae', 'optimizer': 'adam', 'graph_mode': 'off', 'use_snp_selection': False}. Best is trial 117 with value: 0.31428281915791.
[I 2025-12-06 06:31:30,165] Trial 118 finished with value: 0.3112373621659023 and parameters: {'model_type': 'mlp', 'hidden_dims': '[512, 128]', 'dropout': 0.10158140604408722, 'batch_norm': True, 'lr': 6.371094262502228e-05, 'weight_decay': 0.0003504833104220087, 'epochs': 201, 'loss': 'mse', 'optimizer': 'adam', 'graph_mode': 'off', 'use_snp_selection': False}. Best is trial 117 with value: 0.31428281915791.
[I 2025-12-06 06:32:03,116] Trial 119 finished with value: 0.31060750044974056 and parameters: {'model_type': 'mlp', 'hidden_dims': '[512, 256]', 'dropout': 0.5990127129355303, 'batch_norm': True, 'lr': 7.282215667733157e-05, 'weight_decay': 0.00016133345767550342, 'epochs': 157, 'loss': 'mae', 'optimizer': 'adam', 'graph_mode': 'off', 'use_snp_selection': False}. Best is trial 117 with value: 0.31428281915791.
[I 2025-12-06 06:32:40,823] Trial 120 finished with value: 0.3026535172949373 and parameters: {'model_type': 'mlp', 'hidden_dims': '[512, 64]', 'dropout': 0.538394725358802, 'batch_norm': True, 'lr': 0.0001613033124082425, 'weight_decay': 0.0004221555725247425, 'epochs': 185, 'loss': 'mse', 'optimizer': 'adam', 'graph_mode': 'off', 'use_snp_selection': False}. Best is trial 117 with value: 0.31428281915791.
[I 2025-12-06 06:33:24,752] Trial 121 finished with value: 0.309399770726979 and parameters: {'model_type': 'mlp', 'hidden_dims': '[512, 256]', 'dropout': 0.5279445669352689, 'batch_norm': True, 'lr': 4.9037903243220295e-05, 'weight_decay': 0.0005930004966601887, 'epochs': 219, 'loss': 'mae', 'optimizer': 'adam', 'graph_mode': 'off', 'use_snp_selection': False}. Best is trial 117 with value: 0.31428281915791.
[I 2025-12-06 06:34:04,435] Trial 122 finished with value: 0.314602625654642 and parameters: {'model_type': 'mlp', 'hidden_dims': '[512, 256]', 'dropout': 0.5824899431442744, 'batch_norm': True, 'lr': 8.488775762637441e-05, 'weight_decay': 0.0007964261001650587, 'epochs': 194, 'loss': 'mae', 'optimizer': 'adam', 'graph_mode': 'off', 'use_snp_selection': False}. Best is trial 122 with value: 0.314602625654642.
[I 2025-12-06 06:34:44,171] Trial 123 finished with value: 0.3097242076620068 and parameters: {'model_type': 'mlp', 'hidden_dims': '[512, 256]', 'dropout': 0.5595726662913428, 'batch_norm': True, 'lr': 9.05366189139264e-05, 'weight_decay': 0.0006927058753576789, 'epochs': 195, 'loss': 'mae', 'optimizer': 'adam', 'graph_mode': 'off', 'use_snp_selection': False}. Best is trial 122 with value: 0.314602625654642.
[I 2025-12-06 06:35:22,602] Trial 124 finished with value: 0.310860817953052 and parameters: {'model_type': 'mlp', 'hidden_dims': '[512, 256]', 'dropout': 0.582504423556038, 'batch_norm': True, 'lr': 5.840995453978216e-05, 'weight_decay': 0.000519836748484909, 'epochs': 188, 'loss': 'mae', 'optimizer': 'adam', 'graph_mode': 'off', 'use_snp_selection': False}. Best is trial 122 with value: 0.314602625654642.
[I 2025-12-06 06:35:56,437] Trial 125 finished with value: 0.30943245585293083 and parameters: {'model_type': 'mlp', 'hidden_dims': '[512, 256]', 'dropout': 0.12853390693101902, 'batch_norm': True, 'lr': 0.0001121422564856575, 'weight_decay': 0.000919636715493224, 'epochs': 162, 'loss': 'mae', 'optimizer': 'adam', 'graph_mode': 'off', 'use_snp_selection': False}. Best is trial 122 with value: 0.314602625654642.
[I 2025-12-06 06:36:17,800] Trial 126 finished with value: 0.3108691674905882 and parameters: {'model_type': 'mlp', 'hidden_dims': '[256, 128, 64]', 'dropout': 0.581360745865112, 'batch_norm': True, 'lr': 7.856377263489165e-05, 'weight_decay': 0.0002949842026147995, 'epochs': 180, 'loss': 'mae', 'optimizer': 'adam', 'graph_mode': 'off', 'use_snp_selection': False}. Best is trial 122 with value: 0.314602625654642.
[I 2025-12-06 06:36:59,380] Trial 127 finished with value: 0.3121783620266131 and parameters: {'model_type': 'mlp', 'hidden_dims': '[512, 256]', 'dropout': 0.1596286603682276, 'batch_norm': True, 'lr': 0.00010347902081190628, 'weight_decay': 0.0004362158147581075, 'epochs': 206, 'loss': 'mae', 'optimizer': 'adam', 'graph_mode': 'off', 'use_snp_selection': False}. Best is trial 122 with value: 0.314602625654642.
[I 2025-12-06 06:37:41,166] Trial 128 finished with value: 0.31091648678338435 and parameters: {'model_type': 'mlp', 'hidden_dims': '[512, 256]', 'dropout': 0.1617374520737993, 'batch_norm': True, 'lr': 0.00010379168264224275, 'weight_decay': 0.0008606648297410681, 'epochs': 207, 'loss': 'mae', 'optimizer': 'adam', 'graph_mode': 'off', 'use_snp_selection': False}. Best is trial 122 with value: 0.314602625654642.
[I 2025-12-06 06:38:09,924] Trial 129 finished with value: 0.30195102924510875 and parameters: {'model_type': 'mlp', 'hidden_dims': '[512, 256]', 'dropout': 0.14166690588442968, 'batch_norm': True, 'lr': 6.5506446233406e-05, 'weight_decay': 0.0002333191309686403, 'epochs': 173, 'loss': 'mse', 'optimizer': 'adam', 'graph_mode': 'off', 'use_snp_selection': True, 'num_snps': 9760}. Best is trial 122 with value: 0.314602625654642.
[I 2025-12-06 06:38:49,440] Trial 130 finished with value: 0.3102294499611536 and parameters: {'model_type': 'mlp', 'hidden_dims': '[512, 256]', 'dropout': 0.11873693309730234, 'batch_norm': True, 'lr': 0.00018223318608705092, 'weight_decay': 0.00042169321526299325, 'epochs': 195, 'loss': 'mae', 'optimizer': 'adam', 'graph_mode': 'off', 'use_snp_selection': False}. Best is trial 122 with value: 0.314602625654642.
[I 2025-12-06 06:39:30,744] Trial 131 finished with value: 0.31289577047889044 and parameters: {'model_type': 'mlp', 'hidden_dims': '[512, 256]', 'dropout': 0.17098678433643277, 'batch_norm': True, 'lr': 4.622798646828205e-05, 'weight_decay': 0.00045913570848581765, 'epochs': 205, 'loss': 'mae', 'optimizer': 'adam', 'graph_mode': 'off', 'use_snp_selection': False}. Best is trial 122 with value: 0.314602625654642.
[I 2025-12-06 06:40:12,440] Trial 132 finished with value: 0.2859545607523775 and parameters: {'model_type': 'mlp', 'hidden_dims': '[512, 256]', 'dropout': 0.1746306590616255, 'batch_norm': True, 'lr': 2.2757652887330195e-06, 'weight_decay': 0.0004370325019488124, 'epochs': 207, 'loss': 'mae', 'optimizer': 'adam', 'graph_mode': 'off', 'use_snp_selection': False}. Best is trial 122 with value: 0.314602625654642.
[I 2025-12-06 06:40:55,777] Trial 133 finished with value: 0.3132923588221813 and parameters: {'model_type': 'mlp', 'hidden_dims': '[512, 256]', 'dropout': 0.19847881664359188, 'batch_norm': True, 'lr': 8.752347284240563e-05, 'weight_decay': 0.0007396514819597795, 'epochs': 216, 'loss': 'mae', 'optimizer': 'adam', 'graph_mode': 'off', 'use_snp_selection': False}. Best is trial 122 with value: 0.314602625654642.
[I 2025-12-06 06:41:38,959] Trial 134 finished with value: 0.31151141088207246 and parameters: {'model_type': 'mlp', 'hidden_dims': '[512, 256]', 'dropout': 0.1980250436823328, 'batch_norm': True, 'lr': 8.598529126493207e-05, 'weight_decay': 0.0007812745764347513, 'epochs': 215, 'loss': 'mae', 'optimizer': 'adam', 'graph_mode': 'off', 'use_snp_selection': False}. Best is trial 122 with value: 0.314602625654642.
[I 2025-12-06 06:42:09,591] Trial 135 finished with value: 0.30407306919332566 and parameters: {'model_type': 'mlp', 'hidden_dims': '[512, 256]', 'dropout': 0.20923120569710518, 'batch_norm': True, 'lr': 4.1654898604032464e-05, 'weight_decay': 0.0006000734681132315, 'epochs': 144, 'loss': 'mae', 'optimizer': 'adam', 'graph_mode': 'off', 'use_snp_selection': False}. Best is trial 122 with value: 0.314602625654642.
[I 2025-12-06 06:42:37,604] Trial 136 finished with value: 0.3086516986720446 and parameters: {'model_type': 'mlp', 'hidden_dims': '[512, 256]', 'dropout': 0.1917060931992095, 'batch_norm': True, 'lr': 0.0001470346188906019, 'weight_decay': 0.0003268183330109828, 'epochs': 129, 'loss': 'mae', 'optimizer': 'adam', 'graph_mode': 'off', 'use_snp_selection': False}. Best is trial 122 with value: 0.314602625654642.
[I 2025-12-06 06:43:16,688] Trial 137 finished with value: 0.3111624171733919 and parameters: {'model_type': 'mlp', 'hidden_dims': '[512, 64]', 'dropout': 0.1482113980631011, 'batch_norm': True, 'lr': 7.120131240566252e-05, 'weight_decay': 0.00011770772092221834, 'epochs': 193, 'loss': 'mse', 'optimizer': 'adam', 'graph_mode': 'off', 'use_snp_selection': False}. Best is trial 122 with value: 0.314602625654642.
[I 2025-12-06 06:43:56,987] Trial 138 finished with value: 0.3109058520392138 and parameters: {'model_type': 'mlp', 'hidden_dims': '[512, 256]', 'dropout': 0.16759626810324452, 'batch_norm': True, 'lr': 8.802778684033257e-05, 'weight_decay': 0.0005609272658197271, 'epochs': 199, 'loss': 'mae', 'optimizer': 'adam', 'graph_mode': 'off', 'use_snp_selection': False}. Best is trial 122 with value: 0.314602625654642.
[I 2025-12-06 06:44:12,368] Trial 139 finished with value: 0.3132372110034257 and parameters: {'model_type': 'mlp', 'hidden_dims': '[256, 128]', 'dropout': 0.5552089144713039, 'batch_norm': False, 'lr': 5.5595861925570703e-05, 'weight_decay': 0.0006321145401903798, 'epochs': 118, 'loss': 'mse', 'optimizer': 'adam', 'graph_mode': 'off', 'use_snp_selection': False}. Best is trial 122 with value: 0.314602625654642.
[I 2025-12-06 06:44:27,398] Trial 140 finished with value: 0.28857576297022686 and parameters: {'model_type': 'mlp', 'hidden_dims': '[256, 128]', 'dropout': 0.5529987399452223, 'batch_norm': False, 'lr': 5.6614193008244136e-05, 'weight_decay': 0.0007082647983926494, 'epochs': 114, 'loss': 'mae', 'optimizer': 'adam', 'graph_mode': 'off', 'use_snp_selection': False}. Best is trial 122 with value: 0.314602625654642.
[I 2025-12-06 06:44:43,015] Trial 141 finished with value: 0.3120662662663775 and parameters: {'model_type': 'mlp', 'hidden_dims': '[256, 128]', 'dropout': 0.5376008773976744, 'batch_norm': False, 'lr': 5.015411346390458e-05, 'weight_decay': 0.0007981366596164436, 'epochs': 121, 'loss': 'mse', 'optimizer': 'adam', 'graph_mode': 'off', 'use_snp_selection': False}. Best is trial 122 with value: 0.314602625654642.
