[I 2025-12-05 16:01:38,234] Trial 6 finished with value: 0.08174735056005764 and parameters: {'model_type': 'mlp', 'hidden_dims': '[256, 128]', 'dropout': 0.3930109900265879, 'batch_norm': False, 'lr': 4.892964372128395e-05, 'weight_decay': 1.5809549317992182e-06, 'epochs': 199, 'loss': 'mse', 'optimizer': 'adam', 'graph_mode': 'off', 'use_snp_selection': False}. Best is trial 6 with value: 0.08174735056005764.
[I 2025-12-05 16:01:39,706] Trial 7 finished with value: 0.06161566498141962 and parameters: {'model_type': 'mlp', 'hidden_dims': '[512, 256]', 'dropout': 0.15343979219678458, 'batch_norm': True, 'lr': 6.234003099047341e-05, 'weight_decay': 3.894760610535477e-07, 'epochs': 97, 'loss': 'mse', 'optimizer': 'adam', 'graph_mode': 'off', 'use_snp_selection': False}. Best is trial 6 with value: 0.08174735056005764.
[I 2025-12-05 16:01:42,788] Trial 8 finished with value: 0.06192993132065234 and parameters: {'model_type': 'mlp', 'hidden_dims': '[512, 128]', 'dropout': 0.10743001231661406, 'batch_norm': True, 'lr': 0.00023728538449271062, 'weight_decay': 1.7629071578048637e-05, 'epochs': 312, 'loss': 'mae', 'optimizer': 'adam', 'graph_mode': 'off', 'use_snp_selection': False}. Best is trial 6 with value: 0.08174735056005764.
[I 2025-12-05 16:01:44,836] Trial 9 finished with value: 0.09602688663013464 and parameters: {'model_type': 'mlp', 'hidden_dims': '[512, 64]', 'dropout': 0.14505336736221927, 'batch_norm': True, 'lr': 5.8619638388111826e-05, 'weight_decay': 6.200156172669308e-07, 'epochs': 175, 'loss': 'mse', 'optimizer': 'adam', 'graph_mode': 'off', 'use_snp_selection': False}. Best is trial 9 with value: 0.09602688663013464.
[I 2025-12-05 16:01:45,925] Trial 10 finished with value: 0.0014485502965355243 and parameters: {'model_type': 'mlp', 'hidden_dims': '[512, 64]', 'dropout': 0.27531666245262887, 'batch_norm': False, 'lr': 0.00032393778075602147, 'weight_decay': 1.1714031539166647e-07, 'epochs': 44, 'loss': 'mse', 'optimizer': 'adam', 'graph_mode': 'off', 'use_snp_selection': False}. Best is trial 9 with value: 0.09602688663013464.
[I 2025-12-05 16:01:47,186] Trial 11 finished with value: 0.06702357722690912 and parameters: {'model_type': 'mlp', 'hidden_dims': '[256, 128]', 'dropout': 0.4976577565047725, 'batch_norm': False, 'lr': 1.6474108386126448e-05, 'weight_decay': 1.4494794384169763e-06, 'epochs': 185, 'loss': 'mse', 'optimizer': 'adam', 'graph_mode': 'off', 'use_snp_selection': False}. Best is trial 9 with value: 0.09602688663013464.
[I 2025-12-05 16:01:48,598] Trial 12 finished with value: 0.10005734614186132 and parameters: {'model_type': 'mlp', 'hidden_dims': '[256, 128]', 'dropout': 0.33506312640228997, 'batch_norm': False, 'lr': 2.1956038299947918e-05, 'weight_decay': 1.255784110448998e-06, 'epochs': 218, 'loss': 'mse', 'optimizer': 'adam', 'graph_mode': 'off', 'use_snp_selection': False}. Best is trial 12 with value: 0.10005734614186132.
[I 2025-12-05 16:01:49,624] Trial 13 finished with value: 0.0537062683478338 and parameters: {'model_type': 'mlp', 'hidden_dims': '[128, 64]', 'dropout': 0.2972521032827613, 'batch_norm': False, 'lr': 1.537109700844877e-05, 'weight_decay': 2.1978369390547452e-06, 'epochs': 234, 'loss': 'mse', 'optimizer': 'adam', 'graph_mode': 'off', 'use_snp_selection': False}. Best is trial 12 with value: 0.10005734614186132.
[I 2025-12-05 16:01:51,445] Trial 14 finished with value: 0.10865215811559152 and parameters: {'model_type': 'mlp', 'hidden_dims': '[512, 256]', 'dropout': 0.2033601956916713, 'batch_norm': True, 'lr': 0.0001457690241539883, 'weight_decay': 4.3747121993078125e-07, 'epochs': 139, 'loss': 'mse', 'optimizer': 'adam', 'graph_mode': 'off', 'use_snp_selection': False}. Best is trial 14 with value: 0.10865215811559152.
[I 2025-12-05 16:01:52,976] Trial 15 finished with value: 0.05375356872092912 and parameters: {'model_type': 'mlp', 'hidden_dims': '[512, 256]', 'dropout': 0.22324193485000776, 'batch_norm': False, 'lr': 0.0001572871022003765, 'weight_decay': 1.2138430327269933e-07, 'epochs': 101, 'loss': 'mse', 'optimizer': 'adam', 'graph_mode': 'off', 'use_snp_selection': False}. Best is trial 14 with value: 0.10865215811559152.
[I 2025-12-05 16:01:55,520] Trial 16 finished with value: 0.09191419960318746 and parameters: {'model_type': 'mlp', 'hidden_dims': '[512, 256]', 'dropout': 0.32031868488877385, 'batch_norm': True, 'lr': 0.0006289346442834361, 'weight_decay': 3.5782261944567403e-06, 'epochs': 240, 'loss': 'mse', 'optimizer': 'adam', 'graph_mode': 'off', 'use_snp_selection': False}. Best is trial 14 with value: 0.10865215811559152.
[I 2025-12-05 16:01:56,543] Trial 17 finished with value: 0.0473029878912296 and parameters: {'model_type': 'mlp', 'hidden_dims': '[256, 128, 64]', 'dropout': 0.3359509294360599, 'batch_norm': False, 'lr': 2.088305436647351e-05, 'weight_decay': 4.167626182108816e-07, 'epochs': 106, 'loss': 'mse', 'optimizer': 'adam', 'graph_mode': 'off', 'use_snp_selection': False}. Best is trial 14 with value: 0.10865215811559152.
[I 2025-12-05 16:01:59,608] Trial 18 finished with value: 0.11229925359316556 and parameters: {'model_type': 'mlp', 'hidden_dims': '[256, 128]', 'dropout': 0.49216103860548877, 'batch_norm': False, 'lr': 0.0009109419121837671, 'weight_decay': 5.399175074092964e-06, 'epochs': 209, 'loss': 'mse', 'optimizer': 'adam', 'graph_mode': 'off', 'use_snp_selection': True, 'num_snps': 58241}. Best is trial 18 with value: 0.11229925359316556.
[I 2025-12-05 16:02:02,399] Trial 19 finished with value: 0.07689212635497263 and parameters: {'model_type': 'mlp', 'hidden_dims': '[512, 256]', 'dropout': 0.513426782949672, 'batch_norm': True, 'lr': 0.0008245132405553007, 'weight_decay': 6.222548508687935e-06, 'epochs': 49, 'loss': 'mse', 'optimizer': 'adam', 'graph_mode': 'off', 'use_snp_selection': True, 'num_snps': 55667}. Best is trial 18 with value: 0.11229925359316556.
[I 2025-12-05 16:02:06,145] Trial 20 finished with value: 0.0670591868557893 and parameters: {'model_type': 'mlp', 'hidden_dims': '[512, 256]', 'dropout': 0.591555494114107, 'batch_norm': True, 'lr': 0.00013400817891621365, 'weight_decay': 4.170062865086698e-05, 'epochs': 151, 'loss': 'mse', 'optimizer': 'adam', 'graph_mode': 'off', 'use_snp_selection': True, 'num_snps': 57703}. Best is trial 18 with value: 0.11229925359316556.
[I 2025-12-05 16:02:07,585] Trial 21 finished with value: 0.06629196331316455 and parameters: {'model_type': 'mlp', 'hidden_dims': '[256, 128]', 'dropout': 0.4727088783203093, 'batch_norm': False, 'lr': 0.0004646684363679669, 'weight_decay': 8.243204466155195e-07, 'epochs': 221, 'loss': 'mse', 'optimizer': 'adam', 'graph_mode': 'off', 'use_snp_selection': True, 'num_snps': 11878}. Best is trial 18 with value: 0.11229925359316556.
[I 2025-12-05 16:02:09,421] Trial 22 finished with value: 0.03424374498975096 and parameters: {'model_type': 'mlp', 'hidden_dims': '[256, 128]', 'dropout': 0.5457676315480617, 'batch_norm': False, 'lr': 0.0009334453542054464, 'weight_decay': 5.012377364839065e-06, 'epochs': 270, 'loss': 'mse', 'optimizer': 'adam', 'graph_mode': 'off', 'use_snp_selection': True, 'num_snps': 22259}. Best is trial 18 with value: 0.11229925359316556.
[I 2025-12-05 16:02:12,046] Trial 23 finished with value: 0.0746842000447913 and parameters: {'model_type': 'mlp', 'hidden_dims': '[256, 128]', 'dropout': 0.2198999633302277, 'batch_norm': False, 'lr': 0.00012495604084640226, 'weight_decay': 3.120096892180096e-07, 'epochs': 206, 'loss': 'mse', 'optimizer': 'adam', 'graph_mode': 'off', 'use_snp_selection': True, 'num_snps': 46925}. Best is trial 18 with value: 0.11229925359316556.
[I 2025-12-05 16:02:13,642] Trial 24 finished with value: 0.07539169026065938 and parameters: {'model_type': 'mlp', 'hidden_dims': '[256, 128]', 'dropout': 0.36580162833925, 'batch_norm': False, 'lr': 8.36794934070151e-06, 'weight_decay': 2.231453650487593e-07, 'epochs': 269, 'loss': 'mse', 'optimizer': 'adam', 'graph_mode': 'off', 'use_snp_selection': False}. Best is trial 18 with value: 0.11229925359316556.
[I 2025-12-05 16:02:14,750] Trial 25 finished with value: 0.0361555549298889 and parameters: {'model_type': 'mlp', 'hidden_dims': '[256, 128]', 'dropout': 0.4503558009633201, 'batch_norm': False, 'lr': 2.6009770520795623e-05, 'weight_decay': 9.283104332154834e-07, 'epochs': 127, 'loss': 'mse', 'optimizer': 'adam', 'graph_mode': 'off', 'use_snp_selection': False}. Best is trial 18 with value: 0.11229925359316556.
[I 2025-12-05 16:02:15,865] Trial 26 finished with value: 0.05135906168694904 and parameters: {'model_type': 'mlp', 'hidden_dims': '[128, 64]', 'dropout': 0.17948649421882285, 'batch_norm': False, 'lr': 0.0003256866067622884, 'weight_decay': 2.781038502498256e-06, 'epochs': 169, 'loss': 'mse', 'optimizer': 'adam', 'graph_mode': 'off', 'use_snp_selection': True, 'num_snps': 2344}. Best is trial 18 with value: 0.11229925359316556.
[I 2025-12-05 16:02:16,780] Trial 27 finished with value: 0.10260274596415814 and parameters: {'model_type': 'mlp', 'hidden_dims': '[256, 128, 64]', 'dropout': 0.25005041943189793, 'batch_norm': False, 'lr': 3.820926979866136e-05, 'weight_decay': 6.359923488225596e-06, 'epochs': 73, 'loss': 'mae', 'optimizer': 'adam', 'graph_mode': 'off', 'use_snp_selection': False}. Best is trial 18 with value: 0.11229925359316556.
[I 2025-12-05 16:02:19,227] Trial 28 finished with value: 0.048206993287947 and parameters: {'model_type': 'mlp', 'hidden_dims': '[256, 128, 64]', 'dropout': 0.2522700766094444, 'batch_norm': True, 'lr': 3.695853273205143e-05, 'weight_decay': 8.046262965638888e-05, 'epochs': 59, 'loss': 'mae', 'optimizer': 'adam', 'graph_mode': 'off', 'use_snp_selection': True, 'num_snps': 48700}. Best is trial 18 with value: 0.11229925359316556.
[I 2025-12-05 16:02:21,069] Trial 29 finished with value: 0.047621027172687264 and parameters: {'model_type': 'mlp', 'hidden_dims': '[256, 128, 64]', 'dropout': 0.1858584215989412, 'batch_norm': True, 'lr': 0.00010821374911652203, 'weight_decay': 6.827247947432239e-06, 'epochs': 67, 'loss': 'mae', 'optimizer': 'adam', 'graph_mode': 'off', 'use_snp_selection': True, 'num_snps': 26940}. Best is trial 18 with value: 0.11229925359316556.
[I 2025-12-05 16:02:22,001] Trial 30 finished with value: 0.11646223412731632 and parameters: {'model_type': 'mlp', 'hidden_dims': '[256, 128, 64]', 'dropout': 0.10835336400259868, 'batch_norm': False, 'lr': 9.312518648701799e-06, 'weight_decay': 7.852357868748531e-05, 'epochs': 79, 'loss': 'mae', 'optimizer': 'adam', 'graph_mode': 'off', 'use_snp_selection': False}. Best is trial 30 with value: 0.11646223412731632.
[I 2025-12-05 16:02:22,927] Trial 31 finished with value: 0.09933906887526614 and parameters: {'model_type': 'mlp', 'hidden_dims': '[256, 128, 64]', 'dropout': 0.11870854669548585, 'batch_norm': False, 'lr': 1.0038563763351555e-05, 'weight_decay': 0.00012455712250835602, 'epochs': 79, 'loss': 'mae', 'optimizer': 'adam', 'graph_mode': 'off', 'use_snp_selection': False}. Best is trial 30 with value: 0.11646223412731632.
[I 2025-12-05 16:02:24,001] Trial 32 finished with value: 0.04816942338104168 and parameters: {'model_type': 'mlp', 'hidden_dims': '[256, 128, 64]', 'dropout': 0.14381037949911799, 'batch_norm': False, 'lr': 2.9681992964181274e-06, 'weight_decay': 9.801544510520877e-06, 'epochs': 124, 'loss': 'mae', 'optimizer': 'adam', 'graph_mode': 'off', 'use_snp_selection': False}. Best is trial 30 with value: 0.11646223412731632.
[I 2025-12-05 16:02:24,929] Trial 33 finished with value: 0.060454913827561754 and parameters: {'model_type': 'mlp', 'hidden_dims': '[256, 128, 64]', 'dropout': 0.19424294372147555, 'batch_norm': False, 'lr': 1.0454336641205728e-05, 'weight_decay': 2.4681042735078652e-05, 'epochs': 77, 'loss': 'mae', 'optimizer': 'adam', 'graph_mode': 'off', 'use_snp_selection': False}. Best is trial 30 with value: 0.11646223412731632.
[I 2025-12-05 16:02:26,020] Trial 34 finished with value: 0.06600875025312597 and parameters: {'model_type': 'mlp', 'hidden_dims': '[256, 128, 64]', 'dropout': 0.23211902117911645, 'batch_norm': False, 'lr': 2.761931648048337e-06, 'weight_decay': 0.00015294682537036187, 'epochs': 121, 'loss': 'mae', 'optimizer': 'adam', 'graph_mode': 'off', 'use_snp_selection': False}. Best is trial 30 with value: 0.11646223412731632.
[I 2025-12-05 16:02:27,955] Trial 35 finished with value: 0.09395569741004059 and parameters: {'model_type': 'mlp', 'hidden_dims': '[512, 128]', 'dropout': 0.29555285979377405, 'batch_norm': False, 'lr': 8.951006343866779e-05, 'weight_decay': 4.4583603519951154e-05, 'epochs': 159, 'loss': 'mae', 'optimizer': 'adam', 'graph_mode': 'off', 'use_snp_selection': False}. Best is trial 30 with value: 0.11646223412731632.
[I 2025-12-05 16:02:28,700] Trial 36 finished with value: -0.004980478843972028 and parameters: {'model_type': 'mlp', 'hidden_dims': '[128, 64]', 'dropout': 0.1574132891495136, 'batch_norm': True, 'lr': 4.69517896034606e-06, 'weight_decay': 1.2376109617231836e-05, 'epochs': 80, 'loss': 'mae', 'optimizer': 'adam', 'graph_mode': 'off', 'use_snp_selection': False}. Best is trial 30 with value: 0.11646223412731632.
[I 2025-12-05 16:02:30,951] Trial 37 finished with value: 0.09309740136703146 and parameters: {'model_type': 'mlp', 'hidden_dims': '[256, 128, 64]', 'dropout': 0.406849128101377, 'batch_norm': False, 'lr': 0.00020544325386886235, 'weight_decay': 0.0006307513011214727, 'epochs': 141, 'loss': 'mae', 'optimizer': 'adam', 'graph_mode': 'off', 'use_snp_selection': True, 'num_snps': 38290}. Best is trial 30 with value: 0.11646223412731632.
[I 2025-12-05 16:02:32,402] Trial 38 finished with value: 0.089978581088243 and parameters: {'model_type': 'mlp', 'hidden_dims': '[512, 256]', 'dropout': 0.10321130153332594, 'batch_norm': False, 'lr': 4.044397196226514e-05, 'weight_decay': 2.7499448625536218e-05, 'epochs': 98, 'loss': 'mae', 'optimizer': 'adam', 'graph_mode': 'off', 'use_snp_selection': False}. Best is trial 30 with value: 0.11646223412731632.
[I 2025-12-05 16:02:36,025] Trial 39 finished with value: 0.02093450561326924 and parameters: {'model_type': 'mlp', 'hidden_dims': '[512, 128]', 'dropout': 0.24934144621412324, 'batch_norm': True, 'lr': 1.0661807028389837e-06, 'weight_decay': 0.0002691708630904023, 'epochs': 136, 'loss': 'mae', 'optimizer': 'adam', 'graph_mode': 'off', 'use_snp_selection': True, 'num_snps': 59978}. Best is trial 30 with value: 0.11646223412731632.
[I 2025-12-05 16:02:37,097] Trial 40 finished with value: 0.04043849773602096 and parameters: {'model_type': 'mlp', 'hidden_dims': '[256, 128, 64]', 'dropout': 0.20969273305668057, 'batch_norm': True, 'lr': 6.774874132939307e-06, 'weight_decay': 7.850746971888713e-05, 'epochs': 111, 'loss': 'mae', 'optimizer': 'adam', 'graph_mode': 'off', 'use_snp_selection': False}. Best is trial 30 with value: 0.11646223412731632.
[I 2025-12-05 16:02:38,516] Trial 41 finished with value: 0.07654230307611909 and parameters: {'model_type': 'mlp', 'hidden_dims': '[256, 128]', 'dropout': 0.3550572609323792, 'batch_norm': False, 'lr': 2.913519140464621e-05, 'weight_decay': 1.3377400852745238e-06, 'epochs': 217, 'loss': 'mse', 'optimizer': 'adam', 'graph_mode': 'off', 'use_snp_selection': False}. Best is trial 30 with value: 0.11646223412731632.
[I 2025-12-05 16:02:40,062] Trial 42 finished with value: 0.08992526179552936 and parameters: {'model_type': 'mlp', 'hidden_dims': '[256, 128]', 'dropout': 0.28436642349091185, 'batch_norm': False, 'lr': 1.575451687673229e-05, 'weight_decay': 4.085116141714102e-06, 'epochs': 256, 'loss': 'mse', 'optimizer': 'adam', 'graph_mode': 'off', 'use_snp_selection': False}. Best is trial 30 with value: 0.11646223412731632.
[I 2025-12-05 16:02:42,239] Trial 43 finished with value: 0.09148426971096149 and parameters: {'model_type': 'mlp', 'hidden_dims': '[512, 64]', 'dropout': 0.4390962809668691, 'batch_norm': False, 'lr': 7.220493566385111e-05, 'weight_decay': 1.05427570462586e-05, 'epochs': 193, 'loss': 'mae', 'optimizer': 'adam', 'graph_mode': 'off', 'use_snp_selection': False}. Best is trial 30 with value: 0.11646223412731632.
[I 2025-12-05 16:02:44,046] Trial 44 finished with value: 0.09029973311091118 and parameters: {'model_type': 'mlp', 'hidden_dims': '[256, 128]', 'dropout': 0.32625388963461543, 'batch_norm': False, 'lr': 1.277790786198558e-05, 'weight_decay': 2.6172428139899654e-06, 'epochs': 343, 'loss': 'mse', 'optimizer': 'adam', 'graph_mode': 'off', 'use_snp_selection': False}. Best is trial 30 with value: 0.11646223412731632.
[I 2025-12-05 16:02:46,878] Trial 45 finished with value: 0.09438383310493696 and parameters: {'model_type': 'mlp', 'hidden_dims': '[512, 256]', 'dropout': 0.16354339718509323, 'batch_norm': False, 'lr': 4.7276574145451654e-05, 'weight_decay': 6.485081167357466e-07, 'epochs': 288, 'loss': 'mse', 'optimizer': 'adam', 'graph_mode': 'off', 'use_snp_selection': False}. Best is trial 30 with value: 0.11646223412731632.
[I 2025-12-05 16:02:48,294] Trial 46 finished with value: 0.09942523438776639 and parameters: {'model_type': 'mlp', 'hidden_dims': '[256, 128, 64]', 'dropout': 0.13501677633539536, 'batch_norm': False, 'lr': 2.2387383518384325e-05, 'weight_decay': 1.8151731290061508e-07, 'epochs': 219, 'loss': 'mae', 'optimizer': 'adam', 'graph_mode': 'off', 'use_snp_selection': False}. Best is trial 30 with value: 0.11646223412731632.
[I 2025-12-05 16:02:50,331] Trial 47 finished with value: -0.008896354016680314 and parameters: {'model_type': 'mlp', 'hidden_dims': '[512, 64]', 'dropout': 0.31068422882597585, 'batch_norm': False, 'lr': 0.0004324564521310835, 'weight_decay': 1.8191410977934771e-06, 'epochs': 173, 'loss': 'mse', 'optimizer': 'adam', 'graph_mode': 'off', 'use_snp_selection': False}. Best is trial 30 with value: 0.11646223412731632.
[I 2025-12-05 16:02:51,117] Trial 48 finished with value: 0.08525486695375507 and parameters: {'model_type': 'mlp', 'hidden_dims': '[128, 64]', 'dropout': 0.27056068189149834, 'batch_norm': True, 'lr': 0.00023644003390859404, 'weight_decay': 1.684089583318209e-05, 'epochs': 89, 'loss': 'mse', 'optimizer': 'adam', 'graph_mode': 'off', 'use_snp_selection': False}. Best is trial 30 with value: 0.11646223412731632.
[I 2025-12-05 16:02:53,290] Trial 49 finished with value: 0.07246142807520996 and parameters: {'model_type': 'mlp', 'hidden_dims': '[512, 256]', 'dropout': 0.3705412610296772, 'batch_norm': False, 'lr': 7.918495049550987e-05, 'weight_decay': 1.2225679154428946e-06, 'epochs': 191, 'loss': 'mse', 'optimizer': 'adam', 'graph_mode': 'off', 'use_snp_selection': False}. Best is trial 30 with value: 0.11646223412731632.
[I 2025-12-05 16:02:55,292] Trial 50 finished with value: -0.002741765727425077 and parameters: {'model_type': 'mlp', 'hidden_dims': '[512, 128]', 'dropout': 0.3898463160470866, 'batch_norm': True, 'lr': 7.495395679756293e-06, 'weight_decay': 4.904384654522859e-07, 'epochs': 251, 'loss': 'mae', 'optimizer': 'adam', 'graph_mode': 'off', 'use_snp_selection': True, 'num_snps': 19391}. Best is trial 30 with value: 0.11646223412731632.
[I 2025-12-05 16:02:56,741] Trial 51 finished with value: 0.08690382640115601 and parameters: {'model_type': 'mlp', 'hidden_dims': '[256, 128, 64]', 'dropout': 0.12132648789381087, 'batch_norm': False, 'lr': 2.1131121270291076e-05, 'weight_decay': 2.1652790523616914e-07, 'epochs': 227, 'loss': 'mae', 'optimizer': 'adam', 'graph_mode': 'off', 'use_snp_selection': False}. Best is trial 30 with value: 0.11646223412731632.
[I 2025-12-05 16:02:58,106] Trial 52 finished with value: 0.09421427325633407 and parameters: {'model_type': 'mlp', 'hidden_dims': '[256, 128, 64]', 'dropout': 0.13842830855097205, 'batch_norm': False, 'lr': 2.2522187896256783e-05, 'weight_decay': 1.85531258539803e-07, 'epochs': 213, 'loss': 'mae', 'optimizer': 'adam', 'graph_mode': 'off', 'use_snp_selection': False}. Best is trial 30 with value: 0.11646223412731632.
[I 2025-12-05 16:02:59,474] Trial 53 finished with value: 0.1076112283761259 and parameters: {'model_type': 'mlp', 'hidden_dims': '[256, 128, 64]', 'dropout': 0.1707609948913086, 'batch_norm': False, 'lr': 2.9300189955521236e-05, 'weight_decay': 1.265406149428734e-07, 'epochs': 203, 'loss': 'mae', 'optimizer': 'adam', 'graph_mode': 'off', 'use_snp_selection': False}. Best is trial 30 with value: 0.11646223412731632.
[I 2025-12-05 16:03:00,847] Trial 54 finished with value: 0.10645327419308245 and parameters: {'model_type': 'mlp', 'hidden_dims': '[256, 128]', 'dropout': 0.23952838402260695, 'batch_norm': False, 'lr': 6.0913257966847615e-05, 'weight_decay': 1.1448811075179064e-07, 'epochs': 205, 'loss': 'mae', 'optimizer': 'adam', 'graph_mode': 'off', 'use_snp_selection': False}. Best is trial 30 with value: 0.11646223412731632.
[I 2025-12-05 16:03:02,161] Trial 55 finished with value: 0.09403975421682967 and parameters: {'model_type': 'mlp', 'hidden_dims': '[256, 128, 64]', 'dropout': 0.16659298433023884, 'batch_norm': False, 'lr': 5.6259616113512135e-05, 'weight_decay': 1.0945998092773922e-07, 'epochs': 185, 'loss': 'mae', 'optimizer': 'adam', 'graph_mode': 'off', 'use_snp_selection': False}. Best is trial 30 with value: 0.11646223412731632.
[I 2025-12-05 16:03:03,349] Trial 56 finished with value: 0.09347746657430246 and parameters: {'model_type': 'mlp', 'hidden_dims': '[256, 128]', 'dropout': 0.2393185031558732, 'batch_norm': False, 'lr': 3.521283858838218e-05, 'weight_decay': 2.996659277276237e-07, 'epochs': 158, 'loss': 'mae', 'optimizer': 'adam', 'graph_mode': 'off', 'use_snp_selection': False}. Best is trial 30 with value: 0.11646223412731632.
[I 2025-12-05 16:03:05,574] Trial 57 finished with value: 0.1005538977871486 and parameters: {'model_type': 'mlp', 'hidden_dims': '[512, 256]', 'dropout': 0.20058506593058517, 'batch_norm': False, 'lr': 0.00015350248850595264, 'weight_decay': 1.3799043801216266e-07, 'epochs': 200, 'loss': 'mae', 'optimizer': 'adam', 'graph_mode': 'off', 'use_snp_selection': False}. Best is trial 30 with value: 0.11646223412731632.
