[I 2025-12-05 20:07:46,514] Trial 2 finished with value: 0.33879803985770707 and parameters: {'model_type': 'mlp', 'hidden_dims': '[256, 128, 64]', 'dropout': 0.41314357415569625, 'batch_norm': False, 'lr': 3.952233718592101e-06, 'weight_decay': 0.00026754769258252603, 'epochs': 149, 'loss': 'mse', 'optimizer': 'adam', 'graph_mode': 'off', 'use_snp_selection': True, 'num_snps': 11571}. Best is trial 1 with value: 0.34641039905492454.
[I 2025-12-05 20:08:52,079] Trial 3 finished with value: 0.3750316668963855 and parameters: {'model_type': 'mlp', 'hidden_dims': '[512, 64]', 'dropout': 0.5938127374509361, 'batch_norm': False, 'lr': 5.67704586114731e-06, 'weight_decay': 2.4518087630137052e-05, 'epochs': 320, 'loss': 'mae', 'optimizer': 'adam', 'graph_mode': 'off', 'use_snp_selection': False}. Best is trial 3 with value: 0.3750316668963855.
[I 2025-12-05 20:09:56,657] Trial 4 finished with value: 0.31924249002511457 and parameters: {'model_type': 'mlp', 'hidden_dims': '[512, 128]', 'dropout': 0.25746343592134413, 'batch_norm': True, 'lr': 1.3467657668402788e-06, 'weight_decay': 0.00033087251918647806, 'epochs': 277, 'loss': 'mse', 'optimizer': 'adam', 'graph_mode': 'off', 'use_snp_selection': True, 'num_snps': 36675}. Best is trial 3 with value: 0.3750316668963855.
[I 2025-12-05 20:10:42,038] Trial 5 finished with value: 0.2903848428447085 and parameters: {'model_type': 'mlp', 'hidden_dims': '[512, 64]', 'dropout': 0.38275350994408375, 'batch_norm': True, 'lr': 1.5586664309232824e-06, 'weight_decay': 0.0008227664668621182, 'epochs': 145, 'loss': 'mae', 'optimizer': 'adam', 'graph_mode': 'off', 'use_snp_selection': True, 'num_snps': 32148}. Best is trial 3 with value: 0.3750316668963855.
[I 2025-12-05 20:11:05,898] Trial 6 finished with value: 0.35614317150339403 and parameters: {'model_type': 'mlp', 'hidden_dims': '[256, 128]', 'dropout': 0.3930109900265879, 'batch_norm': False, 'lr': 4.892964372128395e-05, 'weight_decay': 1.5809549317992182e-06, 'epochs': 199, 'loss': 'mse', 'optimizer': 'adam', 'graph_mode': 'off', 'use_snp_selection': False}. Best is trial 3 with value: 0.3750316668963855.
[I 2025-12-05 20:11:30,041] Trial 7 finished with value: 0.35820904085721655 and parameters: {'model_type': 'mlp', 'hidden_dims': '[512, 256]', 'dropout': 0.15343979219678458, 'batch_norm': True, 'lr': 6.234003099047341e-05, 'weight_decay': 3.894760610535477e-07, 'epochs': 97, 'loss': 'mse', 'optimizer': 'adam', 'graph_mode': 'off', 'use_snp_selection': False}. Best is trial 3 with value: 0.3750316668963855.
[I 2025-12-05 20:12:35,525] Trial 8 finished with value: 0.3529870120025065 and parameters: {'model_type': 'mlp', 'hidden_dims': '[512, 128]', 'dropout': 0.10743001231661406, 'batch_norm': True, 'lr': 0.00023728538449271062, 'weight_decay': 1.7629071578048637e-05, 'epochs': 312, 'loss': 'mae', 'optimizer': 'adam', 'graph_mode': 'off', 'use_snp_selection': False}. Best is trial 3 with value: 0.3750316668963855.
[I 2025-12-05 20:13:14,703] Trial 9 finished with value: 0.35842361153595087 and parameters: {'model_type': 'mlp', 'hidden_dims': '[512, 64]', 'dropout': 0.14505336736221927, 'batch_norm': True, 'lr': 5.8619638388111826e-05, 'weight_decay': 6.200156172669308e-07, 'epochs': 175, 'loss': 'mse', 'optimizer': 'adam', 'graph_mode': 'off', 'use_snp_selection': False}. Best is trial 3 with value: 0.3750316668963855.
[I 2025-12-05 20:13:30,513] Trial 10 finished with value: 0.34441106640223795 and parameters: {'model_type': 'mlp', 'hidden_dims': '[512, 64]', 'dropout': 0.5885461262002587, 'batch_norm': False, 'lr': 8.769366258768696e-06, 'weight_decay': 2.78273193871783e-06, 'epochs': 55, 'loss': 'mae', 'optimizer': 'adam', 'graph_mode': 'off', 'use_snp_selection': False}. Best is trial 3 with value: 0.3750316668963855.
[I 2025-12-05 20:14:16,110] Trial 11 finished with value: 0.3675850199828067 and parameters: {'model_type': 'mlp', 'hidden_dims': '[512, 64]', 'dropout': 0.583942291816117, 'batch_norm': False, 'lr': 1.422933652790185e-05, 'weight_decay': 1.2045055692919657e-07, 'epochs': 213, 'loss': 'mse', 'optimizer': 'adam', 'graph_mode': 'off', 'use_snp_selection': False}. Best is trial 3 with value: 0.3750316668963855.
[I 2025-12-05 20:15:08,825] Trial 12 finished with value: 0.37330110289927065 and parameters: {'model_type': 'mlp', 'hidden_dims': '[512, 64]', 'dropout': 0.593097749012682, 'batch_norm': False, 'lr': 1.1374686318732863e-05, 'weight_decay': 1.3081036432574914e-07, 'epochs': 250, 'loss': 'mae', 'optimizer': 'adam', 'graph_mode': 'off', 'use_snp_selection': False}. Best is trial 3 with value: 0.3750316668963855.
[I 2025-12-05 20:16:08,258] Trial 13 finished with value: 0.3655195056785286 and parameters: {'model_type': 'mlp', 'hidden_dims': '[512, 64]', 'dropout': 0.5043641748401543, 'batch_norm': False, 'lr': 1.262035332095525e-05, 'weight_decay': 4.80586993129494e-05, 'epochs': 285, 'loss': 'mae', 'optimizer': 'adam', 'graph_mode': 'off', 'use_snp_selection': False}. Best is trial 3 with value: 0.3750316668963855.
[I 2025-12-05 20:16:31,981] Trial 14 finished with value: 0.37266360660012837 and parameters: {'model_type': 'mlp', 'hidden_dims': '[128, 64]', 'dropout': 0.5300180653494536, 'batch_norm': False, 'lr': 5.096356034191146e-06, 'weight_decay': 3.0607358611649674e-06, 'epochs': 346, 'loss': 'mae', 'optimizer': 'adam', 'graph_mode': 'off', 'use_snp_selection': False}. Best is trial 3 with value: 0.3750316668963855.
[I 2025-12-05 20:17:26,030] Trial 15 finished with value: 0.36334414456403474 and parameters: {'model_type': 'mlp', 'hidden_dims': '[512, 256]', 'dropout': 0.29817671914947536, 'batch_norm': False, 'lr': 1.8411764708572348e-05, 'weight_decay': 1.232049712459595e-07, 'epochs': 257, 'loss': 'mae', 'optimizer': 'adam', 'graph_mode': 'off', 'use_snp_selection': False}. Best is trial 3 with value: 0.3750316668963855.
[I 2025-12-05 20:18:00,457] Trial 16 finished with value: 0.34488448229446755 and parameters: {'model_type': 'mlp', 'hidden_dims': '[256, 128, 64]', 'dropout': 0.4985027776477374, 'batch_norm': False, 'lr': 0.00017549215405955411, 'weight_decay': 9.796037636714031e-05, 'epochs': 303, 'loss': 'mae', 'optimizer': 'adam', 'graph_mode': 'off', 'use_snp_selection': False}. Best is trial 3 with value: 0.3750316668963855.
[I 2025-12-05 20:18:50,163] Trial 17 finished with value: 0.12130381029065099 and parameters: {'model_type': 'mlp', 'hidden_dims': '[512, 64]', 'dropout': 0.46956397995943144, 'batch_norm': False, 'lr': 0.000906375209920231, 'weight_decay': 6.503919561253859e-06, 'epochs': 239, 'loss': 'mae', 'optimizer': 'adam', 'graph_mode': 'off', 'use_snp_selection': False}. Best is trial 3 with value: 0.3750316668963855.
[I 2025-12-05 20:20:25,230] Trial 18 finished with value: 0.3768249461450045 and parameters: {'model_type': 'mlp', 'hidden_dims': '[512, 64]', 'dropout': 0.5468831937008775, 'batch_norm': False, 'lr': 3.329079977138569e-06, 'weight_decay': 3.5310916592806245e-07, 'epochs': 318, 'loss': 'mae', 'optimizer': 'adam', 'graph_mode': 'off', 'use_snp_selection': True, 'num_snps': 58241}. Best is trial 18 with value: 0.3768249461450045.
[I 2025-12-05 20:21:58,439] Trial 19 finished with value: 0.3766271826467197 and parameters: {'model_type': 'mlp', 'hidden_dims': '[512, 64]', 'dropout': 0.5441884957330794, 'batch_norm': False, 'lr': 3.5174637112418118e-06, 'weight_decay': 2.8130326038007742e-05, 'epochs': 323, 'loss': 'mae', 'optimizer': 'adam', 'graph_mode': 'off', 'use_snp_selection': True, 'num_snps': 55667}. Best is trial 18 with value: 0.3768249461450045.
[I 2025-12-05 20:23:29,085] Trial 20 finished with value: 0.37521780310600766 and parameters: {'model_type': 'mlp', 'hidden_dims': '[512, 256]', 'dropout': 0.33342124442316484, 'batch_norm': False, 'lr': 3.101327183314624e-06, 'weight_decay': 6.156615130801898e-07, 'epochs': 294, 'loss': 'mae', 'optimizer': 'adam', 'graph_mode': 'off', 'use_snp_selection': True, 'num_snps': 57703}. Best is trial 18 with value: 0.3768249461450045.
[I 2025-12-05 20:25:01,685] Trial 21 finished with value: 0.37557125031639965 and parameters: {'model_type': 'mlp', 'hidden_dims': '[512, 256]', 'dropout': 0.32967325732922625, 'batch_norm': False, 'lr': 2.813419319355781e-06, 'weight_decay': 5.320616480613653e-07, 'epochs': 288, 'loss': 'mae', 'optimizer': 'adam', 'graph_mode': 'off', 'use_snp_selection': True, 'num_snps': 59845}. Best is trial 18 with value: 0.3768249461450045.
[I 2025-12-05 20:26:44,524] Trial 22 finished with value: 0.3767646511819724 and parameters: {'model_type': 'mlp', 'hidden_dims': '[512, 256]', 'dropout': 0.3369156109631033, 'batch_norm': False, 'lr': 2.523064963881003e-06, 'weight_decay': 3.2787434088902953e-07, 'epochs': 345, 'loss': 'mae', 'optimizer': 'adam', 'graph_mode': 'off', 'use_snp_selection': True, 'num_snps': 59635}. Best is trial 18 with value: 0.3768249461450045.
[I 2025-12-05 20:28:16,145] Trial 23 finished with value: 0.3679245421501355 and parameters: {'model_type': 'mlp', 'hidden_dims': '[512, 256]', 'dropout': 0.5384273175945657, 'batch_norm': False, 'lr': 1.1094273212131717e-06, 'weight_decay': 1.6018801075704255e-06, 'epochs': 340, 'loss': 'mae', 'optimizer': 'adam', 'graph_mode': 'off', 'use_snp_selection': True, 'num_snps': 51866}. Best is trial 18 with value: 0.3768249461450045.
[I 2025-12-05 20:29:20,184] Trial 24 finished with value: 0.3517002241361066 and parameters: {'model_type': 'mlp', 'hidden_dims': '[256, 128, 64]', 'dropout': 0.4532859312761465, 'batch_norm': False, 'lr': 2.6470527355854517e-05, 'weight_decay': 3.711921890857929e-06, 'epochs': 347, 'loss': 'mae', 'optimizer': 'adam', 'graph_mode': 'off', 'use_snp_selection': True, 'num_snps': 51470}. Best is trial 18 with value: 0.3768249461450045.
[I 2025-12-05 20:30:03,540] Trial 25 finished with value: 0.3637153423737749 and parameters: {'model_type': 'mlp', 'hidden_dims': '[512, 128]', 'dropout': 0.23452530120209408, 'batch_norm': False, 'lr': 7.666914863173754e-06, 'weight_decay': 2.678984165232859e-07, 'epochs': 320, 'loss': 'mae', 'optimizer': 'adam', 'graph_mode': 'off', 'use_snp_selection': True, 'num_snps': 17230}. Best is trial 18 with value: 0.3768249461450045.
[I 2025-12-05 20:30:58,317] Trial 26 finished with value: 0.3735719625420254 and parameters: {'model_type': 'mlp', 'hidden_dims': '[256, 128]', 'dropout': 0.28840446049882007, 'batch_norm': False, 'lr': 2.1075671910094017e-06, 'weight_decay': 1.0402812125968805e-06, 'epochs': 274, 'loss': 'mae', 'optimizer': 'adam', 'graph_mode': 'off', 'use_snp_selection': True, 'num_snps': 46944}. Best is trial 18 with value: 0.3768249461450045.
[I 2025-12-05 20:31:52,013] Trial 27 finished with value: 0.3701612772753284 and parameters: {'model_type': 'mlp', 'hidden_dims': '[128, 64]', 'dropout': 0.367661752538193, 'batch_norm': False, 'lr': 2.9387957626602793e-06, 'weight_decay': 2.4051949581271616e-07, 'epochs': 312, 'loss': 'mae', 'optimizer': 'adam', 'graph_mode': 'off', 'use_snp_selection': True, 'num_snps': 59670}. Best is trial 18 with value: 0.3768249461450045.
[I 2025-12-05 20:32:53,633] Trial 28 finished with value: 0.377405269007026 and parameters: {'model_type': 'mlp', 'hidden_dims': '[512, 256]', 'dropout': 0.4911371856075518, 'batch_norm': False, 'lr': 6.346279650163663e-06, 'weight_decay': 8.998479561642212e-06, 'epochs': 215, 'loss': 'mae', 'optimizer': 'adam', 'graph_mode': 'off', 'use_snp_selection': True, 'num_snps': 42058}. Best is trial 28 with value: 0.377405269007026.
[I 2025-12-05 20:33:56,317] Trial 29 finished with value: 0.3662503773300856 and parameters: {'model_type': 'mlp', 'hidden_dims': '[512, 256]', 'dropout': 0.49083200098660296, 'batch_norm': False, 'lr': 1.9273452756655805e-06, 'weight_decay': 6.3175895207505055e-06, 'epochs': 220, 'loss': 'mae', 'optimizer': 'adam', 'graph_mode': 'off', 'use_snp_selection': True, 'num_snps': 42303}. Best is trial 28 with value: 0.377405269007026.
[I 2025-12-05 20:34:37,021] Trial 30 finished with value: 0.32504980725078136 and parameters: {'model_type': 'mlp', 'hidden_dims': '[512, 256]', 'dropout': 0.41917137253164727, 'batch_norm': False, 'lr': 1.0105630062079762e-06, 'weight_decay': 1.1551762043090074e-06, 'epochs': 169, 'loss': 'mae', 'optimizer': 'adam', 'graph_mode': 'off', 'use_snp_selection': True, 'num_snps': 23548}. Best is trial 28 with value: 0.377405269007026.
[I 2025-12-05 20:36:04,222] Trial 31 finished with value: 0.37549989857161875 and parameters: {'model_type': 'mlp', 'hidden_dims': '[512, 256]', 'dropout': 0.5500835877331459, 'batch_norm': False, 'lr': 5.180393330865907e-06, 'weight_decay': 3.966526469482291e-05, 'epochs': 328, 'loss': 'mae', 'optimizer': 'adam', 'graph_mode': 'off', 'use_snp_selection': True, 'num_snps': 50740}. Best is trial 28 with value: 0.377405269007026.
[I 2025-12-05 20:36:53,036] Trial 32 finished with value: 0.37242552271772555 and parameters: {'model_type': 'mlp', 'hidden_dims': '[128, 64]', 'dropout': 0.5531226930288476, 'batch_norm': False, 'lr': 7.248046463356561e-06, 'weight_decay': 0.00011876721247228694, 'epochs': 266, 'loss': 'mae', 'optimizer': 'adam', 'graph_mode': 'off', 'use_snp_selection': True, 'num_snps': 54686}. Best is trial 28 with value: 0.377405269007026.
[I 2025-12-05 20:37:39,121] Trial 33 finished with value: 0.3727184385793483 and parameters: {'model_type': 'mlp', 'hidden_dims': '[512, 256]', 'dropout': 0.463369783604459, 'batch_norm': False, 'lr': 3.920978008485695e-06, 'weight_decay': 1.0939975108108489e-05, 'epochs': 111, 'loss': 'mae', 'optimizer': 'adam', 'graph_mode': 'off', 'use_snp_selection': True, 'num_snps': 38593}. Best is trial 28 with value: 0.377405269007026.
[I 2025-12-05 20:39:05,646] Trial 34 finished with value: 0.37524271845730306 and parameters: {'model_type': 'mlp', 'hidden_dims': '[512, 64]', 'dropout': 0.5200739532278197, 'batch_norm': False, 'lr': 2.3289099551302517e-06, 'weight_decay': 2.0964181892187047e-05, 'epochs': 350, 'loss': 'mae', 'optimizer': 'adam', 'graph_mode': 'off', 'use_snp_selection': True, 'num_snps': 48097}. Best is trial 28 with value: 0.377405269007026.
[I 2025-12-05 20:40:10,134] Trial 35 finished with value: 0.32906042286611836 and parameters: {'model_type': 'mlp', 'hidden_dims': '[256, 128]', 'dropout': 0.4364710393214665, 'batch_norm': True, 'lr': 4.072896820203069e-06, 'weight_decay': 7.943031877045477e-05, 'epochs': 328, 'loss': 'mae', 'optimizer': 'adam', 'graph_mode': 'off', 'use_snp_selection': True, 'num_snps': 54221}. Best is trial 28 with value: 0.377405269007026.
[I 2025-12-05 20:41:07,498] Trial 36 finished with value: 0.3696407137668539 and parameters: {'model_type': 'mlp', 'hidden_dims': '[256, 128, 64]', 'dropout': 0.5681512588927742, 'batch_norm': False, 'lr': 2.2259276617680535e-05, 'weight_decay': 0.00019417162436965261, 'epochs': 230, 'loss': 'mse', 'optimizer': 'adam', 'graph_mode': 'off', 'use_snp_selection': True, 'num_snps': 55608}. Best is trial 28 with value: 0.377405269007026.
[I 2025-12-05 20:42:02,970] Trial 37 finished with value: 0.3674264379442197 and parameters: {'model_type': 'mlp', 'hidden_dims': '[512, 64]', 'dropout': 0.4054610954358261, 'batch_norm': False, 'lr': 1.5352882685179572e-06, 'weight_decay': 3.681694392805901e-05, 'epochs': 302, 'loss': 'mae', 'optimizer': 'adam', 'graph_mode': 'off', 'use_snp_selection': True, 'num_snps': 28178}. Best is trial 28 with value: 0.377405269007026.
[I 2025-12-05 20:42:57,167] Trial 38 finished with value: 0.3552361692612397 and parameters: {'model_type': 'mlp', 'hidden_dims': '[512, 256]', 'dropout': 0.3554425748689234, 'batch_norm': True, 'lr': 4.0531978550740704e-05, 'weight_decay': 0.0007039256747749402, 'epochs': 147, 'loss': 'mse', 'optimizer': 'adam', 'graph_mode': 'off', 'use_snp_selection': True, 'num_snps': 43229}. Best is trial 28 with value: 0.377405269007026.
[I 2025-12-05 20:44:02,107] Trial 39 finished with value: 0.3779156619737201 and parameters: {'model_type': 'mlp', 'hidden_dims': '[512, 128]', 'dropout': 0.48117239236153064, 'batch_norm': False, 'lr': 4.049531851862147e-06, 'weight_decay': 2.4219817029742214e-07, 'epochs': 199, 'loss': 'mae', 'optimizer': 'adam', 'graph_mode': 'off', 'use_snp_selection': True, 'num_snps': 48239}. Best is trial 39 with value: 0.3779156619737201.
[I 2025-12-05 20:45:06,096] Trial 40 finished with value: 0.33984653616865634 and parameters: {'model_type': 'mlp', 'hidden_dims': '[512, 128]', 'dropout': 0.47488903392007314, 'batch_norm': True, 'lr': 6.107538248867505e-06, 'weight_decay': 3.322919818042448e-07, 'epochs': 195, 'loss': 'mae', 'optimizer': 'adam', 'graph_mode': 'off', 'use_snp_selection': True, 'num_snps': 47363}. Best is trial 39 with value: 0.3779156619737201.
[I 2025-12-05 20:46:15,320] Trial 41 finished with value: 0.3754053581784126 and parameters: {'model_type': 'mlp', 'hidden_dims': '[512, 128]', 'dropout': 0.5167976810309998, 'batch_norm': False, 'lr': 3.82881814497007e-06, 'weight_decay': 1.694588932525325e-07, 'epochs': 182, 'loss': 'mae', 'optimizer': 'adam', 'graph_mode': 'off', 'use_snp_selection': True, 'num_snps': 55686}. Best is trial 39 with value: 0.3779156619737201.
[I 2025-12-05 20:47:23,876] Trial 42 finished with value: 0.36955257939564 and parameters: {'model_type': 'mlp', 'hidden_dims': '[512, 128]', 'dropout': 0.4395414180287909, 'batch_norm': False, 'lr': 9.679425218863718e-06, 'weight_decay': 1.9879810196627078e-07, 'epochs': 207, 'loss': 'mae', 'optimizer': 'adam', 'graph_mode': 'off', 'use_snp_selection': True, 'num_snps': 50829}. Best is trial 39 with value: 0.3779156619737201.
[I 2025-12-05 20:48:26,918] Trial 43 finished with value: 0.34608153705726163 and parameters: {'model_type': 'mlp', 'hidden_dims': '[512, 128]', 'dropout': 0.553988625494007, 'batch_norm': False, 'lr': 1.5830743529255138e-06, 'weight_decay': 8.619886828954425e-07, 'epochs': 133, 'loss': 'mae', 'optimizer': 'adam', 'graph_mode': 'off', 'use_snp_selection': True, 'num_snps': 58821}. Best is trial 39 with value: 0.3779156619737201.
[I 2025-12-05 20:49:58,427] Trial 44 finished with value: 0.3771847344076697 and parameters: {'model_type': 'mlp', 'hidden_dims': '[512, 64]', 'dropout': 0.38439971931911804, 'batch_norm': False, 'lr': 2.6961928246112316e-06, 'weight_decay': 4.5653918273047114e-07, 'epochs': 332, 'loss': 'mse', 'optimizer': 'adam', 'graph_mode': 'off', 'use_snp_selection': True, 'num_snps': 53740}. Best is trial 39 with value: 0.3779156619737201.
[I 2025-12-05 20:50:37,678] Trial 45 finished with value: 0.3152579452547011 and parameters: {'model_type': 'mlp', 'hidden_dims': '[512, 64]', 'dropout': 0.3725418609274217, 'batch_norm': False, 'lr': 2.4994038100052798e-06, 'weight_decay': 4.945022819797842e-07, 'epochs': 44, 'loss': 'mse', 'optimizer': 'adam', 'graph_mode': 'off', 'use_snp_selection': True, 'num_snps': 40302}. Best is trial 39 with value: 0.3779156619737201.
[I 2025-12-05 20:51:24,829] Trial 46 finished with value: 0.33495297486346065 and parameters: {'model_type': 'mlp', 'hidden_dims': '[256, 128]', 'dropout': 0.3975523080452116, 'batch_norm': True, 'lr': 6.450292717198046e-06, 'weight_decay': 2.0861860724263967e-06, 'epochs': 167, 'loss': 'mse', 'optimizer': 'adam', 'graph_mode': 'off', 'use_snp_selection': True, 'num_snps': 46149}. Best is trial 39 with value: 0.3779156619737201.
[I 2025-12-05 20:51:48,046] Trial 47 finished with value: 0.17435015374347831 and parameters: {'model_type': 'mlp', 'hidden_dims': '[512, 128]', 'dropout': 0.2332783991746729, 'batch_norm': False, 'lr': 1.3490674844464767e-06, 'weight_decay': 3.7029503675739994e-07, 'epochs': 93, 'loss': 'mse', 'optimizer': 'adam', 'graph_mode': 'off', 'use_snp_selection': True, 'num_snps': 2313}. Best is trial 39 with value: 0.3779156619737201.
[I 2025-12-05 20:52:40,111] Trial 48 finished with value: 0.35528610875574557 and parameters: {'model_type': 'mlp', 'hidden_dims': '[512, 64]', 'dropout': 0.30461188845637566, 'batch_norm': False, 'lr': 1.5231106726145955e-05, 'weight_decay': 8.210261186621991e-07, 'epochs': 184, 'loss': 'mse', 'optimizer': 'adam', 'graph_mode': 'off', 'use_snp_selection': True, 'num_snps': 36282}. Best is trial 39 with value: 0.3779156619737201.
[I 2025-12-05 20:53:56,938] Trial 49 finished with value: 0.3680096505296303 and parameters: {'model_type': 'mlp', 'hidden_dims': '[512, 256]', 'dropout': 0.42398519642888816, 'batch_norm': False, 'lr': 4.742040601680695e-06, 'weight_decay': 1.4725737977603026e-07, 'epochs': 261, 'loss': 'mse', 'optimizer': 'adam', 'graph_mode': 'off', 'use_snp_selection': True, 'num_snps': 50699}. Best is trial 39 with value: 0.3779156619737201.
[I 2025-12-05 20:54:36,846] Trial 50 finished with value: 0.33455230939571506 and parameters: {'model_type': 'mlp', 'hidden_dims': '[128, 64]', 'dropout': 0.48379431009638113, 'batch_norm': False, 'lr': 0.0001362400403117377, 'weight_decay': 2.7206984426636184e-07, 'epochs': 333, 'loss': 'mse', 'optimizer': 'adam', 'graph_mode': 'off', 'use_snp_selection': True, 'num_snps': 32610}. Best is trial 39 with value: 0.3779156619737201.
[I 2025-12-05 20:56:06,306] Trial 51 finished with value: 0.3774930740122414 and parameters: {'model_type': 'mlp', 'hidden_dims': '[512, 64]', 'dropout': 0.5729327747683138, 'batch_norm': False, 'lr': 3.358463271508849e-06, 'weight_decay': 1.7048357402130677e-05, 'epochs': 313, 'loss': 'mae', 'optimizer': 'adam', 'graph_mode': 'off', 'use_snp_selection': True, 'num_snps': 55161}. Best is trial 39 with value: 0.3779156619737201.
[I 2025-12-05 20:57:32,664] Trial 52 finished with value: 0.37640236046911985 and parameters: {'model_type': 'mlp', 'hidden_dims': '[512, 64]', 'dropout': 0.5761937939055625, 'batch_norm': False, 'lr': 2.034628606774096e-06, 'weight_decay': 5.497154172542178e-06, 'epochs': 302, 'loss': 'mae', 'optimizer': 'adam', 'graph_mode': 'off', 'use_snp_selection': True, 'num_snps': 53631}. Best is trial 39 with value: 0.3779156619737201.
