[I 2025-12-05 15:34:34,687] Trial 66 finished with value: -0.02651927790428737 and parameters: {'model_type': 'mlp', 'hidden_dims': '[512, 64]', 'dropout': 0.5614703766691963, 'batch_norm': False, 'lr': 6.3654941024583866e-06, 'weight_decay': 3.192577224729498e-05, 'epochs': 104, 'loss': 'mae', 'optimizer': 'adam', 'graph_mode': 'off', 'use_snp_selection': True, 'num_snps': 2241}. Best is trial 64 with value: 0.038837352766533786.
[I 2025-12-05 15:34:35,780] Trial 67 finished with value: -0.00984981840572901 and parameters: {'model_type': 'mlp', 'hidden_dims': '[512, 64]', 'dropout': 0.5887556276570153, 'batch_norm': False, 'lr': 1.2647932606241958e-06, 'weight_decay': 9.94539140510503e-06, 'epochs': 116, 'loss': 'mse', 'optimizer': 'adam', 'graph_mode': 'off', 'use_snp_selection': True, 'num_snps': 11369}. Best is trial 64 with value: 0.038837352766533786.
[I 2025-12-05 15:34:36,607] Trial 68 finished with value: 0.0334798478689288 and parameters: {'model_type': 'mlp', 'hidden_dims': '[512, 64]', 'dropout': 0.5144068243253362, 'batch_norm': False, 'lr': 2.288573172142826e-05, 'weight_decay': 1.709714856297552e-06, 'epochs': 66, 'loss': 'mae', 'optimizer': 'adam', 'graph_mode': 'off', 'use_snp_selection': True, 'num_snps': 5325}. Best is trial 64 with value: 0.038837352766533786.
[I 2025-12-05 15:34:37,525] Trial 69 finished with value: 0.004396393136313733 and parameters: {'model_type': 'mlp', 'hidden_dims': '[512, 64]', 'dropout': 0.18801532696931517, 'batch_norm': False, 'lr': 4.744578980421112e-05, 'weight_decay': 7.820864000286851e-06, 'epochs': 56, 'loss': 'mae', 'optimizer': 'adam', 'graph_mode': 'off', 'use_snp_selection': True, 'num_snps': 8640}. Best is trial 64 with value: 0.038837352766533786.
[I 2025-12-05 15:34:38,790] Trial 70 finished with value: -0.017154411362803632 and parameters: {'model_type': 'mlp', 'hidden_dims': '[512, 64]', 'dropout': 0.5770891067974234, 'batch_norm': True, 'lr': 4.190665806241003e-06, 'weight_decay': 5.428603813722098e-06, 'epochs': 72, 'loss': 'mae', 'optimizer': 'adam', 'graph_mode': 'off', 'use_snp_selection': True, 'num_snps': 15597}. Best is trial 64 with value: 0.038837352766533786.
[I 2025-12-05 15:34:41,820] Trial 71 finished with value: -0.0032497455467346468 and parameters: {'model_type': 'mlp', 'hidden_dims': '[512, 64]', 'dropout': 0.5229756089925846, 'batch_norm': False, 'lr': 2.36065311364395e-05, 'weight_decay': 1.8166778342040887e-06, 'epochs': 91, 'loss': 'mae', 'optimizer': 'adam', 'graph_mode': 'off', 'use_snp_selection': True, 'num_snps': 59400}. Best is trial 64 with value: 0.038837352766533786.
[I 2025-12-05 15:34:42,638] Trial 72 finished with value: -0.005605754423477948 and parameters: {'model_type': 'mlp', 'hidden_dims': '[512, 64]', 'dropout': 0.5406358771525296, 'batch_norm': False, 'lr': 1.110032792069045e-05, 'weight_decay': 3.01283484406186e-06, 'epochs': 67, 'loss': 'mae', 'optimizer': 'adam', 'graph_mode': 'off', 'use_snp_selection': True, 'num_snps': 4713}. Best is trial 64 with value: 0.038837352766533786.
[I 2025-12-05 15:34:43,498] Trial 73 finished with value: 0.019842907567773987 and parameters: {'model_type': 'mlp', 'hidden_dims': '[512, 64]', 'dropout': 0.5109254667464983, 'batch_norm': False, 'lr': 1.4936226435593661e-05, 'weight_decay': 1.1719883125523e-06, 'epochs': 86, 'loss': 'mae', 'optimizer': 'adam', 'graph_mode': 'off', 'use_snp_selection': True, 'num_snps': 6165}. Best is trial 64 with value: 0.038837352766533786.
[I 2025-12-05 15:34:44,364] Trial 74 finished with value: 0.014411935220345728 and parameters: {'model_type': 'mlp', 'hidden_dims': '[512, 64]', 'dropout': 0.4770364055625472, 'batch_norm': False, 'lr': 7.807968902935924e-06, 'weight_decay': 1.096696590607152e-06, 'epochs': 81, 'loss': 'mae', 'optimizer': 'adam', 'graph_mode': 'off', 'use_snp_selection': True, 'num_snps': 6480}. Best is trial 64 with value: 0.038837352766533786.
[I 2025-12-05 15:34:45,342] Trial 75 finished with value: -0.004761413552906558 and parameters: {'model_type': 'mlp', 'hidden_dims': '[512, 64]', 'dropout': 0.5053510929003296, 'batch_norm': False, 'lr': 1.7993672248303112e-06, 'weight_decay': 2.6916766381524826e-06, 'epochs': 52, 'loss': 'mae', 'optimizer': 'adam', 'graph_mode': 'off', 'use_snp_selection': True, 'num_snps': 9702}. Best is trial 64 with value: 0.038837352766533786.
[I 2025-12-05 15:34:47,084] Trial 76 finished with value: -0.011361126497874241 and parameters: {'model_type': 'mlp', 'hidden_dims': '[512, 64]', 'dropout': 0.46572790083014387, 'batch_norm': False, 'lr': 2.5624062585631343e-05, 'weight_decay': 8.002514828225712e-07, 'epochs': 207, 'loss': 'mae', 'optimizer': 'adam', 'graph_mode': 'off', 'use_snp_selection': False}. Best is trial 64 with value: 0.038837352766533786.
[I 2025-12-05 15:34:48,897] Trial 77 finished with value: -0.015541372314684257 and parameters: {'model_type': 'mlp', 'hidden_dims': '[512, 64]', 'dropout': 0.5624329739552012, 'batch_norm': False, 'lr': 1.2398050226703192e-06, 'weight_decay': 5.908055965053678e-07, 'epochs': 91, 'loss': 'mae', 'optimizer': 'adam', 'graph_mode': 'off', 'use_snp_selection': True, 'num_snps': 30996}. Best is trial 64 with value: 0.038837352766533786.
[I 2025-12-05 15:34:50,023] Trial 78 finished with value: -0.0006714642146599223 and parameters: {'model_type': 'mlp', 'hidden_dims': '[256, 128]', 'dropout': 0.5128880909118193, 'batch_norm': False, 'lr': 4.98438228507108e-06, 'weight_decay': 0.00010774988178297994, 'epochs': 121, 'loss': 'mae', 'optimizer': 'adam', 'graph_mode': 'off', 'use_snp_selection': True, 'num_snps': 13114}. Best is trial 64 with value: 0.038837352766533786.
[I 2025-12-05 15:34:51,602] Trial 79 finished with value: -0.011908130689445604 and parameters: {'model_type': 'mlp', 'hidden_dims': '[512, 128]', 'dropout': 0.4174686395124236, 'batch_norm': False, 'lr': 1.3985908483613083e-05, 'weight_decay': 1.3958431303347415e-06, 'epochs': 73, 'loss': 'mae', 'optimizer': 'adam', 'graph_mode': 'off', 'use_snp_selection': True, 'num_snps': 26587}. Best is trial 64 with value: 0.038837352766533786.
[I 2025-12-05 15:34:53,615] Trial 80 finished with value: 0.006262140113318364 and parameters: {'model_type': 'mlp', 'hidden_dims': '[512, 64]', 'dropout': 0.27637773788550857, 'batch_norm': False, 'lr': 1.8736318192878473e-06, 'weight_decay': 3.68141131928588e-06, 'epochs': 272, 'loss': 'mae', 'optimizer': 'adam', 'graph_mode': 'off', 'use_snp_selection': False}. Best is trial 64 with value: 0.038837352766533786.
[I 2025-12-05 15:34:54,531] Trial 81 finished with value: 0.0044996423016032995 and parameters: {'model_type': 'mlp', 'hidden_dims': '[512, 256]', 'dropout': 0.4970695462210011, 'batch_norm': False, 'lr': 1.682264766228071e-05, 'weight_decay': 1.5909137225500665e-06, 'epochs': 111, 'loss': 'mse', 'optimizer': 'adam', 'graph_mode': 'off', 'use_snp_selection': True, 'num_snps': 5200}. Best is trial 64 with value: 0.038837352766533786.
[I 2025-12-05 15:34:55,335] Trial 82 finished with value: -0.014631584020376905 and parameters: {'model_type': 'mlp', 'hidden_dims': '[256, 128, 64]', 'dropout': 0.5152859802892095, 'batch_norm': False, 'lr': 1.0638890451013547e-05, 'weight_decay': 1.0730915715577686e-06, 'epochs': 85, 'loss': 'mae', 'optimizer': 'adam', 'graph_mode': 'off', 'use_snp_selection': True, 'num_snps': 2557}. Best is trial 64 with value: 0.038837352766533786.
[I 2025-12-05 15:34:56,777] Trial 83 finished with value: 0.011083150069751017 and parameters: {'model_type': 'mlp', 'hidden_dims': '[512, 64]', 'dropout': 0.5384163594302963, 'batch_norm': False, 'lr': 2.206101662435491e-05, 'weight_decay': 2.245449278259281e-06, 'epochs': 102, 'loss': 'mae', 'optimizer': 'adam', 'graph_mode': 'off', 'use_snp_selection': True, 'num_snps': 20556}. Best is trial 64 with value: 0.038837352766533786.
[I 2025-12-05 15:34:57,853] Trial 84 finished with value: -0.004369535627454437 and parameters: {'model_type': 'mlp', 'hidden_dims': '[128, 64]', 'dropout': 0.48891850091740396, 'batch_norm': False, 'lr': 1.3397676507612576e-05, 'weight_decay': 0.0009144635349580388, 'epochs': 258, 'loss': 'mae', 'optimizer': 'adam', 'graph_mode': 'off', 'use_snp_selection': True, 'num_snps': 7177}. Best is trial 64 with value: 0.038837352766533786.
[I 2025-12-05 15:34:58,644] Trial 85 finished with value: 0.006687487523125238 and parameters: {'model_type': 'mlp', 'hidden_dims': '[512, 64]', 'dropout': 0.5515751712533752, 'batch_norm': False, 'lr': 3.4617873629499835e-05, 'weight_decay': 1.8155621028761076e-06, 'epochs': 61, 'loss': 'mse', 'optimizer': 'adam', 'graph_mode': 'off', 'use_snp_selection': True, 'num_snps': 4327}. Best is trial 64 with value: 0.038837352766533786.
[I 2025-12-05 15:34:59,689] Trial 86 finished with value: 0.006271756544307844 and parameters: {'model_type': 'mlp', 'hidden_dims': '[128, 64]', 'dropout': 0.5906522072704605, 'batch_norm': False, 'lr': 4.2342652859372183e-05, 'weight_decay': 8.173407369964482e-06, 'epochs': 133, 'loss': 'mae', 'optimizer': 'adam', 'graph_mode': 'off', 'use_snp_selection': True, 'num_snps': 8327}. Best is trial 64 with value: 0.038837352766533786.
[I 2025-12-05 15:35:02,755] Trial 87 finished with value: 0.000260921197996749 and parameters: {'model_type': 'mlp', 'hidden_dims': '[512, 64]', 'dropout': 0.5285921875037808, 'batch_norm': True, 'lr': 6.497086603250208e-05, 'weight_decay': 7.227333082738986e-07, 'epochs': 151, 'loss': 'mae', 'optimizer': 'adam', 'graph_mode': 'off', 'use_snp_selection': True, 'num_snps': 54344}. Best is trial 64 with value: 0.038837352766533786.
[I 2025-12-05 15:35:04,028] Trial 88 finished with value: 0.00443162294040846 and parameters: {'model_type': 'mlp', 'hidden_dims': '[512, 256]', 'dropout': 0.47237801594169626, 'batch_norm': False, 'lr': 2.8832689099960146e-05, 'weight_decay': 5.400821615607888e-06, 'epochs': 98, 'loss': 'mse', 'optimizer': 'adam', 'graph_mode': 'off', 'use_snp_selection': True, 'num_snps': 16765}. Best is trial 64 with value: 0.038837352766533786.
[I 2025-12-05 15:35:04,960] Trial 89 finished with value: -0.031859393862260776 and parameters: {'model_type': 'mlp', 'hidden_dims': '[512, 128]', 'dropout': 0.45751198345104843, 'batch_norm': False, 'lr': 7.846797783829679e-06, 'weight_decay': 0.00021468571805977068, 'epochs': 46, 'loss': 'mae', 'optimizer': 'adam', 'graph_mode': 'off', 'use_snp_selection': False}. Best is trial 64 with value: 0.038837352766533786.
[I 2025-12-05 15:35:06,448] Trial 90 finished with value: 0.0003185670867675179 and parameters: {'model_type': 'mlp', 'hidden_dims': '[256, 128]', 'dropout': 0.5726383836216987, 'batch_norm': False, 'lr': 1.8081782522122463e-05, 'weight_decay': 1.6546564401384455e-05, 'epochs': 122, 'loss': 'mae', 'optimizer': 'adam', 'graph_mode': 'off', 'use_snp_selection': True, 'num_snps': 21627}. Best is trial 64 with value: 0.038837352766533786.
[I 2025-12-05 15:35:07,803] Trial 91 finished with value: 0.055760875437285855 and parameters: {'model_type': 'mlp', 'hidden_dims': '[128, 64]', 'dropout': 0.49474803882138635, 'batch_norm': False, 'lr': 2.175493584220926e-06, 'weight_decay': 2.476549512133552e-07, 'epochs': 144, 'loss': 'mae', 'optimizer': 'adam', 'graph_mode': 'off', 'use_snp_selection': True, 'num_snps': 18889}. Best is trial 91 with value: 0.055760875437285855.
[I 2025-12-05 15:35:09,298] Trial 92 finished with value: 0.03274855373142195 and parameters: {'model_type': 'mlp', 'hidden_dims': '[128, 64]', 'dropout': 0.4939232391764277, 'batch_norm': False, 'lr': 1.6463557589469767e-06, 'weight_decay': 2.7236034739148704e-06, 'epochs': 113, 'loss': 'mae', 'optimizer': 'adam', 'graph_mode': 'off', 'use_snp_selection': True, 'num_snps': 25007}. Best is trial 91 with value: 0.055760875437285855.
[I 2025-12-05 15:35:10,734] Trial 93 finished with value: -0.0033414184826367575 and parameters: {'model_type': 'mlp', 'hidden_dims': '[128, 64]', 'dropout': 0.4960713230702982, 'batch_norm': False, 'lr': 1.6332873243781221e-06, 'weight_decay': 3.5141154982965157e-07, 'epochs': 112, 'loss': 'mae', 'optimizer': 'adam', 'graph_mode': 'off', 'use_snp_selection': True, 'num_snps': 25241}. Best is trial 91 with value: 0.055760875437285855.
[I 2025-12-05 15:35:12,250] Trial 94 finished with value: 0.024941381682149644 and parameters: {'model_type': 'mlp', 'hidden_dims': '[128, 64]', 'dropout': 0.5122498497961527, 'batch_norm': False, 'lr': 2.437350379864856e-06, 'weight_decay': 3.962987722099592e-06, 'epochs': 132, 'loss': 'mae', 'optimizer': 'adam', 'graph_mode': 'off', 'use_snp_selection': True, 'num_snps': 24651}. Best is trial 91 with value: 0.055760875437285855.
[I 2025-12-05 15:35:13,673] Trial 95 finished with value: -0.019340625805396267 and parameters: {'model_type': 'mlp', 'hidden_dims': '[128, 64]', 'dropout': 0.48672535187476584, 'batch_norm': False, 'lr': 2.1149487451070493e-06, 'weight_decay': 3.7582498050828966e-06, 'epochs': 176, 'loss': 'mae', 'optimizer': 'adam', 'graph_mode': 'off', 'use_snp_selection': True, 'num_snps': 19023}. Best is trial 91 with value: 0.055760875437285855.
[I 2025-12-05 15:35:15,342] Trial 96 finished with value: 0.04251916916031089 and parameters: {'model_type': 'mlp', 'hidden_dims': '[128, 64]', 'dropout': 0.4439588137485486, 'batch_norm': False, 'lr': 3.148108841212115e-06, 'weight_decay': 2.7544553273263977e-06, 'epochs': 156, 'loss': 'mae', 'optimizer': 'adam', 'graph_mode': 'off', 'use_snp_selection': True, 'num_snps': 29044}. Best is trial 91 with value: 0.055760875437285855.
[I 2025-12-05 15:35:17,073] Trial 97 finished with value: 0.0017933452689021707 and parameters: {'model_type': 'mlp', 'hidden_dims': '[128, 64]', 'dropout': 0.44420760830019856, 'batch_norm': False, 'lr': 2.9079519241866323e-06, 'weight_decay': 2.4335660403571556e-06, 'epochs': 145, 'loss': 'mae', 'optimizer': 'adam', 'graph_mode': 'off', 'use_snp_selection': True, 'num_snps': 32813}. Best is trial 91 with value: 0.055760875437285855.
[I 2025-12-05 15:35:17,799] Trial 98 finished with value: 0.002101549887724414 and parameters: {'model_type': 'mlp', 'hidden_dims': '[128, 64]', 'dropout': 0.4276919115625122, 'batch_norm': False, 'lr': 2.515863115930806e-06, 'weight_decay': 4.52970921516153e-06, 'epochs': 131, 'loss': 'mae', 'optimizer': 'adam', 'graph_mode': 'off', 'use_snp_selection': False}. Best is trial 91 with value: 0.055760875437285855.
[I 2025-12-05 15:35:19,479] Trial 99 finished with value: 0.015757492228314074 and parameters: {'model_type': 'mlp', 'hidden_dims': '[128, 64]', 'dropout': 0.45502373206456537, 'batch_norm': False, 'lr': 3.454787695789019e-06, 'weight_decay': 2.792975145724474e-06, 'epochs': 158, 'loss': 'mae', 'optimizer': 'adam', 'graph_mode': 'off', 'use_snp_selection': True, 'num_snps': 28747}. Best is trial 91 with value: 0.055760875437285855.
[I 2025-12-05 15:35:21,099] Trial 100 finished with value: -0.0038705070281713863 and parameters: {'model_type': 'mlp', 'hidden_dims': '[128, 64]', 'dropout': 0.4037457149465467, 'batch_norm': True, 'lr': 4.339182866468289e-06, 'weight_decay': 3.281573650531544e-06, 'epochs': 138, 'loss': 'mae', 'optimizer': 'adam', 'graph_mode': 'off', 'use_snp_selection': True, 'num_snps': 24878}. Best is trial 91 with value: 0.055760875437285855.
[I 2025-12-05 15:35:22,774] Trial 101 finished with value: -0.0166215971508827 and parameters: {'model_type': 'mlp', 'hidden_dims': '[128, 64]', 'dropout': 0.4673266865815111, 'batch_norm': False, 'lr': 1.3162798501411652e-06, 'weight_decay': 2.387027563281472e-07, 'epochs': 170, 'loss': 'mae', 'optimizer': 'adam', 'graph_mode': 'off', 'use_snp_selection': True, 'num_snps': 28965}. Best is trial 91 with value: 0.055760875437285855.
[I 2025-12-05 15:35:24,193] Trial 102 finished with value: 0.004559702883338232 and parameters: {'model_type': 'mlp', 'hidden_dims': '[128, 64]', 'dropout': 0.4789512314987719, 'batch_norm': False, 'lr': 2.2836215087508885e-06, 'weight_decay': 6.374417699735986e-06, 'epochs': 143, 'loss': 'mae', 'optimizer': 'adam', 'graph_mode': 'off', 'use_snp_selection': True, 'num_snps': 22392}. Best is trial 91 with value: 0.055760875437285855.
[I 2025-12-05 15:35:25,914] Trial 103 finished with value: -0.005801603818405867 and parameters: {'model_type': 'mlp', 'hidden_dims': '[128, 64]', 'dropout': 0.49927741525032754, 'batch_norm': False, 'lr': 1.6078731077380813e-06, 'weight_decay': 4.239768915827421e-06, 'epochs': 157, 'loss': 'mae', 'optimizer': 'adam', 'graph_mode': 'off', 'use_snp_selection': True, 'num_snps': 32976}. Best is trial 91 with value: 0.055760875437285855.
[I 2025-12-05 15:35:27,503] Trial 104 finished with value: -0.0012660834394781094 and parameters: {'model_type': 'mlp', 'hidden_dims': '[128, 64]', 'dropout': 0.5352378012888244, 'batch_norm': False, 'lr': 3.281450716295565e-06, 'weight_decay': 1.9373793558343317e-06, 'epochs': 124, 'loss': 'mae', 'optimizer': 'adam', 'graph_mode': 'off', 'use_snp_selection': True, 'num_snps': 24754}. Best is trial 91 with value: 0.055760875437285855.
[I 2025-12-05 15:35:29,117] Trial 105 finished with value: 0.01830673171026034 and parameters: {'model_type': 'mlp', 'hidden_dims': '[128, 64]', 'dropout': 0.11295115439788234, 'batch_norm': False, 'lr': 5.769988248124764e-06, 'weight_decay': 9.117772718054826e-06, 'epochs': 118, 'loss': 'mae', 'optimizer': 'adam', 'graph_mode': 'off', 'use_snp_selection': True, 'num_snps': 27254}. Best is trial 91 with value: 0.055760875437285855.
[I 2025-12-05 15:35:30,442] Trial 106 finished with value: -0.008298046070465097 and parameters: {'model_type': 'mlp', 'hidden_dims': '[128, 64]', 'dropout': 0.5054211810110456, 'batch_norm': False, 'lr': 2.7663527090172826e-06, 'weight_decay': 5.654847601947623e-05, 'epochs': 110, 'loss': 'mae', 'optimizer': 'adam', 'graph_mode': 'off', 'use_snp_selection': True, 'num_snps': 19942}. Best is trial 91 with value: 0.055760875437285855.
[I 2025-12-05 15:35:32,034] Trial 107 finished with value: 0.0036814047066024962 and parameters: {'model_type': 'mlp', 'hidden_dims': '[128, 64]', 'dropout': 0.4376388421772186, 'batch_norm': False, 'lr': 1.9259316281457977e-06, 'weight_decay': 5.344292123519874e-06, 'epochs': 131, 'loss': 'mae', 'optimizer': 'adam', 'graph_mode': 'off', 'use_snp_selection': True, 'num_snps': 29868}. Best is trial 91 with value: 0.055760875437285855.
[I 2025-12-05 15:35:32,763] Trial 108 finished with value: 0.006651177463229466 and parameters: {'model_type': 'mlp', 'hidden_dims': '[128, 64]', 'dropout': 0.5583508112721414, 'batch_norm': False, 'lr': 1.1560477303905645e-06, 'weight_decay': 5.16361767910305e-07, 'epochs': 139, 'loss': 'mae', 'optimizer': 'adam', 'graph_mode': 'off', 'use_snp_selection': False}. Best is trial 91 with value: 0.055760875437285855.
[I 2025-12-05 15:35:34,226] Trial 109 finished with value: 0.0012974765324795861 and parameters: {'model_type': 'mlp', 'hidden_dims': '[128, 64]', 'dropout': 0.5260401645910575, 'batch_norm': False, 'lr': 2.37816938021737e-06, 'weight_decay': 3.6201058209584985e-06, 'epochs': 97, 'loss': 'mae', 'optimizer': 'adam', 'graph_mode': 'off', 'use_snp_selection': True, 'num_snps': 23290}. Best is trial 91 with value: 0.055760875437285855.
[I 2025-12-05 15:35:35,618] Trial 110 finished with value: -0.023652645827995502 and parameters: {'model_type': 'mlp', 'hidden_dims': '[256, 128, 64]', 'dropout': 0.5823924831089253, 'batch_norm': False, 'lr': 1.6664231215338226e-06, 'weight_decay': 1.3125507379884239e-05, 'epochs': 149, 'loss': 'mae', 'optimizer': 'adam', 'graph_mode': 'off', 'use_snp_selection': True, 'num_snps': 16755}. Best is trial 91 with value: 0.055760875437285855.
[I 2025-12-05 15:35:37,042] Trial 111 finished with value: -0.00046420561890952696 and parameters: {'model_type': 'mlp', 'hidden_dims': '[512, 64]', 'dropout': 0.5179487257286882, 'batch_norm': False, 'lr': 3.903731702916258e-06, 'weight_decay': 1.365537524642388e-06, 'epochs': 76, 'loss': 'mae', 'optimizer': 'adam', 'graph_mode': 'off', 'use_snp_selection': True, 'num_snps': 21256}. Best is trial 91 with value: 0.055760875437285855.
[I 2025-12-05 15:35:38,106] Trial 112 finished with value: 0.002212941026309484 and parameters: {'model_type': 'mlp', 'hidden_dims': '[128, 64]', 'dropout': 0.48236227043830393, 'batch_norm': False, 'lr': 2.1724034020378785e-06, 'weight_decay': 1.1000255552527566e-06, 'epochs': 67, 'loss': 'mae', 'optimizer': 'adam', 'graph_mode': 'off', 'use_snp_selection': True, 'num_snps': 12800}. Best is trial 91 with value: 0.055760875437285855.
[I 2025-12-05 15:35:39,748] Trial 113 finished with value: 0.005160930471316821 and parameters: {'model_type': 'mlp', 'hidden_dims': '[512, 64]', 'dropout': 0.510890895392554, 'batch_norm': False, 'lr': 1.417123103422807e-06, 'weight_decay': 2.653548785697274e-06, 'epochs': 88, 'loss': 'mae', 'optimizer': 'adam', 'graph_mode': 'off', 'use_snp_selection': True, 'num_snps': 27173}. Best is trial 91 with value: 0.055760875437285855.
[I 2025-12-05 15:35:40,779] Trial 114 finished with value: -0.03078607274739684 and parameters: {'model_type': 'mlp', 'hidden_dims': '[128, 64]', 'dropout': 0.4884980062422025, 'batch_norm': False, 'lr': 2.9688847996001594e-06, 'weight_decay': 2.2231897002428618e-06, 'epochs': 106, 'loss': 'mae', 'optimizer': 'adam', 'graph_mode': 'off', 'use_snp_selection': True, 'num_snps': 9848}. Best is trial 91 with value: 0.055760875437285855.
[I 2025-12-05 15:35:42,486] Trial 115 finished with value: -0.04300270404728843 and parameters: {'model_type': 'mlp', 'hidden_dims': '[512, 64]', 'dropout': 0.5978130265927454, 'batch_norm': False, 'lr': 1.8671891291828693e-06, 'weight_decay': 2.9760891384844147e-06, 'epochs': 80, 'loss': 'mae', 'optimizer': 'adam', 'graph_mode': 'off', 'use_snp_selection': True, 'num_snps': 26257}. Best is trial 91 with value: 0.055760875437285855.
