[I 2025-12-05 14:51:07,420] Trial 25 finished with value: 0.12588360053599368 and parameters: {'model_type': 'mlp', 'hidden_dims': '[512, 64]', 'dropout': 0.24597976199458615, 'batch_norm': True, 'lr': 0.00011215275422176257, 'weight_decay': 5.470041242711598e-06, 'epochs': 183, 'loss': 'mse', 'optimizer': 'adam', 'graph_mode': 'off', 'use_snp_selection': False}. Best is trial 21 with value: 0.14689517948224912.
[I 2025-12-05 14:51:08,366] Trial 26 finished with value: 0.11329371709188513 and parameters: {'model_type': 'mlp', 'hidden_dims': '[512, 64]', 'dropout': 0.19050734863233265, 'batch_norm': True, 'lr': 0.0004476448773153009, 'weight_decay': 2.250921613147251e-07, 'epochs': 127, 'loss': 'mse', 'optimizer': 'adam', 'graph_mode': 'off', 'use_snp_selection': True, 'num_snps': 3842}. Best is trial 21 with value: 0.14689517948224912.
[I 2025-12-05 14:51:10,087] Trial 27 finished with value: 0.1337450412688971 and parameters: {'model_type': 'mlp', 'hidden_dims': '[512, 64]', 'dropout': 0.2391340306990172, 'batch_norm': False, 'lr': 8.575390282733358e-05, 'weight_decay': 8.233418287422098e-07, 'epochs': 199, 'loss': 'mse', 'optimizer': 'adam', 'graph_mode': 'off', 'use_snp_selection': False}. Best is trial 21 with value: 0.14689517948224912.
[I 2025-12-05 14:51:12,231] Trial 28 finished with value: 0.13774360970183602 and parameters: {'model_type': 'mlp', 'hidden_dims': '[512, 64]', 'dropout': 0.13498724060077172, 'batch_norm': True, 'lr': 0.0009594218427351577, 'weight_decay': 2.7273940256921087e-06, 'epochs': 294, 'loss': 'mse', 'optimizer': 'adam', 'graph_mode': 'off', 'use_snp_selection': False}. Best is trial 21 with value: 0.14689517948224912.
[I 2025-12-05 14:51:13,772] Trial 29 finished with value: 0.12307018954860899 and parameters: {'model_type': 'mlp', 'hidden_dims': '[128, 64]', 'dropout': 0.19152601877174444, 'batch_norm': True, 'lr': 3.678548482609573e-05, 'weight_decay': 1.848205533231039e-07, 'epochs': 215, 'loss': 'mse', 'optimizer': 'adam', 'graph_mode': 'off', 'use_snp_selection': True, 'num_snps': 19468}. Best is trial 21 with value: 0.14689517948224912.
[I 2025-12-05 14:51:14,892] Trial 30 finished with value: 0.1263593070023351 and parameters: {'model_type': 'mlp', 'hidden_dims': '[256, 128]', 'dropout': 0.29089839959866887, 'batch_norm': True, 'lr': 0.0001787155823809422, 'weight_decay': 4.414122133384597e-05, 'epochs': 174, 'loss': 'mse', 'optimizer': 'adam', 'graph_mode': 'off', 'use_snp_selection': False}. Best is trial 21 with value: 0.14689517948224912.
[I 2025-12-05 14:51:16,813] Trial 31 finished with value: 0.13458598757080112 and parameters: {'model_type': 'mlp', 'hidden_dims': '[512, 64]', 'dropout': 0.16563555524126178, 'batch_norm': True, 'lr': 0.00011773465257145794, 'weight_decay': 9.683311983079399e-07, 'epochs': 240, 'loss': 'mse', 'optimizer': 'adam', 'graph_mode': 'off', 'use_snp_selection': False}. Best is trial 21 with value: 0.14689517948224912.
[I 2025-12-05 14:51:18,776] Trial 32 finished with value: 0.1316467284119091 and parameters: {'model_type': 'mlp', 'hidden_dims': '[512, 64]', 'dropout': 0.1914540354947652, 'batch_norm': True, 'lr': 6.914340621988925e-05, 'weight_decay': 7.861191375713876e-07, 'epochs': 248, 'loss': 'mse', 'optimizer': 'adam', 'graph_mode': 'off', 'use_snp_selection': False}. Best is trial 21 with value: 0.14689517948224912.
[I 2025-12-05 14:51:21,170] Trial 33 finished with value: 0.13394800945938498 and parameters: {'model_type': 'mlp', 'hidden_dims': '[512, 64]', 'dropout': 0.13710055438841184, 'batch_norm': True, 'lr': 0.0002611037014841862, 'weight_decay': 9.676196413933473e-06, 'epochs': 344, 'loss': 'mse', 'optimizer': 'adam', 'graph_mode': 'off', 'use_snp_selection': False}. Best is trial 21 with value: 0.14689517948224912.
[I 2025-12-05 14:51:23,063] Trial 34 finished with value: 0.12839706258532588 and parameters: {'model_type': 'mlp', 'hidden_dims': '[512, 256]', 'dropout': 0.23728382615559773, 'batch_norm': True, 'lr': 9.077102080020397e-05, 'weight_decay': 1.5122179468002875e-06, 'epochs': 235, 'loss': 'mae', 'optimizer': 'adam', 'graph_mode': 'off', 'use_snp_selection': False}. Best is trial 21 with value: 0.14689517948224912.
[I 2025-12-05 14:51:24,886] Trial 35 finished with value: 0.11198452275274157 and parameters: {'model_type': 'mlp', 'hidden_dims': '[512, 64]', 'dropout': 0.21198281352849183, 'batch_norm': False, 'lr': 5.405403098697391e-05, 'weight_decay': 2.4476706724970276e-07, 'epochs': 221, 'loss': 'mse', 'optimizer': 'adam', 'graph_mode': 'off', 'use_snp_selection': False}. Best is trial 21 with value: 0.14689517948224912.
[I 2025-12-05 14:51:27,498] Trial 36 finished with value: 0.10195390286897262 and parameters: {'model_type': 'mlp', 'hidden_dims': '[128, 64]', 'dropout': 0.1290696418025067, 'batch_norm': True, 'lr': 2.8050869020116803e-05, 'weight_decay': 8.34096261876928e-06, 'epochs': 197, 'loss': 'mse', 'optimizer': 'adam', 'graph_mode': 'off', 'use_snp_selection': True, 'num_snps': 58661}. Best is trial 21 with value: 0.14689517948224912.
[I 2025-12-05 14:51:28,642] Trial 37 finished with value: 0.04036217272436276 and parameters: {'model_type': 'mlp', 'hidden_dims': '[256, 128]', 'dropout': 0.2689792845951112, 'batch_norm': True, 'lr': 4.446294938689996e-06, 'weight_decay': 7.559740396328149e-07, 'epochs': 157, 'loss': 'mae', 'optimizer': 'adam', 'graph_mode': 'off', 'use_snp_selection': False}. Best is trial 21 with value: 0.14689517948224912.
[I 2025-12-05 14:51:30,305] Trial 38 finished with value: 0.12860746582519184 and parameters: {'model_type': 'mlp', 'hidden_dims': '[512, 64]', 'dropout': 0.17896513512272874, 'batch_norm': False, 'lr': 0.00015932169225696098, 'weight_decay': 2.7423232367141614e-06, 'epochs': 267, 'loss': 'mse', 'optimizer': 'adam', 'graph_mode': 'off', 'use_snp_selection': True, 'num_snps': 19911}. Best is trial 21 with value: 0.14689517948224912.
[I 2025-12-05 14:51:32,482] Trial 39 finished with value: 0.1329339064114701 and parameters: {'model_type': 'mlp', 'hidden_dims': '[512, 64]', 'dropout': 0.3727249260507418, 'batch_norm': True, 'lr': 0.00036125177884362684, 'weight_decay': 4.1496219479791416e-07, 'epochs': 298, 'loss': 'mse', 'optimizer': 'adam', 'graph_mode': 'off', 'use_snp_selection': False}. Best is trial 21 with value: 0.14689517948224912.
[I 2025-12-05 14:51:34,135] Trial 40 finished with value: 0.10951913825175881 and parameters: {'model_type': 'mlp', 'hidden_dims': '[512, 64]', 'dropout': 0.3444940294509404, 'batch_norm': True, 'lr': 4.9989851979654414e-05, 'weight_decay': 1.5166296373251197e-06, 'epochs': 191, 'loss': 'mae', 'optimizer': 'adam', 'graph_mode': 'off', 'use_snp_selection': False}. Best is trial 21 with value: 0.14689517948224912.
[I 2025-12-05 14:51:36,322] Trial 41 finished with value: 0.056282796392380034 and parameters: {'model_type': 'mlp', 'hidden_dims': '[512, 64]', 'dropout': 0.13851942844625506, 'batch_norm': True, 'lr': 2.320370617557869e-06, 'weight_decay': 2.6547006755559354e-06, 'epochs': 295, 'loss': 'mse', 'optimizer': 'adam', 'graph_mode': 'off', 'use_snp_selection': False}. Best is trial 21 with value: 0.14689517948224912.
[I 2025-12-05 14:51:38,578] Trial 42 finished with value: 0.13499909929653905 and parameters: {'model_type': 'mlp', 'hidden_dims': '[512, 64]', 'dropout': 0.12803612111626791, 'batch_norm': True, 'lr': 0.0007824248368399207, 'weight_decay': 2.0684259913696777e-06, 'epochs': 313, 'loss': 'mse', 'optimizer': 'adam', 'graph_mode': 'off', 'use_snp_selection': False}. Best is trial 21 with value: 0.14689517948224912.
[I 2025-12-05 14:51:40,887] Trial 43 finished with value: 0.12846463228028274 and parameters: {'model_type': 'mlp', 'hidden_dims': '[512, 64]', 'dropout': 0.16800717699341186, 'batch_norm': True, 'lr': 7.767660001728982e-05, 'weight_decay': 1.1862468549066182e-06, 'epochs': 328, 'loss': 'mse', 'optimizer': 'adam', 'graph_mode': 'off', 'use_snp_selection': False}. Best is trial 21 with value: 0.14689517948224912.
[I 2025-12-05 14:51:42,865] Trial 44 finished with value: 0.13030031712099813 and parameters: {'model_type': 'mlp', 'hidden_dims': '[512, 64]', 'dropout': 0.11785061460338615, 'batch_norm': True, 'lr': 0.0001341084005845303, 'weight_decay': 3.6061341460057226e-06, 'epochs': 251, 'loss': 'mse', 'optimizer': 'adam', 'graph_mode': 'off', 'use_snp_selection': False}. Best is trial 21 with value: 0.14689517948224912.
[I 2025-12-05 14:51:44,296] Trial 45 finished with value: 0.14826626548093985 and parameters: {'model_type': 'mlp', 'hidden_dims': '[512, 128]', 'dropout': 0.21836294679980364, 'batch_norm': True, 'lr': 0.0002300226355390722, 'weight_decay': 7.451293089596422e-06, 'epochs': 133, 'loss': 'mse', 'optimizer': 'adam', 'graph_mode': 'off', 'use_snp_selection': False}. Best is trial 45 with value: 0.14826626548093985.
[I 2025-12-05 14:51:45,715] Trial 46 finished with value: 0.09625513033165974 and parameters: {'model_type': 'mlp', 'hidden_dims': '[512, 128]', 'dropout': 0.22043524619427216, 'batch_norm': False, 'lr': 0.0002472880621801194, 'weight_decay': 6.59207793758764e-05, 'epochs': 135, 'loss': 'mse', 'optimizer': 'adam', 'graph_mode': 'off', 'use_snp_selection': False}. Best is trial 45 with value: 0.14826626548093985.
[I 2025-12-05 14:51:46,933] Trial 47 finished with value: 0.1381105731582787 and parameters: {'model_type': 'mlp', 'hidden_dims': '[512, 128]', 'dropout': 0.2577310256444136, 'batch_norm': True, 'lr': 0.00023206619868927175, 'weight_decay': 0.00010696364667213752, 'epochs': 88, 'loss': 'mae', 'optimizer': 'adam', 'graph_mode': 'off', 'use_snp_selection': False}. Best is trial 45 with value: 0.14826626548093985.
[I 2025-12-05 14:51:48,029] Trial 48 finished with value: 0.13278205240344845 and parameters: {'model_type': 'mlp', 'hidden_dims': '[512, 128]', 'dropout': 0.28205934362327884, 'batch_norm': True, 'lr': 0.0003387666410409083, 'weight_decay': 0.00028685936123443016, 'epochs': 71, 'loss': 'mae', 'optimizer': 'adam', 'graph_mode': 'off', 'use_snp_selection': False}. Best is trial 45 with value: 0.14826626548093985.
[I 2025-12-05 14:51:50,527] Trial 49 finished with value: 0.13434449197061746 and parameters: {'model_type': 'mlp', 'hidden_dims': '[512, 128]', 'dropout': 0.23721840105394212, 'batch_norm': True, 'lr': 0.0002311350654035873, 'weight_decay': 0.0005066159281116349, 'epochs': 105, 'loss': 'mae', 'optimizer': 'adam', 'graph_mode': 'off', 'use_snp_selection': True, 'num_snps': 46888}. Best is trial 45 with value: 0.14826626548093985.
[I 2025-12-05 14:51:51,732] Trial 50 finished with value: 0.11175164298026503 and parameters: {'model_type': 'mlp', 'hidden_dims': '[512, 128]', 'dropout': 0.2617438768884857, 'batch_norm': True, 'lr': 0.0005074336766098006, 'weight_decay': 1.975453923099614e-05, 'epochs': 65, 'loss': 'mae', 'optimizer': 'adam', 'graph_mode': 'off', 'use_snp_selection': False}. Best is trial 45 with value: 0.14826626548093985.
[I 2025-12-05 14:51:53,188] Trial 51 finished with value: 0.12854723735454138 and parameters: {'model_type': 'mlp', 'hidden_dims': '[512, 128]', 'dropout': 0.2056329538046447, 'batch_norm': True, 'lr': 9.948504497577483e-05, 'weight_decay': 1.2784195859408097e-05, 'epochs': 141, 'loss': 'mae', 'optimizer': 'adam', 'graph_mode': 'off', 'use_snp_selection': False}. Best is trial 45 with value: 0.14826626548093985.
[I 2025-12-05 14:51:54,726] Trial 52 finished with value: 0.112454839542579 and parameters: {'model_type': 'mlp', 'hidden_dims': '[512, 128]', 'dropout': 0.15491643641778122, 'batch_norm': True, 'lr': 0.00015566045464102845, 'weight_decay': 0.00015708254017785187, 'epochs': 159, 'loss': 'mae', 'optimizer': 'adam', 'graph_mode': 'off', 'use_snp_selection': False}. Best is trial 45 with value: 0.14826626548093985.
[I 2025-12-05 14:51:55,871] Trial 53 finished with value: 0.13496762854400438 and parameters: {'model_type': 'mlp', 'hidden_dims': '[512, 256]', 'dropout': 0.31308245610708046, 'batch_norm': True, 'lr': 6.553556316229296e-05, 'weight_decay': 3.551858453394809e-05, 'epochs': 81, 'loss': 'mse', 'optimizer': 'adam', 'graph_mode': 'off', 'use_snp_selection': False}. Best is trial 45 with value: 0.14826626548093985.
[I 2025-12-05 14:51:57,133] Trial 54 finished with value: 0.11606155223586434 and parameters: {'model_type': 'mlp', 'hidden_dims': '[512, 128]', 'dropout': 0.43743617279638136, 'batch_norm': True, 'lr': 0.00021650538116349644, 'weight_decay': 3.2030574560172126e-07, 'epochs': 109, 'loss': 'mse', 'optimizer': 'adam', 'graph_mode': 'off', 'use_snp_selection': False}. Best is trial 45 with value: 0.14826626548093985.
[I 2025-12-05 14:51:57,914] Trial 55 finished with value: 0.12817243260578548 and parameters: {'model_type': 'mlp', 'hidden_dims': '[256, 128]', 'dropout': 0.22788560427257867, 'batch_norm': True, 'lr': 4.731669211116425e-05, 'weight_decay': 7.224728742074552e-06, 'epochs': 42, 'loss': 'mae', 'optimizer': 'adam', 'graph_mode': 'off', 'use_snp_selection': False}. Best is trial 45 with value: 0.14826626548093985.
[I 2025-12-05 14:51:59,689] Trial 56 finished with value: 0.14464531182684498 and parameters: {'model_type': 'mlp', 'hidden_dims': '[512, 128]', 'dropout': 0.2555245988694447, 'batch_norm': True, 'lr': 0.0002994573024367637, 'weight_decay': 8.165243056611965e-05, 'epochs': 208, 'loss': 'mse', 'optimizer': 'adam', 'graph_mode': 'off', 'use_snp_selection': False}. Best is trial 45 with value: 0.14826626548093985.
[I 2025-12-05 14:52:01,260] Trial 57 finished with value: 0.0912902908608903 and parameters: {'model_type': 'mlp', 'hidden_dims': '[512, 128]', 'dropout': 0.25591737306087664, 'batch_norm': False, 'lr': 0.0003781894115624749, 'weight_decay': 0.00012192714283050586, 'epochs': 167, 'loss': 'mse', 'optimizer': 'adam', 'graph_mode': 'off', 'use_snp_selection': False}. Best is trial 45 with value: 0.14826626548093985.
[I 2025-12-05 14:52:03,095] Trial 58 finished with value: 0.1418776273661396 and parameters: {'model_type': 'mlp', 'hidden_dims': '[512, 128]', 'dropout': 0.28939367417005285, 'batch_norm': True, 'lr': 0.00014226080036320825, 'weight_decay': 8.693081100842416e-05, 'epochs': 228, 'loss': 'mse', 'optimizer': 'adam', 'graph_mode': 'off', 'use_snp_selection': False}. Best is trial 45 with value: 0.14826626548093985.
[I 2025-12-05 14:52:04,916] Trial 59 finished with value: 0.10706067568949801 and parameters: {'model_type': 'mlp', 'hidden_dims': '[512, 128]', 'dropout': 0.5631379366831802, 'batch_norm': True, 'lr': 0.00029105329880206306, 'weight_decay': 2.6003867781134824e-05, 'epochs': 228, 'loss': 'mse', 'optimizer': 'adam', 'graph_mode': 'off', 'use_snp_selection': False}. Best is trial 45 with value: 0.14826626548093985.
[I 2025-12-05 14:52:06,103] Trial 60 finished with value: 0.12162671799208365 and parameters: {'model_type': 'mlp', 'hidden_dims': '[256, 128, 64]', 'dropout': 0.3009190980052974, 'batch_norm': True, 'lr': 0.00013101939018917214, 'weight_decay': 9.761823028561249e-05, 'epochs': 207, 'loss': 'mse', 'optimizer': 'adam', 'graph_mode': 'off', 'use_snp_selection': False}. Best is trial 45 with value: 0.14826626548093985.
[I 2025-12-05 14:52:07,701] Trial 61 finished with value: 0.1441376189957095 and parameters: {'model_type': 'mlp', 'hidden_dims': '[512, 128]', 'dropout': 0.2582032945677239, 'batch_norm': True, 'lr': 0.0001844613701515763, 'weight_decay': 0.00017458874677733237, 'epochs': 180, 'loss': 'mse', 'optimizer': 'adam', 'graph_mode': 'off', 'use_snp_selection': False}. Best is trial 45 with value: 0.14826626548093985.
[I 2025-12-05 14:52:09,316] Trial 62 finished with value: 0.13763263650001495 and parameters: {'model_type': 'mlp', 'hidden_dims': '[512, 128]', 'dropout': 0.2786418921402196, 'batch_norm': True, 'lr': 0.00014404516740916998, 'weight_decay': 0.0005535618087153959, 'epochs': 184, 'loss': 'mse', 'optimizer': 'adam', 'graph_mode': 'off', 'use_snp_selection': False}. Best is trial 45 with value: 0.14826626548093985.
[I 2025-12-05 14:52:11,044] Trial 63 finished with value: 0.12738034304545687 and parameters: {'model_type': 'mlp', 'hidden_dims': '[512, 128]', 'dropout': 0.32877519413157674, 'batch_norm': True, 'lr': 0.00019265254970780708, 'weight_decay': 0.00018123550949150305, 'epochs': 206, 'loss': 'mse', 'optimizer': 'adam', 'graph_mode': 'off', 'use_snp_selection': False}. Best is trial 45 with value: 0.14826626548093985.
[I 2025-12-05 14:52:11,954] Trial 64 finished with value: 0.12110938537261053 and parameters: {'model_type': 'mlp', 'hidden_dims': '[128, 64]', 'dropout': 0.20141482358076357, 'batch_norm': True, 'lr': 7.624974799583573e-05, 'weight_decay': 6.893301499085288e-05, 'epochs': 227, 'loss': 'mse', 'optimizer': 'adam', 'graph_mode': 'off', 'use_snp_selection': False}. Best is trial 45 with value: 0.14826626548093985.
[I 2025-12-05 14:52:13,600] Trial 65 finished with value: 0.12501746869549357 and parameters: {'model_type': 'mlp', 'hidden_dims': '[512, 128]', 'dropout': 0.1828427411957626, 'batch_norm': True, 'lr': 0.0005947644998051423, 'weight_decay': 0.0009426665169768911, 'epochs': 191, 'loss': 'mse', 'optimizer': 'adam', 'graph_mode': 'off', 'use_snp_selection': False}. Best is trial 45 with value: 0.14826626548093985.
[I 2025-12-05 14:52:15,169] Trial 66 finished with value: 0.13882355123583437 and parameters: {'model_type': 'mlp', 'hidden_dims': '[512, 128]', 'dropout': 0.2269612282459998, 'batch_norm': True, 'lr': 9.306349043586184e-05, 'weight_decay': 0.0002212474130539359, 'epochs': 150, 'loss': 'mse', 'optimizer': 'adam', 'graph_mode': 'off', 'use_snp_selection': True, 'num_snps': 22881}. Best is trial 45 with value: 0.14826626548093985.
[I 2025-12-05 14:52:16,746] Trial 67 finished with value: 0.019152474341479438 and parameters: {'model_type': 'mlp', 'hidden_dims': '[512, 256]', 'dropout': 0.24917583129911117, 'batch_norm': True, 'lr': 1.038788092140181e-06, 'weight_decay': 0.0003665197405892897, 'epochs': 174, 'loss': 'mse', 'optimizer': 'adam', 'graph_mode': 'off', 'use_snp_selection': False}. Best is trial 45 with value: 0.14826626548093985.
[I 2025-12-05 14:52:18,458] Trial 68 finished with value: 0.1408920000986282 and parameters: {'model_type': 'mlp', 'hidden_dims': '[512, 128]', 'dropout': 0.2904285594269427, 'batch_norm': True, 'lr': 0.00043523651297858987, 'weight_decay': 6.161316043604026e-07, 'epochs': 205, 'loss': 'mse', 'optimizer': 'adam', 'graph_mode': 'off', 'use_snp_selection': False}. Best is trial 45 with value: 0.14826626548093985.
[I 2025-12-05 14:52:20,192] Trial 69 finished with value: 0.12604021785231848 and parameters: {'model_type': 'mlp', 'hidden_dims': '[512, 128]', 'dropout': 0.31946095607612834, 'batch_norm': True, 'lr': 0.0007102748812046513, 'weight_decay': 4.0397264089390675e-05, 'epochs': 208, 'loss': 'mse', 'optimizer': 'adam', 'graph_mode': 'off', 'use_snp_selection': False}. Best is trial 45 with value: 0.14826626548093985.
[I 2025-12-05 14:52:21,967] Trial 70 finished with value: 0.1120494673615175 and parameters: {'model_type': 'mlp', 'hidden_dims': '[512, 128]', 'dropout': 0.2946584756853117, 'batch_norm': False, 'lr': 0.00043650378998940357, 'weight_decay': 5.518728095303784e-07, 'epochs': 219, 'loss': 'mse', 'optimizer': 'adam', 'graph_mode': 'off', 'use_snp_selection': False}. Best is trial 45 with value: 0.14826626548093985.
[I 2025-12-05 14:52:23,914] Trial 71 finished with value: 0.13916618629827765 and parameters: {'model_type': 'mlp', 'hidden_dims': '[512, 128]', 'dropout': 0.36281003565033054, 'batch_norm': True, 'lr': 0.00019356936756787332, 'weight_decay': 1.8465924516948767e-07, 'epochs': 247, 'loss': 'mse', 'optimizer': 'adam', 'graph_mode': 'off', 'use_snp_selection': False}. Best is trial 45 with value: 0.14826626548093985.
[I 2025-12-05 14:52:25,029] Trial 72 finished with value: 0.12975946041867698 and parameters: {'model_type': 'mlp', 'hidden_dims': '[256, 128, 64]', 'dropout': 0.2715290881781311, 'batch_norm': True, 'lr': 0.00028904520552868064, 'weight_decay': 5.528387614332506e-07, 'epochs': 185, 'loss': 'mse', 'optimizer': 'adam', 'graph_mode': 'off', 'use_snp_selection': False}. Best is trial 45 with value: 0.14826626548093985.
[I 2025-12-05 14:52:26,714] Trial 73 finished with value: 0.12451979317954774 and parameters: {'model_type': 'mlp', 'hidden_dims': '[512, 128]', 'dropout': 0.24532673486678047, 'batch_norm': True, 'lr': 3.637870583775207e-05, 'weight_decay': 3.672125846789971e-07, 'epochs': 199, 'loss': 'mse', 'optimizer': 'adam', 'graph_mode': 'off', 'use_snp_selection': False}. Best is trial 45 with value: 0.14826626548093985.
[I 2025-12-05 14:52:27,822] Trial 74 finished with value: 0.13009109207325348 and parameters: {'model_type': 'mlp', 'hidden_dims': '[256, 128]', 'dropout': 0.2833654916884716, 'batch_norm': True, 'lr': 5.8706851915144904e-05, 'weight_decay': 6.440176991496181e-07, 'epochs': 166, 'loss': 'mse', 'optimizer': 'adam', 'graph_mode': 'off', 'use_snp_selection': False}. Best is trial 45 with value: 0.14826626548093985.
[I 2025-12-05 14:52:28,730] Trial 75 finished with value: 0.1262707826704588 and parameters: {'model_type': 'mlp', 'hidden_dims': '[128, 64]', 'dropout': 0.34096359240435214, 'batch_norm': True, 'lr': 0.0004178695948340391, 'weight_decay': 1.1882455793034792e-06, 'epochs': 225, 'loss': 'mse', 'optimizer': 'adam', 'graph_mode': 'off', 'use_snp_selection': False}. Best is trial 45 with value: 0.14826626548093985.
[I 2025-12-05 14:52:30,475] Trial 76 finished with value: 0.13075913832160677 and parameters: {'model_type': 'mlp', 'hidden_dims': '[512, 128]', 'dropout': 0.4044981080633146, 'batch_norm': True, 'lr': 0.0003101576565622297, 'weight_decay': 1.4470958877014452e-05, 'epochs': 212, 'loss': 'mse', 'optimizer': 'adam', 'graph_mode': 'off', 'use_snp_selection': False}. Best is trial 45 with value: 0.14826626548093985.
