[I 2025-12-05 14:30:00,466] Trial 105 finished with value: 0.10652006061411443 and parameters: {'model_type': 'mlp', 'hidden_dims': '[512, 64]', 'dropout': 0.33879721751643577, 'batch_norm': False, 'lr': 0.00010287733160441608, 'weight_decay': 2.1443434795228004e-05, 'epochs': 260, 'loss': 'mae', 'optimizer': 'adam', 'graph_mode': 'off', 'use_snp_selection': False}. Best is trial 32 with value: 0.1302124254881053.
[I 2025-12-05 14:30:01,742] Trial 106 finished with value: 0.11483112494327867 and parameters: {'model_type': 'mlp', 'hidden_dims': '[256, 128, 64]', 'dropout': 0.19156218463755334, 'batch_norm': False, 'lr': 5.9048396464779356e-05, 'weight_decay': 1.1263861952172917e-05, 'epochs': 219, 'loss': 'mse', 'optimizer': 'adam', 'graph_mode': 'off', 'use_snp_selection': False}. Best is trial 32 with value: 0.1302124254881053.
[I 2025-12-05 14:30:02,884] Trial 107 finished with value: 0.10681754955179762 and parameters: {'model_type': 'mlp', 'hidden_dims': '[256, 128]', 'dropout': 0.24911151118537728, 'batch_norm': True, 'lr': 0.0001901040557139965, 'weight_decay': 7.814337251888128e-05, 'epochs': 166, 'loss': 'mae', 'optimizer': 'adam', 'graph_mode': 'off', 'use_snp_selection': False}. Best is trial 32 with value: 0.1302124254881053.
[I 2025-12-05 14:30:03,792] Trial 108 finished with value: 0.10626341317583327 and parameters: {'model_type': 'mlp', 'hidden_dims': '[128, 64]', 'dropout': 0.2706151115773655, 'batch_norm': False, 'lr': 0.0003687770568413159, 'weight_decay': 8.654204668997122e-06, 'epochs': 199, 'loss': 'mae', 'optimizer': 'adam', 'graph_mode': 'off', 'use_snp_selection': False}. Best is trial 32 with value: 0.1302124254881053.
[I 2025-12-05 14:30:05,006] Trial 109 finished with value: 0.11651451626671729 and parameters: {'model_type': 'mlp', 'hidden_dims': '[512, 64]', 'dropout': 0.3296262916551407, 'batch_norm': False, 'lr': 0.00014358650752061304, 'weight_decay': 5.3713208439250064e-05, 'epochs': 255, 'loss': 'mae', 'optimizer': 'adam', 'graph_mode': 'off', 'use_snp_selection': True, 'num_snps': 9738}. Best is trial 32 with value: 0.1302124254881053.
[I 2025-12-05 14:30:06,142] Trial 110 finished with value: 0.07528600880337268 and parameters: {'model_type': 'mlp', 'hidden_dims': '[256, 128, 64]', 'dropout': 0.39234330139002666, 'batch_norm': True, 'lr': 3.6948965166703096e-05, 'weight_decay': 3.001194340903562e-05, 'epochs': 177, 'loss': 'mae', 'optimizer': 'adam', 'graph_mode': 'off', 'use_snp_selection': False}. Best is trial 32 with value: 0.1302124254881053.
[I 2025-12-05 14:30:07,368] Trial 111 finished with value: 0.11878508190376887 and parameters: {'model_type': 'mlp', 'hidden_dims': '[256, 128]', 'dropout': 0.13926734032463722, 'batch_norm': True, 'lr': 0.00011555827000192572, 'weight_decay': 6.503110050232121e-07, 'epochs': 203, 'loss': 'mae', 'optimizer': 'adam', 'graph_mode': 'off', 'use_snp_selection': False}. Best is trial 32 with value: 0.1302124254881053.
[I 2025-12-05 14:30:08,537] Trial 112 finished with value: 0.10563884979885274 and parameters: {'model_type': 'mlp', 'hidden_dims': '[256, 128]', 'dropout': 0.1254324011787207, 'batch_norm': True, 'lr': 8.685460421694673e-05, 'weight_decay': 3.5713882831957194e-07, 'epochs': 193, 'loss': 'mae', 'optimizer': 'adam', 'graph_mode': 'off', 'use_snp_selection': False}. Best is trial 32 with value: 0.1302124254881053.
[I 2025-12-05 14:30:09,783] Trial 113 finished with value: 0.11319074300766621 and parameters: {'model_type': 'mlp', 'hidden_dims': '[256, 128]', 'dropout': 0.13995136955216214, 'batch_norm': True, 'lr': 0.00012490135199300916, 'weight_decay': 1.1567642854797656e-06, 'epochs': 224, 'loss': 'mae', 'optimizer': 'adam', 'graph_mode': 'off', 'use_snp_selection': False}. Best is trial 32 with value: 0.1302124254881053.
[I 2025-12-05 14:30:11,024] Trial 114 finished with value: 0.11734615607222396 and parameters: {'model_type': 'mlp', 'hidden_dims': '[256, 128]', 'dropout': 0.16939019863144586, 'batch_norm': True, 'lr': 0.00017489713536811288, 'weight_decay': 0.00017138854626063118, 'epochs': 209, 'loss': 'mae', 'optimizer': 'adam', 'graph_mode': 'off', 'use_snp_selection': False}. Best is trial 32 with value: 0.1302124254881053.
[I 2025-12-05 14:30:12,321] Trial 115 finished with value: 0.10105879392582268 and parameters: {'model_type': 'mlp', 'hidden_dims': '[256, 128]', 'dropout': 0.1514802990808731, 'batch_norm': True, 'lr': 4.655038913966497e-05, 'weight_decay': 4.857924971093624e-07, 'epochs': 242, 'loss': 'mae', 'optimizer': 'adam', 'graph_mode': 'off', 'use_snp_selection': False}. Best is trial 32 with value: 0.1302124254881053.
[I 2025-12-05 14:30:13,612] Trial 116 finished with value: 0.10882070169242601 and parameters: {'model_type': 'mlp', 'hidden_dims': '[256, 128]', 'dropout': 0.1009494896132338, 'batch_norm': True, 'lr': 6.720524508004054e-05, 'weight_decay': 1.0845912454286256e-07, 'epochs': 231, 'loss': 'mae', 'optimizer': 'adam', 'graph_mode': 'off', 'use_snp_selection': False}. Best is trial 32 with value: 0.1302124254881053.
[I 2025-12-05 14:30:14,759] Trial 117 finished with value: 0.11268683457560463 and parameters: {'model_type': 'mlp', 'hidden_dims': '[256, 128, 64]', 'dropout': 0.40669474705997083, 'batch_norm': False, 'lr': 0.00011150182020387228, 'weight_decay': 0.00010644471473807043, 'epochs': 184, 'loss': 'mae', 'optimizer': 'adam', 'graph_mode': 'off', 'use_snp_selection': False}. Best is trial 32 with value: 0.1302124254881053.
[I 2025-12-05 14:30:15,648] Trial 118 finished with value: 0.11377178996520404 and parameters: {'model_type': 'mlp', 'hidden_dims': '[128, 64]', 'dropout': 0.29310752743739177, 'batch_norm': True, 'lr': 0.00015303030288271876, 'weight_decay': 6.46946324169639e-05, 'epochs': 201, 'loss': 'mae', 'optimizer': 'adam', 'graph_mode': 'off', 'use_snp_selection': False}. Best is trial 32 with value: 0.1302124254881053.
[I 2025-12-05 14:30:17,471] Trial 119 finished with value: 0.09740371912960764 and parameters: {'model_type': 'mlp', 'hidden_dims': '[512, 64]', 'dropout': 0.11953252516188356, 'batch_norm': False, 'lr': 9.645974906384881e-05, 'weight_decay': 3.7874015797198785e-05, 'epochs': 212, 'loss': 'mae', 'optimizer': 'adam', 'graph_mode': 'off', 'use_snp_selection': False}. Best is trial 32 with value: 0.1302124254881053.
[I 2025-12-05 14:30:19,628] Trial 120 finished with value: 0.11097992042895022 and parameters: {'model_type': 'mlp', 'hidden_dims': '[512, 128]', 'dropout': 0.363913122523482, 'batch_norm': True, 'lr': 5.255010487571267e-05, 'weight_decay': 8.903563154610126e-07, 'epochs': 283, 'loss': 'mae', 'optimizer': 'adam', 'graph_mode': 'off', 'use_snp_selection': False}. Best is trial 32 with value: 0.1302124254881053.
[I 2025-12-05 14:30:20,874] Trial 121 finished with value: 0.11709963750322316 and parameters: {'model_type': 'mlp', 'hidden_dims': '[256, 128]', 'dropout': 0.1406202943410668, 'batch_norm': True, 'lr': 0.00011820848772754245, 'weight_decay': 1.621160797078781e-07, 'epochs': 206, 'loss': 'mae', 'optimizer': 'adam', 'graph_mode': 'off', 'use_snp_selection': False}. Best is trial 32 with value: 0.1302124254881053.
[I 2025-12-05 14:30:22,042] Trial 122 finished with value: 0.10700388375115147 and parameters: {'model_type': 'mlp', 'hidden_dims': '[256, 128]', 'dropout': 0.13189681840952736, 'batch_norm': True, 'lr': 0.00028342981255963766, 'weight_decay': 1.6934776313811643e-07, 'epochs': 191, 'loss': 'mae', 'optimizer': 'adam', 'graph_mode': 'off', 'use_snp_selection': False}. Best is trial 32 with value: 0.1302124254881053.
[I 2025-12-05 14:30:23,226] Trial 123 finished with value: 0.12162971360039812 and parameters: {'model_type': 'mlp', 'hidden_dims': '[256, 128]', 'dropout': 0.17836041941567718, 'batch_norm': True, 'lr': 8.2862498705976e-05, 'weight_decay': 3.082268136420168e-07, 'epochs': 201, 'loss': 'mae', 'optimizer': 'adam', 'graph_mode': 'off', 'use_snp_selection': False}. Best is trial 32 with value: 0.1302124254881053.
[I 2025-12-05 14:30:24,472] Trial 124 finished with value: 0.11490366424331766 and parameters: {'model_type': 'mlp', 'hidden_dims': '[256, 128]', 'dropout': 0.11445701890279503, 'batch_norm': True, 'lr': 8.207870471788695e-05, 'weight_decay': 5.889806082541445e-07, 'epochs': 219, 'loss': 'mae', 'optimizer': 'adam', 'graph_mode': 'off', 'use_snp_selection': False}. Best is trial 32 with value: 0.1302124254881053.
[I 2025-12-05 14:30:25,757] Trial 125 finished with value: 0.10195712825802045 and parameters: {'model_type': 'mlp', 'hidden_dims': '[256, 128]', 'dropout': 0.1882903486366896, 'batch_norm': True, 'lr': 5.7346590556120244e-05, 'weight_decay': 2.3466022959206983e-07, 'epochs': 237, 'loss': 'mae', 'optimizer': 'adam', 'graph_mode': 'off', 'use_snp_selection': False}. Best is trial 32 with value: 0.1302124254881053.
[I 2025-12-05 14:30:27,023] Trial 126 finished with value: 0.09920406685665985 and parameters: {'model_type': 'mlp', 'hidden_dims': '[256, 128]', 'dropout': 0.222923435327971, 'batch_norm': False, 'lr': 0.00021388613462624886, 'weight_decay': 0.00013496388295029704, 'epochs': 229, 'loss': 'mse', 'optimizer': 'adam', 'graph_mode': 'off', 'use_snp_selection': False}. Best is trial 32 with value: 0.1302124254881053.
[I 2025-12-05 14:30:29,623] Trial 127 finished with value: 0.10463959719185716 and parameters: {'model_type': 'mlp', 'hidden_dims': '[256, 128, 64]', 'dropout': 0.17658870945179633, 'batch_norm': True, 'lr': 7.256440307531637e-05, 'weight_decay': 3.022062573097216e-07, 'epochs': 201, 'loss': 'mae', 'optimizer': 'adam', 'graph_mode': 'off', 'use_snp_selection': True, 'num_snps': 51295}. Best is trial 32 with value: 0.1302124254881053.
[I 2025-12-05 14:30:31,323] Trial 128 finished with value: 0.1067477484278469 and parameters: {'model_type': 'mlp', 'hidden_dims': '[512, 64]', 'dropout': 0.3791185193775615, 'batch_norm': False, 'lr': 8.546982664143606e-06, 'weight_decay': 0.00020579490224185363, 'epochs': 176, 'loss': 'mae', 'optimizer': 'adam', 'graph_mode': 'off', 'use_snp_selection': False}. Best is trial 32 with value: 0.1302124254881053.
[I 2025-12-05 14:30:33,007] Trial 129 finished with value: 0.10700342571592897 and parameters: {'model_type': 'mlp', 'hidden_dims': '[512, 256]', 'dropout': 0.1593749671043278, 'batch_norm': True, 'lr': 9.735482778543715e-05, 'weight_decay': 1.7304331831085486e-05, 'epochs': 188, 'loss': 'mae', 'optimizer': 'adam', 'graph_mode': 'off', 'use_snp_selection': False}. Best is trial 32 with value: 0.1302124254881053.
[I 2025-12-05 14:30:34,355] Trial 130 finished with value: 0.11055134515249805 and parameters: {'model_type': 'mlp', 'hidden_dims': '[256, 128]', 'dropout': 0.3457742105560999, 'batch_norm': False, 'lr': 0.000159657845619268, 'weight_decay': 2.1473734089222745e-06, 'epochs': 248, 'loss': 'mae', 'optimizer': 'adam', 'graph_mode': 'off', 'use_snp_selection': False}. Best is trial 32 with value: 0.1302124254881053.
[I 2025-12-05 14:30:35,525] Trial 131 finished with value: 0.09451999213433257 and parameters: {'model_type': 'mlp', 'hidden_dims': '[256, 128]', 'dropout': 0.20500591050584022, 'batch_norm': True, 'lr': 0.0001310699166663194, 'weight_decay': 1.4735165762026307e-07, 'epochs': 194, 'loss': 'mae', 'optimizer': 'adam', 'graph_mode': 'off', 'use_snp_selection': False}. Best is trial 32 with value: 0.1302124254881053.
[I 2025-12-05 14:30:36,723] Trial 132 finished with value: 0.1033035216254649 and parameters: {'model_type': 'mlp', 'hidden_dims': '[256, 128]', 'dropout': 0.14499670753742583, 'batch_norm': True, 'lr': 0.00011391636071958884, 'weight_decay': 3.0030543773095347e-07, 'epochs': 202, 'loss': 'mae', 'optimizer': 'adam', 'graph_mode': 'off', 'use_snp_selection': False}. Best is trial 32 with value: 0.1302124254881053.
[I 2025-12-05 14:30:37,996] Trial 133 finished with value: 0.1002354352278016 and parameters: {'model_type': 'mlp', 'hidden_dims': '[256, 128]', 'dropout': 0.3553784731735047, 'batch_norm': True, 'lr': 8.468070802596119e-05, 'weight_decay': 2.3041543058512164e-07, 'epochs': 214, 'loss': 'mae', 'optimizer': 'adam', 'graph_mode': 'off', 'use_snp_selection': False}. Best is trial 32 with value: 0.1302124254881053.
[I 2025-12-05 14:30:39,247] Trial 134 finished with value: 0.10999671606192903 and parameters: {'model_type': 'mlp', 'hidden_dims': '[256, 128]', 'dropout': 0.13288131076443713, 'batch_norm': True, 'lr': 0.00023898377702960753, 'weight_decay': 5.1423593287561446e-05, 'epochs': 225, 'loss': 'mae', 'optimizer': 'adam', 'graph_mode': 'off', 'use_snp_selection': False}. Best is trial 32 with value: 0.1302124254881053.
[I 2025-12-05 14:30:40,138] Trial 135 finished with value: 0.09309744801561798 and parameters: {'model_type': 'mlp', 'hidden_dims': '[128, 64]', 'dropout': 0.15209752443334706, 'batch_norm': True, 'lr': 0.00019305045402305041, 'weight_decay': 9.133889535542614e-05, 'epochs': 205, 'loss': 'mae', 'optimizer': 'adam', 'graph_mode': 'off', 'use_snp_selection': False}. Best is trial 32 with value: 0.1302124254881053.
[I 2025-12-05 14:30:41,525] Trial 136 finished with value: 0.08363097805235109 and parameters: {'model_type': 'mlp', 'hidden_dims': '[256, 128, 64]', 'dropout': 0.45406156314576146, 'batch_norm': False, 'lr': 0.00012759691097125256, 'weight_decay': 0.0002841566834471847, 'epochs': 261, 'loss': 'mae', 'optimizer': 'adam', 'graph_mode': 'off', 'use_snp_selection': False}. Best is trial 32 with value: 0.1302124254881053.
[I 2025-12-05 14:30:43,086] Trial 137 finished with value: 0.09054071155755386 and parameters: {'model_type': 'mlp', 'hidden_dims': '[512, 128]', 'dropout': 0.17234508960755196, 'batch_norm': True, 'lr': 0.00010300142918065434, 'weight_decay': 1.316821174278067e-07, 'epochs': 255, 'loss': 'mae', 'optimizer': 'adam', 'graph_mode': 'off', 'use_snp_selection': True, 'num_snps': 18282}. Best is trial 32 with value: 0.1302124254881053.
[I 2025-12-05 14:30:44,450] Trial 138 finished with value: 0.09832100216905817 and parameters: {'model_type': 'mlp', 'hidden_dims': '[256, 128]', 'dropout': 0.4197436455851622, 'batch_norm': False, 'lr': 6.248903978231716e-05, 'weight_decay': 2.3536535571488343e-07, 'epochs': 271, 'loss': 'mae', 'optimizer': 'adam', 'graph_mode': 'off', 'use_snp_selection': False}. Best is trial 32 with value: 0.1302124254881053.
[I 2025-12-05 14:30:46,297] Trial 139 finished with value: 0.1111929889331343 and parameters: {'model_type': 'mlp', 'hidden_dims': '[512, 64]', 'dropout': 0.31602675124370855, 'batch_norm': True, 'lr': 7.465173696147833e-05, 'weight_decay': 1.9936292997218978e-07, 'epochs': 220, 'loss': 'mae', 'optimizer': 'adam', 'graph_mode': 'off', 'use_snp_selection': False}. Best is trial 32 with value: 0.1302124254881053.
[I 2025-12-05 14:30:47,681] Trial 140 finished with value: 0.12068371757658003 and parameters: {'model_type': 'mlp', 'hidden_dims': '[256, 128, 64]', 'dropout': 0.371901471625181, 'batch_norm': False, 'lr': 0.00031663478496586037, 'weight_decay': 3.3025543627426024e-05, 'epochs': 278, 'loss': 'mae', 'optimizer': 'adam', 'graph_mode': 'off', 'use_snp_selection': False}. Best is trial 32 with value: 0.1302124254881053.
[I 2025-12-05 14:30:49,103] Trial 141 finished with value: 0.09300709327593862 and parameters: {'model_type': 'mlp', 'hidden_dims': '[256, 128, 64]', 'dropout': 0.3680392668374323, 'batch_norm': False, 'lr': 0.00024763458665289737, 'weight_decay': 3.32576221623257e-05, 'epochs': 291, 'loss': 'mae', 'optimizer': 'adam', 'graph_mode': 'off', 'use_snp_selection': False}. Best is trial 32 with value: 0.1302124254881053.
[I 2025-12-05 14:30:50,453] Trial 142 finished with value: 0.061591495486042196 and parameters: {'model_type': 'mlp', 'hidden_dims': '[256, 128, 64]', 'dropout': 0.386661807534383, 'batch_norm': False, 'lr': 0.00037445102164248586, 'weight_decay': 2.452511126730176e-05, 'epochs': 265, 'loss': 'mae', 'optimizer': 'adam', 'graph_mode': 'off', 'use_snp_selection': False}. Best is trial 32 with value: 0.1302124254881053.
[I 2025-12-05 14:30:51,882] Trial 143 finished with value: 0.08614401497806655 and parameters: {'model_type': 'mlp', 'hidden_dims': '[256, 128, 64]', 'dropout': 0.35845161525707003, 'batch_norm': False, 'lr': 0.00045600049076313117, 'weight_decay': 4.334855781340191e-05, 'epochs': 278, 'loss': 'mae', 'optimizer': 'adam', 'graph_mode': 'off', 'use_snp_selection': False}. Best is trial 32 with value: 0.1302124254881053.
[I 2025-12-05 14:30:52,985] Trial 144 finished with value: 0.09307551437881022 and parameters: {'model_type': 'mlp', 'hidden_dims': '[256, 128, 64]', 'dropout': 0.3749575062652085, 'batch_norm': False, 'lr': 0.0006379107721658839, 'weight_decay': 1.9991829479562492e-05, 'epochs': 169, 'loss': 'mae', 'optimizer': 'adam', 'graph_mode': 'off', 'use_snp_selection': False}. Best is trial 32 with value: 0.1302124254881053.
[I 2025-12-05 14:30:54,105] Trial 145 finished with value: 0.11357164410516812 and parameters: {'model_type': 'mlp', 'hidden_dims': '[256, 128]', 'dropout': 0.4006152065809979, 'batch_norm': False, 'lr': 0.0003133695029813976, 'weight_decay': 2.9069341246331474e-05, 'epochs': 182, 'loss': 'mae', 'optimizer': 'adam', 'graph_mode': 'off', 'use_snp_selection': False}. Best is trial 32 with value: 0.1302124254881053.
[I 2025-12-05 14:30:55,302] Trial 146 finished with value: 0.1135742763151282 and parameters: {'model_type': 'mlp', 'hidden_dims': '[256, 128, 64]', 'dropout': 0.11291452827252024, 'batch_norm': False, 'lr': 0.00014367737050485706, 'weight_decay': 7.090790371867164e-05, 'epochs': 196, 'loss': 'mae', 'optimizer': 'adam', 'graph_mode': 'off', 'use_snp_selection': False}. Best is trial 32 with value: 0.1302124254881053.
[I 2025-12-05 14:30:57,215] Trial 147 finished with value: 0.1039118833164283 and parameters: {'model_type': 'mlp', 'hidden_dims': '[512, 64]', 'dropout': 0.3319755834193092, 'batch_norm': True, 'lr': 0.00017509810048936373, 'weight_decay': 0.000119519105774917, 'epochs': 235, 'loss': 'mse', 'optimizer': 'adam', 'graph_mode': 'off', 'use_snp_selection': False}. Best is trial 32 with value: 0.1302124254881053.
[I 2025-12-05 14:30:58,229] Trial 148 finished with value: 0.09897036317606575 and parameters: {'model_type': 'mlp', 'hidden_dims': '[128, 64]', 'dropout': 0.4442556333769942, 'batch_norm': False, 'lr': 8.970244736871018e-05, 'weight_decay': 1.3325762557175265e-05, 'epochs': 279, 'loss': 'mae', 'optimizer': 'adam', 'graph_mode': 'off', 'use_snp_selection': False}. Best is trial 32 with value: 0.1302124254881053.
[I 2025-12-05 14:30:59,876] Trial 149 finished with value: 0.10262931370197632 and parameters: {'model_type': 'mlp', 'hidden_dims': '[256, 128]', 'dropout': 0.2433553451159731, 'batch_norm': True, 'lr': 0.00021564086987930315, 'weight_decay': 3.633488470795339e-05, 'epochs': 211, 'loss': 'mae', 'optimizer': 'adam', 'graph_mode': 'off', 'use_snp_selection': True, 'num_snps': 25579}. Best is trial 32 with value: 0.1302124254881053.
[I 2025-12-05 14:31:02,174] Trial 0 finished with value: 0.1009372680694907 and parameters: {'model_type': 'mlp', 'hidden_dims': '[128, 64]', 'dropout': 0.199031432379812, 'batch_norm': True, 'lr': 1.8408544111075837e-06, 'weight_decay': 5.5136510071208614e-05, 'epochs': 336, 'loss': 'mae', 'optimizer': 'adam', 'graph_mode': 'off', 'use_snp_selection': True, 'num_snps': 43862}. Best is trial 0 with value: 0.1009372680694907.
[I 2025-12-05 14:31:03,324] Trial 1 finished with value: 0.1024495119871185 and parameters: {'model_type': 'mlp', 'hidden_dims': '[256, 128]', 'dropout': 0.4370668075331726, 'batch_norm': True, 'lr': 7.133471581159139e-05, 'weight_decay': 1.128633586803549e-05, 'epochs': 242, 'loss': 'mae', 'optimizer': 'adam', 'graph_mode': 'off', 'use_snp_selection': False}. Best is trial 1 with value: 0.1024495119871185.
[I 2025-12-05 14:31:04,356] Trial 2 finished with value: 0.07457117597960805 and parameters: {'model_type': 'mlp', 'hidden_dims': '[256, 128, 64]', 'dropout': 0.41314357415569625, 'batch_norm': False, 'lr': 3.952233718592101e-06, 'weight_decay': 0.00026754769258252603, 'epochs': 149, 'loss': 'mse', 'optimizer': 'adam', 'graph_mode': 'off', 'use_snp_selection': True, 'num_snps': 11571}. Best is trial 1 with value: 0.1024495119871185.
[I 2025-12-05 14:31:06,388] Trial 3 finished with value: 0.0774523785019679 and parameters: {'model_type': 'mlp', 'hidden_dims': '[512, 64]', 'dropout': 0.5938127374509361, 'batch_norm': False, 'lr': 5.67704586114731e-06, 'weight_decay': 2.4518087630137052e-05, 'epochs': 320, 'loss': 'mae', 'optimizer': 'adam', 'graph_mode': 'off', 'use_snp_selection': False}. Best is trial 1 with value: 0.1024495119871185.
[I 2025-12-05 14:31:08,718] Trial 4 finished with value: 0.04219459915634987 and parameters: {'model_type': 'mlp', 'hidden_dims': '[512, 128]', 'dropout': 0.25746343592134413, 'batch_norm': True, 'lr': 1.3467657668402788e-06, 'weight_decay': 0.00033087251918647806, 'epochs': 277, 'loss': 'mse', 'optimizer': 'adam', 'graph_mode': 'off', 'use_snp_selection': True, 'num_snps': 36675}. Best is trial 1 with value: 0.1024495119871185.
[I 2025-12-05 14:31:10,516] Trial 5 finished with value: 0.03377051706927156 and parameters: {'model_type': 'mlp', 'hidden_dims': '[512, 64]', 'dropout': 0.38275350994408375, 'batch_norm': True, 'lr': 1.5586664309232824e-06, 'weight_decay': 0.0008227664668621182, 'epochs': 145, 'loss': 'mae', 'optimizer': 'adam', 'graph_mode': 'off', 'use_snp_selection': True, 'num_snps': 32148}. Best is trial 1 with value: 0.1024495119871185.
[I 2025-12-05 14:31:11,586] Trial 6 finished with value: 0.10232931633019368 and parameters: {'model_type': 'mlp', 'hidden_dims': '[256, 128]', 'dropout': 0.3930109900265879, 'batch_norm': False, 'lr': 4.892964372128395e-05, 'weight_decay': 1.5809549317992182e-06, 'epochs': 199, 'loss': 'mse', 'optimizer': 'adam', 'graph_mode': 'off', 'use_snp_selection': False}. Best is trial 1 with value: 0.1024495119871185.
