[I 2025-12-05 19:08:15,204] Trial 114 finished with value: 0.2970915572494594 and parameters: {'model_type': 'mlp', 'hidden_dims': '[512, 256]', 'dropout': 0.269116368275718, 'batch_norm': False, 'lr': 1.7030666259595477e-06, 'weight_decay': 0.0007844759566980185, 'epochs': 210, 'loss': 'mse', 'optimizer': 'adam', 'graph_mode': 'off', 'use_snp_selection': False}. Best is trial 65 with value: 0.3057176100218867.
[I 2025-12-05 19:08:53,093] Trial 115 finished with value: 0.3006313856128534 and parameters: {'model_type': 'mlp', 'hidden_dims': '[512, 256]', 'dropout': 0.37454713275520124, 'batch_norm': False, 'lr': 2.2708794837267762e-06, 'weight_decay': 0.00027387051488523656, 'epochs': 186, 'loss': 'mse', 'optimizer': 'adam', 'graph_mode': 'off', 'use_snp_selection': False}. Best is trial 65 with value: 0.3057176100218867.
[I 2025-12-05 19:09:39,523] Trial 116 finished with value: 0.3008241001700086 and parameters: {'model_type': 'mlp', 'hidden_dims': '[512, 64]', 'dropout': 0.3993408558576147, 'batch_norm': False, 'lr': 1.3161575473663354e-06, 'weight_decay': 0.0003664016812579332, 'epochs': 236, 'loss': 'mse', 'optimizer': 'adam', 'graph_mode': 'off', 'use_snp_selection': False}. Best is trial 65 with value: 0.3057176100218867.
[I 2025-12-05 19:10:21,141] Trial 117 finished with value: 0.28660762883022206 and parameters: {'model_type': 'mlp', 'hidden_dims': '[512, 128]', 'dropout': 0.29942024586948257, 'batch_norm': False, 'lr': 2.899926629569598e-06, 'weight_decay': 0.0005830436891558076, 'epochs': 208, 'loss': 'mae', 'optimizer': 'adam', 'graph_mode': 'off', 'use_snp_selection': False}. Best is trial 65 with value: 0.3057176100218867.
[I 2025-12-05 19:11:00,781] Trial 118 finished with value: 0.29762976919114675 and parameters: {'model_type': 'mlp', 'hidden_dims': '[512, 256]', 'dropout': 0.348912787280818, 'batch_norm': False, 'lr': 1.5954670885171615e-06, 'weight_decay': 0.00046000082578394205, 'epochs': 196, 'loss': 'mse', 'optimizer': 'adam', 'graph_mode': 'off', 'use_snp_selection': False}. Best is trial 65 with value: 0.3057176100218867.
[I 2025-12-05 19:11:43,770] Trial 119 finished with value: 0.2960326822484153 and parameters: {'model_type': 'mlp', 'hidden_dims': '[512, 256]', 'dropout': 0.3643550977165103, 'batch_norm': False, 'lr': 4.200452564295304e-06, 'weight_decay': 0.0008650889416134832, 'epochs': 215, 'loss': 'mse', 'optimizer': 'adam', 'graph_mode': 'off', 'use_snp_selection': False}. Best is trial 65 with value: 0.3057176100218867.
[I 2025-12-05 19:12:24,636] Trial 120 finished with value: 0.300000025637425 and parameters: {'model_type': 'mlp', 'hidden_dims': '[512, 256]', 'dropout': 0.32361246614067934, 'batch_norm': False, 'lr': 2.5098549515153197e-06, 'weight_decay': 0.00017924051733171157, 'epochs': 203, 'loss': 'mse', 'optimizer': 'adam', 'graph_mode': 'off', 'use_snp_selection': False}. Best is trial 65 with value: 0.3057176100218867.
[I 2025-12-05 19:13:01,471] Trial 121 finished with value: 0.30367421126897465 and parameters: {'model_type': 'mlp', 'hidden_dims': '[512, 256]', 'dropout': 0.35965573004408696, 'batch_norm': False, 'lr': 2.0243719037524455e-06, 'weight_decay': 0.000415562071725948, 'epochs': 180, 'loss': 'mse', 'optimizer': 'adam', 'graph_mode': 'off', 'use_snp_selection': False}. Best is trial 65 with value: 0.3057176100218867.
[I 2025-12-05 19:13:33,236] Trial 122 finished with value: 0.30169055417424506 and parameters: {'model_type': 'mlp', 'hidden_dims': '[512, 256]', 'dropout': 0.33784258224808655, 'batch_norm': False, 'lr': 1.9509307733752927e-06, 'weight_decay': 0.0006747009410411937, 'epochs': 151, 'loss': 'mse', 'optimizer': 'adam', 'graph_mode': 'off', 'use_snp_selection': False}. Best is trial 65 with value: 0.3057176100218867.
[I 2025-12-05 19:13:44,573] Trial 123 finished with value: 0.26990587540907685 and parameters: {'model_type': 'mlp', 'hidden_dims': '[128, 64]', 'dropout': 0.3375410961475966, 'batch_norm': False, 'lr': 1.8165274616220615e-06, 'weight_decay': 0.000700058064713727, 'epochs': 134, 'loss': 'mse', 'optimizer': 'adam', 'graph_mode': 'off', 'use_snp_selection': False}. Best is trial 65 with value: 0.3057176100218867.
[I 2025-12-05 19:14:16,279] Trial 124 finished with value: 0.2998946789088546 and parameters: {'model_type': 'mlp', 'hidden_dims': '[512, 256]', 'dropout': 0.417093422721684, 'batch_norm': False, 'lr': 2.0084130635475316e-06, 'weight_decay': 0.0009750878478422751, 'epochs': 151, 'loss': 'mse', 'optimizer': 'adam', 'graph_mode': 'off', 'use_snp_selection': False}. Best is trial 65 with value: 0.3057176100218867.
[I 2025-12-05 19:14:49,952] Trial 125 finished with value: 0.29978293436034653 and parameters: {'model_type': 'mlp', 'hidden_dims': '[512, 256]', 'dropout': 0.3452919882728418, 'batch_norm': False, 'lr': 1.5440590576886488e-06, 'weight_decay': 0.0005195511648404784, 'epochs': 162, 'loss': 'mse', 'optimizer': 'adam', 'graph_mode': 'off', 'use_snp_selection': False}. Best is trial 65 with value: 0.3057176100218867.
[I 2025-12-05 19:15:25,780] Trial 126 finished with value: 0.2981543041718086 and parameters: {'model_type': 'mlp', 'hidden_dims': '[512, 256]', 'dropout': 0.3225972462308684, 'batch_norm': False, 'lr': 2.3522715545168886e-06, 'weight_decay': 0.0002744753362789262, 'epochs': 174, 'loss': 'mse', 'optimizer': 'adam', 'graph_mode': 'off', 'use_snp_selection': False}. Best is trial 65 with value: 0.3057176100218867.
[I 2025-12-05 19:16:09,259] Trial 127 finished with value: 0.299984532066573 and parameters: {'model_type': 'mlp', 'hidden_dims': '[512, 256]', 'dropout': 0.37488660893692843, 'batch_norm': False, 'lr': 1.3549084474368125e-06, 'weight_decay': 0.0006150491633694673, 'epochs': 218, 'loss': 'mse', 'optimizer': 'adam', 'graph_mode': 'off', 'use_snp_selection': False}. Best is trial 65 with value: 0.3057176100218867.
[I 2025-12-05 19:16:35,938] Trial 128 finished with value: 0.2976648595160684 and parameters: {'model_type': 'mlp', 'hidden_dims': '[512, 256]', 'dropout': 0.2808246477652651, 'batch_norm': False, 'lr': 3.312244600848595e-06, 'weight_decay': 0.0004710727843006383, 'epochs': 122, 'loss': 'mse', 'optimizer': 'adam', 'graph_mode': 'off', 'use_snp_selection': False}. Best is trial 65 with value: 0.3057176100218867.
[I 2025-12-05 19:17:06,061] Trial 129 finished with value: 0.28614009047064115 and parameters: {'model_type': 'mlp', 'hidden_dims': '[512, 256]', 'dropout': 0.29172090250549254, 'batch_norm': False, 'lr': 0.00024814730119336815, 'weight_decay': 0.0003273811646632364, 'epochs': 143, 'loss': 'mse', 'optimizer': 'adam', 'graph_mode': 'off', 'use_snp_selection': False}. Best is trial 65 with value: 0.3057176100218867.
[I 2025-12-05 19:17:27,349] Trial 130 finished with value: 0.2587605526089979 and parameters: {'model_type': 'mlp', 'hidden_dims': '[256, 128, 64]', 'dropout': 0.27081888003638077, 'batch_norm': True, 'lr': 2.0393710112583e-06, 'weight_decay': 0.0006944277481653774, 'epochs': 180, 'loss': 'mse', 'optimizer': 'adam', 'graph_mode': 'off', 'use_snp_selection': False}. Best is trial 65 with value: 0.3057176100218867.
[I 2025-12-05 19:18:06,263] Trial 131 finished with value: 0.302831118091056 and parameters: {'model_type': 'mlp', 'hidden_dims': '[512, 256]', 'dropout': 0.35656146537679084, 'batch_norm': False, 'lr': 2.783683055070917e-06, 'weight_decay': 0.00040190456684898135, 'epochs': 192, 'loss': 'mse', 'optimizer': 'adam', 'graph_mode': 'off', 'use_snp_selection': False}. Best is trial 65 with value: 0.3057176100218867.
[I 2025-12-05 19:18:51,178] Trial 132 finished with value: 0.3033774770277261 and parameters: {'model_type': 'mlp', 'hidden_dims': '[512, 256]', 'dropout': 0.31136527353568105, 'batch_norm': False, 'lr': 2.3438010994572197e-06, 'weight_decay': 0.0004182100867863464, 'epochs': 226, 'loss': 'mse', 'optimizer': 'adam', 'graph_mode': 'off', 'use_snp_selection': False}. Best is trial 65 with value: 0.3057176100218867.
[I 2025-12-05 19:19:36,112] Trial 133 finished with value: 0.2990842092616828 and parameters: {'model_type': 'mlp', 'hidden_dims': '[512, 256]', 'dropout': 0.3147540358383523, 'batch_norm': False, 'lr': 2.463975252913719e-06, 'weight_decay': 0.00023011021083622492, 'epochs': 226, 'loss': 'mse', 'optimizer': 'adam', 'graph_mode': 'off', 'use_snp_selection': False}. Best is trial 65 with value: 0.3057176100218867.
[I 2025-12-05 19:20:15,429] Trial 134 finished with value: 0.29850371173195844 and parameters: {'model_type': 'mlp', 'hidden_dims': '[512, 256]', 'dropout': 0.3318885343409438, 'batch_norm': False, 'lr': 3.882760716423133e-06, 'weight_decay': 0.0004164496718371068, 'epochs': 194, 'loss': 'mse', 'optimizer': 'adam', 'graph_mode': 'off', 'use_snp_selection': False}. Best is trial 65 with value: 0.3057176100218867.
[I 2025-12-05 19:21:03,175] Trial 135 finished with value: 0.29876861230534263 and parameters: {'model_type': 'mlp', 'hidden_dims': '[512, 256]', 'dropout': 0.30088107018558613, 'batch_norm': False, 'lr': 1.850663906974707e-06, 'weight_decay': 0.00032584220327875636, 'epochs': 242, 'loss': 'mse', 'optimizer': 'adam', 'graph_mode': 'off', 'use_snp_selection': False}. Best is trial 65 with value: 0.3057176100218867.
[I 2025-12-05 19:21:43,351] Trial 136 finished with value: 0.2975507959945247 and parameters: {'model_type': 'mlp', 'hidden_dims': '[512, 256]', 'dropout': 0.3533764338217387, 'batch_norm': False, 'lr': 3.2394736072105556e-06, 'weight_decay': 0.0005122245390848038, 'epochs': 199, 'loss': 'mse', 'optimizer': 'adam', 'graph_mode': 'off', 'use_snp_selection': False}. Best is trial 65 with value: 0.3057176100218867.
[I 2025-12-05 19:22:18,265] Trial 137 finished with value: 0.30313022268637857 and parameters: {'model_type': 'mlp', 'hidden_dims': '[512, 256]', 'dropout': 0.36740056481174255, 'batch_norm': False, 'lr': 2.710563170246029e-06, 'weight_decay': 0.0002700306878928389, 'epochs': 169, 'loss': 'mse', 'optimizer': 'adam', 'graph_mode': 'off', 'use_snp_selection': False}. Best is trial 65 with value: 0.3057176100218867.
[I 2025-12-05 19:22:53,366] Trial 138 finished with value: 0.2654845108568241 and parameters: {'model_type': 'mlp', 'hidden_dims': '[512, 256]', 'dropout': 0.36407750520374793, 'batch_norm': False, 'lr': 1.7090550004255022e-06, 'weight_decay': 0.0002713822116385069, 'epochs': 170, 'loss': 'mae', 'optimizer': 'adam', 'graph_mode': 'off', 'use_snp_selection': False}. Best is trial 65 with value: 0.3057176100218867.
[I 2025-12-05 19:23:26,170] Trial 139 finished with value: 0.296702385838911 and parameters: {'model_type': 'mlp', 'hidden_dims': '[512, 256]', 'dropout': 0.38625261239875025, 'batch_norm': False, 'lr': 2.832809841426651e-06, 'weight_decay': 0.00020634942023475532, 'epochs': 157, 'loss': 'mse', 'optimizer': 'adam', 'graph_mode': 'off', 'use_snp_selection': False}. Best is trial 65 with value: 0.3057176100218867.
[I 2025-12-05 19:24:03,115] Trial 140 finished with value: 0.29117368653059683 and parameters: {'model_type': 'mlp', 'hidden_dims': '[512, 256]', 'dropout': 0.34269288392858244, 'batch_norm': False, 'lr': 1.0216507658872597e-06, 'weight_decay': 0.0003460605684723653, 'epochs': 181, 'loss': 'mse', 'optimizer': 'adam', 'graph_mode': 'off', 'use_snp_selection': False}. Best is trial 65 with value: 0.3057176100218867.
[I 2025-12-05 19:24:37,613] Trial 141 finished with value: 0.3011333064140244 and parameters: {'model_type': 'mlp', 'hidden_dims': '[512, 256]', 'dropout': 0.32971538507343046, 'batch_norm': False, 'lr': 2.362463119349538e-06, 'weight_decay': 0.000402886745215402, 'epochs': 167, 'loss': 'mse', 'optimizer': 'adam', 'graph_mode': 'off', 'use_snp_selection': False}. Best is trial 65 with value: 0.3057176100218867.
[I 2025-12-05 19:25:09,330] Trial 142 finished with value: 0.3015635886436926 and parameters: {'model_type': 'mlp', 'hidden_dims': '[512, 256]', 'dropout': 0.3171970026593931, 'batch_norm': False, 'lr': 2.1840575449168803e-06, 'weight_decay': 0.0004601270706593422, 'epochs': 151, 'loss': 'mse', 'optimizer': 'adam', 'graph_mode': 'off', 'use_snp_selection': False}. Best is trial 65 with value: 0.3057176100218867.
[I 2025-12-05 19:25:40,511] Trial 143 finished with value: 0.2907258533003417 and parameters: {'model_type': 'mlp', 'hidden_dims': '[512, 256]', 'dropout': 0.36950680871639874, 'batch_norm': False, 'lr': 2.170513589594554e-06, 'weight_decay': 0.0002944150399460251, 'epochs': 148, 'loss': 'mse', 'optimizer': 'adam', 'graph_mode': 'off', 'use_snp_selection': False}. Best is trial 65 with value: 0.3057176100218867.
[I 2025-12-05 19:26:08,569] Trial 144 finished with value: 0.29296274782626386 and parameters: {'model_type': 'mlp', 'hidden_dims': '[512, 256]', 'dropout': 0.3493165037270029, 'batch_norm': False, 'lr': 1.4957600553494718e-06, 'weight_decay': 0.0004717725125761181, 'epochs': 130, 'loss': 'mse', 'optimizer': 'adam', 'graph_mode': 'off', 'use_snp_selection': False}. Best is trial 65 with value: 0.3057176100218867.
[I 2025-12-05 19:26:44,313] Trial 145 finished with value: 0.30081648359402074 and parameters: {'model_type': 'mlp', 'hidden_dims': '[512, 64]', 'dropout': 0.3062963815918857, 'batch_norm': False, 'lr': 1.8433975354299455e-06, 'weight_decay': 0.00016379812517410298, 'epochs': 175, 'loss': 'mse', 'optimizer': 'adam', 'graph_mode': 'off', 'use_snp_selection': False}. Best is trial 65 with value: 0.3057176100218867.
[I 2025-12-05 19:27:16,544] Trial 146 finished with value: 0.2885149006352094 and parameters: {'model_type': 'mlp', 'hidden_dims': '[512, 256]', 'dropout': 0.2945421050218577, 'batch_norm': False, 'lr': 1.2203774939461646e-06, 'weight_decay': 0.00021973485496717103, 'epochs': 154, 'loss': 'mse', 'optimizer': 'adam', 'graph_mode': 'off', 'use_snp_selection': False}. Best is trial 65 with value: 0.3057176100218867.
[I 2025-12-05 19:27:55,021] Trial 147 finished with value: 0.3018227217016576 and parameters: {'model_type': 'mlp', 'hidden_dims': '[512, 128]', 'dropout': 0.31596001025467424, 'batch_norm': False, 'lr': 3.5179060637298712e-06, 'weight_decay': 0.0003587027999598506, 'epochs': 190, 'loss': 'mse', 'optimizer': 'adam', 'graph_mode': 'off', 'use_snp_selection': False}. Best is trial 65 with value: 0.3057176100218867.
[I 2025-12-05 19:28:33,318] Trial 148 finished with value: 0.2997420689837562 and parameters: {'model_type': 'mlp', 'hidden_dims': '[512, 128]', 'dropout': 0.3090732913386008, 'batch_norm': False, 'lr': 3.278047701954905e-06, 'weight_decay': 0.0003771877474038467, 'epochs': 189, 'loss': 'mse', 'optimizer': 'adam', 'graph_mode': 'off', 'use_snp_selection': False}. Best is trial 65 with value: 0.3057176100218867.
[I 2025-12-05 19:29:14,736] Trial 149 finished with value: 0.3016888409592321 and parameters: {'model_type': 'mlp', 'hidden_dims': '[512, 128]', 'dropout': 0.3794906959477269, 'batch_norm': False, 'lr': 3.675702270300898e-06, 'weight_decay': 0.000270636633443641, 'epochs': 207, 'loss': 'mse', 'optimizer': 'adam', 'graph_mode': 'off', 'use_snp_selection': False}. Best is trial 65 with value: 0.3057176100218867.
[I 2025-12-05 19:30:09,430] Trial 0 finished with value: 0.25593635130007025 and parameters: {'model_type': 'mlp', 'hidden_dims': '[128, 64]', 'dropout': 0.199031432379812, 'batch_norm': True, 'lr': 1.8408544111075837e-06, 'weight_decay': 5.5136510071208614e-05, 'epochs': 336, 'loss': 'mae', 'optimizer': 'adam', 'graph_mode': 'off', 'use_snp_selection': True, 'num_snps': 43862}. Best is trial 0 with value: 0.25593635130007025.
[I 2025-12-05 19:30:36,154] Trial 1 finished with value: 0.27941375050152784 and parameters: {'model_type': 'mlp', 'hidden_dims': '[256, 128]', 'dropout': 0.4370668075331726, 'batch_norm': True, 'lr': 7.133471581159139e-05, 'weight_decay': 1.128633586803549e-05, 'epochs': 242, 'loss': 'mae', 'optimizer': 'adam', 'graph_mode': 'off', 'use_snp_selection': False}. Best is trial 1 with value: 0.27941375050152784.
[I 2025-12-05 19:31:02,524] Trial 2 finished with value: 0.23708708009984975 and parameters: {'model_type': 'mlp', 'hidden_dims': '[256, 128, 64]', 'dropout': 0.41314357415569625, 'batch_norm': False, 'lr': 3.952233718592101e-06, 'weight_decay': 0.00026754769258252603, 'epochs': 149, 'loss': 'mse', 'optimizer': 'adam', 'graph_mode': 'off', 'use_snp_selection': True, 'num_snps': 11571}. Best is trial 1 with value: 0.27941375050152784.
[I 2025-12-05 19:32:03,191] Trial 3 finished with value: 0.2850103385982719 and parameters: {'model_type': 'mlp', 'hidden_dims': '[512, 64]', 'dropout': 0.5938127374509361, 'batch_norm': False, 'lr': 5.67704586114731e-06, 'weight_decay': 2.4518087630137052e-05, 'epochs': 320, 'loss': 'mae', 'optimizer': 'adam', 'graph_mode': 'off', 'use_snp_selection': False}. Best is trial 3 with value: 0.2850103385982719.
[I 2025-12-05 19:33:03,611] Trial 4 finished with value: 0.26396729004643377 and parameters: {'model_type': 'mlp', 'hidden_dims': '[512, 128]', 'dropout': 0.25746343592134413, 'batch_norm': True, 'lr': 1.3467657668402788e-06, 'weight_decay': 0.00033087251918647806, 'epochs': 277, 'loss': 'mse', 'optimizer': 'adam', 'graph_mode': 'off', 'use_snp_selection': True, 'num_snps': 36675}. Best is trial 3 with value: 0.2850103385982719.
[I 2025-12-05 19:33:46,604] Trial 5 finished with value: 0.24322878176553778 and parameters: {'model_type': 'mlp', 'hidden_dims': '[512, 64]', 'dropout': 0.38275350994408375, 'batch_norm': True, 'lr': 1.5586664309232824e-06, 'weight_decay': 0.0008227664668621182, 'epochs': 145, 'loss': 'mae', 'optimizer': 'adam', 'graph_mode': 'off', 'use_snp_selection': True, 'num_snps': 32148}. Best is trial 3 with value: 0.2850103385982719.
[I 2025-12-05 19:34:09,241] Trial 6 finished with value: 0.28487598493327243 and parameters: {'model_type': 'mlp', 'hidden_dims': '[256, 128]', 'dropout': 0.3930109900265879, 'batch_norm': False, 'lr': 4.892964372128395e-05, 'weight_decay': 1.5809549317992182e-06, 'epochs': 199, 'loss': 'mse', 'optimizer': 'adam', 'graph_mode': 'off', 'use_snp_selection': False}. Best is trial 3 with value: 0.2850103385982719.
[I 2025-12-05 19:34:31,446] Trial 7 finished with value: 0.2913727448419525 and parameters: {'model_type': 'mlp', 'hidden_dims': '[512, 256]', 'dropout': 0.15343979219678458, 'batch_norm': True, 'lr': 6.234003099047341e-05, 'weight_decay': 3.894760610535477e-07, 'epochs': 97, 'loss': 'mse', 'optimizer': 'adam', 'graph_mode': 'off', 'use_snp_selection': False}. Best is trial 7 with value: 0.2913727448419525.
[I 2025-12-05 19:35:31,549] Trial 8 finished with value: 0.2854162651574357 and parameters: {'model_type': 'mlp', 'hidden_dims': '[512, 128]', 'dropout': 0.10743001231661406, 'batch_norm': True, 'lr': 0.00023728538449271062, 'weight_decay': 1.7629071578048637e-05, 'epochs': 312, 'loss': 'mae', 'optimizer': 'adam', 'graph_mode': 'off', 'use_snp_selection': False}. Best is trial 7 with value: 0.2913727448419525.
[I 2025-12-05 19:36:07,489] Trial 9 finished with value: 0.28485931745746884 and parameters: {'model_type': 'mlp', 'hidden_dims': '[512, 64]', 'dropout': 0.14505336736221927, 'batch_norm': True, 'lr': 5.8619638388111826e-05, 'weight_decay': 6.200156172669308e-07, 'epochs': 175, 'loss': 'mse', 'optimizer': 'adam', 'graph_mode': 'off', 'use_snp_selection': False}. Best is trial 7 with value: 0.2913727448419525.
[I 2025-12-05 19:36:19,819] Trial 10 finished with value: 0.1437079071591947 and parameters: {'model_type': 'mlp', 'hidden_dims': '[512, 256]', 'dropout': 0.2736992815328032, 'batch_norm': False, 'lr': 0.00032393778075602147, 'weight_decay': 1.1511946696017092e-07, 'epochs': 41, 'loss': 'mse', 'optimizer': 'adam', 'graph_mode': 'off', 'use_snp_selection': False}. Best is trial 7 with value: 0.2913727448419525.
[I 2025-12-05 19:36:37,345] Trial 11 finished with value: 0.28739678564218574 and parameters: {'model_type': 'mlp', 'hidden_dims': '[512, 128]', 'dropout': 0.10095648685224448, 'batch_norm': True, 'lr': 0.0007666984023899753, 'weight_decay': 2.512571353186099e-06, 'epochs': 70, 'loss': 'mae', 'optimizer': 'adam', 'graph_mode': 'off', 'use_snp_selection': False}. Best is trial 7 with value: 0.2913727448419525.
[I 2025-12-05 19:36:53,695] Trial 12 finished with value: 0.2851588863420269 and parameters: {'model_type': 'mlp', 'hidden_dims': '[512, 256]', 'dropout': 0.10344600881777158, 'batch_norm': True, 'lr': 0.0006753264773209732, 'weight_decay': 1.2006458821839938e-06, 'epochs': 63, 'loss': 'mae', 'optimizer': 'adam', 'graph_mode': 'off', 'use_snp_selection': False}. Best is trial 7 with value: 0.2913727448419525.
[I 2025-12-05 19:37:15,114] Trial 13 finished with value: 0.27917385683286106 and parameters: {'model_type': 'mlp', 'hidden_dims': '[512, 256]', 'dropout': 0.206733630507397, 'batch_norm': True, 'lr': 1.3373175420781734e-05, 'weight_decay': 1.8965593394883618e-07, 'epochs': 92, 'loss': 'mse', 'optimizer': 'adam', 'graph_mode': 'off', 'use_snp_selection': False}. Best is trial 7 with value: 0.2913727448419525.
[I 2025-12-05 19:37:39,668] Trial 14 finished with value: 0.2824188937434047 and parameters: {'model_type': 'mlp', 'hidden_dims': '[512, 128]', 'dropout': 0.3012984444538551, 'batch_norm': True, 'lr': 0.0009000048932733863, 'weight_decay': 3.2568808920327207e-06, 'epochs': 110, 'loss': 'mae', 'optimizer': 'adam', 'graph_mode': 'off', 'use_snp_selection': False}. Best is trial 7 with value: 0.2913727448419525.
[I 2025-12-05 19:37:49,239] Trial 15 finished with value: 0.2856830982703271 and parameters: {'model_type': 'mlp', 'hidden_dims': '[128, 64]', 'dropout': 0.18406139084679396, 'batch_norm': True, 'lr': 0.0001572871022003765, 'weight_decay': 3.717609129469701e-07, 'epochs': 100, 'loss': 'mse', 'optimizer': 'adam', 'graph_mode': 'off', 'use_snp_selection': False}. Best is trial 7 with value: 0.2913727448419525.
