[I 2025-12-05 14:43:02,311] Trial 66 finished with value: 0.09332887091153946 and parameters: {'model_type': 'mlp', 'hidden_dims': '[128, 64]', 'dropout': 0.25107278357339846, 'batch_norm': True, 'lr': 0.0007308919535871846, 'weight_decay': 1.3290417205216211e-07, 'epochs': 56, 'loss': 'mse', 'optimizer': 'adam', 'graph_mode': 'off', 'use_snp_selection': True, 'num_snps': 22881}. Best is trial 7 with value: 0.11937346209676132.
[I 2025-12-05 14:43:04,920] Trial 67 finished with value: 0.006722808399725435 and parameters: {'model_type': 'mlp', 'hidden_dims': '[512, 256]', 'dropout': 0.55445548317417, 'batch_norm': True, 'lr': 1.038788092140181e-06, 'weight_decay': 1.4745154221415968e-07, 'epochs': 143, 'loss': 'mae', 'optimizer': 'adam', 'graph_mode': 'off', 'use_snp_selection': False}. Best is trial 7 with value: 0.11937346209676132.
[I 2025-12-05 14:43:06,187] Trial 68 finished with value: 0.09419006487400028 and parameters: {'model_type': 'mlp', 'hidden_dims': '[256, 128]', 'dropout': 0.18643223432297998, 'batch_norm': False, 'lr': 0.00039056542970759454, 'weight_decay': 1.9461322335898918e-06, 'epochs': 91, 'loss': 'mse', 'optimizer': 'adam', 'graph_mode': 'off', 'use_snp_selection': False}. Best is trial 7 with value: 0.11937346209676132.
[I 2025-12-05 14:43:08,290] Trial 69 finished with value: 0.10909349276913627 and parameters: {'model_type': 'mlp', 'hidden_dims': '[512, 256]', 'dropout': 0.1526310919635266, 'batch_norm': True, 'lr': 0.0009129141978897194, 'weight_decay': 3.1146115042155534e-06, 'epochs': 108, 'loss': 'mae', 'optimizer': 'adam', 'graph_mode': 'off', 'use_snp_selection': False}. Best is trial 7 with value: 0.11937346209676132.
[I 2025-12-05 14:43:10,604] Trial 70 finished with value: 0.10790942695604394 and parameters: {'model_type': 'mlp', 'hidden_dims': '[512, 128]', 'dropout': 0.12894176203532798, 'batch_norm': True, 'lr': 0.0008590685499115709, 'weight_decay': 2.9538789654069765e-06, 'epochs': 126, 'loss': 'mae', 'optimizer': 'adam', 'graph_mode': 'off', 'use_snp_selection': False}. Best is trial 7 with value: 0.11937346209676132.
[I 2025-12-05 14:43:12,673] Trial 71 finished with value: 0.10689153469599363 and parameters: {'model_type': 'mlp', 'hidden_dims': '[512, 256]', 'dropout': 0.16009877079159363, 'batch_norm': True, 'lr': 0.0005732746523241986, 'weight_decay': 3.8725872863411246e-06, 'epochs': 106, 'loss': 'mae', 'optimizer': 'adam', 'graph_mode': 'off', 'use_snp_selection': False}. Best is trial 7 with value: 0.11937346209676132.
[I 2025-12-05 14:43:14,670] Trial 72 finished with value: 0.1063043418529507 and parameters: {'model_type': 'mlp', 'hidden_dims': '[512, 256]', 'dropout': 0.5994036075274569, 'batch_norm': True, 'lr': 0.0009805093994671645, 'weight_decay': 6.28534928635985e-06, 'epochs': 98, 'loss': 'mae', 'optimizer': 'adam', 'graph_mode': 'off', 'use_snp_selection': False}. Best is trial 7 with value: 0.11937346209676132.
[I 2025-12-05 14:43:16,927] Trial 73 finished with value: 0.11643382697302626 and parameters: {'model_type': 'mlp', 'hidden_dims': '[512, 256]', 'dropout': 0.2127835417990624, 'batch_norm': True, 'lr': 0.0006619649336307772, 'weight_decay': 1.7687740131726996e-06, 'epochs': 119, 'loss': 'mae', 'optimizer': 'adam', 'graph_mode': 'off', 'use_snp_selection': False}. Best is trial 7 with value: 0.11937346209676132.
[I 2025-12-05 14:43:19,185] Trial 74 finished with value: 0.0963585952936661 and parameters: {'model_type': 'mlp', 'hidden_dims': '[512, 256]', 'dropout': 0.215913171562718, 'batch_norm': True, 'lr': 0.0007991447339371188, 'weight_decay': 1.2180837716204446e-06, 'epochs': 119, 'loss': 'mae', 'optimizer': 'adam', 'graph_mode': 'off', 'use_snp_selection': False}. Best is trial 7 with value: 0.11937346209676132.
[I 2025-12-05 14:43:21,926] Trial 75 finished with value: 0.1000932516061803 and parameters: {'model_type': 'mlp', 'hidden_dims': '[512, 256]', 'dropout': 0.3288710839173965, 'batch_norm': True, 'lr': 0.0005882867121159622, 'weight_decay': 1.1882455793034792e-06, 'epochs': 160, 'loss': 'mae', 'optimizer': 'adam', 'graph_mode': 'off', 'use_snp_selection': False}. Best is trial 7 with value: 0.11937346209676132.
[I 2025-12-05 14:43:23,561] Trial 76 finished with value: 0.0785685388008136 and parameters: {'model_type': 'mlp', 'hidden_dims': '[256, 128, 64]', 'dropout': 0.23666059049843158, 'batch_norm': True, 'lr': 0.0006980186568926419, 'weight_decay': 1.726255983044022e-06, 'epochs': 130, 'loss': 'mae', 'optimizer': 'adam', 'graph_mode': 'off', 'use_snp_selection': True, 'num_snps': 3325}. Best is trial 7 with value: 0.11937346209676132.
[I 2025-12-05 14:43:24,624] Trial 77 finished with value: 0.09040147402684313 and parameters: {'model_type': 'mlp', 'hidden_dims': '[128, 64]', 'dropout': 0.14995184159342753, 'batch_norm': True, 'lr': 0.00044825633428476064, 'weight_decay': 5.739602570955299e-07, 'epochs': 149, 'loss': 'mae', 'optimizer': 'adam', 'graph_mode': 'off', 'use_snp_selection': False}. Best is trial 7 with value: 0.11937346209676132.
[I 2025-12-05 14:43:26,767] Trial 78 finished with value: 0.11205977358959071 and parameters: {'model_type': 'mlp', 'hidden_dims': '[512, 256]', 'dropout': 0.19721621021486094, 'batch_norm': True, 'lr': 0.0005362195220232242, 'weight_decay': 2.683769398258791e-06, 'epochs': 112, 'loss': 'mae', 'optimizer': 'adam', 'graph_mode': 'off', 'use_snp_selection': False}. Best is trial 7 with value: 0.11937346209676132.
[I 2025-12-05 14:43:28,444] Trial 79 finished with value: 0.09662805847861464 and parameters: {'model_type': 'mlp', 'hidden_dims': '[512, 64]', 'dropout': 0.19508822959656233, 'batch_norm': True, 'lr': 0.00026303830582618095, 'weight_decay': 4.654356973592034e-06, 'epochs': 75, 'loss': 'mae', 'optimizer': 'adam', 'graph_mode': 'off', 'use_snp_selection': False}. Best is trial 7 with value: 0.11937346209676132.
[I 2025-12-05 14:43:30,892] Trial 80 finished with value: 0.09663391142909786 and parameters: {'model_type': 'mlp', 'hidden_dims': '[512, 256]', 'dropout': 0.1753817868243436, 'batch_norm': True, 'lr': 0.0003825891173204448, 'weight_decay': 1.871237034631592e-07, 'epochs': 134, 'loss': 'mae', 'optimizer': 'adam', 'graph_mode': 'off', 'use_snp_selection': False}. Best is trial 7 with value: 0.11937346209676132.
[I 2025-12-05 14:43:33,085] Trial 81 finished with value: 0.10459105324307366 and parameters: {'model_type': 'mlp', 'hidden_dims': '[512, 256]', 'dropout': 0.19890262537635003, 'batch_norm': True, 'lr': 0.0005271840541220639, 'weight_decay': 2.8134808992661874e-06, 'epochs': 116, 'loss': 'mae', 'optimizer': 'adam', 'graph_mode': 'off', 'use_snp_selection': False}. Best is trial 7 with value: 0.11937346209676132.
[I 2025-12-05 14:43:35,204] Trial 82 finished with value: 0.1129731451966016 and parameters: {'model_type': 'mlp', 'hidden_dims': '[512, 256]', 'dropout': 0.1483919271642186, 'batch_norm': True, 'lr': 0.0006824885735261937, 'weight_decay': 3.5408585025463696e-06, 'epochs': 110, 'loss': 'mae', 'optimizer': 'adam', 'graph_mode': 'off', 'use_snp_selection': False}. Best is trial 7 with value: 0.11937346209676132.
[I 2025-12-05 14:43:37,170] Trial 83 finished with value: 0.09645896619629062 and parameters: {'model_type': 'mlp', 'hidden_dims': '[512, 256]', 'dropout': 0.1326417150007711, 'batch_norm': True, 'lr': 0.0006813071624429455, 'weight_decay': 7.4723355250110254e-06, 'epochs': 98, 'loss': 'mae', 'optimizer': 'adam', 'graph_mode': 'off', 'use_snp_selection': False}. Best is trial 7 with value: 0.11937346209676132.
[I 2025-12-05 14:43:39,471] Trial 84 finished with value: 0.09562775450191108 and parameters: {'model_type': 'mlp', 'hidden_dims': '[512, 256]', 'dropout': 0.4060513391372862, 'batch_norm': True, 'lr': 0.00019099502832880066, 'weight_decay': 2.6296683242678806e-07, 'epochs': 122, 'loss': 'mae', 'optimizer': 'adam', 'graph_mode': 'off', 'use_snp_selection': False}. Best is trial 7 with value: 0.11937346209676132.
[I 2025-12-05 14:43:41,296] Trial 85 finished with value: 0.1235808695724671 and parameters: {'model_type': 'mlp', 'hidden_dims': '[512, 256]', 'dropout': 0.11951410359171533, 'batch_norm': True, 'lr': 0.00011710662547928467, 'weight_decay': 1.8781351848371635e-06, 'epochs': 86, 'loss': 'mae', 'optimizer': 'adam', 'graph_mode': 'off', 'use_snp_selection': False}. Best is trial 85 with value: 0.1235808695724671.
[I 2025-12-05 14:43:42,155] Trial 86 finished with value: 0.09239696529700984 and parameters: {'model_type': 'mlp', 'hidden_dims': '[128, 64]', 'dropout': 0.11688274065134804, 'batch_norm': True, 'lr': 8.171375209984559e-05, 'weight_decay': 1.9072730495321352e-06, 'epochs': 87, 'loss': 'mae', 'optimizer': 'adam', 'graph_mode': 'off', 'use_snp_selection': False}. Best is trial 85 with value: 0.1235808695724671.
[I 2025-12-05 14:43:44,080] Trial 87 finished with value: 0.09560028268968039 and parameters: {'model_type': 'mlp', 'hidden_dims': '[512, 256]', 'dropout': 0.17450094922446305, 'batch_norm': True, 'lr': 0.0001278420010821662, 'weight_decay': 3.5387659719486077e-06, 'epochs': 94, 'loss': 'mae', 'optimizer': 'adam', 'graph_mode': 'off', 'use_snp_selection': False}. Best is trial 85 with value: 0.1235808695724671.
[I 2025-12-05 14:43:45,651] Trial 88 finished with value: 0.10151766903662908 and parameters: {'model_type': 'mlp', 'hidden_dims': '[512, 256]', 'dropout': 0.1416237165285883, 'batch_norm': True, 'lr': 0.0001591338449162793, 'weight_decay': 2.572954716157229e-06, 'epochs': 66, 'loss': 'mae', 'optimizer': 'adam', 'graph_mode': 'off', 'use_snp_selection': False}. Best is trial 85 with value: 0.1235808695724671.
[I 2025-12-05 14:43:48,690] Trial 89 finished with value: 0.10153838321687252 and parameters: {'model_type': 'mlp', 'hidden_dims': '[256, 128]', 'dropout': 0.18979642961883922, 'batch_norm': True, 'lr': 9.240089060343952e-05, 'weight_decay': 5.379348751962643e-06, 'epochs': 81, 'loss': 'mae', 'optimizer': 'adam', 'graph_mode': 'off', 'use_snp_selection': True, 'num_snps': 45058}. Best is trial 85 with value: 0.1235808695724671.
[I 2025-12-05 14:43:50,154] Trial 90 finished with value: 0.09994092866513349 and parameters: {'model_type': 'mlp', 'hidden_dims': '[512, 256]', 'dropout': 0.1654186368837149, 'batch_norm': True, 'lr': 0.00011614627263065859, 'weight_decay': 8.679872496416109e-07, 'epochs': 57, 'loss': 'mae', 'optimizer': 'adam', 'graph_mode': 'off', 'use_snp_selection': False}. Best is trial 85 with value: 0.1235808695724671.
[I 2025-12-05 14:43:52,327] Trial 91 finished with value: 0.0952325699379356 and parameters: {'model_type': 'mlp', 'hidden_dims': '[512, 256]', 'dropout': 0.12156517329246695, 'batch_norm': True, 'lr': 5.4962502305915585e-05, 'weight_decay': 1.5661711416922658e-06, 'epochs': 113, 'loss': 'mae', 'optimizer': 'adam', 'graph_mode': 'off', 'use_snp_selection': False}. Best is trial 85 with value: 0.1235808695724671.
[I 2025-12-05 14:43:54,849] Trial 92 finished with value: 0.10310590502947838 and parameters: {'model_type': 'mlp', 'hidden_dims': '[512, 256]', 'dropout': 0.37049410232513913, 'batch_norm': True, 'lr': 0.0004557286683068844, 'weight_decay': 2.2214882599848563e-06, 'epochs': 143, 'loss': 'mae', 'optimizer': 'adam', 'graph_mode': 'off', 'use_snp_selection': False}. Best is trial 85 with value: 0.1235808695724671.
[I 2025-12-05 14:43:57,669] Trial 93 finished with value: 0.10687051993376326 and parameters: {'model_type': 'mlp', 'hidden_dims': '[512, 256]', 'dropout': 0.2076225913919818, 'batch_norm': True, 'lr': 0.0006410470858484, 'weight_decay': 9.740315542179759e-06, 'epochs': 167, 'loss': 'mae', 'optimizer': 'adam', 'graph_mode': 'off', 'use_snp_selection': False}. Best is trial 85 with value: 0.1235808695724671.
[I 2025-12-05 14:44:00,105] Trial 94 finished with value: 0.10115977138580373 and parameters: {'model_type': 'mlp', 'hidden_dims': '[512, 128]', 'dropout': 0.35185185544504394, 'batch_norm': True, 'lr': 0.0007867085370609292, 'weight_decay': 3.9238279029483897e-07, 'epochs': 136, 'loss': 'mae', 'optimizer': 'adam', 'graph_mode': 'off', 'use_snp_selection': False}. Best is trial 85 with value: 0.1235808695724671.
[I 2025-12-05 14:44:02,193] Trial 95 finished with value: 0.10832180179176991 and parameters: {'model_type': 'mlp', 'hidden_dims': '[512, 256]', 'dropout': 0.15046756884231294, 'batch_norm': True, 'lr': 0.0002768789581267286, 'weight_decay': 1.3012853980887865e-06, 'epochs': 106, 'loss': 'mse', 'optimizer': 'adam', 'graph_mode': 'off', 'use_snp_selection': False}. Best is trial 85 with value: 0.1235808695724671.
[I 2025-12-05 14:44:04,775] Trial 96 finished with value: 0.09772422378520615 and parameters: {'model_type': 'mlp', 'hidden_dims': '[512, 256]', 'dropout': 0.38848354046598, 'batch_norm': True, 'lr': 2.7585165413045963e-05, 'weight_decay': 6.407240902913145e-07, 'epochs': 148, 'loss': 'mse', 'optimizer': 'adam', 'graph_mode': 'off', 'use_snp_selection': False}. Best is trial 85 with value: 0.1235808695724671.
[I 2025-12-05 14:44:05,868] Trial 97 finished with value: 0.09654883873192559 and parameters: {'model_type': 'mlp', 'hidden_dims': '[128, 64]', 'dropout': 0.23164829634749828, 'batch_norm': True, 'lr': 0.00020251612658780146, 'weight_decay': 1.0131860857055383e-07, 'epochs': 156, 'loss': 'mae', 'optimizer': 'adam', 'graph_mode': 'off', 'use_snp_selection': False}. Best is trial 85 with value: 0.1235808695724671.
[I 2025-12-05 14:44:07,322] Trial 98 finished with value: 0.11158301474510328 and parameters: {'model_type': 'mlp', 'hidden_dims': '[256, 128, 64]', 'dropout': 0.11132769025956735, 'batch_norm': True, 'lr': 0.00034964142453521583, 'weight_decay': 3.967512713869666e-06, 'epochs': 119, 'loss': 'mse', 'optimizer': 'adam', 'graph_mode': 'off', 'use_snp_selection': False}. Best is trial 85 with value: 0.1235808695724671.
[I 2025-12-05 14:44:08,856] Trial 99 finished with value: 0.08404897370594723 and parameters: {'model_type': 'mlp', 'hidden_dims': '[256, 128, 64]', 'dropout': 0.1007704796667887, 'batch_norm': True, 'lr': 3.8697074376630254e-05, 'weight_decay': 4.2023795119201654e-06, 'epochs': 124, 'loss': 'mse', 'optimizer': 'adam', 'graph_mode': 'off', 'use_snp_selection': False}. Best is trial 85 with value: 0.1235808695724671.
[I 2025-12-05 14:44:10,180] Trial 100 finished with value: 0.1156832311351754 and parameters: {'model_type': 'mlp', 'hidden_dims': '[256, 128, 64]', 'dropout': 0.13184745198619655, 'batch_norm': True, 'lr': 0.0005357660707078641, 'weight_decay': 3.515313735210262e-06, 'epochs': 100, 'loss': 'mse', 'optimizer': 'adam', 'graph_mode': 'off', 'use_snp_selection': False}. Best is trial 85 with value: 0.1235808695724671.
[I 2025-12-05 14:44:11,521] Trial 101 finished with value: 0.1111225795322619 and parameters: {'model_type': 'mlp', 'hidden_dims': '[256, 128, 64]', 'dropout': 0.1132978583431548, 'batch_norm': True, 'lr': 0.00034788890524848015, 'weight_decay': 6.120539386576039e-06, 'epochs': 98, 'loss': 'mse', 'optimizer': 'adam', 'graph_mode': 'off', 'use_snp_selection': False}. Best is trial 85 with value: 0.1235808695724671.
[I 2025-12-05 14:44:12,754] Trial 102 finished with value: 0.1126232580034397 and parameters: {'model_type': 'mlp', 'hidden_dims': '[256, 128, 64]', 'dropout': 0.13688105292682318, 'batch_norm': True, 'lr': 0.000516084781916357, 'weight_decay': 3.2923810832804726e-06, 'epochs': 87, 'loss': 'mse', 'optimizer': 'adam', 'graph_mode': 'off', 'use_snp_selection': False}. Best is trial 85 with value: 0.1235808695724671.
[I 2025-12-05 14:44:13,945] Trial 103 finished with value: 0.1113040630312378 and parameters: {'model_type': 'mlp', 'hidden_dims': '[256, 128, 64]', 'dropout': 0.13193920352525212, 'batch_norm': True, 'lr': 0.0005601134241225625, 'weight_decay': 2.3990097786866353e-06, 'epochs': 81, 'loss': 'mse', 'optimizer': 'adam', 'graph_mode': 'off', 'use_snp_selection': False}. Best is trial 85 with value: 0.1235808695724671.
[I 2025-12-05 14:44:15,195] Trial 104 finished with value: 0.09728237072751386 and parameters: {'model_type': 'mlp', 'hidden_dims': '[256, 128, 64]', 'dropout': 0.1653967484738582, 'batch_norm': True, 'lr': 0.0001691474321163671, 'weight_decay': 1.8442195463108732e-06, 'epochs': 90, 'loss': 'mse', 'optimizer': 'adam', 'graph_mode': 'off', 'use_snp_selection': False}. Best is trial 85 with value: 0.1235808695724671.
[I 2025-12-05 14:44:16,309] Trial 105 finished with value: 0.11055683091922199 and parameters: {'model_type': 'mlp', 'hidden_dims': '[256, 128, 64]', 'dropout': 0.13625143518339586, 'batch_norm': True, 'lr': 0.0005310133703811715, 'weight_decay': 5.382061587513796e-06, 'epochs': 70, 'loss': 'mse', 'optimizer': 'adam', 'graph_mode': 'off', 'use_snp_selection': False}. Best is trial 85 with value: 0.1235808695724671.
[I 2025-12-05 14:44:17,713] Trial 106 finished with value: 0.10437065659902839 and parameters: {'model_type': 'mlp', 'hidden_dims': '[256, 128, 64]', 'dropout': 0.15579345716398674, 'batch_norm': True, 'lr': 0.0009882916374372274, 'weight_decay': 7.69183694161893e-06, 'epochs': 110, 'loss': 'mse', 'optimizer': 'adam', 'graph_mode': 'off', 'use_snp_selection': False}. Best is trial 85 with value: 0.1235808695724671.
[I 2025-12-05 14:44:19,697] Trial 107 finished with value: 0.11862236039726166 and parameters: {'model_type': 'mlp', 'hidden_dims': '[512, 64]', 'dropout': 0.17885540270966152, 'batch_norm': True, 'lr': 0.0004095176955818995, 'weight_decay': 3.39972499414839e-06, 'epochs': 100, 'loss': 'mse', 'optimizer': 'adam', 'graph_mode': 'off', 'use_snp_selection': False}. Best is trial 85 with value: 0.1235808695724671.
[I 2025-12-05 14:44:23,686] Trial 108 finished with value: 0.10329130914630637 and parameters: {'model_type': 'mlp', 'hidden_dims': '[512, 64]', 'dropout': 0.17684255289981118, 'batch_norm': True, 'lr': 0.00022861065707823914, 'weight_decay': 3.4398969582664703e-06, 'epochs': 103, 'loss': 'mse', 'optimizer': 'adam', 'graph_mode': 'off', 'use_snp_selection': True, 'num_snps': 51558}. Best is trial 85 with value: 0.1235808695724671.
[I 2025-12-05 14:44:25,595] Trial 109 finished with value: 0.11518953724826125 and parameters: {'model_type': 'mlp', 'hidden_dims': '[512, 64]', 'dropout': 0.12580294882026413, 'batch_norm': True, 'lr': 0.00042429023190238387, 'weight_decay': 1.081853591359049e-06, 'epochs': 94, 'loss': 'mse', 'optimizer': 'adam', 'graph_mode': 'off', 'use_snp_selection': False}. Best is trial 85 with value: 0.1235808695724671.
[I 2025-12-05 14:44:27,527] Trial 110 finished with value: 0.10826650489235579 and parameters: {'model_type': 'mlp', 'hidden_dims': '[512, 64]', 'dropout': 0.12573071736578906, 'batch_norm': True, 'lr': 0.00040028220399868704, 'weight_decay': 9.921053856644463e-07, 'epochs': 93, 'loss': 'mse', 'optimizer': 'adam', 'graph_mode': 'off', 'use_snp_selection': False}. Best is trial 85 with value: 0.1235808695724671.
[I 2025-12-05 14:44:29,355] Trial 111 finished with value: 0.10551020569844996 and parameters: {'model_type': 'mlp', 'hidden_dims': '[512, 64]', 'dropout': 0.14032117085353862, 'batch_norm': True, 'lr': 0.000733594549239911, 'weight_decay': 1.3425297601977117e-06, 'epochs': 87, 'loss': 'mse', 'optimizer': 'adam', 'graph_mode': 'off', 'use_snp_selection': False}. Best is trial 85 with value: 0.1235808695724671.
[I 2025-12-05 14:44:31,350] Trial 112 finished with value: 0.10847028020918109 and parameters: {'model_type': 'mlp', 'hidden_dims': '[512, 64]', 'dropout': 0.14892257976319673, 'batch_norm': True, 'lr': 0.0006383089988117056, 'weight_decay': 2.129279127516818e-06, 'epochs': 101, 'loss': 'mse', 'optimizer': 'adam', 'graph_mode': 'off', 'use_snp_selection': False}. Best is trial 85 with value: 0.1235808695724671.
[I 2025-12-05 14:44:33,087] Trial 113 finished with value: 0.11146656722467016 and parameters: {'model_type': 'mlp', 'hidden_dims': '[512, 64]', 'dropout': 0.1620468170037893, 'batch_norm': True, 'lr': 0.0004605446442628643, 'weight_decay': 1.5731606773727976e-06, 'epochs': 80, 'loss': 'mse', 'optimizer': 'adam', 'graph_mode': 'off', 'use_snp_selection': False}. Best is trial 85 with value: 0.1235808695724671.
[I 2025-12-05 14:44:34,565] Trial 114 finished with value: 0.10960637421796665 and parameters: {'model_type': 'mlp', 'hidden_dims': '[512, 64]', 'dropout': 0.12261075394211132, 'batch_norm': True, 'lr': 9.257482206438003e-05, 'weight_decay': 3.0896198126320284e-06, 'epochs': 59, 'loss': 'mse', 'optimizer': 'adam', 'graph_mode': 'off', 'use_snp_selection': False}. Best is trial 85 with value: 0.1235808695724671.
[I 2025-12-05 14:44:35,837] Trial 115 finished with value: 0.11367406003198997 and parameters: {'model_type': 'mlp', 'hidden_dims': '[512, 64]', 'dropout': 0.17022274981885846, 'batch_norm': True, 'lr': 0.0001471405161603486, 'weight_decay': 2.3514538952923128e-06, 'epochs': 42, 'loss': 'mse', 'optimizer': 'adam', 'graph_mode': 'off', 'use_snp_selection': False}. Best is trial 85 with value: 0.1235808695724671.
[I 2025-12-05 14:44:38,150] Trial 116 finished with value: 0.0943601356502224 and parameters: {'model_type': 'mlp', 'hidden_dims': '[512, 64]', 'dropout': 0.18227086915338095, 'batch_norm': False, 'lr': 0.00014454258585451795, 'weight_decay': 7.244830738817903e-07, 'epochs': 128, 'loss': 'mse', 'optimizer': 'adam', 'graph_mode': 'off', 'use_snp_selection': False}. Best is trial 85 with value: 0.1235808695724671.
[I 2025-12-05 14:44:39,420] Trial 117 finished with value: 0.11961641112808004 and parameters: {'model_type': 'mlp', 'hidden_dims': '[512, 64]', 'dropout': 0.17126175012800163, 'batch_norm': True, 'lr': 0.00011816322458122786, 'weight_decay': 1.1730417449144528e-06, 'epochs': 42, 'loss': 'mse', 'optimizer': 'adam', 'graph_mode': 'off', 'use_snp_selection': False}. Best is trial 85 with value: 0.1235808695724671.
