[I 2025-12-05 15:49:44,232] Trial 135 finished with value: 0.051546943232540055 and parameters: {'model_type': 'mlp', 'hidden_dims': '[256, 128]', 'dropout': 0.2697827908421987, 'batch_norm': True, 'lr': 0.0004428450010348177, 'weight_decay': 7.339359533805663e-06, 'epochs': 205, 'loss': 'mse', 'optimizer': 'adam', 'graph_mode': 'off', 'use_snp_selection': False}. Best is trial 102 with value: 0.08464553310069903.
[I 2025-12-05 15:49:45,566] Trial 136 finished with value: 0.06235168906858034 and parameters: {'model_type': 'mlp', 'hidden_dims': '[512, 128]', 'dropout': 0.3045943337424039, 'batch_norm': True, 'lr': 0.0003540554280524872, 'weight_decay': 6.2489126252828395e-06, 'epochs': 186, 'loss': 'mse', 'optimizer': 'adam', 'graph_mode': 'off', 'use_snp_selection': False}. Best is trial 102 with value: 0.08464553310069903.
[I 2025-12-05 15:49:46,293] Trial 137 finished with value: 0.0585918867772515 and parameters: {'model_type': 'mlp', 'hidden_dims': '[128, 64]', 'dropout': 0.24128939122536713, 'batch_norm': True, 'lr': 0.00025049222192327685, 'weight_decay': 4.7438550054314403e-07, 'epochs': 156, 'loss': 'mse', 'optimizer': 'adam', 'graph_mode': 'off', 'use_snp_selection': False}. Best is trial 102 with value: 0.08464553310069903.
[I 2025-12-05 15:49:47,551] Trial 138 finished with value: 0.06831934048051355 and parameters: {'model_type': 'mlp', 'hidden_dims': '[512, 128]', 'dropout': 0.3161606120107299, 'batch_norm': True, 'lr': 0.00047860634641053537, 'weight_decay': 8.852757845837906e-07, 'epochs': 164, 'loss': 'mse', 'optimizer': 'adam', 'graph_mode': 'off', 'use_snp_selection': False}. Best is trial 102 with value: 0.08464553310069903.
[I 2025-12-05 15:49:48,794] Trial 139 finished with value: 0.07151641880389407 and parameters: {'model_type': 'mlp', 'hidden_dims': '[512, 128]', 'dropout': 0.2793552465569085, 'batch_norm': True, 'lr': 0.00013464198539122222, 'weight_decay': 6.508326229171539e-07, 'epochs': 161, 'loss': 'mse', 'optimizer': 'adam', 'graph_mode': 'off', 'use_snp_selection': False}. Best is trial 102 with value: 0.08464553310069903.
[I 2025-12-05 15:49:50,032] Trial 140 finished with value: 0.04211478499972532 and parameters: {'model_type': 'mlp', 'hidden_dims': '[512, 128]', 'dropout': 0.27674926082209045, 'batch_norm': True, 'lr': 0.00011492814807262292, 'weight_decay': 3.420010166929141e-07, 'epochs': 160, 'loss': 'mse', 'optimizer': 'adam', 'graph_mode': 'off', 'use_snp_selection': False}. Best is trial 102 with value: 0.08464553310069903.
[I 2025-12-05 15:49:51,364] Trial 141 finished with value: 0.06037183418557641 and parameters: {'model_type': 'mlp', 'hidden_dims': '[512, 128]', 'dropout': 0.2873370202127976, 'batch_norm': True, 'lr': 0.00020430981284282065, 'weight_decay': 8.340823840305271e-07, 'epochs': 179, 'loss': 'mse', 'optimizer': 'adam', 'graph_mode': 'off', 'use_snp_selection': False}. Best is trial 102 with value: 0.08464553310069903.
[I 2025-12-05 15:49:52,549] Trial 142 finished with value: 0.04176427719279478 and parameters: {'model_type': 'mlp', 'hidden_dims': '[512, 128]', 'dropout': 0.25326448408056434, 'batch_norm': True, 'lr': 0.00013222566605463487, 'weight_decay': 6.297672863623218e-07, 'epochs': 144, 'loss': 'mse', 'optimizer': 'adam', 'graph_mode': 'off', 'use_snp_selection': False}. Best is trial 102 with value: 0.08464553310069903.
[I 2025-12-05 15:49:53,797] Trial 143 finished with value: 0.03755839802304656 and parameters: {'model_type': 'mlp', 'hidden_dims': '[512, 128]', 'dropout': 0.22607846312359117, 'batch_norm': True, 'lr': 0.00016706038812819515, 'weight_decay': 1.2015124943781662e-06, 'epochs': 163, 'loss': 'mse', 'optimizer': 'adam', 'graph_mode': 'off', 'use_snp_selection': False}. Best is trial 102 with value: 0.08464553310069903.
[I 2025-12-05 15:49:55,090] Trial 144 finished with value: 0.05916161690151537 and parameters: {'model_type': 'mlp', 'hidden_dims': '[512, 128]', 'dropout': 0.3165832808512421, 'batch_norm': True, 'lr': 0.00014628313872507262, 'weight_decay': 9.274875641846166e-07, 'epochs': 175, 'loss': 'mse', 'optimizer': 'adam', 'graph_mode': 'off', 'use_snp_selection': False}. Best is trial 102 with value: 0.08464553310069903.
[I 2025-12-05 15:49:56,533] Trial 145 finished with value: 0.05727220258896036 and parameters: {'model_type': 'mlp', 'hidden_dims': '[512, 128]', 'dropout': 0.2934247109297235, 'batch_norm': True, 'lr': 0.0001850848002092245, 'weight_decay': 7.820653702957054e-07, 'epochs': 216, 'loss': 'mse', 'optimizer': 'adam', 'graph_mode': 'off', 'use_snp_selection': False}. Best is trial 102 with value: 0.08464553310069903.
[I 2025-12-05 15:49:57,737] Trial 146 finished with value: 0.07676764961704985 and parameters: {'model_type': 'mlp', 'hidden_dims': '[512, 128]', 'dropout': 0.27913375624251946, 'batch_norm': True, 'lr': 0.00032811477636822026, 'weight_decay': 1.0241590543896057e-06, 'epochs': 150, 'loss': 'mse', 'optimizer': 'adam', 'graph_mode': 'off', 'use_snp_selection': False}. Best is trial 102 with value: 0.08464553310069903.
[I 2025-12-05 15:49:58,952] Trial 147 finished with value: 0.05665875324410162 and parameters: {'model_type': 'mlp', 'hidden_dims': '[512, 128]', 'dropout': 0.27924996042158495, 'batch_norm': True, 'lr': 0.00031488349938739555, 'weight_decay': 5.825073304882343e-07, 'epochs': 153, 'loss': 'mse', 'optimizer': 'adam', 'graph_mode': 'off', 'use_snp_selection': False}. Best is trial 102 with value: 0.08464553310069903.
[I 2025-12-05 15:50:00,248] Trial 148 finished with value: 0.0665423847666285 and parameters: {'model_type': 'mlp', 'hidden_dims': '[512, 128]', 'dropout': 0.2655126801224808, 'batch_norm': True, 'lr': 0.00022747203608321535, 'weight_decay': 1.3753703331790236e-06, 'epochs': 167, 'loss': 'mse', 'optimizer': 'adam', 'graph_mode': 'off', 'use_snp_selection': False}. Best is trial 102 with value: 0.08464553310069903.
[I 2025-12-05 15:50:01,524] Trial 149 finished with value: 0.05619429254952419 and parameters: {'model_type': 'mlp', 'hidden_dims': '[512, 128]', 'dropout': 0.2649791512389633, 'batch_norm': True, 'lr': 0.00022497721584889977, 'weight_decay': 6.753776409575436e-07, 'epochs': 170, 'loss': 'mse', 'optimizer': 'adam', 'graph_mode': 'off', 'use_snp_selection': False}. Best is trial 102 with value: 0.08464553310069903.
[I 2025-12-05 15:50:03,616] Trial 0 finished with value: -0.008925913383792831 and parameters: {'model_type': 'mlp', 'hidden_dims': '[128, 64]', 'dropout': 0.199031432379812, 'batch_norm': True, 'lr': 1.8408544111075837e-06, 'weight_decay': 5.5136510071208614e-05, 'epochs': 336, 'loss': 'mae', 'optimizer': 'adam', 'graph_mode': 'off', 'use_snp_selection': True, 'num_snps': 43862}. Best is trial 0 with value: -0.008925913383792831.
[I 2025-12-05 15:50:04,587] Trial 1 finished with value: 0.09531143802456193 and parameters: {'model_type': 'mlp', 'hidden_dims': '[256, 128]', 'dropout': 0.4370668075331726, 'batch_norm': True, 'lr': 7.133471581159139e-05, 'weight_decay': 1.128633586803549e-05, 'epochs': 242, 'loss': 'mae', 'optimizer': 'adam', 'graph_mode': 'off', 'use_snp_selection': False}. Best is trial 1 with value: 0.09531143802456193.
[I 2025-12-05 15:50:05,538] Trial 2 finished with value: 0.027749402286773146 and parameters: {'model_type': 'mlp', 'hidden_dims': '[256, 128, 64]', 'dropout': 0.41314357415569625, 'batch_norm': False, 'lr': 3.952233718592101e-06, 'weight_decay': 0.00026754769258252603, 'epochs': 149, 'loss': 'mse', 'optimizer': 'adam', 'graph_mode': 'off', 'use_snp_selection': True, 'num_snps': 11571}. Best is trial 1 with value: 0.09531143802456193.
[I 2025-12-05 15:50:07,197] Trial 3 finished with value: 0.04151853019893001 and parameters: {'model_type': 'mlp', 'hidden_dims': '[512, 64]', 'dropout': 0.5938127374509361, 'batch_norm': False, 'lr': 5.67704586114731e-06, 'weight_decay': 2.4518087630137052e-05, 'epochs': 320, 'loss': 'mae', 'optimizer': 'adam', 'graph_mode': 'off', 'use_snp_selection': False}. Best is trial 1 with value: 0.09531143802456193.
[I 2025-12-05 15:50:09,194] Trial 4 finished with value: 0.057999584192617054 and parameters: {'model_type': 'mlp', 'hidden_dims': '[512, 128]', 'dropout': 0.25746343592134413, 'batch_norm': True, 'lr': 1.3467657668402788e-06, 'weight_decay': 0.00033087251918647806, 'epochs': 277, 'loss': 'mse', 'optimizer': 'adam', 'graph_mode': 'off', 'use_snp_selection': True, 'num_snps': 36675}. Best is trial 1 with value: 0.09531143802456193.
[I 2025-12-05 15:50:10,809] Trial 5 finished with value: 0.0625611060366036 and parameters: {'model_type': 'mlp', 'hidden_dims': '[512, 64]', 'dropout': 0.38275350994408375, 'batch_norm': True, 'lr': 1.5586664309232824e-06, 'weight_decay': 0.0008227664668621182, 'epochs': 145, 'loss': 'mae', 'optimizer': 'adam', 'graph_mode': 'off', 'use_snp_selection': True, 'num_snps': 32148}. Best is trial 1 with value: 0.09531143802456193.
[I 2025-12-05 15:50:11,700] Trial 6 finished with value: 0.03221162563079064 and parameters: {'model_type': 'mlp', 'hidden_dims': '[256, 128]', 'dropout': 0.3930109900265879, 'batch_norm': False, 'lr': 4.892964372128395e-05, 'weight_decay': 1.5809549317992182e-06, 'epochs': 199, 'loss': 'mse', 'optimizer': 'adam', 'graph_mode': 'off', 'use_snp_selection': False}. Best is trial 1 with value: 0.09531143802456193.
[I 2025-12-05 15:50:12,668] Trial 7 finished with value: 0.09909187462495968 and parameters: {'model_type': 'mlp', 'hidden_dims': '[512, 256]', 'dropout': 0.15343979219678458, 'batch_norm': True, 'lr': 6.234003099047341e-05, 'weight_decay': 3.894760610535477e-07, 'epochs': 97, 'loss': 'mse', 'optimizer': 'adam', 'graph_mode': 'off', 'use_snp_selection': False}. Best is trial 7 with value: 0.09909187462495968.
[I 2025-12-05 15:50:14,323] Trial 8 finished with value: 0.09140391913238845 and parameters: {'model_type': 'mlp', 'hidden_dims': '[512, 128]', 'dropout': 0.10743001231661406, 'batch_norm': True, 'lr': 0.00023728538449271062, 'weight_decay': 1.7629071578048637e-05, 'epochs': 312, 'loss': 'mae', 'optimizer': 'adam', 'graph_mode': 'off', 'use_snp_selection': False}. Best is trial 7 with value: 0.09909187462495968.
[I 2025-12-05 15:50:15,534] Trial 9 finished with value: 0.10375698083264719 and parameters: {'model_type': 'mlp', 'hidden_dims': '[512, 64]', 'dropout': 0.14505336736221927, 'batch_norm': True, 'lr': 5.8619638388111826e-05, 'weight_decay': 6.200156172669308e-07, 'epochs': 175, 'loss': 'mse', 'optimizer': 'adam', 'graph_mode': 'off', 'use_snp_selection': False}. Best is trial 9 with value: 0.10375698083264719.
[I 2025-12-05 15:50:16,364] Trial 10 finished with value: 0.011723761544795128 and parameters: {'model_type': 'mlp', 'hidden_dims': '[512, 64]', 'dropout': 0.27531666245262887, 'batch_norm': False, 'lr': 0.00032393778075602147, 'weight_decay': 1.1714031539166647e-07, 'epochs': 44, 'loss': 'mse', 'optimizer': 'adam', 'graph_mode': 'off', 'use_snp_selection': False}. Best is trial 9 with value: 0.10375698083264719.
[I 2025-12-05 15:50:17,248] Trial 11 finished with value: 0.06811673888083082 and parameters: {'model_type': 'mlp', 'hidden_dims': '[512, 256]', 'dropout': 0.10095648685224448, 'batch_norm': True, 'lr': 1.6474108386126448e-05, 'weight_decay': 6.203180869264506e-07, 'epochs': 67, 'loss': 'mse', 'optimizer': 'adam', 'graph_mode': 'off', 'use_snp_selection': False}. Best is trial 9 with value: 0.10375698083264719.
[I 2025-12-05 15:50:18,257] Trial 12 finished with value: 0.09762325492087792 and parameters: {'model_type': 'mlp', 'hidden_dims': '[512, 256]', 'dropout': 0.1977119287227368, 'batch_norm': True, 'lr': 0.000121041789182661, 'weight_decay': 1.2192432071058163e-06, 'epochs': 106, 'loss': 'mse', 'optimizer': 'adam', 'graph_mode': 'off', 'use_snp_selection': False}. Best is trial 9 with value: 0.10375698083264719.
[I 2025-12-05 15:50:19,503] Trial 13 finished with value: 0.08536381895114299 and parameters: {'model_type': 'mlp', 'hidden_dims': '[512, 256]', 'dropout': 0.17892004217860003, 'batch_norm': True, 'lr': 1.9472380101128875e-05, 'weight_decay': 1.1026057540153843e-07, 'epochs': 181, 'loss': 'mse', 'optimizer': 'adam', 'graph_mode': 'off', 'use_snp_selection': False}. Best is trial 9 with value: 0.10375698083264719.
[I 2025-12-05 15:50:20,150] Trial 14 finished with value: 0.10441694267304848 and parameters: {'model_type': 'mlp', 'hidden_dims': '[128, 64]', 'dropout': 0.3012984444538551, 'batch_norm': True, 'lr': 0.0006681578335050954, 'weight_decay': 4.814764599662762e-07, 'epochs': 105, 'loss': 'mse', 'optimizer': 'adam', 'graph_mode': 'off', 'use_snp_selection': False}. Best is trial 14 with value: 0.10441694267304848.
[I 2025-12-05 15:50:20,968] Trial 15 finished with value: 0.10744925226569489 and parameters: {'model_type': 'mlp', 'hidden_dims': '[128, 64]', 'dropout': 0.3075458114455759, 'batch_norm': True, 'lr': 0.0006317465611898928, 'weight_decay': 3.2179532533076768e-06, 'epochs': 231, 'loss': 'mse', 'optimizer': 'adam', 'graph_mode': 'off', 'use_snp_selection': False}. Best is trial 15 with value: 0.10744925226569489.
[I 2025-12-05 15:50:21,808] Trial 16 finished with value: 0.10726073879803166 and parameters: {'model_type': 'mlp', 'hidden_dims': '[128, 64]', 'dropout': 0.30783495887215145, 'batch_norm': True, 'lr': 0.0009200541192959166, 'weight_decay': 5.098763140321504e-06, 'epochs': 228, 'loss': 'mse', 'optimizer': 'adam', 'graph_mode': 'off', 'use_snp_selection': False}. Best is trial 15 with value: 0.10744925226569489.
[I 2025-12-05 15:50:22,647] Trial 17 finished with value: 0.10066637320200332 and parameters: {'model_type': 'mlp', 'hidden_dims': '[128, 64]', 'dropout': 0.49276230228315465, 'batch_norm': True, 'lr': 0.000906375209920231, 'weight_decay': 2.5731493482963297e-06, 'epochs': 239, 'loss': 'mse', 'optimizer': 'adam', 'graph_mode': 'off', 'use_snp_selection': False}. Best is trial 15 with value: 0.10744925226569489.
[I 2025-12-05 15:50:24,922] Trial 18 finished with value: 0.03656216283082696 and parameters: {'model_type': 'mlp', 'hidden_dims': '[128, 64]', 'dropout': 0.31660641646325327, 'batch_norm': False, 'lr': 0.0003604174919270397, 'weight_decay': 4.680306832873293e-06, 'epochs': 230, 'loss': 'mse', 'optimizer': 'adam', 'graph_mode': 'off', 'use_snp_selection': True, 'num_snps': 58241}. Best is trial 15 with value: 0.10744925226569489.
[I 2025-12-05 15:50:25,799] Trial 19 finished with value: 0.09684964911771657 and parameters: {'model_type': 'mlp', 'hidden_dims': '[128, 64]', 'dropout': 0.23740597688310255, 'batch_norm': True, 'lr': 0.00014334793979738487, 'weight_decay': 5.029686194801873e-06, 'epochs': 282, 'loss': 'mse', 'optimizer': 'adam', 'graph_mode': 'off', 'use_snp_selection': False}. Best is trial 15 with value: 0.10744925226569489.
[I 2025-12-05 15:50:26,762] Trial 20 finished with value: 0.1133368848200781 and parameters: {'model_type': 'mlp', 'hidden_dims': '[256, 128, 64]', 'dropout': 0.3449118028392856, 'batch_norm': True, 'lr': 0.0005248911062997444, 'weight_decay': 4.679666515308887e-05, 'epochs': 213, 'loss': 'mse', 'optimizer': 'adam', 'graph_mode': 'off', 'use_snp_selection': False}. Best is trial 20 with value: 0.1133368848200781.
[I 2025-12-05 15:50:27,794] Trial 21 finished with value: 0.10515330346469356 and parameters: {'model_type': 'mlp', 'hidden_dims': '[256, 128, 64]', 'dropout': 0.3426036956588672, 'batch_norm': True, 'lr': 0.0005403878844544843, 'weight_decay': 6.331291676273367e-05, 'epochs': 264, 'loss': 'mse', 'optimizer': 'adam', 'graph_mode': 'off', 'use_snp_selection': False}. Best is trial 20 with value: 0.1133368848200781.
[I 2025-12-05 15:50:28,731] Trial 22 finished with value: 0.10101742239674741 and parameters: {'model_type': 'mlp', 'hidden_dims': '[256, 128, 64]', 'dropout': 0.47089334652169845, 'batch_norm': True, 'lr': 0.0009543657940879833, 'weight_decay': 4.6881323524619394e-05, 'epochs': 210, 'loss': 'mse', 'optimizer': 'adam', 'graph_mode': 'off', 'use_snp_selection': False}. Best is trial 20 with value: 0.1133368848200781.
[I 2025-12-05 15:50:29,670] Trial 23 finished with value: 0.11977490981415422 and parameters: {'model_type': 'mlp', 'hidden_dims': '[256, 128, 64]', 'dropout': 0.35659654727474116, 'batch_norm': True, 'lr': 0.000194839884545945, 'weight_decay': 7.117533735813737e-06, 'epochs': 215, 'loss': 'mse', 'optimizer': 'adam', 'graph_mode': 'off', 'use_snp_selection': False}. Best is trial 23 with value: 0.11977490981415422.
[I 2025-12-05 15:50:30,509] Trial 24 finished with value: 0.09973153001450723 and parameters: {'model_type': 'mlp', 'hidden_dims': '[256, 128, 64]', 'dropout': 0.36665683831765294, 'batch_norm': True, 'lr': 0.00019701296246933678, 'weight_decay': 2.7360718870784588e-05, 'epochs': 159, 'loss': 'mse', 'optimizer': 'adam', 'graph_mode': 'off', 'use_snp_selection': False}. Best is trial 23 with value: 0.11977490981415422.
[I 2025-12-05 15:50:31,452] Trial 25 finished with value: 0.09093066108265821 and parameters: {'model_type': 'mlp', 'hidden_dims': '[256, 128, 64]', 'dropout': 0.34396785273900465, 'batch_norm': True, 'lr': 0.0004345994244700227, 'weight_decay': 0.00011857505337527573, 'epochs': 203, 'loss': 'mse', 'optimizer': 'adam', 'graph_mode': 'off', 'use_snp_selection': False}. Best is trial 23 with value: 0.11977490981415422.
[I 2025-12-05 15:50:32,454] Trial 26 finished with value: -0.004148635635179922 and parameters: {'model_type': 'mlp', 'hidden_dims': '[256, 128, 64]', 'dropout': 0.5270046763413629, 'batch_norm': True, 'lr': 0.0001193503104925154, 'weight_decay': 7.29088623631245e-06, 'epochs': 275, 'loss': 'mse', 'optimizer': 'adam', 'graph_mode': 'off', 'use_snp_selection': True, 'num_snps': 3842}. Best is trial 23 with value: 0.11977490981415422.
[I 2025-12-05 15:50:33,453] Trial 27 finished with value: 0.032402198314365006 and parameters: {'model_type': 'mlp', 'hidden_dims': '[256, 128, 64]', 'dropout': 0.43758911779469883, 'batch_norm': False, 'lr': 0.00019402753686625741, 'weight_decay': 1.1665225380730334e-05, 'epochs': 258, 'loss': 'mae', 'optimizer': 'adam', 'graph_mode': 'off', 'use_snp_selection': False}. Best is trial 23 with value: 0.11977490981415422.
[I 2025-12-05 15:50:34,329] Trial 28 finished with value: 0.09632757202493471 and parameters: {'model_type': 'mlp', 'hidden_dims': '[256, 128, 64]', 'dropout': 0.22806074942488175, 'batch_norm': True, 'lr': 0.0003087756969849982, 'weight_decay': 0.00011837572117061313, 'epochs': 178, 'loss': 'mse', 'optimizer': 'adam', 'graph_mode': 'off', 'use_snp_selection': False}. Best is trial 23 with value: 0.11977490981415422.
[I 2025-12-05 15:50:35,694] Trial 29 finished with value: 0.08125738864805684 and parameters: {'model_type': 'mlp', 'hidden_dims': '[256, 128]', 'dropout': 0.28706123720507243, 'batch_norm': True, 'lr': 0.0005388560200940643, 'weight_decay': 2.1819302107535844e-06, 'epochs': 297, 'loss': 'mae', 'optimizer': 'adam', 'graph_mode': 'off', 'use_snp_selection': True, 'num_snps': 19468}. Best is trial 23 with value: 0.11977490981415422.
[I 2025-12-05 15:50:37,052] Trial 30 finished with value: 0.06743999493302137 and parameters: {'model_type': 'mlp', 'hidden_dims': '[512, 128]', 'dropout': 0.3321360820616691, 'batch_norm': True, 'lr': 3.0219171795809596e-05, 'weight_decay': 5.371565204879276e-05, 'epochs': 216, 'loss': 'mse', 'optimizer': 'adam', 'graph_mode': 'off', 'use_snp_selection': False}. Best is trial 23 with value: 0.11977490981415422.
[I 2025-12-05 15:50:37,852] Trial 31 finished with value: 0.0981461832141975 and parameters: {'model_type': 'mlp', 'hidden_dims': '[128, 64]', 'dropout': 0.3110651721343159, 'batch_norm': True, 'lr': 0.00071919420823596, 'weight_decay': 2.9801921501524464e-06, 'epochs': 224, 'loss': 'mse', 'optimizer': 'adam', 'graph_mode': 'off', 'use_snp_selection': False}. Best is trial 23 with value: 0.11977490981415422.
[I 2025-12-05 15:50:38,670] Trial 32 finished with value: 0.08467362455479709 and parameters: {'model_type': 'mlp', 'hidden_dims': '[128, 64]', 'dropout': 0.3620870687489563, 'batch_norm': True, 'lr': 0.00047569327344179326, 'weight_decay': 8.512114790184798e-06, 'epochs': 236, 'loss': 'mse', 'optimizer': 'adam', 'graph_mode': 'off', 'use_snp_selection': False}. Best is trial 23 with value: 0.11977490981415422.
[I 2025-12-05 15:50:39,512] Trial 33 finished with value: 0.10495365711254707 and parameters: {'model_type': 'mlp', 'hidden_dims': '[128, 64]', 'dropout': 0.4056194601374864, 'batch_norm': True, 'lr': 0.0009490611843540828, 'weight_decay': 1.5136275940748909e-05, 'epochs': 254, 'loss': 'mse', 'optimizer': 'adam', 'graph_mode': 'off', 'use_snp_selection': False}. Best is trial 23 with value: 0.11977490981415422.
[I 2025-12-05 15:50:40,275] Trial 34 finished with value: 0.10176876547359898 and parameters: {'model_type': 'mlp', 'hidden_dims': '[128, 64]', 'dropout': 0.43146040792692775, 'batch_norm': True, 'lr': 9.401096446039106e-05, 'weight_decay': 2.7074520598719792e-05, 'epochs': 191, 'loss': 'mae', 'optimizer': 'adam', 'graph_mode': 'off', 'use_snp_selection': False}. Best is trial 23 with value: 0.11977490981415422.
[I 2025-12-05 15:50:41,257] Trial 35 finished with value: 0.056690124781396775 and parameters: {'model_type': 'mlp', 'hidden_dims': '[256, 128, 64]', 'dropout': 0.26320067289659854, 'batch_norm': False, 'lr': 0.000263755885760847, 'weight_decay': 4.776282286501531e-06, 'epochs': 248, 'loss': 'mse', 'optimizer': 'adam', 'graph_mode': 'off', 'use_snp_selection': False}. Best is trial 23 with value: 0.11977490981415422.
[I 2025-12-05 15:50:43,546] Trial 36 finished with value: 0.023769209596361248 and parameters: {'model_type': 'mlp', 'hidden_dims': '[256, 128]', 'dropout': 0.23401547682899987, 'batch_norm': True, 'lr': 6.380446803916078e-06, 'weight_decay': 9.904908356402637e-07, 'epochs': 131, 'loss': 'mse', 'optimizer': 'adam', 'graph_mode': 'off', 'use_snp_selection': True, 'num_snps': 58661}. Best is trial 23 with value: 0.11977490981415422.
