[I 2025-12-05 15:50:44,501] Trial 37 finished with value: 0.09767899546602066 and parameters: {'model_type': 'mlp', 'hidden_dims': '[128, 64]', 'dropout': 0.37520160041279854, 'batch_norm': True, 'lr': 0.0006509502433305438, 'weight_decay': 7.290690612321234e-06, 'epochs': 329, 'loss': 'mae', 'optimizer': 'adam', 'graph_mode': 'off', 'use_snp_selection': False}. Best is trial 23 with value: 0.11977490981415422.
[I 2025-12-05 15:50:45,666] Trial 38 finished with value: 0.05955237390213307 and parameters: {'model_type': 'mlp', 'hidden_dims': '[256, 128, 64]', 'dropout': 0.32458517441985946, 'batch_norm': False, 'lr': 0.00017228358888587617, 'weight_decay': 0.0003065497152065842, 'epochs': 159, 'loss': 'mse', 'optimizer': 'adam', 'graph_mode': 'off', 'use_snp_selection': True, 'num_snps': 19911}. Best is trial 23 with value: 0.11977490981415422.
[I 2025-12-05 15:50:47,037] Trial 39 finished with value: 0.05584893236629478 and parameters: {'model_type': 'mlp', 'hidden_dims': '[512, 128]', 'dropout': 0.593444752072398, 'batch_norm': True, 'lr': 2.4072341702654822e-06, 'weight_decay': 0.00012645408476787598, 'epochs': 223, 'loss': 'mse', 'optimizer': 'adam', 'graph_mode': 'off', 'use_snp_selection': False}. Best is trial 23 with value: 0.11977490981415422.
[I 2025-12-05 15:50:48,048] Trial 40 finished with value: 0.1017928641965417 and parameters: {'model_type': 'mlp', 'hidden_dims': '[128, 64]', 'dropout': 0.2846109283124002, 'batch_norm': True, 'lr': 0.0004138972301039122, 'weight_decay': 2.453182755912325e-07, 'epochs': 349, 'loss': 'mae', 'optimizer': 'adam', 'graph_mode': 'off', 'use_snp_selection': False}. Best is trial 23 with value: 0.11977490981415422.
[I 2025-12-05 15:50:49,089] Trial 41 finished with value: 0.0952520996734951 and parameters: {'model_type': 'mlp', 'hidden_dims': '[256, 128, 64]', 'dropout': 0.34969851542085717, 'batch_norm': True, 'lr': 0.0005263602334962975, 'weight_decay': 3.692017577507803e-05, 'epochs': 268, 'loss': 'mse', 'optimizer': 'adam', 'graph_mode': 'off', 'use_snp_selection': False}. Best is trial 23 with value: 0.11977490981415422.
[I 2025-12-05 15:50:50,183] Trial 42 finished with value: 0.09608026351803524 and parameters: {'model_type': 'mlp', 'hidden_dims': '[256, 128, 64]', 'dropout': 0.3996414961699289, 'batch_norm': True, 'lr': 0.0006981189577406202, 'weight_decay': 8.090414641192755e-05, 'epochs': 299, 'loss': 'mse', 'optimizer': 'adam', 'graph_mode': 'off', 'use_snp_selection': False}. Best is trial 23 with value: 0.11977490981415422.
[I 2025-12-05 15:50:51,093] Trial 43 finished with value: 0.0973040251676846 and parameters: {'model_type': 'mlp', 'hidden_dims': '[256, 128, 64]', 'dropout': 0.3373294731259212, 'batch_norm': True, 'lr': 0.000311672024048788, 'weight_decay': 1.6765883903918987e-05, 'epochs': 196, 'loss': 'mse', 'optimizer': 'adam', 'graph_mode': 'off', 'use_snp_selection': False}. Best is trial 23 with value: 0.11977490981415422.
[I 2025-12-05 15:50:52,536] Trial 44 finished with value: 0.11458442702531332 and parameters: {'model_type': 'mlp', 'hidden_dims': '[512, 64]', 'dropout': 0.29879482550258424, 'batch_norm': True, 'lr': 0.0005184943669437907, 'weight_decay': 0.0001694478792900455, 'epochs': 247, 'loss': 'mse', 'optimizer': 'adam', 'graph_mode': 'off', 'use_snp_selection': False}. Best is trial 23 with value: 0.11977490981415422.
[I 2025-12-05 15:50:53,955] Trial 45 finished with value: 0.10268109033915981 and parameters: {'model_type': 'mlp', 'hidden_dims': '[512, 64]', 'dropout': 0.29941407848242807, 'batch_norm': True, 'lr': 0.0002300226355390722, 'weight_decay': 0.0005694501615962997, 'epochs': 238, 'loss': 'mse', 'optimizer': 'adam', 'graph_mode': 'off', 'use_snp_selection': False}. Best is trial 23 with value: 0.11977490981415422.
[I 2025-12-05 15:50:55,302] Trial 46 finished with value: 0.10177256574302011 and parameters: {'model_type': 'mlp', 'hidden_dims': '[512, 64]', 'dropout': 0.25499049409557367, 'batch_norm': True, 'lr': 0.0009914703096329518, 'weight_decay': 0.0004999150481672966, 'epochs': 216, 'loss': 'mse', 'optimizer': 'adam', 'graph_mode': 'off', 'use_snp_selection': False}. Best is trial 23 with value: 0.11977490981415422.
[I 2025-12-05 15:50:56,850] Trial 47 finished with value: 0.033077112024216315 and parameters: {'model_type': 'mlp', 'hidden_dims': '[512, 64]', 'dropout': 0.4197167682335299, 'batch_norm': False, 'lr': 0.0003368406379275874, 'weight_decay': 0.00020626393915515188, 'epochs': 285, 'loss': 'mse', 'optimizer': 'adam', 'graph_mode': 'off', 'use_snp_selection': False}. Best is trial 23 with value: 0.11977490981415422.
[I 2025-12-05 15:50:58,114] Trial 48 finished with value: 0.08379350934813654 and parameters: {'model_type': 'mlp', 'hidden_dims': '[512, 64]', 'dropout': 0.37389782820096196, 'batch_norm': True, 'lr': 9.54276529987195e-05, 'weight_decay': 3.5705764913889526e-06, 'epochs': 189, 'loss': 'mse', 'optimizer': 'adam', 'graph_mode': 'off', 'use_snp_selection': False}. Best is trial 23 with value: 0.11977490981415422.
[I 2025-12-05 15:51:00,529] Trial 49 finished with value: 0.09328892603731408 and parameters: {'model_type': 'mlp', 'hidden_dims': '[512, 256]', 'dropout': 0.20454689224962613, 'batch_norm': True, 'lr': 0.0007412045655548084, 'weight_decay': 9.640867194657468e-07, 'epochs': 247, 'loss': 'mse', 'optimizer': 'adam', 'graph_mode': 'off', 'use_snp_selection': True, 'num_snps': 46888}. Best is trial 23 with value: 0.11977490981415422.
[I 2025-12-05 15:51:01,463] Trial 50 finished with value: 0.10267968266166973 and parameters: {'model_type': 'mlp', 'hidden_dims': '[256, 128]', 'dropout': 0.2668391393920788, 'batch_norm': True, 'lr': 0.0004322158699830267, 'weight_decay': 1.6065191854145354e-06, 'epochs': 207, 'loss': 'mse', 'optimizer': 'adam', 'graph_mode': 'off', 'use_snp_selection': False}. Best is trial 23 with value: 0.11977490981415422.
[I 2025-12-05 15:51:02,490] Trial 51 finished with value: 0.11437948810195178 and parameters: {'model_type': 'mlp', 'hidden_dims': '[256, 128, 64]', 'dropout': 0.30432454860088864, 'batch_norm': True, 'lr': 0.0005923597716868192, 'weight_decay': 8.431196944962615e-05, 'epochs': 256, 'loss': 'mse', 'optimizer': 'adam', 'graph_mode': 'off', 'use_snp_selection': False}. Best is trial 23 with value: 0.11977490981415422.
[I 2025-12-05 15:51:03,891] Trial 52 finished with value: 0.10436880064185057 and parameters: {'model_type': 'mlp', 'hidden_dims': '[512, 64]', 'dropout': 0.3001761770443375, 'batch_norm': True, 'lr': 0.0005849568728739684, 'weight_decay': 0.00020486880622671893, 'epochs': 229, 'loss': 'mse', 'optimizer': 'adam', 'graph_mode': 'off', 'use_snp_selection': False}. Best is trial 23 with value: 0.11977490981415422.
[I 2025-12-05 15:51:05,392] Trial 53 finished with value: 0.11177113269489894 and parameters: {'model_type': 'mlp', 'hidden_dims': '[512, 128]', 'dropout': 0.38899164646598966, 'batch_norm': True, 'lr': 0.00025445417397012773, 'weight_decay': 8.78966829313623e-05, 'epochs': 250, 'loss': 'mse', 'optimizer': 'adam', 'graph_mode': 'off', 'use_snp_selection': False}. Best is trial 23 with value: 0.11977490981415422.
[I 2025-12-05 15:51:06,902] Trial 54 finished with value: 0.04911677848639316 and parameters: {'model_type': 'mlp', 'hidden_dims': '[512, 128]', 'dropout': 0.38780587648108755, 'batch_norm': True, 'lr': 4.3905665257410236e-05, 'weight_decay': 8.397321142361979e-05, 'epochs': 263, 'loss': 'mse', 'optimizer': 'adam', 'graph_mode': 'off', 'use_snp_selection': False}. Best is trial 23 with value: 0.11977490981415422.
[I 2025-12-05 15:51:08,524] Trial 55 finished with value: 0.09819662972308402 and parameters: {'model_type': 'mlp', 'hidden_dims': '[512, 128]', 'dropout': 0.3565162797012423, 'batch_norm': True, 'lr': 0.00025200745539842085, 'weight_decay': 0.00016932686291448162, 'epochs': 299, 'loss': 'mse', 'optimizer': 'adam', 'graph_mode': 'off', 'use_snp_selection': False}. Best is trial 23 with value: 0.11977490981415422.
[I 2025-12-05 15:51:09,978] Trial 56 finished with value: 0.09902539908884496 and parameters: {'model_type': 'mlp', 'hidden_dims': '[512, 128]', 'dropout': 0.449810222978798, 'batch_norm': True, 'lr': 0.00014930805041332902, 'weight_decay': 4.000471182177748e-05, 'epochs': 245, 'loss': 'mse', 'optimizer': 'adam', 'graph_mode': 'off', 'use_snp_selection': False}. Best is trial 23 with value: 0.11977490981415422.
[I 2025-12-05 15:51:10,846] Trial 57 finished with value: 0.09916370187679026 and parameters: {'model_type': 'mlp', 'hidden_dims': '[256, 128, 64]', 'dropout': 0.32801755408071154, 'batch_norm': True, 'lr': 0.0003761306967409958, 'weight_decay': 7.842181495730036e-05, 'epochs': 168, 'loss': 'mse', 'optimizer': 'adam', 'graph_mode': 'off', 'use_snp_selection': False}. Best is trial 23 with value: 0.11977490981415422.
[I 2025-12-05 15:51:12,383] Trial 58 finished with value: 0.08267338613475368 and parameters: {'model_type': 'mlp', 'hidden_dims': '[512, 128]', 'dropout': 0.28366307268670526, 'batch_norm': False, 'lr': 1.0795446007347502e-05, 'weight_decay': 0.0005049034925029443, 'epochs': 274, 'loss': 'mse', 'optimizer': 'adam', 'graph_mode': 'off', 'use_snp_selection': False}. Best is trial 23 with value: 0.11977490981415422.
[I 2025-12-05 15:51:13,966] Trial 59 finished with value: 0.09382998652683439 and parameters: {'model_type': 'mlp', 'hidden_dims': '[512, 256]', 'dropout': 0.38712464854624623, 'batch_norm': True, 'lr': 0.00026957378695582814, 'weight_decay': 2.1042614820608693e-05, 'epochs': 286, 'loss': 'mae', 'optimizer': 'adam', 'graph_mode': 'off', 'use_snp_selection': False}. Best is trial 23 with value: 0.11977490981415422.
[I 2025-12-05 15:51:14,993] Trial 60 finished with value: 0.10221133151023788 and parameters: {'model_type': 'mlp', 'hidden_dims': '[256, 128, 64]', 'dropout': 0.24507233342787904, 'batch_norm': True, 'lr': 0.0002161021556308089, 'weight_decay': 0.0008032949547464452, 'epochs': 255, 'loss': 'mse', 'optimizer': 'adam', 'graph_mode': 'off', 'use_snp_selection': False}. Best is trial 23 with value: 0.11977490981415422.
[I 2025-12-05 15:51:15,798] Trial 61 finished with value: 0.09756618401506251 and parameters: {'model_type': 'mlp', 'hidden_dims': '[128, 64]', 'dropout': 0.315786733141349, 'batch_norm': True, 'lr': 0.0008506739309394558, 'weight_decay': 1.1892232567022598e-05, 'epochs': 218, 'loss': 'mse', 'optimizer': 'adam', 'graph_mode': 'off', 'use_snp_selection': False}. Best is trial 23 with value: 0.11977490981415422.
[I 2025-12-05 15:51:16,742] Trial 62 finished with value: 0.11944291272679036 and parameters: {'model_type': 'mlp', 'hidden_dims': '[256, 128, 64]', 'dropout': 0.30504737644622354, 'batch_norm': True, 'lr': 0.000584900040647221, 'weight_decay': 2.0345077159710346e-06, 'epochs': 210, 'loss': 'mse', 'optimizer': 'adam', 'graph_mode': 'off', 'use_snp_selection': False}. Best is trial 23 with value: 0.11977490981415422.
[I 2025-12-05 15:51:17,675] Trial 63 finished with value: 0.10042960652107075 and parameters: {'model_type': 'mlp', 'hidden_dims': '[256, 128, 64]', 'dropout': 0.2168195536336887, 'batch_norm': True, 'lr': 0.0005628334338319407, 'weight_decay': 1.691260471988101e-06, 'epochs': 205, 'loss': 'mse', 'optimizer': 'adam', 'graph_mode': 'off', 'use_snp_selection': False}. Best is trial 23 with value: 0.11977490981415422.
[I 2025-12-05 15:51:18,693] Trial 64 finished with value: 0.10604223174888389 and parameters: {'model_type': 'mlp', 'hidden_dims': '[256, 128, 64]', 'dropout': 0.3608573633156324, 'batch_norm': True, 'lr': 0.0004035315312682536, 'weight_decay': 3.6408774806981565e-06, 'epochs': 235, 'loss': 'mse', 'optimizer': 'adam', 'graph_mode': 'off', 'use_snp_selection': False}. Best is trial 23 with value: 0.11977490981415422.
[I 2025-12-05 15:51:19,593] Trial 65 finished with value: 0.09071529098542813 and parameters: {'model_type': 'mlp', 'hidden_dims': '[256, 128, 64]', 'dropout': 0.29602703241728406, 'batch_norm': True, 'lr': 0.0004740351104446531, 'weight_decay': 0.00012896373737181623, 'epochs': 184, 'loss': 'mse', 'optimizer': 'adam', 'graph_mode': 'off', 'use_snp_selection': False}. Best is trial 23 with value: 0.11977490981415422.
[I 2025-12-05 15:51:21,003] Trial 66 finished with value: 0.08427026727380214 and parameters: {'model_type': 'mlp', 'hidden_dims': '[256, 128, 64]', 'dropout': 0.27402540420232835, 'batch_norm': True, 'lr': 0.0003177006130844563, 'weight_decay': 0.00036246817768370717, 'epochs': 200, 'loss': 'mse', 'optimizer': 'adam', 'graph_mode': 'off', 'use_snp_selection': True, 'num_snps': 22881}. Best is trial 23 with value: 0.11977490981415422.
[I 2025-12-05 15:51:22,356] Trial 67 finished with value: 0.06339384450570754 and parameters: {'model_type': 'mlp', 'hidden_dims': '[512, 64]', 'dropout': 0.3433068659832311, 'batch_norm': True, 'lr': 1.038788092140181e-06, 'weight_decay': 6.115394418013015e-05, 'epochs': 215, 'loss': 'mse', 'optimizer': 'adam', 'graph_mode': 'off', 'use_snp_selection': False}. Best is trial 23 with value: 0.11977490981415422.
[I 2025-12-05 15:51:23,335] Trial 68 finished with value: 0.09982082768662809 and parameters: {'model_type': 'mlp', 'hidden_dims': '[256, 128, 64]', 'dropout': 0.41420731761493945, 'batch_norm': True, 'lr': 0.0007460721315980988, 'weight_decay': 6.904292499041158e-06, 'epochs': 229, 'loss': 'mse', 'optimizer': 'adam', 'graph_mode': 'off', 'use_snp_selection': False}. Best is trial 23 with value: 0.11977490981415422.
[I 2025-12-05 15:51:24,355] Trial 69 finished with value: 0.05219272569896483 and parameters: {'model_type': 'mlp', 'hidden_dims': '[256, 128]', 'dropout': 0.31946095607612834, 'batch_norm': False, 'lr': 0.0006361702905259616, 'weight_decay': 2.393852817778885e-06, 'epochs': 252, 'loss': 'mse', 'optimizer': 'adam', 'graph_mode': 'off', 'use_snp_selection': False}. Best is trial 23 with value: 0.11977490981415422.
[I 2025-12-05 15:51:25,801] Trial 70 finished with value: 0.09548916475475538 and parameters: {'model_type': 'mlp', 'hidden_dims': '[512, 128]', 'dropout': 0.33066938361895826, 'batch_norm': True, 'lr': 0.00016988051489100908, 'weight_decay': 3.4717250961149065e-05, 'epochs': 243, 'loss': 'mse', 'optimizer': 'adam', 'graph_mode': 'off', 'use_snp_selection': False}. Best is trial 23 with value: 0.11977490981415422.
[I 2025-12-05 15:51:26,617] Trial 71 finished with value: 0.09328165184671232 and parameters: {'model_type': 'mlp', 'hidden_dims': '[128, 64]', 'dropout': 0.31551576591566405, 'batch_norm': True, 'lr': 0.0008080539637447134, 'weight_decay': 5.753596293665532e-06, 'epochs': 224, 'loss': 'mse', 'optimizer': 'adam', 'graph_mode': 'off', 'use_snp_selection': False}. Best is trial 23 with value: 0.11977490981415422.
[I 2025-12-05 15:51:27,442] Trial 72 finished with value: 0.11135641355441457 and parameters: {'model_type': 'mlp', 'hidden_dims': '[128, 64]', 'dropout': 0.30221066156645454, 'batch_norm': True, 'lr': 0.00047939325677098316, 'weight_decay': 3.891195684336055e-06, 'epochs': 234, 'loss': 'mse', 'optimizer': 'adam', 'graph_mode': 'off', 'use_snp_selection': False}. Best is trial 23 with value: 0.11977490981415422.
[I 2025-12-05 15:51:28,311] Trial 73 finished with value: 0.0955997914446773 and parameters: {'model_type': 'mlp', 'hidden_dims': '[128, 64]', 'dropout': 0.28541311504533967, 'batch_norm': True, 'lr': 0.0004772185697373744, 'weight_decay': 1.0491704195902206e-05, 'epochs': 265, 'loss': 'mse', 'optimizer': 'adam', 'graph_mode': 'off', 'use_snp_selection': False}. Best is trial 23 with value: 0.11977490981415422.
[I 2025-12-05 15:51:29,276] Trial 74 finished with value: 0.09044370473200941 and parameters: {'model_type': 'mlp', 'hidden_dims': '[256, 128, 64]', 'dropout': 0.24792022413478473, 'batch_norm': True, 'lr': 0.00036656208747653217, 'weight_decay': 3.6952266370571084e-06, 'epochs': 210, 'loss': 'mae', 'optimizer': 'adam', 'graph_mode': 'off', 'use_snp_selection': False}. Best is trial 23 with value: 0.11977490981415422.
[I 2025-12-05 15:51:30,118] Trial 75 finished with value: 0.0857289278923265 and parameters: {'model_type': 'mlp', 'hidden_dims': '[128, 64]', 'dropout': 0.35386974967727786, 'batch_norm': True, 'lr': 0.0005859187109482075, 'weight_decay': 1.1882455793034792e-06, 'epochs': 236, 'loss': 'mse', 'optimizer': 'adam', 'graph_mode': 'off', 'use_snp_selection': False}. Best is trial 23 with value: 0.11977490981415422.
[I 2025-12-05 15:51:30,991] Trial 76 finished with value: 0.10927556325422803 and parameters: {'model_type': 'mlp', 'hidden_dims': '[256, 128, 64]', 'dropout': 0.3040222494524796, 'batch_norm': True, 'lr': 0.00028739172687934487, 'weight_decay': 2.9838261009479874e-06, 'epochs': 170, 'loss': 'mse', 'optimizer': 'adam', 'graph_mode': 'off', 'use_snp_selection': False}. Best is trial 23 with value: 0.11977490981415422.
[I 2025-12-05 15:51:31,797] Trial 77 finished with value: 0.0871100088253877 and parameters: {'model_type': 'mlp', 'hidden_dims': '[256, 128, 64]', 'dropout': 0.37330126068293346, 'batch_norm': True, 'lr': 0.00011629856872575174, 'weight_decay': 1.9613435089557e-06, 'epochs': 133, 'loss': 'mse', 'optimizer': 'adam', 'graph_mode': 'off', 'use_snp_selection': False}. Best is trial 23 with value: 0.11977490981415422.
[I 2025-12-05 15:51:32,590] Trial 78 finished with value: 0.031135571551259456 and parameters: {'model_type': 'mlp', 'hidden_dims': '[256, 128, 64]', 'dropout': 0.2715154273118918, 'batch_norm': True, 'lr': 0.00028028710122538885, 'weight_decay': 8.99475263191221e-05, 'epochs': 168, 'loss': 'mse', 'optimizer': 'adam', 'graph_mode': 'off', 'use_snp_selection': True, 'num_snps': 2246}. Best is trial 23 with value: 0.11977490981415422.
[I 2025-12-05 15:51:33,468] Trial 79 finished with value: 0.10010382600438718 and parameters: {'model_type': 'mlp', 'hidden_dims': '[256, 128, 64]', 'dropout': 0.2955288609301464, 'batch_norm': True, 'lr': 0.00022132275093184766, 'weight_decay': 8.388287576839991e-07, 'epochs': 172, 'loss': 'mse', 'optimizer': 'adam', 'graph_mode': 'off', 'use_snp_selection': False}. Best is trial 23 with value: 0.11977490981415422.
[I 2025-12-05 15:51:34,305] Trial 80 finished with value: 0.08397689669769284 and parameters: {'model_type': 'mlp', 'hidden_dims': '[256, 128, 64]', 'dropout': 0.3363092662384985, 'batch_norm': True, 'lr': 6.792894880434349e-05, 'weight_decay': 0.00016627829646941654, 'epochs': 149, 'loss': 'mse', 'optimizer': 'adam', 'graph_mode': 'off', 'use_snp_selection': False}. Best is trial 23 with value: 0.11977490981415422.
[I 2025-12-05 15:51:35,634] Trial 81 finished with value: 0.09239774797088864 and parameters: {'model_type': 'mlp', 'hidden_dims': '[512, 256]', 'dropout': 0.30776550023124605, 'batch_norm': True, 'lr': 0.0004711443290477907, 'weight_decay': 2.6104745763366273e-06, 'epochs': 196, 'loss': 'mse', 'optimizer': 'adam', 'graph_mode': 'off', 'use_snp_selection': False}. Best is trial 23 with value: 0.11977490981415422.
[I 2025-12-05 15:51:36,535] Trial 82 finished with value: 0.09003638869379155 and parameters: {'model_type': 'mlp', 'hidden_dims': '[256, 128, 64]', 'dropout': 0.3218505337115435, 'batch_norm': True, 'lr': 0.0003624907270032295, 'weight_decay': 3.1229054732822848e-06, 'epochs': 185, 'loss': 'mse', 'optimizer': 'adam', 'graph_mode': 'off', 'use_snp_selection': False}. Best is trial 23 with value: 0.11977490981415422.
[I 2025-12-05 15:51:37,901] Trial 83 finished with value: 0.10650574143284712 and parameters: {'model_type': 'mlp', 'hidden_dims': '[512, 64]', 'dropout': 0.34778869947970886, 'batch_norm': True, 'lr': 0.0006209191706459546, 'weight_decay': 6.294706260898993e-06, 'epochs': 218, 'loss': 'mse', 'optimizer': 'adam', 'graph_mode': 'off', 'use_snp_selection': False}. Best is trial 23 with value: 0.11977490981415422.
[I 2025-12-05 15:51:38,765] Trial 84 finished with value: 0.09590237786096395 and parameters: {'model_type': 'mlp', 'hidden_dims': '[128, 64]', 'dropout': 0.28914859322978487, 'batch_norm': True, 'lr': 0.00019147041959670805, 'weight_decay': 4.459517647548092e-06, 'epochs': 259, 'loss': 'mse', 'optimizer': 'adam', 'graph_mode': 'off', 'use_snp_selection': False}. Best is trial 23 with value: 0.11977490981415422.
[I 2025-12-05 15:51:39,757] Trial 85 finished with value: 0.08754483294171614 and parameters: {'model_type': 'mlp', 'hidden_dims': '[256, 128, 64]', 'dropout': 0.2571926456045847, 'batch_norm': True, 'lr': 0.00028722107983332934, 'weight_decay': 8.25761772897255e-06, 'epochs': 231, 'loss': 'mae', 'optimizer': 'adam', 'graph_mode': 'off', 'use_snp_selection': False}. Best is trial 23 with value: 0.11977490981415422.
[I 2025-12-05 15:51:41,276] Trial 86 finished with value: 0.028144647769481487 and parameters: {'model_type': 'mlp', 'hidden_dims': '[512, 128]', 'dropout': 0.30423491959541243, 'batch_norm': False, 'lr': 0.0005275711645160518, 'weight_decay': 0.00024850160095935263, 'epochs': 271, 'loss': 'mse', 'optimizer': 'adam', 'graph_mode': 'off', 'use_snp_selection': False}. Best is trial 23 with value: 0.11977490981415422.
[I 2025-12-05 15:51:42,293] Trial 87 finished with value: 0.10458013513598037 and parameters: {'model_type': 'mlp', 'hidden_dims': '[256, 128]', 'dropout': 0.3639176133626819, 'batch_norm': True, 'lr': 0.00042841181392062574, 'weight_decay': 0.00010534728127032893, 'epochs': 242, 'loss': 'mse', 'optimizer': 'adam', 'graph_mode': 'off', 'use_snp_selection': False}. Best is trial 23 with value: 0.11977490981415422.
[I 2025-12-05 15:51:44,544] Trial 88 finished with value: 0.10624066055100312 and parameters: {'model_type': 'mlp', 'hidden_dims': '[256, 128, 64]', 'dropout': 0.3984337860297418, 'batch_norm': True, 'lr': 0.0008128764569910417, 'weight_decay': 1.3817017769102507e-06, 'epochs': 250, 'loss': 'mse', 'optimizer': 'adam', 'graph_mode': 'off', 'use_snp_selection': True, 'num_snps': 48766}. Best is trial 23 with value: 0.11977490981415422.
