[I 2025-12-06 00:14:47,065] Trial 110 finished with value: 0.37236507970822524 and parameters: {'model_type': 'mlp', 'hidden_dims': '[512, 256]', 'dropout': 0.4885474377597872, 'batch_norm': False, 'lr': 3.868925524905643e-06, 'weight_decay': 6.762632539018931e-06, 'epochs': 349, 'loss': 'mae', 'optimizer': 'adam', 'graph_mode': 'off', 'use_snp_selection': False}. Best is trial 63 with value: 0.3778882646178849.
[I 2025-12-06 00:15:55,032] Trial 111 finished with value: 0.37366820348754504 and parameters: {'model_type': 'mlp', 'hidden_dims': '[512, 256]', 'dropout': 0.5025020741947762, 'batch_norm': False, 'lr': 3.1528652396719022e-06, 'weight_decay': 1.9147739462905965e-05, 'epochs': 329, 'loss': 'mae', 'optimizer': 'adam', 'graph_mode': 'off', 'use_snp_selection': False}. Best is trial 63 with value: 0.3778882646178849.
[I 2025-12-06 00:17:03,363] Trial 112 finished with value: 0.3755590154996965 and parameters: {'model_type': 'mlp', 'hidden_dims': '[512, 256]', 'dropout': 0.5001327395659848, 'batch_norm': False, 'lr': 2.611940771086133e-06, 'weight_decay': 1.4598553600150915e-05, 'epochs': 331, 'loss': 'mae', 'optimizer': 'adam', 'graph_mode': 'off', 'use_snp_selection': False}. Best is trial 63 with value: 0.3778882646178849.
[I 2025-12-06 00:18:09,343] Trial 113 finished with value: 0.19109218993442717 and parameters: {'model_type': 'mlp', 'hidden_dims': '[512, 256]', 'dropout': 0.5024756736090334, 'batch_norm': False, 'lr': 0.0005034027391041193, 'weight_decay': 1.4417108236100263e-05, 'epochs': 331, 'loss': 'mae', 'optimizer': 'adam', 'graph_mode': 'off', 'use_snp_selection': False}. Best is trial 63 with value: 0.3778882646178849.
[I 2025-12-06 00:19:18,955] Trial 114 finished with value: 0.373266724415792 and parameters: {'model_type': 'mlp', 'hidden_dims': '[512, 256]', 'dropout': 0.4803631444965616, 'batch_norm': False, 'lr': 2.4689759825367456e-06, 'weight_decay': 2.8162779778723514e-05, 'epochs': 338, 'loss': 'mae', 'optimizer': 'adam', 'graph_mode': 'off', 'use_snp_selection': False}. Best is trial 63 with value: 0.3778882646178849.
[I 2025-12-06 00:20:29,297] Trial 115 finished with value: 0.37376511007571167 and parameters: {'model_type': 'mlp', 'hidden_dims': '[512, 128]', 'dropout': 0.5105559073945016, 'batch_norm': False, 'lr': 1.9561640852899263e-06, 'weight_decay': 1.9437116650529148e-05, 'epochs': 343, 'loss': 'mae', 'optimizer': 'adam', 'graph_mode': 'off', 'use_snp_selection': False}. Best is trial 63 with value: 0.3778882646178849.
[I 2025-12-06 00:21:40,128] Trial 116 finished with value: 0.37006157638448195 and parameters: {'model_type': 'mlp', 'hidden_dims': '[512, 256]', 'dropout': 0.5402430907257234, 'batch_norm': False, 'lr': 1.9792555694353e-06, 'weight_decay': 3.5992674939631294e-05, 'epochs': 344, 'loss': 'mae', 'optimizer': 'adam', 'graph_mode': 'off', 'use_snp_selection': False}. Best is trial 63 with value: 0.3778882646178849.
[I 2025-12-06 00:22:01,931] Trial 117 finished with value: 0.36021275627281457 and parameters: {'model_type': 'mlp', 'hidden_dims': '[128, 64]', 'dropout': 0.5096917089878836, 'batch_norm': False, 'lr': 1.2825964387500392e-06, 'weight_decay': 2.0256151577463828e-05, 'epochs': 323, 'loss': 'mse', 'optimizer': 'adam', 'graph_mode': 'off', 'use_snp_selection': False}. Best is trial 63 with value: 0.3778882646178849.
[I 2025-12-06 00:23:10,401] Trial 118 finished with value: 0.367935546806155 and parameters: {'model_type': 'mlp', 'hidden_dims': '[512, 256]', 'dropout': 0.571274490227147, 'batch_norm': False, 'lr': 1.6717379970579073e-06, 'weight_decay': 7.063064606527886e-05, 'epochs': 333, 'loss': 'mae', 'optimizer': 'adam', 'graph_mode': 'off', 'use_snp_selection': False}. Best is trial 63 with value: 0.3778882646178849.
[I 2025-12-06 00:24:21,816] Trial 119 finished with value: 0.36146917553622226 and parameters: {'model_type': 'mlp', 'hidden_dims': '[512, 64]', 'dropout': 0.5539775758363381, 'batch_norm': False, 'lr': 4.515630237715026e-06, 'weight_decay': 1.1402340414552277e-05, 'epochs': 350, 'loss': 'mse', 'optimizer': 'adam', 'graph_mode': 'off', 'use_snp_selection': False}. Best is trial 63 with value: 0.3778882646178849.
[I 2025-12-06 00:25:48,250] Trial 120 finished with value: 0.37727564657757495 and parameters: {'model_type': 'mlp', 'hidden_dims': '[512, 128]', 'dropout': 0.4648619530498746, 'batch_norm': False, 'lr': 3.2509816471198733e-06, 'weight_decay': 2.432936954577131e-05, 'epochs': 312, 'loss': 'mae', 'optimizer': 'adam', 'graph_mode': 'off', 'use_snp_selection': True, 'num_snps': 52690}. Best is trial 63 with value: 0.3778882646178849.
[I 2025-12-06 00:27:14,863] Trial 121 finished with value: 0.37357257096610996 and parameters: {'model_type': 'mlp', 'hidden_dims': '[512, 128]', 'dropout': 0.46753419759984843, 'batch_norm': False, 'lr': 3.411792134905918e-06, 'weight_decay': 1.7102889577582868e-05, 'epochs': 312, 'loss': 'mae', 'optimizer': 'adam', 'graph_mode': 'off', 'use_snp_selection': True, 'num_snps': 52790}. Best is trial 63 with value: 0.3778882646178849.
[I 2025-12-06 00:28:29,394] Trial 122 finished with value: 0.37137363395949063 and parameters: {'model_type': 'mlp', 'hidden_dims': '[512, 128]', 'dropout': 0.48334046567243094, 'batch_norm': False, 'lr': 2.7063975114709575e-06, 'weight_decay': 2.3552189407955934e-05, 'epochs': 320, 'loss': 'mae', 'optimizer': 'adam', 'graph_mode': 'off', 'use_snp_selection': True, 'num_snps': 42305}. Best is trial 63 with value: 0.3778882646178849.
[I 2025-12-06 00:29:54,024] Trial 123 finished with value: 0.3710891706488082 and parameters: {'model_type': 'mlp', 'hidden_dims': '[512, 128]', 'dropout': 0.5174759142311588, 'batch_norm': False, 'lr': 2.987673005008005e-06, 'weight_decay': 4.443164888838853e-05, 'epochs': 303, 'loss': 'mae', 'optimizer': 'adam', 'graph_mode': 'off', 'use_snp_selection': True, 'num_snps': 52273}. Best is trial 63 with value: 0.3778882646178849.
[I 2025-12-06 00:31:03,260] Trial 124 finished with value: 0.378160103383972 and parameters: {'model_type': 'mlp', 'hidden_dims': '[512, 128]', 'dropout': 0.4545070871263984, 'batch_norm': False, 'lr': 2.088456018466236e-06, 'weight_decay': 1.404578351216121e-05, 'epochs': 327, 'loss': 'mae', 'optimizer': 'adam', 'graph_mode': 'off', 'use_snp_selection': True, 'num_snps': 37916}. Best is trial 124 with value: 0.378160103383972.
[I 2025-12-06 00:32:16,101] Trial 125 finished with value: 0.37014598266196985 and parameters: {'model_type': 'mlp', 'hidden_dims': '[512, 128]', 'dropout': 0.4269439069775312, 'batch_norm': False, 'lr': 2.1854208502278856e-06, 'weight_decay': 1.3712955194723157e-05, 'epochs': 342, 'loss': 'mae', 'optimizer': 'adam', 'graph_mode': 'off', 'use_snp_selection': True, 'num_snps': 39077}. Best is trial 124 with value: 0.378160103383972.
[I 2025-12-06 00:33:39,276] Trial 126 finished with value: 0.3737561732786865 and parameters: {'model_type': 'mlp', 'hidden_dims': '[512, 128]', 'dropout': 0.45688461476742376, 'batch_norm': False, 'lr': 1.761792132807433e-06, 'weight_decay': 8.916641312393175e-06, 'epochs': 314, 'loss': 'mse', 'optimizer': 'adam', 'graph_mode': 'off', 'use_snp_selection': True, 'num_snps': 49974}. Best is trial 124 with value: 0.378160103383972.
[I 2025-12-06 00:35:01,049] Trial 127 finished with value: 0.32930913608966 and parameters: {'model_type': 'mlp', 'hidden_dims': '[512, 128]', 'dropout': 0.44967404385440823, 'batch_norm': True, 'lr': 1.824938256236738e-06, 'weight_decay': 9.553133655868907e-06, 'epochs': 316, 'loss': 'mse', 'optimizer': 'adam', 'graph_mode': 'off', 'use_snp_selection': True, 'num_snps': 48276}. Best is trial 124 with value: 0.378160103383972.
[I 2025-12-06 00:36:38,460] Trial 128 finished with value: 0.37143747347385564 and parameters: {'model_type': 'mlp', 'hidden_dims': '[512, 128]', 'dropout': 0.4164590755890401, 'batch_norm': False, 'lr': 1.4796980569800247e-06, 'weight_decay': 5.590886695725979e-06, 'epochs': 322, 'loss': 'mse', 'optimizer': 'adam', 'graph_mode': 'off', 'use_snp_selection': True, 'num_snps': 59914}. Best is trial 124 with value: 0.378160103383972.
[I 2025-12-06 00:37:55,098] Trial 129 finished with value: 0.3711010321374847 and parameters: {'model_type': 'mlp', 'hidden_dims': '[512, 128]', 'dropout': 0.4022868064481945, 'batch_norm': False, 'lr': 1.1599999419071727e-06, 'weight_decay': 1.1116766003507272e-05, 'epochs': 334, 'loss': 'mse', 'optimizer': 'adam', 'graph_mode': 'off', 'use_snp_selection': True, 'num_snps': 42441}. Best is trial 124 with value: 0.378160103383972.
[I 2025-12-06 00:39:25,625] Trial 130 finished with value: 0.3739158746497481 and parameters: {'model_type': 'mlp', 'hidden_dims': '[512, 128]', 'dropout': 0.43567993357528545, 'batch_norm': False, 'lr': 1.9419584369047716e-06, 'weight_decay': 8.46304869306576e-06, 'epochs': 314, 'loss': 'mse', 'optimizer': 'adam', 'graph_mode': 'off', 'use_snp_selection': True, 'num_snps': 55539}. Best is trial 124 with value: 0.378160103383972.
[I 2025-12-06 00:40:46,873] Trial 131 finished with value: 0.3756083626233124 and parameters: {'model_type': 'mlp', 'hidden_dims': '[512, 128]', 'dropout': 0.46107826469655555, 'batch_norm': False, 'lr': 1.6890860054537187e-06, 'weight_decay': 8.581777702972753e-06, 'epochs': 296, 'loss': 'mse', 'optimizer': 'adam', 'graph_mode': 'off', 'use_snp_selection': True, 'num_snps': 50571}. Best is trial 124 with value: 0.378160103383972.
[I 2025-12-06 00:41:54,938] Trial 132 finished with value: 0.36529304852164834 and parameters: {'model_type': 'mlp', 'hidden_dims': '[512, 128]', 'dropout': 0.43201518511931286, 'batch_norm': False, 'lr': 1.3775491416520402e-06, 'weight_decay': 6.4793246662709034e-06, 'epochs': 190, 'loss': 'mse', 'optimizer': 'adam', 'graph_mode': 'off', 'use_snp_selection': True, 'num_snps': 54953}. Best is trial 124 with value: 0.378160103383972.
[I 2025-12-06 00:43:15,191] Trial 133 finished with value: 0.3721395471289847 and parameters: {'model_type': 'mlp', 'hidden_dims': '[512, 128]', 'dropout': 0.4650825684496859, 'batch_norm': False, 'lr': 1.5890336644948596e-06, 'weight_decay': 4.317513858109712e-06, 'epochs': 296, 'loss': 'mse', 'optimizer': 'adam', 'graph_mode': 'off', 'use_snp_selection': True, 'num_snps': 50092}. Best is trial 124 with value: 0.378160103383972.
[I 2025-12-06 00:44:48,453] Trial 134 finished with value: 0.3717844388459602 and parameters: {'model_type': 'mlp', 'hidden_dims': '[512, 128]', 'dropout': 0.4460540394441616, 'batch_norm': False, 'lr': 2.0810763644172883e-06, 'weight_decay': 1.621625018225198e-05, 'epochs': 325, 'loss': 'mse', 'optimizer': 'adam', 'graph_mode': 'off', 'use_snp_selection': True, 'num_snps': 56373}. Best is trial 124 with value: 0.378160103383972.
[I 2025-12-06 00:46:03,934] Trial 135 finished with value: 0.37194820581124854 and parameters: {'model_type': 'mlp', 'hidden_dims': '[512, 128]', 'dropout': 0.47444939038296735, 'batch_norm': False, 'lr': 2.5735442925235834e-06, 'weight_decay': 8.107824267732052e-06, 'epochs': 310, 'loss': 'mse', 'optimizer': 'adam', 'graph_mode': 'off', 'use_snp_selection': True, 'num_snps': 44227}. Best is trial 124 with value: 0.378160103383972.
[I 2025-12-06 00:47:31,924] Trial 136 finished with value: 0.3334002274735882 and parameters: {'model_type': 'mlp', 'hidden_dims': '[512, 128]', 'dropout': 0.423384080564826, 'batch_norm': False, 'lr': 2.8050520527308313e-05, 'weight_decay': 1.139045280707179e-05, 'epochs': 301, 'loss': 'mse', 'optimizer': 'adam', 'graph_mode': 'off', 'use_snp_selection': True, 'num_snps': 55961}. Best is trial 124 with value: 0.378160103383972.
[I 2025-12-06 00:48:52,766] Trial 137 finished with value: 0.37320440345020656 and parameters: {'model_type': 'mlp', 'hidden_dims': '[512, 128]', 'dropout': 0.4383198808544592, 'batch_norm': False, 'lr': 2.0062943496191018e-06, 'weight_decay': 2.258170424293112e-05, 'epochs': 288, 'loss': 'mse', 'optimizer': 'adam', 'graph_mode': 'off', 'use_snp_selection': True, 'num_snps': 50854}. Best is trial 124 with value: 0.378160103383972.
[I 2025-12-06 00:49:37,370] Trial 138 finished with value: 0.37243120898520654 and parameters: {'model_type': 'mlp', 'hidden_dims': '[128, 64]', 'dropout': 0.4037483740740811, 'batch_norm': False, 'lr': 2.2785141120296396e-06, 'weight_decay': 5.403359882094148e-06, 'epochs': 298, 'loss': 'mse', 'optimizer': 'adam', 'graph_mode': 'off', 'use_snp_selection': True, 'num_snps': 44341}. Best is trial 124 with value: 0.378160103383972.
[I 2025-12-06 00:50:13,000] Trial 139 finished with value: 0.2935482340423098 and parameters: {'model_type': 'mlp', 'hidden_dims': '[512, 128]', 'dropout': 0.48923556914323946, 'batch_norm': False, 'lr': 2.7278885572875733e-06, 'weight_decay': 1.0097031658558731e-05, 'epochs': 40, 'loss': 'mse', 'optimizer': 'adam', 'graph_mode': 'off', 'use_snp_selection': True, 'num_snps': 35529}. Best is trial 124 with value: 0.378160103383972.
[I 2025-12-06 00:51:47,659] Trial 140 finished with value: 0.3720317473470127 and parameters: {'model_type': 'mlp', 'hidden_dims': '[512, 128]', 'dropout': 0.4600682979140837, 'batch_norm': False, 'lr': 1.7773392277370445e-06, 'weight_decay': 3.6174386371047544e-06, 'epochs': 329, 'loss': 'mse', 'optimizer': 'adam', 'graph_mode': 'off', 'use_snp_selection': True, 'num_snps': 57625}. Best is trial 124 with value: 0.378160103383972.
[I 2025-12-06 00:53:11,807] Trial 141 finished with value: 0.3758321562631609 and parameters: {'model_type': 'mlp', 'hidden_dims': '[512, 128]', 'dropout': 0.45343970127677063, 'batch_norm': False, 'lr': 1.5653291406698928e-06, 'weight_decay': 9.059851251983518e-06, 'epochs': 314, 'loss': 'mse', 'optimizer': 'adam', 'graph_mode': 'off', 'use_snp_selection': True, 'num_snps': 50415}. Best is trial 124 with value: 0.378160103383972.
[I 2025-12-06 00:54:33,582] Trial 142 finished with value: 0.380144450478448 and parameters: {'model_type': 'mlp', 'hidden_dims': '[512, 128]', 'dropout': 0.4406740697642267, 'batch_norm': False, 'lr': 1.0789704174219786e-06, 'weight_decay': 1.2895530871385637e-05, 'epochs': 306, 'loss': 'mse', 'optimizer': 'adam', 'graph_mode': 'off', 'use_snp_selection': True, 'num_snps': 49514}. Best is trial 142 with value: 0.380144450478448.
[I 2025-12-06 00:55:55,267] Trial 143 finished with value: 0.37245853793646366 and parameters: {'model_type': 'mlp', 'hidden_dims': '[512, 128]', 'dropout': 0.44229254532746676, 'batch_norm': False, 'lr': 1.0537081302708246e-06, 'weight_decay': 8.551898799104841e-06, 'epochs': 305, 'loss': 'mse', 'optimizer': 'adam', 'graph_mode': 'off', 'use_snp_selection': True, 'num_snps': 49420}. Best is trial 142 with value: 0.380144450478448.
[I 2025-12-06 00:57:21,253] Trial 144 finished with value: 0.3765040972338688 and parameters: {'model_type': 'mlp', 'hidden_dims': '[512, 128]', 'dropout': 0.37766200597496913, 'batch_norm': False, 'lr': 1.3222682207034612e-06, 'weight_decay': 1.4204084899267961e-05, 'epochs': 293, 'loss': 'mse', 'optimizer': 'adam', 'graph_mode': 'off', 'use_snp_selection': True, 'num_snps': 55268}. Best is trial 142 with value: 0.380144450478448.
[I 2025-12-06 00:58:36,496] Trial 145 finished with value: 0.3698343806411661 and parameters: {'model_type': 'mlp', 'hidden_dims': '[512, 128]', 'dropout': 0.37565237571151705, 'batch_norm': False, 'lr': 1.324684304739134e-06, 'weight_decay': 1.5068186777000057e-05, 'epochs': 292, 'loss': 'mse', 'optimizer': 'adam', 'graph_mode': 'off', 'use_snp_selection': True, 'num_snps': 45678}. Best is trial 142 with value: 0.380144450478448.
[I 2025-12-06 00:59:35,836] Trial 146 finished with value: 0.3643652954344813 and parameters: {'model_type': 'mlp', 'hidden_dims': '[256, 128, 64]', 'dropout': 0.3577834880135383, 'batch_norm': False, 'lr': 1.0936900672034925e-06, 'weight_decay': 1.2904712999166344e-05, 'epochs': 286, 'loss': 'mse', 'optimizer': 'adam', 'graph_mode': 'off', 'use_snp_selection': True, 'num_snps': 51843}. Best is trial 142 with value: 0.380144450478448.
[I 2025-12-06 01:00:18,199] Trial 147 finished with value: 0.3576395475008276 and parameters: {'model_type': 'mlp', 'hidden_dims': '[128, 64]', 'dropout': 0.3362173528216649, 'batch_norm': False, 'lr': 1.0003361917924453e-06, 'weight_decay': 6.539496922206573e-06, 'epochs': 308, 'loss': 'mse', 'optimizer': 'adam', 'graph_mode': 'off', 'use_snp_selection': True, 'num_snps': 39978}. Best is trial 142 with value: 0.380144450478448.
[I 2025-12-06 01:00:55,415] Trial 148 finished with value: 0.319965585201685 and parameters: {'model_type': 'mlp', 'hidden_dims': '[512, 128]', 'dropout': 0.31096561723141136, 'batch_norm': True, 'lr': 1.2736836852688177e-06, 'weight_decay': 1.2290364988693992e-05, 'epochs': 295, 'loss': 'mse', 'optimizer': 'adam', 'graph_mode': 'off', 'use_snp_selection': True, 'num_snps': 13467}. Best is trial 142 with value: 0.380144450478448.
[I 2025-12-06 01:02:14,093] Trial 149 finished with value: 0.3724566753130385 and parameters: {'model_type': 'mlp', 'hidden_dims': '[512, 128]', 'dropout': 0.4077653923802413, 'batch_norm': False, 'lr': 1.5426963617871542e-06, 'weight_decay': 4.8511727887542255e-06, 'epochs': 303, 'loss': 'mse', 'optimizer': 'adam', 'graph_mode': 'off', 'use_snp_selection': True, 'num_snps': 47702}. Best is trial 142 with value: 0.380144450478448.
[I 2025-12-06 01:03:19,604] Trial 0 finished with value: 0.30430877943276835 and parameters: {'model_type': 'mlp', 'hidden_dims': '[128, 64]', 'dropout': 0.199031432379812, 'batch_norm': True, 'lr': 1.8408544111075837e-06, 'weight_decay': 5.5136510071208614e-05, 'epochs': 336, 'loss': 'mae', 'optimizer': 'adam', 'graph_mode': 'off', 'use_snp_selection': True, 'num_snps': 43862}. Best is trial 0 with value: 0.30430877943276835.
[I 2025-12-06 01:03:47,867] Trial 1 finished with value: 0.35125643362865827 and parameters: {'model_type': 'mlp', 'hidden_dims': '[256, 128]', 'dropout': 0.4370668075331726, 'batch_norm': True, 'lr': 7.133471581159139e-05, 'weight_decay': 1.128633586803549e-05, 'epochs': 242, 'loss': 'mae', 'optimizer': 'adam', 'graph_mode': 'off', 'use_snp_selection': False}. Best is trial 1 with value: 0.35125643362865827.
[I 2025-12-06 01:04:15,032] Trial 2 finished with value: 0.33522837541352796 and parameters: {'model_type': 'mlp', 'hidden_dims': '[256, 128, 64]', 'dropout': 0.41314357415569625, 'batch_norm': False, 'lr': 3.952233718592101e-06, 'weight_decay': 0.00026754769258252603, 'epochs': 149, 'loss': 'mse', 'optimizer': 'adam', 'graph_mode': 'off', 'use_snp_selection': True, 'num_snps': 11571}. Best is trial 1 with value: 0.35125643362865827.
[I 2025-12-06 01:05:20,039] Trial 3 finished with value: 0.38052509421805986 and parameters: {'model_type': 'mlp', 'hidden_dims': '[512, 64]', 'dropout': 0.5938127374509361, 'batch_norm': False, 'lr': 5.67704586114731e-06, 'weight_decay': 2.4518087630137052e-05, 'epochs': 320, 'loss': 'mae', 'optimizer': 'adam', 'graph_mode': 'off', 'use_snp_selection': False}. Best is trial 3 with value: 0.38052509421805986.
[I 2025-12-06 01:06:23,878] Trial 4 finished with value: 0.3119959091824339 and parameters: {'model_type': 'mlp', 'hidden_dims': '[512, 128]', 'dropout': 0.25746343592134413, 'batch_norm': True, 'lr': 1.3467657668402788e-06, 'weight_decay': 0.00033087251918647806, 'epochs': 277, 'loss': 'mse', 'optimizer': 'adam', 'graph_mode': 'off', 'use_snp_selection': True, 'num_snps': 36675}. Best is trial 3 with value: 0.38052509421805986.
[I 2025-12-06 01:07:08,213] Trial 5 finished with value: 0.32411534415282045 and parameters: {'model_type': 'mlp', 'hidden_dims': '[512, 64]', 'dropout': 0.38275350994408375, 'batch_norm': True, 'lr': 1.5586664309232824e-06, 'weight_decay': 0.0008227664668621182, 'epochs': 145, 'loss': 'mae', 'optimizer': 'adam', 'graph_mode': 'off', 'use_snp_selection': True, 'num_snps': 32148}. Best is trial 3 with value: 0.38052509421805986.
[I 2025-12-06 01:07:31,447] Trial 6 finished with value: 0.3571179100311397 and parameters: {'model_type': 'mlp', 'hidden_dims': '[256, 128]', 'dropout': 0.3930109900265879, 'batch_norm': False, 'lr': 4.892964372128395e-05, 'weight_decay': 1.5809549317992182e-06, 'epochs': 199, 'loss': 'mse', 'optimizer': 'adam', 'graph_mode': 'off', 'use_snp_selection': False}. Best is trial 3 with value: 0.38052509421805986.
[I 2025-12-06 01:07:54,741] Trial 7 finished with value: 0.3549049349108997 and parameters: {'model_type': 'mlp', 'hidden_dims': '[512, 256]', 'dropout': 0.15343979219678458, 'batch_norm': True, 'lr': 6.234003099047341e-05, 'weight_decay': 3.894760610535477e-07, 'epochs': 97, 'loss': 'mse', 'optimizer': 'adam', 'graph_mode': 'off', 'use_snp_selection': False}. Best is trial 3 with value: 0.38052509421805986.
[I 2025-12-06 01:08:59,624] Trial 8 finished with value: 0.35650225264394797 and parameters: {'model_type': 'mlp', 'hidden_dims': '[512, 128]', 'dropout': 0.10743001231661406, 'batch_norm': True, 'lr': 0.00023728538449271062, 'weight_decay': 1.7629071578048637e-05, 'epochs': 312, 'loss': 'mae', 'optimizer': 'adam', 'graph_mode': 'off', 'use_snp_selection': False}. Best is trial 3 with value: 0.38052509421805986.
[I 2025-12-06 01:09:38,023] Trial 9 finished with value: 0.3543612793333649 and parameters: {'model_type': 'mlp', 'hidden_dims': '[512, 64]', 'dropout': 0.14505336736221927, 'batch_norm': True, 'lr': 5.8619638388111826e-05, 'weight_decay': 6.200156172669308e-07, 'epochs': 175, 'loss': 'mse', 'optimizer': 'adam', 'graph_mode': 'off', 'use_snp_selection': False}. Best is trial 3 with value: 0.38052509421805986.
[I 2025-12-06 01:09:53,073] Trial 10 finished with value: 0.3469613684280921 and parameters: {'model_type': 'mlp', 'hidden_dims': '[512, 64]', 'dropout': 0.5885461262002587, 'batch_norm': False, 'lr': 8.769366258768696e-06, 'weight_decay': 2.78273193871783e-06, 'epochs': 55, 'loss': 'mae', 'optimizer': 'adam', 'graph_mode': 'off', 'use_snp_selection': False}. Best is trial 3 with value: 0.38052509421805986.
