[I 2025-12-06 03:06:24,945] Trial 125 finished with value: 0.1864310820781629 and parameters: {'model_type': 'mlp', 'hidden_dims': '[256, 128]', 'dropout': 0.1386784185600721, 'batch_norm': False, 'lr': 1.7877034664808423e-05, 'weight_decay': 3.258069951409805e-07, 'epochs': 51, 'loss': 'mae', 'optimizer': 'adam', 'graph_mode': 'off', 'use_snp_selection': True, 'num_snps': 21557}. Best is trial 74 with value: 0.20470863597462086.
[I 2025-12-06 03:06:57,490] Trial 126 finished with value: 0.1903601591610403 and parameters: {'model_type': 'mlp', 'hidden_dims': '[256, 128]', 'dropout': 0.17640003249412942, 'batch_norm': False, 'lr': 0.000110078001445163, 'weight_decay': 1.402034467373112e-06, 'epochs': 80, 'loss': 'mae', 'optimizer': 'adam', 'graph_mode': 'off', 'use_snp_selection': True, 'num_snps': 27147}. Best is trial 74 with value: 0.20470863597462086.
[I 2025-12-06 03:07:37,658] Trial 127 finished with value: 0.19144581051077378 and parameters: {'model_type': 'mlp', 'hidden_dims': '[512, 64]', 'dropout': 0.2397150743457347, 'batch_norm': False, 'lr': 1.100576844934651e-05, 'weight_decay': 9.674437509401872e-06, 'epochs': 89, 'loss': 'mae', 'optimizer': 'adam', 'graph_mode': 'off', 'use_snp_selection': True, 'num_snps': 32780}. Best is trial 74 with value: 0.20470863597462086.
[I 2025-12-06 03:08:04,935] Trial 128 finished with value: 0.11795539849217573 and parameters: {'model_type': 'mlp', 'hidden_dims': '[256, 128, 64]', 'dropout': 0.11019526777521012, 'batch_norm': True, 'lr': 1.544967728391513e-05, 'weight_decay': 6.2815625376023515e-06, 'epochs': 61, 'loss': 'mae', 'optimizer': 'adam', 'graph_mode': 'off', 'use_snp_selection': True, 'num_snps': 14717}. Best is trial 74 with value: 0.20470863597462086.
[I 2025-12-06 03:08:41,485] Trial 129 finished with value: 0.18753984989745273 and parameters: {'model_type': 'mlp', 'hidden_dims': '[256, 128]', 'dropout': 0.16271714089345812, 'batch_norm': False, 'lr': 3.231228536658009e-05, 'weight_decay': 1.4665927555985357e-05, 'epochs': 68, 'loss': 'mae', 'optimizer': 'adam', 'graph_mode': 'off', 'use_snp_selection': True, 'num_snps': 39396}. Best is trial 74 with value: 0.20470863597462086.
[I 2025-12-06 03:08:52,330] Trial 130 finished with value: 0.18829626020888884 and parameters: {'model_type': 'mlp', 'hidden_dims': '[256, 128]', 'dropout': 0.20391638445592306, 'batch_norm': False, 'lr': 2.7332230661307646e-05, 'weight_decay': 8.46651652660728e-06, 'epochs': 51, 'loss': 'mae', 'optimizer': 'adam', 'graph_mode': 'off', 'use_snp_selection': False}. Best is trial 74 with value: 0.20470863597462086.
[I 2025-12-06 03:09:24,590] Trial 131 finished with value: 0.18335660190597586 and parameters: {'model_type': 'mlp', 'hidden_dims': '[256, 128]', 'dropout': 0.16711053248686286, 'batch_norm': False, 'lr': 1.3579312822109826e-05, 'weight_decay': 7.467328807301552e-06, 'epochs': 73, 'loss': 'mae', 'optimizer': 'adam', 'graph_mode': 'off', 'use_snp_selection': True, 'num_snps': 26181}. Best is trial 74 with value: 0.20470863597462086.
[I 2025-12-06 03:09:58,208] Trial 132 finished with value: 0.17577274012574579 and parameters: {'model_type': 'mlp', 'hidden_dims': '[256, 128]', 'dropout': 0.1498688197902103, 'batch_norm': False, 'lr': 1.2409491223602823e-05, 'weight_decay': 1.1657793778506094e-05, 'epochs': 76, 'loss': 'mae', 'optimizer': 'adam', 'graph_mode': 'off', 'use_snp_selection': True, 'num_snps': 29399}. Best is trial 74 with value: 0.20470863597462086.
[I 2025-12-06 03:10:29,441] Trial 133 finished with value: 0.20105257339461793 and parameters: {'model_type': 'mlp', 'hidden_dims': '[256, 128]', 'dropout': 0.18483160850059976, 'batch_norm': False, 'lr': 7.554502490591744e-06, 'weight_decay': 7.656074329666743e-06, 'epochs': 59, 'loss': 'mae', 'optimizer': 'adam', 'graph_mode': 'off', 'use_snp_selection': True, 'num_snps': 25214}. Best is trial 74 with value: 0.20470863597462086.
[I 2025-12-06 03:11:00,582] Trial 134 finished with value: 0.1927222294729752 and parameters: {'model_type': 'mlp', 'hidden_dims': '[256, 128]', 'dropout': 0.1879167486360608, 'batch_norm': False, 'lr': 7.4628813407579046e-06, 'weight_decay': 1.9382229190662188e-05, 'epochs': 59, 'loss': 'mae', 'optimizer': 'adam', 'graph_mode': 'off', 'use_snp_selection': True, 'num_snps': 25040}. Best is trial 74 with value: 0.20470863597462086.
[I 2025-12-06 03:11:32,200] Trial 135 finished with value: 0.19428751668754565 and parameters: {'model_type': 'mlp', 'hidden_dims': '[256, 128]', 'dropout': 0.17672224600855438, 'batch_norm': False, 'lr': 6.541586053644433e-05, 'weight_decay': 4.937764475205994e-06, 'epochs': 47, 'loss': 'mae', 'optimizer': 'adam', 'graph_mode': 'off', 'use_snp_selection': True, 'num_snps': 28319}. Best is trial 74 with value: 0.20470863597462086.
[I 2025-12-06 03:12:01,834] Trial 136 finished with value: 0.12338414395245519 and parameters: {'model_type': 'mlp', 'hidden_dims': '[256, 128]', 'dropout': 0.13384506562580245, 'batch_norm': False, 'lr': 4.219946658423749e-06, 'weight_decay': 2.661502324819942e-05, 'epochs': 40, 'loss': 'mae', 'optimizer': 'adam', 'graph_mode': 'off', 'use_snp_selection': True, 'num_snps': 23055}. Best is trial 74 with value: 0.20470863597462086.
[I 2025-12-06 03:12:34,744] Trial 137 finished with value: 0.19432654410681133 and parameters: {'model_type': 'mlp', 'hidden_dims': '[256, 128]', 'dropout': 0.2278721992623598, 'batch_norm': False, 'lr': 6.12919055747134e-06, 'weight_decay': 6.309522784968956e-06, 'epochs': 55, 'loss': 'mae', 'optimizer': 'adam', 'graph_mode': 'off', 'use_snp_selection': True, 'num_snps': 30792}. Best is trial 74 with value: 0.20470863597462086.
[I 2025-12-06 03:13:07,907] Trial 138 finished with value: 0.19068778054481675 and parameters: {'model_type': 'mlp', 'hidden_dims': '[256, 128]', 'dropout': 0.20145716601748936, 'batch_norm': False, 'lr': 9.103788367621265e-06, 'weight_decay': 2.7361432068946893e-06, 'epochs': 66, 'loss': 'mae', 'optimizer': 'adam', 'graph_mode': 'off', 'use_snp_selection': True, 'num_snps': 29672}. Best is trial 74 with value: 0.20470863597462086.
[I 2025-12-06 03:13:39,031] Trial 139 finished with value: 0.1929474189726132 and parameters: {'model_type': 'mlp', 'hidden_dims': '[256, 128]', 'dropout': 0.14161716873626654, 'batch_norm': False, 'lr': 1.0970795337267652e-05, 'weight_decay': 3.887461149026803e-06, 'epochs': 46, 'loss': 'mae', 'optimizer': 'adam', 'graph_mode': 'off', 'use_snp_selection': True, 'num_snps': 27067}. Best is trial 74 with value: 0.20470863597462086.
[I 2025-12-06 03:14:18,137] Trial 140 finished with value: 0.180769161287482 and parameters: {'model_type': 'mlp', 'hidden_dims': '[128, 64]', 'dropout': 0.15671025778177547, 'batch_norm': False, 'lr': 0.00018584221974875598, 'weight_decay': 9.454663392415636e-06, 'epochs': 290, 'loss': 'mae', 'optimizer': 'adam', 'graph_mode': 'off', 'use_snp_selection': True, 'num_snps': 33893}. Best is trial 74 with value: 0.20470863597462086.
[I 2025-12-06 03:14:49,930] Trial 141 finished with value: 0.18479706969442458 and parameters: {'model_type': 'mlp', 'hidden_dims': '[256, 128]', 'dropout': 0.19210185636454752, 'batch_norm': False, 'lr': 0.0009615287586285842, 'weight_decay': 8.15870779394519e-06, 'epochs': 74, 'loss': 'mae', 'optimizer': 'adam', 'graph_mode': 'off', 'use_snp_selection': True, 'num_snps': 25532}. Best is trial 74 with value: 0.20470863597462086.
[I 2025-12-06 03:15:22,530] Trial 142 finished with value: 0.19618791492700263 and parameters: {'model_type': 'mlp', 'hidden_dims': '[256, 128]', 'dropout': 0.16323188653484524, 'batch_norm': False, 'lr': 1.2368762742322503e-05, 'weight_decay': 1.1768552440008266e-05, 'epochs': 84, 'loss': 'mae', 'optimizer': 'adam', 'graph_mode': 'off', 'use_snp_selection': True, 'num_snps': 26393}. Best is trial 74 with value: 0.20470863597462086.
[I 2025-12-06 03:15:56,017] Trial 143 finished with value: 0.19191706761570035 and parameters: {'model_type': 'mlp', 'hidden_dims': '[256, 128]', 'dropout': 0.1808501389549399, 'batch_norm': False, 'lr': 1.8091787069701792e-05, 'weight_decay': 1.1802175734608589e-05, 'epochs': 83, 'loss': 'mae', 'optimizer': 'adam', 'graph_mode': 'off', 'use_snp_selection': True, 'num_snps': 28571}. Best is trial 74 with value: 0.20470863597462086.
[I 2025-12-06 03:16:29,154] Trial 144 finished with value: 0.19388884473630005 and parameters: {'model_type': 'mlp', 'hidden_dims': '[256, 128]', 'dropout': 0.16980215291452613, 'batch_norm': False, 'lr': 7.846305623381528e-06, 'weight_decay': 1.4005093288668183e-05, 'epochs': 93, 'loss': 'mae', 'optimizer': 'adam', 'graph_mode': 'off', 'use_snp_selection': True, 'num_snps': 26758}. Best is trial 74 with value: 0.20470863597462086.
[I 2025-12-06 03:16:59,370] Trial 145 finished with value: 0.17573970880756018 and parameters: {'model_type': 'mlp', 'hidden_dims': '[256, 128]', 'dropout': 0.21022767521251237, 'batch_norm': False, 'lr': 9.68529207833944e-06, 'weight_decay': 1.705363293850021e-05, 'epochs': 62, 'loss': 'mae', 'optimizer': 'adam', 'graph_mode': 'off', 'use_snp_selection': True, 'num_snps': 22540}. Best is trial 74 with value: 0.20470863597462086.
[I 2025-12-06 03:17:35,051] Trial 146 finished with value: 0.1933062005624966 and parameters: {'model_type': 'mlp', 'hidden_dims': '[512, 64]', 'dropout': 0.12860445435860302, 'batch_norm': False, 'lr': 1.4674499398177162e-05, 'weight_decay': 7.063940176508548e-06, 'epochs': 52, 'loss': 'mae', 'optimizer': 'adam', 'graph_mode': 'off', 'use_snp_selection': True, 'num_snps': 31062}. Best is trial 74 with value: 0.20470863597462086.
[I 2025-12-06 03:18:09,749] Trial 147 finished with value: 0.17587179884025614 and parameters: {'model_type': 'mlp', 'hidden_dims': '[256, 128]', 'dropout': 0.14909626914583915, 'batch_norm': False, 'lr': 1.2916401149121512e-05, 'weight_decay': 9.749166805127254e-06, 'epochs': 57, 'loss': 'mae', 'optimizer': 'adam', 'graph_mode': 'off', 'use_snp_selection': True, 'num_snps': 35293}. Best is trial 74 with value: 0.20470863597462086.
[I 2025-12-06 03:18:41,173] Trial 148 finished with value: 0.1871559503105407 and parameters: {'model_type': 'mlp', 'hidden_dims': '[256, 128]', 'dropout': 0.15906852348558537, 'batch_norm': False, 'lr': 2.1216086405327078e-05, 'weight_decay': 5.803499848537652e-06, 'epochs': 69, 'loss': 'mae', 'optimizer': 'adam', 'graph_mode': 'off', 'use_snp_selection': True, 'num_snps': 24955}. Best is trial 74 with value: 0.20470863597462086.
[I 2025-12-06 03:19:11,772] Trial 149 finished with value: 0.18574424267266218 and parameters: {'model_type': 'mlp', 'hidden_dims': '[256, 128]', 'dropout': 0.1849846582628916, 'batch_norm': False, 'lr': 6.59674584673614e-06, 'weight_decay': 2.423358859842937e-05, 'epochs': 87, 'loss': 'mae', 'optimizer': 'adam', 'graph_mode': 'off', 'use_snp_selection': True, 'num_snps': 20749}. Best is trial 74 with value: 0.20470863597462086.
[I 2025-12-06 03:20:15,089] Trial 0 finished with value: 0.14057187302463134 and parameters: {'model_type': 'mlp', 'hidden_dims': '[128, 64]', 'dropout': 0.199031432379812, 'batch_norm': True, 'lr': 1.8408544111075837e-06, 'weight_decay': 5.5136510071208614e-05, 'epochs': 336, 'loss': 'mae', 'optimizer': 'adam', 'graph_mode': 'off', 'use_snp_selection': True, 'num_snps': 43862}. Best is trial 0 with value: 0.14057187302463134.
[I 2025-12-06 03:20:53,830] Trial 1 finished with value: 0.1855555675842121 and parameters: {'model_type': 'mlp', 'hidden_dims': '[256, 128]', 'dropout': 0.4370668075331726, 'batch_norm': True, 'lr': 7.133471581159139e-05, 'weight_decay': 1.128633586803549e-05, 'epochs': 242, 'loss': 'mae', 'optimizer': 'adam', 'graph_mode': 'off', 'use_snp_selection': False}. Best is trial 1 with value: 0.1855555675842121.
[I 2025-12-06 03:21:29,711] Trial 2 finished with value: 0.1660384547099261 and parameters: {'model_type': 'mlp', 'hidden_dims': '[256, 128, 64]', 'dropout': 0.41314357415569625, 'batch_norm': False, 'lr': 3.952233718592101e-06, 'weight_decay': 0.00026754769258252603, 'epochs': 149, 'loss': 'mse', 'optimizer': 'adam', 'graph_mode': 'off', 'use_snp_selection': True, 'num_snps': 11571}. Best is trial 1 with value: 0.1855555675842121.
[I 2025-12-06 03:23:00,815] Trial 3 finished with value: 0.20577242551477953 and parameters: {'model_type': 'mlp', 'hidden_dims': '[512, 64]', 'dropout': 0.5938127374509361, 'batch_norm': False, 'lr': 5.67704586114731e-06, 'weight_decay': 2.4518087630137052e-05, 'epochs': 320, 'loss': 'mae', 'optimizer': 'adam', 'graph_mode': 'off', 'use_snp_selection': False}. Best is trial 3 with value: 0.20577242551477953.
[I 2025-12-06 03:24:24,056] Trial 4 finished with value: 0.15561936905864834 and parameters: {'model_type': 'mlp', 'hidden_dims': '[512, 128]', 'dropout': 0.25746343592134413, 'batch_norm': True, 'lr': 1.3467657668402788e-06, 'weight_decay': 0.00033087251918647806, 'epochs': 277, 'loss': 'mse', 'optimizer': 'adam', 'graph_mode': 'off', 'use_snp_selection': True, 'num_snps': 36675}. Best is trial 3 with value: 0.20577242551477953.
[I 2025-12-06 03:25:22,576] Trial 5 finished with value: 0.09186966422361477 and parameters: {'model_type': 'mlp', 'hidden_dims': '[512, 64]', 'dropout': 0.38275350994408375, 'batch_norm': True, 'lr': 1.5586664309232824e-06, 'weight_decay': 0.0008227664668621182, 'epochs': 145, 'loss': 'mae', 'optimizer': 'adam', 'graph_mode': 'off', 'use_snp_selection': True, 'num_snps': 32148}. Best is trial 3 with value: 0.20577242551477953.
[I 2025-12-06 03:25:54,953] Trial 6 finished with value: 0.18644480930394874 and parameters: {'model_type': 'mlp', 'hidden_dims': '[256, 128]', 'dropout': 0.3930109900265879, 'batch_norm': False, 'lr': 4.892964372128395e-05, 'weight_decay': 1.5809549317992182e-06, 'epochs': 199, 'loss': 'mse', 'optimizer': 'adam', 'graph_mode': 'off', 'use_snp_selection': False}. Best is trial 3 with value: 0.20577242551477953.
[I 2025-12-06 03:26:28,214] Trial 7 finished with value: 0.17978193248320157 and parameters: {'model_type': 'mlp', 'hidden_dims': '[512, 256]', 'dropout': 0.15343979219678458, 'batch_norm': True, 'lr': 6.234003099047341e-05, 'weight_decay': 3.894760610535477e-07, 'epochs': 97, 'loss': 'mse', 'optimizer': 'adam', 'graph_mode': 'off', 'use_snp_selection': False}. Best is trial 3 with value: 0.20577242551477953.
[I 2025-12-06 03:27:59,223] Trial 8 finished with value: 0.1865870933145833 and parameters: {'model_type': 'mlp', 'hidden_dims': '[512, 128]', 'dropout': 0.10743001231661406, 'batch_norm': True, 'lr': 0.00023728538449271062, 'weight_decay': 1.7629071578048637e-05, 'epochs': 312, 'loss': 'mae', 'optimizer': 'adam', 'graph_mode': 'off', 'use_snp_selection': False}. Best is trial 3 with value: 0.20577242551477953.
[I 2025-12-06 03:28:53,541] Trial 9 finished with value: 0.18623971299370226 and parameters: {'model_type': 'mlp', 'hidden_dims': '[512, 64]', 'dropout': 0.14505336736221927, 'batch_norm': True, 'lr': 5.8619638388111826e-05, 'weight_decay': 6.200156172669308e-07, 'epochs': 175, 'loss': 'mse', 'optimizer': 'adam', 'graph_mode': 'off', 'use_snp_selection': False}. Best is trial 3 with value: 0.20577242551477953.
[I 2025-12-06 03:29:15,422] Trial 10 finished with value: 0.151664629097285 and parameters: {'model_type': 'mlp', 'hidden_dims': '[512, 64]', 'dropout': 0.5885461262002587, 'batch_norm': False, 'lr': 8.769366258768696e-06, 'weight_decay': 2.78273193871783e-06, 'epochs': 55, 'loss': 'mae', 'optimizer': 'adam', 'graph_mode': 'off', 'use_snp_selection': False}. Best is trial 3 with value: 0.20577242551477953.
[I 2025-12-06 03:30:51,911] Trial 11 finished with value: 0.17192211491991266 and parameters: {'model_type': 'mlp', 'hidden_dims': '[512, 128]', 'dropout': 0.583942291816117, 'batch_norm': False, 'lr': 0.0007607980626791682, 'weight_decay': 2.11387030344014e-05, 'epochs': 346, 'loss': 'mae', 'optimizer': 'adam', 'graph_mode': 'off', 'use_snp_selection': False}. Best is trial 3 with value: 0.20577242551477953.
[I 2025-12-06 03:32:15,321] Trial 12 finished with value: 0.1935746352438569 and parameters: {'model_type': 'mlp', 'hidden_dims': '[512, 128]', 'dropout': 0.2637316882220091, 'batch_norm': False, 'lr': 0.000384886887018818, 'weight_decay': 6.23587291883057e-05, 'epochs': 294, 'loss': 'mae', 'optimizer': 'adam', 'graph_mode': 'off', 'use_snp_selection': False}. Best is trial 3 with value: 0.20577242551477953.
[I 2025-12-06 03:32:39,142] Trial 13 finished with value: 0.18528459873028963 and parameters: {'model_type': 'mlp', 'hidden_dims': '[128, 64]', 'dropout': 0.28178980110198326, 'batch_norm': False, 'lr': 1.3373175420781734e-05, 'weight_decay': 7.287276573694029e-05, 'epochs': 258, 'loss': 'mae', 'optimizer': 'adam', 'graph_mode': 'off', 'use_snp_selection': False}. Best is trial 3 with value: 0.20577242551477953.
[I 2025-12-06 03:33:23,402] Trial 14 finished with value: 0.14151011342935116 and parameters: {'model_type': 'mlp', 'hidden_dims': '[256, 128, 64]', 'dropout': 0.49945838328795056, 'batch_norm': False, 'lr': 0.000875907548496985, 'weight_decay': 1.1414924884997386e-07, 'epochs': 288, 'loss': 'mae', 'optimizer': 'adam', 'graph_mode': 'off', 'use_snp_selection': False}. Best is trial 3 with value: 0.20577242551477953.
[I 2025-12-06 03:34:30,695] Trial 15 finished with value: 0.1977039972619794 and parameters: {'model_type': 'mlp', 'hidden_dims': '[512, 256]', 'dropout': 0.3150448977110323, 'batch_norm': False, 'lr': 0.00025082177630769887, 'weight_decay': 6.682546297843178e-05, 'epochs': 231, 'loss': 'mae', 'optimizer': 'adam', 'graph_mode': 'off', 'use_snp_selection': False}. Best is trial 3 with value: 0.20577242551477953.
[I 2025-12-06 03:35:37,124] Trial 16 finished with value: 0.18830641460095326 and parameters: {'model_type': 'mlp', 'hidden_dims': '[512, 256]', 'dropout': 0.32991052690448897, 'batch_norm': False, 'lr': 2.1517090787442848e-05, 'weight_decay': 5.098763140321504e-06, 'epochs': 223, 'loss': 'mae', 'optimizer': 'adam', 'graph_mode': 'off', 'use_snp_selection': False}. Best is trial 3 with value: 0.20577242551477953.
[I 2025-12-06 03:36:36,928] Trial 17 finished with value: 0.19208117959234391 and parameters: {'model_type': 'mlp', 'hidden_dims': '[512, 256]', 'dropout': 0.49621638297688087, 'batch_norm': False, 'lr': 0.00015757341301155474, 'weight_decay': 0.0001926407929958507, 'epochs': 202, 'loss': 'mae', 'optimizer': 'adam', 'graph_mode': 'off', 'use_snp_selection': False}. Best is trial 3 with value: 0.20577242551477953.
[I 2025-12-06 03:38:23,499] Trial 18 finished with value: 0.1843940768343435 and parameters: {'model_type': 'mlp', 'hidden_dims': '[512, 256]', 'dropout': 0.48966784326139867, 'batch_norm': False, 'lr': 5.4850663591507836e-06, 'weight_decay': 3.8406508332565465e-05, 'epochs': 246, 'loss': 'mae', 'optimizer': 'adam', 'graph_mode': 'off', 'use_snp_selection': True, 'num_snps': 58241}. Best is trial 3 with value: 0.20577242551477953.
[I 2025-12-06 03:39:53,191] Trial 19 finished with value: 0.1913827980046921 and parameters: {'model_type': 'mlp', 'hidden_dims': '[512, 64]', 'dropout': 0.3255732506546632, 'batch_norm': False, 'lr': 0.00013008907717271205, 'weight_decay': 6.12206267817511e-06, 'epochs': 320, 'loss': 'mae', 'optimizer': 'adam', 'graph_mode': 'off', 'use_snp_selection': False}. Best is trial 3 with value: 0.20577242551477953.
[I 2025-12-06 03:40:33,511] Trial 20 finished with value: 0.1966133837862168 and parameters: {'model_type': 'mlp', 'hidden_dims': '[512, 64]', 'dropout': 0.22720693584988713, 'batch_norm': False, 'lr': 2.3361432915417936e-05, 'weight_decay': 0.00013085730167205134, 'epochs': 126, 'loss': 'mae', 'optimizer': 'adam', 'graph_mode': 'off', 'use_snp_selection': False}. Best is trial 3 with value: 0.20577242551477953.
[I 2025-12-06 03:41:03,957] Trial 21 finished with value: 0.20868984701698076 and parameters: {'model_type': 'mlp', 'hidden_dims': '[512, 64]', 'dropout': 0.21684413910827155, 'batch_norm': False, 'lr': 1.6837211771752744e-05, 'weight_decay': 0.00013936186155550533, 'epochs': 88, 'loss': 'mae', 'optimizer': 'adam', 'graph_mode': 'off', 'use_snp_selection': False}. Best is trial 21 with value: 0.20868984701698076.
[I 2025-12-06 03:41:25,794] Trial 22 finished with value: 0.14786782267482887 and parameters: {'model_type': 'mlp', 'hidden_dims': '[512, 64]', 'dropout': 0.3076826993576923, 'batch_norm': False, 'lr': 3.490450337057794e-06, 'weight_decay': 2.7995357335812167e-05, 'epochs': 55, 'loss': 'mae', 'optimizer': 'adam', 'graph_mode': 'off', 'use_snp_selection': False}. Best is trial 21 with value: 0.20868984701698076.
[I 2025-12-06 03:41:59,476] Trial 23 finished with value: 0.19779282658750638 and parameters: {'model_type': 'mlp', 'hidden_dims': '[512, 64]', 'dropout': 0.18745289914844948, 'batch_norm': False, 'lr': 1.2095324892817102e-05, 'weight_decay': 0.00011104091007685275, 'epochs': 100, 'loss': 'mae', 'optimizer': 'adam', 'graph_mode': 'off', 'use_snp_selection': False}. Best is trial 21 with value: 0.20868984701698076.
[I 2025-12-06 03:42:30,775] Trial 24 finished with value: 0.19157549226335094 and parameters: {'model_type': 'mlp', 'hidden_dims': '[512, 64]', 'dropout': 0.18483675294668558, 'batch_norm': False, 'lr': 1.1019489355248174e-05, 'weight_decay': 0.0005101377696628139, 'epochs': 91, 'loss': 'mae', 'optimizer': 'adam', 'graph_mode': 'off', 'use_snp_selection': False}. Best is trial 21 with value: 0.20868984701698076.
[I 2025-12-06 03:43:03,983] Trial 25 finished with value: 0.1936946299577766 and parameters: {'model_type': 'mlp', 'hidden_dims': '[512, 64]', 'dropout': 0.22144259204126704, 'batch_norm': False, 'lr': 6.957296081481843e-06, 'weight_decay': 0.00015305446028183634, 'epochs': 98, 'loss': 'mae', 'optimizer': 'adam', 'graph_mode': 'off', 'use_snp_selection': False}. Best is trial 21 with value: 0.20868984701698076.
