[I 2025-12-05 15:42:28,960] Trial 79 finished with value: 0.09030046589001722 and parameters: {'model_type': 'mlp', 'hidden_dims': '[256, 128]', 'dropout': 0.12356563419088347, 'batch_norm': False, 'lr': 5.058151880523421e-05, 'weight_decay': 1.9337151823764564e-05, 'epochs': 173, 'loss': 'mae', 'optimizer': 'adam', 'graph_mode': 'off', 'use_snp_selection': True, 'num_snps': 45736}. Best is trial 75 with value: 0.1034338442096587.
[I 2025-12-05 15:42:31,143] Trial 80 finished with value: 0.0817425645530658 and parameters: {'model_type': 'mlp', 'hidden_dims': '[256, 128, 64]', 'dropout': 0.12324300612249181, 'batch_norm': False, 'lr': 3.151958256648497e-05, 'weight_decay': 2.2974767977662547e-05, 'epochs': 174, 'loss': 'mae', 'optimizer': 'adam', 'graph_mode': 'off', 'use_snp_selection': True, 'num_snps': 45515}. Best is trial 75 with value: 0.1034338442096587.
[I 2025-12-05 15:42:33,499] Trial 81 finished with value: 0.08557801772861397 and parameters: {'model_type': 'mlp', 'hidden_dims': '[256, 128]', 'dropout': 0.10758318879670356, 'batch_norm': False, 'lr': 5.016598701023336e-05, 'weight_decay': 2.7366178484088727e-05, 'epochs': 192, 'loss': 'mae', 'optimizer': 'adam', 'graph_mode': 'off', 'use_snp_selection': True, 'num_snps': 50499}. Best is trial 75 with value: 0.1034338442096587.
[I 2025-12-05 15:42:35,585] Trial 82 finished with value: 0.08366433180830819 and parameters: {'model_type': 'mlp', 'hidden_dims': '[256, 128]', 'dropout': 0.14240600194415812, 'batch_norm': False, 'lr': 5.7302192284474335e-05, 'weight_decay': 3.9085573230890905e-05, 'epochs': 132, 'loss': 'mae', 'optimizer': 'adam', 'graph_mode': 'off', 'use_snp_selection': True, 'num_snps': 44145}. Best is trial 75 with value: 0.1034338442096587.
[I 2025-12-05 15:42:37,624] Trial 83 finished with value: 0.08815280310258113 and parameters: {'model_type': 'mlp', 'hidden_dims': '[256, 128]', 'dropout': 0.1234149308901347, 'batch_norm': False, 'lr': 0.00010545666631531712, 'weight_decay': 1.8412598342531652e-05, 'epochs': 169, 'loss': 'mae', 'optimizer': 'adam', 'graph_mode': 'off', 'use_snp_selection': True, 'num_snps': 40622}. Best is trial 75 with value: 0.1034338442096587.
[I 2025-12-05 15:42:40,036] Trial 84 finished with value: 0.052692417256769486 and parameters: {'model_type': 'mlp', 'hidden_dims': '[256, 128]', 'dropout': 0.5509811935196718, 'batch_norm': False, 'lr': 7.257842962657053e-05, 'weight_decay': 1.0583350541274666e-05, 'epochs': 158, 'loss': 'mae', 'optimizer': 'adam', 'graph_mode': 'off', 'use_snp_selection': True, 'num_snps': 53953}. Best is trial 75 with value: 0.1034338442096587.
[I 2025-12-05 15:42:42,323] Trial 85 finished with value: 0.08832497079521069 and parameters: {'model_type': 'mlp', 'hidden_dims': '[256, 128]', 'dropout': 0.1504607265658434, 'batch_norm': False, 'lr': 3.11475926213904e-05, 'weight_decay': 3.269933927364772e-05, 'epochs': 179, 'loss': 'mae', 'optimizer': 'adam', 'graph_mode': 'off', 'use_snp_selection': True, 'num_snps': 48213}. Best is trial 75 with value: 0.1034338442096587.
[I 2025-12-05 15:42:44,703] Trial 86 finished with value: 0.057522189762013794 and parameters: {'model_type': 'mlp', 'hidden_dims': '[256, 128]', 'dropout': 0.13042242240601534, 'batch_norm': True, 'lr': 4.722136776327705e-05, 'weight_decay': 3.1884735070508695e-05, 'epochs': 210, 'loss': 'mae', 'optimizer': 'adam', 'graph_mode': 'off', 'use_snp_selection': True, 'num_snps': 48718}. Best is trial 75 with value: 0.1034338442096587.
[I 2025-12-05 15:42:48,004] Trial 87 finished with value: 0.07190496468848806 and parameters: {'model_type': 'mlp', 'hidden_dims': '[512, 64]', 'dropout': 0.10000015978378522, 'batch_norm': False, 'lr': 3.0078007999436897e-05, 'weight_decay': 2.1182842059318003e-05, 'epochs': 297, 'loss': 'mae', 'optimizer': 'adam', 'graph_mode': 'off', 'use_snp_selection': True, 'num_snps': 56424}. Best is trial 75 with value: 0.1034338442096587.
[I 2025-12-05 15:42:50,437] Trial 88 finished with value: 0.08564631542354104 and parameters: {'model_type': 'mlp', 'hidden_dims': '[512, 256]', 'dropout': 0.15035678769897942, 'batch_norm': False, 'lr': 3.595399651090119e-05, 'weight_decay': 6.176791168148117e-05, 'epochs': 180, 'loss': 'mae', 'optimizer': 'adam', 'graph_mode': 'off', 'use_snp_selection': True, 'num_snps': 44549}. Best is trial 75 with value: 0.1034338442096587.
[I 2025-12-05 15:42:53,032] Trial 89 finished with value: 0.09083174152537327 and parameters: {'model_type': 'mlp', 'hidden_dims': '[256, 128]', 'dropout': 0.4268718959125253, 'batch_norm': False, 'lr': 2.5061345329004456e-05, 'weight_decay': 0.00015349919673230455, 'epochs': 200, 'loss': 'mae', 'optimizer': 'adam', 'graph_mode': 'off', 'use_snp_selection': True, 'num_snps': 55062}. Best is trial 75 with value: 0.1034338442096587.
[I 2025-12-05 15:42:55,507] Trial 90 finished with value: 0.07295083958509602 and parameters: {'model_type': 'mlp', 'hidden_dims': '[256, 128]', 'dropout': 0.42459402728469475, 'batch_norm': False, 'lr': 2.5179673470331092e-05, 'weight_decay': 9.151397725770685e-05, 'epochs': 163, 'loss': 'mae', 'optimizer': 'adam', 'graph_mode': 'off', 'use_snp_selection': True, 'num_snps': 55202}. Best is trial 75 with value: 0.1034338442096587.
[I 2025-12-05 15:42:57,822] Trial 91 finished with value: 0.09013270381270884 and parameters: {'model_type': 'mlp', 'hidden_dims': '[256, 128]', 'dropout': 0.4035434516164042, 'batch_norm': False, 'lr': 2.215654687451664e-05, 'weight_decay': 0.0001666547676162286, 'epochs': 188, 'loss': 'mae', 'optimizer': 'adam', 'graph_mode': 'off', 'use_snp_selection': True, 'num_snps': 48981}. Best is trial 75 with value: 0.1034338442096587.
[I 2025-12-05 15:43:00,248] Trial 92 finished with value: 0.06425435785406303 and parameters: {'model_type': 'mlp', 'hidden_dims': '[256, 128]', 'dropout': 0.4462220457527772, 'batch_norm': False, 'lr': 1.873444098224563e-05, 'weight_decay': 0.00019180076079353174, 'epochs': 213, 'loss': 'mae', 'optimizer': 'adam', 'graph_mode': 'off', 'use_snp_selection': True, 'num_snps': 50224}. Best is trial 75 with value: 0.1034338442096587.
[I 2025-12-05 15:43:02,489] Trial 93 finished with value: 0.05121733564673971 and parameters: {'model_type': 'mlp', 'hidden_dims': '[256, 128]', 'dropout': 0.3883395965215319, 'batch_norm': False, 'lr': 1.2600440861799825e-05, 'weight_decay': 0.0002566355800754273, 'epochs': 201, 'loss': 'mae', 'optimizer': 'adam', 'graph_mode': 'off', 'use_snp_selection': True, 'num_snps': 45625}. Best is trial 75 with value: 0.1034338442096587.
[I 2025-12-05 15:43:05,180] Trial 94 finished with value: 0.059620993955028734 and parameters: {'model_type': 'mlp', 'hidden_dims': '[256, 128]', 'dropout': 0.4016148970039507, 'batch_norm': False, 'lr': 2.35383034804806e-05, 'weight_decay': 0.0007338469544445367, 'epochs': 188, 'loss': 'mae', 'optimizer': 'adam', 'graph_mode': 'off', 'use_snp_selection': True, 'num_snps': 59450}. Best is trial 75 with value: 0.1034338442096587.
[I 2025-12-05 15:43:07,606] Trial 95 finished with value: 0.07589053742090131 and parameters: {'model_type': 'mlp', 'hidden_dims': '[256, 128]', 'dropout': 0.4155846866194435, 'batch_norm': False, 'lr': 4.3634268427290374e-05, 'weight_decay': 0.00010151466195660699, 'epochs': 173, 'loss': 'mae', 'optimizer': 'adam', 'graph_mode': 'off', 'use_snp_selection': True, 'num_snps': 53506}. Best is trial 75 with value: 0.1034338442096587.
[I 2025-12-05 15:43:09,492] Trial 96 finished with value: 0.07650858832303593 and parameters: {'model_type': 'mlp', 'hidden_dims': '[256, 128]', 'dropout': 0.4555634487618969, 'batch_norm': False, 'lr': 2.236522035165529e-05, 'weight_decay': 0.0001330704918289804, 'epochs': 197, 'loss': 'mae', 'optimizer': 'adam', 'graph_mode': 'off', 'use_snp_selection': True, 'num_snps': 37398}. Best is trial 75 with value: 0.1034338442096587.
[I 2025-12-05 15:43:10,667] Trial 97 finished with value: 0.07830355413063558 and parameters: {'model_type': 'mlp', 'hidden_dims': '[256, 128]', 'dropout': 0.3702258335222851, 'batch_norm': False, 'lr': 6.647713185267397e-05, 'weight_decay': 0.00015615435161109406, 'epochs': 222, 'loss': 'mae', 'optimizer': 'adam', 'graph_mode': 'off', 'use_snp_selection': True, 'num_snps': 13012}. Best is trial 75 with value: 0.1034338442096587.
[I 2025-12-05 15:43:13,235] Trial 98 finished with value: 0.07884934375303872 and parameters: {'model_type': 'mlp', 'hidden_dims': '[512, 128]', 'dropout': 0.4937689527370829, 'batch_norm': False, 'lr': 3.849817145516815e-05, 'weight_decay': 0.0003831675632032916, 'epochs': 185, 'loss': 'mae', 'optimizer': 'adam', 'graph_mode': 'off', 'use_snp_selection': True, 'num_snps': 47272}. Best is trial 75 with value: 0.1034338442096587.
[I 2025-12-05 15:43:15,888] Trial 99 finished with value: 0.08629951579729014 and parameters: {'model_type': 'mlp', 'hidden_dims': '[256, 128]', 'dropout': 0.4284481379036874, 'batch_norm': True, 'lr': 5.081199354936733e-05, 'weight_decay': 0.00022913352237280223, 'epochs': 234, 'loss': 'mae', 'optimizer': 'adam', 'graph_mode': 'off', 'use_snp_selection': True, 'num_snps': 56368}. Best is trial 75 with value: 0.1034338442096587.
[I 2025-12-05 15:43:17,827] Trial 100 finished with value: 0.04684265399998523 and parameters: {'model_type': 'mlp', 'hidden_dims': '[256, 128, 64]', 'dropout': 0.4104165789323353, 'batch_norm': False, 'lr': 3.4366900528924104e-05, 'weight_decay': 6.539073232429117e-05, 'epochs': 148, 'loss': 'mae', 'optimizer': 'adam', 'graph_mode': 'off', 'use_snp_selection': True, 'num_snps': 40368}. Best is trial 75 with value: 0.1034338442096587.
[I 2025-12-05 15:43:20,095] Trial 101 finished with value: 0.08396949850799929 and parameters: {'model_type': 'mlp', 'hidden_dims': '[256, 128]', 'dropout': 0.11903465296958421, 'batch_norm': False, 'lr': 3.055762310327868e-05, 'weight_decay': 4.2006252882500155e-05, 'epochs': 178, 'loss': 'mae', 'optimizer': 'adam', 'graph_mode': 'off', 'use_snp_selection': True, 'num_snps': 49058}. Best is trial 75 with value: 0.1034338442096587.
[I 2025-12-05 15:43:22,187] Trial 102 finished with value: 0.07178850493754212 and parameters: {'model_type': 'mlp', 'hidden_dims': '[256, 128]', 'dropout': 0.4720452336798351, 'batch_norm': False, 'lr': 2.7946123596925503e-05, 'weight_decay': 2.5812564681414186e-05, 'epochs': 161, 'loss': 'mae', 'optimizer': 'adam', 'graph_mode': 'off', 'use_snp_selection': True, 'num_snps': 43635}. Best is trial 75 with value: 0.1034338442096587.
[I 2025-12-05 15:43:24,414] Trial 103 finished with value: 0.07648345525468288 and parameters: {'model_type': 'mlp', 'hidden_dims': '[256, 128]', 'dropout': 0.17221531958900946, 'batch_norm': False, 'lr': 1.7836045233278728e-05, 'weight_decay': 1.2692564933326859e-05, 'epochs': 190, 'loss': 'mae', 'optimizer': 'adam', 'graph_mode': 'off', 'use_snp_selection': True, 'num_snps': 47072}. Best is trial 75 with value: 0.1034338442096587.
[I 2025-12-05 15:43:26,782] Trial 104 finished with value: 0.08525439575804213 and parameters: {'model_type': 'mlp', 'hidden_dims': '[256, 128]', 'dropout': 0.441802231147959, 'batch_norm': False, 'lr': 5.500644729218397e-05, 'weight_decay': 0.00032352124131579277, 'epochs': 171, 'loss': 'mae', 'optimizer': 'adam', 'graph_mode': 'off', 'use_snp_selection': True, 'num_snps': 52206}. Best is trial 75 with value: 0.1034338442096587.
[I 2025-12-05 15:43:28,927] Trial 105 finished with value: 0.08298427210843846 and parameters: {'model_type': 'mlp', 'hidden_dims': '[256, 128]', 'dropout': 0.13388931558159625, 'batch_norm': False, 'lr': 8.375852642750194e-05, 'weight_decay': 3.4898179289592724e-05, 'epochs': 203, 'loss': 'mae', 'optimizer': 'adam', 'graph_mode': 'off', 'use_snp_selection': True, 'num_snps': 42977}. Best is trial 75 with value: 0.1034338442096587.
[I 2025-12-05 15:43:31,161] Trial 106 finished with value: 0.06618905187956389 and parameters: {'model_type': 'mlp', 'hidden_dims': '[256, 128]', 'dropout': 0.15791495206889336, 'batch_norm': False, 'lr': 4.222365061488912e-05, 'weight_decay': 0.00045337827615517164, 'epochs': 155, 'loss': 'mae', 'optimizer': 'adam', 'graph_mode': 'off', 'use_snp_selection': True, 'num_snps': 48462}. Best is trial 75 with value: 0.1034338442096587.
[I 2025-12-05 15:43:33,649] Trial 107 finished with value: 0.07119697910551749 and parameters: {'model_type': 'mlp', 'hidden_dims': '[512, 64]', 'dropout': 0.14445518557333537, 'batch_norm': False, 'lr': 2.085083255790996e-05, 'weight_decay': 0.0001548496445628686, 'epochs': 180, 'loss': 'mae', 'optimizer': 'adam', 'graph_mode': 'off', 'use_snp_selection': True, 'num_snps': 45933}. Best is trial 75 with value: 0.1034338442096587.
[I 2025-12-05 15:43:35,364] Trial 108 finished with value: 0.08975967419692546 and parameters: {'model_type': 'mlp', 'hidden_dims': '[256, 128]', 'dropout': 0.11166904487018824, 'batch_norm': False, 'lr': 6.444441127858607e-05, 'weight_decay': 7.44584662762024e-05, 'epochs': 136, 'loss': 'mae', 'optimizer': 'adam', 'graph_mode': 'off', 'use_snp_selection': True, 'num_snps': 35062}. Best is trial 75 with value: 0.1034338442096587.
[I 2025-12-05 15:43:36,544] Trial 109 finished with value: 0.08804620033222395 and parameters: {'model_type': 'mlp', 'hidden_dims': '[512, 256]', 'dropout': 0.11404954173591635, 'batch_norm': False, 'lr': 0.00012374376257571836, 'weight_decay': 9.030250397787e-05, 'epochs': 111, 'loss': 'mae', 'optimizer': 'adam', 'graph_mode': 'off', 'use_snp_selection': False}. Best is trial 75 with value: 0.1034338442096587.
[I 2025-12-05 15:43:38,267] Trial 110 finished with value: 0.09696692297905495 and parameters: {'model_type': 'mlp', 'hidden_dims': '[256, 128]', 'dropout': 0.13331232201448454, 'batch_norm': False, 'lr': 6.62771002963805e-05, 'weight_decay': 5.250199897821305e-05, 'epochs': 126, 'loss': 'mae', 'optimizer': 'adam', 'graph_mode': 'off', 'use_snp_selection': True, 'num_snps': 35423}. Best is trial 75 with value: 0.1034338442096587.
[I 2025-12-05 15:43:39,944] Trial 111 finished with value: 0.08195759888982908 and parameters: {'model_type': 'mlp', 'hidden_dims': '[256, 128]', 'dropout': 0.13127745189311538, 'batch_norm': False, 'lr': 6.609121519042092e-05, 'weight_decay': 4.982948537473359e-05, 'epochs': 135, 'loss': 'mae', 'optimizer': 'adam', 'graph_mode': 'off', 'use_snp_selection': True, 'num_snps': 33961}. Best is trial 75 with value: 0.1034338442096587.
[I 2025-12-05 15:43:41,480] Trial 112 finished with value: 0.09184029058730919 and parameters: {'model_type': 'mlp', 'hidden_dims': '[256, 128]', 'dropout': 0.10022567933186824, 'batch_norm': False, 'lr': 4.568186931725399e-05, 'weight_decay': 4.789954262815115e-05, 'epochs': 119, 'loss': 'mae', 'optimizer': 'adam', 'graph_mode': 'off', 'use_snp_selection': True, 'num_snps': 29525}. Best is trial 75 with value: 0.1034338442096587.
[I 2025-12-05 15:43:43,018] Trial 113 finished with value: 0.0908227391853887 and parameters: {'model_type': 'mlp', 'hidden_dims': '[256, 128]', 'dropout': 0.11963410013181063, 'batch_norm': False, 'lr': 8.109462574178987e-05, 'weight_decay': 2.162823764021853e-05, 'epochs': 120, 'loss': 'mae', 'optimizer': 'adam', 'graph_mode': 'off', 'use_snp_selection': True, 'num_snps': 28955}. Best is trial 75 with value: 0.1034338442096587.
[I 2025-12-05 15:43:44,552] Trial 114 finished with value: 0.07277035854687607 and parameters: {'model_type': 'mlp', 'hidden_dims': '[256, 128]', 'dropout': 0.10012535588560226, 'batch_norm': False, 'lr': 8.538105072642053e-05, 'weight_decay': 1.9840718578396096e-05, 'epochs': 102, 'loss': 'mae', 'optimizer': 'adam', 'graph_mode': 'off', 'use_snp_selection': True, 'num_snps': 30468}. Best is trial 75 with value: 0.1034338442096587.
[I 2025-12-05 15:43:46,127] Trial 115 finished with value: 0.10120706091625141 and parameters: {'model_type': 'mlp', 'hidden_dims': '[256, 128]', 'dropout': 0.12414781608621399, 'batch_norm': False, 'lr': 4.75110007965393e-05, 'weight_decay': 1.4522254925959314e-05, 'epochs': 128, 'loss': 'mae', 'optimizer': 'adam', 'graph_mode': 'off', 'use_snp_selection': True, 'num_snps': 30350}. Best is trial 75 with value: 0.1034338442096587.
[I 2025-12-05 15:43:47,024] Trial 116 finished with value: 0.0869432393532185 and parameters: {'model_type': 'mlp', 'hidden_dims': '[256, 128]', 'dropout': 0.12519975557416238, 'batch_norm': False, 'lr': 4.6777455404265164e-05, 'weight_decay': 1.455222834204224e-05, 'epochs': 117, 'loss': 'mae', 'optimizer': 'adam', 'graph_mode': 'off', 'use_snp_selection': False}. Best is trial 75 with value: 0.1034338442096587.
[I 2025-12-05 15:43:48,416] Trial 117 finished with value: 0.07025744548453171 and parameters: {'model_type': 'mlp', 'hidden_dims': '[256, 128]', 'dropout': 0.11412096089612316, 'batch_norm': False, 'lr': 4.006784743678842e-05, 'weight_decay': 2.3126907440457468e-05, 'epochs': 90, 'loss': 'mae', 'optimizer': 'adam', 'graph_mode': 'off', 'use_snp_selection': True, 'num_snps': 26236}. Best is trial 75 with value: 0.1034338442096587.
[I 2025-12-05 15:43:50,038] Trial 118 finished with value: 0.08500392563488063 and parameters: {'model_type': 'mlp', 'hidden_dims': '[256, 128]', 'dropout': 0.13136333797682676, 'batch_norm': True, 'lr': 5.107815804179713e-05, 'weight_decay': 1.0065857421601483e-05, 'epochs': 126, 'loss': 'mae', 'optimizer': 'adam', 'graph_mode': 'off', 'use_snp_selection': True, 'num_snps': 30180}. Best is trial 75 with value: 0.1034338442096587.
[I 2025-12-05 15:43:50,925] Trial 119 finished with value: 0.08532808856700336 and parameters: {'model_type': 'mlp', 'hidden_dims': '[256, 128]', 'dropout': 0.1403182467514725, 'batch_norm': False, 'lr': 8.083445544332814e-05, 'weight_decay': 8.477597682147444e-06, 'epochs': 119, 'loss': 'mae', 'optimizer': 'adam', 'graph_mode': 'off', 'use_snp_selection': False}. Best is trial 75 with value: 0.1034338442096587.
[I 2025-12-05 15:43:52,218] Trial 120 finished with value: 0.08643325342350278 and parameters: {'model_type': 'mlp', 'hidden_dims': '[256, 128]', 'dropout': 0.1678286584872987, 'batch_norm': False, 'lr': 9.586332732572925e-05, 'weight_decay': 1.6638365421804373e-05, 'epochs': 108, 'loss': 'mae', 'optimizer': 'adam', 'graph_mode': 'off', 'use_snp_selection': True, 'num_snps': 22355}. Best is trial 75 with value: 0.1034338442096587.
[I 2025-12-05 15:43:53,785] Trial 121 finished with value: 0.08390332189868681 and parameters: {'model_type': 'mlp', 'hidden_dims': '[256, 128]', 'dropout': 0.10862472812313691, 'batch_norm': False, 'lr': 5.3724559015836547e-05, 'weight_decay': 2.8840883800770546e-05, 'epochs': 125, 'loss': 'mae', 'optimizer': 'adam', 'graph_mode': 'off', 'use_snp_selection': True, 'num_snps': 30229}. Best is trial 75 with value: 0.1034338442096587.
[I 2025-12-05 15:43:55,273] Trial 122 finished with value: 0.07718513892542525 and parameters: {'model_type': 'mlp', 'hidden_dims': '[256, 128]', 'dropout': 0.12169028721377452, 'batch_norm': False, 'lr': 7.331702634892784e-05, 'weight_decay': 4.6097361123391725e-05, 'epochs': 129, 'loss': 'mae', 'optimizer': 'adam', 'graph_mode': 'off', 'use_snp_selection': True, 'num_snps': 28430}. Best is trial 75 with value: 0.1034338442096587.
[I 2025-12-05 15:43:56,720] Trial 123 finished with value: 0.10048527572180795 and parameters: {'model_type': 'mlp', 'hidden_dims': '[256, 128]', 'dropout': 0.15714734881195247, 'batch_norm': False, 'lr': 5.8346658184411846e-05, 'weight_decay': 1.2385257887071775e-05, 'epochs': 145, 'loss': 'mae', 'optimizer': 'adam', 'graph_mode': 'off', 'use_snp_selection': True, 'num_snps': 25307}. Best is trial 75 with value: 0.1034338442096587.
[I 2025-12-05 15:43:58,064] Trial 124 finished with value: 0.07664878803439874 and parameters: {'model_type': 'mlp', 'hidden_dims': '[256, 128]', 'dropout': 0.18075565051916118, 'batch_norm': False, 'lr': 3.6207055856738025e-05, 'weight_decay': 1.2121251776484006e-05, 'epochs': 95, 'loss': 'mae', 'optimizer': 'adam', 'graph_mode': 'off', 'use_snp_selection': True, 'num_snps': 25558}. Best is trial 75 with value: 0.1034338442096587.
[I 2025-12-05 15:43:59,506] Trial 125 finished with value: 0.1039116816153847 and parameters: {'model_type': 'mlp', 'hidden_dims': '[512, 128]', 'dropout': 0.14169487952973048, 'batch_norm': False, 'lr': 0.00014325665758239424, 'weight_decay': 7.071263877159612e-06, 'epochs': 145, 'loss': 'mae', 'optimizer': 'adam', 'graph_mode': 'off', 'use_snp_selection': True, 'num_snps': 23432}. Best is trial 125 with value: 0.1039116816153847.
[I 2025-12-05 15:44:00,939] Trial 126 finished with value: 0.09435081457142513 and parameters: {'model_type': 'mlp', 'hidden_dims': '[512, 128]', 'dropout': 0.14429281107287462, 'batch_norm': False, 'lr': 0.00014213842148328294, 'weight_decay': 7.755617258162336e-06, 'epochs': 145, 'loss': 'mae', 'optimizer': 'adam', 'graph_mode': 'off', 'use_snp_selection': True, 'num_snps': 23045}. Best is trial 125 with value: 0.1039116816153847.
[I 2025-12-05 15:44:02,119] Trial 127 finished with value: 0.08437611116842653 and parameters: {'model_type': 'mlp', 'hidden_dims': '[512, 128]', 'dropout': 0.1410721117082955, 'batch_norm': False, 'lr': 0.00016956055134266507, 'weight_decay': 8.498615984889106e-06, 'epochs': 146, 'loss': 'mae', 'optimizer': 'adam', 'graph_mode': 'off', 'use_snp_selection': True, 'num_snps': 17011}. Best is trial 125 with value: 0.1039116816153847.
[I 2025-12-05 15:44:03,545] Trial 128 finished with value: 0.09062689732285689 and parameters: {'model_type': 'mlp', 'hidden_dims': '[512, 128]', 'dropout': 0.15754727210919775, 'batch_norm': False, 'lr': 0.00023446865759199894, 'weight_decay': 6.047768093711553e-06, 'epochs': 143, 'loss': 'mae', 'optimizer': 'adam', 'graph_mode': 'off', 'use_snp_selection': True, 'num_snps': 23136}. Best is trial 125 with value: 0.1039116816153847.
