[I 2025-12-05 14:45:08,206] Trial 121 finished with value: 0.13901894862402966 and parameters: {'model_type': 'mlp', 'hidden_dims': '[512, 128]', 'dropout': 0.10671307744049147, 'batch_norm': True, 'lr': 0.0004958853215920139, 'weight_decay': 0.00022471163393320427, 'epochs': 270, 'loss': 'mae', 'optimizer': 'adam', 'graph_mode': 'off', 'use_snp_selection': False}. Best is trial 34 with value: 0.15284138160430905.
[I 2025-12-05 14:45:11,906] Trial 122 finished with value: 0.13867189059661184 and parameters: {'model_type': 'mlp', 'hidden_dims': '[512, 128]', 'dropout': 0.5768500005308357, 'batch_norm': True, 'lr': 0.0008024515028111206, 'weight_decay': 0.00025891594402702866, 'epochs': 251, 'loss': 'mae', 'optimizer': 'adam', 'graph_mode': 'off', 'use_snp_selection': False}. Best is trial 34 with value: 0.15284138160430905.
[I 2025-12-05 14:45:16,102] Trial 123 finished with value: 0.14565586736260858 and parameters: {'model_type': 'mlp', 'hidden_dims': '[512, 128]', 'dropout': 0.11726797552082795, 'batch_norm': True, 'lr': 4.396932791876234e-05, 'weight_decay': 3.103575909601621e-05, 'epochs': 293, 'loss': 'mae', 'optimizer': 'adam', 'graph_mode': 'off', 'use_snp_selection': False}. Best is trial 34 with value: 0.15284138160430905.
[I 2025-12-05 14:45:20,225] Trial 124 finished with value: 0.14273993154234596 and parameters: {'model_type': 'mlp', 'hidden_dims': '[512, 128]', 'dropout': 0.10435856342469897, 'batch_norm': True, 'lr': 0.0005347457455231164, 'weight_decay': 0.00018923866105282052, 'epochs': 287, 'loss': 'mae', 'optimizer': 'adam', 'graph_mode': 'off', 'use_snp_selection': False}. Best is trial 34 with value: 0.15284138160430905.
[I 2025-12-05 14:45:24,088] Trial 125 finished with value: 0.15503171470862398 and parameters: {'model_type': 'mlp', 'hidden_dims': '[512, 256]', 'dropout': 0.13298682254666594, 'batch_norm': True, 'lr': 0.0003569768527659518, 'weight_decay': 0.00011066940041856741, 'epochs': 264, 'loss': 'mae', 'optimizer': 'adam', 'graph_mode': 'off', 'use_snp_selection': False}. Best is trial 125 with value: 0.15503171470862398.
[I 2025-12-05 14:45:27,572] Trial 126 finished with value: 0.12787729512646331 and parameters: {'model_type': 'mlp', 'hidden_dims': '[512, 256]', 'dropout': 0.1572666859079474, 'batch_norm': True, 'lr': 0.00033092272222135817, 'weight_decay': 0.00010653539733871919, 'epochs': 258, 'loss': 'mae', 'optimizer': 'adam', 'graph_mode': 'off', 'use_snp_selection': True, 'num_snps': 28304}. Best is trial 125 with value: 0.15503171470862398.
[I 2025-12-05 14:45:31,238] Trial 127 finished with value: 0.13071954507865616 and parameters: {'model_type': 'mlp', 'hidden_dims': '[512, 256]', 'dropout': 0.5677660722705007, 'batch_norm': True, 'lr': 0.00026496063443833516, 'weight_decay': 0.00013876426331178222, 'epochs': 247, 'loss': 'mae', 'optimizer': 'adam', 'graph_mode': 'off', 'use_snp_selection': False}. Best is trial 125 with value: 0.15503171470862398.
[I 2025-12-05 14:45:34,178] Trial 128 finished with value: 0.144865586120417 and parameters: {'model_type': 'mlp', 'hidden_dims': '[512, 256]', 'dropout': 0.14748323407525762, 'batch_norm': True, 'lr': 0.0003793367566209301, 'weight_decay': 1.9404802071001336e-07, 'epochs': 185, 'loss': 'mae', 'optimizer': 'adam', 'graph_mode': 'off', 'use_snp_selection': False}. Best is trial 125 with value: 0.15503171470862398.
[I 2025-12-05 14:45:38,650] Trial 129 finished with value: 0.1408351256254454 and parameters: {'model_type': 'mlp', 'hidden_dims': '[512, 256]', 'dropout': 0.13181826227247956, 'batch_norm': True, 'lr': 0.0004381089498818193, 'weight_decay': 8.804137575267882e-05, 'epochs': 316, 'loss': 'mse', 'optimizer': 'adam', 'graph_mode': 'off', 'use_snp_selection': False}. Best is trial 125 with value: 0.15503171470862398.
[I 2025-12-05 14:45:41,853] Trial 130 finished with value: 0.1317654188284242 and parameters: {'model_type': 'mlp', 'hidden_dims': '[512, 256]', 'dropout': 0.5573438250619037, 'batch_norm': True, 'lr': 0.0006409103997457309, 'weight_decay': 6.179835778912567e-05, 'epochs': 208, 'loss': 'mae', 'optimizer': 'adam', 'graph_mode': 'off', 'use_snp_selection': False}. Best is trial 125 with value: 0.15503171470862398.
[I 2025-12-05 14:45:45,825] Trial 131 finished with value: 0.14995342425355035 and parameters: {'model_type': 'mlp', 'hidden_dims': '[512, 128]', 'dropout': 0.10113910307449298, 'batch_norm': True, 'lr': 0.0005276210581004068, 'weight_decay': 4.4958739245605904e-05, 'epochs': 274, 'loss': 'mae', 'optimizer': 'adam', 'graph_mode': 'off', 'use_snp_selection': False}. Best is trial 125 with value: 0.15503171470862398.
[I 2025-12-05 14:45:48,242] Trial 132 finished with value: 0.14627610838916422 and parameters: {'model_type': 'mlp', 'hidden_dims': '[256, 128]', 'dropout': 0.12046301108678929, 'batch_norm': True, 'lr': 0.0007351066234055526, 'weight_decay': 4.0539286751855624e-05, 'epochs': 278, 'loss': 'mae', 'optimizer': 'adam', 'graph_mode': 'off', 'use_snp_selection': False}. Best is trial 125 with value: 0.15503171470862398.
[I 2025-12-05 14:45:52,207] Trial 133 finished with value: 0.146665892156149 and parameters: {'model_type': 'mlp', 'hidden_dims': '[512, 64]', 'dropout': 0.14420795284764065, 'batch_norm': True, 'lr': 0.0005828832811188728, 'weight_decay': 4.6475099306912816e-05, 'epochs': 274, 'loss': 'mae', 'optimizer': 'adam', 'graph_mode': 'off', 'use_snp_selection': False}. Best is trial 125 with value: 0.15503171470862398.
[I 2025-12-05 14:45:56,277] Trial 134 finished with value: 0.1402770699880512 and parameters: {'model_type': 'mlp', 'hidden_dims': '[512, 128]', 'dropout': 0.10138729779725261, 'batch_norm': True, 'lr': 0.0004629912972833918, 'weight_decay': 2.949224326169012e-07, 'epochs': 282, 'loss': 'mae', 'optimizer': 'adam', 'graph_mode': 'off', 'use_snp_selection': False}. Best is trial 125 with value: 0.15503171470862398.
[I 2025-12-05 14:46:00,138] Trial 135 finished with value: 0.1505041787965584 and parameters: {'model_type': 'mlp', 'hidden_dims': '[512, 256]', 'dropout': 0.17209877408900737, 'batch_norm': True, 'lr': 0.00035894125657972263, 'weight_decay': 5.666744789721387e-05, 'epochs': 264, 'loss': 'mae', 'optimizer': 'adam', 'graph_mode': 'off', 'use_snp_selection': False}. Best is trial 125 with value: 0.15503171470862398.
[I 2025-12-05 14:46:03,996] Trial 136 finished with value: 0.128961898690232 and parameters: {'model_type': 'mlp', 'hidden_dims': '[512, 256]', 'dropout': 0.17510647676364338, 'batch_norm': True, 'lr': 5.75833810905279e-05, 'weight_decay': 7.358094006039228e-05, 'epochs': 263, 'loss': 'mae', 'optimizer': 'adam', 'graph_mode': 'off', 'use_snp_selection': False}. Best is trial 125 with value: 0.15503171470862398.
[I 2025-12-05 14:46:07,585] Trial 137 finished with value: 0.14752136275130145 and parameters: {'model_type': 'mlp', 'hidden_dims': '[512, 256]', 'dropout': 0.1634273663592608, 'batch_norm': True, 'lr': 0.00029071022846752654, 'weight_decay': 5.7769119929173826e-05, 'epochs': 241, 'loss': 'mae', 'optimizer': 'adam', 'graph_mode': 'off', 'use_snp_selection': False}. Best is trial 125 with value: 0.15503171470862398.
[I 2025-12-05 14:46:11,187] Trial 138 finished with value: 0.14207401774357054 and parameters: {'model_type': 'mlp', 'hidden_dims': '[512, 256]', 'dropout': 0.17004164287485854, 'batch_norm': True, 'lr': 0.00021821724997384706, 'weight_decay': 2.8695001828743448e-05, 'epochs': 242, 'loss': 'mae', 'optimizer': 'adam', 'graph_mode': 'off', 'use_snp_selection': False}. Best is trial 125 with value: 0.15503171470862398.
[I 2025-12-05 14:46:14,670] Trial 139 finished with value: 0.13106926387288598 and parameters: {'model_type': 'mlp', 'hidden_dims': '[512, 256]', 'dropout': 0.155431073853678, 'batch_norm': False, 'lr': 0.0002923543316642674, 'weight_decay': 5.910602017154931e-05, 'epochs': 234, 'loss': 'mae', 'optimizer': 'adam', 'graph_mode': 'off', 'use_snp_selection': False}. Best is trial 125 with value: 0.15503171470862398.
[I 2025-12-05 14:46:18,444] Trial 140 finished with value: 0.14376205503144182 and parameters: {'model_type': 'mlp', 'hidden_dims': '[512, 256]', 'dropout': 0.24251769854990507, 'batch_norm': True, 'lr': 0.0003558952359345338, 'weight_decay': 1.904335089005203e-05, 'epochs': 256, 'loss': 'mae', 'optimizer': 'adam', 'graph_mode': 'off', 'use_snp_selection': False}. Best is trial 125 with value: 0.15503171470862398.
[I 2025-12-05 14:46:21,521] Trial 141 finished with value: 0.13420164816802227 and parameters: {'model_type': 'mlp', 'hidden_dims': '[512, 256]', 'dropout': 0.1323769257832556, 'batch_norm': True, 'lr': 0.0002642465871344759, 'weight_decay': 4.871170403877728e-05, 'epochs': 197, 'loss': 'mae', 'optimizer': 'adam', 'graph_mode': 'off', 'use_snp_selection': False}. Best is trial 125 with value: 0.15503171470862398.
[I 2025-12-05 14:46:25,381] Trial 142 finished with value: 0.1399731214478821 and parameters: {'model_type': 'mlp', 'hidden_dims': '[512, 256]', 'dropout': 0.19464710595931822, 'batch_norm': True, 'lr': 0.0003927467421233683, 'weight_decay': 0.00011741604339835277, 'epochs': 264, 'loss': 'mae', 'optimizer': 'adam', 'graph_mode': 'off', 'use_snp_selection': False}. Best is trial 125 with value: 0.15503171470862398.
[I 2025-12-05 14:46:29,096] Trial 143 finished with value: 0.14397492448279353 and parameters: {'model_type': 'mlp', 'hidden_dims': '[512, 256]', 'dropout': 0.11417942697660077, 'batch_norm': True, 'lr': 0.00035151823250220975, 'weight_decay': 3.613355391920861e-05, 'epochs': 250, 'loss': 'mae', 'optimizer': 'adam', 'graph_mode': 'off', 'use_snp_selection': False}. Best is trial 125 with value: 0.15503171470862398.
[I 2025-12-05 14:46:32,502] Trial 144 finished with value: 0.13563099101267848 and parameters: {'model_type': 'mlp', 'hidden_dims': '[512, 256]', 'dropout': 0.12468990566212587, 'batch_norm': True, 'lr': 0.00019240488149919677, 'weight_decay': 5.385357799036605e-05, 'epochs': 225, 'loss': 'mae', 'optimizer': 'adam', 'graph_mode': 'off', 'use_snp_selection': False}. Best is trial 125 with value: 0.15503171470862398.
[I 2025-12-05 14:46:34,039] Trial 145 finished with value: 0.14409486286199072 and parameters: {'model_type': 'mlp', 'hidden_dims': '[512, 256]', 'dropout': 0.1393020438349748, 'batch_norm': True, 'lr': 0.0003189760585002652, 'weight_decay': 8.57250058583562e-05, 'epochs': 66, 'loss': 'mae', 'optimizer': 'adam', 'graph_mode': 'off', 'use_snp_selection': False}. Best is trial 125 with value: 0.15503171470862398.
[I 2025-12-05 14:46:37,982] Trial 146 finished with value: 0.14217808922602018 and parameters: {'model_type': 'mlp', 'hidden_dims': '[512, 256]', 'dropout': 0.15720946531649854, 'batch_norm': True, 'lr': 0.000419915058690791, 'weight_decay': 0.00015691646602478148, 'epochs': 271, 'loss': 'mae', 'optimizer': 'adam', 'graph_mode': 'off', 'use_snp_selection': False}. Best is trial 125 with value: 0.15503171470862398.
[I 2025-12-05 14:46:39,068] Trial 147 finished with value: 0.13097142851755925 and parameters: {'model_type': 'mlp', 'hidden_dims': '[128, 64]', 'dropout': 0.12078793897421668, 'batch_norm': True, 'lr': 2.8110021508411317e-05, 'weight_decay': 2.442684932112577e-05, 'epochs': 171, 'loss': 'mae', 'optimizer': 'adam', 'graph_mode': 'off', 'use_snp_selection': False}. Best is trial 125 with value: 0.15503171470862398.
[I 2025-12-05 14:46:42,071] Trial 148 finished with value: 0.1416723750576469 and parameters: {'model_type': 'mlp', 'hidden_dims': '[512, 256]', 'dropout': 0.10029590898416575, 'batch_norm': True, 'lr': 0.00013454172080445915, 'weight_decay': 4.248705226093283e-05, 'epochs': 191, 'loss': 'mae', 'optimizer': 'adam', 'graph_mode': 'off', 'use_snp_selection': False}. Best is trial 125 with value: 0.15503171470862398.
[I 2025-12-05 14:46:44,079] Trial 149 finished with value: 0.1084289590751014 and parameters: {'model_type': 'mlp', 'hidden_dims': '[256, 128, 64]', 'dropout': 0.40314085623309853, 'batch_norm': True, 'lr': 0.0005161408264485423, 'weight_decay': 7.01910344051159e-05, 'epochs': 214, 'loss': 'mae', 'optimizer': 'adam', 'graph_mode': 'off', 'use_snp_selection': True, 'num_snps': 12822}. Best is trial 125 with value: 0.15503171470862398.
[I 2025-12-05 14:46:46,471] Trial 0 finished with value: 0.0006457872971504561 and parameters: {'model_type': 'mlp', 'hidden_dims': '[128, 64]', 'dropout': 0.199031432379812, 'batch_norm': True, 'lr': 1.8408544111075837e-06, 'weight_decay': 5.5136510071208614e-05, 'epochs': 336, 'loss': 'mae', 'optimizer': 'adam', 'graph_mode': 'off', 'use_snp_selection': True, 'num_snps': 43862}. Best is trial 0 with value: 0.0006457872971504561.
[I 2025-12-05 14:46:47,759] Trial 1 finished with value: 0.09164162292618387 and parameters: {'model_type': 'mlp', 'hidden_dims': '[256, 128]', 'dropout': 0.4370668075331726, 'batch_norm': True, 'lr': 7.133471581159139e-05, 'weight_decay': 1.128633586803549e-05, 'epochs': 242, 'loss': 'mae', 'optimizer': 'adam', 'graph_mode': 'off', 'use_snp_selection': False}. Best is trial 1 with value: 0.09164162292618387.
[I 2025-12-05 14:46:48,919] Trial 2 finished with value: 0.019086954172894285 and parameters: {'model_type': 'mlp', 'hidden_dims': '[256, 128, 64]', 'dropout': 0.41314357415569625, 'batch_norm': False, 'lr': 3.952233718592101e-06, 'weight_decay': 0.00026754769258252603, 'epochs': 149, 'loss': 'mse', 'optimizer': 'adam', 'graph_mode': 'off', 'use_snp_selection': True, 'num_snps': 11571}. Best is trial 1 with value: 0.09164162292618387.
[I 2025-12-05 14:46:51,443] Trial 3 finished with value: 0.06788320223468078 and parameters: {'model_type': 'mlp', 'hidden_dims': '[512, 64]', 'dropout': 0.5938127374509361, 'batch_norm': False, 'lr': 5.67704586114731e-06, 'weight_decay': 2.4518087630137052e-05, 'epochs': 320, 'loss': 'mae', 'optimizer': 'adam', 'graph_mode': 'off', 'use_snp_selection': False}. Best is trial 1 with value: 0.09164162292618387.
[I 2025-12-05 14:46:54,100] Trial 4 finished with value: 0.0380044508850202 and parameters: {'model_type': 'mlp', 'hidden_dims': '[512, 128]', 'dropout': 0.25746343592134413, 'batch_norm': True, 'lr': 1.3467657668402788e-06, 'weight_decay': 0.00033087251918647806, 'epochs': 277, 'loss': 'mse', 'optimizer': 'adam', 'graph_mode': 'off', 'use_snp_selection': True, 'num_snps': 36675}. Best is trial 1 with value: 0.09164162292618387.
[I 2025-12-05 14:46:56,132] Trial 5 finished with value: 0.020837961889935322 and parameters: {'model_type': 'mlp', 'hidden_dims': '[512, 64]', 'dropout': 0.38275350994408375, 'batch_norm': True, 'lr': 1.5586664309232824e-06, 'weight_decay': 0.0008227664668621182, 'epochs': 145, 'loss': 'mae', 'optimizer': 'adam', 'graph_mode': 'off', 'use_snp_selection': True, 'num_snps': 32148}. Best is trial 1 with value: 0.09164162292618387.
[I 2025-12-05 14:46:57,287] Trial 6 finished with value: 0.05810340410194508 and parameters: {'model_type': 'mlp', 'hidden_dims': '[256, 128]', 'dropout': 0.3930109900265879, 'batch_norm': False, 'lr': 4.892964372128395e-05, 'weight_decay': 1.5809549317992182e-06, 'epochs': 199, 'loss': 'mse', 'optimizer': 'adam', 'graph_mode': 'off', 'use_snp_selection': False}. Best is trial 1 with value: 0.09164162292618387.
[I 2025-12-05 14:46:58,588] Trial 7 finished with value: 0.09016072912984902 and parameters: {'model_type': 'mlp', 'hidden_dims': '[512, 256]', 'dropout': 0.15343979219678458, 'batch_norm': True, 'lr': 6.234003099047341e-05, 'weight_decay': 3.894760610535477e-07, 'epochs': 97, 'loss': 'mse', 'optimizer': 'adam', 'graph_mode': 'off', 'use_snp_selection': False}. Best is trial 1 with value: 0.09164162292618387.
[I 2025-12-05 14:47:01,093] Trial 8 finished with value: 0.08827849138026717 and parameters: {'model_type': 'mlp', 'hidden_dims': '[512, 128]', 'dropout': 0.10743001231661406, 'batch_norm': True, 'lr': 0.00023728538449271062, 'weight_decay': 1.7629071578048637e-05, 'epochs': 312, 'loss': 'mae', 'optimizer': 'adam', 'graph_mode': 'off', 'use_snp_selection': False}. Best is trial 1 with value: 0.09164162292618387.
[I 2025-12-05 14:47:02,820] Trial 9 finished with value: 0.09993476849703475 and parameters: {'model_type': 'mlp', 'hidden_dims': '[512, 64]', 'dropout': 0.14505336736221927, 'batch_norm': True, 'lr': 5.8619638388111826e-05, 'weight_decay': 6.200156172669308e-07, 'epochs': 175, 'loss': 'mse', 'optimizer': 'adam', 'graph_mode': 'off', 'use_snp_selection': False}. Best is trial 9 with value: 0.09993476849703475.
[I 2025-12-05 14:47:03,822] Trial 10 finished with value: 0.03262704462959309 and parameters: {'model_type': 'mlp', 'hidden_dims': '[512, 64]', 'dropout': 0.27531666245262887, 'batch_norm': False, 'lr': 0.00032393778075602147, 'weight_decay': 1.1714031539166647e-07, 'epochs': 44, 'loss': 'mse', 'optimizer': 'adam', 'graph_mode': 'off', 'use_snp_selection': False}. Best is trial 9 with value: 0.09993476849703475.
[I 2025-12-05 14:47:05,106] Trial 11 finished with value: 0.04922074199263145 and parameters: {'model_type': 'mlp', 'hidden_dims': '[256, 128]', 'dropout': 0.5011246104824927, 'batch_norm': True, 'lr': 1.6474108386126448e-05, 'weight_decay': 2.8129958937311506e-06, 'epochs': 239, 'loss': 'mae', 'optimizer': 'adam', 'graph_mode': 'off', 'use_snp_selection': False}. Best is trial 9 with value: 0.09993476849703475.
[I 2025-12-05 14:47:06,343] Trial 12 finished with value: 0.09046491272433167 and parameters: {'model_type': 'mlp', 'hidden_dims': '[256, 128]', 'dropout': 0.4779690972965961, 'batch_norm': True, 'lr': 0.000121041789182661, 'weight_decay': 4.19780668911197e-06, 'epochs': 219, 'loss': 'mae', 'optimizer': 'adam', 'graph_mode': 'off', 'use_snp_selection': False}. Best is trial 9 with value: 0.09993476849703475.
[I 2025-12-05 14:47:07,156] Trial 13 finished with value: 0.012615655658573687 and parameters: {'model_type': 'mlp', 'hidden_dims': '[128, 64]', 'dropout': 0.3037065148378758, 'batch_norm': True, 'lr': 1.8184704710575438e-05, 'weight_decay': 6.97716041744421e-07, 'epochs': 157, 'loss': 'mse', 'optimizer': 'adam', 'graph_mode': 'off', 'use_snp_selection': False}. Best is trial 9 with value: 0.09993476849703475.
[I 2025-12-05 14:47:08,532] Trial 14 finished with value: 0.05489276667265022 and parameters: {'model_type': 'mlp', 'hidden_dims': '[256, 128, 64]', 'dropout': 0.4774917249809648, 'batch_norm': True, 'lr': 0.0006681578335050954, 'weight_decay': 1.0971024377881592e-07, 'epochs': 263, 'loss': 'mse', 'optimizer': 'adam', 'graph_mode': 'off', 'use_snp_selection': False}. Best is trial 9 with value: 0.09993476849703475.
[I 2025-12-05 14:47:10,381] Trial 15 finished with value: 0.055798685542521084 and parameters: {'model_type': 'mlp', 'hidden_dims': '[512, 256]', 'dropout': 0.5699025908888742, 'batch_norm': True, 'lr': 0.0001045571331345049, 'weight_decay': 7.236536090132001e-06, 'epochs': 190, 'loss': 'mae', 'optimizer': 'adam', 'graph_mode': 'off', 'use_snp_selection': False}. Best is trial 9 with value: 0.09993476849703475.
[I 2025-12-05 14:47:11,285] Trial 16 finished with value: 0.05095793609408634 and parameters: {'model_type': 'mlp', 'hidden_dims': '[256, 128]', 'dropout': 0.3400578620313633, 'batch_norm': True, 'lr': 2.1517090787442848e-05, 'weight_decay': 7.882980925273178e-05, 'epochs': 98, 'loss': 'mse', 'optimizer': 'adam', 'graph_mode': 'off', 'use_snp_selection': False}. Best is trial 9 with value: 0.09993476849703475.
[I 2025-12-05 14:47:13,610] Trial 17 finished with value: 0.03874648072159556 and parameters: {'model_type': 'mlp', 'hidden_dims': '[512, 64]', 'dropout': 0.2174542087235227, 'batch_norm': True, 'lr': 9.746523544442226e-06, 'weight_decay': 7.208825532007247e-07, 'epochs': 279, 'loss': 'mae', 'optimizer': 'adam', 'graph_mode': 'off', 'use_snp_selection': False}. Best is trial 9 with value: 0.09993476849703475.
[I 2025-12-05 14:47:16,408] Trial 18 finished with value: 0.03875034020164539 and parameters: {'model_type': 'mlp', 'hidden_dims': '[256, 128]', 'dropout': 0.10884892417738423, 'batch_norm': False, 'lr': 0.0009735993119677173, 'weight_decay': 1.0315216097288506e-05, 'epochs': 184, 'loss': 'mse', 'optimizer': 'adam', 'graph_mode': 'off', 'use_snp_selection': True, 'num_snps': 58241}. Best is trial 9 with value: 0.09993476849703475.
[I 2025-12-05 14:47:18,543] Trial 19 finished with value: 0.08787207435760439 and parameters: {'model_type': 'mlp', 'hidden_dims': '[512, 64]', 'dropout': 0.42887889798689083, 'batch_norm': True, 'lr': 5.356605669826495e-05, 'weight_decay': 3.210676296043814e-07, 'epochs': 244, 'loss': 'mae', 'optimizer': 'adam', 'graph_mode': 'off', 'use_snp_selection': False}. Best is trial 9 with value: 0.09993476849703475.
[I 2025-12-05 14:47:19,928] Trial 20 finished with value: 0.10210523843739283 and parameters: {'model_type': 'mlp', 'hidden_dims': '[512, 128]', 'dropout': 0.34297698673380095, 'batch_norm': True, 'lr': 0.00018572983005243663, 'weight_decay': 1.8907823396101775e-06, 'epochs': 113, 'loss': 'mae', 'optimizer': 'adam', 'graph_mode': 'off', 'use_snp_selection': False}. Best is trial 20 with value: 0.10210523843739283.
[I 2025-12-05 14:47:21,118] Trial 21 finished with value: 0.054716748261933505 and parameters: {'model_type': 'mlp', 'hidden_dims': '[512, 128]', 'dropout': 0.3426036956588672, 'batch_norm': True, 'lr': 0.00018883741319897782, 'weight_decay': 1.5330795279190887e-06, 'epochs': 77, 'loss': 'mae', 'optimizer': 'adam', 'graph_mode': 'off', 'use_snp_selection': False}. Best is trial 20 with value: 0.10210523843739283.
[I 2025-12-05 14:47:22,539] Trial 22 finished with value: 0.05311769355717474 and parameters: {'model_type': 'mlp', 'hidden_dims': '[512, 128]', 'dropout': 0.527068617035195, 'batch_norm': True, 'lr': 0.00041657079075973146, 'weight_decay': 2.4009270565043595e-06, 'epochs': 120, 'loss': 'mae', 'optimizer': 'adam', 'graph_mode': 'off', 'use_snp_selection': False}. Best is trial 20 with value: 0.10210523843739283.
