[I 2025-12-05 16:22:54,928] Trial 80 finished with value: 0.1495061210713179 and parameters: {'model_type': 'mlp', 'hidden_dims': '[512, 128]', 'dropout': 0.16872442531850196, 'batch_norm': False, 'lr': 0.0002254279293141043, 'weight_decay': 4.030323085668752e-05, 'epochs': 270, 'loss': 'mae', 'optimizer': 'adam', 'graph_mode': 'off', 'use_snp_selection': False}. Best is trial 62 with value: 0.1909437269968553.
[I 2025-12-05 16:22:56,828] Trial 81 finished with value: 0.18521620329699126 and parameters: {'model_type': 'mlp', 'hidden_dims': '[512, 128]', 'dropout': 0.2004869878255125, 'batch_norm': True, 'lr': 0.00027962716211625007, 'weight_decay': 3.580596123433292e-06, 'epochs': 328, 'loss': 'mae', 'optimizer': 'adam', 'graph_mode': 'off', 'use_snp_selection': False}. Best is trial 62 with value: 0.1909437269968553.
[I 2025-12-05 16:22:58,711] Trial 82 finished with value: 0.18069762862454647 and parameters: {'model_type': 'mlp', 'hidden_dims': '[512, 128]', 'dropout': 0.12951381561216505, 'batch_norm': True, 'lr': 0.00040390955726572265, 'weight_decay': 4.19395703774119e-06, 'epochs': 327, 'loss': 'mae', 'optimizer': 'adam', 'graph_mode': 'off', 'use_snp_selection': False}. Best is trial 62 with value: 0.1909437269968553.
[I 2025-12-05 16:23:00,588] Trial 83 finished with value: 0.16295094906399388 and parameters: {'model_type': 'mlp', 'hidden_dims': '[512, 128]', 'dropout': 0.24226628017703117, 'batch_norm': True, 'lr': 0.0005029826132514888, 'weight_decay': 4.4089563210557186e-06, 'epochs': 324, 'loss': 'mae', 'optimizer': 'adam', 'graph_mode': 'off', 'use_snp_selection': False}. Best is trial 62 with value: 0.1909437269968553.
[I 2025-12-05 16:23:02,392] Trial 84 finished with value: 0.16887637386770663 and parameters: {'model_type': 'mlp', 'hidden_dims': '[512, 128]', 'dropout': 0.1537507484529166, 'batch_norm': True, 'lr': 0.00042862291644797104, 'weight_decay': 2.7627683098774683e-06, 'epochs': 302, 'loss': 'mae', 'optimizer': 'adam', 'graph_mode': 'off', 'use_snp_selection': False}. Best is trial 62 with value: 0.1909437269968553.
[I 2025-12-05 16:23:04,211] Trial 85 finished with value: 0.17772319021199937 and parameters: {'model_type': 'mlp', 'hidden_dims': '[512, 128]', 'dropout': 0.12539990336165335, 'batch_norm': True, 'lr': 0.0002961210808578485, 'weight_decay': 7.58665396959611e-06, 'epochs': 309, 'loss': 'mae', 'optimizer': 'adam', 'graph_mode': 'off', 'use_snp_selection': False}. Best is trial 62 with value: 0.1909437269968553.
[I 2025-12-05 16:23:06,077] Trial 86 finished with value: 0.17532174618264762 and parameters: {'model_type': 'mlp', 'hidden_dims': '[256, 128]', 'dropout': 0.20843083160608195, 'batch_norm': True, 'lr': 0.0007157385914802515, 'weight_decay': 4.993860841097151e-06, 'epochs': 320, 'loss': 'mae', 'optimizer': 'adam', 'graph_mode': 'off', 'use_snp_selection': True, 'num_snps': 32601}. Best is trial 62 with value: 0.1909437269968553.
[I 2025-12-05 16:23:08,004] Trial 87 finished with value: 0.17672845706452264 and parameters: {'model_type': 'mlp', 'hidden_dims': '[512, 128]', 'dropout': 0.19014269132244616, 'batch_norm': True, 'lr': 0.00020596649872566715, 'weight_decay': 1.9801677383784185e-06, 'epochs': 334, 'loss': 'mse', 'optimizer': 'adam', 'graph_mode': 'off', 'use_snp_selection': False}. Best is trial 62 with value: 0.1909437269968553.
[I 2025-12-05 16:23:09,770] Trial 88 finished with value: 0.16466443898973482 and parameters: {'model_type': 'mlp', 'hidden_dims': '[512, 64]', 'dropout': 0.5704200851766934, 'batch_norm': True, 'lr': 0.00030973297540268387, 'weight_decay': 2.749355623725449e-06, 'epochs': 285, 'loss': 'mae', 'optimizer': 'adam', 'graph_mode': 'off', 'use_snp_selection': False}. Best is trial 62 with value: 0.1909437269968553.
[I 2025-12-05 16:23:12,089] Trial 89 finished with value: 0.1715537002216673 and parameters: {'model_type': 'mlp', 'hidden_dims': '[128, 64]', 'dropout': 0.10942153095611987, 'batch_norm': True, 'lr': 0.00017461712879090458, 'weight_decay': 3.9125417216940235e-06, 'epochs': 277, 'loss': 'mse', 'optimizer': 'adam', 'graph_mode': 'off', 'use_snp_selection': True, 'num_snps': 49539}. Best is trial 62 with value: 0.1909437269968553.
[I 2025-12-05 16:23:13,877] Trial 90 finished with value: 0.18827381154743772 and parameters: {'model_type': 'mlp', 'hidden_dims': '[512, 128]', 'dropout': 0.10043316825009493, 'batch_norm': True, 'lr': 0.0004626309604299646, 'weight_decay': 6.870287504475684e-06, 'epochs': 298, 'loss': 'mae', 'optimizer': 'adam', 'graph_mode': 'off', 'use_snp_selection': False}. Best is trial 62 with value: 0.1909437269968553.
[I 2025-12-05 16:23:15,632] Trial 91 finished with value: 0.18246482696876554 and parameters: {'model_type': 'mlp', 'hidden_dims': '[512, 128]', 'dropout': 0.14563855243738058, 'batch_norm': True, 'lr': 0.0008252267557196543, 'weight_decay': 6.632041852941776e-06, 'epochs': 298, 'loss': 'mae', 'optimizer': 'adam', 'graph_mode': 'off', 'use_snp_selection': False}. Best is trial 62 with value: 0.1909437269968553.
[I 2025-12-05 16:23:17,405] Trial 92 finished with value: 0.18128337462751684 and parameters: {'model_type': 'mlp', 'hidden_dims': '[512, 128]', 'dropout': 0.10148514455214477, 'batch_norm': True, 'lr': 0.0007911736224028143, 'weight_decay': 1.0774923333881552e-05, 'epochs': 294, 'loss': 'mae', 'optimizer': 'adam', 'graph_mode': 'off', 'use_snp_selection': False}. Best is trial 62 with value: 0.1909437269968553.
[I 2025-12-05 16:23:19,141] Trial 93 finished with value: 0.1766751876209762 and parameters: {'model_type': 'mlp', 'hidden_dims': '[512, 128]', 'dropout': 0.10309486462809875, 'batch_norm': True, 'lr': 0.0008146072933460973, 'weight_decay': 1.1033310440820915e-05, 'epochs': 292, 'loss': 'mae', 'optimizer': 'adam', 'graph_mode': 'off', 'use_snp_selection': False}. Best is trial 62 with value: 0.1909437269968553.
[I 2025-12-05 16:23:20,958] Trial 94 finished with value: 0.18337495618914984 and parameters: {'model_type': 'mlp', 'hidden_dims': '[512, 128]', 'dropout': 0.1453064717378007, 'batch_norm': True, 'lr': 0.0008692488889897771, 'weight_decay': 2.2628808659336393e-05, 'epochs': 316, 'loss': 'mae', 'optimizer': 'adam', 'graph_mode': 'off', 'use_snp_selection': False}. Best is trial 62 with value: 0.1909437269968553.
[I 2025-12-05 16:23:22,753] Trial 95 finished with value: 0.168915033531056 and parameters: {'model_type': 'mlp', 'hidden_dims': '[512, 128]', 'dropout': 0.14454996763046146, 'batch_norm': True, 'lr': 0.0005399996610203503, 'weight_decay': 5.826662390638606e-05, 'epochs': 300, 'loss': 'mae', 'optimizer': 'adam', 'graph_mode': 'off', 'use_snp_selection': False}. Best is trial 62 with value: 0.1909437269968553.
[I 2025-12-05 16:23:24,616] Trial 96 finished with value: 0.17046478753598257 and parameters: {'model_type': 'mlp', 'hidden_dims': '[512, 128]', 'dropout': 0.37982674276183276, 'batch_norm': True, 'lr': 0.000875416966610377, 'weight_decay': 1.8843406363335894e-05, 'epochs': 313, 'loss': 'mae', 'optimizer': 'adam', 'graph_mode': 'off', 'use_snp_selection': False}. Best is trial 62 with value: 0.1909437269968553.
[I 2025-12-05 16:23:26,456] Trial 97 finished with value: 0.17385952651448186 and parameters: {'model_type': 'mlp', 'hidden_dims': '[512, 128]', 'dropout': 0.2995607072426732, 'batch_norm': True, 'lr': 0.0007370469196455981, 'weight_decay': 2.7162963524317144e-05, 'epochs': 306, 'loss': 'mae', 'optimizer': 'adam', 'graph_mode': 'off', 'use_snp_selection': False}. Best is trial 62 with value: 0.1909437269968553.
[I 2025-12-05 16:23:28,134] Trial 98 finished with value: 0.1737436136274173 and parameters: {'model_type': 'mlp', 'hidden_dims': '[512, 128]', 'dropout': 0.15771513514590962, 'batch_norm': True, 'lr': 0.0005803623174202574, 'weight_decay': 2.2088600494811976e-05, 'epochs': 264, 'loss': 'mae', 'optimizer': 'adam', 'graph_mode': 'off', 'use_snp_selection': False}. Best is trial 62 with value: 0.1909437269968553.
[I 2025-12-05 16:23:29,902] Trial 99 finished with value: 0.1834921855686227 and parameters: {'model_type': 'mlp', 'hidden_dims': '[512, 128]', 'dropout': 0.17596472125472964, 'batch_norm': True, 'lr': 0.0009919065122698844, 'weight_decay': 6.952438312284673e-06, 'epochs': 291, 'loss': 'mae', 'optimizer': 'adam', 'graph_mode': 'off', 'use_snp_selection': False}. Best is trial 62 with value: 0.1909437269968553.
[I 2025-12-05 16:23:31,596] Trial 100 finished with value: 0.15379037593253822 and parameters: {'model_type': 'mlp', 'hidden_dims': '[512, 128]', 'dropout': 0.17752950285970473, 'batch_norm': False, 'lr': 0.0006487450271319776, 'weight_decay': 8.686092368232857e-06, 'epochs': 280, 'loss': 'mae', 'optimizer': 'adam', 'graph_mode': 'off', 'use_snp_selection': False}. Best is trial 62 with value: 0.1909437269968553.
[I 2025-12-05 16:23:33,315] Trial 101 finished with value: 0.17544726122094428 and parameters: {'model_type': 'mlp', 'hidden_dims': '[512, 128]', 'dropout': 0.11611321231624774, 'batch_norm': True, 'lr': 0.0007781364116944937, 'weight_decay': 1.2773787824111718e-05, 'epochs': 288, 'loss': 'mae', 'optimizer': 'adam', 'graph_mode': 'off', 'use_snp_selection': False}. Best is trial 62 with value: 0.1909437269968553.
[I 2025-12-05 16:23:35,070] Trial 102 finished with value: 0.18373203594928494 and parameters: {'model_type': 'mlp', 'hidden_dims': '[512, 128]', 'dropout': 0.14319418428092007, 'batch_norm': True, 'lr': 0.0009731318074661473, 'weight_decay': 6.5561004027215215e-06, 'epochs': 296, 'loss': 'mae', 'optimizer': 'adam', 'graph_mode': 'off', 'use_snp_selection': False}. Best is trial 62 with value: 0.1909437269968553.
[I 2025-12-05 16:23:36,880] Trial 103 finished with value: 0.1696074522704948 and parameters: {'model_type': 'mlp', 'hidden_dims': '[512, 128]', 'dropout': 0.16273442477155348, 'batch_norm': True, 'lr': 0.0009300141926498948, 'weight_decay': 6.905021308294629e-06, 'epochs': 314, 'loss': 'mae', 'optimizer': 'adam', 'graph_mode': 'off', 'use_snp_selection': False}. Best is trial 62 with value: 0.1909437269968553.
[I 2025-12-05 16:23:38,747] Trial 104 finished with value: 0.1752009200724037 and parameters: {'model_type': 'mlp', 'hidden_dims': '[512, 128]', 'dropout': 0.19404031195666843, 'batch_norm': True, 'lr': 0.0009623849290365794, 'weight_decay': 6.296510411291873e-06, 'epochs': 320, 'loss': 'mae', 'optimizer': 'adam', 'graph_mode': 'off', 'use_snp_selection': False}. Best is trial 62 with value: 0.1909437269968553.
[I 2025-12-05 16:23:40,513] Trial 105 finished with value: 0.1689539155706635 and parameters: {'model_type': 'mlp', 'hidden_dims': '[512, 128]', 'dropout': 0.1429695036405589, 'batch_norm': True, 'lr': 0.00048588887120732554, 'weight_decay': 3.433691136033029e-05, 'epochs': 300, 'loss': 'mae', 'optimizer': 'adam', 'graph_mode': 'off', 'use_snp_selection': False}. Best is trial 62 with value: 0.1909437269968553.
[I 2025-12-05 16:23:41,684] Trial 106 finished with value: 0.16797138495114936 and parameters: {'model_type': 'mlp', 'hidden_dims': '[256, 128, 64]', 'dropout': 0.1749898996851454, 'batch_norm': True, 'lr': 0.0006565179176733065, 'weight_decay': 1.5262433821936396e-05, 'epochs': 274, 'loss': 'mae', 'optimizer': 'adam', 'graph_mode': 'off', 'use_snp_selection': False}. Best is trial 62 with value: 0.1909437269968553.
[I 2025-12-05 16:23:43,538] Trial 107 finished with value: 0.15872655333504804 and parameters: {'model_type': 'mlp', 'hidden_dims': '[512, 128]', 'dropout': 0.20545909421942965, 'batch_norm': True, 'lr': 0.0003570202685990535, 'weight_decay': 4.846319388844476e-05, 'epochs': 307, 'loss': 'mae', 'optimizer': 'adam', 'graph_mode': 'off', 'use_snp_selection': False}. Best is trial 62 with value: 0.1909437269968553.
[I 2025-12-05 16:23:45,494] Trial 108 finished with value: 0.17635372831854224 and parameters: {'model_type': 'mlp', 'hidden_dims': '[512, 256]', 'dropout': 0.14696464020906688, 'batch_norm': True, 'lr': 0.0005782678879110818, 'weight_decay': 8.980245059838369e-06, 'epochs': 340, 'loss': 'mae', 'optimizer': 'adam', 'graph_mode': 'off', 'use_snp_selection': False}. Best is trial 62 with value: 0.1909437269968553.
[I 2025-12-05 16:23:47,234] Trial 109 finished with value: 0.18123560515427217 and parameters: {'model_type': 'mlp', 'hidden_dims': '[512, 128]', 'dropout': 0.1340688997195104, 'batch_norm': True, 'lr': 0.0004313100836998533, 'weight_decay': 3.1904052127022825e-06, 'epochs': 283, 'loss': 'mae', 'optimizer': 'adam', 'graph_mode': 'off', 'use_snp_selection': False}. Best is trial 62 with value: 0.1909437269968553.
[I 2025-12-05 16:23:49,012] Trial 110 finished with value: 0.15793420597762886 and parameters: {'model_type': 'mlp', 'hidden_dims': '[512, 128]', 'dropout': 0.165508504040804, 'batch_norm': True, 'lr': 0.0008595609233008639, 'weight_decay': 7.445224743871274e-06, 'epochs': 295, 'loss': 'mae', 'optimizer': 'adam', 'graph_mode': 'off', 'use_snp_selection': False}. Best is trial 62 with value: 0.1909437269968553.
[I 2025-12-05 16:23:50,771] Trial 111 finished with value: 0.18888399957152513 and parameters: {'model_type': 'mlp', 'hidden_dims': '[512, 128]', 'dropout': 0.11608868708677536, 'batch_norm': True, 'lr': 0.0007349102465510643, 'weight_decay': 1.0986845625689265e-05, 'epochs': 299, 'loss': 'mae', 'optimizer': 'adam', 'graph_mode': 'off', 'use_snp_selection': False}. Best is trial 62 with value: 0.1909437269968553.
[I 2025-12-05 16:23:52,621] Trial 112 finished with value: 0.18111332578700726 and parameters: {'model_type': 'mlp', 'hidden_dims': '[512, 128]', 'dropout': 0.11461163036929162, 'batch_norm': True, 'lr': 0.0009785498904458317, 'weight_decay': 5.304780615706318e-06, 'epochs': 317, 'loss': 'mae', 'optimizer': 'adam', 'graph_mode': 'off', 'use_snp_selection': False}. Best is trial 62 with value: 0.1909437269968553.
[I 2025-12-05 16:23:54,411] Trial 113 finished with value: 0.19443631717083304 and parameters: {'model_type': 'mlp', 'hidden_dims': '[512, 128]', 'dropout': 0.12377253728977325, 'batch_norm': True, 'lr': 0.0007114724257353199, 'weight_decay': 2.7250168144728902e-05, 'epochs': 308, 'loss': 'mae', 'optimizer': 'adam', 'graph_mode': 'off', 'use_snp_selection': False}. Best is trial 113 with value: 0.19443631717083304.
[I 2025-12-05 16:23:56,202] Trial 114 finished with value: 0.1794616413249895 and parameters: {'model_type': 'mlp', 'hidden_dims': '[512, 128]', 'dropout': 0.12202100026137844, 'batch_norm': True, 'lr': 0.0006902459990026678, 'weight_decay': 2.4772818025263615e-05, 'epochs': 309, 'loss': 'mae', 'optimizer': 'adam', 'graph_mode': 'off', 'use_snp_selection': False}. Best is trial 113 with value: 0.19443631717083304.
[I 2025-12-05 16:23:58,047] Trial 115 finished with value: 0.17872686747961225 and parameters: {'model_type': 'mlp', 'hidden_dims': '[512, 128]', 'dropout': 0.13384665175159852, 'batch_norm': True, 'lr': 0.0005456003421112091, 'weight_decay': 3.1320598187047935e-05, 'epochs': 324, 'loss': 'mae', 'optimizer': 'adam', 'graph_mode': 'off', 'use_snp_selection': False}. Best is trial 113 with value: 0.19443631717083304.
[I 2025-12-05 16:23:59,985] Trial 116 finished with value: 0.18104971213052246 and parameters: {'model_type': 'mlp', 'hidden_dims': '[512, 128]', 'dropout': 0.11047239182120724, 'batch_norm': True, 'lr': 0.0004812478125814431, 'weight_decay': 3.955135159059866e-05, 'epochs': 334, 'loss': 'mae', 'optimizer': 'adam', 'graph_mode': 'off', 'use_snp_selection': False}. Best is trial 113 with value: 0.19443631717083304.
[I 2025-12-05 16:24:01,179] Trial 117 finished with value: 0.1588161510755884 and parameters: {'model_type': 'mlp', 'hidden_dims': '[256, 128]', 'dropout': 0.1841177589196375, 'batch_norm': True, 'lr': 0.00013078996323127347, 'weight_decay': 8.19135249344766e-05, 'epochs': 285, 'loss': 'mae', 'optimizer': 'adam', 'graph_mode': 'off', 'use_snp_selection': False}. Best is trial 113 with value: 0.19443631717083304.
[I 2025-12-05 16:24:03,101] Trial 118 finished with value: 0.17681499413004179 and parameters: {'model_type': 'mlp', 'hidden_dims': '[512, 128]', 'dropout': 0.15409613964867006, 'batch_norm': True, 'lr': 0.0007132576748191357, 'weight_decay': 1.651116809924458e-05, 'epochs': 329, 'loss': 'mae', 'optimizer': 'adam', 'graph_mode': 'off', 'use_snp_selection': False}. Best is trial 113 with value: 0.19443631717083304.
[I 2025-12-05 16:24:04,017] Trial 119 finished with value: 0.17643900201821636 and parameters: {'model_type': 'mlp', 'hidden_dims': '[128, 64]', 'dropout': 0.1679048992480347, 'batch_norm': False, 'lr': 0.00011606028774274436, 'weight_decay': 2.0729036636432563e-05, 'epochs': 289, 'loss': 'mae', 'optimizer': 'adam', 'graph_mode': 'off', 'use_snp_selection': False}. Best is trial 113 with value: 0.19443631717083304.
[I 2025-12-05 16:24:05,836] Trial 120 finished with value: 0.06776042190122349 and parameters: {'model_type': 'mlp', 'hidden_dims': '[512, 128]', 'dropout': 0.4539879736497117, 'batch_norm': True, 'lr': 1.1973954518325412e-05, 'weight_decay': 1.298299628475727e-05, 'epochs': 306, 'loss': 'mae', 'optimizer': 'adam', 'graph_mode': 'off', 'use_snp_selection': False}. Best is trial 113 with value: 0.19443631717083304.
[I 2025-12-05 16:24:07,600] Trial 121 finished with value: 0.1705524461202605 and parameters: {'model_type': 'mlp', 'hidden_dims': '[512, 128]', 'dropout': 0.14465893320558187, 'batch_norm': True, 'lr': 0.0007958805681460654, 'weight_decay': 5.921059849885859e-06, 'epochs': 299, 'loss': 'mae', 'optimizer': 'adam', 'graph_mode': 'off', 'use_snp_selection': False}. Best is trial 113 with value: 0.19443631717083304.
[I 2025-12-05 16:24:09,387] Trial 122 finished with value: 0.1808813472082371 and parameters: {'model_type': 'mlp', 'hidden_dims': '[512, 128]', 'dropout': 0.12125397320627064, 'batch_norm': True, 'lr': 0.000634784731364548, 'weight_decay': 1.0001721085102864e-05, 'epochs': 297, 'loss': 'mae', 'optimizer': 'adam', 'graph_mode': 'off', 'use_snp_selection': False}. Best is trial 113 with value: 0.19443631717083304.
[I 2025-12-05 16:24:10,451] Trial 123 finished with value: 0.1790997544400131 and parameters: {'model_type': 'mlp', 'hidden_dims': '[512, 128]', 'dropout': 0.13245157105322897, 'batch_norm': True, 'lr': 0.0009641143118343768, 'weight_decay': 6.9571796162860225e-06, 'epochs': 96, 'loss': 'mae', 'optimizer': 'adam', 'graph_mode': 'off', 'use_snp_selection': False}. Best is trial 113 with value: 0.19443631717083304.
[I 2025-12-05 16:24:12,145] Trial 124 finished with value: 0.16839620244704595 and parameters: {'model_type': 'mlp', 'hidden_dims': '[512, 128]', 'dropout': 0.15649221716170744, 'batch_norm': True, 'lr': 0.0001552419833419033, 'weight_decay': 3.533370744806594e-06, 'epochs': 270, 'loss': 'mae', 'optimizer': 'adam', 'graph_mode': 'off', 'use_snp_selection': False}. Best is trial 113 with value: 0.19443631717083304.
[I 2025-12-05 16:24:13,881] Trial 125 finished with value: 0.16924112430129473 and parameters: {'model_type': 'mlp', 'hidden_dims': '[512, 128]', 'dropout': 0.14243664769321623, 'batch_norm': True, 'lr': 0.0008396755776128864, 'weight_decay': 4.777597331802373e-06, 'epochs': 279, 'loss': 'mae', 'optimizer': 'adam', 'graph_mode': 'off', 'use_snp_selection': False}. Best is trial 113 with value: 0.19443631717083304.
[I 2025-12-05 16:24:15,750] Trial 126 finished with value: 0.18121782682571191 and parameters: {'model_type': 'mlp', 'hidden_dims': '[512, 128]', 'dropout': 0.12201383197535945, 'batch_norm': True, 'lr': 8.754743976841355e-05, 'weight_decay': 2.625408504989542e-05, 'epochs': 314, 'loss': 'mae', 'optimizer': 'adam', 'graph_mode': 'off', 'use_snp_selection': False}. Best is trial 113 with value: 0.19443631717083304.
[I 2025-12-05 16:24:17,588] Trial 127 finished with value: 0.17032989308861465 and parameters: {'model_type': 'mlp', 'hidden_dims': '[512, 128]', 'dropout': 0.10983858577811037, 'batch_norm': True, 'lr': 0.0005843368452886969, 'weight_decay': 8.35283339148974e-06, 'epochs': 304, 'loss': 'mae', 'optimizer': 'adam', 'graph_mode': 'off', 'use_snp_selection': False}. Best is trial 113 with value: 0.19443631717083304.
[I 2025-12-05 16:24:18,905] Trial 128 finished with value: 0.1702423323850711 and parameters: {'model_type': 'mlp', 'hidden_dims': '[256, 128, 64]', 'dropout': 0.21409578940960147, 'batch_norm': True, 'lr': 0.00045641449380195276, 'weight_decay': 5.3853544271457535e-05, 'epochs': 321, 'loss': 'mae', 'optimizer': 'adam', 'graph_mode': 'off', 'use_snp_selection': False}. Best is trial 113 with value: 0.19443631717083304.
[I 2025-12-05 16:24:20,641] Trial 129 finished with value: 0.03659935133119968 and parameters: {'model_type': 'mlp', 'hidden_dims': '[512, 128]', 'dropout': 0.12988310708820425, 'batch_norm': True, 'lr': 2.482918876985895e-06, 'weight_decay': 1.36896902734803e-05, 'epochs': 291, 'loss': 'mae', 'optimizer': 'adam', 'graph_mode': 'off', 'use_snp_selection': False}. Best is trial 113 with value: 0.19443631717083304.
[I 2025-12-05 16:24:22,295] Trial 130 finished with value: 0.0020547303400865863 and parameters: {'model_type': 'mlp', 'hidden_dims': '[512, 256]', 'dropout': 0.10022525094161677, 'batch_norm': True, 'lr': 1.1729536085859946e-06, 'weight_decay': 3.950456441433637e-05, 'epochs': 259, 'loss': 'mae', 'optimizer': 'adam', 'graph_mode': 'off', 'use_snp_selection': False}. Best is trial 113 with value: 0.19443631717083304.
[I 2025-12-05 16:24:24,033] Trial 131 finished with value: 0.17145387893961586 and parameters: {'model_type': 'mlp', 'hidden_dims': '[512, 128]', 'dropout': 0.1029194203913912, 'batch_norm': True, 'lr': 0.0007333751986160757, 'weight_decay': 9.59459385654444e-06, 'epochs': 292, 'loss': 'mae', 'optimizer': 'adam', 'graph_mode': 'off', 'use_snp_selection': False}. Best is trial 113 with value: 0.19443631717083304.
