[I 2025-12-05 14:38:16,221] Trial 14 finished with value: 0.15267502877706776 and parameters: {'model_type': 'mlp', 'hidden_dims': '[512, 128]', 'dropout': 0.3221595656802847, 'batch_norm': True, 'lr': 0.0009218940720367965, 'weight_decay': 5.724103314313124e-05, 'epochs': 271, 'loss': 'mae', 'optimizer': 'adam', 'graph_mode': 'off', 'use_snp_selection': False}. Best is trial 8 with value: 0.16425476779755838.
[I 2025-12-05 14:38:17,722] Trial 15 finished with value: 0.1495503458090022 and parameters: {'model_type': 'mlp', 'hidden_dims': '[128, 64]', 'dropout': 0.10515697852451877, 'batch_norm': True, 'lr': 0.0001637201916360417, 'weight_decay': 1.232049712459595e-07, 'epochs': 302, 'loss': 'mae', 'optimizer': 'adam', 'graph_mode': 'off', 'use_snp_selection': False}. Best is trial 8 with value: 0.16425476779755838.
[I 2025-12-05 14:38:20,677] Trial 16 finished with value: 0.13130476976428251 and parameters: {'model_type': 'mlp', 'hidden_dims': '[256, 128, 64]', 'dropout': 0.19236941781656602, 'batch_norm': True, 'lr': 1.2586985041154999e-05, 'weight_decay': 1.3401995465726466e-05, 'epochs': 350, 'loss': 'mae', 'optimizer': 'adam', 'graph_mode': 'off', 'use_snp_selection': False}. Best is trial 8 with value: 0.16425476779755838.
[I 2025-12-05 14:38:24,356] Trial 17 finished with value: 0.15038544070866794 and parameters: {'model_type': 'mlp', 'hidden_dims': '[512, 256]', 'dropout': 0.5434692890636532, 'batch_norm': True, 'lr': 0.000906375209920231, 'weight_decay': 7.521380152599298e-07, 'epochs': 239, 'loss': 'mae', 'optimizer': 'adam', 'graph_mode': 'off', 'use_snp_selection': False}. Best is trial 8 with value: 0.16425476779755838.
[I 2025-12-05 14:38:30,260] Trial 18 finished with value: 0.1350591083815573 and parameters: {'model_type': 'mlp', 'hidden_dims': '[512, 128]', 'dropout': 0.46470375425664545, 'batch_norm': False, 'lr': 0.00017553303054964982, 'weight_decay': 5.1284909832915915e-05, 'epochs': 252, 'loss': 'mae', 'optimizer': 'adam', 'graph_mode': 'off', 'use_snp_selection': True, 'num_snps': 58241}. Best is trial 8 with value: 0.16425476779755838.
[I 2025-12-05 14:38:34,781] Trial 19 finished with value: 0.16302874600600425 and parameters: {'model_type': 'mlp', 'hidden_dims': '[512, 128]', 'dropout': 0.31848849517917976, 'batch_norm': True, 'lr': 2.2599578696439803e-05, 'weight_decay': 4.683851500825195e-06, 'epochs': 312, 'loss': 'mae', 'optimizer': 'adam', 'graph_mode': 'off', 'use_snp_selection': False}. Best is trial 8 with value: 0.16425476779755838.
[I 2025-12-05 14:38:39,217] Trial 20 finished with value: 0.125947600284872 and parameters: {'model_type': 'mlp', 'hidden_dims': '[512, 128]', 'dropout': 0.3218345171465685, 'batch_norm': True, 'lr': 1.9778622737898004e-05, 'weight_decay': 4.930564275661486e-06, 'epochs': 303, 'loss': 'mae', 'optimizer': 'adam', 'graph_mode': 'off', 'use_snp_selection': False}. Best is trial 8 with value: 0.16425476779755838.
[I 2025-12-05 14:38:43,812] Trial 21 finished with value: 0.1493372274166331 and parameters: {'model_type': 'mlp', 'hidden_dims': '[512, 128]', 'dropout': 0.19787897232432566, 'batch_norm': True, 'lr': 0.00044506921648418136, 'weight_decay': 1.5546335552110408e-06, 'epochs': 317, 'loss': 'mae', 'optimizer': 'adam', 'graph_mode': 'off', 'use_snp_selection': False}. Best is trial 8 with value: 0.16425476779755838.
[I 2025-12-05 14:38:47,744] Trial 22 finished with value: 0.1499757359200822 and parameters: {'model_type': 'mlp', 'hidden_dims': '[512, 128]', 'dropout': 0.1629904129754279, 'batch_norm': True, 'lr': 2.57676319175151e-05, 'weight_decay': 2.7995103730495247e-07, 'epochs': 262, 'loss': 'mae', 'optimizer': 'adam', 'graph_mode': 'off', 'use_snp_selection': False}. Best is trial 8 with value: 0.16425476779755838.
[I 2025-12-05 14:38:52,080] Trial 23 finished with value: 0.13724118807397656 and parameters: {'model_type': 'mlp', 'hidden_dims': '[512, 128]', 'dropout': 0.23070381072043317, 'batch_norm': True, 'lr': 0.00011807398412846929, 'weight_decay': 2.3692940680708454e-05, 'epochs': 296, 'loss': 'mae', 'optimizer': 'adam', 'graph_mode': 'off', 'use_snp_selection': False}. Best is trial 8 with value: 0.16425476779755838.
[I 2025-12-05 14:38:56,904] Trial 24 finished with value: 0.11561794532362607 and parameters: {'model_type': 'mlp', 'hidden_dims': '[512, 128]', 'dropout': 0.503357595946361, 'batch_norm': True, 'lr': 1.0339930351440496e-05, 'weight_decay': 1.794022213356721e-06, 'epochs': 334, 'loss': 'mae', 'optimizer': 'adam', 'graph_mode': 'off', 'use_snp_selection': False}. Best is trial 8 with value: 0.16425476779755838.
[I 2025-12-05 14:39:00,570] Trial 25 finished with value: 0.16588106968938035 and parameters: {'model_type': 'mlp', 'hidden_dims': '[512, 256]', 'dropout': 0.12607882830136855, 'batch_norm': True, 'lr': 0.0003204015041971954, 'weight_decay': 0.00015329121932861325, 'epochs': 241, 'loss': 'mae', 'optimizer': 'adam', 'graph_mode': 'off', 'use_snp_selection': False}. Best is trial 25 with value: 0.16588106968938035.
[I 2025-12-05 14:39:02,257] Trial 26 finished with value: 0.0893387730535442 and parameters: {'model_type': 'mlp', 'hidden_dims': '[512, 256]', 'dropout': 0.2961736157130974, 'batch_norm': True, 'lr': 3.6761002725294677e-05, 'weight_decay': 0.00015265805543382736, 'epochs': 225, 'loss': 'mae', 'optimizer': 'adam', 'graph_mode': 'off', 'use_snp_selection': True, 'num_snps': 3842}. Best is trial 25 with value: 0.16588106968938035.
[I 2025-12-05 14:39:05,198] Trial 27 finished with value: 0.12524729145907004 and parameters: {'model_type': 'mlp', 'hidden_dims': '[512, 256]', 'dropout': 0.35357412821925666, 'batch_norm': False, 'lr': 0.0003286648741420222, 'weight_decay': 0.00014322851160412787, 'epochs': 185, 'loss': 'mae', 'optimizer': 'adam', 'graph_mode': 'off', 'use_snp_selection': False}. Best is trial 25 with value: 0.16588106968938035.
[I 2025-12-05 14:39:10,218] Trial 28 finished with value: 0.15591841375934715 and parameters: {'model_type': 'mlp', 'hidden_dims': '[512, 256]', 'dropout': 0.14661603835000184, 'batch_norm': True, 'lr': 0.00011955193262015558, 'weight_decay': 6.355701249759703e-06, 'epochs': 350, 'loss': 'mae', 'optimizer': 'adam', 'graph_mode': 'off', 'use_snp_selection': False}. Best is trial 25 with value: 0.16588106968938035.
[I 2025-12-05 14:39:12,451] Trial 29 finished with value: 0.024102110868931204 and parameters: {'model_type': 'mlp', 'hidden_dims': '[128, 64]', 'dropout': 0.21876257667697596, 'batch_norm': True, 'lr': 3.1868653642222323e-06, 'weight_decay': 5.5227103357724904e-05, 'epochs': 319, 'loss': 'mae', 'optimizer': 'adam', 'graph_mode': 'off', 'use_snp_selection': True, 'num_snps': 19468}. Best is trial 25 with value: 0.16588106968938035.
[I 2025-12-05 14:39:14,494] Trial 30 finished with value: 0.16647953723095776 and parameters: {'model_type': 'mlp', 'hidden_dims': '[256, 128]', 'dropout': 0.18328990745321205, 'batch_norm': True, 'lr': 0.0002676325969812956, 'weight_decay': 2.7057071031069988e-05, 'epochs': 220, 'loss': 'mae', 'optimizer': 'adam', 'graph_mode': 'off', 'use_snp_selection': False}. Best is trial 30 with value: 0.16647953723095776.
[I 2025-12-05 14:39:16,527] Trial 31 finished with value: 0.1496002936177262 and parameters: {'model_type': 'mlp', 'hidden_dims': '[256, 128]', 'dropout': 0.1810928573713633, 'batch_norm': True, 'lr': 0.0002866068294383082, 'weight_decay': 2.4099497558342564e-05, 'epochs': 212, 'loss': 'mae', 'optimizer': 'adam', 'graph_mode': 'off', 'use_snp_selection': False}. Best is trial 30 with value: 0.16647953723095776.
[I 2025-12-05 14:39:18,136] Trial 32 finished with value: 0.15135632971513874 and parameters: {'model_type': 'mlp', 'hidden_dims': '[256, 128]', 'dropout': 0.12974623875215313, 'batch_norm': True, 'lr': 0.00013162898375365895, 'weight_decay': 1.2844173667856627e-05, 'epochs': 150, 'loss': 'mae', 'optimizer': 'adam', 'graph_mode': 'off', 'use_snp_selection': False}. Best is trial 30 with value: 0.16647953723095776.
[I 2025-12-05 14:39:20,315] Trial 33 finished with value: 0.14587004567799414 and parameters: {'model_type': 'mlp', 'hidden_dims': '[256, 128]', 'dropout': 0.12675256597286702, 'batch_norm': True, 'lr': 8.613404321373549e-05, 'weight_decay': 0.00010314580128452047, 'epochs': 238, 'loss': 'mae', 'optimizer': 'adam', 'graph_mode': 'off', 'use_snp_selection': False}. Best is trial 30 with value: 0.16647953723095776.
[I 2025-12-05 14:39:22,013] Trial 34 finished with value: 0.15268939827194863 and parameters: {'model_type': 'mlp', 'hidden_dims': '[256, 128, 64]', 'dropout': 0.17092141715636677, 'batch_norm': True, 'lr': 0.00023933242818052509, 'weight_decay': 0.000523339875991667, 'epochs': 167, 'loss': 'mae', 'optimizer': 'adam', 'graph_mode': 'off', 'use_snp_selection': False}. Best is trial 30 with value: 0.16647953723095776.
[I 2025-12-05 14:39:24,432] Trial 35 finished with value: 0.12583603414291628 and parameters: {'model_type': 'mlp', 'hidden_dims': '[256, 128]', 'dropout': 0.2131762231799147, 'batch_norm': False, 'lr': 0.0005481233635235851, 'weight_decay': 4.091746002060991e-05, 'epochs': 287, 'loss': 'mae', 'optimizer': 'adam', 'graph_mode': 'off', 'use_snp_selection': False}. Best is trial 30 with value: 0.16647953723095776.
[I 2025-12-05 14:39:28,533] Trial 36 finished with value: 0.09796651757214539 and parameters: {'model_type': 'mlp', 'hidden_dims': '[128, 64]', 'dropout': 0.2687859038178613, 'batch_norm': True, 'lr': 1.5702256897180456e-05, 'weight_decay': 1.0687295154404784e-05, 'epochs': 328, 'loss': 'mse', 'optimizer': 'adam', 'graph_mode': 'off', 'use_snp_selection': True, 'num_snps': 58661}. Best is trial 30 with value: 0.16647953723095776.
[I 2025-12-05 14:39:31,766] Trial 37 finished with value: 0.14099700602554502 and parameters: {'model_type': 'mlp', 'hidden_dims': '[512, 64]', 'dropout': 0.4628410519409756, 'batch_norm': True, 'lr': 4.350549331735279e-05, 'weight_decay': 0.00027176669497101704, 'epochs': 202, 'loss': 'mae', 'optimizer': 'adam', 'graph_mode': 'off', 'use_snp_selection': False}. Best is trial 30 with value: 0.16647953723095776.
[I 2025-12-05 14:39:33,994] Trial 38 finished with value: 0.08773223187288914 and parameters: {'model_type': 'mlp', 'hidden_dims': '[512, 256]', 'dropout': 0.17772040406793635, 'batch_norm': False, 'lr': 8.659559379292074e-05, 'weight_decay': 8.608805466453113e-05, 'epochs': 103, 'loss': 'mse', 'optimizer': 'adam', 'graph_mode': 'off', 'use_snp_selection': True, 'num_snps': 19911}. Best is trial 30 with value: 0.16647953723095776.
[I 2025-12-05 14:39:36,365] Trial 39 finished with value: 0.1215506725325589 and parameters: {'model_type': 'mlp', 'hidden_dims': '[256, 128]', 'dropout': 0.12665057359899629, 'batch_norm': True, 'lr': 2.6051238604502166e-05, 'weight_decay': 3.1454796673030104e-05, 'epochs': 270, 'loss': 'mae', 'optimizer': 'adam', 'graph_mode': 'off', 'use_snp_selection': False}. Best is trial 30 with value: 0.16647953723095776.
[I 2025-12-05 14:39:40,004] Trial 40 finished with value: 0.06327700353612807 and parameters: {'model_type': 'mlp', 'hidden_dims': '[512, 256]', 'dropout': 0.4069563392424391, 'batch_norm': True, 'lr': 5.7489274108267205e-06, 'weight_decay': 1.6185431678369267e-05, 'epochs': 238, 'loss': 'mse', 'optimizer': 'adam', 'graph_mode': 'off', 'use_snp_selection': False}. Best is trial 30 with value: 0.16647953723095776.
[I 2025-12-05 14:39:43,798] Trial 41 finished with value: 0.15672047900521316 and parameters: {'model_type': 'mlp', 'hidden_dims': '[512, 128]', 'dropout': 0.10877361453937646, 'batch_norm': True, 'lr': 0.0006907169952850606, 'weight_decay': 7.1596880971865045e-06, 'epochs': 252, 'loss': 'mae', 'optimizer': 'adam', 'graph_mode': 'off', 'use_snp_selection': False}. Best is trial 30 with value: 0.16647953723095776.
[I 2025-12-05 14:39:45,909] Trial 42 finished with value: 0.14007074933927893 and parameters: {'model_type': 'mlp', 'hidden_dims': '[256, 128, 64]', 'dropout': 0.14181597416498262, 'batch_norm': True, 'lr': 0.00039037331028445656, 'weight_decay': 0.0005098110246506823, 'epochs': 227, 'loss': 'mae', 'optimizer': 'adam', 'graph_mode': 'off', 'use_snp_selection': False}. Best is trial 30 with value: 0.16647953723095776.
[I 2025-12-05 14:39:49,815] Trial 43 finished with value: 0.16688938474463802 and parameters: {'model_type': 'mlp', 'hidden_dims': '[512, 128]', 'dropout': 0.10225704830748708, 'batch_norm': True, 'lr': 0.0006759327079628498, 'weight_decay': 2.484734872917861e-07, 'epochs': 259, 'loss': 'mae', 'optimizer': 'adam', 'graph_mode': 'off', 'use_snp_selection': False}. Best is trial 43 with value: 0.16688938474463802.
[I 2025-12-05 14:39:54,333] Trial 44 finished with value: 0.16173749757610908 and parameters: {'model_type': 'mlp', 'hidden_dims': '[512, 64]', 'dropout': 0.1623070957337736, 'batch_norm': True, 'lr': 0.00024100829262361048, 'weight_decay': 3.7186531719629567e-06, 'epochs': 311, 'loss': 'mae', 'optimizer': 'adam', 'graph_mode': 'off', 'use_snp_selection': False}. Best is trial 43 with value: 0.16688938474463802.
[I 2025-12-05 14:39:58,482] Trial 45 finished with value: 0.16440553423526247 and parameters: {'model_type': 'mlp', 'hidden_dims': '[512, 128]', 'dropout': 0.1209637568453093, 'batch_norm': True, 'lr': 0.0005185114239314793, 'weight_decay': 9.60902715795235e-07, 'epochs': 281, 'loss': 'mae', 'optimizer': 'adam', 'graph_mode': 'off', 'use_snp_selection': False}. Best is trial 43 with value: 0.16688938474463802.
[I 2025-12-05 14:40:00,937] Trial 46 finished with value: 0.11603520442745034 and parameters: {'model_type': 'mlp', 'hidden_dims': '[256, 128]', 'dropout': 0.12237176629180031, 'batch_norm': False, 'lr': 0.0006601362286270987, 'weight_decay': 2.412461038952892e-07, 'epochs': 288, 'loss': 'mae', 'optimizer': 'adam', 'graph_mode': 'off', 'use_snp_selection': False}. Best is trial 43 with value: 0.16688938474463802.
[I 2025-12-05 14:40:05,043] Trial 47 finished with value: 0.15916271525472692 and parameters: {'model_type': 'mlp', 'hidden_dims': '[512, 128]', 'dropout': 0.1004841829061714, 'batch_norm': True, 'lr': 0.0004900230427221237, 'weight_decay': 6.542600616086426e-07, 'epochs': 277, 'loss': 'mse', 'optimizer': 'adam', 'graph_mode': 'off', 'use_snp_selection': False}. Best is trial 43 with value: 0.16688938474463802.
[I 2025-12-05 14:40:08,985] Trial 48 finished with value: 0.15511787910508457 and parameters: {'model_type': 'mlp', 'hidden_dims': '[512, 128]', 'dropout': 0.1520474771040824, 'batch_norm': True, 'lr': 0.0009397596053653362, 'weight_decay': 1.0201310005877701e-06, 'epochs': 264, 'loss': 'mae', 'optimizer': 'adam', 'graph_mode': 'off', 'use_snp_selection': False}. Best is trial 43 with value: 0.16688938474463802.
[I 2025-12-05 14:40:12,221] Trial 49 finished with value: 0.14041748577879126 and parameters: {'model_type': 'mlp', 'hidden_dims': '[128, 64]', 'dropout': 0.20417671498503814, 'batch_norm': True, 'lr': 0.0002878739998934288, 'weight_decay': 3.946637445760036e-07, 'epochs': 216, 'loss': 'mae', 'optimizer': 'adam', 'graph_mode': 'off', 'use_snp_selection': True, 'num_snps': 46888}. Best is trial 43 with value: 0.16688938474463802.
[I 2025-12-05 14:40:15,274] Trial 50 finished with value: 0.14297086872461906 and parameters: {'model_type': 'mlp', 'hidden_dims': '[512, 64]', 'dropout': 0.24985088404451783, 'batch_norm': True, 'lr': 0.0006874339812808996, 'weight_decay': 1.9435071363069595e-07, 'epochs': 192, 'loss': 'mae', 'optimizer': 'adam', 'graph_mode': 'off', 'use_snp_selection': False}. Best is trial 43 with value: 0.16688938474463802.
[I 2025-12-05 14:40:19,393] Trial 51 finished with value: 0.16350831356075518 and parameters: {'model_type': 'mlp', 'hidden_dims': '[512, 128]', 'dropout': 0.12748673538298783, 'batch_norm': True, 'lr': 0.00038812757900621005, 'weight_decay': 4.276513896950526e-07, 'epochs': 278, 'loss': 'mae', 'optimizer': 'adam', 'graph_mode': 'off', 'use_snp_selection': False}. Best is trial 43 with value: 0.16688938474463802.
[I 2025-12-05 14:40:23,193] Trial 52 finished with value: 0.1769979941376395 and parameters: {'model_type': 'mlp', 'hidden_dims': '[512, 128]', 'dropout': 0.13587009850673307, 'batch_norm': True, 'lr': 0.00037898621394849043, 'weight_decay': 3.333278002206e-07, 'epochs': 250, 'loss': 'mae', 'optimizer': 'adam', 'graph_mode': 'off', 'use_snp_selection': False}. Best is trial 52 with value: 0.1769979941376395.
[I 2025-12-05 14:40:26,972] Trial 53 finished with value: 0.16348778978203965 and parameters: {'model_type': 'mlp', 'hidden_dims': '[512, 128]', 'dropout': 0.14624901994933992, 'batch_norm': True, 'lr': 0.00019311962862219911, 'weight_decay': 1.7887868577131717e-07, 'epochs': 250, 'loss': 'mae', 'optimizer': 'adam', 'graph_mode': 'off', 'use_snp_selection': False}. Best is trial 52 with value: 0.1769979941376395.
[I 2025-12-05 14:40:30,450] Trial 54 finished with value: 0.1550080395958167 and parameters: {'model_type': 'mlp', 'hidden_dims': '[512, 128]', 'dropout': 0.1852101695552592, 'batch_norm': True, 'lr': 0.0005149843247710579, 'weight_decay': 2.2728466291846664e-06, 'epochs': 222, 'loss': 'mae', 'optimizer': 'adam', 'graph_mode': 'off', 'use_snp_selection': False}. Best is trial 52 with value: 0.1769979941376395.
[I 2025-12-05 14:40:34,138] Trial 55 finished with value: 0.1587216071950318 and parameters: {'model_type': 'mlp', 'hidden_dims': '[512, 128]', 'dropout': 0.1183179872502413, 'batch_norm': True, 'lr': 0.00023207644899111315, 'weight_decay': 1.0418807344595432e-06, 'epochs': 241, 'loss': 'mae', 'optimizer': 'adam', 'graph_mode': 'off', 'use_snp_selection': False}. Best is trial 52 with value: 0.1769979941376395.
[I 2025-12-05 14:40:36,484] Trial 56 finished with value: 0.15150254048154832 and parameters: {'model_type': 'mlp', 'hidden_dims': '[256, 128, 64]', 'dropout': 0.16552460576155187, 'batch_norm': True, 'lr': 0.00014930805041332902, 'weight_decay': 4.6734624749127175e-07, 'epochs': 260, 'loss': 'mae', 'optimizer': 'adam', 'graph_mode': 'off', 'use_snp_selection': False}. Best is trial 52 with value: 0.1769979941376395.
[I 2025-12-05 14:40:40,925] Trial 57 finished with value: 0.15327391868209506 and parameters: {'model_type': 'mlp', 'hidden_dims': '[512, 128]', 'dropout': 0.14306478486976987, 'batch_norm': True, 'lr': 0.00034460526038456005, 'weight_decay': 1.8288753828605645e-05, 'epochs': 300, 'loss': 'mae', 'optimizer': 'adam', 'graph_mode': 'off', 'use_snp_selection': False}. Best is trial 52 with value: 0.1769979941376395.
[I 2025-12-05 14:40:44,052] Trial 58 finished with value: 0.10945402592752423 and parameters: {'model_type': 'mlp', 'hidden_dims': '[512, 256]', 'dropout': 0.10281057181063594, 'batch_norm': False, 'lr': 0.0009940078250790824, 'weight_decay': 1.641705766011551e-07, 'epochs': 203, 'loss': 'mse', 'optimizer': 'adam', 'graph_mode': 'off', 'use_snp_selection': False}. Best is trial 52 with value: 0.1769979941376395.
[I 2025-12-05 14:40:48,363] Trial 59 finished with value: 0.15752787238386182 and parameters: {'model_type': 'mlp', 'hidden_dims': '[512, 128]', 'dropout': 0.22617429948950937, 'batch_norm': True, 'lr': 0.0007495793464564918, 'weight_decay': 2.943915049024796e-07, 'epochs': 293, 'loss': 'mae', 'optimizer': 'adam', 'graph_mode': 'off', 'use_snp_selection': False}. Best is trial 52 with value: 0.1769979941376395.
[I 2025-12-05 14:40:51,886] Trial 60 finished with value: 0.12643888096698788 and parameters: {'model_type': 'mlp', 'hidden_dims': '[512, 128]', 'dropout': 0.5779117875046005, 'batch_norm': True, 'lr': 0.0005769452847024867, 'weight_decay': 8.668724187838041e-06, 'epochs': 227, 'loss': 'mae', 'optimizer': 'adam', 'graph_mode': 'off', 'use_snp_selection': False}. Best is trial 52 with value: 0.1769979941376395.
[I 2025-12-05 14:40:56,106] Trial 61 finished with value: 0.1560276186194452 and parameters: {'model_type': 'mlp', 'hidden_dims': '[512, 128]', 'dropout': 0.13384567315014212, 'batch_norm': True, 'lr': 0.0004060386483784625, 'weight_decay': 4.830808037597686e-07, 'epochs': 285, 'loss': 'mae', 'optimizer': 'adam', 'graph_mode': 'off', 'use_snp_selection': False}. Best is trial 52 with value: 0.1769979941376395.
[I 2025-12-05 14:41:00,241] Trial 62 finished with value: 0.16474834763903512 and parameters: {'model_type': 'mlp', 'hidden_dims': '[512, 128]', 'dropout': 0.11532301775946212, 'batch_norm': True, 'lr': 0.0002921546904399617, 'weight_decay': 8.957392590577625e-07, 'epochs': 275, 'loss': 'mae', 'optimizer': 'adam', 'graph_mode': 'off', 'use_snp_selection': False}. Best is trial 52 with value: 0.1769979941376395.
[I 2025-12-05 14:41:04,318] Trial 63 finished with value: 0.1596558403002172 and parameters: {'model_type': 'mlp', 'hidden_dims': '[512, 128]', 'dropout': 0.11699961286124566, 'batch_norm': True, 'lr': 0.0002811116366380333, 'weight_decay': 1.0477309766725313e-07, 'epochs': 272, 'loss': 'mae', 'optimizer': 'adam', 'graph_mode': 'off', 'use_snp_selection': False}. Best is trial 52 with value: 0.1769979941376395.
[I 2025-12-05 14:41:08,027] Trial 64 finished with value: 0.16932196481943076 and parameters: {'model_type': 'mlp', 'hidden_dims': '[512, 128]', 'dropout': 0.16006694182360984, 'batch_norm': True, 'lr': 0.0001919966394563566, 'weight_decay': 9.44479125182906e-07, 'epochs': 244, 'loss': 'mae', 'optimizer': 'adam', 'graph_mode': 'off', 'use_snp_selection': False}. Best is trial 52 with value: 0.1769979941376395.
[I 2025-12-05 14:41:10,186] Trial 65 finished with value: 0.15294176640863447 and parameters: {'model_type': 'mlp', 'hidden_dims': '[256, 128]', 'dropout': 0.19755350523120868, 'batch_norm': True, 'lr': 0.00017926036490197782, 'weight_decay': 1.015957632462363e-06, 'epochs': 233, 'loss': 'mae', 'optimizer': 'adam', 'graph_mode': 'off', 'use_snp_selection': False}. Best is trial 52 with value: 0.1769979941376395.
