[I 2025-12-05 16:08:38,251] Trial 64 finished with value: 0.10785334436879987 and parameters: {'model_type': 'mlp', 'hidden_dims': '[512, 256]', 'dropout': 0.1585795816810801, 'batch_norm': True, 'lr': 0.00028045805312641915, 'weight_decay': 0.0001952866488985277, 'epochs': 89, 'loss': 'mae', 'optimizer': 'adam', 'graph_mode': 'off', 'use_snp_selection': True, 'num_snps': 34656}. Best is trial 55 with value: 0.15835618302911308.
[I 2025-12-05 16:08:40,994] Trial 65 finished with value: 0.1076409287934516 and parameters: {'model_type': 'mlp', 'hidden_dims': '[512, 256]', 'dropout': 0.1887269930403799, 'batch_norm': True, 'lr': 0.0001393435037066021, 'weight_decay': 0.00032026705100298173, 'epochs': 138, 'loss': 'mae', 'optimizer': 'adam', 'graph_mode': 'off', 'use_snp_selection': True, 'num_snps': 26397}. Best is trial 55 with value: 0.15835618302911308.
[I 2025-12-05 16:08:43,823] Trial 66 finished with value: 0.12397430880981163 and parameters: {'model_type': 'mlp', 'hidden_dims': '[256, 128, 64]', 'dropout': 0.11609564262944798, 'batch_norm': True, 'lr': 0.0007650656567229415, 'weight_decay': 0.0008861910378724893, 'epochs': 108, 'loss': 'mae', 'optimizer': 'adam', 'graph_mode': 'off', 'use_snp_selection': True, 'num_snps': 41437}. Best is trial 55 with value: 0.15835618302911308.
[I 2025-12-05 16:08:47,150] Trial 67 finished with value: 0.12806016347689095 and parameters: {'model_type': 'mlp', 'hidden_dims': '[512, 256]', 'dropout': 0.5614711718709352, 'batch_norm': True, 'lr': 0.00048330804850316356, 'weight_decay': 0.00045762966888123553, 'epochs': 51, 'loss': 'mae', 'optimizer': 'adam', 'graph_mode': 'off', 'use_snp_selection': True, 'num_snps': 50014}. Best is trial 55 with value: 0.15835618302911308.
[I 2025-12-05 16:08:51,740] Trial 68 finished with value: 0.11752622098980403 and parameters: {'model_type': 'mlp', 'hidden_dims': '[512, 64]', 'dropout': 0.17620267342563972, 'batch_norm': True, 'lr': 0.00021475154615655353, 'weight_decay': 0.0002090938414273659, 'epochs': 165, 'loss': 'mse', 'optimizer': 'adam', 'graph_mode': 'off', 'use_snp_selection': True, 'num_snps': 54741}. Best is trial 55 with value: 0.15835618302911308.
[I 2025-12-05 16:08:56,087] Trial 69 finished with value: 0.07460907646529909 and parameters: {'model_type': 'mlp', 'hidden_dims': '[512, 256]', 'dropout': 0.13911810139244893, 'batch_norm': True, 'lr': 1.0423059742535089e-05, 'weight_decay': 0.0006453751523208612, 'epochs': 206, 'loss': 'mae', 'optimizer': 'adam', 'graph_mode': 'off', 'use_snp_selection': True, 'num_snps': 45582}. Best is trial 55 with value: 0.15835618302911308.
[I 2025-12-05 16:08:59,656] Trial 70 finished with value: 0.11436990770634453 and parameters: {'model_type': 'mlp', 'hidden_dims': '[256, 128]', 'dropout': 0.2032755424265843, 'batch_norm': False, 'lr': 0.0003713321591818951, 'weight_decay': 3.4349523301799835e-05, 'epochs': 226, 'loss': 'mae', 'optimizer': 'adam', 'graph_mode': 'off', 'use_snp_selection': True, 'num_snps': 44151}. Best is trial 55 with value: 0.15835618302911308.
[I 2025-12-05 16:09:02,023] Trial 71 finished with value: 0.14757502253464055 and parameters: {'model_type': 'mlp', 'hidden_dims': '[128, 64]', 'dropout': 0.10546960788036845, 'batch_norm': True, 'lr': 0.0008290886049750839, 'weight_decay': 2.849894863192605e-07, 'epochs': 63, 'loss': 'mae', 'optimizer': 'adam', 'graph_mode': 'off', 'use_snp_selection': True, 'num_snps': 35552}. Best is trial 55 with value: 0.15835618302911308.
[I 2025-12-05 16:09:04,371] Trial 72 finished with value: 0.10985116170132508 and parameters: {'model_type': 'mlp', 'hidden_dims': '[128, 64]', 'dropout': 0.12281505446309608, 'batch_norm': True, 'lr': 0.0005496216867980785, 'weight_decay': 0.00032493491966783226, 'epochs': 82, 'loss': 'mae', 'optimizer': 'adam', 'graph_mode': 'off', 'use_snp_selection': True, 'num_snps': 35461}. Best is trial 55 with value: 0.15835618302911308.
[I 2025-12-05 16:09:06,759] Trial 73 finished with value: 0.1306792463437128 and parameters: {'model_type': 'mlp', 'hidden_dims': '[512, 256]', 'dropout': 0.10945280680850768, 'batch_norm': True, 'lr': 0.0007514796672811229, 'weight_decay': 1.1921619790739136e-05, 'epochs': 57, 'loss': 'mae', 'optimizer': 'adam', 'graph_mode': 'off', 'use_snp_selection': True, 'num_snps': 29617}. Best is trial 55 with value: 0.15835618302911308.
[I 2025-12-05 16:09:09,387] Trial 74 finished with value: 0.1372371927863707 and parameters: {'model_type': 'mlp', 'hidden_dims': '[128, 64]', 'dropout': 0.1544631186670882, 'batch_norm': True, 'lr': 0.00032757936197066697, 'weight_decay': 2.927376504816936e-07, 'epochs': 70, 'loss': 'mae', 'optimizer': 'adam', 'graph_mode': 'off', 'use_snp_selection': True, 'num_snps': 40311}. Best is trial 55 with value: 0.15835618302911308.
[I 2025-12-05 16:09:11,514] Trial 75 finished with value: 0.007049152281081439 and parameters: {'model_type': 'mlp', 'hidden_dims': '[256, 128]', 'dropout': 0.1017796758920483, 'batch_norm': True, 'lr': 1.0087771566710253e-06, 'weight_decay': 0.0004075553927561993, 'epochs': 67, 'loss': 'mae', 'optimizer': 'adam', 'graph_mode': 'off', 'use_snp_selection': True, 'num_snps': 21177}. Best is trial 55 with value: 0.15835618302911308.
[I 2025-12-05 16:09:15,238] Trial 76 finished with value: 0.11452722441702662 and parameters: {'model_type': 'mlp', 'hidden_dims': '[512, 256]', 'dropout': 0.1333606873639128, 'batch_norm': True, 'lr': 0.0004805590985475266, 'weight_decay': 2.1685857096718065e-07, 'epochs': 189, 'loss': 'mse', 'optimizer': 'adam', 'graph_mode': 'off', 'use_snp_selection': True, 'num_snps': 36952}. Best is trial 55 with value: 0.15835618302911308.
[I 2025-12-05 16:09:16,940] Trial 77 finished with value: 0.10974169388672349 and parameters: {'model_type': 'mlp', 'hidden_dims': '[128, 64]', 'dropout': 0.1615806079325301, 'batch_norm': True, 'lr': 0.0002671690115126389, 'weight_decay': 8.110671503229167e-05, 'epochs': 49, 'loss': 'mae', 'optimizer': 'adam', 'graph_mode': 'off', 'use_snp_selection': True, 'num_snps': 14056}. Best is trial 55 with value: 0.15835618302911308.
[I 2025-12-05 16:09:19,530] Trial 78 finished with value: 0.1262714970871751 and parameters: {'model_type': 'mlp', 'hidden_dims': '[256, 128, 64]', 'dropout': 0.12333139528221529, 'batch_norm': True, 'lr': 0.0006156493621135214, 'weight_decay': 1.244036279571445e-07, 'epochs': 90, 'loss': 'mae', 'optimizer': 'adam', 'graph_mode': 'off', 'use_snp_selection': True, 'num_snps': 33454}. Best is trial 55 with value: 0.15835618302911308.
[I 2025-12-05 16:09:23,244] Trial 79 finished with value: 0.1261870397522919 and parameters: {'model_type': 'mlp', 'hidden_dims': '[512, 256]', 'dropout': 0.23825608132687215, 'batch_norm': True, 'lr': 0.0008601094993488936, 'weight_decay': 0.000738161104612739, 'epochs': 112, 'loss': 'mse', 'optimizer': 'adam', 'graph_mode': 'off', 'use_snp_selection': True, 'num_snps': 47450}. Best is trial 55 with value: 0.15835618302911308.
[I 2025-12-05 16:09:25,273] Trial 80 finished with value: 0.14161241942320968 and parameters: {'model_type': 'mlp', 'hidden_dims': '[256, 128]', 'dropout': 0.14852952567312033, 'batch_norm': True, 'lr': 0.00043008989405267465, 'weight_decay': 4.609819158826186e-06, 'epochs': 213, 'loss': 'mae', 'optimizer': 'adam', 'graph_mode': 'off', 'use_snp_selection': False}. Best is trial 55 with value: 0.15835618302911308.
[I 2025-12-05 16:09:27,278] Trial 81 finished with value: 0.13293827654919968 and parameters: {'model_type': 'mlp', 'hidden_dims': '[256, 128]', 'dropout': 0.14646972735853558, 'batch_norm': True, 'lr': 0.0003220725766415757, 'weight_decay': 4.4089563210557186e-06, 'epochs': 212, 'loss': 'mae', 'optimizer': 'adam', 'graph_mode': 'off', 'use_snp_selection': False}. Best is trial 55 with value: 0.15835618302911308.
[I 2025-12-05 16:09:29,428] Trial 82 finished with value: 0.13423208756962107 and parameters: {'model_type': 'mlp', 'hidden_dims': '[256, 128]', 'dropout': 0.1299003498660015, 'batch_norm': True, 'lr': 0.00045011897167387326, 'weight_decay': 4.650275171447072e-07, 'epochs': 231, 'loss': 'mae', 'optimizer': 'adam', 'graph_mode': 'off', 'use_snp_selection': False}. Best is trial 55 with value: 0.15835618302911308.
[I 2025-12-05 16:09:31,375] Trial 83 finished with value: 0.12801722431273668 and parameters: {'model_type': 'mlp', 'hidden_dims': '[256, 128]', 'dropout': 0.11295513849569076, 'batch_norm': True, 'lr': 0.00039557725106408536, 'weight_decay': 8.276798681749522e-06, 'epochs': 201, 'loss': 'mae', 'optimizer': 'adam', 'graph_mode': 'off', 'use_snp_selection': False}. Best is trial 55 with value: 0.15835618302911308.
[I 2025-12-05 16:09:33,409] Trial 84 finished with value: 0.13887783984634178 and parameters: {'model_type': 'mlp', 'hidden_dims': '[256, 128]', 'dropout': 0.17673500500776632, 'batch_norm': True, 'lr': 0.0006604834735979503, 'weight_decay': 1.3264891245418368e-07, 'epochs': 216, 'loss': 'mae', 'optimizer': 'adam', 'graph_mode': 'off', 'use_snp_selection': False}. Best is trial 55 with value: 0.15835618302911308.
[I 2025-12-05 16:09:35,414] Trial 85 finished with value: 0.13471492427155607 and parameters: {'model_type': 'mlp', 'hidden_dims': '[256, 128]', 'dropout': 0.21477256624416655, 'batch_norm': True, 'lr': 0.0008092301246139751, 'weight_decay': 1.303395435695525e-07, 'epochs': 217, 'loss': 'mae', 'optimizer': 'adam', 'graph_mode': 'off', 'use_snp_selection': False}. Best is trial 55 with value: 0.15835618302911308.
[I 2025-12-05 16:09:37,468] Trial 86 finished with value: 0.125917482641187 and parameters: {'model_type': 'mlp', 'hidden_dims': '[256, 128]', 'dropout': 0.1954691304783675, 'batch_norm': True, 'lr': 0.0005950406957191553, 'weight_decay': 2.9005939675342604e-07, 'epochs': 218, 'loss': 'mae', 'optimizer': 'adam', 'graph_mode': 'off', 'use_snp_selection': False}. Best is trial 55 with value: 0.15835618302911308.
[I 2025-12-05 16:09:39,259] Trial 87 finished with value: 0.10588454419824282 and parameters: {'model_type': 'mlp', 'hidden_dims': '[256, 128]', 'dropout': 0.17707216707215662, 'batch_norm': False, 'lr': 0.0006702658829352134, 'weight_decay': 1.5139879586289545e-07, 'epochs': 182, 'loss': 'mae', 'optimizer': 'adam', 'graph_mode': 'off', 'use_snp_selection': False}. Best is trial 55 with value: 0.15835618302911308.
[I 2025-12-05 16:09:41,226] Trial 88 finished with value: 0.11350157169693047 and parameters: {'model_type': 'mlp', 'hidden_dims': '[256, 128]', 'dropout': 0.16616466036865735, 'batch_norm': True, 'lr': 0.0005062399741626195, 'weight_decay': 2.0637018280507214e-07, 'epochs': 203, 'loss': 'mse', 'optimizer': 'adam', 'graph_mode': 'off', 'use_snp_selection': False}. Best is trial 55 with value: 0.15835618302911308.
[I 2025-12-05 16:09:44,865] Trial 89 finished with value: 0.1257648341866547 and parameters: {'model_type': 'mlp', 'hidden_dims': '[512, 64]', 'dropout': 0.3898905752228753, 'batch_norm': True, 'lr': 0.0002423826025052187, 'weight_decay': 7.668352627168705e-07, 'epochs': 245, 'loss': 'mae', 'optimizer': 'adam', 'graph_mode': 'off', 'use_snp_selection': False}. Best is trial 55 with value: 0.15835618302911308.
[I 2025-12-05 16:09:47,704] Trial 90 finished with value: 0.1317428442196999 and parameters: {'model_type': 'mlp', 'hidden_dims': '[512, 128]', 'dropout': 0.2720532270160696, 'batch_norm': True, 'lr': 0.0008171037067382477, 'weight_decay': 1.5188219783177043e-06, 'epochs': 175, 'loss': 'mae', 'optimizer': 'adam', 'graph_mode': 'off', 'use_snp_selection': False}. Best is trial 55 with value: 0.15835618302911308.
[I 2025-12-05 16:09:49,271] Trial 91 finished with value: 0.1325427682109562 and parameters: {'model_type': 'mlp', 'hidden_dims': '[256, 128]', 'dropout': 0.15040141405829763, 'batch_norm': True, 'lr': 0.00044278594511654813, 'weight_decay': 2.5106888818652356e-07, 'epochs': 144, 'loss': 'mae', 'optimizer': 'adam', 'graph_mode': 'off', 'use_snp_selection': False}. Best is trial 55 with value: 0.15835618302911308.
[I 2025-12-05 16:09:52,690] Trial 92 finished with value: 0.13021151899352645 and parameters: {'model_type': 'mlp', 'hidden_dims': '[512, 256]', 'dropout': 0.13994568363820026, 'batch_norm': True, 'lr': 0.00033766379642583016, 'weight_decay': 3.596560586495865e-05, 'epochs': 228, 'loss': 'mae', 'optimizer': 'adam', 'graph_mode': 'off', 'use_snp_selection': False}. Best is trial 55 with value: 0.15835618302911308.
[I 2025-12-05 16:09:53,428] Trial 93 finished with value: 0.131322845892068 and parameters: {'model_type': 'mlp', 'hidden_dims': '[128, 64]', 'dropout': 0.12254392862527748, 'batch_norm': True, 'lr': 0.00018215066091258316, 'weight_decay': 3.658521444696626e-07, 'epochs': 61, 'loss': 'mae', 'optimizer': 'adam', 'graph_mode': 'off', 'use_snp_selection': False}. Best is trial 55 with value: 0.15835618302911308.
[I 2025-12-05 16:09:56,721] Trial 94 finished with value: 0.12291391853803257 and parameters: {'model_type': 'mlp', 'hidden_dims': '[512, 256]', 'dropout': 0.1088898172466234, 'batch_norm': True, 'lr': 0.0006742388655189507, 'weight_decay': 1.3184625516959013e-07, 'epochs': 193, 'loss': 'mae', 'optimizer': 'adam', 'graph_mode': 'off', 'use_snp_selection': True, 'num_snps': 29975}. Best is trial 55 with value: 0.15835618302911308.
[I 2025-12-05 16:09:59,944] Trial 95 finished with value: 0.14018008430859702 and parameters: {'model_type': 'mlp', 'hidden_dims': '[512, 128]', 'dropout': 0.158196691675029, 'batch_norm': True, 'lr': 0.0005520613913885546, 'weight_decay': 1.8128139366672715e-07, 'epochs': 210, 'loss': 'mae', 'optimizer': 'adam', 'graph_mode': 'off', 'use_snp_selection': False}. Best is trial 55 with value: 0.15835618302911308.
[I 2025-12-05 16:10:03,165] Trial 96 finished with value: 0.12495708245482616 and parameters: {'model_type': 'mlp', 'hidden_dims': '[512, 128]', 'dropout': 0.15762677123104388, 'batch_norm': True, 'lr': 0.000523574375106156, 'weight_decay': 1.0070290930328705e-07, 'epochs': 211, 'loss': 'mae', 'optimizer': 'adam', 'graph_mode': 'off', 'use_snp_selection': False}. Best is trial 55 with value: 0.15835618302911308.
[I 2025-12-05 16:10:06,665] Trial 97 finished with value: 0.12887416315403605 and parameters: {'model_type': 'mlp', 'hidden_dims': '[512, 128]', 'dropout': 0.17885631900944604, 'batch_norm': True, 'lr': 0.0008773722143243913, 'weight_decay': 1.7625168034267924e-07, 'epochs': 237, 'loss': 'mae', 'optimizer': 'adam', 'graph_mode': 'off', 'use_snp_selection': False}. Best is trial 55 with value: 0.15835618302911308.
[I 2025-12-05 16:10:09,960] Trial 98 finished with value: 0.1261403935907907 and parameters: {'model_type': 'mlp', 'hidden_dims': '[512, 128]', 'dropout': 0.19276566782879895, 'batch_norm': True, 'lr': 0.0005898151722847413, 'weight_decay': 1.08658982306744e-06, 'epochs': 220, 'loss': 'mse', 'optimizer': 'adam', 'graph_mode': 'off', 'use_snp_selection': False}. Best is trial 55 with value: 0.15835618302911308.
[I 2025-12-05 16:10:13,178] Trial 99 finished with value: 0.11102087209169052 and parameters: {'model_type': 'mlp', 'hidden_dims': '[512, 128]', 'dropout': 0.3200009556156008, 'batch_norm': False, 'lr': 0.00043420230949106343, 'weight_decay': 3.343495425775843e-07, 'epochs': 211, 'loss': 'mae', 'optimizer': 'adam', 'graph_mode': 'off', 'use_snp_selection': False}. Best is trial 55 with value: 0.15835618302911308.
[I 2025-12-05 16:10:15,016] Trial 100 finished with value: 0.12979650172434165 and parameters: {'model_type': 'mlp', 'hidden_dims': '[256, 128]', 'dropout': 0.22984099136640151, 'batch_norm': True, 'lr': 0.000295670171177912, 'weight_decay': 4.7182277935421814e-07, 'epochs': 186, 'loss': 'mae', 'optimizer': 'adam', 'graph_mode': 'off', 'use_snp_selection': False}. Best is trial 55 with value: 0.15835618302911308.
[I 2025-12-05 16:10:18,191] Trial 101 finished with value: 0.13592193545077313 and parameters: {'model_type': 'mlp', 'hidden_dims': '[512, 256]', 'dropout': 0.13987100542292125, 'batch_norm': True, 'lr': 0.0003939368372875195, 'weight_decay': 0.0005805272232917072, 'epochs': 206, 'loss': 'mae', 'optimizer': 'adam', 'graph_mode': 'off', 'use_snp_selection': False}. Best is trial 55 with value: 0.15835618302911308.
[I 2025-12-05 16:10:21,511] Trial 102 finished with value: 0.13655422280915894 and parameters: {'model_type': 'mlp', 'hidden_dims': '[512, 128]', 'dropout': 0.12931269901900294, 'batch_norm': True, 'lr': 0.000720770182258871, 'weight_decay': 2.5782336126213153e-07, 'epochs': 45, 'loss': 'mae', 'optimizer': 'adam', 'graph_mode': 'off', 'use_snp_selection': True, 'num_snps': 54697}. Best is trial 55 with value: 0.15835618302911308.
[I 2025-12-05 16:10:25,456] Trial 103 finished with value: 0.12551521918821693 and parameters: {'model_type': 'mlp', 'hidden_dims': '[512, 256]', 'dropout': 0.17129280123448093, 'batch_norm': True, 'lr': 0.0002536850744923508, 'weight_decay': 3.359087954834003e-06, 'epochs': 164, 'loss': 'mae', 'optimizer': 'adam', 'graph_mode': 'off', 'use_snp_selection': True, 'num_snps': 42919}. Best is trial 55 with value: 0.15835618302911308.
[I 2025-12-05 16:10:27,708] Trial 104 finished with value: 0.13386867102133373 and parameters: {'model_type': 'mlp', 'hidden_dims': '[256, 128, 64]', 'dropout': 0.10828335308533425, 'batch_norm': True, 'lr': 0.0005249993980728302, 'weight_decay': 1.9951466556286237e-07, 'epochs': 246, 'loss': 'mae', 'optimizer': 'adam', 'graph_mode': 'off', 'use_snp_selection': False}. Best is trial 55 with value: 0.15835618302911308.
[I 2025-12-05 16:10:30,169] Trial 105 finished with value: 0.12279074240260061 and parameters: {'model_type': 'mlp', 'hidden_dims': '[512, 256]', 'dropout': 0.1206621217788132, 'batch_norm': True, 'lr': 0.00020381829200537968, 'weight_decay': 0.00038705137508238195, 'epochs': 79, 'loss': 'mae', 'optimizer': 'adam', 'graph_mode': 'off', 'use_snp_selection': True, 'num_snps': 23465}. Best is trial 55 with value: 0.15835618302911308.
[I 2025-12-05 16:10:31,545] Trial 106 finished with value: 0.1327905922562239 and parameters: {'model_type': 'mlp', 'hidden_dims': '[128, 64]', 'dropout': 0.10105146289075656, 'batch_norm': True, 'lr': 0.0001498243795676674, 'weight_decay': 0.0008743620575124989, 'epochs': 260, 'loss': 'mae', 'optimizer': 'adam', 'graph_mode': 'off', 'use_snp_selection': False}. Best is trial 55 with value: 0.15835618302911308.
[I 2025-12-05 16:10:33,515] Trial 107 finished with value: 0.12173659608515448 and parameters: {'model_type': 'mlp', 'hidden_dims': '[256, 128]', 'dropout': 0.1521155085653805, 'batch_norm': True, 'lr': 0.0003384569758958623, 'weight_decay': 1.261565991959231e-07, 'epochs': 97, 'loss': 'mae', 'optimizer': 'adam', 'graph_mode': 'off', 'use_snp_selection': True, 'num_snps': 16458}. Best is trial 55 with value: 0.15835618302911308.
[I 2025-12-05 16:10:37,002] Trial 108 finished with value: 0.09064115909116216 and parameters: {'model_type': 'mlp', 'hidden_dims': '[512, 256]', 'dropout': 0.5025020741947762, 'batch_norm': True, 'lr': 7.353928854120903e-05, 'weight_decay': 0.00026106813833445786, 'epochs': 231, 'loss': 'mse', 'optimizer': 'adam', 'graph_mode': 'off', 'use_snp_selection': False}. Best is trial 55 with value: 0.15835618302911308.
[I 2025-12-05 16:10:38,771] Trial 109 finished with value: 0.09924046041006886 and parameters: {'model_type': 'mlp', 'hidden_dims': '[512, 128]', 'dropout': 0.40798454414022495, 'batch_norm': True, 'lr': 0.0009249786956575005, 'weight_decay': 1.4242599233783655e-07, 'epochs': 200, 'loss': 'mae', 'optimizer': 'adam', 'graph_mode': 'off', 'use_snp_selection': True, 'num_snps': 5296}. Best is trial 55 with value: 0.15835618302911308.
[I 2025-12-05 16:10:40,278] Trial 110 finished with value: 0.13033821724353678 and parameters: {'model_type': 'mlp', 'hidden_dims': '[512, 64]', 'dropout': 0.1347749037318695, 'batch_norm': True, 'lr': 0.00063245548425026, 'weight_decay': 0.0009890353664425908, 'epochs': 63, 'loss': 'mae', 'optimizer': 'adam', 'graph_mode': 'off', 'use_snp_selection': False}. Best is trial 55 with value: 0.15835618302911308.
[I 2025-12-05 16:10:42,817] Trial 111 finished with value: 0.1308282059187048 and parameters: {'model_type': 'mlp', 'hidden_dims': '[128, 64]', 'dropout': 0.15990590769862292, 'batch_norm': True, 'lr': 0.0003627819440306637, 'weight_decay': 5.846562292001459e-07, 'epochs': 69, 'loss': 'mae', 'optimizer': 'adam', 'graph_mode': 'off', 'use_snp_selection': True, 'num_snps': 40518}. Best is trial 55 with value: 0.15835618302911308.
[I 2025-12-05 16:10:45,816] Trial 112 finished with value: 0.12373675597440416 and parameters: {'model_type': 'mlp', 'hidden_dims': '[128, 64]', 'dropout': 0.14744374182348732, 'batch_norm': True, 'lr': 0.00029254092510635826, 'weight_decay': 3.122437398820446e-07, 'epochs': 83, 'loss': 'mae', 'optimizer': 'adam', 'graph_mode': 'off', 'use_snp_selection': True, 'num_snps': 48452}. Best is trial 55 with value: 0.15835618302911308.
[I 2025-12-05 16:10:48,406] Trial 113 finished with value: 0.13551833562176827 and parameters: {'model_type': 'mlp', 'hidden_dims': '[128, 64]', 'dropout': 0.18520835535915933, 'batch_norm': True, 'lr': 0.0004483323061534613, 'weight_decay': 1.7503809745607779e-07, 'epochs': 70, 'loss': 'mae', 'optimizer': 'adam', 'graph_mode': 'off', 'use_snp_selection': True, 'num_snps': 37367}. Best is trial 55 with value: 0.15835618302911308.
[I 2025-12-05 16:10:50,549] Trial 114 finished with value: 0.11478091167764642 and parameters: {'model_type': 'mlp', 'hidden_dims': '[128, 64]', 'dropout': 0.11613298634076114, 'batch_norm': True, 'lr': 0.0003260333011641979, 'weight_decay': 2.572738822363136e-07, 'epochs': 49, 'loss': 'mae', 'optimizer': 'adam', 'graph_mode': 'off', 'use_snp_selection': True, 'num_snps': 28258}. Best is trial 55 with value: 0.15835618302911308.
