[I 2025-12-05 17:41:44,319] Trial 1 finished with value: 0.30545616547572724 and parameters: {'model_type': 'mlp', 'hidden_dims': '[256, 128]', 'dropout': 0.4370668075331726, 'batch_norm': True, 'lr': 7.133471581159139e-05, 'weight_decay': 1.128633586803549e-05, 'epochs': 242, 'loss': 'mae', 'optimizer': 'adam', 'graph_mode': 'off', 'use_snp_selection': False}. Best is trial 1 with value: 0.30545616547572724.
[I 2025-12-05 17:42:11,095] Trial 2 finished with value: 0.25404725462804495 and parameters: {'model_type': 'mlp', 'hidden_dims': '[256, 128, 64]', 'dropout': 0.41314357415569625, 'batch_norm': False, 'lr': 3.952233718592101e-06, 'weight_decay': 0.00026754769258252603, 'epochs': 149, 'loss': 'mse', 'optimizer': 'adam', 'graph_mode': 'off', 'use_snp_selection': True, 'num_snps': 11571}. Best is trial 1 with value: 0.30545616547572724.
[I 2025-12-05 17:43:11,632] Trial 3 finished with value: 0.31123104041571176 and parameters: {'model_type': 'mlp', 'hidden_dims': '[512, 64]', 'dropout': 0.5938127374509361, 'batch_norm': False, 'lr': 5.67704586114731e-06, 'weight_decay': 2.4518087630137052e-05, 'epochs': 320, 'loss': 'mae', 'optimizer': 'adam', 'graph_mode': 'off', 'use_snp_selection': False}. Best is trial 3 with value: 0.31123104041571176.
[I 2025-12-05 17:44:12,182] Trial 4 finished with value: 0.2865393634409946 and parameters: {'model_type': 'mlp', 'hidden_dims': '[512, 128]', 'dropout': 0.25746343592134413, 'batch_norm': True, 'lr': 1.3467657668402788e-06, 'weight_decay': 0.00033087251918647806, 'epochs': 277, 'loss': 'mse', 'optimizer': 'adam', 'graph_mode': 'off', 'use_snp_selection': True, 'num_snps': 36675}. Best is trial 3 with value: 0.31123104041571176.
[I 2025-12-05 17:44:55,427] Trial 5 finished with value: 0.2684052297586866 and parameters: {'model_type': 'mlp', 'hidden_dims': '[512, 64]', 'dropout': 0.38275350994408375, 'batch_norm': True, 'lr': 1.5586664309232824e-06, 'weight_decay': 0.0008227664668621182, 'epochs': 145, 'loss': 'mae', 'optimizer': 'adam', 'graph_mode': 'off', 'use_snp_selection': True, 'num_snps': 32148}. Best is trial 3 with value: 0.31123104041571176.
[I 2025-12-05 17:45:18,072] Trial 6 finished with value: 0.3065090760680384 and parameters: {'model_type': 'mlp', 'hidden_dims': '[256, 128]', 'dropout': 0.3930109900265879, 'batch_norm': False, 'lr': 4.892964372128395e-05, 'weight_decay': 1.5809549317992182e-06, 'epochs': 199, 'loss': 'mse', 'optimizer': 'adam', 'graph_mode': 'off', 'use_snp_selection': False}. Best is trial 3 with value: 0.31123104041571176.
[I 2025-12-05 17:45:40,283] Trial 7 finished with value: 0.30512055996418685 and parameters: {'model_type': 'mlp', 'hidden_dims': '[512, 256]', 'dropout': 0.15343979219678458, 'batch_norm': True, 'lr': 6.234003099047341e-05, 'weight_decay': 3.894760610535477e-07, 'epochs': 97, 'loss': 'mse', 'optimizer': 'adam', 'graph_mode': 'off', 'use_snp_selection': False}. Best is trial 3 with value: 0.31123104041571176.
[I 2025-12-05 17:46:40,137] Trial 8 finished with value: 0.3018129412461542 and parameters: {'model_type': 'mlp', 'hidden_dims': '[512, 128]', 'dropout': 0.10743001231661406, 'batch_norm': True, 'lr': 0.00023728538449271062, 'weight_decay': 1.7629071578048637e-05, 'epochs': 312, 'loss': 'mae', 'optimizer': 'adam', 'graph_mode': 'off', 'use_snp_selection': False}. Best is trial 3 with value: 0.31123104041571176.
[I 2025-12-05 17:47:15,921] Trial 9 finished with value: 0.3061803315235898 and parameters: {'model_type': 'mlp', 'hidden_dims': '[512, 64]', 'dropout': 0.14505336736221927, 'batch_norm': True, 'lr': 5.8619638388111826e-05, 'weight_decay': 6.200156172669308e-07, 'epochs': 175, 'loss': 'mse', 'optimizer': 'adam', 'graph_mode': 'off', 'use_snp_selection': False}. Best is trial 3 with value: 0.31123104041571176.
[I 2025-12-05 17:47:30,627] Trial 10 finished with value: 0.27052749928381686 and parameters: {'model_type': 'mlp', 'hidden_dims': '[512, 64]', 'dropout': 0.5885461262002587, 'batch_norm': False, 'lr': 8.769366258768696e-06, 'weight_decay': 2.78273193871783e-06, 'epochs': 55, 'loss': 'mae', 'optimizer': 'adam', 'graph_mode': 'off', 'use_snp_selection': False}. Best is trial 3 with value: 0.31123104041571176.
[I 2025-12-05 17:47:56,165] Trial 11 finished with value: 0.30808994513226085 and parameters: {'model_type': 'mlp', 'hidden_dims': '[256, 128]', 'dropout': 0.583942291816117, 'batch_norm': False, 'lr': 1.422933652790185e-05, 'weight_decay': 2.805519019095577e-06, 'epochs': 231, 'loss': 'mse', 'optimizer': 'adam', 'graph_mode': 'off', 'use_snp_selection': False}. Best is trial 3 with value: 0.31123104041571176.
[I 2025-12-05 17:48:21,905] Trial 12 finished with value: 0.3119958558008967 and parameters: {'model_type': 'mlp', 'hidden_dims': '[256, 128]', 'dropout': 0.593097749012682, 'batch_norm': False, 'lr': 1.1374686318732863e-05, 'weight_decay': 1.3081036432574914e-07, 'epochs': 233, 'loss': 'mae', 'optimizer': 'adam', 'graph_mode': 'off', 'use_snp_selection': False}. Best is trial 12 with value: 0.3119958558008967.
[I 2025-12-05 17:48:40,946] Trial 13 finished with value: 0.31200242098658165 and parameters: {'model_type': 'mlp', 'hidden_dims': '[128, 64]', 'dropout': 0.5043641748401543, 'batch_norm': False, 'lr': 1.262035332095525e-05, 'weight_decay': 1.0885943577911259e-07, 'epochs': 285, 'loss': 'mae', 'optimizer': 'adam', 'graph_mode': 'off', 'use_snp_selection': False}. Best is trial 13 with value: 0.31200242098658165.
[I 2025-12-05 17:48:59,264] Trial 14 finished with value: 0.31181109250774575 and parameters: {'model_type': 'mlp', 'hidden_dims': '[128, 64]', 'dropout': 0.48369972861071203, 'batch_norm': False, 'lr': 2.2686068105732384e-05, 'weight_decay': 1.0444671845585217e-07, 'epochs': 271, 'loss': 'mae', 'optimizer': 'adam', 'graph_mode': 'off', 'use_snp_selection': False}. Best is trial 13 with value: 0.31200242098658165.
[I 2025-12-05 17:49:18,055] Trial 15 finished with value: 0.2250876770877266 and parameters: {'model_type': 'mlp', 'hidden_dims': '[128, 64]', 'dropout': 0.49962106881650387, 'batch_norm': False, 'lr': 0.00018996549754766415, 'weight_decay': 1.1194436916932256e-07, 'epochs': 280, 'loss': 'mae', 'optimizer': 'adam', 'graph_mode': 'off', 'use_snp_selection': False}. Best is trial 13 with value: 0.31200242098658165.
[I 2025-12-05 17:49:42,705] Trial 16 finished with value: 0.30898017108078174 and parameters: {'model_type': 'mlp', 'hidden_dims': '[256, 128, 64]', 'dropout': 0.3113370581957565, 'batch_norm': False, 'lr': 1.7410198278064714e-05, 'weight_decay': 3.315063111115081e-07, 'epochs': 220, 'loss': 'mae', 'optimizer': 'adam', 'graph_mode': 'off', 'use_snp_selection': False}. Best is trial 13 with value: 0.31200242098658165.
[I 2025-12-05 17:50:48,732] Trial 17 finished with value: 0.16003021215837188 and parameters: {'model_type': 'mlp', 'hidden_dims': '[512, 256]', 'dropout': 0.4973360034827234, 'batch_norm': False, 'lr': 0.000906375209920231, 'weight_decay': 8.54261249428194e-07, 'epochs': 350, 'loss': 'mae', 'optimizer': 'adam', 'graph_mode': 'off', 'use_snp_selection': False}. Best is trial 13 with value: 0.31200242098658165.
[I 2025-12-05 17:51:37,597] Trial 18 finished with value: 0.2870073097104354 and parameters: {'model_type': 'mlp', 'hidden_dims': '[128, 64]', 'dropout': 0.5393829161631665, 'batch_norm': False, 'lr': 3.546828848247229e-06, 'weight_decay': 1.982894825033117e-07, 'epochs': 254, 'loss': 'mae', 'optimizer': 'adam', 'graph_mode': 'off', 'use_snp_selection': True, 'num_snps': 58241}. Best is trial 13 with value: 0.31200242098658165.
[I 2025-12-05 17:52:10,016] Trial 19 finished with value: 0.3127451197299607 and parameters: {'model_type': 'mlp', 'hidden_dims': '[256, 128]', 'dropout': 0.5439870116467299, 'batch_norm': False, 'lr': 1.0436614786391874e-05, 'weight_decay': 4.133208398865786e-06, 'epochs': 307, 'loss': 'mae', 'optimizer': 'adam', 'graph_mode': 'off', 'use_snp_selection': False}. Best is trial 19 with value: 0.3127451197299607.
[I 2025-12-05 17:52:29,860] Trial 20 finished with value: 0.3091292171045593 and parameters: {'model_type': 'mlp', 'hidden_dims': '[128, 64]', 'dropout': 0.45355589818292674, 'batch_norm': False, 'lr': 3.157099311935621e-05, 'weight_decay': 4.737404348833776e-06, 'epochs': 301, 'loss': 'mae', 'optimizer': 'adam', 'graph_mode': 'off', 'use_snp_selection': False}. Best is trial 19 with value: 0.3127451197299607.
[I 2025-12-05 17:53:01,128] Trial 21 finished with value: 0.3146411730032755 and parameters: {'model_type': 'mlp', 'hidden_dims': '[256, 128]', 'dropout': 0.5405439478908376, 'batch_norm': False, 'lr': 8.109858199635986e-06, 'weight_decay': 1.2720123859594044e-06, 'epochs': 294, 'loss': 'mae', 'optimizer': 'adam', 'graph_mode': 'off', 'use_snp_selection': False}. Best is trial 21 with value: 0.3146411730032755.
[I 2025-12-05 17:53:33,893] Trial 22 finished with value: 0.3106231589672056 and parameters: {'model_type': 'mlp', 'hidden_dims': '[256, 128]', 'dropout': 0.5306299428479917, 'batch_norm': False, 'lr': 4.630898807086134e-06, 'weight_decay': 1.0892005933741711e-06, 'epochs': 310, 'loss': 'mae', 'optimizer': 'adam', 'graph_mode': 'off', 'use_snp_selection': False}. Best is trial 21 with value: 0.3146411730032755.
[I 2025-12-05 17:54:04,984] Trial 23 finished with value: 0.3128832274054317 and parameters: {'model_type': 'mlp', 'hidden_dims': '[256, 128]', 'dropout': 0.5400058916159252, 'batch_norm': False, 'lr': 7.888038380930695e-06, 'weight_decay': 7.676707078033654e-06, 'epochs': 291, 'loss': 'mae', 'optimizer': 'adam', 'graph_mode': 'off', 'use_snp_selection': False}. Best is trial 21 with value: 0.3146411730032755.
[I 2025-12-05 17:54:41,337] Trial 24 finished with value: 0.3117798471601706 and parameters: {'model_type': 'mlp', 'hidden_dims': '[256, 128]', 'dropout': 0.5408900453997689, 'batch_norm': False, 'lr': 7.639038655717361e-06, 'weight_decay': 7.155673581155691e-06, 'epochs': 349, 'loss': 'mae', 'optimizer': 'adam', 'graph_mode': 'off', 'use_snp_selection': False}. Best is trial 21 with value: 0.3146411730032755.
[I 2025-12-05 17:55:09,037] Trial 25 finished with value: 0.30667486861279364 and parameters: {'model_type': 'mlp', 'hidden_dims': '[256, 128]', 'dropout': 0.46143257695756695, 'batch_norm': False, 'lr': 2.7232289155843837e-06, 'weight_decay': 6.329591755408762e-05, 'epochs': 253, 'loss': 'mae', 'optimizer': 'adam', 'graph_mode': 'off', 'use_snp_selection': False}. Best is trial 21 with value: 0.3146411730032755.
[I 2025-12-05 17:55:32,329] Trial 26 finished with value: 0.27693695589207534 and parameters: {'model_type': 'mlp', 'hidden_dims': '[256, 128]', 'dropout': 0.3291987546716162, 'batch_norm': False, 'lr': 6.813169109489975e-06, 'weight_decay': 2.443643243280606e-06, 'epochs': 204, 'loss': 'mae', 'optimizer': 'adam', 'graph_mode': 'off', 'use_snp_selection': True, 'num_snps': 3842}. Best is trial 21 with value: 0.3146411730032755.
[I 2025-12-05 17:56:04,080] Trial 27 finished with value: 0.308982593303803 and parameters: {'model_type': 'mlp', 'hidden_dims': '[256, 128]', 'dropout': 0.5429877268531857, 'batch_norm': False, 'lr': 2.7738212745119604e-05, 'weight_decay': 5.085436323868505e-06, 'epochs': 300, 'loss': 'mae', 'optimizer': 'adam', 'graph_mode': 'off', 'use_snp_selection': False}. Best is trial 21 with value: 0.3146411730032755.
[I 2025-12-05 17:56:38,594] Trial 28 finished with value: 0.2894491735912169 and parameters: {'model_type': 'mlp', 'hidden_dims': '[256, 128]', 'dropout': 0.272623590487204, 'batch_norm': False, 'lr': 1.0512295401281275e-06, 'weight_decay': 3.718258487664909e-05, 'epochs': 329, 'loss': 'mae', 'optimizer': 'adam', 'graph_mode': 'off', 'use_snp_selection': False}. Best is trial 21 with value: 0.3146411730032755.
[I 2025-12-05 17:57:12,513] Trial 29 finished with value: 0.2837088781258354 and parameters: {'model_type': 'mlp', 'hidden_dims': '[256, 128]', 'dropout': 0.3627757190892162, 'batch_norm': False, 'lr': 2.3829805490848858e-06, 'weight_decay': 7.556740997596572e-05, 'epochs': 263, 'loss': 'mae', 'optimizer': 'adam', 'graph_mode': 'off', 'use_snp_selection': True, 'num_snps': 19468}. Best is trial 21 with value: 0.3146411730032755.
[I 2025-12-05 17:58:15,321] Trial 30 finished with value: 0.29936818427795747 and parameters: {'model_type': 'mlp', 'hidden_dims': '[512, 256]', 'dropout': 0.5586552810621004, 'batch_norm': False, 'lr': 0.0001033207575243065, 'weight_decay': 1.109368245763992e-05, 'epochs': 332, 'loss': 'mae', 'optimizer': 'adam', 'graph_mode': 'off', 'use_snp_selection': False}. Best is trial 21 with value: 0.3146411730032755.
[I 2025-12-05 17:58:34,575] Trial 31 finished with value: 0.3129699017172742 and parameters: {'model_type': 'mlp', 'hidden_dims': '[128, 64]', 'dropout': 0.5048937362419892, 'batch_norm': False, 'lr': 1.1268513590468322e-05, 'weight_decay': 1.4582916353926753e-06, 'epochs': 288, 'loss': 'mae', 'optimizer': 'adam', 'graph_mode': 'off', 'use_snp_selection': False}. Best is trial 21 with value: 0.3146411730032755.
[I 2025-12-05 17:59:05,908] Trial 32 finished with value: 0.3120859084953643 and parameters: {'model_type': 'mlp', 'hidden_dims': '[256, 128, 64]', 'dropout': 0.4237255642235944, 'batch_norm': False, 'lr': 9.420794924888157e-06, 'weight_decay': 1.6384787345948198e-06, 'epochs': 293, 'loss': 'mae', 'optimizer': 'adam', 'graph_mode': 'off', 'use_snp_selection': False}. Best is trial 21 with value: 0.3146411730032755.
[I 2025-12-05 18:00:06,923] Trial 33 finished with value: 0.30781477787811873 and parameters: {'model_type': 'mlp', 'hidden_dims': '[512, 128]', 'dropout': 0.4670603218831637, 'batch_norm': False, 'lr': 1.631444285365046e-05, 'weight_decay': 4.289398881293827e-06, 'epochs': 322, 'loss': 'mae', 'optimizer': 'adam', 'graph_mode': 'off', 'use_snp_selection': False}. Best is trial 21 with value: 0.3146411730032755.
[I 2025-12-05 18:00:34,250] Trial 34 finished with value: 0.3123573349466931 and parameters: {'model_type': 'mlp', 'hidden_dims': '[256, 128]', 'dropout': 0.5178266009946662, 'batch_norm': False, 'lr': 5.243755385159396e-06, 'weight_decay': 1.6893364884532703e-05, 'epochs': 249, 'loss': 'mae', 'optimizer': 'adam', 'graph_mode': 'off', 'use_snp_selection': False}. Best is trial 21 with value: 0.3146411730032755.
[I 2025-12-05 18:00:53,706] Trial 35 finished with value: 0.2939713222424082 and parameters: {'model_type': 'mlp', 'hidden_dims': '[128, 64]', 'dropout': 0.5677307493378301, 'batch_norm': True, 'lr': 2.123123704207162e-05, 'weight_decay': 5.597377041887522e-07, 'epochs': 290, 'loss': 'mae', 'optimizer': 'adam', 'graph_mode': 'off', 'use_snp_selection': False}. Best is trial 21 with value: 0.3146411730032755.
[I 2025-12-05 18:01:53,306] Trial 36 finished with value: 0.30203470790677345 and parameters: {'model_type': 'mlp', 'hidden_dims': '[256, 128, 64]', 'dropout': 0.43390576319742485, 'batch_norm': False, 'lr': 3.0098921224108357e-06, 'weight_decay': 8.3310038107266e-06, 'epochs': 267, 'loss': 'mse', 'optimizer': 'adam', 'graph_mode': 'off', 'use_snp_selection': True, 'num_snps': 58661}. Best is trial 21 with value: 0.3146411730032755.
[I 2025-12-05 18:02:13,605] Trial 37 finished with value: 0.3109934387825328 and parameters: {'model_type': 'mlp', 'hidden_dims': '[256, 128]', 'dropout': 0.5654480838435071, 'batch_norm': False, 'lr': 3.914180183131933e-05, 'weight_decay': 1.6069704523951457e-06, 'epochs': 173, 'loss': 'mae', 'optimizer': 'adam', 'graph_mode': 'off', 'use_snp_selection': False}. Best is trial 21 with value: 0.3146411730032755.
[I 2025-12-05 18:02:49,357] Trial 38 finished with value: 0.28978386716396154 and parameters: {'model_type': 'mlp', 'hidden_dims': '[256, 128]', 'dropout': 0.48123768704922654, 'batch_norm': True, 'lr': 6.168297747961041e-06, 'weight_decay': 1.0337174115610788e-06, 'epochs': 318, 'loss': 'mse', 'optimizer': 'adam', 'graph_mode': 'off', 'use_snp_selection': True, 'num_snps': 19911}. Best is trial 21 with value: 0.3146411730032755.
[I 2025-12-05 18:03:17,096] Trial 39 finished with value: 0.287343892333138 and parameters: {'model_type': 'mlp', 'hidden_dims': '[512, 128]', 'dropout': 0.40491549826838436, 'batch_norm': False, 'lr': 2.0624872418891355e-06, 'weight_decay': 0.00010412398872024411, 'epochs': 130, 'loss': 'mae', 'optimizer': 'adam', 'graph_mode': 'off', 'use_snp_selection': False}. Best is trial 21 with value: 0.3146411730032755.
[I 2025-12-05 18:03:59,967] Trial 40 finished with value: 0.29553900502854313 and parameters: {'model_type': 'mlp', 'hidden_dims': '[512, 256]', 'dropout': 0.5171889195790174, 'batch_norm': True, 'lr': 4.3848231971810864e-06, 'weight_decay': 2.4957220313468415e-05, 'epochs': 214, 'loss': 'mae', 'optimizer': 'adam', 'graph_mode': 'off', 'use_snp_selection': False}. Best is trial 21 with value: 0.3146411730032755.
[I 2025-12-05 18:04:27,753] Trial 41 finished with value: 0.30795038457121177 and parameters: {'model_type': 'mlp', 'hidden_dims': '[256, 128]', 'dropout': 0.5322465509932315, 'batch_norm': False, 'lr': 5.257092623648103e-06, 'weight_decay': 2.3982287122765696e-05, 'epochs': 254, 'loss': 'mae', 'optimizer': 'adam', 'graph_mode': 'off', 'use_snp_selection': False}. Best is trial 21 with value: 0.3146411730032755.
[I 2025-12-05 18:04:59,814] Trial 42 finished with value: 0.3139238387373885 and parameters: {'model_type': 'mlp', 'hidden_dims': '[256, 128]', 'dropout': 0.564377819310369, 'batch_norm': False, 'lr': 1.2341534642386294e-05, 'weight_decay': 1.3731884491098625e-05, 'epochs': 303, 'loss': 'mae', 'optimizer': 'adam', 'graph_mode': 'off', 'use_snp_selection': False}. Best is trial 21 with value: 0.3146411730032755.
[I 2025-12-05 18:05:31,877] Trial 43 finished with value: 0.31216907574977004 and parameters: {'model_type': 'mlp', 'hidden_dims': '[256, 128]', 'dropout': 0.5641471537840604, 'batch_norm': False, 'lr': 9.616965122749774e-06, 'weight_decay': 3.3775804481707096e-06, 'epochs': 303, 'loss': 'mae', 'optimizer': 'adam', 'graph_mode': 'off', 'use_snp_selection': False}. Best is trial 21 with value: 0.3146411730032755.
[I 2025-12-05 18:06:36,055] Trial 44 finished with value: 0.3079790573997119 and parameters: {'model_type': 'mlp', 'hidden_dims': '[512, 64]', 'dropout': 0.5916004587231402, 'batch_norm': False, 'lr': 1.2012243948149527e-05, 'weight_decay': 6.485127306560843e-06, 'epochs': 341, 'loss': 'mse', 'optimizer': 'adam', 'graph_mode': 'off', 'use_snp_selection': False}. Best is trial 21 with value: 0.3146411730032755.
[I 2025-12-05 18:07:06,154] Trial 45 finished with value: 0.30841057356557633 and parameters: {'model_type': 'mlp', 'hidden_dims': '[256, 128]', 'dropout': 0.23275422741828078, 'batch_norm': False, 'lr': 1.8514747746534686e-05, 'weight_decay': 1.5280818925128613e-05, 'epochs': 281, 'loss': 'mae', 'optimizer': 'adam', 'graph_mode': 'off', 'use_snp_selection': False}. Best is trial 21 with value: 0.3146411730032755.
[I 2025-12-05 18:07:39,712] Trial 46 finished with value: 0.2996923021551419 and parameters: {'model_type': 'mlp', 'hidden_dims': '[256, 128]', 'dropout': 0.5983572016206543, 'batch_norm': True, 'lr': 8.131070227464708e-06, 'weight_decay': 2.054748269113502e-06, 'epochs': 314, 'loss': 'mae', 'optimizer': 'adam', 'graph_mode': 'off', 'use_snp_selection': False}. Best is trial 21 with value: 0.3146411730032755.
[I 2025-12-05 18:07:56,199] Trial 47 finished with value: 0.3098422685040932 and parameters: {'model_type': 'mlp', 'hidden_dims': '[128, 64]', 'dropout': 0.511032845767093, 'batch_norm': False, 'lr': 2.499797678972896e-05, 'weight_decay': 0.00016416562341034564, 'epochs': 235, 'loss': 'mae', 'optimizer': 'adam', 'graph_mode': 'off', 'use_snp_selection': False}. Best is trial 21 with value: 0.3146411730032755.
[I 2025-12-05 18:08:48,877] Trial 48 finished with value: 0.306472728301107 and parameters: {'model_type': 'mlp', 'hidden_dims': '[512, 64]', 'dropout': 0.49036164723338693, 'batch_norm': False, 'lr': 1.2562659503792356e-05, 'weight_decay': 1.1443906973879577e-05, 'epochs': 274, 'loss': 'mse', 'optimizer': 'adam', 'graph_mode': 'off', 'use_snp_selection': False}. Best is trial 21 with value: 0.3146411730032755.
[I 2025-12-05 18:09:26,548] Trial 49 finished with value: 0.20258863334814953 and parameters: {'model_type': 'mlp', 'hidden_dims': '[256, 128]', 'dropout': 0.5560915417903705, 'batch_norm': False, 'lr': 3.6317513337679595e-06, 'weight_decay': 3.946637445760036e-07, 'epochs': 48, 'loss': 'mae', 'optimizer': 'adam', 'graph_mode': 'off', 'use_snp_selection': True, 'num_snps': 46888}. Best is trial 21 with value: 0.3146411730032755.
[I 2025-12-05 18:10:29,881] Trial 50 finished with value: 0.3033507442636566 and parameters: {'model_type': 'mlp', 'hidden_dims': '[512, 128]', 'dropout': 0.4579193794196348, 'batch_norm': False, 'lr': 4.047707832768187e-05, 'weight_decay': 3.23871761832411e-06, 'epochs': 335, 'loss': 'mae', 'optimizer': 'adam', 'graph_mode': 'off', 'use_snp_selection': False}. Best is trial 21 with value: 0.3146411730032755.
[I 2025-12-05 18:11:01,110] Trial 51 finished with value: 0.31154895259220705 and parameters: {'model_type': 'mlp', 'hidden_dims': '[256, 128]', 'dropout': 0.5222960664821772, 'batch_norm': False, 'lr': 5.645730954445444e-06, 'weight_decay': 1.4620357889276705e-05, 'epochs': 293, 'loss': 'mae', 'optimizer': 'adam', 'graph_mode': 'off', 'use_snp_selection': False}. Best is trial 21 with value: 0.3146411730032755.
[I 2025-12-05 18:11:29,396] Trial 52 finished with value: 0.31361120950407945 and parameters: {'model_type': 'mlp', 'hidden_dims': '[256, 128]', 'dropout': 0.5687617789342223, 'batch_norm': False, 'lr': 1.4980202689752009e-05, 'weight_decay': 4.150534079122137e-05, 'epochs': 261, 'loss': 'mae', 'optimizer': 'adam', 'graph_mode': 'off', 'use_snp_selection': False}. Best is trial 21 with value: 0.3146411730032755.
