[I 2025-12-06 08:24:33,470] Trial 140 finished with value: 0.28819955874048325 and parameters: {'model_type': 'mlp', 'hidden_dims': '[512, 256]', 'dropout': 0.4626652002754313, 'batch_norm': True, 'lr': 7.0395471998975575e-06, 'weight_decay': 1.2814298973877245e-06, 'epochs': 143, 'loss': 'mse', 'optimizer': 'adam', 'graph_mode': 'off', 'use_snp_selection': True, 'num_snps': 35177}. Best is trial 132 with value: 0.3029190495520343.
[I 2025-12-06 08:25:17,853] Trial 141 finished with value: 0.29395211742025257 and parameters: {'model_type': 'mlp', 'hidden_dims': '[512, 256]', 'dropout': 0.5328159445295576, 'batch_norm': False, 'lr': 1.2342748508795465e-05, 'weight_decay': 4.905568559163199e-07, 'epochs': 79, 'loss': 'mse', 'optimizer': 'adam', 'graph_mode': 'off', 'use_snp_selection': True, 'num_snps': 46441}. Best is trial 132 with value: 0.3029190495520343.
[I 2025-12-06 08:26:06,966] Trial 142 finished with value: 0.2983274811987048 and parameters: {'model_type': 'mlp', 'hidden_dims': '[512, 256]', 'dropout': 0.5058719895527125, 'batch_norm': False, 'lr': 7.95074533001356e-06, 'weight_decay': 3.8203257417123545e-07, 'epochs': 89, 'loss': 'mse', 'optimizer': 'adam', 'graph_mode': 'off', 'use_snp_selection': True, 'num_snps': 52442}. Best is trial 132 with value: 0.3029190495520343.
[I 2025-12-06 08:27:15,545] Trial 143 finished with value: 0.29814465266716544 and parameters: {'model_type': 'mlp', 'hidden_dims': '[512, 256]', 'dropout': 0.5123542608102591, 'batch_norm': False, 'lr': 5.932022514019173e-06, 'weight_decay': 8.115132716062145e-07, 'epochs': 211, 'loss': 'mse', 'optimizer': 'adam', 'graph_mode': 'off', 'use_snp_selection': True, 'num_snps': 54610}. Best is trial 132 with value: 0.3029190495520343.
[I 2025-12-06 08:28:15,782] Trial 144 finished with value: 0.288635345480285 and parameters: {'model_type': 'mlp', 'hidden_dims': '[512, 256]', 'dropout': 0.4867111637971946, 'batch_norm': False, 'lr': 1.6344454136646262e-05, 'weight_decay': 2.9110672718702054e-07, 'epochs': 191, 'loss': 'mse', 'optimizer': 'adam', 'graph_mode': 'off', 'use_snp_selection': True, 'num_snps': 48222}. Best is trial 132 with value: 0.3029190495520343.
[I 2025-12-06 08:29:03,326] Trial 145 finished with value: 0.27661638712419634 and parameters: {'model_type': 'mlp', 'hidden_dims': '[512, 256]', 'dropout': 0.38662001593448014, 'batch_norm': False, 'lr': 2.575472040878079e-06, 'weight_decay': 1.0228951808363003e-06, 'epochs': 82, 'loss': 'mse', 'optimizer': 'adam', 'graph_mode': 'off', 'use_snp_selection': True, 'num_snps': 51704}. Best is trial 132 with value: 0.3029190495520343.
[I 2025-12-06 08:30:01,656] Trial 146 finished with value: 0.2949900209790887 and parameters: {'model_type': 'mlp', 'hidden_dims': '[512, 256]', 'dropout': 0.49707422510019866, 'batch_norm': False, 'lr': 1.0615741584354601e-05, 'weight_decay': 6.362374095376481e-07, 'epochs': 170, 'loss': 'mse', 'optimizer': 'adam', 'graph_mode': 'off', 'use_snp_selection': True, 'num_snps': 49434}. Best is trial 132 with value: 0.3029190495520343.
[I 2025-12-06 08:30:53,555] Trial 147 finished with value: 0.30014298939060213 and parameters: {'model_type': 'mlp', 'hidden_dims': '[512, 256]', 'dropout': 0.4805438461929032, 'batch_norm': False, 'lr': 8.811880269113304e-06, 'weight_decay': 1.8012531402658898e-07, 'epochs': 96, 'loss': 'mse', 'optimizer': 'adam', 'graph_mode': 'off', 'use_snp_selection': True, 'num_snps': 56107}. Best is trial 132 with value: 0.3029190495520343.
[I 2025-12-06 08:31:49,223] Trial 148 finished with value: 0.296483778184559 and parameters: {'model_type': 'mlp', 'hidden_dims': '[512, 128]', 'dropout': 0.4706315784064851, 'batch_norm': False, 'lr': 8.805813735778402e-06, 'weight_decay': 1.995526014591533e-07, 'epochs': 119, 'loss': 'mse', 'optimizer': 'adam', 'graph_mode': 'off', 'use_snp_selection': True, 'num_snps': 56550}. Best is trial 132 with value: 0.3029190495520343.
[I 2025-12-06 08:32:02,986] Trial 149 finished with value: 0.29203293904795224 and parameters: {'model_type': 'mlp', 'hidden_dims': '[256, 128]', 'dropout': 0.4780740320338416, 'batch_norm': False, 'lr': 6.661776168636977e-06, 'weight_decay': 1.0432396889653076e-07, 'epochs': 101, 'loss': 'mse', 'optimizer': 'adam', 'graph_mode': 'off', 'use_snp_selection': False}. Best is trial 132 with value: 0.3029190495520343.
