[I 2025-12-05 21:46:36,132] Trial 65 finished with value: 0.24105879555428547 and parameters: {'model_type': 'mlp', 'hidden_dims': '[256, 128, 64]', 'dropout': 0.37680934911082614, 'batch_norm': False, 'lr': 2.256313619695771e-06, 'weight_decay': 0.0003527330851414867, 'epochs': 170, 'loss': 'mse', 'optimizer': 'adam', 'graph_mode': 'off', 'use_snp_selection': False}. Best is trial 63 with value: 0.25290748224954906.
[I 2025-12-05 21:47:09,032] Trial 66 finished with value: 0.237306415031677 and parameters: {'model_type': 'mlp', 'hidden_dims': '[256, 128, 64]', 'dropout': 0.3625727981167143, 'batch_norm': False, 'lr': 4.774402533402414e-06, 'weight_decay': 0.0002524862835434459, 'epochs': 184, 'loss': 'mse', 'optimizer': 'adam', 'graph_mode': 'off', 'use_snp_selection': False}. Best is trial 63 with value: 0.25290748224954906.
[I 2025-12-05 21:47:26,233] Trial 67 finished with value: 0.21250442436993447 and parameters: {'model_type': 'mlp', 'hidden_dims': '[128, 64]', 'dropout': 0.16656960642819546, 'batch_norm': False, 'lr': 3.254018703344708e-05, 'weight_decay': 0.0006765947847815282, 'epochs': 157, 'loss': 'mse', 'optimizer': 'adam', 'graph_mode': 'off', 'use_snp_selection': False}. Best is trial 63 with value: 0.25290748224954906.
[I 2025-12-05 21:48:42,270] Trial 68 finished with value: 0.23444422513828486 and parameters: {'model_type': 'mlp', 'hidden_dims': '[512, 256]', 'dropout': 0.19438073471582115, 'batch_norm': False, 'lr': 1.73783678514109e-06, 'weight_decay': 0.0004392166531220828, 'epochs': 245, 'loss': 'mse', 'optimizer': 'adam', 'graph_mode': 'off', 'use_snp_selection': False}. Best is trial 63 with value: 0.25290748224954906.
[I 2025-12-05 21:49:15,960] Trial 69 finished with value: 0.22609192134840214 and parameters: {'model_type': 'mlp', 'hidden_dims': '[256, 128, 64]', 'dropout': 0.2484339391598246, 'batch_norm': False, 'lr': 1.015753306286601e-06, 'weight_decay': 0.0009868045209927593, 'epochs': 189, 'loss': 'mse', 'optimizer': 'adam', 'graph_mode': 'off', 'use_snp_selection': False}. Best is trial 63 with value: 0.25290748224954906.
[I 2025-12-05 21:50:18,435] Trial 70 finished with value: 0.23612639758976406 and parameters: {'model_type': 'mlp', 'hidden_dims': '[256, 128, 64]', 'dropout': 0.429238314971094, 'batch_norm': False, 'lr': 3.4623706138562225e-06, 'weight_decay': 4.3963709235876286e-05, 'epochs': 206, 'loss': 'mse', 'optimizer': 'adam', 'graph_mode': 'off', 'use_snp_selection': True, 'num_snps': 41371}. Best is trial 63 with value: 0.25290748224954906.
[I 2025-12-05 21:51:29,644] Trial 71 finished with value: 0.2173884710629083 and parameters: {'model_type': 'mlp', 'hidden_dims': '[512, 256]', 'dropout': 0.30169106896781783, 'batch_norm': False, 'lr': 2.673842826508608e-06, 'weight_decay': 0.0005677121701640343, 'epochs': 230, 'loss': 'mse', 'optimizer': 'adam', 'graph_mode': 'off', 'use_snp_selection': False}. Best is trial 63 with value: 0.25290748224954906.
[I 2025-12-05 21:52:37,070] Trial 72 finished with value: 0.239682183101378 and parameters: {'model_type': 'mlp', 'hidden_dims': '[512, 64]', 'dropout': 0.3336776384698469, 'batch_norm': False, 'lr': 1.9617435619372713e-06, 'weight_decay': 0.00014459163444373167, 'epochs': 216, 'loss': 'mse', 'optimizer': 'adam', 'graph_mode': 'off', 'use_snp_selection': False}. Best is trial 63 with value: 0.25290748224954906.
[I 2025-12-05 21:53:21,570] Trial 73 finished with value: 0.24441150697995445 and parameters: {'model_type': 'mlp', 'hidden_dims': '[256, 128, 64]', 'dropout': 0.34461901904099645, 'batch_norm': False, 'lr': 1.4530443349525832e-06, 'weight_decay': 0.00023322269405382835, 'epochs': 265, 'loss': 'mae', 'optimizer': 'adam', 'graph_mode': 'off', 'use_snp_selection': False}. Best is trial 63 with value: 0.25290748224954906.
[I 2025-12-05 21:54:06,468] Trial 74 finished with value: 0.23089355876599665 and parameters: {'model_type': 'mlp', 'hidden_dims': '[256, 128, 64]', 'dropout': 0.3588627419617436, 'batch_norm': False, 'lr': 1.4377233284252016e-06, 'weight_decay': 4.041177397683986e-06, 'epochs': 268, 'loss': 'mse', 'optimizer': 'adam', 'graph_mode': 'off', 'use_snp_selection': False}. Best is trial 63 with value: 0.25290748224954906.
[I 2025-12-05 21:54:50,041] Trial 75 finished with value: 0.21852782801853068 and parameters: {'model_type': 'mlp', 'hidden_dims': '[256, 128, 64]', 'dropout': 0.37121409353622076, 'batch_norm': False, 'lr': 1.2499653650607138e-06, 'weight_decay': 0.00023230491547410702, 'epochs': 259, 'loss': 'mae', 'optimizer': 'adam', 'graph_mode': 'off', 'use_snp_selection': False}. Best is trial 63 with value: 0.25290748224954906.
[I 2025-12-05 21:55:31,321] Trial 76 finished with value: 0.11374305053920583 and parameters: {'model_type': 'mlp', 'hidden_dims': '[256, 128, 64]', 'dropout': 0.39355541473507966, 'batch_norm': True, 'lr': 2.241902103362791e-06, 'weight_decay': 0.00028729981925434544, 'epochs': 240, 'loss': 'mae', 'optimizer': 'adam', 'graph_mode': 'off', 'use_snp_selection': False}. Best is trial 63 with value: 0.25290748224954906.
[I 2025-12-05 21:56:17,755] Trial 77 finished with value: 0.25501946279800297 and parameters: {'model_type': 'mlp', 'hidden_dims': '[256, 128, 64]', 'dropout': 0.2698283646026201, 'batch_norm': False, 'lr': 1.778037382794437e-06, 'weight_decay': 7.677916446416364e-06, 'epochs': 278, 'loss': 'mse', 'optimizer': 'adam', 'graph_mode': 'off', 'use_snp_selection': False}. Best is trial 77 with value: 0.25501946279800297.
[I 2025-12-05 21:57:42,588] Trial 78 finished with value: 0.22831864739145438 and parameters: {'model_type': 'mlp', 'hidden_dims': '[512, 64]', 'dropout': 0.28074311039111055, 'batch_norm': False, 'lr': 3.906895923287285e-06, 'weight_decay': 7.018251998605872e-06, 'epochs': 279, 'loss': 'mse', 'optimizer': 'adam', 'graph_mode': 'off', 'use_snp_selection': False}. Best is trial 77 with value: 0.25501946279800297.
[I 2025-12-05 21:58:31,379] Trial 79 finished with value: 0.20456393272892895 and parameters: {'model_type': 'mlp', 'hidden_dims': '[256, 128]', 'dropout': 0.2680498380907444, 'batch_norm': False, 'lr': 7.172564613919988e-06, 'weight_decay': 8.266567121863856e-06, 'epochs': 296, 'loss': 'mse', 'optimizer': 'adam', 'graph_mode': 'off', 'use_snp_selection': False}. Best is trial 77 with value: 0.25501946279800297.
[I 2025-12-05 21:59:48,877] Trial 80 finished with value: 0.22803949753557679 and parameters: {'model_type': 'mlp', 'hidden_dims': '[512, 256]', 'dropout': 0.5552988644036942, 'batch_norm': False, 'lr': 1.7283057222152879e-06, 'weight_decay': 3.880260917811965e-06, 'epochs': 252, 'loss': 'mse', 'optimizer': 'adam', 'graph_mode': 'off', 'use_snp_selection': False}. Best is trial 77 with value: 0.25501946279800297.
[I 2025-12-05 22:00:34,668] Trial 81 finished with value: 0.24922975411431522 and parameters: {'model_type': 'mlp', 'hidden_dims': '[256, 128, 64]', 'dropout': 0.3172014481414815, 'batch_norm': False, 'lr': 1.537799904948892e-06, 'weight_decay': 1.212956834404006e-05, 'epochs': 274, 'loss': 'mse', 'optimizer': 'adam', 'graph_mode': 'off', 'use_snp_selection': False}. Best is trial 77 with value: 0.25501946279800297.
[I 2025-12-05 22:01:20,783] Trial 82 finished with value: 0.24726953632498333 and parameters: {'model_type': 'mlp', 'hidden_dims': '[256, 128, 64]', 'dropout': 0.299052709196973, 'batch_norm': False, 'lr': 2.4166966897800253e-06, 'weight_decay': 1.0889805558276648e-05, 'epochs': 276, 'loss': 'mse', 'optimizer': 'adam', 'graph_mode': 'off', 'use_snp_selection': False}. Best is trial 77 with value: 0.25501946279800297.
[I 2025-12-05 22:02:08,456] Trial 83 finished with value: 0.24480765984626593 and parameters: {'model_type': 'mlp', 'hidden_dims': '[256, 128, 64]', 'dropout': 0.31890469225836754, 'batch_norm': False, 'lr': 2.5346584283404658e-06, 'weight_decay': 2.0846352413286473e-05, 'epochs': 287, 'loss': 'mse', 'optimizer': 'adam', 'graph_mode': 'off', 'use_snp_selection': False}. Best is trial 77 with value: 0.25501946279800297.
[I 2025-12-05 22:02:58,228] Trial 84 finished with value: 0.2511044182954025 and parameters: {'model_type': 'mlp', 'hidden_dims': '[256, 128, 64]', 'dropout': 0.2961466164929678, 'batch_norm': False, 'lr': 1.9177058297114456e-06, 'weight_decay': 1.2248601846154175e-05, 'epochs': 301, 'loss': 'mse', 'optimizer': 'adam', 'graph_mode': 'off', 'use_snp_selection': False}. Best is trial 77 with value: 0.25501946279800297.
[I 2025-12-05 22:03:44,332] Trial 85 finished with value: 0.23918359273456424 and parameters: {'model_type': 'mlp', 'hidden_dims': '[256, 128, 64]', 'dropout': 0.29291414524404985, 'batch_norm': False, 'lr': 1.1765233447534945e-06, 'weight_decay': 1.1741073328269384e-05, 'epochs': 276, 'loss': 'mse', 'optimizer': 'adam', 'graph_mode': 'off', 'use_snp_selection': False}. Best is trial 77 with value: 0.25501946279800297.
[I 2025-12-05 22:04:34,864] Trial 86 finished with value: 0.2419382531759982 and parameters: {'model_type': 'mlp', 'hidden_dims': '[256, 128, 64]', 'dropout': 0.2599805958800584, 'batch_norm': False, 'lr': 1.8597349937131778e-06, 'weight_decay': 1.1381766998300288e-05, 'epochs': 307, 'loss': 'mse', 'optimizer': 'adam', 'graph_mode': 'off', 'use_snp_selection': False}. Best is trial 77 with value: 0.25501946279800297.
[I 2025-12-05 22:05:24,224] Trial 87 finished with value: 0.2454721414302225 and parameters: {'model_type': 'mlp', 'hidden_dims': '[256, 128, 64]', 'dropout': 0.3023112421927677, 'batch_norm': False, 'lr': 2.058956316251545e-06, 'weight_decay': 3.47143251611326e-05, 'epochs': 299, 'loss': 'mse', 'optimizer': 'adam', 'graph_mode': 'off', 'use_snp_selection': False}. Best is trial 77 with value: 0.25501946279800297.
[I 2025-12-05 22:06:16,420] Trial 88 finished with value: 0.2322939514149521 and parameters: {'model_type': 'mlp', 'hidden_dims': '[256, 128, 64]', 'dropout': 0.22472674712924487, 'batch_norm': False, 'lr': 1.5231423382362031e-06, 'weight_decay': 1.4721188306040154e-05, 'epochs': 319, 'loss': 'mse', 'optimizer': 'adam', 'graph_mode': 'off', 'use_snp_selection': False}. Best is trial 77 with value: 0.25501946279800297.
[I 2025-12-05 22:07:00,036] Trial 89 finished with value: 0.22872307472688375 and parameters: {'model_type': 'mlp', 'hidden_dims': '[256, 128, 64]', 'dropout': 0.27777394388098375, 'batch_norm': True, 'lr': 0.0006789064351886682, 'weight_decay': 2.635909107300346e-05, 'epochs': 66, 'loss': 'mse', 'optimizer': 'adam', 'graph_mode': 'off', 'use_snp_selection': True, 'num_snps': 28333}. Best is trial 77 with value: 0.25501946279800297.
[I 2025-12-05 22:07:44,907] Trial 90 finished with value: 0.24562973188800155 and parameters: {'model_type': 'mlp', 'hidden_dims': '[256, 128, 64]', 'dropout': 0.3158572911668579, 'batch_norm': False, 'lr': 3.1811767682969305e-06, 'weight_decay': 2.4886151490348677e-06, 'epochs': 271, 'loss': 'mse', 'optimizer': 'adam', 'graph_mode': 'off', 'use_snp_selection': False}. Best is trial 77 with value: 0.25501946279800297.
[I 2025-12-05 22:08:28,297] Trial 91 finished with value: 0.24753661488258233 and parameters: {'model_type': 'mlp', 'hidden_dims': '[256, 128, 64]', 'dropout': 0.2925565565006588, 'batch_norm': False, 'lr': 2.396780461825844e-06, 'weight_decay': 5.188328424372191e-06, 'epochs': 258, 'loss': 'mse', 'optimizer': 'adam', 'graph_mode': 'off', 'use_snp_selection': False}. Best is trial 77 with value: 0.25501946279800297.
[I 2025-12-05 22:09:12,344] Trial 92 finished with value: 0.25111464277594253 and parameters: {'model_type': 'mlp', 'hidden_dims': '[256, 128, 64]', 'dropout': 0.2899760707949256, 'batch_norm': False, 'lr': 2.5434879859545314e-06, 'weight_decay': 9.313861520931348e-06, 'epochs': 262, 'loss': 'mse', 'optimizer': 'adam', 'graph_mode': 'off', 'use_snp_selection': False}. Best is trial 77 with value: 0.25501946279800297.
[I 2025-12-05 22:09:56,343] Trial 93 finished with value: 0.24902361545484902 and parameters: {'model_type': 'mlp', 'hidden_dims': '[256, 128, 64]', 'dropout': 0.24422112742357666, 'batch_norm': False, 'lr': 1.7290431073906631e-06, 'weight_decay': 4.220491764829552e-06, 'epochs': 261, 'loss': 'mse', 'optimizer': 'adam', 'graph_mode': 'off', 'use_snp_selection': False}. Best is trial 77 with value: 0.25501946279800297.
[I 2025-12-05 22:10:44,653] Trial 94 finished with value: 0.24848755603910805 and parameters: {'model_type': 'mlp', 'hidden_dims': '[256, 128, 64]', 'dropout': 0.24280526667702781, 'batch_norm': False, 'lr': 1.1415536059348844e-06, 'weight_decay': 4.874009071516821e-06, 'epochs': 291, 'loss': 'mse', 'optimizer': 'adam', 'graph_mode': 'off', 'use_snp_selection': False}. Best is trial 77 with value: 0.25501946279800297.
[I 2025-12-05 22:11:32,917] Trial 95 finished with value: 0.2447972081367109 and parameters: {'model_type': 'mlp', 'hidden_dims': '[256, 128, 64]', 'dropout': 0.245377541252305, 'batch_norm': False, 'lr': 1.0902917915085896e-06, 'weight_decay': 4.6017203666304745e-06, 'epochs': 291, 'loss': 'mse', 'optimizer': 'adam', 'graph_mode': 'off', 'use_snp_selection': False}. Best is trial 77 with value: 0.25501946279800297.
[I 2025-12-05 22:12:27,533] Trial 96 finished with value: 0.2653727993063316 and parameters: {'model_type': 'mlp', 'hidden_dims': '[256, 128, 64]', 'dropout': 0.2167350833618778, 'batch_norm': False, 'lr': 1.233329509404118e-06, 'weight_decay': 3.2540700334609154e-06, 'epochs': 335, 'loss': 'mse', 'optimizer': 'adam', 'graph_mode': 'off', 'use_snp_selection': False}. Best is trial 96 with value: 0.2653727993063316.
[I 2025-12-05 22:12:57,844] Trial 97 finished with value: 0.23578791196459856 and parameters: {'model_type': 'mlp', 'hidden_dims': '[128, 64]', 'dropout': 0.22526128083062352, 'batch_norm': False, 'lr': 1.8922655033059034e-06, 'weight_decay': 1.7613522418382592e-06, 'epochs': 337, 'loss': 'mse', 'optimizer': 'adam', 'graph_mode': 'off', 'use_snp_selection': False}. Best is trial 96 with value: 0.2653727993063316.
[I 2025-12-05 22:13:54,186] Trial 98 finished with value: 0.25277526221970253 and parameters: {'model_type': 'mlp', 'hidden_dims': '[256, 128, 64]', 'dropout': 0.21537712394882055, 'batch_norm': False, 'lr': 1.3829318528714316e-06, 'weight_decay': 3.359813394972944e-06, 'epochs': 348, 'loss': 'mse', 'optimizer': 'adam', 'graph_mode': 'off', 'use_snp_selection': False}. Best is trial 96 with value: 0.2653727993063316.
[I 2025-12-05 22:14:49,150] Trial 99 finished with value: 0.23418966365238258 and parameters: {'model_type': 'mlp', 'hidden_dims': '[256, 128, 64]', 'dropout': 0.21536589765061986, 'batch_norm': False, 'lr': 1.2733681236305917e-06, 'weight_decay': 2.2237947371750907e-06, 'epochs': 338, 'loss': 'mse', 'optimizer': 'adam', 'graph_mode': 'off', 'use_snp_selection': False}. Best is trial 96 with value: 0.2653727993063316.
[I 2025-12-05 22:15:43,168] Trial 100 finished with value: 0.24684061054034817 and parameters: {'model_type': 'mlp', 'hidden_dims': '[256, 128, 64]', 'dropout': 0.20188107369050481, 'batch_norm': False, 'lr': 1.3905334887707835e-06, 'weight_decay': 1.2382915147995781e-06, 'epochs': 331, 'loss': 'mse', 'optimizer': 'adam', 'graph_mode': 'off', 'use_snp_selection': False}. Best is trial 96 with value: 0.2653727993063316.
[I 2025-12-05 22:16:39,392] Trial 101 finished with value: 0.23468837637398923 and parameters: {'model_type': 'mlp', 'hidden_dims': '[256, 128, 64]', 'dropout': 0.2727258273698225, 'batch_norm': False, 'lr': 1.6556379459080144e-06, 'weight_decay': 6.433014669249762e-06, 'epochs': 347, 'loss': 'mse', 'optimizer': 'adam', 'graph_mode': 'off', 'use_snp_selection': False}. Best is trial 96 with value: 0.2653727993063316.
[I 2025-12-05 22:17:35,911] Trial 102 finished with value: 0.23150940878140122 and parameters: {'model_type': 'mlp', 'hidden_dims': '[256, 128, 64]', 'dropout': 0.23291309167974014, 'batch_norm': False, 'lr': 2.07738553168266e-06, 'weight_decay': 2.755163420441265e-06, 'epochs': 349, 'loss': 'mse', 'optimizer': 'adam', 'graph_mode': 'off', 'use_snp_selection': False}. Best is trial 96 with value: 0.2653727993063316.
[I 2025-12-05 22:18:16,364] Trial 103 finished with value: 0.23258663275429656 and parameters: {'model_type': 'mlp', 'hidden_dims': '[256, 128, 64]', 'dropout': 0.21042187614463118, 'batch_norm': False, 'lr': 2.914319643884224e-06, 'weight_decay': 3.831316235045676e-06, 'epochs': 237, 'loss': 'mse', 'optimizer': 'adam', 'graph_mode': 'off', 'use_snp_selection': False}. Best is trial 96 with value: 0.2653727993063316.
[I 2025-12-05 22:19:08,396] Trial 104 finished with value: 0.26287768292140595 and parameters: {'model_type': 'mlp', 'hidden_dims': '[256, 128, 64]', 'dropout': 0.3116063344846386, 'batch_norm': False, 'lr': 1.0327801314538825e-06, 'weight_decay': 8.59526198046078e-06, 'epochs': 318, 'loss': 'mse', 'optimizer': 'adam', 'graph_mode': 'off', 'use_snp_selection': False}. Best is trial 96 with value: 0.2653727993063316.
[I 2025-12-05 22:19:59,712] Trial 105 finished with value: 0.22797780639871865 and parameters: {'model_type': 'mlp', 'hidden_dims': '[256, 128, 64]', 'dropout': 0.31129041501232585, 'batch_norm': False, 'lr': 1.23571326245751e-06, 'weight_decay': 8.375704781471551e-06, 'epochs': 312, 'loss': 'mse', 'optimizer': 'adam', 'graph_mode': 'off', 'use_snp_selection': False}. Best is trial 96 with value: 0.2653727993063316.
[I 2025-12-05 22:20:51,226] Trial 106 finished with value: 0.238783955704158 and parameters: {'model_type': 'mlp', 'hidden_dims': '[256, 128, 64]', 'dropout': 0.32949611161865117, 'batch_norm': False, 'lr': 1.0361854908918376e-06, 'weight_decay': 9.532560963436292e-06, 'epochs': 314, 'loss': 'mse', 'optimizer': 'adam', 'graph_mode': 'off', 'use_snp_selection': False}. Best is trial 96 with value: 0.2653727993063316.
[I 2025-12-05 22:22:16,775] Trial 107 finished with value: 0.18793083608494013 and parameters: {'model_type': 'mlp', 'hidden_dims': '[256, 128]', 'dropout': 0.34751325558819246, 'batch_norm': True, 'lr': 1.4515551764305988e-06, 'weight_decay': 3.1362490305536715e-06, 'epochs': 338, 'loss': 'mse', 'optimizer': 'adam', 'graph_mode': 'off', 'use_snp_selection': True, 'num_snps': 50748}. Best is trial 96 with value: 0.2653727993063316.
[I 2025-12-05 22:23:09,980] Trial 108 finished with value: 0.21783821532960074 and parameters: {'model_type': 'mlp', 'hidden_dims': '[256, 128, 64]', 'dropout': 0.19308770158036234, 'batch_norm': False, 'lr': 4.2149344400003774e-06, 'weight_decay': 1.913997090517182e-05, 'epochs': 327, 'loss': 'mse', 'optimizer': 'adam', 'graph_mode': 'off', 'use_snp_selection': False}. Best is trial 96 with value: 0.2653727993063316.
[I 2025-12-05 22:23:59,594] Trial 109 finished with value: 0.2381004894467355 and parameters: {'model_type': 'mlp', 'hidden_dims': '[256, 128, 64]', 'dropout': 0.28272414518403777, 'batch_norm': False, 'lr': 2.0584808258385894e-06, 'weight_decay': 1.3552812320659396e-05, 'epochs': 301, 'loss': 'mse', 'optimizer': 'adam', 'graph_mode': 'off', 'use_snp_selection': False}. Best is trial 96 with value: 0.2653727993063316.
[I 2025-12-05 22:24:30,320] Trial 110 finished with value: 0.23401324841467805 and parameters: {'model_type': 'mlp', 'hidden_dims': '[128, 64]', 'dropout': 0.3266954499929505, 'batch_norm': False, 'lr': 2.6579607904036714e-06, 'weight_decay': 5.704835376953002e-06, 'epochs': 343, 'loss': 'mse', 'optimizer': 'adam', 'graph_mode': 'off', 'use_snp_selection': False}. Best is trial 96 with value: 0.2653727993063316.
[I 2025-12-05 22:25:12,336] Trial 111 finished with value: 0.25115488809030245 and parameters: {'model_type': 'mlp', 'hidden_dims': '[256, 128, 64]', 'dropout': 0.2558748279583791, 'batch_norm': False, 'lr': 1.6465192397696307e-06, 'weight_decay': 3.3941214561483813e-06, 'epochs': 248, 'loss': 'mse', 'optimizer': 'adam', 'graph_mode': 'off', 'use_snp_selection': False}. Best is trial 96 with value: 0.2653727993063316.
[I 2025-12-05 22:25:54,843] Trial 112 finished with value: 0.2532617705928312 and parameters: {'model_type': 'mlp', 'hidden_dims': '[256, 128, 64]', 'dropout': 0.2910091518328657, 'batch_norm': False, 'lr': 1.536213721010053e-06, 'weight_decay': 7.831317979535387e-06, 'epochs': 251, 'loss': 'mse', 'optimizer': 'adam', 'graph_mode': 'off', 'use_snp_selection': False}. Best is trial 96 with value: 0.2653727993063316.
[I 2025-12-05 22:26:36,465] Trial 113 finished with value: 0.24531793469910265 and parameters: {'model_type': 'mlp', 'hidden_dims': '[256, 128, 64]', 'dropout': 0.2516031863120869, 'batch_norm': False, 'lr': 1.2916621033105415e-06, 'weight_decay': 1.3792240318629607e-06, 'epochs': 245, 'loss': 'mse', 'optimizer': 'adam', 'graph_mode': 'off', 'use_snp_selection': False}. Best is trial 96 with value: 0.2653727993063316.
[I 2025-12-05 22:27:18,990] Trial 114 finished with value: 0.24847007083515651 and parameters: {'model_type': 'mlp', 'hidden_dims': '[256, 128, 64]', 'dropout': 0.26698544984110584, 'batch_norm': False, 'lr': 1.774341390123226e-06, 'weight_decay': 6.9357553006193215e-06, 'epochs': 251, 'loss': 'mse', 'optimizer': 'adam', 'graph_mode': 'off', 'use_snp_selection': False}. Best is trial 96 with value: 0.2653727993063316.
[I 2025-12-05 22:27:57,702] Trial 115 finished with value: 0.2422079786149205 and parameters: {'model_type': 'mlp', 'hidden_dims': '[256, 128, 64]', 'dropout': 0.2874274423900778, 'batch_norm': False, 'lr': 1.0219037083352866e-06, 'weight_decay': 3.4548090300315853e-06, 'epochs': 225, 'loss': 'mse', 'optimizer': 'adam', 'graph_mode': 'off', 'use_snp_selection': False}. Best is trial 96 with value: 0.2653727993063316.
[I 2025-12-05 22:28:37,467] Trial 116 finished with value: 0.24409857115857175 and parameters: {'model_type': 'mlp', 'hidden_dims': '[256, 128, 64]', 'dropout': 0.3073482291226217, 'batch_norm': False, 'lr': 2.1661338476427675e-06, 'weight_decay': 9.42174157874909e-06, 'epochs': 232, 'loss': 'mse', 'optimizer': 'adam', 'graph_mode': 'off', 'use_snp_selection': False}. Best is trial 96 with value: 0.2653727993063316.
