[I 2025-12-06 13:32:58,131] Trial 41 finished with value: 0.27409365230068805 and parameters: {'model_type': 'mlp', 'hidden_dims': '[512, 256]', 'dropout': 0.47366960883935266, 'batch_norm': False, 'lr': 4.596125098685083e-06, 'weight_decay': 5.755186574982408e-06, 'epochs': 314, 'loss': 'mae', 'optimizer': 'adam', 'graph_mode': 'off', 'use_snp_selection': False}. Best is trial 17 with value: 0.2751062484365413.
[I 2025-12-06 13:34:31,834] Trial 42 finished with value: 0.2659991528144891 and parameters: {'model_type': 'mlp', 'hidden_dims': '[512, 256]', 'dropout': 0.48836266105522896, 'batch_norm': False, 'lr': 2.1129244799744535e-06, 'weight_decay': 7.771702034283768e-06, 'epochs': 308, 'loss': 'mae', 'optimizer': 'adam', 'graph_mode': 'off', 'use_snp_selection': False}. Best is trial 17 with value: 0.2751062484365413.
[I 2025-12-06 13:36:08,852] Trial 43 finished with value: 0.27068160333180136 and parameters: {'model_type': 'mlp', 'hidden_dims': '[512, 256]', 'dropout': 0.38629133631073564, 'batch_norm': False, 'lr': 7.849391180227986e-06, 'weight_decay': 3.02209729791328e-05, 'epochs': 320, 'loss': 'mae', 'optimizer': 'adam', 'graph_mode': 'off', 'use_snp_selection': False}. Best is trial 17 with value: 0.2751062484365413.
[I 2025-12-06 13:37:45,804] Trial 44 finished with value: 0.2713876008963158 and parameters: {'model_type': 'mlp', 'hidden_dims': '[512, 256]', 'dropout': 0.40976114755964765, 'batch_norm': False, 'lr': 8.594146832226199e-06, 'weight_decay': 1.3485524730073597e-05, 'epochs': 320, 'loss': 'mae', 'optimizer': 'adam', 'graph_mode': 'off', 'use_snp_selection': False}. Best is trial 17 with value: 0.2751062484365413.
[I 2025-12-06 13:38:28,738] Trial 45 finished with value: 0.2717194876533905 and parameters: {'model_type': 'mlp', 'hidden_dims': '[512, 256]', 'dropout': 0.3906345294853611, 'batch_norm': False, 'lr': 8.292130763789353e-06, 'weight_decay': 3.8450829016761936e-05, 'epochs': 127, 'loss': 'mae', 'optimizer': 'adam', 'graph_mode': 'off', 'use_snp_selection': False}. Best is trial 17 with value: 0.2751062484365413.
[I 2025-12-06 13:39:04,143] Trial 46 finished with value: 0.19491264270143144 and parameters: {'model_type': 'mlp', 'hidden_dims': '[512, 256]', 'dropout': 0.4159986851340889, 'batch_norm': True, 'lr': 1.024696950715863e-05, 'weight_decay': 0.00016517088466076038, 'epochs': 99, 'loss': 'mae', 'optimizer': 'adam', 'graph_mode': 'off', 'use_snp_selection': False}. Best is trial 17 with value: 0.2751062484365413.
[I 2025-12-06 13:39:46,767] Trial 47 finished with value: 0.2664652168193088 and parameters: {'model_type': 'mlp', 'hidden_dims': '[512, 128]', 'dropout': 0.3315198214925387, 'batch_norm': False, 'lr': 1.4954807148016316e-05, 'weight_decay': 5.5476497801996356e-05, 'epochs': 127, 'loss': 'mae', 'optimizer': 'adam', 'graph_mode': 'off', 'use_snp_selection': False}. Best is trial 17 with value: 0.2751062484365413.
[I 2025-12-06 13:40:14,785] Trial 48 finished with value: 0.26976381143515726 and parameters: {'model_type': 'mlp', 'hidden_dims': '[512, 256]', 'dropout': 0.4059660953638601, 'batch_norm': False, 'lr': 2.6101976621101958e-05, 'weight_decay': 1.4723168568398131e-05, 'epochs': 75, 'loss': 'mae', 'optimizer': 'adam', 'graph_mode': 'off', 'use_snp_selection': False}. Best is trial 17 with value: 0.2751062484365413.
[I 2025-12-06 13:41:28,062] Trial 49 finished with value: 0.25703829616988905 and parameters: {'model_type': 'mlp', 'hidden_dims': '[512, 256]', 'dropout': 0.47623199878078104, 'batch_norm': False, 'lr': 6.492785862743271e-06, 'weight_decay': 3.946637445760036e-07, 'epochs': 137, 'loss': 'mse', 'optimizer': 'adam', 'graph_mode': 'off', 'use_snp_selection': True, 'num_snps': 46888}. Best is trial 17 with value: 0.2751062484365413.
[I 2025-12-06 13:41:46,313] Trial 50 finished with value: 0.27476263320094185 and parameters: {'model_type': 'mlp', 'hidden_dims': '[128, 64]', 'dropout': 0.3079533790660518, 'batch_norm': False, 'lr': 2.0024062321654754e-05, 'weight_decay': 2.61579857277345e-06, 'epochs': 176, 'loss': 'mae', 'optimizer': 'adam', 'graph_mode': 'off', 'use_snp_selection': False}. Best is trial 17 with value: 0.2751062484365413.
[I 2025-12-06 13:42:00,549] Trial 51 finished with value: 0.26094327507883575 and parameters: {'model_type': 'mlp', 'hidden_dims': '[128, 64]', 'dropout': 0.30662751579742326, 'batch_norm': False, 'lr': 2.073460892137056e-05, 'weight_decay': 3.603407788280677e-06, 'epochs': 119, 'loss': 'mae', 'optimizer': 'adam', 'graph_mode': 'off', 'use_snp_selection': False}. Best is trial 17 with value: 0.2751062484365413.
[I 2025-12-06 13:42:19,455] Trial 52 finished with value: 0.26735735130569876 and parameters: {'model_type': 'mlp', 'hidden_dims': '[128, 64]', 'dropout': 0.23036854194229772, 'batch_norm': False, 'lr': 3.503809475643368e-05, 'weight_decay': 1.4038051211417448e-05, 'epochs': 186, 'loss': 'mae', 'optimizer': 'adam', 'graph_mode': 'off', 'use_snp_selection': False}. Best is trial 17 with value: 0.2751062484365413.
[I 2025-12-06 13:42:36,419] Trial 53 finished with value: 0.26914609527285815 and parameters: {'model_type': 'mlp', 'hidden_dims': '[128, 64]', 'dropout': 0.349228345429514, 'batch_norm': False, 'lr': 1.497555698168327e-05, 'weight_decay': 1.6763021575910827e-07, 'epochs': 157, 'loss': 'mae', 'optimizer': 'adam', 'graph_mode': 'off', 'use_snp_selection': False}. Best is trial 17 with value: 0.2751062484365413.
[I 2025-12-06 13:42:54,511] Trial 54 finished with value: 0.26791099169187144 and parameters: {'model_type': 'mlp', 'hidden_dims': '[128, 64]', 'dropout': 0.3068305805604012, 'batch_norm': False, 'lr': 4.8678767623786906e-05, 'weight_decay': 1.977764856373129e-06, 'epochs': 175, 'loss': 'mae', 'optimizer': 'adam', 'graph_mode': 'off', 'use_snp_selection': False}. Best is trial 17 with value: 0.2751062484365413.
[I 2025-12-06 13:43:13,493] Trial 55 finished with value: 0.2513427600472364 and parameters: {'model_type': 'mlp', 'hidden_dims': '[512, 128]', 'dropout': 0.37683325385070165, 'batch_norm': False, 'lr': 1.0664741171365257e-05, 'weight_decay': 3.509569205129214e-06, 'epochs': 42, 'loss': 'mae', 'optimizer': 'adam', 'graph_mode': 'off', 'use_snp_selection': False}. Best is trial 17 with value: 0.2751062484365413.
[I 2025-12-06 13:44:19,511] Trial 56 finished with value: 0.26290144848667835 and parameters: {'model_type': 'mlp', 'hidden_dims': '[512, 256]', 'dropout': 0.27244619811604454, 'batch_norm': False, 'lr': 4.925191277780045e-06, 'weight_decay': 9.451980764465269e-05, 'epochs': 210, 'loss': 'mae', 'optimizer': 'adam', 'graph_mode': 'off', 'use_snp_selection': False}. Best is trial 17 with value: 0.2751062484365413.
[I 2025-12-06 13:44:42,040] Trial 57 finished with value: 0.209879704857455 and parameters: {'model_type': 'mlp', 'hidden_dims': '[128, 64]', 'dropout': 0.5258194955309446, 'batch_norm': True, 'lr': 8.134711583073864e-06, 'weight_decay': 3.9953700208789376e-05, 'epochs': 229, 'loss': 'mae', 'optimizer': 'adam', 'graph_mode': 'off', 'use_snp_selection': False}. Best is trial 17 with value: 0.2751062484365413.
[I 2025-12-06 13:45:29,695] Trial 58 finished with value: 0.2603591217154026 and parameters: {'model_type': 'mlp', 'hidden_dims': '[256, 128, 64]', 'dropout': 0.20660483606825308, 'batch_norm': False, 'lr': 3.1412482282049842e-06, 'weight_decay': 3.733168937284035e-07, 'epochs': 289, 'loss': 'mae', 'optimizer': 'adam', 'graph_mode': 'off', 'use_snp_selection': False}. Best is trial 17 with value: 0.2751062484365413.
[I 2025-12-06 13:46:50,760] Trial 59 finished with value: 0.2579712545206326 and parameters: {'model_type': 'mlp', 'hidden_dims': '[512, 256]', 'dropout': 0.49686939425367527, 'batch_norm': False, 'lr': 2.443087391704216e-05, 'weight_decay': 2.183163024420866e-05, 'epochs': 268, 'loss': 'mae', 'optimizer': 'adam', 'graph_mode': 'off', 'use_snp_selection': False}. Best is trial 17 with value: 0.2751062484365413.
[I 2025-12-06 13:47:04,846] Trial 60 finished with value: 0.2761065402685473 and parameters: {'model_type': 'mlp', 'hidden_dims': '[128, 64]', 'dropout': 0.2929693074252559, 'batch_norm': False, 'lr': 1.489588281215599e-05, 'weight_decay': 8.379734647289669e-07, 'epochs': 115, 'loss': 'mae', 'optimizer': 'adam', 'graph_mode': 'off', 'use_snp_selection': False}. Best is trial 60 with value: 0.2761065402685473.
[I 2025-12-06 13:47:18,052] Trial 61 finished with value: 0.2745020274371993 and parameters: {'model_type': 'mlp', 'hidden_dims': '[128, 64]', 'dropout': 0.24419605910249964, 'batch_norm': False, 'lr': 1.3501113454236411e-05, 'weight_decay': 2.4223098955409116e-07, 'epochs': 103, 'loss': 'mae', 'optimizer': 'adam', 'graph_mode': 'off', 'use_snp_selection': False}. Best is trial 60 with value: 0.2761065402685473.
[I 2025-12-06 13:47:30,876] Trial 62 finished with value: 0.2628312395419631 and parameters: {'model_type': 'mlp', 'hidden_dims': '[128, 64]', 'dropout': 0.23812323105298025, 'batch_norm': False, 'lr': 1.4159125243694106e-05, 'weight_decay': 2.644942280224411e-07, 'epochs': 98, 'loss': 'mae', 'optimizer': 'adam', 'graph_mode': 'off', 'use_snp_selection': False}. Best is trial 60 with value: 0.2761065402685473.
[I 2025-12-06 13:47:42,463] Trial 63 finished with value: 0.2622356141855901 and parameters: {'model_type': 'mlp', 'hidden_dims': '[128, 64]', 'dropout': 0.2940503374765407, 'batch_norm': False, 'lr': 4.307275163158755e-05, 'weight_decay': 9.475973970458634e-07, 'epochs': 82, 'loss': 'mae', 'optimizer': 'adam', 'graph_mode': 'off', 'use_snp_selection': False}. Best is trial 60 with value: 0.2761065402685473.
[I 2025-12-06 13:47:56,389] Trial 64 finished with value: 0.26872135467062247 and parameters: {'model_type': 'mlp', 'hidden_dims': '[128, 64]', 'dropout': 0.17575092244205393, 'batch_norm': False, 'lr': 1.7872096085489355e-05, 'weight_decay': 1.5062547342524417e-07, 'epochs': 114, 'loss': 'mae', 'optimizer': 'adam', 'graph_mode': 'off', 'use_snp_selection': False}. Best is trial 60 with value: 0.2761065402685473.
[I 2025-12-06 13:48:12,318] Trial 65 finished with value: 0.25264614843929106 and parameters: {'model_type': 'mlp', 'hidden_dims': '[128, 64]', 'dropout': 0.2502011290222777, 'batch_norm': False, 'lr': 6.734073714460217e-06, 'weight_decay': 2.634506088873429e-07, 'epochs': 141, 'loss': 'mae', 'optimizer': 'adam', 'graph_mode': 'off', 'use_snp_selection': False}. Best is trial 60 with value: 0.2761065402685473.
[I 2025-12-06 13:48:50,789] Trial 66 finished with value: 0.21931126934264739 and parameters: {'model_type': 'mlp', 'hidden_dims': '[128, 64]', 'dropout': 0.21370677605219993, 'batch_norm': False, 'lr': 4.63366039626e-06, 'weight_decay': 4.805133007997273e-07, 'epochs': 76, 'loss': 'mae', 'optimizer': 'adam', 'graph_mode': 'off', 'use_snp_selection': True, 'num_snps': 22881}. Best is trial 60 with value: 0.2761065402685473.
[I 2025-12-06 13:49:04,252] Trial 67 finished with value: 0.2575364925032079 and parameters: {'model_type': 'mlp', 'hidden_dims': '[128, 64]', 'dropout': 0.3439360810465122, 'batch_norm': False, 'lr': 2.7236684397109086e-05, 'weight_decay': 7.776674360117824e-07, 'epochs': 110, 'loss': 'mae', 'optimizer': 'adam', 'graph_mode': 'off', 'use_snp_selection': False}. Best is trial 60 with value: 0.2761065402685473.
[I 2025-12-06 13:49:14,508] Trial 68 finished with value: 0.2578493930676804 and parameters: {'model_type': 'mlp', 'hidden_dims': '[128, 64]', 'dropout': 0.18643223432297998, 'batch_norm': False, 'lr': 7.432116984385524e-05, 'weight_decay': 2.4572627319952097e-06, 'epochs': 64, 'loss': 'mse', 'optimizer': 'adam', 'graph_mode': 'off', 'use_snp_selection': False}. Best is trial 60 with value: 0.2761065402685473.
[I 2025-12-06 13:49:30,918] Trial 69 finished with value: 0.19714714115336876 and parameters: {'model_type': 'mlp', 'hidden_dims': '[128, 64]', 'dropout': 0.2835156723065423, 'batch_norm': False, 'lr': 0.0008925222241173445, 'weight_decay': 1.2969585669104718e-07, 'epochs': 154, 'loss': 'mae', 'optimizer': 'adam', 'graph_mode': 'off', 'use_snp_selection': False}. Best is trial 60 with value: 0.2761065402685473.
[I 2025-12-06 13:49:55,872] Trial 70 finished with value: 0.2703359132418161 and parameters: {'model_type': 'mlp', 'hidden_dims': '[256, 128]', 'dropout': 0.26136004743784536, 'batch_norm': False, 'lr': 1.0230823827602152e-05, 'weight_decay': 2.2516960073075372e-07, 'epochs': 133, 'loss': 'mae', 'optimizer': 'adam', 'graph_mode': 'off', 'use_snp_selection': False}. Best is trial 60 with value: 0.2761065402685473.
[I 2025-12-06 13:50:50,330] Trial 71 finished with value: 0.26678557975671147 and parameters: {'model_type': 'mlp', 'hidden_dims': '[512, 256]', 'dropout': 0.317099506593894, 'batch_norm': False, 'lr': 1.2465617322432556e-05, 'weight_decay': 6.096016448784533e-06, 'epochs': 170, 'loss': 'mae', 'optimizer': 'adam', 'graph_mode': 'off', 'use_snp_selection': False}. Best is trial 60 with value: 0.2761065402685473.
[I 2025-12-06 13:51:27,280] Trial 72 finished with value: 0.2625889330245713 and parameters: {'model_type': 'mlp', 'hidden_dims': '[512, 256]', 'dropout': 0.46539015950528106, 'batch_norm': False, 'lr': 6.100070658040449e-06, 'weight_decay': 3.3417159439547586e-07, 'epochs': 106, 'loss': 'mae', 'optimizer': 'adam', 'graph_mode': 'off', 'use_snp_selection': False}. Best is trial 60 with value: 0.2761065402685473.
[I 2025-12-06 13:53:01,572] Trial 73 finished with value: 0.267457892569994 and parameters: {'model_type': 'mlp', 'hidden_dims': '[512, 256]', 'dropout': 0.39582877000206595, 'batch_norm': False, 'lr': 1.5823143908212204e-05, 'weight_decay': 1.362222886410693e-06, 'epochs': 314, 'loss': 'mae', 'optimizer': 'adam', 'graph_mode': 'off', 'use_snp_selection': False}. Best is trial 60 with value: 0.2761065402685473.
[I 2025-12-06 13:54:06,116] Trial 74 finished with value: 0.2696543387695745 and parameters: {'model_type': 'mlp', 'hidden_dims': '[512, 128]', 'dropout': 0.36178901496689786, 'batch_norm': False, 'lr': 9.14251188295001e-06, 'weight_decay': 3.6952266370571084e-06, 'epochs': 205, 'loss': 'mae', 'optimizer': 'adam', 'graph_mode': 'off', 'use_snp_selection': False}. Best is trial 60 with value: 0.2761065402685473.
[I 2025-12-06 13:54:38,766] Trial 75 finished with value: 0.26363767930633875 and parameters: {'model_type': 'mlp', 'hidden_dims': '[256, 128, 64]', 'dropout': 0.5051269159553541, 'batch_norm': False, 'lr': 2.0082147348450066e-05, 'weight_decay': 5.329673201507885e-07, 'epochs': 187, 'loss': 'mae', 'optimizer': 'adam', 'graph_mode': 'off', 'use_snp_selection': False}. Best is trial 60 with value: 0.2761065402685473.
[I 2025-12-06 13:54:53,868] Trial 76 finished with value: 0.19065418021485342 and parameters: {'model_type': 'mlp', 'hidden_dims': '[128, 64]', 'dropout': 0.4338136982415009, 'batch_norm': True, 'lr': 2.96197987037e-06, 'weight_decay': 1.0451198384749447e-07, 'epochs': 127, 'loss': 'mae', 'optimizer': 'adam', 'graph_mode': 'off', 'use_snp_selection': False}. Best is trial 60 with value: 0.2761065402685473.
[I 2025-12-06 13:55:25,513] Trial 77 finished with value: 0.25818553626309176 and parameters: {'model_type': 'mlp', 'hidden_dims': '[512, 256]', 'dropout': 0.41977537258459174, 'batch_norm': False, 'lr': 1.2093679914857913e-05, 'weight_decay': 2.044982962593491e-07, 'epochs': 87, 'loss': 'mae', 'optimizer': 'adam', 'graph_mode': 'off', 'use_snp_selection': False}. Best is trial 60 with value: 0.2761065402685473.
[I 2025-12-06 13:55:58,000] Trial 78 finished with value: 0.239942357729868 and parameters: {'model_type': 'mlp', 'hidden_dims': '[512, 64]', 'dropout': 0.29281575340173405, 'batch_norm': False, 'lr': 4.115590692975218e-06, 'weight_decay': 1.2476121352440465e-05, 'epochs': 240, 'loss': 'mae', 'optimizer': 'adam', 'graph_mode': 'off', 'use_snp_selection': True, 'num_snps': 2246}. Best is trial 60 with value: 0.2761065402685473.
[I 2025-12-06 13:57:29,906] Trial 79 finished with value: 0.23737413819791153 and parameters: {'model_type': 'mlp', 'hidden_dims': '[512, 256]', 'dropout': 0.11907044296807826, 'batch_norm': False, 'lr': 7.418205147120556e-06, 'weight_decay': 8.544857661292563e-06, 'epochs': 303, 'loss': 'mse', 'optimizer': 'adam', 'graph_mode': 'off', 'use_snp_selection': False}. Best is trial 60 with value: 0.2761065402685473.
[I 2025-12-06 13:57:55,031] Trial 80 finished with value: 0.05736154232631294 and parameters: {'model_type': 'mlp', 'hidden_dims': '[128, 64]', 'dropout': 0.44787722720305334, 'batch_norm': False, 'lr': 0.0004882750310617914, 'weight_decay': 5.122018064969277e-06, 'epochs': 276, 'loss': 'mae', 'optimizer': 'adam', 'graph_mode': 'off', 'use_snp_selection': False}. Best is trial 60 with value: 0.2761065402685473.
[I 2025-12-06 13:59:32,691] Trial 81 finished with value: 0.26661978080403 and parameters: {'model_type': 'mlp', 'hidden_dims': '[512, 256]', 'dropout': 0.3847791937245111, 'batch_norm': False, 'lr': 8.65119915565597e-06, 'weight_decay': 3.252853772722893e-05, 'epochs': 322, 'loss': 'mae', 'optimizer': 'adam', 'graph_mode': 'off', 'use_snp_selection': False}. Best is trial 60 with value: 0.2761065402685473.
[I 2025-12-06 14:01:02,253] Trial 82 finished with value: 0.26938238772701284 and parameters: {'model_type': 'mlp', 'hidden_dims': '[512, 256]', 'dropout': 0.3406099576455486, 'batch_norm': False, 'lr': 5.19567058935631e-06, 'weight_decay': 2.790768752581111e-05, 'epochs': 292, 'loss': 'mae', 'optimizer': 'adam', 'graph_mode': 'off', 'use_snp_selection': False}. Best is trial 60 with value: 0.2761065402685473.
[I 2025-12-06 14:02:37,775] Trial 83 finished with value: 0.2666795258594855 and parameters: {'model_type': 'mlp', 'hidden_dims': '[512, 256]', 'dropout': 0.48988362227947263, 'batch_norm': False, 'lr': 7.480871643544423e-06, 'weight_decay': 1.726575811479445e-05, 'epochs': 315, 'loss': 'mae', 'optimizer': 'adam', 'graph_mode': 'off', 'use_snp_selection': False}. Best is trial 60 with value: 0.2761065402685473.
[I 2025-12-06 14:04:20,014] Trial 84 finished with value: 0.27475906252707255 and parameters: {'model_type': 'mlp', 'hidden_dims': '[512, 256]', 'dropout': 0.3938429458743719, 'batch_norm': False, 'lr': 9.722477828242508e-06, 'weight_decay': 4.155949821925531e-05, 'epochs': 339, 'loss': 'mae', 'optimizer': 'adam', 'graph_mode': 'off', 'use_snp_selection': False}. Best is trial 60 with value: 0.2761065402685473.
[I 2025-12-06 14:06:03,035] Trial 85 finished with value: 0.25806714110875756 and parameters: {'model_type': 'mlp', 'hidden_dims': '[512, 256]', 'dropout': 0.36946053687606917, 'batch_norm': False, 'lr': 2.3388714189279937e-06, 'weight_decay': 6.592319884186951e-05, 'epochs': 341, 'loss': 'mae', 'optimizer': 'adam', 'graph_mode': 'off', 'use_snp_selection': False}. Best is trial 60 with value: 0.2761065402685473.
[I 2025-12-06 14:06:56,052] Trial 86 finished with value: 0.2681329711239129 and parameters: {'model_type': 'mlp', 'hidden_dims': '[256, 128]', 'dropout': 0.5465969973042712, 'batch_norm': False, 'lr': 9.713923299021668e-06, 'weight_decay': 8.890304803364099e-05, 'epochs': 330, 'loss': 'mae', 'optimizer': 'adam', 'graph_mode': 'off', 'use_snp_selection': False}. Best is trial 60 with value: 0.2761065402685473.
[I 2025-12-06 14:08:42,344] Trial 87 finished with value: 0.23563244027333036 and parameters: {'model_type': 'mlp', 'hidden_dims': '[512, 256]', 'dropout': 0.4648764475415929, 'batch_norm': True, 'lr': 1.2931809436181381e-05, 'weight_decay': 4.6316196663198633e-05, 'epochs': 350, 'loss': 'mae', 'optimizer': 'adam', 'graph_mode': 'off', 'use_snp_selection': False}. Best is trial 60 with value: 0.2761065402685473.
[I 2025-12-06 14:09:47,606] Trial 88 finished with value: 0.2792669062575092 and parameters: {'model_type': 'mlp', 'hidden_dims': '[128, 64]', 'dropout': 0.40162275223131183, 'batch_norm': False, 'lr': 2.1506438823875096e-05, 'weight_decay': 0.00013648421885564924, 'epochs': 339, 'loss': 'mae', 'optimizer': 'adam', 'graph_mode': 'off', 'use_snp_selection': True, 'num_snps': 48766}. Best is trial 88 with value: 0.2792669062575092.
[I 2025-12-06 14:10:53,427] Trial 89 finished with value: 0.2653064091055649 and parameters: {'model_type': 'mlp', 'hidden_dims': '[128, 64]', 'dropout': 0.5178501005217553, 'batch_norm': False, 'lr': 2.136773954871279e-05, 'weight_decay': 0.00028843616216498824, 'epochs': 343, 'loss': 'mae', 'optimizer': 'adam', 'graph_mode': 'off', 'use_snp_selection': True, 'num_snps': 49323}. Best is trial 88 with value: 0.2792669062575092.
[I 2025-12-06 14:11:41,147] Trial 90 finished with value: 0.24030223789138963 and parameters: {'model_type': 'mlp', 'hidden_dims': '[128, 64]', 'dropout': 0.3968535562832119, 'batch_norm': False, 'lr': 3.0514921801060402e-05, 'weight_decay': 0.00022385022978403579, 'epochs': 124, 'loss': 'mse', 'optimizer': 'adam', 'graph_mode': 'off', 'use_snp_selection': True, 'num_snps': 38357}. Best is trial 88 with value: 0.2792669062575092.
[I 2025-12-06 14:12:49,139] Trial 91 finished with value: 0.26956632029598615 and parameters: {'model_type': 'mlp', 'hidden_dims': '[128, 64]', 'dropout': 0.42144647818187314, 'batch_norm': False, 'lr': 1.5404963843238678e-05, 'weight_decay': 0.00016462832897631808, 'epochs': 337, 'loss': 'mae', 'optimizer': 'adam', 'graph_mode': 'off', 'use_snp_selection': True, 'num_snps': 53998}. Best is trial 88 with value: 0.2792669062575092.
[I 2025-12-06 14:13:46,215] Trial 92 finished with value: 0.25764866692250615 and parameters: {'model_type': 'mlp', 'hidden_dims': '[128, 64]', 'dropout': 0.37729730501936143, 'batch_norm': False, 'lr': 1.7638682007780104e-05, 'weight_decay': 0.0004059127991450432, 'epochs': 300, 'loss': 'mae', 'optimizer': 'adam', 'graph_mode': 'off', 'use_snp_selection': True, 'num_snps': 41433}. Best is trial 88 with value: 0.2792669062575092.
