[I 2025-12-05 14:59:20,027] Trial 37 finished with value: 0.011508623634410567 and parameters: {'model_type': 'mlp', 'hidden_dims': '[256, 128]', 'dropout': 0.22152163512379314, 'batch_norm': True, 'lr': 1.1152546142192734e-06, 'weight_decay': 0.00027176669497101704, 'epochs': 265, 'loss': 'mse', 'optimizer': 'adam', 'graph_mode': 'off', 'use_snp_selection': True, 'num_snps': 22282}. Best is trial 3 with value: 0.08939730523412698.
[I 2025-12-05 14:59:21,241] Trial 38 finished with value: 0.02886712081141135 and parameters: {'model_type': 'mlp', 'hidden_dims': '[256, 128, 64]', 'dropout': 0.3919955374080201, 'batch_norm': False, 'lr': 1.5988176238086923e-05, 'weight_decay': 0.00046644832351108945, 'epochs': 303, 'loss': 'mae', 'optimizer': 'adam', 'graph_mode': 'off', 'use_snp_selection': False}. Best is trial 3 with value: 0.08939730523412698.
[I 2025-12-05 14:59:22,572] Trial 39 finished with value: 0.03835591238045795 and parameters: {'model_type': 'mlp', 'hidden_dims': '[256, 128, 64]', 'dropout': 0.48504746281820577, 'batch_norm': True, 'lr': 0.00036125177884362624, 'weight_decay': 1.4787276849767253e-06, 'epochs': 344, 'loss': 'mae', 'optimizer': 'adam', 'graph_mode': 'off', 'use_snp_selection': False}. Best is trial 3 with value: 0.08939730523412698.
[I 2025-12-05 14:59:23,727] Trial 40 finished with value: 0.012760466569241236 and parameters: {'model_type': 'mlp', 'hidden_dims': '[256, 128]', 'dropout': 0.5735118369365442, 'batch_norm': False, 'lr': 4.4735676851271046e-05, 'weight_decay': 0.00019726252549585126, 'epochs': 272, 'loss': 'mse', 'optimizer': 'adam', 'graph_mode': 'off', 'use_snp_selection': False}. Best is trial 3 with value: 0.08939730523412698.
[I 2025-12-05 14:59:25,649] Trial 41 finished with value: 0.07220492759048107 and parameters: {'model_type': 'mlp', 'hidden_dims': '[512, 128]', 'dropout': 0.5369784458573483, 'batch_norm': False, 'lr': 2.526327967935003e-05, 'weight_decay': 8.558579819312653e-05, 'epochs': 332, 'loss': 'mae', 'optimizer': 'adam', 'graph_mode': 'off', 'use_snp_selection': False}. Best is trial 3 with value: 0.08939730523412698.
[I 2025-12-05 14:59:26,611] Trial 42 finished with value: 0.03470622343125284 and parameters: {'model_type': 'mlp', 'hidden_dims': '[128, 64]', 'dropout': 0.5319192227971721, 'batch_norm': False, 'lr': 6.791064196637747e-05, 'weight_decay': 6.808177592766855e-05, 'epochs': 331, 'loss': 'mae', 'optimizer': 'adam', 'graph_mode': 'off', 'use_snp_selection': False}. Best is trial 3 with value: 0.08939730523412698.
[I 2025-12-05 14:59:28,189] Trial 43 finished with value: 0.0391626133892873 and parameters: {'model_type': 'mlp', 'hidden_dims': '[512, 128]', 'dropout': 0.5690884718424506, 'batch_norm': False, 'lr': 9.926307991415651e-05, 'weight_decay': 9.935636210881485e-05, 'epochs': 240, 'loss': 'mae', 'optimizer': 'adam', 'graph_mode': 'off', 'use_snp_selection': False}. Best is trial 3 with value: 0.08939730523412698.
[I 2025-12-05 14:59:29,459] Trial 44 finished with value: 0.05941698039330905 and parameters: {'model_type': 'mlp', 'hidden_dims': '[256, 128, 64]', 'dropout': 0.44875590220011463, 'batch_norm': False, 'lr': 8.165006114558862e-06, 'weight_decay': 3.90705245854269e-05, 'epochs': 326, 'loss': 'mae', 'optimizer': 'adam', 'graph_mode': 'off', 'use_snp_selection': False}. Best is trial 3 with value: 0.08939730523412698.
[I 2025-12-05 14:59:31,310] Trial 45 finished with value: 0.04469652948336469 and parameters: {'model_type': 'mlp', 'hidden_dims': '[512, 256]', 'dropout': 0.5153276322185506, 'batch_norm': True, 'lr': 3.264568699366539e-05, 'weight_decay': 1.3835346520672773e-05, 'epochs': 310, 'loss': 'mae', 'optimizer': 'adam', 'graph_mode': 'off', 'use_snp_selection': False}. Best is trial 3 with value: 0.08939730523412698.
[I 2025-12-05 14:59:32,476] Trial 46 finished with value: 0.05539251655645668 and parameters: {'model_type': 'mlp', 'hidden_dims': '[256, 128]', 'dropout': 0.5983690140074627, 'batch_norm': False, 'lr': 1.1667116525040764e-05, 'weight_decay': 2.425073978424273e-05, 'epochs': 286, 'loss': 'mae', 'optimizer': 'adam', 'graph_mode': 'off', 'use_snp_selection': False}. Best is trial 3 with value: 0.08939730523412698.
[I 2025-12-05 14:59:34,427] Trial 47 finished with value: 0.030690316418223593 and parameters: {'model_type': 'mlp', 'hidden_dims': '[512, 128]', 'dropout': 0.5384374312179925, 'batch_norm': False, 'lr': 5.315371414240652e-05, 'weight_decay': 6.359895876866024e-06, 'epochs': 339, 'loss': 'mae', 'optimizer': 'adam', 'graph_mode': 'off', 'use_snp_selection': False}. Best is trial 3 with value: 0.08939730523412698.
[I 2025-12-05 14:59:35,544] Trial 48 finished with value: 0.03887188879225732 and parameters: {'model_type': 'mlp', 'hidden_dims': '[256, 128, 64]', 'dropout': 0.49778144548140707, 'batch_norm': False, 'lr': 1.9203701754313942e-05, 'weight_decay': 0.0001924205687625914, 'epochs': 250, 'loss': 'mse', 'optimizer': 'adam', 'graph_mode': 'off', 'use_snp_selection': False}. Best is trial 3 with value: 0.08939730523412698.
[I 2025-12-05 14:59:38,051] Trial 49 finished with value: 0.023511954965987774 and parameters: {'model_type': 'mlp', 'hidden_dims': '[512, 64]', 'dropout': 0.36638461651722043, 'batch_norm': False, 'lr': 0.00013281758022640268, 'weight_decay': 6.250451307174044e-05, 'epochs': 210, 'loss': 'mae', 'optimizer': 'adam', 'graph_mode': 'off', 'use_snp_selection': True, 'num_snps': 46888}. Best is trial 3 with value: 0.08939730523412698.
[I 2025-12-05 14:59:39,067] Trial 50 finished with value: 0.017318242278694964 and parameters: {'model_type': 'mlp', 'hidden_dims': '[128, 64]', 'dropout': 0.5747680956006801, 'batch_norm': True, 'lr': 6.614834208005791e-06, 'weight_decay': 0.00037986609608947446, 'epochs': 308, 'loss': 'mae', 'optimizer': 'adam', 'graph_mode': 'off', 'use_snp_selection': False}. Best is trial 3 with value: 0.08939730523412698.
[I 2025-12-05 14:59:40,143] Trial 51 finished with value: 0.03720586315549847 and parameters: {'model_type': 'mlp', 'hidden_dims': '[512, 128]', 'dropout': 0.5657805702363913, 'batch_norm': False, 'lr': 2.4210576798008733e-05, 'weight_decay': 0.00016945468817277683, 'epochs': 89, 'loss': 'mae', 'optimizer': 'adam', 'graph_mode': 'off', 'use_snp_selection': False}. Best is trial 3 with value: 0.08939730523412698.
[I 2025-12-05 14:59:41,298] Trial 52 finished with value: 0.011309391533809006 and parameters: {'model_type': 'mlp', 'hidden_dims': '[512, 128]', 'dropout': 0.5305658945195862, 'batch_norm': False, 'lr': 1.8099967895352705e-06, 'weight_decay': 0.00023485894977384037, 'epochs': 116, 'loss': 'mae', 'optimizer': 'adam', 'graph_mode': 'off', 'use_snp_selection': False}. Best is trial 3 with value: 0.08939730523412698.
[I 2025-12-05 14:59:42,507] Trial 53 finished with value: 0.07273440420014261 and parameters: {'model_type': 'mlp', 'hidden_dims': '[512, 128]', 'dropout': 0.579609630018258, 'batch_norm': False, 'lr': 1.4707219322114647e-05, 'weight_decay': 0.000702604676954342, 'epochs': 132, 'loss': 'mae', 'optimizer': 'adam', 'graph_mode': 'off', 'use_snp_selection': False}. Best is trial 3 with value: 0.08939730523412698.
[I 2025-12-05 14:59:43,851] Trial 54 finished with value: 0.02479477193990709 and parameters: {'model_type': 'mlp', 'hidden_dims': '[512, 128]', 'dropout': 0.4117156983738929, 'batch_norm': False, 'lr': 1.0180241099669549e-05, 'weight_decay': 0.0007158176807659024, 'epochs': 162, 'loss': 'mae', 'optimizer': 'adam', 'graph_mode': 'off', 'use_snp_selection': False}. Best is trial 3 with value: 0.08939730523412698.
[I 2025-12-05 14:59:45,011] Trial 55 finished with value: 0.04217788104521617 and parameters: {'model_type': 'mlp', 'hidden_dims': '[512, 64]', 'dropout': 0.5821509292670034, 'batch_norm': False, 'lr': 1.302404279821658e-05, 'weight_decay': 0.0007089568701094973, 'epochs': 106, 'loss': 'mae', 'optimizer': 'adam', 'graph_mode': 'off', 'use_snp_selection': False}. Best is trial 3 with value: 0.08939730523412698.
[I 2025-12-05 14:59:45,991] Trial 56 finished with value: 0.03806204446383832 and parameters: {'model_type': 'mlp', 'hidden_dims': '[512, 128]', 'dropout': 0.489335975798246, 'batch_norm': False, 'lr': 5.115671271334122e-06, 'weight_decay': 9.34600250616716e-05, 'epochs': 64, 'loss': 'mae', 'optimizer': 'adam', 'graph_mode': 'off', 'use_snp_selection': False}. Best is trial 3 with value: 0.08939730523412698.
[I 2025-12-05 14:59:47,951] Trial 57 finished with value: 0.029885820494841533 and parameters: {'model_type': 'mlp', 'hidden_dims': '[512, 256]', 'dropout': 0.5462579582879734, 'batch_norm': False, 'lr': 3.568613523954681e-06, 'weight_decay': 0.0003145139307555075, 'epochs': 350, 'loss': 'mae', 'optimizer': 'adam', 'graph_mode': 'off', 'use_snp_selection': False}. Best is trial 3 with value: 0.08939730523412698.
[I 2025-12-05 14:59:49,145] Trial 58 finished with value: 0.026018209874219503 and parameters: {'model_type': 'mlp', 'hidden_dims': '[256, 128]', 'dropout': 0.5078632198749963, 'batch_norm': False, 'lr': 2.723020802954249e-05, 'weight_decay': 0.00046392992836413624, 'epochs': 300, 'loss': 'mae', 'optimizer': 'adam', 'graph_mode': 'off', 'use_snp_selection': False}. Best is trial 3 with value: 0.08939730523412698.
[I 2025-12-05 14:59:50,999] Trial 59 finished with value: 0.04303042348174525 and parameters: {'model_type': 'mlp', 'hidden_dims': '[512, 64]', 'dropout': 0.46183403455338806, 'batch_norm': False, 'lr': 4.0568283185238614e-05, 'weight_decay': 1.6139406775110432e-07, 'epochs': 318, 'loss': 'mae', 'optimizer': 'adam', 'graph_mode': 'off', 'use_snp_selection': False}. Best is trial 3 with value: 0.08939730523412698.
[I 2025-12-05 14:59:52,398] Trial 60 finished with value: 0.051008839959656126 and parameters: {'model_type': 'mlp', 'hidden_dims': '[512, 128]', 'dropout': 0.5997922157574546, 'batch_norm': False, 'lr': 1.3653583160207804e-05, 'weight_decay': 1.3749341962151777e-05, 'epochs': 187, 'loss': 'mse', 'optimizer': 'adam', 'graph_mode': 'off', 'use_snp_selection': False}. Best is trial 3 with value: 0.08939730523412698.
[I 2025-12-05 14:59:53,605] Trial 61 finished with value: 0.034050640123240286 and parameters: {'model_type': 'mlp', 'hidden_dims': '[512, 128]', 'dropout': 0.5611751805326756, 'batch_norm': False, 'lr': 2.2872798301472094e-05, 'weight_decay': 0.00013887712740340286, 'epochs': 131, 'loss': 'mae', 'optimizer': 'adam', 'graph_mode': 'off', 'use_snp_selection': False}. Best is trial 3 with value: 0.08939730523412698.
[I 2025-12-05 14:59:54,827] Trial 62 finished with value: 0.021366987811087937 and parameters: {'model_type': 'mlp', 'hidden_dims': '[512, 128]', 'dropout': 0.543222300257753, 'batch_norm': False, 'lr': 8.069645498138561e-06, 'weight_decay': 0.00023714993113902022, 'epochs': 136, 'loss': 'mae', 'optimizer': 'adam', 'graph_mode': 'off', 'use_snp_selection': False}. Best is trial 3 with value: 0.08939730523412698.
[I 2025-12-05 14:59:56,144] Trial 63 finished with value: 0.04275752178279029 and parameters: {'model_type': 'mlp', 'hidden_dims': '[512, 128]', 'dropout': 0.5826827478523572, 'batch_norm': False, 'lr': 2.033226298804762e-05, 'weight_decay': 4.997762772556456e-05, 'epochs': 158, 'loss': 'mae', 'optimizer': 'adam', 'graph_mode': 'off', 'use_snp_selection': False}. Best is trial 3 with value: 0.08939730523412698.
[I 2025-12-05 14:59:57,215] Trial 64 finished with value: 0.034136774749086246 and parameters: {'model_type': 'mlp', 'hidden_dims': '[512, 128]', 'dropout': 0.5199683737214815, 'batch_norm': False, 'lr': 2.9409672342608484e-05, 'weight_decay': 0.0009845613684789057, 'epochs': 86, 'loss': 'mae', 'optimizer': 'adam', 'graph_mode': 'off', 'use_snp_selection': False}. Best is trial 3 with value: 0.08939730523412698.
[I 2025-12-05 14:59:58,513] Trial 65 finished with value: 0.05439499719843789 and parameters: {'model_type': 'mlp', 'hidden_dims': '[256, 128, 64]', 'dropout': 0.5578858051249009, 'batch_norm': False, 'lr': 5.893304391128311e-05, 'weight_decay': 4.5126290852146095e-06, 'epochs': 106, 'loss': 'mae', 'optimizer': 'adam', 'graph_mode': 'off', 'use_snp_selection': True, 'num_snps': 22828}. Best is trial 3 with value: 0.08939730523412698.
[I 2025-12-05 14:59:59,784] Trial 66 finished with value: 0.05454368838131515 and parameters: {'model_type': 'mlp', 'hidden_dims': '[512, 64]', 'dropout': 0.5807568106306848, 'batch_norm': False, 'lr': 1.9159021497251577e-05, 'weight_decay': 0.0001255411700573043, 'epochs': 150, 'loss': 'mae', 'optimizer': 'adam', 'graph_mode': 'off', 'use_snp_selection': False}. Best is trial 3 with value: 0.08939730523412698.
[I 2025-12-05 15:00:00,886] Trial 67 finished with value: 0.020602522967238312 and parameters: {'model_type': 'mlp', 'hidden_dims': '[256, 128]', 'dropout': 0.5405500189441114, 'batch_norm': False, 'lr': 0.0002023580609099144, 'weight_decay': 8.276965710050737e-05, 'epochs': 224, 'loss': 'mae', 'optimizer': 'adam', 'graph_mode': 'off', 'use_snp_selection': False}. Best is trial 3 with value: 0.08939730523412698.
[I 2025-12-05 15:00:02,074] Trial 68 finished with value: 0.08146113004081232 and parameters: {'model_type': 'mlp', 'hidden_dims': '[256, 128, 64]', 'dropout': 0.47587027484173083, 'batch_norm': False, 'lr': 7.432116984385524e-05, 'weight_decay': 0.000360029116039241, 'epochs': 288, 'loss': 'mae', 'optimizer': 'adam', 'graph_mode': 'off', 'use_snp_selection': False}. Best is trial 3 with value: 0.08939730523412698.
[I 2025-12-05 15:00:03,286] Trial 69 finished with value: 0.04003828071572183 and parameters: {'model_type': 'mlp', 'hidden_dims': '[256, 128, 64]', 'dropout': 0.4871589461709958, 'batch_norm': True, 'lr': 7.369561323475865e-05, 'weight_decay': 0.0007033298640352274, 'epochs': 287, 'loss': 'mae', 'optimizer': 'adam', 'graph_mode': 'off', 'use_snp_selection': False}. Best is trial 3 with value: 0.08939730523412698.
[I 2025-12-05 15:00:04,452] Trial 70 finished with value: 0.0440930573711115 and parameters: {'model_type': 'mlp', 'hidden_dims': '[256, 128, 64]', 'dropout': 0.2833082857186198, 'batch_norm': False, 'lr': 0.00011103977079898417, 'weight_decay': 0.00038586594660530233, 'epochs': 277, 'loss': 'mae', 'optimizer': 'adam', 'graph_mode': 'off', 'use_snp_selection': False}. Best is trial 3 with value: 0.08939730523412698.
[I 2025-12-05 15:00:05,703] Trial 71 finished with value: 0.03496122135880387 and parameters: {'model_type': 'mlp', 'hidden_dims': '[256, 128, 64]', 'dropout': 0.5161192681074608, 'batch_norm': False, 'lr': 3.7657991791426074e-05, 'weight_decay': 0.000144246577142816, 'epochs': 323, 'loss': 'mae', 'optimizer': 'adam', 'graph_mode': 'off', 'use_snp_selection': False}. Best is trial 3 with value: 0.08939730523412698.
[I 2025-12-05 15:00:06,990] Trial 72 finished with value: 0.028014277765541187 and parameters: {'model_type': 'mlp', 'hidden_dims': '[256, 128, 64]', 'dropout': 0.5558214734723734, 'batch_norm': False, 'lr': 5.163628005033897e-05, 'weight_decay': 0.0005345469794000473, 'epochs': 335, 'loss': 'mae', 'optimizer': 'adam', 'graph_mode': 'off', 'use_snp_selection': False}. Best is trial 3 with value: 0.08939730523412698.
[I 2025-12-05 15:00:07,948] Trial 73 finished with value: 0.06568762271994091 and parameters: {'model_type': 'mlp', 'hidden_dims': '[128, 64]', 'dropout': 0.5284505496130377, 'batch_norm': False, 'lr': 1.5426772219442285e-05, 'weight_decay': 0.0002528302845040689, 'epochs': 341, 'loss': 'mae', 'optimizer': 'adam', 'graph_mode': 'off', 'use_snp_selection': False}. Best is trial 3 with value: 0.08939730523412698.
[I 2025-12-05 15:00:08,907] Trial 74 finished with value: 0.05617557477750837 and parameters: {'model_type': 'mlp', 'hidden_dims': '[128, 64]', 'dropout': 0.4709992045194187, 'batch_norm': False, 'lr': 1.4740610037322936e-05, 'weight_decay': 0.0002725353699806306, 'epochs': 344, 'loss': 'mae', 'optimizer': 'adam', 'graph_mode': 'off', 'use_snp_selection': False}. Best is trial 3 with value: 0.08939730523412698.
[I 2025-12-05 15:00:09,849] Trial 75 finished with value: 0.027693790709660226 and parameters: {'model_type': 'mlp', 'hidden_dims': '[128, 64]', 'dropout': 0.5082029346487913, 'batch_norm': False, 'lr': 7.481295873848057e-05, 'weight_decay': 1.9497635574728614e-06, 'epochs': 295, 'loss': 'mae', 'optimizer': 'adam', 'graph_mode': 'off', 'use_snp_selection': False}. Best is trial 3 with value: 0.08939730523412698.
[I 2025-12-05 15:00:10,784] Trial 76 finished with value: 0.041987112644321235 and parameters: {'model_type': 'mlp', 'hidden_dims': '[128, 64]', 'dropout': 0.5284393051335992, 'batch_norm': False, 'lr': 0.0001346850197040525, 'weight_decay': 8.554742422123942e-06, 'epochs': 311, 'loss': 'mae', 'optimizer': 'adam', 'graph_mode': 'off', 'use_snp_selection': True, 'num_snps': 3325}. Best is trial 3 with value: 0.08939730523412698.
[I 2025-12-05 15:00:11,766] Trial 77 finished with value: 0.031911901001248064 and parameters: {'model_type': 'mlp', 'hidden_dims': '[128, 64]', 'dropout': 0.49666531404392295, 'batch_norm': False, 'lr': 1.0159130959073434e-05, 'weight_decay': 0.00038596926502683566, 'epochs': 328, 'loss': 'mae', 'optimizer': 'adam', 'graph_mode': 'off', 'use_snp_selection': False}. Best is trial 3 with value: 0.08939730523412698.
[I 2025-12-05 15:00:13,052] Trial 78 finished with value: 0.011143293331855 and parameters: {'model_type': 'mlp', 'hidden_dims': '[256, 128, 64]', 'dropout': 0.4530572816787808, 'batch_norm': False, 'lr': 0.0002845005892586477, 'weight_decay': 0.00021494162744128384, 'epochs': 340, 'loss': 'mse', 'optimizer': 'adam', 'graph_mode': 'off', 'use_snp_selection': False}. Best is trial 3 with value: 0.08939730523412698.
[I 2025-12-05 15:00:14,278] Trial 79 finished with value: 0.0205099281236926 and parameters: {'model_type': 'mlp', 'hidden_dims': '[256, 128]', 'dropout': 0.11907044296807826, 'batch_norm': False, 'lr': 6.052749357383652e-06, 'weight_decay': 2.8524199473358468e-05, 'epochs': 317, 'loss': 'mae', 'optimizer': 'adam', 'graph_mode': 'off', 'use_snp_selection': False}. Best is trial 3 with value: 0.08939730523412698.
[I 2025-12-05 15:00:16,112] Trial 80 finished with value: 0.032385481076839924 and parameters: {'model_type': 'mlp', 'hidden_dims': '[512, 256]', 'dropout': 0.47650177582502534, 'batch_norm': True, 'lr': 1.7911248263830956e-05, 'weight_decay': 0.0006308644688324024, 'epochs': 307, 'loss': 'mae', 'optimizer': 'adam', 'graph_mode': 'off', 'use_snp_selection': False}. Best is trial 3 with value: 0.08939730523412698.
[I 2025-12-05 15:00:17,317] Trial 81 finished with value: 0.04223547518244175 and parameters: {'model_type': 'mlp', 'hidden_dims': '[512, 128]', 'dropout': 0.5507590194910935, 'batch_norm': False, 'lr': 2.5860580483225178e-05, 'weight_decay': 0.00017686017006255503, 'epochs': 120, 'loss': 'mae', 'optimizer': 'adam', 'graph_mode': 'off', 'use_snp_selection': False}. Best is trial 3 with value: 0.08939730523412698.
[I 2025-12-05 15:00:18,588] Trial 82 finished with value: 0.06408114580547891 and parameters: {'model_type': 'mlp', 'hidden_dims': '[256, 128, 64]', 'dropout': 0.5704738087144129, 'batch_norm': False, 'lr': 3.3853322862523096e-05, 'weight_decay': 0.0003358914440918198, 'epochs': 333, 'loss': 'mae', 'optimizer': 'adam', 'graph_mode': 'off', 'use_snp_selection': False}. Best is trial 3 with value: 0.08939730523412698.
[I 2025-12-05 15:00:19,891] Trial 83 finished with value: 0.04527122798023672 and parameters: {'model_type': 'mlp', 'hidden_dims': '[256, 128, 64]', 'dropout': 0.5877262088429499, 'batch_norm': False, 'lr': 2.9900498932190913e-05, 'weight_decay': 0.00037500352877734965, 'epochs': 350, 'loss': 'mae', 'optimizer': 'adam', 'graph_mode': 'off', 'use_snp_selection': False}. Best is trial 3 with value: 0.08939730523412698.
[I 2025-12-05 15:00:21,161] Trial 84 finished with value: 0.02947566640088955 and parameters: {'model_type': 'mlp', 'hidden_dims': '[256, 128, 64]', 'dropout': 0.5687039198222907, 'batch_norm': False, 'lr': 4.8093660468377304e-05, 'weight_decay': 0.00027839028039107895, 'epochs': 333, 'loss': 'mae', 'optimizer': 'adam', 'graph_mode': 'off', 'use_snp_selection': False}. Best is trial 3 with value: 0.08939730523412698.
[I 2025-12-05 15:00:22,481] Trial 85 finished with value: 0.019440756194041627 and parameters: {'model_type': 'mlp', 'hidden_dims': '[256, 128, 64]', 'dropout': 0.5284051879823762, 'batch_norm': False, 'lr': 3.63431855146352e-05, 'weight_decay': 5.229553304402372e-06, 'epochs': 325, 'loss': 'mae', 'optimizer': 'adam', 'graph_mode': 'off', 'use_snp_selection': False}. Best is trial 3 with value: 0.08939730523412698.
[I 2025-12-05 15:00:23,687] Trial 86 finished with value: 0.059932182326932044 and parameters: {'model_type': 'mlp', 'hidden_dims': '[256, 128, 64]', 'dropout': 0.5401596162874692, 'batch_norm': False, 'lr': 8.46989720310518e-06, 'weight_decay': 0.0005956249203067841, 'epochs': 294, 'loss': 'mae', 'optimizer': 'adam', 'graph_mode': 'off', 'use_snp_selection': False}. Best is trial 3 with value: 0.08939730523412698.
[I 2025-12-05 15:00:25,524] Trial 87 finished with value: 0.06168931523063873 and parameters: {'model_type': 'mlp', 'hidden_dims': '[512, 64]', 'dropout': 0.1868439640232244, 'batch_norm': False, 'lr': 4.307253911536457e-06, 'weight_decay': 0.00011235147236846897, 'epochs': 315, 'loss': 'mae', 'optimizer': 'adam', 'graph_mode': 'off', 'use_snp_selection': False}. Best is trial 3 with value: 0.08939730523412698.
[I 2025-12-05 15:00:27,987] Trial 88 finished with value: 0.04334990499493333 and parameters: {'model_type': 'mlp', 'hidden_dims': '[256, 128, 64]', 'dropout': 0.5709082212344094, 'batch_norm': False, 'lr': 8.53210250855994e-05, 'weight_decay': 0.0008574040395613817, 'epochs': 339, 'loss': 'mae', 'optimizer': 'adam', 'graph_mode': 'off', 'use_snp_selection': True, 'num_snps': 48766}. Best is trial 3 with value: 0.08939730523412698.
