[I 2025-12-06 00:57:50,008] Trial 23 finished with value: 0.2414098104044656 and parameters: {'model_type': 'mlp', 'hidden_dims': '[512, 64]', 'dropout': 0.45237186402674573, 'batch_norm': False, 'lr': 3.035449352914064e-06, 'weight_decay': 9.95324655336522e-06, 'epochs': 346, 'loss': 'mae', 'optimizer': 'adam', 'graph_mode': 'off', 'use_snp_selection': False}. Best is trial 11 with value: 0.24482938842625424.
[I 2025-12-06 00:58:49,925] Trial 24 finished with value: 0.23068824039240848 and parameters: {'model_type': 'mlp', 'hidden_dims': '[512, 64]', 'dropout': 0.5459552055641331, 'batch_norm': False, 'lr': 9.676314560243454e-06, 'weight_decay': 1.794022213356721e-06, 'epochs': 257, 'loss': 'mae', 'optimizer': 'adam', 'graph_mode': 'off', 'use_snp_selection': False}. Best is trial 11 with value: 0.24482938842625424.
[I 2025-12-06 00:59:27,688] Trial 25 finished with value: 0.23597639223077022 and parameters: {'model_type': 'mlp', 'hidden_dims': '[512, 256]', 'dropout': 0.47368734678696506, 'batch_norm': False, 'lr': 0.00013228256017674262, 'weight_decay': 2.986269599076725e-05, 'epochs': 153, 'loss': 'mae', 'optimizer': 'adam', 'graph_mode': 'off', 'use_snp_selection': False}. Best is trial 11 with value: 0.24482938842625424.
[I 2025-12-06 00:59:52,659] Trial 26 finished with value: 0.1784810733268191 and parameters: {'model_type': 'mlp', 'hidden_dims': '[256, 128]', 'dropout': 0.5539864929034677, 'batch_norm': False, 'lr': 2.0084781789717195e-05, 'weight_decay': 6.14145850038929e-06, 'epochs': 215, 'loss': 'mae', 'optimizer': 'adam', 'graph_mode': 'off', 'use_snp_selection': True, 'num_snps': 3842}. Best is trial 11 with value: 0.24482938842625424.
[I 2025-12-06 01:00:12,629] Trial 27 finished with value: 0.23759779707657577 and parameters: {'model_type': 'mlp', 'hidden_dims': '[128, 64]', 'dropout': 0.502180441619482, 'batch_norm': False, 'lr': 5.5126535146441655e-06, 'weight_decay': 1.307253616967539e-05, 'epochs': 303, 'loss': 'mse', 'optimizer': 'adam', 'graph_mode': 'off', 'use_snp_selection': False}. Best is trial 11 with value: 0.24482938842625424.
[I 2025-12-06 01:00:25,726] Trial 28 finished with value: 0.22246918057160822 and parameters: {'model_type': 'mlp', 'hidden_dims': '[256, 128, 64]', 'dropout': 0.5680596884596518, 'batch_norm': False, 'lr': 3.288663963712051e-05, 'weight_decay': 2.8047775425278707e-07, 'epochs': 71, 'loss': 'mae', 'optimizer': 'adam', 'graph_mode': 'off', 'use_snp_selection': False}. Best is trial 11 with value: 0.24482938842625424.
[I 2025-12-06 01:00:56,199] Trial 29 finished with value: 0.21344172115750215 and parameters: {'model_type': 'mlp', 'hidden_dims': '[128, 64]', 'dropout': 0.24403726671739606, 'batch_norm': False, 'lr': 2.320440320155318e-06, 'weight_decay': 0.00012363202694194868, 'epochs': 179, 'loss': 'mae', 'optimizer': 'adam', 'graph_mode': 'off', 'use_snp_selection': True, 'num_snps': 19468}. Best is trial 11 with value: 0.24482938842625424.
[I 2025-12-06 01:01:56,910] Trial 30 finished with value: 0.2234754001375899 and parameters: {'model_type': 'mlp', 'hidden_dims': '[512, 64]', 'dropout': 0.5157762281091106, 'batch_norm': False, 'lr': 1.3174628844056259e-05, 'weight_decay': 2.077332952911847e-06, 'epochs': 263, 'loss': 'mae', 'optimizer': 'adam', 'graph_mode': 'off', 'use_snp_selection': False}. Best is trial 11 with value: 0.24482938842625424.
[I 2025-12-06 01:03:16,700] Trial 31 finished with value: 0.2426579009230113 and parameters: {'model_type': 'mlp', 'hidden_dims': '[512, 64]', 'dropout': 0.42973809195123175, 'batch_norm': False, 'lr': 2.5291269565673562e-06, 'weight_decay': 8.974280790259746e-06, 'epochs': 350, 'loss': 'mae', 'optimizer': 'adam', 'graph_mode': 'off', 'use_snp_selection': False}. Best is trial 11 with value: 0.24482938842625424.
[I 2025-12-06 01:04:32,453] Trial 32 finished with value: 0.21388479339629382 and parameters: {'model_type': 'mlp', 'hidden_dims': '[512, 64]', 'dropout': 0.4432312285347767, 'batch_norm': False, 'lr': 1.0066498588760712e-06, 'weight_decay': 4.413851575565222e-05, 'epochs': 331, 'loss': 'mae', 'optimizer': 'adam', 'graph_mode': 'off', 'use_snp_selection': False}. Best is trial 11 with value: 0.24482938842625424.
[I 2025-12-06 01:05:51,780] Trial 33 finished with value: 0.2274407163246655 and parameters: {'model_type': 'mlp', 'hidden_dims': '[512, 64]', 'dropout': 0.3613899791583047, 'batch_norm': False, 'lr': 2.2857566187557865e-06, 'weight_decay': 1.6510041344202767e-05, 'epochs': 348, 'loss': 'mae', 'optimizer': 'adam', 'graph_mode': 'off', 'use_snp_selection': False}. Best is trial 11 with value: 0.24482938842625424.
[I 2025-12-06 01:07:06,347] Trial 34 finished with value: 0.22359598539663797 and parameters: {'model_type': 'mlp', 'hidden_dims': '[512, 64]', 'dropout': 0.4198516292106909, 'batch_norm': False, 'lr': 5.064439303172819e-06, 'weight_decay': 4.571259593489247e-06, 'epochs': 326, 'loss': 'mae', 'optimizer': 'adam', 'graph_mode': 'off', 'use_snp_selection': False}. Best is trial 11 with value: 0.24482938842625424.
[I 2025-12-06 01:07:44,408] Trial 35 finished with value: 0.1988467777718005 and parameters: {'model_type': 'mlp', 'hidden_dims': '[256, 128]', 'dropout': 0.4615135540491399, 'batch_norm': True, 'lr': 8.539864490463013e-06, 'weight_decay': 1.0095452455278093e-06, 'epochs': 296, 'loss': 'mae', 'optimizer': 'adam', 'graph_mode': 'off', 'use_snp_selection': False}. Best is trial 11 with value: 0.24482938842625424.
[I 2025-12-06 01:08:45,440] Trial 36 finished with value: 0.2393234019611957 and parameters: {'model_type': 'mlp', 'hidden_dims': '[256, 128, 64]', 'dropout': 0.4221717770058167, 'batch_norm': False, 'lr': 4.5792092226547284e-06, 'weight_decay': 8.210456308191642e-06, 'epochs': 241, 'loss': 'mse', 'optimizer': 'adam', 'graph_mode': 'off', 'use_snp_selection': True, 'num_snps': 58661}. Best is trial 11 with value: 0.24482938842625424.
[I 2025-12-06 01:09:49,232] Trial 37 finished with value: 0.2332618838584648 and parameters: {'model_type': 'mlp', 'hidden_dims': '[512, 64]', 'dropout': 0.5700455878712253, 'batch_norm': False, 'lr': 3.0053281481134447e-06, 'weight_decay': 0.00013181929764121206, 'epochs': 276, 'loss': 'mae', 'optimizer': 'adam', 'graph_mode': 'off', 'use_snp_selection': False}. Best is trial 11 with value: 0.24482938842625424.
[I 2025-12-06 01:10:37,556] Trial 38 finished with value: 0.22664879253746695 and parameters: {'model_type': 'mlp', 'hidden_dims': '[512, 128]', 'dropout': 0.5242256362895499, 'batch_norm': True, 'lr': 3.8546714020329285e-05, 'weight_decay': 2.2780046519393483e-05, 'epochs': 317, 'loss': 'mse', 'optimizer': 'adam', 'graph_mode': 'off', 'use_snp_selection': True, 'num_snps': 19911}. Best is trial 11 with value: 0.24482938842625424.
[I 2025-12-06 01:11:20,895] Trial 39 finished with value: 0.2337887725553896 and parameters: {'model_type': 'mlp', 'hidden_dims': '[512, 64]', 'dropout': 0.3974561059399841, 'batch_norm': False, 'lr': 1.4653278160927534e-06, 'weight_decay': 0.000494866061743946, 'epochs': 177, 'loss': 'mae', 'optimizer': 'adam', 'graph_mode': 'off', 'use_snp_selection': False}. Best is trial 11 with value: 0.24482938842625424.
[I 2025-12-06 01:11:51,777] Trial 40 finished with value: 0.23214875399751872 and parameters: {'model_type': 'mlp', 'hidden_dims': '[512, 256]', 'dropout': 0.5712457602907212, 'batch_norm': True, 'lr': 0.00010299837783030175, 'weight_decay': 3.0729960178000403e-06, 'epochs': 115, 'loss': 'mae', 'optimizer': 'adam', 'graph_mode': 'off', 'use_snp_selection': False}. Best is trial 11 with value: 0.24482938842625424.
[I 2025-12-06 01:13:10,994] Trial 41 finished with value: 0.2286631643660145 and parameters: {'model_type': 'mlp', 'hidden_dims': '[512, 64]', 'dropout': 0.4467502567582974, 'batch_norm': False, 'lr': 2.753406866249937e-06, 'weight_decay': 1.1092937818150653e-05, 'epochs': 347, 'loss': 'mae', 'optimizer': 'adam', 'graph_mode': 'off', 'use_snp_selection': False}. Best is trial 11 with value: 0.24482938842625424.
[I 2025-12-06 01:14:27,870] Trial 42 finished with value: 0.24574922482253436 and parameters: {'model_type': 'mlp', 'hidden_dims': '[512, 64]', 'dropout': 0.4519626899481449, 'batch_norm': False, 'lr': 3.633634759538832e-06, 'weight_decay': 1.3174810033300462e-05, 'epochs': 336, 'loss': 'mae', 'optimizer': 'adam', 'graph_mode': 'off', 'use_snp_selection': False}. Best is trial 42 with value: 0.24574922482253436.
[I 2025-12-06 01:15:39,727] Trial 43 finished with value: 0.2366505462087874 and parameters: {'model_type': 'mlp', 'hidden_dims': '[512, 64]', 'dropout': 0.36542159824229553, 'batch_norm': False, 'lr': 7.873222776752499e-06, 'weight_decay': 5.186059296445691e-05, 'epochs': 313, 'loss': 'mae', 'optimizer': 'adam', 'graph_mode': 'off', 'use_snp_selection': False}. Best is trial 42 with value: 0.24574922482253436.
[I 2025-12-06 01:16:56,097] Trial 44 finished with value: 0.24707068504388907 and parameters: {'model_type': 'mlp', 'hidden_dims': '[512, 64]', 'dropout': 0.47856736742266237, 'batch_norm': False, 'lr': 3.929066837847967e-06, 'weight_decay': 1.796885273726542e-05, 'epochs': 335, 'loss': 'mae', 'optimizer': 'adam', 'graph_mode': 'off', 'use_snp_selection': False}. Best is trial 44 with value: 0.24707068504388907.
[I 2025-12-06 01:18:11,014] Trial 45 finished with value: 0.21609057229556988 and parameters: {'model_type': 'mlp', 'hidden_dims': '[512, 64]', 'dropout': 0.4648356361619548, 'batch_norm': False, 'lr': 1.9650760324370147e-06, 'weight_decay': 1.8965694309403308e-05, 'epochs': 328, 'loss': 'mse', 'optimizer': 'adam', 'graph_mode': 'off', 'use_snp_selection': False}. Best is trial 44 with value: 0.24707068504388907.
[I 2025-12-06 01:18:53,512] Trial 46 finished with value: 0.18515046213380928 and parameters: {'model_type': 'mlp', 'hidden_dims': '[256, 128]', 'dropout': 0.5983777420059128, 'batch_norm': True, 'lr': 3.8844507079549854e-06, 'weight_decay': 6.351700124187818e-06, 'epochs': 337, 'loss': 'mae', 'optimizer': 'adam', 'graph_mode': 'off', 'use_snp_selection': False}. Best is trial 44 with value: 0.24707068504388907.
[I 2025-12-06 01:20:03,465] Trial 47 finished with value: 0.2285534843052237 and parameters: {'model_type': 'mlp', 'hidden_dims': '[512, 64]', 'dropout': 0.4052195276018318, 'batch_norm': False, 'lr': 1.036185214006083e-06, 'weight_decay': 1.49093969037659e-05, 'epochs': 304, 'loss': 'mae', 'optimizer': 'adam', 'graph_mode': 'off', 'use_snp_selection': False}. Best is trial 44 with value: 0.24707068504388907.
[I 2025-12-06 01:21:09,535] Trial 48 finished with value: 0.24007732642207064 and parameters: {'model_type': 'mlp', 'hidden_dims': '[512, 128]', 'dropout': 0.4806073050401796, 'batch_norm': False, 'lr': 5.60792411804664e-06, 'weight_decay': 2.5843549726285043e-06, 'epochs': 285, 'loss': 'mae', 'optimizer': 'adam', 'graph_mode': 'off', 'use_snp_selection': False}. Best is trial 44 with value: 0.24707068504388907.
[I 2025-12-06 01:21:56,231] Trial 49 finished with value: 0.20338205005462923 and parameters: {'model_type': 'mlp', 'hidden_dims': '[128, 64]', 'dropout': 0.29909146648196316, 'batch_norm': False, 'lr': 1.0664686809081046e-05, 'weight_decay': 1.2081564945711089e-06, 'epochs': 321, 'loss': 'mse', 'optimizer': 'adam', 'graph_mode': 'off', 'use_snp_selection': True, 'num_snps': 46888}. Best is trial 44 with value: 0.24707068504388907.
[I 2025-12-06 01:22:30,021] Trial 50 finished with value: 0.19790318548180044 and parameters: {'model_type': 'mlp', 'hidden_dims': '[512, 64]', 'dropout': 0.5208023616414903, 'batch_norm': False, 'lr': 1.814698396789914e-06, 'weight_decay': 4.038017573787121e-06, 'epochs': 132, 'loss': 'mae', 'optimizer': 'adam', 'graph_mode': 'off', 'use_snp_selection': False}. Best is trial 44 with value: 0.24707068504388907.
[I 2025-12-06 01:23:46,032] Trial 51 finished with value: 0.2248657960155978 and parameters: {'model_type': 'mlp', 'hidden_dims': '[512, 64]', 'dropout': 0.4986625516205218, 'batch_norm': False, 'lr': 1.5561545353100236e-05, 'weight_decay': 3.7838135373485445e-05, 'epochs': 336, 'loss': 'mae', 'optimizer': 'adam', 'graph_mode': 'off', 'use_snp_selection': False}. Best is trial 44 with value: 0.24707068504388907.
[I 2025-12-06 01:24:49,073] Trial 52 finished with value: 0.22795804695872737 and parameters: {'model_type': 'mlp', 'hidden_dims': '[512, 64]', 'dropout': 0.4305697996769001, 'batch_norm': False, 'lr': 7.1515795143562064e-06, 'weight_decay': 9.222985866574126e-06, 'epochs': 270, 'loss': 'mae', 'optimizer': 'adam', 'graph_mode': 'off', 'use_snp_selection': False}. Best is trial 44 with value: 0.24707068504388907.
[I 2025-12-06 01:25:46,341] Trial 53 finished with value: 0.24038366914093792 and parameters: {'model_type': 'mlp', 'hidden_dims': '[512, 64]', 'dropout': 0.512565880119159, 'batch_norm': False, 'lr': 2.5439304421706706e-05, 'weight_decay': 2.2399481570475202e-05, 'epochs': 247, 'loss': 'mae', 'optimizer': 'adam', 'graph_mode': 'off', 'use_snp_selection': False}. Best is trial 44 with value: 0.24707068504388907.
[I 2025-12-06 01:26:56,331] Trial 54 finished with value: 0.23747944530128934 and parameters: {'model_type': 'mlp', 'hidden_dims': '[512, 64]', 'dropout': 0.3801567900058699, 'batch_norm': False, 'lr': 1.0934196227630076e-05, 'weight_decay': 6.707527488390919e-05, 'epochs': 305, 'loss': 'mae', 'optimizer': 'adam', 'graph_mode': 'off', 'use_snp_selection': False}. Best is trial 44 with value: 0.24707068504388907.
[I 2025-12-06 01:28:03,180] Trial 55 finished with value: 0.23538772083922957 and parameters: {'model_type': 'mlp', 'hidden_dims': '[512, 64]', 'dropout': 0.4794245855248042, 'batch_norm': False, 'lr': 3.6818559416799028e-06, 'weight_decay': 1.2788415000617994e-05, 'epochs': 289, 'loss': 'mae', 'optimizer': 'adam', 'graph_mode': 'off', 'use_snp_selection': False}. Best is trial 44 with value: 0.24707068504388907.
[I 2025-12-06 01:28:45,343] Trial 56 finished with value: 0.24253295717036144 and parameters: {'model_type': 'mlp', 'hidden_dims': '[256, 128, 64]', 'dropout': 0.5615917849015515, 'batch_norm': False, 'lr': 6.600505635398701e-06, 'weight_decay': 9.45645940784095e-05, 'epochs': 337, 'loss': 'mae', 'optimizer': 'adam', 'graph_mode': 'off', 'use_snp_selection': False}. Best is trial 44 with value: 0.24707068504388907.
[I 2025-12-06 01:29:29,649] Trial 57 finished with value: 0.2256558511039682 and parameters: {'model_type': 'mlp', 'hidden_dims': '[256, 128, 64]', 'dropout': 0.5690449857816948, 'batch_norm': True, 'lr': 6.915854928515102e-06, 'weight_decay': 0.0002869380351275004, 'epochs': 350, 'loss': 'mae', 'optimizer': 'adam', 'graph_mode': 'off', 'use_snp_selection': False}. Best is trial 44 with value: 0.24707068504388907.
[I 2025-12-06 01:30:11,590] Trial 58 finished with value: 0.22599469699029345 and parameters: {'model_type': 'mlp', 'hidden_dims': '[256, 128, 64]', 'dropout': 0.5815465263358438, 'batch_norm': False, 'lr': 4.497828322998233e-06, 'weight_decay': 9.26461029384794e-05, 'epochs': 335, 'loss': 'mae', 'optimizer': 'adam', 'graph_mode': 'off', 'use_snp_selection': False}. Best is trial 44 with value: 0.24707068504388907.
[I 2025-12-06 01:30:49,859] Trial 59 finished with value: 0.1665966414679338 and parameters: {'model_type': 'mlp', 'hidden_dims': '[256, 128, 64]', 'dropout': 0.5303036008253911, 'batch_norm': False, 'lr': 0.0008124203504309952, 'weight_decay': 5.705643366512856e-06, 'epochs': 308, 'loss': 'mae', 'optimizer': 'adam', 'graph_mode': 'off', 'use_snp_selection': False}. Best is trial 44 with value: 0.24707068504388907.
[I 2025-12-06 01:31:30,264] Trial 60 finished with value: 0.24346866804335443 and parameters: {'model_type': 'mlp', 'hidden_dims': '[256, 128, 64]', 'dropout': 0.5518726307609687, 'batch_norm': False, 'lr': 6.2566519238829725e-06, 'weight_decay': 3.5254448149096993e-06, 'epochs': 320, 'loss': 'mae', 'optimizer': 'adam', 'graph_mode': 'off', 'use_snp_selection': False}. Best is trial 44 with value: 0.24707068504388907.
[I 2025-12-06 01:32:12,754] Trial 61 finished with value: 0.24379859984222887 and parameters: {'model_type': 'mlp', 'hidden_dims': '[256, 128, 64]', 'dropout': 0.5531142235717484, 'batch_norm': False, 'lr': 6.243752955638517e-06, 'weight_decay': 0.00019556695411297335, 'epochs': 339, 'loss': 'mae', 'optimizer': 'adam', 'graph_mode': 'off', 'use_snp_selection': False}. Best is trial 44 with value: 0.24707068504388907.
[I 2025-12-06 01:32:53,138] Trial 62 finished with value: 0.22928163768524584 and parameters: {'model_type': 'mlp', 'hidden_dims': '[256, 128, 64]', 'dropout': 0.584298550517966, 'batch_norm': False, 'lr': 3.0836797398384746e-06, 'weight_decay': 0.0001954460261883652, 'epochs': 320, 'loss': 'mae', 'optimizer': 'adam', 'graph_mode': 'off', 'use_snp_selection': False}. Best is trial 44 with value: 0.24707068504388907.
[I 2025-12-06 01:33:05,650] Trial 63 finished with value: 0.16899828113392962 and parameters: {'model_type': 'mlp', 'hidden_dims': '[256, 128, 64]', 'dropout': 0.5428886574105424, 'batch_norm': False, 'lr': 5.832492175316935e-06, 'weight_decay': 1.4434647301966444e-06, 'epochs': 66, 'loss': 'mae', 'optimizer': 'adam', 'graph_mode': 'off', 'use_snp_selection': False}. Best is trial 44 with value: 0.24707068504388907.
[I 2025-12-06 01:34:14,282] Trial 64 finished with value: 0.22919553500700168 and parameters: {'model_type': 'mlp', 'hidden_dims': '[512, 256]', 'dropout': 0.5497187500122261, 'batch_norm': False, 'lr': 2.3485038054786733e-06, 'weight_decay': 0.0009503374997855269, 'epochs': 297, 'loss': 'mae', 'optimizer': 'adam', 'graph_mode': 'off', 'use_snp_selection': False}. Best is trial 44 with value: 0.24707068504388907.
[I 2025-12-06 01:34:56,952] Trial 65 finished with value: 0.2295315151275626 and parameters: {'model_type': 'mlp', 'hidden_dims': '[256, 128, 64]', 'dropout': 0.5978662808303754, 'batch_norm': False, 'lr': 4.033255679773185e-06, 'weight_decay': 0.0005592507312010263, 'epochs': 341, 'loss': 'mae', 'optimizer': 'adam', 'graph_mode': 'off', 'use_snp_selection': False}. Best is trial 44 with value: 0.24707068504388907.
[I 2025-12-06 01:35:37,360] Trial 66 finished with value: 0.20852891678886593 and parameters: {'model_type': 'mlp', 'hidden_dims': '[256, 128, 64]', 'dropout': 0.49500568959772184, 'batch_norm': False, 'lr': 1.674985234439908e-05, 'weight_decay': 2.2271270287681242e-06, 'epochs': 316, 'loss': 'mae', 'optimizer': 'adam', 'graph_mode': 'off', 'use_snp_selection': True, 'num_snps': 22881}. Best is trial 44 with value: 0.24707068504388907.
[I 2025-12-06 01:36:17,960] Trial 67 finished with value: 0.22638608570688995 and parameters: {'model_type': 'mlp', 'hidden_dims': '[256, 128]', 'dropout': 0.4585915235963736, 'batch_norm': False, 'lr': 9.333383877100682e-06, 'weight_decay': 7.124651756747424e-06, 'epochs': 326, 'loss': 'mae', 'optimizer': 'adam', 'graph_mode': 'off', 'use_snp_selection': False}. Best is trial 44 with value: 0.24707068504388907.
[I 2025-12-06 01:36:58,343] Trial 68 finished with value: 0.21871055130895814 and parameters: {'model_type': 'mlp', 'hidden_dims': '[512, 128]', 'dropout': 0.5297900142307244, 'batch_norm': False, 'lr': 1.7674594578510909e-06, 'weight_decay': 3.8402327852023535e-06, 'epochs': 163, 'loss': 'mse', 'optimizer': 'adam', 'graph_mode': 'off', 'use_snp_selection': False}. Best is trial 44 with value: 0.24707068504388907.
[I 2025-12-06 01:37:12,467] Trial 69 finished with value: 0.23586737777446126 and parameters: {'model_type': 'mlp', 'hidden_dims': '[128, 64]', 'dropout': 0.5546992606771501, 'batch_norm': False, 'lr': 1.1010294286745995e-05, 'weight_decay': 3.03411708708235e-06, 'epochs': 189, 'loss': 'mae', 'optimizer': 'adam', 'graph_mode': 'off', 'use_snp_selection': False}. Best is trial 44 with value: 0.24707068504388907.
[I 2025-12-06 01:38:27,515] Trial 70 finished with value: 0.2322874300872956 and parameters: {'model_type': 'mlp', 'hidden_dims': '[512, 64]', 'dropout': 0.43472242608102424, 'batch_norm': False, 'lr': 1.2434071045795473e-06, 'weight_decay': 2.9384153184237225e-05, 'epochs': 328, 'loss': 'mae', 'optimizer': 'adam', 'graph_mode': 'off', 'use_snp_selection': False}. Best is trial 44 with value: 0.24707068504388907.
[I 2025-12-06 01:39:10,297] Trial 71 finished with value: 0.2411779025657995 and parameters: {'model_type': 'mlp', 'hidden_dims': '[256, 128, 64]', 'dropout': 0.5607220828146378, 'batch_norm': False, 'lr': 6.800884093603529e-06, 'weight_decay': 0.00023047107500102093, 'epochs': 343, 'loss': 'mae', 'optimizer': 'adam', 'graph_mode': 'off', 'use_snp_selection': False}. Best is trial 44 with value: 0.24707068504388907.
[I 2025-12-06 01:39:52,384] Trial 72 finished with value: 0.22894930824707194 and parameters: {'model_type': 'mlp', 'hidden_dims': '[256, 128, 64]', 'dropout': 0.5144068243253362, 'batch_norm': False, 'lr': 3.2172075567230245e-06, 'weight_decay': 4.9111373448073344e-06, 'epochs': 336, 'loss': 'mae', 'optimizer': 'adam', 'graph_mode': 'off', 'use_snp_selection': False}. Best is trial 44 with value: 0.24707068504388907.
[I 2025-12-06 01:40:35,746] Trial 73 finished with value: 0.24108985717733833 and parameters: {'model_type': 'mlp', 'hidden_dims': '[256, 128, 64]', 'dropout': 0.5764932829254851, 'batch_norm': False, 'lr': 6.077118163935592e-06, 'weight_decay': 0.0004648407337526762, 'epochs': 349, 'loss': 'mae', 'optimizer': 'adam', 'graph_mode': 'off', 'use_snp_selection': False}. Best is trial 44 with value: 0.24707068504388907.
[I 2025-12-06 01:41:15,106] Trial 74 finished with value: 0.2394978791069069 and parameters: {'model_type': 'mlp', 'hidden_dims': '[256, 128, 64]', 'dropout': 0.5562758038118714, 'batch_norm': False, 'lr': 5.07295212180087e-06, 'weight_decay': 0.0001801194174317741, 'epochs': 312, 'loss': 'mae', 'optimizer': 'adam', 'graph_mode': 'off', 'use_snp_selection': False}. Best is trial 44 with value: 0.24707068504388907.
