[I 2025-12-05 15:06:09,186] Trial 44 finished with value: -0.008408515276142225 and parameters: {'model_type': 'mlp', 'hidden_dims': '[256, 128]', 'dropout': 0.46785188035319963, 'batch_norm': False, 'lr': 8.465116762119799e-06, 'weight_decay': 6.181831333672623e-06, 'epochs': 297, 'loss': 'mse', 'optimizer': 'adam', 'graph_mode': 'off', 'use_snp_selection': False}. Best is trial 0 with value: 0.060712734896453596.
[I 2025-12-05 15:06:11,690] Trial 45 finished with value: 0.0060749432284701935 and parameters: {'model_type': 'mlp', 'hidden_dims': '[256, 128]', 'dropout': 0.20321406552723992, 'batch_norm': False, 'lr': 4.131221662201433e-06, 'weight_decay': 2.393542496470521e-06, 'epochs': 319, 'loss': 'mse', 'optimizer': 'adam', 'graph_mode': 'off', 'use_snp_selection': True, 'num_snps': 51574}. Best is trial 0 with value: 0.060712734896453596.
[I 2025-12-05 15:06:13,367] Trial 46 finished with value: 0.004985256496296382 and parameters: {'model_type': 'mlp', 'hidden_dims': '[512, 128]', 'dropout': 0.41190911658902574, 'batch_norm': False, 'lr': 5.011865616344365e-05, 'weight_decay': 1.3614636203186015e-06, 'epochs': 245, 'loss': 'mse', 'optimizer': 'adam', 'graph_mode': 'off', 'use_snp_selection': False}. Best is trial 0 with value: 0.060712734896453596.
[I 2025-12-05 15:06:15,310] Trial 47 finished with value: -0.011135872731869733 and parameters: {'model_type': 'mlp', 'hidden_dims': '[128, 64]', 'dropout': 0.596011136166532, 'batch_norm': False, 'lr': 8.596652765698553e-05, 'weight_decay': 4.6369478087801955e-05, 'epochs': 271, 'loss': 'mse', 'optimizer': 'adam', 'graph_mode': 'off', 'use_snp_selection': True, 'num_snps': 39715}. Best is trial 0 with value: 0.060712734896453596.
[I 2025-12-05 15:06:16,257] Trial 48 finished with value: 0.034010191936965736 and parameters: {'model_type': 'mlp', 'hidden_dims': '[256, 128, 64]', 'dropout': 0.15804564551325062, 'batch_norm': True, 'lr': 2.545669589714884e-05, 'weight_decay': 5.582406694679721e-07, 'epochs': 159, 'loss': 'mae', 'optimizer': 'adam', 'graph_mode': 'off', 'use_snp_selection': False}. Best is trial 0 with value: 0.060712734896453596.
[I 2025-12-05 15:06:17,624] Trial 49 finished with value: 0.04988629156045789 and parameters: {'model_type': 'mlp', 'hidden_dims': '[256, 128]', 'dropout': 0.25912544182724156, 'batch_norm': False, 'lr': 0.00014044823198744536, 'weight_decay': 9.017122345008087e-07, 'epochs': 229, 'loss': 'mse', 'optimizer': 'adam', 'graph_mode': 'off', 'use_snp_selection': True, 'num_snps': 21339}. Best is trial 0 with value: 0.060712734896453596.
[I 2025-12-05 15:06:19,021] Trial 50 finished with value: 0.02505367670589174 and parameters: {'model_type': 'mlp', 'hidden_dims': '[128, 64]', 'dropout': 0.22951742783516066, 'batch_norm': True, 'lr': 0.000139904085689122, 'weight_decay': 8.336705564543752e-07, 'epochs': 227, 'loss': 'mse', 'optimizer': 'adam', 'graph_mode': 'off', 'use_snp_selection': True, 'num_snps': 21645}. Best is trial 0 with value: 0.060712734896453596.
[I 2025-12-05 15:06:20,630] Trial 51 finished with value: 0.03767464950551933 and parameters: {'model_type': 'mlp', 'hidden_dims': '[256, 128]', 'dropout': 0.25781978202547645, 'batch_norm': False, 'lr': 0.00026333746966633495, 'weight_decay': 1.7263209761965216e-06, 'epochs': 208, 'loss': 'mse', 'optimizer': 'adam', 'graph_mode': 'off', 'use_snp_selection': True, 'num_snps': 28943}. Best is trial 0 with value: 0.060712734896453596.
[I 2025-12-05 15:06:21,729] Trial 52 finished with value: 0.03379161019760096 and parameters: {'model_type': 'mlp', 'hidden_dims': '[256, 128]', 'dropout': 0.2729094843743982, 'batch_norm': False, 'lr': 0.00038135417186615985, 'weight_decay': 1.0742909768032766e-06, 'epochs': 185, 'loss': 'mse', 'optimizer': 'adam', 'graph_mode': 'off', 'use_snp_selection': True, 'num_snps': 15361}. Best is trial 0 with value: 0.060712734896453596.
[I 2025-12-05 15:06:23,624] Trial 53 finished with value: 0.029408991305648533 and parameters: {'model_type': 'mlp', 'hidden_dims': '[256, 128]', 'dropout': 0.34099104570083777, 'batch_norm': False, 'lr': 1.340647792972737e-05, 'weight_decay': 3.5198571701684213e-06, 'epochs': 331, 'loss': 'mse', 'optimizer': 'adam', 'graph_mode': 'off', 'use_snp_selection': True, 'num_snps': 34526}. Best is trial 0 with value: 0.060712734896453596.
[I 2025-12-05 15:06:25,692] Trial 54 finished with value: 0.02494473578405236 and parameters: {'model_type': 'mlp', 'hidden_dims': '[256, 128]', 'dropout': 0.22501792123128356, 'batch_norm': False, 'lr': 0.00015725376406405835, 'weight_decay': 2.0392364110314693e-06, 'epochs': 201, 'loss': 'mse', 'optimizer': 'adam', 'graph_mode': 'off', 'use_snp_selection': True, 'num_snps': 44033}. Best is trial 0 with value: 0.060712734896453596.
[I 2025-12-05 15:06:27,071] Trial 55 finished with value: -0.001465019461018786 and parameters: {'model_type': 'mlp', 'hidden_dims': '[512, 64]', 'dropout': 0.17130211790821293, 'batch_norm': False, 'lr': 4.0630909754447234e-05, 'weight_decay': 6.542595515009507e-06, 'epochs': 171, 'loss': 'mse', 'optimizer': 'adam', 'graph_mode': 'off', 'use_snp_selection': False}. Best is trial 0 with value: 0.060712734896453596.
[I 2025-12-05 15:06:28,593] Trial 56 finished with value: 0.04197626463049123 and parameters: {'model_type': 'mlp', 'hidden_dims': '[512, 256]', 'dropout': 0.20676217029758956, 'batch_norm': False, 'lr': 6.021811187518497e-05, 'weight_decay': 3.8567831068410146e-07, 'epochs': 223, 'loss': 'mae', 'optimizer': 'adam', 'graph_mode': 'off', 'use_snp_selection': True, 'num_snps': 24372}. Best is trial 0 with value: 0.060712734896453596.
[I 2025-12-05 15:06:29,528] Trial 57 finished with value: 0.036070693997448076 and parameters: {'model_type': 'mlp', 'hidden_dims': '[128, 64]', 'dropout': 0.3756422091464844, 'batch_norm': True, 'lr': 4.764518200289499e-06, 'weight_decay': 3.926438155111043e-06, 'epochs': 236, 'loss': 'mae', 'optimizer': 'adam', 'graph_mode': 'off', 'use_snp_selection': False}. Best is trial 0 with value: 0.060712734896453596.
[I 2025-12-05 15:06:30,687] Trial 58 finished with value: 0.05015045386614635 and parameters: {'model_type': 'mlp', 'hidden_dims': '[256, 128]', 'dropout': 0.563067568654864, 'batch_norm': False, 'lr': 7.805731056109727e-05, 'weight_decay': 0.00010897524033500439, 'epochs': 142, 'loss': 'mse', 'optimizer': 'adam', 'graph_mode': 'off', 'use_snp_selection': True, 'num_snps': 16626}. Best is trial 0 with value: 0.060712734896453596.
[I 2025-12-05 15:06:31,769] Trial 59 finished with value: 0.036951761705586963 and parameters: {'model_type': 'mlp', 'hidden_dims': '[256, 128]', 'dropout': 0.5644502701955473, 'batch_norm': True, 'lr': 7.977199606939002e-05, 'weight_decay': 2.8766591148662975e-05, 'epochs': 109, 'loss': 'mse', 'optimizer': 'adam', 'graph_mode': 'off', 'use_snp_selection': True, 'num_snps': 16423}. Best is trial 0 with value: 0.060712734896453596.
[I 2025-12-05 15:06:32,528] Trial 60 finished with value: 0.04372508942869273 and parameters: {'model_type': 'mlp', 'hidden_dims': '[128, 64]', 'dropout': 0.30199934471929524, 'batch_norm': False, 'lr': 0.00019262473452957957, 'weight_decay': 0.00014279595972920342, 'epochs': 72, 'loss': 'mae', 'optimizer': 'adam', 'graph_mode': 'off', 'use_snp_selection': True, 'num_snps': 8201}. Best is trial 0 with value: 0.060712734896453596.
[I 2025-12-05 15:06:33,955] Trial 61 finished with value: 0.012890404358710908 and parameters: {'model_type': 'mlp', 'hidden_dims': '[256, 128]', 'dropout': 0.5193915553707712, 'batch_norm': False, 'lr': 0.00012916918081444824, 'weight_decay': 6.889487401915544e-05, 'epochs': 128, 'loss': 'mse', 'optimizer': 'adam', 'graph_mode': 'off', 'use_snp_selection': True, 'num_snps': 27274}. Best is trial 0 with value: 0.060712734896453596.
[I 2025-12-05 15:06:35,081] Trial 62 finished with value: -0.013164974468464444 and parameters: {'model_type': 'mlp', 'hidden_dims': '[256, 128]', 'dropout': 0.5466732478573418, 'batch_norm': False, 'lr': 5.045618212761359e-05, 'weight_decay': 1.0018141414577645e-05, 'epochs': 149, 'loss': 'mse', 'optimizer': 'adam', 'graph_mode': 'off', 'use_snp_selection': True, 'num_snps': 16727}. Best is trial 0 with value: 0.060712734896453596.
[I 2025-12-05 15:06:35,842] Trial 63 finished with value: 0.018958316490530806 and parameters: {'model_type': 'mlp', 'hidden_dims': '[256, 128]', 'dropout': 0.4976594022777936, 'batch_norm': False, 'lr': 3.6586531425982896e-05, 'weight_decay': 0.00043319186023103276, 'epochs': 185, 'loss': 'mse', 'optimizer': 'adam', 'graph_mode': 'off', 'use_snp_selection': True, 'num_snps': 3775}. Best is trial 0 with value: 0.060712734896453596.
[I 2025-12-05 15:06:36,753] Trial 64 finished with value: 0.018559324234172607 and parameters: {'model_type': 'mlp', 'hidden_dims': '[256, 128]', 'dropout': 0.5359391721074976, 'batch_norm': False, 'lr': 2.2556490952105232e-05, 'weight_decay': 0.00025052575144715713, 'epochs': 143, 'loss': 'mse', 'optimizer': 'adam', 'graph_mode': 'off', 'use_snp_selection': False}. Best is trial 0 with value: 0.060712734896453596.
[I 2025-12-05 15:06:37,631] Trial 65 finished with value: 0.03854472867523736 and parameters: {'model_type': 'mlp', 'hidden_dims': '[128, 64]', 'dropout': 0.1027544937618654, 'batch_norm': True, 'lr': 0.0002816217242893244, 'weight_decay': 8.052104251139677e-05, 'epochs': 210, 'loss': 'mae', 'optimizer': 'adam', 'graph_mode': 'off', 'use_snp_selection': False}. Best is trial 0 with value: 0.060712734896453596.
[I 2025-12-05 15:06:38,765] Trial 66 finished with value: 0.04991142510402338 and parameters: {'model_type': 'mlp', 'hidden_dims': '[256, 128, 64]', 'dropout': 0.46935873354741364, 'batch_norm': True, 'lr': 1.748116413341123e-05, 'weight_decay': 0.00012902315173047384, 'epochs': 164, 'loss': 'mse', 'optimizer': 'adam', 'graph_mode': 'off', 'use_snp_selection': True, 'num_snps': 13198}. Best is trial 0 with value: 0.060712734896453596.
[I 2025-12-05 15:06:39,912] Trial 67 finished with value: 0.021499341174020355 and parameters: {'model_type': 'mlp', 'hidden_dims': '[256, 128, 64]', 'dropout': 0.4257939941811682, 'batch_norm': True, 'lr': 0.00011144531621629317, 'weight_decay': 0.00015796584183969998, 'epochs': 159, 'loss': 'mse', 'optimizer': 'adam', 'graph_mode': 'off', 'use_snp_selection': True, 'num_snps': 13630}. Best is trial 0 with value: 0.060712734896453596.
[I 2025-12-05 15:06:41,215] Trial 68 finished with value: -0.02201321519891107 and parameters: {'model_type': 'mlp', 'hidden_dims': '[256, 128, 64]', 'dropout': 0.1987739277031084, 'batch_norm': True, 'lr': 8.129607180763279e-06, 'weight_decay': 0.00033171099755654044, 'epochs': 165, 'loss': 'mae', 'optimizer': 'adam', 'graph_mode': 'off', 'use_snp_selection': True, 'num_snps': 18775}. Best is trial 0 with value: 0.060712734896453596.
[I 2025-12-05 15:06:42,300] Trial 69 finished with value: 0.04200688909538923 and parameters: {'model_type': 'mlp', 'hidden_dims': '[256, 128, 64]', 'dropout': 0.143451046929906, 'batch_norm': True, 'lr': 7.622691368190146e-05, 'weight_decay': 3.9182583646848684e-05, 'epochs': 177, 'loss': 'mae', 'optimizer': 'adam', 'graph_mode': 'off', 'use_snp_selection': True, 'num_snps': 10431}. Best is trial 0 with value: 0.060712734896453596.
[I 2025-12-05 15:06:43,240] Trial 70 finished with value: 0.01296618289570343 and parameters: {'model_type': 'mlp', 'hidden_dims': '[256, 128, 64]', 'dropout': 0.4789093759236067, 'batch_norm': True, 'lr': 4.3376194559555166e-05, 'weight_decay': 0.0001236882208700224, 'epochs': 137, 'loss': 'mse', 'optimizer': 'adam', 'graph_mode': 'off', 'use_snp_selection': True, 'num_snps': 6468}. Best is trial 0 with value: 0.060712734896453596.
[I 2025-12-05 15:06:44,983] Trial 71 finished with value: 0.020363446378910657 and parameters: {'model_type': 'mlp', 'hidden_dims': '[512, 128]', 'dropout': 0.45401547220987937, 'batch_norm': True, 'lr': 1.0581777369071377e-05, 'weight_decay': 1.2574897512793424e-06, 'epochs': 197, 'loss': 'mse', 'optimizer': 'adam', 'graph_mode': 'off', 'use_snp_selection': True, 'num_snps': 25841}. Best is trial 0 with value: 0.060712734896453596.
[I 2025-12-05 15:06:45,857] Trial 72 finished with value: 0.02974751803052497 and parameters: {'model_type': 'mlp', 'hidden_dims': '[128, 64]', 'dropout': 0.5807984468736918, 'batch_norm': True, 'lr': 1.941249652976307e-05, 'weight_decay': 0.00018254608995580578, 'epochs': 188, 'loss': 'mse', 'optimizer': 'adam', 'graph_mode': 'off', 'use_snp_selection': False}. Best is trial 0 with value: 0.060712734896453596.
[I 2025-12-05 15:06:46,927] Trial 73 finished with value: 0.03630345106633948 and parameters: {'model_type': 'mlp', 'hidden_dims': '[256, 128]', 'dropout': 0.5241940110873289, 'batch_norm': False, 'lr': 1.5819528709825302e-05, 'weight_decay': 1.678721246184643e-05, 'epochs': 217, 'loss': 'mse', 'optimizer': 'adam', 'graph_mode': 'off', 'use_snp_selection': False}. Best is trial 0 with value: 0.060712734896453596.
[I 2025-12-05 15:06:48,831] Trial 74 finished with value: 0.015267324999853097 and parameters: {'model_type': 'mlp', 'hidden_dims': '[512, 256]', 'dropout': 0.49912555458895386, 'batch_norm': True, 'lr': 1.5506055306704335e-06, 'weight_decay': 5.461669951966549e-05, 'epochs': 115, 'loss': 'mse', 'optimizer': 'adam', 'graph_mode': 'off', 'use_snp_selection': True, 'num_snps': 34356}. Best is trial 0 with value: 0.060712734896453596.
[I 2025-12-05 15:06:49,690] Trial 75 finished with value: 0.05547041727610422 and parameters: {'model_type': 'mlp', 'hidden_dims': '[128, 64]', 'dropout': 0.39511624531996453, 'batch_norm': False, 'lr': 2.642671711315887e-05, 'weight_decay': 7.548705534810043e-07, 'epochs': 202, 'loss': 'mae', 'optimizer': 'adam', 'graph_mode': 'off', 'use_snp_selection': False}. Best is trial 0 with value: 0.060712734896453596.
[I 2025-12-05 15:06:50,556] Trial 76 finished with value: 0.019742216095832005 and parameters: {'model_type': 'mlp', 'hidden_dims': '[128, 64]', 'dropout': 0.3906496444883961, 'batch_norm': False, 'lr': 2.424387998432439e-05, 'weight_decay': 8.555331908391912e-05, 'epochs': 204, 'loss': 'mae', 'optimizer': 'adam', 'graph_mode': 'off', 'use_snp_selection': False}. Best is trial 0 with value: 0.060712734896453596.
[I 2025-12-05 15:06:51,874] Trial 77 finished with value: -0.010112957497573585 and parameters: {'model_type': 'mlp', 'hidden_dims': '[128, 64]', 'dropout': 0.3249023245717262, 'batch_norm': True, 'lr': 6.12400148261326e-05, 'weight_decay': 2.27273381091891e-07, 'epochs': 257, 'loss': 'mae', 'optimizer': 'adam', 'graph_mode': 'off', 'use_snp_selection': True, 'num_snps': 13503}. Best is trial 0 with value: 0.060712734896453596.
[I 2025-12-05 15:06:52,698] Trial 78 finished with value: -0.0007070588719727668 and parameters: {'model_type': 'mlp', 'hidden_dims': '[128, 64]', 'dropout': 0.43340037337325943, 'batch_norm': False, 'lr': 2.769399963260681e-05, 'weight_decay': 7.5668516882447e-07, 'epochs': 176, 'loss': 'mae', 'optimizer': 'adam', 'graph_mode': 'off', 'use_snp_selection': False}. Best is trial 0 with value: 0.060712734896453596.
[I 2025-12-05 15:06:53,570] Trial 79 finished with value: -0.0007613065513965227 and parameters: {'model_type': 'mlp', 'hidden_dims': '[128, 64]', 'dropout': 0.23970495943778689, 'batch_norm': True, 'lr': 3.6297533838326336e-05, 'weight_decay': 5.471806787070175e-07, 'epochs': 166, 'loss': 'mae', 'optimizer': 'adam', 'graph_mode': 'off', 'use_snp_selection': False}. Best is trial 0 with value: 0.060712734896453596.
[I 2025-12-05 15:06:55,074] Trial 80 finished with value: 0.021827565618180667 and parameters: {'model_type': 'mlp', 'hidden_dims': '[512, 64]', 'dropout': 0.368321715770158, 'batch_norm': True, 'lr': 1.3027039667280353e-05, 'weight_decay': 1.5140915983798702e-06, 'epochs': 217, 'loss': 'mae', 'optimizer': 'adam', 'graph_mode': 'off', 'use_snp_selection': True, 'num_snps': 19327}. Best is trial 0 with value: 0.060712734896453596.
[I 2025-12-05 15:06:56,072] Trial 81 finished with value: 0.022621300561835103 and parameters: {'model_type': 'mlp', 'hidden_dims': '[128, 64]', 'dropout': 0.3976820327504771, 'batch_norm': False, 'lr': 3.2023188758945196e-05, 'weight_decay': 2.4301987888161043e-06, 'epochs': 340, 'loss': 'mae', 'optimizer': 'adam', 'graph_mode': 'off', 'use_snp_selection': False}. Best is trial 0 with value: 0.060712734896453596.
[I 2025-12-05 15:06:57,024] Trial 82 finished with value: 0.006206742320345713 and parameters: {'model_type': 'mlp', 'hidden_dims': '[256, 128]', 'dropout': 0.46143273744818336, 'batch_norm': False, 'lr': 1.7412003820970052e-05, 'weight_decay': 1.1288587013172044e-06, 'epochs': 149, 'loss': 'mse', 'optimizer': 'adam', 'graph_mode': 'off', 'use_snp_selection': False}. Best is trial 0 with value: 0.060712734896453596.
[I 2025-12-05 15:06:58,066] Trial 83 finished with value: 0.009228211973020286 and parameters: {'model_type': 'mlp', 'hidden_dims': '[256, 128, 64]', 'dropout': 0.3505212539374799, 'batch_norm': False, 'lr': 5.3452896276928085e-05, 'weight_decay': 1.705769142982283e-06, 'epochs': 196, 'loss': 'mae', 'optimizer': 'adam', 'graph_mode': 'off', 'use_snp_selection': False}. Best is trial 0 with value: 0.060712734896453596.
[I 2025-12-05 15:06:58,736] Trial 84 finished with value: -0.020413561298452412 and parameters: {'model_type': 'mlp', 'hidden_dims': '[128, 64]', 'dropout': 0.4173204886777758, 'batch_norm': False, 'lr': 1.050865910890932e-06, 'weight_decay': 3.3348490200906454e-06, 'epochs': 40, 'loss': 'mse', 'optimizer': 'adam', 'graph_mode': 'off', 'use_snp_selection': False}. Best is trial 0 with value: 0.060712734896453596.
[I 2025-12-05 15:06:59,937] Trial 85 finished with value: 0.056939064242191785 and parameters: {'model_type': 'mlp', 'hidden_dims': '[256, 128]', 'dropout': 0.17649797497435513, 'batch_norm': False, 'lr': 0.0008067577185273767, 'weight_decay': 4.569264061803166e-07, 'epochs': 287, 'loss': 'mse', 'optimizer': 'adam', 'graph_mode': 'off', 'use_snp_selection': False}. Best is trial 0 with value: 0.060712734896453596.
[I 2025-12-05 15:07:01,125] Trial 86 finished with value: 0.028132162508469276 and parameters: {'model_type': 'mlp', 'hidden_dims': '[256, 128]', 'dropout': 0.1700695096250835, 'batch_norm': False, 'lr': 0.0005839238864048677, 'weight_decay': 3.5471528994732154e-07, 'epochs': 283, 'loss': 'mse', 'optimizer': 'adam', 'graph_mode': 'off', 'use_snp_selection': False}. Best is trial 0 with value: 0.060712734896453596.
[I 2025-12-05 15:07:02,760] Trial 87 finished with value: 0.027184184848573826 and parameters: {'model_type': 'mlp', 'hidden_dims': '[512, 128]', 'dropout': 0.1916044819322254, 'batch_norm': False, 'lr': 9.714787715167334e-05, 'weight_decay': 5.091113638635527e-07, 'epochs': 244, 'loss': 'mae', 'optimizer': 'adam', 'graph_mode': 'off', 'use_snp_selection': False}. Best is trial 0 with value: 0.060712734896453596.
[I 2025-12-05 15:07:05,594] Trial 88 finished with value: 0.012376989238082886 and parameters: {'model_type': 'mlp', 'hidden_dims': '[128, 64]', 'dropout': 0.21532412698780512, 'batch_norm': True, 'lr': 0.000946152307731113, 'weight_decay': 2.2060588919681462e-07, 'epochs': 303, 'loss': 'mse', 'optimizer': 'adam', 'graph_mode': 'off', 'use_snp_selection': True, 'num_snps': 57017}. Best is trial 0 with value: 0.060712734896453596.
[I 2025-12-05 15:07:06,743] Trial 89 finished with value: 0.031862731043617615 and parameters: {'model_type': 'mlp', 'hidden_dims': '[256, 128]', 'dropout': 0.27206032235061123, 'batch_norm': False, 'lr': 3.411585429251796e-05, 'weight_decay': 6.867632543334721e-07, 'epochs': 234, 'loss': 'mae', 'optimizer': 'adam', 'graph_mode': 'off', 'use_snp_selection': False}. Best is trial 0 with value: 0.060712734896453596.
[I 2025-12-05 15:07:09,125] Trial 90 finished with value: 0.026371437722472565 and parameters: {'model_type': 'mlp', 'hidden_dims': '[512, 256]', 'dropout': 0.11730757587071652, 'batch_norm': True, 'lr': 0.0007036130764824116, 'weight_decay': 9.437877632665555e-07, 'epochs': 263, 'loss': 'mse', 'optimizer': 'adam', 'graph_mode': 'off', 'use_snp_selection': True, 'num_snps': 38696}. Best is trial 0 with value: 0.060712734896453596.
[I 2025-12-05 15:07:10,390] Trial 91 finished with value: 0.040864868794887786 and parameters: {'model_type': 'mlp', 'hidden_dims': '[256, 128]', 'dropout': 0.15116988208987087, 'batch_norm': False, 'lr': 8.860626238099156e-06, 'weight_decay': 5.577421238911206e-06, 'epochs': 327, 'loss': 'mse', 'optimizer': 'adam', 'graph_mode': 'off', 'use_snp_selection': False}. Best is trial 0 with value: 0.060712734896453596.
[I 2025-12-05 15:07:11,558] Trial 92 finished with value: 0.029060685623410038 and parameters: {'model_type': 'mlp', 'hidden_dims': '[256, 128]', 'dropout': 0.1761983779392977, 'batch_norm': False, 'lr': 0.00038739304983159397, 'weight_decay': 0.00010596294055451626, 'epochs': 288, 'loss': 'mse', 'optimizer': 'adam', 'graph_mode': 'off', 'use_snp_selection': False}. Best is trial 0 with value: 0.060712734896453596.
[I 2025-12-05 15:07:12,806] Trial 93 finished with value: 0.027633992799794886 and parameters: {'model_type': 'mlp', 'hidden_dims': '[256, 128]', 'dropout': 0.21886955678224612, 'batch_norm': False, 'lr': 2.0020906599080826e-05, 'weight_decay': 2.077953509135778e-06, 'epochs': 314, 'loss': 'mse', 'optimizer': 'adam', 'graph_mode': 'off', 'use_snp_selection': False}. Best is trial 0 with value: 0.060712734896453596.
[I 2025-12-05 15:07:14,103] Trial 94 finished with value: 0.04494308509115551 and parameters: {'model_type': 'mlp', 'hidden_dims': '[256, 128]', 'dropout': 0.5090104856547072, 'batch_norm': False, 'lr': 1.1866910278176285e-05, 'weight_decay': 2.835998150676539e-07, 'epochs': 341, 'loss': 'mse', 'optimizer': 'adam', 'graph_mode': 'off', 'use_snp_selection': False}. Best is trial 0 with value: 0.060712734896453596.
