[I 2025-12-05 16:01:26,025] Trial 0 finished with value: 0.10992756750819849 and parameters: {'model_type': 'mlp', 'hidden_dims': '[128, 64]', 'dropout': 0.199031432379812, 'batch_norm': True, 'lr': 1.8408544111075837e-06, 'weight_decay': 5.5136510071208614e-05, 'epochs': 336, 'loss': 'mae', 'optimizer': 'adam', 'graph_mode': 'off', 'use_snp_selection': True, 'num_snps': 43862}. Best is trial 0 with value: 0.10992756750819849.
[I 2025-12-05 16:01:28,190] Trial 1 finished with value: 0.14570653640132905 and parameters: {'model_type': 'mlp', 'hidden_dims': '[256, 128]', 'dropout': 0.4370668075331726, 'batch_norm': True, 'lr': 7.133471581159139e-05, 'weight_decay': 1.128633586803549e-05, 'epochs': 242, 'loss': 'mae', 'optimizer': 'adam', 'graph_mode': 'off', 'use_snp_selection': False}. Best is trial 1 with value: 0.14570653640132905.
[I 2025-12-05 16:01:29,935] Trial 2 finished with value: 0.034944581771046715 and parameters: {'model_type': 'mlp', 'hidden_dims': '[256, 128, 64]', 'dropout': 0.41314357415569625, 'batch_norm': False, 'lr': 3.952233718592101e-06, 'weight_decay': 0.00026754769258252603, 'epochs': 149, 'loss': 'mse', 'optimizer': 'adam', 'graph_mode': 'off', 'use_snp_selection': True, 'num_snps': 11571}. Best is trial 1 with value: 0.14570653640132905.
[I 2025-12-05 16:01:34,468] Trial 3 finished with value: 0.14145147731732619 and parameters: {'model_type': 'mlp', 'hidden_dims': '[512, 64]', 'dropout': 0.5938127374509361, 'batch_norm': False, 'lr': 5.67704586114731e-06, 'weight_decay': 2.4518087630137052e-05, 'epochs': 320, 'loss': 'mae', 'optimizer': 'adam', 'graph_mode': 'off', 'use_snp_selection': False}. Best is trial 1 with value: 0.14570653640132905.
[I 2025-12-05 16:01:38,755] Trial 4 finished with value: 0.08253272911056646 and parameters: {'model_type': 'mlp', 'hidden_dims': '[512, 128]', 'dropout': 0.25746343592134413, 'batch_norm': True, 'lr': 1.3467657668402788e-06, 'weight_decay': 0.00033087251918647806, 'epochs': 277, 'loss': 'mse', 'optimizer': 'adam', 'graph_mode': 'off', 'use_snp_selection': True, 'num_snps': 36675}. Best is trial 1 with value: 0.14570653640132905.
[I 2025-12-05 16:01:41,925] Trial 5 finished with value: 0.07409106817799166 and parameters: {'model_type': 'mlp', 'hidden_dims': '[512, 64]', 'dropout': 0.38275350994408375, 'batch_norm': True, 'lr': 1.5586664309232824e-06, 'weight_decay': 0.0008227664668621182, 'epochs': 145, 'loss': 'mae', 'optimizer': 'adam', 'graph_mode': 'off', 'use_snp_selection': True, 'num_snps': 32148}. Best is trial 1 with value: 0.14570653640132905.
[I 2025-12-05 16:01:43,763] Trial 6 finished with value: 0.1532203567829425 and parameters: {'model_type': 'mlp', 'hidden_dims': '[256, 128]', 'dropout': 0.3930109900265879, 'batch_norm': False, 'lr': 4.892964372128395e-05, 'weight_decay': 1.5809549317992182e-06, 'epochs': 199, 'loss': 'mse', 'optimizer': 'adam', 'graph_mode': 'off', 'use_snp_selection': False}. Best is trial 6 with value: 0.1532203567829425.
[I 2025-12-05 16:01:45,610] Trial 7 finished with value: 0.1515429711599837 and parameters: {'model_type': 'mlp', 'hidden_dims': '[512, 256]', 'dropout': 0.15343979219678458, 'batch_norm': True, 'lr': 6.234003099047341e-05, 'weight_decay': 3.894760610535477e-07, 'epochs': 97, 'loss': 'mse', 'optimizer': 'adam', 'graph_mode': 'off', 'use_snp_selection': False}. Best is trial 6 with value: 0.1532203567829425.
[I 2025-12-05 16:01:50,112] Trial 8 finished with value: 0.17202263909488316 and parameters: {'model_type': 'mlp', 'hidden_dims': '[512, 128]', 'dropout': 0.10743001231661406, 'batch_norm': True, 'lr': 0.00023728538449271062, 'weight_decay': 1.7629071578048637e-05, 'epochs': 312, 'loss': 'mae', 'optimizer': 'adam', 'graph_mode': 'off', 'use_snp_selection': False}. Best is trial 8 with value: 0.17202263909488316.
[I 2025-12-05 16:01:52,932] Trial 9 finished with value: 0.17823410778957532 and parameters: {'model_type': 'mlp', 'hidden_dims': '[512, 64]', 'dropout': 0.14505336736221927, 'batch_norm': True, 'lr': 5.8619638388111826e-05, 'weight_decay': 6.200156172669308e-07, 'epochs': 175, 'loss': 'mse', 'optimizer': 'adam', 'graph_mode': 'off', 'use_snp_selection': False}. Best is trial 9 with value: 0.17823410778957532.
[I 2025-12-05 16:01:54,119] Trial 10 finished with value: 0.022407703588418943 and parameters: {'model_type': 'mlp', 'hidden_dims': '[512, 64]', 'dropout': 0.27531666245262887, 'batch_norm': False, 'lr': 0.00032393778075602147, 'weight_decay': 1.1714031539166647e-07, 'epochs': 44, 'loss': 'mse', 'optimizer': 'adam', 'graph_mode': 'off', 'use_snp_selection': False}. Best is trial 9 with value: 0.17823410778957532.
[I 2025-12-05 16:01:57,453] Trial 11 finished with value: 0.15874434508968377 and parameters: {'model_type': 'mlp', 'hidden_dims': '[512, 128]', 'dropout': 0.10095648685224448, 'batch_norm': True, 'lr': 0.0007381466848241802, 'weight_decay': 1.969664044175748e-06, 'epochs': 216, 'loss': 'mae', 'optimizer': 'adam', 'graph_mode': 'off', 'use_snp_selection': False}. Best is trial 9 with value: 0.17823410778957532.
[I 2025-12-05 16:02:01,594] Trial 12 finished with value: 0.17155334274110792 and parameters: {'model_type': 'mlp', 'hidden_dims': '[512, 128]', 'dropout': 0.10344600881777158, 'batch_norm': True, 'lr': 0.00018400807026440393, 'weight_decay': 2.652725854953085e-06, 'epochs': 281, 'loss': 'mae', 'optimizer': 'adam', 'graph_mode': 'off', 'use_snp_selection': False}. Best is trial 9 with value: 0.17823410778957532.
[I 2025-12-05 16:02:02,589] Trial 13 finished with value: 0.10951937866600014 and parameters: {'model_type': 'mlp', 'hidden_dims': '[128, 64]', 'dropout': 0.21562224788131257, 'batch_norm': True, 'lr': 1.343038855084232e-05, 'weight_decay': 5.9577988329204815e-05, 'epochs': 156, 'loss': 'mse', 'optimizer': 'adam', 'graph_mode': 'off', 'use_snp_selection': False}. Best is trial 9 with value: 0.17823410778957532.
[I 2025-12-05 16:02:04,929] Trial 14 finished with value: 0.14009595847720913 and parameters: {'model_type': 'mlp', 'hidden_dims': '[256, 128, 64]', 'dropout': 0.3012984444538551, 'batch_norm': True, 'lr': 0.00017558188744418174, 'weight_decay': 4.841366235436571e-06, 'epochs': 262, 'loss': 'mse', 'optimizer': 'adam', 'graph_mode': 'off', 'use_snp_selection': False}. Best is trial 9 with value: 0.17823410778957532.
[I 2025-12-05 16:02:06,902] Trial 15 finished with value: 0.10793230783812606 and parameters: {'model_type': 'mlp', 'hidden_dims': '[512, 256]', 'dropout': 0.1723492905468449, 'batch_norm': True, 'lr': 1.9101360081531482e-05, 'weight_decay': 4.5605747709891527e-07, 'epochs': 106, 'loss': 'mae', 'optimizer': 'adam', 'graph_mode': 'off', 'use_snp_selection': False}. Best is trial 9 with value: 0.17823410778957532.
[I 2025-12-05 16:02:11,890] Trial 16 finished with value: 0.14399946501960167 and parameters: {'model_type': 'mlp', 'hidden_dims': '[512, 128]', 'dropout': 0.558513902174278, 'batch_norm': True, 'lr': 0.0008608834321780825, 'weight_decay': 1.0765286122019607e-05, 'epochs': 350, 'loss': 'mse', 'optimizer': 'adam', 'graph_mode': 'off', 'use_snp_selection': False}. Best is trial 9 with value: 0.17823410778957532.
[I 2025-12-05 16:02:15,330] Trial 17 finished with value: 0.16278846823144716 and parameters: {'model_type': 'mlp', 'hidden_dims': '[512, 64]', 'dropout': 0.4828821377080479, 'batch_norm': True, 'lr': 0.00013980529748764629, 'weight_decay': 5.666950082267898e-07, 'epochs': 225, 'loss': 'mae', 'optimizer': 'adam', 'graph_mode': 'off', 'use_snp_selection': False}. Best is trial 9 with value: 0.17823410778957532.
[I 2025-12-05 16:02:20,281] Trial 18 finished with value: 0.1353221914874833 and parameters: {'model_type': 'mlp', 'hidden_dims': '[512, 128]', 'dropout': 0.3245776573111194, 'batch_norm': False, 'lr': 2.797772152750264e-05, 'weight_decay': 4.036647609793897e-05, 'epochs': 172, 'loss': 'mse', 'optimizer': 'adam', 'graph_mode': 'off', 'use_snp_selection': True, 'num_snps': 58241}. Best is trial 9 with value: 0.17823410778957532.
[I 2025-12-05 16:02:24,627] Trial 19 finished with value: 0.1647605942255227 and parameters: {'model_type': 'mlp', 'hidden_dims': '[512, 64]', 'dropout': 0.13867140329468503, 'batch_norm': True, 'lr': 0.0003251383087518385, 'weight_decay': 1.1354159408743119e-07, 'epochs': 299, 'loss': 'mae', 'optimizer': 'adam', 'graph_mode': 'off', 'use_snp_selection': False}. Best is trial 9 with value: 0.17823410778957532.
[I 2025-12-05 16:02:25,472] Trial 20 finished with value: 0.14312375205886235 and parameters: {'model_type': 'mlp', 'hidden_dims': '[128, 64]', 'dropout': 0.23662357927250263, 'batch_norm': True, 'lr': 0.0003732224191310746, 'weight_decay': 0.0001247981980720522, 'epochs': 113, 'loss': 'mae', 'optimizer': 'adam', 'graph_mode': 'off', 'use_snp_selection': False}. Best is trial 9 with value: 0.17823410778957532.
[I 2025-12-05 16:02:29,793] Trial 21 finished with value: 0.1785148367792688 and parameters: {'model_type': 'mlp', 'hidden_dims': '[512, 128]', 'dropout': 0.10124091625799034, 'batch_norm': True, 'lr': 0.0001233861441709155, 'weight_decay': 3.423561490831173e-06, 'epochs': 297, 'loss': 'mae', 'optimizer': 'adam', 'graph_mode': 'off', 'use_snp_selection': False}. Best is trial 21 with value: 0.1785148367792688.
[I 2025-12-05 16:02:34,335] Trial 22 finished with value: 0.15993540047911953 and parameters: {'model_type': 'mlp', 'hidden_dims': '[512, 128]', 'dropout': 0.1453059867714032, 'batch_norm': True, 'lr': 9.85129616755961e-05, 'weight_decay': 4.905653876075577e-06, 'epochs': 312, 'loss': 'mae', 'optimizer': 'adam', 'graph_mode': 'off', 'use_snp_selection': False}. Best is trial 21 with value: 0.1785148367792688.
[I 2025-12-05 16:02:38,144] Trial 23 finished with value: 0.15319176735408613 and parameters: {'model_type': 'mlp', 'hidden_dims': '[512, 128]', 'dropout': 0.18066682298309217, 'batch_norm': True, 'lr': 3.535809849538806e-05, 'weight_decay': 7.902282329432871e-07, 'epochs': 253, 'loss': 'mae', 'optimizer': 'adam', 'graph_mode': 'off', 'use_snp_selection': False}. Best is trial 21 with value: 0.1785148367792688.
[I 2025-12-05 16:02:42,447] Trial 24 finished with value: 0.17902410124327034 and parameters: {'model_type': 'mlp', 'hidden_dims': '[512, 128]', 'dropout': 0.11385171911779653, 'batch_norm': True, 'lr': 0.00010186932911646434, 'weight_decay': 5.038321313786889e-06, 'epochs': 295, 'loss': 'mae', 'optimizer': 'adam', 'graph_mode': 'off', 'use_snp_selection': False}. Best is trial 24 with value: 0.17902410124327034.
[I 2025-12-05 16:02:45,378] Trial 25 finished with value: 0.16518498199851564 and parameters: {'model_type': 'mlp', 'hidden_dims': '[512, 256]', 'dropout': 0.20659399060640374, 'batch_norm': True, 'lr': 0.00011215275422176257, 'weight_decay': 4.168711962529103e-06, 'epochs': 183, 'loss': 'mae', 'optimizer': 'adam', 'graph_mode': 'off', 'use_snp_selection': False}. Best is trial 24 with value: 0.17902410124327034.
[I 2025-12-05 16:02:47,008] Trial 26 finished with value: 0.01883022951023252 and parameters: {'model_type': 'mlp', 'hidden_dims': '[256, 128]', 'dropout': 0.13601017065099433, 'batch_norm': True, 'lr': 1.1686842646128116e-05, 'weight_decay': 1.063376716453576e-06, 'epochs': 203, 'loss': 'mse', 'optimizer': 'adam', 'graph_mode': 'off', 'use_snp_selection': True, 'num_snps': 3842}. Best is trial 24 with value: 0.17902410124327034.
[I 2025-12-05 16:02:49,513] Trial 27 finished with value: 0.14848730645138378 and parameters: {'model_type': 'mlp', 'hidden_dims': '[256, 128, 64]', 'dropout': 0.2347718254607485, 'batch_norm': False, 'lr': 3.708794373669967e-05, 'weight_decay': 2.145059391609654e-07, 'epochs': 293, 'loss': 'mae', 'optimizer': 'adam', 'graph_mode': 'off', 'use_snp_selection': False}. Best is trial 24 with value: 0.17902410124327034.
[I 2025-12-05 16:02:53,043] Trial 28 finished with value: 0.14843007271174227 and parameters: {'model_type': 'mlp', 'hidden_dims': '[512, 64]', 'dropout': 0.1602895116201787, 'batch_norm': True, 'lr': 8.226865442368421e-05, 'weight_decay': 6.768427395284904e-06, 'epochs': 233, 'loss': 'mse', 'optimizer': 'adam', 'graph_mode': 'off', 'use_snp_selection': False}. Best is trial 24 with value: 0.17902410124327034.
[I 2025-12-05 16:02:55,304] Trial 29 finished with value: 0.12591203575308876 and parameters: {'model_type': 'mlp', 'hidden_dims': '[128, 64]', 'dropout': 0.192785698866823, 'batch_norm': True, 'lr': 0.0005388560200940643, 'weight_decay': 2.5463792799188387e-06, 'epochs': 335, 'loss': 'mae', 'optimizer': 'adam', 'graph_mode': 'off', 'use_snp_selection': True, 'num_snps': 19468}. Best is trial 24 with value: 0.17902410124327034.
[I 2025-12-05 16:02:59,258] Trial 30 finished with value: 0.138829935349533 and parameters: {'model_type': 'mlp', 'hidden_dims': '[512, 128]', 'dropout': 0.3444097086260433, 'batch_norm': True, 'lr': 2.251128231288598e-05, 'weight_decay': 1.0099570256287878e-06, 'epochs': 267, 'loss': 'mae', 'optimizer': 'adam', 'graph_mode': 'off', 'use_snp_selection': False}. Best is trial 24 with value: 0.17902410124327034.
[I 2025-12-05 16:03:03,849] Trial 31 finished with value: 0.17274090704728898 and parameters: {'model_type': 'mlp', 'hidden_dims': '[512, 128]', 'dropout': 0.10352911849472163, 'batch_norm': True, 'lr': 0.000183195383083799, 'weight_decay': 2.0661648753413055e-05, 'epochs': 318, 'loss': 'mae', 'optimizer': 'adam', 'graph_mode': 'off', 'use_snp_selection': False}. Best is trial 24 with value: 0.17902410124327034.
[I 2025-12-05 16:03:08,648] Trial 32 finished with value: 0.15361465265247098 and parameters: {'model_type': 'mlp', 'hidden_dims': '[512, 128]', 'dropout': 0.12676477415311713, 'batch_norm': True, 'lr': 5.475532178807485e-05, 'weight_decay': 1.9580922569206304e-05, 'epochs': 335, 'loss': 'mae', 'optimizer': 'adam', 'graph_mode': 'off', 'use_snp_selection': False}. Best is trial 24 with value: 0.17902410124327034.
[I 2025-12-05 16:03:12,312] Trial 33 finished with value: 0.16257512056690654 and parameters: {'model_type': 'mlp', 'hidden_dims': '[512, 128]', 'dropout': 0.17452364671284862, 'batch_norm': True, 'lr': 0.00011955176210474787, 'weight_decay': 1.1113682208797708e-05, 'epochs': 242, 'loss': 'mae', 'optimizer': 'adam', 'graph_mode': 'off', 'use_snp_selection': False}. Best is trial 24 with value: 0.17902410124327034.
[I 2025-12-05 16:03:14,798] Trial 34 finished with value: 0.17190632434942382 and parameters: {'model_type': 'mlp', 'hidden_dims': '[256, 128]', 'dropout': 0.12918504777466877, 'batch_norm': True, 'lr': 0.00020889652189809278, 'weight_decay': 6.26672315004559e-05, 'epochs': 289, 'loss': 'mae', 'optimizer': 'adam', 'graph_mode': 'off', 'use_snp_selection': False}. Best is trial 24 with value: 0.17902410124327034.
[I 2025-12-05 16:03:19,313] Trial 35 finished with value: 0.13411967111274425 and parameters: {'model_type': 'mlp', 'hidden_dims': '[512, 128]', 'dropout': 0.10189024024330684, 'batch_norm': False, 'lr': 7.630290265663671e-05, 'weight_decay': 2.4502568750467577e-07, 'epochs': 320, 'loss': 'mae', 'optimizer': 'adam', 'graph_mode': 'off', 'use_snp_selection': False}. Best is trial 24 with value: 0.17902410124327034.
[I 2025-12-05 16:03:23,675] Trial 36 finished with value: 0.16266203617918878 and parameters: {'model_type': 'mlp', 'hidden_dims': '[256, 128, 64]', 'dropout': 0.21378572595452272, 'batch_norm': True, 'lr': 0.0004847547787349859, 'weight_decay': 0.0001244805107393721, 'epochs': 247, 'loss': 'mae', 'optimizer': 'adam', 'graph_mode': 'off', 'use_snp_selection': True, 'num_snps': 58661}. Best is trial 24 with value: 0.17902410124327034.
[I 2025-12-05 16:03:28,611] Trial 37 finished with value: 0.05592458449485273 and parameters: {'model_type': 'mlp', 'hidden_dims': '[512, 64]', 'dropout': 0.4491846433780996, 'batch_norm': True, 'lr': 4.446294938689996e-06, 'weight_decay': 2.0856647811874017e-05, 'epochs': 347, 'loss': 'mse', 'optimizer': 'adam', 'graph_mode': 'off', 'use_snp_selection': False}. Best is trial 24 with value: 0.17902410124327034.
[I 2025-12-05 16:03:30,925] Trial 38 finished with value: 0.1102299170588424 and parameters: {'model_type': 'mlp', 'hidden_dims': '[512, 128]', 'dropout': 0.25961685559417563, 'batch_norm': False, 'lr': 4.827142942511583e-05, 'weight_decay': 3.959398927703408e-05, 'epochs': 132, 'loss': 'mae', 'optimizer': 'adam', 'graph_mode': 'off', 'use_snp_selection': True, 'num_snps': 19911}. Best is trial 24 with value: 0.17902410124327034.
[I 2025-12-05 16:03:34,978] Trial 39 finished with value: 0.1593530243885202 and parameters: {'model_type': 'mlp', 'hidden_dims': '[512, 64]', 'dropout': 0.15906804937508254, 'batch_norm': True, 'lr': 0.00014644239562913548, 'weight_decay': 7.292174767457787e-06, 'epochs': 274, 'loss': 'mse', 'optimizer': 'adam', 'graph_mode': 'off', 'use_snp_selection': False}. Best is trial 24 with value: 0.17902410124327034.
[I 2025-12-05 16:03:39,407] Trial 40 finished with value: 0.17176437902060038 and parameters: {'model_type': 'mlp', 'hidden_dims': '[512, 128]', 'dropout': 0.1915478382899422, 'batch_norm': True, 'lr': 0.0002542374964944564, 'weight_decay': 1.6371007096426808e-06, 'epochs': 305, 'loss': 'mae', 'optimizer': 'adam', 'graph_mode': 'off', 'use_snp_selection': False}. Best is trial 24 with value: 0.17902410124327034.
[I 2025-12-05 16:03:44,024] Trial 41 finished with value: 0.037192870398943784 and parameters: {'model_type': 'mlp', 'hidden_dims': '[512, 128]', 'dropout': 0.1162789620756352, 'batch_norm': True, 'lr': 2.320370617557869e-06, 'weight_decay': 1.7371159432057735e-05, 'epochs': 319, 'loss': 'mae', 'optimizer': 'adam', 'graph_mode': 'off', 'use_snp_selection': False}. Best is trial 24 with value: 0.17902410124327034.
[I 2025-12-05 16:03:48,725] Trial 42 finished with value: 0.17610533681449414 and parameters: {'model_type': 'mlp', 'hidden_dims': '[512, 128]', 'dropout': 0.12255781086192731, 'batch_norm': True, 'lr': 0.00022258375151805243, 'weight_decay': 3.8279467665809535e-06, 'epochs': 326, 'loss': 'mae', 'optimizer': 'adam', 'graph_mode': 'off', 'use_snp_selection': False}. Best is trial 24 with value: 0.17902410124327034.
[I 2025-12-05 16:03:53,430] Trial 43 finished with value: 0.15915597808290266 and parameters: {'model_type': 'mlp', 'hidden_dims': '[512, 128]', 'dropout': 0.14618298896299126, 'batch_norm': True, 'lr': 8.38444185067449e-05, 'weight_decay': 3.1589801034974494e-06, 'epochs': 327, 'loss': 'mae', 'optimizer': 'adam', 'graph_mode': 'off', 'use_snp_selection': False}. Best is trial 24 with value: 0.17902410124327034.
[I 2025-12-05 16:03:54,909] Trial 44 finished with value: 0.15153926950482838 and parameters: {'model_type': 'mlp', 'hidden_dims': '[512, 128]', 'dropout': 0.12191426019205154, 'batch_norm': True, 'lr': 0.00025002092540288794, 'weight_decay': 8.529712042632363e-06, 'epochs': 67, 'loss': 'mae', 'optimizer': 'adam', 'graph_mode': 'off', 'use_snp_selection': False}. Best is trial 24 with value: 0.17902410124327034.
[I 2025-12-05 16:03:59,173] Trial 45 finished with value: 0.1714486852409413 and parameters: {'model_type': 'mlp', 'hidden_dims': '[512, 256]', 'dropout': 0.10041931843890209, 'batch_norm': True, 'lr': 6.624753704346008e-05, 'weight_decay': 1.4627168028388175e-06, 'epochs': 289, 'loss': 'mae', 'optimizer': 'adam', 'graph_mode': 'off', 'use_snp_selection': False}. Best is trial 24 with value: 0.17902410124327034.
[I 2025-12-05 16:04:00,766] Trial 46 finished with value: 0.15062552413410757 and parameters: {'model_type': 'mlp', 'hidden_dims': '[256, 128]', 'dropout': 0.16601020435863348, 'batch_norm': False, 'lr': 0.00015017698533317968, 'weight_decay': 3.5749556982709435e-06, 'epochs': 160, 'loss': 'mse', 'optimizer': 'adam', 'graph_mode': 'off', 'use_snp_selection': False}. Best is trial 24 with value: 0.17902410124327034.
[I 2025-12-05 16:04:04,002] Trial 47 finished with value: 0.17058348166724668 and parameters: {'model_type': 'mlp', 'hidden_dims': '[512, 128]', 'dropout': 0.12318894186522558, 'batch_norm': True, 'lr': 0.0004900230427221237, 'weight_decay': 1.37853673081063e-05, 'epochs': 208, 'loss': 'mae', 'optimizer': 'adam', 'graph_mode': 'off', 'use_snp_selection': False}. Best is trial 24 with value: 0.17902410124327034.
[I 2025-12-05 16:04:05,109] Trial 48 finished with value: 0.13835678249798256 and parameters: {'model_type': 'mlp', 'hidden_dims': '[128, 64]', 'dropout': 0.23634848937098213, 'batch_norm': True, 'lr': 4.1856878544078626e-05, 'weight_decay': 3.093107184334965e-05, 'epochs': 186, 'loss': 'mse', 'optimizer': 'adam', 'graph_mode': 'off', 'use_snp_selection': False}. Best is trial 24 with value: 0.17902410124327034.
[I 2025-12-05 16:04:10,623] Trial 49 finished with value: 0.15136317383892217 and parameters: {'model_type': 'mlp', 'hidden_dims': '[512, 64]', 'dropout': 0.28134694027148055, 'batch_norm': True, 'lr': 0.00010513228995364196, 'weight_decay': 2.4569111495755094e-07, 'epochs': 310, 'loss': 'mae', 'optimizer': 'adam', 'graph_mode': 'off', 'use_snp_selection': True, 'num_snps': 46888}. Best is trial 24 with value: 0.17902410124327034.
[I 2025-12-05 16:04:14,710] Trial 50 finished with value: 0.154883846708328 and parameters: {'model_type': 'mlp', 'hidden_dims': '[512, 128]', 'dropout': 0.15065679393734435, 'batch_norm': True, 'lr': 0.00018475893290890674, 'weight_decay': 5.947707162911157e-06, 'epochs': 276, 'loss': 'mae', 'optimizer': 'adam', 'graph_mode': 'off', 'use_snp_selection': False}. Best is trial 24 with value: 0.17902410124327034.
[I 2025-12-05 16:04:19,437] Trial 51 finished with value: 0.1713575241799476 and parameters: {'model_type': 'mlp', 'hidden_dims': '[512, 128]', 'dropout': 0.12084792867154753, 'batch_norm': True, 'lr': 0.0002368916581390468, 'weight_decay': 1.3944346214843438e-05, 'epochs': 328, 'loss': 'mae', 'optimizer': 'adam', 'graph_mode': 'off', 'use_snp_selection': False}. Best is trial 24 with value: 0.17902410124327034.
