[I 2025-12-05 15:30:55,156] Trial 63 finished with value: 0.10579808051889275 and parameters: {'model_type': 'mlp', 'hidden_dims': '[256, 128, 64]', 'dropout': 0.29014762367707303, 'batch_norm': True, 'lr': 0.00019231143031888488, 'weight_decay': 1.1337214821178947e-05, 'epochs': 86, 'loss': 'mae', 'optimizer': 'adam', 'graph_mode': 'off', 'use_snp_selection': True, 'num_snps': 54075}. Best is trial 50 with value: 0.13183701202040027.
[I 2025-12-05 15:30:57,373] Trial 64 finished with value: 0.08644840691644459 and parameters: {'model_type': 'mlp', 'hidden_dims': '[256, 128, 64]', 'dropout': 0.33860496724505995, 'batch_norm': True, 'lr': 9.247707225725464e-05, 'weight_decay': 5.394611955343464e-06, 'epochs': 75, 'loss': 'mae', 'optimizer': 'adam', 'graph_mode': 'off', 'use_snp_selection': True, 'num_snps': 41281}. Best is trial 50 with value: 0.13183701202040027.
[I 2025-12-05 15:30:59,886] Trial 65 finished with value: 0.10628471755906727 and parameters: {'model_type': 'mlp', 'hidden_dims': '[512, 128]', 'dropout': 0.24693175181274146, 'batch_norm': True, 'lr': 0.00014278836427025882, 'weight_decay': 6.187665616384727e-07, 'epochs': 50, 'loss': 'mae', 'optimizer': 'adam', 'graph_mode': 'off', 'use_snp_selection': True, 'num_snps': 47622}. Best is trial 50 with value: 0.13183701202040027.
[I 2025-12-05 15:31:02,025] Trial 66 finished with value: 0.11196686627462217 and parameters: {'model_type': 'mlp', 'hidden_dims': '[256, 128, 64]', 'dropout': 0.36100879070967284, 'batch_norm': True, 'lr': 0.00027027141658194937, 'weight_decay': 3.3500643218700485e-06, 'epochs': 187, 'loss': 'mae', 'optimizer': 'adam', 'graph_mode': 'off', 'use_snp_selection': True, 'num_snps': 35766}. Best is trial 50 with value: 0.13183701202040027.
[I 2025-12-05 15:31:04,582] Trial 67 finished with value: 0.09399301438444235 and parameters: {'model_type': 'mlp', 'hidden_dims': '[256, 128, 64]', 'dropout': 0.31385937260089714, 'batch_norm': True, 'lr': 0.0004814195539470453, 'weight_decay': 1.2942636387590326e-06, 'epochs': 63, 'loss': 'mae', 'optimizer': 'adam', 'graph_mode': 'off', 'use_snp_selection': True, 'num_snps': 56323}. Best is trial 50 with value: 0.13183701202040027.
[I 2025-12-05 15:31:07,260] Trial 68 finished with value: 0.10471864216335054 and parameters: {'model_type': 'mlp', 'hidden_dims': '[512, 128]', 'dropout': 0.18807064599668563, 'batch_norm': True, 'lr': 0.0003695305077143336, 'weight_decay': 1.8957616849316033e-06, 'epochs': 94, 'loss': 'mae', 'optimizer': 'adam', 'graph_mode': 'off', 'use_snp_selection': True, 'num_snps': 45099}. Best is trial 50 with value: 0.13183701202040027.
[I 2025-12-05 15:31:09,023] Trial 69 finished with value: 0.08560460581896066 and parameters: {'model_type': 'mlp', 'hidden_dims': '[256, 128, 64]', 'dropout': 0.21474694642425357, 'batch_norm': True, 'lr': 9.240171386078175e-05, 'weight_decay': 7.660702504618469e-06, 'epochs': 108, 'loss': 'mae', 'optimizer': 'adam', 'graph_mode': 'off', 'use_snp_selection': True, 'num_snps': 27924}. Best is trial 50 with value: 0.13183701202040027.
[I 2025-12-05 15:31:11,233] Trial 70 finished with value: 0.11954393472624483 and parameters: {'model_type': 'mlp', 'hidden_dims': '[256, 128]', 'dropout': 0.15677813972391372, 'batch_norm': False, 'lr': 6.0516695761931705e-05, 'weight_decay': 3.768044212857858e-05, 'epochs': 141, 'loss': 'mae', 'optimizer': 'adam', 'graph_mode': 'off', 'use_snp_selection': True, 'num_snps': 42147}. Best is trial 50 with value: 0.13183701202040027.
[I 2025-12-05 15:31:13,489] Trial 71 finished with value: 0.11637712443301679 and parameters: {'model_type': 'mlp', 'hidden_dims': '[256, 128]', 'dropout': 0.16224155127393206, 'batch_norm': False, 'lr': 6.171359733782007e-05, 'weight_decay': 3.3686591454125296e-05, 'epochs': 146, 'loss': 'mae', 'optimizer': 'adam', 'graph_mode': 'off', 'use_snp_selection': True, 'num_snps': 43220}. Best is trial 50 with value: 0.13183701202040027.
[I 2025-12-05 15:31:15,706] Trial 72 finished with value: 0.10344953077986578 and parameters: {'model_type': 'mlp', 'hidden_dims': '[256, 128]', 'dropout': 0.1593328663419601, 'batch_norm': False, 'lr': 5.853397191538803e-05, 'weight_decay': 3.665938582884127e-05, 'epochs': 115, 'loss': 'mae', 'optimizer': 'adam', 'graph_mode': 'off', 'use_snp_selection': True, 'num_snps': 41584}. Best is trial 50 with value: 0.13183701202040027.
[I 2025-12-05 15:31:18,135] Trial 73 finished with value: 0.10530181138811597 and parameters: {'model_type': 'mlp', 'hidden_dims': '[256, 128]', 'dropout': 0.12804041622357915, 'batch_norm': False, 'lr': 2.861053949465191e-05, 'weight_decay': 7.390418963090733e-05, 'epochs': 141, 'loss': 'mae', 'optimizer': 'adam', 'graph_mode': 'off', 'use_snp_selection': True, 'num_snps': 44119}. Best is trial 50 with value: 0.13183701202040027.
[I 2025-12-05 15:31:20,302] Trial 74 finished with value: 0.11017980330856278 and parameters: {'model_type': 'mlp', 'hidden_dims': '[256, 128]', 'dropout': 0.14325065059934305, 'batch_norm': False, 'lr': 7.084631217646524e-05, 'weight_decay': 3.734406960491809e-05, 'epochs': 156, 'loss': 'mae', 'optimizer': 'adam', 'graph_mode': 'off', 'use_snp_selection': True, 'num_snps': 38091}. Best is trial 50 with value: 0.13183701202040027.
[I 2025-12-05 15:31:22,114] Trial 75 finished with value: 0.030552119903664552 and parameters: {'model_type': 'mlp', 'hidden_dims': '[256, 128]', 'dropout': 0.17337751119662276, 'batch_norm': False, 'lr': 1.0087771566710253e-06, 'weight_decay': 0.0001871159865235435, 'epochs': 143, 'loss': 'mae', 'optimizer': 'adam', 'graph_mode': 'off', 'use_snp_selection': True, 'num_snps': 32484}. Best is trial 50 with value: 0.13183701202040027.
[I 2025-12-05 15:31:24,647] Trial 76 finished with value: 0.11034885222539918 and parameters: {'model_type': 'mlp', 'hidden_dims': '[256, 128]', 'dropout': 0.15447233130029028, 'batch_norm': False, 'lr': 5.08058667733253e-05, 'weight_decay': 1.6074133846085107e-05, 'epochs': 138, 'loss': 'mae', 'optimizer': 'adam', 'graph_mode': 'off', 'use_snp_selection': True, 'num_snps': 49595}. Best is trial 50 with value: 0.13183701202040027.
[I 2025-12-05 15:31:26,991] Trial 77 finished with value: 0.08962513055909473 and parameters: {'model_type': 'mlp', 'hidden_dims': '[256, 128]', 'dropout': 0.14103217010234007, 'batch_norm': False, 'lr': 8.939112132340298e-05, 'weight_decay': 2.0983237229796732e-05, 'epochs': 124, 'loss': 'mae', 'optimizer': 'adam', 'graph_mode': 'off', 'use_snp_selection': True, 'num_snps': 42791}. Best is trial 50 with value: 0.13183701202040027.
[I 2025-12-05 15:31:29,228] Trial 78 finished with value: 0.10044460114830388 and parameters: {'model_type': 'mlp', 'hidden_dims': '[256, 128]', 'dropout': 0.1967197408435774, 'batch_norm': False, 'lr': 4.045941434961458e-05, 'weight_decay': 1.167075523073067e-05, 'epochs': 188, 'loss': 'mae', 'optimizer': 'adam', 'graph_mode': 'off', 'use_snp_selection': True, 'num_snps': 38378}. Best is trial 50 with value: 0.13183701202040027.
[I 2025-12-05 15:31:32,147] Trial 79 finished with value: 0.1053014580708271 and parameters: {'model_type': 'mlp', 'hidden_dims': '[512, 128]', 'dropout': 0.102095549603402, 'batch_norm': False, 'lr': 0.00012450961681970886, 'weight_decay': 4.132110884525922e-05, 'epochs': 95, 'loss': 'mae', 'optimizer': 'adam', 'graph_mode': 'off', 'use_snp_selection': True, 'num_snps': 55280}. Best is trial 50 with value: 0.13183701202040027.
[I 2025-12-05 15:31:32,847] Trial 80 finished with value: 0.09515464774637078 and parameters: {'model_type': 'mlp', 'hidden_dims': '[128, 64]', 'dropout': 0.16957697469871236, 'batch_norm': False, 'lr': 6.612438909954449e-05, 'weight_decay': 2.8954458724513837e-05, 'epochs': 85, 'loss': 'mae', 'optimizer': 'adam', 'graph_mode': 'off', 'use_snp_selection': False}. Best is trial 50 with value: 0.13183701202040027.
[I 2025-12-05 15:31:35,239] Trial 81 finished with value: 0.1112491292351934 and parameters: {'model_type': 'mlp', 'hidden_dims': '[256, 128, 64]', 'dropout': 0.22553773386567988, 'batch_norm': True, 'lr': 0.00016182375262824796, 'weight_decay': 4.4089563210557186e-06, 'epochs': 76, 'loss': 'mae', 'optimizer': 'adam', 'graph_mode': 'off', 'use_snp_selection': True, 'num_snps': 49215}. Best is trial 50 with value: 0.13183701202040027.
[I 2025-12-05 15:31:37,517] Trial 82 finished with value: 0.07873345213065536 and parameters: {'model_type': 'mlp', 'hidden_dims': '[256, 128]', 'dropout': 0.23905241106677325, 'batch_norm': False, 'lr': 0.00020887762701247585, 'weight_decay': 2.8515905662136994e-06, 'epochs': 59, 'loss': 'mae', 'optimizer': 'adam', 'graph_mode': 'off', 'use_snp_selection': True, 'num_snps': 44705}. Best is trial 50 with value: 0.13183701202040027.
[I 2025-12-05 15:31:39,953] Trial 83 finished with value: 0.09366676694367881 and parameters: {'model_type': 'mlp', 'hidden_dims': '[512, 64]', 'dropout': 0.45804314044256567, 'batch_norm': True, 'lr': 0.0005080274291519076, 'weight_decay': 8.95499436997822e-06, 'epochs': 44, 'loss': 'mae', 'optimizer': 'adam', 'graph_mode': 'off', 'use_snp_selection': True, 'num_snps': 47015}. Best is trial 50 with value: 0.13183701202040027.
[I 2025-12-05 15:31:42,613] Trial 84 finished with value: 0.09280604416058626 and parameters: {'model_type': 'mlp', 'hidden_dims': '[512, 256]', 'dropout': 0.12173169913991863, 'batch_norm': True, 'lr': 2.7296553096622434e-05, 'weight_decay': 5.940974130623455e-06, 'epochs': 71, 'loss': 'mae', 'optimizer': 'adam', 'graph_mode': 'off', 'use_snp_selection': True, 'num_snps': 51235}. Best is trial 50 with value: 0.13183701202040027.
[I 2025-12-05 15:31:44,503] Trial 85 finished with value: 0.10030233028532524 and parameters: {'model_type': 'mlp', 'hidden_dims': '[256, 128, 64]', 'dropout': 0.18374860000235455, 'batch_norm': True, 'lr': 5.118478320838763e-05, 'weight_decay': 0.00015257841577745893, 'epochs': 102, 'loss': 'mae', 'optimizer': 'adam', 'graph_mode': 'off', 'use_snp_selection': True, 'num_snps': 34335}. Best is trial 50 with value: 0.13183701202040027.
[I 2025-12-05 15:31:45,387] Trial 86 finished with value: 0.11397391574393007 and parameters: {'model_type': 'mlp', 'hidden_dims': '[256, 128, 64]', 'dropout': 0.2062601620755719, 'batch_norm': True, 'lr': 0.0006859330175668516, 'weight_decay': 3.7232159065240556e-06, 'epochs': 83, 'loss': 'mae', 'optimizer': 'adam', 'graph_mode': 'off', 'use_snp_selection': False}. Best is trial 50 with value: 0.13183701202040027.
[I 2025-12-05 15:31:47,527] Trial 87 finished with value: 0.11811693128841522 and parameters: {'model_type': 'mlp', 'hidden_dims': '[256, 128, 64]', 'dropout': 0.1657608112982678, 'batch_norm': False, 'lr': 0.00010485336359979633, 'weight_decay': 6.975583287304658e-06, 'epochs': 111, 'loss': 'mae', 'optimizer': 'adam', 'graph_mode': 'off', 'use_snp_selection': True, 'num_snps': 39441}. Best is trial 50 with value: 0.13183701202040027.
[I 2025-12-05 15:31:48,528] Trial 88 finished with value: 0.09537703616223288 and parameters: {'model_type': 'mlp', 'hidden_dims': '[256, 128]', 'dropout': 0.1563153143778446, 'batch_norm': False, 'lr': 0.00010380369763565243, 'weight_decay': 2.1428920250419985e-06, 'epochs': 136, 'loss': 'mae', 'optimizer': 'adam', 'graph_mode': 'off', 'use_snp_selection': False}. Best is trial 50 with value: 0.13183701202040027.
[I 2025-12-05 15:31:50,797] Trial 89 finished with value: 0.11258231202145362 and parameters: {'model_type': 'mlp', 'hidden_dims': '[512, 256]', 'dropout': 0.26277832845125004, 'batch_norm': False, 'lr': 3.700867603381073e-05, 'weight_decay': 1.2387983629022099e-05, 'epochs': 112, 'loss': 'mae', 'optimizer': 'adam', 'graph_mode': 'off', 'use_snp_selection': True, 'num_snps': 39249}. Best is trial 50 with value: 0.13183701202040027.
[I 2025-12-05 15:31:52,227] Trial 90 finished with value: 0.09607416517179011 and parameters: {'model_type': 'mlp', 'hidden_dims': '[512, 128]', 'dropout': 0.1647851449587332, 'batch_norm': False, 'lr': 7.324192755749717e-05, 'weight_decay': 1.9242519199710768e-05, 'epochs': 126, 'loss': 'mse', 'optimizer': 'adam', 'graph_mode': 'off', 'use_snp_selection': False}. Best is trial 50 with value: 0.13183701202040027.
[I 2025-12-05 15:31:54,374] Trial 91 finished with value: 0.10066170030259372 and parameters: {'model_type': 'mlp', 'hidden_dims': '[256, 128, 64]', 'dropout': 0.19411048601794995, 'batch_norm': False, 'lr': 0.00031539322902906976, 'weight_decay': 6.960659813663721e-06, 'epochs': 101, 'loss': 'mae', 'optimizer': 'adam', 'graph_mode': 'off', 'use_snp_selection': True, 'num_snps': 44326}. Best is trial 50 with value: 0.13183701202040027.
[I 2025-12-05 15:31:56,827] Trial 92 finished with value: 0.09088866333938837 and parameters: {'model_type': 'mlp', 'hidden_dims': '[256, 128, 64]', 'dropout': 0.1786686805113042, 'batch_norm': False, 'lr': 0.00015529974951883395, 'weight_decay': 5.011229815202081e-06, 'epochs': 66, 'loss': 'mae', 'optimizer': 'adam', 'graph_mode': 'off', 'use_snp_selection': True, 'num_snps': 47901}. Best is trial 50 with value: 0.13183701202040027.
[I 2025-12-05 15:31:59,087] Trial 93 finished with value: 0.10686613346703736 and parameters: {'model_type': 'mlp', 'hidden_dims': '[256, 128, 64]', 'dropout': 0.13499414530318415, 'batch_norm': True, 'lr': 8.423961503643238e-05, 'weight_decay': 2.808861637943552e-06, 'epochs': 90, 'loss': 'mae', 'optimizer': 'adam', 'graph_mode': 'off', 'use_snp_selection': True, 'num_snps': 42678}. Best is trial 50 with value: 0.13183701202040027.
[I 2025-12-05 15:32:01,859] Trial 94 finished with value: 0.10281965311359248 and parameters: {'model_type': 'mlp', 'hidden_dims': '[256, 128, 64]', 'dropout': 0.14877527712343258, 'batch_norm': True, 'lr': 0.00024751746734236467, 'weight_decay': 9.933358128715486e-06, 'epochs': 209, 'loss': 'mae', 'optimizer': 'adam', 'graph_mode': 'off', 'use_snp_selection': True, 'num_snps': 51258}. Best is trial 50 with value: 0.13183701202040027.
[I 2025-12-05 15:32:02,782] Trial 95 finished with value: 0.07186049556621772 and parameters: {'model_type': 'mlp', 'hidden_dims': '[256, 128, 64]', 'dropout': 0.11452340548997368, 'batch_norm': True, 'lr': 0.00010296715400832982, 'weight_decay': 4.687768802133915e-05, 'epochs': 82, 'loss': 'mae', 'optimizer': 'adam', 'graph_mode': 'off', 'use_snp_selection': True, 'num_snps': 3544}. Best is trial 50 with value: 0.13183701202040027.
[I 2025-12-05 15:32:05,023] Trial 96 finished with value: 0.10242122415933413 and parameters: {'model_type': 'mlp', 'hidden_dims': '[128, 64]', 'dropout': 0.29096155162447573, 'batch_norm': False, 'lr': 0.00012706331972520834, 'weight_decay': 3.7057698026289623e-06, 'epochs': 150, 'loss': 'mae', 'optimizer': 'adam', 'graph_mode': 'off', 'use_snp_selection': True, 'num_snps': 46140}. Best is trial 50 with value: 0.13183701202040027.
[I 2025-12-05 15:32:06,164] Trial 97 finished with value: 0.08613274198654186 and parameters: {'model_type': 'mlp', 'hidden_dims': '[256, 128, 64]', 'dropout': 0.23886399466791897, 'batch_norm': True, 'lr': 6.249558736581772e-05, 'weight_decay': 6.372774349686427e-06, 'epochs': 169, 'loss': 'mae', 'optimizer': 'adam', 'graph_mode': 'off', 'use_snp_selection': False}. Best is trial 50 with value: 0.13183701202040027.
[I 2025-12-05 15:32:08,277] Trial 98 finished with value: 0.09198599091242599 and parameters: {'model_type': 'mlp', 'hidden_dims': '[256, 128, 64]', 'dropout': 0.21596911782211267, 'batch_norm': True, 'lr': 0.00021681177091993227, 'weight_decay': 2.3476214928628655e-06, 'epochs': 46, 'loss': 'mae', 'optimizer': 'adam', 'graph_mode': 'off', 'use_snp_selection': True, 'num_snps': 39822}. Best is trial 50 with value: 0.13183701202040027.
[I 2025-12-05 15:32:09,790] Trial 99 finished with value: 0.11391875903152747 and parameters: {'model_type': 'mlp', 'hidden_dims': '[512, 256]', 'dropout': 0.2017515747999597, 'batch_norm': True, 'lr': 0.000423201705813582, 'weight_decay': 1.5996278300071988e-06, 'epochs': 119, 'loss': 'mae', 'optimizer': 'adam', 'graph_mode': 'off', 'use_snp_selection': False}. Best is trial 50 with value: 0.13183701202040027.
[I 2025-12-05 15:32:10,786] Trial 100 finished with value: 0.07157351764417844 and parameters: {'model_type': 'mlp', 'hidden_dims': '[512, 64]', 'dropout': 0.5312056100588873, 'batch_norm': False, 'lr': 0.00019219194623277722, 'weight_decay': 7.031858415641077e-05, 'epochs': 58, 'loss': 'mae', 'optimizer': 'adam', 'graph_mode': 'off', 'use_snp_selection': True, 'num_snps': 8064}. Best is trial 50 with value: 0.13183701202040027.
[I 2025-12-05 15:32:11,766] Trial 101 finished with value: 0.12617926502944235 and parameters: {'model_type': 'mlp', 'hidden_dims': '[256, 128, 64]', 'dropout': 0.22448237997622442, 'batch_norm': True, 'lr': 0.0008868361132793819, 'weight_decay': 4.233416292965075e-06, 'epochs': 132, 'loss': 'mae', 'optimizer': 'adam', 'graph_mode': 'off', 'use_snp_selection': False}. Best is trial 50 with value: 0.13183701202040027.
[I 2025-12-05 15:32:12,736] Trial 102 finished with value: 0.11640391187998099 and parameters: {'model_type': 'mlp', 'hidden_dims': '[256, 128, 64]', 'dropout': 0.2550381440732183, 'batch_norm': True, 'lr': 0.0006769877748701249, 'weight_decay': 4.739890821373183e-06, 'epochs': 129, 'loss': 'mae', 'optimizer': 'adam', 'graph_mode': 'off', 'use_snp_selection': False}. Best is trial 50 with value: 0.13183701202040027.
[I 2025-12-05 15:32:13,715] Trial 103 finished with value: 0.11524696715701038 and parameters: {'model_type': 'mlp', 'hidden_dims': '[256, 128, 64]', 'dropout': 0.22602821537031975, 'batch_norm': True, 'lr': 0.000980408816353231, 'weight_decay': 5.339961113646298e-06, 'epochs': 131, 'loss': 'mae', 'optimizer': 'adam', 'graph_mode': 'off', 'use_snp_selection': False}. Best is trial 50 with value: 0.13183701202040027.
[I 2025-12-05 15:32:14,782] Trial 104 finished with value: 0.11801379972274116 and parameters: {'model_type': 'mlp', 'hidden_dims': '[256, 128, 64]', 'dropout': 0.25897629307579667, 'batch_norm': True, 'lr': 0.0007019148937927822, 'weight_decay': 3.0223388854271623e-06, 'epochs': 161, 'loss': 'mae', 'optimizer': 'adam', 'graph_mode': 'off', 'use_snp_selection': False}. Best is trial 50 with value: 0.13183701202040027.
[I 2025-12-05 15:32:15,769] Trial 105 finished with value: 0.1111769210326642 and parameters: {'model_type': 'mlp', 'hidden_dims': '[256, 128, 64]', 'dropout': 0.2631894312319928, 'batch_norm': True, 'lr': 0.0008329099977668727, 'weight_decay': 8.852625128186125e-06, 'epochs': 134, 'loss': 'mae', 'optimizer': 'adam', 'graph_mode': 'off', 'use_snp_selection': False}. Best is trial 50 with value: 0.13183701202040027.
[I 2025-12-05 15:32:16,730] Trial 106 finished with value: 0.09597686783347271 and parameters: {'model_type': 'mlp', 'hidden_dims': '[256, 128, 64]', 'dropout': 0.24138304006605227, 'batch_norm': True, 'lr': 0.0006381194684114586, 'weight_decay': 3.1162153709429217e-06, 'epochs': 108, 'loss': 'mse', 'optimizer': 'adam', 'graph_mode': 'off', 'use_snp_selection': False}. Best is trial 50 with value: 0.13183701202040027.
[I 2025-12-05 15:32:17,745] Trial 107 finished with value: 0.10832701226973826 and parameters: {'model_type': 'mlp', 'hidden_dims': '[256, 128, 64]', 'dropout': 0.27333470484426825, 'batch_norm': True, 'lr': 0.0009002087654107023, 'weight_decay': 4.505156872517511e-06, 'epochs': 125, 'loss': 'mae', 'optimizer': 'adam', 'graph_mode': 'off', 'use_snp_selection': False}. Best is trial 50 with value: 0.13183701202040027.
[I 2025-12-05 15:32:18,850] Trial 108 finished with value: 0.10139201973769423 and parameters: {'model_type': 'mlp', 'hidden_dims': '[256, 128, 64]', 'dropout': 0.30654580739523857, 'batch_norm': True, 'lr': 0.0007346372694937534, 'weight_decay': 1.8895642936714236e-06, 'epochs': 158, 'loss': 'mae', 'optimizer': 'adam', 'graph_mode': 'off', 'use_snp_selection': False}. Best is trial 50 with value: 0.13183701202040027.
[I 2025-12-05 15:32:19,817] Trial 109 finished with value: 0.10610248923743189 and parameters: {'model_type': 'mlp', 'hidden_dims': '[256, 128, 64]', 'dropout': 0.2540706306636931, 'batch_norm': True, 'lr': 0.0005538371086519454, 'weight_decay': 7.189904215294302e-06, 'epochs': 117, 'loss': 'mae', 'optimizer': 'adam', 'graph_mode': 'off', 'use_snp_selection': False}. Best is trial 50 with value: 0.13183701202040027.
[I 2025-12-05 15:32:21,505] Trial 110 finished with value: 0.10666473644413099 and parameters: {'model_type': 'mlp', 'hidden_dims': '[512, 128]', 'dropout': 0.21187140224461565, 'batch_norm': True, 'lr': 0.0004792878944265002, 'weight_decay': 4.166204344348379e-06, 'epochs': 166, 'loss': 'mae', 'optimizer': 'adam', 'graph_mode': 'off', 'use_snp_selection': False}. Best is trial 50 with value: 0.13183701202040027.
[I 2025-12-05 15:32:22,545] Trial 111 finished with value: 0.1186049179990593 and parameters: {'model_type': 'mlp', 'hidden_dims': '[256, 128, 64]', 'dropout': 0.1938344945866812, 'batch_norm': True, 'lr': 0.0006787479130824589, 'weight_decay': 1.4035997327185874e-05, 'epochs': 149, 'loss': 'mae', 'optimizer': 'adam', 'graph_mode': 'off', 'use_snp_selection': False}. Best is trial 50 with value: 0.13183701202040027.
[I 2025-12-05 15:32:23,587] Trial 112 finished with value: 0.1064352053074374 and parameters: {'model_type': 'mlp', 'hidden_dims': '[256, 128, 64]', 'dropout': 0.2301343530998981, 'batch_norm': True, 'lr': 0.0006738050878338913, 'weight_decay': 1.399913708239282e-05, 'epochs': 149, 'loss': 'mae', 'optimizer': 'adam', 'graph_mode': 'off', 'use_snp_selection': False}. Best is trial 50 with value: 0.13183701202040027.
[I 2025-12-05 15:32:24,714] Trial 113 finished with value: 0.09821358689735532 and parameters: {'model_type': 'mlp', 'hidden_dims': '[256, 128, 64]', 'dropout': 0.18992048759175933, 'batch_norm': True, 'lr': 0.0008457547679748186, 'weight_decay': 2.568604417801975e-06, 'epochs': 177, 'loss': 'mae', 'optimizer': 'adam', 'graph_mode': 'off', 'use_snp_selection': False}. Best is trial 50 with value: 0.13183701202040027.
