[I 2025-12-05 15:18:32,377] Trial 60 finished with value: 0.06562468492048405 and parameters: {'model_type': 'mlp', 'hidden_dims': '[256, 128, 64]', 'dropout': 0.33794664277484165, 'batch_norm': False, 'lr': 0.0006840241013930499, 'weight_decay': 0.0007465590326272661, 'epochs': 257, 'loss': 'mae', 'optimizer': 'adam', 'graph_mode': 'off', 'use_snp_selection': False}. Best is trial 33 with value: 0.08617519563411301.
[I 2025-12-05 15:18:33,578] Trial 61 finished with value: 0.0644022433016399 and parameters: {'model_type': 'mlp', 'hidden_dims': '[256, 128, 64]', 'dropout': 0.15522491969458949, 'batch_norm': True, 'lr': 0.00047646039597982597, 'weight_decay': 0.00035788277668898625, 'epochs': 131, 'loss': 'mae', 'optimizer': 'adam', 'graph_mode': 'off', 'use_snp_selection': False}. Best is trial 33 with value: 0.08617519563411301.
[I 2025-12-05 15:18:34,924] Trial 62 finished with value: 0.07033779026557954 and parameters: {'model_type': 'mlp', 'hidden_dims': '[256, 128, 64]', 'dropout': 0.11462652731487818, 'batch_norm': True, 'lr': 0.00069058342394902, 'weight_decay': 0.00016387033162810515, 'epochs': 176, 'loss': 'mae', 'optimizer': 'adam', 'graph_mode': 'off', 'use_snp_selection': False}. Best is trial 33 with value: 0.08617519563411301.
[I 2025-12-05 15:18:36,286] Trial 63 finished with value: 0.07025076116497123 and parameters: {'model_type': 'mlp', 'hidden_dims': '[256, 128, 64]', 'dropout': 0.10019008561429137, 'batch_norm': True, 'lr': 0.0006270319684549819, 'weight_decay': 0.00017140005917329015, 'epochs': 181, 'loss': 'mae', 'optimizer': 'adam', 'graph_mode': 'off', 'use_snp_selection': False}. Best is trial 33 with value: 0.08617519563411301.
[I 2025-12-05 15:18:37,528] Trial 64 finished with value: 0.06821917766188984 and parameters: {'model_type': 'mlp', 'hidden_dims': '[256, 128, 64]', 'dropout': 0.11582329625559151, 'batch_norm': True, 'lr': 0.0008154583536864044, 'weight_decay': 0.00044586984892121034, 'epochs': 147, 'loss': 'mae', 'optimizer': 'adam', 'graph_mode': 'off', 'use_snp_selection': False}. Best is trial 33 with value: 0.08617519563411301.
[I 2025-12-05 15:18:38,986] Trial 65 finished with value: 0.06083085915032202 and parameters: {'model_type': 'mlp', 'hidden_dims': '[256, 128, 64]', 'dropout': 0.28977696987030716, 'batch_norm': True, 'lr': 0.000534200107275509, 'weight_decay': 0.0002706503824929722, 'epochs': 204, 'loss': 'mae', 'optimizer': 'adam', 'graph_mode': 'off', 'use_snp_selection': False}. Best is trial 33 with value: 0.08617519563411301.
[I 2025-12-05 15:18:40,818] Trial 66 finished with value: 0.07595637942741888 and parameters: {'model_type': 'mlp', 'hidden_dims': '[256, 128, 64]', 'dropout': 0.16415742964329227, 'batch_norm': True, 'lr': 0.0008221492581921904, 'weight_decay': 0.00014951067589187903, 'epochs': 167, 'loss': 'mae', 'optimizer': 'adam', 'graph_mode': 'off', 'use_snp_selection': True, 'num_snps': 22881}. Best is trial 33 with value: 0.08617519563411301.
[I 2025-12-05 15:18:42,615] Trial 67 finished with value: 0.05822928466724653 and parameters: {'model_type': 'mlp', 'hidden_dims': '[256, 128, 64]', 'dropout': 0.16168726810606912, 'batch_norm': True, 'lr': 0.0008165006949921907, 'weight_decay': 2.112532858131444e-07, 'epochs': 221, 'loss': 'mse', 'optimizer': 'adam', 'graph_mode': 'off', 'use_snp_selection': True, 'num_snps': 18545}. Best is trial 33 with value: 0.08617519563411301.
[I 2025-12-05 15:18:45,225] Trial 68 finished with value: 0.06524707035918119 and parameters: {'model_type': 'mlp', 'hidden_dims': '[512, 128]', 'dropout': 0.17953142110690326, 'batch_norm': True, 'lr': 0.00040846852274516665, 'weight_decay': 0.000712197538733174, 'epochs': 287, 'loss': 'mae', 'optimizer': 'adam', 'graph_mode': 'off', 'use_snp_selection': True, 'num_snps': 26304}. Best is trial 33 with value: 0.08617519563411301.
[I 2025-12-05 15:18:46,785] Trial 69 finished with value: 0.03649716350073033 and parameters: {'model_type': 'mlp', 'hidden_dims': '[256, 128, 64]', 'dropout': 0.13747803262346964, 'batch_norm': True, 'lr': 2.41591104920386e-05, 'weight_decay': 5.347253065183707e-05, 'epochs': 336, 'loss': 'mae', 'optimizer': 'adam', 'graph_mode': 'off', 'use_snp_selection': True, 'num_snps': 3415}. Best is trial 33 with value: 0.08617519563411301.
[I 2025-12-05 15:18:49,851] Trial 70 finished with value: 0.012149112020550558 and parameters: {'model_type': 'mlp', 'hidden_dims': '[512, 128]', 'dropout': 0.2054394577453183, 'batch_norm': True, 'lr': 1.6380591506453602e-05, 'weight_decay': 0.0009898169817034886, 'epochs': 168, 'loss': 'mae', 'optimizer': 'adam', 'graph_mode': 'off', 'use_snp_selection': True, 'num_snps': 41784}. Best is trial 33 with value: 0.08617519563411301.
[I 2025-12-05 15:18:52,000] Trial 71 finished with value: 0.057988418584657676 and parameters: {'model_type': 'mlp', 'hidden_dims': '[256, 128, 64]', 'dropout': 0.11657074116875533, 'batch_norm': True, 'lr': 0.0005762452459924252, 'weight_decay': 0.00015274247372423753, 'epochs': 182, 'loss': 'mae', 'optimizer': 'adam', 'graph_mode': 'off', 'use_snp_selection': True, 'num_snps': 29006}. Best is trial 33 with value: 0.08617519563411301.
[I 2025-12-05 15:18:53,335] Trial 72 finished with value: 0.07076450990793041 and parameters: {'model_type': 'mlp', 'hidden_dims': '[256, 128, 64]', 'dropout': 0.14957345093188004, 'batch_norm': True, 'lr': 0.0007430554950793904, 'weight_decay': 0.00032822941981308927, 'epochs': 175, 'loss': 'mae', 'optimizer': 'adam', 'graph_mode': 'off', 'use_snp_selection': False}. Best is trial 33 with value: 0.08617519563411301.
[I 2025-12-05 15:18:54,754] Trial 73 finished with value: 0.08745127049003182 and parameters: {'model_type': 'mlp', 'hidden_dims': '[256, 128, 64]', 'dropout': 0.15062428384393495, 'batch_norm': True, 'lr': 0.0008290004232450333, 'weight_decay': 0.00030102880184841325, 'epochs': 198, 'loss': 'mae', 'optimizer': 'adam', 'graph_mode': 'off', 'use_snp_selection': False}. Best is trial 73 with value: 0.08745127049003182.
[I 2025-12-05 15:18:55,970] Trial 74 finished with value: 0.06403866153492051 and parameters: {'model_type': 'mlp', 'hidden_dims': '[256, 128, 64]', 'dropout': 0.14649549215677224, 'batch_norm': True, 'lr': 0.0008705868108207442, 'weight_decay': 0.0003255981506477436, 'epochs': 140, 'loss': 'mae', 'optimizer': 'adam', 'graph_mode': 'off', 'use_snp_selection': False}. Best is trial 73 with value: 0.08745127049003182.
[I 2025-12-05 15:18:57,487] Trial 75 finished with value: 0.050934377447257484 and parameters: {'model_type': 'mlp', 'hidden_dims': '[256, 128, 64]', 'dropout': 0.17344655211822943, 'batch_norm': True, 'lr': 0.00047377021490579323, 'weight_decay': 0.000414683413150819, 'epochs': 198, 'loss': 'mae', 'optimizer': 'adam', 'graph_mode': 'off', 'use_snp_selection': True, 'num_snps': 11403}. Best is trial 73 with value: 0.08745127049003182.
[I 2025-12-05 15:18:58,796] Trial 76 finished with value: 0.0575190893439137 and parameters: {'model_type': 'mlp', 'hidden_dims': '[256, 128, 64]', 'dropout': 0.12996709253646194, 'batch_norm': True, 'lr': 0.0003465259307385651, 'weight_decay': 0.00023896511478510557, 'epochs': 167, 'loss': 'mae', 'optimizer': 'adam', 'graph_mode': 'off', 'use_snp_selection': False}. Best is trial 73 with value: 0.08745127049003182.
[I 2025-12-05 15:19:00,021] Trial 77 finished with value: 0.056571472624324354 and parameters: {'model_type': 'mlp', 'hidden_dims': '[256, 128, 64]', 'dropout': 0.1601073330031733, 'batch_norm': False, 'lr': 0.0007511941153172707, 'weight_decay': 0.0005194627562701606, 'epochs': 155, 'loss': 'mae', 'optimizer': 'adam', 'graph_mode': 'off', 'use_snp_selection': False}. Best is trial 73 with value: 0.08745127049003182.
[I 2025-12-05 15:19:01,956] Trial 78 finished with value: 0.07072261140891307 and parameters: {'model_type': 'mlp', 'hidden_dims': '[256, 128, 64]', 'dropout': 0.23586316739231367, 'batch_norm': True, 'lr': 0.0009880744598941519, 'weight_decay': 0.0003055526808044078, 'epochs': 327, 'loss': 'mae', 'optimizer': 'adam', 'graph_mode': 'off', 'use_snp_selection': False}. Best is trial 73 with value: 0.08745127049003182.
[I 2025-12-05 15:19:03,956] Trial 79 finished with value: 0.05994505565768834 and parameters: {'model_type': 'mlp', 'hidden_dims': '[256, 128, 64]', 'dropout': 0.149974360126088, 'batch_norm': True, 'lr': 0.0003950128758084922, 'weight_decay': 9.767685618089023e-05, 'epochs': 344, 'loss': 'mse', 'optimizer': 'adam', 'graph_mode': 'off', 'use_snp_selection': False}. Best is trial 73 with value: 0.08745127049003182.
[I 2025-12-05 15:19:05,516] Trial 80 finished with value: 0.06721601570587953 and parameters: {'model_type': 'mlp', 'hidden_dims': '[256, 128]', 'dropout': 0.1286783670601787, 'batch_norm': True, 'lr': 0.0005985945364593832, 'weight_decay': 0.0006421936458720584, 'epochs': 247, 'loss': 'mae', 'optimizer': 'adam', 'graph_mode': 'off', 'use_snp_selection': True, 'num_snps': 12270}. Best is trial 73 with value: 0.08745127049003182.
[I 2025-12-05 15:19:07,441] Trial 81 finished with value: 0.08101873120078466 and parameters: {'model_type': 'mlp', 'hidden_dims': '[256, 128, 64]', 'dropout': 0.22985578924848146, 'batch_norm': True, 'lr': 0.0009692671683355749, 'weight_decay': 0.00029932934268473495, 'epochs': 321, 'loss': 'mae', 'optimizer': 'adam', 'graph_mode': 'off', 'use_snp_selection': False}. Best is trial 73 with value: 0.08745127049003182.
[I 2025-12-05 15:19:09,286] Trial 82 finished with value: 0.06396556530725837 and parameters: {'model_type': 'mlp', 'hidden_dims': '[256, 128, 64]', 'dropout': 0.1938695316110132, 'batch_norm': True, 'lr': 0.000855313320672916, 'weight_decay': 0.0001972678164809772, 'epochs': 303, 'loss': 'mae', 'optimizer': 'adam', 'graph_mode': 'off', 'use_snp_selection': False}. Best is trial 73 with value: 0.08745127049003182.
[I 2025-12-05 15:19:11,164] Trial 83 finished with value: 0.06646723312203723 and parameters: {'model_type': 'mlp', 'hidden_dims': '[256, 128, 64]', 'dropout': 0.21528704267628224, 'batch_norm': True, 'lr': 0.0006029864683074525, 'weight_decay': 0.00039703893558397596, 'epochs': 313, 'loss': 'mae', 'optimizer': 'adam', 'graph_mode': 'off', 'use_snp_selection': False}. Best is trial 73 with value: 0.08745127049003182.
[I 2025-12-05 15:19:12,338] Trial 84 finished with value: 0.06766544110286662 and parameters: {'model_type': 'mlp', 'hidden_dims': '[128, 64]', 'dropout': 0.17085116138215245, 'batch_norm': True, 'lr': 0.0007146903239456741, 'weight_decay': 0.00014498019139856509, 'epochs': 294, 'loss': 'mae', 'optimizer': 'adam', 'graph_mode': 'off', 'use_snp_selection': False}. Best is trial 73 with value: 0.08745127049003182.
[I 2025-12-05 15:19:13,716] Trial 85 finished with value: 0.053403244123372995 and parameters: {'model_type': 'mlp', 'hidden_dims': '[256, 128, 64]', 'dropout': 0.1127983088430453, 'batch_norm': True, 'lr': 0.00045035696670368185, 'weight_decay': 0.00020896040756792744, 'epochs': 186, 'loss': 'mae', 'optimizer': 'adam', 'graph_mode': 'off', 'use_snp_selection': False}. Best is trial 73 with value: 0.08745127049003182.
[I 2025-12-05 15:19:15,641] Trial 86 finished with value: 0.07072923645916286 and parameters: {'model_type': 'mlp', 'hidden_dims': '[256, 128, 64]', 'dropout': 0.14256785619768636, 'batch_norm': True, 'lr': 0.0003252110760001671, 'weight_decay': 0.0005702019174269034, 'epochs': 319, 'loss': 'mae', 'optimizer': 'adam', 'graph_mode': 'off', 'use_snp_selection': False}. Best is trial 73 with value: 0.08745127049003182.
[I 2025-12-05 15:19:18,996] Trial 87 finished with value: -0.007994618515181665 and parameters: {'model_type': 'mlp', 'hidden_dims': '[512, 64]', 'dropout': 0.18568007146046783, 'batch_norm': True, 'lr': 9.998743964995522e-06, 'weight_decay': 7.195144549283658e-05, 'epochs': 329, 'loss': 'mae', 'optimizer': 'adam', 'graph_mode': 'off', 'use_snp_selection': False}. Best is trial 73 with value: 0.08745127049003182.
[I 2025-12-05 15:19:21,006] Trial 88 finished with value: 0.07382330046631576 and parameters: {'model_type': 'mlp', 'hidden_dims': '[256, 128, 64]', 'dropout': 0.16368087678669935, 'batch_norm': True, 'lr': 0.0009499708221120643, 'weight_decay': 0.000311169517304098, 'epochs': 345, 'loss': 'mae', 'optimizer': 'adam', 'graph_mode': 'off', 'use_snp_selection': False}. Best is trial 73 with value: 0.08745127049003182.
[I 2025-12-05 15:19:22,978] Trial 89 finished with value: 0.08484318881928199 and parameters: {'model_type': 'mlp', 'hidden_dims': '[256, 128, 64]', 'dropout': 0.13006128426603047, 'batch_norm': True, 'lr': 0.0009359281468573935, 'weight_decay': 0.00010911192104039606, 'epochs': 334, 'loss': 'mae', 'optimizer': 'adam', 'graph_mode': 'off', 'use_snp_selection': False}. Best is trial 73 with value: 0.08745127049003182.
[I 2025-12-05 15:19:24,910] Trial 90 finished with value: 0.05510136635779967 and parameters: {'model_type': 'mlp', 'hidden_dims': '[256, 128]', 'dropout': 0.1005488630105722, 'batch_norm': False, 'lr': 3.562056918018235e-05, 'weight_decay': 0.00011083759607192912, 'epochs': 341, 'loss': 'mse', 'optimizer': 'adam', 'graph_mode': 'off', 'use_snp_selection': False}. Best is trial 73 with value: 0.08745127049003182.
[I 2025-12-05 15:19:26,945] Trial 91 finished with value: 0.07937214358544051 and parameters: {'model_type': 'mlp', 'hidden_dims': '[256, 128, 64]', 'dropout': 0.16122574210396753, 'batch_norm': True, 'lr': 0.0009674109464705447, 'weight_decay': 0.00023583802137760952, 'epochs': 348, 'loss': 'mae', 'optimizer': 'adam', 'graph_mode': 'off', 'use_snp_selection': False}. Best is trial 73 with value: 0.08745127049003182.
[I 2025-12-05 15:19:28,948] Trial 92 finished with value: 0.07757934887536623 and parameters: {'model_type': 'mlp', 'hidden_dims': '[256, 128, 64]', 'dropout': 0.16520746255532917, 'batch_norm': True, 'lr': 0.0009735362445525311, 'weight_decay': 0.0002605703863233213, 'epochs': 343, 'loss': 'mae', 'optimizer': 'adam', 'graph_mode': 'off', 'use_snp_selection': False}. Best is trial 73 with value: 0.08745127049003182.
[I 2025-12-05 15:19:30,904] Trial 93 finished with value: 0.06344273214196389 and parameters: {'model_type': 'mlp', 'hidden_dims': '[256, 128, 64]', 'dropout': 0.13346430909012078, 'batch_norm': True, 'lr': 0.0005438038446182226, 'weight_decay': 0.00026686978918383935, 'epochs': 330, 'loss': 'mae', 'optimizer': 'adam', 'graph_mode': 'off', 'use_snp_selection': False}. Best is trial 73 with value: 0.08745127049003182.
[I 2025-12-05 15:19:32,932] Trial 94 finished with value: 0.060428413905135286 and parameters: {'model_type': 'mlp', 'hidden_dims': '[256, 128, 64]', 'dropout': 0.42278451885517926, 'batch_norm': True, 'lr': 0.0008386288723043553, 'weight_decay': 0.00011660194567726792, 'epochs': 349, 'loss': 'mae', 'optimizer': 'adam', 'graph_mode': 'off', 'use_snp_selection': False}. Best is trial 73 with value: 0.08745127049003182.
[I 2025-12-05 15:19:34,849] Trial 95 finished with value: 0.0758788744780496 and parameters: {'model_type': 'mlp', 'hidden_dims': '[256, 128, 64]', 'dropout': 0.12349839284083955, 'batch_norm': True, 'lr': 0.0008925997720321496, 'weight_decay': 0.00045333962562988343, 'epochs': 321, 'loss': 'mae', 'optimizer': 'adam', 'graph_mode': 'off', 'use_snp_selection': False}. Best is trial 73 with value: 0.08745127049003182.
[I 2025-12-05 15:19:36,080] Trial 96 finished with value: 0.06557156706158958 and parameters: {'model_type': 'mlp', 'hidden_dims': '[128, 64]', 'dropout': 0.17589599036542594, 'batch_norm': True, 'lr': 0.00020350765828920967, 'weight_decay': 8.293075026744053e-05, 'epochs': 307, 'loss': 'mae', 'optimizer': 'adam', 'graph_mode': 'off', 'use_snp_selection': False}. Best is trial 73 with value: 0.08745127049003182.
[I 2025-12-05 15:19:38,098] Trial 97 finished with value: 0.07102883888846652 and parameters: {'model_type': 'mlp', 'hidden_dims': '[256, 128, 64]', 'dropout': 0.11107479449664855, 'batch_norm': True, 'lr': 0.0007763913645311457, 'weight_decay': 0.00017981298355362673, 'epochs': 337, 'loss': 'mae', 'optimizer': 'adam', 'graph_mode': 'off', 'use_snp_selection': False}. Best is trial 73 with value: 0.08745127049003182.
[I 2025-12-05 15:19:41,510] Trial 98 finished with value: 0.06376485817188388 and parameters: {'model_type': 'mlp', 'hidden_dims': '[256, 128, 64]', 'dropout': 0.21052090812270255, 'batch_norm': True, 'lr': 0.0005629282925925461, 'weight_decay': 4.0787643015897304e-05, 'epochs': 332, 'loss': 'mae', 'optimizer': 'adam', 'graph_mode': 'off', 'use_snp_selection': True, 'num_snps': 51258}. Best is trial 73 with value: 0.08745127049003182.
[I 2025-12-05 15:19:44,842] Trial 99 finished with value: 0.07560577571260071 and parameters: {'model_type': 'mlp', 'hidden_dims': '[512, 128]', 'dropout': 0.19429325245483905, 'batch_norm': True, 'lr': 0.0009951208849996462, 'weight_decay': 0.00013542238819126812, 'epochs': 320, 'loss': 'mae', 'optimizer': 'adam', 'graph_mode': 'off', 'use_snp_selection': False}. Best is trial 73 with value: 0.08745127049003182.
[I 2025-12-05 15:19:48,293] Trial 100 finished with value: 0.06990886201271788 and parameters: {'model_type': 'mlp', 'hidden_dims': '[512, 64]', 'dropout': 0.16588012048076223, 'batch_norm': True, 'lr': 0.0004474584207610126, 'weight_decay': 6.741600694644364e-05, 'epochs': 339, 'loss': 'mae', 'optimizer': 'adam', 'graph_mode': 'off', 'use_snp_selection': False}. Best is trial 73 with value: 0.08745127049003182.
[I 2025-12-05 15:19:50,253] Trial 101 finished with value: 0.07821957946929141 and parameters: {'model_type': 'mlp', 'hidden_dims': '[256, 128, 64]', 'dropout': 0.12563089989359236, 'batch_norm': True, 'lr': 0.0008868236663187305, 'weight_decay': 0.0004668288596561606, 'epochs': 322, 'loss': 'mae', 'optimizer': 'adam', 'graph_mode': 'off', 'use_snp_selection': False}. Best is trial 73 with value: 0.08745127049003182.
[I 2025-12-05 15:19:52,191] Trial 102 finished with value: 0.06672938242789007 and parameters: {'model_type': 'mlp', 'hidden_dims': '[256, 128, 64]', 'dropout': 0.13538316580360515, 'batch_norm': True, 'lr': 0.0006675711692337052, 'weight_decay': 0.000830318715249354, 'epochs': 325, 'loss': 'mae', 'optimizer': 'adam', 'graph_mode': 'off', 'use_snp_selection': False}. Best is trial 73 with value: 0.08745127049003182.
[I 2025-12-05 15:19:54,116] Trial 103 finished with value: 0.07346520371786092 and parameters: {'model_type': 'mlp', 'hidden_dims': '[256, 128, 64]', 'dropout': 0.1251390697076865, 'batch_norm': True, 'lr': 0.0008429174548410869, 'weight_decay': 0.00046425363169601914, 'epochs': 311, 'loss': 'mae', 'optimizer': 'adam', 'graph_mode': 'off', 'use_snp_selection': False}. Best is trial 73 with value: 0.08745127049003182.
[I 2025-12-05 15:19:56,138] Trial 104 finished with value: 0.06761730254953209 and parameters: {'model_type': 'mlp', 'hidden_dims': '[256, 128, 64]', 'dropout': 0.10791975075221241, 'batch_norm': True, 'lr': 0.0005259288639506896, 'weight_decay': 0.00023440432802690996, 'epochs': 344, 'loss': 'mae', 'optimizer': 'adam', 'graph_mode': 'off', 'use_snp_selection': False}. Best is trial 73 with value: 0.08745127049003182.
[I 2025-12-05 15:19:59,675] Trial 105 finished with value: 0.07486647413038389 and parameters: {'model_type': 'mlp', 'hidden_dims': '[512, 256]', 'dropout': 0.15177048391313455, 'batch_norm': True, 'lr': 0.0006587343351030432, 'weight_decay': 0.00036048600304954746, 'epochs': 350, 'loss': 'mae', 'optimizer': 'adam', 'graph_mode': 'off', 'use_snp_selection': False}. Best is trial 73 with value: 0.08745127049003182.
[I 2025-12-05 15:20:01,682] Trial 106 finished with value: 0.03336220511715535 and parameters: {'model_type': 'mlp', 'hidden_dims': '[256, 128, 64]', 'dropout': 0.22732294058417613, 'batch_norm': True, 'lr': 2.6945423795241193e-05, 'weight_decay': 0.000251190066438963, 'epochs': 336, 'loss': 'mae', 'optimizer': 'adam', 'graph_mode': 'off', 'use_snp_selection': False}. Best is trial 73 with value: 0.08745127049003182.
[I 2025-12-05 15:20:03,605] Trial 107 finished with value: 0.04544983359559067 and parameters: {'model_type': 'mlp', 'hidden_dims': '[256, 128, 64]', 'dropout': 0.18204088878753402, 'batch_norm': True, 'lr': 1.5860625335989242e-05, 'weight_decay': 0.00028618285336245205, 'epochs': 321, 'loss': 'mae', 'optimizer': 'adam', 'graph_mode': 'off', 'use_snp_selection': False}. Best is trial 73 with value: 0.08745127049003182.
[I 2025-12-05 15:20:06,581] Trial 108 finished with value: 0.07001375646643707 and parameters: {'model_type': 'mlp', 'hidden_dims': '[512, 256]', 'dropout': 0.13741981726582284, 'batch_norm': True, 'lr': 0.0007753719019491052, 'weight_decay': 2.412472672715603e-05, 'epochs': 279, 'loss': 'mae', 'optimizer': 'adam', 'graph_mode': 'off', 'use_snp_selection': False}. Best is trial 73 with value: 0.08745127049003182.
[I 2025-12-05 15:20:09,166] Trial 109 finished with value: 0.04175293426097301 and parameters: {'model_type': 'mlp', 'hidden_dims': '[256, 128, 64]', 'dropout': 0.5387378500318457, 'batch_norm': False, 'lr': 0.00041010718549286, 'weight_decay': 0.00018842092283924164, 'epochs': 300, 'loss': 'mae', 'optimizer': 'adam', 'graph_mode': 'off', 'use_snp_selection': True, 'num_snps': 36471}. Best is trial 73 with value: 0.08745127049003182.
[I 2025-12-05 15:20:12,556] Trial 110 finished with value: 0.06140119197569782 and parameters: {'model_type': 'mlp', 'hidden_dims': '[512, 128]', 'dropout': 0.1579377404401416, 'batch_norm': True, 'lr': 0.000977384953244559, 'weight_decay': 0.0006225250310489182, 'epochs': 332, 'loss': 'mse', 'optimizer': 'adam', 'graph_mode': 'off', 'use_snp_selection': False}. Best is trial 73 with value: 0.08745127049003182.
[I 2025-12-05 15:20:14,465] Trial 111 finished with value: 0.08102570175183295 and parameters: {'model_type': 'mlp', 'hidden_dims': '[256, 128, 64]', 'dropout': 0.12237733229939654, 'batch_norm': True, 'lr': 0.0008969758959303029, 'weight_decay': 0.000454499010615999, 'epochs': 317, 'loss': 'mae', 'optimizer': 'adam', 'graph_mode': 'off', 'use_snp_selection': False}. Best is trial 73 with value: 0.08745127049003182.
