[I 2025-12-06 12:20:09,472] Trial 124 finished with value: 0.24146949939159462 and parameters: {'model_type': 'mlp', 'hidden_dims': '[512, 64]', 'dropout': 0.40109734920005813, 'batch_norm': False, 'lr': 1.1010627949015704e-05, 'weight_decay': 4.146387940125566e-05, 'epochs': 227, 'loss': 'mse', 'optimizer': 'adam', 'graph_mode': 'off', 'use_snp_selection': True, 'num_snps': 18141}. Best is trial 114 with value: 0.2595925061824989.
[I 2025-12-06 12:21:08,150] Trial 125 finished with value: 0.24704903240004614 and parameters: {'model_type': 'mlp', 'hidden_dims': '[512, 64]', 'dropout': 0.3520514290915221, 'batch_norm': False, 'lr': 5.467138383784286e-06, 'weight_decay': 7.99823472725501e-06, 'epochs': 242, 'loss': 'mse', 'optimizer': 'adam', 'graph_mode': 'off', 'use_snp_selection': True, 'num_snps': 22169}. Best is trial 114 with value: 0.2595925061824989.
[I 2025-12-06 12:22:13,466] Trial 126 finished with value: 0.24762627052843683 and parameters: {'model_type': 'mlp', 'hidden_dims': '[512, 64]', 'dropout': 0.432324352002572, 'batch_norm': False, 'lr': 7.601914121644881e-06, 'weight_decay': 1.2704902845480339e-05, 'epochs': 265, 'loss': 'mse', 'optimizer': 'adam', 'graph_mode': 'off', 'use_snp_selection': True, 'num_snps': 25487}. Best is trial 114 with value: 0.2595925061824989.
[I 2025-12-06 12:23:12,735] Trial 127 finished with value: 0.24750155256025078 and parameters: {'model_type': 'mlp', 'hidden_dims': '[512, 64]', 'dropout': 0.3795326736903439, 'batch_norm': False, 'lr': 1.3353483176739654e-05, 'weight_decay': 3.3403334006282647e-06, 'epochs': 285, 'loss': 'mse', 'optimizer': 'adam', 'graph_mode': 'off', 'use_snp_selection': True, 'num_snps': 19863}. Best is trial 114 with value: 0.2595925061824989.
[I 2025-12-06 12:24:09,473] Trial 128 finished with value: 0.25175298963010123 and parameters: {'model_type': 'mlp', 'hidden_dims': '[512, 64]', 'dropout': 0.41596930753364425, 'batch_norm': False, 'lr': 1.7894122809278828e-05, 'weight_decay': 2.184824999838087e-05, 'epochs': 185, 'loss': 'mse', 'optimizer': 'adam', 'graph_mode': 'off', 'use_snp_selection': True, 'num_snps': 24745}. Best is trial 114 with value: 0.2595925061824989.
[I 2025-12-06 12:25:11,655] Trial 129 finished with value: 0.2522502512749816 and parameters: {'model_type': 'mlp', 'hidden_dims': '[512, 256]', 'dropout': 0.411923471484099, 'batch_norm': False, 'lr': 1.774535712825178e-05, 'weight_decay': 2.4210409765901634e-05, 'epochs': 235, 'loss': 'mae', 'optimizer': 'adam', 'graph_mode': 'off', 'use_snp_selection': True, 'num_snps': 24810}. Best is trial 114 with value: 0.2595925061824989.
[I 2025-12-06 12:26:11,981] Trial 130 finished with value: 0.2612774315674168 and parameters: {'model_type': 'mlp', 'hidden_dims': '[512, 256]', 'dropout': 0.4178781851738196, 'batch_norm': False, 'lr': 1.8007901133423746e-05, 'weight_decay': 2.226072670343818e-05, 'epochs': 237, 'loss': 'mae', 'optimizer': 'adam', 'graph_mode': 'off', 'use_snp_selection': True, 'num_snps': 23308}. Best is trial 130 with value: 0.2612774315674168.
[I 2025-12-06 12:27:12,504] Trial 131 finished with value: 0.2477756745607088 and parameters: {'model_type': 'mlp', 'hidden_dims': '[512, 256]', 'dropout': 0.40931453536815815, 'batch_norm': False, 'lr': 1.9879074413703878e-05, 'weight_decay': 2.3274649794689143e-05, 'epochs': 236, 'loss': 'mae', 'optimizer': 'adam', 'graph_mode': 'off', 'use_snp_selection': True, 'num_snps': 23076}. Best is trial 130 with value: 0.2612774315674168.
[I 2025-12-06 12:28:16,286] Trial 132 finished with value: 0.24652047689799966 and parameters: {'model_type': 'mlp', 'hidden_dims': '[512, 256]', 'dropout': 0.4194716617631547, 'batch_norm': False, 'lr': 1.6536521447697056e-05, 'weight_decay': 1.788005293952772e-05, 'epochs': 247, 'loss': 'mae', 'optimizer': 'adam', 'graph_mode': 'off', 'use_snp_selection': True, 'num_snps': 25277}. Best is trial 130 with value: 0.2612774315674168.
[I 2025-12-06 12:29:18,938] Trial 133 finished with value: 0.25406091944687226 and parameters: {'model_type': 'mlp', 'hidden_dims': '[512, 256]', 'dropout': 0.4254490610236154, 'batch_norm': False, 'lr': 1.8666645076752798e-05, 'weight_decay': 2.817835448112888e-05, 'epochs': 259, 'loss': 'mae', 'optimizer': 'adam', 'graph_mode': 'off', 'use_snp_selection': True, 'num_snps': 23467}. Best is trial 130 with value: 0.2612774315674168.
[I 2025-12-06 12:30:14,632] Trial 134 finished with value: 0.24914058122080412 and parameters: {'model_type': 'mlp', 'hidden_dims': '[512, 256]', 'dropout': 0.4019589011159386, 'batch_norm': False, 'lr': 2.2103004562598005e-05, 'weight_decay': 2.5626216132718214e-05, 'epochs': 257, 'loss': 'mae', 'optimizer': 'adam', 'graph_mode': 'off', 'use_snp_selection': True, 'num_snps': 18802}. Best is trial 130 with value: 0.2612774315674168.
[I 2025-12-06 12:31:06,967] Trial 135 finished with value: 0.25182183407646896 and parameters: {'model_type': 'mlp', 'hidden_dims': '[512, 256]', 'dropout': 0.4182714084091692, 'batch_norm': False, 'lr': 1.76177956536419e-05, 'weight_decay': 1.6024266041833994e-05, 'epochs': 243, 'loss': 'mae', 'optimizer': 'adam', 'graph_mode': 'off', 'use_snp_selection': True, 'num_snps': 17105}. Best is trial 130 with value: 0.2612774315674168.
[I 2025-12-06 12:32:26,525] Trial 136 finished with value: 0.2315906551999667 and parameters: {'model_type': 'mlp', 'hidden_dims': '[512, 256]', 'dropout': 0.4124924873872236, 'batch_norm': False, 'lr': 1.7732023041169117e-05, 'weight_decay': 4.52948274372803e-05, 'epochs': 267, 'loss': 'mae', 'optimizer': 'adam', 'graph_mode': 'off', 'use_snp_selection': False}. Best is trial 130 with value: 0.2612774315674168.
[I 2025-12-06 12:33:19,681] Trial 137 finished with value: 0.25228116591042343 and parameters: {'model_type': 'mlp', 'hidden_dims': '[512, 256]', 'dropout': 0.38732441421689817, 'batch_norm': False, 'lr': 1.3819238332914515e-05, 'weight_decay': 2.0856943299356403e-05, 'epochs': 243, 'loss': 'mae', 'optimizer': 'adam', 'graph_mode': 'off', 'use_snp_selection': True, 'num_snps': 17095}. Best is trial 130 with value: 0.2612774315674168.
[I 2025-12-06 12:34:04,795] Trial 138 finished with value: 0.23015881272574057 and parameters: {'model_type': 'mlp', 'hidden_dims': '[512, 256]', 'dropout': 0.39292368368145625, 'batch_norm': False, 'lr': 1.4715889035520971e-05, 'weight_decay': 2.1295062841264255e-05, 'epochs': 258, 'loss': 'mae', 'optimizer': 'adam', 'graph_mode': 'off', 'use_snp_selection': True, 'num_snps': 10466}. Best is trial 130 with value: 0.2612774315674168.
[I 2025-12-06 12:34:56,781] Trial 139 finished with value: 0.2519862018409996 and parameters: {'model_type': 'mlp', 'hidden_dims': '[512, 256]', 'dropout': 0.43214000560619137, 'batch_norm': False, 'lr': 2.5988743359120423e-05, 'weight_decay': 1.8474837312634653e-05, 'epochs': 242, 'loss': 'mae', 'optimizer': 'adam', 'graph_mode': 'off', 'use_snp_selection': True, 'num_snps': 16669}. Best is trial 130 with value: 0.2612774315674168.
[I 2025-12-06 12:35:43,372] Trial 140 finished with value: 0.23469274404375207 and parameters: {'model_type': 'mlp', 'hidden_dims': '[512, 256]', 'dropout': 0.43120684499712, 'batch_norm': False, 'lr': 2.834599320713018e-05, 'weight_decay': 3.668300262053511e-05, 'epochs': 245, 'loss': 'mae', 'optimizer': 'adam', 'graph_mode': 'off', 'use_snp_selection': True, 'num_snps': 12153}. Best is trial 130 with value: 0.2612774315674168.
[I 2025-12-06 12:36:35,746] Trial 141 finished with value: 0.24172818384621547 and parameters: {'model_type': 'mlp', 'hidden_dims': '[512, 256]', 'dropout': 0.41662684015878104, 'batch_norm': False, 'lr': 2.133563124562844e-05, 'weight_decay': 1.8056927260990194e-05, 'epochs': 238, 'loss': 'mae', 'optimizer': 'adam', 'graph_mode': 'off', 'use_snp_selection': True, 'num_snps': 17110}. Best is trial 130 with value: 0.2612774315674168.
[I 2025-12-06 12:37:27,710] Trial 142 finished with value: 0.24972318924506948 and parameters: {'model_type': 'mlp', 'hidden_dims': '[512, 256]', 'dropout': 0.4387072938247544, 'batch_norm': False, 'lr': 2.447974304018998e-05, 'weight_decay': 2.772541908137908e-05, 'epochs': 282, 'loss': 'mae', 'optimizer': 'adam', 'graph_mode': 'off', 'use_snp_selection': True, 'num_snps': 14651}. Best is trial 130 with value: 0.2612774315674168.
[I 2025-12-06 12:38:18,522] Trial 143 finished with value: 0.2569414444632965 and parameters: {'model_type': 'mlp', 'hidden_dims': '[512, 256]', 'dropout': 0.3855447163255523, 'batch_norm': False, 'lr': 1.8265162556600954e-05, 'weight_decay': 2.0157335599563798e-05, 'epochs': 227, 'loss': 'mae', 'optimizer': 'adam', 'graph_mode': 'off', 'use_snp_selection': True, 'num_snps': 16103}. Best is trial 130 with value: 0.2612774315674168.
[I 2025-12-06 12:39:09,407] Trial 144 finished with value: 0.25410294091226077 and parameters: {'model_type': 'mlp', 'hidden_dims': '[512, 256]', 'dropout': 0.3978359484961648, 'batch_norm': False, 'lr': 1.4163422325770951e-05, 'weight_decay': 1.4102756075801034e-05, 'epochs': 228, 'loss': 'mae', 'optimizer': 'adam', 'graph_mode': 'off', 'use_snp_selection': True, 'num_snps': 16244}. Best is trial 130 with value: 0.2612774315674168.
[I 2025-12-06 12:39:58,889] Trial 145 finished with value: 0.2553455844946854 and parameters: {'model_type': 'mlp', 'hidden_dims': '[512, 256]', 'dropout': 0.39050470573239654, 'batch_norm': False, 'lr': 1.4127577629643112e-05, 'weight_decay': 8.865981990489406e-06, 'epochs': 229, 'loss': 'mae', 'optimizer': 'adam', 'graph_mode': 'off', 'use_snp_selection': True, 'num_snps': 15391}. Best is trial 130 with value: 0.2612774315674168.
[I 2025-12-06 12:40:48,279] Trial 146 finished with value: 0.25864057359905374 and parameters: {'model_type': 'mlp', 'hidden_dims': '[512, 256]', 'dropout': 0.384517713691568, 'batch_norm': False, 'lr': 1.4095743358464627e-05, 'weight_decay': 8.684085065786932e-06, 'epochs': 227, 'loss': 'mae', 'optimizer': 'adam', 'graph_mode': 'off', 'use_snp_selection': True, 'num_snps': 15530}. Best is trial 130 with value: 0.2612774315674168.
[I 2025-12-06 12:41:31,084] Trial 147 finished with value: 0.2435798059797598 and parameters: {'model_type': 'mlp', 'hidden_dims': '[512, 256]', 'dropout': 0.39346751486009957, 'batch_norm': False, 'lr': 1.3431004495811345e-05, 'weight_decay': 9.330458935382124e-06, 'epochs': 228, 'loss': 'mae', 'optimizer': 'adam', 'graph_mode': 'off', 'use_snp_selection': True, 'num_snps': 10212}. Best is trial 130 with value: 0.2612774315674168.
[I 2025-12-06 12:42:19,787] Trial 148 finished with value: 0.25952728334771885 and parameters: {'model_type': 'mlp', 'hidden_dims': '[512, 256]', 'dropout': 0.38731288501566713, 'batch_norm': False, 'lr': 8.395956186457695e-06, 'weight_decay': 6.580236068158003e-06, 'epochs': 217, 'loss': 'mae', 'optimizer': 'adam', 'graph_mode': 'off', 'use_snp_selection': True, 'num_snps': 15468}. Best is trial 130 with value: 0.2612774315674168.
[I 2025-12-06 12:43:07,255] Trial 149 finished with value: 0.24790403218378118 and parameters: {'model_type': 'mlp', 'hidden_dims': '[512, 256]', 'dropout': 0.3824402701935239, 'batch_norm': False, 'lr': 1.457999743680196e-05, 'weight_decay': 5.147115766290807e-06, 'epochs': 216, 'loss': 'mae', 'optimizer': 'adam', 'graph_mode': 'off', 'use_snp_selection': True, 'num_snps': 14008}. Best is trial 130 with value: 0.2612774315674168.
[I 2025-12-06 12:44:14,869] Trial 0 finished with value: 0.22847785031245058 and parameters: {'model_type': 'mlp', 'hidden_dims': '[128, 64]', 'dropout': 0.199031432379812, 'batch_norm': True, 'lr': 1.8408544111075837e-06, 'weight_decay': 5.5136510071208614e-05, 'epochs': 336, 'loss': 'mae', 'optimizer': 'adam', 'graph_mode': 'off', 'use_snp_selection': True, 'num_snps': 43862}. Best is trial 0 with value: 0.22847785031245058.
[I 2025-12-06 12:44:55,055] Trial 1 finished with value: 0.24117976291127005 and parameters: {'model_type': 'mlp', 'hidden_dims': '[256, 128]', 'dropout': 0.4370668075331726, 'batch_norm': True, 'lr': 7.133471581159139e-05, 'weight_decay': 1.128633586803549e-05, 'epochs': 242, 'loss': 'mae', 'optimizer': 'adam', 'graph_mode': 'off', 'use_snp_selection': False}. Best is trial 1 with value: 0.24117976291127005.
[I 2025-12-06 12:45:32,286] Trial 2 finished with value: 0.18467812382553886 and parameters: {'model_type': 'mlp', 'hidden_dims': '[256, 128, 64]', 'dropout': 0.41314357415569625, 'batch_norm': False, 'lr': 3.952233718592101e-06, 'weight_decay': 0.00026754769258252603, 'epochs': 149, 'loss': 'mse', 'optimizer': 'adam', 'graph_mode': 'off', 'use_snp_selection': True, 'num_snps': 11571}. Best is trial 1 with value: 0.24117976291127005.
[I 2025-12-06 12:47:06,029] Trial 3 finished with value: 0.24412510100809337 and parameters: {'model_type': 'mlp', 'hidden_dims': '[512, 64]', 'dropout': 0.5938127374509361, 'batch_norm': False, 'lr': 5.67704586114731e-06, 'weight_decay': 2.4518087630137052e-05, 'epochs': 320, 'loss': 'mae', 'optimizer': 'adam', 'graph_mode': 'off', 'use_snp_selection': False}. Best is trial 3 with value: 0.24412510100809337.
[I 2025-12-06 12:48:31,188] Trial 4 finished with value: 0.2097154094544797 and parameters: {'model_type': 'mlp', 'hidden_dims': '[512, 128]', 'dropout': 0.25746343592134413, 'batch_norm': True, 'lr': 1.3467657668402788e-06, 'weight_decay': 0.00033087251918647806, 'epochs': 277, 'loss': 'mse', 'optimizer': 'adam', 'graph_mode': 'off', 'use_snp_selection': True, 'num_snps': 36675}. Best is trial 3 with value: 0.24412510100809337.
[I 2025-12-06 12:49:30,978] Trial 5 finished with value: 0.15535541610249723 and parameters: {'model_type': 'mlp', 'hidden_dims': '[512, 64]', 'dropout': 0.38275350994408375, 'batch_norm': True, 'lr': 1.5586664309232824e-06, 'weight_decay': 0.0008227664668621182, 'epochs': 145, 'loss': 'mae', 'optimizer': 'adam', 'graph_mode': 'off', 'use_snp_selection': True, 'num_snps': 32148}. Best is trial 3 with value: 0.24412510100809337.
[I 2025-12-06 12:50:04,496] Trial 6 finished with value: 0.23055212686356902 and parameters: {'model_type': 'mlp', 'hidden_dims': '[256, 128]', 'dropout': 0.3930109900265879, 'batch_norm': False, 'lr': 4.892964372128395e-05, 'weight_decay': 1.5809549317992182e-06, 'epochs': 199, 'loss': 'mse', 'optimizer': 'adam', 'graph_mode': 'off', 'use_snp_selection': False}. Best is trial 3 with value: 0.24412510100809337.
[I 2025-12-06 12:50:38,631] Trial 7 finished with value: 0.23718323141348213 and parameters: {'model_type': 'mlp', 'hidden_dims': '[512, 256]', 'dropout': 0.15343979219678458, 'batch_norm': True, 'lr': 6.234003099047341e-05, 'weight_decay': 3.894760610535477e-07, 'epochs': 97, 'loss': 'mse', 'optimizer': 'adam', 'graph_mode': 'off', 'use_snp_selection': False}. Best is trial 3 with value: 0.24412510100809337.
[I 2025-12-06 12:52:11,919] Trial 8 finished with value: 0.23202092093166354 and parameters: {'model_type': 'mlp', 'hidden_dims': '[512, 128]', 'dropout': 0.10743001231661406, 'batch_norm': True, 'lr': 0.00023728538449271062, 'weight_decay': 1.7629071578048637e-05, 'epochs': 312, 'loss': 'mae', 'optimizer': 'adam', 'graph_mode': 'off', 'use_snp_selection': False}. Best is trial 3 with value: 0.24412510100809337.
[I 2025-12-06 12:53:07,586] Trial 9 finished with value: 0.24002414895815774 and parameters: {'model_type': 'mlp', 'hidden_dims': '[512, 64]', 'dropout': 0.14505336736221927, 'batch_norm': True, 'lr': 5.8619638388111826e-05, 'weight_decay': 6.200156172669308e-07, 'epochs': 175, 'loss': 'mse', 'optimizer': 'adam', 'graph_mode': 'off', 'use_snp_selection': False}. Best is trial 3 with value: 0.24412510100809337.
[I 2025-12-06 12:53:30,085] Trial 10 finished with value: 0.2125402096187392 and parameters: {'model_type': 'mlp', 'hidden_dims': '[512, 64]', 'dropout': 0.5885461262002587, 'batch_norm': False, 'lr': 8.769366258768696e-06, 'weight_decay': 2.78273193871783e-06, 'epochs': 55, 'loss': 'mae', 'optimizer': 'adam', 'graph_mode': 'off', 'use_snp_selection': False}. Best is trial 3 with value: 0.24412510100809337.
[I 2025-12-06 12:54:10,323] Trial 11 finished with value: 0.24579365030383707 and parameters: {'model_type': 'mlp', 'hidden_dims': '[256, 128]', 'dropout': 0.5874224943486895, 'batch_norm': False, 'lr': 1.579181036140435e-05, 'weight_decay': 2.2706826306130984e-05, 'epochs': 243, 'loss': 'mae', 'optimizer': 'adam', 'graph_mode': 'off', 'use_snp_selection': False}. Best is trial 11 with value: 0.24579365030383707.
[I 2025-12-06 12:54:50,795] Trial 12 finished with value: 0.2384687010310603 and parameters: {'model_type': 'mlp', 'hidden_dims': '[256, 128]', 'dropout': 0.593097749012682, 'batch_norm': False, 'lr': 1.237037822532362e-05, 'weight_decay': 5.805294946475999e-05, 'epochs': 245, 'loss': 'mae', 'optimizer': 'adam', 'graph_mode': 'off', 'use_snp_selection': False}. Best is trial 11 with value: 0.24579365030383707.
[I 2025-12-06 12:55:16,757] Trial 13 finished with value: 0.2433732490328618 and parameters: {'model_type': 'mlp', 'hidden_dims': '[128, 64]', 'dropout': 0.5043641748401543, 'batch_norm': False, 'lr': 1.4304506621636526e-05, 'weight_decay': 4.41249611300005e-05, 'epochs': 285, 'loss': 'mae', 'optimizer': 'adam', 'graph_mode': 'off', 'use_snp_selection': False}. Best is trial 11 with value: 0.24579365030383707.
[I 2025-12-06 12:56:58,828] Trial 14 finished with value: 0.24429390932334036 and parameters: {'model_type': 'mlp', 'hidden_dims': '[512, 256]', 'dropout': 0.5300180653494536, 'batch_norm': False, 'lr': 5.096356034191146e-06, 'weight_decay': 1.1414924884997386e-07, 'epochs': 346, 'loss': 'mae', 'optimizer': 'adam', 'graph_mode': 'off', 'use_snp_selection': False}. Best is trial 11 with value: 0.24579365030383707.
[I 2025-12-06 12:58:07,592] Trial 15 finished with value: 0.2380665515783261 and parameters: {'model_type': 'mlp', 'hidden_dims': '[512, 256]', 'dropout': 0.50071393962227, 'batch_norm': False, 'lr': 2.2174629912801656e-05, 'weight_decay': 1.2323424272263762e-07, 'epochs': 226, 'loss': 'mae', 'optimizer': 'adam', 'graph_mode': 'off', 'use_snp_selection': False}. Best is trial 11 with value: 0.24579365030383707.
[I 2025-12-06 12:59:48,230] Trial 16 finished with value: 0.23251340342291787 and parameters: {'model_type': 'mlp', 'hidden_dims': '[512, 256]', 'dropout': 0.29858025320781567, 'batch_norm': False, 'lr': 0.00033868611611782796, 'weight_decay': 5.098763140321504e-06, 'epochs': 349, 'loss': 'mae', 'optimizer': 'adam', 'graph_mode': 'off', 'use_snp_selection': False}. Best is trial 11 with value: 0.24579365030383707.
[I 2025-12-06 13:00:33,192] Trial 17 finished with value: 0.22785558048990412 and parameters: {'model_type': 'mlp', 'hidden_dims': '[256, 128, 64]', 'dropout': 0.4948551096870826, 'batch_norm': False, 'lr': 0.000906375209920231, 'weight_decay': 1.402638371047158e-07, 'epochs': 283, 'loss': 'mae', 'optimizer': 'adam', 'graph_mode': 'off', 'use_snp_selection': False}. Best is trial 11 with value: 0.24579365030383707.
[I 2025-12-06 13:01:47,573] Trial 18 finished with value: 0.23397038065924244 and parameters: {'model_type': 'mlp', 'hidden_dims': '[256, 128]', 'dropout': 0.5379583751015726, 'batch_norm': False, 'lr': 4.0639528151957315e-06, 'weight_decay': 1.3157026583586933e-06, 'epochs': 203, 'loss': 'mae', 'optimizer': 'adam', 'graph_mode': 'off', 'use_snp_selection': True, 'num_snps': 58241}. Best is trial 11 with value: 0.24579365030383707.
[I 2025-12-06 13:03:05,126] Trial 19 finished with value: 0.23689120125963242 and parameters: {'model_type': 'mlp', 'hidden_dims': '[512, 256]', 'dropout': 0.44438650796046825, 'batch_norm': False, 'lr': 0.00014334793979738487, 'weight_decay': 5.822881089878246e-06, 'epochs': 265, 'loss': 'mae', 'optimizer': 'adam', 'graph_mode': 'off', 'use_snp_selection': False}. Best is trial 11 with value: 0.24579365030383707.
[I 2025-12-06 13:03:42,927] Trial 20 finished with value: 0.241746972914285 and parameters: {'model_type': 'mlp', 'hidden_dims': '[512, 256]', 'dropout': 0.33818288615525227, 'batch_norm': False, 'lr': 3.1853143095072665e-05, 'weight_decay': 0.00014915267609160352, 'epochs': 113, 'loss': 'mae', 'optimizer': 'adam', 'graph_mode': 'off', 'use_snp_selection': False}. Best is trial 11 with value: 0.24579365030383707.
[I 2025-12-06 13:05:15,782] Trial 21 finished with value: 0.24404878502973532 and parameters: {'model_type': 'mlp', 'hidden_dims': '[512, 64]', 'dropout': 0.5551594855246745, 'batch_norm': False, 'lr': 5.514580286838434e-06, 'weight_decay': 1.990454784107754e-05, 'epochs': 315, 'loss': 'mae', 'optimizer': 'adam', 'graph_mode': 'off', 'use_snp_selection': False}. Best is trial 11 with value: 0.24579365030383707.
[I 2025-12-06 13:06:48,145] Trial 22 finished with value: 0.24416098421913265 and parameters: {'model_type': 'mlp', 'hidden_dims': '[512, 64]', 'dropout': 0.5466149221009567, 'batch_norm': False, 'lr': 6.964091851030654e-06, 'weight_decay': 3.260887770804715e-05, 'epochs': 312, 'loss': 'mae', 'optimizer': 'adam', 'graph_mode': 'off', 'use_snp_selection': False}. Best is trial 11 with value: 0.24579365030383707.
[I 2025-12-06 13:07:37,751] Trial 23 finished with value: 0.24074115955946923 and parameters: {'model_type': 'mlp', 'hidden_dims': '[256, 128]', 'dropout': 0.5425152778851695, 'batch_norm': False, 'lr': 2.6667383797171216e-06, 'weight_decay': 9.237118821562573e-05, 'epochs': 309, 'loss': 'mae', 'optimizer': 'adam', 'graph_mode': 'off', 'use_snp_selection': False}. Best is trial 11 with value: 0.24579365030383707.
[I 2025-12-06 13:08:33,036] Trial 24 finished with value: 0.23562623564985233 and parameters: {'model_type': 'mlp', 'hidden_dims': '[256, 128, 64]', 'dropout': 0.46987033741278, 'batch_norm': False, 'lr': 8.688554016280198e-06, 'weight_decay': 7.155673581155691e-06, 'epochs': 349, 'loss': 'mae', 'optimizer': 'adam', 'graph_mode': 'off', 'use_snp_selection': False}. Best is trial 11 with value: 0.24579365030383707.
