[I 2025-12-05 14:48:40,048] Trial 75 finished with value: 0.08352391350749568 and parameters: {'model_type': 'mlp', 'hidden_dims': '[128, 64]', 'dropout': 0.10554352377978365, 'batch_norm': True, 'lr': 0.0002972686483662054, 'weight_decay': 2.134147885361073e-07, 'epochs': 259, 'loss': 'mae', 'optimizer': 'adam', 'graph_mode': 'off', 'use_snp_selection': False}. Best is trial 20 with value: 0.10210523843739283.
[I 2025-12-05 14:48:41,074] Trial 76 finished with value: 0.09547328924812083 and parameters: {'model_type': 'mlp', 'hidden_dims': '[128, 64]', 'dropout': 0.18020345128320164, 'batch_norm': True, 'lr': 0.00020256288163849758, 'weight_decay': 3.3132985354067483e-07, 'epochs': 305, 'loss': 'mae', 'optimizer': 'adam', 'graph_mode': 'off', 'use_snp_selection': False}. Best is trial 20 with value: 0.10210523843739283.
[I 2025-12-05 14:48:43,109] Trial 77 finished with value: 0.08609996662813982 and parameters: {'model_type': 'mlp', 'hidden_dims': '[128, 64]', 'dropout': 0.17029840389227008, 'batch_norm': True, 'lr': 0.0002424249396695309, 'weight_decay': 1.3309430688788242e-07, 'epochs': 192, 'loss': 'mae', 'optimizer': 'adam', 'graph_mode': 'off', 'use_snp_selection': True, 'num_snps': 38231}. Best is trial 20 with value: 0.10210523843739283.
[I 2025-12-05 14:48:45,388] Trial 78 finished with value: 0.08479134944988337 and parameters: {'model_type': 'mlp', 'hidden_dims': '[512, 64]', 'dropout': 0.206795585955881, 'batch_norm': True, 'lr': 0.0001904323964371294, 'weight_decay': 8.91490293391917e-07, 'epochs': 271, 'loss': 'mae', 'optimizer': 'adam', 'graph_mode': 'off', 'use_snp_selection': False}. Best is trial 20 with value: 0.10210523843739283.
[I 2025-12-05 14:48:46,436] Trial 79 finished with value: 0.09895861986660417 and parameters: {'model_type': 'mlp', 'hidden_dims': '[128, 64]', 'dropout': 0.13736095103936438, 'batch_norm': True, 'lr': 0.0009983481736921635, 'weight_decay': 1.4674700202076059e-06, 'epochs': 310, 'loss': 'mae', 'optimizer': 'adam', 'graph_mode': 'off', 'use_snp_selection': False}. Best is trial 20 with value: 0.10210523843739283.
[I 2025-12-05 14:48:47,447] Trial 80 finished with value: 0.05464663706271911 and parameters: {'model_type': 'mlp', 'hidden_dims': '[128, 64]', 'dropout': 0.13346808767953544, 'batch_norm': False, 'lr': 0.0006067821001514827, 'weight_decay': 1.3322686587656104e-06, 'epochs': 307, 'loss': 'mae', 'optimizer': 'adam', 'graph_mode': 'off', 'use_snp_selection': False}. Best is trial 20 with value: 0.10210523843739283.
[I 2025-12-05 14:48:48,485] Trial 81 finished with value: 0.09762906235804265 and parameters: {'model_type': 'mlp', 'hidden_dims': '[128, 64]', 'dropout': 0.141653929550896, 'batch_norm': True, 'lr': 0.0003893779760444414, 'weight_decay': 3.555651469286447e-07, 'epochs': 312, 'loss': 'mae', 'optimizer': 'adam', 'graph_mode': 'off', 'use_snp_selection': False}. Best is trial 20 with value: 0.10210523843739283.
[I 2025-12-05 14:48:49,541] Trial 82 finished with value: 0.09749536409090252 and parameters: {'model_type': 'mlp', 'hidden_dims': '[128, 64]', 'dropout': 0.10005166447044464, 'batch_norm': True, 'lr': 0.0008286827970160164, 'weight_decay': 2.8824817535565897e-07, 'epochs': 313, 'loss': 'mae', 'optimizer': 'adam', 'graph_mode': 'off', 'use_snp_selection': False}. Best is trial 20 with value: 0.10210523843739283.
[I 2025-12-05 14:48:50,588] Trial 83 finished with value: 0.08138797178966785 and parameters: {'model_type': 'mlp', 'hidden_dims': '[128, 64]', 'dropout': 0.10036552303274407, 'batch_norm': True, 'lr': 0.00035626912342407113, 'weight_decay': 2.316814987134615e-07, 'epochs': 318, 'loss': 'mae', 'optimizer': 'adam', 'graph_mode': 'off', 'use_snp_selection': False}. Best is trial 20 with value: 0.10210523843739283.
[I 2025-12-05 14:48:51,644] Trial 84 finished with value: 0.09038924376861415 and parameters: {'model_type': 'mlp', 'hidden_dims': '[128, 64]', 'dropout': 0.13860919600501273, 'batch_norm': True, 'lr': 0.0008212476318320068, 'weight_decay': 3.975725034131924e-07, 'epochs': 325, 'loss': 'mae', 'optimizer': 'adam', 'graph_mode': 'off', 'use_snp_selection': False}. Best is trial 20 with value: 0.10210523843739283.
[I 2025-12-05 14:48:52,676] Trial 85 finished with value: 0.07318201235890293 and parameters: {'model_type': 'mlp', 'hidden_dims': '[128, 64]', 'dropout': 0.14561057777908984, 'batch_norm': True, 'lr': 0.0008750245880300481, 'weight_decay': 7.393631956074207e-07, 'epochs': 300, 'loss': 'mae', 'optimizer': 'adam', 'graph_mode': 'off', 'use_snp_selection': False}. Best is trial 20 with value: 0.10210523843739283.
[I 2025-12-05 14:48:53,680] Trial 86 finished with value: 0.0865418129328151 and parameters: {'model_type': 'mlp', 'hidden_dims': '[128, 64]', 'dropout': 0.11909802766584492, 'batch_norm': True, 'lr': 0.0006636016565781598, 'weight_decay': 6.387905479135624e-06, 'epochs': 289, 'loss': 'mae', 'optimizer': 'adam', 'graph_mode': 'off', 'use_snp_selection': False}. Best is trial 20 with value: 0.10210523843739283.
[I 2025-12-05 14:48:56,223] Trial 87 finished with value: 0.09715293211998358 and parameters: {'model_type': 'mlp', 'hidden_dims': '[512, 128]', 'dropout': 0.11349434414510068, 'batch_norm': True, 'lr': 0.00042056455017800055, 'weight_decay': 1.545157394550495e-06, 'epochs': 317, 'loss': 'mae', 'optimizer': 'adam', 'graph_mode': 'off', 'use_snp_selection': False}. Best is trial 20 with value: 0.10210523843739283.
[I 2025-12-05 14:48:58,895] Trial 88 finished with value: 0.08198683519300665 and parameters: {'model_type': 'mlp', 'hidden_dims': '[512, 128]', 'dropout': 0.1159271266637206, 'batch_norm': True, 'lr': 0.0004318459046445387, 'weight_decay': 1.646145660828936e-06, 'epochs': 339, 'loss': 'mae', 'optimizer': 'adam', 'graph_mode': 'off', 'use_snp_selection': False}. Best is trial 20 with value: 0.10210523843739283.
[I 2025-12-05 14:49:01,571] Trial 89 finished with value: 0.09071118811939702 and parameters: {'model_type': 'mlp', 'hidden_dims': '[512, 128]', 'dropout': 0.16457641267997927, 'batch_norm': True, 'lr': 0.0008203601762449049, 'weight_decay': 1.42111691857734e-05, 'epochs': 341, 'loss': 'mae', 'optimizer': 'adam', 'graph_mode': 'off', 'use_snp_selection': False}. Best is trial 20 with value: 0.10210523843739283.
[I 2025-12-05 14:49:04,119] Trial 90 finished with value: 0.08317766817156554 and parameters: {'model_type': 'mlp', 'hidden_dims': '[512, 128]', 'dropout': 0.11115093567580522, 'batch_norm': True, 'lr': 0.000524519604807231, 'weight_decay': 1.4018473483517266e-07, 'epochs': 318, 'loss': 'mae', 'optimizer': 'adam', 'graph_mode': 'off', 'use_snp_selection': False}. Best is trial 20 with value: 0.10210523843739283.
[I 2025-12-05 14:49:06,729] Trial 91 finished with value: 0.0865663291805476 and parameters: {'model_type': 'mlp', 'hidden_dims': '[512, 128]', 'dropout': 0.1407095646454601, 'batch_norm': True, 'lr': 0.0009553701792291103, 'weight_decay': 2.196682242589123e-06, 'epochs': 326, 'loss': 'mae', 'optimizer': 'adam', 'graph_mode': 'off', 'use_snp_selection': False}. Best is trial 20 with value: 0.10210523843739283.
[I 2025-12-05 14:49:07,772] Trial 92 finished with value: 0.08539129715748506 and parameters: {'model_type': 'mlp', 'hidden_dims': '[128, 64]', 'dropout': 0.17788367500651736, 'batch_norm': True, 'lr': 0.0007663262163708663, 'weight_decay': 1.0072893430976316e-06, 'epochs': 315, 'loss': 'mae', 'optimizer': 'adam', 'graph_mode': 'off', 'use_snp_selection': False}. Best is trial 20 with value: 0.10210523843739283.
[I 2025-12-05 14:49:10,269] Trial 93 finished with value: 0.08726424999297142 and parameters: {'model_type': 'mlp', 'hidden_dims': '[512, 64]', 'dropout': 0.13119515984726526, 'batch_norm': True, 'lr': 0.00041303817524847964, 'weight_decay': 1.4046955630572632e-06, 'epochs': 310, 'loss': 'mae', 'optimizer': 'adam', 'graph_mode': 'off', 'use_snp_selection': False}. Best is trial 20 with value: 0.10210523843739283.
[I 2025-12-05 14:49:12,544] Trial 94 finished with value: 0.08042857068006658 and parameters: {'model_type': 'mlp', 'hidden_dims': '[512, 256]', 'dropout': 0.10778449978628649, 'batch_norm': True, 'lr': 0.0002859623094567572, 'weight_decay': 3.487019033020371e-07, 'epochs': 269, 'loss': 'mae', 'optimizer': 'adam', 'graph_mode': 'off', 'use_snp_selection': False}. Best is trial 20 with value: 0.10210523843739283.
[I 2025-12-05 14:49:13,635] Trial 95 finished with value: 0.10134762968043631 and parameters: {'model_type': 'mlp', 'hidden_dims': '[128, 64]', 'dropout': 0.10027670451726528, 'batch_norm': True, 'lr': 0.0006536939369806299, 'weight_decay': 4.732762123442418e-07, 'epochs': 347, 'loss': 'mae', 'optimizer': 'adam', 'graph_mode': 'off', 'use_snp_selection': False}. Best is trial 20 with value: 0.10210523843739283.
[I 2025-12-05 14:49:16,333] Trial 96 finished with value: 0.09453103167988844 and parameters: {'model_type': 'mlp', 'hidden_dims': '[512, 128]', 'dropout': 0.1556613981405726, 'batch_norm': True, 'lr': 0.0007233252773507152, 'weight_decay': 2.4638774210479363e-07, 'epochs': 344, 'loss': 'mae', 'optimizer': 'adam', 'graph_mode': 'off', 'use_snp_selection': False}. Best is trial 20 with value: 0.10210523843739283.
[I 2025-12-05 14:49:17,404] Trial 97 finished with value: 0.09620688086354627 and parameters: {'model_type': 'mlp', 'hidden_dims': '[128, 64]', 'dropout': 0.18935713262645712, 'batch_norm': True, 'lr': 0.0006163132799904693, 'weight_decay': 4.378845587251878e-07, 'epochs': 333, 'loss': 'mae', 'optimizer': 'adam', 'graph_mode': 'off', 'use_snp_selection': False}. Best is trial 20 with value: 0.10210523843739283.
[I 2025-12-05 14:49:20,106] Trial 98 finished with value: 0.07313507252758902 and parameters: {'model_type': 'mlp', 'hidden_dims': '[512, 64]', 'dropout': 0.20254148341708192, 'batch_norm': False, 'lr': 0.00047573527148515334, 'weight_decay': 1.0196070004749244e-07, 'epochs': 348, 'loss': 'mae', 'optimizer': 'adam', 'graph_mode': 'off', 'use_snp_selection': False}. Best is trial 20 with value: 0.10210523843739283.
[I 2025-12-05 14:49:22,573] Trial 99 finished with value: 0.08856073532319503 and parameters: {'model_type': 'mlp', 'hidden_dims': '[512, 128]', 'dropout': 0.5773925733299263, 'batch_norm': True, 'lr': 0.0005711764000043666, 'weight_decay': 7.601730043752655e-07, 'epochs': 303, 'loss': 'mae', 'optimizer': 'adam', 'graph_mode': 'off', 'use_snp_selection': False}. Best is trial 20 with value: 0.10210523843739283.
[I 2025-12-05 14:49:23,625] Trial 100 finished with value: 0.10272290875989905 and parameters: {'model_type': 'mlp', 'hidden_dims': '[128, 64]', 'dropout': 0.23279959620249469, 'batch_norm': True, 'lr': 0.0009867959125136167, 'weight_decay': 3.2481969846167676e-06, 'epochs': 321, 'loss': 'mae', 'optimizer': 'adam', 'graph_mode': 'off', 'use_snp_selection': False}. Best is trial 100 with value: 0.10272290875989905.
[I 2025-12-05 14:49:24,681] Trial 101 finished with value: 0.09501181353069005 and parameters: {'model_type': 'mlp', 'hidden_dims': '[128, 64]', 'dropout': 0.2278994154249957, 'batch_norm': True, 'lr': 0.0009610608660705577, 'weight_decay': 4.1364798674064285e-06, 'epochs': 323, 'loss': 'mae', 'optimizer': 'adam', 'graph_mode': 'off', 'use_snp_selection': False}. Best is trial 100 with value: 0.10272290875989905.
[I 2025-12-05 14:49:25,757] Trial 102 finished with value: 0.10304666950230068 and parameters: {'model_type': 'mlp', 'hidden_dims': '[128, 64]', 'dropout': 0.12435337914291333, 'batch_norm': True, 'lr': 0.0004024067919616534, 'weight_decay': 6.2591798075460985e-06, 'epochs': 335, 'loss': 'mae', 'optimizer': 'adam', 'graph_mode': 'off', 'use_snp_selection': False}. Best is trial 102 with value: 0.10304666950230068.
[I 2025-12-05 14:49:26,833] Trial 103 finished with value: 0.0836290020668835 and parameters: {'model_type': 'mlp', 'hidden_dims': '[128, 64]', 'dropout': 0.2550561342214331, 'batch_norm': True, 'lr': 0.000761662463769358, 'weight_decay': 3.2227452051297617e-06, 'epochs': 333, 'loss': 'mae', 'optimizer': 'adam', 'graph_mode': 'off', 'use_snp_selection': False}. Best is trial 102 with value: 0.10304666950230068.
[I 2025-12-05 14:49:27,640] Trial 104 finished with value: 0.1040249856957381 and parameters: {'model_type': 'mlp', 'hidden_dims': '[128, 64]', 'dropout': 0.143982345449138, 'batch_norm': True, 'lr': 0.0006650693640017335, 'weight_decay': 7.5400711680705244e-06, 'epochs': 151, 'loss': 'mae', 'optimizer': 'adam', 'graph_mode': 'off', 'use_snp_selection': False}. Best is trial 104 with value: 0.1040249856957381.
[I 2025-12-05 14:49:28,464] Trial 105 finished with value: 0.09330479406278791 and parameters: {'model_type': 'mlp', 'hidden_dims': '[128, 64]', 'dropout': 0.1602895880725833, 'batch_norm': True, 'lr': 0.0006741691295551201, 'weight_decay': 8.87056249301556e-06, 'epochs': 163, 'loss': 'mae', 'optimizer': 'adam', 'graph_mode': 'off', 'use_snp_selection': False}. Best is trial 104 with value: 0.1040249856957381.
[I 2025-12-05 14:49:29,267] Trial 106 finished with value: 0.09348938925054515 and parameters: {'model_type': 'mlp', 'hidden_dims': '[128, 64]', 'dropout': 0.14563252019383027, 'batch_norm': True, 'lr': 0.00037086271914179604, 'weight_decay': 5.737370637078713e-06, 'epochs': 151, 'loss': 'mae', 'optimizer': 'adam', 'graph_mode': 'off', 'use_snp_selection': False}. Best is trial 104 with value: 0.1040249856957381.
[I 2025-12-05 14:49:30,028] Trial 107 finished with value: 0.07694324057373889 and parameters: {'model_type': 'mlp', 'hidden_dims': '[128, 64]', 'dropout': 0.12583598884392014, 'batch_norm': True, 'lr': 5.6058894752956904e-05, 'weight_decay': 1.1846333817798165e-05, 'epochs': 121, 'loss': 'mae', 'optimizer': 'adam', 'graph_mode': 'off', 'use_snp_selection': False}. Best is trial 104 with value: 0.1040249856957381.
[I 2025-12-05 14:49:30,808] Trial 108 finished with value: 0.00046024770319270936 and parameters: {'model_type': 'mlp', 'hidden_dims': '[128, 64]', 'dropout': 0.27934813862526264, 'batch_norm': True, 'lr': 4.715683290913407e-06, 'weight_decay': 7.711462963996281e-06, 'epochs': 135, 'loss': 'mae', 'optimizer': 'adam', 'graph_mode': 'off', 'use_snp_selection': False}. Best is trial 104 with value: 0.1040249856957381.
[I 2025-12-05 14:49:32,366] Trial 109 finished with value: 0.07517964261261827 and parameters: {'model_type': 'mlp', 'hidden_dims': '[512, 256]', 'dropout': 0.14014218560436037, 'batch_norm': True, 'lr': 0.0005045211965361225, 'weight_decay': 1.9370440358815658e-05, 'epochs': 142, 'loss': 'mae', 'optimizer': 'adam', 'graph_mode': 'off', 'use_snp_selection': False}. Best is trial 104 with value: 0.1040249856957381.
[I 2025-12-05 14:49:33,220] Trial 110 finished with value: 0.07684767582105516 and parameters: {'model_type': 'mlp', 'hidden_dims': '[128, 64]', 'dropout': 0.16990375823280976, 'batch_norm': True, 'lr': 0.0006462901041091054, 'weight_decay': 4.212442628593833e-06, 'epochs': 182, 'loss': 'mae', 'optimizer': 'adam', 'graph_mode': 'off', 'use_snp_selection': False}. Best is trial 104 with value: 0.1040249856957381.
[I 2025-12-05 14:49:34,319] Trial 111 finished with value: 0.08739620201763937 and parameters: {'model_type': 'mlp', 'hidden_dims': '[128, 64]', 'dropout': 0.11936144320458283, 'batch_norm': True, 'lr': 0.0009351018676851588, 'weight_decay': 3.046885527074529e-06, 'epochs': 349, 'loss': 'mae', 'optimizer': 'adam', 'graph_mode': 'off', 'use_snp_selection': False}. Best is trial 104 with value: 0.1040249856957381.
[I 2025-12-05 14:49:35,326] Trial 112 finished with value: 0.03273940069470665 and parameters: {'model_type': 'mlp', 'hidden_dims': '[128, 64]', 'dropout': 0.351958491973957, 'batch_norm': True, 'lr': 1.1959332109977606e-06, 'weight_decay': 6.447579058891986e-06, 'epochs': 290, 'loss': 'mae', 'optimizer': 'adam', 'graph_mode': 'off', 'use_snp_selection': False}. Best is trial 104 with value: 0.1040249856957381.
[I 2025-12-05 14:49:36,393] Trial 113 finished with value: 0.08763768920653614 and parameters: {'model_type': 'mlp', 'hidden_dims': '[128, 64]', 'dropout': 0.13195333253299074, 'batch_norm': True, 'lr': 0.0007534139296168241, 'weight_decay': 2.373291825046854e-06, 'epochs': 330, 'loss': 'mae', 'optimizer': 'adam', 'graph_mode': 'off', 'use_snp_selection': False}. Best is trial 104 with value: 0.1040249856957381.
[I 2025-12-05 14:49:37,241] Trial 114 finished with value: 0.0876492192689021 and parameters: {'model_type': 'mlp', 'hidden_dims': '[128, 64]', 'dropout': 0.14644851658207836, 'batch_norm': True, 'lr': 0.0005781028363237432, 'weight_decay': 4.6611717438731385e-06, 'epochs': 173, 'loss': 'mae', 'optimizer': 'adam', 'graph_mode': 'off', 'use_snp_selection': False}. Best is trial 104 with value: 0.1040249856957381.
[I 2025-12-05 14:49:39,914] Trial 115 finished with value: 0.09324369240792947 and parameters: {'model_type': 'mlp', 'hidden_dims': '[512, 64]', 'dropout': 0.190849502535978, 'batch_norm': True, 'lr': 0.00035158141278816976, 'weight_decay': 1.812041693738479e-07, 'epochs': 341, 'loss': 'mae', 'optimizer': 'adam', 'graph_mode': 'off', 'use_snp_selection': False}. Best is trial 104 with value: 0.1040249856957381.
[I 2025-12-05 14:49:40,954] Trial 116 finished with value: 0.09032001887543407 and parameters: {'model_type': 'mlp', 'hidden_dims': '[128, 64]', 'dropout': 0.17420720110683496, 'batch_norm': True, 'lr': 0.000475894006839634, 'weight_decay': 3.61221908905741e-05, 'epochs': 311, 'loss': 'mae', 'optimizer': 'adam', 'graph_mode': 'off', 'use_snp_selection': False}. Best is trial 104 with value: 0.1040249856957381.
[I 2025-12-05 14:49:41,666] Trial 117 finished with value: 0.07379655757610654 and parameters: {'model_type': 'mlp', 'hidden_dims': '[128, 64]', 'dropout': 0.5347632099046269, 'batch_norm': True, 'lr': 0.0008615479247135457, 'weight_decay': 1.3137699003353004e-05, 'epochs': 89, 'loss': 'mse', 'optimizer': 'adam', 'graph_mode': 'off', 'use_snp_selection': False}. Best is trial 104 with value: 0.1040249856957381.
[I 2025-12-05 14:49:42,710] Trial 118 finished with value: 0.06514173378728422 and parameters: {'model_type': 'mlp', 'hidden_dims': '[256, 128]', 'dropout': 0.21540302207171452, 'batch_norm': False, 'lr': 8.030879290489515e-05, 'weight_decay': 9.211320399558939e-06, 'epochs': 155, 'loss': 'mae', 'optimizer': 'adam', 'graph_mode': 'off', 'use_snp_selection': False}. Best is trial 104 with value: 0.1040249856957381.
[I 2025-12-05 14:49:43,779] Trial 119 finished with value: 0.06261288227722245 and parameters: {'model_type': 'mlp', 'hidden_dims': '[128, 64]', 'dropout': 0.43144790521858467, 'batch_norm': True, 'lr': 0.00068938250797775, 'weight_decay': 2.9075626555184704e-07, 'epochs': 322, 'loss': 'mae', 'optimizer': 'adam', 'graph_mode': 'off', 'use_snp_selection': False}. Best is trial 104 with value: 0.1040249856957381.
[I 2025-12-05 14:49:44,600] Trial 120 finished with value: 0.06841392068999884 and parameters: {'model_type': 'mlp', 'hidden_dims': '[128, 64]', 'dropout': 0.5015760801364026, 'batch_norm': True, 'lr': 0.000553992400320978, 'weight_decay': 3.722404419039419e-06, 'epochs': 164, 'loss': 'mae', 'optimizer': 'adam', 'graph_mode': 'off', 'use_snp_selection': False}. Best is trial 104 with value: 0.1040249856957381.
[I 2025-12-05 14:49:47,251] Trial 121 finished with value: 0.08478844654870903 and parameters: {'model_type': 'mlp', 'hidden_dims': '[512, 128]', 'dropout': 0.11484419577484398, 'batch_norm': True, 'lr': 0.00041129915019723324, 'weight_decay': 1.8958660702008627e-06, 'epochs': 336, 'loss': 'mae', 'optimizer': 'adam', 'graph_mode': 'off', 'use_snp_selection': False}. Best is trial 104 with value: 0.1040249856957381.
[I 2025-12-05 14:49:49,803] Trial 122 finished with value: 0.09085264012261454 and parameters: {'model_type': 'mlp', 'hidden_dims': '[512, 128]', 'dropout': 0.11054764153679235, 'batch_norm': True, 'lr': 0.0004238827525767631, 'weight_decay': 1.1466061267508368e-06, 'epochs': 318, 'loss': 'mae', 'optimizer': 'adam', 'graph_mode': 'off', 'use_snp_selection': False}. Best is trial 104 with value: 0.1040249856957381.
[I 2025-12-05 14:49:52,279] Trial 123 finished with value: 0.08449674867300422 and parameters: {'model_type': 'mlp', 'hidden_dims': '[512, 64]', 'dropout': 0.13115319411348234, 'batch_norm': True, 'lr': 0.0009705041741661166, 'weight_decay': 6.056183776336551e-07, 'epochs': 306, 'loss': 'mae', 'optimizer': 'adam', 'graph_mode': 'off', 'use_snp_selection': False}. Best is trial 104 with value: 0.1040249856957381.
[I 2025-12-05 14:49:53,160] Trial 124 finished with value: 0.10351184955168309 and parameters: {'model_type': 'mlp', 'hidden_dims': '[128, 64]', 'dropout': 0.1028610518433337, 'batch_norm': True, 'lr': 0.00016864971432275155, 'weight_decay': 5.653106485648745e-06, 'epochs': 202, 'loss': 'mae', 'optimizer': 'adam', 'graph_mode': 'off', 'use_snp_selection': False}. Best is trial 104 with value: 0.1040249856957381.
[I 2025-12-05 14:49:54,044] Trial 125 finished with value: 0.08390897039350431 and parameters: {'model_type': 'mlp', 'hidden_dims': '[128, 64]', 'dropout': 0.10186330565826507, 'batch_norm': True, 'lr': 0.00015573430627724715, 'weight_decay': 5.26643894981182e-06, 'epochs': 201, 'loss': 'mae', 'optimizer': 'adam', 'graph_mode': 'off', 'use_snp_selection': False}. Best is trial 104 with value: 0.1040249856957381.
[I 2025-12-05 14:49:54,887] Trial 126 finished with value: 0.09438267771944682 and parameters: {'model_type': 'mlp', 'hidden_dims': '[128, 64]', 'dropout': 0.12200732708418746, 'batch_norm': True, 'lr': 0.00012764591301717666, 'weight_decay': 7.055581313472381e-06, 'epochs': 178, 'loss': 'mae', 'optimizer': 'adam', 'graph_mode': 'off', 'use_snp_selection': False}. Best is trial 104 with value: 0.1040249856957381.
