[I 2025-12-05 14:40:52,338] Trial 14 finished with value: 0.10412731994287028 and parameters: {'model_type': 'mlp', 'hidden_dims': '[256, 128]', 'dropout': 0.47260361404074946, 'batch_norm': True, 'lr': 0.0006809598175709456, 'weight_decay': 5.366986687375328e-07, 'epochs': 114, 'loss': 'mse', 'optimizer': 'adam', 'graph_mode': 'off', 'use_snp_selection': False}. Best is trial 7 with value: 0.11937346209676132.
[I 2025-12-05 14:40:53,253] Trial 15 finished with value: 0.09574198477446662 and parameters: {'model_type': 'mlp', 'hidden_dims': '[128, 64]', 'dropout': 0.20364285455346318, 'batch_norm': True, 'lr': 0.00010977913753626019, 'weight_decay': 7.236536090132001e-06, 'epochs': 100, 'loss': 'mae', 'optimizer': 'adam', 'graph_mode': 'off', 'use_snp_selection': False}. Best is trial 7 with value: 0.11937346209676132.
[I 2025-12-05 14:40:55,710] Trial 16 finished with value: 0.06085723579114888 and parameters: {'model_type': 'mlp', 'hidden_dims': '[256, 128, 64]', 'dropout': 0.33714629729085804, 'batch_norm': True, 'lr': 2.1517090787442848e-05, 'weight_decay': 5.3536875449215945e-05, 'epochs': 269, 'loss': 'mse', 'optimizer': 'adam', 'graph_mode': 'off', 'use_snp_selection': False}. Best is trial 7 with value: 0.11937346209676132.
[I 2025-12-05 14:40:57,747] Trial 17 finished with value: 0.05812568424788722 and parameters: {'model_type': 'mlp', 'hidden_dims': '[256, 128]', 'dropout': 0.5816756231506599, 'batch_norm': True, 'lr': 9.746523544442226e-06, 'weight_decay': 5.490737021320602e-07, 'epochs': 202, 'loss': 'mae', 'optimizer': 'adam', 'graph_mode': 'off', 'use_snp_selection': False}. Best is trial 7 with value: 0.11937346209676132.
[I 2025-12-05 14:41:02,627] Trial 18 finished with value: -0.009363098289690211 and parameters: {'model_type': 'mlp', 'hidden_dims': '[512, 256]', 'dropout': 0.20912869164872058, 'batch_norm': False, 'lr': 0.0009735993119677173, 'weight_decay': 1.3157026583586933e-06, 'epochs': 164, 'loss': 'mse', 'optimizer': 'adam', 'graph_mode': 'off', 'use_snp_selection': True, 'num_snps': 58241}. Best is trial 7 with value: 0.11937346209676132.
[I 2025-12-05 14:41:03,602] Trial 19 finished with value: 0.10470709113765937 and parameters: {'model_type': 'mlp', 'hidden_dims': '[256, 128]', 'dropout': 0.5398478097162089, 'batch_norm': True, 'lr': 5.63952922625923e-05, 'weight_decay': 8.65779117499206e-05, 'epochs': 49, 'loss': 'mae', 'optimizer': 'adam', 'graph_mode': 'off', 'use_snp_selection': False}. Best is trial 7 with value: 0.11937346209676132.
[I 2025-12-05 14:41:05,848] Trial 20 finished with value: 0.11360132415610298 and parameters: {'model_type': 'mlp', 'hidden_dims': '[512, 256]', 'dropout': 0.3400065648259248, 'batch_norm': True, 'lr': 0.00014058530570495862, 'weight_decay': 5.6086896540041565e-06, 'epochs': 121, 'loss': 'mae', 'optimizer': 'adam', 'graph_mode': 'off', 'use_snp_selection': False}. Best is trial 7 with value: 0.11937346209676132.
[I 2025-12-05 14:41:08,035] Trial 21 finished with value: 0.10511600992180047 and parameters: {'model_type': 'mlp', 'hidden_dims': '[512, 256]', 'dropout': 0.4307599252553659, 'batch_norm': True, 'lr': 0.00016149120358604482, 'weight_decay': 8.07593060307469e-06, 'epochs': 117, 'loss': 'mae', 'optimizer': 'adam', 'graph_mode': 'off', 'use_snp_selection': False}. Best is trial 7 with value: 0.11937346209676132.
[I 2025-12-05 14:41:10,446] Trial 22 finished with value: 0.11075933900244696 and parameters: {'model_type': 'mlp', 'hidden_dims': '[512, 256]', 'dropout': 0.34621422421031517, 'batch_norm': True, 'lr': 0.0004342042491177238, 'weight_decay': 2.903926001236389e-07, 'epochs': 131, 'loss': 'mae', 'optimizer': 'adam', 'graph_mode': 'off', 'use_snp_selection': False}. Best is trial 7 with value: 0.11937346209676132.
[I 2025-12-05 14:41:12,275] Trial 23 finished with value: 0.09557508606194248 and parameters: {'model_type': 'mlp', 'hidden_dims': '[512, 256]', 'dropout': 0.337863567709218, 'batch_norm': True, 'lr': 0.00037172365620413093, 'weight_decay': 3.2666120737763034e-07, 'epochs': 85, 'loss': 'mae', 'optimizer': 'adam', 'graph_mode': 'off', 'use_snp_selection': False}. Best is trial 7 with value: 0.11937346209676132.
[I 2025-12-05 14:41:14,562] Trial 24 finished with value: 0.10319959872107837 and parameters: {'model_type': 'mlp', 'hidden_dims': '[512, 256]', 'dropout': 0.2880127083218229, 'batch_norm': True, 'lr': 0.0006272423555770005, 'weight_decay': 2.2585433347505652e-07, 'epochs': 122, 'loss': 'mae', 'optimizer': 'adam', 'graph_mode': 'off', 'use_snp_selection': False}. Best is trial 7 with value: 0.11937346209676132.
[I 2025-12-05 14:41:16,110] Trial 25 finished with value: 0.08196743936155644 and parameters: {'model_type': 'mlp', 'hidden_dims': '[512, 256]', 'dropout': 0.23904130825867426, 'batch_norm': True, 'lr': 3.318836508614039e-05, 'weight_decay': 1.0077734665942408e-06, 'epochs': 65, 'loss': 'mae', 'optimizer': 'adam', 'graph_mode': 'off', 'use_snp_selection': False}. Best is trial 7 with value: 0.11937346209676132.
[I 2025-12-05 14:41:17,663] Trial 26 finished with value: 0.09355468317311622 and parameters: {'model_type': 'mlp', 'hidden_dims': '[512, 256]', 'dropout': 0.15893977600118336, 'batch_norm': True, 'lr': 0.00018256957045033998, 'weight_decay': 2.443643243280606e-06, 'epochs': 138, 'loss': 'mse', 'optimizer': 'adam', 'graph_mode': 'off', 'use_snp_selection': True, 'num_snps': 3842}. Best is trial 7 with value: 0.11937346209676132.
[I 2025-12-05 14:41:19,559] Trial 27 finished with value: 0.09842329872624372 and parameters: {'model_type': 'mlp', 'hidden_dims': '[512, 256]', 'dropout': 0.3159473830358486, 'batch_norm': False, 'lr': 0.0003871606811620235, 'weight_decay': 2.0556038453304137e-07, 'epochs': 95, 'loss': 'mae', 'optimizer': 'adam', 'graph_mode': 'off', 'use_snp_selection': False}. Best is trial 7 with value: 0.11937346209676132.
[I 2025-12-05 14:41:22,533] Trial 28 finished with value: 0.1078331889099408 and parameters: {'model_type': 'mlp', 'hidden_dims': '[512, 256]', 'dropout': 0.101372352794305, 'batch_norm': True, 'lr': 0.00010118004692841974, 'weight_decay': 3.3266247578020294e-07, 'epochs': 177, 'loss': 'mse', 'optimizer': 'adam', 'graph_mode': 'off', 'use_snp_selection': False}. Best is trial 7 with value: 0.11937346209676132.
[I 2025-12-05 14:41:24,499] Trial 29 finished with value: 0.08714381971690784 and parameters: {'model_type': 'mlp', 'hidden_dims': '[128, 64]', 'dropout': 0.38192037972756254, 'batch_norm': True, 'lr': 0.00024131284079230956, 'weight_decay': 1.008105974656094e-06, 'epochs': 65, 'loss': 'mae', 'optimizer': 'adam', 'graph_mode': 'off', 'use_snp_selection': True, 'num_snps': 19468}. Best is trial 7 with value: 0.11937346209676132.
[I 2025-12-05 14:41:26,057] Trial 30 finished with value: 0.10723915277906393 and parameters: {'model_type': 'mlp', 'hidden_dims': '[256, 128, 64]', 'dropout': 0.1643682238690179, 'batch_norm': True, 'lr': 0.0005903884778922259, 'weight_decay': 4.159303284197293e-05, 'epochs': 129, 'loss': 'mae', 'optimizer': 'adam', 'graph_mode': 'off', 'use_snp_selection': False}. Best is trial 7 with value: 0.11937346209676132.
[I 2025-12-05 14:41:28,977] Trial 31 finished with value: 0.09491208050604136 and parameters: {'model_type': 'mlp', 'hidden_dims': '[512, 256]', 'dropout': 0.10991763221837625, 'batch_norm': True, 'lr': 9.079476714755926e-05, 'weight_decay': 3.1473198049252e-07, 'epochs': 175, 'loss': 'mse', 'optimizer': 'adam', 'graph_mode': 'off', 'use_snp_selection': False}. Best is trial 7 with value: 0.11937346209676132.
[I 2025-12-05 14:41:31,698] Trial 32 finished with value: 0.08351887510795998 and parameters: {'model_type': 'mlp', 'hidden_dims': '[512, 256]', 'dropout': 0.12875022997072189, 'batch_norm': True, 'lr': 3.035088004027062e-05, 'weight_decay': 3.9085714506067526e-07, 'epochs': 158, 'loss': 'mse', 'optimizer': 'adam', 'graph_mode': 'off', 'use_snp_selection': False}. Best is trial 7 with value: 0.11937346209676132.
[I 2025-12-05 14:41:33,785] Trial 33 finished with value: 0.10322714206315774 and parameters: {'model_type': 'mlp', 'hidden_dims': '[512, 256]', 'dropout': 0.2275323665509701, 'batch_norm': True, 'lr': 0.00013745053213108437, 'weight_decay': 4.982607587459388e-06, 'epochs': 105, 'loss': 'mse', 'optimizer': 'adam', 'graph_mode': 'off', 'use_snp_selection': False}. Best is trial 7 with value: 0.11937346209676132.
[I 2025-12-05 14:41:36,709] Trial 34 finished with value: 0.10621721785164805 and parameters: {'model_type': 'mlp', 'hidden_dims': '[512, 128]', 'dropout': 0.16997035187346096, 'batch_norm': True, 'lr': 8.122161105850805e-05, 'weight_decay': 1.9525389131100973e-07, 'epochs': 174, 'loss': 'mse', 'optimizer': 'adam', 'graph_mode': 'off', 'use_snp_selection': False}. Best is trial 7 with value: 0.11937346209676132.
[I 2025-12-05 14:41:37,705] Trial 35 finished with value: 0.11580887537643586 and parameters: {'model_type': 'mlp', 'hidden_dims': '[128, 64]', 'dropout': 0.18747967137150173, 'batch_norm': False, 'lr': 0.00021009466938170577, 'weight_decay': 1.8649467141177418e-06, 'epochs': 137, 'loss': 'mse', 'optimizer': 'adam', 'graph_mode': 'off', 'use_snp_selection': False}. Best is trial 7 with value: 0.11937346209676132.
[I 2025-12-05 14:41:41,142] Trial 36 finished with value: 0.1016891536165791 and parameters: {'model_type': 'mlp', 'hidden_dims': '[128, 64]', 'dropout': 0.2573154896273591, 'batch_norm': False, 'lr': 0.00025711309280034304, 'weight_decay': 2.248824387566297e-06, 'epochs': 139, 'loss': 'mse', 'optimizer': 'adam', 'graph_mode': 'off', 'use_snp_selection': True, 'num_snps': 58661}. Best is trial 7 with value: 0.11937346209676132.
[I 2025-12-05 14:41:41,986] Trial 37 finished with value: 0.09530344512333846 and parameters: {'model_type': 'mlp', 'hidden_dims': '[128, 64]', 'dropout': 0.20162747714756662, 'batch_norm': False, 'lr': 0.0004869336472575792, 'weight_decay': 1.8415663682713915e-05, 'epochs': 89, 'loss': 'mae', 'optimizer': 'adam', 'graph_mode': 'off', 'use_snp_selection': False}. Best is trial 7 with value: 0.11937346209676132.
[I 2025-12-05 14:41:44,061] Trial 38 finished with value: 0.08449179021430302 and parameters: {'model_type': 'mlp', 'hidden_dims': '[128, 64]', 'dropout': 0.36094593163548944, 'batch_norm': False, 'lr': 3.490287478856546e-05, 'weight_decay': 7.962212428233289e-07, 'epochs': 156, 'loss': 'mse', 'optimizer': 'adam', 'graph_mode': 'off', 'use_snp_selection': True, 'num_snps': 19911}. Best is trial 7 with value: 0.11937346209676132.
[I 2025-12-05 14:41:45,716] Trial 39 finished with value: 0.048660336499540394 and parameters: {'model_type': 'mlp', 'hidden_dims': '[512, 64]', 'dropout': 0.40491549826838436, 'batch_norm': False, 'lr': 0.0008533990180269198, 'weight_decay': 1.4787276849767253e-06, 'epochs': 71, 'loss': 'mae', 'optimizer': 'adam', 'graph_mode': 'off', 'use_snp_selection': False}. Best is trial 7 with value: 0.11937346209676132.
[I 2025-12-05 14:41:49,075] Trial 40 finished with value: 0.10053689942809929 and parameters: {'model_type': 'mlp', 'hidden_dims': '[512, 128]', 'dropout': 0.18100664360727906, 'batch_norm': False, 'lr': 4.767147905519569e-06, 'weight_decay': 1.2441968042512803e-05, 'epochs': 214, 'loss': 'mse', 'optimizer': 'adam', 'graph_mode': 'off', 'use_snp_selection': False}. Best is trial 7 with value: 0.11937346209676132.
[I 2025-12-05 14:41:51,486] Trial 41 finished with value: 0.096678380514174 and parameters: {'model_type': 'mlp', 'hidden_dims': '[512, 256]', 'dropout': 0.1425672194914473, 'batch_norm': False, 'lr': 2.320370617557869e-06, 'weight_decay': 4.6442150469511546e-06, 'epochs': 136, 'loss': 'mse', 'optimizer': 'adam', 'graph_mode': 'off', 'use_snp_selection': False}. Best is trial 7 with value: 0.11937346209676132.
[I 2025-12-05 14:41:54,479] Trial 42 finished with value: 0.0961512470178983 and parameters: {'model_type': 'mlp', 'hidden_dims': '[256, 128, 64]', 'dropout': 0.11996417946258145, 'batch_norm': True, 'lr': 0.00018085896590089737, 'weight_decay': 1.0652014863727442e-07, 'epochs': 348, 'loss': 'mse', 'optimizer': 'adam', 'graph_mode': 'off', 'use_snp_selection': False}. Best is trial 7 with value: 0.11937346209676132.
[I 2025-12-05 14:41:55,709] Trial 43 finished with value: 0.10761063468101521 and parameters: {'model_type': 'mlp', 'hidden_dims': '[128, 64]', 'dropout': 0.10415603547139413, 'batch_norm': True, 'lr': 7.952527479089124e-05, 'weight_decay': 4.613973988186821e-07, 'epochs': 188, 'loss': 'mse', 'optimizer': 'adam', 'graph_mode': 'off', 'use_snp_selection': False}. Best is trial 7 with value: 0.11937346209676132.
[I 2025-12-05 14:41:57,875] Trial 44 finished with value: 0.1014000786986034 and parameters: {'model_type': 'mlp', 'hidden_dims': '[512, 256]', 'dropout': 0.1402733734113478, 'batch_norm': True, 'lr': 0.00029968043824466216, 'weight_decay': 8.011468182093946e-07, 'epochs': 111, 'loss': 'mse', 'optimizer': 'adam', 'graph_mode': 'off', 'use_snp_selection': False}. Best is trial 7 with value: 0.11937346209676132.
[I 2025-12-05 14:42:00,387] Trial 45 finished with value: 0.08415311749652075 and parameters: {'model_type': 'mlp', 'hidden_dims': '[512, 64]', 'dropout': 0.18500813265582572, 'batch_norm': False, 'lr': 4.661530405232219e-05, 'weight_decay': 2.2286019007643186e-07, 'epochs': 144, 'loss': 'mse', 'optimizer': 'adam', 'graph_mode': 'off', 'use_snp_selection': False}. Best is trial 7 with value: 0.11937346209676132.
[I 2025-12-05 14:42:03,451] Trial 46 finished with value: 0.117405219772234 and parameters: {'model_type': 'mlp', 'hidden_dims': '[512, 256]', 'dropout': 0.3682346501233408, 'batch_norm': True, 'lr': 0.00011703687732925536, 'weight_decay': 2.0110380303608144e-06, 'epochs': 184, 'loss': 'mse', 'optimizer': 'adam', 'graph_mode': 'off', 'use_snp_selection': False}. Best is trial 7 with value: 0.11937346209676132.
[I 2025-12-05 14:42:05,747] Trial 47 finished with value: 0.0832580021596037 and parameters: {'model_type': 'mlp', 'hidden_dims': '[512, 256]', 'dropout': 0.31891152854499166, 'batch_norm': True, 'lr': 0.00019351195175057077, 'weight_decay': 2.986817416260153e-06, 'epochs': 124, 'loss': 'mae', 'optimizer': 'adam', 'graph_mode': 'off', 'use_snp_selection': False}. Best is trial 7 with value: 0.11937346209676132.
[I 2025-12-05 14:42:09,470] Trial 48 finished with value: 0.1038777715317587 and parameters: {'model_type': 'mlp', 'hidden_dims': '[512, 128]', 'dropout': 0.35955334695992874, 'batch_norm': True, 'lr': 6.699418420146042e-05, 'weight_decay': 6.126926157288785e-06, 'epochs': 237, 'loss': 'mse', 'optimizer': 'adam', 'graph_mode': 'off', 'use_snp_selection': False}. Best is trial 7 with value: 0.11937346209676132.
[I 2025-12-05 14:42:12,680] Trial 49 finished with value: 0.09886419431566273 and parameters: {'model_type': 'mlp', 'hidden_dims': '[128, 64]', 'dropout': 0.4366354223869369, 'batch_norm': False, 'lr': 0.00012814777684102725, 'weight_decay': 2.1448862265708293e-06, 'epochs': 195, 'loss': 'mae', 'optimizer': 'adam', 'graph_mode': 'off', 'use_snp_selection': True, 'num_snps': 46888}. Best is trial 7 with value: 0.11937346209676132.
[I 2025-12-05 14:42:15,312] Trial 50 finished with value: 0.09867908924951904 and parameters: {'model_type': 'mlp', 'hidden_dims': '[512, 256]', 'dropout': 0.4579193794196349, 'batch_norm': True, 'lr': 0.0004414559099669683, 'weight_decay': 1.2964896697126892e-05, 'epochs': 152, 'loss': 'mse', 'optimizer': 'adam', 'graph_mode': 'off', 'use_snp_selection': False}. Best is trial 7 with value: 0.11937346209676132.
[I 2025-12-05 14:42:18,200] Trial 51 finished with value: 0.08037454177534717 and parameters: {'model_type': 'mlp', 'hidden_dims': '[512, 256]', 'dropout': 0.3844120312889794, 'batch_norm': True, 'lr': 0.00010252536989029888, 'weight_decay': 1.5808855929339818e-07, 'epochs': 173, 'loss': 'mse', 'optimizer': 'adam', 'graph_mode': 'off', 'use_snp_selection': False}. Best is trial 7 with value: 0.11937346209676132.
[I 2025-12-05 14:42:21,375] Trial 52 finished with value: 0.10083356396575494 and parameters: {'model_type': 'mlp', 'hidden_dims': '[512, 256]', 'dropout': 0.27066752320308296, 'batch_norm': True, 'lr': 0.0001393006908214726, 'weight_decay': 1.519460331389669e-06, 'epochs': 192, 'loss': 'mse', 'optimizer': 'adam', 'graph_mode': 'off', 'use_snp_selection': False}. Best is trial 7 with value: 0.11937346209676132.
[I 2025-12-05 14:42:24,737] Trial 53 finished with value: 0.08288007729662952 and parameters: {'model_type': 'mlp', 'hidden_dims': '[512, 256]', 'dropout': 0.4178738403426007, 'batch_norm': True, 'lr': 4.388393142039393e-05, 'weight_decay': 6.879833416853552e-07, 'epochs': 208, 'loss': 'mse', 'optimizer': 'adam', 'graph_mode': 'off', 'use_snp_selection': False}. Best is trial 7 with value: 0.11937346209676132.
[I 2025-12-05 14:42:27,746] Trial 54 finished with value: 0.10277881066243272 and parameters: {'model_type': 'mlp', 'hidden_dims': '[512, 256]', 'dropout': 0.34299917597476154, 'batch_norm': True, 'lr': 0.00023003401494532753, 'weight_decay': 3.3892183471032776e-07, 'epochs': 182, 'loss': 'mse', 'optimizer': 'adam', 'graph_mode': 'off', 'use_snp_selection': False}. Best is trial 7 with value: 0.11937346209676132.
[I 2025-12-05 14:42:30,544] Trial 55 finished with value: 0.10536285360909006 and parameters: {'model_type': 'mlp', 'hidden_dims': '[512, 64]', 'dropout': 0.21986816240876303, 'batch_norm': True, 'lr': 0.00010530106006869303, 'weight_decay': 1.000330175776035e-06, 'epochs': 166, 'loss': 'mse', 'optimizer': 'adam', 'graph_mode': 'off', 'use_snp_selection': False}. Best is trial 7 with value: 0.11937346209676132.
[I 2025-12-05 14:42:31,877] Trial 56 finished with value: 0.07992689523776483 and parameters: {'model_type': 'mlp', 'hidden_dims': '[256, 128]', 'dropout': 0.30902757430178235, 'batch_norm': True, 'lr': 7.2129758698292e-05, 'weight_decay': 3.757542681572735e-06, 'epochs': 103, 'loss': 'mae', 'optimizer': 'adam', 'graph_mode': 'off', 'use_snp_selection': False}. Best is trial 7 with value: 0.11937346209676132.
[I 2025-12-05 14:42:35,420] Trial 57 finished with value: 0.0771611916585798 and parameters: {'model_type': 'mlp', 'hidden_dims': '[512, 256]', 'dropout': 0.3682072637761252, 'batch_norm': True, 'lr': 6.232077416221323e-05, 'weight_decay': 4.6184662714294154e-07, 'epochs': 221, 'loss': 'mse', 'optimizer': 'adam', 'graph_mode': 'off', 'use_snp_selection': False}. Best is trial 7 with value: 0.11937346209676132.
[I 2025-12-05 14:42:36,979] Trial 58 finished with value: 0.05009268409877263 and parameters: {'model_type': 'mlp', 'hidden_dims': '[256, 128, 64]', 'dropout': 0.28932497318063705, 'batch_norm': True, 'lr': 1.0795446007347502e-05, 'weight_decay': 9.424079565105799e-06, 'epochs': 130, 'loss': 'mae', 'optimizer': 'adam', 'graph_mode': 'off', 'use_snp_selection': False}. Best is trial 7 with value: 0.11937346209676132.
[I 2025-12-05 14:42:41,338] Trial 59 finished with value: 0.1087093629510037 and parameters: {'model_type': 'mlp', 'hidden_dims': '[512, 256]', 'dropout': 0.5093833972683453, 'batch_norm': False, 'lr': 0.0003350688812423521, 'weight_decay': 0.00014144043448895884, 'epochs': 299, 'loss': 'mse', 'optimizer': 'adam', 'graph_mode': 'off', 'use_snp_selection': False}. Best is trial 7 with value: 0.11937346209676132.
[I 2025-12-05 14:42:45,839] Trial 60 finished with value: 0.08662094395686275 and parameters: {'model_type': 'mlp', 'hidden_dims': '[512, 256]', 'dropout': 0.5142476363532219, 'batch_norm': False, 'lr': 0.0003150376269561511, 'weight_decay': 0.00036281617080361243, 'epochs': 307, 'loss': 'mae', 'optimizer': 'adam', 'graph_mode': 'off', 'use_snp_selection': False}. Best is trial 7 with value: 0.11937346209676132.
[I 2025-12-05 14:42:50,025] Trial 61 finished with value: 0.07899090723287629 and parameters: {'model_type': 'mlp', 'hidden_dims': '[512, 256]', 'dropout': 0.5753066395951072, 'batch_norm': False, 'lr': 0.00021883052997787714, 'weight_decay': 0.000819829256734232, 'epochs': 285, 'loss': 'mse', 'optimizer': 'adam', 'graph_mode': 'off', 'use_snp_selection': False}. Best is trial 7 with value: 0.11937346209676132.
[I 2025-12-05 14:42:53,827] Trial 62 finished with value: 0.09261277459048992 and parameters: {'model_type': 'mlp', 'hidden_dims': '[512, 256]', 'dropout': 0.487586698380089, 'batch_norm': False, 'lr': 0.0001528894040152854, 'weight_decay': 0.0001531037147413123, 'epochs': 251, 'loss': 'mse', 'optimizer': 'adam', 'graph_mode': 'off', 'use_snp_selection': False}. Best is trial 7 with value: 0.11937346209676132.
[I 2025-12-05 14:42:55,993] Trial 63 finished with value: 0.0843983588795046 and parameters: {'model_type': 'mlp', 'hidden_dims': '[512, 256]', 'dropout': 0.45393654689003404, 'batch_norm': False, 'lr': 0.0005010628480310789, 'weight_decay': 2.705472615073652e-05, 'epochs': 115, 'loss': 'mse', 'optimizer': 'adam', 'graph_mode': 'off', 'use_snp_selection': False}. Best is trial 7 with value: 0.11937346209676132.
[I 2025-12-05 14:42:57,726] Trial 64 finished with value: 0.06688600079628287 and parameters: {'model_type': 'mlp', 'hidden_dims': '[512, 256]', 'dropout': 0.5157413550068778, 'batch_norm': False, 'lr': 0.0003032251568057188, 'weight_decay': 2.8346965593761264e-07, 'epochs': 81, 'loss': 'mse', 'optimizer': 'adam', 'graph_mode': 'off', 'use_snp_selection': False}. Best is trial 7 with value: 0.11937346209676132.
[I 2025-12-05 14:43:00,301] Trial 65 finished with value: 0.11592233805540962 and parameters: {'model_type': 'mlp', 'hidden_dims': '[512, 256]', 'dropout': 0.15561995991658079, 'batch_norm': True, 'lr': 0.0007571093708956132, 'weight_decay': 1.535482435492118e-07, 'epochs': 147, 'loss': 'mse', 'optimizer': 'adam', 'graph_mode': 'off', 'use_snp_selection': False}. Best is trial 7 with value: 0.11937346209676132.
