[I 2025-12-06 09:04:39,549] Trial 73 finished with value: 0.3762183385425507 and parameters: {'model_type': 'mlp', 'hidden_dims': '[512, 128]', 'dropout': 0.4085783807643458, 'batch_norm': False, 'lr': 1.4607635284085171e-06, 'weight_decay': 3.2673166610237015e-06, 'epochs': 247, 'loss': 'mse', 'optimizer': 'adam', 'graph_mode': 'off', 'use_snp_selection': False}. Best is trial 33 with value: 0.3841059404310342.
[I 2025-12-06 09:04:51,873] Trial 74 finished with value: 0.3621533686362928 and parameters: {'model_type': 'mlp', 'hidden_dims': '[128, 64]', 'dropout': 0.3456779612856544, 'batch_norm': False, 'lr': 2.1796721313086142e-06, 'weight_decay': 1.3075260195937881e-05, 'epochs': 142, 'loss': 'mse', 'optimizer': 'adam', 'graph_mode': 'off', 'use_snp_selection': False}. Best is trial 33 with value: 0.3841059404310342.
[I 2025-12-06 09:05:44,294] Trial 75 finished with value: 0.3303644851658635 and parameters: {'model_type': 'mlp', 'hidden_dims': '[256, 128]', 'dropout': 0.4694523344748202, 'batch_norm': True, 'lr': 4.628849322163692e-06, 'weight_decay': 6.132983065366933e-06, 'epochs': 274, 'loss': 'mse', 'optimizer': 'adam', 'graph_mode': 'off', 'use_snp_selection': True, 'num_snps': 42261}. Best is trial 33 with value: 0.3841059404310342.
[I 2025-12-06 09:06:10,631] Trial 76 finished with value: 0.3834858097447511 and parameters: {'model_type': 'mlp', 'hidden_dims': '[256, 128, 64]', 'dropout': 0.4479652126892572, 'batch_norm': False, 'lr': 3.6192006549575585e-06, 'weight_decay': 4.971451143518021e-06, 'epochs': 218, 'loss': 'mse', 'optimizer': 'adam', 'graph_mode': 'off', 'use_snp_selection': False}. Best is trial 33 with value: 0.3841059404310342.
[I 2025-12-06 09:06:33,614] Trial 77 finished with value: 0.3794812094815204 and parameters: {'model_type': 'mlp', 'hidden_dims': '[256, 128, 64]', 'dropout': 0.3087619207985539, 'batch_norm': False, 'lr': 3.582597148688397e-06, 'weight_decay': 4.780733718383807e-06, 'epochs': 183, 'loss': 'mse', 'optimizer': 'adam', 'graph_mode': 'off', 'use_snp_selection': False}. Best is trial 33 with value: 0.3841059404310342.
[I 2025-12-06 09:06:57,565] Trial 78 finished with value: 0.3807258707075902 and parameters: {'model_type': 'mlp', 'hidden_dims': '[256, 128, 64]', 'dropout': 0.29512683072152984, 'batch_norm': False, 'lr': 5.514402093969178e-06, 'weight_decay': 4.975812319878071e-06, 'epochs': 192, 'loss': 'mse', 'optimizer': 'adam', 'graph_mode': 'off', 'use_snp_selection': False}. Best is trial 33 with value: 0.3841059404310342.
[I 2025-12-06 09:07:22,295] Trial 79 finished with value: 0.350308709062978 and parameters: {'model_type': 'mlp', 'hidden_dims': '[256, 128, 64]', 'dropout': 0.280169279141807, 'batch_norm': False, 'lr': 1.2337593533108374e-05, 'weight_decay': 2.461036216343284e-06, 'epochs': 201, 'loss': 'mse', 'optimizer': 'adam', 'graph_mode': 'off', 'use_snp_selection': False}. Best is trial 33 with value: 0.3841059404310342.
[I 2025-12-06 09:07:43,809] Trial 80 finished with value: 0.3689414468229321 and parameters: {'model_type': 'mlp', 'hidden_dims': '[256, 128, 64]', 'dropout': 0.37013611329101015, 'batch_norm': False, 'lr': 9.490133522681471e-06, 'weight_decay': 3.376311982931933e-06, 'epochs': 168, 'loss': 'mae', 'optimizer': 'adam', 'graph_mode': 'off', 'use_snp_selection': False}. Best is trial 33 with value: 0.3841059404310342.
[I 2025-12-06 09:08:07,960] Trial 81 finished with value: 0.3779518628182577 and parameters: {'model_type': 'mlp', 'hidden_dims': '[256, 128, 64]', 'dropout': 0.3134118628015582, 'batch_norm': False, 'lr': 5.665640666264511e-06, 'weight_decay': 4.938402243720674e-06, 'epochs': 194, 'loss': 'mse', 'optimizer': 'adam', 'graph_mode': 'off', 'use_snp_selection': False}. Best is trial 33 with value: 0.3841059404310342.
[I 2025-12-06 09:08:30,667] Trial 82 finished with value: 0.3822766802855842 and parameters: {'model_type': 'mlp', 'hidden_dims': '[256, 128, 64]', 'dropout': 0.22752534402093905, 'batch_norm': False, 'lr': 3.602409653767168e-06, 'weight_decay': 8.733013826019242e-06, 'epochs': 179, 'loss': 'mse', 'optimizer': 'adam', 'graph_mode': 'off', 'use_snp_selection': False}. Best is trial 33 with value: 0.3841059404310342.
[I 2025-12-06 09:08:51,136] Trial 83 finished with value: 0.3791138838075347 and parameters: {'model_type': 'mlp', 'hidden_dims': '[256, 128, 64]', 'dropout': 0.1929013344460609, 'batch_norm': False, 'lr': 2.6562678291603492e-06, 'weight_decay': 1.7489757075213838e-05, 'epochs': 157, 'loss': 'mse', 'optimizer': 'adam', 'graph_mode': 'off', 'use_snp_selection': False}. Best is trial 33 with value: 0.3841059404310342.
[I 2025-12-06 09:09:10,074] Trial 84 finished with value: 0.3802975227373627 and parameters: {'model_type': 'mlp', 'hidden_dims': '[256, 128, 64]', 'dropout': 0.18244121702155178, 'batch_norm': False, 'lr': 3.865476305142611e-06, 'weight_decay': 7.64241693003296e-06, 'epochs': 142, 'loss': 'mse', 'optimizer': 'adam', 'graph_mode': 'off', 'use_snp_selection': False}. Best is trial 33 with value: 0.3841059404310342.
[I 2025-12-06 09:09:25,493] Trial 85 finished with value: 0.3820587554530631 and parameters: {'model_type': 'mlp', 'hidden_dims': '[256, 128, 64]', 'dropout': 0.18343483152805126, 'batch_norm': False, 'lr': 6.496101464428981e-06, 'weight_decay': 7.038861953984702e-06, 'epochs': 107, 'loss': 'mse', 'optimizer': 'adam', 'graph_mode': 'off', 'use_snp_selection': False}. Best is trial 33 with value: 0.3841059404310342.
[I 2025-12-06 09:09:41,209] Trial 86 finished with value: 0.3820015283794896 and parameters: {'model_type': 'mlp', 'hidden_dims': '[256, 128, 64]', 'dropout': 0.2112221460515572, 'batch_norm': False, 'lr': 5.192372143346872e-06, 'weight_decay': 7.961990535865486e-06, 'epochs': 110, 'loss': 'mse', 'optimizer': 'adam', 'graph_mode': 'off', 'use_snp_selection': False}. Best is trial 33 with value: 0.3841059404310342.
[I 2025-12-06 09:09:55,878] Trial 87 finished with value: 0.38117984480429995 and parameters: {'model_type': 'mlp', 'hidden_dims': '[256, 128, 64]', 'dropout': 0.21822145571453677, 'batch_norm': False, 'lr': 7.819779105139952e-06, 'weight_decay': 1.6480986415682187e-06, 'epochs': 100, 'loss': 'mse', 'optimizer': 'adam', 'graph_mode': 'off', 'use_snp_selection': False}. Best is trial 33 with value: 0.3841059404310342.
[I 2025-12-06 09:10:11,400] Trial 88 finished with value: 0.31984407821927074 and parameters: {'model_type': 'mlp', 'hidden_dims': '[256, 128, 64]', 'dropout': 0.22985046939605874, 'batch_norm': True, 'lr': 7.813782599982295e-06, 'weight_decay': 1.7486427668404176e-06, 'epochs': 107, 'loss': 'mse', 'optimizer': 'adam', 'graph_mode': 'off', 'use_snp_selection': False}. Best is trial 33 with value: 0.3841059404310342.
[I 2025-12-06 09:10:23,755] Trial 89 finished with value: 0.37828308279723205 and parameters: {'model_type': 'mlp', 'hidden_dims': '[256, 128, 64]', 'dropout': 0.1413324607462385, 'batch_norm': False, 'lr': 6.386385817344847e-06, 'weight_decay': 1.3067569633010541e-06, 'epochs': 76, 'loss': 'mse', 'optimizer': 'adam', 'graph_mode': 'off', 'use_snp_selection': False}. Best is trial 33 with value: 0.3841059404310342.
[I 2025-12-06 09:10:37,486] Trial 90 finished with value: 0.37809524841486175 and parameters: {'model_type': 'mlp', 'hidden_dims': '[256, 128, 64]', 'dropout': 0.23228808209017535, 'batch_norm': False, 'lr': 5.447877962589654e-06, 'weight_decay': 6.810195798037497e-07, 'epochs': 90, 'loss': 'mse', 'optimizer': 'adam', 'graph_mode': 'off', 'use_snp_selection': False}. Best is trial 33 with value: 0.3841059404310342.
[I 2025-12-06 09:10:53,713] Trial 91 finished with value: 0.3601812127874895 and parameters: {'model_type': 'mlp', 'hidden_dims': '[256, 128, 64]', 'dropout': 0.16910440652889885, 'batch_norm': False, 'lr': 1.6220549609533565e-05, 'weight_decay': 3.970621471231964e-06, 'epochs': 115, 'loss': 'mse', 'optimizer': 'adam', 'graph_mode': 'off', 'use_snp_selection': False}. Best is trial 33 with value: 0.3841059404310342.
[I 2025-12-06 09:11:04,400] Trial 92 finished with value: 0.3741648365706142 and parameters: {'model_type': 'mlp', 'hidden_dims': '[256, 128, 64]', 'dropout': 0.2441516356373715, 'batch_norm': False, 'lr': 1.1099472923073015e-05, 'weight_decay': 5.731897241643048e-06, 'epochs': 60, 'loss': 'mse', 'optimizer': 'adam', 'graph_mode': 'off', 'use_snp_selection': False}. Best is trial 33 with value: 0.3841059404310342.
[I 2025-12-06 09:11:21,816] Trial 93 finished with value: 0.3773926336782266 and parameters: {'model_type': 'mlp', 'hidden_dims': '[256, 128, 64]', 'dropout': 0.20739436043966386, 'batch_norm': False, 'lr': 8.576384156987686e-06, 'weight_decay': 8.626228093170094e-06, 'epochs': 127, 'loss': 'mse', 'optimizer': 'adam', 'graph_mode': 'off', 'use_snp_selection': False}. Best is trial 33 with value: 0.3841059404310342.
[I 2025-12-06 09:11:35,436] Trial 94 finished with value: 0.3785898557873065 and parameters: {'model_type': 'mlp', 'hidden_dims': '[256, 128, 64]', 'dropout': 0.2123182216967894, 'batch_norm': False, 'lr': 4.970851727954198e-06, 'weight_decay': 7.022397231230558e-06, 'epochs': 89, 'loss': 'mse', 'optimizer': 'adam', 'graph_mode': 'off', 'use_snp_selection': False}. Best is trial 33 with value: 0.3841059404310342.
[I 2025-12-06 09:11:50,204] Trial 95 finished with value: 0.378406376754927 and parameters: {'model_type': 'mlp', 'hidden_dims': '[256, 128, 64]', 'dropout': 0.15279171097896665, 'batch_norm': False, 'lr': 6.400067591779728e-06, 'weight_decay': 1.504623109441604e-05, 'epochs': 100, 'loss': 'mse', 'optimizer': 'adam', 'graph_mode': 'off', 'use_snp_selection': False}. Best is trial 33 with value: 0.3841059404310342.
[I 2025-12-06 09:12:07,669] Trial 96 finished with value: 0.36096508638040603 and parameters: {'model_type': 'mlp', 'hidden_dims': '[256, 128, 64]', 'dropout': 0.21984549586796587, 'batch_norm': False, 'lr': 2.2377420714735703e-05, 'weight_decay': 2.7698241718089676e-06, 'epochs': 128, 'loss': 'mse', 'optimizer': 'adam', 'graph_mode': 'off', 'use_snp_selection': False}. Best is trial 33 with value: 0.3841059404310342.
[I 2025-12-06 09:12:25,900] Trial 97 finished with value: 0.3777050541827726 and parameters: {'model_type': 'mlp', 'hidden_dims': '[256, 128, 64]', 'dropout': 0.12725420150998762, 'batch_norm': False, 'lr': 3.211971810583698e-06, 'weight_decay': 2.405776055593983e-05, 'epochs': 134, 'loss': 'mse', 'optimizer': 'adam', 'graph_mode': 'off', 'use_snp_selection': False}. Best is trial 33 with value: 0.3841059404310342.
[I 2025-12-06 09:12:39,069] Trial 98 finished with value: 0.37499081529463113 and parameters: {'model_type': 'mlp', 'hidden_dims': '[256, 128, 64]', 'dropout': 0.18962150338851613, 'batch_norm': False, 'lr': 4.20635977402632e-06, 'weight_decay': 9.240026755674666e-06, 'epochs': 84, 'loss': 'mse', 'optimizer': 'adam', 'graph_mode': 'off', 'use_snp_selection': False}. Best is trial 33 with value: 0.3841059404310342.
[I 2025-12-06 09:12:50,386] Trial 99 finished with value: 0.3782518087885382 and parameters: {'model_type': 'mlp', 'hidden_dims': '[256, 128, 64]', 'dropout': 0.17067154448402821, 'batch_norm': False, 'lr': 4.821853179020514e-06, 'weight_decay': 3.526749258314937e-06, 'epochs': 66, 'loss': 'mse', 'optimizer': 'adam', 'graph_mode': 'off', 'use_snp_selection': False}. Best is trial 33 with value: 0.3841059404310342.
[I 2025-12-06 09:13:17,257] Trial 100 finished with value: 0.3564576927314719 and parameters: {'model_type': 'mlp', 'hidden_dims': '[512, 64]', 'dropout': 0.2543243332637409, 'batch_norm': False, 'lr': 8.112914675945931e-05, 'weight_decay': 1.0786821302428927e-05, 'epochs': 116, 'loss': 'mse', 'optimizer': 'adam', 'graph_mode': 'off', 'use_snp_selection': False}. Best is trial 33 with value: 0.3841059404310342.
[I 2025-12-06 09:13:36,203] Trial 101 finished with value: 0.38058951065296603 and parameters: {'model_type': 'mlp', 'hidden_dims': '[256, 128, 64]', 'dropout': 0.18326059336015932, 'batch_norm': False, 'lr': 3.7879603955510945e-06, 'weight_decay': 5.461652388764158e-06, 'epochs': 141, 'loss': 'mse', 'optimizer': 'adam', 'graph_mode': 'off', 'use_snp_selection': False}. Best is trial 33 with value: 0.3841059404310342.
[I 2025-12-06 09:13:51,498] Trial 102 finished with value: 0.3710890083815489 and parameters: {'model_type': 'mlp', 'hidden_dims': '[256, 128, 64]', 'dropout': 0.17153705401225575, 'batch_norm': False, 'lr': 2.977169622754023e-06, 'weight_decay': 4.978541554017314e-06, 'epochs': 105, 'loss': 'mse', 'optimizer': 'adam', 'graph_mode': 'off', 'use_snp_selection': False}. Best is trial 33 with value: 0.3841059404310342.
[I 2025-12-06 09:14:08,503] Trial 103 finished with value: 0.3790326965842474 and parameters: {'model_type': 'mlp', 'hidden_dims': '[256, 128, 64]', 'dropout': 0.21848236545727134, 'batch_norm': False, 'lr': 3.8795006904216755e-06, 'weight_decay': 7.605939337845825e-06, 'epochs': 122, 'loss': 'mse', 'optimizer': 'adam', 'graph_mode': 'off', 'use_snp_selection': False}. Best is trial 33 with value: 0.3841059404310342.
[I 2025-12-06 09:14:31,237] Trial 104 finished with value: 0.36276170689099835 and parameters: {'model_type': 'mlp', 'hidden_dims': '[256, 128, 64]', 'dropout': 0.10368994338691476, 'batch_norm': False, 'lr': 7.50920339739296e-06, 'weight_decay': 5.223338346204522e-06, 'epochs': 179, 'loss': 'mse', 'optimizer': 'adam', 'graph_mode': 'off', 'use_snp_selection': False}. Best is trial 33 with value: 0.3841059404310342.
[I 2025-12-06 09:14:49,832] Trial 105 finished with value: 0.35925371811435625 and parameters: {'model_type': 'mlp', 'hidden_dims': '[256, 128, 64]', 'dropout': 0.2013211425201495, 'batch_norm': False, 'lr': 2.0591634115230035e-06, 'weight_decay': 1.9801551918718348e-05, 'epochs': 137, 'loss': 'mae', 'optimizer': 'adam', 'graph_mode': 'off', 'use_snp_selection': False}. Best is trial 33 with value: 0.3841059404310342.
[I 2025-12-06 09:15:13,605] Trial 106 finished with value: 0.30586203897985476 and parameters: {'model_type': 'mlp', 'hidden_dims': '[256, 128]', 'dropout': 0.24446385795853767, 'batch_norm': True, 'lr': 3.5963292035039485e-06, 'weight_decay': 6.050223772493148e-06, 'epochs': 188, 'loss': 'mse', 'optimizer': 'adam', 'graph_mode': 'off', 'use_snp_selection': False}. Best is trial 33 with value: 0.3841059404310342.
[I 2025-12-06 09:15:35,530] Trial 107 finished with value: 0.38424750014957565 and parameters: {'model_type': 'mlp', 'hidden_dims': '[256, 128, 64]', 'dropout': 0.2752848582532228, 'batch_norm': False, 'lr': 5.260285734287242e-06, 'weight_decay': 2.0094510704846923e-06, 'epochs': 171, 'loss': 'mse', 'optimizer': 'adam', 'graph_mode': 'off', 'use_snp_selection': False}. Best is trial 107 with value: 0.38424750014957565.
[I 2025-12-06 09:15:57,451] Trial 108 finished with value: 0.37912652236374406 and parameters: {'model_type': 'mlp', 'hidden_dims': '[256, 128, 64]', 'dropout': 0.2799231665768613, 'batch_norm': False, 'lr': 5.26883670559183e-06, 'weight_decay': 1.3390512577819676e-06, 'epochs': 171, 'loss': 'mse', 'optimizer': 'adam', 'graph_mode': 'off', 'use_snp_selection': False}. Best is trial 107 with value: 0.38424750014957565.
[I 2025-12-06 09:16:17,188] Trial 109 finished with value: 0.3783713331137492 and parameters: {'model_type': 'mlp', 'hidden_dims': '[256, 128, 64]', 'dropout': 0.2648657894385088, 'batch_norm': False, 'lr': 6.298199667916101e-06, 'weight_decay': 1.0014614724975017e-06, 'epochs': 149, 'loss': 'mse', 'optimizer': 'adam', 'graph_mode': 'off', 'use_snp_selection': False}. Best is trial 107 with value: 0.38424750014957565.
[I 2025-12-06 09:16:38,047] Trial 110 finished with value: 0.3774572803014771 and parameters: {'model_type': 'mlp', 'hidden_dims': '[256, 128, 64]', 'dropout': 0.1803271811656141, 'batch_norm': False, 'lr': 4.325027222904345e-06, 'weight_decay': 4.17263579973155e-06, 'epochs': 160, 'loss': 'mse', 'optimizer': 'adam', 'graph_mode': 'off', 'use_snp_selection': False}. Best is trial 107 with value: 0.38424750014957565.
[I 2025-12-06 09:16:52,613] Trial 111 finished with value: 0.3777919880675876 and parameters: {'model_type': 'mlp', 'hidden_dims': '[128, 64]', 'dropout': 0.29542035723227383, 'batch_norm': False, 'lr': 3.3461362388773423e-06, 'weight_decay': 1.84042369973966e-06, 'epochs': 182, 'loss': 'mse', 'optimizer': 'adam', 'graph_mode': 'off', 'use_snp_selection': False}. Best is trial 107 with value: 0.38424750014957565.
[I 2025-12-06 09:17:16,905] Trial 112 finished with value: 0.38059127842261964 and parameters: {'model_type': 'mlp', 'hidden_dims': '[256, 128, 64]', 'dropout': 0.4198313437022814, 'batch_norm': False, 'lr': 8.7872160212094e-06, 'weight_decay': 2.707031257037803e-06, 'epochs': 196, 'loss': 'mse', 'optimizer': 'adam', 'graph_mode': 'off', 'use_snp_selection': False}. Best is trial 107 with value: 0.38424750014957565.
[I 2025-12-06 09:17:41,072] Trial 113 finished with value: 0.3748173827140135 and parameters: {'model_type': 'mlp', 'hidden_dims': '[256, 128, 64]', 'dropout': 0.3305672799214867, 'batch_norm': False, 'lr': 9.004239924525865e-06, 'weight_decay': 3.002737206687272e-06, 'epochs': 194, 'loss': 'mse', 'optimizer': 'adam', 'graph_mode': 'off', 'use_snp_selection': False}. Best is trial 107 with value: 0.38424750014957565.
[I 2025-12-06 09:18:03,206] Trial 114 finished with value: 0.3660048364318002 and parameters: {'model_type': 'mlp', 'hidden_dims': '[256, 128, 64]', 'dropout': 0.19608483442748698, 'batch_norm': False, 'lr': 7.2168763606359855e-06, 'weight_decay': 2.528204839725572e-06, 'epochs': 173, 'loss': 'mse', 'optimizer': 'adam', 'graph_mode': 'off', 'use_snp_selection': False}. Best is trial 107 with value: 0.38424750014957565.
[I 2025-12-06 09:18:29,227] Trial 115 finished with value: 0.3569364744846845 and parameters: {'model_type': 'mlp', 'hidden_dims': '[256, 128, 64]', 'dropout': 0.3918298370794833, 'batch_norm': False, 'lr': 1.2844531713609387e-05, 'weight_decay': 1.9585216518514683e-06, 'epochs': 212, 'loss': 'mse', 'optimizer': 'adam', 'graph_mode': 'off', 'use_snp_selection': False}. Best is trial 107 with value: 0.38424750014957565.
[I 2025-12-06 09:18:44,032] Trial 116 finished with value: 0.36873534497958416 and parameters: {'model_type': 'mlp', 'hidden_dims': '[256, 128, 64]', 'dropout': 0.41971164129908517, 'batch_norm': False, 'lr': 5.86285841784501e-06, 'weight_decay': 1.4295111192199376e-06, 'epochs': 100, 'loss': 'mse', 'optimizer': 'adam', 'graph_mode': 'off', 'use_snp_selection': False}. Best is trial 107 with value: 0.38424750014957565.
[I 2025-12-06 09:19:04,216] Trial 117 finished with value: 0.3655081320025576 and parameters: {'model_type': 'mlp', 'hidden_dims': '[256, 128, 64]', 'dropout': 0.235186056803803, 'batch_norm': False, 'lr': 1.0973468285976585e-05, 'weight_decay': 3.5756725564780085e-06, 'epochs': 154, 'loss': 'mse', 'optimizer': 'adam', 'graph_mode': 'off', 'use_snp_selection': False}. Best is trial 107 with value: 0.38424750014957565.
[I 2025-12-06 09:19:25,466] Trial 118 finished with value: 0.3759223751031577 and parameters: {'model_type': 'mlp', 'hidden_dims': '[256, 128, 64]', 'dropout': 0.2220170092584757, 'batch_norm': False, 'lr': 4.822250000828806e-06, 'weight_decay': 2.2174025673727058e-06, 'epochs': 164, 'loss': 'mse', 'optimizer': 'adam', 'graph_mode': 'off', 'use_snp_selection': False}. Best is trial 107 with value: 0.38424750014957565.
[I 2025-12-06 09:19:50,220] Trial 119 finished with value: 0.364774832306641 and parameters: {'model_type': 'mlp', 'hidden_dims': '[256, 128, 64]', 'dropout': 0.26995568835580663, 'batch_norm': False, 'lr': 2.6036378656026732e-06, 'weight_decay': 6.539154207321801e-06, 'epochs': 198, 'loss': 'mae', 'optimizer': 'adam', 'graph_mode': 'off', 'use_snp_selection': False}. Best is trial 107 with value: 0.38424750014957565.
[I 2025-12-06 09:20:16,427] Trial 120 finished with value: 0.3641468389234909 and parameters: {'model_type': 'mlp', 'hidden_dims': '[512, 64]', 'dropout': 0.15952489686426827, 'batch_norm': False, 'lr': 8.873074283998836e-06, 'weight_decay': 4.410473833595007e-06, 'epochs': 109, 'loss': 'mse', 'optimizer': 'adam', 'graph_mode': 'off', 'use_snp_selection': False}. Best is trial 107 with value: 0.38424750014957565.
[I 2025-12-06 09:20:40,072] Trial 121 finished with value: 0.3734788627405668 and parameters: {'model_type': 'mlp', 'hidden_dims': '[256, 128, 64]', 'dropout': 0.4444549455672452, 'batch_norm': False, 'lr': 2.9414687975413078e-06, 'weight_decay': 1.1044435408593172e-05, 'epochs': 188, 'loss': 'mse', 'optimizer': 'adam', 'graph_mode': 'off', 'use_snp_selection': False}. Best is trial 107 with value: 0.38424750014957565.
[I 2025-12-06 09:21:06,092] Trial 122 finished with value: 0.37342487599571217 and parameters: {'model_type': 'mlp', 'hidden_dims': '[256, 128, 64]', 'dropout': 0.42589194919386825, 'batch_norm': False, 'lr': 4.190926762657099e-06, 'weight_decay': 1.3350439637437138e-05, 'epochs': 211, 'loss': 'mse', 'optimizer': 'adam', 'graph_mode': 'off', 'use_snp_selection': False}. Best is trial 107 with value: 0.38424750014957565.
[I 2025-12-06 09:21:33,003] Trial 123 finished with value: 0.3799919913532944 and parameters: {'model_type': 'mlp', 'hidden_dims': '[256, 128, 64]', 'dropout': 0.2062909546870931, 'batch_norm': False, 'lr': 2.412944224827492e-06, 'weight_decay': 8.63007308396704e-06, 'epochs': 220, 'loss': 'mse', 'optimizer': 'adam', 'graph_mode': 'off', 'use_snp_selection': False}. Best is trial 107 with value: 0.38424750014957565.
[I 2025-12-06 09:21:58,382] Trial 124 finished with value: 0.36797954351120293 and parameters: {'model_type': 'mlp', 'hidden_dims': '[256, 128]', 'dropout': 0.41147423902295244, 'batch_norm': False, 'lr': 6.733610219488095e-06, 'weight_decay': 5.506272491295368e-06, 'epochs': 205, 'loss': 'mse', 'optimizer': 'adam', 'graph_mode': 'off', 'use_snp_selection': False}. Best is trial 107 with value: 0.38424750014957565.
