[I 2025-12-06 00:00:17,739] Trial 77 finished with value: 0.2938463489572346 and parameters: {'model_type': 'mlp', 'hidden_dims': '[512, 256]', 'dropout': 0.15223595709016619, 'batch_norm': True, 'lr': 7.510397094560247e-05, 'weight_decay': 1.8469478830462128e-06, 'epochs': 192, 'loss': 'mae', 'optimizer': 'adam', 'graph_mode': 'off', 'use_snp_selection': True, 'num_snps': 47886}. Best is trial 9 with value: 0.3016673276975667.
[I 2025-12-06 00:01:04,012] Trial 78 finished with value: 0.2934428603233901 and parameters: {'model_type': 'mlp', 'hidden_dims': '[512, 256]', 'dropout': 0.13560443959831966, 'batch_norm': True, 'lr': 0.00021422311040993926, 'weight_decay': 3.3147931192818536e-07, 'epochs': 233, 'loss': 'mse', 'optimizer': 'adam', 'graph_mode': 'off', 'use_snp_selection': False}. Best is trial 9 with value: 0.3016673276975667.
[I 2025-12-06 00:01:58,329] Trial 79 finished with value: 0.28185685294484797 and parameters: {'model_type': 'mlp', 'hidden_dims': '[512, 128]', 'dropout': 0.49521264479573135, 'batch_norm': False, 'lr': 4.1385175567836505e-05, 'weight_decay': 5.557303818283798e-07, 'epochs': 283, 'loss': 'mse', 'optimizer': 'adam', 'graph_mode': 'off', 'use_snp_selection': False}. Best is trial 9 with value: 0.3016673276975667.
[I 2025-12-06 00:02:44,641] Trial 80 finished with value: 0.28863824675717076 and parameters: {'model_type': 'mlp', 'hidden_dims': '[512, 256]', 'dropout': 0.22517943603354484, 'batch_norm': True, 'lr': 0.00039291314809310267, 'weight_decay': 0.0005885994080302396, 'epochs': 210, 'loss': 'mae', 'optimizer': 'adam', 'graph_mode': 'off', 'use_snp_selection': True, 'num_snps': 29074}. Best is trial 9 with value: 0.3016673276975667.
[I 2025-12-06 00:03:20,448] Trial 81 finished with value: 0.2953282055412037 and parameters: {'model_type': 'mlp', 'hidden_dims': '[512, 256]', 'dropout': 0.12631307333402747, 'batch_norm': True, 'lr': 7.364314941988921e-05, 'weight_decay': 4.602116487652267e-07, 'epochs': 174, 'loss': 'mse', 'optimizer': 'adam', 'graph_mode': 'off', 'use_snp_selection': False}. Best is trial 9 with value: 0.3016673276975667.
[I 2025-12-06 00:03:55,323] Trial 82 finished with value: 0.2933234628925402 and parameters: {'model_type': 'mlp', 'hidden_dims': '[512, 256]', 'dropout': 0.11705873211608801, 'batch_norm': True, 'lr': 6.061455922571745e-05, 'weight_decay': 4.750446651456679e-07, 'epochs': 168, 'loss': 'mse', 'optimizer': 'adam', 'graph_mode': 'off', 'use_snp_selection': False}. Best is trial 9 with value: 0.3016673276975667.
[I 2025-12-06 00:04:32,527] Trial 83 finished with value: 0.2960881944817245 and parameters: {'model_type': 'mlp', 'hidden_dims': '[512, 256]', 'dropout': 0.3352838186145597, 'batch_norm': True, 'lr': 0.00011258357822857711, 'weight_decay': 6.808245910542578e-07, 'epochs': 181, 'loss': 'mse', 'optimizer': 'adam', 'graph_mode': 'off', 'use_snp_selection': False}. Best is trial 9 with value: 0.3016673276975667.
[I 2025-12-06 00:05:13,111] Trial 84 finished with value: 0.2969197119228976 and parameters: {'model_type': 'mlp', 'hidden_dims': '[512, 256]', 'dropout': 0.30554197454374066, 'batch_norm': True, 'lr': 6.948535170357905e-05, 'weight_decay': 7.801543657541118e-07, 'epochs': 200, 'loss': 'mse', 'optimizer': 'adam', 'graph_mode': 'off', 'use_snp_selection': False}. Best is trial 9 with value: 0.3016673276975667.
[I 2025-12-06 00:05:27,657] Trial 85 finished with value: 0.28619351450902053 and parameters: {'model_type': 'mlp', 'hidden_dims': '[128, 64]', 'dropout': 0.352525979987371, 'batch_norm': True, 'lr': 0.00016801946338964043, 'weight_decay': 7.894084326464426e-07, 'epochs': 196, 'loss': 'mse', 'optimizer': 'adam', 'graph_mode': 'off', 'use_snp_selection': False}. Best is trial 9 with value: 0.3016673276975667.
[I 2025-12-06 00:06:09,255] Trial 86 finished with value: 0.2918823459269575 and parameters: {'model_type': 'mlp', 'hidden_dims': '[512, 256]', 'dropout': 0.3656291762783892, 'batch_norm': True, 'lr': 1.0694871743774163e-05, 'weight_decay': 9.661519831268433e-07, 'epochs': 206, 'loss': 'mse', 'optimizer': 'adam', 'graph_mode': 'off', 'use_snp_selection': False}. Best is trial 9 with value: 0.3016673276975667.
[I 2025-12-06 00:06:33,864] Trial 87 finished with value: 0.2849070777481707 and parameters: {'model_type': 'mlp', 'hidden_dims': '[256, 128]', 'dropout': 0.28367163281762775, 'batch_norm': False, 'lr': 2.337564433423892e-05, 'weight_decay': 1.4606144037792247e-06, 'epochs': 220, 'loss': 'mse', 'optimizer': 'adam', 'graph_mode': 'off', 'use_snp_selection': False}. Best is trial 9 with value: 0.3016673276975667.
[I 2025-12-06 00:07:32,428] Trial 88 finished with value: 0.2894456231916428 and parameters: {'model_type': 'mlp', 'hidden_dims': '[512, 256]', 'dropout': 0.323512897641621, 'batch_norm': True, 'lr': 1.7808171395868833e-06, 'weight_decay': 6.125023345406375e-07, 'epochs': 302, 'loss': 'mse', 'optimizer': 'adam', 'graph_mode': 'off', 'use_snp_selection': False}. Best is trial 9 with value: 0.3016673276975667.
[I 2025-12-06 00:08:00,196] Trial 89 finished with value: 0.28298274271293644 and parameters: {'model_type': 'mlp', 'hidden_dims': '[512, 64]', 'dropout': 0.39109125192606836, 'batch_norm': True, 'lr': 3.202491831044127e-05, 'weight_decay': 1.0477411897350522e-06, 'epochs': 156, 'loss': 'mae', 'optimizer': 'adam', 'graph_mode': 'off', 'use_snp_selection': True, 'num_snps': 9634}. Best is trial 9 with value: 0.3016673276975667.
[I 2025-12-06 00:08:49,811] Trial 90 finished with value: 0.29441922084987027 and parameters: {'model_type': 'mlp', 'hidden_dims': '[512, 256]', 'dropout': 0.31874515568686695, 'batch_norm': True, 'lr': 5.38934862158593e-05, 'weight_decay': 2.483698913127892e-06, 'epochs': 252, 'loss': 'mse', 'optimizer': 'adam', 'graph_mode': 'off', 'use_snp_selection': False}. Best is trial 9 with value: 0.3016673276975667.
[I 2025-12-06 00:09:25,800] Trial 91 finished with value: 0.29282474232371764 and parameters: {'model_type': 'mlp', 'hidden_dims': '[512, 256]', 'dropout': 0.4452489535147255, 'batch_norm': True, 'lr': 7.279751432651859e-05, 'weight_decay': 4.192164599979276e-07, 'epochs': 174, 'loss': 'mse', 'optimizer': 'adam', 'graph_mode': 'off', 'use_snp_selection': False}. Best is trial 9 with value: 0.3016673276975667.
[I 2025-12-06 00:10:02,990] Trial 92 finished with value: 0.2924842570406518 and parameters: {'model_type': 'mlp', 'hidden_dims': '[512, 256]', 'dropout': 0.3060609695064307, 'batch_norm': True, 'lr': 0.00012670635450244826, 'weight_decay': 2.649292763849704e-07, 'epochs': 181, 'loss': 'mse', 'optimizer': 'adam', 'graph_mode': 'off', 'use_snp_selection': False}. Best is trial 9 with value: 0.3016673276975667.
[I 2025-12-06 00:10:36,610] Trial 93 finished with value: 0.2998933265378943 and parameters: {'model_type': 'mlp', 'hidden_dims': '[512, 256]', 'dropout': 0.16227634764848756, 'batch_norm': True, 'lr': 8.577684488124423e-05, 'weight_decay': 7.00073484361389e-07, 'epochs': 161, 'loss': 'mse', 'optimizer': 'adam', 'graph_mode': 'off', 'use_snp_selection': False}. Best is trial 9 with value: 0.3016673276975667.
[I 2025-12-06 00:11:28,653] Trial 94 finished with value: 0.293224451611416 and parameters: {'model_type': 'mlp', 'hidden_dims': '[512, 256]', 'dropout': 0.3436651279249294, 'batch_norm': True, 'lr': 8.799036503124933e-05, 'weight_decay': 6.945685165578224e-07, 'epochs': 265, 'loss': 'mse', 'optimizer': 'adam', 'graph_mode': 'off', 'use_snp_selection': False}. Best is trial 9 with value: 0.3016673276975667.
[I 2025-12-06 00:12:02,635] Trial 95 finished with value: 0.2804017001427008 and parameters: {'model_type': 'mlp', 'hidden_dims': '[512, 128]', 'dropout': 0.25760035780297014, 'batch_norm': True, 'lr': 4.619290049382557e-06, 'weight_decay': 1.6139744207990715e-06, 'epochs': 163, 'loss': 'mse', 'optimizer': 'adam', 'graph_mode': 'off', 'use_snp_selection': False}. Best is trial 9 with value: 0.3016673276975667.
[I 2025-12-06 00:12:32,077] Trial 96 finished with value: 0.28372068870522893 and parameters: {'model_type': 'mlp', 'hidden_dims': '[512, 256]', 'dropout': 0.16033084978322135, 'batch_norm': False, 'lr': 9.634751526015559e-05, 'weight_decay': 1.2458634355860566e-06, 'epochs': 139, 'loss': 'mae', 'optimizer': 'adam', 'graph_mode': 'off', 'use_snp_selection': False}. Best is trial 9 with value: 0.3016673276975667.
[I 2025-12-06 00:13:02,101] Trial 97 finished with value: 0.2922181166378046 and parameters: {'model_type': 'mlp', 'hidden_dims': '[256, 128, 64]', 'dropout': 0.17502991629188266, 'batch_norm': True, 'lr': 0.00014384328050392748, 'weight_decay': 3.3643573829658786e-07, 'epochs': 273, 'loss': 'mse', 'optimizer': 'adam', 'graph_mode': 'off', 'use_snp_selection': False}. Best is trial 9 with value: 0.3016673276975667.
[I 2025-12-06 00:13:49,793] Trial 98 finished with value: 0.29124026191517327 and parameters: {'model_type': 'mlp', 'hidden_dims': '[512, 256]', 'dropout': 0.3784976739401459, 'batch_norm': True, 'lr': 4.339851104156673e-05, 'weight_decay': 2.0864882235284732e-07, 'epochs': 240, 'loss': 'mse', 'optimizer': 'adam', 'graph_mode': 'off', 'use_snp_selection': False}. Best is trial 9 with value: 0.3016673276975667.
[I 2025-12-06 00:14:23,807] Trial 99 finished with value: 0.2942009428477331 and parameters: {'model_type': 'mlp', 'hidden_dims': '[512, 256]', 'dropout': 0.199855102275925, 'batch_norm': True, 'lr': 0.00011585395074697143, 'weight_decay': 1.400671094221995e-07, 'epochs': 203, 'loss': 'mae', 'optimizer': 'adam', 'graph_mode': 'off', 'use_snp_selection': True, 'num_snps': 14786}. Best is trial 9 with value: 0.3016673276975667.
[I 2025-12-06 00:15:08,876] Trial 100 finished with value: 0.2875092228963534 and parameters: {'model_type': 'mlp', 'hidden_dims': '[512, 64]', 'dropout': 0.5417921142537152, 'batch_norm': True, 'lr': 0.0002746580904259497, 'weight_decay': 7.767759531363068e-07, 'epochs': 227, 'loss': 'mse', 'optimizer': 'adam', 'graph_mode': 'off', 'use_snp_selection': False}. Best is trial 9 with value: 0.3016673276975667.
[I 2025-12-06 00:15:47,680] Trial 101 finished with value: 0.29304139294234643 and parameters: {'model_type': 'mlp', 'hidden_dims': '[512, 256]', 'dropout': 0.12460197113286468, 'batch_norm': True, 'lr': 5.9734550042900225e-05, 'weight_decay': 5.265660716416046e-07, 'epochs': 190, 'loss': 'mse', 'optimizer': 'adam', 'graph_mode': 'off', 'use_snp_selection': False}. Best is trial 9 with value: 0.3016673276975667.
[I 2025-12-06 00:16:25,153] Trial 102 finished with value: 0.29446353071322945 and parameters: {'model_type': 'mlp', 'hidden_dims': '[512, 256]', 'dropout': 0.13626115902461847, 'batch_norm': True, 'lr': 7.03758344793056e-05, 'weight_decay': 4.5540057377069196e-07, 'epochs': 182, 'loss': 'mse', 'optimizer': 'adam', 'graph_mode': 'off', 'use_snp_selection': False}. Best is trial 9 with value: 0.3016673276975667.
[I 2025-12-06 00:16:59,941] Trial 103 finished with value: 0.29779916125786565 and parameters: {'model_type': 'mlp', 'hidden_dims': '[512, 256]', 'dropout': 0.10838860028874868, 'batch_norm': True, 'lr': 7.831629863438126e-05, 'weight_decay': 6.54276089360814e-07, 'epochs': 167, 'loss': 'mse', 'optimizer': 'adam', 'graph_mode': 'off', 'use_snp_selection': False}. Best is trial 9 with value: 0.3016673276975667.
[I 2025-12-06 00:17:34,361] Trial 104 finished with value: 0.29263917213965024 and parameters: {'model_type': 'mlp', 'hidden_dims': '[512, 256]', 'dropout': 0.14825897528521034, 'batch_norm': True, 'lr': 3.592954364874797e-05, 'weight_decay': 8.004096354568866e-07, 'epochs': 165, 'loss': 'mse', 'optimizer': 'adam', 'graph_mode': 'off', 'use_snp_selection': False}. Best is trial 9 with value: 0.3016673276975667.
[I 2025-12-06 00:18:00,996] Trial 105 finished with value: 0.2949854243968446 and parameters: {'model_type': 'mlp', 'hidden_dims': '[512, 256]', 'dropout': 0.337363982788473, 'batch_norm': True, 'lr': 8.847208384798524e-05, 'weight_decay': 3.7410183898260575e-07, 'epochs': 121, 'loss': 'mse', 'optimizer': 'adam', 'graph_mode': 'off', 'use_snp_selection': False}. Best is trial 9 with value: 0.3016673276975667.
[I 2025-12-06 00:18:33,403] Trial 106 finished with value: 0.29213377855597417 and parameters: {'model_type': 'mlp', 'hidden_dims': '[512, 128]', 'dropout': 0.10917931513082847, 'batch_norm': True, 'lr': 0.0001702254539786037, 'weight_decay': 1.061510841385095e-06, 'epochs': 154, 'loss': 'mae', 'optimizer': 'adam', 'graph_mode': 'off', 'use_snp_selection': False}. Best is trial 9 with value: 0.3016673276975667.
[I 2025-12-06 00:18:48,050] Trial 107 finished with value: 0.2949409192570136 and parameters: {'model_type': 'mlp', 'hidden_dims': '[128, 64]', 'dropout': 0.10693759709056817, 'batch_norm': False, 'lr': 4.6752271420385464e-05, 'weight_decay': 1.3672559449156516e-06, 'epochs': 198, 'loss': 'mse', 'optimizer': 'adam', 'graph_mode': 'off', 'use_snp_selection': False}. Best is trial 9 with value: 0.3016673276975667.
[I 2025-12-06 00:19:21,593] Trial 108 finished with value: 0.2944681633054747 and parameters: {'model_type': 'mlp', 'hidden_dims': '[512, 256]', 'dropout': 0.10030995751914057, 'batch_norm': True, 'lr': 0.00011027252644258027, 'weight_decay': 1.7457154740433174e-06, 'epochs': 160, 'loss': 'mse', 'optimizer': 'adam', 'graph_mode': 'off', 'use_snp_selection': False}. Best is trial 9 with value: 0.3016673276975667.
[I 2025-12-06 00:20:28,765] Trial 109 finished with value: 0.29465148698305177 and parameters: {'model_type': 'mlp', 'hidden_dims': '[512, 256]', 'dropout': 0.24142004265753902, 'batch_norm': True, 'lr': 0.00014868202371840134, 'weight_decay': 6.635405285374775e-07, 'epochs': 213, 'loss': 'mae', 'optimizer': 'adam', 'graph_mode': 'off', 'use_snp_selection': True, 'num_snps': 51824}. Best is trial 9 with value: 0.3016673276975667.
[I 2025-12-06 00:20:57,511] Trial 110 finished with value: 0.2909945921278201 and parameters: {'model_type': 'mlp', 'hidden_dims': '[256, 128]', 'dropout': 0.13885618639056155, 'batch_norm': True, 'lr': 5.647046984725659e-05, 'weight_decay': 1.2019983532066853e-07, 'epochs': 261, 'loss': 'mse', 'optimizer': 'adam', 'graph_mode': 'off', 'use_snp_selection': False}. Best is trial 9 with value: 0.3016673276975667.
[I 2025-12-06 00:21:33,147] Trial 111 finished with value: 0.2940957128353546 and parameters: {'model_type': 'mlp', 'hidden_dims': '[512, 256]', 'dropout': 0.12800170821796497, 'batch_norm': True, 'lr': 7.983413264986865e-05, 'weight_decay': 5.012204647511649e-07, 'epochs': 172, 'loss': 'mse', 'optimizer': 'adam', 'graph_mode': 'off', 'use_snp_selection': False}. Best is trial 9 with value: 0.3016673276975667.
[I 2025-12-06 00:22:09,738] Trial 112 finished with value: 0.2956232919645627 and parameters: {'model_type': 'mlp', 'hidden_dims': '[512, 256]', 'dropout': 0.11583267975484364, 'batch_norm': True, 'lr': 7.252718891593321e-05, 'weight_decay': 2.8108641436958043e-07, 'epochs': 177, 'loss': 'mse', 'optimizer': 'adam', 'graph_mode': 'off', 'use_snp_selection': False}. Best is trial 9 with value: 0.3016673276975667.
[I 2025-12-06 00:22:46,481] Trial 113 finished with value: 0.29979511180371615 and parameters: {'model_type': 'mlp', 'hidden_dims': '[512, 256]', 'dropout': 0.11902668341033859, 'batch_norm': True, 'lr': 6.591586993464103e-05, 'weight_decay': 2.9038017273984323e-07, 'epochs': 178, 'loss': 'mse', 'optimizer': 'adam', 'graph_mode': 'off', 'use_snp_selection': False}. Best is trial 9 with value: 0.3016673276975667.
[I 2025-12-06 00:23:24,807] Trial 114 finished with value: 0.29582113543929434 and parameters: {'model_type': 'mlp', 'hidden_dims': '[512, 256]', 'dropout': 0.1598125186552305, 'batch_norm': True, 'lr': 0.00020521987566928833, 'weight_decay': 2.020137234427052e-07, 'epochs': 187, 'loss': 'mse', 'optimizer': 'adam', 'graph_mode': 'off', 'use_snp_selection': False}. Best is trial 9 with value: 0.3016673276975667.
[I 2025-12-06 00:23:59,770] Trial 115 finished with value: 0.29565310599998973 and parameters: {'model_type': 'mlp', 'hidden_dims': '[512, 256]', 'dropout': 0.11945082179835184, 'batch_norm': True, 'lr': 4.959677327998438e-05, 'weight_decay': 6.114853549475478e-07, 'epochs': 168, 'loss': 'mse', 'optimizer': 'adam', 'graph_mode': 'off', 'use_snp_selection': False}. Best is trial 9 with value: 0.3016673276975667.
[I 2025-12-06 00:24:56,071] Trial 116 finished with value: 0.2954206964284259 and parameters: {'model_type': 'mlp', 'hidden_dims': '[512, 64]', 'dropout': 0.14444993392822736, 'batch_norm': True, 'lr': 3.8993911223985784e-05, 'weight_decay': 3.033859097315623e-07, 'epochs': 290, 'loss': 'mse', 'optimizer': 'adam', 'graph_mode': 'off', 'use_snp_selection': False}. Best is trial 9 with value: 0.3016673276975667.
[I 2025-12-06 00:25:45,176] Trial 117 finished with value: 0.2855252204079264 and parameters: {'model_type': 'mlp', 'hidden_dims': '[512, 256]', 'dropout': 0.18378067938959716, 'batch_norm': False, 'lr': 2.978180605979622e-06, 'weight_decay': 3.397507198475189e-07, 'epochs': 249, 'loss': 'mae', 'optimizer': 'adam', 'graph_mode': 'off', 'use_snp_selection': False}. Best is trial 9 with value: 0.3016673276975667.
[I 2025-12-06 00:26:24,441] Trial 118 finished with value: 0.29338180330464797 and parameters: {'model_type': 'mlp', 'hidden_dims': '[512, 128]', 'dropout': 0.16604463276397916, 'batch_norm': True, 'lr': 0.00010110485773384741, 'weight_decay': 9.031860860494088e-07, 'epochs': 193, 'loss': 'mse', 'optimizer': 'adam', 'graph_mode': 'off', 'use_snp_selection': False}. Best is trial 9 with value: 0.3016673276975667.
[I 2025-12-06 00:27:01,882] Trial 119 finished with value: 0.28661456438702626 and parameters: {'model_type': 'mlp', 'hidden_dims': '[512, 256]', 'dropout': 0.1313491873962196, 'batch_norm': True, 'lr': 7.571300944435884e-06, 'weight_decay': 1.573681333081317e-07, 'epochs': 182, 'loss': 'mse', 'optimizer': 'adam', 'graph_mode': 'off', 'use_snp_selection': False}. Best is trial 9 with value: 0.3016673276975667.
[I 2025-12-06 00:27:58,838] Trial 120 finished with value: 0.2955666520244915 and parameters: {'model_type': 'mlp', 'hidden_dims': '[512, 256]', 'dropout': 0.15305139240201496, 'batch_norm': True, 'lr': 0.00013432358190228888, 'weight_decay': 1.1123193217132238e-06, 'epochs': 277, 'loss': 'mae', 'optimizer': 'adam', 'graph_mode': 'off', 'use_snp_selection': True, 'num_snps': 32835}. Best is trial 9 with value: 0.3016673276975667.
[I 2025-12-06 00:28:36,879] Trial 121 finished with value: 0.29191321541222637 and parameters: {'model_type': 'mlp', 'hidden_dims': '[512, 256]', 'dropout': 0.16058091765599597, 'batch_norm': True, 'lr': 0.00019837084603818242, 'weight_decay': 1.9717470199136703e-07, 'epochs': 186, 'loss': 'mse', 'optimizer': 'adam', 'graph_mode': 'off', 'use_snp_selection': False}. Best is trial 9 with value: 0.3016673276975667.
[I 2025-12-06 00:29:08,618] Trial 122 finished with value: 0.2971426814528596 and parameters: {'model_type': 'mlp', 'hidden_dims': '[512, 256]', 'dropout': 0.10618841266577499, 'batch_norm': True, 'lr': 0.00022416202504083982, 'weight_decay': 2.5164915566958183e-07, 'epochs': 150, 'loss': 'mse', 'optimizer': 'adam', 'graph_mode': 'off', 'use_snp_selection': False}. Best is trial 9 with value: 0.3016673276975667.
[I 2025-12-06 00:29:39,524] Trial 123 finished with value: 0.2970344371677487 and parameters: {'model_type': 'mlp', 'hidden_dims': '[512, 256]', 'dropout': 0.11805674277156426, 'batch_norm': True, 'lr': 0.00023260204888073783, 'weight_decay': 2.377329715196294e-07, 'epochs': 145, 'loss': 'mse', 'optimizer': 'adam', 'graph_mode': 'off', 'use_snp_selection': False}. Best is trial 9 with value: 0.3016673276975667.
[I 2025-12-06 00:30:07,415] Trial 124 finished with value: 0.29562998946019625 and parameters: {'model_type': 'mlp', 'hidden_dims': '[512, 256]', 'dropout': 0.1084468881342468, 'batch_norm': True, 'lr': 0.0002983681614235872, 'weight_decay': 2.3453234962843941e-07, 'epochs': 128, 'loss': 'mse', 'optimizer': 'adam', 'graph_mode': 'off', 'use_snp_selection': False}. Best is trial 9 with value: 0.3016673276975667.
[I 2025-12-06 00:30:37,617] Trial 125 finished with value: 0.2913624238643687 and parameters: {'model_type': 'mlp', 'hidden_dims': '[512, 256]', 'dropout': 0.11926169260102273, 'batch_norm': True, 'lr': 6.395098787491567e-05, 'weight_decay': 2.5841531419742867e-07, 'epochs': 141, 'loss': 'mse', 'optimizer': 'adam', 'graph_mode': 'off', 'use_snp_selection': False}. Best is trial 9 with value: 0.3016673276975667.
[I 2025-12-06 00:31:09,197] Trial 126 finished with value: 0.29264224844330095 and parameters: {'model_type': 'mlp', 'hidden_dims': '[512, 256]', 'dropout': 0.1350109667437217, 'batch_norm': True, 'lr': 0.0003355086229839526, 'weight_decay': 3.8278321931092385e-07, 'epochs': 149, 'loss': 'mse', 'optimizer': 'adam', 'graph_mode': 'off', 'use_snp_selection': False}. Best is trial 9 with value: 0.3016673276975667.
[I 2025-12-06 00:31:37,434] Trial 127 finished with value: 0.2974111822993088 and parameters: {'model_type': 'mlp', 'hidden_dims': '[512, 256]', 'dropout': 0.10046430027365176, 'batch_norm': True, 'lr': 0.00023271064300153148, 'weight_decay': 1.7480964962954256e-07, 'epochs': 130, 'loss': 'mse', 'optimizer': 'adam', 'graph_mode': 'off', 'use_snp_selection': False}. Best is trial 9 with value: 0.3016673276975667.
[I 2025-12-06 00:32:05,516] Trial 128 finished with value: 0.29273861900687964 and parameters: {'model_type': 'mlp', 'hidden_dims': '[512, 256]', 'dropout': 0.3082461153359677, 'batch_norm': True, 'lr': 0.00023383848812662852, 'weight_decay': 1.6740934335145312e-07, 'epochs': 129, 'loss': 'mse', 'optimizer': 'adam', 'graph_mode': 'off', 'use_snp_selection': False}. Best is trial 9 with value: 0.3016673276975667.
