[I 2025-12-06 08:22:43,065] Trial 21 finished with value: 0.37915613148251 and parameters: {'model_type': 'mlp', 'hidden_dims': '[512, 256]', 'dropout': 0.5551594855246745, 'batch_norm': False, 'lr': 3.090288347705094e-06, 'weight_decay': 0.0001547413022287012, 'epochs': 217, 'loss': 'mse', 'optimizer': 'adam', 'graph_mode': 'off', 'use_snp_selection': True, 'num_snps': 57741}. Best is trial 21 with value: 0.37915613148251.
[I 2025-12-06 08:23:52,651] Trial 22 finished with value: 0.37099549028873174 and parameters: {'model_type': 'mlp', 'hidden_dims': '[512, 256]', 'dropout': 0.5612442427378929, 'batch_norm': False, 'lr': 2.3406799539396974e-06, 'weight_decay': 0.00010197245846567733, 'epochs': 165, 'loss': 'mse', 'optimizer': 'adam', 'graph_mode': 'off', 'use_snp_selection': True, 'num_snps': 59634}. Best is trial 21 with value: 0.37915613148251.
[I 2025-12-06 08:24:23,879] Trial 23 finished with value: 0.22873183966825622 and parameters: {'model_type': 'mlp', 'hidden_dims': '[512, 256]', 'dropout': 0.5955385530142175, 'batch_norm': False, 'lr': 1.013036684073909e-06, 'weight_decay': 0.0005071058768810474, 'epochs': 128, 'loss': 'mse', 'optimizer': 'adam', 'graph_mode': 'off', 'use_snp_selection': True, 'num_snps': 13925}. Best is trial 21 with value: 0.37915613148251.
[I 2025-12-06 08:25:47,356] Trial 24 finished with value: 0.3680574917289595 and parameters: {'model_type': 'mlp', 'hidden_dims': '[512, 256]', 'dropout': 0.4677662200111916, 'batch_norm': False, 'lr': 3.0595332058180557e-06, 'weight_decay': 0.00011535570819680899, 'epochs': 312, 'loss': 'mse', 'optimizer': 'adam', 'graph_mode': 'off', 'use_snp_selection': True, 'num_snps': 49189}. Best is trial 21 with value: 0.37915613148251.
[I 2025-12-06 08:26:23,980] Trial 25 finished with value: 0.34459774450596353 and parameters: {'model_type': 'mlp', 'hidden_dims': '[256, 128, 64]', 'dropout': 0.5535429839103987, 'batch_norm': False, 'lr': 2.524955194001414e-05, 'weight_decay': 5.342793572259206e-06, 'epochs': 253, 'loss': 'mse', 'optimizer': 'adam', 'graph_mode': 'off', 'use_snp_selection': True, 'num_snps': 22126}. Best is trial 21 with value: 0.37915613148251.
[I 2025-12-06 08:26:46,836] Trial 26 finished with value: 0.2866324118858642 and parameters: {'model_type': 'mlp', 'hidden_dims': '[128, 64]', 'dropout': 0.5185589085998421, 'batch_norm': False, 'lr': 6.053640006278864e-06, 'weight_decay': 1.1709123669574253e-06, 'epochs': 194, 'loss': 'mse', 'optimizer': 'adam', 'graph_mode': 'off', 'use_snp_selection': True, 'num_snps': 2344}. Best is trial 21 with value: 0.37915613148251.
[I 2025-12-06 08:27:21,722] Trial 27 finished with value: 0.35173590892083084 and parameters: {'model_type': 'mlp', 'hidden_dims': '[256, 128]', 'dropout': 0.5586821557443514, 'batch_norm': False, 'lr': 9.977799701453788e-06, 'weight_decay': 2.271885450975891e-05, 'epochs': 310, 'loss': 'mse', 'optimizer': 'adam', 'graph_mode': 'off', 'use_snp_selection': False}. Best is trial 21 with value: 0.37915613148251.
[I 2025-12-06 08:28:31,492] Trial 28 finished with value: 0.3554506942494374 and parameters: {'model_type': 'mlp', 'hidden_dims': '[512, 64]', 'dropout': 0.46238280082582595, 'batch_norm': False, 'lr': 1.8081330005600177e-05, 'weight_decay': 0.00021074967784881466, 'epochs': 228, 'loss': 'mae', 'optimizer': 'adam', 'graph_mode': 'off', 'use_snp_selection': True, 'num_snps': 48700}. Best is trial 21 with value: 0.37915613148251.
[I 2025-12-06 08:29:04,887] Trial 29 finished with value: 0.3510334754523977 and parameters: {'model_type': 'mlp', 'hidden_dims': '[128, 64]', 'dropout': 0.23090703697841608, 'batch_norm': False, 'lr': 2.2341930466279717e-06, 'weight_decay': 7.13690662268439e-05, 'epochs': 184, 'loss': 'mae', 'optimizer': 'adam', 'graph_mode': 'off', 'use_snp_selection': True, 'num_snps': 26994}. Best is trial 21 with value: 0.37915613148251.
[I 2025-12-06 08:29:59,344] Trial 30 finished with value: 0.37769095350103926 and parameters: {'model_type': 'mlp', 'hidden_dims': '[512, 256]', 'dropout': 0.5703615999608569, 'batch_norm': False, 'lr': 3.0756340892240573e-06, 'weight_decay': 4.4131289510730833e-05, 'epochs': 260, 'loss': 'mse', 'optimizer': 'adam', 'graph_mode': 'off', 'use_snp_selection': False}. Best is trial 21 with value: 0.37915613148251.
[I 2025-12-06 08:30:54,242] Trial 31 finished with value: 0.37634793056116705 and parameters: {'model_type': 'mlp', 'hidden_dims': '[512, 256]', 'dropout': 0.5993030909641737, 'batch_norm': False, 'lr': 2.899983273771225e-06, 'weight_decay': 2.901482880467091e-05, 'epochs': 259, 'loss': 'mse', 'optimizer': 'adam', 'graph_mode': 'off', 'use_snp_selection': False}. Best is trial 21 with value: 0.37915613148251.
[I 2025-12-06 08:31:49,328] Trial 32 finished with value: 0.379627185076816 and parameters: {'model_type': 'mlp', 'hidden_dims': '[512, 256]', 'dropout': 0.553067964443912, 'batch_norm': False, 'lr': 2.5392991485115925e-06, 'weight_decay': 1.202566875901559e-05, 'epochs': 259, 'loss': 'mse', 'optimizer': 'adam', 'graph_mode': 'off', 'use_snp_selection': False}. Best is trial 32 with value: 0.379627185076816.
[I 2025-12-06 08:32:43,779] Trial 33 finished with value: 0.3841059404310342 and parameters: {'model_type': 'mlp', 'hidden_dims': '[512, 256]', 'dropout': 0.5402072361825131, 'batch_norm': False, 'lr': 2.629190844208157e-06, 'weight_decay': 1.0518694545807994e-05, 'epochs': 256, 'loss': 'mse', 'optimizer': 'adam', 'graph_mode': 'off', 'use_snp_selection': False}. Best is trial 33 with value: 0.3841059404310342.
[I 2025-12-06 08:33:30,600] Trial 34 finished with value: 0.3804055602179949 and parameters: {'model_type': 'mlp', 'hidden_dims': '[512, 256]', 'dropout': 0.42577093677012645, 'batch_norm': False, 'lr': 1.7712536811438254e-06, 'weight_decay': 1.1288470994087877e-05, 'epochs': 216, 'loss': 'mse', 'optimizer': 'adam', 'graph_mode': 'off', 'use_snp_selection': False}. Best is trial 33 with value: 0.3841059404310342.
[I 2025-12-06 08:34:16,053] Trial 35 finished with value: 0.3158005088424514 and parameters: {'model_type': 'mlp', 'hidden_dims': '[512, 256]', 'dropout': 0.4206374112617315, 'batch_norm': True, 'lr': 1.0314255209296193e-06, 'weight_decay': 1.0778289922214324e-05, 'epochs': 207, 'loss': 'mse', 'optimizer': 'adam', 'graph_mode': 'off', 'use_snp_selection': False}. Best is trial 33 with value: 0.3841059404310342.
[I 2025-12-06 08:35:03,654] Trial 36 finished with value: 0.3748514581052693 and parameters: {'model_type': 'mlp', 'hidden_dims': '[512, 256]', 'dropout': 0.36518318415141926, 'batch_norm': False, 'lr': 1.659712765128571e-06, 'weight_decay': 5.480633228402825e-06, 'epochs': 220, 'loss': 'mse', 'optimizer': 'adam', 'graph_mode': 'off', 'use_snp_selection': False}. Best is trial 33 with value: 0.3841059404310342.
[I 2025-12-06 08:36:11,709] Trial 37 finished with value: 0.37657531143263434 and parameters: {'model_type': 'mlp', 'hidden_dims': '[512, 256]', 'dropout': 0.49096207007818804, 'batch_norm': False, 'lr': 1.7865581675557838e-06, 'weight_decay': 1.3779270860988559e-05, 'epochs': 298, 'loss': 'mse', 'optimizer': 'adam', 'graph_mode': 'off', 'use_snp_selection': True, 'num_snps': 38290}. Best is trial 33 with value: 0.3841059404310342.
[I 2025-12-06 08:36:40,868] Trial 38 finished with value: 0.32483150866109145 and parameters: {'model_type': 'mlp', 'hidden_dims': '[256, 128]', 'dropout': 0.4146169749920121, 'batch_norm': True, 'lr': 4.850909763366592e-06, 'weight_decay': 7.70626460886649e-06, 'epochs': 243, 'loss': 'mse', 'optimizer': 'adam', 'graph_mode': 'off', 'use_snp_selection': False}. Best is trial 33 with value: 0.3841059404310342.
[I 2025-12-06 08:37:38,375] Trial 39 finished with value: 0.34799597999207127 and parameters: {'model_type': 'mlp', 'hidden_dims': '[256, 128, 64]', 'dropout': 0.528697638810463, 'batch_norm': False, 'lr': 1.201749098925232e-06, 'weight_decay': 1.6416033827479016e-06, 'epochs': 288, 'loss': 'mse', 'optimizer': 'adam', 'graph_mode': 'off', 'use_snp_selection': True, 'num_snps': 48815}. Best is trial 33 with value: 0.3841059404310342.
[I 2025-12-06 08:38:34,886] Trial 40 finished with value: 0.32364241400188654 and parameters: {'model_type': 'mlp', 'hidden_dims': '[512, 256]', 'dropout': 0.3381080410978039, 'batch_norm': True, 'lr': 2.166217078773291e-06, 'weight_decay': 2.864681283485174e-06, 'epochs': 266, 'loss': 'mse', 'optimizer': 'adam', 'graph_mode': 'off', 'use_snp_selection': False}. Best is trial 33 with value: 0.3841059404310342.
[I 2025-12-06 08:39:26,734] Trial 41 finished with value: 0.3735626696175953 and parameters: {'model_type': 'mlp', 'hidden_dims': '[512, 256]', 'dropout': 0.562825181020246, 'batch_norm': False, 'lr': 3.471774151704516e-06, 'weight_decay': 3.787934518313893e-05, 'epochs': 243, 'loss': 'mse', 'optimizer': 'adam', 'graph_mode': 'off', 'use_snp_selection': False}. Best is trial 33 with value: 0.3841059404310342.
[I 2025-12-06 08:40:23,119] Trial 42 finished with value: 0.3755638960355092 and parameters: {'model_type': 'mlp', 'hidden_dims': '[512, 256]', 'dropout': 0.47450399405206833, 'batch_norm': False, 'lr': 2.5310399466538627e-06, 'weight_decay': 7.795283749648562e-05, 'epochs': 266, 'loss': 'mse', 'optimizer': 'adam', 'graph_mode': 'off', 'use_snp_selection': False}. Best is trial 33 with value: 0.3841059404310342.
[I 2025-12-06 08:41:11,518] Trial 43 finished with value: 0.37737310026408805 and parameters: {'model_type': 'mlp', 'hidden_dims': '[512, 128]', 'dropout': 0.4390962809668691, 'batch_norm': False, 'lr': 1.493971158184008e-06, 'weight_decay': 1.6405931011240866e-05, 'epochs': 225, 'loss': 'mse', 'optimizer': 'adam', 'graph_mode': 'off', 'use_snp_selection': False}. Best is trial 33 with value: 0.3841059404310342.
[I 2025-12-06 08:42:04,347] Trial 44 finished with value: 0.35045274519325653 and parameters: {'model_type': 'mlp', 'hidden_dims': '[512, 256]', 'dropout': 0.5233639158519566, 'batch_norm': False, 'lr': 7.579053858433124e-06, 'weight_decay': 0.0003219778991409058, 'epochs': 248, 'loss': 'mse', 'optimizer': 'adam', 'graph_mode': 'off', 'use_snp_selection': False}. Best is trial 33 with value: 0.3841059404310342.
[I 2025-12-06 08:42:48,572] Trial 45 finished with value: 0.373940741189403 and parameters: {'model_type': 'mlp', 'hidden_dims': '[512, 256]', 'dropout': 0.5763885803255748, 'batch_norm': False, 'lr': 4.323154357917577e-06, 'weight_decay': 9.941992171270757e-06, 'epochs': 203, 'loss': 'mse', 'optimizer': 'adam', 'graph_mode': 'off', 'use_snp_selection': False}. Best is trial 33 with value: 0.3841059404310342.
[I 2025-12-06 08:43:24,893] Trial 46 finished with value: 0.3001899278262269 and parameters: {'model_type': 'mlp', 'hidden_dims': '[512, 256]', 'dropout': 0.38381991463064846, 'batch_norm': True, 'lr': 1.4809174196992823e-06, 'weight_decay': 3.503039104470214e-05, 'epochs': 160, 'loss': 'mse', 'optimizer': 'adam', 'graph_mode': 'off', 'use_snp_selection': False}. Best is trial 33 with value: 0.3841059404310342.
[I 2025-12-06 08:43:47,860] Trial 47 finished with value: 0.3576607270377181 and parameters: {'model_type': 'mlp', 'hidden_dims': '[256, 128]', 'dropout': 0.5152905166341607, 'batch_norm': False, 'lr': 9.487992374702257e-05, 'weight_decay': 0.0009669331628569786, 'epochs': 188, 'loss': 'mse', 'optimizer': 'adam', 'graph_mode': 'off', 'use_snp_selection': False}. Best is trial 33 with value: 0.3841059404310342.
[I 2025-12-06 08:44:56,734] Trial 48 finished with value: 0.3711338621795897 and parameters: {'model_type': 'mlp', 'hidden_dims': '[512, 256]', 'dropout': 0.5394868242018066, 'batch_norm': False, 'lr': 3.2064761081988353e-06, 'weight_decay': 4.512261549445878e-06, 'epochs': 331, 'loss': 'mse', 'optimizer': 'adam', 'graph_mode': 'off', 'use_snp_selection': False}. Best is trial 33 with value: 0.3841059404310342.
[I 2025-12-06 08:45:53,658] Trial 49 finished with value: 0.37198508382283163 and parameters: {'model_type': 'mlp', 'hidden_dims': '[512, 256]', 'dropout': 0.5749079107681253, 'batch_norm': False, 'lr': 1.965092656892446e-06, 'weight_decay': 5.5299543599377196e-05, 'epochs': 269, 'loss': 'mse', 'optimizer': 'adam', 'graph_mode': 'off', 'use_snp_selection': False}. Best is trial 33 with value: 0.3841059404310342.
[I 2025-12-06 08:46:56,023] Trial 50 finished with value: 0.3587587603099365 and parameters: {'model_type': 'mlp', 'hidden_dims': '[512, 128]', 'dropout': 0.48688942303140176, 'batch_norm': False, 'lr': 4.025723611437027e-06, 'weight_decay': 1.860235013783889e-05, 'epochs': 298, 'loss': 'mse', 'optimizer': 'adam', 'graph_mode': 'off', 'use_snp_selection': False}. Best is trial 33 with value: 0.3841059404310342.
[I 2025-12-06 08:47:44,273] Trial 51 finished with value: 0.3761301386422816 and parameters: {'model_type': 'mlp', 'hidden_dims': '[512, 128]', 'dropout': 0.43165969774151025, 'batch_norm': False, 'lr': 1.3841245700647093e-06, 'weight_decay': 1.4797367773300664e-05, 'epochs': 224, 'loss': 'mse', 'optimizer': 'adam', 'graph_mode': 'off', 'use_snp_selection': False}. Best is trial 33 with value: 0.3841059404310342.
[I 2025-12-06 08:48:33,454] Trial 52 finished with value: 0.3791655175713986 and parameters: {'model_type': 'mlp', 'hidden_dims': '[512, 128]', 'dropout': 0.4479508417026223, 'batch_norm': False, 'lr': 1.7155988723457458e-06, 'weight_decay': 1.0082603052853818e-05, 'epochs': 229, 'loss': 'mse', 'optimizer': 'adam', 'graph_mode': 'off', 'use_snp_selection': False}. Best is trial 33 with value: 0.3841059404310342.
[I 2025-12-06 08:49:23,700] Trial 53 finished with value: 0.37401415200521904 and parameters: {'model_type': 'mlp', 'hidden_dims': '[512, 128]', 'dropout': 0.5456311826318919, 'batch_norm': False, 'lr': 2.7322949948694153e-06, 'weight_decay': 8.402430079522819e-06, 'epochs': 235, 'loss': 'mse', 'optimizer': 'adam', 'graph_mode': 'off', 'use_snp_selection': False}. Best is trial 33 with value: 0.3841059404310342.
[I 2025-12-06 08:50:10,028] Trial 54 finished with value: 0.37756935931842367 and parameters: {'model_type': 'mlp', 'hidden_dims': '[512, 128]', 'dropout': 0.39990257616753944, 'batch_norm': False, 'lr': 2.0037329907917916e-06, 'weight_decay': 4.088822889454068e-06, 'epochs': 214, 'loss': 'mse', 'optimizer': 'adam', 'graph_mode': 'off', 'use_snp_selection': False}. Best is trial 33 with value: 0.3841059404310342.
[I 2025-12-06 08:50:27,628] Trial 55 finished with value: 0.377212020042352 and parameters: {'model_type': 'mlp', 'hidden_dims': '[128, 64]', 'dropout': 0.4575900476405133, 'batch_norm': False, 'lr': 5.69418339501556e-06, 'weight_decay': 0.000492872150456735, 'epochs': 237, 'loss': 'mse', 'optimizer': 'adam', 'graph_mode': 'off', 'use_snp_selection': False}. Best is trial 33 with value: 0.3841059404310342.
[I 2025-12-06 08:51:19,803] Trial 56 finished with value: 0.32879665091706123 and parameters: {'model_type': 'mlp', 'hidden_dims': '[512, 256]', 'dropout': 0.5061139071498615, 'batch_norm': False, 'lr': 0.0005361807719839151, 'weight_decay': 1.0078878495262025e-05, 'epochs': 253, 'loss': 'mse', 'optimizer': 'adam', 'graph_mode': 'off', 'use_snp_selection': False}. Best is trial 33 with value: 0.3841059404310342.
[I 2025-12-06 08:51:53,627] Trial 57 finished with value: 0.18308509298919995 and parameters: {'model_type': 'mlp', 'hidden_dims': '[256, 128, 64]', 'dropout': 0.5682461888535776, 'batch_norm': True, 'lr': 1.1972023993682667e-06, 'weight_decay': 0.0001679032480416268, 'epochs': 177, 'loss': 'mse', 'optimizer': 'adam', 'graph_mode': 'off', 'use_snp_selection': True, 'num_snps': 21034}. Best is trial 33 with value: 0.3841059404310342.
[I 2025-12-06 08:52:53,224] Trial 58 finished with value: 0.34877439995224574 and parameters: {'model_type': 'mlp', 'hidden_dims': '[512, 256]', 'dropout': 0.3629213627825921, 'batch_norm': False, 'lr': 4.324516097912898e-06, 'weight_decay': 2.7606135944748012e-05, 'epochs': 284, 'loss': 'mse', 'optimizer': 'adam', 'graph_mode': 'off', 'use_snp_selection': False}. Best is trial 33 with value: 0.3841059404310342.
[I 2025-12-06 08:53:36,969] Trial 59 finished with value: 0.3559075699590569 and parameters: {'model_type': 'mlp', 'hidden_dims': '[512, 256]', 'dropout': 0.4805864202348151, 'batch_norm': False, 'lr': 7.187313503608443e-06, 'weight_decay': 2.0776328506037017e-06, 'epochs': 200, 'loss': 'mse', 'optimizer': 'adam', 'graph_mode': 'off', 'use_snp_selection': False}. Best is trial 33 with value: 0.3841059404310342.
[I 2025-12-06 08:54:57,435] Trial 60 finished with value: 0.37086878782156474 and parameters: {'model_type': 'mlp', 'hidden_dims': '[512, 128]', 'dropout': 0.5308093233649599, 'batch_norm': False, 'lr': 3.4600484617243333e-06, 'weight_decay': 6.675564325113973e-05, 'epochs': 258, 'loss': 'mse', 'optimizer': 'adam', 'graph_mode': 'off', 'use_snp_selection': True, 'num_snps': 54359}. Best is trial 33 with value: 0.3841059404310342.
[I 2025-12-06 08:55:42,155] Trial 61 finished with value: 0.3819190935725912 and parameters: {'model_type': 'mlp', 'hidden_dims': '[512, 128]', 'dropout': 0.4096327507779084, 'batch_norm': False, 'lr': 1.8841461101998482e-06, 'weight_decay': 4.958847329129354e-06, 'epochs': 207, 'loss': 'mse', 'optimizer': 'adam', 'graph_mode': 'off', 'use_snp_selection': False}. Best is trial 33 with value: 0.3841059404310342.
[I 2025-12-06 08:56:27,676] Trial 62 finished with value: 0.3769114144381329 and parameters: {'model_type': 'mlp', 'hidden_dims': '[512, 128]', 'dropout': 0.40240655208669235, 'batch_norm': False, 'lr': 2.469271949705238e-06, 'weight_decay': 3.928462323697093e-06, 'epochs': 210, 'loss': 'mse', 'optimizer': 'adam', 'graph_mode': 'off', 'use_snp_selection': False}. Best is trial 33 with value: 0.3841059404310342.
[I 2025-12-06 08:57:17,999] Trial 63 finished with value: 0.38004312018738057 and parameters: {'model_type': 'mlp', 'hidden_dims': '[512, 128]', 'dropout': 0.34229621846775776, 'batch_norm': False, 'lr': 1.7397466211677317e-06, 'weight_decay': 1.234715450758425e-05, 'epochs': 234, 'loss': 'mse', 'optimizer': 'adam', 'graph_mode': 'off', 'use_snp_selection': False}. Best is trial 33 with value: 0.3841059404310342.
[I 2025-12-06 08:58:07,182] Trial 64 finished with value: 0.37469519490491854 and parameters: {'model_type': 'mlp', 'hidden_dims': '[512, 128]', 'dropout': 0.2629236045701187, 'batch_norm': False, 'lr': 1.6619471090275798e-06, 'weight_decay': 9.45144151420334e-07, 'epochs': 228, 'loss': 'mse', 'optimizer': 'adam', 'graph_mode': 'off', 'use_snp_selection': False}. Best is trial 33 with value: 0.3841059404310342.
[I 2025-12-06 08:58:56,173] Trial 65 finished with value: 0.3518892108966477 and parameters: {'model_type': 'mlp', 'hidden_dims': '[512, 128]', 'dropout': 0.32667554603974003, 'batch_norm': False, 'lr': 4.0647199424857926e-05, 'weight_decay': 2.730344603752165e-07, 'epochs': 234, 'loss': 'mae', 'optimizer': 'adam', 'graph_mode': 'off', 'use_snp_selection': False}. Best is trial 33 with value: 0.3841059404310342.
[I 2025-12-06 08:59:38,049] Trial 66 finished with value: 0.37513718623276443 and parameters: {'model_type': 'mlp', 'hidden_dims': '[512, 128]', 'dropout': 0.36015083498682965, 'batch_norm': False, 'lr': 1.257282393568591e-06, 'weight_decay': 6.398146405012147e-06, 'epochs': 191, 'loss': 'mse', 'optimizer': 'adam', 'graph_mode': 'off', 'use_snp_selection': False}. Best is trial 33 with value: 0.3841059404310342.
[I 2025-12-06 09:00:33,141] Trial 67 finished with value: 0.374514303148756 and parameters: {'model_type': 'mlp', 'hidden_dims': '[512, 128]', 'dropout': 0.28639050553599, 'batch_norm': False, 'lr': 1.7842223984766747e-06, 'weight_decay': 2.2560181990580753e-06, 'epochs': 216, 'loss': 'mse', 'optimizer': 'adam', 'graph_mode': 'off', 'use_snp_selection': True, 'num_snps': 35136}. Best is trial 33 with value: 0.3841059404310342.
[I 2025-12-06 09:01:11,109] Trial 68 finished with value: 0.38203002106060063 and parameters: {'model_type': 'mlp', 'hidden_dims': '[512, 128]', 'dropout': 0.4483790548219128, 'batch_norm': False, 'lr': 2.5759735715374046e-06, 'weight_decay': 1.1829877960897127e-05, 'epochs': 172, 'loss': 'mse', 'optimizer': 'adam', 'graph_mode': 'off', 'use_snp_selection': False}. Best is trial 33 with value: 0.3841059404310342.
[I 2025-12-06 09:01:48,207] Trial 69 finished with value: 0.36479352549116867 and parameters: {'model_type': 'mlp', 'hidden_dims': '[512, 128]', 'dropout': 0.38470493957326946, 'batch_norm': False, 'lr': 1.071306155700411e-06, 'weight_decay': 1.2159700801830834e-05, 'epochs': 166, 'loss': 'mse', 'optimizer': 'adam', 'graph_mode': 'off', 'use_snp_selection': False}. Best is trial 33 with value: 0.3841059404310342.
[I 2025-12-06 09:02:22,694] Trial 70 finished with value: 0.3566609883554938 and parameters: {'model_type': 'mlp', 'hidden_dims': '[512, 128]', 'dropout': 0.44114091453200704, 'batch_norm': False, 'lr': 2.3386964206831006e-06, 'weight_decay': 2.033971537435468e-05, 'epochs': 152, 'loss': 'mae', 'optimizer': 'adam', 'graph_mode': 'off', 'use_snp_selection': False}. Best is trial 33 with value: 0.3841059404310342.
[I 2025-12-06 09:03:01,887] Trial 71 finished with value: 0.3786952362909134 and parameters: {'model_type': 'mlp', 'hidden_dims': '[512, 128]', 'dropout': 0.4267233916165589, 'batch_norm': False, 'lr': 2.8063001648765985e-06, 'weight_decay': 6.774140696262729e-06, 'epochs': 176, 'loss': 'mse', 'optimizer': 'adam', 'graph_mode': 'off', 'use_snp_selection': False}. Best is trial 33 with value: 0.3841059404310342.
[I 2025-12-06 09:03:46,758] Trial 72 finished with value: 0.37432715033902764 and parameters: {'model_type': 'mlp', 'hidden_dims': '[512, 64]', 'dropout': 0.4563414415958409, 'batch_norm': False, 'lr': 1.8158558791405378e-06, 'weight_decay': 8.537418148031018e-06, 'epochs': 205, 'loss': 'mse', 'optimizer': 'adam', 'graph_mode': 'off', 'use_snp_selection': False}. Best is trial 33 with value: 0.3841059404310342.
