[I 2025-12-05 15:37:45,306] Trial 130 finished with value: 0.04179506850607441 and parameters: {'model_type': 'mlp', 'hidden_dims': '[512, 256]', 'dropout': 0.17038106995685062, 'batch_norm': True, 'lr': 0.0009994904313502997, 'weight_decay': 8.80324689509378e-06, 'epochs': 170, 'loss': 'mse', 'optimizer': 'adam', 'graph_mode': 'off', 'use_snp_selection': False}. Best is trial 0 with value: 0.07830712685738.
[I 2025-12-05 15:37:46,833] Trial 131 finished with value: 0.0510040852684612 and parameters: {'model_type': 'mlp', 'hidden_dims': '[512, 64]', 'dropout': 0.18788143887552916, 'batch_norm': True, 'lr': 0.000812909296950924, 'weight_decay': 3.099777430389103e-05, 'epochs': 165, 'loss': 'mse', 'optimizer': 'adam', 'graph_mode': 'off', 'use_snp_selection': False}. Best is trial 0 with value: 0.07830712685738.
[I 2025-12-05 15:37:48,431] Trial 132 finished with value: 0.04488775436465834 and parameters: {'model_type': 'mlp', 'hidden_dims': '[512, 256]', 'dropout': 0.10022929311060307, 'batch_norm': True, 'lr': 0.0005644869434895856, 'weight_decay': 1.0823605118350643e-05, 'epochs': 177, 'loss': 'mse', 'optimizer': 'adam', 'graph_mode': 'off', 'use_snp_selection': False}. Best is trial 0 with value: 0.07830712685738.
[I 2025-12-05 15:37:49,915] Trial 133 finished with value: 0.044744500807089076 and parameters: {'model_type': 'mlp', 'hidden_dims': '[512, 256]', 'dropout': 0.15148155676138275, 'batch_norm': True, 'lr': 0.0006884064821466925, 'weight_decay': 4.413633074617895e-06, 'epochs': 155, 'loss': 'mse', 'optimizer': 'adam', 'graph_mode': 'off', 'use_snp_selection': False}. Best is trial 0 with value: 0.07830712685738.
[I 2025-12-05 15:37:51,538] Trial 134 finished with value: 0.037599900736235696 and parameters: {'model_type': 'mlp', 'hidden_dims': '[512, 256]', 'dropout': 0.11781620982450432, 'batch_norm': True, 'lr': 2.5975622875355255e-05, 'weight_decay': 0.00012298584003222676, 'epochs': 186, 'loss': 'mse', 'optimizer': 'adam', 'graph_mode': 'off', 'use_snp_selection': False}. Best is trial 0 with value: 0.07830712685738.
[I 2025-12-05 15:37:52,572] Trial 135 finished with value: 0.05955937853648184 and parameters: {'model_type': 'mlp', 'hidden_dims': '[128, 64]', 'dropout': 0.13369157755648378, 'batch_norm': True, 'lr': 0.0008244320043017108, 'weight_decay': 9.058269769935407e-05, 'epochs': 306, 'loss': 'mse', 'optimizer': 'adam', 'graph_mode': 'off', 'use_snp_selection': False}. Best is trial 0 with value: 0.07830712685738.
[I 2025-12-05 15:37:54,343] Trial 136 finished with value: 0.04703371025600606 and parameters: {'model_type': 'mlp', 'hidden_dims': '[512, 256]', 'dropout': 0.1734878865872289, 'batch_norm': False, 'lr': 3.368354905438284e-05, 'weight_decay': 6.057551563907795e-06, 'epochs': 160, 'loss': 'mse', 'optimizer': 'adam', 'graph_mode': 'off', 'use_snp_selection': True, 'num_snps': 27379}. Best is trial 0 with value: 0.07830712685738.
[I 2025-12-05 15:37:55,710] Trial 137 finished with value: 0.046307374569338776 and parameters: {'model_type': 'mlp', 'hidden_dims': '[512, 64]', 'dropout': 0.15741955354497986, 'batch_norm': True, 'lr': 0.0006142750732502522, 'weight_decay': 6.530566906693604e-05, 'epochs': 138, 'loss': 'mse', 'optimizer': 'adam', 'graph_mode': 'off', 'use_snp_selection': False}. Best is trial 0 with value: 0.07830712685738.
[I 2025-12-05 15:37:56,472] Trial 138 finished with value: -0.02386640734613278 and parameters: {'model_type': 'mlp', 'hidden_dims': '[128, 64]', 'dropout': 0.37307905037179534, 'batch_norm': True, 'lr': 1.2324133607096667e-05, 'weight_decay': 1.241333642014776e-05, 'epochs': 125, 'loss': 'mse', 'optimizer': 'adam', 'graph_mode': 'off', 'use_snp_selection': False}. Best is trial 0 with value: 0.07830712685738.
[I 2025-12-05 15:37:57,954] Trial 139 finished with value: 0.05993825129681819 and parameters: {'model_type': 'mlp', 'hidden_dims': '[256, 128, 64]', 'dropout': 0.11611957685165682, 'batch_norm': True, 'lr': 8.779468426714997e-06, 'weight_decay': 1.8911507862765545e-06, 'epochs': 328, 'loss': 'mae', 'optimizer': 'adam', 'graph_mode': 'off', 'use_snp_selection': False}. Best is trial 0 with value: 0.07830712685738.
[I 2025-12-05 15:37:59,350] Trial 140 finished with value: 0.031000984857380485 and parameters: {'model_type': 'mlp', 'hidden_dims': '[512, 64]', 'dropout': 0.14312533551892437, 'batch_norm': True, 'lr': 4.56262916779755e-05, 'weight_decay': 1.98251273016454e-05, 'epochs': 144, 'loss': 'mse', 'optimizer': 'adam', 'graph_mode': 'off', 'use_snp_selection': False}. Best is trial 0 with value: 0.07830712685738.
[I 2025-12-05 15:38:00,835] Trial 141 finished with value: 0.006823533402339272 and parameters: {'model_type': 'mlp', 'hidden_dims': '[256, 128, 64]', 'dropout': 0.1111616262743947, 'batch_norm': True, 'lr': 8.54262289837698e-06, 'weight_decay': 6.604710921532084e-07, 'epochs': 331, 'loss': 'mae', 'optimizer': 'adam', 'graph_mode': 'off', 'use_snp_selection': False}. Best is trial 0 with value: 0.07830712685738.
[I 2025-12-05 15:38:02,381] Trial 142 finished with value: 0.006728212246077505 and parameters: {'model_type': 'mlp', 'hidden_dims': '[256, 128, 64]', 'dropout': 0.12122180667704013, 'batch_norm': True, 'lr': 6.111567042111503e-06, 'weight_decay': 8.961204608576823e-07, 'epochs': 338, 'loss': 'mae', 'optimizer': 'adam', 'graph_mode': 'off', 'use_snp_selection': False}. Best is trial 0 with value: 0.07830712685738.
[I 2025-12-05 15:38:03,905] Trial 143 finished with value: 0.03449152187977221 and parameters: {'model_type': 'mlp', 'hidden_dims': '[256, 128, 64]', 'dropout': 0.12972706151336286, 'batch_norm': True, 'lr': 1.947827736215013e-05, 'weight_decay': 2.225982643411155e-06, 'epochs': 327, 'loss': 'mae', 'optimizer': 'adam', 'graph_mode': 'off', 'use_snp_selection': False}. Best is trial 0 with value: 0.07830712685738.
[I 2025-12-05 15:38:05,409] Trial 144 finished with value: 0.018107319013672265 and parameters: {'model_type': 'mlp', 'hidden_dims': '[256, 128, 64]', 'dropout': 0.10028516515698538, 'batch_norm': True, 'lr': 9.586491190101594e-06, 'weight_decay': 3.7739863377934974e-05, 'epochs': 322, 'loss': 'mae', 'optimizer': 'adam', 'graph_mode': 'off', 'use_snp_selection': False}. Best is trial 0 with value: 0.07830712685738.
[I 2025-12-05 15:38:06,558] Trial 145 finished with value: 0.040717271145330275 and parameters: {'model_type': 'mlp', 'hidden_dims': '[256, 128, 64]', 'dropout': 0.11479806160621332, 'batch_norm': True, 'lr': 4.050590733174652e-05, 'weight_decay': 1.0733683162385916e-06, 'epochs': 177, 'loss': 'mae', 'optimizer': 'adam', 'graph_mode': 'off', 'use_snp_selection': False}. Best is trial 0 with value: 0.07830712685738.
[I 2025-12-05 15:38:08,625] Trial 146 finished with value: 0.015248021659427069 and parameters: {'model_type': 'mlp', 'hidden_dims': '[512, 128]', 'dropout': 0.4738802391278786, 'batch_norm': True, 'lr': 1.5103561269958281e-06, 'weight_decay': 3.3385622257964673e-07, 'epochs': 169, 'loss': 'mse', 'optimizer': 'adam', 'graph_mode': 'off', 'use_snp_selection': True, 'num_snps': 33978}. Best is trial 0 with value: 0.07830712685738.
[I 2025-12-05 15:38:09,991] Trial 147 finished with value: 0.03771809875851059 and parameters: {'model_type': 'mlp', 'hidden_dims': '[256, 128]', 'dropout': 0.16364319496830781, 'batch_norm': True, 'lr': 0.0009366011760912285, 'weight_decay': 6.221692445935886e-07, 'epochs': 292, 'loss': 'mse', 'optimizer': 'adam', 'graph_mode': 'off', 'use_snp_selection': False}. Best is trial 0 with value: 0.07830712685738.
[I 2025-12-05 15:38:11,976] Trial 148 finished with value: 0.052304294934371574 and parameters: {'model_type': 'mlp', 'hidden_dims': '[512, 64]', 'dropout': 0.12386916274739435, 'batch_norm': True, 'lr': 5.2294315442109524e-05, 'weight_decay': 1.6697781886538052e-06, 'epochs': 269, 'loss': 'mae', 'optimizer': 'adam', 'graph_mode': 'off', 'use_snp_selection': False}. Best is trial 0 with value: 0.07830712685738.
[I 2025-12-05 15:38:13,032] Trial 149 finished with value: -0.0013769236420209108 and parameters: {'model_type': 'mlp', 'hidden_dims': '[128, 64]', 'dropout': 0.1493910203395927, 'batch_norm': True, 'lr': 2.8842287555262136e-05, 'weight_decay': 3.5323891746088487e-06, 'epochs': 342, 'loss': 'mse', 'optimizer': 'adam', 'graph_mode': 'off', 'use_snp_selection': False}. Best is trial 0 with value: 0.07830712685738.
[I 2025-12-05 15:38:15,290] Trial 0 finished with value: 0.04154583839722372 and parameters: {'model_type': 'mlp', 'hidden_dims': '[128, 64]', 'dropout': 0.199031432379812, 'batch_norm': True, 'lr': 1.8408544111075837e-06, 'weight_decay': 5.5136510071208614e-05, 'epochs': 336, 'loss': 'mae', 'optimizer': 'adam', 'graph_mode': 'off', 'use_snp_selection': True, 'num_snps': 43862}. Best is trial 0 with value: 0.04154583839722372.
[I 2025-12-05 15:38:16,399] Trial 1 finished with value: 0.13837966756547154 and parameters: {'model_type': 'mlp', 'hidden_dims': '[256, 128]', 'dropout': 0.4370668075331726, 'batch_norm': True, 'lr': 7.133471581159139e-05, 'weight_decay': 1.128633586803549e-05, 'epochs': 242, 'loss': 'mae', 'optimizer': 'adam', 'graph_mode': 'off', 'use_snp_selection': False}. Best is trial 1 with value: 0.13837966756547154.
[I 2025-12-05 15:38:17,508] Trial 2 finished with value: 0.04120697976572004 and parameters: {'model_type': 'mlp', 'hidden_dims': '[256, 128, 64]', 'dropout': 0.41314357415569625, 'batch_norm': False, 'lr': 3.952233718592101e-06, 'weight_decay': 0.00026754769258252603, 'epochs': 149, 'loss': 'mse', 'optimizer': 'adam', 'graph_mode': 'off', 'use_snp_selection': True, 'num_snps': 11571}. Best is trial 1 with value: 0.13837966756547154.
[I 2025-12-05 15:38:19,376] Trial 3 finished with value: 0.1294817868900232 and parameters: {'model_type': 'mlp', 'hidden_dims': '[512, 64]', 'dropout': 0.5938127374509361, 'batch_norm': False, 'lr': 5.67704586114731e-06, 'weight_decay': 2.4518087630137052e-05, 'epochs': 320, 'loss': 'mae', 'optimizer': 'adam', 'graph_mode': 'off', 'use_snp_selection': False}. Best is trial 1 with value: 0.13837966756547154.
[I 2025-12-05 15:38:21,649] Trial 4 finished with value: 0.06491529647901484 and parameters: {'model_type': 'mlp', 'hidden_dims': '[512, 128]', 'dropout': 0.25746343592134413, 'batch_norm': True, 'lr': 1.3467657668402788e-06, 'weight_decay': 0.00033087251918647806, 'epochs': 277, 'loss': 'mse', 'optimizer': 'adam', 'graph_mode': 'off', 'use_snp_selection': True, 'num_snps': 36675}. Best is trial 1 with value: 0.13837966756547154.
[I 2025-12-05 15:38:23,509] Trial 5 finished with value: 0.013079270371207211 and parameters: {'model_type': 'mlp', 'hidden_dims': '[512, 64]', 'dropout': 0.38275350994408375, 'batch_norm': True, 'lr': 1.5586664309232824e-06, 'weight_decay': 0.0008227664668621182, 'epochs': 145, 'loss': 'mae', 'optimizer': 'adam', 'graph_mode': 'off', 'use_snp_selection': True, 'num_snps': 32148}. Best is trial 1 with value: 0.13837966756547154.
[I 2025-12-05 15:38:24,537] Trial 6 finished with value: 0.1468470203259188 and parameters: {'model_type': 'mlp', 'hidden_dims': '[256, 128]', 'dropout': 0.3930109900265879, 'batch_norm': False, 'lr': 4.892964372128395e-05, 'weight_decay': 1.5809549317992182e-06, 'epochs': 199, 'loss': 'mse', 'optimizer': 'adam', 'graph_mode': 'off', 'use_snp_selection': False}. Best is trial 6 with value: 0.1468470203259188.
[I 2025-12-05 15:38:25,659] Trial 7 finished with value: 0.14901529294888555 and parameters: {'model_type': 'mlp', 'hidden_dims': '[512, 256]', 'dropout': 0.15343979219678458, 'batch_norm': True, 'lr': 6.234003099047341e-05, 'weight_decay': 3.894760610535477e-07, 'epochs': 97, 'loss': 'mse', 'optimizer': 'adam', 'graph_mode': 'off', 'use_snp_selection': False}. Best is trial 7 with value: 0.14901529294888555.
[I 2025-12-05 15:38:27,513] Trial 8 finished with value: 0.1713785775796543 and parameters: {'model_type': 'mlp', 'hidden_dims': '[512, 128]', 'dropout': 0.10743001231661406, 'batch_norm': True, 'lr': 0.00023728538449271062, 'weight_decay': 1.7629071578048637e-05, 'epochs': 312, 'loss': 'mae', 'optimizer': 'adam', 'graph_mode': 'off', 'use_snp_selection': False}. Best is trial 8 with value: 0.1713785775796543.
[I 2025-12-05 15:38:28,900] Trial 9 finished with value: 0.12855603438448665 and parameters: {'model_type': 'mlp', 'hidden_dims': '[512, 64]', 'dropout': 0.14505336736221927, 'batch_norm': True, 'lr': 5.8619638388111826e-05, 'weight_decay': 6.200156172669308e-07, 'epochs': 175, 'loss': 'mse', 'optimizer': 'adam', 'graph_mode': 'off', 'use_snp_selection': False}. Best is trial 8 with value: 0.1713785775796543.
[I 2025-12-05 15:38:29,883] Trial 10 finished with value: -0.00524181422884781 and parameters: {'model_type': 'mlp', 'hidden_dims': '[512, 128]', 'dropout': 0.2800030442581858, 'batch_norm': False, 'lr': 0.0004919806695968258, 'weight_decay': 2.9953888095455486e-06, 'epochs': 55, 'loss': 'mae', 'optimizer': 'adam', 'graph_mode': 'off', 'use_snp_selection': False}. Best is trial 8 with value: 0.1713785775796543.
[I 2025-12-05 15:38:30,912] Trial 11 finished with value: 0.16150351763270474 and parameters: {'model_type': 'mlp', 'hidden_dims': '[512, 256]', 'dropout': 0.10095648685224448, 'batch_norm': True, 'lr': 0.0003926892266729099, 'weight_decay': 3.172181990533228e-07, 'epochs': 70, 'loss': 'mse', 'optimizer': 'adam', 'graph_mode': 'off', 'use_snp_selection': False}. Best is trial 8 with value: 0.1713785775796543.
[I 2025-12-05 15:38:31,858] Trial 12 finished with value: 0.17311953173930675 and parameters: {'model_type': 'mlp', 'hidden_dims': '[512, 256]', 'dropout': 0.10344600881777158, 'batch_norm': True, 'lr': 0.0006753264773209732, 'weight_decay': 1.3081036432574914e-07, 'epochs': 40, 'loss': 'mae', 'optimizer': 'adam', 'graph_mode': 'off', 'use_snp_selection': False}. Best is trial 12 with value: 0.17311953173930675.
[I 2025-12-05 15:38:33,534] Trial 13 finished with value: 0.1664059440052542 and parameters: {'model_type': 'mlp', 'hidden_dims': '[512, 128]', 'dropout': 0.24294613148916022, 'batch_norm': True, 'lr': 0.00020263148232071683, 'weight_decay': 1.0885943577911259e-07, 'epochs': 253, 'loss': 'mae', 'optimizer': 'adam', 'graph_mode': 'off', 'use_snp_selection': False}. Best is trial 12 with value: 0.17311953173930675.
[I 2025-12-05 15:38:35,353] Trial 14 finished with value: 0.17743419453974899 and parameters: {'model_type': 'mlp', 'hidden_dims': '[512, 256]', 'dropout': 0.3221595656802847, 'batch_norm': True, 'lr': 0.000922330603992367, 'weight_decay': 4.57067734295802e-06, 'epochs': 294, 'loss': 'mae', 'optimizer': 'adam', 'graph_mode': 'off', 'use_snp_selection': False}. Best is trial 14 with value: 0.17743419453974899.
[I 2025-12-05 15:38:36,530] Trial 15 finished with value: 0.1721106161130562 and parameters: {'model_type': 'mlp', 'hidden_dims': '[512, 256]', 'dropout': 0.4919686891470568, 'batch_norm': True, 'lr': 0.000810333179231948, 'weight_decay': 3.3210083727526755e-06, 'epochs': 107, 'loss': 'mae', 'optimizer': 'adam', 'graph_mode': 'off', 'use_snp_selection': False}. Best is trial 14 with value: 0.17743419453974899.
[I 2025-12-05 15:38:38,088] Trial 16 finished with value: 0.09554444276084545 and parameters: {'model_type': 'mlp', 'hidden_dims': '[512, 256]', 'dropout': 0.32867349263672585, 'batch_norm': True, 'lr': 1.4186730202195517e-05, 'weight_decay': 1.0500296803371061e-07, 'epochs': 220, 'loss': 'mae', 'optimizer': 'adam', 'graph_mode': 'off', 'use_snp_selection': False}. Best is trial 14 with value: 0.17743419453974899.
[I 2025-12-05 15:38:39,842] Trial 17 finished with value: 0.16589577912160125 and parameters: {'model_type': 'mlp', 'hidden_dims': '[512, 256]', 'dropout': 0.5260020523685199, 'batch_norm': True, 'lr': 0.000906375209920231, 'weight_decay': 5.1199285841180324e-05, 'epochs': 287, 'loss': 'mae', 'optimizer': 'adam', 'graph_mode': 'off', 'use_snp_selection': False}. Best is trial 14 with value: 0.17743419453974899.
[I 2025-12-05 15:38:42,447] Trial 18 finished with value: 0.1397298563840966 and parameters: {'model_type': 'mlp', 'hidden_dims': '[128, 64]', 'dropout': 0.3124176708262755, 'batch_norm': False, 'lr': 0.00016762172947871066, 'weight_decay': 1.3157026583586933e-06, 'epochs': 115, 'loss': 'mae', 'optimizer': 'adam', 'graph_mode': 'off', 'use_snp_selection': True, 'num_snps': 58241}. Best is trial 14 with value: 0.17743419453974899.
[I 2025-12-05 15:38:43,450] Trial 19 finished with value: 0.10885360971414287 and parameters: {'model_type': 'mlp', 'hidden_dims': '[256, 128, 64]', 'dropout': 0.21626923229526662, 'batch_norm': True, 'lr': 2.2469824113760382e-05, 'weight_decay': 4.7715005104496274e-06, 'epochs': 169, 'loss': 'mae', 'optimizer': 'adam', 'graph_mode': 'off', 'use_snp_selection': False}. Best is trial 14 with value: 0.17743419453974899.
[I 2025-12-05 15:38:44,396] Trial 20 finished with value: 0.12209950616597919 and parameters: {'model_type': 'mlp', 'hidden_dims': '[512, 256]', 'dropout': 0.46987058522739095, 'batch_norm': True, 'lr': 0.00013141443221566116, 'weight_decay': 2.1140679395673766e-07, 'epochs': 43, 'loss': 'mae', 'optimizer': 'adam', 'graph_mode': 'off', 'use_snp_selection': False}. Best is trial 14 with value: 0.17743419453974899.
[I 2025-12-05 15:38:45,473] Trial 21 finished with value: 0.15551446086748533 and parameters: {'model_type': 'mlp', 'hidden_dims': '[512, 256]', 'dropout': 0.5126377787726917, 'batch_norm': True, 'lr': 0.0007571993520533326, 'weight_decay': 4.774845180192265e-06, 'epochs': 91, 'loss': 'mae', 'optimizer': 'adam', 'graph_mode': 'off', 'use_snp_selection': False}. Best is trial 14 with value: 0.17743419453974899.
[I 2025-12-05 15:38:46,719] Trial 22 finished with value: 0.15752801891685791 and parameters: {'model_type': 'mlp', 'hidden_dims': '[512, 256]', 'dropout': 0.5662034291663135, 'batch_norm': True, 'lr': 0.00039145344439463816, 'weight_decay': 9.195955783127143e-07, 'epochs': 123, 'loss': 'mae', 'optimizer': 'adam', 'graph_mode': 'off', 'use_snp_selection': False}. Best is trial 14 with value: 0.17743419453974899.
[I 2025-12-05 15:38:47,808] Trial 23 finished with value: 0.14263106822443505 and parameters: {'model_type': 'mlp', 'hidden_dims': '[512, 256]', 'dropout': 0.4739350811940737, 'batch_norm': True, 'lr': 0.0009524132315556238, 'weight_decay': 2.386309717988258e-06, 'epochs': 76, 'loss': 'mae', 'optimizer': 'adam', 'graph_mode': 'off', 'use_snp_selection': False}. Best is trial 14 with value: 0.17743419453974899.
[I 2025-12-05 15:38:48,785] Trial 24 finished with value: 0.14957856295619237 and parameters: {'model_type': 'mlp', 'hidden_dims': '[512, 256]', 'dropout': 0.35216622249507, 'batch_norm': True, 'lr': 0.00047121608672501107, 'weight_decay': 6.584719320921613e-06, 'epochs': 43, 'loss': 'mae', 'optimizer': 'adam', 'graph_mode': 'off', 'use_snp_selection': False}. Best is trial 14 with value: 0.17743419453974899.
[I 2025-12-05 15:38:50,035] Trial 25 finished with value: 0.16174442761206725 and parameters: {'model_type': 'mlp', 'hidden_dims': '[512, 256]', 'dropout': 0.17937104630479878, 'batch_norm': True, 'lr': 0.0002816211051642671, 'weight_decay': 7.852156273440315e-05, 'epochs': 124, 'loss': 'mae', 'optimizer': 'adam', 'graph_mode': 'off', 'use_snp_selection': False}. Best is trial 14 with value: 0.17743419453974899.
[I 2025-12-05 15:38:50,966] Trial 26 finished with value: 0.12849953700504824 and parameters: {'model_type': 'mlp', 'hidden_dims': '[512, 256]', 'dropout': 0.304721294236187, 'batch_norm': True, 'lr': 0.00010257716930016817, 'weight_decay': 6.216455498105533e-07, 'epochs': 195, 'loss': 'mae', 'optimizer': 'adam', 'graph_mode': 'off', 'use_snp_selection': True, 'num_snps': 3842}. Best is trial 14 with value: 0.17743419453974899.
[I 2025-12-05 15:38:51,845] Trial 27 finished with value: 0.09113274776242453 and parameters: {'model_type': 'mlp', 'hidden_dims': '[256, 128, 64]', 'dropout': 0.3614863936860444, 'batch_norm': False, 'lr': 0.0006294829707962875, 'weight_decay': 1.0195369700557025e-05, 'epochs': 95, 'loss': 'mae', 'optimizer': 'adam', 'graph_mode': 'off', 'use_snp_selection': False}. Best is trial 14 with value: 0.17743419453974899.
[I 2025-12-05 15:38:52,573] Trial 28 finished with value: 0.1383438770354754 and parameters: {'model_type': 'mlp', 'hidden_dims': '[128, 64]', 'dropout': 0.5260062524819146, 'batch_norm': True, 'lr': 0.000993687952115419, 'weight_decay': 2.2398814272313298e-06, 'epochs': 66, 'loss': 'mae', 'optimizer': 'adam', 'graph_mode': 'off', 'use_snp_selection': False}. Best is trial 14 with value: 0.17743419453974899.
[I 2025-12-05 15:38:54,117] Trial 29 finished with value: 0.175410417169618 and parameters: {'model_type': 'mlp', 'hidden_dims': '[256, 128]', 'dropout': 0.4540184348968538, 'batch_norm': True, 'lr': 0.0003053124654174704, 'weight_decay': 5.5227103357724904e-05, 'epochs': 334, 'loss': 'mae', 'optimizer': 'adam', 'graph_mode': 'off', 'use_snp_selection': True, 'num_snps': 19468}. Best is trial 14 with value: 0.17743419453974899.
[I 2025-12-05 15:38:55,613] Trial 30 finished with value: 0.1716879786149691 and parameters: {'model_type': 'mlp', 'hidden_dims': '[256, 128]', 'dropout': 0.43122512425048143, 'batch_norm': True, 'lr': 0.00034614812808824043, 'weight_decay': 8.589708611495364e-05, 'epochs': 335, 'loss': 'mae', 'optimizer': 'adam', 'graph_mode': 'off', 'use_snp_selection': True, 'num_snps': 18365}. Best is trial 14 with value: 0.17743419453974899.
[I 2025-12-05 15:38:57,168] Trial 31 finished with value: 0.1624606415837634 and parameters: {'model_type': 'mlp', 'hidden_dims': '[256, 128]', 'dropout': 0.4673210507164174, 'batch_norm': True, 'lr': 0.0005795381033586347, 'weight_decay': 3.296555836070284e-05, 'epochs': 342, 'loss': 'mae', 'optimizer': 'adam', 'graph_mode': 'off', 'use_snp_selection': True, 'num_snps': 20689}. Best is trial 14 with value: 0.17743419453974899.
