[I 2025-12-05 15:55:55,947] Trial 101 finished with value: 0.12181474672676895 and parameters: {'model_type': 'mlp', 'hidden_dims': '[512, 128]', 'dropout': 0.3240926742310765, 'batch_norm': True, 'lr': 0.0007269386175393167, 'weight_decay': 3.3529110107733665e-07, 'epochs': 258, 'loss': 'mse', 'optimizer': 'adam', 'graph_mode': 'off', 'use_snp_selection': True, 'num_snps': 35218}. Best is trial 90 with value: 0.13143751993584177.
[I 2025-12-05 15:55:57,820] Trial 102 finished with value: 0.11474180255129476 and parameters: {'model_type': 'mlp', 'hidden_dims': '[512, 128]', 'dropout': 0.3189413688352988, 'batch_norm': True, 'lr': 0.0006984874625081602, 'weight_decay': 1.7109925131791883e-07, 'epochs': 255, 'loss': 'mse', 'optimizer': 'adam', 'graph_mode': 'off', 'use_snp_selection': True, 'num_snps': 35200}. Best is trial 90 with value: 0.13143751993584177.
[I 2025-12-05 15:55:59,668] Trial 103 finished with value: 0.11040900374213786 and parameters: {'model_type': 'mlp', 'hidden_dims': '[512, 128]', 'dropout': 0.3281316218091759, 'batch_norm': True, 'lr': 0.0007027682845029715, 'weight_decay': 3.379321243063465e-07, 'epochs': 252, 'loss': 'mse', 'optimizer': 'adam', 'graph_mode': 'off', 'use_snp_selection': True, 'num_snps': 35033}. Best is trial 90 with value: 0.13143751993584177.
[I 2025-12-05 15:56:01,411] Trial 104 finished with value: 0.10171396372417352 and parameters: {'model_type': 'mlp', 'hidden_dims': '[512, 128]', 'dropout': 0.3115724382306407, 'batch_norm': True, 'lr': 0.0005498371513824586, 'weight_decay': 1.7328101779855173e-07, 'epochs': 238, 'loss': 'mse', 'optimizer': 'adam', 'graph_mode': 'off', 'use_snp_selection': True, 'num_snps': 30519}. Best is trial 90 with value: 0.13143751993584177.
[I 2025-12-05 15:56:03,379] Trial 105 finished with value: 0.1229748849455699 and parameters: {'model_type': 'mlp', 'hidden_dims': '[512, 128]', 'dropout': 0.28457071845384146, 'batch_norm': True, 'lr': 0.0007501480774610427, 'weight_decay': 3.401107745696589e-07, 'epochs': 269, 'loss': 'mse', 'optimizer': 'adam', 'graph_mode': 'off', 'use_snp_selection': True, 'num_snps': 32837}. Best is trial 90 with value: 0.13143751993584177.
[I 2025-12-05 15:56:04,981] Trial 106 finished with value: 0.11386794200978999 and parameters: {'model_type': 'mlp', 'hidden_dims': '[512, 128]', 'dropout': 0.24535453843590987, 'batch_norm': True, 'lr': 0.0004759751963085744, 'weight_decay': 3.0876964917680333e-07, 'epochs': 271, 'loss': 'mse', 'optimizer': 'adam', 'graph_mode': 'off', 'use_snp_selection': True, 'num_snps': 23934}. Best is trial 90 with value: 0.13143751993584177.
[I 2025-12-05 15:56:06,870] Trial 107 finished with value: 0.003974985496942678 and parameters: {'model_type': 'mlp', 'hidden_dims': '[512, 128]', 'dropout': 0.2831344583410584, 'batch_norm': True, 'lr': 1.0751474883217484e-06, 'weight_decay': 3.395122712308642e-07, 'epochs': 261, 'loss': 'mae', 'optimizer': 'adam', 'graph_mode': 'off', 'use_snp_selection': True, 'num_snps': 32950}. Best is trial 90 with value: 0.13143751993584177.
[I 2025-12-05 15:56:07,869] Trial 108 finished with value: 0.11175317413393901 and parameters: {'model_type': 'mlp', 'hidden_dims': '[512, 128]', 'dropout': 0.294989618708359, 'batch_norm': True, 'lr': 0.0007781094851442096, 'weight_decay': 5.509383968745403e-07, 'epochs': 232, 'loss': 'mse', 'optimizer': 'adam', 'graph_mode': 'off', 'use_snp_selection': True, 'num_snps': 7731}. Best is trial 90 with value: 0.13143751993584177.
[I 2025-12-05 15:56:09,636] Trial 109 finished with value: 0.0995433964257092 and parameters: {'model_type': 'mlp', 'hidden_dims': '[512, 128]', 'dropout': 0.35616765287468144, 'batch_norm': True, 'lr': 0.0009342798567783661, 'weight_decay': 6.340831050966629e-07, 'epochs': 268, 'loss': 'mse', 'optimizer': 'adam', 'graph_mode': 'off', 'use_snp_selection': True, 'num_snps': 32260}. Best is trial 90 with value: 0.13143751993584177.
[I 2025-12-05 15:56:11,505] Trial 110 finished with value: 0.1008953290917055 and parameters: {'model_type': 'mlp', 'hidden_dims': '[512, 256]', 'dropout': 0.3438095924674782, 'batch_norm': True, 'lr': 0.0005715179152498098, 'weight_decay': 4.0390178398343005e-07, 'epochs': 214, 'loss': 'mse', 'optimizer': 'adam', 'graph_mode': 'off', 'use_snp_selection': True, 'num_snps': 37088}. Best is trial 90 with value: 0.13143751993584177.
[I 2025-12-05 15:56:13,379] Trial 111 finished with value: 0.1188416587260224 and parameters: {'model_type': 'mlp', 'hidden_dims': '[512, 128]', 'dropout': 0.31087601809233745, 'batch_norm': True, 'lr': 0.0007327598088626938, 'weight_decay': 1.1410700352066636e-07, 'epochs': 255, 'loss': 'mse', 'optimizer': 'adam', 'graph_mode': 'off', 'use_snp_selection': True, 'num_snps': 35181}. Best is trial 90 with value: 0.13143751993584177.
[I 2025-12-05 15:56:14,735] Trial 112 finished with value: 0.10944527559214884 and parameters: {'model_type': 'mlp', 'hidden_dims': '[512, 128]', 'dropout': 0.30928013520048747, 'batch_norm': True, 'lr': 0.0007692069399559126, 'weight_decay': 1.3411094813735428e-07, 'epochs': 276, 'loss': 'mse', 'optimizer': 'adam', 'graph_mode': 'off', 'use_snp_selection': True, 'num_snps': 19432}. Best is trial 90 with value: 0.13143751993584177.
[I 2025-12-05 15:56:15,922] Trial 113 finished with value: 0.11508835716957203 and parameters: {'model_type': 'mlp', 'hidden_dims': '[512, 128]', 'dropout': 0.2725351790479419, 'batch_norm': True, 'lr': 0.0006220713819284389, 'weight_decay': 1.3889216919091012e-06, 'epochs': 241, 'loss': 'mse', 'optimizer': 'adam', 'graph_mode': 'off', 'use_snp_selection': True, 'num_snps': 15207}. Best is trial 90 with value: 0.13143751993584177.
[I 2025-12-05 15:56:17,879] Trial 114 finished with value: 0.10492279897164823 and parameters: {'model_type': 'mlp', 'hidden_dims': '[512, 128]', 'dropout': 0.3275229797634075, 'batch_norm': True, 'lr': 0.0004996501554204195, 'weight_decay': 9.876865813992824e-07, 'epochs': 248, 'loss': 'mse', 'optimizer': 'adam', 'graph_mode': 'off', 'use_snp_selection': True, 'num_snps': 33468}. Best is trial 90 with value: 0.13143751993584177.
[I 2025-12-05 15:56:19,738] Trial 115 finished with value: 0.118504466325065 and parameters: {'model_type': 'mlp', 'hidden_dims': '[512, 128]', 'dropout': 0.3687560821759478, 'batch_norm': True, 'lr': 0.0008676628488832016, 'weight_decay': 5.083274857341934e-07, 'epochs': 258, 'loss': 'mse', 'optimizer': 'adam', 'graph_mode': 'off', 'use_snp_selection': True, 'num_snps': 30924}. Best is trial 90 with value: 0.13143751993584177.
[I 2025-12-05 15:56:21,413] Trial 116 finished with value: 0.10467240827776589 and parameters: {'model_type': 'mlp', 'hidden_dims': '[512, 128]', 'dropout': 0.3668156667599627, 'batch_norm': True, 'lr': 0.0009854713115255028, 'weight_decay': 5.08352860991661e-07, 'epochs': 224, 'loss': 'mse', 'optimizer': 'adam', 'graph_mode': 'off', 'use_snp_selection': True, 'num_snps': 29362}. Best is trial 90 with value: 0.13143751993584177.
[I 2025-12-05 15:56:22,905] Trial 117 finished with value: 0.11724985480758357 and parameters: {'model_type': 'mlp', 'hidden_dims': '[512, 128]', 'dropout': 0.3002386485452368, 'batch_norm': True, 'lr': 0.0008534477285603663, 'weight_decay': 7.211960472934794e-07, 'epochs': 253, 'loss': 'mse', 'optimizer': 'adam', 'graph_mode': 'off', 'use_snp_selection': False}. Best is trial 90 with value: 0.13143751993584177.
[I 2025-12-05 15:56:24,539] Trial 118 finished with value: 0.13217672050707877 and parameters: {'model_type': 'mlp', 'hidden_dims': '[512, 128]', 'dropout': 0.2569473929583631, 'batch_norm': True, 'lr': 0.0006489865116687572, 'weight_decay': 2.8533698555003816e-07, 'epochs': 268, 'loss': 'mse', 'optimizer': 'adam', 'graph_mode': 'off', 'use_snp_selection': True, 'num_snps': 27673}. Best is trial 118 with value: 0.13217672050707877.
[I 2025-12-05 15:56:26,009] Trial 119 finished with value: 0.03557871130177871 and parameters: {'model_type': 'mlp', 'hidden_dims': '[512, 128]', 'dropout': 0.21428771758133483, 'batch_norm': True, 'lr': 1.7833759189208963e-05, 'weight_decay': 1.6587897321381473e-07, 'epochs': 206, 'loss': 'mse', 'optimizer': 'adam', 'graph_mode': 'off', 'use_snp_selection': True, 'num_snps': 26195}. Best is trial 118 with value: 0.13217672050707877.
[I 2025-12-05 15:56:27,534] Trial 120 finished with value: 0.11873241634739339 and parameters: {'model_type': 'mlp', 'hidden_dims': '[128, 64]', 'dropout': 0.2768284958182266, 'batch_norm': True, 'lr': 0.0006137549009237771, 'weight_decay': 2.9209319340555123e-07, 'epochs': 279, 'loss': 'mse', 'optimizer': 'adam', 'graph_mode': 'off', 'use_snp_selection': True, 'num_snps': 27198}. Best is trial 118 with value: 0.13217672050707877.
[I 2025-12-05 15:56:29,100] Trial 121 finished with value: 0.11304628924392895 and parameters: {'model_type': 'mlp', 'hidden_dims': '[128, 64]', 'dropout': 0.26009666461613623, 'batch_norm': True, 'lr': 0.0006347294346967489, 'weight_decay': 2.909561589059626e-07, 'epochs': 258, 'loss': 'mse', 'optimizer': 'adam', 'graph_mode': 'off', 'use_snp_selection': True, 'num_snps': 27458}. Best is trial 118 with value: 0.13217672050707877.
[I 2025-12-05 15:56:30,526] Trial 122 finished with value: 0.11262331340366954 and parameters: {'model_type': 'mlp', 'hidden_dims': '[128, 64]', 'dropout': 0.2718195218221975, 'batch_norm': True, 'lr': 0.00043091581750458104, 'weight_decay': 1.0520002782540009e-07, 'epochs': 277, 'loss': 'mse', 'optimizer': 'adam', 'graph_mode': 'off', 'use_snp_selection': True, 'num_snps': 23543}. Best is trial 118 with value: 0.13217672050707877.
[I 2025-12-05 15:56:32,158] Trial 123 finished with value: 0.12075636971213416 and parameters: {'model_type': 'mlp', 'hidden_dims': '[128, 64]', 'dropout': 0.2582400210412163, 'batch_norm': True, 'lr': 0.0005502704789590986, 'weight_decay': 2.063970510953079e-07, 'epochs': 283, 'loss': 'mse', 'optimizer': 'adam', 'graph_mode': 'off', 'use_snp_selection': True, 'num_snps': 29992}. Best is trial 118 with value: 0.13217672050707877.
[I 2025-12-05 15:56:33,933] Trial 124 finished with value: 0.10674855035924638 and parameters: {'model_type': 'mlp', 'hidden_dims': '[128, 64]', 'dropout': 0.23518164280614037, 'batch_norm': True, 'lr': 0.0005350283530136961, 'weight_decay': 2.588902265229142e-07, 'epochs': 282, 'loss': 'mse', 'optimizer': 'adam', 'graph_mode': 'off', 'use_snp_selection': True, 'num_snps': 30151}. Best is trial 118 with value: 0.13217672050707877.
[I 2025-12-05 15:56:35,707] Trial 125 finished with value: 0.09925203535309322 and parameters: {'model_type': 'mlp', 'hidden_dims': '[128, 64]', 'dropout': 0.2539169394218101, 'batch_norm': True, 'lr': 0.0006248932614310993, 'weight_decay': 1.365011259931107e-07, 'epochs': 274, 'loss': 'mse', 'optimizer': 'adam', 'graph_mode': 'off', 'use_snp_selection': True, 'num_snps': 31335}. Best is trial 118 with value: 0.13217672050707877.
[I 2025-12-05 15:56:37,371] Trial 126 finished with value: 0.07688532712016828 and parameters: {'model_type': 'mlp', 'hidden_dims': '[512, 128]', 'dropout': 0.2801037003713251, 'batch_norm': False, 'lr': 7.292357843345663e-06, 'weight_decay': 4.158955322684668e-07, 'epochs': 295, 'loss': 'mse', 'optimizer': 'adam', 'graph_mode': 'off', 'use_snp_selection': True, 'num_snps': 27654}. Best is trial 118 with value: 0.13217672050707877.
[I 2025-12-05 15:56:38,830] Trial 127 finished with value: 0.11353744388692776 and parameters: {'model_type': 'mlp', 'hidden_dims': '[128, 64]', 'dropout': 0.21838760517640543, 'batch_norm': True, 'lr': 0.0003827355866309344, 'weight_decay': 3.519629538279385e-07, 'epochs': 286, 'loss': 'mse', 'optimizer': 'adam', 'graph_mode': 'off', 'use_snp_selection': True, 'num_snps': 21726}. Best is trial 118 with value: 0.13217672050707877.
[I 2025-12-05 15:56:40,285] Trial 128 finished with value: 0.12695405314171437 and parameters: {'model_type': 'mlp', 'hidden_dims': '[128, 64]', 'dropout': 0.25841189481996873, 'batch_norm': True, 'lr': 0.0007118874564489441, 'weight_decay': 1.969514481709957e-07, 'epochs': 267, 'loss': 'mae', 'optimizer': 'adam', 'graph_mode': 'off', 'use_snp_selection': True, 'num_snps': 24389}. Best is trial 118 with value: 0.13217672050707877.
[I 2025-12-05 15:56:41,766] Trial 129 finished with value: 0.10865546954445808 and parameters: {'model_type': 'mlp', 'hidden_dims': '[128, 64]', 'dropout': 0.2598894114138131, 'batch_norm': True, 'lr': 0.0007083303168208645, 'weight_decay': 1.939509298304972e-07, 'epochs': 270, 'loss': 'mae', 'optimizer': 'adam', 'graph_mode': 'off', 'use_snp_selection': True, 'num_snps': 24746}. Best is trial 118 with value: 0.13217672050707877.
[I 2025-12-05 15:56:43,215] Trial 130 finished with value: 0.10956051482829358 and parameters: {'model_type': 'mlp', 'hidden_dims': '[128, 64]', 'dropout': 0.19022838991161461, 'batch_norm': True, 'lr': 0.0008902054477958602, 'weight_decay': 2.1734229339685248e-07, 'epochs': 249, 'loss': 'mae', 'optimizer': 'adam', 'graph_mode': 'off', 'use_snp_selection': True, 'num_snps': 25463}. Best is trial 118 with value: 0.13217672050707877.
[I 2025-12-05 15:56:44,768] Trial 131 finished with value: 0.08844547849035131 and parameters: {'model_type': 'mlp', 'hidden_dims': '[128, 64]', 'dropout': 0.28859602116761524, 'batch_norm': True, 'lr': 0.0004664188211682528, 'weight_decay': 1.414469151404661e-07, 'epochs': 188, 'loss': 'mae', 'optimizer': 'adam', 'graph_mode': 'off', 'use_snp_selection': True, 'num_snps': 32007}. Best is trial 118 with value: 0.13217672050707877.
[I 2025-12-05 15:56:46,106] Trial 132 finished with value: 0.11980349489819478 and parameters: {'model_type': 'mlp', 'hidden_dims': '[128, 64]', 'dropout': 0.23216667925860682, 'batch_norm': True, 'lr': 0.0005664228705118537, 'weight_decay': 2.6771233823436106e-07, 'epochs': 259, 'loss': 'mae', 'optimizer': 'adam', 'graph_mode': 'off', 'use_snp_selection': True, 'num_snps': 21112}. Best is trial 118 with value: 0.13217672050707877.
[I 2025-12-05 15:56:47,510] Trial 133 finished with value: 0.09728456643458958 and parameters: {'model_type': 'mlp', 'hidden_dims': '[128, 64]', 'dropout': 0.24315372493862114, 'batch_norm': True, 'lr': 0.0005681163475136216, 'weight_decay': 2.7286988663031755e-07, 'epochs': 256, 'loss': 'mae', 'optimizer': 'adam', 'graph_mode': 'off', 'use_snp_selection': True, 'num_snps': 22003}. Best is trial 118 with value: 0.13217672050707877.
[I 2025-12-05 15:56:49,181] Trial 134 finished with value: 0.10450662734459978 and parameters: {'model_type': 'mlp', 'hidden_dims': '[128, 64]', 'dropout': 0.22577151853423194, 'batch_norm': True, 'lr': 0.0006923208432538897, 'weight_decay': 2.0690805220406113e-07, 'epochs': 242, 'loss': 'mae', 'optimizer': 'adam', 'graph_mode': 'off', 'use_snp_selection': True, 'num_snps': 28142}. Best is trial 118 with value: 0.13217672050707877.
[I 2025-12-05 15:56:50,955] Trial 135 finished with value: 0.10664661666622827 and parameters: {'model_type': 'mlp', 'hidden_dims': '[128, 64]', 'dropout': 0.26608925073167766, 'batch_norm': True, 'lr': 0.0005231782110277504, 'weight_decay': 4.755148970761748e-07, 'epochs': 266, 'loss': 'mae', 'optimizer': 'adam', 'graph_mode': 'off', 'use_snp_selection': True, 'num_snps': 30558}. Best is trial 118 with value: 0.13217672050707877.
[I 2025-12-05 15:56:52,382] Trial 136 finished with value: 0.1050309605915891 and parameters: {'model_type': 'mlp', 'hidden_dims': '[128, 64]', 'dropout': 0.19835234242940417, 'batch_norm': True, 'lr': 0.0008970444294799556, 'weight_decay': 2.6480705197524663e-07, 'epochs': 278, 'loss': 'mae', 'optimizer': 'adam', 'graph_mode': 'off', 'use_snp_selection': True, 'num_snps': 20495}. Best is trial 118 with value: 0.13217672050707877.
[I 2025-12-05 15:56:53,758] Trial 137 finished with value: 0.11780631585377593 and parameters: {'model_type': 'mlp', 'hidden_dims': '[128, 64]', 'dropout': 0.30316781088970024, 'batch_norm': True, 'lr': 0.0006235381833328143, 'weight_decay': 3.948642532924722e-07, 'epochs': 287, 'loss': 'mae', 'optimizer': 'adam', 'graph_mode': 'off', 'use_snp_selection': True, 'num_snps': 18402}. Best is trial 118 with value: 0.13217672050707877.
[I 2025-12-05 15:56:55,351] Trial 138 finished with value: 0.109639846217191 and parameters: {'model_type': 'mlp', 'hidden_dims': '[128, 64]', 'dropout': 0.23214015037011773, 'batch_norm': True, 'lr': 0.0007499214278792241, 'weight_decay': 1.5282592159810645e-07, 'epochs': 260, 'loss': 'mae', 'optimizer': 'adam', 'graph_mode': 'off', 'use_snp_selection': True, 'num_snps': 29006}. Best is trial 118 with value: 0.13217672050707877.
[I 2025-12-05 15:56:56,885] Trial 139 finished with value: 0.0979018400497086 and parameters: {'model_type': 'mlp', 'hidden_dims': '[512, 256]', 'dropout': 0.3377029963577004, 'batch_norm': True, 'lr': 0.0009894685110346181, 'weight_decay': 1.1000477693894235e-07, 'epochs': 282, 'loss': 'mae', 'optimizer': 'adam', 'graph_mode': 'off', 'use_snp_selection': False}. Best is trial 118 with value: 0.13217672050707877.
[I 2025-12-05 15:56:58,322] Trial 140 finished with value: 0.11452080877698292 and parameters: {'model_type': 'mlp', 'hidden_dims': '[128, 64]', 'dropout': 0.249510784484253, 'batch_norm': True, 'lr': 0.00046735818354872393, 'weight_decay': 2.2651503377367518e-07, 'epochs': 300, 'loss': 'mse', 'optimizer': 'adam', 'graph_mode': 'off', 'use_snp_selection': True, 'num_snps': 22803}. Best is trial 118 with value: 0.13217672050707877.
[I 2025-12-05 15:56:59,877] Trial 141 finished with value: 0.12015389316546389 and parameters: {'model_type': 'mlp', 'hidden_dims': '[512, 128]', 'dropout': 0.3214454228902711, 'batch_norm': True, 'lr': 0.00039977357653345755, 'weight_decay': 5.570046354988032e-07, 'epochs': 269, 'loss': 'mse', 'optimizer': 'adam', 'graph_mode': 'off', 'use_snp_selection': True, 'num_snps': 25433}. Best is trial 118 with value: 0.13217672050707877.
[I 2025-12-05 15:57:01,375] Trial 142 finished with value: 0.11492846856741358 and parameters: {'model_type': 'mlp', 'hidden_dims': '[512, 128]', 'dropout': 0.3194229358323674, 'batch_norm': True, 'lr': 0.0003428793459352864, 'weight_decay': 3.2987754673112266e-07, 'epochs': 252, 'loss': 'mse', 'optimizer': 'adam', 'graph_mode': 'off', 'use_snp_selection': True, 'num_snps': 24995}. Best is trial 118 with value: 0.13217672050707877.
[I 2025-12-05 15:57:02,955] Trial 143 finished with value: 0.11193713093671936 and parameters: {'model_type': 'mlp', 'hidden_dims': '[512, 128]', 'dropout': 0.32836790841663943, 'batch_norm': True, 'lr': 0.0006031081663384826, 'weight_decay': 5.519073216260531e-07, 'epochs': 271, 'loss': 'mse', 'optimizer': 'adam', 'graph_mode': 'off', 'use_snp_selection': True, 'num_snps': 26761}. Best is trial 118 with value: 0.13217672050707877.
[I 2025-12-05 15:57:04,992] Trial 144 finished with value: 0.11386023268446636 and parameters: {'model_type': 'mlp', 'hidden_dims': '[512, 128]', 'dropout': 0.28934837382045797, 'batch_norm': True, 'lr': 0.0007027292913758462, 'weight_decay': 1.9977167516249682e-07, 'epochs': 266, 'loss': 'mse', 'optimizer': 'adam', 'graph_mode': 'off', 'use_snp_selection': True, 'num_snps': 34089}. Best is trial 118 with value: 0.13217672050707877.
[I 2025-12-05 15:57:06,455] Trial 145 finished with value: 0.1146098449808694 and parameters: {'model_type': 'mlp', 'hidden_dims': '[512, 128]', 'dropout': 0.26369014015572406, 'batch_norm': True, 'lr': 0.0005282859207506373, 'weight_decay': 3.8236070858974957e-07, 'epochs': 259, 'loss': 'mse', 'optimizer': 'adam', 'graph_mode': 'off', 'use_snp_selection': True, 'num_snps': 19706}. Best is trial 118 with value: 0.13217672050707877.
[I 2025-12-05 15:57:08,253] Trial 146 finished with value: 0.1345587660198129 and parameters: {'model_type': 'mlp', 'hidden_dims': '[512, 128]', 'dropout': 0.27890968523121407, 'batch_norm': True, 'lr': 0.000836060764584158, 'weight_decay': 6.370881123503567e-07, 'epochs': 277, 'loss': 'mse', 'optimizer': 'adam', 'graph_mode': 'off', 'use_snp_selection': True, 'num_snps': 31033}. Best is trial 146 with value: 0.1345587660198129.
[I 2025-12-05 15:57:10,106] Trial 147 finished with value: 0.1009580363444228 and parameters: {'model_type': 'mlp', 'hidden_dims': '[512, 128]', 'dropout': 0.28256551317610307, 'batch_norm': False, 'lr': 2.0815710393097656e-06, 'weight_decay': 6.896971285611235e-07, 'epochs': 290, 'loss': 'mse', 'optimizer': 'adam', 'graph_mode': 'off', 'use_snp_selection': True, 'num_snps': 32450}. Best is trial 146 with value: 0.1345587660198129.
[I 2025-12-05 15:57:11,550] Trial 148 finished with value: 0.11336234279068536 and parameters: {'model_type': 'mlp', 'hidden_dims': '[128, 64]', 'dropout': 0.2998459696103374, 'batch_norm': True, 'lr': 0.00040311767476678204, 'weight_decay': 2.982255695084383e-07, 'epochs': 276, 'loss': 'mae', 'optimizer': 'adam', 'graph_mode': 'off', 'use_snp_selection': True, 'num_snps': 21923}. Best is trial 146 with value: 0.1345587660198129.
[I 2025-12-05 15:57:12,832] Trial 149 finished with value: 0.11687048627316315 and parameters: {'model_type': 'mlp', 'hidden_dims': '[512, 128]', 'dropout': 0.2718422175132503, 'batch_norm': True, 'lr': 0.0007565394123506783, 'weight_decay': 1.8175763821456341e-07, 'epochs': 267, 'loss': 'mse', 'optimizer': 'adam', 'graph_mode': 'off', 'use_snp_selection': True, 'num_snps': 16776}. Best is trial 146 with value: 0.1345587660198129.
[I 2025-12-05 15:57:15,385] Trial 0 finished with value: 0.0638511802312804 and parameters: {'model_type': 'mlp', 'hidden_dims': '[128, 64]', 'dropout': 0.199031432379812, 'batch_norm': True, 'lr': 1.8408544111075837e-06, 'weight_decay': 5.5136510071208614e-05, 'epochs': 336, 'loss': 'mae', 'optimizer': 'adam', 'graph_mode': 'off', 'use_snp_selection': True, 'num_snps': 43862}. Best is trial 0 with value: 0.0638511802312804.
