[I 2025-12-05 16:11:58,453] Trial 6 finished with value: 0.20627070881102122 and parameters: {'model_type': 'mlp', 'hidden_dims': '[256, 128]', 'dropout': 0.3930109900265879, 'batch_norm': False, 'lr': 4.892964372128395e-05, 'weight_decay': 1.5809549317992182e-06, 'epochs': 199, 'loss': 'mse', 'optimizer': 'adam', 'graph_mode': 'off', 'use_snp_selection': False}. Best is trial 3 with value: 0.24045905308731358.
[I 2025-12-05 16:12:33,684] Trial 7 finished with value: 0.2087259746452884 and parameters: {'model_type': 'mlp', 'hidden_dims': '[512, 256]', 'dropout': 0.15343979219678458, 'batch_norm': True, 'lr': 6.234003099047341e-05, 'weight_decay': 3.894760610535477e-07, 'epochs': 97, 'loss': 'mse', 'optimizer': 'adam', 'graph_mode': 'off', 'use_snp_selection': False}. Best is trial 3 with value: 0.24045905308731358.
[I 2025-12-05 16:14:10,404] Trial 8 finished with value: 0.22014084154287472 and parameters: {'model_type': 'mlp', 'hidden_dims': '[512, 128]', 'dropout': 0.10743001231661406, 'batch_norm': True, 'lr': 0.00023728538449271062, 'weight_decay': 1.7629071578048637e-05, 'epochs': 312, 'loss': 'mae', 'optimizer': 'adam', 'graph_mode': 'off', 'use_snp_selection': False}. Best is trial 3 with value: 0.24045905308731358.
[I 2025-12-05 16:15:08,127] Trial 9 finished with value: 0.20981762922507205 and parameters: {'model_type': 'mlp', 'hidden_dims': '[512, 64]', 'dropout': 0.14505336736221927, 'batch_norm': True, 'lr': 5.8619638388111826e-05, 'weight_decay': 6.200156172669308e-07, 'epochs': 175, 'loss': 'mse', 'optimizer': 'adam', 'graph_mode': 'off', 'use_snp_selection': False}. Best is trial 3 with value: 0.24045905308731358.
[I 2025-12-05 16:15:31,464] Trial 10 finished with value: 0.22635898942543609 and parameters: {'model_type': 'mlp', 'hidden_dims': '[512, 64]', 'dropout': 0.5885461262002587, 'batch_norm': False, 'lr': 8.769366258768696e-06, 'weight_decay': 2.78273193871783e-06, 'epochs': 55, 'loss': 'mae', 'optimizer': 'adam', 'graph_mode': 'off', 'use_snp_selection': False}. Best is trial 3 with value: 0.24045905308731358.
[I 2025-12-05 16:16:00,848] Trial 11 finished with value: 0.24496792249952107 and parameters: {'model_type': 'mlp', 'hidden_dims': '[512, 64]', 'dropout': 0.583942291816117, 'batch_norm': False, 'lr': 1.1821335968986158e-05, 'weight_decay': 4.061640528568547e-06, 'epochs': 77, 'loss': 'mae', 'optimizer': 'adam', 'graph_mode': 'off', 'use_snp_selection': False}. Best is trial 11 with value: 0.24496792249952107.
[I 2025-12-05 16:16:19,903] Trial 12 finished with value: 0.22339519991197135 and parameters: {'model_type': 'mlp', 'hidden_dims': '[512, 64]', 'dropout': 0.593097749012682, 'batch_norm': False, 'lr': 1.2808693622626188e-05, 'weight_decay': 1.3081036432574914e-07, 'epochs': 40, 'loss': 'mae', 'optimizer': 'adam', 'graph_mode': 'off', 'use_snp_selection': False}. Best is trial 11 with value: 0.24496792249952107.
[I 2025-12-05 16:17:33,355] Trial 13 finished with value: 0.22734759220144346 and parameters: {'model_type': 'mlp', 'hidden_dims': '[512, 64]', 'dropout': 0.5043641748401543, 'batch_norm': False, 'lr': 1.3373175420781734e-05, 'weight_decay': 4.373608364627903e-05, 'epochs': 235, 'loss': 'mae', 'optimizer': 'adam', 'graph_mode': 'off', 'use_snp_selection': False}. Best is trial 11 with value: 0.24496792249952107.
[I 2025-12-05 16:17:46,248] Trial 14 finished with value: 0.23005928124317493 and parameters: {'model_type': 'mlp', 'hidden_dims': '[128, 64]', 'dropout': 0.5300180653494536, 'batch_norm': False, 'lr': 5.096356034191146e-06, 'weight_decay': 4.57067734295802e-06, 'epochs': 93, 'loss': 'mae', 'optimizer': 'adam', 'graph_mode': 'off', 'use_snp_selection': False}. Best is trial 11 with value: 0.24496792249952107.
[I 2025-12-05 16:19:12,179] Trial 15 finished with value: 0.22322960484748777 and parameters: {'model_type': 'mlp', 'hidden_dims': '[512, 256]', 'dropout': 0.29817671914947536, 'batch_norm': False, 'lr': 1.8411764708572348e-05, 'weight_decay': 4.4084956876871386e-05, 'epochs': 278, 'loss': 'mae', 'optimizer': 'adam', 'graph_mode': 'off', 'use_snp_selection': False}. Best is trial 11 with value: 0.24496792249952107.
[I 2025-12-05 16:20:08,046] Trial 16 finished with value: 0.2093857426547372 and parameters: {'model_type': 'mlp', 'hidden_dims': '[256, 128, 64]', 'dropout': 0.4992385332513618, 'batch_norm': False, 'lr': 0.00017549215405955411, 'weight_decay': 6.80662468241148e-06, 'epochs': 350, 'loss': 'mae', 'optimizer': 'adam', 'graph_mode': 'off', 'use_snp_selection': False}. Best is trial 11 with value: 0.24496792249952107.
[I 2025-12-05 16:20:47,030] Trial 17 finished with value: 0.0679922868627893 and parameters: {'model_type': 'mlp', 'hidden_dims': '[512, 64]', 'dropout': 0.543474321376226, 'batch_norm': False, 'lr': 0.000906375209920231, 'weight_decay': 1.3398043894594233e-06, 'epochs': 113, 'loss': 'mae', 'optimizer': 'adam', 'graph_mode': 'off', 'use_snp_selection': False}. Best is trial 11 with value: 0.24496792249952107.
[I 2025-12-05 16:22:33,850] Trial 18 finished with value: 0.2435679842916673 and parameters: {'model_type': 'mlp', 'hidden_dims': '[512, 64]', 'dropout': 0.4928065509878574, 'batch_norm': False, 'lr': 3.4071412855829388e-06, 'weight_decay': 0.00012275232383599145, 'epochs': 214, 'loss': 'mae', 'optimizer': 'adam', 'graph_mode': 'off', 'use_snp_selection': True, 'num_snps': 58241}. Best is trial 11 with value: 0.24496792249952107.
[I 2025-12-05 16:24:15,389] Trial 19 finished with value: 0.2439431167356712 and parameters: {'model_type': 'mlp', 'hidden_dims': '[512, 64]', 'dropout': 0.47355279224247543, 'batch_norm': False, 'lr': 2.7960991179492955e-06, 'weight_decay': 9.33647122404507e-05, 'epochs': 205, 'loss': 'mae', 'optimizer': 'adam', 'graph_mode': 'off', 'use_snp_selection': True, 'num_snps': 55667}. Best is trial 11 with value: 0.24496792249952107.
[I 2025-12-05 16:25:45,701] Trial 20 finished with value: 0.2507962394015929 and parameters: {'model_type': 'mlp', 'hidden_dims': '[512, 256]', 'dropout': 0.44795937657049567, 'batch_norm': False, 'lr': 2.486017858307547e-06, 'weight_decay': 0.00017680016161656075, 'epochs': 151, 'loss': 'mae', 'optimizer': 'adam', 'graph_mode': 'off', 'use_snp_selection': True, 'num_snps': 57703}. Best is trial 20 with value: 0.2507962394015929.
[I 2025-12-05 16:27:17,314] Trial 21 finished with value: 0.23703451950845614 and parameters: {'model_type': 'mlp', 'hidden_dims': '[512, 256]', 'dropout': 0.4525017130485846, 'batch_norm': False, 'lr': 2.1402396224889165e-06, 'weight_decay': 0.00011727750911803841, 'epochs': 148, 'loss': 'mae', 'optimizer': 'adam', 'graph_mode': 'off', 'use_snp_selection': True, 'num_snps': 59672}. Best is trial 20 with value: 0.2507962394015929.
[I 2025-12-05 16:28:42,894] Trial 22 finished with value: 0.2350594472232755 and parameters: {'model_type': 'mlp', 'hidden_dims': '[512, 256]', 'dropout': 0.34979026414918357, 'batch_norm': False, 'lr': 2.576018607404523e-05, 'weight_decay': 0.0008637670314495343, 'epochs': 174, 'loss': 'mae', 'optimizer': 'adam', 'graph_mode': 'off', 'use_snp_selection': True, 'num_snps': 48701}. Best is trial 20 with value: 0.2507962394015929.
[I 2025-12-05 16:29:25,560] Trial 23 finished with value: 0.2228125415146765 and parameters: {'model_type': 'mlp', 'hidden_dims': '[512, 256]', 'dropout': 0.4623046741749175, 'batch_norm': False, 'lr': 7.819816648584564e-06, 'weight_decay': 0.00013214259350608046, 'epochs': 68, 'loss': 'mae', 'optimizer': 'adam', 'graph_mode': 'off', 'use_snp_selection': True, 'num_snps': 18234}. Best is trial 20 with value: 0.2507962394015929.
[I 2025-12-05 16:30:28,962] Trial 24 finished with value: 0.19976245632072293 and parameters: {'model_type': 'mlp', 'hidden_dims': '[256, 128, 64]', 'dropout': 0.3096764712007455, 'batch_norm': False, 'lr': 1.0272800133319561e-06, 'weight_decay': 0.00033092211733712156, 'epochs': 127, 'loss': 'mae', 'optimizer': 'adam', 'graph_mode': 'off', 'use_snp_selection': True, 'num_snps': 50570}. Best is trial 20 with value: 0.2507962394015929.
[I 2025-12-05 16:31:16,519] Trial 25 finished with value: 0.20849640656529095 and parameters: {'model_type': 'mlp', 'hidden_dims': '[512, 128]', 'dropout': 0.5472566816920805, 'batch_norm': False, 'lr': 3.007788931505872e-06, 'weight_decay': 2.0159685009367607e-05, 'epochs': 83, 'loss': 'mae', 'optimizer': 'adam', 'graph_mode': 'off', 'use_snp_selection': True, 'num_snps': 23071}. Best is trial 20 with value: 0.2507962394015929.
[I 2025-12-05 16:32:17,975] Trial 26 finished with value: 0.24045773763382935 and parameters: {'model_type': 'mlp', 'hidden_dims': '[256, 128]', 'dropout': 0.4642242046792523, 'batch_norm': False, 'lr': 8.017561786286181e-06, 'weight_decay': 6.82558126477469e-05, 'epochs': 176, 'loss': 'mae', 'optimizer': 'adam', 'graph_mode': 'off', 'use_snp_selection': True, 'num_snps': 40781}. Best is trial 20 with value: 0.2507962394015929.
[I 2025-12-05 16:33:20,480] Trial 27 finished with value: 0.22166752158188402 and parameters: {'model_type': 'mlp', 'hidden_dims': '[128, 64]', 'dropout': 0.3477601142682715, 'batch_norm': False, 'lr': 2.593920294854391e-06, 'weight_decay': 8.591260947325217e-06, 'epochs': 221, 'loss': 'mse', 'optimizer': 'adam', 'graph_mode': 'off', 'use_snp_selection': True, 'num_snps': 51493}. Best is trial 20 with value: 0.2507962394015929.
[I 2025-12-05 16:33:57,883] Trial 28 finished with value: 0.20679878197465026 and parameters: {'model_type': 'mlp', 'hidden_dims': '[512, 256]', 'dropout': 0.5554218154819413, 'batch_norm': False, 'lr': 2.8488979691756413e-05, 'weight_decay': 0.00021217967330717114, 'epochs': 263, 'loss': 'mae', 'optimizer': 'adam', 'graph_mode': 'off', 'use_snp_selection': True, 'num_snps': 3934}. Best is trial 20 with value: 0.2507962394015929.
[I 2025-12-05 16:34:55,884] Trial 29 finished with value: 0.18853025996802683 and parameters: {'model_type': 'mlp', 'hidden_dims': '[128, 64]', 'dropout': 0.40935152374607636, 'batch_norm': False, 'lr': 2.0706695005528587e-06, 'weight_decay': 0.0005128239224515612, 'epochs': 125, 'loss': 'mae', 'optimizer': 'adam', 'graph_mode': 'off', 'use_snp_selection': True, 'num_snps': 54325}. Best is trial 20 with value: 0.2507962394015929.
[I 2025-12-05 16:36:16,039] Trial 30 finished with value: 0.20942203066198783 and parameters: {'model_type': 'mlp', 'hidden_dims': '[512, 64]', 'dropout': 0.4867507938239815, 'batch_norm': False, 'lr': 1.0049634350967163e-06, 'weight_decay': 5.643743123580809e-05, 'epochs': 188, 'loss': 'mae', 'optimizer': 'adam', 'graph_mode': 'off', 'use_snp_selection': True, 'num_snps': 42860}. Best is trial 20 with value: 0.2507962394015929.
[I 2025-12-05 16:38:03,281] Trial 31 finished with value: 0.2448220540318748 and parameters: {'model_type': 'mlp', 'hidden_dims': '[512, 64]', 'dropout': 0.5209287667779743, 'batch_norm': False, 'lr': 3.948709257064098e-06, 'weight_decay': 0.00011513951782574728, 'epochs': 209, 'loss': 'mae', 'optimizer': 'adam', 'graph_mode': 'off', 'use_snp_selection': True, 'num_snps': 59246}. Best is trial 20 with value: 0.2507962394015929.
[I 2025-12-05 16:39:56,937] Trial 32 finished with value: 0.2526866274743228 and parameters: {'model_type': 'mlp', 'hidden_dims': '[512, 64]', 'dropout': 0.5176568736597905, 'batch_norm': False, 'lr': 5.1575984704005815e-06, 'weight_decay': 2.9215409433396042e-05, 'epochs': 247, 'loss': 'mae', 'optimizer': 'adam', 'graph_mode': 'off', 'use_snp_selection': True, 'num_snps': 57707}. Best is trial 32 with value: 0.2526866274743228.
[I 2025-12-05 16:41:53,908] Trial 33 finished with value: 0.23659051884303745 and parameters: {'model_type': 'mlp', 'hidden_dims': '[512, 64]', 'dropout': 0.5253740878963782, 'batch_norm': False, 'lr': 5.0136593875223696e-06, 'weight_decay': 2.9512568103731214e-05, 'epochs': 247, 'loss': 'mae', 'optimizer': 'adam', 'graph_mode': 'off', 'use_snp_selection': True, 'num_snps': 59420}. Best is trial 32 with value: 0.2526866274743228.
[I 2025-12-05 16:43:43,361] Trial 34 finished with value: 0.23478450306648174 and parameters: {'model_type': 'mlp', 'hidden_dims': '[512, 64]', 'dropout': 0.5660495903201264, 'batch_norm': False, 'lr': 1.46509138722038e-05, 'weight_decay': 1.5064951031141403e-05, 'epochs': 294, 'loss': 'mae', 'optimizer': 'adam', 'graph_mode': 'off', 'use_snp_selection': True, 'num_snps': 48294}. Best is trial 32 with value: 0.2526866274743228.
[I 2025-12-05 16:44:55,695] Trial 35 finished with value: 0.20693338802684522 and parameters: {'model_type': 'mlp', 'hidden_dims': '[256, 128]', 'dropout': 0.4243232855604142, 'batch_norm': True, 'lr': 6.3875733668032225e-06, 'weight_decay': 0.0001809952834505566, 'epochs': 233, 'loss': 'mae', 'optimizer': 'adam', 'graph_mode': 'off', 'use_snp_selection': True, 'num_snps': 45781}. Best is trial 32 with value: 0.2526866274743228.
[I 2025-12-05 16:46:16,500] Trial 36 finished with value: 0.23838503361974994 and parameters: {'model_type': 'mlp', 'hidden_dims': '[256, 128, 64]', 'dropout': 0.5247075144220742, 'batch_norm': False, 'lr': 3.919760287845908e-06, 'weight_decay': 3.996821235654476e-06, 'epochs': 256, 'loss': 'mse', 'optimizer': 'adam', 'graph_mode': 'off', 'use_snp_selection': True, 'num_snps': 54166}. Best is trial 32 with value: 0.2526866274743228.
[I 2025-12-05 16:47:25,195] Trial 37 finished with value: 0.25786006345063966 and parameters: {'model_type': 'mlp', 'hidden_dims': '[512, 64]', 'dropout': 0.5715304703679751, 'batch_norm': False, 'lr': 1.0789476215444663e-05, 'weight_decay': 2.8463577405517332e-05, 'epochs': 156, 'loss': 'mae', 'optimizer': 'adam', 'graph_mode': 'off', 'use_snp_selection': True, 'num_snps': 36998}. Best is trial 37 with value: 0.25786006345063966.
[I 2025-12-05 16:48:21,842] Trial 38 finished with value: 0.18030309816988146 and parameters: {'model_type': 'mlp', 'hidden_dims': '[512, 128]', 'dropout': 0.5735288580318662, 'batch_norm': True, 'lr': 1.0104741313931475e-05, 'weight_decay': 3.051721822725122e-05, 'epochs': 159, 'loss': 'mse', 'optimizer': 'adam', 'graph_mode': 'off', 'use_snp_selection': True, 'num_snps': 24866}. Best is trial 37 with value: 0.25786006345063966.
[I 2025-12-05 16:49:24,133] Trial 39 finished with value: 0.249678562350367 and parameters: {'model_type': 'mlp', 'hidden_dims': '[512, 64]', 'dropout': 0.5973666882190021, 'batch_norm': False, 'lr': 2.2725211329081865e-05, 'weight_decay': 1.1092937818150672e-05, 'epochs': 117, 'loss': 'mae', 'optimizer': 'adam', 'graph_mode': 'off', 'use_snp_selection': True, 'num_snps': 37203}. Best is trial 37 with value: 0.25786006345063966.
[I 2025-12-05 16:50:27,513] Trial 40 finished with value: 0.22359124241732928 and parameters: {'model_type': 'mlp', 'hidden_dims': '[512, 256]', 'dropout': 0.43974904361868783, 'batch_norm': True, 'lr': 1.9818951196273313e-05, 'weight_decay': 1.4263806713178567e-05, 'epochs': 128, 'loss': 'mae', 'optimizer': 'adam', 'graph_mode': 'off', 'use_snp_selection': True, 'num_snps': 36184}. Best is trial 37 with value: 0.25786006345063966.
[I 2025-12-05 16:51:21,853] Trial 41 finished with value: 0.24192834614273884 and parameters: {'model_type': 'mlp', 'hidden_dims': '[512, 64]', 'dropout': 0.5968897995325391, 'batch_norm': False, 'lr': 3.6156687985308945e-05, 'weight_decay': 1.7639863010216495e-06, 'epochs': 112, 'loss': 'mae', 'optimizer': 'adam', 'graph_mode': 'off', 'use_snp_selection': True, 'num_snps': 28522}. Best is trial 37 with value: 0.25786006345063966.
[I 2025-12-05 16:52:31,407] Trial 42 finished with value: 0.22974311786779028 and parameters: {'model_type': 'mlp', 'hidden_dims': '[512, 64]', 'dropout': 0.5720884956030328, 'batch_norm': False, 'lr': 0.00013704294145524076, 'weight_decay': 8.609468227222382e-06, 'epochs': 154, 'loss': 'mae', 'optimizer': 'adam', 'graph_mode': 'off', 'use_snp_selection': True, 'num_snps': 38563}. Best is trial 37 with value: 0.25786006345063966.
[I 2025-12-05 16:53:23,566] Trial 43 finished with value: 0.25564922046290356 and parameters: {'model_type': 'mlp', 'hidden_dims': '[512, 64]', 'dropout': 0.598876264364811, 'batch_norm': False, 'lr': 9.851644805394765e-05, 'weight_decay': 5.0349980223463525e-06, 'epochs': 72, 'loss': 'mae', 'optimizer': 'adam', 'graph_mode': 'off', 'use_snp_selection': True, 'num_snps': 32439}. Best is trial 37 with value: 0.25786006345063966.
[I 2025-12-05 16:54:20,058] Trial 44 finished with value: 0.23458690146460745 and parameters: {'model_type': 'mlp', 'hidden_dims': '[512, 64]', 'dropout': 0.5493216797378421, 'batch_norm': False, 'lr': 0.0001082471822910443, 'weight_decay': 1.078789601976667e-05, 'epochs': 111, 'loss': 'mae', 'optimizer': 'adam', 'graph_mode': 'off', 'use_snp_selection': True, 'num_snps': 31285}. Best is trial 37 with value: 0.25786006345063966.
[I 2025-12-05 16:55:23,461] Trial 45 finished with value: 0.19340356310031606 and parameters: {'model_type': 'mlp', 'hidden_dims': '[512, 64]', 'dropout': 0.5991813106954476, 'batch_norm': False, 'lr': 0.0004020645314867002, 'weight_decay': 5.793590590453184e-06, 'epochs': 134, 'loss': 'mse', 'optimizer': 'adam', 'graph_mode': 'off', 'use_snp_selection': True, 'num_snps': 36160}. Best is trial 37 with value: 0.25786006345063966.
[I 2025-12-05 16:56:07,247] Trial 46 finished with value: 0.21447056905675926 and parameters: {'model_type': 'mlp', 'hidden_dims': '[256, 128]', 'dropout': 0.20902483152630552, 'batch_norm': True, 'lr': 8.489233772115867e-05, 'weight_decay': 2.7351218967031463e-06, 'epochs': 57, 'loss': 'mae', 'optimizer': 'adam', 'graph_mode': 'off', 'use_snp_selection': True, 'num_snps': 27221}. Best is trial 37 with value: 0.25786006345063966.
[I 2025-12-05 16:56:52,804] Trial 47 finished with value: 0.22231224632330057 and parameters: {'model_type': 'mlp', 'hidden_dims': '[512, 64]', 'dropout': 0.5119447466692066, 'batch_norm': False, 'lr': 3.719800757429124e-05, 'weight_decay': 2.9896314268332288e-05, 'epochs': 93, 'loss': 'mae', 'optimizer': 'adam', 'graph_mode': 'off', 'use_snp_selection': True, 'num_snps': 20078}. Best is trial 37 with value: 0.25786006345063966.
[I 2025-12-05 16:57:57,947] Trial 48 finished with value: 0.23587766148383876 and parameters: {'model_type': 'mlp', 'hidden_dims': '[512, 128]', 'dropout': 0.5678634263640601, 'batch_norm': False, 'lr': 2.073460892137056e-05, 'weight_decay': 8.210261186621991e-07, 'epochs': 162, 'loss': 'mae', 'optimizer': 'adam', 'graph_mode': 'off', 'use_snp_selection': True, 'num_snps': 32863}. Best is trial 37 with value: 0.25786006345063966.
[I 2025-12-05 16:59:20,284] Trial 49 finished with value: 0.20871061372111277 and parameters: {'model_type': 'mlp', 'hidden_dims': '[512, 64]', 'dropout': 0.5374370210582089, 'batch_norm': False, 'lr': 4.9149923890243775e-05, 'weight_decay': 7.639943949027878e-05, 'epochs': 195, 'loss': 'mse', 'optimizer': 'adam', 'graph_mode': 'off', 'use_snp_selection': True, 'num_snps': 44641}. Best is trial 37 with value: 0.25786006345063966.
[I 2025-12-05 17:00:06,907] Trial 50 finished with value: 0.1362858931121317 and parameters: {'model_type': 'mlp', 'hidden_dims': '[128, 64]', 'dropout': 0.5768115550795253, 'batch_norm': False, 'lr': 1.728764966693954e-06, 'weight_decay': 4.580225615009291e-05, 'epochs': 104, 'loss': 'mae', 'optimizer': 'adam', 'graph_mode': 'off', 'use_snp_selection': True, 'num_snps': 34030}. Best is trial 37 with value: 0.25786006345063966.
[I 2025-12-05 17:00:36,079] Trial 51 finished with value: 0.2411221422120134 and parameters: {'model_type': 'mlp', 'hidden_dims': '[512, 64]', 'dropout': 0.5843823611757327, 'batch_norm': False, 'lr': 1.0947925169295173e-05, 'weight_decay': 3.867009900776349e-06, 'epochs': 78, 'loss': 'mae', 'optimizer': 'adam', 'graph_mode': 'off', 'use_snp_selection': False}. Best is trial 37 with value: 0.25786006345063966.
[I 2025-12-05 17:01:22,159] Trial 52 finished with value: 0.24162978865822193 and parameters: {'model_type': 'mlp', 'hidden_dims': '[512, 64]', 'dropout': 0.5558168850947504, 'batch_norm': False, 'lr': 1.584061880494712e-05, 'weight_decay': 2.2523436038502816e-06, 'epochs': 139, 'loss': 'mae', 'optimizer': 'adam', 'graph_mode': 'off', 'use_snp_selection': False}. Best is trial 37 with value: 0.25786006345063966.
[I 2025-12-05 17:01:41,983] Trial 53 finished with value: 0.23872622662141635 and parameters: {'model_type': 'mlp', 'hidden_dims': '[512, 64]', 'dropout': 0.4897036844081117, 'batch_norm': False, 'lr': 1.146000063809482e-05, 'weight_decay': 5.929285546557068e-06, 'epochs': 43, 'loss': 'mae', 'optimizer': 'adam', 'graph_mode': 'off', 'use_snp_selection': False}. Best is trial 37 with value: 0.25786006345063966.
[I 2025-12-05 17:02:11,103] Trial 54 finished with value: 0.22104558910814537 and parameters: {'model_type': 'mlp', 'hidden_dims': '[512, 64]', 'dropout': 0.38195141584817394, 'batch_norm': False, 'lr': 6.0277356131188695e-06, 'weight_decay': 1.3150905279781022e-05, 'epochs': 76, 'loss': 'mae', 'optimizer': 'adam', 'graph_mode': 'off', 'use_snp_selection': False}. Best is trial 37 with value: 0.25786006345063966.
[I 2025-12-05 17:02:43,873] Trial 55 finished with value: 0.188192699876698 and parameters: {'model_type': 'mlp', 'hidden_dims': '[512, 256]', 'dropout': 0.5960555810016337, 'batch_norm': False, 'lr': 0.0003691612489736482, 'weight_decay': 1.9732586632886545e-05, 'epochs': 91, 'loss': 'mae', 'optimizer': 'adam', 'graph_mode': 'off', 'use_snp_selection': False}. Best is trial 37 with value: 0.25786006345063966.
[I 2025-12-05 17:03:22,874] Trial 56 finished with value: 0.23920023553959488 and parameters: {'model_type': 'mlp', 'hidden_dims': '[512, 64]', 'dropout': 0.5059874353820742, 'batch_norm': False, 'lr': 7.134871621942156e-06, 'weight_decay': 9.678477674497334e-07, 'epochs': 54, 'loss': 'mae', 'optimizer': 'adam', 'graph_mode': 'off', 'use_snp_selection': True, 'num_snps': 14148}. Best is trial 37 with value: 0.25786006345063966.
