[I 2025-12-05 22:53:51,521] Trial 110 finished with value: 0.2191002883544732 and parameters: {'model_type': 'mlp', 'hidden_dims': '[512, 128]', 'dropout': 0.3429180607843527, 'batch_norm': False, 'lr': 1.2169823887835398e-05, 'weight_decay': 0.00025878324818372054, 'epochs': 276, 'loss': 'mse', 'optimizer': 'adam', 'graph_mode': 'off', 'use_snp_selection': True, 'num_snps': 19424}. Best is trial 45 with value: 0.22042093462114573.
[I 2025-12-05 22:54:50,124] Trial 111 finished with value: 0.21776384066100377 and parameters: {'model_type': 'mlp', 'hidden_dims': '[512, 128]', 'dropout': 0.352440480887782, 'batch_norm': False, 'lr': 1.269927853364246e-05, 'weight_decay': 0.0006592404932329836, 'epochs': 276, 'loss': 'mse', 'optimizer': 'adam', 'graph_mode': 'off', 'use_snp_selection': True, 'num_snps': 20027}. Best is trial 45 with value: 0.22042093462114573.
[I 2025-12-05 22:55:47,507] Trial 112 finished with value: 0.2159309412385749 and parameters: {'model_type': 'mlp', 'hidden_dims': '[512, 128]', 'dropout': 0.31514571074748216, 'batch_norm': False, 'lr': 1.2893580009814539e-05, 'weight_decay': 0.0006548111742883248, 'epochs': 268, 'loss': 'mse', 'optimizer': 'adam', 'graph_mode': 'off', 'use_snp_selection': True, 'num_snps': 19318}. Best is trial 45 with value: 0.22042093462114573.
[I 2025-12-05 22:56:40,214] Trial 113 finished with value: 0.20674494002192514 and parameters: {'model_type': 'mlp', 'hidden_dims': '[512, 128]', 'dropout': 0.3458711505312123, 'batch_norm': False, 'lr': 1.5512280504371826e-05, 'weight_decay': 0.0008724183815293109, 'epochs': 276, 'loss': 'mse', 'optimizer': 'adam', 'graph_mode': 'off', 'use_snp_selection': True, 'num_snps': 15617}. Best is trial 45 with value: 0.22042093462114573.
[I 2025-12-05 22:57:36,598] Trial 114 finished with value: 0.22090406226158937 and parameters: {'model_type': 'mlp', 'hidden_dims': '[512, 128]', 'dropout': 0.34180662556965685, 'batch_norm': False, 'lr': 2.7209538455775125e-05, 'weight_decay': 0.0004311174988530043, 'epochs': 284, 'loss': 'mse', 'optimizer': 'adam', 'graph_mode': 'off', 'use_snp_selection': True, 'num_snps': 18084}. Best is trial 114 with value: 0.22090406226158937.
[I 2025-12-05 22:58:59,135] Trial 115 finished with value: 0.19953347387341286 and parameters: {'model_type': 'mlp', 'hidden_dims': '[512, 128]', 'dropout': 0.3522723333703223, 'batch_norm': False, 'lr': 1.1313761710726522e-05, 'weight_decay': 0.00042568604746621514, 'epochs': 284, 'loss': 'mse', 'optimizer': 'adam', 'graph_mode': 'off', 'use_snp_selection': True, 'num_snps': 35673}. Best is trial 114 with value: 0.22090406226158937.
[I 2025-12-05 22:59:55,340] Trial 116 finished with value: 0.22802374224146837 and parameters: {'model_type': 'mlp', 'hidden_dims': '[512, 128]', 'dropout': 0.3412555773888021, 'batch_norm': False, 'lr': 4.403638230917381e-05, 'weight_decay': 0.0005105492135879475, 'epochs': 273, 'loss': 'mse', 'optimizer': 'adam', 'graph_mode': 'off', 'use_snp_selection': True, 'num_snps': 18309}. Best is trial 116 with value: 0.22802374224146837.
[I 2025-12-05 23:00:50,168] Trial 117 finished with value: 0.2171230030444163 and parameters: {'model_type': 'mlp', 'hidden_dims': '[512, 128]', 'dropout': 0.38921140885251115, 'batch_norm': False, 'lr': 4.009295179887068e-05, 'weight_decay': 0.0009995195843119547, 'epochs': 265, 'loss': 'mse', 'optimizer': 'adam', 'graph_mode': 'off', 'use_snp_selection': True, 'num_snps': 18240}. Best is trial 116 with value: 0.22802374224146837.
[I 2025-12-05 23:02:00,481] Trial 118 finished with value: 0.20731073795760002 and parameters: {'model_type': 'mlp', 'hidden_dims': '[512, 128]', 'dropout': 0.400312022830536, 'batch_norm': False, 'lr': 4.0209851997545845e-05, 'weight_decay': 0.0007230726108233934, 'epochs': 298, 'loss': 'mse', 'optimizer': 'adam', 'graph_mode': 'off', 'use_snp_selection': True, 'num_snps': 26448}. Best is trial 116 with value: 0.22802374224146837.
[I 2025-12-05 23:02:58,460] Trial 119 finished with value: 0.22291619883621888 and parameters: {'model_type': 'mlp', 'hidden_dims': '[512, 128]', 'dropout': 0.37521622051346953, 'batch_norm': False, 'lr': 7.280023692297226e-05, 'weight_decay': 0.0009462932206168292, 'epochs': 275, 'loss': 'mse', 'optimizer': 'adam', 'graph_mode': 'off', 'use_snp_selection': True, 'num_snps': 20091}. Best is trial 116 with value: 0.22802374224146837.
[I 2025-12-05 23:03:58,218] Trial 120 finished with value: 0.21547293818191288 and parameters: {'model_type': 'mlp', 'hidden_dims': '[512, 128]', 'dropout': 0.3639931170858697, 'batch_norm': False, 'lr': 5.183481269665264e-05, 'weight_decay': 0.0005610160041724355, 'epochs': 285, 'loss': 'mse', 'optimizer': 'adam', 'graph_mode': 'off', 'use_snp_selection': True, 'num_snps': 20357}. Best is trial 116 with value: 0.22802374224146837.
[I 2025-12-05 23:04:52,755] Trial 121 finished with value: 0.21549929289513003 and parameters: {'model_type': 'mlp', 'hidden_dims': '[512, 128]', 'dropout': 0.37967443527948386, 'batch_norm': False, 'lr': 5.971018233425102e-05, 'weight_decay': 0.0009659147425068497, 'epochs': 265, 'loss': 'mse', 'optimizer': 'adam', 'graph_mode': 'off', 'use_snp_selection': True, 'num_snps': 17824}. Best is trial 116 with value: 0.22802374224146837.
[I 2025-12-05 23:05:50,360] Trial 122 finished with value: 0.22386058145714452 and parameters: {'model_type': 'mlp', 'hidden_dims': '[512, 128]', 'dropout': 0.406880078959759, 'batch_norm': False, 'lr': 6.884064792228269e-05, 'weight_decay': 0.0003626521227032401, 'epochs': 273, 'loss': 'mse', 'optimizer': 'adam', 'graph_mode': 'off', 'use_snp_selection': True, 'num_snps': 19896}. Best is trial 116 with value: 0.22802374224146837.
[I 2025-12-05 23:06:52,495] Trial 123 finished with value: 0.21715784291105572 and parameters: {'model_type': 'mlp', 'hidden_dims': '[512, 128]', 'dropout': 0.3373559653863565, 'batch_norm': False, 'lr': 8.07253540342465e-05, 'weight_decay': 0.0003557904297733779, 'epochs': 274, 'loss': 'mse', 'optimizer': 'adam', 'graph_mode': 'off', 'use_snp_selection': True, 'num_snps': 22792}. Best is trial 116 with value: 0.22802374224146837.
[I 2025-12-05 23:07:50,788] Trial 124 finished with value: 0.22371781735288482 and parameters: {'model_type': 'mlp', 'hidden_dims': '[512, 128]', 'dropout': 0.3704094005388741, 'batch_norm': False, 'lr': 0.00010823992375979025, 'weight_decay': 0.00024728484285632067, 'epochs': 275, 'loss': 'mse', 'optimizer': 'adam', 'graph_mode': 'off', 'use_snp_selection': True, 'num_snps': 20260}. Best is trial 116 with value: 0.22802374224146837.
[I 2025-12-05 23:08:56,771] Trial 125 finished with value: 0.21713596627215104 and parameters: {'model_type': 'mlp', 'hidden_dims': '[512, 128]', 'dropout': 0.416204189550225, 'batch_norm': False, 'lr': 7.229874911723412e-05, 'weight_decay': 0.0002420483933204708, 'epochs': 280, 'loss': 'mse', 'optimizer': 'adam', 'graph_mode': 'off', 'use_snp_selection': True, 'num_snps': 25360}. Best is trial 116 with value: 0.22802374224146837.
[I 2025-12-05 23:09:59,249] Trial 126 finished with value: 0.22511239829868224 and parameters: {'model_type': 'mlp', 'hidden_dims': '[512, 128]', 'dropout': 0.3620549606937902, 'batch_norm': False, 'lr': 4.649848980467833e-05, 'weight_decay': 0.0007253906372314785, 'epochs': 324, 'loss': 'mse', 'optimizer': 'adam', 'graph_mode': 'off', 'use_snp_selection': True, 'num_snps': 20222}. Best is trial 116 with value: 0.22802374224146837.
[I 2025-12-05 23:11:01,920] Trial 127 finished with value: 0.22189817584856414 and parameters: {'model_type': 'mlp', 'hidden_dims': '[512, 128]', 'dropout': 0.3634272160141667, 'batch_norm': False, 'lr': 8.52542920557052e-05, 'weight_decay': 0.0007582573060107612, 'epochs': 326, 'loss': 'mae', 'optimizer': 'adam', 'graph_mode': 'off', 'use_snp_selection': True, 'num_snps': 20268}. Best is trial 116 with value: 0.22802374224146837.
[I 2025-12-05 23:12:07,030] Trial 128 finished with value: 0.22336032775659817 and parameters: {'model_type': 'mlp', 'hidden_dims': '[512, 128]', 'dropout': 0.3630027891064818, 'batch_norm': False, 'lr': 7.84324622260226e-05, 'weight_decay': 0.000519236527204484, 'epochs': 325, 'loss': 'mae', 'optimizer': 'adam', 'graph_mode': 'off', 'use_snp_selection': True, 'num_snps': 21877}. Best is trial 116 with value: 0.22802374224146837.
[I 2025-12-05 23:13:23,210] Trial 129 finished with value: 0.21953602624074925 and parameters: {'model_type': 'mlp', 'hidden_dims': '[512, 128]', 'dropout': 0.3612629927630011, 'batch_norm': False, 'lr': 0.0001242331860445053, 'weight_decay': 0.0005201361276585985, 'epochs': 323, 'loss': 'mae', 'optimizer': 'adam', 'graph_mode': 'off', 'use_snp_selection': True, 'num_snps': 28642}. Best is trial 116 with value: 0.22802374224146837.
[I 2025-12-05 23:15:00,985] Trial 130 finished with value: 0.20709173817176368 and parameters: {'model_type': 'mlp', 'hidden_dims': '[512, 128]', 'dropout': 0.36491166748443, 'batch_norm': False, 'lr': 0.0001310083015576782, 'weight_decay': 0.0007928862324849846, 'epochs': 324, 'loss': 'mae', 'optimizer': 'adam', 'graph_mode': 'off', 'use_snp_selection': True, 'num_snps': 41255}. Best is trial 116 with value: 0.22802374224146837.
[I 2025-12-05 23:16:18,079] Trial 131 finished with value: 0.21120525754987543 and parameters: {'model_type': 'mlp', 'hidden_dims': '[512, 128]', 'dropout': 0.405419603413513, 'batch_norm': False, 'lr': 0.00011773705443673384, 'weight_decay': 0.0004952447604129101, 'epochs': 312, 'loss': 'mae', 'optimizer': 'adam', 'graph_mode': 'off', 'use_snp_selection': True, 'num_snps': 30171}. Best is trial 116 with value: 0.22802374224146837.
[I 2025-12-05 23:17:27,994] Trial 132 finished with value: 0.2200896402816305 and parameters: {'model_type': 'mlp', 'hidden_dims': '[512, 128]', 'dropout': 0.38568542017667473, 'batch_norm': False, 'lr': 8.863468815014762e-05, 'weight_decay': 0.0005569842168581579, 'epochs': 344, 'loss': 'mae', 'optimizer': 'adam', 'graph_mode': 'off', 'use_snp_selection': True, 'num_snps': 23566}. Best is trial 116 with value: 0.22802374224146837.
[I 2025-12-05 23:18:34,313] Trial 133 finished with value: 0.22748651754909513 and parameters: {'model_type': 'mlp', 'hidden_dims': '[512, 128]', 'dropout': 0.3839967586039837, 'batch_norm': False, 'lr': 0.0002056367513980784, 'weight_decay': 0.0006084050104996205, 'epochs': 343, 'loss': 'mae', 'optimizer': 'adam', 'graph_mode': 'off', 'use_snp_selection': True, 'num_snps': 21688}. Best is trial 116 with value: 0.22802374224146837.
[I 2025-12-05 23:19:41,257] Trial 134 finished with value: 0.2145146179063314 and parameters: {'model_type': 'mlp', 'hidden_dims': '[512, 128]', 'dropout': 0.3863333351348414, 'batch_norm': False, 'lr': 0.00020192812839297044, 'weight_decay': 0.0005506086973512608, 'epochs': 319, 'loss': 'mae', 'optimizer': 'adam', 'graph_mode': 'off', 'use_snp_selection': True, 'num_snps': 23354}. Best is trial 116 with value: 0.22802374224146837.
[I 2025-12-05 23:20:48,131] Trial 135 finished with value: 0.22228561927701795 and parameters: {'model_type': 'mlp', 'hidden_dims': '[512, 128]', 'dropout': 0.3774932906189123, 'batch_norm': False, 'lr': 8.770854008269967e-05, 'weight_decay': 0.0007472419266208949, 'epochs': 343, 'loss': 'mae', 'optimizer': 'adam', 'graph_mode': 'off', 'use_snp_selection': True, 'num_snps': 21819}. Best is trial 116 with value: 0.22802374224146837.
[I 2025-12-05 23:22:25,653] Trial 136 finished with value: 0.1984107951397605 and parameters: {'model_type': 'mlp', 'hidden_dims': '[512, 128]', 'dropout': 0.37212983619865597, 'batch_norm': False, 'lr': 8.36903121265402e-05, 'weight_decay': 0.0008145816036098884, 'epochs': 341, 'loss': 'mae', 'optimizer': 'adam', 'graph_mode': 'off', 'use_snp_selection': False}. Best is trial 116 with value: 0.22802374224146837.
[I 2025-12-05 23:23:33,086] Trial 137 finished with value: 0.21490163672040152 and parameters: {'model_type': 'mlp', 'hidden_dims': '[512, 128]', 'dropout': 0.4123178519896618, 'batch_norm': False, 'lr': 0.00028796716445101024, 'weight_decay': 0.000638359842750476, 'epochs': 345, 'loss': 'mae', 'optimizer': 'adam', 'graph_mode': 'off', 'use_snp_selection': True, 'num_snps': 21511}. Best is trial 116 with value: 0.22802374224146837.
[I 2025-12-05 23:24:49,049] Trial 138 finished with value: 0.22064907839295939 and parameters: {'model_type': 'mlp', 'hidden_dims': '[512, 128]', 'dropout': 0.4323589264282539, 'batch_norm': False, 'lr': 6.351423112076726e-05, 'weight_decay': 0.00041902919840323765, 'epochs': 328, 'loss': 'mae', 'optimizer': 'adam', 'graph_mode': 'off', 'use_snp_selection': True, 'num_snps': 27667}. Best is trial 116 with value: 0.22802374224146837.
[I 2025-12-05 23:26:11,322] Trial 139 finished with value: 0.21523094009408963 and parameters: {'model_type': 'mlp', 'hidden_dims': '[512, 128]', 'dropout': 0.4448396376853373, 'batch_norm': False, 'lr': 0.00010855459663066868, 'weight_decay': 0.0007525366404840865, 'epochs': 325, 'loss': 'mae', 'optimizer': 'adam', 'graph_mode': 'off', 'use_snp_selection': True, 'num_snps': 32321}. Best is trial 116 with value: 0.22802374224146837.
[I 2025-12-05 23:27:25,855] Trial 140 finished with value: 0.21549536216612913 and parameters: {'model_type': 'mlp', 'hidden_dims': '[512, 128]', 'dropout': 0.35784076885639277, 'batch_norm': False, 'lr': 0.0001770798871724404, 'weight_decay': 1.967443419007919e-07, 'epochs': 331, 'loss': 'mae', 'optimizer': 'adam', 'graph_mode': 'off', 'use_snp_selection': True, 'num_snps': 27600}. Best is trial 116 with value: 0.22802374224146837.
[I 2025-12-05 23:28:40,264] Trial 141 finished with value: 0.22302036302619288 and parameters: {'model_type': 'mlp', 'hidden_dims': '[512, 128]', 'dropout': 0.3833170951504747, 'batch_norm': False, 'lr': 6.439771240457259e-05, 'weight_decay': 0.0004243988967729343, 'epochs': 350, 'loss': 'mae', 'optimizer': 'adam', 'graph_mode': 'off', 'use_snp_selection': True, 'num_snps': 25865}. Best is trial 116 with value: 0.22802374224146837.
[I 2025-12-05 23:29:53,268] Trial 142 finished with value: 0.22074787783167782 and parameters: {'model_type': 'mlp', 'hidden_dims': '[512, 128]', 'dropout': 0.3778226623410544, 'batch_norm': False, 'lr': 6.494942930904555e-05, 'weight_decay': 0.0005705252142209015, 'epochs': 339, 'loss': 'mae', 'optimizer': 'adam', 'graph_mode': 'off', 'use_snp_selection': True, 'num_snps': 25617}. Best is trial 116 with value: 0.22802374224146837.
[I 2025-12-05 23:31:05,086] Trial 143 finished with value: 0.22847575292858102 and parameters: {'model_type': 'mlp', 'hidden_dims': '[512, 128]', 'dropout': 0.3809063733450504, 'batch_norm': False, 'lr': 6.487807594917772e-05, 'weight_decay': 0.0004020209653005288, 'epochs': 338, 'loss': 'mae', 'optimizer': 'adam', 'graph_mode': 'off', 'use_snp_selection': True, 'num_snps': 24926}. Best is trial 143 with value: 0.22847575292858102.
[I 2025-12-05 23:32:17,558] Trial 144 finished with value: 0.21866709042947852 and parameters: {'model_type': 'mlp', 'hidden_dims': '[512, 128]', 'dropout': 0.3760678025696076, 'batch_norm': False, 'lr': 6.856627042456803e-05, 'weight_decay': 0.00036805947869230575, 'epochs': 333, 'loss': 'mae', 'optimizer': 'adam', 'graph_mode': 'off', 'use_snp_selection': True, 'num_snps': 25729}. Best is trial 143 with value: 0.22847575292858102.
[I 2025-12-05 23:33:29,599] Trial 145 finished with value: 0.21716706568882774 and parameters: {'model_type': 'mlp', 'hidden_dims': '[512, 128]', 'dropout': 0.42537215443390647, 'batch_norm': False, 'lr': 6.354457853494769e-05, 'weight_decay': 0.0004252695736976659, 'epochs': 337, 'loss': 'mae', 'optimizer': 'adam', 'graph_mode': 'off', 'use_snp_selection': True, 'num_snps': 25208}. Best is trial 143 with value: 0.22847575292858102.
[I 2025-12-05 23:34:37,624] Trial 146 finished with value: 0.21487786825057897 and parameters: {'model_type': 'mlp', 'hidden_dims': '[512, 128]', 'dropout': 0.3344866695345447, 'batch_norm': False, 'lr': 4.953770990756806e-05, 'weight_decay': 0.0006719701991227394, 'epochs': 349, 'loss': 'mae', 'optimizer': 'adam', 'graph_mode': 'off', 'use_snp_selection': True, 'num_snps': 22071}. Best is trial 143 with value: 0.22847575292858102.
[I 2025-12-05 23:35:45,292] Trial 147 finished with value: 0.2151747811059747 and parameters: {'model_type': 'mlp', 'hidden_dims': '[512, 128]', 'dropout': 0.3950697381898833, 'batch_norm': False, 'lr': 4.536212393968009e-05, 'weight_decay': 0.0008328601661303093, 'epochs': 311, 'loss': 'mae', 'optimizer': 'adam', 'graph_mode': 'off', 'use_snp_selection': True, 'num_snps': 23893}. Best is trial 143 with value: 0.22847575292858102.
[I 2025-12-05 23:37:04,663] Trial 148 finished with value: 0.2037597193360971 and parameters: {'model_type': 'mlp', 'hidden_dims': '[512, 128]', 'dropout': 0.3751620725441928, 'batch_norm': True, 'lr': 9.754888586056923e-05, 'weight_decay': 0.0003000591155911003, 'epochs': 329, 'loss': 'mae', 'optimizer': 'adam', 'graph_mode': 'off', 'use_snp_selection': True, 'num_snps': 29323}. Best is trial 143 with value: 0.22847575292858102.
[I 2025-12-05 23:38:21,808] Trial 149 finished with value: 0.21575959117462157 and parameters: {'model_type': 'mlp', 'hidden_dims': '[512, 128]', 'dropout': 0.4351830679223982, 'batch_norm': False, 'lr': 7.728478213211977e-05, 'weight_decay': 0.00038732214371848574, 'epochs': 338, 'loss': 'mae', 'optimizer': 'adam', 'graph_mode': 'off', 'use_snp_selection': True, 'num_snps': 27739}. Best is trial 143 with value: 0.22847575292858102.
[I 2025-12-05 23:39:24,186] Trial 0 finished with value: 0.21771226850133477 and parameters: {'model_type': 'mlp', 'hidden_dims': '[128, 64]', 'dropout': 0.199031432379812, 'batch_norm': True, 'lr': 1.8408544111075837e-06, 'weight_decay': 5.5136510071208614e-05, 'epochs': 336, 'loss': 'mae', 'optimizer': 'adam', 'graph_mode': 'off', 'use_snp_selection': True, 'num_snps': 43862}. Best is trial 0 with value: 0.21771226850133477.
[I 2025-12-05 23:40:01,039] Trial 1 finished with value: 0.24388105786897105 and parameters: {'model_type': 'mlp', 'hidden_dims': '[256, 128]', 'dropout': 0.4370668075331726, 'batch_norm': True, 'lr': 7.133471581159139e-05, 'weight_decay': 1.128633586803549e-05, 'epochs': 242, 'loss': 'mae', 'optimizer': 'adam', 'graph_mode': 'off', 'use_snp_selection': False}. Best is trial 1 with value: 0.24388105786897105.
[I 2025-12-05 23:40:34,247] Trial 2 finished with value: 0.16824886138502188 and parameters: {'model_type': 'mlp', 'hidden_dims': '[256, 128, 64]', 'dropout': 0.41314357415569625, 'batch_norm': False, 'lr': 3.952233718592101e-06, 'weight_decay': 0.00026754769258252603, 'epochs': 149, 'loss': 'mse', 'optimizer': 'adam', 'graph_mode': 'off', 'use_snp_selection': True, 'num_snps': 11571}. Best is trial 1 with value: 0.24388105786897105.
[I 2025-12-05 23:41:59,297] Trial 3 finished with value: 0.2451249502172085 and parameters: {'model_type': 'mlp', 'hidden_dims': '[512, 64]', 'dropout': 0.5938127374509361, 'batch_norm': False, 'lr': 5.67704586114731e-06, 'weight_decay': 2.4518087630137052e-05, 'epochs': 320, 'loss': 'mae', 'optimizer': 'adam', 'graph_mode': 'off', 'use_snp_selection': False}. Best is trial 3 with value: 0.2451249502172085.
[I 2025-12-05 23:43:15,650] Trial 4 finished with value: 0.19389074757186572 and parameters: {'model_type': 'mlp', 'hidden_dims': '[512, 128]', 'dropout': 0.25746343592134413, 'batch_norm': True, 'lr': 1.3467657668402788e-06, 'weight_decay': 0.00033087251918647806, 'epochs': 277, 'loss': 'mse', 'optimizer': 'adam', 'graph_mode': 'off', 'use_snp_selection': True, 'num_snps': 36675}. Best is trial 3 with value: 0.2451249502172085.
[I 2025-12-05 23:44:09,446] Trial 5 finished with value: 0.1905467447107639 and parameters: {'model_type': 'mlp', 'hidden_dims': '[512, 64]', 'dropout': 0.38275350994408375, 'batch_norm': True, 'lr': 1.5586664309232824e-06, 'weight_decay': 0.0008227664668621182, 'epochs': 145, 'loss': 'mae', 'optimizer': 'adam', 'graph_mode': 'off', 'use_snp_selection': True, 'num_snps': 32148}. Best is trial 3 with value: 0.2451249502172085.
[I 2025-12-05 23:44:40,143] Trial 6 finished with value: 0.23401692728599266 and parameters: {'model_type': 'mlp', 'hidden_dims': '[256, 128]', 'dropout': 0.3930109900265879, 'batch_norm': False, 'lr': 4.892964372128395e-05, 'weight_decay': 1.5809549317992182e-06, 'epochs': 199, 'loss': 'mse', 'optimizer': 'adam', 'graph_mode': 'off', 'use_snp_selection': False}. Best is trial 3 with value: 0.2451249502172085.
[I 2025-12-05 23:45:11,349] Trial 7 finished with value: 0.2319097944015811 and parameters: {'model_type': 'mlp', 'hidden_dims': '[512, 256]', 'dropout': 0.15343979219678458, 'batch_norm': True, 'lr': 6.234003099047341e-05, 'weight_decay': 3.894760610535477e-07, 'epochs': 97, 'loss': 'mse', 'optimizer': 'adam', 'graph_mode': 'off', 'use_snp_selection': False}. Best is trial 3 with value: 0.2451249502172085.
[I 2025-12-05 23:46:35,974] Trial 8 finished with value: 0.23343937227028105 and parameters: {'model_type': 'mlp', 'hidden_dims': '[512, 128]', 'dropout': 0.10743001231661406, 'batch_norm': True, 'lr': 0.00023728538449271062, 'weight_decay': 1.7629071578048637e-05, 'epochs': 312, 'loss': 'mae', 'optimizer': 'adam', 'graph_mode': 'off', 'use_snp_selection': False}. Best is trial 3 with value: 0.2451249502172085.
[I 2025-12-05 23:47:26,505] Trial 9 finished with value: 0.23914956330987236 and parameters: {'model_type': 'mlp', 'hidden_dims': '[512, 64]', 'dropout': 0.14505336736221927, 'batch_norm': True, 'lr': 5.8619638388111826e-05, 'weight_decay': 6.200156172669308e-07, 'epochs': 175, 'loss': 'mse', 'optimizer': 'adam', 'graph_mode': 'off', 'use_snp_selection': False}. Best is trial 3 with value: 0.2451249502172085.
