[I 2025-12-06 11:37:38,809] Trial 74 finished with value: 0.23201992539350327 and parameters: {'model_type': 'mlp', 'hidden_dims': '[256, 128]', 'dropout': 0.48272538606743953, 'batch_norm': True, 'lr': 4.94742601531664e-05, 'weight_decay': 0.0009603204571723303, 'epochs': 40, 'loss': 'mse', 'optimizer': 'adam', 'graph_mode': 'off', 'use_snp_selection': True, 'num_snps': 32708}. Best is trial 54 with value: 0.2542831994125158.
[I 2025-12-06 11:38:25,780] Trial 75 finished with value: 0.23398106408255934 and parameters: {'model_type': 'mlp', 'hidden_dims': '[256, 128]', 'dropout': 0.5717514174703114, 'batch_norm': True, 'lr': 3.4819369091879496e-05, 'weight_decay': 0.0005893910729339292, 'epochs': 59, 'loss': 'mse', 'optimizer': 'adam', 'graph_mode': 'off', 'use_snp_selection': True, 'num_snps': 36930}. Best is trial 54 with value: 0.2542831994125158.
[I 2025-12-06 11:39:07,540] Trial 76 finished with value: 0.22590907944042052 and parameters: {'model_type': 'mlp', 'hidden_dims': '[256, 128]', 'dropout': 0.4366483699191618, 'batch_norm': True, 'lr': 7.389940680287701e-05, 'weight_decay': 0.00035652618862461714, 'epochs': 101, 'loss': 'mse', 'optimizer': 'adam', 'graph_mode': 'off', 'use_snp_selection': True, 'num_snps': 21568}. Best is trial 54 with value: 0.2542831994125158.
[I 2025-12-06 11:39:47,925] Trial 77 finished with value: 0.19969159739232173 and parameters: {'model_type': 'mlp', 'hidden_dims': '[128, 64]', 'dropout': 0.5526050415393637, 'batch_norm': True, 'lr': 2.27253113614887e-05, 'weight_decay': 5.767992881595128e-05, 'epochs': 86, 'loss': 'mse', 'optimizer': 'adam', 'graph_mode': 'off', 'use_snp_selection': True, 'num_snps': 24996}. Best is trial 54 with value: 0.2542831994125158.
[I 2025-12-06 11:40:34,459] Trial 78 finished with value: 0.21305471699952522 and parameters: {'model_type': 'mlp', 'hidden_dims': '[512, 128]', 'dropout': 0.45668948909107726, 'batch_norm': True, 'lr': 1.2121747603540533e-05, 'weight_decay': 1.839527573498888e-05, 'epochs': 55, 'loss': 'mse', 'optimizer': 'adam', 'graph_mode': 'off', 'use_snp_selection': True, 'num_snps': 29196}. Best is trial 54 with value: 0.2542831994125158.
[I 2025-12-06 11:41:12,321] Trial 79 finished with value: 0.2257484420185035 and parameters: {'model_type': 'mlp', 'hidden_dims': '[256, 128]', 'dropout': 0.5030748817456302, 'batch_norm': True, 'lr': 5.13357683008419e-05, 'weight_decay': 0.00010034759950744613, 'epochs': 78, 'loss': 'mse', 'optimizer': 'adam', 'graph_mode': 'off', 'use_snp_selection': True, 'num_snps': 16464}. Best is trial 54 with value: 0.2542831994125158.
[I 2025-12-06 11:41:56,596] Trial 80 finished with value: 0.23216707805495423 and parameters: {'model_type': 'mlp', 'hidden_dims': '[256, 128]', 'dropout': 0.5237574161933836, 'batch_norm': True, 'lr': 0.00012180981070697376, 'weight_decay': 3.5613669189392084e-05, 'epochs': 95, 'loss': 'mse', 'optimizer': 'adam', 'graph_mode': 'off', 'use_snp_selection': True, 'num_snps': 26786}. Best is trial 54 with value: 0.2542831994125158.
[I 2025-12-06 11:42:39,164] Trial 81 finished with value: 0.2465644243779801 and parameters: {'model_type': 'mlp', 'hidden_dims': '[256, 128]', 'dropout': 0.5070688566390977, 'batch_norm': False, 'lr': 6.62261576538347e-05, 'weight_decay': 0.0007679297902990943, 'epochs': 62, 'loss': 'mse', 'optimizer': 'adam', 'graph_mode': 'off', 'use_snp_selection': True, 'num_snps': 27652}. Best is trial 54 with value: 0.2542831994125158.
[I 2025-12-06 11:43:10,896] Trial 82 finished with value: 0.20441006081193502 and parameters: {'model_type': 'mlp', 'hidden_dims': '[256, 128]', 'dropout': 0.5124456796841764, 'batch_norm': False, 'lr': 6.762213703907945e-05, 'weight_decay': 0.0007691446935861807, 'epochs': 63, 'loss': 'mse', 'optimizer': 'adam', 'graph_mode': 'off', 'use_snp_selection': True, 'num_snps': 5270}. Best is trial 54 with value: 0.2542831994125158.
[I 2025-12-06 11:43:50,968] Trial 83 finished with value: 0.24292908104626773 and parameters: {'model_type': 'mlp', 'hidden_dims': '[256, 128]', 'dropout': 0.48684137139896005, 'batch_norm': False, 'lr': 9.75734881107873e-05, 'weight_decay': 0.00025243470775461246, 'epochs': 50, 'loss': 'mse', 'optimizer': 'adam', 'graph_mode': 'off', 'use_snp_selection': True, 'num_snps': 23786}. Best is trial 54 with value: 0.2542831994125158.
[I 2025-12-06 11:44:35,339] Trial 84 finished with value: 0.2464727908174352 and parameters: {'model_type': 'mlp', 'hidden_dims': '[256, 128]', 'dropout': 0.5461624785572283, 'batch_norm': False, 'lr': 3.717406077497011e-05, 'weight_decay': 0.000546217781691489, 'epochs': 65, 'loss': 'mse', 'optimizer': 'adam', 'graph_mode': 'off', 'use_snp_selection': True, 'num_snps': 31029}. Best is trial 54 with value: 0.2542831994125158.
[I 2025-12-06 11:45:24,626] Trial 85 finished with value: 0.2414088018879094 and parameters: {'model_type': 'mlp', 'hidden_dims': '[512, 256]', 'dropout': 0.5446484650242825, 'batch_norm': False, 'lr': 0.00019716051765030653, 'weight_decay': 0.0005597711377350175, 'epochs': 71, 'loss': 'mse', 'optimizer': 'adam', 'graph_mode': 'off', 'use_snp_selection': True, 'num_snps': 30835}. Best is trial 54 with value: 0.2542831994125158.
[I 2025-12-06 11:46:04,153] Trial 86 finished with value: 0.23852443059917658 and parameters: {'model_type': 'mlp', 'hidden_dims': '[256, 128]', 'dropout': 0.590703937592704, 'batch_norm': False, 'lr': 3.846039351748935e-05, 'weight_decay': 0.00041240871045811125, 'epochs': 82, 'loss': 'mse', 'optimizer': 'adam', 'graph_mode': 'off', 'use_snp_selection': True, 'num_snps': 19583}. Best is trial 54 with value: 0.2542831994125158.
[I 2025-12-06 11:46:51,075] Trial 87 finished with value: 0.23984324783232838 and parameters: {'model_type': 'mlp', 'hidden_dims': '[256, 128]', 'dropout': 0.5350662913989049, 'batch_norm': False, 'lr': 2.618810402397708e-05, 'weight_decay': 0.00023241342212735924, 'epochs': 64, 'loss': 'mse', 'optimizer': 'adam', 'graph_mode': 'off', 'use_snp_selection': True, 'num_snps': 35941}. Best is trial 54 with value: 0.2542831994125158.
[I 2025-12-06 11:47:34,867] Trial 88 finished with value: 0.2397195673549209 and parameters: {'model_type': 'mlp', 'hidden_dims': '[256, 128]', 'dropout': 0.10771757649952818, 'batch_norm': False, 'lr': 8.552658715274008e-05, 'weight_decay': 0.0007729165090657246, 'epochs': 103, 'loss': 'mse', 'optimizer': 'adam', 'graph_mode': 'off', 'use_snp_selection': True, 'num_snps': 25442}. Best is trial 54 with value: 0.2542831994125158.
[I 2025-12-06 11:48:50,097] Trial 89 finished with value: 0.23881661259414058 and parameters: {'model_type': 'mlp', 'hidden_dims': '[512, 128]', 'dropout': 0.5641906352193236, 'batch_norm': False, 'lr': 6.236876251896348e-05, 'weight_decay': 0.0003397724776346856, 'epochs': 298, 'loss': 'mse', 'optimizer': 'adam', 'graph_mode': 'off', 'use_snp_selection': True, 'num_snps': 29063}. Best is trial 54 with value: 0.2542831994125158.
[I 2025-12-06 11:49:33,435] Trial 90 finished with value: 0.22638427753973978 and parameters: {'model_type': 'mlp', 'hidden_dims': '[256, 128]', 'dropout': 0.4919493368649668, 'batch_norm': False, 'lr': 3.302391015138069e-05, 'weight_decay': 0.000150893321441076, 'epochs': 40, 'loss': 'mse', 'optimizer': 'adam', 'graph_mode': 'off', 'use_snp_selection': True, 'num_snps': 32278}. Best is trial 54 with value: 0.2542831994125158.
[I 2025-12-06 11:50:15,193] Trial 91 finished with value: 0.24855051751340224 and parameters: {'model_type': 'mlp', 'hidden_dims': '[256, 128]', 'dropout': 0.46659234287666124, 'batch_norm': False, 'lr': 4.724983699549205e-05, 'weight_decay': 0.0009051763339750596, 'epochs': 53, 'loss': 'mse', 'optimizer': 'adam', 'graph_mode': 'off', 'use_snp_selection': True, 'num_snps': 27112}. Best is trial 54 with value: 0.2542831994125158.
[I 2025-12-06 11:50:55,144] Trial 92 finished with value: 0.24083987765814494 and parameters: {'model_type': 'mlp', 'hidden_dims': '[256, 128]', 'dropout': 0.4698080345861014, 'batch_norm': False, 'lr': 4.433480434576634e-05, 'weight_decay': 0.0005846110087011533, 'epochs': 47, 'loss': 'mse', 'optimizer': 'adam', 'graph_mode': 'off', 'use_snp_selection': True, 'num_snps': 23832}. Best is trial 54 with value: 0.2542831994125158.
[I 2025-12-06 11:51:35,892] Trial 93 finished with value: 0.24342855498506943 and parameters: {'model_type': 'mlp', 'hidden_dims': '[128, 64]', 'dropout': 0.42847673958399995, 'batch_norm': False, 'lr': 5.432055373857916e-05, 'weight_decay': 5.334356718762047e-06, 'epochs': 75, 'loss': 'mse', 'optimizer': 'adam', 'graph_mode': 'off', 'use_snp_selection': True, 'num_snps': 26896}. Best is trial 54 with value: 0.2542831994125158.
[I 2025-12-06 11:52:23,191] Trial 94 finished with value: 0.2483376066875055 and parameters: {'model_type': 'mlp', 'hidden_dims': '[256, 128]', 'dropout': 0.45242426965480786, 'batch_norm': False, 'lr': 1.9775525992151886e-05, 'weight_decay': 1.0787642866715721e-05, 'epochs': 222, 'loss': 'mse', 'optimizer': 'adam', 'graph_mode': 'off', 'use_snp_selection': True, 'num_snps': 21086}. Best is trial 54 with value: 0.2542831994125158.
[I 2025-12-06 11:53:09,275] Trial 95 finished with value: 0.25300180573168096 and parameters: {'model_type': 'mlp', 'hidden_dims': '[256, 128]', 'dropout': 0.4597358411360224, 'batch_norm': False, 'lr': 1.7163505980546054e-05, 'weight_decay': 1.026839262593657e-05, 'epochs': 220, 'loss': 'mse', 'optimizer': 'adam', 'graph_mode': 'off', 'use_snp_selection': True, 'num_snps': 20547}. Best is trial 54 with value: 0.2542831994125158.
[I 2025-12-06 11:53:56,238] Trial 96 finished with value: 0.2497060210024153 and parameters: {'model_type': 'mlp', 'hidden_dims': '[256, 128]', 'dropout': 0.4488425242655444, 'batch_norm': False, 'lr': 1.591936831386336e-05, 'weight_decay': 1.1604849694328511e-05, 'epochs': 218, 'loss': 'mse', 'optimizer': 'adam', 'graph_mode': 'off', 'use_snp_selection': True, 'num_snps': 21113}. Best is trial 54 with value: 0.2542831994125158.
[I 2025-12-06 11:54:52,662] Trial 97 finished with value: 0.2506297001947854 and parameters: {'model_type': 'mlp', 'hidden_dims': '[512, 64]', 'dropout': 0.4492203451603256, 'batch_norm': False, 'lr': 1.1327213175795457e-05, 'weight_decay': 1.0866068171792503e-05, 'epochs': 223, 'loss': 'mse', 'optimizer': 'adam', 'graph_mode': 'off', 'use_snp_selection': True, 'num_snps': 21153}. Best is trial 54 with value: 0.2542831994125158.
[I 2025-12-06 11:55:49,060] Trial 98 finished with value: 0.2521750731247485 and parameters: {'model_type': 'mlp', 'hidden_dims': '[512, 64]', 'dropout': 0.4528269096818151, 'batch_norm': False, 'lr': 9.790408910155778e-06, 'weight_decay': 1.4246448904655056e-05, 'epochs': 224, 'loss': 'mse', 'optimizer': 'adam', 'graph_mode': 'off', 'use_snp_selection': True, 'num_snps': 21034}. Best is trial 54 with value: 0.2542831994125158.
[I 2025-12-06 11:56:46,095] Trial 99 finished with value: 0.25455247568150546 and parameters: {'model_type': 'mlp', 'hidden_dims': '[512, 64]', 'dropout': 0.4476121104000729, 'batch_norm': False, 'lr': 1.1406599786851621e-05, 'weight_decay': 1.4415752681726501e-05, 'epochs': 226, 'loss': 'mse', 'optimizer': 'adam', 'graph_mode': 'off', 'use_snp_selection': True, 'num_snps': 20965}. Best is trial 99 with value: 0.25455247568150546.
[I 2025-12-06 11:57:32,551] Trial 100 finished with value: 0.2413400179865508 and parameters: {'model_type': 'mlp', 'hidden_dims': '[512, 64]', 'dropout': 0.4468943481363866, 'batch_norm': False, 'lr': 1.0062467620175302e-05, 'weight_decay': 1.0803079680632086e-05, 'epochs': 222, 'loss': 'mse', 'optimizer': 'adam', 'graph_mode': 'off', 'use_snp_selection': True, 'num_snps': 13685}. Best is trial 99 with value: 0.25455247568150546.
[I 2025-12-06 11:58:31,158] Trial 101 finished with value: 0.25297851823583717 and parameters: {'model_type': 'mlp', 'hidden_dims': '[512, 64]', 'dropout': 0.4199190260679115, 'batch_norm': False, 'lr': 6.470070127346348e-06, 'weight_decay': 1.4164256737056555e-05, 'epochs': 250, 'loss': 'mse', 'optimizer': 'adam', 'graph_mode': 'off', 'use_snp_selection': True, 'num_snps': 20859}. Best is trial 99 with value: 0.25455247568150546.
[I 2025-12-06 11:59:27,774] Trial 102 finished with value: 0.25176123320678306 and parameters: {'model_type': 'mlp', 'hidden_dims': '[512, 64]', 'dropout': 0.4163779679165197, 'batch_norm': False, 'lr': 6.292448467289467e-06, 'weight_decay': 1.4437114957835859e-05, 'epochs': 243, 'loss': 'mse', 'optimizer': 'adam', 'graph_mode': 'off', 'use_snp_selection': True, 'num_snps': 20303}. Best is trial 99 with value: 0.25455247568150546.
[I 2025-12-06 12:00:23,063] Trial 103 finished with value: 0.24720907894544406 and parameters: {'model_type': 'mlp', 'hidden_dims': '[512, 64]', 'dropout': 0.41619319625342566, 'batch_norm': False, 'lr': 5.939054832506987e-06, 'weight_decay': 1.4390118178131389e-05, 'epochs': 260, 'loss': 'mse', 'optimizer': 'adam', 'graph_mode': 'off', 'use_snp_selection': True, 'num_snps': 18218}. Best is trial 99 with value: 0.25455247568150546.
[I 2025-12-06 12:01:15,083] Trial 104 finished with value: 0.24506735050208256 and parameters: {'model_type': 'mlp', 'hidden_dims': '[512, 64]', 'dropout': 0.4325224478765201, 'batch_norm': False, 'lr': 4.691008733791477e-06, 'weight_decay': 2.361778119812586e-05, 'epochs': 248, 'loss': 'mse', 'optimizer': 'adam', 'graph_mode': 'off', 'use_snp_selection': True, 'num_snps': 16438}. Best is trial 99 with value: 0.25455247568150546.
[I 2025-12-06 12:02:07,857] Trial 105 finished with value: 0.24124185408142287 and parameters: {'model_type': 'mlp', 'hidden_dims': '[512, 64]', 'dropout': 0.44352415917600274, 'batch_norm': False, 'lr': 8.205533603014078e-06, 'weight_decay': 1.670062494368281e-05, 'epochs': 193, 'loss': 'mse', 'optimizer': 'adam', 'graph_mode': 'off', 'use_snp_selection': True, 'num_snps': 20513}. Best is trial 99 with value: 0.25455247568150546.
[I 2025-12-06 12:03:07,450] Trial 106 finished with value: 0.2507617091866482 and parameters: {'model_type': 'mlp', 'hidden_dims': '[512, 64]', 'dropout': 0.425876701935673, 'batch_norm': False, 'lr': 1.0245475397233614e-05, 'weight_decay': 3.148035872676838e-05, 'epochs': 232, 'loss': 'mse', 'optimizer': 'adam', 'graph_mode': 'off', 'use_snp_selection': True, 'num_snps': 22676}. Best is trial 99 with value: 0.25455247568150546.
[I 2025-12-06 12:04:01,023] Trial 107 finished with value: 0.23791337886122857 and parameters: {'model_type': 'mlp', 'hidden_dims': '[512, 64]', 'dropout': 0.4205734334576854, 'batch_norm': False, 'lr': 7.371014583319776e-06, 'weight_decay': 3.1592673737736586e-05, 'epochs': 239, 'loss': 'mse', 'optimizer': 'adam', 'graph_mode': 'off', 'use_snp_selection': True, 'num_snps': 17865}. Best is trial 99 with value: 0.25455247568150546.
[I 2025-12-06 12:04:58,538] Trial 108 finished with value: 0.24367692374714137 and parameters: {'model_type': 'mlp', 'hidden_dims': '[512, 64]', 'dropout': 0.4076705276109296, 'batch_norm': False, 'lr': 1.2095517912006569e-05, 'weight_decay': 2.1011771331390126e-05, 'epochs': 213, 'loss': 'mse', 'optimizer': 'adam', 'graph_mode': 'off', 'use_snp_selection': True, 'num_snps': 22589}. Best is trial 99 with value: 0.25455247568150546.
[I 2025-12-06 12:05:55,152] Trial 109 finished with value: 0.24800909322885442 and parameters: {'model_type': 'mlp', 'hidden_dims': '[512, 64]', 'dropout': 0.4571525785564011, 'batch_norm': False, 'lr': 1.5452738298936446e-05, 'weight_decay': 1.4537490041731831e-05, 'epochs': 253, 'loss': 'mse', 'optimizer': 'adam', 'graph_mode': 'off', 'use_snp_selection': True, 'num_snps': 19108}. Best is trial 99 with value: 0.25455247568150546.
[I 2025-12-06 12:06:54,888] Trial 110 finished with value: 0.2522685773831802 and parameters: {'model_type': 'mlp', 'hidden_dims': '[512, 64]', 'dropout': 0.36197740092106867, 'batch_norm': False, 'lr': 6.959676112994924e-06, 'weight_decay': 8.664137052929842e-06, 'epochs': 232, 'loss': 'mse', 'optimizer': 'adam', 'graph_mode': 'off', 'use_snp_selection': True, 'num_snps': 22972}. Best is trial 99 with value: 0.25455247568150546.
[I 2025-12-06 12:07:54,880] Trial 111 finished with value: 0.24961473356568345 and parameters: {'model_type': 'mlp', 'hidden_dims': '[512, 64]', 'dropout': 0.3870768425523573, 'batch_norm': False, 'lr': 1.0339403021725661e-05, 'weight_decay': 9.672028029135822e-06, 'epochs': 232, 'loss': 'mse', 'optimizer': 'adam', 'graph_mode': 'off', 'use_snp_selection': True, 'num_snps': 23264}. Best is trial 99 with value: 0.25455247568150546.
[I 2025-12-06 12:08:54,702] Trial 112 finished with value: 0.23815131217138089 and parameters: {'model_type': 'mlp', 'hidden_dims': '[512, 64]', 'dropout': 0.39135313428370905, 'batch_norm': False, 'lr': 9.701705649148649e-06, 'weight_decay': 9.109538080812688e-06, 'epochs': 234, 'loss': 'mse', 'optimizer': 'adam', 'graph_mode': 'off', 'use_snp_selection': True, 'num_snps': 22812}. Best is trial 99 with value: 0.25455247568150546.
[I 2025-12-06 12:09:51,541] Trial 113 finished with value: 0.24974208701240624 and parameters: {'model_type': 'mlp', 'hidden_dims': '[512, 64]', 'dropout': 0.3641718666020321, 'batch_norm': False, 'lr': 6.669381993081985e-06, 'weight_decay': 6.226395467969273e-06, 'epochs': 222, 'loss': 'mse', 'optimizer': 'adam', 'graph_mode': 'off', 'use_snp_selection': True, 'num_snps': 21093}. Best is trial 99 with value: 0.25455247568150546.
[I 2025-12-06 12:10:52,832] Trial 114 finished with value: 0.2595925061824989 and parameters: {'model_type': 'mlp', 'hidden_dims': '[512, 64]', 'dropout': 0.3543608660602513, 'batch_norm': False, 'lr': 6.800967423576188e-06, 'weight_decay': 6.7962531291022066e-06, 'epochs': 272, 'loss': 'mse', 'optimizer': 'adam', 'graph_mode': 'off', 'use_snp_selection': True, 'num_snps': 20966}. Best is trial 114 with value: 0.2595925061824989.
[I 2025-12-06 12:11:46,663] Trial 115 finished with value: 0.24248457171305074 and parameters: {'model_type': 'mlp', 'hidden_dims': '[512, 64]', 'dropout': 0.3643775159277186, 'batch_norm': False, 'lr': 4.936211523385021e-06, 'weight_decay': 5.7476409967659565e-06, 'epochs': 275, 'loss': 'mse', 'optimizer': 'adam', 'graph_mode': 'off', 'use_snp_selection': True, 'num_snps': 16289}. Best is trial 114 with value: 0.2595925061824989.
[I 2025-12-06 12:12:45,130] Trial 116 finished with value: 0.24605788821906155 and parameters: {'model_type': 'mlp', 'hidden_dims': '[512, 64]', 'dropout': 0.31818978522380065, 'batch_norm': False, 'lr': 3.003093123196549e-06, 'weight_decay': 4.44380381778375e-06, 'epochs': 272, 'loss': 'mse', 'optimizer': 'adam', 'graph_mode': 'off', 'use_snp_selection': True, 'num_snps': 19204}. Best is trial 114 with value: 0.2595925061824989.
[I 2025-12-06 12:13:43,716] Trial 117 finished with value: 0.2506764644647429 and parameters: {'model_type': 'mlp', 'hidden_dims': '[512, 64]', 'dropout': 0.3614348422918911, 'batch_norm': False, 'lr': 7.281280892284805e-06, 'weight_decay': 7.450098333659162e-06, 'epochs': 199, 'loss': 'mse', 'optimizer': 'adam', 'graph_mode': 'off', 'use_snp_selection': True, 'num_snps': 24645}. Best is trial 114 with value: 0.2595925061824989.
[I 2025-12-06 12:14:43,054] Trial 118 finished with value: 0.24239515443206955 and parameters: {'model_type': 'mlp', 'hidden_dims': '[512, 64]', 'dropout': 0.3353872641585143, 'batch_norm': False, 'lr': 4.469161253121102e-06, 'weight_decay': 2.929490310956685e-05, 'epochs': 201, 'loss': 'mse', 'optimizer': 'adam', 'graph_mode': 'off', 'use_snp_selection': True, 'num_snps': 24602}. Best is trial 114 with value: 0.2595925061824989.
[I 2025-12-06 12:15:29,262] Trial 119 finished with value: 0.24035673798890267 and parameters: {'model_type': 'mlp', 'hidden_dims': '[512, 64]', 'dropout': 0.2934318311804557, 'batch_norm': False, 'lr': 3.819468745439054e-06, 'weight_decay': 7.45185014260619e-06, 'epochs': 191, 'loss': 'mse', 'optimizer': 'adam', 'graph_mode': 'off', 'use_snp_selection': True, 'num_snps': 14776}. Best is trial 114 with value: 0.2595925061824989.
[I 2025-12-06 12:16:25,409] Trial 120 finished with value: 0.25102071515490787 and parameters: {'model_type': 'mlp', 'hidden_dims': '[512, 64]', 'dropout': 0.3746035688825488, 'batch_norm': False, 'lr': 1.2177645975507281e-05, 'weight_decay': 1.5736470133671447e-05, 'epochs': 209, 'loss': 'mse', 'optimizer': 'adam', 'graph_mode': 'off', 'use_snp_selection': True, 'num_snps': 22244}. Best is trial 114 with value: 0.2595925061824989.
[I 2025-12-06 12:17:21,046] Trial 121 finished with value: 0.24368674852127245 and parameters: {'model_type': 'mlp', 'hidden_dims': '[512, 64]', 'dropout': 0.3374318777086037, 'batch_norm': False, 'lr': 1.348621421543528e-05, 'weight_decay': 1.5480217840323143e-05, 'epochs': 206, 'loss': 'mse', 'optimizer': 'adam', 'graph_mode': 'off', 'use_snp_selection': True, 'num_snps': 22226}. Best is trial 114 with value: 0.2595925061824989.
[I 2025-12-06 12:18:14,902] Trial 122 finished with value: 0.23959398348152475 and parameters: {'model_type': 'mlp', 'hidden_dims': '[512, 64]', 'dropout': 0.35707612233976915, 'batch_norm': False, 'lr': 6.833393624236557e-06, 'weight_decay': 1.9962399084773213e-05, 'epochs': 211, 'loss': 'mse', 'optimizer': 'adam', 'graph_mode': 'off', 'use_snp_selection': True, 'num_snps': 20006}. Best is trial 114 with value: 0.2595925061824989.
[I 2025-12-06 12:19:17,029] Trial 123 finished with value: 0.24304411766977427 and parameters: {'model_type': 'mlp', 'hidden_dims': '[512, 64]', 'dropout': 0.3710003818490832, 'batch_norm': False, 'lr': 8.968659180439884e-06, 'weight_decay': 1.265480674609531e-05, 'epochs': 251, 'loss': 'mse', 'optimizer': 'adam', 'graph_mode': 'off', 'use_snp_selection': True, 'num_snps': 24118}. Best is trial 114 with value: 0.2595925061824989.
