[I 2025-12-05 16:14:11,499] Trial 69 finished with value: 0.07659391951158835 and parameters: {'model_type': 'mlp', 'hidden_dims': '[128, 64]', 'dropout': 0.4125520245066144, 'batch_norm': False, 'lr': 0.00036681869056255683, 'weight_decay': 1.0307695510216435e-07, 'epochs': 283, 'loss': 'mae', 'optimizer': 'adam', 'graph_mode': 'off', 'use_snp_selection': True, 'num_snps': 37579}. Best is trial 59 with value: 0.11155179944425214.
[I 2025-12-05 16:14:13,430] Trial 70 finished with value: 0.08961774862489527 and parameters: {'model_type': 'mlp', 'hidden_dims': '[128, 64]', 'dropout': 0.21632608981641796, 'batch_norm': True, 'lr': 0.0008282259310813955, 'weight_decay': 8.669617360392454e-07, 'epochs': 299, 'loss': 'mae', 'optimizer': 'adam', 'graph_mode': 'off', 'use_snp_selection': True, 'num_snps': 30008}. Best is trial 59 with value: 0.11155179944425214.
[I 2025-12-05 16:14:15,831] Trial 71 finished with value: 0.1022749686022271 and parameters: {'model_type': 'mlp', 'hidden_dims': '[128, 64]', 'dropout': 0.24113188996363108, 'batch_norm': True, 'lr': 0.000644798371242267, 'weight_decay': 4.50306084182913e-07, 'epochs': 258, 'loss': 'mae', 'optimizer': 'adam', 'graph_mode': 'off', 'use_snp_selection': True, 'num_snps': 50200}. Best is trial 59 with value: 0.11155179944425214.
[I 2025-12-05 16:14:18,123] Trial 72 finished with value: 0.1069006881560732 and parameters: {'model_type': 'mlp', 'hidden_dims': '[128, 64]', 'dropout': 0.20398162001511078, 'batch_norm': True, 'lr': 0.0006108578790074857, 'weight_decay': 1.2859137249215573e-06, 'epochs': 334, 'loss': 'mae', 'optimizer': 'adam', 'graph_mode': 'off', 'use_snp_selection': True, 'num_snps': 42880}. Best is trial 59 with value: 0.11155179944425214.
[I 2025-12-05 16:14:21,727] Trial 73 finished with value: 0.0878640711769478 and parameters: {'model_type': 'mlp', 'hidden_dims': '[512, 256]', 'dropout': 0.27008986300367244, 'batch_norm': True, 'lr': 0.0005044950771203615, 'weight_decay': 8.027914897429559e-07, 'epochs': 309, 'loss': 'mae', 'optimizer': 'adam', 'graph_mode': 'off', 'use_snp_selection': True, 'num_snps': 52908}. Best is trial 59 with value: 0.11155179944425214.
[I 2025-12-05 16:14:22,699] Trial 74 finished with value: 0.08459367638154766 and parameters: {'model_type': 'mlp', 'hidden_dims': '[128, 64]', 'dropout': 0.15532079968143914, 'batch_norm': True, 'lr': 0.0007970441009444545, 'weight_decay': 1.8166778342040887e-06, 'epochs': 282, 'loss': 'mse', 'optimizer': 'adam', 'graph_mode': 'off', 'use_snp_selection': False}. Best is trial 59 with value: 0.11155179944425214.
[I 2025-12-05 16:14:24,002] Trial 75 finished with value: 0.10074529223739534 and parameters: {'model_type': 'mlp', 'hidden_dims': '[256, 128, 64]', 'dropout': 0.13741564945633167, 'batch_norm': True, 'lr': 0.00047272552432137013, 'weight_decay': 2.1801631086505789e-07, 'epochs': 250, 'loss': 'mae', 'optimizer': 'adam', 'graph_mode': 'off', 'use_snp_selection': False}. Best is trial 59 with value: 0.11155179944425214.
[I 2025-12-05 16:14:27,075] Trial 76 finished with value: 0.07970241227929549 and parameters: {'model_type': 'mlp', 'hidden_dims': '[512, 128]', 'dropout': 0.17400201906969665, 'batch_norm': True, 'lr': 0.00032209342003904805, 'weight_decay': 0.0001849748836171605, 'epochs': 292, 'loss': 'mse', 'optimizer': 'adam', 'graph_mode': 'off', 'use_snp_selection': True, 'num_snps': 40430}. Best is trial 59 with value: 0.11155179944425214.
[I 2025-12-05 16:14:28,002] Trial 77 finished with value: 0.0997264655594238 and parameters: {'model_type': 'mlp', 'hidden_dims': '[128, 64]', 'dropout': 0.5491566274466353, 'batch_norm': True, 'lr': 0.00024269495540322494, 'weight_decay': 3.4828584179451405e-07, 'epochs': 218, 'loss': 'mae', 'optimizer': 'adam', 'graph_mode': 'off', 'use_snp_selection': False}. Best is trial 59 with value: 0.11155179944425214.
[I 2025-12-05 16:14:30,285] Trial 78 finished with value: 0.09362032688045081 and parameters: {'model_type': 'mlp', 'hidden_dims': '[512, 64]', 'dropout': 0.11286623353142967, 'batch_norm': True, 'lr': 0.000862682255208109, 'weight_decay': 1.5255280307048116e-07, 'epochs': 266, 'loss': 'mse', 'optimizer': 'adam', 'graph_mode': 'off', 'use_snp_selection': False}. Best is trial 59 with value: 0.11155179944425214.
[I 2025-12-05 16:14:32,337] Trial 79 finished with value: 0.12154521220053922 and parameters: {'model_type': 'mlp', 'hidden_dims': '[512, 256]', 'dropout': 0.1890791661811454, 'batch_norm': True, 'lr': 0.0006527096190686739, 'weight_decay': 5.663500362472442e-07, 'epochs': 232, 'loss': 'mae', 'optimizer': 'adam', 'graph_mode': 'off', 'use_snp_selection': False}. Best is trial 79 with value: 0.12154521220053922.
[I 2025-12-05 16:14:34,372] Trial 80 finished with value: 0.07928238958597456 and parameters: {'model_type': 'mlp', 'hidden_dims': '[512, 128]', 'dropout': 0.12833812158349991, 'batch_norm': False, 'lr': 5.058151880523421e-05, 'weight_decay': 6.121448776161401e-07, 'epochs': 234, 'loss': 'mae', 'optimizer': 'adam', 'graph_mode': 'off', 'use_snp_selection': False}. Best is trial 79 with value: 0.12154521220053922.
[I 2025-12-05 16:14:36,261] Trial 81 finished with value: 0.08876693260845163 and parameters: {'model_type': 'mlp', 'hidden_dims': '[512, 256]', 'dropout': 0.1932553630958731, 'batch_norm': True, 'lr': 0.0006952644025007832, 'weight_decay': 5.22097065235413e-07, 'epochs': 205, 'loss': 'mae', 'optimizer': 'adam', 'graph_mode': 'off', 'use_snp_selection': False}. Best is trial 79 with value: 0.12154521220053922.
[I 2025-12-05 16:14:37,947] Trial 82 finished with value: 0.09838327258029625 and parameters: {'model_type': 'mlp', 'hidden_dims': '[512, 256]', 'dropout': 0.22954591138390198, 'batch_norm': True, 'lr': 0.0009914138432430058, 'weight_decay': 9.236201324343904e-07, 'epochs': 169, 'loss': 'mae', 'optimizer': 'adam', 'graph_mode': 'off', 'use_snp_selection': False}. Best is trial 79 with value: 0.12154521220053922.
[I 2025-12-05 16:14:39,718] Trial 83 finished with value: 0.10546877584991325 and parameters: {'model_type': 'mlp', 'hidden_dims': '[512, 256]', 'dropout': 0.16349589933778555, 'batch_norm': True, 'lr': 0.0005537198511225919, 'weight_decay': 1.1949275728670827e-06, 'epochs': 184, 'loss': 'mae', 'optimizer': 'adam', 'graph_mode': 'off', 'use_snp_selection': False}. Best is trial 79 with value: 0.12154521220053922.
[I 2025-12-05 16:14:41,820] Trial 84 finished with value: 0.10401043369588882 and parameters: {'model_type': 'mlp', 'hidden_dims': '[512, 256]', 'dropout': 0.2042629209457197, 'batch_norm': True, 'lr': 0.0006914546966308618, 'weight_decay': 2.534165602217735e-07, 'epochs': 242, 'loss': 'mae', 'optimizer': 'adam', 'graph_mode': 'off', 'use_snp_selection': False}. Best is trial 79 with value: 0.12154521220053922.
[I 2025-12-05 16:14:43,231] Trial 85 finished with value: 0.09805724850496864 and parameters: {'model_type': 'mlp', 'hidden_dims': '[256, 128]', 'dropout': 0.29750961801371806, 'batch_norm': True, 'lr': 0.0004499118784603325, 'weight_decay': 2.6130679257763506e-06, 'epochs': 277, 'loss': 'mse', 'optimizer': 'adam', 'graph_mode': 'off', 'use_snp_selection': False}. Best is trial 79 with value: 0.12154521220053922.
[I 2025-12-05 16:14:45,614] Trial 86 finished with value: 0.0946108897429732 and parameters: {'model_type': 'mlp', 'hidden_dims': '[512, 256]', 'dropout': 0.1313665627718418, 'batch_norm': True, 'lr': 0.0008476473580248239, 'weight_decay': 3.9394777356837443e-07, 'epochs': 228, 'loss': 'mae', 'optimizer': 'adam', 'graph_mode': 'off', 'use_snp_selection': True, 'num_snps': 33483}. Best is trial 79 with value: 0.12154521220053922.
[I 2025-12-05 16:14:46,505] Trial 87 finished with value: 0.007323312635017672 and parameters: {'model_type': 'mlp', 'hidden_dims': '[128, 64]', 'dropout': 0.1825581379914819, 'batch_norm': True, 'lr': 1.1664965422250752e-06, 'weight_decay': 7.436388457995354e-07, 'epochs': 198, 'loss': 'mae', 'optimizer': 'adam', 'graph_mode': 'off', 'use_snp_selection': False}. Best is trial 79 with value: 0.12154521220053922.
[I 2025-12-05 16:14:48,762] Trial 88 finished with value: 0.08604860244871003 and parameters: {'model_type': 'mlp', 'hidden_dims': '[512, 128]', 'dropout': 0.2640838968503789, 'batch_norm': True, 'lr': 0.0006277448428225303, 'weight_decay': 1.927952457216661e-07, 'epochs': 263, 'loss': 'mse', 'optimizer': 'adam', 'graph_mode': 'off', 'use_snp_selection': False}. Best is trial 79 with value: 0.12154521220053922.
[I 2025-12-05 16:14:50,403] Trial 89 finished with value: 0.09959195353494972 and parameters: {'model_type': 'mlp', 'hidden_dims': '[128, 64]', 'dropout': 0.14626578441290827, 'batch_norm': True, 'lr': 0.0004031908204117076, 'weight_decay': 5.082210299762538e-07, 'epochs': 219, 'loss': 'mae', 'optimizer': 'adam', 'graph_mode': 'off', 'use_snp_selection': True, 'num_snps': 25821}. Best is trial 79 with value: 0.12154521220053922.
[I 2025-12-05 16:14:53,050] Trial 90 finished with value: 0.06202537600707476 and parameters: {'model_type': 'mlp', 'hidden_dims': '[512, 128]', 'dropout': 0.3275193186932208, 'batch_norm': True, 'lr': 9.507307202560235e-06, 'weight_decay': 2.684380263159297e-07, 'epochs': 342, 'loss': 'mse', 'optimizer': 'adam', 'graph_mode': 'off', 'use_snp_selection': False}. Best is trial 79 with value: 0.12154521220053922.
[I 2025-12-05 16:14:55,390] Trial 91 finished with value: 0.10004310054143675 and parameters: {'model_type': 'mlp', 'hidden_dims': '[128, 64]', 'dropout': 0.20985324456456758, 'batch_norm': True, 'lr': 0.0005583929294468775, 'weight_decay': 1.5700803637718554e-06, 'epochs': 330, 'loss': 'mae', 'optimizer': 'adam', 'graph_mode': 'off', 'use_snp_selection': True, 'num_snps': 43934}. Best is trial 79 with value: 0.12154521220053922.
[I 2025-12-05 16:14:57,975] Trial 92 finished with value: 0.10103805187013389 and parameters: {'model_type': 'mlp', 'hidden_dims': '[128, 64]', 'dropout': 0.22890610496777222, 'batch_norm': True, 'lr': 0.000607048353227461, 'weight_decay': 1.2321676695957612e-06, 'epochs': 322, 'loss': 'mae', 'optimizer': 'adam', 'graph_mode': 'off', 'use_snp_selection': True, 'num_snps': 54575}. Best is trial 79 with value: 0.12154521220053922.
[I 2025-12-05 16:15:00,323] Trial 93 finished with value: 0.09495724023844719 and parameters: {'model_type': 'mlp', 'hidden_dims': '[128, 64]', 'dropout': 0.11143036488605959, 'batch_norm': True, 'lr': 0.0007059213616649973, 'weight_decay': 1.3138091737439416e-06, 'epochs': 336, 'loss': 'mae', 'optimizer': 'adam', 'graph_mode': 'off', 'use_snp_selection': True, 'num_snps': 41860}. Best is trial 79 with value: 0.12154521220053922.
[I 2025-12-05 16:15:02,928] Trial 94 finished with value: 0.09073919276703439 and parameters: {'model_type': 'mlp', 'hidden_dims': '[128, 64]', 'dropout': 0.24729973583599557, 'batch_norm': True, 'lr': 0.0008503702789068315, 'weight_decay': 1.9898545762888067e-06, 'epochs': 315, 'loss': 'mae', 'optimizer': 'adam', 'graph_mode': 'off', 'use_snp_selection': True, 'num_snps': 47539}. Best is trial 79 with value: 0.12154521220053922.
[I 2025-12-05 16:15:05,456] Trial 95 finished with value: 0.09486173941545956 and parameters: {'model_type': 'mlp', 'hidden_dims': '[256, 128, 64]', 'dropout': 0.19934719827519062, 'batch_norm': True, 'lr': 0.0004961181972973894, 'weight_decay': 3.4843757119301075e-06, 'epochs': 348, 'loss': 'mae', 'optimizer': 'adam', 'graph_mode': 'off', 'use_snp_selection': True, 'num_snps': 41860}. Best is trial 79 with value: 0.12154521220053922.
[I 2025-12-05 16:15:06,558] Trial 96 finished with value: 0.09141454959779233 and parameters: {'model_type': 'mlp', 'hidden_dims': '[128, 64]', 'dropout': 0.16870812274739466, 'batch_norm': True, 'lr': 0.0007005799792385728, 'weight_decay': 6.159988968850655e-07, 'epochs': 336, 'loss': 'mae', 'optimizer': 'adam', 'graph_mode': 'off', 'use_snp_selection': False}. Best is trial 79 with value: 0.12154521220053922.
[I 2025-12-05 16:15:08,842] Trial 97 finished with value: 0.08537284413457853 and parameters: {'model_type': 'mlp', 'hidden_dims': '[512, 256]', 'dropout': 0.2180293229152854, 'batch_norm': True, 'lr': 0.0009778868411743585, 'weight_decay': 9.73144991501806e-07, 'epochs': 193, 'loss': 'mae', 'optimizer': 'adam', 'graph_mode': 'off', 'use_snp_selection': True, 'num_snps': 36017}. Best is trial 79 with value: 0.12154521220053922.
[I 2025-12-05 16:15:10,758] Trial 98 finished with value: 0.052154933800406096 and parameters: {'model_type': 'mlp', 'hidden_dims': '[512, 128]', 'dropout': 0.15346200104944685, 'batch_norm': False, 'lr': 2.9267782161364793e-05, 'weight_decay': 5.112465349208179e-06, 'epochs': 213, 'loss': 'mse', 'optimizer': 'adam', 'graph_mode': 'off', 'use_snp_selection': False}. Best is trial 79 with value: 0.12154521220053922.
[I 2025-12-05 16:15:13,151] Trial 99 finished with value: 0.089947521428652 and parameters: {'model_type': 'mlp', 'hidden_dims': '[512, 64]', 'dropout': 0.19124595752924223, 'batch_norm': True, 'lr': 0.000327301004862899, 'weight_decay': 3.6443220546872314e-07, 'epochs': 296, 'loss': 'mae', 'optimizer': 'adam', 'graph_mode': 'off', 'use_snp_selection': False}. Best is trial 79 with value: 0.12154521220053922.
[I 2025-12-05 16:15:15,201] Trial 100 finished with value: 0.1003737114109931 and parameters: {'model_type': 'mlp', 'hidden_dims': '[128, 64]', 'dropout': 0.12893925123420552, 'batch_norm': True, 'lr': 0.000585924031597771, 'weight_decay': 1.691499119349162e-07, 'epochs': 179, 'loss': 'mse', 'optimizer': 'adam', 'graph_mode': 'off', 'use_snp_selection': True, 'num_snps': 43268}. Best is trial 79 with value: 0.12154521220053922.
[I 2025-12-05 16:15:16,997] Trial 101 finished with value: 0.08458496729948513 and parameters: {'model_type': 'mlp', 'hidden_dims': '[512, 256]', 'dropout': 0.10874987036389389, 'batch_norm': True, 'lr': 0.000513599559609322, 'weight_decay': 1.536337965711668e-07, 'epochs': 187, 'loss': 'mse', 'optimizer': 'adam', 'graph_mode': 'off', 'use_snp_selection': False}. Best is trial 79 with value: 0.12154521220053922.
[I 2025-12-05 16:15:18,876] Trial 102 finished with value: 0.09988470674515829 and parameters: {'model_type': 'mlp', 'hidden_dims': '[512, 256]', 'dropout': 0.10054044970428679, 'batch_norm': True, 'lr': 0.000748845998764201, 'weight_decay': 1.227295461903546e-07, 'epochs': 192, 'loss': 'mse', 'optimizer': 'adam', 'graph_mode': 'off', 'use_snp_selection': False}. Best is trial 79 with value: 0.12154521220053922.
[I 2025-12-05 16:15:20,535] Trial 103 finished with value: 0.07959967188701941 and parameters: {'model_type': 'mlp', 'hidden_dims': '[512, 256]', 'dropout': 0.11528933893340981, 'batch_norm': True, 'lr': 0.00044401991245325524, 'weight_decay': 2.4333415159680313e-07, 'epochs': 155, 'loss': 'mse', 'optimizer': 'adam', 'graph_mode': 'off', 'use_snp_selection': False}. Best is trial 79 with value: 0.12154521220053922.
[I 2025-12-05 16:15:23,027] Trial 104 finished with value: 0.08867042662595079 and parameters: {'model_type': 'mlp', 'hidden_dims': '[512, 256]', 'dropout': 0.14442420137215395, 'batch_norm': True, 'lr': 0.0003808203214293816, 'weight_decay': 3.092198395621369e-07, 'epochs': 305, 'loss': 'mse', 'optimizer': 'adam', 'graph_mode': 'off', 'use_snp_selection': False}. Best is trial 79 with value: 0.12154521220053922.
[I 2025-12-05 16:15:25,079] Trial 105 finished with value: 0.09574270653773578 and parameters: {'model_type': 'mlp', 'hidden_dims': '[512, 128]', 'dropout': 0.125270002777397, 'batch_norm': True, 'lr': 0.000265147412091779, 'weight_decay': 7.105465887093663e-07, 'epochs': 232, 'loss': 'mse', 'optimizer': 'adam', 'graph_mode': 'off', 'use_snp_selection': False}. Best is trial 79 with value: 0.12154521220053922.
[I 2025-12-05 16:15:26,016] Trial 106 finished with value: 0.11312558252798856 and parameters: {'model_type': 'mlp', 'hidden_dims': '[128, 64]', 'dropout': 0.1005037055139077, 'batch_norm': True, 'lr': 0.0008456544688373133, 'weight_decay': 4.364667020437866e-07, 'epochs': 239, 'loss': 'mae', 'optimizer': 'adam', 'graph_mode': 'off', 'use_snp_selection': False}. Best is trial 79 with value: 0.12154521220053922.
[I 2025-12-05 16:15:26,929] Trial 107 finished with value: 0.10363888078583193 and parameters: {'model_type': 'mlp', 'hidden_dims': '[128, 64]', 'dropout': 0.17684953721987498, 'batch_norm': True, 'lr': 0.0008805081829593608, 'weight_decay': 4.463746894266598e-07, 'epochs': 241, 'loss': 'mae', 'optimizer': 'adam', 'graph_mode': 'off', 'use_snp_selection': False}. Best is trial 79 with value: 0.12154521220053922.
[I 2025-12-05 16:15:27,853] Trial 108 finished with value: 0.09263608634478003 and parameters: {'model_type': 'mlp', 'hidden_dims': '[128, 64]', 'dropout': 0.16437506607855285, 'batch_norm': True, 'lr': 0.0006337515813515922, 'weight_decay': 1.6972285627627852e-06, 'epochs': 249, 'loss': 'mae', 'optimizer': 'adam', 'graph_mode': 'off', 'use_snp_selection': False}. Best is trial 79 with value: 0.12154521220053922.
[I 2025-12-05 16:15:29,209] Trial 109 finished with value: 0.05734523386928944 and parameters: {'model_type': 'mlp', 'hidden_dims': '[128, 64]', 'dropout': 0.38070882959254154, 'batch_norm': True, 'lr': 0.0008362394652703884, 'weight_decay': 5.95644666938493e-07, 'epochs': 257, 'loss': 'mae', 'optimizer': 'adam', 'graph_mode': 'off', 'use_snp_selection': True, 'num_snps': 13790}. Best is trial 79 with value: 0.12154521220053922.
[I 2025-12-05 16:15:30,101] Trial 110 finished with value: 0.09632551610179656 and parameters: {'model_type': 'mlp', 'hidden_dims': '[128, 64]', 'dropout': 0.13571332914257794, 'batch_norm': True, 'lr': 0.0007544459282810946, 'weight_decay': 1.0230306368475246e-06, 'epochs': 226, 'loss': 'mae', 'optimizer': 'adam', 'graph_mode': 'off', 'use_snp_selection': False}. Best is trial 79 with value: 0.12154521220053922.
[I 2025-12-05 16:15:30,963] Trial 111 finished with value: 0.09728791271656678 and parameters: {'model_type': 'mlp', 'hidden_dims': '[128, 64]', 'dropout': 0.10847400727130782, 'batch_norm': True, 'lr': 0.0005115513251667463, 'weight_decay': 2.115820638335061e-07, 'epochs': 207, 'loss': 'mae', 'optimizer': 'adam', 'graph_mode': 'off', 'use_snp_selection': False}. Best is trial 79 with value: 0.12154521220053922.
[I 2025-12-05 16:15:32,714] Trial 112 finished with value: 0.09516027429538138 and parameters: {'model_type': 'mlp', 'hidden_dims': '[512, 256]', 'dropout': 0.10125953251280286, 'batch_norm': True, 'lr': 0.000881399970208763, 'weight_decay': 8.413807340275821e-07, 'epochs': 173, 'loss': 'mae', 'optimizer': 'adam', 'graph_mode': 'off', 'use_snp_selection': False}. Best is trial 79 with value: 0.12154521220053922.
[I 2025-12-05 16:15:35,036] Trial 113 finished with value: 0.0867710624859111 and parameters: {'model_type': 'mlp', 'hidden_dims': '[512, 128]', 'dropout': 0.12191434151907753, 'batch_norm': True, 'lr': 0.0006110661393476815, 'weight_decay': 3.241587277733597e-07, 'epochs': 274, 'loss': 'mse', 'optimizer': 'adam', 'graph_mode': 'off', 'use_snp_selection': False}. Best is trial 79 with value: 0.12154521220053922.
[I 2025-12-05 16:15:36,118] Trial 114 finished with value: 0.09010548544024904 and parameters: {'model_type': 'mlp', 'hidden_dims': '[128, 64]', 'dropout': 0.14846642286020656, 'batch_norm': True, 'lr': 0.0006972647353506328, 'weight_decay': 1.1188846003126432e-07, 'epochs': 323, 'loss': 'mae', 'optimizer': 'adam', 'graph_mode': 'off', 'use_snp_selection': False}. Best is trial 79 with value: 0.12154521220053922.
[I 2025-12-05 16:15:37,404] Trial 115 finished with value: 0.08944537934042623 and parameters: {'model_type': 'mlp', 'hidden_dims': '[256, 128]', 'dropout': 0.11471225922505446, 'batch_norm': True, 'lr': 0.0005369579895432436, 'weight_decay': 4.6648494283386424e-07, 'epochs': 236, 'loss': 'mae', 'optimizer': 'adam', 'graph_mode': 'off', 'use_snp_selection': False}. Best is trial 79 with value: 0.12154521220053922.
[I 2025-12-05 16:15:39,297] Trial 116 finished with value: 0.057462180754084394 and parameters: {'model_type': 'mlp', 'hidden_dims': '[512, 256]', 'dropout': 0.20637800415864957, 'batch_norm': False, 'lr': 0.00041618997224523253, 'weight_decay': 1.363107906224804e-07, 'epochs': 201, 'loss': 'mse', 'optimizer': 'adam', 'graph_mode': 'off', 'use_snp_selection': False}. Best is trial 79 with value: 0.12154521220053922.
[I 2025-12-05 16:15:41,694] Trial 117 finished with value: 0.08032930809841908 and parameters: {'model_type': 'mlp', 'hidden_dims': '[512, 128]', 'dropout': 0.13311764714013255, 'batch_norm': True, 'lr': 7.526875911160945e-05, 'weight_decay': 2.8220554083219267e-07, 'epochs': 289, 'loss': 'mae', 'optimizer': 'adam', 'graph_mode': 'off', 'use_snp_selection': False}. Best is trial 79 with value: 0.12154521220053922.
[I 2025-12-05 16:15:44,353] Trial 118 finished with value: 0.11705918027797418 and parameters: {'model_type': 'mlp', 'hidden_dims': '[256, 128, 64]', 'dropout': 0.23928555407669072, 'batch_norm': True, 'lr': 0.0009825436837295682, 'weight_decay': 1.7395832387096992e-07, 'epochs': 215, 'loss': 'mae', 'optimizer': 'adam', 'graph_mode': 'off', 'use_snp_selection': True, 'num_snps': 55196}. Best is trial 79 with value: 0.12154521220053922.
[I 2025-12-05 16:15:47,123] Trial 119 finished with value: 0.09223842412470934 and parameters: {'model_type': 'mlp', 'hidden_dims': '[256, 128, 64]', 'dropout': 0.2249445408479199, 'batch_norm': True, 'lr': 0.0009160861384612742, 'weight_decay': 3.803460772477413e-07, 'epochs': 216, 'loss': 'mae', 'optimizer': 'adam', 'graph_mode': 'off', 'use_snp_selection': True, 'num_snps': 56261}. Best is trial 79 with value: 0.12154521220053922.
[I 2025-12-05 16:15:49,598] Trial 120 finished with value: 0.09952170187277924 and parameters: {'model_type': 'mlp', 'hidden_dims': '[256, 128, 64]', 'dropout': 0.23734587397540463, 'batch_norm': True, 'lr': 0.0007635407264227952, 'weight_decay': 1.8690245224735018e-07, 'epochs': 221, 'loss': 'mae', 'optimizer': 'adam', 'graph_mode': 'off', 'use_snp_selection': True, 'num_snps': 49466}. Best is trial 79 with value: 0.12154521220053922.
