[I 2025-12-05 16:22:36,970] Trial 65 finished with value: 0.08699919517994488 and parameters: {'model_type': 'mlp', 'hidden_dims': '[512, 64]', 'dropout': 0.11282729739179795, 'batch_norm': True, 'lr': 8.231048283521063e-05, 'weight_decay': 1.7101040462062848e-07, 'epochs': 235, 'loss': 'mse', 'optimizer': 'adam', 'graph_mode': 'off', 'use_snp_selection': True, 'num_snps': 39339}. Best is trial 33 with value: 0.11481403501753586.
[I 2025-12-05 16:22:39,466] Trial 66 finished with value: 0.08347278902346772 and parameters: {'model_type': 'mlp', 'hidden_dims': '[512, 64]', 'dropout': 0.1826940131139218, 'batch_norm': True, 'lr': 4.290954428003359e-05, 'weight_decay': 2.416480979557663e-07, 'epochs': 193, 'loss': 'mse', 'optimizer': 'adam', 'graph_mode': 'off', 'use_snp_selection': True, 'num_snps': 49010}. Best is trial 33 with value: 0.11481403501753586.
[I 2025-12-05 16:22:41,881] Trial 67 finished with value: 0.07436111808706662 and parameters: {'model_type': 'mlp', 'hidden_dims': '[512, 64]', 'dropout': 0.15137979950670633, 'batch_norm': True, 'lr': 0.0001215465371111736, 'weight_decay': 4.1555877283032934e-07, 'epochs': 221, 'loss': 'mse', 'optimizer': 'adam', 'graph_mode': 'off', 'use_snp_selection': True, 'num_snps': 42865}. Best is trial 33 with value: 0.11481403501753586.
[I 2025-12-05 16:22:43,589] Trial 68 finished with value: 0.10223120277871904 and parameters: {'model_type': 'mlp', 'hidden_dims': '[512, 64]', 'dropout': 0.24501150451967207, 'batch_norm': True, 'lr': 0.00030019853877139523, 'weight_decay': 1.0393298310365081e-07, 'epochs': 88, 'loss': 'mse', 'optimizer': 'adam', 'graph_mode': 'off', 'use_snp_selection': True, 'num_snps': 35341}. Best is trial 33 with value: 0.11481403501753586.
[I 2025-12-05 16:22:45,397] Trial 69 finished with value: 0.10307524524695072 and parameters: {'model_type': 'mlp', 'hidden_dims': '[512, 64]', 'dropout': 0.21675528135287078, 'batch_norm': True, 'lr': 0.00018886862184819858, 'weight_decay': 1.9077792808914706e-07, 'epochs': 239, 'loss': 'mse', 'optimizer': 'adam', 'graph_mode': 'off', 'use_snp_selection': True, 'num_snps': 30191}. Best is trial 33 with value: 0.11481403501753586.
[I 2025-12-05 16:22:47,354] Trial 70 finished with value: 0.09637290075394395 and parameters: {'model_type': 'mlp', 'hidden_dims': '[512, 64]', 'dropout': 0.12372160222148294, 'batch_norm': False, 'lr': 6.893001751883013e-05, 'weight_decay': 1.341727446794267e-07, 'epochs': 132, 'loss': 'mse', 'optimizer': 'adam', 'graph_mode': 'off', 'use_snp_selection': True, 'num_snps': 39250}. Best is trial 33 with value: 0.11481403501753586.
[I 2025-12-05 16:22:49,484] Trial 71 finished with value: 0.09887694800625668 and parameters: {'model_type': 'mlp', 'hidden_dims': '[512, 64]', 'dropout': 0.2112553980860338, 'batch_norm': True, 'lr': 0.00020663292538100966, 'weight_decay': 3.228096233545638e-07, 'epochs': 224, 'loss': 'mse', 'optimizer': 'adam', 'graph_mode': 'off', 'use_snp_selection': True, 'num_snps': 38668}. Best is trial 33 with value: 0.11481403501753586.
[I 2025-12-05 16:22:51,958] Trial 72 finished with value: 0.09235983782531668 and parameters: {'model_type': 'mlp', 'hidden_dims': '[512, 64]', 'dropout': 0.1756380823851006, 'batch_norm': True, 'lr': 0.00013532838204263753, 'weight_decay': 1.0871836280547196e-07, 'epochs': 253, 'loss': 'mse', 'optimizer': 'adam', 'graph_mode': 'off', 'use_snp_selection': True, 'num_snps': 43967}. Best is trial 33 with value: 0.11481403501753586.
[I 2025-12-05 16:22:54,706] Trial 73 finished with value: 0.1087946275738842 and parameters: {'model_type': 'mlp', 'hidden_dims': '[512, 64]', 'dropout': 0.14129850256301588, 'batch_norm': True, 'lr': 0.00023878056706605737, 'weight_decay': 2.277439823983864e-07, 'epochs': 340, 'loss': 'mse', 'optimizer': 'adam', 'graph_mode': 'off', 'use_snp_selection': True, 'num_snps': 43359}. Best is trial 33 with value: 0.11481403501753586.
[I 2025-12-05 16:22:57,767] Trial 74 finished with value: 0.10848956294266408 and parameters: {'model_type': 'mlp', 'hidden_dims': '[512, 64]', 'dropout': 0.14264010822384593, 'batch_norm': True, 'lr': 0.0005545550112431169, 'weight_decay': 2.137872893984401e-07, 'epochs': 334, 'loss': 'mse', 'optimizer': 'adam', 'graph_mode': 'off', 'use_snp_selection': True, 'num_snps': 50843}. Best is trial 33 with value: 0.11481403501753586.
[I 2025-12-05 16:23:00,861] Trial 75 finished with value: 0.004576599046901858 and parameters: {'model_type': 'mlp', 'hidden_dims': '[512, 256]', 'dropout': 0.13442383312725403, 'batch_norm': True, 'lr': 1.0087771566710253e-06, 'weight_decay': 2.472070451055119e-07, 'epochs': 339, 'loss': 'mse', 'optimizer': 'adam', 'graph_mode': 'off', 'use_snp_selection': True, 'num_snps': 50532}. Best is trial 33 with value: 0.11481403501753586.
[I 2025-12-05 16:23:03,638] Trial 76 finished with value: 0.11650901182115267 and parameters: {'model_type': 'mlp', 'hidden_dims': '[512, 64]', 'dropout': 0.1023202571562513, 'batch_norm': True, 'lr': 0.0005471724623988684, 'weight_decay': 4.6515680392382947e-07, 'epochs': 339, 'loss': 'mse', 'optimizer': 'adam', 'graph_mode': 'off', 'use_snp_selection': True, 'num_snps': 44472}. Best is trial 76 with value: 0.11650901182115267.
[I 2025-12-05 16:23:06,483] Trial 77 finished with value: 0.10843278574749955 and parameters: {'model_type': 'mlp', 'hidden_dims': '[512, 64]', 'dropout': 0.10327278585212778, 'batch_norm': True, 'lr': 0.0003972351536432786, 'weight_decay': 7.510929807611768e-07, 'epochs': 343, 'loss': 'mse', 'optimizer': 'adam', 'graph_mode': 'off', 'use_snp_selection': True, 'num_snps': 45171}. Best is trial 76 with value: 0.11650901182115267.
[I 2025-12-05 16:23:09,247] Trial 78 finished with value: 0.1053655829222967 and parameters: {'model_type': 'mlp', 'hidden_dims': '[512, 64]', 'dropout': 0.16398596436085203, 'batch_norm': True, 'lr': 0.0003967625088780226, 'weight_decay': 4.481775780544021e-07, 'epochs': 341, 'loss': 'mse', 'optimizer': 'adam', 'graph_mode': 'off', 'use_snp_selection': True, 'num_snps': 44289}. Best is trial 76 with value: 0.11650901182115267.
[I 2025-12-05 16:23:12,358] Trial 79 finished with value: 0.10388476078282674 and parameters: {'model_type': 'mlp', 'hidden_dims': '[512, 64]', 'dropout': 0.10058458203327994, 'batch_norm': True, 'lr': 0.0007550429781898375, 'weight_decay': 1.8451529398655077e-07, 'epochs': 332, 'loss': 'mse', 'optimizer': 'adam', 'graph_mode': 'off', 'use_snp_selection': True, 'num_snps': 52422}. Best is trial 76 with value: 0.11650901182115267.
[I 2025-12-05 16:23:15,002] Trial 80 finished with value: 0.10825074937686324 and parameters: {'model_type': 'mlp', 'hidden_dims': '[512, 64]', 'dropout': 0.14247926686482298, 'batch_norm': True, 'lr': 0.0003255406898621417, 'weight_decay': 8.196660649328233e-07, 'epochs': 314, 'loss': 'mse', 'optimizer': 'adam', 'graph_mode': 'off', 'use_snp_selection': True, 'num_snps': 42925}. Best is trial 76 with value: 0.11650901182115267.
[I 2025-12-05 16:23:17,635] Trial 81 finished with value: 0.10728094626783698 and parameters: {'model_type': 'mlp', 'hidden_dims': '[512, 64]', 'dropout': 0.14235307124992627, 'batch_norm': True, 'lr': 0.0003185064727724555, 'weight_decay': 8.471172856092146e-07, 'epochs': 315, 'loss': 'mse', 'optimizer': 'adam', 'graph_mode': 'off', 'use_snp_selection': True, 'num_snps': 42884}. Best is trial 76 with value: 0.11650901182115267.
[I 2025-12-05 16:23:20,245] Trial 82 finished with value: 0.11060704252095688 and parameters: {'model_type': 'mlp', 'hidden_dims': '[512, 64]', 'dropout': 0.11765004841825429, 'batch_norm': True, 'lr': 0.0005350315990112673, 'weight_decay': 7.6590826325864e-07, 'epochs': 313, 'loss': 'mse', 'optimizer': 'adam', 'graph_mode': 'off', 'use_snp_selection': True, 'num_snps': 43326}. Best is trial 76 with value: 0.11650901182115267.
[I 2025-12-05 16:23:23,090] Trial 83 finished with value: 0.10596268822062647 and parameters: {'model_type': 'mlp', 'hidden_dims': '[512, 64]', 'dropout': 0.11753064113476838, 'batch_norm': True, 'lr': 0.0005648658500669656, 'weight_decay': 1.2378037168747919e-06, 'epochs': 306, 'loss': 'mse', 'optimizer': 'adam', 'graph_mode': 'off', 'use_snp_selection': True, 'num_snps': 48651}. Best is trial 76 with value: 0.11650901182115267.
[I 2025-12-05 16:23:26,461] Trial 84 finished with value: 0.10280887375139952 and parameters: {'model_type': 'mlp', 'hidden_dims': '[512, 64]', 'dropout': 0.11093865576811102, 'batch_norm': True, 'lr': 0.0004673920167181514, 'weight_decay': 1.663517361160113e-06, 'epochs': 345, 'loss': 'mse', 'optimizer': 'adam', 'graph_mode': 'off', 'use_snp_selection': True, 'num_snps': 56507}. Best is trial 76 with value: 0.11650901182115267.
[I 2025-12-05 16:23:29,253] Trial 85 finished with value: 0.11191831579294001 and parameters: {'model_type': 'mlp', 'hidden_dims': '[512, 64]', 'dropout': 0.13935019871899038, 'batch_norm': True, 'lr': 0.0003733582296219319, 'weight_decay': 8.356192557193729e-06, 'epochs': 320, 'loss': 'mse', 'optimizer': 'adam', 'graph_mode': 'off', 'use_snp_selection': True, 'num_snps': 45328}. Best is trial 76 with value: 0.11650901182115267.
[I 2025-12-05 16:23:32,007] Trial 86 finished with value: 0.05542770488385984 and parameters: {'model_type': 'mlp', 'hidden_dims': '[512, 64]', 'dropout': 0.15595559701866465, 'batch_norm': False, 'lr': 0.0007448688073801339, 'weight_decay': 8.960681574078418e-06, 'epochs': 324, 'loss': 'mse', 'optimizer': 'adam', 'graph_mode': 'off', 'use_snp_selection': True, 'num_snps': 45690}. Best is trial 76 with value: 0.11650901182115267.
[I 2025-12-05 16:23:35,014] Trial 87 finished with value: 0.1045376860436396 and parameters: {'model_type': 'mlp', 'hidden_dims': '[512, 64]', 'dropout': 0.10572279774507637, 'batch_norm': True, 'lr': 0.0004208848606064192, 'weight_decay': 1.4405085918106566e-05, 'epochs': 330, 'loss': 'mse', 'optimizer': 'adam', 'graph_mode': 'off', 'use_snp_selection': True, 'num_snps': 50250}. Best is trial 76 with value: 0.11650901182115267.
[I 2025-12-05 16:23:37,964] Trial 88 finished with value: 0.1043255127274604 and parameters: {'model_type': 'mlp', 'hidden_dims': '[512, 64]', 'dropout': 0.13245336532718588, 'batch_norm': True, 'lr': 0.00025562997079441215, 'weight_decay': 5.314675152730845e-07, 'epochs': 349, 'loss': 'mse', 'optimizer': 'adam', 'graph_mode': 'off', 'use_snp_selection': True, 'num_snps': 47090}. Best is trial 76 with value: 0.11650901182115267.
[I 2025-12-05 16:23:40,682] Trial 89 finished with value: 0.11151830899620581 and parameters: {'model_type': 'mlp', 'hidden_dims': '[256, 128, 64]', 'dropout': 0.1241348812978579, 'batch_norm': True, 'lr': 0.0003672448891353847, 'weight_decay': 9.330983723526108e-05, 'epochs': 337, 'loss': 'mse', 'optimizer': 'adam', 'graph_mode': 'off', 'use_snp_selection': True, 'num_snps': 55678}. Best is trial 76 with value: 0.11650901182115267.
[I 2025-12-05 16:23:43,383] Trial 90 finished with value: 0.10584552404558337 and parameters: {'model_type': 'mlp', 'hidden_dims': '[256, 128, 64]', 'dropout': 0.1562724781513939, 'batch_norm': True, 'lr': 0.0005161854212224389, 'weight_decay': 0.00012987738447637527, 'epochs': 321, 'loss': 'mse', 'optimizer': 'adam', 'graph_mode': 'off', 'use_snp_selection': True, 'num_snps': 55335}. Best is trial 76 with value: 0.11650901182115267.
[I 2025-12-05 16:23:46,233] Trial 91 finished with value: 0.10897578287900711 and parameters: {'model_type': 'mlp', 'hidden_dims': '[256, 128, 64]', 'dropout': 0.12141373608354598, 'batch_norm': True, 'lr': 0.000369443158541271, 'weight_decay': 9.788124320843932e-05, 'epochs': 337, 'loss': 'mse', 'optimizer': 'adam', 'graph_mode': 'off', 'use_snp_selection': True, 'num_snps': 59267}. Best is trial 76 with value: 0.11650901182115267.
[I 2025-12-05 16:23:48,982] Trial 92 finished with value: 0.10670368982474737 and parameters: {'model_type': 'mlp', 'hidden_dims': '[256, 128, 64]', 'dropout': 0.12405202877779889, 'batch_norm': True, 'lr': 0.0003566457573668082, 'weight_decay': 0.00021159215116193616, 'epochs': 335, 'loss': 'mse', 'optimizer': 'adam', 'graph_mode': 'off', 'use_snp_selection': True, 'num_snps': 56841}. Best is trial 76 with value: 0.11650901182115267.
[I 2025-12-05 16:23:51,768] Trial 93 finished with value: 0.0931963830616629 and parameters: {'model_type': 'mlp', 'hidden_dims': '[256, 128, 64]', 'dropout': 0.13820417220692996, 'batch_norm': True, 'lr': 0.000949425293809531, 'weight_decay': 0.00010002665871913786, 'epochs': 303, 'loss': 'mse', 'optimizer': 'adam', 'graph_mode': 'off', 'use_snp_selection': True, 'num_snps': 59456}. Best is trial 76 with value: 0.11650901182115267.
[I 2025-12-05 16:23:54,281] Trial 94 finished with value: 0.09746695891049814 and parameters: {'model_type': 'mlp', 'hidden_dims': '[256, 128, 64]', 'dropout': 0.12263093008885048, 'batch_norm': True, 'lr': 0.00023811779785217675, 'weight_decay': 0.0004160551942762987, 'epochs': 307, 'loss': 'mse', 'optimizer': 'adam', 'graph_mode': 'off', 'use_snp_selection': True, 'num_snps': 51287}. Best is trial 76 with value: 0.11650901182115267.
[I 2025-12-05 16:23:56,963] Trial 95 finished with value: 0.11178702735428275 and parameters: {'model_type': 'mlp', 'hidden_dims': '[256, 128, 64]', 'dropout': 0.15787729374547307, 'batch_norm': True, 'lr': 0.0005893422927325029, 'weight_decay': 6.814535741255263e-05, 'epochs': 334, 'loss': 'mse', 'optimizer': 'adam', 'graph_mode': 'off', 'use_snp_selection': True, 'num_snps': 54487}. Best is trial 76 with value: 0.11650901182115267.
[I 2025-12-05 16:23:59,611] Trial 96 finished with value: 0.09917636298224536 and parameters: {'model_type': 'mlp', 'hidden_dims': '[256, 128, 64]', 'dropout': 0.18855032466427407, 'batch_norm': True, 'lr': 0.0002725250686804407, 'weight_decay': 8.490569865859483e-05, 'epochs': 325, 'loss': 'mse', 'optimizer': 'adam', 'graph_mode': 'off', 'use_snp_selection': True, 'num_snps': 54425}. Best is trial 76 with value: 0.11650901182115267.
[I 2025-12-05 16:24:02,470] Trial 97 finished with value: 0.058300143858694406 and parameters: {'model_type': 'mlp', 'hidden_dims': '[256, 128, 64]', 'dropout': 0.15643810711987513, 'batch_norm': True, 'lr': 1.4987511703660038e-05, 'weight_decay': 0.00014439796931239773, 'epochs': 316, 'loss': 'mse', 'optimizer': 'adam', 'graph_mode': 'off', 'use_snp_selection': True, 'num_snps': 59358}. Best is trial 76 with value: 0.11650901182115267.
[I 2025-12-05 16:24:03,804] Trial 98 finished with value: 0.10347243176949766 and parameters: {'model_type': 'mlp', 'hidden_dims': '[256, 128, 64]', 'dropout': 0.11209204365977678, 'batch_norm': True, 'lr': 0.0007608163676715757, 'weight_decay': 4.553464239287079e-05, 'epochs': 291, 'loss': 'mse', 'optimizer': 'adam', 'graph_mode': 'off', 'use_snp_selection': True, 'num_snps': 13448}. Best is trial 76 with value: 0.11650901182115267.
[I 2025-12-05 16:24:06,055] Trial 99 finished with value: 0.09610394815939323 and parameters: {'model_type': 'mlp', 'hidden_dims': '[256, 128, 64]', 'dropout': 0.16385007500327212, 'batch_norm': True, 'lr': 0.0006260145575863939, 'weight_decay': 2.795138423548998e-05, 'epochs': 346, 'loss': 'mae', 'optimizer': 'adam', 'graph_mode': 'off', 'use_snp_selection': True, 'num_snps': 40998}. Best is trial 76 with value: 0.11650901182115267.
[I 2025-12-05 16:24:07,316] Trial 100 finished with value: 0.10599387708163129 and parameters: {'model_type': 'mlp', 'hidden_dims': '[256, 128, 64]', 'dropout': 0.12701346703198732, 'batch_norm': False, 'lr': 0.0004648829024975522, 'weight_decay': 7.017017420538117e-05, 'epochs': 338, 'loss': 'mse', 'optimizer': 'adam', 'graph_mode': 'off', 'use_snp_selection': False}. Best is trial 76 with value: 0.11650901182115267.
[I 2025-12-05 16:24:10,601] Trial 101 finished with value: 0.10963114710530064 and parameters: {'model_type': 'mlp', 'hidden_dims': '[512, 256]', 'dropout': 0.1449251420232296, 'batch_norm': True, 'lr': 0.0003709049315838892, 'weight_decay': 1.7917258848499236e-05, 'epochs': 331, 'loss': 'mse', 'optimizer': 'adam', 'graph_mode': 'off', 'use_snp_selection': True, 'num_snps': 56679}. Best is trial 76 with value: 0.11650901182115267.
[I 2025-12-05 16:24:13,901] Trial 102 finished with value: 0.1167076602043538 and parameters: {'model_type': 'mlp', 'hidden_dims': '[512, 256]', 'dropout': 0.14799826730436533, 'batch_norm': True, 'lr': 0.0002920115004037248, 'weight_decay': 4.710032703559276e-05, 'epochs': 328, 'loss': 'mse', 'optimizer': 'adam', 'graph_mode': 'off', 'use_snp_selection': True, 'num_snps': 56399}. Best is trial 102 with value: 0.1167076602043538.
[I 2025-12-05 16:24:17,308] Trial 103 finished with value: 0.10714054285918856 and parameters: {'model_type': 'mlp', 'hidden_dims': '[512, 256]', 'dropout': 0.15064495505451392, 'batch_norm': True, 'lr': 0.00029546748926861656, 'weight_decay': 1.9374179611229665e-05, 'epochs': 328, 'loss': 'mse', 'optimizer': 'adam', 'graph_mode': 'off', 'use_snp_selection': True, 'num_snps': 57685}. Best is trial 102 with value: 0.1167076602043538.
[I 2025-12-05 16:24:20,485] Trial 104 finished with value: 0.11632796593416381 and parameters: {'model_type': 'mlp', 'hidden_dims': '[512, 256]', 'dropout': 0.116448449938548, 'batch_norm': True, 'lr': 0.0003553689568435129, 'weight_decay': 4.382875320500852e-05, 'epochs': 300, 'loss': 'mse', 'optimizer': 'adam', 'graph_mode': 'off', 'use_snp_selection': True, 'num_snps': 56170}. Best is trial 102 with value: 0.1167076602043538.
[I 2025-12-05 16:24:23,673] Trial 105 finished with value: 0.1061471106122198 and parameters: {'model_type': 'mlp', 'hidden_dims': '[512, 256]', 'dropout': 0.100790849334168, 'batch_norm': True, 'lr': 0.0004304428262939634, 'weight_decay': 4.617039591739052e-05, 'epochs': 299, 'loss': 'mse', 'optimizer': 'adam', 'graph_mode': 'off', 'use_snp_selection': True, 'num_snps': 55631}. Best is trial 102 with value: 0.1167076602043538.
[I 2025-12-05 16:24:26,848] Trial 106 finished with value: 0.10950434132845331 and parameters: {'model_type': 'mlp', 'hidden_dims': '[512, 256]', 'dropout': 0.2075575881947534, 'batch_norm': True, 'lr': 0.0002980640573016679, 'weight_decay': 5.241084222306301e-06, 'epochs': 312, 'loss': 'mse', 'optimizer': 'adam', 'graph_mode': 'off', 'use_snp_selection': True, 'num_snps': 54125}. Best is trial 102 with value: 0.1167076602043538.
[I 2025-12-05 16:24:28,642] Trial 107 finished with value: 0.09922114175171687 and parameters: {'model_type': 'mlp', 'hidden_dims': '[512, 256]', 'dropout': 0.11527214808837842, 'batch_norm': True, 'lr': 0.0005686064995028411, 'weight_decay': 6.593670003221752e-05, 'epochs': 282, 'loss': 'mae', 'optimizer': 'adam', 'graph_mode': 'off', 'use_snp_selection': False}. Best is trial 102 with value: 0.1167076602043538.
[I 2025-12-05 16:24:31,476] Trial 108 finished with value: 0.1078914147166841 and parameters: {'model_type': 'mlp', 'hidden_dims': '[512, 256]', 'dropout': 0.1876572475675924, 'batch_norm': True, 'lr': 0.0006680681259929635, 'weight_decay': 2.8662058777317043e-05, 'epochs': 319, 'loss': 'mse', 'optimizer': 'adam', 'graph_mode': 'off', 'use_snp_selection': True, 'num_snps': 48301}. Best is trial 102 with value: 0.1167076602043538.
[I 2025-12-05 16:24:34,520] Trial 109 finished with value: 0.10796262468018272 and parameters: {'model_type': 'mlp', 'hidden_dims': '[512, 256]', 'dropout': 0.16061732366887937, 'batch_norm': True, 'lr': 0.0004550027710664673, 'weight_decay': 1.6039875682147722e-05, 'epochs': 291, 'loss': 'mse', 'optimizer': 'adam', 'graph_mode': 'off', 'use_snp_selection': True, 'num_snps': 52716}. Best is trial 102 with value: 0.1167076602043538.
[I 2025-12-05 16:24:36,279] Trial 110 finished with value: 0.09804647973309044 and parameters: {'model_type': 'mlp', 'hidden_dims': '[512, 256]', 'dropout': 0.13459856829961503, 'batch_norm': True, 'lr': 0.0003522968676288733, 'weight_decay': 9.195322821144685e-06, 'epochs': 271, 'loss': 'mae', 'optimizer': 'adam', 'graph_mode': 'off', 'use_snp_selection': False}. Best is trial 102 with value: 0.1167076602043538.
[I 2025-12-05 16:24:39,375] Trial 111 finished with value: 0.11165787327707966 and parameters: {'model_type': 'mlp', 'hidden_dims': '[512, 256]', 'dropout': 0.16842280739473192, 'batch_norm': True, 'lr': 0.000321342144315272, 'weight_decay': 5.477244939727311e-06, 'epochs': 300, 'loss': 'mse', 'optimizer': 'adam', 'graph_mode': 'off', 'use_snp_selection': True, 'num_snps': 54310}. Best is trial 102 with value: 0.1167076602043538.
[I 2025-12-05 16:24:42,641] Trial 112 finished with value: 0.02883009329057512 and parameters: {'model_type': 'mlp', 'hidden_dims': '[512, 256]', 'dropout': 0.14797800884542905, 'batch_norm': True, 'lr': 5.796826742934571e-06, 'weight_decay': 5.7929561784779175e-06, 'epochs': 309, 'loss': 'mse', 'optimizer': 'adam', 'graph_mode': 'off', 'use_snp_selection': True, 'num_snps': 56778}. Best is trial 102 with value: 0.1167076602043538.
[I 2025-12-05 16:24:45,792] Trial 113 finished with value: 0.1083478824968866 and parameters: {'model_type': 'mlp', 'hidden_dims': '[512, 256]', 'dropout': 0.17290027535499736, 'batch_norm': True, 'lr': 0.0005077537136413972, 'weight_decay': 2.289928546381837e-05, 'epochs': 303, 'loss': 'mse', 'optimizer': 'adam', 'graph_mode': 'off', 'use_snp_selection': True, 'num_snps': 54515}. Best is trial 102 with value: 0.1167076602043538.
[I 2025-12-05 16:24:48,046] Trial 114 finished with value: 0.1001812474166936 and parameters: {'model_type': 'mlp', 'hidden_dims': '[512, 256]', 'dropout': 0.11339684041437811, 'batch_norm': True, 'lr': 0.00017788215663659096, 'weight_decay': 4.2464528650812625e-05, 'epochs': 324, 'loss': 'mse', 'optimizer': 'adam', 'graph_mode': 'off', 'use_snp_selection': True, 'num_snps': 34913}. Best is trial 102 with value: 0.1167076602043538.
