[I 2025-12-05 15:11:40,321] Trial 52 finished with value: 0.12869331700549744 and parameters: {'model_type': 'mlp', 'hidden_dims': '[256, 128]', 'dropout': 0.210908755950278, 'batch_norm': False, 'lr': 0.0006472971254417029, 'weight_decay': 0.00046944154313266283, 'epochs': 169, 'loss': 'mae', 'optimizer': 'adam', 'graph_mode': 'off', 'use_snp_selection': True, 'num_snps': 40140}. Best is trial 37 with value: 0.15090821081568856.
[I 2025-12-05 15:11:42,480] Trial 53 finished with value: 0.13088522297647132 and parameters: {'model_type': 'mlp', 'hidden_dims': '[256, 128]', 'dropout': 0.15261354142218367, 'batch_norm': False, 'lr': 0.0003101346881453982, 'weight_decay': 0.00015603883434535816, 'epochs': 206, 'loss': 'mae', 'optimizer': 'adam', 'graph_mode': 'off', 'use_snp_selection': True, 'num_snps': 36135}. Best is trial 37 with value: 0.15090821081568856.
[I 2025-12-05 15:11:44,503] Trial 54 finished with value: 0.1185073012250506 and parameters: {'model_type': 'mlp', 'hidden_dims': '[256, 128]', 'dropout': 0.23846861758737123, 'batch_norm': False, 'lr': 0.0004741961288104337, 'weight_decay': 8.29945585393654e-05, 'epochs': 188, 'loss': 'mae', 'optimizer': 'adam', 'graph_mode': 'off', 'use_snp_selection': True, 'num_snps': 34616}. Best is trial 37 with value: 0.15090821081568856.
[I 2025-12-05 15:11:46,767] Trial 55 finished with value: 0.09860632914217973 and parameters: {'model_type': 'mlp', 'hidden_dims': '[256, 128, 64]', 'dropout': 0.2646753839750419, 'batch_norm': False, 'lr': 2.6421267525863184e-05, 'weight_decay': 0.0009237561856728902, 'epochs': 164, 'loss': 'mae', 'optimizer': 'adam', 'graph_mode': 'off', 'use_snp_selection': True, 'num_snps': 42901}. Best is trial 37 with value: 0.15090821081568856.
[I 2025-12-05 15:11:48,490] Trial 56 finished with value: 0.1106878612513835 and parameters: {'model_type': 'mlp', 'hidden_dims': '[256, 128]', 'dropout': 0.12460727871071967, 'batch_norm': False, 'lr': 4.146896582172274e-05, 'weight_decay': 0.0002723835448922176, 'epochs': 244, 'loss': 'mae', 'optimizer': 'adam', 'graph_mode': 'off', 'use_snp_selection': True, 'num_snps': 28545}. Best is trial 37 with value: 0.15090821081568856.
[I 2025-12-05 15:11:50,952] Trial 57 finished with value: 0.12545963122868095 and parameters: {'model_type': 'mlp', 'hidden_dims': '[256, 128]', 'dropout': 0.16234924757064276, 'batch_norm': False, 'lr': 0.00016591838901644794, 'weight_decay': 5.5380578119541024e-05, 'epochs': 83, 'loss': 'mae', 'optimizer': 'adam', 'graph_mode': 'off', 'use_snp_selection': True, 'num_snps': 56295}. Best is trial 37 with value: 0.15090821081568856.
[I 2025-12-05 15:11:52,852] Trial 58 finished with value: 0.12187404633493387 and parameters: {'model_type': 'mlp', 'hidden_dims': '[256, 128]', 'dropout': 0.1917069843031233, 'batch_norm': False, 'lr': 0.0005224682891304734, 'weight_decay': 0.000519945406520214, 'epochs': 134, 'loss': 'mae', 'optimizer': 'adam', 'graph_mode': 'off', 'use_snp_selection': True, 'num_snps': 37527}. Best is trial 37 with value: 0.15090821081568856.
[I 2025-12-05 15:11:55,205] Trial 59 finished with value: 0.11563812542703317 and parameters: {'model_type': 'mlp', 'hidden_dims': '[256, 128]', 'dropout': 0.4134225673600069, 'batch_norm': False, 'lr': 0.0009701819609447676, 'weight_decay': 0.00012769896823551386, 'epochs': 208, 'loss': 'mse', 'optimizer': 'adam', 'graph_mode': 'off', 'use_snp_selection': True, 'num_snps': 45953}. Best is trial 37 with value: 0.15090821081568856.
[I 2025-12-05 15:11:58,280] Trial 60 finished with value: 0.12747012192254248 and parameters: {'model_type': 'mlp', 'hidden_dims': '[512, 64]', 'dropout': 0.30299279864444156, 'batch_norm': False, 'lr': 7.114722681503618e-05, 'weight_decay': 0.00035552462194197716, 'epochs': 226, 'loss': 'mae', 'optimizer': 'adam', 'graph_mode': 'off', 'use_snp_selection': True, 'num_snps': 49827}. Best is trial 37 with value: 0.15090821081568856.
[I 2025-12-05 15:12:00,529] Trial 61 finished with value: 0.12226505130333819 and parameters: {'model_type': 'mlp', 'hidden_dims': '[256, 128]', 'dropout': 0.2121069568753744, 'batch_norm': False, 'lr': 0.0007258690501537413, 'weight_decay': 0.0007135719860913202, 'epochs': 188, 'loss': 'mae', 'optimizer': 'adam', 'graph_mode': 'off', 'use_snp_selection': True, 'num_snps': 40234}. Best is trial 37 with value: 0.15090821081568856.
[I 2025-12-05 15:12:02,414] Trial 62 finished with value: 0.12442305094750616 and parameters: {'model_type': 'mlp', 'hidden_dims': '[256, 128]', 'dropout': 0.20015077689655839, 'batch_norm': False, 'lr': 0.0003613777919936338, 'weight_decay': 0.0008804470875321427, 'epochs': 183, 'loss': 'mae', 'optimizer': 'adam', 'graph_mode': 'off', 'use_snp_selection': True, 'num_snps': 33104}. Best is trial 37 with value: 0.15090821081568856.
[I 2025-12-05 15:12:04,437] Trial 63 finished with value: 0.14610208000548475 and parameters: {'model_type': 'mlp', 'hidden_dims': '[256, 128]', 'dropout': 0.23895950846526914, 'batch_norm': False, 'lr': 0.0005252307146498521, 'weight_decay': 0.0002088012241772275, 'epochs': 167, 'loss': 'mae', 'optimizer': 'adam', 'graph_mode': 'off', 'use_snp_selection': True, 'num_snps': 38105}. Best is trial 37 with value: 0.15090821081568856.
[I 2025-12-05 15:12:06,909] Trial 64 finished with value: 0.13346275556519419 and parameters: {'model_type': 'mlp', 'hidden_dims': '[512, 128]', 'dropout': 0.24879608886766258, 'batch_norm': False, 'lr': 0.0005065395297512278, 'weight_decay': 0.00019331081434521453, 'epochs': 266, 'loss': 'mae', 'optimizer': 'adam', 'graph_mode': 'off', 'use_snp_selection': True, 'num_snps': 37110}. Best is trial 37 with value: 0.15090821081568856.
[I 2025-12-05 15:12:08,595] Trial 65 finished with value: 0.12369965747116016 and parameters: {'model_type': 'mlp', 'hidden_dims': '[256, 128]', 'dropout': 0.22654072738524417, 'batch_norm': False, 'lr': 0.0002751131626207538, 'weight_decay': 4.5999909148802856e-05, 'epochs': 168, 'loss': 'mae', 'optimizer': 'adam', 'graph_mode': 'off', 'use_snp_selection': True, 'num_snps': 30156}. Best is trial 37 with value: 0.15090821081568856.
[I 2025-12-05 15:12:10,680] Trial 66 finished with value: 0.12487887308534616 and parameters: {'model_type': 'mlp', 'hidden_dims': '[256, 128, 64]', 'dropout': 0.27402042055483256, 'batch_norm': False, 'lr': 0.0005920209284918976, 'weight_decay': 0.00023515115548233267, 'epochs': 141, 'loss': 'mae', 'optimizer': 'adam', 'graph_mode': 'off', 'use_snp_selection': True, 'num_snps': 42001}. Best is trial 37 with value: 0.15090821081568856.
[I 2025-12-05 15:12:13,215] Trial 67 finished with value: 0.1135122688353338 and parameters: {'model_type': 'mlp', 'hidden_dims': '[256, 128]', 'dropout': 0.3574339981826177, 'batch_norm': False, 'lr': 4.7983732968635545e-05, 'weight_decay': 2.4925441157562144e-05, 'epochs': 159, 'loss': 'mae', 'optimizer': 'adam', 'graph_mode': 'off', 'use_snp_selection': True, 'num_snps': 53715}. Best is trial 37 with value: 0.15090821081568856.
[I 2025-12-05 15:12:15,854] Trial 68 finished with value: 0.146640681425342 and parameters: {'model_type': 'mlp', 'hidden_dims': '[256, 128]', 'dropout': 0.17533917774590493, 'batch_norm': False, 'lr': 0.00018973861209246458, 'weight_decay': 0.00010568518352282046, 'epochs': 295, 'loss': 'mae', 'optimizer': 'adam', 'graph_mode': 'off', 'use_snp_selection': True, 'num_snps': 44927}. Best is trial 37 with value: 0.15090821081568856.
[I 2025-12-05 15:12:18,434] Trial 69 finished with value: 0.1354329092479449 and parameters: {'model_type': 'mlp', 'hidden_dims': '[256, 128]', 'dropout': 0.13742976502217719, 'batch_norm': False, 'lr': 0.00036656208747653217, 'weight_decay': 7.595943267303811e-05, 'epochs': 297, 'loss': 'mae', 'optimizer': 'adam', 'graph_mode': 'off', 'use_snp_selection': True, 'num_snps': 45062}. Best is trial 37 with value: 0.15090821081568856.
[I 2025-12-05 15:12:21,610] Trial 70 finished with value: 0.14776006650937518 and parameters: {'model_type': 'mlp', 'hidden_dims': '[256, 128]', 'dropout': 0.11424547293167389, 'batch_norm': False, 'lr': 0.00015189931530409614, 'weight_decay': 0.00027740792646769317, 'epochs': 277, 'loss': 'mae', 'optimizer': 'adam', 'graph_mode': 'off', 'use_snp_selection': True, 'num_snps': 57340}. Best is trial 37 with value: 0.15090821081568856.
[I 2025-12-05 15:12:24,612] Trial 71 finished with value: 0.1365951374780556 and parameters: {'model_type': 'mlp', 'hidden_dims': '[256, 128]', 'dropout': 0.18363745749899685, 'batch_norm': False, 'lr': 0.0001826168596086888, 'weight_decay': 0.0003107686951259757, 'epochs': 274, 'loss': 'mae', 'optimizer': 'adam', 'graph_mode': 'off', 'use_snp_selection': True, 'num_snps': 58443}. Best is trial 37 with value: 0.15090821081568856.
[I 2025-12-05 15:12:27,547] Trial 72 finished with value: 0.13980229749645015 and parameters: {'model_type': 'mlp', 'hidden_dims': '[256, 128]', 'dropout': 0.12113021486040791, 'batch_norm': False, 'lr': 0.00027546259726832467, 'weight_decay': 0.00015072785422575762, 'epochs': 293, 'loss': 'mae', 'optimizer': 'adam', 'graph_mode': 'off', 'use_snp_selection': True, 'num_snps': 55095}. Best is trial 37 with value: 0.15090821081568856.
[I 2025-12-05 15:12:30,550] Trial 73 finished with value: 0.12582020933071358 and parameters: {'model_type': 'mlp', 'hidden_dims': '[256, 128]', 'dropout': 0.15242284639614623, 'batch_norm': False, 'lr': 0.00019963980315489666, 'weight_decay': 0.0005654822922588277, 'epochs': 317, 'loss': 'mae', 'optimizer': 'adam', 'graph_mode': 'off', 'use_snp_selection': True, 'num_snps': 50017}. Best is trial 37 with value: 0.15090821081568856.
[I 2025-12-05 15:12:34,227] Trial 74 finished with value: 0.12920134959377835 and parameters: {'model_type': 'mlp', 'hidden_dims': '[512, 128]', 'dropout': 0.17314674761226054, 'batch_norm': False, 'lr': 0.00014197015717239513, 'weight_decay': 0.0004331692879682252, 'epochs': 264, 'loss': 'mae', 'optimizer': 'adam', 'graph_mode': 'off', 'use_snp_selection': True, 'num_snps': 58952}. Best is trial 37 with value: 0.15090821081568856.
[I 2025-12-05 15:12:37,271] Trial 75 finished with value: 0.125709046499053 and parameters: {'model_type': 'mlp', 'hidden_dims': '[256, 128]', 'dropout': 0.11155107069506642, 'batch_norm': False, 'lr': 0.00022620878000810253, 'weight_decay': 0.00027701315861524247, 'epochs': 247, 'loss': 'mae', 'optimizer': 'adam', 'graph_mode': 'off', 'use_snp_selection': True, 'num_snps': 56989}. Best is trial 37 with value: 0.15090821081568856.
[I 2025-12-05 15:12:39,503] Trial 76 finished with value: 0.14412432490720994 and parameters: {'model_type': 'mlp', 'hidden_dims': '[256, 128]', 'dropout': 0.16642873744988018, 'batch_norm': False, 'lr': 0.00010093500802313598, 'weight_decay': 1.0390658631550636e-05, 'epochs': 333, 'loss': 'mae', 'optimizer': 'adam', 'graph_mode': 'off', 'use_snp_selection': True, 'num_snps': 34944}. Best is trial 37 with value: 0.15090821081568856.
[I 2025-12-05 15:12:41,620] Trial 77 finished with value: 0.12552263886679807 and parameters: {'model_type': 'mlp', 'hidden_dims': '[256, 128]', 'dropout': 0.16046625312396487, 'batch_norm': False, 'lr': 0.00010302836801388815, 'weight_decay': 4.076474161098225e-06, 'epochs': 338, 'loss': 'mse', 'optimizer': 'adam', 'graph_mode': 'off', 'use_snp_selection': True, 'num_snps': 34567}. Best is trial 37 with value: 0.15090821081568856.
[I 2025-12-05 15:12:43,087] Trial 78 finished with value: 0.1306529327624592 and parameters: {'model_type': 'mlp', 'hidden_dims': '[256, 128, 64]', 'dropout': 0.13923173315977483, 'batch_norm': False, 'lr': 0.00014556781053347737, 'weight_decay': 1.204557191041727e-05, 'epochs': 330, 'loss': 'mae', 'optimizer': 'adam', 'graph_mode': 'off', 'use_snp_selection': False}. Best is trial 37 with value: 0.15090821081568856.
[I 2025-12-05 15:12:46,109] Trial 79 finished with value: 0.1303677163538413 and parameters: {'model_type': 'mlp', 'hidden_dims': '[256, 128]', 'dropout': 0.10722603742502027, 'batch_norm': False, 'lr': 0.00011193430133429216, 'weight_decay': 7.882582133768094e-06, 'epochs': 291, 'loss': 'mae', 'optimizer': 'adam', 'graph_mode': 'off', 'use_snp_selection': True, 'num_snps': 52455}. Best is trial 37 with value: 0.15090821081568856.
[I 2025-12-05 15:12:49,473] Trial 80 finished with value: 0.12319448301122884 and parameters: {'model_type': 'mlp', 'hidden_dims': '[512, 256]', 'dropout': 0.17692287972953238, 'batch_norm': True, 'lr': 8.389971649580419e-05, 'weight_decay': 2.8502295025905792e-06, 'epochs': 314, 'loss': 'mae', 'optimizer': 'adam', 'graph_mode': 'off', 'use_snp_selection': True, 'num_snps': 47666}. Best is trial 37 with value: 0.15090821081568856.
[I 2025-12-05 15:12:51,677] Trial 81 finished with value: 0.13566681288721186 and parameters: {'model_type': 'mlp', 'hidden_dims': '[256, 128]', 'dropout': 0.188939352766645, 'batch_norm': False, 'lr': 6.884826088198031e-05, 'weight_decay': 9.491088130576202e-05, 'epochs': 276, 'loss': 'mae', 'optimizer': 'adam', 'graph_mode': 'off', 'use_snp_selection': True, 'num_snps': 37937}. Best is trial 37 with value: 0.15090821081568856.
[I 2025-12-05 15:12:53,768] Trial 82 finished with value: 0.1265500077031039 and parameters: {'model_type': 'mlp', 'hidden_dims': '[256, 128]', 'dropout': 0.21260668261380034, 'batch_norm': False, 'lr': 0.0004299113630606731, 'weight_decay': 1.0079169708913719e-05, 'epochs': 217, 'loss': 'mae', 'optimizer': 'adam', 'graph_mode': 'off', 'use_snp_selection': True, 'num_snps': 35996}. Best is trial 37 with value: 0.15090821081568856.
[I 2025-12-05 15:12:55,828] Trial 83 finished with value: 0.130238508583487 and parameters: {'model_type': 'mlp', 'hidden_dims': '[256, 128]', 'dropout': 0.1471819638203205, 'batch_norm': False, 'lr': 0.0002512236019291139, 'weight_decay': 0.00022350422629613948, 'epochs': 249, 'loss': 'mae', 'optimizer': 'adam', 'graph_mode': 'off', 'use_snp_selection': True, 'num_snps': 32620}. Best is trial 37 with value: 0.15090821081568856.
[I 2025-12-05 15:12:56,993] Trial 84 finished with value: 0.1226032862445486 and parameters: {'model_type': 'mlp', 'hidden_dims': '[256, 128]', 'dropout': 0.1683741677171841, 'batch_norm': False, 'lr': 0.0007384779876166755, 'weight_decay': 5.913844413374202e-06, 'epochs': 257, 'loss': 'mae', 'optimizer': 'adam', 'graph_mode': 'off', 'use_snp_selection': True, 'num_snps': 7841}. Best is trial 37 with value: 0.15090821081568856.
[I 2025-12-05 15:12:59,236] Trial 85 finished with value: 0.12274839463154374 and parameters: {'model_type': 'mlp', 'hidden_dims': '[128, 64]', 'dropout': 0.2407684694272171, 'batch_norm': False, 'lr': 0.00012940073530931168, 'weight_decay': 2.2826781936998635e-05, 'epochs': 283, 'loss': 'mae', 'optimizer': 'adam', 'graph_mode': 'off', 'use_snp_selection': True, 'num_snps': 44246}. Best is trial 37 with value: 0.15090821081568856.
[I 2025-12-05 15:13:01,543] Trial 86 finished with value: 0.13979602857497475 and parameters: {'model_type': 'mlp', 'hidden_dims': '[256, 128]', 'dropout': 0.11720613315260167, 'batch_norm': False, 'lr': 0.00037160582776671303, 'weight_decay': 0.0001499562450103375, 'epochs': 176, 'loss': 'mae', 'optimizer': 'adam', 'graph_mode': 'off', 'use_snp_selection': True, 'num_snps': 42255}. Best is trial 37 with value: 0.15090821081568856.
[I 2025-12-05 15:13:04,362] Trial 87 finished with value: 0.13810815811394164 and parameters: {'model_type': 'mlp', 'hidden_dims': '[512, 64]', 'dropout': 0.10030320248268641, 'batch_norm': False, 'lr': 0.00010219425682646659, 'weight_decay': 4.2058859256332776e-05, 'epochs': 332, 'loss': 'mae', 'optimizer': 'adam', 'graph_mode': 'off', 'use_snp_selection': True, 'num_snps': 38670}. Best is trial 37 with value: 0.15090821081568856.
[I 2025-12-05 15:13:05,772] Trial 88 finished with value: 0.12300334412499835 and parameters: {'model_type': 'mlp', 'hidden_dims': '[256, 128]', 'dropout': 0.1328721610454387, 'batch_norm': False, 'lr': 2.572256110694248e-06, 'weight_decay': 0.0003705995304248073, 'epochs': 299, 'loss': 'mae', 'optimizer': 'adam', 'graph_mode': 'off', 'use_snp_selection': False}. Best is trial 37 with value: 0.15090821081568856.
[I 2025-12-05 15:13:07,595] Trial 89 finished with value: 0.12787696215550398 and parameters: {'model_type': 'mlp', 'hidden_dims': '[256, 128]', 'dropout': 0.19717021324209472, 'batch_norm': False, 'lr': 0.00020008991988394495, 'weight_decay': 1.784334018723243e-05, 'epochs': 236, 'loss': 'mse', 'optimizer': 'adam', 'graph_mode': 'off', 'use_snp_selection': True, 'num_snps': 30617}. Best is trial 37 with value: 0.15090821081568856.
[I 2025-12-05 15:13:09,847] Trial 90 finished with value: 0.13260141843228299 and parameters: {'model_type': 'mlp', 'hidden_dims': '[256, 128]', 'dropout': 0.226379759237149, 'batch_norm': False, 'lr': 0.00030805306519452553, 'weight_decay': 6.673153050479798e-05, 'epochs': 281, 'loss': 'mae', 'optimizer': 'adam', 'graph_mode': 'off', 'use_snp_selection': True, 'num_snps': 40766}. Best is trial 37 with value: 0.15090821081568856.
[I 2025-12-05 15:13:12,668] Trial 91 finished with value: 0.13712528220488468 and parameters: {'model_type': 'mlp', 'hidden_dims': '[256, 128]', 'dropout': 0.12379082999741679, 'batch_norm': False, 'lr': 0.000277672753381491, 'weight_decay': 0.00014356152000478175, 'epochs': 296, 'loss': 'mae', 'optimizer': 'adam', 'graph_mode': 'off', 'use_snp_selection': True, 'num_snps': 54267}. Best is trial 37 with value: 0.15090821081568856.
[I 2025-12-05 15:13:15,630] Trial 92 finished with value: 0.1281673382500239 and parameters: {'model_type': 'mlp', 'hidden_dims': '[256, 128]', 'dropout': 0.15106580600215877, 'batch_norm': False, 'lr': 0.0005438748470526269, 'weight_decay': 9.567721147304429e-05, 'epochs': 290, 'loss': 'mae', 'optimizer': 'adam', 'graph_mode': 'off', 'use_snp_selection': True, 'num_snps': 56963}. Best is trial 37 with value: 0.15090821081568856.
[I 2025-12-05 15:13:18,662] Trial 93 finished with value: 0.1247650452618792 and parameters: {'model_type': 'mlp', 'hidden_dims': '[256, 128]', 'dropout': 0.1611689961493048, 'batch_norm': False, 'lr': 0.0004398068820474365, 'weight_decay': 0.0002046985784024612, 'epochs': 271, 'loss': 'mae', 'optimizer': 'adam', 'graph_mode': 'off', 'use_snp_selection': True, 'num_snps': 55342}. Best is trial 37 with value: 0.15090821081568856.
[I 2025-12-05 15:13:21,472] Trial 94 finished with value: 0.13026110889928363 and parameters: {'model_type': 'mlp', 'hidden_dims': '[256, 128]', 'dropout': 0.11853726686919601, 'batch_norm': False, 'lr': 0.00015935378784108503, 'weight_decay': 0.00011464338330770095, 'epochs': 306, 'loss': 'mae', 'optimizer': 'adam', 'graph_mode': 'off', 'use_snp_selection': True, 'num_snps': 50445}. Best is trial 37 with value: 0.15090821081568856.
[I 2025-12-05 15:13:24,381] Trial 95 finished with value: 0.12660013998451478 and parameters: {'model_type': 'mlp', 'hidden_dims': '[256, 128]', 'dropout': 0.2615127349347654, 'batch_norm': False, 'lr': 0.000322047843757203, 'weight_decay': 0.00016003416355066767, 'epochs': 348, 'loss': 'mae', 'optimizer': 'adam', 'graph_mode': 'off', 'use_snp_selection': True, 'num_snps': 52989}. Best is trial 37 with value: 0.15090821081568856.
[I 2025-12-05 15:13:26,458] Trial 96 finished with value: 0.10842885674839917 and parameters: {'model_type': 'mlp', 'hidden_dims': '[256, 128]', 'dropout': 0.20315441688225946, 'batch_norm': False, 'lr': 0.0007700913825398444, 'weight_decay': 0.0006976034529516677, 'epochs': 259, 'loss': 'mae', 'optimizer': 'adam', 'graph_mode': 'off', 'use_snp_selection': True, 'num_snps': 35713}. Best is trial 37 with value: 0.15090821081568856.
[I 2025-12-05 15:13:29,901] Trial 97 finished with value: 0.1258062410946719 and parameters: {'model_type': 'mlp', 'hidden_dims': '[512, 128]', 'dropout': 0.2160332666325107, 'batch_norm': True, 'lr': 0.00025384320723617594, 'weight_decay': 0.00027956029564615967, 'epochs': 286, 'loss': 'mae', 'optimizer': 'adam', 'graph_mode': 'off', 'use_snp_selection': True, 'num_snps': 55379}. Best is trial 37 with value: 0.15090821081568856.
[I 2025-12-05 15:13:31,960] Trial 98 finished with value: 0.1381473531563025 and parameters: {'model_type': 'mlp', 'hidden_dims': '[256, 128]', 'dropout': 0.1312297838041728, 'batch_norm': False, 'lr': 9.400553589998703e-05, 'weight_decay': 2.8492127095969265e-05, 'epochs': 322, 'loss': 'mae', 'optimizer': 'adam', 'graph_mode': 'off', 'use_snp_selection': True, 'num_snps': 33826}. Best is trial 37 with value: 0.15090821081568856.
[I 2025-12-05 15:13:35,516] Trial 99 finished with value: 0.14641595331329596 and parameters: {'model_type': 'mlp', 'hidden_dims': '[512, 256]', 'dropout': 0.17693551963072407, 'batch_norm': False, 'lr': 0.0003803989893087878, 'weight_decay': 0.00038326710558289265, 'epochs': 202, 'loss': 'mae', 'optimizer': 'adam', 'graph_mode': 'off', 'use_snp_selection': True, 'num_snps': 59896}. Best is trial 37 with value: 0.15090821081568856.
[I 2025-12-05 15:13:39,011] Trial 100 finished with value: 0.1418064770487203 and parameters: {'model_type': 'mlp', 'hidden_dims': '[512, 256]', 'dropout': 0.18039391142845423, 'batch_norm': False, 'lr': 0.00040347971364702075, 'weight_decay': 0.0004485244728053221, 'epochs': 213, 'loss': 'mae', 'optimizer': 'adam', 'graph_mode': 'off', 'use_snp_selection': True, 'num_snps': 59707}. Best is trial 37 with value: 0.15090821081568856.
[I 2025-12-05 15:13:42,281] Trial 101 finished with value: 0.11479481140185009 and parameters: {'model_type': 'mlp', 'hidden_dims': '[512, 256]', 'dropout': 0.18288144961439784, 'batch_norm': False, 'lr': 0.0006133125334410266, 'weight_decay': 0.0004737892130604834, 'epochs': 190, 'loss': 'mae', 'optimizer': 'adam', 'graph_mode': 'off', 'use_snp_selection': True, 'num_snps': 59705}. Best is trial 37 with value: 0.15090821081568856.
