[I 2025-12-05 16:15:34,256] Trial 117 finished with value: 0.131023838390552 and parameters: {'model_type': 'mlp', 'hidden_dims': '[512, 256]', 'dropout': 0.2624768771812359, 'batch_norm': True, 'lr': 0.0005167238773248191, 'weight_decay': 2.9080743344446356e-06, 'epochs': 181, 'loss': 'mse', 'optimizer': 'adam', 'graph_mode': 'off', 'use_snp_selection': False}. Best is trial 100 with value: 0.14338910092999496.
[I 2025-12-05 16:15:35,265] Trial 118 finished with value: 0.14177407914338314 and parameters: {'model_type': 'mlp', 'hidden_dims': '[256, 128, 64]', 'dropout': 0.17495523368288643, 'batch_norm': True, 'lr': 0.0003661059867782947, 'weight_decay': 4.884097833208346e-07, 'epochs': 144, 'loss': 'mse', 'optimizer': 'adam', 'graph_mode': 'off', 'use_snp_selection': False}. Best is trial 100 with value: 0.14338910092999496.
[I 2025-12-05 16:15:36,264] Trial 119 finished with value: 0.12321574949827714 and parameters: {'model_type': 'mlp', 'hidden_dims': '[256, 128, 64]', 'dropout': 0.25292455906830563, 'batch_norm': True, 'lr': 0.0003730388887294508, 'weight_decay': 4.842744159304484e-07, 'epochs': 149, 'loss': 'mse', 'optimizer': 'adam', 'graph_mode': 'off', 'use_snp_selection': False}. Best is trial 100 with value: 0.14338910092999496.
[I 2025-12-05 16:15:37,341] Trial 120 finished with value: 0.13724339027613122 and parameters: {'model_type': 'mlp', 'hidden_dims': '[256, 128, 64]', 'dropout': 0.19156522688583338, 'batch_norm': True, 'lr': 0.00013753432557061525, 'weight_decay': 9.020792484536909e-07, 'epochs': 164, 'loss': 'mse', 'optimizer': 'adam', 'graph_mode': 'off', 'use_snp_selection': False}. Best is trial 100 with value: 0.14338910092999496.
[I 2025-12-05 16:15:38,427] Trial 121 finished with value: 0.1342834682875607 and parameters: {'model_type': 'mlp', 'hidden_dims': '[256, 128, 64]', 'dropout': 0.19119803518621103, 'batch_norm': True, 'lr': 0.00012783585427548924, 'weight_decay': 2.819487332461824e-07, 'epochs': 162, 'loss': 'mse', 'optimizer': 'adam', 'graph_mode': 'off', 'use_snp_selection': False}. Best is trial 100 with value: 0.14338910092999496.
[I 2025-12-05 16:15:39,523] Trial 122 finished with value: 0.11775033958733944 and parameters: {'model_type': 'mlp', 'hidden_dims': '[256, 128, 64]', 'dropout': 0.215904512511708, 'batch_norm': True, 'lr': 0.00018638568964444034, 'weight_decay': 9.186981297339074e-07, 'epochs': 171, 'loss': 'mse', 'optimizer': 'adam', 'graph_mode': 'off', 'use_snp_selection': False}. Best is trial 100 with value: 0.14338910092999496.
[I 2025-12-05 16:15:40,578] Trial 123 finished with value: 0.1319351416798036 and parameters: {'model_type': 'mlp', 'hidden_dims': '[256, 128, 64]', 'dropout': 0.16761341601311616, 'batch_norm': True, 'lr': 0.00022868054312491734, 'weight_decay': 1.1482545268489658e-06, 'epochs': 154, 'loss': 'mse', 'optimizer': 'adam', 'graph_mode': 'off', 'use_snp_selection': False}. Best is trial 100 with value: 0.14338910092999496.
[I 2025-12-05 16:15:41,707] Trial 124 finished with value: 0.11012490910884892 and parameters: {'model_type': 'mlp', 'hidden_dims': '[256, 128, 64]', 'dropout': 0.17719574899759485, 'batch_norm': True, 'lr': 0.00016712006779028243, 'weight_decay': 6.320848684818611e-07, 'epochs': 199, 'loss': 'mse', 'optimizer': 'adam', 'graph_mode': 'off', 'use_snp_selection': False}. Best is trial 100 with value: 0.14338910092999496.
[I 2025-12-05 16:15:43,021] Trial 125 finished with value: 0.12063348417527164 and parameters: {'model_type': 'mlp', 'hidden_dims': '[256, 128, 64]', 'dropout': 0.1976343390807378, 'batch_norm': True, 'lr': 0.00014640546221165838, 'weight_decay': 1.3894988682009856e-06, 'epochs': 276, 'loss': 'mse', 'optimizer': 'adam', 'graph_mode': 'off', 'use_snp_selection': False}. Best is trial 100 with value: 0.14338910092999496.
[I 2025-12-05 16:15:44,148] Trial 126 finished with value: 0.10395660189895041 and parameters: {'model_type': 'mlp', 'hidden_dims': '[256, 128, 64]', 'dropout': 0.13658981448102012, 'batch_norm': True, 'lr': 0.00010385151754138874, 'weight_decay': 8.397475552639879e-07, 'epochs': 181, 'loss': 'mae', 'optimizer': 'adam', 'graph_mode': 'off', 'use_snp_selection': False}. Best is trial 100 with value: 0.14338910092999496.
[I 2025-12-05 16:15:47,125] Trial 127 finished with value: 0.12665077432944383 and parameters: {'model_type': 'mlp', 'hidden_dims': '[512, 128]', 'dropout': 0.15588651935594525, 'batch_norm': True, 'lr': 0.00045050621614038455, 'weight_decay': 1.7474996500216667e-06, 'epochs': 312, 'loss': 'mse', 'optimizer': 'adam', 'graph_mode': 'off', 'use_snp_selection': True, 'num_snps': 43422}. Best is trial 100 with value: 0.14338910092999496.
[I 2025-12-05 16:15:47,912] Trial 128 finished with value: 0.12280405778473652 and parameters: {'model_type': 'mlp', 'hidden_dims': '[128, 64]', 'dropout': 0.1878256722991323, 'batch_norm': True, 'lr': 0.00029605322473913096, 'weight_decay': 2.433508917842083e-07, 'epochs': 145, 'loss': 'mse', 'optimizer': 'adam', 'graph_mode': 'off', 'use_snp_selection': False}. Best is trial 100 with value: 0.14338910092999496.
[I 2025-12-05 16:15:48,872] Trial 129 finished with value: 0.1364676553862256 and parameters: {'model_type': 'mlp', 'hidden_dims': '[256, 128, 64]', 'dropout': 0.11246341579227093, 'batch_norm': True, 'lr': 0.00021351359970241964, 'weight_decay': 4.062984449680954e-07, 'epochs': 124, 'loss': 'mse', 'optimizer': 'adam', 'graph_mode': 'off', 'use_snp_selection': False}. Best is trial 100 with value: 0.14338910092999496.
[I 2025-12-05 16:15:49,595] Trial 130 finished with value: 0.13748541150856247 and parameters: {'model_type': 'mlp', 'hidden_dims': '[128, 64]', 'dropout': 0.20497625335769093, 'batch_norm': True, 'lr': 0.00031505866619436075, 'weight_decay': 3.336346872333762e-07, 'epochs': 102, 'loss': 'mse', 'optimizer': 'adam', 'graph_mode': 'off', 'use_snp_selection': False}. Best is trial 100 with value: 0.14338910092999496.
[I 2025-12-05 16:15:50,341] Trial 131 finished with value: 0.1111021384010715 and parameters: {'model_type': 'mlp', 'hidden_dims': '[128, 64]', 'dropout': 0.22469036466668618, 'batch_norm': True, 'lr': 0.0003382902280956834, 'weight_decay': 0.0001049266817300017, 'epochs': 93, 'loss': 'mse', 'optimizer': 'adam', 'graph_mode': 'off', 'use_snp_selection': False}. Best is trial 100 with value: 0.14338910092999496.
[I 2025-12-05 16:15:51,110] Trial 132 finished with value: 0.12382597171507531 and parameters: {'model_type': 'mlp', 'hidden_dims': '[128, 64]', 'dropout': 0.20646325332198814, 'batch_norm': True, 'lr': 0.0002567255507342512, 'weight_decay': 3.282978180227567e-07, 'epochs': 104, 'loss': 'mse', 'optimizer': 'adam', 'graph_mode': 'off', 'use_snp_selection': False}. Best is trial 100 with value: 0.14338910092999496.
[I 2025-12-05 16:15:51,873] Trial 133 finished with value: 0.1355491774195902 and parameters: {'model_type': 'mlp', 'hidden_dims': '[128, 64]', 'dropout': 0.16870467021065041, 'batch_norm': True, 'lr': 0.00040952533427418217, 'weight_decay': 5.203253421478657e-07, 'epochs': 101, 'loss': 'mse', 'optimizer': 'adam', 'graph_mode': 'off', 'use_snp_selection': False}. Best is trial 100 with value: 0.14338910092999496.
[I 2025-12-05 16:15:52,642] Trial 134 finished with value: 0.06277092962105574 and parameters: {'model_type': 'mlp', 'hidden_dims': '[128, 64]', 'dropout': 0.20382406357601202, 'batch_norm': True, 'lr': 1.616458672429446e-05, 'weight_decay': 2.2188177708630166e-07, 'epochs': 113, 'loss': 'mse', 'optimizer': 'adam', 'graph_mode': 'off', 'use_snp_selection': False}. Best is trial 100 with value: 0.14338910092999496.
[I 2025-12-05 16:15:53,503] Trial 135 finished with value: 0.1106332818614361 and parameters: {'model_type': 'mlp', 'hidden_dims': '[128, 64]', 'dropout': 0.1444936695263883, 'batch_norm': True, 'lr': 0.00014040536535126397, 'weight_decay': 6.829672652730694e-07, 'epochs': 187, 'loss': 'mse', 'optimizer': 'adam', 'graph_mode': 'off', 'use_snp_selection': False}. Best is trial 100 with value: 0.14338910092999496.
[I 2025-12-05 16:15:54,750] Trial 136 finished with value: 0.12637811379542044 and parameters: {'model_type': 'mlp', 'hidden_dims': '[256, 128]', 'dropout': 0.1839216747368123, 'batch_norm': True, 'lr': 0.0003077225036778742, 'weight_decay': 4.485237625449451e-07, 'epochs': 254, 'loss': 'mse', 'optimizer': 'adam', 'graph_mode': 'off', 'use_snp_selection': False}. Best is trial 100 with value: 0.14338910092999496.
[I 2025-12-05 16:15:55,873] Trial 137 finished with value: 0.1262548048394862 and parameters: {'model_type': 'mlp', 'hidden_dims': '[256, 128, 64]', 'dropout': 0.3405896129352311, 'batch_norm': True, 'lr': 0.00017591136073235512, 'weight_decay': 1.7864643102853244e-07, 'epochs': 177, 'loss': 'mse', 'optimizer': 'adam', 'graph_mode': 'off', 'use_snp_selection': False}. Best is trial 100 with value: 0.14338910092999496.
[I 2025-12-05 16:15:58,196] Trial 138 finished with value: 0.11079196545146434 and parameters: {'model_type': 'mlp', 'hidden_dims': '[128, 64]', 'dropout': 0.2177557878805928, 'batch_norm': False, 'lr': 9.561326738572301e-05, 'weight_decay': 2.819378577128964e-07, 'epochs': 165, 'loss': 'mse', 'optimizer': 'adam', 'graph_mode': 'off', 'use_snp_selection': True, 'num_snps': 49313}. Best is trial 100 with value: 0.14338910092999496.
[I 2025-12-05 16:15:59,891] Trial 139 finished with value: 0.1320541906784523 and parameters: {'model_type': 'mlp', 'hidden_dims': '[512, 256]', 'dropout': 0.12623688610411204, 'batch_norm': True, 'lr': 0.00011834757195554446, 'weight_decay': 8.918432534761337e-07, 'epochs': 194, 'loss': 'mse', 'optimizer': 'adam', 'graph_mode': 'off', 'use_snp_selection': False}. Best is trial 100 with value: 0.14338910092999496.
[I 2025-12-05 16:16:00,754] Trial 140 finished with value: 0.10536977098675533 and parameters: {'model_type': 'mlp', 'hidden_dims': '[128, 64]', 'dropout': 0.28099951797400624, 'batch_norm': True, 'lr': 4.179851570650054e-05, 'weight_decay': 5.629418134169833e-07, 'epochs': 203, 'loss': 'mse', 'optimizer': 'adam', 'graph_mode': 'off', 'use_snp_selection': False}. Best is trial 100 with value: 0.14338910092999496.
[I 2025-12-05 16:16:01,701] Trial 141 finished with value: 0.12036324436637723 and parameters: {'model_type': 'mlp', 'hidden_dims': '[256, 128, 64]', 'dropout': 0.10016275908356768, 'batch_norm': True, 'lr': 0.00020077984237623677, 'weight_decay': 3.712161320976747e-07, 'epochs': 124, 'loss': 'mse', 'optimizer': 'adam', 'graph_mode': 'off', 'use_snp_selection': False}. Best is trial 100 with value: 0.14338910092999496.
[I 2025-12-05 16:16:02,688] Trial 142 finished with value: 0.11162638007086767 and parameters: {'model_type': 'mlp', 'hidden_dims': '[256, 128, 64]', 'dropout': 0.11327338799487922, 'batch_norm': True, 'lr': 0.00022036056962069717, 'weight_decay': 4.1329281464973844e-07, 'epochs': 124, 'loss': 'mse', 'optimizer': 'adam', 'graph_mode': 'off', 'use_snp_selection': False}. Best is trial 100 with value: 0.14338910092999496.
[I 2025-12-05 16:16:03,650] Trial 143 finished with value: 0.11677929209619425 and parameters: {'model_type': 'mlp', 'hidden_dims': '[256, 128, 64]', 'dropout': 0.11068862768472978, 'batch_norm': True, 'lr': 0.00024876152310946326, 'weight_decay': 7.718927133236191e-07, 'epochs': 111, 'loss': 'mse', 'optimizer': 'adam', 'graph_mode': 'off', 'use_snp_selection': False}. Best is trial 100 with value: 0.14338910092999496.
[I 2025-12-05 16:16:04,614] Trial 144 finished with value: 0.11004809956057132 and parameters: {'model_type': 'mlp', 'hidden_dims': '[256, 128, 64]', 'dropout': 0.5487495397493094, 'batch_norm': True, 'lr': 0.00036500785119928346, 'weight_decay': 3.175315374641613e-07, 'epochs': 119, 'loss': 'mse', 'optimizer': 'adam', 'graph_mode': 'off', 'use_snp_selection': False}. Best is trial 100 with value: 0.14338910092999496.
[I 2025-12-05 16:16:05,614] Trial 145 finished with value: 0.11465774237854598 and parameters: {'model_type': 'mlp', 'hidden_dims': '[256, 128, 64]', 'dropout': 0.13536530934022362, 'batch_norm': True, 'lr': 0.00021031217729688682, 'weight_decay': 1.4180793712745803e-07, 'epochs': 132, 'loss': 'mse', 'optimizer': 'adam', 'graph_mode': 'off', 'use_snp_selection': False}. Best is trial 100 with value: 0.14338910092999496.
[I 2025-12-05 16:16:06,410] Trial 146 finished with value: 0.0737527057988284 and parameters: {'model_type': 'mlp', 'hidden_dims': '[128, 64]', 'dropout': 0.15803547348328822, 'batch_norm': True, 'lr': 2.6741799409323544e-06, 'weight_decay': 2.357864535122485e-07, 'epochs': 156, 'loss': 'mse', 'optimizer': 'adam', 'graph_mode': 'off', 'use_snp_selection': False}. Best is trial 100 with value: 0.14338910092999496.
[I 2025-12-05 16:16:07,483] Trial 147 finished with value: 0.12183080677783344 and parameters: {'model_type': 'mlp', 'hidden_dims': '[256, 128, 64]', 'dropout': 0.12116661390104116, 'batch_norm': True, 'lr': 0.00016022366917112956, 'weight_decay': 4.916176508275756e-07, 'epochs': 174, 'loss': 'mae', 'optimizer': 'adam', 'graph_mode': 'off', 'use_snp_selection': False}. Best is trial 100 with value: 0.14338910092999496.
[I 2025-12-05 16:16:09,652] Trial 148 finished with value: 0.12837386581205212 and parameters: {'model_type': 'mlp', 'hidden_dims': '[256, 128]', 'dropout': 0.14935435628625995, 'batch_norm': True, 'lr': 0.0004891528710545823, 'weight_decay': 1.000805708083129e-06, 'epochs': 140, 'loss': 'mse', 'optimizer': 'adam', 'graph_mode': 'off', 'use_snp_selection': True, 'num_snps': 44558}. Best is trial 100 with value: 0.14338910092999496.
[I 2025-12-05 16:16:10,422] Trial 149 finished with value: 0.06244410054476032 and parameters: {'model_type': 'mlp', 'hidden_dims': '[128, 64]', 'dropout': 0.17770588797653672, 'batch_norm': True, 'lr': 8.601899539417852e-06, 'weight_decay': 3.7929081152191257e-07, 'epochs': 100, 'loss': 'mse', 'optimizer': 'adam', 'graph_mode': 'off', 'use_snp_selection': False}. Best is trial 100 with value: 0.14338910092999496.
[I 2025-12-05 16:16:12,696] Trial 0 finished with value: -0.03268191260362638 and parameters: {'model_type': 'mlp', 'hidden_dims': '[128, 64]', 'dropout': 0.199031432379812, 'batch_norm': True, 'lr': 1.8408544111075837e-06, 'weight_decay': 5.5136510071208614e-05, 'epochs': 336, 'loss': 'mae', 'optimizer': 'adam', 'graph_mode': 'off', 'use_snp_selection': True, 'num_snps': 43862}. Best is trial 0 with value: -0.03268191260362638.
[I 2025-12-05 16:16:13,813] Trial 1 finished with value: 0.07986312925248822 and parameters: {'model_type': 'mlp', 'hidden_dims': '[256, 128]', 'dropout': 0.4370668075331726, 'batch_norm': True, 'lr': 7.133471581159139e-05, 'weight_decay': 1.128633586803549e-05, 'epochs': 242, 'loss': 'mae', 'optimizer': 'adam', 'graph_mode': 'off', 'use_snp_selection': False}. Best is trial 1 with value: 0.07986312925248822.
[I 2025-12-05 16:16:14,812] Trial 2 finished with value: 0.041304675533533626 and parameters: {'model_type': 'mlp', 'hidden_dims': '[256, 128, 64]', 'dropout': 0.41314357415569625, 'batch_norm': False, 'lr': 3.952233718592101e-06, 'weight_decay': 0.00026754769258252603, 'epochs': 149, 'loss': 'mse', 'optimizer': 'adam', 'graph_mode': 'off', 'use_snp_selection': True, 'num_snps': 11571}. Best is trial 1 with value: 0.07986312925248822.
[I 2025-12-05 16:16:16,789] Trial 3 finished with value: 0.062066380856620494 and parameters: {'model_type': 'mlp', 'hidden_dims': '[512, 64]', 'dropout': 0.5938127374509361, 'batch_norm': False, 'lr': 5.67704586114731e-06, 'weight_decay': 2.4518087630137052e-05, 'epochs': 320, 'loss': 'mae', 'optimizer': 'adam', 'graph_mode': 'off', 'use_snp_selection': False}. Best is trial 1 with value: 0.07986312925248822.
[I 2025-12-05 16:16:19,047] Trial 4 finished with value: 0.015843535877282804 and parameters: {'model_type': 'mlp', 'hidden_dims': '[512, 128]', 'dropout': 0.25746343592134413, 'batch_norm': True, 'lr': 1.3467657668402788e-06, 'weight_decay': 0.00033087251918647806, 'epochs': 277, 'loss': 'mse', 'optimizer': 'adam', 'graph_mode': 'off', 'use_snp_selection': True, 'num_snps': 36675}. Best is trial 1 with value: 0.07986312925248822.
[I 2025-12-05 16:16:20,757] Trial 5 finished with value: 0.044462000297770594 and parameters: {'model_type': 'mlp', 'hidden_dims': '[512, 64]', 'dropout': 0.38275350994408375, 'batch_norm': True, 'lr': 1.5586664309232824e-06, 'weight_decay': 0.0008227664668621182, 'epochs': 145, 'loss': 'mae', 'optimizer': 'adam', 'graph_mode': 'off', 'use_snp_selection': True, 'num_snps': 32148}. Best is trial 1 with value: 0.07986312925248822.
[I 2025-12-05 16:16:21,754] Trial 6 finished with value: 0.09761371490930695 and parameters: {'model_type': 'mlp', 'hidden_dims': '[256, 128]', 'dropout': 0.3930109900265879, 'batch_norm': False, 'lr': 4.892964372128395e-05, 'weight_decay': 1.5809549317992182e-06, 'epochs': 199, 'loss': 'mse', 'optimizer': 'adam', 'graph_mode': 'off', 'use_snp_selection': False}. Best is trial 6 with value: 0.09761371490930695.
[I 2025-12-05 16:16:22,886] Trial 7 finished with value: 0.09751765851211497 and parameters: {'model_type': 'mlp', 'hidden_dims': '[512, 256]', 'dropout': 0.15343979219678458, 'batch_norm': True, 'lr': 6.234003099047341e-05, 'weight_decay': 3.894760610535477e-07, 'epochs': 97, 'loss': 'mse', 'optimizer': 'adam', 'graph_mode': 'off', 'use_snp_selection': False}. Best is trial 6 with value: 0.09761371490930695.
[I 2025-12-05 16:16:24,823] Trial 8 finished with value: 0.1064805549432652 and parameters: {'model_type': 'mlp', 'hidden_dims': '[512, 128]', 'dropout': 0.10743001231661406, 'batch_norm': True, 'lr': 0.00023728538449271062, 'weight_decay': 1.7629071578048637e-05, 'epochs': 312, 'loss': 'mae', 'optimizer': 'adam', 'graph_mode': 'off', 'use_snp_selection': False}. Best is trial 8 with value: 0.1064805549432652.
[I 2025-12-05 16:16:26,247] Trial 9 finished with value: 0.08754758754111176 and parameters: {'model_type': 'mlp', 'hidden_dims': '[512, 64]', 'dropout': 0.14505336736221927, 'batch_norm': True, 'lr': 5.8619638388111826e-05, 'weight_decay': 6.200156172669308e-07, 'epochs': 175, 'loss': 'mse', 'optimizer': 'adam', 'graph_mode': 'off', 'use_snp_selection': False}. Best is trial 8 with value: 0.1064805549432652.
[I 2025-12-05 16:16:27,184] Trial 10 finished with value: 0.022671905797237657 and parameters: {'model_type': 'mlp', 'hidden_dims': '[512, 128]', 'dropout': 0.2800030442581858, 'batch_norm': False, 'lr': 0.0004919806695968258, 'weight_decay': 2.9953888095455486e-06, 'epochs': 55, 'loss': 'mae', 'optimizer': 'adam', 'graph_mode': 'off', 'use_snp_selection': False}. Best is trial 8 with value: 0.1064805549432652.
[I 2025-12-05 16:16:28,290] Trial 11 finished with value: 0.10066390340449344 and parameters: {'model_type': 'mlp', 'hidden_dims': '[256, 128]', 'dropout': 0.5025533409127559, 'batch_norm': False, 'lr': 0.00034089430505247417, 'weight_decay': 2.512571353186099e-06, 'epochs': 239, 'loss': 'mse', 'optimizer': 'adam', 'graph_mode': 'off', 'use_snp_selection': False}. Best is trial 8 with value: 0.1064805549432652.
[I 2025-12-05 16:16:30,062] Trial 12 finished with value: 0.05562639710464528 and parameters: {'model_type': 'mlp', 'hidden_dims': '[512, 128]', 'dropout': 0.5266996967984326, 'batch_norm': False, 'lr': 0.0006674532614549997, 'weight_decay': 1.3081036432574914e-07, 'epochs': 268, 'loss': 'mae', 'optimizer': 'adam', 'graph_mode': 'off', 'use_snp_selection': False}. Best is trial 8 with value: 0.1064805549432652.
[I 2025-12-05 16:16:31,180] Trial 13 finished with value: 0.09547524884079422 and parameters: {'model_type': 'mlp', 'hidden_dims': '[256, 128]', 'dropout': 0.4928303937946425, 'batch_norm': False, 'lr': 0.00023284399572303963, 'weight_decay': 5.19148481099927e-06, 'epochs': 229, 'loss': 'mse', 'optimizer': 'adam', 'graph_mode': 'off', 'use_snp_selection': False}. Best is trial 8 with value: 0.1064805549432652.
[I 2025-12-05 16:16:33,069] Trial 14 finished with value: 0.1102885927402421 and parameters: {'model_type': 'mlp', 'hidden_dims': '[512, 256]', 'dropout': 0.3136114216535987, 'batch_norm': True, 'lr': 0.0002108574938852793, 'weight_decay': 5.724103314313124e-05, 'epochs': 303, 'loss': 'mse', 'optimizer': 'adam', 'graph_mode': 'off', 'use_snp_selection': False}. Best is trial 14 with value: 0.1102885927402421.
[I 2025-12-05 16:16:34,980] Trial 15 finished with value: 0.10088224036582794 and parameters: {'model_type': 'mlp', 'hidden_dims': '[512, 256]', 'dropout': 0.31375028567868374, 'batch_norm': True, 'lr': 0.0001572871022003765, 'weight_decay': 6.682546297843178e-05, 'epochs': 302, 'loss': 'mae', 'optimizer': 'adam', 'graph_mode': 'off', 'use_snp_selection': False}. Best is trial 14 with value: 0.1102885927402421.
[I 2025-12-05 16:16:37,083] Trial 16 finished with value: 0.1003171546693053 and parameters: {'model_type': 'mlp', 'hidden_dims': '[512, 256]', 'dropout': 0.11265306434676485, 'batch_norm': True, 'lr': 1.2586985041154999e-05, 'weight_decay': 0.00010816133680779602, 'epochs': 350, 'loss': 'mse', 'optimizer': 'adam', 'graph_mode': 'off', 'use_snp_selection': False}. Best is trial 14 with value: 0.1102885927402421.
[I 2025-12-05 16:16:38,086] Trial 17 finished with value: 0.11165915104902292 and parameters: {'model_type': 'mlp', 'hidden_dims': '[128, 64]', 'dropout': 0.21589416881380946, 'batch_norm': True, 'lr': 0.000906375209920231, 'weight_decay': 1.5056854160235808e-05, 'epochs': 287, 'loss': 'mae', 'optimizer': 'adam', 'graph_mode': 'off', 'use_snp_selection': False}. Best is trial 17 with value: 0.11165915104902292.
[I 2025-12-05 16:16:40,644] Trial 18 finished with value: 0.11672009829385534 and parameters: {'model_type': 'mlp', 'hidden_dims': '[128, 64]', 'dropout': 0.2312628506238401, 'batch_norm': True, 'lr': 0.0009890727022070175, 'weight_decay': 2.9530126315155672e-05, 'epochs': 280, 'loss': 'mae', 'optimizer': 'adam', 'graph_mode': 'off', 'use_snp_selection': True, 'num_snps': 58241}. Best is trial 18 with value: 0.11672009829385534.
