[I 2025-12-05 16:13:12,878] Trial 13 finished with value: 0.06000777452213646 and parameters: {'model_type': 'mlp', 'hidden_dims': '[128, 64]', 'dropout': 0.22096278001553593, 'batch_norm': True, 'lr': 1.3373175420781734e-05, 'weight_decay': 2.1978369390547452e-06, 'epochs': 147, 'loss': 'mse', 'optimizer': 'adam', 'graph_mode': 'off', 'use_snp_selection': False}. Best is trial 9 with value: 0.13656639352650343.
[I 2025-12-05 16:13:14,138] Trial 14 finished with value: 0.138775629550442 and parameters: {'model_type': 'mlp', 'hidden_dims': '[256, 128, 64]', 'dropout': 0.31612449728949465, 'batch_norm': True, 'lr': 0.0008980959006851178, 'weight_decay': 5.631894527472498e-07, 'epochs': 254, 'loss': 'mse', 'optimizer': 'adam', 'graph_mode': 'off', 'use_snp_selection': False}. Best is trial 14 with value: 0.138775629550442.
[I 2025-12-05 16:13:15,415] Trial 15 finished with value: 0.12300214385746856 and parameters: {'model_type': 'mlp', 'hidden_dims': '[256, 128, 64]', 'dropout': 0.3119445805815422, 'batch_norm': True, 'lr': 0.0001572871022003765, 'weight_decay': 3.902725566902971e-07, 'epochs': 260, 'loss': 'mse', 'optimizer': 'adam', 'graph_mode': 'off', 'use_snp_selection': False}. Best is trial 14 with value: 0.138775629550442.
[I 2025-12-05 16:13:16,430] Trial 16 finished with value: 0.058751762507388686 and parameters: {'model_type': 'mlp', 'hidden_dims': '[256, 128, 64]', 'dropout': 0.49955971038069424, 'batch_norm': True, 'lr': 2.1517090787442848e-05, 'weight_decay': 1.0684657338197165e-07, 'epochs': 159, 'loss': 'mse', 'optimizer': 'adam', 'graph_mode': 'off', 'use_snp_selection': False}. Best is trial 14 with value: 0.138775629550442.
[I 2025-12-05 16:13:18,506] Trial 17 finished with value: 0.11679053212183467 and parameters: {'model_type': 'mlp', 'hidden_dims': '[512, 256]', 'dropout': 0.32888830259108426, 'batch_norm': True, 'lr': 0.00011211243661860934, 'weight_decay': 5.096749530682285e-07, 'epochs': 286, 'loss': 'mse', 'optimizer': 'adam', 'graph_mode': 'off', 'use_snp_selection': False}. Best is trial 14 with value: 0.138775629550442.
[I 2025-12-05 16:13:21,231] Trial 18 finished with value: 0.07945410427913585 and parameters: {'model_type': 'mlp', 'hidden_dims': '[256, 128, 64]', 'dropout': 0.5098431992326697, 'batch_norm': False, 'lr': 0.0009810476770103049, 'weight_decay': 5.399175074092964e-06, 'epochs': 231, 'loss': 'mse', 'optimizer': 'adam', 'graph_mode': 'off', 'use_snp_selection': True, 'num_snps': 58241}. Best is trial 14 with value: 0.138775629550442.
[I 2025-12-05 16:13:22,513] Trial 19 finished with value: 0.06939972694226926 and parameters: {'model_type': 'mlp', 'hidden_dims': '[512, 64]', 'dropout': 0.18625362219272576, 'batch_norm': True, 'lr': 1.2907909326183886e-05, 'weight_decay': 5.844573140418872e-07, 'epochs': 100, 'loss': 'mse', 'optimizer': 'adam', 'graph_mode': 'off', 'use_snp_selection': False}. Best is trial 14 with value: 0.138775629550442.
[I 2025-12-05 16:13:24,069] Trial 20 finished with value: 0.12274983941105533 and parameters: {'model_type': 'mlp', 'hidden_dims': '[512, 64]', 'dropout': 0.26746024379854694, 'batch_norm': True, 'lr': 0.0003679268700617201, 'weight_decay': 5.505029832844308e-06, 'epochs': 178, 'loss': 'mse', 'optimizer': 'adam', 'graph_mode': 'off', 'use_snp_selection': False}. Best is trial 14 with value: 0.138775629550442.
[I 2025-12-05 16:13:25,832] Trial 21 finished with value: 0.12116747984674928 and parameters: {'model_type': 'mlp', 'hidden_dims': '[512, 128]', 'dropout': 0.14482393983673217, 'batch_norm': True, 'lr': 0.0005320659957241035, 'weight_decay': 9.812279867704331e-07, 'epochs': 222, 'loss': 'mae', 'optimizer': 'adam', 'graph_mode': 'off', 'use_snp_selection': False}. Best is trial 14 with value: 0.138775629550442.
[I 2025-12-05 16:13:27,406] Trial 22 finished with value: 0.11856254787088573 and parameters: {'model_type': 'mlp', 'hidden_dims': '[512, 128]', 'dropout': 0.1621037130767129, 'batch_norm': True, 'lr': 0.00017138937487689603, 'weight_decay': 2.2063048502572068e-07, 'epochs': 181, 'loss': 'mae', 'optimizer': 'adam', 'graph_mode': 'off', 'use_snp_selection': False}. Best is trial 14 with value: 0.138775629550442.
[I 2025-12-05 16:13:28,652] Trial 23 finished with value: 0.11156548771773009 and parameters: {'model_type': 'mlp', 'hidden_dims': '[256, 128, 64]', 'dropout': 0.23070381072043317, 'batch_norm': True, 'lr': 0.0009551756572111758, 'weight_decay': 3.887770375011815e-06, 'epochs': 250, 'loss': 'mae', 'optimizer': 'adam', 'graph_mode': 'off', 'use_snp_selection': False}. Best is trial 14 with value: 0.138775629550442.
[I 2025-12-05 16:13:29,560] Trial 24 finished with value: 0.13681861366074616 and parameters: {'model_type': 'mlp', 'hidden_dims': '[256, 128]', 'dropout': 0.12932822753058773, 'batch_norm': True, 'lr': 0.0004826890766615883, 'weight_decay': 1.0074763135619242e-06, 'epochs': 116, 'loss': 'mse', 'optimizer': 'adam', 'graph_mode': 'off', 'use_snp_selection': False}. Best is trial 14 with value: 0.138775629550442.
[I 2025-12-05 16:13:30,528] Trial 25 finished with value: 0.11986415100586233 and parameters: {'model_type': 'mlp', 'hidden_dims': '[256, 128]', 'dropout': 0.2916278845565484, 'batch_norm': True, 'lr': 0.0004136938359479979, 'weight_decay': 1.0077734665942408e-06, 'epochs': 124, 'loss': 'mse', 'optimizer': 'adam', 'graph_mode': 'off', 'use_snp_selection': False}. Best is trial 14 with value: 0.138775629550442.
[I 2025-12-05 16:13:31,269] Trial 26 finished with value: 0.044657296583603276 and parameters: {'model_type': 'mlp', 'hidden_dims': '[256, 128]', 'dropout': 0.35247149629815966, 'batch_norm': True, 'lr': 0.00010367458207903548, 'weight_decay': 2.2108868211191284e-07, 'epochs': 45, 'loss': 'mse', 'optimizer': 'adam', 'graph_mode': 'off', 'use_snp_selection': True, 'num_snps': 3842}. Best is trial 14 with value: 0.138775629550442.
[I 2025-12-05 16:13:32,090] Trial 27 finished with value: 0.13163198168742196 and parameters: {'model_type': 'mlp', 'hidden_dims': '[256, 128]', 'dropout': 0.14201787846424646, 'batch_norm': False, 'lr': 3.631512440055815e-05, 'weight_decay': 8.17347047701444e-07, 'epochs': 86, 'loss': 'mse', 'optimizer': 'adam', 'graph_mode': 'off', 'use_snp_selection': False}. Best is trial 14 with value: 0.138775629550442.
[I 2025-12-05 16:13:32,822] Trial 28 finished with value: 0.13841208610694591 and parameters: {'model_type': 'mlp', 'hidden_dims': '[128, 64]', 'dropout': 0.219196935871986, 'batch_norm': True, 'lr': 0.00017773119642007775, 'weight_decay': 2.0919850143677088e-07, 'epochs': 119, 'loss': 'mse', 'optimizer': 'adam', 'graph_mode': 'off', 'use_snp_selection': False}. Best is trial 14 with value: 0.138775629550442.
[I 2025-12-05 16:13:34,025] Trial 29 finished with value: 0.11116508723105484 and parameters: {'model_type': 'mlp', 'hidden_dims': '[128, 64]', 'dropout': 0.19531266656131652, 'batch_norm': True, 'lr': 0.00024131284079230956, 'weight_decay': 2.1977412685686115e-07, 'epochs': 78, 'loss': 'mse', 'optimizer': 'adam', 'graph_mode': 'off', 'use_snp_selection': True, 'num_snps': 19468}. Best is trial 14 with value: 0.138775629550442.
[I 2025-12-05 16:13:34,779] Trial 30 finished with value: 0.13373748767854451 and parameters: {'model_type': 'mlp', 'hidden_dims': '[128, 64]', 'dropout': 0.22477696158836197, 'batch_norm': True, 'lr': 0.000596535570066144, 'weight_decay': 4.613224642665017e-05, 'epochs': 130, 'loss': 'mse', 'optimizer': 'adam', 'graph_mode': 'off', 'use_snp_selection': False}. Best is trial 14 with value: 0.138775629550442.
[I 2025-12-05 16:13:35,502] Trial 31 finished with value: 0.1340406544162095 and parameters: {'model_type': 'mlp', 'hidden_dims': '[128, 64]', 'dropout': 0.18295862000520557, 'batch_norm': True, 'lr': 0.00011773465257145794, 'weight_decay': 2.964734406794125e-07, 'epochs': 112, 'loss': 'mse', 'optimizer': 'adam', 'graph_mode': 'off', 'use_snp_selection': False}. Best is trial 14 with value: 0.138775629550442.
[I 2025-12-05 16:13:36,311] Trial 32 finished with value: 0.11156321716855369 and parameters: {'model_type': 'mlp', 'hidden_dims': '[128, 64]', 'dropout': 0.2406365123097409, 'batch_norm': True, 'lr': 0.0002435574053423931, 'weight_decay': 1.700411378796864e-07, 'epochs': 169, 'loss': 'mse', 'optimizer': 'adam', 'graph_mode': 'off', 'use_snp_selection': False}. Best is trial 14 with value: 0.138775629550442.
[I 2025-12-05 16:13:37,776] Trial 33 finished with value: 0.11669695991057982 and parameters: {'model_type': 'mlp', 'hidden_dims': '[256, 128]', 'dropout': 0.13710055438841184, 'batch_norm': True, 'lr': 7.148458475618615e-05, 'weight_decay': 7.078410117619857e-07, 'epochs': 347, 'loss': 'mse', 'optimizer': 'adam', 'graph_mode': 'off', 'use_snp_selection': False}. Best is trial 14 with value: 0.138775629550442.
[I 2025-12-05 16:13:38,575] Trial 34 finished with value: 0.09231372744110808 and parameters: {'model_type': 'mlp', 'hidden_dims': '[256, 128, 64]', 'dropout': 0.20923877137587815, 'batch_norm': True, 'lr': 2.3813326364143217e-05, 'weight_decay': 1.0813578329902673e-06, 'epochs': 71, 'loss': 'mse', 'optimizer': 'adam', 'graph_mode': 'off', 'use_snp_selection': False}. Best is trial 14 with value: 0.138775629550442.
[I 2025-12-05 16:13:39,889] Trial 35 finished with value: 0.01562908183279034 and parameters: {'model_type': 'mlp', 'hidden_dims': '[512, 64]', 'dropout': 0.4544759458916865, 'batch_norm': False, 'lr': 0.00043892556162517324, 'weight_decay': 4.861027926880169e-07, 'epochs': 129, 'loss': 'mse', 'optimizer': 'adam', 'graph_mode': 'off', 'use_snp_selection': False}. Best is trial 14 with value: 0.138775629550442.
[I 2025-12-05 16:13:43,044] Trial 36 finished with value: 0.1373978955988047 and parameters: {'model_type': 'mlp', 'hidden_dims': '[512, 256]', 'dropout': 0.17521200946810195, 'batch_norm': True, 'lr': 0.00018336890780698946, 'weight_decay': 3.1734452500822223e-06, 'epochs': 190, 'loss': 'mse', 'optimizer': 'adam', 'graph_mode': 'off', 'use_snp_selection': True, 'num_snps': 58661}. Best is trial 14 with value: 0.138775629550442.
[I 2025-12-05 16:13:46,486] Trial 37 finished with value: 0.11850281884993258 and parameters: {'model_type': 'mlp', 'hidden_dims': '[512, 256]', 'dropout': 0.3394789229984753, 'batch_norm': True, 'lr': 0.00017911490664626988, 'weight_decay': 1.0304860156119237e-05, 'epochs': 271, 'loss': 'mse', 'optimizer': 'adam', 'graph_mode': 'off', 'use_snp_selection': True, 'num_snps': 57733}. Best is trial 14 with value: 0.138775629550442.
[I 2025-12-05 16:13:49,081] Trial 38 finished with value: 0.12610345362148084 and parameters: {'model_type': 'mlp', 'hidden_dims': '[512, 256]', 'dropout': 0.17828268006817433, 'batch_norm': False, 'lr': 0.000311277381050512, 'weight_decay': 3.402087342579708e-06, 'epochs': 194, 'loss': 'mse', 'optimizer': 'adam', 'graph_mode': 'off', 'use_snp_selection': True, 'num_snps': 46312}. Best is trial 14 with value: 0.138775629550442.
[I 2025-12-05 16:13:50,366] Trial 39 finished with value: 0.002818150462149822 and parameters: {'model_type': 'mlp', 'hidden_dims': '[512, 256]', 'dropout': 0.2973516105116988, 'batch_norm': True, 'lr': 4.98235389778232e-06, 'weight_decay': 1.417424061335222e-06, 'epochs': 64, 'loss': 'mse', 'optimizer': 'adam', 'graph_mode': 'off', 'use_snp_selection': True, 'num_snps': 19621}. Best is trial 14 with value: 0.138775629550442.
[I 2025-12-05 16:13:53,322] Trial 40 finished with value: 0.10935190372783368 and parameters: {'model_type': 'mlp', 'hidden_dims': '[512, 256]', 'dropout': 0.25357904552478416, 'batch_norm': True, 'lr': 8.07540631089438e-05, 'weight_decay': 9.033397682264248e-05, 'epochs': 297, 'loss': 'mse', 'optimizer': 'adam', 'graph_mode': 'off', 'use_snp_selection': True, 'num_snps': 46840}. Best is trial 14 with value: 0.138775629550442.
[I 2025-12-05 16:13:54,978] Trial 41 finished with value: 0.11892151363131045 and parameters: {'model_type': 'mlp', 'hidden_dims': '[512, 64]', 'dropout': 0.12403212170631663, 'batch_norm': True, 'lr': 4.801174047019032e-05, 'weight_decay': 3.2177993844784044e-06, 'epochs': 192, 'loss': 'mse', 'optimizer': 'adam', 'graph_mode': 'off', 'use_snp_selection': True, 'num_snps': 25404}. Best is trial 14 with value: 0.138775629550442.
[I 2025-12-05 16:13:57,321] Trial 42 finished with value: 0.023298989294622513 and parameters: {'model_type': 'mlp', 'hidden_dims': '[256, 128]', 'dropout': 0.17057432938462447, 'batch_norm': True, 'lr': 2.1087442807785206e-06, 'weight_decay': 3.6378377758471307e-07, 'epochs': 158, 'loss': 'mse', 'optimizer': 'adam', 'graph_mode': 'off', 'use_snp_selection': True, 'num_snps': 52728}. Best is trial 14 with value: 0.138775629550442.
[I 2025-12-05 16:13:58,256] Trial 43 finished with value: 0.1203213399342069 and parameters: {'model_type': 'mlp', 'hidden_dims': '[128, 64]', 'dropout': 0.12845392581634377, 'batch_norm': True, 'lr': 0.00028330954764348756, 'weight_decay': 6.004891998697355e-06, 'epochs': 243, 'loss': 'mse', 'optimizer': 'adam', 'graph_mode': 'off', 'use_snp_selection': False}. Best is trial 14 with value: 0.138775629550442.
[I 2025-12-05 16:13:59,161] Trial 44 finished with value: 0.09044348027718029 and parameters: {'model_type': 'mlp', 'hidden_dims': '[256, 128, 64]', 'dropout': 0.36584685939454686, 'batch_norm': True, 'lr': 0.00014611797602087049, 'weight_decay': 1.364342348034805e-06, 'epochs': 113, 'loss': 'mse', 'optimizer': 'adam', 'graph_mode': 'off', 'use_snp_selection': False}. Best is trial 14 with value: 0.138775629550442.
[I 2025-12-05 16:14:00,998] Trial 45 finished with value: 0.12729303320435179 and parameters: {'model_type': 'mlp', 'hidden_dims': '[512, 64]', 'dropout': 0.20622538955360153, 'batch_norm': True, 'lr': 0.0004951216102043732, 'weight_decay': 1.423139649069025e-07, 'epochs': 231, 'loss': 'mse', 'optimizer': 'adam', 'graph_mode': 'off', 'use_snp_selection': False}. Best is trial 14 with value: 0.138775629550442.
[I 2025-12-05 16:14:03,067] Trial 46 finished with value: 0.07911806254283478 and parameters: {'model_type': 'mlp', 'hidden_dims': '[512, 256]', 'dropout': 0.11995562948606309, 'batch_norm': False, 'lr': 0.0007611462893895182, 'weight_decay': 2.2212295829944014e-06, 'epochs': 144, 'loss': 'mse', 'optimizer': 'adam', 'graph_mode': 'off', 'use_snp_selection': True, 'num_snps': 38360}. Best is trial 14 with value: 0.138775629550442.
[I 2025-12-05 16:14:04,194] Trial 47 finished with value: 0.1211830526788491 and parameters: {'model_type': 'mlp', 'hidden_dims': '[256, 128]', 'dropout': 0.1623938403307071, 'batch_norm': True, 'lr': 0.00021329001512120066, 'weight_decay': 1.7139068147112512e-05, 'epochs': 208, 'loss': 'mae', 'optimizer': 'adam', 'graph_mode': 'off', 'use_snp_selection': False}. Best is trial 14 with value: 0.138775629550442.
[I 2025-12-05 16:14:05,249] Trial 48 finished with value: 0.07074967528920421 and parameters: {'model_type': 'mlp', 'hidden_dims': '[256, 128, 64]', 'dropout': 0.4045640375567009, 'batch_norm': True, 'lr': 4.4990777483337e-05, 'weight_decay': 2.8261862380063757e-07, 'epochs': 169, 'loss': 'mse', 'optimizer': 'adam', 'graph_mode': 'off', 'use_snp_selection': False}. Best is trial 14 with value: 0.138775629550442.
[I 2025-12-05 16:14:06,290] Trial 49 finished with value: 0.11250343226360895 and parameters: {'model_type': 'mlp', 'hidden_dims': '[128, 64]', 'dropout': 0.19933140322779752, 'batch_norm': True, 'lr': 7.918495049550974e-05, 'weight_decay': 6.224940242243495e-07, 'epochs': 326, 'loss': 'mse', 'optimizer': 'adam', 'graph_mode': 'off', 'use_snp_selection': False}. Best is trial 14 with value: 0.138775629550442.
[I 2025-12-05 16:14:07,820] Trial 50 finished with value: 0.13104720645182064 and parameters: {'model_type': 'mlp', 'hidden_dims': '[512, 64]', 'dropout': 0.1058597292756176, 'batch_norm': True, 'lr': 0.0006955120862824045, 'weight_decay': 1.6646019229513763e-06, 'epochs': 96, 'loss': 'mse', 'optimizer': 'adam', 'graph_mode': 'off', 'use_snp_selection': True, 'num_snps': 26890}. Best is trial 14 with value: 0.138775629550442.
[I 2025-12-05 16:14:08,550] Trial 51 finished with value: 0.13802707908537787 and parameters: {'model_type': 'mlp', 'hidden_dims': '[128, 64]', 'dropout': 0.17501222125821722, 'batch_norm': True, 'lr': 0.00012208102873533384, 'weight_decay': 3.336599636729885e-07, 'epochs': 117, 'loss': 'mse', 'optimizer': 'adam', 'graph_mode': 'off', 'use_snp_selection': False}. Best is trial 14 with value: 0.138775629550442.
[I 2025-12-05 16:14:09,314] Trial 52 finished with value: 0.12596946265552264 and parameters: {'model_type': 'mlp', 'hidden_dims': '[128, 64]', 'dropout': 0.16065247910234848, 'batch_norm': True, 'lr': 0.00012557966680002875, 'weight_decay': 4.279716483164067e-07, 'epochs': 138, 'loss': 'mse', 'optimizer': 'adam', 'graph_mode': 'off', 'use_snp_selection': False}. Best is trial 14 with value: 0.138775629550442.
[I 2025-12-05 16:14:10,047] Trial 53 finished with value: 0.10491153942333252 and parameters: {'model_type': 'mlp', 'hidden_dims': '[128, 64]', 'dropout': 0.250293899217778, 'batch_norm': True, 'lr': 5.920280743779439e-05, 'weight_decay': 1.4736649180371286e-07, 'epochs': 119, 'loss': 'mse', 'optimizer': 'adam', 'graph_mode': 'off', 'use_snp_selection': False}. Best is trial 14 with value: 0.138775629550442.
[I 2025-12-05 16:14:10,855] Trial 54 finished with value: 0.11397512885523109 and parameters: {'model_type': 'mlp', 'hidden_dims': '[128, 64]', 'dropout': 0.21829303683105333, 'batch_norm': True, 'lr': 9.724132901778003e-05, 'weight_decay': 6.46523722745791e-07, 'epochs': 154, 'loss': 'mse', 'optimizer': 'adam', 'graph_mode': 'off', 'use_snp_selection': False}. Best is trial 14 with value: 0.138775629550442.
[I 2025-12-05 16:14:11,744] Trial 55 finished with value: 0.13356414492071306 and parameters: {'model_type': 'mlp', 'hidden_dims': '[256, 128, 64]', 'dropout': 0.14633823035867563, 'batch_norm': True, 'lr': 0.00018926648502891178, 'weight_decay': 3.0147748957983563e-07, 'epochs': 105, 'loss': 'mse', 'optimizer': 'adam', 'graph_mode': 'off', 'use_snp_selection': False}. Best is trial 14 with value: 0.138775629550442.
[I 2025-12-05 16:14:13,349] Trial 56 finished with value: 0.1076165175052633 and parameters: {'model_type': 'mlp', 'hidden_dims': '[512, 256]', 'dropout': 0.5874947623454398, 'batch_norm': True, 'lr': 0.0003588533238343457, 'weight_decay': 1.0312648467263472e-06, 'epochs': 181, 'loss': 'mae', 'optimizer': 'adam', 'graph_mode': 'off', 'use_snp_selection': False}. Best is trial 14 with value: 0.138775629550442.
[I 2025-12-05 16:14:14,376] Trial 57 finished with value: 0.12071884146814273 and parameters: {'model_type': 'mlp', 'hidden_dims': '[256, 128]', 'dropout': 0.2864587135145137, 'batch_norm': False, 'lr': 3.37307855717936e-05, 'weight_decay': 2.6293850897472747e-06, 'epochs': 167, 'loss': 'mse', 'optimizer': 'adam', 'graph_mode': 'off', 'use_snp_selection': False}. Best is trial 14 with value: 0.138775629550442.
[I 2025-12-05 16:14:15,527] Trial 58 finished with value: 0.04088716081829024 and parameters: {'model_type': 'mlp', 'hidden_dims': '[512, 128]', 'dropout': 0.4267521374303243, 'batch_norm': True, 'lr': 1.2236019725063699e-05, 'weight_decay': 1.9593251208500856e-07, 'epochs': 90, 'loss': 'mse', 'optimizer': 'adam', 'graph_mode': 'off', 'use_snp_selection': False}. Best is trial 14 with value: 0.138775629550442.
[I 2025-12-05 16:14:16,935] Trial 59 finished with value: 0.1364605157484199 and parameters: {'model_type': 'mlp', 'hidden_dims': '[512, 64]', 'dropout': 0.177158837696267, 'batch_norm': True, 'lr': 0.000967071649286293, 'weight_decay': 6.61623584827066e-06, 'epochs': 139, 'loss': 'mse', 'optimizer': 'adam', 'graph_mode': 'off', 'use_snp_selection': False}. Best is trial 14 with value: 0.138775629550442.
[I 2025-12-05 16:14:17,795] Trial 60 finished with value: 0.11362466362218175 and parameters: {'model_type': 'mlp', 'hidden_dims': '[128, 64]', 'dropout': 0.3243013009031736, 'batch_norm': True, 'lr': 0.00015441412322013284, 'weight_decay': 1.0532809921409031e-07, 'epochs': 205, 'loss': 'mae', 'optimizer': 'adam', 'graph_mode': 'off', 'use_snp_selection': False}. Best is trial 14 with value: 0.138775629550442.
[I 2025-12-05 16:14:19,174] Trial 61 finished with value: 0.13500858423291062 and parameters: {'model_type': 'mlp', 'hidden_dims': '[512, 64]', 'dropout': 0.1896564783834392, 'batch_norm': True, 'lr': 0.0007982806530590757, 'weight_decay': 6.152968854357301e-06, 'epochs': 139, 'loss': 'mse', 'optimizer': 'adam', 'graph_mode': 'off', 'use_snp_selection': False}. Best is trial 14 with value: 0.138775629550442.
[I 2025-12-05 16:14:20,524] Trial 62 finished with value: 0.12545733137164974 and parameters: {'model_type': 'mlp', 'hidden_dims': '[512, 64]', 'dropout': 0.1537350265736767, 'batch_norm': True, 'lr': 0.0009839009529960783, 'weight_decay': 1.2444490866297704e-05, 'epochs': 132, 'loss': 'mse', 'optimizer': 'adam', 'graph_mode': 'off', 'use_snp_selection': False}. Best is trial 14 with value: 0.138775629550442.
[I 2025-12-05 16:14:21,816] Trial 63 finished with value: 0.12674049708607643 and parameters: {'model_type': 'mlp', 'hidden_dims': '[512, 64]', 'dropout': 0.11420026070123233, 'batch_norm': True, 'lr': 0.0005646677622713384, 'weight_decay': 0.0006902748445006628, 'epochs': 110, 'loss': 'mse', 'optimizer': 'adam', 'graph_mode': 'off', 'use_snp_selection': False}. Best is trial 14 with value: 0.138775629550442.
[I 2025-12-05 16:14:23,292] Trial 64 finished with value: 0.13255508045314313 and parameters: {'model_type': 'mlp', 'hidden_dims': '[512, 64]', 'dropout': 0.17441463659296164, 'batch_norm': True, 'lr': 0.0004394006852781967, 'weight_decay': 4.3350556461568515e-06, 'epochs': 150, 'loss': 'mse', 'optimizer': 'adam', 'graph_mode': 'off', 'use_snp_selection': False}. Best is trial 14 with value: 0.138775629550442.
