[I 2025-12-05 14:55:12,419] Trial 34 finished with value: 0.13839999194698754 and parameters: {'model_type': 'mlp', 'hidden_dims': '[512, 128]', 'dropout': 0.18971914448287763, 'batch_norm': True, 'lr': 8.828403853386392e-05, 'weight_decay': 1.7287601386608524e-05, 'epochs': 317, 'loss': 'mae', 'optimizer': 'adam', 'graph_mode': 'off', 'use_snp_selection': False}. Best is trial 31 with value: 0.16121570367139137.
[I 2025-12-05 14:55:14,327] Trial 35 finished with value: 0.14231025642634385 and parameters: {'model_type': 'mlp', 'hidden_dims': '[512, 128]', 'dropout': 0.2116729356674671, 'batch_norm': False, 'lr': 0.0006405463431978317, 'weight_decay': 0.0001797029564677693, 'epochs': 329, 'loss': 'mae', 'optimizer': 'adam', 'graph_mode': 'off', 'use_snp_selection': False}. Best is trial 31 with value: 0.16121570367139137.
[I 2025-12-05 14:55:17,534] Trial 36 finished with value: 0.14163410714821448 and parameters: {'model_type': 'mlp', 'hidden_dims': '[512, 128]', 'dropout': 0.25556571675067885, 'batch_norm': True, 'lr': 3.8955609395377126e-05, 'weight_decay': 3.0947891953170706e-05, 'epochs': 283, 'loss': 'mse', 'optimizer': 'adam', 'graph_mode': 'off', 'use_snp_selection': True, 'num_snps': 58661}. Best is trial 31 with value: 0.16121570367139137.
[I 2025-12-05 14:55:19,346] Trial 37 finished with value: 0.06978734951822559 and parameters: {'model_type': 'mlp', 'hidden_dims': '[512, 128]', 'dropout': 0.13538650177400433, 'batch_norm': True, 'lr': 4.446294938689996e-06, 'weight_decay': 4.324362288577541e-05, 'epochs': 309, 'loss': 'mae', 'optimizer': 'adam', 'graph_mode': 'off', 'use_snp_selection': False}. Best is trial 31 with value: 0.16121570367139137.
[I 2025-12-05 14:55:20,805] Trial 38 finished with value: 0.14612964147921184 and parameters: {'model_type': 'mlp', 'hidden_dims': '[512, 64]', 'dropout': 0.17271003765785714, 'batch_norm': False, 'lr': 0.0001574343305514422, 'weight_decay': 0.0007861043263994401, 'epochs': 340, 'loss': 'mse', 'optimizer': 'adam', 'graph_mode': 'off', 'use_snp_selection': True, 'num_snps': 19911}. Best is trial 31 with value: 0.16121570367139137.
[I 2025-12-05 14:55:22,720] Trial 39 finished with value: 0.1655821399679711 and parameters: {'model_type': 'mlp', 'hidden_dims': '[512, 128]', 'dropout': 0.15480557095365105, 'batch_norm': True, 'lr': 0.0002490656238112741, 'weight_decay': 2.133862224650403e-05, 'epochs': 323, 'loss': 'mae', 'optimizer': 'adam', 'graph_mode': 'off', 'use_snp_selection': False}. Best is trial 39 with value: 0.1655821399679711.
[I 2025-12-05 14:55:24,634] Trial 40 finished with value: 0.14397258024451592 and parameters: {'model_type': 'mlp', 'hidden_dims': '[512, 128]', 'dropout': 0.1661755046800379, 'batch_norm': True, 'lr': 0.0006276424844477613, 'weight_decay': 2.258211041297843e-05, 'epochs': 322, 'loss': 'mse', 'optimizer': 'adam', 'graph_mode': 'off', 'use_snp_selection': False}. Best is trial 39 with value: 0.1655821399679711.
[I 2025-12-05 14:55:26,380] Trial 41 finished with value: 0.1525912579766623 and parameters: {'model_type': 'mlp', 'hidden_dims': '[512, 128]', 'dropout': 0.1197593993966321, 'batch_norm': True, 'lr': 0.00028394476322631565, 'weight_decay': 1.1092937818150653e-05, 'epochs': 276, 'loss': 'mae', 'optimizer': 'adam', 'graph_mode': 'off', 'use_snp_selection': False}. Best is trial 39 with value: 0.1655821399679711.
[I 2025-12-05 14:55:28,337] Trial 42 finished with value: 0.15168666055691735 and parameters: {'model_type': 'mlp', 'hidden_dims': '[512, 128]', 'dropout': 0.12445533257728433, 'batch_norm': True, 'lr': 0.0002878832133770999, 'weight_decay': 9.0276577506181e-06, 'epochs': 350, 'loss': 'mae', 'optimizer': 'adam', 'graph_mode': 'off', 'use_snp_selection': False}. Best is trial 39 with value: 0.1655821399679711.
[I 2025-12-05 14:55:29,558] Trial 43 finished with value: 0.05956954509078002 and parameters: {'model_type': 'mlp', 'hidden_dims': '[256, 128, 64]', 'dropout': 0.15455341913022788, 'batch_norm': True, 'lr': 2.1409924724993155e-06, 'weight_decay': 1.2060969976423632e-05, 'epochs': 306, 'loss': 'mae', 'optimizer': 'adam', 'graph_mode': 'off', 'use_snp_selection': False}. Best is trial 39 with value: 0.1655821399679711.
[I 2025-12-05 14:55:30,760] Trial 44 finished with value: 0.14202998684911933 and parameters: {'model_type': 'mlp', 'hidden_dims': '[512, 128]', 'dropout': 0.10317932671700103, 'batch_norm': True, 'lr': 0.00043029419066470783, 'weight_decay': 0.00010765638739885776, 'epochs': 131, 'loss': 'mae', 'optimizer': 'adam', 'graph_mode': 'off', 'use_snp_selection': False}. Best is trial 39 with value: 0.1655821399679711.
[I 2025-12-05 14:55:32,605] Trial 45 finished with value: 0.14617030224770175 and parameters: {'model_type': 'mlp', 'hidden_dims': '[512, 64]', 'dropout': 0.24186541993440108, 'batch_norm': True, 'lr': 0.00017921016036360506, 'weight_decay': 4.385736371042536e-05, 'epochs': 319, 'loss': 'mae', 'optimizer': 'adam', 'graph_mode': 'off', 'use_snp_selection': False}. Best is trial 39 with value: 0.1655821399679711.
[I 2025-12-05 14:55:34,542] Trial 46 finished with value: 0.14526172922473696 and parameters: {'model_type': 'mlp', 'hidden_dims': '[512, 256]', 'dropout': 0.1951879507019712, 'batch_norm': False, 'lr': 0.00027901221262173286, 'weight_decay': 2.3477997521031734e-05, 'epochs': 334, 'loss': 'mae', 'optimizer': 'adam', 'graph_mode': 'off', 'use_snp_selection': False}. Best is trial 39 with value: 0.1655821399679711.
[I 2025-12-05 14:55:36,313] Trial 47 finished with value: 0.1624182292218083 and parameters: {'model_type': 'mlp', 'hidden_dims': '[512, 128]', 'dropout': 0.1225222744761209, 'batch_norm': True, 'lr': 7.684731044515476e-05, 'weight_decay': 6.427148643240824e-05, 'epochs': 280, 'loss': 'mae', 'optimizer': 'adam', 'graph_mode': 'off', 'use_snp_selection': False}. Best is trial 39 with value: 0.1655821399679711.
[I 2025-12-05 14:55:38,134] Trial 48 finished with value: 0.14580250411585646 and parameters: {'model_type': 'mlp', 'hidden_dims': '[512, 128]', 'dropout': 0.15087160369178187, 'batch_norm': True, 'lr': 7.657633505175456e-05, 'weight_decay': 6.289664018357323e-05, 'epochs': 297, 'loss': 'mae', 'optimizer': 'adam', 'graph_mode': 'off', 'use_snp_selection': False}. Best is trial 39 with value: 0.1655821399679711.
[I 2025-12-05 14:55:40,303] Trial 49 finished with value: 0.1047602791373362 and parameters: {'model_type': 'mlp', 'hidden_dims': '[512, 128]', 'dropout': 0.1406069629624776, 'batch_norm': True, 'lr': 4.489902594536678e-05, 'weight_decay': 0.000287191443674494, 'epochs': 48, 'loss': 'mse', 'optimizer': 'adam', 'graph_mode': 'off', 'use_snp_selection': True, 'num_snps': 46888}. Best is trial 39 with value: 0.1655821399679711.
[I 2025-12-05 14:55:41,355] Trial 50 finished with value: 0.09061052759771762 and parameters: {'model_type': 'mlp', 'hidden_dims': '[128, 64]', 'dropout': 0.2731814742779615, 'batch_norm': True, 'lr': 1.0763022129215937e-05, 'weight_decay': 0.00019812291185948092, 'epochs': 338, 'loss': 'mae', 'optimizer': 'adam', 'graph_mode': 'off', 'use_snp_selection': False}. Best is trial 39 with value: 0.1655821399679711.
[I 2025-12-05 14:55:43,053] Trial 51 finished with value: 0.15752499101347409 and parameters: {'model_type': 'mlp', 'hidden_dims': '[512, 128]', 'dropout': 0.12117485123870361, 'batch_norm': True, 'lr': 0.00022513893930171792, 'weight_decay': 1.8143561781679768e-05, 'epochs': 274, 'loss': 'mae', 'optimizer': 'adam', 'graph_mode': 'off', 'use_snp_selection': False}. Best is trial 39 with value: 0.1655821399679711.
[I 2025-12-05 14:55:44,800] Trial 52 finished with value: 0.13324449571454272 and parameters: {'model_type': 'mlp', 'hidden_dims': '[512, 128]', 'dropout': 0.17149751771677138, 'batch_norm': True, 'lr': 0.000191214983305055, 'weight_decay': 2.0803511815668014e-05, 'epochs': 289, 'loss': 'mae', 'optimizer': 'adam', 'graph_mode': 'off', 'use_snp_selection': False}. Best is trial 39 with value: 0.1655821399679711.
[I 2025-12-05 14:55:46,693] Trial 53 finished with value: 0.14494816856894166 and parameters: {'model_type': 'mlp', 'hidden_dims': '[512, 128]', 'dropout': 0.11813763482689707, 'batch_norm': True, 'lr': 0.0003791728112613264, 'weight_decay': 4.80892238600141e-05, 'epochs': 313, 'loss': 'mae', 'optimizer': 'adam', 'graph_mode': 'off', 'use_snp_selection': False}. Best is trial 39 with value: 0.1655821399679711.
[I 2025-12-05 14:55:48,478] Trial 54 finished with value: 0.15356178947244148 and parameters: {'model_type': 'mlp', 'hidden_dims': '[512, 128]', 'dropout': 0.21075652290414132, 'batch_norm': True, 'lr': 0.0005656933591635788, 'weight_decay': 0.00011280720649036931, 'epochs': 279, 'loss': 'mae', 'optimizer': 'adam', 'graph_mode': 'off', 'use_snp_selection': False}. Best is trial 39 with value: 0.1655821399679711.
[I 2025-12-05 14:55:50,329] Trial 55 finished with value: 0.1445319463630674 and parameters: {'model_type': 'mlp', 'hidden_dims': '[512, 128]', 'dropout': 0.15098767987773673, 'batch_norm': True, 'lr': 0.00023260292692249334, 'weight_decay': 3.9151058548298905e-05, 'epochs': 302, 'loss': 'mae', 'optimizer': 'adam', 'graph_mode': 'off', 'use_snp_selection': False}. Best is trial 39 with value: 0.1655821399679711.
[I 2025-12-05 14:55:51,999] Trial 56 finished with value: 0.14279004258172145 and parameters: {'model_type': 'mlp', 'hidden_dims': '[512, 64]', 'dropout': 0.1808315655631052, 'batch_norm': True, 'lr': 0.00010533486016532641, 'weight_decay': 4.3152379610512046e-06, 'epochs': 256, 'loss': 'mae', 'optimizer': 'adam', 'graph_mode': 'off', 'use_snp_selection': False}. Best is trial 39 with value: 0.1655821399679711.
[I 2025-12-05 14:55:53,151] Trial 57 finished with value: 0.12567352797449927 and parameters: {'model_type': 'mlp', 'hidden_dims': '[256, 128, 64]', 'dropout': 0.1353012033406055, 'batch_norm': True, 'lr': 5.952679207549483e-05, 'weight_decay': 1.4493757019876034e-05, 'epochs': 267, 'loss': 'mae', 'optimizer': 'adam', 'graph_mode': 'off', 'use_snp_selection': False}. Best is trial 39 with value: 0.1655821399679711.
[I 2025-12-05 14:55:55,009] Trial 58 finished with value: 0.13409178350289083 and parameters: {'model_type': 'mlp', 'hidden_dims': '[512, 256]', 'dropout': 0.40228275019692983, 'batch_norm': False, 'lr': 0.00015294101438350754, 'weight_decay': 0.0004096534249150027, 'epochs': 325, 'loss': 'mae', 'optimizer': 'adam', 'graph_mode': 'off', 'use_snp_selection': False}. Best is trial 39 with value: 0.1655821399679711.
[I 2025-12-05 14:55:56,072] Trial 59 finished with value: 0.17338871024337962 and parameters: {'model_type': 'mlp', 'hidden_dims': '[512, 128]', 'dropout': 0.10299973357129148, 'batch_norm': True, 'lr': 0.0008124203504309938, 'weight_decay': 6.509715265950956e-05, 'epochs': 89, 'loss': 'mae', 'optimizer': 'adam', 'graph_mode': 'off', 'use_snp_selection': False}. Best is trial 59 with value: 0.17338871024337962.
[I 2025-12-05 14:55:57,141] Trial 60 finished with value: 0.13203964563551868 and parameters: {'model_type': 'mlp', 'hidden_dims': '[512, 128]', 'dropout': 0.10359152144262201, 'batch_norm': True, 'lr': 0.0007613686193072191, 'weight_decay': 6.035668877379383e-05, 'epochs': 91, 'loss': 'mae', 'optimizer': 'adam', 'graph_mode': 'off', 'use_snp_selection': False}. Best is trial 59 with value: 0.17338871024337962.
[I 2025-12-05 14:55:58,390] Trial 61 finished with value: 0.1623804193609428 and parameters: {'model_type': 'mlp', 'hidden_dims': '[512, 128]', 'dropout': 0.15500841999520942, 'batch_norm': True, 'lr': 0.00034214271759832747, 'weight_decay': 2.8228651731064496e-05, 'epochs': 125, 'loss': 'mae', 'optimizer': 'adam', 'graph_mode': 'off', 'use_snp_selection': False}. Best is trial 59 with value: 0.17338871024337962.
[I 2025-12-05 14:55:59,529] Trial 62 finished with value: 0.1207232233895134 and parameters: {'model_type': 'mlp', 'hidden_dims': '[512, 128]', 'dropout': 0.11532301775946212, 'batch_norm': True, 'lr': 0.0005003242789868907, 'weight_decay': 8.30435093304674e-06, 'epochs': 91, 'loss': 'mae', 'optimizer': 'adam', 'graph_mode': 'off', 'use_snp_selection': False}. Best is trial 59 with value: 0.17338871024337962.
[I 2025-12-05 14:56:00,753] Trial 63 finished with value: 0.1410176053318307 and parameters: {'model_type': 'mlp', 'hidden_dims': '[512, 128]', 'dropout': 0.14651046609693957, 'batch_norm': True, 'lr': 0.0007807678468929136, 'weight_decay': 8.055371689265306e-05, 'epochs': 115, 'loss': 'mae', 'optimizer': 'adam', 'graph_mode': 'off', 'use_snp_selection': False}. Best is trial 59 with value: 0.17338871024337962.
[I 2025-12-05 14:56:01,831] Trial 64 finished with value: 0.1320360287736892 and parameters: {'model_type': 'mlp', 'hidden_dims': '[512, 128]', 'dropout': 0.16006694182360984, 'batch_norm': True, 'lr': 0.0003496930793810283, 'weight_decay': 1.749530022010027e-05, 'epochs': 75, 'loss': 'mae', 'optimizer': 'adam', 'graph_mode': 'off', 'use_snp_selection': False}. Best is trial 59 with value: 0.17338871024337962.
[I 2025-12-05 14:56:02,878] Trial 65 finished with value: 0.14277915568101937 and parameters: {'model_type': 'mlp', 'hidden_dims': '[512, 128]', 'dropout': 0.13152049851150532, 'batch_norm': True, 'lr': 0.00022614720199466617, 'weight_decay': 2.4412332273387623e-05, 'epochs': 68, 'loss': 'mae', 'optimizer': 'adam', 'graph_mode': 'off', 'use_snp_selection': False}. Best is trial 59 with value: 0.17338871024337962.
[I 2025-12-05 14:56:03,797] Trial 66 finished with value: 0.1518535338993738 and parameters: {'model_type': 'mlp', 'hidden_dims': '[256, 128]', 'dropout': 0.1015902097885831, 'batch_norm': True, 'lr': 0.0005105360249261029, 'weight_decay': 5.295138770165991e-06, 'epochs': 119, 'loss': 'mae', 'optimizer': 'adam', 'graph_mode': 'off', 'use_snp_selection': False}. Best is trial 59 with value: 0.17338871024337962.
[I 2025-12-05 14:56:05,223] Trial 67 finished with value: 0.15872243207777262 and parameters: {'model_type': 'mlp', 'hidden_dims': '[512, 128]', 'dropout': 0.11688422425651109, 'batch_norm': True, 'lr': 0.00042214552541810433, 'weight_decay': 6.298676200508312e-05, 'epochs': 158, 'loss': 'mae', 'optimizer': 'adam', 'graph_mode': 'off', 'use_snp_selection': True, 'num_snps': 22951}. Best is trial 59 with value: 0.17338871024337962.
[I 2025-12-05 14:56:06,599] Trial 68 finished with value: 0.15052180811676721 and parameters: {'model_type': 'mlp', 'hidden_dims': '[128, 64]', 'dropout': 0.20796868958753179, 'batch_norm': True, 'lr': 0.00039684574971626016, 'weight_decay': 0.00014720590650631378, 'epochs': 157, 'loss': 'mse', 'optimizer': 'adam', 'graph_mode': 'off', 'use_snp_selection': True, 'num_snps': 22632}. Best is trial 59 with value: 0.17338871024337962.
[I 2025-12-05 14:56:07,522] Trial 69 finished with value: 0.15472790590399688 and parameters: {'model_type': 'mlp', 'hidden_dims': '[512, 128]', 'dropout': 0.18275435613751637, 'batch_norm': True, 'lr': 0.000897630755907299, 'weight_decay': 5.9051237265737325e-05, 'epochs': 142, 'loss': 'mae', 'optimizer': 'adam', 'graph_mode': 'off', 'use_snp_selection': True, 'num_snps': 6004}. Best is trial 59 with value: 0.17338871024337962.
[I 2025-12-05 14:56:09,097] Trial 70 finished with value: 0.1653749148381123 and parameters: {'model_type': 'mlp', 'hidden_dims': '[512, 128]', 'dropout': 0.4249468315529673, 'batch_norm': False, 'lr': 0.0007454752767312401, 'weight_decay': 3.24398886270944e-05, 'epochs': 167, 'loss': 'mae', 'optimizer': 'adam', 'graph_mode': 'off', 'use_snp_selection': True, 'num_snps': 24354}. Best is trial 59 with value: 0.17338871024337962.
[I 2025-12-05 14:56:10,675] Trial 71 finished with value: 0.15694778796117925 and parameters: {'model_type': 'mlp', 'hidden_dims': '[512, 128]', 'dropout': 0.4415481545240512, 'batch_norm': False, 'lr': 0.0007166589442201788, 'weight_decay': 3.5229593265826796e-05, 'epochs': 178, 'loss': 'mae', 'optimizer': 'adam', 'graph_mode': 'off', 'use_snp_selection': True, 'num_snps': 23142}. Best is trial 59 with value: 0.17338871024337962.
[I 2025-12-05 14:56:12,537] Trial 72 finished with value: 0.1376793436495713 and parameters: {'model_type': 'mlp', 'hidden_dims': '[512, 128]', 'dropout': 0.428670285820736, 'batch_norm': False, 'lr': 0.0009961237083615793, 'weight_decay': 2.774456848766708e-05, 'epochs': 176, 'loss': 'mae', 'optimizer': 'adam', 'graph_mode': 'off', 'use_snp_selection': True, 'num_snps': 29629}. Best is trial 59 with value: 0.17338871024337962.
[I 2025-12-05 14:56:13,698] Trial 73 finished with value: 0.14460727259689238 and parameters: {'model_type': 'mlp', 'hidden_dims': '[512, 128]', 'dropout': 0.3644774251012563, 'batch_norm': False, 'lr': 0.0005738576406947275, 'weight_decay': 9.329964461816951e-05, 'epochs': 190, 'loss': 'mae', 'optimizer': 'adam', 'graph_mode': 'off', 'use_snp_selection': True, 'num_snps': 12966}. Best is trial 59 with value: 0.17338871024337962.
[I 2025-12-05 14:56:15,283] Trial 74 finished with value: 0.13417065413946752 and parameters: {'model_type': 'mlp', 'hidden_dims': '[512, 128]', 'dropout': 0.48032862480465427, 'batch_norm': False, 'lr': 0.00033101269339467213, 'weight_decay': 4.950220612866301e-05, 'epochs': 109, 'loss': 'mae', 'optimizer': 'adam', 'graph_mode': 'off', 'use_snp_selection': True, 'num_snps': 27815}. Best is trial 59 with value: 0.17338871024337962.
[I 2025-12-05 14:56:17,276] Trial 75 finished with value: 0.16379223431159712 and parameters: {'model_type': 'mlp', 'hidden_dims': '[256, 128, 64]', 'dropout': 0.14028197416641047, 'batch_norm': False, 'lr': 0.0004405998736483732, 'weight_decay': 7.317868626825975e-05, 'epochs': 134, 'loss': 'mae', 'optimizer': 'adam', 'graph_mode': 'off', 'use_snp_selection': True, 'num_snps': 37657}. Best is trial 59 with value: 0.17338871024337962.
[I 2025-12-05 14:56:19,288] Trial 76 finished with value: 0.12078218112025055 and parameters: {'model_type': 'mlp', 'hidden_dims': '[256, 128, 64]', 'dropout': 0.1401214243487269, 'batch_norm': False, 'lr': 0.0005353136313134039, 'weight_decay': 0.000128675072476564, 'epochs': 133, 'loss': 'mae', 'optimizer': 'adam', 'graph_mode': 'off', 'use_snp_selection': True, 'num_snps': 38058}. Best is trial 59 with value: 0.17338871024337962.
[I 2025-12-05 14:56:21,582] Trial 77 finished with value: 0.09387146022799836 and parameters: {'model_type': 'mlp', 'hidden_dims': '[256, 128, 64]', 'dropout': 0.5356701739994623, 'batch_norm': False, 'lr': 0.000433419336382773, 'weight_decay': 7.308178319434429e-05, 'epochs': 158, 'loss': 'mae', 'optimizer': 'adam', 'graph_mode': 'off', 'use_snp_selection': True, 'num_snps': 45229}. Best is trial 59 with value: 0.17338871024337962.
[I 2025-12-05 14:56:23,459] Trial 78 finished with value: 0.12803952498373192 and parameters: {'model_type': 'mlp', 'hidden_dims': '[256, 128, 64]', 'dropout': 0.38337795848437717, 'batch_norm': False, 'lr': 0.0007506335987091335, 'weight_decay': 3.508887862395963e-05, 'epochs': 167, 'loss': 'mae', 'optimizer': 'adam', 'graph_mode': 'off', 'use_snp_selection': True, 'num_snps': 35317}. Best is trial 59 with value: 0.17338871024337962.
[I 2025-12-05 14:56:24,654] Trial 79 finished with value: 0.1404506303029832 and parameters: {'model_type': 'mlp', 'hidden_dims': '[256, 128, 64]', 'dropout': 0.1588842658827328, 'batch_norm': False, 'lr': 0.00032620701276810343, 'weight_decay': 7.118775960779822e-05, 'epochs': 134, 'loss': 'mae', 'optimizer': 'adam', 'graph_mode': 'off', 'use_snp_selection': True, 'num_snps': 14391}. Best is trial 59 with value: 0.17338871024337962.
[I 2025-12-05 14:56:26,307] Trial 80 finished with value: 0.15413238972328258 and parameters: {'model_type': 'mlp', 'hidden_dims': '[512, 256]', 'dropout': 0.11416467562873919, 'batch_norm': False, 'lr': 0.0008341948940913985, 'weight_decay': 0.00019633626353854396, 'epochs': 141, 'loss': 'mae', 'optimizer': 'adam', 'graph_mode': 'off', 'use_snp_selection': True, 'num_snps': 26547}. Best is trial 59 with value: 0.17338871024337962.
[I 2025-12-05 14:56:27,629] Trial 81 finished with value: 0.1583621166958211 and parameters: {'model_type': 'mlp', 'hidden_dims': '[512, 128]', 'dropout': 0.1311320123176827, 'batch_norm': True, 'lr': 0.00041937560984967433, 'weight_decay': 5.218601872691248e-05, 'epochs': 151, 'loss': 'mae', 'optimizer': 'adam', 'graph_mode': 'off', 'use_snp_selection': True, 'num_snps': 16816}. Best is trial 59 with value: 0.17338871024337962.
[I 2025-12-05 14:56:28,998] Trial 82 finished with value: 0.15527418629748563 and parameters: {'model_type': 'mlp', 'hidden_dims': '[512, 128]', 'dropout': 0.13038883708855853, 'batch_norm': True, 'lr': 0.0004471753059208564, 'weight_decay': 4.7595788856502304e-05, 'epochs': 189, 'loss': 'mae', 'optimizer': 'adam', 'graph_mode': 'off', 'use_snp_selection': True, 'num_snps': 16094}. Best is trial 59 with value: 0.17338871024337962.
[I 2025-12-05 14:56:30,010] Trial 83 finished with value: 0.1487074483262392 and parameters: {'model_type': 'mlp', 'hidden_dims': '[512, 128]', 'dropout': 0.16316517074284217, 'batch_norm': False, 'lr': 0.0006249952118673104, 'weight_decay': 9.583295283696967e-05, 'epochs': 149, 'loss': 'mae', 'optimizer': 'adam', 'graph_mode': 'off', 'use_snp_selection': True, 'num_snps': 9279}. Best is trial 59 with value: 0.17338871024337962.
[I 2025-12-05 14:56:31,522] Trial 84 finished with value: 0.16358115931059808 and parameters: {'model_type': 'mlp', 'hidden_dims': '[512, 64]', 'dropout': 0.1414922698471874, 'batch_norm': True, 'lr': 0.0006434652303077504, 'weight_decay': 3.9144264039927085e-05, 'epochs': 109, 'loss': 'mse', 'optimizer': 'adam', 'graph_mode': 'off', 'use_snp_selection': True, 'num_snps': 24888}. Best is trial 59 with value: 0.17338871024337962.
