[I 2025-12-06 04:46:27,827] Trial 129 finished with value: 0.18300878662973036 and parameters: {'model_type': 'mlp', 'hidden_dims': '[512, 64]', 'dropout': 0.3029331496438729, 'batch_norm': False, 'lr': 3.702798053706894e-05, 'weight_decay': 0.00014738628005341788, 'epochs': 102, 'loss': 'mae', 'optimizer': 'adam', 'graph_mode': 'off', 'use_snp_selection': False}. Best is trial 76 with value: 0.21110188042063088.
[I 2025-12-06 04:46:59,774] Trial 130 finished with value: 0.19319596174636006 and parameters: {'model_type': 'mlp', 'hidden_dims': '[512, 256]', 'dropout': 0.22789334651943743, 'batch_norm': True, 'lr': 2.636790849566867e-05, 'weight_decay': 2.6320902676889215e-05, 'epochs': 92, 'loss': 'mae', 'optimizer': 'adam', 'graph_mode': 'off', 'use_snp_selection': False}. Best is trial 76 with value: 0.21110188042063088.
[I 2025-12-06 04:47:28,236] Trial 131 finished with value: 0.20533133303235057 and parameters: {'model_type': 'mlp', 'hidden_dims': '[512, 64]', 'dropout': 0.2771538158028224, 'batch_norm': False, 'lr': 1.6692088295876177e-05, 'weight_decay': 4.689365351246146e-06, 'epochs': 80, 'loss': 'mae', 'optimizer': 'adam', 'graph_mode': 'off', 'use_snp_selection': False}. Best is trial 76 with value: 0.21110188042063088.
[I 2025-12-06 04:47:54,414] Trial 132 finished with value: 0.2002594457414466 and parameters: {'model_type': 'mlp', 'hidden_dims': '[512, 64]', 'dropout': 0.27210066236670205, 'batch_norm': False, 'lr': 1.1575547790094296e-05, 'weight_decay': 6.196969621600407e-06, 'epochs': 71, 'loss': 'mae', 'optimizer': 'adam', 'graph_mode': 'off', 'use_snp_selection': False}. Best is trial 76 with value: 0.21110188042063088.
[I 2025-12-06 04:48:17,655] Trial 133 finished with value: 0.2097598920360105 and parameters: {'model_type': 'mlp', 'hidden_dims': '[512, 64]', 'dropout': 0.28477662900000333, 'batch_norm': False, 'lr': 1.526254321403635e-05, 'weight_decay': 3.864287950023173e-06, 'epochs': 60, 'loss': 'mae', 'optimizer': 'adam', 'graph_mode': 'off', 'use_snp_selection': False}. Best is trial 76 with value: 0.21110188042063088.
[I 2025-12-06 04:48:38,757] Trial 134 finished with value: 0.19229194730461172 and parameters: {'model_type': 'mlp', 'hidden_dims': '[512, 64]', 'dropout': 0.3161045113829404, 'batch_norm': False, 'lr': 1.671049234504226e-05, 'weight_decay': 5.20186874162527e-06, 'epochs': 52, 'loss': 'mae', 'optimizer': 'adam', 'graph_mode': 'off', 'use_snp_selection': False}. Best is trial 76 with value: 0.21110188042063088.
[I 2025-12-06 04:49:02,020] Trial 135 finished with value: 0.18493208148718607 and parameters: {'model_type': 'mlp', 'hidden_dims': '[512, 64]', 'dropout': 0.2598402619662684, 'batch_norm': False, 'lr': 9.176278322461005e-06, 'weight_decay': 8.694394888733156e-06, 'epochs': 60, 'loss': 'mae', 'optimizer': 'adam', 'graph_mode': 'off', 'use_snp_selection': False}. Best is trial 76 with value: 0.21110188042063088.
[I 2025-12-06 04:50:36,363] Trial 136 finished with value: 0.18496424179728446 and parameters: {'model_type': 'mlp', 'hidden_dims': '[512, 64]', 'dropout': 0.218244285562236, 'batch_norm': False, 'lr': 3.744617794069963e-06, 'weight_decay': 3.944802018549035e-06, 'epochs': 326, 'loss': 'mae', 'optimizer': 'adam', 'graph_mode': 'off', 'use_snp_selection': False}. Best is trial 76 with value: 0.21110188042063088.
[I 2025-12-06 04:51:20,562] Trial 137 finished with value: 0.19401409684314916 and parameters: {'model_type': 'mlp', 'hidden_dims': '[256, 128]', 'dropout': 0.45748569756764046, 'batch_norm': False, 'lr': 1.5013374340823576e-05, 'weight_decay': 4.199906806829547e-06, 'epochs': 85, 'loss': 'mae', 'optimizer': 'adam', 'graph_mode': 'off', 'use_snp_selection': True, 'num_snps': 31632}. Best is trial 76 with value: 0.21110188042063088.
[I 2025-12-06 04:51:52,180] Trial 138 finished with value: 0.19673748993724732 and parameters: {'model_type': 'mlp', 'hidden_dims': '[512, 64]', 'dropout': 0.2880778170858324, 'batch_norm': False, 'lr': 2.000204647406457e-05, 'weight_decay': 6.972666224608139e-06, 'epochs': 93, 'loss': 'mae', 'optimizer': 'adam', 'graph_mode': 'off', 'use_snp_selection': False}. Best is trial 76 with value: 0.21110188042063088.
[I 2025-12-06 04:52:12,368] Trial 139 finished with value: 0.16463384729981234 and parameters: {'model_type': 'mlp', 'hidden_dims': '[512, 64]', 'dropout': 0.1365307638674698, 'batch_norm': False, 'lr': 1.838214365483872e-05, 'weight_decay': 2.089945510942037e-06, 'epochs': 49, 'loss': 'mae', 'optimizer': 'adam', 'graph_mode': 'off', 'use_snp_selection': False}. Best is trial 76 with value: 0.21110188042063088.
[I 2025-12-06 04:53:12,389] Trial 140 finished with value: 0.19528944349333582 and parameters: {'model_type': 'mlp', 'hidden_dims': '[512, 64]', 'dropout': 0.5622507869821252, 'batch_norm': False, 'lr': 1.2826214994707972e-05, 'weight_decay': 5.7859373210363936e-05, 'epochs': 201, 'loss': 'mae', 'optimizer': 'adam', 'graph_mode': 'off', 'use_snp_selection': False}. Best is trial 76 with value: 0.21110188042063088.
[I 2025-12-06 04:53:36,867] Trial 141 finished with value: 0.18761519573026691 and parameters: {'model_type': 'mlp', 'hidden_dims': '[512, 64]', 'dropout': 0.29007596693115284, 'batch_norm': False, 'lr': 2.2782104262009294e-05, 'weight_decay': 3.3891151235693546e-06, 'epochs': 65, 'loss': 'mae', 'optimizer': 'adam', 'graph_mode': 'off', 'use_snp_selection': False}. Best is trial 76 with value: 0.21110188042063088.
[I 2025-12-06 04:54:04,357] Trial 142 finished with value: 0.198144481658393 and parameters: {'model_type': 'mlp', 'hidden_dims': '[512, 64]', 'dropout': 0.262989516791787, 'batch_norm': False, 'lr': 4.44697871240421e-05, 'weight_decay': 9.86842143286057e-06, 'epochs': 77, 'loss': 'mae', 'optimizer': 'adam', 'graph_mode': 'off', 'use_snp_selection': False}. Best is trial 76 with value: 0.21110188042063088.
[I 2025-12-06 04:54:30,546] Trial 143 finished with value: 0.19948805406311973 and parameters: {'model_type': 'mlp', 'hidden_dims': '[512, 64]', 'dropout': 0.2782366461497402, 'batch_norm': False, 'lr': 3.2890891663831385e-05, 'weight_decay': 1.1924131372019589e-05, 'epochs': 72, 'loss': 'mae', 'optimizer': 'adam', 'graph_mode': 'off', 'use_snp_selection': False}. Best is trial 76 with value: 0.21110188042063088.
[I 2025-12-06 04:54:53,374] Trial 144 finished with value: 0.18991649654507609 and parameters: {'model_type': 'mlp', 'hidden_dims': '[512, 64]', 'dropout': 0.24453387790498335, 'batch_norm': False, 'lr': 2.6654702275725904e-05, 'weight_decay': 4.92724785759197e-06, 'epochs': 59, 'loss': 'mae', 'optimizer': 'adam', 'graph_mode': 'off', 'use_snp_selection': False}. Best is trial 76 with value: 0.21110188042063088.
[I 2025-12-06 04:55:43,084] Trial 145 finished with value: 0.200490724985633 and parameters: {'model_type': 'mlp', 'hidden_dims': '[512, 256]', 'dropout': 0.2994741902348005, 'batch_norm': False, 'lr': 7.201795006618523e-06, 'weight_decay': 1.6573858630796684e-05, 'epochs': 159, 'loss': 'mae', 'optimizer': 'adam', 'graph_mode': 'off', 'use_snp_selection': False}. Best is trial 76 with value: 0.21110188042063088.
[I 2025-12-06 04:57:01,969] Trial 146 finished with value: 0.18066814733594064 and parameters: {'model_type': 'mlp', 'hidden_dims': '[512, 64]', 'dropout': 0.28628652802603244, 'batch_norm': False, 'lr': 1.0167602316257289e-05, 'weight_decay': 2.1745117395551968e-05, 'epochs': 254, 'loss': 'mae', 'optimizer': 'adam', 'graph_mode': 'off', 'use_snp_selection': True, 'num_snps': 36502}. Best is trial 76 with value: 0.21110188042063088.
[I 2025-12-06 04:58:06,018] Trial 147 finished with value: 0.18723379552792468 and parameters: {'model_type': 'mlp', 'hidden_dims': '[512, 128]', 'dropout': 0.19393034792177222, 'batch_norm': False, 'lr': 4.94718243300696e-05, 'weight_decay': 2.7760701802654146e-06, 'epochs': 219, 'loss': 'mae', 'optimizer': 'adam', 'graph_mode': 'off', 'use_snp_selection': False}. Best is trial 76 with value: 0.21110188042063088.
[I 2025-12-06 04:58:45,741] Trial 148 finished with value: 0.19097885479665264 and parameters: {'model_type': 'mlp', 'hidden_dims': '[512, 64]', 'dropout': 0.5908338237826956, 'batch_norm': False, 'lr': 6.302373825731338e-05, 'weight_decay': 8.442838715170894e-06, 'epochs': 125, 'loss': 'mse', 'optimizer': 'adam', 'graph_mode': 'off', 'use_snp_selection': False}. Best is trial 76 with value: 0.21110188042063088.
[I 2025-12-06 04:59:16,229] Trial 149 finished with value: 0.1937403978054863 and parameters: {'model_type': 'mlp', 'hidden_dims': '[512, 64]', 'dropout': 0.26963647776917826, 'batch_norm': False, 'lr': 2.1971661983785822e-05, 'weight_decay': 6.498281089787406e-06, 'epochs': 88, 'loss': 'mae', 'optimizer': 'adam', 'graph_mode': 'off', 'use_snp_selection': False}. Best is trial 76 with value: 0.21110188042063088.
[I 2025-12-06 05:00:22,209] Trial 0 finished with value: 0.1965749456910224 and parameters: {'model_type': 'mlp', 'hidden_dims': '[128, 64]', 'dropout': 0.199031432379812, 'batch_norm': True, 'lr': 1.8408544111075837e-06, 'weight_decay': 5.5136510071208614e-05, 'epochs': 336, 'loss': 'mae', 'optimizer': 'adam', 'graph_mode': 'off', 'use_snp_selection': True, 'num_snps': 43862}. Best is trial 0 with value: 0.1965749456910224.
[I 2025-12-06 05:01:02,585] Trial 1 finished with value: 0.23964971627102966 and parameters: {'model_type': 'mlp', 'hidden_dims': '[256, 128]', 'dropout': 0.4370668075331726, 'batch_norm': True, 'lr': 7.133471581159139e-05, 'weight_decay': 1.128633586803549e-05, 'epochs': 242, 'loss': 'mae', 'optimizer': 'adam', 'graph_mode': 'off', 'use_snp_selection': False}. Best is trial 1 with value: 0.23964971627102966.
[I 2025-12-06 05:01:39,471] Trial 2 finished with value: 0.19544874538585336 and parameters: {'model_type': 'mlp', 'hidden_dims': '[256, 128, 64]', 'dropout': 0.41314357415569625, 'batch_norm': False, 'lr': 3.952233718592101e-06, 'weight_decay': 0.00026754769258252603, 'epochs': 149, 'loss': 'mse', 'optimizer': 'adam', 'graph_mode': 'off', 'use_snp_selection': True, 'num_snps': 11571}. Best is trial 1 with value: 0.23964971627102966.
[I 2025-12-06 05:03:13,362] Trial 3 finished with value: 0.23819374905648488 and parameters: {'model_type': 'mlp', 'hidden_dims': '[512, 64]', 'dropout': 0.5938127374509361, 'batch_norm': False, 'lr': 5.67704586114731e-06, 'weight_decay': 2.4518087630137052e-05, 'epochs': 320, 'loss': 'mae', 'optimizer': 'adam', 'graph_mode': 'off', 'use_snp_selection': False}. Best is trial 1 with value: 0.23964971627102966.
[I 2025-12-06 05:04:38,494] Trial 4 finished with value: 0.18049981655344566 and parameters: {'model_type': 'mlp', 'hidden_dims': '[512, 128]', 'dropout': 0.25746343592134413, 'batch_norm': True, 'lr': 1.3467657668402788e-06, 'weight_decay': 0.00033087251918647806, 'epochs': 277, 'loss': 'mse', 'optimizer': 'adam', 'graph_mode': 'off', 'use_snp_selection': True, 'num_snps': 36675}. Best is trial 1 with value: 0.23964971627102966.
[I 2025-12-06 05:05:38,143] Trial 5 finished with value: 0.16964288992626847 and parameters: {'model_type': 'mlp', 'hidden_dims': '[512, 64]', 'dropout': 0.38275350994408375, 'batch_norm': True, 'lr': 1.5586664309232824e-06, 'weight_decay': 0.0008227664668621182, 'epochs': 145, 'loss': 'mae', 'optimizer': 'adam', 'graph_mode': 'off', 'use_snp_selection': True, 'num_snps': 32148}. Best is trial 1 with value: 0.23964971627102966.
[I 2025-12-06 05:06:11,751] Trial 6 finished with value: 0.236525564523603 and parameters: {'model_type': 'mlp', 'hidden_dims': '[256, 128]', 'dropout': 0.3930109900265879, 'batch_norm': False, 'lr': 4.892964372128395e-05, 'weight_decay': 1.5809549317992182e-06, 'epochs': 199, 'loss': 'mse', 'optimizer': 'adam', 'graph_mode': 'off', 'use_snp_selection': False}. Best is trial 1 with value: 0.23964971627102966.
[I 2025-12-06 05:06:45,921] Trial 7 finished with value: 0.23367324416901628 and parameters: {'model_type': 'mlp', 'hidden_dims': '[512, 256]', 'dropout': 0.15343979219678458, 'batch_norm': True, 'lr': 6.234003099047341e-05, 'weight_decay': 3.894760610535477e-07, 'epochs': 97, 'loss': 'mse', 'optimizer': 'adam', 'graph_mode': 'off', 'use_snp_selection': False}. Best is trial 1 with value: 0.23964971627102966.
[I 2025-12-06 05:08:19,546] Trial 8 finished with value: 0.24918415126370458 and parameters: {'model_type': 'mlp', 'hidden_dims': '[512, 128]', 'dropout': 0.10743001231661406, 'batch_norm': True, 'lr': 0.00023728538449271062, 'weight_decay': 1.7629071578048637e-05, 'epochs': 312, 'loss': 'mae', 'optimizer': 'adam', 'graph_mode': 'off', 'use_snp_selection': False}. Best is trial 8 with value: 0.24918415126370458.
[I 2025-12-06 05:09:15,486] Trial 9 finished with value: 0.24206880604858477 and parameters: {'model_type': 'mlp', 'hidden_dims': '[512, 64]', 'dropout': 0.14505336736221927, 'batch_norm': True, 'lr': 5.8619638388111826e-05, 'weight_decay': 6.200156172669308e-07, 'epochs': 175, 'loss': 'mse', 'optimizer': 'adam', 'graph_mode': 'off', 'use_snp_selection': False}. Best is trial 8 with value: 0.24918415126370458.
[I 2025-12-06 05:09:37,751] Trial 10 finished with value: 0.17688058334641857 and parameters: {'model_type': 'mlp', 'hidden_dims': '[512, 128]', 'dropout': 0.2800030442581858, 'batch_norm': False, 'lr': 0.0004919806695968258, 'weight_decay': 2.9953888095455486e-06, 'epochs': 55, 'loss': 'mae', 'optimizer': 'adam', 'graph_mode': 'off', 'use_snp_selection': False}. Best is trial 8 with value: 0.24918415126370458.
[I 2025-12-06 05:10:44,929] Trial 11 finished with value: 0.2339626654795067 and parameters: {'model_type': 'mlp', 'hidden_dims': '[512, 128]', 'dropout': 0.10095648685224448, 'batch_norm': True, 'lr': 0.0003411435764085616, 'weight_decay': 1.2045055692919657e-07, 'epochs': 216, 'loss': 'mse', 'optimizer': 'adam', 'graph_mode': 'off', 'use_snp_selection': False}. Best is trial 8 with value: 0.24918415126370458.
[I 2025-12-06 05:12:10,146] Trial 12 finished with value: 0.2479672228832614 and parameters: {'model_type': 'mlp', 'hidden_dims': '[512, 64]', 'dropout': 0.10344600881777158, 'batch_norm': True, 'lr': 0.00018400807026440393, 'weight_decay': 2.071258764988014e-06, 'epochs': 281, 'loss': 'mae', 'optimizer': 'adam', 'graph_mode': 'off', 'use_snp_selection': False}. Best is trial 8 with value: 0.24918415126370458.
[I 2025-12-06 05:12:36,767] Trial 13 finished with value: 0.24017524033777785 and parameters: {'model_type': 'mlp', 'hidden_dims': '[128, 64]', 'dropout': 0.24294613148916022, 'batch_norm': True, 'lr': 0.00020209017454184854, 'weight_decay': 4.439089487662099e-06, 'epochs': 285, 'loss': 'mae', 'optimizer': 'adam', 'graph_mode': 'off', 'use_snp_selection': False}. Best is trial 8 with value: 0.24918415126370458.
[I 2025-12-06 05:13:23,906] Trial 14 finished with value: 0.22950129065227162 and parameters: {'model_type': 'mlp', 'hidden_dims': '[256, 128, 64]', 'dropout': 0.3221595656802847, 'batch_norm': True, 'lr': 0.0008417026281429627, 'weight_decay': 5.724103314313124e-05, 'epochs': 282, 'loss': 'mae', 'optimizer': 'adam', 'graph_mode': 'off', 'use_snp_selection': False}. Best is trial 8 with value: 0.24918415126370458.
[I 2025-12-06 05:14:42,192] Trial 15 finished with value: 0.24584263811305038 and parameters: {'model_type': 'mlp', 'hidden_dims': '[512, 256]', 'dropout': 0.10515697852451877, 'batch_norm': True, 'lr': 0.0001572871022003765, 'weight_decay': 1.2913386141637801e-05, 'epochs': 254, 'loss': 'mae', 'optimizer': 'adam', 'graph_mode': 'off', 'use_snp_selection': False}. Best is trial 8 with value: 0.24918415126370458.
[I 2025-12-06 05:16:26,772] Trial 16 finished with value: 0.22069461467082604 and parameters: {'model_type': 'mlp', 'hidden_dims': '[512, 128]', 'dropout': 0.19236941781656602, 'batch_norm': True, 'lr': 1.2586985041154999e-05, 'weight_decay': 1.3863650262743918e-06, 'epochs': 350, 'loss': 'mae', 'optimizer': 'adam', 'graph_mode': 'off', 'use_snp_selection': False}. Best is trial 8 with value: 0.24918415126370458.
[I 2025-12-06 05:18:00,349] Trial 17 finished with value: 0.2391875606017692 and parameters: {'model_type': 'mlp', 'hidden_dims': '[512, 64]', 'dropout': 0.5434692890636532, 'batch_norm': True, 'lr': 2.349300150160787e-05, 'weight_decay': 4.44481515892685e-05, 'epochs': 311, 'loss': 'mae', 'optimizer': 'adam', 'graph_mode': 'off', 'use_snp_selection': False}. Best is trial 8 with value: 0.24918415126370458.
[I 2025-12-06 05:19:47,197] Trial 18 finished with value: 0.23363257161590165 and parameters: {'model_type': 'mlp', 'hidden_dims': '[512, 128]', 'dropout': 0.46470375425664545, 'batch_norm': False, 'lr': 0.0001366564573077262, 'weight_decay': 5.2170752646525835e-06, 'epochs': 240, 'loss': 'mae', 'optimizer': 'adam', 'graph_mode': 'off', 'use_snp_selection': True, 'num_snps': 58241}. Best is trial 8 with value: 0.24918415126370458.
[I 2025-12-06 05:21:18,403] Trial 19 finished with value: 0.23584355518997419 and parameters: {'model_type': 'mlp', 'hidden_dims': '[512, 64]', 'dropout': 0.31848849517917976, 'batch_norm': True, 'lr': 0.00086785817604629, 'weight_decay': 1.1354159408743119e-07, 'epochs': 305, 'loss': 'mae', 'optimizer': 'adam', 'graph_mode': 'off', 'use_snp_selection': False}. Best is trial 8 with value: 0.24918415126370458.
[I 2025-12-06 05:21:43,521] Trial 20 finished with value: 0.2333156567062659 and parameters: {'model_type': 'mlp', 'hidden_dims': '[128, 64]', 'dropout': 0.19812532526213855, 'batch_norm': True, 'lr': 0.0002995209451731648, 'weight_decay': 0.0001247981980720522, 'epochs': 264, 'loss': 'mae', 'optimizer': 'adam', 'graph_mode': 'off', 'use_snp_selection': False}. Best is trial 8 with value: 0.24918415126370458.
[I 2025-12-06 05:22:55,570] Trial 21 finished with value: 0.24593664456675604 and parameters: {'model_type': 'mlp', 'hidden_dims': '[512, 256]', 'dropout': 0.10125817542847075, 'batch_norm': True, 'lr': 0.0001233861441709155, 'weight_decay': 1.2376356659961615e-05, 'epochs': 232, 'loss': 'mae', 'optimizer': 'adam', 'graph_mode': 'off', 'use_snp_selection': False}. Best is trial 8 with value: 0.24918415126370458.
[I 2025-12-06 05:24:05,116] Trial 22 finished with value: 0.24568230276589326 and parameters: {'model_type': 'mlp', 'hidden_dims': '[512, 256]', 'dropout': 0.1365175406313252, 'batch_norm': True, 'lr': 0.0001230859243709366, 'weight_decay': 1.6399047316866625e-05, 'epochs': 223, 'loss': 'mae', 'optimizer': 'adam', 'graph_mode': 'off', 'use_snp_selection': False}. Best is trial 8 with value: 0.24918415126370458.
[I 2025-12-06 05:25:36,297] Trial 23 finished with value: 0.252174980633632 and parameters: {'model_type': 'mlp', 'hidden_dims': '[512, 256]', 'dropout': 0.16618261289875408, 'batch_norm': True, 'lr': 3.2382979861305656e-05, 'weight_decay': 6.127615875489793e-06, 'epochs': 301, 'loss': 'mae', 'optimizer': 'adam', 'graph_mode': 'off', 'use_snp_selection': False}. Best is trial 23 with value: 0.252174980633632.
[I 2025-12-06 05:27:07,421] Trial 24 finished with value: 0.2398787394325626 and parameters: {'model_type': 'mlp', 'hidden_dims': '[512, 256]', 'dropout': 0.16273626112275727, 'batch_norm': True, 'lr': 2.6656174602389554e-05, 'weight_decay': 1.794022213356721e-06, 'epochs': 300, 'loss': 'mae', 'optimizer': 'adam', 'graph_mode': 'off', 'use_snp_selection': False}. Best is trial 23 with value: 0.252174980633632.
[I 2025-12-06 05:28:01,423] Trial 25 finished with value: 0.23442661251019886 and parameters: {'model_type': 'mlp', 'hidden_dims': '[256, 128, 64]', 'dropout': 0.20659399060640368, 'batch_norm': True, 'lr': 1.4271291144939137e-05, 'weight_decay': 5.865926025582105e-06, 'epochs': 330, 'loss': 'mae', 'optimizer': 'adam', 'graph_mode': 'off', 'use_snp_selection': False}. Best is trial 23 with value: 0.252174980633632.
[I 2025-12-06 05:28:35,786] Trial 26 finished with value: 0.16907600757587946 and parameters: {'model_type': 'mlp', 'hidden_dims': '[256, 128]', 'dropout': 0.22606653931922838, 'batch_norm': True, 'lr': 0.0004335817110375476, 'weight_decay': 6.216455498105533e-07, 'epochs': 345, 'loss': 'mae', 'optimizer': 'adam', 'graph_mode': 'off', 'use_snp_selection': True, 'num_snps': 3842}. Best is trial 23 with value: 0.252174980633632.
[I 2025-12-06 05:30:01,661] Trial 27 finished with value: 0.23572328055473407 and parameters: {'model_type': 'mlp', 'hidden_dims': '[512, 128]', 'dropout': 0.1663464079810561, 'batch_norm': False, 'lr': 0.00023115910701526637, 'weight_decay': 2.6086871179536294e-05, 'epochs': 294, 'loss': 'mae', 'optimizer': 'adam', 'graph_mode': 'off', 'use_snp_selection': False}. Best is trial 23 with value: 0.252174980633632.
[I 2025-12-06 05:31:22,323] Trial 28 finished with value: 0.2238833627389209 and parameters: {'model_type': 'mlp', 'hidden_dims': '[512, 64]', 'dropout': 0.28093507872716894, 'batch_norm': True, 'lr': 1.094990034050885e-05, 'weight_decay': 3.011663751443734e-06, 'epochs': 265, 'loss': 'mae', 'optimizer': 'adam', 'graph_mode': 'off', 'use_snp_selection': False}. Best is trial 23 with value: 0.252174980633632.
[I 2025-12-06 05:32:05,314] Trial 29 finished with value: 0.21617620436897939 and parameters: {'model_type': 'mlp', 'hidden_dims': '[128, 64]', 'dropout': 0.1299602604460052, 'batch_norm': True, 'lr': 8.933493341513789e-05, 'weight_decay': 7.053866336258918e-05, 'epochs': 323, 'loss': 'mae', 'optimizer': 'adam', 'graph_mode': 'off', 'use_snp_selection': True, 'num_snps': 19468}. Best is trial 23 with value: 0.252174980633632.
[I 2025-12-06 05:33:07,096] Trial 30 finished with value: 0.23460534744619155 and parameters: {'model_type': 'mlp', 'hidden_dims': '[512, 256]', 'dropout': 0.18328990745321205, 'batch_norm': True, 'lr': 4.209639098608223e-05, 'weight_decay': 6.3175895207505055e-06, 'epochs': 198, 'loss': 'mae', 'optimizer': 'adam', 'graph_mode': 'off', 'use_snp_selection': False}. Best is trial 23 with value: 0.252174980633632.
