[I 2025-12-05 16:24:32,447] Trial 103 finished with value: 0.20080639960348642 and parameters: {'model_type': 'mlp', 'hidden_dims': '[512, 128]', 'dropout': 0.28162576017451413, 'batch_norm': False, 'lr': 1.4050801078650697e-06, 'weight_decay': 1.0716926938243408e-05, 'epochs': 153, 'loss': 'mae', 'optimizer': 'adam', 'graph_mode': 'off', 'use_snp_selection': False}. Best is trial 82 with value: 0.22977306550283125.
[I 2025-12-05 16:25:30,282] Trial 104 finished with value: 0.21676173085855419 and parameters: {'model_type': 'mlp', 'hidden_dims': '[512, 128]', 'dropout': 0.33580455667328746, 'batch_norm': False, 'lr': 1.7492376015240875e-06, 'weight_decay': 3.0255281151614293e-05, 'epochs': 177, 'loss': 'mae', 'optimizer': 'adam', 'graph_mode': 'off', 'use_snp_selection': False}. Best is trial 82 with value: 0.22977306550283125.
[I 2025-12-05 16:26:35,712] Trial 105 finished with value: 0.21127612483375874 and parameters: {'model_type': 'mlp', 'hidden_dims': '[512, 64]', 'dropout': 0.2747796715804376, 'batch_norm': False, 'lr': 1.1366189287225779e-06, 'weight_decay': 6.137442858302053e-05, 'epochs': 204, 'loss': 'mae', 'optimizer': 'adam', 'graph_mode': 'off', 'use_snp_selection': False}. Best is trial 82 with value: 0.22977306550283125.
[I 2025-12-05 16:27:43,696] Trial 106 finished with value: 0.21264576917934472 and parameters: {'model_type': 'mlp', 'hidden_dims': '[512, 128]', 'dropout': 0.26808265832286376, 'batch_norm': False, 'lr': 3.144591748748401e-06, 'weight_decay': 5.117117092725093e-06, 'epochs': 169, 'loss': 'mae', 'optimizer': 'adam', 'graph_mode': 'off', 'use_snp_selection': True, 'num_snps': 34963}. Best is trial 82 with value: 0.22977306550283125.
[I 2025-12-05 16:28:57,745] Trial 107 finished with value: 0.21235707044075816 and parameters: {'model_type': 'mlp', 'hidden_dims': '[512, 64]', 'dropout': 0.3541643634734462, 'batch_norm': False, 'lr': 2.500580764063601e-06, 'weight_decay': 0.00025827955203646123, 'epochs': 237, 'loss': 'mae', 'optimizer': 'adam', 'graph_mode': 'off', 'use_snp_selection': False}. Best is trial 82 with value: 0.22977306550283125.
[I 2025-12-05 16:30:41,707] Trial 108 finished with value: 0.20585535261823748 and parameters: {'model_type': 'mlp', 'hidden_dims': '[512, 128]', 'dropout': 0.2913177984755615, 'batch_norm': False, 'lr': 5.898038971047307e-06, 'weight_decay': 2.487767790588005e-05, 'epochs': 340, 'loss': 'mae', 'optimizer': 'adam', 'graph_mode': 'off', 'use_snp_selection': False}. Best is trial 82 with value: 0.22977306550283125.
[I 2025-12-05 16:31:30,957] Trial 109 finished with value: 0.19144642839227802 and parameters: {'model_type': 'mlp', 'hidden_dims': '[512, 64]', 'dropout': 0.3190578963437968, 'batch_norm': False, 'lr': 2.0653528704750564e-06, 'weight_decay': 7.251407034494005e-06, 'epochs': 263, 'loss': 'mae', 'optimizer': 'adam', 'graph_mode': 'off', 'use_snp_selection': True, 'num_snps': 13231}. Best is trial 82 with value: 0.22977306550283125.
[I 2025-12-05 16:32:17,876] Trial 110 finished with value: 0.21998885576809296 and parameters: {'model_type': 'mlp', 'hidden_dims': '[512, 128]', 'dropout': 0.3718765053177989, 'batch_norm': False, 'lr': 1.4458249105712313e-05, 'weight_decay': 1.8214297027426393e-05, 'epochs': 141, 'loss': 'mae', 'optimizer': 'adam', 'graph_mode': 'off', 'use_snp_selection': False}. Best is trial 82 with value: 0.22977306550283125.
[I 2025-12-05 16:33:05,037] Trial 111 finished with value: 0.2163369645526642 and parameters: {'model_type': 'mlp', 'hidden_dims': '[512, 128]', 'dropout': 0.3773802644579335, 'batch_norm': False, 'lr': 1.1796959415080729e-05, 'weight_decay': 3.492468129604988e-05, 'epochs': 141, 'loss': 'mae', 'optimizer': 'adam', 'graph_mode': 'off', 'use_snp_selection': False}. Best is trial 82 with value: 0.22977306550283125.
[I 2025-12-05 16:33:40,968] Trial 112 finished with value: 0.21711562831946152 and parameters: {'model_type': 'mlp', 'hidden_dims': '[512, 128]', 'dropout': 0.3918298370794833, 'batch_norm': False, 'lr': 1.9582123570310383e-05, 'weight_decay': 1.0835676046662254e-05, 'epochs': 100, 'loss': 'mae', 'optimizer': 'adam', 'graph_mode': 'off', 'use_snp_selection': False}. Best is trial 82 with value: 0.22977306550283125.
[I 2025-12-05 16:34:19,237] Trial 113 finished with value: 0.21669007898038584 and parameters: {'model_type': 'mlp', 'hidden_dims': '[512, 128]', 'dropout': 0.40867433002528303, 'batch_norm': False, 'lr': 2.602206334838396e-05, 'weight_decay': 1.7024288619245133e-05, 'epochs': 110, 'loss': 'mae', 'optimizer': 'adam', 'graph_mode': 'off', 'use_snp_selection': False}. Best is trial 82 with value: 0.22977306550283125.
[I 2025-12-05 16:35:28,165] Trial 114 finished with value: 0.20688128413857765 and parameters: {'model_type': 'mlp', 'hidden_dims': '[512, 128]', 'dropout': 0.30789821744599616, 'batch_norm': False, 'lr': 3.927229090791846e-06, 'weight_decay': 0.000532084330103311, 'epochs': 217, 'loss': 'mae', 'optimizer': 'adam', 'graph_mode': 'off', 'use_snp_selection': False}. Best is trial 82 with value: 0.22977306550283125.
[I 2025-12-05 16:35:43,583] Trial 115 finished with value: 0.16691351944723803 and parameters: {'model_type': 'mlp', 'hidden_dims': '[128, 64]', 'dropout': 0.25065186350974616, 'batch_norm': False, 'lr': 1.614727263069335e-06, 'weight_decay': 0.00012881316747220074, 'epochs': 129, 'loss': 'mae', 'optimizer': 'adam', 'graph_mode': 'off', 'use_snp_selection': False}. Best is trial 82 with value: 0.22977306550283125.
[I 2025-12-05 16:37:08,346] Trial 116 finished with value: 0.16789883484588022 and parameters: {'model_type': 'mlp', 'hidden_dims': '[512, 128]', 'dropout': 0.34883286019808185, 'batch_norm': True, 'lr': 2.885711938375392e-06, 'weight_decay': 0.00021299764556470503, 'epochs': 250, 'loss': 'mae', 'optimizer': 'adam', 'graph_mode': 'off', 'use_snp_selection': True, 'num_snps': 38477}. Best is trial 82 with value: 0.22977306550283125.
[I 2025-12-05 16:37:44,794] Trial 117 finished with value: 0.21003019016949337 and parameters: {'model_type': 'mlp', 'hidden_dims': '[256, 128]', 'dropout': 0.3698363261279763, 'batch_norm': False, 'lr': 2.26386670349504e-06, 'weight_decay': 1.8474249288605532e-05, 'epochs': 210, 'loss': 'mae', 'optimizer': 'adam', 'graph_mode': 'off', 'use_snp_selection': False}. Best is trial 82 with value: 0.22977306550283125.
[I 2025-12-05 16:38:35,061] Trial 118 finished with value: 0.20586007561282096 and parameters: {'model_type': 'mlp', 'hidden_dims': '[512, 64]', 'dropout': 0.32262696735714524, 'batch_norm': False, 'lr': 1.3930093467431178e-05, 'weight_decay': 2.473121717965435e-05, 'epochs': 153, 'loss': 'mse', 'optimizer': 'adam', 'graph_mode': 'off', 'use_snp_selection': False}. Best is trial 82 with value: 0.22977306550283125.
[I 2025-12-05 16:39:55,245] Trial 119 finished with value: 0.2063194686472901 and parameters: {'model_type': 'mlp', 'hidden_dims': '[512, 256]', 'dropout': 0.12614145498218446, 'batch_norm': False, 'lr': 4.518639969778703e-06, 'weight_decay': 4.3030648884785706e-05, 'epochs': 194, 'loss': 'mae', 'optimizer': 'adam', 'graph_mode': 'off', 'use_snp_selection': True, 'num_snps': 42543}. Best is trial 82 with value: 0.22977306550283125.
[I 2025-12-05 16:40:41,024] Trial 120 finished with value: 0.16999305623004846 and parameters: {'model_type': 'mlp', 'hidden_dims': '[512, 128]', 'dropout': 0.5386724989966544, 'batch_norm': False, 'lr': 1.7908154521603152e-06, 'weight_decay': 3.0827451787616874e-05, 'epochs': 137, 'loss': 'mae', 'optimizer': 'adam', 'graph_mode': 'off', 'use_snp_selection': False}. Best is trial 82 with value: 0.22977306550283125.
[I 2025-12-05 16:41:47,482] Trial 121 finished with value: 0.20996435055338872 and parameters: {'model_type': 'mlp', 'hidden_dims': '[512, 128]', 'dropout': 0.2945753260859448, 'batch_norm': False, 'lr': 3.3791253819772097e-06, 'weight_decay': 5.435943987242831e-05, 'epochs': 209, 'loss': 'mae', 'optimizer': 'adam', 'graph_mode': 'off', 'use_snp_selection': False}. Best is trial 82 with value: 0.22977306550283125.
[I 2025-12-05 16:42:51,673] Trial 122 finished with value: 0.21118366823604057 and parameters: {'model_type': 'mlp', 'hidden_dims': '[512, 128]', 'dropout': 0.3067879714981532, 'batch_norm': False, 'lr': 8.49818772690364e-06, 'weight_decay': 7.696816250180732e-05, 'epochs': 200, 'loss': 'mae', 'optimizer': 'adam', 'graph_mode': 'off', 'use_snp_selection': False}. Best is trial 82 with value: 0.22977306550283125.
[I 2025-12-05 16:44:04,716] Trial 123 finished with value: 0.2209913490817356 and parameters: {'model_type': 'mlp', 'hidden_dims': '[512, 128]', 'dropout': 0.3948187046153888, 'batch_norm': False, 'lr': 2.9320748444791056e-06, 'weight_decay': 5.390248096274331e-05, 'epochs': 231, 'loss': 'mae', 'optimizer': 'adam', 'graph_mode': 'off', 'use_snp_selection': False}. Best is trial 82 with value: 0.22977306550283125.
[I 2025-12-05 16:45:15,013] Trial 124 finished with value: 0.2033956285102021 and parameters: {'model_type': 'mlp', 'hidden_dims': '[512, 128]', 'dropout': 0.3931249763033206, 'batch_norm': False, 'lr': 4.3484512880886773e-05, 'weight_decay': 1.0764117641486978e-06, 'epochs': 226, 'loss': 'mae', 'optimizer': 'adam', 'graph_mode': 'off', 'use_snp_selection': False}. Best is trial 82 with value: 0.22977306550283125.
[I 2025-12-05 16:46:33,934] Trial 125 finished with value: 0.22229396579680877 and parameters: {'model_type': 'mlp', 'hidden_dims': '[512, 128]', 'dropout': 0.41857124400549217, 'batch_norm': False, 'lr': 2.7319952873471e-06, 'weight_decay': 9.805404505269608e-05, 'epochs': 252, 'loss': 'mae', 'optimizer': 'adam', 'graph_mode': 'off', 'use_snp_selection': False}. Best is trial 82 with value: 0.22977306550283125.
[I 2025-12-05 16:47:47,686] Trial 126 finished with value: 0.20540523748022155 and parameters: {'model_type': 'mlp', 'hidden_dims': '[512, 64]', 'dropout': 0.4555518788488244, 'batch_norm': False, 'lr': 2.813266381338284e-06, 'weight_decay': 0.00010925342997513188, 'epochs': 234, 'loss': 'mae', 'optimizer': 'adam', 'graph_mode': 'off', 'use_snp_selection': False}. Best is trial 82 with value: 0.22977306550283125.
[I 2025-12-05 16:49:08,764] Trial 127 finished with value: 0.21804696448708327 and parameters: {'model_type': 'mlp', 'hidden_dims': '[512, 128]', 'dropout': 0.42076089620486723, 'batch_norm': False, 'lr': 2.487828935324012e-06, 'weight_decay': 9.977108506890106e-05, 'epochs': 259, 'loss': 'mae', 'optimizer': 'adam', 'graph_mode': 'off', 'use_snp_selection': False}. Best is trial 82 with value: 0.22977306550283125.
[I 2025-12-05 16:50:08,956] Trial 128 finished with value: 0.1843182484576266 and parameters: {'model_type': 'mlp', 'hidden_dims': '[256, 128, 64]', 'dropout': 0.4019378816516793, 'batch_norm': False, 'lr': 1.8983121593997505e-06, 'weight_decay': 6.795996772482212e-05, 'epochs': 246, 'loss': 'mae', 'optimizer': 'adam', 'graph_mode': 'off', 'use_snp_selection': True, 'num_snps': 33399}. Best is trial 82 with value: 0.22977306550283125.
[I 2025-12-05 16:51:33,840] Trial 129 finished with value: 0.19961173182521247 and parameters: {'model_type': 'mlp', 'hidden_dims': '[512, 128]', 'dropout': 0.5154705756063231, 'batch_norm': False, 'lr': 1.4154776632106266e-06, 'weight_decay': 0.0003790303939206947, 'epochs': 276, 'loss': 'mae', 'optimizer': 'adam', 'graph_mode': 'off', 'use_snp_selection': False}. Best is trial 82 with value: 0.22977306550283125.
[I 2025-12-05 16:52:43,288] Trial 130 finished with value: 0.20599074438080178 and parameters: {'model_type': 'mlp', 'hidden_dims': '[512, 64]', 'dropout': 0.4180053105318247, 'batch_norm': False, 'lr': 3.926165476962715e-06, 'weight_decay': 5.153034231264549e-05, 'epochs': 219, 'loss': 'mae', 'optimizer': 'adam', 'graph_mode': 'off', 'use_snp_selection': False}. Best is trial 82 with value: 0.22977306550283125.
[I 2025-12-05 16:54:02,855] Trial 131 finished with value: 0.20414057242465553 and parameters: {'model_type': 'mlp', 'hidden_dims': '[512, 128]', 'dropout': 0.3936345430987084, 'batch_norm': False, 'lr': 2.1050269338106198e-06, 'weight_decay': 0.00016595110705606297, 'epochs': 254, 'loss': 'mae', 'optimizer': 'adam', 'graph_mode': 'off', 'use_snp_selection': False}. Best is trial 82 with value: 0.22977306550283125.
[I 2025-12-05 16:55:18,392] Trial 132 finished with value: 0.21103276437695206 and parameters: {'model_type': 'mlp', 'hidden_dims': '[512, 128]', 'dropout': 0.36470493767474715, 'batch_norm': False, 'lr': 3.553350903728506e-06, 'weight_decay': 2.197171469390899e-05, 'epochs': 239, 'loss': 'mae', 'optimizer': 'adam', 'graph_mode': 'off', 'use_snp_selection': False}. Best is trial 82 with value: 0.22977306550283125.
[I 2025-12-05 16:56:31,741] Trial 133 finished with value: 0.21569614471969398 and parameters: {'model_type': 'mlp', 'hidden_dims': '[512, 128]', 'dropout': 0.28328199721163894, 'batch_norm': False, 'lr': 3.2106849452528045e-06, 'weight_decay': 3.857536723069027e-05, 'epochs': 231, 'loss': 'mae', 'optimizer': 'adam', 'graph_mode': 'off', 'use_snp_selection': False}. Best is trial 82 with value: 0.22977306550283125.
[I 2025-12-05 16:57:12,891] Trial 134 finished with value: 0.2044583732092024 and parameters: {'model_type': 'mlp', 'hidden_dims': '[512, 128]', 'dropout': 0.4326332762318997, 'batch_norm': False, 'lr': 2.73405872667658e-06, 'weight_decay': 0.0002812537296757052, 'epochs': 118, 'loss': 'mae', 'optimizer': 'adam', 'graph_mode': 'off', 'use_snp_selection': False}. Best is trial 82 with value: 0.22977306550283125.
[I 2025-12-05 16:58:47,990] Trial 135 finished with value: 0.21147622555699858 and parameters: {'model_type': 'mlp', 'hidden_dims': '[512, 128]', 'dropout': 0.33362684941871523, 'batch_norm': False, 'lr': 2.3058069719745106e-06, 'weight_decay': 3.0504523785251386e-05, 'epochs': 308, 'loss': 'mae', 'optimizer': 'adam', 'graph_mode': 'off', 'use_snp_selection': False}. Best is trial 82 with value: 0.22977306550283125.
[I 2025-12-05 16:59:36,118] Trial 136 finished with value: 0.20726453092774277 and parameters: {'model_type': 'mlp', 'hidden_dims': '[512, 128]', 'dropout': 0.26806044802711815, 'batch_norm': False, 'lr': 5.54624472674564e-06, 'weight_decay': 8.130159956947863e-06, 'epochs': 166, 'loss': 'mae', 'optimizer': 'adam', 'graph_mode': 'off', 'use_snp_selection': True, 'num_snps': 16953}. Best is trial 82 with value: 0.22977306550283125.
[I 2025-12-05 17:01:06,049] Trial 137 finished with value: 0.17422116519319628 and parameters: {'model_type': 'mlp', 'hidden_dims': '[512, 64]', 'dropout': 0.37469148529334695, 'batch_norm': True, 'lr': 1.6014024581952958e-06, 'weight_decay': 1.4354152811961732e-05, 'epochs': 291, 'loss': 'mae', 'optimizer': 'adam', 'graph_mode': 'off', 'use_snp_selection': False}. Best is trial 82 with value: 0.22977306550283125.
[I 2025-12-05 17:02:04,286] Trial 138 finished with value: 0.18723245311641154 and parameters: {'model_type': 'mlp', 'hidden_dims': '[512, 128]', 'dropout': 0.5837190360064908, 'batch_norm': False, 'lr': 1.3522062391460937e-06, 'weight_decay': 0.0001742258706158976, 'epochs': 179, 'loss': 'mse', 'optimizer': 'adam', 'graph_mode': 'off', 'use_snp_selection': False}. Best is trial 82 with value: 0.22977306550283125.
[I 2025-12-05 17:03:12,577] Trial 139 finished with value: 0.21614379709912396 and parameters: {'model_type': 'mlp', 'hidden_dims': '[512, 128]', 'dropout': 0.3880948241320982, 'batch_norm': False, 'lr': 1.9444163727963673e-06, 'weight_decay': 4.361039449095136e-05, 'epochs': 214, 'loss': 'mae', 'optimizer': 'adam', 'graph_mode': 'off', 'use_snp_selection': False}. Best is trial 82 with value: 0.22977306550283125.
[I 2025-12-05 17:03:46,680] Trial 140 finished with value: 0.17862608814590936 and parameters: {'model_type': 'mlp', 'hidden_dims': '[128, 64]', 'dropout': 0.35546223221399337, 'batch_norm': False, 'lr': 4.259966070116221e-06, 'weight_decay': 0.00014032113506775874, 'epochs': 221, 'loss': 'mae', 'optimizer': 'adam', 'graph_mode': 'off', 'use_snp_selection': True, 'num_snps': 6192}. Best is trial 82 with value: 0.22977306550283125.
[I 2025-12-05 17:04:51,856] Trial 141 finished with value: 0.21866795213025592 and parameters: {'model_type': 'mlp', 'hidden_dims': '[512, 128]', 'dropout': 0.29437985681495005, 'batch_norm': False, 'lr': 3.020580066244082e-06, 'weight_decay': 6.103797067489721e-05, 'epochs': 205, 'loss': 'mae', 'optimizer': 'adam', 'graph_mode': 'off', 'use_snp_selection': False}. Best is trial 82 with value: 0.22977306550283125.
[I 2025-12-05 17:06:30,714] Trial 142 finished with value: 0.2135649539299474 and parameters: {'model_type': 'mlp', 'hidden_dims': '[512, 128]', 'dropout': 0.3052026419246784, 'batch_norm': False, 'lr': 2.6013743685345913e-06, 'weight_decay': 5.125641070106005e-05, 'epochs': 322, 'loss': 'mae', 'optimizer': 'adam', 'graph_mode': 'off', 'use_snp_selection': False}. Best is trial 82 with value: 0.22977306550283125.
[I 2025-12-05 17:07:33,469] Trial 143 finished with value: 0.20654567604999619 and parameters: {'model_type': 'mlp', 'hidden_dims': '[512, 128]', 'dropout': 0.3157532291793125, 'batch_norm': False, 'lr': 3.648426868562169e-06, 'weight_decay': 8.297065215183111e-05, 'epochs': 194, 'loss': 'mae', 'optimizer': 'adam', 'graph_mode': 'off', 'use_snp_selection': False}. Best is trial 82 with value: 0.22977306550283125.
[I 2025-12-05 17:08:39,227] Trial 144 finished with value: 0.2180596055657084 and parameters: {'model_type': 'mlp', 'hidden_dims': '[512, 128]', 'dropout': 0.4738802391278786, 'batch_norm': False, 'lr': 2.951348479997117e-06, 'weight_decay': 3.487585300244265e-05, 'epochs': 205, 'loss': 'mae', 'optimizer': 'adam', 'graph_mode': 'off', 'use_snp_selection': False}. Best is trial 82 with value: 0.22977306550283125.
[I 2025-12-05 17:09:55,452] Trial 145 finished with value: 0.21110372545275888 and parameters: {'model_type': 'mlp', 'hidden_dims': '[512, 64]', 'dropout': 0.27928569973856976, 'batch_norm': False, 'lr': 2.217472240435659e-06, 'weight_decay': 2.567763333402549e-05, 'epochs': 242, 'loss': 'mae', 'optimizer': 'adam', 'graph_mode': 'off', 'use_snp_selection': False}. Best is trial 82 with value: 0.22977306550283125.
[I 2025-12-05 17:11:08,980] Trial 146 finished with value: 0.20331487727362116 and parameters: {'model_type': 'mlp', 'hidden_dims': '[512, 128]', 'dropout': 0.25904484757537743, 'batch_norm': False, 'lr': 1.788566289753472e-06, 'weight_decay': 2.062728049623622e-05, 'epochs': 232, 'loss': 'mae', 'optimizer': 'adam', 'graph_mode': 'off', 'use_snp_selection': False}. Best is trial 82 with value: 0.22977306550283125.
[I 2025-12-05 17:11:42,302] Trial 147 finished with value: 0.17210154103176273 and parameters: {'model_type': 'mlp', 'hidden_dims': '[256, 128]', 'dropout': 0.2862330066004036, 'batch_norm': False, 'lr': 1.0003530802269236e-06, 'weight_decay': 1.692156048021183e-05, 'epochs': 185, 'loss': 'mae', 'optimizer': 'adam', 'graph_mode': 'off', 'use_snp_selection': False}. Best is trial 82 with value: 0.22977306550283125.
[I 2025-12-05 17:13:11,810] Trial 148 finished with value: 0.2075562909887528 and parameters: {'model_type': 'mlp', 'hidden_dims': '[512, 128]', 'dropout': 0.5551398943404892, 'batch_norm': False, 'lr': 3.1954423677336004e-06, 'weight_decay': 1.1789258845064022e-05, 'epochs': 223, 'loss': 'mae', 'optimizer': 'adam', 'graph_mode': 'off', 'use_snp_selection': True, 'num_snps': 45914}. Best is trial 82 with value: 0.22977306550283125.
[I 2025-12-05 17:14:15,837] Trial 149 finished with value: 0.20460332430257372 and parameters: {'model_type': 'mlp', 'hidden_dims': '[512, 256]', 'dropout': 0.24564462807603116, 'batch_norm': False, 'lr': 4.910227420473695e-06, 'weight_decay': 5.9160358181275346e-05, 'epochs': 200, 'loss': 'mae', 'optimizer': 'adam', 'graph_mode': 'off', 'use_snp_selection': False}. Best is trial 82 with value: 0.22977306550283125.
[I 2025-12-05 17:15:26,001] Trial 0 finished with value: 0.1439017434457428 and parameters: {'model_type': 'mlp', 'hidden_dims': '[128, 64]', 'dropout': 0.199031432379812, 'batch_norm': True, 'lr': 1.8408544111075837e-06, 'weight_decay': 5.5136510071208614e-05, 'epochs': 336, 'loss': 'mae', 'optimizer': 'adam', 'graph_mode': 'off', 'use_snp_selection': True, 'num_snps': 43862}. Best is trial 0 with value: 0.1439017434457428.
[I 2025-12-05 17:16:07,418] Trial 1 finished with value: 0.17651490139858916 and parameters: {'model_type': 'mlp', 'hidden_dims': '[256, 128]', 'dropout': 0.4370668075331726, 'batch_norm': True, 'lr': 7.133471581159139e-05, 'weight_decay': 1.128633586803549e-05, 'epochs': 242, 'loss': 'mae', 'optimizer': 'adam', 'graph_mode': 'off', 'use_snp_selection': False}. Best is trial 1 with value: 0.17651490139858916.
[I 2025-12-05 17:16:45,811] Trial 2 finished with value: 0.14547437567587476 and parameters: {'model_type': 'mlp', 'hidden_dims': '[256, 128, 64]', 'dropout': 0.41314357415569625, 'batch_norm': False, 'lr': 3.952233718592101e-06, 'weight_decay': 0.00026754769258252603, 'epochs': 149, 'loss': 'mse', 'optimizer': 'adam', 'graph_mode': 'off', 'use_snp_selection': True, 'num_snps': 11571}. Best is trial 1 with value: 0.17651490139858916.
[I 2025-12-05 17:18:23,013] Trial 3 finished with value: 0.19024951900346437 and parameters: {'model_type': 'mlp', 'hidden_dims': '[512, 64]', 'dropout': 0.5938127374509361, 'batch_norm': False, 'lr': 5.67704586114731e-06, 'weight_decay': 2.4518087630137052e-05, 'epochs': 320, 'loss': 'mae', 'optimizer': 'adam', 'graph_mode': 'off', 'use_snp_selection': False}. Best is trial 3 with value: 0.19024951900346437.
[I 2025-12-05 17:19:50,985] Trial 4 finished with value: 0.11717616987524686 and parameters: {'model_type': 'mlp', 'hidden_dims': '[512, 128]', 'dropout': 0.25746343592134413, 'batch_norm': True, 'lr': 1.3467657668402788e-06, 'weight_decay': 0.00033087251918647806, 'epochs': 277, 'loss': 'mse', 'optimizer': 'adam', 'graph_mode': 'off', 'use_snp_selection': True, 'num_snps': 36675}. Best is trial 3 with value: 0.19024951900346437.
