[I 2025-12-05 18:13:05,748] Trial 51 finished with value: 0.3832613767083373 and parameters: {'model_type': 'mlp', 'hidden_dims': '[512, 64]', 'dropout': 0.4772933442783105, 'batch_norm': False, 'lr': 4.001858819168639e-06, 'weight_decay': 0.00018827903254178634, 'epochs': 212, 'loss': 'mae', 'optimizer': 'adam', 'graph_mode': 'off', 'use_snp_selection': True, 'num_snps': 59453}. Best is trial 51 with value: 0.3832613767083373.
[I 2025-12-05 18:14:14,957] Trial 52 finished with value: 0.3715945906901995 and parameters: {'model_type': 'mlp', 'hidden_dims': '[512, 64]', 'dropout': 0.4905011391249634, 'batch_norm': False, 'lr': 3.4123694902593253e-06, 'weight_decay': 0.00011415642288767724, 'epochs': 179, 'loss': 'mae', 'optimizer': 'adam', 'graph_mode': 'off', 'use_snp_selection': True, 'num_snps': 56374}. Best is trial 51 with value: 0.3832613767083373.
[I 2025-12-05 18:15:22,956] Trial 53 finished with value: 0.373339773964923 and parameters: {'model_type': 'mlp', 'hidden_dims': '[512, 64]', 'dropout': 0.4553867628217355, 'batch_norm': False, 'lr': 5.698742376255928e-06, 'weight_decay': 0.0002790363350027575, 'epochs': 199, 'loss': 'mae', 'optimizer': 'adam', 'graph_mode': 'off', 'use_snp_selection': True, 'num_snps': 51395}. Best is trial 51 with value: 0.3832613767083373.
[I 2025-12-05 18:16:43,611] Trial 54 finished with value: 0.3681389912506865 and parameters: {'model_type': 'mlp', 'hidden_dims': '[512, 64]', 'dropout': 0.5270703483369025, 'batch_norm': False, 'lr': 1.3144988406513587e-05, 'weight_decay': 0.00016694022900537504, 'epochs': 227, 'loss': 'mae', 'optimizer': 'adam', 'graph_mode': 'off', 'use_snp_selection': True, 'num_snps': 59907}. Best is trial 51 with value: 0.3832613767083373.
[I 2025-12-05 18:17:28,745] Trial 55 finished with value: 0.36974734161064654 and parameters: {'model_type': 'mlp', 'hidden_dims': '[512, 256]', 'dropout': 0.4624984634770325, 'batch_norm': False, 'lr': 2.530534601811683e-06, 'weight_decay': 1.4913596234301954e-05, 'epochs': 209, 'loss': 'mae', 'optimizer': 'adam', 'graph_mode': 'off', 'use_snp_selection': False}. Best is trial 51 with value: 0.3832613767083373.
[I 2025-12-05 18:18:50,354] Trial 56 finished with value: 0.3717142112425071 and parameters: {'model_type': 'mlp', 'hidden_dims': '[512, 64]', 'dropout': 0.27943402605574275, 'batch_norm': False, 'lr': 1.3165247911781307e-06, 'weight_decay': 8.164036780843518e-06, 'epochs': 250, 'loss': 'mae', 'optimizer': 'adam', 'graph_mode': 'off', 'use_snp_selection': True, 'num_snps': 56297}. Best is trial 51 with value: 0.3832613767083373.
[I 2025-12-05 18:19:33,440] Trial 57 finished with value: 0.37488907748872285 and parameters: {'model_type': 'mlp', 'hidden_dims': '[256, 128, 64]', 'dropout': 0.3577237524890722, 'batch_norm': False, 'lr': 4.9494530428851955e-06, 'weight_decay': 4.633329496004683e-05, 'epochs': 234, 'loss': 'mae', 'optimizer': 'adam', 'graph_mode': 'off', 'use_snp_selection': True, 'num_snps': 32091}. Best is trial 51 with value: 0.3832613767083373.
[I 2025-12-05 18:20:04,608] Trial 58 finished with value: 0.047948757145094466 and parameters: {'model_type': 'mlp', 'hidden_dims': '[512, 64]', 'dropout': 0.5471163915308324, 'batch_norm': False, 'lr': 0.0008952138285772197, 'weight_decay': 1.5279549042073658e-07, 'epochs': 141, 'loss': 'mae', 'optimizer': 'adam', 'graph_mode': 'off', 'use_snp_selection': False}. Best is trial 51 with value: 0.3832613767083373.
[I 2025-12-05 18:21:47,479] Trial 59 finished with value: 0.36457866500932723 and parameters: {'model_type': 'mlp', 'hidden_dims': '[512, 64]', 'dropout': 0.32892488817426163, 'batch_norm': False, 'lr': 7.195569992437295e-06, 'weight_decay': 0.0004471560903997249, 'epochs': 345, 'loss': 'mae', 'optimizer': 'adam', 'graph_mode': 'off', 'use_snp_selection': True, 'num_snps': 59999}. Best is trial 51 with value: 0.3832613767083373.
[I 2025-12-05 18:22:45,895] Trial 60 finished with value: 0.3742083583361535 and parameters: {'model_type': 'mlp', 'hidden_dims': '[256, 128]', 'dropout': 0.5031609424794777, 'batch_norm': False, 'lr': 2.9988320612880976e-06, 'weight_decay': 2.8619642557417384e-05, 'epochs': 270, 'loss': 'mse', 'optimizer': 'adam', 'graph_mode': 'off', 'use_snp_selection': True, 'num_snps': 50676}. Best is trial 51 with value: 0.3832613767083373.
[I 2025-12-05 18:24:02,845] Trial 61 finished with value: 0.3770663866891829 and parameters: {'model_type': 'mlp', 'hidden_dims': '[512, 64]', 'dropout': 0.48181630256027563, 'batch_norm': False, 'lr': 3.2968211137109653e-06, 'weight_decay': 0.00019601448983516442, 'epochs': 220, 'loss': 'mae', 'optimizer': 'adam', 'graph_mode': 'off', 'use_snp_selection': True, 'num_snps': 57064}. Best is trial 51 with value: 0.3832613767083373.
[I 2025-12-05 18:25:18,751] Trial 62 finished with value: 0.3768229314236017 and parameters: {'model_type': 'mlp', 'hidden_dims': '[512, 64]', 'dropout': 0.4775065021373763, 'batch_norm': False, 'lr': 3.930070323859019e-06, 'weight_decay': 0.00024940374278349306, 'epochs': 216, 'loss': 'mae', 'optimizer': 'adam', 'graph_mode': 'off', 'use_snp_selection': True, 'num_snps': 56969}. Best is trial 51 with value: 0.3832613767083373.
[I 2025-12-05 18:26:31,246] Trial 63 finished with value: 0.3787603545354373 and parameters: {'model_type': 'mlp', 'hidden_dims': '[512, 64]', 'dropout': 0.43432843863904175, 'batch_norm': False, 'lr': 4.343845857528474e-06, 'weight_decay': 0.0003130774986749914, 'epochs': 195, 'loss': 'mae', 'optimizer': 'adam', 'graph_mode': 'off', 'use_snp_selection': True, 'num_snps': 57262}. Best is trial 51 with value: 0.3832613767083373.
[I 2025-12-05 18:27:43,014] Trial 64 finished with value: 0.37263534129100473 and parameters: {'model_type': 'mlp', 'hidden_dims': '[512, 64]', 'dropout': 0.4448334026343696, 'batch_norm': False, 'lr': 2.074652733292669e-06, 'weight_decay': 0.0006453686792040809, 'epochs': 192, 'loss': 'mae', 'optimizer': 'adam', 'graph_mode': 'off', 'use_snp_selection': True, 'num_snps': 56212}. Best is trial 51 with value: 0.3832613767083373.
[I 2025-12-05 18:28:59,397] Trial 65 finished with value: 0.37434088856287634 and parameters: {'model_type': 'mlp', 'hidden_dims': '[512, 64]', 'dropout': 0.4696181291103273, 'batch_norm': False, 'lr': 4.391148236810659e-06, 'weight_decay': 0.00025266351513566473, 'epochs': 217, 'loss': 'mae', 'optimizer': 'adam', 'graph_mode': 'off', 'use_snp_selection': True, 'num_snps': 57372}. Best is trial 51 with value: 0.3832613767083373.
[I 2025-12-05 18:30:14,501] Trial 66 finished with value: 0.36491024008491907 and parameters: {'model_type': 'mlp', 'hidden_dims': '[512, 64]', 'dropout': 0.4268854718569378, 'batch_norm': False, 'lr': 1.0472520818938931e-05, 'weight_decay': 0.0003318452983932933, 'epochs': 236, 'loss': 'mae', 'optimizer': 'adam', 'graph_mode': 'off', 'use_snp_selection': True, 'num_snps': 52486}. Best is trial 51 with value: 0.3832613767083373.
[I 2025-12-05 18:31:23,683] Trial 67 finished with value: 0.36585492654596896 and parameters: {'model_type': 'mlp', 'hidden_dims': '[512, 64]', 'dropout': 0.5144937350796984, 'batch_norm': False, 'lr': 2.7211336959333977e-06, 'weight_decay': 8.887318964284583e-05, 'epochs': 176, 'loss': 'mae', 'optimizer': 'adam', 'graph_mode': 'off', 'use_snp_selection': True, 'num_snps': 57244}. Best is trial 51 with value: 0.3832613767083373.
[I 2025-12-05 18:32:06,887] Trial 68 finished with value: 0.37028382806273324 and parameters: {'model_type': 'mlp', 'hidden_dims': '[128, 64]', 'dropout': 0.40343122988218594, 'batch_norm': False, 'lr': 3.9325142156705e-06, 'weight_decay': 0.00045084275184210736, 'epochs': 207, 'loss': 'mae', 'optimizer': 'adam', 'graph_mode': 'off', 'use_snp_selection': True, 'num_snps': 47531}. Best is trial 51 with value: 0.3832613767083373.
[I 2025-12-05 18:33:15,298] Trial 69 finished with value: 0.37588785018148596 and parameters: {'model_type': 'mlp', 'hidden_dims': '[512, 128]', 'dropout': 0.4356743433562648, 'batch_norm': False, 'lr': 6.276216533025112e-06, 'weight_decay': 0.00018863018324049262, 'epochs': 193, 'loss': 'mae', 'optimizer': 'adam', 'graph_mode': 'off', 'use_snp_selection': True, 'num_snps': 52755}. Best is trial 51 with value: 0.3832613767083373.
[I 2025-12-05 18:33:48,315] Trial 70 finished with value: 0.32302039831074336 and parameters: {'model_type': 'mlp', 'hidden_dims': '[512, 64]', 'dropout': 0.49777995690032656, 'batch_norm': False, 'lr': 1.2171332810280742e-06, 'weight_decay': 0.00012501899415255286, 'epochs': 219, 'loss': 'mae', 'optimizer': 'adam', 'graph_mode': 'off', 'use_snp_selection': True, 'num_snps': 11824}. Best is trial 51 with value: 0.3832613767083373.
[I 2025-12-05 18:34:56,197] Trial 71 finished with value: 0.3729984998126821 and parameters: {'model_type': 'mlp', 'hidden_dims': '[512, 64]', 'dropout': 0.48952808852627566, 'batch_norm': False, 'lr': 8.508019633324694e-06, 'weight_decay': 0.0002634087483833951, 'epochs': 170, 'loss': 'mae', 'optimizer': 'adam', 'graph_mode': 'off', 'use_snp_selection': True, 'num_snps': 57198}. Best is trial 51 with value: 0.3832613767083373.
[I 2025-12-05 18:35:44,368] Trial 72 finished with value: 0.36808272596451347 and parameters: {'model_type': 'mlp', 'hidden_dims': '[512, 64]', 'dropout': 0.37823894310992884, 'batch_norm': False, 'lr': 5.12877005972542e-06, 'weight_decay': 6.153898159274007e-05, 'epochs': 227, 'loss': 'mae', 'optimizer': 'adam', 'graph_mode': 'off', 'use_snp_selection': False}. Best is trial 51 with value: 0.3832613767083373.
[I 2025-12-05 18:37:02,566] Trial 73 finished with value: 0.3762165290848518 and parameters: {'model_type': 'mlp', 'hidden_dims': '[512, 64]', 'dropout': 0.4684662040018685, 'batch_norm': False, 'lr': 3.0613453566727348e-06, 'weight_decay': 0.0001561373618499773, 'epochs': 211, 'loss': 'mae', 'optimizer': 'adam', 'graph_mode': 'off', 'use_snp_selection': True, 'num_snps': 59869}. Best is trial 51 with value: 0.3832613767083373.
[I 2025-12-05 18:37:55,722] Trial 74 finished with value: 0.32029320336982225 and parameters: {'model_type': 'mlp', 'hidden_dims': '[256, 128, 64]', 'dropout': 0.5329010486998353, 'batch_norm': True, 'lr': 3.917260225931907e-06, 'weight_decay': 1.8327767003397473e-06, 'epochs': 182, 'loss': 'mae', 'optimizer': 'adam', 'graph_mode': 'off', 'use_snp_selection': True, 'num_snps': 54651}. Best is trial 51 with value: 0.3832613767083373.
[I 2025-12-05 18:39:03,678] Trial 75 finished with value: 0.37151057001729765 and parameters: {'model_type': 'mlp', 'hidden_dims': '[512, 256]', 'dropout': 0.5098226671523425, 'batch_norm': False, 'lr': 2.2558896537151363e-06, 'weight_decay': 0.00021122271448560006, 'epochs': 196, 'loss': 'mae', 'optimizer': 'adam', 'graph_mode': 'off', 'use_snp_selection': True, 'num_snps': 50945}. Best is trial 51 with value: 0.3832613767083373.
[I 2025-12-05 18:40:34,662] Trial 76 finished with value: 0.37702582945341623 and parameters: {'model_type': 'mlp', 'hidden_dims': '[512, 64]', 'dropout': 0.5580754546623777, 'batch_norm': False, 'lr': 5.000535727876006e-06, 'weight_decay': 8.758782302070191e-05, 'epochs': 301, 'loss': 'mae', 'optimizer': 'adam', 'graph_mode': 'off', 'use_snp_selection': True, 'num_snps': 57500}. Best is trial 51 with value: 0.3832613767083373.
[I 2025-12-05 18:41:57,546] Trial 77 finished with value: 0.37303741500121096 and parameters: {'model_type': 'mlp', 'hidden_dims': '[512, 64]', 'dropout': 0.5585959944162904, 'batch_norm': False, 'lr': 5.005962482151116e-06, 'weight_decay': 0.00036368562653059925, 'epochs': 256, 'loss': 'mae', 'optimizer': 'adam', 'graph_mode': 'off', 'use_snp_selection': True, 'num_snps': 57099}. Best is trial 51 with value: 0.3832613767083373.
[I 2025-12-05 18:43:26,673] Trial 78 finished with value: 0.371029421613922 and parameters: {'model_type': 'mlp', 'hidden_dims': '[512, 64]', 'dropout': 0.5826850509498819, 'batch_norm': False, 'lr': 6.524538164354463e-06, 'weight_decay': 0.0005394581683389054, 'epochs': 290, 'loss': 'mae', 'optimizer': 'adam', 'graph_mode': 'off', 'use_snp_selection': True, 'num_snps': 57626}. Best is trial 51 with value: 0.3832613767083373.
[I 2025-12-05 18:44:30,433] Trial 79 finished with value: 0.36656865111371184 and parameters: {'model_type': 'mlp', 'hidden_dims': '[512, 64]', 'dropout': 0.48628091855548217, 'batch_norm': False, 'lr': 1.7778696764111069e-06, 'weight_decay': 0.000999039446957231, 'epochs': 161, 'loss': 'mse', 'optimizer': 'adam', 'graph_mode': 'off', 'use_snp_selection': True, 'num_snps': 53491}. Best is trial 51 with value: 0.3832613767083373.
[I 2025-12-05 18:45:29,873] Trial 80 finished with value: 0.3594245809698872 and parameters: {'model_type': 'mlp', 'hidden_dims': '[512, 64]', 'dropout': 0.18343483152805126, 'batch_norm': False, 'lr': 1.5761878823747895e-05, 'weight_decay': 7.817588733621108e-05, 'epochs': 237, 'loss': 'mae', 'optimizer': 'adam', 'graph_mode': 'off', 'use_snp_selection': True, 'num_snps': 36700}. Best is trial 51 with value: 0.3832613767083373.
[I 2025-12-05 18:47:01,214] Trial 81 finished with value: 0.3767402478947703 and parameters: {'model_type': 'mlp', 'hidden_dims': '[512, 64]', 'dropout': 0.5540130724960505, 'batch_norm': False, 'lr': 3.364181470013792e-06, 'weight_decay': 3.6872188603171053e-05, 'epochs': 323, 'loss': 'mae', 'optimizer': 'adam', 'graph_mode': 'off', 'use_snp_selection': True, 'num_snps': 55028}. Best is trial 51 with value: 0.3832613767083373.
[I 2025-12-05 18:48:37,812] Trial 82 finished with value: 0.371299298908748 and parameters: {'model_type': 'mlp', 'hidden_dims': '[512, 64]', 'dropout': 0.44566230482653046, 'batch_norm': False, 'lr': 3.347814016067715e-06, 'weight_decay': 0.00013044642767564427, 'epochs': 327, 'loss': 'mae', 'optimizer': 'adam', 'graph_mode': 'off', 'use_snp_selection': True, 'num_snps': 58249}. Best is trial 51 with value: 0.3832613767083373.
[I 2025-12-05 18:50:06,229] Trial 83 finished with value: 0.3762724448825332 and parameters: {'model_type': 'mlp', 'hidden_dims': '[512, 64]', 'dropout': 0.5212593098462435, 'batch_norm': False, 'lr': 2.6467334095257567e-06, 'weight_decay': 3.512994743433884e-05, 'epochs': 303, 'loss': 'mae', 'optimizer': 'adam', 'graph_mode': 'off', 'use_snp_selection': True, 'num_snps': 55115}. Best is trial 51 with value: 0.3832613767083373.
[I 2025-12-05 18:51:38,096] Trial 84 finished with value: 0.3737632196348834 and parameters: {'model_type': 'mlp', 'hidden_dims': '[512, 64]', 'dropout': 0.5566904270888395, 'batch_norm': False, 'lr': 4.352117567668895e-06, 'weight_decay': 0.00010356624961619233, 'epochs': 340, 'loss': 'mae', 'optimizer': 'adam', 'graph_mode': 'off', 'use_snp_selection': True, 'num_snps': 52695}. Best is trial 51 with value: 0.3832613767083373.
[I 2025-12-05 18:52:45,670] Trial 85 finished with value: 0.37094026100577604 and parameters: {'model_type': 'mlp', 'hidden_dims': '[256, 128]', 'dropout': 0.5836710436816949, 'batch_norm': False, 'lr': 8.649821924748231e-06, 'weight_decay': 0.00021249735611539848, 'epochs': 314, 'loss': 'mae', 'optimizer': 'adam', 'graph_mode': 'off', 'use_snp_selection': True, 'num_snps': 59974}. Best is trial 51 with value: 0.3832613767083373.
[I 2025-12-05 18:54:16,693] Trial 86 finished with value: 0.3758821558197343 and parameters: {'model_type': 'mlp', 'hidden_dims': '[512, 64]', 'dropout': 0.543480635190684, 'batch_norm': False, 'lr': 3.679888135417343e-06, 'weight_decay': 5.40437521414208e-05, 'epochs': 320, 'loss': 'mae', 'optimizer': 'adam', 'graph_mode': 'off', 'use_snp_selection': True, 'num_snps': 55181}. Best is trial 51 with value: 0.3832613767083373.
[I 2025-12-05 18:55:31,397] Trial 87 finished with value: 0.3361728602234958 and parameters: {'model_type': 'mlp', 'hidden_dims': '[512, 64]', 'dropout': 0.4654494727867797, 'batch_norm': True, 'lr': 5.120626604143195e-06, 'weight_decay': 8.321973538943751e-05, 'epochs': 202, 'loss': 'mae', 'optimizer': 'adam', 'graph_mode': 'off', 'use_snp_selection': True, 'num_snps': 58253}. Best is trial 51 with value: 0.3832613767083373.
[I 2025-12-05 18:56:07,008] Trial 88 finished with value: 0.3436812302240738 and parameters: {'model_type': 'mlp', 'hidden_dims': '[128, 64]', 'dropout': 0.41040493380697485, 'batch_norm': False, 'lr': 1.65168451665899e-06, 'weight_decay': 0.00011281534585206343, 'epochs': 296, 'loss': 'mae', 'optimizer': 'adam', 'graph_mode': 'off', 'use_snp_selection': True, 'num_snps': 25802}. Best is trial 51 with value: 0.3832613767083373.
[I 2025-12-05 18:57:25,600] Trial 89 finished with value: 0.371817869370759 and parameters: {'model_type': 'mlp', 'hidden_dims': '[512, 128]', 'dropout': 0.47889129097020305, 'batch_norm': False, 'lr': 2.0313521493567814e-06, 'weight_decay': 0.00017745338074683542, 'epochs': 282, 'loss': 'mae', 'optimizer': 'adam', 'graph_mode': 'off', 'use_snp_selection': True, 'num_snps': 49247}. Best is trial 51 with value: 0.3832613767083373.
[I 2025-12-05 18:58:45,361] Trial 90 finished with value: 0.37325828242008413 and parameters: {'model_type': 'mlp', 'hidden_dims': '[512, 64]', 'dropout': 0.4977664819444094, 'batch_norm': False, 'lr': 2.8888160167971498e-06, 'weight_decay': 0.00028437067406401884, 'epochs': 252, 'loss': 'mse', 'optimizer': 'adam', 'graph_mode': 'off', 'use_snp_selection': True, 'num_snps': 55059}. Best is trial 51 with value: 0.3832613767083373.
[I 2025-12-05 18:59:51,422] Trial 91 finished with value: 0.36817986305101175 and parameters: {'model_type': 'mlp', 'hidden_dims': '[512, 64]', 'dropout': 0.5745128794712039, 'batch_norm': False, 'lr': 5.839446564424693e-06, 'weight_decay': 2.0396441052642795e-05, 'epochs': 321, 'loss': 'mae', 'optimizer': 'adam', 'graph_mode': 'off', 'use_snp_selection': False}. Best is trial 51 with value: 0.3832613767083373.
[I 2025-12-05 19:01:01,032] Trial 92 finished with value: 0.3721035466845871 and parameters: {'model_type': 'mlp', 'hidden_dims': '[512, 64]', 'dropout': 0.5897316431226926, 'batch_norm': False, 'lr': 4.414842848746659e-06, 'weight_decay': 4.123838709069045e-05, 'epochs': 337, 'loss': 'mae', 'optimizer': 'adam', 'graph_mode': 'off', 'use_snp_selection': False}. Best is trial 51 with value: 0.3832613767083373.
[I 2025-12-05 19:01:41,210] Trial 93 finished with value: 0.3718922879390233 and parameters: {'model_type': 'mlp', 'hidden_dims': '[512, 64]', 'dropout': 0.5593428510140136, 'batch_norm': False, 'lr': 7.358933587601357e-06, 'weight_decay': 5.322070652894608e-06, 'epochs': 221, 'loss': 'mae', 'optimizer': 'adam', 'graph_mode': 'off', 'use_snp_selection': True, 'num_snps': 19048}. Best is trial 51 with value: 0.3832613767083373.
[I 2025-12-05 19:03:06,327] Trial 94 finished with value: 0.3747258012017714 and parameters: {'model_type': 'mlp', 'hidden_dims': '[512, 64]', 'dropout': 0.5340964046567619, 'batch_norm': False, 'lr': 2.4043755024788596e-06, 'weight_decay': 1.6160164556864477e-05, 'epochs': 302, 'loss': 'mae', 'optimizer': 'adam', 'graph_mode': 'off', 'use_snp_selection': True, 'num_snps': 52184}. Best is trial 51 with value: 0.3832613767083373.
[I 2025-12-05 19:04:03,197] Trial 95 finished with value: 0.3320092627935941 and parameters: {'model_type': 'mlp', 'hidden_dims': '[256, 128, 64]', 'dropout': 0.5981888177976314, 'batch_norm': False, 'lr': 3.572364097217235e-06, 'weight_decay': 6.759243787685472e-05, 'epochs': 205, 'loss': 'mae', 'optimizer': 'adam', 'graph_mode': 'off', 'use_snp_selection': True, 'num_snps': 58178}. Best is trial 51 with value: 0.3832613767083373.
[I 2025-12-05 19:05:15,571] Trial 96 finished with value: 0.37074611128862495 and parameters: {'model_type': 'mlp', 'hidden_dims': '[512, 256]', 'dropout': 0.10989189687296735, 'batch_norm': False, 'lr': 5.452974847992076e-06, 'weight_decay': 0.00014142276283110982, 'epochs': 350, 'loss': 'mae', 'optimizer': 'adam', 'graph_mode': 'off', 'use_snp_selection': False}. Best is trial 51 with value: 0.3832613767083373.
[I 2025-12-05 19:06:04,442] Trial 97 finished with value: 0.3450880804613703 and parameters: {'model_type': 'mlp', 'hidden_dims': '[512, 64]', 'dropout': 0.44741964118856037, 'batch_norm': False, 'lr': 7.809889875233579e-05, 'weight_decay': 0.0003837741930414038, 'epochs': 214, 'loss': 'mae', 'optimizer': 'adam', 'graph_mode': 'off', 'use_snp_selection': True, 'num_snps': 29372}. Best is trial 51 with value: 0.3832613767083373.
[I 2025-12-05 19:07:09,617] Trial 98 finished with value: 0.34779053469994736 and parameters: {'model_type': 'mlp', 'hidden_dims': '[512, 64]', 'dropout': 0.5116089267249803, 'batch_norm': True, 'lr': 2.4287552617419225e-05, 'weight_decay': 5.2517158985600617e-05, 'epochs': 229, 'loss': 'mae', 'optimizer': 'adam', 'graph_mode': 'off', 'use_snp_selection': True, 'num_snps': 43382}. Best is trial 51 with value: 0.3832613767083373.
[I 2025-12-05 19:08:29,595] Trial 99 finished with value: 0.3705864857494392 and parameters: {'model_type': 'mlp', 'hidden_dims': '[512, 64]', 'dropout': 0.4203971584383208, 'batch_norm': False, 'lr': 3.1428883128660933e-06, 'weight_decay': 2.6514429473679053e-05, 'epochs': 244, 'loss': 'mae', 'optimizer': 'adam', 'graph_mode': 'off', 'use_snp_selection': True, 'num_snps': 55969}. Best is trial 51 with value: 0.3832613767083373.
[I 2025-12-05 19:09:35,604] Trial 100 finished with value: 0.35946947582628896 and parameters: {'model_type': 'mlp', 'hidden_dims': '[512, 64]', 'dropout': 0.47594859091965114, 'batch_norm': False, 'lr': 1.0797031636356797e-05, 'weight_decay': 0.0007598765253569804, 'epochs': 322, 'loss': 'mae', 'optimizer': 'adam', 'graph_mode': 'off', 'use_snp_selection': False}. Best is trial 51 with value: 0.3832613767083373.
[I 2025-12-05 19:11:02,928] Trial 101 finished with value: 0.3710352435127565 and parameters: {'model_type': 'mlp', 'hidden_dims': '[512, 64]', 'dropout': 0.5259641222807425, 'batch_norm': False, 'lr': 2.50640581229938e-06, 'weight_decay': 3.472346770093929e-05, 'epochs': 303, 'loss': 'mae', 'optimizer': 'adam', 'graph_mode': 'off', 'use_snp_selection': True, 'num_snps': 54152}. Best is trial 51 with value: 0.3832613767083373.
