[I 2025-12-05 15:01:32,876] Trial 137 finished with value: 0.090199738018485 and parameters: {'model_type': 'mlp', 'hidden_dims': '[512, 128]', 'dropout': 0.4838785986706434, 'batch_norm': False, 'lr': 5.7731496127120045e-05, 'weight_decay': 0.00027070408191701985, 'epochs': 317, 'loss': 'mse', 'optimizer': 'adam', 'graph_mode': 'off', 'use_snp_selection': True, 'num_snps': 3663}. Best is trial 132 with value: 0.1204660768663533.
[I 2025-12-05 15:01:34,917] Trial 138 finished with value: 0.08767634878142311 and parameters: {'model_type': 'mlp', 'hidden_dims': '[512, 128]', 'dropout': 0.45008876814958865, 'batch_norm': False, 'lr': 4.903541383904766e-05, 'weight_decay': 1.3458686745159343e-06, 'epochs': 342, 'loss': 'mse', 'optimizer': 'adam', 'graph_mode': 'off', 'use_snp_selection': False}. Best is trial 132 with value: 0.1204660768663533.
[I 2025-12-05 15:01:35,891] Trial 139 finished with value: 0.09162775755521922 and parameters: {'model_type': 'mlp', 'hidden_dims': '[512, 128]', 'dropout': 0.33303233149492734, 'batch_norm': False, 'lr': 0.0001260262315268657, 'weight_decay': 2.060366935619716e-06, 'epochs': 332, 'loss': 'mse', 'optimizer': 'adam', 'graph_mode': 'off', 'use_snp_selection': True, 'num_snps': 4139}. Best is trial 132 with value: 0.1204660768663533.
[I 2025-12-05 15:01:36,894] Trial 140 finished with value: 0.08762291233061571 and parameters: {'model_type': 'mlp', 'hidden_dims': '[512, 128]', 'dropout': 0.46078767625362405, 'batch_norm': False, 'lr': 0.00015757840063553212, 'weight_decay': 5.948336841105377e-07, 'epochs': 309, 'loss': 'mse', 'optimizer': 'adam', 'graph_mode': 'off', 'use_snp_selection': True, 'num_snps': 5868}. Best is trial 132 with value: 0.1204660768663533.
[I 2025-12-05 15:01:37,866] Trial 141 finished with value: 0.09116386060353802 and parameters: {'model_type': 'mlp', 'hidden_dims': '[512, 128]', 'dropout': 0.4287136879591759, 'batch_norm': False, 'lr': 7.930129939016514e-05, 'weight_decay': 1.4359879750342844e-07, 'epochs': 325, 'loss': 'mse', 'optimizer': 'adam', 'graph_mode': 'off', 'use_snp_selection': True, 'num_snps': 3079}. Best is trial 132 with value: 0.1204660768663533.
[I 2025-12-05 15:01:38,959] Trial 142 finished with value: 0.08114115118636477 and parameters: {'model_type': 'mlp', 'hidden_dims': '[512, 64]', 'dropout': 0.3062518754100534, 'batch_norm': False, 'lr': 0.00010735394249657444, 'weight_decay': 8.750329398817526e-07, 'epochs': 321, 'loss': 'mse', 'optimizer': 'adam', 'graph_mode': 'off', 'use_snp_selection': True, 'num_snps': 8368}. Best is trial 132 with value: 0.1204660768663533.
[I 2025-12-05 15:01:40,073] Trial 143 finished with value: 0.08074516382603009 and parameters: {'model_type': 'mlp', 'hidden_dims': '[512, 128]', 'dropout': 0.46968470830116754, 'batch_norm': False, 'lr': 8.713291615379937e-05, 'weight_decay': 1.0733245465559656e-06, 'epochs': 350, 'loss': 'mse', 'optimizer': 'adam', 'graph_mode': 'off', 'use_snp_selection': True, 'num_snps': 7287}. Best is trial 132 with value: 0.1204660768663533.
[I 2025-12-05 15:01:41,079] Trial 144 finished with value: 0.10088556442581754 and parameters: {'model_type': 'mlp', 'hidden_dims': '[512, 256]', 'dropout': 0.4398600153544111, 'batch_norm': False, 'lr': 6.260711384350593e-05, 'weight_decay': 0.00038288989948696096, 'epochs': 327, 'loss': 'mse', 'optimizer': 'adam', 'graph_mode': 'off', 'use_snp_selection': True, 'num_snps': 4835}. Best is trial 132 with value: 0.1204660768663533.
[I 2025-12-05 15:01:44,484] Trial 145 finished with value: 0.07250641360804475 and parameters: {'model_type': 'mlp', 'hidden_dims': '[512, 256]', 'dropout': 0.4850236218966577, 'batch_norm': False, 'lr': 6.14588337295776e-05, 'weight_decay': 0.00035736635592577206, 'epochs': 343, 'loss': 'mse', 'optimizer': 'adam', 'graph_mode': 'off', 'use_snp_selection': True, 'num_snps': 56467}. Best is trial 132 with value: 0.1204660768663533.
[I 2025-12-05 15:01:45,492] Trial 146 finished with value: 0.10132479007116918 and parameters: {'model_type': 'mlp', 'hidden_dims': '[512, 256]', 'dropout': 0.4396780261378239, 'batch_norm': False, 'lr': 2.8123348433707927e-05, 'weight_decay': 0.0004751555837371402, 'epochs': 337, 'loss': 'mse', 'optimizer': 'adam', 'graph_mode': 'off', 'use_snp_selection': True, 'num_snps': 4601}. Best is trial 132 with value: 0.1204660768663533.
[I 2025-12-05 15:01:46,239] Trial 147 finished with value: 0.07313811350499137 and parameters: {'model_type': 'mlp', 'hidden_dims': '[512, 256]', 'dropout': 0.44382730861365266, 'batch_norm': False, 'lr': 2.3292045319088366e-05, 'weight_decay': 0.00048053682416153925, 'epochs': 165, 'loss': 'mse', 'optimizer': 'adam', 'graph_mode': 'off', 'use_snp_selection': True, 'num_snps': 2205}. Best is trial 132 with value: 0.1204660768663533.
[I 2025-12-05 15:01:47,266] Trial 148 finished with value: 0.10703092578073711 and parameters: {'model_type': 'mlp', 'hidden_dims': '[512, 256]', 'dropout': 0.43385360984029575, 'batch_norm': False, 'lr': 2.9753559762870958e-05, 'weight_decay': 0.0006513661612851796, 'epochs': 337, 'loss': 'mse', 'optimizer': 'adam', 'graph_mode': 'off', 'use_snp_selection': True, 'num_snps': 4879}. Best is trial 132 with value: 0.1204660768663533.
[I 2025-12-05 15:01:48,278] Trial 149 finished with value: 0.05477150623496428 and parameters: {'model_type': 'mlp', 'hidden_dims': '[512, 256]', 'dropout': 0.43062690928845226, 'batch_norm': False, 'lr': 3.191186775611115e-05, 'weight_decay': 0.0006295489696126616, 'epochs': 338, 'loss': 'mse', 'optimizer': 'adam', 'graph_mode': 'off', 'use_snp_selection': True, 'num_snps': 5126}. Best is trial 132 with value: 0.1204660768663533.
[I 2025-12-05 15:01:50,503] Trial 0 finished with value: -0.046780369912392906 and parameters: {'model_type': 'mlp', 'hidden_dims': '[128, 64]', 'dropout': 0.199031432379812, 'batch_norm': True, 'lr': 1.8408544111075837e-06, 'weight_decay': 5.5136510071208614e-05, 'epochs': 336, 'loss': 'mae', 'optimizer': 'adam', 'graph_mode': 'off', 'use_snp_selection': True, 'num_snps': 43862}. Best is trial 0 with value: -0.046780369912392906.
[I 2025-12-05 15:01:51,679] Trial 1 finished with value: 0.05485491701434048 and parameters: {'model_type': 'mlp', 'hidden_dims': '[256, 128]', 'dropout': 0.4370668075331726, 'batch_norm': True, 'lr': 7.133471581159139e-05, 'weight_decay': 1.128633586803549e-05, 'epochs': 242, 'loss': 'mae', 'optimizer': 'adam', 'graph_mode': 'off', 'use_snp_selection': False}. Best is trial 1 with value: 0.05485491701434048.
[I 2025-12-05 15:01:52,690] Trial 2 finished with value: 0.039087765767367666 and parameters: {'model_type': 'mlp', 'hidden_dims': '[256, 128, 64]', 'dropout': 0.41314357415569625, 'batch_norm': False, 'lr': 3.952233718592101e-06, 'weight_decay': 0.00026754769258252603, 'epochs': 149, 'loss': 'mse', 'optimizer': 'adam', 'graph_mode': 'off', 'use_snp_selection': True, 'num_snps': 11571}. Best is trial 1 with value: 0.05485491701434048.
[I 2025-12-05 15:01:54,667] Trial 3 finished with value: -0.006243409391696753 and parameters: {'model_type': 'mlp', 'hidden_dims': '[512, 64]', 'dropout': 0.5938127374509361, 'batch_norm': False, 'lr': 5.67704586114731e-06, 'weight_decay': 2.4518087630137052e-05, 'epochs': 320, 'loss': 'mae', 'optimizer': 'adam', 'graph_mode': 'off', 'use_snp_selection': False}. Best is trial 1 with value: 0.05485491701434048.
[I 2025-12-05 15:01:56,917] Trial 4 finished with value: 0.0006657025160455222 and parameters: {'model_type': 'mlp', 'hidden_dims': '[512, 128]', 'dropout': 0.25746343592134413, 'batch_norm': True, 'lr': 1.3467657668402788e-06, 'weight_decay': 0.00033087251918647806, 'epochs': 277, 'loss': 'mse', 'optimizer': 'adam', 'graph_mode': 'off', 'use_snp_selection': True, 'num_snps': 36675}. Best is trial 1 with value: 0.05485491701434048.
[I 2025-12-05 15:01:58,708] Trial 5 finished with value: 0.021196161396771492 and parameters: {'model_type': 'mlp', 'hidden_dims': '[512, 64]', 'dropout': 0.38275350994408375, 'batch_norm': True, 'lr': 1.5586664309232824e-06, 'weight_decay': 0.0008227664668621182, 'epochs': 145, 'loss': 'mae', 'optimizer': 'adam', 'graph_mode': 'off', 'use_snp_selection': True, 'num_snps': 32148}. Best is trial 1 with value: 0.05485491701434048.
[I 2025-12-05 15:01:59,756] Trial 6 finished with value: 0.03858619219165862 and parameters: {'model_type': 'mlp', 'hidden_dims': '[256, 128]', 'dropout': 0.3930109900265879, 'batch_norm': False, 'lr': 4.892964372128395e-05, 'weight_decay': 1.5809549317992182e-06, 'epochs': 199, 'loss': 'mse', 'optimizer': 'adam', 'graph_mode': 'off', 'use_snp_selection': False}. Best is trial 1 with value: 0.05485491701434048.
[I 2025-12-05 15:02:00,910] Trial 7 finished with value: 0.028395349629912095 and parameters: {'model_type': 'mlp', 'hidden_dims': '[512, 256]', 'dropout': 0.15343979219678458, 'batch_norm': True, 'lr': 6.234003099047341e-05, 'weight_decay': 3.894760610535477e-07, 'epochs': 97, 'loss': 'mse', 'optimizer': 'adam', 'graph_mode': 'off', 'use_snp_selection': False}. Best is trial 1 with value: 0.05485491701434048.
[I 2025-12-05 15:02:02,865] Trial 8 finished with value: 0.033831912555068074 and parameters: {'model_type': 'mlp', 'hidden_dims': '[512, 128]', 'dropout': 0.10743001231661406, 'batch_norm': True, 'lr': 0.00023728538449271062, 'weight_decay': 1.7629071578048637e-05, 'epochs': 312, 'loss': 'mae', 'optimizer': 'adam', 'graph_mode': 'off', 'use_snp_selection': False}. Best is trial 1 with value: 0.05485491701434048.
[I 2025-12-05 15:02:04,290] Trial 9 finished with value: 0.016475308822784134 and parameters: {'model_type': 'mlp', 'hidden_dims': '[512, 64]', 'dropout': 0.14505336736221927, 'batch_norm': True, 'lr': 5.8619638388111826e-05, 'weight_decay': 6.200156172669308e-07, 'epochs': 175, 'loss': 'mse', 'optimizer': 'adam', 'graph_mode': 'off', 'use_snp_selection': False}. Best is trial 1 with value: 0.05485491701434048.
[I 2025-12-05 15:02:05,413] Trial 10 finished with value: 0.022800496490339647 and parameters: {'model_type': 'mlp', 'hidden_dims': '[256, 128]', 'dropout': 0.5365714961141473, 'batch_norm': False, 'lr': 0.00032955828969150785, 'weight_decay': 3.381683344261174e-06, 'epochs': 236, 'loss': 'mae', 'optimizer': 'adam', 'graph_mode': 'off', 'use_snp_selection': False}. Best is trial 1 with value: 0.05485491701434048.
[I 2025-12-05 15:02:06,166] Trial 11 finished with value: 0.020469759336160694 and parameters: {'model_type': 'mlp', 'hidden_dims': '[256, 128, 64]', 'dropout': 0.46666886951066355, 'batch_norm': False, 'lr': 1.0179754910949672e-05, 'weight_decay': 0.00011098547132554421, 'epochs': 77, 'loss': 'mse', 'optimizer': 'adam', 'graph_mode': 'off', 'use_snp_selection': True, 'num_snps': 5419}. Best is trial 1 with value: 0.05485491701434048.
[I 2025-12-05 15:02:07,184] Trial 12 finished with value: 0.03758632822194366 and parameters: {'model_type': 'mlp', 'hidden_dims': '[256, 128, 64]', 'dropout': 0.3131971633261129, 'batch_norm': False, 'lr': 1.2835550758876947e-05, 'weight_decay': 5.268209346377717e-06, 'epochs': 225, 'loss': 'mae', 'optimizer': 'adam', 'graph_mode': 'off', 'use_snp_selection': True, 'num_snps': 7003}. Best is trial 1 with value: 0.05485491701434048.
[I 2025-12-05 15:02:09,739] Trial 13 finished with value: 0.0036206836034147374 and parameters: {'model_type': 'mlp', 'hidden_dims': '[256, 128, 64]', 'dropout': 0.45454916383868244, 'batch_norm': False, 'lr': 0.00013334537241400203, 'weight_decay': 0.00017529084132193428, 'epochs': 135, 'loss': 'mse', 'optimizer': 'adam', 'graph_mode': 'off', 'use_snp_selection': True, 'num_snps': 59978}. Best is trial 1 with value: 0.05485491701434048.
[I 2025-12-05 15:02:11,120] Trial 14 finished with value: 0.020680238423252215 and parameters: {'model_type': 'mlp', 'hidden_dims': '[256, 128]', 'dropout': 0.4552029103675417, 'batch_norm': True, 'lr': 0.000998643517858015, 'weight_decay': 0.0009897902971003753, 'epochs': 252, 'loss': 'mae', 'optimizer': 'adam', 'graph_mode': 'off', 'use_snp_selection': True, 'num_snps': 17781}. Best is trial 1 with value: 0.05485491701434048.
[I 2025-12-05 15:02:11,841] Trial 15 finished with value: 0.04623682478595978 and parameters: {'model_type': 'mlp', 'hidden_dims': '[128, 64]', 'dropout': 0.3179507722671933, 'batch_norm': False, 'lr': 1.9467377853946494e-05, 'weight_decay': 1.8431992240252364e-07, 'epochs': 122, 'loss': 'mse', 'optimizer': 'adam', 'graph_mode': 'off', 'use_snp_selection': False}. Best is trial 1 with value: 0.05485491701434048.
[I 2025-12-05 15:02:12,466] Trial 16 finished with value: -0.010581607434592707 and parameters: {'model_type': 'mlp', 'hidden_dims': '[128, 64]', 'dropout': 0.3035948139902824, 'batch_norm': False, 'lr': 2.476733901740279e-05, 'weight_decay': 1.214664357323611e-07, 'epochs': 41, 'loss': 'mae', 'optimizer': 'adam', 'graph_mode': 'off', 'use_snp_selection': False}. Best is trial 1 with value: 0.05485491701434048.
[I 2025-12-05 15:02:13,337] Trial 17 finished with value: -0.007547520066364024 and parameters: {'model_type': 'mlp', 'hidden_dims': '[128, 64]', 'dropout': 0.24800233735537824, 'batch_norm': True, 'lr': 2.4183016377218973e-05, 'weight_decay': 1.40022675967374e-07, 'epochs': 197, 'loss': 'mse', 'optimizer': 'adam', 'graph_mode': 'off', 'use_snp_selection': False}. Best is trial 1 with value: 0.05485491701434048.
[I 2025-12-05 15:02:15,135] Trial 18 finished with value: 0.04445614504723533 and parameters: {'model_type': 'mlp', 'hidden_dims': '[512, 256]', 'dropout': 0.33225943349122394, 'batch_norm': False, 'lr': 0.0001531570761860785, 'weight_decay': 1.6198320590907912e-06, 'epochs': 274, 'loss': 'mae', 'optimizer': 'adam', 'graph_mode': 'off', 'use_snp_selection': False}. Best is trial 1 with value: 0.05485491701434048.
[I 2025-12-05 15:02:15,856] Trial 19 finished with value: 0.031302481089089035 and parameters: {'model_type': 'mlp', 'hidden_dims': '[128, 64]', 'dropout': 0.5213195975076659, 'batch_norm': True, 'lr': 0.000615559032739879, 'weight_decay': 9.707001819661774e-06, 'epochs': 104, 'loss': 'mse', 'optimizer': 'adam', 'graph_mode': 'off', 'use_snp_selection': False}. Best is trial 1 with value: 0.05485491701434048.
[I 2025-12-05 15:02:16,855] Trial 20 finished with value: 0.035073030611061796 and parameters: {'model_type': 'mlp', 'hidden_dims': '[256, 128]', 'dropout': 0.26708642740910277, 'batch_norm': False, 'lr': 0.00010227958973624051, 'weight_decay': 4.401103622051135e-05, 'epochs': 173, 'loss': 'mse', 'optimizer': 'adam', 'graph_mode': 'off', 'use_snp_selection': False}. Best is trial 1 with value: 0.05485491701434048.
[I 2025-12-05 15:02:18,679] Trial 21 finished with value: 0.03030935587262397 and parameters: {'model_type': 'mlp', 'hidden_dims': '[512, 256]', 'dropout': 0.3424866455276697, 'batch_norm': False, 'lr': 0.00018795800454544185, 'weight_decay': 1.2783001578745452e-06, 'epochs': 282, 'loss': 'mae', 'optimizer': 'adam', 'graph_mode': 'off', 'use_snp_selection': False}. Best is trial 1 with value: 0.05485491701434048.
[I 2025-12-05 15:02:20,458] Trial 22 finished with value: 0.04179394687227533 and parameters: {'model_type': 'mlp', 'hidden_dims': '[512, 256]', 'dropout': 0.35913597128943875, 'batch_norm': False, 'lr': 3.5416014790258375e-05, 'weight_decay': 3.0191566540155994e-07, 'epochs': 270, 'loss': 'mae', 'optimizer': 'adam', 'graph_mode': 'off', 'use_snp_selection': False}. Best is trial 1 with value: 0.05485491701434048.
[I 2025-12-05 15:02:22,347] Trial 23 finished with value: 0.015325650599906624 and parameters: {'model_type': 'mlp', 'hidden_dims': '[512, 256]', 'dropout': 0.3316039024367095, 'batch_norm': False, 'lr': 9.594250661111026e-05, 'weight_decay': 1.2363597608827024e-06, 'epochs': 299, 'loss': 'mae', 'optimizer': 'adam', 'graph_mode': 'off', 'use_snp_selection': False}. Best is trial 1 with value: 0.05485491701434048.
[I 2025-12-05 15:02:23,993] Trial 24 finished with value: 0.05162566439748086 and parameters: {'model_type': 'mlp', 'hidden_dims': '[512, 256]', 'dropout': 0.4207545817741529, 'batch_norm': False, 'lr': 1.737888139176462e-05, 'weight_decay': 3.5340033684213975e-06, 'epochs': 235, 'loss': 'mae', 'optimizer': 'adam', 'graph_mode': 'off', 'use_snp_selection': False}. Best is trial 1 with value: 0.05485491701434048.
[I 2025-12-05 15:02:25,115] Trial 25 finished with value: 0.0500543610854974 and parameters: {'model_type': 'mlp', 'hidden_dims': '[256, 128]', 'dropout': 0.5083251479402447, 'batch_norm': False, 'lr': 1.4065351156789553e-05, 'weight_decay': 4.316479958076426e-06, 'epochs': 222, 'loss': 'mae', 'optimizer': 'adam', 'graph_mode': 'off', 'use_snp_selection': False}. Best is trial 1 with value: 0.05485491701434048.
[I 2025-12-05 15:02:26,246] Trial 26 finished with value: -0.009014142932063346 and parameters: {'model_type': 'mlp', 'hidden_dims': '[256, 128]', 'dropout': 0.5181056566659079, 'batch_norm': True, 'lr': 6.511589520276833e-06, 'weight_decay': 5.144093264853512e-06, 'epochs': 223, 'loss': 'mae', 'optimizer': 'adam', 'graph_mode': 'off', 'use_snp_selection': False}. Best is trial 1 with value: 0.05485491701434048.
[I 2025-12-05 15:02:27,381] Trial 27 finished with value: 0.0348977032974377 and parameters: {'model_type': 'mlp', 'hidden_dims': '[256, 128]', 'dropout': 0.5768302202965653, 'batch_norm': False, 'lr': 1.4587380420714017e-05, 'weight_decay': 1.2192253086757185e-05, 'epochs': 241, 'loss': 'mae', 'optimizer': 'adam', 'graph_mode': 'off', 'use_snp_selection': False}. Best is trial 1 with value: 0.05485491701434048.
[I 2025-12-05 15:02:28,489] Trial 28 finished with value: 0.006511344626389934 and parameters: {'model_type': 'mlp', 'hidden_dims': '[256, 128]', 'dropout': 0.4835795605732801, 'batch_norm': True, 'lr': 3.6963939911696003e-06, 'weight_decay': 4.478710653215084e-06, 'epochs': 211, 'loss': 'mae', 'optimizer': 'adam', 'graph_mode': 'off', 'use_snp_selection': False}. Best is trial 1 with value: 0.05485491701434048.
[I 2025-12-05 15:02:29,501] Trial 29 finished with value: -0.020981671180749985 and parameters: {'model_type': 'mlp', 'hidden_dims': '[256, 128]', 'dropout': 0.4216735877982377, 'batch_norm': True, 'lr': 2.3360772175287275e-06, 'weight_decay': 4.614105838493116e-05, 'epochs': 178, 'loss': 'mae', 'optimizer': 'adam', 'graph_mode': 'off', 'use_snp_selection': False}. Best is trial 1 with value: 0.05485491701434048.
[I 2025-12-05 15:02:31,215] Trial 30 finished with value: 0.04996678628509234 and parameters: {'model_type': 'mlp', 'hidden_dims': '[512, 128]', 'dropout': 0.549805750679235, 'batch_norm': False, 'lr': 8.798157230445258e-06, 'weight_decay': 2.3815400783582833e-05, 'epochs': 253, 'loss': 'mae', 'optimizer': 'adam', 'graph_mode': 'off', 'use_snp_selection': False}. Best is trial 1 with value: 0.05485491701434048.
[I 2025-12-05 15:02:32,934] Trial 31 finished with value: 0.044969807687033576 and parameters: {'model_type': 'mlp', 'hidden_dims': '[512, 128]', 'dropout': 0.4950722015520079, 'batch_norm': False, 'lr': 7.931606552399074e-06, 'weight_decay': 8.410545688725044e-06, 'epochs': 255, 'loss': 'mae', 'optimizer': 'adam', 'graph_mode': 'off', 'use_snp_selection': False}. Best is trial 1 with value: 0.05485491701434048.
[I 2025-12-05 15:02:34,516] Trial 32 finished with value: 0.003683335109084197 and parameters: {'model_type': 'mlp', 'hidden_dims': '[512, 128]', 'dropout': 0.5570008324652561, 'batch_norm': False, 'lr': 3.705177154204894e-05, 'weight_decay': 2.452243959234803e-05, 'epochs': 218, 'loss': 'mae', 'optimizer': 'adam', 'graph_mode': 'off', 'use_snp_selection': False}. Best is trial 1 with value: 0.05485491701434048.
[I 2025-12-05 15:02:36,619] Trial 33 finished with value: 0.04456666601579524 and parameters: {'model_type': 'mlp', 'hidden_dims': '[512, 128]', 'dropout': 0.4372556994114797, 'batch_norm': False, 'lr': 3.5719705396601434e-06, 'weight_decay': 2.444053571535268e-06, 'epochs': 349, 'loss': 'mae', 'optimizer': 'adam', 'graph_mode': 'off', 'use_snp_selection': False}. Best is trial 1 with value: 0.05485491701434048.
[I 2025-12-05 15:02:38,344] Trial 34 finished with value: 0.08422594760083942 and parameters: {'model_type': 'mlp', 'hidden_dims': '[512, 128]', 'dropout': 0.4930346881458028, 'batch_norm': False, 'lr': 1.276530270288381e-05, 'weight_decay': 1.6165185916137827e-05, 'epochs': 255, 'loss': 'mae', 'optimizer': 'adam', 'graph_mode': 'off', 'use_snp_selection': False}. Best is trial 34 with value: 0.08422594760083942.
[I 2025-12-05 15:02:40,242] Trial 35 finished with value: 0.04599491893014261 and parameters: {'model_type': 'mlp', 'hidden_dims': '[512, 256]', 'dropout': 0.397648981301579, 'batch_norm': False, 'lr': 1.81684337591003e-05, 'weight_decay': 9.356503219189375e-06, 'epochs': 298, 'loss': 'mae', 'optimizer': 'adam', 'graph_mode': 'off', 'use_snp_selection': False}. Best is trial 34 with value: 0.08422594760083942.
[I 2025-12-05 15:02:41,714] Trial 36 finished with value: -0.008245366723580443 and parameters: {'model_type': 'mlp', 'hidden_dims': '[512, 64]', 'dropout': 0.5002145401841513, 'batch_norm': False, 'lr': 4.719398427520863e-06, 'weight_decay': 7.88630957741931e-05, 'epochs': 187, 'loss': 'mae', 'optimizer': 'adam', 'graph_mode': 'off', 'use_snp_selection': False}. Best is trial 34 with value: 0.08422594760083942.
[I 2025-12-05 15:02:44,375] Trial 37 finished with value: 0.038069662636186274 and parameters: {'model_type': 'mlp', 'hidden_dims': '[256, 128]', 'dropout': 0.3657032407161601, 'batch_norm': True, 'lr': 4.350549331735279e-05, 'weight_decay': 2.5231007832851532e-06, 'epochs': 206, 'loss': 'mae', 'optimizer': 'adam', 'graph_mode': 'off', 'use_snp_selection': True, 'num_snps': 57733}. Best is trial 34 with value: 0.08422594760083942.
