[I 2025-12-06 00:24:17,372] Trial 61 finished with value: 0.24633680300597485 and parameters: {'model_type': 'mlp', 'hidden_dims': '[512, 256]', 'dropout': 0.16841913789014404, 'batch_norm': False, 'lr': 2.224075781920152e-05, 'weight_decay': 0.0004072024443118115, 'epochs': 109, 'loss': 'mse', 'optimizer': 'adam', 'graph_mode': 'off', 'use_snp_selection': True, 'num_snps': 23539}. Best is trial 37 with value: 0.26732035923459463.
[I 2025-12-06 00:24:57,816] Trial 62 finished with value: 0.2493766899987389 and parameters: {'model_type': 'mlp', 'hidden_dims': '[512, 256]', 'dropout': 0.1901122149545209, 'batch_norm': False, 'lr': 7.663097300979713e-05, 'weight_decay': 0.0009917277384493676, 'epochs': 132, 'loss': 'mse', 'optimizer': 'adam', 'graph_mode': 'off', 'use_snp_selection': True, 'num_snps': 18030}. Best is trial 37 with value: 0.26732035923459463.
[I 2025-12-06 00:25:35,002] Trial 63 finished with value: 0.2503307610725739 and parameters: {'model_type': 'mlp', 'hidden_dims': '[128, 64]', 'dropout': 0.1443579111253112, 'batch_norm': False, 'lr': 4.039124457954904e-05, 'weight_decay': 0.0002754663717363858, 'epochs': 166, 'loss': 'mse', 'optimizer': 'adam', 'graph_mode': 'off', 'use_snp_selection': True, 'num_snps': 24075}. Best is trial 37 with value: 0.26732035923459463.
[I 2025-12-06 00:26:09,940] Trial 64 finished with value: 0.2371568285317549 and parameters: {'model_type': 'mlp', 'hidden_dims': '[512, 256]', 'dropout': 0.11925291150817355, 'batch_norm': False, 'lr': 0.0001003501417643499, 'weight_decay': 0.000452410377203109, 'epochs': 119, 'loss': 'mse', 'optimizer': 'adam', 'graph_mode': 'off', 'use_snp_selection': True, 'num_snps': 12026}. Best is trial 37 with value: 0.26732035923459463.
[I 2025-12-06 00:26:51,580] Trial 65 finished with value: 0.2608002538725364 and parameters: {'model_type': 'mlp', 'hidden_dims': '[512, 128]', 'dropout': 0.4118520895003167, 'batch_norm': False, 'lr': 1.9835436814094016e-05, 'weight_decay': 0.0001679984612940183, 'epochs': 145, 'loss': 'mse', 'optimizer': 'adam', 'graph_mode': 'off', 'use_snp_selection': True, 'num_snps': 18567}. Best is trial 37 with value: 0.26732035923459463.
[I 2025-12-06 00:27:34,634] Trial 66 finished with value: 0.24697388756856498 and parameters: {'model_type': 'mlp', 'hidden_dims': '[512, 128]', 'dropout': 0.381138799166692, 'batch_norm': False, 'lr': 2.0468799219097523e-05, 'weight_decay': 3.9549581895592546e-05, 'epochs': 192, 'loss': 'mse', 'optimizer': 'adam', 'graph_mode': 'off', 'use_snp_selection': True, 'num_snps': 16882}. Best is trial 37 with value: 0.26732035923459463.
[I 2025-12-06 00:28:35,613] Trial 67 finished with value: 0.23365470861136745 and parameters: {'model_type': 'mlp', 'hidden_dims': '[512, 128]', 'dropout': 0.39961369266413116, 'batch_norm': False, 'lr': 3.503406260691163e-05, 'weight_decay': 0.00018079235769670452, 'epochs': 152, 'loss': 'mse', 'optimizer': 'adam', 'graph_mode': 'off', 'use_snp_selection': True, 'num_snps': 40234}. Best is trial 37 with value: 0.26732035923459463.
[I 2025-12-06 00:29:22,298] Trial 68 finished with value: 0.24331637381018192 and parameters: {'model_type': 'mlp', 'hidden_dims': '[512, 128]', 'dropout': 0.29682037199818556, 'batch_norm': False, 'lr': 1.9063363340775703e-05, 'weight_decay': 0.0006512008588509221, 'epochs': 98, 'loss': 'mse', 'optimizer': 'adam', 'graph_mode': 'off', 'use_snp_selection': True, 'num_snps': 30957}. Best is trial 37 with value: 0.26732035923459463.
[I 2025-12-06 00:29:56,473] Trial 69 finished with value: 0.24710308186888144 and parameters: {'model_type': 'mlp', 'hidden_dims': '[256, 128, 64]', 'dropout': 0.2468463176372389, 'batch_norm': False, 'lr': 2.7594235990640356e-05, 'weight_decay': 9.303669554637871e-05, 'epochs': 164, 'loss': 'mse', 'optimizer': 'adam', 'graph_mode': 'off', 'use_snp_selection': True, 'num_snps': 13502}. Best is trial 37 with value: 0.26732035923459463.
[I 2025-12-06 00:31:07,820] Trial 70 finished with value: 0.19976679542183837 and parameters: {'model_type': 'mlp', 'hidden_dims': '[512, 128]', 'dropout': 0.4164483333380411, 'batch_norm': False, 'lr': 1.0723833370436655e-06, 'weight_decay': 0.0001888930848561694, 'epochs': 144, 'loss': 'mse', 'optimizer': 'adam', 'graph_mode': 'off', 'use_snp_selection': True, 'num_snps': 54034}. Best is trial 37 with value: 0.26732035923459463.
[I 2025-12-06 00:31:42,100] Trial 71 finished with value: 0.25503883574040725 and parameters: {'model_type': 'mlp', 'hidden_dims': '[128, 64]', 'dropout': 0.3288710839173965, 'batch_norm': False, 'lr': 5.348289463573667e-05, 'weight_decay': 0.0002713253703086142, 'epochs': 130, 'loss': 'mse', 'optimizer': 'adam', 'graph_mode': 'off', 'use_snp_selection': True, 'num_snps': 19592}. Best is trial 37 with value: 0.26732035923459463.
[I 2025-12-06 00:32:15,935] Trial 72 finished with value: 0.26181591425667294 and parameters: {'model_type': 'mlp', 'hidden_dims': '[128, 64]', 'dropout': 0.3324360931277719, 'batch_norm': False, 'lr': 5.120132477172553e-05, 'weight_decay': 1.0232858639639297e-07, 'epochs': 115, 'loss': 'mse', 'optimizer': 'adam', 'graph_mode': 'off', 'use_snp_selection': True, 'num_snps': 19090}. Best is trial 37 with value: 0.26732035923459463.
[I 2025-12-06 00:32:49,396] Trial 73 finished with value: 0.24514795589016408 and parameters: {'model_type': 'mlp', 'hidden_dims': '[128, 64]', 'dropout': 0.3304487167234597, 'batch_norm': False, 'lr': 4.496369617839062e-05, 'weight_decay': 3.6638704668744936e-07, 'epochs': 113, 'loss': 'mse', 'optimizer': 'adam', 'graph_mode': 'off', 'use_snp_selection': True, 'num_snps': 18535}. Best is trial 37 with value: 0.26732035923459463.
[I 2025-12-06 00:33:30,891] Trial 74 finished with value: 0.25376681648590516 and parameters: {'model_type': 'mlp', 'hidden_dims': '[512, 256]', 'dropout': 0.37026101489225055, 'batch_norm': False, 'lr': 1.0747972430077128e-05, 'weight_decay': 1.5965690595023858e-07, 'epochs': 104, 'loss': 'mse', 'optimizer': 'adam', 'graph_mode': 'off', 'use_snp_selection': True, 'num_snps': 22457}. Best is trial 37 with value: 0.26732035923459463.
[I 2025-12-06 00:34:04,917] Trial 75 finished with value: 0.25530625126019185 and parameters: {'model_type': 'mlp', 'hidden_dims': '[128, 64]', 'dropout': 0.341463104089671, 'batch_norm': False, 'lr': 6.492571767592667e-05, 'weight_decay': 4.696695760684795e-05, 'epochs': 125, 'loss': 'mse', 'optimizer': 'adam', 'graph_mode': 'off', 'use_snp_selection': True, 'num_snps': 19224}. Best is trial 37 with value: 0.26732035923459463.
[I 2025-12-06 00:34:38,660] Trial 76 finished with value: 0.2408620509264267 and parameters: {'model_type': 'mlp', 'hidden_dims': '[128, 64]', 'dropout': 0.41815812111667033, 'batch_norm': False, 'lr': 3.385780980834558e-05, 'weight_decay': 1.307832999424658e-06, 'epochs': 122, 'loss': 'mse', 'optimizer': 'adam', 'graph_mode': 'off', 'use_snp_selection': True, 'num_snps': 18453}. Best is trial 37 with value: 0.26732035923459463.
[I 2025-12-06 00:35:25,694] Trial 77 finished with value: 0.25010140954243 and parameters: {'model_type': 'mlp', 'hidden_dims': '[512, 128]', 'dropout': 0.29003015313576247, 'batch_norm': False, 'lr': 6.542671586877028e-05, 'weight_decay': 2.197670584162171e-05, 'epochs': 146, 'loss': 'mse', 'optimizer': 'adam', 'graph_mode': 'off', 'use_snp_selection': True, 'num_snps': 24986}. Best is trial 37 with value: 0.26732035923459463.
[I 2025-12-06 00:35:56,330] Trial 78 finished with value: 0.23577225367062016 and parameters: {'model_type': 'mlp', 'hidden_dims': '[128, 64]', 'dropout': 0.3437689312034536, 'batch_norm': False, 'lr': 1.755744478465707e-05, 'weight_decay': 4.9484948173330936e-05, 'epochs': 193, 'loss': 'mse', 'optimizer': 'adam', 'graph_mode': 'off', 'use_snp_selection': True, 'num_snps': 9213}. Best is trial 37 with value: 0.26732035923459463.
[I 2025-12-06 00:36:29,450] Trial 79 finished with value: 0.21532773489841447 and parameters: {'model_type': 'mlp', 'hidden_dims': '[128, 64]', 'dropout': 0.2236152706011455, 'batch_norm': True, 'lr': 2.3262969840398215e-05, 'weight_decay': 7.753727744573929e-05, 'epochs': 172, 'loss': 'mse', 'optimizer': 'adam', 'graph_mode': 'off', 'use_snp_selection': True, 'num_snps': 14278}. Best is trial 37 with value: 0.26732035923459463.
[I 2025-12-06 00:37:14,893] Trial 80 finished with value: 0.2588857611463395 and parameters: {'model_type': 'mlp', 'hidden_dims': '[512, 256]', 'dropout': 0.3777026233804489, 'batch_norm': False, 'lr': 3.004280076775757e-05, 'weight_decay': 2.8914248880037752e-05, 'epochs': 156, 'loss': 'mse', 'optimizer': 'adam', 'graph_mode': 'off', 'use_snp_selection': True, 'num_snps': 21838}. Best is trial 37 with value: 0.26732035923459463.
[I 2025-12-06 00:38:00,587] Trial 81 finished with value: 0.2575169703195441 and parameters: {'model_type': 'mlp', 'hidden_dims': '[512, 256]', 'dropout': 0.36151697852214, 'batch_norm': False, 'lr': 4.159277405661534e-05, 'weight_decay': 2.6405550627664448e-05, 'epochs': 156, 'loss': 'mse', 'optimizer': 'adam', 'graph_mode': 'off', 'use_snp_selection': True, 'num_snps': 22131}. Best is trial 37 with value: 0.26732035923459463.
[I 2025-12-06 00:38:50,519] Trial 82 finished with value: 0.25054346852811527 and parameters: {'model_type': 'mlp', 'hidden_dims': '[512, 256]', 'dropout': 0.36475946907222, 'batch_norm': False, 'lr': 2.802291230772471e-05, 'weight_decay': 2.6848957215076247e-05, 'epochs': 212, 'loss': 'mse', 'optimizer': 'adam', 'graph_mode': 'off', 'use_snp_selection': True, 'num_snps': 21808}. Best is trial 37 with value: 0.26732035923459463.
[I 2025-12-06 00:39:36,643] Trial 83 finished with value: 0.25288704925945016 and parameters: {'model_type': 'mlp', 'hidden_dims': '[512, 256]', 'dropout': 0.40545937480162964, 'batch_norm': False, 'lr': 4.4170253572273644e-05, 'weight_decay': 1.7474039537010732e-05, 'epochs': 153, 'loss': 'mse', 'optimizer': 'adam', 'graph_mode': 'off', 'use_snp_selection': True, 'num_snps': 22547}. Best is trial 37 with value: 0.26732035923459463.
[I 2025-12-06 00:40:29,749] Trial 84 finished with value: 0.2586552318606706 and parameters: {'model_type': 'mlp', 'hidden_dims': '[512, 256]', 'dropout': 0.3852982485520714, 'batch_norm': False, 'lr': 3.2561675185990446e-05, 'weight_decay': 3.31743550809252e-05, 'epochs': 185, 'loss': 'mse', 'optimizer': 'adam', 'graph_mode': 'off', 'use_snp_selection': True, 'num_snps': 26980}. Best is trial 37 with value: 0.26732035923459463.
[I 2025-12-06 00:41:21,348] Trial 85 finished with value: 0.24711754438309227 and parameters: {'model_type': 'mlp', 'hidden_dims': '[512, 256]', 'dropout': 0.3819513584591965, 'batch_norm': False, 'lr': 3.333927768328494e-05, 'weight_decay': 3.118312087611515e-05, 'epochs': 158, 'loss': 'mse', 'optimizer': 'adam', 'graph_mode': 'off', 'use_snp_selection': True, 'num_snps': 28303}. Best is trial 37 with value: 0.26732035923459463.
[I 2025-12-06 00:42:08,379] Trial 86 finished with value: 0.2566712803471422 and parameters: {'model_type': 'mlp', 'hidden_dims': '[512, 256]', 'dropout': 0.3910377326648756, 'batch_norm': False, 'lr': 1.1272584056482765e-05, 'weight_decay': 7.897492617157826e-06, 'epochs': 189, 'loss': 'mse', 'optimizer': 'adam', 'graph_mode': 'off', 'use_snp_selection': True, 'num_snps': 20509}. Best is trial 37 with value: 0.26732035923459463.
[I 2025-12-06 00:42:58,724] Trial 87 finished with value: 0.24747141463808792 and parameters: {'model_type': 'mlp', 'hidden_dims': '[512, 256]', 'dropout': 0.420354211538686, 'batch_norm': False, 'lr': 2.7423080946294198e-05, 'weight_decay': 2.1540996271846624e-05, 'epochs': 160, 'loss': 'mse', 'optimizer': 'adam', 'graph_mode': 'off', 'use_snp_selection': True, 'num_snps': 26182}. Best is trial 37 with value: 0.26732035923459463.
[I 2025-12-06 00:43:41,994] Trial 88 finished with value: 0.25258053169202777 and parameters: {'model_type': 'mlp', 'hidden_dims': '[512, 256]', 'dropout': 0.4712409289835601, 'batch_norm': False, 'lr': 2.4696528684394578e-05, 'weight_decay': 6.586296471426287e-05, 'epochs': 169, 'loss': 'mse', 'optimizer': 'adam', 'graph_mode': 'off', 'use_snp_selection': True, 'num_snps': 17624}. Best is trial 37 with value: 0.26732035923459463.
[I 2025-12-06 00:44:30,684] Trial 89 finished with value: 0.23365260694086903 and parameters: {'model_type': 'mlp', 'hidden_dims': '[512, 256]', 'dropout': 0.36472101285029823, 'batch_norm': True, 'lr': 3.874050220983496e-05, 'weight_decay': 1.2992451640131047e-05, 'epochs': 184, 'loss': 'mse', 'optimizer': 'adam', 'graph_mode': 'off', 'use_snp_selection': True, 'num_snps': 21847}. Best is trial 37 with value: 0.26732035923459463.
[I 2025-12-06 00:45:13,179] Trial 90 finished with value: 0.2501278123058895 and parameters: {'model_type': 'mlp', 'hidden_dims': '[512, 256]', 'dropout': 0.43852485971441846, 'batch_norm': False, 'lr': 1.3205431555916646e-05, 'weight_decay': 3.4823419432622696e-05, 'epochs': 208, 'loss': 'mse', 'optimizer': 'adam', 'graph_mode': 'off', 'use_snp_selection': True, 'num_snps': 14738}. Best is trial 37 with value: 0.26732035923459463.
[I 2025-12-06 00:46:00,013] Trial 91 finished with value: 0.24974375817945899 and parameters: {'model_type': 'mlp', 'hidden_dims': '[512, 256]', 'dropout': 0.3939970456196898, 'batch_norm': False, 'lr': 1.2702129097549868e-05, 'weight_decay': 5.599467801304608e-06, 'epochs': 188, 'loss': 'mse', 'optimizer': 'adam', 'graph_mode': 'off', 'use_snp_selection': True, 'num_snps': 20336}. Best is trial 37 with value: 0.26732035923459463.
[I 2025-12-06 00:46:47,692] Trial 92 finished with value: 0.2501320935940914 and parameters: {'model_type': 'mlp', 'hidden_dims': '[512, 256]', 'dropout': 0.3762618938737293, 'batch_norm': False, 'lr': 7.284977568468144e-06, 'weight_decay': 9.491165327413414e-06, 'epochs': 199, 'loss': 'mse', 'optimizer': 'adam', 'graph_mode': 'off', 'use_snp_selection': True, 'num_snps': 20465}. Best is trial 37 with value: 0.26732035923459463.
[I 2025-12-06 00:47:43,098] Trial 93 finished with value: 0.2523334263371829 and parameters: {'model_type': 'mlp', 'hidden_dims': '[512, 256]', 'dropout': 0.39183702919789426, 'batch_norm': False, 'lr': 9.704004139175863e-06, 'weight_decay': 1.0451869508741428e-07, 'epochs': 213, 'loss': 'mse', 'optimizer': 'adam', 'graph_mode': 'off', 'use_snp_selection': True, 'num_snps': 25940}. Best is trial 37 with value: 0.26732035923459463.
[I 2025-12-06 00:48:28,990] Trial 94 finished with value: 0.24765376650132648 and parameters: {'model_type': 'mlp', 'hidden_dims': '[512, 256]', 'dropout': 0.42702589342674835, 'batch_norm': False, 'lr': 1.909174829280161e-05, 'weight_decay': 2.5976981503161214e-07, 'epochs': 144, 'loss': 'mse', 'optimizer': 'adam', 'graph_mode': 'off', 'use_snp_selection': True, 'num_snps': 22996}. Best is trial 37 with value: 0.26732035923459463.
[I 2025-12-06 00:49:10,891] Trial 95 finished with value: 0.2525683349498223 and parameters: {'model_type': 'mlp', 'hidden_dims': '[512, 256]', 'dropout': 0.4062886355961586, 'batch_norm': False, 'lr': 5.183735500573285e-05, 'weight_decay': 7.2513060113465045e-06, 'epochs': 170, 'loss': 'mse', 'optimizer': 'adam', 'graph_mode': 'off', 'use_snp_selection': True, 'num_snps': 16762}. Best is trial 37 with value: 0.26732035923459463.
[I 2025-12-06 00:49:49,836] Trial 96 finished with value: 0.24865057570814333 and parameters: {'model_type': 'mlp', 'hidden_dims': '[256, 128, 64]', 'dropout': 0.3576943270253414, 'batch_norm': False, 'lr': 1.673410963614878e-05, 'weight_decay': 1.7011307760425898e-06, 'epochs': 175, 'loss': 'mse', 'optimizer': 'adam', 'graph_mode': 'off', 'use_snp_selection': True, 'num_snps': 19642}. Best is trial 37 with value: 0.26732035923459463.
[I 2025-12-06 00:50:35,510] Trial 97 finished with value: 0.2409588074578796 and parameters: {'model_type': 'mlp', 'hidden_dims': '[256, 128]', 'dropout': 0.31188574906703764, 'batch_norm': False, 'lr': 3.401639575384026e-05, 'weight_decay': 2.7589063515262748e-05, 'epochs': 151, 'loss': 'mse', 'optimizer': 'adam', 'graph_mode': 'off', 'use_snp_selection': True, 'num_snps': 32995}. Best is trial 37 with value: 0.26732035923459463.
[I 2025-12-06 00:51:10,428] Trial 98 finished with value: 0.2337835465216659 and parameters: {'model_type': 'mlp', 'hidden_dims': '[512, 256]', 'dropout': 0.3905808828265046, 'batch_norm': False, 'lr': 2.163218473842866e-05, 'weight_decay': 1.5066984904654489e-05, 'epochs': 116, 'loss': 'mse', 'optimizer': 'adam', 'graph_mode': 'off', 'use_snp_selection': True, 'num_snps': 11797}. Best is trial 37 with value: 0.26732035923459463.
[I 2025-12-06 00:52:00,281] Trial 99 finished with value: 0.24557974853877984 and parameters: {'model_type': 'mlp', 'hidden_dims': '[512, 256]', 'dropout': 0.46298463521605193, 'batch_norm': False, 'lr': 4.238456508221857e-05, 'weight_decay': 6.438587951163001e-07, 'epochs': 139, 'loss': 'mse', 'optimizer': 'adam', 'graph_mode': 'off', 'use_snp_selection': True, 'num_snps': 28171}. Best is trial 37 with value: 0.26732035923459463.
[I 2025-12-06 00:52:45,343] Trial 100 finished with value: 0.2540654827651645 and parameters: {'model_type': 'mlp', 'hidden_dims': '[512, 128]', 'dropout': 0.3324142178159186, 'batch_norm': False, 'lr': 3.157917243289644e-05, 'weight_decay': 0.00013284010804928394, 'epochs': 127, 'loss': 'mse', 'optimizer': 'adam', 'graph_mode': 'off', 'use_snp_selection': True, 'num_snps': 24156}. Best is trial 37 with value: 0.26732035923459463.
[I 2025-12-06 00:53:28,699] Trial 101 finished with value: 0.2534826427368821 and parameters: {'model_type': 'mlp', 'hidden_dims': '[512, 256]', 'dropout': 0.15774459138434438, 'batch_norm': False, 'lr': 7.84286305410598e-05, 'weight_decay': 0.0006952895799060087, 'epochs': 131, 'loss': 'mse', 'optimizer': 'adam', 'graph_mode': 'off', 'use_snp_selection': True, 'num_snps': 21330}. Best is trial 37 with value: 0.26732035923459463.
[I 2025-12-06 00:54:06,174] Trial 102 finished with value: 0.24749479943221417 and parameters: {'model_type': 'mlp', 'hidden_dims': '[128, 64]', 'dropout': 0.35188697661324525, 'batch_norm': False, 'lr': 4.7810251362808875e-05, 'weight_decay': 4.0260907087999075e-06, 'epochs': 155, 'loss': 'mse', 'optimizer': 'adam', 'graph_mode': 'off', 'use_snp_selection': True, 'num_snps': 24770}. Best is trial 37 with value: 0.26732035923459463.
[I 2025-12-06 00:54:40,224] Trial 103 finished with value: 0.2542119517577798 and parameters: {'model_type': 'mlp', 'hidden_dims': '[128, 64]', 'dropout': 0.2099396577192059, 'batch_norm': False, 'lr': 5.617312374406034e-05, 'weight_decay': 0.0008493434715240908, 'epochs': 141, 'loss': 'mse', 'optimizer': 'adam', 'graph_mode': 'off', 'use_snp_selection': True, 'num_snps': 17585}. Best is trial 37 with value: 0.26732035923459463.
[I 2025-12-06 00:55:16,875] Trial 104 finished with value: 0.2396679026455509 and parameters: {'model_type': 'mlp', 'hidden_dims': '[512, 256]', 'dropout': 0.20150463673365865, 'batch_norm': False, 'lr': 8.713747913725128e-05, 'weight_decay': 0.0005324041097728501, 'epochs': 91, 'loss': 'mse', 'optimizer': 'adam', 'graph_mode': 'off', 'use_snp_selection': True, 'num_snps': 15966}. Best is trial 37 with value: 0.26732035923459463.
[I 2025-12-06 00:55:57,012] Trial 105 finished with value: 0.2444604135382209 and parameters: {'model_type': 'mlp', 'hidden_dims': '[128, 64]', 'dropout': 0.13797937763122434, 'batch_norm': False, 'lr': 2.426773321983731e-05, 'weight_decay': 5.560039255594682e-05, 'epochs': 163, 'loss': 'mse', 'optimizer': 'adam', 'graph_mode': 'off', 'use_snp_selection': True, 'num_snps': 30238}. Best is trial 37 with value: 0.26732035923459463.
[I 2025-12-06 00:56:42,238] Trial 106 finished with value: 0.2523034364049606 and parameters: {'model_type': 'mlp', 'hidden_dims': '[512, 128]', 'dropout': 0.1833861822437245, 'batch_norm': False, 'lr': 3.799731158313321e-05, 'weight_decay': 4.026623648194435e-05, 'epochs': 136, 'loss': 'mse', 'optimizer': 'adam', 'graph_mode': 'off', 'use_snp_selection': True, 'num_snps': 23409}. Best is trial 37 with value: 0.26732035923459463.
[I 2025-12-06 00:57:27,619] Trial 107 finished with value: 0.24268230147061942 and parameters: {'model_type': 'mlp', 'hidden_dims': '[256, 128]', 'dropout': 0.16215869219064977, 'batch_norm': False, 'lr': 0.00015276576363968455, 'weight_decay': 0.0004052965893828248, 'epochs': 221, 'loss': 'mse', 'optimizer': 'adam', 'graph_mode': 'off', 'use_snp_selection': True, 'num_snps': 26806}. Best is trial 37 with value: 0.26732035923459463.
[I 2025-12-06 00:58:03,792] Trial 108 finished with value: 0.24687901870894305 and parameters: {'model_type': 'mlp', 'hidden_dims': '[256, 128, 64]', 'dropout': 0.43160041571718777, 'batch_norm': True, 'lr': 6.85279260050005e-05, 'weight_decay': 0.0007837487383369282, 'epochs': 104, 'loss': 'mse', 'optimizer': 'adam', 'graph_mode': 'off', 'use_snp_selection': True, 'num_snps': 19651}. Best is trial 37 with value: 0.26732035923459463.
[I 2025-12-06 00:58:40,387] Trial 109 finished with value: 0.25033189170192804 and parameters: {'model_type': 'mlp', 'hidden_dims': '[128, 64]', 'dropout': 0.12390149806663875, 'batch_norm': False, 'lr': 3.013145410934054e-05, 'weight_decay': 2.0458059581481228e-05, 'epochs': 179, 'loss': 'mse', 'optimizer': 'adam', 'graph_mode': 'off', 'use_snp_selection': True, 'num_snps': 21259}. Best is trial 37 with value: 0.26732035923459463.
[I 2025-12-06 00:59:20,507] Trial 110 finished with value: 0.2614129756071678 and parameters: {'model_type': 'mlp', 'hidden_dims': '[512, 256]', 'dropout': 0.26407895979509816, 'batch_norm': False, 'lr': 5.66731276457027e-05, 'weight_decay': 0.00016048944219447018, 'epochs': 119, 'loss': 'mse', 'optimizer': 'adam', 'graph_mode': 'off', 'use_snp_selection': True, 'num_snps': 18525}. Best is trial 37 with value: 0.26732035923459463.
