[I 2025-12-05 16:21:17,326] Trial 28 finished with value: 0.16106357382766603 and parameters: {'model_type': 'mlp', 'hidden_dims': '[128, 64]', 'dropout': 0.26673595624506075, 'batch_norm': True, 'lr': 0.0003793564442259007, 'weight_decay': 2.871843684455702e-06, 'epochs': 256, 'loss': 'mae', 'optimizer': 'adam', 'graph_mode': 'off', 'use_snp_selection': False}. Best is trial 13 with value: 0.18477349904482088.
[I 2025-12-05 16:21:18,914] Trial 29 finished with value: 0.16568535574691426 and parameters: {'model_type': 'mlp', 'hidden_dims': '[128, 64]', 'dropout': 0.1852111301781321, 'batch_norm': True, 'lr': 0.00022395149407349103, 'weight_decay': 1.3255203087773196e-06, 'epochs': 336, 'loss': 'mae', 'optimizer': 'adam', 'graph_mode': 'off', 'use_snp_selection': True, 'num_snps': 19468}. Best is trial 13 with value: 0.18477349904482088.
[I 2025-12-05 16:21:20,843] Trial 30 finished with value: 0.1728588150345035 and parameters: {'model_type': 'mlp', 'hidden_dims': '[512, 128]', 'dropout': 0.31398518842820433, 'batch_norm': True, 'lr': 0.0006127343189613932, 'weight_decay': 2.6140704596073916e-07, 'epochs': 334, 'loss': 'mae', 'optimizer': 'adam', 'graph_mode': 'off', 'use_snp_selection': False}. Best is trial 13 with value: 0.18477349904482088.
[I 2025-12-05 16:21:22,624] Trial 31 finished with value: 0.17181460788506406 and parameters: {'model_type': 'mlp', 'hidden_dims': '[512, 128]', 'dropout': 0.10674979676626772, 'batch_norm': True, 'lr': 0.00021215892253711844, 'weight_decay': 1.582942314792138e-05, 'epochs': 294, 'loss': 'mae', 'optimizer': 'adam', 'graph_mode': 'off', 'use_snp_selection': False}. Best is trial 13 with value: 0.18477349904482088.
[I 2025-12-05 16:21:24,452] Trial 32 finished with value: 0.18292516924968996 and parameters: {'model_type': 'mlp', 'hidden_dims': '[512, 128]', 'dropout': 0.13365525585504942, 'batch_norm': True, 'lr': 8.54091231365239e-05, 'weight_decay': 4.413851575565222e-05, 'epochs': 318, 'loss': 'mae', 'optimizer': 'adam', 'graph_mode': 'off', 'use_snp_selection': False}. Best is trial 13 with value: 0.18477349904482088.
[I 2025-12-05 16:21:26,391] Trial 33 finished with value: 0.16550564075505358 and parameters: {'model_type': 'mlp', 'hidden_dims': '[512, 128]', 'dropout': 0.15015145617820763, 'batch_norm': True, 'lr': 8.613404321373549e-05, 'weight_decay': 6.317273368728498e-05, 'epochs': 350, 'loss': 'mae', 'optimizer': 'adam', 'graph_mode': 'off', 'use_snp_selection': False}. Best is trial 13 with value: 0.18477349904482088.
[I 2025-12-05 16:21:27,496] Trial 34 finished with value: 0.09573486179321133 and parameters: {'model_type': 'mlp', 'hidden_dims': '[256, 128]', 'dropout': 0.4776495763450488, 'batch_norm': True, 'lr': 3.4842710826311315e-05, 'weight_decay': 4.3223736033848286e-05, 'epochs': 268, 'loss': 'mae', 'optimizer': 'adam', 'graph_mode': 'off', 'use_snp_selection': False}. Best is trial 13 with value: 0.18477349904482088.
[I 2025-12-05 16:21:29,323] Trial 35 finished with value: 0.14611803542527993 and parameters: {'model_type': 'mlp', 'hidden_dims': '[512, 128]', 'dropout': 0.1892863448774954, 'batch_norm': False, 'lr': 7.945347567264378e-05, 'weight_decay': 0.00010855456101912547, 'epochs': 324, 'loss': 'mae', 'optimizer': 'adam', 'graph_mode': 'off', 'use_snp_selection': False}. Best is trial 13 with value: 0.18477349904482088.
[I 2025-12-05 16:21:32,597] Trial 36 finished with value: 0.18060225475177344 and parameters: {'model_type': 'mlp', 'hidden_dims': '[512, 64]', 'dropout': 0.12813387739436594, 'batch_norm': True, 'lr': 0.00018336890780698946, 'weight_decay': 5.455211634785403e-06, 'epochs': 297, 'loss': 'mse', 'optimizer': 'adam', 'graph_mode': 'off', 'use_snp_selection': True, 'num_snps': 58661}. Best is trial 13 with value: 0.18477349904482088.
[I 2025-12-05 16:21:35,771] Trial 37 finished with value: 0.0569622688161772 and parameters: {'model_type': 'mlp', 'hidden_dims': '[512, 64]', 'dropout': 0.14125890986837178, 'batch_norm': True, 'lr': 4.446294938689996e-06, 'weight_decay': 2.8778734459435162e-05, 'epochs': 279, 'loss': 'mse', 'optimizer': 'adam', 'graph_mode': 'off', 'use_snp_selection': True, 'num_snps': 57733}. Best is trial 13 with value: 0.18477349904482088.
[I 2025-12-05 16:21:38,283] Trial 38 finished with value: 0.1587178007161153 and parameters: {'model_type': 'mlp', 'hidden_dims': '[512, 64]', 'dropout': 0.12909081518300217, 'batch_norm': False, 'lr': 2.225792717437086e-05, 'weight_decay': 9.992344049696583e-06, 'epochs': 242, 'loss': 'mse', 'optimizer': 'adam', 'graph_mode': 'off', 'use_snp_selection': True, 'num_snps': 46312}. Best is trial 13 with value: 0.18477349904482088.
[I 2025-12-05 16:21:39,541] Trial 39 finished with value: 0.06247684646781668 and parameters: {'model_type': 'mlp', 'hidden_dims': '[512, 64]', 'dropout': 0.16842875591073986, 'batch_norm': True, 'lr': 8.211110712880427e-06, 'weight_decay': 0.00021140548787724033, 'epochs': 123, 'loss': 'mse', 'optimizer': 'adam', 'graph_mode': 'off', 'use_snp_selection': True, 'num_snps': 19621}. Best is trial 13 with value: 0.18477349904482088.
[I 2025-12-05 16:21:42,224] Trial 40 finished with value: 0.13450569716914867 and parameters: {'model_type': 'mlp', 'hidden_dims': '[512, 64]', 'dropout': 0.5832815775516413, 'batch_norm': True, 'lr': 4.836369780502257e-05, 'weight_decay': 0.0006417234961516584, 'epochs': 323, 'loss': 'mse', 'optimizer': 'adam', 'graph_mode': 'off', 'use_snp_selection': True, 'num_snps': 46840}. Best is trial 13 with value: 0.18477349904482088.
[I 2025-12-05 16:21:43,910] Trial 41 finished with value: 0.15254835724433052 and parameters: {'model_type': 'mlp', 'hidden_dims': '[256, 128, 64]', 'dropout': 0.21819224730230918, 'batch_norm': True, 'lr': 0.0001654321543571407, 'weight_decay': 4.979957093555078e-06, 'epochs': 298, 'loss': 'mse', 'optimizer': 'adam', 'graph_mode': 'off', 'use_snp_selection': True, 'num_snps': 25404}. Best is trial 13 with value: 0.18477349904482088.
[I 2025-12-05 16:21:46,889] Trial 42 finished with value: 0.04907241484998729 and parameters: {'model_type': 'mlp', 'hidden_dims': '[512, 128]', 'dropout': 0.12611294300561574, 'batch_norm': True, 'lr': 2.1087442807785206e-06, 'weight_decay': 2.9390602300578476e-06, 'epochs': 302, 'loss': 'mse', 'optimizer': 'adam', 'graph_mode': 'off', 'use_snp_selection': True, 'num_snps': 52728}. Best is trial 13 with value: 0.18477349904482088.
[I 2025-12-05 16:21:48,258] Trial 43 finished with value: 0.1396827233572659 and parameters: {'model_type': 'mlp', 'hidden_dims': '[512, 64]', 'dropout': 0.3592562082197286, 'batch_norm': True, 'lr': 6.073331243251894e-05, 'weight_decay': 1.2978588864774449e-05, 'epochs': 169, 'loss': 'mse', 'optimizer': 'adam', 'graph_mode': 'off', 'use_snp_selection': False}. Best is trial 13 with value: 0.18477349904482088.
[I 2025-12-05 16:21:50,133] Trial 44 finished with value: 0.16545337460701248 and parameters: {'model_type': 'mlp', 'hidden_dims': '[512, 128]', 'dropout': 0.25149250986755745, 'batch_norm': True, 'lr': 0.0004279115106014033, 'weight_decay': 6.586573051568981e-06, 'epochs': 318, 'loss': 'mae', 'optimizer': 'adam', 'graph_mode': 'off', 'use_snp_selection': False}. Best is trial 13 with value: 0.18477349904482088.
[I 2025-12-05 16:21:51,829] Trial 45 finished with value: 0.16513175192384985 and parameters: {'model_type': 'mlp', 'hidden_dims': '[512, 256]', 'dropout': 0.19883068293361722, 'batch_norm': True, 'lr': 0.00017723585831479346, 'weight_decay': 1.90226216905189e-06, 'epochs': 267, 'loss': 'mae', 'optimizer': 'adam', 'graph_mode': 'off', 'use_snp_selection': False}. Best is trial 13 with value: 0.18477349904482088.
[I 2025-12-05 16:21:54,055] Trial 46 finished with value: 0.1811934855097754 and parameters: {'model_type': 'mlp', 'hidden_dims': '[512, 128]', 'dropout': 0.12819376604851696, 'batch_norm': True, 'lr': 0.0002887782119403414, 'weight_decay': 4.070498740864129e-06, 'epochs': 211, 'loss': 'mse', 'optimizer': 'adam', 'graph_mode': 'off', 'use_snp_selection': True, 'num_snps': 38360}. Best is trial 13 with value: 0.18477349904482088.
[I 2025-12-05 16:21:55,911] Trial 47 finished with value: 0.15200529353833636 and parameters: {'model_type': 'mlp', 'hidden_dims': '[256, 128]', 'dropout': 0.1275551394365959, 'batch_norm': False, 'lr': 0.0003071930554631814, 'weight_decay': 3.360590994618939e-06, 'epochs': 201, 'loss': 'mse', 'optimizer': 'adam', 'graph_mode': 'off', 'use_snp_selection': True, 'num_snps': 36540}. Best is trial 13 with value: 0.18477349904482088.
[I 2025-12-05 16:21:57,803] Trial 48 finished with value: 0.17158156318613832 and parameters: {'model_type': 'mlp', 'hidden_dims': '[512, 128]', 'dropout': 0.1739015989527113, 'batch_norm': True, 'lr': 0.00010160109766983941, 'weight_decay': 1.0595903337000164e-06, 'epochs': 57, 'loss': 'mse', 'optimizer': 'adam', 'graph_mode': 'off', 'use_snp_selection': True, 'num_snps': 39110}. Best is trial 13 with value: 0.18477349904482088.
[I 2025-12-05 16:22:00,507] Trial 49 finished with value: 0.17007224393406695 and parameters: {'model_type': 'mlp', 'hidden_dims': '[512, 64]', 'dropout': 0.12001386278162877, 'batch_norm': True, 'lr': 0.0006254752546775335, 'weight_decay': 4.915786874781014e-07, 'epochs': 218, 'loss': 'mse', 'optimizer': 'adam', 'graph_mode': 'off', 'use_snp_selection': True, 'num_snps': 51175}. Best is trial 13 with value: 0.18477349904482088.
[I 2025-12-05 16:22:02,134] Trial 50 finished with value: 0.15731044991489748 and parameters: {'model_type': 'mlp', 'hidden_dims': '[128, 64]', 'dropout': 0.15404284999841034, 'batch_norm': True, 'lr': 0.00028448562170759216, 'weight_decay': 2.735977491326344e-05, 'epochs': 153, 'loss': 'mse', 'optimizer': 'adam', 'graph_mode': 'off', 'use_snp_selection': True, 'num_snps': 28670}. Best is trial 13 with value: 0.18477349904482088.
[I 2025-12-05 16:22:03,893] Trial 51 finished with value: 0.1894404436287859 and parameters: {'model_type': 'mlp', 'hidden_dims': '[512, 128]', 'dropout': 0.14013732866489823, 'batch_norm': True, 'lr': 0.00013282022866337715, 'weight_decay': 4.240525701476821e-06, 'epochs': 283, 'loss': 'mse', 'optimizer': 'adam', 'graph_mode': 'off', 'use_snp_selection': False}. Best is trial 51 with value: 0.1894404436287859.
[I 2025-12-05 16:22:07,323] Trial 52 finished with value: 0.1617181242224216 and parameters: {'model_type': 'mlp', 'hidden_dims': '[512, 128]', 'dropout': 0.14593593466348537, 'batch_norm': True, 'lr': 4.84931223896522e-05, 'weight_decay': 2.238698332121414e-06, 'epochs': 283, 'loss': 'mse', 'optimizer': 'adam', 'graph_mode': 'off', 'use_snp_selection': True, 'num_snps': 59836}. Best is trial 51 with value: 0.1894404436287859.
[I 2025-12-05 16:22:08,956] Trial 53 finished with value: 0.1547582453241094 and parameters: {'model_type': 'mlp', 'hidden_dims': '[512, 128]', 'dropout': 0.10399227404253386, 'batch_norm': True, 'lr': 0.00013001124533995384, 'weight_decay': 7.373967861471405e-06, 'epochs': 249, 'loss': 'mse', 'optimizer': 'adam', 'graph_mode': 'off', 'use_snp_selection': False}. Best is trial 51 with value: 0.1894404436287859.
[I 2025-12-05 16:22:10,374] Trial 54 finished with value: 0.13889029966513824 and parameters: {'model_type': 'mlp', 'hidden_dims': '[512, 128]', 'dropout': 0.12430221535551478, 'batch_norm': True, 'lr': 7.435411514716546e-05, 'weight_decay': 1.3802102932197826e-05, 'epochs': 184, 'loss': 'mse', 'optimizer': 'adam', 'graph_mode': 'off', 'use_snp_selection': False}. Best is trial 51 with value: 0.1894404436287859.
[I 2025-12-05 16:22:12,311] Trial 55 finished with value: 0.17526609414408323 and parameters: {'model_type': 'mlp', 'hidden_dims': '[512, 128]', 'dropout': 0.16821068471021372, 'batch_norm': True, 'lr': 0.0004863539298330624, 'weight_decay': 3.517729234439265e-06, 'epochs': 340, 'loss': 'mse', 'optimizer': 'adam', 'graph_mode': 'off', 'use_snp_selection': False}. Best is trial 51 with value: 0.1894404436287859.
[I 2025-12-05 16:22:15,032] Trial 56 finished with value: 0.1787820804610459 and parameters: {'model_type': 'mlp', 'hidden_dims': '[512, 128]', 'dropout': 0.22823627920864134, 'batch_norm': True, 'lr': 0.0009372520110511067, 'weight_decay': 8.490043927392327e-07, 'epochs': 230, 'loss': 'mse', 'optimizer': 'adam', 'graph_mode': 'off', 'use_snp_selection': True, 'num_snps': 51861}. Best is trial 51 with value: 0.1894404436287859.
[I 2025-12-05 16:22:16,160] Trial 57 finished with value: 0.15668065078213797 and parameters: {'model_type': 'mlp', 'hidden_dims': '[256, 128, 64]', 'dropout': 0.20176620731460715, 'batch_norm': True, 'lr': 0.00018899596384999064, 'weight_decay': 4.635741095203224e-06, 'epochs': 273, 'loss': 'mse', 'optimizer': 'adam', 'graph_mode': 'off', 'use_snp_selection': False}. Best is trial 51 with value: 0.1894404436287859.
[I 2025-12-05 16:22:17,907] Trial 58 finished with value: 0.11729418186873847 and parameters: {'model_type': 'mlp', 'hidden_dims': '[512, 256]', 'dropout': 0.13812964220754878, 'batch_norm': False, 'lr': 0.00025608326976798507, 'weight_decay': 1.9537585224296482e-07, 'epochs': 289, 'loss': 'mse', 'optimizer': 'adam', 'graph_mode': 'off', 'use_snp_selection': False}. Best is trial 51 with value: 0.1894404436287859.
[I 2025-12-05 16:22:19,762] Trial 59 finished with value: 0.1846396217612459 and parameters: {'model_type': 'mlp', 'hidden_dims': '[512, 128]', 'dropout': 0.1670540524277424, 'batch_norm': True, 'lr': 0.00012654218005785702, 'weight_decay': 2.057091711840332e-05, 'epochs': 314, 'loss': 'mse', 'optimizer': 'adam', 'graph_mode': 'off', 'use_snp_selection': False}. Best is trial 51 with value: 0.1894404436287859.
[I 2025-12-05 16:22:22,311] Trial 60 finished with value: 0.1704574491577037 and parameters: {'model_type': 'mlp', 'hidden_dims': '[512, 128]', 'dropout': 0.1620402602030202, 'batch_norm': True, 'lr': 0.00013074217691814096, 'weight_decay': 7.307879682806197e-05, 'epochs': 314, 'loss': 'mse', 'optimizer': 'adam', 'graph_mode': 'off', 'use_snp_selection': True, 'num_snps': 41630}. Best is trial 51 with value: 0.1894404436287859.
[I 2025-12-05 16:22:24,184] Trial 61 finished with value: 0.16439420914595299 and parameters: {'model_type': 'mlp', 'hidden_dims': '[512, 128]', 'dropout': 0.18808494853841962, 'batch_norm': True, 'lr': 9.781375293078435e-05, 'weight_decay': 1.9627346731263245e-05, 'epochs': 331, 'loss': 'mse', 'optimizer': 'adam', 'graph_mode': 'off', 'use_snp_selection': False}. Best is trial 51 with value: 0.1894404436287859.
[I 2025-12-05 16:22:25,807] Trial 62 finished with value: 0.1909437269968553 and parameters: {'model_type': 'mlp', 'hidden_dims': '[512, 128]', 'dropout': 0.10385190763774341, 'batch_norm': True, 'lr': 0.00015384625638627326, 'weight_decay': 3.849982672019381e-05, 'epochs': 260, 'loss': 'mse', 'optimizer': 'adam', 'graph_mode': 'off', 'use_snp_selection': False}. Best is trial 62 with value: 0.1909437269968553.
[I 2025-12-05 16:22:27,449] Trial 63 finished with value: 0.15422802379732448 and parameters: {'model_type': 'mlp', 'hidden_dims': '[512, 128]', 'dropout': 0.11284803308708023, 'batch_norm': True, 'lr': 0.0001468865748976332, 'weight_decay': 3.533181493174482e-05, 'epochs': 257, 'loss': 'mse', 'optimizer': 'adam', 'graph_mode': 'off', 'use_snp_selection': False}. Best is trial 62 with value: 0.1909437269968553.
[I 2025-12-05 16:22:29,187] Trial 64 finished with value: 0.17797004549565731 and parameters: {'model_type': 'mlp', 'hidden_dims': '[512, 128]', 'dropout': 0.11655845412391076, 'batch_norm': True, 'lr': 0.00037507299939096517, 'weight_decay': 0.0001038786335926629, 'epochs': 284, 'loss': 'mse', 'optimizer': 'adam', 'graph_mode': 'off', 'use_snp_selection': False}. Best is trial 62 with value: 0.1909437269968553.
[I 2025-12-05 16:22:30,997] Trial 65 finished with value: 0.16082709505225534 and parameters: {'model_type': 'mlp', 'hidden_dims': '[512, 128]', 'dropout': 0.15412750491722332, 'batch_norm': True, 'lr': 0.0002040599716181066, 'weight_decay': 1.0047323910584083e-05, 'epochs': 303, 'loss': 'mse', 'optimizer': 'adam', 'graph_mode': 'off', 'use_snp_selection': False}. Best is trial 62 with value: 0.1909437269968553.
[I 2025-12-05 16:22:32,146] Trial 66 finished with value: 0.14541644718102076 and parameters: {'model_type': 'mlp', 'hidden_dims': '[256, 128]', 'dropout': 0.10022716475804008, 'batch_norm': True, 'lr': 6.592870920330674e-05, 'weight_decay': 6.054679947866557e-06, 'epochs': 261, 'loss': 'mse', 'optimizer': 'adam', 'graph_mode': 'off', 'use_snp_selection': False}. Best is trial 62 with value: 0.1909437269968553.
[I 2025-12-05 16:22:33,632] Trial 67 finished with value: 0.17246570736937772 and parameters: {'model_type': 'mlp', 'hidden_dims': '[512, 128]', 'dropout': 0.18239053429980828, 'batch_norm': True, 'lr': 0.0002428539742481668, 'weight_decay': 4.9379496589565966e-05, 'epochs': 202, 'loss': 'mse', 'optimizer': 'adam', 'graph_mode': 'off', 'use_snp_selection': False}. Best is trial 62 with value: 0.1909437269968553.
[I 2025-12-05 16:22:34,576] Trial 68 finished with value: 0.17035279009488655 and parameters: {'model_type': 'mlp', 'hidden_dims': '[128, 64]', 'dropout': 0.4257939941811682, 'batch_norm': True, 'lr': 0.00015759278515164898, 'weight_decay': 0.0001468812126574715, 'epochs': 237, 'loss': 'mse', 'optimizer': 'adam', 'graph_mode': 'off', 'use_snp_selection': False}. Best is trial 62 with value: 0.1909437269968553.
[I 2025-12-05 16:22:36,309] Trial 69 finished with value: 0.17158375682538496 and parameters: {'model_type': 'mlp', 'hidden_dims': '[512, 128]', 'dropout': 0.13757713892911785, 'batch_norm': True, 'lr': 0.00012095458540720644, 'weight_decay': 2.299167340908595e-05, 'epochs': 276, 'loss': 'mse', 'optimizer': 'adam', 'graph_mode': 'off', 'use_snp_selection': False}. Best is trial 62 with value: 0.1909437269968553.
[I 2025-12-05 16:22:37,788] Trial 70 finished with value: 0.1415691487931826 and parameters: {'model_type': 'mlp', 'hidden_dims': '[512, 64]', 'dropout': 0.1624605362704019, 'batch_norm': False, 'lr': 0.00034302699525043054, 'weight_decay': 8.54222436676307e-06, 'epochs': 212, 'loss': 'mse', 'optimizer': 'adam', 'graph_mode': 'off', 'use_snp_selection': True, 'num_snps': 21050}. Best is trial 62 with value: 0.1909437269968553.
[I 2025-12-05 16:22:39,721] Trial 71 finished with value: 0.17634870709035144 and parameters: {'model_type': 'mlp', 'hidden_dims': '[512, 128]', 'dropout': 0.13724322895194388, 'batch_norm': True, 'lr': 9.207369372842606e-05, 'weight_decay': 3.29239220182661e-05, 'epochs': 340, 'loss': 'mae', 'optimizer': 'adam', 'graph_mode': 'off', 'use_snp_selection': False}. Best is trial 62 with value: 0.1909437269968553.
[I 2025-12-05 16:22:41,517] Trial 72 finished with value: 0.15543416417297143 and parameters: {'model_type': 'mlp', 'hidden_dims': '[512, 128]', 'dropout': 0.11172855324156278, 'batch_norm': True, 'lr': 0.00010875144150494571, 'weight_decay': 1.7380281442136984e-05, 'epochs': 306, 'loss': 'mae', 'optimizer': 'adam', 'graph_mode': 'off', 'use_snp_selection': False}. Best is trial 62 with value: 0.1909437269968553.
[I 2025-12-05 16:22:43,384] Trial 73 finished with value: 0.17333906640865215 and parameters: {'model_type': 'mlp', 'hidden_dims': '[512, 128]', 'dropout': 0.13551413106794125, 'batch_norm': True, 'lr': 0.00018745153760212795, 'weight_decay': 7.165231341022359e-05, 'epochs': 318, 'loss': 'mae', 'optimizer': 'adam', 'graph_mode': 'off', 'use_snp_selection': False}. Best is trial 62 with value: 0.1909437269968553.
[I 2025-12-05 16:22:45,181] Trial 74 finished with value: 0.15617858624052833 and parameters: {'model_type': 'mlp', 'hidden_dims': '[512, 128]', 'dropout': 0.14928331773071188, 'batch_norm': True, 'lr': 7.966361352781124e-05, 'weight_decay': 1.1800570541222032e-05, 'epochs': 295, 'loss': 'mae', 'optimizer': 'adam', 'graph_mode': 'off', 'use_snp_selection': False}. Best is trial 62 with value: 0.1909437269968553.
[I 2025-12-05 16:22:46,391] Trial 75 finished with value: 0.10927484102964027 and parameters: {'model_type': 'mlp', 'hidden_dims': '[256, 128, 64]', 'dropout': 0.17720590304125147, 'batch_norm': True, 'lr': 4.247900323190487e-05, 'weight_decay': 1.548274743120174e-06, 'epochs': 290, 'loss': 'mae', 'optimizer': 'adam', 'graph_mode': 'off', 'use_snp_selection': False}. Best is trial 62 with value: 0.1909437269968553.
[I 2025-12-05 16:22:48,301] Trial 76 finished with value: 0.18035070771276338 and parameters: {'model_type': 'mlp', 'hidden_dims': '[512, 128]', 'dropout': 0.19728116041434915, 'batch_norm': True, 'lr': 0.0002658486005516134, 'weight_decay': 3.87693057763674e-06, 'epochs': 328, 'loss': 'mae', 'optimizer': 'adam', 'graph_mode': 'off', 'use_snp_selection': False}. Best is trial 62 with value: 0.1909437269968553.
[I 2025-12-05 16:22:49,955] Trial 77 finished with value: 0.16739156511353878 and parameters: {'model_type': 'mlp', 'hidden_dims': '[512, 256]', 'dropout': 0.22090602730286765, 'batch_norm': True, 'lr': 0.00014398231348970782, 'weight_decay': 2.3477483053102764e-06, 'epochs': 250, 'loss': 'mse', 'optimizer': 'adam', 'graph_mode': 'off', 'use_snp_selection': False}. Best is trial 62 with value: 0.1909437269968553.
[I 2025-12-05 16:22:51,293] Trial 78 finished with value: 0.13813026875134551 and parameters: {'model_type': 'mlp', 'hidden_dims': '[512, 128]', 'dropout': 0.2696553469082844, 'batch_norm': True, 'lr': 2.8484304627253243e-05, 'weight_decay': 5.78659631248704e-06, 'epochs': 313, 'loss': 'mae', 'optimizer': 'adam', 'graph_mode': 'off', 'use_snp_selection': True, 'num_snps': 10364}. Best is trial 62 with value: 0.1909437269968553.
[I 2025-12-05 16:22:53,238] Trial 79 finished with value: 0.1620916403597147 and parameters: {'model_type': 'mlp', 'hidden_dims': '[512, 64]', 'dropout': 0.11901802225867997, 'batch_norm': True, 'lr': 5.76196530248602e-05, 'weight_decay': 1.5230952347473094e-05, 'epochs': 345, 'loss': 'mse', 'optimizer': 'adam', 'graph_mode': 'off', 'use_snp_selection': False}. Best is trial 62 with value: 0.1909437269968553.
