[I 2025-12-05 14:56:29,595] Trial 83 finished with value: 0.12529436517737275 and parameters: {'model_type': 'mlp', 'hidden_dims': '[512, 64]', 'dropout': 0.22291047655396973, 'batch_norm': True, 'lr': 0.0003322360208355829, 'weight_decay': 3.5185906064313156e-06, 'epochs': 246, 'loss': 'mae', 'optimizer': 'adam', 'graph_mode': 'off', 'use_snp_selection': False}. Best is trial 14 with value: 0.14489011797967669.
[I 2025-12-05 14:56:31,328] Trial 84 finished with value: 0.12080671612805327 and parameters: {'model_type': 'mlp', 'hidden_dims': '[512, 64]', 'dropout': 0.21497084498398686, 'batch_norm': True, 'lr': 0.00023248131387834837, 'weight_decay': 1.2096617274045955e-06, 'epochs': 259, 'loss': 'mae', 'optimizer': 'adam', 'graph_mode': 'off', 'use_snp_selection': False}. Best is trial 14 with value: 0.14489011797967669.
[I 2025-12-05 14:56:33,014] Trial 85 finished with value: 0.12786479522755775 and parameters: {'model_type': 'mlp', 'hidden_dims': '[512, 256]', 'dropout': 0.23961107036918072, 'batch_norm': True, 'lr': 0.00012200425435890166, 'weight_decay': 1.7809333985841105e-06, 'epochs': 238, 'loss': 'mae', 'optimizer': 'adam', 'graph_mode': 'off', 'use_snp_selection': False}. Best is trial 14 with value: 0.14489011797967669.
[I 2025-12-05 14:56:34,726] Trial 86 finished with value: 0.1326638835891968 and parameters: {'model_type': 'mlp', 'hidden_dims': '[512, 64]', 'dropout': 0.2675367501644337, 'batch_norm': True, 'lr': 8.384700180338153e-05, 'weight_decay': 2.80861397056088e-07, 'epochs': 252, 'loss': 'mae', 'optimizer': 'adam', 'graph_mode': 'off', 'use_snp_selection': False}. Best is trial 14 with value: 0.14489011797967669.
[I 2025-12-05 14:56:35,727] Trial 87 finished with value: 0.11530133486720413 and parameters: {'model_type': 'mlp', 'hidden_dims': '[128, 64]', 'dropout': 0.2601264967117428, 'batch_norm': True, 'lr': 8.083312328087289e-05, 'weight_decay': 2.5831501919325955e-07, 'epochs': 279, 'loss': 'mae', 'optimizer': 'adam', 'graph_mode': 'off', 'use_snp_selection': False}. Best is trial 14 with value: 0.14489011797967669.
[I 2025-12-05 14:56:36,889] Trial 88 finished with value: 0.113692284827085 and parameters: {'model_type': 'mlp', 'hidden_dims': '[256, 128]', 'dropout': 0.2831820591412607, 'batch_norm': True, 'lr': 6.954052799553857e-05, 'weight_decay': 1.2360759418178607e-07, 'epochs': 255, 'loss': 'mae', 'optimizer': 'adam', 'graph_mode': 'off', 'use_snp_selection': False}. Best is trial 14 with value: 0.14489011797967669.
[I 2025-12-05 14:56:38,784] Trial 89 finished with value: 0.122945650973598 and parameters: {'model_type': 'mlp', 'hidden_dims': '[512, 64]', 'dropout': 0.3011317518208002, 'batch_norm': True, 'lr': 8.829059353434112e-05, 'weight_decay': 3.8426886608575997e-07, 'epochs': 301, 'loss': 'mae', 'optimizer': 'adam', 'graph_mode': 'off', 'use_snp_selection': False}. Best is trial 14 with value: 0.14489011797967669.
[I 2025-12-05 14:56:39,853] Trial 90 finished with value: 0.04385650884877659 and parameters: {'model_type': 'mlp', 'hidden_dims': '[128, 64]', 'dropout': 0.10905343694424474, 'batch_norm': True, 'lr': 4.798726352531876e-05, 'weight_decay': 1.7991241049133603e-07, 'epochs': 249, 'loss': 'mse', 'optimizer': 'adam', 'graph_mode': 'off', 'use_snp_selection': True, 'num_snps': 8680}. Best is trial 14 with value: 0.14489011797967669.
[I 2025-12-05 14:56:41,521] Trial 91 finished with value: 0.1291188780438175 and parameters: {'model_type': 'mlp', 'hidden_dims': '[512, 64]', 'dropout': 0.2697463707280596, 'batch_norm': True, 'lr': 0.0003021127619040854, 'weight_decay': 6.327608184830805e-07, 'epochs': 234, 'loss': 'mae', 'optimizer': 'adam', 'graph_mode': 'off', 'use_snp_selection': False}. Best is trial 14 with value: 0.14489011797967669.
[I 2025-12-05 14:56:43,145] Trial 92 finished with value: 0.11088368458855359 and parameters: {'model_type': 'mlp', 'hidden_dims': '[512, 64]', 'dropout': 0.27468801763048356, 'batch_norm': True, 'lr': 0.00020043587015204444, 'weight_decay': 6.675998571122462e-07, 'epochs': 225, 'loss': 'mae', 'optimizer': 'adam', 'graph_mode': 'off', 'use_snp_selection': False}. Best is trial 14 with value: 0.14489011797967669.
[I 2025-12-05 14:56:44,714] Trial 93 finished with value: 0.09958837744225099 and parameters: {'model_type': 'mlp', 'hidden_dims': '[512, 64]', 'dropout': 0.2651966498644703, 'batch_norm': True, 'lr': 0.00026757340022231846, 'weight_decay': 4.395832332575998e-07, 'epochs': 215, 'loss': 'mae', 'optimizer': 'adam', 'graph_mode': 'off', 'use_snp_selection': False}. Best is trial 14 with value: 0.14489011797967669.
[I 2025-12-05 14:56:46,477] Trial 94 finished with value: 0.10670041520818546 and parameters: {'model_type': 'mlp', 'hidden_dims': '[512, 64]', 'dropout': 0.3394862545434581, 'batch_norm': True, 'lr': 0.0005960037950175324, 'weight_decay': 2.377040120446881e-07, 'epochs': 265, 'loss': 'mae', 'optimizer': 'adam', 'graph_mode': 'off', 'use_snp_selection': False}. Best is trial 14 with value: 0.14489011797967669.
[I 2025-12-05 14:56:48,146] Trial 95 finished with value: 0.12274170751105319 and parameters: {'model_type': 'mlp', 'hidden_dims': '[512, 128]', 'dropout': 0.3182596250880223, 'batch_norm': True, 'lr': 0.0001592280305773058, 'weight_decay': 5.837123969425244e-07, 'epochs': 242, 'loss': 'mae', 'optimizer': 'adam', 'graph_mode': 'off', 'use_snp_selection': False}. Best is trial 14 with value: 0.14489011797967669.
[I 2025-12-05 14:56:49,955] Trial 96 finished with value: 0.11778032149144543 and parameters: {'model_type': 'mlp', 'hidden_dims': '[512, 64]', 'dropout': 0.2850868278549163, 'batch_norm': True, 'lr': 0.00011947731077535152, 'weight_decay': 3.2314921384932437e-07, 'epochs': 274, 'loss': 'mae', 'optimizer': 'adam', 'graph_mode': 'off', 'use_snp_selection': False}. Best is trial 14 with value: 0.14489011797967669.
[I 2025-12-05 14:56:51,014] Trial 97 finished with value: 0.09674256416667598 and parameters: {'model_type': 'mlp', 'hidden_dims': '[256, 128]', 'dropout': 0.517130287057717, 'batch_norm': True, 'lr': 0.00045694057667653045, 'weight_decay': 8.357477550655762e-07, 'epochs': 204, 'loss': 'mae', 'optimizer': 'adam', 'graph_mode': 'off', 'use_snp_selection': False}. Best is trial 14 with value: 0.14489011797967669.
[I 2025-12-05 14:56:52,038] Trial 98 finished with value: 0.1169950787362399 and parameters: {'model_type': 'mlp', 'hidden_dims': '[256, 128, 64]', 'dropout': 0.30803904618898853, 'batch_norm': False, 'lr': 3.8697074376630254e-05, 'weight_decay': 1.3588054006874675e-07, 'epochs': 191, 'loss': 'mae', 'optimizer': 'adam', 'graph_mode': 'off', 'use_snp_selection': False}. Best is trial 14 with value: 0.14489011797967669.
[I 2025-12-05 14:56:53,891] Trial 99 finished with value: 0.11841229692412522 and parameters: {'model_type': 'mlp', 'hidden_dims': '[512, 64]', 'dropout': 0.3314844846568518, 'batch_norm': True, 'lr': 0.00029904191116330897, 'weight_decay': 4.799070995610906e-06, 'epochs': 290, 'loss': 'mae', 'optimizer': 'adam', 'graph_mode': 'off', 'use_snp_selection': False}. Best is trial 14 with value: 0.14489011797967669.
[I 2025-12-05 14:56:56,184] Trial 100 finished with value: 0.10296270158690583 and parameters: {'model_type': 'mlp', 'hidden_dims': '[128, 64]', 'dropout': 0.543881815347294, 'batch_norm': True, 'lr': 6.562237557731804e-05, 'weight_decay': 1.8401764203524724e-07, 'epochs': 233, 'loss': 'mae', 'optimizer': 'adam', 'graph_mode': 'off', 'use_snp_selection': True, 'num_snps': 50168}. Best is trial 14 with value: 0.14489011797967669.
[I 2025-12-05 14:56:57,853] Trial 101 finished with value: 0.12298617557824655 and parameters: {'model_type': 'mlp', 'hidden_dims': '[512, 64]', 'dropout': 0.24930156329310493, 'batch_norm': True, 'lr': 0.0008189432015084711, 'weight_decay': 2.2665343315536236e-06, 'epochs': 231, 'loss': 'mae', 'optimizer': 'adam', 'graph_mode': 'off', 'use_snp_selection': False}. Best is trial 14 with value: 0.14489011797967669.
[I 2025-12-05 14:56:59,448] Trial 102 finished with value: 0.1271880636488561 and parameters: {'model_type': 'mlp', 'hidden_dims': '[512, 64]', 'dropout': 0.19527020912882478, 'batch_norm': True, 'lr': 0.0003317339424299444, 'weight_decay': 0.0005338471483080505, 'epochs': 222, 'loss': 'mae', 'optimizer': 'adam', 'graph_mode': 'off', 'use_snp_selection': False}. Best is trial 14 with value: 0.14489011797967669.
[I 2025-12-05 14:57:01,150] Trial 103 finished with value: 0.13353543998210934 and parameters: {'model_type': 'mlp', 'hidden_dims': '[512, 64]', 'dropout': 0.2935165380751643, 'batch_norm': True, 'lr': 0.00021798169522845983, 'weight_decay': 1.3708773929572942e-06, 'epochs': 250, 'loss': 'mae', 'optimizer': 'adam', 'graph_mode': 'off', 'use_snp_selection': False}. Best is trial 14 with value: 0.14489011797967669.
[I 2025-12-05 14:57:02,861] Trial 104 finished with value: 0.1179937935599285 and parameters: {'model_type': 'mlp', 'hidden_dims': '[512, 64]', 'dropout': 0.294603069165395, 'batch_norm': True, 'lr': 0.00023306348773819815, 'weight_decay': 6.595647341291047e-07, 'epochs': 252, 'loss': 'mae', 'optimizer': 'adam', 'graph_mode': 'off', 'use_snp_selection': False}. Best is trial 14 with value: 0.14489011797967669.
[I 2025-12-05 14:57:04,607] Trial 105 finished with value: 0.11912306283833468 and parameters: {'model_type': 'mlp', 'hidden_dims': '[512, 64]', 'dropout': 0.3153491723556688, 'batch_norm': True, 'lr': 0.00018706675737221673, 'weight_decay': 0.0001997785699186065, 'epochs': 260, 'loss': 'mae', 'optimizer': 'adam', 'graph_mode': 'off', 'use_snp_selection': False}. Best is trial 14 with value: 0.14489011797967669.
[I 2025-12-05 14:57:06,297] Trial 106 finished with value: 0.11625976665809883 and parameters: {'model_type': 'mlp', 'hidden_dims': '[512, 256]', 'dropout': 0.2782753173874025, 'batch_norm': True, 'lr': 0.00014301144527795518, 'weight_decay': 1.0252384062518232e-06, 'epochs': 246, 'loss': 'mae', 'optimizer': 'adam', 'graph_mode': 'off', 'use_snp_selection': False}. Best is trial 14 with value: 0.14489011797967669.
[I 2025-12-05 14:57:07,386] Trial 107 finished with value: 0.1336916705032618 and parameters: {'model_type': 'mlp', 'hidden_dims': '[256, 128]', 'dropout': 0.296285590019642, 'batch_norm': True, 'lr': 0.00027905269959330924, 'weight_decay': 1.2809830828618329e-06, 'epochs': 209, 'loss': 'mae', 'optimizer': 'adam', 'graph_mode': 'off', 'use_snp_selection': False}. Best is trial 14 with value: 0.14489011797967669.
[I 2025-12-05 14:57:08,471] Trial 108 finished with value: 0.11672669441280245 and parameters: {'model_type': 'mlp', 'hidden_dims': '[256, 128]', 'dropout': 0.35939428111526767, 'batch_norm': True, 'lr': 0.00022554547677074453, 'weight_decay': 1.3481213776272796e-06, 'epochs': 211, 'loss': 'mae', 'optimizer': 'adam', 'graph_mode': 'off', 'use_snp_selection': False}. Best is trial 14 with value: 0.14489011797967669.
[I 2025-12-05 14:57:09,486] Trial 109 finished with value: 0.11196749443388147 and parameters: {'model_type': 'mlp', 'hidden_dims': '[256, 128]', 'dropout': 0.2999446184583771, 'batch_norm': True, 'lr': 0.00011315493919573778, 'weight_decay': 1.7923300095180916e-06, 'epochs': 182, 'loss': 'mse', 'optimizer': 'adam', 'graph_mode': 'off', 'use_snp_selection': False}. Best is trial 14 with value: 0.14489011797967669.
[I 2025-12-05 14:57:10,558] Trial 110 finished with value: 0.10334499458106013 and parameters: {'model_type': 'mlp', 'hidden_dims': '[256, 128]', 'dropout': 0.5762324240409634, 'batch_norm': True, 'lr': 9.756243294453938e-05, 'weight_decay': 2.594433512327844e-06, 'epochs': 196, 'loss': 'mae', 'optimizer': 'adam', 'graph_mode': 'off', 'use_snp_selection': False}. Best is trial 14 with value: 0.14489011797967669.
[I 2025-12-05 14:57:11,694] Trial 111 finished with value: 0.12053996141954082 and parameters: {'model_type': 'mlp', 'hidden_dims': '[256, 128]', 'dropout': 0.4935086563277232, 'batch_norm': True, 'lr': 0.00028410476391487854, 'weight_decay': 1.161265537615114e-06, 'epochs': 241, 'loss': 'mae', 'optimizer': 'adam', 'graph_mode': 'off', 'use_snp_selection': False}. Best is trial 14 with value: 0.14489011797967669.
[I 2025-12-05 14:57:13,298] Trial 112 finished with value: 0.12876220645237613 and parameters: {'model_type': 'mlp', 'hidden_dims': '[512, 64]', 'dropout': 0.24389026446097933, 'batch_norm': True, 'lr': 0.00041060223117202026, 'weight_decay': 9.181779862288163e-07, 'epochs': 216, 'loss': 'mae', 'optimizer': 'adam', 'graph_mode': 'off', 'use_snp_selection': False}. Best is trial 14 with value: 0.14489011797967669.
[I 2025-12-05 14:57:14,442] Trial 113 finished with value: 0.12817889051364387 and parameters: {'model_type': 'mlp', 'hidden_dims': '[256, 128]', 'dropout': 0.47014812242441373, 'batch_norm': True, 'lr': 0.0002652498847508742, 'weight_decay': 4.5185226387435735e-07, 'epochs': 226, 'loss': 'mae', 'optimizer': 'adam', 'graph_mode': 'off', 'use_snp_selection': False}. Best is trial 14 with value: 0.14489011797967669.
[I 2025-12-05 14:57:15,370] Trial 114 finished with value: 0.12487240316009138 and parameters: {'model_type': 'mlp', 'hidden_dims': '[128, 64]', 'dropout': 0.32803359539112614, 'batch_norm': True, 'lr': 0.0005702037636928405, 'weight_decay': 7.439570508881231e-07, 'epochs': 238, 'loss': 'mae', 'optimizer': 'adam', 'graph_mode': 'off', 'use_snp_selection': False}. Best is trial 14 with value: 0.14489011797967669.
[I 2025-12-05 14:57:17,344] Trial 115 finished with value: 0.1224588054041657 and parameters: {'model_type': 'mlp', 'hidden_dims': '[512, 64]', 'dropout': 0.26809104164730535, 'batch_norm': True, 'lr': 0.00017905266526931803, 'weight_decay': 2.7533435124741014e-07, 'epochs': 210, 'loss': 'mae', 'optimizer': 'adam', 'graph_mode': 'off', 'use_snp_selection': True, 'num_snps': 34027}. Best is trial 14 with value: 0.14489011797967669.
[I 2025-12-05 14:57:18,746] Trial 116 finished with value: 0.1273343500653451 and parameters: {'model_type': 'mlp', 'hidden_dims': '[512, 64]', 'dropout': 0.2858399674165617, 'batch_norm': True, 'lr': 0.0004876841282671125, 'weight_decay': 1.286067907542892e-06, 'epochs': 167, 'loss': 'mae', 'optimizer': 'adam', 'graph_mode': 'off', 'use_snp_selection': False}. Best is trial 14 with value: 0.14489011797967669.
[I 2025-12-05 14:57:19,822] Trial 117 finished with value: 0.09844759479460702 and parameters: {'model_type': 'mlp', 'hidden_dims': '[256, 128]', 'dropout': 0.3390937655694942, 'batch_norm': False, 'lr': 5.3295220100104657e-05, 'weight_decay': 8.434712620787401e-06, 'epochs': 221, 'loss': 'mae', 'optimizer': 'adam', 'graph_mode': 'off', 'use_snp_selection': False}. Best is trial 14 with value: 0.14489011797967669.
[I 2025-12-05 14:57:21,632] Trial 118 finished with value: 0.12339325872208012 and parameters: {'model_type': 'mlp', 'hidden_dims': '[512, 128]', 'dropout': 0.30970228601558386, 'batch_norm': True, 'lr': 0.0003749317387284885, 'weight_decay': 1.2042600200148927e-07, 'epochs': 269, 'loss': 'mae', 'optimizer': 'adam', 'graph_mode': 'off', 'use_snp_selection': False}. Best is trial 14 with value: 0.14489011797967669.
[I 2025-12-05 14:57:23,326] Trial 119 finished with value: 0.11798425194498414 and parameters: {'model_type': 'mlp', 'hidden_dims': '[512, 64]', 'dropout': 0.2565297765098753, 'batch_norm': True, 'lr': 0.0003105749764190074, 'weight_decay': 1.7704426400100072e-05, 'epochs': 247, 'loss': 'mae', 'optimizer': 'adam', 'graph_mode': 'off', 'use_snp_selection': False}. Best is trial 14 with value: 0.14489011797967669.
[I 2025-12-05 14:57:24,305] Trial 120 finished with value: 0.11760496677009595 and parameters: {'model_type': 'mlp', 'hidden_dims': '[128, 64]', 'dropout': 0.2889493497911588, 'batch_norm': True, 'lr': 0.0001319826918301158, 'weight_decay': 5.153256721464492e-07, 'epochs': 257, 'loss': 'mae', 'optimizer': 'adam', 'graph_mode': 'off', 'use_snp_selection': False}. Best is trial 14 with value: 0.14489011797967669.
[I 2025-12-05 14:57:25,890] Trial 121 finished with value: 0.1208946814873763 and parameters: {'model_type': 'mlp', 'hidden_dims': '[512, 64]', 'dropout': 0.24096948587890799, 'batch_norm': True, 'lr': 0.0004141174845093921, 'weight_decay': 9.465431923363936e-07, 'epochs': 216, 'loss': 'mae', 'optimizer': 'adam', 'graph_mode': 'off', 'use_snp_selection': False}. Best is trial 14 with value: 0.14489011797967669.
[I 2025-12-05 14:57:27,428] Trial 122 finished with value: 0.12691630215381122 and parameters: {'model_type': 'mlp', 'hidden_dims': '[512, 64]', 'dropout': 0.21781681754609175, 'batch_norm': True, 'lr': 0.00022349648930411, 'weight_decay': 9.158789682648031e-07, 'epochs': 206, 'loss': 'mae', 'optimizer': 'adam', 'graph_mode': 'off', 'use_snp_selection': False}. Best is trial 14 with value: 0.14489011797967669.
[I 2025-12-05 14:57:29,091] Trial 123 finished with value: 0.12046050249695732 and parameters: {'model_type': 'mlp', 'hidden_dims': '[512, 64]', 'dropout': 0.26760941522957404, 'batch_norm': True, 'lr': 0.0003843888202314693, 'weight_decay': 1.5867471624512813e-06, 'epochs': 230, 'loss': 'mae', 'optimizer': 'adam', 'graph_mode': 'off', 'use_snp_selection': False}. Best is trial 14 with value: 0.14489011797967669.
[I 2025-12-05 14:57:30,755] Trial 124 finished with value: 0.11843536183801939 and parameters: {'model_type': 'mlp', 'hidden_dims': '[512, 64]', 'dropout': 0.24416453687896697, 'batch_norm': True, 'lr': 7.696287531736339e-05, 'weight_decay': 2.043355643221809e-06, 'epochs': 236, 'loss': 'mae', 'optimizer': 'adam', 'graph_mode': 'off', 'use_snp_selection': False}. Best is trial 14 with value: 0.14489011797967669.
[I 2025-12-05 14:57:31,861] Trial 125 finished with value: 0.10799572504359185 and parameters: {'model_type': 'mlp', 'hidden_dims': '[256, 128, 64]', 'dropout': 0.23011981999319292, 'batch_norm': True, 'lr': 0.00025515314194949566, 'weight_decay': 1.142959496149923e-06, 'epochs': 217, 'loss': 'mae', 'optimizer': 'adam', 'graph_mode': 'off', 'use_snp_selection': False}. Best is trial 14 with value: 0.14489011797967669.
[I 2025-12-05 14:57:33,260] Trial 126 finished with value: 0.1233034482807294 and parameters: {'model_type': 'mlp', 'hidden_dims': '[512, 64]', 'dropout': 0.2980830720963892, 'batch_norm': True, 'lr': 0.00015739337478171912, 'weight_decay': 3.58255369156107e-07, 'epochs': 226, 'loss': 'mae', 'optimizer': 'adam', 'graph_mode': 'off', 'use_snp_selection': True, 'num_snps': 18073}. Best is trial 14 with value: 0.14489011797967669.
[I 2025-12-05 14:57:34,965] Trial 127 finished with value: 0.11975459343429178 and parameters: {'model_type': 'mlp', 'hidden_dims': '[512, 64]', 'dropout': 0.2790401513062449, 'batch_norm': True, 'lr': 0.0005371276754636829, 'weight_decay': 6.324230609980727e-07, 'epochs': 252, 'loss': 'mae', 'optimizer': 'adam', 'graph_mode': 'off', 'use_snp_selection': False}. Best is trial 14 with value: 0.14489011797967669.
[I 2025-12-05 14:57:36,024] Trial 128 finished with value: 0.1271016760790456 and parameters: {'model_type': 'mlp', 'hidden_dims': '[256, 128]', 'dropout': 0.3191639958037435, 'batch_norm': True, 'lr': 0.00020041837896957475, 'weight_decay': 3.2101826460518716e-06, 'epochs': 201, 'loss': 'mae', 'optimizer': 'adam', 'graph_mode': 'off', 'use_snp_selection': False}. Best is trial 14 with value: 0.14489011797967669.
[I 2025-12-05 14:57:37,709] Trial 129 finished with value: 0.11935475847605319 and parameters: {'model_type': 'mlp', 'hidden_dims': '[512, 64]', 'dropout': 0.2567273489443662, 'batch_norm': True, 'lr': 0.00030908957298417017, 'weight_decay': 1.5531710248944543e-07, 'epochs': 245, 'loss': 'mse', 'optimizer': 'adam', 'graph_mode': 'off', 'use_snp_selection': False}. Best is trial 14 with value: 0.14489011797967669.
[I 2025-12-05 14:57:38,619] Trial 130 finished with value: 0.10783238305171124 and parameters: {'model_type': 'mlp', 'hidden_dims': '[128, 64]', 'dropout': 0.5219256289045711, 'batch_norm': True, 'lr': 0.0004360930558090439, 'weight_decay': 1.3474308559434617e-06, 'epochs': 234, 'loss': 'mae', 'optimizer': 'adam', 'graph_mode': 'off', 'use_snp_selection': False}. Best is trial 14 with value: 0.14489011797967669.
[I 2025-12-05 14:57:40,303] Trial 131 finished with value: 0.12800874415917818 and parameters: {'model_type': 'mlp', 'hidden_dims': '[512, 64]', 'dropout': 0.20866383055183477, 'batch_norm': True, 'lr': 0.00035529184244347396, 'weight_decay': 8.240062451259052e-07, 'epochs': 241, 'loss': 'mae', 'optimizer': 'adam', 'graph_mode': 'off', 'use_snp_selection': False}. Best is trial 14 with value: 0.14489011797967669.
[I 2025-12-05 14:57:41,885] Trial 132 finished with value: 0.1211776934654835 and parameters: {'model_type': 'mlp', 'hidden_dims': '[512, 64]', 'dropout': 0.23279454933831184, 'batch_norm': True, 'lr': 0.0003241811690799881, 'weight_decay': 1.7303316864998425e-06, 'epochs': 220, 'loss': 'mae', 'optimizer': 'adam', 'graph_mode': 'off', 'use_snp_selection': False}. Best is trial 14 with value: 0.14489011797967669.
[I 2025-12-05 14:57:43,531] Trial 133 finished with value: 0.1219838130647647 and parameters: {'model_type': 'mlp', 'hidden_dims': '[512, 64]', 'dropout': 0.3053378294540939, 'batch_norm': True, 'lr': 0.00026892075174307655, 'weight_decay': 1.5576446725649072e-06, 'epochs': 233, 'loss': 'mae', 'optimizer': 'adam', 'graph_mode': 'off', 'use_snp_selection': False}. Best is trial 14 with value: 0.14489011797967669.
[I 2025-12-05 14:57:45,465] Trial 134 finished with value: 0.11978535652037675 and parameters: {'model_type': 'mlp', 'hidden_dims': '[512, 64]', 'dropout': 0.5080144022464032, 'batch_norm': True, 'lr': 0.00040330625847953306, 'weight_decay': 2.431751391907356e-06, 'epochs': 311, 'loss': 'mae', 'optimizer': 'adam', 'graph_mode': 'off', 'use_snp_selection': False}. Best is trial 14 with value: 0.14489011797967669.
