[I 2025-12-06 06:32:19,210] Trial 83 finished with value: 0.25341080998178517 and parameters: {'model_type': 'mlp', 'hidden_dims': '[512, 64]', 'dropout': 0.16298758111551984, 'batch_norm': True, 'lr': 2.81655696595322e-05, 'weight_decay': 7.007020795452957e-07, 'epochs': 222, 'loss': 'mae', 'optimizer': 'adam', 'graph_mode': 'off', 'use_snp_selection': False}. Best is trial 83 with value: 0.25341080998178517.
[I 2025-12-06 06:33:27,665] Trial 84 finished with value: 0.24361722257651536 and parameters: {'model_type': 'mlp', 'hidden_dims': '[512, 64]', 'dropout': 0.1618568315279631, 'batch_norm': True, 'lr': 2.993565060488601e-05, 'weight_decay': 3.220825490633205e-07, 'epochs': 220, 'loss': 'mae', 'optimizer': 'adam', 'graph_mode': 'off', 'use_snp_selection': False}. Best is trial 83 with value: 0.25341080998178517.
[I 2025-12-06 06:35:06,318] Trial 85 finished with value: 0.2526210907333825 and parameters: {'model_type': 'mlp', 'hidden_dims': '[512, 64]', 'dropout': 0.20684763209811538, 'batch_norm': True, 'lr': 2.5540632168239922e-05, 'weight_decay': 1.4546402402346697e-06, 'epochs': 329, 'loss': 'mae', 'optimizer': 'adam', 'graph_mode': 'off', 'use_snp_selection': False}. Best is trial 83 with value: 0.25341080998178517.
[I 2025-12-06 06:36:44,487] Trial 86 finished with value: 0.2333594363891668 and parameters: {'model_type': 'mlp', 'hidden_dims': '[512, 64]', 'dropout': 0.205395763096704, 'batch_norm': False, 'lr': 1.8004409824088913e-05, 'weight_decay': 5.456056974253127e-07, 'epochs': 332, 'loss': 'mae', 'optimizer': 'adam', 'graph_mode': 'off', 'use_snp_selection': False}. Best is trial 83 with value: 0.25341080998178517.
[I 2025-12-06 06:38:20,334] Trial 87 finished with value: 0.23207788847711064 and parameters: {'model_type': 'mlp', 'hidden_dims': '[512, 64]', 'dropout': 0.23284187786600818, 'batch_norm': True, 'lr': 8.742487298725755e-06, 'weight_decay': 8.662910205693889e-07, 'epochs': 319, 'loss': 'mae', 'optimizer': 'adam', 'graph_mode': 'off', 'use_snp_selection': False}. Best is trial 83 with value: 0.25341080998178517.
[I 2025-12-06 06:40:02,241] Trial 88 finished with value: 0.23765482978151237 and parameters: {'model_type': 'mlp', 'hidden_dims': '[512, 64]', 'dropout': 0.25191331755325663, 'batch_norm': True, 'lr': 2.5284291577087318e-05, 'weight_decay': 1.514132510505607e-06, 'epochs': 341, 'loss': 'mse', 'optimizer': 'adam', 'graph_mode': 'off', 'use_snp_selection': False}. Best is trial 83 with value: 0.25341080998178517.
[I 2025-12-06 06:41:26,046] Trial 89 finished with value: 0.2353204253901926 and parameters: {'model_type': 'mlp', 'hidden_dims': '[512, 64]', 'dropout': 0.2693406572294442, 'batch_norm': True, 'lr': 4.074739022365053e-05, 'weight_decay': 8.512634581889662e-07, 'epochs': 205, 'loss': 'mae', 'optimizer': 'adam', 'graph_mode': 'off', 'use_snp_selection': True, 'num_snps': 45058}. Best is trial 83 with value: 0.25341080998178517.
[I 2025-12-06 06:42:58,567] Trial 90 finished with value: 0.24895793159230228 and parameters: {'model_type': 'mlp', 'hidden_dims': '[512, 64]', 'dropout': 0.1812608625598613, 'batch_norm': True, 'lr': 5.207319908474187e-05, 'weight_decay': 4.488019059021976e-07, 'epochs': 309, 'loss': 'mae', 'optimizer': 'adam', 'graph_mode': 'off', 'use_snp_selection': False}. Best is trial 83 with value: 0.25341080998178517.
[I 2025-12-06 06:44:30,979] Trial 91 finished with value: 0.24926116944093218 and parameters: {'model_type': 'mlp', 'hidden_dims': '[512, 64]', 'dropout': 0.17573604322816858, 'batch_norm': True, 'lr': 5.0395514234985256e-05, 'weight_decay': 2.528449602328972e-07, 'epochs': 306, 'loss': 'mae', 'optimizer': 'adam', 'graph_mode': 'off', 'use_snp_selection': False}. Best is trial 83 with value: 0.25341080998178517.
[I 2025-12-06 06:46:15,629] Trial 92 finished with value: 0.24488320540284106 and parameters: {'model_type': 'mlp', 'hidden_dims': '[512, 64]', 'dropout': 0.17962801559165611, 'batch_norm': True, 'lr': 5.994930216147578e-05, 'weight_decay': 1.9256973182734667e-07, 'epochs': 350, 'loss': 'mae', 'optimizer': 'adam', 'graph_mode': 'off', 'use_snp_selection': False}. Best is trial 83 with value: 0.25341080998178517.
[I 2025-12-06 06:47:47,014] Trial 93 finished with value: 0.24506338967927527 and parameters: {'model_type': 'mlp', 'hidden_dims': '[512, 64]', 'dropout': 0.1947237853391841, 'batch_norm': True, 'lr': 4.8128914260855246e-05, 'weight_decay': 4.3646758101038193e-07, 'epochs': 303, 'loss': 'mae', 'optimizer': 'adam', 'graph_mode': 'off', 'use_snp_selection': False}. Best is trial 83 with value: 0.25341080998178517.
[I 2025-12-06 06:49:20,631] Trial 94 finished with value: 0.23200647313723183 and parameters: {'model_type': 'mlp', 'hidden_dims': '[512, 64]', 'dropout': 0.21601495342707022, 'batch_norm': True, 'lr': 3.116096373262808e-05, 'weight_decay': 2.6925513296224514e-07, 'epochs': 311, 'loss': 'mae', 'optimizer': 'adam', 'graph_mode': 'off', 'use_snp_selection': False}. Best is trial 83 with value: 0.25341080998178517.
[I 2025-12-06 06:50:59,404] Trial 95 finished with value: 0.2397067684762796 and parameters: {'model_type': 'mlp', 'hidden_dims': '[512, 64]', 'dropout': 0.18886015479318324, 'batch_norm': True, 'lr': 8.174753071373542e-05, 'weight_decay': 6.762933285593728e-07, 'epochs': 329, 'loss': 'mae', 'optimizer': 'adam', 'graph_mode': 'off', 'use_snp_selection': False}. Best is trial 83 with value: 0.25341080998178517.
[I 2025-12-06 06:52:36,159] Trial 96 finished with value: 0.24251289567512035 and parameters: {'model_type': 'mlp', 'hidden_dims': '[512, 64]', 'dropout': 0.22737067298473707, 'batch_norm': True, 'lr': 1.5551649985960977e-05, 'weight_decay': 1.6684369273912572e-07, 'epochs': 322, 'loss': 'mae', 'optimizer': 'adam', 'graph_mode': 'off', 'use_snp_selection': False}. Best is trial 83 with value: 0.25341080998178517.
[I 2025-12-06 06:54:09,622] Trial 97 finished with value: 0.24509997276355677 and parameters: {'model_type': 'mlp', 'hidden_dims': '[512, 64]', 'dropout': 0.23894529735865122, 'batch_norm': True, 'lr': 5.212108390528372e-05, 'weight_decay': 4.3997168902385105e-07, 'epochs': 310, 'loss': 'mae', 'optimizer': 'adam', 'graph_mode': 'off', 'use_snp_selection': False}. Best is trial 83 with value: 0.25341080998178517.
[I 2025-12-06 06:55:38,793] Trial 98 finished with value: 0.23766947813770872 and parameters: {'model_type': 'mlp', 'hidden_dims': '[512, 128]', 'dropout': 0.20446480973804174, 'batch_norm': True, 'lr': 7.056212600552704e-05, 'weight_decay': 1.2816667328382098e-06, 'epochs': 294, 'loss': 'mae', 'optimizer': 'adam', 'graph_mode': 'off', 'use_snp_selection': False}. Best is trial 83 with value: 0.25341080998178517.
[I 2025-12-06 06:56:17,022] Trial 99 finished with value: 0.23664169926335474 and parameters: {'model_type': 'mlp', 'hidden_dims': '[512, 64]', 'dropout': 0.17562025334692924, 'batch_norm': False, 'lr': 2.267733925712356e-05, 'weight_decay': 1.0019119629446712e-07, 'epochs': 113, 'loss': 'mae', 'optimizer': 'adam', 'graph_mode': 'off', 'use_snp_selection': False}. Best is trial 83 with value: 0.25341080998178517.
[I 2025-12-06 06:56:27,615] Trial 100 finished with value: 0.23495533233603116 and parameters: {'model_type': 'mlp', 'hidden_dims': '[128, 64]', 'dropout': 0.16642419301116612, 'batch_norm': True, 'lr': 3.837716476532589e-05, 'weight_decay': 1.7307996473854045e-06, 'epochs': 64, 'loss': 'mae', 'optimizer': 'adam', 'graph_mode': 'off', 'use_snp_selection': False}. Best is trial 83 with value: 0.25341080998178517.
[I 2025-12-06 06:56:57,473] Trial 101 finished with value: 0.23834680525126123 and parameters: {'model_type': 'mlp', 'hidden_dims': '[256, 128]', 'dropout': 0.15182358564061882, 'batch_norm': True, 'lr': 2.7404899100608286e-05, 'weight_decay': 3.39304743662027e-07, 'epochs': 165, 'loss': 'mae', 'optimizer': 'adam', 'graph_mode': 'off', 'use_snp_selection': False}. Best is trial 83 with value: 0.25341080998178517.
[I 2025-12-06 06:58:27,647] Trial 102 finished with value: 0.2416387599675192 and parameters: {'model_type': 'mlp', 'hidden_dims': '[512, 64]', 'dropout': 0.34982627909265185, 'batch_norm': True, 'lr': 4.7690575388181e-05, 'weight_decay': 3.654149104361309e-06, 'epochs': 299, 'loss': 'mae', 'optimizer': 'adam', 'graph_mode': 'off', 'use_snp_selection': False}. Best is trial 83 with value: 0.25341080998178517.
[I 2025-12-06 07:00:02,545] Trial 103 finished with value: 0.23678602082484096 and parameters: {'model_type': 'mlp', 'hidden_dims': '[512, 128]', 'dropout': 0.14317955798921414, 'batch_norm': True, 'lr': 2.2770662986754947e-05, 'weight_decay': 2.629642683782497e-07, 'epochs': 315, 'loss': 'mae', 'optimizer': 'adam', 'graph_mode': 'off', 'use_snp_selection': False}. Best is trial 83 with value: 0.25341080998178517.
[I 2025-12-06 07:00:29,934] Trial 104 finished with value: 0.23291878301632246 and parameters: {'model_type': 'mlp', 'hidden_dims': '[256, 128, 64]', 'dropout': 0.17979069629758784, 'batch_norm': True, 'lr': 3.458122102339389e-05, 'weight_decay': 1.0570734022611226e-06, 'epochs': 146, 'loss': 'mae', 'optimizer': 'adam', 'graph_mode': 'off', 'use_snp_selection': False}. Best is trial 83 with value: 0.25341080998178517.
[I 2025-12-06 07:01:40,409] Trial 105 finished with value: 0.2375965027763225 and parameters: {'model_type': 'mlp', 'hidden_dims': '[512, 64]', 'dropout': 0.16093566686499142, 'batch_norm': True, 'lr': 1.252878544194624e-05, 'weight_decay': 7.29486963215303e-07, 'epochs': 228, 'loss': 'mae', 'optimizer': 'adam', 'graph_mode': 'off', 'use_snp_selection': False}. Best is trial 83 with value: 0.25341080998178517.
[I 2025-12-06 07:02:33,332] Trial 106 finished with value: 0.24301036372935442 and parameters: {'model_type': 'mlp', 'hidden_dims': '[256, 128]', 'dropout': 0.19359206294222256, 'batch_norm': True, 'lr': 0.00010199026426840445, 'weight_decay': 5.283609398776022e-07, 'epochs': 326, 'loss': 'mae', 'optimizer': 'adam', 'graph_mode': 'off', 'use_snp_selection': False}. Best is trial 83 with value: 0.25341080998178517.
[I 2025-12-06 07:03:35,551] Trial 107 finished with value: 0.24241811065589478 and parameters: {'model_type': 'mlp', 'hidden_dims': '[512, 64]', 'dropout': 0.22433273833086295, 'batch_norm': True, 'lr': 2.8119011832778714e-05, 'weight_decay': 1.4556377581506192e-07, 'epochs': 198, 'loss': 'mse', 'optimizer': 'adam', 'graph_mode': 'off', 'use_snp_selection': False}. Best is trial 83 with value: 0.25341080998178517.
[I 2025-12-06 07:04:21,408] Trial 108 finished with value: 0.20677515107805902 and parameters: {'model_type': 'mlp', 'hidden_dims': '[512, 64]', 'dropout': 0.11330955549307857, 'batch_norm': True, 'lr': 6.456809211139224e-05, 'weight_decay': 2.0062671428386386e-06, 'epochs': 273, 'loss': 'mae', 'optimizer': 'adam', 'graph_mode': 'off', 'use_snp_selection': True, 'num_snps': 11322}. Best is trial 83 with value: 0.25341080998178517.
[I 2025-12-06 07:06:03,590] Trial 109 finished with value: 0.24803281652188786 and parameters: {'model_type': 'mlp', 'hidden_dims': '[512, 128]', 'dropout': 0.21104453746205798, 'batch_norm': True, 'lr': 4.384227579156455e-05, 'weight_decay': 6.434784080232778e-06, 'epochs': 343, 'loss': 'mae', 'optimizer': 'adam', 'graph_mode': 'off', 'use_snp_selection': False}. Best is trial 83 with value: 0.25341080998178517.
[I 2025-12-06 07:06:31,542] Trial 110 finished with value: 0.2338048383629431 and parameters: {'model_type': 'mlp', 'hidden_dims': '[128, 64]', 'dropout': 0.1702223342787086, 'batch_norm': True, 'lr': 0.0005147526552314268, 'weight_decay': 3.998093439928836e-06, 'epochs': 303, 'loss': 'mae', 'optimizer': 'adam', 'graph_mode': 'off', 'use_snp_selection': False}. Best is trial 83 with value: 0.25341080998178517.
[I 2025-12-06 07:07:58,175] Trial 111 finished with value: 0.2554084311044038 and parameters: {'model_type': 'mlp', 'hidden_dims': '[512, 64]', 'dropout': 0.15598381241267026, 'batch_norm': True, 'lr': 7.991616019015373e-05, 'weight_decay': 2.3713801846265223e-06, 'epochs': 286, 'loss': 'mae', 'optimizer': 'adam', 'graph_mode': 'off', 'use_snp_selection': False}. Best is trial 111 with value: 0.2554084311044038.
[I 2025-12-06 07:09:27,111] Trial 112 finished with value: 0.248483545312686 and parameters: {'model_type': 'mlp', 'hidden_dims': '[512, 64]', 'dropout': 0.13440314573625622, 'batch_norm': True, 'lr': 3.927573805764218e-05, 'weight_decay': 1.0825010619401418e-05, 'epochs': 294, 'loss': 'mae', 'optimizer': 'adam', 'graph_mode': 'off', 'use_snp_selection': False}. Best is trial 111 with value: 0.2554084311044038.
[I 2025-12-06 07:10:59,397] Trial 113 finished with value: 0.24382553020323092 and parameters: {'model_type': 'mlp', 'hidden_dims': '[512, 64]', 'dropout': 0.1519285055778859, 'batch_norm': True, 'lr': 8.077859061024451e-05, 'weight_decay': 1.5731606773727976e-06, 'epochs': 307, 'loss': 'mae', 'optimizer': 'adam', 'graph_mode': 'off', 'use_snp_selection': False}. Best is trial 111 with value: 0.2554084311044038.
[I 2025-12-06 07:12:20,538] Trial 114 finished with value: 0.24605056148110016 and parameters: {'model_type': 'mlp', 'hidden_dims': '[512, 64]', 'dropout': 0.18721804308219112, 'batch_norm': True, 'lr': 5.905957564574241e-05, 'weight_decay': 1.4817463634776442e-05, 'epochs': 267, 'loss': 'mae', 'optimizer': 'adam', 'graph_mode': 'off', 'use_snp_selection': False}. Best is trial 111 with value: 0.2554084311044038.
[I 2025-12-06 07:14:00,375] Trial 115 finished with value: 0.23787480889304408 and parameters: {'model_type': 'mlp', 'hidden_dims': '[512, 64]', 'dropout': 0.14561958139837605, 'batch_norm': True, 'lr': 1.6308750309793155e-05, 'weight_decay': 5.421043641041018e-06, 'epochs': 335, 'loss': 'mae', 'optimizer': 'adam', 'graph_mode': 'off', 'use_snp_selection': False}. Best is trial 111 with value: 0.2554084311044038.
[I 2025-12-06 07:14:46,489] Trial 116 finished with value: 0.23580457389439405 and parameters: {'model_type': 'mlp', 'hidden_dims': '[256, 128]', 'dropout': 0.16383660450550727, 'batch_norm': True, 'lr': 3.43082271647828e-05, 'weight_decay': 3.0120767545419995e-06, 'epochs': 278, 'loss': 'mae', 'optimizer': 'adam', 'graph_mode': 'off', 'use_snp_selection': False}. Best is trial 111 with value: 0.2554084311044038.
[I 2025-12-06 07:15:51,243] Trial 117 finished with value: 0.2379416012218835 and parameters: {'model_type': 'mlp', 'hidden_dims': '[512, 64]', 'dropout': 0.12535629780396312, 'batch_norm': True, 'lr': 2.32879778230517e-05, 'weight_decay': 1.0242575759757712e-06, 'epochs': 207, 'loss': 'mae', 'optimizer': 'adam', 'graph_mode': 'off', 'use_snp_selection': False}. Best is trial 111 with value: 0.2554084311044038.
[I 2025-12-06 07:16:37,868] Trial 118 finished with value: 0.2338393564860028 and parameters: {'model_type': 'mlp', 'hidden_dims': '[256, 128, 64]', 'dropout': 0.20184116074518244, 'batch_norm': False, 'lr': 5.2904301377181004e-05, 'weight_decay': 2.2635803211823403e-06, 'epochs': 287, 'loss': 'mae', 'optimizer': 'adam', 'graph_mode': 'off', 'use_snp_selection': False}. Best is trial 111 with value: 0.2554084311044038.
[I 2025-12-06 07:18:12,437] Trial 119 finished with value: 0.23588723470115328 and parameters: {'model_type': 'mlp', 'hidden_dims': '[512, 64]', 'dropout': 0.5990127129355303, 'batch_norm': True, 'lr': 7.346291881018746e-05, 'weight_decay': 2.183896812225129e-05, 'epochs': 315, 'loss': 'mae', 'optimizer': 'adam', 'graph_mode': 'off', 'use_snp_selection': False}. Best is trial 111 with value: 0.2554084311044038.
[I 2025-12-06 07:19:26,044] Trial 120 finished with value: 0.24320506958799787 and parameters: {'model_type': 'mlp', 'hidden_dims': '[512, 128]', 'dropout': 0.17753664775989417, 'batch_norm': True, 'lr': 0.0003483646631909143, 'weight_decay': 1.3321336869436707e-06, 'epochs': 239, 'loss': 'mae', 'optimizer': 'adam', 'graph_mode': 'off', 'use_snp_selection': False}. Best is trial 111 with value: 0.2554084311044038.
[I 2025-12-06 07:20:55,072] Trial 121 finished with value: 0.2390586939955662 and parameters: {'model_type': 'mlp', 'hidden_dims': '[512, 64]', 'dropout': 0.1589514008153934, 'batch_norm': True, 'lr': 0.00012109287495848256, 'weight_decay': 2.806029957178761e-06, 'epochs': 295, 'loss': 'mae', 'optimizer': 'adam', 'graph_mode': 'off', 'use_snp_selection': False}. Best is trial 111 with value: 0.2554084311044038.
[I 2025-12-06 07:22:20,207] Trial 122 finished with value: 0.24373400495188413 and parameters: {'model_type': 'mlp', 'hidden_dims': '[512, 64]', 'dropout': 0.15419590813923095, 'batch_norm': True, 'lr': 0.00014835961994988964, 'weight_decay': 3.448300569112362e-06, 'epochs': 281, 'loss': 'mae', 'optimizer': 'adam', 'graph_mode': 'off', 'use_snp_selection': False}. Best is trial 111 with value: 0.2554084311044038.
[I 2025-12-06 07:23:47,603] Trial 123 finished with value: 0.24199598187340876 and parameters: {'model_type': 'mlp', 'hidden_dims': '[512, 64]', 'dropout': 0.13779576552021794, 'batch_norm': True, 'lr': 0.0004165389214175758, 'weight_decay': 1.8753370312493382e-06, 'epochs': 289, 'loss': 'mae', 'optimizer': 'adam', 'graph_mode': 'off', 'use_snp_selection': False}. Best is trial 111 with value: 0.2554084311044038.
[I 2025-12-06 07:24:55,270] Trial 124 finished with value: 0.25378102130300134 and parameters: {'model_type': 'mlp', 'hidden_dims': '[512, 64]', 'dropout': 0.18540640001150832, 'batch_norm': True, 'lr': 4.566796488630593e-05, 'weight_decay': 4.766660439562183e-06, 'epochs': 218, 'loss': 'mae', 'optimizer': 'adam', 'graph_mode': 'off', 'use_snp_selection': False}. Best is trial 111 with value: 0.2554084311044038.
[I 2025-12-06 07:26:02,990] Trial 125 finished with value: 0.2473101862330728 and parameters: {'model_type': 'mlp', 'hidden_dims': '[512, 256]', 'dropout': 0.18493936038147257, 'batch_norm': True, 'lr': 4.534462228608388e-05, 'weight_decay': 4.808229649730403e-06, 'epochs': 217, 'loss': 'mae', 'optimizer': 'adam', 'graph_mode': 'off', 'use_snp_selection': False}. Best is trial 111 with value: 0.2554084311044038.
[I 2025-12-06 07:27:12,592] Trial 126 finished with value: 0.2325542484271963 and parameters: {'model_type': 'mlp', 'hidden_dims': '[512, 64]', 'dropout': 0.493794502328217, 'batch_norm': True, 'lr': 3.112717611530533e-05, 'weight_decay': 8.493085865253973e-06, 'epochs': 225, 'loss': 'mse', 'optimizer': 'adam', 'graph_mode': 'off', 'use_snp_selection': False}. Best is trial 111 with value: 0.2554084311044038.
[I 2025-12-06 07:28:10,039] Trial 127 finished with value: 0.23322083088610931 and parameters: {'model_type': 'mlp', 'hidden_dims': '[512, 64]', 'dropout': 0.19739911943470953, 'batch_norm': True, 'lr': 2.108711130315317e-05, 'weight_decay': 3.069055498013359e-05, 'epochs': 181, 'loss': 'mae', 'optimizer': 'adam', 'graph_mode': 'off', 'use_snp_selection': False}. Best is trial 111 with value: 0.2554084311044038.
[I 2025-12-06 07:29:38,432] Trial 128 finished with value: 0.2279575907486011 and parameters: {'model_type': 'mlp', 'hidden_dims': '[512, 256]', 'dropout': 0.10925317514652645, 'batch_norm': True, 'lr': 2.761940687916302e-05, 'weight_decay': 4.394640602454011e-06, 'epochs': 189, 'loss': 'mae', 'optimizer': 'adam', 'graph_mode': 'off', 'use_snp_selection': True, 'num_snps': 51726}. Best is trial 111 with value: 0.2554084311044038.
[I 2025-12-06 07:30:14,840] Trial 129 finished with value: 0.23820326551470833 and parameters: {'model_type': 'mlp', 'hidden_dims': '[256, 128]', 'dropout': 0.17076690136110076, 'batch_norm': True, 'lr': 0.0006365530427472936, 'weight_decay': 6.409454684837749e-06, 'epochs': 213, 'loss': 'mae', 'optimizer': 'adam', 'graph_mode': 'off', 'use_snp_selection': False}. Best is trial 111 with value: 0.2554084311044038.
[I 2025-12-06 07:31:27,449] Trial 130 finished with value: 0.24069378046072507 and parameters: {'model_type': 'mlp', 'hidden_dims': '[512, 64]', 'dropout': 0.18805417430153354, 'batch_norm': True, 'lr': 3.9157427049348335e-05, 'weight_decay': 1.7459866500601516e-05, 'epochs': 236, 'loss': 'mae', 'optimizer': 'adam', 'graph_mode': 'off', 'use_snp_selection': False}. Best is trial 111 with value: 0.2554084311044038.
[I 2025-12-06 07:33:03,071] Trial 131 finished with value: 0.24886206312938638 and parameters: {'model_type': 'mlp', 'hidden_dims': '[512, 64]', 'dropout': 0.15842408935768856, 'batch_norm': True, 'lr': 5.3073474992339445e-05, 'weight_decay': 3.184299162683802e-06, 'epochs': 318, 'loss': 'mae', 'optimizer': 'adam', 'graph_mode': 'off', 'use_snp_selection': False}. Best is trial 111 with value: 0.2554084311044038.
[I 2025-12-06 07:34:38,801] Trial 132 finished with value: 0.24720425056400153 and parameters: {'model_type': 'mlp', 'hidden_dims': '[512, 64]', 'dropout': 0.17613696687574978, 'batch_norm': True, 'lr': 5.5584222971653295e-05, 'weight_decay': 9.93342501298411e-06, 'epochs': 319, 'loss': 'mae', 'optimizer': 'adam', 'graph_mode': 'off', 'use_snp_selection': False}. Best is trial 111 with value: 0.2554084311044038.
[I 2025-12-06 07:36:16,971] Trial 133 finished with value: 0.24404885312887176 and parameters: {'model_type': 'mlp', 'hidden_dims': '[512, 64]', 'dropout': 0.21174895470112712, 'batch_norm': True, 'lr': 6.978490987040666e-05, 'weight_decay': 3.4936141331403227e-06, 'epochs': 328, 'loss': 'mae', 'optimizer': 'adam', 'graph_mode': 'off', 'use_snp_selection': False}. Best is trial 111 with value: 0.2554084311044038.
[I 2025-12-06 07:37:47,657] Trial 134 finished with value: 0.2558381167454596 and parameters: {'model_type': 'mlp', 'hidden_dims': '[512, 64]', 'dropout': 0.14418675848666226, 'batch_norm': True, 'lr': 4.2183115388474145e-05, 'weight_decay': 2.1713968539861102e-06, 'epochs': 301, 'loss': 'mae', 'optimizer': 'adam', 'graph_mode': 'off', 'use_snp_selection': False}. Best is trial 134 with value: 0.2558381167454596.
