[I 2025-12-05 18:53:42,486] Trial 105 finished with value: 0.31184505155685416 and parameters: {'model_type': 'mlp', 'hidden_dims': '[512, 128]', 'dropout': 0.37073593893027296, 'batch_norm': False, 'lr': 2.7723619802659206e-06, 'weight_decay': 1.5636213166876404e-05, 'epochs': 244, 'loss': 'mse', 'optimizer': 'adam', 'graph_mode': 'off', 'use_snp_selection': True, 'num_snps': 59797}. Best is trial 95 with value: 0.3172677545951165.
[I 2025-12-05 18:54:56,943] Trial 106 finished with value: 0.3158091631075055 and parameters: {'model_type': 'mlp', 'hidden_dims': '[512, 128]', 'dropout': 0.21436809358308795, 'batch_norm': False, 'lr': 2.073183262311674e-06, 'weight_decay': 2.2326944809277167e-05, 'epochs': 287, 'loss': 'mse', 'optimizer': 'adam', 'graph_mode': 'off', 'use_snp_selection': True, 'num_snps': 49165}. Best is trial 95 with value: 0.3172677545951165.
[I 2025-12-05 18:56:01,577] Trial 107 finished with value: 0.28447108862104703 and parameters: {'model_type': 'mlp', 'hidden_dims': '[512, 128]', 'dropout': 0.22161827258621922, 'batch_norm': True, 'lr': 2.1343229506583154e-06, 'weight_decay': 2.2893560879867913e-05, 'epochs': 214, 'loss': 'mse', 'optimizer': 'adam', 'graph_mode': 'off', 'use_snp_selection': True, 'num_snps': 48959}. Best is trial 95 with value: 0.3172677545951165.
[I 2025-12-05 18:57:21,371] Trial 108 finished with value: 0.31083564404122155 and parameters: {'model_type': 'mlp', 'hidden_dims': '[512, 128]', 'dropout': 0.16009519442718534, 'batch_norm': False, 'lr': 1.18804777771704e-06, 'weight_decay': 2.043542066327455e-05, 'epochs': 285, 'loss': 'mse', 'optimizer': 'adam', 'graph_mode': 'off', 'use_snp_selection': True, 'num_snps': 54610}. Best is trial 95 with value: 0.3172677545951165.
[I 2025-12-05 18:58:28,385] Trial 109 finished with value: 0.31244444767511775 and parameters: {'model_type': 'mlp', 'hidden_dims': '[512, 128]', 'dropout': 0.1720687558043239, 'batch_norm': False, 'lr': 3.303711413690749e-06, 'weight_decay': 3.5378366438999545e-05, 'epochs': 276, 'loss': 'mse', 'optimizer': 'adam', 'graph_mode': 'off', 'use_snp_selection': True, 'num_snps': 43492}. Best is trial 95 with value: 0.3172677545951165.
[I 2025-12-05 18:59:21,115] Trial 110 finished with value: 0.3158493867359701 and parameters: {'model_type': 'mlp', 'hidden_dims': '[512, 128]', 'dropout': 0.19647596726626904, 'batch_norm': False, 'lr': 4.115684901465469e-06, 'weight_decay': 7.479909397969775e-05, 'epochs': 147, 'loss': 'mse', 'optimizer': 'adam', 'graph_mode': 'off', 'use_snp_selection': True, 'num_snps': 45041}. Best is trial 95 with value: 0.3172677545951165.
[I 2025-12-05 19:00:15,291] Trial 111 finished with value: 0.30968815215195783 and parameters: {'model_type': 'mlp', 'hidden_dims': '[512, 128]', 'dropout': 0.19494799737229673, 'batch_norm': False, 'lr': 2.6877274113695826e-06, 'weight_decay': 4.184798087311862e-05, 'epochs': 154, 'loss': 'mse', 'optimizer': 'adam', 'graph_mode': 'off', 'use_snp_selection': True, 'num_snps': 46336}. Best is trial 95 with value: 0.3172677545951165.
[I 2025-12-05 19:01:17,877] Trial 112 finished with value: 0.3114945313894987 and parameters: {'model_type': 'mlp', 'hidden_dims': '[512, 128]', 'dropout': 0.3216416238135086, 'batch_norm': False, 'lr': 4.3074903994562605e-06, 'weight_decay': 3.0836468782463654e-05, 'epochs': 190, 'loss': 'mse', 'optimizer': 'adam', 'graph_mode': 'off', 'use_snp_selection': True, 'num_snps': 50793}. Best is trial 95 with value: 0.3172677545951165.
[I 2025-12-05 19:01:57,305] Trial 113 finished with value: 0.2932900134804725 and parameters: {'model_type': 'mlp', 'hidden_dims': '[256, 128, 64]', 'dropout': 0.19614295205268129, 'batch_norm': False, 'lr': 3.7064319469038924e-06, 'weight_decay': 8.703628858372475e-05, 'epochs': 128, 'loss': 'mse', 'optimizer': 'adam', 'graph_mode': 'off', 'use_snp_selection': True, 'num_snps': 39141}. Best is trial 95 with value: 0.3172677545951165.
[I 2025-12-05 19:02:49,009] Trial 114 finished with value: 0.3012018214193635 and parameters: {'model_type': 'mlp', 'hidden_dims': '[512, 128]', 'dropout': 0.22852975833511083, 'batch_norm': False, 'lr': 2.0599810717663092e-06, 'weight_decay': 1.4388091427566549e-05, 'epochs': 144, 'loss': 'mse', 'optimizer': 'adam', 'graph_mode': 'off', 'use_snp_selection': True, 'num_snps': 44554}. Best is trial 95 with value: 0.3172677545951165.
[I 2025-12-05 19:03:43,034] Trial 115 finished with value: 0.3129708751532209 and parameters: {'model_type': 'mlp', 'hidden_dims': '[512, 128]', 'dropout': 0.2981258140574278, 'batch_norm': False, 'lr': 5.365596678906877e-06, 'weight_decay': 1.1950990336551278e-05, 'epochs': 112, 'loss': 'mse', 'optimizer': 'adam', 'graph_mode': 'off', 'use_snp_selection': True, 'num_snps': 54949}. Best is trial 95 with value: 0.3172677545951165.
[I 2025-12-05 19:04:59,043] Trial 116 finished with value: 0.3143897480497204 and parameters: {'model_type': 'mlp', 'hidden_dims': '[512, 256]', 'dropout': 0.3516057239100423, 'batch_norm': False, 'lr': 1.7225498089722842e-06, 'weight_decay': 2.3005688257753843e-05, 'epochs': 292, 'loss': 'mse', 'optimizer': 'adam', 'graph_mode': 'off', 'use_snp_selection': True, 'num_snps': 49811}. Best is trial 95 with value: 0.3172677545951165.
[I 2025-12-05 19:06:15,908] Trial 117 finished with value: 0.3049739142549555 and parameters: {'model_type': 'mlp', 'hidden_dims': '[512, 128]', 'dropout': 0.18183693840489687, 'batch_norm': False, 'lr': 4.041484600202839e-06, 'weight_decay': 6.718098740958953e-05, 'epochs': 269, 'loss': 'mse', 'optimizer': 'adam', 'graph_mode': 'off', 'use_snp_selection': True, 'num_snps': 54076}. Best is trial 95 with value: 0.3172677545951165.
[I 2025-12-05 19:07:15,924] Trial 118 finished with value: 0.3129377551486495 and parameters: {'model_type': 'mlp', 'hidden_dims': '[512, 128]', 'dropout': 0.25717179354613634, 'batch_norm': False, 'lr': 2.785376925849849e-06, 'weight_decay': 6.552870436058261e-06, 'epochs': 254, 'loss': 'mse', 'optimizer': 'adam', 'graph_mode': 'off', 'use_snp_selection': True, 'num_snps': 39437}. Best is trial 95 with value: 0.3172677545951165.
[I 2025-12-05 19:08:41,447] Trial 119 finished with value: 0.3091252533766199 and parameters: {'model_type': 'mlp', 'hidden_dims': '[512, 64]', 'dropout': 0.3950787561849293, 'batch_norm': False, 'lr': 4.81768930035636e-06, 'weight_decay': 5.0523939705937884e-05, 'epochs': 300, 'loss': 'mse', 'optimizer': 'adam', 'graph_mode': 'off', 'use_snp_selection': True, 'num_snps': 57714}. Best is trial 95 with value: 0.3172677545951165.
[I 2025-12-05 19:09:15,868] Trial 120 finished with value: 0.29827493201842425 and parameters: {'model_type': 'mlp', 'hidden_dims': '[512, 128]', 'dropout': 0.2115772959527425, 'batch_norm': False, 'lr': 5.820921283045161e-06, 'weight_decay': 0.0005924416864671649, 'epochs': 72, 'loss': 'mse', 'optimizer': 'adam', 'graph_mode': 'off', 'use_snp_selection': True, 'num_snps': 27556}. Best is trial 95 with value: 0.3172677545951165.
[I 2025-12-05 19:10:31,074] Trial 121 finished with value: 0.31352112391378795 and parameters: {'model_type': 'mlp', 'hidden_dims': '[512, 256]', 'dropout': 0.3567469301371139, 'batch_norm': False, 'lr': 1.6969614348385729e-06, 'weight_decay': 2.271600032196571e-05, 'epochs': 291, 'loss': 'mse', 'optimizer': 'adam', 'graph_mode': 'off', 'use_snp_selection': True, 'num_snps': 49384}. Best is trial 95 with value: 0.3172677545951165.
[I 2025-12-05 19:11:39,808] Trial 122 finished with value: 0.31426888056258623 and parameters: {'model_type': 'mlp', 'hidden_dims': '[512, 256]', 'dropout': 0.34710837773318487, 'batch_norm': False, 'lr': 2.2710209031525884e-06, 'weight_decay': 1.7318028491610173e-05, 'epochs': 285, 'loss': 'mse', 'optimizer': 'adam', 'graph_mode': 'off', 'use_snp_selection': True, 'num_snps': 44083}. Best is trial 95 with value: 0.3172677545951165.
[I 2025-12-05 19:12:51,964] Trial 123 finished with value: 0.3035175419240515 and parameters: {'model_type': 'mlp', 'hidden_dims': '[512, 256]', 'dropout': 0.38121032255722553, 'batch_norm': False, 'lr': 1.456801456049896e-06, 'weight_decay': 2.633179178721824e-05, 'epochs': 264, 'loss': 'mse', 'optimizer': 'adam', 'graph_mode': 'off', 'use_snp_selection': True, 'num_snps': 49853}. Best is trial 95 with value: 0.3172677545951165.
[I 2025-12-05 19:14:06,364] Trial 124 finished with value: 0.3144481407861649 and parameters: {'model_type': 'mlp', 'hidden_dims': '[512, 256]', 'dropout': 0.3689312310014247, 'batch_norm': False, 'lr': 1.868196034766561e-06, 'weight_decay': 9.932152653439728e-06, 'epochs': 311, 'loss': 'mse', 'optimizer': 'adam', 'graph_mode': 'off', 'use_snp_selection': True, 'num_snps': 46097}. Best is trial 95 with value: 0.3172677545951165.
[I 2025-12-05 19:15:02,188] Trial 125 finished with value: 0.30505530727264285 and parameters: {'model_type': 'mlp', 'hidden_dims': '[512, 128]', 'dropout': 0.3720535349457885, 'batch_norm': False, 'lr': 3.2289382844579264e-06, 'weight_decay': 5.362323067177276e-06, 'epochs': 168, 'loss': 'mse', 'optimizer': 'adam', 'graph_mode': 'off', 'use_snp_selection': True, 'num_snps': 46162}. Best is trial 95 with value: 0.3172677545951165.
[I 2025-12-05 19:15:35,014] Trial 126 finished with value: 0.28644111336451833 and parameters: {'model_type': 'mlp', 'hidden_dims': '[512, 128]', 'dropout': 0.33153543475799907, 'batch_norm': False, 'lr': 1.843243098921494e-06, 'weight_decay': 9.728303068143665e-06, 'epochs': 329, 'loss': 'mse', 'optimizer': 'adam', 'graph_mode': 'off', 'use_snp_selection': True, 'num_snps': 9916}. Best is trial 95 with value: 0.3172677545951165.
[I 2025-12-05 19:16:58,541] Trial 127 finished with value: 0.27826632532739487 and parameters: {'model_type': 'mlp', 'hidden_dims': '[512, 128]', 'dropout': 0.1136238709712456, 'batch_norm': True, 'lr': 2.779944010692092e-06, 'weight_decay': 0.0001308411788625666, 'epochs': 319, 'loss': 'mse', 'optimizer': 'adam', 'graph_mode': 'off', 'use_snp_selection': True, 'num_snps': 53236}. Best is trial 95 with value: 0.3172677545951165.
[I 2025-12-05 19:18:25,361] Trial 128 finished with value: 0.30597904475439613 and parameters: {'model_type': 'mlp', 'hidden_dims': '[512, 128]', 'dropout': 0.3641070180186601, 'batch_norm': False, 'lr': 6.7454009387166395e-06, 'weight_decay': 1.5191156492608637e-05, 'epochs': 309, 'loss': 'mse', 'optimizer': 'adam', 'graph_mode': 'off', 'use_snp_selection': True, 'num_snps': 57833}. Best is trial 95 with value: 0.3172677545951165.
[I 2025-12-05 19:19:18,545] Trial 129 finished with value: 0.2875560061410251 and parameters: {'model_type': 'mlp', 'hidden_dims': '[256, 128, 64]', 'dropout': 0.43564694753624605, 'batch_norm': False, 'lr': 0.00030612026805933103, 'weight_decay': 4.907588928463664e-07, 'epochs': 300, 'loss': 'mse', 'optimizer': 'adam', 'graph_mode': 'off', 'use_snp_selection': True, 'num_snps': 45462}. Best is trial 95 with value: 0.3172677545951165.
[I 2025-12-05 19:20:27,103] Trial 130 finished with value: 0.31262859902235557 and parameters: {'model_type': 'mlp', 'hidden_dims': '[512, 256]', 'dropout': 0.39233315782371436, 'batch_norm': False, 'lr': 3.5600045867758277e-06, 'weight_decay': 1.096553136697753e-05, 'epochs': 314, 'loss': 'mse', 'optimizer': 'adam', 'graph_mode': 'off', 'use_snp_selection': True, 'num_snps': 41114}. Best is trial 95 with value: 0.3172677545951165.
[I 2025-12-05 19:21:42,205] Trial 131 finished with value: 0.313089056760141 and parameters: {'model_type': 'mlp', 'hidden_dims': '[512, 256]', 'dropout': 0.3512182236988821, 'batch_norm': False, 'lr': 1.6050561021225901e-06, 'weight_decay': 2.172094568686169e-05, 'epochs': 296, 'loss': 'mse', 'optimizer': 'adam', 'graph_mode': 'off', 'use_snp_selection': True, 'num_snps': 48519}. Best is trial 95 with value: 0.3172677545951165.
[I 2025-12-05 19:22:59,160] Trial 132 finished with value: 0.31416612073907385 and parameters: {'model_type': 'mlp', 'hidden_dims': '[512, 256]', 'dropout': 0.4138480124689088, 'batch_norm': False, 'lr': 1.968112367227829e-06, 'weight_decay': 4.092097054339845e-05, 'epochs': 280, 'loss': 'mse', 'optimizer': 'adam', 'graph_mode': 'off', 'use_snp_selection': True, 'num_snps': 52315}. Best is trial 95 with value: 0.3172677545951165.
[I 2025-12-05 19:24:22,532] Trial 133 finished with value: 0.3141140686107615 and parameters: {'model_type': 'mlp', 'hidden_dims': '[512, 256]', 'dropout': 0.3083286895789951, 'batch_norm': False, 'lr': 2.440099090009496e-06, 'weight_decay': 2.87202558106598e-05, 'epochs': 291, 'loss': 'mse', 'optimizer': 'adam', 'graph_mode': 'off', 'use_snp_selection': True, 'num_snps': 56743}. Best is trial 95 with value: 0.3172677545951165.
[I 2025-12-05 19:25:40,580] Trial 134 finished with value: 0.3142034868216396 and parameters: {'model_type': 'mlp', 'hidden_dims': '[512, 256]', 'dropout': 0.3611002550596854, 'batch_norm': False, 'lr': 2.137092692917042e-06, 'weight_decay': 1.876453705616167e-05, 'epochs': 304, 'loss': 'mse', 'optimizer': 'adam', 'graph_mode': 'off', 'use_snp_selection': True, 'num_snps': 50282}. Best is trial 95 with value: 0.3172677545951165.
[I 2025-12-05 19:26:34,856] Trial 135 finished with value: 0.3112756641021307 and parameters: {'model_type': 'mlp', 'hidden_dims': '[512, 128]', 'dropout': 0.3263678659795976, 'batch_norm': False, 'lr': 4.699161066586443e-06, 'weight_decay': 1.3484839388163212e-05, 'epochs': 234, 'loss': 'mse', 'optimizer': 'adam', 'graph_mode': 'off', 'use_snp_selection': True, 'num_snps': 35863}. Best is trial 95 with value: 0.3172677545951165.
[I 2025-12-05 19:27:50,901] Trial 136 finished with value: 0.3118206658214756 and parameters: {'model_type': 'mlp', 'hidden_dims': '[512, 128]', 'dropout': 0.23936190972157131, 'batch_norm': False, 'lr': 3.0958423234090207e-06, 'weight_decay': 3.4936745690958104e-05, 'epochs': 312, 'loss': 'mse', 'optimizer': 'adam', 'graph_mode': 'off', 'use_snp_selection': True, 'num_snps': 48070}. Best is trial 95 with value: 0.3172677545951165.
[I 2025-12-05 19:29:03,323] Trial 137 finished with value: 0.31639226021192524 and parameters: {'model_type': 'mlp', 'hidden_dims': '[512, 128]', 'dropout': 0.2774341111476563, 'batch_norm': False, 'lr': 2.4779529206816414e-06, 'weight_decay': 7.557464236824484e-06, 'epochs': 286, 'loss': 'mse', 'optimizer': 'adam', 'graph_mode': 'off', 'use_snp_selection': True, 'num_snps': 47798}. Best is trial 95 with value: 0.3172677545951165.
[I 2025-12-05 19:29:58,219] Trial 138 finished with value: 0.31175080681558826 and parameters: {'model_type': 'mlp', 'hidden_dims': '[512, 128]', 'dropout': 0.2786004713384426, 'batch_norm': False, 'lr': 2.5389891043384994e-06, 'weight_decay': 7.93588309227207e-06, 'epochs': 285, 'loss': 'mae', 'optimizer': 'adam', 'graph_mode': 'off', 'use_snp_selection': False}. Best is trial 95 with value: 0.3172677545951165.
[I 2025-12-05 19:31:00,020] Trial 139 finished with value: 0.3054445721547989 and parameters: {'model_type': 'mlp', 'hidden_dims': '[512, 128]', 'dropout': 0.2997720811205006, 'batch_norm': False, 'lr': 4.244066869784822e-06, 'weight_decay': 4.270199177462006e-06, 'epochs': 324, 'loss': 'mse', 'optimizer': 'adam', 'graph_mode': 'off', 'use_snp_selection': False}. Best is trial 95 with value: 0.3172677545951165.
[I 2025-12-05 19:32:05,839] Trial 140 finished with value: 0.2998400257357784 and parameters: {'model_type': 'mlp', 'hidden_dims': '[512, 128]', 'dropout': 0.28988032126698243, 'batch_norm': False, 'lr': 1.2145838517532013e-06, 'weight_decay': 6.822199762297486e-06, 'epochs': 275, 'loss': 'mae', 'optimizer': 'adam', 'graph_mode': 'off', 'use_snp_selection': True, 'num_snps': 42897}. Best is trial 95 with value: 0.3172677545951165.
[I 2025-12-05 19:33:19,570] Trial 141 finished with value: 0.3144842950200567 and parameters: {'model_type': 'mlp', 'hidden_dims': '[512, 128]', 'dropout': 0.3372585828063489, 'batch_norm': False, 'lr': 1.7819480364131306e-06, 'weight_decay': 1.2031024691426027e-05, 'epochs': 295, 'loss': 'mse', 'optimizer': 'adam', 'graph_mode': 'off', 'use_snp_selection': True, 'num_snps': 47804}. Best is trial 95 with value: 0.3172677545951165.
[I 2025-12-05 19:34:34,172] Trial 142 finished with value: 0.31102212577716354 and parameters: {'model_type': 'mlp', 'hidden_dims': '[512, 128]', 'dropout': 0.33406230797682873, 'batch_norm': False, 'lr': 2.925600551353315e-06, 'weight_decay': 1.1450960136674668e-05, 'epochs': 302, 'loss': 'mse', 'optimizer': 'adam', 'graph_mode': 'off', 'use_snp_selection': True, 'num_snps': 47723}. Best is trial 95 with value: 0.3172677545951165.
[I 2025-12-05 19:35:53,374] Trial 143 finished with value: 0.3115513511058633 and parameters: {'model_type': 'mlp', 'hidden_dims': '[512, 128]', 'dropout': 0.312892824834042, 'batch_norm': False, 'lr': 2.002392455659312e-06, 'weight_decay': 9.863325130732996e-06, 'epochs': 296, 'loss': 'mse', 'optimizer': 'adam', 'graph_mode': 'off', 'use_snp_selection': True, 'num_snps': 52656}. Best is trial 95 with value: 0.3172677545951165.
[I 2025-12-05 19:37:00,312] Trial 144 finished with value: 0.31073487421266643 and parameters: {'model_type': 'mlp', 'hidden_dims': '[512, 128]', 'dropout': 0.20954950906828126, 'batch_norm': False, 'lr': 2.3099084829175744e-06, 'weight_decay': 1.7281006704804893e-05, 'epochs': 261, 'loss': 'mse', 'optimizer': 'adam', 'graph_mode': 'off', 'use_snp_selection': True, 'num_snps': 45417}. Best is trial 95 with value: 0.3172677545951165.
[I 2025-12-05 19:38:17,820] Trial 145 finished with value: 0.3092857121032484 and parameters: {'model_type': 'mlp', 'hidden_dims': '[512, 128]', 'dropout': 0.26352251735738613, 'batch_norm': False, 'lr': 3.5395719888669048e-06, 'weight_decay': 8.394163242235079e-06, 'epochs': 285, 'loss': 'mse', 'optimizer': 'adam', 'graph_mode': 'off', 'use_snp_selection': True, 'num_snps': 52122}. Best is trial 95 with value: 0.3172677545951165.
[I 2025-12-05 19:39:11,052] Trial 146 finished with value: 0.31358806113883975 and parameters: {'model_type': 'mlp', 'hidden_dims': '[512, 64]', 'dropout': 0.33539944627520196, 'batch_norm': False, 'lr': 6.728615629277015e-06, 'weight_decay': 1.2639661053153003e-05, 'epochs': 276, 'loss': 'mae', 'optimizer': 'adam', 'graph_mode': 'off', 'use_snp_selection': False}. Best is trial 95 with value: 0.3172677545951165.
[I 2025-12-05 19:40:22,531] Trial 147 finished with value: 0.3047911645411633 and parameters: {'model_type': 'mlp', 'hidden_dims': '[512, 128]', 'dropout': 0.38393641224181313, 'batch_norm': False, 'lr': 1.3937844021204382e-06, 'weight_decay': 1.5349204888677027e-05, 'epochs': 217, 'loss': 'mse', 'optimizer': 'adam', 'graph_mode': 'off', 'use_snp_selection': True, 'num_snps': 56368}. Best is trial 95 with value: 0.3172677545951165.
[I 2025-12-05 19:41:23,136] Trial 148 finished with value: 0.3118804443713163 and parameters: {'model_type': 'mlp', 'hidden_dims': '[512, 128]', 'dropout': 0.3732954714573662, 'batch_norm': False, 'lr': 3.8753834101727735e-06, 'weight_decay': 5.6461440923887435e-05, 'epochs': 318, 'loss': 'mae', 'optimizer': 'adam', 'graph_mode': 'off', 'use_snp_selection': False}. Best is trial 95 with value: 0.3172677545951165.
[I 2025-12-05 19:42:28,121] Trial 149 finished with value: 0.2915696598312846 and parameters: {'model_type': 'mlp', 'hidden_dims': '[512, 128]', 'dropout': 0.3420884886001366, 'batch_norm': True, 'lr': 5.750245376716392e-06, 'weight_decay': 7.203249400275674e-05, 'epochs': 227, 'loss': 'mse', 'optimizer': 'adam', 'graph_mode': 'off', 'use_snp_selection': True, 'num_snps': 47237}. Best is trial 95 with value: 0.3172677545951165.
[I 2025-12-05 19:43:32,403] Trial 0 finished with value: 0.27102745520129523 and parameters: {'model_type': 'mlp', 'hidden_dims': '[128, 64]', 'dropout': 0.199031432379812, 'batch_norm': True, 'lr': 1.8408544111075837e-06, 'weight_decay': 5.5136510071208614e-05, 'epochs': 336, 'loss': 'mae', 'optimizer': 'adam', 'graph_mode': 'off', 'use_snp_selection': True, 'num_snps': 43862}. Best is trial 0 with value: 0.27102745520129523.
[I 2025-12-05 19:43:59,110] Trial 1 finished with value: 0.29385152708812134 and parameters: {'model_type': 'mlp', 'hidden_dims': '[256, 128]', 'dropout': 0.4370668075331726, 'batch_norm': True, 'lr': 7.133471581159139e-05, 'weight_decay': 1.128633586803549e-05, 'epochs': 242, 'loss': 'mae', 'optimizer': 'adam', 'graph_mode': 'off', 'use_snp_selection': False}. Best is trial 1 with value: 0.29385152708812134.
[I 2025-12-05 19:44:25,970] Trial 2 finished with value: 0.26279919190726436 and parameters: {'model_type': 'mlp', 'hidden_dims': '[256, 128, 64]', 'dropout': 0.41314357415569625, 'batch_norm': False, 'lr': 3.952233718592101e-06, 'weight_decay': 0.00026754769258252603, 'epochs': 149, 'loss': 'mse', 'optimizer': 'adam', 'graph_mode': 'off', 'use_snp_selection': True, 'num_snps': 11571}. Best is trial 1 with value: 0.29385152708812134.
[I 2025-12-05 19:45:26,574] Trial 3 finished with value: 0.30145251910879245 and parameters: {'model_type': 'mlp', 'hidden_dims': '[512, 64]', 'dropout': 0.5938127374509361, 'batch_norm': False, 'lr': 5.67704586114731e-06, 'weight_decay': 2.4518087630137052e-05, 'epochs': 320, 'loss': 'mae', 'optimizer': 'adam', 'graph_mode': 'off', 'use_snp_selection': False}. Best is trial 3 with value: 0.30145251910879245.
[I 2025-12-05 19:46:27,366] Trial 4 finished with value: 0.2762755900446863 and parameters: {'model_type': 'mlp', 'hidden_dims': '[512, 128]', 'dropout': 0.25746343592134413, 'batch_norm': True, 'lr': 1.3467657668402788e-06, 'weight_decay': 0.00033087251918647806, 'epochs': 277, 'loss': 'mse', 'optimizer': 'adam', 'graph_mode': 'off', 'use_snp_selection': True, 'num_snps': 36675}. Best is trial 3 with value: 0.30145251910879245.
