[I 2025-12-06 14:51:11,928] Trial 127 finished with value: 0.23904804709218844 and parameters: {'model_type': 'mlp', 'hidden_dims': '[128, 64]', 'dropout': 0.3135956535660918, 'batch_norm': True, 'lr': 6.348658142585452e-05, 'weight_decay': 3.367934887138825e-07, 'epochs': 153, 'loss': 'mse', 'optimizer': 'adam', 'graph_mode': 'off', 'use_snp_selection': True, 'num_snps': 25629}. Best is trial 71 with value: 0.2596386798200256.
[I 2025-12-06 14:51:54,677] Trial 128 finished with value: 0.24132965417774477 and parameters: {'model_type': 'mlp', 'hidden_dims': '[128, 64]', 'dropout': 0.2739745556435767, 'batch_norm': False, 'lr': 3.782845510747558e-05, 'weight_decay': 1.3855701522155964e-07, 'epochs': 141, 'loss': 'mse', 'optimizer': 'adam', 'graph_mode': 'off', 'use_snp_selection': True, 'num_snps': 28192}. Best is trial 71 with value: 0.2596386798200256.
[I 2025-12-06 14:52:33,994] Trial 129 finished with value: 0.24263262154727547 and parameters: {'model_type': 'mlp', 'hidden_dims': '[128, 64]', 'dropout': 0.10178269725803635, 'batch_norm': False, 'lr': 8.913514283772172e-05, 'weight_decay': 1.7765748655902473e-07, 'epochs': 175, 'loss': 'mse', 'optimizer': 'adam', 'graph_mode': 'off', 'use_snp_selection': True, 'num_snps': 19850}. Best is trial 71 with value: 0.2596386798200256.
[I 2025-12-06 14:53:14,763] Trial 130 finished with value: 0.2480246259504279 and parameters: {'model_type': 'mlp', 'hidden_dims': '[128, 64]', 'dropout': 0.3236085706593333, 'batch_norm': False, 'lr': 0.00012065615215596307, 'weight_decay': 1.0097812929897894e-07, 'epochs': 148, 'loss': 'mse', 'optimizer': 'adam', 'graph_mode': 'off', 'use_snp_selection': True, 'num_snps': 23924}. Best is trial 71 with value: 0.2596386798200256.
[I 2025-12-06 14:54:07,294] Trial 131 finished with value: 0.24897879232106018 and parameters: {'model_type': 'mlp', 'hidden_dims': '[512, 128]', 'dropout': 0.3016596200086185, 'batch_norm': False, 'lr': 1.0337254076572132e-05, 'weight_decay': 2.897068761472649e-07, 'epochs': 167, 'loss': 'mse', 'optimizer': 'adam', 'graph_mode': 'off', 'use_snp_selection': True, 'num_snps': 22530}. Best is trial 71 with value: 0.2596386798200256.
[I 2025-12-06 14:54:50,614] Trial 132 finished with value: 0.24567519515043995 and parameters: {'model_type': 'mlp', 'hidden_dims': '[256, 128]', 'dropout': 0.31372099884861765, 'batch_norm': False, 'lr': 1.390742159182245e-05, 'weight_decay': 2.2383160613289623e-07, 'epochs': 181, 'loss': 'mse', 'optimizer': 'adam', 'graph_mode': 'off', 'use_snp_selection': True, 'num_snps': 19764}. Best is trial 71 with value: 0.2596386798200256.
[I 2025-12-06 14:55:33,528] Trial 133 finished with value: 0.23971198718870604 and parameters: {'model_type': 'mlp', 'hidden_dims': '[256, 128, 64]', 'dropout': 0.3057112925554319, 'batch_norm': False, 'lr': 9.073492062446388e-06, 'weight_decay': 4.056440076589692e-07, 'epochs': 204, 'loss': 'mse', 'optimizer': 'adam', 'graph_mode': 'off', 'use_snp_selection': True, 'num_snps': 17405}. Best is trial 71 with value: 0.2596386798200256.
[I 2025-12-06 14:56:14,404] Trial 134 finished with value: 0.24815255685401 and parameters: {'model_type': 'mlp', 'hidden_dims': '[128, 64]', 'dropout': 0.2816487545265958, 'batch_norm': False, 'lr': 0.00017447920456329554, 'weight_decay': 6.628745353733041e-07, 'epochs': 185, 'loss': 'mse', 'optimizer': 'adam', 'graph_mode': 'off', 'use_snp_selection': True, 'num_snps': 22070}. Best is trial 71 with value: 0.2596386798200256.
[I 2025-12-06 14:57:09,952] Trial 135 finished with value: 0.2513259442934885 and parameters: {'model_type': 'mlp', 'hidden_dims': '[512, 64]', 'dropout': 0.34507019984267534, 'batch_norm': False, 'lr': 1.2078263642298841e-05, 'weight_decay': 1.4046274420134908e-05, 'epochs': 159, 'loss': 'mse', 'optimizer': 'adam', 'graph_mode': 'off', 'use_snp_selection': True, 'num_snps': 26507}. Best is trial 71 with value: 0.2596386798200256.
[I 2025-12-06 14:58:05,967] Trial 136 finished with value: 0.24355979854101167 and parameters: {'model_type': 'mlp', 'hidden_dims': '[512, 256]', 'dropout': 0.3701410427025205, 'batch_norm': False, 'lr': 1.2431646633974571e-05, 'weight_decay': 9.800903004709154e-06, 'epochs': 158, 'loss': 'mse', 'optimizer': 'adam', 'graph_mode': 'off', 'use_snp_selection': True, 'num_snps': 27020}. Best is trial 71 with value: 0.2596386798200256.
[I 2025-12-06 14:58:48,394] Trial 137 finished with value: 0.24693074556102634 and parameters: {'model_type': 'mlp', 'hidden_dims': '[128, 64]', 'dropout': 0.34531349044634224, 'batch_norm': False, 'lr': 3.0405732466174456e-05, 'weight_decay': 1.6892697788168362e-05, 'epochs': 171, 'loss': 'mse', 'optimizer': 'adam', 'graph_mode': 'off', 'use_snp_selection': True, 'num_snps': 25844}. Best is trial 71 with value: 0.2596386798200256.
[I 2025-12-06 14:59:43,250] Trial 138 finished with value: 0.24997628449064666 and parameters: {'model_type': 'mlp', 'hidden_dims': '[512, 64]', 'dropout': 0.36117263320526, 'batch_norm': False, 'lr': 6.637724971659733e-05, 'weight_decay': 6.3135746049066715e-06, 'epochs': 129, 'loss': 'mae', 'optimizer': 'adam', 'graph_mode': 'off', 'use_snp_selection': True, 'num_snps': 30271}. Best is trial 71 with value: 0.2596386798200256.
[I 2025-12-06 15:00:39,444] Trial 139 finished with value: 0.2482177642458679 and parameters: {'model_type': 'mlp', 'hidden_dims': '[512, 64]', 'dropout': 0.35962954101909933, 'batch_norm': False, 'lr': 4.476275253983158e-05, 'weight_decay': 5.331478767795407e-06, 'epochs': 127, 'loss': 'mae', 'optimizer': 'adam', 'graph_mode': 'off', 'use_snp_selection': True, 'num_snps': 31693}. Best is trial 71 with value: 0.2596386798200256.
[I 2025-12-06 15:01:31,893] Trial 140 finished with value: 0.23782246811300167 and parameters: {'model_type': 'mlp', 'hidden_dims': '[512, 64]', 'dropout': 0.33236238032686416, 'batch_norm': False, 'lr': 6.526621441589196e-05, 'weight_decay': 1.1792391662862575e-05, 'epochs': 117, 'loss': 'mae', 'optimizer': 'adam', 'graph_mode': 'off', 'use_snp_selection': True, 'num_snps': 28674}. Best is trial 71 with value: 0.2596386798200256.
[I 2025-12-06 15:02:29,112] Trial 141 finished with value: 0.24727464463529963 and parameters: {'model_type': 'mlp', 'hidden_dims': '[512, 64]', 'dropout': 0.34111823879615305, 'batch_norm': False, 'lr': 5.410149571147089e-05, 'weight_decay': 1.3347063361827191e-05, 'epochs': 146, 'loss': 'mae', 'optimizer': 'adam', 'graph_mode': 'off', 'use_snp_selection': True, 'num_snps': 30525}. Best is trial 71 with value: 0.2596386798200256.
[I 2025-12-06 15:03:22,836] Trial 142 finished with value: 0.24992841582384256 and parameters: {'model_type': 'mlp', 'hidden_dims': '[512, 64]', 'dropout': 0.3248943631460572, 'batch_norm': False, 'lr': 2.253904182238209e-05, 'weight_decay': 1.9028213866059169e-07, 'epochs': 163, 'loss': 'mae', 'optimizer': 'adam', 'graph_mode': 'off', 'use_snp_selection': True, 'num_snps': 24570}. Best is trial 71 with value: 0.2596386798200256.
[I 2025-12-06 15:04:09,661] Trial 143 finished with value: 0.24597911595930277 and parameters: {'model_type': 'mlp', 'hidden_dims': '[512, 64]', 'dropout': 0.37354816966255944, 'batch_norm': False, 'lr': 1.1420616538445559e-05, 'weight_decay': 1.3765698298168182e-07, 'epochs': 103, 'loss': 'mae', 'optimizer': 'adam', 'graph_mode': 'off', 'use_snp_selection': True, 'num_snps': 23139}. Best is trial 71 with value: 0.2596386798200256.
[I 2025-12-06 15:05:10,939] Trial 144 finished with value: 0.236348497248375 and parameters: {'model_type': 'mlp', 'hidden_dims': '[512, 64]', 'dropout': 0.35966750747899096, 'batch_norm': False, 'lr': 4.0485671763188624e-05, 'weight_decay': 1.6472340102253064e-07, 'epochs': 153, 'loss': 'mse', 'optimizer': 'adam', 'graph_mode': 'off', 'use_snp_selection': True, 'num_snps': 33257}. Best is trial 71 with value: 0.2596386798200256.
[I 2025-12-06 15:06:04,886] Trial 145 finished with value: 0.2546958675558679 and parameters: {'model_type': 'mlp', 'hidden_dims': '[512, 64]', 'dropout': 0.34681988885771897, 'batch_norm': False, 'lr': 1.602464470591524e-05, 'weight_decay': 3.990016200635147e-06, 'epochs': 143, 'loss': 'mae', 'optimizer': 'adam', 'graph_mode': 'off', 'use_snp_selection': True, 'num_snps': 27033}. Best is trial 71 with value: 0.2596386798200256.
[I 2025-12-06 15:06:57,884] Trial 146 finished with value: 0.25358509606869867 and parameters: {'model_type': 'mlp', 'hidden_dims': '[512, 64]', 'dropout': 0.3476729908457355, 'batch_norm': False, 'lr': 1.6384128337105138e-05, 'weight_decay': 3.9042951215513e-06, 'epochs': 134, 'loss': 'mae', 'optimizer': 'adam', 'graph_mode': 'off', 'use_snp_selection': True, 'num_snps': 27168}. Best is trial 71 with value: 0.2596386798200256.
[I 2025-12-06 15:07:39,809] Trial 147 finished with value: 0.2560872040983705 and parameters: {'model_type': 'mlp', 'hidden_dims': '[128, 64]', 'dropout': 0.3502284502196086, 'batch_norm': False, 'lr': 1.7475932717871845e-05, 'weight_decay': 0.0009467736956614255, 'epochs': 137, 'loss': 'mae', 'optimizer': 'adam', 'graph_mode': 'off', 'use_snp_selection': True, 'num_snps': 27072}. Best is trial 71 with value: 0.2596386798200256.
[I 2025-12-06 15:08:21,897] Trial 148 finished with value: 0.2484539975263016 and parameters: {'model_type': 'mlp', 'hidden_dims': '[128, 64]', 'dropout': 0.34899792212732345, 'batch_norm': False, 'lr': 1.7309400876990562e-05, 'weight_decay': 0.0007241703083894918, 'epochs': 137, 'loss': 'mae', 'optimizer': 'adam', 'graph_mode': 'off', 'use_snp_selection': True, 'num_snps': 27433}. Best is trial 71 with value: 0.2596386798200256.
[I 2025-12-06 15:09:03,515] Trial 149 finished with value: 0.21610003479776907 and parameters: {'model_type': 'mlp', 'hidden_dims': '[128, 64]', 'dropout': 0.3831942173852523, 'batch_norm': True, 'lr': 2.534542084262631e-05, 'weight_decay': 3.829120502067521e-06, 'epochs': 141, 'loss': 'mae', 'optimizer': 'adam', 'graph_mode': 'off', 'use_snp_selection': True, 'num_snps': 25823}. Best is trial 71 with value: 0.2596386798200256.
