[I 2025-12-05 16:23:55,717] Trial 123 finished with value: 0.08205174625713349 and parameters: {'model_type': 'mlp', 'hidden_dims': '[128, 64]', 'dropout': 0.28859752756672014, 'batch_norm': True, 'lr': 0.0004002027073193874, 'weight_decay': 2.145546701556662e-07, 'epochs': 216, 'loss': 'mse', 'optimizer': 'adam', 'graph_mode': 'off', 'use_snp_selection': True, 'num_snps': 9035}. Best is trial 17 with value: 0.11157945279125966.
[I 2025-12-05 16:23:57,456] Trial 124 finished with value: 0.08029339150228001 and parameters: {'model_type': 'mlp', 'hidden_dims': '[128, 64]', 'dropout': 0.40342935847356676, 'batch_norm': True, 'lr': 0.00026743376315794843, 'weight_decay': 6.557675958610505e-07, 'epochs': 197, 'loss': 'mse', 'optimizer': 'adam', 'graph_mode': 'off', 'use_snp_selection': True, 'num_snps': 31624}. Best is trial 17 with value: 0.11157945279125966.
[I 2025-12-05 16:23:58,849] Trial 125 finished with value: 0.09392269043047298 and parameters: {'model_type': 'mlp', 'hidden_dims': '[128, 64]', 'dropout': 0.3770238432253244, 'batch_norm': True, 'lr': 0.00021647336044951633, 'weight_decay': 1.3557656109770998e-07, 'epochs': 229, 'loss': 'mse', 'optimizer': 'adam', 'graph_mode': 'off', 'use_snp_selection': True, 'num_snps': 18275}. Best is trial 17 with value: 0.11157945279125966.
[I 2025-12-05 16:24:00,157] Trial 126 finished with value: 0.0770077592967843 and parameters: {'model_type': 'mlp', 'hidden_dims': '[128, 64]', 'dropout': 0.5705765487188861, 'batch_norm': True, 'lr': 0.00019298519062982866, 'weight_decay': 4.525909736718885e-07, 'epochs': 230, 'loss': 'mae', 'optimizer': 'adam', 'graph_mode': 'off', 'use_snp_selection': True, 'num_snps': 14823}. Best is trial 17 with value: 0.11157945279125966.
[I 2025-12-05 16:24:01,498] Trial 127 finished with value: 0.05766813347817209 and parameters: {'model_type': 'mlp', 'hidden_dims': '[256, 128, 64]', 'dropout': 0.379272210638082, 'batch_norm': True, 'lr': 0.00022392681374847285, 'weight_decay': 8.63171511981748e-06, 'epochs': 314, 'loss': 'mse', 'optimizer': 'adam', 'graph_mode': 'off', 'use_snp_selection': False}. Best is trial 17 with value: 0.11157945279125966.
[I 2025-12-05 16:24:02,550] Trial 128 finished with value: 0.07928429955302359 and parameters: {'model_type': 'mlp', 'hidden_dims': '[128, 64]', 'dropout': 0.3906570142258774, 'batch_norm': True, 'lr': 0.0006681354448585058, 'weight_decay': 1.3665679574462833e-07, 'epochs': 44, 'loss': 'mae', 'optimizer': 'adam', 'graph_mode': 'off', 'use_snp_selection': True, 'num_snps': 18083}. Best is trial 17 with value: 0.11157945279125966.
[I 2025-12-05 16:24:03,714] Trial 129 finished with value: 0.08902545984689188 and parameters: {'model_type': 'mlp', 'hidden_dims': '[512, 256]', 'dropout': 0.5308366142794638, 'batch_norm': True, 'lr': 0.00035829786587411843, 'weight_decay': 3.064724363821814e-07, 'epochs': 245, 'loss': 'mse', 'optimizer': 'adam', 'graph_mode': 'off', 'use_snp_selection': True, 'num_snps': 11229}. Best is trial 17 with value: 0.11157945279125966.
[I 2025-12-05 16:24:05,270] Trial 130 finished with value: 0.08106509451704372 and parameters: {'model_type': 'mlp', 'hidden_dims': '[256, 128]', 'dropout': 0.347280200206916, 'batch_norm': True, 'lr': 0.0001561945603880261, 'weight_decay': 1.633553324484797e-07, 'epochs': 238, 'loss': 'mae', 'optimizer': 'adam', 'graph_mode': 'off', 'use_snp_selection': True, 'num_snps': 21370}. Best is trial 17 with value: 0.11157945279125966.
[I 2025-12-05 16:24:06,211] Trial 131 finished with value: 0.06324710753645423 and parameters: {'model_type': 'mlp', 'hidden_dims': '[128, 64]', 'dropout': 0.5097702009922621, 'batch_norm': True, 'lr': 0.00029671127564580134, 'weight_decay': 1.218228079597562e-07, 'epochs': 227, 'loss': 'mse', 'optimizer': 'adam', 'graph_mode': 'off', 'use_snp_selection': True, 'num_snps': 2148}. Best is trial 17 with value: 0.11157945279125966.
[I 2025-12-05 16:24:07,585] Trial 132 finished with value: 0.08447284100237339 and parameters: {'model_type': 'mlp', 'hidden_dims': '[128, 64]', 'dropout': 0.33676526475289625, 'batch_norm': True, 'lr': 0.0004212540952588264, 'weight_decay': 2.2527867679076233e-07, 'epochs': 206, 'loss': 'mse', 'optimizer': 'adam', 'graph_mode': 'off', 'use_snp_selection': True, 'num_snps': 17108}. Best is trial 17 with value: 0.11157945279125966.
[I 2025-12-05 16:24:09,294] Trial 133 finished with value: 0.0748812535604457 and parameters: {'model_type': 'mlp', 'hidden_dims': '[128, 64]', 'dropout': 0.359569714132374, 'batch_norm': True, 'lr': 0.00020979806594558027, 'weight_decay': 1.0968806200920689e-07, 'epochs': 254, 'loss': 'mse', 'optimizer': 'adam', 'graph_mode': 'off', 'use_snp_selection': True, 'num_snps': 29135}. Best is trial 17 with value: 0.11157945279125966.
[I 2025-12-05 16:24:10,634] Trial 134 finished with value: 0.0666701017312268 and parameters: {'model_type': 'mlp', 'hidden_dims': '[128, 64]', 'dropout': 0.316384454824258, 'batch_norm': True, 'lr': 0.0005621564623663565, 'weight_decay': 1.447586128645669e-07, 'epochs': 192, 'loss': 'mse', 'optimizer': 'adam', 'graph_mode': 'off', 'use_snp_selection': True, 'num_snps': 19402}. Best is trial 17 with value: 0.11157945279125966.
[I 2025-12-05 16:24:12,100] Trial 135 finished with value: 0.07071151543384661 and parameters: {'model_type': 'mlp', 'hidden_dims': '[512, 64]', 'dropout': 0.4845051746434477, 'batch_norm': True, 'lr': 0.00024008850992828252, 'weight_decay': 5.192398436416167e-06, 'epochs': 113, 'loss': 'mse', 'optimizer': 'adam', 'graph_mode': 'off', 'use_snp_selection': True, 'num_snps': 22280}. Best is trial 17 with value: 0.11157945279125966.
[I 2025-12-05 16:24:13,681] Trial 136 finished with value: 0.08131996373536861 and parameters: {'model_type': 'mlp', 'hidden_dims': '[512, 128]', 'dropout': 0.3806884871788446, 'batch_norm': True, 'lr': 0.0004867727355381926, 'weight_decay': 2.5537532669659607e-07, 'epochs': 212, 'loss': 'mae', 'optimizer': 'adam', 'graph_mode': 'off', 'use_snp_selection': False}. Best is trial 17 with value: 0.11157945279125966.
[I 2025-12-05 16:24:15,600] Trial 137 finished with value: 0.07874361498532712 and parameters: {'model_type': 'mlp', 'hidden_dims': '[128, 64]', 'dropout': 0.419725695730856, 'batch_norm': False, 'lr': 0.00038053671674530206, 'weight_decay': 8.6982144885716e-05, 'epochs': 293, 'loss': 'mse', 'optimizer': 'adam', 'graph_mode': 'off', 'use_snp_selection': True, 'num_snps': 39261}. Best is trial 17 with value: 0.11157945279125966.
[I 2025-12-05 16:24:17,694] Trial 138 finished with value: 0.049772308989689096 and parameters: {'model_type': 'mlp', 'hidden_dims': '[128, 64]', 'dropout': 0.5845716200432328, 'batch_norm': True, 'lr': 0.00011981471243330825, 'weight_decay': 1.8856608078531333e-07, 'epochs': 276, 'loss': 'mae', 'optimizer': 'adam', 'graph_mode': 'off', 'use_snp_selection': True, 'num_snps': 36402}. Best is trial 17 with value: 0.11157945279125966.
[I 2025-12-05 16:24:19,312] Trial 139 finished with value: 0.04952495126806819 and parameters: {'model_type': 'mlp', 'hidden_dims': '[256, 128]', 'dropout': 0.54763964609594, 'batch_norm': True, 'lr': 5.851041730493881e-06, 'weight_decay': 3.6030597070255493e-07, 'epochs': 181, 'loss': 'mse', 'optimizer': 'adam', 'graph_mode': 'off', 'use_snp_selection': True, 'num_snps': 25342}. Best is trial 17 with value: 0.11157945279125966.
[I 2025-12-05 16:24:20,538] Trial 140 finished with value: 0.08205410422068331 and parameters: {'model_type': 'mlp', 'hidden_dims': '[512, 256]', 'dropout': 0.3266362168646365, 'batch_norm': True, 'lr': 0.00031707499946561697, 'weight_decay': 1.4402574550730622e-06, 'epochs': 203, 'loss': 'mae', 'optimizer': 'adam', 'graph_mode': 'off', 'use_snp_selection': True, 'num_snps': 12211}. Best is trial 17 with value: 0.11157945279125966.
[I 2025-12-05 16:24:21,642] Trial 141 finished with value: 0.06143538655439186 and parameters: {'model_type': 'mlp', 'hidden_dims': '[256, 128]', 'dropout': 0.30132293050701525, 'batch_norm': True, 'lr': 0.0004397634456383566, 'weight_decay': 7.943037142557914e-07, 'epochs': 230, 'loss': 'mae', 'optimizer': 'adam', 'graph_mode': 'off', 'use_snp_selection': False}. Best is trial 17 with value: 0.11157945279125966.
[I 2025-12-05 16:24:22,751] Trial 142 finished with value: 0.07873201488623927 and parameters: {'model_type': 'mlp', 'hidden_dims': '[256, 128]', 'dropout': 0.5704504574034395, 'batch_norm': True, 'lr': 0.00027220939456601846, 'weight_decay': 1.0796788578963663e-06, 'epochs': 238, 'loss': 'mae', 'optimizer': 'adam', 'graph_mode': 'off', 'use_snp_selection': False}. Best is trial 17 with value: 0.11157945279125966.
[I 2025-12-05 16:24:23,879] Trial 143 finished with value: 0.07262837755033003 and parameters: {'model_type': 'mlp', 'hidden_dims': '[256, 128]', 'dropout': 0.5523216941994467, 'batch_norm': True, 'lr': 0.000734306981288094, 'weight_decay': 5.816116587073651e-07, 'epochs': 248, 'loss': 'mae', 'optimizer': 'adam', 'graph_mode': 'off', 'use_snp_selection': False}. Best is trial 17 with value: 0.11157945279125966.
[I 2025-12-05 16:24:25,004] Trial 144 finished with value: 0.0852352097770445 and parameters: {'model_type': 'mlp', 'hidden_dims': '[256, 128]', 'dropout': 0.5418932555566732, 'batch_norm': True, 'lr': 0.0009984970726489048, 'weight_decay': 4.845682413534488e-07, 'epochs': 219, 'loss': 'mae', 'optimizer': 'adam', 'graph_mode': 'off', 'use_snp_selection': False}. Best is trial 17 with value: 0.11157945279125966.
[I 2025-12-05 16:24:26,336] Trial 145 finished with value: 0.07739601143444509 and parameters: {'model_type': 'mlp', 'hidden_dims': '[256, 128, 64]', 'dropout': 0.36472423404091, 'batch_norm': True, 'lr': 0.000348507075836743, 'weight_decay': 1.0233244638844596e-07, 'epochs': 302, 'loss': 'mae', 'optimizer': 'adam', 'graph_mode': 'off', 'use_snp_selection': False}. Best is trial 17 with value: 0.11157945279125966.
[I 2025-12-05 16:24:27,400] Trial 146 finished with value: 0.06998267646620576 and parameters: {'model_type': 'mlp', 'hidden_dims': '[128, 64]', 'dropout': 0.5762089846012822, 'batch_norm': True, 'lr': 0.0006068562240289137, 'weight_decay': 1.6986197620950138e-07, 'epochs': 262, 'loss': 'mse', 'optimizer': 'adam', 'graph_mode': 'off', 'use_snp_selection': True, 'num_snps': 4971}. Best is trial 17 with value: 0.11157945279125966.
[I 2025-12-05 16:24:29,049] Trial 147 finished with value: 0.06151398520412743 and parameters: {'model_type': 'mlp', 'hidden_dims': '[512, 64]', 'dropout': 0.346563544926263, 'batch_norm': True, 'lr': 0.00019130960298950793, 'weight_decay': 1.6703790234507712e-06, 'epochs': 224, 'loss': 'mae', 'optimizer': 'adam', 'graph_mode': 'off', 'use_snp_selection': False}. Best is trial 17 with value: 0.11157945279125966.
[I 2025-12-05 16:24:30,347] Trial 148 finished with value: 0.08337209757118988 and parameters: {'model_type': 'mlp', 'hidden_dims': '[512, 128]', 'dropout': 0.590525125779594, 'batch_norm': True, 'lr': 0.0005172278442977277, 'weight_decay': 1.3503977230623472e-07, 'epochs': 234, 'loss': 'mae', 'optimizer': 'adam', 'graph_mode': 'off', 'use_snp_selection': True, 'num_snps': 15443}. Best is trial 17 with value: 0.11157945279125966.
[I 2025-12-05 16:24:32,532] Trial 149 finished with value: 0.08169361165866189 and parameters: {'model_type': 'mlp', 'hidden_dims': '[128, 64]', 'dropout': 0.3110939439090857, 'batch_norm': True, 'lr': 0.00040353647607305155, 'weight_decay': 0.0002558280777682765, 'epochs': 215, 'loss': 'mse', 'optimizer': 'adam', 'graph_mode': 'off', 'use_snp_selection': True, 'num_snps': 44788}. Best is trial 17 with value: 0.11157945279125966.
[I 2025-12-05 16:24:34,859] Trial 0 finished with value: -0.005380351995895826 and parameters: {'model_type': 'mlp', 'hidden_dims': '[128, 64]', 'dropout': 0.199031432379812, 'batch_norm': True, 'lr': 1.8408544111075837e-06, 'weight_decay': 5.5136510071208614e-05, 'epochs': 336, 'loss': 'mae', 'optimizer': 'adam', 'graph_mode': 'off', 'use_snp_selection': True, 'num_snps': 43862}. Best is trial 0 with value: -0.005380351995895826.
[I 2025-12-05 16:24:36,085] Trial 1 finished with value: 0.03317299435995216 and parameters: {'model_type': 'mlp', 'hidden_dims': '[256, 128]', 'dropout': 0.4370668075331726, 'batch_norm': True, 'lr': 7.133471581159139e-05, 'weight_decay': 1.128633586803549e-05, 'epochs': 242, 'loss': 'mae', 'optimizer': 'adam', 'graph_mode': 'off', 'use_snp_selection': False}. Best is trial 1 with value: 0.03317299435995216.
[I 2025-12-05 16:24:37,129] Trial 2 finished with value: -0.005697431439855243 and parameters: {'model_type': 'mlp', 'hidden_dims': '[256, 128, 64]', 'dropout': 0.41314357415569625, 'batch_norm': False, 'lr': 3.952233718592101e-06, 'weight_decay': 0.00026754769258252603, 'epochs': 149, 'loss': 'mse', 'optimizer': 'adam', 'graph_mode': 'off', 'use_snp_selection': True, 'num_snps': 11571}. Best is trial 1 with value: 0.03317299435995216.
[I 2025-12-05 16:24:39,140] Trial 3 finished with value: 0.036326154502787644 and parameters: {'model_type': 'mlp', 'hidden_dims': '[512, 64]', 'dropout': 0.5938127374509361, 'batch_norm': False, 'lr': 5.67704586114731e-06, 'weight_decay': 2.4518087630137052e-05, 'epochs': 320, 'loss': 'mae', 'optimizer': 'adam', 'graph_mode': 'off', 'use_snp_selection': False}. Best is trial 3 with value: 0.036326154502787644.
[I 2025-12-05 16:24:41,422] Trial 4 finished with value: -0.005719131397409238 and parameters: {'model_type': 'mlp', 'hidden_dims': '[512, 128]', 'dropout': 0.25746343592134413, 'batch_norm': True, 'lr': 1.3467657668402788e-06, 'weight_decay': 0.00033087251918647806, 'epochs': 277, 'loss': 'mse', 'optimizer': 'adam', 'graph_mode': 'off', 'use_snp_selection': True, 'num_snps': 36675}. Best is trial 3 with value: 0.036326154502787644.
[I 2025-12-05 16:24:43,131] Trial 5 finished with value: -0.0024374303230120568 and parameters: {'model_type': 'mlp', 'hidden_dims': '[512, 64]', 'dropout': 0.38275350994408375, 'batch_norm': True, 'lr': 1.5586664309232824e-06, 'weight_decay': 0.0008227664668621182, 'epochs': 145, 'loss': 'mae', 'optimizer': 'adam', 'graph_mode': 'off', 'use_snp_selection': True, 'num_snps': 32148}. Best is trial 3 with value: 0.036326154502787644.
[I 2025-12-05 16:24:44,192] Trial 6 finished with value: 0.008406291223569043 and parameters: {'model_type': 'mlp', 'hidden_dims': '[256, 128]', 'dropout': 0.3930109900265879, 'batch_norm': False, 'lr': 4.892964372128395e-05, 'weight_decay': 1.5809549317992182e-06, 'epochs': 199, 'loss': 'mse', 'optimizer': 'adam', 'graph_mode': 'off', 'use_snp_selection': False}. Best is trial 3 with value: 0.036326154502787644.
[I 2025-12-05 16:24:45,353] Trial 7 finished with value: 0.04584479454403272 and parameters: {'model_type': 'mlp', 'hidden_dims': '[512, 256]', 'dropout': 0.15343979219678458, 'batch_norm': True, 'lr': 6.234003099047341e-05, 'weight_decay': 3.894760610535477e-07, 'epochs': 97, 'loss': 'mse', 'optimizer': 'adam', 'graph_mode': 'off', 'use_snp_selection': False}. Best is trial 7 with value: 0.04584479454403272.
[I 2025-12-05 16:24:47,334] Trial 8 finished with value: 0.03854130802337686 and parameters: {'model_type': 'mlp', 'hidden_dims': '[512, 128]', 'dropout': 0.10743001231661406, 'batch_norm': True, 'lr': 0.00023728538449271062, 'weight_decay': 1.7629071578048637e-05, 'epochs': 312, 'loss': 'mae', 'optimizer': 'adam', 'graph_mode': 'off', 'use_snp_selection': False}. Best is trial 7 with value: 0.04584479454403272.
[I 2025-12-05 16:24:48,734] Trial 9 finished with value: 0.03150976463072993 and parameters: {'model_type': 'mlp', 'hidden_dims': '[512, 64]', 'dropout': 0.14505336736221927, 'batch_norm': True, 'lr': 5.8619638388111826e-05, 'weight_decay': 6.200156172669308e-07, 'epochs': 175, 'loss': 'mse', 'optimizer': 'adam', 'graph_mode': 'off', 'use_snp_selection': False}. Best is trial 7 with value: 0.04584479454403272.
[I 2025-12-05 16:24:49,623] Trial 10 finished with value: -0.050809631833273555 and parameters: {'model_type': 'mlp', 'hidden_dims': '[512, 256]', 'dropout': 0.2736992815328032, 'batch_norm': False, 'lr': 0.00032393778075602147, 'weight_decay': 1.1511946696017092e-07, 'epochs': 41, 'loss': 'mse', 'optimizer': 'adam', 'graph_mode': 'off', 'use_snp_selection': False}. Best is trial 7 with value: 0.04584479454403272.
[I 2025-12-05 16:24:50,667] Trial 11 finished with value: 0.025388731653524423 and parameters: {'model_type': 'mlp', 'hidden_dims': '[512, 128]', 'dropout': 0.10095648685224448, 'batch_norm': True, 'lr': 0.0007666984023899753, 'weight_decay': 2.512571353186099e-06, 'epochs': 70, 'loss': 'mae', 'optimizer': 'adam', 'graph_mode': 'off', 'use_snp_selection': False}. Best is trial 7 with value: 0.04584479454403272.
[I 2025-12-05 16:24:51,797] Trial 12 finished with value: 0.02118414610666125 and parameters: {'model_type': 'mlp', 'hidden_dims': '[512, 256]', 'dropout': 0.18206399419301494, 'batch_norm': True, 'lr': 0.00026576228959612443, 'weight_decay': 1.3081036432574914e-07, 'epochs': 88, 'loss': 'mae', 'optimizer': 'adam', 'graph_mode': 'off', 'use_snp_selection': False}. Best is trial 7 with value: 0.04584479454403272.
[I 2025-12-05 16:24:53,500] Trial 13 finished with value: 0.0240179776180061 and parameters: {'model_type': 'mlp', 'hidden_dims': '[512, 128]', 'dropout': 0.28178980110198326, 'batch_norm': True, 'lr': 1.6203139973043888e-05, 'weight_decay': 3.475237872468419e-06, 'epochs': 237, 'loss': 'mse', 'optimizer': 'adam', 'graph_mode': 'off', 'use_snp_selection': False}. Best is trial 7 with value: 0.04584479454403272.
[I 2025-12-05 16:24:54,736] Trial 14 finished with value: 0.043242820627901565 and parameters: {'model_type': 'mlp', 'hidden_dims': '[512, 256]', 'dropout': 0.12319334351899142, 'batch_norm': True, 'lr': 0.00017558188744418174, 'weight_decay': 6.0578250711704925e-05, 'epochs': 119, 'loss': 'mse', 'optimizer': 'adam', 'graph_mode': 'off', 'use_snp_selection': False}. Best is trial 7 with value: 0.04584479454403272.
[I 2025-12-05 16:24:55,922] Trial 15 finished with value: 0.036349294111043325 and parameters: {'model_type': 'mlp', 'hidden_dims': '[512, 256]', 'dropout': 0.20621131466804843, 'batch_norm': True, 'lr': 2.002944590579291e-05, 'weight_decay': 8.204492176908448e-05, 'epochs': 106, 'loss': 'mse', 'optimizer': 'adam', 'graph_mode': 'off', 'use_snp_selection': False}. Best is trial 7 with value: 0.04584479454403272.
[I 2025-12-05 16:24:57,183] Trial 16 finished with value: 0.04766495257198574 and parameters: {'model_type': 'mlp', 'hidden_dims': '[512, 256]', 'dropout': 0.3143120296249873, 'batch_norm': True, 'lr': 0.00012396403352551432, 'weight_decay': 5.111768350743726e-07, 'epochs': 123, 'loss': 'mse', 'optimizer': 'adam', 'graph_mode': 'off', 'use_snp_selection': False}. Best is trial 16 with value: 0.04766495257198574.
[I 2025-12-05 16:24:58,134] Trial 17 finished with value: 0.025661605367379412 and parameters: {'model_type': 'mlp', 'hidden_dims': '[512, 256]', 'dropout': 0.47780512810378184, 'batch_norm': True, 'lr': 0.00011211060956895801, 'weight_decay': 3.6392708945165584e-07, 'epochs': 43, 'loss': 'mse', 'optimizer': 'adam', 'graph_mode': 'off', 'use_snp_selection': False}. Best is trial 16 with value: 0.04766495257198574.
[I 2025-12-05 16:25:00,612] Trial 18 finished with value: 0.03510570706044045 and parameters: {'model_type': 'mlp', 'hidden_dims': '[128, 64]', 'dropout': 0.3256756590086126, 'batch_norm': False, 'lr': 0.0009700460844600156, 'weight_decay': 6.200286480550168e-07, 'epochs': 143, 'loss': 'mse', 'optimizer': 'adam', 'graph_mode': 'off', 'use_snp_selection': True, 'num_snps': 58241}. Best is trial 16 with value: 0.04766495257198574.
[I 2025-12-05 16:25:01,752] Trial 19 finished with value: -0.0002511884296954268 and parameters: {'model_type': 'mlp', 'hidden_dims': '[256, 128, 64]', 'dropout': 0.511151273359987, 'batch_norm': True, 'lr': 1.2998031534780248e-05, 'weight_decay': 5.616604511856029e-06, 'epochs': 189, 'loss': 'mse', 'optimizer': 'adam', 'graph_mode': 'off', 'use_snp_selection': False}. Best is trial 16 with value: 0.04766495257198574.
[I 2025-12-05 16:25:02,857] Trial 20 finished with value: 0.036204590084083416 and parameters: {'model_type': 'mlp', 'hidden_dims': '[512, 256]', 'dropout': 0.34670652695216636, 'batch_norm': True, 'lr': 3.3332134611146494e-05, 'weight_decay': 2.7514336050627956e-07, 'epochs': 81, 'loss': 'mse', 'optimizer': 'adam', 'graph_mode': 'off', 'use_snp_selection': False}. Best is trial 16 with value: 0.04766495257198574.
[I 2025-12-05 16:25:04,106] Trial 21 finished with value: 0.010437950203154737 and parameters: {'model_type': 'mlp', 'hidden_dims': '[512, 256]', 'dropout': 0.14984565036526126, 'batch_norm': True, 'lr': 0.0001400192911920417, 'weight_decay': 1.27259278429389e-06, 'epochs': 118, 'loss': 'mse', 'optimizer': 'adam', 'graph_mode': 'off', 'use_snp_selection': False}. Best is trial 16 with value: 0.04766495257198574.
[I 2025-12-05 16:25:05,333] Trial 22 finished with value: 0.04524002767973486 and parameters: {'model_type': 'mlp', 'hidden_dims': '[512, 256]', 'dropout': 0.24692309586425704, 'batch_norm': True, 'lr': 0.000129389513748678, 'weight_decay': 5.196052337561322e-05, 'epochs': 115, 'loss': 'mse', 'optimizer': 'adam', 'graph_mode': 'off', 'use_snp_selection': False}. Best is trial 16 with value: 0.04766495257198574.
[I 2025-12-05 16:25:06,712] Trial 23 finished with value: 0.02912680055537891 and parameters: {'model_type': 'mlp', 'hidden_dims': '[512, 256]', 'dropout': 0.23531785383722015, 'batch_norm': True, 'lr': 0.0005645008608643643, 'weight_decay': 5.571848746300387e-06, 'epochs': 166, 'loss': 'mse', 'optimizer': 'adam', 'graph_mode': 'off', 'use_snp_selection': False}. Best is trial 16 with value: 0.04766495257198574.
