[I 2025-12-06 00:32:09,899] Trial 23 finished with value: 0.3024620781368597 and parameters: {'model_type': 'mlp', 'hidden_dims': '[128, 64]', 'dropout': 0.18555007390454792, 'batch_norm': True, 'lr': 0.0001040437474180157, 'weight_decay': 0.00014061128063276327, 'epochs': 123, 'loss': 'mae', 'optimizer': 'adam', 'graph_mode': 'off', 'use_snp_selection': False}. Best is trial 22 with value: 0.31340379818889347.
[I 2025-12-06 00:32:23,658] Trial 24 finished with value: 0.3089726404609235 and parameters: {'model_type': 'mlp', 'hidden_dims': '[128, 64]', 'dropout': 0.24524453359542225, 'batch_norm': True, 'lr': 0.0005582689996165211, 'weight_decay': 7.155673581155691e-06, 'epochs': 180, 'loss': 'mae', 'optimizer': 'adam', 'graph_mode': 'off', 'use_snp_selection': False}. Best is trial 22 with value: 0.31340379818889347.
[I 2025-12-06 00:32:31,234] Trial 25 finished with value: 0.2984441967029948 and parameters: {'model_type': 'mlp', 'hidden_dims': '[128, 64]', 'dropout': 0.1499795796096931, 'batch_norm': True, 'lr': 3.775256329745003e-05, 'weight_decay': 1.0077734665942408e-06, 'epochs': 61, 'loss': 'mae', 'optimizer': 'adam', 'graph_mode': 'off', 'use_snp_selection': False}. Best is trial 22 with value: 0.31340379818889347.
[I 2025-12-06 00:32:53,854] Trial 26 finished with value: 0.27743670567123935 and parameters: {'model_type': 'mlp', 'hidden_dims': '[128, 64]', 'dropout': 0.2956061571170323, 'batch_norm': True, 'lr': 9.398159696926316e-05, 'weight_decay': 0.0009977436481228867, 'epochs': 124, 'loss': 'mse', 'optimizer': 'adam', 'graph_mode': 'off', 'use_snp_selection': True, 'num_snps': 3842}. Best is trial 22 with value: 0.31340379818889347.
[I 2025-12-06 00:33:02,827] Trial 27 finished with value: 0.2932456902170961 and parameters: {'model_type': 'mlp', 'hidden_dims': '[128, 64]', 'dropout': 0.21658352765802535, 'batch_norm': False, 'lr': 1.2089799038469695e-05, 'weight_decay': 4.881339110858778e-06, 'epochs': 88, 'loss': 'mae', 'optimizer': 'adam', 'graph_mode': 'off', 'use_snp_selection': False}. Best is trial 22 with value: 0.31340379818889347.
[I 2025-12-06 00:33:18,602] Trial 28 finished with value: 0.3052415224937043 and parameters: {'model_type': 'mlp', 'hidden_dims': '[256, 128]', 'dropout': 0.13666152773125706, 'batch_norm': True, 'lr': 2.6521076988623107e-05, 'weight_decay': 0.00010848591018341434, 'epochs': 122, 'loss': 'mse', 'optimizer': 'adam', 'graph_mode': 'off', 'use_snp_selection': False}. Best is trial 22 with value: 0.31340379818889347.
[I 2025-12-06 00:33:48,025] Trial 29 finished with value: 0.30082956504080083 and parameters: {'model_type': 'mlp', 'hidden_dims': '[128, 64]', 'dropout': 0.18791532504952393, 'batch_norm': True, 'lr': 0.0005110746661777083, 'weight_decay': 3.936754555095496e-05, 'epochs': 188, 'loss': 'mae', 'optimizer': 'adam', 'graph_mode': 'off', 'use_snp_selection': True, 'num_snps': 19468}. Best is trial 22 with value: 0.31340379818889347.
[I 2025-12-06 00:34:17,451] Trial 30 finished with value: 0.3075138832771676 and parameters: {'model_type': 'mlp', 'hidden_dims': '[512, 256]', 'dropout': 0.3455853241042135, 'batch_norm': True, 'lr': 0.00011257436136732168, 'weight_decay': 0.00028887320708269554, 'epochs': 138, 'loss': 'mae', 'optimizer': 'adam', 'graph_mode': 'off', 'use_snp_selection': False}. Best is trial 22 with value: 0.31340379818889347.
[I 2025-12-06 00:34:37,291] Trial 31 finished with value: 0.30637227541538636 and parameters: {'model_type': 'mlp', 'hidden_dims': '[256, 128, 64]', 'dropout': 0.1204107143800032, 'batch_norm': True, 'lr': 0.0001832483914683609, 'weight_decay': 1.879247231773269e-05, 'epochs': 165, 'loss': 'mae', 'optimizer': 'adam', 'graph_mode': 'off', 'use_snp_selection': False}. Best is trial 22 with value: 0.31340379818889347.
[I 2025-12-06 00:35:19,711] Trial 32 finished with value: 0.30923303572027283 and parameters: {'model_type': 'mlp', 'hidden_dims': '[512, 128]', 'dropout': 0.16787151517132848, 'batch_norm': True, 'lr': 0.00022916750389875834, 'weight_decay': 2.0381525184348023e-05, 'epochs': 212, 'loss': 'mae', 'optimizer': 'adam', 'graph_mode': 'off', 'use_snp_selection': False}. Best is trial 22 with value: 0.31340379818889347.
[I 2025-12-06 00:36:07,382] Trial 33 finished with value: 0.3063124783791703 and parameters: {'model_type': 'mlp', 'hidden_dims': '[512, 64]', 'dropout': 0.19980577661636736, 'batch_norm': True, 'lr': 5.8639405512243324e-05, 'weight_decay': 6.355932383753226e-05, 'epochs': 242, 'loss': 'mae', 'optimizer': 'adam', 'graph_mode': 'off', 'use_snp_selection': False}. Best is trial 22 with value: 0.31340379818889347.
[I 2025-12-06 00:36:17,625] Trial 34 finished with value: 0.3076237433869862 and parameters: {'model_type': 'mlp', 'hidden_dims': '[128, 64]', 'dropout': 0.13196779972547878, 'batch_norm': True, 'lr': 7.617544649993905e-05, 'weight_decay': 1.640527100051932e-05, 'epochs': 111, 'loss': 'mae', 'optimizer': 'adam', 'graph_mode': 'off', 'use_snp_selection': False}. Best is trial 22 with value: 0.31340379818889347.
[I 2025-12-06 00:36:50,895] Trial 35 finished with value: 0.30075701546660677 and parameters: {'model_type': 'mlp', 'hidden_dims': '[256, 128]', 'dropout': 0.24117210141286102, 'batch_norm': False, 'lr': 0.0002600362496437402, 'weight_decay': 3.6829867355532434e-06, 'epochs': 316, 'loss': 'mae', 'optimizer': 'adam', 'graph_mode': 'off', 'use_snp_selection': False}. Best is trial 22 with value: 0.31340379818889347.
[I 2025-12-06 00:37:34,767] Trial 36 finished with value: 0.30571135707103353 and parameters: {'model_type': 'mlp', 'hidden_dims': '[256, 128, 64]', 'dropout': 0.17396154741297837, 'batch_norm': True, 'lr': 0.0004952630758234079, 'weight_decay': 0.000516216105979363, 'epochs': 72, 'loss': 'mae', 'optimizer': 'adam', 'graph_mode': 'off', 'use_snp_selection': True, 'num_snps': 58661}. Best is trial 22 with value: 0.31340379818889347.
[I 2025-12-06 00:38:03,693] Trial 37 finished with value: 0.28938379983704027 and parameters: {'model_type': 'mlp', 'hidden_dims': '[512, 64]', 'dropout': 0.26757411280169435, 'batch_norm': True, 'lr': 4.446294938689996e-06, 'weight_decay': 9.121526760895848e-06, 'epochs': 136, 'loss': 'mse', 'optimizer': 'adam', 'graph_mode': 'off', 'use_snp_selection': False}. Best is trial 22 with value: 0.31340379818889347.
[I 2025-12-06 00:38:43,414] Trial 38 finished with value: 0.2987135906377864 and parameters: {'model_type': 'mlp', 'hidden_dims': '[512, 128]', 'dropout': 0.10020348216981056, 'batch_norm': False, 'lr': 4.9427450049882736e-05, 'weight_decay': 3.120437206690815e-05, 'epochs': 244, 'loss': 'mae', 'optimizer': 'adam', 'graph_mode': 'off', 'use_snp_selection': True, 'num_snps': 19911}. Best is trial 22 with value: 0.31340379818889347.
[I 2025-12-06 00:39:23,908] Trial 39 finished with value: 0.30579090420308663 and parameters: {'model_type': 'mlp', 'hidden_dims': '[512, 64]', 'dropout': 0.12413886946584855, 'batch_norm': True, 'lr': 0.00012733098753092847, 'weight_decay': 7.463087491454578e-05, 'epochs': 202, 'loss': 'mse', 'optimizer': 'adam', 'graph_mode': 'off', 'use_snp_selection': False}. Best is trial 22 with value: 0.31340379818889347.
[I 2025-12-06 00:39:35,921] Trial 40 finished with value: 0.30706717905272496 and parameters: {'model_type': 'mlp', 'hidden_dims': '[128, 64]', 'dropout': 0.2023929494130503, 'batch_norm': True, 'lr': 7.329482072663353e-05, 'weight_decay': 1.3702788085132317e-06, 'epochs': 148, 'loss': 'mae', 'optimizer': 'adam', 'graph_mode': 'off', 'use_snp_selection': False}. Best is trial 22 with value: 0.31340379818889347.
[I 2025-12-06 00:40:30,949] Trial 41 finished with value: 0.3069311534833352 and parameters: {'model_type': 'mlp', 'hidden_dims': '[512, 128]', 'dropout': 0.10705992666962863, 'batch_norm': True, 'lr': 0.00017582459619530159, 'weight_decay': 2.6547006755559354e-06, 'epochs': 284, 'loss': 'mae', 'optimizer': 'adam', 'graph_mode': 'off', 'use_snp_selection': False}. Best is trial 22 with value: 0.31340379818889347.
[I 2025-12-06 00:41:32,919] Trial 42 finished with value: 0.3072689897143125 and parameters: {'model_type': 'mlp', 'hidden_dims': '[512, 128]', 'dropout': 0.15739329470999674, 'batch_norm': True, 'lr': 0.00039037331028445656, 'weight_decay': 2.1623380375768881e-07, 'epochs': 323, 'loss': 'mae', 'optimizer': 'adam', 'graph_mode': 'off', 'use_snp_selection': False}. Best is trial 22 with value: 0.31340379818889347.
[I 2025-12-06 00:42:30,379] Trial 43 finished with value: 0.3071547284748478 and parameters: {'model_type': 'mlp', 'hidden_dims': '[512, 128]', 'dropout': 0.1554913119490861, 'batch_norm': True, 'lr': 0.00023187339126164776, 'weight_decay': 9.055672356145647e-07, 'epochs': 297, 'loss': 'mae', 'optimizer': 'adam', 'graph_mode': 'off', 'use_snp_selection': False}. Best is trial 22 with value: 0.31340379818889347.
[I 2025-12-06 00:43:34,143] Trial 44 finished with value: 0.3093715510307967 and parameters: {'model_type': 'mlp', 'hidden_dims': '[512, 128]', 'dropout': 0.12052684386291568, 'batch_norm': True, 'lr': 0.0001516538970529717, 'weight_decay': 2.462369548690841e-06, 'epochs': 333, 'loss': 'mae', 'optimizer': 'adam', 'graph_mode': 'off', 'use_snp_selection': False}. Best is trial 22 with value: 0.31340379818889347.
[I 2025-12-06 00:44:25,563] Trial 45 finished with value: 0.3111798982458189 and parameters: {'model_type': 'mlp', 'hidden_dims': '[512, 256]', 'dropout': 0.1001353552753443, 'batch_norm': True, 'lr': 8.245304589782865e-05, 'weight_decay': 3.015186644185983e-07, 'epochs': 262, 'loss': 'mse', 'optimizer': 'adam', 'graph_mode': 'off', 'use_snp_selection': False}. Best is trial 22 with value: 0.31340379818889347.
[I 2025-12-06 00:45:16,352] Trial 46 finished with value: 0.3002558845178179 and parameters: {'model_type': 'mlp', 'hidden_dims': '[512, 256]', 'dropout': 0.1440731338418798, 'batch_norm': False, 'lr': 8.055567193103489e-05, 'weight_decay': 1.7529395856549123e-07, 'epochs': 262, 'loss': 'mse', 'optimizer': 'adam', 'graph_mode': 'off', 'use_snp_selection': False}. Best is trial 22 with value: 0.31340379818889347.
[I 2025-12-06 00:45:28,689] Trial 47 finished with value: 0.30849547223993623 and parameters: {'model_type': 'mlp', 'hidden_dims': '[512, 256]', 'dropout': 0.47981792189754, 'batch_norm': True, 'lr': 1.8875250387645762e-05, 'weight_decay': 0.0001803456264880134, 'epochs': 40, 'loss': 'mse', 'optimizer': 'adam', 'graph_mode': 'off', 'use_snp_selection': False}. Best is trial 22 with value: 0.31340379818889347.
[I 2025-12-06 00:46:14,559] Trial 48 finished with value: 0.30840677940347544 and parameters: {'model_type': 'mlp', 'hidden_dims': '[512, 256]', 'dropout': 0.18544782032588084, 'batch_norm': True, 'lr': 4.184270977121149e-05, 'weight_decay': 3.0081991170546236e-07, 'epochs': 231, 'loss': 'mse', 'optimizer': 'adam', 'graph_mode': 'off', 'use_snp_selection': False}. Best is trial 22 with value: 0.31340379818889347.
[I 2025-12-06 00:47:22,605] Trial 49 finished with value: 0.3107698188989971 and parameters: {'model_type': 'mlp', 'hidden_dims': '[512, 256]', 'dropout': 0.37552058304187724, 'batch_norm': True, 'lr': 0.0009309211764542658, 'weight_decay': 1.3311446607239699e-05, 'epochs': 255, 'loss': 'mse', 'optimizer': 'adam', 'graph_mode': 'off', 'use_snp_selection': True, 'num_snps': 46888}. Best is trial 22 with value: 0.31340379818889347.
[I 2025-12-06 00:48:31,227] Trial 50 finished with value: 0.3089941207807919 and parameters: {'model_type': 'mlp', 'hidden_dims': '[512, 256]', 'dropout': 0.36536639728717096, 'batch_norm': True, 'lr': 0.0008438562120159094, 'weight_decay': 6.33860508476315e-07, 'epochs': 263, 'loss': 'mse', 'optimizer': 'adam', 'graph_mode': 'off', 'use_snp_selection': True, 'num_snps': 46345}. Best is trial 22 with value: 0.31340379818889347.
[I 2025-12-06 00:49:38,912] Trial 51 finished with value: 0.3084749834958084 and parameters: {'model_type': 'mlp', 'hidden_dims': '[512, 256]', 'dropout': 0.38593555089859377, 'batch_norm': True, 'lr': 0.0005718358175009255, 'weight_decay': 7.288747571963319e-06, 'epochs': 251, 'loss': 'mse', 'optimizer': 'adam', 'graph_mode': 'off', 'use_snp_selection': True, 'num_snps': 47105}. Best is trial 22 with value: 0.31340379818889347.
[I 2025-12-06 00:50:24,794] Trial 52 finished with value: 0.3001398712949526 and parameters: {'model_type': 'mlp', 'hidden_dims': '[512, 256]', 'dropout': 0.41598281844098295, 'batch_norm': True, 'lr': 0.0009654075752522302, 'weight_decay': 1.415765414991003e-05, 'epochs': 304, 'loss': 'mse', 'optimizer': 'adam', 'graph_mode': 'off', 'use_snp_selection': True, 'num_snps': 22057}. Best is trial 22 with value: 0.31340379818889347.
[I 2025-12-06 00:51:32,596] Trial 53 finished with value: 0.3066529578714784 and parameters: {'model_type': 'mlp', 'hidden_dims': '[512, 256]', 'dropout': 0.4416284706739891, 'batch_norm': True, 'lr': 0.0007060044763191631, 'weight_decay': 2.5720936379451195e-05, 'epochs': 348, 'loss': 'mse', 'optimizer': 'adam', 'graph_mode': 'off', 'use_snp_selection': True, 'num_snps': 37397}. Best is trial 22 with value: 0.31340379818889347.
[I 2025-12-06 00:52:15,110] Trial 54 finished with value: 0.30808872815997124 and parameters: {'model_type': 'mlp', 'hidden_dims': '[256, 128]', 'dropout': 0.3274781230032679, 'batch_norm': True, 'lr': 0.000278649885821613, 'weight_decay': 4.801012868415369e-06, 'epochs': 99, 'loss': 'mse', 'optimizer': 'adam', 'graph_mode': 'off', 'use_snp_selection': True, 'num_snps': 51553}. Best is trial 22 with value: 0.31340379818889347.
[I 2025-12-06 00:53:08,084] Trial 55 finished with value: 0.31013372353650526 and parameters: {'model_type': 'mlp', 'hidden_dims': '[512, 64]', 'dropout': 0.11842715950177626, 'batch_norm': True, 'lr': 0.00044082080815148304, 'weight_decay': 0.000492872150456735, 'epochs': 274, 'loss': 'mse', 'optimizer': 'adam', 'graph_mode': 'off', 'use_snp_selection': False}. Best is trial 22 with value: 0.31340379818889347.
[I 2025-12-06 00:54:00,896] Trial 56 finished with value: 0.28771064493004694 and parameters: {'model_type': 'mlp', 'hidden_dims': '[512, 64]', 'dropout': 0.3002515420275374, 'batch_norm': True, 'lr': 2.4503369464133085e-06, 'weight_decay': 0.00019973560963595092, 'epochs': 272, 'loss': 'mse', 'optimizer': 'adam', 'graph_mode': 'off', 'use_snp_selection': False}. Best is trial 22 with value: 0.31340379818889347.
[I 2025-12-06 00:54:45,885] Trial 57 finished with value: 0.3050764167069908 and parameters: {'model_type': 'mlp', 'hidden_dims': '[512, 64]', 'dropout': 0.4047059860673202, 'batch_norm': True, 'lr': 0.0004140232357001067, 'weight_decay': 0.00041855219172414593, 'epochs': 227, 'loss': 'mse', 'optimizer': 'adam', 'graph_mode': 'off', 'use_snp_selection': False}. Best is trial 22 with value: 0.31340379818889347.
[I 2025-12-06 00:55:26,266] Trial 58 finished with value: 0.3021979651933977 and parameters: {'model_type': 'mlp', 'hidden_dims': '[512, 64]', 'dropout': 0.21353549836939695, 'batch_norm': False, 'lr': 5.450410250833066e-05, 'weight_decay': 0.0007108026317820044, 'epochs': 162, 'loss': 'mse', 'optimizer': 'adam', 'graph_mode': 'off', 'use_snp_selection': True, 'num_snps': 26798}. Best is trial 22 with value: 0.31340379818889347.
[I 2025-12-06 00:56:21,843] Trial 59 finished with value: 0.3107154596787307 and parameters: {'model_type': 'mlp', 'hidden_dims': '[512, 64]', 'dropout': 0.16672622397367892, 'batch_norm': True, 'lr': 0.0006493671851029405, 'weight_decay': 8.360915008036101e-05, 'epochs': 288, 'loss': 'mse', 'optimizer': 'adam', 'graph_mode': 'off', 'use_snp_selection': False}. Best is trial 22 with value: 0.31340379818889347.
[I 2025-12-06 00:56:40,626] Trial 60 finished with value: 0.30231697459344514 and parameters: {'model_type': 'mlp', 'hidden_dims': '[128, 64]', 'dropout': 0.23633200013554223, 'batch_norm': True, 'lr': 0.0006427719697044512, 'weight_decay': 8.750023091265336e-05, 'epochs': 279, 'loss': 'mse', 'optimizer': 'adam', 'graph_mode': 'off', 'use_snp_selection': False}. Best is trial 22 with value: 0.31340379818889347.
[I 2025-12-06 00:57:37,552] Trial 61 finished with value: 0.3066514255624309 and parameters: {'model_type': 'mlp', 'hidden_dims': '[512, 64]', 'dropout': 0.16780273674309815, 'batch_norm': True, 'lr': 0.000448307540127346, 'weight_decay': 5.093375317359743e-05, 'epochs': 295, 'loss': 'mse', 'optimizer': 'adam', 'graph_mode': 'off', 'use_snp_selection': False}. Best is trial 22 with value: 0.31340379818889347.
[I 2025-12-06 00:58:33,054] Trial 62 finished with value: 0.30689947760122605 and parameters: {'model_type': 'mlp', 'hidden_dims': '[512, 64]', 'dropout': 0.12035735281724207, 'batch_norm': True, 'lr': 0.0007318267840184853, 'weight_decay': 0.00018329597243312368, 'epochs': 287, 'loss': 'mse', 'optimizer': 'adam', 'graph_mode': 'off', 'use_snp_selection': False}. Best is trial 22 with value: 0.31340379818889347.
[I 2025-12-06 00:59:26,172] Trial 63 finished with value: 0.3082630470396066 and parameters: {'model_type': 'mlp', 'hidden_dims': '[512, 64]', 'dropout': 0.13791638470858744, 'batch_norm': True, 'lr': 0.0009554846151997609, 'weight_decay': 0.0006587001962840062, 'epochs': 273, 'loss': 'mse', 'optimizer': 'adam', 'graph_mode': 'off', 'use_snp_selection': False}. Best is trial 22 with value: 0.31340379818889347.
[I 2025-12-06 01:00:15,781] Trial 64 finished with value: 0.30641002620293306 and parameters: {'model_type': 'mlp', 'hidden_dims': '[512, 64]', 'dropout': 0.1584246502851591, 'batch_norm': True, 'lr': 3.465020033287137e-05, 'weight_decay': 0.00041480848700463553, 'epochs': 253, 'loss': 'mse', 'optimizer': 'adam', 'graph_mode': 'off', 'use_snp_selection': False}. Best is trial 22 with value: 0.31340379818889347.
[I 2025-12-06 01:00:37,980] Trial 65 finished with value: 0.3021304605991344 and parameters: {'model_type': 'mlp', 'hidden_dims': '[256, 128, 64]', 'dropout': 0.3641097321732469, 'batch_norm': True, 'lr': 0.0003162976856457791, 'weight_decay': 1.1907753153956422e-05, 'epochs': 189, 'loss': 'mse', 'optimizer': 'adam', 'graph_mode': 'off', 'use_snp_selection': False}. Best is trial 22 with value: 0.31340379818889347.
[I 2025-12-06 01:00:53,447] Trial 66 finished with value: 0.30696941422351254 and parameters: {'model_type': 'mlp', 'hidden_dims': '[128, 64]', 'dropout': 0.17966173693627435, 'batch_norm': True, 'lr': 0.0006213956767557865, 'weight_decay': 3.243957086426113e-07, 'epochs': 213, 'loss': 'mse', 'optimizer': 'adam', 'graph_mode': 'off', 'use_snp_selection': False}. Best is trial 22 with value: 0.31340379818889347.
[I 2025-12-06 01:01:14,001] Trial 67 finished with value: 0.30585406303479934 and parameters: {'model_type': 'mlp', 'hidden_dims': '[512, 256]', 'dropout': 0.2842173857674439, 'batch_norm': True, 'lr': 9.460769314438148e-05, 'weight_decay': 4.021938392145642e-05, 'epochs': 87, 'loss': 'mse', 'optimizer': 'adam', 'graph_mode': 'off', 'use_snp_selection': False}. Best is trial 22 with value: 0.31340379818889347.
[I 2025-12-06 01:01:42,588] Trial 68 finished with value: 0.3077709695002274 and parameters: {'model_type': 'mlp', 'hidden_dims': '[512, 64]', 'dropout': 0.11578652354949996, 'batch_norm': True, 'lr': 0.00035086135646824945, 'weight_decay': 0.00024097862381033044, 'epochs': 133, 'loss': 'mse', 'optimizer': 'adam', 'graph_mode': 'off', 'use_snp_selection': False}. Best is trial 22 with value: 0.31340379818889347.
[I 2025-12-06 01:02:23,086] Trial 69 finished with value: 0.30909537915011237 and parameters: {'model_type': 'mlp', 'hidden_dims': '[128, 64]', 'dropout': 0.19638694918951796, 'batch_norm': False, 'lr': 0.00012819380640220242, 'weight_decay': 0.0001072492655160023, 'epochs': 112, 'loss': 'mse', 'optimizer': 'adam', 'graph_mode': 'off', 'use_snp_selection': True, 'num_snps': 52937}. Best is trial 22 with value: 0.31340379818889347.
[I 2025-12-06 01:02:49,635] Trial 70 finished with value: 0.2992220130468346 and parameters: {'model_type': 'mlp', 'hidden_dims': '[256, 128]', 'dropout': 0.3232957529293861, 'batch_norm': True, 'lr': 2.5215677563792276e-05, 'weight_decay': 1.9284925734719488e-07, 'epochs': 240, 'loss': 'mse', 'optimizer': 'adam', 'graph_mode': 'off', 'use_snp_selection': False}. Best is trial 22 with value: 0.31340379818889347.
[I 2025-12-06 01:03:49,334] Trial 71 finished with value: 0.30627615272267855 and parameters: {'model_type': 'mlp', 'hidden_dims': '[512, 64]', 'dropout': 0.13859979110524068, 'batch_norm': True, 'lr': 0.0002104426448058685, 'weight_decay': 2.661707688717343e-05, 'epochs': 311, 'loss': 'mae', 'optimizer': 'adam', 'graph_mode': 'off', 'use_snp_selection': False}. Best is trial 22 with value: 0.31340379818889347.
[I 2025-12-06 01:04:08,799] Trial 72 finished with value: 0.3060991223580932 and parameters: {'model_type': 'mlp', 'hidden_dims': '[128, 64]', 'dropout': 0.10288928179856097, 'batch_norm': True, 'lr': 0.0004793922981476433, 'weight_decay': 6.871798380365007e-06, 'epochs': 288, 'loss': 'mae', 'optimizer': 'adam', 'graph_mode': 'off', 'use_snp_selection': False}. Best is trial 22 with value: 0.31340379818889347.
[I 2025-12-06 01:05:12,399] Trial 73 finished with value: 0.30750059483949427 and parameters: {'model_type': 'mlp', 'hidden_dims': '[512, 256]', 'dropout': 0.13165540330819872, 'batch_norm': True, 'lr': 0.00027713621767569494, 'weight_decay': 2.0201838799738247e-05, 'epochs': 331, 'loss': 'mae', 'optimizer': 'adam', 'graph_mode': 'off', 'use_snp_selection': False}. Best is trial 22 with value: 0.31340379818889347.
[I 2025-12-06 01:05:45,500] Trial 74 finished with value: 0.3098762110329063 and parameters: {'model_type': 'mlp', 'hidden_dims': '[256, 128, 64]', 'dropout': 0.25465139090767075, 'batch_norm': True, 'lr': 6.634099293555613e-05, 'weight_decay': 8.844745434206151e-06, 'epochs': 307, 'loss': 'mse', 'optimizer': 'adam', 'graph_mode': 'off', 'use_snp_selection': False}. Best is trial 22 with value: 0.31340379818889347.
