[I 2025-12-05 15:42:38,032] Trial 104 finished with value: 0.28281850749647586 and parameters: {'model_type': 'mlp', 'hidden_dims': '[128, 64]', 'dropout': 0.5138931399352316, 'batch_norm': False, 'lr': 1.1656350660713667e-05, 'weight_decay': 1.2207366189557582e-07, 'epochs': 217, 'loss': 'mse', 'optimizer': 'adam', 'graph_mode': 'off', 'use_snp_selection': False}. Best is trial 87 with value: 0.2857285364616648.
[I 2025-12-05 15:42:53,695] Trial 105 finished with value: 0.28018993594353614 and parameters: {'model_type': 'mlp', 'hidden_dims': '[128, 64]', 'dropout': 0.5142980285956414, 'batch_norm': False, 'lr': 1.1725234688284811e-05, 'weight_decay': 1.202934902843536e-07, 'epochs': 218, 'loss': 'mse', 'optimizer': 'adam', 'graph_mode': 'off', 'use_snp_selection': False}. Best is trial 87 with value: 0.2857285364616648.
[I 2025-12-05 15:43:08,154] Trial 106 finished with value: 0.2807306645628955 and parameters: {'model_type': 'mlp', 'hidden_dims': '[128, 64]', 'dropout': 0.5596632877404594, 'batch_norm': False, 'lr': 9.553605274444218e-06, 'weight_decay': 1.029732692504004e-07, 'epochs': 194, 'loss': 'mse', 'optimizer': 'adam', 'graph_mode': 'off', 'use_snp_selection': False}. Best is trial 87 with value: 0.2857285364616648.
[I 2025-12-05 15:43:24,526] Trial 107 finished with value: 0.25446323554457323 and parameters: {'model_type': 'mlp', 'hidden_dims': '[128, 64]', 'dropout': 0.45481898467895493, 'batch_norm': True, 'lr': 1.3747622644774373e-05, 'weight_decay': 1.8634458968351777e-07, 'epochs': 230, 'loss': 'mse', 'optimizer': 'adam', 'graph_mode': 'off', 'use_snp_selection': False}. Best is trial 87 with value: 0.2857285364616648.
[I 2025-12-05 15:43:41,718] Trial 108 finished with value: 0.2743128271555031 and parameters: {'model_type': 'mlp', 'hidden_dims': '[128, 64]', 'dropout': 0.34254370519432326, 'batch_norm': False, 'lr': 1.535628328989742e-05, 'weight_decay': 2.880335712553982e-07, 'epochs': 247, 'loss': 'mse', 'optimizer': 'adam', 'graph_mode': 'off', 'use_snp_selection': False}. Best is trial 87 with value: 0.2857285364616648.
[I 2025-12-05 15:43:56,874] Trial 109 finished with value: 0.2826032216915645 and parameters: {'model_type': 'mlp', 'hidden_dims': '[128, 64]', 'dropout': 0.4800861482031449, 'batch_norm': False, 'lr': 2.213691705415389e-05, 'weight_decay': 1.5228152513422247e-07, 'epochs': 208, 'loss': 'mse', 'optimizer': 'adam', 'graph_mode': 'off', 'use_snp_selection': False}. Best is trial 87 with value: 0.2857285364616648.
[I 2025-12-05 15:44:29,742] Trial 110 finished with value: 0.2749764835839645 and parameters: {'model_type': 'mlp', 'hidden_dims': '[128, 64]', 'dropout': 0.531113586773382, 'batch_norm': False, 'lr': 6.294102514242098e-06, 'weight_decay': 1.536637837533958e-07, 'epochs': 209, 'loss': 'mse', 'optimizer': 'adam', 'graph_mode': 'off', 'use_snp_selection': True, 'num_snps': 26398}. Best is trial 87 with value: 0.2857285364616648.
[I 2025-12-05 15:44:44,490] Trial 111 finished with value: 0.2818046882820966 and parameters: {'model_type': 'mlp', 'hidden_dims': '[128, 64]', 'dropout': 0.4742094077890854, 'batch_norm': False, 'lr': 2.184518154567883e-05, 'weight_decay': 1.3353566685726954e-07, 'epochs': 199, 'loss': 'mse', 'optimizer': 'adam', 'graph_mode': 'off', 'use_snp_selection': False}. Best is trial 87 with value: 0.2857285364616648.
[I 2025-12-05 15:44:57,570] Trial 112 finished with value: 0.2832369122446488 and parameters: {'model_type': 'mlp', 'hidden_dims': '[128, 64]', 'dropout': 0.47737647063940386, 'batch_norm': False, 'lr': 7.608006795146336e-06, 'weight_decay': 1.3136232190338995e-07, 'epochs': 167, 'loss': 'mse', 'optimizer': 'adam', 'graph_mode': 'off', 'use_snp_selection': False}. Best is trial 87 with value: 0.2857285364616648.
[I 2025-12-05 15:45:10,559] Trial 113 finished with value: 0.28339150695956344 and parameters: {'model_type': 'mlp', 'hidden_dims': '[128, 64]', 'dropout': 0.4837868459131725, 'batch_norm': False, 'lr': 7.07215974483128e-06, 'weight_decay': 1.3419589517237722e-07, 'epochs': 166, 'loss': 'mse', 'optimizer': 'adam', 'graph_mode': 'off', 'use_snp_selection': False}. Best is trial 87 with value: 0.2857285364616648.
[I 2025-12-05 15:45:44,920] Trial 114 finished with value: 0.2852748804116202 and parameters: {'model_type': 'mlp', 'hidden_dims': '[512, 256]', 'dropout': 0.48651552940365345, 'batch_norm': False, 'lr': 7.254024287250346e-06, 'weight_decay': 2.3907119552043253e-07, 'epochs': 167, 'loss': 'mse', 'optimizer': 'adam', 'graph_mode': 'off', 'use_snp_selection': False}. Best is trial 87 with value: 0.2857285364616648.
[I 2025-12-05 15:46:19,538] Trial 115 finished with value: 0.28361480095935104 and parameters: {'model_type': 'mlp', 'hidden_dims': '[512, 256]', 'dropout': 0.4840712549056981, 'batch_norm': False, 'lr': 7.628377241477281e-06, 'weight_decay': 2.392959822390245e-07, 'epochs': 168, 'loss': 'mse', 'optimizer': 'adam', 'graph_mode': 'off', 'use_snp_selection': False}. Best is trial 87 with value: 0.2857285364616648.
[I 2025-12-05 15:46:54,150] Trial 116 finished with value: 0.28477476154936887 and parameters: {'model_type': 'mlp', 'hidden_dims': '[512, 256]', 'dropout': 0.48660179981266494, 'batch_norm': False, 'lr': 4.902977087804899e-06, 'weight_decay': 2.246445844732172e-07, 'epochs': 168, 'loss': 'mse', 'optimizer': 'adam', 'graph_mode': 'off', 'use_snp_selection': False}. Best is trial 87 with value: 0.2857285364616648.
[I 2025-12-05 15:47:28,282] Trial 117 finished with value: 0.2847289917637671 and parameters: {'model_type': 'mlp', 'hidden_dims': '[512, 256]', 'dropout': 0.48113694400962526, 'batch_norm': False, 'lr': 4.892095177978982e-06, 'weight_decay': 2.416339677660219e-07, 'epochs': 165, 'loss': 'mse', 'optimizer': 'adam', 'graph_mode': 'off', 'use_snp_selection': False}. Best is trial 87 with value: 0.2857285364616648.
[I 2025-12-05 15:48:02,594] Trial 118 finished with value: 0.28449011812220715 and parameters: {'model_type': 'mlp', 'hidden_dims': '[512, 256]', 'dropout': 0.49130219735453695, 'batch_norm': False, 'lr': 4.8361646030102194e-06, 'weight_decay': 2.463137147631589e-07, 'epochs': 166, 'loss': 'mse', 'optimizer': 'adam', 'graph_mode': 'off', 'use_snp_selection': False}. Best is trial 87 with value: 0.2857285364616648.
[I 2025-12-05 15:48:35,843] Trial 119 finished with value: 0.2845191822446187 and parameters: {'model_type': 'mlp', 'hidden_dims': '[512, 256]', 'dropout': 0.4885939563242423, 'batch_norm': False, 'lr': 4.7550274293006515e-06, 'weight_decay': 2.572563943547961e-07, 'epochs': 160, 'loss': 'mse', 'optimizer': 'adam', 'graph_mode': 'off', 'use_snp_selection': False}. Best is trial 87 with value: 0.2857285364616648.
[I 2025-12-05 15:49:10,718] Trial 120 finished with value: 0.2683855050600659 and parameters: {'model_type': 'mlp', 'hidden_dims': '[512, 256]', 'dropout': 0.4885788461083581, 'batch_norm': True, 'lr': 4.935087102337073e-06, 'weight_decay': 4.08110176069861e-07, 'epochs': 168, 'loss': 'mse', 'optimizer': 'adam', 'graph_mode': 'off', 'use_snp_selection': False}. Best is trial 87 with value: 0.2857285364616648.
[I 2025-12-05 15:49:42,435] Trial 121 finished with value: 0.2831754186147532 and parameters: {'model_type': 'mlp', 'hidden_dims': '[512, 256]', 'dropout': 0.43849762800803954, 'batch_norm': False, 'lr': 7.370399471742669e-06, 'weight_decay': 2.454820483920581e-07, 'epochs': 151, 'loss': 'mse', 'optimizer': 'adam', 'graph_mode': 'off', 'use_snp_selection': False}. Best is trial 87 with value: 0.2857285364616648.
[I 2025-12-05 15:50:14,982] Trial 122 finished with value: 0.2849775339510499 and parameters: {'model_type': 'mlp', 'hidden_dims': '[512, 256]', 'dropout': 0.43351999808080927, 'batch_norm': False, 'lr': 3.889407434753823e-06, 'weight_decay': 2.551634001757684e-07, 'epochs': 156, 'loss': 'mse', 'optimizer': 'adam', 'graph_mode': 'off', 'use_snp_selection': False}. Best is trial 87 with value: 0.2857285364616648.
[I 2025-12-05 15:50:48,913] Trial 123 finished with value: 0.28534626412956143 and parameters: {'model_type': 'mlp', 'hidden_dims': '[512, 256]', 'dropout': 0.5007572556293646, 'batch_norm': False, 'lr': 4.151650849859159e-06, 'weight_decay': 2.9959508814249157e-07, 'epochs': 164, 'loss': 'mse', 'optimizer': 'adam', 'graph_mode': 'off', 'use_snp_selection': False}. Best is trial 87 with value: 0.2857285364616648.
[I 2025-12-05 15:51:21,604] Trial 124 finished with value: 0.283766547105912 and parameters: {'model_type': 'mlp', 'hidden_dims': '[512, 256]', 'dropout': 0.5012482901193642, 'batch_norm': False, 'lr': 4.25320124118519e-06, 'weight_decay': 5.720897815077717e-07, 'epochs': 157, 'loss': 'mse', 'optimizer': 'adam', 'graph_mode': 'off', 'use_snp_selection': False}. Best is trial 87 with value: 0.2857285364616648.
[I 2025-12-05 15:51:54,488] Trial 125 finished with value: 0.2825325734170317 and parameters: {'model_type': 'mlp', 'hidden_dims': '[512, 256]', 'dropout': 0.5004976731139656, 'batch_norm': False, 'lr': 4.1416005325152214e-06, 'weight_decay': 3.997206414390225e-07, 'epochs': 158, 'loss': 'mse', 'optimizer': 'adam', 'graph_mode': 'off', 'use_snp_selection': False}. Best is trial 87 with value: 0.2857285364616648.
[I 2025-12-05 15:52:24,215] Trial 126 finished with value: 0.28489825015586967 and parameters: {'model_type': 'mlp', 'hidden_dims': '[512, 256]', 'dropout': 0.4940816383323823, 'batch_norm': False, 'lr': 4.9171210101200945e-06, 'weight_decay': 5.599615868938219e-07, 'epochs': 140, 'loss': 'mse', 'optimizer': 'adam', 'graph_mode': 'off', 'use_snp_selection': False}. Best is trial 87 with value: 0.2857285364616648.
[I 2025-12-05 15:52:53,755] Trial 127 finished with value: 0.28613215465008224 and parameters: {'model_type': 'mlp', 'hidden_dims': '[512, 256]', 'dropout': 0.49531824343755015, 'batch_norm': False, 'lr': 5.729730308457497e-06, 'weight_decay': 5.55278351720784e-07, 'epochs': 139, 'loss': 'mse', 'optimizer': 'adam', 'graph_mode': 'off', 'use_snp_selection': False}. Best is trial 127 with value: 0.28613215465008224.
[I 2025-12-05 15:53:24,626] Trial 128 finished with value: 0.2848117717448613 and parameters: {'model_type': 'mlp', 'hidden_dims': '[512, 256]', 'dropout': 0.45775422082691253, 'batch_norm': False, 'lr': 5.574967194397667e-06, 'weight_decay': 4.5519175586388785e-07, 'epochs': 147, 'loss': 'mse', 'optimizer': 'adam', 'graph_mode': 'off', 'use_snp_selection': False}. Best is trial 127 with value: 0.28613215465008224.
[I 2025-12-05 15:53:54,120] Trial 129 finished with value: 0.28489139777477257 and parameters: {'model_type': 'mlp', 'hidden_dims': '[512, 256]', 'dropout': 0.45776572010836203, 'batch_norm': False, 'lr': 5.482055682151056e-06, 'weight_decay': 4.772504271286858e-07, 'epochs': 139, 'loss': 'mse', 'optimizer': 'adam', 'graph_mode': 'off', 'use_snp_selection': False}. Best is trial 127 with value: 0.28613215465008224.
[I 2025-12-05 15:54:24,437] Trial 130 finished with value: 0.2861290899435946 and parameters: {'model_type': 'mlp', 'hidden_dims': '[512, 256]', 'dropout': 0.4543717843616435, 'batch_norm': False, 'lr': 5.635203390883895e-06, 'weight_decay': 6.475904787769985e-07, 'epochs': 143, 'loss': 'mse', 'optimizer': 'adam', 'graph_mode': 'off', 'use_snp_selection': False}. Best is trial 127 with value: 0.28613215465008224.
[I 2025-12-05 15:54:54,206] Trial 131 finished with value: 0.2829147384980268 and parameters: {'model_type': 'mlp', 'hidden_dims': '[512, 256]', 'dropout': 0.4495038127557988, 'batch_norm': False, 'lr': 5.452345217159061e-06, 'weight_decay': 4.992587562127155e-07, 'epochs': 140, 'loss': 'mse', 'optimizer': 'adam', 'graph_mode': 'off', 'use_snp_selection': False}. Best is trial 127 with value: 0.28613215465008224.
[I 2025-12-05 15:55:25,702] Trial 132 finished with value: 0.2834597531313058 and parameters: {'model_type': 'mlp', 'hidden_dims': '[512, 256]', 'dropout': 0.4321166530987878, 'batch_norm': False, 'lr': 2.574448776998509e-06, 'weight_decay': 6.606717881374463e-07, 'epochs': 150, 'loss': 'mse', 'optimizer': 'adam', 'graph_mode': 'off', 'use_snp_selection': False}. Best is trial 127 with value: 0.28613215465008224.
[I 2025-12-05 15:55:54,917] Trial 133 finished with value: 0.28612890156971915 and parameters: {'model_type': 'mlp', 'hidden_dims': '[512, 256]', 'dropout': 0.4210544906203806, 'batch_norm': False, 'lr': 3.530432055539215e-06, 'weight_decay': 9.862546211491615e-07, 'epochs': 137, 'loss': 'mse', 'optimizer': 'adam', 'graph_mode': 'off', 'use_snp_selection': False}. Best is trial 127 with value: 0.28613215465008224.
[I 2025-12-05 15:56:22,777] Trial 134 finished with value: 0.2810931440924474 and parameters: {'model_type': 'mlp', 'hidden_dims': '[512, 256]', 'dropout': 0.45778887242533645, 'batch_norm': False, 'lr': 3.5322238098741576e-06, 'weight_decay': 9.102161656606785e-07, 'epochs': 129, 'loss': 'mse', 'optimizer': 'adam', 'graph_mode': 'off', 'use_snp_selection': False}. Best is trial 127 with value: 0.28613215465008224.
[I 2025-12-05 15:56:52,196] Trial 135 finished with value: 0.2842058905456742 and parameters: {'model_type': 'mlp', 'hidden_dims': '[512, 256]', 'dropout': 0.40666331849541343, 'batch_norm': False, 'lr': 5.93417877631012e-06, 'weight_decay': 6.088237029181155e-07, 'epochs': 138, 'loss': 'mse', 'optimizer': 'adam', 'graph_mode': 'off', 'use_snp_selection': False}. Best is trial 127 with value: 0.28613215465008224.
[I 2025-12-05 15:57:22,902] Trial 136 finished with value: 0.28204458952285727 and parameters: {'model_type': 'mlp', 'hidden_dims': '[512, 256]', 'dropout': 0.4242579844135322, 'batch_norm': False, 'lr': 2.254991687851227e-06, 'weight_decay': 3.14574058610732e-07, 'epochs': 145, 'loss': 'mse', 'optimizer': 'adam', 'graph_mode': 'off', 'use_snp_selection': False}. Best is trial 127 with value: 0.28613215465008224.
[I 2025-12-05 15:57:50,010] Trial 137 finished with value: 0.28346979126592897 and parameters: {'model_type': 'mlp', 'hidden_dims': '[512, 256]', 'dropout': 0.43710397072579243, 'batch_norm': False, 'lr': 3.18553954044395e-06, 'weight_decay': 4.794809043601542e-07, 'epochs': 125, 'loss': 'mse', 'optimizer': 'adam', 'graph_mode': 'off', 'use_snp_selection': False}. Best is trial 127 with value: 0.28613215465008224.
[I 2025-12-05 15:58:47,881] Trial 138 finished with value: 0.2873714305310223 and parameters: {'model_type': 'mlp', 'hidden_dims': '[512, 256]', 'dropout': 0.41828455830189654, 'batch_norm': False, 'lr': 5.410907750793963e-06, 'weight_decay': 7.851536054998913e-07, 'epochs': 154, 'loss': 'mse', 'optimizer': 'adam', 'graph_mode': 'off', 'use_snp_selection': True, 'num_snps': 51266}. Best is trial 138 with value: 0.2873714305310223.
[I 2025-12-05 15:59:46,178] Trial 139 finished with value: 0.2850069751620189 and parameters: {'model_type': 'mlp', 'hidden_dims': '[512, 256]', 'dropout': 0.4213557482816926, 'batch_norm': False, 'lr': 3.796813015114078e-06, 'weight_decay': 7.815236742014993e-07, 'epochs': 151, 'loss': 'mse', 'optimizer': 'adam', 'graph_mode': 'off', 'use_snp_selection': True, 'num_snps': 52405}. Best is trial 138 with value: 0.2873714305310223.
[I 2025-12-05 16:00:42,972] Trial 140 finished with value: 0.286931384227509 and parameters: {'model_type': 'mlp', 'hidden_dims': '[512, 256]', 'dropout': 0.421577772125177, 'batch_norm': False, 'lr': 4.020987247222749e-06, 'weight_decay': 8.379513214121737e-07, 'epochs': 147, 'loss': 'mse', 'optimizer': 'adam', 'graph_mode': 'off', 'use_snp_selection': True, 'num_snps': 51239}. Best is trial 138 with value: 0.2873714305310223.
[I 2025-12-05 16:01:39,515] Trial 141 finished with value: 0.2865041530853881 and parameters: {'model_type': 'mlp', 'hidden_dims': '[512, 256]', 'dropout': 0.41722914850210946, 'batch_norm': False, 'lr': 3.717560386794281e-06, 'weight_decay': 8.62404063074262e-07, 'epochs': 144, 'loss': 'mse', 'optimizer': 'adam', 'graph_mode': 'off', 'use_snp_selection': True, 'num_snps': 51108}. Best is trial 138 with value: 0.2873714305310223.
[I 2025-12-05 16:02:35,815] Trial 142 finished with value: 0.2854495254213412 and parameters: {'model_type': 'mlp', 'hidden_dims': '[512, 256]', 'dropout': 0.3875295466266072, 'batch_norm': False, 'lr': 3.7394021023680137e-06, 'weight_decay': 7.771299010572012e-07, 'epochs': 145, 'loss': 'mse', 'optimizer': 'adam', 'graph_mode': 'off', 'use_snp_selection': True, 'num_snps': 50563}. Best is trial 138 with value: 0.2873714305310223.
[I 2025-12-05 16:03:33,271] Trial 143 finished with value: 0.2832684131481752 and parameters: {'model_type': 'mlp', 'hidden_dims': '[512, 256]', 'dropout': 0.3732427178641144, 'batch_norm': False, 'lr': 3.800655980319433e-06, 'weight_decay': 7.942273394102369e-07, 'epochs': 145, 'loss': 'mse', 'optimizer': 'adam', 'graph_mode': 'off', 'use_snp_selection': True, 'num_snps': 52072}. Best is trial 138 with value: 0.2873714305310223.
[I 2025-12-05 16:04:28,262] Trial 144 finished with value: 0.28378278882629426 and parameters: {'model_type': 'mlp', 'hidden_dims': '[512, 256]', 'dropout': 0.39520772393848375, 'batch_norm': False, 'lr': 3.0931215505196853e-06, 'weight_decay': 1.188461894674613e-06, 'epochs': 134, 'loss': 'mse', 'optimizer': 'adam', 'graph_mode': 'off', 'use_snp_selection': True, 'num_snps': 51149}. Best is trial 138 with value: 0.2873714305310223.
[I 2025-12-05 16:05:27,710] Trial 145 finished with value: 0.27504096450964277 and parameters: {'model_type': 'mlp', 'hidden_dims': '[512, 256]', 'dropout': 0.3868532498921702, 'batch_norm': False, 'lr': 1.821279733130589e-06, 'weight_decay': 1.0322106601977781e-06, 'epochs': 154, 'loss': 'mse', 'optimizer': 'adam', 'graph_mode': 'off', 'use_snp_selection': True, 'num_snps': 53231}. Best is trial 138 with value: 0.2873714305310223.
[I 2025-12-05 16:06:19,601] Trial 146 finished with value: 0.28534843115213426 and parameters: {'model_type': 'mlp', 'hidden_dims': '[512, 256]', 'dropout': 0.41760611196168385, 'batch_norm': False, 'lr': 5.580101181561472e-06, 'weight_decay': 1.6606436460369581e-06, 'epochs': 140, 'loss': 'mse', 'optimizer': 'adam', 'graph_mode': 'off', 'use_snp_selection': True, 'num_snps': 45302}. Best is trial 138 with value: 0.2873714305310223.
[I 2025-12-05 16:07:09,707] Trial 147 finished with value: 0.281069500460257 and parameters: {'model_type': 'mlp', 'hidden_dims': '[512, 256]', 'dropout': 0.4152254738902349, 'batch_norm': False, 'lr': 4.022932054599399e-06, 'weight_decay': 1.6186744172979692e-06, 'epochs': 123, 'loss': 'mse', 'optimizer': 'adam', 'graph_mode': 'off', 'use_snp_selection': True, 'num_snps': 45766}. Best is trial 138 with value: 0.2873714305310223.
[I 2025-12-05 16:08:06,753] Trial 148 finished with value: 0.2751941290326353 and parameters: {'model_type': 'mlp', 'hidden_dims': '[512, 256]', 'dropout': 0.4049995806073072, 'batch_norm': True, 'lr': 2.650957968808916e-06, 'weight_decay': 9.189512341957762e-07, 'epochs': 136, 'loss': 'mse', 'optimizer': 'adam', 'graph_mode': 'off', 'use_snp_selection': True, 'num_snps': 53674}. Best is trial 138 with value: 0.2873714305310223.
[I 2025-12-05 16:08:55,586] Trial 149 finished with value: 0.2813690694888565 and parameters: {'model_type': 'mlp', 'hidden_dims': '[512, 256]', 'dropout': 0.4186630880898766, 'batch_norm': False, 'lr': 3.4813673662280355e-06, 'weight_decay': 6.297149206233354e-07, 'epochs': 141, 'loss': 'mse', 'optimizer': 'adam', 'graph_mode': 'off', 'use_snp_selection': True, 'num_snps': 40346}. Best is trial 138 with value: 0.2873714305310223.
[I 2025-12-05 16:09:54,679] Trial 0 finished with value: 0.27132994375931807 and parameters: {'model_type': 'mlp', 'hidden_dims': '[128, 64]', 'dropout': 0.199031432379812, 'batch_norm': True, 'lr': 1.8408544111075837e-06, 'weight_decay': 5.5136510071208614e-05, 'epochs': 336, 'loss': 'mae', 'optimizer': 'adam', 'graph_mode': 'off', 'use_snp_selection': True, 'num_snps': 43862}. Best is trial 0 with value: 0.27132994375931807.
[I 2025-12-05 16:10:21,385] Trial 1 finished with value: 0.2876650556647658 and parameters: {'model_type': 'mlp', 'hidden_dims': '[256, 128]', 'dropout': 0.4370668075331726, 'batch_norm': True, 'lr': 7.133471581159139e-05, 'weight_decay': 1.128633586803549e-05, 'epochs': 242, 'loss': 'mae', 'optimizer': 'adam', 'graph_mode': 'off', 'use_snp_selection': False}. Best is trial 1 with value: 0.2876650556647658.
[I 2025-12-05 16:10:48,207] Trial 2 finished with value: 0.2618963174109756 and parameters: {'model_type': 'mlp', 'hidden_dims': '[256, 128, 64]', 'dropout': 0.41314357415569625, 'batch_norm': False, 'lr': 3.952233718592101e-06, 'weight_decay': 0.00026754769258252603, 'epochs': 149, 'loss': 'mse', 'optimizer': 'adam', 'graph_mode': 'off', 'use_snp_selection': True, 'num_snps': 11571}. Best is trial 1 with value: 0.2876650556647658.
[I 2025-12-05 16:11:48,908] Trial 3 finished with value: 0.29705935264052585 and parameters: {'model_type': 'mlp', 'hidden_dims': '[512, 64]', 'dropout': 0.5938127374509361, 'batch_norm': False, 'lr': 5.67704586114731e-06, 'weight_decay': 2.4518087630137052e-05, 'epochs': 320, 'loss': 'mae', 'optimizer': 'adam', 'graph_mode': 'off', 'use_snp_selection': False}. Best is trial 3 with value: 0.29705935264052585.
[I 2025-12-05 16:12:49,805] Trial 4 finished with value: 0.26754059927206914 and parameters: {'model_type': 'mlp', 'hidden_dims': '[512, 128]', 'dropout': 0.25746343592134413, 'batch_norm': True, 'lr': 1.3467657668402788e-06, 'weight_decay': 0.00033087251918647806, 'epochs': 277, 'loss': 'mse', 'optimizer': 'adam', 'graph_mode': 'off', 'use_snp_selection': True, 'num_snps': 36675}. Best is trial 3 with value: 0.29705935264052585.
[I 2025-12-05 16:13:32,962] Trial 5 finished with value: 0.2174620614167278 and parameters: {'model_type': 'mlp', 'hidden_dims': '[512, 64]', 'dropout': 0.38275350994408375, 'batch_norm': True, 'lr': 1.5586664309232824e-06, 'weight_decay': 0.0008227664668621182, 'epochs': 145, 'loss': 'mae', 'optimizer': 'adam', 'graph_mode': 'off', 'use_snp_selection': True, 'num_snps': 32148}. Best is trial 3 with value: 0.29705935264052585.
