[I 2025-12-05 16:13:55,728] Trial 6 finished with value: 0.2961326842697652 and parameters: {'model_type': 'mlp', 'hidden_dims': '[256, 128]', 'dropout': 0.3930109900265879, 'batch_norm': False, 'lr': 4.892964372128395e-05, 'weight_decay': 1.5809549317992182e-06, 'epochs': 199, 'loss': 'mse', 'optimizer': 'adam', 'graph_mode': 'off', 'use_snp_selection': False}. Best is trial 3 with value: 0.29705935264052585.
[I 2025-12-05 16:14:18,013] Trial 7 finished with value: 0.29101257767927985 and parameters: {'model_type': 'mlp', 'hidden_dims': '[512, 256]', 'dropout': 0.15343979219678458, 'batch_norm': True, 'lr': 6.234003099047341e-05, 'weight_decay': 3.894760610535477e-07, 'epochs': 97, 'loss': 'mse', 'optimizer': 'adam', 'graph_mode': 'off', 'use_snp_selection': False}. Best is trial 3 with value: 0.29705935264052585.
[I 2025-12-05 16:15:17,998] Trial 8 finished with value: 0.2931881901493343 and parameters: {'model_type': 'mlp', 'hidden_dims': '[512, 128]', 'dropout': 0.10743001231661406, 'batch_norm': True, 'lr': 0.00023728538449271062, 'weight_decay': 1.7629071578048637e-05, 'epochs': 312, 'loss': 'mae', 'optimizer': 'adam', 'graph_mode': 'off', 'use_snp_selection': False}. Best is trial 3 with value: 0.29705935264052585.
[I 2025-12-05 16:15:53,938] Trial 9 finished with value: 0.29458110019651856 and parameters: {'model_type': 'mlp', 'hidden_dims': '[512, 64]', 'dropout': 0.14505336736221927, 'batch_norm': True, 'lr': 5.8619638388111826e-05, 'weight_decay': 6.200156172669308e-07, 'epochs': 175, 'loss': 'mse', 'optimizer': 'adam', 'graph_mode': 'off', 'use_snp_selection': False}. Best is trial 3 with value: 0.29705935264052585.
[I 2025-12-05 16:16:08,732] Trial 10 finished with value: 0.24134561968893994 and parameters: {'model_type': 'mlp', 'hidden_dims': '[512, 64]', 'dropout': 0.5885461262002587, 'batch_norm': False, 'lr': 8.769366258768696e-06, 'weight_decay': 2.78273193871783e-06, 'epochs': 55, 'loss': 'mae', 'optimizer': 'adam', 'graph_mode': 'off', 'use_snp_selection': False}. Best is trial 3 with value: 0.29705935264052585.
[I 2025-12-05 16:16:34,348] Trial 11 finished with value: 0.2987396751006771 and parameters: {'model_type': 'mlp', 'hidden_dims': '[256, 128]', 'dropout': 0.583942291816117, 'batch_norm': False, 'lr': 1.422933652790185e-05, 'weight_decay': 2.805519019095577e-06, 'epochs': 231, 'loss': 'mse', 'optimizer': 'adam', 'graph_mode': 'off', 'use_snp_selection': False}. Best is trial 11 with value: 0.2987396751006771.
[I 2025-12-05 16:17:00,173] Trial 12 finished with value: 0.29047418266518304 and parameters: {'model_type': 'mlp', 'hidden_dims': '[256, 128]', 'dropout': 0.593097749012682, 'batch_norm': False, 'lr': 1.1374686318732863e-05, 'weight_decay': 1.3081036432574914e-07, 'epochs': 233, 'loss': 'mae', 'optimizer': 'adam', 'graph_mode': 'off', 'use_snp_selection': False}. Best is trial 11 with value: 0.2987396751006771.
[I 2025-12-05 16:17:19,284] Trial 13 finished with value: 0.29908056272083605 and parameters: {'model_type': 'mlp', 'hidden_dims': '[128, 64]', 'dropout': 0.5043641748401543, 'batch_norm': False, 'lr': 1.4304506621636526e-05, 'weight_decay': 4.373608364627903e-05, 'epochs': 285, 'loss': 'mse', 'optimizer': 'adam', 'graph_mode': 'off', 'use_snp_selection': False}. Best is trial 13 with value: 0.29908056272083605.
[I 2025-12-05 16:17:37,680] Trial 14 finished with value: 0.05832714443072155 and parameters: {'model_type': 'mlp', 'hidden_dims': '[128, 64]', 'dropout': 0.48369972861071203, 'batch_norm': False, 'lr': 0.0005290576304499545, 'weight_decay': 7.267863851235743e-05, 'epochs': 271, 'loss': 'mse', 'optimizer': 'adam', 'graph_mode': 'off', 'use_snp_selection': False}. Best is trial 13 with value: 0.29908056272083605.
[I 2025-12-05 16:17:53,584] Trial 15 finished with value: 0.3002097821915434 and parameters: {'model_type': 'mlp', 'hidden_dims': '[128, 64]', 'dropout': 0.49962106881650387, 'batch_norm': False, 'lr': 2.0000715648251612e-05, 'weight_decay': 3.272648898921122e-06, 'epochs': 223, 'loss': 'mse', 'optimizer': 'adam', 'graph_mode': 'off', 'use_snp_selection': False}. Best is trial 15 with value: 0.3002097821915434.
[I 2025-12-05 16:18:12,804] Trial 16 finished with value: 0.29626710753091917 and parameters: {'model_type': 'mlp', 'hidden_dims': '[128, 64]', 'dropout': 0.5034577682173387, 'batch_norm': False, 'lr': 2.1881620604252317e-05, 'weight_decay': 5.098763140321504e-06, 'epochs': 287, 'loss': 'mse', 'optimizer': 'adam', 'graph_mode': 'off', 'use_snp_selection': False}. Best is trial 15 with value: 0.3002097821915434.
[I 2025-12-05 16:18:27,629] Trial 17 finished with value: 0.2953503671363543 and parameters: {'model_type': 'mlp', 'hidden_dims': '[128, 64]', 'dropout': 0.31226206234945486, 'batch_norm': False, 'lr': 0.00012008380777796563, 'weight_decay': 7.847113876390963e-05, 'epochs': 202, 'loss': 'mse', 'optimizer': 'adam', 'graph_mode': 'off', 'use_snp_selection': False}. Best is trial 15 with value: 0.3002097821915434.
[I 2025-12-05 16:19:16,697] Trial 18 finished with value: 0.2960918617663234 and parameters: {'model_type': 'mlp', 'hidden_dims': '[128, 64]', 'dropout': 0.5098431992326697, 'batch_norm': False, 'lr': 2.401812739094555e-05, 'weight_decay': 8.365998717420549e-07, 'epochs': 256, 'loss': 'mse', 'optimizer': 'adam', 'graph_mode': 'off', 'use_snp_selection': True, 'num_snps': 58241}. Best is trial 15 with value: 0.3002097821915434.
[I 2025-12-05 16:20:14,322] Trial 19 finished with value: 0.2929654181047986 and parameters: {'model_type': 'mlp', 'hidden_dims': '[512, 256]', 'dropout': 0.3256078588279646, 'batch_norm': False, 'lr': 4.238115837317623e-06, 'weight_decay': 5.681575780015826e-06, 'epochs': 300, 'loss': 'mse', 'optimizer': 'adam', 'graph_mode': 'off', 'use_snp_selection': False}. Best is trial 15 with value: 0.3002097821915434.
[I 2025-12-05 16:20:30,448] Trial 20 finished with value: 0.29433531460975254 and parameters: {'model_type': 'mlp', 'hidden_dims': '[256, 128, 64]', 'dropout': 0.4700634535452809, 'batch_norm': False, 'lr': 0.00015773359539232408, 'weight_decay': 2.417613357794622e-05, 'epochs': 126, 'loss': 'mse', 'optimizer': 'adam', 'graph_mode': 'off', 'use_snp_selection': False}. Best is trial 15 with value: 0.3002097821915434.
[I 2025-12-05 16:20:56,440] Trial 21 finished with value: 0.29733108934122165 and parameters: {'model_type': 'mlp', 'hidden_dims': '[256, 128]', 'dropout': 0.5405439478908376, 'batch_norm': False, 'lr': 1.4243854206984224e-05, 'weight_decay': 2.4705177402880233e-06, 'epochs': 235, 'loss': 'mse', 'optimizer': 'adam', 'graph_mode': 'off', 'use_snp_selection': False}. Best is trial 15 with value: 0.3002097821915434.
[I 2025-12-05 16:21:11,910] Trial 22 finished with value: 0.29525139814381385 and parameters: {'model_type': 'mlp', 'hidden_dims': '[128, 64]', 'dropout': 0.5433000911885434, 'batch_norm': False, 'lr': 3.1036641924056695e-05, 'weight_decay': 4.905653876075577e-06, 'epochs': 215, 'loss': 'mse', 'optimizer': 'adam', 'graph_mode': 'off', 'use_snp_selection': False}. Best is trial 15 with value: 0.3002097821915434.
[I 2025-12-05 16:21:25,425] Trial 23 finished with value: 0.30220120355319835 and parameters: {'model_type': 'mlp', 'hidden_dims': '[128, 64]', 'dropout': 0.554763843946446, 'batch_norm': False, 'lr': 1.5877985933824004e-05, 'weight_decay': 2.0496148090145926e-07, 'epochs': 177, 'loss': 'mse', 'optimizer': 'adam', 'graph_mode': 'off', 'use_snp_selection': False}. Best is trial 23 with value: 0.30220120355319835.
[I 2025-12-05 16:21:38,632] Trial 24 finished with value: 0.3002705404312776 and parameters: {'model_type': 'mlp', 'hidden_dims': '[128, 64]', 'dropout': 0.4451148193583865, 'batch_norm': False, 'lr': 7.958527539555478e-06, 'weight_decay': 1.9393822607423775e-07, 'epochs': 171, 'loss': 'mse', 'optimizer': 'adam', 'graph_mode': 'off', 'use_snp_selection': False}. Best is trial 23 with value: 0.30220120355319835.
[I 2025-12-05 16:21:51,769] Trial 25 finished with value: 0.2740301871619282 and parameters: {'model_type': 'mlp', 'hidden_dims': '[128, 64]', 'dropout': 0.429589748020634, 'batch_norm': False, 'lr': 2.7820844974987783e-06, 'weight_decay': 1.0821227921406112e-07, 'epochs': 169, 'loss': 'mse', 'optimizer': 'adam', 'graph_mode': 'off', 'use_snp_selection': False}. Best is trial 23 with value: 0.30220120355319835.
[I 2025-12-05 16:22:14,117] Trial 26 finished with value: 0.22940630229671424 and parameters: {'model_type': 'mlp', 'hidden_dims': '[128, 64]', 'dropout': 0.4663205941103356, 'batch_norm': False, 'lr': 6.4340113346154046e-06, 'weight_decay': 3.253094810152716e-07, 'epochs': 113, 'loss': 'mse', 'optimizer': 'adam', 'graph_mode': 'off', 'use_snp_selection': True, 'num_snps': 3842}. Best is trial 23 with value: 0.30220120355319835.
[I 2025-12-05 16:22:27,258] Trial 27 finished with value: 0.29258806433785095 and parameters: {'model_type': 'mlp', 'hidden_dims': '[128, 64]', 'dropout': 0.3658651750272167, 'batch_norm': False, 'lr': 3.708794373669967e-05, 'weight_decay': 1.8399129182845068e-07, 'epochs': 169, 'loss': 'mse', 'optimizer': 'adam', 'graph_mode': 'off', 'use_snp_selection': False}. Best is trial 23 with value: 0.30220120355319835.
[I 2025-12-05 16:22:36,120] Trial 28 finished with value: 0.2717363516648136 and parameters: {'model_type': 'mlp', 'hidden_dims': '[128, 64]', 'dropout': 0.5446517125861267, 'batch_norm': False, 'lr': 7.870106098297548e-06, 'weight_decay': 1.1542978030792464e-06, 'epochs': 86, 'loss': 'mse', 'optimizer': 'adam', 'graph_mode': 'off', 'use_snp_selection': False}. Best is trial 23 with value: 0.30220120355319835.
[I 2025-12-05 16:23:05,313] Trial 29 finished with value: 0.2553341326685447 and parameters: {'model_type': 'mlp', 'hidden_dims': '[128, 64]', 'dropout': 0.4496987681425299, 'batch_norm': False, 'lr': 2.320440320155318e-06, 'weight_decay': 2.8226597177319216e-07, 'epochs': 181, 'loss': 'mse', 'optimizer': 'adam', 'graph_mode': 'off', 'use_snp_selection': True, 'num_snps': 19468}. Best is trial 23 with value: 0.30220120355319835.
[I 2025-12-05 16:23:34,036] Trial 30 finished with value: 0.2952525001164533 and parameters: {'model_type': 'mlp', 'hidden_dims': '[512, 256]', 'dropout': 0.2523135802350327, 'batch_norm': False, 'lr': 2.1420251565133913e-05, 'weight_decay': 4.817113677703904e-07, 'epochs': 135, 'loss': 'mse', 'optimizer': 'adam', 'graph_mode': 'off', 'use_snp_selection': False}. Best is trial 23 with value: 0.30220120355319835.
[I 2025-12-05 16:23:56,426] Trial 31 finished with value: 0.2962685282964316 and parameters: {'model_type': 'mlp', 'hidden_dims': '[128, 64]', 'dropout': 0.507873838197083, 'batch_norm': False, 'lr': 1.4091076752885697e-05, 'weight_decay': 3.8079078564953926e-05, 'epochs': 349, 'loss': 'mse', 'optimizer': 'adam', 'graph_mode': 'off', 'use_snp_selection': False}. Best is trial 23 with value: 0.30220120355319835.
[I 2025-12-05 16:24:11,922] Trial 32 finished with value: 0.302525567539508 and parameters: {'model_type': 'mlp', 'hidden_dims': '[128, 64]', 'dropout': 0.5482184278301679, 'batch_norm': False, 'lr': 1.9406675484475083e-05, 'weight_decay': 9.908222041615267e-06, 'epochs': 215, 'loss': 'mse', 'optimizer': 'adam', 'graph_mode': 'off', 'use_snp_selection': False}. Best is trial 32 with value: 0.302525567539508.
[I 2025-12-05 16:24:36,009] Trial 33 finished with value: 0.2864116031219333 and parameters: {'model_type': 'mlp', 'hidden_dims': '[256, 128, 64]', 'dropout': 0.542536343447789, 'batch_norm': False, 'lr': 9.305011066855761e-05, 'weight_decay': 1.0193306105618284e-05, 'epochs': 213, 'loss': 'mse', 'optimizer': 'adam', 'graph_mode': 'off', 'use_snp_selection': False}. Best is trial 32 with value: 0.302525567539508.
[I 2025-12-05 16:24:48,452] Trial 34 finished with value: 0.24161992205367863 and parameters: {'model_type': 'mlp', 'hidden_dims': '[128, 64]', 'dropout': 0.5609812699642116, 'batch_norm': False, 'lr': 3.8190281669228594e-06, 'weight_decay': 2.6433334039007755e-07, 'epochs': 156, 'loss': 'mae', 'optimizer': 'adam', 'graph_mode': 'off', 'use_snp_selection': False}. Best is trial 32 with value: 0.302525567539508.
[I 2025-12-05 16:25:05,053] Trial 35 finished with value: 0.2866702397762845 and parameters: {'model_type': 'mlp', 'hidden_dims': '[128, 64]', 'dropout': 0.42031305434219635, 'batch_norm': True, 'lr': 3.608475298132135e-05, 'weight_decay': 1.407106047222363e-06, 'epochs': 194, 'loss': 'mse', 'optimizer': 'adam', 'graph_mode': 'off', 'use_snp_selection': False}. Best is trial 32 with value: 0.302525567539508.
[I 2025-12-05 16:26:24,845] Trial 36 finished with value: 0.30022937400061495 and parameters: {'model_type': 'mlp', 'hidden_dims': '[512, 128]', 'dropout': 0.5213797037857949, 'batch_norm': False, 'lr': 5.283067137393462e-06, 'weight_decay': 7.806239030419633e-07, 'epochs': 258, 'loss': 'mse', 'optimizer': 'adam', 'graph_mode': 'off', 'use_snp_selection': True, 'num_snps': 58661}. Best is trial 32 with value: 0.302525567539508.
[I 2025-12-05 16:27:42,744] Trial 37 finished with value: 0.29070939836657583 and parameters: {'model_type': 'mlp', 'hidden_dims': '[512, 128]', 'dropout': 0.5592599618887248, 'batch_norm': False, 'lr': 5.285890262650896e-06, 'weight_decay': 6.85171059353472e-07, 'epochs': 252, 'loss': 'mae', 'optimizer': 'adam', 'graph_mode': 'off', 'use_snp_selection': True, 'num_snps': 57733}. Best is trial 32 with value: 0.302525567539508.
[I 2025-12-05 16:28:50,647] Trial 38 finished with value: 0.2861691382381396 and parameters: {'model_type': 'mlp', 'hidden_dims': '[512, 128]', 'dropout': 0.45327553982968866, 'batch_norm': True, 'lr': 9.425991555338798e-06, 'weight_decay': 1.753249635136766e-07, 'epochs': 259, 'loss': 'mse', 'optimizer': 'adam', 'graph_mode': 'off', 'use_snp_selection': True, 'num_snps': 46312}. Best is trial 32 with value: 0.302525567539508.
[I 2025-12-05 16:29:25,715] Trial 39 finished with value: 0.24850366894836567 and parameters: {'model_type': 'mlp', 'hidden_dims': '[512, 128]', 'dropout': 0.3972341829755667, 'batch_norm': False, 'lr': 1.0898465112308518e-06, 'weight_decay': 0.00021140548787724033, 'epochs': 155, 'loss': 'mse', 'optimizer': 'adam', 'graph_mode': 'off', 'use_snp_selection': True, 'num_snps': 19621}. Best is trial 32 with value: 0.302525567539508.
[I 2025-12-05 16:30:24,592] Trial 40 finished with value: 0.2839702030170535 and parameters: {'model_type': 'mlp', 'hidden_dims': '[512, 128]', 'dropout': 0.5264230835199183, 'batch_norm': True, 'lr': 2.9975869475979317e-06, 'weight_decay': 2.3063629002424888e-07, 'epochs': 185, 'loss': 'mae', 'optimizer': 'adam', 'graph_mode': 'off', 'use_snp_selection': True, 'num_snps': 46840}. Best is trial 32 with value: 0.302525567539508.
[I 2025-12-05 16:31:00,674] Trial 41 finished with value: 0.2953574090341081 and parameters: {'model_type': 'mlp', 'hidden_dims': '[256, 128, 64]', 'dropout': 0.5681951670801062, 'batch_norm': False, 'lr': 1.8608735473088612e-05, 'weight_decay': 9.215125733412648e-07, 'epochs': 217, 'loss': 'mse', 'optimizer': 'adam', 'graph_mode': 'off', 'use_snp_selection': True, 'num_snps': 25404}. Best is trial 32 with value: 0.302525567539508.
[I 2025-12-05 16:32:06,791] Trial 42 finished with value: 0.30117147193880167 and parameters: {'model_type': 'mlp', 'hidden_dims': '[512, 128]', 'dropout': 0.4941386391912371, 'batch_norm': False, 'lr': 6.575278999317219e-06, 'weight_decay': 1.99194935958279e-06, 'epochs': 204, 'loss': 'mse', 'optimizer': 'adam', 'graph_mode': 'off', 'use_snp_selection': True, 'num_snps': 52728}. Best is trial 32 with value: 0.302525567539508.
[I 2025-12-05 16:33:11,551] Trial 43 finished with value: 0.30491486358211695 and parameters: {'model_type': 'mlp', 'hidden_dims': '[512, 128]', 'dropout': 0.4789254384109648, 'batch_norm': False, 'lr': 6.557703088031485e-06, 'weight_decay': 5.402276074011706e-07, 'epochs': 197, 'loss': 'mse', 'optimizer': 'adam', 'graph_mode': 'off', 'use_snp_selection': True, 'num_snps': 52089}. Best is trial 43 with value: 0.30491486358211695.
[I 2025-12-05 16:34:15,188] Trial 44 finished with value: 0.3010522255212203 and parameters: {'model_type': 'mlp', 'hidden_dims': '[512, 128]', 'dropout': 0.48250903740296214, 'batch_norm': False, 'lr': 7.240553116568331e-06, 'weight_decay': 5.505893160029437e-07, 'epochs': 197, 'loss': 'mse', 'optimizer': 'adam', 'graph_mode': 'off', 'use_snp_selection': True, 'num_snps': 50877}. Best is trial 43 with value: 0.30491486358211695.
[I 2025-12-05 16:35:18,862] Trial 45 finished with value: 0.2855688971142238 and parameters: {'model_type': 'mlp', 'hidden_dims': '[512, 128]', 'dropout': 0.4777911659017593, 'batch_norm': False, 'lr': 1.7163626258074327e-06, 'weight_decay': 1.6575275635403462e-06, 'epochs': 200, 'loss': 'mse', 'optimizer': 'adam', 'graph_mode': 'off', 'use_snp_selection': True, 'num_snps': 50321}. Best is trial 43 with value: 0.30491486358211695.
[I 2025-12-05 16:36:11,893] Trial 46 finished with value: 0.29267227549979563 and parameters: {'model_type': 'mlp', 'hidden_dims': '[512, 128]', 'dropout': 0.573479762034649, 'batch_norm': True, 'lr': 1.1602145999312471e-05, 'weight_decay': 4.455260684107242e-07, 'epochs': 190, 'loss': 'mse', 'optimizer': 'adam', 'graph_mode': 'off', 'use_snp_selection': True, 'num_snps': 39039}. Best is trial 43 with value: 0.30491486358211695.
[I 2025-12-05 16:37:08,593] Trial 47 finished with value: 0.29235003663368475 and parameters: {'model_type': 'mlp', 'hidden_dims': '[512, 128]', 'dropout': 0.599075269450736, 'batch_norm': False, 'lr': 4.7025901430054344e-05, 'weight_decay': 1.6181578294037602e-05, 'epochs': 145, 'loss': 'mse', 'optimizer': 'adam', 'graph_mode': 'off', 'use_snp_selection': True, 'num_snps': 51839}. Best is trial 43 with value: 0.30491486358211695.
[I 2025-12-05 16:38:13,931] Trial 48 finished with value: 0.29007963093502637 and parameters: {'model_type': 'mlp', 'hidden_dims': '[512, 64]', 'dropout': 0.48734138389236176, 'batch_norm': False, 'lr': 6.7137765159831e-06, 'weight_decay': 7.237398222983562e-06, 'epochs': 205, 'loss': 'mae', 'optimizer': 'adam', 'graph_mode': 'off', 'use_snp_selection': True, 'num_snps': 51750}. Best is trial 43 with value: 0.30491486358211695.
[I 2025-12-05 16:39:12,095] Trial 49 finished with value: 0.301389651512918 and parameters: {'model_type': 'mlp', 'hidden_dims': '[512, 128]', 'dropout': 0.525256598137394, 'batch_norm': False, 'lr': 3.898699787702272e-06, 'weight_decay': 4.4305254052632244e-07, 'epochs': 245, 'loss': 'mse', 'optimizer': 'adam', 'graph_mode': 'off', 'use_snp_selection': True, 'num_snps': 38274}. Best is trial 43 with value: 0.30491486358211695.
[I 2025-12-05 16:40:11,839] Trial 50 finished with value: 0.23779333119302412 and parameters: {'model_type': 'mlp', 'hidden_dims': '[512, 128]', 'dropout': 0.5198598147287312, 'batch_norm': False, 'lr': 0.00097813456262853, 'weight_decay': 2.196445793866033e-06, 'epochs': 244, 'loss': 'mse', 'optimizer': 'adam', 'graph_mode': 'off', 'use_snp_selection': True, 'num_snps': 39981}. Best is trial 43 with value: 0.30491486358211695.
[I 2025-12-05 16:41:22,099] Trial 51 finished with value: 0.30045396994756224 and parameters: {'model_type': 'mlp', 'hidden_dims': '[512, 128]', 'dropout': 0.40535554247236333, 'batch_norm': False, 'lr': 3.6369188371458327e-06, 'weight_decay': 6.014393056622009e-07, 'epochs': 226, 'loss': 'mse', 'optimizer': 'adam', 'graph_mode': 'off', 'use_snp_selection': True, 'num_snps': 53888}. Best is trial 43 with value: 0.30491486358211695.
[I 2025-12-05 16:42:20,131] Trial 52 finished with value: 0.29812854948091483 and parameters: {'model_type': 'mlp', 'hidden_dims': '[512, 128]', 'dropout': 0.48486985772350516, 'batch_norm': False, 'lr': 1.034782681348969e-05, 'weight_decay': 3.808519414893256e-07, 'epochs': 208, 'loss': 'mse', 'optimizer': 'adam', 'graph_mode': 'off', 'use_snp_selection': True, 'num_snps': 42605}. Best is trial 43 with value: 0.30491486358211695.
[I 2025-12-05 16:43:26,309] Trial 53 finished with value: 0.3063562177890325 and parameters: {'model_type': 'mlp', 'hidden_dims': '[512, 128]', 'dropout': 0.531091745132934, 'batch_norm': False, 'lr': 4.628630744366413e-06, 'weight_decay': 1.4474306202732605e-07, 'epochs': 241, 'loss': 'mse', 'optimizer': 'adam', 'graph_mode': 'off', 'use_snp_selection': True, 'num_snps': 47026}. Best is trial 53 with value: 0.3063562177890325.
[I 2025-12-05 16:44:22,435] Trial 54 finished with value: 0.29289152016803177 and parameters: {'model_type': 'mlp', 'hidden_dims': '[512, 128]', 'dropout': 0.5288431321458567, 'batch_norm': False, 'lr': 2.4607303566219966e-06, 'weight_decay': 1.533778599336444e-07, 'epochs': 272, 'loss': 'mse', 'optimizer': 'adam', 'graph_mode': 'off', 'use_snp_selection': True, 'num_snps': 33892}. Best is trial 53 with value: 0.3063562177890325.
[I 2025-12-05 16:45:28,941] Trial 55 finished with value: 0.29222450938397715 and parameters: {'model_type': 'mlp', 'hidden_dims': '[512, 256]', 'dropout': 0.5573462345084723, 'batch_norm': False, 'lr': 2.066531786723838e-06, 'weight_decay': 1.1009148475384754e-07, 'epochs': 240, 'loss': 'mse', 'optimizer': 'adam', 'graph_mode': 'off', 'use_snp_selection': True, 'num_snps': 47419}. Best is trial 53 with value: 0.3063562177890325.
[I 2025-12-05 16:46:22,745] Trial 56 finished with value: 0.29720083483051957 and parameters: {'model_type': 'mlp', 'hidden_dims': '[256, 128]', 'dropout': 0.5844969291945858, 'batch_norm': False, 'lr': 4.8565569557712794e-06, 'weight_decay': 1.0737727597818046e-06, 'epochs': 229, 'loss': 'mse', 'optimizer': 'adam', 'graph_mode': 'off', 'use_snp_selection': True, 'num_snps': 54838}. Best is trial 53 with value: 0.3063562177890325.
