[I 2025-12-05 14:51:25,608] Trial 23 finished with value: 0.02816736887913089 and parameters: {'model_type': 'mlp', 'hidden_dims': '[512, 128]', 'dropout': 0.3407103654841603, 'batch_norm': True, 'lr': 0.00011118454243804409, 'weight_decay': 2.55500584544198e-07, 'epochs': 227, 'loss': 'mse', 'optimizer': 'adam', 'graph_mode': 'off', 'use_snp_selection': False}. Best is trial 7 with value: 0.04229040321643808.
[I 2025-12-05 14:51:27,929] Trial 24 finished with value: 0.03510648422314035 and parameters: {'model_type': 'mlp', 'hidden_dims': '[512, 128]', 'dropout': 0.46661021124092494, 'batch_norm': True, 'lr': 0.000597300846056639, 'weight_decay': 9.98438853641073e-07, 'epochs': 342, 'loss': 'mse', 'optimizer': 'adam', 'graph_mode': 'off', 'use_snp_selection': False}. Best is trial 7 with value: 0.04229040321643808.
[I 2025-12-05 14:51:29,294] Trial 25 finished with value: 0.0193133830140333 and parameters: {'model_type': 'mlp', 'hidden_dims': '[256, 128, 64]', 'dropout': 0.3605455373000043, 'batch_norm': True, 'lr': 0.00037242244363041785, 'weight_decay': 2.5347221329812837e-07, 'epochs': 293, 'loss': 'mse', 'optimizer': 'adam', 'graph_mode': 'off', 'use_snp_selection': False}. Best is trial 7 with value: 0.04229040321643808.
[I 2025-12-05 14:51:30,122] Trial 26 finished with value: 0.002291122256669806 and parameters: {'model_type': 'mlp', 'hidden_dims': '[128, 64]', 'dropout': 0.3042082617769317, 'batch_norm': True, 'lr': 8.62543952190633e-05, 'weight_decay': 3.855345043027877e-06, 'epochs': 209, 'loss': 'mae', 'optimizer': 'adam', 'graph_mode': 'off', 'use_snp_selection': False}. Best is trial 7 with value: 0.04229040321643808.
[I 2025-12-05 14:51:31,095] Trial 27 finished with value: 0.01590428434522057 and parameters: {'model_type': 'mlp', 'hidden_dims': '[256, 128]', 'dropout': 0.5684346716934683, 'batch_norm': False, 'lr': 3.5939305819074826e-05, 'weight_decay': 2.0516034592406726e-07, 'epochs': 155, 'loss': 'mse', 'optimizer': 'adam', 'graph_mode': 'off', 'use_snp_selection': False}. Best is trial 7 with value: 0.04229040321643808.
[I 2025-12-05 14:51:32,344] Trial 28 finished with value: 0.020782804553773803 and parameters: {'model_type': 'mlp', 'hidden_dims': '[512, 256]', 'dropout': 0.501049943617615, 'batch_norm': True, 'lr': 0.00019602267934171658, 'weight_decay': 1.1260204893565143e-06, 'epochs': 115, 'loss': 'mse', 'optimizer': 'adam', 'graph_mode': 'off', 'use_snp_selection': False}. Best is trial 7 with value: 0.04229040321643808.
[I 2025-12-05 14:51:33,324] Trial 29 finished with value: 0.026990533002884644 and parameters: {'model_type': 'mlp', 'hidden_dims': '[128, 64]', 'dropout': 0.21547267547105137, 'batch_norm': True, 'lr': 3.306519917966916e-05, 'weight_decay': 7.287289014646863e-06, 'epochs': 315, 'loss': 'mae', 'optimizer': 'adam', 'graph_mode': 'off', 'use_snp_selection': False}. Best is trial 7 with value: 0.04229040321643808.
[I 2025-12-05 14:51:35,296] Trial 30 finished with value: 0.03844627888624183 and parameters: {'model_type': 'mlp', 'hidden_dims': '[512, 128]', 'dropout': 0.353759069443804, 'batch_norm': True, 'lr': 0.00020675519034684184, 'weight_decay': 8.738170299171046e-07, 'epochs': 263, 'loss': 'mse', 'optimizer': 'adam', 'graph_mode': 'off', 'use_snp_selection': False}. Best is trial 7 with value: 0.04229040321643808.
[I 2025-12-05 14:51:37,258] Trial 31 finished with value: 0.029832110677334808 and parameters: {'model_type': 'mlp', 'hidden_dims': '[512, 128]', 'dropout': 0.3506348481036568, 'batch_norm': True, 'lr': 0.0001982472045741414, 'weight_decay': 7.17683318165601e-07, 'epochs': 266, 'loss': 'mse', 'optimizer': 'adam', 'graph_mode': 'off', 'use_snp_selection': False}. Best is trial 7 with value: 0.04229040321643808.
[I 2025-12-05 14:51:39,062] Trial 32 finished with value: 0.006942461672101736 and parameters: {'model_type': 'mlp', 'hidden_dims': '[512, 128]', 'dropout': 0.4306022156332004, 'batch_norm': True, 'lr': 8.756578418756068e-05, 'weight_decay': 2.398600021056029e-06, 'epochs': 233, 'loss': 'mse', 'optimizer': 'adam', 'graph_mode': 'off', 'use_snp_selection': False}. Best is trial 7 with value: 0.04229040321643808.
[I 2025-12-05 14:51:41,189] Trial 33 finished with value: 0.032723359231352264 and parameters: {'model_type': 'mlp', 'hidden_dims': '[512, 128]', 'dropout': 0.29956759188269105, 'batch_norm': True, 'lr': 0.00035782235964286404, 'weight_decay': 3.3305991530357243e-07, 'epochs': 298, 'loss': 'mse', 'optimizer': 'adam', 'graph_mode': 'off', 'use_snp_selection': False}. Best is trial 7 with value: 0.04229040321643808.
[I 2025-12-05 14:51:42,648] Trial 34 finished with value: 0.049511385262284296 and parameters: {'model_type': 'mlp', 'hidden_dims': '[256, 128]', 'dropout': 0.3739367078140154, 'batch_norm': True, 'lr': 5.0195891787132946e-05, 'weight_decay': 1.5745458713373008e-07, 'epochs': 334, 'loss': 'mae', 'optimizer': 'adam', 'graph_mode': 'off', 'use_snp_selection': False}. Best is trial 34 with value: 0.049511385262284296.
[I 2025-12-05 14:51:44,078] Trial 35 finished with value: 0.007553970066284146 and parameters: {'model_type': 'mlp', 'hidden_dims': '[256, 128]', 'dropout': 0.3803148252543665, 'batch_norm': False, 'lr': 5.0427456391998145e-05, 'weight_decay': 1.6040649795461022e-07, 'epochs': 331, 'loss': 'mae', 'optimizer': 'adam', 'graph_mode': 'off', 'use_snp_selection': False}. Best is trial 34 with value: 0.049511385262284296.
[I 2025-12-05 14:51:45,576] Trial 36 finished with value: 0.009811495059010054 and parameters: {'model_type': 'mlp', 'hidden_dims': '[256, 128]', 'dropout': 0.45475278926631024, 'batch_norm': True, 'lr': 2.2511671091499027e-05, 'weight_decay': 1.3902179156499393e-06, 'epochs': 347, 'loss': 'mae', 'optimizer': 'adam', 'graph_mode': 'off', 'use_snp_selection': False}. Best is trial 34 with value: 0.049511385262284296.
[I 2025-12-05 14:51:46,811] Trial 37 finished with value: 0.013565018865530614 and parameters: {'model_type': 'mlp', 'hidden_dims': '[256, 128]', 'dropout': 0.3990008194750919, 'batch_norm': True, 'lr': 7.624500288233094e-05, 'weight_decay': 4.446385392329962e-07, 'epochs': 249, 'loss': 'mae', 'optimizer': 'adam', 'graph_mode': 'off', 'use_snp_selection': False}. Best is trial 34 with value: 0.049511385262284296.
[I 2025-12-05 14:51:48,944] Trial 38 finished with value: 0.030161777900609223 and parameters: {'model_type': 'mlp', 'hidden_dims': '[512, 64]', 'dropout': 0.14147941701518654, 'batch_norm': False, 'lr': 4.5358571098618525e-05, 'weight_decay': 1.1651643706525505e-05, 'epochs': 308, 'loss': 'mae', 'optimizer': 'adam', 'graph_mode': 'off', 'use_snp_selection': False}. Best is trial 34 with value: 0.049511385262284296.
[I 2025-12-05 14:51:50,228] Trial 39 finished with value: 0.03187235452738906 and parameters: {'model_type': 'mlp', 'hidden_dims': '[256, 128]', 'dropout': 0.41891561540641165, 'batch_norm': True, 'lr': 0.0005900186682258454, 'weight_decay': 8.01072982366101e-07, 'epochs': 268, 'loss': 'mae', 'optimizer': 'adam', 'graph_mode': 'off', 'use_snp_selection': False}. Best is trial 34 with value: 0.049511385262284296.
[I 2025-12-05 14:51:51,696] Trial 40 finished with value: 0.0249283220318187 and parameters: {'model_type': 'mlp', 'hidden_dims': '[256, 128, 64]', 'dropout': 0.2842320898463489, 'batch_norm': True, 'lr': 0.00015861487883996793, 'weight_decay': 1.5719162382136994e-07, 'epochs': 329, 'loss': 'mae', 'optimizer': 'adam', 'graph_mode': 'off', 'use_snp_selection': False}. Best is trial 34 with value: 0.049511385262284296.
[I 2025-12-05 14:51:53,719] Trial 41 finished with value: 0.015765761372139905 and parameters: {'model_type': 'mlp', 'hidden_dims': '[512, 128]', 'dropout': 0.324177159707824, 'batch_norm': True, 'lr': 0.00010621020389069385, 'weight_decay': 3.2452709505373064e-07, 'epochs': 278, 'loss': 'mse', 'optimizer': 'adam', 'graph_mode': 'off', 'use_snp_selection': False}. Best is trial 34 with value: 0.049511385262284296.
[I 2025-12-05 14:51:55,895] Trial 42 finished with value: 0.03188997628747524 and parameters: {'model_type': 'mlp', 'hidden_dims': '[512, 128]', 'dropout': 0.3486462100792395, 'batch_norm': True, 'lr': 0.0002638572448396884, 'weight_decay': 1.6546274804815747e-07, 'epochs': 309, 'loss': 'mse', 'optimizer': 'adam', 'graph_mode': 'off', 'use_snp_selection': False}. Best is trial 34 with value: 0.049511385262284296.
[I 2025-12-05 14:51:57,740] Trial 43 finished with value: 0.03544087353680603 and parameters: {'model_type': 'mlp', 'hidden_dims': '[512, 64]', 'dropout': 0.36975716435429234, 'batch_norm': True, 'lr': 6.614733482532872e-05, 'weight_decay': 1.7987363929619752e-06, 'epochs': 242, 'loss': 'mse', 'optimizer': 'adam', 'graph_mode': 'off', 'use_snp_selection': False}. Best is trial 34 with value: 0.049511385262284296.
[I 2025-12-05 14:52:00,019] Trial 44 finished with value: -0.005108565228939367 and parameters: {'model_type': 'mlp', 'hidden_dims': '[512, 256]', 'dropout': 0.3984132421006072, 'batch_norm': True, 'lr': 2.7114339867088885e-06, 'weight_decay': 6.716103841528156e-07, 'epochs': 330, 'loss': 'mae', 'optimizer': 'adam', 'graph_mode': 'off', 'use_snp_selection': False}. Best is trial 34 with value: 0.049511385262284296.
[I 2025-12-05 14:52:02,130] Trial 45 finished with value: 0.033318297198700886 and parameters: {'model_type': 'mlp', 'hidden_dims': '[512, 128]', 'dropout': 0.22523426076279776, 'batch_norm': True, 'lr': 0.00011111166837040046, 'weight_decay': 1.2138594942680068e-07, 'epochs': 299, 'loss': 'mse', 'optimizer': 'adam', 'graph_mode': 'off', 'use_snp_selection': False}. Best is trial 34 with value: 0.049511385262284296.
[I 2025-12-05 14:52:03,113] Trial 46 finished with value: 0.03099998201212237 and parameters: {'model_type': 'mlp', 'hidden_dims': '[256, 128]', 'dropout': 0.287097065978673, 'batch_norm': False, 'lr': 6.192204251759285e-05, 'weight_decay': 3.5695760373407252e-06, 'epochs': 159, 'loss': 'mse', 'optimizer': 'adam', 'graph_mode': 'off', 'use_snp_selection': False}. Best is trial 34 with value: 0.049511385262284296.
[I 2025-12-05 14:52:04,435] Trial 47 finished with value: 0.038365800454418605 and parameters: {'model_type': 'mlp', 'hidden_dims': '[512, 128]', 'dropout': 0.24978723518277884, 'batch_norm': True, 'lr': 0.00027834659834629385, 'weight_decay': 3.5339456857807703e-07, 'epochs': 131, 'loss': 'mse', 'optimizer': 'adam', 'graph_mode': 'off', 'use_snp_selection': False}. Best is trial 34 with value: 0.049511385262284296.
[I 2025-12-05 14:52:05,268] Trial 48 finished with value: 0.018568237741051555 and parameters: {'model_type': 'mlp', 'hidden_dims': '[128, 64]', 'dropout': 0.1376564611798297, 'batch_norm': True, 'lr': 0.0004965415569487489, 'weight_decay': 3.766301503823489e-07, 'epochs': 124, 'loss': 'mae', 'optimizer': 'adam', 'graph_mode': 'off', 'use_snp_selection': True, 'num_snps': 2035}. Best is trial 34 with value: 0.049511385262284296.
[I 2025-12-05 14:52:06,374] Trial 49 finished with value: 0.019986058432426602 and parameters: {'model_type': 'mlp', 'hidden_dims': '[512, 256]', 'dropout': 0.24336823810136848, 'batch_norm': True, 'lr': 0.0009382887144195632, 'weight_decay': 9.919256339968022e-07, 'epochs': 88, 'loss': 'mse', 'optimizer': 'adam', 'graph_mode': 'off', 'use_snp_selection': False}. Best is trial 34 with value: 0.049511385262284296.
[I 2025-12-05 14:52:07,720] Trial 50 finished with value: 0.034157051484737674 and parameters: {'model_type': 'mlp', 'hidden_dims': '[512, 128]', 'dropout': 0.18315015496285159, 'batch_norm': True, 'lr': 0.0002346973045766577, 'weight_decay': 1.9230665817671207e-05, 'epochs': 139, 'loss': 'mse', 'optimizer': 'adam', 'graph_mode': 'off', 'use_snp_selection': False}. Best is trial 34 with value: 0.049511385262284296.
[I 2025-12-05 14:52:08,765] Trial 51 finished with value: 0.025226082274881864 and parameters: {'model_type': 'mlp', 'hidden_dims': '[512, 128]', 'dropout': 0.3374405428082906, 'batch_norm': True, 'lr': 0.0001639394864201802, 'weight_decay': 2.2733845204907772e-07, 'epochs': 76, 'loss': 'mse', 'optimizer': 'adam', 'graph_mode': 'off', 'use_snp_selection': False}. Best is trial 34 with value: 0.049511385262284296.
[I 2025-12-05 14:52:09,856] Trial 52 finished with value: 0.01514688678925367 and parameters: {'model_type': 'mlp', 'hidden_dims': '[512, 128]', 'dropout': 0.2633365526176187, 'batch_norm': True, 'lr': 4.732084903978176e-05, 'weight_decay': 5.323869377369848e-07, 'epochs': 85, 'loss': 'mse', 'optimizer': 'adam', 'graph_mode': 'off', 'use_snp_selection': False}. Best is trial 34 with value: 0.049511385262284296.
[I 2025-12-05 14:52:11,360] Trial 53 finished with value: 0.020720244001326202 and parameters: {'model_type': 'mlp', 'hidden_dims': '[512, 128]', 'dropout': 0.32548198148335805, 'batch_norm': True, 'lr': 0.00027436336845326683, 'weight_decay': 1.0260909752531992e-07, 'epochs': 172, 'loss': 'mse', 'optimizer': 'adam', 'graph_mode': 'off', 'use_snp_selection': False}. Best is trial 34 with value: 0.049511385262284296.
[I 2025-12-05 14:52:13,952] Trial 54 finished with value: 0.04427028933119986 and parameters: {'model_type': 'mlp', 'hidden_dims': '[512, 128]', 'dropout': 0.3706427016500485, 'batch_norm': True, 'lr': 0.00013131586376583784, 'weight_decay': 2.6335746728708495e-06, 'epochs': 58, 'loss': 'mse', 'optimizer': 'adam', 'graph_mode': 'off', 'use_snp_selection': True, 'num_snps': 56459}. Best is trial 34 with value: 0.049511385262284296.
[I 2025-12-05 14:52:16,687] Trial 55 finished with value: 0.014106411371642381 and parameters: {'model_type': 'mlp', 'hidden_dims': '[512, 64]', 'dropout': 0.37979423824008846, 'batch_norm': True, 'lr': 0.00043809270793882335, 'weight_decay': 5.026371603761883e-06, 'epochs': 54, 'loss': 'mse', 'optimizer': 'adam', 'graph_mode': 'off', 'use_snp_selection': True, 'num_snps': 59879}. Best is trial 34 with value: 0.049511385262284296.
[I 2025-12-05 14:52:19,007] Trial 56 finished with value: 0.03269093807390028 and parameters: {'model_type': 'mlp', 'hidden_dims': '[256, 128, 64]', 'dropout': 0.12102582675273142, 'batch_norm': True, 'lr': 0.0001360681483100413, 'weight_decay': 2.4681671365786808e-06, 'epochs': 69, 'loss': 'mse', 'optimizer': 'adam', 'graph_mode': 'off', 'use_snp_selection': True, 'num_snps': 52248}. Best is trial 34 with value: 0.049511385262284296.
[I 2025-12-05 14:52:20,300] Trial 57 finished with value: 0.036067821946270597 and parameters: {'model_type': 'mlp', 'hidden_dims': '[512, 256]', 'dropout': 0.16316203374222196, 'batch_norm': True, 'lr': 0.0001850222995776827, 'weight_decay': 1.691636204384635e-06, 'epochs': 92, 'loss': 'mse', 'optimizer': 'adam', 'graph_mode': 'off', 'use_snp_selection': True, 'num_snps': 17123}. Best is trial 34 with value: 0.049511385262284296.
[I 2025-12-05 14:52:22,793] Trial 58 finished with value: 0.0168752564866649 and parameters: {'model_type': 'mlp', 'hidden_dims': '[512, 128]', 'dropout': 0.363207717191823, 'batch_norm': False, 'lr': 2.1212375285544383e-05, 'weight_decay': 9.567355805081314e-06, 'epochs': 65, 'loss': 'mse', 'optimizer': 'adam', 'graph_mode': 'off', 'use_snp_selection': True, 'num_snps': 52020}. Best is trial 34 with value: 0.049511385262284296.
[I 2025-12-05 14:52:24,207] Trial 59 finished with value: 0.039919667692756976 and parameters: {'model_type': 'mlp', 'hidden_dims': '[512, 128]', 'dropout': 0.24486467816681318, 'batch_norm': True, 'lr': 1.036508746503153e-05, 'weight_decay': 2.721439245812625e-06, 'epochs': 100, 'loss': 'mse', 'optimizer': 'adam', 'graph_mode': 'off', 'use_snp_selection': True, 'num_snps': 20327}. Best is trial 34 with value: 0.049511385262284296.
[I 2025-12-05 14:52:25,513] Trial 60 finished with value: -0.007068543266174158 and parameters: {'model_type': 'mlp', 'hidden_dims': '[256, 128]', 'dropout': 0.2131291583149042, 'batch_norm': True, 'lr': 1.3645344145066708e-05, 'weight_decay': 3.806496981004949e-05, 'epochs': 100, 'loss': 'mse', 'optimizer': 'adam', 'graph_mode': 'off', 'use_snp_selection': True, 'num_snps': 20443}. Best is trial 34 with value: 0.049511385262284296.
[I 2025-12-05 14:52:27,598] Trial 61 finished with value: 0.06672729345569342 and parameters: {'model_type': 'mlp', 'hidden_dims': '[512, 128]', 'dropout': 0.24136925310952662, 'batch_norm': True, 'lr': 7.591824292528903e-06, 'weight_decay': 2.7882353285815627e-06, 'epochs': 131, 'loss': 'mse', 'optimizer': 'adam', 'graph_mode': 'off', 'use_snp_selection': True, 'num_snps': 37547}. Best is trial 61 with value: 0.06672729345569342.
[I 2025-12-05 14:52:29,644] Trial 62 finished with value: -0.026335539671098425 and parameters: {'model_type': 'mlp', 'hidden_dims': '[512, 128]', 'dropout': 0.24574587451302435, 'batch_norm': True, 'lr': 8.203107922139659e-06, 'weight_decay': 1.3051481590438667e-06, 'epochs': 132, 'loss': 'mse', 'optimizer': 'adam', 'graph_mode': 'off', 'use_snp_selection': True, 'num_snps': 35436}. Best is trial 61 with value: 0.06672729345569342.
[I 2025-12-05 14:52:31,020] Trial 63 finished with value: 0.021359445001369617 and parameters: {'model_type': 'mlp', 'hidden_dims': '[512, 128]', 'dropout': 0.1818493582702837, 'batch_norm': True, 'lr': 6.822975089503113e-06, 'weight_decay': 2.451783342168142e-06, 'epochs': 127, 'loss': 'mse', 'optimizer': 'adam', 'graph_mode': 'off', 'use_snp_selection': True, 'num_snps': 19863}. Best is trial 61 with value: 0.06672729345569342.
[I 2025-12-05 14:52:33,109] Trial 64 finished with value: 0.002686453215689154 and parameters: {'model_type': 'mlp', 'hidden_dims': '[512, 128]', 'dropout': 0.2813690710359056, 'batch_norm': True, 'lr': 1.0536363567012535e-05, 'weight_decay': 4.759063692522161e-06, 'epochs': 115, 'loss': 'mse', 'optimizer': 'adam', 'graph_mode': 'off', 'use_snp_selection': True, 'num_snps': 37986}. Best is trial 61 with value: 0.06672729345569342.
[I 2025-12-05 14:52:34,650] Trial 65 finished with value: 0.007369713884783631 and parameters: {'model_type': 'mlp', 'hidden_dims': '[512, 128]', 'dropout': 0.16549974634232623, 'batch_norm': True, 'lr': 4.112149041018761e-06, 'weight_decay': 9.622210663438527e-07, 'epochs': 101, 'loss': 'mse', 'optimizer': 'adam', 'graph_mode': 'off', 'use_snp_selection': True, 'num_snps': 25551}. Best is trial 61 with value: 0.06672729345569342.
[I 2025-12-05 14:52:37,549] Trial 66 finished with value: -0.023746801430248682 and parameters: {'model_type': 'mlp', 'hidden_dims': '[512, 256]', 'dropout': 0.26738927610351537, 'batch_norm': True, 'lr': 2.655464930892142e-06, 'weight_decay': 5.263234078770702e-07, 'epochs': 190, 'loss': 'mse', 'optimizer': 'adam', 'graph_mode': 'off', 'use_snp_selection': True, 'num_snps': 51498}. Best is trial 61 with value: 0.06672729345569342.
[I 2025-12-05 14:52:38,629] Trial 67 finished with value: 0.012730521703836617 and parameters: {'model_type': 'mlp', 'hidden_dims': '[512, 128]', 'dropout': 0.40771415068973715, 'batch_norm': True, 'lr': 3.904129437190536e-05, 'weight_decay': 2.9639416722786604e-06, 'epochs': 60, 'loss': 'mae', 'optimizer': 'adam', 'graph_mode': 'off', 'use_snp_selection': True, 'num_snps': 13293}. Best is trial 61 with value: 0.06672729345569342.
[I 2025-12-05 14:52:40,673] Trial 68 finished with value: -0.007869303475085295 and parameters: {'model_type': 'mlp', 'hidden_dims': '[128, 64]', 'dropout': 0.20036729305026524, 'batch_norm': True, 'lr': 1.1627262556838085e-05, 'weight_decay': 3.4048285944005546e-07, 'epochs': 43, 'loss': 'mse', 'optimizer': 'adam', 'graph_mode': 'off', 'use_snp_selection': True, 'num_snps': 48467}. Best is trial 61 with value: 0.06672729345569342.
[I 2025-12-05 14:52:43,056] Trial 69 finished with value: 0.02505914107396875 and parameters: {'model_type': 'mlp', 'hidden_dims': '[512, 128]', 'dropout': 0.4451916962015339, 'batch_norm': False, 'lr': 2.7500668300260605e-05, 'weight_decay': 8.079050771193261e-07, 'epochs': 170, 'loss': 'mse', 'optimizer': 'adam', 'graph_mode': 'off', 'use_snp_selection': True, 'num_snps': 39696}. Best is trial 61 with value: 0.06672729345569342.
[I 2025-12-05 14:52:44,894] Trial 70 finished with value: -0.01291569123474124 and parameters: {'model_type': 'mlp', 'hidden_dims': '[256, 128, 64]', 'dropout': 0.3070474521802458, 'batch_norm': True, 'lr': 1.841014642427049e-05, 'weight_decay': 1.0318589830550416e-05, 'epochs': 204, 'loss': 'mse', 'optimizer': 'adam', 'graph_mode': 'off', 'use_snp_selection': True, 'num_snps': 31423}. Best is trial 61 with value: 0.06672729345569342.
[I 2025-12-05 14:52:46,386] Trial 71 finished with value: 0.037811355087376035 and parameters: {'model_type': 'mlp', 'hidden_dims': '[512, 128]', 'dropout': 0.2946798501353065, 'batch_norm': True, 'lr': 8.803145670462846e-05, 'weight_decay': 5.886542309725787e-06, 'epochs': 137, 'loss': 'mse', 'optimizer': 'adam', 'graph_mode': 'off', 'use_snp_selection': True, 'num_snps': 22397}. Best is trial 61 with value: 0.06672729345569342.
[I 2025-12-05 14:52:48,101] Trial 72 finished with value: 0.04458171428101035 and parameters: {'model_type': 'mlp', 'hidden_dims': '[512, 128]', 'dropout': 0.25043394785361006, 'batch_norm': True, 'lr': 0.0003141351917833449, 'weight_decay': 2.014388573693434e-06, 'epochs': 215, 'loss': 'mse', 'optimizer': 'adam', 'graph_mode': 'off', 'use_snp_selection': False}. Best is trial 61 with value: 0.06672729345569342.
[I 2025-12-05 14:52:49,792] Trial 73 finished with value: 0.0310421322919268 and parameters: {'model_type': 'mlp', 'hidden_dims': '[512, 128]', 'dropout': 0.2311507006860297, 'batch_norm': True, 'lr': 0.0003094051686256837, 'weight_decay': 2.00716416801596e-06, 'epochs': 211, 'loss': 'mse', 'optimizer': 'adam', 'graph_mode': 'off', 'use_snp_selection': False}. Best is trial 61 with value: 0.06672729345569342.
