[I 2025-12-06 05:23:02,217] Trial 118 finished with value: 0.3487755661432159 and parameters: {'model_type': 'mlp', 'hidden_dims': '[256, 128, 64]', 'dropout': 0.5711599015438338, 'batch_norm': False, 'lr': 1.7355319628864984e-06, 'weight_decay': 0.000848039815165743, 'epochs': 315, 'loss': 'mse', 'optimizer': 'adam', 'graph_mode': 'off', 'use_snp_selection': True, 'num_snps': 41918}. Best is trial 95 with value: 0.38481260605352013.
[I 2025-12-06 05:24:34,308] Trial 119 finished with value: 0.38839046919030723 and parameters: {'model_type': 'mlp', 'hidden_dims': '[512, 128]', 'dropout': 0.5879487131461686, 'batch_norm': False, 'lr': 2.328026676157891e-06, 'weight_decay': 0.0003463111409126409, 'epochs': 350, 'loss': 'mse', 'optimizer': 'adam', 'graph_mode': 'off', 'use_snp_selection': True, 'num_snps': 52016}. Best is trial 119 with value: 0.38839046919030723.
[I 2025-12-06 05:26:05,931] Trial 120 finished with value: 0.3776974682426616 and parameters: {'model_type': 'mlp', 'hidden_dims': '[512, 128]', 'dropout': 0.5892131159884088, 'batch_norm': False, 'lr': 2.912766214949237e-06, 'weight_decay': 0.00030797464684091804, 'epochs': 346, 'loss': 'mse', 'optimizer': 'adam', 'graph_mode': 'off', 'use_snp_selection': True, 'num_snps': 51860}. Best is trial 119 with value: 0.38839046919030723.
[I 2025-12-06 05:27:34,940] Trial 121 finished with value: 0.3832697343012174 and parameters: {'model_type': 'mlp', 'hidden_dims': '[512, 128]', 'dropout': 0.5804958214933584, 'batch_norm': False, 'lr': 2.352227861374375e-06, 'weight_decay': 0.0005069573864870987, 'epochs': 350, 'loss': 'mse', 'optimizer': 'adam', 'graph_mode': 'off', 'use_snp_selection': True, 'num_snps': 49811}. Best is trial 119 with value: 0.38839046919030723.
[I 2025-12-06 05:28:58,679] Trial 122 finished with value: 0.3824551612770102 and parameters: {'model_type': 'mlp', 'hidden_dims': '[512, 128]', 'dropout': 0.5793571446181764, 'batch_norm': False, 'lr': 2.647932803008283e-06, 'weight_decay': 0.0005257599232769185, 'epochs': 349, 'loss': 'mse', 'optimizer': 'adam', 'graph_mode': 'off', 'use_snp_selection': True, 'num_snps': 46033}. Best is trial 119 with value: 0.38839046919030723.
[I 2025-12-06 05:30:22,808] Trial 123 finished with value: 0.3572423874831207 and parameters: {'model_type': 'mlp', 'hidden_dims': '[512, 128]', 'dropout': 0.1291898733556344, 'batch_norm': False, 'lr': 2.5175080654153625e-06, 'weight_decay': 0.0006648013573696094, 'epochs': 349, 'loss': 'mse', 'optimizer': 'adam', 'graph_mode': 'off', 'use_snp_selection': True, 'num_snps': 45972}. Best is trial 119 with value: 0.38839046919030723.
[I 2025-12-06 05:31:53,884] Trial 124 finished with value: 0.3740949094166432 and parameters: {'model_type': 'mlp', 'hidden_dims': '[512, 128]', 'dropout': 0.5750898737977777, 'batch_norm': False, 'lr': 3.655927016843859e-06, 'weight_decay': 0.00025276827860871726, 'epochs': 330, 'loss': 'mse', 'optimizer': 'adam', 'graph_mode': 'off', 'use_snp_selection': True, 'num_snps': 53916}. Best is trial 119 with value: 0.38839046919030723.
[I 2025-12-06 05:33:21,380] Trial 125 finished with value: 0.3787714159766523 and parameters: {'model_type': 'mlp', 'hidden_dims': '[512, 128]', 'dropout': 0.5642070397379666, 'batch_norm': False, 'lr': 1.5882971559811982e-06, 'weight_decay': 0.0004449505361557753, 'epochs': 335, 'loss': 'mse', 'optimizer': 'adam', 'graph_mode': 'off', 'use_snp_selection': True, 'num_snps': 50262}. Best is trial 119 with value: 0.38839046919030723.
[I 2025-12-06 05:34:41,855] Trial 126 finished with value: 0.37699621288115903 and parameters: {'model_type': 'mlp', 'hidden_dims': '[512, 128]', 'dropout': 0.5812364435426429, 'batch_norm': False, 'lr': 1.8554572990768175e-06, 'weight_decay': 0.00019073395579755455, 'epochs': 350, 'loss': 'mse', 'optimizer': 'adam', 'graph_mode': 'off', 'use_snp_selection': True, 'num_snps': 43271}. Best is trial 119 with value: 0.38839046919030723.
[I 2025-12-06 05:36:05,105] Trial 127 finished with value: 0.3746762887918735 and parameters: {'model_type': 'mlp', 'hidden_dims': '[512, 128]', 'dropout': 0.5995747939590677, 'batch_norm': False, 'lr': 2.6731226306998656e-06, 'weight_decay': 0.0003036772868429023, 'epochs': 345, 'loss': 'mse', 'optimizer': 'adam', 'graph_mode': 'off', 'use_snp_selection': True, 'num_snps': 45973}. Best is trial 119 with value: 0.38839046919030723.
[I 2025-12-06 05:37:33,784] Trial 128 finished with value: 0.32949380216660484 and parameters: {'model_type': 'mlp', 'hidden_dims': '[512, 128]', 'dropout': 0.542672200492156, 'batch_norm': True, 'lr': 1.1159891289107437e-06, 'weight_decay': 0.00046886012744324875, 'epochs': 331, 'loss': 'mse', 'optimizer': 'adam', 'graph_mode': 'off', 'use_snp_selection': True, 'num_snps': 51207}. Best is trial 119 with value: 0.38839046919030723.
[I 2025-12-06 05:38:47,648] Trial 129 finished with value: 0.3720151924058303 and parameters: {'model_type': 'mlp', 'hidden_dims': '[512, 128]', 'dropout': 0.5619550458621173, 'batch_norm': False, 'lr': 1.406795935027055e-06, 'weight_decay': 0.0008503386923437241, 'epochs': 323, 'loss': 'mse', 'optimizer': 'adam', 'graph_mode': 'off', 'use_snp_selection': True, 'num_snps': 40385}. Best is trial 119 with value: 0.38839046919030723.
[I 2025-12-06 05:40:14,163] Trial 130 finished with value: 0.3466495391540278 and parameters: {'model_type': 'mlp', 'hidden_dims': '[512, 64]', 'dropout': 0.18850616930058134, 'batch_norm': False, 'lr': 6.222169251635275e-06, 'weight_decay': 0.0005954770562836145, 'epochs': 338, 'loss': 'mse', 'optimizer': 'adam', 'graph_mode': 'off', 'use_snp_selection': True, 'num_snps': 48958}. Best is trial 119 with value: 0.38839046919030723.
[I 2025-12-06 05:41:39,109] Trial 131 finished with value: 0.3820993498645481 and parameters: {'model_type': 'mlp', 'hidden_dims': '[512, 128]', 'dropout': 0.5869650828182466, 'batch_norm': False, 'lr': 2.1959233389319893e-06, 'weight_decay': 0.0005255161827658366, 'epochs': 343, 'loss': 'mse', 'optimizer': 'adam', 'graph_mode': 'off', 'use_snp_selection': True, 'num_snps': 47732}. Best is trial 119 with value: 0.38839046919030723.
[I 2025-12-06 05:43:00,444] Trial 132 finished with value: 0.38482059372712185 and parameters: {'model_type': 'mlp', 'hidden_dims': '[512, 128]', 'dropout': 0.5784820252057878, 'batch_norm': False, 'lr': 1.98785027053634e-06, 'weight_decay': 0.0003783236616322255, 'epochs': 344, 'loss': 'mse', 'optimizer': 'adam', 'graph_mode': 'off', 'use_snp_selection': True, 'num_snps': 44863}. Best is trial 119 with value: 0.38839046919030723.
[I 2025-12-06 05:44:25,960] Trial 133 finished with value: 0.38513550504818844 and parameters: {'model_type': 'mlp', 'hidden_dims': '[512, 128]', 'dropout': 0.5749987083554013, 'batch_norm': False, 'lr': 1.9614486822393713e-06, 'weight_decay': 0.0003780068229919251, 'epochs': 350, 'loss': 'mse', 'optimizer': 'adam', 'graph_mode': 'off', 'use_snp_selection': True, 'num_snps': 47355}. Best is trial 119 with value: 0.38839046919030723.
[I 2025-12-06 05:46:00,073] Trial 134 finished with value: 0.3860528294056098 and parameters: {'model_type': 'mlp', 'hidden_dims': '[512, 128]', 'dropout': 0.5719884528509817, 'batch_norm': False, 'lr': 1.8257105345004623e-06, 'weight_decay': 0.0003836369810478821, 'epochs': 345, 'loss': 'mse', 'optimizer': 'adam', 'graph_mode': 'off', 'use_snp_selection': True, 'num_snps': 54653}. Best is trial 119 with value: 0.38839046919030723.
[I 2025-12-06 05:47:35,876] Trial 135 finished with value: 0.38283185507627915 and parameters: {'model_type': 'mlp', 'hidden_dims': '[512, 128]', 'dropout': 0.5759486293517027, 'batch_norm': False, 'lr': 1.928966824847018e-06, 'weight_decay': 0.00038011414040374264, 'epochs': 350, 'loss': 'mse', 'optimizer': 'adam', 'graph_mode': 'off', 'use_snp_selection': True, 'num_snps': 55138}. Best is trial 119 with value: 0.38839046919030723.
[I 2025-12-06 05:49:14,150] Trial 136 finished with value: 0.379397536798583 and parameters: {'model_type': 'mlp', 'hidden_dims': '[512, 128]', 'dropout': 0.5531609402316909, 'batch_norm': False, 'lr': 1.8723447764322187e-06, 'weight_decay': 0.0003835659185650647, 'epochs': 350, 'loss': 'mse', 'optimizer': 'adam', 'graph_mode': 'off', 'use_snp_selection': True, 'num_snps': 57048}. Best is trial 119 with value: 0.38839046919030723.
[I 2025-12-06 05:50:03,839] Trial 137 finished with value: 0.3661407035980104 and parameters: {'model_type': 'mlp', 'hidden_dims': '[128, 64]', 'dropout': 0.5685174332706066, 'batch_norm': False, 'lr': 1.6982728983703036e-06, 'weight_decay': 0.0002694419436232274, 'epochs': 337, 'loss': 'mse', 'optimizer': 'adam', 'graph_mode': 'off', 'use_snp_selection': True, 'num_snps': 52562}. Best is trial 119 with value: 0.38839046919030723.
[I 2025-12-06 05:51:35,741] Trial 138 finished with value: 0.372025403201309 and parameters: {'model_type': 'mlp', 'hidden_dims': '[512, 128]', 'dropout': 0.5417804235300344, 'batch_norm': False, 'lr': 3.182728071852254e-06, 'weight_decay': 0.0002242864769900234, 'epochs': 333, 'loss': 'mse', 'optimizer': 'adam', 'graph_mode': 'off', 'use_snp_selection': True, 'num_snps': 54918}. Best is trial 119 with value: 0.38839046919030723.
[I 2025-12-06 05:53:09,358] Trial 139 finished with value: 0.3736640451045573 and parameters: {'model_type': 'mlp', 'hidden_dims': '[512, 128]', 'dropout': 0.4031408562330985, 'batch_norm': False, 'lr': 1.2363064732252663e-06, 'weight_decay': 0.0003338861964797459, 'epochs': 343, 'loss': 'mse', 'optimizer': 'adam', 'graph_mode': 'off', 'use_snp_selection': True, 'num_snps': 54780}. Best is trial 119 with value: 0.38839046919030723.
[I 2025-12-06 05:54:46,897] Trial 140 finished with value: 0.3797572347271324 and parameters: {'model_type': 'mlp', 'hidden_dims': '[512, 128]', 'dropout': 0.5619771550391618, 'batch_norm': False, 'lr': 2.3111170270814314e-06, 'weight_decay': 0.0004097401117706615, 'epochs': 329, 'loss': 'mse', 'optimizer': 'adam', 'graph_mode': 'off', 'use_snp_selection': True, 'num_snps': 58778}. Best is trial 119 with value: 0.38839046919030723.
[I 2025-12-06 05:56:14,333] Trial 141 finished with value: 0.38071217376426947 and parameters: {'model_type': 'mlp', 'hidden_dims': '[512, 128]', 'dropout': 0.5781046059425039, 'batch_norm': False, 'lr': 2.0489642947958676e-06, 'weight_decay': 0.0006580360730967888, 'epochs': 344, 'loss': 'mse', 'optimizer': 'adam', 'graph_mode': 'off', 'use_snp_selection': True, 'num_snps': 49588}. Best is trial 119 with value: 0.38839046919030723.
[I 2025-12-06 05:57:39,152] Trial 142 finished with value: 0.3744393828428335 and parameters: {'model_type': 'mlp', 'hidden_dims': '[512, 128]', 'dropout': 0.5999616882795393, 'batch_norm': False, 'lr': 1.5366550683835652e-06, 'weight_decay': 0.0003089475718160556, 'epochs': 350, 'loss': 'mse', 'optimizer': 'adam', 'graph_mode': 'off', 'use_snp_selection': True, 'num_snps': 46895}. Best is trial 119 with value: 0.38839046919030723.
[I 2025-12-06 05:59:09,831] Trial 143 finished with value: 0.3774169524007801 and parameters: {'model_type': 'mlp', 'hidden_dims': '[512, 128]', 'dropout': 0.5782601238966466, 'batch_norm': False, 'lr': 1.8686859030734575e-06, 'weight_decay': 0.0004001038047354267, 'epochs': 339, 'loss': 'mse', 'optimizer': 'adam', 'graph_mode': 'off', 'use_snp_selection': True, 'num_snps': 52571}. Best is trial 119 with value: 0.38839046919030723.
[I 2025-12-06 06:00:39,208] Trial 144 finished with value: 0.38246498008083274 and parameters: {'model_type': 'mlp', 'hidden_dims': '[512, 128]', 'dropout': 0.5728223867078309, 'batch_norm': False, 'lr': 2.4805733568339276e-06, 'weight_decay': 0.00025604579468727014, 'epochs': 345, 'loss': 'mse', 'optimizer': 'adam', 'graph_mode': 'off', 'use_snp_selection': True, 'num_snps': 50813}. Best is trial 119 with value: 0.38839046919030723.
[I 2025-12-06 06:02:06,987] Trial 145 finished with value: 0.3405176318235468 and parameters: {'model_type': 'mlp', 'hidden_dims': '[512, 128]', 'dropout': 0.5555662776108129, 'batch_norm': False, 'lr': 2.871664461868988e-05, 'weight_decay': 0.00016044144378185183, 'epochs': 339, 'loss': 'mse', 'optimizer': 'adam', 'graph_mode': 'off', 'use_snp_selection': True, 'num_snps': 50974}. Best is trial 119 with value: 0.38839046919030723.
[I 2025-12-06 06:03:15,938] Trial 146 finished with value: 0.3774373783971078 and parameters: {'model_type': 'mlp', 'hidden_dims': '[512, 128]', 'dropout': 0.5661937725069135, 'batch_norm': False, 'lr': 2.361077340818492e-06, 'weight_decay': 0.000265757810683935, 'epochs': 226, 'loss': 'mse', 'optimizer': 'adam', 'graph_mode': 'off', 'use_snp_selection': True, 'num_snps': 49088}. Best is trial 119 with value: 0.38839046919030723.
[I 2025-12-06 06:04:24,270] Trial 147 finished with value: 0.37065883352075246 and parameters: {'model_type': 'mlp', 'hidden_dims': '[256, 128, 64]', 'dropout': 0.5341629867528738, 'batch_norm': False, 'lr': 2.031619515364744e-06, 'weight_decay': 0.0002153641182220622, 'epochs': 332, 'loss': 'mse', 'optimizer': 'adam', 'graph_mode': 'off', 'use_snp_selection': True, 'num_snps': 56467}. Best is trial 119 with value: 0.38839046919030723.
[I 2025-12-06 06:05:13,699] Trial 148 finished with value: 0.3486731045940255 and parameters: {'model_type': 'mlp', 'hidden_dims': '[512, 128]', 'dropout': 0.5870399886145782, 'batch_norm': False, 'lr': 3.1815934372454477e-06, 'weight_decay': 0.0003447305393396492, 'epochs': 77, 'loss': 'mse', 'optimizer': 'adam', 'graph_mode': 'off', 'use_snp_selection': True, 'num_snps': 52228}. Best is trial 119 with value: 0.38839046919030723.
[I 2025-12-06 06:06:47,747] Trial 149 finished with value: 0.377518933248037 and parameters: {'model_type': 'mlp', 'hidden_dims': '[512, 128]', 'dropout': 0.5501564950827126, 'batch_norm': False, 'lr': 1.3501222459184693e-06, 'weight_decay': 0.00018348682998825934, 'epochs': 343, 'loss': 'mse', 'optimizer': 'adam', 'graph_mode': 'off', 'use_snp_selection': True, 'num_snps': 54364}. Best is trial 119 with value: 0.38839046919030723.
[I 2025-12-06 06:07:56,954] Trial 0 finished with value: 0.28718144484856534 and parameters: {'model_type': 'mlp', 'hidden_dims': '[128, 64]', 'dropout': 0.199031432379812, 'batch_norm': True, 'lr': 1.8408544111075837e-06, 'weight_decay': 5.5136510071208614e-05, 'epochs': 336, 'loss': 'mae', 'optimizer': 'adam', 'graph_mode': 'off', 'use_snp_selection': True, 'num_snps': 43862}. Best is trial 0 with value: 0.28718144484856534.
[I 2025-12-06 06:08:25,799] Trial 1 finished with value: 0.3393037822805336 and parameters: {'model_type': 'mlp', 'hidden_dims': '[256, 128]', 'dropout': 0.4370668075331726, 'batch_norm': True, 'lr': 7.133471581159139e-05, 'weight_decay': 1.128633586803549e-05, 'epochs': 242, 'loss': 'mae', 'optimizer': 'adam', 'graph_mode': 'off', 'use_snp_selection': False}. Best is trial 1 with value: 0.3393037822805336.
[I 2025-12-06 06:08:53,557] Trial 2 finished with value: 0.33517268514482457 and parameters: {'model_type': 'mlp', 'hidden_dims': '[256, 128, 64]', 'dropout': 0.41314357415569625, 'batch_norm': False, 'lr': 3.952233718592101e-06, 'weight_decay': 0.00026754769258252603, 'epochs': 149, 'loss': 'mse', 'optimizer': 'adam', 'graph_mode': 'off', 'use_snp_selection': True, 'num_snps': 11571}. Best is trial 1 with value: 0.3393037822805336.
[I 2025-12-06 06:09:59,207] Trial 3 finished with value: 0.3684221724282802 and parameters: {'model_type': 'mlp', 'hidden_dims': '[512, 64]', 'dropout': 0.5938127374509361, 'batch_norm': False, 'lr': 5.67704586114731e-06, 'weight_decay': 2.4518087630137052e-05, 'epochs': 320, 'loss': 'mae', 'optimizer': 'adam', 'graph_mode': 'off', 'use_snp_selection': False}. Best is trial 3 with value: 0.3684221724282802.
[I 2025-12-06 06:11:04,104] Trial 4 finished with value: 0.3079396365662837 and parameters: {'model_type': 'mlp', 'hidden_dims': '[512, 128]', 'dropout': 0.25746343592134413, 'batch_norm': True, 'lr': 1.3467657668402788e-06, 'weight_decay': 0.00033087251918647806, 'epochs': 277, 'loss': 'mse', 'optimizer': 'adam', 'graph_mode': 'off', 'use_snp_selection': True, 'num_snps': 36675}. Best is trial 3 with value: 0.3684221724282802.
[I 2025-12-06 06:11:49,513] Trial 5 finished with value: 0.29901837539348824 and parameters: {'model_type': 'mlp', 'hidden_dims': '[512, 64]', 'dropout': 0.38275350994408375, 'batch_norm': True, 'lr': 1.5586664309232824e-06, 'weight_decay': 0.0008227664668621182, 'epochs': 145, 'loss': 'mae', 'optimizer': 'adam', 'graph_mode': 'off', 'use_snp_selection': True, 'num_snps': 32148}. Best is trial 3 with value: 0.3684221724282802.
[I 2025-12-06 06:12:13,342] Trial 6 finished with value: 0.35557795116795743 and parameters: {'model_type': 'mlp', 'hidden_dims': '[256, 128]', 'dropout': 0.3930109900265879, 'batch_norm': False, 'lr': 4.892964372128395e-05, 'weight_decay': 1.5809549317992182e-06, 'epochs': 199, 'loss': 'mse', 'optimizer': 'adam', 'graph_mode': 'off', 'use_snp_selection': False}. Best is trial 3 with value: 0.3684221724282802.
[I 2025-12-06 06:12:37,249] Trial 7 finished with value: 0.3400035162692204 and parameters: {'model_type': 'mlp', 'hidden_dims': '[512, 256]', 'dropout': 0.15343979219678458, 'batch_norm': True, 'lr': 6.234003099047341e-05, 'weight_decay': 3.894760610535477e-07, 'epochs': 97, 'loss': 'mse', 'optimizer': 'adam', 'graph_mode': 'off', 'use_snp_selection': False}. Best is trial 3 with value: 0.3684221724282802.
[I 2025-12-06 06:13:42,565] Trial 8 finished with value: 0.3423022281719371 and parameters: {'model_type': 'mlp', 'hidden_dims': '[512, 128]', 'dropout': 0.10743001231661406, 'batch_norm': True, 'lr': 0.00023728538449271062, 'weight_decay': 1.7629071578048637e-05, 'epochs': 312, 'loss': 'mae', 'optimizer': 'adam', 'graph_mode': 'off', 'use_snp_selection': False}. Best is trial 3 with value: 0.3684221724282802.
[I 2025-12-06 06:14:21,569] Trial 9 finished with value: 0.346295317901966 and parameters: {'model_type': 'mlp', 'hidden_dims': '[512, 64]', 'dropout': 0.14505336736221927, 'batch_norm': True, 'lr': 5.8619638388111826e-05, 'weight_decay': 6.200156172669308e-07, 'epochs': 175, 'loss': 'mse', 'optimizer': 'adam', 'graph_mode': 'off', 'use_snp_selection': False}. Best is trial 3 with value: 0.3684221724282802.
[I 2025-12-06 06:14:37,251] Trial 10 finished with value: 0.3341948511581644 and parameters: {'model_type': 'mlp', 'hidden_dims': '[512, 64]', 'dropout': 0.5885461262002587, 'batch_norm': False, 'lr': 8.769366258768696e-06, 'weight_decay': 2.78273193871783e-06, 'epochs': 55, 'loss': 'mae', 'optimizer': 'adam', 'graph_mode': 'off', 'use_snp_selection': False}. Best is trial 3 with value: 0.3684221724282802.
[I 2025-12-06 06:15:04,710] Trial 11 finished with value: 0.36370868551517027 and parameters: {'model_type': 'mlp', 'hidden_dims': '[256, 128]', 'dropout': 0.583942291816117, 'batch_norm': False, 'lr': 1.422933652790185e-05, 'weight_decay': 2.805519019095577e-06, 'epochs': 231, 'loss': 'mse', 'optimizer': 'adam', 'graph_mode': 'off', 'use_snp_selection': False}. Best is trial 3 with value: 0.3684221724282802.
[I 2025-12-06 06:15:32,517] Trial 12 finished with value: 0.36952950672583545 and parameters: {'model_type': 'mlp', 'hidden_dims': '[256, 128]', 'dropout': 0.593097749012682, 'batch_norm': False, 'lr': 1.1374686318732863e-05, 'weight_decay': 1.3081036432574914e-07, 'epochs': 233, 'loss': 'mae', 'optimizer': 'adam', 'graph_mode': 'off', 'use_snp_selection': False}. Best is trial 12 with value: 0.36952950672583545.
[I 2025-12-06 06:15:52,648] Trial 13 finished with value: 0.3636474643954305 and parameters: {'model_type': 'mlp', 'hidden_dims': '[128, 64]', 'dropout': 0.5043641748401543, 'batch_norm': False, 'lr': 1.262035332095525e-05, 'weight_decay': 1.0885943577911259e-07, 'epochs': 285, 'loss': 'mae', 'optimizer': 'adam', 'graph_mode': 'off', 'use_snp_selection': False}. Best is trial 12 with value: 0.36952950672583545.
[I 2025-12-06 06:17:04,233] Trial 14 finished with value: 0.3690996870711085 and parameters: {'model_type': 'mlp', 'hidden_dims': '[512, 256]', 'dropout': 0.5300180653494536, 'batch_norm': False, 'lr': 5.096356034191146e-06, 'weight_decay': 4.7581885634242365e-05, 'epochs': 345, 'loss': 'mae', 'optimizer': 'adam', 'graph_mode': 'off', 'use_snp_selection': False}. Best is trial 12 with value: 0.36952950672583545.
[I 2025-12-06 06:17:55,461] Trial 15 finished with value: 0.35766559621870125 and parameters: {'model_type': 'mlp', 'hidden_dims': '[512, 256]', 'dropout': 0.50071393962227, 'batch_norm': False, 'lr': 2.2256887240255933e-05, 'weight_decay': 6.91081660772694e-05, 'epochs': 244, 'loss': 'mae', 'optimizer': 'adam', 'graph_mode': 'off', 'use_snp_selection': False}. Best is trial 12 with value: 0.36952950672583545.
[I 2025-12-06 06:19:05,552] Trial 16 finished with value: 0.33570623076706685 and parameters: {'model_type': 'mlp', 'hidden_dims': '[512, 256]', 'dropout': 0.29858025320781567, 'batch_norm': False, 'lr': 0.00026660340143421223, 'weight_decay': 1.0590314199196095e-07, 'epochs': 349, 'loss': 'mae', 'optimizer': 'adam', 'graph_mode': 'off', 'use_snp_selection': False}. Best is trial 12 with value: 0.36952950672583545.
[I 2025-12-06 06:19:37,345] Trial 17 finished with value: 0.049673648912406235 and parameters: {'model_type': 'mlp', 'hidden_dims': '[256, 128, 64]', 'dropout': 0.4973360034827234, 'batch_norm': False, 'lr': 0.000906375209920231, 'weight_decay': 7.64402049066398e-05, 'epochs': 278, 'loss': 'mae', 'optimizer': 'adam', 'graph_mode': 'off', 'use_snp_selection': False}. Best is trial 12 with value: 0.36952950672583545.
[I 2025-12-06 06:20:33,052] Trial 18 finished with value: 0.36467661848707894 and parameters: {'model_type': 'mlp', 'hidden_dims': '[256, 128]', 'dropout': 0.5306024267342098, 'batch_norm': False, 'lr': 3.3005598272130625e-06, 'weight_decay': 5.409591144113358e-06, 'epochs': 193, 'loss': 'mae', 'optimizer': 'adam', 'graph_mode': 'off', 'use_snp_selection': True, 'num_snps': 58241}. Best is trial 12 with value: 0.36952950672583545.
