[I 2025-12-06 12:32:07,530] Trial 139 finished with value: 0.23789421747944664 and parameters: {'model_type': 'mlp', 'hidden_dims': '[256, 128, 64]', 'dropout': 0.5105181452243105, 'batch_norm': False, 'lr': 1.3163596905666065e-06, 'weight_decay': 2.873367277721598e-07, 'epochs': 218, 'loss': 'mae', 'optimizer': 'adam', 'graph_mode': 'off', 'use_snp_selection': False}. Best is trial 102 with value: 0.2868643764237585.
[I 2025-12-06 12:33:02,389] Trial 140 finished with value: 0.21187652494265077 and parameters: {'model_type': 'mlp', 'hidden_dims': '[512, 64]', 'dropout': 0.5276156882908272, 'batch_norm': False, 'lr': 1.01172845775103e-06, 'weight_decay': 2.132200387892175e-07, 'epochs': 170, 'loss': 'mae', 'optimizer': 'adam', 'graph_mode': 'off', 'use_snp_selection': False}. Best is trial 102 with value: 0.2868643764237585.
[I 2025-12-06 12:35:02,373] Trial 141 finished with value: 0.2650344416067119 and parameters: {'model_type': 'mlp', 'hidden_dims': '[512, 256]', 'dropout': 0.4879669499195754, 'batch_norm': False, 'lr': 2.059607139318701e-06, 'weight_decay': 1.8699352196232107e-06, 'epochs': 284, 'loss': 'mae', 'optimizer': 'adam', 'graph_mode': 'off', 'use_snp_selection': True, 'num_snps': 56985}. Best is trial 102 with value: 0.2868643764237585.
[I 2025-12-06 12:36:14,242] Trial 142 finished with value: 0.2505923374735355 and parameters: {'model_type': 'mlp', 'hidden_dims': '[512, 256]', 'dropout': 0.1928448242367351, 'batch_norm': False, 'lr': 1.5343991497473565e-06, 'weight_decay': 5.907299629437326e-07, 'epochs': 274, 'loss': 'mae', 'optimizer': 'adam', 'graph_mode': 'off', 'use_snp_selection': True, 'num_snps': 27745}. Best is trial 102 with value: 0.2868643764237585.
[I 2025-12-06 12:38:04,795] Trial 143 finished with value: 0.2759748182188067 and parameters: {'model_type': 'mlp', 'hidden_dims': '[512, 256]', 'dropout': 0.4638530755873576, 'batch_norm': False, 'lr': 1.8807663986156398e-06, 'weight_decay': 4.240823994510714e-07, 'epochs': 266, 'loss': 'mae', 'optimizer': 'adam', 'graph_mode': 'off', 'use_snp_selection': True, 'num_snps': 53649}. Best is trial 102 with value: 0.2868643764237585.
[I 2025-12-06 12:39:54,935] Trial 144 finished with value: 0.2672257887788429 and parameters: {'model_type': 'mlp', 'hidden_dims': '[512, 256]', 'dropout': 0.44242093167204266, 'batch_norm': False, 'lr': 1.785246357915742e-06, 'weight_decay': 3.687757318150201e-07, 'epochs': 267, 'loss': 'mae', 'optimizer': 'adam', 'graph_mode': 'off', 'use_snp_selection': True, 'num_snps': 53500}. Best is trial 102 with value: 0.2868643764237585.
[I 2025-12-06 12:41:45,584] Trial 145 finished with value: 0.2735566287926707 and parameters: {'model_type': 'mlp', 'hidden_dims': '[512, 256]', 'dropout': 0.4648314932807464, 'batch_norm': False, 'lr': 2.887449491004346e-06, 'weight_decay': 7.687287936664225e-07, 'epochs': 299, 'loss': 'mae', 'optimizer': 'adam', 'graph_mode': 'off', 'use_snp_selection': True, 'num_snps': 48945}. Best is trial 102 with value: 0.2868643764237585.
[I 2025-12-06 12:43:10,158] Trial 146 finished with value: 0.24893390587617037 and parameters: {'model_type': 'mlp', 'hidden_dims': '[256, 128]', 'dropout': 0.469150731508174, 'batch_norm': False, 'lr': 2.2985291823866158e-06, 'weight_decay': 4.605931913912995e-07, 'epochs': 261, 'loss': 'mae', 'optimizer': 'adam', 'graph_mode': 'off', 'use_snp_selection': True, 'num_snps': 59878}. Best is trial 102 with value: 0.2868643764237585.
[I 2025-12-06 12:44:56,479] Trial 147 finished with value: 0.18262077632787066 and parameters: {'model_type': 'mlp', 'hidden_dims': '[512, 256]', 'dropout': 0.34623543655496075, 'batch_norm': True, 'lr': 1.2081925616505926e-06, 'weight_decay': 3.939273945235827e-07, 'epochs': 291, 'loss': 'mae', 'optimizer': 'adam', 'graph_mode': 'off', 'use_snp_selection': True, 'num_snps': 47384}. Best is trial 102 with value: 0.2868643764237585.
[I 2025-12-06 12:46:40,090] Trial 148 finished with value: 0.270077987000032 and parameters: {'model_type': 'mlp', 'hidden_dims': '[512, 256]', 'dropout': 0.4493975967541619, 'batch_norm': False, 'lr': 1.5713498527056573e-06, 'weight_decay': 3.0331200024872867e-07, 'epochs': 245, 'loss': 'mae', 'optimizer': 'adam', 'graph_mode': 'off', 'use_snp_selection': True, 'num_snps': 52504}. Best is trial 102 with value: 0.2868643764237585.
[I 2025-12-06 12:47:44,568] Trial 149 finished with value: 0.25605957705482146 and parameters: {'model_type': 'mlp', 'hidden_dims': '[128, 64]', 'dropout': 0.43225833928578733, 'batch_norm': False, 'lr': 3.297310294249612e-05, 'weight_decay': 1.6214611489307916e-07, 'epochs': 281, 'loss': 'mae', 'optimizer': 'adam', 'graph_mode': 'off', 'use_snp_selection': True, 'num_snps': 54288}. Best is trial 102 with value: 0.2868643764237585.
[I 2025-12-06 12:48:56,919] Trial 0 finished with value: 0.17366441777312513 and parameters: {'model_type': 'mlp', 'hidden_dims': '[128, 64]', 'dropout': 0.199031432379812, 'batch_norm': True, 'lr': 1.8408544111075837e-06, 'weight_decay': 5.5136510071208614e-05, 'epochs': 336, 'loss': 'mae', 'optimizer': 'adam', 'graph_mode': 'off', 'use_snp_selection': True, 'num_snps': 43862}. Best is trial 0 with value: 0.17366441777312513.
[I 2025-12-06 12:49:37,533] Trial 1 finished with value: 0.24213400897835577 and parameters: {'model_type': 'mlp', 'hidden_dims': '[256, 128]', 'dropout': 0.4370668075331726, 'batch_norm': True, 'lr': 7.133471581159139e-05, 'weight_decay': 1.128633586803549e-05, 'epochs': 242, 'loss': 'mae', 'optimizer': 'adam', 'graph_mode': 'off', 'use_snp_selection': False}. Best is trial 1 with value: 0.24213400897835577.
[I 2025-12-06 12:50:14,481] Trial 2 finished with value: 0.21034087778008356 and parameters: {'model_type': 'mlp', 'hidden_dims': '[256, 128, 64]', 'dropout': 0.41314357415569625, 'batch_norm': False, 'lr': 3.952233718592101e-06, 'weight_decay': 0.00026754769258252603, 'epochs': 149, 'loss': 'mse', 'optimizer': 'adam', 'graph_mode': 'off', 'use_snp_selection': True, 'num_snps': 11571}. Best is trial 1 with value: 0.24213400897835577.
[I 2025-12-06 12:51:50,015] Trial 3 finished with value: 0.27025514240273874 and parameters: {'model_type': 'mlp', 'hidden_dims': '[512, 64]', 'dropout': 0.5938127374509361, 'batch_norm': False, 'lr': 5.67704586114731e-06, 'weight_decay': 2.4518087630137052e-05, 'epochs': 320, 'loss': 'mae', 'optimizer': 'adam', 'graph_mode': 'off', 'use_snp_selection': False}. Best is trial 3 with value: 0.27025514240273874.
[I 2025-12-06 12:53:15,424] Trial 4 finished with value: 0.18163566747585227 and parameters: {'model_type': 'mlp', 'hidden_dims': '[512, 128]', 'dropout': 0.25746343592134413, 'batch_norm': True, 'lr': 1.3467657668402788e-06, 'weight_decay': 0.00033087251918647806, 'epochs': 277, 'loss': 'mse', 'optimizer': 'adam', 'graph_mode': 'off', 'use_snp_selection': True, 'num_snps': 36675}. Best is trial 3 with value: 0.27025514240273874.
[I 2025-12-06 12:54:15,076] Trial 5 finished with value: 0.14526338642500378 and parameters: {'model_type': 'mlp', 'hidden_dims': '[512, 64]', 'dropout': 0.38275350994408375, 'batch_norm': True, 'lr': 1.5586664309232824e-06, 'weight_decay': 0.0008227664668621182, 'epochs': 145, 'loss': 'mae', 'optimizer': 'adam', 'graph_mode': 'off', 'use_snp_selection': True, 'num_snps': 32148}. Best is trial 3 with value: 0.27025514240273874.
[I 2025-12-06 12:54:48,620] Trial 6 finished with value: 0.24919278403962553 and parameters: {'model_type': 'mlp', 'hidden_dims': '[256, 128]', 'dropout': 0.3930109900265879, 'batch_norm': False, 'lr': 4.892964372128395e-05, 'weight_decay': 1.5809549317992182e-06, 'epochs': 199, 'loss': 'mse', 'optimizer': 'adam', 'graph_mode': 'off', 'use_snp_selection': False}. Best is trial 3 with value: 0.27025514240273874.
[I 2025-12-06 12:55:23,207] Trial 7 finished with value: 0.2501523787395432 and parameters: {'model_type': 'mlp', 'hidden_dims': '[512, 256]', 'dropout': 0.15343979219678458, 'batch_norm': True, 'lr': 6.234003099047341e-05, 'weight_decay': 3.894760610535477e-07, 'epochs': 97, 'loss': 'mse', 'optimizer': 'adam', 'graph_mode': 'off', 'use_snp_selection': False}. Best is trial 3 with value: 0.27025514240273874.
[I 2025-12-06 12:56:58,298] Trial 8 finished with value: 0.2608388888433084 and parameters: {'model_type': 'mlp', 'hidden_dims': '[512, 128]', 'dropout': 0.10743001231661406, 'batch_norm': True, 'lr': 0.00023728538449271062, 'weight_decay': 1.7629071578048637e-05, 'epochs': 312, 'loss': 'mae', 'optimizer': 'adam', 'graph_mode': 'off', 'use_snp_selection': False}. Best is trial 3 with value: 0.27025514240273874.
[I 2025-12-06 12:57:54,856] Trial 9 finished with value: 0.25459381942915493 and parameters: {'model_type': 'mlp', 'hidden_dims': '[512, 64]', 'dropout': 0.14505336736221927, 'batch_norm': True, 'lr': 5.8619638388111826e-05, 'weight_decay': 6.200156172669308e-07, 'epochs': 175, 'loss': 'mse', 'optimizer': 'adam', 'graph_mode': 'off', 'use_snp_selection': False}. Best is trial 3 with value: 0.27025514240273874.
[I 2025-12-06 12:58:17,478] Trial 10 finished with value: 0.2529367854978101 and parameters: {'model_type': 'mlp', 'hidden_dims': '[512, 64]', 'dropout': 0.5885461262002587, 'batch_norm': False, 'lr': 8.769366258768696e-06, 'weight_decay': 2.78273193871783e-06, 'epochs': 55, 'loss': 'mae', 'optimizer': 'adam', 'graph_mode': 'off', 'use_snp_selection': False}. Best is trial 3 with value: 0.27025514240273874.
[I 2025-12-06 12:59:58,378] Trial 11 finished with value: 0.22869357481363867 and parameters: {'model_type': 'mlp', 'hidden_dims': '[512, 128]', 'dropout': 0.583942291816117, 'batch_norm': False, 'lr': 0.0007607980626791682, 'weight_decay': 2.11387030344014e-05, 'epochs': 346, 'loss': 'mae', 'optimizer': 'adam', 'graph_mode': 'off', 'use_snp_selection': False}. Best is trial 3 with value: 0.27025514240273874.
[I 2025-12-06 13:01:25,778] Trial 12 finished with value: 0.26456220225205895 and parameters: {'model_type': 'mlp', 'hidden_dims': '[512, 128]', 'dropout': 0.2637316882220091, 'batch_norm': False, 'lr': 0.000384886887018818, 'weight_decay': 6.23587291883057e-05, 'epochs': 294, 'loss': 'mae', 'optimizer': 'adam', 'graph_mode': 'off', 'use_snp_selection': False}. Best is trial 3 with value: 0.27025514240273874.
[I 2025-12-06 13:01:50,278] Trial 13 finished with value: 0.26718831195794834 and parameters: {'model_type': 'mlp', 'hidden_dims': '[128, 64]', 'dropout': 0.28178980110198326, 'batch_norm': False, 'lr': 1.3373175420781734e-05, 'weight_decay': 7.287276573694029e-05, 'epochs': 258, 'loss': 'mae', 'optimizer': 'adam', 'graph_mode': 'off', 'use_snp_selection': False}. Best is trial 3 with value: 0.27025514240273874.
[I 2025-12-06 13:02:14,214] Trial 14 finished with value: 0.2731434319729535 and parameters: {'model_type': 'mlp', 'hidden_dims': '[128, 64]', 'dropout': 0.49945838328795056, 'batch_norm': False, 'lr': 1.3128901291408973e-05, 'weight_decay': 1.1414924884997386e-07, 'epochs': 253, 'loss': 'mae', 'optimizer': 'adam', 'graph_mode': 'off', 'use_snp_selection': False}. Best is trial 14 with value: 0.2731434319729535.
[I 2025-12-06 13:02:36,460] Trial 15 finished with value: 0.26786604452175705 and parameters: {'model_type': 'mlp', 'hidden_dims': '[128, 64]', 'dropout': 0.49906818850328205, 'batch_norm': False, 'lr': 1.8411764708572348e-05, 'weight_decay': 1.2323424272263762e-07, 'epochs': 231, 'loss': 'mae', 'optimizer': 'adam', 'graph_mode': 'off', 'use_snp_selection': False}. Best is trial 14 with value: 0.2731434319729535.
[I 2025-12-06 13:03:14,007] Trial 16 finished with value: 0.2690386520508315 and parameters: {'model_type': 'mlp', 'hidden_dims': '[256, 128, 64]', 'dropout': 0.5162771484329657, 'batch_norm': False, 'lr': 6.013316929814413e-06, 'weight_decay': 2.66242976641068e-06, 'epochs': 220, 'loss': 'mae', 'optimizer': 'adam', 'graph_mode': 'off', 'use_snp_selection': False}. Best is trial 14 with value: 0.2731434319729535.
[I 2025-12-06 13:04:44,873] Trial 17 finished with value: 0.2751062484365413 and parameters: {'model_type': 'mlp', 'hidden_dims': '[512, 256]', 'dropout': 0.4976434386489672, 'batch_norm': False, 'lr': 3.378196935792496e-06, 'weight_decay': 1.402638371047158e-07, 'epochs': 298, 'loss': 'mae', 'optimizer': 'adam', 'graph_mode': 'off', 'use_snp_selection': False}. Best is trial 17 with value: 0.2751062484365413.
[I 2025-12-06 13:06:43,624] Trial 18 finished with value: 0.26398718220092265 and parameters: {'model_type': 'mlp', 'hidden_dims': '[512, 256]', 'dropout': 0.48906034616476446, 'batch_norm': False, 'lr': 2.2353259688531646e-05, 'weight_decay': 1.896308872976838e-07, 'epochs': 282, 'loss': 'mae', 'optimizer': 'adam', 'graph_mode': 'off', 'use_snp_selection': True, 'num_snps': 58241}. Best is trial 17 with value: 0.2751062484365413.
[I 2025-12-06 13:08:03,694] Trial 19 finished with value: 0.2665436440625595 and parameters: {'model_type': 'mlp', 'hidden_dims': '[512, 256]', 'dropout': 0.321742788192223, 'batch_norm': False, 'lr': 2.7960991179492955e-06, 'weight_decay': 7.036554490779244e-07, 'epochs': 260, 'loss': 'mae', 'optimizer': 'adam', 'graph_mode': 'off', 'use_snp_selection': False}. Best is trial 17 with value: 0.2751062484365413.
[I 2025-12-06 13:08:23,208] Trial 20 finished with value: 0.25873833173238603 and parameters: {'model_type': 'mlp', 'hidden_dims': '[128, 64]', 'dropout': 0.5374805525865108, 'batch_norm': False, 'lr': 0.00014700841231659668, 'weight_decay': 2.677642538073776e-07, 'epochs': 196, 'loss': 'mae', 'optimizer': 'adam', 'graph_mode': 'off', 'use_snp_selection': False}. Best is trial 17 with value: 0.2751062484365413.
[I 2025-12-06 13:09:59,079] Trial 21 finished with value: 0.26520656229921746 and parameters: {'model_type': 'mlp', 'hidden_dims': '[512, 64]', 'dropout': 0.5551594855246745, 'batch_norm': False, 'lr': 7.061203076623522e-06, 'weight_decay': 1.0912058494088967e-07, 'epochs': 319, 'loss': 'mae', 'optimizer': 'adam', 'graph_mode': 'off', 'use_snp_selection': False}. Best is trial 17 with value: 0.2751062484365413.
[I 2025-12-06 13:11:31,846] Trial 22 finished with value: 0.2693119143364726 and parameters: {'model_type': 'mlp', 'hidden_dims': '[512, 256]', 'dropout': 0.4540600793257886, 'batch_norm': False, 'lr': 4.121701043139613e-06, 'weight_decay': 4.905653876075577e-06, 'epochs': 304, 'loss': 'mae', 'optimizer': 'adam', 'graph_mode': 'off', 'use_snp_selection': False}. Best is trial 17 with value: 0.2751062484365413.
[I 2025-12-06 13:13:09,461] Trial 23 finished with value: 0.25989204411932904 and parameters: {'model_type': 'mlp', 'hidden_dims': '[512, 64]', 'dropout': 0.4724962128152971, 'batch_norm': False, 'lr': 1.2095324892817102e-05, 'weight_decay': 1.0699770451891937e-06, 'epochs': 326, 'loss': 'mae', 'optimizer': 'adam', 'graph_mode': 'off', 'use_snp_selection': False}. Best is trial 17 with value: 0.2751062484365413.
[I 2025-12-06 13:13:34,780] Trial 24 finished with value: 0.2639319757365309 and parameters: {'model_type': 'mlp', 'hidden_dims': '[128, 64]', 'dropout': 0.5491564275192613, 'batch_norm': False, 'lr': 2.735121376945847e-06, 'weight_decay': 5.016324652695507e-06, 'epochs': 269, 'loss': 'mae', 'optimizer': 'adam', 'graph_mode': 'off', 'use_snp_selection': False}. Best is trial 17 with value: 0.2751062484365413.
[I 2025-12-06 13:15:04,872] Trial 25 finished with value: 0.2687668820460904 and parameters: {'model_type': 'mlp', 'hidden_dims': '[512, 256]', 'dropout': 0.599048443037655, 'batch_norm': False, 'lr': 5.450104373567729e-06, 'weight_decay': 2.7135650278957826e-07, 'epochs': 296, 'loss': 'mae', 'optimizer': 'adam', 'graph_mode': 'off', 'use_snp_selection': False}. Best is trial 17 with value: 0.2751062484365413.
[I 2025-12-06 13:15:39,046] Trial 26 finished with value: 0.2124220366243296 and parameters: {'model_type': 'mlp', 'hidden_dims': '[256, 128, 64]', 'dropout': 0.36196246652781894, 'batch_norm': False, 'lr': 3.054415193087715e-05, 'weight_decay': 3.363001981901425e-05, 'epochs': 345, 'loss': 'mse', 'optimizer': 'adam', 'graph_mode': 'off', 'use_snp_selection': True, 'num_snps': 3842}. Best is trial 17 with value: 0.2751062484365413.
[I 2025-12-06 13:16:19,255] Trial 27 finished with value: 0.26773185653648457 and parameters: {'model_type': 'mlp', 'hidden_dims': '[256, 128]', 'dropout': 0.5186242708992924, 'batch_norm': False, 'lr': 1.1220608598724221e-05, 'weight_decay': 0.00018159878154878938, 'epochs': 242, 'loss': 'mae', 'optimizer': 'adam', 'graph_mode': 'off', 'use_snp_selection': False}. Best is trial 17 with value: 0.2751062484365413.
[I 2025-12-06 13:16:40,518] Trial 28 finished with value: 0.2226609021849189 and parameters: {'model_type': 'mlp', 'hidden_dims': '[128, 64]', 'dropout': 0.42922722360170795, 'batch_norm': False, 'lr': 1.0943587837281925e-06, 'weight_decay': 1.0006905253207943e-07, 'epochs': 215, 'loss': 'mae', 'optimizer': 'adam', 'graph_mode': 'off', 'use_snp_selection': False}. Best is trial 17 with value: 0.2751062484365413.
[I 2025-12-06 13:17:42,934] Trial 29 finished with value: 0.24859052293675776 and parameters: {'model_type': 'mlp', 'hidden_dims': '[512, 64]', 'dropout': 0.4751227859228855, 'batch_norm': False, 'lr': 2.320440320155318e-06, 'weight_decay': 0.00010774073487650296, 'epochs': 322, 'loss': 'mae', 'optimizer': 'adam', 'graph_mode': 'off', 'use_snp_selection': True, 'num_snps': 19468}. Best is trial 17 with value: 0.2751062484365413.
[I 2025-12-06 13:19:07,466] Trial 30 finished with value: 0.26148497150425515 and parameters: {'model_type': 'mlp', 'hidden_dims': '[512, 256]', 'dropout': 0.563339612033556, 'batch_norm': False, 'lr': 3.6345249195137736e-05, 'weight_decay': 6.3175895207505055e-06, 'epochs': 284, 'loss': 'mae', 'optimizer': 'adam', 'graph_mode': 'off', 'use_snp_selection': False}. Best is trial 17 with value: 0.2751062484365413.
[I 2025-12-06 13:20:40,544] Trial 31 finished with value: 0.26684831459303093 and parameters: {'model_type': 'mlp', 'hidden_dims': '[512, 256]', 'dropout': 0.4549329678355573, 'batch_norm': False, 'lr': 4.080223046991974e-06, 'weight_decay': 3.62040498582377e-05, 'epochs': 306, 'loss': 'mae', 'optimizer': 'adam', 'graph_mode': 'off', 'use_snp_selection': False}. Best is trial 17 with value: 0.2751062484365413.
[I 2025-12-06 13:22:20,789] Trial 32 finished with value: 0.27027607972647705 and parameters: {'model_type': 'mlp', 'hidden_dims': '[512, 256]', 'dropout': 0.4406880980440368, 'batch_norm': False, 'lr': 3.7533355602261455e-06, 'weight_decay': 9.384564907398571e-06, 'epochs': 331, 'loss': 'mae', 'optimizer': 'adam', 'graph_mode': 'off', 'use_snp_selection': False}. Best is trial 17 with value: 0.2751062484365413.
[I 2025-12-06 13:24:01,260] Trial 33 finished with value: 0.26865335306105553 and parameters: {'model_type': 'mlp', 'hidden_dims': '[512, 256]', 'dropout': 0.5079043174181219, 'batch_norm': False, 'lr': 1.8796469983019433e-06, 'weight_decay': 1.0281199863163163e-05, 'epochs': 332, 'loss': 'mae', 'optimizer': 'adam', 'graph_mode': 'off', 'use_snp_selection': False}. Best is trial 17 with value: 0.2751062484365413.
[I 2025-12-06 13:24:25,181] Trial 34 finished with value: 0.24397406304827163 and parameters: {'model_type': 'mlp', 'hidden_dims': '[128, 64]', 'dropout': 0.4279253130698772, 'batch_norm': True, 'lr': 8.462503627762325e-06, 'weight_decay': 5.835211738859762e-07, 'epochs': 246, 'loss': 'mae', 'optimizer': 'adam', 'graph_mode': 'off', 'use_snp_selection': False}. Best is trial 17 with value: 0.2751062484365413.
[I 2025-12-06 13:26:37,904] Trial 35 finished with value: 0.2536606282974075 and parameters: {'model_type': 'mlp', 'hidden_dims': '[512, 256]', 'dropout': 0.32964604986413154, 'batch_norm': False, 'lr': 3.3772190671287353e-06, 'weight_decay': 0.0009119597082290585, 'epochs': 335, 'loss': 'mse', 'optimizer': 'adam', 'graph_mode': 'off', 'use_snp_selection': True, 'num_snps': 57586}. Best is trial 17 with value: 0.2751062484365413.
[I 2025-12-06 13:27:22,838] Trial 36 finished with value: 0.2653249565764399 and parameters: {'model_type': 'mlp', 'hidden_dims': '[256, 128]', 'dropout': 0.4042710750183591, 'batch_norm': False, 'lr': 1.7451127780159537e-05, 'weight_decay': 1.998103925748335e-05, 'epochs': 276, 'loss': 'mae', 'optimizer': 'adam', 'graph_mode': 'off', 'use_snp_selection': False}. Best is trial 17 with value: 0.2751062484365413.
[I 2025-12-06 13:28:17,444] Trial 37 finished with value: 0.21278115382790394 and parameters: {'model_type': 'mlp', 'hidden_dims': '[256, 128, 64]', 'dropout': 0.5346475452070962, 'batch_norm': True, 'lr': 5.0196240317865055e-06, 'weight_decay': 1.090012344021007e-06, 'epochs': 348, 'loss': 'mse', 'optimizer': 'adam', 'graph_mode': 'off', 'use_snp_selection': True, 'num_snps': 22282}. Best is trial 17 with value: 0.2751062484365413.
[I 2025-12-06 13:29:09,571] Trial 38 finished with value: 0.2532570495321085 and parameters: {'model_type': 'mlp', 'hidden_dims': '[512, 64]', 'dropout': 0.36687557128064263, 'batch_norm': False, 'lr': 1.5574557933379718e-06, 'weight_decay': 0.00046644832351108945, 'epochs': 162, 'loss': 'mae', 'optimizer': 'adam', 'graph_mode': 'off', 'use_snp_selection': False}. Best is trial 17 with value: 0.2751062484365413.
[I 2025-12-06 13:30:40,925] Trial 39 finished with value: 0.20792786843703565 and parameters: {'model_type': 'mlp', 'hidden_dims': '[512, 256]', 'dropout': 0.5709025120477085, 'batch_norm': True, 'lr': 1.0358203565750975e-06, 'weight_decay': 1.7995963133747348e-07, 'epochs': 298, 'loss': 'mae', 'optimizer': 'adam', 'graph_mode': 'off', 'use_snp_selection': False}. Best is trial 17 with value: 0.2751062484365413.
[I 2025-12-06 13:31:22,837] Trial 40 finished with value: 0.24575902455906934 and parameters: {'model_type': 'mlp', 'hidden_dims': '[256, 128]', 'dropout': 0.45165010230028696, 'batch_norm': False, 'lr': 0.00010299837783030175, 'weight_decay': 1.7348724934858418e-06, 'epochs': 258, 'loss': 'mse', 'optimizer': 'adam', 'graph_mode': 'off', 'use_snp_selection': False}. Best is trial 17 with value: 0.2751062484365413.
