[I 2025-12-05 14:39:19,110] Trial 17 finished with value: 0.1301416932395865 and parameters: {'model_type': 'mlp', 'hidden_dims': '[128, 64]', 'dropout': 0.10230308008198463, 'batch_norm': True, 'lr': 0.0001700155970829766, 'weight_decay': 8.239060085464661e-05, 'epochs': 306, 'loss': 'mae', 'optimizer': 'adam', 'graph_mode': 'off', 'use_snp_selection': False}. Best is trial 8 with value: 0.15062274617222998.
[I 2025-12-05 14:39:24,868] Trial 18 finished with value: 0.10979218485246284 and parameters: {'model_type': 'mlp', 'hidden_dims': '[512, 256]', 'dropout': 0.33126133605940894, 'batch_norm': False, 'lr': 0.0009897362511876527, 'weight_decay': 9.994312378900002e-07, 'epochs': 263, 'loss': 'mae', 'optimizer': 'adam', 'graph_mode': 'off', 'use_snp_selection': True, 'num_snps': 58241}. Best is trial 8 with value: 0.15062274617222998.
[I 2025-12-05 14:39:28,070] Trial 19 finished with value: 0.12389376378025653 and parameters: {'model_type': 'mlp', 'hidden_dims': '[512, 128]', 'dropout': 0.23740597688310255, 'batch_norm': True, 'lr': 2.2789757615406074e-05, 'weight_decay': 7.0039813804930875e-06, 'epochs': 209, 'loss': 'mae', 'optimizer': 'adam', 'graph_mode': 'off', 'use_snp_selection': False}. Best is trial 8 with value: 0.15062274617222998.
[I 2025-12-05 14:39:32,455] Trial 20 finished with value: 0.14850291564128829 and parameters: {'model_type': 'mlp', 'hidden_dims': '[512, 128]', 'dropout': 0.5413334066271338, 'batch_norm': True, 'lr': 0.0003516836857329344, 'weight_decay': 2.571313541430049e-07, 'epochs': 311, 'loss': 'mae', 'optimizer': 'adam', 'graph_mode': 'off', 'use_snp_selection': False}. Best is trial 8 with value: 0.15062274617222998.
[I 2025-12-05 14:39:36,758] Trial 21 finished with value: 0.13010192278393187 and parameters: {'model_type': 'mlp', 'hidden_dims': '[512, 128]', 'dropout': 0.5456834029785789, 'batch_norm': True, 'lr': 0.0003415382041253303, 'weight_decay': 1.0767127144462166e-07, 'epochs': 304, 'loss': 'mae', 'optimizer': 'adam', 'graph_mode': 'off', 'use_snp_selection': False}. Best is trial 8 with value: 0.15062274617222998.
[I 2025-12-05 14:39:41,236] Trial 22 finished with value: 0.13741699841333288 and parameters: {'model_type': 'mlp', 'hidden_dims': '[512, 128]', 'dropout': 0.4574102870142017, 'batch_norm': True, 'lr': 0.00012154570102704964, 'weight_decay': 2.341643249004971e-07, 'epochs': 319, 'loss': 'mae', 'optimizer': 'adam', 'graph_mode': 'off', 'use_snp_selection': False}. Best is trial 8 with value: 0.15062274617222998.
[I 2025-12-05 14:39:45,023] Trial 23 finished with value: 0.12500515929880096 and parameters: {'model_type': 'mlp', 'hidden_dims': '[512, 128]', 'dropout': 0.5510283606672878, 'batch_norm': True, 'lr': 0.0004189289013969729, 'weight_decay': 1.8251352643327644e-06, 'epochs': 260, 'loss': 'mae', 'optimizer': 'adam', 'graph_mode': 'off', 'use_snp_selection': False}. Best is trial 8 with value: 0.15062274617222998.
[I 2025-12-05 14:39:49,852] Trial 24 finished with value: 0.1242403839289819 and parameters: {'model_type': 'mlp', 'hidden_dims': '[512, 128]', 'dropout': 0.46654996436896384, 'batch_norm': True, 'lr': 0.0006636105143234791, 'weight_decay': 4.7333128342612387e-07, 'epochs': 349, 'loss': 'mae', 'optimizer': 'adam', 'graph_mode': 'off', 'use_snp_selection': False}. Best is trial 8 with value: 0.15062274617222998.
[I 2025-12-05 14:39:54,082] Trial 25 finished with value: 0.13132814670299936 and parameters: {'model_type': 'mlp', 'hidden_dims': '[512, 128]', 'dropout': 0.5335323239954017, 'batch_norm': True, 'lr': 0.0002763369915810005, 'weight_decay': 1.5089181232408535e-05, 'epochs': 296, 'loss': 'mae', 'optimizer': 'adam', 'graph_mode': 'off', 'use_snp_selection': False}. Best is trial 8 with value: 0.15062274617222998.
[I 2025-12-05 14:39:55,891] Trial 26 finished with value: 0.1021576791875201 and parameters: {'model_type': 'mlp', 'hidden_dims': '[256, 128, 64]', 'dropout': 0.3301522988666219, 'batch_norm': True, 'lr': 0.00014032165783338225, 'weight_decay': 4.639083492956934e-06, 'epochs': 260, 'loss': 'mae', 'optimizer': 'adam', 'graph_mode': 'off', 'use_snp_selection': True, 'num_snps': 3842}. Best is trial 8 with value: 0.15062274617222998.
[I 2025-12-05 14:39:57,383] Trial 27 finished with value: 0.12711970496773198 and parameters: {'model_type': 'mlp', 'hidden_dims': '[128, 64]', 'dropout': 0.212734012477362, 'batch_norm': False, 'lr': 2.255373446711429e-05, 'weight_decay': 3.177679233246989e-05, 'epochs': 324, 'loss': 'mse', 'optimizer': 'adam', 'graph_mode': 'off', 'use_snp_selection': False}. Best is trial 8 with value: 0.15062274617222998.
[I 2025-12-05 14:40:00,700] Trial 28 finished with value: 0.14459860715656705 and parameters: {'model_type': 'mlp', 'hidden_dims': '[512, 256]', 'dropout': 0.5696959943327825, 'batch_norm': True, 'lr': 0.0006429127789572331, 'weight_decay': 0.00011837572117061313, 'epochs': 219, 'loss': 'mae', 'optimizer': 'adam', 'graph_mode': 'off', 'use_snp_selection': False}. Best is trial 8 with value: 0.15062274617222998.
[I 2025-12-05 14:40:02,947] Trial 29 finished with value: 0.10287924532025519 and parameters: {'model_type': 'mlp', 'hidden_dims': '[128, 64]', 'dropout': 0.16755615570094595, 'batch_norm': True, 'lr': 0.00011176149717096834, 'weight_decay': 1.2687211499385917e-06, 'epochs': 329, 'loss': 'mae', 'optimizer': 'adam', 'graph_mode': 'off', 'use_snp_selection': True, 'num_snps': 19468}. Best is trial 8 with value: 0.15062274617222998.
[I 2025-12-05 14:40:05,735] Trial 30 finished with value: 0.14312745074412545 and parameters: {'model_type': 'mlp', 'hidden_dims': '[512, 128]', 'dropout': 0.35744064431732625, 'batch_norm': True, 'lr': 0.00028257093975258234, 'weight_decay': 2.2351109162973748e-07, 'epochs': 174, 'loss': 'mae', 'optimizer': 'adam', 'graph_mode': 'off', 'use_snp_selection': False}. Best is trial 8 with value: 0.15062274617222998.
[I 2025-12-05 14:40:09,112] Trial 31 finished with value: 0.12038120423234003 and parameters: {'model_type': 'mlp', 'hidden_dims': '[512, 256]', 'dropout': 0.570664462012199, 'batch_norm': True, 'lr': 0.0006390668619708711, 'weight_decay': 0.0001034208875676758, 'epochs': 224, 'loss': 'mae', 'optimizer': 'adam', 'graph_mode': 'off', 'use_snp_selection': False}. Best is trial 8 with value: 0.15062274617222998.
[I 2025-12-05 14:40:12,838] Trial 32 finished with value: 0.14229636997673195 and parameters: {'model_type': 'mlp', 'hidden_dims': '[512, 256]', 'dropout': 0.5273959341242487, 'batch_norm': True, 'lr': 0.0005792990589876567, 'weight_decay': 0.0002109326680517033, 'epochs': 254, 'loss': 'mae', 'optimizer': 'adam', 'graph_mode': 'off', 'use_snp_selection': False}. Best is trial 8 with value: 0.15062274617222998.
[I 2025-12-05 14:40:16,819] Trial 33 finished with value: 0.13787868332214934 and parameters: {'model_type': 'mlp', 'hidden_dims': '[512, 256]', 'dropout': 0.45978464991169066, 'batch_norm': True, 'lr': 0.0002556032902583251, 'weight_decay': 0.0001645201514369745, 'epochs': 275, 'loss': 'mae', 'optimizer': 'adam', 'graph_mode': 'off', 'use_snp_selection': False}. Best is trial 8 with value: 0.15062274617222998.
[I 2025-12-05 14:40:20,087] Trial 34 finished with value: 0.15284138160430905 and parameters: {'model_type': 'mlp', 'hidden_dims': '[512, 256]', 'dropout': 0.5747746154311839, 'batch_norm': True, 'lr': 0.0008349423892197818, 'weight_decay': 3.732840185841628e-05, 'epochs': 215, 'loss': 'mae', 'optimizer': 'adam', 'graph_mode': 'off', 'use_snp_selection': False}. Best is trial 34 with value: 0.15284138160430905.
[I 2025-12-05 14:40:22,608] Trial 35 finished with value: 0.07238947194011519 and parameters: {'model_type': 'mlp', 'hidden_dims': '[256, 128]', 'dropout': 0.42887958946086446, 'batch_norm': False, 'lr': 0.0007898566171642459, 'weight_decay': 2.8782782537274217e-05, 'epochs': 302, 'loss': 'mae', 'optimizer': 'adam', 'graph_mode': 'off', 'use_snp_selection': False}. Best is trial 34 with value: 0.15284138160430905.
[I 2025-12-05 14:40:28,247] Trial 36 finished with value: 0.14260296182587018 and parameters: {'model_type': 'mlp', 'hidden_dims': '[512, 64]', 'dropout': 0.5724366335552699, 'batch_norm': True, 'lr': 0.00044165758251010756, 'weight_decay': 1.0687295154404784e-05, 'epochs': 245, 'loss': 'mse', 'optimizer': 'adam', 'graph_mode': 'off', 'use_snp_selection': True, 'num_snps': 58661}. Best is trial 34 with value: 0.15284138160430905.
[I 2025-12-05 14:40:30,060] Trial 37 finished with value: 0.014429652585144432 and parameters: {'model_type': 'mlp', 'hidden_dims': '[256, 128, 64]', 'dropout': 0.477915495890022, 'batch_norm': True, 'lr': 2.814873948011466e-06, 'weight_decay': 4.324362288577541e-05, 'epochs': 182, 'loss': 'mae', 'optimizer': 'adam', 'graph_mode': 'off', 'use_snp_selection': False}. Best is trial 34 with value: 0.15284138160430905.
[I 2025-12-05 14:40:32,480] Trial 38 finished with value: 0.11538624984296142 and parameters: {'model_type': 'mlp', 'hidden_dims': '[512, 128]', 'dropout': 0.4055298384555821, 'batch_norm': False, 'lr': 8.659559379292074e-05, 'weight_decay': 1.4718740952094895e-05, 'epochs': 159, 'loss': 'mse', 'optimizer': 'adam', 'graph_mode': 'off', 'use_snp_selection': True, 'num_snps': 19911}. Best is trial 34 with value: 0.15284138160430905.
[I 2025-12-05 14:40:34,762] Trial 39 finished with value: 0.1068644290452493 and parameters: {'model_type': 'mlp', 'hidden_dims': '[512, 256]', 'dropout': 0.5997651727402233, 'batch_norm': True, 'lr': 3.9880318821847514e-05, 'weight_decay': 0.000494866061743946, 'epochs': 130, 'loss': 'mae', 'optimizer': 'adam', 'graph_mode': 'off', 'use_snp_selection': False}. Best is trial 34 with value: 0.15284138160430905.
[I 2025-12-05 14:40:37,830] Trial 40 finished with value: 0.1267230536037355 and parameters: {'model_type': 'mlp', 'hidden_dims': '[512, 64]', 'dropout': 0.5238668295369414, 'batch_norm': True, 'lr': 0.0003378279859660943, 'weight_decay': 6.172390646922322e-05, 'epochs': 198, 'loss': 'mse', 'optimizer': 'adam', 'graph_mode': 'off', 'use_snp_selection': False}. Best is trial 34 with value: 0.15284138160430905.
[I 2025-12-05 14:40:41,143] Trial 41 finished with value: 0.14331416306406658 and parameters: {'model_type': 'mlp', 'hidden_dims': '[512, 256]', 'dropout': 0.5697770783911115, 'batch_norm': True, 'lr': 0.0007114019002352551, 'weight_decay': 0.00012461580914298513, 'epochs': 218, 'loss': 'mae', 'optimizer': 'adam', 'graph_mode': 'off', 'use_snp_selection': False}. Best is trial 34 with value: 0.15284138160430905.
[I 2025-12-05 14:40:44,373] Trial 42 finished with value: 0.1321102761438554 and parameters: {'model_type': 'mlp', 'hidden_dims': '[512, 256]', 'dropout': 0.564917155217664, 'batch_norm': True, 'lr': 0.0005291476973155032, 'weight_decay': 0.0004003103302747203, 'epochs': 210, 'loss': 'mae', 'optimizer': 'adam', 'graph_mode': 'off', 'use_snp_selection': False}. Best is trial 34 with value: 0.15284138160430905.
[I 2025-12-05 14:40:48,316] Trial 43 finished with value: 0.13771741217555486 and parameters: {'model_type': 'mlp', 'hidden_dims': '[512, 256]', 'dropout': 0.5050410105633031, 'batch_norm': True, 'lr': 0.0009559957386871317, 'weight_decay': 1.912585680011148e-05, 'epochs': 272, 'loss': 'mae', 'optimizer': 'adam', 'graph_mode': 'off', 'use_snp_selection': False}. Best is trial 34 with value: 0.15284138160430905.
[I 2025-12-05 14:40:50,454] Trial 44 finished with value: 0.13093724232449644 and parameters: {'model_type': 'mlp', 'hidden_dims': '[256, 128]', 'dropout': 0.5786717607349314, 'batch_norm': True, 'lr': 0.00020744873386006974, 'weight_decay': 4.049236020890635e-05, 'epochs': 236, 'loss': 'mae', 'optimizer': 'adam', 'graph_mode': 'off', 'use_snp_selection': False}. Best is trial 34 with value: 0.15284138160430905.
[I 2025-12-05 14:40:54,951] Trial 45 finished with value: 0.1431614029501839 and parameters: {'model_type': 'mlp', 'hidden_dims': '[512, 256]', 'dropout': 0.4356036677693436, 'batch_norm': True, 'lr': 0.0003753795014359183, 'weight_decay': 6.144005073122562e-06, 'epochs': 319, 'loss': 'mae', 'optimizer': 'adam', 'graph_mode': 'off', 'use_snp_selection': False}. Best is trial 34 with value: 0.15284138160430905.
[I 2025-12-05 14:40:59,044] Trial 46 finished with value: 0.12749832809672518 and parameters: {'model_type': 'mlp', 'hidden_dims': '[512, 128]', 'dropout': 0.5414102511257575, 'batch_norm': False, 'lr': 0.0005552765379343663, 'weight_decay': 2.140669802398178e-06, 'epochs': 288, 'loss': 'mae', 'optimizer': 'adam', 'graph_mode': 'off', 'use_snp_selection': False}. Best is trial 34 with value: 0.15284138160430905.
[I 2025-12-05 14:41:03,738] Trial 47 finished with value: 0.1416905453305144 and parameters: {'model_type': 'mlp', 'hidden_dims': '[512, 128]', 'dropout': 0.48390754118297197, 'batch_norm': True, 'lr': 8.019090122638471e-05, 'weight_decay': 7.383475264494008e-05, 'epochs': 337, 'loss': 'mae', 'optimizer': 'adam', 'graph_mode': 'off', 'use_snp_selection': False}. Best is trial 34 with value: 0.15284138160430905.
[I 2025-12-05 14:41:06,680] Trial 48 finished with value: 0.0049490553001184856 and parameters: {'model_type': 'mlp', 'hidden_dims': '[512, 256]', 'dropout': 0.5174226543081228, 'batch_norm': True, 'lr': 1.1170552432785515e-06, 'weight_decay': 0.0006963874766430621, 'epochs': 187, 'loss': 'mae', 'optimizer': 'adam', 'graph_mode': 'off', 'use_snp_selection': False}. Best is trial 34 with value: 0.15284138160430905.
[I 2025-12-05 14:41:09,371] Trial 49 finished with value: 0.10694133722495613 and parameters: {'model_type': 'mlp', 'hidden_dims': '[128, 64]', 'dropout': 0.37496679420837586, 'batch_norm': True, 'lr': 0.00023546075301029824, 'weight_decay': 7.783522788264867e-07, 'epochs': 48, 'loss': 'mse', 'optimizer': 'adam', 'graph_mode': 'off', 'use_snp_selection': True, 'num_snps': 46888}. Best is trial 34 with value: 0.15284138160430905.
[I 2025-12-05 14:41:13,051] Trial 50 finished with value: 0.1394749604711699 and parameters: {'model_type': 'mlp', 'hidden_dims': '[512, 128]', 'dropout': 0.11823835924875836, 'batch_norm': True, 'lr': 0.0007583398722306994, 'weight_decay': 0.00022714117797874344, 'epochs': 250, 'loss': 'mae', 'optimizer': 'adam', 'graph_mode': 'off', 'use_snp_selection': False}. Best is trial 34 with value: 0.15284138160430905.
[I 2025-12-05 14:41:16,410] Trial 51 finished with value: 0.0672202114872672 and parameters: {'model_type': 'mlp', 'hidden_dims': '[512, 256]', 'dropout': 0.5575838483058061, 'batch_norm': True, 'lr': 8.26991777858618e-06, 'weight_decay': 0.0001258874521702069, 'epochs': 221, 'loss': 'mae', 'optimizer': 'adam', 'graph_mode': 'off', 'use_snp_selection': False}. Best is trial 34 with value: 0.15284138160430905.
[I 2025-12-05 14:41:19,662] Trial 52 finished with value: 0.13903728892424894 and parameters: {'model_type': 'mlp', 'hidden_dims': '[512, 256]', 'dropout': 0.5856584820900086, 'batch_norm': True, 'lr': 0.0007333427673637213, 'weight_decay': 0.00011697016036546398, 'epochs': 213, 'loss': 'mae', 'optimizer': 'adam', 'graph_mode': 'off', 'use_snp_selection': False}. Best is trial 34 with value: 0.15284138160430905.
[I 2025-12-05 14:41:22,282] Trial 53 finished with value: 0.14515589770291037 and parameters: {'model_type': 'mlp', 'hidden_dims': '[512, 256]', 'dropout': 0.5557723918015214, 'batch_norm': True, 'lr': 0.00044744173779446146, 'weight_decay': 4.076988915944742e-05, 'epochs': 159, 'loss': 'mae', 'optimizer': 'adam', 'graph_mode': 'off', 'use_snp_selection': False}. Best is trial 34 with value: 0.15284138160430905.
[I 2025-12-05 14:41:24,487] Trial 54 finished with value: 0.13944610065137664 and parameters: {'model_type': 'mlp', 'hidden_dims': '[512, 256]', 'dropout': 0.5490998429601203, 'batch_norm': True, 'lr': 0.0004814313716621942, 'weight_decay': 4.0086489628103126e-05, 'epochs': 124, 'loss': 'mae', 'optimizer': 'adam', 'graph_mode': 'off', 'use_snp_selection': False}. Best is trial 34 with value: 0.15284138160430905.
[I 2025-12-05 14:41:26,137] Trial 55 finished with value: 0.13494415337181656 and parameters: {'model_type': 'mlp', 'hidden_dims': '[256, 128, 64]', 'dropout': 0.49155482253590066, 'batch_norm': True, 'lr': 0.0003156696944164192, 'weight_decay': 1.479551522539417e-05, 'epochs': 155, 'loss': 'mae', 'optimizer': 'adam', 'graph_mode': 'off', 'use_snp_selection': False}. Best is trial 34 with value: 0.15284138160430905.
[I 2025-12-05 14:41:27,995] Trial 56 finished with value: 0.13022111898608382 and parameters: {'model_type': 'mlp', 'hidden_dims': '[512, 128]', 'dropout': 0.5160263458722067, 'batch_norm': True, 'lr': 0.00014930805041332902, 'weight_decay': 8.098275687767888e-06, 'epochs': 93, 'loss': 'mae', 'optimizer': 'adam', 'graph_mode': 'off', 'use_snp_selection': False}. Best is trial 34 with value: 0.15284138160430905.
[I 2025-12-05 14:41:32,355] Trial 57 finished with value: -0.011275233279823728 and parameters: {'model_type': 'mlp', 'hidden_dims': '[512, 64]', 'dropout': 0.2879686039461927, 'batch_norm': False, 'lr': 0.0009987818710787651, 'weight_decay': 2.0605746263091026e-05, 'epochs': 311, 'loss': 'mae', 'optimizer': 'adam', 'graph_mode': 'off', 'use_snp_selection': False}. Best is trial 34 with value: 0.15284138160430905.
[I 2025-12-05 14:41:34,853] Trial 58 finished with value: 0.13987789751674498 and parameters: {'model_type': 'mlp', 'hidden_dims': '[256, 128]', 'dropout': 0.180873094365327, 'batch_norm': True, 'lr': 0.0004002605462653593, 'weight_decay': 5.105159605953742e-05, 'epochs': 292, 'loss': 'mae', 'optimizer': 'adam', 'graph_mode': 'off', 'use_snp_selection': False}. Best is trial 34 with value: 0.15284138160430905.
[I 2025-12-05 14:41:37,558] Trial 59 finished with value: 0.12229340890142791 and parameters: {'model_type': 'mlp', 'hidden_dims': '[512, 128]', 'dropout': 0.5852960173242208, 'batch_norm': True, 'lr': 0.00020518432217355175, 'weight_decay': 2.725663311561382e-06, 'epochs': 166, 'loss': 'mae', 'optimizer': 'adam', 'graph_mode': 'off', 'use_snp_selection': False}. Best is trial 34 with value: 0.15284138160430905.
[I 2025-12-05 14:41:40,162] Trial 60 finished with value: 0.12133572294631806 and parameters: {'model_type': 'mlp', 'hidden_dims': '[512, 256]', 'dropout': 0.22489003315891543, 'batch_norm': True, 'lr': 0.0005321032354495604, 'weight_decay': 2.7700247415711025e-07, 'epochs': 137, 'loss': 'mae', 'optimizer': 'adam', 'graph_mode': 'off', 'use_snp_selection': True, 'num_snps': 24139}. Best is trial 34 with value: 0.15284138160430905.
[I 2025-12-05 14:41:43,158] Trial 61 finished with value: 0.14684408826713433 and parameters: {'model_type': 'mlp', 'hidden_dims': '[512, 256]', 'dropout': 0.5569123372042247, 'batch_norm': True, 'lr': 0.000743264663223998, 'weight_decay': 8.34804739205863e-05, 'epochs': 191, 'loss': 'mae', 'optimizer': 'adam', 'graph_mode': 'off', 'use_snp_selection': False}. Best is trial 34 with value: 0.15284138160430905.
[I 2025-12-05 14:41:46,261] Trial 62 finished with value: 0.14499179559117345 and parameters: {'model_type': 'mlp', 'hidden_dims': '[512, 256]', 'dropout': 0.5364886216945393, 'batch_norm': True, 'lr': 0.0008519793506567107, 'weight_decay': 8.018479191451845e-05, 'epochs': 200, 'loss': 'mae', 'optimizer': 'adam', 'graph_mode': 'off', 'use_snp_selection': False}. Best is trial 34 with value: 0.15284138160430905.
[I 2025-12-05 14:41:49,186] Trial 63 finished with value: 0.1322477324720594 and parameters: {'model_type': 'mlp', 'hidden_dims': '[512, 256]', 'dropout': 0.5424012141796035, 'batch_norm': True, 'lr': 0.0008297708693340335, 'weight_decay': 8.319077627199229e-05, 'epochs': 185, 'loss': 'mae', 'optimizer': 'adam', 'graph_mode': 'off', 'use_snp_selection': False}. Best is trial 34 with value: 0.15284138160430905.
[I 2025-12-05 14:41:52,240] Trial 64 finished with value: 0.12766197480762315 and parameters: {'model_type': 'mlp', 'hidden_dims': '[512, 256]', 'dropout': 0.5098938715298476, 'batch_norm': True, 'lr': 0.0004372878968550471, 'weight_decay': 2.876486210478291e-05, 'epochs': 196, 'loss': 'mae', 'optimizer': 'adam', 'graph_mode': 'off', 'use_snp_selection': False}. Best is trial 34 with value: 0.15284138160430905.
[I 2025-12-05 14:41:54,232] Trial 65 finished with value: 0.14212549420610493 and parameters: {'model_type': 'mlp', 'hidden_dims': '[512, 128]', 'dropout': 0.5526264239322453, 'batch_norm': True, 'lr': 0.00032550834436830147, 'weight_decay': 6.492127312522386e-05, 'epochs': 106, 'loss': 'mae', 'optimizer': 'adam', 'graph_mode': 'off', 'use_snp_selection': False}. Best is trial 34 with value: 0.15284138160430905.
[I 2025-12-05 14:41:56,973] Trial 66 finished with value: 0.13564042727293657 and parameters: {'model_type': 'mlp', 'hidden_dims': '[512, 256]', 'dropout': 0.5357672788018012, 'batch_norm': True, 'lr': 0.0006232548265393145, 'weight_decay': 3.9637020162878815e-06, 'epochs': 169, 'loss': 'mae', 'optimizer': 'adam', 'graph_mode': 'off', 'use_snp_selection': False}. Best is trial 34 with value: 0.15284138160430905.
[I 2025-12-05 14:42:01,673] Trial 67 finished with value: 0.13295313660956445 and parameters: {'model_type': 'mlp', 'hidden_dims': '[512, 128]', 'dropout': 0.5986118677194301, 'batch_norm': True, 'lr': 0.0008165006949921907, 'weight_decay': 3.636145098370015e-05, 'epochs': 337, 'loss': 'mse', 'optimizer': 'adam', 'graph_mode': 'off', 'use_snp_selection': False}. Best is trial 34 with value: 0.15284138160430905.
[I 2025-12-05 14:42:03,054] Trial 68 finished with value: 0.07613209884959529 and parameters: {'model_type': 'mlp', 'hidden_dims': '[128, 64]', 'dropout': 0.47616085053337315, 'batch_norm': False, 'lr': 0.00025770313192208206, 'weight_decay': 5.175061566732659e-05, 'epochs': 281, 'loss': 'mae', 'optimizer': 'adam', 'graph_mode': 'off', 'use_snp_selection': False}. Best is trial 34 with value: 0.15284138160430905.
