[I 2025-12-05 19:12:34,588] Trial 102 finished with value: 0.3752946814390893 and parameters: {'model_type': 'mlp', 'hidden_dims': '[512, 64]', 'dropout': 0.4930634251696044, 'batch_norm': False, 'lr': 4.332882584715241e-06, 'weight_decay': 3.2072313438550295e-05, 'epochs': 311, 'loss': 'mae', 'optimizer': 'adam', 'graph_mode': 'off', 'use_snp_selection': True, 'num_snps': 56188}. Best is trial 51 with value: 0.3832613767083373.
[I 2025-12-05 19:14:01,358] Trial 103 finished with value: 0.37345145562960336 and parameters: {'model_type': 'mlp', 'hidden_dims': '[512, 64]', 'dropout': 0.5221890245811893, 'batch_norm': False, 'lr': 2.9428091828551904e-06, 'weight_decay': 4.1776982030551015e-05, 'epochs': 271, 'loss': 'mae', 'optimizer': 'adam', 'graph_mode': 'off', 'use_snp_selection': True, 'num_snps': 58415}. Best is trial 51 with value: 0.3832613767083373.
[I 2025-12-05 19:15:09,942] Trial 104 finished with value: 0.37067948440192433 and parameters: {'model_type': 'mlp', 'hidden_dims': '[512, 64]', 'dropout': 0.45729875481127263, 'batch_norm': False, 'lr': 6.6583990236622095e-06, 'weight_decay': 9.808139466130879e-05, 'epochs': 188, 'loss': 'mae', 'optimizer': 'adam', 'graph_mode': 'off', 'use_snp_selection': True, 'num_snps': 54303}. Best is trial 51 with value: 0.3832613767083373.
[I 2025-12-05 19:16:32,484] Trial 105 finished with value: 0.3780732214704102 and parameters: {'model_type': 'mlp', 'hidden_dims': '[512, 64]', 'dropout': 0.5763115352316495, 'batch_norm': False, 'lr': 3.857576577611933e-06, 'weight_decay': 6.907464752438403e-05, 'epochs': 297, 'loss': 'mae', 'optimizer': 'adam', 'graph_mode': 'off', 'use_snp_selection': True, 'num_snps': 50881}. Best is trial 51 with value: 0.3832613767083373.
[I 2025-12-05 19:17:39,657] Trial 106 finished with value: 0.345271672655307 and parameters: {'model_type': 'mlp', 'hidden_dims': '[512, 64]', 'dropout': 0.5690069298877336, 'batch_norm': False, 'lr': 0.000436042642503192, 'weight_decay': 0.00015190548912083832, 'epochs': 197, 'loss': 'mae', 'optimizer': 'adam', 'graph_mode': 'off', 'use_snp_selection': True, 'num_snps': 51533}. Best is trial 51 with value: 0.3832613767083373.
[I 2025-12-05 19:18:24,446] Trial 107 finished with value: 0.34040414218514137 and parameters: {'model_type': 'mlp', 'hidden_dims': '[512, 64]', 'dropout': 0.5795978541539695, 'batch_norm': False, 'lr': 4.569259527468236e-06, 'weight_decay': 0.00011520763069206018, 'epochs': 64, 'loss': 'mae', 'optimizer': 'adam', 'graph_mode': 'off', 'use_snp_selection': True, 'num_snps': 46891}. Best is trial 51 with value: 0.3832613767083373.
[I 2025-12-05 19:19:28,198] Trial 108 finished with value: 0.3763196785935773 and parameters: {'model_type': 'mlp', 'hidden_dims': '[256, 128]', 'dropout': 0.5539501547317438, 'batch_norm': False, 'lr': 4.01089955654306e-06, 'weight_decay': 6.77104849611043e-05, 'epochs': 282, 'loss': 'mse', 'optimizer': 'adam', 'graph_mode': 'off', 'use_snp_selection': True, 'num_snps': 58551}. Best is trial 51 with value: 0.3832613767083373.
[I 2025-12-05 19:20:16,821] Trial 109 finished with value: 0.35794135596151055 and parameters: {'model_type': 'mlp', 'hidden_dims': '[128, 64]', 'dropout': 0.5368581444450211, 'batch_norm': False, 'lr': 3.4485539943152547e-06, 'weight_decay': 0.00025460820574909807, 'epochs': 224, 'loss': 'mae', 'optimizer': 'adam', 'graph_mode': 'off', 'use_snp_selection': True, 'num_snps': 56996}. Best is trial 51 with value: 0.3832613767083373.
[I 2025-12-05 19:21:38,004] Trial 110 finished with value: 0.36750742268568365 and parameters: {'model_type': 'mlp', 'hidden_dims': '[512, 64]', 'dropout': 0.43536865231564437, 'batch_norm': False, 'lr': 2.112515185999953e-06, 'weight_decay': 8.564397772738329e-05, 'epochs': 296, 'loss': 'mae', 'optimizer': 'adam', 'graph_mode': 'off', 'use_snp_selection': True, 'num_snps': 49862}. Best is trial 51 with value: 0.3832613767083373.
[I 2025-12-05 19:22:42,215] Trial 111 finished with value: 0.37657323422440325 and parameters: {'model_type': 'mlp', 'hidden_dims': '[256, 128]', 'dropout': 0.5494092146315912, 'batch_norm': False, 'lr': 3.85967825809578e-06, 'weight_decay': 7.09807255132983e-05, 'epochs': 287, 'loss': 'mse', 'optimizer': 'adam', 'graph_mode': 'off', 'use_snp_selection': True, 'num_snps': 58637}. Best is trial 51 with value: 0.3832613767083373.
[I 2025-12-05 19:23:49,294] Trial 112 finished with value: 0.3717252497652324 and parameters: {'model_type': 'mlp', 'hidden_dims': '[256, 128]', 'dropout': 0.5438155204838346, 'batch_norm': False, 'lr': 5.5696394558062285e-06, 'weight_decay': 0.00019494804396604344, 'epochs': 316, 'loss': 'mse', 'optimizer': 'adam', 'graph_mode': 'off', 'use_snp_selection': True, 'num_snps': 59058}. Best is trial 51 with value: 0.3832613767083373.
[I 2025-12-05 19:24:49,991] Trial 113 finished with value: 0.3695673393192341 and parameters: {'model_type': 'mlp', 'hidden_dims': '[256, 128]', 'dropout': 0.505684442339983, 'batch_norm': False, 'lr': 4.8593462533372735e-06, 'weight_decay': 6.009907517119525e-05, 'epochs': 262, 'loss': 'mse', 'optimizer': 'adam', 'graph_mode': 'off', 'use_snp_selection': True, 'num_snps': 56208}. Best is trial 51 with value: 0.3832613767083373.
[I 2025-12-05 19:25:14,871] Trial 114 finished with value: 0.330347652973792 and parameters: {'model_type': 'mlp', 'hidden_dims': '[256, 128]', 'dropout': 0.5658132868012227, 'batch_norm': False, 'lr': 3.785745125146604e-06, 'weight_decay': 7.440847734399294e-05, 'epochs': 287, 'loss': 'mse', 'optimizer': 'adam', 'graph_mode': 'off', 'use_snp_selection': True, 'num_snps': 3674}. Best is trial 51 with value: 0.3832613767083373.
[I 2025-12-05 19:26:50,034] Trial 115 finished with value: 0.3511298537170182 and parameters: {'model_type': 'mlp', 'hidden_dims': '[512, 128]', 'dropout': 0.5529371460562055, 'batch_norm': False, 'lr': 7.665166947915496e-06, 'weight_decay': 0.00016333979667258855, 'epochs': 308, 'loss': 'mse', 'optimizer': 'adam', 'graph_mode': 'off', 'use_snp_selection': True, 'num_snps': 59761}. Best is trial 51 with value: 0.3832613767083373.
[I 2025-12-05 19:28:21,712] Trial 116 finished with value: 0.37395439124788715 and parameters: {'model_type': 'mlp', 'hidden_dims': '[512, 64]', 'dropout': 0.4660927365816163, 'batch_norm': False, 'lr': 3.1797012999398927e-06, 'weight_decay': 4.8493056339395366e-05, 'epochs': 333, 'loss': 'mae', 'optimizer': 'adam', 'graph_mode': 'off', 'use_snp_selection': True, 'num_snps': 53539}. Best is trial 51 with value: 0.3832613767083373.
[I 2025-12-05 19:28:53,827] Trial 117 finished with value: 0.3727678407279218 and parameters: {'model_type': 'mlp', 'hidden_dims': '[256, 128]', 'dropout': 0.5921464803267531, 'batch_norm': False, 'lr': 6.327035351163453e-06, 'weight_decay': 9.941857603042855e-05, 'epochs': 275, 'loss': 'mse', 'optimizer': 'adam', 'graph_mode': 'off', 'use_snp_selection': False}. Best is trial 51 with value: 0.3832613767083373.
[I 2025-12-05 19:30:14,758] Trial 118 finished with value: 0.33939737621813415 and parameters: {'model_type': 'mlp', 'hidden_dims': '[512, 64]', 'dropout': 0.4871636183368163, 'batch_norm': True, 'lr': 3.91548938288767e-06, 'weight_decay': 0.0003159806994120694, 'epochs': 239, 'loss': 'mae', 'optimizer': 'adam', 'graph_mode': 'off', 'use_snp_selection': True, 'num_snps': 57574}. Best is trial 51 with value: 0.3832613767083373.
[I 2025-12-05 19:31:12,929] Trial 119 finished with value: 0.3411549829085662 and parameters: {'model_type': 'mlp', 'hidden_dims': '[256, 128, 64]', 'dropout': 0.5781823283653683, 'batch_norm': False, 'lr': 2.5099041041116956e-06, 'weight_decay': 0.0002366297437210706, 'epochs': 231, 'loss': 'mae', 'optimizer': 'adam', 'graph_mode': 'off', 'use_snp_selection': True, 'num_snps': 56030}. Best is trial 51 with value: 0.3832613767083373.
[I 2025-12-05 19:32:24,402] Trial 120 finished with value: 0.3672372813990249 and parameters: {'model_type': 'mlp', 'hidden_dims': '[512, 256]', 'dropout': 0.4551665878997095, 'batch_norm': False, 'lr': 8.716940742324856e-06, 'weight_decay': 6.475904787769985e-07, 'epochs': 210, 'loss': 'mae', 'optimizer': 'adam', 'graph_mode': 'off', 'use_snp_selection': True, 'num_snps': 53175}. Best is trial 51 with value: 0.3832613767083373.
[I 2025-12-05 19:33:27,991] Trial 121 finished with value: 0.3744692940966873 and parameters: {'model_type': 'mlp', 'hidden_dims': '[256, 128]', 'dropout': 0.5514158462611765, 'batch_norm': False, 'lr': 3.856369638375569e-06, 'weight_decay': 6.910945864182168e-05, 'epochs': 286, 'loss': 'mse', 'optimizer': 'adam', 'graph_mode': 'off', 'use_snp_selection': True, 'num_snps': 58208}. Best is trial 51 with value: 0.3832613767083373.
[I 2025-12-05 19:34:25,827] Trial 122 finished with value: 0.3815071910417579 and parameters: {'model_type': 'mlp', 'hidden_dims': '[256, 128]', 'dropout': 0.5664615833258858, 'batch_norm': False, 'lr': 4.599555847004186e-06, 'weight_decay': 0.00013849908748246728, 'epochs': 215, 'loss': 'mse', 'optimizer': 'adam', 'graph_mode': 'off', 'use_snp_selection': True, 'num_snps': 58861}. Best is trial 51 with value: 0.3832613767083373.
[I 2025-12-05 19:35:24,267] Trial 123 finished with value: 0.37356956539125863 and parameters: {'model_type': 'mlp', 'hidden_dims': '[256, 128]', 'dropout': 0.5665129686156531, 'batch_norm': False, 'lr': 4.830936208407682e-06, 'weight_decay': 0.0001356610993852825, 'epochs': 215, 'loss': 'mse', 'optimizer': 'adam', 'graph_mode': 'off', 'use_snp_selection': True, 'num_snps': 59969}. Best is trial 51 with value: 0.3832613767083373.
[I 2025-12-05 19:36:21,925] Trial 124 finished with value: 0.37649883526316563 and parameters: {'model_type': 'mlp', 'hidden_dims': '[256, 128]', 'dropout': 0.5372032233956244, 'batch_norm': False, 'lr': 5.565288516786631e-06, 'weight_decay': 0.0001155154273374921, 'epochs': 223, 'loss': 'mse', 'optimizer': 'adam', 'graph_mode': 'off', 'use_snp_selection': True, 'num_snps': 56923}. Best is trial 51 with value: 0.3832613767083373.
[I 2025-12-05 19:37:33,046] Trial 125 finished with value: 0.37661403333221466 and parameters: {'model_type': 'mlp', 'hidden_dims': '[512, 64]', 'dropout': 0.5993337230468982, 'batch_norm': False, 'lr': 2.8047646756972505e-06, 'weight_decay': 0.00018237040857160187, 'epochs': 200, 'loss': 'mse', 'optimizer': 'adam', 'graph_mode': 'off', 'use_snp_selection': True, 'num_snps': 55085}. Best is trial 51 with value: 0.3832613767083373.
[I 2025-12-05 19:38:45,021] Trial 126 finished with value: 0.3731414270599909 and parameters: {'model_type': 'mlp', 'hidden_dims': '[512, 64]', 'dropout': 0.5847819445054565, 'batch_norm': False, 'lr': 2.735629121605043e-06, 'weight_decay': 0.00018134362792026045, 'epochs': 207, 'loss': 'mse', 'optimizer': 'adam', 'graph_mode': 'off', 'use_snp_selection': True, 'num_snps': 54966}. Best is trial 51 with value: 0.3832613767083373.
[I 2025-12-05 19:39:56,937] Trial 127 finished with value: 0.37549568026103436 and parameters: {'model_type': 'mlp', 'hidden_dims': '[512, 64]', 'dropout': 0.4799039617461705, 'batch_norm': False, 'lr': 1.8702881343424561e-06, 'weight_decay': 0.00022694873988486503, 'epochs': 193, 'loss': 'mse', 'optimizer': 'adam', 'graph_mode': 'off', 'use_snp_selection': True, 'num_snps': 57244}. Best is trial 51 with value: 0.3832613767083373.
[I 2025-12-05 19:40:53,436] Trial 128 finished with value: 0.3772206364305625 and parameters: {'model_type': 'mlp', 'hidden_dims': '[256, 128]', 'dropout': 0.5038351715415158, 'batch_norm': False, 'lr': 3.147293827088577e-06, 'weight_decay': 8.873846750288646e-05, 'epochs': 199, 'loss': 'mse', 'optimizer': 'adam', 'graph_mode': 'off', 'use_snp_selection': True, 'num_snps': 58894}. Best is trial 51 with value: 0.3832613767083373.
[I 2025-12-05 19:42:05,346] Trial 129 finished with value: 0.3819942340671123 and parameters: {'model_type': 'mlp', 'hidden_dims': '[512, 64]', 'dropout': 0.5048794864231425, 'batch_norm': False, 'lr': 3.2202975566456673e-06, 'weight_decay': 0.00014236928508122086, 'epochs': 200, 'loss': 'mse', 'optimizer': 'adam', 'graph_mode': 'off', 'use_snp_selection': True, 'num_snps': 55572}. Best is trial 51 with value: 0.3832613767083373.
[I 2025-12-05 19:43:18,256] Trial 130 finished with value: 0.3803554086550015 and parameters: {'model_type': 'mlp', 'hidden_dims': '[512, 64]', 'dropout': 0.5041237050669123, 'batch_norm': False, 'lr': 3.4045904333237486e-06, 'weight_decay': 0.00013216122652741615, 'epochs': 188, 'loss': 'mse', 'optimizer': 'adam', 'graph_mode': 'off', 'use_snp_selection': True, 'num_snps': 58972}. Best is trial 51 with value: 0.3832613767083373.
[I 2025-12-05 19:44:31,061] Trial 131 finished with value: 0.36879687661099053 and parameters: {'model_type': 'mlp', 'hidden_dims': '[512, 64]', 'dropout': 0.5074195673626749, 'batch_norm': False, 'lr': 3.5176527072672726e-06, 'weight_decay': 0.0001254740525081095, 'epochs': 186, 'loss': 'mse', 'optimizer': 'adam', 'graph_mode': 'off', 'use_snp_selection': True, 'num_snps': 59138}. Best is trial 51 with value: 0.3832613767083373.
[I 2025-12-05 19:45:38,716] Trial 132 finished with value: 0.37485510130445165 and parameters: {'model_type': 'mlp', 'hidden_dims': '[512, 64]', 'dropout': 0.49951067882799777, 'batch_norm': False, 'lr': 3.3261424874993025e-06, 'weight_decay': 9.134632814485238e-05, 'epochs': 171, 'loss': 'mse', 'optimizer': 'adam', 'graph_mode': 'off', 'use_snp_selection': True, 'num_snps': 56562}. Best is trial 51 with value: 0.3832613767083373.
[I 2025-12-05 19:46:48,438] Trial 133 finished with value: 0.37109065177916134 and parameters: {'model_type': 'mlp', 'hidden_dims': '[512, 64]', 'dropout': 0.4864649099883495, 'batch_norm': False, 'lr': 2.2885044948348765e-06, 'weight_decay': 0.00014937565443029556, 'epochs': 178, 'loss': 'mse', 'optimizer': 'adam', 'graph_mode': 'off', 'use_snp_selection': True, 'num_snps': 57710}. Best is trial 51 with value: 0.3832613767083373.
[I 2025-12-05 19:48:06,257] Trial 134 finished with value: 0.377501907669755 and parameters: {'model_type': 'mlp', 'hidden_dims': '[512, 64]', 'dropout': 0.47221867414915025, 'batch_norm': False, 'lr': 4.474014397972598e-06, 'weight_decay': 0.00028402966158445474, 'epochs': 215, 'loss': 'mse', 'optimizer': 'adam', 'graph_mode': 'off', 'use_snp_selection': True, 'num_snps': 58873}. Best is trial 51 with value: 0.3832613767083373.
[I 2025-12-05 19:49:24,706] Trial 135 finished with value: 0.37493712202008683 and parameters: {'model_type': 'mlp', 'hidden_dims': '[512, 64]', 'dropout': 0.5161402685409913, 'batch_norm': False, 'lr': 4.477779144452984e-06, 'weight_decay': 0.0003184801235389456, 'epochs': 218, 'loss': 'mse', 'optimizer': 'adam', 'graph_mode': 'off', 'use_snp_selection': True, 'num_snps': 59018}. Best is trial 51 with value: 0.3832613767083373.
[I 2025-12-05 19:50:37,302] Trial 136 finished with value: 0.36862939953992047 and parameters: {'model_type': 'mlp', 'hidden_dims': '[512, 64]', 'dropout': 0.47356938393004544, 'batch_norm': False, 'lr': 5.035417445423514e-06, 'weight_decay': 0.0005330131645411493, 'epochs': 201, 'loss': 'mse', 'optimizer': 'adam', 'graph_mode': 'off', 'use_snp_selection': True, 'num_snps': 56235}. Best is trial 51 with value: 0.3832613767083373.
[I 2025-12-05 19:51:52,570] Trial 137 finished with value: 0.3670647415242757 and parameters: {'model_type': 'mlp', 'hidden_dims': '[512, 64]', 'dropout': 0.4649848714120847, 'batch_norm': False, 'lr': 6.210695288858113e-06, 'weight_decay': 0.00039490024133772493, 'epochs': 209, 'loss': 'mse', 'optimizer': 'adam', 'graph_mode': 'off', 'use_snp_selection': True, 'num_snps': 57886}. Best is trial 51 with value: 0.3832613767083373.
[I 2025-12-05 19:53:06,699] Trial 138 finished with value: 0.38174200118148666 and parameters: {'model_type': 'mlp', 'hidden_dims': '[512, 64]', 'dropout': 0.45034405642287784, 'batch_norm': False, 'lr': 2.8829438267876944e-06, 'weight_decay': 0.0002740614256456163, 'epochs': 191, 'loss': 'mse', 'optimizer': 'adam', 'graph_mode': 'off', 'use_snp_selection': True, 'num_snps': 59936}. Best is trial 51 with value: 0.3832613767083373.
[I 2025-12-05 19:54:20,979] Trial 139 finished with value: 0.3717227054546758 and parameters: {'model_type': 'mlp', 'hidden_dims': '[512, 64]', 'dropout': 0.49059291397138377, 'batch_norm': False, 'lr': 1.4128726231402256e-06, 'weight_decay': 0.00016659629974245755, 'epochs': 194, 'loss': 'mse', 'optimizer': 'adam', 'graph_mode': 'off', 'use_snp_selection': True, 'num_snps': 59178}. Best is trial 51 with value: 0.3832613767083373.
[I 2025-12-05 19:55:08,721] Trial 140 finished with value: 0.3110361886945833 and parameters: {'model_type': 'mlp', 'hidden_dims': '[128, 64]', 'dropout': 0.4429235188199128, 'batch_norm': True, 'lr': 3.019507757080367e-06, 'weight_decay': 0.00021442447329826636, 'epochs': 183, 'loss': 'mse', 'optimizer': 'adam', 'graph_mode': 'off', 'use_snp_selection': True, 'num_snps': 59836}. Best is trial 51 with value: 0.3832613767083373.
[I 2025-12-05 19:56:25,207] Trial 141 finished with value: 0.3699214569520827 and parameters: {'model_type': 'mlp', 'hidden_dims': '[512, 64]', 'dropout': 0.4728653950462661, 'batch_norm': False, 'lr': 4.4169058160951e-06, 'weight_decay': 0.0002378171953841394, 'epochs': 216, 'loss': 'mse', 'optimizer': 'adam', 'graph_mode': 'off', 'use_snp_selection': True, 'num_snps': 57258}. Best is trial 51 with value: 0.3832613767083373.
[I 2025-12-05 19:57:36,029] Trial 142 finished with value: 0.36898059148161894 and parameters: {'model_type': 'mlp', 'hidden_dims': '[512, 64]', 'dropout': 0.4973753786522177, 'batch_norm': False, 'lr': 4.075867501843357e-06, 'weight_decay': 0.000276444000707868, 'epochs': 204, 'loss': 'mse', 'optimizer': 'adam', 'graph_mode': 'off', 'use_snp_selection': True, 'num_snps': 54047}. Best is trial 51 with value: 0.3832613767083373.
[I 2025-12-05 19:58:47,869] Trial 143 finished with value: 0.3760043183550574 and parameters: {'model_type': 'mlp', 'hidden_dims': '[512, 64]', 'dropout': 0.4537454627500597, 'batch_norm': False, 'lr': 2.735917370927697e-06, 'weight_decay': 0.00012806927651767507, 'epochs': 188, 'loss': 'mse', 'optimizer': 'adam', 'graph_mode': 'off', 'use_snp_selection': True, 'num_snps': 58464}. Best is trial 51 with value: 0.3832613767083373.
[I 2025-12-05 20:00:01,981] Trial 144 finished with value: 0.37333366644885574 and parameters: {'model_type': 'mlp', 'hidden_dims': '[512, 64]', 'dropout': 0.4815790043144586, 'batch_norm': False, 'lr': 3.2614054146579174e-06, 'weight_decay': 0.0001054894711061322, 'epochs': 212, 'loss': 'mse', 'optimizer': 'adam', 'graph_mode': 'off', 'use_snp_selection': True, 'num_snps': 55683}. Best is trial 51 with value: 0.3832613767083373.
[I 2025-12-05 20:01:08,498] Trial 145 finished with value: 0.37386520640120546 and parameters: {'model_type': 'mlp', 'hidden_dims': '[512, 128]', 'dropout': 0.46054274672764295, 'batch_norm': False, 'lr': 5.21613058198813e-06, 'weight_decay': 0.00015206159961691064, 'epochs': 160, 'loss': 'mse', 'optimizer': 'adam', 'graph_mode': 'off', 'use_snp_selection': True, 'num_snps': 57514}. Best is trial 51 with value: 0.3832613767083373.
[I 2025-12-05 20:02:22,842] Trial 146 finished with value: 0.37797136903994544 and parameters: {'model_type': 'mlp', 'hidden_dims': '[512, 64]', 'dropout': 0.4342981792648634, 'batch_norm': False, 'lr': 2.2672546807394058e-06, 'weight_decay': 0.000300469103249694, 'epochs': 196, 'loss': 'mse', 'optimizer': 'adam', 'graph_mode': 'off', 'use_snp_selection': True, 'num_snps': 58972}. Best is trial 51 with value: 0.3832613767083373.
[I 2025-12-05 20:03:36,953] Trial 147 finished with value: 0.3808045698400421 and parameters: {'model_type': 'mlp', 'hidden_dims': '[512, 64]', 'dropout': 0.43835064981128646, 'batch_norm': False, 'lr': 2.0815710393097656e-06, 'weight_decay': 0.0004803764208499716, 'epochs': 194, 'loss': 'mse', 'optimizer': 'adam', 'graph_mode': 'off', 'use_snp_selection': True, 'num_snps': 58993}. Best is trial 51 with value: 0.3832613767083373.
[I 2025-12-05 20:04:47,943] Trial 148 finished with value: 0.3652649815304353 and parameters: {'model_type': 'mlp', 'hidden_dims': '[512, 64]', 'dropout': 0.42813120603527566, 'batch_norm': False, 'lr': 1.18346753675483e-06, 'weight_decay': 0.0005838688969797199, 'epochs': 174, 'loss': 'mse', 'optimizer': 'adam', 'graph_mode': 'off', 'use_snp_selection': True, 'num_snps': 59816}. Best is trial 51 with value: 0.3832613767083373.
[I 2025-12-05 20:05:44,047] Trial 149 finished with value: 0.3712560927080236 and parameters: {'model_type': 'mlp', 'hidden_dims': '[256, 128]', 'dropout': 0.4186987577621171, 'batch_norm': False, 'lr': 1.9283710906826336e-06, 'weight_decay': 0.0003836376898684884, 'epochs': 197, 'loss': 'mse', 'optimizer': 'adam', 'graph_mode': 'off', 'use_snp_selection': True, 'num_snps': 58615}. Best is trial 51 with value: 0.3832613767083373.
[I 2025-12-05 20:06:49,737] Trial 0 finished with value: 0.29128109745369557 and parameters: {'model_type': 'mlp', 'hidden_dims': '[128, 64]', 'dropout': 0.199031432379812, 'batch_norm': True, 'lr': 1.8408544111075837e-06, 'weight_decay': 5.5136510071208614e-05, 'epochs': 336, 'loss': 'mae', 'optimizer': 'adam', 'graph_mode': 'off', 'use_snp_selection': True, 'num_snps': 43862}. Best is trial 0 with value: 0.29128109745369557.
[I 2025-12-05 20:07:18,547] Trial 1 finished with value: 0.34641039905492454 and parameters: {'model_type': 'mlp', 'hidden_dims': '[256, 128]', 'dropout': 0.4370668075331726, 'batch_norm': True, 'lr': 7.133471581159139e-05, 'weight_decay': 1.128633586803549e-05, 'epochs': 242, 'loss': 'mae', 'optimizer': 'adam', 'graph_mode': 'off', 'use_snp_selection': False}. Best is trial 1 with value: 0.34641039905492454.
