[I 2025-12-05 15:35:43,675] Trial 116 finished with value: 0.0473259217180868 and parameters: {'model_type': 'mlp', 'hidden_dims': '[128, 64]', 'dropout': 0.5441146404152675, 'batch_norm': False, 'lr': 5.691105033801081e-06, 'weight_decay': 2.7017669618474143e-05, 'epochs': 115, 'loss': 'mae', 'optimizer': 'adam', 'graph_mode': 'off', 'use_snp_selection': True, 'num_snps': 14703}. Best is trial 91 with value: 0.055760875437285855.
[I 2025-12-05 15:35:44,973] Trial 117 finished with value: -0.018421096367720935 and parameters: {'model_type': 'mlp', 'hidden_dims': '[128, 64]', 'dropout': 0.5435426051551409, 'batch_norm': False, 'lr': 5.763525402612864e-06, 'weight_decay': 3.13433773199613e-05, 'epochs': 127, 'loss': 'mae', 'optimizer': 'adam', 'graph_mode': 'off', 'use_snp_selection': True, 'num_snps': 18422}. Best is trial 91 with value: 0.055760875437285855.
[I 2025-12-05 15:35:46,115] Trial 118 finished with value: -0.012530790084954904 and parameters: {'model_type': 'mlp', 'hidden_dims': '[128, 64]', 'dropout': 0.5498818367048748, 'batch_norm': False, 'lr': 4.349751272775828e-06, 'weight_decay': 3.25030421510608e-05, 'epochs': 116, 'loss': 'mae', 'optimizer': 'adam', 'graph_mode': 'off', 'use_snp_selection': True, 'num_snps': 15014}. Best is trial 91 with value: 0.055760875437285855.
[I 2025-12-05 15:35:46,896] Trial 119 finished with value: 0.03336943754075303 and parameters: {'model_type': 'mlp', 'hidden_dims': '[128, 64]', 'dropout': 0.5630847316118825, 'batch_norm': True, 'lr': 2.60516712668007e-06, 'weight_decay': 8.135783568814904e-05, 'epochs': 132, 'loss': 'mae', 'optimizer': 'adam', 'graph_mode': 'off', 'use_snp_selection': False}. Best is trial 91 with value: 0.055760875437285855.
[I 2025-12-05 15:35:47,626] Trial 120 finished with value: -0.021581577593860337 and parameters: {'model_type': 'mlp', 'hidden_dims': '[128, 64]', 'dropout': 0.561357097225689, 'batch_norm': True, 'lr': 7.264534562409143e-06, 'weight_decay': 7.670358938351584e-05, 'epochs': 133, 'loss': 'mae', 'optimizer': 'adam', 'graph_mode': 'off', 'use_snp_selection': False}. Best is trial 91 with value: 0.055760875437285855.
[I 2025-12-05 15:35:48,323] Trial 121 finished with value: 0.01686231576713415 and parameters: {'model_type': 'mlp', 'hidden_dims': '[128, 64]', 'dropout': 0.5694276503947137, 'batch_norm': True, 'lr': 2.645742100921535e-06, 'weight_decay': 0.00013692088678600824, 'epochs': 122, 'loss': 'mae', 'optimizer': 'adam', 'graph_mode': 'off', 'use_snp_selection': False}. Best is trial 91 with value: 0.055760875437285855.
[I 2025-12-05 15:35:48,992] Trial 122 finished with value: 0.03105134907374367 and parameters: {'model_type': 'mlp', 'hidden_dims': '[128, 64]', 'dropout': 0.5297952586483375, 'batch_norm': True, 'lr': 3.3968990005111503e-06, 'weight_decay': 6.0882773525306895e-05, 'epochs': 102, 'loss': 'mae', 'optimizer': 'adam', 'graph_mode': 'off', 'use_snp_selection': False}. Best is trial 91 with value: 0.055760875437285855.
[I 2025-12-05 15:35:49,666] Trial 123 finished with value: -0.024977607434018872 and parameters: {'model_type': 'mlp', 'hidden_dims': '[128, 64]', 'dropout': 0.5188309448480877, 'batch_norm': True, 'lr': 3.6761972717192695e-06, 'weight_decay': 8.521915163476488e-05, 'epochs': 100, 'loss': 'mae', 'optimizer': 'adam', 'graph_mode': 'off', 'use_snp_selection': False}. Best is trial 91 with value: 0.055760875437285855.
[I 2025-12-05 15:35:50,616] Trial 124 finished with value: 0.025969466600641884 and parameters: {'model_type': 'mlp', 'hidden_dims': '[128, 64]', 'dropout': 0.5403361519216878, 'batch_norm': True, 'lr': 3.164171079793102e-06, 'weight_decay': 0.00011537695104095922, 'epochs': 297, 'loss': 'mae', 'optimizer': 'adam', 'graph_mode': 'off', 'use_snp_selection': False}. Best is trial 91 with value: 0.055760875437285855.
[I 2025-12-05 15:35:51,625] Trial 125 finished with value: 0.003712748802289109 and parameters: {'model_type': 'mlp', 'hidden_dims': '[128, 64]', 'dropout': 0.5807512273211273, 'batch_norm': True, 'lr': 4.759613799589144e-06, 'weight_decay': 0.00013252090371203382, 'epochs': 311, 'loss': 'mae', 'optimizer': 'adam', 'graph_mode': 'off', 'use_snp_selection': False}. Best is trial 91 with value: 0.055760875437285855.
[I 2025-12-05 15:35:52,479] Trial 126 finished with value: -0.03348931107771514 and parameters: {'model_type': 'mlp', 'hidden_dims': '[128, 64]', 'dropout': 0.5331892606787703, 'batch_norm': True, 'lr': 3.154559737776498e-06, 'weight_decay': 6.516334917728882e-05, 'epochs': 195, 'loss': 'mae', 'optimizer': 'adam', 'graph_mode': 'off', 'use_snp_selection': False}. Best is trial 91 with value: 0.055760875437285855.
[I 2025-12-05 15:35:53,274] Trial 127 finished with value: -0.01951251586904695 and parameters: {'model_type': 'mlp', 'hidden_dims': '[128, 64]', 'dropout': 0.5451083774011566, 'batch_norm': True, 'lr': 3.668086510269173e-06, 'weight_decay': 8.998228992637307e-07, 'epochs': 159, 'loss': 'mae', 'optimizer': 'adam', 'graph_mode': 'off', 'use_snp_selection': False}. Best is trial 91 with value: 0.055760875437285855.
[I 2025-12-05 15:35:54,190] Trial 128 finished with value: 0.004827923267621944 and parameters: {'model_type': 'mlp', 'hidden_dims': '[128, 64]', 'dropout': 0.5555459041778622, 'batch_norm': True, 'lr': 2.4837357682193046e-06, 'weight_decay': 0.00027534188837146457, 'epochs': 244, 'loss': 'mae', 'optimizer': 'adam', 'graph_mode': 'off', 'use_snp_selection': False}. Best is trial 91 with value: 0.055760875437285855.
[I 2025-12-05 15:35:55,175] Trial 129 finished with value: -0.004443366333885681 and parameters: {'model_type': 'mlp', 'hidden_dims': '[128, 64]', 'dropout': 0.5708479751074614, 'batch_norm': True, 'lr': 2.0206022460683095e-06, 'weight_decay': 4.707103648907488e-05, 'epochs': 299, 'loss': 'mae', 'optimizer': 'adam', 'graph_mode': 'off', 'use_snp_selection': False}. Best is trial 91 with value: 0.055760875437285855.
[I 2025-12-05 15:35:56,161] Trial 130 finished with value: -0.023367717627354217 and parameters: {'model_type': 'mlp', 'hidden_dims': '[256, 128]', 'dropout': 0.5318588463241872, 'batch_norm': True, 'lr': 2.7820011231817264e-06, 'weight_decay': 2.5696442310826443e-05, 'epochs': 149, 'loss': 'mae', 'optimizer': 'adam', 'graph_mode': 'off', 'use_snp_selection': False}. Best is trial 91 with value: 0.055760875437285855.
[I 2025-12-05 15:35:56,819] Trial 131 finished with value: 0.012953105358257484 and parameters: {'model_type': 'mlp', 'hidden_dims': '[128, 64]', 'dropout': 0.5054706215023143, 'batch_norm': True, 'lr': 5.4564640790164655e-06, 'weight_decay': 0.0001085198623628958, 'epochs': 92, 'loss': 'mae', 'optimizer': 'adam', 'graph_mode': 'off', 'use_snp_selection': False}. Best is trial 91 with value: 0.055760875437285855.
[I 2025-12-05 15:35:58,027] Trial 132 finished with value: 0.022555202908177127 and parameters: {'model_type': 'mlp', 'hidden_dims': '[512, 128]', 'dropout': 0.5445571084694596, 'batch_norm': True, 'lr': 3.209592745283359e-06, 'weight_decay': 0.0005093018943090306, 'epochs': 108, 'loss': 'mae', 'optimizer': 'adam', 'graph_mode': 'off', 'use_snp_selection': False}. Best is trial 91 with value: 0.055760875437285855.
[I 2025-12-05 15:35:59,221] Trial 133 finished with value: -0.013944927756218485 and parameters: {'model_type': 'mlp', 'hidden_dims': '[512, 128]', 'dropout': 0.542978947377458, 'batch_norm': True, 'lr': 3.1945316065848675e-06, 'weight_decay': 5.359555843628785e-05, 'epochs': 105, 'loss': 'mae', 'optimizer': 'adam', 'graph_mode': 'off', 'use_snp_selection': False}. Best is trial 91 with value: 0.055760875437285855.
[I 2025-12-05 15:36:00,953] Trial 134 finished with value: 0.00903131575411234 and parameters: {'model_type': 'mlp', 'hidden_dims': '[512, 128]', 'dropout': 0.5894580827604858, 'batch_norm': True, 'lr': 1.5443162672926304e-06, 'weight_decay': 0.0005560346990168279, 'epochs': 219, 'loss': 'mae', 'optimizer': 'adam', 'graph_mode': 'off', 'use_snp_selection': False}. Best is trial 91 with value: 0.055760875437285855.
[I 2025-12-05 15:36:02,224] Trial 135 finished with value: 0.0033362519828038784 and parameters: {'model_type': 'mlp', 'hidden_dims': '[512, 128]', 'dropout': 0.563832696834455, 'batch_norm': True, 'lr': 3.988516423485293e-06, 'weight_decay': 0.0004927073535678031, 'epochs': 113, 'loss': 'mae', 'optimizer': 'adam', 'graph_mode': 'off', 'use_snp_selection': False}. Best is trial 91 with value: 0.055760875437285855.
[I 2025-12-05 15:36:04,615] Trial 136 finished with value: -0.005513015752799093 and parameters: {'model_type': 'mlp', 'hidden_dims': '[512, 128]', 'dropout': 0.5507368755108852, 'batch_norm': True, 'lr': 8.56601069843845e-05, 'weight_decay': 0.0003809945746871843, 'epochs': 347, 'loss': 'mae', 'optimizer': 'adam', 'graph_mode': 'off', 'use_snp_selection': False}. Best is trial 91 with value: 0.055760875437285855.
[I 2025-12-05 15:36:05,384] Trial 137 finished with value: -0.018769845278672297 and parameters: {'model_type': 'mlp', 'hidden_dims': '[128, 64]', 'dropout': 0.5269298334677196, 'batch_norm': True, 'lr': 2.298960285120573e-06, 'weight_decay': 0.00017348577707621576, 'epochs': 144, 'loss': 'mae', 'optimizer': 'adam', 'graph_mode': 'off', 'use_snp_selection': False}. Best is trial 91 with value: 0.055760875437285855.
[I 2025-12-05 15:36:06,023] Trial 138 finished with value: 0.0190087741135718 and parameters: {'model_type': 'mlp', 'hidden_dims': '[128, 64]', 'dropout': 0.38196832275534, 'batch_norm': True, 'lr': 1.815867823677061e-06, 'weight_decay': 8.6982144885716e-05, 'epochs': 56, 'loss': 'mae', 'optimizer': 'adam', 'graph_mode': 'off', 'use_snp_selection': False}. Best is trial 91 with value: 0.055760875437285855.
[I 2025-12-05 15:36:06,960] Trial 139 finished with value: -0.0025355523484835905 and parameters: {'model_type': 'mlp', 'hidden_dims': '[256, 128, 64]', 'dropout': 0.47047027252286044, 'batch_norm': True, 'lr': 4.650199370024465e-06, 'weight_decay': 1.7662619385843878e-05, 'epochs': 131, 'loss': 'mse', 'optimizer': 'adam', 'graph_mode': 'off', 'use_snp_selection': False}. Best is trial 91 with value: 0.055760875437285855.
[I 2025-12-05 15:36:07,644] Trial 140 finished with value: 0.03019719991859776 and parameters: {'model_type': 'mlp', 'hidden_dims': '[128, 64]', 'dropout': 0.49276624043773415, 'batch_norm': True, 'lr': 1.0107091703840072e-06, 'weight_decay': 0.0002045367884032659, 'epochs': 109, 'loss': 'mae', 'optimizer': 'adam', 'graph_mode': 'off', 'use_snp_selection': False}. Best is trial 91 with value: 0.055760875437285855.
[I 2025-12-05 15:36:08,315] Trial 141 finished with value: -0.0021987599864681595 and parameters: {'model_type': 'mlp', 'hidden_dims': '[128, 64]', 'dropout': 0.49366246730758806, 'batch_norm': True, 'lr': 1.1252222827334863e-06, 'weight_decay': 0.00020749538179497213, 'epochs': 101, 'loss': 'mae', 'optimizer': 'adam', 'graph_mode': 'off', 'use_snp_selection': False}. Best is trial 91 with value: 0.055760875437285855.
[I 2025-12-05 15:36:08,996] Trial 142 finished with value: 0.016719191588382625 and parameters: {'model_type': 'mlp', 'hidden_dims': '[128, 64]', 'dropout': 0.5127011187621251, 'batch_norm': True, 'lr': 1.3223632372870025e-06, 'weight_decay': 1.8062600130919468e-07, 'epochs': 109, 'loss': 'mae', 'optimizer': 'adam', 'graph_mode': 'off', 'use_snp_selection': False}. Best is trial 91 with value: 0.055760875437285855.
[I 2025-12-05 15:36:09,700] Trial 143 finished with value: 0.06559368469285225 and parameters: {'model_type': 'mlp', 'hidden_dims': '[128, 64]', 'dropout': 0.4558067813636063, 'batch_norm': True, 'lr': 1.0453156469644122e-06, 'weight_decay': 0.0007006885279558553, 'epochs': 120, 'loss': 'mae', 'optimizer': 'adam', 'graph_mode': 'off', 'use_snp_selection': False}. Best is trial 143 with value: 0.06559368469285225.
[I 2025-12-05 15:36:10,701] Trial 144 finished with value: -0.014734066676608879 and parameters: {'model_type': 'mlp', 'hidden_dims': '[128, 64]', 'dropout': 0.4547473217418798, 'batch_norm': True, 'lr': 1.1839960274069465e-06, 'weight_decay': 0.00017488661887048794, 'epochs': 333, 'loss': 'mae', 'optimizer': 'adam', 'graph_mode': 'off', 'use_snp_selection': False}. Best is trial 143 with value: 0.06559368469285225.
[I 2025-12-05 15:36:11,402] Trial 145 finished with value: 0.014890272621588183 and parameters: {'model_type': 'mlp', 'hidden_dims': '[128, 64]', 'dropout': 0.47525450034749334, 'batch_norm': True, 'lr': 1.0720391001525348e-06, 'weight_decay': 0.0007965724797510948, 'epochs': 122, 'loss': 'mae', 'optimizer': 'adam', 'graph_mode': 'off', 'use_snp_selection': False}. Best is trial 143 with value: 0.06559368469285225.
[I 2025-12-05 15:36:11,997] Trial 146 finished with value: 0.03252361271030765 and parameters: {'model_type': 'mlp', 'hidden_dims': '[128, 64]', 'dropout': 0.4659296015259342, 'batch_norm': True, 'lr': 1.4205209247075178e-06, 'weight_decay': 0.00012232956753916712, 'epochs': 47, 'loss': 'mae', 'optimizer': 'adam', 'graph_mode': 'off', 'use_snp_selection': False}. Best is trial 143 with value: 0.06559368469285225.
[I 2025-12-05 15:36:12,622] Trial 147 finished with value: 0.018952746928556048 and parameters: {'model_type': 'mlp', 'hidden_dims': '[128, 64]', 'dropout': 0.4675903278537952, 'batch_norm': True, 'lr': 1.4373798946773465e-06, 'weight_decay': 0.00011141583593633144, 'epochs': 43, 'loss': 'mae', 'optimizer': 'adam', 'graph_mode': 'off', 'use_snp_selection': False}. Best is trial 143 with value: 0.06559368469285225.
[I 2025-12-05 15:36:13,276] Trial 148 finished with value: -0.006601843280595102 and parameters: {'model_type': 'mlp', 'hidden_dims': '[128, 64]', 'dropout': 0.4859019106133345, 'batch_norm': True, 'lr': 1.5975235080191047e-06, 'weight_decay': 6.084407544788573e-05, 'epochs': 51, 'loss': 'mae', 'optimizer': 'adam', 'graph_mode': 'off', 'use_snp_selection': False}. Best is trial 143 with value: 0.06559368469285225.
[I 2025-12-05 15:36:13,928] Trial 149 finished with value: -0.011413938759175242 and parameters: {'model_type': 'mlp', 'hidden_dims': '[128, 64]', 'dropout': 0.4475434807284184, 'batch_norm': True, 'lr': 1.05318898016523e-06, 'weight_decay': 0.00012267367938861024, 'epochs': 47, 'loss': 'mae', 'optimizer': 'adam', 'graph_mode': 'off', 'use_snp_selection': False}. Best is trial 143 with value: 0.06559368469285225.
[I 2025-12-05 15:36:16,246] Trial 0 finished with value: 0.028421549638066756 and parameters: {'model_type': 'mlp', 'hidden_dims': '[128, 64]', 'dropout': 0.199031432379812, 'batch_norm': True, 'lr': 1.8408544111075837e-06, 'weight_decay': 5.5136510071208614e-05, 'epochs': 336, 'loss': 'mae', 'optimizer': 'adam', 'graph_mode': 'off', 'use_snp_selection': True, 'num_snps': 43862}. Best is trial 0 with value: 0.028421549638066756.
[I 2025-12-05 15:36:17,309] Trial 1 finished with value: 0.08231976724802356 and parameters: {'model_type': 'mlp', 'hidden_dims': '[256, 128]', 'dropout': 0.4370668075331726, 'batch_norm': True, 'lr': 7.133471581159139e-05, 'weight_decay': 1.128633586803549e-05, 'epochs': 242, 'loss': 'mae', 'optimizer': 'adam', 'graph_mode': 'off', 'use_snp_selection': False}. Best is trial 1 with value: 0.08231976724802356.
[I 2025-12-05 15:36:18,319] Trial 2 finished with value: 0.06937769577453988 and parameters: {'model_type': 'mlp', 'hidden_dims': '[256, 128, 64]', 'dropout': 0.41314357415569625, 'batch_norm': False, 'lr': 3.952233718592101e-06, 'weight_decay': 0.00026754769258252603, 'epochs': 149, 'loss': 'mse', 'optimizer': 'adam', 'graph_mode': 'off', 'use_snp_selection': True, 'num_snps': 11571}. Best is trial 1 with value: 0.08231976724802356.
[I 2025-12-05 15:36:20,186] Trial 3 finished with value: 0.09530522034613981 and parameters: {'model_type': 'mlp', 'hidden_dims': '[512, 64]', 'dropout': 0.5938127374509361, 'batch_norm': False, 'lr': 5.67704586114731e-06, 'weight_decay': 2.4518087630137052e-05, 'epochs': 320, 'loss': 'mae', 'optimizer': 'adam', 'graph_mode': 'off', 'use_snp_selection': False}. Best is trial 3 with value: 0.09530522034613981.
[I 2025-12-05 15:36:22,442] Trial 4 finished with value: 0.01851134394262917 and parameters: {'model_type': 'mlp', 'hidden_dims': '[512, 128]', 'dropout': 0.25746343592134413, 'batch_norm': True, 'lr': 1.3467657668402788e-06, 'weight_decay': 0.00033087251918647806, 'epochs': 277, 'loss': 'mse', 'optimizer': 'adam', 'graph_mode': 'off', 'use_snp_selection': True, 'num_snps': 36675}. Best is trial 3 with value: 0.09530522034613981.
[I 2025-12-05 15:36:24,291] Trial 5 finished with value: 0.05778916429342565 and parameters: {'model_type': 'mlp', 'hidden_dims': '[512, 64]', 'dropout': 0.38275350994408375, 'batch_norm': True, 'lr': 1.5586664309232824e-06, 'weight_decay': 0.0008227664668621182, 'epochs': 145, 'loss': 'mae', 'optimizer': 'adam', 'graph_mode': 'off', 'use_snp_selection': True, 'num_snps': 32148}. Best is trial 3 with value: 0.09530522034613981.
[I 2025-12-05 15:36:25,282] Trial 6 finished with value: 0.09216237327525638 and parameters: {'model_type': 'mlp', 'hidden_dims': '[256, 128]', 'dropout': 0.3930109900265879, 'batch_norm': False, 'lr': 4.892964372128395e-05, 'weight_decay': 1.5809549317992182e-06, 'epochs': 199, 'loss': 'mse', 'optimizer': 'adam', 'graph_mode': 'off', 'use_snp_selection': False}. Best is trial 3 with value: 0.09530522034613981.
[I 2025-12-05 15:36:26,352] Trial 7 finished with value: 0.09989350421346392 and parameters: {'model_type': 'mlp', 'hidden_dims': '[512, 256]', 'dropout': 0.15343979219678458, 'batch_norm': True, 'lr': 6.234003099047341e-05, 'weight_decay': 3.894760610535477e-07, 'epochs': 97, 'loss': 'mse', 'optimizer': 'adam', 'graph_mode': 'off', 'use_snp_selection': False}. Best is trial 7 with value: 0.09989350421346392.
[I 2025-12-05 15:36:28,209] Trial 8 finished with value: 0.10077848315801843 and parameters: {'model_type': 'mlp', 'hidden_dims': '[512, 128]', 'dropout': 0.10743001231661406, 'batch_norm': True, 'lr': 0.00023728538449271062, 'weight_decay': 1.7629071578048637e-05, 'epochs': 312, 'loss': 'mae', 'optimizer': 'adam', 'graph_mode': 'off', 'use_snp_selection': False}. Best is trial 8 with value: 0.10077848315801843.
[I 2025-12-05 15:36:29,544] Trial 9 finished with value: 0.09179818853347523 and parameters: {'model_type': 'mlp', 'hidden_dims': '[512, 64]', 'dropout': 0.14505336736221927, 'batch_norm': True, 'lr': 5.8619638388111826e-05, 'weight_decay': 6.200156172669308e-07, 'epochs': 175, 'loss': 'mse', 'optimizer': 'adam', 'graph_mode': 'off', 'use_snp_selection': False}. Best is trial 8 with value: 0.10077848315801843.
[I 2025-12-05 15:36:30,441] Trial 10 finished with value: 0.04611934915905321 and parameters: {'model_type': 'mlp', 'hidden_dims': '[512, 128]', 'dropout': 0.2800030442581858, 'batch_norm': False, 'lr': 0.0004919806695968258, 'weight_decay': 2.9953888095455486e-06, 'epochs': 55, 'loss': 'mae', 'optimizer': 'adam', 'graph_mode': 'off', 'use_snp_selection': False}. Best is trial 8 with value: 0.10077848315801843.
[I 2025-12-05 15:36:31,444] Trial 11 finished with value: 0.11348404530805777 and parameters: {'model_type': 'mlp', 'hidden_dims': '[512, 256]', 'dropout': 0.10095648685224448, 'batch_norm': True, 'lr': 0.0003926892266729099, 'weight_decay': 3.172181990533228e-07, 'epochs': 70, 'loss': 'mse', 'optimizer': 'adam', 'graph_mode': 'off', 'use_snp_selection': False}. Best is trial 11 with value: 0.11348404530805777.
[I 2025-12-05 15:36:32,330] Trial 12 finished with value: 0.0999296103813416 and parameters: {'model_type': 'mlp', 'hidden_dims': '[512, 256]', 'dropout': 0.10344600881777158, 'batch_norm': True, 'lr': 0.0006753264773209732, 'weight_decay': 1.3081036432574914e-07, 'epochs': 40, 'loss': 'mae', 'optimizer': 'adam', 'graph_mode': 'off', 'use_snp_selection': False}. Best is trial 11 with value: 0.11348404530805777.
[I 2025-12-05 15:36:33,949] Trial 13 finished with value: 0.12262220944237365 and parameters: {'model_type': 'mlp', 'hidden_dims': '[512, 128]', 'dropout': 0.23699951708513148, 'batch_norm': True, 'lr': 0.00023284399572303963, 'weight_decay': 3.973183926706275e-06, 'epochs': 239, 'loss': 'mse', 'optimizer': 'adam', 'graph_mode': 'off', 'use_snp_selection': False}. Best is trial 13 with value: 0.12262220944237365.
[I 2025-12-05 15:36:35,516] Trial 14 finished with value: 0.10791001725501101 and parameters: {'model_type': 'mlp', 'hidden_dims': '[512, 256]', 'dropout': 0.28397504683850705, 'batch_norm': True, 'lr': 0.0002108574938852793, 'weight_decay': 2.9356892821725063e-06, 'epochs': 230, 'loss': 'mse', 'optimizer': 'adam', 'graph_mode': 'off', 'use_snp_selection': False}. Best is trial 13 with value: 0.12262220944237365.
[I 2025-12-05 15:36:36,178] Trial 15 finished with value: 0.12411614544257442 and parameters: {'model_type': 'mlp', 'hidden_dims': '[128, 64]', 'dropout': 0.2198889615042905, 'batch_norm': True, 'lr': 0.00018429018027102804, 'weight_decay': 1.2409720044783996e-07, 'epochs': 100, 'loss': 'mse', 'optimizer': 'adam', 'graph_mode': 'off', 'use_snp_selection': False}. Best is trial 15 with value: 0.12411614544257442.
[I 2025-12-05 15:36:36,863] Trial 16 finished with value: 0.07038795664153928 and parameters: {'model_type': 'mlp', 'hidden_dims': '[128, 64]', 'dropout': 0.2215021798529484, 'batch_norm': True, 'lr': 2.1517090787442848e-05, 'weight_decay': 1.1333185331337161e-07, 'epochs': 120, 'loss': 'mse', 'optimizer': 'adam', 'graph_mode': 'off', 'use_snp_selection': False}. Best is trial 15 with value: 0.12411614544257442.
[I 2025-12-05 15:36:37,687] Trial 17 finished with value: 0.08257048432332308 and parameters: {'model_type': 'mlp', 'hidden_dims': '[128, 64]', 'dropout': 0.32888830259108426, 'batch_norm': True, 'lr': 0.0001381096628267626, 'weight_decay': 1.3398043894594233e-06, 'epochs': 222, 'loss': 'mse', 'optimizer': 'adam', 'graph_mode': 'off', 'use_snp_selection': False}. Best is trial 15 with value: 0.12411614544257442.
