[I 2025-12-06 12:27:05,646] Trial 84 finished with value: 0.3705808662892872 and parameters: {'model_type': 'mlp', 'hidden_dims': '[512, 128]', 'dropout': 0.5264345998881513, 'batch_norm': False, 'lr': 3.772191651739991e-06, 'weight_decay': 2.6075490249232656e-05, 'epochs': 146, 'loss': 'mse', 'optimizer': 'adam', 'graph_mode': 'off', 'use_snp_selection': False}. Best is trial 76 with value: 0.37827641757205727.
[I 2025-12-06 12:27:37,244] Trial 85 finished with value: 0.37057550685153223 and parameters: {'model_type': 'mlp', 'hidden_dims': '[512, 128]', 'dropout': 0.5766288266174356, 'batch_norm': False, 'lr': 4.412582939543356e-06, 'weight_decay': 5.251064137197451e-05, 'epochs': 137, 'loss': 'mse', 'optimizer': 'adam', 'graph_mode': 'off', 'use_snp_selection': False}. Best is trial 76 with value: 0.37827641757205727.
[I 2025-12-06 12:28:13,550] Trial 86 finished with value: 0.37185312829818457 and parameters: {'model_type': 'mlp', 'hidden_dims': '[512, 128]', 'dropout': 0.11632442676025975, 'batch_norm': False, 'lr': 1.9062029426606655e-06, 'weight_decay': 9.277852333994835e-06, 'epochs': 160, 'loss': 'mse', 'optimizer': 'adam', 'graph_mode': 'off', 'use_snp_selection': False}. Best is trial 76 with value: 0.37827641757205727.
[I 2025-12-06 12:28:48,398] Trial 87 finished with value: 0.3416034266832238 and parameters: {'model_type': 'mlp', 'hidden_dims': '[512, 128]', 'dropout': 0.5466846230266503, 'batch_norm': True, 'lr': 5.533137183834758e-06, 'weight_decay': 8.518214280419261e-05, 'epochs': 152, 'loss': 'mse', 'optimizer': 'adam', 'graph_mode': 'off', 'use_snp_selection': False}. Best is trial 76 with value: 0.37827641757205727.
[I 2025-12-06 12:29:17,467] Trial 88 finished with value: 0.3711252664591803 and parameters: {'model_type': 'mlp', 'hidden_dims': '[512, 128]', 'dropout': 0.590312948685432, 'batch_norm': False, 'lr': 3.5760039197906244e-06, 'weight_decay': 4.03634585065636e-05, 'epochs': 124, 'loss': 'mse', 'optimizer': 'adam', 'graph_mode': 'off', 'use_snp_selection': False}. Best is trial 76 with value: 0.37827641757205727.
[I 2025-12-06 12:29:55,412] Trial 89 finished with value: 0.3616535616666023 and parameters: {'model_type': 'mlp', 'hidden_dims': '[512, 128]', 'dropout': 0.5073372243942886, 'batch_norm': False, 'lr': 1.4651270729609164e-06, 'weight_decay': 6.297757898110671e-05, 'epochs': 170, 'loss': 'mse', 'optimizer': 'adam', 'graph_mode': 'off', 'use_snp_selection': False}. Best is trial 76 with value: 0.37827641757205727.
[I 2025-12-06 12:30:35,116] Trial 90 finished with value: 0.3728610859369346 and parameters: {'model_type': 'mlp', 'hidden_dims': '[512, 128]', 'dropout': 0.521557146377511, 'batch_norm': False, 'lr': 4.653121108045979e-06, 'weight_decay': 1.7318819328112388e-05, 'epochs': 179, 'loss': 'mse', 'optimizer': 'adam', 'graph_mode': 'off', 'use_snp_selection': False}. Best is trial 76 with value: 0.37827641757205727.
[I 2025-12-06 12:31:18,569] Trial 91 finished with value: 0.3730002833224018 and parameters: {'model_type': 'mlp', 'hidden_dims': '[512, 128]', 'dropout': 0.5771282417955921, 'batch_norm': False, 'lr': 2.6144005368709715e-06, 'weight_decay': 3.0469655891050188e-05, 'epochs': 199, 'loss': 'mse', 'optimizer': 'adam', 'graph_mode': 'off', 'use_snp_selection': False}. Best is trial 76 with value: 0.37827641757205727.
[I 2025-12-06 12:31:59,284] Trial 92 finished with value: 0.37570311659253 and parameters: {'model_type': 'mlp', 'hidden_dims': '[512, 64]', 'dropout': 0.566715305120996, 'batch_norm': False, 'lr': 2.434085798185375e-06, 'weight_decay': 9.442067795028786e-05, 'epochs': 185, 'loss': 'mse', 'optimizer': 'adam', 'graph_mode': 'off', 'use_snp_selection': False}. Best is trial 76 with value: 0.37827641757205727.
[I 2025-12-06 12:32:40,404] Trial 93 finished with value: 0.36815338346090665 and parameters: {'model_type': 'mlp', 'hidden_dims': '[512, 64]', 'dropout': 0.5431535316706156, 'batch_norm': False, 'lr': 2.137649436910381e-06, 'weight_decay': 9.333093636150437e-05, 'epochs': 187, 'loss': 'mse', 'optimizer': 'adam', 'graph_mode': 'off', 'use_snp_selection': False}. Best is trial 76 with value: 0.37827641757205727.
[I 2025-12-06 12:33:23,384] Trial 94 finished with value: 0.37146691651418645 and parameters: {'model_type': 'mlp', 'hidden_dims': '[512, 64]', 'dropout': 0.5608170167000177, 'batch_norm': False, 'lr': 3.1804915681802746e-06, 'weight_decay': 1.1858678072229922e-05, 'epochs': 197, 'loss': 'mse', 'optimizer': 'adam', 'graph_mode': 'off', 'use_snp_selection': False}. Best is trial 76 with value: 0.37827641757205727.
[I 2025-12-06 12:34:01,144] Trial 95 finished with value: 0.3715016689404828 and parameters: {'model_type': 'mlp', 'hidden_dims': '[512, 64]', 'dropout': 0.5360064903753187, 'batch_norm': False, 'lr': 2.7465000384700108e-06, 'weight_decay': 4.906022415350274e-05, 'epochs': 170, 'loss': 'mse', 'optimizer': 'adam', 'graph_mode': 'off', 'use_snp_selection': False}. Best is trial 76 with value: 0.37827641757205727.
[I 2025-12-06 12:34:36,078] Trial 96 finished with value: 0.3619287998862525 and parameters: {'model_type': 'mlp', 'hidden_dims': '[512, 128]', 'dropout': 0.5654987305338449, 'batch_norm': False, 'lr': 1.8348509626669254e-06, 'weight_decay': 8.470138930792769e-05, 'epochs': 155, 'loss': 'mse', 'optimizer': 'adam', 'graph_mode': 'off', 'use_snp_selection': False}. Best is trial 76 with value: 0.37827641757205727.
[I 2025-12-06 12:35:23,093] Trial 97 finished with value: 0.3642485303369242 and parameters: {'model_type': 'mlp', 'hidden_dims': '[512, 64]', 'dropout': 0.5519276651470891, 'batch_norm': False, 'lr': 1.2112083097644516e-06, 'weight_decay': 2.3189939432928114e-05, 'epochs': 218, 'loss': 'mse', 'optimizer': 'adam', 'graph_mode': 'off', 'use_snp_selection': False}. Best is trial 76 with value: 0.37827641757205727.
[I 2025-12-06 12:35:40,119] Trial 98 finished with value: 0.37348339392436153 and parameters: {'model_type': 'mlp', 'hidden_dims': '[128, 64]', 'dropout': 0.5924326533108317, 'batch_norm': False, 'lr': 6.124097818800504e-06, 'weight_decay': 0.00013595890915452485, 'epochs': 227, 'loss': 'mse', 'optimizer': 'adam', 'graph_mode': 'off', 'use_snp_selection': False}. Best is trial 76 with value: 0.37827641757205727.
[I 2025-12-06 12:36:31,417] Trial 99 finished with value: 0.3717684576170582 and parameters: {'model_type': 'mlp', 'hidden_dims': '[512, 128]', 'dropout': 0.5260798882818576, 'batch_norm': False, 'lr': 1.5105369620015048e-06, 'weight_decay': 0.00010319458765544744, 'epochs': 240, 'loss': 'mse', 'optimizer': 'adam', 'graph_mode': 'off', 'use_snp_selection': False}. Best is trial 76 with value: 0.37827641757205727.
[I 2025-12-06 12:37:02,120] Trial 100 finished with value: 0.36901650884812814 and parameters: {'model_type': 'mlp', 'hidden_dims': '[256, 128]', 'dropout': 0.21556797508253028, 'batch_norm': False, 'lr': 2.3455388780927654e-06, 'weight_decay': 7.185885413928678e-05, 'epochs': 258, 'loss': 'mse', 'optimizer': 'adam', 'graph_mode': 'off', 'use_snp_selection': False}. Best is trial 76 with value: 0.37827641757205727.
[I 2025-12-06 12:37:23,007] Trial 101 finished with value: 0.3693773988227047 and parameters: {'model_type': 'mlp', 'hidden_dims': '[512, 128]', 'dropout': 0.5802417420713881, 'batch_norm': False, 'lr': 9.526343536718005e-06, 'weight_decay': 0.00019557609904327452, 'epochs': 82, 'loss': 'mse', 'optimizer': 'adam', 'graph_mode': 'off', 'use_snp_selection': False}. Best is trial 76 with value: 0.37827641757205727.
[I 2025-12-06 12:37:37,571] Trial 102 finished with value: 0.37156332279018967 and parameters: {'model_type': 'mlp', 'hidden_dims': '[128, 64]', 'dropout': 0.5982831891893933, 'batch_norm': False, 'lr': 7.886175259822687e-06, 'weight_decay': 1.8710299006732e-05, 'epochs': 184, 'loss': 'mse', 'optimizer': 'adam', 'graph_mode': 'off', 'use_snp_selection': False}. Best is trial 76 with value: 0.37827641757205727.
[I 2025-12-06 12:38:16,042] Trial 103 finished with value: 0.37454295700489626 and parameters: {'model_type': 'mlp', 'hidden_dims': '[512, 64]', 'dropout': 0.5735247111230691, 'batch_norm': False, 'lr': 3.787863196724003e-06, 'weight_decay': 3.886304118169366e-06, 'epochs': 174, 'loss': 'mse', 'optimizer': 'adam', 'graph_mode': 'off', 'use_snp_selection': False}. Best is trial 76 with value: 0.37827641757205727.
[I 2025-12-06 12:38:51,546] Trial 104 finished with value: 0.3761881119967389 and parameters: {'model_type': 'mlp', 'hidden_dims': '[512, 64]', 'dropout': 0.5692435972004882, 'batch_norm': False, 'lr': 3.700343572319359e-06, 'weight_decay': 3.3792357475323476e-05, 'epochs': 158, 'loss': 'mse', 'optimizer': 'adam', 'graph_mode': 'off', 'use_snp_selection': False}. Best is trial 76 with value: 0.37827641757205727.
[I 2025-12-06 12:39:22,615] Trial 105 finished with value: 0.34153102970363586 and parameters: {'model_type': 'mlp', 'hidden_dims': '[512, 64]', 'dropout': 0.4811650758853014, 'batch_norm': True, 'lr': 3.0379656709994906e-06, 'weight_decay': 3.158072581783271e-05, 'epochs': 133, 'loss': 'mse', 'optimizer': 'adam', 'graph_mode': 'off', 'use_snp_selection': False}. Best is trial 76 with value: 0.37827641757205727.
[I 2025-12-06 12:39:58,145] Trial 106 finished with value: 0.37476358032609197 and parameters: {'model_type': 'mlp', 'hidden_dims': '[512, 64]', 'dropout': 0.5614330640743943, 'batch_norm': False, 'lr': 4.927411430602561e-06, 'weight_decay': 5.420827060874283e-05, 'epochs': 158, 'loss': 'mse', 'optimizer': 'adam', 'graph_mode': 'off', 'use_snp_selection': False}. Best is trial 76 with value: 0.37827641757205727.
[I 2025-12-06 12:40:31,308] Trial 107 finished with value: 0.37360225152020793 and parameters: {'model_type': 'mlp', 'hidden_dims': '[512, 64]', 'dropout': 0.36678201643967967, 'batch_norm': False, 'lr': 4.443686917130226e-06, 'weight_decay': 5.827638544042133e-05, 'epochs': 145, 'loss': 'mse', 'optimizer': 'adam', 'graph_mode': 'off', 'use_snp_selection': False}. Best is trial 76 with value: 0.37827641757205727.
[I 2025-12-06 12:41:06,257] Trial 108 finished with value: 0.3710136597410365 and parameters: {'model_type': 'mlp', 'hidden_dims': '[512, 64]', 'dropout': 0.5171474826849402, 'batch_norm': False, 'lr': 5.435621899370228e-06, 'weight_decay': 4.0607685522202907e-05, 'epochs': 155, 'loss': 'mse', 'optimizer': 'adam', 'graph_mode': 'off', 'use_snp_selection': False}. Best is trial 76 with value: 0.37827641757205727.
[I 2025-12-06 12:41:42,720] Trial 109 finished with value: 0.37339902385165813 and parameters: {'model_type': 'mlp', 'hidden_dims': '[512, 64]', 'dropout': 0.5646563375928904, 'batch_norm': False, 'lr': 4.912066988803277e-06, 'weight_decay': 2.454798714688203e-05, 'epochs': 163, 'loss': 'mse', 'optimizer': 'adam', 'graph_mode': 'off', 'use_snp_selection': False}. Best is trial 76 with value: 0.37827641757205727.
[I 2025-12-06 12:42:11,268] Trial 110 finished with value: 0.37112418325322455 and parameters: {'model_type': 'mlp', 'hidden_dims': '[512, 64]', 'dropout': 0.3330578303159964, 'batch_norm': False, 'lr': 3.7165527851544627e-06, 'weight_decay': 7.539647610237223e-05, 'epochs': 121, 'loss': 'mse', 'optimizer': 'adam', 'graph_mode': 'off', 'use_snp_selection': False}. Best is trial 76 with value: 0.37827641757205727.
[I 2025-12-06 12:42:48,638] Trial 111 finished with value: 0.3778892287260107 and parameters: {'model_type': 'mlp', 'hidden_dims': '[512, 64]', 'dropout': 0.550404436436921, 'batch_norm': False, 'lr': 2.467835851897644e-06, 'weight_decay': 0.00011755521893987673, 'epochs': 167, 'loss': 'mse', 'optimizer': 'adam', 'graph_mode': 'off', 'use_snp_selection': False}. Best is trial 76 with value: 0.37827641757205727.
[I 2025-12-06 12:43:25,951] Trial 112 finished with value: 0.3691476700471525 and parameters: {'model_type': 'mlp', 'hidden_dims': '[512, 64]', 'dropout': 0.5337956416024536, 'batch_norm': False, 'lr': 7.088841598646916e-06, 'weight_decay': 0.00011755310051307057, 'epochs': 167, 'loss': 'mse', 'optimizer': 'adam', 'graph_mode': 'off', 'use_snp_selection': False}. Best is trial 76 with value: 0.37827641757205727.
[I 2025-12-06 12:44:05,386] Trial 113 finished with value: 0.376503254872692 and parameters: {'model_type': 'mlp', 'hidden_dims': '[512, 64]', 'dropout': 0.5493519454405074, 'batch_norm': False, 'lr': 2.9590555102906186e-06, 'weight_decay': 0.00016160212145170368, 'epochs': 178, 'loss': 'mse', 'optimizer': 'adam', 'graph_mode': 'off', 'use_snp_selection': False}. Best is trial 76 with value: 0.37827641757205727.
[I 2025-12-06 12:44:44,029] Trial 114 finished with value: 0.37228066870624693 and parameters: {'model_type': 'mlp', 'hidden_dims': '[512, 64]', 'dropout': 0.547362546131302, 'batch_norm': False, 'lr': 2.9137621501682784e-06, 'weight_decay': 0.00013455644374329843, 'epochs': 174, 'loss': 'mse', 'optimizer': 'adam', 'graph_mode': 'off', 'use_snp_selection': False}. Best is trial 76 with value: 0.37827641757205727.
[I 2025-12-06 12:45:07,090] Trial 115 finished with value: 0.3601423225631346 and parameters: {'model_type': 'mlp', 'hidden_dims': '[256, 128, 64]', 'dropout': 0.5034122463167947, 'batch_norm': False, 'lr': 2.4991221100458955e-06, 'weight_decay': 0.00015962089997116033, 'epochs': 182, 'loss': 'mse', 'optimizer': 'adam', 'graph_mode': 'off', 'use_snp_selection': False}. Best is trial 76 with value: 0.37827641757205727.
[I 2025-12-06 12:45:49,405] Trial 116 finished with value: 0.36701343585202023 and parameters: {'model_type': 'mlp', 'hidden_dims': '[512, 64]', 'dropout': 0.5836783260563049, 'batch_norm': False, 'lr': 1.935199550060244e-06, 'weight_decay': 0.00010501229692388663, 'epochs': 194, 'loss': 'mse', 'optimizer': 'adam', 'graph_mode': 'off', 'use_snp_selection': False}. Best is trial 76 with value: 0.37827641757205727.
[I 2025-12-06 12:46:22,824] Trial 117 finished with value: 0.3753762950633217 and parameters: {'model_type': 'mlp', 'hidden_dims': '[512, 128]', 'dropout': 0.514064540211847, 'batch_norm': False, 'lr': 3.337171400409476e-06, 'weight_decay': 0.0001641012984438615, 'epochs': 147, 'loss': 'mse', 'optimizer': 'adam', 'graph_mode': 'off', 'use_snp_selection': False}. Best is trial 76 with value: 0.37827641757205727.
[I 2025-12-06 12:46:56,234] Trial 118 finished with value: 0.3685809299352345 and parameters: {'model_type': 'mlp', 'hidden_dims': '[512, 128]', 'dropout': 0.5407784939307962, 'batch_norm': False, 'lr': 3.461524434531573e-06, 'weight_decay': 1.1841572946729637e-05, 'epochs': 147, 'loss': 'mse', 'optimizer': 'adam', 'graph_mode': 'off', 'use_snp_selection': False}. Best is trial 76 with value: 0.37827641757205727.
[I 2025-12-06 12:47:28,531] Trial 119 finished with value: 0.3648648971180595 and parameters: {'model_type': 'mlp', 'hidden_dims': '[512, 128]', 'dropout': 0.512657907490311, 'batch_norm': False, 'lr': 1.6295607786253319e-06, 'weight_decay': 0.00022562329279114996, 'epochs': 141, 'loss': 'mse', 'optimizer': 'adam', 'graph_mode': 'off', 'use_snp_selection': False}. Best is trial 76 with value: 0.37827641757205727.
[I 2025-12-06 12:48:10,458] Trial 120 finished with value: 0.3318808780566491 and parameters: {'model_type': 'mlp', 'hidden_dims': '[512, 128]', 'dropout': 0.5275520017622988, 'batch_norm': True, 'lr': 2.1487864759106102e-06, 'weight_decay': 3.519729956549804e-05, 'epochs': 189, 'loss': 'mse', 'optimizer': 'adam', 'graph_mode': 'off', 'use_snp_selection': False}. Best is trial 76 with value: 0.37827641757205727.
[I 2025-12-06 12:48:37,025] Trial 121 finished with value: 0.37047209798398095 and parameters: {'model_type': 'mlp', 'hidden_dims': '[512, 128]', 'dropout': 0.5536475110025102, 'batch_norm': False, 'lr': 2.9045878943550817e-06, 'weight_decay': 0.00017605696647096422, 'epochs': 111, 'loss': 'mse', 'optimizer': 'adam', 'graph_mode': 'off', 'use_snp_selection': False}. Best is trial 76 with value: 0.37827641757205727.
[I 2025-12-06 12:49:14,331] Trial 122 finished with value: 0.37275610966410416 and parameters: {'model_type': 'mlp', 'hidden_dims': '[512, 128]', 'dropout': 0.571126897280338, 'batch_norm': False, 'lr': 4.10663938527412e-06, 'weight_decay': 0.00014859569393641238, 'epochs': 167, 'loss': 'mse', 'optimizer': 'adam', 'graph_mode': 'off', 'use_snp_selection': False}. Best is trial 76 with value: 0.37827641757205727.
[I 2025-12-06 12:49:30,482] Trial 123 finished with value: 0.3720605544853747 and parameters: {'model_type': 'mlp', 'hidden_dims': '[128, 64]', 'dropout': 0.4528692448525326, 'batch_norm': False, 'lr': 3.3210930235702815e-06, 'weight_decay': 0.00028351927901136065, 'epochs': 210, 'loss': 'mse', 'optimizer': 'adam', 'graph_mode': 'off', 'use_snp_selection': False}. Best is trial 76 with value: 0.37827641757205727.
[I 2025-12-06 12:50:09,730] Trial 124 finished with value: 0.371795545871968 and parameters: {'model_type': 'mlp', 'hidden_dims': '[512, 64]', 'dropout': 0.5353296407389722, 'batch_norm': False, 'lr': 2.413700328545793e-06, 'weight_decay': 7.719189058048552e-05, 'epochs': 177, 'loss': 'mse', 'optimizer': 'adam', 'graph_mode': 'off', 'use_snp_selection': False}. Best is trial 76 with value: 0.37827641757205727.
[I 2025-12-06 12:51:16,865] Trial 125 finished with value: 0.32628321410680716 and parameters: {'model_type': 'mlp', 'hidden_dims': '[512, 128]', 'dropout': 0.49705414494994593, 'batch_norm': False, 'lr': 0.00010532163155654003, 'weight_decay': 0.0001226444947277207, 'epochs': 331, 'loss': 'mse', 'optimizer': 'adam', 'graph_mode': 'off', 'use_snp_selection': False}. Best is trial 76 with value: 0.37827641757205727.
[I 2025-12-06 12:51:35,113] Trial 126 finished with value: 0.3451135000565746 and parameters: {'model_type': 'mlp', 'hidden_dims': '[256, 128]', 'dropout': 0.4845241401769178, 'batch_norm': False, 'lr': 1.827211707827089e-06, 'weight_decay': 0.0001943516644507395, 'epochs': 135, 'loss': 'mse', 'optimizer': 'adam', 'graph_mode': 'off', 'use_snp_selection': False}. Best is trial 76 with value: 0.37827641757205727.
[I 2025-12-06 12:52:09,050] Trial 127 finished with value: 0.37204685403812376 and parameters: {'model_type': 'mlp', 'hidden_dims': '[512, 128]', 'dropout': 0.5477379664077567, 'batch_norm': False, 'lr': 6.133982490126698e-06, 'weight_decay': 9.683883454717722e-05, 'epochs': 150, 'loss': 'mse', 'optimizer': 'adam', 'graph_mode': 'off', 'use_snp_selection': False}. Best is trial 76 with value: 0.37827641757205727.
[I 2025-12-06 12:52:43,586] Trial 128 finished with value: 0.3577448392144819 and parameters: {'model_type': 'mlp', 'hidden_dims': '[512, 64]', 'dropout': 0.5177652504719344, 'batch_norm': False, 'lr': 2.9000696064827254e-06, 'weight_decay': 2.757219518801542e-05, 'epochs': 162, 'loss': 'mse', 'optimizer': 'adam', 'graph_mode': 'off', 'use_snp_selection': True, 'num_snps': 16099}. Best is trial 76 with value: 0.37827641757205727.
[I 2025-12-06 12:53:27,197] Trial 129 finished with value: 0.3648005889000735 and parameters: {'model_type': 'mlp', 'hidden_dims': '[512, 128]', 'dropout': 0.4056704405310635, 'batch_norm': False, 'lr': 4.1000802314089745e-06, 'weight_decay': 0.0001593567253543504, 'epochs': 202, 'loss': 'mse', 'optimizer': 'adam', 'graph_mode': 'off', 'use_snp_selection': False}. Best is trial 76 with value: 0.37827641757205727.
[I 2025-12-06 12:54:01,695] Trial 130 finished with value: 0.34501661700876324 and parameters: {'model_type': 'mlp', 'hidden_dims': '[128, 64]', 'dropout': 0.4384530526745903, 'batch_norm': False, 'lr': 2.0462770907028276e-06, 'weight_decay': 4.857754871838317e-05, 'epochs': 183, 'loss': 'mse', 'optimizer': 'adam', 'graph_mode': 'off', 'use_snp_selection': True, 'num_snps': 29025}. Best is trial 76 with value: 0.37827641757205727.
[I 2025-12-06 12:54:39,575] Trial 131 finished with value: 0.37560689869243913 and parameters: {'model_type': 'mlp', 'hidden_dims': '[512, 64]', 'dropout': 0.5603615621723785, 'batch_norm': False, 'lr': 5.1450775416782e-06, 'weight_decay': 5.5930157456461926e-05, 'epochs': 173, 'loss': 'mse', 'optimizer': 'adam', 'graph_mode': 'off', 'use_snp_selection': False}. Best is trial 76 with value: 0.37827641757205727.
[I 2025-12-06 12:55:17,768] Trial 132 finished with value: 0.3706708426652362 and parameters: {'model_type': 'mlp', 'hidden_dims': '[512, 64]', 'dropout': 0.5598982650720695, 'batch_norm': False, 'lr': 2.5527025524062625e-06, 'weight_decay': 6.31689596804256e-05, 'epochs': 173, 'loss': 'mse', 'optimizer': 'adam', 'graph_mode': 'off', 'use_snp_selection': False}. Best is trial 76 with value: 0.37827641757205727.
[I 2025-12-06 12:55:59,025] Trial 133 finished with value: 0.371413719405398 and parameters: {'model_type': 'mlp', 'hidden_dims': '[512, 64]', 'dropout': 0.5895691077270108, 'batch_norm': False, 'lr': 3.401694669613515e-06, 'weight_decay': 9.392115414671209e-05, 'epochs': 188, 'loss': 'mse', 'optimizer': 'adam', 'graph_mode': 'off', 'use_snp_selection': False}. Best is trial 76 with value: 0.37827641757205727.
[I 2025-12-06 12:56:23,831] Trial 134 finished with value: 0.37854464520042397 and parameters: {'model_type': 'mlp', 'hidden_dims': '[512, 64]', 'dropout': 0.5691349436045255, 'batch_norm': False, 'lr': 5.312120444179153e-06, 'weight_decay': 6.881136331729615e-05, 'epochs': 102, 'loss': 'mse', 'optimizer': 'adam', 'graph_mode': 'off', 'use_snp_selection': False}. Best is trial 134 with value: 0.37854464520042397.
[I 2025-12-06 12:56:59,347] Trial 135 finished with value: 0.37354654370232837 and parameters: {'model_type': 'mlp', 'hidden_dims': '[512, 64]', 'dropout': 0.5790963206845854, 'batch_norm': False, 'lr': 5.936805072208977e-06, 'weight_decay': 4.2227544800947594e-05, 'epochs': 158, 'loss': 'mse', 'optimizer': 'adam', 'graph_mode': 'off', 'use_snp_selection': False}. Best is trial 134 with value: 0.37854464520042397.
