[I 2025-12-05 16:10:41,415] Trial 6 finished with value: 0.12934434498965539 and parameters: {'model_type': 'mlp', 'hidden_dims': '[256, 128]', 'dropout': 0.3930109900265879, 'batch_norm': False, 'lr': 4.892964372128395e-05, 'weight_decay': 1.5809549317992182e-06, 'epochs': 199, 'loss': 'mse', 'optimizer': 'adam', 'graph_mode': 'off', 'use_snp_selection': False}. Best is trial 6 with value: 0.12934434498965539.
[I 2025-12-05 16:10:42,648] Trial 7 finished with value: 0.13779617685210827 and parameters: {'model_type': 'mlp', 'hidden_dims': '[512, 256]', 'dropout': 0.15343979219678458, 'batch_norm': True, 'lr': 6.234003099047341e-05, 'weight_decay': 3.894760610535477e-07, 'epochs': 97, 'loss': 'mse', 'optimizer': 'adam', 'graph_mode': 'off', 'use_snp_selection': False}. Best is trial 7 with value: 0.13779617685210827.
[I 2025-12-05 16:10:45,159] Trial 8 finished with value: 0.12770602246477467 and parameters: {'model_type': 'mlp', 'hidden_dims': '[512, 128]', 'dropout': 0.10743001231661406, 'batch_norm': True, 'lr': 0.00023728538449271062, 'weight_decay': 1.7629071578048637e-05, 'epochs': 312, 'loss': 'mae', 'optimizer': 'adam', 'graph_mode': 'off', 'use_snp_selection': False}. Best is trial 7 with value: 0.13779617685210827.
[I 2025-12-05 16:10:46,855] Trial 9 finished with value: 0.14030837906735188 and parameters: {'model_type': 'mlp', 'hidden_dims': '[512, 64]', 'dropout': 0.14505336736221927, 'batch_norm': True, 'lr': 5.8619638388111826e-05, 'weight_decay': 6.200156172669308e-07, 'epochs': 175, 'loss': 'mse', 'optimizer': 'adam', 'graph_mode': 'off', 'use_snp_selection': False}. Best is trial 9 with value: 0.14030837906735188.
[I 2025-12-05 16:10:47,776] Trial 10 finished with value: -0.05066884136737394 and parameters: {'model_type': 'mlp', 'hidden_dims': '[512, 64]', 'dropout': 0.27531666245262887, 'batch_norm': False, 'lr': 0.00032393778075602147, 'weight_decay': 1.1714031539166647e-07, 'epochs': 44, 'loss': 'mse', 'optimizer': 'adam', 'graph_mode': 'off', 'use_snp_selection': False}. Best is trial 9 with value: 0.14030837906735188.
[I 2025-12-05 16:10:48,843] Trial 11 finished with value: 0.07260105284091414 and parameters: {'model_type': 'mlp', 'hidden_dims': '[512, 256]', 'dropout': 0.10095648685224448, 'batch_norm': True, 'lr': 1.6474108386126448e-05, 'weight_decay': 6.203180869264506e-07, 'epochs': 67, 'loss': 'mse', 'optimizer': 'adam', 'graph_mode': 'off', 'use_snp_selection': False}. Best is trial 9 with value: 0.14030837906735188.
[I 2025-12-05 16:10:50,143] Trial 12 finished with value: 0.13088918067188585 and parameters: {'model_type': 'mlp', 'hidden_dims': '[512, 256]', 'dropout': 0.1977119287227368, 'batch_norm': True, 'lr': 0.000121041789182661, 'weight_decay': 1.2192432071058163e-06, 'epochs': 106, 'loss': 'mse', 'optimizer': 'adam', 'graph_mode': 'off', 'use_snp_selection': False}. Best is trial 9 with value: 0.14030837906735188.
[I 2025-12-05 16:10:51,888] Trial 13 finished with value: 0.09487689950780041 and parameters: {'model_type': 'mlp', 'hidden_dims': '[512, 256]', 'dropout': 0.17892004217860003, 'batch_norm': True, 'lr': 1.9472380101128875e-05, 'weight_decay': 1.1026057540153843e-07, 'epochs': 181, 'loss': 'mse', 'optimizer': 'adam', 'graph_mode': 'off', 'use_snp_selection': False}. Best is trial 9 with value: 0.14030837906735188.
[I 2025-12-05 16:10:52,557] Trial 14 finished with value: 0.13437769079316617 and parameters: {'model_type': 'mlp', 'hidden_dims': '[128, 64]', 'dropout': 0.3012984444538551, 'batch_norm': True, 'lr': 0.0006681578335050954, 'weight_decay': 4.814764599662762e-07, 'epochs': 105, 'loss': 'mse', 'optimizer': 'adam', 'graph_mode': 'off', 'use_snp_selection': False}. Best is trial 9 with value: 0.14030837906735188.
[I 2025-12-05 16:10:53,785] Trial 15 finished with value: 0.03937257469576947 and parameters: {'model_type': 'mlp', 'hidden_dims': '[256, 128, 64]', 'dropout': 0.49061215024256943, 'batch_norm': True, 'lr': 2.200457974768058e-05, 'weight_decay': 3.0158133721245484e-06, 'epochs': 219, 'loss': 'mse', 'optimizer': 'adam', 'graph_mode': 'off', 'use_snp_selection': False}. Best is trial 9 with value: 0.14030837906735188.
[I 2025-12-05 16:10:55,064] Trial 16 finished with value: 0.1348396602795328 and parameters: {'model_type': 'mlp', 'hidden_dims': '[512, 64]', 'dropout': 0.16016829601914256, 'batch_norm': True, 'lr': 0.0001154043714215127, 'weight_decay': 4.411191520975561e-06, 'epochs': 104, 'loss': 'mse', 'optimizer': 'adam', 'graph_mode': 'off', 'use_snp_selection': False}. Best is trial 9 with value: 0.14030837906735188.
[I 2025-12-05 16:10:56,720] Trial 17 finished with value: 0.06810090471391533 and parameters: {'model_type': 'mlp', 'hidden_dims': '[512, 256]', 'dropout': 0.31793710483525317, 'batch_norm': True, 'lr': 9.746523544442226e-06, 'weight_decay': 3.539465486244914e-07, 'epochs': 166, 'loss': 'mse', 'optimizer': 'adam', 'graph_mode': 'off', 'use_snp_selection': False}. Best is trial 9 with value: 0.14030837906735188.
[I 2025-12-05 16:10:59,724] Trial 18 finished with value: 0.12919696914277362 and parameters: {'model_type': 'mlp', 'hidden_dims': '[512, 256]', 'dropout': 0.23917094658642962, 'batch_norm': False, 'lr': 4.286919484755962e-05, 'weight_decay': 2.457070557037528e-07, 'epochs': 123, 'loss': 'mse', 'optimizer': 'adam', 'graph_mode': 'off', 'use_snp_selection': True, 'num_snps': 58241}. Best is trial 9 with value: 0.14030837906735188.
[I 2025-12-05 16:11:00,859] Trial 19 finished with value: 0.1435506190813813 and parameters: {'model_type': 'mlp', 'hidden_dims': '[512, 64]', 'dropout': 0.14397347595664306, 'batch_norm': True, 'lr': 0.00014334793979738487, 'weight_decay': 5.616604511856029e-06, 'epochs': 69, 'loss': 'mse', 'optimizer': 'adam', 'graph_mode': 'off', 'use_snp_selection': False}. Best is trial 19 with value: 0.1435506190813813.
[I 2025-12-05 16:11:02,952] Trial 20 finished with value: 0.14428721124360433 and parameters: {'model_type': 'mlp', 'hidden_dims': '[512, 64]', 'dropout': 0.22713525795094816, 'batch_norm': True, 'lr': 0.0002995209451731648, 'weight_decay': 5.749400013478273e-06, 'epochs': 243, 'loss': 'mse', 'optimizer': 'adam', 'graph_mode': 'off', 'use_snp_selection': False}. Best is trial 20 with value: 0.14428721124360433.
[I 2025-12-05 16:11:05,110] Trial 21 finished with value: 0.1404664461251641 and parameters: {'model_type': 'mlp', 'hidden_dims': '[512, 64]', 'dropout': 0.22332911203874686, 'batch_norm': True, 'lr': 0.0003129266932999996, 'weight_decay': 5.412707890109729e-06, 'epochs': 254, 'loss': 'mse', 'optimizer': 'adam', 'graph_mode': 'off', 'use_snp_selection': False}. Best is trial 20 with value: 0.14428721124360433.
[I 2025-12-05 16:11:07,305] Trial 22 finished with value: 0.1435470774109471 and parameters: {'model_type': 'mlp', 'hidden_dims': '[512, 64]', 'dropout': 0.22277687738732366, 'batch_norm': True, 'lr': 0.000861567948686292, 'weight_decay': 5.5175805970332555e-06, 'epochs': 260, 'loss': 'mse', 'optimizer': 'adam', 'graph_mode': 'off', 'use_snp_selection': False}. Best is trial 20 with value: 0.14428721124360433.
[I 2025-12-05 16:11:09,661] Trial 23 finished with value: 0.14716798123633412 and parameters: {'model_type': 'mlp', 'hidden_dims': '[512, 64]', 'dropout': 0.29814581566506004, 'batch_norm': True, 'lr': 0.0009540903043169505, 'weight_decay': 6.445672052489213e-05, 'epochs': 287, 'loss': 'mse', 'optimizer': 'adam', 'graph_mode': 'off', 'use_snp_selection': False}. Best is trial 23 with value: 0.14716798123633412.
[I 2025-12-05 16:11:12,102] Trial 24 finished with value: 0.1318552965114632 and parameters: {'model_type': 'mlp', 'hidden_dims': '[512, 64]', 'dropout': 0.3145526345808486, 'batch_norm': True, 'lr': 0.0004920056916984788, 'weight_decay': 5.236679102878916e-05, 'epochs': 302, 'loss': 'mse', 'optimizer': 'adam', 'graph_mode': 'off', 'use_snp_selection': False}. Best is trial 23 with value: 0.14716798123633412.
[I 2025-12-05 16:11:14,095] Trial 25 finished with value: 0.12981436887616574 and parameters: {'model_type': 'mlp', 'hidden_dims': '[512, 64]', 'dropout': 0.33606540790318173, 'batch_norm': True, 'lr': 0.0009911843733254825, 'weight_decay': 7.852156273440315e-05, 'epochs': 226, 'loss': 'mse', 'optimizer': 'adam', 'graph_mode': 'off', 'use_snp_selection': False}. Best is trial 23 with value: 0.14716798123633412.
[I 2025-12-05 16:11:15,236] Trial 26 finished with value: 0.10913596005595406 and parameters: {'model_type': 'mlp', 'hidden_dims': '[512, 64]', 'dropout': 0.272971725141957, 'batch_norm': True, 'lr': 0.00016487461472206366, 'weight_decay': 0.00015265805543382736, 'epochs': 278, 'loss': 'mse', 'optimizer': 'adam', 'graph_mode': 'off', 'use_snp_selection': True, 'num_snps': 3842}. Best is trial 23 with value: 0.14716798123633412.
[I 2025-12-05 16:11:17,565] Trial 27 finished with value: 0.11511121455452737 and parameters: {'model_type': 'mlp', 'hidden_dims': '[512, 64]', 'dropout': 0.36257539227462326, 'batch_norm': False, 'lr': 0.00047193539473540147, 'weight_decay': 2.6086871179536294e-05, 'epochs': 285, 'loss': 'mae', 'optimizer': 'adam', 'graph_mode': 'off', 'use_snp_selection': False}. Best is trial 23 with value: 0.14716798123633412.
[I 2025-12-05 16:11:18,389] Trial 28 finished with value: 0.13593781463975171 and parameters: {'model_type': 'mlp', 'hidden_dims': '[128, 64]', 'dropout': 0.13120024132517835, 'batch_norm': True, 'lr': 0.0001994935740545717, 'weight_decay': 9.622678433402031e-06, 'epochs': 206, 'loss': 'mse', 'optimizer': 'adam', 'graph_mode': 'off', 'use_snp_selection': False}. Best is trial 23 with value: 0.14716798123633412.
[I 2025-12-05 16:11:20,024] Trial 29 finished with value: 0.1481134254674696 and parameters: {'model_type': 'mlp', 'hidden_dims': '[256, 128]', 'dropout': 0.2010980918123868, 'batch_norm': True, 'lr': 0.00046667633647606073, 'weight_decay': 5.5227103357724904e-05, 'epochs': 335, 'loss': 'mae', 'optimizer': 'adam', 'graph_mode': 'off', 'use_snp_selection': True, 'num_snps': 19468}. Best is trial 29 with value: 0.1481134254674696.
[I 2025-12-05 16:11:21,627] Trial 30 finished with value: 0.1519781892529282 and parameters: {'model_type': 'mlp', 'hidden_dims': '[256, 128]', 'dropout': 0.19388975672393388, 'batch_norm': True, 'lr': 0.0004119784468576924, 'weight_decay': 4.312415658394063e-05, 'epochs': 335, 'loss': 'mae', 'optimizer': 'adam', 'graph_mode': 'off', 'use_snp_selection': True, 'num_snps': 18365}. Best is trial 30 with value: 0.1519781892529282.
[I 2025-12-05 16:11:23,268] Trial 31 finished with value: 0.15668429220257676 and parameters: {'model_type': 'mlp', 'hidden_dims': '[256, 128]', 'dropout': 0.19929912440060063, 'batch_norm': True, 'lr': 0.0005007926904322084, 'weight_decay': 5.7430303346862736e-05, 'epochs': 343, 'loss': 'mae', 'optimizer': 'adam', 'graph_mode': 'off', 'use_snp_selection': True, 'num_snps': 18314}. Best is trial 31 with value: 0.15668429220257676.
[I 2025-12-05 16:11:24,966] Trial 32 finished with value: 0.13896365160933255 and parameters: {'model_type': 'mlp', 'hidden_dims': '[256, 128]', 'dropout': 0.19252135337055146, 'batch_norm': True, 'lr': 0.0005090321541690601, 'weight_decay': 5.809309455613871e-05, 'epochs': 350, 'loss': 'mae', 'optimizer': 'adam', 'graph_mode': 'off', 'use_snp_selection': True, 'num_snps': 20866}. Best is trial 31 with value: 0.15668429220257676.
[I 2025-12-05 16:11:26,593] Trial 33 finished with value: 0.14675886850977704 and parameters: {'model_type': 'mlp', 'hidden_dims': '[256, 128]', 'dropout': 0.28461768444890945, 'batch_norm': True, 'lr': 0.0006778056927195517, 'weight_decay': 0.00011282587419962125, 'epochs': 334, 'loss': 'mae', 'optimizer': 'adam', 'graph_mode': 'off', 'use_snp_selection': True, 'num_snps': 19398}. Best is trial 31 with value: 0.15668429220257676.
[I 2025-12-05 16:11:28,269] Trial 34 finished with value: 0.13724651665233284 and parameters: {'model_type': 'mlp', 'hidden_dims': '[256, 128]', 'dropout': 0.18307872403112418, 'batch_norm': True, 'lr': 0.00040235711635240286, 'weight_decay': 3.335427819279938e-05, 'epochs': 349, 'loss': 'mae', 'optimizer': 'adam', 'graph_mode': 'off', 'use_snp_selection': True, 'num_snps': 20424}. Best is trial 31 with value: 0.15668429220257676.
[I 2025-12-05 16:11:29,675] Trial 35 finished with value: 0.04194098675623831 and parameters: {'model_type': 'mlp', 'hidden_dims': '[256, 128]', 'dropout': 0.46317141495961844, 'batch_norm': False, 'lr': 2.5436790768323134e-06, 'weight_decay': 0.0002007164914124834, 'epochs': 328, 'loss': 'mae', 'optimizer': 'adam', 'graph_mode': 'off', 'use_snp_selection': True, 'num_snps': 15505}. Best is trial 31 with value: 0.15668429220257676.
[I 2025-12-05 16:11:31,471] Trial 36 finished with value: 0.1386077522390408 and parameters: {'model_type': 'mlp', 'hidden_dims': '[256, 128]', 'dropout': 0.25211641093535214, 'batch_norm': True, 'lr': 9.21417540486901e-05, 'weight_decay': 0.0003618961753428184, 'epochs': 300, 'loss': 'mae', 'optimizer': 'adam', 'graph_mode': 'off', 'use_snp_selection': True, 'num_snps': 25264}. Best is trial 31 with value: 0.15668429220257676.
[I 2025-12-05 16:11:32,814] Trial 37 finished with value: 0.10243395004107853 and parameters: {'model_type': 'mlp', 'hidden_dims': '[256, 128]', 'dropout': 0.5681512588927742, 'batch_norm': True, 'lr': 0.0007077723889673812, 'weight_decay': 1.395899984404447e-05, 'epochs': 319, 'loss': 'mae', 'optimizer': 'adam', 'graph_mode': 'off', 'use_snp_selection': True, 'num_snps': 9072}. Best is trial 31 with value: 0.15668429220257676.
[I 2025-12-05 16:11:34,732] Trial 38 finished with value: 0.1468718374555585 and parameters: {'model_type': 'mlp', 'hidden_dims': '[256, 128]', 'dropout': 0.20956472529060866, 'batch_norm': False, 'lr': 0.000995070751521962, 'weight_decay': 0.0005256881399395717, 'epochs': 293, 'loss': 'mae', 'optimizer': 'adam', 'graph_mode': 'off', 'use_snp_selection': True, 'num_snps': 31215}. Best is trial 31 with value: 0.15668429220257676.
[I 2025-12-05 16:11:36,701] Trial 39 finished with value: 0.14262729397629748 and parameters: {'model_type': 'mlp', 'hidden_dims': '[256, 128, 64]', 'dropout': 0.257130839110405, 'batch_norm': True, 'lr': 0.00024685450543499395, 'weight_decay': 4.510512340126788e-05, 'epochs': 334, 'loss': 'mae', 'optimizer': 'adam', 'graph_mode': 'off', 'use_snp_selection': True, 'num_snps': 26278}. Best is trial 31 with value: 0.15668429220257676.
[I 2025-12-05 16:11:38,156] Trial 40 finished with value: 0.1235194936640826 and parameters: {'model_type': 'mlp', 'hidden_dims': '[512, 128]', 'dropout': 0.3567417880182512, 'batch_norm': True, 'lr': 0.0005826130748571656, 'weight_decay': 9.682381125233345e-05, 'epochs': 312, 'loss': 'mae', 'optimizer': 'adam', 'graph_mode': 'off', 'use_snp_selection': True, 'num_snps': 12943}. Best is trial 31 with value: 0.15668429220257676.
[I 2025-12-05 16:11:40,167] Trial 41 finished with value: 0.14130166524534318 and parameters: {'model_type': 'mlp', 'hidden_dims': '[256, 128]', 'dropout': 0.2118931212537558, 'batch_norm': False, 'lr': 0.0009393055957685191, 'weight_decay': 0.0009320472547048893, 'epochs': 295, 'loss': 'mae', 'optimizer': 'adam', 'graph_mode': 'off', 'use_snp_selection': True, 'num_snps': 33097}. Best is trial 31 with value: 0.15668429220257676.
[I 2025-12-05 16:11:42,587] Trial 42 finished with value: 0.13859902118192238 and parameters: {'model_type': 'mlp', 'hidden_dims': '[256, 128]', 'dropout': 0.18115496265982972, 'batch_norm': False, 'lr': 0.00038581161644504265, 'weight_decay': 0.00044919566354779223, 'epochs': 344, 'loss': 'mae', 'optimizer': 'adam', 'graph_mode': 'off', 'use_snp_selection': True, 'num_snps': 41274}. Best is trial 31 with value: 0.15668429220257676.
[I 2025-12-05 16:11:44,287] Trial 43 finished with value: 0.14513155442236939 and parameters: {'model_type': 'mlp', 'hidden_dims': '[256, 128]', 'dropout': 0.12010821960370201, 'batch_norm': False, 'lr': 0.0009587938854477908, 'weight_decay': 0.0005108155899917878, 'epochs': 265, 'loss': 'mae', 'optimizer': 'adam', 'graph_mode': 'off', 'use_snp_selection': True, 'num_snps': 26541}. Best is trial 31 with value: 0.15668429220257676.
[I 2025-12-05 16:11:45,788] Trial 44 finished with value: 0.15355697155303313 and parameters: {'model_type': 'mlp', 'hidden_dims': '[256, 128]', 'dropout': 0.16501788204988188, 'batch_norm': False, 'lr': 0.0002351931044795897, 'weight_decay': 0.00020731506103978696, 'epochs': 324, 'loss': 'mae', 'optimizer': 'adam', 'graph_mode': 'off', 'use_snp_selection': True, 'num_snps': 18023}. Best is trial 31 with value: 0.15668429220257676.
[I 2025-12-05 16:11:47,272] Trial 45 finished with value: 0.14717778293060457 and parameters: {'model_type': 'mlp', 'hidden_dims': '[256, 128]', 'dropout': 0.16618276684247396, 'batch_norm': False, 'lr': 0.00021700462332815743, 'weight_decay': 0.00021602524280344194, 'epochs': 323, 'loss': 'mae', 'optimizer': 'adam', 'graph_mode': 'off', 'use_snp_selection': True, 'num_snps': 17050}. Best is trial 31 with value: 0.15668429220257676.
[I 2025-12-05 16:11:48,763] Trial 46 finished with value: 0.15462508108030087 and parameters: {'model_type': 'mlp', 'hidden_dims': '[256, 128]', 'dropout': 0.15710998330787468, 'batch_norm': False, 'lr': 0.00022871002329759844, 'weight_decay': 0.00016386850682803124, 'epochs': 322, 'loss': 'mae', 'optimizer': 'adam', 'graph_mode': 'off', 'use_snp_selection': True, 'num_snps': 17777}. Best is trial 31 with value: 0.15668429220257676.
[I 2025-12-05 16:11:49,936] Trial 47 finished with value: 0.1271057972304471 and parameters: {'model_type': 'mlp', 'hidden_dims': '[256, 128]', 'dropout': 0.13647240848277697, 'batch_norm': False, 'lr': 9.043055436480435e-05, 'weight_decay': 0.00012239547017014712, 'epochs': 309, 'loss': 'mae', 'optimizer': 'adam', 'graph_mode': 'off', 'use_snp_selection': True, 'num_snps': 6821}. Best is trial 31 with value: 0.15668429220257676.
[I 2025-12-05 16:11:51,561] Trial 48 finished with value: 0.1353361291325954 and parameters: {'model_type': 'mlp', 'hidden_dims': '[256, 128]', 'dropout': 0.11071639990214524, 'batch_norm': False, 'lr': 0.00028669323724507713, 'weight_decay': 3.6952419164186536e-05, 'epochs': 336, 'loss': 'mae', 'optimizer': 'adam', 'graph_mode': 'off', 'use_snp_selection': True, 'num_snps': 22308}. Best is trial 31 with value: 0.15668429220257676.
[I 2025-12-05 16:11:53,039] Trial 49 finished with value: 0.1351559481365157 and parameters: {'model_type': 'mlp', 'hidden_dims': '[512, 128]', 'dropout': 0.16207590876129951, 'batch_norm': False, 'lr': 0.0001589201080813765, 'weight_decay': 0.00027812560199053413, 'epochs': 321, 'loss': 'mae', 'optimizer': 'adam', 'graph_mode': 'off', 'use_snp_selection': True, 'num_snps': 13539}. Best is trial 31 with value: 0.15668429220257676.
[I 2025-12-05 16:11:54,460] Trial 50 finished with value: 0.14811804223051467 and parameters: {'model_type': 'mlp', 'hidden_dims': '[256, 128]', 'dropout': 0.19617889323200904, 'batch_norm': False, 'lr': 0.00019358006013639852, 'weight_decay': 2.1706210005444155e-05, 'epochs': 272, 'loss': 'mae', 'optimizer': 'adam', 'graph_mode': 'off', 'use_snp_selection': True, 'num_snps': 17272}. Best is trial 31 with value: 0.15668429220257676.
[I 2025-12-05 16:11:55,872] Trial 51 finished with value: 0.1386952789536538 and parameters: {'model_type': 'mlp', 'hidden_dims': '[256, 128]', 'dropout': 0.19645054227688613, 'batch_norm': False, 'lr': 0.00036915339949205743, 'weight_decay': 2.799657732456936e-05, 'epochs': 309, 'loss': 'mae', 'optimizer': 'adam', 'graph_mode': 'off', 'use_snp_selection': True, 'num_snps': 15360}. Best is trial 31 with value: 0.15668429220257676.
[I 2025-12-05 16:11:57,383] Trial 52 finished with value: 0.13167286945538303 and parameters: {'model_type': 'mlp', 'hidden_dims': '[256, 128]', 'dropout': 0.1661081611684832, 'batch_norm': False, 'lr': 0.00019267093856766118, 'weight_decay': 1.9686232032996367e-05, 'epochs': 340, 'loss': 'mae', 'optimizer': 'adam', 'graph_mode': 'off', 'use_snp_selection': True, 'num_snps': 17729}. Best is trial 31 with value: 0.15668429220257676.
[I 2025-12-05 16:11:58,965] Trial 53 finished with value: 0.12992968853254197 and parameters: {'model_type': 'mlp', 'hidden_dims': '[128, 64]', 'dropout': 0.23409132960123602, 'batch_norm': False, 'lr': 7.919312764721467e-05, 'weight_decay': 0.0001613303042432665, 'epochs': 275, 'loss': 'mae', 'optimizer': 'adam', 'graph_mode': 'off', 'use_snp_selection': True, 'num_snps': 23565}. Best is trial 31 with value: 0.15668429220257676.
[I 2025-12-05 16:12:00,260] Trial 54 finished with value: 0.13496296512986544 and parameters: {'model_type': 'mlp', 'hidden_dims': '[256, 128]', 'dropout': 0.1443334769416617, 'batch_norm': False, 'lr': 0.00011262004079240666, 'weight_decay': 1.0535156259114251e-05, 'epochs': 325, 'loss': 'mae', 'optimizer': 'adam', 'graph_mode': 'off', 'use_snp_selection': True, 'num_snps': 10076}. Best is trial 31 with value: 0.15668429220257676.
[I 2025-12-05 16:12:01,862] Trial 55 finished with value: 0.14526466849685982 and parameters: {'model_type': 'mlp', 'hidden_dims': '[256, 128, 64]', 'dropout': 0.20558403781621595, 'batch_norm': False, 'lr': 0.00025920066890219385, 'weight_decay': 7.979118619763127e-05, 'epochs': 350, 'loss': 'mae', 'optimizer': 'adam', 'graph_mode': 'off', 'use_snp_selection': True, 'num_snps': 18047}. Best is trial 31 with value: 0.15668429220257676.
[I 2025-12-05 16:12:03,472] Trial 56 finished with value: 0.12353353263494007 and parameters: {'model_type': 'mlp', 'hidden_dims': '[256, 128]', 'dropout': 0.12450367316674874, 'batch_norm': False, 'lr': 3.0230828812239343e-05, 'weight_decay': 1.9040736937433254e-05, 'epochs': 312, 'loss': 'mae', 'optimizer': 'adam', 'graph_mode': 'off', 'use_snp_selection': True, 'num_snps': 22488}. Best is trial 31 with value: 0.15668429220257676.
