[I 2025-12-05 15:09:23,273] Trial 48 finished with value: 0.11208634963469047 and parameters: {'model_type': 'mlp', 'hidden_dims': '[256, 128]', 'dropout': 0.3034988963907585, 'batch_norm': True, 'lr': 0.0001543018270987969, 'weight_decay': 0.0005215344678242308, 'epochs': 80, 'loss': 'mse', 'optimizer': 'adam', 'graph_mode': 'off', 'use_snp_selection': False}. Best is trial 8 with value: 0.12183592227197806.
[I 2025-12-05 15:09:25,860] Trial 49 finished with value: 0.11244932963779337 and parameters: {'model_type': 'mlp', 'hidden_dims': '[512, 128]', 'dropout': 0.21354948911384963, 'batch_norm': False, 'lr': 8.175575389830993e-05, 'weight_decay': 1.7009079364163254e-07, 'epochs': 140, 'loss': 'mae', 'optimizer': 'adam', 'graph_mode': 'off', 'use_snp_selection': True, 'num_snps': 46888}. Best is trial 8 with value: 0.12183592227197806.
[I 2025-12-05 15:09:27,581] Trial 50 finished with value: 0.09832155787761138 and parameters: {'model_type': 'mlp', 'hidden_dims': '[512, 256]', 'dropout': 0.11349163859436989, 'batch_norm': True, 'lr': 0.0001247324606938041, 'weight_decay': 2.0532907239061396e-06, 'epochs': 186, 'loss': 'mse', 'optimizer': 'adam', 'graph_mode': 'off', 'use_snp_selection': False}. Best is trial 8 with value: 0.12183592227197806.
[I 2025-12-05 15:09:28,494] Trial 51 finished with value: 0.0972701994592429 and parameters: {'model_type': 'mlp', 'hidden_dims': '[256, 128]', 'dropout': 0.17356351990266522, 'batch_norm': False, 'lr': 0.0002387769345407677, 'weight_decay': 0.00019117337573928403, 'epochs': 98, 'loss': 'mae', 'optimizer': 'adam', 'graph_mode': 'off', 'use_snp_selection': False}. Best is trial 8 with value: 0.12183592227197806.
[I 2025-12-05 15:09:29,248] Trial 52 finished with value: 0.0953150257597983 and parameters: {'model_type': 'mlp', 'hidden_dims': '[128, 64]', 'dropout': 0.23621266477618597, 'batch_norm': False, 'lr': 0.0003318410790558985, 'weight_decay': 0.0003547585860343481, 'epochs': 84, 'loss': 'mae', 'optimizer': 'adam', 'graph_mode': 'off', 'use_snp_selection': False}. Best is trial 8 with value: 0.12183592227197806.
[I 2025-12-05 15:09:30,342] Trial 53 finished with value: 0.08227153326967146 and parameters: {'model_type': 'mlp', 'hidden_dims': '[512, 128]', 'dropout': 0.13352554932798905, 'batch_norm': False, 'lr': 0.00018734725979231785, 'weight_decay': 1.7683715991829383e-05, 'epochs': 60, 'loss': 'mae', 'optimizer': 'adam', 'graph_mode': 'off', 'use_snp_selection': False}. Best is trial 8 with value: 0.12183592227197806.
[I 2025-12-05 15:09:31,728] Trial 54 finished with value: 0.10197787735239877 and parameters: {'model_type': 'mlp', 'hidden_dims': '[512, 256]', 'dropout': 0.1667854281334669, 'batch_norm': False, 'lr': 0.0007471492806934583, 'weight_decay': 3.6629272634674545e-05, 'epochs': 122, 'loss': 'mae', 'optimizer': 'adam', 'graph_mode': 'off', 'use_snp_selection': False}. Best is trial 8 with value: 0.12183592227197806.
[I 2025-12-05 15:09:32,828] Trial 55 finished with value: 0.10351669008925286 and parameters: {'model_type': 'mlp', 'hidden_dims': '[256, 128, 64]', 'dropout': 0.20393877861032547, 'batch_norm': False, 'lr': 0.0004321828114841246, 'weight_decay': 1.0237391270654394e-06, 'epochs': 157, 'loss': 'mae', 'optimizer': 'adam', 'graph_mode': 'off', 'use_snp_selection': False}. Best is trial 8 with value: 0.12183592227197806.
[I 2025-12-05 15:09:34,105] Trial 56 finished with value: 0.09711842333699133 and parameters: {'model_type': 'mlp', 'hidden_dims': '[512, 64]', 'dropout': 0.15270724516903253, 'batch_norm': True, 'lr': 0.000165277149660729, 'weight_decay': 6.342285025130212e-05, 'epochs': 104, 'loss': 'mae', 'optimizer': 'adam', 'graph_mode': 'off', 'use_snp_selection': False}. Best is trial 8 with value: 0.12183592227197806.
[I 2025-12-05 15:09:35,926] Trial 57 finished with value: 0.11211033348578403 and parameters: {'model_type': 'mlp', 'hidden_dims': '[512, 256]', 'dropout': 0.182767721455359, 'batch_norm': True, 'lr': 0.0002583541391642878, 'weight_decay': 1.0185924877748758e-05, 'epochs': 215, 'loss': 'mae', 'optimizer': 'adam', 'graph_mode': 'off', 'use_snp_selection': False}. Best is trial 8 with value: 0.12183592227197806.
[I 2025-12-05 15:09:37,048] Trial 58 finished with value: 0.10157210186774501 and parameters: {'model_type': 'mlp', 'hidden_dims': '[512, 128]', 'dropout': 0.11387348546658113, 'batch_norm': True, 'lr': 9.484201414408994e-05, 'weight_decay': 1.8575214030959156e-07, 'epochs': 74, 'loss': 'mse', 'optimizer': 'adam', 'graph_mode': 'off', 'use_snp_selection': False}. Best is trial 8 with value: 0.12183592227197806.
[I 2025-12-05 15:09:38,494] Trial 59 finished with value: 0.10745262671613509 and parameters: {'model_type': 'mlp', 'hidden_dims': '[256, 128]', 'dropout': 0.18848146417895034, 'batch_norm': False, 'lr': 5.4740563578296675e-05, 'weight_decay': 3.821450026660531e-07, 'epochs': 288, 'loss': 'mae', 'optimizer': 'adam', 'graph_mode': 'off', 'use_snp_selection': False}. Best is trial 8 with value: 0.12183592227197806.
[I 2025-12-05 15:09:40,255] Trial 60 finished with value: 0.06701731066283599 and parameters: {'model_type': 'mlp', 'hidden_dims': '[128, 64]', 'dropout': 0.4175874208624717, 'batch_norm': True, 'lr': 2.5688194474073647e-05, 'weight_decay': 0.0001276638071136779, 'epochs': 250, 'loss': 'mae', 'optimizer': 'adam', 'graph_mode': 'off', 'use_snp_selection': True, 'num_snps': 24139}. Best is trial 8 with value: 0.12183592227197806.
[I 2025-12-05 15:09:41,690] Trial 61 finished with value: 0.11378291609600616 and parameters: {'model_type': 'mlp', 'hidden_dims': '[512, 256]', 'dropout': 0.10639822571951538, 'batch_norm': True, 'lr': 0.0009575714864640951, 'weight_decay': 3.0252123195332606e-07, 'epochs': 132, 'loss': 'mae', 'optimizer': 'adam', 'graph_mode': 'off', 'use_snp_selection': False}. Best is trial 8 with value: 0.12183592227197806.
[I 2025-12-05 15:09:43,053] Trial 62 finished with value: 0.11179397593801498 and parameters: {'model_type': 'mlp', 'hidden_dims': '[512, 256]', 'dropout': 0.13770914130841264, 'batch_norm': True, 'lr': 0.00046818714960580806, 'weight_decay': 1.004803039047636e-07, 'epochs': 124, 'loss': 'mae', 'optimizer': 'adam', 'graph_mode': 'off', 'use_snp_selection': False}. Best is trial 8 with value: 0.12183592227197806.
[I 2025-12-05 15:09:44,370] Trial 63 finished with value: 0.09008446751066447 and parameters: {'model_type': 'mlp', 'hidden_dims': '[512, 256]', 'dropout': 0.1627200564381878, 'batch_norm': True, 'lr': 0.0007221250655122471, 'weight_decay': 9.313694182824292e-07, 'epochs': 115, 'loss': 'mae', 'optimizer': 'adam', 'graph_mode': 'off', 'use_snp_selection': False}. Best is trial 8 with value: 0.12183592227197806.
[I 2025-12-05 15:09:45,561] Trial 64 finished with value: 0.12024907286065874 and parameters: {'model_type': 'mlp', 'hidden_dims': '[512, 256]', 'dropout': 0.1044352697773218, 'batch_norm': True, 'lr': 0.0006579618854965261, 'weight_decay': 4.533270497132198e-07, 'epochs': 90, 'loss': 'mae', 'optimizer': 'adam', 'graph_mode': 'off', 'use_snp_selection': False}. Best is trial 8 with value: 0.12183592227197806.
[I 2025-12-05 15:09:46,807] Trial 65 finished with value: 0.11418782883395323 and parameters: {'model_type': 'mlp', 'hidden_dims': '[512, 256]', 'dropout': 0.12377983870433235, 'batch_norm': True, 'lr': 0.00034379290151466407, 'weight_decay': 2.4162195828989077e-06, 'epochs': 92, 'loss': 'mae', 'optimizer': 'adam', 'graph_mode': 'off', 'use_snp_selection': False}. Best is trial 8 with value: 0.12183592227197806.
[I 2025-12-05 15:09:47,876] Trial 66 finished with value: 0.10241948724533112 and parameters: {'model_type': 'mlp', 'hidden_dims': '[512, 256]', 'dropout': 0.10180112088256903, 'batch_norm': True, 'lr': 0.0005861890298640003, 'weight_decay': 5.909241418307985e-07, 'epochs': 56, 'loss': 'mse', 'optimizer': 'adam', 'graph_mode': 'off', 'use_snp_selection': False}. Best is trial 8 with value: 0.12183592227197806.
[I 2025-12-05 15:09:48,555] Trial 67 finished with value: 0.036173229266040136 and parameters: {'model_type': 'mlp', 'hidden_dims': '[128, 64]', 'dropout': 0.22832200861068574, 'batch_norm': True, 'lr': 1.038788092140181e-06, 'weight_decay': 3.6994316557952914e-06, 'epochs': 40, 'loss': 'mae', 'optimizer': 'adam', 'graph_mode': 'off', 'use_snp_selection': False}. Best is trial 8 with value: 0.12183592227197806.
[I 2025-12-05 15:09:49,765] Trial 68 finished with value: 0.08674695413833537 and parameters: {'model_type': 'mlp', 'hidden_dims': '[512, 128]', 'dropout': 0.1427828320192643, 'batch_norm': False, 'lr': 1.182926478537891e-05, 'weight_decay': 0.0002401082440015849, 'epochs': 87, 'loss': 'mae', 'optimizer': 'adam', 'graph_mode': 'off', 'use_snp_selection': False}. Best is trial 8 with value: 0.12183592227197806.
[I 2025-12-05 15:09:50,713] Trial 69 finished with value: 0.10707861196385521 and parameters: {'model_type': 'mlp', 'hidden_dims': '[256, 128, 64]', 'dropout': 0.5614711718709352, 'batch_norm': True, 'lr': 0.00022583138460003076, 'weight_decay': 1.5066609800447262e-07, 'epochs': 108, 'loss': 'mae', 'optimizer': 'adam', 'graph_mode': 'off', 'use_snp_selection': False}. Best is trial 8 with value: 0.12183592227197806.
[I 2025-12-05 15:09:51,812] Trial 70 finished with value: 0.10616716970937173 and parameters: {'model_type': 'mlp', 'hidden_dims': '[512, 256]', 'dropout': 0.21323298916379363, 'batch_norm': False, 'lr': 6.631974521580803e-05, 'weight_decay': 1.242231870833967e-06, 'epochs': 73, 'loss': 'mse', 'optimizer': 'adam', 'graph_mode': 'off', 'use_snp_selection': False}. Best is trial 8 with value: 0.12183592227197806.
[I 2025-12-05 15:09:53,317] Trial 71 finished with value: 0.12514336860277436 and parameters: {'model_type': 'mlp', 'hidden_dims': '[512, 256]', 'dropout': 0.1539163388592296, 'batch_norm': True, 'lr': 0.0006499197009123548, 'weight_decay': 4.6993134466067165e-07, 'epochs': 147, 'loss': 'mae', 'optimizer': 'adam', 'graph_mode': 'off', 'use_snp_selection': False}. Best is trial 71 with value: 0.12514336860277436.
[I 2025-12-05 15:09:54,878] Trial 72 finished with value: 0.10514109227946303 and parameters: {'model_type': 'mlp', 'hidden_dims': '[512, 256]', 'dropout': 0.147905148735445, 'batch_norm': True, 'lr': 0.00047939325677098316, 'weight_decay': 5.528387614332506e-07, 'epochs': 163, 'loss': 'mae', 'optimizer': 'adam', 'graph_mode': 'off', 'use_snp_selection': False}. Best is trial 71 with value: 0.12514336860277436.
[I 2025-12-05 15:09:56,386] Trial 73 finished with value: 0.12139449562332022 and parameters: {'model_type': 'mlp', 'hidden_dims': '[512, 256]', 'dropout': 0.1762436994867876, 'batch_norm': True, 'lr': 3.8687346347021474e-05, 'weight_decay': 4.407504618549933e-07, 'epochs': 145, 'loss': 'mae', 'optimizer': 'adam', 'graph_mode': 'off', 'use_snp_selection': False}. Best is trial 71 with value: 0.12514336860277436.
[I 2025-12-05 15:09:57,900] Trial 74 finished with value: 0.12228710968807538 and parameters: {'model_type': 'mlp', 'hidden_dims': '[512, 256]', 'dropout': 0.15813079977255776, 'batch_norm': True, 'lr': 4.418794453805814e-05, 'weight_decay': 4.5167412936055785e-07, 'epochs': 145, 'loss': 'mae', 'optimizer': 'adam', 'graph_mode': 'off', 'use_snp_selection': False}. Best is trial 71 with value: 0.12514336860277436.
[I 2025-12-05 15:09:59,406] Trial 75 finished with value: 0.1074768463705682 and parameters: {'model_type': 'mlp', 'hidden_dims': '[512, 256]', 'dropout': 0.11900669975640979, 'batch_norm': True, 'lr': 3.703813717996405e-05, 'weight_decay': 7.605965553414146e-07, 'epochs': 146, 'loss': 'mae', 'optimizer': 'adam', 'graph_mode': 'off', 'use_snp_selection': False}. Best is trial 71 with value: 0.12514336860277436.
[I 2025-12-05 15:10:00,977] Trial 76 finished with value: 0.10551187902443143 and parameters: {'model_type': 'mlp', 'hidden_dims': '[512, 256]', 'dropout': 0.1626780175246274, 'batch_norm': True, 'lr': 0.0006783814242091134, 'weight_decay': 2.578723947047775e-07, 'epochs': 166, 'loss': 'mae', 'optimizer': 'adam', 'graph_mode': 'off', 'use_snp_selection': False}. Best is trial 71 with value: 0.12514336860277436.
[I 2025-12-05 15:10:02,623] Trial 77 finished with value: 0.11407556306573025 and parameters: {'model_type': 'mlp', 'hidden_dims': '[512, 256]', 'dropout': 0.135486219014622, 'batch_norm': True, 'lr': 1.9171852831481684e-05, 'weight_decay': 4.0669981682632614e-07, 'epochs': 182, 'loss': 'mae', 'optimizer': 'adam', 'graph_mode': 'off', 'use_snp_selection': False}. Best is trial 71 with value: 0.12514336860277436.
[I 2025-12-05 15:10:03,494] Trial 78 finished with value: 0.06810905692448548 and parameters: {'model_type': 'mlp', 'hidden_dims': '[512, 256]', 'dropout': 0.1995449021558658, 'batch_norm': True, 'lr': 2.815726286669593e-05, 'weight_decay': 1.5922258590618767e-06, 'epochs': 141, 'loss': 'mae', 'optimizer': 'adam', 'graph_mode': 'off', 'use_snp_selection': True, 'num_snps': 2246}. Best is trial 71 with value: 0.12514336860277436.
[I 2025-12-05 15:10:05,013] Trial 79 finished with value: 0.09382027185980434 and parameters: {'model_type': 'mlp', 'hidden_dims': '[512, 256]', 'dropout': 0.1736822352615674, 'batch_norm': True, 'lr': 3.9599602095057546e-05, 'weight_decay': 2.0218059032631552e-07, 'epochs': 155, 'loss': 'mae', 'optimizer': 'adam', 'graph_mode': 'off', 'use_snp_selection': False}. Best is trial 71 with value: 0.12514336860277436.
[I 2025-12-05 15:10:06,737] Trial 80 finished with value: 0.11216952301586093 and parameters: {'model_type': 'mlp', 'hidden_dims': '[512, 64]', 'dropout': 0.15350589305288292, 'batch_norm': True, 'lr': 0.0009591760061699886, 'weight_decay': 7.26236472013962e-06, 'epochs': 191, 'loss': 'mae', 'optimizer': 'adam', 'graph_mode': 'off', 'use_snp_selection': False}. Best is trial 71 with value: 0.12514336860277436.
[I 2025-12-05 15:10:08,187] Trial 81 finished with value: 0.11557660359570779 and parameters: {'model_type': 'mlp', 'hidden_dims': '[512, 256]', 'dropout': 0.18796300445728467, 'batch_norm': True, 'lr': 5.2140172065414724e-05, 'weight_decay': 4.5664222141211515e-07, 'epochs': 132, 'loss': 'mae', 'optimizer': 'adam', 'graph_mode': 'off', 'use_snp_selection': False}. Best is trial 71 with value: 0.12514336860277436.
[I 2025-12-05 15:10:09,708] Trial 82 finished with value: 0.0977487131202062 and parameters: {'model_type': 'mlp', 'hidden_dims': '[512, 256]', 'dropout': 0.13056734630865865, 'batch_norm': True, 'lr': 4.4137572946686996e-05, 'weight_decay': 6.78652625117785e-07, 'epochs': 149, 'loss': 'mae', 'optimizer': 'adam', 'graph_mode': 'off', 'use_snp_selection': False}. Best is trial 71 with value: 0.12514336860277436.
[I 2025-12-05 15:10:11,341] Trial 83 finished with value: 0.10815956040892571 and parameters: {'model_type': 'mlp', 'hidden_dims': '[512, 256]', 'dropout': 0.1677340291955421, 'batch_norm': True, 'lr': 0.0001257759924927107, 'weight_decay': 2.6599698291697144e-07, 'epochs': 178, 'loss': 'mae', 'optimizer': 'adam', 'graph_mode': 'off', 'use_snp_selection': False}. Best is trial 71 with value: 0.12514336860277436.
[I 2025-12-05 15:10:12,882] Trial 84 finished with value: 0.10300300865505654 and parameters: {'model_type': 'mlp', 'hidden_dims': '[256, 128]', 'dropout': 0.4923757848293242, 'batch_norm': True, 'lr': 0.0003264503680561557, 'weight_decay': 3.220825490633205e-07, 'epochs': 331, 'loss': 'mse', 'optimizer': 'adam', 'graph_mode': 'off', 'use_snp_selection': False}. Best is trial 71 with value: 0.12514336860277436.
[I 2025-12-05 15:10:14,205] Trial 85 finished with value: 0.12175726199513218 and parameters: {'model_type': 'mlp', 'hidden_dims': '[512, 256]', 'dropout': 0.15289869849718518, 'batch_norm': True, 'lr': 6.148020378187072e-05, 'weight_decay': 1.2725423178160906e-06, 'epochs': 117, 'loss': 'mae', 'optimizer': 'adam', 'graph_mode': 'off', 'use_snp_selection': False}. Best is trial 71 with value: 0.12514336860277436.
[I 2025-12-05 15:10:15,558] Trial 86 finished with value: 0.12126962811238627 and parameters: {'model_type': 'mlp', 'hidden_dims': '[512, 256]', 'dropout': 0.12479255689747898, 'batch_norm': True, 'lr': 7.72986430808238e-05, 'weight_decay': 8.793157597774385e-07, 'epochs': 122, 'loss': 'mae', 'optimizer': 'adam', 'graph_mode': 'off', 'use_snp_selection': False}. Best is trial 71 with value: 0.12514336860277436.
[I 2025-12-05 15:10:16,927] Trial 87 finished with value: 0.11254789577262181 and parameters: {'model_type': 'mlp', 'hidden_dims': '[512, 256]', 'dropout': 0.1076588970486235, 'batch_norm': True, 'lr': 8.478175555405603e-05, 'weight_decay': 7.958953787524258e-07, 'epochs': 118, 'loss': 'mae', 'optimizer': 'adam', 'graph_mode': 'off', 'use_snp_selection': False}. Best is trial 71 with value: 0.12514336860277436.
[I 2025-12-05 15:10:18,204] Trial 88 finished with value: 0.12668341454697915 and parameters: {'model_type': 'mlp', 'hidden_dims': '[512, 256]', 'dropout': 0.11753215332848399, 'batch_norm': True, 'lr': 6.595936968055752e-05, 'weight_decay': 1.234970412178511e-06, 'epochs': 98, 'loss': 'mae', 'optimizer': 'adam', 'graph_mode': 'off', 'use_snp_selection': False}. Best is trial 88 with value: 0.12668341454697915.
[I 2025-12-05 15:10:20,663] Trial 89 finished with value: 0.11815162025034015 and parameters: {'model_type': 'mlp', 'hidden_dims': '[512, 256]', 'dropout': 0.12870539398329753, 'batch_norm': True, 'lr': 3.217084973737917e-05, 'weight_decay': 5.155241091715131e-07, 'epochs': 100, 'loss': 'mae', 'optimizer': 'adam', 'graph_mode': 'off', 'use_snp_selection': True, 'num_snps': 45058}. Best is trial 88 with value: 0.12668341454697915.
[I 2025-12-05 15:10:22,109] Trial 90 finished with value: 0.11338247289672489 and parameters: {'model_type': 'mlp', 'hidden_dims': '[512, 256]', 'dropout': 0.12128982400865801, 'batch_norm': True, 'lr': 6.0498456105922544e-05, 'weight_decay': 1.355677269914324e-06, 'epochs': 126, 'loss': 'mae', 'optimizer': 'adam', 'graph_mode': 'off', 'use_snp_selection': False}. Best is trial 88 with value: 0.12668341454697915.
[I 2025-12-05 15:10:23,406] Trial 91 finished with value: 0.11184182607500524 and parameters: {'model_type': 'mlp', 'hidden_dims': '[512, 256]', 'dropout': 0.10042674073222292, 'batch_norm': True, 'lr': 7.173607884581545e-05, 'weight_decay': 1.3241599867657477e-06, 'epochs': 109, 'loss': 'mae', 'optimizer': 'adam', 'graph_mode': 'off', 'use_snp_selection': False}. Best is trial 88 with value: 0.12668341454697915.
[I 2025-12-05 15:10:24,854] Trial 92 finished with value: 0.1131143747863234 and parameters: {'model_type': 'mlp', 'hidden_dims': '[512, 256]', 'dropout': 0.14911930662139344, 'batch_norm': True, 'lr': 9.283662789928922e-05, 'weight_decay': 8.943707972457194e-07, 'epochs': 140, 'loss': 'mae', 'optimizer': 'adam', 'graph_mode': 'off', 'use_snp_selection': False}. Best is trial 88 with value: 0.12668341454697915.
[I 2025-12-05 15:10:26,085] Trial 93 finished with value: 0.11536937237155939 and parameters: {'model_type': 'mlp', 'hidden_dims': '[512, 256]', 'dropout': 0.11747227931804932, 'batch_norm': True, 'lr': 4.62338956756442e-05, 'weight_decay': 2.4104018086995366e-06, 'epochs': 94, 'loss': 'mae', 'optimizer': 'adam', 'graph_mode': 'off', 'use_snp_selection': False}. Best is trial 88 with value: 0.12668341454697915.
[I 2025-12-05 15:10:27,304] Trial 94 finished with value: 0.10316562250799166 and parameters: {'model_type': 'mlp', 'hidden_dims': '[512, 128]', 'dropout': 0.13771051622164798, 'batch_norm': True, 'lr': 0.00012053541339084588, 'weight_decay': 3.764210060015349e-07, 'epochs': 83, 'loss': 'mae', 'optimizer': 'adam', 'graph_mode': 'off', 'use_snp_selection': False}. Best is trial 88 with value: 0.12668341454697915.
[I 2025-12-05 15:10:28,699] Trial 95 finished with value: 0.12115583831145536 and parameters: {'model_type': 'mlp', 'hidden_dims': '[512, 256]', 'dropout': 0.1756749749621601, 'batch_norm': True, 'lr': 6.193892025710908e-05, 'weight_decay': 3.940300574589835e-06, 'epochs': 118, 'loss': 'mae', 'optimizer': 'adam', 'graph_mode': 'off', 'use_snp_selection': False}. Best is trial 88 with value: 0.12668341454697915.
[I 2025-12-05 15:10:30,090] Trial 96 finished with value: 0.10759109990425303 and parameters: {'model_type': 'mlp', 'hidden_dims': '[512, 256]', 'dropout': 0.1559587920270579, 'batch_norm': True, 'lr': 5.7578135141505005e-05, 'weight_decay': 4.750533751321404e-06, 'epochs': 120, 'loss': 'mae', 'optimizer': 'adam', 'graph_mode': 'off', 'use_snp_selection': False}. Best is trial 88 with value: 0.12668341454697915.
[I 2025-12-05 15:10:31,521] Trial 97 finished with value: 0.11234344466691532 and parameters: {'model_type': 'mlp', 'hidden_dims': '[512, 256]', 'dropout': 0.11293992613350298, 'batch_norm': True, 'lr': 3.9531127222793245e-05, 'weight_decay': 3.3464685267162845e-06, 'epochs': 135, 'loss': 'mae', 'optimizer': 'adam', 'graph_mode': 'off', 'use_snp_selection': False}. Best is trial 88 with value: 0.12668341454697915.
[I 2025-12-05 15:10:32,842] Trial 98 finished with value: 0.07093555761883766 and parameters: {'model_type': 'mlp', 'hidden_dims': '[512, 256]', 'dropout': 0.1427881052003635, 'batch_norm': True, 'lr': 2.4121146521247692e-05, 'weight_decay': 1.1365596038666457e-06, 'epochs': 114, 'loss': 'mae', 'optimizer': 'adam', 'graph_mode': 'off', 'use_snp_selection': False}. Best is trial 88 with value: 0.12668341454697915.
[I 2025-12-05 15:10:34,228] Trial 99 finished with value: 0.11394206125811819 and parameters: {'model_type': 'mlp', 'hidden_dims': '[512, 256]', 'dropout': 0.20929173564423215, 'batch_norm': True, 'lr': 7.552065472705505e-05, 'weight_decay': 1.926620706172976e-05, 'epochs': 126, 'loss': 'mae', 'optimizer': 'adam', 'graph_mode': 'off', 'use_snp_selection': False}. Best is trial 88 with value: 0.12668341454697915.
