[I 2025-12-06 00:32:22,666] Trial 129 finished with value: 0.2884856949457544 and parameters: {'model_type': 'mlp', 'hidden_dims': '[256, 128, 64]', 'dropout': 0.12139539357839049, 'batch_norm': True, 'lr': 0.00048408437239581326, 'weight_decay': 1.8625456681200764e-07, 'epochs': 134, 'loss': 'mse', 'optimizer': 'adam', 'graph_mode': 'off', 'use_snp_selection': False}. Best is trial 9 with value: 0.3016673276975667.
[I 2025-12-06 00:32:47,127] Trial 130 finished with value: 0.2798780402642313 and parameters: {'model_type': 'mlp', 'hidden_dims': '[512, 256]', 'dropout': 0.14596430174026181, 'batch_norm': False, 'lr': 1.207099933028455e-06, 'weight_decay': 1.186707528926567e-07, 'epochs': 109, 'loss': 'mse', 'optimizer': 'adam', 'graph_mode': 'off', 'use_snp_selection': False}. Best is trial 9 with value: 0.3016673276975667.
[I 2025-12-06 00:33:17,868] Trial 131 finished with value: 0.2987097975198535 and parameters: {'model_type': 'mlp', 'hidden_dims': '[512, 256]', 'dropout': 0.10084423758730034, 'batch_norm': True, 'lr': 0.00016757249874224344, 'weight_decay': 5.448752260763109e-07, 'epochs': 144, 'loss': 'mse', 'optimizer': 'adam', 'graph_mode': 'off', 'use_snp_selection': False}. Best is trial 9 with value: 0.3016673276975667.
[I 2025-12-06 00:33:48,426] Trial 132 finished with value: 0.29018115093576535 and parameters: {'model_type': 'mlp', 'hidden_dims': '[512, 256]', 'dropout': 0.1012029260976497, 'batch_norm': True, 'lr': 0.0003458604611674, 'weight_decay': 2.63615013718862e-07, 'epochs': 143, 'loss': 'mse', 'optimizer': 'adam', 'graph_mode': 'off', 'use_snp_selection': False}. Best is trial 9 with value: 0.3016673276975667.
[I 2025-12-06 00:34:20,727] Trial 133 finished with value: 0.2959925235724642 and parameters: {'model_type': 'mlp', 'hidden_dims': '[512, 256]', 'dropout': 0.11236254142434461, 'batch_norm': True, 'lr': 0.00012383696453733775, 'weight_decay': 4.2024349736718173e-07, 'epochs': 153, 'loss': 'mse', 'optimizer': 'adam', 'graph_mode': 'off', 'use_snp_selection': False}. Best is trial 9 with value: 0.3016673276975667.
[I 2025-12-06 00:34:46,659] Trial 134 finished with value: 0.2953366404329043 and parameters: {'model_type': 'mlp', 'hidden_dims': '[512, 256]', 'dropout': 0.12865049108744175, 'batch_norm': True, 'lr': 0.00017236041431998415, 'weight_decay': 5.298132238135484e-07, 'epochs': 117, 'loss': 'mse', 'optimizer': 'adam', 'graph_mode': 'off', 'use_snp_selection': False}. Best is trial 9 with value: 0.3016673276975667.
[I 2025-12-06 00:35:20,004] Trial 135 finished with value: 0.28989094488892503 and parameters: {'model_type': 'mlp', 'hidden_dims': '[512, 256]', 'dropout': 0.11439792011707771, 'batch_norm': True, 'lr': 0.0002604861293943847, 'weight_decay': 2.2989681317756364e-07, 'epochs': 159, 'loss': 'mse', 'optimizer': 'adam', 'graph_mode': 'off', 'use_snp_selection': False}. Best is trial 9 with value: 0.3016673276975667.
[I 2025-12-06 00:35:51,440] Trial 136 finished with value: 0.2900521505790373 and parameters: {'model_type': 'mlp', 'hidden_dims': '[512, 256]', 'dropout': 0.1383562810224524, 'batch_norm': True, 'lr': 2.883034844496666e-05, 'weight_decay': 3.600344424053408e-07, 'epochs': 148, 'loss': 'mse', 'optimizer': 'adam', 'graph_mode': 'off', 'use_snp_selection': False}. Best is trial 9 with value: 0.3016673276975667.
[I 2025-12-06 00:36:28,871] Trial 137 finished with value: 0.28948726019649995 and parameters: {'model_type': 'mlp', 'hidden_dims': '[512, 64]', 'dropout': 0.12477920110497276, 'batch_norm': True, 'lr': 0.00022739309016947488, 'weight_decay': 1.3074077772888543e-07, 'epochs': 133, 'loss': 'mse', 'optimizer': 'adam', 'graph_mode': 'off', 'use_snp_selection': True, 'num_snps': 24806}. Best is trial 9 with value: 0.3016673276975667.
[I 2025-12-06 00:37:04,059] Trial 138 finished with value: 0.2897558305532492 and parameters: {'model_type': 'mlp', 'hidden_dims': '[512, 256]', 'dropout': 0.10982902177740823, 'batch_norm': True, 'lr': 8.221194176824416e-05, 'weight_decay': 3.134320519817502e-07, 'epochs': 170, 'loss': 'mse', 'optimizer': 'adam', 'graph_mode': 'off', 'use_snp_selection': False}. Best is trial 9 with value: 0.3016673276975667.
[I 2025-12-06 00:37:37,784] Trial 139 finished with value: 0.28844941607354213 and parameters: {'model_type': 'mlp', 'hidden_dims': '[512, 256]', 'dropout': 0.3625660471273413, 'batch_norm': True, 'lr': 9.635637112753383e-05, 'weight_decay': 9.730960058660608e-05, 'epochs': 161, 'loss': 'mse', 'optimizer': 'adam', 'graph_mode': 'off', 'use_snp_selection': False}. Best is trial 9 with value: 0.3016673276975667.
[I 2025-12-06 00:38:18,342] Trial 140 finished with value: 0.2973186377026282 and parameters: {'model_type': 'mlp', 'hidden_dims': '[512, 256]', 'dropout': 0.1739795911184957, 'batch_norm': True, 'lr': 0.00018771712243088198, 'weight_decay': 5.545702344103614e-07, 'epochs': 200, 'loss': 'mse', 'optimizer': 'adam', 'graph_mode': 'off', 'use_snp_selection': False}. Best is trial 9 with value: 0.3016673276975667.
[I 2025-12-06 00:38:59,071] Trial 141 finished with value: 0.29717805099637595 and parameters: {'model_type': 'mlp', 'hidden_dims': '[512, 256]', 'dropout': 0.17599267527463294, 'batch_norm': True, 'lr': 0.00019137440697496486, 'weight_decay': 5.703139941106745e-07, 'epochs': 201, 'loss': 'mse', 'optimizer': 'adam', 'graph_mode': 'off', 'use_snp_selection': False}. Best is trial 9 with value: 0.3016673276975667.
[I 2025-12-06 00:39:40,910] Trial 142 finished with value: 0.29371742977260495 and parameters: {'model_type': 'mlp', 'hidden_dims': '[512, 256]', 'dropout': 0.17419687124287506, 'batch_norm': True, 'lr': 0.00019611906724022917, 'weight_decay': 4.643134212743506e-07, 'epochs': 207, 'loss': 'mse', 'optimizer': 'adam', 'graph_mode': 'off', 'use_snp_selection': False}. Best is trial 9 with value: 0.3016673276975667.
[I 2025-12-06 00:40:21,467] Trial 143 finished with value: 0.29452983254466386 and parameters: {'model_type': 'mlp', 'hidden_dims': '[512, 256]', 'dropout': 0.18734088804928972, 'batch_norm': True, 'lr': 0.00014128467571832354, 'weight_decay': 7.115633190052684e-07, 'epochs': 200, 'loss': 'mse', 'optimizer': 'adam', 'graph_mode': 'off', 'use_snp_selection': False}. Best is trial 9 with value: 0.3016673276975667.
[I 2025-12-06 00:41:04,870] Trial 144 finished with value: 0.2991813329457318 and parameters: {'model_type': 'mlp', 'hidden_dims': '[512, 256]', 'dropout': 0.19607756102609375, 'batch_norm': True, 'lr': 0.00015918344387134191, 'weight_decay': 5.321024567573855e-07, 'epochs': 216, 'loss': 'mse', 'optimizer': 'adam', 'graph_mode': 'off', 'use_snp_selection': False}. Best is trial 9 with value: 0.3016673276975667.
[I 2025-12-06 00:41:47,891] Trial 145 finished with value: 0.29531095807957264 and parameters: {'model_type': 'mlp', 'hidden_dims': '[512, 256]', 'dropout': 0.169912390938399, 'batch_norm': True, 'lr': 0.00024428307956283416, 'weight_decay': 5.857982733065923e-07, 'epochs': 214, 'loss': 'mse', 'optimizer': 'adam', 'graph_mode': 'off', 'use_snp_selection': False}. Best is trial 9 with value: 0.3016673276975667.
[I 2025-12-06 00:42:04,022] Trial 146 finished with value: 0.28870208434939393 and parameters: {'model_type': 'mlp', 'hidden_dims': '[128, 64]', 'dropout': 0.21915781937632342, 'batch_norm': True, 'lr': 0.0001664805422517458, 'weight_decay': 2.902257948835951e-07, 'epochs': 227, 'loss': 'mse', 'optimizer': 'adam', 'graph_mode': 'off', 'use_snp_selection': False}. Best is trial 9 with value: 0.3016673276975667.
[I 2025-12-06 00:42:30,140] Trial 147 finished with value: 0.2930635668674759 and parameters: {'model_type': 'mlp', 'hidden_dims': '[512, 256]', 'dropout': 0.19640445590937158, 'batch_norm': False, 'lr': 0.00020265501374515943, 'weight_decay': 4.094350357785934e-07, 'epochs': 120, 'loss': 'mse', 'optimizer': 'adam', 'graph_mode': 'off', 'use_snp_selection': False}. Best is trial 9 with value: 0.3016673276975667.
[I 2025-12-06 00:42:54,675] Trial 148 finished with value: 0.2889634188859552 and parameters: {'model_type': 'mlp', 'hidden_dims': '[256, 128]', 'dropout': 0.14484692911678537, 'batch_norm': True, 'lr': 0.00018700082159708558, 'weight_decay': 5.19436880881958e-07, 'epochs': 216, 'loss': 'mse', 'optimizer': 'adam', 'graph_mode': 'off', 'use_snp_selection': False}. Best is trial 9 with value: 0.3016673276975667.
[I 2025-12-06 00:43:49,352] Trial 149 finished with value: 0.2955879197123509 and parameters: {'model_type': 'mlp', 'hidden_dims': '[512, 256]', 'dropout': 0.2078935792055691, 'batch_norm': True, 'lr': 0.00015643946544807556, 'weight_decay': 1.7182980679885907e-07, 'epochs': 220, 'loss': 'mse', 'optimizer': 'adam', 'graph_mode': 'off', 'use_snp_selection': True, 'num_snps': 37517}. Best is trial 9 with value: 0.3016673276975667.
[I 2025-12-06 00:44:43,432] Trial 0 finished with value: 0.25671665221881973 and parameters: {'model_type': 'mlp', 'hidden_dims': '[128, 64]', 'dropout': 0.199031432379812, 'batch_norm': True, 'lr': 1.8408544111075837e-06, 'weight_decay': 5.5136510071208614e-05, 'epochs': 336, 'loss': 'mae', 'optimizer': 'adam', 'graph_mode': 'off', 'use_snp_selection': True, 'num_snps': 43862}. Best is trial 0 with value: 0.25671665221881973.
[I 2025-12-06 00:45:10,156] Trial 1 finished with value: 0.2785415149392306 and parameters: {'model_type': 'mlp', 'hidden_dims': '[256, 128]', 'dropout': 0.4370668075331726, 'batch_norm': True, 'lr': 7.133471581159139e-05, 'weight_decay': 1.128633586803549e-05, 'epochs': 242, 'loss': 'mae', 'optimizer': 'adam', 'graph_mode': 'off', 'use_snp_selection': False}. Best is trial 1 with value: 0.2785415149392306.
[I 2025-12-06 00:45:36,689] Trial 2 finished with value: 0.275764667739407 and parameters: {'model_type': 'mlp', 'hidden_dims': '[256, 128, 64]', 'dropout': 0.41314357415569625, 'batch_norm': False, 'lr': 3.952233718592101e-06, 'weight_decay': 0.00026754769258252603, 'epochs': 149, 'loss': 'mse', 'optimizer': 'adam', 'graph_mode': 'off', 'use_snp_selection': True, 'num_snps': 11571}. Best is trial 1 with value: 0.2785415149392306.
[I 2025-12-06 00:46:37,419] Trial 3 finished with value: 0.2977764299051507 and parameters: {'model_type': 'mlp', 'hidden_dims': '[512, 64]', 'dropout': 0.5938127374509361, 'batch_norm': False, 'lr': 5.67704586114731e-06, 'weight_decay': 2.4518087630137052e-05, 'epochs': 320, 'loss': 'mae', 'optimizer': 'adam', 'graph_mode': 'off', 'use_snp_selection': False}. Best is trial 3 with value: 0.2977764299051507.
[I 2025-12-06 00:47:38,035] Trial 4 finished with value: 0.26294393537701366 and parameters: {'model_type': 'mlp', 'hidden_dims': '[512, 128]', 'dropout': 0.25746343592134413, 'batch_norm': True, 'lr': 1.3467657668402788e-06, 'weight_decay': 0.00033087251918647806, 'epochs': 277, 'loss': 'mse', 'optimizer': 'adam', 'graph_mode': 'off', 'use_snp_selection': True, 'num_snps': 36675}. Best is trial 3 with value: 0.2977764299051507.
[I 2025-12-06 00:48:21,202] Trial 5 finished with value: 0.24605278863276006 and parameters: {'model_type': 'mlp', 'hidden_dims': '[512, 64]', 'dropout': 0.38275350994408375, 'batch_norm': True, 'lr': 1.5586664309232824e-06, 'weight_decay': 0.0008227664668621182, 'epochs': 145, 'loss': 'mae', 'optimizer': 'adam', 'graph_mode': 'off', 'use_snp_selection': True, 'num_snps': 32148}. Best is trial 3 with value: 0.2977764299051507.
[I 2025-12-06 00:48:43,835] Trial 6 finished with value: 0.2812024448384297 and parameters: {'model_type': 'mlp', 'hidden_dims': '[256, 128]', 'dropout': 0.3930109900265879, 'batch_norm': False, 'lr': 4.892964372128395e-05, 'weight_decay': 1.5809549317992182e-06, 'epochs': 199, 'loss': 'mse', 'optimizer': 'adam', 'graph_mode': 'off', 'use_snp_selection': False}. Best is trial 3 with value: 0.2977764299051507.
[I 2025-12-06 00:49:06,090] Trial 7 finished with value: 0.28618551847862395 and parameters: {'model_type': 'mlp', 'hidden_dims': '[512, 256]', 'dropout': 0.15343979219678458, 'batch_norm': True, 'lr': 6.234003099047341e-05, 'weight_decay': 3.894760610535477e-07, 'epochs': 97, 'loss': 'mse', 'optimizer': 'adam', 'graph_mode': 'off', 'use_snp_selection': False}. Best is trial 3 with value: 0.2977764299051507.
[I 2025-12-06 00:50:06,196] Trial 8 finished with value: 0.27723073819236144 and parameters: {'model_type': 'mlp', 'hidden_dims': '[512, 128]', 'dropout': 0.10743001231661406, 'batch_norm': True, 'lr': 0.00023728538449271062, 'weight_decay': 1.7629071578048637e-05, 'epochs': 312, 'loss': 'mae', 'optimizer': 'adam', 'graph_mode': 'off', 'use_snp_selection': False}. Best is trial 3 with value: 0.2977764299051507.
[I 2025-12-06 00:50:42,188] Trial 9 finished with value: 0.28128639744258754 and parameters: {'model_type': 'mlp', 'hidden_dims': '[512, 64]', 'dropout': 0.14505336736221927, 'batch_norm': True, 'lr': 5.8619638388111826e-05, 'weight_decay': 6.200156172669308e-07, 'epochs': 175, 'loss': 'mse', 'optimizer': 'adam', 'graph_mode': 'off', 'use_snp_selection': False}. Best is trial 3 with value: 0.2977764299051507.
[I 2025-12-06 00:50:56,921] Trial 10 finished with value: 0.24402088253541585 and parameters: {'model_type': 'mlp', 'hidden_dims': '[512, 64]', 'dropout': 0.5885461262002587, 'batch_norm': False, 'lr': 8.769366258768696e-06, 'weight_decay': 2.78273193871783e-06, 'epochs': 55, 'loss': 'mae', 'optimizer': 'adam', 'graph_mode': 'off', 'use_snp_selection': False}. Best is trial 3 with value: 0.2977764299051507.
[I 2025-12-06 00:51:15,511] Trial 11 finished with value: 0.29628402500000367 and parameters: {'model_type': 'mlp', 'hidden_dims': '[512, 256]', 'dropout': 0.583942291816117, 'batch_norm': False, 'lr': 1.422933652790185e-05, 'weight_decay': 1.18635098029648e-07, 'epochs': 77, 'loss': 'mse', 'optimizer': 'adam', 'graph_mode': 'off', 'use_snp_selection': False}. Best is trial 3 with value: 0.2977764299051507.
[I 2025-12-06 00:51:27,685] Trial 12 finished with value: 0.22749750876596977 and parameters: {'model_type': 'mlp', 'hidden_dims': '[512, 256]', 'dropout': 0.593097749012682, 'batch_norm': False, 'lr': 1.1374686318732863e-05, 'weight_decay': 1.3081036432574914e-07, 'epochs': 40, 'loss': 'mae', 'optimizer': 'adam', 'graph_mode': 'off', 'use_snp_selection': False}. Best is trial 3 with value: 0.2977764299051507.
[I 2025-12-06 00:52:13,894] Trial 13 finished with value: 0.27850938894791877 and parameters: {'model_type': 'mlp', 'hidden_dims': '[512, 256]', 'dropout': 0.5043641748401543, 'batch_norm': False, 'lr': 1.4304506621636526e-05, 'weight_decay': 5.0135437753417527e-05, 'epochs': 235, 'loss': 'mse', 'optimizer': 'adam', 'graph_mode': 'off', 'use_snp_selection': False}. Best is trial 3 with value: 0.2977764299051507.
[I 2025-12-06 00:52:23,018] Trial 14 finished with value: 0.2701222504641455 and parameters: {'model_type': 'mlp', 'hidden_dims': '[128, 64]', 'dropout': 0.5300180653494536, 'batch_norm': False, 'lr': 5.096356034191146e-06, 'weight_decay': 3.0607358611649674e-06, 'epochs': 93, 'loss': 'mse', 'optimizer': 'adam', 'graph_mode': 'off', 'use_snp_selection': False}. Best is trial 3 with value: 0.2977764299051507.
[I 2025-12-06 00:52:53,054] Trial 15 finished with value: 0.27830200043551934 and parameters: {'model_type': 'mlp', 'hidden_dims': '[256, 128, 64]', 'dropout': 0.29817671914947536, 'batch_norm': False, 'lr': 1.8411764708572348e-05, 'weight_decay': 4.4084956876871386e-05, 'epochs': 278, 'loss': 'mae', 'optimizer': 'adam', 'graph_mode': 'off', 'use_snp_selection': False}. Best is trial 3 with value: 0.2977764299051507.
[I 2025-12-06 00:53:59,176] Trial 16 finished with value: 0.26770950623598483 and parameters: {'model_type': 'mlp', 'hidden_dims': '[512, 256]', 'dropout': 0.4992385332513618, 'batch_norm': False, 'lr': 0.00017549215405955411, 'weight_decay': 1.3070443894198984e-07, 'epochs': 350, 'loss': 'mse', 'optimizer': 'adam', 'graph_mode': 'off', 'use_snp_selection': False}. Best is trial 3 with value: 0.2977764299051507.
[I 2025-12-06 00:54:23,926] Trial 17 finished with value: 0.14881203537583937 and parameters: {'model_type': 'mlp', 'hidden_dims': '[512, 64]', 'dropout': 0.543474321376226, 'batch_norm': False, 'lr': 0.000906375209920231, 'weight_decay': 6.503919561253859e-06, 'epochs': 113, 'loss': 'mae', 'optimizer': 'adam', 'graph_mode': 'off', 'use_snp_selection': False}. Best is trial 3 with value: 0.2977764299051507.
[I 2025-12-06 00:55:36,348] Trial 18 finished with value: 0.29613954564580663 and parameters: {'model_type': 'mlp', 'hidden_dims': '[512, 256]', 'dropout': 0.4928065509878574, 'batch_norm': False, 'lr': 3.8282888633697165e-06, 'weight_decay': 0.00015435589843114137, 'epochs': 214, 'loss': 'mse', 'optimizer': 'adam', 'graph_mode': 'off', 'use_snp_selection': True, 'num_snps': 58241}. Best is trial 3 with value: 0.2977764299051507.
[I 2025-12-06 00:56:30,253] Trial 19 finished with value: 0.28003961498925245 and parameters: {'model_type': 'mlp', 'hidden_dims': '[512, 64]', 'dropout': 0.44786810823414697, 'batch_norm': False, 'lr': 2.7694571046960796e-05, 'weight_decay': 5.724339384591128e-07, 'epochs': 281, 'loss': 'mae', 'optimizer': 'adam', 'graph_mode': 'off', 'use_snp_selection': False}. Best is trial 3 with value: 0.2977764299051507.
[I 2025-12-06 00:56:48,220] Trial 20 finished with value: 0.2764715820856354 and parameters: {'model_type': 'mlp', 'hidden_dims': '[512, 128]', 'dropout': 0.31622655364259217, 'batch_norm': False, 'lr': 6.91107062941075e-06, 'weight_decay': 2.417613357794622e-05, 'epochs': 73, 'loss': 'mae', 'optimizer': 'adam', 'graph_mode': 'off', 'use_snp_selection': False}. Best is trial 3 with value: 0.2977764299051507.
[I 2025-12-06 00:58:00,509] Trial 21 finished with value: 0.30046409487242753 and parameters: {'model_type': 'mlp', 'hidden_dims': '[512, 256]', 'dropout': 0.5551594855246745, 'batch_norm': False, 'lr': 3.090288347705094e-06, 'weight_decay': 0.0001547413022287012, 'epochs': 217, 'loss': 'mse', 'optimizer': 'adam', 'graph_mode': 'off', 'use_snp_selection': True, 'num_snps': 57741}. Best is trial 21 with value: 0.30046409487242753.
[I 2025-12-06 00:59:06,077] Trial 22 finished with value: 0.2930554907238495 and parameters: {'model_type': 'mlp', 'hidden_dims': '[512, 256]', 'dropout': 0.5612442427378929, 'batch_norm': False, 'lr': 2.3406799539396974e-06, 'weight_decay': 0.00010197245846567733, 'epochs': 165, 'loss': 'mse', 'optimizer': 'adam', 'graph_mode': 'off', 'use_snp_selection': True, 'num_snps': 59634}. Best is trial 21 with value: 0.30046409487242753.
[I 2025-12-06 00:59:35,888] Trial 23 finished with value: 0.1982001149203681 and parameters: {'model_type': 'mlp', 'hidden_dims': '[512, 256]', 'dropout': 0.5955385530142175, 'batch_norm': False, 'lr': 1.013036684073909e-06, 'weight_decay': 0.0005071058768810474, 'epochs': 128, 'loss': 'mse', 'optimizer': 'adam', 'graph_mode': 'off', 'use_snp_selection': True, 'num_snps': 13925}. Best is trial 21 with value: 0.30046409487242753.
[I 2025-12-06 01:00:54,286] Trial 24 finished with value: 0.2935064087908247 and parameters: {'model_type': 'mlp', 'hidden_dims': '[512, 256]', 'dropout': 0.4677662200111916, 'batch_norm': False, 'lr': 3.0595332058180557e-06, 'weight_decay': 0.00011535570819680899, 'epochs': 312, 'loss': 'mse', 'optimizer': 'adam', 'graph_mode': 'off', 'use_snp_selection': True, 'num_snps': 49189}. Best is trial 21 with value: 0.30046409487242753.
[I 2025-12-06 01:01:29,565] Trial 25 finished with value: 0.28614768905465143 and parameters: {'model_type': 'mlp', 'hidden_dims': '[256, 128, 64]', 'dropout': 0.5535429839103987, 'batch_norm': False, 'lr': 2.524955194001414e-05, 'weight_decay': 5.342793572259206e-06, 'epochs': 253, 'loss': 'mse', 'optimizer': 'adam', 'graph_mode': 'off', 'use_snp_selection': True, 'num_snps': 22126}. Best is trial 21 with value: 0.30046409487242753.
[I 2025-12-06 01:01:52,036] Trial 26 finished with value: 0.22375848536766094 and parameters: {'model_type': 'mlp', 'hidden_dims': '[128, 64]', 'dropout': 0.5185589085998421, 'batch_norm': False, 'lr': 6.053640006278864e-06, 'weight_decay': 1.1709123669574253e-06, 'epochs': 194, 'loss': 'mse', 'optimizer': 'adam', 'graph_mode': 'off', 'use_snp_selection': True, 'num_snps': 2344}. Best is trial 21 with value: 0.30046409487242753.
[I 2025-12-06 01:02:24,933] Trial 27 finished with value: 0.2909455260053702 and parameters: {'model_type': 'mlp', 'hidden_dims': '[256, 128]', 'dropout': 0.5586821557443514, 'batch_norm': False, 'lr': 9.977799701453788e-06, 'weight_decay': 2.271885450975891e-05, 'epochs': 310, 'loss': 'mse', 'optimizer': 'adam', 'graph_mode': 'off', 'use_snp_selection': False}. Best is trial 21 with value: 0.30046409487242753.
[I 2025-12-06 01:03:30,982] Trial 28 finished with value: 0.2858771589154548 and parameters: {'model_type': 'mlp', 'hidden_dims': '[512, 64]', 'dropout': 0.46238280082582595, 'batch_norm': False, 'lr': 1.8081330005600177e-05, 'weight_decay': 0.00021074967784881466, 'epochs': 228, 'loss': 'mae', 'optimizer': 'adam', 'graph_mode': 'off', 'use_snp_selection': True, 'num_snps': 48700}. Best is trial 21 with value: 0.30046409487242753.
[I 2025-12-06 01:04:03,865] Trial 29 finished with value: 0.26671542712613683 and parameters: {'model_type': 'mlp', 'hidden_dims': '[128, 64]', 'dropout': 0.23090703697841608, 'batch_norm': False, 'lr': 2.2341930466279717e-06, 'weight_decay': 7.13690662268439e-05, 'epochs': 184, 'loss': 'mae', 'optimizer': 'adam', 'graph_mode': 'off', 'use_snp_selection': True, 'num_snps': 26994}. Best is trial 21 with value: 0.30046409487242753.
[I 2025-12-06 01:04:54,476] Trial 30 finished with value: 0.30104470069355177 and parameters: {'model_type': 'mlp', 'hidden_dims': '[512, 256]', 'dropout': 0.5703615999608569, 'batch_norm': False, 'lr': 3.0756340892240573e-06, 'weight_decay': 4.4131289510730833e-05, 'epochs': 260, 'loss': 'mse', 'optimizer': 'adam', 'graph_mode': 'off', 'use_snp_selection': False}. Best is trial 30 with value: 0.30104470069355177.
