[I 2025-12-05 16:31:32,101] Trial 72 finished with value: 0.047526381166161195 and parameters: {'model_type': 'mlp', 'hidden_dims': '[512, 64]', 'dropout': 0.5477837342466583, 'batch_norm': False, 'lr': 4.250402308670833e-05, 'weight_decay': 3.2271413050040537e-07, 'epochs': 325, 'loss': 'mae', 'optimizer': 'adam', 'graph_mode': 'off', 'use_snp_selection': False}. Best is trial 9 with value: 0.07418170351669094.
[I 2025-12-05 16:31:33,969] Trial 73 finished with value: 0.04920211714809544 and parameters: {'model_type': 'mlp', 'hidden_dims': '[512, 256]', 'dropout': 0.5998977717145801, 'batch_norm': False, 'lr': 5.645362093198876e-06, 'weight_decay': 4.202322240643838e-05, 'epochs': 341, 'loss': 'mae', 'optimizer': 'adam', 'graph_mode': 'off', 'use_snp_selection': False}. Best is trial 9 with value: 0.07418170351669094.
[I 2025-12-05 16:31:35,147] Trial 74 finished with value: 4.521494921671007e-05 and parameters: {'model_type': 'mlp', 'hidden_dims': '[512, 64]', 'dropout': 0.5594811624827303, 'batch_norm': False, 'lr': 7.407861379985336e-05, 'weight_decay': 6.955470928753403e-06, 'epochs': 144, 'loss': 'mae', 'optimizer': 'adam', 'graph_mode': 'off', 'use_snp_selection': False}. Best is trial 9 with value: 0.07418170351669094.
[I 2025-12-05 16:31:35,967] Trial 75 finished with value: 0.03709350764327586 and parameters: {'model_type': 'mlp', 'hidden_dims': '[512, 128]', 'dropout': 0.5807984468736918, 'batch_norm': False, 'lr': 0.00022570334048001306, 'weight_decay': 7.024100778023008e-07, 'epochs': 234, 'loss': 'mae', 'optimizer': 'adam', 'graph_mode': 'off', 'use_snp_selection': True, 'num_snps': 2869}. Best is trial 9 with value: 0.07418170351669094.
[I 2025-12-05 16:31:36,866] Trial 76 finished with value: 0.00924529453532118 and parameters: {'model_type': 'mlp', 'hidden_dims': '[128, 64]', 'dropout': 0.35954190837674066, 'batch_norm': True, 'lr': 1.7382988223709501e-06, 'weight_decay': 1.1298977101069999e-06, 'epochs': 281, 'loss': 'mse', 'optimizer': 'adam', 'graph_mode': 'off', 'use_snp_selection': False}. Best is trial 9 with value: 0.07418170351669094.
[I 2025-12-05 16:31:38,474] Trial 77 finished with value: 0.04124287884107137 and parameters: {'model_type': 'mlp', 'hidden_dims': '[512, 256]', 'dropout': 0.46536123279547054, 'batch_norm': False, 'lr': 9.731493264024754e-05, 'weight_decay': 1.2878065099241646e-07, 'epochs': 267, 'loss': 'mae', 'optimizer': 'adam', 'graph_mode': 'off', 'use_snp_selection': False}. Best is trial 9 with value: 0.07418170351669094.
[I 2025-12-05 16:31:39,460] Trial 78 finished with value: 0.04875303396016642 and parameters: {'model_type': 'mlp', 'hidden_dims': '[512, 64]', 'dropout': 0.1529119599785209, 'batch_norm': True, 'lr': 0.00014544270190973798, 'weight_decay': 7.055262603974099e-05, 'epochs': 86, 'loss': 'mse', 'optimizer': 'adam', 'graph_mode': 'off', 'use_snp_selection': False}. Best is trial 9 with value: 0.07418170351669094.
[I 2025-12-05 16:31:40,902] Trial 79 finished with value: 0.03364676491216747 and parameters: {'model_type': 'mlp', 'hidden_dims': '[512, 256]', 'dropout': 0.2054134745790744, 'batch_norm': False, 'lr': 1.4922168324926453e-05, 'weight_decay': 2.0442943379988259e-07, 'epochs': 210, 'loss': 'mse', 'optimizer': 'adam', 'graph_mode': 'off', 'use_snp_selection': False}. Best is trial 9 with value: 0.07418170351669094.
[I 2025-12-05 16:31:42,444] Trial 80 finished with value: 0.03841273141048308 and parameters: {'model_type': 'mlp', 'hidden_dims': '[512, 128]', 'dropout': 0.17455741160792043, 'batch_norm': True, 'lr': 4.9435165948572284e-05, 'weight_decay': 1.3730307753230563e-05, 'epochs': 245, 'loss': 'mse', 'optimizer': 'adam', 'graph_mode': 'off', 'use_snp_selection': False}. Best is trial 9 with value: 0.07418170351669094.
[I 2025-12-05 16:31:43,796] Trial 81 finished with value: 0.047306381302813755 and parameters: {'model_type': 'mlp', 'hidden_dims': '[512, 64]', 'dropout': 0.19890262537635003, 'batch_norm': False, 'lr': 6.14584304961626e-05, 'weight_decay': 0.00011665214803248022, 'epochs': 194, 'loss': 'mse', 'optimizer': 'adam', 'graph_mode': 'off', 'use_snp_selection': False}. Best is trial 9 with value: 0.07418170351669094.
[I 2025-12-05 16:31:45,181] Trial 82 finished with value: 0.03157538101711685 and parameters: {'model_type': 'mlp', 'hidden_dims': '[512, 64]', 'dropout': 0.14064216407558577, 'batch_norm': False, 'lr': 8.198296569485148e-05, 'weight_decay': 0.00011186384080033323, 'epochs': 203, 'loss': 'mse', 'optimizer': 'adam', 'graph_mode': 'off', 'use_snp_selection': False}. Best is trial 9 with value: 0.07418170351669094.
[I 2025-12-05 16:31:46,628] Trial 83 finished with value: 0.035134808374963494 and parameters: {'model_type': 'mlp', 'hidden_dims': '[512, 64]', 'dropout': 0.19303663002110905, 'batch_norm': False, 'lr': 3.201934633061141e-05, 'weight_decay': 5.089257052183157e-05, 'epochs': 222, 'loss': 'mse', 'optimizer': 'adam', 'graph_mode': 'off', 'use_snp_selection': False}. Best is trial 9 with value: 0.07418170351669094.
[I 2025-12-05 16:31:47,947] Trial 84 finished with value: 0.04173842715445466 and parameters: {'model_type': 'mlp', 'hidden_dims': '[512, 64]', 'dropout': 0.2189921258388632, 'batch_norm': False, 'lr': 5.998434518574413e-05, 'weight_decay': 0.0001577674911435871, 'epochs': 184, 'loss': 'mse', 'optimizer': 'adam', 'graph_mode': 'off', 'use_snp_selection': False}. Best is trial 9 with value: 0.07418170351669094.
[I 2025-12-05 16:31:48,865] Trial 85 finished with value: 0.026259488106337214 and parameters: {'model_type': 'mlp', 'hidden_dims': '[256, 128]', 'dropout': 0.24219922645414022, 'batch_norm': False, 'lr': 5.117774317638723e-05, 'weight_decay': 8.371945412810627e-05, 'epochs': 190, 'loss': 'mse', 'optimizer': 'adam', 'graph_mode': 'off', 'use_snp_selection': False}. Best is trial 9 with value: 0.07418170351669094.
[I 2025-12-05 16:31:50,894] Trial 86 finished with value: 0.0595487005779241 and parameters: {'model_type': 'mlp', 'hidden_dims': '[128, 64]', 'dropout': 0.27213030213784783, 'batch_norm': False, 'lr': 9.031691768237435e-06, 'weight_decay': 5.456056974253127e-07, 'epochs': 164, 'loss': 'mse', 'optimizer': 'adam', 'graph_mode': 'off', 'use_snp_selection': True, 'num_snps': 48233}. Best is trial 9 with value: 0.07418170351669094.
[I 2025-12-05 16:31:52,879] Trial 87 finished with value: 0.03699187315917368 and parameters: {'model_type': 'mlp', 'hidden_dims': '[128, 64]', 'dropout': 0.28387970416045866, 'batch_norm': False, 'lr': 9.445251041046251e-06, 'weight_decay': 5.015284456796415e-07, 'epochs': 164, 'loss': 'mae', 'optimizer': 'adam', 'graph_mode': 'off', 'use_snp_selection': True, 'num_snps': 47142}. Best is trial 9 with value: 0.07418170351669094.
[I 2025-12-05 16:31:54,713] Trial 88 finished with value: 0.006852140452241039 and parameters: {'model_type': 'mlp', 'hidden_dims': '[128, 64]', 'dropout': 0.29942020638456207, 'batch_norm': True, 'lr': 1.0147418282195511e-05, 'weight_decay': 3.719952349164285e-07, 'epochs': 179, 'loss': 'mse', 'optimizer': 'adam', 'graph_mode': 'off', 'use_snp_selection': True, 'num_snps': 39249}. Best is trial 9 with value: 0.07418170351669094.
[I 2025-12-05 16:31:56,770] Trial 89 finished with value: 0.037982976230235325 and parameters: {'model_type': 'mlp', 'hidden_dims': '[128, 64]', 'dropout': 0.11721027469486123, 'batch_norm': False, 'lr': 6.8603903834537275e-06, 'weight_decay': 2.553282987499032e-07, 'epochs': 150, 'loss': 'mse', 'optimizer': 'adam', 'graph_mode': 'off', 'use_snp_selection': True, 'num_snps': 50535}. Best is trial 9 with value: 0.07418170351669094.
[I 2025-12-05 16:31:58,892] Trial 90 finished with value: 0.029504394018901973 and parameters: {'model_type': 'mlp', 'hidden_dims': '[128, 64]', 'dropout': 0.25926050012941515, 'batch_norm': True, 'lr': 3.0542009730428065e-06, 'weight_decay': 1.5950724872536688e-06, 'epochs': 73, 'loss': 'mse', 'optimizer': 'adam', 'graph_mode': 'off', 'use_snp_selection': True, 'num_snps': 53054}. Best is trial 9 with value: 0.07418170351669094.
[I 2025-12-05 16:32:00,413] Trial 91 finished with value: 0.05208060862821129 and parameters: {'model_type': 'mlp', 'hidden_dims': '[256, 128, 64]', 'dropout': 0.161763873372036, 'batch_norm': False, 'lr': 4.110404408833419e-05, 'weight_decay': 0.00031492568745066266, 'epochs': 200, 'loss': 'mse', 'optimizer': 'adam', 'graph_mode': 'off', 'use_snp_selection': True, 'num_snps': 28357}. Best is trial 9 with value: 0.07418170351669094.
[I 2025-12-05 16:32:01,689] Trial 92 finished with value: 0.07024756304855856 and parameters: {'model_type': 'mlp', 'hidden_dims': '[512, 64]', 'dropout': 0.181282254231416, 'batch_norm': False, 'lr': 2.259472756636672e-05, 'weight_decay': 6.04732681513262e-07, 'epochs': 174, 'loss': 'mse', 'optimizer': 'adam', 'graph_mode': 'off', 'use_snp_selection': False}. Best is trial 9 with value: 0.07418170351669094.
[I 2025-12-05 16:32:02,958] Trial 93 finished with value: 0.04238230209760454 and parameters: {'model_type': 'mlp', 'hidden_dims': '[512, 256]', 'dropout': 0.17907531728451323, 'batch_norm': False, 'lr': 1.90297473291976e-05, 'weight_decay': 5.773402439313693e-07, 'epochs': 173, 'loss': 'mse', 'optimizer': 'adam', 'graph_mode': 'off', 'use_snp_selection': False}. Best is trial 9 with value: 0.07418170351669094.
[I 2025-12-05 16:32:04,186] Trial 94 finished with value: 0.04186865281216515 and parameters: {'model_type': 'mlp', 'hidden_dims': '[512, 128]', 'dropout': 0.32757197983095454, 'batch_norm': False, 'lr': 1.572748698134181e-05, 'weight_decay': 7.81232031547342e-07, 'epochs': 158, 'loss': 'mse', 'optimizer': 'adam', 'graph_mode': 'off', 'use_snp_selection': False}. Best is trial 9 with value: 0.07418170351669094.
[I 2025-12-05 16:32:05,218] Trial 95 finished with value: 0.048343265543771 and parameters: {'model_type': 'mlp', 'hidden_dims': '[512, 64]', 'dropout': 0.21378494995012046, 'batch_norm': False, 'lr': 2.478171428745241e-05, 'weight_decay': 1.1001717573812409e-06, 'epochs': 103, 'loss': 'mse', 'optimizer': 'adam', 'graph_mode': 'off', 'use_snp_selection': False}. Best is trial 9 with value: 0.07418170351669094.
[I 2025-12-05 16:32:07,088] Trial 96 finished with value: 0.03217116977979073 and parameters: {'model_type': 'mlp', 'hidden_dims': '[512, 256]', 'dropout': 0.16246397757888364, 'batch_norm': False, 'lr': 7.767198772289386e-06, 'weight_decay': 4.023943386297187e-07, 'epochs': 179, 'loss': 'mae', 'optimizer': 'adam', 'graph_mode': 'off', 'use_snp_selection': True, 'num_snps': 35578}. Best is trial 9 with value: 0.07418170351669094.
[I 2025-12-05 16:32:07,733] Trial 97 finished with value: 0.08735465824458159 and parameters: {'model_type': 'mlp', 'hidden_dims': '[128, 64]', 'dropout': 0.1406190535089076, 'batch_norm': True, 'lr': 1.406788123136512e-05, 'weight_decay': 2.0987022623199e-05, 'epochs': 90, 'loss': 'mse', 'optimizer': 'adam', 'graph_mode': 'off', 'use_snp_selection': False}. Best is trial 97 with value: 0.08735465824458159.
[I 2025-12-05 16:32:08,404] Trial 98 finished with value: 0.0402261207895576 and parameters: {'model_type': 'mlp', 'hidden_dims': '[128, 64]', 'dropout': 0.14617565896144016, 'batch_norm': True, 'lr': 2.108356690753494e-05, 'weight_decay': 1.8235817211618382e-06, 'epochs': 91, 'loss': 'mse', 'optimizer': 'adam', 'graph_mode': 'off', 'use_snp_selection': False}. Best is trial 97 with value: 0.08735465824458159.
[I 2025-12-05 16:32:09,011] Trial 99 finished with value: 0.027123102747003712 and parameters: {'model_type': 'mlp', 'hidden_dims': '[128, 64]', 'dropout': 0.12148445501745737, 'batch_norm': True, 'lr': 1.3815270728507548e-05, 'weight_decay': 5.740230701460763e-07, 'epochs': 58, 'loss': 'mse', 'optimizer': 'adam', 'graph_mode': 'off', 'use_snp_selection': False}. Best is trial 97 with value: 0.08735465824458159.
[I 2025-12-05 16:32:09,675] Trial 100 finished with value: 0.00892208629346626 and parameters: {'model_type': 'mlp', 'hidden_dims': '[128, 64]', 'dropout': 0.13195307811407186, 'batch_norm': True, 'lr': 1.1318398787782875e-05, 'weight_decay': 2.732289271884865e-06, 'epochs': 111, 'loss': 'mse', 'optimizer': 'adam', 'graph_mode': 'off', 'use_snp_selection': False}. Best is trial 97 with value: 0.08735465824458159.
[I 2025-12-05 16:32:10,317] Trial 101 finished with value: 0.04293636492018564 and parameters: {'model_type': 'mlp', 'hidden_dims': '[128, 64]', 'dropout': 0.31446685287517034, 'batch_norm': True, 'lr': 3.6398098136596292e-06, 'weight_decay': 1.849380070629337e-05, 'epochs': 94, 'loss': 'mse', 'optimizer': 'adam', 'graph_mode': 'off', 'use_snp_selection': False}. Best is trial 97 with value: 0.08735465824458159.
[I 2025-12-05 16:32:11,914] Trial 102 finished with value: 0.03244597443105098 and parameters: {'model_type': 'mlp', 'hidden_dims': '[512, 256]', 'dropout': 0.11013197615298048, 'batch_norm': True, 'lr': 2.8803971603366154e-05, 'weight_decay': 2.1512027436589147e-05, 'epochs': 260, 'loss': 'mse', 'optimizer': 'adam', 'graph_mode': 'off', 'use_snp_selection': False}. Best is trial 97 with value: 0.08735465824458159.
[I 2025-12-05 16:32:12,536] Trial 103 finished with value: -0.00013531225856244008 and parameters: {'model_type': 'mlp', 'hidden_dims': '[128, 64]', 'dropout': 0.5857865022970286, 'batch_norm': True, 'lr': 2.0660137469451663e-05, 'weight_decay': 0.0005883104303412636, 'epochs': 81, 'loss': 'mse', 'optimizer': 'adam', 'graph_mode': 'off', 'use_snp_selection': False}. Best is trial 97 with value: 0.08735465824458159.
[I 2025-12-05 16:32:13,792] Trial 104 finished with value: 0.002164950419799307 and parameters: {'model_type': 'mlp', 'hidden_dims': '[512, 64]', 'dropout': 0.5655223220617277, 'batch_norm': False, 'lr': 5.617591676891403e-06, 'weight_decay': 1.7658677489550223e-07, 'epochs': 163, 'loss': 'mse', 'optimizer': 'adam', 'graph_mode': 'off', 'use_snp_selection': False}. Best is trial 97 with value: 0.08735465824458159.
[I 2025-12-05 16:32:14,715] Trial 105 finished with value: 0.03766463562643897 and parameters: {'model_type': 'mlp', 'hidden_dims': '[512, 256]', 'dropout': 0.23234096642352572, 'batch_norm': True, 'lr': 1.0772339771645765e-05, 'weight_decay': 2.876111044587411e-07, 'epochs': 68, 'loss': 'mse', 'optimizer': 'adam', 'graph_mode': 'off', 'use_snp_selection': False}. Best is trial 97 with value: 0.08735465824458159.
[I 2025-12-05 16:32:15,839] Trial 106 finished with value: 0.042119108277490665 and parameters: {'model_type': 'mlp', 'hidden_dims': '[512, 128]', 'dropout': 0.13646230640801302, 'batch_norm': False, 'lr': 8.08151406498002e-06, 'weight_decay': 7.887190069893026e-06, 'epochs': 128, 'loss': 'mae', 'optimizer': 'adam', 'graph_mode': 'off', 'use_snp_selection': False}. Best is trial 97 with value: 0.08735465824458159.
[I 2025-12-05 16:32:16,630] Trial 107 finished with value: 0.06372450651384727 and parameters: {'model_type': 'mlp', 'hidden_dims': '[256, 128]', 'dropout': 0.16537040082724322, 'batch_norm': False, 'lr': 6.862942698453097e-05, 'weight_decay': 1.168409585523014e-05, 'epochs': 119, 'loss': 'mse', 'optimizer': 'adam', 'graph_mode': 'off', 'use_snp_selection': False}. Best is trial 97 with value: 0.08735465824458159.
[I 2025-12-05 16:32:17,419] Trial 108 finished with value: 0.03411047941074714 and parameters: {'model_type': 'mlp', 'hidden_dims': '[256, 128]', 'dropout': 0.16456905237442407, 'batch_norm': False, 'lr': 6.661922389282925e-05, 'weight_decay': 1.1889244242526795e-05, 'epochs': 119, 'loss': 'mse', 'optimizer': 'adam', 'graph_mode': 'off', 'use_snp_selection': False}. Best is trial 97 with value: 0.08735465824458159.
[I 2025-12-05 16:32:19,308] Trial 109 finished with value: 0.050919606289131794 and parameters: {'model_type': 'mlp', 'hidden_dims': '[256, 128]', 'dropout': 0.19073158423619457, 'batch_norm': True, 'lr': 0.00011417213839796269, 'weight_decay': 6.100982529713231e-06, 'epochs': 135, 'loss': 'mse', 'optimizer': 'adam', 'graph_mode': 'off', 'use_snp_selection': True, 'num_snps': 42102}. Best is trial 97 with value: 0.08735465824458159.
[I 2025-12-05 16:32:20,071] Trial 110 finished with value: 0.050076933929882876 and parameters: {'model_type': 'mlp', 'hidden_dims': '[256, 128]', 'dropout': 0.1548979332780934, 'batch_norm': False, 'lr': 3.6948965166703096e-05, 'weight_decay': 4.4472416595660846e-07, 'epochs': 103, 'loss': 'mse', 'optimizer': 'adam', 'graph_mode': 'off', 'use_snp_selection': False}. Best is trial 97 with value: 0.08735465824458159.
[I 2025-12-05 16:32:20,985] Trial 111 finished with value: 0.03489996910415506 and parameters: {'model_type': 'mlp', 'hidden_dims': '[256, 128]', 'dropout': 0.2470604014782511, 'batch_norm': False, 'lr': 0.0005688660371028104, 'weight_decay': 4.76890668867178e-06, 'epochs': 188, 'loss': 'mse', 'optimizer': 'adam', 'graph_mode': 'off', 'use_snp_selection': False}. Best is trial 97 with value: 0.08735465824458159.
[I 2025-12-05 16:32:22,679] Trial 112 finished with value: 0.062326063129526835 and parameters: {'model_type': 'mlp', 'hidden_dims': '[512, 256]', 'dropout': 0.17102740232766653, 'batch_norm': False, 'lr': 8.986127930327171e-05, 'weight_decay': 9.866932292263192e-06, 'epochs': 292, 'loss': 'mse', 'optimizer': 'adam', 'graph_mode': 'off', 'use_snp_selection': False}. Best is trial 97 with value: 0.08735465824458159.
[I 2025-12-05 16:32:24,404] Trial 113 finished with value: 0.04467279807570454 and parameters: {'model_type': 'mlp', 'hidden_dims': '[512, 256]', 'dropout': 0.17630798780709445, 'batch_norm': False, 'lr': 8.831113948175506e-05, 'weight_decay': 1.3514181136162603e-05, 'epochs': 300, 'loss': 'mse', 'optimizer': 'adam', 'graph_mode': 'off', 'use_snp_selection': False}. Best is trial 97 with value: 0.08735465824458159.
[I 2025-12-05 16:32:25,370] Trial 114 finished with value: 0.07957743602977635 and parameters: {'model_type': 'mlp', 'hidden_dims': '[512, 256]', 'dropout': 0.14703045986502844, 'batch_norm': False, 'lr': 6.755883322676857e-05, 'weight_decay': 7.194952218252761e-07, 'epochs': 81, 'loss': 'mse', 'optimizer': 'adam', 'graph_mode': 'off', 'use_snp_selection': False}. Best is trial 97 with value: 0.08735465824458159.
[I 2025-12-05 16:32:27,051] Trial 115 finished with value: 0.06550232745270818 and parameters: {'model_type': 'mlp', 'hidden_dims': '[512, 256]', 'dropout': 0.14628984221909566, 'batch_norm': False, 'lr': 7.193455938557991e-05, 'weight_decay': 7.830157889814526e-07, 'epochs': 289, 'loss': 'mse', 'optimizer': 'adam', 'graph_mode': 'off', 'use_snp_selection': False}. Best is trial 97 with value: 0.08735465824458159.
[I 2025-12-05 16:32:28,750] Trial 116 finished with value: 0.05183317080422039 and parameters: {'model_type': 'mlp', 'hidden_dims': '[512, 256]', 'dropout': 0.1489295069442623, 'batch_norm': True, 'lr': 7.424244428922569e-05, 'weight_decay': 9.230333916322088e-06, 'epochs': 288, 'loss': 'mse', 'optimizer': 'adam', 'graph_mode': 'off', 'use_snp_selection': False}. Best is trial 97 with value: 0.08735465824458159.
[I 2025-12-05 16:32:30,495] Trial 117 finished with value: 0.044141152398040555 and parameters: {'model_type': 'mlp', 'hidden_dims': '[512, 256]', 'dropout': 0.17085729580140424, 'batch_norm': False, 'lr': 5.319191898280908e-05, 'weight_decay': 7.954417352947659e-07, 'epochs': 307, 'loss': 'mse', 'optimizer': 'adam', 'graph_mode': 'off', 'use_snp_selection': False}. Best is trial 97 with value: 0.08735465824458159.
[I 2025-12-05 16:32:32,117] Trial 118 finished with value: 0.04792525884898254 and parameters: {'model_type': 'mlp', 'hidden_dims': '[512, 256]', 'dropout': 0.1324427907435158, 'batch_norm': False, 'lr': 3.265635242616991e-05, 'weight_decay': 9.668587858742317e-07, 'epochs': 272, 'loss': 'mse', 'optimizer': 'adam', 'graph_mode': 'off', 'use_snp_selection': False}. Best is trial 97 with value: 0.08735465824458159.
[I 2025-12-05 16:32:33,827] Trial 119 finished with value: 0.0315953353039998 and parameters: {'model_type': 'mlp', 'hidden_dims': '[512, 256]', 'dropout': 0.18256547887319996, 'batch_norm': True, 'lr': 4.508345618856389e-05, 'weight_decay': 1.1826732704170755e-07, 'epochs': 291, 'loss': 'mse', 'optimizer': 'adam', 'graph_mode': 'off', 'use_snp_selection': False}. Best is trial 97 with value: 0.08735465824458159.
[I 2025-12-05 16:32:35,489] Trial 120 finished with value: 0.059306355050244966 and parameters: {'model_type': 'mlp', 'hidden_dims': '[512, 256]', 'dropout': 0.11078009437485442, 'batch_norm': False, 'lr': 0.00010051552740738519, 'weight_decay': 1.46049384566356e-07, 'epochs': 283, 'loss': 'mse', 'optimizer': 'adam', 'graph_mode': 'off', 'use_snp_selection': False}. Best is trial 97 with value: 0.08735465824458159.
[I 2025-12-05 16:32:36,459] Trial 121 finished with value: 0.06657376366422178 and parameters: {'model_type': 'mlp', 'hidden_dims': '[512, 256]', 'dropout': 0.14578150056274702, 'batch_norm': False, 'lr': 6.854217275626109e-05, 'weight_decay': 6.589516501075678e-07, 'epochs': 82, 'loss': 'mse', 'optimizer': 'adam', 'graph_mode': 'off', 'use_snp_selection': False}. Best is trial 97 with value: 0.08735465824458159.
[I 2025-12-05 16:32:37,450] Trial 122 finished with value: 0.03198730071890193 and parameters: {'model_type': 'mlp', 'hidden_dims': '[512, 256]', 'dropout': 0.1446990801450299, 'batch_norm': False, 'lr': 0.0001340052299654119, 'weight_decay': 3.1756425219156165e-07, 'epochs': 81, 'loss': 'mse', 'optimizer': 'adam', 'graph_mode': 'off', 'use_snp_selection': False}. Best is trial 97 with value: 0.08735465824458159.
[I 2025-12-05 16:32:38,302] Trial 123 finished with value: 0.03700371879856875 and parameters: {'model_type': 'mlp', 'hidden_dims': '[512, 256]', 'dropout': 0.16361860600330785, 'batch_norm': False, 'lr': 7.949607857362486e-05, 'weight_decay': 2.4249692860056175e-07, 'epochs': 48, 'loss': 'mse', 'optimizer': 'adam', 'graph_mode': 'off', 'use_snp_selection': False}. Best is trial 97 with value: 0.08735465824458159.
