[I 2025-12-06 05:05:24,411] Trial 38 finished with value: 0.28507973515880447 and parameters: {'model_type': 'mlp', 'hidden_dims': '[256, 128, 64]', 'dropout': 0.338517801133631, 'batch_norm': True, 'lr': 2.590352423882353e-05, 'weight_decay': 0.00017411024312040036, 'epochs': 98, 'loss': 'mse', 'optimizer': 'adam', 'graph_mode': 'off', 'use_snp_selection': True, 'num_snps': 24866}. Best is trial 21 with value: 0.3092264416225702.
[I 2025-12-06 05:05:48,944] Trial 39 finished with value: 0.2869619654015279 and parameters: {'model_type': 'mlp', 'hidden_dims': '[512, 128]', 'dropout': 0.1456654075365714, 'batch_norm': False, 'lr': 1.018011719793853e-05, 'weight_decay': 0.0005270282295743135, 'epochs': 135, 'loss': 'mse', 'optimizer': 'adam', 'graph_mode': 'off', 'use_snp_selection': True, 'num_snps': 5787}. Best is trial 21 with value: 0.3092264416225702.
[I 2025-12-06 05:06:40,618] Trial 40 finished with value: 0.262179115399379 and parameters: {'model_type': 'mlp', 'hidden_dims': '[512, 256]', 'dropout': 0.24188224736459132, 'batch_norm': True, 'lr': 1.6082608268562697e-06, 'weight_decay': 2.5209846458865025e-05, 'epochs': 184, 'loss': 'mae', 'optimizer': 'adam', 'graph_mode': 'off', 'use_snp_selection': True, 'num_snps': 38507}. Best is trial 21 with value: 0.3092264416225702.
[I 2025-12-06 05:07:29,882] Trial 41 finished with value: 0.3104019414454807 and parameters: {'model_type': 'mlp', 'hidden_dims': '[512, 256]', 'dropout': 0.21307019357671178, 'batch_norm': False, 'lr': 8.423519345601025e-06, 'weight_decay': 0.00021259493314592637, 'epochs': 82, 'loss': 'mse', 'optimizer': 'adam', 'graph_mode': 'off', 'use_snp_selection': True, 'num_snps': 55223}. Best is trial 41 with value: 0.3104019414454807.
[I 2025-12-06 05:08:17,576] Trial 42 finished with value: 0.2922010072700297 and parameters: {'model_type': 'mlp', 'hidden_dims': '[512, 256]', 'dropout': 0.17114754204816346, 'batch_norm': False, 'lr': 2.9326390893590783e-06, 'weight_decay': 7.793528522337749e-05, 'epochs': 72, 'loss': 'mse', 'optimizer': 'adam', 'graph_mode': 'off', 'use_snp_selection': True, 'num_snps': 54975}. Best is trial 41 with value: 0.3104019414454807.
[I 2025-12-06 05:09:05,152] Trial 43 finished with value: 0.306509154663753 and parameters: {'model_type': 'mlp', 'hidden_dims': '[512, 256]', 'dropout': 0.2524472248837496, 'batch_norm': False, 'lr': 6.891460832824694e-06, 'weight_decay': 3.994868573016661e-05, 'epochs': 101, 'loss': 'mse', 'optimizer': 'adam', 'graph_mode': 'off', 'use_snp_selection': True, 'num_snps': 46951}. Best is trial 41 with value: 0.3104019414454807.
[I 2025-12-06 05:09:45,688] Trial 44 finished with value: 0.2930382133590971 and parameters: {'model_type': 'mlp', 'hidden_dims': '[512, 64]', 'dropout': 0.25333995626734135, 'batch_norm': False, 'lr': 7.118944271754254e-06, 'weight_decay': 3.978737245269936e-05, 'epochs': 47, 'loss': 'mse', 'optimizer': 'adam', 'graph_mode': 'off', 'use_snp_selection': True, 'num_snps': 47037}. Best is trial 41 with value: 0.3104019414454807.
[I 2025-12-06 05:10:37,822] Trial 45 finished with value: 0.30299653236065816 and parameters: {'model_type': 'mlp', 'hidden_dims': '[512, 256]', 'dropout': 0.295340871005637, 'batch_norm': False, 'lr': 9.996791066375793e-06, 'weight_decay': 0.00016386850682803124, 'epochs': 102, 'loss': 'mse', 'optimizer': 'adam', 'graph_mode': 'off', 'use_snp_selection': True, 'num_snps': 54851}. Best is trial 41 with value: 0.3104019414454807.
[I 2025-12-06 05:11:19,953] Trial 46 finished with value: 0.29514768741018693 and parameters: {'model_type': 'mlp', 'hidden_dims': '[512, 256]', 'dropout': 0.32285440029586127, 'batch_norm': True, 'lr': 4.381390368618427e-05, 'weight_decay': 1.5575133828006012e-05, 'epochs': 81, 'loss': 'mse', 'optimizer': 'adam', 'graph_mode': 'off', 'use_snp_selection': True, 'num_snps': 41428}. Best is trial 41 with value: 0.3104019414454807.
[I 2025-12-06 05:12:14,626] Trial 47 finished with value: 0.30228982577972047 and parameters: {'model_type': 'mlp', 'hidden_dims': '[512, 256]', 'dropout': 0.36127291270515577, 'batch_norm': False, 'lr': 6.0037672547661074e-06, 'weight_decay': 3.658585425730001e-05, 'epochs': 158, 'loss': 'mse', 'optimizer': 'adam', 'graph_mode': 'off', 'use_snp_selection': True, 'num_snps': 46633}. Best is trial 41 with value: 0.3104019414454807.
[I 2025-12-06 05:13:40,665] Trial 48 finished with value: 0.2892747597011106 and parameters: {'model_type': 'mlp', 'hidden_dims': '[512, 128]', 'dropout': 0.38478373913747277, 'batch_norm': False, 'lr': 2.073460892137056e-05, 'weight_decay': 0.0004359283256572386, 'epochs': 329, 'loss': 'mse', 'optimizer': 'adam', 'graph_mode': 'off', 'use_snp_selection': True, 'num_snps': 54678}. Best is trial 41 with value: 0.3104019414454807.
[I 2025-12-06 05:14:23,339] Trial 49 finished with value: 0.3040784264821993 and parameters: {'model_type': 'mlp', 'hidden_dims': '[256, 128]', 'dropout': 0.12189153758853474, 'batch_norm': False, 'lr': 1.2594280514133557e-05, 'weight_decay': 0.00026435973547413546, 'epochs': 104, 'loss': 'mse', 'optimizer': 'adam', 'graph_mode': 'off', 'use_snp_selection': True, 'num_snps': 50661}. Best is trial 41 with value: 0.3104019414454807.
[I 2025-12-06 05:14:55,201] Trial 50 finished with value: 0.26775307010968435 and parameters: {'model_type': 'mlp', 'hidden_dims': '[128, 64]', 'dropout': 0.24961499816991795, 'batch_norm': False, 'lr': 4.849881547273526e-06, 'weight_decay': 6.049909268734511e-06, 'epochs': 56, 'loss': 'mse', 'optimizer': 'adam', 'graph_mode': 'off', 'use_snp_selection': True, 'num_snps': 34080}. Best is trial 41 with value: 0.3104019414454807.
[I 2025-12-06 05:15:51,407] Trial 51 finished with value: 0.30405143096529275 and parameters: {'model_type': 'mlp', 'hidden_dims': '[512, 256]', 'dropout': 0.20985047640185883, 'batch_norm': False, 'lr': 4.347125022820317e-06, 'weight_decay': 6.776635025451987e-05, 'epochs': 121, 'loss': 'mse', 'optimizer': 'adam', 'graph_mode': 'off', 'use_snp_selection': True, 'num_snps': 56589}. Best is trial 41 with value: 0.3104019414454807.
[I 2025-12-06 05:16:53,117] Trial 52 finished with value: 0.285254019900787 and parameters: {'model_type': 'mlp', 'hidden_dims': '[512, 256]', 'dropout': 0.5921812828280455, 'batch_norm': False, 'lr': 2.3935335297564153e-06, 'weight_decay': 0.00010446421425271383, 'epochs': 141, 'loss': 'mse', 'optimizer': 'adam', 'graph_mode': 'off', 'use_snp_selection': True, 'num_snps': 59621}. Best is trial 41 with value: 0.3104019414454807.
[I 2025-12-06 05:17:45,775] Trial 53 finished with value: 0.29611657758783105 and parameters: {'model_type': 'mlp', 'hidden_dims': '[512, 256]', 'dropout': 0.1895373746840754, 'batch_norm': False, 'lr': 0.00010062818895006419, 'weight_decay': 4.8010257150118645e-05, 'epochs': 95, 'loss': 'mse', 'optimizer': 'adam', 'graph_mode': 'off', 'use_snp_selection': True, 'num_snps': 56669}. Best is trial 41 with value: 0.3104019414454807.
[I 2025-12-06 05:18:45,946] Trial 54 finished with value: 0.3050503591804105 and parameters: {'model_type': 'mlp', 'hidden_dims': '[512, 256]', 'dropout': 0.22447308771240462, 'batch_norm': False, 'lr': 3.511013833911663e-06, 'weight_decay': 2.5043272895314118e-05, 'epochs': 167, 'loss': 'mse', 'optimizer': 'adam', 'graph_mode': 'off', 'use_snp_selection': True, 'num_snps': 51824}. Best is trial 41 with value: 0.3104019414454807.
[I 2025-12-06 05:19:57,903] Trial 55 finished with value: 0.2975614261753983 and parameters: {'model_type': 'mlp', 'hidden_dims': '[512, 256]', 'dropout': 0.16045849132486364, 'batch_norm': False, 'lr': 7.247854793439345e-06, 'weight_decay': 0.0001515024887694177, 'epochs': 216, 'loss': 'mse', 'optimizer': 'adam', 'graph_mode': 'off', 'use_snp_selection': True, 'num_snps': 56861}. Best is trial 41 with value: 0.3104019414454807.
[I 2025-12-06 05:20:57,346] Trial 56 finished with value: 0.30384522638529543 and parameters: {'model_type': 'mlp', 'hidden_dims': '[512, 64]', 'dropout': 0.4135579616427061, 'batch_norm': False, 'lr': 1.3461471497078902e-05, 'weight_decay': 1.7261918034960744e-05, 'epochs': 126, 'loss': 'mse', 'optimizer': 'adam', 'graph_mode': 'off', 'use_snp_selection': True, 'num_snps': 59825}. Best is trial 41 with value: 0.3104019414454807.
[I 2025-12-06 05:21:29,515] Trial 57 finished with value: 0.19822190146147836 and parameters: {'model_type': 'mlp', 'hidden_dims': '[256, 128, 64]', 'dropout': 0.28293001385933436, 'batch_norm': True, 'lr': 2.681369343554063e-06, 'weight_decay': 3.220892657579208e-05, 'epochs': 76, 'loss': 'mse', 'optimizer': 'adam', 'graph_mode': 'off', 'use_snp_selection': True, 'num_snps': 28433}. Best is trial 41 with value: 0.3104019414454807.
[I 2025-12-06 05:21:53,584] Trial 58 finished with value: 0.29221874795834035 and parameters: {'model_type': 'mlp', 'hidden_dims': '[512, 256]', 'dropout': 0.2205925378689887, 'batch_norm': False, 'lr': 5.969293625194998e-06, 'weight_decay': 5.191401929057713e-05, 'epochs': 108, 'loss': 'mae', 'optimizer': 'adam', 'graph_mode': 'off', 'use_snp_selection': False}. Best is trial 41 with value: 0.3104019414454807.
[I 2025-12-06 05:22:40,479] Trial 59 finished with value: 0.3026854103157455 and parameters: {'model_type': 'mlp', 'hidden_dims': '[512, 256]', 'dropout': 0.19222476595497218, 'batch_norm': False, 'lr': 3.930771834045481e-06, 'weight_decay': 0.0002005097665239194, 'epochs': 85, 'loss': 'mse', 'optimizer': 'adam', 'graph_mode': 'off', 'use_snp_selection': True, 'num_snps': 48752}. Best is trial 41 with value: 0.3104019414454807.
[I 2025-12-06 05:23:29,208] Trial 60 finished with value: 0.2777539874416519 and parameters: {'model_type': 'mlp', 'hidden_dims': '[256, 128]', 'dropout': 0.31166322347708275, 'batch_norm': False, 'lr': 1.5020662101321236e-06, 'weight_decay': 0.00012958224783978905, 'epochs': 143, 'loss': 'mse', 'optimizer': 'adam', 'graph_mode': 'off', 'use_snp_selection': True, 'num_snps': 57015}. Best is trial 41 with value: 0.3104019414454807.
[I 2025-12-06 05:24:29,425] Trial 61 finished with value: 0.3063228900119983 and parameters: {'model_type': 'mlp', 'hidden_dims': '[512, 256]', 'dropout': 0.2239909224406531, 'batch_norm': False, 'lr': 3.3596061258105945e-06, 'weight_decay': 2.16653797135918e-05, 'epochs': 165, 'loss': 'mse', 'optimizer': 'adam', 'graph_mode': 'off', 'use_snp_selection': True, 'num_snps': 51851}. Best is trial 41 with value: 0.3104019414454807.
[I 2025-12-06 05:25:34,487] Trial 62 finished with value: 0.30903206066652666 and parameters: {'model_type': 'mlp', 'hidden_dims': '[512, 256]', 'dropout': 0.2554999507156289, 'batch_norm': False, 'lr': 3.0794662405156756e-06, 'weight_decay': 8.572231873395481e-06, 'epochs': 191, 'loss': 'mse', 'optimizer': 'adam', 'graph_mode': 'off', 'use_snp_selection': True, 'num_snps': 53117}. Best is trial 41 with value: 0.3104019414454807.
[I 2025-12-06 05:26:38,969] Trial 63 finished with value: 0.3055042430676559 and parameters: {'model_type': 'mlp', 'hidden_dims': '[512, 256]', 'dropout': 0.25490302981416096, 'batch_norm': False, 'lr': 2.304912287854607e-06, 'weight_decay': 8.256113110894693e-06, 'epochs': 196, 'loss': 'mse', 'optimizer': 'adam', 'graph_mode': 'off', 'use_snp_selection': True, 'num_snps': 51829}. Best is trial 41 with value: 0.3104019414454807.
[I 2025-12-06 05:27:37,476] Trial 64 finished with value: 0.2996377978829215 and parameters: {'model_type': 'mlp', 'hidden_dims': '[512, 256]', 'dropout': 0.27137088879217625, 'batch_norm': False, 'lr': 7.923109765050295e-06, 'weight_decay': 3.42746989714934e-06, 'epochs': 186, 'loss': 'mse', 'optimizer': 'adam', 'graph_mode': 'off', 'use_snp_selection': True, 'num_snps': 46287}. Best is trial 41 with value: 0.3104019414454807.
[I 2025-12-06 05:28:47,846] Trial 65 finished with value: 0.30241118147539353 and parameters: {'model_type': 'mlp', 'hidden_dims': '[512, 256]', 'dropout': 0.23826507828285998, 'batch_norm': False, 'lr': 3.183822589462458e-06, 'weight_decay': 1.0302863575027963e-06, 'epochs': 253, 'loss': 'mse', 'optimizer': 'adam', 'graph_mode': 'off', 'use_snp_selection': True, 'num_snps': 49466}. Best is trial 41 with value: 0.3104019414454807.
[I 2025-12-06 05:29:30,676] Trial 66 finished with value: 0.3041877747798412 and parameters: {'model_type': 'mlp', 'hidden_dims': '[512, 256]', 'dropout': 0.28949255182799516, 'batch_norm': False, 'lr': 1.992714294475118e-06, 'weight_decay': 1.2589780865494108e-05, 'epochs': 208, 'loss': 'mse', 'optimizer': 'adam', 'graph_mode': 'off', 'use_snp_selection': False}. Best is trial 41 with value: 0.3104019414454807.
[I 2025-12-06 05:30:31,736] Trial 67 finished with value: 0.30488803119903063 and parameters: {'model_type': 'mlp', 'hidden_dims': '[512, 256]', 'dropout': 0.22511563961579786, 'batch_norm': False, 'lr': 5.309986266069811e-06, 'weight_decay': 1.9137884055280932e-05, 'epochs': 160, 'loss': 'mse', 'optimizer': 'adam', 'graph_mode': 'off', 'use_snp_selection': True, 'num_snps': 53899}. Best is trial 41 with value: 0.3104019414454807.
[I 2025-12-06 05:31:14,309] Trial 68 finished with value: 0.21728032424499383 and parameters: {'model_type': 'mlp', 'hidden_dims': '[128, 64]', 'dropout': 0.2575623780577376, 'batch_norm': False, 'lr': 0.0009791654904104615, 'weight_decay': 1.8476270700468697e-07, 'epochs': 168, 'loss': 'mse', 'optimizer': 'adam', 'graph_mode': 'off', 'use_snp_selection': True, 'num_snps': 52725}. Best is trial 41 with value: 0.3104019414454807.
[I 2025-12-06 05:32:20,357] Trial 69 finished with value: 0.3028223782813949 and parameters: {'model_type': 'mlp', 'hidden_dims': '[512, 256]', 'dropout': 0.316100957703944, 'batch_norm': False, 'lr': 1.1496602727404742e-05, 'weight_decay': 3.758914704142106e-06, 'epochs': 179, 'loss': 'mse', 'optimizer': 'adam', 'graph_mode': 'off', 'use_snp_selection': True, 'num_snps': 57014}. Best is trial 41 with value: 0.3104019414454807.
[I 2025-12-06 05:33:16,186] Trial 70 finished with value: 0.272587924915377 and parameters: {'model_type': 'mlp', 'hidden_dims': '[512, 128]', 'dropout': 0.1974406420948812, 'batch_norm': False, 'lr': 1.3071333504189802e-06, 'weight_decay': 8.495766108617916e-06, 'epochs': 151, 'loss': 'mae', 'optimizer': 'adam', 'graph_mode': 'off', 'use_snp_selection': True, 'num_snps': 48892}. Best is trial 41 with value: 0.3104019414454807.
[I 2025-12-06 05:34:12,825] Trial 71 finished with value: 0.3024543260757097 and parameters: {'model_type': 'mlp', 'hidden_dims': '[512, 256]', 'dropout': 0.2117052845347372, 'batch_norm': False, 'lr': 3.9312935035473135e-06, 'weight_decay': 7.181826448843279e-05, 'epochs': 116, 'loss': 'mse', 'optimizer': 'adam', 'graph_mode': 'off', 'use_snp_selection': True, 'num_snps': 58080}. Best is trial 41 with value: 0.3104019414454807.
[I 2025-12-06 05:35:35,083] Trial 72 finished with value: 0.2969228969249258 and parameters: {'model_type': 'mlp', 'hidden_dims': '[512, 256]', 'dropout': 0.24153085062889562, 'batch_norm': False, 'lr': 4.550634447490569e-06, 'weight_decay': 8.406995878930824e-05, 'epochs': 288, 'loss': 'mse', 'optimizer': 'adam', 'graph_mode': 'off', 'use_snp_selection': True, 'num_snps': 55523}. Best is trial 41 with value: 0.3104019414454807.
[I 2025-12-06 05:36:35,519] Trial 73 finished with value: 0.30843315533075755 and parameters: {'model_type': 'mlp', 'hidden_dims': '[512, 256]', 'dropout': 0.18363782212741045, 'batch_norm': False, 'lr': 3.2282480223162344e-06, 'weight_decay': 4.454720080635209e-05, 'epochs': 136, 'loss': 'mse', 'optimizer': 'adam', 'graph_mode': 'off', 'use_snp_selection': True, 'num_snps': 58591}. Best is trial 41 with value: 0.3104019414454807.
[I 2025-12-06 05:37:31,287] Trial 74 finished with value: 0.30611233171242375 and parameters: {'model_type': 'mlp', 'hidden_dims': '[512, 256]', 'dropout': 0.15729253323206166, 'batch_norm': False, 'lr': 2.9986776907071886e-06, 'weight_decay': 2.699404312872382e-05, 'epochs': 132, 'loss': 'mse', 'optimizer': 'adam', 'graph_mode': 'off', 'use_snp_selection': True, 'num_snps': 52775}. Best is trial 41 with value: 0.3104019414454807.
[I 2025-12-06 05:38:15,360] Trial 75 finished with value: 0.2838230577144317 and parameters: {'model_type': 'mlp', 'hidden_dims': '[256, 128, 64]', 'dropout': 0.17778943226481853, 'batch_norm': False, 'lr': 0.0006719931804292528, 'weight_decay': 4.169480560883183e-05, 'epochs': 173, 'loss': 'mse', 'optimizer': 'adam', 'graph_mode': 'off', 'use_snp_selection': True, 'num_snps': 44020}. Best is trial 41 with value: 0.3104019414454807.
[I 2025-12-06 05:39:24,651] Trial 76 finished with value: 0.28873725380771004 and parameters: {'model_type': 'mlp', 'hidden_dims': '[512, 256]', 'dropout': 0.2714085437581659, 'batch_norm': True, 'lr': 6.861184102649892e-06, 'weight_decay': 4.9387871131007844e-05, 'epochs': 193, 'loss': 'mse', 'optimizer': 'adam', 'graph_mode': 'off', 'use_snp_selection': True, 'num_snps': 58134}. Best is trial 41 with value: 0.3104019414454807.
[I 2025-12-06 05:39:46,164] Trial 77 finished with value: 0.2885525614455341 and parameters: {'model_type': 'mlp', 'hidden_dims': '[512, 256]', 'dropout': 0.12705468167659686, 'batch_norm': False, 'lr': 1.6812087837634605e-06, 'weight_decay': 2.177194319286572e-05, 'epochs': 93, 'loss': 'mse', 'optimizer': 'adam', 'graph_mode': 'off', 'use_snp_selection': False}. Best is trial 41 with value: 0.3104019414454807.
[I 2025-12-06 05:40:46,959] Trial 78 finished with value: 0.30109007602552174 and parameters: {'model_type': 'mlp', 'hidden_dims': '[512, 64]', 'dropout': 0.1337619546001544, 'batch_norm': False, 'lr': 3.4598278704832437e-06, 'weight_decay': 3.1311577861302766e-05, 'epochs': 163, 'loss': 'mse', 'optimizer': 'adam', 'graph_mode': 'off', 'use_snp_selection': True, 'num_snps': 53544}. Best is trial 41 with value: 0.3104019414454807.
[I 2025-12-06 05:41:42,695] Trial 79 finished with value: 0.3010423459268955 and parameters: {'model_type': 'mlp', 'hidden_dims': '[512, 256]', 'dropout': 0.18315839041284948, 'batch_norm': False, 'lr': 2.1833433516221975e-06, 'weight_decay': 1.4632080355953914e-05, 'epochs': 142, 'loss': 'mse', 'optimizer': 'adam', 'graph_mode': 'off', 'use_snp_selection': True, 'num_snps': 50341}. Best is trial 41 with value: 0.3104019414454807.
[I 2025-12-06 05:42:32,116] Trial 80 finished with value: 0.29898894160596273 and parameters: {'model_type': 'mlp', 'hidden_dims': '[256, 128]', 'dropout': 0.22240005330288684, 'batch_norm': False, 'lr': 8.628147428986526e-06, 'weight_decay': 1.0331262747220131e-05, 'epochs': 152, 'loss': 'mae', 'optimizer': 'adam', 'graph_mode': 'off', 'use_snp_selection': True, 'num_snps': 55460}. Best is trial 41 with value: 0.3104019414454807.
[I 2025-12-06 05:43:27,842] Trial 81 finished with value: 0.3032949203966007 and parameters: {'model_type': 'mlp', 'hidden_dims': '[512, 256]', 'dropout': 0.10365041511896195, 'batch_norm': False, 'lr': 2.6559324671147734e-06, 'weight_decay': 3.321515073661386e-05, 'epochs': 131, 'loss': 'mse', 'optimizer': 'adam', 'graph_mode': 'off', 'use_snp_selection': True, 'num_snps': 52559}. Best is trial 41 with value: 0.3104019414454807.
[I 2025-12-06 05:44:27,969] Trial 82 finished with value: 0.3017693386404279 and parameters: {'model_type': 'mlp', 'hidden_dims': '[512, 256]', 'dropout': 0.15910222093275528, 'batch_norm': False, 'lr': 2.8278954507695615e-06, 'weight_decay': 2.6248027786403458e-05, 'epochs': 136, 'loss': 'mse', 'optimizer': 'adam', 'graph_mode': 'off', 'use_snp_selection': True, 'num_snps': 58338}. Best is trial 41 with value: 0.3104019414454807.
[I 2025-12-06 05:45:22,664] Trial 83 finished with value: 0.30743572226718807 and parameters: {'model_type': 'mlp', 'hidden_dims': '[512, 256]', 'dropout': 0.16801027069719768, 'batch_norm': False, 'lr': 5.994448431539204e-06, 'weight_decay': 1.9234636181068982e-05, 'epochs': 111, 'loss': 'mse', 'optimizer': 'adam', 'graph_mode': 'off', 'use_snp_selection': True, 'num_snps': 55684}. Best is trial 41 with value: 0.3104019414454807.
[I 2025-12-06 05:46:16,526] Trial 84 finished with value: 0.30635377501707356 and parameters: {'model_type': 'mlp', 'hidden_dims': '[512, 256]', 'dropout': 0.14180548926781472, 'batch_norm': False, 'lr': 5.388795150884591e-06, 'weight_decay': 1.9095297490066516e-05, 'epochs': 109, 'loss': 'mse', 'optimizer': 'adam', 'graph_mode': 'off', 'use_snp_selection': True, 'num_snps': 55267}. Best is trial 41 with value: 0.3104019414454807.
[I 2025-12-06 05:47:07,999] Trial 85 finished with value: 0.30705066213733506 and parameters: {'model_type': 'mlp', 'hidden_dims': '[512, 256]', 'dropout': 0.1465733616010504, 'batch_norm': False, 'lr': 6.455123989211822e-06, 'weight_decay': 1.3107741077800813e-05, 'epochs': 93, 'loss': 'mse', 'optimizer': 'adam', 'graph_mode': 'off', 'use_snp_selection': True, 'num_snps': 55685}. Best is trial 41 with value: 0.3104019414454807.
[I 2025-12-06 05:47:57,509] Trial 86 finished with value: 0.3054277214669309 and parameters: {'model_type': 'mlp', 'hidden_dims': '[512, 256]', 'dropout': 0.14636279600344698, 'batch_norm': False, 'lr': 6.270880204835571e-06, 'weight_decay': 5.155305510734618e-06, 'epochs': 68, 'loss': 'mse', 'optimizer': 'adam', 'graph_mode': 'off', 'use_snp_selection': True, 'num_snps': 59901}. Best is trial 41 with value: 0.3104019414454807.
[I 2025-12-06 05:48:50,958] Trial 87 finished with value: 0.30061228453394734 and parameters: {'model_type': 'mlp', 'hidden_dims': '[512, 256]', 'dropout': 0.13877185135228257, 'batch_norm': False, 'lr': 1.4875690026016447e-05, 'weight_decay': 0.0009666781010672631, 'epochs': 106, 'loss': 'mse', 'optimizer': 'adam', 'graph_mode': 'off', 'use_snp_selection': True, 'num_snps': 55847}. Best is trial 41 with value: 0.3104019414454807.
