[I 2025-12-05 14:23:00,345] Trial 52 finished with value: 0.12492415618772032 and parameters: {'model_type': 'mlp', 'hidden_dims': '[512, 64]', 'dropout': 0.10877636304005844, 'batch_norm': True, 'lr': 0.0003281792615076454, 'weight_decay': 0.0008041947097834535, 'epochs': 184, 'loss': 'mse', 'optimizer': 'adam', 'graph_mode': 'off', 'use_snp_selection': False}. Best is trial 52 with value: 0.12492415618772032.
[I 2025-12-05 14:23:01,641] Trial 53 finished with value: 0.11755337369596762 and parameters: {'model_type': 'mlp', 'hidden_dims': '[512, 64]', 'dropout': 0.10030218365875615, 'batch_norm': True, 'lr': 0.0005525702176822987, 'weight_decay': 0.000900094895689112, 'epochs': 169, 'loss': 'mse', 'optimizer': 'adam', 'graph_mode': 'off', 'use_snp_selection': False}. Best is trial 52 with value: 0.12492415618772032.
[I 2025-12-05 14:23:03,168] Trial 54 finished with value: 0.11822459146829702 and parameters: {'model_type': 'mlp', 'hidden_dims': '[512, 64]', 'dropout': 0.14138894744826794, 'batch_norm': True, 'lr': 0.00017094057985229846, 'weight_decay': 1.9534481315534327e-06, 'epochs': 236, 'loss': 'mse', 'optimizer': 'adam', 'graph_mode': 'off', 'use_snp_selection': False}. Best is trial 52 with value: 0.12492415618772032.
[I 2025-12-05 14:23:03,962] Trial 55 finished with value: 0.12176265729137979 and parameters: {'model_type': 'mlp', 'hidden_dims': '[256, 128]', 'dropout': 0.16480144164746258, 'batch_norm': True, 'lr': 0.00029540504230943, 'weight_decay': 0.0001949275420220085, 'epochs': 54, 'loss': 'mse', 'optimizer': 'adam', 'graph_mode': 'off', 'use_snp_selection': False}. Best is trial 52 with value: 0.12492415618772032.
[I 2025-12-05 14:23:04,769] Trial 56 finished with value: 0.1079425786399773 and parameters: {'model_type': 'mlp', 'hidden_dims': '[256, 128]', 'dropout': 0.12317522476467502, 'batch_norm': True, 'lr': 0.0002840291780595457, 'weight_decay': 0.00019705881923361108, 'epochs': 62, 'loss': 'mse', 'optimizer': 'adam', 'graph_mode': 'off', 'use_snp_selection': False}. Best is trial 52 with value: 0.12492415618772032.
[I 2025-12-05 14:23:05,575] Trial 57 finished with value: 0.11053815659791744 and parameters: {'model_type': 'mlp', 'hidden_dims': '[256, 128]', 'dropout': 0.16375205763462328, 'batch_norm': True, 'lr': 0.0007403612802623268, 'weight_decay': 0.00037970732897337915, 'epochs': 51, 'loss': 'mse', 'optimizer': 'adam', 'graph_mode': 'off', 'use_snp_selection': False}. Best is trial 52 with value: 0.12492415618772032.
[I 2025-12-05 14:23:06,390] Trial 58 finished with value: 0.07473318631371645 and parameters: {'model_type': 'mlp', 'hidden_dims': '[256, 128]', 'dropout': 0.20660483606825308, 'batch_norm': False, 'lr': 0.00020895277216339742, 'weight_decay': 0.00015793823013145699, 'epochs': 68, 'loss': 'mse', 'optimizer': 'adam', 'graph_mode': 'off', 'use_snp_selection': False}. Best is trial 52 with value: 0.12492415618772032.
[I 2025-12-05 14:23:07,267] Trial 59 finished with value: 0.10722737627091063 and parameters: {'model_type': 'mlp', 'hidden_dims': '[256, 128]', 'dropout': 0.42541663018825737, 'batch_norm': True, 'lr': 0.0005055429906058494, 'weight_decay': 9.381104148505614e-05, 'epochs': 100, 'loss': 'mae', 'optimizer': 'adam', 'graph_mode': 'off', 'use_snp_selection': False}. Best is trial 52 with value: 0.12492415618772032.
[I 2025-12-05 14:23:08,215] Trial 60 finished with value: 0.0937920058868602 and parameters: {'model_type': 'mlp', 'hidden_dims': '[512, 128]', 'dropout': 0.1864495200414093, 'batch_norm': True, 'lr': 0.0003481511320264914, 'weight_decay': 0.000707819807263972, 'epochs': 41, 'loss': 'mse', 'optimizer': 'adam', 'graph_mode': 'off', 'use_snp_selection': False}. Best is trial 52 with value: 0.12492415618772032.
[I 2025-12-05 14:23:09,597] Trial 61 finished with value: 0.10575160260784246 and parameters: {'model_type': 'mlp', 'hidden_dims': '[512, 64]', 'dropout': 0.1434153431843101, 'batch_norm': True, 'lr': 5.2101454175396925e-05, 'weight_decay': 0.0009625453657357731, 'epochs': 182, 'loss': 'mse', 'optimizer': 'adam', 'graph_mode': 'off', 'use_snp_selection': False}. Best is trial 52 with value: 0.12492415618772032.
[I 2025-12-05 14:23:10,843] Trial 62 finished with value: 0.10318987113725331 and parameters: {'model_type': 'mlp', 'hidden_dims': '[512, 64]', 'dropout': 0.11881959231410712, 'batch_norm': True, 'lr': 0.0007292482220530076, 'weight_decay': 0.0002940476859936123, 'epochs': 138, 'loss': 'mse', 'optimizer': 'adam', 'graph_mode': 'off', 'use_snp_selection': False}. Best is trial 52 with value: 0.12492415618772032.
[I 2025-12-05 14:23:12,294] Trial 63 finished with value: 0.12451466080981663 and parameters: {'model_type': 'mlp', 'hidden_dims': '[512, 64]', 'dropout': 0.1599659373340106, 'batch_norm': True, 'lr': 0.00047572218022652997, 'weight_decay': 7.46758870417398e-07, 'epochs': 212, 'loss': 'mse', 'optimizer': 'adam', 'graph_mode': 'off', 'use_snp_selection': False}. Best is trial 52 with value: 0.12492415618772032.
[I 2025-12-05 14:23:13,442] Trial 64 finished with value: 0.12025156046287183 and parameters: {'model_type': 'mlp', 'hidden_dims': '[256, 128, 64]', 'dropout': 0.1598425263117555, 'batch_norm': True, 'lr': 0.0004945416023769011, 'weight_decay': 4.740425631575548e-05, 'epochs': 241, 'loss': 'mse', 'optimizer': 'adam', 'graph_mode': 'off', 'use_snp_selection': False}. Best is trial 52 with value: 0.12492415618772032.
[I 2025-12-05 14:23:14,954] Trial 65 finished with value: 0.11123810775273094 and parameters: {'model_type': 'mlp', 'hidden_dims': '[512, 64]', 'dropout': 0.13605182005191138, 'batch_norm': True, 'lr': 0.0006380238507177186, 'weight_decay': 9.332226421205864e-05, 'epochs': 219, 'loss': 'mse', 'optimizer': 'adam', 'graph_mode': 'off', 'use_snp_selection': False}. Best is trial 52 with value: 0.12492415618772032.
[I 2025-12-05 14:23:16,309] Trial 66 finished with value: 0.103875468599394 and parameters: {'model_type': 'mlp', 'hidden_dims': '[512, 256]', 'dropout': 0.2629798816008565, 'batch_norm': True, 'lr': 0.0002728485972375613, 'weight_decay': 0.0003201312867685192, 'epochs': 52, 'loss': 'mse', 'optimizer': 'adam', 'graph_mode': 'off', 'use_snp_selection': True, 'num_snps': 22881}. Best is trial 52 with value: 0.12492415618772032.
[I 2025-12-05 14:23:17,357] Trial 67 finished with value: 0.12565357021701706 and parameters: {'model_type': 'mlp', 'hidden_dims': '[512, 64]', 'dropout': 0.2283220086106858, 'batch_norm': True, 'lr': 0.0004047343285329748, 'weight_decay': 2.112532858131444e-07, 'epochs': 68, 'loss': 'mse', 'optimizer': 'adam', 'graph_mode': 'off', 'use_snp_selection': False}. Best is trial 67 with value: 0.12565357021701706.
[I 2025-12-05 14:23:18,411] Trial 68 finished with value: 0.10583049329049797 and parameters: {'model_type': 'mlp', 'hidden_dims': '[512, 64]', 'dropout': 0.2259181839444391, 'batch_norm': True, 'lr': 0.00017939802123481463, 'weight_decay': 1.6789315966770154e-07, 'epochs': 87, 'loss': 'mse', 'optimizer': 'adam', 'graph_mode': 'off', 'use_snp_selection': False}. Best is trial 67 with value: 0.12565357021701706.
[I 2025-12-05 14:23:19,589] Trial 69 finished with value: 0.1118115219590334 and parameters: {'model_type': 'mlp', 'hidden_dims': '[256, 128]', 'dropout': 0.19880818147317897, 'batch_norm': True, 'lr': 0.00039357796853977707, 'weight_decay': 6.89143988175118e-07, 'epochs': 297, 'loss': 'mse', 'optimizer': 'adam', 'graph_mode': 'off', 'use_snp_selection': False}. Best is trial 67 with value: 0.12565357021701706.
[I 2025-12-05 14:23:21,084] Trial 70 finished with value: 0.0690038869236143 and parameters: {'model_type': 'mlp', 'hidden_dims': '[512, 64]', 'dropout': 0.16931783189397182, 'batch_norm': False, 'lr': 0.0001245375189373413, 'weight_decay': 2.8340206651693864e-07, 'epochs': 226, 'loss': 'mse', 'optimizer': 'adam', 'graph_mode': 'off', 'use_snp_selection': False}. Best is trial 67 with value: 0.12565357021701706.
[I 2025-12-05 14:23:22,199] Trial 71 finished with value: 0.11521332866441093 and parameters: {'model_type': 'mlp', 'hidden_dims': '[512, 64]', 'dropout': 0.1127202343741201, 'batch_norm': True, 'lr': 0.0008121223566372562, 'weight_decay': 1.9877813508789306e-07, 'epochs': 68, 'loss': 'mse', 'optimizer': 'adam', 'graph_mode': 'off', 'use_snp_selection': False}. Best is trial 67 with value: 0.12565357021701706.
[I 2025-12-05 14:23:23,189] Trial 72 finished with value: 0.1094675909672093 and parameters: {'model_type': 'mlp', 'hidden_dims': '[512, 64]', 'dropout': 0.1477728884836897, 'batch_norm': True, 'lr': 0.00047939325677098316, 'weight_decay': 5.528387614332506e-07, 'epochs': 49, 'loss': 'mse', 'optimizer': 'adam', 'graph_mode': 'off', 'use_snp_selection': False}. Best is trial 67 with value: 0.12565357021701706.
[I 2025-12-05 14:23:24,273] Trial 73 finished with value: 0.1162663395616131 and parameters: {'model_type': 'mlp', 'hidden_dims': '[512, 64]', 'dropout': 0.13205983698460563, 'batch_norm': True, 'lr': 0.00026127918567036526, 'weight_decay': 1.051947756184111e-06, 'epochs': 74, 'loss': 'mse', 'optimizer': 'adam', 'graph_mode': 'off', 'use_snp_selection': False}. Best is trial 67 with value: 0.12565357021701706.
[I 2025-12-05 14:23:25,441] Trial 74 finished with value: 0.1073422846387724 and parameters: {'model_type': 'mlp', 'hidden_dims': '[512, 64]', 'dropout': 0.11269523336474768, 'batch_norm': True, 'lr': 0.00034763816828877543, 'weight_decay': 1.384092423292952e-07, 'epochs': 57, 'loss': 'mae', 'optimizer': 'adam', 'graph_mode': 'off', 'use_snp_selection': False}. Best is trial 67 with value: 0.12565357021701706.
[I 2025-12-05 14:23:26,695] Trial 75 finished with value: 0.10941935526472496 and parameters: {'model_type': 'mlp', 'hidden_dims': '[512, 64]', 'dropout': 0.1821631149764011, 'batch_norm': True, 'lr': 0.000635251404899085, 'weight_decay': 0.0006584546096286449, 'epochs': 161, 'loss': 'mse', 'optimizer': 'adam', 'graph_mode': 'off', 'use_snp_selection': False}. Best is trial 67 with value: 0.12565357021701706.
[I 2025-12-05 14:23:27,576] Trial 76 finished with value: 0.1121997135696477 and parameters: {'model_type': 'mlp', 'hidden_dims': '[512, 128]', 'dropout': 0.10101050108609225, 'batch_norm': True, 'lr': 0.0008861257898445805, 'weight_decay': 2.570252347037463e-06, 'epochs': 40, 'loss': 'mse', 'optimizer': 'adam', 'graph_mode': 'off', 'use_snp_selection': False}. Best is trial 67 with value: 0.12565357021701706.
[I 2025-12-05 14:23:28,567] Trial 77 finished with value: 0.1183584227730412 and parameters: {'model_type': 'mlp', 'hidden_dims': '[512, 256]', 'dropout': 0.1535525483263852, 'batch_norm': True, 'lr': 0.00041834963468586716, 'weight_decay': 3.791453459811174e-07, 'epochs': 82, 'loss': 'mse', 'optimizer': 'adam', 'graph_mode': 'off', 'use_snp_selection': False}. Best is trial 67 with value: 0.12565357021701706.
[I 2025-12-05 14:23:29,247] Trial 78 finished with value: -0.029563632397305403 and parameters: {'model_type': 'mlp', 'hidden_dims': '[512, 64]', 'dropout': 0.12800278279584607, 'batch_norm': True, 'lr': 1.0087771566710253e-06, 'weight_decay': 1.0123802935102727e-07, 'epochs': 94, 'loss': 'mse', 'optimizer': 'adam', 'graph_mode': 'off', 'use_snp_selection': True, 'num_snps': 2246}. Best is trial 67 with value: 0.12565357021701706.
[I 2025-12-05 14:23:30,197] Trial 79 finished with value: 0.10463452133245363 and parameters: {'model_type': 'mlp', 'hidden_dims': '[512, 64]', 'dropout': 0.29142808752415655, 'batch_norm': True, 'lr': 0.0005765977136915235, 'weight_decay': 5.3399047732248446e-05, 'epochs': 63, 'loss': 'mse', 'optimizer': 'adam', 'graph_mode': 'off', 'use_snp_selection': False}. Best is trial 67 with value: 0.12565357021701706.
[I 2025-12-05 14:23:31,045] Trial 80 finished with value: 0.09796296803565685 and parameters: {'model_type': 'mlp', 'hidden_dims': '[256, 128, 64]', 'dropout': 0.16792017027537492, 'batch_norm': True, 'lr': 0.0007249251733012944, 'weight_decay': 0.0001537419345709083, 'epochs': 122, 'loss': 'mae', 'optimizer': 'adam', 'graph_mode': 'off', 'use_snp_selection': False}. Best is trial 67 with value: 0.12565357021701706.
[I 2025-12-05 14:23:32,102] Trial 81 finished with value: 0.11549750542983861 and parameters: {'model_type': 'mlp', 'hidden_dims': '[256, 128, 64]', 'dropout': 0.1596070851275197, 'batch_norm': True, 'lr': 0.00045895116904676365, 'weight_decay': 1.593638699689558e-05, 'epochs': 249, 'loss': 'mse', 'optimizer': 'adam', 'graph_mode': 'off', 'use_snp_selection': False}. Best is trial 67 with value: 0.12565357021701706.
[I 2025-12-05 14:23:33,207] Trial 82 finished with value: 0.12582633453201478 and parameters: {'model_type': 'mlp', 'hidden_dims': '[256, 128, 64]', 'dropout': 0.13700752560601548, 'batch_norm': True, 'lr': 0.0004968615535218473, 'weight_decay': 4.607866662360892e-05, 'epochs': 253, 'loss': 'mse', 'optimizer': 'adam', 'graph_mode': 'off', 'use_snp_selection': False}. Best is trial 82 with value: 0.12582633453201478.
[I 2025-12-05 14:23:34,305] Trial 83 finished with value: 0.11500691351034568 and parameters: {'model_type': 'mlp', 'hidden_dims': '[256, 128, 64]', 'dropout': 0.11507298938860541, 'batch_norm': True, 'lr': 0.0003104849256830494, 'weight_decay': 3.920778803995636e-05, 'epochs': 257, 'loss': 'mse', 'optimizer': 'adam', 'graph_mode': 'off', 'use_snp_selection': False}. Best is trial 82 with value: 0.12582633453201478.
[I 2025-12-05 14:23:35,393] Trial 84 finished with value: 0.11684272119422813 and parameters: {'model_type': 'mlp', 'hidden_dims': '[256, 128, 64]', 'dropout': 0.14080835194577157, 'batch_norm': True, 'lr': 0.0005445112643087795, 'weight_decay': 7.797301673562664e-05, 'epochs': 272, 'loss': 'mse', 'optimizer': 'adam', 'graph_mode': 'off', 'use_snp_selection': False}. Best is trial 82 with value: 0.12582633453201478.
[I 2025-12-05 14:23:37,019] Trial 85 finished with value: 0.11678571898382027 and parameters: {'model_type': 'mlp', 'hidden_dims': '[512, 64]', 'dropout': 0.3777026233804489, 'batch_norm': True, 'lr': 0.00023141443756824587, 'weight_decay': 0.0002372133408780914, 'epochs': 292, 'loss': 'mse', 'optimizer': 'adam', 'graph_mode': 'off', 'use_snp_selection': False}. Best is trial 82 with value: 0.12582633453201478.
[I 2025-12-05 14:23:37,673] Trial 86 finished with value: -0.0416643349577551 and parameters: {'model_type': 'mlp', 'hidden_dims': '[256, 128]', 'dropout': 0.12894565371065841, 'batch_norm': False, 'lr': 0.0009354694579563547, 'weight_decay': 7.465179170746615e-06, 'epochs': 50, 'loss': 'mse', 'optimizer': 'adam', 'graph_mode': 'off', 'use_snp_selection': False}. Best is trial 82 with value: 0.12582633453201478.
[I 2025-12-05 14:23:38,606] Trial 87 finished with value: 0.11947839060149941 and parameters: {'model_type': 'mlp', 'hidden_dims': '[512, 64]', 'dropout': 0.2468081868664666, 'batch_norm': True, 'lr': 0.0007261406575584649, 'weight_decay': 2.441918612461745e-05, 'epochs': 73, 'loss': 'mse', 'optimizer': 'adam', 'graph_mode': 'off', 'use_snp_selection': False}. Best is trial 82 with value: 0.12582633453201478.
[I 2025-12-05 14:23:39,930] Trial 88 finished with value: 0.1233234709731667 and parameters: {'model_type': 'mlp', 'hidden_dims': '[512, 64]', 'dropout': 0.4676913230675005, 'batch_norm': True, 'lr': 0.00035284978879508293, 'weight_decay': 1.381554250550447e-05, 'epochs': 201, 'loss': 'mse', 'optimizer': 'adam', 'graph_mode': 'off', 'use_snp_selection': False}. Best is trial 82 with value: 0.12582633453201478.
[I 2025-12-05 14:23:42,101] Trial 89 finished with value: 0.10517270711979904 and parameters: {'model_type': 'mlp', 'hidden_dims': '[256, 128, 64]', 'dropout': 0.4673764063785454, 'batch_norm': True, 'lr': 0.0002048887281979968, 'weight_decay': 3.215391720462416e-06, 'epochs': 200, 'loss': 'mse', 'optimizer': 'adam', 'graph_mode': 'off', 'use_snp_selection': True, 'num_snps': 45058}. Best is trial 82 with value: 0.12582633453201478.
[I 2025-12-05 14:23:43,482] Trial 90 finished with value: 0.10542140326120435 and parameters: {'model_type': 'mlp', 'hidden_dims': '[512, 64]', 'dropout': 0.5180914298926754, 'batch_norm': True, 'lr': 0.00014528309542497455, 'weight_decay': 1.27994955346089e-05, 'epochs': 212, 'loss': 'mse', 'optimizer': 'adam', 'graph_mode': 'off', 'use_snp_selection': False}. Best is trial 82 with value: 0.12582633453201478.
[I 2025-12-05 14:23:44,786] Trial 91 finished with value: 0.11442522344673892 and parameters: {'model_type': 'mlp', 'hidden_dims': '[512, 64]', 'dropout': 0.5747578352539385, 'batch_norm': True, 'lr': 0.00037192781349655054, 'weight_decay': 5.945619134190977e-05, 'epochs': 189, 'loss': 'mse', 'optimizer': 'adam', 'graph_mode': 'off', 'use_snp_selection': False}. Best is trial 82 with value: 0.12582633453201478.
[I 2025-12-05 14:23:46,196] Trial 92 finished with value: 0.10677224853094766 and parameters: {'model_type': 'mlp', 'hidden_dims': '[512, 64]', 'dropout': 0.33029785791449556, 'batch_norm': True, 'lr': 0.0003272953240812437, 'weight_decay': 2.8186586524733977e-05, 'epochs': 228, 'loss': 'mse', 'optimizer': 'adam', 'graph_mode': 'off', 'use_snp_selection': False}. Best is trial 82 with value: 0.12582633453201478.
[I 2025-12-05 14:23:47,274] Trial 93 finished with value: 0.1149475558358853 and parameters: {'model_type': 'mlp', 'hidden_dims': '[512, 64]', 'dropout': 0.11068663511063516, 'batch_norm': True, 'lr': 0.0005535332242804119, 'weight_decay': 0.00010990950992307538, 'epochs': 111, 'loss': 'mse', 'optimizer': 'adam', 'graph_mode': 'off', 'use_snp_selection': False}. Best is trial 82 with value: 0.12582633453201478.
[I 2025-12-05 14:23:48,651] Trial 94 finished with value: 0.09425938418623847 and parameters: {'model_type': 'mlp', 'hidden_dims': '[512, 64]', 'dropout': 0.5117616994530163, 'batch_norm': True, 'lr': 0.000855563328365746, 'weight_decay': 2.0785426799525082e-05, 'epochs': 209, 'loss': 'mse', 'optimizer': 'adam', 'graph_mode': 'off', 'use_snp_selection': False}. Best is trial 82 with value: 0.12582633453201478.
[I 2025-12-05 14:23:49,831] Trial 95 finished with value: 0.10536238795390569 and parameters: {'model_type': 'mlp', 'hidden_dims': '[512, 64]', 'dropout': 0.4003276533705147, 'batch_norm': True, 'lr': 0.00044415279234180595, 'weight_decay': 7.726556369044305e-07, 'epochs': 144, 'loss': 'mse', 'optimizer': 'adam', 'graph_mode': 'off', 'use_snp_selection': False}. Best is trial 82 with value: 0.12582633453201478.
[I 2025-12-05 14:23:50,754] Trial 96 finished with value: 0.11833230273672012 and parameters: {'model_type': 'mlp', 'hidden_dims': '[256, 128]', 'dropout': 0.14380736116334858, 'batch_norm': True, 'lr': 0.0002529225862959171, 'weight_decay': 3.6998441318962725e-05, 'epochs': 182, 'loss': 'mse', 'optimizer': 'adam', 'graph_mode': 'off', 'use_snp_selection': False}. Best is trial 82 with value: 0.12582633453201478.
[I 2025-12-05 14:23:51,640] Trial 97 finished with value: 0.12803634756483995 and parameters: {'model_type': 'mlp', 'hidden_dims': '[512, 64]', 'dropout': 0.45895843296340366, 'batch_norm': True, 'lr': 0.0006578393829899539, 'weight_decay': 4.898922536324515e-06, 'epochs': 46, 'loss': 'mse', 'optimizer': 'adam', 'graph_mode': 'off', 'use_snp_selection': False}. Best is trial 97 with value: 0.12803634756483995.
[I 2025-12-05 14:23:52,503] Trial 98 finished with value: 0.11703918552049804 and parameters: {'model_type': 'mlp', 'hidden_dims': '[512, 128]', 'dropout': 0.45314466308126394, 'batch_norm': True, 'lr': 0.0006707142507370225, 'weight_decay': 6.3339880105854185e-06, 'epochs': 47, 'loss': 'mse', 'optimizer': 'adam', 'graph_mode': 'off', 'use_snp_selection': False}. Best is trial 97 with value: 0.12803634756483995.
[I 2025-12-05 14:23:54,198] Trial 99 finished with value: 0.06030201749731937 and parameters: {'model_type': 'mlp', 'hidden_dims': '[512, 256]', 'dropout': 0.44090354902525974, 'batch_norm': False, 'lr': 0.00042834487515378553, 'weight_decay': 4.884124860768428e-06, 'epochs': 321, 'loss': 'mae', 'optimizer': 'adam', 'graph_mode': 'off', 'use_snp_selection': False}. Best is trial 97 with value: 0.12803634756483995.
[I 2025-12-05 14:23:55,116] Trial 100 finished with value: 0.09000177814538587 and parameters: {'model_type': 'mlp', 'hidden_dims': '[512, 64]', 'dropout': 0.48210939053920493, 'batch_norm': True, 'lr': 0.00030251999176249684, 'weight_decay': 0.0003799915985001874, 'epochs': 61, 'loss': 'mse', 'optimizer': 'adam', 'graph_mode': 'off', 'use_snp_selection': False}. Best is trial 97 with value: 0.12803634756483995.
[I 2025-12-05 14:23:56,035] Trial 101 finished with value: 0.1348562663387269 and parameters: {'model_type': 'mlp', 'hidden_dims': '[512, 64]', 'dropout': 0.5079798257147856, 'batch_norm': True, 'lr': 0.0007954882588146117, 'weight_decay': 1.4101325760289818e-05, 'epochs': 56, 'loss': 'mse', 'optimizer': 'adam', 'graph_mode': 'off', 'use_snp_selection': False}. Best is trial 101 with value: 0.1348562663387269.
[I 2025-12-05 14:23:57,272] Trial 102 finished with value: 0.10630579368867724 and parameters: {'model_type': 'mlp', 'hidden_dims': '[512, 64]', 'dropout': 0.556525715933123, 'batch_norm': True, 'lr': 0.0005270081481085356, 'weight_decay': 3.8648756654527156e-06, 'epochs': 159, 'loss': 'mse', 'optimizer': 'adam', 'graph_mode': 'off', 'use_snp_selection': False}. Best is trial 101 with value: 0.1348562663387269.
[I 2025-12-05 14:23:58,268] Trial 103 finished with value: 0.09666967727135584 and parameters: {'model_type': 'mlp', 'hidden_dims': '[512, 64]', 'dropout': 0.5200414614906785, 'batch_norm': True, 'lr': 0.0009947315276048851, 'weight_decay': 1.5256416323896624e-05, 'epochs': 99, 'loss': 'mse', 'optimizer': 'adam', 'graph_mode': 'off', 'use_snp_selection': False}. Best is trial 101 with value: 0.1348562663387269.
