[I 2025-12-05 23:26:16,280] Trial 23 finished with value: 0.21116476140510257 and parameters: {'model_type': 'mlp', 'hidden_dims': '[512, 64]', 'dropout': 0.5968415406439916, 'batch_norm': False, 'lr': 3.571004490904308e-06, 'weight_decay': 4.934373325409827e-06, 'epochs': 170, 'loss': 'mae', 'optimizer': 'adam', 'graph_mode': 'off', 'use_snp_selection': False}. Best is trial 12 with value: 0.21276081721259446.
[I 2025-12-05 23:27:06,973] Trial 24 finished with value: 0.21584959011946578 and parameters: {'model_type': 'mlp', 'hidden_dims': '[512, 64]', 'dropout': 0.4803493701927781, 'batch_norm': False, 'lr': 3.0005134002695575e-06, 'weight_decay': 6.150201994093408e-06, 'epochs': 169, 'loss': 'mae', 'optimizer': 'adam', 'graph_mode': 'off', 'use_snp_selection': False}. Best is trial 24 with value: 0.21584959011946578.
[I 2025-12-05 23:27:48,231] Trial 25 finished with value: 0.2024796749749059 and parameters: {'model_type': 'mlp', 'hidden_dims': '[512, 256]', 'dropout': 0.5425441457968837, 'batch_norm': False, 'lr': 2.567929268772149e-06, 'weight_decay': 5.140220411807396e-05, 'epochs': 132, 'loss': 'mae', 'optimizer': 'adam', 'graph_mode': 'off', 'use_snp_selection': False}. Best is trial 24 with value: 0.21584959011946578.
[I 2025-12-05 23:28:15,627] Trial 26 finished with value: 0.04438590803937867 and parameters: {'model_type': 'mlp', 'hidden_dims': '[256, 128]', 'dropout': 0.49016968602955774, 'batch_norm': False, 'lr': 3.703388108944459e-06, 'weight_decay': 4.65017028400095e-06, 'epochs': 55, 'loss': 'mae', 'optimizer': 'adam', 'graph_mode': 'off', 'use_snp_selection': True, 'num_snps': 3842}. Best is trial 24 with value: 0.21584959011946578.
[I 2025-12-05 23:28:32,085] Trial 27 finished with value: 0.18329673262723487 and parameters: {'model_type': 'mlp', 'hidden_dims': '[128, 64]', 'dropout': 0.553190891390822, 'batch_norm': False, 'lr': 2.8950492987795127e-06, 'weight_decay': 1.0148102977562031e-05, 'epochs': 162, 'loss': 'mae', 'optimizer': 'adam', 'graph_mode': 'off', 'use_snp_selection': False}. Best is trial 24 with value: 0.21584959011946578.
[I 2025-12-05 23:28:48,810] Trial 28 finished with value: 0.029054987286404273 and parameters: {'model_type': 'mlp', 'hidden_dims': '[256, 128, 64]', 'dropout': 0.4552874473909173, 'batch_norm': False, 'lr': 1.0219712638612089e-06, 'weight_decay': 3.907450551778806e-05, 'epochs': 81, 'loss': 'mae', 'optimizer': 'adam', 'graph_mode': 'off', 'use_snp_selection': False}. Best is trial 24 with value: 0.21584959011946578.
[I 2025-12-05 23:29:23,650] Trial 29 finished with value: 0.19279927625684384 and parameters: {'model_type': 'mlp', 'hidden_dims': '[128, 64]', 'dropout': 0.5154708649295417, 'batch_norm': False, 'lr': 4.9403658553590485e-06, 'weight_decay': 0.00010774073487650296, 'epochs': 128, 'loss': 'mae', 'optimizer': 'adam', 'graph_mode': 'off', 'use_snp_selection': True, 'num_snps': 19468}. Best is trial 24 with value: 0.21584959011946578.
[I 2025-12-05 23:30:37,451] Trial 30 finished with value: 0.22163667835016215 and parameters: {'model_type': 'mlp', 'hidden_dims': '[512, 64]', 'dropout': 0.5973661806893475, 'batch_norm': False, 'lr': 2.2828644892766757e-06, 'weight_decay': 6.3175895207505055e-06, 'epochs': 263, 'loss': 'mae', 'optimizer': 'adam', 'graph_mode': 'off', 'use_snp_selection': False}. Best is trial 30 with value: 0.22163667835016215.
[I 2025-12-05 23:32:14,178] Trial 31 finished with value: 0.20677934088872116 and parameters: {'model_type': 'mlp', 'hidden_dims': '[512, 64]', 'dropout': 0.5922305881238027, 'batch_norm': False, 'lr': 2.1790704691913464e-06, 'weight_decay': 7.42456038312605e-06, 'epochs': 349, 'loss': 'mae', 'optimizer': 'adam', 'graph_mode': 'off', 'use_snp_selection': False}. Best is trial 30 with value: 0.22163667835016215.
[I 2025-12-05 23:33:28,233] Trial 32 finished with value: 0.21049732270045443 and parameters: {'model_type': 'mlp', 'hidden_dims': '[512, 64]', 'dropout': 0.5685497742310711, 'batch_norm': False, 'lr': 8.784742450583336e-06, 'weight_decay': 1.5136386916167585e-05, 'epochs': 261, 'loss': 'mae', 'optimizer': 'adam', 'graph_mode': 'off', 'use_snp_selection': False}. Best is trial 30 with value: 0.22163667835016215.
[I 2025-12-05 23:34:36,604] Trial 33 finished with value: 0.19912995382386192 and parameters: {'model_type': 'mlp', 'hidden_dims': '[512, 64]', 'dropout': 0.4757293323410563, 'batch_norm': False, 'lr': 3.406563950597214e-06, 'weight_decay': 3.2405351068988813e-06, 'epochs': 238, 'loss': 'mae', 'optimizer': 'adam', 'graph_mode': 'off', 'use_snp_selection': False}. Best is trial 30 with value: 0.22163667835016215.
[I 2025-12-05 23:35:40,554] Trial 34 finished with value: 0.2134499800895217 and parameters: {'model_type': 'mlp', 'hidden_dims': '[512, 64]', 'dropout': 0.5549244214585421, 'batch_norm': False, 'lr': 6.003623229413168e-06, 'weight_decay': 2.6213764752666e-05, 'epochs': 221, 'loss': 'mae', 'optimizer': 'adam', 'graph_mode': 'off', 'use_snp_selection': False}. Best is trial 30 with value: 0.22163667835016215.
[I 2025-12-05 23:36:24,664] Trial 35 finished with value: 0.19698043545415575 and parameters: {'model_type': 'mlp', 'hidden_dims': '[256, 128]', 'dropout': 0.4258410874241678, 'batch_norm': False, 'lr': 5.8861303180848315e-06, 'weight_decay': 0.0001450711180469122, 'epochs': 287, 'loss': 'mae', 'optimizer': 'adam', 'graph_mode': 'off', 'use_snp_selection': False}. Best is trial 30 with value: 0.22163667835016215.
[I 2025-12-05 23:37:35,989] Trial 36 finished with value: 0.18596890271230612 and parameters: {'model_type': 'mlp', 'hidden_dims': '[256, 128, 64]', 'dropout': 0.5250254179576122, 'batch_norm': False, 'lr': 1.6821345825332609e-06, 'weight_decay': 2.1986899597056687e-05, 'epochs': 225, 'loss': 'mae', 'optimizer': 'adam', 'graph_mode': 'off', 'use_snp_selection': True, 'num_snps': 58661}. Best is trial 30 with value: 0.22163667835016215.
[I 2025-12-05 23:38:50,813] Trial 37 finished with value: 0.19367131908782045 and parameters: {'model_type': 'mlp', 'hidden_dims': '[512, 64]', 'dropout': 0.5634206612297704, 'batch_norm': False, 'lr': 1.106743212753824e-06, 'weight_decay': 1.1710972768076075e-05, 'epochs': 265, 'loss': 'mae', 'optimizer': 'adam', 'graph_mode': 'off', 'use_snp_selection': False}. Best is trial 30 with value: 0.22163667835016215.
[I 2025-12-05 23:39:42,601] Trial 38 finished with value: 0.21947061627924264 and parameters: {'model_type': 'mlp', 'hidden_dims': '[512, 128]', 'dropout': 0.46785317616857813, 'batch_norm': False, 'lr': 5.763246482888904e-06, 'weight_decay': 3.9402425144166636e-05, 'epochs': 242, 'loss': 'mae', 'optimizer': 'adam', 'graph_mode': 'off', 'use_snp_selection': True, 'num_snps': 19911}. Best is trial 30 with value: 0.22163667835016215.
[I 2025-12-05 23:40:40,670] Trial 39 finished with value: 0.23192366524334065 and parameters: {'model_type': 'mlp', 'hidden_dims': '[512, 128]', 'dropout': 0.3656633665941649, 'batch_norm': False, 'lr': 1.8667298816268426e-06, 'weight_decay': 3.1454796673030104e-05, 'epochs': 298, 'loss': 'mae', 'optimizer': 'adam', 'graph_mode': 'off', 'use_snp_selection': True, 'num_snps': 21018}. Best is trial 39 with value: 0.23192366524334065.
[I 2025-12-05 23:41:38,892] Trial 40 finished with value: 0.20873461902807294 and parameters: {'model_type': 'mlp', 'hidden_dims': '[512, 128]', 'dropout': 0.36108080298658374, 'batch_norm': False, 'lr': 1.8246777242616232e-06, 'weight_decay': 0.00011781892855779065, 'epochs': 302, 'loss': 'mae', 'optimizer': 'adam', 'graph_mode': 'off', 'use_snp_selection': True, 'num_snps': 20854}. Best is trial 39 with value: 0.23192366524334065.
[I 2025-12-05 23:42:37,681] Trial 41 finished with value: 0.2172037950892328 and parameters: {'model_type': 'mlp', 'hidden_dims': '[512, 128]', 'dropout': 0.3953740623635139, 'batch_norm': False, 'lr': 2.312142624534425e-06, 'weight_decay': 3.527480350134889e-05, 'epochs': 300, 'loss': 'mae', 'optimizer': 'adam', 'graph_mode': 'off', 'use_snp_selection': True, 'num_snps': 21719}. Best is trial 39 with value: 0.23192366524334065.
[I 2025-12-05 23:43:39,034] Trial 42 finished with value: 0.22256336421821427 and parameters: {'model_type': 'mlp', 'hidden_dims': '[512, 128]', 'dropout': 0.4021160210271519, 'batch_norm': False, 'lr': 2.3850872849141856e-06, 'weight_decay': 5.866998476320951e-05, 'epochs': 335, 'loss': 'mae', 'optimizer': 'adam', 'graph_mode': 'off', 'use_snp_selection': True, 'num_snps': 21315}. Best is trial 39 with value: 0.23192366524334065.
[I 2025-12-05 23:44:42,306] Trial 43 finished with value: 0.22109758400612883 and parameters: {'model_type': 'mlp', 'hidden_dims': '[512, 128]', 'dropout': 0.4007753648596822, 'batch_norm': False, 'lr': 1.4295258493096125e-06, 'weight_decay': 7.721796496250919e-05, 'epochs': 329, 'loss': 'mae', 'optimizer': 'adam', 'graph_mode': 'off', 'use_snp_selection': True, 'num_snps': 22661}. Best is trial 39 with value: 0.23192366524334065.
[I 2025-12-05 23:45:48,226] Trial 44 finished with value: 0.21452972223843716 and parameters: {'model_type': 'mlp', 'hidden_dims': '[512, 128]', 'dropout': 0.3565803005568379, 'batch_norm': False, 'lr': 1.3920243655369896e-06, 'weight_decay': 8.242526075346213e-05, 'epochs': 330, 'loss': 'mae', 'optimizer': 'adam', 'graph_mode': 'off', 'use_snp_selection': True, 'num_snps': 24637}. Best is trial 39 with value: 0.23192366524334065.
[I 2025-12-05 23:46:35,883] Trial 45 finished with value: 0.20570797107093314 and parameters: {'model_type': 'mlp', 'hidden_dims': '[512, 128]', 'dropout': 0.4077296478006167, 'batch_norm': False, 'lr': 1.4747968460424432e-06, 'weight_decay': 0.00026826872086612954, 'epochs': 321, 'loss': 'mae', 'optimizer': 'adam', 'graph_mode': 'off', 'use_snp_selection': True, 'num_snps': 13662}. Best is trial 39 with value: 0.23192366524334065.
[I 2025-12-05 23:47:49,069] Trial 46 finished with value: 0.2154782983352525 and parameters: {'model_type': 'mlp', 'hidden_dims': '[512, 128]', 'dropout': 0.3274097202664573, 'batch_norm': False, 'lr': 4.592152428507737e-06, 'weight_decay': 0.000544021196269964, 'epochs': 349, 'loss': 'mae', 'optimizer': 'adam', 'graph_mode': 'off', 'use_snp_selection': True, 'num_snps': 27772}. Best is trial 39 with value: 0.23192366524334065.
[I 2025-12-05 23:48:37,135] Trial 47 finished with value: 0.2049321281513797 and parameters: {'model_type': 'mlp', 'hidden_dims': '[512, 128]', 'dropout': 0.3806528217250462, 'batch_norm': False, 'lr': 1.9457997539056653e-06, 'weight_decay': 6.23904196065108e-05, 'epochs': 298, 'loss': 'mae', 'optimizer': 'adam', 'graph_mode': 'off', 'use_snp_selection': True, 'num_snps': 14346}. Best is trial 39 with value: 0.23192366524334065.
[I 2025-12-05 23:49:53,154] Trial 48 finished with value: 0.20392595463897814 and parameters: {'model_type': 'mlp', 'hidden_dims': '[512, 128]', 'dropout': 0.4301393080037796, 'batch_norm': False, 'lr': 1.0015120202166158e-06, 'weight_decay': 0.00021713164807268958, 'epochs': 325, 'loss': 'mae', 'optimizer': 'adam', 'graph_mode': 'off', 'use_snp_selection': True, 'num_snps': 31181}. Best is trial 39 with value: 0.23192366524334065.
[I 2025-12-05 23:50:43,453] Trial 49 finished with value: 0.20190530845533444 and parameters: {'model_type': 'mlp', 'hidden_dims': '[512, 128]', 'dropout': 0.25845458454237674, 'batch_norm': True, 'lr': 2.4990953390428443e-06, 'weight_decay': 6.477226872802912e-05, 'epochs': 273, 'loss': 'mae', 'optimizer': 'adam', 'graph_mode': 'off', 'use_snp_selection': True, 'num_snps': 17229}. Best is trial 39 with value: 0.23192366524334065.
[I 2025-12-05 23:51:18,481] Trial 50 finished with value: 0.14938136139571304 and parameters: {'model_type': 'mlp', 'hidden_dims': '[512, 128]', 'dropout': 0.3194493080804421, 'batch_norm': False, 'lr': 1.3042146316216853e-06, 'weight_decay': 3.9109218862670135e-05, 'epochs': 249, 'loss': 'mae', 'optimizer': 'adam', 'graph_mode': 'off', 'use_snp_selection': True, 'num_snps': 6558}. Best is trial 39 with value: 0.23192366524334065.
[I 2025-12-05 23:52:20,303] Trial 51 finished with value: 0.2149855242216822 and parameters: {'model_type': 'mlp', 'hidden_dims': '[512, 128]', 'dropout': 0.39754432489538566, 'batch_norm': False, 'lr': 2.177241540611511e-06, 'weight_decay': 3.662765323434042e-05, 'epochs': 307, 'loss': 'mae', 'optimizer': 'adam', 'graph_mode': 'off', 'use_snp_selection': True, 'num_snps': 23290}. Best is trial 39 with value: 0.23192366524334065.
[I 2025-12-05 23:53:20,022] Trial 52 finished with value: 0.21459210793326386 and parameters: {'model_type': 'mlp', 'hidden_dims': '[512, 128]', 'dropout': 0.37605294904789416, 'batch_norm': False, 'lr': 1.8489803541189282e-06, 'weight_decay': 2.5546556434481197e-05, 'epochs': 292, 'loss': 'mae', 'optimizer': 'adam', 'graph_mode': 'off', 'use_snp_selection': True, 'num_snps': 22636}. Best is trial 39 with value: 0.23192366524334065.
[I 2025-12-05 23:54:27,882] Trial 53 finished with value: 0.22846495508841708 and parameters: {'model_type': 'mlp', 'hidden_dims': '[512, 128]', 'dropout': 0.40964015336779613, 'batch_norm': False, 'lr': 2.636044305298839e-06, 'weight_decay': 1.4857633978627583e-05, 'epochs': 315, 'loss': 'mae', 'optimizer': 'adam', 'graph_mode': 'off', 'use_snp_selection': True, 'num_snps': 26594}. Best is trial 39 with value: 0.23192366524334065.
[I 2025-12-05 23:55:38,390] Trial 54 finished with value: 0.2218541901937438 and parameters: {'model_type': 'mlp', 'hidden_dims': '[512, 128]', 'dropout': 0.45120018732372147, 'batch_norm': False, 'lr': 4.115280598027393e-06, 'weight_decay': 1.5375429869415957e-05, 'epochs': 337, 'loss': 'mae', 'optimizer': 'adam', 'graph_mode': 'off', 'use_snp_selection': True, 'num_snps': 27416}. Best is trial 39 with value: 0.23192366524334065.
[I 2025-12-05 23:57:05,009] Trial 55 finished with value: 0.2193125888397474 and parameters: {'model_type': 'mlp', 'hidden_dims': '[512, 128]', 'dropout': 0.42209415647104975, 'batch_norm': False, 'lr': 4.045987565549691e-06, 'weight_decay': 1.3242975547171456e-05, 'epochs': 339, 'loss': 'mae', 'optimizer': 'adam', 'graph_mode': 'off', 'use_snp_selection': True, 'num_snps': 36786}. Best is trial 39 with value: 0.23192366524334065.
[I 2025-12-05 23:58:16,557] Trial 56 finished with value: 0.1858572313700495 and parameters: {'model_type': 'mlp', 'hidden_dims': '[512, 256]', 'dropout': 0.4456590532103015, 'batch_norm': True, 'lr': 1.4541561454981113e-06, 'weight_decay': 1.9337898562789125e-05, 'epochs': 336, 'loss': 'mse', 'optimizer': 'adam', 'graph_mode': 'off', 'use_snp_selection': True, 'num_snps': 27647}. Best is trial 39 with value: 0.23192366524334065.
[I 2025-12-05 23:59:24,387] Trial 57 finished with value: 0.2073935761352455 and parameters: {'model_type': 'mlp', 'hidden_dims': '[512, 128]', 'dropout': 0.30766371416786864, 'batch_norm': False, 'lr': 7.071964061159588e-06, 'weight_decay': 7.107725503763326e-06, 'epochs': 311, 'loss': 'mae', 'optimizer': 'adam', 'graph_mode': 'off', 'use_snp_selection': True, 'num_snps': 27592}. Best is trial 39 with value: 0.23192366524334065.
[I 2025-12-06 00:00:44,836] Trial 58 finished with value: 0.2153885312393012 and parameters: {'model_type': 'mlp', 'hidden_dims': '[512, 128]', 'dropout': 0.3685148235845078, 'batch_norm': False, 'lr': 2.951945645261073e-06, 'weight_decay': 0.00016455527076296745, 'epochs': 314, 'loss': 'mae', 'optimizer': 'adam', 'graph_mode': 'off', 'use_snp_selection': True, 'num_snps': 35172}. Best is trial 39 with value: 0.23192366524334065.
[I 2025-12-06 00:01:37,013] Trial 59 finished with value: 0.21551928601254478 and parameters: {'model_type': 'mlp', 'hidden_dims': '[256, 128]', 'dropout': 0.3397665587065468, 'batch_norm': False, 'lr': 4.434592696196867e-06, 'weight_decay': 8.726433158394714e-06, 'epochs': 338, 'loss': 'mse', 'optimizer': 'adam', 'graph_mode': 'off', 'use_snp_selection': True, 'num_snps': 26060}. Best is trial 39 with value: 0.23192366524334065.
[I 2025-12-06 00:03:02,627] Trial 60 finished with value: 0.20351080300634566 and parameters: {'model_type': 'mlp', 'hidden_dims': '[512, 128]', 'dropout': 0.27566401538193097, 'batch_norm': False, 'lr': 1.1038705488926435e-05, 'weight_decay': 8.496508589715125e-05, 'epochs': 281, 'loss': 'mae', 'optimizer': 'adam', 'graph_mode': 'off', 'use_snp_selection': True, 'num_snps': 41712}. Best is trial 39 with value: 0.23192366524334065.
[I 2025-12-06 00:03:57,010] Trial 61 finished with value: 0.19686486372355422 and parameters: {'model_type': 'mlp', 'hidden_dims': '[512, 128]', 'dropout': 0.46500941233158444, 'batch_norm': False, 'lr': 3.2693566097492375e-06, 'weight_decay': 2.8924705730368624e-05, 'epochs': 322, 'loss': 'mae', 'optimizer': 'adam', 'graph_mode': 'off', 'use_snp_selection': True, 'num_snps': 17526}. Best is trial 39 with value: 0.23192366524334065.
[I 2025-12-06 00:04:48,066] Trial 62 finished with value: 0.20507211320474159 and parameters: {'model_type': 'mlp', 'hidden_dims': '[512, 128]', 'dropout': 0.40876906695630866, 'batch_norm': False, 'lr': 5.332236518123402e-06, 'weight_decay': 5.18162663612876e-05, 'epochs': 290, 'loss': 'mae', 'optimizer': 'adam', 'graph_mode': 'off', 'use_snp_selection': True, 'num_snps': 17260}. Best is trial 39 with value: 0.23192366524334065.
[I 2025-12-06 00:05:29,594] Trial 63 finished with value: 0.1811498662508148 and parameters: {'model_type': 'mlp', 'hidden_dims': '[512, 128]', 'dropout': 0.4419218336942879, 'batch_norm': False, 'lr': 4.0647199424857926e-05, 'weight_decay': 1.7437797376296145e-05, 'epochs': 274, 'loss': 'mae', 'optimizer': 'adam', 'graph_mode': 'off', 'use_snp_selection': True, 'num_snps': 10718}. Best is trial 39 with value: 0.23192366524334065.
[I 2025-12-06 00:06:15,664] Trial 64 finished with value: 0.17680863946846223 and parameters: {'model_type': 'mlp', 'hidden_dims': '[128, 64]', 'dropout': 0.5074126014671676, 'batch_norm': False, 'lr': 1.2359126296576627e-06, 'weight_decay': 3.586844194151984e-06, 'epochs': 314, 'loss': 'mae', 'optimizer': 'adam', 'graph_mode': 'off', 'use_snp_selection': True, 'num_snps': 30513}. Best is trial 39 with value: 0.23192366524334065.
[I 2025-12-06 00:07:21,928] Trial 65 finished with value: 0.18120153803439032 and parameters: {'model_type': 'mlp', 'hidden_dims': '[512, 128]', 'dropout': 0.34090929259362196, 'batch_norm': True, 'lr': 2.6774963864042677e-06, 'weight_decay': 1.0490291313289927e-05, 'epochs': 328, 'loss': 'mae', 'optimizer': 'adam', 'graph_mode': 'off', 'use_snp_selection': True, 'num_snps': 24868}. Best is trial 39 with value: 0.23192366524334065.
[I 2025-12-06 00:08:04,016] Trial 66 finished with value: 0.2120573261151894 and parameters: {'model_type': 'mlp', 'hidden_dims': '[256, 128, 64]', 'dropout': 0.4656079359159451, 'batch_norm': False, 'lr': 9.010812754125414e-05, 'weight_decay': 7.4619296377199e-05, 'epochs': 238, 'loss': 'mae', 'optimizer': 'adam', 'graph_mode': 'off', 'use_snp_selection': True, 'num_snps': 20277}. Best is trial 39 with value: 0.23192366524334065.
[I 2025-12-06 00:09:19,752] Trial 67 finished with value: 0.23432816000254308 and parameters: {'model_type': 'mlp', 'hidden_dims': '[512, 256]', 'dropout': 0.39034506699885807, 'batch_norm': False, 'lr': 1.7684028224826088e-06, 'weight_decay': 4.891702479151897e-05, 'epochs': 350, 'loss': 'mae', 'optimizer': 'adam', 'graph_mode': 'off', 'use_snp_selection': True, 'num_snps': 29509}. Best is trial 67 with value: 0.23432816000254308.
[I 2025-12-06 00:10:44,855] Trial 68 finished with value: 0.21879589691606993 and parameters: {'model_type': 'mlp', 'hidden_dims': '[512, 256]', 'dropout': 0.38906924993235276, 'batch_norm': False, 'lr': 1.6232899351822286e-06, 'weight_decay': 1.502881050812775e-05, 'epochs': 350, 'loss': 'mse', 'optimizer': 'adam', 'graph_mode': 'off', 'use_snp_selection': True, 'num_snps': 34920}. Best is trial 67 with value: 0.23432816000254308.
[I 2025-12-06 00:12:00,811] Trial 69 finished with value: 0.20467497159277656 and parameters: {'model_type': 'mlp', 'hidden_dims': '[512, 256]', 'dropout': 0.41381723341654697, 'batch_norm': False, 'lr': 0.0009170723239699647, 'weight_decay': 0.0004646937760540884, 'epochs': 336, 'loss': 'mae', 'optimizer': 'adam', 'graph_mode': 'off', 'use_snp_selection': True, 'num_snps': 31133}. Best is trial 67 with value: 0.23432816000254308.
[I 2025-12-06 00:13:50,487] Trial 70 finished with value: 0.22088980484169096 and parameters: {'model_type': 'mlp', 'hidden_dims': '[512, 256]', 'dropout': 0.3459142567684434, 'batch_norm': False, 'lr': 2.1541717693560165e-06, 'weight_decay': 5.160132308480969e-05, 'epochs': 343, 'loss': 'mae', 'optimizer': 'adam', 'graph_mode': 'off', 'use_snp_selection': True, 'num_snps': 50488}. Best is trial 67 with value: 0.23432816000254308.
[I 2025-12-06 00:15:40,702] Trial 71 finished with value: 0.20694252396474244 and parameters: {'model_type': 'mlp', 'hidden_dims': '[512, 256]', 'dropout': 0.35602228574726485, 'batch_norm': False, 'lr': 2.0966167871511805e-06, 'weight_decay': 1.992081970138947e-05, 'epochs': 341, 'loss': 'mae', 'optimizer': 'adam', 'graph_mode': 'off', 'use_snp_selection': True, 'num_snps': 51424}. Best is trial 67 with value: 0.23432816000254308.
[I 2025-12-06 00:17:18,054] Trial 72 finished with value: 0.20313248710320905 and parameters: {'model_type': 'mlp', 'hidden_dims': '[512, 256]', 'dropout': 0.2893631409370628, 'batch_norm': False, 'lr': 2.480032736171663e-06, 'weight_decay': 4.8708817708617406e-05, 'epochs': 318, 'loss': 'mae', 'optimizer': 'adam', 'graph_mode': 'off', 'use_snp_selection': True, 'num_snps': 45377}. Best is trial 67 with value: 0.23432816000254308.
[I 2025-12-06 00:18:46,783] Trial 73 finished with value: 0.2171349741596472 and parameters: {'model_type': 'mlp', 'hidden_dims': '[512, 256]', 'dropout': 0.37246151884311013, 'batch_norm': False, 'lr': 1.7450071130476518e-06, 'weight_decay': 9.738402061556626e-05, 'epochs': 329, 'loss': 'mae', 'optimizer': 'adam', 'graph_mode': 'off', 'use_snp_selection': True, 'num_snps': 39040}. Best is trial 67 with value: 0.23432816000254308.
