[I 2025-12-05 16:19:52,836] Trial 121 finished with value: 0.10586358234225746 and parameters: {'model_type': 'mlp', 'hidden_dims': '[128, 64]', 'dropout': 0.21177603507070533, 'batch_norm': True, 'lr': 0.0008734098950312223, 'weight_decay': 1.3036211950041562e-05, 'epochs': 281, 'loss': 'mae', 'optimizer': 'adam', 'graph_mode': 'off', 'use_snp_selection': False}. Best is trial 105 with value: 0.12294717254433538.
[I 2025-12-05 16:19:53,809] Trial 122 finished with value: 0.09600779901004265 and parameters: {'model_type': 'mlp', 'hidden_dims': '[128, 64]', 'dropout': 0.2266859203168216, 'batch_norm': True, 'lr': 0.000693601706236142, 'weight_decay': 1.0302276721864428e-05, 'epochs': 286, 'loss': 'mae', 'optimizer': 'adam', 'graph_mode': 'off', 'use_snp_selection': False}. Best is trial 105 with value: 0.12294717254433538.
[I 2025-12-05 16:19:54,748] Trial 123 finished with value: 0.09639620295275644 and parameters: {'model_type': 'mlp', 'hidden_dims': '[128, 64]', 'dropout': 0.23269096700619604, 'batch_norm': True, 'lr': 0.0008118802674190656, 'weight_decay': 6.797818550986625e-06, 'epochs': 260, 'loss': 'mae', 'optimizer': 'adam', 'graph_mode': 'off', 'use_snp_selection': False}. Best is trial 105 with value: 0.12294717254433538.
[I 2025-12-05 16:19:55,696] Trial 124 finished with value: 0.051006900808873074 and parameters: {'model_type': 'mlp', 'hidden_dims': '[128, 64]', 'dropout': 0.24239428104535127, 'batch_norm': True, 'lr': 2.1266736822904295e-05, 'weight_decay': 2.904668707714171e-05, 'epochs': 267, 'loss': 'mae', 'optimizer': 'adam', 'graph_mode': 'off', 'use_snp_selection': False}. Best is trial 105 with value: 0.12294717254433538.
[I 2025-12-05 16:19:56,717] Trial 125 finished with value: 0.09714525155364596 and parameters: {'model_type': 'mlp', 'hidden_dims': '[128, 64]', 'dropout': 0.27407800158561346, 'batch_norm': True, 'lr': 0.00048248969092783714, 'weight_decay': 4.0383302875709535e-05, 'epochs': 290, 'loss': 'mae', 'optimizer': 'adam', 'graph_mode': 'off', 'use_snp_selection': False}. Best is trial 105 with value: 0.12294717254433538.
[I 2025-12-05 16:19:58,619] Trial 126 finished with value: 0.10544528501584201 and parameters: {'model_type': 'mlp', 'hidden_dims': '[512, 64]', 'dropout': 0.17171854289619112, 'batch_norm': True, 'lr': 0.0006041603536509161, 'weight_decay': 2.055210810732073e-05, 'epochs': 295, 'loss': 'mae', 'optimizer': 'adam', 'graph_mode': 'off', 'use_snp_selection': False}. Best is trial 105 with value: 0.12294717254433538.
[I 2025-12-05 16:20:01,445] Trial 127 finished with value: 0.0972121734125449 and parameters: {'model_type': 'mlp', 'hidden_dims': '[256, 128, 64]', 'dropout': 0.19575868803050667, 'batch_norm': True, 'lr': 2.702166597825648e-05, 'weight_decay': 1.620145718641206e-05, 'epochs': 274, 'loss': 'mae', 'optimizer': 'adam', 'graph_mode': 'off', 'use_snp_selection': True, 'num_snps': 59988}. Best is trial 105 with value: 0.12294717254433538.
[I 2025-12-05 16:20:03,162] Trial 128 finished with value: 0.10844571223054088 and parameters: {'model_type': 'mlp', 'hidden_dims': '[128, 64]', 'dropout': 0.21471909642514436, 'batch_norm': False, 'lr': 0.0007199579544055197, 'weight_decay': 0.0005757089918072382, 'epochs': 284, 'loss': 'mse', 'optimizer': 'adam', 'graph_mode': 'off', 'use_snp_selection': True, 'num_snps': 33345}. Best is trial 105 with value: 0.12294717254433538.
[I 2025-12-05 16:20:04,166] Trial 129 finished with value: 0.11077863629715651 and parameters: {'model_type': 'mlp', 'hidden_dims': '[128, 64]', 'dropout': 0.2543026709196617, 'batch_norm': True, 'lr': 0.0008955296444079378, 'weight_decay': 5.204306633551833e-05, 'epochs': 308, 'loss': 'mae', 'optimizer': 'adam', 'graph_mode': 'off', 'use_snp_selection': False}. Best is trial 105 with value: 0.12294717254433538.
[I 2025-12-05 16:20:07,296] Trial 130 finished with value: 0.10495601028969434 and parameters: {'model_type': 'mlp', 'hidden_dims': '[512, 256]', 'dropout': 0.11573123285708951, 'batch_norm': True, 'lr': 0.000362864935261553, 'weight_decay': 7.849398418028435e-06, 'epochs': 320, 'loss': 'mae', 'optimizer': 'adam', 'graph_mode': 'off', 'use_snp_selection': True, 'num_snps': 53696}. Best is trial 105 with value: 0.12294717254433538.
[I 2025-12-05 16:20:09,980] Trial 131 finished with value: 0.09817775244310858 and parameters: {'model_type': 'mlp', 'hidden_dims': '[128, 64]', 'dropout': 0.21849109447400689, 'batch_norm': True, 'lr': 0.00042004704245882964, 'weight_decay': 0.0003350492714306475, 'epochs': 268, 'loss': 'mae', 'optimizer': 'adam', 'graph_mode': 'off', 'use_snp_selection': True, 'num_snps': 56997}. Best is trial 105 with value: 0.12294717254433538.
[I 2025-12-05 16:20:12,480] Trial 132 finished with value: 0.10036566966773855 and parameters: {'model_type': 'mlp', 'hidden_dims': '[128, 64]', 'dropout': 0.23513914445348694, 'batch_norm': True, 'lr': 0.00048801476750203257, 'weight_decay': 0.0004221068349620758, 'epochs': 259, 'loss': 'mae', 'optimizer': 'adam', 'graph_mode': 'off', 'use_snp_selection': True, 'num_snps': 55869}. Best is trial 105 with value: 0.12294717254433538.
[I 2025-12-05 16:20:14,565] Trial 133 finished with value: 0.09714114386911922 and parameters: {'model_type': 'mlp', 'hidden_dims': '[128, 64]', 'dropout': 0.18371676649362764, 'batch_norm': True, 'lr': 0.0003274296828095808, 'weight_decay': 0.0005784494747352766, 'epochs': 275, 'loss': 'mae', 'optimizer': 'adam', 'graph_mode': 'off', 'use_snp_selection': True, 'num_snps': 43986}. Best is trial 105 with value: 0.12294717254433538.
[I 2025-12-05 16:20:16,864] Trial 134 finished with value: 0.10189859224790362 and parameters: {'model_type': 'mlp', 'hidden_dims': '[128, 64]', 'dropout': 0.20790062819486982, 'batch_norm': True, 'lr': 0.0006115833490122723, 'weight_decay': 0.0002664964674210437, 'epochs': 251, 'loss': 'mae', 'optimizer': 'adam', 'graph_mode': 'off', 'use_snp_selection': True, 'num_snps': 51816}. Best is trial 105 with value: 0.12294717254433538.
[I 2025-12-05 16:20:19,535] Trial 135 finished with value: 0.10778830591453542 and parameters: {'model_type': 'mlp', 'hidden_dims': '[128, 64]', 'dropout': 0.1303187534592379, 'batch_norm': True, 'lr': 0.0007703838865749925, 'weight_decay': 7.607014131051064e-05, 'epochs': 264, 'loss': 'mae', 'optimizer': 'adam', 'graph_mode': 'off', 'use_snp_selection': True, 'num_snps': 58539}. Best is trial 105 with value: 0.12294717254433538.
[I 2025-12-05 16:20:20,434] Trial 136 finished with value: 0.11006282057358065 and parameters: {'model_type': 'mlp', 'hidden_dims': '[128, 64]', 'dropout': 0.24651781597214717, 'batch_norm': False, 'lr': 0.00021374706535262674, 'weight_decay': 3.522530831956795e-05, 'epochs': 182, 'loss': 'mae', 'optimizer': 'adam', 'graph_mode': 'off', 'use_snp_selection': False}. Best is trial 105 with value: 0.12294717254433538.
[I 2025-12-05 16:20:22,955] Trial 137 finished with value: 0.09966678812753745 and parameters: {'model_type': 'mlp', 'hidden_dims': '[256, 128, 64]', 'dropout': 0.2665398949037136, 'batch_norm': True, 'lr': 0.00042749235767959435, 'weight_decay': 9.630330959935389e-05, 'epochs': 244, 'loss': 'mse', 'optimizer': 'adam', 'graph_mode': 'off', 'use_snp_selection': True, 'num_snps': 54291}. Best is trial 105 with value: 0.12294717254433538.
[I 2025-12-05 16:20:25,454] Trial 138 finished with value: 0.10642901410241395 and parameters: {'model_type': 'mlp', 'hidden_dims': '[128, 64]', 'dropout': 0.1011297887416969, 'batch_norm': True, 'lr': 0.0005430965932302142, 'weight_decay': 0.0008671938599267942, 'epochs': 300, 'loss': 'mae', 'optimizer': 'adam', 'graph_mode': 'off', 'use_snp_selection': True, 'num_snps': 56031}. Best is trial 105 with value: 0.12294717254433538.
[I 2025-12-05 16:20:26,659] Trial 139 finished with value: 0.09789216892743205 and parameters: {'model_type': 'mlp', 'hidden_dims': '[256, 128]', 'dropout': 0.22493957259312367, 'batch_norm': False, 'lr': 0.0006535228904772988, 'weight_decay': 1.374326083437419e-05, 'epochs': 271, 'loss': 'mae', 'optimizer': 'adam', 'graph_mode': 'off', 'use_snp_selection': False}. Best is trial 105 with value: 0.12294717254433538.
[I 2025-12-05 16:20:29,278] Trial 140 finished with value: 0.08983975012379271 and parameters: {'model_type': 'mlp', 'hidden_dims': '[128, 64]', 'dropout': 0.31520468770293636, 'batch_norm': True, 'lr': 6.589388860735759e-05, 'weight_decay': 6.249463892211048e-05, 'epochs': 282, 'loss': 'mse', 'optimizer': 'adam', 'graph_mode': 'off', 'use_snp_selection': True, 'num_snps': 57133}. Best is trial 105 with value: 0.12294717254433538.
[I 2025-12-05 16:20:30,641] Trial 141 finished with value: 0.11570915949869803 and parameters: {'model_type': 'mlp', 'hidden_dims': '[256, 128, 64]', 'dropout': 0.3550608821752928, 'batch_norm': True, 'lr': 0.0009946779853615953, 'weight_decay': 2.430071991599851e-05, 'epochs': 345, 'loss': 'mae', 'optimizer': 'adam', 'graph_mode': 'off', 'use_snp_selection': True, 'num_snps': 7443}. Best is trial 105 with value: 0.12294717254433538.
[I 2025-12-05 16:20:32,069] Trial 142 finished with value: 0.11160438848805002 and parameters: {'model_type': 'mlp', 'hidden_dims': '[256, 128, 64]', 'dropout': 0.3408531284001056, 'batch_norm': True, 'lr': 0.0009929789610258284, 'weight_decay': 2.337506575590076e-05, 'epochs': 328, 'loss': 'mae', 'optimizer': 'adam', 'graph_mode': 'off', 'use_snp_selection': True, 'num_snps': 11476}. Best is trial 105 with value: 0.12294717254433538.
[I 2025-12-05 16:20:33,425] Trial 143 finished with value: 0.10151320252301914 and parameters: {'model_type': 'mlp', 'hidden_dims': '[256, 128, 64]', 'dropout': 0.3471147738687812, 'batch_norm': True, 'lr': 0.0009958080067659105, 'weight_decay': 2.5730842741654103e-05, 'epochs': 346, 'loss': 'mae', 'optimizer': 'adam', 'graph_mode': 'off', 'use_snp_selection': True, 'num_snps': 9496}. Best is trial 105 with value: 0.12294717254433538.
[I 2025-12-05 16:20:34,713] Trial 144 finished with value: 0.1051589845472416 and parameters: {'model_type': 'mlp', 'hidden_dims': '[256, 128, 64]', 'dropout': 0.3624049966122384, 'batch_norm': True, 'lr': 0.000867808422180838, 'weight_decay': 2.1829280735657733e-05, 'epochs': 339, 'loss': 'mae', 'optimizer': 'adam', 'graph_mode': 'off', 'use_snp_selection': True, 'num_snps': 7099}. Best is trial 105 with value: 0.12294717254433538.
[I 2025-12-05 16:20:36,320] Trial 145 finished with value: 0.1157806861670888 and parameters: {'model_type': 'mlp', 'hidden_dims': '[256, 128, 64]', 'dropout': 0.3928237747454943, 'batch_norm': True, 'lr': 0.0007714860834151738, 'weight_decay': 2.9937470365130002e-05, 'epochs': 348, 'loss': 'mae', 'optimizer': 'adam', 'graph_mode': 'off', 'use_snp_selection': True, 'num_snps': 14154}. Best is trial 105 with value: 0.12294717254433538.
[I 2025-12-05 16:20:37,513] Trial 146 finished with value: 0.08591944805117128 and parameters: {'model_type': 'mlp', 'hidden_dims': '[256, 128, 64]', 'dropout': 0.42150295772308677, 'batch_norm': True, 'lr': 0.0007240199189997227, 'weight_decay': 1.114481470062296e-05, 'epochs': 344, 'loss': 'mae', 'optimizer': 'adam', 'graph_mode': 'off', 'use_snp_selection': True, 'num_snps': 2186}. Best is trial 105 with value: 0.12294717254433538.
[I 2025-12-05 16:20:38,588] Trial 147 finished with value: 0.07124395593485452 and parameters: {'model_type': 'mlp', 'hidden_dims': '[256, 128, 64]', 'dropout': 0.3930593202791621, 'batch_norm': False, 'lr': 0.0007978177126045097, 'weight_decay': 3.215572447186485e-05, 'epochs': 339, 'loss': 'mae', 'optimizer': 'adam', 'graph_mode': 'off', 'use_snp_selection': True, 'num_snps': 4194}. Best is trial 105 with value: 0.12294717254433538.
[I 2025-12-05 16:20:39,956] Trial 148 finished with value: 0.11956660280816694 and parameters: {'model_type': 'mlp', 'hidden_dims': '[256, 128, 64]', 'dropout': 0.4080989553651689, 'batch_norm': True, 'lr': 0.0008696362019232121, 'weight_decay': 1.5943481104068296e-05, 'epochs': 336, 'loss': 'mae', 'optimizer': 'adam', 'graph_mode': 'off', 'use_snp_selection': False}. Best is trial 105 with value: 0.12294717254433538.
[I 2025-12-05 16:20:41,363] Trial 149 finished with value: 0.09871127918769815 and parameters: {'model_type': 'mlp', 'hidden_dims': '[256, 128, 64]', 'dropout': 0.4014451115954212, 'batch_norm': True, 'lr': 0.000639278293988064, 'weight_decay': 4.2661074757862705e-05, 'epochs': 349, 'loss': 'mae', 'optimizer': 'adam', 'graph_mode': 'off', 'use_snp_selection': False}. Best is trial 105 with value: 0.12294717254433538.
[I 2025-12-05 16:20:43,714] Trial 0 finished with value: 0.03314772226147771 and parameters: {'model_type': 'mlp', 'hidden_dims': '[128, 64]', 'dropout': 0.199031432379812, 'batch_norm': True, 'lr': 1.8408544111075837e-06, 'weight_decay': 5.5136510071208614e-05, 'epochs': 336, 'loss': 'mae', 'optimizer': 'adam', 'graph_mode': 'off', 'use_snp_selection': True, 'num_snps': 43862}. Best is trial 0 with value: 0.03314772226147771.
[I 2025-12-05 16:20:44,894] Trial 1 finished with value: 0.08159576196020883 and parameters: {'model_type': 'mlp', 'hidden_dims': '[256, 128]', 'dropout': 0.4370668075331726, 'batch_norm': True, 'lr': 7.133471581159139e-05, 'weight_decay': 1.128633586803549e-05, 'epochs': 242, 'loss': 'mae', 'optimizer': 'adam', 'graph_mode': 'off', 'use_snp_selection': False}. Best is trial 1 with value: 0.08159576196020883.
[I 2025-12-05 16:20:45,878] Trial 2 finished with value: -0.026901939958705767 and parameters: {'model_type': 'mlp', 'hidden_dims': '[256, 128, 64]', 'dropout': 0.41314357415569625, 'batch_norm': False, 'lr': 3.952233718592101e-06, 'weight_decay': 0.00026754769258252603, 'epochs': 149, 'loss': 'mse', 'optimizer': 'adam', 'graph_mode': 'off', 'use_snp_selection': True, 'num_snps': 11571}. Best is trial 1 with value: 0.08159576196020883.
[I 2025-12-05 16:20:47,849] Trial 3 finished with value: 0.05724954335851053 and parameters: {'model_type': 'mlp', 'hidden_dims': '[512, 64]', 'dropout': 0.5938127374509361, 'batch_norm': False, 'lr': 5.67704586114731e-06, 'weight_decay': 2.4518087630137052e-05, 'epochs': 320, 'loss': 'mae', 'optimizer': 'adam', 'graph_mode': 'off', 'use_snp_selection': False}. Best is trial 1 with value: 0.08159576196020883.
[I 2025-12-05 16:20:50,202] Trial 4 finished with value: 0.037522165532902656 and parameters: {'model_type': 'mlp', 'hidden_dims': '[512, 128]', 'dropout': 0.25746343592134413, 'batch_norm': True, 'lr': 1.3467657668402788e-06, 'weight_decay': 0.00033087251918647806, 'epochs': 277, 'loss': 'mse', 'optimizer': 'adam', 'graph_mode': 'off', 'use_snp_selection': True, 'num_snps': 36675}. Best is trial 1 with value: 0.08159576196020883.
[I 2025-12-05 16:20:51,994] Trial 5 finished with value: 0.04859077965686754 and parameters: {'model_type': 'mlp', 'hidden_dims': '[512, 64]', 'dropout': 0.38275350994408375, 'batch_norm': True, 'lr': 1.5586664309232824e-06, 'weight_decay': 0.0008227664668621182, 'epochs': 145, 'loss': 'mae', 'optimizer': 'adam', 'graph_mode': 'off', 'use_snp_selection': True, 'num_snps': 32148}. Best is trial 1 with value: 0.08159576196020883.
[I 2025-12-05 16:20:53,001] Trial 6 finished with value: 0.06969116738005468 and parameters: {'model_type': 'mlp', 'hidden_dims': '[256, 128]', 'dropout': 0.3930109900265879, 'batch_norm': False, 'lr': 4.892964372128395e-05, 'weight_decay': 1.5809549317992182e-06, 'epochs': 199, 'loss': 'mse', 'optimizer': 'adam', 'graph_mode': 'off', 'use_snp_selection': False}. Best is trial 1 with value: 0.08159576196020883.
[I 2025-12-05 16:20:54,140] Trial 7 finished with value: 0.05335577789935245 and parameters: {'model_type': 'mlp', 'hidden_dims': '[512, 256]', 'dropout': 0.15343979219678458, 'batch_norm': True, 'lr': 6.234003099047341e-05, 'weight_decay': 3.894760610535477e-07, 'epochs': 97, 'loss': 'mse', 'optimizer': 'adam', 'graph_mode': 'off', 'use_snp_selection': False}. Best is trial 1 with value: 0.08159576196020883.
[I 2025-12-05 16:20:56,084] Trial 8 finished with value: 0.08270041232059183 and parameters: {'model_type': 'mlp', 'hidden_dims': '[512, 128]', 'dropout': 0.10743001231661406, 'batch_norm': True, 'lr': 0.00023728538449271062, 'weight_decay': 1.7629071578048637e-05, 'epochs': 312, 'loss': 'mae', 'optimizer': 'adam', 'graph_mode': 'off', 'use_snp_selection': False}. Best is trial 8 with value: 0.08270041232059183.
[I 2025-12-05 16:20:57,472] Trial 9 finished with value: 0.050927795276938165 and parameters: {'model_type': 'mlp', 'hidden_dims': '[512, 64]', 'dropout': 0.14505336736221927, 'batch_norm': True, 'lr': 5.8619638388111826e-05, 'weight_decay': 6.200156172669308e-07, 'epochs': 175, 'loss': 'mse', 'optimizer': 'adam', 'graph_mode': 'off', 'use_snp_selection': False}. Best is trial 8 with value: 0.08270041232059183.
[I 2025-12-05 16:20:58,446] Trial 10 finished with value: -0.04137993807625954 and parameters: {'model_type': 'mlp', 'hidden_dims': '[512, 128]', 'dropout': 0.2800030442581858, 'batch_norm': False, 'lr': 0.0004919806695968258, 'weight_decay': 2.9953888095455486e-06, 'epochs': 55, 'loss': 'mae', 'optimizer': 'adam', 'graph_mode': 'off', 'use_snp_selection': False}. Best is trial 8 with value: 0.08270041232059183.
[I 2025-12-05 16:20:59,611] Trial 11 finished with value: 0.08482198977373863 and parameters: {'model_type': 'mlp', 'hidden_dims': '[256, 128]', 'dropout': 0.5025533409127559, 'batch_norm': True, 'lr': 0.0004219456914890788, 'weight_decay': 7.0869802591332905e-06, 'epochs': 239, 'loss': 'mae', 'optimizer': 'adam', 'graph_mode': 'off', 'use_snp_selection': False}. Best is trial 11 with value: 0.08482198977373863.
[I 2025-12-05 16:21:01,422] Trial 12 finished with value: 0.07821381720932118 and parameters: {'model_type': 'mlp', 'hidden_dims': '[512, 128]', 'dropout': 0.5266996967984326, 'batch_norm': True, 'lr': 0.0006753264773209732, 'weight_decay': 4.19780668911197e-06, 'epochs': 268, 'loss': 'mae', 'optimizer': 'adam', 'graph_mode': 'off', 'use_snp_selection': False}. Best is trial 11 with value: 0.08482198977373863.
[I 2025-12-05 16:21:02,561] Trial 13 finished with value: 0.0745811187728296 and parameters: {'model_type': 'mlp', 'hidden_dims': '[256, 128]', 'dropout': 0.4928303937946425, 'batch_norm': True, 'lr': 0.00023284399572303963, 'weight_decay': 5.9577988329204815e-05, 'epochs': 229, 'loss': 'mae', 'optimizer': 'adam', 'graph_mode': 'off', 'use_snp_selection': False}. Best is trial 11 with value: 0.08482198977373863.
[I 2025-12-05 16:21:04,450] Trial 14 finished with value: 0.09552739298006763 and parameters: {'model_type': 'mlp', 'hidden_dims': '[512, 256]', 'dropout': 0.3136114216535987, 'batch_norm': True, 'lr': 0.0002108574938852793, 'weight_decay': 1.1414924884997386e-07, 'epochs': 303, 'loss': 'mae', 'optimizer': 'adam', 'graph_mode': 'off', 'use_snp_selection': False}. Best is trial 14 with value: 0.09552739298006763.
[I 2025-12-05 16:21:06,334] Trial 15 finished with value: 0.08377331708939095 and parameters: {'model_type': 'mlp', 'hidden_dims': '[512, 256]', 'dropout': 0.317840840599126, 'batch_norm': True, 'lr': 0.00018429018027102804, 'weight_decay': 1.2166194516519187e-07, 'epochs': 290, 'loss': 'mae', 'optimizer': 'adam', 'graph_mode': 'off', 'use_snp_selection': False}. Best is trial 14 with value: 0.09552739298006763.
[I 2025-12-05 16:21:08,429] Trial 16 finished with value: 0.041201444527249956 and parameters: {'model_type': 'mlp', 'hidden_dims': '[512, 256]', 'dropout': 0.47427353379681125, 'batch_norm': True, 'lr': 1.2586985041154999e-05, 'weight_decay': 1.14189505294403e-07, 'epochs': 349, 'loss': 'mae', 'optimizer': 'adam', 'graph_mode': 'off', 'use_snp_selection': False}. Best is trial 14 with value: 0.09552739298006763.
[I 2025-12-05 16:21:09,356] Trial 17 finished with value: 0.11157945279125966 and parameters: {'model_type': 'mlp', 'hidden_dims': '[128, 64]', 'dropout': 0.5897150686853508, 'batch_norm': True, 'lr': 0.000906375209920231, 'weight_decay': 5.186432488166066e-07, 'epochs': 225, 'loss': 'mae', 'optimizer': 'adam', 'graph_mode': 'off', 'use_snp_selection': False}. Best is trial 17 with value: 0.11157945279125966.
[I 2025-12-05 16:21:11,987] Trial 18 finished with value: 0.004035067236010205 and parameters: {'model_type': 'mlp', 'hidden_dims': '[128, 64]', 'dropout': 0.5855696804968278, 'batch_norm': False, 'lr': 0.0009890727022070175, 'weight_decay': 3.8864361433995704e-07, 'epochs': 207, 'loss': 'mae', 'optimizer': 'adam', 'graph_mode': 'off', 'use_snp_selection': True, 'num_snps': 58241}. Best is trial 17 with value: 0.11157945279125966.
[I 2025-12-05 16:21:13,040] Trial 19 finished with value: 0.05774624649100398 and parameters: {'model_type': 'mlp', 'hidden_dims': '[128, 64]', 'dropout': 0.3162234504500151, 'batch_norm': True, 'lr': 0.00013346863904656342, 'weight_decay': 1.2478068915303884e-06, 'epochs': 294, 'loss': 'mae', 'optimizer': 'adam', 'graph_mode': 'off', 'use_snp_selection': False}. Best is trial 17 with value: 0.11157945279125966.
[I 2025-12-05 16:21:14,244] Trial 20 finished with value: 0.033679189852050394 and parameters: {'model_type': 'mlp', 'hidden_dims': '[256, 128, 64]', 'dropout': 0.24280079961225087, 'batch_norm': True, 'lr': 2.1080398487359424e-05, 'weight_decay': 2.095402605662792e-07, 'epochs': 249, 'loss': 'mae', 'optimizer': 'adam', 'graph_mode': 'off', 'use_snp_selection': False}. Best is trial 17 with value: 0.11157945279125966.
[I 2025-12-05 16:21:15,388] Trial 21 finished with value: 0.09235601166899056 and parameters: {'model_type': 'mlp', 'hidden_dims': '[256, 128]', 'dropout': 0.5405439478908376, 'batch_norm': True, 'lr': 0.00041049051500653683, 'weight_decay': 8.490528741616163e-07, 'epochs': 238, 'loss': 'mae', 'optimizer': 'adam', 'graph_mode': 'off', 'use_snp_selection': False}. Best is trial 17 with value: 0.11157945279125966.
