[I 2025-12-05 19:23:22,250] Trial 7 finished with value: 0.20156999192107436 and parameters: {'model_type': 'mlp', 'hidden_dims': '[512, 256]', 'dropout': 0.15343979219678458, 'batch_norm': True, 'lr': 6.234003099047341e-05, 'weight_decay': 3.894760610535477e-07, 'epochs': 97, 'loss': 'mse', 'optimizer': 'adam', 'graph_mode': 'off', 'use_snp_selection': False}. Best is trial 3 with value: 0.21004734724805454.
[I 2025-12-05 19:24:52,430] Trial 8 finished with value: 0.20229941070123694 and parameters: {'model_type': 'mlp', 'hidden_dims': '[512, 128]', 'dropout': 0.10743001231661406, 'batch_norm': True, 'lr': 0.00023728538449271062, 'weight_decay': 1.7629071578048637e-05, 'epochs': 312, 'loss': 'mae', 'optimizer': 'adam', 'graph_mode': 'off', 'use_snp_selection': False}. Best is trial 3 with value: 0.21004734724805454.
[I 2025-12-05 19:25:46,323] Trial 9 finished with value: 0.19138182344360993 and parameters: {'model_type': 'mlp', 'hidden_dims': '[512, 64]', 'dropout': 0.14505336736221927, 'batch_norm': True, 'lr': 5.8619638388111826e-05, 'weight_decay': 6.200156172669308e-07, 'epochs': 175, 'loss': 'mse', 'optimizer': 'adam', 'graph_mode': 'off', 'use_snp_selection': False}. Best is trial 3 with value: 0.21004734724805454.
[I 2025-12-05 19:26:08,222] Trial 10 finished with value: 0.18577915093652667 and parameters: {'model_type': 'mlp', 'hidden_dims': '[512, 64]', 'dropout': 0.5885461262002587, 'batch_norm': False, 'lr': 8.769366258768696e-06, 'weight_decay': 2.78273193871783e-06, 'epochs': 55, 'loss': 'mae', 'optimizer': 'adam', 'graph_mode': 'off', 'use_snp_selection': False}. Best is trial 3 with value: 0.21004734724805454.
[I 2025-12-05 19:26:46,919] Trial 11 finished with value: 0.20430595403702595 and parameters: {'model_type': 'mlp', 'hidden_dims': '[256, 128]', 'dropout': 0.5874224943486895, 'batch_norm': False, 'lr': 1.579181036140435e-05, 'weight_decay': 2.2706826306130984e-05, 'epochs': 243, 'loss': 'mae', 'optimizer': 'adam', 'graph_mode': 'off', 'use_snp_selection': False}. Best is trial 3 with value: 0.21004734724805454.
[I 2025-12-05 19:27:26,001] Trial 12 finished with value: 0.13600810785461814 and parameters: {'model_type': 'mlp', 'hidden_dims': '[256, 128]', 'dropout': 0.4856805755923864, 'batch_norm': False, 'lr': 0.0006753264773209732, 'weight_decay': 5.275092102447975e-06, 'epochs': 251, 'loss': 'mae', 'optimizer': 'adam', 'graph_mode': 'off', 'use_snp_selection': False}. Best is trial 3 with value: 0.21004734724805454.
[I 2025-12-05 19:27:52,242] Trial 13 finished with value: 0.21328478144868884 and parameters: {'model_type': 'mlp', 'hidden_dims': '[128, 64]', 'dropout': 0.4964828887099272, 'batch_norm': False, 'lr': 1.3373175420781734e-05, 'weight_decay': 6.713476180492357e-05, 'epochs': 295, 'loss': 'mae', 'optimizer': 'adam', 'graph_mode': 'off', 'use_snp_selection': False}. Best is trial 13 with value: 0.21328478144868884.
[I 2025-12-05 19:28:22,175] Trial 14 finished with value: 0.21260855693011718 and parameters: {'model_type': 'mlp', 'hidden_dims': '[128, 64]', 'dropout': 0.5300180653494536, 'batch_norm': False, 'lr': 8.48957463521563e-06, 'weight_decay': 7.403889609818183e-05, 'epochs': 347, 'loss': 'mae', 'optimizer': 'adam', 'graph_mode': 'off', 'use_snp_selection': False}. Best is trial 13 with value: 0.21328478144868884.
[I 2025-12-05 19:28:48,810] Trial 15 finished with value: 0.20469675291484726 and parameters: {'model_type': 'mlp', 'hidden_dims': '[128, 64]', 'dropout': 0.4976624582945862, 'batch_norm': False, 'lr': 1.89959711088838e-05, 'weight_decay': 9.402358050729363e-05, 'epochs': 302, 'loss': 'mae', 'optimizer': 'adam', 'graph_mode': 'off', 'use_snp_selection': False}. Best is trial 13 with value: 0.21328478144868884.
[I 2025-12-05 19:29:18,931] Trial 16 finished with value: 0.21015570220761112 and parameters: {'model_type': 'mlp', 'hidden_dims': '[128, 64]', 'dropout': 0.3061285181427016, 'batch_norm': False, 'lr': 1.8245386607615336e-05, 'weight_decay': 0.00011431726695115916, 'epochs': 350, 'loss': 'mae', 'optimizer': 'adam', 'graph_mode': 'off', 'use_snp_selection': False}. Best is trial 13 with value: 0.21328478144868884.
[I 2025-12-05 19:29:44,704] Trial 17 finished with value: 0.19973764984681774 and parameters: {'model_type': 'mlp', 'hidden_dims': '[128, 64]', 'dropout': 0.497812504198358, 'batch_norm': False, 'lr': 3.378196935792496e-06, 'weight_decay': 4.279596648260934e-05, 'epochs': 287, 'loss': 'mae', 'optimizer': 'adam', 'graph_mode': 'off', 'use_snp_selection': False}. Best is trial 13 with value: 0.21328478144868884.
[I 2025-12-05 19:30:45,176] Trial 18 finished with value: 0.1985213440377988 and parameters: {'model_type': 'mlp', 'hidden_dims': '[128, 64]', 'dropout': 0.5305540111037982, 'batch_norm': False, 'lr': 0.0001794723810273373, 'weight_decay': 0.00038975757849594756, 'epochs': 206, 'loss': 'mae', 'optimizer': 'adam', 'graph_mode': 'off', 'use_snp_selection': True, 'num_snps': 58241}. Best is trial 13 with value: 0.21328478144868884.
[I 2025-12-05 19:32:03,219] Trial 19 finished with value: 0.2002091724947475 and parameters: {'model_type': 'mlp', 'hidden_dims': '[512, 256]', 'dropout': 0.32935937709168017, 'batch_norm': False, 'lr': 1.0436614786391874e-05, 'weight_decay': 1.1354159408743119e-07, 'epochs': 270, 'loss': 'mae', 'optimizer': 'adam', 'graph_mode': 'off', 'use_snp_selection': False}. Best is trial 13 with value: 0.21328478144868884.
[I 2025-12-05 19:32:54,974] Trial 20 finished with value: 0.20114198283188361 and parameters: {'model_type': 'mlp', 'hidden_dims': '[256, 128, 64]', 'dropout': 0.4450955313776808, 'batch_norm': False, 'lr': 2.9503582542947398e-05, 'weight_decay': 0.00013945447013175529, 'epochs': 342, 'loss': 'mae', 'optimizer': 'adam', 'graph_mode': 'off', 'use_snp_selection': False}. Best is trial 13 with value: 0.21328478144868884.
[I 2025-12-05 19:33:24,412] Trial 21 finished with value: 0.2071062022749836 and parameters: {'model_type': 'mlp', 'hidden_dims': '[128, 64]', 'dropout': 0.3321242340027305, 'batch_norm': False, 'lr': 2.527382470008408e-05, 'weight_decay': 0.0001164452033667714, 'epochs': 342, 'loss': 'mae', 'optimizer': 'adam', 'graph_mode': 'off', 'use_snp_selection': False}. Best is trial 13 with value: 0.21328478144868884.
[I 2025-12-05 19:33:54,419] Trial 22 finished with value: 0.2084569585679164 and parameters: {'model_type': 'mlp', 'hidden_dims': '[128, 64]', 'dropout': 0.2637824719824857, 'batch_norm': False, 'lr': 9.158330589306343e-06, 'weight_decay': 5.3345917686508766e-05, 'epochs': 347, 'loss': 'mae', 'optimizer': 'adam', 'graph_mode': 'off', 'use_snp_selection': False}. Best is trial 13 with value: 0.21328478144868884.
[I 2025-12-05 19:34:21,921] Trial 23 finished with value: 0.20606511759227578 and parameters: {'model_type': 'mlp', 'hidden_dims': '[128, 64]', 'dropout': 0.25730961542762315, 'batch_norm': False, 'lr': 5.483031362197907e-06, 'weight_decay': 0.00019734935881314015, 'epochs': 310, 'loss': 'mae', 'optimizer': 'adam', 'graph_mode': 'off', 'use_snp_selection': False}. Best is trial 13 with value: 0.21328478144868884.
[I 2025-12-05 19:34:51,908] Trial 24 finished with value: 0.20186263218040512 and parameters: {'model_type': 'mlp', 'hidden_dims': '[128, 64]', 'dropout': 0.5442935677554487, 'batch_norm': False, 'lr': 1.3096313257329068e-05, 'weight_decay': 7.155673581155691e-06, 'epochs': 350, 'loss': 'mae', 'optimizer': 'adam', 'graph_mode': 'off', 'use_snp_selection': False}. Best is trial 13 with value: 0.21328478144868884.
[I 2025-12-05 19:35:18,738] Trial 25 finished with value: 0.20417358976161276 and parameters: {'model_type': 'mlp', 'hidden_dims': '[128, 64]', 'dropout': 0.28797047501685, 'batch_norm': False, 'lr': 2.8045174154124853e-06, 'weight_decay': 0.0008835998501523608, 'epochs': 301, 'loss': 'mae', 'optimizer': 'adam', 'graph_mode': 'off', 'use_snp_selection': False}. Best is trial 13 with value: 0.21328478144868884.
[I 2025-12-05 19:35:50,331] Trial 26 finished with value: 0.18809857947926542 and parameters: {'model_type': 'mlp', 'hidden_dims': '[128, 64]', 'dropout': 0.45965971601117755, 'batch_norm': False, 'lr': 0.00012811659024298042, 'weight_decay': 7.942137495855486e-05, 'epochs': 266, 'loss': 'mae', 'optimizer': 'adam', 'graph_mode': 'off', 'use_snp_selection': True, 'num_snps': 3842}. Best is trial 13 with value: 0.21328478144868884.
[I 2025-12-05 19:36:11,019] Trial 27 finished with value: 0.19966253805040807 and parameters: {'model_type': 'mlp', 'hidden_dims': '[128, 64]', 'dropout': 0.37013513079903576, 'batch_norm': False, 'lr': 3.492621107657812e-05, 'weight_decay': 3.7728781986273995e-05, 'epochs': 220, 'loss': 'mse', 'optimizer': 'adam', 'graph_mode': 'off', 'use_snp_selection': False}. Best is trial 13 with value: 0.21328478144868884.
[I 2025-12-05 19:37:42,600] Trial 28 finished with value: 0.21436094055511412 and parameters: {'model_type': 'mlp', 'hidden_dims': '[512, 128]', 'dropout': 0.5446517125861267, 'batch_norm': False, 'lr': 6.613522594619988e-06, 'weight_decay': 0.00048490287780322843, 'epochs': 322, 'loss': 'mae', 'optimizer': 'adam', 'graph_mode': 'off', 'use_snp_selection': False}. Best is trial 28 with value: 0.21436094055511412.
[I 2025-12-05 19:38:43,520] Trial 29 finished with value: 0.21412161598589585 and parameters: {'model_type': 'mlp', 'hidden_dims': '[512, 128]', 'dropout': 0.5460250500409488, 'batch_norm': False, 'lr': 2.320440320155318e-06, 'weight_decay': 0.0005623252657736917, 'epochs': 318, 'loss': 'mae', 'optimizer': 'adam', 'graph_mode': 'off', 'use_snp_selection': True, 'num_snps': 19468}. Best is trial 28 with value: 0.21436094055511412.
[I 2025-12-05 19:39:40,090] Trial 30 finished with value: 0.19419155176589625 and parameters: {'model_type': 'mlp', 'hidden_dims': '[512, 128]', 'dropout': 0.5477189133737199, 'batch_norm': False, 'lr': 2.294644033025472e-06, 'weight_decay': 0.0005454150377288574, 'epochs': 292, 'loss': 'mae', 'optimizer': 'adam', 'graph_mode': 'off', 'use_snp_selection': True, 'num_snps': 18365}. Best is trial 28 with value: 0.21436094055511412.
[I 2025-12-05 19:40:42,740] Trial 31 finished with value: 0.17596340667116397 and parameters: {'model_type': 'mlp', 'hidden_dims': '[512, 128]', 'dropout': 0.5286523829942323, 'batch_norm': False, 'lr': 1.0044778570963268e-06, 'weight_decay': 0.0004977409337433253, 'epochs': 326, 'loss': 'mae', 'optimizer': 'adam', 'graph_mode': 'off', 'use_snp_selection': True, 'num_snps': 20689}. Best is trial 28 with value: 0.21436094055511412.
[I 2025-12-05 19:41:46,064] Trial 32 finished with value: 0.20413101601767067 and parameters: {'model_type': 'mlp', 'hidden_dims': '[512, 128]', 'dropout': 0.56410572201039, 'batch_norm': False, 'lr': 5.6246951144556525e-06, 'weight_decay': 0.00020029633201499987, 'epochs': 322, 'loss': 'mae', 'optimizer': 'adam', 'graph_mode': 'off', 'use_snp_selection': True, 'num_snps': 20754}. Best is trial 28 with value: 0.21436094055511412.
[I 2025-12-05 19:43:38,366] Trial 33 finished with value: 0.2046562571053061 and parameters: {'model_type': 'mlp', 'hidden_dims': '[512, 128]', 'dropout': 0.46819797531061047, 'batch_norm': False, 'lr': 6.456658537413445e-06, 'weight_decay': 0.0009130620026113817, 'epochs': 327, 'loss': 'mae', 'optimizer': 'adam', 'graph_mode': 'off', 'use_snp_selection': True, 'num_snps': 50127}. Best is trial 28 with value: 0.21436094055511412.
[I 2025-12-05 19:44:11,249] Trial 34 finished with value: 0.14054600045454707 and parameters: {'model_type': 'mlp', 'hidden_dims': '[256, 128, 64]', 'dropout': 0.5177219572176189, 'batch_norm': False, 'lr': 3.6302042512416126e-06, 'weight_decay': 0.00028412121137622926, 'epochs': 260, 'loss': 'mae', 'optimizer': 'adam', 'graph_mode': 'off', 'use_snp_selection': True, 'num_snps': 4311}. Best is trial 28 with value: 0.21436094055511412.
[I 2025-12-05 19:45:13,287] Trial 35 finished with value: 0.16564524170094505 and parameters: {'model_type': 'mlp', 'hidden_dims': '[512, 128]', 'dropout': 0.4329020994100405, 'batch_norm': True, 'lr': 1.7842556898236096e-06, 'weight_decay': 1.0875537767249956e-05, 'epochs': 223, 'loss': 'mae', 'optimizer': 'adam', 'graph_mode': 'off', 'use_snp_selection': True, 'num_snps': 26222}. Best is trial 28 with value: 0.21436094055511412.
[I 2025-12-05 19:46:34,303] Trial 36 finished with value: 0.2098740674685719 and parameters: {'model_type': 'mlp', 'hidden_dims': '[512, 128]', 'dropout': 0.5685897409164987, 'batch_norm': False, 'lr': 4.057514474210237e-06, 'weight_decay': 0.0001933363794978441, 'epochs': 283, 'loss': 'mse', 'optimizer': 'adam', 'graph_mode': 'off', 'use_snp_selection': False}. Best is trial 28 with value: 0.21436094055511412.
[I 2025-12-05 19:48:07,969] Trial 37 finished with value: 0.21667412311547 and parameters: {'model_type': 'mlp', 'hidden_dims': '[512, 256]', 'dropout': 0.4084621039174515, 'batch_norm': False, 'lr': 6.708270909821364e-06, 'weight_decay': 6.633903868747104e-05, 'epochs': 328, 'loss': 'mae', 'optimizer': 'adam', 'graph_mode': 'off', 'use_snp_selection': True, 'num_snps': 38290}. Best is trial 37 with value: 0.21667412311547.
[I 2025-12-05 19:49:41,622] Trial 38 finished with value: 0.1858499055520578 and parameters: {'model_type': 'mlp', 'hidden_dims': '[512, 256]', 'dropout': 0.4261899706455253, 'batch_norm': True, 'lr': 6.417947020163857e-06, 'weight_decay': 2.750535623284633e-05, 'epochs': 297, 'loss': 'mse', 'optimizer': 'adam', 'graph_mode': 'off', 'use_snp_selection': True, 'num_snps': 41468}. Best is trial 37 with value: 0.21667412311547.
[I 2025-12-05 19:50:39,846] Trial 39 finished with value: 0.20136497607706336 and parameters: {'model_type': 'mlp', 'hidden_dims': '[512, 256]', 'dropout': 0.4017956077686543, 'batch_norm': False, 'lr': 2.604189080514011e-06, 'weight_decay': 0.00043493546976713866, 'epochs': 172, 'loss': 'mae', 'optimizer': 'adam', 'graph_mode': 'off', 'use_snp_selection': True, 'num_snps': 28463}. Best is trial 37 with value: 0.21667412311547.
[I 2025-12-05 19:51:50,228] Trial 40 finished with value: 0.15120582685552358 and parameters: {'model_type': 'mlp', 'hidden_dims': '[512, 256]', 'dropout': 0.4731500618077674, 'batch_norm': True, 'lr': 1.050939837365623e-06, 'weight_decay': 1.4284368507012146e-05, 'epochs': 123, 'loss': 'mae', 'optimizer': 'adam', 'graph_mode': 'off', 'use_snp_selection': True, 'num_snps': 49123}. Best is trial 37 with value: 0.21667412311547.
[I 2025-12-05 19:52:43,257] Trial 41 finished with value: 0.22846476711178365 and parameters: {'model_type': 'mlp', 'hidden_dims': '[512, 128]', 'dropout': 0.5051340250664098, 'batch_norm': False, 'lr': 1.2930347187842621e-05, 'weight_decay': 7.72682288863197e-05, 'epochs': 329, 'loss': 'mae', 'optimizer': 'adam', 'graph_mode': 'off', 'use_snp_selection': True, 'num_snps': 14441}. Best is trial 41 with value: 0.22846476711178365.
[I 2025-12-05 19:53:32,701] Trial 42 finished with value: 0.22522536398296467 and parameters: {'model_type': 'mlp', 'hidden_dims': '[512, 128]', 'dropout': 0.5020115592730617, 'batch_norm': False, 'lr': 1.152587343829186e-05, 'weight_decay': 6.238753807419773e-05, 'epochs': 318, 'loss': 'mae', 'optimizer': 'adam', 'graph_mode': 'off', 'use_snp_selection': True, 'num_snps': 12788}. Best is trial 41 with value: 0.22846476711178365.
[I 2025-12-05 19:54:22,197] Trial 43 finished with value: 0.22757273776542353 and parameters: {'model_type': 'mlp', 'hidden_dims': '[512, 128]', 'dropout': 0.5638956347533034, 'batch_norm': False, 'lr': 4.531041206323444e-06, 'weight_decay': 0.0006378543578183854, 'epochs': 328, 'loss': 'mae', 'optimizer': 'adam', 'graph_mode': 'off', 'use_snp_selection': True, 'num_snps': 12453}. Best is trial 41 with value: 0.22846476711178365.
[I 2025-12-05 19:55:07,576] Trial 44 finished with value: 0.20522254025605352 and parameters: {'model_type': 'mlp', 'hidden_dims': '[512, 128]', 'dropout': 0.5983298255456665, 'batch_norm': False, 'lr': 5.0321291446477866e-06, 'weight_decay': 3.407682085293314e-05, 'epochs': 330, 'loss': 'mae', 'optimizer': 'adam', 'graph_mode': 'off', 'use_snp_selection': True, 'num_snps': 10321}. Best is trial 41 with value: 0.22846476711178365.
[I 2025-12-05 19:55:54,671] Trial 45 finished with value: 0.2120005820751917 and parameters: {'model_type': 'mlp', 'hidden_dims': '[512, 128]', 'dropout': 0.5151791974693987, 'batch_norm': False, 'lr': 4.053098770874274e-05, 'weight_decay': 0.00026500661743495996, 'epochs': 313, 'loss': 'mse', 'optimizer': 'adam', 'graph_mode': 'off', 'use_snp_selection': True, 'num_snps': 11861}. Best is trial 41 with value: 0.22846476711178365.
[I 2025-12-05 19:56:45,272] Trial 46 finished with value: 0.2131910417107581 and parameters: {'model_type': 'mlp', 'hidden_dims': '[512, 128]', 'dropout': 0.5631970301671999, 'batch_norm': True, 'lr': 1.2213168759113258e-05, 'weight_decay': 1.872463365412672e-05, 'epochs': 278, 'loss': 'mae', 'optimizer': 'adam', 'graph_mode': 'off', 'use_snp_selection': True, 'num_snps': 15198}. Best is trial 41 with value: 0.22846476711178365.
[I 2025-12-05 19:57:26,631] Trial 47 finished with value: 0.1985093556568442 and parameters: {'model_type': 'mlp', 'hidden_dims': '[512, 128]', 'dropout': 0.3709203811910538, 'batch_norm': False, 'lr': 2.1530947509017554e-05, 'weight_decay': 3.2040662388231857e-06, 'epochs': 332, 'loss': 'mae', 'optimizer': 'adam', 'graph_mode': 'off', 'use_snp_selection': True, 'num_snps': 7370}. Best is trial 41 with value: 0.22846476711178365.
[I 2025-12-05 19:58:27,264] Trial 48 finished with value: 0.21683114475093754 and parameters: {'model_type': 'mlp', 'hidden_dims': '[256, 128]', 'dropout': 0.44915331893471333, 'batch_norm': False, 'lr': 8.283279098151454e-06, 'weight_decay': 0.00013991304017669045, 'epochs': 309, 'loss': 'mae', 'optimizer': 'adam', 'graph_mode': 'off', 'use_snp_selection': True, 'num_snps': 33643}. Best is trial 41 with value: 0.22846476711178365.
[I 2025-12-05 19:59:10,758] Trial 49 finished with value: 0.19187630284787607 and parameters: {'model_type': 'mlp', 'hidden_dims': '[256, 128]', 'dropout': 0.4185274578403254, 'batch_norm': False, 'lr': 8.756746527058838e-06, 'weight_decay': 0.00014738859235884666, 'epochs': 47, 'loss': 'mse', 'optimizer': 'adam', 'graph_mode': 'off', 'use_snp_selection': True, 'num_snps': 34795}. Best is trial 41 with value: 0.22846476711178365.
[I 2025-12-05 20:00:01,355] Trial 50 finished with value: 0.22668248168734392 and parameters: {'model_type': 'mlp', 'hidden_dims': '[256, 128]', 'dropout': 0.4799334224453928, 'batch_norm': False, 'lr': 1.5714386518809898e-05, 'weight_decay': 6.0903019444301945e-05, 'epochs': 254, 'loss': 'mae', 'optimizer': 'adam', 'graph_mode': 'off', 'use_snp_selection': True, 'num_snps': 25650}. Best is trial 41 with value: 0.22846476711178365.
[I 2025-12-05 20:00:55,002] Trial 51 finished with value: 0.22091727341020947 and parameters: {'model_type': 'mlp', 'hidden_dims': '[256, 128]', 'dropout': 0.453466923673246, 'batch_norm': False, 'lr': 1.521160372208013e-05, 'weight_decay': 5.484588709094227e-05, 'epochs': 309, 'loss': 'mae', 'optimizer': 'adam', 'graph_mode': 'off', 'use_snp_selection': True, 'num_snps': 25353}. Best is trial 41 with value: 0.22846476711178365.
[I 2025-12-05 20:01:44,302] Trial 52 finished with value: 0.21630959823245238 and parameters: {'model_type': 'mlp', 'hidden_dims': '[256, 128]', 'dropout': 0.4548243596310757, 'batch_norm': False, 'lr': 1.584477263485813e-05, 'weight_decay': 5.077786654394466e-05, 'epochs': 254, 'loss': 'mae', 'optimizer': 'adam', 'graph_mode': 'off', 'use_snp_selection': True, 'num_snps': 24070}. Best is trial 41 with value: 0.22846476711178365.
[I 2025-12-05 20:02:38,371] Trial 53 finished with value: 0.20621593315415448 and parameters: {'model_type': 'mlp', 'hidden_dims': '[256, 128]', 'dropout': 0.49706704695390846, 'batch_norm': False, 'lr': 2.3524871988475994e-05, 'weight_decay': 8.819775738681347e-05, 'epochs': 238, 'loss': 'mae', 'optimizer': 'adam', 'graph_mode': 'off', 'use_snp_selection': True, 'num_snps': 30828}. Best is trial 41 with value: 0.22846476711178365.
[I 2025-12-05 20:03:21,515] Trial 54 finished with value: 0.23016374487429067 and parameters: {'model_type': 'mlp', 'hidden_dims': '[256, 128]', 'dropout': 0.4822544421755707, 'batch_norm': False, 'lr': 1.1073398368769954e-05, 'weight_decay': 3.0492167385794565e-05, 'epochs': 305, 'loss': 'mae', 'optimizer': 'adam', 'graph_mode': 'off', 'use_snp_selection': True, 'num_snps': 14569}. Best is trial 54 with value: 0.23016374487429067.
[I 2025-12-05 20:04:04,512] Trial 55 finished with value: 0.2239175364498763 and parameters: {'model_type': 'mlp', 'hidden_dims': '[256, 128]', 'dropout': 0.5137119079473013, 'batch_norm': False, 'lr': 7.299544893421003e-05, 'weight_decay': 2.6197629846148934e-05, 'epochs': 275, 'loss': 'mae', 'optimizer': 'adam', 'graph_mode': 'off', 'use_snp_selection': True, 'num_snps': 15906}. Best is trial 54 with value: 0.23016374487429067.
[I 2025-12-05 20:04:46,525] Trial 56 finished with value: 0.21293425884830192 and parameters: {'model_type': 'mlp', 'hidden_dims': '[256, 128]', 'dropout': 0.4794025950785224, 'batch_norm': False, 'lr': 0.0006009351673196924, 'weight_decay': 2.6460448577127118e-05, 'epochs': 278, 'loss': 'mae', 'optimizer': 'adam', 'graph_mode': 'off', 'use_snp_selection': True, 'num_snps': 14839}. Best is trial 54 with value: 0.23016374487429067.
[I 2025-12-05 20:05:38,175] Trial 57 finished with value: 0.23764430199362083 and parameters: {'model_type': 'mlp', 'hidden_dims': '[512, 64]', 'dropout': 0.5097116152680063, 'batch_norm': True, 'lr': 9.293286169568416e-05, 'weight_decay': 7.587923730778985e-06, 'epochs': 288, 'loss': 'mae', 'optimizer': 'adam', 'graph_mode': 'off', 'use_snp_selection': True, 'num_snps': 15440}. Best is trial 57 with value: 0.23764430199362083.
