[I 2025-12-05 19:38:21,830] Trial 59 finished with value: 0.2531206863438095 and parameters: {'model_type': 'mlp', 'hidden_dims': '[128, 64]', 'dropout': 0.5772467466749612, 'batch_norm': False, 'lr': 7.162139927057279e-05, 'weight_decay': 7.880215732164159e-07, 'epochs': 203, 'loss': 'mae', 'optimizer': 'adam', 'graph_mode': 'off', 'use_snp_selection': False}. Best is trial 47 with value: 0.27473222670638264.
[I 2025-12-05 19:38:40,876] Trial 60 finished with value: 0.2568084553065755 and parameters: {'model_type': 'mlp', 'hidden_dims': '[128, 64]', 'dropout': 0.5470514255658491, 'batch_norm': False, 'lr': 9.440827178484153e-05, 'weight_decay': 1.6583185824298317e-07, 'epochs': 191, 'loss': 'mae', 'optimizer': 'adam', 'graph_mode': 'off', 'use_snp_selection': False}. Best is trial 47 with value: 0.27473222670638264.
[I 2025-12-05 19:38:58,079] Trial 61 finished with value: 0.26474263787002206 and parameters: {'model_type': 'mlp', 'hidden_dims': '[128, 64]', 'dropout': 0.505631785229657, 'batch_norm': False, 'lr': 2.7882145943434233e-05, 'weight_decay': 2.4729118341526483e-07, 'epochs': 163, 'loss': 'mae', 'optimizer': 'adam', 'graph_mode': 'off', 'use_snp_selection': False}. Best is trial 47 with value: 0.27473222670638264.
[I 2025-12-05 19:39:14,821] Trial 62 finished with value: 0.258014670982931 and parameters: {'model_type': 'mlp', 'hidden_dims': '[128, 64]', 'dropout': 0.5083363597566964, 'batch_norm': False, 'lr': 4.4790190447245664e-05, 'weight_decay': 2.3701503882329502e-07, 'epochs': 157, 'loss': 'mae', 'optimizer': 'adam', 'graph_mode': 'off', 'use_snp_selection': False}. Best is trial 47 with value: 0.27473222670638264.
[I 2025-12-05 19:39:32,320] Trial 63 finished with value: 0.2609394352948645 and parameters: {'model_type': 'mlp', 'hidden_dims': '[128, 64]', 'dropout': 0.5373391117368673, 'batch_norm': False, 'lr': 2.341133849226377e-05, 'weight_decay': 4.4100674329990466e-07, 'epochs': 167, 'loss': 'mae', 'optimizer': 'adam', 'graph_mode': 'off', 'use_snp_selection': False}. Best is trial 47 with value: 0.27473222670638264.
[I 2025-12-05 19:39:52,583] Trial 64 finished with value: 0.24749999419477803 and parameters: {'model_type': 'mlp', 'hidden_dims': '[128, 64]', 'dropout': 0.4474154799692478, 'batch_norm': False, 'lr': 2.8667033758490088e-05, 'weight_decay': 1.2723195889773728e-07, 'epochs': 207, 'loss': 'mae', 'optimizer': 'adam', 'graph_mode': 'off', 'use_snp_selection': False}. Best is trial 47 with value: 0.27473222670638264.
[I 2025-12-05 19:40:14,551] Trial 65 finished with value: 0.2586739671575343 and parameters: {'model_type': 'mlp', 'hidden_dims': '[128, 64]', 'dropout': 0.48110362597931167, 'batch_norm': False, 'lr': 2.0472499783452396e-05, 'weight_decay': 2.2710956666294787e-07, 'epochs': 230, 'loss': 'mae', 'optimizer': 'adam', 'graph_mode': 'off', 'use_snp_selection': False}. Best is trial 47 with value: 0.27473222670638264.
[I 2025-12-05 19:40:33,763] Trial 66 finished with value: 0.24979878789195564 and parameters: {'model_type': 'mlp', 'hidden_dims': '[128, 64]', 'dropout': 0.5276090455215546, 'batch_norm': False, 'lr': 6.273990895731057e-05, 'weight_decay': 7.807594955337802e-07, 'epochs': 194, 'loss': 'mae', 'optimizer': 'adam', 'graph_mode': 'off', 'use_snp_selection': False}. Best is trial 47 with value: 0.27473222670638264.
[I 2025-12-05 19:41:28,334] Trial 67 finished with value: 0.24138077904613428 and parameters: {'model_type': 'mlp', 'hidden_dims': '[512, 128]', 'dropout': 0.5991341049333548, 'batch_norm': False, 'lr': 3.627777973027144e-05, 'weight_decay': 1.0191115843864636e-07, 'epochs': 186, 'loss': 'mae', 'optimizer': 'adam', 'graph_mode': 'off', 'use_snp_selection': True, 'num_snps': 22951}. Best is trial 47 with value: 0.27473222670638264.
[I 2025-12-05 19:41:45,309] Trial 68 finished with value: 0.2541711751559885 and parameters: {'model_type': 'mlp', 'hidden_dims': '[128, 64]', 'dropout': 0.4236388707308323, 'batch_norm': False, 'lr': 2.8378189630691448e-05, 'weight_decay': 3.4490999337011725e-07, 'epochs': 162, 'loss': 'mse', 'optimizer': 'adam', 'graph_mode': 'off', 'use_snp_selection': False}. Best is trial 47 with value: 0.27473222670638264.
[I 2025-12-05 19:42:03,326] Trial 69 finished with value: 0.2589724922327068 and parameters: {'model_type': 'mlp', 'hidden_dims': '[128, 64]', 'dropout': 0.5692595050909567, 'batch_norm': False, 'lr': 1.4396104152971498e-05, 'weight_decay': 5.939680088867887e-07, 'epochs': 175, 'loss': 'mae', 'optimizer': 'adam', 'graph_mode': 'off', 'use_snp_selection': False}. Best is trial 47 with value: 0.27473222670638264.
[I 2025-12-05 19:42:23,086] Trial 70 finished with value: 0.26101216277281597 and parameters: {'model_type': 'mlp', 'hidden_dims': '[128, 64]', 'dropout': 0.5040872997982603, 'batch_norm': False, 'lr': 1.072643464857857e-05, 'weight_decay': 1.459655597217003e-07, 'epochs': 199, 'loss': 'mae', 'optimizer': 'adam', 'graph_mode': 'off', 'use_snp_selection': False}. Best is trial 47 with value: 0.27473222670638264.
[I 2025-12-05 19:42:42,933] Trial 71 finished with value: 0.2562438558830946 and parameters: {'model_type': 'mlp', 'hidden_dims': '[128, 64]', 'dropout': 0.5084250981899506, 'batch_norm': False, 'lr': 1.0456127065661444e-05, 'weight_decay': 1.4966418735129604e-07, 'epochs': 200, 'loss': 'mae', 'optimizer': 'adam', 'graph_mode': 'off', 'use_snp_selection': False}. Best is trial 47 with value: 0.27473222670638264.
[I 2025-12-05 19:43:03,493] Trial 72 finished with value: 0.24922134231999005 and parameters: {'model_type': 'mlp', 'hidden_dims': '[128, 64]', 'dropout': 0.5476090956802323, 'batch_norm': False, 'lr': 1.0180242723514924e-05, 'weight_decay': 1.9300198481680223e-07, 'epochs': 210, 'loss': 'mae', 'optimizer': 'adam', 'graph_mode': 'off', 'use_snp_selection': False}. Best is trial 47 with value: 0.27473222670638264.
[I 2025-12-05 19:43:19,520] Trial 73 finished with value: 0.2615182693745554 and parameters: {'model_type': 'mlp', 'hidden_dims': '[128, 64]', 'dropout': 0.4623426007299085, 'batch_norm': False, 'lr': 2.07720581955834e-05, 'weight_decay': 2.6577843747921925e-07, 'epochs': 146, 'loss': 'mae', 'optimizer': 'adam', 'graph_mode': 'off', 'use_snp_selection': False}. Best is trial 47 with value: 0.27473222670638264.
[I 2025-12-05 19:43:35,560] Trial 74 finished with value: 0.2665191888425624 and parameters: {'model_type': 'mlp', 'hidden_dims': '[128, 64]', 'dropout': 0.4610130835670138, 'batch_norm': False, 'lr': 1.98475700096235e-05, 'weight_decay': 2.8782073123767855e-07, 'epochs': 146, 'loss': 'mae', 'optimizer': 'adam', 'graph_mode': 'off', 'use_snp_selection': False}. Best is trial 47 with value: 0.27473222670638264.
[I 2025-12-05 19:44:21,420] Trial 75 finished with value: 0.26622521986955666 and parameters: {'model_type': 'mlp', 'hidden_dims': '[512, 256]', 'dropout': 0.4593791486332582, 'batch_norm': False, 'lr': 2.027988274743414e-05, 'weight_decay': 3.183345151580299e-07, 'epochs': 145, 'loss': 'mae', 'optimizer': 'adam', 'graph_mode': 'off', 'use_snp_selection': False}. Best is trial 47 with value: 0.27473222670638264.
[I 2025-12-05 19:45:08,044] Trial 76 finished with value: 0.23118732733396988 and parameters: {'model_type': 'mlp', 'hidden_dims': '[512, 256]', 'dropout': 0.3951252578359776, 'batch_norm': False, 'lr': 0.0009309583255880276, 'weight_decay': 1.1383771250309075e-06, 'epochs': 150, 'loss': 'mae', 'optimizer': 'adam', 'graph_mode': 'off', 'use_snp_selection': False}. Best is trial 47 with value: 0.27473222670638264.
[I 2025-12-05 19:45:53,464] Trial 77 finished with value: 0.2320223437732311 and parameters: {'model_type': 'mlp', 'hidden_dims': '[512, 256]', 'dropout': 0.48780435028042907, 'batch_norm': True, 'lr': 1.4799417617700502e-05, 'weight_decay': 2.934504985030709e-07, 'epochs': 140, 'loss': 'mae', 'optimizer': 'adam', 'graph_mode': 'off', 'use_snp_selection': False}. Best is trial 47 with value: 0.27473222670638264.
[I 2025-12-05 19:46:39,715] Trial 78 finished with value: 0.2535168582772118 and parameters: {'model_type': 'mlp', 'hidden_dims': '[512, 256]', 'dropout': 0.42996276300742026, 'batch_norm': False, 'lr': 1.8808443817508752e-05, 'weight_decay': 4.041924902516236e-07, 'epochs': 146, 'loss': 'mae', 'optimizer': 'adam', 'graph_mode': 'off', 'use_snp_selection': False}. Best is trial 47 with value: 0.27473222670638264.
[I 2025-12-05 19:47:12,724] Trial 79 finished with value: 0.23118654250118476 and parameters: {'model_type': 'mlp', 'hidden_dims': '[512, 256]', 'dropout': 0.4693445389619433, 'batch_norm': False, 'lr': 7.754145369263814e-06, 'weight_decay': 4.89036654440655e-07, 'epochs': 163, 'loss': 'mae', 'optimizer': 'adam', 'graph_mode': 'off', 'use_snp_selection': True, 'num_snps': 3769}. Best is trial 47 with value: 0.27473222670638264.
[I 2025-12-05 19:47:54,832] Trial 80 finished with value: 0.24964561813250458 and parameters: {'model_type': 'mlp', 'hidden_dims': '[512, 64]', 'dropout': 0.44968299231970366, 'batch_norm': False, 'lr': 3.835159204609192e-05, 'weight_decay': 6.59010292873486e-07, 'epochs': 133, 'loss': 'mae', 'optimizer': 'adam', 'graph_mode': 'off', 'use_snp_selection': False}. Best is trial 47 with value: 0.27473222670638264.
[I 2025-12-05 19:48:11,558] Trial 81 finished with value: 0.2630013936886858 and parameters: {'model_type': 'mlp', 'hidden_dims': '[128, 64]', 'dropout': 0.4614415577231893, 'batch_norm': False, 'lr': 2.151093909980511e-05, 'weight_decay': 2.482297424605565e-07, 'epochs': 156, 'loss': 'mae', 'optimizer': 'adam', 'graph_mode': 'off', 'use_snp_selection': False}. Best is trial 47 with value: 0.27473222670638264.
[I 2025-12-05 19:48:39,250] Trial 82 finished with value: 0.26282648623186633 and parameters: {'model_type': 'mlp', 'hidden_dims': '[256, 128]', 'dropout': 0.49354408719878834, 'batch_norm': False, 'lr': 2.7835000783926662e-05, 'weight_decay': 2.2921064915438308e-07, 'epochs': 157, 'loss': 'mae', 'optimizer': 'adam', 'graph_mode': 'off', 'use_snp_selection': False}. Best is trial 47 with value: 0.27473222670638264.
[I 2025-12-05 19:49:09,017] Trial 83 finished with value: 0.2613310079028699 and parameters: {'model_type': 'mlp', 'hidden_dims': '[256, 128]', 'dropout': 0.5202365765203012, 'batch_norm': False, 'lr': 2.761742552844639e-05, 'weight_decay': 2.2035811165658902e-07, 'epochs': 172, 'loss': 'mae', 'optimizer': 'adam', 'graph_mode': 'off', 'use_snp_selection': False}. Best is trial 47 with value: 0.27473222670638264.
[I 2025-12-05 19:49:36,845] Trial 84 finished with value: 0.26259614887800703 and parameters: {'model_type': 'mlp', 'hidden_dims': '[256, 128]', 'dropout': 0.4923757848293242, 'batch_norm': False, 'lr': 1.4483245274446966e-05, 'weight_decay': 3.220825490633205e-07, 'epochs': 156, 'loss': 'mae', 'optimizer': 'adam', 'graph_mode': 'off', 'use_snp_selection': False}. Best is trial 47 with value: 0.27473222670638264.
[I 2025-12-05 19:50:00,584] Trial 85 finished with value: 0.26906341284015867 and parameters: {'model_type': 'mlp', 'hidden_dims': '[256, 128]', 'dropout': 0.43630490441146924, 'batch_norm': False, 'lr': 1.271847428385729e-05, 'weight_decay': 1.1640832994766757e-06, 'epochs': 126, 'loss': 'mae', 'optimizer': 'adam', 'graph_mode': 'off', 'use_snp_selection': False}. Best is trial 47 with value: 0.27473222670638264.
[I 2025-12-05 19:50:24,943] Trial 86 finished with value: 0.25505391418274376 and parameters: {'model_type': 'mlp', 'hidden_dims': '[256, 128]', 'dropout': 0.4403102881365536, 'batch_norm': False, 'lr': 9.377383613837e-06, 'weight_decay': 5.456056974253127e-07, 'epochs': 130, 'loss': 'mse', 'optimizer': 'adam', 'graph_mode': 'off', 'use_snp_selection': False}. Best is trial 47 with value: 0.27473222670638264.
[I 2025-12-05 19:51:02,787] Trial 87 finished with value: 0.2612908254547003 and parameters: {'model_type': 'mlp', 'hidden_dims': '[512, 128]', 'dropout': 0.414953903023849, 'batch_norm': False, 'lr': 1.2817829604628322e-05, 'weight_decay': 1.2877830306371236e-06, 'epochs': 114, 'loss': 'mae', 'optimizer': 'adam', 'graph_mode': 'off', 'use_snp_selection': False}. Best is trial 47 with value: 0.27473222670638264.
[I 2025-12-05 19:51:58,178] Trial 88 finished with value: 0.26473013343577145 and parameters: {'model_type': 'mlp', 'hidden_dims': '[512, 256]', 'dropout': 0.48044450377597003, 'batch_norm': False, 'lr': 6.696444861061072e-06, 'weight_decay': 1.8790146937361171e-06, 'epochs': 178, 'loss': 'mae', 'optimizer': 'adam', 'graph_mode': 'off', 'use_snp_selection': False}. Best is trial 47 with value: 0.27473222670638264.
[I 2025-12-05 19:52:43,242] Trial 89 finished with value: 0.2564214935855962 and parameters: {'model_type': 'mlp', 'hidden_dims': '[512, 256]', 'dropout': 0.45288695597452844, 'batch_norm': False, 'lr': 1.791399401363011e-05, 'weight_decay': 3.071196531477895e-06, 'epochs': 141, 'loss': 'mae', 'optimizer': 'adam', 'graph_mode': 'off', 'use_snp_selection': False}. Best is trial 47 with value: 0.27473222670638264.
[I 2025-12-05 19:53:38,802] Trial 90 finished with value: 0.23738596126247574 and parameters: {'model_type': 'mlp', 'hidden_dims': '[512, 256]', 'dropout': 0.4786176604518926, 'batch_norm': True, 'lr': 6.762488118658135e-06, 'weight_decay': 8.960592233607173e-07, 'epochs': 177, 'loss': 'mae', 'optimizer': 'adam', 'graph_mode': 'off', 'use_snp_selection': False}. Best is trial 47 with value: 0.27473222670638264.
[I 2025-12-05 19:54:37,415] Trial 91 finished with value: 0.2747815494022535 and parameters: {'model_type': 'mlp', 'hidden_dims': '[512, 256]', 'dropout': 0.514302260681105, 'batch_norm': False, 'lr': 5.048236564564359e-06, 'weight_decay': 1.3508135677052825e-07, 'epochs': 190, 'loss': 'mae', 'optimizer': 'adam', 'graph_mode': 'off', 'use_snp_selection': False}. Best is trial 91 with value: 0.2747815494022535.
[I 2025-12-05 19:55:30,121] Trial 92 finished with value: 0.2650605177913229 and parameters: {'model_type': 'mlp', 'hidden_dims': '[512, 256]', 'dropout': 0.47937518284253683, 'batch_norm': False, 'lr': 4.500175846663213e-06, 'weight_decay': 3.743174482229987e-07, 'epochs': 168, 'loss': 'mae', 'optimizer': 'adam', 'graph_mode': 'off', 'use_snp_selection': False}. Best is trial 91 with value: 0.2747815494022535.
[I 2025-12-05 19:56:22,791] Trial 93 finished with value: 0.254569705472255 and parameters: {'model_type': 'mlp', 'hidden_dims': '[512, 256]', 'dropout': 0.5289544786408054, 'batch_norm': False, 'lr': 4.4597923526405e-06, 'weight_decay': 1.7049605457361636e-06, 'epochs': 168, 'loss': 'mae', 'optimizer': 'adam', 'graph_mode': 'off', 'use_snp_selection': False}. Best is trial 91 with value: 0.2747815494022535.
[I 2025-12-05 19:57:28,674] Trial 94 finished with value: 0.262290145022796 and parameters: {'model_type': 'mlp', 'hidden_dims': '[512, 256]', 'dropout': 0.5124816162494766, 'batch_norm': False, 'lr': 3.9727667992425655e-06, 'weight_decay': 4.680644664645592e-06, 'epochs': 217, 'loss': 'mae', 'optimizer': 'adam', 'graph_mode': 'off', 'use_snp_selection': False}. Best is trial 91 with value: 0.2747815494022535.
[I 2025-12-05 19:58:26,287] Trial 95 finished with value: 0.258442380747746 and parameters: {'model_type': 'mlp', 'hidden_dims': '[512, 256]', 'dropout': 0.4795945036316257, 'batch_norm': False, 'lr': 5.339693112857546e-06, 'weight_decay': 1.2905183466553106e-07, 'epochs': 186, 'loss': 'mae', 'optimizer': 'adam', 'graph_mode': 'off', 'use_snp_selection': False}. Best is trial 91 with value: 0.2747815494022535.
[I 2025-12-05 19:59:38,255] Trial 96 finished with value: 0.26472707486504216 and parameters: {'model_type': 'mlp', 'hidden_dims': '[512, 256]', 'dropout': 0.5007844444285948, 'batch_norm': False, 'lr': 2.072488180584776e-06, 'weight_decay': 3.8378657665347485e-07, 'epochs': 126, 'loss': 'mae', 'optimizer': 'adam', 'graph_mode': 'off', 'use_snp_selection': True, 'num_snps': 48962}. Best is trial 91 with value: 0.2747815494022535.
[I 2025-12-05 20:00:48,693] Trial 97 finished with value: 0.24365895064076418 and parameters: {'model_type': 'mlp', 'hidden_dims': '[512, 256]', 'dropout': 0.43932646980012063, 'batch_norm': False, 'lr': 2.396508936363361e-06, 'weight_decay': 1.8761289858528757e-06, 'epochs': 127, 'loss': 'mae', 'optimizer': 'adam', 'graph_mode': 'off', 'use_snp_selection': True, 'num_snps': 47412}. Best is trial 91 with value: 0.2747815494022535.
[I 2025-12-05 20:01:47,616] Trial 98 finished with value: 0.2236297730562134 and parameters: {'model_type': 'mlp', 'hidden_dims': '[512, 256]', 'dropout': 0.4988517643598635, 'batch_norm': False, 'lr': 1.594821306689662e-06, 'weight_decay': 3.701122318224231e-07, 'epochs': 106, 'loss': 'mse', 'optimizer': 'adam', 'graph_mode': 'off', 'use_snp_selection': True, 'num_snps': 38196}. Best is trial 91 with value: 0.2747815494022535.
[I 2025-12-05 20:02:58,686] Trial 99 finished with value: 0.23996794087051937 and parameters: {'model_type': 'mlp', 'hidden_dims': '[512, 256]', 'dropout': 0.48556929521666975, 'batch_norm': False, 'lr': 0.00035304358015944424, 'weight_decay': 7.036405015335647e-07, 'epochs': 119, 'loss': 'mae', 'optimizer': 'adam', 'graph_mode': 'off', 'use_snp_selection': True, 'num_snps': 51063}. Best is trial 91 with value: 0.2747815494022535.
[I 2025-12-05 20:04:19,546] Trial 100 finished with value: 0.20928867321386718 and parameters: {'model_type': 'mlp', 'hidden_dims': '[512, 256]', 'dropout': 0.5183966006767415, 'batch_norm': False, 'lr': 1.2019021699833616e-06, 'weight_decay': 4.1220357364233186e-07, 'epochs': 149, 'loss': 'mae', 'optimizer': 'adam', 'graph_mode': 'off', 'use_snp_selection': True, 'num_snps': 53641}. Best is trial 91 with value: 0.2747815494022535.
[I 2025-12-05 20:05:28,361] Trial 101 finished with value: 0.27034920476931823 and parameters: {'model_type': 'mlp', 'hidden_dims': '[512, 256]', 'dropout': 0.4677300179227649, 'batch_norm': False, 'lr': 3.1462088342539664e-06, 'weight_decay': 1.31448272308991e-07, 'epochs': 162, 'loss': 'mae', 'optimizer': 'adam', 'graph_mode': 'off', 'use_snp_selection': True, 'num_snps': 39482}. Best is trial 91 with value: 0.2747815494022535.
[I 2025-12-05 20:06:41,690] Trial 102 finished with value: 0.25232990805297806 and parameters: {'model_type': 'mlp', 'hidden_dims': '[512, 256]', 'dropout': 0.4735422400915189, 'batch_norm': False, 'lr': 3.5010747743310946e-06, 'weight_decay': 1.902469088866934e-07, 'epochs': 180, 'loss': 'mae', 'optimizer': 'adam', 'graph_mode': 'off', 'use_snp_selection': True, 'num_snps': 40769}. Best is trial 91 with value: 0.2747815494022535.
[I 2025-12-05 20:07:38,655] Trial 103 finished with value: 0.2546390724168794 and parameters: {'model_type': 'mlp', 'hidden_dims': '[512, 256]', 'dropout': 0.45357033310982536, 'batch_norm': False, 'lr': 1.9426684029574234e-06, 'weight_decay': 6.569722253625203e-06, 'epochs': 166, 'loss': 'mae', 'optimizer': 'adam', 'graph_mode': 'off', 'use_snp_selection': True, 'num_snps': 27626}. Best is trial 91 with value: 0.2747815494022535.
[I 2025-12-05 20:08:36,376] Trial 104 finished with value: 0.2320731737182459 and parameters: {'model_type': 'mlp', 'hidden_dims': '[512, 256]', 'dropout': 0.4298919291579334, 'batch_norm': False, 'lr': 2.014479454347746e-06, 'weight_decay': 9.64768572035994e-07, 'epochs': 134, 'loss': 'mae', 'optimizer': 'adam', 'graph_mode': 'off', 'use_snp_selection': True, 'num_snps': 32205}. Best is trial 91 with value: 0.2747815494022535.
[I 2025-12-05 20:10:01,216] Trial 105 finished with value: 0.25235221982593165 and parameters: {'model_type': 'mlp', 'hidden_dims': '[512, 256]', 'dropout': 0.15228180213640896, 'batch_norm': False, 'lr': 2.973196512789354e-06, 'weight_decay': 1.9939953233513554e-07, 'epochs': 173, 'loss': 'mae', 'optimizer': 'adam', 'graph_mode': 'off', 'use_snp_selection': True, 'num_snps': 52322}. Best is trial 91 with value: 0.2747815494022535.
[I 2025-12-05 20:11:12,030] Trial 106 finished with value: 0.26248765185380835 and parameters: {'model_type': 'mlp', 'hidden_dims': '[512, 256]', 'dropout': 0.4978159868897592, 'batch_norm': False, 'lr': 4.261038413647532e-06, 'weight_decay': 3.2199402446203797e-07, 'epochs': 162, 'loss': 'mae', 'optimizer': 'adam', 'graph_mode': 'off', 'use_snp_selection': True, 'num_snps': 41341}. Best is trial 91 with value: 0.2747815494022535.
[I 2025-12-05 20:12:13,782] Trial 107 finished with value: 0.254245335948379 and parameters: {'model_type': 'mlp', 'hidden_dims': '[512, 256]', 'dropout': 0.4734683127841705, 'batch_norm': False, 'lr': 4.888606686462412e-06, 'weight_decay': 5.38619798900792e-07, 'epochs': 142, 'loss': 'mae', 'optimizer': 'adam', 'graph_mode': 'off', 'use_snp_selection': True, 'num_snps': 35291}. Best is trial 91 with value: 0.2747815494022535.
[I 2025-12-05 20:13:01,778] Trial 108 finished with value: 0.20443277133643703 and parameters: {'model_type': 'mlp', 'hidden_dims': '[512, 256]', 'dropout': 0.5560442174038561, 'batch_norm': True, 'lr': 6.567273497357379e-06, 'weight_decay': 3.352469354706205e-06, 'epochs': 151, 'loss': 'mae', 'optimizer': 'adam', 'graph_mode': 'off', 'use_snp_selection': False}. Best is trial 91 with value: 0.2747815494022535.
[I 2025-12-05 20:13:48,910] Trial 109 finished with value: 0.22144739603191735 and parameters: {'model_type': 'mlp', 'hidden_dims': '[256, 128]', 'dropout': 0.5347186255802899, 'batch_norm': False, 'lr': 2.480279372291806e-06, 'weight_decay': 1.2527017424433878e-07, 'epochs': 180, 'loss': 'mae', 'optimizer': 'adam', 'graph_mode': 'off', 'use_snp_selection': True, 'num_snps': 25776}. Best is trial 91 with value: 0.2747815494022535.
[I 2025-12-05 20:14:41,360] Trial 110 finished with value: 0.26167566870510706 and parameters: {'model_type': 'mlp', 'hidden_dims': '[512, 64]', 'dropout': 0.458876140214567, 'batch_norm': False, 'lr': 3.594209134469165e-06, 'weight_decay': 1.0109878181786391e-07, 'epochs': 170, 'loss': 'mae', 'optimizer': 'adam', 'graph_mode': 'off', 'use_snp_selection': False}. Best is trial 91 with value: 0.2747815494022535.
