[I 2025-12-05 20:51:50,893] Trial 13 finished with value: 0.23197582798340358 and parameters: {'model_type': 'mlp', 'hidden_dims': '[256, 128, 64]', 'dropout': 0.29125366674822484, 'batch_norm': False, 'lr': 5.160505268156064e-06, 'weight_decay': 3.1999034495941446e-05, 'epochs': 282, 'loss': 'mse', 'optimizer': 'adam', 'graph_mode': 'off', 'use_snp_selection': True, 'num_snps': 59978}. Best is trial 3 with value: 0.23417311437131733.
[I 2025-12-05 20:52:04,099] Trial 14 finished with value: 0.022300278668561338 and parameters: {'model_type': 'mlp', 'hidden_dims': '[128, 64]', 'dropout': 0.47880568694936143, 'batch_norm': False, 'lr': 0.000996727461936671, 'weight_decay': 0.00025686800421847447, 'epochs': 105, 'loss': 'mae', 'optimizer': 'adam', 'graph_mode': 'off', 'use_snp_selection': False}. Best is trial 3 with value: 0.23417311437131733.
[I 2025-12-05 20:53:08,898] Trial 15 finished with value: 0.21004098472819027 and parameters: {'model_type': 'mlp', 'hidden_dims': '[512, 256]', 'dropout': 0.5303211456902688, 'batch_norm': False, 'lr': 1.98648288753574e-05, 'weight_decay': 3.797795084560882e-06, 'epochs': 347, 'loss': 'mse', 'optimizer': 'adam', 'graph_mode': 'off', 'use_snp_selection': True, 'num_snps': 19093}. Best is trial 3 with value: 0.23417311437131733.
[I 2025-12-05 20:54:23,492] Trial 16 finished with value: 0.24618593903210337 and parameters: {'model_type': 'mlp', 'hidden_dims': '[512, 64]', 'dropout': 0.33587209601766577, 'batch_norm': False, 'lr': 3.284888101997687e-06, 'weight_decay': 0.0007812431650451949, 'epochs': 243, 'loss': 'mae', 'optimizer': 'adam', 'graph_mode': 'off', 'use_snp_selection': False}. Best is trial 16 with value: 0.24618593903210337.
[I 2025-12-05 20:55:43,130] Trial 17 finished with value: 0.2400532158570278 and parameters: {'model_type': 'mlp', 'hidden_dims': '[512, 64]', 'dropout': 0.3616584899410866, 'batch_norm': False, 'lr': 1.8081964730854778e-05, 'weight_decay': 1.40022675967374e-07, 'epochs': 263, 'loss': 'mae', 'optimizer': 'adam', 'graph_mode': 'off', 'use_snp_selection': False}. Best is trial 16 with value: 0.24618593903210337.
[I 2025-12-05 20:56:59,675] Trial 18 finished with value: 0.23349919137117175 and parameters: {'model_type': 'mlp', 'hidden_dims': '[512, 64]', 'dropout': 0.3136888700861539, 'batch_norm': False, 'lr': 1.790609276429939e-05, 'weight_decay': 1.1437146174521097e-07, 'epochs': 251, 'loss': 'mae', 'optimizer': 'adam', 'graph_mode': 'off', 'use_snp_selection': False}. Best is trial 16 with value: 0.24618593903210337.
[I 2025-12-05 20:58:21,144] Trial 19 finished with value: 0.22536984861047588 and parameters: {'model_type': 'mlp', 'hidden_dims': '[512, 64]', 'dropout': 0.353027219667445, 'batch_norm': False, 'lr': 0.00014582800845134593, 'weight_decay': 3.1643384072840295e-07, 'epochs': 274, 'loss': 'mae', 'optimizer': 'adam', 'graph_mode': 'off', 'use_snp_selection': False}. Best is trial 16 with value: 0.24618593903210337.
[I 2025-12-05 20:59:27,803] Trial 20 finished with value: 0.23547816905113708 and parameters: {'model_type': 'mlp', 'hidden_dims': '[512, 64]', 'dropout': 0.2514200100913465, 'batch_norm': False, 'lr': 2.7223563715204948e-06, 'weight_decay': 5.277131480374089e-06, 'epochs': 213, 'loss': 'mae', 'optimizer': 'adam', 'graph_mode': 'off', 'use_snp_selection': False}. Best is trial 16 with value: 0.24618593903210337.
[I 2025-12-05 21:00:35,789] Trial 21 finished with value: 0.2374158542928746 and parameters: {'model_type': 'mlp', 'hidden_dims': '[512, 64]', 'dropout': 0.24145881913729025, 'batch_norm': False, 'lr': 3.1593377482908204e-06, 'weight_decay': 1.4110458539238735e-07, 'epochs': 218, 'loss': 'mae', 'optimizer': 'adam', 'graph_mode': 'off', 'use_snp_selection': False}. Best is trial 16 with value: 0.24618593903210337.
[I 2025-12-05 21:01:50,066] Trial 22 finished with value: 0.22740773836806683 and parameters: {'model_type': 'mlp', 'hidden_dims': '[512, 64]', 'dropout': 0.3260679753067099, 'batch_norm': False, 'lr': 1.686995101226227e-05, 'weight_decay': 1.133817337998295e-07, 'epochs': 243, 'loss': 'mae', 'optimizer': 'adam', 'graph_mode': 'off', 'use_snp_selection': False}. Best is trial 16 with value: 0.24618593903210337.
[I 2025-12-05 21:02:47,013] Trial 23 finished with value: 0.23164761627583164 and parameters: {'model_type': 'mlp', 'hidden_dims': '[512, 64]', 'dropout': 0.24079325962395987, 'batch_norm': False, 'lr': 2.3706483462147182e-06, 'weight_decay': 7.632852053249511e-07, 'epochs': 178, 'loss': 'mae', 'optimizer': 'adam', 'graph_mode': 'off', 'use_snp_selection': False}. Best is trial 16 with value: 0.24618593903210337.
[I 2025-12-05 21:04:16,495] Trial 24 finished with value: 0.23159113380820545 and parameters: {'model_type': 'mlp', 'hidden_dims': '[512, 64]', 'dropout': 0.36002496492003827, 'batch_norm': False, 'lr': 3.6981151228937936e-06, 'weight_decay': 2.0202690565848763e-07, 'epochs': 296, 'loss': 'mae', 'optimizer': 'adam', 'graph_mode': 'off', 'use_snp_selection': False}. Best is trial 16 with value: 0.24618593903210337.
[I 2025-12-05 21:05:35,570] Trial 25 finished with value: 0.22105250937881263 and parameters: {'model_type': 'mlp', 'hidden_dims': '[512, 64]', 'dropout': 0.20843226202580867, 'batch_norm': False, 'lr': 1.1636023219614102e-06, 'weight_decay': 1.0316006966278784e-06, 'epochs': 258, 'loss': 'mae', 'optimizer': 'adam', 'graph_mode': 'off', 'use_snp_selection': False}. Best is trial 16 with value: 0.24618593903210337.
[I 2025-12-05 21:05:57,489] Trial 26 finished with value: 0.22847799920666684 and parameters: {'model_type': 'mlp', 'hidden_dims': '[128, 64]', 'dropout': 0.28631084433197795, 'batch_norm': False, 'lr': 2.9289498679292495e-05, 'weight_decay': 0.0008431498678185087, 'epochs': 225, 'loss': 'mae', 'optimizer': 'adam', 'graph_mode': 'off', 'use_snp_selection': False}. Best is trial 16 with value: 0.24618593903210337.
[I 2025-12-05 21:06:31,155] Trial 27 finished with value: 0.2365690630213233 and parameters: {'model_type': 'mlp', 'hidden_dims': '[256, 128]', 'dropout': 0.4479685675967455, 'batch_norm': False, 'lr': 1.2310006987936143e-05, 'weight_decay': 2.49776540446545e-07, 'epochs': 192, 'loss': 'mae', 'optimizer': 'adam', 'graph_mode': 'off', 'use_snp_selection': False}. Best is trial 16 with value: 0.24618593903210337.
[I 2025-12-05 21:07:42,257] Trial 28 finished with value: 0.24395416986947197 and parameters: {'model_type': 'mlp', 'hidden_dims': '[512, 128]', 'dropout': 0.33130684238892005, 'batch_norm': False, 'lr': 2.981629607178263e-06, 'weight_decay': 1.0027443534045795e-07, 'epochs': 229, 'loss': 'mae', 'optimizer': 'adam', 'graph_mode': 'off', 'use_snp_selection': False}. Best is trial 16 with value: 0.24618593903210337.
[I 2025-12-05 21:09:14,074] Trial 29 finished with value: 0.2411623292110338 and parameters: {'model_type': 'mlp', 'hidden_dims': '[512, 128]', 'dropout': 0.32721934301876304, 'batch_norm': False, 'lr': 1.942853006874646e-06, 'weight_decay': 2.0690557149786135e-06, 'epochs': 303, 'loss': 'mae', 'optimizer': 'adam', 'graph_mode': 'off', 'use_snp_selection': False}. Best is trial 16 with value: 0.24618593903210337.
[I 2025-12-05 21:10:47,566] Trial 30 finished with value: 0.2345763156307755 and parameters: {'model_type': 'mlp', 'hidden_dims': '[512, 128]', 'dropout': 0.3211214768503743, 'batch_norm': False, 'lr': 1.9534511049440437e-06, 'weight_decay': 8.20332486625712e-06, 'epochs': 310, 'loss': 'mae', 'optimizer': 'adam', 'graph_mode': 'off', 'use_snp_selection': False}. Best is trial 16 with value: 0.24618593903210337.
[I 2025-12-05 21:12:07,719] Trial 31 finished with value: 0.22861639460948058 and parameters: {'model_type': 'mlp', 'hidden_dims': '[512, 128]', 'dropout': 0.38437717613501365, 'batch_norm': False, 'lr': 1.0037867197167714e-06, 'weight_decay': 1.842101754434364e-06, 'epochs': 262, 'loss': 'mae', 'optimizer': 'adam', 'graph_mode': 'off', 'use_snp_selection': False}. Best is trial 16 with value: 0.24618593903210337.
[I 2025-12-05 21:13:36,450] Trial 32 finished with value: 0.23786265006989676 and parameters: {'model_type': 'mlp', 'hidden_dims': '[512, 128]', 'dropout': 0.34806767940140687, 'batch_norm': False, 'lr': 5.969278439823417e-06, 'weight_decay': 4.834667759071808e-07, 'epochs': 293, 'loss': 'mae', 'optimizer': 'adam', 'graph_mode': 'off', 'use_snp_selection': False}. Best is trial 16 with value: 0.24618593903210337.
[I 2025-12-05 21:14:49,946] Trial 33 finished with value: 0.23387386921992842 and parameters: {'model_type': 'mlp', 'hidden_dims': '[512, 128]', 'dropout': 0.43129477469473027, 'batch_norm': False, 'lr': 1.8728618999057616e-06, 'weight_decay': 1.1081681095676013e-06, 'epochs': 238, 'loss': 'mae', 'optimizer': 'adam', 'graph_mode': 'off', 'use_snp_selection': False}. Best is trial 16 with value: 0.24618593903210337.
[I 2025-12-05 21:16:27,585] Trial 34 finished with value: 0.24173656595477513 and parameters: {'model_type': 'mlp', 'hidden_dims': '[512, 128]', 'dropout': 0.2875602843481449, 'batch_norm': False, 'lr': 3.7544166286640422e-06, 'weight_decay': 1.9407114864522608e-07, 'epochs': 325, 'loss': 'mae', 'optimizer': 'adam', 'graph_mode': 'off', 'use_snp_selection': False}. Best is trial 16 with value: 0.24618593903210337.
[I 2025-12-05 21:18:06,966] Trial 35 finished with value: 0.20492704539213458 and parameters: {'model_type': 'mlp', 'hidden_dims': '[512, 128]', 'dropout': 0.2864126514096104, 'batch_norm': True, 'lr': 4.328630441719443e-06, 'weight_decay': 2.164148444510409e-07, 'epochs': 329, 'loss': 'mae', 'optimizer': 'adam', 'graph_mode': 'off', 'use_snp_selection': False}. Best is trial 16 with value: 0.24618593903210337.
[I 2025-12-05 21:19:50,281] Trial 36 finished with value: 0.22730686010160728 and parameters: {'model_type': 'mlp', 'hidden_dims': '[512, 128]', 'dropout': 0.2167336538647767, 'batch_norm': False, 'lr': 2.8037367728466437e-06, 'weight_decay': 3.926291063193908e-05, 'epochs': 345, 'loss': 'mae', 'optimizer': 'adam', 'graph_mode': 'off', 'use_snp_selection': False}. Best is trial 16 with value: 0.24618593903210337.
[I 2025-12-05 21:21:28,059] Trial 37 finished with value: 0.240162897965779 and parameters: {'model_type': 'mlp', 'hidden_dims': '[512, 128]', 'dropout': 0.4087777702621316, 'batch_norm': False, 'lr': 1.5443622359966047e-06, 'weight_decay': 0.00047730529425361613, 'epochs': 326, 'loss': 'mae', 'optimizer': 'adam', 'graph_mode': 'off', 'use_snp_selection': False}. Best is trial 16 with value: 0.24618593903210337.
[I 2025-12-05 21:23:30,135] Trial 38 finished with value: 0.1925614693374942 and parameters: {'model_type': 'mlp', 'hidden_dims': '[512, 128]', 'dropout': 0.2744555113456143, 'batch_norm': True, 'lr': 5.1602730635965236e-06, 'weight_decay': 1.4718740952094895e-05, 'epochs': 304, 'loss': 'mae', 'optimizer': 'adam', 'graph_mode': 'off', 'use_snp_selection': True, 'num_snps': 55304}. Best is trial 16 with value: 0.24618593903210337.
[I 2025-12-05 21:24:55,091] Trial 39 finished with value: 0.2457873795575784 and parameters: {'model_type': 'mlp', 'hidden_dims': '[512, 256]', 'dropout': 0.17508423852144878, 'batch_norm': False, 'lr': 7.039766191945463e-06, 'weight_decay': 7.292174767457787e-06, 'epochs': 279, 'loss': 'mae', 'optimizer': 'adam', 'graph_mode': 'off', 'use_snp_selection': False}. Best is trial 16 with value: 0.24618593903210337.
[I 2025-12-05 21:26:22,234] Trial 40 finished with value: 0.1816480083272964 and parameters: {'model_type': 'mlp', 'hidden_dims': '[512, 256]', 'dropout': 0.14674886936631562, 'batch_norm': True, 'lr': 1.1593519772401664e-05, 'weight_decay': 0.00016979571393713568, 'epochs': 284, 'loss': 'mae', 'optimizer': 'adam', 'graph_mode': 'off', 'use_snp_selection': False}. Best is trial 16 with value: 0.24618593903210337.
[I 2025-12-05 21:27:35,212] Trial 41 finished with value: 0.2514491836152614 and parameters: {'model_type': 'mlp', 'hidden_dims': '[512, 256]', 'dropout': 0.18453241003068946, 'batch_norm': False, 'lr': 2.09305344806899e-06, 'weight_decay': 7.1596880971865045e-06, 'epochs': 235, 'loss': 'mae', 'optimizer': 'adam', 'graph_mode': 'off', 'use_snp_selection': False}. Best is trial 41 with value: 0.2514491836152614.
[I 2025-12-05 21:28:50,115] Trial 42 finished with value: 0.2221116802685173 and parameters: {'model_type': 'mlp', 'hidden_dims': '[512, 256]', 'dropout': 0.1861155250277146, 'batch_norm': False, 'lr': 6.115419271575147e-06, 'weight_decay': 9.659399108288678e-06, 'epochs': 242, 'loss': 'mae', 'optimizer': 'adam', 'graph_mode': 'off', 'use_snp_selection': False}. Best is trial 41 with value: 0.2514491836152614.
[I 2025-12-05 21:29:52,872] Trial 43 finished with value: 0.23276037747697997 and parameters: {'model_type': 'mlp', 'hidden_dims': '[512, 256]', 'dropout': 0.11123255936838682, 'batch_norm': False, 'lr': 3.564498097273158e-06, 'weight_decay': 5.403878570934152e-06, 'epochs': 198, 'loss': 'mae', 'optimizer': 'adam', 'graph_mode': 'off', 'use_snp_selection': False}. Best is trial 41 with value: 0.2514491836152614.
[I 2025-12-05 21:31:15,743] Trial 44 finished with value: 0.22862696914212877 and parameters: {'model_type': 'mlp', 'hidden_dims': '[512, 256]', 'dropout': 0.18189798269042814, 'batch_norm': False, 'lr': 1.3743181908670594e-06, 'weight_decay': 6.161948692168505e-05, 'epochs': 270, 'loss': 'mse', 'optimizer': 'adam', 'graph_mode': 'off', 'use_snp_selection': False}. Best is trial 41 with value: 0.2514491836152614.
[I 2025-12-05 21:32:27,163] Trial 45 finished with value: 0.23470792856441172 and parameters: {'model_type': 'mlp', 'hidden_dims': '[512, 256]', 'dropout': 0.2275208686080896, 'batch_norm': False, 'lr': 2.528778664645937e-06, 'weight_decay': 9.1693146789852e-05, 'epochs': 229, 'loss': 'mae', 'optimizer': 'adam', 'graph_mode': 'off', 'use_snp_selection': False}. Best is trial 41 with value: 0.2514491836152614.
[I 2025-12-05 21:33:14,563] Trial 46 finished with value: 0.1703702730931902 and parameters: {'model_type': 'mlp', 'hidden_dims': '[256, 128]', 'dropout': 0.15751802116000474, 'batch_norm': True, 'lr': 6.61280801420283e-06, 'weight_decay': 6.230356920227035e-06, 'epochs': 207, 'loss': 'mae', 'optimizer': 'adam', 'graph_mode': 'off', 'use_snp_selection': True, 'num_snps': 22173}. Best is trial 41 with value: 0.2514491836152614.
[I 2025-12-05 21:34:08,513] Trial 47 finished with value: 0.2129249430065064 and parameters: {'model_type': 'mlp', 'hidden_dims': '[512, 256]', 'dropout': 0.17666768370619396, 'batch_norm': False, 'lr': 4.381607536721023e-06, 'weight_decay': 2.1834141679910928e-05, 'epochs': 168, 'loss': 'mse', 'optimizer': 'adam', 'graph_mode': 'off', 'use_snp_selection': False}. Best is trial 41 with value: 0.2514491836152614.
[I 2025-12-05 21:34:37,413] Trial 48 finished with value: 0.23017560443404247 and parameters: {'model_type': 'mlp', 'hidden_dims': '[128, 64]', 'dropout': 0.11778821381490923, 'batch_norm': False, 'lr': 1.0450858904431925e-05, 'weight_decay': 3.144413975441043e-06, 'epochs': 318, 'loss': 'mae', 'optimizer': 'adam', 'graph_mode': 'off', 'use_snp_selection': False}. Best is trial 41 with value: 0.2514491836152614.
[I 2025-12-05 21:36:11,435] Trial 49 finished with value: 0.23053382639707626 and parameters: {'model_type': 'mlp', 'hidden_dims': '[512, 256]', 'dropout': 0.2683912524808405, 'batch_norm': False, 'lr': 8.175841367918269e-06, 'weight_decay': 1.601790271654047e-05, 'epochs': 234, 'loss': 'mae', 'optimizer': 'adam', 'graph_mode': 'off', 'use_snp_selection': True, 'num_snps': 47408}. Best is trial 41 with value: 0.2514491836152614.
[I 2025-12-05 21:36:53,982] Trial 50 finished with value: 0.25247319749092567 and parameters: {'model_type': 'mlp', 'hidden_dims': '[256, 128, 64]', 'dropout': 0.3062243826710844, 'batch_norm': False, 'lr': 2.1626381119086687e-06, 'weight_decay': 0.0005504265523157396, 'epochs': 254, 'loss': 'mse', 'optimizer': 'adam', 'graph_mode': 'off', 'use_snp_selection': False}. Best is trial 50 with value: 0.25247319749092567.
[I 2025-12-05 21:37:36,767] Trial 51 finished with value: 0.24175503271490872 and parameters: {'model_type': 'mlp', 'hidden_dims': '[256, 128, 64]', 'dropout': 0.304756663314872, 'batch_norm': False, 'lr': 2.0918621154936437e-06, 'weight_decay': 0.0005346674131447084, 'epochs': 254, 'loss': 'mse', 'optimizer': 'adam', 'graph_mode': 'off', 'use_snp_selection': False}. Best is trial 50 with value: 0.25247319749092567.
[I 2025-12-05 21:38:19,223] Trial 52 finished with value: 0.25193601683273803 and parameters: {'model_type': 'mlp', 'hidden_dims': '[256, 128, 64]', 'dropout': 0.31674364755114814, 'batch_norm': False, 'lr': 1.4847483728374967e-06, 'weight_decay': 0.000548748074249188, 'epochs': 251, 'loss': 'mse', 'optimizer': 'adam', 'graph_mode': 'off', 'use_snp_selection': False}. Best is trial 50 with value: 0.25247319749092567.
[I 2025-12-05 21:39:06,262] Trial 53 finished with value: 0.2403480034303994 and parameters: {'model_type': 'mlp', 'hidden_dims': '[256, 128, 64]', 'dropout': 0.3396052376476354, 'batch_norm': False, 'lr': 1.3029786890472057e-06, 'weight_decay': 0.0002326410318187669, 'epochs': 283, 'loss': 'mse', 'optimizer': 'adam', 'graph_mode': 'off', 'use_snp_selection': False}. Best is trial 50 with value: 0.25247319749092567.
[I 2025-12-05 21:39:48,208] Trial 54 finished with value: 0.2413554803947026 and parameters: {'model_type': 'mlp', 'hidden_dims': '[256, 128, 64]', 'dropout': 0.3778612087143275, 'batch_norm': False, 'lr': 2.929805847968923e-06, 'weight_decay': 0.00045559660448933685, 'epochs': 248, 'loss': 'mse', 'optimizer': 'adam', 'graph_mode': 'off', 'use_snp_selection': False}. Best is trial 50 with value: 0.25247319749092567.
[I 2025-12-05 21:40:32,910] Trial 55 finished with value: 0.2483191351145333 and parameters: {'model_type': 'mlp', 'hidden_dims': '[256, 128, 64]', 'dropout': 0.262322066589383, 'batch_norm': False, 'lr': 1.6207693948327305e-06, 'weight_decay': 0.0003327269910168292, 'epochs': 266, 'loss': 'mse', 'optimizer': 'adam', 'graph_mode': 'off', 'use_snp_selection': False}. Best is trial 50 with value: 0.25247319749092567.
[I 2025-12-05 21:41:17,332] Trial 56 finished with value: 0.23099391537468045 and parameters: {'model_type': 'mlp', 'hidden_dims': '[256, 128, 64]', 'dropout': 0.25910772927224013, 'batch_norm': False, 'lr': 1.6631988136318947e-06, 'weight_decay': 0.0006330114203004947, 'epochs': 265, 'loss': 'mse', 'optimizer': 'adam', 'graph_mode': 'off', 'use_snp_selection': False}. Best is trial 50 with value: 0.25247319749092567.
[I 2025-12-05 21:42:05,826] Trial 57 finished with value: 0.11764713405368063 and parameters: {'model_type': 'mlp', 'hidden_dims': '[256, 128, 64]', 'dropout': 0.12900692428839594, 'batch_norm': True, 'lr': 1.093861527749286e-06, 'weight_decay': 0.0009896957275468252, 'epochs': 290, 'loss': 'mse', 'optimizer': 'adam', 'graph_mode': 'off', 'use_snp_selection': False}. Best is trial 50 with value: 0.25247319749092567.
[I 2025-12-05 21:42:56,946] Trial 58 finished with value: 0.18703092596740084 and parameters: {'model_type': 'mlp', 'hidden_dims': '[256, 128, 64]', 'dropout': 0.23350266790636406, 'batch_norm': False, 'lr': 0.00010582028659250907, 'weight_decay': 0.0003352021935064606, 'epochs': 274, 'loss': 'mse', 'optimizer': 'adam', 'graph_mode': 'off', 'use_snp_selection': True, 'num_snps': 22390}. Best is trial 50 with value: 0.25247319749092567.
[I 2025-12-05 21:43:32,354] Trial 59 finished with value: 0.21298472467479054 and parameters: {'model_type': 'mlp', 'hidden_dims': '[256, 128, 64]', 'dropout': 0.3045170817179664, 'batch_norm': False, 'lr': 0.0003201464585770352, 'weight_decay': 0.0003526896641525357, 'epochs': 209, 'loss': 'mse', 'optimizer': 'adam', 'graph_mode': 'off', 'use_snp_selection': False}. Best is trial 50 with value: 0.25247319749092567.
[I 2025-12-05 21:43:46,471] Trial 60 finished with value: 0.12316160021876336 and parameters: {'model_type': 'mlp', 'hidden_dims': '[256, 128, 64]', 'dropout': 0.20472646518840387, 'batch_norm': False, 'lr': 1.5767951737022096e-06, 'weight_decay': 0.00017861431061208516, 'epochs': 53, 'loss': 'mse', 'optimizer': 'adam', 'graph_mode': 'off', 'use_snp_selection': False}. Best is trial 50 with value: 0.25247319749092567.
[I 2025-12-05 21:44:24,507] Trial 61 finished with value: 0.2318465346445629 and parameters: {'model_type': 'mlp', 'hidden_dims': '[256, 128, 64]', 'dropout': 0.3378694102162214, 'batch_norm': False, 'lr': 2.308323790340085e-06, 'weight_decay': 0.0007539733101562315, 'epochs': 221, 'loss': 'mse', 'optimizer': 'adam', 'graph_mode': 'off', 'use_snp_selection': False}. Best is trial 50 with value: 0.25247319749092567.
[I 2025-12-05 21:45:07,232] Trial 62 finished with value: 0.21841229280280655 and parameters: {'model_type': 'mlp', 'hidden_dims': '[256, 128]', 'dropout': 0.3130596122879429, 'batch_norm': False, 'lr': 3.0460807007394587e-06, 'weight_decay': 0.00011024945501501824, 'epochs': 254, 'loss': 'mse', 'optimizer': 'adam', 'graph_mode': 'off', 'use_snp_selection': False}. Best is trial 50 with value: 0.25247319749092567.
[I 2025-12-05 21:45:40,724] Trial 63 finished with value: 0.25290748224954906 and parameters: {'model_type': 'mlp', 'hidden_dims': '[256, 128, 64]', 'dropout': 0.3743675134627579, 'batch_norm': False, 'lr': 2.2191920090787546e-06, 'weight_decay': 0.00019966881211741838, 'epochs': 188, 'loss': 'mse', 'optimizer': 'adam', 'graph_mode': 'off', 'use_snp_selection': False}. Best is trial 63 with value: 0.25290748224954906.
[I 2025-12-05 21:46:05,216] Trial 64 finished with value: 0.15438774387064422 and parameters: {'model_type': 'mlp', 'hidden_dims': '[256, 128, 64]', 'dropout': 0.4016678531235973, 'batch_norm': False, 'lr': 1.3085283398442998e-06, 'weight_decay': 0.00017141055574149654, 'epochs': 125, 'loss': 'mse', 'optimizer': 'adam', 'graph_mode': 'off', 'use_snp_selection': False}. Best is trial 63 with value: 0.25290748224954906.
