[I 2025-12-05 16:26:51,217] Trial 16 finished with value: -0.008052935329306416 and parameters: {'model_type': 'mlp', 'hidden_dims': '[128, 64]', 'dropout': 0.3014832796859817, 'batch_norm': True, 'lr': 2.1517090787442848e-05, 'weight_decay': 0.00011431726695115916, 'epochs': 220, 'loss': 'mae', 'optimizer': 'adam', 'graph_mode': 'off', 'use_snp_selection': False}. Best is trial 12 with value: 0.07226820936961251.
[I 2025-12-05 16:26:52,133] Trial 17 finished with value: 0.045504396190921614 and parameters: {'model_type': 'mlp', 'hidden_dims': '[128, 64]', 'dropout': 0.5051653507337479, 'batch_norm': True, 'lr': 0.00015021242928938214, 'weight_decay': 4.279596648260934e-05, 'epochs': 273, 'loss': 'mae', 'optimizer': 'adam', 'graph_mode': 'off', 'use_snp_selection': False}. Best is trial 12 with value: 0.07226820936961251.
[I 2025-12-05 16:26:54,775] Trial 18 finished with value: 0.06557551112679857 and parameters: {'model_type': 'mlp', 'hidden_dims': '[256, 128, 64]', 'dropout': 0.21759080685139784, 'batch_norm': False, 'lr': 1.4933560111851611e-05, 'weight_decay': 5.409591144113358e-06, 'epochs': 282, 'loss': 'mae', 'optimizer': 'adam', 'graph_mode': 'off', 'use_snp_selection': True, 'num_snps': 58241}. Best is trial 12 with value: 0.07226820936961251.
[I 2025-12-05 16:26:57,253] Trial 19 finished with value: 0.01169142336237068 and parameters: {'model_type': 'mlp', 'hidden_dims': '[256, 128, 64]', 'dropout': 0.3158551594330238, 'batch_norm': False, 'lr': 1.6665721063030462e-05, 'weight_decay': 1.1354159408743119e-07, 'epochs': 174, 'loss': 'mae', 'optimizer': 'adam', 'graph_mode': 'off', 'use_snp_selection': True, 'num_snps': 55667}. Best is trial 12 with value: 0.07226820936961251.
[I 2025-12-05 16:26:59,707] Trial 20 finished with value: 0.0285876532727406 and parameters: {'model_type': 'mlp', 'hidden_dims': '[256, 128, 64]', 'dropout': 0.1953573671747883, 'batch_norm': False, 'lr': 8.325513273551534e-06, 'weight_decay': 1.292869911986818e-06, 'epochs': 96, 'loss': 'mae', 'optimizer': 'adam', 'graph_mode': 'off', 'use_snp_selection': True, 'num_snps': 57703}. Best is trial 12 with value: 0.07226820936961251.
[I 2025-12-05 16:27:00,852] Trial 21 finished with value: 0.047878684042088906 and parameters: {'model_type': 'mlp', 'hidden_dims': '[512, 256]', 'dropout': 0.1582468584867472, 'batch_norm': False, 'lr': 0.00013201138907764626, 'weight_decay': 4.749730046143362e-06, 'epochs': 283, 'loss': 'mae', 'optimizer': 'adam', 'graph_mode': 'off', 'use_snp_selection': True, 'num_snps': 11878}. Best is trial 12 with value: 0.07226820936961251.
[I 2025-12-05 16:27:02,252] Trial 22 finished with value: 0.038849672252455184 and parameters: {'model_type': 'mlp', 'hidden_dims': '[128, 64]', 'dropout': 0.2283100210722643, 'batch_norm': False, 'lr': 2.576018607404523e-05, 'weight_decay': 4.867992271966418e-05, 'epochs': 290, 'loss': 'mae', 'optimizer': 'adam', 'graph_mode': 'off', 'use_snp_selection': True, 'num_snps': 22259}. Best is trial 12 with value: 0.07226820936961251.
[I 2025-12-05 16:27:04,552] Trial 23 finished with value: 0.058119704431195 and parameters: {'model_type': 'mlp', 'hidden_dims': '[256, 128, 64]', 'dropout': 0.13965400557575663, 'batch_norm': False, 'lr': 0.0009688249251698786, 'weight_decay': 0.00013585520276251868, 'epochs': 251, 'loss': 'mae', 'optimizer': 'adam', 'graph_mode': 'off', 'use_snp_selection': True, 'num_snps': 46925}. Best is trial 12 with value: 0.07226820936961251.
[I 2025-12-05 16:27:06,622] Trial 24 finished with value: 0.04842053700763849 and parameters: {'model_type': 'mlp', 'hidden_dims': '[512, 256]', 'dropout': 0.34114952573867796, 'batch_norm': True, 'lr': 1.0411243446662102e-05, 'weight_decay': 0.0009189330720472584, 'epochs': 343, 'loss': 'mae', 'optimizer': 'adam', 'graph_mode': 'off', 'use_snp_selection': False}. Best is trial 12 with value: 0.07226820936961251.
[I 2025-12-05 16:27:07,429] Trial 25 finished with value: 0.062278687411596194 and parameters: {'model_type': 'mlp', 'hidden_dims': '[128, 64]', 'dropout': 0.18910251596896174, 'batch_norm': True, 'lr': 9.893785492477368e-05, 'weight_decay': 7.664367670010377e-06, 'epochs': 219, 'loss': 'mae', 'optimizer': 'adam', 'graph_mode': 'off', 'use_snp_selection': False}. Best is trial 12 with value: 0.07226820936961251.
[I 2025-12-05 16:27:08,386] Trial 26 finished with value: 0.006640310034984043 and parameters: {'model_type': 'mlp', 'hidden_dims': '[256, 128, 64]', 'dropout': 0.10632342924648835, 'batch_norm': False, 'lr': 0.0004564406395958519, 'weight_decay': 2.475423244927227e-07, 'epochs': 305, 'loss': 'mae', 'optimizer': 'adam', 'graph_mode': 'off', 'use_snp_selection': True, 'num_snps': 2344}. Best is trial 12 with value: 0.07226820936961251.
[I 2025-12-05 16:27:09,524] Trial 27 finished with value: 0.037473156745141414 and parameters: {'model_type': 'mlp', 'hidden_dims': '[256, 128]', 'dropout': 0.23414617882535932, 'batch_norm': True, 'lr': 4.010154992545314e-05, 'weight_decay': 9.34665886912573e-07, 'epochs': 256, 'loss': 'mae', 'optimizer': 'adam', 'graph_mode': 'off', 'use_snp_selection': False}. Best is trial 12 with value: 0.07226820936961251.
[I 2025-12-05 16:27:11,765] Trial 28 finished with value: 0.013283107785285556 and parameters: {'model_type': 'mlp', 'hidden_dims': '[128, 64]', 'dropout': 0.16935023750846342, 'batch_norm': False, 'lr': 0.0002931714070134094, 'weight_decay': 2.032465106576885e-06, 'epochs': 201, 'loss': 'mae', 'optimizer': 'adam', 'graph_mode': 'off', 'use_snp_selection': True, 'num_snps': 48700}. Best is trial 12 with value: 0.07226820936961251.
[I 2025-12-05 16:27:13,686] Trial 29 finished with value: 0.039930458021424725 and parameters: {'model_type': 'mlp', 'hidden_dims': '[512, 256]', 'dropout': 0.12931067540978206, 'batch_norm': True, 'lr': 1.2905839388564053e-05, 'weight_decay': 0.00010345404791182575, 'epochs': 336, 'loss': 'mae', 'optimizer': 'adam', 'graph_mode': 'off', 'use_snp_selection': True, 'num_snps': 26940}. Best is trial 12 with value: 0.07226820936961251.
[I 2025-12-05 16:27:14,503] Trial 30 finished with value: 0.043549796772325323 and parameters: {'model_type': 'mlp', 'hidden_dims': '[256, 128, 64]', 'dropout': 0.20972169368654195, 'batch_norm': True, 'lr': 3.377014935698565e-06, 'weight_decay': 2.744423818834789e-05, 'epochs': 124, 'loss': 'mae', 'optimizer': 'adam', 'graph_mode': 'off', 'use_snp_selection': False}. Best is trial 12 with value: 0.07226820936961251.
[I 2025-12-05 16:27:16,385] Trial 31 finished with value: 0.0710979186418162 and parameters: {'model_type': 'mlp', 'hidden_dims': '[512, 128]', 'dropout': 0.11148128547279346, 'batch_norm': True, 'lr': 0.0002074791370254504, 'weight_decay': 1.149775295111606e-05, 'epochs': 308, 'loss': 'mae', 'optimizer': 'adam', 'graph_mode': 'off', 'use_snp_selection': False}. Best is trial 12 with value: 0.07226820936961251.
[I 2025-12-05 16:27:18,239] Trial 32 finished with value: 0.05443314196307284 and parameters: {'model_type': 'mlp', 'hidden_dims': '[512, 128]', 'dropout': 0.18134086488093876, 'batch_norm': True, 'lr': 0.00010413130959628185, 'weight_decay': 1.413649129529754e-05, 'epochs': 301, 'loss': 'mae', 'optimizer': 'adam', 'graph_mode': 'off', 'use_snp_selection': False}. Best is trial 12 with value: 0.07226820936961251.
[I 2025-12-05 16:27:19,918] Trial 33 finished with value: 0.05461381244795218 and parameters: {'model_type': 'mlp', 'hidden_dims': '[512, 128]', 'dropout': 0.13065474952547856, 'batch_norm': True, 'lr': 0.000569341244453464, 'weight_decay': 7.529678470541377e-06, 'epochs': 260, 'loss': 'mae', 'optimizer': 'adam', 'graph_mode': 'off', 'use_snp_selection': False}. Best is trial 12 with value: 0.07226820936961251.
[I 2025-12-05 16:27:20,854] Trial 34 finished with value: 0.06192596440490009 and parameters: {'model_type': 'mlp', 'hidden_dims': '[128, 64]', 'dropout': 0.48992825192923517, 'batch_norm': True, 'lr': 0.00018170841821327398, 'weight_decay': 2.894051993710668e-05, 'epochs': 323, 'loss': 'mae', 'optimizer': 'adam', 'graph_mode': 'off', 'use_snp_selection': False}. Best is trial 12 with value: 0.07226820936961251.
[I 2025-12-05 16:27:21,893] Trial 35 finished with value: 0.06606140383959026 and parameters: {'model_type': 'mlp', 'hidden_dims': '[256, 128]', 'dropout': 0.27930076842596974, 'batch_norm': True, 'lr': 9.024782356763728e-05, 'weight_decay': 0.00024296931664049854, 'epochs': 235, 'loss': 'mae', 'optimizer': 'adam', 'graph_mode': 'off', 'use_snp_selection': False}. Best is trial 12 with value: 0.07226820936961251.
[I 2025-12-05 16:27:22,967] Trial 36 finished with value: 0.025068588097288763 and parameters: {'model_type': 'mlp', 'hidden_dims': '[256, 128]', 'dropout': 0.2721449246836501, 'batch_norm': True, 'lr': 3.558912417217273e-05, 'weight_decay': 0.0001983289462534703, 'epochs': 236, 'loss': 'mse', 'optimizer': 'adam', 'graph_mode': 'off', 'use_snp_selection': False}. Best is trial 12 with value: 0.07226820936961251.
[I 2025-12-05 16:27:24,940] Trial 37 finished with value: 0.05393408906348733 and parameters: {'model_type': 'mlp', 'hidden_dims': '[256, 128]', 'dropout': 0.23558844669722095, 'batch_norm': False, 'lr': 8.567020214668315e-05, 'weight_decay': 0.0003412942717592296, 'epochs': 219, 'loss': 'mae', 'optimizer': 'adam', 'graph_mode': 'off', 'use_snp_selection': True, 'num_snps': 38290}. Best is trial 12 with value: 0.07226820936961251.
[I 2025-12-05 16:27:25,888] Trial 38 finished with value: 0.059876110331629616 and parameters: {'model_type': 'mlp', 'hidden_dims': '[256, 128]', 'dropout': 0.3001540740966774, 'batch_norm': True, 'lr': 0.0003276347941072162, 'weight_decay': 0.000512916316727362, 'epochs': 169, 'loss': 'mse', 'optimizer': 'adam', 'graph_mode': 'off', 'use_snp_selection': False}. Best is trial 12 with value: 0.07226820936961251.
[I 2025-12-05 16:27:29,091] Trial 39 finished with value: 0.00010602108555910854 and parameters: {'model_type': 'mlp', 'hidden_dims': '[512, 64]', 'dropout': 0.36850443902964514, 'batch_norm': False, 'lr': 2.742683238017549e-06, 'weight_decay': 7.485278017963361e-07, 'epochs': 265, 'loss': 'mae', 'optimizer': 'adam', 'graph_mode': 'off', 'use_snp_selection': True, 'num_snps': 59978}. Best is trial 12 with value: 0.07226820936961251.
[I 2025-12-05 16:27:30,400] Trial 40 finished with value: 0.03788028488116048 and parameters: {'model_type': 'mlp', 'hidden_dims': '[256, 128]', 'dropout': 0.33208428367801185, 'batch_norm': True, 'lr': 7.338165481830388e-05, 'weight_decay': 2.210265095476223e-07, 'epochs': 320, 'loss': 'mae', 'optimizer': 'adam', 'graph_mode': 'off', 'use_snp_selection': False}. Best is trial 12 with value: 0.07226820936961251.
[I 2025-12-05 16:27:32,225] Trial 41 finished with value: 0.06870500500998242 and parameters: {'model_type': 'mlp', 'hidden_dims': '[512, 128]', 'dropout': 0.171040232389416, 'batch_norm': True, 'lr': 0.00012810700547454242, 'weight_decay': 8.988588000320834e-05, 'epochs': 293, 'loss': 'mae', 'optimizer': 'adam', 'graph_mode': 'off', 'use_snp_selection': False}. Best is trial 12 with value: 0.07226820936961251.
[I 2025-12-05 16:27:34,042] Trial 42 finished with value: 0.06176702807193552 and parameters: {'model_type': 'mlp', 'hidden_dims': '[512, 128]', 'dropout': 0.2104502153926165, 'batch_norm': True, 'lr': 0.0002587055587637046, 'weight_decay': 0.0005337643807604698, 'epochs': 297, 'loss': 'mae', 'optimizer': 'adam', 'graph_mode': 'off', 'use_snp_selection': False}. Best is trial 12 with value: 0.07226820936961251.
[I 2025-12-05 16:27:35,987] Trial 43 finished with value: 0.06405640191089433 and parameters: {'model_type': 'mlp', 'hidden_dims': '[512, 128]', 'dropout': 0.16781522129828896, 'batch_norm': True, 'lr': 0.0001181135937438547, 'weight_decay': 6.970297285224893e-05, 'epochs': 334, 'loss': 'mae', 'optimizer': 'adam', 'graph_mode': 'off', 'use_snp_selection': False}. Best is trial 12 with value: 0.07226820936961251.
[I 2025-12-05 16:27:37,801] Trial 44 finished with value: 0.0640641937351835 and parameters: {'model_type': 'mlp', 'hidden_dims': '[512, 128]', 'dropout': 0.26722472675601916, 'batch_norm': True, 'lr': 4.651437616064752e-05, 'weight_decay': 0.0002071358588097923, 'epochs': 291, 'loss': 'mse', 'optimizer': 'adam', 'graph_mode': 'off', 'use_snp_selection': False}. Best is trial 12 with value: 0.07226820936961251.
[I 2025-12-05 16:27:38,649] Trial 45 finished with value: 0.040007807183179436 and parameters: {'model_type': 'mlp', 'hidden_dims': '[512, 128]', 'dropout': 0.21913183717873147, 'batch_norm': True, 'lr': 5.132444953277257e-06, 'weight_decay': 1.7535080019203036e-05, 'epochs': 42, 'loss': 'mae', 'optimizer': 'adam', 'graph_mode': 'off', 'use_snp_selection': False}. Best is trial 12 with value: 0.07226820936961251.
[I 2025-12-05 16:27:39,924] Trial 46 finished with value: 0.027987571144644483 and parameters: {'model_type': 'mlp', 'hidden_dims': '[512, 64]', 'dropout': 0.13316523168112407, 'batch_norm': True, 'lr': 5.963579486071338e-05, 'weight_decay': 2.6415880980970023e-06, 'epochs': 152, 'loss': 'mae', 'optimizer': 'adam', 'graph_mode': 'off', 'use_snp_selection': False}. Best is trial 12 with value: 0.07226820936961251.
[I 2025-12-05 16:27:41,530] Trial 47 finished with value: 0.08117400765552986 and parameters: {'model_type': 'mlp', 'hidden_dims': '[512, 256]', 'dropout': 0.25117807665761765, 'batch_norm': True, 'lr': 0.0006675269354326282, 'weight_decay': 0.0005184153976044669, 'epochs': 245, 'loss': 'mae', 'optimizer': 'adam', 'graph_mode': 'off', 'use_snp_selection': False}. Best is trial 47 with value: 0.08117400765552986.
[I 2025-12-05 16:27:43,129] Trial 48 finished with value: 0.07066790069432237 and parameters: {'model_type': 'mlp', 'hidden_dims': '[512, 256]', 'dropout': 0.29198475908565047, 'batch_norm': True, 'lr': 0.000674072367285125, 'weight_decay': 0.0004421280086060039, 'epochs': 244, 'loss': 'mse', 'optimizer': 'adam', 'graph_mode': 'off', 'use_snp_selection': False}. Best is trial 47 with value: 0.08117400765552986.
[I 2025-12-05 16:27:44,521] Trial 49 finished with value: 0.07251938437659455 and parameters: {'model_type': 'mlp', 'hidden_dims': '[512, 256]', 'dropout': 0.2475834162791453, 'batch_norm': True, 'lr': 0.0006008535687209797, 'weight_decay': 0.0005077670671428281, 'epochs': 189, 'loss': 'mse', 'optimizer': 'adam', 'graph_mode': 'off', 'use_snp_selection': False}. Best is trial 47 with value: 0.08117400765552986.
[I 2025-12-05 16:27:45,916] Trial 50 finished with value: 0.0807396067762077 and parameters: {'model_type': 'mlp', 'hidden_dims': '[512, 256]', 'dropout': 0.2518149235089813, 'batch_norm': True, 'lr': 0.0006955120862824045, 'weight_decay': 0.00044053402984688643, 'epochs': 192, 'loss': 'mse', 'optimizer': 'adam', 'graph_mode': 'off', 'use_snp_selection': False}. Best is trial 47 with value: 0.08117400765552986.
[I 2025-12-05 16:27:47,316] Trial 51 finished with value: 0.06429957023271332 and parameters: {'model_type': 'mlp', 'hidden_dims': '[512, 256]', 'dropout': 0.2521389582480046, 'batch_norm': True, 'lr': 0.0006404055459700145, 'weight_decay': 0.0005144124976905824, 'epochs': 192, 'loss': 'mse', 'optimizer': 'adam', 'graph_mode': 'off', 'use_snp_selection': False}. Best is trial 47 with value: 0.08117400765552986.
[I 2025-12-05 16:27:48,518] Trial 52 finished with value: 0.05709442025319018 and parameters: {'model_type': 'mlp', 'hidden_dims': '[512, 256]', 'dropout': 0.30828350444602526, 'batch_norm': True, 'lr': 0.0006969096792139745, 'weight_decay': 0.0006867470447193383, 'epochs': 140, 'loss': 'mse', 'optimizer': 'adam', 'graph_mode': 'off', 'use_snp_selection': False}. Best is trial 47 with value: 0.08117400765552986.
[I 2025-12-05 16:27:49,910] Trial 53 finished with value: 0.0602532989352066 and parameters: {'model_type': 'mlp', 'hidden_dims': '[512, 256]', 'dropout': 0.2881624985609531, 'batch_norm': True, 'lr': 0.00038129953019392504, 'weight_decay': 0.0003616451547881938, 'epochs': 191, 'loss': 'mse', 'optimizer': 'adam', 'graph_mode': 'off', 'use_snp_selection': False}. Best is trial 47 with value: 0.08117400765552986.
[I 2025-12-05 16:27:50,850] Trial 54 finished with value: 0.07821906315508577 and parameters: {'model_type': 'mlp', 'hidden_dims': '[512, 256]', 'dropout': 0.24924127592990544, 'batch_norm': True, 'lr': 0.0007285766459092095, 'weight_decay': 0.00014362563953389888, 'epochs': 74, 'loss': 'mse', 'optimizer': 'adam', 'graph_mode': 'off', 'use_snp_selection': False}. Best is trial 47 with value: 0.08117400765552986.
[I 2025-12-05 16:27:51,839] Trial 55 finished with value: 0.06843247816464469 and parameters: {'model_type': 'mlp', 'hidden_dims': '[512, 256]', 'dropout': 0.2504147863616153, 'batch_norm': True, 'lr': 0.000850178793779171, 'weight_decay': 0.00016812462120286266, 'epochs': 80, 'loss': 'mse', 'optimizer': 'adam', 'graph_mode': 'off', 'use_snp_selection': False}. Best is trial 47 with value: 0.08117400765552986.
[I 2025-12-05 16:27:52,919] Trial 56 finished with value: 0.062467971233864335 and parameters: {'model_type': 'mlp', 'hidden_dims': '[512, 256]', 'dropout': 0.5915875502395606, 'batch_norm': True, 'lr': 0.00045144790436145264, 'weight_decay': 0.0008389834316127892, 'epochs': 109, 'loss': 'mse', 'optimizer': 'adam', 'graph_mode': 'off', 'use_snp_selection': False}. Best is trial 47 with value: 0.08117400765552986.
[I 2025-12-05 16:27:53,850] Trial 57 finished with value: 0.03142410158599452 and parameters: {'model_type': 'mlp', 'hidden_dims': '[512, 256]', 'dropout': 0.4047059860673202, 'batch_norm': True, 'lr': 0.000205126154533562, 'weight_decay': 0.0002759561752072223, 'epochs': 71, 'loss': 'mse', 'optimizer': 'adam', 'graph_mode': 'off', 'use_snp_selection': False}. Best is trial 47 with value: 0.08117400765552986.
[I 2025-12-05 16:27:55,040] Trial 58 finished with value: 0.07480549893102204 and parameters: {'model_type': 'mlp', 'hidden_dims': '[512, 256]', 'dropout': 0.32825106734350407, 'batch_norm': True, 'lr': 0.0003544406584627596, 'weight_decay': 0.00016344745066649004, 'epochs': 138, 'loss': 'mse', 'optimizer': 'adam', 'graph_mode': 'off', 'use_snp_selection': False}. Best is trial 47 with value: 0.08117400765552986.
[I 2025-12-05 16:27:56,292] Trial 59 finished with value: 0.06736299851301225 and parameters: {'model_type': 'mlp', 'hidden_dims': '[512, 256]', 'dropout': 0.3222577917878312, 'batch_norm': True, 'lr': 0.0005066753353419456, 'weight_decay': 0.00015363988006676996, 'epochs': 154, 'loss': 'mse', 'optimizer': 'adam', 'graph_mode': 'off', 'use_snp_selection': False}. Best is trial 47 with value: 0.08117400765552986.
[I 2025-12-05 16:27:57,455] Trial 60 finished with value: 0.05711270391565859 and parameters: {'model_type': 'mlp', 'hidden_dims': '[512, 256]', 'dropout': 0.4305984970979322, 'batch_norm': True, 'lr': 0.0007794069230251119, 'weight_decay': 0.0006770427944572233, 'epochs': 131, 'loss': 'mse', 'optimizer': 'adam', 'graph_mode': 'off', 'use_snp_selection': False}. Best is trial 47 with value: 0.08117400765552986.
[I 2025-12-05 16:27:58,491] Trial 61 finished with value: 0.0626432638799743 and parameters: {'model_type': 'mlp', 'hidden_dims': '[512, 256]', 'dropout': 0.34841220173949267, 'batch_norm': True, 'lr': 0.0003500996589032241, 'weight_decay': 0.0003354846877337871, 'epochs': 98, 'loss': 'mse', 'optimizer': 'adam', 'graph_mode': 'off', 'use_snp_selection': False}. Best is trial 47 with value: 0.08117400765552986.
[I 2025-12-05 16:27:59,807] Trial 62 finished with value: 0.054927519502722934 and parameters: {'model_type': 'mlp', 'hidden_dims': '[512, 256]', 'dropout': 0.23863161183279008, 'batch_norm': True, 'lr': 0.0009615421921818689, 'weight_decay': 0.0009974679928986298, 'epochs': 169, 'loss': 'mse', 'optimizer': 'adam', 'graph_mode': 'off', 'use_snp_selection': False}. Best is trial 47 with value: 0.08117400765552986.
[I 2025-12-05 16:28:01,256] Trial 63 finished with value: 0.07062066137017167 and parameters: {'model_type': 'mlp', 'hidden_dims': '[512, 256]', 'dropout': 0.36937354768581326, 'batch_norm': True, 'lr': 0.0002589904157816842, 'weight_decay': 7.086064229952265e-05, 'epochs': 205, 'loss': 'mse', 'optimizer': 'adam', 'graph_mode': 'off', 'use_snp_selection': False}. Best is trial 47 with value: 0.08117400765552986.
[I 2025-12-05 16:28:02,618] Trial 64 finished with value: 0.07559004012016896 and parameters: {'model_type': 'mlp', 'hidden_dims': '[512, 256]', 'dropout': 0.19522361782703584, 'batch_norm': True, 'lr': 0.0005459768758310735, 'weight_decay': 0.00011962966314228466, 'epochs': 183, 'loss': 'mse', 'optimizer': 'adam', 'graph_mode': 'off', 'use_snp_selection': False}. Best is trial 47 with value: 0.08117400765552986.
[I 2025-12-05 16:28:03,976] Trial 65 finished with value: 0.06635874776245666 and parameters: {'model_type': 'mlp', 'hidden_dims': '[512, 256]', 'dropout': 0.1958270769190895, 'batch_norm': True, 'lr': 0.0005501469652696585, 'weight_decay': 4.090958941441098e-05, 'epochs': 180, 'loss': 'mse', 'optimizer': 'adam', 'graph_mode': 'off', 'use_snp_selection': False}. Best is trial 47 with value: 0.08117400765552986.
[I 2025-12-05 16:28:05,445] Trial 66 finished with value: 0.06408123967662276 and parameters: {'model_type': 'mlp', 'hidden_dims': '[512, 256]', 'dropout': 0.2606709638441101, 'batch_norm': True, 'lr': 0.0004332881703284636, 'weight_decay': 0.0001253108016030822, 'epochs': 211, 'loss': 'mse', 'optimizer': 'adam', 'graph_mode': 'off', 'use_snp_selection': False}. Best is trial 47 with value: 0.08117400765552986.
[I 2025-12-05 16:28:06,736] Trial 67 finished with value: 0.07442636967033413 and parameters: {'model_type': 'mlp', 'hidden_dims': '[512, 256]', 'dropout': 0.22197821171378557, 'batch_norm': True, 'lr': 0.000595065357003724, 'weight_decay': 0.00024022529675995791, 'epochs': 158, 'loss': 'mse', 'optimizer': 'adam', 'graph_mode': 'off', 'use_snp_selection': False}. Best is trial 47 with value: 0.08117400765552986.
