[I 2025-12-05 18:34:43,106] Trial 62 finished with value: 0.29922468578481215 and parameters: {'model_type': 'mlp', 'hidden_dims': '[512, 256]', 'dropout': 0.3313161080335638, 'batch_norm': False, 'lr': 2.6138269555343943e-06, 'weight_decay': 0.0009237214320852725, 'epochs': 241, 'loss': 'mse', 'optimizer': 'adam', 'graph_mode': 'off', 'use_snp_selection': False}. Best is trial 55 with value: 0.30310428546197843.
[I 2025-12-05 18:35:25,746] Trial 63 finished with value: 0.29954294638340273 and parameters: {'model_type': 'mlp', 'hidden_dims': '[512, 256]', 'dropout': 0.2867908305702941, 'batch_norm': False, 'lr': 1.7053652897370984e-06, 'weight_decay': 0.0006705866022167324, 'epochs': 213, 'loss': 'mse', 'optimizer': 'adam', 'graph_mode': 'off', 'use_snp_selection': False}. Best is trial 55 with value: 0.30310428546197843.
[I 2025-12-05 18:36:20,010] Trial 64 finished with value: 0.2897617291043336 and parameters: {'model_type': 'mlp', 'hidden_dims': '[512, 256]', 'dropout': 0.3091045095681866, 'batch_norm': False, 'lr': 3.932841220755711e-06, 'weight_decay': 0.0002837133541257564, 'epochs': 279, 'loss': 'mse', 'optimizer': 'adam', 'graph_mode': 'off', 'use_snp_selection': False}. Best is trial 55 with value: 0.30310428546197843.
[I 2025-12-05 18:36:58,413] Trial 65 finished with value: 0.3057176100218867 and parameters: {'model_type': 'mlp', 'hidden_dims': '[512, 256]', 'dropout': 0.34794711927212935, 'batch_norm': False, 'lr': 2.514677146862909e-06, 'weight_decay': 0.0006615309662882202, 'epochs': 189, 'loss': 'mse', 'optimizer': 'adam', 'graph_mode': 'off', 'use_snp_selection': False}. Best is trial 65 with value: 0.3057176100218867.
[I 2025-12-05 18:37:37,028] Trial 66 finished with value: 0.30087099883123125 and parameters: {'model_type': 'mlp', 'hidden_dims': '[512, 256]', 'dropout': 0.3898597746482434, 'batch_norm': False, 'lr': 3.5720143695955037e-06, 'weight_decay': 0.00018841210642780873, 'epochs': 190, 'loss': 'mse', 'optimizer': 'adam', 'graph_mode': 'off', 'use_snp_selection': False}. Best is trial 65 with value: 0.3057176100218867.
[I 2025-12-05 18:38:16,163] Trial 67 finished with value: 0.28550619634599805 and parameters: {'model_type': 'mlp', 'hidden_dims': '[512, 256]', 'dropout': 0.35380597934630487, 'batch_norm': False, 'lr': 3.6864815639196558e-06, 'weight_decay': 0.00036289822493670084, 'epochs': 193, 'loss': 'mae', 'optimizer': 'adam', 'graph_mode': 'off', 'use_snp_selection': False}. Best is trial 65 with value: 0.3057176100218867.
[I 2025-12-05 18:38:54,958] Trial 68 finished with value: 0.29948277870546597 and parameters: {'model_type': 'mlp', 'hidden_dims': '[512, 256]', 'dropout': 0.26172277948719025, 'batch_norm': False, 'lr': 1.8453299702122049e-06, 'weight_decay': 0.00020621614831369377, 'epochs': 191, 'loss': 'mse', 'optimizer': 'adam', 'graph_mode': 'off', 'use_snp_selection': False}. Best is trial 65 with value: 0.3057176100218867.
[I 2025-12-05 18:39:29,685] Trial 69 finished with value: 0.2929706637258209 and parameters: {'model_type': 'mlp', 'hidden_dims': '[512, 256]', 'dropout': 0.3473967278108246, 'batch_norm': False, 'lr': 1.3741258385178141e-06, 'weight_decay': 0.0006331219339000535, 'epochs': 168, 'loss': 'mse', 'optimizer': 'adam', 'graph_mode': 'off', 'use_snp_selection': False}. Best is trial 65 with value: 0.3057176100218867.
[I 2025-12-05 18:40:07,035] Trial 70 finished with value: 0.29679155165186205 and parameters: {'model_type': 'mlp', 'hidden_dims': '[512, 256]', 'dropout': 0.38822081402887376, 'batch_norm': False, 'lr': 2.4144406664935954e-06, 'weight_decay': 0.00015244992452760023, 'epochs': 183, 'loss': 'mse', 'optimizer': 'adam', 'graph_mode': 'off', 'use_snp_selection': False}. Best is trial 65 with value: 0.3057176100218867.
[I 2025-12-05 18:40:48,224] Trial 71 finished with value: 0.30075149355680575 and parameters: {'model_type': 'mlp', 'hidden_dims': '[512, 256]', 'dropout': 0.4721879430878772, 'batch_norm': False, 'lr': 3.282433069731311e-06, 'weight_decay': 0.0006859829968241583, 'epochs': 205, 'loss': 'mse', 'optimizer': 'adam', 'graph_mode': 'off', 'use_snp_selection': False}. Best is trial 65 with value: 0.3057176100218867.
[I 2025-12-05 18:41:28,587] Trial 72 finished with value: 0.30099653709065477 and parameters: {'model_type': 'mlp', 'hidden_dims': '[512, 256]', 'dropout': 0.3072335099941869, 'batch_norm': False, 'lr': 3.1034785187361587e-06, 'weight_decay': 0.00042234022633660007, 'epochs': 200, 'loss': 'mse', 'optimizer': 'adam', 'graph_mode': 'off', 'use_snp_selection': False}. Best is trial 65 with value: 0.3057176100218867.
[I 2025-12-05 18:42:08,755] Trial 73 finished with value: 0.2992991106300356 and parameters: {'model_type': 'mlp', 'hidden_dims': '[512, 256]', 'dropout': 0.3173021797940388, 'batch_norm': False, 'lr': 3.130073751605467e-06, 'weight_decay': 0.0003856776675519019, 'epochs': 199, 'loss': 'mse', 'optimizer': 'adam', 'graph_mode': 'off', 'use_snp_selection': False}. Best is trial 65 with value: 0.3057176100218867.
[I 2025-12-05 18:42:50,819] Trial 74 finished with value: 0.3012854610677732 and parameters: {'model_type': 'mlp', 'hidden_dims': '[512, 256]', 'dropout': 0.3987899746048368, 'batch_norm': False, 'lr': 2.110877353581932e-06, 'weight_decay': 0.0006563015099096655, 'epochs': 210, 'loss': 'mse', 'optimizer': 'adam', 'graph_mode': 'off', 'use_snp_selection': False}. Best is trial 65 with value: 0.3057176100218867.
[I 2025-12-05 18:43:27,088] Trial 75 finished with value: 0.28761156960325235 and parameters: {'model_type': 'mlp', 'hidden_dims': '[512, 256]', 'dropout': 0.4006709967770424, 'batch_norm': False, 'lr': 1.0112858893483346e-06, 'weight_decay': 0.0007514901886520043, 'epochs': 177, 'loss': 'mse', 'optimizer': 'adam', 'graph_mode': 'off', 'use_snp_selection': False}. Best is trial 65 with value: 0.3057176100218867.
[I 2025-12-05 18:44:09,169] Trial 76 finished with value: 0.3035087627552423 and parameters: {'model_type': 'mlp', 'hidden_dims': '[512, 256]', 'dropout': 0.34944300748024326, 'batch_norm': False, 'lr': 1.8750226647773627e-06, 'weight_decay': 0.0002863044072376356, 'epochs': 210, 'loss': 'mse', 'optimizer': 'adam', 'graph_mode': 'off', 'use_snp_selection': False}. Best is trial 65 with value: 0.3057176100218867.
[I 2025-12-05 18:44:50,025] Trial 77 finished with value: 0.30064648947810063 and parameters: {'model_type': 'mlp', 'hidden_dims': '[512, 256]', 'dropout': 0.3514024150043437, 'batch_norm': False, 'lr': 1.9016946669647371e-06, 'weight_decay': 0.0006824616241832267, 'epochs': 203, 'loss': 'mse', 'optimizer': 'adam', 'graph_mode': 'off', 'use_snp_selection': False}. Best is trial 65 with value: 0.3057176100218867.
[I 2025-12-05 18:45:33,845] Trial 78 finished with value: 0.2673353394502461 and parameters: {'model_type': 'mlp', 'hidden_dims': '[512, 256]', 'dropout': 0.38753950218367844, 'batch_norm': False, 'lr': 1.510717069199165e-06, 'weight_decay': 0.0003980303413814192, 'epochs': 220, 'loss': 'mae', 'optimizer': 'adam', 'graph_mode': 'off', 'use_snp_selection': False}. Best is trial 65 with value: 0.3057176100218867.
[I 2025-12-05 18:46:12,297] Trial 79 finished with value: 0.10790347247913386 and parameters: {'model_type': 'mlp', 'hidden_dims': '[512, 64]', 'dropout': 0.34315630700995353, 'batch_norm': False, 'lr': 0.0006824885735261944, 'weight_decay': 0.0003199171276523381, 'epochs': 192, 'loss': 'mse', 'optimizer': 'adam', 'graph_mode': 'off', 'use_snp_selection': False}. Best is trial 65 with value: 0.3057176100218867.
[I 2025-12-05 18:46:58,026] Trial 80 finished with value: 0.3002543510109288 and parameters: {'model_type': 'mlp', 'hidden_dims': '[512, 128]', 'dropout': 0.4228227799692627, 'batch_norm': False, 'lr': 2.3861103073341936e-06, 'weight_decay': 0.00020885540210658114, 'epochs': 232, 'loss': 'mse', 'optimizer': 'adam', 'graph_mode': 'off', 'use_snp_selection': False}. Best is trial 65 with value: 0.3057176100218867.
[I 2025-12-05 18:47:40,808] Trial 81 finished with value: 0.302089502591474 and parameters: {'model_type': 'mlp', 'hidden_dims': '[512, 256]', 'dropout': 0.3097696754636817, 'batch_norm': False, 'lr': 2.715164838610728e-06, 'weight_decay': 0.00025182606546013983, 'epochs': 214, 'loss': 'mse', 'optimizer': 'adam', 'graph_mode': 'off', 'use_snp_selection': False}. Best is trial 65 with value: 0.3057176100218867.
[I 2025-12-05 18:48:18,014] Trial 82 finished with value: 0.29723804307349855 and parameters: {'model_type': 'mlp', 'hidden_dims': '[512, 256]', 'dropout': 0.30071479550015157, 'batch_norm': False, 'lr': 1.9040026682763939e-06, 'weight_decay': 0.0009914627253347311, 'epochs': 182, 'loss': 'mse', 'optimizer': 'adam', 'graph_mode': 'off', 'use_snp_selection': False}. Best is trial 65 with value: 0.3057176100218867.
[I 2025-12-05 18:48:52,391] Trial 83 finished with value: 0.29652114169745547 and parameters: {'model_type': 'mlp', 'hidden_dims': '[512, 256]', 'dropout': 0.2738618004871294, 'batch_norm': False, 'lr': 3.4716237398979178e-06, 'weight_decay': 0.0006320762355320955, 'epochs': 166, 'loss': 'mse', 'optimizer': 'adam', 'graph_mode': 'off', 'use_snp_selection': False}. Best is trial 65 with value: 0.3057176100218867.
[I 2025-12-05 18:49:34,676] Trial 84 finished with value: 0.29599152650137583 and parameters: {'model_type': 'mlp', 'hidden_dims': '[512, 256]', 'dropout': 0.2468081868664666, 'batch_norm': False, 'lr': 1.2559943079509473e-06, 'weight_decay': 0.0001578479486656272, 'epochs': 210, 'loss': 'mse', 'optimizer': 'adam', 'graph_mode': 'off', 'use_snp_selection': False}. Best is trial 65 with value: 0.3057176100218867.
[I 2025-12-05 18:49:49,293] Trial 85 finished with value: 0.2979837983397494 and parameters: {'model_type': 'mlp', 'hidden_dims': '[128, 64]', 'dropout': 0.3631932118725912, 'batch_norm': False, 'lr': 7.228935064400266e-06, 'weight_decay': 0.0001179399816046294, 'epochs': 199, 'loss': 'mse', 'optimizer': 'adam', 'graph_mode': 'off', 'use_snp_selection': False}. Best is trial 65 with value: 0.3057176100218867.
[I 2025-12-05 18:50:33,448] Trial 86 finished with value: 0.2992848743340516 and parameters: {'model_type': 'mlp', 'hidden_dims': '[512, 256]', 'dropout': 0.34087984519924913, 'batch_norm': False, 'lr': 1.6606506127173707e-06, 'weight_decay': 0.0004476137854533806, 'epochs': 222, 'loss': 'mse', 'optimizer': 'adam', 'graph_mode': 'off', 'use_snp_selection': False}. Best is trial 65 with value: 0.3057176100218867.
[I 2025-12-05 18:51:19,394] Trial 87 finished with value: 0.3005636587587418 and parameters: {'model_type': 'mlp', 'hidden_dims': '[512, 256]', 'dropout': 0.35961859608531915, 'batch_norm': False, 'lr': 2.20347767233748e-06, 'weight_decay': 0.0007823732742660682, 'epochs': 232, 'loss': 'mse', 'optimizer': 'adam', 'graph_mode': 'off', 'use_snp_selection': False}. Best is trial 65 with value: 0.3057176100218867.
[I 2025-12-05 18:51:55,152] Trial 88 finished with value: 0.2982481155651026 and parameters: {'model_type': 'mlp', 'hidden_dims': '[512, 256]', 'dropout': 0.3090822356278742, 'batch_norm': False, 'lr': 2.6960485117245228e-06, 'weight_decay': 0.00030671749450965, 'epochs': 174, 'loss': 'mse', 'optimizer': 'adam', 'graph_mode': 'off', 'use_snp_selection': False}. Best is trial 65 with value: 0.3057176100218867.
[I 2025-12-05 18:52:27,533] Trial 89 finished with value: 0.2990461422007985 and parameters: {'model_type': 'mlp', 'hidden_dims': '[512, 256]', 'dropout': 0.4085598237360776, 'batch_norm': False, 'lr': 3.6276000298811288e-06, 'weight_decay': 9.295448589392964e-05, 'epochs': 155, 'loss': 'mse', 'optimizer': 'adam', 'graph_mode': 'off', 'use_snp_selection': False}. Best is trial 65 with value: 0.3057176100218867.
[I 2025-12-05 18:53:05,756] Trial 90 finished with value: 0.29837610750786175 and parameters: {'model_type': 'mlp', 'hidden_dims': '[512, 256]', 'dropout': 0.3822429676338252, 'batch_norm': False, 'lr': 6.15055063222741e-06, 'weight_decay': 0.0005953256000819662, 'epochs': 188, 'loss': 'mse', 'optimizer': 'adam', 'graph_mode': 'off', 'use_snp_selection': False}. Best is trial 65 with value: 0.3057176100218867.
[I 2025-12-05 18:53:48,184] Trial 91 finished with value: 0.2992541858351013 and parameters: {'model_type': 'mlp', 'hidden_dims': '[512, 256]', 'dropout': 0.3205829110044798, 'batch_norm': False, 'lr': 3.1953409507672478e-06, 'weight_decay': 0.00025027213918877325, 'epochs': 212, 'loss': 'mse', 'optimizer': 'adam', 'graph_mode': 'off', 'use_snp_selection': False}. Best is trial 65 with value: 0.3057176100218867.
[I 2025-12-05 18:54:28,315] Trial 92 finished with value: 0.30157201558108954 and parameters: {'model_type': 'mlp', 'hidden_dims': '[512, 256]', 'dropout': 0.3363594832714656, 'batch_norm': False, 'lr': 2.7085906263945313e-06, 'weight_decay': 0.00041865075645600554, 'epochs': 199, 'loss': 'mse', 'optimizer': 'adam', 'graph_mode': 'off', 'use_snp_selection': False}. Best is trial 65 with value: 0.3057176100218867.
[I 2025-12-05 18:55:09,182] Trial 93 finished with value: 0.3020839495774888 and parameters: {'model_type': 'mlp', 'hidden_dims': '[512, 256]', 'dropout': 0.28649016431617813, 'batch_norm': False, 'lr': 2.125498585931658e-06, 'weight_decay': 0.00038101601839284153, 'epochs': 203, 'loss': 'mse', 'optimizer': 'adam', 'graph_mode': 'off', 'use_snp_selection': False}. Best is trial 65 with value: 0.3057176100218867.
[I 2025-12-05 18:55:49,526] Trial 94 finished with value: 0.30179751765805385 and parameters: {'model_type': 'mlp', 'hidden_dims': '[512, 256]', 'dropout': 0.2833184072701907, 'batch_norm': False, 'lr': 2.0746820419623258e-06, 'weight_decay': 0.0004464521955614658, 'epochs': 200, 'loss': 'mse', 'optimizer': 'adam', 'graph_mode': 'off', 'use_snp_selection': False}. Best is trial 65 with value: 0.3057176100218867.
[I 2025-12-05 18:56:29,321] Trial 95 finished with value: 0.30043060794071763 and parameters: {'model_type': 'mlp', 'hidden_dims': '[512, 64]', 'dropout': 0.27822649620931883, 'batch_norm': False, 'lr': 2.073312118343283e-06, 'weight_decay': 0.0004795816250063396, 'epochs': 198, 'loss': 'mse', 'optimizer': 'adam', 'graph_mode': 'off', 'use_snp_selection': False}. Best is trial 65 with value: 0.3057176100218867.
[I 2025-12-05 18:57:13,019] Trial 96 finished with value: 0.2975364752619485 and parameters: {'model_type': 'mlp', 'hidden_dims': '[512, 128]', 'dropout': 0.2999029786882011, 'batch_norm': False, 'lr': 1.1774805415907574e-06, 'weight_decay': 0.0004091296311774757, 'epochs': 220, 'loss': 'mse', 'optimizer': 'adam', 'graph_mode': 'off', 'use_snp_selection': False}. Best is trial 65 with value: 0.3057176100218867.
[I 2025-12-05 18:57:29,291] Trial 97 finished with value: 0.2832481315726841 and parameters: {'model_type': 'mlp', 'hidden_dims': '[128, 64]', 'dropout': 0.2543666309081517, 'batch_norm': False, 'lr': 1.4935573405068457e-06, 'weight_decay': 0.0003207122844852323, 'epochs': 230, 'loss': 'mse', 'optimizer': 'adam', 'graph_mode': 'off', 'use_snp_selection': False}. Best is trial 65 with value: 0.3057176100218867.
[I 2025-12-05 18:58:05,905] Trial 98 finished with value: 0.2835570786062539 and parameters: {'model_type': 'mlp', 'hidden_dims': '[512, 256]', 'dropout': 0.29096155162447573, 'batch_norm': True, 'lr': 2.6665066071451816e-06, 'weight_decay': 0.0007801620997226072, 'epochs': 178, 'loss': 'mae', 'optimizer': 'adam', 'graph_mode': 'off', 'use_snp_selection': False}. Best is trial 65 with value: 0.3057176100218867.
[I 2025-12-05 18:58:54,126] Trial 99 finished with value: 0.3008435100516601 and parameters: {'model_type': 'mlp', 'hidden_dims': '[512, 256]', 'dropout': 0.33770822528270733, 'batch_norm': False, 'lr': 1.789785043137571e-06, 'weight_decay': 0.0002393336254062493, 'epochs': 245, 'loss': 'mse', 'optimizer': 'adam', 'graph_mode': 'off', 'use_snp_selection': False}. Best is trial 65 with value: 0.3057176100218867.
[I 2025-12-05 18:59:35,239] Trial 100 finished with value: 0.28994076285122106 and parameters: {'model_type': 'mlp', 'hidden_dims': '[512, 256]', 'dropout': 0.22735296019536294, 'batch_norm': False, 'lr': 5.304688004024419e-06, 'weight_decay': 0.0008526492464700899, 'epochs': 204, 'loss': 'mse', 'optimizer': 'adam', 'graph_mode': 'off', 'use_snp_selection': False}. Best is trial 65 with value: 0.3057176100218867.
[I 2025-12-05 19:00:14,544] Trial 101 finished with value: 0.3005222320601644 and parameters: {'model_type': 'mlp', 'hidden_dims': '[512, 256]', 'dropout': 0.31369671429947193, 'batch_norm': False, 'lr': 2.227242697970145e-06, 'weight_decay': 0.0001786912705559171, 'epochs': 194, 'loss': 'mse', 'optimizer': 'adam', 'graph_mode': 'off', 'use_snp_selection': False}. Best is trial 65 with value: 0.3057176100218867.
[I 2025-12-05 19:00:57,527] Trial 102 finished with value: 0.29418104699411024 and parameters: {'model_type': 'mlp', 'hidden_dims': '[512, 256]', 'dropout': 0.3783682420566742, 'batch_norm': False, 'lr': 4.122703740948515e-06, 'weight_decay': 0.000534239903325201, 'epochs': 215, 'loss': 'mse', 'optimizer': 'adam', 'graph_mode': 'off', 'use_snp_selection': False}. Best is trial 65 with value: 0.3057176100218867.
[I 2025-12-05 19:01:35,598] Trial 103 finished with value: 0.3010745757145913 and parameters: {'model_type': 'mlp', 'hidden_dims': '[512, 256]', 'dropout': 0.3937257480568719, 'batch_norm': False, 'lr': 2.6272551797756035e-06, 'weight_decay': 0.0003675225361763754, 'epochs': 187, 'loss': 'mse', 'optimizer': 'adam', 'graph_mode': 'off', 'use_snp_selection': False}. Best is trial 65 with value: 0.3057176100218867.
[I 2025-12-05 19:02:10,895] Trial 104 finished with value: 0.30235438176478047 and parameters: {'model_type': 'mlp', 'hidden_dims': '[512, 256]', 'dropout': 0.2632555683921916, 'batch_norm': False, 'lr': 1.9616212635118922e-06, 'weight_decay': 0.00037222104529809, 'epochs': 171, 'loss': 'mse', 'optimizer': 'adam', 'graph_mode': 'off', 'use_snp_selection': False}. Best is trial 65 with value: 0.3057176100218867.
[I 2025-12-05 19:02:43,905] Trial 105 finished with value: 0.2994405118134444 and parameters: {'model_type': 'mlp', 'hidden_dims': '[512, 256]', 'dropout': 0.28512908606947024, 'batch_norm': False, 'lr': 1.645155773101873e-06, 'weight_decay': 0.0002884587928731164, 'epochs': 158, 'loss': 'mse', 'optimizer': 'adam', 'graph_mode': 'off', 'use_snp_selection': False}. Best is trial 65 with value: 0.3057176100218867.
[I 2025-12-05 19:03:19,364] Trial 106 finished with value: 0.30356171109867347 and parameters: {'model_type': 'mlp', 'hidden_dims': '[512, 256]', 'dropout': 0.3981564552206057, 'batch_norm': False, 'lr': 2.0194659494195997e-06, 'weight_decay': 0.0003424820275263987, 'epochs': 172, 'loss': 'mse', 'optimizer': 'adam', 'graph_mode': 'off', 'use_snp_selection': False}. Best is trial 65 with value: 0.3057176100218867.
[I 2025-12-05 19:03:54,861] Trial 107 finished with value: 0.2988388226318596 and parameters: {'model_type': 'mlp', 'hidden_dims': '[512, 256]', 'dropout': 0.2603926697665999, 'batch_norm': False, 'lr': 1.9614101650704497e-06, 'weight_decay': 0.000531976309721071, 'epochs': 172, 'loss': 'mse', 'optimizer': 'adam', 'graph_mode': 'off', 'use_snp_selection': False}. Best is trial 65 with value: 0.3057176100218867.
[I 2025-12-05 19:04:39,489] Trial 108 finished with value: 0.2968230091433939 and parameters: {'model_type': 'mlp', 'hidden_dims': '[512, 256]', 'dropout': 0.20054644253289516, 'batch_norm': False, 'lr': 1.1198489188966526e-06, 'weight_decay': 0.00022380495617806102, 'epochs': 224, 'loss': 'mse', 'optimizer': 'adam', 'graph_mode': 'off', 'use_snp_selection': False}. Best is trial 65 with value: 0.3057176100218867.
[I 2025-12-05 19:05:09,449] Trial 109 finished with value: 0.2905697337717531 and parameters: {'model_type': 'mlp', 'hidden_dims': '[512, 256]', 'dropout': 0.43559123814829626, 'batch_norm': False, 'lr': 1.3917315852063477e-06, 'weight_decay': 0.00013793000514938244, 'epochs': 141, 'loss': 'mse', 'optimizer': 'adam', 'graph_mode': 'off', 'use_snp_selection': False}. Best is trial 65 with value: 0.3057176100218867.
[I 2025-12-05 19:05:43,301] Trial 110 finished with value: 0.26139924953766813 and parameters: {'model_type': 'mlp', 'hidden_dims': '[512, 256]', 'dropout': 0.23153132952428684, 'batch_norm': True, 'lr': 2.32721998481361e-06, 'weight_decay': 0.0003297987765370559, 'epochs': 162, 'loss': 'mse', 'optimizer': 'adam', 'graph_mode': 'off', 'use_snp_selection': False}. Best is trial 65 with value: 0.3057176100218867.
[I 2025-12-05 19:06:21,347] Trial 111 finished with value: 0.3012348911331908 and parameters: {'model_type': 'mlp', 'hidden_dims': '[512, 256]', 'dropout': 0.3572401689209391, 'batch_norm': False, 'lr': 2.8749020401221366e-06, 'weight_decay': 0.0003872040202329771, 'epochs': 187, 'loss': 'mse', 'optimizer': 'adam', 'graph_mode': 'off', 'use_snp_selection': False}. Best is trial 65 with value: 0.3057176100218867.
[I 2025-12-05 19:06:58,191] Trial 112 finished with value: 0.3010863499277475 and parameters: {'model_type': 'mlp', 'hidden_dims': '[512, 256]', 'dropout': 0.35778567732025823, 'batch_norm': False, 'lr': 2.013666208735078e-06, 'weight_decay': 0.0004396664703739519, 'epochs': 180, 'loss': 'mse', 'optimizer': 'adam', 'graph_mode': 'off', 'use_snp_selection': False}. Best is trial 65 with value: 0.3057176100218867.
[I 2025-12-05 19:07:33,111] Trial 113 finished with value: 0.29965778572367363 and parameters: {'model_type': 'mlp', 'hidden_dims': '[512, 256]', 'dropout': 0.33534139779943256, 'batch_norm': False, 'lr': 2.7358310225540263e-06, 'weight_decay': 0.0006097403730715215, 'epochs': 169, 'loss': 'mse', 'optimizer': 'adam', 'graph_mode': 'off', 'use_snp_selection': False}. Best is trial 65 with value: 0.3057176100218867.
