[I 2025-12-05 23:24:32,092] Trial 25 finished with value: 0.2982972160871042 and parameters: {'model_type': 'mlp', 'hidden_dims': '[512, 256]', 'dropout': 0.10997351447444888, 'batch_norm': True, 'lr': 3.775256329745003e-05, 'weight_decay': 2.541606909583134e-07, 'epochs': 204, 'loss': 'mse', 'optimizer': 'adam', 'graph_mode': 'off', 'use_snp_selection': False}. Best is trial 9 with value: 0.3016673276975667.
[I 2025-12-05 23:24:57,080] Trial 26 finished with value: 0.26478362394489097 and parameters: {'model_type': 'mlp', 'hidden_dims': '[512, 256]', 'dropout': 0.22606653931922838, 'batch_norm': True, 'lr': 1.2550693142833744e-05, 'weight_decay': 1.8829468433995606e-07, 'epochs': 241, 'loss': 'mae', 'optimizer': 'adam', 'graph_mode': 'off', 'use_snp_selection': True, 'num_snps': 3842}. Best is trial 9 with value: 0.3016673276975667.
[I 2025-12-05 23:25:50,512] Trial 27 finished with value: 0.27755385670565236 and parameters: {'model_type': 'mlp', 'hidden_dims': '[512, 256]', 'dropout': 0.12589575561441588, 'batch_norm': False, 'lr': 3.708794373669967e-05, 'weight_decay': 9.830800292945214e-07, 'epochs': 277, 'loss': 'mse', 'optimizer': 'adam', 'graph_mode': 'off', 'use_snp_selection': False}. Best is trial 9 with value: 0.3016673276975667.
[I 2025-12-05 23:26:34,758] Trial 28 finished with value: 0.276859268790001 and parameters: {'model_type': 'mlp', 'hidden_dims': '[512, 256]', 'dropout': 0.26673595624506075, 'batch_norm': True, 'lr': 6.805688140322742e-06, 'weight_decay': 2.905899669856459e-07, 'epochs': 221, 'loss': 'mae', 'optimizer': 'adam', 'graph_mode': 'off', 'use_snp_selection': False}. Best is trial 9 with value: 0.3016673276975667.
[I 2025-12-05 23:27:10,350] Trial 29 finished with value: 0.2894833887758362 and parameters: {'model_type': 'mlp', 'hidden_dims': '[256, 128]', 'dropout': 0.192785698866823, 'batch_norm': True, 'lr': 2.8415318116138854e-05, 'weight_decay': 9.28189671541117e-07, 'epochs': 333, 'loss': 'mae', 'optimizer': 'adam', 'graph_mode': 'off', 'use_snp_selection': True, 'num_snps': 19468}. Best is trial 9 with value: 0.3016673276975667.
[I 2025-12-05 23:27:33,307] Trial 30 finished with value: 0.2866475859727922 and parameters: {'model_type': 'mlp', 'hidden_dims': '[256, 128, 64]', 'dropout': 0.17638962752580317, 'batch_norm': True, 'lr': 6.371797711530363e-05, 'weight_decay': 2.977855892197522e-06, 'epochs': 199, 'loss': 'mse', 'optimizer': 'adam', 'graph_mode': 'off', 'use_snp_selection': False}. Best is trial 9 with value: 0.3016673276975667.
[I 2025-12-05 23:27:46,458] Trial 31 finished with value: 0.2888361411030304 and parameters: {'model_type': 'mlp', 'hidden_dims': '[128, 64]', 'dropout': 0.10126391937142809, 'batch_norm': True, 'lr': 0.00011526791999089445, 'weight_decay': 2.3067680642911222e-07, 'epochs': 170, 'loss': 'mse', 'optimizer': 'adam', 'graph_mode': 'off', 'use_snp_selection': False}. Best is trial 9 with value: 0.3016673276975667.
[I 2025-12-05 23:28:18,100] Trial 32 finished with value: 0.2951091150834504 and parameters: {'model_type': 'mlp', 'hidden_dims': '[512, 256]', 'dropout': 0.1296513269062101, 'batch_norm': True, 'lr': 8.131548463532387e-05, 'weight_decay': 1.8342542141284837e-07, 'epochs': 150, 'loss': 'mse', 'optimizer': 'adam', 'graph_mode': 'off', 'use_snp_selection': False}. Best is trial 9 with value: 0.3016673276975667.
[I 2025-12-05 23:28:50,422] Trial 33 finished with value: 0.294087117726566 and parameters: {'model_type': 'mlp', 'hidden_dims': '[512, 256]', 'dropout': 0.13375946511435552, 'batch_norm': True, 'lr': 3.9814126614885726e-05, 'weight_decay': 5.823404365180375e-07, 'epochs': 154, 'loss': 'mse', 'optimizer': 'adam', 'graph_mode': 'off', 'use_snp_selection': False}. Best is trial 9 with value: 0.3016673276975667.
[I 2025-12-05 23:29:19,757] Trial 34 finished with value: 0.28909976743233484 and parameters: {'model_type': 'mlp', 'hidden_dims': '[512, 256]', 'dropout': 0.4776495763450488, 'batch_norm': True, 'lr': 7.899077889667424e-05, 'weight_decay': 1.6765975841903191e-07, 'epochs': 137, 'loss': 'mse', 'optimizer': 'adam', 'graph_mode': 'off', 'use_snp_selection': False}. Best is trial 9 with value: 0.3016673276975667.
[I 2025-12-05 23:30:18,817] Trial 35 finished with value: 0.2761517816468467 and parameters: {'model_type': 'mlp', 'hidden_dims': '[512, 256]', 'dropout': 0.1708034578552084, 'batch_norm': False, 'lr': 2.0463570704610496e-05, 'weight_decay': 1.1713448588744846e-06, 'epochs': 309, 'loss': 'mse', 'optimizer': 'adam', 'graph_mode': 'off', 'use_snp_selection': False}. Best is trial 9 with value: 0.3016673276975667.
[I 2025-12-05 23:31:37,494] Trial 36 finished with value: 0.2815078543147586 and parameters: {'model_type': 'mlp', 'hidden_dims': '[512, 128]', 'dropout': 0.20872453934940258, 'batch_norm': True, 'lr': 9.970946098782799e-06, 'weight_decay': 4.055676327200311e-07, 'epochs': 247, 'loss': 'mae', 'optimizer': 'adam', 'graph_mode': 'off', 'use_snp_selection': True, 'num_snps': 58661}. Best is trial 9 with value: 0.3016673276975667.
[I 2025-12-05 23:32:14,014] Trial 37 finished with value: 0.28756251963661206 and parameters: {'model_type': 'mlp', 'hidden_dims': '[256, 128]', 'dropout': 0.1282462424528316, 'batch_norm': True, 'lr': 0.00015481503145586223, 'weight_decay': 9.383321919652132e-06, 'epochs': 346, 'loss': 'mse', 'optimizer': 'adam', 'graph_mode': 'off', 'use_snp_selection': False}. Best is trial 9 with value: 0.3016673276975667.
[I 2025-12-05 23:32:52,245] Trial 38 finished with value: 0.2970116917988123 and parameters: {'model_type': 'mlp', 'hidden_dims': '[512, 256]', 'dropout': 0.16301614459348424, 'batch_norm': False, 'lr': 3.085888614832747e-06, 'weight_decay': 7.294286658728546e-07, 'epochs': 205, 'loss': 'mse', 'optimizer': 'adam', 'graph_mode': 'off', 'use_snp_selection': True, 'num_snps': 19911}. Best is trial 9 with value: 0.3016673276975667.
[I 2025-12-05 23:33:25,693] Trial 39 finished with value: 0.23101207735083049 and parameters: {'model_type': 'mlp', 'hidden_dims': '[256, 128, 64]', 'dropout': 0.25375283869460513, 'batch_norm': False, 'lr': 1.0331048247681746e-06, 'weight_decay': 1.4787276849767253e-06, 'epochs': 208, 'loss': 'mae', 'optimizer': 'adam', 'graph_mode': 'off', 'use_snp_selection': True, 'num_snps': 21018}. Best is trial 9 with value: 0.3016673276975667.
[I 2025-12-05 23:34:08,950] Trial 40 finished with value: 0.29164784046929004 and parameters: {'model_type': 'mlp', 'hidden_dims': '[512, 128]', 'dropout': 0.35345043086952455, 'batch_norm': False, 'lr': 2.7558505563369852e-06, 'weight_decay': 3.2163790857930605e-06, 'epochs': 233, 'loss': 'mse', 'optimizer': 'adam', 'graph_mode': 'off', 'use_snp_selection': True, 'num_snps': 24090}. Best is trial 9 with value: 0.3016673276975667.
[I 2025-12-05 23:35:06,705] Trial 41 finished with value: 0.2853924221816463 and parameters: {'model_type': 'mlp', 'hidden_dims': '[512, 256]', 'dropout': 0.16188841413720284, 'batch_norm': False, 'lr': 5.231240380202334e-05, 'weight_decay': 6.495157768605955e-07, 'epochs': 189, 'loss': 'mse', 'optimizer': 'adam', 'graph_mode': 'off', 'use_snp_selection': True, 'num_snps': 45129}. Best is trial 9 with value: 0.3016673276975667.
[I 2025-12-05 23:35:29,481] Trial 42 finished with value: 0.22268595778521227 and parameters: {'model_type': 'mlp', 'hidden_dims': '[512, 256]', 'dropout': 0.12791608162818366, 'batch_norm': False, 'lr': 2.3850872849141856e-06, 'weight_decay': 3.7571861133772805e-07, 'epochs': 159, 'loss': 'mse', 'optimizer': 'adam', 'graph_mode': 'off', 'use_snp_selection': True, 'num_snps': 2308}. Best is trial 9 with value: 0.3016673276975667.
[I 2025-12-05 23:36:01,811] Trial 43 finished with value: 0.2692999853463033 and parameters: {'model_type': 'mlp', 'hidden_dims': '[512, 256]', 'dropout': 0.1992681264158066, 'batch_norm': False, 'lr': 8.363460516529902e-05, 'weight_decay': 1.0148546052483216e-07, 'epochs': 145, 'loss': 'mse', 'optimizer': 'adam', 'graph_mode': 'off', 'use_snp_selection': True, 'num_snps': 16325}. Best is trial 9 with value: 0.3016673276975667.
[I 2025-12-05 23:36:38,021] Trial 44 finished with value: 0.2934517631129771 and parameters: {'model_type': 'mlp', 'hidden_dims': '[512, 256]', 'dropout': 0.23648661542298988, 'batch_norm': True, 'lr': 0.0002842688553652565, 'weight_decay': 1.4713298799339185e-07, 'epochs': 176, 'loss': 'mse', 'optimizer': 'adam', 'graph_mode': 'off', 'use_snp_selection': False}. Best is trial 9 with value: 0.3016673276975667.
[I 2025-12-05 23:37:30,478] Trial 45 finished with value: 0.27620578601773255 and parameters: {'model_type': 'mlp', 'hidden_dims': '[512, 256]', 'dropout': 0.11872232349088654, 'batch_norm': False, 'lr': 4.598549193782987e-05, 'weight_decay': 3.031588504558698e-07, 'epochs': 270, 'loss': 'mse', 'optimizer': 'adam', 'graph_mode': 'off', 'use_snp_selection': False}. Best is trial 9 with value: 0.3016673276975667.
[I 2025-12-05 23:38:06,651] Trial 46 finished with value: 0.2731108998318976 and parameters: {'model_type': 'mlp', 'hidden_dims': '[512, 128]', 'dropout': 0.15738334686831945, 'batch_norm': True, 'lr': 5.561947302065273e-06, 'weight_decay': 2.2212295829944014e-06, 'epochs': 87, 'loss': 'mae', 'optimizer': 'adam', 'graph_mode': 'off', 'use_snp_selection': True, 'num_snps': 27921}. Best is trial 9 with value: 0.3016673276975667.
[I 2025-12-05 23:38:30,092] Trial 47 finished with value: 0.2852084130337767 and parameters: {'model_type': 'mlp', 'hidden_dims': '[256, 128]', 'dropout': 0.2933032329817951, 'batch_norm': True, 'lr': 2.2791132957269095e-05, 'weight_decay': 9.348371596874158e-06, 'epochs': 205, 'loss': 'mse', 'optimizer': 'adam', 'graph_mode': 'off', 'use_snp_selection': False}. Best is trial 9 with value: 0.3016673276975667.
[I 2025-12-05 23:38:49,521] Trial 48 finished with value: 0.2833842360726835 and parameters: {'model_type': 'mlp', 'hidden_dims': '[128, 64]', 'dropout': 0.1792071997953216, 'batch_norm': False, 'lr': 6.255961347365243e-05, 'weight_decay': 3.193482319360242e-05, 'epochs': 291, 'loss': 'mse', 'optimizer': 'adam', 'graph_mode': 'off', 'use_snp_selection': False}. Best is trial 9 with value: 0.3016673276975667.
[I 2025-12-05 23:39:40,567] Trial 49 finished with value: 0.29492512993787345 and parameters: {'model_type': 'mlp', 'hidden_dims': '[512, 256]', 'dropout': 0.10125663315910784, 'batch_norm': True, 'lr': 0.00017504284718856595, 'weight_decay': 6.833964046804178e-07, 'epochs': 259, 'loss': 'mae', 'optimizer': 'adam', 'graph_mode': 'off', 'use_snp_selection': False}. Best is trial 9 with value: 0.3016673276975667.
[I 2025-12-05 23:40:08,801] Trial 50 finished with value: 0.28687963700901054 and parameters: {'model_type': 'mlp', 'hidden_dims': '[512, 128]', 'dropout': 0.1417143689165352, 'batch_norm': True, 'lr': 8.452204697918316e-05, 'weight_decay': 1.548126491741671e-06, 'epochs': 164, 'loss': 'mse', 'optimizer': 'adam', 'graph_mode': 'off', 'use_snp_selection': True, 'num_snps': 9659}. Best is trial 9 with value: 0.3016673276975667.
[I 2025-12-05 23:40:59,019] Trial 51 finished with value: 0.29607798636812194 and parameters: {'model_type': 'mlp', 'hidden_dims': '[512, 256]', 'dropout': 0.10052448547010731, 'batch_norm': True, 'lr': 0.0001587244426595252, 'weight_decay': 6.737651861398018e-07, 'epochs': 255, 'loss': 'mae', 'optimizer': 'adam', 'graph_mode': 'off', 'use_snp_selection': False}. Best is trial 9 with value: 0.3016673276975667.
[I 2025-12-05 23:41:57,537] Trial 52 finished with value: 0.29130406779131823 and parameters: {'model_type': 'mlp', 'hidden_dims': '[512, 256]', 'dropout': 0.12302155546478077, 'batch_norm': True, 'lr': 0.00014326443433839513, 'weight_decay': 4.4725811706474947e-07, 'epochs': 301, 'loss': 'mae', 'optimizer': 'adam', 'graph_mode': 'off', 'use_snp_selection': False}. Best is trial 9 with value: 0.3016673276975667.
[I 2025-12-05 23:42:44,222] Trial 53 finished with value: 0.2902899377695135 and parameters: {'model_type': 'mlp', 'hidden_dims': '[512, 256]', 'dropout': 0.158553283326429, 'batch_norm': True, 'lr': 0.00023714447884992703, 'weight_decay': 3.030519258175351e-07, 'epochs': 234, 'loss': 'mae', 'optimizer': 'adam', 'graph_mode': 'off', 'use_snp_selection': False}. Best is trial 9 with value: 0.3016673276975667.
[I 2025-12-05 23:43:35,522] Trial 54 finished with value: 0.2915484180909557 and parameters: {'model_type': 'mlp', 'hidden_dims': '[512, 256]', 'dropout': 0.11434993817443154, 'batch_norm': True, 'lr': 0.0003169651805159402, 'weight_decay': 0.00014515736057650768, 'epochs': 260, 'loss': 'mae', 'optimizer': 'adam', 'graph_mode': 'off', 'use_snp_selection': False}. Best is trial 9 with value: 0.3016673276975667.
[I 2025-12-05 23:43:52,790] Trial 55 finished with value: 0.28524283696602337 and parameters: {'model_type': 'mlp', 'hidden_dims': '[256, 128, 64]', 'dropout': 0.14609790973169356, 'batch_norm': True, 'lr': 4.750528279526019e-05, 'weight_decay': 8.967557128804008e-07, 'epochs': 135, 'loss': 'mae', 'optimizer': 'adam', 'graph_mode': 'off', 'use_snp_selection': False}. Best is trial 9 with value: 0.3016673276975667.
[I 2025-12-05 23:44:32,212] Trial 56 finished with value: 0.2941121434550408 and parameters: {'model_type': 'mlp', 'hidden_dims': '[512, 64]', 'dropout': 0.10105678178809556, 'batch_norm': True, 'lr': 9.277838858283586e-05, 'weight_decay': 1.7063000138712875e-07, 'epochs': 194, 'loss': 'mae', 'optimizer': 'adam', 'graph_mode': 'off', 'use_snp_selection': False}. Best is trial 9 with value: 0.3016673276975667.
[I 2025-12-05 23:45:15,151] Trial 57 finished with value: 0.29056844660592535 and parameters: {'model_type': 'mlp', 'hidden_dims': '[512, 256]', 'dropout': 0.4140687337780541, 'batch_norm': True, 'lr': 3.4263623018660466e-05, 'weight_decay': 7.35775017646046e-07, 'epochs': 213, 'loss': 'mse', 'optimizer': 'adam', 'graph_mode': 'off', 'use_snp_selection': False}. Best is trial 9 with value: 0.3016673276975667.
[I 2025-12-05 23:46:03,837] Trial 58 finished with value: 0.28791156967506415 and parameters: {'model_type': 'mlp', 'hidden_dims': '[512, 128]', 'dropout': 0.20619970080845507, 'batch_norm': True, 'lr': 0.0003944319250940838, 'weight_decay': 2.621574960272108e-06, 'epochs': 246, 'loss': 'mae', 'optimizer': 'adam', 'graph_mode': 'off', 'use_snp_selection': False}. Best is trial 9 with value: 0.3016673276975667.
[I 2025-12-05 23:46:48,289] Trial 59 finished with value: 0.20958760313033648 and parameters: {'model_type': 'mlp', 'hidden_dims': '[512, 64]', 'dropout': 0.1662794567282272, 'batch_norm': False, 'lr': 0.0006313979408994755, 'weight_decay': 1.1792204849741765e-06, 'epochs': 226, 'loss': 'mse', 'optimizer': 'adam', 'graph_mode': 'off', 'use_snp_selection': False}. Best is trial 9 with value: 0.3016673276975667.
[I 2025-12-05 23:47:24,676] Trial 60 finished with value: 0.28353482701602506 and parameters: {'model_type': 'mlp', 'hidden_dims': '[512, 256]', 'dropout': 0.13639794773525726, 'batch_norm': True, 'lr': 1.6327865231687378e-05, 'weight_decay': 3.958281319221464e-06, 'epochs': 176, 'loss': 'mse', 'optimizer': 'adam', 'graph_mode': 'off', 'use_snp_selection': False}. Best is trial 9 with value: 0.3016673276975667.
[I 2025-12-05 23:48:15,527] Trial 61 finished with value: 0.29332126795622804 and parameters: {'model_type': 'mlp', 'hidden_dims': '[512, 256]', 'dropout': 0.11442875487177472, 'batch_norm': True, 'lr': 0.00018520652237676672, 'weight_decay': 5.441605766244789e-07, 'epochs': 257, 'loss': 'mae', 'optimizer': 'adam', 'graph_mode': 'off', 'use_snp_selection': False}. Best is trial 9 with value: 0.3016673276975667.
[I 2025-12-05 23:49:07,920] Trial 62 finished with value: 0.2969616763308898 and parameters: {'model_type': 'mlp', 'hidden_dims': '[512, 256]', 'dropout': 0.10330054843269833, 'batch_norm': True, 'lr': 0.00014817555644007128, 'weight_decay': 2.410631751090926e-07, 'epochs': 266, 'loss': 'mae', 'optimizer': 'adam', 'graph_mode': 'off', 'use_snp_selection': False}. Best is trial 9 with value: 0.3016673276975667.
[I 2025-12-05 23:50:04,901] Trial 63 finished with value: 0.29302049631903576 and parameters: {'model_type': 'mlp', 'hidden_dims': '[512, 256]', 'dropout': 0.12290174259123873, 'batch_norm': True, 'lr': 0.00012750187754381414, 'weight_decay': 2.47973170216897e-07, 'epochs': 292, 'loss': 'mae', 'optimizer': 'adam', 'graph_mode': 'off', 'use_snp_selection': False}. Best is trial 9 with value: 0.3016673276975667.
[I 2025-12-05 23:51:10,256] Trial 64 finished with value: 0.29390668978995327 and parameters: {'model_type': 'mlp', 'hidden_dims': '[512, 256]', 'dropout': 0.19010097304186824, 'batch_norm': True, 'lr': 0.00023253090214676208, 'weight_decay': 1.3901643202064967e-07, 'epochs': 321, 'loss': 'mae', 'optimizer': 'adam', 'graph_mode': 'off', 'use_snp_selection': False}. Best is trial 9 with value: 0.3016673276975667.
[I 2025-12-05 23:51:29,010] Trial 65 finished with value: 0.2929052945995462 and parameters: {'model_type': 'mlp', 'hidden_dims': '[128, 64]', 'dropout': 0.15284269462926078, 'batch_norm': True, 'lr': 6.654361430116189e-05, 'weight_decay': 3.837688946646007e-07, 'epochs': 271, 'loss': 'mae', 'optimizer': 'adam', 'graph_mode': 'off', 'use_snp_selection': False}. Best is trial 9 with value: 0.3016673276975667.
[I 2025-12-05 23:52:23,697] Trial 66 finished with value: 0.2927079990755492 and parameters: {'model_type': 'mlp', 'hidden_dims': '[512, 64]', 'dropout': 0.13837099415946047, 'batch_norm': True, 'lr': 2.7733617730791087e-05, 'weight_decay': 2.2480389603878018e-07, 'epochs': 281, 'loss': 'mae', 'optimizer': 'adam', 'graph_mode': 'off', 'use_snp_selection': False}. Best is trial 9 with value: 0.3016673276975667.
[I 2025-12-05 23:53:01,972] Trial 67 finished with value: 0.29529257828886324 and parameters: {'model_type': 'mlp', 'hidden_dims': '[512, 256]', 'dropout': 0.11116329298829776, 'batch_norm': True, 'lr': 0.00010893709722579277, 'weight_decay': 7.268406199847319e-06, 'epochs': 185, 'loss': 'mse', 'optimizer': 'adam', 'graph_mode': 'off', 'use_snp_selection': False}. Best is trial 9 with value: 0.3016673276975667.
[I 2025-12-05 23:53:46,724] Trial 68 finished with value: 0.29184731275809783 and parameters: {'model_type': 'mlp', 'hidden_dims': '[256, 128]', 'dropout': 0.11250485949594133, 'batch_norm': True, 'lr': 0.00012133806764658291, 'weight_decay': 6.732265374395023e-06, 'epochs': 217, 'loss': 'mae', 'optimizer': 'adam', 'graph_mode': 'off', 'use_snp_selection': True, 'num_snps': 39536}. Best is trial 9 with value: 0.3016673276975667.
[I 2025-12-05 23:54:27,235] Trial 69 finished with value: 0.28898711185771064 and parameters: {'model_type': 'mlp', 'hidden_dims': '[512, 128]', 'dropout': 0.5771574376880082, 'batch_norm': True, 'lr': 0.00015674271598789806, 'weight_decay': 2.327273572135733e-05, 'epochs': 201, 'loss': 'mse', 'optimizer': 'adam', 'graph_mode': 'off', 'use_snp_selection': False}. Best is trial 9 with value: 0.3016673276975667.
[I 2025-12-05 23:55:16,877] Trial 70 finished with value: 0.29413467078061956 and parameters: {'model_type': 'mlp', 'hidden_dims': '[512, 256]', 'dropout': 0.1827680650924113, 'batch_norm': True, 'lr': 9.878603904075239e-05, 'weight_decay': 1.4652843701890563e-05, 'epochs': 251, 'loss': 'mse', 'optimizer': 'adam', 'graph_mode': 'off', 'use_snp_selection': False}. Best is trial 9 with value: 0.3016673276975667.
[I 2025-12-05 23:55:55,040] Trial 71 finished with value: 0.29306470277869856 and parameters: {'model_type': 'mlp', 'hidden_dims': '[512, 256]', 'dropout': 0.1289930242979679, 'batch_norm': True, 'lr': 5.422223159533389e-05, 'weight_decay': 7.0006675392774785e-06, 'epochs': 186, 'loss': 'mse', 'optimizer': 'adam', 'graph_mode': 'off', 'use_snp_selection': False}. Best is trial 9 with value: 0.3016673276975667.
[I 2025-12-05 23:56:26,291] Trial 72 finished with value: 0.29236784939875904 and parameters: {'model_type': 'mlp', 'hidden_dims': '[512, 256]', 'dropout': 0.10127844331888505, 'batch_norm': True, 'lr': 0.0001962231109170942, 'weight_decay': 1.2676673579834068e-06, 'epochs': 147, 'loss': 'mse', 'optimizer': 'adam', 'graph_mode': 'off', 'use_snp_selection': False}. Best is trial 9 with value: 0.3016673276975667.
[I 2025-12-05 23:57:13,510] Trial 73 finished with value: 0.2976399941255487 and parameters: {'model_type': 'mlp', 'hidden_dims': '[512, 256]', 'dropout': 0.14472381135514317, 'batch_norm': True, 'lr': 0.00010310174392880625, 'weight_decay': 1.820634480290679e-06, 'epochs': 237, 'loss': 'mse', 'optimizer': 'adam', 'graph_mode': 'off', 'use_snp_selection': False}. Best is trial 9 with value: 0.3016673276975667.
[I 2025-12-05 23:58:05,978] Trial 74 finished with value: 0.29306519044741375 and parameters: {'model_type': 'mlp', 'hidden_dims': '[512, 256]', 'dropout': 0.14609343567331523, 'batch_norm': True, 'lr': 0.0001365693290302286, 'weight_decay': 8.84620926323704e-07, 'epochs': 267, 'loss': 'mse', 'optimizer': 'adam', 'graph_mode': 'off', 'use_snp_selection': False}. Best is trial 9 with value: 0.3016673276975667.
[I 2025-12-05 23:58:32,375] Trial 75 finished with value: 0.2766754767723149 and parameters: {'model_type': 'mlp', 'hidden_dims': '[256, 128, 64]', 'dropout': 0.1131717078582864, 'batch_norm': False, 'lr': 0.00010271646062323686, 'weight_decay': 1.9938995572503877e-06, 'epochs': 239, 'loss': 'mse', 'optimizer': 'adam', 'graph_mode': 'off', 'use_snp_selection': False}. Best is trial 9 with value: 0.3016673276975667.
[I 2025-12-05 23:59:17,185] Trial 76 finished with value: 0.28948367886971516 and parameters: {'model_type': 'mlp', 'hidden_dims': '[512, 64]', 'dropout': 0.1693006549369971, 'batch_norm': True, 'lr': 0.00026739490539894403, 'weight_decay': 3.867460847877996e-06, 'epochs': 225, 'loss': 'mse', 'optimizer': 'adam', 'graph_mode': 'off', 'use_snp_selection': False}. Best is trial 9 with value: 0.3016673276975667.
