[I 2025-12-06 07:41:28,291] Trial 120 finished with value: 0.3499004029012382 and parameters: {'model_type': 'mlp', 'hidden_dims': '[256, 128, 64]', 'dropout': 0.5067956483782856, 'batch_norm': False, 'lr': 3.152144524373883e-06, 'weight_decay': 7.329435054755004e-07, 'epochs': 139, 'loss': 'mse', 'optimizer': 'adam', 'graph_mode': 'off', 'use_snp_selection': True, 'num_snps': 50722}. Best is trial 107 with value: 0.37800007718678985.
[I 2025-12-06 07:42:28,475] Trial 121 finished with value: 0.37146557713406436 and parameters: {'model_type': 'mlp', 'hidden_dims': '[512, 128]', 'dropout': 0.5368832232203057, 'batch_norm': False, 'lr': 6.071146882778489e-06, 'weight_decay': 2.559381104107293e-07, 'epochs': 128, 'loss': 'mse', 'optimizer': 'adam', 'graph_mode': 'off', 'use_snp_selection': True, 'num_snps': 56550}. Best is trial 107 with value: 0.37800007718678985.
[I 2025-12-06 07:43:33,905] Trial 122 finished with value: 0.37180631510249923 and parameters: {'model_type': 'mlp', 'hidden_dims': '[512, 128]', 'dropout': 0.5635312037128026, 'batch_norm': False, 'lr': 7.1459882916588034e-06, 'weight_decay': 4.0050538930158e-07, 'epochs': 143, 'loss': 'mse', 'optimizer': 'adam', 'graph_mode': 'off', 'use_snp_selection': True, 'num_snps': 59987}. Best is trial 107 with value: 0.37800007718678985.
[I 2025-12-06 07:44:25,666] Trial 123 finished with value: 0.37126614740907177 and parameters: {'model_type': 'mlp', 'hidden_dims': '[512, 128]', 'dropout': 0.5250677646498104, 'batch_norm': False, 'lr': 5.560210345899584e-06, 'weight_decay': 5.629590636967917e-07, 'epochs': 86, 'loss': 'mse', 'optimizer': 'adam', 'graph_mode': 'off', 'use_snp_selection': True, 'num_snps': 54343}. Best is trial 107 with value: 0.37800007718678985.
[I 2025-12-06 07:45:27,324] Trial 124 finished with value: 0.372247440605696 and parameters: {'model_type': 'mlp', 'hidden_dims': '[512, 128]', 'dropout': 0.5465683729972264, 'batch_norm': False, 'lr': 4.016753208573518e-06, 'weight_decay': 2.937242822570746e-07, 'epochs': 133, 'loss': 'mse', 'optimizer': 'adam', 'graph_mode': 'off', 'use_snp_selection': True, 'num_snps': 57571}. Best is trial 107 with value: 0.37800007718678985.
[I 2025-12-06 07:46:33,334] Trial 125 finished with value: 0.3692724038246972 and parameters: {'model_type': 'mlp', 'hidden_dims': '[512, 128]', 'dropout': 0.5681415144010857, 'batch_norm': False, 'lr': 8.542999155683758e-06, 'weight_decay': 1.8596715883173024e-07, 'epochs': 165, 'loss': 'mse', 'optimizer': 'adam', 'graph_mode': 'off', 'use_snp_selection': True, 'num_snps': 55674}. Best is trial 107 with value: 0.37800007718678985.
[I 2025-12-06 07:47:34,485] Trial 126 finished with value: 0.3746378152059986 and parameters: {'model_type': 'mlp', 'hidden_dims': '[512, 64]', 'dropout': 0.5185003328225607, 'batch_norm': False, 'lr': 4.818339977870648e-06, 'weight_decay': 1.19997082738309e-07, 'epochs': 123, 'loss': 'mse', 'optimizer': 'adam', 'graph_mode': 'off', 'use_snp_selection': True, 'num_snps': 58948}. Best is trial 107 with value: 0.37800007718678985.
[I 2025-12-06 07:48:36,280] Trial 127 finished with value: 0.37439894377746763 and parameters: {'model_type': 'mlp', 'hidden_dims': '[512, 64]', 'dropout': 0.5167562044280996, 'batch_norm': False, 'lr': 4.296268508673008e-06, 'weight_decay': 1.3873212814396666e-07, 'epochs': 151, 'loss': 'mse', 'optimizer': 'adam', 'graph_mode': 'off', 'use_snp_selection': True, 'num_snps': 53676}. Best is trial 107 with value: 0.37800007718678985.
[I 2025-12-06 07:49:41,114] Trial 128 finished with value: 0.31541265235105176 and parameters: {'model_type': 'mlp', 'hidden_dims': '[512, 64]', 'dropout': 0.18470874038357674, 'batch_norm': True, 'lr': 4.753971483200613e-06, 'weight_decay': 1.2174085498390524e-07, 'epochs': 151, 'loss': 'mse', 'optimizer': 'adam', 'graph_mode': 'off', 'use_snp_selection': True, 'num_snps': 56935}. Best is trial 107 with value: 0.37800007718678985.
[I 2025-12-06 07:50:39,841] Trial 129 finished with value: 0.36753484437422246 and parameters: {'model_type': 'mlp', 'hidden_dims': '[512, 64]', 'dropout': 0.5172933388592846, 'batch_norm': False, 'lr': 4.172129426192941e-06, 'weight_decay': 1.4552589752937558e-07, 'epochs': 112, 'loss': 'mse', 'optimizer': 'adam', 'graph_mode': 'off', 'use_snp_selection': True, 'num_snps': 58731}. Best is trial 107 with value: 0.37800007718678985.
[I 2025-12-06 07:51:21,425] Trial 130 finished with value: 0.36888862028906766 and parameters: {'model_type': 'mlp', 'hidden_dims': '[512, 64]', 'dropout': 0.5335585635226877, 'batch_norm': False, 'lr': 3.5068268189936604e-06, 'weight_decay': 1.5898648199581668e-07, 'epochs': 154, 'loss': 'mse', 'optimizer': 'adam', 'graph_mode': 'off', 'use_snp_selection': True, 'num_snps': 26112}. Best is trial 107 with value: 0.37800007718678985.
[I 2025-12-06 07:52:18,642] Trial 131 finished with value: 0.3728953809633 and parameters: {'model_type': 'mlp', 'hidden_dims': '[512, 64]', 'dropout': 0.5056689176077451, 'batch_norm': False, 'lr': 5.12752669436602e-06, 'weight_decay': 1.2554876700840386e-06, 'epochs': 123, 'loss': 'mse', 'optimizer': 'adam', 'graph_mode': 'off', 'use_snp_selection': True, 'num_snps': 53334}. Best is trial 107 with value: 0.37800007718678985.
[I 2025-12-06 07:53:19,808] Trial 132 finished with value: 0.36980178054772417 and parameters: {'model_type': 'mlp', 'hidden_dims': '[512, 64]', 'dropout': 0.5530299709480637, 'batch_norm': False, 'lr': 6.066206797794638e-06, 'weight_decay': 1.2365483319338057e-07, 'epochs': 143, 'loss': 'mse', 'optimizer': 'adam', 'graph_mode': 'off', 'use_snp_selection': True, 'num_snps': 54695}. Best is trial 107 with value: 0.37800007718678985.
[I 2025-12-06 07:54:14,243] Trial 133 finished with value: 0.36577086603843384 and parameters: {'model_type': 'mlp', 'hidden_dims': '[512, 64]', 'dropout': 0.54212830618549, 'batch_norm': False, 'lr': 2.778691696754812e-06, 'weight_decay': 2.1948061703848922e-07, 'epochs': 129, 'loss': 'mse', 'optimizer': 'adam', 'graph_mode': 'off', 'use_snp_selection': True, 'num_snps': 47795}. Best is trial 107 with value: 0.37800007718678985.
[I 2025-12-06 07:54:57,619] Trial 134 finished with value: 0.36154246861642225 and parameters: {'model_type': 'mlp', 'hidden_dims': '[128, 64]', 'dropout': 0.5180494372176221, 'batch_norm': False, 'lr': 4.500596148232928e-06, 'weight_decay': 6.13835458259117e-07, 'epochs': 124, 'loss': 'mse', 'optimizer': 'adam', 'graph_mode': 'off', 'use_snp_selection': True, 'num_snps': 55980}. Best is trial 107 with value: 0.37800007718678985.
[I 2025-12-06 07:55:52,236] Trial 135 finished with value: 0.37628115675545976 and parameters: {'model_type': 'mlp', 'hidden_dims': '[512, 64]', 'dropout': 0.4852846469878694, 'batch_norm': False, 'lr': 5.437042164658065e-06, 'weight_decay': 4.844877162756175e-07, 'epochs': 115, 'loss': 'mse', 'optimizer': 'adam', 'graph_mode': 'off', 'use_snp_selection': True, 'num_snps': 51489}. Best is trial 107 with value: 0.37800007718678985.
[I 2025-12-06 07:56:47,265] Trial 136 finished with value: 0.37181596317238264 and parameters: {'model_type': 'mlp', 'hidden_dims': '[512, 64]', 'dropout': 0.5302147108624664, 'batch_norm': False, 'lr': 5.447168339361126e-06, 'weight_decay': 4.2411571485393714e-07, 'epochs': 118, 'loss': 'mse', 'optimizer': 'adam', 'graph_mode': 'off', 'use_snp_selection': True, 'num_snps': 51480}. Best is trial 107 with value: 0.37800007718678985.
[I 2025-12-06 07:57:43,728] Trial 137 finished with value: 0.3732802830293205 and parameters: {'model_type': 'mlp', 'hidden_dims': '[512, 64]', 'dropout': 0.47512108065574477, 'batch_norm': False, 'lr': 3.7920103646283817e-06, 'weight_decay': 7.832826317388152e-07, 'epochs': 136, 'loss': 'mse', 'optimizer': 'adam', 'graph_mode': 'off', 'use_snp_selection': True, 'num_snps': 49170}. Best is trial 107 with value: 0.37800007718678985.
[I 2025-12-06 07:58:06,924] Trial 138 finished with value: 0.25416187029943343 and parameters: {'model_type': 'mlp', 'hidden_dims': '[512, 64]', 'dropout': 0.5044853102391796, 'batch_norm': False, 'lr': 3.2002792858297063e-06, 'weight_decay': 5.181286183719344e-07, 'epochs': 105, 'loss': 'mse', 'optimizer': 'adam', 'graph_mode': 'off', 'use_snp_selection': True, 'num_snps': 2563}. Best is trial 107 with value: 0.37800007718678985.
[I 2025-12-06 07:59:13,053] Trial 139 finished with value: 0.37017000298078667 and parameters: {'model_type': 'mlp', 'hidden_dims': '[512, 64]', 'dropout': 0.4847059392164108, 'batch_norm': False, 'lr': 6.149713487325867e-06, 'weight_decay': 3.136048473540889e-07, 'epochs': 160, 'loss': 'mse', 'optimizer': 'adam', 'graph_mode': 'off', 'use_snp_selection': True, 'num_snps': 57428}. Best is trial 107 with value: 0.37800007718678985.
[I 2025-12-06 08:00:07,921] Trial 140 finished with value: 0.36941375197165394 and parameters: {'model_type': 'mlp', 'hidden_dims': '[512, 128]', 'dropout': 0.5229409208367666, 'batch_norm': False, 'lr': 4.932795276201159e-06, 'weight_decay': 2.1255943982050673e-07, 'epochs': 113, 'loss': 'mse', 'optimizer': 'adam', 'graph_mode': 'off', 'use_snp_selection': True, 'num_snps': 52062}. Best is trial 107 with value: 0.37800007718678985.
[I 2025-12-06 08:00:59,877] Trial 141 finished with value: 0.37463392501953174 and parameters: {'model_type': 'mlp', 'hidden_dims': '[512, 128]', 'dropout': 0.4940584441741954, 'batch_norm': False, 'lr': 7.360044985773272e-06, 'weight_decay': 9.720381948654153e-07, 'epochs': 90, 'loss': 'mse', 'optimizer': 'adam', 'graph_mode': 'off', 'use_snp_selection': True, 'num_snps': 53458}. Best is trial 107 with value: 0.37800007718678985.
[I 2025-12-06 08:01:51,971] Trial 142 finished with value: 0.3729208948721494 and parameters: {'model_type': 'mlp', 'hidden_dims': '[512, 128]', 'dropout': 0.5112866787884038, 'batch_norm': False, 'lr': 8.741641834622939e-06, 'weight_decay': 9.477323739793667e-07, 'epochs': 90, 'loss': 'mse', 'optimizer': 'adam', 'graph_mode': 'off', 'use_snp_selection': True, 'num_snps': 53886}. Best is trial 107 with value: 0.37800007718678985.
[I 2025-12-06 08:02:36,390] Trial 143 finished with value: 0.3328374129496387 and parameters: {'model_type': 'mlp', 'hidden_dims': '[256, 128, 64]', 'dropout': 0.5408356851478671, 'batch_norm': False, 'lr': 6.988702046850609e-06, 'weight_decay': 5.998637807874086e-07, 'epochs': 65, 'loss': 'mse', 'optimizer': 'adam', 'graph_mode': 'off', 'use_snp_selection': True, 'num_snps': 58957}. Best is trial 107 with value: 0.37800007718678985.
[I 2025-12-06 08:03:31,889] Trial 144 finished with value: 0.36843381616973414 and parameters: {'model_type': 'mlp', 'hidden_dims': '[512, 128]', 'dropout': 0.45130559640499057, 'batch_norm': False, 'lr': 1.0943181405687962e-05, 'weight_decay': 7.616858605725788e-07, 'epochs': 108, 'loss': 'mse', 'optimizer': 'adam', 'graph_mode': 'off', 'use_snp_selection': True, 'num_snps': 55041}. Best is trial 107 with value: 0.37800007718678985.
[I 2025-12-06 08:04:24,391] Trial 145 finished with value: 0.3680191823674952 and parameters: {'model_type': 'mlp', 'hidden_dims': '[512, 128]', 'dropout': 0.5533000970289658, 'batch_norm': False, 'lr': 4.308678030742529e-06, 'weight_decay': 1.763161852285137e-07, 'epochs': 81, 'loss': 'mse', 'optimizer': 'adam', 'graph_mode': 'off', 'use_snp_selection': True, 'num_snps': 57352}. Best is trial 107 with value: 0.37800007718678985.
[I 2025-12-06 08:05:16,285] Trial 146 finished with value: 0.37111469382394996 and parameters: {'model_type': 'mlp', 'hidden_dims': '[512, 128]', 'dropout': 0.4985514716557417, 'batch_norm': False, 'lr': 5.530786064914075e-06, 'weight_decay': 2.6913003914270066e-07, 'epochs': 100, 'loss': 'mse', 'optimizer': 'adam', 'graph_mode': 'off', 'use_snp_selection': True, 'num_snps': 50115}. Best is trial 107 with value: 0.37800007718678985.
[I 2025-12-06 08:05:45,466] Trial 147 finished with value: 0.34552227017350706 and parameters: {'model_type': 'mlp', 'hidden_dims': '[512, 64]', 'dropout': 0.5758238729019037, 'batch_norm': False, 'lr': 7.0789410216251905e-06, 'weight_decay': 4.2442505661272585e-07, 'epochs': 69, 'loss': 'mse', 'optimizer': 'adam', 'graph_mode': 'off', 'use_snp_selection': True, 'num_snps': 15374}. Best is trial 107 with value: 0.37800007718678985.
[I 2025-12-06 08:06:48,679] Trial 148 finished with value: 0.3715136623081855 and parameters: {'model_type': 'mlp', 'hidden_dims': '[512, 128]', 'dropout': 0.532221358617448, 'batch_norm': False, 'lr': 6.152374480409649e-06, 'weight_decay': 1.1348693533002751e-06, 'epochs': 147, 'loss': 'mse', 'optimizer': 'adam', 'graph_mode': 'off', 'use_snp_selection': True, 'num_snps': 56295}. Best is trial 107 with value: 0.37800007718678985.
[I 2025-12-06 08:07:30,222] Trial 149 finished with value: 0.3732605167473596 and parameters: {'model_type': 'mlp', 'hidden_dims': '[128, 64]', 'dropout': 0.4859425273406912, 'batch_norm': False, 'lr': 9.60604680854967e-06, 'weight_decay': 1.0894945945625835e-07, 'epochs': 116, 'loss': 'mse', 'optimizer': 'adam', 'graph_mode': 'off', 'use_snp_selection': True, 'num_snps': 53071}. Best is trial 107 with value: 0.37800007718678985.
[I 2025-12-06 08:08:31,222] Trial 0 finished with value: 0.31912177649425066 and parameters: {'model_type': 'mlp', 'hidden_dims': '[128, 64]', 'dropout': 0.199031432379812, 'batch_norm': True, 'lr': 1.8408544111075837e-06, 'weight_decay': 5.5136510071208614e-05, 'epochs': 336, 'loss': 'mae', 'optimizer': 'adam', 'graph_mode': 'off', 'use_snp_selection': True, 'num_snps': 43862}. Best is trial 0 with value: 0.31912177649425066.
[I 2025-12-06 08:08:59,836] Trial 1 finished with value: 0.3370710075521506 and parameters: {'model_type': 'mlp', 'hidden_dims': '[256, 128]', 'dropout': 0.4370668075331726, 'batch_norm': True, 'lr': 7.133471581159139e-05, 'weight_decay': 1.128633586803549e-05, 'epochs': 242, 'loss': 'mae', 'optimizer': 'adam', 'graph_mode': 'off', 'use_snp_selection': False}. Best is trial 1 with value: 0.3370710075521506.
[I 2025-12-06 08:09:27,502] Trial 2 finished with value: 0.3431717427450443 and parameters: {'model_type': 'mlp', 'hidden_dims': '[256, 128, 64]', 'dropout': 0.41314357415569625, 'batch_norm': False, 'lr': 3.952233718592101e-06, 'weight_decay': 0.00026754769258252603, 'epochs': 149, 'loss': 'mse', 'optimizer': 'adam', 'graph_mode': 'off', 'use_snp_selection': True, 'num_snps': 11571}. Best is trial 2 with value: 0.3431717427450443.
[I 2025-12-06 08:10:32,840] Trial 3 finished with value: 0.3744328361700285 and parameters: {'model_type': 'mlp', 'hidden_dims': '[512, 64]', 'dropout': 0.5938127374509361, 'batch_norm': False, 'lr': 5.67704586114731e-06, 'weight_decay': 2.4518087630137052e-05, 'epochs': 320, 'loss': 'mae', 'optimizer': 'adam', 'graph_mode': 'off', 'use_snp_selection': False}. Best is trial 3 with value: 0.3744328361700285.
[I 2025-12-06 08:11:37,531] Trial 4 finished with value: 0.3156539863701352 and parameters: {'model_type': 'mlp', 'hidden_dims': '[512, 128]', 'dropout': 0.25746343592134413, 'batch_norm': True, 'lr': 1.3467657668402788e-06, 'weight_decay': 0.00033087251918647806, 'epochs': 277, 'loss': 'mse', 'optimizer': 'adam', 'graph_mode': 'off', 'use_snp_selection': True, 'num_snps': 36675}. Best is trial 3 with value: 0.3744328361700285.
[I 2025-12-06 08:12:22,874] Trial 5 finished with value: 0.29795383071835413 and parameters: {'model_type': 'mlp', 'hidden_dims': '[512, 64]', 'dropout': 0.38275350994408375, 'batch_norm': True, 'lr': 1.5586664309232824e-06, 'weight_decay': 0.0008227664668621182, 'epochs': 145, 'loss': 'mae', 'optimizer': 'adam', 'graph_mode': 'off', 'use_snp_selection': True, 'num_snps': 32148}. Best is trial 3 with value: 0.3744328361700285.
[I 2025-12-06 08:12:46,660] Trial 6 finished with value: 0.3455878819246566 and parameters: {'model_type': 'mlp', 'hidden_dims': '[256, 128]', 'dropout': 0.3930109900265879, 'batch_norm': False, 'lr': 4.892964372128395e-05, 'weight_decay': 1.5809549317992182e-06, 'epochs': 199, 'loss': 'mse', 'optimizer': 'adam', 'graph_mode': 'off', 'use_snp_selection': False}. Best is trial 3 with value: 0.3744328361700285.
[I 2025-12-06 08:13:10,635] Trial 7 finished with value: 0.3522465505585947 and parameters: {'model_type': 'mlp', 'hidden_dims': '[512, 256]', 'dropout': 0.15343979219678458, 'batch_norm': True, 'lr': 6.234003099047341e-05, 'weight_decay': 3.894760610535477e-07, 'epochs': 97, 'loss': 'mse', 'optimizer': 'adam', 'graph_mode': 'off', 'use_snp_selection': False}. Best is trial 3 with value: 0.3744328361700285.
[I 2025-12-06 08:14:16,107] Trial 8 finished with value: 0.3437340828162408 and parameters: {'model_type': 'mlp', 'hidden_dims': '[512, 128]', 'dropout': 0.10743001231661406, 'batch_norm': True, 'lr': 0.00023728538449271062, 'weight_decay': 1.7629071578048637e-05, 'epochs': 312, 'loss': 'mae', 'optimizer': 'adam', 'graph_mode': 'off', 'use_snp_selection': False}. Best is trial 3 with value: 0.3744328361700285.
[I 2025-12-06 08:14:55,197] Trial 9 finished with value: 0.34325517409003636 and parameters: {'model_type': 'mlp', 'hidden_dims': '[512, 64]', 'dropout': 0.14505336736221927, 'batch_norm': True, 'lr': 5.8619638388111826e-05, 'weight_decay': 6.200156172669308e-07, 'epochs': 175, 'loss': 'mse', 'optimizer': 'adam', 'graph_mode': 'off', 'use_snp_selection': False}. Best is trial 3 with value: 0.3744328361700285.
[I 2025-12-06 08:15:10,974] Trial 10 finished with value: 0.3484322442497153 and parameters: {'model_type': 'mlp', 'hidden_dims': '[512, 64]', 'dropout': 0.5885461262002587, 'batch_norm': False, 'lr': 8.769366258768696e-06, 'weight_decay': 2.78273193871783e-06, 'epochs': 55, 'loss': 'mae', 'optimizer': 'adam', 'graph_mode': 'off', 'use_snp_selection': False}. Best is trial 3 with value: 0.3744328361700285.
[I 2025-12-06 08:15:30,874] Trial 11 finished with value: 0.37449933585045914 and parameters: {'model_type': 'mlp', 'hidden_dims': '[512, 256]', 'dropout': 0.583942291816117, 'batch_norm': False, 'lr': 1.422933652790185e-05, 'weight_decay': 1.18635098029648e-07, 'epochs': 77, 'loss': 'mse', 'optimizer': 'adam', 'graph_mode': 'off', 'use_snp_selection': False}. Best is trial 11 with value: 0.37449933585045914.
[I 2025-12-06 08:15:43,784] Trial 12 finished with value: 0.32330429067021477 and parameters: {'model_type': 'mlp', 'hidden_dims': '[512, 256]', 'dropout': 0.593097749012682, 'batch_norm': False, 'lr': 1.1374686318732863e-05, 'weight_decay': 1.3081036432574914e-07, 'epochs': 40, 'loss': 'mae', 'optimizer': 'adam', 'graph_mode': 'off', 'use_snp_selection': False}. Best is trial 11 with value: 0.37449933585045914.
[I 2025-12-06 08:16:33,714] Trial 13 finished with value: 0.3475704377485939 and parameters: {'model_type': 'mlp', 'hidden_dims': '[512, 256]', 'dropout': 0.5043641748401543, 'batch_norm': False, 'lr': 1.4304506621636526e-05, 'weight_decay': 5.0135437753417527e-05, 'epochs': 235, 'loss': 'mse', 'optimizer': 'adam', 'graph_mode': 'off', 'use_snp_selection': False}. Best is trial 11 with value: 0.37449933585045914.
[I 2025-12-06 08:16:43,305] Trial 14 finished with value: 0.3502502960762582 and parameters: {'model_type': 'mlp', 'hidden_dims': '[128, 64]', 'dropout': 0.5300180653494536, 'batch_norm': False, 'lr': 5.096356034191146e-06, 'weight_decay': 3.0607358611649674e-06, 'epochs': 93, 'loss': 'mse', 'optimizer': 'adam', 'graph_mode': 'off', 'use_snp_selection': False}. Best is trial 11 with value: 0.37449933585045914.
[I 2025-12-06 08:17:15,826] Trial 15 finished with value: 0.346534712893567 and parameters: {'model_type': 'mlp', 'hidden_dims': '[256, 128, 64]', 'dropout': 0.29817671914947536, 'batch_norm': False, 'lr': 1.8411764708572348e-05, 'weight_decay': 4.4084956876871386e-05, 'epochs': 278, 'loss': 'mae', 'optimizer': 'adam', 'graph_mode': 'off', 'use_snp_selection': False}. Best is trial 11 with value: 0.37449933585045914.
[I 2025-12-06 08:18:26,163] Trial 16 finished with value: 0.3168761810863871 and parameters: {'model_type': 'mlp', 'hidden_dims': '[512, 256]', 'dropout': 0.4992385332513618, 'batch_norm': False, 'lr': 0.00017549215405955411, 'weight_decay': 1.3070443894198984e-07, 'epochs': 350, 'loss': 'mse', 'optimizer': 'adam', 'graph_mode': 'off', 'use_snp_selection': False}. Best is trial 11 with value: 0.37449933585045914.
[I 2025-12-06 08:18:52,426] Trial 17 finished with value: 0.05168828298505351 and parameters: {'model_type': 'mlp', 'hidden_dims': '[512, 64]', 'dropout': 0.543474321376226, 'batch_norm': False, 'lr': 0.000906375209920231, 'weight_decay': 6.503919561253859e-06, 'epochs': 113, 'loss': 'mae', 'optimizer': 'adam', 'graph_mode': 'off', 'use_snp_selection': False}. Best is trial 11 with value: 0.37449933585045914.
[I 2025-12-06 08:20:09,165] Trial 18 finished with value: 0.3710271663056902 and parameters: {'model_type': 'mlp', 'hidden_dims': '[512, 256]', 'dropout': 0.4928065509878574, 'batch_norm': False, 'lr': 3.8282888633697165e-06, 'weight_decay': 0.00015435589843114137, 'epochs': 214, 'loss': 'mse', 'optimizer': 'adam', 'graph_mode': 'off', 'use_snp_selection': True, 'num_snps': 58241}. Best is trial 11 with value: 0.37449933585045914.
[I 2025-12-06 08:21:06,702] Trial 19 finished with value: 0.348004952676086 and parameters: {'model_type': 'mlp', 'hidden_dims': '[512, 64]', 'dropout': 0.44786810823414697, 'batch_norm': False, 'lr': 2.7694571046960796e-05, 'weight_decay': 5.724339384591128e-07, 'epochs': 281, 'loss': 'mae', 'optimizer': 'adam', 'graph_mode': 'off', 'use_snp_selection': False}. Best is trial 11 with value: 0.37449933585045914.
[I 2025-12-06 08:21:25,978] Trial 20 finished with value: 0.36811377788204835 and parameters: {'model_type': 'mlp', 'hidden_dims': '[512, 128]', 'dropout': 0.31622655364259217, 'batch_norm': False, 'lr': 6.91107062941075e-06, 'weight_decay': 2.417613357794622e-05, 'epochs': 73, 'loss': 'mae', 'optimizer': 'adam', 'graph_mode': 'off', 'use_snp_selection': False}. Best is trial 11 with value: 0.37449933585045914.
