[I 2025-12-05 15:28:52,228] Trial 15 finished with value: 0.08752621891296969 and parameters: {'model_type': 'mlp', 'hidden_dims': '[256, 128]', 'dropout': 0.32572093903428045, 'batch_norm': False, 'lr': 0.0006229509918218761, 'weight_decay': 4.415185978856655e-06, 'epochs': 207, 'loss': 'mse', 'optimizer': 'adam', 'graph_mode': 'off', 'use_snp_selection': False}. Best is trial 15 with value: 0.08752621891296969.
[I 2025-12-05 15:28:53,640] Trial 16 finished with value: 0.07369812601252199 and parameters: {'model_type': 'mlp', 'hidden_dims': '[256, 128]', 'dropout': 0.32323168955821785, 'batch_norm': True, 'lr': 0.0009207739315702904, 'weight_decay': 5.098763140321504e-06, 'epochs': 258, 'loss': 'mse', 'optimizer': 'adam', 'graph_mode': 'off', 'use_snp_selection': False}. Best is trial 15 with value: 0.08752621891296969.
[I 2025-12-05 15:28:54,910] Trial 17 finished with value: 0.06819291266396324 and parameters: {'model_type': 'mlp', 'hidden_dims': '[256, 128]', 'dropout': 0.252995545127649, 'batch_norm': False, 'lr': 0.0009235381122022145, 'weight_decay': 8.05533704984093e-05, 'epochs': 222, 'loss': 'mse', 'optimizer': 'adam', 'graph_mode': 'off', 'use_snp_selection': False}. Best is trial 15 with value: 0.08752621891296969.
[I 2025-12-05 15:28:57,545] Trial 18 finished with value: 0.10370338241819542 and parameters: {'model_type': 'mlp', 'hidden_dims': '[128, 64]', 'dropout': 0.33556256572415755, 'batch_norm': False, 'lr': 0.0003321116365913395, 'weight_decay': 4.148662457734088e-06, 'epochs': 172, 'loss': 'mse', 'optimizer': 'adam', 'graph_mode': 'off', 'use_snp_selection': True, 'num_snps': 58241}. Best is trial 18 with value: 0.10370338241819542.
[I 2025-12-05 15:29:00,100] Trial 19 finished with value: 0.06908473150810261 and parameters: {'model_type': 'mlp', 'hidden_dims': '[128, 64]', 'dropout': 0.3602067411620538, 'batch_norm': False, 'lr': 0.00022229143301598275, 'weight_decay': 4.8212613563831595e-06, 'epochs': 160, 'loss': 'mse', 'optimizer': 'adam', 'graph_mode': 'off', 'use_snp_selection': True, 'num_snps': 55667}. Best is trial 18 with value: 0.10370338241819542.
[I 2025-12-05 15:29:02,696] Trial 20 finished with value: 0.05243609750558612 and parameters: {'model_type': 'mlp', 'hidden_dims': '[128, 64]', 'dropout': 0.4861925201779728, 'batch_norm': False, 'lr': 0.00042689743244366256, 'weight_decay': 4.170062865086698e-05, 'epochs': 132, 'loss': 'mse', 'optimizer': 'adam', 'graph_mode': 'off', 'use_snp_selection': True, 'num_snps': 57703}. Best is trial 18 with value: 0.10370338241819542.
[I 2025-12-05 15:29:03,966] Trial 21 finished with value: 0.05512281434224083 and parameters: {'model_type': 'mlp', 'hidden_dims': '[256, 128, 64]', 'dropout': 0.3094577397850265, 'batch_norm': False, 'lr': 0.000511136082790517, 'weight_decay': 3.352839898870113e-06, 'epochs': 186, 'loss': 'mse', 'optimizer': 'adam', 'graph_mode': 'off', 'use_snp_selection': True, 'num_snps': 11878}. Best is trial 18 with value: 0.10370338241819542.
[I 2025-12-05 15:29:05,488] Trial 22 finished with value: 0.09049019489885479 and parameters: {'model_type': 'mlp', 'hidden_dims': '[128, 64]', 'dropout': 0.3425305439316914, 'batch_norm': False, 'lr': 0.00014828279022843378, 'weight_decay': 8.80624297641563e-06, 'epochs': 203, 'loss': 'mse', 'optimizer': 'adam', 'graph_mode': 'off', 'use_snp_selection': True, 'num_snps': 22259}. Best is trial 18 with value: 0.10370338241819542.
[I 2025-12-05 15:29:07,020] Trial 23 finished with value: 0.05944677817502201 and parameters: {'model_type': 'mlp', 'hidden_dims': '[128, 64]', 'dropout': 0.34251166579736786, 'batch_norm': False, 'lr': 0.0001518128779113514, 'weight_decay': 1.0105974624781753e-05, 'epochs': 272, 'loss': 'mse', 'optimizer': 'adam', 'graph_mode': 'off', 'use_snp_selection': True, 'num_snps': 20180}. Best is trial 18 with value: 0.10370338241819542.
[I 2025-12-05 15:29:08,587] Trial 24 finished with value: 0.04481061715258473 and parameters: {'model_type': 'mlp', 'hidden_dims': '[128, 64]', 'dropout': 0.358535354917266, 'batch_norm': False, 'lr': 0.00014861645181562472, 'weight_decay': 7.124459546710191e-07, 'epochs': 231, 'loss': 'mse', 'optimizer': 'adam', 'graph_mode': 'off', 'use_snp_selection': True, 'num_snps': 21681}. Best is trial 18 with value: 0.10370338241819542.
[I 2025-12-05 15:29:10,811] Trial 25 finished with value: 0.07690445858377887 and parameters: {'model_type': 'mlp', 'hidden_dims': '[128, 64]', 'dropout': 0.22148368637148672, 'batch_norm': False, 'lr': 0.0001319199873571546, 'weight_decay': 7.4110253353573725e-06, 'epochs': 181, 'loss': 'mse', 'optimizer': 'adam', 'graph_mode': 'off', 'use_snp_selection': True, 'num_snps': 44361}. Best is trial 18 with value: 0.10370338241819542.
[I 2025-12-05 15:29:11,725] Trial 26 finished with value: 0.0900391957206265 and parameters: {'model_type': 'mlp', 'hidden_dims': '[128, 64]', 'dropout': 0.4383515568574245, 'batch_norm': False, 'lr': 0.0003035194598418998, 'weight_decay': 2.186128555622661e-05, 'epochs': 118, 'loss': 'mae', 'optimizer': 'adam', 'graph_mode': 'off', 'use_snp_selection': True, 'num_snps': 4103}. Best is trial 18 with value: 0.10370338241819542.
[I 2025-12-05 15:29:12,614] Trial 27 finished with value: 0.05337675704414473 and parameters: {'model_type': 'mlp', 'hidden_dims': '[128, 64]', 'dropout': 0.46040839254943167, 'batch_norm': False, 'lr': 0.00026214240960082395, 'weight_decay': 2.0110394478153595e-05, 'epochs': 113, 'loss': 'mae', 'optimizer': 'adam', 'graph_mode': 'off', 'use_snp_selection': True, 'num_snps': 3011}. Best is trial 18 with value: 0.10370338241819542.
[I 2025-12-05 15:29:13,977] Trial 28 finished with value: 0.03315666243172097 and parameters: {'model_type': 'mlp', 'hidden_dims': '[128, 64]', 'dropout': 0.5154708649295417, 'batch_norm': False, 'lr': 0.00010787840987204116, 'weight_decay': 0.00012363202694194868, 'epochs': 65, 'loss': 'mae', 'optimizer': 'adam', 'graph_mode': 'off', 'use_snp_selection': True, 'num_snps': 20572}. Best is trial 18 with value: 0.10370338241819542.
[I 2025-12-05 15:29:14,889] Trial 29 finished with value: 0.07227653957746319 and parameters: {'model_type': 'mlp', 'hidden_dims': '[128, 64]', 'dropout': 0.4008900625663161, 'batch_norm': False, 'lr': 3.777245673740724e-05, 'weight_decay': 3.589715926424081e-05, 'epochs': 128, 'loss': 'mae', 'optimizer': 'adam', 'graph_mode': 'off', 'use_snp_selection': True, 'num_snps': 3502}. Best is trial 18 with value: 0.10370338241819542.
[I 2025-12-05 15:29:16,613] Trial 30 finished with value: 0.01659418936923521 and parameters: {'model_type': 'mlp', 'hidden_dims': '[128, 64]', 'dropout': 0.5671445980709595, 'batch_norm': False, 'lr': 0.0003351321511268556, 'weight_decay': 7.585244624215017e-05, 'epochs': 165, 'loss': 'mae', 'optimizer': 'adam', 'graph_mode': 'off', 'use_snp_selection': True, 'num_snps': 29690}. Best is trial 18 with value: 0.10370338241819542.
[I 2025-12-05 15:29:18,970] Trial 31 finished with value: 0.061909671158011964 and parameters: {'model_type': 'mlp', 'hidden_dims': '[128, 64]', 'dropout': 0.2769297542812376, 'batch_norm': False, 'lr': 0.0004833605979738626, 'weight_decay': 2.6371804179792103e-06, 'epochs': 206, 'loss': 'mae', 'optimizer': 'adam', 'graph_mode': 'off', 'use_snp_selection': True, 'num_snps': 48109}. Best is trial 18 with value: 0.10370338241819542.
[I 2025-12-05 15:29:20,367] Trial 32 finished with value: 0.07068131012923055 and parameters: {'model_type': 'mlp', 'hidden_dims': '[256, 128, 64]', 'dropout': 0.43620787922265175, 'batch_norm': False, 'lr': 0.00019461512386812627, 'weight_decay': 1.3172399134002242e-05, 'epochs': 243, 'loss': 'mae', 'optimizer': 'adam', 'graph_mode': 'off', 'use_snp_selection': True, 'num_snps': 13251}. Best is trial 18 with value: 0.10370338241819542.
[I 2025-12-05 15:29:22,255] Trial 33 finished with value: 0.05290849633477244 and parameters: {'model_type': 'mlp', 'hidden_dims': '[512, 128]', 'dropout': 0.3425954406284413, 'batch_norm': False, 'lr': 0.0006845309502128712, 'weight_decay': 6.873585097161319e-06, 'epochs': 151, 'loss': 'mse', 'optimizer': 'adam', 'graph_mode': 'off', 'use_snp_selection': True, 'num_snps': 27305}. Best is trial 18 with value: 0.10370338241819542.
[I 2025-12-05 15:29:24,087] Trial 34 finished with value: 0.03287351653063918 and parameters: {'model_type': 'mlp', 'hidden_dims': '[128, 64]', 'dropout': 0.42158840560889865, 'batch_norm': False, 'lr': 1.044119409211577e-05, 'weight_decay': 9.403131009608443e-06, 'epochs': 87, 'loss': 'mae', 'optimizer': 'adam', 'graph_mode': 'off', 'use_snp_selection': True, 'num_snps': 36006}. Best is trial 18 with value: 0.10370338241819542.
[I 2025-12-05 15:29:25,117] Trial 35 finished with value: 0.046064886666799344 and parameters: {'model_type': 'mlp', 'hidden_dims': '[128, 64]', 'dropout': 0.20584121487001242, 'batch_norm': False, 'lr': 0.0006015153808554756, 'weight_decay': 3.0427979762558995e-05, 'epochs': 129, 'loss': 'mse', 'optimizer': 'adam', 'graph_mode': 'off', 'use_snp_selection': True, 'num_snps': 7434}. Best is trial 18 with value: 0.10370338241819542.
[I 2025-12-05 15:29:26,856] Trial 36 finished with value: 0.056336381650171616 and parameters: {'model_type': 'mlp', 'hidden_dims': '[256, 128]', 'dropout': 0.3721723580190801, 'batch_norm': False, 'lr': 9.431269862355988e-05, 'weight_decay': 9.976164041698341e-07, 'epochs': 253, 'loss': 'mae', 'optimizer': 'adam', 'graph_mode': 'off', 'use_snp_selection': True, 'num_snps': 24861}. Best is trial 18 with value: 0.10370338241819542.
[I 2025-12-05 15:29:28,532] Trial 37 finished with value: 0.07557386592892983 and parameters: {'model_type': 'mlp', 'hidden_dims': '[512, 64]', 'dropout': 0.28271093071631537, 'batch_norm': False, 'lr': 0.00037014974941533535, 'weight_decay': 1.5317662791139832e-05, 'epochs': 289, 'loss': 'mse', 'optimizer': 'adam', 'graph_mode': 'off', 'use_snp_selection': True, 'num_snps': 16315}. Best is trial 18 with value: 0.10370338241819542.
[I 2025-12-05 15:29:31,290] Trial 38 finished with value: 0.027473888314776575 and parameters: {'model_type': 'mlp', 'hidden_dims': '[256, 128, 64]', 'dropout': 0.41173975784243716, 'batch_norm': False, 'lr': 3.2211467597109637e-06, 'weight_decay': 0.00014813515859183195, 'epochs': 170, 'loss': 'mse', 'optimizer': 'adam', 'graph_mode': 'off', 'use_snp_selection': True, 'num_snps': 52220}. Best is trial 18 with value: 0.10370338241819542.
[I 2025-12-05 15:29:34,083] Trial 39 finished with value: 0.05617786764055136 and parameters: {'model_type': 'mlp', 'hidden_dims': '[512, 128]', 'dropout': 0.33099490755134137, 'batch_norm': False, 'lr': 0.0001947235214142341, 'weight_decay': 2.6547006755559354e-06, 'epochs': 191, 'loss': 'mae', 'optimizer': 'adam', 'graph_mode': 'off', 'use_snp_selection': True, 'num_snps': 39070}. Best is trial 18 with value: 0.10370338241819542.
[I 2025-12-05 15:29:35,188] Trial 40 finished with value: 0.06731883531289426 and parameters: {'model_type': 'mlp', 'hidden_dims': '[256, 128]', 'dropout': 0.4495288265573186, 'batch_norm': True, 'lr': 0.0002574833671007204, 'weight_decay': 5.577197935948671e-06, 'epochs': 143, 'loss': 'mse', 'optimizer': 'adam', 'graph_mode': 'off', 'use_snp_selection': False}. Best is trial 18 with value: 0.10370338241819542.
[I 2025-12-05 15:29:36,469] Trial 41 finished with value: 0.07064038699425806 and parameters: {'model_type': 'mlp', 'hidden_dims': '[256, 128]', 'dropout': 0.30122515735980954, 'batch_norm': True, 'lr': 0.0006901374025162991, 'weight_decay': 3.790680110102536e-06, 'epochs': 197, 'loss': 'mse', 'optimizer': 'adam', 'graph_mode': 'off', 'use_snp_selection': False}. Best is trial 18 with value: 0.10370338241819542.
[I 2025-12-05 15:29:37,764] Trial 42 finished with value: 0.06836292610898179 and parameters: {'model_type': 'mlp', 'hidden_dims': '[256, 128]', 'dropout': 0.384662569748496, 'batch_norm': True, 'lr': 0.000801412213912285, 'weight_decay': 2.269190704543508e-06, 'epochs': 208, 'loss': 'mse', 'optimizer': 'adam', 'graph_mode': 'off', 'use_snp_selection': False}. Best is trial 18 with value: 0.10370338241819542.
[I 2025-12-05 15:29:39,125] Trial 43 finished with value: 0.06861005143361215 and parameters: {'model_type': 'mlp', 'hidden_dims': '[256, 128]', 'dropout': 0.22772115304257876, 'batch_norm': True, 'lr': 0.0004499356947160264, 'weight_decay': 1.5726109249974666e-06, 'epochs': 231, 'loss': 'mse', 'optimizer': 'adam', 'graph_mode': 'off', 'use_snp_selection': False}. Best is trial 18 with value: 0.10370338241819542.
[I 2025-12-05 15:29:41,198] Trial 44 finished with value: 0.06441610373556902 and parameters: {'model_type': 'mlp', 'hidden_dims': '[512, 64]', 'dropout': 0.2785111750710251, 'batch_norm': True, 'lr': 0.0005683948439247096, 'weight_decay': 2.392002866949393e-05, 'epochs': 217, 'loss': 'mse', 'optimizer': 'adam', 'graph_mode': 'off', 'use_snp_selection': False}. Best is trial 18 with value: 0.10370338241819542.
[I 2025-12-05 15:29:42,862] Trial 45 finished with value: 0.07203967576738934 and parameters: {'model_type': 'mlp', 'hidden_dims': '[256, 128]', 'dropout': 0.32195089802231885, 'batch_norm': True, 'lr': 0.00031867284133474486, 'weight_decay': 1.2409537757530935e-05, 'epochs': 338, 'loss': 'mse', 'optimizer': 'adam', 'graph_mode': 'off', 'use_snp_selection': False}. Best is trial 18 with value: 0.10370338241819542.
[I 2025-12-05 15:29:43,767] Trial 46 finished with value: 0.07202780793652572 and parameters: {'model_type': 'mlp', 'hidden_dims': '[128, 64]', 'dropout': 0.37439521799197, 'batch_norm': True, 'lr': 0.0001831161296869245, 'weight_decay': 3.7944626235967913e-06, 'epochs': 182, 'loss': 'mse', 'optimizer': 'adam', 'graph_mode': 'off', 'use_snp_selection': False}. Best is trial 18 with value: 0.10370338241819542.
[I 2025-12-05 15:29:44,888] Trial 47 finished with value: 0.055653829051650755 and parameters: {'model_type': 'mlp', 'hidden_dims': '[256, 128]', 'dropout': 0.29661404854582385, 'batch_norm': False, 'lr': 0.00037519677389683545, 'weight_decay': 9.014468461559687e-06, 'epochs': 153, 'loss': 'mse', 'optimizer': 'adam', 'graph_mode': 'off', 'use_snp_selection': False}. Best is trial 18 with value: 0.10370338241819542.
[I 2025-12-05 15:29:46,357] Trial 48 finished with value: 0.05654709128087784 and parameters: {'model_type': 'mlp', 'hidden_dims': '[512, 256]', 'dropout': 0.2528432720393122, 'batch_norm': True, 'lr': 0.0009070405951351917, 'weight_decay': 4.830936308591571e-07, 'epochs': 109, 'loss': 'mae', 'optimizer': 'adam', 'graph_mode': 'off', 'use_snp_selection': False}. Best is trial 18 with value: 0.10370338241819542.
[I 2025-12-05 15:29:47,959] Trial 49 finished with value: 0.06397997150897237 and parameters: {'model_type': 'mlp', 'hidden_dims': '[512, 128]', 'dropout': 0.17808971499853038, 'batch_norm': False, 'lr': 6.171752843456968e-05, 'weight_decay': 0.0004359283256572386, 'epochs': 210, 'loss': 'mse', 'optimizer': 'adam', 'graph_mode': 'off', 'use_snp_selection': True, 'num_snps': 16964}. Best is trial 18 with value: 0.10370338241819542.
[I 2025-12-05 15:29:48,946] Trial 50 finished with value: 0.07742718791215093 and parameters: {'model_type': 'mlp', 'hidden_dims': '[128, 64]', 'dropout': 0.3540790282947331, 'batch_norm': False, 'lr': 0.0001222244543796638, 'weight_decay': 9.529761950282686e-07, 'epochs': 232, 'loss': 'mse', 'optimizer': 'adam', 'graph_mode': 'off', 'use_snp_selection': False}. Best is trial 18 with value: 0.10370338241819542.
[I 2025-12-05 15:29:50,188] Trial 51 finished with value: 0.0590477310596266 and parameters: {'model_type': 'mlp', 'hidden_dims': '[256, 128]', 'dropout': 0.39670111089254806, 'batch_norm': False, 'lr': 3.651578253019137e-05, 'weight_decay': 1.7043320361275874e-06, 'epochs': 197, 'loss': 'mse', 'optimizer': 'adam', 'graph_mode': 'off', 'use_snp_selection': False}. Best is trial 18 with value: 0.10370338241819542.
[I 2025-12-05 15:29:51,370] Trial 52 finished with value: 0.0682854702157739 and parameters: {'model_type': 'mlp', 'hidden_dims': '[256, 128]', 'dropout': 0.4304085771159212, 'batch_norm': False, 'lr': 4.915669555858216e-05, 'weight_decay': 5.438195369185649e-06, 'epochs': 173, 'loss': 'mse', 'optimizer': 'adam', 'graph_mode': 'off', 'use_snp_selection': False}. Best is trial 18 with value: 0.10370338241819542.
[I 2025-12-05 15:29:52,618] Trial 53 finished with value: 0.06575032972508145 and parameters: {'model_type': 'mlp', 'hidden_dims': '[256, 128]', 'dropout': 0.4952298828427944, 'batch_norm': False, 'lr': 2.1815360772134806e-05, 'weight_decay': 1.3223672814710224e-06, 'epochs': 196, 'loss': 'mse', 'optimizer': 'adam', 'graph_mode': 'off', 'use_snp_selection': False}. Best is trial 18 with value: 0.10370338241819542.
[I 2025-12-05 15:29:53,427] Trial 54 finished with value: 0.09088864764629033 and parameters: {'model_type': 'mlp', 'hidden_dims': '[256, 128]', 'dropout': 0.38785329068892804, 'batch_norm': False, 'lr': 0.0003053763489169552, 'weight_decay': 2.617837565031066e-07, 'epochs': 40, 'loss': 'mse', 'optimizer': 'adam', 'graph_mode': 'off', 'use_snp_selection': False}. Best is trial 18 with value: 0.10370338241819542.
[I 2025-12-05 15:29:54,277] Trial 55 finished with value: 0.07848034465095158 and parameters: {'model_type': 'mlp', 'hidden_dims': '[256, 128]', 'dropout': 0.31897533361460706, 'batch_norm': False, 'lr': 0.0002904817999793001, 'weight_decay': 1.882254590660404e-07, 'epochs': 68, 'loss': 'mse', 'optimizer': 'adam', 'graph_mode': 'off', 'use_snp_selection': False}. Best is trial 18 with value: 0.10370338241819542.
[I 2025-12-05 15:29:55,381] Trial 56 finished with value: -0.013044066867069366 and parameters: {'model_type': 'mlp', 'hidden_dims': '[512, 64]', 'dropout': 0.3367683574265614, 'batch_norm': False, 'lr': 0.00045080799691756684, 'weight_decay': 3.965124345493882e-07, 'epochs': 49, 'loss': 'mse', 'optimizer': 'adam', 'graph_mode': 'off', 'use_snp_selection': False}. Best is trial 18 with value: 0.10370338241819542.
[I 2025-12-05 15:29:58,278] Trial 57 finished with value: 0.06812122494260903 and parameters: {'model_type': 'mlp', 'hidden_dims': '[256, 128, 64]', 'dropout': 0.3643591202112784, 'batch_norm': True, 'lr': 7.706293723711702e-05, 'weight_decay': 5.429074944836621e-05, 'epochs': 93, 'loss': 'mse', 'optimizer': 'adam', 'graph_mode': 'off', 'use_snp_selection': True, 'num_snps': 59916}. Best is trial 18 with value: 0.10370338241819542.
[I 2025-12-05 15:29:59,461] Trial 58 finished with value: -0.025285789728858515 and parameters: {'model_type': 'mlp', 'hidden_dims': '[512, 256]', 'dropout': 0.40217162139980867, 'batch_norm': False, 'lr': 0.0006882244315196856, 'weight_decay': 1.894530813673795e-05, 'epochs': 53, 'loss': 'mse', 'optimizer': 'adam', 'graph_mode': 'off', 'use_snp_selection': False}. Best is trial 18 with value: 0.10370338241819542.
[I 2025-12-05 15:30:00,687] Trial 59 finished with value: 0.051838254791896035 and parameters: {'model_type': 'mlp', 'hidden_dims': '[128, 64]', 'dropout': 0.26682771773425373, 'batch_norm': False, 'lr': 0.00023499569569908764, 'weight_decay': 1.044536620141326e-07, 'epochs': 265, 'loss': 'mae', 'optimizer': 'adam', 'graph_mode': 'off', 'use_snp_selection': True, 'num_snps': 7833}. Best is trial 18 with value: 0.10370338241819542.
[I 2025-12-05 15:30:03,122] Trial 60 finished with value: 0.06338159678007574 and parameters: {'model_type': 'mlp', 'hidden_dims': '[128, 64]', 'dropout': 0.4530121808744767, 'batch_norm': False, 'lr': 0.0001637184126516236, 'weight_decay': 1.5558469583593e-07, 'epochs': 241, 'loss': 'mse', 'optimizer': 'adam', 'graph_mode': 'off', 'use_snp_selection': True, 'num_snps': 48406}. Best is trial 18 with value: 0.10370338241819542.
[I 2025-12-05 15:30:04,401] Trial 61 finished with value: 0.04298141435027431 and parameters: {'model_type': 'mlp', 'hidden_dims': '[256, 128]', 'dropout': 0.391058761524985, 'batch_norm': False, 'lr': 9.519240219895025e-06, 'weight_decay': 3.3095583951912384e-06, 'epochs': 216, 'loss': 'mse', 'optimizer': 'adam', 'graph_mode': 'off', 'use_snp_selection': False}. Best is trial 18 with value: 0.10370338241819542.
[I 2025-12-05 15:30:05,499] Trial 62 finished with value: 0.06915229410276161 and parameters: {'model_type': 'mlp', 'hidden_dims': '[256, 128]', 'dropout': 0.3484672879077366, 'batch_norm': False, 'lr': 0.0005373574768878128, 'weight_decay': 7.398153120058302e-06, 'epochs': 160, 'loss': 'mse', 'optimizer': 'adam', 'graph_mode': 'off', 'use_snp_selection': False}. Best is trial 18 with value: 0.10370338241819542.
[I 2025-12-05 15:30:06,257] Trial 63 finished with value: -0.017527346726587012 and parameters: {'model_type': 'mlp', 'hidden_dims': '[256, 128]', 'dropout': 0.413481344171945, 'batch_norm': False, 'lr': 0.00039446781069132116, 'weight_decay': 4.669234061646372e-06, 'epochs': 40, 'loss': 'mse', 'optimizer': 'adam', 'graph_mode': 'off', 'use_snp_selection': False}. Best is trial 18 with value: 0.10370338241819542.
[I 2025-12-05 15:30:07,399] Trial 64 finished with value: 0.07175127469984138 and parameters: {'model_type': 'mlp', 'hidden_dims': '[256, 128]', 'dropout': 0.31199319687526017, 'batch_norm': False, 'lr': 0.0002906122663969522, 'weight_decay': 2.68137256273739e-07, 'epochs': 179, 'loss': 'mse', 'optimizer': 'adam', 'graph_mode': 'off', 'use_snp_selection': False}. Best is trial 18 with value: 0.10370338241819542.
[I 2025-12-05 15:30:08,342] Trial 65 finished with value: 0.0695405745904702 and parameters: {'model_type': 'mlp', 'hidden_dims': '[128, 64]', 'dropout': 0.4761693547796599, 'batch_norm': False, 'lr': 0.00011262028984256476, 'weight_decay': 2.2353114967071177e-06, 'epochs': 224, 'loss': 'mae', 'optimizer': 'adam', 'graph_mode': 'off', 'use_snp_selection': False}. Best is trial 18 with value: 0.10370338241819542.
