[I 2025-12-05 16:15:12,866] Trial 7 finished with value: -0.012013813597028944 and parameters: {'model_type': 'mlp', 'hidden_dims': '[512, 256]', 'dropout': 0.15343979219678458, 'batch_norm': True, 'lr': 6.234003099047341e-05, 'weight_decay': 3.894760610535477e-07, 'epochs': 97, 'loss': 'mse', 'optimizer': 'adam', 'graph_mode': 'off', 'use_snp_selection': False}. Best is trial 4 with value: 0.024485224539466468.
[I 2025-12-05 16:15:15,006] Trial 8 finished with value: 0.0049049551627314775 and parameters: {'model_type': 'mlp', 'hidden_dims': '[512, 128]', 'dropout': 0.10743001231661406, 'batch_norm': True, 'lr': 0.00023728538449271062, 'weight_decay': 1.7629071578048637e-05, 'epochs': 312, 'loss': 'mae', 'optimizer': 'adam', 'graph_mode': 'off', 'use_snp_selection': False}. Best is trial 4 with value: 0.024485224539466468.
[I 2025-12-05 16:15:16,491] Trial 9 finished with value: -0.00027386421192214055 and parameters: {'model_type': 'mlp', 'hidden_dims': '[512, 64]', 'dropout': 0.14505336736221927, 'batch_norm': True, 'lr': 5.8619638388111826e-05, 'weight_decay': 6.200156172669308e-07, 'epochs': 175, 'loss': 'mse', 'optimizer': 'adam', 'graph_mode': 'off', 'use_snp_selection': False}. Best is trial 4 with value: 0.024485224539466468.
[I 2025-12-05 16:15:19,796] Trial 10 finished with value: -0.0037749879446544237 and parameters: {'model_type': 'mlp', 'hidden_dims': '[512, 128]', 'dropout': 0.2549147281275221, 'batch_norm': False, 'lr': 1.080428984628536e-05, 'weight_decay': 0.0001397766261378007, 'epochs': 256, 'loss': 'mse', 'optimizer': 'adam', 'graph_mode': 'off', 'use_snp_selection': True, 'num_snps': 57847}. Best is trial 4 with value: 0.024485224539466468.
[I 2025-12-05 16:15:20,807] Trial 11 finished with value: 0.013929716870611989 and parameters: {'model_type': 'mlp', 'hidden_dims': '[256, 128]', 'dropout': 0.2951407941561307, 'batch_norm': False, 'lr': 0.0007612007694070342, 'weight_decay': 1.870902088619276e-06, 'epochs': 240, 'loss': 'mse', 'optimizer': 'adam', 'graph_mode': 'off', 'use_snp_selection': True, 'num_snps': 7093}. Best is trial 4 with value: 0.024485224539466468.
[I 2025-12-05 16:15:21,668] Trial 12 finished with value: 0.006408288506624498 and parameters: {'model_type': 'mlp', 'hidden_dims': '[512, 128]', 'dropout': 0.5040822261097736, 'batch_norm': False, 'lr': 1.8174345617074418e-05, 'weight_decay': 2.540289733915756e-06, 'epochs': 41, 'loss': 'mse', 'optimizer': 'adam', 'graph_mode': 'off', 'use_snp_selection': False}. Best is trial 4 with value: 0.024485224539466468.
[I 2025-12-05 16:15:23,325] Trial 13 finished with value: -0.0016812459463794265 and parameters: {'model_type': 'mlp', 'hidden_dims': '[256, 128]', 'dropout': 0.31728815233181606, 'batch_norm': False, 'lr': 0.00021525541839733763, 'weight_decay': 2.8390638864363585e-06, 'epochs': 277, 'loss': 'mse', 'optimizer': 'adam', 'graph_mode': 'off', 'use_snp_selection': True, 'num_snps': 28162}. Best is trial 4 with value: 0.024485224539466468.
[I 2025-12-05 16:15:24,424] Trial 14 finished with value: -0.021224948799577287 and parameters: {'model_type': 'mlp', 'hidden_dims': '[256, 128, 64]', 'dropout': 0.23364907269219606, 'batch_norm': True, 'lr': 2.5920425278148356e-05, 'weight_decay': 1.9066300525955814e-07, 'epochs': 208, 'loss': 'mse', 'optimizer': 'adam', 'graph_mode': 'off', 'use_snp_selection': False}. Best is trial 4 with value: 0.024485224539466468.
[I 2025-12-05 16:15:25,934] Trial 15 finished with value: 0.031196528649023742 and parameters: {'model_type': 'mlp', 'hidden_dims': '[128, 64]', 'dropout': 0.48177467097578114, 'batch_norm': False, 'lr': 0.00016256646223462224, 'weight_decay': 0.000980572352827026, 'epochs': 196, 'loss': 'mse', 'optimizer': 'adam', 'graph_mode': 'off', 'use_snp_selection': True, 'num_snps': 27767}. Best is trial 15 with value: 0.031196528649023742.
[I 2025-12-05 16:15:27,598] Trial 16 finished with value: 0.02000771041882774 and parameters: {'model_type': 'mlp', 'hidden_dims': '[128, 64]', 'dropout': 0.567612206564901, 'batch_norm': False, 'lr': 0.00017068679397349827, 'weight_decay': 0.0008228240666658354, 'epochs': 285, 'loss': 'mse', 'optimizer': 'adam', 'graph_mode': 'off', 'use_snp_selection': True, 'num_snps': 28314}. Best is trial 15 with value: 0.031196528649023742.
[I 2025-12-05 16:15:29,412] Trial 17 finished with value: 0.017060321177507838 and parameters: {'model_type': 'mlp', 'hidden_dims': '[128, 64]', 'dropout': 0.5063463265099032, 'batch_norm': True, 'lr': 0.0006177036976756851, 'weight_decay': 0.00020495620287340902, 'epochs': 102, 'loss': 'mse', 'optimizer': 'adam', 'graph_mode': 'off', 'use_snp_selection': True, 'num_snps': 40603}. Best is trial 15 with value: 0.031196528649023742.
[I 2025-12-05 16:15:30,850] Trial 18 finished with value: 0.04222620683119727 and parameters: {'model_type': 'mlp', 'hidden_dims': '[512, 256]', 'dropout': 0.4668908025443073, 'batch_norm': True, 'lr': 3.7199610657271533e-06, 'weight_decay': 8.332995981308845e-05, 'epochs': 229, 'loss': 'mse', 'optimizer': 'adam', 'graph_mode': 'off', 'use_snp_selection': True, 'num_snps': 18008}. Best is trial 18 with value: 0.04222620683119727.
[I 2025-12-05 16:15:32,234] Trial 19 finished with value: 0.009429126598505696 and parameters: {'model_type': 'mlp', 'hidden_dims': '[512, 256]', 'dropout': 0.4650585733320662, 'batch_norm': False, 'lr': 8.188670972139527e-06, 'weight_decay': 5.844218878976137e-05, 'epochs': 223, 'loss': 'mse', 'optimizer': 'adam', 'graph_mode': 'off', 'use_snp_selection': True, 'num_snps': 17681}. Best is trial 18 with value: 0.04222620683119727.
[I 2025-12-05 16:15:33,611] Trial 20 finished with value: -0.00032432840384530006 and parameters: {'model_type': 'mlp', 'hidden_dims': '[512, 256]', 'dropout': 0.5277204948973405, 'batch_norm': True, 'lr': 0.00013164638073930344, 'weight_decay': 5.8750032979546745e-05, 'epochs': 171, 'loss': 'mse', 'optimizer': 'adam', 'graph_mode': 'off', 'use_snp_selection': True, 'num_snps': 19199}. Best is trial 18 with value: 0.04222620683119727.
[I 2025-12-05 16:15:35,985] Trial 21 finished with value: 0.023332026570561635 and parameters: {'model_type': 'mlp', 'hidden_dims': '[512, 128]', 'dropout': 0.33691910072939873, 'batch_norm': True, 'lr': 2.9503922601155696e-06, 'weight_decay': 0.0004381660701250266, 'epochs': 272, 'loss': 'mse', 'optimizer': 'adam', 'graph_mode': 'off', 'use_snp_selection': True, 'num_snps': 36259}. Best is trial 18 with value: 0.04222620683119727.
[I 2025-12-05 16:15:38,272] Trial 22 finished with value: 0.009562871104371427 and parameters: {'model_type': 'mlp', 'hidden_dims': '[128, 64]', 'dropout': 0.4610658331607758, 'batch_norm': True, 'lr': 1.009085205039849e-06, 'weight_decay': 0.00012335002089219882, 'epochs': 295, 'loss': 'mse', 'optimizer': 'adam', 'graph_mode': 'off', 'use_snp_selection': True, 'num_snps': 48332}. Best is trial 18 with value: 0.04222620683119727.
[I 2025-12-05 16:15:39,875] Trial 23 finished with value: -0.0004199095983687565 and parameters: {'model_type': 'mlp', 'hidden_dims': '[512, 256]', 'dropout': 0.3666117052210743, 'batch_norm': True, 'lr': 3.142687953389953e-06, 'weight_decay': 0.0005019694131277083, 'epochs': 223, 'loss': 'mse', 'optimizer': 'adam', 'graph_mode': 'off', 'use_snp_selection': True, 'num_snps': 20843}. Best is trial 18 with value: 0.04222620683119727.
[I 2025-12-05 16:15:41,489] Trial 24 finished with value: 0.025602065249412196 and parameters: {'model_type': 'mlp', 'hidden_dims': '[512, 128]', 'dropout': 0.29418983169865154, 'batch_norm': True, 'lr': 0.00042528403063550005, 'weight_decay': 0.0003156519826517325, 'epochs': 186, 'loss': 'mse', 'optimizer': 'adam', 'graph_mode': 'off', 'use_snp_selection': True, 'num_snps': 24915}. Best is trial 18 with value: 0.04222620683119727.
[I 2025-12-05 16:15:42,950] Trial 25 finished with value: 0.012538822865748048 and parameters: {'model_type': 'mlp', 'hidden_dims': '[128, 64]', 'dropout': 0.543457733160783, 'batch_norm': True, 'lr': 0.00031597356168153336, 'weight_decay': 9.436881843051324e-05, 'epochs': 171, 'loss': 'mse', 'optimizer': 'adam', 'graph_mode': 'off', 'use_snp_selection': True, 'num_snps': 23730}. Best is trial 18 with value: 0.04222620683119727.
[I 2025-12-05 16:15:43,742] Trial 26 finished with value: 0.03561414646885968 and parameters: {'model_type': 'mlp', 'hidden_dims': '[512, 256]', 'dropout': 0.47037305481455144, 'batch_norm': False, 'lr': 0.0004811951698930735, 'weight_decay': 0.0008582642647008529, 'epochs': 130, 'loss': 'mse', 'optimizer': 'adam', 'graph_mode': 'off', 'use_snp_selection': True, 'num_snps': 2019}. Best is trial 18 with value: 0.04222620683119727.
[I 2025-12-05 16:15:44,608] Trial 27 finished with value: 0.029292745152303942 and parameters: {'model_type': 'mlp', 'hidden_dims': '[512, 256]', 'dropout': 0.4762256160889832, 'batch_norm': False, 'lr': 0.0004919244481733685, 'weight_decay': 0.0008594222878938503, 'epochs': 117, 'loss': 'mae', 'optimizer': 'adam', 'graph_mode': 'off', 'use_snp_selection': True, 'num_snps': 5487}. Best is trial 18 with value: 0.04222620683119727.
[I 2025-12-05 16:15:45,619] Trial 28 finished with value: 0.008535726446069512 and parameters: {'model_type': 'mlp', 'hidden_dims': '[512, 256]', 'dropout': 0.42658502357823, 'batch_norm': False, 'lr': 0.0009543154542966892, 'weight_decay': 0.0009619325606903528, 'epochs': 53, 'loss': 'mse', 'optimizer': 'adam', 'graph_mode': 'off', 'use_snp_selection': True, 'num_snps': 13063}. Best is trial 18 with value: 0.04222620683119727.
[I 2025-12-05 16:15:46,760] Trial 29 finished with value: -0.03163143870075927 and parameters: {'model_type': 'mlp', 'hidden_dims': '[512, 256]', 'dropout': 0.4840543081260859, 'batch_norm': False, 'lr': 1.4168882831651752e-05, 'weight_decay': 2.744423818834789e-05, 'epochs': 131, 'loss': 'mae', 'optimizer': 'adam', 'graph_mode': 'off', 'use_snp_selection': True, 'num_snps': 13063}. Best is trial 18 with value: 0.04222620683119727.
[I 2025-12-05 16:15:47,738] Trial 30 finished with value: 0.037841673208492015 and parameters: {'model_type': 'mlp', 'hidden_dims': '[128, 64]', 'dropout': 0.5470217949023856, 'batch_norm': False, 'lr': 0.0001314747126717333, 'weight_decay': 8.37116377905605e-06, 'epochs': 350, 'loss': 'mse', 'optimizer': 'adam', 'graph_mode': 'off', 'use_snp_selection': True, 'num_snps': 2086}. Best is trial 18 with value: 0.04222620683119727.
[I 2025-12-05 16:15:48,712] Trial 31 finished with value: 0.049164102263009365 and parameters: {'model_type': 'mlp', 'hidden_dims': '[128, 64]', 'dropout': 0.5521888217256293, 'batch_norm': False, 'lr': 0.00011096370149350566, 'weight_decay': 4.289398881293827e-06, 'epochs': 348, 'loss': 'mse', 'optimizer': 'adam', 'graph_mode': 'off', 'use_snp_selection': True, 'num_snps': 2003}. Best is trial 31 with value: 0.049164102263009365.
[I 2025-12-05 16:15:49,690] Trial 32 finished with value: 0.009466490381516273 and parameters: {'model_type': 'mlp', 'hidden_dims': '[128, 64]', 'dropout': 0.5677693536962777, 'batch_norm': False, 'lr': 0.00010585808422503706, 'weight_decay': 4.967059497083754e-06, 'epochs': 345, 'loss': 'mse', 'optimizer': 'adam', 'graph_mode': 'off', 'use_snp_selection': True, 'num_snps': 2316}. Best is trial 31 with value: 0.049164102263009365.
[I 2025-12-05 16:15:50,651] Trial 33 finished with value: 0.02244836817987978 and parameters: {'model_type': 'mlp', 'hidden_dims': '[128, 64]', 'dropout': 0.5294932341749626, 'batch_norm': False, 'lr': 9.664627664134977e-05, 'weight_decay': 6.8369507698963815e-06, 'epochs': 324, 'loss': 'mse', 'optimizer': 'adam', 'graph_mode': 'off', 'use_snp_selection': True, 'num_snps': 2559}. Best is trial 31 with value: 0.049164102263009365.
[I 2025-12-05 16:15:51,871] Trial 34 finished with value: 0.031561622595077714 and parameters: {'model_type': 'mlp', 'hidden_dims': '[256, 128, 64]', 'dropout': 0.5806801755260523, 'batch_norm': False, 'lr': 4.055280346300221e-05, 'weight_decay': 9.771221732757703e-06, 'epochs': 346, 'loss': 'mae', 'optimizer': 'adam', 'graph_mode': 'off', 'use_snp_selection': True, 'num_snps': 8116}. Best is trial 31 with value: 0.049164102263009365.
[I 2025-12-05 16:15:52,821] Trial 35 finished with value: 0.005811667060355937 and parameters: {'model_type': 'mlp', 'hidden_dims': '[512, 256]', 'dropout': 0.4369520754093814, 'batch_norm': False, 'lr': 2.9541998315486305e-05, 'weight_decay': 1.5834557711700984e-05, 'epochs': 67, 'loss': 'mse', 'optimizer': 'adam', 'graph_mode': 'off', 'use_snp_selection': True, 'num_snps': 9750}. Best is trial 31 with value: 0.049164102263009365.
[I 2025-12-05 16:15:53,775] Trial 36 finished with value: 0.03526458570371757 and parameters: {'model_type': 'mlp', 'hidden_dims': '[128, 64]', 'dropout': 0.5510649052666484, 'batch_norm': False, 'lr': 0.00035644432839080763, 'weight_decay': 3.0301266906154767e-05, 'epochs': 325, 'loss': 'mse', 'optimizer': 'adam', 'graph_mode': 'off', 'use_snp_selection': True, 'num_snps': 2088}. Best is trial 31 with value: 0.049164102263009365.
[I 2025-12-05 16:15:55,212] Trial 37 finished with value: 0.0037716759123252314 and parameters: {'model_type': 'mlp', 'hidden_dims': '[512, 64]', 'dropout': 0.5936734491751923, 'batch_norm': False, 'lr': 9.146883057838359e-05, 'weight_decay': 1.0559621156581787e-06, 'epochs': 307, 'loss': 'mae', 'optimizer': 'adam', 'graph_mode': 'off', 'use_snp_selection': True, 'num_snps': 15588}. Best is trial 31 with value: 0.049164102263009365.
[I 2025-12-05 16:15:56,087] Trial 38 finished with value: 0.050874541462131516 and parameters: {'model_type': 'mlp', 'hidden_dims': '[512, 256]', 'dropout': 0.39555071682965054, 'batch_norm': False, 'lr': 6.250077067686012e-06, 'weight_decay': 6.771917812879979e-06, 'epochs': 150, 'loss': 'mse', 'optimizer': 'adam', 'graph_mode': 'off', 'use_snp_selection': True, 'num_snps': 5422}. Best is trial 38 with value: 0.050874541462131516.
[I 2025-12-05 16:15:57,002] Trial 39 finished with value: 0.01976087630699357 and parameters: {'model_type': 'mlp', 'hidden_dims': '[256, 128, 64]', 'dropout': 0.40245480527080957, 'batch_norm': False, 'lr': 5.754034166312477e-06, 'weight_decay': 4.174898580766616e-06, 'epochs': 155, 'loss': 'mse', 'optimizer': 'adam', 'graph_mode': 'off', 'use_snp_selection': True, 'num_snps': 5990}. Best is trial 38 with value: 0.050874541462131516.
[I 2025-12-05 16:15:58,020] Trial 40 finished with value: -0.029373244118655512 and parameters: {'model_type': 'mlp', 'hidden_dims': '[128, 64]', 'dropout': 0.5101642551241271, 'batch_norm': False, 'lr': 2.064650942546444e-06, 'weight_decay': 1.0798489181846542e-05, 'epochs': 337, 'loss': 'mae', 'optimizer': 'adam', 'graph_mode': 'off', 'use_snp_selection': False}. Best is trial 38 with value: 0.050874541462131516.
[I 2025-12-05 16:15:58,903] Trial 41 finished with value: 0.016615094296245816 and parameters: {'model_type': 'mlp', 'hidden_dims': '[512, 256]', 'dropout': 0.45190935081357514, 'batch_norm': False, 'lr': 6.252731160023408e-06, 'weight_decay': 6.897756052155071e-06, 'epochs': 140, 'loss': 'mse', 'optimizer': 'adam', 'graph_mode': 'off', 'use_snp_selection': True, 'num_snps': 6202}. Best is trial 38 with value: 0.050874541462131516.
[I 2025-12-05 16:15:59,866] Trial 42 finished with value: 0.028755365007628153 and parameters: {'model_type': 'mlp', 'hidden_dims': '[512, 256]', 'dropout': 0.41735949114256604, 'batch_norm': False, 'lr': 4.18491423062541e-06, 'weight_decay': 1.7693956758631266e-05, 'epochs': 80, 'loss': 'mse', 'optimizer': 'adam', 'graph_mode': 'off', 'use_snp_selection': True, 'num_snps': 10500}. Best is trial 38 with value: 0.050874541462131516.
[I 2025-12-05 16:16:00,622] Trial 43 finished with value: 0.02854228821996189 and parameters: {'model_type': 'mlp', 'hidden_dims': '[512, 256]', 'dropout': 0.38238465224260565, 'batch_norm': False, 'lr': 2.2176075687513154e-05, 'weight_decay': 4.553302171652494e-06, 'epochs': 120, 'loss': 'mse', 'optimizer': 'adam', 'graph_mode': 'off', 'use_snp_selection': True, 'num_snps': 2041}. Best is trial 38 with value: 0.050874541462131516.
[I 2025-12-05 16:16:01,943] Trial 44 finished with value: 0.0038973538315510824 and parameters: {'model_type': 'mlp', 'hidden_dims': '[512, 256]', 'dropout': 0.49961602537755756, 'batch_norm': False, 'lr': 4.220319439741245e-05, 'weight_decay': 4.1998425983876144e-05, 'epochs': 254, 'loss': 'mse', 'optimizer': 'adam', 'graph_mode': 'off', 'use_snp_selection': True, 'num_snps': 13523}. Best is trial 38 with value: 0.050874541462131516.
[I 2025-12-05 16:16:02,950] Trial 45 finished with value: 0.0092837788192597 and parameters: {'model_type': 'mlp', 'hidden_dims': '[512, 64]', 'dropout': 0.5330307184834401, 'batch_norm': False, 'lr': 1.8344167069971736e-06, 'weight_decay': 1.2013329724443922e-06, 'epochs': 156, 'loss': 'mse', 'optimizer': 'adam', 'graph_mode': 'off', 'use_snp_selection': True, 'num_snps': 9455}. Best is trial 38 with value: 0.050874541462131516.
[I 2025-12-05 16:16:05,050] Trial 46 finished with value: 0.0010712552614392616 and parameters: {'model_type': 'mlp', 'hidden_dims': '[512, 256]', 'dropout': 0.4336032393097601, 'batch_norm': False, 'lr': 1.0448998140613696e-05, 'weight_decay': 2.662789922186189e-06, 'epochs': 307, 'loss': 'mse', 'optimizer': 'adam', 'graph_mode': 'off', 'use_snp_selection': False}. Best is trial 38 with value: 0.050874541462131516.
[I 2025-12-05 16:16:05,857] Trial 47 finished with value: -0.010583654858671304 and parameters: {'model_type': 'mlp', 'hidden_dims': '[256, 128]', 'dropout': 0.559432785847469, 'batch_norm': False, 'lr': 6.446105985243455e-05, 'weight_decay': 6.984364448457809e-06, 'epochs': 102, 'loss': 'mse', 'optimizer': 'adam', 'graph_mode': 'off', 'use_snp_selection': True, 'num_snps': 5206}. Best is trial 38 with value: 0.050874541462131516.
[I 2025-12-05 16:16:06,994] Trial 48 finished with value: 0.0019998918701842764 and parameters: {'model_type': 'mlp', 'hidden_dims': '[128, 64]', 'dropout': 0.3801978201946986, 'batch_norm': True, 'lr': 1.573235237300193e-05, 'weight_decay': 1.5747103541255106e-05, 'epochs': 125, 'loss': 'mse', 'optimizer': 'adam', 'graph_mode': 'off', 'use_snp_selection': True, 'num_snps': 15494}. Best is trial 38 with value: 0.050874541462131516.
[I 2025-12-05 16:16:07,810] Trial 49 finished with value: 0.022658465929017643 and parameters: {'model_type': 'mlp', 'hidden_dims': '[256, 128]', 'dropout': 0.3525708022819871, 'batch_norm': False, 'lr': 0.0002587991551905539, 'weight_decay': 6.242937871419589e-07, 'epochs': 87, 'loss': 'mse', 'optimizer': 'adam', 'graph_mode': 'off', 'use_snp_selection': False}. Best is trial 38 with value: 0.050874541462131516.
[I 2025-12-05 16:16:08,751] Trial 50 finished with value: 0.023140602675351066 and parameters: {'model_type': 'mlp', 'hidden_dims': '[512, 256]', 'dropout': 0.5172531699610556, 'batch_norm': False, 'lr': 0.00019873476751581793, 'weight_decay': 0.00018019339899366573, 'epochs': 213, 'loss': 'mse', 'optimizer': 'adam', 'graph_mode': 'off', 'use_snp_selection': True, 'num_snps': 5542}. Best is trial 38 with value: 0.050874541462131516.
[I 2025-12-05 16:16:09,727] Trial 51 finished with value: 0.02069955147088641 and parameters: {'model_type': 'mlp', 'hidden_dims': '[128, 64]', 'dropout': 0.5608815531516533, 'batch_norm': False, 'lr': 0.00044103053883073765, 'weight_decay': 3.865469169034138e-05, 'epochs': 327, 'loss': 'mse', 'optimizer': 'adam', 'graph_mode': 'off', 'use_snp_selection': True, 'num_snps': 2061}. Best is trial 38 with value: 0.050874541462131516.
[I 2025-12-05 16:16:10,765] Trial 52 finished with value: 0.0417305911529865 and parameters: {'model_type': 'mlp', 'hidden_dims': '[128, 64]', 'dropout': 0.5452874602735268, 'batch_norm': False, 'lr': 0.00031776222531581036, 'weight_decay': 2.6329335128337433e-05, 'epochs': 349, 'loss': 'mse', 'optimizer': 'adam', 'graph_mode': 'off', 'use_snp_selection': True, 'num_snps': 4436}. Best is trial 38 with value: 0.050874541462131516.
[I 2025-12-05 16:16:11,914] Trial 53 finished with value: -0.0068804390369345825 and parameters: {'model_type': 'mlp', 'hidden_dims': '[128, 64]', 'dropout': 0.48816394147247544, 'batch_norm': False, 'lr': 0.0006287668783361498, 'weight_decay': 7.254748565240514e-05, 'epochs': 350, 'loss': 'mse', 'optimizer': 'adam', 'graph_mode': 'off', 'use_snp_selection': True, 'num_snps': 8823}. Best is trial 38 with value: 0.050874541462131516.
[I 2025-12-05 16:16:12,910] Trial 54 finished with value: 0.03411244735551007 and parameters: {'model_type': 'mlp', 'hidden_dims': '[128, 64]', 'dropout': 0.5790030935279769, 'batch_norm': False, 'lr': 0.0001496203894566554, 'weight_decay': 2.088581740994223e-05, 'epochs': 297, 'loss': 'mse', 'optimizer': 'adam', 'graph_mode': 'off', 'use_snp_selection': True, 'num_snps': 4861}. Best is trial 38 with value: 0.050874541462131516.
[I 2025-12-05 16:16:14,209] Trial 55 finished with value: 0.00695250245995664 and parameters: {'model_type': 'mlp', 'hidden_dims': '[128, 64]', 'dropout': 0.5973058241176625, 'batch_norm': True, 'lr': 0.0002755291522749999, 'weight_decay': 1.1047761672557848e-05, 'epochs': 334, 'loss': 'mse', 'optimizer': 'adam', 'graph_mode': 'off', 'use_snp_selection': True, 'num_snps': 11455}. Best is trial 38 with value: 0.050874541462131516.
[I 2025-12-05 16:16:15,216] Trial 56 finished with value: 0.020603949451756292 and parameters: {'model_type': 'mlp', 'hidden_dims': '[256, 128, 64]', 'dropout': 0.45334460048725506, 'batch_norm': False, 'lr': 7.600646857596823e-05, 'weight_decay': 0.0005189451987285278, 'epochs': 184, 'loss': 'mse', 'optimizer': 'adam', 'graph_mode': 'off', 'use_snp_selection': True, 'num_snps': 8135}. Best is trial 38 with value: 0.050874541462131516.
