[I 2025-12-05 16:17:27,511] Trial 22 finished with value: 0.01895467411808006 and parameters: {'model_type': 'mlp', 'hidden_dims': '[128, 64]', 'dropout': 0.5783246125834935, 'batch_norm': True, 'lr': 0.0005013578589398675, 'weight_decay': 1.3632552350002514e-06, 'epochs': 216, 'loss': 'mae', 'optimizer': 'adam', 'graph_mode': 'off', 'use_snp_selection': False}. Best is trial 20 with value: 0.055891923018492315.
[I 2025-12-05 16:17:28,447] Trial 23 finished with value: 0.033295600028485826 and parameters: {'model_type': 'mlp', 'hidden_dims': '[128, 64]', 'dropout': 0.4853325556761535, 'batch_norm': True, 'lr': 0.0001239870569445819, 'weight_decay': 2.3618628826405353e-07, 'epochs': 265, 'loss': 'mae', 'optimizer': 'adam', 'graph_mode': 'off', 'use_snp_selection': False}. Best is trial 20 with value: 0.055891923018492315.
[I 2025-12-05 16:17:29,424] Trial 24 finished with value: 0.02288030383519649 and parameters: {'model_type': 'mlp', 'hidden_dims': '[128, 64]', 'dropout': 0.5318731373861194, 'batch_norm': True, 'lr': 3.585887275038824e-05, 'weight_decay': 2.5721656020233354e-06, 'epochs': 304, 'loss': 'mae', 'optimizer': 'adam', 'graph_mode': 'off', 'use_snp_selection': False}. Best is trial 20 with value: 0.055891923018492315.
[I 2025-12-05 16:17:30,331] Trial 25 finished with value: 0.04411430600748612 and parameters: {'model_type': 'mlp', 'hidden_dims': '[128, 64]', 'dropout': 0.3613255711244666, 'batch_norm': True, 'lr': 0.0004146050630108754, 'weight_decay': 9.573304473889886e-07, 'epochs': 246, 'loss': 'mae', 'optimizer': 'adam', 'graph_mode': 'off', 'use_snp_selection': False}. Best is trial 20 with value: 0.055891923018492315.
[I 2025-12-05 16:17:31,363] Trial 26 finished with value: 0.0286477156883186 and parameters: {'model_type': 'mlp', 'hidden_dims': '[512, 128]', 'dropout': 0.45002087786681755, 'batch_norm': False, 'lr': 0.0001446333565857672, 'weight_decay': 1.622795757888081e-05, 'epochs': 343, 'loss': 'mse', 'optimizer': 'adam', 'graph_mode': 'off', 'use_snp_selection': True, 'num_snps': 3842}. Best is trial 20 with value: 0.055891923018492315.
[I 2025-12-05 16:17:32,350] Trial 27 finished with value: 0.04256976562970188 and parameters: {'model_type': 'mlp', 'hidden_dims': '[256, 128, 64]', 'dropout': 0.5627475224868568, 'batch_norm': True, 'lr': 0.0009393089915030916, 'weight_decay': 4.881339110858778e-06, 'epochs': 152, 'loss': 'mae', 'optimizer': 'adam', 'graph_mode': 'off', 'use_snp_selection': False}. Best is trial 20 with value: 0.055891923018492315.
[I 2025-12-05 16:17:33,857] Trial 28 finished with value: 0.04559293065032983 and parameters: {'model_type': 'mlp', 'hidden_dims': '[512, 256]', 'dropout': 0.5038603634352177, 'batch_norm': False, 'lr': 8.59974466644761e-05, 'weight_decay': 2.905899669856459e-07, 'epochs': 181, 'loss': 'mae', 'optimizer': 'adam', 'graph_mode': 'off', 'use_snp_selection': False}. Best is trial 20 with value: 0.055891923018492315.
[I 2025-12-05 16:17:35,238] Trial 29 finished with value: 0.026924144661861566 and parameters: {'model_type': 'mlp', 'hidden_dims': '[128, 64]', 'dropout': 0.32195194040372804, 'batch_norm': True, 'lr': 1.2182385399647518e-05, 'weight_decay': 5.5227103357724904e-05, 'epochs': 218, 'loss': 'mae', 'optimizer': 'adam', 'graph_mode': 'off', 'use_snp_selection': True, 'num_snps': 19468}. Best is trial 20 with value: 0.055891923018492315.
[I 2025-12-05 16:17:36,159] Trial 30 finished with value: 0.04319137683691446 and parameters: {'model_type': 'mlp', 'hidden_dims': '[128, 64]', 'dropout': 0.2523135802350327, 'batch_norm': True, 'lr': 0.0005119731244425054, 'weight_decay': 1.041771500195912e-05, 'epochs': 263, 'loss': 'mae', 'optimizer': 'adam', 'graph_mode': 'off', 'use_snp_selection': False}. Best is trial 20 with value: 0.055891923018492315.
[I 2025-12-05 16:17:37,338] Trial 31 finished with value: 0.02977868986676551 and parameters: {'model_type': 'mlp', 'hidden_dims': '[256, 128]', 'dropout': 0.542434852350003, 'batch_norm': False, 'lr': 0.00036077658550654114, 'weight_decay': 2.931347468819864e-06, 'epochs': 226, 'loss': 'mae', 'optimizer': 'adam', 'graph_mode': 'off', 'use_snp_selection': False}. Best is trial 20 with value: 0.055891923018492315.
[I 2025-12-05 16:17:38,579] Trial 32 finished with value: 0.012157361635791 and parameters: {'model_type': 'mlp', 'hidden_dims': '[256, 128]', 'dropout': 0.5191458696693787, 'batch_norm': False, 'lr': 0.00019688548620029215, 'weight_decay': 7.234336388484332e-07, 'epochs': 244, 'loss': 'mae', 'optimizer': 'adam', 'graph_mode': 'off', 'use_snp_selection': False}. Best is trial 20 with value: 0.055891923018492315.
[I 2025-12-05 16:17:39,935] Trial 33 finished with value: 0.03760849840056188 and parameters: {'model_type': 'mlp', 'hidden_dims': '[256, 128]', 'dropout': 0.5938426246152757, 'batch_norm': False, 'lr': 0.00031010350413943744, 'weight_decay': 2.101664902119427e-06, 'epochs': 296, 'loss': 'mae', 'optimizer': 'adam', 'graph_mode': 'off', 'use_snp_selection': False}. Best is trial 20 with value: 0.055891923018492315.
[I 2025-12-05 16:17:42,926] Trial 34 finished with value: 0.010636817010362157 and parameters: {'model_type': 'mlp', 'hidden_dims': '[256, 128]', 'dropout': 0.554555735238256, 'batch_norm': False, 'lr': 0.0001689852416011417, 'weight_decay': 3.1931752820960745e-05, 'epochs': 324, 'loss': 'mse', 'optimizer': 'adam', 'graph_mode': 'off', 'use_snp_selection': True, 'num_snps': 58283}. Best is trial 20 with value: 0.055891923018492315.
[I 2025-12-05 16:17:44,820] Trial 35 finished with value: 0.024523199708447158 and parameters: {'model_type': 'mlp', 'hidden_dims': '[512, 64]', 'dropout': 0.41525286392911354, 'batch_norm': False, 'lr': 3.7076321611887164e-06, 'weight_decay': 0.00011989470253335132, 'epochs': 265, 'loss': 'mae', 'optimizer': 'adam', 'graph_mode': 'off', 'use_snp_selection': False}. Best is trial 20 with value: 0.055891923018492315.
[I 2025-12-05 16:17:46,228] Trial 36 finished with value: 0.05803460304029105 and parameters: {'model_type': 'mlp', 'hidden_dims': '[512, 128]', 'dropout': 0.46134657793493894, 'batch_norm': False, 'lr': 0.000582541908140274, 'weight_decay': 1.1966379030002378e-05, 'epochs': 159, 'loss': 'mae', 'optimizer': 'adam', 'graph_mode': 'off', 'use_snp_selection': False}. Best is trial 36 with value: 0.05803460304029105.
[I 2025-12-05 16:17:47,714] Trial 37 finished with value: 0.036866341339900306 and parameters: {'model_type': 'mlp', 'hidden_dims': '[512, 128]', 'dropout': 0.4728477518062009, 'batch_norm': False, 'lr': 0.0005960038787267457, 'weight_decay': 1.218358727275003e-05, 'epochs': 162, 'loss': 'mse', 'optimizer': 'adam', 'graph_mode': 'off', 'use_snp_selection': True, 'num_snps': 22282}. Best is trial 36 with value: 0.05803460304029105.
[I 2025-12-05 16:17:48,952] Trial 38 finished with value: 0.004070454407644316 and parameters: {'model_type': 'mlp', 'hidden_dims': '[512, 128]', 'dropout': 0.4018498247707683, 'batch_norm': True, 'lr': 3.617538478976949e-05, 'weight_decay': 3.1002342135206714e-05, 'epochs': 115, 'loss': 'mae', 'optimizer': 'adam', 'graph_mode': 'off', 'use_snp_selection': False}. Best is trial 36 with value: 0.05803460304029105.
[I 2025-12-05 16:17:50,234] Trial 39 finished with value: 0.06766369665432428 and parameters: {'model_type': 'mlp', 'hidden_dims': '[512, 128]', 'dropout': 0.4246116819735686, 'batch_norm': False, 'lr': 8.811446151612832e-05, 'weight_decay': 0.00020642707938555574, 'epochs': 128, 'loss': 'mse', 'optimizer': 'adam', 'graph_mode': 'off', 'use_snp_selection': False}. Best is trial 39 with value: 0.06766369665432428.
[I 2025-12-05 16:17:51,516] Trial 40 finished with value: 0.056315005552145116 and parameters: {'model_type': 'mlp', 'hidden_dims': '[512, 128]', 'dropout': 0.4697469728245501, 'batch_norm': False, 'lr': 8.653470285837577e-05, 'weight_decay': 0.00029222022426265303, 'epochs': 127, 'loss': 'mse', 'optimizer': 'adam', 'graph_mode': 'off', 'use_snp_selection': False}. Best is trial 39 with value: 0.06766369665432428.
[I 2025-12-05 16:17:52,806] Trial 41 finished with value: 0.03756738673999013 and parameters: {'model_type': 'mlp', 'hidden_dims': '[512, 128]', 'dropout': 0.3716081310069049, 'batch_norm': False, 'lr': 8.142025131048774e-05, 'weight_decay': 0.0007723328683824657, 'epochs': 122, 'loss': 'mse', 'optimizer': 'adam', 'graph_mode': 'off', 'use_snp_selection': False}. Best is trial 39 with value: 0.06766369665432428.
[I 2025-12-05 16:17:53,951] Trial 42 finished with value: 0.02270138311951339 and parameters: {'model_type': 'mlp', 'hidden_dims': '[512, 128]', 'dropout': 0.42383774873858276, 'batch_norm': False, 'lr': 4.9695778173887786e-05, 'weight_decay': 0.0002221801481205928, 'epochs': 81, 'loss': 'mse', 'optimizer': 'adam', 'graph_mode': 'off', 'use_snp_selection': False}. Best is trial 39 with value: 0.06766369665432428.
[I 2025-12-05 16:17:55,327] Trial 43 finished with value: -0.021219562921107132 and parameters: {'model_type': 'mlp', 'hidden_dims': '[512, 128]', 'dropout': 0.46050626352573076, 'batch_norm': False, 'lr': 0.000661144499442855, 'weight_decay': 0.0004257835794850603, 'epochs': 140, 'loss': 'mse', 'optimizer': 'adam', 'graph_mode': 'off', 'use_snp_selection': False}. Best is trial 39 with value: 0.06766369665432428.
[I 2025-12-05 16:17:56,469] Trial 44 finished with value: 0.00407686707720122 and parameters: {'model_type': 'mlp', 'hidden_dims': '[512, 128]', 'dropout': 0.5686233200914318, 'batch_norm': False, 'lr': 0.00010599413547047505, 'weight_decay': 0.00016638111935641573, 'epochs': 83, 'loss': 'mse', 'optimizer': 'adam', 'graph_mode': 'off', 'use_snp_selection': False}. Best is trial 39 with value: 0.06766369665432428.
[I 2025-12-05 16:17:57,836] Trial 45 finished with value: 0.049193785326600695 and parameters: {'model_type': 'mlp', 'hidden_dims': '[512, 128]', 'dropout': 0.5061252449157385, 'batch_norm': False, 'lr': 7.444382957593811e-05, 'weight_decay': 0.0004892143874388229, 'epochs': 133, 'loss': 'mse', 'optimizer': 'adam', 'graph_mode': 'off', 'use_snp_selection': False}. Best is trial 39 with value: 0.06766369665432428.
[I 2025-12-05 16:17:59,331] Trial 46 finished with value: 0.04223133908634127 and parameters: {'model_type': 'mlp', 'hidden_dims': '[512, 128]', 'dropout': 0.43170682541311406, 'batch_norm': False, 'lr': 0.00023164640900603348, 'weight_decay': 0.00017979332769657471, 'epochs': 168, 'loss': 'mse', 'optimizer': 'adam', 'graph_mode': 'off', 'use_snp_selection': False}. Best is trial 39 with value: 0.06766369665432428.
[I 2025-12-05 16:18:00,463] Trial 47 finished with value: 0.04427953368459839 and parameters: {'model_type': 'mlp', 'hidden_dims': '[512, 128]', 'dropout': 0.3347029666452505, 'batch_norm': False, 'lr': 2.4135326891909068e-05, 'weight_decay': 0.0002985029037640859, 'epochs': 92, 'loss': 'mse', 'optimizer': 'adam', 'graph_mode': 'off', 'use_snp_selection': False}. Best is trial 39 with value: 0.06766369665432428.
[I 2025-12-05 16:18:01,906] Trial 48 finished with value: 0.04469380699504296 and parameters: {'model_type': 'mlp', 'hidden_dims': '[512, 64]', 'dropout': 0.47030759371332376, 'batch_norm': False, 'lr': 4.32572949380532e-05, 'weight_decay': 8.387845257598225e-05, 'epochs': 158, 'loss': 'mse', 'optimizer': 'adam', 'graph_mode': 'off', 'use_snp_selection': False}. Best is trial 39 with value: 0.06766369665432428.
[I 2025-12-05 16:18:04,120] Trial 49 finished with value: 0.03273080975922823 and parameters: {'model_type': 'mlp', 'hidden_dims': '[256, 128, 64]', 'dropout': 0.38897708006689397, 'batch_norm': False, 'lr': 0.0009775710418717513, 'weight_decay': 1.7009079364163254e-07, 'epochs': 198, 'loss': 'mse', 'optimizer': 'adam', 'graph_mode': 'off', 'use_snp_selection': True, 'num_snps': 46888}. Best is trial 39 with value: 0.06766369665432428.
[I 2025-12-05 16:18:05,463] Trial 50 finished with value: 0.02472333572782418 and parameters: {'model_type': 'mlp', 'hidden_dims': '[512, 256]', 'dropout': 0.5169944756115926, 'batch_norm': False, 'lr': 0.00043391579993236654, 'weight_decay': 0.0007393122662542984, 'epochs': 131, 'loss': 'mse', 'optimizer': 'adam', 'graph_mode': 'off', 'use_snp_selection': False}. Best is trial 39 with value: 0.06766369665432428.
[I 2025-12-05 16:18:06,997] Trial 51 finished with value: 0.0454872617541297 and parameters: {'model_type': 'mlp', 'hidden_dims': '[512, 128]', 'dropout': 0.4898411618349029, 'batch_norm': True, 'lr': 5.5082985199748414e-05, 'weight_decay': 4.707342038670778e-06, 'epochs': 181, 'loss': 'mae', 'optimizer': 'adam', 'graph_mode': 'off', 'use_snp_selection': False}. Best is trial 39 with value: 0.06766369665432428.
[I 2025-12-05 16:18:07,760] Trial 52 finished with value: -0.010017759068404693 and parameters: {'model_type': 'mlp', 'hidden_dims': '[128, 64]', 'dropout': 0.4033282227000787, 'batch_norm': True, 'lr': 1.0921708743861942e-06, 'weight_decay': 1.759829038418161e-05, 'epochs': 147, 'loss': 'mae', 'optimizer': 'adam', 'graph_mode': 'off', 'use_snp_selection': False}. Best is trial 39 with value: 0.06766369665432428.
[I 2025-12-05 16:18:08,991] Trial 53 finished with value: 0.03861429686265047 and parameters: {'model_type': 'mlp', 'hidden_dims': '[512, 128]', 'dropout': 0.4385303940363645, 'batch_norm': False, 'lr': 0.0001533761877422315, 'weight_decay': 6.489481901421153e-06, 'epochs': 103, 'loss': 'mae', 'optimizer': 'adam', 'graph_mode': 'off', 'use_snp_selection': False}. Best is trial 39 with value: 0.06766369665432428.
[I 2025-12-05 16:18:09,985] Trial 54 finished with value: 0.028392823996417835 and parameters: {'model_type': 'mlp', 'hidden_dims': '[512, 64]', 'dropout': 0.584794314640621, 'batch_norm': True, 'lr': 6.16432318205103e-05, 'weight_decay': 0.00010052489089935466, 'epochs': 46, 'loss': 'mae', 'optimizer': 'adam', 'graph_mode': 'off', 'use_snp_selection': False}. Best is trial 39 with value: 0.06766369665432428.
[I 2025-12-05 16:18:10,830] Trial 55 finished with value: 0.04987430556291846 and parameters: {'model_type': 'mlp', 'hidden_dims': '[128, 64]', 'dropout': 0.34732081512112734, 'batch_norm': False, 'lr': 0.00027232977408061555, 'weight_decay': 1.000330175776035e-06, 'epochs': 190, 'loss': 'mse', 'optimizer': 'adam', 'graph_mode': 'off', 'use_snp_selection': False}. Best is trial 39 with value: 0.06766369665432428.
[I 2025-12-05 16:18:11,668] Trial 56 finished with value: 0.036098640707364155 and parameters: {'model_type': 'mlp', 'hidden_dims': '[256, 128, 64]', 'dropout': 0.46538605880549005, 'batch_norm': True, 'lr': 2.5232396841974224e-05, 'weight_decay': 3.721078217971044e-07, 'epochs': 66, 'loss': 'mae', 'optimizer': 'adam', 'graph_mode': 'off', 'use_snp_selection': False}. Best is trial 39 with value: 0.06766369665432428.
[I 2025-12-05 16:18:13,341] Trial 57 finished with value: 0.045644876536376625 and parameters: {'model_type': 'mlp', 'hidden_dims': '[512, 128]', 'dropout': 0.37817936362462157, 'batch_norm': False, 'lr': 7.216415895623809e-05, 'weight_decay': 4.0925614870376665e-05, 'epochs': 204, 'loss': 'mae', 'optimizer': 'adam', 'graph_mode': 'off', 'use_snp_selection': False}. Best is trial 39 with value: 0.06766369665432428.
[I 2025-12-05 16:18:14,326] Trial 58 finished with value: 0.037439999833347795 and parameters: {'model_type': 'mlp', 'hidden_dims': '[128, 64]', 'dropout': 0.5399069200382772, 'batch_norm': True, 'lr': 0.0001772280721482527, 'weight_decay': 2.1365650622274738e-06, 'epochs': 274, 'loss': 'mae', 'optimizer': 'adam', 'graph_mode': 'off', 'use_snp_selection': False}. Best is trial 39 with value: 0.06766369665432428.
[I 2025-12-05 16:18:15,830] Trial 59 finished with value: 0.041208473964595746 and parameters: {'model_type': 'mlp', 'hidden_dims': '[512, 256]', 'dropout': 0.41825324118039925, 'batch_norm': False, 'lr': 9.75242436656715e-05, 'weight_decay': 2.128463447366773e-05, 'epochs': 172, 'loss': 'mse', 'optimizer': 'adam', 'graph_mode': 'off', 'use_snp_selection': False}. Best is trial 39 with value: 0.06766369665432428.
[I 2025-12-05 16:18:16,819] Trial 60 finished with value: 0.004787330313144671 and parameters: {'model_type': 'mlp', 'hidden_dims': '[256, 128]', 'dropout': 0.4491172881440044, 'batch_norm': True, 'lr': 1.75493606529084e-05, 'weight_decay': 8.581793720379306e-06, 'epochs': 253, 'loss': 'mae', 'optimizer': 'adam', 'graph_mode': 'off', 'use_snp_selection': True, 'num_snps': 2400}. Best is trial 39 with value: 0.06766369665432428.
[I 2025-12-05 16:18:17,620] Trial 61 finished with value: 0.011538342987120632 and parameters: {'model_type': 'mlp', 'hidden_dims': '[128, 64]', 'dropout': 0.2712421844451491, 'batch_norm': False, 'lr': 0.0003017471110961095, 'weight_decay': 1.2454654700752505e-06, 'epochs': 189, 'loss': 'mse', 'optimizer': 'adam', 'graph_mode': 'off', 'use_snp_selection': False}. Best is trial 39 with value: 0.06766369665432428.
[I 2025-12-05 16:18:18,470] Trial 62 finished with value: 0.034308803414241536 and parameters: {'model_type': 'mlp', 'hidden_dims': '[128, 64]', 'dropout': 0.3607072844229274, 'batch_norm': False, 'lr': 0.00013983656282356313, 'weight_decay': 8.431249559622813e-07, 'epochs': 228, 'loss': 'mse', 'optimizer': 'adam', 'graph_mode': 'off', 'use_snp_selection': False}. Best is trial 39 with value: 0.06766369665432428.
[I 2025-12-05 16:18:19,327] Trial 63 finished with value: 0.05209405359102997 and parameters: {'model_type': 'mlp', 'hidden_dims': '[128, 64]', 'dropout': 0.34627398946766197, 'batch_norm': False, 'lr': 0.0002763610421291525, 'weight_decay': 5.136421787706107e-07, 'epochs': 211, 'loss': 'mse', 'optimizer': 'adam', 'graph_mode': 'off', 'use_snp_selection': False}. Best is trial 39 with value: 0.06766369665432428.
[I 2025-12-05 16:18:20,164] Trial 64 finished with value: 0.031614847889802095 and parameters: {'model_type': 'mlp', 'hidden_dims': '[128, 64]', 'dropout': 0.1909719102745576, 'batch_norm': False, 'lr': 0.0006845508431099666, 'weight_decay': 5.649148743183868e-07, 'epochs': 216, 'loss': 'mse', 'optimizer': 'adam', 'graph_mode': 'off', 'use_snp_selection': False}. Best is trial 39 with value: 0.06766369665432428.
[I 2025-12-05 16:18:20,912] Trial 65 finished with value: 0.033130469969620165 and parameters: {'model_type': 'mlp', 'hidden_dims': '[128, 64]', 'dropout': 0.28228022870212166, 'batch_norm': False, 'lr': 0.0004005138156265976, 'weight_decay': 2.3267147049700946e-07, 'epochs': 139, 'loss': 'mse', 'optimizer': 'adam', 'graph_mode': 'off', 'use_snp_selection': False}. Best is trial 39 with value: 0.06766369665432428.
[I 2025-12-05 16:18:21,791] Trial 66 finished with value: 0.0025604979428610944 and parameters: {'model_type': 'mlp', 'hidden_dims': '[128, 64]', 'dropout': 0.5983923022735472, 'batch_norm': False, 'lr': 0.0005292695269074676, 'weight_decay': 4.033652799255428e-07, 'epochs': 229, 'loss': 'mae', 'optimizer': 'adam', 'graph_mode': 'off', 'use_snp_selection': False}. Best is trial 39 with value: 0.06766369665432428.
[I 2025-12-05 16:18:23,173] Trial 67 finished with value: 0.03934288226599548 and parameters: {'model_type': 'mlp', 'hidden_dims': '[256, 128]', 'dropout': 0.575914052228899, 'batch_norm': True, 'lr': 0.00022182868182784798, 'weight_decay': 4.484178817177233e-06, 'epochs': 290, 'loss': 'mae', 'optimizer': 'adam', 'graph_mode': 'off', 'use_snp_selection': False}. Best is trial 39 with value: 0.06766369665432428.
[I 2025-12-05 16:18:24,881] Trial 68 finished with value: 0.036310380809549306 and parameters: {'model_type': 'mlp', 'hidden_dims': '[512, 128]', 'dropout': 0.494212892503349, 'batch_norm': False, 'lr': 0.00011703215983138207, 'weight_decay': 1.9461322335898918e-06, 'epochs': 210, 'loss': 'mse', 'optimizer': 'adam', 'graph_mode': 'off', 'use_snp_selection': False}. Best is trial 39 with value: 0.06766369665432428.
[I 2025-12-05 16:18:25,653] Trial 69 finished with value: 0.016774519345190766 and parameters: {'model_type': 'mlp', 'hidden_dims': '[128, 64]', 'dropout': 0.40053707849306275, 'batch_norm': False, 'lr': 0.0007829282631486607, 'weight_decay': 1.3333339731563691e-05, 'epochs': 125, 'loss': 'mae', 'optimizer': 'adam', 'graph_mode': 'off', 'use_snp_selection': False}. Best is trial 39 with value: 0.06766369665432428.
[I 2025-12-05 16:18:27,055] Trial 70 finished with value: 0.040992177907649835 and parameters: {'model_type': 'mlp', 'hidden_dims': '[256, 128, 64]', 'dropout': 0.5277205852361677, 'batch_norm': True, 'lr': 4.202984837173198e-05, 'weight_decay': 1.713152408767321e-07, 'epochs': 108, 'loss': 'mae', 'optimizer': 'adam', 'graph_mode': 'off', 'use_snp_selection': True, 'num_snps': 21177}. Best is trial 39 with value: 0.06766369665432428.
[I 2025-12-05 16:18:27,910] Trial 71 finished with value: 0.04620876398655157 and parameters: {'model_type': 'mlp', 'hidden_dims': '[128, 64]', 'dropout': 0.3555851909714151, 'batch_norm': False, 'lr': 0.00026017697968329687, 'weight_decay': 1.0192731409788547e-06, 'epochs': 192, 'loss': 'mse', 'optimizer': 'adam', 'graph_mode': 'off', 'use_snp_selection': False}. Best is trial 39 with value: 0.06766369665432428.
[I 2025-12-05 16:18:28,769] Trial 72 finished with value: 0.027049241998156427 and parameters: {'model_type': 'mlp', 'hidden_dims': '[128, 64]', 'dropout': 0.3761648837166846, 'batch_norm': False, 'lr': 0.0003260840814065991, 'weight_decay': 6.257356072726616e-07, 'epochs': 183, 'loss': 'mse', 'optimizer': 'adam', 'graph_mode': 'off', 'use_snp_selection': False}. Best is trial 39 with value: 0.06766369665432428.
[I 2025-12-05 16:18:29,582] Trial 73 finished with value: 0.044022188385572945 and parameters: {'model_type': 'mlp', 'hidden_dims': '[128, 64]', 'dropout': 0.32963380109279466, 'batch_norm': False, 'lr': 0.0004617328195604217, 'weight_decay': 4.666214182758744e-07, 'epochs': 155, 'loss': 'mse', 'optimizer': 'adam', 'graph_mode': 'off', 'use_snp_selection': False}. Best is trial 39 with value: 0.06766369665432428.
