[I 2025-12-05 16:27:35,095] Trial 128 finished with value: 0.012290497320460102 and parameters: {'model_type': 'mlp', 'hidden_dims': '[512, 64]', 'dropout': 0.48324067690237804, 'batch_norm': True, 'lr': 6.739586752174929e-05, 'weight_decay': 0.00011391476075757908, 'epochs': 241, 'loss': 'mae', 'optimizer': 'adam', 'graph_mode': 'off', 'use_snp_selection': True, 'num_snps': 39076}. Best is trial 46 with value: 0.07279895725465674.
[I 2025-12-05 16:27:36,891] Trial 129 finished with value: 0.026100011465158758 and parameters: {'model_type': 'mlp', 'hidden_dims': '[512, 64]', 'dropout': 0.4609178160560313, 'batch_norm': True, 'lr': 5.641763783350284e-05, 'weight_decay': 0.00025132265848891, 'epochs': 257, 'loss': 'mse', 'optimizer': 'adam', 'graph_mode': 'off', 'use_snp_selection': False}. Best is trial 46 with value: 0.07279895725465674.
[I 2025-12-05 16:27:38,352] Trial 130 finished with value: 0.013470412064745602 and parameters: {'model_type': 'mlp', 'hidden_dims': '[512, 64]', 'dropout': 0.42225491576629903, 'batch_norm': False, 'lr': 3.291887813331206e-05, 'weight_decay': 0.0004375364659985615, 'epochs': 174, 'loss': 'mae', 'optimizer': 'adam', 'graph_mode': 'off', 'use_snp_selection': False}. Best is trial 46 with value: 0.07279895725465674.
[I 2025-12-05 16:27:40,402] Trial 131 finished with value: 0.05989783898101248 and parameters: {'model_type': 'mlp', 'hidden_dims': '[512, 64]', 'dropout': 0.4393301545510771, 'batch_norm': True, 'lr': 8.988047528730218e-05, 'weight_decay': 0.0007202834568523065, 'epochs': 337, 'loss': 'mae', 'optimizer': 'adam', 'graph_mode': 'off', 'use_snp_selection': False}. Best is trial 46 with value: 0.07279895725465674.
[I 2025-12-05 16:27:42,433] Trial 132 finished with value: 0.006673342640926769 and parameters: {'model_type': 'mlp', 'hidden_dims': '[512, 64]', 'dropout': 0.4359449632257104, 'batch_norm': True, 'lr': 5.023756447132764e-05, 'weight_decay': 0.0006434772205799013, 'epochs': 334, 'loss': 'mae', 'optimizer': 'adam', 'graph_mode': 'off', 'use_snp_selection': False}. Best is trial 46 with value: 0.07279895725465674.
[I 2025-12-05 16:27:44,588] Trial 133 finished with value: 0.03261576337484064 and parameters: {'model_type': 'mlp', 'hidden_dims': '[512, 64]', 'dropout': 0.44954894498771925, 'batch_norm': True, 'lr': 7.67972676267238e-05, 'weight_decay': 0.0006937106601227991, 'epochs': 349, 'loss': 'mae', 'optimizer': 'adam', 'graph_mode': 'off', 'use_snp_selection': False}. Best is trial 46 with value: 0.07279895725465674.
[I 2025-12-05 16:27:46,637] Trial 134 finished with value: 0.037231519715116776 and parameters: {'model_type': 'mlp', 'hidden_dims': '[512, 64]', 'dropout': 0.46689404968579507, 'batch_norm': True, 'lr': 2.8160899005969547e-05, 'weight_decay': 0.0005420129483068958, 'epochs': 324, 'loss': 'mae', 'optimizer': 'adam', 'graph_mode': 'off', 'use_snp_selection': False}. Best is trial 46 with value: 0.07279895725465674.
[I 2025-12-05 16:27:48,601] Trial 135 finished with value: 0.05372946997348008 and parameters: {'model_type': 'mlp', 'hidden_dims': '[512, 64]', 'dropout': 0.47783947579091446, 'batch_norm': True, 'lr': 9.244948343879558e-05, 'weight_decay': 0.0009978865051832881, 'epochs': 312, 'loss': 'mae', 'optimizer': 'adam', 'graph_mode': 'off', 'use_snp_selection': False}. Best is trial 46 with value: 0.07279895725465674.
[I 2025-12-05 16:27:50,719] Trial 136 finished with value: 0.02113191686316437 and parameters: {'model_type': 'mlp', 'hidden_dims': '[512, 64]', 'dropout': 0.4311945603776584, 'batch_norm': True, 'lr': 7.026572286812408e-05, 'weight_decay': 0.00034171454657041877, 'epochs': 343, 'loss': 'mae', 'optimizer': 'adam', 'graph_mode': 'off', 'use_snp_selection': False}. Best is trial 46 with value: 0.07279895725465674.
[I 2025-12-05 16:27:52,133] Trial 137 finished with value: 0.05209068210309199 and parameters: {'model_type': 'mlp', 'hidden_dims': '[256, 128, 64]', 'dropout': 0.45757864942496346, 'batch_norm': True, 'lr': 1.790937826792831e-05, 'weight_decay': 4.359836477709233e-05, 'epochs': 336, 'loss': 'mae', 'optimizer': 'adam', 'graph_mode': 'off', 'use_snp_selection': False}. Best is trial 46 with value: 0.07279895725465674.
[I 2025-12-05 16:27:53,789] Trial 138 finished with value: 0.03358328079031406 and parameters: {'model_type': 'mlp', 'hidden_dims': '[512, 128]', 'dropout': 0.38012544986276736, 'batch_norm': False, 'lr': 4.2848560352618554e-05, 'weight_decay': 0.00015057132648793608, 'epochs': 223, 'loss': 'mae', 'optimizer': 'adam', 'graph_mode': 'off', 'use_snp_selection': False}. Best is trial 46 with value: 0.07279895725465674.
[I 2025-12-05 16:27:55,542] Trial 139 finished with value: 0.03805092394175294 and parameters: {'model_type': 'mlp', 'hidden_dims': '[512, 256]', 'dropout': 0.4434046497165805, 'batch_norm': True, 'lr': 0.00010627395194731014, 'weight_decay': 0.0007891619118222304, 'epochs': 249, 'loss': 'mae', 'optimizer': 'adam', 'graph_mode': 'off', 'use_snp_selection': False}. Best is trial 46 with value: 0.07279895725465674.
[I 2025-12-05 16:27:57,134] Trial 140 finished with value: 0.037011767526402256 and parameters: {'model_type': 'mlp', 'hidden_dims': '[512, 64]', 'dropout': 0.4080727699951642, 'batch_norm': True, 'lr': 2.4729869083562704e-05, 'weight_decay': 0.000439957709877255, 'epochs': 212, 'loss': 'mae', 'optimizer': 'adam', 'graph_mode': 'off', 'use_snp_selection': False}. Best is trial 46 with value: 0.07279895725465674.
[I 2025-12-05 16:27:57,992] Trial 141 finished with value: 0.03487340235078559 and parameters: {'model_type': 'mlp', 'hidden_dims': '[256, 128]', 'dropout': 0.39108000204891813, 'batch_norm': True, 'lr': 0.0001300133956221898, 'weight_decay': 0.0007497463637246226, 'epochs': 84, 'loss': 'mae', 'optimizer': 'adam', 'graph_mode': 'off', 'use_snp_selection': False}. Best is trial 46 with value: 0.07279895725465674.
[I 2025-12-05 16:27:58,894] Trial 142 finished with value: 0.024431794869732914 and parameters: {'model_type': 'mlp', 'hidden_dims': '[256, 128]', 'dropout': 0.5837190360064908, 'batch_norm': True, 'lr': 2.1409380574072366e-05, 'weight_decay': 0.000576688267248769, 'epochs': 105, 'loss': 'mae', 'optimizer': 'adam', 'graph_mode': 'off', 'use_snp_selection': False}. Best is trial 46 with value: 0.07279895725465674.
[I 2025-12-05 16:28:01,046] Trial 143 finished with value: 0.045762192723486174 and parameters: {'model_type': 'mlp', 'hidden_dims': '[512, 64]', 'dropout': 0.4966977153902823, 'batch_norm': True, 'lr': 8.868812918582217e-05, 'weight_decay': 0.0008482524538311676, 'epochs': 350, 'loss': 'mae', 'optimizer': 'adam', 'graph_mode': 'off', 'use_snp_selection': False}. Best is trial 46 with value: 0.07279895725465674.
[I 2025-12-05 16:28:01,973] Trial 144 finished with value: 0.023066895632475923 and parameters: {'model_type': 'mlp', 'hidden_dims': '[256, 128]', 'dropout': 0.4193563789943605, 'batch_norm': True, 'lr': 6.231479746891468e-05, 'weight_decay': 0.00031234747673585976, 'epochs': 122, 'loss': 'mae', 'optimizer': 'adam', 'graph_mode': 'off', 'use_snp_selection': False}. Best is trial 46 with value: 0.07279895725465674.
[I 2025-12-05 16:28:03,799] Trial 145 finished with value: 0.010707864077632218 and parameters: {'model_type': 'mlp', 'hidden_dims': '[512, 256]', 'dropout': 0.36158973130870237, 'batch_norm': True, 'lr': 1.376118372804659e-05, 'weight_decay': 0.0004883611513002002, 'epochs': 270, 'loss': 'mae', 'optimizer': 'adam', 'graph_mode': 'off', 'use_snp_selection': False}. Best is trial 46 with value: 0.07279895725465674.
[I 2025-12-05 16:28:05,526] Trial 146 finished with value: 0.04399578579585109 and parameters: {'model_type': 'mlp', 'hidden_dims': '[512, 128]', 'dropout': 0.3739055676016529, 'batch_norm': True, 'lr': 0.00020734925602440744, 'weight_decay': 2.7323981839967337e-05, 'epochs': 241, 'loss': 'mse', 'optimizer': 'adam', 'graph_mode': 'off', 'use_snp_selection': False}. Best is trial 46 with value: 0.07279895725465674.
[I 2025-12-05 16:28:06,769] Trial 147 finished with value: 0.008006358922357102 and parameters: {'model_type': 'mlp', 'hidden_dims': '[256, 128]', 'dropout': 0.40053488709487917, 'batch_norm': False, 'lr': 8.331007491884515e-05, 'weight_decay': 0.0006252602983878536, 'epochs': 281, 'loss': 'mae', 'optimizer': 'adam', 'graph_mode': 'off', 'use_snp_selection': False}. Best is trial 46 with value: 0.07279895725465674.
[I 2025-12-05 16:28:08,344] Trial 148 finished with value: 0.035965053705120834 and parameters: {'model_type': 'mlp', 'hidden_dims': '[512, 64]', 'dropout': 0.1137359209493489, 'batch_norm': True, 'lr': 5.6627322437108336e-05, 'weight_decay': 0.00038309836413550773, 'epochs': 199, 'loss': 'mae', 'optimizer': 'adam', 'graph_mode': 'off', 'use_snp_selection': False}. Best is trial 46 with value: 0.07279895725465674.
[I 2025-12-05 16:28:10,273] Trial 149 finished with value: 0.03134001702257075 and parameters: {'model_type': 'mlp', 'hidden_dims': '[256, 128]', 'dropout': 0.22769284842446336, 'batch_norm': True, 'lr': 0.0004569428575301748, 'weight_decay': 0.000758891283478471, 'epochs': 342, 'loss': 'mae', 'optimizer': 'adam', 'graph_mode': 'off', 'use_snp_selection': True, 'num_snps': 29744}. Best is trial 46 with value: 0.07279895725465674.
[I 2025-12-05 16:28:22,490] Trial 0 finished with value: 0.007040082389751129 and parameters: {'model_type': 'mlp', 'hidden_dims': '[128, 64]', 'dropout': 0.199031432379812, 'batch_norm': True, 'lr': 1.8408544111075837e-06, 'weight_decay': 5.5136510071208614e-05, 'epochs': 336, 'loss': 'mae', 'optimizer': 'adam', 'graph_mode': 'off', 'use_snp_selection': True, 'num_snps': 43862}. Best is trial 0 with value: 0.007040082389751129.
[I 2025-12-05 16:28:23,565] Trial 1 finished with value: 0.01499469870229263 and parameters: {'model_type': 'mlp', 'hidden_dims': '[256, 128]', 'dropout': 0.4370668075331726, 'batch_norm': True, 'lr': 7.133471581159139e-05, 'weight_decay': 1.128633586803549e-05, 'epochs': 242, 'loss': 'mae', 'optimizer': 'adam', 'graph_mode': 'off', 'use_snp_selection': False}. Best is trial 1 with value: 0.01499469870229263.
[I 2025-12-05 16:28:24,504] Trial 2 finished with value: 0.03025551827081542 and parameters: {'model_type': 'mlp', 'hidden_dims': '[256, 128, 64]', 'dropout': 0.41314357415569625, 'batch_norm': False, 'lr': 3.952233718592101e-06, 'weight_decay': 0.00026754769258252603, 'epochs': 149, 'loss': 'mse', 'optimizer': 'adam', 'graph_mode': 'off', 'use_snp_selection': True, 'num_snps': 11571}. Best is trial 2 with value: 0.03025551827081542.
[I 2025-12-05 16:28:26,401] Trial 3 finished with value: 0.021728334553577082 and parameters: {'model_type': 'mlp', 'hidden_dims': '[512, 64]', 'dropout': 0.5938127374509361, 'batch_norm': False, 'lr': 5.67704586114731e-06, 'weight_decay': 2.4518087630137052e-05, 'epochs': 320, 'loss': 'mae', 'optimizer': 'adam', 'graph_mode': 'off', 'use_snp_selection': False}. Best is trial 2 with value: 0.03025551827081542.
[I 2025-12-05 16:28:28,675] Trial 4 finished with value: -0.018104274125116948 and parameters: {'model_type': 'mlp', 'hidden_dims': '[512, 128]', 'dropout': 0.25746343592134413, 'batch_norm': True, 'lr': 1.3467657668402788e-06, 'weight_decay': 0.00033087251918647806, 'epochs': 277, 'loss': 'mse', 'optimizer': 'adam', 'graph_mode': 'off', 'use_snp_selection': True, 'num_snps': 36675}. Best is trial 2 with value: 0.03025551827081542.
[I 2025-12-05 16:28:30,397] Trial 5 finished with value: 0.022564596127123103 and parameters: {'model_type': 'mlp', 'hidden_dims': '[512, 64]', 'dropout': 0.38275350994408375, 'batch_norm': True, 'lr': 1.5586664309232824e-06, 'weight_decay': 0.0008227664668621182, 'epochs': 145, 'loss': 'mae', 'optimizer': 'adam', 'graph_mode': 'off', 'use_snp_selection': True, 'num_snps': 32148}. Best is trial 2 with value: 0.03025551827081542.
[I 2025-12-05 16:28:31,425] Trial 6 finished with value: 0.03578880735217104 and parameters: {'model_type': 'mlp', 'hidden_dims': '[256, 128]', 'dropout': 0.3930109900265879, 'batch_norm': False, 'lr': 4.892964372128395e-05, 'weight_decay': 1.5809549317992182e-06, 'epochs': 199, 'loss': 'mse', 'optimizer': 'adam', 'graph_mode': 'off', 'use_snp_selection': False}. Best is trial 6 with value: 0.03578880735217104.
[I 2025-12-05 16:28:32,549] Trial 7 finished with value: 0.011234318752692566 and parameters: {'model_type': 'mlp', 'hidden_dims': '[512, 256]', 'dropout': 0.15343979219678458, 'batch_norm': True, 'lr': 6.234003099047341e-05, 'weight_decay': 3.894760610535477e-07, 'epochs': 97, 'loss': 'mse', 'optimizer': 'adam', 'graph_mode': 'off', 'use_snp_selection': False}. Best is trial 6 with value: 0.03578880735217104.
[I 2025-12-05 16:28:34,436] Trial 8 finished with value: 0.00936474078913338 and parameters: {'model_type': 'mlp', 'hidden_dims': '[512, 128]', 'dropout': 0.10743001231661406, 'batch_norm': True, 'lr': 0.00023728538449271062, 'weight_decay': 1.7629071578048637e-05, 'epochs': 312, 'loss': 'mae', 'optimizer': 'adam', 'graph_mode': 'off', 'use_snp_selection': False}. Best is trial 6 with value: 0.03578880735217104.
[I 2025-12-05 16:28:35,833] Trial 9 finished with value: 0.012156374695777461 and parameters: {'model_type': 'mlp', 'hidden_dims': '[512, 64]', 'dropout': 0.14505336736221927, 'batch_norm': True, 'lr': 5.8619638388111826e-05, 'weight_decay': 6.200156172669308e-07, 'epochs': 175, 'loss': 'mse', 'optimizer': 'adam', 'graph_mode': 'off', 'use_snp_selection': False}. Best is trial 6 with value: 0.03578880735217104.
[I 2025-12-05 16:28:36,587] Trial 10 finished with value: 0.022889376002309662 and parameters: {'model_type': 'mlp', 'hidden_dims': '[256, 128]', 'dropout': 0.5267360651501256, 'batch_norm': False, 'lr': 0.00032393778075602147, 'weight_decay': 1.936962886850364e-06, 'epochs': 46, 'loss': 'mse', 'optimizer': 'adam', 'graph_mode': 'off', 'use_snp_selection': False}. Best is trial 6 with value: 0.03578880735217104.
[I 2025-12-05 16:28:37,512] Trial 11 finished with value: 0.005993161235211309 and parameters: {'model_type': 'mlp', 'hidden_dims': '[256, 128, 64]', 'dropout': 0.3160531038486785, 'batch_norm': False, 'lr': 1.2467800292900095e-05, 'weight_decay': 2.805519019095577e-06, 'epochs': 219, 'loss': 'mse', 'optimizer': 'adam', 'graph_mode': 'off', 'use_snp_selection': True, 'num_snps': 5419}. Best is trial 6 with value: 0.03578880735217104.
[I 2025-12-05 16:28:38,416] Trial 12 finished with value: 0.01917297670330171 and parameters: {'model_type': 'mlp', 'hidden_dims': '[256, 128, 64]', 'dropout': 0.44680631124543924, 'batch_norm': False, 'lr': 1.6491753181045373e-05, 'weight_decay': 1.046668821935964e-07, 'epochs': 147, 'loss': 'mse', 'optimizer': 'adam', 'graph_mode': 'off', 'use_snp_selection': True, 'num_snps': 7003}. Best is trial 6 with value: 0.03578880735217104.
[I 2025-12-05 16:28:41,004] Trial 13 finished with value: -0.003780645298061021 and parameters: {'model_type': 'mlp', 'hidden_dims': '[256, 128, 64]', 'dropout': 0.3458935986258572, 'batch_norm': False, 'lr': 6.5481132871340765e-06, 'weight_decay': 0.00012654339615917872, 'epochs': 113, 'loss': 'mse', 'optimizer': 'adam', 'graph_mode': 'off', 'use_snp_selection': True, 'num_snps': 59978}. Best is trial 6 with value: 0.03578880735217104.
[I 2025-12-05 16:28:42,049] Trial 14 finished with value: -0.009741331894745813 and parameters: {'model_type': 'mlp', 'hidden_dims': '[256, 128]', 'dropout': 0.4552029103675417, 'batch_norm': False, 'lr': 0.0009998076236933976, 'weight_decay': 2.9196532205641e-06, 'epochs': 195, 'loss': 'mse', 'optimizer': 'adam', 'graph_mode': 'off', 'use_snp_selection': False}. Best is trial 6 with value: 0.03578880735217104.
[I 2025-12-05 16:28:43,347] Trial 15 finished with value: -0.015075800895197049 and parameters: {'model_type': 'mlp', 'hidden_dims': '[128, 64]', 'dropout': 0.5108452162361568, 'batch_norm': False, 'lr': 2.6455469047392855e-05, 'weight_decay': 0.00011349526640122639, 'epochs': 259, 'loss': 'mse', 'optimizer': 'adam', 'graph_mode': 'off', 'use_snp_selection': True, 'num_snps': 19093}. Best is trial 6 with value: 0.03578880735217104.
[I 2025-12-05 16:28:44,411] Trial 16 finished with value: 0.028452819700820135 and parameters: {'model_type': 'mlp', 'hidden_dims': '[512, 256]', 'dropout': 0.2975339775228894, 'batch_norm': False, 'lr': 4.4104393187832995e-06, 'weight_decay': 5.29970785842156e-06, 'epochs': 72, 'loss': 'mse', 'optimizer': 'adam', 'graph_mode': 'off', 'use_snp_selection': False}. Best is trial 6 with value: 0.03578880735217104.
[I 2025-12-05 16:28:45,743] Trial 17 finished with value: 0.02828156430121475 and parameters: {'model_type': 'mlp', 'hidden_dims': '[256, 128, 64]', 'dropout': 0.3914310109458991, 'batch_norm': False, 'lr': 0.00010634423683350944, 'weight_decay': 8.325885323349622e-07, 'epochs': 158, 'loss': 'mse', 'optimizer': 'adam', 'graph_mode': 'off', 'use_snp_selection': True, 'num_snps': 18228}. Best is trial 6 with value: 0.03578880735217104.
[I 2025-12-05 16:28:47,114] Trial 18 finished with value: 0.038680118531385664 and parameters: {'model_type': 'mlp', 'hidden_dims': '[256, 128]', 'dropout': 0.25663062063798425, 'batch_norm': False, 'lr': 2.16133533026396e-05, 'weight_decay': 0.000922433099068622, 'epochs': 213, 'loss': 'mse', 'optimizer': 'adam', 'graph_mode': 'off', 'use_snp_selection': True, 'num_snps': 20445}. Best is trial 18 with value: 0.038680118531385664.
[I 2025-12-05 16:28:48,221] Trial 19 finished with value: 0.017396280807723645 and parameters: {'model_type': 'mlp', 'hidden_dims': '[256, 128]', 'dropout': 0.23989812542838362, 'batch_norm': False, 'lr': 2.7886302002203773e-05, 'weight_decay': 1.5543942856186997e-07, 'epochs': 215, 'loss': 'mse', 'optimizer': 'adam', 'graph_mode': 'off', 'use_snp_selection': False}. Best is trial 18 with value: 0.038680118531385664.
[I 2025-12-05 16:28:49,849] Trial 20 finished with value: 0.011975975398650411 and parameters: {'model_type': 'mlp', 'hidden_dims': '[256, 128]', 'dropout': 0.27615036091756695, 'batch_norm': False, 'lr': 0.00015536880490268085, 'weight_decay': 0.0006943121180525726, 'epochs': 292, 'loss': 'mse', 'optimizer': 'adam', 'graph_mode': 'off', 'use_snp_selection': True, 'num_snps': 24799}. Best is trial 18 with value: 0.038680118531385664.
[I 2025-12-05 16:28:50,928] Trial 21 finished with value: 0.0026026575283894537 and parameters: {'model_type': 'mlp', 'hidden_dims': '[256, 128]', 'dropout': 0.3724446201678813, 'batch_norm': False, 'lr': 1.1849021634184127e-05, 'weight_decay': 0.0002517924023793625, 'epochs': 193, 'loss': 'mse', 'optimizer': 'adam', 'graph_mode': 'off', 'use_snp_selection': True, 'num_snps': 13362}. Best is trial 18 with value: 0.038680118531385664.
[I 2025-12-05 16:28:52,380] Trial 22 finished with value: 0.015810719018758742 and parameters: {'model_type': 'mlp', 'hidden_dims': '[256, 128]', 'dropout': 0.342516562065094, 'batch_norm': False, 'lr': 3.37848638514423e-06, 'weight_decay': 0.0009422350221432926, 'epochs': 126, 'loss': 'mse', 'optimizer': 'adam', 'graph_mode': 'off', 'use_snp_selection': True, 'num_snps': 25409}. Best is trial 18 with value: 0.038680118531385664.
[I 2025-12-05 16:28:53,255] Trial 23 finished with value: 0.04954747502704046 and parameters: {'model_type': 'mlp', 'hidden_dims': '[256, 128, 64]', 'dropout': 0.22544804159482024, 'batch_norm': False, 'lr': 3.978049943836133e-05, 'weight_decay': 0.00031498179228359896, 'epochs': 224, 'loss': 'mse', 'optimizer': 'adam', 'graph_mode': 'off', 'use_snp_selection': True, 'num_snps': 2531}. Best is trial 23 with value: 0.04954747502704046.
[I 2025-12-05 16:28:54,085] Trial 24 finished with value: 0.029979517690261956 and parameters: {'model_type': 'mlp', 'hidden_dims': '[256, 128]', 'dropout': 0.21380416523546528, 'batch_norm': False, 'lr': 3.897298485541277e-05, 'weight_decay': 4.4467920003965005e-05, 'epochs': 235, 'loss': 'mse', 'optimizer': 'adam', 'graph_mode': 'off', 'use_snp_selection': True, 'num_snps': 2321}. Best is trial 23 with value: 0.04954747502704046.
[I 2025-12-05 16:28:56,727] Trial 25 finished with value: 0.017296064955186922 and parameters: {'model_type': 'mlp', 'hidden_dims': '[512, 256]', 'dropout': 0.19076327722291225, 'batch_norm': False, 'lr': 1.8901676755560572e-05, 'weight_decay': 0.0004012675245614643, 'epochs': 257, 'loss': 'mse', 'optimizer': 'adam', 'graph_mode': 'off', 'use_snp_selection': True, 'num_snps': 44193}. Best is trial 23 with value: 0.04954747502704046.
[I 2025-12-05 16:28:58,294] Trial 26 finished with value: 0.014777712476732053 and parameters: {'model_type': 'mlp', 'hidden_dims': '[512, 128]', 'dropout': 0.3052215395176086, 'batch_norm': False, 'lr': 3.8950744997446246e-05, 'weight_decay': 6.887346757245457e-06, 'epochs': 212, 'loss': 'mae', 'optimizer': 'adam', 'graph_mode': 'off', 'use_snp_selection': False}. Best is trial 23 with value: 0.04954747502704046.
[I 2025-12-05 16:28:59,409] Trial 27 finished with value: 0.020651957412459468 and parameters: {'model_type': 'mlp', 'hidden_dims': '[128, 64]', 'dropout': 0.23643308852090203, 'batch_norm': False, 'lr': 9.354066742625634e-06, 'weight_decay': 0.00012588571958118422, 'epochs': 188, 'loss': 'mse', 'optimizer': 'adam', 'graph_mode': 'off', 'use_snp_selection': True, 'num_snps': 13266}. Best is trial 23 with value: 0.04954747502704046.
[I 2025-12-05 16:29:00,474] Trial 28 finished with value: 0.019504678894828677 and parameters: {'model_type': 'mlp', 'hidden_dims': '[256, 128, 64]', 'dropout': 0.16855961615157927, 'batch_norm': False, 'lr': 0.00013679288136348697, 'weight_decay': 1.1149523207316467e-06, 'epochs': 172, 'loss': 'mse', 'optimizer': 'adam', 'graph_mode': 'off', 'use_snp_selection': False}. Best is trial 23 with value: 0.04954747502704046.
