[I 2025-12-05 16:06:09,786] Trial 12 finished with value: 0.13594996538504167 and parameters: {'model_type': 'mlp', 'hidden_dims': '[512, 128]', 'dropout': 0.10344600881777158, 'batch_norm': True, 'lr': 0.0006674532614549997, 'weight_decay': 1.3081036432574914e-07, 'epochs': 255, 'loss': 'mae', 'optimizer': 'adam', 'graph_mode': 'off', 'use_snp_selection': False}. Best is trial 11 with value: 0.1427928499948129.
[I 2025-12-05 16:06:13,321] Trial 13 finished with value: 0.11443025246604782 and parameters: {'model_type': 'mlp', 'hidden_dims': '[512, 128]', 'dropout': 0.22096278001553593, 'batch_norm': True, 'lr': 0.0005692918571972218, 'weight_decay': 1.0885943577911259e-07, 'epochs': 236, 'loss': 'mse', 'optimizer': 'adam', 'graph_mode': 'off', 'use_snp_selection': False}. Best is trial 11 with value: 0.1427928499948129.
[I 2025-12-05 16:06:16,942] Trial 14 finished with value: 0.13564198502081928 and parameters: {'model_type': 'mlp', 'hidden_dims': '[512, 128]', 'dropout': 0.3012984444538551, 'batch_norm': True, 'lr': 0.0002108574938852793, 'weight_decay': 1.0838231003431842e-07, 'epochs': 243, 'loss': 'mse', 'optimizer': 'adam', 'graph_mode': 'off', 'use_snp_selection': False}. Best is trial 11 with value: 0.1427928499948129.
[I 2025-12-05 16:06:18,357] Trial 15 finished with value: 0.12578385495872751 and parameters: {'model_type': 'mlp', 'hidden_dims': '[128, 64]', 'dropout': 0.10272160099215884, 'batch_norm': True, 'lr': 0.0008020255002946251, 'weight_decay': 3.9745576709552696e-07, 'epochs': 281, 'loss': 'mae', 'optimizer': 'adam', 'graph_mode': 'off', 'use_snp_selection': False}. Best is trial 11 with value: 0.1427928499948129.
[I 2025-12-05 16:06:20,364] Trial 16 finished with value: 0.10367591963090445 and parameters: {'model_type': 'mlp', 'hidden_dims': '[256, 128, 64]', 'dropout': 0.558513902174278, 'batch_norm': True, 'lr': 0.00017549215405955411, 'weight_decay': 1.3863650262743918e-06, 'epochs': 206, 'loss': 'mae', 'optimizer': 'adam', 'graph_mode': 'off', 'use_snp_selection': False}. Best is trial 11 with value: 0.1427928499948129.
[I 2025-12-05 16:06:24,499] Trial 17 finished with value: 0.07093469573219258 and parameters: {'model_type': 'mlp', 'hidden_dims': '[512, 256]', 'dropout': 0.5026660877666042, 'batch_norm': True, 'lr': 1.7075459989479874e-05, 'weight_decay': 4.4347581776480764e-06, 'epochs': 287, 'loss': 'mse', 'optimizer': 'adam', 'graph_mode': 'off', 'use_snp_selection': False}. Best is trial 11 with value: 0.1427928499948129.
[I 2025-12-05 16:06:29,893] Trial 18 finished with value: 0.09845108973116473 and parameters: {'model_type': 'mlp', 'hidden_dims': '[512, 128]', 'dropout': 0.18666334338261442, 'batch_norm': False, 'lr': 0.000990842629404931, 'weight_decay': 2.3295471516958728e-07, 'epochs': 217, 'loss': 'mae', 'optimizer': 'adam', 'graph_mode': 'off', 'use_snp_selection': True, 'num_snps': 58241}. Best is trial 11 with value: 0.1427928499948129.
[I 2025-12-05 16:06:32,465] Trial 19 finished with value: 0.06803279595713624 and parameters: {'model_type': 'mlp', 'hidden_dims': '[512, 128]', 'dropout': 0.31341549294012583, 'batch_norm': True, 'lr': 2.2599578696439803e-05, 'weight_decay': 7.205967523593867e-07, 'epochs': 154, 'loss': 'mse', 'optimizer': 'adam', 'graph_mode': 'off', 'use_snp_selection': False}. Best is trial 11 with value: 0.1427928499948129.
[I 2025-12-05 16:06:34,456] Trial 20 finished with value: 0.12359649220591236 and parameters: {'model_type': 'mlp', 'hidden_dims': '[512, 128]', 'dropout': 0.2333704671534715, 'batch_norm': True, 'lr': 0.00036610172740531927, 'weight_decay': 2.026749435220459e-07, 'epochs': 106, 'loss': 'mse', 'optimizer': 'adam', 'graph_mode': 'off', 'use_snp_selection': False}. Best is trial 11 with value: 0.1427928499948129.
[I 2025-12-05 16:06:38,145] Trial 21 finished with value: 0.10732866427585411 and parameters: {'model_type': 'mlp', 'hidden_dims': '[512, 128]', 'dropout': 0.3426036956588672, 'batch_norm': True, 'lr': 0.0001573993532868966, 'weight_decay': 1.0386813394522385e-07, 'epochs': 251, 'loss': 'mse', 'optimizer': 'adam', 'graph_mode': 'off', 'use_snp_selection': False}. Best is trial 11 with value: 0.1427928499948129.
[I 2025-12-05 16:06:41,788] Trial 22 finished with value: 0.13261891100494194 and parameters: {'model_type': 'mlp', 'hidden_dims': '[512, 128]', 'dropout': 0.16482687806697485, 'batch_norm': True, 'lr': 0.00012064061699488194, 'weight_decay': 1.0790082404688784e-07, 'epochs': 245, 'loss': 'mse', 'optimizer': 'adam', 'graph_mode': 'off', 'use_snp_selection': False}. Best is trial 11 with value: 0.1427928499948129.
[I 2025-12-05 16:06:45,627] Trial 23 finished with value: 0.13162898540333368 and parameters: {'model_type': 'mlp', 'hidden_dims': '[512, 128]', 'dropout': 0.12530647633340045, 'batch_norm': True, 'lr': 0.0003016140254855497, 'weight_decay': 2.3010588836368953e-07, 'epochs': 263, 'loss': 'mse', 'optimizer': 'adam', 'graph_mode': 'off', 'use_snp_selection': False}. Best is trial 11 with value: 0.1427928499948129.
[I 2025-12-05 16:06:49,004] Trial 24 finished with value: 0.09825876837507491 and parameters: {'model_type': 'mlp', 'hidden_dims': '[512, 128]', 'dropout': 0.46987033741278, 'batch_norm': True, 'lr': 0.00010778890470749087, 'weight_decay': 9.905353781686856e-07, 'epochs': 223, 'loss': 'mse', 'optimizer': 'adam', 'graph_mode': 'off', 'use_snp_selection': False}. Best is trial 11 with value: 0.1427928499948129.
[I 2025-12-05 16:06:51,811] Trial 25 finished with value: 0.11446210111974033 and parameters: {'model_type': 'mlp', 'hidden_dims': '[512, 256]', 'dropout': 0.30282932136132634, 'batch_norm': True, 'lr': 0.0005231515547338476, 'weight_decay': 3.099946245505388e-07, 'epochs': 174, 'loss': 'mse', 'optimizer': 'adam', 'graph_mode': 'off', 'use_snp_selection': False}. Best is trial 11 with value: 0.1427928499948129.
[I 2025-12-05 16:06:53,663] Trial 26 finished with value: 0.08780461220515903 and parameters: {'model_type': 'mlp', 'hidden_dims': '[256, 128]', 'dropout': 0.1808643871581092, 'batch_norm': True, 'lr': 0.00030308904929809727, 'weight_decay': 2.443643243280606e-06, 'epochs': 307, 'loss': 'mae', 'optimizer': 'adam', 'graph_mode': 'off', 'use_snp_selection': True, 'num_snps': 3842}. Best is trial 11 with value: 0.1427928499948129.
[I 2025-12-05 16:06:55,476] Trial 27 finished with value: 0.11795117380231547 and parameters: {'model_type': 'mlp', 'hidden_dims': '[256, 128, 64]', 'dropout': 0.238158013549788, 'batch_norm': False, 'lr': 1.2089799038469695e-05, 'weight_decay': 4.881339110858778e-06, 'epochs': 183, 'loss': 'mse', 'optimizer': 'adam', 'graph_mode': 'off', 'use_snp_selection': False}. Best is trial 11 with value: 0.1427928499948129.
[I 2025-12-05 16:06:57,078] Trial 28 finished with value: 0.1366241581495321 and parameters: {'model_type': 'mlp', 'hidden_dims': '[128, 64]', 'dropout': 0.10058916407425991, 'batch_norm': True, 'lr': 0.0009944094734697072, 'weight_decay': 1.8219834248060387e-07, 'epochs': 344, 'loss': 'mae', 'optimizer': 'adam', 'graph_mode': 'off', 'use_snp_selection': False}. Best is trial 11 with value: 0.1427928499948129.
[I 2025-12-05 16:06:59,386] Trial 29 finished with value: 0.11313467450785059 and parameters: {'model_type': 'mlp', 'hidden_dims': '[128, 64]', 'dropout': 0.20079893670037424, 'batch_norm': True, 'lr': 0.000853918206043086, 'weight_decay': 5.522710335772481e-05, 'epochs': 341, 'loss': 'mae', 'optimizer': 'adam', 'graph_mode': 'off', 'use_snp_selection': True, 'num_snps': 19468}. Best is trial 11 with value: 0.1427928499948129.
[I 2025-12-05 16:07:00,968] Trial 30 finished with value: 0.12840646261509775 and parameters: {'model_type': 'mlp', 'hidden_dims': '[128, 64]', 'dropout': 0.13306465339928158, 'batch_norm': True, 'lr': 0.00044959210330041056, 'weight_decay': 5.881280961801718e-07, 'epochs': 329, 'loss': 'mae', 'optimizer': 'adam', 'graph_mode': 'off', 'use_snp_selection': False}. Best is trial 11 with value: 0.1427928499948129.
[I 2025-12-05 16:07:02,613] Trial 31 finished with value: 0.11986195035690511 and parameters: {'model_type': 'mlp', 'hidden_dims': '[128, 64]', 'dropout': 0.1029087677665471, 'batch_norm': True, 'lr': 0.00021529466456466327, 'weight_decay': 1.707360488491118e-07, 'epochs': 350, 'loss': 'mae', 'optimizer': 'adam', 'graph_mode': 'off', 'use_snp_selection': False}. Best is trial 11 with value: 0.1427928499948129.
[I 2025-12-05 16:07:04,072] Trial 32 finished with value: 0.12239027451598121 and parameters: {'model_type': 'mlp', 'hidden_dims': '[128, 64]', 'dropout': 0.15337147121154432, 'batch_norm': True, 'lr': 0.0005770635609126228, 'weight_decay': 1.6418528531965185e-07, 'epochs': 291, 'loss': 'mae', 'optimizer': 'adam', 'graph_mode': 'off', 'use_snp_selection': False}. Best is trial 11 with value: 0.1427928499948129.
[I 2025-12-05 16:07:05,463] Trial 33 finished with value: 0.10823856176806543 and parameters: {'model_type': 'mlp', 'hidden_dims': '[128, 64]', 'dropout': 0.20130185779085685, 'batch_norm': True, 'lr': 0.00011069555879162689, 'weight_decay': 5.40807309746305e-07, 'epochs': 269, 'loss': 'mae', 'optimizer': 'adam', 'graph_mode': 'off', 'use_snp_selection': False}. Best is trial 11 with value: 0.1427928499948129.
[I 2025-12-05 16:07:07,496] Trial 34 finished with value: 0.1436220803288829 and parameters: {'model_type': 'mlp', 'hidden_dims': '[256, 128]', 'dropout': 0.12851488209268175, 'batch_norm': True, 'lr': 0.000657243158651399, 'weight_decay': 2.979425820608117e-07, 'epochs': 224, 'loss': 'mae', 'optimizer': 'adam', 'graph_mode': 'off', 'use_snp_selection': False}. Best is trial 34 with value: 0.1436220803288829.
[I 2025-12-05 16:07:09,415] Trial 35 finished with value: 0.1086716250653604 and parameters: {'model_type': 'mlp', 'hidden_dims': '[256, 128]', 'dropout': 0.12560217157178907, 'batch_norm': False, 'lr': 0.0007064496368312768, 'weight_decay': 3.0585898962808515e-07, 'epochs': 211, 'loss': 'mae', 'optimizer': 'adam', 'graph_mode': 'off', 'use_snp_selection': False}. Best is trial 34 with value: 0.1436220803288829.
[I 2025-12-05 16:07:13,635] Trial 36 finished with value: 0.12428452335370174 and parameters: {'model_type': 'mlp', 'hidden_dims': '[256, 128]', 'dropout': 0.17188758877242566, 'batch_norm': True, 'lr': 0.0003304053234613385, 'weight_decay': 6.886876803351276e-05, 'epochs': 224, 'loss': 'mae', 'optimizer': 'adam', 'graph_mode': 'off', 'use_snp_selection': True, 'num_snps': 58661}. Best is trial 34 with value: 0.1436220803288829.
[I 2025-12-05 16:07:15,097] Trial 37 finished with value: 0.0428053151653262 and parameters: {'model_type': 'mlp', 'hidden_dims': '[256, 128]', 'dropout': 0.13159317001680457, 'batch_norm': True, 'lr': 4.446294938689996e-06, 'weight_decay': 1.1132814472532842e-06, 'epochs': 126, 'loss': 'mae', 'optimizer': 'adam', 'graph_mode': 'off', 'use_snp_selection': False}. Best is trial 34 with value: 0.1436220803288829.
[I 2025-12-05 16:07:17,692] Trial 38 finished with value: 0.0882812303257578 and parameters: {'model_type': 'mlp', 'hidden_dims': '[512, 64]', 'dropout': 0.10027580217880837, 'batch_norm': False, 'lr': 0.0009572261051231687, 'weight_decay': 8.707282741966065e-06, 'epochs': 183, 'loss': 'mae', 'optimizer': 'adam', 'graph_mode': 'off', 'use_snp_selection': True, 'num_snps': 19911}. Best is trial 34 with value: 0.1436220803288829.
[I 2025-12-05 16:07:20,224] Trial 39 finished with value: 0.12347457064007845 and parameters: {'model_type': 'mlp', 'hidden_dims': '[256, 128]', 'dropout': 0.2590304263267221, 'batch_norm': True, 'lr': 3.3076796635345364e-05, 'weight_decay': 0.00010412398872024411, 'epochs': 298, 'loss': 'mae', 'optimizer': 'adam', 'graph_mode': 'off', 'use_snp_selection': False}. Best is trial 34 with value: 0.1436220803288829.
[I 2025-12-05 16:07:22,564] Trial 40 finished with value: 0.13050694568877738 and parameters: {'model_type': 'mlp', 'hidden_dims': '[256, 128]', 'dropout': 0.15643462950417475, 'batch_norm': True, 'lr': 0.0006669882205604788, 'weight_decay': 3.809621484456397e-07, 'epochs': 265, 'loss': 'mae', 'optimizer': 'adam', 'graph_mode': 'off', 'use_snp_selection': False}. Best is trial 34 with value: 0.1436220803288829.
[I 2025-12-05 16:07:26,065] Trial 41 finished with value: 0.05572802307143513 and parameters: {'model_type': 'mlp', 'hidden_dims': '[512, 128]', 'dropout': 0.3558481713556107, 'batch_norm': True, 'lr': 2.320370617557869e-06, 'weight_decay': 1.4982128504862986e-07, 'epochs': 235, 'loss': 'mse', 'optimizer': 'adam', 'graph_mode': 'off', 'use_snp_selection': False}. Best is trial 34 with value: 0.1436220803288829.
[I 2025-12-05 16:07:28,331] Trial 42 finished with value: 0.127108031160861 and parameters: {'model_type': 'mlp', 'hidden_dims': '[256, 128, 64]', 'dropout': 0.4373560331216342, 'batch_norm': True, 'lr': 0.00041643377149204756, 'weight_decay': 1.0312531084197586e-07, 'epochs': 253, 'loss': 'mae', 'optimizer': 'adam', 'graph_mode': 'off', 'use_snp_selection': False}. Best is trial 34 with value: 0.1436220803288829.
[I 2025-12-05 16:07:31,387] Trial 43 finished with value: 0.13186437694127215 and parameters: {'model_type': 'mlp', 'hidden_dims': '[512, 128]', 'dropout': 0.1270265338703035, 'batch_norm': True, 'lr': 0.00024999948612524893, 'weight_decay': 2.484734872917861e-07, 'epochs': 196, 'loss': 'mse', 'optimizer': 'adam', 'graph_mode': 'off', 'use_snp_selection': False}. Best is trial 34 with value: 0.1436220803288829.
[I 2025-12-05 16:07:34,067] Trial 44 finished with value: 0.13317061793043863 and parameters: {'model_type': 'mlp', 'hidden_dims': '[512, 64]', 'dropout': 0.21102045728508564, 'batch_norm': True, 'lr': 0.00017456544905745908, 'weight_decay': 1.6582317619070996e-07, 'epochs': 163, 'loss': 'mae', 'optimizer': 'adam', 'graph_mode': 'off', 'use_snp_selection': False}. Best is trial 34 with value: 0.1436220803288829.
[I 2025-12-05 16:07:37,619] Trial 45 finished with value: 0.12745352101540317 and parameters: {'model_type': 'mlp', 'hidden_dims': '[512, 128]', 'dropout': 0.14795668028679282, 'batch_norm': True, 'lr': 0.0006740286750663018, 'weight_decay': 4.25476121175068e-07, 'epochs': 239, 'loss': 'mse', 'optimizer': 'adam', 'graph_mode': 'off', 'use_snp_selection': False}. Best is trial 34 with value: 0.1436220803288829.
[I 2025-12-05 16:07:40,644] Trial 46 finished with value: 0.14047406973067827 and parameters: {'model_type': 'mlp', 'hidden_dims': '[512, 256]', 'dropout': 0.12102843799340512, 'batch_norm': True, 'lr': 0.0003962137339599292, 'weight_decay': 1.5123788387186485e-07, 'epochs': 196, 'loss': 'mae', 'optimizer': 'adam', 'graph_mode': 'off', 'use_snp_selection': False}. Best is trial 34 with value: 0.1436220803288829.
[I 2025-12-05 16:07:43,628] Trial 47 finished with value: 0.10602461083712804 and parameters: {'model_type': 'mlp', 'hidden_dims': '[512, 256]', 'dropout': 0.11786633654652555, 'batch_norm': False, 'lr': 7.946327311841995e-05, 'weight_decay': 7.969761049336864e-07, 'epochs': 195, 'loss': 'mae', 'optimizer': 'adam', 'graph_mode': 'off', 'use_snp_selection': False}. Best is trial 34 with value: 0.1436220803288829.
[I 2025-12-05 16:07:48,171] Trial 48 finished with value: 0.11749876648662377 and parameters: {'model_type': 'mlp', 'hidden_dims': '[512, 256]', 'dropout': 0.18160858390039533, 'batch_norm': True, 'lr': 0.0004270887414498421, 'weight_decay': 1.8844674886738178e-06, 'epochs': 322, 'loss': 'mae', 'optimizer': 'adam', 'graph_mode': 'off', 'use_snp_selection': False}. Best is trial 34 with value: 0.1436220803288829.
[I 2025-12-05 16:07:51,329] Trial 49 finished with value: 0.15230533385768555 and parameters: {'model_type': 'mlp', 'hidden_dims': '[512, 256]', 'dropout': 0.14221193669535778, 'batch_norm': True, 'lr': 0.0005627758790369909, 'weight_decay': 0.0005066159281116349, 'epochs': 48, 'loss': 'mae', 'optimizer': 'adam', 'graph_mode': 'off', 'use_snp_selection': True, 'num_snps': 46888}. Best is trial 49 with value: 0.15230533385768555.
[I 2025-12-05 16:07:54,551] Trial 50 finished with value: 0.13910649352489476 and parameters: {'model_type': 'mlp', 'hidden_dims': '[512, 256]', 'dropout': 0.14806010090845956, 'batch_norm': True, 'lr': 0.0002991780015386373, 'weight_decay': 0.0006472716575673044, 'epochs': 74, 'loss': 'mae', 'optimizer': 'adam', 'graph_mode': 'off', 'use_snp_selection': True, 'num_snps': 46345}. Best is trial 49 with value: 0.15230533385768555.
[I 2025-12-05 16:07:57,720] Trial 51 finished with value: 0.12020695087922498 and parameters: {'model_type': 'mlp', 'hidden_dims': '[512, 256]', 'dropout': 0.14176868789034897, 'batch_norm': True, 'lr': 0.00052074799301554, 'weight_decay': 0.0005346674131447084, 'epochs': 42, 'loss': 'mae', 'optimizer': 'adam', 'graph_mode': 'off', 'use_snp_selection': True, 'num_snps': 46497}. Best is trial 49 with value: 0.15230533385768555.
[I 2025-12-05 16:08:01,032] Trial 52 finished with value: 0.12036222354160178 and parameters: {'model_type': 'mlp', 'hidden_dims': '[512, 256]', 'dropout': 0.1683251007853932, 'batch_norm': True, 'lr': 0.000282823833000364, 'weight_decay': 0.0009930036670572533, 'epochs': 70, 'loss': 'mae', 'optimizer': 'adam', 'graph_mode': 'off', 'use_snp_selection': True, 'num_snps': 47120}. Best is trial 49 with value: 0.15230533385768555.
[I 2025-12-05 16:08:04,503] Trial 53 finished with value: 0.11314277556093517 and parameters: {'model_type': 'mlp', 'hidden_dims': '[512, 256]', 'dropout': 0.11474593554464353, 'batch_norm': True, 'lr': 0.0009781955557821615, 'weight_decay': 0.00026975550166676054, 'epochs': 121, 'loss': 'mae', 'optimizer': 'adam', 'graph_mode': 'off', 'use_snp_selection': True, 'num_snps': 39726}. Best is trial 49 with value: 0.15230533385768555.
[I 2025-12-05 16:08:08,369] Trial 54 finished with value: 0.13384195472707436 and parameters: {'model_type': 'mlp', 'hidden_dims': '[512, 256]', 'dropout': 0.14733600374155129, 'batch_norm': True, 'lr': 0.000379343661630366, 'weight_decay': 0.00013194016898929214, 'epochs': 89, 'loss': 'mae', 'optimizer': 'adam', 'graph_mode': 'off', 'use_snp_selection': True, 'num_snps': 52298}. Best is trial 49 with value: 0.15230533385768555.
[I 2025-12-05 16:08:10,859] Trial 55 finished with value: 0.15835618302911308 and parameters: {'model_type': 'mlp', 'hidden_dims': '[512, 256]', 'dropout': 0.18692019486429284, 'batch_norm': True, 'lr': 0.0001358111123509545, 'weight_decay': 0.000492872150456735, 'epochs': 78, 'loss': 'mae', 'optimizer': 'adam', 'graph_mode': 'off', 'use_snp_selection': True, 'num_snps': 26954}. Best is trial 55 with value: 0.15835618302911308.
[I 2025-12-05 16:08:13,279] Trial 56 finished with value: 0.11376173022083298 and parameters: {'model_type': 'mlp', 'hidden_dims': '[512, 256]', 'dropout': 0.2229637364093764, 'batch_norm': True, 'lr': 0.00014018202464184868, 'weight_decay': 0.0005077224210773397, 'epochs': 76, 'loss': 'mae', 'optimizer': 'adam', 'graph_mode': 'off', 'use_snp_selection': True, 'num_snps': 26156}. Best is trial 55 with value: 0.15835618302911308.
[I 2025-12-05 16:08:15,731] Trial 57 finished with value: 0.13191843224336436 and parameters: {'model_type': 'mlp', 'hidden_dims': '[512, 256]', 'dropout': 0.18915830223005128, 'batch_norm': True, 'lr': 9.603719117613245e-05, 'weight_decay': 0.0001675974688221541, 'epochs': 54, 'loss': 'mae', 'optimizer': 'adam', 'graph_mode': 'off', 'use_snp_selection': True, 'num_snps': 31548}. Best is trial 55 with value: 0.15835618302911308.
[I 2025-12-05 16:08:18,160] Trial 58 finished with value: 0.10106195309606866 and parameters: {'model_type': 'mlp', 'hidden_dims': '[512, 256]', 'dropout': 0.16632546400728093, 'batch_norm': False, 'lr': 0.00022848515346908835, 'weight_decay': 2.330604431307473e-05, 'epochs': 78, 'loss': 'mae', 'optimizer': 'adam', 'graph_mode': 'off', 'use_snp_selection': True, 'num_snps': 24919}. Best is trial 55 with value: 0.15835618302911308.
[I 2025-12-05 16:08:21,581] Trial 59 finished with value: 0.12035473458444744 and parameters: {'model_type': 'mlp', 'hidden_dims': '[512, 256]', 'dropout': 0.258150790173642, 'batch_norm': True, 'lr': 4.2781814853927364e-05, 'weight_decay': 0.0006222296610453332, 'epochs': 62, 'loss': 'mae', 'optimizer': 'adam', 'graph_mode': 'off', 'use_snp_selection': True, 'num_snps': 50952}. Best is trial 55 with value: 0.15835618302911308.
[I 2025-12-05 16:08:24,666] Trial 60 finished with value: 0.12753371229324734 and parameters: {'model_type': 'mlp', 'hidden_dims': '[512, 256]', 'dropout': 0.14126274504088765, 'batch_norm': True, 'lr': 0.00018542260694607467, 'weight_decay': 0.0003321945235112316, 'epochs': 101, 'loss': 'mae', 'optimizer': 'adam', 'graph_mode': 'off', 'use_snp_selection': True, 'num_snps': 38560}. Best is trial 55 with value: 0.15835618302911308.
[I 2025-12-05 16:08:28,050] Trial 61 finished with value: 0.12896044358936953 and parameters: {'model_type': 'mlp', 'hidden_dims': '[512, 256]', 'dropout': 0.11434695191551406, 'batch_norm': True, 'lr': 0.0005968295753027442, 'weight_decay': 0.00044154342153366764, 'epochs': 40, 'loss': 'mae', 'optimizer': 'adam', 'graph_mode': 'off', 'use_snp_selection': True, 'num_snps': 52506}. Best is trial 55 with value: 0.15835618302911308.
[I 2025-12-05 16:08:31,748] Trial 62 finished with value: 0.1383092356597985 and parameters: {'model_type': 'mlp', 'hidden_dims': '[512, 256]', 'dropout': 0.12038359637272704, 'batch_norm': True, 'lr': 0.0003522452244742004, 'weight_decay': 0.0007021548045043737, 'epochs': 139, 'loss': 'mae', 'optimizer': 'adam', 'graph_mode': 'off', 'use_snp_selection': True, 'num_snps': 43042}. Best is trial 55 with value: 0.15835618302911308.
[I 2025-12-05 16:08:35,251] Trial 63 finished with value: 0.12852599735893996 and parameters: {'model_type': 'mlp', 'hidden_dims': '[512, 256]', 'dropout': 0.13436134659780333, 'batch_norm': True, 'lr': 0.0003655217056372613, 'weight_decay': 0.0007264339435859491, 'epochs': 127, 'loss': 'mae', 'optimizer': 'adam', 'graph_mode': 'off', 'use_snp_selection': True, 'num_snps': 42985}. Best is trial 55 with value: 0.15835618302911308.
