[I 2025-12-05 15:43:23,503] Trial 29 finished with value: -0.012756843244595837 and parameters: {'model_type': 'mlp', 'hidden_dims': '[128, 64]', 'dropout': 0.5503073818393536, 'batch_norm': True, 'lr': 2.153444936836059e-06, 'weight_decay': 8.155158768248925e-06, 'epochs': 336, 'loss': 'mae', 'optimizer': 'adam', 'graph_mode': 'off', 'use_snp_selection': True, 'num_snps': 33826}. Best is trial 5 with value: 0.056440586886236925.
[I 2025-12-05 15:43:25,291] Trial 30 finished with value: -0.004878977588753709 and parameters: {'model_type': 'mlp', 'hidden_dims': '[512, 64]', 'dropout': 0.3323729802750404, 'batch_norm': True, 'lr': 1.0158596012342448e-06, 'weight_decay': 4.413851575565222e-05, 'epochs': 223, 'loss': 'mae', 'optimizer': 'adam', 'graph_mode': 'off', 'use_snp_selection': True, 'num_snps': 29073}. Best is trial 5 with value: 0.056440586886236925.
[I 2025-12-05 15:43:27,571] Trial 31 finished with value: 0.0302709494603111 and parameters: {'model_type': 'mlp', 'hidden_dims': '[512, 256]', 'dropout': 0.292303349369843, 'batch_norm': True, 'lr': 0.00039241926549901164, 'weight_decay': 0.00013650143671465408, 'epochs': 128, 'loss': 'mae', 'optimizer': 'adam', 'graph_mode': 'off', 'use_snp_selection': True, 'num_snps': 45808}. Best is trial 5 with value: 0.056440586886236925.
[I 2025-12-05 15:43:29,986] Trial 32 finished with value: 0.019655153124110276 and parameters: {'model_type': 'mlp', 'hidden_dims': '[512, 256]', 'dropout': 0.420445654860943, 'batch_norm': True, 'lr': 0.00010323434561277342, 'weight_decay': 0.00022790089812340714, 'epochs': 90, 'loss': 'mae', 'optimizer': 'adam', 'graph_mode': 'off', 'use_snp_selection': True, 'num_snps': 50131}. Best is trial 5 with value: 0.056440586886236925.
[I 2025-12-05 15:43:32,227] Trial 33 finished with value: 0.04010240182764022 and parameters: {'model_type': 'mlp', 'hidden_dims': '[512, 256]', 'dropout': 0.3803148252543665, 'batch_norm': True, 'lr': 0.00022951222593470662, 'weight_decay': 0.0006537541871055988, 'epochs': 155, 'loss': 'mae', 'optimizer': 'adam', 'graph_mode': 'off', 'use_snp_selection': True, 'num_snps': 41007}. Best is trial 5 with value: 0.056440586886236925.
[I 2025-12-05 15:43:34,031] Trial 34 finished with value: 0.05289429810862167 and parameters: {'model_type': 'mlp', 'hidden_dims': '[256, 128, 64]', 'dropout': 0.43968265932813144, 'batch_norm': True, 'lr': 0.0009423662930873952, 'weight_decay': 0.0003756094984611687, 'epochs': 123, 'loss': 'mae', 'optimizer': 'adam', 'graph_mode': 'off', 'use_snp_selection': True, 'num_snps': 37287}. Best is trial 5 with value: 0.056440586886236925.
[I 2025-12-05 15:43:35,943] Trial 35 finished with value: 0.031271191244910554 and parameters: {'model_type': 'mlp', 'hidden_dims': '[256, 128, 64]', 'dropout': 0.4722117682312563, 'batch_norm': False, 'lr': 0.0007995509434529722, 'weight_decay': 0.00045305644372391934, 'epochs': 242, 'loss': 'mae', 'optimizer': 'adam', 'graph_mode': 'off', 'use_snp_selection': True, 'num_snps': 37323}. Best is trial 5 with value: 0.056440586886236925.
[I 2025-12-05 15:43:37,648] Trial 36 finished with value: 0.04474149531507242 and parameters: {'model_type': 'mlp', 'hidden_dims': '[256, 128, 64]', 'dropout': 0.4173550328460927, 'batch_norm': True, 'lr': 0.0005716018448315814, 'weight_decay': 1.5036304273709549e-05, 'epochs': 112, 'loss': 'mse', 'optimizer': 'adam', 'graph_mode': 'off', 'use_snp_selection': True, 'num_snps': 33434}. Best is trial 5 with value: 0.056440586886236925.
[I 2025-12-05 15:43:38,389] Trial 37 finished with value: 0.025412840689845038 and parameters: {'model_type': 'mlp', 'hidden_dims': '[256, 128, 64]', 'dropout': 0.4291074891757835, 'batch_norm': True, 'lr': 8.729917851704727e-05, 'weight_decay': 0.0003282787289606488, 'epochs': 77, 'loss': 'mae', 'optimizer': 'adam', 'graph_mode': 'off', 'use_snp_selection': False}. Best is trial 5 with value: 0.056440586886236925.
[I 2025-12-05 15:43:39,917] Trial 38 finished with value: 0.006588620432963126 and parameters: {'model_type': 'mlp', 'hidden_dims': '[256, 128, 64]', 'dropout': 0.4425836147935046, 'batch_norm': False, 'lr': 3.977504726621812e-05, 'weight_decay': 0.000908117487085616, 'epochs': 262, 'loss': 'mse', 'optimizer': 'adam', 'graph_mode': 'off', 'use_snp_selection': True, 'num_snps': 23857}. Best is trial 5 with value: 0.056440586886236925.
[I 2025-12-05 15:43:41,364] Trial 39 finished with value: 0.050629208696312905 and parameters: {'model_type': 'mlp', 'hidden_dims': '[512, 128]', 'dropout': 0.38753513076390333, 'batch_norm': True, 'lr': 0.0009421382050683847, 'weight_decay': 2.6060685821044104e-05, 'epochs': 198, 'loss': 'mae', 'optimizer': 'adam', 'graph_mode': 'off', 'use_snp_selection': False}. Best is trial 5 with value: 0.056440586886236925.
[I 2025-12-05 15:43:42,777] Trial 40 finished with value: 0.0019634983901218486 and parameters: {'model_type': 'mlp', 'hidden_dims': '[512, 128]', 'dropout': 0.5937685227205456, 'batch_norm': True, 'lr': 5.564677166342786e-06, 'weight_decay': 2.902288933652916e-05, 'epochs': 190, 'loss': 'mse', 'optimizer': 'adam', 'graph_mode': 'off', 'use_snp_selection': False}. Best is trial 5 with value: 0.056440586886236925.
[I 2025-12-05 15:43:44,051] Trial 41 finished with value: 0.037711043153143754 and parameters: {'model_type': 'mlp', 'hidden_dims': '[512, 128]', 'dropout': 0.39684514653418523, 'batch_norm': True, 'lr': 0.0004698514822683194, 'weight_decay': 8.554398726544083e-05, 'epochs': 149, 'loss': 'mae', 'optimizer': 'adam', 'graph_mode': 'off', 'use_snp_selection': False}. Best is trial 5 with value: 0.056440586886236925.
[I 2025-12-05 15:43:45,527] Trial 42 finished with value: 0.046708760813323306 and parameters: {'model_type': 'mlp', 'hidden_dims': '[512, 128]', 'dropout': 0.3511595528210149, 'batch_norm': True, 'lr': 0.0008444850152859881, 'weight_decay': 0.00017577224037944542, 'epochs': 204, 'loss': 'mae', 'optimizer': 'adam', 'graph_mode': 'off', 'use_snp_selection': False}. Best is trial 5 with value: 0.056440586886236925.
[I 2025-12-05 15:43:47,081] Trial 43 finished with value: 0.04322656745111204 and parameters: {'model_type': 'mlp', 'hidden_dims': '[512, 64]', 'dropout': 0.32123101395936204, 'batch_norm': True, 'lr': 0.0009699517169784665, 'weight_decay': 4.51515149489944e-07, 'epochs': 226, 'loss': 'mae', 'optimizer': 'adam', 'graph_mode': 'off', 'use_snp_selection': False}. Best is trial 5 with value: 0.056440586886236925.
[I 2025-12-05 15:43:48,011] Trial 44 finished with value: 0.04259780828989472 and parameters: {'model_type': 'mlp', 'hidden_dims': '[256, 128]', 'dropout': 0.3841254856537317, 'batch_norm': True, 'lr': 0.00019006735514051818, 'weight_decay': 3.993855165611627e-06, 'epochs': 160, 'loss': 'mae', 'optimizer': 'adam', 'graph_mode': 'off', 'use_snp_selection': False}. Best is trial 5 with value: 0.056440586886236925.
[I 2025-12-05 15:43:49,387] Trial 45 finished with value: 0.04440860328857964 and parameters: {'model_type': 'mlp', 'hidden_dims': '[512, 128]', 'dropout': 0.2662915448770308, 'batch_norm': True, 'lr': 0.00031462303931930805, 'weight_decay': 1.3722598877116787e-05, 'epochs': 180, 'loss': 'mae', 'optimizer': 'adam', 'graph_mode': 'off', 'use_snp_selection': False}. Best is trial 5 with value: 0.056440586886236925.
[I 2025-12-05 15:43:50,498] Trial 46 finished with value: 0.031114975547001416 and parameters: {'model_type': 'mlp', 'hidden_dims': '[256, 128, 64]', 'dropout': 0.4905368087076612, 'batch_norm': False, 'lr': 0.0005177798360527776, 'weight_decay': 2.721736361122687e-05, 'epochs': 259, 'loss': 'mae', 'optimizer': 'adam', 'graph_mode': 'off', 'use_snp_selection': False}. Best is trial 5 with value: 0.056440586886236925.
[I 2025-12-05 15:43:52,228] Trial 47 finished with value: 0.03381630566238309 and parameters: {'model_type': 'mlp', 'hidden_dims': '[512, 64]', 'dropout': 0.44097137736330144, 'batch_norm': True, 'lr': 0.0005872910071825134, 'weight_decay': 1.2798559450978395e-06, 'epochs': 138, 'loss': 'mae', 'optimizer': 'adam', 'graph_mode': 'off', 'use_snp_selection': True, 'num_snps': 30760}. Best is trial 5 with value: 0.056440586886236925.
[I 2025-12-05 15:43:53,139] Trial 48 finished with value: 0.045410477608399676 and parameters: {'model_type': 'mlp', 'hidden_dims': '[256, 128, 64]', 'dropout': 0.3520876779681605, 'batch_norm': True, 'lr': 0.0006595995585224869, 'weight_decay': 8.960639075741832e-06, 'epochs': 110, 'loss': 'mse', 'optimizer': 'adam', 'graph_mode': 'off', 'use_snp_selection': True, 'num_snps': 7730}. Best is trial 5 with value: 0.056440586886236925.
[I 2025-12-05 15:43:54,861] Trial 49 finished with value: 0.028560357001496766 and parameters: {'model_type': 'mlp', 'hidden_dims': '[256, 128]', 'dropout': 0.39969736952232915, 'batch_norm': True, 'lr': 1.8647721750381054e-06, 'weight_decay': 0.00046373254565263095, 'epochs': 59, 'loss': 'mae', 'optimizer': 'adam', 'graph_mode': 'off', 'use_snp_selection': True, 'num_snps': 38929}. Best is trial 5 with value: 0.056440586886236925.
[I 2025-12-05 15:43:56,742] Trial 50 finished with value: 0.0477099799275365 and parameters: {'model_type': 'mlp', 'hidden_dims': '[512, 128]', 'dropout': 0.37393318864438013, 'batch_norm': True, 'lr': 0.00018054663142075175, 'weight_decay': 0.00024467469937010063, 'epochs': 305, 'loss': 'mae', 'optimizer': 'adam', 'graph_mode': 'off', 'use_snp_selection': False}. Best is trial 5 with value: 0.056440586886236925.
[I 2025-12-05 15:43:58,611] Trial 51 finished with value: 0.04664727505037301 and parameters: {'model_type': 'mlp', 'hidden_dims': '[512, 128]', 'dropout': 0.36710064300104195, 'batch_norm': True, 'lr': 0.00017094057985229846, 'weight_decay': 0.00023178309537062085, 'epochs': 306, 'loss': 'mae', 'optimizer': 'adam', 'graph_mode': 'off', 'use_snp_selection': False}. Best is trial 5 with value: 0.056440586886236925.
[I 2025-12-05 15:44:00,649] Trial 52 finished with value: 0.05538693306525286 and parameters: {'model_type': 'mlp', 'hidden_dims': '[512, 128]', 'dropout': 0.31631223936743863, 'batch_norm': True, 'lr': 0.0003115471415821221, 'weight_decay': 0.0006693566683459425, 'epochs': 346, 'loss': 'mae', 'optimizer': 'adam', 'graph_mode': 'off', 'use_snp_selection': False}. Best is trial 5 with value: 0.056440586886236925.
[I 2025-12-05 15:44:02,644] Trial 53 finished with value: 0.04133412702863706 and parameters: {'model_type': 'mlp', 'hidden_dims': '[512, 128]', 'dropout': 0.3133055369844679, 'batch_norm': True, 'lr': 6.361110962232842e-05, 'weight_decay': 0.0006143344466535594, 'epochs': 340, 'loss': 'mae', 'optimizer': 'adam', 'graph_mode': 'off', 'use_snp_selection': False}. Best is trial 5 with value: 0.056440586886236925.
[I 2025-12-05 15:44:04,675] Trial 54 finished with value: 0.04501220304257678 and parameters: {'model_type': 'mlp', 'hidden_dims': '[512, 128]', 'dropout': 0.28545271210323075, 'batch_norm': True, 'lr': 0.00029377266104478616, 'weight_decay': 0.00036721585887463894, 'epochs': 349, 'loss': 'mae', 'optimizer': 'adam', 'graph_mode': 'off', 'use_snp_selection': False}. Best is trial 5 with value: 0.056440586886236925.
[I 2025-12-05 15:44:06,592] Trial 55 finished with value: 0.0321820000698336 and parameters: {'model_type': 'mlp', 'hidden_dims': '[512, 128]', 'dropout': 0.4580462347067091, 'batch_norm': True, 'lr': 8.486349193519983e-05, 'weight_decay': 0.0009577857089498438, 'epochs': 312, 'loss': 'mae', 'optimizer': 'adam', 'graph_mode': 'off', 'use_snp_selection': False}. Best is trial 5 with value: 0.056440586886236925.
[I 2025-12-05 15:44:08,528] Trial 56 finished with value: 0.02677843314897835 and parameters: {'model_type': 'mlp', 'hidden_dims': '[512, 128]', 'dropout': 0.24993300199083798, 'batch_norm': True, 'lr': 1.763560258657679e-05, 'weight_decay': 0.0002868792703461089, 'epochs': 321, 'loss': 'mae', 'optimizer': 'adam', 'graph_mode': 'off', 'use_snp_selection': False}. Best is trial 5 with value: 0.056440586886236925.
[I 2025-12-05 15:44:10,348] Trial 57 finished with value: 0.02402760726966038 and parameters: {'model_type': 'mlp', 'hidden_dims': '[512, 128]', 'dropout': 0.39099922068968385, 'batch_norm': False, 'lr': 4.565424789361368e-05, 'weight_decay': 0.000620226517076196, 'epochs': 296, 'loss': 'mae', 'optimizer': 'adam', 'graph_mode': 'off', 'use_snp_selection': False}. Best is trial 5 with value: 0.056440586886236925.
[I 2025-12-05 15:44:12,310] Trial 58 finished with value: 0.013736834171973689 and parameters: {'model_type': 'mlp', 'hidden_dims': '[512, 64]', 'dropout': 0.3520641081503427, 'batch_norm': True, 'lr': 1.1519048799065279e-05, 'weight_decay': 0.00011950457387890813, 'epochs': 330, 'loss': 'mae', 'optimizer': 'adam', 'graph_mode': 'off', 'use_snp_selection': False}. Best is trial 5 with value: 0.056440586886236925.
[I 2025-12-05 15:44:14,253] Trial 59 finished with value: 0.04328729319757049 and parameters: {'model_type': 'mlp', 'hidden_dims': '[512, 128]', 'dropout': 0.3663625496446284, 'batch_norm': True, 'lr': 0.0002623732926937079, 'weight_decay': 9.154366257229738e-05, 'epochs': 324, 'loss': 'mae', 'optimizer': 'adam', 'graph_mode': 'off', 'use_snp_selection': False}. Best is trial 5 with value: 0.056440586886236925.
[I 2025-12-05 15:44:15,017] Trial 60 finished with value: 0.040826048317963715 and parameters: {'model_type': 'mlp', 'hidden_dims': '[128, 64]', 'dropout': 0.40903452952884567, 'batch_norm': True, 'lr': 0.00013728543734643493, 'weight_decay': 6.529010527591238e-05, 'epochs': 170, 'loss': 'mae', 'optimizer': 'adam', 'graph_mode': 'off', 'use_snp_selection': False}. Best is trial 5 with value: 0.056440586886236925.
[I 2025-12-05 15:44:17,003] Trial 61 finished with value: 0.03547967152447064 and parameters: {'model_type': 'mlp', 'hidden_dims': '[256, 128, 64]', 'dropout': 0.30796878387089804, 'batch_norm': True, 'lr': 0.0003931032792182587, 'weight_decay': 0.0004323409095074133, 'epochs': 276, 'loss': 'mae', 'optimizer': 'adam', 'graph_mode': 'off', 'use_snp_selection': True, 'num_snps': 34323}. Best is trial 5 with value: 0.056440586886236925.
[I 2025-12-05 15:44:18,419] Trial 62 finished with value: 0.03141462753596904 and parameters: {'model_type': 'mlp', 'hidden_dims': '[256, 128, 64]', 'dropout': 0.34203077337787163, 'batch_norm': True, 'lr': 0.000174553810697357, 'weight_decay': 2.3267147049700946e-07, 'epochs': 200, 'loss': 'mae', 'optimizer': 'adam', 'graph_mode': 'off', 'use_snp_selection': True, 'num_snps': 19727}. Best is trial 5 with value: 0.056440586886236925.
[I 2025-12-05 15:44:20,638] Trial 63 finished with value: 0.02839724743823995 and parameters: {'model_type': 'mlp', 'hidden_dims': '[256, 128, 64]', 'dropout': 0.32844755894201216, 'batch_norm': True, 'lr': 0.00048161300601783785, 'weight_decay': 0.0006767989258147931, 'epochs': 217, 'loss': 'mae', 'optimizer': 'adam', 'graph_mode': 'off', 'use_snp_selection': True, 'num_snps': 44384}. Best is trial 5 with value: 0.056440586886236925.
[I 2025-12-05 15:44:22,421] Trial 64 finished with value: 0.04457292740959798 and parameters: {'model_type': 'mlp', 'hidden_dims': '[512, 64]', 'dropout': 0.37048133192304783, 'batch_norm': True, 'lr': 0.0007271904315125007, 'weight_decay': 2.626643100536285e-06, 'epochs': 276, 'loss': 'mae', 'optimizer': 'adam', 'graph_mode': 'off', 'use_snp_selection': False}. Best is trial 5 with value: 0.056440586886236925.
[I 2025-12-05 15:44:25,599] Trial 65 finished with value: 0.04449103065049075 and parameters: {'model_type': 'mlp', 'hidden_dims': '[512, 128]', 'dropout': 0.17197506862574335, 'batch_norm': True, 'lr': 0.0004035987079517522, 'weight_decay': 0.00018085262093520815, 'epochs': 231, 'loss': 'mae', 'optimizer': 'adam', 'graph_mode': 'off', 'use_snp_selection': True, 'num_snps': 59131}. Best is trial 5 with value: 0.056440586886236925.
[I 2025-12-05 15:44:27,143] Trial 66 finished with value: -0.01169280707983334 and parameters: {'model_type': 'mlp', 'hidden_dims': '[256, 128]', 'dropout': 0.4257939941811682, 'batch_norm': True, 'lr': 2.679316369833246e-06, 'weight_decay': 1.6047559095945736e-06, 'epochs': 255, 'loss': 'mae', 'optimizer': 'adam', 'graph_mode': 'off', 'use_snp_selection': True, 'num_snps': 23635}. Best is trial 5 with value: 0.056440586886236925.
[I 2025-12-05 15:44:28,710] Trial 67 finished with value: 0.025749949791243548 and parameters: {'model_type': 'mlp', 'hidden_dims': '[256, 128, 64]', 'dropout': 0.384114883975831, 'batch_norm': True, 'lr': 0.000991862820413838, 'weight_decay': 2.1020376041546482e-05, 'epochs': 103, 'loss': 'mse', 'optimizer': 'adam', 'graph_mode': 'off', 'use_snp_selection': True, 'num_snps': 30485}. Best is trial 5 with value: 0.056440586886236925.
[I 2025-12-05 15:44:29,473] Trial 68 finished with value: 0.01924067719828887 and parameters: {'model_type': 'mlp', 'hidden_dims': '[128, 64]', 'dropout': 0.29682037199818556, 'batch_norm': False, 'lr': 0.00031097019843193135, 'weight_decay': 0.00027206426039244396, 'epochs': 196, 'loss': 'mae', 'optimizer': 'adam', 'graph_mode': 'off', 'use_snp_selection': False}. Best is trial 5 with value: 0.056440586886236925.
[I 2025-12-05 15:44:30,619] Trial 69 finished with value: 0.02288416902838577 and parameters: {'model_type': 'mlp', 'hidden_dims': '[512, 128]', 'dropout': 0.2709789534265143, 'batch_norm': True, 'lr': 0.0002099533648376202, 'weight_decay': 0.0007750006685136461, 'epochs': 125, 'loss': 'mae', 'optimizer': 'adam', 'graph_mode': 'off', 'use_snp_selection': True, 'num_snps': 15532}. Best is trial 5 with value: 0.056440586886236925.
[I 2025-12-05 15:44:32,250] Trial 70 finished with value: 0.029464748826434857 and parameters: {'model_type': 'mlp', 'hidden_dims': '[256, 128, 64]', 'dropout': 0.5218152990140159, 'batch_norm': True, 'lr': 0.00010781937804883344, 'weight_decay': 4.2891537743202824e-05, 'epochs': 210, 'loss': 'mae', 'optimizer': 'adam', 'graph_mode': 'off', 'use_snp_selection': True, 'num_snps': 25464}. Best is trial 5 with value: 0.056440586886236925.
[I 2025-12-05 15:44:33,859] Trial 71 finished with value: 0.04456647672263926 and parameters: {'model_type': 'mlp', 'hidden_dims': '[512, 128]', 'dropout': 0.3427923203370468, 'batch_norm': True, 'lr': 0.0007847313196764426, 'weight_decay': 0.00021533589577896203, 'epochs': 238, 'loss': 'mae', 'optimizer': 'adam', 'graph_mode': 'off', 'use_snp_selection': False}. Best is trial 5 with value: 0.056440586886236925.
[I 2025-12-05 15:44:35,358] Trial 72 finished with value: 0.047350397944862024 and parameters: {'model_type': 'mlp', 'hidden_dims': '[512, 128]', 'dropout': 0.35811199259157794, 'batch_norm': True, 'lr': 0.0008175880519062122, 'weight_decay': 0.00017228007864184146, 'epochs': 201, 'loss': 'mae', 'optimizer': 'adam', 'graph_mode': 'off', 'use_snp_selection': False}. Best is trial 5 with value: 0.056440586886236925.
[I 2025-12-05 15:44:36,748] Trial 73 finished with value: 0.04057707315010414 and parameters: {'model_type': 'mlp', 'hidden_dims': '[512, 128]', 'dropout': 0.3184467500211152, 'batch_norm': True, 'lr': 0.000683147095251165, 'weight_decay': 0.0003621383968391853, 'epochs': 182, 'loss': 'mae', 'optimizer': 'adam', 'graph_mode': 'off', 'use_snp_selection': False}. Best is trial 5 with value: 0.056440586886236925.
[I 2025-12-05 15:44:38,268] Trial 74 finished with value: 0.02811691194489926 and parameters: {'model_type': 'mlp', 'hidden_dims': '[512, 128]', 'dropout': 0.3587368442728759, 'batch_norm': True, 'lr': 0.0005890505544619554, 'weight_decay': 0.000489673062844805, 'epochs': 216, 'loss': 'mae', 'optimizer': 'adam', 'graph_mode': 'off', 'use_snp_selection': False}. Best is trial 5 with value: 0.056440586886236925.
[I 2025-12-05 15:44:39,695] Trial 75 finished with value: 0.04148719380509757 and parameters: {'model_type': 'mlp', 'hidden_dims': '[512, 64]', 'dropout': 0.335812270471541, 'batch_norm': True, 'lr': 0.0003487555923342869, 'weight_decay': 0.00015541116890237233, 'epochs': 193, 'loss': 'mae', 'optimizer': 'adam', 'graph_mode': 'off', 'use_snp_selection': False}. Best is trial 5 with value: 0.056440586886236925.
[I 2025-12-05 15:44:41,024] Trial 76 finished with value: 0.04143021070618469 and parameters: {'model_type': 'mlp', 'hidden_dims': '[512, 128]', 'dropout': 0.4091421571134912, 'batch_norm': True, 'lr': 0.00043131967570939815, 'weight_decay': 9.643500141960725e-05, 'epochs': 167, 'loss': 'mae', 'optimizer': 'adam', 'graph_mode': 'off', 'use_snp_selection': False}. Best is trial 5 with value: 0.056440586886236925.
[I 2025-12-05 15:44:43,391] Trial 77 finished with value: 0.018787441479733887 and parameters: {'model_type': 'mlp', 'hidden_dims': '[256, 128, 64]', 'dropout': 0.3785722420434623, 'batch_norm': True, 'lr': 0.00024128239267740277, 'weight_decay': 4.123537932058597e-07, 'epochs': 251, 'loss': 'mse', 'optimizer': 'adam', 'graph_mode': 'off', 'use_snp_selection': True, 'num_snps': 47656}. Best is trial 5 with value: 0.056440586886236925.
[I 2025-12-05 15:44:45,008] Trial 78 finished with value: 0.04951122736549567 and parameters: {'model_type': 'mlp', 'hidden_dims': '[512, 256]', 'dropout': 0.3943736446146031, 'batch_norm': True, 'lr': 0.0008867161514351764, 'weight_decay': 5.565123017948584e-06, 'epochs': 232, 'loss': 'mae', 'optimizer': 'adam', 'graph_mode': 'off', 'use_snp_selection': False}. Best is trial 5 with value: 0.056440586886236925.
[I 2025-12-05 15:44:46,233] Trial 79 finished with value: 0.03863449220772274 and parameters: {'model_type': 'mlp', 'hidden_dims': '[512, 256]', 'dropout': 0.45836159308683533, 'batch_norm': True, 'lr': 0.0008559487280015495, 'weight_decay': 6.468184669669428e-06, 'epochs': 139, 'loss': 'mae', 'optimizer': 'adam', 'graph_mode': 'off', 'use_snp_selection': False}. Best is trial 5 with value: 0.056440586886236925.
