[I 2025-12-05 16:14:24,415] Trial 65 finished with value: 0.11942212062351887 and parameters: {'model_type': 'mlp', 'hidden_dims': '[256, 128, 64]', 'dropout': 0.13332371223255632, 'batch_norm': True, 'lr': 0.0002785842031443715, 'weight_decay': 8.56340822898159e-06, 'epochs': 185, 'loss': 'mse', 'optimizer': 'adam', 'graph_mode': 'off', 'use_snp_selection': False}. Best is trial 14 with value: 0.138775629550442.
[I 2025-12-05 16:14:25,572] Trial 66 finished with value: 0.12371996122596671 and parameters: {'model_type': 'mlp', 'hidden_dims': '[256, 128]', 'dropout': 0.22665657189227534, 'batch_norm': True, 'lr': 0.0006226535251502496, 'weight_decay': 7.771780773096772e-07, 'epochs': 219, 'loss': 'mse', 'optimizer': 'adam', 'graph_mode': 'off', 'use_snp_selection': False}. Best is trial 14 with value: 0.138775629550442.
[I 2025-12-05 16:14:27,049] Trial 67 finished with value: 0.12924873617173405 and parameters: {'model_type': 'mlp', 'hidden_dims': '[512, 64]', 'dropout': 0.24074234479237647, 'batch_norm': True, 'lr': 9.465422031824091e-05, 'weight_decay': 4.914257108931296e-07, 'epochs': 160, 'loss': 'mse', 'optimizer': 'adam', 'graph_mode': 'off', 'use_snp_selection': False}. Best is trial 14 with value: 0.138775629550442.
[I 2025-12-05 16:14:29,348] Trial 68 finished with value: 0.10277800099502057 and parameters: {'model_type': 'mlp', 'hidden_dims': '[128, 64]', 'dropout': 0.2672049565264954, 'batch_norm': False, 'lr': 0.0008530392127964971, 'weight_decay': 4.134901331699595e-05, 'epochs': 120, 'loss': 'mse', 'optimizer': 'adam', 'graph_mode': 'off', 'use_snp_selection': True, 'num_snps': 50851}. Best is trial 14 with value: 0.138775629550442.
[I 2025-12-05 16:14:30,467] Trial 69 finished with value: 0.1078164282343653 and parameters: {'model_type': 'mlp', 'hidden_dims': '[512, 256]', 'dropout': 0.20010769467172082, 'batch_norm': True, 'lr': 6.239279603051033e-05, 'weight_decay': 2.7736969734449287e-07, 'epochs': 58, 'loss': 'mse', 'optimizer': 'adam', 'graph_mode': 'off', 'use_snp_selection': False}. Best is trial 14 with value: 0.138775629550442.
[I 2025-12-05 16:14:31,668] Trial 70 finished with value: 0.11038954116234499 and parameters: {'model_type': 'mlp', 'hidden_dims': '[512, 128]', 'dropout': 0.15223419569855767, 'batch_norm': True, 'lr': 0.00013337956031942398, 'weight_decay': 1.2994073573551415e-06, 'epochs': 98, 'loss': 'mae', 'optimizer': 'adam', 'graph_mode': 'off', 'use_snp_selection': False}. Best is trial 14 with value: 0.138775629550442.
[I 2025-12-05 16:14:33,032] Trial 71 finished with value: 0.13166401122398536 and parameters: {'model_type': 'mlp', 'hidden_dims': '[512, 64]', 'dropout': 0.1842024753035734, 'batch_norm': True, 'lr': 0.0007668889305706804, 'weight_decay': 7.48994158044073e-06, 'epochs': 136, 'loss': 'mse', 'optimizer': 'adam', 'graph_mode': 'off', 'use_snp_selection': False}. Best is trial 14 with value: 0.138775629550442.
[I 2025-12-05 16:14:34,496] Trial 72 finished with value: 0.13226442330320742 and parameters: {'model_type': 'mlp', 'hidden_dims': '[512, 64]', 'dropout': 0.18325920154128866, 'batch_norm': True, 'lr': 0.0005148754199838535, 'weight_decay': 6.0791814742845435e-06, 'epochs': 146, 'loss': 'mse', 'optimizer': 'adam', 'graph_mode': 'off', 'use_snp_selection': False}. Best is trial 14 with value: 0.138775629550442.
[I 2025-12-05 16:14:35,659] Trial 73 finished with value: 0.12382717029495802 and parameters: {'model_type': 'mlp', 'hidden_dims': '[512, 64]', 'dropout': 0.16809361698039935, 'batch_norm': True, 'lr': 0.0008268758120060771, 'weight_decay': 1.4804308733998826e-05, 'epochs': 82, 'loss': 'mse', 'optimizer': 'adam', 'graph_mode': 'off', 'use_snp_selection': False}. Best is trial 14 with value: 0.138775629550442.
[I 2025-12-05 16:14:37,007] Trial 74 finished with value: 0.12747277337550555 and parameters: {'model_type': 'mlp', 'hidden_dims': '[512, 64]', 'dropout': 0.21323558156165198, 'batch_norm': True, 'lr': 0.0006512208066906366, 'weight_decay': 4.334229842857328e-06, 'epochs': 124, 'loss': 'mse', 'optimizer': 'adam', 'graph_mode': 'off', 'use_snp_selection': False}. Best is trial 14 with value: 0.138775629550442.
[I 2025-12-05 16:14:38,397] Trial 75 finished with value: 0.1327829860517674 and parameters: {'model_type': 'mlp', 'hidden_dims': '[512, 64]', 'dropout': 0.193455111521578, 'batch_norm': True, 'lr': 0.0003888538205917681, 'weight_decay': 2.6498543627414986e-06, 'epochs': 141, 'loss': 'mse', 'optimizer': 'adam', 'graph_mode': 'off', 'use_snp_selection': False}. Best is trial 14 with value: 0.138775629550442.
[I 2025-12-05 16:14:40,454] Trial 76 finished with value: 0.13243883796396735 and parameters: {'model_type': 'mlp', 'hidden_dims': '[256, 128, 64]', 'dropout': 0.13022368956514233, 'batch_norm': True, 'lr': 0.00020337404595569626, 'weight_decay': 1.8052064503790758e-06, 'epochs': 167, 'loss': 'mse', 'optimizer': 'adam', 'graph_mode': 'off', 'use_snp_selection': True, 'num_snps': 39304}. Best is trial 14 with value: 0.138775629550442.
[I 2025-12-05 16:14:41,843] Trial 77 finished with value: 0.12379089934020009 and parameters: {'model_type': 'mlp', 'hidden_dims': '[256, 128]', 'dropout': 0.1423784806755431, 'batch_norm': True, 'lr': 0.0009860680064211497, 'weight_decay': 3.493968982181061e-07, 'epochs': 296, 'loss': 'mse', 'optimizer': 'adam', 'graph_mode': 'off', 'use_snp_selection': False}. Best is trial 14 with value: 0.138775629550442.
[I 2025-12-05 16:14:42,694] Trial 78 finished with value: 0.14171609052467532 and parameters: {'model_type': 'mlp', 'hidden_dims': '[128, 64]', 'dropout': 0.10177921056751711, 'batch_norm': True, 'lr': 0.0003072018198355781, 'weight_decay': 8.91986278404303e-07, 'epochs': 174, 'loss': 'mse', 'optimizer': 'adam', 'graph_mode': 'off', 'use_snp_selection': False}. Best is trial 78 with value: 0.14171609052467532.
[I 2025-12-05 16:14:43,622] Trial 79 finished with value: 0.08899595378353392 and parameters: {'model_type': 'mlp', 'hidden_dims': '[128, 64]', 'dropout': 0.10182175174053255, 'batch_norm': True, 'lr': 0.0002664456476898222, 'weight_decay': 9.33821328596851e-07, 'epochs': 175, 'loss': 'mse', 'optimizer': 'adam', 'graph_mode': 'off', 'use_snp_selection': True, 'num_snps': 3059}. Best is trial 78 with value: 0.14171609052467532.
[I 2025-12-05 16:14:44,499] Trial 80 finished with value: 0.12156828072216413 and parameters: {'model_type': 'mlp', 'hidden_dims': '[128, 64]', 'dropout': 0.12364371366396022, 'batch_norm': False, 'lr': 0.00032066514617041354, 'weight_decay': 2.509993953519008e-05, 'epochs': 198, 'loss': 'mse', 'optimizer': 'adam', 'graph_mode': 'off', 'use_snp_selection': False}. Best is trial 78 with value: 0.14171609052467532.
[I 2025-12-05 16:14:45,227] Trial 81 finished with value: 0.11313965302879127 and parameters: {'model_type': 'mlp', 'hidden_dims': '[128, 64]', 'dropout': 0.15631183988483138, 'batch_norm': True, 'lr': 0.00046203467099505255, 'weight_decay': 5.219725468376294e-07, 'epochs': 106, 'loss': 'mse', 'optimizer': 'adam', 'graph_mode': 'off', 'use_snp_selection': False}. Best is trial 78 with value: 0.14171609052467532.
[I 2025-12-05 16:14:46,083] Trial 82 finished with value: 0.13692325914390735 and parameters: {'model_type': 'mlp', 'hidden_dims': '[128, 64]', 'dropout': 0.11532991620232161, 'batch_norm': True, 'lr': 0.00023192588184496208, 'weight_decay': 2.4766662856210545e-07, 'epochs': 186, 'loss': 'mse', 'optimizer': 'adam', 'graph_mode': 'off', 'use_snp_selection': False}. Best is trial 78 with value: 0.14171609052467532.
[I 2025-12-05 16:14:46,971] Trial 83 finished with value: 0.1150876101793613 and parameters: {'model_type': 'mlp', 'hidden_dims': '[128, 64]', 'dropout': 0.11990656144725505, 'batch_norm': True, 'lr': 0.00022700257907810683, 'weight_decay': 2.39225534357831e-07, 'epochs': 190, 'loss': 'mse', 'optimizer': 'adam', 'graph_mode': 'off', 'use_snp_selection': False}. Best is trial 78 with value: 0.14171609052467532.
[I 2025-12-05 16:14:47,909] Trial 84 finished with value: 0.1286731046201002 and parameters: {'model_type': 'mlp', 'hidden_dims': '[128, 64]', 'dropout': 0.11129020241115047, 'batch_norm': True, 'lr': 0.00015899093844829254, 'weight_decay': 4.0747158806812593e-07, 'epochs': 229, 'loss': 'mse', 'optimizer': 'adam', 'graph_mode': 'off', 'use_snp_selection': False}. Best is trial 78 with value: 0.14171609052467532.
[I 2025-12-05 16:14:48,819] Trial 85 finished with value: 0.12346047565651731 and parameters: {'model_type': 'mlp', 'hidden_dims': '[128, 64]', 'dropout': 0.1450673440647856, 'batch_norm': True, 'lr': 0.0003554268198769644, 'weight_decay': 1.3840369238320598e-07, 'epochs': 213, 'loss': 'mse', 'optimizer': 'adam', 'graph_mode': 'off', 'use_snp_selection': False}. Best is trial 78 with value: 0.14171609052467532.
[I 2025-12-05 16:14:49,684] Trial 86 finished with value: 0.14123862771546097 and parameters: {'model_type': 'mlp', 'hidden_dims': '[128, 64]', 'dropout': 0.17102343694706806, 'batch_norm': True, 'lr': 0.00011461932592189544, 'weight_decay': 7.862886818779001e-07, 'epochs': 202, 'loss': 'mse', 'optimizer': 'adam', 'graph_mode': 'off', 'use_snp_selection': False}. Best is trial 78 with value: 0.14171609052467532.
[I 2025-12-05 16:14:50,657] Trial 87 finished with value: 0.12267900892477833 and parameters: {'model_type': 'mlp', 'hidden_dims': '[128, 64]', 'dropout': 0.10151114512004611, 'batch_norm': True, 'lr': 0.0001788504090689036, 'weight_decay': 7.814879518403579e-07, 'epochs': 262, 'loss': 'mse', 'optimizer': 'adam', 'graph_mode': 'off', 'use_snp_selection': False}. Best is trial 78 with value: 0.14171609052467532.
[I 2025-12-05 16:14:53,314] Trial 88 finished with value: 0.12862597182999805 and parameters: {'model_type': 'mlp', 'hidden_dims': '[128, 64]', 'dropout': 0.13276413326481035, 'batch_norm': True, 'lr': 0.00011790954362330857, 'weight_decay': 1.8412234010459687e-07, 'epochs': 176, 'loss': 'mse', 'optimizer': 'adam', 'graph_mode': 'off', 'use_snp_selection': True, 'num_snps': 59864}. Best is trial 78 with value: 0.14171609052467532.
[I 2025-12-05 16:14:54,273] Trial 89 finished with value: 0.07876569385445359 and parameters: {'model_type': 'mlp', 'hidden_dims': '[128, 64]', 'dropout': 0.45889900964263414, 'batch_norm': True, 'lr': 8.618936719702085e-05, 'weight_decay': 1.1623324983381042e-06, 'epochs': 202, 'loss': 'mae', 'optimizer': 'adam', 'graph_mode': 'off', 'use_snp_selection': False}. Best is trial 78 with value: 0.14171609052467532.
[I 2025-12-05 16:14:55,229] Trial 90 finished with value: 0.12127464949950771 and parameters: {'model_type': 'mlp', 'hidden_dims': '[128, 64]', 'dropout': 0.16470588950764203, 'batch_norm': True, 'lr': 0.00010813218935311306, 'weight_decay': 5.614283839674261e-07, 'epochs': 245, 'loss': 'mse', 'optimizer': 'adam', 'graph_mode': 'off', 'use_snp_selection': False}. Best is trial 78 with value: 0.14171609052467532.
[I 2025-12-05 16:14:56,737] Trial 91 finished with value: 0.1290552148559203 and parameters: {'model_type': 'mlp', 'hidden_dims': '[512, 256]', 'dropout': 0.13698591155734285, 'batch_norm': True, 'lr': 0.0001351209277215048, 'weight_decay': 3.510366166520088e-07, 'epochs': 160, 'loss': 'mse', 'optimizer': 'adam', 'graph_mode': 'off', 'use_snp_selection': False}. Best is trial 78 with value: 0.14171609052467532.
[I 2025-12-05 16:14:57,576] Trial 92 finished with value: 0.0857885161185759 and parameters: {'model_type': 'mlp', 'hidden_dims': '[128, 64]', 'dropout': 0.17333476944946155, 'batch_norm': True, 'lr': 2.7573990808446097e-05, 'weight_decay': 6.194279248915023e-07, 'epochs': 184, 'loss': 'mse', 'optimizer': 'adam', 'graph_mode': 'off', 'use_snp_selection': False}. Best is trial 78 with value: 0.14171609052467532.
[I 2025-12-05 16:14:58,696] Trial 93 finished with value: 0.11728355199510568 and parameters: {'model_type': 'mlp', 'hidden_dims': '[256, 128, 64]', 'dropout': 0.11217181617609645, 'batch_norm': True, 'lr': 0.00021274493539932528, 'weight_decay': 2.5046720981834884e-07, 'epochs': 190, 'loss': 'mse', 'optimizer': 'adam', 'graph_mode': 'off', 'use_snp_selection': False}. Best is trial 78 with value: 0.14171609052467532.
[I 2025-12-05 16:14:59,467] Trial 94 finished with value: 0.1018341827395018 and parameters: {'model_type': 'mlp', 'hidden_dims': '[128, 64]', 'dropout': 0.1556929919956863, 'batch_norm': True, 'lr': 4.098845693365635e-05, 'weight_decay': 8.621120917973512e-07, 'epochs': 127, 'loss': 'mse', 'optimizer': 'adam', 'graph_mode': 'off', 'use_snp_selection': False}. Best is trial 78 with value: 0.14171609052467532.
[I 2025-12-05 16:15:00,383] Trial 95 finished with value: 0.11338364567847432 and parameters: {'model_type': 'mlp', 'hidden_dims': '[256, 128]', 'dropout': 0.30328861804156937, 'batch_norm': True, 'lr': 0.00028097772448490454, 'weight_decay': 3.167465208447892e-07, 'epochs': 117, 'loss': 'mse', 'optimizer': 'adam', 'graph_mode': 'off', 'use_snp_selection': False}. Best is trial 78 with value: 0.14171609052467532.
[I 2025-12-05 16:15:02,184] Trial 96 finished with value: 0.12386542309873633 and parameters: {'model_type': 'mlp', 'hidden_dims': '[512, 256]', 'dropout': 0.23300821521525786, 'batch_norm': True, 'lr': 0.00017024702228929687, 'weight_decay': 1.5194219524268466e-06, 'epochs': 227, 'loss': 'mse', 'optimizer': 'adam', 'graph_mode': 'off', 'use_snp_selection': False}. Best is trial 78 with value: 0.14171609052467532.
[I 2025-12-05 16:15:03,039] Trial 97 finished with value: 0.09103007071741594 and parameters: {'model_type': 'mlp', 'hidden_dims': '[128, 64]', 'dropout': 0.2017166437374961, 'batch_norm': False, 'lr': 5.4757094508780994e-05, 'weight_decay': 4.5423648547460117e-07, 'epochs': 215, 'loss': 'mse', 'optimizer': 'adam', 'graph_mode': 'off', 'use_snp_selection': False}. Best is trial 78 with value: 0.14171609052467532.
[I 2025-12-05 16:15:04,169] Trial 98 finished with value: 0.11959647156728126 and parameters: {'model_type': 'mlp', 'hidden_dims': '[128, 64]', 'dropout': 0.3579214461962221, 'batch_norm': True, 'lr': 0.00025096750554152655, 'weight_decay': 7.181743142736108e-07, 'epochs': 152, 'loss': 'mse', 'optimizer': 'adam', 'graph_mode': 'off', 'use_snp_selection': True, 'num_snps': 12938}. Best is trial 78 with value: 0.14171609052467532.
[I 2025-12-05 16:15:06,089] Trial 99 finished with value: 0.12999580530039118 and parameters: {'model_type': 'mlp', 'hidden_dims': '[512, 128]', 'dropout': 0.1753081796593638, 'batch_norm': True, 'lr': 0.0005600394669262598, 'weight_decay': 2.2194567693345495e-06, 'epochs': 237, 'loss': 'mse', 'optimizer': 'adam', 'graph_mode': 'off', 'use_snp_selection': False}. Best is trial 78 with value: 0.14171609052467532.
[I 2025-12-05 16:15:07,149] Trial 100 finished with value: 0.14338910092999496 and parameters: {'model_type': 'mlp', 'hidden_dims': '[256, 128, 64]', 'dropout': 0.21210202583641194, 'batch_norm': True, 'lr': 7.206502500894065e-05, 'weight_decay': 1.6140661190339031e-07, 'epochs': 170, 'loss': 'mse', 'optimizer': 'adam', 'graph_mode': 'off', 'use_snp_selection': False}. Best is trial 100 with value: 0.14338910092999496.
[I 2025-12-05 16:15:08,277] Trial 101 finished with value: 0.11954152323037325 and parameters: {'model_type': 'mlp', 'hidden_dims': '[256, 128, 64]', 'dropout': 0.2141909499973121, 'batch_norm': True, 'lr': 6.926333391941557e-05, 'weight_decay': 1.24728704446096e-07, 'epochs': 196, 'loss': 'mse', 'optimizer': 'adam', 'graph_mode': 'off', 'use_snp_selection': False}. Best is trial 100 with value: 0.14338910092999496.
[I 2025-12-05 16:15:09,321] Trial 102 finished with value: 0.12213714155796576 and parameters: {'model_type': 'mlp', 'hidden_dims': '[256, 128, 64]', 'dropout': 0.14217998174678145, 'batch_norm': True, 'lr': 7.590075095032234e-05, 'weight_decay': 1.603863500700677e-07, 'epochs': 176, 'loss': 'mse', 'optimizer': 'adam', 'graph_mode': 'off', 'use_snp_selection': False}. Best is trial 100 with value: 0.14338910092999496.
[I 2025-12-05 16:15:10,342] Trial 103 finished with value: 0.10256792312502812 and parameters: {'model_type': 'mlp', 'hidden_dims': '[256, 128, 64]', 'dropout': 0.18405671763427336, 'batch_norm': True, 'lr': 0.00011651095867263579, 'weight_decay': 4.1242643098088095e-07, 'epochs': 167, 'loss': 'mse', 'optimizer': 'adam', 'graph_mode': 'off', 'use_snp_selection': False}. Best is trial 100 with value: 0.14338910092999496.
[I 2025-12-05 16:15:11,388] Trial 104 finished with value: 0.10349248097513791 and parameters: {'model_type': 'mlp', 'hidden_dims': '[256, 128, 64]', 'dropout': 0.379747630160047, 'batch_norm': True, 'lr': 9.795074288772368e-05, 'weight_decay': 2.0788778687601956e-07, 'epochs': 159, 'loss': 'mse', 'optimizer': 'adam', 'graph_mode': 'off', 'use_snp_selection': False}. Best is trial 100 with value: 0.14338910092999496.
[I 2025-12-05 16:15:12,351] Trial 105 finished with value: 0.13020936103667002 and parameters: {'model_type': 'mlp', 'hidden_dims': '[256, 128]', 'dropout': 0.1191352751153265, 'batch_norm': True, 'lr': 0.00014658820187830144, 'weight_decay': 2.537528410395696e-07, 'epochs': 135, 'loss': 'mse', 'optimizer': 'adam', 'graph_mode': 'off', 'use_snp_selection': False}. Best is trial 100 with value: 0.14338910092999496.
[I 2025-12-05 16:15:14,085] Trial 106 finished with value: 0.12949133462598944 and parameters: {'model_type': 'mlp', 'hidden_dims': '[512, 256]', 'dropout': 0.16390635112621285, 'batch_norm': True, 'lr': 0.00019677496634695448, 'weight_decay': 1.0162463407208853e-07, 'epochs': 210, 'loss': 'mae', 'optimizer': 'adam', 'graph_mode': 'off', 'use_snp_selection': False}. Best is trial 100 with value: 0.14338910092999496.
[I 2025-12-05 16:15:15,119] Trial 107 finished with value: 0.10916341061232361 and parameters: {'model_type': 'mlp', 'hidden_dims': '[256, 128, 64]', 'dropout': 0.15039969029444994, 'batch_norm': True, 'lr': 5.4104888916435905e-05, 'weight_decay': 1.1085470521648594e-06, 'epochs': 171, 'loss': 'mse', 'optimizer': 'adam', 'graph_mode': 'off', 'use_snp_selection': False}. Best is trial 100 with value: 0.14338910092999496.
[I 2025-12-05 16:15:17,376] Trial 108 finished with value: 0.138615744366651 and parameters: {'model_type': 'mlp', 'hidden_dims': '[128, 64]', 'dropout': 0.24320886847355438, 'batch_norm': True, 'lr': 0.00033468806122572163, 'weight_decay': 1.8922636546626054e-07, 'epochs': 104, 'loss': 'mse', 'optimizer': 'adam', 'graph_mode': 'off', 'use_snp_selection': True, 'num_snps': 52945}. Best is trial 100 with value: 0.14338910092999496.
[I 2025-12-05 16:15:19,746] Trial 109 finished with value: 0.12229071947388544 and parameters: {'model_type': 'mlp', 'hidden_dims': '[128, 64]', 'dropout': 0.2746946641805412, 'batch_norm': True, 'lr': 0.00040777097239699805, 'weight_decay': 2.0343236284133835e-07, 'epochs': 77, 'loss': 'mse', 'optimizer': 'adam', 'graph_mode': 'off', 'use_snp_selection': True, 'num_snps': 52895}. Best is trial 100 with value: 0.14338910092999496.
[I 2025-12-05 16:15:22,018] Trial 110 finished with value: 0.11271731388287104 and parameters: {'model_type': 'mlp', 'hidden_dims': '[128, 64]', 'dropout': 0.23567888031078504, 'batch_norm': True, 'lr': 0.000330868595353282, 'weight_decay': 1.7744601215840104e-07, 'epochs': 87, 'loss': 'mse', 'optimizer': 'adam', 'graph_mode': 'off', 'use_snp_selection': True, 'num_snps': 53993}. Best is trial 100 with value: 0.14338910092999496.
[I 2025-12-05 16:15:23,936] Trial 111 finished with value: 0.10964641026782858 and parameters: {'model_type': 'mlp', 'hidden_dims': '[128, 64]', 'dropout': 0.24378475761003668, 'batch_norm': True, 'lr': 0.0002428351054189421, 'weight_decay': 3.1449959632535746e-07, 'epochs': 105, 'loss': 'mse', 'optimizer': 'adam', 'graph_mode': 'off', 'use_snp_selection': True, 'num_snps': 41470}. Best is trial 100 with value: 0.14338910092999496.
[I 2025-12-05 16:15:26,194] Trial 112 finished with value: 0.10699264236098052 and parameters: {'model_type': 'mlp', 'hidden_dims': '[128, 64]', 'dropout': 0.20673178150640037, 'batch_norm': True, 'lr': 6.677122490806312e-05, 'weight_decay': 1.267444764599178e-07, 'epochs': 95, 'loss': 'mse', 'optimizer': 'adam', 'graph_mode': 'off', 'use_snp_selection': True, 'num_snps': 48612}. Best is trial 100 with value: 0.14338910092999496.
[I 2025-12-05 16:15:28,017] Trial 113 finished with value: 0.13466664216688187 and parameters: {'model_type': 'mlp', 'hidden_dims': '[128, 64]', 'dropout': 0.1927231102527827, 'batch_norm': True, 'lr': 8.504415354277513e-05, 'weight_decay': 5.488005647531926e-07, 'epochs': 188, 'loss': 'mse', 'optimizer': 'adam', 'graph_mode': 'off', 'use_snp_selection': True, 'num_snps': 33781}. Best is trial 100 with value: 0.14338910092999496.
[I 2025-12-05 16:15:28,911] Trial 114 finished with value: 0.022118517801239128 and parameters: {'model_type': 'mlp', 'hidden_dims': '[256, 128]', 'dropout': 0.22387091284008376, 'batch_norm': True, 'lr': 1.0751474883217484e-06, 'weight_decay': 1.5884188360074145e-07, 'epochs': 112, 'loss': 'mse', 'optimizer': 'adam', 'graph_mode': 'off', 'use_snp_selection': False}. Best is trial 100 with value: 0.14338910092999496.
[I 2025-12-05 16:15:29,678] Trial 115 finished with value: 0.12929939255847386 and parameters: {'model_type': 'mlp', 'hidden_dims': '[128, 64]', 'dropout': 0.3254132093377485, 'batch_norm': True, 'lr': 0.0006916024003747374, 'weight_decay': 6.825122633081538e-07, 'epochs': 118, 'loss': 'mse', 'optimizer': 'adam', 'graph_mode': 'off', 'use_snp_selection': False}. Best is trial 100 with value: 0.14338910092999496.
[I 2025-12-05 16:15:32,577] Trial 116 finished with value: 0.09496317782554384 and parameters: {'model_type': 'mlp', 'hidden_dims': '[512, 64]', 'dropout': 0.12642356531371862, 'batch_norm': False, 'lr': 0.00029157112009720135, 'weight_decay': 3.7913571431872056e-07, 'epochs': 130, 'loss': 'mse', 'optimizer': 'adam', 'graph_mode': 'off', 'use_snp_selection': True, 'num_snps': 55494}. Best is trial 100 with value: 0.14338910092999496.
