[I 2025-12-05 15:07:15,407] Trial 95 finished with value: 0.0240581756290729 and parameters: {'model_type': 'mlp', 'hidden_dims': '[256, 128]', 'dropout': 0.5575412643810131, 'batch_norm': False, 'lr': 1.1954535583396946e-05, 'weight_decay': 1.9399968473804745e-07, 'epochs': 348, 'loss': 'mse', 'optimizer': 'adam', 'graph_mode': 'off', 'use_snp_selection': False}. Best is trial 0 with value: 0.060712734896453596.
[I 2025-12-05 15:07:16,196] Trial 96 finished with value: 0.020160054168449713 and parameters: {'model_type': 'mlp', 'hidden_dims': '[128, 64]', 'dropout': 0.19413843145044413, 'batch_norm': False, 'lr': 2.6571580425096373e-05, 'weight_decay': 1.1927529818664504e-07, 'epochs': 191, 'loss': 'mse', 'optimizer': 'adam', 'graph_mode': 'off', 'use_snp_selection': False}. Best is trial 0 with value: 0.060712734896453596.
[I 2025-12-05 15:07:17,572] Trial 97 finished with value: 0.0066716901741127235 and parameters: {'model_type': 'mlp', 'hidden_dims': '[512, 64]', 'dropout': 0.48581447554547796, 'batch_norm': False, 'lr': 1.717218146063811e-05, 'weight_decay': 3.260577406786929e-07, 'epochs': 181, 'loss': 'mae', 'optimizer': 'adam', 'graph_mode': 'off', 'use_snp_selection': False}. Best is trial 0 with value: 0.060712734896453596.
[I 2025-12-05 15:07:18,729] Trial 98 finished with value: 0.01876506838330972 and parameters: {'model_type': 'mlp', 'hidden_dims': '[256, 128]', 'dropout': 0.16278859595647555, 'batch_norm': True, 'lr': 4.138647440360708e-05, 'weight_decay': 4.053050000538917e-07, 'epochs': 322, 'loss': 'mse', 'optimizer': 'adam', 'graph_mode': 'off', 'use_snp_selection': True, 'num_snps': 8016}. Best is trial 0 with value: 0.060712734896453596.
[I 2025-12-05 15:07:20,000] Trial 99 finished with value: 0.0381280307800108 and parameters: {'model_type': 'mlp', 'hidden_dims': '[256, 128, 64]', 'dropout': 0.23179537712329318, 'batch_norm': False, 'lr': 2.95660842258465e-06, 'weight_decay': 4.776691152115007e-07, 'epochs': 335, 'loss': 'mae', 'optimizer': 'adam', 'graph_mode': 'off', 'use_snp_selection': False}. Best is trial 0 with value: 0.060712734896453596.
[I 2025-12-05 15:07:21,338] Trial 100 finished with value: 0.006055392808787427 and parameters: {'model_type': 'mlp', 'hidden_dims': '[128, 64]', 'dropout': 0.5120324064115794, 'batch_norm': False, 'lr': 0.0004989339289243572, 'weight_decay': 2.7792722675761655e-07, 'epochs': 167, 'loss': 'mse', 'optimizer': 'adam', 'graph_mode': 'off', 'use_snp_selection': True, 'num_snps': 23047}. Best is trial 0 with value: 0.060712734896453596.
[I 2025-12-05 15:07:22,602] Trial 101 finished with value: 0.03802197260108808 and parameters: {'model_type': 'mlp', 'hidden_dims': '[256, 128]', 'dropout': 0.53618316326894, 'batch_norm': False, 'lr': 2.2138956211879212e-05, 'weight_decay': 7.970502264405054e-06, 'epochs': 341, 'loss': 'mse', 'optimizer': 'adam', 'graph_mode': 'off', 'use_snp_selection': False}. Best is trial 0 with value: 0.060712734896453596.
[I 2025-12-05 15:07:23,786] Trial 102 finished with value: 0.028174180104828292 and parameters: {'model_type': 'mlp', 'hidden_dims': '[256, 128]', 'dropout': 0.2078267491901551, 'batch_norm': False, 'lr': 1.4333046315397575e-05, 'weight_decay': 8.52221891838876e-07, 'epochs': 299, 'loss': 'mse', 'optimizer': 'adam', 'graph_mode': 'off', 'use_snp_selection': False}. Best is trial 0 with value: 0.060712734896453596.
[I 2025-12-05 15:07:24,974] Trial 103 finished with value: 0.007882326424571389 and parameters: {'model_type': 'mlp', 'hidden_dims': '[256, 128]', 'dropout': 0.4748083391088168, 'batch_norm': False, 'lr': 6.812934265384217e-06, 'weight_decay': 6.523647119127393e-07, 'epochs': 307, 'loss': 'mse', 'optimizer': 'adam', 'graph_mode': 'off', 'use_snp_selection': False}. Best is trial 0 with value: 0.060712734896453596.
[I 2025-12-05 15:07:25,907] Trial 104 finished with value: 0.003188677524670203 and parameters: {'model_type': 'mlp', 'hidden_dims': '[256, 128]', 'dropout': 0.4394251595045528, 'batch_norm': False, 'lr': 0.00019793553363484835, 'weight_decay': 2.9100748257287333e-06, 'epochs': 156, 'loss': 'mse', 'optimizer': 'adam', 'graph_mode': 'off', 'use_snp_selection': False}. Best is trial 0 with value: 0.060712734896453596.
[I 2025-12-05 15:07:27,180] Trial 105 finished with value: 0.009075310295672141 and parameters: {'model_type': 'mlp', 'hidden_dims': '[256, 128]', 'dropout': 0.24816181798246675, 'batch_norm': True, 'lr': 6.68147148184537e-05, 'weight_decay': 1.755337636222258e-07, 'epochs': 323, 'loss': 'mse', 'optimizer': 'adam', 'graph_mode': 'off', 'use_snp_selection': False}. Best is trial 0 with value: 0.060712734896453596.
[I 2025-12-05 15:07:29,562] Trial 106 finished with value: 0.04257435112450236 and parameters: {'model_type': 'mlp', 'hidden_dims': '[128, 64]', 'dropout': 0.5028848671416979, 'batch_norm': False, 'lr': 2.950212484352127e-05, 'weight_decay': 1.4157214166485107e-06, 'epochs': 315, 'loss': 'mae', 'optimizer': 'adam', 'graph_mode': 'off', 'use_snp_selection': True, 'num_snps': 52012}. Best is trial 0 with value: 0.060712734896453596.
[I 2025-12-05 15:07:30,905] Trial 107 finished with value: 0.004957103567558503 and parameters: {'model_type': 'mlp', 'hidden_dims': '[256, 128]', 'dropout': 0.5758050670280164, 'batch_norm': True, 'lr': 4.43539781727815e-05, 'weight_decay': 1.105199034168304e-06, 'epochs': 334, 'loss': 'mse', 'optimizer': 'adam', 'graph_mode': 'off', 'use_snp_selection': False}. Best is trial 0 with value: 0.060712734896453596.
[I 2025-12-05 15:07:32,589] Trial 108 finished with value: 0.017939727846862038 and parameters: {'model_type': 'mlp', 'hidden_dims': '[256, 128, 64]', 'dropout': 0.18023707094018457, 'batch_norm': False, 'lr': 2.4736147922956827e-05, 'weight_decay': 0.0002209467267821138, 'epochs': 203, 'loss': 'mse', 'optimizer': 'adam', 'graph_mode': 'off', 'use_snp_selection': True, 'num_snps': 31502}. Best is trial 0 with value: 0.060712734896453596.
[I 2025-12-05 15:07:33,626] Trial 109 finished with value: -0.0003876238691717544 and parameters: {'model_type': 'mlp', 'hidden_dims': '[256, 128]', 'dropout': 0.510573544515069, 'batch_norm': True, 'lr': 1.1867792730745386e-05, 'weight_decay': 4.824498977344521e-06, 'epochs': 214, 'loss': 'mae', 'optimizer': 'adam', 'graph_mode': 'off', 'use_snp_selection': False}. Best is trial 0 with value: 0.060712734896453596.
[I 2025-12-05 15:07:35,574] Trial 110 finished with value: 0.022932618565799805 and parameters: {'model_type': 'mlp', 'hidden_dims': '[512, 128]', 'dropout': 0.5476116907046957, 'batch_norm': False, 'lr': 9.349340666769916e-06, 'weight_decay': 2.776833889395927e-07, 'epochs': 347, 'loss': 'mse', 'optimizer': 'adam', 'graph_mode': 'off', 'use_snp_selection': False}. Best is trial 0 with value: 0.060712734896453596.
[I 2025-12-05 15:07:36,331] Trial 111 finished with value: 0.030682427735951107 and parameters: {'model_type': 'mlp', 'hidden_dims': '[128, 64]', 'dropout': 0.3124459292539258, 'batch_norm': False, 'lr': 0.00018499395026316676, 'weight_decay': 0.0001251138757828673, 'epochs': 92, 'loss': 'mae', 'optimizer': 'adam', 'graph_mode': 'off', 'use_snp_selection': True, 'num_snps': 7137}. Best is trial 0 with value: 0.060712734896453596.
[I 2025-12-05 15:07:37,321] Trial 112 finished with value: 0.034129190676479876 and parameters: {'model_type': 'mlp', 'hidden_dims': '[128, 64]', 'dropout': 0.2724622106790653, 'batch_norm': False, 'lr': 0.00024814741797430094, 'weight_decay': 0.00014647107521940068, 'epochs': 182, 'loss': 'mae', 'optimizer': 'adam', 'graph_mode': 'off', 'use_snp_selection': True, 'num_snps': 11427}. Best is trial 0 with value: 0.060712734896453596.
[I 2025-12-05 15:07:38,147] Trial 113 finished with value: 0.05637945761492101 and parameters: {'model_type': 'mlp', 'hidden_dims': '[128, 64]', 'dropout': 0.2952200808247105, 'batch_norm': False, 'lr': 0.00013178620144910954, 'weight_decay': 6.126121724813892e-05, 'epochs': 71, 'loss': 'mae', 'optimizer': 'adam', 'graph_mode': 'off', 'use_snp_selection': True, 'num_snps': 8422}. Best is trial 0 with value: 0.060712734896453596.
[I 2025-12-05 15:07:40,501] Trial 114 finished with value: 0.013267853025630764 and parameters: {'model_type': 'mlp', 'hidden_dims': '[128, 64]', 'dropout': 0.2889058201824894, 'batch_norm': False, 'lr': 0.00012915624681149622, 'weight_decay': 8.503811549629881e-05, 'epochs': 70, 'loss': 'mae', 'optimizer': 'adam', 'graph_mode': 'off', 'use_snp_selection': True, 'num_snps': 59886}. Best is trial 0 with value: 0.060712734896453596.
[I 2025-12-05 15:07:41,511] Trial 115 finished with value: 0.04384195913893557 and parameters: {'model_type': 'mlp', 'hidden_dims': '[128, 64]', 'dropout': 0.3408189080428087, 'batch_norm': False, 'lr': 8.94053535119468e-05, 'weight_decay': 5.9860749859567356e-05, 'epochs': 103, 'loss': 'mae', 'optimizer': 'adam', 'graph_mode': 'off', 'use_snp_selection': True, 'num_snps': 13603}. Best is trial 0 with value: 0.060712734896453596.
[I 2025-12-05 15:07:42,291] Trial 116 finished with value: 0.0026800707556554875 and parameters: {'model_type': 'mlp', 'hidden_dims': '[128, 64]', 'dropout': 0.32639652368844774, 'batch_norm': True, 'lr': 5.430541491490905e-05, 'weight_decay': 4.125510002060272e-05, 'epochs': 119, 'loss': 'mae', 'optimizer': 'adam', 'graph_mode': 'off', 'use_snp_selection': True, 'num_snps': 4490}. Best is trial 0 with value: 0.060712734896453596.
[I 2025-12-05 15:07:43,028] Trial 117 finished with value: 0.03432775909815852 and parameters: {'model_type': 'mlp', 'hidden_dims': '[512, 256]', 'dropout': 0.489621263459492, 'batch_norm': False, 'lr': 7.262321631449945e-05, 'weight_decay': 0.0003408013811437627, 'epochs': 192, 'loss': 'mae', 'optimizer': 'adam', 'graph_mode': 'off', 'use_snp_selection': True, 'num_snps': 2006}. Best is trial 0 with value: 0.060712734896453596.
[I 2025-12-05 15:07:44,214] Trial 118 finished with value: 0.015798309474992486 and parameters: {'model_type': 'mlp', 'hidden_dims': '[256, 128]', 'dropout': 0.3822546128429946, 'batch_norm': False, 'lr': 0.0001591406945250355, 'weight_decay': 1.823502719117045e-06, 'epochs': 293, 'loss': 'mse', 'optimizer': 'adam', 'graph_mode': 'off', 'use_snp_selection': False}. Best is trial 0 with value: 0.060712734896453596.
[I 2025-12-05 15:07:45,605] Trial 119 finished with value: 0.02544465279819624 and parameters: {'model_type': 'mlp', 'hidden_dims': '[128, 64]', 'dropout': 0.453928178281465, 'batch_norm': True, 'lr': 1.5624973120295727e-05, 'weight_decay': 3.31998765915835e-05, 'epochs': 230, 'loss': 'mae', 'optimizer': 'adam', 'graph_mode': 'off', 'use_snp_selection': True, 'num_snps': 18694}. Best is trial 0 with value: 0.060712734896453596.
[I 2025-12-05 15:07:46,560] Trial 120 finished with value: 0.02203146434373243 and parameters: {'model_type': 'mlp', 'hidden_dims': '[256, 128, 64]', 'dropout': 0.4114195346738271, 'batch_norm': False, 'lr': 2.0366431815614107e-05, 'weight_decay': 4.0876957672962644e-06, 'epochs': 172, 'loss': 'mse', 'optimizer': 'adam', 'graph_mode': 'off', 'use_snp_selection': False}. Best is trial 0 with value: 0.060712734896453596.
[I 2025-12-05 15:07:47,575] Trial 121 finished with value: 0.044721174228281375 and parameters: {'model_type': 'mlp', 'hidden_dims': '[128, 64]', 'dropout': 0.29986724766730816, 'batch_norm': False, 'lr': 0.00010863855886817387, 'weight_decay': 2.319852369945855e-05, 'epochs': 101, 'loss': 'mae', 'optimizer': 'adam', 'graph_mode': 'off', 'use_snp_selection': True, 'num_snps': 15254}. Best is trial 0 with value: 0.060712734896453596.
[I 2025-12-05 15:07:48,480] Trial 122 finished with value: 0.04085112056219923 and parameters: {'model_type': 'mlp', 'hidden_dims': '[128, 64]', 'dropout': 0.25957178118857793, 'batch_norm': False, 'lr': 0.00011665527578476057, 'weight_decay': 2.2863803666304554e-05, 'epochs': 97, 'loss': 'mae', 'optimizer': 'adam', 'graph_mode': 'off', 'use_snp_selection': True, 'num_snps': 10507}. Best is trial 0 with value: 0.060712734896453596.
[I 2025-12-05 15:07:49,636] Trial 123 finished with value: 0.03034715078163503 and parameters: {'model_type': 'mlp', 'hidden_dims': '[128, 64]', 'dropout': 0.3543408469360196, 'batch_norm': False, 'lr': 8.511776064669264e-05, 'weight_decay': 6.286469055727335e-05, 'epochs': 60, 'loss': 'mae', 'optimizer': 'adam', 'graph_mode': 'off', 'use_snp_selection': True, 'num_snps': 21518}. Best is trial 0 with value: 0.060712734896453596.
[I 2025-12-05 15:07:50,629] Trial 124 finished with value: 0.08547736083653104 and parameters: {'model_type': 'mlp', 'hidden_dims': '[128, 64]', 'dropout': 0.28229768452696036, 'batch_norm': False, 'lr': 0.00029703046923083696, 'weight_decay': 1.6805665725871794e-05, 'epochs': 69, 'loss': 'mae', 'optimizer': 'adam', 'graph_mode': 'off', 'use_snp_selection': True, 'num_snps': 15728}. Best is trial 124 with value: 0.08547736083653104.
[I 2025-12-05 15:07:51,682] Trial 125 finished with value: 0.05989859338768819 and parameters: {'model_type': 'mlp', 'hidden_dims': '[128, 64]', 'dropout': 0.30358320368112535, 'batch_norm': False, 'lr': 0.0003407353538641631, 'weight_decay': 4.963846632147981e-05, 'epochs': 80, 'loss': 'mae', 'optimizer': 'adam', 'graph_mode': 'off', 'use_snp_selection': True, 'num_snps': 16382}. Best is trial 124 with value: 0.08547736083653104.
[I 2025-12-05 15:07:52,715] Trial 126 finished with value: 0.05581754126914581 and parameters: {'model_type': 'mlp', 'hidden_dims': '[128, 64]', 'dropout': 0.2651328157213164, 'batch_norm': False, 'lr': 0.000609528936968802, 'weight_decay': 4.6777258387521255e-05, 'epochs': 78, 'loss': 'mae', 'optimizer': 'adam', 'graph_mode': 'off', 'use_snp_selection': True, 'num_snps': 16911}. Best is trial 124 with value: 0.08547736083653104.
[I 2025-12-05 15:07:53,803] Trial 127 finished with value: 0.012010840499727324 and parameters: {'model_type': 'mlp', 'hidden_dims': '[128, 64]', 'dropout': 0.2816653835031402, 'batch_norm': False, 'lr': 0.0005636405335970386, 'weight_decay': 1.8045477202762478e-05, 'epochs': 73, 'loss': 'mae', 'optimizer': 'adam', 'graph_mode': 'off', 'use_snp_selection': True, 'num_snps': 16500}. Best is trial 124 with value: 0.08547736083653104.
[I 2025-12-05 15:07:54,751] Trial 128 finished with value: 0.03718097116256058 and parameters: {'model_type': 'mlp', 'hidden_dims': '[128, 64]', 'dropout': 0.297371942233849, 'batch_norm': True, 'lr': 0.0003085221672533512, 'weight_decay': 4.747805862726607e-05, 'epochs': 79, 'loss': 'mae', 'optimizer': 'adam', 'graph_mode': 'off', 'use_snp_selection': True, 'num_snps': 12733}. Best is trial 124 with value: 0.08547736083653104.
[I 2025-12-05 15:07:55,790] Trial 129 finished with value: 0.04436055738388542 and parameters: {'model_type': 'mlp', 'hidden_dims': '[128, 64]', 'dropout': 0.2374955250157032, 'batch_norm': False, 'lr': 0.0009922861699803564, 'weight_decay': 7.220183760170076e-05, 'epochs': 70, 'loss': 'mae', 'optimizer': 'adam', 'graph_mode': 'off', 'use_snp_selection': True, 'num_snps': 17324}. Best is trial 124 with value: 0.08547736083653104.
[I 2025-12-05 15:07:56,986] Trial 130 finished with value: 0.052549482966997456 and parameters: {'model_type': 'mlp', 'hidden_dims': '[128, 64]', 'dropout': 0.28000392206761343, 'batch_norm': True, 'lr': 0.000438969342941053, 'weight_decay': 4.7806138941227694e-05, 'epochs': 82, 'loss': 'mae', 'optimizer': 'adam', 'graph_mode': 'off', 'use_snp_selection': True, 'num_snps': 20308}. Best is trial 124 with value: 0.08547736083653104.
[I 2025-12-05 15:07:58,096] Trial 131 finished with value: 0.031612684374703354 and parameters: {'model_type': 'mlp', 'hidden_dims': '[128, 64]', 'dropout': 0.25227053358171175, 'batch_norm': True, 'lr': 0.0007392207505538249, 'weight_decay': 7.706234860313391e-05, 'epochs': 58, 'loss': 'mae', 'optimizer': 'adam', 'graph_mode': 'off', 'use_snp_selection': True, 'num_snps': 19503}. Best is trial 124 with value: 0.08547736083653104.
[I 2025-12-05 15:07:59,359] Trial 132 finished with value: 0.049556756832668664 and parameters: {'model_type': 'mlp', 'hidden_dims': '[128, 64]', 'dropout': 0.27714993431758145, 'batch_norm': True, 'lr': 0.00044175024437533543, 'weight_decay': 3.066479238381349e-05, 'epochs': 83, 'loss': 'mae', 'optimizer': 'adam', 'graph_mode': 'off', 'use_snp_selection': True, 'num_snps': 22464}. Best is trial 124 with value: 0.08547736083653104.
[I 2025-12-05 15:08:00,638] Trial 133 finished with value: 0.03853817127047778 and parameters: {'model_type': 'mlp', 'hidden_dims': '[128, 64]', 'dropout': 0.2737388218949147, 'batch_norm': True, 'lr': 0.0004457780874384216, 'weight_decay': 3.006315780731557e-05, 'epochs': 79, 'loss': 'mae', 'optimizer': 'adam', 'graph_mode': 'off', 'use_snp_selection': True, 'num_snps': 22793}. Best is trial 124 with value: 0.08547736083653104.
[I 2025-12-05 15:08:01,841] Trial 134 finished with value: 0.02616030620833286 and parameters: {'model_type': 'mlp', 'hidden_dims': '[128, 64]', 'dropout': 0.267126777476762, 'batch_norm': True, 'lr': 0.0004741476366271844, 'weight_decay': 4.7788643514243836e-05, 'epochs': 86, 'loss': 'mae', 'optimizer': 'adam', 'graph_mode': 'off', 'use_snp_selection': True, 'num_snps': 20774}. Best is trial 124 with value: 0.08547736083653104.
[I 2025-12-05 15:08:02,798] Trial 135 finished with value: 0.04544088763654563 and parameters: {'model_type': 'mlp', 'hidden_dims': '[128, 64]', 'dropout': 0.28451894767347824, 'batch_norm': True, 'lr': 0.0003209548422492603, 'weight_decay': 3.7931280756884734e-05, 'epochs': 47, 'loss': 'mae', 'optimizer': 'adam', 'graph_mode': 'off', 'use_snp_selection': True, 'num_snps': 14998}. Best is trial 124 with value: 0.08547736083653104.
[I 2025-12-05 15:08:03,900] Trial 136 finished with value: 0.020661435293954547 and parameters: {'model_type': 'mlp', 'hidden_dims': '[128, 64]', 'dropout': 0.32156941036375986, 'batch_norm': True, 'lr': 0.0008070642115225954, 'weight_decay': 5.294599719216996e-05, 'epochs': 61, 'loss': 'mae', 'optimizer': 'adam', 'graph_mode': 'off', 'use_snp_selection': True, 'num_snps': 17906}. Best is trial 124 with value: 0.08547736083653104.
[I 2025-12-05 15:08:05,227] Trial 137 finished with value: 0.03724771254167715 and parameters: {'model_type': 'mlp', 'hidden_dims': '[128, 64]', 'dropout': 0.30392489872448186, 'batch_norm': False, 'lr': 0.0004055109720565824, 'weight_decay': 9.286566768561501e-05, 'epochs': 91, 'loss': 'mae', 'optimizer': 'adam', 'graph_mode': 'off', 'use_snp_selection': True, 'num_snps': 26449}. Best is trial 124 with value: 0.08547736083653104.
[I 2025-12-05 15:08:06,080] Trial 138 finished with value: 0.05800037798915848 and parameters: {'model_type': 'mlp', 'hidden_dims': '[512, 64]', 'dropout': 0.31551243273778845, 'batch_norm': True, 'lr': 0.0006366976088648534, 'weight_decay': 3.495507584101346e-05, 'epochs': 67, 'loss': 'mae', 'optimizer': 'adam', 'graph_mode': 'off', 'use_snp_selection': True, 'num_snps': 9176}. Best is trial 124 with value: 0.08547736083653104.
[I 2025-12-05 15:08:06,944] Trial 139 finished with value: 0.07763284156475873 and parameters: {'model_type': 'mlp', 'hidden_dims': '[512, 64]', 'dropout': 0.3133287938763121, 'batch_norm': False, 'lr': 0.0005504707756776286, 'weight_decay': 1.883170261065498e-05, 'epochs': 86, 'loss': 'mae', 'optimizer': 'adam', 'graph_mode': 'off', 'use_snp_selection': True, 'num_snps': 9334}. Best is trial 124 with value: 0.08547736083653104.
[I 2025-12-05 15:08:07,759] Trial 140 finished with value: 0.05567364215646591 and parameters: {'model_type': 'mlp', 'hidden_dims': '[512, 64]', 'dropout': 0.31684441620141257, 'batch_norm': False, 'lr': 0.0006153893942436796, 'weight_decay': 2.590289811196531e-05, 'epochs': 67, 'loss': 'mae', 'optimizer': 'adam', 'graph_mode': 'off', 'use_snp_selection': True, 'num_snps': 9155}. Best is trial 124 with value: 0.08547736083653104.
[I 2025-12-05 15:08:08,634] Trial 141 finished with value: 0.015601061892755397 and parameters: {'model_type': 'mlp', 'hidden_dims': '[512, 64]', 'dropout': 0.3127764524239631, 'batch_norm': False, 'lr': 0.0005952205220012725, 'weight_decay': 3.5809430379575405e-05, 'epochs': 65, 'loss': 'mae', 'optimizer': 'adam', 'graph_mode': 'off', 'use_snp_selection': True, 'num_snps': 9752}. Best is trial 124 with value: 0.08547736083653104.
[I 2025-12-05 15:08:09,558] Trial 142 finished with value: 0.018680991694862578 and parameters: {'model_type': 'mlp', 'hidden_dims': '[512, 64]', 'dropout': 0.2917302022610645, 'batch_norm': False, 'lr': 0.0006850269807893484, 'weight_decay': 1.869563071555777e-05, 'epochs': 48, 'loss': 'mae', 'optimizer': 'adam', 'graph_mode': 'off', 'use_snp_selection': True, 'num_snps': 12545}. Best is trial 124 with value: 0.08547736083653104.
[I 2025-12-05 15:08:10,372] Trial 143 finished with value: 0.06619227533449609 and parameters: {'model_type': 'mlp', 'hidden_dims': '[512, 64]', 'dropout': 0.334368793593777, 'batch_norm': False, 'lr': 0.0008897474133560221, 'weight_decay': 1.5664315633595223e-05, 'epochs': 66, 'loss': 'mae', 'optimizer': 'adam', 'graph_mode': 'off', 'use_snp_selection': True, 'num_snps': 8794}. Best is trial 124 with value: 0.08547736083653104.
[I 2025-12-05 15:08:11,190] Trial 144 finished with value: 0.04495783416448733 and parameters: {'model_type': 'mlp', 'hidden_dims': '[512, 64]', 'dropout': 0.3381561568466954, 'batch_norm': False, 'lr': 0.0008788841010475239, 'weight_decay': 1.4077184947613201e-05, 'epochs': 77, 'loss': 'mae', 'optimizer': 'adam', 'graph_mode': 'off', 'use_snp_selection': True, 'num_snps': 8808}. Best is trial 124 with value: 0.08547736083653104.
[I 2025-12-05 15:08:11,946] Trial 145 finished with value: 0.047106878473205244 and parameters: {'model_type': 'mlp', 'hidden_dims': '[512, 64]', 'dropout': 0.3111424841819346, 'batch_norm': False, 'lr': 0.00035349948400235497, 'weight_decay': 1.0613803732402972e-05, 'epochs': 55, 'loss': 'mae', 'optimizer': 'adam', 'graph_mode': 'off', 'use_snp_selection': True, 'num_snps': 6913}. Best is trial 124 with value: 0.08547736083653104.
