[I 2025-12-05 16:28:08,007] Trial 68 finished with value: 0.07224510751998103 and parameters: {'model_type': 'mlp', 'hidden_dims': '[512, 256]', 'dropout': 0.22169876207758585, 'batch_norm': True, 'lr': 0.0007334169755391906, 'weight_decay': 0.00021946310753707046, 'epochs': 158, 'loss': 'mse', 'optimizer': 'adam', 'graph_mode': 'off', 'use_snp_selection': False}. Best is trial 47 with value: 0.08117400765552986.
[I 2025-12-05 16:28:09,381] Trial 69 finished with value: 0.06614881499591993 and parameters: {'model_type': 'mlp', 'hidden_dims': '[512, 256]', 'dropout': 0.24031764489005228, 'batch_norm': True, 'lr': 0.00099851187229474, 'weight_decay': 0.0002813538156152812, 'epochs': 186, 'loss': 'mse', 'optimizer': 'adam', 'graph_mode': 'off', 'use_snp_selection': False}. Best is trial 47 with value: 0.08117400765552986.
[I 2025-12-05 16:28:10,677] Trial 70 finished with value: 0.06929561674008139 and parameters: {'model_type': 'mlp', 'hidden_dims': '[512, 256]', 'dropout': 0.2644117961523001, 'batch_norm': True, 'lr': 0.0005764961461525717, 'weight_decay': 0.0004200909266611813, 'epochs': 165, 'loss': 'mse', 'optimizer': 'adam', 'graph_mode': 'off', 'use_snp_selection': False}. Best is trial 47 with value: 0.08117400765552986.
[I 2025-12-05 16:28:11,874] Trial 71 finished with value: 0.061980200584640106 and parameters: {'model_type': 'mlp', 'hidden_dims': '[512, 256]', 'dropout': 0.18245367762464307, 'batch_norm': True, 'lr': 0.0003275065670779373, 'weight_decay': 9.175025526202238e-05, 'epochs': 140, 'loss': 'mse', 'optimizer': 'adam', 'graph_mode': 'off', 'use_snp_selection': False}. Best is trial 47 with value: 0.08117400765552986.
[I 2025-12-05 16:28:12,872] Trial 72 finished with value: 0.06269305615377652 and parameters: {'model_type': 'mlp', 'hidden_dims': '[512, 256]', 'dropout': 0.20450949007825514, 'batch_norm': True, 'lr': 0.0004249360313205001, 'weight_decay': 0.0006490587241601364, 'epochs': 88, 'loss': 'mse', 'optimizer': 'adam', 'graph_mode': 'off', 'use_snp_selection': False}. Best is trial 47 with value: 0.08117400765552986.
[I 2025-12-05 16:28:13,990] Trial 73 finished with value: 0.05150946637729959 and parameters: {'model_type': 'mlp', 'hidden_dims': '[512, 256]', 'dropout': 0.14787545123102624, 'batch_norm': True, 'lr': 0.0005395463462007815, 'weight_decay': 0.00015876436044732893, 'epochs': 112, 'loss': 'mse', 'optimizer': 'adam', 'graph_mode': 'off', 'use_snp_selection': False}. Best is trial 47 with value: 0.08117400765552986.
[I 2025-12-05 16:28:15,349] Trial 74 finished with value: 0.06143430891313934 and parameters: {'model_type': 'mlp', 'hidden_dims': '[512, 256]', 'dropout': 0.2288222686805335, 'batch_norm': True, 'lr': 0.0008116558243200199, 'weight_decay': 0.00029093270990273153, 'epochs': 181, 'loss': 'mse', 'optimizer': 'adam', 'graph_mode': 'off', 'use_snp_selection': False}. Best is trial 47 with value: 0.08117400765552986.
[I 2025-12-05 16:28:16,575] Trial 75 finished with value: 0.04791329413249595 and parameters: {'model_type': 'mlp', 'hidden_dims': '[512, 256]', 'dropout': 0.2818329664301006, 'batch_norm': True, 'lr': 0.000286708027282009, 'weight_decay': 0.00041703555570891585, 'epochs': 147, 'loss': 'mse', 'optimizer': 'adam', 'graph_mode': 'off', 'use_snp_selection': False}. Best is trial 47 with value: 0.08117400765552986.
[I 2025-12-05 16:28:17,711] Trial 76 finished with value: 0.0615509050682203 and parameters: {'model_type': 'mlp', 'hidden_dims': '[512, 64]', 'dropout': 0.1860785738796237, 'batch_norm': True, 'lr': 0.0006111005940741091, 'weight_decay': 0.00020029255507343256, 'epochs': 124, 'loss': 'mse', 'optimizer': 'adam', 'graph_mode': 'off', 'use_snp_selection': False}. Best is trial 47 with value: 0.08117400765552986.
[I 2025-12-05 16:28:19,256] Trial 77 finished with value: 0.061974754627749755 and parameters: {'model_type': 'mlp', 'hidden_dims': '[512, 256]', 'dropout': 0.24553067799917988, 'batch_norm': True, 'lr': 0.0003943236382664278, 'weight_decay': 0.00011338379192677804, 'epochs': 230, 'loss': 'mse', 'optimizer': 'adam', 'graph_mode': 'off', 'use_snp_selection': False}. Best is trial 47 with value: 0.08117400765552986.
[I 2025-12-05 16:28:20,540] Trial 78 finished with value: 0.0684897906655849 and parameters: {'model_type': 'mlp', 'hidden_dims': '[512, 256]', 'dropout': 0.20603566904820605, 'batch_norm': True, 'lr': 0.00023152971389748544, 'weight_decay': 3.567219050565751e-05, 'epochs': 160, 'loss': 'mse', 'optimizer': 'adam', 'graph_mode': 'off', 'use_snp_selection': False}. Best is trial 47 with value: 0.08117400765552986.
[I 2025-12-05 16:28:22,008] Trial 79 finished with value: 0.07108044816500048 and parameters: {'model_type': 'mlp', 'hidden_dims': '[512, 256]', 'dropout': 0.15704068754972436, 'batch_norm': True, 'lr': 0.0004940916365765052, 'weight_decay': 0.0006181228671013574, 'epochs': 209, 'loss': 'mse', 'optimizer': 'adam', 'graph_mode': 'off', 'use_snp_selection': False}. Best is trial 47 with value: 0.08117400765552986.
[I 2025-12-05 16:28:22,892] Trial 80 finished with value: 0.05718316276143963 and parameters: {'model_type': 'mlp', 'hidden_dims': '[512, 256]', 'dropout': 0.22188591863985296, 'batch_norm': True, 'lr': 0.0007903569333152111, 'weight_decay': 5.905576312014631e-05, 'epochs': 57, 'loss': 'mse', 'optimizer': 'adam', 'graph_mode': 'off', 'use_snp_selection': False}. Best is trial 47 with value: 0.08117400765552986.
[I 2025-12-05 16:28:24,172] Trial 81 finished with value: 0.05991501754682828 and parameters: {'model_type': 'mlp', 'hidden_dims': '[512, 256]', 'dropout': 0.21468151197245877, 'batch_norm': True, 'lr': 0.000752099664107762, 'weight_decay': 0.0002265547319959161, 'epochs': 161, 'loss': 'mse', 'optimizer': 'adam', 'graph_mode': 'off', 'use_snp_selection': False}. Best is trial 47 with value: 0.08117400765552986.
[I 2025-12-05 16:28:25,353] Trial 82 finished with value: 0.07064945609176082 and parameters: {'model_type': 'mlp', 'hidden_dims': '[512, 256]', 'dropout': 0.19562669224635187, 'batch_norm': True, 'lr': 0.0006563288447174112, 'weight_decay': 0.00018265593887606876, 'epochs': 135, 'loss': 'mse', 'optimizer': 'adam', 'graph_mode': 'off', 'use_snp_selection': False}. Best is trial 47 with value: 0.08117400765552986.
[I 2025-12-05 16:28:26,778] Trial 83 finished with value: 0.055692802955010334 and parameters: {'model_type': 'mlp', 'hidden_dims': '[512, 256]', 'dropout': 0.27084181363627174, 'batch_norm': True, 'lr': 0.0003382590216650676, 'weight_decay': 4.540257907174563e-07, 'epochs': 199, 'loss': 'mse', 'optimizer': 'adam', 'graph_mode': 'off', 'use_snp_selection': False}. Best is trial 47 with value: 0.08117400765552986.
[I 2025-12-05 16:28:28,042] Trial 84 finished with value: 0.0572486593614293 and parameters: {'model_type': 'mlp', 'hidden_dims': '[512, 256]', 'dropout': 0.22720237386283249, 'batch_norm': True, 'lr': 0.0009987381360473991, 'weight_decay': 0.0002558854845087677, 'epochs': 155, 'loss': 'mse', 'optimizer': 'adam', 'graph_mode': 'off', 'use_snp_selection': False}. Best is trial 47 with value: 0.08117400765552986.
[I 2025-12-05 16:28:28,956] Trial 85 finished with value: 0.025247154957889623 and parameters: {'model_type': 'mlp', 'hidden_dims': '[256, 128, 64]', 'dropout': 0.17623122077772163, 'batch_norm': False, 'lr': 0.0004925929742116063, 'weight_decay': 0.00013887666549643434, 'epochs': 176, 'loss': 'mse', 'optimizer': 'adam', 'graph_mode': 'off', 'use_snp_selection': False}. Best is trial 47 with value: 0.08117400765552986.
[I 2025-12-05 16:28:30,339] Trial 86 finished with value: 0.07293091094850467 and parameters: {'model_type': 'mlp', 'hidden_dims': '[512, 256]', 'dropout': 0.2488210151502342, 'batch_norm': True, 'lr': 0.00060685882582397, 'weight_decay': 0.0003840661997158771, 'epochs': 187, 'loss': 'mse', 'optimizer': 'adam', 'graph_mode': 'off', 'use_snp_selection': False}. Best is trial 47 with value: 0.08117400765552986.
[I 2025-12-05 16:28:31,623] Trial 87 finished with value: 0.10100013413584537 and parameters: {'model_type': 'mlp', 'hidden_dims': '[512, 256]', 'dropout': 0.30244854851641007, 'batch_norm': True, 'lr': 0.00017099641469634324, 'weight_decay': 0.0003907962140299335, 'epochs': 190, 'loss': 'mse', 'optimizer': 'adam', 'graph_mode': 'off', 'use_snp_selection': True, 'num_snps': 19154}. Best is trial 87 with value: 0.10100013413584537.
[I 2025-12-05 16:28:32,886] Trial 88 finished with value: -0.004950736846023322 and parameters: {'model_type': 'mlp', 'hidden_dims': '[512, 256]', 'dropout': 0.3221830694071278, 'batch_norm': True, 'lr': 1.1664965422250752e-06, 'weight_decay': 0.0003722906940959045, 'epochs': 187, 'loss': 'mse', 'optimizer': 'adam', 'graph_mode': 'off', 'use_snp_selection': True, 'num_snps': 18567}. Best is trial 87 with value: 0.10100013413584537.
[I 2025-12-05 16:28:33,758] Trial 89 finished with value: 0.029933713547318126 and parameters: {'model_type': 'mlp', 'hidden_dims': '[512, 64]', 'dropout': 0.2987177014575843, 'batch_norm': True, 'lr': 0.00017677008507554614, 'weight_decay': 0.0005638488818925097, 'epochs': 227, 'loss': 'mse', 'optimizer': 'adam', 'graph_mode': 'off', 'use_snp_selection': True, 'num_snps': 2890}. Best is trial 87 with value: 0.10100013413584537.
[I 2025-12-05 16:28:34,889] Trial 90 finished with value: 0.06724817430574619 and parameters: {'model_type': 'mlp', 'hidden_dims': '[128, 64]', 'dropout': 0.2789849254425789, 'batch_norm': True, 'lr': 0.0006260944600642907, 'weight_decay': 0.0008358307058407353, 'epochs': 194, 'loss': 'mse', 'optimizer': 'adam', 'graph_mode': 'off', 'use_snp_selection': True, 'num_snps': 13850}. Best is trial 87 with value: 0.10100013413584537.
[I 2025-12-05 16:28:36,422] Trial 91 finished with value: 0.07557611421280323 and parameters: {'model_type': 'mlp', 'hidden_dims': '[512, 256]', 'dropout': 0.25373825121561, 'batch_norm': True, 'lr': 0.00028383029590677017, 'weight_decay': 0.0005056715228436143, 'epochs': 175, 'loss': 'mse', 'optimizer': 'adam', 'graph_mode': 'off', 'use_snp_selection': True, 'num_snps': 25439}. Best is trial 87 with value: 0.10100013413584537.
[I 2025-12-05 16:28:37,950] Trial 92 finished with value: 0.07857245420842934 and parameters: {'model_type': 'mlp', 'hidden_dims': '[512, 256]', 'dropout': 0.244917133863909, 'batch_norm': True, 'lr': 0.0003902492417937505, 'weight_decay': 0.0004959339046069171, 'epochs': 175, 'loss': 'mse', 'optimizer': 'adam', 'graph_mode': 'off', 'use_snp_selection': True, 'num_snps': 25719}. Best is trial 87 with value: 0.10100013413584537.
[I 2025-12-05 16:28:39,540] Trial 93 finished with value: 0.06491429541923398 and parameters: {'model_type': 'mlp', 'hidden_dims': '[512, 256]', 'dropout': 0.33498399894183045, 'batch_norm': True, 'lr': 0.000312093875696875, 'weight_decay': 0.0004432461880305127, 'epochs': 214, 'loss': 'mse', 'optimizer': 'adam', 'graph_mode': 'off', 'use_snp_selection': True, 'num_snps': 25367}. Best is trial 87 with value: 0.10100013413584537.
[I 2025-12-05 16:28:41,241] Trial 94 finished with value: 0.05657527250327359 and parameters: {'model_type': 'mlp', 'hidden_dims': '[512, 256]', 'dropout': 0.2574103320120058, 'batch_norm': True, 'lr': 0.00015023471702019835, 'weight_decay': 0.00031234694279113723, 'epochs': 172, 'loss': 'mse', 'optimizer': 'adam', 'graph_mode': 'off', 'use_snp_selection': True, 'num_snps': 30435}. Best is trial 87 with value: 0.10100013413584537.
[I 2025-12-05 16:28:42,479] Trial 95 finished with value: 0.06818013921281418 and parameters: {'model_type': 'mlp', 'hidden_dims': '[512, 256]', 'dropout': 0.3122649668499994, 'batch_norm': True, 'lr': 0.00042114778037523375, 'weight_decay': 0.000780941218386279, 'epochs': 180, 'loss': 'mse', 'optimizer': 'adam', 'graph_mode': 'off', 'use_snp_selection': True, 'num_snps': 17227}. Best is trial 87 with value: 0.10100013413584537.
[I 2025-12-05 16:28:44,013] Trial 96 finished with value: 0.06159982343947406 and parameters: {'model_type': 'mlp', 'hidden_dims': '[512, 256]', 'dropout': 0.28660751941621254, 'batch_norm': True, 'lr': 0.00024134953775837401, 'weight_decay': 0.0003486053733498381, 'epochs': 202, 'loss': 'mse', 'optimizer': 'adam', 'graph_mode': 'off', 'use_snp_selection': True, 'num_snps': 24751}. Best is trial 87 with value: 0.10100013413584537.
[I 2025-12-05 16:28:45,758] Trial 97 finished with value: 0.026709091251367504 and parameters: {'model_type': 'mlp', 'hidden_dims': '[512, 256]', 'dropout': 0.3591920895522712, 'batch_norm': False, 'lr': 0.0003962411958255727, 'weight_decay': 8.051616510562951e-05, 'epochs': 196, 'loss': 'mse', 'optimizer': 'adam', 'graph_mode': 'off', 'use_snp_selection': True, 'num_snps': 30743}. Best is trial 87 with value: 0.10100013413584537.
[I 2025-12-05 16:28:47,016] Trial 98 finished with value: 0.06550725283462716 and parameters: {'model_type': 'mlp', 'hidden_dims': '[512, 256]', 'dropout': 0.2729392910145483, 'batch_norm': True, 'lr': 0.0003744381351478914, 'weight_decay': 0.00048194159162059697, 'epochs': 165, 'loss': 'mse', 'optimizer': 'adam', 'graph_mode': 'off', 'use_snp_selection': True, 'num_snps': 19366}. Best is trial 87 with value: 0.10100013413584537.
[I 2025-12-05 16:28:47,955] Trial 99 finished with value: 0.08639027663239135 and parameters: {'model_type': 'mlp', 'hidden_dims': '[512, 256]', 'dropout': 0.23628357970658015, 'batch_norm': True, 'lr': 0.0004999856143652908, 'weight_decay': 0.0007353652450963339, 'epochs': 183, 'loss': 'mse', 'optimizer': 'adam', 'graph_mode': 'off', 'use_snp_selection': True, 'num_snps': 7319}. Best is trial 87 with value: 0.10100013413584537.
[I 2025-12-05 16:28:48,873] Trial 100 finished with value: 0.07408093497505343 and parameters: {'model_type': 'mlp', 'hidden_dims': '[256, 128, 64]', 'dropout': 0.30070096741381347, 'batch_norm': True, 'lr': 0.0002892717265586065, 'weight_decay': 0.0006740517555034938, 'epochs': 146, 'loss': 'mse', 'optimizer': 'adam', 'graph_mode': 'off', 'use_snp_selection': True, 'num_snps': 6957}. Best is trial 87 with value: 0.10100013413584537.
[I 2025-12-05 16:28:49,823] Trial 101 finished with value: 0.08359940007116247 and parameters: {'model_type': 'mlp', 'hidden_dims': '[256, 128, 64]', 'dropout': 0.29720448685470635, 'batch_norm': True, 'lr': 0.00021287251180269229, 'weight_decay': 0.0007240514327906043, 'epochs': 145, 'loss': 'mse', 'optimizer': 'adam', 'graph_mode': 'off', 'use_snp_selection': True, 'num_snps': 7998}. Best is trial 87 with value: 0.10100013413584537.
[I 2025-12-05 16:28:50,821] Trial 102 finished with value: 0.06353853843641497 and parameters: {'model_type': 'mlp', 'hidden_dims': '[256, 128, 64]', 'dropout': 0.23557738126558495, 'batch_norm': True, 'lr': 0.0004804083453419421, 'weight_decay': 0.0009841777058064837, 'epochs': 172, 'loss': 'mse', 'optimizer': 'adam', 'graph_mode': 'off', 'use_snp_selection': True, 'num_snps': 7754}. Best is trial 87 with value: 0.10100013413584537.
[I 2025-12-05 16:28:51,823] Trial 103 finished with value: 0.07336430845474397 and parameters: {'model_type': 'mlp', 'hidden_dims': '[256, 128, 64]', 'dropout': 0.32138758958177827, 'batch_norm': True, 'lr': 0.0002430063495250684, 'weight_decay': 0.0007871603585825386, 'epochs': 181, 'loss': 'mse', 'optimizer': 'adam', 'graph_mode': 'off', 'use_snp_selection': True, 'num_snps': 7957}. Best is trial 87 with value: 0.10100013413584537.
[I 2025-12-05 16:28:52,908] Trial 104 finished with value: 0.036443437900187885 and parameters: {'model_type': 'mlp', 'hidden_dims': '[256, 128, 64]', 'dropout': 0.26312577488061045, 'batch_norm': True, 'lr': 0.00021278381091497872, 'weight_decay': 0.0005663717823450138, 'epochs': 123, 'loss': 'mse', 'optimizer': 'adam', 'graph_mode': 'off', 'use_snp_selection': True, 'num_snps': 14734}. Best is trial 87 with value: 0.10100013413584537.
[I 2025-12-05 16:28:54,255] Trial 105 finished with value: 0.06414880264450129 and parameters: {'model_type': 'mlp', 'hidden_dims': '[512, 256]', 'dropout': 0.2925598444230723, 'batch_norm': True, 'lr': 0.0008692703162323116, 'weight_decay': 0.00025334535008476563, 'epochs': 141, 'loss': 'mse', 'optimizer': 'adam', 'graph_mode': 'off', 'use_snp_selection': True, 'num_snps': 22331}. Best is trial 87 with value: 0.10100013413584537.
[I 2025-12-05 16:28:55,239] Trial 106 finished with value: 0.09018724007619103 and parameters: {'model_type': 'mlp', 'hidden_dims': '[256, 128]', 'dropout': 0.25305148902636865, 'batch_norm': True, 'lr': 0.0003595710627449315, 'weight_decay': 0.0006920260967660683, 'epochs': 168, 'loss': 'mse', 'optimizer': 'adam', 'graph_mode': 'off', 'use_snp_selection': True, 'num_snps': 9166}. Best is trial 87 with value: 0.10100013413584537.
[I 2025-12-05 16:28:56,283] Trial 107 finished with value: 0.0676569481448367 and parameters: {'model_type': 'mlp', 'hidden_dims': '[256, 128]', 'dropout': 0.3045709768086756, 'batch_norm': True, 'lr': 0.00015135489073611635, 'weight_decay': 0.0006919643563264602, 'epochs': 206, 'loss': 'mse', 'optimizer': 'adam', 'graph_mode': 'off', 'use_snp_selection': True, 'num_snps': 9738}. Best is trial 87 with value: 0.10100013413584537.
[I 2025-12-05 16:28:57,148] Trial 108 finished with value: 0.05034653240555468 and parameters: {'model_type': 'mlp', 'hidden_dims': '[256, 128]', 'dropout': 0.25628353682018484, 'batch_norm': True, 'lr': 0.0001943309399452512, 'weight_decay': 0.00046389899129226775, 'epochs': 175, 'loss': 'mse', 'optimizer': 'adam', 'graph_mode': 'off', 'use_snp_selection': True, 'num_snps': 4702}. Best is trial 87 with value: 0.10100013413584537.
[I 2025-12-05 16:28:58,403] Trial 109 finished with value: 0.06345191934599576 and parameters: {'model_type': 'mlp', 'hidden_dims': '[256, 128]', 'dropout': 0.27766477591945915, 'batch_norm': True, 'lr': 0.0002864851475026529, 'weight_decay': 0.0005748505529154141, 'epochs': 222, 'loss': 'mse', 'optimizer': 'adam', 'graph_mode': 'off', 'use_snp_selection': True, 'num_snps': 15328}. Best is trial 87 with value: 0.10100013413584537.
[I 2025-12-05 16:28:59,424] Trial 110 finished with value: 0.0659561739076396 and parameters: {'model_type': 'mlp', 'hidden_dims': '[256, 128]', 'dropout': 0.3317043788492004, 'batch_norm': True, 'lr': 0.00036270716497186726, 'weight_decay': 0.0007669662616683693, 'epochs': 167, 'loss': 'mse', 'optimizer': 'adam', 'graph_mode': 'off', 'use_snp_selection': True, 'num_snps': 10759}. Best is trial 87 with value: 0.10100013413584537.
[I 2025-12-05 16:29:01,009] Trial 111 finished with value: 0.07522366722434042 and parameters: {'model_type': 'mlp', 'hidden_dims': '[512, 256]', 'dropout': 0.23945739746538847, 'batch_norm': True, 'lr': 0.0005332075244342264, 'weight_decay': 0.0003335164239987088, 'epochs': 152, 'loss': 'mse', 'optimizer': 'adam', 'graph_mode': 'off', 'use_snp_selection': True, 'num_snps': 28387}. Best is trial 87 with value: 0.10100013413584537.
[I 2025-12-05 16:29:02,492] Trial 112 finished with value: 0.06094761950671875 and parameters: {'model_type': 'mlp', 'hidden_dims': '[128, 64]', 'dropout': 0.24215351665899512, 'batch_norm': True, 'lr': 0.0006994871784186821, 'weight_decay': 0.00031441102281908566, 'epochs': 164, 'loss': 'mse', 'optimizer': 'adam', 'graph_mode': 'off', 'use_snp_selection': True, 'num_snps': 28504}. Best is trial 87 with value: 0.10100013413584537.
[I 2025-12-05 16:29:04,317] Trial 113 finished with value: 0.0443210099282048 and parameters: {'model_type': 'mlp', 'hidden_dims': '[512, 256]', 'dropout': 0.2576952424750048, 'batch_norm': True, 'lr': 0.0005000123303433722, 'weight_decay': 0.0004012405722248382, 'epochs': 183, 'loss': 'mse', 'optimizer': 'adam', 'graph_mode': 'off', 'use_snp_selection': True, 'num_snps': 32988}. Best is trial 87 with value: 0.10100013413584537.
[I 2025-12-05 16:29:06,148] Trial 114 finished with value: 0.052586258140965014 and parameters: {'model_type': 'mlp', 'hidden_dims': '[512, 256]', 'dropout': 0.26738852431485294, 'batch_norm': True, 'lr': 0.00045033172123860177, 'weight_decay': 0.0005223899092080939, 'epochs': 150, 'loss': 'mse', 'optimizer': 'adam', 'graph_mode': 'off', 'use_snp_selection': True, 'num_snps': 35006}. Best is trial 87 with value: 0.10100013413584537.
[I 2025-12-05 16:29:07,410] Trial 115 finished with value: 0.05380725593988142 and parameters: {'model_type': 'mlp', 'hidden_dims': '[512, 64]', 'dropout': 0.23093744471019068, 'batch_norm': True, 'lr': 0.00032615293955036087, 'weight_decay': 0.0009819778765850654, 'epochs': 104, 'loss': 'mse', 'optimizer': 'adam', 'graph_mode': 'off', 'use_snp_selection': True, 'num_snps': 21709}. Best is trial 87 with value: 0.10100013413584537.
[I 2025-12-05 16:29:08,338] Trial 116 finished with value: 0.0511525057043625 and parameters: {'model_type': 'mlp', 'hidden_dims': '[512, 256]', 'dropout': 0.2422270633758961, 'batch_norm': True, 'lr': 0.0005346222946478015, 'weight_decay': 0.00016690873934499447, 'epochs': 195, 'loss': 'mse', 'optimizer': 'adam', 'graph_mode': 'off', 'use_snp_selection': True, 'num_snps': 5667}. Best is trial 87 with value: 0.10100013413584537.
[I 2025-12-05 16:29:09,676] Trial 117 finished with value: 0.03780010143092153 and parameters: {'model_type': 'mlp', 'hidden_dims': '[256, 128, 64]', 'dropout': 0.2129276505640184, 'batch_norm': False, 'lr': 0.00037197003231395544, 'weight_decay': 0.00030975073355854043, 'epochs': 132, 'loss': 'mse', 'optimizer': 'adam', 'graph_mode': 'off', 'use_snp_selection': True, 'num_snps': 23371}. Best is trial 87 with value: 0.10100013413584537.
[I 2025-12-05 16:29:10,870] Trial 118 finished with value: 0.07571480415340583 and parameters: {'model_type': 'mlp', 'hidden_dims': '[256, 128]', 'dropout': 0.29329854588313214, 'batch_norm': True, 'lr': 0.0007075571579042279, 'weight_decay': 0.0006787177762418337, 'epochs': 269, 'loss': 'mse', 'optimizer': 'adam', 'graph_mode': 'off', 'use_snp_selection': True, 'num_snps': 12117}. Best is trial 87 with value: 0.10100013413584537.
