[I 2025-12-05 16:24:51,019] Trial 115 finished with value: 0.10435841012371443 and parameters: {'model_type': 'mlp', 'hidden_dims': '[512, 128]', 'dropout': 0.1304274011954781, 'batch_norm': True, 'lr': 0.00024022007036554778, 'weight_decay': 8.097812866868263e-06, 'epochs': 287, 'loss': 'mse', 'optimizer': 'adam', 'graph_mode': 'off', 'use_snp_selection': True, 'num_snps': 52314}. Best is trial 102 with value: 0.1167076602043538.
[I 2025-12-05 16:24:54,162] Trial 116 finished with value: 0.10344641892416788 and parameters: {'model_type': 'mlp', 'hidden_dims': '[512, 256]', 'dropout': 0.16740921466302627, 'batch_norm': True, 'lr': 0.0003600283970457678, 'weight_decay': 3.7915754671066333e-06, 'epochs': 257, 'loss': 'mse', 'optimizer': 'adam', 'graph_mode': 'off', 'use_snp_selection': True, 'num_snps': 57694}. Best is trial 102 with value: 0.1167076602043538.
[I 2025-12-05 16:24:56,734] Trial 117 finished with value: 0.0954261618977496 and parameters: {'model_type': 'mlp', 'hidden_dims': '[512, 256]', 'dropout': 0.14665918974091596, 'batch_norm': True, 'lr': 0.0002834124466255302, 'weight_decay': 3.352441279213836e-05, 'epochs': 299, 'loss': 'mse', 'optimizer': 'adam', 'graph_mode': 'off', 'use_snp_selection': True, 'num_snps': 41092}. Best is trial 102 with value: 0.1167076602043538.
[I 2025-12-05 16:24:59,670] Trial 118 finished with value: 0.09779220842760089 and parameters: {'model_type': 'mlp', 'hidden_dims': '[512, 256]', 'dropout': 0.19955044439911762, 'batch_norm': True, 'lr': 0.0007990390489697513, 'weight_decay': 5.1500944475735656e-05, 'epochs': 330, 'loss': 'mae', 'optimizer': 'adam', 'graph_mode': 'off', 'use_snp_selection': True, 'num_snps': 48425}. Best is trial 102 with value: 0.1167076602043538.
[I 2025-12-05 16:25:01,589] Trial 119 finished with value: 0.09589894543061882 and parameters: {'model_type': 'mlp', 'hidden_dims': '[512, 128]', 'dropout': 0.13457474917501058, 'batch_norm': False, 'lr': 0.0004221611774239638, 'weight_decay': 7.160095576454964e-05, 'epochs': 321, 'loss': 'mse', 'optimizer': 'adam', 'graph_mode': 'off', 'use_snp_selection': False}. Best is trial 102 with value: 0.1167076602043538.
[I 2025-12-05 16:25:04,731] Trial 120 finished with value: 0.10883563734044162 and parameters: {'model_type': 'mlp', 'hidden_dims': '[512, 256]', 'dropout': 0.11948972590535278, 'batch_norm': True, 'lr': 0.00015293926825337009, 'weight_decay': 1.2424422876871527e-05, 'epochs': 312, 'loss': 'mse', 'optimizer': 'adam', 'graph_mode': 'off', 'use_snp_selection': True, 'num_snps': 55206}. Best is trial 102 with value: 0.1167076602043538.
[I 2025-12-05 16:25:07,907] Trial 121 finished with value: 0.10580054903497424 and parameters: {'model_type': 'mlp', 'hidden_dims': '[512, 256]', 'dropout': 0.21625143166015523, 'batch_norm': True, 'lr': 0.000306363720782031, 'weight_decay': 6.5361382146450155e-06, 'epochs': 311, 'loss': 'mse', 'optimizer': 'adam', 'graph_mode': 'off', 'use_snp_selection': True, 'num_snps': 54046}. Best is trial 102 with value: 0.1167076602043538.
[I 2025-12-05 16:25:11,263] Trial 122 finished with value: 0.10393912401672617 and parameters: {'model_type': 'mlp', 'hidden_dims': '[512, 256]', 'dropout': 0.19999166091992424, 'batch_norm': True, 'lr': 0.0003461921511252699, 'weight_decay': 4.861171678704351e-06, 'epochs': 318, 'loss': 'mse', 'optimizer': 'adam', 'graph_mode': 'off', 'use_snp_selection': True, 'num_snps': 57840}. Best is trial 102 with value: 0.1167076602043538.
[I 2025-12-05 16:25:14,433] Trial 123 finished with value: 0.1096588708866672 and parameters: {'model_type': 'mlp', 'hidden_dims': '[512, 256]', 'dropout': 0.1747388310428142, 'batch_norm': True, 'lr': 0.00022974645356962215, 'weight_decay': 1.9531122707879864e-05, 'epochs': 332, 'loss': 'mse', 'optimizer': 'adam', 'graph_mode': 'off', 'use_snp_selection': True, 'num_snps': 53349}. Best is trial 102 with value: 0.1167076602043538.
[I 2025-12-05 16:25:17,554] Trial 124 finished with value: 0.09509889166608848 and parameters: {'model_type': 'mlp', 'hidden_dims': '[512, 256]', 'dropout': 0.18730868543391135, 'batch_norm': True, 'lr': 0.00022057366326757365, 'weight_decay': 2.0598612791539295e-05, 'epochs': 332, 'loss': 'mse', 'optimizer': 'adam', 'graph_mode': 'off', 'use_snp_selection': True, 'num_snps': 52288}. Best is trial 102 with value: 0.1167076602043538.
[I 2025-12-05 16:25:20,067] Trial 125 finished with value: 0.10360236528590588 and parameters: {'model_type': 'mlp', 'hidden_dims': '[256, 128]', 'dropout': 0.10033867496772607, 'batch_norm': True, 'lr': 0.0005775469654303594, 'weight_decay': 1.7076969870713465e-05, 'epochs': 348, 'loss': 'mse', 'optimizer': 'adam', 'graph_mode': 'off', 'use_snp_selection': True, 'num_snps': 49407}. Best is trial 102 with value: 0.1167076602043538.
[I 2025-12-05 16:25:23,171] Trial 126 finished with value: 0.093346585228613 and parameters: {'model_type': 'mlp', 'hidden_dims': '[512, 128]', 'dropout': 0.17733610560488183, 'batch_norm': True, 'lr': 0.00026752246548620624, 'weight_decay': 2.6094828583421992e-05, 'epochs': 267, 'loss': 'mse', 'optimizer': 'adam', 'graph_mode': 'off', 'use_snp_selection': True, 'num_snps': 56303}. Best is trial 102 with value: 0.1167076602043538.
[I 2025-12-05 16:25:25,429] Trial 127 finished with value: 0.10059178673948205 and parameters: {'model_type': 'mlp', 'hidden_dims': '[512, 256]', 'dropout': 0.23133557757324125, 'batch_norm': True, 'lr': 0.0003948585253374458, 'weight_decay': 1.0449130456856143e-05, 'epochs': 276, 'loss': 'mse', 'optimizer': 'adam', 'graph_mode': 'off', 'use_snp_selection': True, 'num_snps': 36825}. Best is trial 102 with value: 0.1167076602043538.
[I 2025-12-05 16:25:26,673] Trial 128 finished with value: 0.08917028598887881 and parameters: {'model_type': 'mlp', 'hidden_dims': '[256, 128]', 'dropout': 0.1509924456161476, 'batch_norm': True, 'lr': 0.00019189338158723788, 'weight_decay': 1.4583128358282732e-05, 'epochs': 330, 'loss': 'mae', 'optimizer': 'adam', 'graph_mode': 'off', 'use_snp_selection': False}. Best is trial 102 with value: 0.1167076602043538.
[I 2025-12-05 16:25:29,502] Trial 129 finished with value: 0.10750121542965635 and parameters: {'model_type': 'mlp', 'hidden_dims': '[512, 256]', 'dropout': 0.1283808381186787, 'batch_norm': True, 'lr': 0.00048772802344054984, 'weight_decay': 0.00012840016630725709, 'epochs': 337, 'loss': 'mse', 'optimizer': 'adam', 'graph_mode': 'off', 'use_snp_selection': True, 'num_snps': 46871}. Best is trial 102 with value: 0.1167076602043538.
[I 2025-12-05 16:25:32,975] Trial 130 finished with value: 0.0926217004184355 and parameters: {'model_type': 'mlp', 'hidden_dims': '[512, 128]', 'dropout': 0.11072583803749318, 'batch_norm': True, 'lr': 0.0002262250307755336, 'weight_decay': 3.615385908163366e-05, 'epochs': 326, 'loss': 'mse', 'optimizer': 'adam', 'graph_mode': 'off', 'use_snp_selection': True, 'num_snps': 59899}. Best is trial 102 with value: 0.1167076602043538.
[I 2025-12-05 16:25:36,090] Trial 131 finished with value: 0.10211427513742442 and parameters: {'model_type': 'mlp', 'hidden_dims': '[512, 256]', 'dropout': 0.2087676769701566, 'batch_norm': True, 'lr': 0.00030620859451016693, 'weight_decay': 8.533610274426437e-06, 'epochs': 312, 'loss': 'mse', 'optimizer': 'adam', 'graph_mode': 'off', 'use_snp_selection': True, 'num_snps': 53635}. Best is trial 102 with value: 0.1167076602043538.
[I 2025-12-05 16:25:39,065] Trial 132 finished with value: 0.10104033952648013 and parameters: {'model_type': 'mlp', 'hidden_dims': '[512, 256]', 'dropout': 0.164564738635271, 'batch_norm': True, 'lr': 0.0002970114882657727, 'weight_decay': 5.7204087958998385e-05, 'epochs': 296, 'loss': 'mse', 'optimizer': 'adam', 'graph_mode': 'off', 'use_snp_selection': True, 'num_snps': 51684}. Best is trial 102 with value: 0.1167076602043538.
[I 2025-12-05 16:25:42,208] Trial 133 finished with value: 0.10818712027141673 and parameters: {'model_type': 'mlp', 'hidden_dims': '[512, 256]', 'dropout': 0.14849855904317835, 'batch_norm': True, 'lr': 0.0003533469293505721, 'weight_decay': 2.218032811188782e-06, 'epochs': 318, 'loss': 'mse', 'optimizer': 'adam', 'graph_mode': 'off', 'use_snp_selection': True, 'num_snps': 53916}. Best is trial 102 with value: 0.1167076602043538.
[I 2025-12-05 16:25:45,552] Trial 134 finished with value: 0.11136795252986079 and parameters: {'model_type': 'mlp', 'hidden_dims': '[512, 256]', 'dropout': 0.13857946883215486, 'batch_norm': True, 'lr': 0.0002516822249360261, 'weight_decay': 1.241865478659121e-05, 'epochs': 341, 'loss': 'mse', 'optimizer': 'adam', 'graph_mode': 'off', 'use_snp_selection': True, 'num_snps': 55560}. Best is trial 102 with value: 0.1167076602043538.
[I 2025-12-05 16:25:47,714] Trial 135 finished with value: 0.10316764779211474 and parameters: {'model_type': 'mlp', 'hidden_dims': '[512, 256]', 'dropout': 0.13623073413875447, 'batch_norm': True, 'lr': 0.00010148662845914396, 'weight_decay': 1.2622428224225686e-05, 'epochs': 345, 'loss': 'mse', 'optimizer': 'adam', 'graph_mode': 'off', 'use_snp_selection': True, 'num_snps': 31819}. Best is trial 102 with value: 0.1167076602043538.
[I 2025-12-05 16:25:50,733] Trial 136 finished with value: 0.09440189168966079 and parameters: {'model_type': 'mlp', 'hidden_dims': '[512, 256]', 'dropout': 0.12202198276478371, 'batch_norm': True, 'lr': 0.00018379660892172314, 'weight_decay': 1.7930326431022637e-05, 'epochs': 342, 'loss': 'mse', 'optimizer': 'adam', 'graph_mode': 'off', 'use_snp_selection': True, 'num_snps': 50229}. Best is trial 102 with value: 0.1167076602043538.
[I 2025-12-05 16:25:53,477] Trial 137 finished with value: 0.09965414639198812 and parameters: {'model_type': 'mlp', 'hidden_dims': '[256, 128, 64]', 'dropout': 0.14080887166838219, 'batch_norm': True, 'lr': 0.0002547069183304737, 'weight_decay': 1.1750217134962858e-05, 'epochs': 335, 'loss': 'mae', 'optimizer': 'adam', 'graph_mode': 'off', 'use_snp_selection': True, 'num_snps': 55546}. Best is trial 102 with value: 0.1167076602043538.
[I 2025-12-05 16:25:54,759] Trial 138 finished with value: 0.10808639195148706 and parameters: {'model_type': 'mlp', 'hidden_dims': '[256, 128]', 'dropout': 0.1602521426859513, 'batch_norm': True, 'lr': 0.0004063627127437518, 'weight_decay': 7.395634659934896e-06, 'epochs': 325, 'loss': 'mse', 'optimizer': 'adam', 'graph_mode': 'off', 'use_snp_selection': False}. Best is trial 102 with value: 0.1167076602043538.
[I 2025-12-05 16:25:58,030] Trial 139 finished with value: 0.0963698537672984 and parameters: {'model_type': 'mlp', 'hidden_dims': '[512, 64]', 'dropout': 0.10876771360799983, 'batch_norm': True, 'lr': 0.0006304122950581602, 'weight_decay': 2.1503857837361808e-05, 'epochs': 306, 'loss': 'mse', 'optimizer': 'adam', 'graph_mode': 'off', 'use_snp_selection': True, 'num_snps': 57940}. Best is trial 102 with value: 0.1167076602043538.
[I 2025-12-05 16:26:00,811] Trial 140 finished with value: 0.09496892685718625 and parameters: {'model_type': 'mlp', 'hidden_dims': '[512, 256]', 'dropout': 0.17670565450825557, 'batch_norm': False, 'lr': 0.0005237477687063086, 'weight_decay': 7.870887231126099e-05, 'epochs': 342, 'loss': 'mse', 'optimizer': 'adam', 'graph_mode': 'off', 'use_snp_selection': True, 'num_snps': 44886}. Best is trial 102 with value: 0.1167076602043538.
[I 2025-12-05 16:26:04,100] Trial 141 finished with value: 0.09871262881866598 and parameters: {'model_type': 'mlp', 'hidden_dims': '[512, 256]', 'dropout': 0.12729231609161487, 'batch_norm': True, 'lr': 0.00022059056843652062, 'weight_decay': 6.362302919913528e-06, 'epochs': 320, 'loss': 'mse', 'optimizer': 'adam', 'graph_mode': 'off', 'use_snp_selection': True, 'num_snps': 56353}. Best is trial 102 with value: 0.1167076602043538.
[I 2025-12-05 16:26:07,163] Trial 142 finished with value: 0.09692765082809314 and parameters: {'model_type': 'mlp', 'hidden_dims': '[512, 256]', 'dropout': 0.15795705840691918, 'batch_norm': True, 'lr': 0.00031789029359736043, 'weight_decay': 5.7246237149295675e-06, 'epochs': 301, 'loss': 'mse', 'optimizer': 'adam', 'graph_mode': 'off', 'use_snp_selection': True, 'num_snps': 53235}. Best is trial 102 with value: 0.1167076602043538.
[I 2025-12-05 16:26:10,617] Trial 143 finished with value: 0.112342923420253 and parameters: {'model_type': 'mlp', 'hidden_dims': '[512, 256]', 'dropout': 0.11765964445520771, 'batch_norm': True, 'lr': 0.00026627785859162037, 'weight_decay': 2.618983756223988e-06, 'epochs': 333, 'loss': 'mse', 'optimizer': 'adam', 'graph_mode': 'off', 'use_snp_selection': True, 'num_snps': 58457}. Best is trial 102 with value: 0.1167076602043538.
[I 2025-12-05 16:26:14,037] Trial 144 finished with value: 0.09943757460442117 and parameters: {'model_type': 'mlp', 'hidden_dims': '[512, 256]', 'dropout': 0.11781873813907334, 'batch_norm': True, 'lr': 0.00025792874233404063, 'weight_decay': 1.3783991409155824e-05, 'epochs': 330, 'loss': 'mse', 'optimizer': 'adam', 'graph_mode': 'off', 'use_snp_selection': True, 'num_snps': 58634}. Best is trial 102 with value: 0.1167076602043538.
[I 2025-12-05 16:26:16,851] Trial 145 finished with value: 0.1070615788529285 and parameters: {'model_type': 'mlp', 'hidden_dims': '[256, 128, 64]', 'dropout': 0.1386962240820991, 'batch_norm': True, 'lr': 0.0004475689162108206, 'weight_decay': 1.8068853635263805e-06, 'epochs': 348, 'loss': 'mse', 'optimizer': 'adam', 'graph_mode': 'off', 'use_snp_selection': True, 'num_snps': 57272}. Best is trial 102 with value: 0.1167076602043538.
[I 2025-12-05 16:26:20,125] Trial 146 finished with value: 0.11175281943730495 and parameters: {'model_type': 'mlp', 'hidden_dims': '[512, 64]', 'dropout': 0.109190837874328, 'batch_norm': True, 'lr': 0.0003653585690600829, 'weight_decay': 3.616235177587894e-07, 'epochs': 337, 'loss': 'mse', 'optimizer': 'adam', 'graph_mode': 'off', 'use_snp_selection': True, 'num_snps': 55252}. Best is trial 102 with value: 0.1167076602043538.
[I 2025-12-05 16:26:23,381] Trial 147 finished with value: 0.11525894600012226 and parameters: {'model_type': 'mlp', 'hidden_dims': '[512, 64]', 'dropout': 0.11218164177773349, 'batch_norm': True, 'lr': 0.00016440277456972248, 'weight_decay': 3.526621405243157e-07, 'epochs': 326, 'loss': 'mae', 'optimizer': 'adam', 'graph_mode': 'off', 'use_snp_selection': True, 'num_snps': 55327}. Best is trial 102 with value: 0.1167076602043538.
[I 2025-12-05 16:26:25,368] Trial 148 finished with value: 0.09992823429077385 and parameters: {'model_type': 'mlp', 'hidden_dims': '[512, 64]', 'dropout': 0.10868957445461686, 'batch_norm': True, 'lr': 0.00011952809304760972, 'weight_decay': 3.597503775136553e-07, 'epochs': 337, 'loss': 'mae', 'optimizer': 'adam', 'graph_mode': 'off', 'use_snp_selection': False}. Best is trial 102 with value: 0.1167076602043538.
[I 2025-12-05 16:26:28,527] Trial 149 finished with value: 0.08425900287283244 and parameters: {'model_type': 'mlp', 'hidden_dims': '[512, 64]', 'dropout': 0.11563366200552389, 'batch_norm': True, 'lr': 0.00017718037830969513, 'weight_decay': 2.889354322508656e-07, 'epochs': 323, 'loss': 'mae', 'optimizer': 'adam', 'graph_mode': 'off', 'use_snp_selection': True, 'num_snps': 55165}. Best is trial 102 with value: 0.1167076602043538.
[I 2025-12-05 16:26:30,676] Trial 0 finished with value: 0.0022207244867311574 and parameters: {'model_type': 'mlp', 'hidden_dims': '[128, 64]', 'dropout': 0.199031432379812, 'batch_norm': True, 'lr': 1.8408544111075837e-06, 'weight_decay': 5.5136510071208614e-05, 'epochs': 336, 'loss': 'mae', 'optimizer': 'adam', 'graph_mode': 'off', 'use_snp_selection': True, 'num_snps': 43862}. Best is trial 0 with value: 0.0022207244867311574.
[I 2025-12-05 16:26:31,731] Trial 1 finished with value: 0.05312952392742959 and parameters: {'model_type': 'mlp', 'hidden_dims': '[256, 128]', 'dropout': 0.4370668075331726, 'batch_norm': True, 'lr': 7.133471581159139e-05, 'weight_decay': 1.128633586803549e-05, 'epochs': 242, 'loss': 'mae', 'optimizer': 'adam', 'graph_mode': 'off', 'use_snp_selection': False}. Best is trial 1 with value: 0.05312952392742959.
[I 2025-12-05 16:26:32,713] Trial 2 finished with value: -0.0016386177864452503 and parameters: {'model_type': 'mlp', 'hidden_dims': '[256, 128, 64]', 'dropout': 0.41314357415569625, 'batch_norm': False, 'lr': 3.952233718592101e-06, 'weight_decay': 0.00026754769258252603, 'epochs': 149, 'loss': 'mse', 'optimizer': 'adam', 'graph_mode': 'off', 'use_snp_selection': True, 'num_snps': 11571}. Best is trial 1 with value: 0.05312952392742959.
[I 2025-12-05 16:26:34,573] Trial 3 finished with value: 0.01647880489520304 and parameters: {'model_type': 'mlp', 'hidden_dims': '[512, 64]', 'dropout': 0.5938127374509361, 'batch_norm': False, 'lr': 5.67704586114731e-06, 'weight_decay': 2.4518087630137052e-05, 'epochs': 320, 'loss': 'mae', 'optimizer': 'adam', 'graph_mode': 'off', 'use_snp_selection': False}. Best is trial 1 with value: 0.05312952392742959.
[I 2025-12-05 16:26:36,828] Trial 4 finished with value: -0.0072470199811527575 and parameters: {'model_type': 'mlp', 'hidden_dims': '[512, 128]', 'dropout': 0.25746343592134413, 'batch_norm': True, 'lr': 1.3467657668402788e-06, 'weight_decay': 0.00033087251918647806, 'epochs': 277, 'loss': 'mse', 'optimizer': 'adam', 'graph_mode': 'off', 'use_snp_selection': True, 'num_snps': 36675}. Best is trial 1 with value: 0.05312952392742959.
[I 2025-12-05 16:26:38,632] Trial 5 finished with value: -0.03639616021052662 and parameters: {'model_type': 'mlp', 'hidden_dims': '[512, 64]', 'dropout': 0.38275350994408375, 'batch_norm': True, 'lr': 1.5586664309232824e-06, 'weight_decay': 0.0008227664668621182, 'epochs': 145, 'loss': 'mae', 'optimizer': 'adam', 'graph_mode': 'off', 'use_snp_selection': True, 'num_snps': 32148}. Best is trial 1 with value: 0.05312952392742959.
[I 2025-12-05 16:26:39,597] Trial 6 finished with value: 0.01530235997898375 and parameters: {'model_type': 'mlp', 'hidden_dims': '[256, 128]', 'dropout': 0.3930109900265879, 'batch_norm': False, 'lr': 4.892964372128395e-05, 'weight_decay': 1.5809549317992182e-06, 'epochs': 199, 'loss': 'mse', 'optimizer': 'adam', 'graph_mode': 'off', 'use_snp_selection': False}. Best is trial 1 with value: 0.05312952392742959.
[I 2025-12-05 16:26:40,615] Trial 7 finished with value: 0.06300797130501118 and parameters: {'model_type': 'mlp', 'hidden_dims': '[512, 256]', 'dropout': 0.15343979219678458, 'batch_norm': True, 'lr': 6.234003099047341e-05, 'weight_decay': 3.894760610535477e-07, 'epochs': 97, 'loss': 'mse', 'optimizer': 'adam', 'graph_mode': 'off', 'use_snp_selection': False}. Best is trial 7 with value: 0.06300797130501118.
[I 2025-12-05 16:26:42,458] Trial 8 finished with value: 0.06328747848408253 and parameters: {'model_type': 'mlp', 'hidden_dims': '[512, 128]', 'dropout': 0.10743001231661406, 'batch_norm': True, 'lr': 0.00023728538449271062, 'weight_decay': 1.7629071578048637e-05, 'epochs': 312, 'loss': 'mae', 'optimizer': 'adam', 'graph_mode': 'off', 'use_snp_selection': False}. Best is trial 8 with value: 0.06328747848408253.
[I 2025-12-05 16:26:43,812] Trial 9 finished with value: 0.03412054307290563 and parameters: {'model_type': 'mlp', 'hidden_dims': '[512, 64]', 'dropout': 0.14505336736221927, 'batch_norm': True, 'lr': 5.8619638388111826e-05, 'weight_decay': 6.200156172669308e-07, 'epochs': 175, 'loss': 'mse', 'optimizer': 'adam', 'graph_mode': 'off', 'use_snp_selection': False}. Best is trial 8 with value: 0.06328747848408253.
[I 2025-12-05 16:26:44,710] Trial 10 finished with value: 0.0035294695911792886 and parameters: {'model_type': 'mlp', 'hidden_dims': '[512, 128]', 'dropout': 0.2800030442581858, 'batch_norm': False, 'lr': 0.0004919806695968258, 'weight_decay': 2.9953888095455486e-06, 'epochs': 55, 'loss': 'mae', 'optimizer': 'adam', 'graph_mode': 'off', 'use_snp_selection': False}. Best is trial 8 with value: 0.06328747848408253.
[I 2025-12-05 16:26:45,664] Trial 11 finished with value: 0.057754467668728084 and parameters: {'model_type': 'mlp', 'hidden_dims': '[512, 256]', 'dropout': 0.10095648685224448, 'batch_norm': True, 'lr': 0.0003926892266729099, 'weight_decay': 3.172181990533228e-07, 'epochs': 70, 'loss': 'mse', 'optimizer': 'adam', 'graph_mode': 'off', 'use_snp_selection': False}. Best is trial 8 with value: 0.06328747848408253.
[I 2025-12-05 16:26:46,789] Trial 12 finished with value: 0.07226820936961251 and parameters: {'model_type': 'mlp', 'hidden_dims': '[512, 256]', 'dropout': 0.18206399419301494, 'batch_norm': True, 'lr': 0.00026576228959612443, 'weight_decay': 1.3081036432574914e-07, 'epochs': 115, 'loss': 'mae', 'optimizer': 'adam', 'graph_mode': 'off', 'use_snp_selection': False}. Best is trial 12 with value: 0.07226820936961251.
[I 2025-12-05 16:26:48,352] Trial 13 finished with value: 0.05831213800691838 and parameters: {'model_type': 'mlp', 'hidden_dims': '[512, 128]', 'dropout': 0.24979042359621412, 'batch_norm': True, 'lr': 0.00020263148232071683, 'weight_decay': 1.0885943577911259e-07, 'epochs': 237, 'loss': 'mae', 'optimizer': 'adam', 'graph_mode': 'off', 'use_snp_selection': False}. Best is trial 12 with value: 0.07226820936961251.
[I 2025-12-05 16:26:49,455] Trial 14 finished with value: 0.05414375163127908 and parameters: {'model_type': 'mlp', 'hidden_dims': '[512, 256]', 'dropout': 0.20199016384833104, 'batch_norm': True, 'lr': 0.0008727274377671657, 'weight_decay': 4.57067734295802e-06, 'epochs': 117, 'loss': 'mae', 'optimizer': 'adam', 'graph_mode': 'off', 'use_snp_selection': False}. Best is trial 12 with value: 0.07226820936961251.
[I 2025-12-05 16:26:50,373] Trial 15 finished with value: 0.0637479087561223 and parameters: {'model_type': 'mlp', 'hidden_dims': '[128, 64]', 'dropout': 0.10283653531299912, 'batch_norm': True, 'lr': 0.0001637201916360417, 'weight_decay': 6.682546297843178e-05, 'epochs': 279, 'loss': 'mae', 'optimizer': 'adam', 'graph_mode': 'off', 'use_snp_selection': False}. Best is trial 12 with value: 0.07226820936961251.
