[I 2025-12-05 16:04:40,941] Trial 110 finished with value: 0.05295318192506853 and parameters: {'model_type': 'mlp', 'hidden_dims': '[512, 256]', 'dropout': 0.14042663975542605, 'batch_norm': True, 'lr': 6.484619144909819e-05, 'weight_decay': 4.49826633489668e-06, 'epochs': 210, 'loss': 'mse', 'optimizer': 'adam', 'graph_mode': 'off', 'use_snp_selection': True, 'num_snps': 28820}. Best is trial 30 with value: 0.11646223412731632.
[I 2025-12-05 16:04:41,998] Trial 111 finished with value: 0.10111296545272744 and parameters: {'model_type': 'mlp', 'hidden_dims': '[256, 128, 64]', 'dropout': 0.25683854941357565, 'batch_norm': False, 'lr': 1.9010023182861165e-05, 'weight_decay': 6.310947948440098e-07, 'epochs': 108, 'loss': 'mae', 'optimizer': 'adam', 'graph_mode': 'off', 'use_snp_selection': False}. Best is trial 30 with value: 0.11646223412731632.
[I 2025-12-05 16:04:42,948] Trial 112 finished with value: 0.059646692381082826 and parameters: {'model_type': 'mlp', 'hidden_dims': '[256, 128, 64]', 'dropout': 0.24613400413100792, 'batch_norm': False, 'lr': 1.5982848296353132e-05, 'weight_decay': 2.3825032069274315e-07, 'epochs': 76, 'loss': 'mae', 'optimizer': 'adam', 'graph_mode': 'off', 'use_snp_selection': False}. Best is trial 30 with value: 0.11646223412731632.
[I 2025-12-05 16:04:44,081] Trial 113 finished with value: 0.0870431973578618 and parameters: {'model_type': 'mlp', 'hidden_dims': '[256, 128, 64]', 'dropout': 0.16207293274881865, 'batch_norm': False, 'lr': 2.6153552379168622e-05, 'weight_decay': 3.6159285109186545e-07, 'epochs': 127, 'loss': 'mae', 'optimizer': 'adam', 'graph_mode': 'off', 'use_snp_selection': False}. Best is trial 30 with value: 0.11646223412731632.
[I 2025-12-05 16:04:45,282] Trial 114 finished with value: 0.08931565199048706 and parameters: {'model_type': 'mlp', 'hidden_dims': '[256, 128, 64]', 'dropout': 0.2139315040235562, 'batch_norm': False, 'lr': 2.140928439085486e-05, 'weight_decay': 1.3101678088193754e-07, 'epochs': 148, 'loss': 'mae', 'optimizer': 'adam', 'graph_mode': 'off', 'use_snp_selection': False}. Best is trial 30 with value: 0.11646223412731632.
[I 2025-12-05 16:04:46,358] Trial 115 finished with value: 0.12383126693046277 and parameters: {'model_type': 'mlp', 'hidden_dims': '[256, 128, 64]', 'dropout': 0.17887103547720765, 'batch_norm': False, 'lr': 3.489896026013936e-05, 'weight_decay': 2.7946129625584506e-07, 'epochs': 115, 'loss': 'mae', 'optimizer': 'adam', 'graph_mode': 'off', 'use_snp_selection': False}. Best is trial 115 with value: 0.12383126693046277.
[I 2025-12-05 16:04:47,804] Trial 116 finished with value: 0.08204661135505484 and parameters: {'model_type': 'mlp', 'hidden_dims': '[256, 128, 64]', 'dropout': 0.1760956251189999, 'batch_norm': False, 'lr': 0.0004904088209274826, 'weight_decay': 1.7102529466847503e-07, 'epochs': 222, 'loss': 'mae', 'optimizer': 'adam', 'graph_mode': 'off', 'use_snp_selection': False}. Best is trial 115 with value: 0.12383126693046277.
[I 2025-12-05 16:04:49,129] Trial 117 finished with value: 0.10985449873216387 and parameters: {'model_type': 'mlp', 'hidden_dims': '[256, 128]', 'dropout': 0.19392080410383464, 'batch_norm': False, 'lr': 5.161719542512796e-05, 'weight_decay': 0.00010666683540823496, 'epochs': 190, 'loss': 'mae', 'optimizer': 'adam', 'graph_mode': 'off', 'use_snp_selection': False}. Best is trial 115 with value: 0.12383126693046277.
[I 2025-12-05 16:04:50,427] Trial 118 finished with value: 0.0935389311691863 and parameters: {'model_type': 'mlp', 'hidden_dims': '[256, 128]', 'dropout': 0.1849462258202221, 'batch_norm': False, 'lr': 5.0961283536566115e-05, 'weight_decay': 0.00010101931328054955, 'epochs': 192, 'loss': 'mae', 'optimizer': 'adam', 'graph_mode': 'off', 'use_snp_selection': False}. Best is trial 115 with value: 0.12383126693046277.
[I 2025-12-05 16:04:53,118] Trial 119 finished with value: 0.06721795164600343 and parameters: {'model_type': 'mlp', 'hidden_dims': '[256, 128]', 'dropout': 0.19483032612222606, 'batch_norm': False, 'lr': 4.2547863885480754e-05, 'weight_decay': 5.4004179518717207e-05, 'epochs': 208, 'loss': 'mse', 'optimizer': 'adam', 'graph_mode': 'off', 'use_snp_selection': True, 'num_snps': 45158}. Best is trial 115 with value: 0.12383126693046277.
[I 2025-12-05 16:04:54,214] Trial 120 finished with value: 0.07258564285231528 and parameters: {'model_type': 'mlp', 'hidden_dims': '[256, 128]', 'dropout': 0.16979699615852994, 'batch_norm': True, 'lr': 9.577559088607656e-05, 'weight_decay': 4.41335291579947e-07, 'epochs': 118, 'loss': 'mae', 'optimizer': 'adam', 'graph_mode': 'off', 'use_snp_selection': False}. Best is trial 115 with value: 0.12383126693046277.
[I 2025-12-05 16:04:55,162] Trial 121 finished with value: 0.08306631056331633 and parameters: {'model_type': 'mlp', 'hidden_dims': '[128, 64]', 'dropout': 0.22268959625386991, 'batch_norm': False, 'lr': 3.526180318665351e-05, 'weight_decay': 0.00014198524922132155, 'epochs': 188, 'loss': 'mae', 'optimizer': 'adam', 'graph_mode': 'off', 'use_snp_selection': False}. Best is trial 115 with value: 0.12383126693046277.
[I 2025-12-05 16:04:56,037] Trial 122 finished with value: 0.06190622370516704 and parameters: {'model_type': 'mlp', 'hidden_dims': '[256, 128]', 'dropout': 0.15660024680161191, 'batch_norm': False, 'lr': 0.00011937657660380763, 'weight_decay': 1.3161019935950194e-07, 'epochs': 59, 'loss': 'mae', 'optimizer': 'adam', 'graph_mode': 'off', 'use_snp_selection': False}. Best is trial 115 with value: 0.12383126693046277.
[I 2025-12-05 16:04:57,033] Trial 123 finished with value: 0.11074718246408397 and parameters: {'model_type': 'mlp', 'hidden_dims': '[256, 128]', 'dropout': 0.2098792183393618, 'batch_norm': False, 'lr': 6.0826864813850845e-05, 'weight_decay': 3.0812390986585922e-06, 'epochs': 98, 'loss': 'mae', 'optimizer': 'adam', 'graph_mode': 'off', 'use_snp_selection': False}. Best is trial 115 with value: 0.12383126693046277.
[I 2025-12-05 16:04:58,032] Trial 124 finished with value: 0.09651392734251235 and parameters: {'model_type': 'mlp', 'hidden_dims': '[256, 128]', 'dropout': 0.1878613992125533, 'batch_norm': False, 'lr': 6.130721593610213e-05, 'weight_decay': 0.0002245346271089771, 'epochs': 99, 'loss': 'mae', 'optimizer': 'adam', 'graph_mode': 'off', 'use_snp_selection': False}. Best is trial 115 with value: 0.12383126693046277.
[I 2025-12-05 16:04:59,406] Trial 125 finished with value: 0.09458878594969768 and parameters: {'model_type': 'mlp', 'hidden_dims': '[256, 128]', 'dropout': 0.21110931200897862, 'batch_norm': False, 'lr': 7.215337456052065e-05, 'weight_decay': 2.525255545640686e-06, 'epochs': 202, 'loss': 'mae', 'optimizer': 'adam', 'graph_mode': 'off', 'use_snp_selection': False}. Best is trial 115 with value: 0.12383126693046277.
[I 2025-12-05 16:05:00,710] Trial 126 finished with value: 0.07119150521333488 and parameters: {'model_type': 'mlp', 'hidden_dims': '[256, 128]', 'dropout': 0.20158408779891152, 'batch_norm': False, 'lr': 5.262728625003739e-05, 'weight_decay': 3.4574121882125166e-06, 'epochs': 180, 'loss': 'mae', 'optimizer': 'adam', 'graph_mode': 'off', 'use_snp_selection': False}. Best is trial 115 with value: 0.12383126693046277.
[I 2025-12-05 16:05:01,765] Trial 127 finished with value: 0.10420431917238104 and parameters: {'model_type': 'mlp', 'hidden_dims': '[256, 128]', 'dropout': 0.17197613349106747, 'batch_norm': False, 'lr': 0.0009611330732259912, 'weight_decay': 1.6953328508148377e-06, 'epochs': 114, 'loss': 'mae', 'optimizer': 'adam', 'graph_mode': 'off', 'use_snp_selection': False}. Best is trial 115 with value: 0.12383126693046277.
[I 2025-12-05 16:05:03,540] Trial 128 finished with value: 0.06682207310883813 and parameters: {'model_type': 'mlp', 'hidden_dims': '[512, 128]', 'dropout': 0.36770685020528715, 'batch_norm': False, 'lr': 8.211386100342568e-05, 'weight_decay': 1.032427878808572e-06, 'epochs': 93, 'loss': 'mse', 'optimizer': 'adam', 'graph_mode': 'off', 'use_snp_selection': True, 'num_snps': 22616}. Best is trial 115 with value: 0.12383126693046277.
[I 2025-12-05 16:05:05,212] Trial 129 finished with value: 0.09672935515017898 and parameters: {'model_type': 'mlp', 'hidden_dims': '[512, 256]', 'dropout': 0.5836189066276347, 'batch_norm': False, 'lr': 3.034375630403618e-05, 'weight_decay': 2.581695717582814e-07, 'epochs': 122, 'loss': 'mae', 'optimizer': 'adam', 'graph_mode': 'off', 'use_snp_selection': False}. Best is trial 115 with value: 0.12383126693046277.
[I 2025-12-05 16:05:06,572] Trial 130 finished with value: 0.037174920869300666 and parameters: {'model_type': 'mlp', 'hidden_dims': '[256, 128]', 'dropout': 0.5388946319274776, 'batch_norm': True, 'lr': 5.0201952680118403e-05, 'weight_decay': 2.0496616016081538e-07, 'epochs': 197, 'loss': 'mae', 'optimizer': 'adam', 'graph_mode': 'off', 'use_snp_selection': False}. Best is trial 115 with value: 0.12383126693046277.
[I 2025-12-05 16:05:07,604] Trial 131 finished with value: 0.11006863576091509 and parameters: {'model_type': 'mlp', 'hidden_dims': '[256, 128]', 'dropout': 0.172384290995228, 'batch_norm': False, 'lr': 0.0009289505499728868, 'weight_decay': 1.7718765950287098e-06, 'epochs': 111, 'loss': 'mae', 'optimizer': 'adam', 'graph_mode': 'off', 'use_snp_selection': False}. Best is trial 115 with value: 0.12383126693046277.
[I 2025-12-05 16:05:08,699] Trial 132 finished with value: 0.08626299551606353 and parameters: {'model_type': 'mlp', 'hidden_dims': '[256, 128]', 'dropout': 0.5122205336339544, 'batch_norm': False, 'lr': 0.0006584452275045404, 'weight_decay': 1.5701586971236586e-07, 'epochs': 130, 'loss': 'mae', 'optimizer': 'adam', 'graph_mode': 'off', 'use_snp_selection': False}. Best is trial 115 with value: 0.12383126693046277.
[I 2025-12-05 16:05:09,680] Trial 133 finished with value: 0.08981529894377133 and parameters: {'model_type': 'mlp', 'hidden_dims': '[256, 128]', 'dropout': 0.14353591720483916, 'batch_norm': False, 'lr': 0.00028384598436857983, 'weight_decay': 0.00010574534211693673, 'epochs': 98, 'loss': 'mae', 'optimizer': 'adam', 'graph_mode': 'off', 'use_snp_selection': False}. Best is trial 115 with value: 0.12383126693046277.
[I 2025-12-05 16:05:10,697] Trial 134 finished with value: 0.09833676216722184 and parameters: {'model_type': 'mlp', 'hidden_dims': '[256, 128]', 'dropout': 0.1824926469235153, 'batch_norm': False, 'lr': 5.812231727159055e-05, 'weight_decay': 4.191799053249232e-06, 'epochs': 106, 'loss': 'mae', 'optimizer': 'adam', 'graph_mode': 'off', 'use_snp_selection': False}. Best is trial 115 with value: 0.12383126693046277.
[I 2025-12-05 16:05:12,323] Trial 135 finished with value: 0.08293892195889202 and parameters: {'model_type': 'mlp', 'hidden_dims': '[512, 256]', 'dropout': 0.1574889979626119, 'batch_norm': False, 'lr': 0.0008313067755083411, 'weight_decay': 2.148260965110309e-06, 'epochs': 123, 'loss': 'mae', 'optimizer': 'adam', 'graph_mode': 'off', 'use_snp_selection': False}. Best is trial 115 with value: 0.12383126693046277.
[I 2025-12-05 16:05:13,218] Trial 136 finished with value: 0.06474527249687195 and parameters: {'model_type': 'mlp', 'hidden_dims': '[256, 128]', 'dropout': 0.193026831971749, 'batch_norm': False, 'lr': 0.0005491701000646469, 'weight_decay': 3.2711540859680887e-06, 'epochs': 83, 'loss': 'mae', 'optimizer': 'adam', 'graph_mode': 'off', 'use_snp_selection': False}. Best is trial 115 with value: 0.12383126693046277.
[I 2025-12-05 16:05:14,611] Trial 137 finished with value: 0.07703215061315563 and parameters: {'model_type': 'mlp', 'hidden_dims': '[256, 128]', 'dropout': 0.2275338501531511, 'batch_norm': False, 'lr': 4.082940613727058e-05, 'weight_decay': 0.0004403116471223286, 'epochs': 225, 'loss': 'mae', 'optimizer': 'adam', 'graph_mode': 'off', 'use_snp_selection': False}. Best is trial 115 with value: 0.12383126693046277.
[I 2025-12-05 16:05:16,265] Trial 138 finished with value: 0.06080465183474991 and parameters: {'model_type': 'mlp', 'hidden_dims': '[512, 256]', 'dropout': 0.20456027841709648, 'batch_norm': False, 'lr': 7.073582753274431e-05, 'weight_decay': 1.0491594137320056e-05, 'epochs': 243, 'loss': 'mse', 'optimizer': 'adam', 'graph_mode': 'off', 'use_snp_selection': True, 'num_snps': 13022}. Best is trial 115 with value: 0.12383126693046277.
[I 2025-12-05 16:05:18,643] Trial 139 finished with value: 0.10174847060794032 and parameters: {'model_type': 'mlp', 'hidden_dims': '[512, 64]', 'dropout': 0.17505943106023156, 'batch_norm': True, 'lr': 0.0007811823099249053, 'weight_decay': 3.137106459217439e-07, 'epochs': 215, 'loss': 'mae', 'optimizer': 'adam', 'graph_mode': 'off', 'use_snp_selection': False}. Best is trial 115 with value: 0.12383126693046277.
[I 2025-12-05 16:05:19,781] Trial 140 finished with value: 0.10467354950317875 and parameters: {'model_type': 'mlp', 'hidden_dims': '[256, 128]', 'dropout': 0.1655269298851189, 'batch_norm': False, 'lr': 4.683019497526612e-05, 'weight_decay': 1.2162522975939705e-07, 'epochs': 135, 'loss': 'mae', 'optimizer': 'adam', 'graph_mode': 'off', 'use_snp_selection': False}. Best is trial 115 with value: 0.12383126693046277.
[I 2025-12-05 16:05:20,917] Trial 141 finished with value: 0.09449245170440917 and parameters: {'model_type': 'mlp', 'hidden_dims': '[256, 128]', 'dropout': 0.16454954045686637, 'batch_norm': False, 'lr': 4.651466630932622e-05, 'weight_decay': 1.192328190234318e-07, 'epochs': 138, 'loss': 'mae', 'optimizer': 'adam', 'graph_mode': 'off', 'use_snp_selection': False}. Best is trial 115 with value: 0.12383126693046277.
[I 2025-12-05 16:05:22,125] Trial 142 finished with value: 0.10165510268400332 and parameters: {'model_type': 'mlp', 'hidden_dims': '[256, 128]', 'dropout': 0.12359276971792649, 'batch_norm': False, 'lr': 3.629740476211317e-05, 'weight_decay': 1.9278930936380087e-07, 'epochs': 157, 'loss': 'mae', 'optimizer': 'adam', 'graph_mode': 'off', 'use_snp_selection': False}. Best is trial 115 with value: 0.12383126693046277.
[I 2025-12-05 16:05:23,256] Trial 143 finished with value: 0.08997575869501401 and parameters: {'model_type': 'mlp', 'hidden_dims': '[256, 128]', 'dropout': 0.1952359337665751, 'batch_norm': False, 'lr': 5.562320796276483e-05, 'weight_decay': 1.4590821802087294e-07, 'epochs': 146, 'loss': 'mae', 'optimizer': 'adam', 'graph_mode': 'off', 'use_snp_selection': False}. Best is trial 115 with value: 0.12383126693046277.
[I 2025-12-05 16:05:24,246] Trial 144 finished with value: 0.07761162187105625 and parameters: {'model_type': 'mlp', 'hidden_dims': '[256, 128]', 'dropout': 0.2151702577671773, 'batch_norm': False, 'lr': 3.305487941122795e-05, 'weight_decay': 1.192655607385285e-07, 'epochs': 110, 'loss': 'mae', 'optimizer': 'adam', 'graph_mode': 'off', 'use_snp_selection': False}. Best is trial 115 with value: 0.12383126693046277.
[I 2025-12-05 16:05:25,220] Trial 145 finished with value: 0.11061965431749127 and parameters: {'model_type': 'mlp', 'hidden_dims': '[128, 64]', 'dropout': 0.1808416271624165, 'batch_norm': False, 'lr': 4.2054643644651744e-05, 'weight_decay': 7.351318919713749e-06, 'epochs': 232, 'loss': 'mae', 'optimizer': 'adam', 'graph_mode': 'off', 'use_snp_selection': False}. Best is trial 115 with value: 0.12383126693046277.
[I 2025-12-05 16:05:26,196] Trial 146 finished with value: 0.07596525425891844 and parameters: {'model_type': 'mlp', 'hidden_dims': '[128, 64]', 'dropout': 0.17827783118585186, 'batch_norm': False, 'lr': 2.700015001050982e-05, 'weight_decay': 6.690550555458086e-06, 'epochs': 233, 'loss': 'mae', 'optimizer': 'adam', 'graph_mode': 'off', 'use_snp_selection': False}. Best is trial 115 with value: 0.12383126693046277.
[I 2025-12-05 16:05:27,201] Trial 147 finished with value: 0.08761871948702034 and parameters: {'model_type': 'mlp', 'hidden_dims': '[128, 64]', 'dropout': 0.15196871023869832, 'batch_norm': False, 'lr': 0.0003752935525223675, 'weight_decay': 9.124047487148517e-06, 'epochs': 249, 'loss': 'mae', 'optimizer': 'adam', 'graph_mode': 'off', 'use_snp_selection': False}. Best is trial 115 with value: 0.12383126693046277.
[I 2025-12-05 16:05:30,075] Trial 148 finished with value: 0.06331391858065546 and parameters: {'model_type': 'mlp', 'hidden_dims': '[128, 64]', 'dropout': 0.1363358257021554, 'batch_norm': False, 'lr': 6.295103173394356e-06, 'weight_decay': 7.499945447097533e-06, 'epochs': 220, 'loss': 'mse', 'optimizer': 'adam', 'graph_mode': 'off', 'use_snp_selection': True, 'num_snps': 55403}. Best is trial 115 with value: 0.12383126693046277.
[I 2025-12-05 16:05:31,180] Trial 149 finished with value: 0.08684252868133434 and parameters: {'model_type': 'mlp', 'hidden_dims': '[128, 64]', 'dropout': 0.18381567995574913, 'batch_norm': True, 'lr': 9.780576933183354e-05, 'weight_decay': 5.127003783850991e-06, 'epochs': 261, 'loss': 'mae', 'optimizer': 'adam', 'graph_mode': 'off', 'use_snp_selection': False}. Best is trial 115 with value: 0.12383126693046277.
[I 2025-12-05 16:05:34,459] Trial 0 finished with value: 0.0453626397582397 and parameters: {'model_type': 'mlp', 'hidden_dims': '[128, 64]', 'dropout': 0.199031432379812, 'batch_norm': True, 'lr': 1.8408544111075837e-06, 'weight_decay': 5.5136510071208614e-05, 'epochs': 336, 'loss': 'mae', 'optimizer': 'adam', 'graph_mode': 'off', 'use_snp_selection': True, 'num_snps': 43862}. Best is trial 0 with value: 0.0453626397582397.
[I 2025-12-05 16:05:36,630] Trial 1 finished with value: 0.09880329189489322 and parameters: {'model_type': 'mlp', 'hidden_dims': '[256, 128]', 'dropout': 0.4370668075331726, 'batch_norm': True, 'lr': 7.133471581159139e-05, 'weight_decay': 1.128633586803549e-05, 'epochs': 242, 'loss': 'mae', 'optimizer': 'adam', 'graph_mode': 'off', 'use_snp_selection': False}. Best is trial 1 with value: 0.09880329189489322.
[I 2025-12-05 16:05:38,383] Trial 2 finished with value: 0.05283640956562721 and parameters: {'model_type': 'mlp', 'hidden_dims': '[256, 128, 64]', 'dropout': 0.41314357415569625, 'batch_norm': False, 'lr': 3.952233718592101e-06, 'weight_decay': 0.00026754769258252603, 'epochs': 149, 'loss': 'mse', 'optimizer': 'adam', 'graph_mode': 'off', 'use_snp_selection': True, 'num_snps': 11571}. Best is trial 1 with value: 0.09880329189489322.
[I 2025-12-05 16:05:42,833] Trial 3 finished with value: 0.12214153541306305 and parameters: {'model_type': 'mlp', 'hidden_dims': '[512, 64]', 'dropout': 0.5938127374509361, 'batch_norm': False, 'lr': 5.67704586114731e-06, 'weight_decay': 2.4518087630137052e-05, 'epochs': 320, 'loss': 'mae', 'optimizer': 'adam', 'graph_mode': 'off', 'use_snp_selection': False}. Best is trial 3 with value: 0.12214153541306305.
[I 2025-12-05 16:05:47,152] Trial 4 finished with value: 0.1027693716427615 and parameters: {'model_type': 'mlp', 'hidden_dims': '[512, 128]', 'dropout': 0.25746343592134413, 'batch_norm': True, 'lr': 1.3467657668402788e-06, 'weight_decay': 0.00033087251918647806, 'epochs': 277, 'loss': 'mse', 'optimizer': 'adam', 'graph_mode': 'off', 'use_snp_selection': True, 'num_snps': 36675}. Best is trial 3 with value: 0.12214153541306305.
[I 2025-12-05 16:05:50,310] Trial 5 finished with value: 0.009044708304224087 and parameters: {'model_type': 'mlp', 'hidden_dims': '[512, 64]', 'dropout': 0.38275350994408375, 'batch_norm': True, 'lr': 1.5586664309232824e-06, 'weight_decay': 0.0008227664668621182, 'epochs': 145, 'loss': 'mae', 'optimizer': 'adam', 'graph_mode': 'off', 'use_snp_selection': True, 'num_snps': 32148}. Best is trial 3 with value: 0.12214153541306305.
[I 2025-12-05 16:05:52,201] Trial 6 finished with value: 0.10769153705489604 and parameters: {'model_type': 'mlp', 'hidden_dims': '[256, 128]', 'dropout': 0.3930109900265879, 'batch_norm': False, 'lr': 4.892964372128395e-05, 'weight_decay': 1.5809549317992182e-06, 'epochs': 199, 'loss': 'mse', 'optimizer': 'adam', 'graph_mode': 'off', 'use_snp_selection': False}. Best is trial 3 with value: 0.12214153541306305.
[I 2025-12-05 16:05:54,090] Trial 7 finished with value: 0.09041153885529785 and parameters: {'model_type': 'mlp', 'hidden_dims': '[512, 256]', 'dropout': 0.15343979219678458, 'batch_norm': True, 'lr': 6.234003099047341e-05, 'weight_decay': 3.894760610535477e-07, 'epochs': 97, 'loss': 'mse', 'optimizer': 'adam', 'graph_mode': 'off', 'use_snp_selection': False}. Best is trial 3 with value: 0.12214153541306305.
[I 2025-12-05 16:05:58,467] Trial 8 finished with value: 0.12646982275363725 and parameters: {'model_type': 'mlp', 'hidden_dims': '[512, 128]', 'dropout': 0.10743001231661406, 'batch_norm': True, 'lr': 0.00023728538449271062, 'weight_decay': 1.7629071578048637e-05, 'epochs': 312, 'loss': 'mae', 'optimizer': 'adam', 'graph_mode': 'off', 'use_snp_selection': False}. Best is trial 8 with value: 0.12646982275363725.
[I 2025-12-05 16:06:01,286] Trial 9 finished with value: 0.12239139060003283 and parameters: {'model_type': 'mlp', 'hidden_dims': '[512, 64]', 'dropout': 0.14505336736221927, 'batch_norm': True, 'lr': 5.8619638388111826e-05, 'weight_decay': 6.200156172669308e-07, 'epochs': 175, 'loss': 'mse', 'optimizer': 'adam', 'graph_mode': 'off', 'use_snp_selection': False}. Best is trial 8 with value: 0.12646982275363725.
[I 2025-12-05 16:06:02,713] Trial 10 finished with value: 0.013345432642174018 and parameters: {'model_type': 'mlp', 'hidden_dims': '[512, 128]', 'dropout': 0.2800030442581858, 'batch_norm': False, 'lr': 0.0004919806695968258, 'weight_decay': 2.9953888095455486e-06, 'epochs': 55, 'loss': 'mae', 'optimizer': 'adam', 'graph_mode': 'off', 'use_snp_selection': False}. Best is trial 8 with value: 0.12646982275363725.
[I 2025-12-05 16:06:06,017] Trial 11 finished with value: 0.1427928499948129 and parameters: {'model_type': 'mlp', 'hidden_dims': '[512, 128]', 'dropout': 0.10095648685224448, 'batch_norm': True, 'lr': 0.0003411435764085616, 'weight_decay': 1.2045055692919657e-07, 'epochs': 216, 'loss': 'mse', 'optimizer': 'adam', 'graph_mode': 'off', 'use_snp_selection': False}. Best is trial 11 with value: 0.1427928499948129.
