[I 2025-12-05 15:44:02,189] Trial 86 finished with value: 0.08417341146616095 and parameters: {'model_type': 'mlp', 'hidden_dims': '[512, 128]', 'dropout': 0.13232398703395432, 'batch_norm': False, 'lr': 2.5207910582382585e-05, 'weight_decay': 0.00025575432892807176, 'epochs': 327, 'loss': 'mae', 'optimizer': 'adam', 'graph_mode': 'off', 'use_snp_selection': False}. Best is trial 46 with value: 0.1006960060302028.
[I 2025-12-05 15:44:04,069] Trial 87 finished with value: 0.07405311406254284 and parameters: {'model_type': 'mlp', 'hidden_dims': '[512, 256]', 'dropout': 0.18504167284700665, 'batch_norm': False, 'lr': 6.720194968076633e-05, 'weight_decay': 0.00028152291821373175, 'epochs': 308, 'loss': 'mae', 'optimizer': 'adam', 'graph_mode': 'off', 'use_snp_selection': False}. Best is trial 46 with value: 0.1006960060302028.
[I 2025-12-05 15:44:05,919] Trial 88 finished with value: 0.05787654794841689 and parameters: {'model_type': 'mlp', 'hidden_dims': '[512, 256]', 'dropout': 0.15669587203062915, 'batch_norm': False, 'lr': 2.6077435972469993e-05, 'weight_decay': 8.222513381951536e-05, 'epochs': 298, 'loss': 'mae', 'optimizer': 'adam', 'graph_mode': 'off', 'use_snp_selection': False}. Best is trial 46 with value: 0.1006960060302028.
[I 2025-12-05 15:44:07,523] Trial 89 finished with value: 0.07249459701780617 and parameters: {'model_type': 'mlp', 'hidden_dims': '[512, 128]', 'dropout': 0.1357544021095322, 'batch_norm': False, 'lr': 4.438734783892603e-05, 'weight_decay': 0.000516594690978786, 'epochs': 326, 'loss': 'mae', 'optimizer': 'adam', 'graph_mode': 'off', 'use_snp_selection': True, 'num_snps': 19247}. Best is trial 46 with value: 0.1006960060302028.
[I 2025-12-05 15:44:09,536] Trial 90 finished with value: 0.04529859392397923 and parameters: {'model_type': 'mlp', 'hidden_dims': '[512, 256]', 'dropout': 0.4014948137896421, 'batch_norm': True, 'lr': 8.257239151709969e-05, 'weight_decay': 2.4302550671666427e-05, 'epochs': 344, 'loss': 'mae', 'optimizer': 'adam', 'graph_mode': 'off', 'use_snp_selection': False}. Best is trial 46 with value: 0.1006960060302028.
[I 2025-12-05 15:44:11,337] Trial 91 finished with value: 0.06835668317496287 and parameters: {'model_type': 'mlp', 'hidden_dims': '[512, 128]', 'dropout': 0.11953158687672434, 'batch_norm': False, 'lr': 3.279083308527396e-05, 'weight_decay': 0.00017783111955358376, 'epochs': 286, 'loss': 'mae', 'optimizer': 'adam', 'graph_mode': 'off', 'use_snp_selection': False}. Best is trial 46 with value: 0.1006960060302028.
[I 2025-12-05 15:44:13,261] Trial 92 finished with value: 0.04727405959282402 and parameters: {'model_type': 'mlp', 'hidden_dims': '[512, 128]', 'dropout': 0.5463570493945649, 'batch_norm': False, 'lr': 2.501265442195055e-05, 'weight_decay': 0.0002569159247269874, 'epochs': 320, 'loss': 'mae', 'optimizer': 'adam', 'graph_mode': 'off', 'use_snp_selection': False}. Best is trial 46 with value: 0.1006960060302028.
[I 2025-12-05 15:44:14,698] Trial 93 finished with value: 0.05501616464777029 and parameters: {'model_type': 'mlp', 'hidden_dims': '[512, 128]', 'dropout': 0.13326258831088458, 'batch_norm': False, 'lr': 4.770170709901433e-06, 'weight_decay': 0.00043980098173789325, 'epochs': 185, 'loss': 'mae', 'optimizer': 'adam', 'graph_mode': 'off', 'use_snp_selection': False}. Best is trial 46 with value: 0.1006960060302028.
[I 2025-12-05 15:44:16,643] Trial 94 finished with value: 0.06298039127585704 and parameters: {'model_type': 'mlp', 'hidden_dims': '[512, 128]', 'dropout': 0.2806921101615007, 'batch_norm': False, 'lr': 5.5887417425590955e-05, 'weight_decay': 0.00014885264517104402, 'epochs': 338, 'loss': 'mae', 'optimizer': 'adam', 'graph_mode': 'off', 'use_snp_selection': False}. Best is trial 46 with value: 0.1006960060302028.
[I 2025-12-05 15:44:17,460] Trial 95 finished with value: 0.018734528169712456 and parameters: {'model_type': 'mlp', 'hidden_dims': '[128, 64]', 'dropout': 0.5063328563960321, 'batch_norm': False, 'lr': 9.678155301551367e-05, 'weight_decay': 0.00010502403084198808, 'epochs': 158, 'loss': 'mae', 'optimizer': 'adam', 'graph_mode': 'off', 'use_snp_selection': False}. Best is trial 46 with value: 0.1006960060302028.
[I 2025-12-05 15:44:18,950] Trial 96 finished with value: 0.04887340941323455 and parameters: {'model_type': 'mlp', 'hidden_dims': '[512, 128]', 'dropout': 0.37782394972553646, 'batch_norm': False, 'lr': 3.990722323896163e-05, 'weight_decay': 0.0003443914710295698, 'epochs': 197, 'loss': 'mae', 'optimizer': 'adam', 'graph_mode': 'off', 'use_snp_selection': False}. Best is trial 46 with value: 0.1006960060302028.
[I 2025-12-05 15:44:20,536] Trial 97 finished with value: 0.04402219881310912 and parameters: {'model_type': 'mlp', 'hidden_dims': '[512, 256]', 'dropout': 0.5760990846158229, 'batch_norm': False, 'lr': 7.429541847868502e-05, 'weight_decay': 0.0001915559293894071, 'epochs': 222, 'loss': 'mae', 'optimizer': 'adam', 'graph_mode': 'off', 'use_snp_selection': False}. Best is trial 46 with value: 0.1006960060302028.
[I 2025-12-05 15:44:21,698] Trial 98 finished with value: 0.06072117507241048 and parameters: {'model_type': 'mlp', 'hidden_dims': '[256, 128, 64]', 'dropout': 0.16378217538171286, 'batch_norm': False, 'lr': 1.9938312451937896e-05, 'weight_decay': 0.00030931269737039646, 'epochs': 239, 'loss': 'mae', 'optimizer': 'adam', 'graph_mode': 'off', 'use_snp_selection': False}. Best is trial 46 with value: 0.1006960060302028.
[I 2025-12-05 15:44:23,239] Trial 99 finished with value: 0.056679073953233156 and parameters: {'model_type': 'mlp', 'hidden_dims': '[512, 128]', 'dropout': 0.36461302203323614, 'batch_norm': False, 'lr': 3.2860891562724005e-05, 'weight_decay': 0.0005843737628846744, 'epochs': 211, 'loss': 'mae', 'optimizer': 'adam', 'graph_mode': 'off', 'use_snp_selection': False}. Best is trial 46 with value: 0.1006960060302028.
[I 2025-12-05 15:44:24,631] Trial 100 finished with value: 0.04357139010704763 and parameters: {'model_type': 'mlp', 'hidden_dims': '[512, 256]', 'dropout': 0.41316986814603474, 'batch_norm': False, 'lr': 0.00011967049026384932, 'weight_decay': 0.000227397748682917, 'epochs': 166, 'loss': 'mae', 'optimizer': 'adam', 'graph_mode': 'off', 'use_snp_selection': False}. Best is trial 46 with value: 0.1006960060302028.
[I 2025-12-05 15:44:26,067] Trial 101 finished with value: 0.08441852568056202 and parameters: {'model_type': 'mlp', 'hidden_dims': '[512, 128]', 'dropout': 0.17255189061368603, 'batch_norm': False, 'lr': 0.0001785318433858154, 'weight_decay': 0.0002484927725211415, 'epochs': 179, 'loss': 'mae', 'optimizer': 'adam', 'graph_mode': 'off', 'use_snp_selection': False}. Best is trial 46 with value: 0.1006960060302028.
[I 2025-12-05 15:44:27,485] Trial 102 finished with value: 0.07387460146482451 and parameters: {'model_type': 'mlp', 'hidden_dims': '[512, 128]', 'dropout': 0.18823315954174777, 'batch_norm': False, 'lr': 0.00018187844371091557, 'weight_decay': 0.0004026484389465911, 'epochs': 178, 'loss': 'mae', 'optimizer': 'adam', 'graph_mode': 'off', 'use_snp_selection': False}. Best is trial 46 with value: 0.1006960060302028.
[I 2025-12-05 15:44:28,947] Trial 103 finished with value: 0.08292009763431457 and parameters: {'model_type': 'mlp', 'hidden_dims': '[512, 128]', 'dropout': 0.33592615139354903, 'batch_norm': False, 'lr': 4.631678554525801e-05, 'weight_decay': 0.0001407338325273649, 'epochs': 189, 'loss': 'mae', 'optimizer': 'adam', 'graph_mode': 'off', 'use_snp_selection': False}. Best is trial 46 with value: 0.1006960060302028.
[I 2025-12-05 15:44:30,405] Trial 104 finished with value: 0.0616657678951558 and parameters: {'model_type': 'mlp', 'hidden_dims': '[512, 128]', 'dropout': 0.3337025462103437, 'batch_norm': False, 'lr': 4.2969076109444594e-05, 'weight_decay': 0.00014631240268567151, 'epochs': 188, 'loss': 'mae', 'optimizer': 'adam', 'graph_mode': 'off', 'use_snp_selection': False}. Best is trial 46 with value: 0.1006960060302028.
[I 2025-12-05 15:44:31,897] Trial 105 finished with value: 0.06795495066259163 and parameters: {'model_type': 'mlp', 'hidden_dims': '[512, 64]', 'dropout': 0.39266380268126594, 'batch_norm': False, 'lr': 5.36627300424534e-05, 'weight_decay': 8.475614514822592e-05, 'epochs': 202, 'loss': 'mae', 'optimizer': 'adam', 'graph_mode': 'off', 'use_snp_selection': False}. Best is trial 46 with value: 0.1006960060302028.
[I 2025-12-05 15:44:34,083] Trial 106 finished with value: 0.06529180904147024 and parameters: {'model_type': 'mlp', 'hidden_dims': '[512, 128]', 'dropout': 0.43296154710848156, 'batch_norm': False, 'lr': 6.145908988215248e-05, 'weight_decay': 0.00011449480219438364, 'epochs': 216, 'loss': 'mae', 'optimizer': 'adam', 'graph_mode': 'off', 'use_snp_selection': True, 'num_snps': 36410}. Best is trial 46 with value: 0.1006960060302028.
[I 2025-12-05 15:44:35,811] Trial 107 finished with value: 0.08189339017128243 and parameters: {'model_type': 'mlp', 'hidden_dims': '[512, 128]', 'dropout': 0.3501816981539585, 'batch_norm': False, 'lr': 7.020823930274714e-06, 'weight_decay': 0.00026064541462132707, 'epochs': 270, 'loss': 'mae', 'optimizer': 'adam', 'graph_mode': 'off', 'use_snp_selection': False}. Best is trial 46 with value: 0.1006960060302028.
[I 2025-12-05 15:44:37,532] Trial 108 finished with value: 0.04859258264935199 and parameters: {'model_type': 'mlp', 'hidden_dims': '[512, 256]', 'dropout': 0.3158728508641644, 'batch_norm': False, 'lr': 5.7837028265508925e-06, 'weight_decay': 0.00027155870742441037, 'epochs': 261, 'loss': 'mse', 'optimizer': 'adam', 'graph_mode': 'off', 'use_snp_selection': False}. Best is trial 46 with value: 0.1006960060302028.
[I 2025-12-05 15:44:39,307] Trial 109 finished with value: 0.04281133907889554 and parameters: {'model_type': 'mlp', 'hidden_dims': '[512, 128]', 'dropout': 0.3454155998991888, 'batch_norm': True, 'lr': 7.046929385534692e-06, 'weight_decay': 0.0004564234189840686, 'epochs': 274, 'loss': 'mae', 'optimizer': 'adam', 'graph_mode': 'off', 'use_snp_selection': False}. Best is trial 46 with value: 0.1006960060302028.
[I 2025-12-05 15:44:41,043] Trial 110 finished with value: 0.0583921898133796 and parameters: {'model_type': 'mlp', 'hidden_dims': '[512, 256]', 'dropout': 0.36158878745983764, 'batch_norm': False, 'lr': 1.0260456628969808e-05, 'weight_decay': 6.080402694563111e-05, 'epochs': 271, 'loss': 'mae', 'optimizer': 'adam', 'graph_mode': 'off', 'use_snp_selection': False}. Best is trial 46 with value: 0.1006960060302028.
[I 2025-12-05 15:44:42,516] Trial 111 finished with value: 0.05215020626363413 and parameters: {'model_type': 'mlp', 'hidden_dims': '[512, 128]', 'dropout': 0.38070882959254154, 'batch_norm': False, 'lr': 3.0007588279886944e-05, 'weight_decay': 0.00033567621174314085, 'epochs': 195, 'loss': 'mae', 'optimizer': 'adam', 'graph_mode': 'off', 'use_snp_selection': False}. Best is trial 46 with value: 0.1006960060302028.
[I 2025-12-05 15:44:44,417] Trial 112 finished with value: 0.06507049466342801 and parameters: {'model_type': 'mlp', 'hidden_dims': '[512, 128]', 'dropout': 0.273691933237753, 'batch_norm': False, 'lr': 0.000140906915137323, 'weight_decay': 0.00022176002683911293, 'epochs': 315, 'loss': 'mae', 'optimizer': 'adam', 'graph_mode': 'off', 'use_snp_selection': False}. Best is trial 46 with value: 0.1006960060302028.
[I 2025-12-05 15:44:45,855] Trial 113 finished with value: 0.05128973164587466 and parameters: {'model_type': 'mlp', 'hidden_dims': '[512, 128]', 'dropout': 0.2989768503082864, 'batch_norm': False, 'lr': 2.3282441641656268e-05, 'weight_decay': 0.0002512217107441361, 'epochs': 179, 'loss': 'mae', 'optimizer': 'adam', 'graph_mode': 'off', 'use_snp_selection': False}. Best is trial 46 with value: 0.1006960060302028.
[I 2025-12-05 15:44:47,552] Trial 114 finished with value: 0.05110561595914342 and parameters: {'model_type': 'mlp', 'hidden_dims': '[512, 128]', 'dropout': 0.354916393190555, 'batch_norm': False, 'lr': 3.144488919641324e-06, 'weight_decay': 0.0001682583350786697, 'epochs': 253, 'loss': 'mae', 'optimizer': 'adam', 'graph_mode': 'off', 'use_snp_selection': False}. Best is trial 46 with value: 0.1006960060302028.
[I 2025-12-05 15:44:48,771] Trial 115 finished with value: 0.08036825161053522 and parameters: {'model_type': 'mlp', 'hidden_dims': '[256, 128]', 'dropout': 0.20163912269997364, 'batch_norm': False, 'lr': 4.8357995442077344e-05, 'weight_decay': 0.00013650193225555444, 'epochs': 288, 'loss': 'mae', 'optimizer': 'adam', 'graph_mode': 'off', 'use_snp_selection': False}. Best is trial 46 with value: 0.1006960060302028.
[I 2025-12-05 15:44:50,001] Trial 116 finished with value: 0.06306880519521091 and parameters: {'model_type': 'mlp', 'hidden_dims': '[256, 128]', 'dropout': 0.3719827625240758, 'batch_norm': False, 'lr': 4.896491974160629e-05, 'weight_decay': 0.0001360630589218722, 'epochs': 285, 'loss': 'mae', 'optimizer': 'adam', 'graph_mode': 'off', 'use_snp_selection': False}. Best is trial 46 with value: 0.1006960060302028.
[I 2025-12-05 15:44:51,202] Trial 117 finished with value: 0.057161743937353876 and parameters: {'model_type': 'mlp', 'hidden_dims': '[256, 128]', 'dropout': 0.3180233938710215, 'batch_norm': False, 'lr': 1.3619021382651278e-05, 'weight_decay': 9.842359455710219e-05, 'epochs': 295, 'loss': 'mae', 'optimizer': 'adam', 'graph_mode': 'off', 'use_snp_selection': False}. Best is trial 46 with value: 0.1006960060302028.
[I 2025-12-05 15:44:52,519] Trial 118 finished with value: 0.05684595680380834 and parameters: {'model_type': 'mlp', 'hidden_dims': '[256, 128]', 'dropout': 0.586484325487036, 'batch_norm': False, 'lr': 3.5213170943753676e-05, 'weight_decay': 1.0996681712897823e-07, 'epochs': 331, 'loss': 'mae', 'optimizer': 'adam', 'graph_mode': 'off', 'use_snp_selection': False}. Best is trial 46 with value: 0.1006960060302028.
[I 2025-12-05 15:44:53,760] Trial 119 finished with value: 0.07901078162248264 and parameters: {'model_type': 'mlp', 'hidden_dims': '[256, 128]', 'dropout': 0.33925824570043683, 'batch_norm': False, 'lr': 4.914745286889244e-06, 'weight_decay': 8.12743069911164e-06, 'epochs': 289, 'loss': 'mae', 'optimizer': 'adam', 'graph_mode': 'off', 'use_snp_selection': False}. Best is trial 46 with value: 0.1006960060302028.
[I 2025-12-05 15:44:54,961] Trial 120 finished with value: 0.08981243095439091 and parameters: {'model_type': 'mlp', 'hidden_dims': '[256, 128]', 'dropout': 0.21513773680404513, 'batch_norm': False, 'lr': 9.039536341552531e-05, 'weight_decay': 0.00019689967728363426, 'epochs': 267, 'loss': 'mae', 'optimizer': 'adam', 'graph_mode': 'off', 'use_snp_selection': False}. Best is trial 46 with value: 0.1006960060302028.
[I 2025-12-05 15:44:56,166] Trial 121 finished with value: 0.061922765762902315 and parameters: {'model_type': 'mlp', 'hidden_dims': '[256, 128]', 'dropout': 0.1750193321896615, 'batch_norm': False, 'lr': 8.264990925722804e-05, 'weight_decay': 0.00020174499790862125, 'epochs': 279, 'loss': 'mae', 'optimizer': 'adam', 'graph_mode': 'off', 'use_snp_selection': False}. Best is trial 46 with value: 0.1006960060302028.
[I 2025-12-05 15:44:57,405] Trial 122 finished with value: 0.07104749029957652 and parameters: {'model_type': 'mlp', 'hidden_dims': '[256, 128]', 'dropout': 0.21184601320658006, 'batch_norm': False, 'lr': 6.830276265695939e-05, 'weight_decay': 0.00015623045753810098, 'epochs': 301, 'loss': 'mae', 'optimizer': 'adam', 'graph_mode': 'off', 'use_snp_selection': False}. Best is trial 46 with value: 0.1006960060302028.
[I 2025-12-05 15:44:58,571] Trial 123 finished with value: 0.07689365322823985 and parameters: {'model_type': 'mlp', 'hidden_dims': '[256, 128]', 'dropout': 0.25273897590989014, 'batch_norm': False, 'lr': 0.00010599238090732715, 'weight_decay': 0.00012124538303811942, 'epochs': 268, 'loss': 'mae', 'optimizer': 'adam', 'graph_mode': 'off', 'use_snp_selection': False}. Best is trial 46 with value: 0.1006960060302028.
[I 2025-12-05 15:44:59,829] Trial 124 finished with value: 0.063870349712661 and parameters: {'model_type': 'mlp', 'hidden_dims': '[256, 128]', 'dropout': 0.22061490382315693, 'batch_norm': False, 'lr': 7.3028017958345795e-06, 'weight_decay': 0.00032574423964490607, 'epochs': 308, 'loss': 'mae', 'optimizer': 'adam', 'graph_mode': 'off', 'use_snp_selection': False}. Best is trial 46 with value: 0.1006960060302028.
[I 2025-12-05 15:45:01,528] Trial 125 finished with value: 0.08188026429393386 and parameters: {'model_type': 'mlp', 'hidden_dims': '[512, 256]', 'dropout': 0.1974867438287899, 'batch_norm': False, 'lr': 8.948145756785742e-05, 'weight_decay': 8.026916304734022e-05, 'epochs': 254, 'loss': 'mae', 'optimizer': 'adam', 'graph_mode': 'off', 'use_snp_selection': False}. Best is trial 46 with value: 0.1006960060302028.
[I 2025-12-05 15:45:02,461] Trial 126 finished with value: 0.06506366316729427 and parameters: {'model_type': 'mlp', 'hidden_dims': '[128, 64]', 'dropout': 0.19814150020274435, 'batch_norm': False, 'lr': 9.169650228060919e-05, 'weight_decay': 0.00018362896659405891, 'epochs': 259, 'loss': 'mae', 'optimizer': 'adam', 'graph_mode': 'off', 'use_snp_selection': False}. Best is trial 46 with value: 0.1006960060302028.
[I 2025-12-05 15:45:03,378] Trial 127 finished with value: 0.05778731535675449 and parameters: {'model_type': 'mlp', 'hidden_dims': '[512, 256]', 'dropout': 0.14821249197114084, 'batch_norm': False, 'lr': 0.00012976938760477885, 'weight_decay': 0.0002820263589127696, 'epochs': 247, 'loss': 'mse', 'optimizer': 'adam', 'graph_mode': 'off', 'use_snp_selection': True, 'num_snps': 2645}. Best is trial 46 with value: 0.1006960060302028.
[I 2025-12-05 15:45:04,537] Trial 128 finished with value: 0.06327056272447835 and parameters: {'model_type': 'mlp', 'hidden_dims': '[256, 128]', 'dropout': 0.20094258335562643, 'batch_norm': False, 'lr': 0.000101741992570741, 'weight_decay': 0.00037060306180649325, 'epochs': 253, 'loss': 'mae', 'optimizer': 'adam', 'graph_mode': 'off', 'use_snp_selection': False}. Best is trial 46 with value: 0.1006960060302028.
[I 2025-12-05 15:45:05,778] Trial 129 finished with value: 0.06484510512782196 and parameters: {'model_type': 'mlp', 'hidden_dims': '[256, 128, 64]', 'dropout': 0.24174683750722714, 'batch_norm': True, 'lr': 7.943551393627724e-05, 'weight_decay': 8.889099474617474e-05, 'epochs': 275, 'loss': 'mae', 'optimizer': 'adam', 'graph_mode': 'off', 'use_snp_selection': False}. Best is trial 46 with value: 0.1006960060302028.
[I 2025-12-05 15:45:07,368] Trial 130 finished with value: 0.047032633403157144 and parameters: {'model_type': 'mlp', 'hidden_dims': '[512, 256]', 'dropout': 0.1624793305849325, 'batch_norm': False, 'lr': 5.0249198299536296e-05, 'weight_decay': 7.554919648747748e-05, 'epochs': 239, 'loss': 'mae', 'optimizer': 'adam', 'graph_mode': 'off', 'use_snp_selection': False}. Best is trial 46 with value: 0.1006960060302028.
[I 2025-12-05 15:45:09,054] Trial 131 finished with value: 0.06563099930958188 and parameters: {'model_type': 'mlp', 'hidden_dims': '[512, 256]', 'dropout': 0.20873785265883388, 'batch_norm': False, 'lr': 4.421572094025267e-05, 'weight_decay': 0.00010598607386112784, 'epochs': 267, 'loss': 'mae', 'optimizer': 'adam', 'graph_mode': 'off', 'use_snp_selection': False}. Best is trial 46 with value: 0.1006960060302028.
[I 2025-12-05 15:45:10,843] Trial 132 finished with value: 0.08621628156762474 and parameters: {'model_type': 'mlp', 'hidden_dims': '[512, 256]', 'dropout': 0.1787861369620616, 'batch_norm': False, 'lr': 3.69854677286776e-05, 'weight_decay': 0.00014061959381645933, 'epochs': 281, 'loss': 'mae', 'optimizer': 'adam', 'graph_mode': 'off', 'use_snp_selection': False}. Best is trial 46 with value: 0.1006960060302028.
[I 2025-12-05 15:45:12,629] Trial 133 finished with value: 0.04894192282525044 and parameters: {'model_type': 'mlp', 'hidden_dims': '[512, 256]', 'dropout': 0.1835551678028826, 'batch_norm': False, 'lr': 3.8764679103704643e-05, 'weight_decay': 0.00014069074532661494, 'epochs': 281, 'loss': 'mae', 'optimizer': 'adam', 'graph_mode': 'off', 'use_snp_selection': False}. Best is trial 46 with value: 0.1006960060302028.
[I 2025-12-05 15:45:14,427] Trial 134 finished with value: 0.07153705517803635 and parameters: {'model_type': 'mlp', 'hidden_dims': '[512, 256]', 'dropout': 0.1671038553013924, 'batch_norm': False, 'lr': 2.9152982018497137e-05, 'weight_decay': 0.00021558222059283642, 'epochs': 289, 'loss': 'mae', 'optimizer': 'adam', 'graph_mode': 'off', 'use_snp_selection': False}. Best is trial 46 with value: 0.1006960060302028.
[I 2025-12-05 15:45:16,158] Trial 135 finished with value: 0.061964393519415246 and parameters: {'model_type': 'mlp', 'hidden_dims': '[512, 64]', 'dropout': 0.29010717552717175, 'batch_norm': False, 'lr': 0.00011008966698861117, 'weight_decay': 5.163394784059516e-05, 'epochs': 281, 'loss': 'mae', 'optimizer': 'adam', 'graph_mode': 'off', 'use_snp_selection': False}. Best is trial 46 with value: 0.1006960060302028.
[I 2025-12-05 15:45:18,058] Trial 136 finished with value: 0.059680112069592305 and parameters: {'model_type': 'mlp', 'hidden_dims': '[512, 256]', 'dropout': 0.2288208952186063, 'batch_norm': False, 'lr': 1.8553823771621436e-05, 'weight_decay': 0.00017837743925880247, 'epochs': 321, 'loss': 'mae', 'optimizer': 'adam', 'graph_mode': 'off', 'use_snp_selection': False}. Best is trial 46 with value: 0.1006960060302028.
[I 2025-12-05 15:45:19,753] Trial 137 finished with value: 0.058126604457781554 and parameters: {'model_type': 'mlp', 'hidden_dims': '[512, 128]', 'dropout': 0.2628964774794461, 'batch_norm': False, 'lr': 6.827383139154724e-05, 'weight_decay': 0.00024464537788071146, 'epochs': 268, 'loss': 'mae', 'optimizer': 'adam', 'graph_mode': 'off', 'use_snp_selection': False}. Best is trial 46 with value: 0.1006960060302028.
