[I 2025-12-05 16:06:13,311] Trial 53 finished with value: 0.12452818314397181 and parameters: {'model_type': 'mlp', 'hidden_dims': '[512, 256]', 'dropout': 0.12735312485719885, 'batch_norm': True, 'lr': 0.00044090749396729517, 'weight_decay': 1.8223665075745776e-05, 'epochs': 61, 'loss': 'mae', 'optimizer': 'adam', 'graph_mode': 'off', 'use_snp_selection': False}. Best is trial 29 with value: 0.14327701317958927.
[I 2025-12-05 16:06:15,170] Trial 54 finished with value: 0.11078249144781999 and parameters: {'model_type': 'mlp', 'hidden_dims': '[512, 128]', 'dropout': 0.20259046482986492, 'batch_norm': True, 'lr': 0.0001405449934636939, 'weight_decay': 5.154994700028432e-05, 'epochs': 92, 'loss': 'mae', 'optimizer': 'adam', 'graph_mode': 'off', 'use_snp_selection': False}. Best is trial 29 with value: 0.14327701317958927.
[I 2025-12-05 16:06:16,505] Trial 55 finished with value: 0.1302056305492865 and parameters: {'model_type': 'mlp', 'hidden_dims': '[256, 128, 64]', 'dropout': 0.1491953462085547, 'batch_norm': True, 'lr': 0.0007268040239273842, 'weight_decay': 0.00016150271586210223, 'epochs': 106, 'loss': 'mae', 'optimizer': 'adam', 'graph_mode': 'off', 'use_snp_selection': False}. Best is trial 29 with value: 0.14327701317958927.
[I 2025-12-05 16:06:17,807] Trial 56 finished with value: 0.12579023521936425 and parameters: {'model_type': 'mlp', 'hidden_dims': '[512, 64]', 'dropout': 0.5887041522550273, 'batch_norm': True, 'lr': 0.00029993851509304084, 'weight_decay': 1.658012719760779e-06, 'epochs': 47, 'loss': 'mae', 'optimizer': 'adam', 'graph_mode': 'off', 'use_snp_selection': False}. Best is trial 29 with value: 0.14327701317958927.
[I 2025-12-05 16:06:20,077] Trial 57 finished with value: 0.10579950955134769 and parameters: {'model_type': 'mlp', 'hidden_dims': '[512, 256]', 'dropout': 0.1704150371205619, 'batch_norm': False, 'lr': 0.0002085953504313819, 'weight_decay': 0.000369191340195006, 'epochs': 128, 'loss': 'mae', 'optimizer': 'adam', 'graph_mode': 'off', 'use_snp_selection': False}. Best is trial 29 with value: 0.14327701317958927.
[I 2025-12-05 16:06:22,669] Trial 58 finished with value: 0.12550058679965062 and parameters: {'model_type': 'mlp', 'hidden_dims': '[512, 128]', 'dropout': 0.23920716102598602, 'batch_norm': True, 'lr': 0.0005744544450722771, 'weight_decay': 3.2660340489622824e-07, 'epochs': 150, 'loss': 'mse', 'optimizer': 'adam', 'graph_mode': 'off', 'use_snp_selection': False}. Best is trial 29 with value: 0.14327701317958927.
[I 2025-12-05 16:06:27,270] Trial 59 finished with value: 0.12462170241954978 and parameters: {'model_type': 'mlp', 'hidden_dims': '[512, 256]', 'dropout': 0.11690066953558098, 'batch_norm': True, 'lr': 0.0009965604345529924, 'weight_decay': 3.8017725729098987e-06, 'epochs': 313, 'loss': 'mae', 'optimizer': 'adam', 'graph_mode': 'off', 'use_snp_selection': False}. Best is trial 29 with value: 0.14327701317958927.
[I 2025-12-05 16:06:27,980] Trial 60 finished with value: 0.06876833410937733 and parameters: {'model_type': 'mlp', 'hidden_dims': '[128, 64]', 'dropout': 0.10056924324618526, 'batch_norm': True, 'lr': 8.810593957239407e-06, 'weight_decay': 7.525318741766263e-05, 'epochs': 40, 'loss': 'mae', 'optimizer': 'adam', 'graph_mode': 'off', 'use_snp_selection': False}. Best is trial 29 with value: 0.14327701317958927.
[I 2025-12-05 16:06:30,098] Trial 61 finished with value: 0.12675510986243496 and parameters: {'model_type': 'mlp', 'hidden_dims': '[256, 128]', 'dropout': 0.3693363724488143, 'batch_norm': True, 'lr': 0.00025505795728659455, 'weight_decay': 0.00035125597485778583, 'epochs': 225, 'loss': 'mae', 'optimizer': 'adam', 'graph_mode': 'off', 'use_snp_selection': False}. Best is trial 29 with value: 0.14327701317958927.
[I 2025-12-05 16:06:32,158] Trial 62 finished with value: 0.11935178142609527 and parameters: {'model_type': 'mlp', 'hidden_dims': '[256, 128]', 'dropout': 0.34956357112393216, 'batch_norm': True, 'lr': 0.0003785366056505862, 'weight_decay': 2.1838437345176713e-05, 'epochs': 212, 'loss': 'mae', 'optimizer': 'adam', 'graph_mode': 'off', 'use_snp_selection': False}. Best is trial 29 with value: 0.14327701317958927.
[I 2025-12-05 16:06:34,464] Trial 63 finished with value: 0.1338044540831226 and parameters: {'model_type': 'mlp', 'hidden_dims': '[256, 128]', 'dropout': 0.3824715925298482, 'batch_norm': True, 'lr': 0.00042480088989946117, 'weight_decay': 0.0005807042303169624, 'epochs': 253, 'loss': 'mae', 'optimizer': 'adam', 'graph_mode': 'off', 'use_snp_selection': False}. Best is trial 29 with value: 0.14327701317958927.
[I 2025-12-05 16:06:37,025] Trial 64 finished with value: 0.12528296840055894 and parameters: {'model_type': 'mlp', 'hidden_dims': '[256, 128]', 'dropout': 0.4331674078691182, 'batch_norm': True, 'lr': 0.0004739900686751946, 'weight_decay': 0.0006993929733586908, 'epochs': 291, 'loss': 'mae', 'optimizer': 'adam', 'graph_mode': 'off', 'use_snp_selection': False}. Best is trial 29 with value: 0.14327701317958927.
[I 2025-12-05 16:06:41,069] Trial 65 finished with value: 0.12132594302476907 and parameters: {'model_type': 'mlp', 'hidden_dims': '[256, 128]', 'dropout': 0.30969018964759143, 'batch_norm': True, 'lr': 0.0007474884950200581, 'weight_decay': 1.0657281454961735e-05, 'epochs': 286, 'loss': 'mae', 'optimizer': 'adam', 'graph_mode': 'off', 'use_snp_selection': True, 'num_snps': 46361}. Best is trial 29 with value: 0.14327701317958927.
[I 2025-12-05 16:06:44,875] Trial 66 finished with value: 0.11992963904422053 and parameters: {'model_type': 'mlp', 'hidden_dims': '[512, 128]', 'dropout': 0.41946129388948716, 'batch_norm': True, 'lr': 0.0003605077769995105, 'weight_decay': 5.582625254205727e-07, 'epochs': 245, 'loss': 'mae', 'optimizer': 'adam', 'graph_mode': 'off', 'use_snp_selection': False}. Best is trial 29 with value: 0.14327701317958927.
[I 2025-12-05 16:06:45,756] Trial 67 finished with value: 0.11772671329393021 and parameters: {'model_type': 'mlp', 'hidden_dims': '[128, 64]', 'dropout': 0.13473080482103106, 'batch_norm': True, 'lr': 0.0004507247667672222, 'weight_decay': 4.137761235120693e-05, 'epochs': 84, 'loss': 'mae', 'optimizer': 'adam', 'graph_mode': 'off', 'use_snp_selection': False}. Best is trial 29 with value: 0.14327701317958927.
[I 2025-12-05 16:06:47,490] Trial 68 finished with value: 0.09171599550033563 and parameters: {'model_type': 'mlp', 'hidden_dims': '[512, 256]', 'dropout': 0.18102922465322316, 'batch_norm': False, 'lr': 0.0005872554166075858, 'weight_decay': 2.128869893058641e-06, 'epochs': 68, 'loss': 'mae', 'optimizer': 'adam', 'graph_mode': 'off', 'use_snp_selection': True, 'num_snps': 10578}. Best is trial 29 with value: 0.14327701317958927.
[I 2025-12-05 16:06:48,542] Trial 69 finished with value: 0.11610180036251729 and parameters: {'model_type': 'mlp', 'hidden_dims': '[256, 128, 64]', 'dropout': 0.20776124374465127, 'batch_norm': True, 'lr': 7.552766500394964e-05, 'weight_decay': 3.0865783260826766e-05, 'epochs': 57, 'loss': 'mae', 'optimizer': 'adam', 'graph_mode': 'off', 'use_snp_selection': False}. Best is trial 29 with value: 0.14327701317958927.
[I 2025-12-05 16:06:52,578] Trial 70 finished with value: 0.1264608223236632 and parameters: {'model_type': 'mlp', 'hidden_dims': '[512, 256]', 'dropout': 0.11264476819561735, 'batch_norm': True, 'lr': 0.0008344351659873662, 'weight_decay': 1.3976009438291526e-05, 'epochs': 263, 'loss': 'mae', 'optimizer': 'adam', 'graph_mode': 'off', 'use_snp_selection': False}. Best is trial 29 with value: 0.14327701317958927.
[I 2025-12-05 16:06:54,817] Trial 71 finished with value: 0.12453700748431322 and parameters: {'model_type': 'mlp', 'hidden_dims': '[256, 128]', 'dropout': 0.37438819445258337, 'batch_norm': True, 'lr': 0.0002996707868819653, 'weight_decay': 0.0006040947699370964, 'epochs': 236, 'loss': 'mae', 'optimizer': 'adam', 'graph_mode': 'off', 'use_snp_selection': False}. Best is trial 29 with value: 0.14327701317958927.
[I 2025-12-05 16:06:56,791] Trial 72 finished with value: 0.11000861711835254 and parameters: {'model_type': 'mlp', 'hidden_dims': '[256, 128]', 'dropout': 0.347309417454267, 'batch_norm': True, 'lr': 0.00016378016168654003, 'weight_decay': 0.00048167512486377024, 'epochs': 195, 'loss': 'mae', 'optimizer': 'adam', 'graph_mode': 'off', 'use_snp_selection': False}. Best is trial 29 with value: 0.14327701317958927.
[I 2025-12-05 16:06:59,141] Trial 73 finished with value: 0.1277098962220372 and parameters: {'model_type': 'mlp', 'hidden_dims': '[256, 128]', 'dropout': 0.3862649750778979, 'batch_norm': True, 'lr': 0.00026557372755683147, 'weight_decay': 0.0002623393229634775, 'epochs': 251, 'loss': 'mae', 'optimizer': 'adam', 'graph_mode': 'off', 'use_snp_selection': False}. Best is trial 29 with value: 0.14327701317958927.
[I 2025-12-05 16:07:01,357] Trial 74 finished with value: 0.12170900295258054 and parameters: {'model_type': 'mlp', 'hidden_dims': '[256, 128]', 'dropout': 0.3289564231447077, 'batch_norm': True, 'lr': 0.0006455224612455448, 'weight_decay': 0.00015135160662709584, 'epochs': 233, 'loss': 'mae', 'optimizer': 'adam', 'graph_mode': 'off', 'use_snp_selection': False}. Best is trial 29 with value: 0.14327701317958927.
[I 2025-12-05 16:07:03,841] Trial 75 finished with value: 0.12317713740946 and parameters: {'model_type': 'mlp', 'hidden_dims': '[256, 128]', 'dropout': 0.39295266062640266, 'batch_norm': True, 'lr': 0.00021420339579459618, 'weight_decay': 0.00043848835417673607, 'epochs': 271, 'loss': 'mae', 'optimizer': 'adam', 'graph_mode': 'off', 'use_snp_selection': False}. Best is trial 29 with value: 0.14327701317958927.
[I 2025-12-05 16:07:09,487] Trial 76 finished with value: 0.12193620233926288 and parameters: {'model_type': 'mlp', 'hidden_dims': '[512, 128]', 'dropout': 0.3678509770575861, 'batch_norm': True, 'lr': 0.000369053131896921, 'weight_decay': 0.0009196258720227206, 'epochs': 216, 'loss': 'mse', 'optimizer': 'adam', 'graph_mode': 'off', 'use_snp_selection': True, 'num_snps': 59196}. Best is trial 29 with value: 0.14327701317958927.
[I 2025-12-05 16:07:10,769] Trial 77 finished with value: 0.03680781122073428 and parameters: {'model_type': 'mlp', 'hidden_dims': '[128, 64]', 'dropout': 0.4598268852244887, 'batch_norm': True, 'lr': 1.0087771566710253e-06, 'weight_decay': 6.260998076375518e-06, 'epochs': 208, 'loss': 'mae', 'optimizer': 'adam', 'graph_mode': 'off', 'use_snp_selection': False}. Best is trial 29 with value: 0.14327701317958927.
[I 2025-12-05 16:07:13,766] Trial 78 finished with value: 0.12453755070226975 and parameters: {'model_type': 'mlp', 'hidden_dims': '[512, 256]', 'dropout': 0.40697918259521676, 'batch_norm': True, 'lr': 0.0005154822507123631, 'weight_decay': 2.735120626851361e-05, 'epochs': 180, 'loss': 'mae', 'optimizer': 'adam', 'graph_mode': 'off', 'use_snp_selection': False}. Best is trial 29 with value: 0.14327701317958927.
[I 2025-12-05 16:07:16,300] Trial 79 finished with value: 0.11963975120770451 and parameters: {'model_type': 'mlp', 'hidden_dims': '[512, 64]', 'dropout': 0.280169279141807, 'batch_norm': False, 'lr': 3.600396297538744e-05, 'weight_decay': 1.2742486215606567e-06, 'epochs': 62, 'loss': 'mae', 'optimizer': 'adam', 'graph_mode': 'off', 'use_snp_selection': True, 'num_snps': 28222}. Best is trial 29 with value: 0.14327701317958927.
[I 2025-12-05 16:07:18,789] Trial 80 finished with value: 0.12491998860503885 and parameters: {'model_type': 'mlp', 'hidden_dims': '[512, 128]', 'dropout': 0.1480483536186967, 'batch_norm': True, 'lr': 0.0008556779199067348, 'weight_decay': 0.0002065315279930259, 'epochs': 139, 'loss': 'mae', 'optimizer': 'adam', 'graph_mode': 'off', 'use_snp_selection': False}. Best is trial 29 with value: 0.14327701317958927.
[I 2025-12-05 16:07:20,419] Trial 81 finished with value: 0.0760158181300523 and parameters: {'model_type': 'mlp', 'hidden_dims': '[512, 256]', 'dropout': 0.1344825877718771, 'batch_norm': True, 'lr': 2.3557147915229047e-05, 'weight_decay': 5.993468325077056e-07, 'epochs': 73, 'loss': 'mse', 'optimizer': 'adam', 'graph_mode': 'off', 'use_snp_selection': False}. Best is trial 29 with value: 0.14327701317958927.
[I 2025-12-05 16:07:22,368] Trial 82 finished with value: 0.10427775148092505 and parameters: {'model_type': 'mlp', 'hidden_dims': '[512, 256]', 'dropout': 0.11775078622332084, 'batch_norm': True, 'lr': 4.235588763513454e-05, 'weight_decay': 8.115072380640453e-07, 'epochs': 99, 'loss': 'mse', 'optimizer': 'adam', 'graph_mode': 'off', 'use_snp_selection': False}. Best is trial 29 with value: 0.14327701317958927.
[I 2025-12-05 16:07:24,468] Trial 83 finished with value: 0.14108334108233014 and parameters: {'model_type': 'mlp', 'hidden_dims': '[512, 256]', 'dropout': 0.1584731651006489, 'batch_norm': True, 'lr': 0.00040124171524830117, 'weight_decay': 3.220825490633205e-07, 'epochs': 111, 'loss': 'mse', 'optimizer': 'adam', 'graph_mode': 'off', 'use_snp_selection': False}. Best is trial 29 with value: 0.14327701317958927.
[I 2025-12-05 16:07:26,565] Trial 84 finished with value: 0.1249928896154923 and parameters: {'model_type': 'mlp', 'hidden_dims': '[512, 256]', 'dropout': 0.15616116456256088, 'batch_norm': True, 'lr': 0.00041338385326163064, 'weight_decay': 2.597227379581005e-07, 'epochs': 111, 'loss': 'mse', 'optimizer': 'adam', 'graph_mode': 'off', 'use_snp_selection': False}. Best is trial 29 with value: 0.14327701317958927.
[I 2025-12-05 16:07:28,842] Trial 85 finished with value: 0.11567616521270487 and parameters: {'model_type': 'mlp', 'hidden_dims': '[512, 256]', 'dropout': 0.12629977896885294, 'batch_norm': True, 'lr': 0.0006425127649714767, 'weight_decay': 1.5197428116635324e-07, 'epochs': 123, 'loss': 'mse', 'optimizer': 'adam', 'graph_mode': 'off', 'use_snp_selection': False}. Best is trial 29 with value: 0.14327701317958927.
[I 2025-12-05 16:07:30,635] Trial 86 finished with value: 0.12762891956310185 and parameters: {'model_type': 'mlp', 'hidden_dims': '[512, 256]', 'dropout': 0.1748009786340476, 'batch_norm': True, 'lr': 0.000333688163878832, 'weight_decay': 3.9971621803055674e-07, 'epochs': 86, 'loss': 'mse', 'optimizer': 'adam', 'graph_mode': 'off', 'use_snp_selection': False}. Best is trial 29 with value: 0.14327701317958927.
[I 2025-12-05 16:07:31,696] Trial 87 finished with value: 0.13108768607218438 and parameters: {'model_type': 'mlp', 'hidden_dims': '[128, 64]', 'dropout': 0.14304092191828094, 'batch_norm': True, 'lr': 0.0005062289147212261, 'weight_decay': 4.358365262782303e-06, 'epochs': 159, 'loss': 'mae', 'optimizer': 'adam', 'graph_mode': 'off', 'use_snp_selection': False}. Best is trial 29 with value: 0.14327701317958927.
[I 2025-12-05 16:07:34,068] Trial 88 finished with value: 0.132939797912009 and parameters: {'model_type': 'mlp', 'hidden_dims': '[256, 128]', 'dropout': 0.1117138830221256, 'batch_norm': True, 'lr': 0.0006460075533590741, 'weight_decay': 1.0603905263408416e-07, 'epochs': 51, 'loss': 'mae', 'optimizer': 'adam', 'graph_mode': 'off', 'use_snp_selection': True, 'num_snps': 34549}. Best is trial 29 with value: 0.14327701317958927.
[I 2025-12-05 16:07:35,381] Trial 89 finished with value: 0.12536425118168837 and parameters: {'model_type': 'mlp', 'hidden_dims': '[256, 128, 64]', 'dropout': 0.1901888443127513, 'batch_norm': True, 'lr': 0.00019680994493721037, 'weight_decay': 4.919855607400587e-05, 'epochs': 103, 'loss': 'mae', 'optimizer': 'adam', 'graph_mode': 'off', 'use_snp_selection': False}. Best is trial 29 with value: 0.14327701317958927.
[I 2025-12-05 16:07:37,528] Trial 90 finished with value: 0.1257790606017889 and parameters: {'model_type': 'mlp', 'hidden_dims': '[512, 128]', 'dropout': 0.10151642078647591, 'batch_norm': True, 'lr': 0.00026892254661573157, 'weight_decay': 6.522263664559074e-05, 'epochs': 115, 'loss': 'mse', 'optimizer': 'adam', 'graph_mode': 'off', 'use_snp_selection': False}. Best is trial 29 with value: 0.14327701317958927.
[I 2025-12-05 16:07:39,422] Trial 91 finished with value: 0.12474279721469807 and parameters: {'model_type': 'mlp', 'hidden_dims': '[512, 256]', 'dropout': 0.16227619452125155, 'batch_norm': True, 'lr': 0.000144777832286443, 'weight_decay': 2.276538311298533e-07, 'epochs': 94, 'loss': 'mse', 'optimizer': 'adam', 'graph_mode': 'off', 'use_snp_selection': False}. Best is trial 29 with value: 0.14327701317958927.
[I 2025-12-05 16:07:41,101] Trial 92 finished with value: 0.12920776978931114 and parameters: {'model_type': 'mlp', 'hidden_dims': '[512, 256]', 'dropout': 0.12343294977221003, 'batch_norm': True, 'lr': 0.0004270977208473792, 'weight_decay': 4.123099589577998e-07, 'epochs': 77, 'loss': 'mse', 'optimizer': 'adam', 'graph_mode': 'off', 'use_snp_selection': False}. Best is trial 29 with value: 0.14327701317958927.
[I 2025-12-05 16:07:42,652] Trial 93 finished with value: 0.0924040184238897 and parameters: {'model_type': 'mlp', 'hidden_dims': '[512, 256]', 'dropout': 0.15078268634296998, 'batch_norm': True, 'lr': 1.2138154496644278e-05, 'weight_decay': 1.9071249619654513e-06, 'epochs': 66, 'loss': 'mse', 'optimizer': 'adam', 'graph_mode': 'off', 'use_snp_selection': False}. Best is trial 29 with value: 0.14327701317958927.
[I 2025-12-05 16:07:45,909] Trial 94 finished with value: 0.10971373746806967 and parameters: {'model_type': 'mlp', 'hidden_dims': '[512, 256]', 'dropout': 0.4101039055740168, 'batch_norm': True, 'lr': 6.005331787692763e-05, 'weight_decay': 7.278604539927865e-07, 'epochs': 204, 'loss': 'mse', 'optimizer': 'adam', 'graph_mode': 'off', 'use_snp_selection': False}. Best is trial 29 with value: 0.14327701317958927.
[I 2025-12-05 16:07:47,775] Trial 95 finished with value: 0.13403412663477288 and parameters: {'model_type': 'mlp', 'hidden_dims': '[512, 256]', 'dropout': 0.14085821326664216, 'batch_norm': True, 'lr': 0.0008260757124152054, 'weight_decay': 3.7107982360367974e-05, 'epochs': 92, 'loss': 'mae', 'optimizer': 'adam', 'graph_mode': 'off', 'use_snp_selection': False}. Best is trial 29 with value: 0.14327701317958927.
[I 2025-12-05 16:07:49,616] Trial 96 finished with value: 0.13625146311126055 and parameters: {'model_type': 'mlp', 'hidden_dims': '[512, 256]', 'dropout': 0.1375243080495536, 'batch_norm': True, 'lr': 0.000797960635885864, 'weight_decay': 1.6265747170072765e-05, 'epochs': 90, 'loss': 'mae', 'optimizer': 'adam', 'graph_mode': 'off', 'use_snp_selection': False}. Best is trial 29 with value: 0.14327701317958927.
[I 2025-12-05 16:07:51,995] Trial 97 finished with value: 0.13276261073504325 and parameters: {'model_type': 'mlp', 'hidden_dims': '[512, 256]', 'dropout': 0.13748403165104756, 'batch_norm': False, 'lr': 0.000822469210635617, 'weight_decay': 2.1264290212619153e-05, 'epochs': 137, 'loss': 'mae', 'optimizer': 'adam', 'graph_mode': 'off', 'use_snp_selection': False}. Best is trial 29 with value: 0.14327701317958927.
[I 2025-12-05 16:07:53,666] Trial 98 finished with value: 0.11599661839379873 and parameters: {'model_type': 'mlp', 'hidden_dims': '[512, 256]', 'dropout': 0.16451494575266626, 'batch_norm': True, 'lr': 0.0007215873743842804, 'weight_decay': 1.5976970277520243e-05, 'epochs': 75, 'loss': 'mae', 'optimizer': 'adam', 'graph_mode': 'off', 'use_snp_selection': False}. Best is trial 29 with value: 0.14327701317958927.
[I 2025-12-05 16:07:55,657] Trial 99 finished with value: 0.12360676633824953 and parameters: {'model_type': 'mlp', 'hidden_dims': '[512, 256]', 'dropout': 0.11073209182333366, 'batch_norm': True, 'lr': 0.0005761994997054795, 'weight_decay': 3.4297237116632705e-05, 'epochs': 90, 'loss': 'mae', 'optimizer': 'adam', 'graph_mode': 'off', 'use_snp_selection': True, 'num_snps': 15626}. Best is trial 29 with value: 0.14327701317958927.
[I 2025-12-05 16:07:57,415] Trial 100 finished with value: 0.12314044553255929 and parameters: {'model_type': 'mlp', 'hidden_dims': '[512, 256]', 'dropout': 0.12768057978284728, 'batch_norm': True, 'lr': 0.0009173787468433914, 'weight_decay': 1.188497621358986e-05, 'epochs': 83, 'loss': 'mae', 'optimizer': 'adam', 'graph_mode': 'off', 'use_snp_selection': False}. Best is trial 29 with value: 0.14327701317958927.
[I 2025-12-05 16:07:58,754] Trial 101 finished with value: 0.12483304724916228 and parameters: {'model_type': 'mlp', 'hidden_dims': '[512, 128]', 'dropout': 0.14201969134287692, 'batch_norm': True, 'lr': 0.0005167601864869937, 'weight_decay': 8.409122094584861e-06, 'epochs': 49, 'loss': 'mae', 'optimizer': 'adam', 'graph_mode': 'off', 'use_snp_selection': False}. Best is trial 29 with value: 0.14327701317958927.
[I 2025-12-05 16:08:00,724] Trial 102 finished with value: 0.1407621531266266 and parameters: {'model_type': 'mlp', 'hidden_dims': '[512, 64]', 'dropout': 0.11392770961518325, 'batch_norm': True, 'lr': 0.0007501855547822493, 'weight_decay': 9.208389862855863e-05, 'epochs': 101, 'loss': 'mae', 'optimizer': 'adam', 'graph_mode': 'off', 'use_snp_selection': False}. Best is trial 29 with value: 0.14327701317958927.
[I 2025-12-05 16:08:02,783] Trial 103 finished with value: 0.13021633726464132 and parameters: {'model_type': 'mlp', 'hidden_dims': '[512, 64]', 'dropout': 0.10993554764152771, 'batch_norm': True, 'lr': 0.0009949659371907601, 'weight_decay': 8.558478818022805e-05, 'epochs': 108, 'loss': 'mae', 'optimizer': 'adam', 'graph_mode': 'off', 'use_snp_selection': False}. Best is trial 29 with value: 0.14327701317958927.
[I 2025-12-05 16:08:05,000] Trial 104 finished with value: 0.126912723150161 and parameters: {'model_type': 'mlp', 'hidden_dims': '[512, 64]', 'dropout': 0.18372930771944102, 'batch_norm': True, 'lr': 0.0007640727150370569, 'weight_decay': 4.243664479833752e-05, 'epochs': 121, 'loss': 'mae', 'optimizer': 'adam', 'graph_mode': 'off', 'use_snp_selection': False}. Best is trial 29 with value: 0.14327701317958927.
