[I 2025-12-05 16:32:07,592] Trial 129 finished with value: 0.03049727226079197 and parameters: {'model_type': 'mlp', 'hidden_dims': '[512, 128]', 'dropout': 0.5584523186589415, 'batch_norm': False, 'lr': 0.0005083773600888295, 'weight_decay': 5.121767177165211e-07, 'epochs': 139, 'loss': 'mse', 'optimizer': 'adam', 'graph_mode': 'off', 'use_snp_selection': True, 'num_snps': 7595}. Best is trial 107 with value: 0.05874472689184193.
[I 2025-12-05 16:32:08,552] Trial 130 finished with value: 0.03423170002599798 and parameters: {'model_type': 'mlp', 'hidden_dims': '[512, 128]', 'dropout': 0.5739114772052764, 'batch_norm': False, 'lr': 0.0004619638267985694, 'weight_decay': 2.1385037448291614e-06, 'epochs': 283, 'loss': 'mse', 'optimizer': 'adam', 'graph_mode': 'off', 'use_snp_selection': True, 'num_snps': 5381}. Best is trial 107 with value: 0.05874472689184193.
[I 2025-12-05 16:32:09,620] Trial 131 finished with value: 0.026915017977227156 and parameters: {'model_type': 'mlp', 'hidden_dims': '[512, 128]', 'dropout': 0.51049221375501, 'batch_norm': False, 'lr': 0.0005822648933021175, 'weight_decay': 1.0234612390601475e-06, 'epochs': 266, 'loss': 'mse', 'optimizer': 'adam', 'graph_mode': 'off', 'use_snp_selection': True, 'num_snps': 9721}. Best is trial 107 with value: 0.05874472689184193.
[I 2025-12-05 16:32:10,616] Trial 132 finished with value: 0.03957169020034918 and parameters: {'model_type': 'mlp', 'hidden_dims': '[512, 128]', 'dropout': 0.5358505146833549, 'batch_norm': False, 'lr': 0.000820652096213378, 'weight_decay': 1.688294097011175e-06, 'epochs': 145, 'loss': 'mse', 'optimizer': 'adam', 'graph_mode': 'off', 'use_snp_selection': True, 'num_snps': 10579}. Best is trial 107 with value: 0.05874472689184193.
[I 2025-12-05 16:32:11,551] Trial 133 finished with value: 0.041677329799251955 and parameters: {'model_type': 'mlp', 'hidden_dims': '[512, 128]', 'dropout': 0.521540953733605, 'batch_norm': False, 'lr': 0.0005362155483284592, 'weight_decay': 3.5476974889985444e-06, 'epochs': 153, 'loss': 'mse', 'optimizer': 'adam', 'graph_mode': 'off', 'use_snp_selection': True, 'num_snps': 7986}. Best is trial 107 with value: 0.05874472689184193.
[I 2025-12-05 16:32:12,645] Trial 134 finished with value: 0.035800894321124065 and parameters: {'model_type': 'mlp', 'hidden_dims': '[512, 128]', 'dropout': 0.5911531486460494, 'batch_norm': False, 'lr': 0.0003914522375000366, 'weight_decay': 1.4020999482877578e-06, 'epochs': 138, 'loss': 'mse', 'optimizer': 'adam', 'graph_mode': 'off', 'use_snp_selection': True, 'num_snps': 12358}. Best is trial 107 with value: 0.05874472689184193.
[I 2025-12-05 16:32:13,574] Trial 135 finished with value: 0.05717434078931986 and parameters: {'model_type': 'mlp', 'hidden_dims': '[512, 128]', 'dropout': 0.5206732038399042, 'batch_norm': False, 'lr': 0.0005287081757433023, 'weight_decay': 3.0675932014009895e-06, 'epochs': 151, 'loss': 'mse', 'optimizer': 'adam', 'graph_mode': 'off', 'use_snp_selection': True, 'num_snps': 7613}. Best is trial 107 with value: 0.05874472689184193.
[I 2025-12-05 16:32:14,392] Trial 136 finished with value: 0.05276915712574352 and parameters: {'model_type': 'mlp', 'hidden_dims': '[512, 128]', 'dropout': 0.5426417718116041, 'batch_norm': False, 'lr': 0.0006613240319810811, 'weight_decay': 3.1717836154430213e-06, 'epochs': 144, 'loss': 'mse', 'optimizer': 'adam', 'graph_mode': 'off', 'use_snp_selection': True, 'num_snps': 5244}. Best is trial 107 with value: 0.05874472689184193.
[I 2025-12-05 16:32:15,089] Trial 137 finished with value: 0.02779363287736405 and parameters: {'model_type': 'mlp', 'hidden_dims': '[512, 128]', 'dropout': 0.5991617993312933, 'batch_norm': False, 'lr': 0.0007147766799423903, 'weight_decay': 1.2695029642468498e-06, 'epochs': 128, 'loss': 'mse', 'optimizer': 'adam', 'graph_mode': 'off', 'use_snp_selection': True, 'num_snps': 2394}. Best is trial 107 with value: 0.05874472689184193.
[I 2025-12-05 16:32:15,859] Trial 138 finished with value: 0.012619808410218217 and parameters: {'model_type': 'mlp', 'hidden_dims': '[512, 128]', 'dropout': 0.5680679701812552, 'batch_norm': False, 'lr': 0.0005932616980301474, 'weight_decay': 2.9786965888829737e-06, 'epochs': 130, 'loss': 'mse', 'optimizer': 'adam', 'graph_mode': 'off', 'use_snp_selection': True, 'num_snps': 4682}. Best is trial 107 with value: 0.05874472689184193.
[I 2025-12-05 16:32:16,679] Trial 139 finished with value: 0.0014441970795924103 and parameters: {'model_type': 'mlp', 'hidden_dims': '[512, 128]', 'dropout': 0.5569332349643101, 'batch_norm': False, 'lr': 0.0004819519138453867, 'weight_decay': 2.5245297554653677e-06, 'epochs': 146, 'loss': 'mae', 'optimizer': 'adam', 'graph_mode': 'off', 'use_snp_selection': True, 'num_snps': 6474}. Best is trial 107 with value: 0.05874472689184193.
[I 2025-12-05 16:32:17,833] Trial 140 finished with value: 0.004923725264057397 and parameters: {'model_type': 'mlp', 'hidden_dims': '[512, 64]', 'dropout': 0.5423676328444675, 'batch_norm': False, 'lr': 0.0008463836566203077, 'weight_decay': 3.1143197700344263e-06, 'epochs': 101, 'loss': 'mse', 'optimizer': 'adam', 'graph_mode': 'off', 'use_snp_selection': False}. Best is trial 107 with value: 0.05874472689184193.
[I 2025-12-05 16:32:18,802] Trial 141 finished with value: 0.03746144202209503 and parameters: {'model_type': 'mlp', 'hidden_dims': '[512, 128]', 'dropout': 0.5217247348879006, 'batch_norm': False, 'lr': 0.0005473985535933635, 'weight_decay': 3.515939665825621e-06, 'epochs': 161, 'loss': 'mse', 'optimizer': 'adam', 'graph_mode': 'off', 'use_snp_selection': True, 'num_snps': 7842}. Best is trial 107 with value: 0.05874472689184193.
[I 2025-12-05 16:32:19,784] Trial 142 finished with value: 0.04277452398893324 and parameters: {'model_type': 'mlp', 'hidden_dims': '[512, 128]', 'dropout': 0.14150059062966772, 'batch_norm': False, 'lr': 0.0006623077531181158, 'weight_decay': 4.261630141717507e-06, 'epochs': 155, 'loss': 'mse', 'optimizer': 'adam', 'graph_mode': 'off', 'use_snp_selection': True, 'num_snps': 8663}. Best is trial 107 with value: 0.05874472689184193.
[I 2025-12-05 16:32:20,718] Trial 143 finished with value: 0.022639577924024445 and parameters: {'model_type': 'mlp', 'hidden_dims': '[512, 128]', 'dropout': 0.20070159200243187, 'batch_norm': False, 'lr': 0.0009270687083732375, 'weight_decay': 4.851541986655049e-06, 'epochs': 120, 'loss': 'mse', 'optimizer': 'adam', 'graph_mode': 'off', 'use_snp_selection': True, 'num_snps': 8901}. Best is trial 107 with value: 0.05874472689184193.
[I 2025-12-05 16:32:21,502] Trial 144 finished with value: 0.03745634334315159 and parameters: {'model_type': 'mlp', 'hidden_dims': '[512, 128]', 'dropout': 0.13838262900959525, 'batch_norm': False, 'lr': 0.0006302473014722049, 'weight_decay': 2.2850626076126195e-06, 'epochs': 154, 'loss': 'mse', 'optimizer': 'adam', 'graph_mode': 'off', 'use_snp_selection': True, 'num_snps': 3655}. Best is trial 107 with value: 0.05874472689184193.
[I 2025-12-05 16:32:22,447] Trial 145 finished with value: 0.03322213059199319 and parameters: {'model_type': 'mlp', 'hidden_dims': '[512, 256]', 'dropout': 0.1704913295224648, 'batch_norm': False, 'lr': 0.00030989060421623326, 'weight_decay': 1.1677369509566538e-05, 'epochs': 135, 'loss': 'mse', 'optimizer': 'adam', 'graph_mode': 'off', 'use_snp_selection': True, 'num_snps': 10196}. Best is trial 107 with value: 0.05874472689184193.
[I 2025-12-05 16:32:23,466] Trial 146 finished with value: 0.03810493393686552 and parameters: {'model_type': 'mlp', 'hidden_dims': '[512, 128]', 'dropout': 0.14758088463357955, 'batch_norm': True, 'lr': 0.0007238428896846405, 'weight_decay': 8.363634925691539e-07, 'epochs': 148, 'loss': 'mse', 'optimizer': 'adam', 'graph_mode': 'off', 'use_snp_selection': True, 'num_snps': 11497}. Best is trial 107 with value: 0.05874472689184193.
[I 2025-12-05 16:32:24,257] Trial 147 finished with value: 0.03628059778086637 and parameters: {'model_type': 'mlp', 'hidden_dims': '[512, 128]', 'dropout': 0.1242281579485239, 'batch_norm': False, 'lr': 0.00037257783230806185, 'weight_decay': 0.0001649011745172434, 'epochs': 164, 'loss': 'mse', 'optimizer': 'adam', 'graph_mode': 'off', 'use_snp_selection': True, 'num_snps': 5231}. Best is trial 107 with value: 0.05874472689184193.
[I 2025-12-05 16:32:27,028] Trial 148 finished with value: 0.002791813720888575 and parameters: {'model_type': 'mlp', 'hidden_dims': '[512, 128]', 'dropout': 0.2985676601914271, 'batch_norm': False, 'lr': 0.0004242414315804372, 'weight_decay': 4.20704587820873e-06, 'epochs': 279, 'loss': 'mse', 'optimizer': 'adam', 'graph_mode': 'off', 'use_snp_selection': True, 'num_snps': 44067}. Best is trial 107 with value: 0.05874472689184193.
[I 2025-12-05 16:32:29,364] Trial 149 finished with value: 0.012301736422030564 and parameters: {'model_type': 'mlp', 'hidden_dims': '[256, 128, 64]', 'dropout': 0.11185376004795634, 'batch_norm': False, 'lr': 0.0006812209265003612, 'weight_decay': 5.29437024361334e-06, 'epochs': 247, 'loss': 'mse', 'optimizer': 'adam', 'graph_mode': 'off', 'use_snp_selection': True, 'num_snps': 48008}. Best is trial 107 with value: 0.05874472689184193.
[I 2025-12-05 16:32:31,669] Trial 0 finished with value: 0.024882332962150654 and parameters: {'model_type': 'mlp', 'hidden_dims': '[128, 64]', 'dropout': 0.199031432379812, 'batch_norm': True, 'lr': 1.8408544111075837e-06, 'weight_decay': 5.5136510071208614e-05, 'epochs': 336, 'loss': 'mae', 'optimizer': 'adam', 'graph_mode': 'off', 'use_snp_selection': True, 'num_snps': 43862}. Best is trial 0 with value: 0.024882332962150654.
[I 2025-12-05 16:32:32,823] Trial 1 finished with value: -0.0050624761185781375 and parameters: {'model_type': 'mlp', 'hidden_dims': '[256, 128]', 'dropout': 0.4370668075331726, 'batch_norm': True, 'lr': 7.133471581159139e-05, 'weight_decay': 1.128633586803549e-05, 'epochs': 242, 'loss': 'mae', 'optimizer': 'adam', 'graph_mode': 'off', 'use_snp_selection': False}. Best is trial 0 with value: 0.024882332962150654.
[I 2025-12-05 16:32:33,863] Trial 2 finished with value: 0.005381195280152729 and parameters: {'model_type': 'mlp', 'hidden_dims': '[256, 128, 64]', 'dropout': 0.41314357415569625, 'batch_norm': False, 'lr': 3.952233718592101e-06, 'weight_decay': 0.00026754769258252603, 'epochs': 149, 'loss': 'mse', 'optimizer': 'adam', 'graph_mode': 'off', 'use_snp_selection': True, 'num_snps': 11571}. Best is trial 0 with value: 0.024882332962150654.
[I 2025-12-05 16:32:35,658] Trial 3 finished with value: -0.003433469868259425 and parameters: {'model_type': 'mlp', 'hidden_dims': '[512, 64]', 'dropout': 0.5938127374509361, 'batch_norm': False, 'lr': 5.67704586114731e-06, 'weight_decay': 2.4518087630137052e-05, 'epochs': 320, 'loss': 'mae', 'optimizer': 'adam', 'graph_mode': 'off', 'use_snp_selection': False}. Best is trial 0 with value: 0.024882332962150654.
[I 2025-12-05 16:32:37,886] Trial 4 finished with value: -0.02508329686785166 and parameters: {'model_type': 'mlp', 'hidden_dims': '[512, 128]', 'dropout': 0.25746343592134413, 'batch_norm': True, 'lr': 1.3467657668402788e-06, 'weight_decay': 0.00033087251918647806, 'epochs': 277, 'loss': 'mse', 'optimizer': 'adam', 'graph_mode': 'off', 'use_snp_selection': True, 'num_snps': 36675}. Best is trial 0 with value: 0.024882332962150654.
[I 2025-12-05 16:32:39,717] Trial 5 finished with value: -0.022394198144378773 and parameters: {'model_type': 'mlp', 'hidden_dims': '[512, 64]', 'dropout': 0.38275350994408375, 'batch_norm': True, 'lr': 1.5586664309232824e-06, 'weight_decay': 0.0008227664668621182, 'epochs': 145, 'loss': 'mae', 'optimizer': 'adam', 'graph_mode': 'off', 'use_snp_selection': True, 'num_snps': 32148}. Best is trial 0 with value: 0.024882332962150654.
[I 2025-12-05 16:32:40,711] Trial 6 finished with value: 0.011962425575840008 and parameters: {'model_type': 'mlp', 'hidden_dims': '[256, 128]', 'dropout': 0.3930109900265879, 'batch_norm': False, 'lr': 4.892964372128395e-05, 'weight_decay': 1.5809549317992182e-06, 'epochs': 199, 'loss': 'mse', 'optimizer': 'adam', 'graph_mode': 'off', 'use_snp_selection': False}. Best is trial 0 with value: 0.024882332962150654.
[I 2025-12-05 16:32:41,774] Trial 7 finished with value: 0.01247402841263391 and parameters: {'model_type': 'mlp', 'hidden_dims': '[512, 256]', 'dropout': 0.15343979219678458, 'batch_norm': True, 'lr': 6.234003099047341e-05, 'weight_decay': 3.894760610535477e-07, 'epochs': 97, 'loss': 'mse', 'optimizer': 'adam', 'graph_mode': 'off', 'use_snp_selection': False}. Best is trial 0 with value: 0.024882332962150654.
[I 2025-12-05 16:32:43,556] Trial 8 finished with value: 0.00042505129076005066 and parameters: {'model_type': 'mlp', 'hidden_dims': '[512, 128]', 'dropout': 0.10743001231661406, 'batch_norm': True, 'lr': 0.00023728538449271062, 'weight_decay': 1.7629071578048637e-05, 'epochs': 312, 'loss': 'mae', 'optimizer': 'adam', 'graph_mode': 'off', 'use_snp_selection': False}. Best is trial 0 with value: 0.024882332962150654.
[I 2025-12-05 16:32:44,905] Trial 9 finished with value: -0.0034034904914337547 and parameters: {'model_type': 'mlp', 'hidden_dims': '[512, 64]', 'dropout': 0.14505336736221927, 'batch_norm': True, 'lr': 5.8619638388111826e-05, 'weight_decay': 6.200156172669308e-07, 'epochs': 175, 'loss': 'mse', 'optimizer': 'adam', 'graph_mode': 'off', 'use_snp_selection': False}. Best is trial 0 with value: 0.024882332962150654.
[I 2025-12-05 16:32:47,244] Trial 10 finished with value: 0.03062229945905453 and parameters: {'model_type': 'mlp', 'hidden_dims': '[128, 64]', 'dropout': 0.26042626041863687, 'batch_norm': False, 'lr': 1.080428984628536e-05, 'weight_decay': 0.00011308342650768637, 'epochs': 54, 'loss': 'mae', 'optimizer': 'adam', 'graph_mode': 'off', 'use_snp_selection': True, 'num_snps': 57847}. Best is trial 10 with value: 0.03062229945905453.
[I 2025-12-05 16:32:49,620] Trial 11 finished with value: 0.03719431104805771 and parameters: {'model_type': 'mlp', 'hidden_dims': '[128, 64]', 'dropout': 0.25882793327472997, 'batch_norm': False, 'lr': 6.682215890329092e-06, 'weight_decay': 3.725969199673383e-05, 'epochs': 46, 'loss': 'mae', 'optimizer': 'adam', 'graph_mode': 'off', 'use_snp_selection': True, 'num_snps': 58109}. Best is trial 11 with value: 0.03719431104805771.
[I 2025-12-05 16:32:51,984] Trial 12 finished with value: -0.0006582910921952736 and parameters: {'model_type': 'mlp', 'hidden_dims': '[128, 64]', 'dropout': 0.2838054095427211, 'batch_norm': False, 'lr': 9.735518346962828e-06, 'weight_decay': 8.275736304860072e-05, 'epochs': 41, 'loss': 'mae', 'optimizer': 'adam', 'graph_mode': 'off', 'use_snp_selection': True, 'num_snps': 56749}. Best is trial 11 with value: 0.03719431104805771.
[I 2025-12-05 16:32:54,375] Trial 13 finished with value: -0.002966048540852877 and parameters: {'model_type': 'mlp', 'hidden_dims': '[128, 64]', 'dropout': 0.3013642563587751, 'batch_norm': False, 'lr': 1.5276186177400635e-05, 'weight_decay': 5.266541541272998e-06, 'epochs': 46, 'loss': 'mae', 'optimizer': 'adam', 'graph_mode': 'off', 'use_snp_selection': True, 'num_snps': 59375}. Best is trial 11 with value: 0.03719431104805771.
[I 2025-12-05 16:32:56,572] Trial 14 finished with value: -0.008928075241992888 and parameters: {'model_type': 'mlp', 'hidden_dims': '[128, 64]', 'dropout': 0.24826070295360034, 'batch_norm': False, 'lr': 1.9834729414381932e-05, 'weight_decay': 9.292303605293518e-05, 'epochs': 94, 'loss': 'mae', 'optimizer': 'adam', 'graph_mode': 'off', 'use_snp_selection': True, 'num_snps': 48237}. Best is trial 11 with value: 0.03719431104805771.
[I 2025-12-05 16:32:57,704] Trial 15 finished with value: -0.010662887748424174 and parameters: {'model_type': 'mlp', 'hidden_dims': '[128, 64]', 'dropout': 0.480014750633305, 'batch_norm': False, 'lr': 0.0009322090391033176, 'weight_decay': 3.878305585176176e-06, 'epochs': 90, 'loss': 'mae', 'optimizer': 'adam', 'graph_mode': 'off', 'use_snp_selection': True, 'num_snps': 18607}. Best is trial 11 with value: 0.03719431104805771.
[I 2025-12-05 16:32:59,804] Trial 16 finished with value: 0.03957831763965417 and parameters: {'model_type': 'mlp', 'hidden_dims': '[256, 128, 64]', 'dropout': 0.33989063665109087, 'batch_norm': False, 'lr': 5.949140966086241e-06, 'weight_decay': 1.0482369643047958e-07, 'epochs': 77, 'loss': 'mae', 'optimizer': 'adam', 'graph_mode': 'off', 'use_snp_selection': True, 'num_snps': 47325}. Best is trial 16 with value: 0.03957831763965417.
[I 2025-12-05 16:33:02,034] Trial 17 finished with value: 0.02430315763927067 and parameters: {'model_type': 'mlp', 'hidden_dims': '[256, 128, 64]', 'dropout': 0.3242423471610569, 'batch_norm': False, 'lr': 4.0163209143228655e-06, 'weight_decay': 1.6925924762092747e-07, 'epochs': 126, 'loss': 'mae', 'optimizer': 'adam', 'graph_mode': 'off', 'use_snp_selection': True, 'num_snps': 46640}. Best is trial 16 with value: 0.03957831763965417.
[I 2025-12-05 16:33:03,307] Trial 18 finished with value: 0.02448467024169002 and parameters: {'model_type': 'mlp', 'hidden_dims': '[256, 128, 64]', 'dropout': 0.5032525910773772, 'batch_norm': False, 'lr': 2.9724281559600224e-06, 'weight_decay': 1.2603251514881976e-07, 'epochs': 77, 'loss': 'mae', 'optimizer': 'adam', 'graph_mode': 'off', 'use_snp_selection': True, 'num_snps': 21505}. Best is trial 16 with value: 0.03957831763965417.
[I 2025-12-05 16:33:05,997] Trial 19 finished with value: 0.012312188781949916 and parameters: {'model_type': 'mlp', 'hidden_dims': '[512, 256]', 'dropout': 0.34965458787650433, 'batch_norm': False, 'lr': 2.658132127454962e-05, 'weight_decay': 1.7553889172498846e-06, 'epochs': 209, 'loss': 'mae', 'optimizer': 'adam', 'graph_mode': 'off', 'use_snp_selection': True, 'num_snps': 49325}. Best is trial 16 with value: 0.03957831763965417.
[I 2025-12-05 16:33:07,773] Trial 20 finished with value: -0.017290066579791978 and parameters: {'model_type': 'mlp', 'hidden_dims': '[256, 128, 64]', 'dropout': 0.22329264946042754, 'batch_norm': False, 'lr': 7.3292163260907894e-06, 'weight_decay': 3.824154226879643e-05, 'epochs': 122, 'loss': 'mae', 'optimizer': 'adam', 'graph_mode': 'off', 'use_snp_selection': True, 'num_snps': 34879}. Best is trial 16 with value: 0.03957831763965417.
[I 2025-12-05 16:33:10,123] Trial 21 finished with value: -0.004343371589881087 and parameters: {'model_type': 'mlp', 'hidden_dims': '[128, 64]', 'dropout': 0.1913980558743988, 'batch_norm': False, 'lr': 1.1285382061101753e-05, 'weight_decay': 0.00010917769749840727, 'epochs': 64, 'loss': 'mae', 'optimizer': 'adam', 'graph_mode': 'off', 'use_snp_selection': True, 'num_snps': 54550}. Best is trial 16 with value: 0.03957831763965417.
[I 2025-12-05 16:33:12,563] Trial 22 finished with value: -0.04223238994007803 and parameters: {'model_type': 'mlp', 'hidden_dims': '[128, 64]', 'dropout': 0.33578861689224815, 'batch_norm': False, 'lr': 7.304971703549455e-06, 'weight_decay': 0.00030967908378401845, 'epochs': 60, 'loss': 'mae', 'optimizer': 'adam', 'graph_mode': 'off', 'use_snp_selection': True, 'num_snps': 59511}. Best is trial 16 with value: 0.03957831763965417.
[I 2025-12-05 16:33:14,548] Trial 23 finished with value: -0.02294877246602294 and parameters: {'model_type': 'mlp', 'hidden_dims': '[256, 128, 64]', 'dropout': 0.27948689936500115, 'batch_norm': False, 'lr': 2.5723991409529544e-06, 'weight_decay': 5.4980640990494805e-06, 'epochs': 107, 'loss': 'mae', 'optimizer': 'adam', 'graph_mode': 'off', 'use_snp_selection': True, 'num_snps': 41197}. Best is trial 16 with value: 0.03957831763965417.
[I 2025-12-05 16:33:16,806] Trial 24 finished with value: 0.007492456334826815 and parameters: {'model_type': 'mlp', 'hidden_dims': '[128, 64]', 'dropout': 0.24169473711224435, 'batch_norm': False, 'lr': 2.87006482117861e-05, 'weight_decay': 0.00016700913146003687, 'epochs': 73, 'loss': 'mae', 'optimizer': 'adam', 'graph_mode': 'off', 'use_snp_selection': True, 'num_snps': 52338}. Best is trial 16 with value: 0.03957831763965417.
[I 2025-12-05 16:33:17,395] Trial 25 finished with value: -0.011091139219983788 and parameters: {'model_type': 'mlp', 'hidden_dims': '[512, 128]', 'dropout': 0.3065139908781442, 'batch_norm': False, 'lr': 0.00014730392051532992, 'weight_decay': 0.0008568378972394753, 'epochs': 44, 'loss': 'mae', 'optimizer': 'adam', 'graph_mode': 'off', 'use_snp_selection': True, 'num_snps': 2755}. Best is trial 16 with value: 0.03957831763965417.
[I 2025-12-05 16:33:20,095] Trial 26 finished with value: 0.02377242844744077 and parameters: {'model_type': 'mlp', 'hidden_dims': '[512, 256]', 'dropout': 0.3670624889876327, 'batch_norm': False, 'lr': 1.0676463767952018e-06, 'weight_decay': 2.5789338381120274e-05, 'epochs': 164, 'loss': 'mae', 'optimizer': 'adam', 'graph_mode': 'off', 'use_snp_selection': True, 'num_snps': 52127}. Best is trial 16 with value: 0.03957831763965417.
[I 2025-12-05 16:33:22,062] Trial 27 finished with value: -0.02306797658215825 and parameters: {'model_type': 'mlp', 'hidden_dims': '[256, 128]', 'dropout': 0.19331017526901542, 'batch_norm': False, 'lr': 1.3045241751754792e-05, 'weight_decay': 1.11182557065741e-05, 'epochs': 114, 'loss': 'mse', 'optimizer': 'adam', 'graph_mode': 'off', 'use_snp_selection': True, 'num_snps': 40746}. Best is trial 16 with value: 0.03957831763965417.
[I 2025-12-05 16:33:24,366] Trial 28 finished with value: -0.018434551157078257 and parameters: {'model_type': 'mlp', 'hidden_dims': '[256, 128, 64]', 'dropout': 0.45325442517340975, 'batch_norm': False, 'lr': 5.031356757352802e-06, 'weight_decay': 1.7808112979930074e-06, 'epochs': 75, 'loss': 'mae', 'optimizer': 'adam', 'graph_mode': 'off', 'use_snp_selection': True, 'num_snps': 53422}. Best is trial 16 with value: 0.03957831763965417.
