[I 2025-12-05 15:56:28,726] Trial 42 finished with value: 0.08628166342429112 and parameters: {'model_type': 'mlp', 'hidden_dims': '[256, 128]', 'dropout': 0.36682030508917746, 'batch_norm': True, 'lr': 6.837442029783135e-05, 'weight_decay': 2.9560653173893497e-05, 'epochs': 225, 'loss': 'mae', 'optimizer': 'adam', 'graph_mode': 'off', 'use_snp_selection': False}. Best is trial 32 with value: 0.11474941554535856.
[I 2025-12-05 15:56:30,293] Trial 43 finished with value: 0.12008467699619037 and parameters: {'model_type': 'mlp', 'hidden_dims': '[512, 64]', 'dropout': 0.2841590339094825, 'batch_norm': True, 'lr': 4.685938876838808e-05, 'weight_decay': 7.874347762872549e-06, 'epochs': 202, 'loss': 'mae', 'optimizer': 'adam', 'graph_mode': 'off', 'use_snp_selection': False}. Best is trial 43 with value: 0.12008467699619037.
[I 2025-12-05 15:56:31,825] Trial 44 finished with value: 0.08886889593755616 and parameters: {'model_type': 'mlp', 'hidden_dims': '[512, 64]', 'dropout': 0.27842371796468485, 'batch_norm': True, 'lr': 4.112634756424538e-05, 'weight_decay': 2.2007335098369302e-06, 'epochs': 187, 'loss': 'mse', 'optimizer': 'adam', 'graph_mode': 'off', 'use_snp_selection': False}. Best is trial 43 with value: 0.12008467699619037.
[I 2025-12-05 15:56:33,403] Trial 45 finished with value: 0.11817147481947149 and parameters: {'model_type': 'mlp', 'hidden_dims': '[512, 64]', 'dropout': 0.31019953322551463, 'batch_norm': True, 'lr': 2.902417853026224e-05, 'weight_decay': 6.646516150169526e-06, 'epochs': 204, 'loss': 'mae', 'optimizer': 'adam', 'graph_mode': 'off', 'use_snp_selection': False}. Best is trial 43 with value: 0.12008467699619037.
[I 2025-12-05 15:56:34,970] Trial 46 finished with value: 0.09945979940893385 and parameters: {'model_type': 'mlp', 'hidden_dims': '[512, 64]', 'dropout': 0.3098088409429814, 'batch_norm': True, 'lr': 1.621408177073788e-05, 'weight_decay': 6.310987715703427e-06, 'epochs': 204, 'loss': 'mae', 'optimizer': 'adam', 'graph_mode': 'off', 'use_snp_selection': False}. Best is trial 43 with value: 0.12008467699619037.
[I 2025-12-05 15:56:36,708] Trial 47 finished with value: 0.12053006077759305 and parameters: {'model_type': 'mlp', 'hidden_dims': '[512, 64]', 'dropout': 0.3855280917613933, 'batch_norm': True, 'lr': 8.349298609636901e-06, 'weight_decay': 8.646427827433833e-06, 'epochs': 255, 'loss': 'mae', 'optimizer': 'adam', 'graph_mode': 'off', 'use_snp_selection': False}. Best is trial 47 with value: 0.12053006077759305.
[I 2025-12-05 15:56:38,465] Trial 48 finished with value: 0.05911518976096841 and parameters: {'model_type': 'mlp', 'hidden_dims': '[512, 64]', 'dropout': 0.27042949592319526, 'batch_norm': True, 'lr': 9.067026410082424e-06, 'weight_decay': 1.0153199133669153e-05, 'epochs': 259, 'loss': 'mae', 'optimizer': 'adam', 'graph_mode': 'off', 'use_snp_selection': False}. Best is trial 47 with value: 0.12053006077759305.
[I 2025-12-05 15:56:40,835] Trial 49 finished with value: 0.09565967500218218 and parameters: {'model_type': 'mlp', 'hidden_dims': '[512, 64]', 'dropout': 0.3458420123771214, 'batch_norm': True, 'lr': 3.6317513337679595e-06, 'weight_decay': 2.5044602125253307e-06, 'epochs': 157, 'loss': 'mae', 'optimizer': 'adam', 'graph_mode': 'off', 'use_snp_selection': True, 'num_snps': 46888}. Best is trial 47 with value: 0.12053006077759305.
[I 2025-12-05 15:56:42,614] Trial 50 finished with value: 0.09087747525930623 and parameters: {'model_type': 'mlp', 'hidden_dims': '[512, 64]', 'dropout': 0.30286467935335526, 'batch_norm': True, 'lr': 7.742807379812376e-06, 'weight_decay': 4.35792616861206e-06, 'epochs': 248, 'loss': 'mae', 'optimizer': 'adam', 'graph_mode': 'off', 'use_snp_selection': False}. Best is trial 47 with value: 0.12053006077759305.
[I 2025-12-05 15:56:44,239] Trial 51 finished with value: 0.1208645704447077 and parameters: {'model_type': 'mlp', 'hidden_dims': '[512, 64]', 'dropout': 0.37417172186368464, 'batch_norm': True, 'lr': 2.7777167023005674e-05, 'weight_decay': 7.836397804351335e-06, 'epochs': 224, 'loss': 'mae', 'optimizer': 'adam', 'graph_mode': 'off', 'use_snp_selection': False}. Best is trial 51 with value: 0.1208645704447077.
[I 2025-12-05 15:56:45,892] Trial 52 finished with value: 0.06982407212945785 and parameters: {'model_type': 'mlp', 'hidden_dims': '[512, 64]', 'dropout': 0.4158778585728232, 'batch_norm': True, 'lr': 1.0921708743861942e-06, 'weight_decay': 8.763093519768681e-06, 'epochs': 232, 'loss': 'mae', 'optimizer': 'adam', 'graph_mode': 'off', 'use_snp_selection': False}. Best is trial 51 with value: 0.1208645704447077.
[I 2025-12-05 15:56:47,464] Trial 53 finished with value: 0.07107510402253908 and parameters: {'model_type': 'mlp', 'hidden_dims': '[512, 64]', 'dropout': 0.4021182177129456, 'batch_norm': True, 'lr': 1.8141912137194437e-05, 'weight_decay': 1.4114221767997052e-05, 'epochs': 206, 'loss': 'mae', 'optimizer': 'adam', 'graph_mode': 'off', 'use_snp_selection': False}. Best is trial 51 with value: 0.1208645704447077.
[I 2025-12-05 15:56:49,250] Trial 54 finished with value: 0.07377497390949805 and parameters: {'model_type': 'mlp', 'hidden_dims': '[512, 64]', 'dropout': 0.32641958507092184, 'batch_norm': True, 'lr': 2.613166202258298e-05, 'weight_decay': 1.5489190470975207e-06, 'epochs': 267, 'loss': 'mae', 'optimizer': 'adam', 'graph_mode': 'off', 'use_snp_selection': False}. Best is trial 51 with value: 0.1208645704447077.
[I 2025-12-05 15:56:50,935] Trial 55 finished with value: 0.10599881512542042 and parameters: {'model_type': 'mlp', 'hidden_dims': '[512, 64]', 'dropout': 0.29626605609315065, 'batch_norm': True, 'lr': 3.0729742390213455e-05, 'weight_decay': 7.079151789983017e-07, 'epochs': 241, 'loss': 'mae', 'optimizer': 'adam', 'graph_mode': 'off', 'use_snp_selection': False}. Best is trial 51 with value: 0.1208645704447077.
[I 2025-12-05 15:56:52,839] Trial 56 finished with value: 0.08959603033380249 and parameters: {'model_type': 'mlp', 'hidden_dims': '[512, 64]', 'dropout': 0.3915476716355666, 'batch_norm': True, 'lr': 5.3908713810573366e-05, 'weight_decay': 3.437497968598567e-06, 'epochs': 285, 'loss': 'mae', 'optimizer': 'adam', 'graph_mode': 'off', 'use_snp_selection': False}. Best is trial 51 with value: 0.1208645704447077.
[I 2025-12-05 15:56:54,329] Trial 57 finished with value: 0.06476024386062086 and parameters: {'model_type': 'mlp', 'hidden_dims': '[512, 256]', 'dropout': 0.3528503383460717, 'batch_norm': True, 'lr': 1.4998919713207606e-05, 'weight_decay': 3.350539704842845e-05, 'epochs': 187, 'loss': 'mae', 'optimizer': 'adam', 'graph_mode': 'off', 'use_snp_selection': False}. Best is trial 51 with value: 0.1208645704447077.
[I 2025-12-05 15:56:55,977] Trial 58 finished with value: 0.07644985672182615 and parameters: {'model_type': 'mlp', 'hidden_dims': '[512, 64]', 'dropout': 0.3238532528886993, 'batch_norm': True, 'lr': 2.999314183129952e-05, 'weight_decay': 7.943057525357202e-05, 'epochs': 232, 'loss': 'mae', 'optimizer': 'adam', 'graph_mode': 'off', 'use_snp_selection': False}. Best is trial 51 with value: 0.1208645704447077.
[I 2025-12-05 15:56:57,540] Trial 59 finished with value: 0.08431944792713505 and parameters: {'model_type': 'mlp', 'hidden_dims': '[512, 64]', 'dropout': 0.2630413476721466, 'batch_norm': True, 'lr': 8.753589164853823e-05, 'weight_decay': 2.1042614820608693e-05, 'epochs': 206, 'loss': 'mae', 'optimizer': 'adam', 'graph_mode': 'off', 'use_snp_selection': False}. Best is trial 51 with value: 0.1208645704447077.
[I 2025-12-05 15:56:59,156] Trial 60 finished with value: 0.12253720463843523 and parameters: {'model_type': 'mlp', 'hidden_dims': '[512, 64]', 'dropout': 0.4664402393462943, 'batch_norm': True, 'lr': 0.0001460237672435941, 'weight_decay': 9.041541442038011e-06, 'epochs': 223, 'loss': 'mae', 'optimizer': 'adam', 'graph_mode': 'off', 'use_snp_selection': False}. Best is trial 60 with value: 0.12253720463843523.
[I 2025-12-05 15:57:00,807] Trial 61 finished with value: 0.12021144825036036 and parameters: {'model_type': 'mlp', 'hidden_dims': '[512, 64]', 'dropout': 0.42417783964919636, 'batch_norm': True, 'lr': 0.00012577605129622464, 'weight_decay': 0.000819829256734232, 'epochs': 219, 'loss': 'mae', 'optimizer': 'adam', 'graph_mode': 'off', 'use_snp_selection': False}. Best is trial 60 with value: 0.12253720463843523.
[I 2025-12-05 15:57:02,476] Trial 62 finished with value: 0.09864619869540085 and parameters: {'model_type': 'mlp', 'hidden_dims': '[512, 64]', 'dropout': 0.4789446108505589, 'batch_norm': True, 'lr': 0.00013800084706954086, 'weight_decay': 0.0006609876468223297, 'epochs': 223, 'loss': 'mae', 'optimizer': 'adam', 'graph_mode': 'off', 'use_snp_selection': False}. Best is trial 60 with value: 0.12253720463843523.
[I 2025-12-05 15:57:04,234] Trial 63 finished with value: 0.08950775850260208 and parameters: {'model_type': 'mlp', 'hidden_dims': '[512, 64]', 'dropout': 0.4311636993342572, 'batch_norm': True, 'lr': 0.00019759663260817095, 'weight_decay': 0.0001796285930277765, 'epochs': 249, 'loss': 'mae', 'optimizer': 'adam', 'graph_mode': 'off', 'use_snp_selection': False}. Best is trial 60 with value: 0.12253720463843523.
[I 2025-12-05 15:57:05,732] Trial 64 finished with value: 0.09223670999725293 and parameters: {'model_type': 'mlp', 'hidden_dims': '[512, 64]', 'dropout': 0.46576307047156423, 'batch_norm': True, 'lr': 0.0003734907398652306, 'weight_decay': 0.0009543771081971517, 'epochs': 193, 'loss': 'mae', 'optimizer': 'adam', 'graph_mode': 'off', 'use_snp_selection': False}. Best is trial 60 with value: 0.12253720463843523.
[I 2025-12-05 15:57:07,592] Trial 65 finished with value: 0.09325892486552952 and parameters: {'model_type': 'mlp', 'hidden_dims': '[512, 64]', 'dropout': 0.5088811414820457, 'batch_norm': True, 'lr': 0.00012838405614351597, 'weight_decay': 0.00039851610454158157, 'epochs': 272, 'loss': 'mae', 'optimizer': 'adam', 'graph_mode': 'off', 'use_snp_selection': False}. Best is trial 60 with value: 0.12253720463843523.
[I 2025-12-05 15:57:09,269] Trial 66 finished with value: 0.09462804116750854 and parameters: {'model_type': 'mlp', 'hidden_dims': '[512, 64]', 'dropout': 0.420928199055856, 'batch_norm': True, 'lr': 0.00016356632576317116, 'weight_decay': 7.130506583229836e-06, 'epochs': 227, 'loss': 'mae', 'optimizer': 'adam', 'graph_mode': 'off', 'use_snp_selection': False}. Best is trial 60 with value: 0.12253720463843523.
[I 2025-12-05 15:57:10,801] Trial 67 finished with value: 0.10491192372309106 and parameters: {'model_type': 'mlp', 'hidden_dims': '[512, 64]', 'dropout': 0.3826801168768325, 'batch_norm': True, 'lr': 0.00010117023530751639, 'weight_decay': 1.1809633797273338e-05, 'epochs': 211, 'loss': 'mae', 'optimizer': 'adam', 'graph_mode': 'off', 'use_snp_selection': True, 'num_snps': 22951}. Best is trial 60 with value: 0.12253720463843523.
[I 2025-12-05 15:57:11,952] Trial 68 finished with value: 0.1044306575815981 and parameters: {'model_type': 'mlp', 'hidden_dims': '[256, 128, 64]', 'dropout': 0.5420460339887083, 'batch_norm': True, 'lr': 0.0005511280769585186, 'weight_decay': 5.563048327792388e-06, 'epochs': 238, 'loss': 'mae', 'optimizer': 'adam', 'graph_mode': 'off', 'use_snp_selection': False}. Best is trial 60 with value: 0.12253720463843523.
[I 2025-12-05 15:57:12,828] Trial 69 finished with value: 0.08406882983095468 and parameters: {'model_type': 'mlp', 'hidden_dims': '[128, 64]', 'dropout': 0.44626504960099844, 'batch_norm': True, 'lr': 1.1266666079035057e-05, 'weight_decay': 8.398240341758654e-06, 'epochs': 183, 'loss': 'mae', 'optimizer': 'adam', 'graph_mode': 'off', 'use_snp_selection': False}. Best is trial 60 with value: 0.12253720463843523.
[I 2025-12-05 15:57:14,783] Trial 70 finished with value: 0.10966989359318612 and parameters: {'model_type': 'mlp', 'hidden_dims': '[512, 64]', 'dropout': 0.22391459262421434, 'batch_norm': True, 'lr': 8.061146013148919e-05, 'weight_decay': 2.5809089088164386e-05, 'epochs': 298, 'loss': 'mae', 'optimizer': 'adam', 'graph_mode': 'off', 'use_snp_selection': False}. Best is trial 60 with value: 0.12253720463843523.
[I 2025-12-05 15:57:16,350] Trial 71 finished with value: 0.12288803506235363 and parameters: {'model_type': 'mlp', 'hidden_dims': '[512, 256]', 'dropout': 0.3550079805467856, 'batch_norm': True, 'lr': 4.6985000033115775e-05, 'weight_decay': 1.4421934373593998e-05, 'epochs': 200, 'loss': 'mae', 'optimizer': 'adam', 'graph_mode': 'off', 'use_snp_selection': False}. Best is trial 71 with value: 0.12288803506235363.
[I 2025-12-05 15:57:17,867] Trial 72 finished with value: 0.08524521462556066 and parameters: {'model_type': 'mlp', 'hidden_dims': '[512, 256]', 'dropout': 0.382409732720162, 'batch_norm': True, 'lr': 5.654844574513703e-05, 'weight_decay': 1.5029278355846622e-05, 'epochs': 198, 'loss': 'mae', 'optimizer': 'adam', 'graph_mode': 'off', 'use_snp_selection': False}. Best is trial 71 with value: 0.12288803506235363.
[I 2025-12-05 15:57:19,531] Trial 73 finished with value: 0.1154921334190205 and parameters: {'model_type': 'mlp', 'hidden_dims': '[512, 256]', 'dropout': 0.338953595880719, 'batch_norm': True, 'lr': 2.0337202517320807e-05, 'weight_decay': 4.39015577840288e-06, 'epochs': 222, 'loss': 'mae', 'optimizer': 'adam', 'graph_mode': 'off', 'use_snp_selection': False}. Best is trial 71 with value: 0.12288803506235363.
[I 2025-12-05 15:57:21,162] Trial 74 finished with value: 0.08077653522590615 and parameters: {'model_type': 'mlp', 'hidden_dims': '[512, 256]', 'dropout': 0.3416681926405573, 'batch_norm': True, 'lr': 1.918606149234827e-05, 'weight_decay': 4.219879644066456e-06, 'epochs': 216, 'loss': 'mae', 'optimizer': 'adam', 'graph_mode': 'off', 'use_snp_selection': False}. Best is trial 71 with value: 0.12288803506235363.
[I 2025-12-05 15:57:22,902] Trial 75 finished with value: 0.08905719307661046 and parameters: {'model_type': 'mlp', 'hidden_dims': '[512, 256]', 'dropout': 0.4637916216928084, 'batch_norm': True, 'lr': 2.309792044415708e-05, 'weight_decay': 2.703407933452891e-06, 'epochs': 252, 'loss': 'mae', 'optimizer': 'adam', 'graph_mode': 'off', 'use_snp_selection': False}. Best is trial 71 with value: 0.12288803506235363.
[I 2025-12-05 15:57:23,815] Trial 76 finished with value: 0.10355633137449836 and parameters: {'model_type': 'mlp', 'hidden_dims': '[512, 256]', 'dropout': 0.3564465282703796, 'batch_norm': True, 'lr': 0.000334949076130219, 'weight_decay': 9.366744077543747e-06, 'epochs': 40, 'loss': 'mae', 'optimizer': 'adam', 'graph_mode': 'off', 'use_snp_selection': False}. Best is trial 71 with value: 0.12288803506235363.
[I 2025-12-05 15:57:25,538] Trial 77 finished with value: 0.07409428317502907 and parameters: {'model_type': 'mlp', 'hidden_dims': '[512, 256]', 'dropout': 0.31255332419371484, 'batch_norm': True, 'lr': 1.1809149751968726e-05, 'weight_decay': 5.403179055720786e-06, 'epochs': 236, 'loss': 'mae', 'optimizer': 'adam', 'graph_mode': 'off', 'use_snp_selection': False}. Best is trial 71 with value: 0.12288803506235363.
[I 2025-12-05 15:57:27,023] Trial 78 finished with value: 0.07271252963655014 and parameters: {'model_type': 'mlp', 'hidden_dims': '[512, 256]', 'dropout': 0.40016195893530604, 'batch_norm': True, 'lr': 2.9334267640719212e-05, 'weight_decay': 2.969675216410367e-06, 'epochs': 178, 'loss': 'mae', 'optimizer': 'adam', 'graph_mode': 'off', 'use_snp_selection': False}. Best is trial 71 with value: 0.12288803506235363.
[I 2025-12-05 15:57:28,025] Trial 79 finished with value: 0.07905106747257801 and parameters: {'model_type': 'mlp', 'hidden_dims': '[512, 256]', 'dropout': 0.28759402866370837, 'batch_norm': True, 'lr': 0.00017781469279258986, 'weight_decay': 7.396807892006202e-06, 'epochs': 264, 'loss': 'mae', 'optimizer': 'adam', 'graph_mode': 'off', 'use_snp_selection': True, 'num_snps': 3769}. Best is trial 71 with value: 0.12288803506235363.
[I 2025-12-05 15:57:29,380] Trial 80 finished with value: 0.06514098935098031 and parameters: {'model_type': 'mlp', 'hidden_dims': '[512, 64]', 'dropout': 0.4960439315614177, 'batch_norm': True, 'lr': 4.668548205699186e-05, 'weight_decay': 2.025755453103536e-05, 'epochs': 138, 'loss': 'mae', 'optimizer': 'adam', 'graph_mode': 'off', 'use_snp_selection': False}. Best is trial 71 with value: 0.12288803506235363.
[I 2025-12-05 15:57:30,307] Trial 81 finished with value: 0.089687043164746 and parameters: {'model_type': 'mlp', 'hidden_dims': '[128, 64]', 'dropout': 0.33539096265600377, 'batch_norm': True, 'lr': 3.723074797744906e-05, 'weight_decay': 1.3062540260417424e-05, 'epochs': 212, 'loss': 'mae', 'optimizer': 'adam', 'graph_mode': 'off', 'use_snp_selection': False}. Best is trial 71 with value: 0.12288803506235363.
[I 2025-12-05 15:57:31,964] Trial 82 finished with value: 0.0939955831094892 and parameters: {'model_type': 'mlp', 'hidden_dims': '[512, 64]', 'dropout': 0.2526560139565561, 'batch_norm': True, 'lr': 6.340264101235221e-05, 'weight_decay': 6.68359906686208e-05, 'epochs': 221, 'loss': 'mae', 'optimizer': 'adam', 'graph_mode': 'off', 'use_snp_selection': False}. Best is trial 71 with value: 0.12288803506235363.
[I 2025-12-05 15:57:32,849] Trial 83 finished with value: 0.10181173993594131 and parameters: {'model_type': 'mlp', 'hidden_dims': '[128, 64]', 'dropout': 0.31464249820420187, 'batch_norm': True, 'lr': 3.394695302689737e-05, 'weight_decay': 1.0197100179527508e-05, 'epochs': 198, 'loss': 'mae', 'optimizer': 'adam', 'graph_mode': 'off', 'use_snp_selection': False}. Best is trial 71 with value: 0.12288803506235363.
[I 2025-12-05 15:57:33,980] Trial 84 finished with value: 0.030295987546042673 and parameters: {'model_type': 'mlp', 'hidden_dims': '[256, 128, 64]', 'dropout': 0.3801731300683018, 'batch_norm': True, 'lr': 3.1035901772170243e-06, 'weight_decay': 1.6602186103346832e-05, 'epochs': 228, 'loss': 'mae', 'optimizer': 'adam', 'graph_mode': 'off', 'use_snp_selection': False}. Best is trial 71 with value: 0.12288803506235363.
[I 2025-12-05 15:57:35,416] Trial 85 finished with value: 0.09076663341566465 and parameters: {'model_type': 'mlp', 'hidden_dims': '[512, 64]', 'dropout': 0.3700167525615767, 'batch_norm': True, 'lr': 0.000238230688356832, 'weight_decay': 4.0630886621665045e-05, 'epochs': 164, 'loss': 'mae', 'optimizer': 'adam', 'graph_mode': 'off', 'use_snp_selection': False}. Best is trial 71 with value: 0.12288803506235363.
[I 2025-12-05 15:57:37,159] Trial 86 finished with value: 0.10576013403477212 and parameters: {'model_type': 'mlp', 'hidden_dims': '[512, 256]', 'dropout': 0.292756759348172, 'batch_norm': True, 'lr': 4.74571570477285e-05, 'weight_decay': 0.00013988538343890486, 'epochs': 244, 'loss': 'mae', 'optimizer': 'adam', 'graph_mode': 'off', 'use_snp_selection': False}. Best is trial 71 with value: 0.12288803506235363.
[I 2025-12-05 15:57:38,697] Trial 87 finished with value: 0.11291825512086381 and parameters: {'model_type': 'mlp', 'hidden_dims': '[512, 64]', 'dropout': 0.41117983674535796, 'batch_norm': True, 'lr': 2.214487153338317e-05, 'weight_decay': 3.872140489076043e-06, 'epochs': 192, 'loss': 'mae', 'optimizer': 'adam', 'graph_mode': 'off', 'use_snp_selection': False}. Best is trial 71 with value: 0.12288803506235363.
[I 2025-12-05 15:57:40,262] Trial 88 finished with value: 0.09363349577303037 and parameters: {'model_type': 'mlp', 'hidden_dims': '[512, 64]', 'dropout': 0.4356387644892512, 'batch_norm': True, 'lr': 6.0681745612991425e-06, 'weight_decay': 6.143133490076613e-06, 'epochs': 211, 'loss': 'mae', 'optimizer': 'adam', 'graph_mode': 'off', 'use_snp_selection': False}. Best is trial 71 with value: 0.12288803506235363.
[I 2025-12-05 15:57:41,166] Trial 89 finished with value: 0.08177783069943892 and parameters: {'model_type': 'mlp', 'hidden_dims': '[128, 64]', 'dropout': 0.3342040928101544, 'batch_norm': True, 'lr': 1.7105997994135703e-05, 'weight_decay': 1.152244874200363e-05, 'epochs': 204, 'loss': 'mae', 'optimizer': 'adam', 'graph_mode': 'off', 'use_snp_selection': False}. Best is trial 71 with value: 0.12288803506235363.
[I 2025-12-05 15:57:43,991] Trial 90 finished with value: 0.09529336327871478 and parameters: {'model_type': 'mlp', 'hidden_dims': '[512, 256]', 'dropout': 0.2739444670263696, 'batch_norm': True, 'lr': 2.6225170837256532e-05, 'weight_decay': 1.9487327936425993e-06, 'epochs': 255, 'loss': 'mae', 'optimizer': 'adam', 'graph_mode': 'off', 'use_snp_selection': True, 'num_snps': 48165}. Best is trial 71 with value: 0.12288803506235363.
[I 2025-12-05 15:57:45,527] Trial 91 finished with value: 0.10225573654194528 and parameters: {'model_type': 'mlp', 'hidden_dims': '[512, 64]', 'dropout': 0.4249812216555154, 'batch_norm': True, 'lr': 1.379436836727533e-05, 'weight_decay': 4.035492552108724e-06, 'epochs': 191, 'loss': 'mae', 'optimizer': 'adam', 'graph_mode': 'off', 'use_snp_selection': False}. Best is trial 71 with value: 0.12288803506235363.
[I 2025-12-05 15:57:47,029] Trial 92 finished with value: 0.0742524935086471 and parameters: {'model_type': 'mlp', 'hidden_dims': '[512, 64]', 'dropout': 0.41215768243552436, 'batch_norm': True, 'lr': 1.9248454948655076e-05, 'weight_decay': 3.5907915394341386e-06, 'epochs': 182, 'loss': 'mae', 'optimizer': 'adam', 'graph_mode': 'off', 'use_snp_selection': False}. Best is trial 71 with value: 0.12288803506235363.
[I 2025-12-05 15:57:48,682] Trial 93 finished with value: 0.091222408335153 and parameters: {'model_type': 'mlp', 'hidden_dims': '[512, 64]', 'dropout': 0.38846942280910457, 'batch_norm': True, 'lr': 2.1942489964268814e-05, 'weight_decay': 4.916773830001527e-06, 'epochs': 220, 'loss': 'mae', 'optimizer': 'adam', 'graph_mode': 'off', 'use_snp_selection': False}. Best is trial 71 with value: 0.12288803506235363.
