[I 2025-12-05 15:07:19,491] Trial 48 finished with value: 0.05808971388485508 and parameters: {'model_type': 'mlp', 'hidden_dims': '[512, 64]', 'dropout': 0.11510198036975919, 'batch_norm': True, 'lr': 0.0005110949748601216, 'weight_decay': 2.319894102306265e-06, 'epochs': 186, 'loss': 'mae', 'optimizer': 'adam', 'graph_mode': 'off', 'use_snp_selection': True, 'num_snps': 52536}. Best is trial 36 with value: 0.07683981704169063.
[I 2025-12-05 15:07:21,366] Trial 49 finished with value: 0.06684580884626906 and parameters: {'model_type': 'mlp', 'hidden_dims': '[256, 128, 64]', 'dropout': 0.374407967174249, 'batch_norm': True, 'lr': 0.0007477401371161816, 'weight_decay': 3.4302226918617493e-06, 'epochs': 288, 'loss': 'mse', 'optimizer': 'adam', 'graph_mode': 'off', 'use_snp_selection': True, 'num_snps': 27605}. Best is trial 36 with value: 0.07683981704169063.
[I 2025-12-05 15:07:23,414] Trial 50 finished with value: 0.019934144986109983 and parameters: {'model_type': 'mlp', 'hidden_dims': '[512, 64]', 'dropout': 0.21429462165126387, 'batch_norm': True, 'lr': 1.0622088740885973e-06, 'weight_decay': 1.8593638479680208e-06, 'epochs': 104, 'loss': 'mae', 'optimizer': 'adam', 'graph_mode': 'off', 'use_snp_selection': True, 'num_snps': 38188}. Best is trial 36 with value: 0.07683981704169063.
[I 2025-12-05 15:07:26,574] Trial 51 finished with value: 0.0631582832271927 and parameters: {'model_type': 'mlp', 'hidden_dims': '[512, 128]', 'dropout': 0.10683530008038618, 'batch_norm': True, 'lr': 0.00023645783664320982, 'weight_decay': 7.417807105263948e-06, 'epochs': 313, 'loss': 'mae', 'optimizer': 'adam', 'graph_mode': 'off', 'use_snp_selection': True, 'num_snps': 54413}. Best is trial 36 with value: 0.07683981704169063.
[I 2025-12-05 15:07:29,523] Trial 52 finished with value: 0.057159904579813126 and parameters: {'model_type': 'mlp', 'hidden_dims': '[512, 128]', 'dropout': 0.14564519826328123, 'batch_norm': True, 'lr': 0.0001483706200978002, 'weight_decay': 1.5827430532567282e-05, 'epochs': 329, 'loss': 'mae', 'optimizer': 'adam', 'graph_mode': 'off', 'use_snp_selection': True, 'num_snps': 48454}. Best is trial 36 with value: 0.07683981704169063.
[I 2025-12-05 15:07:31,983] Trial 53 finished with value: 0.0697529201572449 and parameters: {'model_type': 'mlp', 'hidden_dims': '[256, 128]', 'dropout': 0.17979380299835704, 'batch_norm': True, 'lr': 0.0003532348665735488, 'weight_decay': 1.2476554344700396e-07, 'epochs': 350, 'loss': 'mae', 'optimizer': 'adam', 'graph_mode': 'off', 'use_snp_selection': True, 'num_snps': 43787}. Best is trial 36 with value: 0.07683981704169063.
[I 2025-12-05 15:07:33,942] Trial 54 finished with value: 0.05535472447407631 and parameters: {'model_type': 'mlp', 'hidden_dims': '[512, 128]', 'dropout': 0.11748772560676879, 'batch_norm': True, 'lr': 0.00027509010942148026, 'weight_decay': 1.5082170561403619e-06, 'epochs': 257, 'loss': 'mae', 'optimizer': 'adam', 'graph_mode': 'off', 'use_snp_selection': True, 'num_snps': 32628}. Best is trial 36 with value: 0.07683981704169063.
[I 2025-12-05 15:07:34,636] Trial 55 finished with value: 0.07190366128168169 and parameters: {'model_type': 'mlp', 'hidden_dims': '[128, 64]', 'dropout': 0.24996535494574457, 'batch_norm': True, 'lr': 0.0001958785955076789, 'weight_decay': 4.955606828409617e-06, 'epochs': 74, 'loss': 'mae', 'optimizer': 'adam', 'graph_mode': 'off', 'use_snp_selection': False}. Best is trial 36 with value: 0.07683981704169063.
[I 2025-12-05 15:07:35,341] Trial 56 finished with value: 0.019557408331904655 and parameters: {'model_type': 'mlp', 'hidden_dims': '[128, 64]', 'dropout': 0.24430870403759575, 'batch_norm': True, 'lr': 4.713263094603128e-05, 'weight_decay': 5.767475211816227e-06, 'epochs': 70, 'loss': 'mae', 'optimizer': 'adam', 'graph_mode': 'off', 'use_snp_selection': False}. Best is trial 36 with value: 0.07683981704169063.
[I 2025-12-05 15:07:36,082] Trial 57 finished with value: 0.04152681078833972 and parameters: {'model_type': 'mlp', 'hidden_dims': '[128, 64]', 'dropout': 0.1579557758581161, 'batch_norm': True, 'lr': 0.00019474271104685098, 'weight_decay': 2.9773706761924675e-06, 'epochs': 68, 'loss': 'mae', 'optimizer': 'adam', 'graph_mode': 'off', 'use_snp_selection': False}. Best is trial 36 with value: 0.07683981704169063.
[I 2025-12-05 15:07:38,556] Trial 58 finished with value: 0.012770527273178327 and parameters: {'model_type': 'mlp', 'hidden_dims': '[128, 64]', 'dropout': 0.2782770816539305, 'batch_norm': False, 'lr': 0.00043133481604813837, 'weight_decay': 4.5591216147559933e-07, 'epochs': 90, 'loss': 'mae', 'optimizer': 'adam', 'graph_mode': 'off', 'use_snp_selection': True, 'num_snps': 55590}. Best is trial 36 with value: 0.07683981704169063.
[I 2025-12-05 15:07:39,437] Trial 59 finished with value: 0.07280485981511253 and parameters: {'model_type': 'mlp', 'hidden_dims': '[256, 128, 64]', 'dropout': 0.18517385316078017, 'batch_norm': True, 'lr': 0.0007092557323101483, 'weight_decay': 0.0006219577227448957, 'epochs': 113, 'loss': 'mae', 'optimizer': 'adam', 'graph_mode': 'off', 'use_snp_selection': False}. Best is trial 36 with value: 0.07683981704169063.
[I 2025-12-05 15:07:40,321] Trial 60 finished with value: 0.028542249076410384 and parameters: {'model_type': 'mlp', 'hidden_dims': '[256, 128, 64]', 'dropout': 0.2984649580138528, 'batch_norm': True, 'lr': 0.0006150393686089364, 'weight_decay': 0.0003474445606304826, 'epochs': 110, 'loss': 'mse', 'optimizer': 'adam', 'graph_mode': 'off', 'use_snp_selection': False}. Best is trial 36 with value: 0.07683981704169063.
[I 2025-12-05 15:07:41,247] Trial 61 finished with value: 0.06625763673474648 and parameters: {'model_type': 'mlp', 'hidden_dims': '[256, 128, 64]', 'dropout': 0.19173888400376152, 'batch_norm': True, 'lr': 0.0007736943396337484, 'weight_decay': 9.0892431296486e-06, 'epochs': 135, 'loss': 'mae', 'optimizer': 'adam', 'graph_mode': 'off', 'use_snp_selection': False}. Best is trial 36 with value: 0.07683981704169063.
[I 2025-12-05 15:07:42,061] Trial 62 finished with value: 0.0352771094853991 and parameters: {'model_type': 'mlp', 'hidden_dims': '[256, 128, 64]', 'dropout': 0.23897946859766472, 'batch_norm': True, 'lr': 0.0009872181666067974, 'weight_decay': 4.967242164542448e-06, 'epochs': 84, 'loss': 'mae', 'optimizer': 'adam', 'graph_mode': 'off', 'use_snp_selection': False}. Best is trial 36 with value: 0.07683981704169063.
[I 2025-12-05 15:07:42,858] Trial 63 finished with value: 0.06338000238345792 and parameters: {'model_type': 'mlp', 'hidden_dims': '[128, 64]', 'dropout': 0.1410244341578548, 'batch_norm': True, 'lr': 0.000496708151046961, 'weight_decay': 0.0007160999944398778, 'epochs': 149, 'loss': 'mae', 'optimizer': 'adam', 'graph_mode': 'off', 'use_snp_selection': False}. Best is trial 36 with value: 0.07683981704169063.
[I 2025-12-05 15:07:43,617] Trial 64 finished with value: 0.025483412551978755 and parameters: {'model_type': 'mlp', 'hidden_dims': '[256, 128, 64]', 'dropout': 0.2079943326500952, 'batch_norm': True, 'lr': 0.0003414763897430456, 'weight_decay': 8.936182240996791e-07, 'epochs': 64, 'loss': 'mae', 'optimizer': 'adam', 'graph_mode': 'off', 'use_snp_selection': False}. Best is trial 36 with value: 0.07683981704169063.
[I 2025-12-05 15:07:44,781] Trial 65 finished with value: 0.04366325919569072 and parameters: {'model_type': 'mlp', 'hidden_dims': '[512, 64]', 'dropout': 0.260026171882221, 'batch_norm': True, 'lr': 0.00014618686038903004, 'weight_decay': 0.0001379806021994, 'epochs': 118, 'loss': 'mae', 'optimizer': 'adam', 'graph_mode': 'off', 'use_snp_selection': False}. Best is trial 36 with value: 0.07683981704169063.
[I 2025-12-05 15:07:45,751] Trial 66 finished with value: 0.03814063855583579 and parameters: {'model_type': 'mlp', 'hidden_dims': '[512, 256]', 'dropout': 0.3101630078045296, 'batch_norm': True, 'lr': 0.00022305444804065293, 'weight_decay': 1.733224345437616e-06, 'epochs': 54, 'loss': 'mae', 'optimizer': 'adam', 'graph_mode': 'off', 'use_snp_selection': False}. Best is trial 36 with value: 0.07683981704169063.
[I 2025-12-05 15:07:46,547] Trial 67 finished with value: 0.06915483582715898 and parameters: {'model_type': 'mlp', 'hidden_dims': '[128, 64]', 'dropout': 0.17005453759116096, 'batch_norm': True, 'lr': 0.0003135852331997236, 'weight_decay': 3.03411708708235e-06, 'epochs': 103, 'loss': 'mae', 'optimizer': 'adam', 'graph_mode': 'off', 'use_snp_selection': False}. Best is trial 36 with value: 0.07683981704169063.
[I 2025-12-05 15:07:47,935] Trial 68 finished with value: 0.03236627615995326 and parameters: {'model_type': 'mlp', 'hidden_dims': '[512, 256]', 'dropout': 0.18681992469838682, 'batch_norm': True, 'lr': 0.00010439718948107968, 'weight_decay': 1.2281849013124212e-06, 'epochs': 43, 'loss': 'mae', 'optimizer': 'adam', 'graph_mode': 'off', 'use_snp_selection': True, 'num_snps': 24278}. Best is trial 36 with value: 0.07683981704169063.
[I 2025-12-05 15:07:48,882] Trial 69 finished with value: 0.06318147483783784 and parameters: {'model_type': 'mlp', 'hidden_dims': '[256, 128]', 'dropout': 0.13589863927085094, 'batch_norm': True, 'lr': 0.0006382740270355817, 'weight_decay': 2.950603338174601e-07, 'epochs': 162, 'loss': 'mae', 'optimizer': 'adam', 'graph_mode': 'off', 'use_snp_selection': False}. Best is trial 36 with value: 0.07683981704169063.
[I 2025-12-05 15:07:49,933] Trial 70 finished with value: 0.020349914760746015 and parameters: {'model_type': 'mlp', 'hidden_dims': '[512, 64]', 'dropout': 0.15920068332603227, 'batch_norm': False, 'lr': 0.00048241842692740654, 'weight_decay': 1.4936275117644777e-07, 'epochs': 80, 'loss': 'mse', 'optimizer': 'adam', 'graph_mode': 'off', 'use_snp_selection': False}. Best is trial 36 with value: 0.07683981704169063.
[I 2025-12-05 15:07:51,642] Trial 71 finished with value: 0.0587345972204648 and parameters: {'model_type': 'mlp', 'hidden_dims': '[512, 128]', 'dropout': 0.10062792486022816, 'batch_norm': True, 'lr': 0.000263786332952721, 'weight_decay': 8.972371702633287e-06, 'epochs': 297, 'loss': 'mae', 'optimizer': 'adam', 'graph_mode': 'off', 'use_snp_selection': False}. Best is trial 36 with value: 0.07683981704169063.
[I 2025-12-05 15:07:53,288] Trial 72 finished with value: 0.07221982797153381 and parameters: {'model_type': 'mlp', 'hidden_dims': '[512, 256]', 'dropout': 0.11859785975386646, 'batch_norm': True, 'lr': 0.00019306317521095774, 'weight_decay': 5.356896022611231e-07, 'epochs': 279, 'loss': 'mae', 'optimizer': 'adam', 'graph_mode': 'off', 'use_snp_selection': False}. Best is trial 36 with value: 0.07683981704169063.
[I 2025-12-05 15:07:54,797] Trial 73 finished with value: 0.06642235392378268 and parameters: {'model_type': 'mlp', 'hidden_dims': '[512, 256]', 'dropout': 0.12383517092415117, 'batch_norm': True, 'lr': 0.00018241560048155888, 'weight_decay': 5.844032323279977e-07, 'epochs': 218, 'loss': 'mae', 'optimizer': 'adam', 'graph_mode': 'off', 'use_snp_selection': False}. Best is trial 36 with value: 0.07683981704169063.
[I 2025-12-05 15:07:56,468] Trial 74 finished with value: 0.05225171180270197 and parameters: {'model_type': 'mlp', 'hidden_dims': '[512, 256]', 'dropout': 0.3470711729520014, 'batch_norm': True, 'lr': 0.0003889884199725395, 'weight_decay': 5.282391619634767e-07, 'epochs': 271, 'loss': 'mae', 'optimizer': 'adam', 'graph_mode': 'off', 'use_snp_selection': False}. Best is trial 36 with value: 0.07683981704169063.
[I 2025-12-05 15:07:58,149] Trial 75 finished with value: 0.07498787729318704 and parameters: {'model_type': 'mlp', 'hidden_dims': '[512, 256]', 'dropout': 0.1382661892882145, 'batch_norm': True, 'lr': 0.0001482829917362012, 'weight_decay': 8.078899342800133e-07, 'epochs': 279, 'loss': 'mae', 'optimizer': 'adam', 'graph_mode': 'off', 'use_snp_selection': False}. Best is trial 36 with value: 0.07683981704169063.
[I 2025-12-05 15:07:59,848] Trial 76 finished with value: 0.054977916612759366 and parameters: {'model_type': 'mlp', 'hidden_dims': '[512, 256]', 'dropout': 0.13880530377168898, 'batch_norm': True, 'lr': 0.00014598346487259615, 'weight_decay': 7.676002517217574e-07, 'epochs': 282, 'loss': 'mae', 'optimizer': 'adam', 'graph_mode': 'off', 'use_snp_selection': False}. Best is trial 36 with value: 0.07683981704169063.
[I 2025-12-05 15:08:02,182] Trial 77 finished with value: 0.059348861380226464 and parameters: {'model_type': 'mlp', 'hidden_dims': '[512, 256]', 'dropout': 0.11563405833200216, 'batch_norm': True, 'lr': 0.0003044760762957068, 'weight_decay': 3.2460818404153905e-07, 'epochs': 238, 'loss': 'mae', 'optimizer': 'adam', 'graph_mode': 'off', 'use_snp_selection': True, 'num_snps': 42884}. Best is trial 36 with value: 0.07683981704169063.
[I 2025-12-05 15:08:04,019] Trial 78 finished with value: 0.056693169350943914 and parameters: {'model_type': 'mlp', 'hidden_dims': '[512, 256]', 'dropout': 0.41425829487154486, 'batch_norm': True, 'lr': 0.0008221911534672714, 'weight_decay': 1.1117464623288672e-06, 'epochs': 324, 'loss': 'mse', 'optimizer': 'adam', 'graph_mode': 'off', 'use_snp_selection': False}. Best is trial 36 with value: 0.07683981704169063.
[I 2025-12-05 15:08:06,801] Trial 79 finished with value: 0.07377901981294538 and parameters: {'model_type': 'mlp', 'hidden_dims': '[512, 256]', 'dropout': 0.1573922217502171, 'batch_norm': True, 'lr': 1.0618598153533742e-05, 'weight_decay': 3.201577100064853e-07, 'epochs': 248, 'loss': 'mae', 'optimizer': 'adam', 'graph_mode': 'off', 'use_snp_selection': True, 'num_snps': 48493}. Best is trial 36 with value: 0.07683981704169063.
[I 2025-12-05 15:08:09,290] Trial 80 finished with value: 0.02276584304545149 and parameters: {'model_type': 'mlp', 'hidden_dims': '[512, 256]', 'dropout': 0.16345478496029234, 'batch_norm': True, 'lr': 7.2675266077697e-06, 'weight_decay': 3.1758329528247443e-07, 'epochs': 306, 'loss': 'mae', 'optimizer': 'adam', 'graph_mode': 'off', 'use_snp_selection': True, 'num_snps': 41070}. Best is trial 36 with value: 0.07683981704169063.
[I 2025-12-05 15:08:11,911] Trial 81 finished with value: 0.03324533830254962 and parameters: {'model_type': 'mlp', 'hidden_dims': '[512, 256]', 'dropout': 0.150523452733779, 'batch_norm': True, 'lr': 1.4376697656926773e-05, 'weight_decay': 1.8932932831147047e-07, 'epochs': 264, 'loss': 'mae', 'optimizer': 'adam', 'graph_mode': 'off', 'use_snp_selection': True, 'num_snps': 47553}. Best is trial 36 with value: 0.07683981704169063.
[I 2025-12-05 15:08:14,096] Trial 82 finished with value: 0.04979263864484472 and parameters: {'model_type': 'mlp', 'hidden_dims': '[512, 256]', 'dropout': 0.13107748171281386, 'batch_norm': True, 'lr': 2.8892391338709716e-05, 'weight_decay': 4.972780072181186e-07, 'epochs': 254, 'loss': 'mae', 'optimizer': 'adam', 'graph_mode': 'off', 'use_snp_selection': True, 'num_snps': 35182}. Best is trial 36 with value: 0.07683981704169063.
[I 2025-12-05 15:08:16,945] Trial 83 finished with value: -0.017555411426038954 and parameters: {'model_type': 'mlp', 'hidden_dims': '[512, 256]', 'dropout': 0.11109865291054638, 'batch_norm': True, 'lr': 3.166715072511319e-06, 'weight_decay': 9.83372096701113e-07, 'epochs': 249, 'loss': 'mae', 'optimizer': 'adam', 'graph_mode': 'off', 'use_snp_selection': True, 'num_snps': 51664}. Best is trial 36 with value: 0.07683981704169063.
[I 2025-12-05 15:08:19,893] Trial 84 finished with value: 0.022521541896745385 and parameters: {'model_type': 'mlp', 'hidden_dims': '[512, 256]', 'dropout': 0.17901237717755872, 'batch_norm': True, 'lr': 8.319846015158021e-06, 'weight_decay': 2.721026772794839e-07, 'epochs': 228, 'loss': 'mae', 'optimizer': 'adam', 'graph_mode': 'off', 'use_snp_selection': True, 'num_snps': 56297}. Best is trial 36 with value: 0.07683981704169063.
[I 2025-12-05 15:08:22,583] Trial 85 finished with value: 0.0585011046278208 and parameters: {'model_type': 'mlp', 'hidden_dims': '[512, 64]', 'dropout': 0.1468314257202133, 'batch_norm': True, 'lr': 5.970816526003059e-05, 'weight_decay': 1.5241631721969442e-06, 'epochs': 285, 'loss': 'mae', 'optimizer': 'adam', 'graph_mode': 'off', 'use_snp_selection': True, 'num_snps': 48046}. Best is trial 36 with value: 0.07683981704169063.
[I 2025-12-05 15:08:24,183] Trial 86 finished with value: -0.005948157523896294 and parameters: {'model_type': 'mlp', 'hidden_dims': '[512, 256]', 'dropout': 0.12466071993913228, 'batch_norm': False, 'lr': 0.0005656215614726212, 'weight_decay': 1.4872977678195987e-07, 'epochs': 271, 'loss': 'mse', 'optimizer': 'adam', 'graph_mode': 'off', 'use_snp_selection': False}. Best is trial 36 with value: 0.07683981704169063.
[I 2025-12-05 15:08:26,898] Trial 87 finished with value: 0.022302409300991574 and parameters: {'model_type': 'mlp', 'hidden_dims': '[256, 128, 64]', 'dropout': 0.19737165734624207, 'batch_norm': True, 'lr': 1.4741841556117575e-05, 'weight_decay': 1.0000823891753864e-07, 'epochs': 211, 'loss': 'mae', 'optimizer': 'adam', 'graph_mode': 'off', 'use_snp_selection': True, 'num_snps': 59543}. Best is trial 36 with value: 0.07683981704169063.
[I 2025-12-05 15:08:28,456] Trial 88 finished with value: 0.06731229507119091 and parameters: {'model_type': 'mlp', 'hidden_dims': '[512, 64]', 'dropout': 0.1006125873514117, 'batch_norm': True, 'lr': 0.0004539438120009658, 'weight_decay': 7.414483683813994e-07, 'epochs': 246, 'loss': 'mae', 'optimizer': 'adam', 'graph_mode': 'off', 'use_snp_selection': False}. Best is trial 36 with value: 0.07683981704169063.
[I 2025-12-05 15:08:30,991] Trial 89 finished with value: 0.06398552998626743 and parameters: {'model_type': 'mlp', 'hidden_dims': '[512, 256]', 'dropout': 0.16200744066219183, 'batch_norm': True, 'lr': 0.0006819118196622916, 'weight_decay': 3.668363655332494e-07, 'epochs': 339, 'loss': 'mae', 'optimizer': 'adam', 'graph_mode': 'off', 'use_snp_selection': True, 'num_snps': 42249}. Best is trial 36 with value: 0.07683981704169063.
[I 2025-12-05 15:08:32,370] Trial 90 finished with value: 0.061613428810191745 and parameters: {'model_type': 'mlp', 'hidden_dims': '[512, 64]', 'dropout': 0.1418814206989437, 'batch_norm': True, 'lr': 0.00034947724231745484, 'weight_decay': 2.358085593813779e-07, 'epochs': 194, 'loss': 'mse', 'optimizer': 'adam', 'graph_mode': 'off', 'use_snp_selection': False}. Best is trial 36 with value: 0.07683981704169063.
[I 2025-12-05 15:08:33,381] Trial 91 finished with value: 0.06005909449756267 and parameters: {'model_type': 'mlp', 'hidden_dims': '[128, 64]', 'dropout': 0.22358955309369236, 'batch_norm': True, 'lr': 0.0002246484802425103, 'weight_decay': 2.2434216146989596e-06, 'epochs': 305, 'loss': 'mae', 'optimizer': 'adam', 'graph_mode': 'off', 'use_snp_selection': False}. Best is trial 36 with value: 0.07683981704169063.
[I 2025-12-05 15:08:35,092] Trial 92 finished with value: 0.05575597594499467 and parameters: {'model_type': 'mlp', 'hidden_dims': '[512, 256]', 'dropout': 0.13017095036283377, 'batch_norm': True, 'lr': 0.00016333594211241057, 'weight_decay': 4.3688104588641075e-06, 'epochs': 292, 'loss': 'mae', 'optimizer': 'adam', 'graph_mode': 'off', 'use_snp_selection': False}. Best is trial 36 with value: 0.07683981704169063.
[I 2025-12-05 15:08:35,936] Trial 93 finished with value: 0.0571353285790521 and parameters: {'model_type': 'mlp', 'hidden_dims': '[256, 128]', 'dropout': 0.1726388288907842, 'batch_norm': True, 'lr': 0.00027667797886520067, 'weight_decay': 1.1271082590878519e-05, 'epochs': 126, 'loss': 'mae', 'optimizer': 'adam', 'graph_mode': 'off', 'use_snp_selection': False}. Best is trial 36 with value: 0.07683981704169063.
[I 2025-12-05 15:08:37,074] Trial 94 finished with value: 0.041746370368301505 and parameters: {'model_type': 'mlp', 'hidden_dims': '[512, 64]', 'dropout': 0.1839117838368176, 'batch_norm': True, 'lr': 0.00020354450498097408, 'weight_decay': 3.549026561767328e-06, 'epochs': 118, 'loss': 'mae', 'optimizer': 'adam', 'graph_mode': 'off', 'use_snp_selection': False}. Best is trial 36 with value: 0.07683981704169063.
[I 2025-12-05 15:08:37,984] Trial 95 finished with value: 0.07028158565928752 and parameters: {'model_type': 'mlp', 'hidden_dims': '[256, 128, 64]', 'dropout': 0.11662734536203892, 'batch_norm': True, 'lr': 0.00010328119561988242, 'weight_decay': 6.416898681220477e-07, 'epochs': 141, 'loss': 'mae', 'optimizer': 'adam', 'graph_mode': 'off', 'use_snp_selection': False}. Best is trial 36 with value: 0.07683981704169063.
[I 2025-12-05 15:08:40,194] Trial 96 finished with value: 0.06117343578007507 and parameters: {'model_type': 'mlp', 'hidden_dims': '[512, 256]', 'dropout': 0.21300086507499158, 'batch_norm': True, 'lr': 0.0001285719621006123, 'weight_decay': 1.4262566225614924e-06, 'epochs': 316, 'loss': 'mae', 'optimizer': 'adam', 'graph_mode': 'off', 'use_snp_selection': True, 'num_snps': 36053}. Best is trial 36 with value: 0.07683981704169063.
[I 2025-12-05 15:08:41,153] Trial 97 finished with value: 0.060079221727354866 and parameters: {'model_type': 'mlp', 'hidden_dims': '[128, 64]', 'dropout': 0.5925112163154567, 'batch_norm': True, 'lr': 0.0004061658090173418, 'weight_decay': 4.249243384894984e-07, 'epochs': 228, 'loss': 'mae', 'optimizer': 'adam', 'graph_mode': 'off', 'use_snp_selection': False}. Best is trial 36 with value: 0.07683981704169063.
[I 2025-12-05 15:08:42,993] Trial 98 finished with value: 0.05328089055496938 and parameters: {'model_type': 'mlp', 'hidden_dims': '[512, 64]', 'dropout': 0.15241295043129913, 'batch_norm': True, 'lr': 4.2238233455448954e-05, 'weight_decay': 1.332333354120644e-05, 'epochs': 329, 'loss': 'mae', 'optimizer': 'adam', 'graph_mode': 'off', 'use_snp_selection': False}. Best is trial 36 with value: 0.07683981704169063.
