[I 2025-12-05 14:34:07,407] Trial 11 finished with value: 0.030476045211767094 and parameters: {'model_type': 'mlp', 'hidden_dims': '[256, 128]', 'dropout': 0.583942291816117, 'batch_norm': False, 'lr': 1.2467800292900095e-05, 'weight_decay': 2.805519019095577e-06, 'epochs': 231, 'loss': 'mae', 'optimizer': 'adam', 'graph_mode': 'off', 'use_snp_selection': False}. Best is trial 6 with value: 0.10447235252636494.
[I 2025-12-05 14:34:09,921] Trial 12 finished with value: 0.06156896880307651 and parameters: {'model_type': 'mlp', 'hidden_dims': '[512, 64]', 'dropout': 0.3057474628570336, 'batch_norm': False, 'lr': 1.2808693622626188e-05, 'weight_decay': 1.3081036432574914e-07, 'epochs': 240, 'loss': 'mae', 'optimizer': 'adam', 'graph_mode': 'off', 'use_snp_selection': False}. Best is trial 6 with value: 0.10447235252636494.
[I 2025-12-05 14:34:11,025] Trial 13 finished with value: 0.06586324024896174 and parameters: {'model_type': 'mlp', 'hidden_dims': '[128, 64]', 'dropout': 0.5374174870648458, 'batch_norm': False, 'lr': 1.2326138759927248e-05, 'weight_decay': 4.373608364627903e-05, 'epochs': 293, 'loss': 'mse', 'optimizer': 'adam', 'graph_mode': 'off', 'use_snp_selection': False}. Best is trial 6 with value: 0.10447235252636494.
[I 2025-12-05 14:34:14,298] Trial 14 finished with value: 0.06636294302178805 and parameters: {'model_type': 'mlp', 'hidden_dims': '[512, 256]', 'dropout': 0.5143108008659758, 'batch_norm': False, 'lr': 5.096356034191146e-06, 'weight_decay': 3.0607358611649674e-06, 'epochs': 344, 'loss': 'mse', 'optimizer': 'adam', 'graph_mode': 'off', 'use_snp_selection': False}. Best is trial 6 with value: 0.10447235252636494.
[I 2025-12-05 14:34:15,607] Trial 15 finished with value: 0.04519992380156773 and parameters: {'model_type': 'mlp', 'hidden_dims': '[256, 128, 64]', 'dropout': 0.4578474191024107, 'batch_norm': False, 'lr': 0.0001450352870487425, 'weight_decay': 5.343087596659364e-05, 'epochs': 190, 'loss': 'mae', 'optimizer': 'adam', 'graph_mode': 'off', 'use_snp_selection': False}. Best is trial 6 with value: 0.10447235252636494.
[I 2025-12-05 14:34:16,592] Trial 16 finished with value: 0.03798062938618596 and parameters: {'model_type': 'mlp', 'hidden_dims': '[256, 128]', 'dropout': 0.3353063343509913, 'batch_norm': False, 'lr': 2.64355173403339e-05, 'weight_decay': 5.8829269339073385e-06, 'epochs': 98, 'loss': 'mse', 'optimizer': 'adam', 'graph_mode': 'off', 'use_snp_selection': False}. Best is trial 6 with value: 0.10447235252636494.
[I 2025-12-05 14:34:19,374] Trial 17 finished with value: 0.011976319733220045 and parameters: {'model_type': 'mlp', 'hidden_dims': '[512, 64]', 'dropout': 0.5922425043639072, 'batch_norm': False, 'lr': 0.000906375209920231, 'weight_decay': 8.354110012916279e-07, 'epochs': 276, 'loss': 'mae', 'optimizer': 'adam', 'graph_mode': 'off', 'use_snp_selection': False}. Best is trial 6 with value: 0.10447235252636494.
[I 2025-12-05 14:34:22,575] Trial 18 finished with value: 0.04170615430755002 and parameters: {'model_type': 'mlp', 'hidden_dims': '[256, 128]', 'dropout': 0.4757154935037114, 'batch_norm': False, 'lr': 5.4850663591507836e-06, 'weight_decay': 1.4785860713169379e-05, 'epochs': 217, 'loss': 'mse', 'optimizer': 'adam', 'graph_mode': 'off', 'use_snp_selection': True, 'num_snps': 58241}. Best is trial 6 with value: 0.10447235252636494.
[I 2025-12-05 14:34:24,201] Trial 19 finished with value: 0.07751385025544782 and parameters: {'model_type': 'mlp', 'hidden_dims': '[512, 64]', 'dropout': 0.2750482467375479, 'batch_norm': False, 'lr': 2.514044336234027e-05, 'weight_decay': 1.1354159408743119e-07, 'epochs': 119, 'loss': 'mae', 'optimizer': 'adam', 'graph_mode': 'off', 'use_snp_selection': False}. Best is trial 6 with value: 0.10447235252636494.
[I 2025-12-05 14:34:25,259] Trial 20 finished with value: 0.034135481977555907 and parameters: {'model_type': 'mlp', 'hidden_dims': '[512, 128]', 'dropout': 0.3743708852868646, 'batch_norm': False, 'lr': 3.324514570871408e-06, 'weight_decay': 0.00015711537877451736, 'epochs': 43, 'loss': 'mae', 'optimizer': 'adam', 'graph_mode': 'off', 'use_snp_selection': False}. Best is trial 6 with value: 0.10447235252636494.
[I 2025-12-05 14:34:26,980] Trial 21 finished with value: 0.08422521159507067 and parameters: {'model_type': 'mlp', 'hidden_dims': '[512, 64]', 'dropout': 0.25521527902629954, 'batch_norm': False, 'lr': 2.8698439200865996e-05, 'weight_decay': 1.0559369434735215e-07, 'epochs': 133, 'loss': 'mae', 'optimizer': 'adam', 'graph_mode': 'off', 'use_snp_selection': False}. Best is trial 6 with value: 0.10447235252636494.
[I 2025-12-05 14:34:29,018] Trial 22 finished with value: 0.06935046031393019 and parameters: {'model_type': 'mlp', 'hidden_dims': '[512, 64]', 'dropout': 0.21720377392499945, 'batch_norm': False, 'lr': 3.511276726977522e-05, 'weight_decay': 1.1753830675998307e-06, 'epochs': 175, 'loss': 'mae', 'optimizer': 'adam', 'graph_mode': 'off', 'use_snp_selection': False}. Best is trial 6 with value: 0.10447235252636494.
[I 2025-12-05 14:34:30,327] Trial 23 finished with value: 0.06256642133314452 and parameters: {'model_type': 'mlp', 'hidden_dims': '[512, 64]', 'dropout': 0.32642799398891875, 'batch_norm': False, 'lr': 0.00012026034970669996, 'weight_decay': 2.8272187302894396e-07, 'epochs': 77, 'loss': 'mae', 'optimizer': 'adam', 'graph_mode': 'off', 'use_snp_selection': False}. Best is trial 6 with value: 0.10447235252636494.
[I 2025-12-05 14:34:32,125] Trial 24 finished with value: 0.08741397518475837 and parameters: {'model_type': 'mlp', 'hidden_dims': '[512, 64]', 'dropout': 0.2317073265326477, 'batch_norm': False, 'lr': 8.386656177016298e-06, 'weight_decay': 5.016324652695507e-06, 'epochs': 142, 'loss': 'mae', 'optimizer': 'adam', 'graph_mode': 'off', 'use_snp_selection': False}. Best is trial 6 with value: 0.10447235252636494.
[I 2025-12-05 14:34:33,952] Trial 25 finished with value: 0.09031030199561833 and parameters: {'model_type': 'mlp', 'hidden_dims': '[512, 256]', 'dropout': 0.23927338714896781, 'batch_norm': False, 'lr': 1.680280835150185e-05, 'weight_decay': 5.655230864413911e-06, 'epochs': 146, 'loss': 'mae', 'optimizer': 'adam', 'graph_mode': 'off', 'use_snp_selection': False}. Best is trial 6 with value: 0.10447235252636494.
[I 2025-12-05 14:34:35,114] Trial 26 finished with value: 0.02999957322122578 and parameters: {'model_type': 'mlp', 'hidden_dims': '[512, 256]', 'dropout': 0.20162432519973145, 'batch_norm': False, 'lr': 1.0913825496506423e-05, 'weight_decay': 4.722532324896287e-06, 'epochs': 205, 'loss': 'mse', 'optimizer': 'adam', 'graph_mode': 'off', 'use_snp_selection': True, 'num_snps': 3842}. Best is trial 6 with value: 0.10447235252636494.
[I 2025-12-05 14:34:37,101] Trial 27 finished with value: 0.08982468351716097 and parameters: {'model_type': 'mlp', 'hidden_dims': '[512, 256]', 'dropout': 0.2927979262852156, 'batch_norm': False, 'lr': 1.793542760403603e-05, 'weight_decay': 1.7086339684873747e-06, 'epochs': 167, 'loss': 'mae', 'optimizer': 'adam', 'graph_mode': 'off', 'use_snp_selection': False}. Best is trial 6 with value: 0.10447235252636494.
[I 2025-12-05 14:34:39,097] Trial 28 finished with value: 0.07368136492416492 and parameters: {'model_type': 'mlp', 'hidden_dims': '[512, 256]', 'dropout': 0.307421145128435, 'batch_norm': False, 'lr': 1.8734325613178324e-05, 'weight_decay': 1.5243980126251713e-06, 'epochs': 168, 'loss': 'mse', 'optimizer': 'adam', 'graph_mode': 'off', 'use_snp_selection': False}. Best is trial 6 with value: 0.10447235252636494.
[I 2025-12-05 14:34:40,957] Trial 29 finished with value: 0.10666169681421664 and parameters: {'model_type': 'mlp', 'hidden_dims': '[512, 256]', 'dropout': 0.36871251563621976, 'batch_norm': False, 'lr': 4.216478777394918e-05, 'weight_decay': 4.938136213451881e-07, 'epochs': 196, 'loss': 'mae', 'optimizer': 'adam', 'graph_mode': 'off', 'use_snp_selection': True, 'num_snps': 19468}. Best is trial 29 with value: 0.10666169681421664.
[I 2025-12-05 14:34:42,523] Trial 30 finished with value: 0.06290450631113315 and parameters: {'model_type': 'mlp', 'hidden_dims': '[128, 64]', 'dropout': 0.4028309374387494, 'batch_norm': False, 'lr': 5.0199921867791066e-05, 'weight_decay': 3.1562766749972713e-07, 'epochs': 198, 'loss': 'mae', 'optimizer': 'adam', 'graph_mode': 'off', 'use_snp_selection': True, 'num_snps': 18365}. Best is trial 29 with value: 0.10666169681421664.
[I 2025-12-05 14:34:44,410] Trial 31 finished with value: 0.07365993182275074 and parameters: {'model_type': 'mlp', 'hidden_dims': '[512, 256]', 'dropout': 0.3550572117505087, 'batch_norm': False, 'lr': 0.00010500902867159844, 'weight_decay': 5.756948267191604e-07, 'epochs': 173, 'loss': 'mae', 'optimizer': 'adam', 'graph_mode': 'off', 'use_snp_selection': True, 'num_snps': 20689}. Best is trial 29 with value: 0.10666169681421664.
[I 2025-12-05 14:34:46,505] Trial 32 finished with value: 0.0767917032997901 and parameters: {'model_type': 'mlp', 'hidden_dims': '[512, 256]', 'dropout': 0.28774764223904875, 'batch_norm': False, 'lr': 4.031868459952234e-05, 'weight_decay': 7.304553147448641e-06, 'epochs': 253, 'loss': 'mae', 'optimizer': 'adam', 'graph_mode': 'off', 'use_snp_selection': True, 'num_snps': 20754}. Best is trial 29 with value: 0.10666169681421664.
[I 2025-12-05 14:34:49,779] Trial 33 finished with value: 0.0797794036896832 and parameters: {'model_type': 'mlp', 'hidden_dims': '[512, 256]', 'dropout': 0.43586512234392855, 'batch_norm': False, 'lr': 1.824730248039597e-05, 'weight_decay': 2.3279902917838367e-06, 'epochs': 159, 'loss': 'mae', 'optimizer': 'adam', 'graph_mode': 'off', 'use_snp_selection': True, 'num_snps': 50127}. Best is trial 29 with value: 0.10666169681421664.
[I 2025-12-05 14:34:51,019] Trial 34 finished with value: 0.04774642238940584 and parameters: {'model_type': 'mlp', 'hidden_dims': '[512, 256]', 'dropout': 0.35972635962221267, 'batch_norm': False, 'lr': 8.468438683831705e-05, 'weight_decay': 1.0190304734108845e-06, 'epochs': 211, 'loss': 'mae', 'optimizer': 'adam', 'graph_mode': 'off', 'use_snp_selection': True, 'num_snps': 4311}. Best is trial 29 with value: 0.10666169681421664.
[I 2025-12-05 14:34:52,973] Trial 35 finished with value: 0.008865315661047903 and parameters: {'model_type': 'mlp', 'hidden_dims': '[256, 128, 64]', 'dropout': 0.17310306136163234, 'batch_norm': True, 'lr': 2.793831302909404e-06, 'weight_decay': 2.01100584867191e-07, 'epochs': 125, 'loss': 'mae', 'optimizer': 'adam', 'graph_mode': 'off', 'use_snp_selection': True, 'num_snps': 26222}. Best is trial 29 with value: 0.10666169681421664.
[I 2025-12-05 14:34:55,173] Trial 36 finished with value: 0.08379146562499523 and parameters: {'model_type': 'mlp', 'hidden_dims': '[512, 256]', 'dropout': 0.4125049851595154, 'batch_norm': False, 'lr': 1.687411158398133e-05, 'weight_decay': 3.5163499934942565e-06, 'epochs': 192, 'loss': 'mae', 'optimizer': 'adam', 'graph_mode': 'off', 'use_snp_selection': False}. Best is trial 29 with value: 0.10666169681421664.
[I 2025-12-05 14:34:58,346] Trial 37 finished with value: 0.0637978921041574 and parameters: {'model_type': 'mlp', 'hidden_dims': '[512, 256]', 'dropout': 0.24422276723279598, 'batch_norm': True, 'lr': 0.00019607140065678845, 'weight_decay': 8.270058724628606e-06, 'epochs': 257, 'loss': 'mse', 'optimizer': 'adam', 'graph_mode': 'off', 'use_snp_selection': True, 'num_snps': 38290}. Best is trial 29 with value: 0.10666169681421664.
[I 2025-12-05 14:34:59,796] Trial 38 finished with value: 0.09057680981598924 and parameters: {'model_type': 'mlp', 'hidden_dims': '[256, 128]', 'dropout': 0.387900573290708, 'batch_norm': False, 'lr': 4.220232804569539e-05, 'weight_decay': 2.7499448625536218e-05, 'epochs': 222, 'loss': 'mae', 'optimizer': 'adam', 'graph_mode': 'off', 'use_snp_selection': False}. Best is trial 29 with value: 0.10666169681421664.
[I 2025-12-05 14:35:01,351] Trial 39 finished with value: 0.04057405221226067 and parameters: {'model_type': 'mlp', 'hidden_dims': '[256, 128]', 'dropout': 0.38746001417138254, 'batch_norm': True, 'lr': 8.31054750904003e-05, 'weight_decay': 0.00010307559826148637, 'epochs': 219, 'loss': 'mse', 'optimizer': 'adam', 'graph_mode': 'off', 'use_snp_selection': True, 'num_snps': 13361}. Best is trial 29 with value: 0.10666169681421664.
[I 2025-12-05 14:35:02,847] Trial 40 finished with value: 0.06726503460767379 and parameters: {'model_type': 'mlp', 'hidden_dims': '[256, 128]', 'dropout': 0.43863583103485315, 'batch_norm': False, 'lr': 4.262346833868764e-05, 'weight_decay': 3.088503087465943e-05, 'epochs': 235, 'loss': 'mae', 'optimizer': 'adam', 'graph_mode': 'off', 'use_snp_selection': False}. Best is trial 29 with value: 0.10666169681421664.
[I 2025-12-05 14:35:04,063] Trial 41 finished with value: 0.08027757350099504 and parameters: {'model_type': 'mlp', 'hidden_dims': '[256, 128]', 'dropout': 0.31717347526702955, 'batch_norm': False, 'lr': 2.1201956346459546e-05, 'weight_decay': 5.571983840390348e-07, 'epochs': 155, 'loss': 'mae', 'optimizer': 'adam', 'graph_mode': 'off', 'use_snp_selection': False}. Best is trial 29 with value: 0.10666169681421664.
[I 2025-12-05 14:35:05,379] Trial 42 finished with value: 0.055034616350828076 and parameters: {'model_type': 'mlp', 'hidden_dims': '[256, 128]', 'dropout': 0.348445634395082, 'batch_norm': False, 'lr': 7.807085669020941e-06, 'weight_decay': 1.2175482856772056e-05, 'epochs': 182, 'loss': 'mae', 'optimizer': 'adam', 'graph_mode': 'off', 'use_snp_selection': False}. Best is trial 29 with value: 0.10666169681421664.
[I 2025-12-05 14:35:06,976] Trial 43 finished with value: 0.08707175464418872 and parameters: {'model_type': 'mlp', 'hidden_dims': '[512, 256]', 'dropout': 0.2836236012076909, 'batch_norm': False, 'lr': 5.544675207729865e-05, 'weight_decay': 2.144475329948681e-05, 'epochs': 110, 'loss': 'mae', 'optimizer': 'adam', 'graph_mode': 'off', 'use_snp_selection': False}. Best is trial 29 with value: 0.10666169681421664.
[I 2025-12-05 14:35:09,404] Trial 44 finished with value: 0.11896642691647082 and parameters: {'model_type': 'mlp', 'hidden_dims': '[512, 128]', 'dropout': 0.39259056341821386, 'batch_norm': False, 'lr': 3.6660777863141424e-05, 'weight_decay': 1.625459747524593e-06, 'epochs': 224, 'loss': 'mae', 'optimizer': 'adam', 'graph_mode': 'off', 'use_snp_selection': False}. Best is trial 44 with value: 0.11896642691647082.
[I 2025-12-05 14:35:11,846] Trial 45 finished with value: 0.11829589502325977 and parameters: {'model_type': 'mlp', 'hidden_dims': '[512, 128]', 'dropout': 0.4782318177409398, 'batch_norm': False, 'lr': 3.544877555530837e-05, 'weight_decay': 9.378705675028787e-05, 'epochs': 226, 'loss': 'mae', 'optimizer': 'adam', 'graph_mode': 'off', 'use_snp_selection': False}. Best is trial 44 with value: 0.11896642691647082.
[I 2025-12-05 14:35:14,612] Trial 46 finished with value: 0.05893473689429945 and parameters: {'model_type': 'mlp', 'hidden_dims': '[512, 128]', 'dropout': 0.4930709606094824, 'batch_norm': True, 'lr': 6.632201537998401e-05, 'weight_decay': 0.00027195770866829947, 'epochs': 267, 'loss': 'mse', 'optimizer': 'adam', 'graph_mode': 'off', 'use_snp_selection': False}. Best is trial 44 with value: 0.11896642691647082.
[I 2025-12-05 14:35:17,053] Trial 47 finished with value: 0.07842834118273853 and parameters: {'model_type': 'mlp', 'hidden_dims': '[512, 128]', 'dropout': 0.43492616604345663, 'batch_norm': False, 'lr': 3.403032262783504e-05, 'weight_decay': 0.000576185324529192, 'epochs': 226, 'loss': 'mae', 'optimizer': 'adam', 'graph_mode': 'off', 'use_snp_selection': False}. Best is trial 44 with value: 0.11896642691647082.
[I 2025-12-05 14:35:20,012] Trial 48 finished with value: 0.07405268189784397 and parameters: {'model_type': 'mlp', 'hidden_dims': '[512, 128]', 'dropout': 0.39769892810886065, 'batch_norm': False, 'lr': 4.4990777483337e-05, 'weight_decay': 0.00010191340832684977, 'epochs': 300, 'loss': 'mse', 'optimizer': 'adam', 'graph_mode': 'off', 'use_snp_selection': False}. Best is trial 44 with value: 0.11896642691647082.
[I 2025-12-05 14:35:22,586] Trial 49 finished with value: 0.08383693360489933 and parameters: {'model_type': 'mlp', 'hidden_dims': '[512, 128]', 'dropout': 0.4593220175286418, 'batch_norm': False, 'lr': 0.0003819183531742419, 'weight_decay': 8.340996183508925e-05, 'epochs': 247, 'loss': 'mae', 'optimizer': 'adam', 'graph_mode': 'off', 'use_snp_selection': False}. Best is trial 44 with value: 0.11896642691647082.
[I 2025-12-05 14:35:24,848] Trial 50 finished with value: 0.09549145541143336 and parameters: {'model_type': 'mlp', 'hidden_dims': '[512, 128]', 'dropout': 0.5424406998226974, 'batch_norm': True, 'lr': 0.0001679563772814585, 'weight_decay': 3.080978053838965e-05, 'epochs': 203, 'loss': 'mae', 'optimizer': 'adam', 'graph_mode': 'off', 'use_snp_selection': False}. Best is trial 44 with value: 0.11896642691647082.
[I 2025-12-05 14:35:27,301] Trial 51 finished with value: 0.0514369758713045 and parameters: {'model_type': 'mlp', 'hidden_dims': '[512, 128]', 'dropout': 0.5532700648534894, 'batch_norm': True, 'lr': 0.0001808948452363867, 'weight_decay': 2.8470874247523384e-05, 'epochs': 228, 'loss': 'mae', 'optimizer': 'adam', 'graph_mode': 'off', 'use_snp_selection': False}. Best is trial 44 with value: 0.11896642691647082.
[I 2025-12-05 14:35:29,548] Trial 52 finished with value: 0.07778315892550261 and parameters: {'model_type': 'mlp', 'hidden_dims': '[512, 128]', 'dropout': 0.4954093939739367, 'batch_norm': True, 'lr': 0.0003590813020460575, 'weight_decay': 3.817305775470573e-05, 'epochs': 201, 'loss': 'mae', 'optimizer': 'adam', 'graph_mode': 'off', 'use_snp_selection': False}. Best is trial 44 with value: 0.11896642691647082.
[I 2025-12-05 14:35:31,878] Trial 53 finished with value: 0.06860313905217945 and parameters: {'model_type': 'mlp', 'hidden_dims': '[512, 128]', 'dropout': 0.5561768280626619, 'batch_norm': True, 'lr': 0.0007412524347230195, 'weight_decay': 6.477758297673723e-05, 'epochs': 211, 'loss': 'mae', 'optimizer': 'adam', 'graph_mode': 'off', 'use_snp_selection': False}. Best is trial 44 with value: 0.11896642691647082.
[I 2025-12-05 14:35:32,824] Trial 54 finished with value: 0.03965582431556363 and parameters: {'model_type': 'mlp', 'hidden_dims': '[128, 64]', 'dropout': 0.5042856817108524, 'batch_norm': True, 'lr': 7.664102762355028e-05, 'weight_decay': 0.00019450546884274488, 'epochs': 190, 'loss': 'mae', 'optimizer': 'adam', 'graph_mode': 'off', 'use_snp_selection': False}. Best is trial 44 with value: 0.11896642691647082.
[I 2025-12-05 14:35:35,365] Trial 55 finished with value: 0.08256970568667886 and parameters: {'model_type': 'mlp', 'hidden_dims': '[512, 128]', 'dropout': 0.3685221083819121, 'batch_norm': True, 'lr': 0.00010806727417104965, 'weight_decay': 1.6293144346354708e-05, 'epochs': 240, 'loss': 'mae', 'optimizer': 'adam', 'graph_mode': 'off', 'use_snp_selection': False}. Best is trial 44 with value: 0.11896642691647082.
[I 2025-12-05 14:35:36,945] Trial 56 finished with value: 0.08250430277261436 and parameters: {'model_type': 'mlp', 'hidden_dims': '[256, 128, 64]', 'dropout': 0.4679252660986221, 'batch_norm': False, 'lr': 3.286707668180659e-05, 'weight_decay': 1.8370532189021574e-07, 'epochs': 262, 'loss': 'mse', 'optimizer': 'adam', 'graph_mode': 'off', 'use_snp_selection': False}. Best is trial 44 with value: 0.11896642691647082.
[I 2025-12-05 14:35:38,351] Trial 57 finished with value: 0.0898601729431964 and parameters: {'model_type': 'mlp', 'hidden_dims': '[256, 128]', 'dropout': 0.42349876410246495, 'batch_norm': False, 'lr': 0.0002808391516406343, 'weight_decay': 7.847658743177741e-07, 'epochs': 216, 'loss': 'mae', 'optimizer': 'adam', 'graph_mode': 'off', 'use_snp_selection': False}. Best is trial 44 with value: 0.11896642691647082.
[I 2025-12-05 14:35:40,997] Trial 58 finished with value: 0.08166992283604106 and parameters: {'model_type': 'mlp', 'hidden_dims': '[512, 128]', 'dropout': 0.5303296753294615, 'batch_norm': False, 'lr': 2.434725513648966e-05, 'weight_decay': 4.1443879679137555e-07, 'epochs': 285, 'loss': 'mae', 'optimizer': 'adam', 'graph_mode': 'off', 'use_snp_selection': True, 'num_snps': 28730}. Best is trial 44 with value: 0.11896642691647082.
[I 2025-12-05 14:35:42,315] Trial 59 finished with value: 0.07046361314124269 and parameters: {'model_type': 'mlp', 'hidden_dims': '[256, 128]', 'dropout': 0.3840238655200747, 'batch_norm': True, 'lr': 0.00015323581757762284, 'weight_decay': 4.5417617288393424e-05, 'epochs': 182, 'loss': 'mse', 'optimizer': 'adam', 'graph_mode': 'off', 'use_snp_selection': False}. Best is trial 44 with value: 0.11896642691647082.
[I 2025-12-05 14:35:44,712] Trial 60 finished with value: 0.0849228880191197 and parameters: {'model_type': 'mlp', 'hidden_dims': '[512, 128]', 'dropout': 0.575982492340515, 'batch_norm': False, 'lr': 5.379047769231522e-05, 'weight_decay': 0.0001546700331594097, 'epochs': 223, 'loss': 'mae', 'optimizer': 'adam', 'graph_mode': 'off', 'use_snp_selection': False}. Best is trial 44 with value: 0.11896642691647082.
[I 2025-12-05 14:35:46,070] Trial 61 finished with value: 0.07144487453304207 and parameters: {'model_type': 'mlp', 'hidden_dims': '[256, 128]', 'dropout': 0.33982268316730746, 'batch_norm': False, 'lr': 9.5969201065762e-06, 'weight_decay': 4.002532814789545e-06, 'epochs': 202, 'loss': 'mae', 'optimizer': 'adam', 'graph_mode': 'off', 'use_snp_selection': False}. Best is trial 44 with value: 0.11896642691647082.
[I 2025-12-05 14:35:46,989] Trial 62 finished with value: 0.09720347670539639 and parameters: {'model_type': 'mlp', 'hidden_dims': '[128, 64]', 'dropout': 0.41707313946661423, 'batch_norm': False, 'lr': 0.0005057105637295744, 'weight_decay': 1.291202070619474e-06, 'epochs': 187, 'loss': 'mae', 'optimizer': 'adam', 'graph_mode': 'off', 'use_snp_selection': False}. Best is trial 44 with value: 0.11896642691647082.
