[I 2025-12-05 14:28:45,242] Trial 7 finished with value: 0.05145022552875146 and parameters: {'model_type': 'mlp', 'hidden_dims': '[512, 256]', 'dropout': 0.15343979219678458, 'batch_norm': True, 'lr': 6.234003099047341e-05, 'weight_decay': 3.894760610535477e-07, 'epochs': 97, 'loss': 'mse', 'optimizer': 'adam', 'graph_mode': 'off', 'use_snp_selection': False}. Best is trial 5 with value: 0.06552593845841431.
[I 2025-12-05 14:28:47,263] Trial 8 finished with value: 0.05111165259596942 and parameters: {'model_type': 'mlp', 'hidden_dims': '[512, 128]', 'dropout': 0.10743001231661406, 'batch_norm': True, 'lr': 0.00023728538449271062, 'weight_decay': 1.7629071578048637e-05, 'epochs': 312, 'loss': 'mae', 'optimizer': 'adam', 'graph_mode': 'off', 'use_snp_selection': False}. Best is trial 5 with value: 0.06552593845841431.
[I 2025-12-05 14:28:48,680] Trial 9 finished with value: 0.049629875757737335 and parameters: {'model_type': 'mlp', 'hidden_dims': '[512, 64]', 'dropout': 0.14505336736221927, 'batch_norm': True, 'lr': 5.8619638388111826e-05, 'weight_decay': 6.200156172669308e-07, 'epochs': 175, 'loss': 'mse', 'optimizer': 'adam', 'graph_mode': 'off', 'use_snp_selection': False}. Best is trial 5 with value: 0.06552593845841431.
[I 2025-12-05 14:28:49,767] Trial 10 finished with value: 0.05760897435092056 and parameters: {'model_type': 'mlp', 'hidden_dims': '[512, 64]', 'dropout': 0.5224835849021415, 'batch_norm': False, 'lr': 1.080428984628536e-05, 'weight_decay': 0.0005512938102173812, 'epochs': 43, 'loss': 'mae', 'optimizer': 'adam', 'graph_mode': 'off', 'use_snp_selection': True, 'num_snps': 16574}. Best is trial 5 with value: 0.06552593845841431.
[I 2025-12-05 14:28:50,893] Trial 11 finished with value: 0.030078102384475773 and parameters: {'model_type': 'mlp', 'hidden_dims': '[512, 64]', 'dropout': 0.5327859396481079, 'batch_norm': False, 'lr': 6.951156193174868e-06, 'weight_decay': 0.000903081830310424, 'epochs': 46, 'loss': 'mae', 'optimizer': 'adam', 'graph_mode': 'off', 'use_snp_selection': True, 'num_snps': 17029}. Best is trial 5 with value: 0.06552593845841431.
[I 2025-12-05 14:28:52,225] Trial 12 finished with value: 0.016505638684788618 and parameters: {'model_type': 'mlp', 'hidden_dims': '[512, 64]', 'dropout': 0.30778189624818614, 'batch_norm': False, 'lr': 1.5176538206550417e-05, 'weight_decay': 0.00010802589751641776, 'epochs': 41, 'loss': 'mae', 'optimizer': 'adam', 'graph_mode': 'off', 'use_snp_selection': True, 'num_snps': 23625}. Best is trial 5 with value: 0.06552593845841431.
[I 2025-12-05 14:28:54,897] Trial 13 finished with value: 0.038192718524237404 and parameters: {'model_type': 'mlp', 'hidden_dims': '[512, 64]', 'dropout': 0.495085382762394, 'batch_norm': False, 'lr': 1.5276186177400635e-05, 'weight_decay': 0.0009249050209925402, 'epochs': 113, 'loss': 'mae', 'optimizer': 'adam', 'graph_mode': 'off', 'use_snp_selection': True, 'num_snps': 54655}. Best is trial 5 with value: 0.06552593845841431.
[I 2025-12-05 14:28:55,684] Trial 14 finished with value: 0.04411256744262388 and parameters: {'model_type': 'mlp', 'hidden_dims': '[512, 256]', 'dropout': 0.3498639583530954, 'batch_norm': True, 'lr': 0.0008945158798110674, 'weight_decay': 3.6451160452997524e-06, 'epochs': 93, 'loss': 'mae', 'optimizer': 'adam', 'graph_mode': 'off', 'use_snp_selection': True, 'num_snps': 3810}. Best is trial 5 with value: 0.06552593845841431.
[I 2025-12-05 14:28:57,329] Trial 15 finished with value: 0.032643220913053814 and parameters: {'model_type': 'mlp', 'hidden_dims': '[256, 128, 64]', 'dropout': 0.48432303720270264, 'batch_norm': False, 'lr': 2.519392314667714e-06, 'weight_decay': 0.0001596878435359552, 'epochs': 218, 'loss': 'mae', 'optimizer': 'adam', 'graph_mode': 'off', 'use_snp_selection': True, 'num_snps': 28480}. Best is trial 5 with value: 0.06552593845841431.
[I 2025-12-05 14:28:59,135] Trial 16 finished with value: -0.011819415774149473 and parameters: {'model_type': 'mlp', 'hidden_dims': '[128, 64]', 'dropout': 0.5951083843397328, 'batch_norm': True, 'lr': 1.0323298387521048e-06, 'weight_decay': 1.0482369643047958e-07, 'epochs': 141, 'loss': 'mae', 'optimizer': 'adam', 'graph_mode': 'off', 'use_snp_selection': True, 'num_snps': 36621}. Best is trial 5 with value: 0.06552593845841431.
[I 2025-12-05 14:29:00,379] Trial 17 finished with value: 0.04918146924733269 and parameters: {'model_type': 'mlp', 'hidden_dims': '[512, 64]', 'dropout': 0.29634835134487325, 'batch_norm': False, 'lr': 1.5106001860183498e-05, 'weight_decay': 0.000419652579471079, 'epochs': 70, 'loss': 'mae', 'optimizer': 'adam', 'graph_mode': 'off', 'use_snp_selection': True, 'num_snps': 19705}. Best is trial 5 with value: 0.06552593845841431.
[I 2025-12-05 14:29:01,430] Trial 18 finished with value: 0.05996877324274433 and parameters: {'model_type': 'mlp', 'hidden_dims': '[512, 64]', 'dropout': 0.5415431027488958, 'batch_norm': True, 'lr': 7.758945550099812e-06, 'weight_decay': 5.804352447750097e-05, 'epochs': 123, 'loss': 'mae', 'optimizer': 'adam', 'graph_mode': 'off', 'use_snp_selection': True, 'num_snps': 10326}. Best is trial 5 with value: 0.06552593845841431.
[I 2025-12-05 14:29:02,279] Trial 19 finished with value: 0.006828621798434788 and parameters: {'model_type': 'mlp', 'hidden_dims': '[512, 64]', 'dropout': 0.4491708215468221, 'batch_norm': True, 'lr': 3.324514570871408e-06, 'weight_decay': 4.679666515308887e-05, 'epochs': 142, 'loss': 'mae', 'optimizer': 'adam', 'graph_mode': 'off', 'use_snp_selection': True, 'num_snps': 3432}. Best is trial 5 with value: 0.06552593845841431.
[I 2025-12-05 14:29:04,899] Trial 20 finished with value: 0.03919632794149275 and parameters: {'model_type': 'mlp', 'hidden_dims': '[512, 256]', 'dropout': 0.3649853224536259, 'batch_norm': True, 'lr': 0.00019933850773556526, 'weight_decay': 4.167826288374101e-06, 'epochs': 176, 'loss': 'mae', 'optimizer': 'adam', 'graph_mode': 'off', 'use_snp_selection': True, 'num_snps': 46131}. Best is trial 5 with value: 0.06552593845841431.
[I 2025-12-05 14:29:05,973] Trial 21 finished with value: 0.03356661531434509 and parameters: {'model_type': 'mlp', 'hidden_dims': '[512, 64]', 'dropout': 0.5418223882029428, 'batch_norm': True, 'lr': 9.017298773912039e-06, 'weight_decay': 0.00010554591832469716, 'epochs': 120, 'loss': 'mae', 'optimizer': 'adam', 'graph_mode': 'off', 'use_snp_selection': True, 'num_snps': 12147}. Best is trial 5 with value: 0.06552593845841431.
[I 2025-12-05 14:29:07,546] Trial 22 finished with value: 0.03303893686010291 and parameters: {'model_type': 'mlp', 'hidden_dims': '[512, 64]', 'dropout': 0.5381994367118762, 'batch_norm': True, 'lr': 2.7496555259612187e-05, 'weight_decay': 0.0006093076485576936, 'epochs': 77, 'loss': 'mae', 'optimizer': 'adam', 'graph_mode': 'off', 'use_snp_selection': True, 'num_snps': 29677}. Best is trial 5 with value: 0.06552593845841431.
[I 2025-12-05 14:29:08,686] Trial 23 finished with value: 0.020730802185518937 and parameters: {'model_type': 'mlp', 'hidden_dims': '[512, 64]', 'dropout': 0.4824607076430091, 'batch_norm': False, 'lr': 8.583403597702555e-06, 'weight_decay': 0.000246439959022417, 'epochs': 169, 'loss': 'mae', 'optimizer': 'adam', 'graph_mode': 'off', 'use_snp_selection': True, 'num_snps': 12432}. Best is trial 5 with value: 0.06552593845841431.
[I 2025-12-05 14:29:10,011] Trial 24 finished with value: 0.03816845502206976 and parameters: {'model_type': 'mlp', 'hidden_dims': '[512, 64]', 'dropout': 0.564032864972505, 'batch_norm': True, 'lr': 2.5169372030807622e-05, 'weight_decay': 5.097947130877431e-05, 'epochs': 65, 'loss': 'mae', 'optimizer': 'adam', 'graph_mode': 'off', 'use_snp_selection': True, 'num_snps': 22847}. Best is trial 5 with value: 0.06552593845841431.
[I 2025-12-05 14:29:10,934] Trial 25 finished with value: 0.0196225450901701 and parameters: {'model_type': 'mlp', 'hidden_dims': '[256, 128]', 'dropout': 0.5009201710881683, 'batch_norm': True, 'lr': 2.34787255417281e-06, 'weight_decay': 0.00014675465661500515, 'epochs': 115, 'loss': 'mae', 'optimizer': 'adam', 'graph_mode': 'off', 'use_snp_selection': True, 'num_snps': 7717}. Best is trial 5 with value: 0.06552593845841431.
[I 2025-12-05 14:29:12,660] Trial 26 finished with value: 0.03391712558435153 and parameters: {'model_type': 'mlp', 'hidden_dims': '[128, 64]', 'dropout': 0.44990557774646717, 'batch_norm': False, 'lr': 5.190170384469151e-06, 'weight_decay': 0.0005260271054104957, 'epochs': 131, 'loss': 'mae', 'optimizer': 'adam', 'graph_mode': 'off', 'use_snp_selection': True, 'num_snps': 35960}. Best is trial 5 with value: 0.06552593845841431.
[I 2025-12-05 14:29:14,045] Trial 27 finished with value: 0.04504184282181537 and parameters: {'model_type': 'mlp', 'hidden_dims': '[512, 128]', 'dropout': 0.37313921930109506, 'batch_norm': True, 'lr': 1.3045241751754792e-05, 'weight_decay': 2.8816915899645494e-05, 'epochs': 231, 'loss': 'mse', 'optimizer': 'adam', 'graph_mode': 'off', 'use_snp_selection': True, 'num_snps': 17185}. Best is trial 5 with value: 0.06552593845841431.
[I 2025-12-05 14:29:15,522] Trial 28 finished with value: -0.03904872300909315 and parameters: {'model_type': 'mlp', 'hidden_dims': '[256, 128, 64]', 'dropout': 0.3165973970029403, 'batch_norm': False, 'lr': 1.6877591951672535e-06, 'weight_decay': 8.047276655667378e-05, 'epochs': 93, 'loss': 'mae', 'optimizer': 'adam', 'graph_mode': 'off', 'use_snp_selection': True, 'num_snps': 26939}. Best is trial 5 with value: 0.06552593845841431.
[I 2025-12-05 14:29:16,599] Trial 29 finished with value: 0.042237274581277406 and parameters: {'model_type': 'mlp', 'hidden_dims': '[128, 64]', 'dropout': 0.41789444592073977, 'batch_norm': True, 'lr': 3.5642355649592275e-06, 'weight_decay': 0.000247151447863692, 'epochs': 198, 'loss': 'mae', 'optimizer': 'adam', 'graph_mode': 'off', 'use_snp_selection': True, 'num_snps': 8772}. Best is trial 5 with value: 0.06552593845841431.
[I 2025-12-05 14:29:18,507] Trial 30 finished with value: 0.05957279511456781 and parameters: {'model_type': 'mlp', 'hidden_dims': '[512, 64]', 'dropout': 0.2698807547865662, 'batch_norm': True, 'lr': 0.00013275937456778462, 'weight_decay': 6.115622987798937e-06, 'epochs': 165, 'loss': 'mae', 'optimizer': 'adam', 'graph_mode': 'off', 'use_snp_selection': True, 'num_snps': 32613}. Best is trial 5 with value: 0.06552593845841431.
[I 2025-12-05 14:29:20,820] Trial 31 finished with value: 0.06079139867240434 and parameters: {'model_type': 'mlp', 'hidden_dims': '[512, 64]', 'dropout': 0.22032836919217527, 'batch_norm': True, 'lr': 0.00018174797393778842, 'weight_decay': 5.416183466278184e-06, 'epochs': 160, 'loss': 'mae', 'optimizer': 'adam', 'graph_mode': 'off', 'use_snp_selection': True, 'num_snps': 42439}. Best is trial 5 with value: 0.06552593845841431.
[I 2025-12-05 14:29:23,141] Trial 32 finished with value: 0.04433863863111671 and parameters: {'model_type': 'mlp', 'hidden_dims': '[512, 64]', 'dropout': 0.22911158304315404, 'batch_norm': True, 'lr': 0.00031844438697070627, 'weight_decay': 6.508570384855083e-06, 'epochs': 162, 'loss': 'mae', 'optimizer': 'adam', 'graph_mode': 'off', 'use_snp_selection': True, 'num_snps': 41906}. Best is trial 5 with value: 0.06552593845841431.
[I 2025-12-05 14:29:25,920] Trial 33 finished with value: 0.05366843953300984 and parameters: {'model_type': 'mlp', 'hidden_dims': '[512, 64]', 'dropout': 0.20121992967095134, 'batch_norm': True, 'lr': 0.00011155279860962565, 'weight_decay': 1.0981486080680525e-05, 'epochs': 153, 'loss': 'mae', 'optimizer': 'adam', 'graph_mode': 'off', 'use_snp_selection': True, 'num_snps': 52681}. Best is trial 5 with value: 0.06552593845841431.
[I 2025-12-05 14:29:27,444] Trial 34 finished with value: 0.061561421088611686 and parameters: {'model_type': 'mlp', 'hidden_dims': '[512, 64]', 'dropout': 0.25928875002913343, 'batch_norm': True, 'lr': 0.00011026078827071791, 'weight_decay': 1.6292561991865586e-06, 'epochs': 187, 'loss': 'mae', 'optimizer': 'adam', 'graph_mode': 'off', 'use_snp_selection': False}. Best is trial 5 with value: 0.06552593845841431.
[I 2025-12-05 14:29:28,616] Trial 35 finished with value: 0.040551578591148565 and parameters: {'model_type': 'mlp', 'hidden_dims': '[256, 128]', 'dropout': 0.2177293429766799, 'batch_norm': True, 'lr': 0.000491467072140191, 'weight_decay': 1.6835909201749461e-06, 'epochs': 266, 'loss': 'mae', 'optimizer': 'adam', 'graph_mode': 'off', 'use_snp_selection': False}. Best is trial 5 with value: 0.06552593845841431.
[I 2025-12-05 14:29:29,626] Trial 36 finished with value: 0.05536238189588613 and parameters: {'model_type': 'mlp', 'hidden_dims': '[256, 128, 64]', 'dropout': 0.2642338658448773, 'batch_norm': True, 'lr': 0.0001011648860400929, 'weight_decay': 1.471819765575971e-06, 'epochs': 186, 'loss': 'mse', 'optimizer': 'adam', 'graph_mode': 'off', 'use_snp_selection': False}. Best is trial 5 with value: 0.06552593845841431.
[I 2025-12-05 14:29:31,230] Trial 37 finished with value: 0.044698470718339905 and parameters: {'model_type': 'mlp', 'hidden_dims': '[512, 64]', 'dropout': 0.33285713357495517, 'batch_norm': True, 'lr': 4.0266256070035514e-05, 'weight_decay': 8.874741822029326e-07, 'epochs': 218, 'loss': 'mae', 'optimizer': 'adam', 'graph_mode': 'off', 'use_snp_selection': False}. Best is trial 5 with value: 0.06552593845841431.
[I 2025-12-05 14:29:32,822] Trial 38 finished with value: 0.05879466630195128 and parameters: {'model_type': 'mlp', 'hidden_dims': '[512, 64]', 'dropout': 0.18423714139309938, 'batch_norm': True, 'lr': 0.00044963806073561075, 'weight_decay': 1.4855475477034206e-05, 'epochs': 208, 'loss': 'mse', 'optimizer': 'adam', 'graph_mode': 'off', 'use_snp_selection': False}. Best is trial 5 with value: 0.06552593845841431.
[I 2025-12-05 14:29:34,641] Trial 39 finished with value: 0.03387784214792812 and parameters: {'model_type': 'mlp', 'hidden_dims': '[512, 128]', 'dropout': 0.23780560991816677, 'batch_norm': True, 'lr': 0.0001776043153168977, 'weight_decay': 2.624919342074084e-06, 'epochs': 268, 'loss': 'mae', 'optimizer': 'adam', 'graph_mode': 'off', 'use_snp_selection': False}. Best is trial 5 with value: 0.06552593845841431.
[I 2025-12-05 14:29:36,152] Trial 40 finished with value: 0.051533806299957935 and parameters: {'model_type': 'mlp', 'hidden_dims': '[512, 256]', 'dropout': 0.15738419961413422, 'batch_norm': True, 'lr': 8.28819541961178e-05, 'weight_decay': 2.704156923443955e-07, 'epochs': 186, 'loss': 'mse', 'optimizer': 'adam', 'graph_mode': 'off', 'use_snp_selection': False}. Best is trial 5 with value: 0.06552593845841431.
[I 2025-12-05 14:29:38,673] Trial 41 finished with value: 0.03510573942477848 and parameters: {'model_type': 'mlp', 'hidden_dims': '[512, 64]', 'dropout': 0.27986877064078347, 'batch_norm': True, 'lr': 0.00014301314972724606, 'weight_decay': 6.524311188998218e-06, 'epochs': 155, 'loss': 'mae', 'optimizer': 'adam', 'graph_mode': 'off', 'use_snp_selection': True, 'num_snps': 48284}. Best is trial 5 with value: 0.06552593845841431.
[I 2025-12-05 14:29:39,980] Trial 42 finished with value: 0.05322479202528213 and parameters: {'model_type': 'mlp', 'hidden_dims': '[512, 64]', 'dropout': 0.18612398678043768, 'batch_norm': True, 'lr': 0.0002750113241295618, 'weight_decay': 2.7449262077641067e-05, 'epochs': 133, 'loss': 'mae', 'optimizer': 'adam', 'graph_mode': 'off', 'use_snp_selection': False}. Best is trial 5 with value: 0.06552593845841431.
[I 2025-12-05 14:29:42,065] Trial 43 finished with value: 0.04642689535645709 and parameters: {'model_type': 'mlp', 'hidden_dims': '[512, 64]', 'dropout': 0.24957766105045598, 'batch_norm': True, 'lr': 0.00014567987871071672, 'weight_decay': 2.3081981145150883e-06, 'epochs': 248, 'loss': 'mae', 'optimizer': 'adam', 'graph_mode': 'off', 'use_snp_selection': True, 'num_snps': 32981}. Best is trial 5 with value: 0.06552593845841431.
[I 2025-12-05 14:29:43,515] Trial 44 finished with value: 0.020182538938961016 and parameters: {'model_type': 'mlp', 'hidden_dims': '[512, 64]', 'dropout': 0.2802606633610209, 'batch_norm': True, 'lr': 6.790753909678407e-05, 'weight_decay': 7.011756188817222e-06, 'epochs': 181, 'loss': 'mae', 'optimizer': 'adam', 'graph_mode': 'off', 'use_snp_selection': False}. Best is trial 5 with value: 0.06552593845841431.
[I 2025-12-05 14:29:45,743] Trial 45 finished with value: 0.051594266326512185 and parameters: {'model_type': 'mlp', 'hidden_dims': '[256, 128]', 'dropout': 0.10540536391562402, 'batch_norm': True, 'lr': 4.244287177097268e-05, 'weight_decay': 8.477774797494191e-07, 'epochs': 349, 'loss': 'mae', 'optimizer': 'adam', 'graph_mode': 'off', 'use_snp_selection': True, 'num_snps': 39777}. Best is trial 5 with value: 0.06552593845841431.
[I 2025-12-05 14:29:47,649] Trial 46 finished with value: 0.04038522213783163 and parameters: {'model_type': 'mlp', 'hidden_dims': '[512, 64]', 'dropout': 0.38912210970312167, 'batch_norm': True, 'lr': 2.1786803342143073e-05, 'weight_decay': 1.703594401208385e-05, 'epochs': 163, 'loss': 'mae', 'optimizer': 'adam', 'graph_mode': 'off', 'use_snp_selection': True, 'num_snps': 33411}. Best is trial 5 with value: 0.06552593845841431.
[I 2025-12-05 14:29:48,789] Trial 47 finished with value: 0.04064365157876564 and parameters: {'model_type': 'mlp', 'hidden_dims': '[512, 64]', 'dropout': 0.3330611176047104, 'batch_norm': True, 'lr': 0.00036561226487231264, 'weight_decay': 4.484500035215582e-06, 'epochs': 108, 'loss': 'mae', 'optimizer': 'adam', 'graph_mode': 'off', 'use_snp_selection': False}. Best is trial 5 with value: 0.06552593845841431.
[I 2025-12-05 14:29:51,709] Trial 48 finished with value: 0.045734883420456784 and parameters: {'model_type': 'mlp', 'hidden_dims': '[512, 128]', 'dropout': 0.20954355623174561, 'batch_norm': True, 'lr': 0.0006966120228521162, 'weight_decay': 3.277817752845556e-07, 'epochs': 131, 'loss': 'mse', 'optimizer': 'adam', 'graph_mode': 'off', 'use_snp_selection': True, 'num_snps': 59815}. Best is trial 5 with value: 0.06552593845841431.
[I 2025-12-05 14:29:54,029] Trial 49 finished with value: -0.011694791862698615 and parameters: {'model_type': 'mlp', 'hidden_dims': '[512, 64]', 'dropout': 0.140910934515424, 'batch_norm': True, 'lr': 5.598824359427853e-06, 'weight_decay': 9.516597315405994e-06, 'epochs': 147, 'loss': 'mae', 'optimizer': 'adam', 'graph_mode': 'off', 'use_snp_selection': True, 'num_snps': 42377}. Best is trial 5 with value: 0.06552593845841431.
[I 2025-12-05 14:29:55,996] Trial 50 finished with value: 0.04080310099284819 and parameters: {'model_type': 'mlp', 'hidden_dims': '[128, 64]', 'dropout': 0.2675957376227549, 'batch_norm': True, 'lr': 8.979988172131378e-05, 'weight_decay': 3.1719256419723856e-06, 'epochs': 208, 'loss': 'mae', 'optimizer': 'adam', 'graph_mode': 'off', 'use_snp_selection': True, 'num_snps': 39163}. Best is trial 5 with value: 0.06552593845841431.
[I 2025-12-05 14:29:57,553] Trial 51 finished with value: 0.047582284621638694 and parameters: {'model_type': 'mlp', 'hidden_dims': '[512, 64]', 'dropout': 0.17751970175730897, 'batch_norm': True, 'lr': 0.0005880639921619275, 'weight_decay': 1.3940873509403533e-05, 'epochs': 206, 'loss': 'mse', 'optimizer': 'adam', 'graph_mode': 'off', 'use_snp_selection': False}. Best is trial 5 with value: 0.06552593845841431.
[I 2025-12-05 14:29:59,234] Trial 52 finished with value: 0.05885814009848546 and parameters: {'model_type': 'mlp', 'hidden_dims': '[512, 64]', 'dropout': 0.12799631205968345, 'batch_norm': True, 'lr': 0.0004226125629852172, 'weight_decay': 2.246822286111437e-05, 'epochs': 237, 'loss': 'mse', 'optimizer': 'adam', 'graph_mode': 'off', 'use_snp_selection': False}. Best is trial 5 with value: 0.06552593845841431.
[I 2025-12-05 14:30:00,728] Trial 53 finished with value: 0.036720590902664975 and parameters: {'model_type': 'mlp', 'hidden_dims': '[512, 64]', 'dropout': 0.2940111366175332, 'batch_norm': True, 'lr': 0.00024535260978652944, 'weight_decay': 3.8950915379908915e-05, 'epochs': 192, 'loss': 'mse', 'optimizer': 'adam', 'graph_mode': 'off', 'use_snp_selection': False}. Best is trial 5 with value: 0.06552593845841431.
[I 2025-12-05 14:30:02,383] Trial 54 finished with value: 0.05083050208792471 and parameters: {'model_type': 'mlp', 'hidden_dims': '[512, 64]', 'dropout': 0.12900692428839594, 'batch_norm': True, 'lr': 0.00014247777801683855, 'weight_decay': 2.040429833852651e-05, 'epochs': 229, 'loss': 'mse', 'optimizer': 'adam', 'graph_mode': 'off', 'use_snp_selection': False}. Best is trial 5 with value: 0.06552593845841431.
[I 2025-12-05 14:30:04,313] Trial 55 finished with value: -0.008224987193360057 and parameters: {'model_type': 'mlp', 'hidden_dims': '[512, 256]', 'dropout': 0.5742328887381665, 'batch_norm': True, 'lr': 1.109259279631933e-06, 'weight_decay': 8.870402892160817e-06, 'epochs': 289, 'loss': 'mse', 'optimizer': 'adam', 'graph_mode': 'off', 'use_snp_selection': False}. Best is trial 5 with value: 0.06552593845841431.
[I 2025-12-05 14:30:05,735] Trial 56 finished with value: 0.04956278909779385 and parameters: {'model_type': 'mlp', 'hidden_dims': '[512, 64]', 'dropout': 0.16425258850229163, 'batch_norm': True, 'lr': 5.5249045474320956e-05, 'weight_decay': 5.130851648266118e-06, 'epochs': 174, 'loss': 'mae', 'optimizer': 'adam', 'graph_mode': 'off', 'use_snp_selection': False}. Best is trial 5 with value: 0.06552593845841431.
[I 2025-12-05 14:30:07,773] Trial 57 finished with value: 0.04582713195983032 and parameters: {'model_type': 'mlp', 'hidden_dims': '[512, 64]', 'dropout': 0.23740171619966982, 'batch_norm': True, 'lr': 0.00019486556403269347, 'weight_decay': 6.48994750319689e-05, 'epochs': 247, 'loss': 'mae', 'optimizer': 'adam', 'graph_mode': 'off', 'use_snp_selection': True, 'num_snps': 32360}. Best is trial 5 with value: 0.06552593845841431.
