[I 2025-12-06 08:45:23,323] Trial 21 finished with value: 0.22621577071245103 and parameters: {'model_type': 'mlp', 'hidden_dims': '[512, 256]', 'dropout': 0.5801943431504863, 'batch_norm': False, 'lr': 1.2502098573971632e-05, 'weight_decay': 1.0421381452602179e-07, 'epochs': 86, 'loss': 'mae', 'optimizer': 'adam', 'graph_mode': 'off', 'use_snp_selection': False}. Best is trial 7 with value: 0.23708272111812953.
[I 2025-12-06 08:45:56,261] Trial 22 finished with value: 0.2263482200037831 and parameters: {'model_type': 'mlp', 'hidden_dims': '[512, 256]', 'dropout': 0.5466149221009567, 'batch_norm': False, 'lr': 1.559270238923501e-05, 'weight_decay': 8.351707160255532e-07, 'epochs': 93, 'loss': 'mae', 'optimizer': 'adam', 'graph_mode': 'off', 'use_snp_selection': False}. Best is trial 7 with value: 0.23708272111812953.
[I 2025-12-06 08:46:20,551] Trial 23 finished with value: 0.2159164531027296 and parameters: {'model_type': 'mlp', 'hidden_dims': '[512, 256]', 'dropout': 0.45700288156596985, 'batch_norm': False, 'lr': 7.888038380930695e-06, 'weight_decay': 2.0643612361345724e-07, 'epochs': 61, 'loss': 'mae', 'optimizer': 'adam', 'graph_mode': 'off', 'use_snp_selection': False}. Best is trial 7 with value: 0.23708272111812953.
[I 2025-12-06 08:46:59,913] Trial 24 finished with value: 0.22686156780273364 and parameters: {'model_type': 'mlp', 'hidden_dims': '[512, 256]', 'dropout': 0.5403769240417255, 'batch_norm': False, 'lr': 3.978049943836133e-05, 'weight_decay': 9.052369605125838e-07, 'epochs': 118, 'loss': 'mae', 'optimizer': 'adam', 'graph_mode': 'off', 'use_snp_selection': False}. Best is trial 7 with value: 0.23708272111812953.
[I 2025-12-06 08:47:44,138] Trial 25 finished with value: 0.20073954153341966 and parameters: {'model_type': 'mlp', 'hidden_dims': '[256, 128, 64]', 'dropout': 0.599048443037655, 'batch_norm': False, 'lr': 3.110790279715502e-06, 'weight_decay': 2.392216091219003e-07, 'epochs': 269, 'loss': 'mae', 'optimizer': 'adam', 'graph_mode': 'off', 'use_snp_selection': False}. Best is trial 7 with value: 0.23708272111812953.
[I 2025-12-06 08:48:17,244] Trial 26 finished with value: 0.1907567122131086 and parameters: {'model_type': 'mlp', 'hidden_dims': '[256, 128]', 'dropout': 0.5545828071842807, 'batch_norm': True, 'lr': 8.580057090529537e-05, 'weight_decay': 9.516657810025634e-05, 'epochs': 182, 'loss': 'mse', 'optimizer': 'adam', 'graph_mode': 'off', 'use_snp_selection': True, 'num_snps': 3842}. Best is trial 7 with value: 0.23708272111812953.
[I 2025-12-06 08:48:30,131] Trial 27 finished with value: 0.22499069643391975 and parameters: {'model_type': 'mlp', 'hidden_dims': '[128, 64]', 'dropout': 0.14201787846424646, 'batch_norm': False, 'lr': 2.9729374414372623e-05, 'weight_decay': 2.164816576134148e-05, 'epochs': 99, 'loss': 'mae', 'optimizer': 'adam', 'graph_mode': 'off', 'use_snp_selection': False}. Best is trial 7 with value: 0.23708272111812953.
[I 2025-12-06 08:49:17,107] Trial 28 finished with value: 0.21948565053909447 and parameters: {'model_type': 'mlp', 'hidden_dims': '[512, 64]', 'dropout': 0.46798163300898377, 'batch_norm': True, 'lr': 1.8734325613178324e-05, 'weight_decay': 1.8219834248060387e-07, 'epochs': 144, 'loss': 'mse', 'optimizer': 'adam', 'graph_mode': 'off', 'use_snp_selection': False}. Best is trial 7 with value: 0.23708272111812953.
[I 2025-12-06 08:49:54,856] Trial 29 finished with value: 0.10221751779273078 and parameters: {'model_type': 'mlp', 'hidden_dims': '[128, 64]', 'dropout': 0.5154708649295417, 'batch_norm': True, 'lr': 2.320440320155318e-06, 'weight_decay': 7.926704399551403e-06, 'epochs': 68, 'loss': 'mae', 'optimizer': 'adam', 'graph_mode': 'off', 'use_snp_selection': True, 'num_snps': 19468}. Best is trial 7 with value: 0.23708272111812953.
[I 2025-12-06 08:51:28,604] Trial 30 finished with value: 0.22766232665565153 and parameters: {'model_type': 'mlp', 'hidden_dims': '[512, 256]', 'dropout': 0.1643682238690179, 'batch_norm': False, 'lr': 6.097081430981486e-06, 'weight_decay': 1.6086554048019763e-06, 'epochs': 315, 'loss': 'mae', 'optimizer': 'adam', 'graph_mode': 'off', 'use_snp_selection': False}. Best is trial 7 with value: 0.23708272111812953.
[I 2025-12-06 08:53:03,177] Trial 31 finished with value: 0.2267370761646988 and parameters: {'model_type': 'mlp', 'hidden_dims': '[512, 256]', 'dropout': 0.1022024468910757, 'batch_norm': False, 'lr': 5.50313179909406e-06, 'weight_decay': 4.868296649398434e-07, 'epochs': 315, 'loss': 'mae', 'optimizer': 'adam', 'graph_mode': 'off', 'use_snp_selection': False}. Best is trial 7 with value: 0.23708272111812953.
[I 2025-12-06 08:54:38,583] Trial 32 finished with value: 0.22536597764443975 and parameters: {'model_type': 'mlp', 'hidden_dims': '[512, 256]', 'dropout': 0.15799814058637093, 'batch_norm': False, 'lr': 1.0626118052708643e-05, 'weight_decay': 1.2932094116543492e-06, 'epochs': 318, 'loss': 'mae', 'optimizer': 'adam', 'graph_mode': 'off', 'use_snp_selection': False}. Best is trial 7 with value: 0.23708272111812953.
[I 2025-12-06 08:56:09,231] Trial 33 finished with value: 0.22512233455381656 and parameters: {'model_type': 'mlp', 'hidden_dims': '[512, 256]', 'dropout': 0.24159730832800486, 'batch_norm': False, 'lr': 2.2976140465352975e-06, 'weight_decay': 3.7144413751216833e-06, 'epochs': 301, 'loss': 'mae', 'optimizer': 'adam', 'graph_mode': 'off', 'use_snp_selection': False}. Best is trial 7 with value: 0.23708272111812953.
[I 2025-12-06 08:57:02,085] Trial 34 finished with value: 0.22523308079422097 and parameters: {'model_type': 'mlp', 'hidden_dims': '[256, 128]', 'dropout': 0.17895417352221732, 'batch_norm': False, 'lr': 5.930686310581878e-06, 'weight_decay': 1.3469007483013366e-05, 'epochs': 330, 'loss': 'mae', 'optimizer': 'adam', 'graph_mode': 'off', 'use_snp_selection': False}. Best is trial 7 with value: 0.23708272111812953.
[I 2025-12-06 08:58:56,895] Trial 35 finished with value: 0.23608504039346384 and parameters: {'model_type': 'mlp', 'hidden_dims': '[512, 256]', 'dropout': 0.43024169205778806, 'batch_norm': False, 'lr': 1.0339223279261923e-05, 'weight_decay': 2.453413711800875e-05, 'epochs': 263, 'loss': 'mae', 'optimizer': 'adam', 'graph_mode': 'off', 'use_snp_selection': True, 'num_snps': 57586}. Best is trial 7 with value: 0.23708272111812953.
[I 2025-12-06 09:00:52,600] Trial 36 finished with value: 0.22273068091045095 and parameters: {'model_type': 'mlp', 'hidden_dims': '[512, 128]', 'dropout': 0.41846381439473296, 'batch_norm': True, 'lr': 8.04980728065778e-05, 'weight_decay': 2.5640502230821084e-05, 'epochs': 250, 'loss': 'mse', 'optimizer': 'adam', 'graph_mode': 'off', 'use_snp_selection': True, 'num_snps': 59835}. Best is trial 7 with value: 0.23708272111812953.
[I 2025-12-06 09:02:01,021] Trial 37 finished with value: 0.21575826596280684 and parameters: {'model_type': 'mlp', 'hidden_dims': '[256, 128, 64]', 'dropout': 0.39024288902908183, 'batch_norm': False, 'lr': 1.000605855140007e-05, 'weight_decay': 9.103888454320312e-05, 'epochs': 219, 'loss': 'mae', 'optimizer': 'adam', 'graph_mode': 'off', 'use_snp_selection': True, 'num_snps': 46288}. Best is trial 7 with value: 0.23708272111812953.
[I 2025-12-06 09:03:05,322] Trial 38 finished with value: 0.18008762755182123 and parameters: {'model_type': 'mlp', 'hidden_dims': '[512, 64]', 'dropout': 0.43234289755619, 'batch_norm': True, 'lr': 1.2392073267042522e-06, 'weight_decay': 1.0422599400426813e-05, 'epochs': 268, 'loss': 'mse', 'optimizer': 'adam', 'graph_mode': 'off', 'use_snp_selection': True, 'num_snps': 23242}. Best is trial 7 with value: 0.23708272111812953.
[I 2025-12-06 09:04:50,919] Trial 39 finished with value: 0.2207653327373416 and parameters: {'model_type': 'mlp', 'hidden_dims': '[512, 256]', 'dropout': 0.5614941659353446, 'batch_norm': False, 'lr': 3.739054983068946e-05, 'weight_decay': 0.0007847210618270999, 'epochs': 289, 'loss': 'mae', 'optimizer': 'adam', 'graph_mode': 'off', 'use_snp_selection': True, 'num_snps': 48464}. Best is trial 7 with value: 0.23708272111812953.
[I 2025-12-06 09:06:07,491] Trial 40 finished with value: 0.22312739796538175 and parameters: {'model_type': 'mlp', 'hidden_dims': '[256, 128]', 'dropout': 0.36044044057817615, 'batch_norm': True, 'lr': 2.1585712711720747e-05, 'weight_decay': 2.6694232194881512e-05, 'epochs': 255, 'loss': 'mae', 'optimizer': 'adam', 'graph_mode': 'off', 'use_snp_selection': True, 'num_snps': 51799}. Best is trial 7 with value: 0.23708272111812953.
[I 2025-12-06 09:07:46,325] Trial 41 finished with value: 0.21981878785770262 and parameters: {'model_type': 'mlp', 'hidden_dims': '[512, 256]', 'dropout': 0.19233876864105612, 'batch_norm': False, 'lr': 5.518326817338156e-06, 'weight_decay': 2.830789262125053e-07, 'epochs': 349, 'loss': 'mae', 'optimizer': 'adam', 'graph_mode': 'off', 'use_snp_selection': True, 'num_snps': 38362}. Best is trial 7 with value: 0.23708272111812953.
[I 2025-12-06 09:09:15,849] Trial 42 finished with value: 0.22345653212986707 and parameters: {'model_type': 'mlp', 'hidden_dims': '[512, 256]', 'dropout': 0.28355789026314226, 'batch_norm': False, 'lr': 9.428849853510013e-06, 'weight_decay': 1.4650025443486168e-07, 'epochs': 299, 'loss': 'mae', 'optimizer': 'adam', 'graph_mode': 'off', 'use_snp_selection': False}. Best is trial 7 with value: 0.23708272111812953.
[I 2025-12-06 09:10:52,680] Trial 43 finished with value: 0.21926861891804506 and parameters: {'model_type': 'mlp', 'hidden_dims': '[512, 256]', 'dropout': 0.12863304570919476, 'batch_norm': False, 'lr': 5.1471961221948956e-05, 'weight_decay': 2.2926080970643854e-06, 'epochs': 330, 'loss': 'mae', 'optimizer': 'adam', 'graph_mode': 'off', 'use_snp_selection': False}. Best is trial 7 with value: 0.23708272111812953.
[I 2025-12-06 09:12:01,636] Trial 44 finished with value: 0.22842373836470498 and parameters: {'model_type': 'mlp', 'hidden_dims': '[512, 256]', 'dropout': 0.1654951536136051, 'batch_norm': False, 'lr': 4.761194660273512e-06, 'weight_decay': 6.623849768103799e-07, 'epochs': 222, 'loss': 'mae', 'optimizer': 'adam', 'graph_mode': 'off', 'use_snp_selection': False}. Best is trial 7 with value: 0.23708272111812953.
[I 2025-12-06 09:13:12,655] Trial 45 finished with value: 0.2246373719134816 and parameters: {'model_type': 'mlp', 'hidden_dims': '[512, 64]', 'dropout': 0.25351238514978963, 'batch_norm': False, 'lr': 3.380625010998632e-06, 'weight_decay': 6.460991263748053e-07, 'epochs': 231, 'loss': 'mse', 'optimizer': 'adam', 'graph_mode': 'off', 'use_snp_selection': False}. Best is trial 7 with value: 0.23708272111812953.
[I 2025-12-06 09:14:11,964] Trial 46 finished with value: 0.22984705482686252 and parameters: {'model_type': 'mlp', 'hidden_dims': '[512, 256]', 'dropout': 0.3208108939284733, 'batch_norm': False, 'lr': 4.0690046599192836e-06, 'weight_decay': 8.053848739699712e-05, 'epochs': 203, 'loss': 'mae', 'optimizer': 'adam', 'graph_mode': 'off', 'use_snp_selection': True, 'num_snps': 24229}. Best is trial 7 with value: 0.23708272111812953.
[I 2025-12-06 09:15:09,937] Trial 47 finished with value: 0.20742352579212114 and parameters: {'model_type': 'mlp', 'hidden_dims': '[512, 128]', 'dropout': 0.3137770888377775, 'batch_norm': False, 'lr': 2.1957399852852135e-06, 'weight_decay': 0.00021748002850838964, 'epochs': 203, 'loss': 'mse', 'optimizer': 'adam', 'graph_mode': 'off', 'use_snp_selection': True, 'num_snps': 23923}. Best is trial 7 with value: 0.23708272111812953.
[I 2025-12-06 09:15:58,039] Trial 48 finished with value: 0.1715823433290941 and parameters: {'model_type': 'mlp', 'hidden_dims': '[512, 256]', 'dropout': 0.2260325291059593, 'batch_norm': True, 'lr': 1.618896494680274e-06, 'weight_decay': 5.556309202540944e-05, 'epochs': 190, 'loss': 'mae', 'optimizer': 'adam', 'graph_mode': 'off', 'use_snp_selection': True, 'num_snps': 15964}. Best is trial 7 with value: 0.23708272111812953.
[I 2025-12-06 09:16:44,573] Trial 49 finished with value: 0.22339119922474357 and parameters: {'model_type': 'mlp', 'hidden_dims': '[128, 64]', 'dropout': 0.4098323332727471, 'batch_norm': False, 'lr': 3.55598528620455e-06, 'weight_decay': 7.140207119515335e-05, 'epochs': 218, 'loss': 'mae', 'optimizer': 'adam', 'graph_mode': 'off', 'use_snp_selection': True, 'num_snps': 28707}. Best is trial 7 with value: 0.23708272111812953.
[I 2025-12-06 09:17:25,793] Trial 50 finished with value: 0.19331476605303557 and parameters: {'model_type': 'mlp', 'hidden_dims': '[512, 64]', 'dropout': 0.2818979448018076, 'batch_norm': True, 'lr': 4.380716308657214e-06, 'weight_decay': 3.769297099537989e-05, 'epochs': 168, 'loss': 'mse', 'optimizer': 'adam', 'graph_mode': 'off', 'use_snp_selection': True, 'num_snps': 10823}. Best is trial 7 with value: 0.23708272111812953.
[I 2025-12-06 09:18:22,581] Trial 51 finished with value: 0.23025728117771577 and parameters: {'model_type': 'mlp', 'hidden_dims': '[512, 256]', 'dropout': 0.5261196929883915, 'batch_norm': False, 'lr': 7.614890613287928e-06, 'weight_decay': 1.5137777647300997e-05, 'epochs': 143, 'loss': 'mae', 'optimizer': 'adam', 'graph_mode': 'off', 'use_snp_selection': True, 'num_snps': 28824}. Best is trial 7 with value: 0.23708272111812953.
[I 2025-12-06 09:19:22,068] Trial 52 finished with value: 0.24579295833830703 and parameters: {'model_type': 'mlp', 'hidden_dims': '[512, 256]', 'dropout': 0.4898236172917628, 'batch_norm': False, 'lr': 8.320198865066069e-06, 'weight_decay': 1.3843170933585987e-05, 'epochs': 153, 'loss': 'mae', 'optimizer': 'adam', 'graph_mode': 'off', 'use_snp_selection': True, 'num_snps': 30310}. Best is trial 52 with value: 0.24579295833830703.
[I 2025-12-06 09:20:18,504] Trial 53 finished with value: 0.22867797855318867 and parameters: {'model_type': 'mlp', 'hidden_dims': '[512, 256]', 'dropout': 0.49286600844483497, 'batch_norm': False, 'lr': 8.025041398567634e-06, 'weight_decay': 1.4592404459980683e-05, 'epochs': 140, 'loss': 'mae', 'optimizer': 'adam', 'graph_mode': 'off', 'use_snp_selection': True, 'num_snps': 29132}. Best is trial 52 with value: 0.24579295833830703.
[I 2025-12-06 09:21:19,401] Trial 54 finished with value: 0.23522644101642026 and parameters: {'model_type': 'mlp', 'hidden_dims': '[512, 256]', 'dropout': 0.44360641878168716, 'batch_norm': False, 'lr': 1.5161790665766203e-05, 'weight_decay': 2.9968631180037173e-05, 'epochs': 129, 'loss': 'mae', 'optimizer': 'adam', 'graph_mode': 'off', 'use_snp_selection': True, 'num_snps': 35840}. Best is trial 52 with value: 0.24579295833830703.
[I 2025-12-06 09:22:20,697] Trial 55 finished with value: 0.22766160130556723 and parameters: {'model_type': 'mlp', 'hidden_dims': '[512, 256]', 'dropout': 0.5226506034188797, 'batch_norm': False, 'lr': 1.645081807197364e-05, 'weight_decay': 8.235048308678077e-06, 'epochs': 129, 'loss': 'mae', 'optimizer': 'adam', 'graph_mode': 'off', 'use_snp_selection': True, 'num_snps': 36185}. Best is trial 52 with value: 0.24579295833830703.
[I 2025-12-06 09:23:09,007] Trial 56 finished with value: 0.2217725987590707 and parameters: {'model_type': 'mlp', 'hidden_dims': '[256, 128, 64]', 'dropout': 0.45884354271504835, 'batch_norm': False, 'lr': 1.3324647393165343e-05, 'weight_decay': 3.4461785430711885e-05, 'epochs': 108, 'loss': 'mae', 'optimizer': 'adam', 'graph_mode': 'off', 'use_snp_selection': True, 'num_snps': 32692}. Best is trial 52 with value: 0.24579295833830703.
[I 2025-12-06 09:24:21,596] Trial 57 finished with value: 0.22425715084129108 and parameters: {'model_type': 'mlp', 'hidden_dims': '[512, 256]', 'dropout': 0.47603886768226156, 'batch_norm': False, 'lr': 2.5186415699437928e-05, 'weight_decay': 5.7064579724159355e-06, 'epochs': 158, 'loss': 'mae', 'optimizer': 'adam', 'graph_mode': 'off', 'use_snp_selection': True, 'num_snps': 43185}. Best is trial 52 with value: 0.24579295833830703.
[I 2025-12-06 09:25:40,836] Trial 58 finished with value: 0.20417330291646177 and parameters: {'model_type': 'mlp', 'hidden_dims': '[512, 64]', 'dropout': 0.4443598364827681, 'batch_norm': False, 'lr': 0.00014408801156572373, 'weight_decay': 1.8628946411576283e-05, 'epochs': 135, 'loss': 'mse', 'optimizer': 'adam', 'graph_mode': 'off', 'use_snp_selection': True, 'num_snps': 55045}. Best is trial 52 with value: 0.24579295833830703.
[I 2025-12-06 09:26:50,337] Trial 59 finished with value: 0.21868341933168808 and parameters: {'model_type': 'mlp', 'hidden_dims': '[512, 256]', 'dropout': 0.5290951418321851, 'batch_norm': True, 'lr': 1.8963314265062227e-05, 'weight_decay': 0.00014501509455894888, 'epochs': 151, 'loss': 'mae', 'optimizer': 'adam', 'graph_mode': 'off', 'use_snp_selection': True, 'num_snps': 40668}. Best is trial 52 with value: 0.24579295833830703.
[I 2025-12-06 09:27:43,024] Trial 60 finished with value: 0.23395995551113372 and parameters: {'model_type': 'mlp', 'hidden_dims': '[512, 128]', 'dropout': 0.494339489960013, 'batch_norm': False, 'lr': 0.00011050537699178755, 'weight_decay': 1.4118633341853191e-05, 'epochs': 109, 'loss': 'mae', 'optimizer': 'adam', 'graph_mode': 'off', 'use_snp_selection': True, 'num_snps': 28807}. Best is trial 52 with value: 0.24579295833830703.
[I 2025-12-06 09:28:33,373] Trial 61 finished with value: 0.23068999967265932 and parameters: {'model_type': 'mlp', 'hidden_dims': '[512, 128]', 'dropout': 0.4975281210295947, 'batch_norm': False, 'lr': 0.0003247545655129992, 'weight_decay': 1.4483774923241849e-05, 'epochs': 108, 'loss': 'mae', 'optimizer': 'adam', 'graph_mode': 'off', 'use_snp_selection': True, 'num_snps': 26209}. Best is trial 52 with value: 0.24579295833830703.
[I 2025-12-06 09:29:22,854] Trial 62 finished with value: 0.22214931629135423 and parameters: {'model_type': 'mlp', 'hidden_dims': '[512, 128]', 'dropout': 0.49423311823166877, 'batch_norm': False, 'lr': 0.0005675174394365385, 'weight_decay': 2.9045023591820314e-05, 'epochs': 106, 'loss': 'mae', 'optimizer': 'adam', 'graph_mode': 'off', 'use_snp_selection': True, 'num_snps': 25852}. Best is trial 52 with value: 0.24579295833830703.
[I 2025-12-06 09:30:05,893] Trial 63 finished with value: 0.23742087415292895 and parameters: {'model_type': 'mlp', 'hidden_dims': '[512, 128]', 'dropout': 0.3757092339914933, 'batch_norm': False, 'lr': 0.00020125822338031436, 'weight_decay': 8.057567738034383e-06, 'epochs': 83, 'loss': 'mae', 'optimizer': 'adam', 'graph_mode': 'off', 'use_snp_selection': True, 'num_snps': 19556}. Best is trial 52 with value: 0.24579295833830703.
[I 2025-12-06 09:30:48,119] Trial 64 finished with value: 0.23341399180871983 and parameters: {'model_type': 'mlp', 'hidden_dims': '[512, 128]', 'dropout': 0.3737122333859094, 'batch_norm': False, 'lr': 0.00011233745960449878, 'weight_decay': 8.943111560422986e-06, 'epochs': 84, 'loss': 'mae', 'optimizer': 'adam', 'graph_mode': 'off', 'use_snp_selection': True, 'num_snps': 18439}. Best is trial 52 with value: 0.24579295833830703.
[I 2025-12-06 09:31:39,637] Trial 65 finished with value: 0.22863999029238302 and parameters: {'model_type': 'mlp', 'hidden_dims': '[512, 128]', 'dropout': 0.40750003058834455, 'batch_norm': False, 'lr': 0.0003229000098640515, 'weight_decay': 5.7367671294015175e-05, 'epochs': 73, 'loss': 'mae', 'optimizer': 'adam', 'graph_mode': 'off', 'use_snp_selection': True, 'num_snps': 33540}. Best is trial 52 with value: 0.24579295833830703.
[I 2025-12-06 09:32:21,567] Trial 66 finished with value: 0.22485312536667398 and parameters: {'model_type': 'mlp', 'hidden_dims': '[512, 128]', 'dropout': 0.4311552074254359, 'batch_norm': False, 'lr': 0.00023018384217700212, 'weight_decay': 3.7014160781182766e-06, 'epochs': 54, 'loss': 'mae', 'optimizer': 'adam', 'graph_mode': 'off', 'use_snp_selection': True, 'num_snps': 21327}. Best is trial 52 with value: 0.24579295833830703.
[I 2025-12-06 09:33:02,674] Trial 67 finished with value: 0.23796121214324403 and parameters: {'model_type': 'mlp', 'hidden_dims': '[512, 128]', 'dropout': 0.44453504262307353, 'batch_norm': False, 'lr': 6.463630115561796e-05, 'weight_decay': 2.0764981200003625e-05, 'epochs': 126, 'loss': 'mse', 'optimizer': 'adam', 'graph_mode': 'off', 'use_snp_selection': True, 'num_snps': 13409}. Best is trial 52 with value: 0.24579295833830703.
[I 2025-12-06 09:33:40,893] Trial 68 finished with value: 0.2185421784943506 and parameters: {'model_type': 'mlp', 'hidden_dims': '[512, 128]', 'dropout': 0.3394582033456406, 'batch_norm': True, 'lr': 6.229453821275913e-05, 'weight_decay': 2.2834144727654342e-05, 'epochs': 122, 'loss': 'mse', 'optimizer': 'adam', 'graph_mode': 'off', 'use_snp_selection': True, 'num_snps': 10221}. Best is trial 52 with value: 0.24579295833830703.
[I 2025-12-06 09:34:18,228] Trial 69 finished with value: 0.2300966351369138 and parameters: {'model_type': 'mlp', 'hidden_dims': '[256, 128]', 'dropout': 0.3972157411929278, 'batch_norm': False, 'lr': 3.520752276529182e-05, 'weight_decay': 6.5479014003140625e-06, 'epochs': 96, 'loss': 'mse', 'optimizer': 'adam', 'graph_mode': 'off', 'use_snp_selection': True, 'num_snps': 14186}. Best is trial 52 with value: 0.24579295833830703.
[I 2025-12-06 09:34:52,131] Trial 70 finished with value: 0.222284644650753 and parameters: {'model_type': 'mlp', 'hidden_dims': '[128, 64]', 'dropout': 0.37017877001544763, 'batch_norm': False, 'lr': 4.362512674548318e-05, 'weight_decay': 3.97152270644961e-05, 'epochs': 129, 'loss': 'mse', 'optimizer': 'adam', 'graph_mode': 'off', 'use_snp_selection': True, 'num_snps': 9195}. Best is trial 52 with value: 0.24579295833830703.
[I 2025-12-06 09:35:24,436] Trial 71 finished with value: 0.18006048925728368 and parameters: {'model_type': 'mlp', 'hidden_dims': '[512, 128]', 'dropout': 0.4497727348503888, 'batch_norm': False, 'lr': 0.00010957088978185453, 'weight_decay': 1.1567371186619784e-05, 'epochs': 84, 'loss': 'mse', 'optimizer': 'adam', 'graph_mode': 'off', 'use_snp_selection': True, 'num_snps': 3984}. Best is trial 52 with value: 0.24579295833830703.
