[I 2025-12-05 14:57:24,534] Trial 77 finished with value: 0.12401260949371694 and parameters: {'model_type': 'mlp', 'hidden_dims': '[256, 128]', 'dropout': 0.25367484972563886, 'batch_norm': False, 'lr': 1.1047334566902653e-05, 'weight_decay': 0.0005479580578583199, 'epochs': 228, 'loss': 'mae', 'optimizer': 'adam', 'graph_mode': 'off', 'use_snp_selection': False}. Best is trial 57 with value: 0.1368237737487214.
[I 2025-12-05 14:57:25,391] Trial 78 finished with value: 0.030625716687270113 and parameters: {'model_type': 'mlp', 'hidden_dims': '[256, 128]', 'dropout': 0.1920832574461736, 'batch_norm': False, 'lr': 1.0087771566710253e-06, 'weight_decay': 0.0001871159865235435, 'epochs': 262, 'loss': 'mae', 'optimizer': 'adam', 'graph_mode': 'off', 'use_snp_selection': True, 'num_snps': 2246}. Best is trial 57 with value: 0.1368237737487214.
[I 2025-12-05 14:57:26,544] Trial 79 finished with value: 0.12844972870904756 and parameters: {'model_type': 'mlp', 'hidden_dims': '[256, 128]', 'dropout': 0.17888519923951696, 'batch_norm': False, 'lr': 0.00018318979535514996, 'weight_decay': 0.0002951301414581938, 'epochs': 275, 'loss': 'mae', 'optimizer': 'adam', 'graph_mode': 'off', 'use_snp_selection': False}. Best is trial 57 with value: 0.1368237737487214.
[I 2025-12-05 14:57:27,664] Trial 80 finished with value: 0.13538769999387743 and parameters: {'model_type': 'mlp', 'hidden_dims': '[256, 128]', 'dropout': 0.16798279360726148, 'batch_norm': False, 'lr': 0.0002641332817598902, 'weight_decay': 0.0004151836774926193, 'epochs': 249, 'loss': 'mae', 'optimizer': 'adam', 'graph_mode': 'off', 'use_snp_selection': False}. Best is trial 57 with value: 0.1368237737487214.
[I 2025-12-05 14:57:28,781] Trial 81 finished with value: 0.12034288276141468 and parameters: {'model_type': 'mlp', 'hidden_dims': '[256, 128]', 'dropout': 0.17216220327186413, 'batch_norm': False, 'lr': 0.00020076679167149684, 'weight_decay': 0.00027051984254722794, 'epochs': 252, 'loss': 'mae', 'optimizer': 'adam', 'graph_mode': 'off', 'use_snp_selection': False}. Best is trial 57 with value: 0.1368237737487214.
[I 2025-12-05 14:57:29,927] Trial 82 finished with value: 0.11421733848083455 and parameters: {'model_type': 'mlp', 'hidden_dims': '[256, 128]', 'dropout': 0.20455033973480352, 'batch_norm': False, 'lr': 0.0003901816746406176, 'weight_decay': 0.0004080806486751107, 'epochs': 274, 'loss': 'mae', 'optimizer': 'adam', 'graph_mode': 'off', 'use_snp_selection': False}. Best is trial 57 with value: 0.1368237737487214.
[I 2025-12-05 14:57:31,016] Trial 83 finished with value: 0.11987367015364697 and parameters: {'model_type': 'mlp', 'hidden_dims': '[256, 128]', 'dropout': 0.1613321299410105, 'batch_norm': False, 'lr': 0.0002882091308596738, 'weight_decay': 0.0008105045461514656, 'epochs': 248, 'loss': 'mae', 'optimizer': 'adam', 'graph_mode': 'off', 'use_snp_selection': False}. Best is trial 57 with value: 0.1368237737487214.
[I 2025-12-05 14:57:32,146] Trial 84 finished with value: 0.10018417457607054 and parameters: {'model_type': 'mlp', 'hidden_dims': '[256, 128]', 'dropout': 0.21239042742430217, 'batch_norm': False, 'lr': 0.0005053236814013837, 'weight_decay': 0.00031266273879040235, 'epochs': 281, 'loss': 'mae', 'optimizer': 'adam', 'graph_mode': 'off', 'use_snp_selection': False}. Best is trial 57 with value: 0.1368237737487214.
[I 2025-12-05 14:57:33,287] Trial 85 finished with value: 0.11613255886509785 and parameters: {'model_type': 'mlp', 'hidden_dims': '[256, 128]', 'dropout': 0.11691373593010294, 'batch_norm': False, 'lr': 0.00027308047817395793, 'weight_decay': 0.0006756448633958058, 'epochs': 287, 'loss': 'mae', 'optimizer': 'adam', 'graph_mode': 'off', 'use_snp_selection': False}. Best is trial 57 with value: 0.1368237737487214.
[I 2025-12-05 14:57:34,387] Trial 86 finished with value: 0.11015450721388077 and parameters: {'model_type': 'mlp', 'hidden_dims': '[256, 128]', 'dropout': 0.23542009610561304, 'batch_norm': False, 'lr': 0.0003551191290979674, 'weight_decay': 0.0004937516030275255, 'epochs': 267, 'loss': 'mae', 'optimizer': 'adam', 'graph_mode': 'off', 'use_snp_selection': False}. Best is trial 57 with value: 0.1368237737487214.
[I 2025-12-05 14:57:35,384] Trial 87 finished with value: 0.11732399055655009 and parameters: {'model_type': 'mlp', 'hidden_dims': '[256, 128]', 'dropout': 0.17051335440805654, 'batch_norm': False, 'lr': 0.00023574062947975336, 'weight_decay': 0.0009902694029682172, 'epochs': 215, 'loss': 'mae', 'optimizer': 'adam', 'graph_mode': 'off', 'use_snp_selection': False}. Best is trial 57 with value: 0.1368237737487214.
[I 2025-12-05 14:57:36,413] Trial 88 finished with value: 0.11887619116351164 and parameters: {'model_type': 'mlp', 'hidden_dims': '[256, 128]', 'dropout': 0.1953184808953907, 'batch_norm': False, 'lr': 0.0001789969585044679, 'weight_decay': 0.00013648421885564924, 'epochs': 231, 'loss': 'mae', 'optimizer': 'adam', 'graph_mode': 'off', 'use_snp_selection': False}. Best is trial 57 with value: 0.1368237737487214.
[I 2025-12-05 14:57:38,062] Trial 89 finished with value: 0.096335641264544 and parameters: {'model_type': 'mlp', 'hidden_dims': '[512, 128]', 'dropout': 0.15243444212748675, 'batch_norm': False, 'lr': 0.0007423066817282904, 'weight_decay': 0.0002438432937357128, 'epochs': 246, 'loss': 'mae', 'optimizer': 'adam', 'graph_mode': 'off', 'use_snp_selection': False}. Best is trial 57 with value: 0.1368237737487214.
[I 2025-12-05 14:57:40,422] Trial 90 finished with value: 0.1139271141092316 and parameters: {'model_type': 'mlp', 'hidden_dims': '[256, 128]', 'dropout': 0.18050183131813352, 'batch_norm': False, 'lr': 2.5040923365289253e-05, 'weight_decay': 0.00037759098896305795, 'epochs': 218, 'loss': 'mae', 'optimizer': 'adam', 'graph_mode': 'off', 'use_snp_selection': True, 'num_snps': 48165}. Best is trial 57 with value: 0.1368237737487214.
[I 2025-12-05 14:57:42,425] Trial 91 finished with value: 0.12679891030371093 and parameters: {'model_type': 'mlp', 'hidden_dims': '[512, 256]', 'dropout': 0.18560043143843719, 'batch_norm': False, 'lr': 0.00010008928950174328, 'weight_decay': 2.6085886446340658e-06, 'epochs': 342, 'loss': 'mae', 'optimizer': 'adam', 'graph_mode': 'off', 'use_snp_selection': False}. Best is trial 57 with value: 0.1368237737487214.
[I 2025-12-05 14:57:43,674] Trial 92 finished with value: 0.12664724301537178 and parameters: {'model_type': 'mlp', 'hidden_dims': '[256, 128, 64]', 'dropout': 0.13104178375811906, 'batch_norm': False, 'lr': 0.0001350012195677395, 'weight_decay': 1.4867815640698857e-05, 'epochs': 334, 'loss': 'mae', 'optimizer': 'adam', 'graph_mode': 'off', 'use_snp_selection': False}. Best is trial 57 with value: 0.1368237737487214.
[I 2025-12-05 14:57:44,769] Trial 93 finished with value: 0.1131309755653175 and parameters: {'model_type': 'mlp', 'hidden_dims': '[256, 128]', 'dropout': 0.15178697126733406, 'batch_norm': False, 'lr': 3.37739500599612e-05, 'weight_decay': 6.108184836194407e-06, 'epochs': 264, 'loss': 'mae', 'optimizer': 'adam', 'graph_mode': 'off', 'use_snp_selection': False}. Best is trial 57 with value: 0.1368237737487214.
[I 2025-12-05 14:57:45,608] Trial 94 finished with value: 0.11402761864039107 and parameters: {'model_type': 'mlp', 'hidden_dims': '[128, 64]', 'dropout': 0.1839679999361175, 'batch_norm': False, 'lr': 1.9014804971166507e-05, 'weight_decay': 0.0001938838369706797, 'epochs': 291, 'loss': 'mae', 'optimizer': 'adam', 'graph_mode': 'off', 'use_snp_selection': False}. Best is trial 57 with value: 0.1368237737487214.
[I 2025-12-05 14:57:47,467] Trial 95 finished with value: 0.11702823748461309 and parameters: {'model_type': 'mlp', 'hidden_dims': '[512, 128]', 'dropout': 0.2005991910174165, 'batch_norm': False, 'lr': 4.615278675657765e-05, 'weight_decay': 7.83304614565659e-06, 'epochs': 305, 'loss': 'mae', 'optimizer': 'adam', 'graph_mode': 'off', 'use_snp_selection': False}. Best is trial 57 with value: 0.1368237737487214.
[I 2025-12-05 14:57:48,573] Trial 96 finished with value: 0.12462987534030508 and parameters: {'model_type': 'mlp', 'hidden_dims': '[256, 128, 64]', 'dropout': 0.33807324175404924, 'batch_norm': False, 'lr': 0.00022627622148891545, 'weight_decay': 0.00043787666490138554, 'epochs': 238, 'loss': 'mae', 'optimizer': 'adam', 'graph_mode': 'off', 'use_snp_selection': False}. Best is trial 57 with value: 0.1368237737487214.
[I 2025-12-05 14:57:49,871] Trial 97 finished with value: 0.12242102471010696 and parameters: {'model_type': 'mlp', 'hidden_dims': '[256, 128]', 'dropout': 0.24509651000028193, 'batch_norm': True, 'lr': 0.00031197849982323616, 'weight_decay': 2.3674598553437087e-05, 'epochs': 328, 'loss': 'mae', 'optimizer': 'adam', 'graph_mode': 'off', 'use_snp_selection': False}. Best is trial 57 with value: 0.1368237737487214.
[I 2025-12-05 14:57:51,026] Trial 98 finished with value: 0.13181494726394113 and parameters: {'model_type': 'mlp', 'hidden_dims': '[256, 128]', 'dropout': 0.2153449253387938, 'batch_norm': False, 'lr': 0.00016039018566429367, 'weight_decay': 6.590233347177299e-05, 'epochs': 276, 'loss': 'mae', 'optimizer': 'adam', 'graph_mode': 'off', 'use_snp_selection': False}. Best is trial 57 with value: 0.1368237737487214.
[I 2025-12-05 14:57:52,190] Trial 99 finished with value: 0.12440324527403591 and parameters: {'model_type': 'mlp', 'hidden_dims': '[256, 128]', 'dropout': 0.21427817484093856, 'batch_norm': True, 'lr': 0.0001500003693057863, 'weight_decay': 0.00016082563254327136, 'epochs': 277, 'loss': 'mae', 'optimizer': 'adam', 'graph_mode': 'off', 'use_snp_selection': False}. Best is trial 57 with value: 0.1368237737487214.
[I 2025-12-05 14:57:53,193] Trial 100 finished with value: 0.11073621753755454 and parameters: {'model_type': 'mlp', 'hidden_dims': '[256, 128]', 'dropout': 0.28357612608007415, 'batch_norm': False, 'lr': 1.581701345687902e-05, 'weight_decay': 0.00031709689380127827, 'epochs': 218, 'loss': 'mae', 'optimizer': 'adam', 'graph_mode': 'off', 'use_snp_selection': False}. Best is trial 57 with value: 0.1368237737487214.
[I 2025-12-05 14:57:54,385] Trial 101 finished with value: 0.1341568950573677 and parameters: {'model_type': 'mlp', 'hidden_dims': '[256, 128]', 'dropout': 0.16932092314094666, 'batch_norm': False, 'lr': 0.0002510026437320546, 'weight_decay': 9.369283729000707e-05, 'epochs': 314, 'loss': 'mae', 'optimizer': 'adam', 'graph_mode': 'off', 'use_snp_selection': False}. Best is trial 57 with value: 0.1368237737487214.
[I 2025-12-05 14:57:55,550] Trial 102 finished with value: 0.10684513887611621 and parameters: {'model_type': 'mlp', 'hidden_dims': '[256, 128]', 'dropout': 0.17061018391761096, 'batch_norm': False, 'lr': 0.0004820029979478905, 'weight_decay': 0.00011185375959389451, 'epochs': 301, 'loss': 'mae', 'optimizer': 'adam', 'graph_mode': 'off', 'use_snp_selection': False}. Best is trial 57 with value: 0.1368237737487214.
[I 2025-12-05 14:57:56,749] Trial 103 finished with value: 0.10553501105457891 and parameters: {'model_type': 'mlp', 'hidden_dims': '[256, 128]', 'dropout': 0.16349680109373327, 'batch_norm': False, 'lr': 0.000254473901585061, 'weight_decay': 6.411223227900305e-05, 'epochs': 318, 'loss': 'mae', 'optimizer': 'adam', 'graph_mode': 'off', 'use_snp_selection': False}. Best is trial 57 with value: 0.1368237737487214.
[I 2025-12-05 14:57:57,885] Trial 104 finished with value: 0.11265710417798501 and parameters: {'model_type': 'mlp', 'hidden_dims': '[256, 128]', 'dropout': 0.1968973978635682, 'batch_norm': False, 'lr': 0.0001829603984219511, 'weight_decay': 9.041710813227893e-05, 'epochs': 283, 'loss': 'mae', 'optimizer': 'adam', 'graph_mode': 'off', 'use_snp_selection': False}. Best is trial 57 with value: 0.1368237737487214.
[I 2025-12-05 14:57:59,008] Trial 105 finished with value: 0.13730927959914407 and parameters: {'model_type': 'mlp', 'hidden_dims': '[256, 128]', 'dropout': 0.2289508350261705, 'batch_norm': False, 'lr': 3.3193076996296145e-05, 'weight_decay': 0.00022836528972833162, 'epochs': 270, 'loss': 'mae', 'optimizer': 'adam', 'graph_mode': 'off', 'use_snp_selection': False}. Best is trial 105 with value: 0.13730927959914407.
[I 2025-12-05 14:58:00,144] Trial 106 finished with value: 0.1162134894503107 and parameters: {'model_type': 'mlp', 'hidden_dims': '[256, 128]', 'dropout': 0.22446483777290238, 'batch_norm': False, 'lr': 2.3801449593226697e-05, 'weight_decay': 0.0002218915940275278, 'epochs': 260, 'loss': 'mae', 'optimizer': 'adam', 'graph_mode': 'off', 'use_snp_selection': False}. Best is trial 105 with value: 0.13730927959914407.
[I 2025-12-05 14:58:01,414] Trial 107 finished with value: 0.07407773435289901 and parameters: {'model_type': 'mlp', 'hidden_dims': '[256, 128, 64]', 'dropout': 0.22999595759358826, 'batch_norm': True, 'lr': 1.993261182702332e-05, 'weight_decay': 0.0005733672316585494, 'epochs': 309, 'loss': 'mae', 'optimizer': 'adam', 'graph_mode': 'off', 'use_snp_selection': False}. Best is trial 105 with value: 0.13730927959914407.
[I 2025-12-05 14:58:03,224] Trial 108 finished with value: 0.10980097441969373 and parameters: {'model_type': 'mlp', 'hidden_dims': '[512, 128]', 'dropout': 0.25700227545411297, 'batch_norm': False, 'lr': 2.8879176555170006e-05, 'weight_decay': 0.00015290224351312742, 'epochs': 293, 'loss': 'mae', 'optimizer': 'adam', 'graph_mode': 'off', 'use_snp_selection': False}. Best is trial 105 with value: 0.13730927959914407.
[I 2025-12-05 14:58:04,836] Trial 109 finished with value: 0.11008692576026585 and parameters: {'model_type': 'mlp', 'hidden_dims': '[256, 128]', 'dropout': 0.21537006349347346, 'batch_norm': False, 'lr': 5.3479988357212805e-05, 'weight_decay': 0.0001232893938140536, 'epochs': 249, 'loss': 'mae', 'optimizer': 'adam', 'graph_mode': 'off', 'use_snp_selection': True, 'num_snps': 28308}. Best is trial 105 with value: 0.13730927959914407.
[I 2025-12-05 14:58:05,956] Trial 110 finished with value: 0.07758047909080888 and parameters: {'model_type': 'mlp', 'hidden_dims': '[256, 128]', 'dropout': 0.2434073376627551, 'batch_norm': True, 'lr': 1.3059450994549257e-05, 'weight_decay': 4.899559456896872e-06, 'epochs': 268, 'loss': 'mae', 'optimizer': 'adam', 'graph_mode': 'off', 'use_snp_selection': False}. Best is trial 105 with value: 0.13730927959914407.
[I 2025-12-05 14:58:07,085] Trial 111 finished with value: 0.12861849796725 and parameters: {'model_type': 'mlp', 'hidden_dims': '[256, 128]', 'dropout': 0.13977690107264545, 'batch_norm': False, 'lr': 3.355749174509608e-06, 'weight_decay': 0.00027453536630627905, 'epochs': 281, 'loss': 'mae', 'optimizer': 'adam', 'graph_mode': 'off', 'use_snp_selection': False}. Best is trial 105 with value: 0.13730927959914407.
[I 2025-12-05 14:58:08,172] Trial 112 finished with value: 0.11688182170118738 and parameters: {'model_type': 'mlp', 'hidden_dims': '[256, 128]', 'dropout': 0.13616401399921352, 'batch_norm': False, 'lr': 5.9760903510689295e-06, 'weight_decay': 0.00036934952468498707, 'epochs': 258, 'loss': 'mae', 'optimizer': 'adam', 'graph_mode': 'off', 'use_snp_selection': False}. Best is trial 105 with value: 0.13730927959914407.
[I 2025-12-05 14:58:09,304] Trial 113 finished with value: 0.11440279101143773 and parameters: {'model_type': 'mlp', 'hidden_dims': '[256, 128]', 'dropout': 0.1543314422713031, 'batch_norm': False, 'lr': 2.8002405364618515e-06, 'weight_decay': 7.694776581473666e-05, 'epochs': 282, 'loss': 'mae', 'optimizer': 'adam', 'graph_mode': 'off', 'use_snp_selection': False}. Best is trial 105 with value: 0.13730927959914407.
[I 2025-12-05 14:58:10,409] Trial 114 finished with value: 0.08623652762038568 and parameters: {'model_type': 'mlp', 'hidden_dims': '[256, 128]', 'dropout': 0.1900143050019889, 'batch_norm': False, 'lr': 1.9486476062505544e-06, 'weight_decay': 0.000272752284627071, 'epochs': 270, 'loss': 'mae', 'optimizer': 'adam', 'graph_mode': 'off', 'use_snp_selection': False}. Best is trial 105 with value: 0.13730927959914407.
[I 2025-12-05 14:58:11,519] Trial 115 finished with value: 0.13088315822129523 and parameters: {'model_type': 'mlp', 'hidden_dims': '[256, 128, 64]', 'dropout': 0.1430760935000606, 'batch_norm': False, 'lr': 3.450845473403671e-05, 'weight_decay': 0.00017721149224872928, 'epochs': 242, 'loss': 'mae', 'optimizer': 'adam', 'graph_mode': 'off', 'use_snp_selection': False}. Best is trial 105 with value: 0.13730927959914407.
[I 2025-12-05 14:58:12,641] Trial 116 finished with value: 0.12980744492888407 and parameters: {'model_type': 'mlp', 'hidden_dims': '[256, 128, 64]', 'dropout': 0.12479108162194226, 'batch_norm': False, 'lr': 3.421370286961191e-05, 'weight_decay': 0.00019112169443615085, 'epochs': 243, 'loss': 'mae', 'optimizer': 'adam', 'graph_mode': 'off', 'use_snp_selection': False}. Best is trial 105 with value: 0.13730927959914407.
[I 2025-12-05 14:58:13,723] Trial 117 finished with value: 0.12202045392797783 and parameters: {'model_type': 'mlp', 'hidden_dims': '[256, 128, 64]', 'dropout': 0.11376700064083778, 'batch_norm': False, 'lr': 4.17376315298732e-05, 'weight_decay': 0.00018055975830804966, 'epochs': 233, 'loss': 'mae', 'optimizer': 'adam', 'graph_mode': 'off', 'use_snp_selection': False}. Best is trial 105 with value: 0.13730927959914407.
[I 2025-12-05 14:58:14,834] Trial 118 finished with value: 0.12205508947689897 and parameters: {'model_type': 'mlp', 'hidden_dims': '[256, 128, 64]', 'dropout': 0.10333582520204337, 'batch_norm': False, 'lr': 3.31268451695203e-05, 'weight_decay': 9.932871189508776e-05, 'epochs': 247, 'loss': 'mae', 'optimizer': 'adam', 'graph_mode': 'off', 'use_snp_selection': False}. Best is trial 105 with value: 0.13730927959914407.
[I 2025-12-05 14:58:15,932] Trial 119 finished with value: 0.10688671009510553 and parameters: {'model_type': 'mlp', 'hidden_dims': '[256, 128, 64]', 'dropout': 0.1645494240660294, 'batch_norm': False, 'lr': 3.469775878453855e-05, 'weight_decay': 0.00022162199603756373, 'epochs': 243, 'loss': 'mae', 'optimizer': 'adam', 'graph_mode': 'off', 'use_snp_selection': False}. Best is trial 105 with value: 0.13730927959914407.
[I 2025-12-05 14:58:16,993] Trial 120 finished with value: 0.12860406989995948 and parameters: {'model_type': 'mlp', 'hidden_dims': '[256, 128, 64]', 'dropout': 0.13000749814743692, 'batch_norm': False, 'lr': 2.6910320001426953e-05, 'weight_decay': 0.0007113340293059819, 'epochs': 239, 'loss': 'mae', 'optimizer': 'adam', 'graph_mode': 'off', 'use_snp_selection': False}. Best is trial 105 with value: 0.13730927959914407.
[I 2025-12-05 14:58:18,085] Trial 121 finished with value: 0.12329730406938068 and parameters: {'model_type': 'mlp', 'hidden_dims': '[256, 128, 64]', 'dropout': 0.14139045916538512, 'batch_norm': False, 'lr': 5.161108316034616e-05, 'weight_decay': 0.00012656729828227533, 'epochs': 257, 'loss': 'mae', 'optimizer': 'adam', 'graph_mode': 'off', 'use_snp_selection': False}. Best is trial 105 with value: 0.13730927959914407.
[I 2025-12-05 14:58:19,238] Trial 122 finished with value: 0.11885210604776258 and parameters: {'model_type': 'mlp', 'hidden_dims': '[256, 128, 64]', 'dropout': 0.12280349515977002, 'batch_norm': False, 'lr': 6.619249313919153e-06, 'weight_decay': 0.00016698649252983982, 'epochs': 288, 'loss': 'mae', 'optimizer': 'adam', 'graph_mode': 'off', 'use_snp_selection': False}. Best is trial 105 with value: 0.13730927959914407.
[I 2025-12-05 14:58:20,322] Trial 123 finished with value: 0.11637813833742199 and parameters: {'model_type': 'mlp', 'hidden_dims': '[256, 128, 64]', 'dropout': 0.14266731287168083, 'batch_norm': False, 'lr': 1.7349815556013652e-05, 'weight_decay': 0.0004588572808569787, 'epochs': 253, 'loss': 'mae', 'optimizer': 'adam', 'graph_mode': 'off', 'use_snp_selection': False}. Best is trial 105 with value: 0.13730927959914407.
[I 2025-12-05 14:58:21,530] Trial 124 finished with value: 0.09693332903509401 and parameters: {'model_type': 'mlp', 'hidden_dims': '[256, 128, 64]', 'dropout': 0.15468375392365735, 'batch_norm': False, 'lr': 2.7507529692379387e-06, 'weight_decay': 0.00026349482584948203, 'epochs': 313, 'loss': 'mae', 'optimizer': 'adam', 'graph_mode': 'off', 'use_snp_selection': False}. Best is trial 105 with value: 0.13730927959914407.
[I 2025-12-05 14:58:23,340] Trial 125 finished with value: 0.1163452788546694 and parameters: {'model_type': 'mlp', 'hidden_dims': '[512, 256]', 'dropout': 0.17202554668948933, 'batch_norm': False, 'lr': 2.123183558932486e-05, 'weight_decay': 0.00021758122642275143, 'epochs': 296, 'loss': 'mae', 'optimizer': 'adam', 'graph_mode': 'off', 'use_snp_selection': False}. Best is trial 105 with value: 0.13730927959914407.
[I 2025-12-05 14:58:24,167] Trial 126 finished with value: 0.07103677626652438 and parameters: {'model_type': 'mlp', 'hidden_dims': '[128, 64]', 'dropout': 0.14827725276342926, 'batch_norm': False, 'lr': 4.50624833782086e-06, 'weight_decay': 0.00035646121925007353, 'epochs': 226, 'loss': 'mae', 'optimizer': 'adam', 'graph_mode': 'off', 'use_snp_selection': False}. Best is trial 105 with value: 0.13730927959914407.
[I 2025-12-05 14:58:25,928] Trial 127 finished with value: 0.11743163228099565 and parameters: {'model_type': 'mlp', 'hidden_dims': '[512, 128]', 'dropout': 0.20143649194223978, 'batch_norm': False, 'lr': 2.9838333233912884e-05, 'weight_decay': 0.00014360913324243366, 'epochs': 277, 'loss': 'mae', 'optimizer': 'adam', 'graph_mode': 'off', 'use_snp_selection': False}. Best is trial 105 with value: 0.13730927959914407.
[I 2025-12-05 14:58:27,072] Trial 128 finished with value: 0.10587307157628056 and parameters: {'model_type': 'mlp', 'hidden_dims': '[256, 128, 64]', 'dropout': 0.4020561040071308, 'batch_norm': False, 'lr': 0.0003482609686441308, 'weight_decay': 0.0005178679374294961, 'epochs': 266, 'loss': 'mae', 'optimizer': 'adam', 'graph_mode': 'off', 'use_snp_selection': False}. Best is trial 105 with value: 0.13730927959914407.
