[I 2025-12-05 21:58:01,601] Trial 104 finished with value: 0.36821647467182617 and parameters: {'model_type': 'mlp', 'hidden_dims': '[512, 64]', 'dropout': 0.5843718199676937, 'batch_norm': False, 'lr': 1.5908147946910412e-06, 'weight_decay': 3.000226059165065e-05, 'epochs': 332, 'loss': 'mae', 'optimizer': 'adam', 'graph_mode': 'off', 'use_snp_selection': True, 'num_snps': 59640}. Best is trial 81 with value: 0.3825091800297298.
[I 2025-12-05 21:59:19,608] Trial 105 finished with value: 0.37405229152801867 and parameters: {'model_type': 'mlp', 'hidden_dims': '[512, 64]', 'dropout': 0.49729113984985523, 'batch_norm': False, 'lr': 5.081595608058976e-06, 'weight_decay': 5.2024481490098994e-05, 'epochs': 301, 'loss': 'mae', 'optimizer': 'adam', 'graph_mode': 'off', 'use_snp_selection': True, 'num_snps': 47409}. Best is trial 81 with value: 0.3825091800297298.
[I 2025-12-05 22:00:37,633] Trial 106 finished with value: 0.35877076407840847 and parameters: {'model_type': 'mlp', 'hidden_dims': '[512, 128]', 'dropout': 0.11057098921180239, 'batch_norm': False, 'lr': 0.0005034027391041193, 'weight_decay': 2.1361948726439512e-05, 'epochs': 278, 'loss': 'mae', 'optimizer': 'adam', 'graph_mode': 'off', 'use_snp_selection': True, 'num_snps': 50132}. Best is trial 81 with value: 0.3825091800297298.
[I 2025-12-05 22:01:42,305] Trial 107 finished with value: 0.3459388288376419 and parameters: {'model_type': 'mlp', 'hidden_dims': '[256, 128]', 'dropout': 0.5341140633404444, 'batch_norm': True, 'lr': 3.2014414106770136e-06, 'weight_decay': 3.932030362281886e-05, 'epochs': 291, 'loss': 'mae', 'optimizer': 'adam', 'graph_mode': 'off', 'use_snp_selection': True, 'num_snps': 57807}. Best is trial 81 with value: 0.3825091800297298.
[I 2025-12-05 22:02:47,373] Trial 108 finished with value: 0.37837984916832335 and parameters: {'model_type': 'mlp', 'hidden_dims': '[512, 64]', 'dropout': 0.47056394453776534, 'batch_norm': False, 'lr': 2.6311628621015665e-06, 'weight_decay': 1.7961154825575998e-05, 'epochs': 315, 'loss': 'mae', 'optimizer': 'adam', 'graph_mode': 'off', 'use_snp_selection': False}. Best is trial 81 with value: 0.3825091800297298.
[I 2025-12-05 22:03:43,036] Trial 109 finished with value: 0.35756548699714524 and parameters: {'model_type': 'mlp', 'hidden_dims': '[512, 64]', 'dropout': 0.47098409161234056, 'batch_norm': False, 'lr': 3.2946291044022086e-05, 'weight_decay': 6.983101370671162e-05, 'epochs': 269, 'loss': 'mae', 'optimizer': 'adam', 'graph_mode': 'off', 'use_snp_selection': False}. Best is trial 81 with value: 0.3825091800297298.
[I 2025-12-05 22:04:52,895] Trial 110 finished with value: 0.37789742639003976 and parameters: {'model_type': 'mlp', 'hidden_dims': '[512, 64]', 'dropout': 0.4440565460351124, 'batch_norm': False, 'lr': 2.255036981923459e-06, 'weight_decay': 2.7518103016278955e-05, 'epochs': 336, 'loss': 'mae', 'optimizer': 'adam', 'graph_mode': 'off', 'use_snp_selection': False}. Best is trial 81 with value: 0.3825091800297298.
[I 2025-12-05 22:06:02,587] Trial 111 finished with value: 0.3750683841108886 and parameters: {'model_type': 'mlp', 'hidden_dims': '[512, 64]', 'dropout': 0.44571308829858286, 'batch_norm': False, 'lr': 2.2664722261292226e-06, 'weight_decay': 2.496966643872929e-05, 'epochs': 336, 'loss': 'mae', 'optimizer': 'adam', 'graph_mode': 'off', 'use_snp_selection': False}. Best is trial 81 with value: 0.3825091800297298.
[I 2025-12-05 22:07:14,863] Trial 112 finished with value: 0.3765037987928698 and parameters: {'model_type': 'mlp', 'hidden_dims': '[512, 64]', 'dropout': 0.46196247184056344, 'batch_norm': False, 'lr': 2.7581912741326856e-06, 'weight_decay': 3.083713131615929e-05, 'epochs': 350, 'loss': 'mae', 'optimizer': 'adam', 'graph_mode': 'off', 'use_snp_selection': False}. Best is trial 81 with value: 0.3825091800297298.
[I 2025-12-05 22:08:20,728] Trial 113 finished with value: 0.3733068747286876 and parameters: {'model_type': 'mlp', 'hidden_dims': '[512, 64]', 'dropout': 0.4152325220752201, 'batch_norm': False, 'lr': 4.202099585613043e-06, 'weight_decay': 4.7436338560232656e-05, 'epochs': 316, 'loss': 'mae', 'optimizer': 'adam', 'graph_mode': 'off', 'use_snp_selection': False}. Best is trial 81 with value: 0.3825091800297298.
[I 2025-12-05 22:09:28,163] Trial 114 finished with value: 0.3644844653747253 and parameters: {'model_type': 'mlp', 'hidden_dims': '[512, 64]', 'dropout': 0.4753229936133319, 'batch_norm': False, 'lr': 1.0010886102330347e-06, 'weight_decay': 6.054922727957436e-05, 'epochs': 325, 'loss': 'mae', 'optimizer': 'adam', 'graph_mode': 'off', 'use_snp_selection': False}. Best is trial 81 with value: 0.3825091800297298.
[I 2025-12-05 22:10:37,214] Trial 115 finished with value: 0.37560183192496843 and parameters: {'model_type': 'mlp', 'hidden_dims': '[512, 64]', 'dropout': 0.4393385851614254, 'batch_norm': False, 'lr': 2.546306948513583e-06, 'weight_decay': 1.664157516849179e-05, 'epochs': 333, 'loss': 'mae', 'optimizer': 'adam', 'graph_mode': 'off', 'use_snp_selection': False}. Best is trial 81 with value: 0.3825091800297298.
[I 2025-12-05 22:11:16,420] Trial 116 finished with value: 0.37163078296717433 and parameters: {'model_type': 'mlp', 'hidden_dims': '[256, 128]', 'dropout': 0.48669968983651335, 'batch_norm': False, 'lr': 1.9814062834354806e-06, 'weight_decay': 3.7491713700706746e-05, 'epochs': 343, 'loss': 'mae', 'optimizer': 'adam', 'graph_mode': 'off', 'use_snp_selection': False}. Best is trial 81 with value: 0.3825091800297298.
[I 2025-12-05 22:12:19,167] Trial 117 finished with value: 0.36629267291812584 and parameters: {'model_type': 'mlp', 'hidden_dims': '[512, 128]', 'dropout': 0.5089669110088516, 'batch_norm': False, 'lr': 1.32529343380934e-06, 'weight_decay': 0.00011406507173208087, 'epochs': 300, 'loss': 'mae', 'optimizer': 'adam', 'graph_mode': 'off', 'use_snp_selection': False}. Best is trial 81 with value: 0.3825091800297298.
[I 2025-12-05 22:13:25,250] Trial 118 finished with value: 0.3760856413508712 and parameters: {'model_type': 'mlp', 'hidden_dims': '[512, 64]', 'dropout': 0.45471131829581807, 'batch_norm': False, 'lr': 1.7228178188249924e-06, 'weight_decay': 2.1476002487579335e-05, 'epochs': 321, 'loss': 'mae', 'optimizer': 'adam', 'graph_mode': 'off', 'use_snp_selection': False}. Best is trial 81 with value: 0.3825091800297298.
[I 2025-12-05 22:14:29,331] Trial 119 finished with value: 0.37870648787145367 and parameters: {'model_type': 'mlp', 'hidden_dims': '[512, 64]', 'dropout': 0.4861385179080771, 'batch_norm': False, 'lr': 3.76075610890675e-06, 'weight_decay': 2.96624042368794e-05, 'epochs': 311, 'loss': 'mae', 'optimizer': 'adam', 'graph_mode': 'off', 'use_snp_selection': False}. Best is trial 81 with value: 0.3825091800297298.
[I 2025-12-05 22:14:48,915] Trial 120 finished with value: 0.3676838843313468 and parameters: {'model_type': 'mlp', 'hidden_dims': '[128, 64]', 'dropout': 0.5258697871076649, 'batch_norm': False, 'lr': 3.901688493386561e-06, 'weight_decay': 1.1558883675545204e-05, 'epochs': 282, 'loss': 'mae', 'optimizer': 'adam', 'graph_mode': 'off', 'use_snp_selection': False}. Best is trial 81 with value: 0.3825091800297298.
[I 2025-12-05 22:15:53,245] Trial 121 finished with value: 0.3747480449698898 and parameters: {'model_type': 'mlp', 'hidden_dims': '[512, 64]', 'dropout': 0.48289118516906404, 'batch_norm': False, 'lr': 2.2318661322861592e-06, 'weight_decay': 2.5539347342347054e-05, 'epochs': 311, 'loss': 'mae', 'optimizer': 'adam', 'graph_mode': 'off', 'use_snp_selection': False}. Best is trial 81 with value: 0.3825091800297298.
[I 2025-12-05 22:17:04,730] Trial 122 finished with value: 0.376653081218377 and parameters: {'model_type': 'mlp', 'hidden_dims': '[512, 64]', 'dropout': 0.4938987768543895, 'batch_norm': False, 'lr': 2.9747143155237328e-06, 'weight_decay': 3.0354643231673692e-05, 'epochs': 329, 'loss': 'mae', 'optimizer': 'adam', 'graph_mode': 'off', 'use_snp_selection': False}. Best is trial 81 with value: 0.3825091800297298.
[I 2025-12-05 22:17:43,587] Trial 123 finished with value: 0.37593810550281065 and parameters: {'model_type': 'mlp', 'hidden_dims': '[512, 64]', 'dropout': 0.4694663971154822, 'batch_norm': False, 'lr': 4.559770848738461e-06, 'weight_decay': 4.425014047514622e-05, 'epochs': 175, 'loss': 'mae', 'optimizer': 'adam', 'graph_mode': 'off', 'use_snp_selection': False}. Best is trial 81 with value: 0.3825091800297298.
[I 2025-12-05 22:18:49,075] Trial 124 finished with value: 0.3793371599738304 and parameters: {'model_type': 'mlp', 'hidden_dims': '[512, 64]', 'dropout': 0.4565581559429951, 'batch_norm': False, 'lr': 3.6852403867391778e-06, 'weight_decay': 1.7753167091008084e-05, 'epochs': 314, 'loss': 'mae', 'optimizer': 'adam', 'graph_mode': 'off', 'use_snp_selection': False}. Best is trial 81 with value: 0.3825091800297298.
[I 2025-12-05 22:19:25,635] Trial 125 finished with value: 0.36921740797735547 and parameters: {'model_type': 'mlp', 'hidden_dims': '[512, 64]', 'dropout': 0.4251088243052065, 'batch_norm': False, 'lr': 5.803769821376057e-06, 'weight_decay': 1.801636030850111e-05, 'epochs': 308, 'loss': 'mae', 'optimizer': 'adam', 'graph_mode': 'off', 'use_snp_selection': True, 'num_snps': 12017}. Best is trial 81 with value: 0.3825091800297298.
[I 2025-12-05 22:20:30,516] Trial 126 finished with value: 0.38322585700154266 and parameters: {'model_type': 'mlp', 'hidden_dims': '[512, 64]', 'dropout': 0.5005615233677189, 'batch_norm': False, 'lr': 3.6023700986939963e-06, 'weight_decay': 3.738458785200354e-05, 'epochs': 315, 'loss': 'mae', 'optimizer': 'adam', 'graph_mode': 'off', 'use_snp_selection': False}. Best is trial 126 with value: 0.38322585700154266.
[I 2025-12-05 22:21:35,944] Trial 127 finished with value: 0.3790948589009219 and parameters: {'model_type': 'mlp', 'hidden_dims': '[512, 64]', 'dropout': 0.5423557471349125, 'batch_norm': False, 'lr': 3.1333929097802338e-06, 'weight_decay': 3.8200399360453866e-05, 'epochs': 316, 'loss': 'mae', 'optimizer': 'adam', 'graph_mode': 'off', 'use_snp_selection': False}. Best is trial 126 with value: 0.38322585700154266.
[I 2025-12-05 22:22:41,763] Trial 128 finished with value: 0.35209971809327334 and parameters: {'model_type': 'mlp', 'hidden_dims': '[512, 64]', 'dropout': 0.5033280721375295, 'batch_norm': True, 'lr': 3.5399239336016078e-06, 'weight_decay': 3.70205925092971e-05, 'epochs': 313, 'loss': 'mae', 'optimizer': 'adam', 'graph_mode': 'off', 'use_snp_selection': False}. Best is trial 126 with value: 0.38322585700154266.
[I 2025-12-05 22:23:42,771] Trial 129 finished with value: 0.37372672094237575 and parameters: {'model_type': 'mlp', 'hidden_dims': '[512, 64]', 'dropout': 0.5391808897653438, 'batch_norm': False, 'lr': 7.3479258752680134e-06, 'weight_decay': 2.0179938363857904e-05, 'epochs': 293, 'loss': 'mae', 'optimizer': 'adam', 'graph_mode': 'off', 'use_snp_selection': False}. Best is trial 126 with value: 0.38322585700154266.
[I 2025-12-05 22:24:46,261] Trial 130 finished with value: 0.3783188604626015 and parameters: {'model_type': 'mlp', 'hidden_dims': '[512, 64]', 'dropout': 0.5111772902855528, 'batch_norm': False, 'lr': 3.6484634192835886e-06, 'weight_decay': 5.676925474036689e-05, 'epochs': 305, 'loss': 'mae', 'optimizer': 'adam', 'graph_mode': 'off', 'use_snp_selection': False}. Best is trial 126 with value: 0.38322585700154266.
[I 2025-12-05 22:25:52,398] Trial 131 finished with value: 0.38260508268815674 and parameters: {'model_type': 'mlp', 'hidden_dims': '[512, 64]', 'dropout': 0.5492610881204198, 'batch_norm': False, 'lr': 2.6702821165056096e-06, 'weight_decay': 3.428176474546098e-05, 'epochs': 319, 'loss': 'mae', 'optimizer': 'adam', 'graph_mode': 'off', 'use_snp_selection': False}. Best is trial 126 with value: 0.38322585700154266.
[I 2025-12-05 22:26:57,992] Trial 132 finished with value: 0.37798738917967367 and parameters: {'model_type': 'mlp', 'hidden_dims': '[512, 64]', 'dropout': 0.5585466683254307, 'batch_norm': False, 'lr': 3.1544188038306686e-06, 'weight_decay': 8.051799744360735e-05, 'epochs': 316, 'loss': 'mae', 'optimizer': 'adam', 'graph_mode': 'off', 'use_snp_selection': False}. Best is trial 126 with value: 0.38322585700154266.
[I 2025-12-05 22:28:00,652] Trial 133 finished with value: 0.3794736343088818 and parameters: {'model_type': 'mlp', 'hidden_dims': '[512, 64]', 'dropout': 0.5248382837185521, 'batch_norm': False, 'lr': 4.51332848631077e-06, 'weight_decay': 3.5604833010813153e-05, 'epochs': 300, 'loss': 'mae', 'optimizer': 'adam', 'graph_mode': 'off', 'use_snp_selection': False}. Best is trial 126 with value: 0.38322585700154266.
[I 2025-12-05 22:29:03,108] Trial 134 finished with value: 0.378792533256081 and parameters: {'model_type': 'mlp', 'hidden_dims': '[512, 64]', 'dropout': 0.524875081218907, 'batch_norm': False, 'lr': 4.571523798579868e-06, 'weight_decay': 3.4502277100373296e-05, 'epochs': 299, 'loss': 'mae', 'optimizer': 'adam', 'graph_mode': 'off', 'use_snp_selection': False}. Best is trial 126 with value: 0.38322585700154266.
[I 2025-12-05 22:29:37,842] Trial 135 finished with value: 0.3759093709352473 and parameters: {'model_type': 'mlp', 'hidden_dims': '[256, 128, 64]', 'dropout': 0.524522075610452, 'batch_norm': False, 'lr': 4.883023699208679e-06, 'weight_decay': 3.471185957700767e-05, 'epochs': 298, 'loss': 'mae', 'optimizer': 'adam', 'graph_mode': 'off', 'use_snp_selection': False}. Best is trial 126 with value: 0.38322585700154266.
[I 2025-12-05 22:30:37,699] Trial 136 finished with value: 0.3763763581681607 and parameters: {'model_type': 'mlp', 'hidden_dims': '[512, 64]', 'dropout': 0.5429295096862318, 'batch_norm': False, 'lr': 6.08405817431869e-06, 'weight_decay': 5.179589418688531e-05, 'epochs': 286, 'loss': 'mae', 'optimizer': 'adam', 'graph_mode': 'off', 'use_snp_selection': False}. Best is trial 126 with value: 0.38322585700154266.
[I 2025-12-05 22:31:41,250] Trial 137 finished with value: 0.3762262638508543 and parameters: {'model_type': 'mlp', 'hidden_dims': '[512, 64]', 'dropout': 0.5320036149534647, 'batch_norm': False, 'lr': 3.878406270108911e-06, 'weight_decay': 3.962275958129174e-05, 'epochs': 305, 'loss': 'mae', 'optimizer': 'adam', 'graph_mode': 'off', 'use_snp_selection': False}. Best is trial 126 with value: 0.38322585700154266.
[I 2025-12-05 22:32:15,035] Trial 138 finished with value: 0.3737257700221166 and parameters: {'model_type': 'mlp', 'hidden_dims': '[256, 128]', 'dropout': 0.5593924577722177, 'batch_norm': False, 'lr': 8.285286835384484e-06, 'weight_decay': 2.5370858188800025e-05, 'epochs': 291, 'loss': 'mae', 'optimizer': 'adam', 'graph_mode': 'off', 'use_snp_selection': False}. Best is trial 126 with value: 0.38322585700154266.
[I 2025-12-05 22:33:22,586] Trial 139 finished with value: 0.36789834230497825 and parameters: {'model_type': 'mlp', 'hidden_dims': '[512, 64]', 'dropout': 0.517072603733554, 'batch_norm': False, 'lr': 4.355460361888681e-06, 'weight_decay': 2.9625958665761306e-05, 'epochs': 325, 'loss': 'mse', 'optimizer': 'adam', 'graph_mode': 'off', 'use_snp_selection': False}. Best is trial 126 with value: 0.38322585700154266.
[I 2025-12-05 22:34:25,200] Trial 140 finished with value: 0.37662893672734354 and parameters: {'model_type': 'mlp', 'hidden_dims': '[512, 64]', 'dropout': 0.5513042776984436, 'batch_norm': False, 'lr': 5.384664816594304e-06, 'weight_decay': 6.399499098739823e-05, 'epochs': 300, 'loss': 'mae', 'optimizer': 'adam', 'graph_mode': 'off', 'use_snp_selection': False}. Best is trial 126 with value: 0.38322585700154266.
[I 2025-12-05 22:35:31,676] Trial 141 finished with value: 0.3783040391208292 and parameters: {'model_type': 'mlp', 'hidden_dims': '[512, 64]', 'dropout': 0.4957355472110471, 'batch_norm': False, 'lr': 3.1978137593046025e-06, 'weight_decay': 3.414649925184029e-05, 'epochs': 320, 'loss': 'mae', 'optimizer': 'adam', 'graph_mode': 'off', 'use_snp_selection': False}. Best is trial 126 with value: 0.38322585700154266.
[I 2025-12-05 22:36:40,120] Trial 142 finished with value: 0.37257521493155077 and parameters: {'model_type': 'mlp', 'hidden_dims': '[512, 64]', 'dropout': 0.5046068360572402, 'batch_norm': False, 'lr': 3.490437088858691e-06, 'weight_decay': 2.266657750267714e-05, 'epochs': 330, 'loss': 'mae', 'optimizer': 'adam', 'graph_mode': 'off', 'use_snp_selection': False}. Best is trial 126 with value: 0.38322585700154266.
[I 2025-12-05 22:37:44,729] Trial 143 finished with value: 0.37616747079526214 and parameters: {'model_type': 'mlp', 'hidden_dims': '[512, 64]', 'dropout': 0.537903874535838, 'batch_norm': False, 'lr': 4.376208087115692e-06, 'weight_decay': 4.974954184656046e-05, 'epochs': 310, 'loss': 'mae', 'optimizer': 'adam', 'graph_mode': 'off', 'use_snp_selection': False}. Best is trial 126 with value: 0.38322585700154266.
[I 2025-12-05 22:38:55,529] Trial 144 finished with value: 0.38302968543664473 and parameters: {'model_type': 'mlp', 'hidden_dims': '[512, 64]', 'dropout': 0.5659615013044923, 'batch_norm': False, 'lr': 2.873659678472214e-06, 'weight_decay': 4.1320011402795494e-05, 'epochs': 340, 'loss': 'mae', 'optimizer': 'adam', 'graph_mode': 'off', 'use_snp_selection': False}. Best is trial 126 with value: 0.38322585700154266.
[I 2025-12-05 22:40:00,211] Trial 145 finished with value: 0.3655926907307453 and parameters: {'model_type': 'mlp', 'hidden_dims': '[512, 64]', 'dropout': 0.5739793885315763, 'batch_norm': False, 'lr': 2.1461527410322785e-05, 'weight_decay': 4.239426836119782e-05, 'epochs': 317, 'loss': 'mae', 'optimizer': 'adam', 'graph_mode': 'off', 'use_snp_selection': False}. Best is trial 126 with value: 0.38322585700154266.
[I 2025-12-05 22:41:08,164] Trial 146 finished with value: 0.37399512236457466 and parameters: {'model_type': 'mlp', 'hidden_dims': '[512, 64]', 'dropout': 0.5514992962742654, 'batch_norm': False, 'lr': 2.5020393691552352e-06, 'weight_decay': 2.767884041841645e-05, 'epochs': 327, 'loss': 'mae', 'optimizer': 'adam', 'graph_mode': 'off', 'use_snp_selection': False}. Best is trial 126 with value: 0.38322585700154266.
[I 2025-12-05 22:42:12,309] Trial 147 finished with value: 0.3768309239986518 and parameters: {'model_type': 'mlp', 'hidden_dims': '[512, 64]', 'dropout': 0.5245726092128671, 'batch_norm': False, 'lr': 4.919470376323655e-06, 'weight_decay': 7.895596063359106e-05, 'epochs': 309, 'loss': 'mae', 'optimizer': 'adam', 'graph_mode': 'off', 'use_snp_selection': False}. Best is trial 126 with value: 0.38322585700154266.
[I 2025-12-05 22:43:22,431] Trial 148 finished with value: 0.3778974470567158 and parameters: {'model_type': 'mlp', 'hidden_dims': '[512, 64]', 'dropout': 0.5673830498779403, 'batch_norm': False, 'lr': 2.832580468934293e-06, 'weight_decay': 3.8851679057882154e-05, 'epochs': 338, 'loss': 'mae', 'optimizer': 'adam', 'graph_mode': 'off', 'use_snp_selection': False}. Best is trial 126 with value: 0.38322585700154266.
[I 2025-12-05 22:43:47,799] Trial 149 finished with value: 0.3534924647418648 and parameters: {'model_type': 'mlp', 'hidden_dims': '[512, 64]', 'dropout': 0.513031684123981, 'batch_norm': False, 'lr': 3.670688754658446e-06, 'weight_decay': 5.3846489782943775e-05, 'epochs': 104, 'loss': 'mae', 'optimizer': 'adam', 'graph_mode': 'off', 'use_snp_selection': False}. Best is trial 126 with value: 0.38322585700154266.
[I 2025-12-05 22:44:51,753] Trial 0 finished with value: 0.29835432224108455 and parameters: {'model_type': 'mlp', 'hidden_dims': '[128, 64]', 'dropout': 0.199031432379812, 'batch_norm': True, 'lr': 1.8408544111075837e-06, 'weight_decay': 5.5136510071208614e-05, 'epochs': 336, 'loss': 'mae', 'optimizer': 'adam', 'graph_mode': 'off', 'use_snp_selection': True, 'num_snps': 43862}. Best is trial 0 with value: 0.29835432224108455.
[I 2025-12-05 22:45:20,759] Trial 1 finished with value: 0.34305587580486846 and parameters: {'model_type': 'mlp', 'hidden_dims': '[256, 128]', 'dropout': 0.4370668075331726, 'batch_norm': True, 'lr': 7.133471581159139e-05, 'weight_decay': 1.128633586803549e-05, 'epochs': 242, 'loss': 'mae', 'optimizer': 'adam', 'graph_mode': 'off', 'use_snp_selection': False}. Best is trial 1 with value: 0.34305587580486846.
[I 2025-12-05 22:45:48,703] Trial 2 finished with value: 0.3403961620876343 and parameters: {'model_type': 'mlp', 'hidden_dims': '[256, 128, 64]', 'dropout': 0.41314357415569625, 'batch_norm': False, 'lr': 3.952233718592101e-06, 'weight_decay': 0.00026754769258252603, 'epochs': 149, 'loss': 'mse', 'optimizer': 'adam', 'graph_mode': 'off', 'use_snp_selection': True, 'num_snps': 11571}. Best is trial 1 with value: 0.34305587580486846.
[I 2025-12-05 22:46:54,918] Trial 3 finished with value: 0.3666395364661136 and parameters: {'model_type': 'mlp', 'hidden_dims': '[512, 64]', 'dropout': 0.5938127374509361, 'batch_norm': False, 'lr': 5.67704586114731e-06, 'weight_decay': 2.4518087630137052e-05, 'epochs': 320, 'loss': 'mae', 'optimizer': 'adam', 'graph_mode': 'off', 'use_snp_selection': False}. Best is trial 3 with value: 0.3666395364661136.
[I 2025-12-05 22:47:59,949] Trial 4 finished with value: 0.31882631231956066 and parameters: {'model_type': 'mlp', 'hidden_dims': '[512, 128]', 'dropout': 0.25746343592134413, 'batch_norm': True, 'lr': 1.3467657668402788e-06, 'weight_decay': 0.00033087251918647806, 'epochs': 277, 'loss': 'mse', 'optimizer': 'adam', 'graph_mode': 'off', 'use_snp_selection': True, 'num_snps': 36675}. Best is trial 3 with value: 0.3666395364661136.
[I 2025-12-05 22:48:45,451] Trial 5 finished with value: 0.2872423029490956 and parameters: {'model_type': 'mlp', 'hidden_dims': '[512, 64]', 'dropout': 0.38275350994408375, 'batch_norm': True, 'lr': 1.5586664309232824e-06, 'weight_decay': 0.0008227664668621182, 'epochs': 145, 'loss': 'mae', 'optimizer': 'adam', 'graph_mode': 'off', 'use_snp_selection': True, 'num_snps': 32148}. Best is trial 3 with value: 0.3666395364661136.
