[I 2025-12-05 15:47:42,428] Trial 92 finished with value: 0.05984832907110468 and parameters: {'model_type': 'mlp', 'hidden_dims': '[256, 128]', 'dropout': 0.25118675626826403, 'batch_norm': True, 'lr': 0.000414872008518753, 'weight_decay': 4.057548107589391e-05, 'epochs': 193, 'loss': 'mae', 'optimizer': 'adam', 'graph_mode': 'off', 'use_snp_selection': False}. Best is trial 78 with value: 0.08363337388283676.
[I 2025-12-05 15:47:43,767] Trial 93 finished with value: 0.07650292761634479 and parameters: {'model_type': 'mlp', 'hidden_dims': '[512, 64]', 'dropout': 0.29700346846058745, 'batch_norm': True, 'lr': 0.0002755916803207898, 'weight_decay': 2.8447774633871935e-06, 'epochs': 165, 'loss': 'mae', 'optimizer': 'adam', 'graph_mode': 'off', 'use_snp_selection': False}. Best is trial 78 with value: 0.08363337388283676.
[I 2025-12-05 15:47:45,326] Trial 94 finished with value: 0.035898572022962316 and parameters: {'model_type': 'mlp', 'hidden_dims': '[512, 64]', 'dropout': 0.2628374540615257, 'batch_norm': True, 'lr': 0.0002749292944778253, 'weight_decay': 3.543849849903573e-06, 'epochs': 228, 'loss': 'mae', 'optimizer': 'adam', 'graph_mode': 'off', 'use_snp_selection': False}. Best is trial 78 with value: 0.08363337388283676.
[I 2025-12-05 15:47:46,662] Trial 95 finished with value: 0.007451805323838067 and parameters: {'model_type': 'mlp', 'hidden_dims': '[512, 64]', 'dropout': 0.29295941416031185, 'batch_norm': True, 'lr': 0.00018502015741593862, 'weight_decay': 2.077953509135778e-06, 'epochs': 165, 'loss': 'mae', 'optimizer': 'adam', 'graph_mode': 'off', 'use_snp_selection': False}. Best is trial 78 with value: 0.08363337388283676.
[I 2025-12-05 15:47:48,138] Trial 96 finished with value: 0.05188203177411075 and parameters: {'model_type': 'mlp', 'hidden_dims': '[512, 64]', 'dropout': 0.30643193368201127, 'batch_norm': True, 'lr': 0.00015529918186882744, 'weight_decay': 2.9105859252412153e-06, 'epochs': 205, 'loss': 'mae', 'optimizer': 'adam', 'graph_mode': 'off', 'use_snp_selection': False}. Best is trial 78 with value: 0.08363337388283676.
[I 2025-12-05 15:47:49,603] Trial 97 finished with value: 0.058467724274369054 and parameters: {'model_type': 'mlp', 'hidden_dims': '[512, 64]', 'dropout': 0.23532182843949445, 'batch_norm': True, 'lr': 0.0006083967118313834, 'weight_decay': 4.604871857464505e-06, 'epochs': 195, 'loss': 'mse', 'optimizer': 'adam', 'graph_mode': 'off', 'use_snp_selection': False}. Best is trial 78 with value: 0.08363337388283676.
[I 2025-12-05 15:47:50,604] Trial 98 finished with value: 0.03818107043214961 and parameters: {'model_type': 'mlp', 'hidden_dims': '[256, 128]', 'dropout': 0.3212834759020101, 'batch_norm': True, 'lr': 0.0007763874249443009, 'weight_decay': 6.262062285667959e-06, 'epochs': 186, 'loss': 'mae', 'optimizer': 'adam', 'graph_mode': 'off', 'use_snp_selection': False}. Best is trial 78 with value: 0.08363337388283676.
[I 2025-12-05 15:47:51,847] Trial 99 finished with value: 0.05695812060792401 and parameters: {'model_type': 'mlp', 'hidden_dims': '[256, 128]', 'dropout': 0.27039533129508775, 'batch_norm': True, 'lr': 0.0002227481434207754, 'weight_decay': 1.337280683031178e-05, 'epochs': 313, 'loss': 'mae', 'optimizer': 'adam', 'graph_mode': 'off', 'use_snp_selection': False}. Best is trial 78 with value: 0.08363337388283676.
[I 2025-12-05 15:47:53,236] Trial 100 finished with value: 0.014787855801613011 and parameters: {'model_type': 'mlp', 'hidden_dims': '[512, 128]', 'dropout': 0.2260757744207605, 'batch_norm': False, 'lr': 0.00027937675182438174, 'weight_decay': 2.5168950937023302e-05, 'epochs': 173, 'loss': 'mae', 'optimizer': 'adam', 'graph_mode': 'off', 'use_snp_selection': False}. Best is trial 78 with value: 0.08363337388283676.
[I 2025-12-05 15:47:54,226] Trial 101 finished with value: 0.0506532693729609 and parameters: {'model_type': 'mlp', 'hidden_dims': '[256, 128]', 'dropout': 0.2869874587086173, 'batch_norm': True, 'lr': 0.000473494899991608, 'weight_decay': 1.8459301793097067e-06, 'epochs': 157, 'loss': 'mae', 'optimizer': 'adam', 'graph_mode': 'off', 'use_snp_selection': False}. Best is trial 78 with value: 0.08363337388283676.
[I 2025-12-05 15:47:55,609] Trial 102 finished with value: 0.06757901502404677 and parameters: {'model_type': 'mlp', 'hidden_dims': '[512, 64]', 'dropout': 0.34924738947569844, 'batch_norm': True, 'lr': 0.00034753748657641385, 'weight_decay': 8.977283774207266e-05, 'epochs': 164, 'loss': 'mae', 'optimizer': 'adam', 'graph_mode': 'off', 'use_snp_selection': False}. Best is trial 78 with value: 0.08363337388283676.
[I 2025-12-05 15:47:57,027] Trial 103 finished with value: 0.042129720237423 and parameters: {'model_type': 'mlp', 'hidden_dims': '[512, 64]', 'dropout': 0.3418455114648798, 'batch_norm': True, 'lr': 0.00033902211065605454, 'weight_decay': 6.606663218150528e-05, 'epochs': 178, 'loss': 'mae', 'optimizer': 'adam', 'graph_mode': 'off', 'use_snp_selection': False}. Best is trial 78 with value: 0.08363337388283676.
[I 2025-12-05 15:47:58,384] Trial 104 finished with value: 0.054742946605620624 and parameters: {'model_type': 'mlp', 'hidden_dims': '[512, 64]', 'dropout': 0.31254577644897863, 'batch_norm': True, 'lr': 0.0004948670135622961, 'weight_decay': 9.326271370999777e-05, 'epochs': 162, 'loss': 'mae', 'optimizer': 'adam', 'graph_mode': 'off', 'use_snp_selection': False}. Best is trial 78 with value: 0.08363337388283676.
[I 2025-12-05 15:47:59,906] Trial 105 finished with value: 0.03685356610985127 and parameters: {'model_type': 'mlp', 'hidden_dims': '[512, 64]', 'dropout': 0.2531735728070322, 'batch_norm': True, 'lr': 0.00018458616791047904, 'weight_decay': 4.827592144391233e-05, 'epochs': 216, 'loss': 'mae', 'optimizer': 'adam', 'graph_mode': 'off', 'use_snp_selection': False}. Best is trial 78 with value: 0.08363337388283676.
[I 2025-12-05 15:48:00,748] Trial 106 finished with value: 0.07413475085249527 and parameters: {'model_type': 'mlp', 'hidden_dims': '[128, 64]', 'dropout': 0.2989191592407209, 'batch_norm': True, 'lr': 0.00024249281638658696, 'weight_decay': 8.290335197969756e-05, 'epochs': 188, 'loss': 'mae', 'optimizer': 'adam', 'graph_mode': 'off', 'use_snp_selection': False}. Best is trial 78 with value: 0.08363337388283676.
[I 2025-12-05 15:48:01,591] Trial 107 finished with value: 0.042849135128551125 and parameters: {'model_type': 'mlp', 'hidden_dims': '[128, 64]', 'dropout': 0.33115592746657013, 'batch_norm': True, 'lr': 0.0001176410614665763, 'weight_decay': 0.00012481753723349258, 'epochs': 189, 'loss': 'mae', 'optimizer': 'adam', 'graph_mode': 'off', 'use_snp_selection': False}. Best is trial 78 with value: 0.08363337388283676.
[I 2025-12-05 15:48:03,980] Trial 108 finished with value: 0.04716900106796215 and parameters: {'model_type': 'mlp', 'hidden_dims': '[128, 64]', 'dropout': 0.300701802809622, 'batch_norm': True, 'lr': 0.00025406824145298546, 'weight_decay': 3.479324848153374e-05, 'epochs': 199, 'loss': 'mae', 'optimizer': 'adam', 'graph_mode': 'off', 'use_snp_selection': True, 'num_snps': 53885}. Best is trial 78 with value: 0.08363337388283676.
[I 2025-12-05 15:48:04,858] Trial 109 finished with value: 0.0783592452877661 and parameters: {'model_type': 'mlp', 'hidden_dims': '[128, 64]', 'dropout': 0.2796503405180364, 'batch_norm': True, 'lr': 0.0006793704464421106, 'weight_decay': 8.782838654258414e-05, 'epochs': 207, 'loss': 'mae', 'optimizer': 'adam', 'graph_mode': 'off', 'use_snp_selection': False}. Best is trial 78 with value: 0.08363337388283676.
[I 2025-12-05 15:48:05,740] Trial 110 finished with value: 0.033749592816702464 and parameters: {'model_type': 'mlp', 'hidden_dims': '[128, 64]', 'dropout': 0.2968412126619144, 'batch_norm': True, 'lr': 9.260178439501607e-05, 'weight_decay': 8.448946806683876e-05, 'epochs': 212, 'loss': 'mae', 'optimizer': 'adam', 'graph_mode': 'off', 'use_snp_selection': False}. Best is trial 78 with value: 0.08363337388283676.
[I 2025-12-05 15:48:06,610] Trial 111 finished with value: 0.05431978304788389 and parameters: {'model_type': 'mlp', 'hidden_dims': '[128, 64]', 'dropout': 0.26504604775377194, 'batch_norm': True, 'lr': 0.0007006466076313916, 'weight_decay': 7.319683723430647e-05, 'epochs': 203, 'loss': 'mae', 'optimizer': 'adam', 'graph_mode': 'off', 'use_snp_selection': False}. Best is trial 78 with value: 0.08363337388283676.
[I 2025-12-05 15:48:07,453] Trial 112 finished with value: 0.05769262352929197 and parameters: {'model_type': 'mlp', 'hidden_dims': '[128, 64]', 'dropout': 0.28454740713304794, 'batch_norm': True, 'lr': 0.0008580543388757803, 'weight_decay': 0.0001105507880112247, 'epochs': 183, 'loss': 'mae', 'optimizer': 'adam', 'graph_mode': 'off', 'use_snp_selection': False}. Best is trial 78 with value: 0.08363337388283676.
[I 2025-12-05 15:48:08,357] Trial 113 finished with value: 0.07495378369169885 and parameters: {'model_type': 'mlp', 'hidden_dims': '[128, 64]', 'dropout': 0.27632180836291065, 'batch_norm': True, 'lr': 0.0005639156795616373, 'weight_decay': 5.435361094533137e-05, 'epochs': 228, 'loss': 'mae', 'optimizer': 'adam', 'graph_mode': 'off', 'use_snp_selection': False}. Best is trial 78 with value: 0.08363337388283676.
[I 2025-12-05 15:48:09,183] Trial 114 finished with value: 0.05523339877454903 and parameters: {'model_type': 'mlp', 'hidden_dims': '[128, 64]', 'dropout': 0.23915965285381988, 'batch_norm': True, 'lr': 0.0005891729359343492, 'weight_decay': 0.00020445332220669384, 'epochs': 168, 'loss': 'mae', 'optimizer': 'adam', 'graph_mode': 'off', 'use_snp_selection': False}. Best is trial 78 with value: 0.08363337388283676.
[I 2025-12-05 15:48:10,171] Trial 115 finished with value: 0.06500834220103738 and parameters: {'model_type': 'mlp', 'hidden_dims': '[128, 64]', 'dropout': 0.5836868724072927, 'batch_norm': True, 'lr': 0.0004327447203185717, 'weight_decay': 5.10695494748736e-05, 'epochs': 239, 'loss': 'mae', 'optimizer': 'adam', 'graph_mode': 'off', 'use_snp_selection': False}. Best is trial 78 with value: 0.08363337388283676.
[I 2025-12-05 15:48:11,129] Trial 116 finished with value: 0.051291849367487076 and parameters: {'model_type': 'mlp', 'hidden_dims': '[128, 64]', 'dropout': 0.3529677551035185, 'batch_norm': True, 'lr': 0.00036483004389800547, 'weight_decay': 6.122314366214528e-05, 'epochs': 229, 'loss': 'mse', 'optimizer': 'adam', 'graph_mode': 'off', 'use_snp_selection': False}. Best is trial 78 with value: 0.08363337388283676.
[I 2025-12-05 15:48:12,058] Trial 117 finished with value: 0.035190969501568935 and parameters: {'model_type': 'mlp', 'hidden_dims': '[128, 64]', 'dropout': 0.31632846900836564, 'batch_norm': True, 'lr': 0.00020439077601765146, 'weight_decay': 4.017165834282416e-06, 'epochs': 208, 'loss': 'mae', 'optimizer': 'adam', 'graph_mode': 'off', 'use_snp_selection': False}. Best is trial 78 with value: 0.08363337388283676.
[I 2025-12-05 15:48:12,964] Trial 118 finished with value: 0.05927305166511162 and parameters: {'model_type': 'mlp', 'hidden_dims': '[128, 64]', 'dropout': 0.26875066521295465, 'batch_norm': True, 'lr': 0.0005474436563140258, 'weight_decay': 8.380821423076512e-05, 'epochs': 194, 'loss': 'mae', 'optimizer': 'adam', 'graph_mode': 'off', 'use_snp_selection': False}. Best is trial 78 with value: 0.08363337388283676.
[I 2025-12-05 15:48:13,935] Trial 119 finished with value: 0.01731277386633055 and parameters: {'model_type': 'mlp', 'hidden_dims': '[256, 128, 64]', 'dropout': 0.25373785587666414, 'batch_norm': True, 'lr': 0.00016943329112377963, 'weight_decay': 7.675338046352331e-06, 'epochs': 142, 'loss': 'mae', 'optimizer': 'adam', 'graph_mode': 'off', 'use_snp_selection': False}. Best is trial 78 with value: 0.08363337388283676.
[I 2025-12-05 15:48:15,189] Trial 120 finished with value: 0.03910851163002785 and parameters: {'model_type': 'mlp', 'hidden_dims': '[512, 64]', 'dropout': 0.2966209785312248, 'batch_norm': False, 'lr': 0.0001328788436393165, 'weight_decay': 2.8596484854179973e-06, 'epochs': 132, 'loss': 'mae', 'optimizer': 'adam', 'graph_mode': 'off', 'use_snp_selection': False}. Best is trial 78 with value: 0.08363337388283676.
[I 2025-12-05 15:48:16,149] Trial 121 finished with value: 0.05429529959254566 and parameters: {'model_type': 'mlp', 'hidden_dims': '[128, 64]', 'dropout': 0.2795891843471307, 'batch_norm': True, 'lr': 0.0007059652289656582, 'weight_decay': 3.877569832388792e-05, 'epochs': 223, 'loss': 'mae', 'optimizer': 'adam', 'graph_mode': 'off', 'use_snp_selection': False}. Best is trial 78 with value: 0.08363337388283676.
[I 2025-12-05 15:48:17,682] Trial 122 finished with value: 0.051546282421418 and parameters: {'model_type': 'mlp', 'hidden_dims': '[512, 64]', 'dropout': 0.24444709203695053, 'batch_norm': True, 'lr': 0.0005103031169772169, 'weight_decay': 4.91033593954383e-06, 'epochs': 217, 'loss': 'mae', 'optimizer': 'adam', 'graph_mode': 'off', 'use_snp_selection': False}. Best is trial 78 with value: 0.08363337388283676.
[I 2025-12-05 15:48:18,608] Trial 123 finished with value: 0.05120824597686211 and parameters: {'model_type': 'mlp', 'hidden_dims': '[128, 64]', 'dropout': 0.22107091704818357, 'batch_norm': True, 'lr': 0.0003069410974659801, 'weight_decay': 5.6988598092384725e-05, 'epochs': 243, 'loss': 'mae', 'optimizer': 'adam', 'graph_mode': 'off', 'use_snp_selection': False}. Best is trial 78 with value: 0.08363337388283676.
[I 2025-12-05 15:48:19,690] Trial 124 finished with value: 0.04276202696595035 and parameters: {'model_type': 'mlp', 'hidden_dims': '[512, 128]', 'dropout': 0.2593707138948566, 'batch_norm': True, 'lr': 0.00022735980979808623, 'weight_decay': 1.861640692479236e-05, 'epochs': 252, 'loss': 'mae', 'optimizer': 'adam', 'graph_mode': 'off', 'use_snp_selection': True, 'num_snps': 7451}. Best is trial 78 with value: 0.08363337388283676.
[I 2025-12-05 15:48:20,719] Trial 125 finished with value: 0.0778937908838825 and parameters: {'model_type': 'mlp', 'hidden_dims': '[256, 128]', 'dropout': 0.28429206489496783, 'batch_norm': True, 'lr': 0.0009998071060882557, 'weight_decay': 0.00010089680670139285, 'epochs': 198, 'loss': 'mae', 'optimizer': 'adam', 'graph_mode': 'off', 'use_snp_selection': False}. Best is trial 78 with value: 0.08363337388283676.
[I 2025-12-05 15:48:21,581] Trial 126 finished with value: 0.07017179911927068 and parameters: {'model_type': 'mlp', 'hidden_dims': '[128, 64]', 'dropout': 0.3427388662238945, 'batch_norm': True, 'lr': 0.0008374995886609633, 'weight_decay': 0.00016774744002735886, 'epochs': 197, 'loss': 'mae', 'optimizer': 'adam', 'graph_mode': 'off', 'use_snp_selection': False}. Best is trial 78 with value: 0.08363337388283676.
[I 2025-12-05 15:48:22,451] Trial 127 finished with value: 0.05920739766828358 and parameters: {'model_type': 'mlp', 'hidden_dims': '[128, 64]', 'dropout': 0.3599247110895624, 'batch_norm': True, 'lr': 0.0009010585567749641, 'weight_decay': 0.0001649531082396674, 'epochs': 201, 'loss': 'mae', 'optimizer': 'adam', 'graph_mode': 'off', 'use_snp_selection': False}. Best is trial 78 with value: 0.08363337388283676.
[I 2025-12-05 15:48:23,337] Trial 128 finished with value: 0.06062093609901179 and parameters: {'model_type': 'mlp', 'hidden_dims': '[128, 64]', 'dropout': 0.37913489769079384, 'batch_norm': True, 'lr': 0.0009876717101831905, 'weight_decay': 0.00012217592546933363, 'epochs': 187, 'loss': 'mae', 'optimizer': 'adam', 'graph_mode': 'off', 'use_snp_selection': False}. Best is trial 78 with value: 0.08363337388283676.
[I 2025-12-05 15:48:24,218] Trial 129 finished with value: 0.04522830699466052 and parameters: {'model_type': 'mlp', 'hidden_dims': '[128, 64]', 'dropout': 0.336053327803609, 'batch_norm': True, 'lr': 0.0008515102819402181, 'weight_decay': 9.805639341054971e-05, 'epochs': 210, 'loss': 'mae', 'optimizer': 'adam', 'graph_mode': 'off', 'use_snp_selection': False}. Best is trial 78 with value: 0.08363337388283676.
[I 2025-12-05 15:48:25,082] Trial 130 finished with value: 0.06523546069198059 and parameters: {'model_type': 'mlp', 'hidden_dims': '[128, 64]', 'dropout': 0.3216604348102484, 'batch_norm': True, 'lr': 0.0006050510139781506, 'weight_decay': 7.699525770851057e-05, 'epochs': 197, 'loss': 'mae', 'optimizer': 'adam', 'graph_mode': 'off', 'use_snp_selection': False}. Best is trial 78 with value: 0.08363337388283676.
[I 2025-12-05 15:48:26,480] Trial 131 finished with value: 0.060254720342046125 and parameters: {'model_type': 'mlp', 'hidden_dims': '[512, 256]', 'dropout': 0.34480414564530837, 'batch_norm': True, 'lr': 0.0007278449570928667, 'weight_decay': 0.00019590505127810713, 'epochs': 180, 'loss': 'mae', 'optimizer': 'adam', 'graph_mode': 'off', 'use_snp_selection': False}. Best is trial 78 with value: 0.08363337388283676.
[I 2025-12-05 15:48:27,360] Trial 132 finished with value: 0.02947099009105237 and parameters: {'model_type': 'mlp', 'hidden_dims': '[256, 128]', 'dropout': 0.2892201875293288, 'batch_norm': True, 'lr': 2.6559146147006634e-05, 'weight_decay': 0.00013263804620586257, 'epochs': 93, 'loss': 'mae', 'optimizer': 'adam', 'graph_mode': 'off', 'use_snp_selection': False}. Best is trial 78 with value: 0.08363337388283676.
[I 2025-12-05 15:48:28,859] Trial 133 finished with value: 0.05200284757130385 and parameters: {'model_type': 'mlp', 'hidden_dims': '[512, 64]', 'dropout': 0.3003617310822525, 'batch_norm': True, 'lr': 0.0004051632493476405, 'weight_decay': 0.00016013277606016064, 'epochs': 192, 'loss': 'mae', 'optimizer': 'adam', 'graph_mode': 'off', 'use_snp_selection': False}. Best is trial 78 with value: 0.08363337388283676.
[I 2025-12-05 15:48:29,988] Trial 134 finished with value: 0.055606772729485936 and parameters: {'model_type': 'mlp', 'hidden_dims': '[256, 128, 64]', 'dropout': 0.2020797969584257, 'batch_norm': True, 'lr': 0.00026458895981332827, 'weight_decay': 5.220703368882798e-06, 'epochs': 206, 'loss': 'mae', 'optimizer': 'adam', 'graph_mode': 'off', 'use_snp_selection': False}. Best is trial 78 with value: 0.08363337388283676.
[I 2025-12-05 15:48:31,009] Trial 135 finished with value: 0.056021605399566195 and parameters: {'model_type': 'mlp', 'hidden_dims': '[256, 128]', 'dropout': 0.2711343414221408, 'batch_norm': True, 'lr': 0.0007946525113861569, 'weight_decay': 0.00010123429177156519, 'epochs': 170, 'loss': 'mae', 'optimizer': 'adam', 'graph_mode': 'off', 'use_snp_selection': False}. Best is trial 78 with value: 0.08363337388283676.
[I 2025-12-05 15:48:32,428] Trial 136 finished with value: 0.05745343847516122 and parameters: {'model_type': 'mlp', 'hidden_dims': '[512, 256]', 'dropout': 0.3070046982210176, 'batch_norm': True, 'lr': 0.00033017716764209445, 'weight_decay': 3.5425059131555395e-06, 'epochs': 175, 'loss': 'mae', 'optimizer': 'adam', 'graph_mode': 'off', 'use_snp_selection': False}. Best is trial 78 with value: 0.08363337388283676.
[I 2025-12-05 15:48:33,207] Trial 137 finished with value: 0.032528908151338826 and parameters: {'model_type': 'mlp', 'hidden_dims': '[128, 64]', 'dropout': 0.3296589384899573, 'batch_norm': True, 'lr': 0.00045525975793627766, 'weight_decay': 0.0002507043925104489, 'epochs': 106, 'loss': 'mse', 'optimizer': 'adam', 'graph_mode': 'off', 'use_snp_selection': False}. Best is trial 78 with value: 0.08363337388283676.
[I 2025-12-05 15:48:34,176] Trial 138 finished with value: 0.052186163941636686 and parameters: {'model_type': 'mlp', 'hidden_dims': '[256, 128]', 'dropout': 0.28657933568980903, 'batch_norm': True, 'lr': 0.0009931786330906695, 'weight_decay': 2.5692126017003774e-06, 'epochs': 159, 'loss': 'mae', 'optimizer': 'adam', 'graph_mode': 'off', 'use_snp_selection': False}. Best is trial 78 with value: 0.08363337388283676.
[I 2025-12-05 15:48:35,588] Trial 139 finished with value: 0.05938122312577766 and parameters: {'model_type': 'mlp', 'hidden_dims': '[512, 64]', 'dropout': 0.2780936734273507, 'batch_norm': True, 'lr': 0.0005586826208874639, 'weight_decay': 6.240346002070567e-05, 'epochs': 185, 'loss': 'mae', 'optimizer': 'adam', 'graph_mode': 'off', 'use_snp_selection': False}. Best is trial 78 with value: 0.08363337388283676.
[I 2025-12-05 15:48:37,060] Trial 140 finished with value: 0.07123403532577167 and parameters: {'model_type': 'mlp', 'hidden_dims': '[512, 256]', 'dropout': 0.2599341968414765, 'batch_norm': True, 'lr': 0.0006498347407927465, 'weight_decay': 8.915719514586843e-05, 'epochs': 198, 'loss': 'mae', 'optimizer': 'adam', 'graph_mode': 'off', 'use_snp_selection': False}. Best is trial 78 with value: 0.08363337388283676.
[I 2025-12-05 15:48:38,575] Trial 141 finished with value: 0.05240931879833873 and parameters: {'model_type': 'mlp', 'hidden_dims': '[512, 256]', 'dropout': 0.24263998573916853, 'batch_norm': True, 'lr': 0.0006106166145784244, 'weight_decay': 0.00010882781226830254, 'epochs': 213, 'loss': 'mae', 'optimizer': 'adam', 'graph_mode': 'off', 'use_snp_selection': False}. Best is trial 78 with value: 0.08363337388283676.
[I 2025-12-05 15:48:40,031] Trial 142 finished with value: 0.049454126629144286 and parameters: {'model_type': 'mlp', 'hidden_dims': '[512, 256]', 'dropout': 0.256892202963348, 'batch_norm': True, 'lr': 0.0008549849342274754, 'weight_decay': 7.59924862491378e-05, 'epochs': 197, 'loss': 'mae', 'optimizer': 'adam', 'graph_mode': 'off', 'use_snp_selection': False}. Best is trial 78 with value: 0.08363337388283676.
[I 2025-12-05 15:48:41,518] Trial 143 finished with value: 0.061599086387822494 and parameters: {'model_type': 'mlp', 'hidden_dims': '[512, 256]', 'dropout': 0.5256563097527279, 'batch_norm': True, 'lr': 0.0006688883785833843, 'weight_decay': 0.00013687724655258945, 'epochs': 205, 'loss': 'mae', 'optimizer': 'adam', 'graph_mode': 'off', 'use_snp_selection': False}. Best is trial 78 with value: 0.08363337388283676.
