[I 2025-12-06 02:25:42,585] Trial 127 finished with value: 0.23725866009088842 and parameters: {'model_type': 'mlp', 'hidden_dims': '[512, 64]', 'dropout': 0.4852879695391385, 'batch_norm': False, 'lr': 2.825563783560883e-06, 'weight_decay': 2.8044323076647004e-06, 'epochs': 310, 'loss': 'mae', 'optimizer': 'adam', 'graph_mode': 'off', 'use_snp_selection': False}. Best is trial 106 with value: 0.24926995518454506.
[I 2025-12-06 02:26:46,287] Trial 128 finished with value: 0.2248968756061746 and parameters: {'model_type': 'mlp', 'hidden_dims': '[256, 128, 64]', 'dropout': 0.2675750556319825, 'batch_norm': False, 'lr': 9.555657981945206e-06, 'weight_decay': 3.983642965135824e-06, 'epochs': 325, 'loss': 'mae', 'optimizer': 'adam', 'graph_mode': 'off', 'use_snp_selection': True, 'num_snps': 51726}. Best is trial 106 with value: 0.24926995518454506.
[I 2025-12-06 02:27:32,655] Trial 129 finished with value: 0.23901483990081496 and parameters: {'model_type': 'mlp', 'hidden_dims': '[512, 64]', 'dropout': 0.5166926395736375, 'batch_norm': False, 'lr': 1.2081249854072812e-05, 'weight_decay': 0.0006934380814286236, 'epochs': 193, 'loss': 'mae', 'optimizer': 'adam', 'graph_mode': 'off', 'use_snp_selection': False}. Best is trial 106 with value: 0.24926995518454506.
[I 2025-12-06 02:28:49,439] Trial 130 finished with value: 0.22021679101584918 and parameters: {'model_type': 'mlp', 'hidden_dims': '[512, 256]', 'dropout': 0.4996964360077519, 'batch_norm': False, 'lr': 4.059526129946736e-06, 'weight_decay': 7.828257677927439e-06, 'epochs': 335, 'loss': 'mse', 'optimizer': 'adam', 'graph_mode': 'off', 'use_snp_selection': False}. Best is trial 106 with value: 0.24926995518454506.
[I 2025-12-06 02:29:32,597] Trial 131 finished with value: 0.2420067852044971 and parameters: {'model_type': 'mlp', 'hidden_dims': '[256, 128, 64]', 'dropout': 0.5402986696518405, 'batch_norm': False, 'lr': 5.414399305374612e-06, 'weight_decay': 1.607384231826128e-05, 'epochs': 344, 'loss': 'mae', 'optimizer': 'adam', 'graph_mode': 'off', 'use_snp_selection': False}. Best is trial 106 with value: 0.24926995518454506.
[I 2025-12-06 02:30:14,073] Trial 132 finished with value: 0.23858544983641633 and parameters: {'model_type': 'mlp', 'hidden_dims': '[256, 128, 64]', 'dropout': 0.5567012090357811, 'batch_norm': False, 'lr': 4.726016310567512e-06, 'weight_decay': 9.340027314849606e-06, 'epochs': 329, 'loss': 'mae', 'optimizer': 'adam', 'graph_mode': 'off', 'use_snp_selection': False}. Best is trial 106 with value: 0.24926995518454506.
[I 2025-12-06 02:30:37,489] Trial 133 finished with value: 0.21468990937938348 and parameters: {'model_type': 'mlp', 'hidden_dims': '[256, 128, 64]', 'dropout': 0.58054165852432, 'batch_norm': False, 'lr': 6.0206962644278565e-06, 'weight_decay': 2.1606342519696033e-05, 'epochs': 165, 'loss': 'mae', 'optimizer': 'adam', 'graph_mode': 'off', 'use_snp_selection': False}. Best is trial 106 with value: 0.24926995518454506.
[I 2025-12-06 02:31:17,759] Trial 134 finished with value: 0.22137950848809557 and parameters: {'model_type': 'mlp', 'hidden_dims': '[256, 128, 64]', 'dropout': 0.5698856262786299, 'batch_norm': False, 'lr': 5.385964420778713e-06, 'weight_decay': 5.144283337816853e-06, 'epochs': 319, 'loss': 'mae', 'optimizer': 'adam', 'graph_mode': 'off', 'use_snp_selection': False}. Best is trial 106 with value: 0.24926995518454506.
[I 2025-12-06 02:31:56,509] Trial 135 finished with value: 0.23044974825194364 and parameters: {'model_type': 'mlp', 'hidden_dims': '[256, 128, 64]', 'dropout': 0.5472559353971732, 'batch_norm': False, 'lr': 3.3492220805705064e-06, 'weight_decay': 1.4440518789729094e-05, 'epochs': 304, 'loss': 'mae', 'optimizer': 'adam', 'graph_mode': 'off', 'use_snp_selection': False}. Best is trial 106 with value: 0.24926995518454506.
[I 2025-12-06 02:33:13,741] Trial 136 finished with value: 0.23422715516204548 and parameters: {'model_type': 'mlp', 'hidden_dims': '[512, 64]', 'dropout': 0.5985847802336416, 'batch_norm': False, 'lr': 2.5331079142502936e-06, 'weight_decay': 3.384184044427655e-05, 'epochs': 339, 'loss': 'mae', 'optimizer': 'adam', 'graph_mode': 'off', 'use_snp_selection': False}. Best is trial 106 with value: 0.24926995518454506.
[I 2025-12-06 02:33:56,600] Trial 137 finished with value: 0.21709652084716208 and parameters: {'model_type': 'mlp', 'hidden_dims': '[256, 128, 64]', 'dropout': 0.5894013285670998, 'batch_norm': False, 'lr': 7.483682641703454e-05, 'weight_decay': 1.2130916457960809e-05, 'epochs': 349, 'loss': 'mae', 'optimizer': 'adam', 'graph_mode': 'off', 'use_snp_selection': False}. Best is trial 106 with value: 0.24926995518454506.
[I 2025-12-06 02:34:11,754] Trial 138 finished with value: 0.22332212830756762 and parameters: {'model_type': 'mlp', 'hidden_dims': '[256, 128]', 'dropout': 0.5621318924619976, 'batch_norm': False, 'lr': 6.759473767701741e-06, 'weight_decay': 2.568272239576985e-05, 'epochs': 89, 'loss': 'mae', 'optimizer': 'adam', 'graph_mode': 'off', 'use_snp_selection': False}. Best is trial 106 with value: 0.24926995518454506.
[I 2025-12-06 02:35:28,018] Trial 139 finished with value: 0.2515845736457048 and parameters: {'model_type': 'mlp', 'hidden_dims': '[512, 128]', 'dropout': 0.4047398224912724, 'batch_norm': False, 'lr': 4.163605938597995e-06, 'weight_decay': 0.0002634150301810883, 'epochs': 333, 'loss': 'mae', 'optimizer': 'adam', 'graph_mode': 'off', 'use_snp_selection': False}. Best is trial 139 with value: 0.2515845736457048.
[I 2025-12-06 02:35:49,307] Trial 140 finished with value: 0.20185080450187107 and parameters: {'model_type': 'mlp', 'hidden_dims': '[128, 64]', 'dropout': 0.36260268790422706, 'batch_norm': True, 'lr': 3.023776967046727e-06, 'weight_decay': 4.6366618860923725e-05, 'epochs': 322, 'loss': 'mae', 'optimizer': 'adam', 'graph_mode': 'off', 'use_snp_selection': False}. Best is trial 139 with value: 0.2515845736457048.
[I 2025-12-06 02:37:05,534] Trial 141 finished with value: 0.24331494486757338 and parameters: {'model_type': 'mlp', 'hidden_dims': '[512, 128]', 'dropout': 0.4404163627368806, 'batch_norm': False, 'lr': 4.267329333307283e-06, 'weight_decay': 0.0002129752121042188, 'epochs': 333, 'loss': 'mae', 'optimizer': 'adam', 'graph_mode': 'off', 'use_snp_selection': False}. Best is trial 139 with value: 0.2515845736457048.
[I 2025-12-06 02:38:21,725] Trial 142 finished with value: 0.23926046485683033 and parameters: {'model_type': 'mlp', 'hidden_dims': '[512, 128]', 'dropout': 0.43204589281804967, 'batch_norm': False, 'lr': 4.131389107625848e-06, 'weight_decay': 0.00031421514054414816, 'epochs': 333, 'loss': 'mae', 'optimizer': 'adam', 'graph_mode': 'off', 'use_snp_selection': False}. Best is trial 139 with value: 0.2515845736457048.
[I 2025-12-06 02:39:36,137] Trial 143 finished with value: 0.23738069631696918 and parameters: {'model_type': 'mlp', 'hidden_dims': '[512, 128]', 'dropout': 0.4117326729433885, 'batch_norm': False, 'lr': 3.698935134133651e-06, 'weight_decay': 0.00022788118010642788, 'epochs': 325, 'loss': 'mae', 'optimizer': 'adam', 'graph_mode': 'off', 'use_snp_selection': False}. Best is trial 139 with value: 0.2515845736457048.
[I 2025-12-06 02:40:48,115] Trial 144 finished with value: 0.23530835419263188 and parameters: {'model_type': 'mlp', 'hidden_dims': '[512, 128]', 'dropout': 0.4039777687679226, 'batch_norm': False, 'lr': 4.744335668683683e-06, 'weight_decay': 0.00026421512991307345, 'epochs': 313, 'loss': 'mae', 'optimizer': 'adam', 'graph_mode': 'off', 'use_snp_selection': False}. Best is trial 139 with value: 0.2515845736457048.
[I 2025-12-06 02:42:04,284] Trial 145 finished with value: 0.23799869572311327 and parameters: {'model_type': 'mlp', 'hidden_dims': '[512, 128]', 'dropout': 0.4432837654904803, 'batch_norm': False, 'lr': 2.0897783363571214e-06, 'weight_decay': 0.0003918072610973692, 'epochs': 333, 'loss': 'mae', 'optimizer': 'adam', 'graph_mode': 'off', 'use_snp_selection': False}. Best is trial 139 with value: 0.2515845736457048.
[I 2025-12-06 02:43:19,314] Trial 146 finished with value: 0.23838501398078 and parameters: {'model_type': 'mlp', 'hidden_dims': '[512, 128]', 'dropout': 0.466032140132239, 'batch_norm': False, 'lr': 6.0564913117462215e-06, 'weight_decay': 0.00017067094066673392, 'epochs': 328, 'loss': 'mae', 'optimizer': 'adam', 'graph_mode': 'off', 'use_snp_selection': False}. Best is trial 139 with value: 0.2515845736457048.
[I 2025-12-06 02:44:36,775] Trial 147 finished with value: 0.23362643109855377 and parameters: {'model_type': 'mlp', 'hidden_dims': '[512, 128]', 'dropout': 0.45516491801266545, 'batch_norm': False, 'lr': 4.1983006490009625e-06, 'weight_decay': 0.00014195928408593074, 'epochs': 339, 'loss': 'mae', 'optimizer': 'adam', 'graph_mode': 'off', 'use_snp_selection': False}. Best is trial 139 with value: 0.2515845736457048.
[I 2025-12-06 02:45:49,627] Trial 148 finished with value: 0.24718664332545442 and parameters: {'model_type': 'mlp', 'hidden_dims': '[512, 128]', 'dropout': 0.4276776396006449, 'batch_norm': False, 'lr': 3.0559979787288817e-06, 'weight_decay': 0.00019686397040364525, 'epochs': 317, 'loss': 'mae', 'optimizer': 'adam', 'graph_mode': 'off', 'use_snp_selection': False}. Best is trial 139 with value: 0.2515845736457048.
[I 2025-12-06 02:46:49,238] Trial 149 finished with value: 0.21883761369685217 and parameters: {'model_type': 'mlp', 'hidden_dims': '[512, 128]', 'dropout': 0.4213681899895533, 'batch_norm': False, 'lr': 7.321125330625948e-06, 'weight_decay': 0.00020642142677579567, 'epochs': 308, 'loss': 'mae', 'optimizer': 'adam', 'graph_mode': 'off', 'use_snp_selection': True, 'num_snps': 29744}. Best is trial 139 with value: 0.2515845736457048.
[I 2025-12-06 02:47:56,749] Trial 0 finished with value: 0.10929358369549877 and parameters: {'model_type': 'mlp', 'hidden_dims': '[128, 64]', 'dropout': 0.199031432379812, 'batch_norm': True, 'lr': 1.8408544111075837e-06, 'weight_decay': 5.5136510071208614e-05, 'epochs': 336, 'loss': 'mae', 'optimizer': 'adam', 'graph_mode': 'off', 'use_snp_selection': True, 'num_snps': 43862}. Best is trial 0 with value: 0.10929358369549877.
[I 2025-12-06 02:48:35,760] Trial 1 finished with value: 0.2240545176178926 and parameters: {'model_type': 'mlp', 'hidden_dims': '[256, 128]', 'dropout': 0.4370668075331726, 'batch_norm': True, 'lr': 7.133471581159139e-05, 'weight_decay': 1.128633586803549e-05, 'epochs': 242, 'loss': 'mae', 'optimizer': 'adam', 'graph_mode': 'off', 'use_snp_selection': False}. Best is trial 1 with value: 0.2240545176178926.
[I 2025-12-06 02:49:11,403] Trial 2 finished with value: 0.2104783203967259 and parameters: {'model_type': 'mlp', 'hidden_dims': '[256, 128, 64]', 'dropout': 0.41314357415569625, 'batch_norm': False, 'lr': 3.952233718592101e-06, 'weight_decay': 0.00026754769258252603, 'epochs': 149, 'loss': 'mse', 'optimizer': 'adam', 'graph_mode': 'off', 'use_snp_selection': True, 'num_snps': 11571}. Best is trial 1 with value: 0.2240545176178926.
[I 2025-12-06 02:50:42,925] Trial 3 finished with value: 0.2459019411713216 and parameters: {'model_type': 'mlp', 'hidden_dims': '[512, 64]', 'dropout': 0.5938127374509361, 'batch_norm': False, 'lr': 5.67704586114731e-06, 'weight_decay': 2.4518087630137052e-05, 'epochs': 320, 'loss': 'mae', 'optimizer': 'adam', 'graph_mode': 'off', 'use_snp_selection': False}. Best is trial 3 with value: 0.2459019411713216.
[I 2025-12-06 02:52:05,738] Trial 4 finished with value: 0.13751854003848776 and parameters: {'model_type': 'mlp', 'hidden_dims': '[512, 128]', 'dropout': 0.25746343592134413, 'batch_norm': True, 'lr': 1.3467657668402788e-06, 'weight_decay': 0.00033087251918647806, 'epochs': 277, 'loss': 'mse', 'optimizer': 'adam', 'graph_mode': 'off', 'use_snp_selection': True, 'num_snps': 36675}. Best is trial 3 with value: 0.2459019411713216.
[I 2025-12-06 02:53:03,930] Trial 5 finished with value: 0.1336571483258334 and parameters: {'model_type': 'mlp', 'hidden_dims': '[512, 64]', 'dropout': 0.38275350994408375, 'batch_norm': True, 'lr': 1.5586664309232824e-06, 'weight_decay': 0.0008227664668621182, 'epochs': 145, 'loss': 'mae', 'optimizer': 'adam', 'graph_mode': 'off', 'use_snp_selection': True, 'num_snps': 32148}. Best is trial 3 with value: 0.2459019411713216.
[I 2025-12-06 02:53:36,271] Trial 6 finished with value: 0.21596823262114445 and parameters: {'model_type': 'mlp', 'hidden_dims': '[256, 128]', 'dropout': 0.3930109900265879, 'batch_norm': False, 'lr': 4.892964372128395e-05, 'weight_decay': 1.5809549317992182e-06, 'epochs': 199, 'loss': 'mse', 'optimizer': 'adam', 'graph_mode': 'off', 'use_snp_selection': False}. Best is trial 3 with value: 0.2459019411713216.
[I 2025-12-06 02:54:09,639] Trial 7 finished with value: 0.21354892671958153 and parameters: {'model_type': 'mlp', 'hidden_dims': '[512, 256]', 'dropout': 0.15343979219678458, 'batch_norm': True, 'lr': 6.234003099047341e-05, 'weight_decay': 3.894760610535477e-07, 'epochs': 97, 'loss': 'mse', 'optimizer': 'adam', 'graph_mode': 'off', 'use_snp_selection': False}. Best is trial 3 with value: 0.2459019411713216.
[I 2025-12-06 02:55:40,948] Trial 8 finished with value: 0.22614198601067598 and parameters: {'model_type': 'mlp', 'hidden_dims': '[512, 128]', 'dropout': 0.10743001231661406, 'batch_norm': True, 'lr': 0.00023728538449271062, 'weight_decay': 1.7629071578048637e-05, 'epochs': 312, 'loss': 'mae', 'optimizer': 'adam', 'graph_mode': 'off', 'use_snp_selection': False}. Best is trial 3 with value: 0.2459019411713216.
[I 2025-12-06 02:56:35,343] Trial 9 finished with value: 0.20940029351510409 and parameters: {'model_type': 'mlp', 'hidden_dims': '[512, 64]', 'dropout': 0.14505336736221927, 'batch_norm': True, 'lr': 5.8619638388111826e-05, 'weight_decay': 6.200156172669308e-07, 'epochs': 175, 'loss': 'mse', 'optimizer': 'adam', 'graph_mode': 'off', 'use_snp_selection': False}. Best is trial 3 with value: 0.2459019411713216.
[I 2025-12-06 02:56:57,235] Trial 10 finished with value: 0.22677336487273325 and parameters: {'model_type': 'mlp', 'hidden_dims': '[512, 64]', 'dropout': 0.5885461262002587, 'batch_norm': False, 'lr': 8.769366258768696e-06, 'weight_decay': 2.78273193871783e-06, 'epochs': 55, 'loss': 'mae', 'optimizer': 'adam', 'graph_mode': 'off', 'use_snp_selection': False}. Best is trial 3 with value: 0.2459019411713216.
[I 2025-12-06 02:57:24,838] Trial 11 finished with value: 0.2413920214791872 and parameters: {'model_type': 'mlp', 'hidden_dims': '[512, 64]', 'dropout': 0.583942291816117, 'batch_norm': False, 'lr': 1.1821335968986158e-05, 'weight_decay': 4.061640528568547e-06, 'epochs': 77, 'loss': 'mae', 'optimizer': 'adam', 'graph_mode': 'off', 'use_snp_selection': False}. Best is trial 3 with value: 0.2459019411713216.
[I 2025-12-06 02:57:42,767] Trial 12 finished with value: 0.20981719937747195 and parameters: {'model_type': 'mlp', 'hidden_dims': '[512, 64]', 'dropout': 0.593097749012682, 'batch_norm': False, 'lr': 1.2808693622626188e-05, 'weight_decay': 1.3081036432574914e-07, 'epochs': 40, 'loss': 'mae', 'optimizer': 'adam', 'graph_mode': 'off', 'use_snp_selection': False}. Best is trial 3 with value: 0.2459019411713216.
[I 2025-12-06 02:58:52,100] Trial 13 finished with value: 0.2258245165309273 and parameters: {'model_type': 'mlp', 'hidden_dims': '[512, 64]', 'dropout': 0.5043641748401543, 'batch_norm': False, 'lr': 1.3373175420781734e-05, 'weight_decay': 4.373608364627903e-05, 'epochs': 235, 'loss': 'mae', 'optimizer': 'adam', 'graph_mode': 'off', 'use_snp_selection': False}. Best is trial 3 with value: 0.2459019411713216.
[I 2025-12-06 02:59:04,383] Trial 14 finished with value: 0.20186468724611065 and parameters: {'model_type': 'mlp', 'hidden_dims': '[128, 64]', 'dropout': 0.5300180653494536, 'batch_norm': False, 'lr': 5.096356034191146e-06, 'weight_decay': 4.57067734295802e-06, 'epochs': 93, 'loss': 'mae', 'optimizer': 'adam', 'graph_mode': 'off', 'use_snp_selection': False}. Best is trial 3 with value: 0.2459019411713216.
[I 2025-12-06 03:00:25,461] Trial 15 finished with value: 0.22343070185553104 and parameters: {'model_type': 'mlp', 'hidden_dims': '[512, 256]', 'dropout': 0.29817671914947536, 'batch_norm': False, 'lr': 1.8411764708572348e-05, 'weight_decay': 4.4084956876871386e-05, 'epochs': 278, 'loss': 'mae', 'optimizer': 'adam', 'graph_mode': 'off', 'use_snp_selection': False}. Best is trial 3 with value: 0.2459019411713216.
[I 2025-12-06 03:01:17,936] Trial 16 finished with value: 0.23040641249275154 and parameters: {'model_type': 'mlp', 'hidden_dims': '[256, 128, 64]', 'dropout': 0.4992385332513618, 'batch_norm': False, 'lr': 0.00017549215405955411, 'weight_decay': 6.80662468241148e-06, 'epochs': 350, 'loss': 'mae', 'optimizer': 'adam', 'graph_mode': 'off', 'use_snp_selection': False}. Best is trial 3 with value: 0.2459019411713216.
[I 2025-12-06 03:01:54,550] Trial 17 finished with value: 0.04982860870105001 and parameters: {'model_type': 'mlp', 'hidden_dims': '[512, 64]', 'dropout': 0.543474321376226, 'batch_norm': False, 'lr': 0.000906375209920231, 'weight_decay': 1.3398043894594233e-06, 'epochs': 113, 'loss': 'mae', 'optimizer': 'adam', 'graph_mode': 'off', 'use_snp_selection': False}. Best is trial 3 with value: 0.2459019411713216.
[I 2025-12-06 03:03:33,089] Trial 18 finished with value: 0.24516539771815443 and parameters: {'model_type': 'mlp', 'hidden_dims': '[512, 64]', 'dropout': 0.4928065509878574, 'batch_norm': False, 'lr': 3.4071412855829388e-06, 'weight_decay': 0.00012275232383599145, 'epochs': 214, 'loss': 'mae', 'optimizer': 'adam', 'graph_mode': 'off', 'use_snp_selection': True, 'num_snps': 58241}. Best is trial 3 with value: 0.2459019411713216.
[I 2025-12-06 03:05:10,341] Trial 19 finished with value: 0.2363171365528552 and parameters: {'model_type': 'mlp', 'hidden_dims': '[512, 64]', 'dropout': 0.47355279224247543, 'batch_norm': False, 'lr': 3.558104577254903e-06, 'weight_decay': 0.00015299712892081902, 'epochs': 220, 'loss': 'mae', 'optimizer': 'adam', 'graph_mode': 'off', 'use_snp_selection': True, 'num_snps': 55667}. Best is trial 3 with value: 0.2459019411713216.
[I 2025-12-06 03:07:04,051] Trial 20 finished with value: 0.23718083120644656 and parameters: {'model_type': 'mlp', 'hidden_dims': '[512, 256]', 'dropout': 0.34258156279977026, 'batch_norm': False, 'lr': 2.6947108542472294e-06, 'weight_decay': 0.00010232480909485412, 'epochs': 279, 'loss': 'mae', 'optimizer': 'adam', 'graph_mode': 'off', 'use_snp_selection': True, 'num_snps': 57703}. Best is trial 3 with value: 0.2459019411713216.
[I 2025-12-06 03:07:44,239] Trial 21 finished with value: 0.22461542504406337 and parameters: {'model_type': 'mlp', 'hidden_dims': '[512, 64]', 'dropout': 0.5675598050602048, 'batch_norm': False, 'lr': 6.248757014625871e-06, 'weight_decay': 1.450589416243313e-05, 'epochs': 172, 'loss': 'mae', 'optimizer': 'adam', 'graph_mode': 'off', 'use_snp_selection': True, 'num_snps': 11878}. Best is trial 3 with value: 0.2459019411713216.
[I 2025-12-06 03:08:42,673] Trial 22 finished with value: 0.2344328933972347 and parameters: {'model_type': 'mlp', 'hidden_dims': '[512, 64]', 'dropout': 0.4606876289530824, 'batch_norm': False, 'lr': 2.4880512057502122e-05, 'weight_decay': 2.4785559696414236e-05, 'epochs': 256, 'loss': 'mae', 'optimizer': 'adam', 'graph_mode': 'off', 'use_snp_selection': True, 'num_snps': 22259}. Best is trial 3 with value: 0.2459019411713216.
[I 2025-12-06 03:10:27,093] Trial 23 finished with value: 0.23139329131228462 and parameters: {'model_type': 'mlp', 'hidden_dims': '[512, 64]', 'dropout': 0.5457724774320233, 'batch_norm': False, 'lr': 7.915460348091433e-06, 'weight_decay': 0.00010276601326600159, 'epochs': 312, 'loss': 'mae', 'optimizer': 'adam', 'graph_mode': 'off', 'use_snp_selection': True, 'num_snps': 46925}. Best is trial 3 with value: 0.2459019411713216.
[I 2025-12-06 03:10:52,873] Trial 24 finished with value: 0.11302973829378031 and parameters: {'model_type': 'mlp', 'hidden_dims': '[512, 64]', 'dropout': 0.5997927039447736, 'batch_norm': False, 'lr': 1.0354612266445716e-06, 'weight_decay': 0.0008031371434368762, 'epochs': 70, 'loss': 'mae', 'optimizer': 'adam', 'graph_mode': 'off', 'use_snp_selection': False}. Best is trial 3 with value: 0.2459019411713216.
[I 2025-12-06 03:11:26,791] Trial 25 finished with value: 0.2478799228636881 and parameters: {'model_type': 'mlp', 'hidden_dims': '[256, 128]', 'dropout': 0.5082623722482305, 'batch_norm': False, 'lr': 2.4627973878640514e-06, 'weight_decay': 5.289956541757451e-06, 'epochs': 205, 'loss': 'mae', 'optimizer': 'adam', 'graph_mode': 'off', 'use_snp_selection': False}. Best is trial 25 with value: 0.2478799228636881.
[I 2025-12-06 03:11:57,284] Trial 26 finished with value: 0.10895592351568366 and parameters: {'model_type': 'mlp', 'hidden_dims': '[256, 128]', 'dropout': 0.5021320494797137, 'batch_norm': False, 'lr': 2.3542875091213717e-06, 'weight_decay': 7.73255286188211e-06, 'epochs': 211, 'loss': 'mse', 'optimizer': 'adam', 'graph_mode': 'off', 'use_snp_selection': True, 'num_snps': 2344}. Best is trial 25 with value: 0.2478799228636881.
[I 2025-12-06 03:12:28,262] Trial 27 finished with value: 0.23965322458197588 and parameters: {'model_type': 'mlp', 'hidden_dims': '[256, 128]', 'dropout': 0.46354598096857513, 'batch_norm': False, 'lr': 3.29507341211539e-06, 'weight_decay': 0.0002644974670841985, 'epochs': 185, 'loss': 'mae', 'optimizer': 'adam', 'graph_mode': 'off', 'use_snp_selection': False}. Best is trial 25 with value: 0.2478799228636881.
[I 2025-12-06 03:13:26,633] Trial 28 finished with value: 0.22184228502766112 and parameters: {'model_type': 'mlp', 'hidden_dims': '[256, 128]', 'dropout': 0.5368392599721372, 'batch_norm': False, 'lr': 5.058441166629785e-06, 'weight_decay': 2.433520982535958e-05, 'epochs': 140, 'loss': 'mae', 'optimizer': 'adam', 'graph_mode': 'off', 'use_snp_selection': True, 'num_snps': 48700}. Best is trial 25 with value: 0.2478799228636881.
