[I 2025-12-05 14:23:59,176] Trial 104 finished with value: 0.11380609285476823 and parameters: {'model_type': 'mlp', 'hidden_dims': '[512, 64]', 'dropout': 0.5498921606523238, 'batch_norm': True, 'lr': 0.000664103982332245, 'weight_decay': 7.954017556975866e-06, 'epochs': 55, 'loss': 'mse', 'optimizer': 'adam', 'graph_mode': 'off', 'use_snp_selection': False}. Best is trial 101 with value: 0.1348562663387269.
[I 2025-12-05 14:24:00,152] Trial 105 finished with value: 0.06698648142611924 and parameters: {'model_type': 'mlp', 'hidden_dims': '[512, 64]', 'dropout': 0.4564365067192339, 'batch_norm': True, 'lr': 1.3355851180271997e-05, 'weight_decay': 1.402050439843422e-05, 'epochs': 82, 'loss': 'mse', 'optimizer': 'adam', 'graph_mode': 'off', 'use_snp_selection': False}. Best is trial 101 with value: 0.1348562663387269.
[I 2025-12-05 14:24:01,493] Trial 106 finished with value: 0.09979060183907656 and parameters: {'model_type': 'mlp', 'hidden_dims': '[512, 64]', 'dropout': 0.4316965671628257, 'batch_norm': True, 'lr': 0.0008244614597171041, 'weight_decay': 1.0977323258110685e-05, 'epochs': 204, 'loss': 'mse', 'optimizer': 'adam', 'graph_mode': 'off', 'use_snp_selection': False}. Best is trial 101 with value: 0.1348562663387269.
[I 2025-12-05 14:24:02,213] Trial 107 finished with value: 0.11730837585757031 and parameters: {'model_type': 'mlp', 'hidden_dims': '[256, 128]', 'dropout': 0.49154279673328216, 'batch_norm': True, 'lr': 0.0003733774159913721, 'weight_decay': 2.1202783313286638e-05, 'epochs': 66, 'loss': 'mse', 'optimizer': 'adam', 'graph_mode': 'off', 'use_snp_selection': False}. Best is trial 101 with value: 0.1348562663387269.
[I 2025-12-05 14:24:03,378] Trial 108 finished with value: 0.09962277622643766 and parameters: {'model_type': 'mlp', 'hidden_dims': '[512, 64]', 'dropout': 0.5014245488596973, 'batch_norm': True, 'lr': 0.000568131257020948, 'weight_decay': 1.888776462998231e-06, 'epochs': 191, 'loss': 'mse', 'optimizer': 'adam', 'graph_mode': 'off', 'use_snp_selection': True, 'num_snps': 11322}. Best is trial 101 with value: 0.1348562663387269.
[I 2025-12-05 14:24:04,062] Trial 109 finished with value: 0.12334601228204727 and parameters: {'model_type': 'mlp', 'hidden_dims': '[128, 64]', 'dropout': 0.18720289851857125, 'batch_norm': True, 'lr': 0.0004735087336977666, 'weight_decay': 9.307548372582819e-06, 'epochs': 71, 'loss': 'mse', 'optimizer': 'adam', 'graph_mode': 'off', 'use_snp_selection': False}. Best is trial 101 with value: 0.1348562663387269.
[I 2025-12-05 14:24:04,712] Trial 110 finished with value: 0.1232430636223853 and parameters: {'model_type': 'mlp', 'hidden_dims': '[128, 64]', 'dropout': 0.5284558552169554, 'batch_norm': True, 'lr': 0.0006544843650998859, 'weight_decay': 1.026350963716174e-05, 'epochs': 72, 'loss': 'mse', 'optimizer': 'adam', 'graph_mode': 'off', 'use_snp_selection': False}. Best is trial 101 with value: 0.1348562663387269.
[I 2025-12-05 14:24:05,392] Trial 111 finished with value: 0.1084489959017204 and parameters: {'model_type': 'mlp', 'hidden_dims': '[128, 64]', 'dropout': 0.20688354837403045, 'batch_norm': True, 'lr': 0.0006472643299978879, 'weight_decay': 1.7528475999106873e-05, 'epochs': 75, 'loss': 'mse', 'optimizer': 'adam', 'graph_mode': 'off', 'use_snp_selection': False}. Best is trial 101 with value: 0.1348562663387269.
[I 2025-12-05 14:24:06,039] Trial 112 finished with value: 0.11735268941207466 and parameters: {'model_type': 'mlp', 'hidden_dims': '[128, 64]', 'dropout': 0.5260644691209988, 'batch_norm': True, 'lr': 0.0007867196032299005, 'weight_decay': 6.434919225004272e-06, 'epochs': 47, 'loss': 'mse', 'optimizer': 'adam', 'graph_mode': 'off', 'use_snp_selection': False}. Best is trial 101 with value: 0.1348562663387269.
[I 2025-12-05 14:24:06,740] Trial 113 finished with value: 0.105567501565216 and parameters: {'model_type': 'mlp', 'hidden_dims': '[128, 64]', 'dropout': 0.5367861868146835, 'batch_norm': True, 'lr': 0.0004863723018231115, 'weight_decay': 1.012241201616069e-05, 'epochs': 87, 'loss': 'mse', 'optimizer': 'adam', 'graph_mode': 'off', 'use_snp_selection': False}. Best is trial 101 with value: 0.1348562663387269.
[I 2025-12-05 14:24:07,400] Trial 114 finished with value: 0.11495851759154457 and parameters: {'model_type': 'mlp', 'hidden_dims': '[128, 64]', 'dropout': 0.18939599143801575, 'batch_norm': True, 'lr': 0.000396445474092967, 'weight_decay': 8.06747088725984e-06, 'epochs': 61, 'loss': 'mse', 'optimizer': 'adam', 'graph_mode': 'off', 'use_snp_selection': False}. Best is trial 101 with value: 0.1348562663387269.
[I 2025-12-05 14:24:08,068] Trial 115 finished with value: 0.10012536951580187 and parameters: {'model_type': 'mlp', 'hidden_dims': '[128, 64]', 'dropout': 0.5052876285194883, 'batch_norm': True, 'lr': 0.0005992825768919737, 'weight_decay': 2.97976317711079e-07, 'epochs': 70, 'loss': 'mse', 'optimizer': 'adam', 'graph_mode': 'off', 'use_snp_selection': False}. Best is trial 101 with value: 0.1348562663387269.
[I 2025-12-05 14:24:08,679] Trial 116 finished with value: 0.11620265828329505 and parameters: {'model_type': 'mlp', 'hidden_dims': '[128, 64]', 'dropout': 0.22152603730713397, 'batch_norm': True, 'lr': 0.00033844009523062413, 'weight_decay': 4.608912460103555e-06, 'epochs': 52, 'loss': 'mse', 'optimizer': 'adam', 'graph_mode': 'off', 'use_snp_selection': False}. Best is trial 101 with value: 0.1348562663387269.
[I 2025-12-05 14:24:09,325] Trial 117 finished with value: 0.12563892091209203 and parameters: {'model_type': 'mlp', 'hidden_dims': '[128, 64]', 'dropout': 0.17515427769169528, 'batch_norm': True, 'lr': 0.0007543000673831245, 'weight_decay': 9.447468738253356e-06, 'epochs': 45, 'loss': 'mse', 'optimizer': 'adam', 'graph_mode': 'off', 'use_snp_selection': False}. Best is trial 101 with value: 0.1348562663387269.
[I 2025-12-05 14:24:09,992] Trial 118 finished with value: 0.10496844463374568 and parameters: {'model_type': 'mlp', 'hidden_dims': '[128, 64]', 'dropout': 0.17185561111903763, 'batch_norm': True, 'lr': 0.0007006180428734903, 'weight_decay': 9.211653796484015e-06, 'epochs': 58, 'loss': 'mse', 'optimizer': 'adam', 'graph_mode': 'off', 'use_snp_selection': False}. Best is trial 101 with value: 0.1348562663387269.
[I 2025-12-05 14:24:10,896] Trial 119 finished with value: 0.08890589869381965 and parameters: {'model_type': 'mlp', 'hidden_dims': '[128, 64]', 'dropout': 0.5990127129355303, 'batch_norm': True, 'lr': 0.0005045212197101973, 'weight_decay': 1.1764464709915596e-05, 'epochs': 222, 'loss': 'mse', 'optimizer': 'adam', 'graph_mode': 'off', 'use_snp_selection': False}. Best is trial 101 with value: 0.1348562663387269.
[I 2025-12-05 14:24:11,735] Trial 120 finished with value: 0.05805095288808271 and parameters: {'model_type': 'mlp', 'hidden_dims': '[128, 64]', 'dropout': 0.5405346260760924, 'batch_norm': False, 'lr': 0.00027559140596125013, 'weight_decay': 3.5817739751853265e-06, 'epochs': 235, 'loss': 'mae', 'optimizer': 'adam', 'graph_mode': 'off', 'use_snp_selection': False}. Best is trial 101 with value: 0.1348562663387269.
[I 2025-12-05 14:24:12,328] Trial 121 finished with value: 0.10436711991360742 and parameters: {'model_type': 'mlp', 'hidden_dims': '[128, 64]', 'dropout': 0.17875799472475878, 'batch_norm': True, 'lr': 0.0008093213728925827, 'weight_decay': 4.634854192169198e-07, 'epochs': 44, 'loss': 'mse', 'optimizer': 'adam', 'graph_mode': 'off', 'use_snp_selection': False}. Best is trial 101 with value: 0.1348562663387269.
[I 2025-12-05 14:24:12,995] Trial 122 finished with value: 0.10382706541161545 and parameters: {'model_type': 'mlp', 'hidden_dims': '[128, 64]', 'dropout': 0.16025488245152075, 'batch_norm': True, 'lr': 0.000580142654743423, 'weight_decay': 2.9079268329240586e-05, 'epochs': 65, 'loss': 'mse', 'optimizer': 'adam', 'graph_mode': 'off', 'use_snp_selection': False}. Best is trial 101 with value: 0.1348562663387269.
[I 2025-12-05 14:24:13,790] Trial 123 finished with value: 0.12184056457245925 and parameters: {'model_type': 'mlp', 'hidden_dims': '[256, 128, 64]', 'dropout': 0.20372467664761507, 'batch_norm': True, 'lr': 0.0004165389214175758, 'weight_decay': 4.6152847220930565e-05, 'epochs': 79, 'loss': 'mse', 'optimizer': 'adam', 'graph_mode': 'off', 'use_snp_selection': False}. Best is trial 101 with value: 0.1348562663387269.
[I 2025-12-05 14:24:14,573] Trial 124 finished with value: 0.10980215045836911 and parameters: {'model_type': 'mlp', 'hidden_dims': '[256, 128, 64]', 'dropout': 0.20629699483928418, 'batch_norm': True, 'lr': 0.00041922112917573424, 'weight_decay': 5.953047955335168e-06, 'epochs': 83, 'loss': 'mse', 'optimizer': 'adam', 'graph_mode': 'off', 'use_snp_selection': False}. Best is trial 101 with value: 0.1348562663387269.
[I 2025-12-05 14:24:15,331] Trial 125 finished with value: 0.11329662407821711 and parameters: {'model_type': 'mlp', 'hidden_dims': '[256, 128, 64]', 'dropout': 0.1920086478522194, 'batch_norm': True, 'lr': 0.00032524671666964703, 'weight_decay': 4.7044076889337927e-05, 'epochs': 69, 'loss': 'mse', 'optimizer': 'adam', 'graph_mode': 'off', 'use_snp_selection': False}. Best is trial 101 with value: 0.1348562663387269.
[I 2025-12-05 14:24:16,126] Trial 126 finished with value: 0.11925244472124202 and parameters: {'model_type': 'mlp', 'hidden_dims': '[256, 128, 64]', 'dropout': 0.24027109834004728, 'batch_norm': True, 'lr': 0.0004399353923202535, 'weight_decay': 1.2733270660289296e-05, 'epochs': 105, 'loss': 'mse', 'optimizer': 'adam', 'graph_mode': 'off', 'use_snp_selection': False}. Best is trial 101 with value: 0.1348562663387269.
[I 2025-12-05 14:24:16,898] Trial 127 finished with value: 0.11378905233769111 and parameters: {'model_type': 'mlp', 'hidden_dims': '[256, 128, 64]', 'dropout': 0.21357257779475394, 'batch_norm': True, 'lr': 0.0005117344194642205, 'weight_decay': 1.4063960747724258e-06, 'epochs': 77, 'loss': 'mse', 'optimizer': 'adam', 'graph_mode': 'off', 'use_snp_selection': False}. Best is trial 101 with value: 0.1348562663387269.
[I 2025-12-05 14:24:17,706] Trial 128 finished with value: 0.11812777682537619 and parameters: {'model_type': 'mlp', 'hidden_dims': '[256, 128, 64]', 'dropout': 0.36083097348393217, 'batch_norm': True, 'lr': 0.0003754975696093501, 'weight_decay': 9.694771104248414e-06, 'epochs': 91, 'loss': 'mse', 'optimizer': 'adam', 'graph_mode': 'off', 'use_snp_selection': False}. Best is trial 101 with value: 0.1348562663387269.
[I 2025-12-05 14:24:19,887] Trial 129 finished with value: 0.045163745360075884 and parameters: {'model_type': 'mlp', 'hidden_dims': '[128, 64]', 'dropout': 0.41380078923370045, 'batch_norm': True, 'lr': 3.6532342421764644e-05, 'weight_decay': 2.6086761372932024e-06, 'epochs': 53, 'loss': 'mse', 'optimizer': 'adam', 'graph_mode': 'off', 'use_snp_selection': True, 'num_snps': 51837}. Best is trial 101 with value: 0.1348562663387269.
[I 2025-12-05 14:24:20,850] Trial 130 finished with value: 0.11367028225257068 and parameters: {'model_type': 'mlp', 'hidden_dims': '[512, 128]', 'dropout': 0.26664473988662285, 'batch_norm': True, 'lr': 0.00019051429448522535, 'weight_decay': 2.265001716690674e-05, 'epochs': 61, 'loss': 'mse', 'optimizer': 'adam', 'graph_mode': 'off', 'use_snp_selection': False}. Best is trial 101 with value: 0.1348562663387269.
[I 2025-12-05 14:24:21,554] Trial 131 finished with value: 0.1224518539659979 and parameters: {'model_type': 'mlp', 'hidden_dims': '[256, 128]', 'dropout': 0.13230981180065454, 'batch_norm': True, 'lr': 0.0008799685556894819, 'weight_decay': 7.358386274964019e-05, 'epochs': 43, 'loss': 'mse', 'optimizer': 'adam', 'graph_mode': 'off', 'use_snp_selection': False}. Best is trial 101 with value: 0.1348562663387269.
[I 2025-12-05 14:24:22,268] Trial 132 finished with value: 0.11087113448086089 and parameters: {'model_type': 'mlp', 'hidden_dims': '[256, 128]', 'dropout': 0.1385971912717112, 'batch_norm': True, 'lr': 0.0006612692603332241, 'weight_decay': 3.616958169616131e-05, 'epochs': 45, 'loss': 'mse', 'optimizer': 'adam', 'graph_mode': 'off', 'use_snp_selection': False}. Best is trial 101 with value: 0.1348562663387269.
[I 2025-12-05 14:24:22,982] Trial 133 finished with value: 0.10372217938915916 and parameters: {'model_type': 'mlp', 'hidden_dims': '[256, 128]', 'dropout': 0.15150164005204014, 'batch_norm': True, 'lr': 0.0007814130737147015, 'weight_decay': 8.749369358860407e-05, 'epochs': 57, 'loss': 'mse', 'optimizer': 'adam', 'graph_mode': 'off', 'use_snp_selection': False}. Best is trial 101 with value: 0.1348562663387269.
[I 2025-12-05 14:24:23,717] Trial 134 finished with value: 0.09460135265493552 and parameters: {'model_type': 'mlp', 'hidden_dims': '[256, 128]', 'dropout': 0.4728017106503412, 'batch_norm': True, 'lr': 0.00023437663500035092, 'weight_decay': 0.00011752660235479175, 'epochs': 74, 'loss': 'mse', 'optimizer': 'adam', 'graph_mode': 'off', 'use_snp_selection': False}. Best is trial 101 with value: 0.1348562663387269.
[I 2025-12-05 14:24:24,369] Trial 135 finished with value: 0.11225937280196274 and parameters: {'model_type': 'mlp', 'hidden_dims': '[256, 128]', 'dropout': 0.17355263827076295, 'batch_norm': True, 'lr': 0.0008879639809429518, 'weight_decay': 9.548976039322373e-07, 'epochs': 40, 'loss': 'mse', 'optimizer': 'adam', 'graph_mode': 'off', 'use_snp_selection': False}. Best is trial 101 with value: 0.1348562663387269.
[I 2025-12-05 14:24:25,215] Trial 136 finished with value: 0.11066698443074387 and parameters: {'model_type': 'mlp', 'hidden_dims': '[512, 256]', 'dropout': 0.4887688383476891, 'batch_norm': True, 'lr': 0.0005746803611082826, 'weight_decay': 7.450954187657985e-05, 'epochs': 50, 'loss': 'mse', 'optimizer': 'adam', 'graph_mode': 'off', 'use_snp_selection': False}. Best is trial 101 with value: 0.1348562663387269.
[I 2025-12-05 14:24:25,938] Trial 137 finished with value: 0.10734513778098204 and parameters: {'model_type': 'mlp', 'hidden_dims': '[256, 128]', 'dropout': 0.1866702457387495, 'batch_norm': True, 'lr': 0.00046619530127025915, 'weight_decay': 1.83549327735978e-05, 'epochs': 66, 'loss': 'mse', 'optimizer': 'adam', 'graph_mode': 'off', 'use_snp_selection': False}. Best is trial 101 with value: 0.1348562663387269.
[I 2025-12-05 14:24:27,087] Trial 138 finished with value: 0.11562928212326644 and parameters: {'model_type': 'mlp', 'hidden_dims': '[256, 128, 64]', 'dropout': 0.15084080584704768, 'batch_norm': True, 'lr': 0.0007159117281631759, 'weight_decay': 0.00015089511962935217, 'epochs': 288, 'loss': 'mse', 'optimizer': 'adam', 'graph_mode': 'off', 'use_snp_selection': False}. Best is trial 101 with value: 0.1348562663387269.
[I 2025-12-05 14:24:27,878] Trial 139 finished with value: 0.028885582412320032 and parameters: {'model_type': 'mlp', 'hidden_dims': '[128, 64]', 'dropout': 0.20003336158338486, 'batch_norm': True, 'lr': 2.6083195930297744e-06, 'weight_decay': 4.3215462178358375e-05, 'epochs': 177, 'loss': 'mse', 'optimizer': 'adam', 'graph_mode': 'off', 'use_snp_selection': False}. Best is trial 101 with value: 0.1348562663387269.
[I 2025-12-05 14:24:29,409] Trial 140 finished with value: 0.06237906936237493 and parameters: {'model_type': 'mlp', 'hidden_dims': '[512, 64]', 'dropout': 0.2292851098810232, 'batch_norm': False, 'lr': 0.000989039977975266, 'weight_decay': 6.315704449837464e-05, 'epochs': 272, 'loss': 'mae', 'optimizer': 'adam', 'graph_mode': 'off', 'use_snp_selection': False}. Best is trial 101 with value: 0.1348562663387269.
[I 2025-12-05 14:24:30,271] Trial 141 finished with value: 0.11001629138244803 and parameters: {'model_type': 'mlp', 'hidden_dims': '[512, 64]', 'dropout': 0.13214632040881946, 'batch_norm': True, 'lr': 0.0008459837881680275, 'weight_decay': 3.0665282110008516e-05, 'epochs': 55, 'loss': 'mse', 'optimizer': 'adam', 'graph_mode': 'off', 'use_snp_selection': False}. Best is trial 101 with value: 0.1348562663387269.
[I 2025-12-05 14:24:31,097] Trial 142 finished with value: 0.10634092961069336 and parameters: {'model_type': 'mlp', 'hidden_dims': '[512, 64]', 'dropout': 0.12370922256816631, 'batch_norm': True, 'lr': 0.0006346573483308114, 'weight_decay': 5.110572206276036e-05, 'epochs': 47, 'loss': 'mse', 'optimizer': 'adam', 'graph_mode': 'off', 'use_snp_selection': False}. Best is trial 101 with value: 0.1348562663387269.
[I 2025-12-05 14:24:31,906] Trial 143 finished with value: 0.10452444236977074 and parameters: {'model_type': 'mlp', 'hidden_dims': '[512, 64]', 'dropout': 0.12183529188446215, 'batch_norm': True, 'lr': 0.0007010182062089854, 'weight_decay': 6.0217499670661214e-05, 'epochs': 42, 'loss': 'mse', 'optimizer': 'adam', 'graph_mode': 'off', 'use_snp_selection': False}. Best is trial 101 with value: 0.1348562663387269.
[I 2025-12-05 14:24:32,771] Trial 144 finished with value: 0.11302220974369274 and parameters: {'model_type': 'mlp', 'hidden_dims': '[512, 64]', 'dropout': 0.16565921214121185, 'batch_norm': True, 'lr': 0.0005319514224065409, 'weight_decay': 1.9262000637290605e-07, 'epochs': 60, 'loss': 'mse', 'optimizer': 'adam', 'graph_mode': 'off', 'use_snp_selection': False}. Best is trial 101 with value: 0.1348562663387269.
[I 2025-12-05 14:24:33,703] Trial 145 finished with value: 0.117207852048582 and parameters: {'model_type': 'mlp', 'hidden_dims': '[512, 64]', 'dropout': 0.15479011690909683, 'batch_norm': True, 'lr': 0.0004023379844705935, 'weight_decay': 1.489864223592751e-05, 'epochs': 79, 'loss': 'mse', 'optimizer': 'adam', 'graph_mode': 'off', 'use_snp_selection': False}. Best is trial 101 with value: 0.1348562663387269.
[I 2025-12-05 14:24:34,793] Trial 146 finished with value: 0.1193522600973837 and parameters: {'model_type': 'mlp', 'hidden_dims': '[256, 128, 64]', 'dropout': 0.3098393690806732, 'batch_norm': True, 'lr': 0.0008819909834170544, 'weight_decay': 0.00020816632803982027, 'epochs': 255, 'loss': 'mse', 'optimizer': 'adam', 'graph_mode': 'off', 'use_snp_selection': False}. Best is trial 101 with value: 0.1348562663387269.
[I 2025-12-05 14:24:35,462] Trial 147 finished with value: 0.11488737262780663 and parameters: {'model_type': 'mlp', 'hidden_dims': '[256, 128]', 'dropout': 0.13615058376399072, 'batch_norm': True, 'lr': 0.0009930760457806426, 'weight_decay': 7.49687965448495e-06, 'epochs': 52, 'loss': 'mse', 'optimizer': 'adam', 'graph_mode': 'off', 'use_snp_selection': False}. Best is trial 101 with value: 0.1348562663387269.
[I 2025-12-05 14:24:36,345] Trial 148 finished with value: 0.1189405238849297 and parameters: {'model_type': 'mlp', 'hidden_dims': '[512, 64]', 'dropout': 0.10971849622881223, 'batch_norm': True, 'lr': 0.0007506719844287478, 'weight_decay': 2.6396788975482883e-05, 'epochs': 65, 'loss': 'mse', 'optimizer': 'adam', 'graph_mode': 'off', 'use_snp_selection': False}. Best is trial 101 with value: 0.1348562663387269.
[I 2025-12-05 14:24:37,319] Trial 149 finished with value: 0.11432214223488943 and parameters: {'model_type': 'mlp', 'hidden_dims': '[128, 64]', 'dropout': 0.5736189192348293, 'batch_norm': True, 'lr': 0.0002981555661417336, 'weight_decay': 0.00010757438145755739, 'epochs': 306, 'loss': 'mse', 'optimizer': 'adam', 'graph_mode': 'off', 'use_snp_selection': False}. Best is trial 101 with value: 0.1348562663387269.
[I 2025-12-05 14:24:39,688] Trial 0 finished with value: 0.02263191047105725 and parameters: {'model_type': 'mlp', 'hidden_dims': '[128, 64]', 'dropout': 0.199031432379812, 'batch_norm': True, 'lr': 1.8408544111075837e-06, 'weight_decay': 5.5136510071208614e-05, 'epochs': 336, 'loss': 'mae', 'optimizer': 'adam', 'graph_mode': 'off', 'use_snp_selection': True, 'num_snps': 43862}. Best is trial 0 with value: 0.02263191047105725.
[I 2025-12-05 14:24:40,899] Trial 1 finished with value: 0.05767141637831678 and parameters: {'model_type': 'mlp', 'hidden_dims': '[256, 128]', 'dropout': 0.4370668075331726, 'batch_norm': True, 'lr': 7.133471581159139e-05, 'weight_decay': 1.128633586803549e-05, 'epochs': 242, 'loss': 'mae', 'optimizer': 'adam', 'graph_mode': 'off', 'use_snp_selection': False}. Best is trial 1 with value: 0.05767141637831678.
[I 2025-12-05 14:24:42,028] Trial 2 finished with value: 0.08225658756223755 and parameters: {'model_type': 'mlp', 'hidden_dims': '[256, 128, 64]', 'dropout': 0.41314357415569625, 'batch_norm': False, 'lr': 3.952233718592101e-06, 'weight_decay': 0.00026754769258252603, 'epochs': 149, 'loss': 'mse', 'optimizer': 'adam', 'graph_mode': 'off', 'use_snp_selection': True, 'num_snps': 11571}. Best is trial 2 with value: 0.08225658756223755.
[I 2025-12-05 14:24:44,545] Trial 3 finished with value: 0.03021330691440185 and parameters: {'model_type': 'mlp', 'hidden_dims': '[512, 64]', 'dropout': 0.5938127374509361, 'batch_norm': False, 'lr': 5.67704586114731e-06, 'weight_decay': 2.4518087630137052e-05, 'epochs': 320, 'loss': 'mae', 'optimizer': 'adam', 'graph_mode': 'off', 'use_snp_selection': False}. Best is trial 2 with value: 0.08225658756223755.
[I 2025-12-05 14:24:47,037] Trial 4 finished with value: 0.021529069203857904 and parameters: {'model_type': 'mlp', 'hidden_dims': '[512, 128]', 'dropout': 0.25746343592134413, 'batch_norm': True, 'lr': 1.3467657668402788e-06, 'weight_decay': 0.00033087251918647806, 'epochs': 277, 'loss': 'mse', 'optimizer': 'adam', 'graph_mode': 'off', 'use_snp_selection': True, 'num_snps': 36675}. Best is trial 2 with value: 0.08225658756223755.
[I 2025-12-05 14:24:48,959] Trial 5 finished with value: -0.0032867227497663954 and parameters: {'model_type': 'mlp', 'hidden_dims': '[512, 64]', 'dropout': 0.38275350994408375, 'batch_norm': True, 'lr': 1.5586664309232824e-06, 'weight_decay': 0.0008227664668621182, 'epochs': 145, 'loss': 'mae', 'optimizer': 'adam', 'graph_mode': 'off', 'use_snp_selection': True, 'num_snps': 32148}. Best is trial 2 with value: 0.08225658756223755.
