[I 2025-12-05 16:30:03,698] Trial 92 finished with value: 0.03636922822197793 and parameters: {'model_type': 'mlp', 'hidden_dims': '[512, 64]', 'dropout': 0.19893702861164927, 'batch_norm': True, 'lr': 0.0005085393448451763, 'weight_decay': 1.4974039981176936e-05, 'epochs': 276, 'loss': 'mae', 'optimizer': 'adam', 'graph_mode': 'off', 'use_snp_selection': False}. Best is trial 42 with value: 0.08000357482808548.
[I 2025-12-05 16:30:05,538] Trial 93 finished with value: 0.060075695316523875 and parameters: {'model_type': 'mlp', 'hidden_dims': '[512, 128]', 'dropout': 0.22905672728578969, 'batch_norm': True, 'lr': 0.00037434530248207356, 'weight_decay': 5.0064207802986516e-05, 'epochs': 303, 'loss': 'mae', 'optimizer': 'adam', 'graph_mode': 'off', 'use_snp_selection': False}. Best is trial 42 with value: 0.08000357482808548.
[I 2025-12-05 16:30:06,840] Trial 94 finished with value: 0.04572816329307618 and parameters: {'model_type': 'mlp', 'hidden_dims': '[256, 128, 64]', 'dropout': 0.12402573822067237, 'batch_norm': True, 'lr': 0.0006714995924011762, 'weight_decay': 3.0932801874826855e-05, 'epochs': 325, 'loss': 'mae', 'optimizer': 'adam', 'graph_mode': 'off', 'use_snp_selection': False}. Best is trial 42 with value: 0.08000357482808548.
[I 2025-12-05 16:30:08,754] Trial 95 finished with value: 0.04778760866883673 and parameters: {'model_type': 'mlp', 'hidden_dims': '[512, 64]', 'dropout': 0.1440095134202774, 'batch_norm': True, 'lr': 1.4524677045081567e-05, 'weight_decay': 4.259916837469776e-05, 'epochs': 335, 'loss': 'mae', 'optimizer': 'adam', 'graph_mode': 'off', 'use_snp_selection': False}. Best is trial 42 with value: 0.08000357482808548.
[I 2025-12-05 16:30:10,211] Trial 96 finished with value: 0.025667028782737245 and parameters: {'model_type': 'mlp', 'hidden_dims': '[512, 64]', 'dropout': 0.1799782222855776, 'batch_norm': True, 'lr': 1.4623110051781592e-06, 'weight_decay': 0.00018200848601054187, 'epochs': 206, 'loss': 'mae', 'optimizer': 'adam', 'graph_mode': 'off', 'use_snp_selection': False}. Best is trial 42 with value: 0.08000357482808548.
[I 2025-12-05 16:30:11,114] Trial 97 finished with value: 0.04277934384837224 and parameters: {'model_type': 'mlp', 'hidden_dims': '[128, 64]', 'dropout': 0.16266357664009123, 'batch_norm': False, 'lr': 0.00012485100099141064, 'weight_decay': 8.70385011319043e-05, 'epochs': 311, 'loss': 'mae', 'optimizer': 'adam', 'graph_mode': 'off', 'use_snp_selection': False}. Best is trial 42 with value: 0.08000357482808548.
[I 2025-12-05 16:30:12,919] Trial 98 finished with value: 0.06573182968097406 and parameters: {'model_type': 'mlp', 'hidden_dims': '[512, 64]', 'dropout': 0.11549394526034769, 'batch_norm': True, 'lr': 0.0009069058530114132, 'weight_decay': 2.4314741496187223e-05, 'epochs': 289, 'loss': 'mae', 'optimizer': 'adam', 'graph_mode': 'off', 'use_snp_selection': False}. Best is trial 42 with value: 0.08000357482808548.
[I 2025-12-05 16:30:14,599] Trial 99 finished with value: 0.04773929458781323 and parameters: {'model_type': 'mlp', 'hidden_dims': '[512, 64]', 'dropout': 0.11721663930100382, 'batch_norm': True, 'lr': 0.0002875489678814551, 'weight_decay': 2.6589285194989402e-05, 'epochs': 250, 'loss': 'mae', 'optimizer': 'adam', 'graph_mode': 'off', 'use_snp_selection': False}. Best is trial 42 with value: 0.08000357482808548.
[I 2025-12-05 16:30:16,236] Trial 100 finished with value: 0.0481855165818188 and parameters: {'model_type': 'mlp', 'hidden_dims': '[512, 64]', 'dropout': 0.3115348284737932, 'batch_norm': True, 'lr': 0.000863024148401145, 'weight_decay': 6.429368218246975e-05, 'epochs': 237, 'loss': 'mae', 'optimizer': 'adam', 'graph_mode': 'off', 'use_snp_selection': False}. Best is trial 42 with value: 0.08000357482808548.
[I 2025-12-05 16:30:17,983] Trial 101 finished with value: 0.05948788588171964 and parameters: {'model_type': 'mlp', 'hidden_dims': '[512, 64]', 'dropout': 0.10069606093524144, 'batch_norm': True, 'lr': 0.0007192004608895929, 'weight_decay': 1.723580860377998e-05, 'epochs': 273, 'loss': 'mae', 'optimizer': 'adam', 'graph_mode': 'off', 'use_snp_selection': False}. Best is trial 42 with value: 0.08000357482808548.
[I 2025-12-05 16:30:19,773] Trial 102 finished with value: 0.043824146639738354 and parameters: {'model_type': 'mlp', 'hidden_dims': '[512, 64]', 'dropout': 0.15200197451035188, 'batch_norm': True, 'lr': 0.0009789358753537554, 'weight_decay': 3.4350000643256114e-05, 'epochs': 294, 'loss': 'mae', 'optimizer': 'adam', 'graph_mode': 'off', 'use_snp_selection': False}. Best is trial 42 with value: 0.08000357482808548.
[I 2025-12-05 16:30:21,515] Trial 103 finished with value: 0.030131476927829193 and parameters: {'model_type': 'mlp', 'hidden_dims': '[512, 128]', 'dropout': 0.12671115140423428, 'batch_norm': True, 'lr': 0.0006107080929075833, 'weight_decay': 1.3396780447395764e-05, 'epochs': 286, 'loss': 'mae', 'optimizer': 'adam', 'graph_mode': 'off', 'use_snp_selection': False}. Best is trial 42 with value: 0.08000357482808548.
[I 2025-12-05 16:30:23,363] Trial 104 finished with value: 0.027480714068897946 and parameters: {'model_type': 'mlp', 'hidden_dims': '[512, 64]', 'dropout': 0.13519051494458398, 'batch_norm': True, 'lr': 0.000462579567027207, 'weight_decay': 1.0074388288208636e-05, 'epochs': 317, 'loss': 'mae', 'optimizer': 'adam', 'graph_mode': 'off', 'use_snp_selection': False}. Best is trial 42 with value: 0.08000357482808548.
[I 2025-12-05 16:30:25,072] Trial 105 finished with value: 0.050522700854753716 and parameters: {'model_type': 'mlp', 'hidden_dims': '[512, 64]', 'dropout': 0.11198337164781916, 'batch_norm': True, 'lr': 0.0003753491287536849, 'weight_decay': 2.21397043629705e-05, 'epochs': 264, 'loss': 'mae', 'optimizer': 'adam', 'graph_mode': 'off', 'use_snp_selection': False}. Best is trial 42 with value: 0.08000357482808548.
[I 2025-12-05 16:30:26,926] Trial 106 finished with value: 0.04712942728752301 and parameters: {'model_type': 'mlp', 'hidden_dims': '[512, 256]', 'dropout': 0.17155464508395826, 'batch_norm': True, 'lr': 0.0005596686575186363, 'weight_decay': 5.4958461168676615e-05, 'epochs': 300, 'loss': 'mae', 'optimizer': 'adam', 'graph_mode': 'off', 'use_snp_selection': False}. Best is trial 42 with value: 0.08000357482808548.
[I 2025-12-05 16:30:29,318] Trial 107 finished with value: 0.018669045182388898 and parameters: {'model_type': 'mlp', 'hidden_dims': '[512, 64]', 'dropout': 0.15927431191841507, 'batch_norm': False, 'lr': 0.000811389500223036, 'weight_decay': 3.0255281151614293e-05, 'epochs': 334, 'loss': 'mae', 'optimizer': 'adam', 'graph_mode': 'off', 'use_snp_selection': True, 'num_snps': 35821}. Best is trial 42 with value: 0.08000357482808548.
[I 2025-12-05 16:30:30,577] Trial 108 finished with value: 0.039327454344993275 and parameters: {'model_type': 'mlp', 'hidden_dims': '[256, 128, 64]', 'dropout': 0.3791461584494806, 'batch_norm': True, 'lr': 0.000413944823358061, 'weight_decay': 7.299745485686913e-06, 'epochs': 309, 'loss': 'mae', 'optimizer': 'adam', 'graph_mode': 'off', 'use_snp_selection': False}. Best is trial 42 with value: 0.08000357482808548.
[I 2025-12-05 16:30:32,496] Trial 109 finished with value: 0.06547690770135468 and parameters: {'model_type': 'mlp', 'hidden_dims': '[512, 128]', 'dropout': 0.14261369596032575, 'batch_norm': True, 'lr': 0.0002463438130131817, 'weight_decay': 4.2768366458096244e-05, 'epochs': 323, 'loss': 'mae', 'optimizer': 'adam', 'graph_mode': 'off', 'use_snp_selection': False}. Best is trial 42 with value: 0.08000357482808548.
[I 2025-12-05 16:30:34,398] Trial 110 finished with value: 0.0600579288107609 and parameters: {'model_type': 'mlp', 'hidden_dims': '[512, 128]', 'dropout': 0.14096308234056756, 'batch_norm': True, 'lr': 0.0002273659745800342, 'weight_decay': 4.2646823921708316e-05, 'epochs': 322, 'loss': 'mae', 'optimizer': 'adam', 'graph_mode': 'off', 'use_snp_selection': False}. Best is trial 42 with value: 0.08000357482808548.
[I 2025-12-05 16:30:36,359] Trial 111 finished with value: 0.04969116419999907 and parameters: {'model_type': 'mlp', 'hidden_dims': '[512, 128]', 'dropout': 0.11702921788558081, 'batch_norm': True, 'lr': 0.00016699043179120224, 'weight_decay': 1.904507550552246e-05, 'epochs': 342, 'loss': 'mae', 'optimizer': 'adam', 'graph_mode': 'off', 'use_snp_selection': False}. Best is trial 42 with value: 0.08000357482808548.
[I 2025-12-05 16:30:38,190] Trial 112 finished with value: 0.05381428912729004 and parameters: {'model_type': 'mlp', 'hidden_dims': '[512, 128]', 'dropout': 0.19178534299339473, 'batch_norm': True, 'lr': 0.00033723002470568243, 'weight_decay': 2.5046607033931504e-05, 'epochs': 314, 'loss': 'mae', 'optimizer': 'adam', 'graph_mode': 'off', 'use_snp_selection': False}. Best is trial 42 with value: 0.08000357482808548.
[I 2025-12-05 16:30:39,563] Trial 113 finished with value: 0.06113175178831725 and parameters: {'model_type': 'mlp', 'hidden_dims': '[512, 128]', 'dropout': 0.14861646116171756, 'batch_norm': True, 'lr': 0.0006439391559566699, 'weight_decay': 7.121469866372186e-05, 'epochs': 171, 'loss': 'mae', 'optimizer': 'adam', 'graph_mode': 'off', 'use_snp_selection': False}. Best is trial 42 with value: 0.08000357482808548.
[I 2025-12-05 16:30:41,495] Trial 114 finished with value: 0.0565564311825752 and parameters: {'model_type': 'mlp', 'hidden_dims': '[512, 64]', 'dropout': 0.126229938823045, 'batch_norm': True, 'lr': 0.00025589232005189023, 'weight_decay': 3.6985440562059e-05, 'epochs': 328, 'loss': 'mae', 'optimizer': 'adam', 'graph_mode': 'off', 'use_snp_selection': False}. Best is trial 42 with value: 0.08000357482808548.
[I 2025-12-05 16:30:43,508] Trial 115 finished with value: 0.05425178102868016 and parameters: {'model_type': 'mlp', 'hidden_dims': '[512, 64]', 'dropout': 0.10955085686104989, 'batch_norm': True, 'lr': 0.00047195138134931397, 'weight_decay': 9.475554825135531e-05, 'epochs': 350, 'loss': 'mae', 'optimizer': 'adam', 'graph_mode': 'off', 'use_snp_selection': False}. Best is trial 42 with value: 0.08000357482808548.
[I 2025-12-05 16:30:45,310] Trial 116 finished with value: 0.00938713951900742 and parameters: {'model_type': 'mlp', 'hidden_dims': '[512, 128]', 'dropout': 0.1346574400641853, 'batch_norm': True, 'lr': 1.8757507930924738e-06, 'weight_decay': 0.0001252478059936664, 'epochs': 293, 'loss': 'mae', 'optimizer': 'adam', 'graph_mode': 'off', 'use_snp_selection': False}. Best is trial 42 with value: 0.08000357482808548.
[I 2025-12-05 16:30:46,870] Trial 117 finished with value: 0.0038254257090042684 and parameters: {'model_type': 'mlp', 'hidden_dims': '[512, 64]', 'dropout': 0.2081018043887149, 'batch_norm': False, 'lr': 0.0006997964168260149, 'weight_decay': 4.677692516159863e-05, 'epochs': 226, 'loss': 'mae', 'optimizer': 'adam', 'graph_mode': 'off', 'use_snp_selection': False}. Best is trial 42 with value: 0.08000357482808548.
[I 2025-12-05 16:30:48,307] Trial 118 finished with value: 0.04527450618001115 and parameters: {'model_type': 'mlp', 'hidden_dims': '[512, 64]', 'dropout': 0.16910868543139723, 'batch_norm': True, 'lr': 5.584546302292592e-05, 'weight_decay': 1.5595615802928726e-05, 'epochs': 186, 'loss': 'mae', 'optimizer': 'adam', 'graph_mode': 'off', 'use_snp_selection': False}. Best is trial 42 with value: 0.08000357482808548.
[I 2025-12-05 16:30:49,331] Trial 119 finished with value: -0.003645939927597454 and parameters: {'model_type': 'mlp', 'hidden_dims': '[128, 64]', 'dropout': 0.34751014800627766, 'batch_norm': True, 'lr': 2.3850633183488253e-05, 'weight_decay': 5.6920053075529645e-05, 'epochs': 305, 'loss': 'mse', 'optimizer': 'adam', 'graph_mode': 'off', 'use_snp_selection': False}. Best is trial 42 with value: 0.08000357482808548.
[I 2025-12-05 16:30:50,591] Trial 120 finished with value: -0.004689122305519453 and parameters: {'model_type': 'mlp', 'hidden_dims': '[256, 128]', 'dropout': 0.5025426956420533, 'batch_norm': True, 'lr': 6.674728418978034e-06, 'weight_decay': 2.810367418185484e-05, 'epochs': 321, 'loss': 'mae', 'optimizer': 'adam', 'graph_mode': 'off', 'use_snp_selection': False}. Best is trial 42 with value: 0.08000357482808548.
[I 2025-12-05 16:30:51,941] Trial 121 finished with value: 0.04086917726222916 and parameters: {'model_type': 'mlp', 'hidden_dims': '[512, 128]', 'dropout': 0.1596097407641336, 'batch_norm': True, 'lr': 0.0005597202505900878, 'weight_decay': 7.931530845855951e-05, 'epochs': 173, 'loss': 'mae', 'optimizer': 'adam', 'graph_mode': 'off', 'use_snp_selection': False}. Best is trial 42 with value: 0.08000357482808548.
[I 2025-12-05 16:30:53,243] Trial 122 finished with value: 0.049192909379820224 and parameters: {'model_type': 'mlp', 'hidden_dims': '[512, 128]', 'dropout': 0.1499299832690831, 'batch_norm': True, 'lr': 0.0008821663382289932, 'weight_decay': 6.953650103879687e-05, 'epochs': 164, 'loss': 'mae', 'optimizer': 'adam', 'graph_mode': 'off', 'use_snp_selection': False}. Best is trial 42 with value: 0.08000357482808548.
[I 2025-12-05 16:30:55,008] Trial 123 finished with value: 0.027096836082718165 and parameters: {'model_type': 'mlp', 'hidden_dims': '[512, 128]', 'dropout': 0.14334477719319086, 'batch_norm': True, 'lr': 0.0006126542987387501, 'weight_decay': 3.70935842205023e-05, 'epochs': 281, 'loss': 'mae', 'optimizer': 'adam', 'graph_mode': 'off', 'use_snp_selection': False}. Best is trial 42 with value: 0.08000357482808548.
[I 2025-12-05 16:30:56,328] Trial 124 finished with value: 0.0504453961275327 and parameters: {'model_type': 'mlp', 'hidden_dims': '[512, 128]', 'dropout': 0.19499807645765227, 'batch_norm': True, 'lr': 0.0006884254076408592, 'weight_decay': 0.00025794076018803184, 'epochs': 152, 'loss': 'mae', 'optimizer': 'adam', 'graph_mode': 'off', 'use_snp_selection': False}. Best is trial 42 with value: 0.08000357482808548.
[I 2025-12-05 16:30:57,785] Trial 125 finished with value: -9.050791159079407e-05 and parameters: {'model_type': 'mlp', 'hidden_dims': '[512, 128]', 'dropout': 0.1825814057283079, 'batch_norm': True, 'lr': 1.1207011736025213e-05, 'weight_decay': 2.2601999238019177e-05, 'epochs': 191, 'loss': 'mae', 'optimizer': 'adam', 'graph_mode': 'off', 'use_snp_selection': False}. Best is trial 42 with value: 0.08000357482808548.
[I 2025-12-05 16:30:59,438] Trial 126 finished with value: 0.0632213892240189 and parameters: {'model_type': 'mlp', 'hidden_dims': '[512, 64]', 'dropout': 0.12102551833747915, 'batch_norm': True, 'lr': 3.6003726684745733e-06, 'weight_decay': 3.2040918237161185e-05, 'epochs': 170, 'loss': 'mae', 'optimizer': 'adam', 'graph_mode': 'off', 'use_snp_selection': True, 'num_snps': 26433}. Best is trial 42 with value: 0.08000357482808548.
[I 2025-12-05 16:31:01,103] Trial 127 finished with value: 0.01711766756981924 and parameters: {'model_type': 'mlp', 'hidden_dims': '[512, 64]', 'dropout': 0.1006479534044462, 'batch_norm': True, 'lr': 4.551709469285695e-06, 'weight_decay': 0.000606537970166716, 'epochs': 179, 'loss': 'mse', 'optimizer': 'adam', 'graph_mode': 'off', 'use_snp_selection': True, 'num_snps': 27663}. Best is trial 42 with value: 0.08000357482808548.
[I 2025-12-05 16:31:02,677] Trial 128 finished with value: 0.001327890227563046 and parameters: {'model_type': 'mlp', 'hidden_dims': '[512, 64]', 'dropout': 0.12498270773150755, 'batch_norm': False, 'lr': 3.6065868243716535e-06, 'weight_decay': 3.43282872960363e-05, 'epochs': 163, 'loss': 'mae', 'optimizer': 'adam', 'graph_mode': 'off', 'use_snp_selection': True, 'num_snps': 24836}. Best is trial 42 with value: 0.08000357482808548.
[I 2025-12-05 16:31:04,888] Trial 129 finished with value: 0.02423550346077357 and parameters: {'model_type': 'mlp', 'hidden_dims': '[512, 64]', 'dropout': 0.11626644581354792, 'batch_norm': True, 'lr': 2.6803634826228357e-06, 'weight_decay': 1.9285128317423574e-05, 'epochs': 144, 'loss': 'mae', 'optimizer': 'adam', 'graph_mode': 'off', 'use_snp_selection': True, 'num_snps': 42074}. Best is trial 42 with value: 0.08000357482808548.
[I 2025-12-05 16:31:07,063] Trial 130 finished with value: -0.028337682374455206 and parameters: {'model_type': 'mlp', 'hidden_dims': '[512, 64]', 'dropout': 0.1364890779152167, 'batch_norm': True, 'lr': 1.0544226665525345e-06, 'weight_decay': 4.6423370633827996e-05, 'epochs': 296, 'loss': 'mae', 'optimizer': 'adam', 'graph_mode': 'off', 'use_snp_selection': True, 'num_snps': 35004}. Best is trial 42 with value: 0.08000357482808548.
[I 2025-12-05 16:31:09,140] Trial 131 finished with value: 0.007831764569573185 and parameters: {'model_type': 'mlp', 'hidden_dims': '[512, 64]', 'dropout': 0.1486601902251277, 'batch_norm': True, 'lr': 2.2757652887330195e-06, 'weight_decay': 5.638106240741571e-05, 'epochs': 172, 'loss': 'mae', 'optimizer': 'adam', 'graph_mode': 'off', 'use_snp_selection': True, 'num_snps': 40876}. Best is trial 42 with value: 0.08000357482808548.
[I 2025-12-05 16:31:10,354] Trial 132 finished with value: 0.026366222842692962 and parameters: {'model_type': 'mlp', 'hidden_dims': '[256, 128]', 'dropout': 0.11206374913256362, 'batch_norm': True, 'lr': 3.1259290522691607e-06, 'weight_decay': 0.0001085985958471852, 'epochs': 311, 'loss': 'mae', 'optimizer': 'adam', 'graph_mode': 'off', 'use_snp_selection': False}. Best is trial 42 with value: 0.08000357482808548.
[I 2025-12-05 16:31:11,705] Trial 133 finished with value: 0.058235390642796606 and parameters: {'model_type': 'mlp', 'hidden_dims': '[512, 64]', 'dropout': 0.12328538763198915, 'batch_norm': True, 'lr': 0.0003169597926643826, 'weight_decay': 7.161796304725214e-05, 'epochs': 162, 'loss': 'mae', 'optimizer': 'adam', 'graph_mode': 'off', 'use_snp_selection': False}. Best is trial 42 with value: 0.08000357482808548.
[I 2025-12-05 16:31:12,961] Trial 134 finished with value: 0.06233525603197546 and parameters: {'model_type': 'mlp', 'hidden_dims': '[512, 64]', 'dropout': 0.25750478833445933, 'batch_norm': True, 'lr': 0.0005086162829945704, 'weight_decay': 2.6585700518150947e-05, 'epochs': 132, 'loss': 'mae', 'optimizer': 'adam', 'graph_mode': 'off', 'use_snp_selection': False}. Best is trial 42 with value: 0.08000357482808548.
[I 2025-12-05 16:31:14,153] Trial 135 finished with value: 0.056426802639983245 and parameters: {'model_type': 'mlp', 'hidden_dims': '[512, 64]', 'dropout': 0.13201609131855824, 'batch_norm': True, 'lr': 0.00039682227516863903, 'weight_decay': 2.8052356255151486e-05, 'epochs': 114, 'loss': 'mae', 'optimizer': 'adam', 'graph_mode': 'off', 'use_snp_selection': False}. Best is trial 42 with value: 0.08000357482808548.
[I 2025-12-05 16:31:16,102] Trial 136 finished with value: 0.0463742895251628 and parameters: {'model_type': 'mlp', 'hidden_dims': '[512, 64]', 'dropout': 0.24621283851524195, 'batch_norm': True, 'lr': 0.0005082376584554498, 'weight_decay': 1.2450295298363747e-05, 'epochs': 328, 'loss': 'mse', 'optimizer': 'adam', 'graph_mode': 'off', 'use_snp_selection': False}. Best is trial 42 with value: 0.08000357482808548.
[I 2025-12-05 16:31:17,579] Trial 137 finished with value: 0.011525096007855831 and parameters: {'model_type': 'mlp', 'hidden_dims': '[512, 64]', 'dropout': 0.2386481513264277, 'batch_norm': True, 'lr': 4.790877110927241e-06, 'weight_decay': 2.22024989390831e-05, 'epochs': 129, 'loss': 'mae', 'optimizer': 'adam', 'graph_mode': 'off', 'use_snp_selection': True, 'num_snps': 23073}. Best is trial 42 with value: 0.08000357482808548.
[I 2025-12-05 16:31:18,650] Trial 138 finished with value: 0.06475366641859584 and parameters: {'model_type': 'mlp', 'hidden_dims': '[512, 256]', 'dropout': 0.2538061079861361, 'batch_norm': True, 'lr': 0.0007472187515810693, 'weight_decay': 1.6406189258130714e-05, 'epochs': 88, 'loss': 'mae', 'optimizer': 'adam', 'graph_mode': 'off', 'use_snp_selection': False}. Best is trial 42 with value: 0.08000357482808548.
[I 2025-12-05 16:31:20,492] Trial 139 finished with value: 0.04278533323341724 and parameters: {'model_type': 'mlp', 'hidden_dims': '[512, 256]', 'dropout': 0.25511993314691833, 'batch_norm': True, 'lr': 0.0004428007596968577, 'weight_decay': 3.9345440955526125e-05, 'epochs': 305, 'loss': 'mae', 'optimizer': 'adam', 'graph_mode': 'off', 'use_snp_selection': False}. Best is trial 42 with value: 0.08000357482808548.
[I 2025-12-05 16:31:21,573] Trial 140 finished with value: 0.015961966171091736 and parameters: {'model_type': 'mlp', 'hidden_dims': '[512, 256]', 'dropout': 0.30095928639412617, 'batch_norm': False, 'lr': 0.0002719606243520577, 'weight_decay': 1.688877660562588e-05, 'epochs': 102, 'loss': 'mae', 'optimizer': 'adam', 'graph_mode': 'off', 'use_snp_selection': False}. Best is trial 42 with value: 0.08000357482808548.
[I 2025-12-05 16:31:22,443] Trial 141 finished with value: 0.05603411790692955 and parameters: {'model_type': 'mlp', 'hidden_dims': '[512, 256]', 'dropout': 0.22641959590303443, 'batch_norm': True, 'lr': 0.0007502048998322441, 'weight_decay': 1.4747705684911246e-05, 'epochs': 41, 'loss': 'mae', 'optimizer': 'adam', 'graph_mode': 'off', 'use_snp_selection': False}. Best is trial 42 with value: 0.08000357482808548.
[I 2025-12-05 16:31:24,281] Trial 142 finished with value: 0.045809856505248596 and parameters: {'model_type': 'mlp', 'hidden_dims': '[512, 256]', 'dropout': 0.2624047677597807, 'batch_norm': True, 'lr': 0.00087996631450726, 'weight_decay': 9.771667382784472e-06, 'epochs': 316, 'loss': 'mae', 'optimizer': 'adam', 'graph_mode': 'off', 'use_snp_selection': False}. Best is trial 42 with value: 0.08000357482808548.
[I 2025-12-05 16:31:26,050] Trial 143 finished with value: 0.05033956618488583 and parameters: {'model_type': 'mlp', 'hidden_dims': '[512, 64]', 'dropout': 0.2912647208979033, 'batch_norm': True, 'lr': 0.0009927869628857727, 'weight_decay': 2.5941677404786413e-05, 'epochs': 287, 'loss': 'mae', 'optimizer': 'adam', 'graph_mode': 'off', 'use_snp_selection': False}. Best is trial 42 with value: 0.08000357482808548.
