[I 2025-12-05 15:18:24,681] Trial 54 finished with value: 0.0774484137106725 and parameters: {'model_type': 'mlp', 'hidden_dims': '[512, 64]', 'dropout': 0.410595340176891, 'batch_norm': False, 'lr': 0.0004503772926047826, 'weight_decay': 0.0003725656772557061, 'epochs': 212, 'loss': 'mae', 'optimizer': 'adam', 'graph_mode': 'off', 'use_snp_selection': True, 'num_snps': 51243}. Best is trial 36 with value: 0.09650977875600154.
[I 2025-12-05 15:18:28,915] Trial 55 finished with value: 0.07710235974143559 and parameters: {'model_type': 'mlp', 'hidden_dims': '[512, 64]', 'dropout': 0.3655812720369124, 'batch_norm': False, 'lr': 0.00020289894196194995, 'weight_decay': 0.0004934784049284016, 'epochs': 243, 'loss': 'mae', 'optimizer': 'adam', 'graph_mode': 'off', 'use_snp_selection': True, 'num_snps': 53797}. Best is trial 36 with value: 0.09650977875600154.
[I 2025-12-05 15:18:32,579] Trial 56 finished with value: 0.07326647729358947 and parameters: {'model_type': 'mlp', 'hidden_dims': '[512, 64]', 'dropout': 0.34932240424593136, 'batch_norm': False, 'lr': 0.0002729493506558556, 'weight_decay': 0.00017148321737723963, 'epochs': 233, 'loss': 'mae', 'optimizer': 'adam', 'graph_mode': 'off', 'use_snp_selection': True, 'num_snps': 48074}. Best is trial 36 with value: 0.09650977875600154.
[I 2025-12-05 15:18:35,968] Trial 57 finished with value: 0.08453171270106288 and parameters: {'model_type': 'mlp', 'hidden_dims': '[512, 64]', 'dropout': 0.40055552574029935, 'batch_norm': False, 'lr': 0.00014636983677077345, 'weight_decay': 0.0005525022204538452, 'epochs': 266, 'loss': 'mae', 'optimizer': 'adam', 'graph_mode': 'off', 'use_snp_selection': True, 'num_snps': 40531}. Best is trial 36 with value: 0.09650977875600154.
[I 2025-12-05 15:18:39,033] Trial 58 finished with value: 0.0840920547638255 and parameters: {'model_type': 'mlp', 'hidden_dims': '[512, 64]', 'dropout': 0.27755474510189004, 'batch_norm': False, 'lr': 4.557021362941565e-05, 'weight_decay': 0.0002447685092777155, 'epochs': 248, 'loss': 'mae', 'optimizer': 'adam', 'graph_mode': 'off', 'use_snp_selection': True, 'num_snps': 35142}. Best is trial 36 with value: 0.09650977875600154.
[I 2025-12-05 15:18:41,798] Trial 59 finished with value: 0.06033218352880327 and parameters: {'model_type': 'mlp', 'hidden_dims': '[256, 128, 64]', 'dropout': 0.494339489960013, 'batch_norm': False, 'lr': 0.0004496251481453819, 'weight_decay': 0.0009156827498893495, 'epochs': 225, 'loss': 'mse', 'optimizer': 'adam', 'graph_mode': 'off', 'use_snp_selection': True, 'num_snps': 41067}. Best is trial 36 with value: 0.09650977875600154.
[I 2025-12-05 15:18:44,675] Trial 60 finished with value: 0.06761298531044169 and parameters: {'model_type': 'mlp', 'hidden_dims': '[512, 64]', 'dropout': 0.44234192305328435, 'batch_norm': False, 'lr': 0.00033069716098669166, 'weight_decay': 0.0006495161811275798, 'epochs': 259, 'loss': 'mae', 'optimizer': 'adam', 'graph_mode': 'off', 'use_snp_selection': True, 'num_snps': 31871}. Best is trial 36 with value: 0.09650977875600154.
[I 2025-12-05 15:18:46,882] Trial 61 finished with value: 0.0930834068119994 and parameters: {'model_type': 'mlp', 'hidden_dims': '[256, 128]', 'dropout': 0.11351484151844903, 'batch_norm': False, 'lr': 0.0005477137221963144, 'weight_decay': 9.132191622969722e-05, 'epochs': 309, 'loss': 'mae', 'optimizer': 'adam', 'graph_mode': 'off', 'use_snp_selection': True, 'num_snps': 29256}. Best is trial 36 with value: 0.09650977875600154.
[I 2025-12-05 15:18:49,158] Trial 62 finished with value: 0.07736637960987157 and parameters: {'model_type': 'mlp', 'hidden_dims': '[256, 128]', 'dropout': 0.337434903129823, 'batch_norm': False, 'lr': 0.0005829135947187179, 'weight_decay': 8.50821737065726e-05, 'epochs': 330, 'loss': 'mae', 'optimizer': 'adam', 'graph_mode': 'off', 'use_snp_selection': True, 'num_snps': 29462}. Best is trial 36 with value: 0.09650977875600154.
[I 2025-12-05 15:18:52,829] Trial 63 finished with value: 0.08085642845968827 and parameters: {'model_type': 'mlp', 'hidden_dims': '[256, 128]', 'dropout': 0.3832824773638222, 'batch_norm': False, 'lr': 0.00043382507016693567, 'weight_decay': 0.000269376964282016, 'epochs': 307, 'loss': 'mae', 'optimizer': 'adam', 'graph_mode': 'off', 'use_snp_selection': True, 'num_snps': 58656}. Best is trial 36 with value: 0.09650977875600154.
[I 2025-12-05 15:18:55,433] Trial 64 finished with value: 0.08910542809730913 and parameters: {'model_type': 'mlp', 'hidden_dims': '[256, 128]', 'dropout': 0.14612648222092897, 'batch_norm': False, 'lr': 0.0003047310289818847, 'weight_decay': 4.404775525052467e-05, 'epochs': 289, 'loss': 'mae', 'optimizer': 'adam', 'graph_mode': 'off', 'use_snp_selection': True, 'num_snps': 34125}. Best is trial 36 with value: 0.09650977875600154.
[I 2025-12-05 15:18:59,116] Trial 65 finished with value: 0.08503549141029555 and parameters: {'model_type': 'mlp', 'hidden_dims': '[512, 64]', 'dropout': 0.11629327571074381, 'batch_norm': False, 'lr': 0.00024322046300156937, 'weight_decay': 0.00015015405234997494, 'epochs': 347, 'loss': 'mae', 'optimizer': 'adam', 'graph_mode': 'off', 'use_snp_selection': True, 'num_snps': 38256}. Best is trial 36 with value: 0.09650977875600154.
[I 2025-12-05 15:19:02,363] Trial 66 finished with value: 0.08157733948447517 and parameters: {'model_type': 'mlp', 'hidden_dims': '[256, 128]', 'dropout': 0.3633081846825908, 'batch_norm': False, 'lr': 0.00010366187084650317, 'weight_decay': 7.655917425151489e-05, 'epochs': 321, 'loss': 'mae', 'optimizer': 'adam', 'graph_mode': 'off', 'use_snp_selection': True, 'num_snps': 48647}. Best is trial 36 with value: 0.09650977875600154.
[I 2025-12-05 15:19:06,871] Trial 67 finished with value: 0.06133246416331464 and parameters: {'model_type': 'mlp', 'hidden_dims': '[512, 64]', 'dropout': 0.3148021586490049, 'batch_norm': False, 'lr': 0.0005120071309503004, 'weight_decay': 9.83450211309268e-05, 'epochs': 304, 'loss': 'mse', 'optimizer': 'adam', 'graph_mode': 'off', 'use_snp_selection': True, 'num_snps': 54201}. Best is trial 36 with value: 0.09650977875600154.
[I 2025-12-05 15:19:09,946] Trial 68 finished with value: 0.07914975301829691 and parameters: {'model_type': 'mlp', 'hidden_dims': '[512, 128]', 'dropout': 0.2891422976800102, 'batch_norm': False, 'lr': 0.00081936203299086, 'weight_decay': 0.0002815142700934869, 'epochs': 280, 'loss': 'mae', 'optimizer': 'adam', 'graph_mode': 'off', 'use_snp_selection': True, 'num_snps': 32685}. Best is trial 36 with value: 0.09650977875600154.
[I 2025-12-05 15:19:12,260] Trial 69 finished with value: 0.08568056772854628 and parameters: {'model_type': 'mlp', 'hidden_dims': '[256, 128, 64]', 'dropout': 0.17521996770298365, 'batch_norm': False, 'lr': 0.00017342520913325566, 'weight_decay': 5.417134631060209e-05, 'epochs': 271, 'loss': 'mae', 'optimizer': 'adam', 'graph_mode': 'off', 'use_snp_selection': True, 'num_snps': 29377}. Best is trial 36 with value: 0.09650977875600154.
[I 2025-12-05 15:19:14,098] Trial 70 finished with value: 0.07342106836408543 and parameters: {'model_type': 'mlp', 'hidden_dims': '[256, 128]', 'dropout': 0.2595626473976909, 'batch_norm': False, 'lr': 0.00024288127742473436, 'weight_decay': 0.00012979146855866358, 'epochs': 202, 'loss': 'mae', 'optimizer': 'adam', 'graph_mode': 'off', 'use_snp_selection': True, 'num_snps': 24013}. Best is trial 36 with value: 0.09650977875600154.
[I 2025-12-05 15:19:16,647] Trial 71 finished with value: 0.0957461728391731 and parameters: {'model_type': 'mlp', 'hidden_dims': '[512, 64]', 'dropout': 0.10166347292893897, 'batch_norm': False, 'lr': 0.0007382906011320154, 'weight_decay': 3.865940516370563e-05, 'epochs': 290, 'loss': 'mae', 'optimizer': 'adam', 'graph_mode': 'off', 'use_snp_selection': True, 'num_snps': 26358}. Best is trial 36 with value: 0.09650977875600154.
[I 2025-12-05 15:19:18,848] Trial 72 finished with value: 0.09336266033270561 and parameters: {'model_type': 'mlp', 'hidden_dims': '[512, 64]', 'dropout': 0.11615120493841577, 'batch_norm': False, 'lr': 0.00041051607704329187, 'weight_decay': 3.375557967041933e-05, 'epochs': 260, 'loss': 'mae', 'optimizer': 'adam', 'graph_mode': 'off', 'use_snp_selection': True, 'num_snps': 22126}. Best is trial 36 with value: 0.09650977875600154.
[I 2025-12-05 15:19:20,847] Trial 73 finished with value: 0.09903826992556788 and parameters: {'model_type': 'mlp', 'hidden_dims': '[512, 64]', 'dropout': 0.11746521353710405, 'batch_norm': False, 'lr': 0.000585395440053131, 'weight_decay': 3.5552533068401894e-05, 'epochs': 238, 'loss': 'mae', 'optimizer': 'adam', 'graph_mode': 'off', 'use_snp_selection': True, 'num_snps': 19646}. Best is trial 73 with value: 0.09903826992556788.
[I 2025-12-05 15:19:23,066] Trial 74 finished with value: 0.08882476720457749 and parameters: {'model_type': 'mlp', 'hidden_dims': '[512, 64]', 'dropout': 0.1295292268344922, 'batch_norm': False, 'lr': 0.0007765562193692251, 'weight_decay': 3.1687080747044e-05, 'epochs': 237, 'loss': 'mae', 'optimizer': 'adam', 'graph_mode': 'off', 'use_snp_selection': True, 'num_snps': 22029}. Best is trial 73 with value: 0.09903826992556788.
[I 2025-12-05 15:19:25,234] Trial 75 finished with value: 0.09228963115651541 and parameters: {'model_type': 'mlp', 'hidden_dims': '[512, 64]', 'dropout': 0.11348767357844827, 'batch_norm': False, 'lr': 0.000581070806643852, 'weight_decay': 4.615958608308345e-05, 'epochs': 258, 'loss': 'mae', 'optimizer': 'adam', 'graph_mode': 'off', 'use_snp_selection': True, 'num_snps': 20236}. Best is trial 73 with value: 0.09903826992556788.
[I 2025-12-05 15:19:27,186] Trial 76 finished with value: 0.09442162052500092 and parameters: {'model_type': 'mlp', 'hidden_dims': '[512, 64]', 'dropout': 0.12135200706908444, 'batch_norm': False, 'lr': 0.0005891438241567188, 'weight_decay': 1.833907718873726e-05, 'epochs': 189, 'loss': 'mae', 'optimizer': 'adam', 'graph_mode': 'off', 'use_snp_selection': True, 'num_snps': 20466}. Best is trial 73 with value: 0.09903826992556788.
[I 2025-12-05 15:19:28,834] Trial 77 finished with value: 0.09496779195866749 and parameters: {'model_type': 'mlp', 'hidden_dims': '[256, 128]', 'dropout': 0.11437776196420876, 'batch_norm': False, 'lr': 0.0006003855599680668, 'weight_decay': 3.238626538561703e-05, 'epochs': 190, 'loss': 'mae', 'optimizer': 'adam', 'graph_mode': 'off', 'use_snp_selection': True, 'num_snps': 19893}. Best is trial 73 with value: 0.09903826992556788.
[I 2025-12-05 15:19:30,377] Trial 78 finished with value: 0.08305057355915119 and parameters: {'model_type': 'mlp', 'hidden_dims': '[256, 128]', 'dropout': 0.1583837645214737, 'batch_norm': False, 'lr': 0.0009899246854094116, 'weight_decay': 1.8641420808185294e-05, 'epochs': 180, 'loss': 'mse', 'optimizer': 'adam', 'graph_mode': 'off', 'use_snp_selection': True, 'num_snps': 16551}. Best is trial 73 with value: 0.09903826992556788.
[I 2025-12-05 15:19:31,800] Trial 79 finished with value: 0.06031589082434804 and parameters: {'model_type': 'mlp', 'hidden_dims': '[256, 128]', 'dropout': 0.11463500181783265, 'batch_norm': False, 'lr': 0.0006331082415649237, 'weight_decay': 3.2480676945780695e-05, 'epochs': 164, 'loss': 'mae', 'optimizer': 'adam', 'graph_mode': 'off', 'use_snp_selection': True, 'num_snps': 10254}. Best is trial 73 with value: 0.09903826992556788.
[I 2025-12-05 15:19:33,556] Trial 80 finished with value: 0.05071327739461454 and parameters: {'model_type': 'mlp', 'hidden_dims': '[256, 128]', 'dropout': 0.10005165213968452, 'batch_norm': False, 'lr': 7.149217458244682e-06, 'weight_decay': 3.6321065893065655e-05, 'epochs': 192, 'loss': 'mae', 'optimizer': 'adam', 'graph_mode': 'off', 'use_snp_selection': True, 'num_snps': 20528}. Best is trial 73 with value: 0.09903826992556788.
[I 2025-12-05 15:19:35,453] Trial 81 finished with value: 0.09688615565925329 and parameters: {'model_type': 'mlp', 'hidden_dims': '[512, 128]', 'dropout': 0.139223848398173, 'batch_norm': False, 'lr': 0.000595898254474446, 'weight_decay': 4.8026977062599804e-05, 'epochs': 194, 'loss': 'mae', 'optimizer': 'adam', 'graph_mode': 'off', 'use_snp_selection': True, 'num_snps': 19245}. Best is trial 73 with value: 0.09903826992556788.
[I 2025-12-05 15:19:37,193] Trial 82 finished with value: 0.08131799283403901 and parameters: {'model_type': 'mlp', 'hidden_dims': '[512, 128]', 'dropout': 0.1341490492431233, 'batch_norm': False, 'lr': 0.0008104872581258607, 'weight_decay': 6.085573564046603e-05, 'epochs': 188, 'loss': 'mae', 'optimizer': 'adam', 'graph_mode': 'off', 'use_snp_selection': True, 'num_snps': 16726}. Best is trial 73 with value: 0.09903826992556788.
[I 2025-12-05 15:19:39,273] Trial 83 finished with value: 0.08395427863135235 and parameters: {'model_type': 'mlp', 'hidden_dims': '[512, 128]', 'dropout': 0.1422172512444746, 'batch_norm': False, 'lr': 0.0006230347708076106, 'weight_decay': 1.8176682888694824e-05, 'epochs': 142, 'loss': 'mae', 'optimizer': 'adam', 'graph_mode': 'off', 'use_snp_selection': True, 'num_snps': 24011}. Best is trial 73 with value: 0.09903826992556788.
[I 2025-12-05 15:19:41,213] Trial 84 finished with value: 0.08120180274595122 and parameters: {'model_type': 'mlp', 'hidden_dims': '[512, 128]', 'dropout': 0.12111093761367324, 'batch_norm': False, 'lr': 0.00039555044489396194, 'weight_decay': 2.7277754691189174e-05, 'epochs': 210, 'loss': 'mae', 'optimizer': 'adam', 'graph_mode': 'off', 'use_snp_selection': True, 'num_snps': 17978}. Best is trial 73 with value: 0.09903826992556788.
[I 2025-12-05 15:19:43,459] Trial 85 finished with value: 0.08938032851775884 and parameters: {'model_type': 'mlp', 'hidden_dims': '[512, 128]', 'dropout': 0.16118531007638856, 'batch_norm': False, 'lr': 0.0007474830790715206, 'weight_decay': 7.958261376782488e-06, 'epochs': 165, 'loss': 'mae', 'optimizer': 'adam', 'graph_mode': 'off', 'use_snp_selection': True, 'num_snps': 27996}. Best is trial 73 with value: 0.09903826992556788.
[I 2025-12-05 15:19:44,850] Trial 86 finished with value: 0.06231852834565313 and parameters: {'model_type': 'mlp', 'hidden_dims': '[256, 128]', 'dropout': 0.18521484591330356, 'batch_norm': False, 'lr': 0.0005637139178949201, 'weight_decay': 4.951090693140171e-05, 'epochs': 199, 'loss': 'mae', 'optimizer': 'adam', 'graph_mode': 'off', 'use_snp_selection': True, 'num_snps': 10965}. Best is trial 73 with value: 0.09903826992556788.
[I 2025-12-05 15:19:46,680] Trial 87 finished with value: 0.035429836062688416 and parameters: {'model_type': 'mlp', 'hidden_dims': '[256, 128]', 'dropout': 0.11054072467895484, 'batch_norm': False, 'lr': 2.0225888277171342e-06, 'weight_decay': 1.4255968916916331e-05, 'epochs': 212, 'loss': 'mae', 'optimizer': 'adam', 'graph_mode': 'off', 'use_snp_selection': True, 'num_snps': 21636}. Best is trial 73 with value: 0.09903826992556788.
[I 2025-12-05 15:19:48,664] Trial 88 finished with value: 0.08151131210075799 and parameters: {'model_type': 'mlp', 'hidden_dims': '[256, 128, 64]', 'dropout': 0.13511852422649187, 'batch_norm': False, 'lr': 0.0009072913355304908, 'weight_decay': 3.8326179692438994e-05, 'epochs': 186, 'loss': 'mae', 'optimizer': 'adam', 'graph_mode': 'off', 'use_snp_selection': True, 'num_snps': 25767}. Best is trial 73 with value: 0.09903826992556788.
[I 2025-12-05 15:19:50,318] Trial 89 finished with value: 0.07914969914767599 and parameters: {'model_type': 'mlp', 'hidden_dims': '[512, 128]', 'dropout': 0.1499619473979903, 'batch_norm': False, 'lr': 0.0005108869735317954, 'weight_decay': 2.1354508559036116e-05, 'epochs': 223, 'loss': 'mae', 'optimizer': 'adam', 'graph_mode': 'off', 'use_snp_selection': True, 'num_snps': 13713}. Best is trial 73 with value: 0.09903826992556788.
[I 2025-12-05 15:19:52,058] Trial 90 finished with value: 0.09516703980879074 and parameters: {'model_type': 'mlp', 'hidden_dims': '[256, 128]', 'dropout': 0.12177798215474568, 'batch_norm': False, 'lr': 0.0003015691035203849, 'weight_decay': 6.451546443014103e-05, 'epochs': 289, 'loss': 'mae', 'optimizer': 'adam', 'graph_mode': 'off', 'use_snp_selection': True, 'num_snps': 19002}. Best is trial 73 with value: 0.09903826992556788.
[I 2025-12-05 15:19:53,845] Trial 91 finished with value: 0.0928592060844548 and parameters: {'model_type': 'mlp', 'hidden_dims': '[256, 128]', 'dropout': 0.11986762221826489, 'batch_norm': False, 'lr': 0.00039911435224174234, 'weight_decay': 2.6753195706616446e-05, 'epochs': 287, 'loss': 'mae', 'optimizer': 'adam', 'graph_mode': 'off', 'use_snp_selection': True, 'num_snps': 18816}. Best is trial 73 with value: 0.09903826992556788.
[I 2025-12-05 15:19:55,649] Trial 92 finished with value: 0.10277660844358609 and parameters: {'model_type': 'mlp', 'hidden_dims': '[256, 128]', 'dropout': 0.12105454467981996, 'batch_norm': False, 'lr': 0.000688870179638425, 'weight_decay': 2.7045267696612394e-05, 'epochs': 276, 'loss': 'mae', 'optimizer': 'adam', 'graph_mode': 'off', 'use_snp_selection': True, 'num_snps': 18509}. Best is trial 92 with value: 0.10277660844358609.
[I 2025-12-05 15:19:57,381] Trial 93 finished with value: 0.07990554135164599 and parameters: {'model_type': 'mlp', 'hidden_dims': '[256, 128]', 'dropout': 0.12694198034562457, 'batch_norm': False, 'lr': 0.0006456715252957881, 'weight_decay': 6.694257887371204e-05, 'epochs': 276, 'loss': 'mae', 'optimizer': 'adam', 'graph_mode': 'off', 'use_snp_selection': True, 'num_snps': 14988}. Best is trial 92 with value: 0.10277660844358609.
[I 2025-12-05 15:19:59,359] Trial 94 finished with value: 0.10439684260630243 and parameters: {'model_type': 'mlp', 'hidden_dims': '[256, 128]', 'dropout': 0.10984990967177909, 'batch_norm': False, 'lr': 0.0007128843764432451, 'weight_decay': 3.001937885131359e-05, 'epochs': 302, 'loss': 'mae', 'optimizer': 'adam', 'graph_mode': 'off', 'use_snp_selection': True, 'num_snps': 24093}. Best is trial 94 with value: 0.10439684260630243.
[I 2025-12-05 15:20:01,924] Trial 95 finished with value: 0.06908258936252704 and parameters: {'model_type': 'mlp', 'hidden_dims': '[512, 256]', 'dropout': 0.10091656102494573, 'batch_norm': True, 'lr': 0.0008303297830241569, 'weight_decay': 4.045881000691661e-05, 'epochs': 290, 'loss': 'mae', 'optimizer': 'adam', 'graph_mode': 'off', 'use_snp_selection': True, 'num_snps': 24346}. Best is trial 94 with value: 0.10439684260630243.
[I 2025-12-05 15:20:03,634] Trial 96 finished with value: 0.1033457827384224 and parameters: {'model_type': 'mlp', 'hidden_dims': '[256, 128]', 'dropout': 0.1402295518121987, 'batch_norm': False, 'lr': 0.0007183521375049436, 'weight_decay': 2.81136642299205e-05, 'epochs': 172, 'loss': 'mae', 'optimizer': 'adam', 'graph_mode': 'off', 'use_snp_selection': True, 'num_snps': 20424}. Best is trial 94 with value: 0.10439684260630243.
[I 2025-12-05 15:20:05,259] Trial 97 finished with value: 0.060969704914460285 and parameters: {'model_type': 'mlp', 'hidden_dims': '[256, 128]', 'dropout': 0.5999451722733229, 'batch_norm': False, 'lr': 0.0007349439699031638, 'weight_decay': 1.6365090530181614e-05, 'epochs': 148, 'loss': 'mse', 'optimizer': 'adam', 'graph_mode': 'off', 'use_snp_selection': True, 'num_snps': 19907}. Best is trial 94 with value: 0.10439684260630243.
[I 2025-12-05 15:20:06,816] Trial 98 finished with value: 0.08194896575404784 and parameters: {'model_type': 'mlp', 'hidden_dims': '[256, 128]', 'dropout': 0.13882119768934847, 'batch_norm': False, 'lr': 0.0009316632373556027, 'weight_decay': 1.1696898929129487e-05, 'epochs': 169, 'loss': 'mae', 'optimizer': 'adam', 'graph_mode': 'off', 'use_snp_selection': True, 'num_snps': 17242}. Best is trial 94 with value: 0.10439684260630243.
[I 2025-12-05 15:20:08,546] Trial 99 finished with value: 0.09858369496111279 and parameters: {'model_type': 'mlp', 'hidden_dims': '[256, 128]', 'dropout': 0.16487983366670567, 'batch_norm': False, 'lr': 0.0007315493252989395, 'weight_decay': 2.130449558011539e-05, 'epochs': 155, 'loss': 'mae', 'optimizer': 'adam', 'graph_mode': 'off', 'use_snp_selection': True, 'num_snps': 20886}. Best is trial 94 with value: 0.10439684260630243.
[I 2025-12-05 15:20:09,847] Trial 100 finished with value: 0.0979320605528269 and parameters: {'model_type': 'mlp', 'hidden_dims': '[256, 128]', 'dropout': 0.16566131305837573, 'batch_norm': False, 'lr': 1.4341925327329749e-05, 'weight_decay': 2.87507983209794e-05, 'epochs': 180, 'loss': 'mae', 'optimizer': 'adam', 'graph_mode': 'off', 'use_snp_selection': False}. Best is trial 94 with value: 0.10439684260630243.
[I 2025-12-05 15:20:11,059] Trial 101 finished with value: 0.08056958832418595 and parameters: {'model_type': 'mlp', 'hidden_dims': '[256, 128]', 'dropout': 0.17211996464136387, 'batch_norm': False, 'lr': 1.3718162809446797e-05, 'weight_decay': 2.8574717049305906e-05, 'epochs': 159, 'loss': 'mae', 'optimizer': 'adam', 'graph_mode': 'off', 'use_snp_selection': False}. Best is trial 94 with value: 0.10439684260630243.
[I 2025-12-05 15:20:12,194] Trial 102 finished with value: 0.07269740036277719 and parameters: {'model_type': 'mlp', 'hidden_dims': '[256, 128]', 'dropout': 0.152410916999898, 'batch_norm': False, 'lr': 2.421657888415961e-05, 'weight_decay': 2.1405345214834514e-05, 'epochs': 143, 'loss': 'mae', 'optimizer': 'adam', 'graph_mode': 'off', 'use_snp_selection': False}. Best is trial 94 with value: 0.10439684260630243.
[I 2025-12-05 15:20:13,278] Trial 103 finished with value: 0.07972869151022828 and parameters: {'model_type': 'mlp', 'hidden_dims': '[256, 128]', 'dropout': 0.16350407628555919, 'batch_norm': False, 'lr': 1.0785288611289387e-05, 'weight_decay': 4.966900430925478e-05, 'epochs': 133, 'loss': 'mae', 'optimizer': 'adam', 'graph_mode': 'off', 'use_snp_selection': False}. Best is trial 94 with value: 0.10439684260630243.
