[I 2025-12-05 14:37:34,999] Trial 60 finished with value: 0.07265743145222231 and parameters: {'model_type': 'mlp', 'hidden_dims': '[512, 128]', 'dropout': 0.21891096439331276, 'batch_norm': True, 'lr': 0.00029510074998295596, 'weight_decay': 2.309426209630927e-05, 'epochs': 319, 'loss': 'mae', 'optimizer': 'adam', 'graph_mode': 'off', 'use_snp_selection': False}. Best is trial 17 with value: 0.08772135417558738.
[I 2025-12-05 14:37:38,251] Trial 61 finished with value: 0.06883704418792772 and parameters: {'model_type': 'mlp', 'hidden_dims': '[512, 128]', 'dropout': 0.22329137464363719, 'batch_norm': True, 'lr': 0.0002517067487112511, 'weight_decay': 2.1439252798763743e-05, 'epochs': 318, 'loss': 'mae', 'optimizer': 'adam', 'graph_mode': 'off', 'use_snp_selection': False}. Best is trial 17 with value: 0.08772135417558738.
[I 2025-12-05 14:37:41,384] Trial 62 finished with value: 0.06616307843925803 and parameters: {'model_type': 'mlp', 'hidden_dims': '[512, 128]', 'dropout': 0.13171547356629523, 'batch_norm': True, 'lr': 0.0002921546904399617, 'weight_decay': 1.2867603903274107e-05, 'epochs': 303, 'loss': 'mae', 'optimizer': 'adam', 'graph_mode': 'off', 'use_snp_selection': False}. Best is trial 17 with value: 0.08772135417558738.
[I 2025-12-05 14:37:44,888] Trial 63 finished with value: 0.051189350725381694 and parameters: {'model_type': 'mlp', 'hidden_dims': '[512, 128]', 'dropout': 0.1878328583915656, 'batch_norm': True, 'lr': 0.00015573631660033868, 'weight_decay': 3.404225627993343e-05, 'epochs': 350, 'loss': 'mae', 'optimizer': 'adam', 'graph_mode': 'off', 'use_snp_selection': False}. Best is trial 17 with value: 0.08772135417558738.
[I 2025-12-05 14:37:48,323] Trial 64 finished with value: 0.06399670096369053 and parameters: {'model_type': 'mlp', 'hidden_dims': '[512, 128]', 'dropout': 0.26895358125075086, 'batch_norm': True, 'lr': 0.00010464749556460673, 'weight_decay': 6.170229381356567e-05, 'epochs': 338, 'loss': 'mae', 'optimizer': 'adam', 'graph_mode': 'off', 'use_snp_selection': False}. Best is trial 17 with value: 0.08772135417558738.
[I 2025-12-05 14:37:49,548] Trial 65 finished with value: 0.06565810469057198 and parameters: {'model_type': 'mlp', 'hidden_dims': '[128, 64]', 'dropout': 0.22565224846085294, 'batch_norm': True, 'lr': 0.0004779473405003597, 'weight_decay': 1.133405877175144e-05, 'epochs': 323, 'loss': 'mae', 'optimizer': 'adam', 'graph_mode': 'off', 'use_snp_selection': False}. Best is trial 17 with value: 0.08772135417558738.
[I 2025-12-05 14:37:51,954] Trial 66 finished with value: 0.06355904385721042 and parameters: {'model_type': 'mlp', 'hidden_dims': '[512, 256]', 'dropout': 0.2880883748128945, 'batch_norm': True, 'lr': 0.0003363395384067285, 'weight_decay': 9.579998388174052e-07, 'epochs': 297, 'loss': 'mae', 'optimizer': 'adam', 'graph_mode': 'off', 'use_snp_selection': True, 'num_snps': 22881}. Best is trial 17 with value: 0.08772135417558738.
[I 2025-12-05 14:37:53,156] Trial 67 finished with value: -0.0006213404476610791 and parameters: {'model_type': 'mlp', 'hidden_dims': '[128, 64]', 'dropout': 0.3051616795595704, 'batch_norm': True, 'lr': 1.038788092140181e-06, 'weight_decay': 4.3168457003427e-05, 'epochs': 308, 'loss': 'mse', 'optimizer': 'adam', 'graph_mode': 'off', 'use_snp_selection': False}. Best is trial 17 with value: 0.08772135417558738.
[I 2025-12-05 14:37:56,050] Trial 68 finished with value: 0.07316850617322493 and parameters: {'model_type': 'mlp', 'hidden_dims': '[512, 128]', 'dropout': 0.5303543091339128, 'batch_norm': True, 'lr': 0.00019557300373768797, 'weight_decay': 2.467434426412949e-05, 'epochs': 270, 'loss': 'mae', 'optimizer': 'adam', 'graph_mode': 'off', 'use_snp_selection': False}. Best is trial 17 with value: 0.08772135417558738.
[I 2025-12-05 14:37:57,143] Trial 69 finished with value: 0.03384209427541328 and parameters: {'model_type': 'mlp', 'hidden_dims': '[128, 64]', 'dropout': 0.5366526518599078, 'batch_norm': False, 'lr': 0.00013574085541366422, 'weight_decay': 2.897275714624433e-05, 'epochs': 264, 'loss': 'mae', 'optimizer': 'adam', 'graph_mode': 'off', 'use_snp_selection': False}. Best is trial 17 with value: 0.08772135417558738.
[I 2025-12-05 14:37:58,293] Trial 70 finished with value: 0.0953589359383638 and parameters: {'model_type': 'mlp', 'hidden_dims': '[128, 64]', 'dropout': 0.5177849699850037, 'batch_norm': True, 'lr': 5.010107083211151e-05, 'weight_decay': 7.34290695012844e-06, 'epochs': 281, 'loss': 'mae', 'optimizer': 'adam', 'graph_mode': 'off', 'use_snp_selection': False}. Best is trial 70 with value: 0.0953589359383638.
[I 2025-12-05 14:37:59,456] Trial 71 finished with value: 0.009579128671021916 and parameters: {'model_type': 'mlp', 'hidden_dims': '[128, 64]', 'dropout': 0.5785069030300649, 'batch_norm': True, 'lr': 2.111062697351126e-05, 'weight_decay': 7.667478228387132e-06, 'epochs': 280, 'loss': 'mae', 'optimizer': 'adam', 'graph_mode': 'off', 'use_snp_selection': False}. Best is trial 70 with value: 0.0953589359383638.
[I 2025-12-05 14:38:00,591] Trial 72 finished with value: 0.04741352015612777 and parameters: {'model_type': 'mlp', 'hidden_dims': '[128, 64]', 'dropout': 0.5144068243253362, 'batch_norm': True, 'lr': 7.286224627577203e-05, 'weight_decay': 2.983939342645245e-06, 'epochs': 273, 'loss': 'mae', 'optimizer': 'adam', 'graph_mode': 'off', 'use_snp_selection': False}. Best is trial 70 with value: 0.0953589359383638.
[I 2025-12-05 14:38:01,676] Trial 73 finished with value: 0.047457308652895144 and parameters: {'model_type': 'mlp', 'hidden_dims': '[128, 64]', 'dropout': 0.49622829986350137, 'batch_norm': True, 'lr': 4.692101925747445e-05, 'weight_decay': 4.169215218895087e-06, 'epochs': 233, 'loss': 'mae', 'optimizer': 'adam', 'graph_mode': 'off', 'use_snp_selection': False}. Best is trial 70 with value: 0.0953589359383638.
[I 2025-12-05 14:38:02,846] Trial 74 finished with value: 0.05618360667326857 and parameters: {'model_type': 'mlp', 'hidden_dims': '[128, 64]', 'dropout': 0.530444103033864, 'batch_norm': True, 'lr': 3.469507689056906e-05, 'weight_decay': 1.7600106490130913e-05, 'epochs': 287, 'loss': 'mae', 'optimizer': 'adam', 'graph_mode': 'off', 'use_snp_selection': False}. Best is trial 70 with value: 0.0953589359383638.
[I 2025-12-05 14:38:03,937] Trial 75 finished with value: 0.05377071639825168 and parameters: {'model_type': 'mlp', 'hidden_dims': '[128, 64]', 'dropout': 0.5662666916487541, 'batch_norm': True, 'lr': 0.00016940148295812888, 'weight_decay': 1.0613393199787916e-05, 'epochs': 249, 'loss': 'mae', 'optimizer': 'adam', 'graph_mode': 'off', 'use_snp_selection': False}. Best is trial 70 with value: 0.0953589359383638.
[I 2025-12-05 14:38:05,338] Trial 76 finished with value: 0.08049483044828247 and parameters: {'model_type': 'mlp', 'hidden_dims': '[256, 128, 64]', 'dropout': 0.48203715463869645, 'batch_norm': True, 'lr': 9.598729907917953e-05, 'weight_decay': 5.672047298026627e-06, 'epochs': 267, 'loss': 'mae', 'optimizer': 'adam', 'graph_mode': 'off', 'use_snp_selection': True, 'num_snps': 3325}. Best is trial 70 with value: 0.0953589359383638.
[I 2025-12-05 14:38:06,753] Trial 77 finished with value: 0.015336576351377727 and parameters: {'model_type': 'mlp', 'hidden_dims': '[256, 128, 64]', 'dropout': 0.4844314761818666, 'batch_norm': True, 'lr': 6.924034949828564e-05, 'weight_decay': 5.692983210537671e-06, 'epochs': 293, 'loss': 'mae', 'optimizer': 'adam', 'graph_mode': 'off', 'use_snp_selection': True, 'num_snps': 2436}. Best is trial 70 with value: 0.0953589359383638.
[I 2025-12-05 14:38:08,424] Trial 78 finished with value: 0.04309133255570438 and parameters: {'model_type': 'mlp', 'hidden_dims': '[256, 128, 64]', 'dropout': 0.4586085402737188, 'batch_norm': True, 'lr': 9.750268880219397e-05, 'weight_decay': 2.4387640841874594e-06, 'epochs': 283, 'loss': 'mae', 'optimizer': 'adam', 'graph_mode': 'off', 'use_snp_selection': True, 'num_snps': 10432}. Best is trial 70 with value: 0.0953589359383638.
[I 2025-12-05 14:38:09,961] Trial 79 finished with value: 0.05172408252863757 and parameters: {'model_type': 'mlp', 'hidden_dims': '[256, 128, 64]', 'dropout': 0.42724652247789663, 'batch_norm': True, 'lr': 2.764670765613653e-05, 'weight_decay': 1.8297480242540836e-06, 'epochs': 208, 'loss': 'mse', 'optimizer': 'adam', 'graph_mode': 'off', 'use_snp_selection': True, 'num_snps': 12108}. Best is trial 70 with value: 0.0953589359383638.
[I 2025-12-05 14:38:12,058] Trial 80 finished with value: 0.025590541824360505 and parameters: {'model_type': 'mlp', 'hidden_dims': '[256, 128, 64]', 'dropout': 0.5028069392506198, 'batch_norm': False, 'lr': 5.02662038690076e-05, 'weight_decay': 7.3664790439225375e-06, 'epochs': 260, 'loss': 'mae', 'optimizer': 'adam', 'graph_mode': 'off', 'use_snp_selection': True, 'num_snps': 27336}. Best is trial 70 with value: 0.0953589359383638.
[I 2025-12-05 14:38:14,489] Trial 81 finished with value: 0.06534032922111797 and parameters: {'model_type': 'mlp', 'hidden_dims': '[128, 64]', 'dropout': 0.5464303969017321, 'batch_norm': True, 'lr': 0.00019753600315738999, 'weight_decay': 7.508510650706856e-05, 'epochs': 247, 'loss': 'mae', 'optimizer': 'adam', 'graph_mode': 'off', 'use_snp_selection': True, 'num_snps': 40655}. Best is trial 70 with value: 0.0953589359383638.
[I 2025-12-05 14:38:16,370] Trial 82 finished with value: 0.07912264240692218 and parameters: {'model_type': 'mlp', 'hidden_dims': '[512, 64]', 'dropout': 0.47476857927645394, 'batch_norm': True, 'lr': 0.000111887456538875, 'weight_decay': 4.644080164820939e-05, 'epochs': 142, 'loss': 'mae', 'optimizer': 'adam', 'graph_mode': 'off', 'use_snp_selection': False}. Best is trial 70 with value: 0.0953589359383638.
[I 2025-12-05 14:38:18,070] Trial 83 finished with value: 0.0489508077497322 and parameters: {'model_type': 'mlp', 'hidden_dims': '[512, 64]', 'dropout': 0.4078011708494435, 'batch_norm': True, 'lr': 0.00012529654666555316, 'weight_decay': 4.699431908137665e-05, 'epochs': 121, 'loss': 'mae', 'optimizer': 'adam', 'graph_mode': 'off', 'use_snp_selection': False}. Best is trial 70 with value: 0.0953589359383638.
[I 2025-12-05 14:38:21,206] Trial 84 finished with value: 0.053724274550611024 and parameters: {'model_type': 'mlp', 'hidden_dims': '[512, 64]', 'dropout': 0.47044508548128566, 'batch_norm': True, 'lr': 9.258893252152867e-05, 'weight_decay': 4.033837174788779e-06, 'epochs': 303, 'loss': 'mae', 'optimizer': 'adam', 'graph_mode': 'off', 'use_snp_selection': False}. Best is trial 70 with value: 0.0953589359383638.
[I 2025-12-05 14:38:23,646] Trial 85 finished with value: 0.04694917094372297 and parameters: {'model_type': 'mlp', 'hidden_dims': '[512, 64]', 'dropout': 0.44610003475205295, 'batch_norm': True, 'lr': 5.456792269028469e-05, 'weight_decay': 0.00011466939418526342, 'epochs': 172, 'loss': 'mae', 'optimizer': 'adam', 'graph_mode': 'off', 'use_snp_selection': True, 'num_snps': 31217}. Best is trial 70 with value: 0.0953589359383638.
[I 2025-12-05 14:38:25,612] Trial 86 finished with value: 0.040502188507222016 and parameters: {'model_type': 'mlp', 'hidden_dims': '[512, 64]', 'dropout': 0.4844191004840057, 'batch_norm': True, 'lr': 7.095186504999537e-05, 'weight_decay': 8.756476174651457e-06, 'epochs': 151, 'loss': 'mae', 'optimizer': 'adam', 'graph_mode': 'off', 'use_snp_selection': False}. Best is trial 70 with value: 0.0953589359383638.
[I 2025-12-05 14:38:26,391] Trial 87 finished with value: 0.021407283071110353 and parameters: {'model_type': 'mlp', 'hidden_dims': '[128, 64]', 'dropout': 0.3861396335784643, 'batch_norm': True, 'lr': 0.00011834291117323243, 'weight_decay': 5.777648628636336e-06, 'epochs': 93, 'loss': 'mae', 'optimizer': 'adam', 'graph_mode': 'off', 'use_snp_selection': False}. Best is trial 70 with value: 0.0953589359383638.
[I 2025-12-05 14:38:27,331] Trial 88 finished with value: 0.031066663015047187 and parameters: {'model_type': 'mlp', 'hidden_dims': '[256, 128]', 'dropout': 0.49698218858285903, 'batch_norm': True, 'lr': 3.809724532748659e-05, 'weight_decay': 1.3678599939328488e-05, 'epochs': 69, 'loss': 'mae', 'optimizer': 'adam', 'graph_mode': 'off', 'use_snp_selection': False}. Best is trial 70 with value: 0.0953589359383638.
[I 2025-12-05 14:38:28,235] Trial 89 finished with value: 0.07245535739584258 and parameters: {'model_type': 'mlp', 'hidden_dims': '[128, 64]', 'dropout': 0.24888401540708963, 'batch_norm': True, 'lr': 0.0001423619925298803, 'weight_decay': 3.377148917120723e-05, 'epochs': 159, 'loss': 'mae', 'optimizer': 'adam', 'graph_mode': 'off', 'use_snp_selection': False}. Best is trial 70 with value: 0.0953589359383638.
[I 2025-12-05 14:38:30,089] Trial 90 finished with value: 0.0633720588701342 and parameters: {'model_type': 'mlp', 'hidden_dims': '[512, 256]', 'dropout': 0.5186572819822364, 'batch_norm': True, 'lr': 0.00010633206402711244, 'weight_decay': 1.1660212598235111e-06, 'epochs': 139, 'loss': 'mse', 'optimizer': 'adam', 'graph_mode': 'off', 'use_snp_selection': False}. Best is trial 70 with value: 0.0953589359383638.
[I 2025-12-05 14:38:31,218] Trial 91 finished with value: 0.061268704302330036 and parameters: {'model_type': 'mlp', 'hidden_dims': '[128, 64]', 'dropout': 0.43147154343881144, 'batch_norm': True, 'lr': 0.00018317529932532426, 'weight_decay': 2.613685165020432e-05, 'epochs': 267, 'loss': 'mae', 'optimizer': 'adam', 'graph_mode': 'off', 'use_snp_selection': False}. Best is trial 70 with value: 0.0953589359383638.
[I 2025-12-05 14:38:34,157] Trial 92 finished with value: 0.07918309098999135 and parameters: {'model_type': 'mlp', 'hidden_dims': '[512, 128]', 'dropout': 0.5238013316945043, 'batch_norm': True, 'lr': 0.00022890930050691865, 'weight_decay': 1.9211764878908775e-05, 'epochs': 272, 'loss': 'mae', 'optimizer': 'adam', 'graph_mode': 'off', 'use_snp_selection': False}. Best is trial 70 with value: 0.0953589359383638.
[I 2025-12-05 14:38:35,979] Trial 93 finished with value: 0.05469746973246884 and parameters: {'model_type': 'mlp', 'hidden_dims': '[256, 128, 64]', 'dropout': 0.47260609475583365, 'batch_norm': True, 'lr': 0.0002500314396717568, 'weight_decay': 1.8629507794297443e-05, 'epochs': 297, 'loss': 'mae', 'optimizer': 'adam', 'graph_mode': 'off', 'use_snp_selection': False}. Best is trial 70 with value: 0.0953589359383638.
[I 2025-12-05 14:38:37,049] Trial 94 finished with value: 0.07508105588951407 and parameters: {'model_type': 'mlp', 'hidden_dims': '[128, 64]', 'dropout': 0.5038633114646451, 'batch_norm': True, 'lr': 0.00015304952111740725, 'weight_decay': 6.711827639462762e-05, 'epochs': 236, 'loss': 'mae', 'optimizer': 'adam', 'graph_mode': 'off', 'use_snp_selection': False}. Best is trial 70 with value: 0.0953589359383638.
[I 2025-12-05 14:38:39,649] Trial 95 finished with value: 0.07354206705087415 and parameters: {'model_type': 'mlp', 'hidden_dims': '[512, 64]', 'dropout': 0.5078360473635134, 'batch_norm': True, 'lr': 7.989330587164565e-05, 'weight_decay': 8.842331235115747e-05, 'epochs': 233, 'loss': 'mae', 'optimizer': 'adam', 'graph_mode': 'off', 'use_snp_selection': False}. Best is trial 70 with value: 0.0953589359383638.
[I 2025-12-05 14:38:40,721] Trial 96 finished with value: 0.09884358697210388 and parameters: {'model_type': 'mlp', 'hidden_dims': '[128, 64]', 'dropout': 0.45200202782717647, 'batch_norm': True, 'lr': 0.00022478812999801248, 'weight_decay': 0.00014361709075515357, 'epochs': 242, 'loss': 'mae', 'optimizer': 'adam', 'graph_mode': 'off', 'use_snp_selection': False}. Best is trial 96 with value: 0.09884358697210388.
[I 2025-12-05 14:38:41,803] Trial 97 finished with value: 0.0820099968377373 and parameters: {'model_type': 'mlp', 'hidden_dims': '[128, 64]', 'dropout': 0.4616039885332262, 'batch_norm': True, 'lr': 0.0006853544321740278, 'weight_decay': 0.00018678510048961548, 'epochs': 241, 'loss': 'mae', 'optimizer': 'adam', 'graph_mode': 'off', 'use_snp_selection': False}. Best is trial 96 with value: 0.09884358697210388.
[I 2025-12-05 14:38:44,523] Trial 98 finished with value: 0.07577399139944961 and parameters: {'model_type': 'mlp', 'hidden_dims': '[128, 64]', 'dropout': 0.45611876685167285, 'batch_norm': True, 'lr': 0.0009173557664048313, 'weight_decay': 0.00023379001189892862, 'epochs': 242, 'loss': 'mae', 'optimizer': 'adam', 'graph_mode': 'off', 'use_snp_selection': True, 'num_snps': 51258}. Best is trial 96 with value: 0.09884358697210388.
[I 2025-12-05 14:38:47,240] Trial 99 finished with value: 0.04874973493988675 and parameters: {'model_type': 'mlp', 'hidden_dims': '[512, 128]', 'dropout': 0.4914156141122457, 'batch_norm': False, 'lr': 0.00044174825987732506, 'weight_decay': 0.0005327017478075976, 'epochs': 254, 'loss': 'mae', 'optimizer': 'adam', 'graph_mode': 'off', 'use_snp_selection': False}. Best is trial 96 with value: 0.09884358697210388.
[I 2025-12-05 14:38:48,331] Trial 100 finished with value: 0.06469973310593402 and parameters: {'model_type': 'mlp', 'hidden_dims': '[128, 64]', 'dropout': 0.46990729976733997, 'batch_norm': True, 'lr': 0.000710053737697688, 'weight_decay': 0.00040302684269254374, 'epochs': 227, 'loss': 'mae', 'optimizer': 'adam', 'graph_mode': 'off', 'use_snp_selection': False}. Best is trial 96 with value: 0.09884358697210388.
[I 2025-12-05 14:38:51,174] Trial 101 finished with value: 0.06787041760955158 and parameters: {'model_type': 'mlp', 'hidden_dims': '[128, 64]', 'dropout': 0.4549252927882041, 'batch_norm': True, 'lr': 0.0009813224553449377, 'weight_decay': 0.00022737963802597287, 'epochs': 214, 'loss': 'mae', 'optimizer': 'adam', 'graph_mode': 'off', 'use_snp_selection': True, 'num_snps': 51746}. Best is trial 96 with value: 0.09884358697210388.
[I 2025-12-05 14:38:54,018] Trial 102 finished with value: 0.06730605871475824 and parameters: {'model_type': 'mlp', 'hidden_dims': '[128, 64]', 'dropout': 0.4422358001079293, 'batch_norm': True, 'lr': 0.0006441329044654953, 'weight_decay': 0.00014963396690299816, 'epochs': 240, 'loss': 'mae', 'optimizer': 'adam', 'graph_mode': 'off', 'use_snp_selection': True, 'num_snps': 51140}. Best is trial 96 with value: 0.09884358697210388.
[I 2025-12-05 14:38:56,369] Trial 103 finished with value: 0.051373000920552025 and parameters: {'model_type': 'mlp', 'hidden_dims': '[128, 64]', 'dropout': 0.4797561302437585, 'batch_norm': True, 'lr': 0.0005366270320315486, 'weight_decay': 0.00029057653956746625, 'epochs': 245, 'loss': 'mae', 'optimizer': 'adam', 'graph_mode': 'off', 'use_snp_selection': True, 'num_snps': 39133}. Best is trial 96 with value: 0.09884358697210388.
[I 2025-12-05 14:38:59,093] Trial 104 finished with value: 0.06382612432902685 and parameters: {'model_type': 'mlp', 'hidden_dims': '[128, 64]', 'dropout': 0.5196384763855918, 'batch_norm': True, 'lr': 0.0008139290400138739, 'weight_decay': 0.00020938475143585087, 'epochs': 187, 'loss': 'mae', 'optimizer': 'adam', 'graph_mode': 'off', 'use_snp_selection': True, 'num_snps': 51484}. Best is trial 96 with value: 0.09884358697210388.
[I 2025-12-05 14:39:01,274] Trial 105 finished with value: 0.06353627647087319 and parameters: {'model_type': 'mlp', 'hidden_dims': '[256, 128]', 'dropout': 0.41689947433115954, 'batch_norm': True, 'lr': 0.0009337150243025654, 'weight_decay': 0.0003619721117739993, 'epochs': 257, 'loss': 'mae', 'optimizer': 'adam', 'graph_mode': 'off', 'use_snp_selection': True, 'num_snps': 25884}. Best is trial 96 with value: 0.09884358697210388.
[I 2025-12-05 14:39:02,373] Trial 106 finished with value: 0.06317136342046004 and parameters: {'model_type': 'mlp', 'hidden_dims': '[128, 64]', 'dropout': 0.10523132144104946, 'batch_norm': True, 'lr': 0.0006304840348213294, 'weight_decay': 0.0009562344677391026, 'epochs': 227, 'loss': 'mae', 'optimizer': 'adam', 'graph_mode': 'off', 'use_snp_selection': False}. Best is trial 96 with value: 0.09884358697210388.
[I 2025-12-05 14:39:03,522] Trial 107 finished with value: 0.07721712829731561 and parameters: {'model_type': 'mlp', 'hidden_dims': '[128, 64]', 'dropout': 0.4628844743984898, 'batch_norm': True, 'lr': 0.0007460729823626994, 'weight_decay': 0.00014316560544533596, 'epochs': 263, 'loss': 'mae', 'optimizer': 'adam', 'graph_mode': 'off', 'use_snp_selection': False}. Best is trial 96 with value: 0.09884358697210388.
[I 2025-12-05 14:39:05,281] Trial 108 finished with value: 0.08031724455866421 and parameters: {'model_type': 'mlp', 'hidden_dims': '[256, 128, 64]', 'dropout': 0.46423595990976985, 'batch_norm': True, 'lr': 0.000336829697889526, 'weight_decay': 0.00015578148685481207, 'epochs': 274, 'loss': 'mae', 'optimizer': 'adam', 'graph_mode': 'off', 'use_snp_selection': False}. Best is trial 96 with value: 0.09884358697210388.
[I 2025-12-05 14:39:07,011] Trial 109 finished with value: 0.0659581566041591 and parameters: {'model_type': 'mlp', 'hidden_dims': '[256, 128, 64]', 'dropout': 0.4382431003231785, 'batch_norm': True, 'lr': 0.0003198104865261918, 'weight_decay': 4.72039927941867e-06, 'epochs': 275, 'loss': 'mae', 'optimizer': 'adam', 'graph_mode': 'off', 'use_snp_selection': False}. Best is trial 96 with value: 0.09884358697210388.
[I 2025-12-05 14:39:08,767] Trial 110 finished with value: 0.06219097608773129 and parameters: {'model_type': 'mlp', 'hidden_dims': '[256, 128, 64]', 'dropout': 0.3980384769663648, 'batch_norm': True, 'lr': 0.00040077685539296017, 'weight_decay': 9.756885039945339e-06, 'epochs': 282, 'loss': 'mse', 'optimizer': 'adam', 'graph_mode': 'off', 'use_snp_selection': False}. Best is trial 96 with value: 0.09884358697210388.
[I 2025-12-05 14:39:10,468] Trial 111 finished with value: 0.05664168762034663 and parameters: {'model_type': 'mlp', 'hidden_dims': '[256, 128, 64]', 'dropout': 0.46482900332775967, 'batch_norm': True, 'lr': 0.0002263768340865864, 'weight_decay': 0.00013792475092190117, 'epochs': 263, 'loss': 'mae', 'optimizer': 'adam', 'graph_mode': 'off', 'use_snp_selection': False}. Best is trial 96 with value: 0.09884358697210388.
