[I 2025-12-06 06:21:00,489] Trial 19 finished with value: 0.3690886270960304 and parameters: {'model_type': 'mlp', 'hidden_dims': '[512, 256]', 'dropout': 0.4474829529456146, 'batch_norm': False, 'lr': 7.403367766965606e-06, 'weight_decay': 4.876628193594786e-07, 'epochs': 117, 'loss': 'mae', 'optimizer': 'adam', 'graph_mode': 'off', 'use_snp_selection': False}. Best is trial 12 with value: 0.36952950672583545.
[I 2025-12-06 06:21:47,308] Trial 20 finished with value: 0.3559760835869433 and parameters: {'model_type': 'mlp', 'hidden_dims': '[512, 256]', 'dropout': 0.33818288615525227, 'batch_norm': False, 'lr': 2.5757907733081407e-05, 'weight_decay': 0.0002062947245947731, 'epochs': 222, 'loss': 'mae', 'optimizer': 'adam', 'graph_mode': 'off', 'use_snp_selection': False}. Best is trial 12 with value: 0.36952950672583545.
[I 2025-12-06 06:22:16,773] Trial 21 finished with value: 0.3720808894282361 and parameters: {'model_type': 'mlp', 'hidden_dims': '[512, 256]', 'dropout': 0.4561162061181468, 'batch_norm': False, 'lr': 5.9930238761530595e-06, 'weight_decay': 2.7421923971903877e-07, 'epochs': 126, 'loss': 'mae', 'optimizer': 'adam', 'graph_mode': 'off', 'use_snp_selection': False}. Best is trial 21 with value: 0.3720808894282361.
[I 2025-12-06 06:22:29,917] Trial 22 finished with value: 0.29035403560582473 and parameters: {'model_type': 'mlp', 'hidden_dims': '[512, 256]', 'dropout': 0.5447308805905808, 'batch_norm': False, 'lr': 3.7267953366136627e-06, 'weight_decay': 1.569574404197732e-07, 'epochs': 41, 'loss': 'mae', 'optimizer': 'adam', 'graph_mode': 'off', 'use_snp_selection': False}. Best is trial 21 with value: 0.3720808894282361.
[I 2025-12-06 06:22:54,373] Trial 23 finished with value: 0.3523848451751987 and parameters: {'model_type': 'mlp', 'hidden_dims': '[512, 256]', 'dropout': 0.46324290153530984, 'batch_norm': False, 'lr': 2.4423080550874456e-06, 'weight_decay': 2.3578025393602273e-07, 'epochs': 100, 'loss': 'mae', 'optimizer': 'adam', 'graph_mode': 'off', 'use_snp_selection': False}. Best is trial 21 with value: 0.3720808894282361.
[I 2025-12-06 06:23:13,178] Trial 24 finished with value: 0.36829711350660943 and parameters: {'model_type': 'mlp', 'hidden_dims': '[256, 128]', 'dropout': 0.548933082694348, 'batch_norm': False, 'lr': 1.0339930351440496e-05, 'weight_decay': 8.293741887925833e-07, 'epochs': 142, 'loss': 'mae', 'optimizer': 'adam', 'graph_mode': 'off', 'use_snp_selection': False}. Best is trial 21 with value: 0.3720808894282361.
[I 2025-12-06 06:24:16,078] Trial 25 finished with value: 0.3620891797937281 and parameters: {'model_type': 'mlp', 'hidden_dims': '[512, 256]', 'dropout': 0.4786326439823625, 'batch_norm': False, 'lr': 1.0459530900202556e-06, 'weight_decay': 1.2046006776347228e-06, 'epochs': 299, 'loss': 'mae', 'optimizer': 'adam', 'graph_mode': 'off', 'use_snp_selection': False}. Best is trial 21 with value: 0.3720808894282361.
[I 2025-12-06 06:24:39,788] Trial 26 finished with value: 0.2726864868962999 and parameters: {'model_type': 'mlp', 'hidden_dims': '[512, 128]', 'dropout': 0.5542150978443016, 'batch_norm': False, 'lr': 5.574521828207366e-06, 'weight_decay': 2.7669132145096193e-07, 'epochs': 69, 'loss': 'mae', 'optimizer': 'adam', 'graph_mode': 'off', 'use_snp_selection': True, 'num_snps': 3842}. Best is trial 21 with value: 0.3720808894282361.
[I 2025-12-06 06:25:09,900] Trial 27 finished with value: 0.35578754042690963 and parameters: {'model_type': 'mlp', 'hidden_dims': '[256, 128, 64]', 'dropout': 0.525881700521255, 'batch_norm': False, 'lr': 1.7892026389298814e-05, 'weight_decay': 6.366130201266533e-06, 'epochs': 258, 'loss': 'mae', 'optimizer': 'adam', 'graph_mode': 'off', 'use_snp_selection': False}. Best is trial 21 with value: 0.3720808894282361.
[I 2025-12-06 06:25:23,711] Trial 28 finished with value: 0.3577611719545919 and parameters: {'model_type': 'mlp', 'hidden_dims': '[128, 64]', 'dropout': 0.351082192874304, 'batch_norm': False, 'lr': 3.173002020439059e-05, 'weight_decay': 2.5895436211011684e-05, 'epochs': 172, 'loss': 'mae', 'optimizer': 'adam', 'graph_mode': 'off', 'use_snp_selection': False}. Best is trial 21 with value: 0.3720808894282361.
[I 2025-12-06 06:25:56,563] Trial 29 finished with value: 0.3595341635932967 and parameters: {'model_type': 'mlp', 'hidden_dims': '[128, 64]', 'dropout': 0.4250952267269558, 'batch_norm': False, 'lr': 2.320440320155318e-06, 'weight_decay': 0.00012363202694194868, 'epochs': 329, 'loss': 'mae', 'optimizer': 'adam', 'graph_mode': 'off', 'use_snp_selection': True, 'num_snps': 19468}. Best is trial 21 with value: 0.3720808894282361.
[I 2025-12-06 06:26:21,204] Trial 30 finished with value: 0.3390453731684346 and parameters: {'model_type': 'mlp', 'hidden_dims': '[256, 128]', 'dropout': 0.5645532131762386, 'batch_norm': False, 'lr': 0.00011200399247813885, 'weight_decay': 3.429327820341355e-05, 'epochs': 208, 'loss': 'mae', 'optimizer': 'adam', 'graph_mode': 'off', 'use_snp_selection': False}. Best is trial 21 with value: 0.3720808894282361.
[I 2025-12-06 06:26:48,191] Trial 31 finished with value: 0.3674442714527169 and parameters: {'model_type': 'mlp', 'hidden_dims': '[512, 256]', 'dropout': 0.46158872268568446, 'batch_norm': False, 'lr': 6.759072896128842e-06, 'weight_decay': 5.121216546473883e-07, 'epochs': 114, 'loss': 'mae', 'optimizer': 'adam', 'graph_mode': 'off', 'use_snp_selection': False}. Best is trial 21 with value: 0.3720808894282361.
[I 2025-12-06 06:27:18,546] Trial 32 finished with value: 0.36796003825911977 and parameters: {'model_type': 'mlp', 'hidden_dims': '[512, 256]', 'dropout': 0.44699248740723924, 'batch_norm': False, 'lr': 7.87797143099999e-06, 'weight_decay': 1.8047293287110543e-07, 'epochs': 131, 'loss': 'mae', 'optimizer': 'adam', 'graph_mode': 'off', 'use_snp_selection': False}. Best is trial 21 with value: 0.3720808894282361.
[I 2025-12-06 06:27:40,350] Trial 33 finished with value: 0.36084514739277157 and parameters: {'model_type': 'mlp', 'hidden_dims': '[512, 256]', 'dropout': 0.5027576918164378, 'batch_norm': False, 'lr': 4.46663319560005e-06, 'weight_decay': 4.6247483900879735e-07, 'epochs': 86, 'loss': 'mae', 'optimizer': 'adam', 'graph_mode': 'off', 'use_snp_selection': False}. Best is trial 21 with value: 0.3720808894282361.
[I 2025-12-06 06:28:17,580] Trial 34 finished with value: 0.3674837073086369 and parameters: {'model_type': 'mlp', 'hidden_dims': '[512, 256]', 'dropout': 0.4013096429344461, 'batch_norm': False, 'lr': 2.941899092415757e-06, 'weight_decay': 9.625972017661873e-06, 'epochs': 166, 'loss': 'mae', 'optimizer': 'adam', 'graph_mode': 'off', 'use_snp_selection': False}. Best is trial 21 with value: 0.3720808894282361.
[I 2025-12-06 06:28:46,965] Trial 35 finished with value: 0.34328951863701923 and parameters: {'model_type': 'mlp', 'hidden_dims': '[512, 256]', 'dropout': 0.43024169205778806, 'batch_norm': True, 'lr': 1.4683928719456792e-05, 'weight_decay': 2.9682324121188565e-07, 'epochs': 124, 'loss': 'mae', 'optimizer': 'adam', 'graph_mode': 'off', 'use_snp_selection': False}. Best is trial 21 with value: 0.3720808894282361.
[I 2025-12-06 06:29:32,305] Trial 36 finished with value: 0.3695684726540861 and parameters: {'model_type': 'mlp', 'hidden_dims': '[256, 128]', 'dropout': 0.4782706192992096, 'batch_norm': False, 'lr': 3.7220960286882353e-05, 'weight_decay': 9.986567849992513e-07, 'epochs': 75, 'loss': 'mse', 'optimizer': 'adam', 'graph_mode': 'off', 'use_snp_selection': True, 'num_snps': 58661}. Best is trial 21 with value: 0.3720808894282361.
[I 2025-12-06 06:30:16,614] Trial 37 finished with value: 0.3628803231808315 and parameters: {'model_type': 'mlp', 'hidden_dims': '[256, 128]', 'dropout': 0.5978476739585556, 'batch_norm': False, 'lr': 4.25516566759177e-05, 'weight_decay': 1.1722695459305586e-06, 'epochs': 71, 'loss': 'mse', 'optimizer': 'adam', 'graph_mode': 'off', 'use_snp_selection': True, 'num_snps': 57733}. Best is trial 21 with value: 0.3720808894282361.
[I 2025-12-06 06:30:57,420] Trial 38 finished with value: 0.3467574730378339 and parameters: {'model_type': 'mlp', 'hidden_dims': '[256, 128]', 'dropout': 0.22487044772394038, 'batch_norm': True, 'lr': 8.405866960382371e-05, 'weight_decay': 2.801734495115805e-06, 'epochs': 82, 'loss': 'mse', 'optimizer': 'adam', 'graph_mode': 'off', 'use_snp_selection': True, 'num_snps': 46312}. Best is trial 21 with value: 0.3720808894282361.
[I 2025-12-06 06:31:32,129] Trial 39 finished with value: 0.37063946641839063 and parameters: {'model_type': 'mlp', 'hidden_dims': '[256, 128]', 'dropout': 0.3686100469590262, 'batch_norm': False, 'lr': 5.239903767578904e-06, 'weight_decay': 0.00044493460820908473, 'epochs': 252, 'loss': 'mse', 'optimizer': 'adam', 'graph_mode': 'off', 'use_snp_selection': True, 'num_snps': 19621}. Best is trial 21 with value: 0.3720808894282361.
[I 2025-12-06 06:32:09,282] Trial 40 finished with value: 0.3379336651164544 and parameters: {'model_type': 'mlp', 'hidden_dims': '[256, 128]', 'dropout': 0.3020424669440511, 'batch_norm': True, 'lr': 3.844259490192248e-05, 'weight_decay': 0.0006417234961516584, 'epochs': 261, 'loss': 'mse', 'optimizer': 'adam', 'graph_mode': 'off', 'use_snp_selection': True, 'num_snps': 22627}. Best is trial 21 with value: 0.3720808894282361.
[I 2025-12-06 06:32:47,870] Trial 41 finished with value: 0.366599060995517 and parameters: {'model_type': 'mlp', 'hidden_dims': '[256, 128]', 'dropout': 0.3660998823935344, 'batch_norm': False, 'lr': 5.282389168112648e-06, 'weight_decay': 0.0003122296719157765, 'epochs': 305, 'loss': 'mse', 'optimizer': 'adam', 'graph_mode': 'off', 'use_snp_selection': True, 'num_snps': 22619}. Best is trial 21 with value: 0.3720808894282361.
[I 2025-12-06 06:33:17,976] Trial 42 finished with value: 0.3334280566929961 and parameters: {'model_type': 'mlp', 'hidden_dims': '[256, 128]', 'dropout': 0.5241204994950637, 'batch_norm': False, 'lr': 1.7626886286391818e-06, 'weight_decay': 0.00011710406092456301, 'epochs': 220, 'loss': 'mse', 'optimizer': 'adam', 'graph_mode': 'off', 'use_snp_selection': True, 'num_snps': 13587}. Best is trial 21 with value: 0.3720808894282361.
[I 2025-12-06 06:34:07,118] Trial 43 finished with value: 0.36954599802955296 and parameters: {'model_type': 'mlp', 'hidden_dims': '[256, 128]', 'dropout': 0.571634077392011, 'batch_norm': False, 'lr': 1.056579524911673e-05, 'weight_decay': 4.044258877369232e-05, 'epochs': 189, 'loss': 'mse', 'optimizer': 'adam', 'graph_mode': 'off', 'use_snp_selection': True, 'num_snps': 48301}. Best is trial 21 with value: 0.3720808894282361.
[I 2025-12-06 06:34:55,358] Trial 44 finished with value: 0.37286893305453894 and parameters: {'model_type': 'mlp', 'hidden_dims': '[256, 128]', 'dropout': 0.5670180376450761, 'batch_norm': False, 'lr': 1.0887989165222804e-05, 'weight_decay': 0.0006026646468404879, 'epochs': 159, 'loss': 'mse', 'optimizer': 'adam', 'graph_mode': 'off', 'use_snp_selection': True, 'num_snps': 50579}. Best is trial 44 with value: 0.37286893305453894.
[I 2025-12-06 06:35:43,707] Trial 45 finished with value: 0.36469574380611836 and parameters: {'model_type': 'mlp', 'hidden_dims': '[256, 128]', 'dropout': 0.47639728564990724, 'batch_norm': False, 'lr': 2.0826188532084093e-05, 'weight_decay': 0.0005209262672949068, 'epochs': 156, 'loss': 'mse', 'optimizer': 'adam', 'graph_mode': 'off', 'use_snp_selection': True, 'num_snps': 51483}. Best is trial 44 with value: 0.37286893305453894.
[I 2025-12-06 06:36:35,104] Trial 46 finished with value: 0.33498200229230646 and parameters: {'model_type': 'mlp', 'hidden_dims': '[256, 128]', 'dropout': 0.5688380538797206, 'batch_norm': True, 'lr': 9.45930002981122e-06, 'weight_decay': 0.000961215302209712, 'epochs': 193, 'loss': 'mse', 'optimizer': 'adam', 'graph_mode': 'off', 'use_snp_selection': True, 'num_snps': 51087}. Best is trial 44 with value: 0.37286893305453894.
[I 2025-12-06 06:37:30,925] Trial 47 finished with value: 0.34418874830810914 and parameters: {'model_type': 'mlp', 'hidden_dims': '[512, 64]', 'dropout': 0.3876849559467834, 'batch_norm': False, 'lr': 1.7067316701583975e-05, 'weight_decay': 0.00021072755080847556, 'epochs': 182, 'loss': 'mse', 'optimizer': 'adam', 'graph_mode': 'off', 'use_snp_selection': True, 'num_snps': 40928}. Best is trial 44 with value: 0.37286893305453894.
[I 2025-12-06 06:38:29,555] Trial 48 finished with value: 0.3473609751863095 and parameters: {'model_type': 'mlp', 'hidden_dims': '[512, 128]', 'dropout': 0.31771350776078777, 'batch_norm': False, 'lr': 2.8324222191042043e-05, 'weight_decay': 0.0004929947943214659, 'epochs': 141, 'loss': 'mse', 'optimizer': 'adam', 'graph_mode': 'off', 'use_snp_selection': True, 'num_snps': 51750}. Best is trial 44 with value: 0.37286893305453894.
[I 2025-12-06 06:39:15,183] Trial 49 finished with value: 0.36937377243154124 and parameters: {'model_type': 'mlp', 'hidden_dims': '[256, 128]', 'dropout': 0.40706774987285377, 'batch_norm': False, 'lr': 1.1732168846690883e-05, 'weight_decay': 1.3134867405017843e-05, 'epochs': 106, 'loss': 'mse', 'optimizer': 'adam', 'graph_mode': 'off', 'use_snp_selection': True, 'num_snps': 53647}. Best is trial 44 with value: 0.37286893305453894.
[I 2025-12-06 06:39:52,834] Trial 50 finished with value: 0.3260579563725795 and parameters: {'model_type': 'mlp', 'hidden_dims': '[256, 128, 64]', 'dropout': 0.3735497850058561, 'batch_norm': False, 'lr': 0.00016865602831245648, 'weight_decay': 0.00011918345439052906, 'epochs': 161, 'loss': 'mse', 'optimizer': 'adam', 'graph_mode': 'off', 'use_snp_selection': True, 'num_snps': 30688}. Best is trial 44 with value: 0.37286893305453894.
[I 2025-12-06 06:40:53,614] Trial 51 finished with value: 0.36364659134953914 and parameters: {'model_type': 'mlp', 'hidden_dims': '[256, 128]', 'dropout': 0.568897560276483, 'batch_norm': False, 'lr': 1.2375846961973773e-05, 'weight_decay': 1.4810475564819067e-07, 'epochs': 247, 'loss': 'mse', 'optimizer': 'adam', 'graph_mode': 'off', 'use_snp_selection': True, 'num_snps': 59426}. Best is trial 44 with value: 0.37286893305453894.
[I 2025-12-06 06:41:44,046] Trial 52 finished with value: 0.37052426395311067 and parameters: {'model_type': 'mlp', 'hidden_dims': '[256, 128]', 'dropout': 0.5857081090038185, 'batch_norm': False, 'lr': 5.995374855340303e-06, 'weight_decay': 1.8053248957175905e-06, 'epochs': 213, 'loss': 'mse', 'optimizer': 'adam', 'graph_mode': 'off', 'use_snp_selection': True, 'num_snps': 47170}. Best is trial 44 with value: 0.37286893305453894.
[I 2025-12-06 06:42:32,273] Trial 53 finished with value: 0.3714744704315499 and parameters: {'model_type': 'mlp', 'hidden_dims': '[256, 128]', 'dropout': 0.5800386662405257, 'batch_norm': False, 'lr': 6.815879499205457e-06, 'weight_decay': 8.238175871192048e-07, 'epochs': 207, 'loss': 'mse', 'optimizer': 'adam', 'graph_mode': 'off', 'use_snp_selection': True, 'num_snps': 44506}. Best is trial 44 with value: 0.37286893305453894.
[I 2025-12-06 06:43:16,399] Trial 54 finished with value: 0.36573001584587245 and parameters: {'model_type': 'mlp', 'hidden_dims': '[256, 128]', 'dropout': 0.2607450673909738, 'batch_norm': False, 'lr': 4.1526029661181795e-06, 'weight_decay': 1.6078426090105525e-06, 'epochs': 212, 'loss': 'mse', 'optimizer': 'adam', 'graph_mode': 'off', 'use_snp_selection': True, 'num_snps': 37042}. Best is trial 44 with value: 0.37286893305453894.
[I 2025-12-06 06:44:03,277] Trial 55 finished with value: 0.3671319791713362 and parameters: {'model_type': 'mlp', 'hidden_dims': '[256, 128]', 'dropout': 0.5129160560587401, 'batch_norm': False, 'lr': 2.529148200914174e-06, 'weight_decay': 6.999269045698605e-07, 'epochs': 202, 'loss': 'mse', 'optimizer': 'adam', 'graph_mode': 'off', 'use_snp_selection': True, 'num_snps': 42144}. Best is trial 44 with value: 0.37286893305453894.
[I 2025-12-06 06:45:18,667] Trial 56 finished with value: 0.3648456799122991 and parameters: {'model_type': 'mlp', 'hidden_dims': '[512, 64]', 'dropout': 0.5994411261008696, 'batch_norm': False, 'lr': 6.669291295866529e-06, 'weight_decay': 1.8206496487648581e-06, 'epochs': 231, 'loss': 'mse', 'optimizer': 'adam', 'graph_mode': 'off', 'use_snp_selection': True, 'num_snps': 54776}. Best is trial 44 with value: 0.37286893305453894.
[I 2025-12-06 06:46:13,268] Trial 57 finished with value: 0.32939155508812534 and parameters: {'model_type': 'mlp', 'hidden_dims': '[256, 128]', 'dropout': 0.4825484865226821, 'batch_norm': True, 'lr': 6.287252266693846e-06, 'weight_decay': 4.706990197281427e-06, 'epochs': 263, 'loss': 'mse', 'optimizer': 'adam', 'graph_mode': 'off', 'use_snp_selection': True, 'num_snps': 47492}. Best is trial 44 with value: 0.37286893305453894.
[I 2025-12-06 06:47:05,452] Trial 58 finished with value: 0.36921827196568613 and parameters: {'model_type': 'mlp', 'hidden_dims': '[256, 128]', 'dropout': 0.5476792194949891, 'batch_norm': False, 'lr': 3.3518755859995195e-06, 'weight_decay': 1.033740870772269e-06, 'epochs': 179, 'loss': 'mse', 'optimizer': 'adam', 'graph_mode': 'off', 'use_snp_selection': True, 'num_snps': 55086}. Best is trial 44 with value: 0.37286893305453894.
[I 2025-12-06 06:47:47,201] Trial 59 finished with value: 0.36713710251653503 and parameters: {'model_type': 'mlp', 'hidden_dims': '[512, 128]', 'dropout': 0.5366223198583215, 'batch_norm': False, 'lr': 8.692808634610077e-06, 'weight_decay': 2.1862828862227494e-06, 'epochs': 135, 'loss': 'mse', 'optimizer': 'adam', 'graph_mode': 'off', 'use_snp_selection': True, 'num_snps': 28956}. Best is trial 44 with value: 0.37286893305453894.
[I 2025-12-06 06:48:27,512] Trial 60 finished with value: 0.36480159649984445 and parameters: {'model_type': 'mlp', 'hidden_dims': '[128, 64]', 'dropout': 0.5872684851761802, 'batch_norm': False, 'lr': 4.7699230447253685e-06, 'weight_decay': 3.454428598418462e-07, 'epochs': 153, 'loss': 'mse', 'optimizer': 'adam', 'graph_mode': 'off', 'use_snp_selection': True, 'num_snps': 45793}. Best is trial 44 with value: 0.37286893305453894.
[I 2025-12-06 06:49:15,702] Trial 61 finished with value: 0.36834462757072434 and parameters: {'model_type': 'mlp', 'hidden_dims': '[256, 128]', 'dropout': 0.5707629183655625, 'batch_norm': False, 'lr': 1.6407604031347384e-05, 'weight_decay': 8.392365332935564e-07, 'epochs': 186, 'loss': 'mse', 'optimizer': 'adam', 'graph_mode': 'off', 'use_snp_selection': True, 'num_snps': 46470}. Best is trial 44 with value: 0.37286893305453894.
[I 2025-12-06 06:50:07,813] Trial 62 finished with value: 0.3678571638108661 and parameters: {'model_type': 'mlp', 'hidden_dims': '[256, 128]', 'dropout': 0.5801680573653114, 'batch_norm': False, 'lr': 9.660386525529622e-06, 'weight_decay': 4.158027026613584e-06, 'epochs': 221, 'loss': 'mse', 'optimizer': 'adam', 'graph_mode': 'off', 'use_snp_selection': True, 'num_snps': 48985}. Best is trial 44 with value: 0.37286893305453894.
[I 2025-12-06 06:50:53,406] Trial 63 finished with value: 0.3689410503540963 and parameters: {'model_type': 'mlp', 'hidden_dims': '[256, 128]', 'dropout': 0.5578404958019917, 'batch_norm': False, 'lr': 7.477771662708141e-06, 'weight_decay': 0.00044937179283964073, 'epochs': 200, 'loss': 'mse', 'optimizer': 'adam', 'graph_mode': 'off', 'use_snp_selection': True, 'num_snps': 40789}. Best is trial 44 with value: 0.37286893305453894.
[I 2025-12-06 06:51:47,608] Trial 64 finished with value: 0.34514665056776156 and parameters: {'model_type': 'mlp', 'hidden_dims': '[256, 128]', 'dropout': 0.5148359996805789, 'batch_norm': False, 'lr': 2.257466347425133e-05, 'weight_decay': 2.112532858131444e-07, 'epochs': 239, 'loss': 'mse', 'optimizer': 'adam', 'graph_mode': 'off', 'use_snp_selection': True, 'num_snps': 50405}. Best is trial 44 with value: 0.37286893305453894.
[I 2025-12-06 06:52:21,907] Trial 65 finished with value: 0.20759311135280947 and parameters: {'model_type': 'mlp', 'hidden_dims': '[256, 128, 64]', 'dropout': 0.5798765758169757, 'batch_norm': False, 'lr': 3.706513373374174e-06, 'weight_decay': 0.0007139739367112256, 'epochs': 44, 'loss': 'mse', 'optimizer': 'adam', 'graph_mode': 'off', 'use_snp_selection': True, 'num_snps': 35865}. Best is trial 44 with value: 0.37286893305453894.
[I 2025-12-06 06:53:12,007] Trial 66 finished with value: 0.20801962349593767 and parameters: {'model_type': 'mlp', 'hidden_dims': '[256, 128]', 'dropout': 0.48390971026878343, 'batch_norm': False, 'lr': 0.000990086976509957, 'weight_decay': 0.00022576171674757988, 'epochs': 251, 'loss': 'mse', 'optimizer': 'adam', 'graph_mode': 'off', 'use_snp_selection': True, 'num_snps': 43684}. Best is trial 44 with value: 0.37286893305453894.
[I 2025-12-06 06:54:06,389] Trial 67 finished with value: 0.35340075079357025 and parameters: {'model_type': 'mlp', 'hidden_dims': '[256, 128]', 'dropout': 0.5399103364950674, 'batch_norm': False, 'lr': 6.194357971820577e-05, 'weight_decay': 4.742166656613363e-05, 'epochs': 191, 'loss': 'mse', 'optimizer': 'adam', 'graph_mode': 'off', 'use_snp_selection': True, 'num_snps': 56918}. Best is trial 44 with value: 0.37286893305453894.
[I 2025-12-06 06:54:36,683] Trial 68 finished with value: 0.320442465485685 and parameters: {'model_type': 'mlp', 'hidden_dims': '[512, 64]', 'dropout': 0.4168768901521361, 'batch_norm': False, 'lr': 0.0005762452459924252, 'weight_decay': 3.6490268643375902e-06, 'epochs': 170, 'loss': 'mse', 'optimizer': 'adam', 'graph_mode': 'off', 'use_snp_selection': True, 'num_snps': 10828}. Best is trial 44 with value: 0.37286893305453894.
[I 2025-12-06 06:55:27,189] Trial 69 finished with value: 0.3617719408349428 and parameters: {'model_type': 'mlp', 'hidden_dims': '[256, 128]', 'dropout': 0.4420616414297145, 'batch_norm': False, 'lr': 5.6499565705680405e-06, 'weight_decay': 7.71312538276752e-06, 'epochs': 287, 'loss': 'mse', 'optimizer': 'adam', 'graph_mode': 'off', 'use_snp_selection': True, 'num_snps': 39472}. Best is trial 44 with value: 0.37286893305453894.
