[I 2025-12-05 15:54:11,816] Trial 51 finished with value: 0.10262459387777943 and parameters: {'model_type': 'mlp', 'hidden_dims': '[256, 128, 64]', 'dropout': 0.5562298862788015, 'batch_norm': True, 'lr': 0.00040807281309360524, 'weight_decay': 7.978741280897134e-06, 'epochs': 325, 'loss': 'mse', 'optimizer': 'adam', 'graph_mode': 'off', 'use_snp_selection': True, 'num_snps': 48142}. Best is trial 29 with value: 0.12282764779048544.
[I 2025-12-05 15:54:14,534] Trial 52 finished with value: 0.08182129260395092 and parameters: {'model_type': 'mlp', 'hidden_dims': '[256, 128, 64]', 'dropout': 0.5420264318105247, 'batch_norm': True, 'lr': 0.0006699595076208231, 'weight_decay': 6.303278782971433e-06, 'epochs': 345, 'loss': 'mse', 'optimizer': 'adam', 'graph_mode': 'off', 'use_snp_selection': True, 'num_snps': 54610}. Best is trial 29 with value: 0.12282764779048544.
[I 2025-12-05 15:54:16,739] Trial 53 finished with value: 0.1129443784969722 and parameters: {'model_type': 'mlp', 'hidden_dims': '[256, 128, 64]', 'dropout': 0.5794835065775228, 'batch_norm': True, 'lr': 0.0003041253658281653, 'weight_decay': 3.165903291246989e-06, 'epochs': 280, 'loss': 'mse', 'optimizer': 'adam', 'graph_mode': 'off', 'use_snp_selection': True, 'num_snps': 43344}. Best is trial 29 with value: 0.12282764779048544.
[I 2025-12-05 15:54:18,775] Trial 54 finished with value: 0.09168107125596615 and parameters: {'model_type': 'mlp', 'hidden_dims': '[128, 64]', 'dropout': 0.5786985928133367, 'batch_norm': True, 'lr': 0.000311410369609235, 'weight_decay': 3.6005142236654377e-06, 'epochs': 278, 'loss': 'mae', 'optimizer': 'adam', 'graph_mode': 'off', 'use_snp_selection': True, 'num_snps': 42974}. Best is trial 29 with value: 0.12282764779048544.
[I 2025-12-05 15:54:20,858] Trial 55 finished with value: 0.06064851475488391 and parameters: {'model_type': 'mlp', 'hidden_dims': '[256, 128, 64]', 'dropout': 0.5177470873282934, 'batch_norm': True, 'lr': 0.00014088285937544987, 'weight_decay': 1.627405854209284e-06, 'epochs': 263, 'loss': 'mse', 'optimizer': 'adam', 'graph_mode': 'off', 'use_snp_selection': True, 'num_snps': 43358}. Best is trial 29 with value: 0.12282764779048544.
[I 2025-12-05 15:54:22,849] Trial 56 finished with value: 0.10939727617248338 and parameters: {'model_type': 'mlp', 'hidden_dims': '[512, 64]', 'dropout': 0.48499233046249235, 'batch_norm': True, 'lr': 0.00021193638347936005, 'weight_decay': 0.0007580672327126504, 'epochs': 298, 'loss': 'mse', 'optimizer': 'adam', 'graph_mode': 'off', 'use_snp_selection': True, 'num_snps': 36899}. Best is trial 29 with value: 0.12282764779048544.
[I 2025-12-05 15:54:25,024] Trial 57 finished with value: 0.11448057067251478 and parameters: {'model_type': 'mlp', 'hidden_dims': '[512, 64]', 'dropout': 0.5827068419820169, 'batch_norm': True, 'lr': 0.00011383132203465243, 'weight_decay': 0.0004412804899192612, 'epochs': 305, 'loss': 'mse', 'optimizer': 'adam', 'graph_mode': 'off', 'use_snp_selection': True, 'num_snps': 39550}. Best is trial 29 with value: 0.12282764779048544.
[I 2025-12-05 15:54:27,085] Trial 58 finished with value: 0.061308085708667255 and parameters: {'model_type': 'mlp', 'hidden_dims': '[512, 64]', 'dropout': 0.48592851137761867, 'batch_norm': False, 'lr': 9.889506762681326e-05, 'weight_decay': 0.0006219577227448957, 'epochs': 296, 'loss': 'mae', 'optimizer': 'adam', 'graph_mode': 'off', 'use_snp_selection': True, 'num_snps': 37637}. Best is trial 29 with value: 0.12282764779048544.
[I 2025-12-05 15:54:28,943] Trial 59 finished with value: 0.0969482935034109 and parameters: {'model_type': 'mlp', 'hidden_dims': '[512, 64]', 'dropout': 0.2917399210418099, 'batch_norm': True, 'lr': 6.650275696394058e-05, 'weight_decay': 0.0008291299252334235, 'epochs': 126, 'loss': 'mse', 'optimizer': 'adam', 'graph_mode': 'off', 'use_snp_selection': True, 'num_snps': 35972}. Best is trial 29 with value: 0.12282764779048544.
[I 2025-12-05 15:54:30,537] Trial 60 finished with value: 0.10865998986669675 and parameters: {'model_type': 'mlp', 'hidden_dims': '[512, 64]', 'dropout': 0.563656887150274, 'batch_norm': True, 'lr': 0.00012373284453897547, 'weight_decay': 0.0004777077409788814, 'epochs': 215, 'loss': 'mse', 'optimizer': 'adam', 'graph_mode': 'off', 'use_snp_selection': True, 'num_snps': 26209}. Best is trial 29 with value: 0.12282764779048544.
[I 2025-12-05 15:54:32,756] Trial 61 finished with value: 0.09675085222607521 and parameters: {'model_type': 'mlp', 'hidden_dims': '[512, 64]', 'dropout': 0.5853441268966171, 'batch_norm': True, 'lr': 0.00020635623477441748, 'weight_decay': 0.00035833892285868475, 'epochs': 310, 'loss': 'mse', 'optimizer': 'adam', 'graph_mode': 'off', 'use_snp_selection': True, 'num_snps': 39782}. Best is trial 29 with value: 0.12282764779048544.
[I 2025-12-05 15:54:34,615] Trial 62 finished with value: 0.10439813539339418 and parameters: {'model_type': 'mlp', 'hidden_dims': '[512, 64]', 'dropout': 0.5964985586993765, 'batch_norm': True, 'lr': 0.00029206312154631675, 'weight_decay': 0.00010960956076773523, 'epochs': 299, 'loss': 'mse', 'optimizer': 'adam', 'graph_mode': 'off', 'use_snp_selection': True, 'num_snps': 32817}. Best is trial 29 with value: 0.12282764779048544.
[I 2025-12-05 15:54:36,998] Trial 63 finished with value: 0.0921314286304433 and parameters: {'model_type': 'mlp', 'hidden_dims': '[512, 64]', 'dropout': 0.5642207276146097, 'batch_norm': True, 'lr': 0.0005292695974962006, 'weight_decay': 2.8545742261466896e-06, 'epochs': 286, 'loss': 'mse', 'optimizer': 'adam', 'graph_mode': 'off', 'use_snp_selection': True, 'num_snps': 44501}. Best is trial 29 with value: 0.12282764779048544.
[I 2025-12-05 15:54:39,045] Trial 64 finished with value: 0.12741175414075345 and parameters: {'model_type': 'mlp', 'hidden_dims': '[512, 128]', 'dropout': 0.43119923995984893, 'batch_norm': True, 'lr': 0.00021517610289576683, 'weight_decay': 4.853476829832484e-06, 'epochs': 318, 'loss': 'mse', 'optimizer': 'adam', 'graph_mode': 'off', 'use_snp_selection': True, 'num_snps': 37269}. Best is trial 64 with value: 0.12741175414075345.
[I 2025-12-05 15:54:41,027] Trial 65 finished with value: 0.097620209351402 and parameters: {'model_type': 'mlp', 'hidden_dims': '[512, 128]', 'dropout': 0.43652005893340506, 'batch_norm': True, 'lr': 0.000147387024368938, 'weight_decay': 4.801704873241554e-06, 'epochs': 315, 'loss': 'mse', 'optimizer': 'adam', 'graph_mode': 'off', 'use_snp_selection': True, 'num_snps': 35915}. Best is trial 64 with value: 0.12741175414075345.
[I 2025-12-05 15:54:43,078] Trial 66 finished with value: 0.10264236765462563 and parameters: {'model_type': 'mlp', 'hidden_dims': '[512, 128]', 'dropout': 0.394408232374347, 'batch_norm': True, 'lr': 5.1367906488270695e-05, 'weight_decay': 2.4998589683655534e-06, 'epochs': 275, 'loss': 'mse', 'optimizer': 'adam', 'graph_mode': 'off', 'use_snp_selection': True, 'num_snps': 38107}. Best is trial 64 with value: 0.12741175414075345.
[I 2025-12-05 15:54:43,728] Trial 67 finished with value: 0.06484895257053257 and parameters: {'model_type': 'mlp', 'hidden_dims': '[512, 128]', 'dropout': 0.4871824887333242, 'batch_norm': True, 'lr': 0.0002069523094810701, 'weight_decay': 1.2218072664970883e-06, 'epochs': 61, 'loss': 'mse', 'optimizer': 'adam', 'graph_mode': 'off', 'use_snp_selection': True, 'num_snps': 3792}. Best is trial 64 with value: 0.12741175414075345.
[I 2025-12-05 15:54:44,862] Trial 68 finished with value: 0.09508068850499495 and parameters: {'model_type': 'mlp', 'hidden_dims': '[512, 128]', 'dropout': 0.4293436696158945, 'batch_norm': True, 'lr': 0.0002666290052980858, 'weight_decay': 0.0005141227568793805, 'epochs': 263, 'loss': 'mse', 'optimizer': 'adam', 'graph_mode': 'off', 'use_snp_selection': True, 'num_snps': 9624}. Best is trial 64 with value: 0.12741175414075345.
[I 2025-12-05 15:54:47,359] Trial 69 finished with value: 0.05018978385063902 and parameters: {'model_type': 'mlp', 'hidden_dims': '[512, 64]', 'dropout': 0.3636562625729908, 'batch_norm': True, 'lr': 6.204313443637617e-06, 'weight_decay': 0.0009416355519891224, 'epochs': 341, 'loss': 'mae', 'optimizer': 'adam', 'graph_mode': 'off', 'use_snp_selection': True, 'num_snps': 42641}. Best is trial 64 with value: 0.12741175414075345.
[I 2025-12-05 15:54:49,152] Trial 70 finished with value: 0.08061126155333967 and parameters: {'model_type': 'mlp', 'hidden_dims': '[512, 256]', 'dropout': 0.4065062523485472, 'batch_norm': False, 'lr': 7.642768315076312e-05, 'weight_decay': 0.00026938910024926113, 'epochs': 182, 'loss': 'mse', 'optimizer': 'adam', 'graph_mode': 'off', 'use_snp_selection': True, 'num_snps': 33875}. Best is trial 64 with value: 0.12741175414075345.
[I 2025-12-05 15:54:51,572] Trial 71 finished with value: 0.08875337591907391 and parameters: {'model_type': 'mlp', 'hidden_dims': '[512, 64]', 'dropout': 0.5782146414498861, 'batch_norm': True, 'lr': 0.0003569741217571157, 'weight_decay': 1.1064721906973891e-05, 'epochs': 306, 'loss': 'mse', 'optimizer': 'adam', 'graph_mode': 'off', 'use_snp_selection': True, 'num_snps': 45494}. Best is trial 64 with value: 0.12741175414075345.
[I 2025-12-05 15:54:53,555] Trial 72 finished with value: 0.10337091659330544 and parameters: {'model_type': 'mlp', 'hidden_dims': '[256, 128]', 'dropout': 0.5189803974999708, 'batch_norm': True, 'lr': 0.0004592362790151592, 'weight_decay': 4.340602788398846e-06, 'epochs': 323, 'loss': 'mse', 'optimizer': 'adam', 'graph_mode': 'off', 'use_snp_selection': True, 'num_snps': 40572}. Best is trial 64 with value: 0.12741175414075345.
[I 2025-12-05 15:54:56,239] Trial 73 finished with value: 0.09730960644879635 and parameters: {'model_type': 'mlp', 'hidden_dims': '[512, 128]', 'dropout': 0.4590296024049453, 'batch_norm': True, 'lr': 0.000555625756484043, 'weight_decay': 1.369869602034795e-05, 'epochs': 338, 'loss': 'mse', 'optimizer': 'adam', 'graph_mode': 'off', 'use_snp_selection': True, 'num_snps': 50282}. Best is trial 64 with value: 0.12741175414075345.
[I 2025-12-05 15:54:58,581] Trial 74 finished with value: 0.08954986872136514 and parameters: {'model_type': 'mlp', 'hidden_dims': '[128, 64]', 'dropout': 0.539363768731058, 'batch_norm': True, 'lr': 0.000834227641558384, 'weight_decay': 5.503090857836253e-06, 'epochs': 289, 'loss': 'mse', 'optimizer': 'adam', 'graph_mode': 'off', 'use_snp_selection': True, 'num_snps': 55970}. Best is trial 64 with value: 0.12741175414075345.
[I 2025-12-05 15:55:00,546] Trial 75 finished with value: 0.09364245653071074 and parameters: {'model_type': 'mlp', 'hidden_dims': '[256, 128, 64]', 'dropout': 0.5070611010980657, 'batch_norm': True, 'lr': 0.00022613329598394918, 'weight_decay': 2.2379406115701673e-06, 'epochs': 301, 'loss': 'mse', 'optimizer': 'adam', 'graph_mode': 'off', 'use_snp_selection': True, 'num_snps': 31457}. Best is trial 64 with value: 0.12741175414075345.
[I 2025-12-05 15:55:02,146] Trial 76 finished with value: 0.07759706944504116 and parameters: {'model_type': 'mlp', 'hidden_dims': '[512, 64]', 'dropout': 0.5494381035205803, 'batch_norm': True, 'lr': 0.00011395764913357764, 'weight_decay': 3.7477102488102546e-05, 'epochs': 158, 'loss': 'mse', 'optimizer': 'adam', 'graph_mode': 'off', 'use_snp_selection': True, 'num_snps': 26724}. Best is trial 64 with value: 0.12741175414075345.
[I 2025-12-05 15:55:04,540] Trial 77 finished with value: 0.08532762074470995 and parameters: {'model_type': 'mlp', 'hidden_dims': '[256, 128]', 'dropout': 0.5723492307760486, 'batch_norm': True, 'lr': 0.00033215289892972493, 'weight_decay': 1.7907912122608054e-06, 'epochs': 313, 'loss': 'mse', 'optimizer': 'adam', 'graph_mode': 'off', 'use_snp_selection': True, 'num_snps': 51688}. Best is trial 64 with value: 0.12741175414075345.
[I 2025-12-05 15:55:06,425] Trial 78 finished with value: 0.10075658343657597 and parameters: {'model_type': 'mlp', 'hidden_dims': '[256, 128, 64]', 'dropout': 0.47904117098442695, 'batch_norm': True, 'lr': 0.00018727089497043447, 'weight_decay': 6.87230966143001e-07, 'epochs': 242, 'loss': 'mse', 'optimizer': 'adam', 'graph_mode': 'off', 'use_snp_selection': True, 'num_snps': 36730}. Best is trial 64 with value: 0.12741175414075345.
[I 2025-12-05 15:55:09,362] Trial 79 finished with value: 0.1230798623964545 and parameters: {'model_type': 'mlp', 'hidden_dims': '[512, 128]', 'dropout': 0.44759596025327175, 'batch_norm': True, 'lr': 0.00041323427790785505, 'weight_decay': 6.31694743799765e-06, 'epochs': 280, 'loss': 'mse', 'optimizer': 'adam', 'graph_mode': 'off', 'use_snp_selection': True, 'num_snps': 59826}. Best is trial 64 with value: 0.12741175414075345.
[I 2025-12-05 15:55:11,546] Trial 80 finished with value: 0.11835823184487491 and parameters: {'model_type': 'mlp', 'hidden_dims': '[512, 128]', 'dropout': 0.44633904755460024, 'batch_norm': True, 'lr': 0.0004131388115368526, 'weight_decay': 6.526595583052118e-06, 'epochs': 273, 'loss': 'mse', 'optimizer': 'adam', 'graph_mode': 'off', 'use_snp_selection': True, 'num_snps': 41324}. Best is trial 64 with value: 0.12741175414075345.
[I 2025-12-05 15:55:13,750] Trial 81 finished with value: 0.09763444630099612 and parameters: {'model_type': 'mlp', 'hidden_dims': '[512, 128]', 'dropout': 0.4502363364111619, 'batch_norm': True, 'lr': 0.00042812667468158396, 'weight_decay': 6.3221555968223196e-06, 'epochs': 258, 'loss': 'mse', 'optimizer': 'adam', 'graph_mode': 'off', 'use_snp_selection': True, 'num_snps': 41414}. Best is trial 64 with value: 0.12741175414075345.
[I 2025-12-05 15:55:16,893] Trial 82 finished with value: 0.10488360726466336 and parameters: {'model_type': 'mlp', 'hidden_dims': '[512, 128]', 'dropout': 0.42298442375531686, 'batch_norm': True, 'lr': 0.0005848243374990773, 'weight_decay': 3.545159972976072e-06, 'epochs': 273, 'loss': 'mse', 'optimizer': 'adam', 'graph_mode': 'off', 'use_snp_selection': True, 'num_snps': 59300}. Best is trial 64 with value: 0.12741175414075345.
[I 2025-12-05 15:55:19,018] Trial 83 finished with value: 0.11048865470815412 and parameters: {'model_type': 'mlp', 'hidden_dims': '[512, 128]', 'dropout': 0.46196686203159343, 'batch_norm': True, 'lr': 0.0002935121603235623, 'weight_decay': 1.468515164982521e-05, 'epochs': 283, 'loss': 'mse', 'optimizer': 'adam', 'graph_mode': 'off', 'use_snp_selection': True, 'num_snps': 38419}. Best is trial 64 with value: 0.12741175414075345.
[I 2025-12-05 15:55:21,162] Trial 84 finished with value: 0.11319287151388295 and parameters: {'model_type': 'mlp', 'hidden_dims': '[512, 128]', 'dropout': 0.46248178062623696, 'batch_norm': True, 'lr': 0.0008143535800335999, 'weight_decay': 1.269299783839058e-05, 'epochs': 285, 'loss': 'mse', 'optimizer': 'adam', 'graph_mode': 'off', 'use_snp_selection': True, 'num_snps': 39053}. Best is trial 64 with value: 0.12741175414075345.
[I 2025-12-05 15:55:23,547] Trial 85 finished with value: 0.10339576294443775 and parameters: {'model_type': 'mlp', 'hidden_dims': '[512, 128]', 'dropout': 0.3859069601368562, 'batch_norm': True, 'lr': 0.0009086071163909124, 'weight_decay': 7.531244768058558e-06, 'epochs': 245, 'loss': 'mse', 'optimizer': 'adam', 'graph_mode': 'off', 'use_snp_selection': True, 'num_snps': 48268}. Best is trial 64 with value: 0.12741175414075345.
[I 2025-12-05 15:55:25,955] Trial 86 finished with value: 0.10679419375639686 and parameters: {'model_type': 'mlp', 'hidden_dims': '[512, 128]', 'dropout': 0.40973623734399167, 'batch_norm': True, 'lr': 0.0007506544685805509, 'weight_decay': 1.040403605711083e-05, 'epochs': 280, 'loss': 'mse', 'optimizer': 'adam', 'graph_mode': 'off', 'use_snp_selection': True, 'num_snps': 45874}. Best is trial 64 with value: 0.12741175414075345.
[I 2025-12-05 15:55:28,047] Trial 87 finished with value: 0.048207327732866526 and parameters: {'model_type': 'mlp', 'hidden_dims': '[512, 128]', 'dropout': 0.4431501710812358, 'batch_norm': False, 'lr': 0.000414578641444737, 'weight_decay': 2.0369318481035856e-05, 'epochs': 224, 'loss': 'mse', 'optimizer': 'adam', 'graph_mode': 'off', 'use_snp_selection': True, 'num_snps': 41858}. Best is trial 64 with value: 0.12741175414075345.
[I 2025-12-05 15:55:30,883] Trial 88 finished with value: 0.10897118647150442 and parameters: {'model_type': 'mlp', 'hidden_dims': '[512, 128]', 'dropout': 0.4364703205943028, 'batch_norm': True, 'lr': 0.000524862353369857, 'weight_decay': 6.132047308799796e-06, 'epochs': 235, 'loss': 'mae', 'optimizer': 'adam', 'graph_mode': 'off', 'use_snp_selection': True, 'num_snps': 56545}. Best is trial 64 with value: 0.12741175414075345.
[I 2025-12-05 15:55:32,895] Trial 89 finished with value: 0.11047351434653126 and parameters: {'model_type': 'mlp', 'hidden_dims': '[512, 128]', 'dropout': 0.46413641532221844, 'batch_norm': True, 'lr': 0.0006422151586807829, 'weight_decay': 2.726126379095926e-06, 'epochs': 256, 'loss': 'mse', 'optimizer': 'adam', 'graph_mode': 'off', 'use_snp_selection': True, 'num_snps': 34522}. Best is trial 64 with value: 0.12741175414075345.
[I 2025-12-05 15:55:35,110] Trial 90 finished with value: 0.13143751993584177 and parameters: {'model_type': 'mlp', 'hidden_dims': '[512, 128]', 'dropout': 0.5034944510010425, 'batch_norm': True, 'lr': 0.0008500930638815599, 'weight_decay': 1.36424756811296e-06, 'epochs': 290, 'loss': 'mse', 'optimizer': 'adam', 'graph_mode': 'off', 'use_snp_selection': True, 'num_snps': 40013}. Best is trial 90 with value: 0.13143751993584177.
[I 2025-12-05 15:55:37,209] Trial 91 finished with value: 0.10147383086585356 and parameters: {'model_type': 'mlp', 'hidden_dims': '[512, 128]', 'dropout': 0.49527150421953925, 'batch_norm': True, 'lr': 0.0008092592701385464, 'weight_decay': 1.1451718889445071e-06, 'epochs': 292, 'loss': 'mse', 'optimizer': 'adam', 'graph_mode': 'off', 'use_snp_selection': True, 'num_snps': 38517}. Best is trial 90 with value: 0.13143751993584177.
[I 2025-12-05 15:55:39,522] Trial 92 finished with value: 0.10128913728463924 and parameters: {'model_type': 'mlp', 'hidden_dims': '[512, 128]', 'dropout': 0.5308034321447923, 'batch_norm': True, 'lr': 0.0004778932737157169, 'weight_decay': 1.3961966024672863e-06, 'epochs': 272, 'loss': 'mse', 'optimizer': 'adam', 'graph_mode': 'off', 'use_snp_selection': True, 'num_snps': 44495}. Best is trial 90 with value: 0.13143751993584177.
[I 2025-12-05 15:55:40,824] Trial 93 finished with value: 0.09175672558904882 and parameters: {'model_type': 'mlp', 'hidden_dims': '[512, 128]', 'dropout': 0.47383106006230313, 'batch_norm': True, 'lr': 0.0003902541090063979, 'weight_decay': 3.9717525946229915e-06, 'epochs': 291, 'loss': 'mse', 'optimizer': 'adam', 'graph_mode': 'off', 'use_snp_selection': True, 'num_snps': 16832}. Best is trial 90 with value: 0.13143751993584177.
[I 2025-12-05 15:55:42,887] Trial 94 finished with value: 0.0999209216370266 and parameters: {'model_type': 'mlp', 'hidden_dims': '[256, 128, 64]', 'dropout': 0.44668977275738164, 'batch_norm': True, 'lr': 0.0005979301498151829, 'weight_decay': 2.019545709527628e-06, 'epochs': 309, 'loss': 'mse', 'optimizer': 'adam', 'graph_mode': 'off', 'use_snp_selection': True, 'num_snps': 40464}. Best is trial 90 with value: 0.13143751993584177.
[I 2025-12-05 15:55:44,932] Trial 95 finished with value: 0.11379510554338738 and parameters: {'model_type': 'mlp', 'hidden_dims': '[512, 128]', 'dropout': 0.4132575645767349, 'batch_norm': True, 'lr': 0.0008555615193408674, 'weight_decay': 8.37110655960885e-07, 'epochs': 263, 'loss': 'mse', 'optimizer': 'adam', 'graph_mode': 'off', 'use_snp_selection': True, 'num_snps': 39230}. Best is trial 90 with value: 0.13143751993584177.
[I 2025-12-05 15:55:47,146] Trial 96 finished with value: 0.11771152255271931 and parameters: {'model_type': 'mlp', 'hidden_dims': '[512, 128]', 'dropout': 0.4190290125175439, 'batch_norm': True, 'lr': 0.0007748744330254602, 'weight_decay': 1.4775810159678e-06, 'epochs': 267, 'loss': 'mse', 'optimizer': 'adam', 'graph_mode': 'off', 'use_snp_selection': True, 'num_snps': 39327}. Best is trial 90 with value: 0.13143751993584177.
[I 2025-12-05 15:55:49,149] Trial 97 finished with value: 0.11802553977140866 and parameters: {'model_type': 'mlp', 'hidden_dims': '[512, 128]', 'dropout': 0.3616185225401945, 'batch_norm': True, 'lr': 0.000792524822567861, 'weight_decay': 8.30159869282571e-07, 'epochs': 262, 'loss': 'mse', 'optimizer': 'adam', 'graph_mode': 'off', 'use_snp_selection': True, 'num_snps': 35229}. Best is trial 90 with value: 0.13143751993584177.
[I 2025-12-05 15:55:50,925] Trial 98 finished with value: 0.11933781124829618 and parameters: {'model_type': 'mlp', 'hidden_dims': '[512, 128]', 'dropout': 0.35755797382296056, 'batch_norm': True, 'lr': 0.0007580729014643762, 'weight_decay': 7.783956527217066e-07, 'epochs': 264, 'loss': 'mse', 'optimizer': 'adam', 'graph_mode': 'off', 'use_snp_selection': True, 'num_snps': 30723}. Best is trial 90 with value: 0.13143751993584177.
[I 2025-12-05 15:55:52,571] Trial 99 finished with value: 0.11230334662177903 and parameters: {'model_type': 'mlp', 'hidden_dims': '[512, 128]', 'dropout': 0.35205716606478193, 'batch_norm': True, 'lr': 0.0006770134720496079, 'weight_decay': 4.927834993931727e-07, 'epochs': 247, 'loss': 'mse', 'optimizer': 'adam', 'graph_mode': 'off', 'use_snp_selection': True, 'num_snps': 28814}. Best is trial 90 with value: 0.13143751993584177.
[I 2025-12-05 15:55:54,033] Trial 100 finished with value: 0.039270407914303 and parameters: {'model_type': 'mlp', 'hidden_dims': '[512, 128]', 'dropout': 0.3793621851496552, 'batch_norm': False, 'lr': 0.0009960778812973892, 'weight_decay': 8.117867501243078e-07, 'epochs': 265, 'loss': 'mse', 'optimizer': 'adam', 'graph_mode': 'off', 'use_snp_selection': False}. Best is trial 90 with value: 0.13143751993584177.
