[I 2025-12-05 14:52:17,264] Trial 81 finished with value: 0.024702010483118486 and parameters: {'model_type': 'mlp', 'hidden_dims': '[128, 64]', 'dropout': 0.13445368554737389, 'batch_norm': True, 'lr': 0.00014480254514373565, 'weight_decay': 1.0354768987866479e-06, 'epochs': 139, 'loss': 'mae', 'optimizer': 'adam', 'graph_mode': 'off', 'use_snp_selection': False}. Best is trial 40 with value: 0.0739077423401802.
[I 2025-12-05 14:52:18,613] Trial 82 finished with value: 0.03636856642295308 and parameters: {'model_type': 'mlp', 'hidden_dims': '[512, 64]', 'dropout': 0.142364100653423, 'batch_norm': True, 'lr': 0.0001313026484718389, 'weight_decay': 3.1201144741522688e-06, 'epochs': 120, 'loss': 'mae', 'optimizer': 'adam', 'graph_mode': 'off', 'use_snp_selection': False}. Best is trial 40 with value: 0.0739077423401802.
[I 2025-12-05 14:52:19,409] Trial 83 finished with value: 0.0677458711172309 and parameters: {'model_type': 'mlp', 'hidden_dims': '[128, 64]', 'dropout': 0.18308088445502824, 'batch_norm': True, 'lr': 0.00018364796795735606, 'weight_decay': 3.6862417835498054e-07, 'epochs': 102, 'loss': 'mae', 'optimizer': 'adam', 'graph_mode': 'off', 'use_snp_selection': False}. Best is trial 40 with value: 0.0739077423401802.
[I 2025-12-05 14:52:20,175] Trial 84 finished with value: 0.049602702390374405 and parameters: {'model_type': 'mlp', 'hidden_dims': '[128, 64]', 'dropout': 0.177325699019724, 'batch_norm': True, 'lr': 0.000173718640696278, 'weight_decay': 3.577197241182002e-07, 'epochs': 86, 'loss': 'mae', 'optimizer': 'adam', 'graph_mode': 'off', 'use_snp_selection': False}. Best is trial 40 with value: 0.0739077423401802.
[I 2025-12-05 14:52:20,957] Trial 85 finished with value: 0.047566464085817314 and parameters: {'model_type': 'mlp', 'hidden_dims': '[128, 64]', 'dropout': 0.1903541271775131, 'batch_norm': True, 'lr': 0.00021092635694663737, 'weight_decay': 2.4648645601553833e-07, 'epochs': 102, 'loss': 'mae', 'optimizer': 'adam', 'graph_mode': 'off', 'use_snp_selection': False}. Best is trial 40 with value: 0.0739077423401802.
[I 2025-12-05 14:52:21,674] Trial 86 finished with value: 0.05489052720245381 and parameters: {'model_type': 'mlp', 'hidden_dims': '[128, 64]', 'dropout': 0.2045948850808756, 'batch_norm': True, 'lr': 0.000304604881350651, 'weight_decay': 7.410410320376576e-07, 'epochs': 57, 'loss': 'mse', 'optimizer': 'adam', 'graph_mode': 'off', 'use_snp_selection': False}. Best is trial 40 with value: 0.0739077423401802.
[I 2025-12-05 14:52:22,385] Trial 87 finished with value: 0.014335455923131056 and parameters: {'model_type': 'mlp', 'hidden_dims': '[128, 64]', 'dropout': 0.5953163220718075, 'batch_norm': True, 'lr': 9.11325138055281e-05, 'weight_decay': 1.8844232424199588e-07, 'epochs': 49, 'loss': 'mae', 'optimizer': 'adam', 'graph_mode': 'off', 'use_snp_selection': False}. Best is trial 40 with value: 0.0739077423401802.
[I 2025-12-05 14:52:25,685] Trial 88 finished with value: 0.07033938899523565 and parameters: {'model_type': 'mlp', 'hidden_dims': '[512, 256]', 'dropout': 0.5692276327074908, 'batch_norm': True, 'lr': 7.432323032848967e-05, 'weight_decay': 4.0723256655797323e-07, 'epochs': 341, 'loss': 'mse', 'optimizer': 'adam', 'graph_mode': 'off', 'use_snp_selection': True, 'num_snps': 48766}. Best is trial 40 with value: 0.0739077423401802.
[I 2025-12-05 14:52:29,263] Trial 89 finished with value: 0.06393329145512819 and parameters: {'model_type': 'mlp', 'hidden_dims': '[512, 256]', 'dropout': 0.5488420862176379, 'batch_norm': True, 'lr': 6.830424787290505e-05, 'weight_decay': 3.6593080414284697e-07, 'epochs': 343, 'loss': 'mae', 'optimizer': 'adam', 'graph_mode': 'off', 'use_snp_selection': True, 'num_snps': 49323}. Best is trial 40 with value: 0.0739077423401802.
[I 2025-12-05 14:52:32,612] Trial 90 finished with value: 0.03043004244115646 and parameters: {'model_type': 'mlp', 'hidden_dims': '[512, 256]', 'dropout': 0.5715675220997056, 'batch_norm': True, 'lr': 4.630951360316156e-05, 'weight_decay': 3.680838411279458e-07, 'epochs': 343, 'loss': 'mae', 'optimizer': 'adam', 'graph_mode': 'off', 'use_snp_selection': True, 'num_snps': 45301}. Best is trial 40 with value: 0.0739077423401802.
[I 2025-12-05 14:52:36,147] Trial 91 finished with value: 0.041715337402863976 and parameters: {'model_type': 'mlp', 'hidden_dims': '[512, 256]', 'dropout': 0.5436295735735368, 'batch_norm': True, 'lr': 6.636358386949344e-05, 'weight_decay': 5.676392383285603e-07, 'epochs': 340, 'loss': 'mae', 'optimizer': 'adam', 'graph_mode': 'off', 'use_snp_selection': True, 'num_snps': 50210}. Best is trial 40 with value: 0.0739077423401802.
[I 2025-12-05 14:52:38,925] Trial 92 finished with value: 0.06219399154206594 and parameters: {'model_type': 'mlp', 'hidden_dims': '[512, 256]', 'dropout': 0.5562654372252785, 'batch_norm': True, 'lr': 5.6020236848321916e-05, 'weight_decay': 4.3615285940372284e-07, 'epochs': 315, 'loss': 'mae', 'optimizer': 'adam', 'graph_mode': 'off', 'use_snp_selection': True, 'num_snps': 38931}. Best is trial 40 with value: 0.0739077423401802.
[I 2025-12-05 14:52:41,757] Trial 93 finished with value: 0.04261251930874908 and parameters: {'model_type': 'mlp', 'hidden_dims': '[512, 256]', 'dropout': 0.5538836146131754, 'batch_norm': True, 'lr': 8.093810501301918e-05, 'weight_decay': 2.9885473331616e-07, 'epochs': 326, 'loss': 'mae', 'optimizer': 'adam', 'graph_mode': 'off', 'use_snp_selection': True, 'num_snps': 38416}. Best is trial 40 with value: 0.0739077423401802.
[I 2025-12-05 14:52:45,310] Trial 94 finished with value: 0.031311997173118576 and parameters: {'model_type': 'mlp', 'hidden_dims': '[512, 256]', 'dropout': 0.49868520131424643, 'batch_norm': True, 'lr': 0.00010141124169329264, 'weight_decay': 4.281904697274744e-07, 'epochs': 305, 'loss': 'mae', 'optimizer': 'adam', 'graph_mode': 'off', 'use_snp_selection': True, 'num_snps': 52530}. Best is trial 40 with value: 0.0739077423401802.
[I 2025-12-05 14:52:48,045] Trial 95 finished with value: 0.056281145470996385 and parameters: {'model_type': 'mlp', 'hidden_dims': '[512, 256]', 'dropout': 0.5699845232055468, 'batch_norm': True, 'lr': 6.890200529565093e-05, 'weight_decay': 1.3773267817233351e-07, 'epochs': 286, 'loss': 'mae', 'optimizer': 'adam', 'graph_mode': 'off', 'use_snp_selection': True, 'num_snps': 39489}. Best is trial 40 with value: 0.0739077423401802.
[I 2025-12-05 14:52:51,648] Trial 96 finished with value: 0.047242780591107536 and parameters: {'model_type': 'mlp', 'hidden_dims': '[512, 256]', 'dropout': 0.5334599053025783, 'batch_norm': True, 'lr': 5.821360533417626e-05, 'weight_decay': 2.0434749808481042e-07, 'epochs': 308, 'loss': 'mae', 'optimizer': 'adam', 'graph_mode': 'off', 'use_snp_selection': True, 'num_snps': 52628}. Best is trial 40 with value: 0.0739077423401802.
[I 2025-12-05 14:52:54,088] Trial 97 finished with value: 0.033633591085815956 and parameters: {'model_type': 'mlp', 'hidden_dims': '[512, 256]', 'dropout': 0.5828278429581416, 'batch_norm': True, 'lr': 2.4515663269377973e-05, 'weight_decay': 8.610042486826997e-07, 'epochs': 321, 'loss': 'mae', 'optimizer': 'adam', 'graph_mode': 'off', 'use_snp_selection': True, 'num_snps': 31510}. Best is trial 40 with value: 0.0739077423401802.
[I 2025-12-05 14:52:57,298] Trial 98 finished with value: 0.04857789548755493 and parameters: {'model_type': 'mlp', 'hidden_dims': '[512, 128]', 'dropout': 0.5066237961551634, 'batch_norm': True, 'lr': 5.2013999629470025e-05, 'weight_decay': 7.103349180811965e-07, 'epochs': 350, 'loss': 'mae', 'optimizer': 'adam', 'graph_mode': 'off', 'use_snp_selection': True, 'num_snps': 43902}. Best is trial 40 with value: 0.0739077423401802.
[I 2025-12-05 14:53:00,411] Trial 99 finished with value: 0.03283016588606022 and parameters: {'model_type': 'mlp', 'hidden_dims': '[256, 128]', 'dropout': 0.5527446823685799, 'batch_norm': False, 'lr': 3.309336706434447e-05, 'weight_decay': 4.3221462871554854e-07, 'epochs': 317, 'loss': 'mae', 'optimizer': 'adam', 'graph_mode': 'off', 'use_snp_selection': True, 'num_snps': 53831}. Best is trial 40 with value: 0.0739077423401802.
[I 2025-12-05 14:53:03,404] Trial 100 finished with value: 0.0409192946082313 and parameters: {'model_type': 'mlp', 'hidden_dims': '[512, 256]', 'dropout': 0.5662528749525753, 'batch_norm': True, 'lr': 0.0002552106199510581, 'weight_decay': 1.2487295219171612e-06, 'epochs': 330, 'loss': 'mae', 'optimizer': 'adam', 'graph_mode': 'off', 'use_snp_selection': True, 'num_snps': 41189}. Best is trial 40 with value: 0.0739077423401802.
[I 2025-12-05 14:53:06,776] Trial 101 finished with value: 0.02742633701325426 and parameters: {'model_type': 'mlp', 'hidden_dims': '[512, 256]', 'dropout': 0.48355419880279593, 'batch_norm': True, 'lr': 4.218659766062223e-05, 'weight_decay': 5.580922636652361e-07, 'epochs': 344, 'loss': 'mse', 'optimizer': 'adam', 'graph_mode': 'off', 'use_snp_selection': True, 'num_snps': 48723}. Best is trial 40 with value: 0.0739077423401802.
[I 2025-12-05 14:53:09,179] Trial 102 finished with value: 0.015924120648250138 and parameters: {'model_type': 'mlp', 'hidden_dims': '[512, 256]', 'dropout': 0.5837762069208624, 'batch_norm': True, 'lr': 7.74091930626873e-05, 'weight_decay': 2.4012878234348964e-07, 'epochs': 190, 'loss': 'mse', 'optimizer': 'adam', 'graph_mode': 'off', 'use_snp_selection': True, 'num_snps': 36548}. Best is trial 40 with value: 0.0739077423401802.
[I 2025-12-05 14:53:11,128] Trial 103 finished with value: 0.03695939960400619 and parameters: {'model_type': 'mlp', 'hidden_dims': '[512, 256]', 'dropout': 0.519799828351244, 'batch_norm': True, 'lr': 0.00011888104169262485, 'weight_decay': 3.3170809493334313e-07, 'epochs': 246, 'loss': 'mae', 'optimizer': 'adam', 'graph_mode': 'off', 'use_snp_selection': True, 'num_snps': 26228}. Best is trial 40 with value: 0.0739077423401802.
[I 2025-12-05 14:53:13,707] Trial 104 finished with value: 0.03249122872809784 and parameters: {'model_type': 'mlp', 'hidden_dims': '[256, 128, 64]', 'dropout': 0.15208512329716867, 'batch_norm': True, 'lr': 9.514609252522179e-05, 'weight_decay': 8.892345696765768e-07, 'epochs': 77, 'loss': 'mse', 'optimizer': 'adam', 'graph_mode': 'off', 'use_snp_selection': True, 'num_snps': 56539}. Best is trial 40 with value: 0.0739077423401802.
[I 2025-12-05 14:53:16,671] Trial 105 finished with value: 0.058840409164271724 and parameters: {'model_type': 'mlp', 'hidden_dims': '[512, 256]', 'dropout': 0.11671155076561032, 'batch_norm': True, 'lr': 2.789588934642268e-05, 'weight_decay': 4.371806862053216e-07, 'epochs': 338, 'loss': 'mae', 'optimizer': 'adam', 'graph_mode': 'off', 'use_snp_selection': True, 'num_snps': 41736}. Best is trial 40 with value: 0.0739077423401802.
[I 2025-12-05 14:53:19,575] Trial 106 finished with value: 0.031119695136876038 and parameters: {'model_type': 'mlp', 'hidden_dims': '[512, 256]', 'dropout': 0.23760469331539275, 'batch_norm': True, 'lr': 2.587332589637158e-05, 'weight_decay': 1.765902260231819e-06, 'epochs': 311, 'loss': 'mae', 'optimizer': 'adam', 'graph_mode': 'off', 'use_snp_selection': True, 'num_snps': 42447}. Best is trial 40 with value: 0.0739077423401802.
[I 2025-12-05 14:53:22,759] Trial 107 finished with value: 0.05566678110875865 and parameters: {'model_type': 'mlp', 'hidden_dims': '[512, 256]', 'dropout': 0.11289274422358689, 'batch_norm': True, 'lr': 1.7424766410378684e-05, 'weight_decay': 4.616684565801653e-07, 'epochs': 336, 'loss': 'mae', 'optimizer': 'adam', 'graph_mode': 'off', 'use_snp_selection': True, 'num_snps': 47379}. Best is trial 40 with value: 0.0739077423401802.
[I 2025-12-05 14:53:25,347] Trial 108 finished with value: 0.05767727155689749 and parameters: {'model_type': 'mlp', 'hidden_dims': '[512, 64]', 'dropout': 0.4211325948924383, 'batch_norm': True, 'lr': 0.00017634779207005924, 'weight_decay': 1.707153523876082e-07, 'epochs': 339, 'loss': 'mae', 'optimizer': 'adam', 'graph_mode': 'off', 'use_snp_selection': True, 'num_snps': 36264}. Best is trial 40 with value: 0.0739077423401802.
[I 2025-12-05 14:53:27,403] Trial 109 finished with value: 0.023625111662302675 and parameters: {'model_type': 'mlp', 'hidden_dims': '[128, 64]', 'dropout': 0.12898813311689958, 'batch_norm': True, 'lr': 3.48985308469065e-05, 'weight_decay': 6.736824394742148e-07, 'epochs': 323, 'loss': 'mae', 'optimizer': 'adam', 'graph_mode': 'off', 'use_snp_selection': True, 'num_snps': 34157}. Best is trial 40 with value: 0.0739077423401802.
[I 2025-12-05 14:53:29,914] Trial 110 finished with value: 0.03502751146239512 and parameters: {'model_type': 'mlp', 'hidden_dims': '[256, 128]', 'dropout': 0.5319473422321129, 'batch_norm': True, 'lr': 1.425846369762099e-05, 'weight_decay': 2.2238595289033092e-07, 'epochs': 331, 'loss': 'mae', 'optimizer': 'adam', 'graph_mode': 'off', 'use_snp_selection': True, 'num_snps': 42795}. Best is trial 40 with value: 0.0739077423401802.
[I 2025-12-05 14:53:32,134] Trial 111 finished with value: 0.04611462620539833 and parameters: {'model_type': 'mlp', 'hidden_dims': '[512, 256]', 'dropout': 0.1022932709363312, 'batch_norm': True, 'lr': 5.521568193092452e-05, 'weight_decay': 2.7446489117987744e-07, 'epochs': 315, 'loss': 'mse', 'optimizer': 'adam', 'graph_mode': 'off', 'use_snp_selection': False}. Best is trial 40 with value: 0.0739077423401802.
[I 2025-12-05 14:53:34,426] Trial 112 finished with value: 0.038156183262421414 and parameters: {'model_type': 'mlp', 'hidden_dims': '[512, 256]', 'dropout': 0.1563689783876176, 'batch_norm': True, 'lr': 2.768681107672358e-05, 'weight_decay': 3.716341591668167e-07, 'epochs': 343, 'loss': 'mae', 'optimizer': 'adam', 'graph_mode': 'off', 'use_snp_selection': False}. Best is trial 40 with value: 0.0739077423401802.
[I 2025-12-05 14:53:35,662] Trial 113 finished with value: 0.055517387403710726 and parameters: {'model_type': 'mlp', 'hidden_dims': '[512, 256]', 'dropout': 0.17933358412607453, 'batch_norm': True, 'lr': 0.00019650889616815216, 'weight_decay': 5.463649847736208e-07, 'epochs': 93, 'loss': 'mse', 'optimizer': 'adam', 'graph_mode': 'off', 'use_snp_selection': False}. Best is trial 40 with value: 0.0739077423401802.
[I 2025-12-05 14:53:36,788] Trial 114 finished with value: 0.030040493917341673 and parameters: {'model_type': 'mlp', 'hidden_dims': '[512, 256]', 'dropout': 0.11766751250441031, 'batch_norm': True, 'lr': 6.487320660731089e-05, 'weight_decay': 2.99136188926515e-07, 'epochs': 67, 'loss': 'mae', 'optimizer': 'adam', 'graph_mode': 'off', 'use_snp_selection': False}. Best is trial 40 with value: 0.0739077423401802.
[I 2025-12-05 14:53:38,929] Trial 115 finished with value: 0.05412974329260902 and parameters: {'model_type': 'mlp', 'hidden_dims': '[512, 64]', 'dropout': 0.1687621649280051, 'batch_norm': True, 'lr': 4.512571817639453e-05, 'weight_decay': 1.058566627969757e-06, 'epochs': 328, 'loss': 'mae', 'optimizer': 'adam', 'graph_mode': 'off', 'use_snp_selection': True, 'num_snps': 27405}. Best is trial 40 with value: 0.0739077423401802.
[I 2025-12-05 14:53:40,021] Trial 116 finished with value: 0.05073015080008445 and parameters: {'model_type': 'mlp', 'hidden_dims': '[128, 64]', 'dropout': 0.5606924765891238, 'batch_norm': True, 'lr': 0.00033900528535169347, 'weight_decay': 2.359287919312691e-05, 'epochs': 350, 'loss': 'mse', 'optimizer': 'adam', 'graph_mode': 'off', 'use_snp_selection': False}. Best is trial 40 with value: 0.0739077423401802.
[I 2025-12-05 14:53:41,020] Trial 117 finished with value: 0.051522353669003165 and parameters: {'model_type': 'mlp', 'hidden_dims': '[512, 128]', 'dropout': 0.13115224347387397, 'batch_norm': True, 'lr': 8.344338073978579e-05, 'weight_decay': 4.1178561955724296e-07, 'epochs': 42, 'loss': 'mae', 'optimizer': 'adam', 'graph_mode': 'off', 'use_snp_selection': False}. Best is trial 40 with value: 0.0739077423401802.
[I 2025-12-05 14:53:42,199] Trial 118 finished with value: 0.07031234843140267 and parameters: {'model_type': 'mlp', 'hidden_dims': '[512, 256]', 'dropout': 0.20680500590669854, 'batch_norm': True, 'lr': 0.000435448221224969, 'weight_decay': 6.654211875915787e-07, 'epochs': 79, 'loss': 'mse', 'optimizer': 'adam', 'graph_mode': 'off', 'use_snp_selection': False}. Best is trial 40 with value: 0.0739077423401802.
[I 2025-12-05 14:53:44,487] Trial 119 finished with value: 0.04679772645548959 and parameters: {'model_type': 'mlp', 'hidden_dims': '[512, 256]', 'dropout': 0.2038831965365975, 'batch_norm': False, 'lr': 0.0004547178508011175, 'weight_decay': 8.315917980752309e-07, 'epochs': 334, 'loss': 'mae', 'optimizer': 'adam', 'graph_mode': 'off', 'use_snp_selection': False}. Best is trial 40 with value: 0.0739077423401802.
[I 2025-12-05 14:53:46,929] Trial 120 finished with value: 0.04185612476423681 and parameters: {'model_type': 'mlp', 'hidden_dims': '[128, 64]', 'dropout': 0.2293775165744314, 'batch_norm': True, 'lr': 0.0002781118611805193, 'weight_decay': 6.163646147412486e-07, 'epochs': 62, 'loss': 'mse', 'optimizer': 'adam', 'graph_mode': 'off', 'use_snp_selection': True, 'num_snps': 50063}. Best is trial 40 with value: 0.0739077423401802.
[I 2025-12-05 14:53:48,088] Trial 121 finished with value: 0.0654574878210181 and parameters: {'model_type': 'mlp', 'hidden_dims': '[512, 256]', 'dropout': 0.24749404840627676, 'batch_norm': True, 'lr': 0.00042070305757877435, 'weight_decay': 4.6120654727395185e-07, 'epochs': 78, 'loss': 'mse', 'optimizer': 'adam', 'graph_mode': 'off', 'use_snp_selection': False}. Best is trial 40 with value: 0.0739077423401802.
[I 2025-12-05 14:53:49,259] Trial 122 finished with value: 0.04740402677845209 and parameters: {'model_type': 'mlp', 'hidden_dims': '[512, 256]', 'dropout': 0.24793342687821296, 'batch_norm': True, 'lr': 0.0003964833336408021, 'weight_decay': 4.940773871305512e-07, 'epochs': 80, 'loss': 'mse', 'optimizer': 'adam', 'graph_mode': 'off', 'use_snp_selection': False}. Best is trial 40 with value: 0.0739077423401802.
[I 2025-12-05 14:53:50,466] Trial 123 finished with value: 0.06410560462522438 and parameters: {'model_type': 'mlp', 'hidden_dims': '[512, 256]', 'dropout': 0.2158958699978653, 'batch_norm': True, 'lr': 0.0006387583117940709, 'weight_decay': 1.1348397962944073e-06, 'epochs': 88, 'loss': 'mse', 'optimizer': 'adam', 'graph_mode': 'off', 'use_snp_selection': False}. Best is trial 40 with value: 0.0739077423401802.
[I 2025-12-05 14:53:51,604] Trial 124 finished with value: 0.07475205604466417 and parameters: {'model_type': 'mlp', 'hidden_dims': '[512, 256]', 'dropout': 0.21333130874252682, 'batch_norm': True, 'lr': 0.0005916006684312751, 'weight_decay': 1.4842022980004851e-06, 'epochs': 73, 'loss': 'mse', 'optimizer': 'adam', 'graph_mode': 'off', 'use_snp_selection': False}. Best is trial 124 with value: 0.07475205604466417.
[I 2025-12-05 14:53:52,809] Trial 125 finished with value: 0.05923657265943775 and parameters: {'model_type': 'mlp', 'hidden_dims': '[512, 256]', 'dropout': 0.21532224258203284, 'batch_norm': True, 'lr': 0.0008528581528752675, 'weight_decay': 2.3786707169949696e-06, 'epochs': 89, 'loss': 'mse', 'optimizer': 'adam', 'graph_mode': 'off', 'use_snp_selection': False}. Best is trial 124 with value: 0.07475205604466417.
[I 2025-12-05 14:53:54,533] Trial 126 finished with value: 0.06050624703059339 and parameters: {'model_type': 'mlp', 'hidden_dims': '[512, 256]', 'dropout': 0.26791223343089765, 'batch_norm': True, 'lr': 0.0005887713677989431, 'weight_decay': 1.7351158921762205e-06, 'epochs': 205, 'loss': 'mse', 'optimizer': 'adam', 'graph_mode': 'off', 'use_snp_selection': False}. Best is trial 124 with value: 0.07475205604466417.
[I 2025-12-05 14:53:55,645] Trial 127 finished with value: 0.06254006512644134 and parameters: {'model_type': 'mlp', 'hidden_dims': '[512, 256]', 'dropout': 0.24356277174506588, 'batch_norm': True, 'lr': 0.0005405335410969526, 'weight_decay': 1.3758220391863308e-06, 'epochs': 68, 'loss': 'mse', 'optimizer': 'adam', 'graph_mode': 'off', 'use_snp_selection': False}. Best is trial 124 with value: 0.07475205604466417.
[I 2025-12-05 14:53:56,750] Trial 128 finished with value: 0.04482684073810704 and parameters: {'model_type': 'mlp', 'hidden_dims': '[512, 256]', 'dropout': 0.24446713096899203, 'batch_norm': True, 'lr': 0.0005259522913698115, 'weight_decay': 1.311478690167197e-06, 'epochs': 67, 'loss': 'mse', 'optimizer': 'adam', 'graph_mode': 'off', 'use_snp_selection': False}. Best is trial 124 with value: 0.07475205604466417.
[I 2025-12-05 14:53:57,767] Trial 129 finished with value: 0.047128752085377326 and parameters: {'model_type': 'mlp', 'hidden_dims': '[512, 256]', 'dropout': 0.1881639576127374, 'batch_norm': True, 'lr': 0.00048289486037063253, 'weight_decay': 7.269271621680748e-07, 'epochs': 56, 'loss': 'mse', 'optimizer': 'adam', 'graph_mode': 'off', 'use_snp_selection': False}. Best is trial 124 with value: 0.07475205604466417.
[I 2025-12-05 14:53:58,886] Trial 130 finished with value: 0.04635183488015098 and parameters: {'model_type': 'mlp', 'hidden_dims': '[512, 256]', 'dropout': 0.2575191006258708, 'batch_norm': True, 'lr': 0.0006576893581364011, 'weight_decay': 1.4366875545728561e-06, 'epochs': 72, 'loss': 'mse', 'optimizer': 'adam', 'graph_mode': 'off', 'use_snp_selection': False}. Best is trial 124 with value: 0.07475205604466417.
[I 2025-12-05 14:54:00,132] Trial 131 finished with value: 0.034634240019302945 and parameters: {'model_type': 'mlp', 'hidden_dims': '[512, 256]', 'dropout': 0.21373740979344602, 'batch_norm': True, 'lr': 0.0004351625557689808, 'weight_decay': 1.1074750250618727e-06, 'epochs': 100, 'loss': 'mse', 'optimizer': 'adam', 'graph_mode': 'off', 'use_snp_selection': False}. Best is trial 124 with value: 0.07475205604466417.
