[I 2025-12-06 06:44:56,560] Trial 142 finished with value: 0.3054825931934445 and parameters: {'model_type': 'mlp', 'hidden_dims': '[256, 128]', 'dropout': 0.5706973702360798, 'batch_norm': False, 'lr': 6.100180073099169e-05, 'weight_decay': 0.0003547023343907856, 'epochs': 98, 'loss': 'mse', 'optimizer': 'adam', 'graph_mode': 'off', 'use_snp_selection': False}. Best is trial 122 with value: 0.314602625654642.
[I 2025-12-06 06:45:21,315] Trial 143 finished with value: 0.3106987948088473 and parameters: {'model_type': 'mlp', 'hidden_dims': '[256, 128]', 'dropout': 0.5879554404109266, 'batch_norm': False, 'lr': 7.591465367355611e-05, 'weight_decay': 0.000507427243117827, 'epochs': 222, 'loss': 'mse', 'optimizer': 'adam', 'graph_mode': 'off', 'use_snp_selection': False}. Best is trial 122 with value: 0.314602625654642.
[I 2025-12-06 06:45:58,381] Trial 144 finished with value: 0.3045424998754246 and parameters: {'model_type': 'mlp', 'hidden_dims': '[512, 256]', 'dropout': 0.12854589919305764, 'batch_norm': False, 'lr': 3.7611022652152685e-05, 'weight_decay': 1.2469503429487465e-06, 'epochs': 183, 'loss': 'mse', 'optimizer': 'adam', 'graph_mode': 'off', 'use_snp_selection': False}. Best is trial 122 with value: 0.314602625654642.
[I 2025-12-06 06:46:13,264] Trial 145 finished with value: 0.30397556152554095 and parameters: {'model_type': 'mlp', 'hidden_dims': '[128, 64]', 'dropout': 0.5201132859528691, 'batch_norm': True, 'lr': 4.550437951673455e-05, 'weight_decay': 0.000996415457397342, 'epochs': 202, 'loss': 'mse', 'optimizer': 'adam', 'graph_mode': 'off', 'use_snp_selection': False}. Best is trial 122 with value: 0.314602625654642.
[I 2025-12-06 06:46:48,443] Trial 146 finished with value: 0.3141586680634003 and parameters: {'model_type': 'mlp', 'hidden_dims': '[512, 256]', 'dropout': 0.2959650723309925, 'batch_norm': True, 'lr': 5.252459924649575e-05, 'weight_decay': 0.0003771492411060508, 'epochs': 170, 'loss': 'mse', 'optimizer': 'adam', 'graph_mode': 'off', 'use_snp_selection': False}. Best is trial 122 with value: 0.314602625654642.
[I 2025-12-06 06:47:22,774] Trial 147 finished with value: 0.3096233509984791 and parameters: {'model_type': 'mlp', 'hidden_dims': '[512, 256]', 'dropout': 0.2331593834576051, 'batch_norm': True, 'lr': 0.00012036090095200363, 'weight_decay': 0.00040304256514704585, 'epochs': 165, 'loss': 'mse', 'optimizer': 'adam', 'graph_mode': 'off', 'use_snp_selection': False}. Best is trial 122 with value: 0.314602625654642.
[I 2025-12-06 06:48:01,012] Trial 148 finished with value: 0.3068744341637911 and parameters: {'model_type': 'mlp', 'hidden_dims': '[512, 128]', 'dropout': 0.29051767196044365, 'batch_norm': True, 'lr': 3.2382226885972584e-05, 'weight_decay': 0.00015543133268045088, 'epochs': 188, 'loss': 'mae', 'optimizer': 'adam', 'graph_mode': 'off', 'use_snp_selection': False}. Best is trial 122 with value: 0.314602625654642.
[I 2025-12-06 06:48:36,798] Trial 149 finished with value: 0.30617037756062 and parameters: {'model_type': 'mlp', 'hidden_dims': '[512, 256]', 'dropout': 0.21804397458682603, 'batch_norm': False, 'lr': 5.241466454318657e-05, 'weight_decay': 0.00023139496449953832, 'epochs': 176, 'loss': 'mse', 'optimizer': 'adam', 'graph_mode': 'off', 'use_snp_selection': False}. Best is trial 122 with value: 0.314602625654642.
[I 2025-12-06 06:49:31,407] Trial 0 finished with value: 0.27689290745493306 and parameters: {'model_type': 'mlp', 'hidden_dims': '[128, 64]', 'dropout': 0.199031432379812, 'batch_norm': True, 'lr': 1.8408544111075837e-06, 'weight_decay': 5.5136510071208614e-05, 'epochs': 336, 'loss': 'mae', 'optimizer': 'adam', 'graph_mode': 'off', 'use_snp_selection': True, 'num_snps': 43862}. Best is trial 0 with value: 0.27689290745493306.
[I 2025-12-06 06:49:58,047] Trial 1 finished with value: 0.3141545204578796 and parameters: {'model_type': 'mlp', 'hidden_dims': '[256, 128]', 'dropout': 0.4370668075331726, 'batch_norm': True, 'lr': 7.133471581159139e-05, 'weight_decay': 1.128633586803549e-05, 'epochs': 242, 'loss': 'mae', 'optimizer': 'adam', 'graph_mode': 'off', 'use_snp_selection': False}. Best is trial 1 with value: 0.3141545204578796.
[I 2025-12-06 06:50:24,300] Trial 2 finished with value: 0.27323845975598415 and parameters: {'model_type': 'mlp', 'hidden_dims': '[256, 128, 64]', 'dropout': 0.41314357415569625, 'batch_norm': False, 'lr': 3.952233718592101e-06, 'weight_decay': 0.00026754769258252603, 'epochs': 149, 'loss': 'mse', 'optimizer': 'adam', 'graph_mode': 'off', 'use_snp_selection': True, 'num_snps': 11571}. Best is trial 1 with value: 0.3141545204578796.
[I 2025-12-06 06:51:24,838] Trial 3 finished with value: 0.31625725454098597 and parameters: {'model_type': 'mlp', 'hidden_dims': '[512, 64]', 'dropout': 0.5938127374509361, 'batch_norm': False, 'lr': 5.67704586114731e-06, 'weight_decay': 2.4518087630137052e-05, 'epochs': 320, 'loss': 'mae', 'optimizer': 'adam', 'graph_mode': 'off', 'use_snp_selection': False}. Best is trial 3 with value: 0.31625725454098597.
[I 2025-12-06 06:52:24,956] Trial 4 finished with value: 0.2900254698343067 and parameters: {'model_type': 'mlp', 'hidden_dims': '[512, 128]', 'dropout': 0.25746343592134413, 'batch_norm': True, 'lr': 1.3467657668402788e-06, 'weight_decay': 0.00033087251918647806, 'epochs': 277, 'loss': 'mse', 'optimizer': 'adam', 'graph_mode': 'off', 'use_snp_selection': True, 'num_snps': 36675}. Best is trial 3 with value: 0.31625725454098597.
[I 2025-12-06 06:53:07,778] Trial 5 finished with value: 0.2549149002679507 and parameters: {'model_type': 'mlp', 'hidden_dims': '[512, 64]', 'dropout': 0.38275350994408375, 'batch_norm': True, 'lr': 1.5586664309232824e-06, 'weight_decay': 0.0008227664668621182, 'epochs': 145, 'loss': 'mae', 'optimizer': 'adam', 'graph_mode': 'off', 'use_snp_selection': True, 'num_snps': 32148}. Best is trial 3 with value: 0.31625725454098597.
[I 2025-12-06 06:53:30,360] Trial 6 finished with value: 0.3143569143087045 and parameters: {'model_type': 'mlp', 'hidden_dims': '[256, 128]', 'dropout': 0.3930109900265879, 'batch_norm': False, 'lr': 4.892964372128395e-05, 'weight_decay': 1.5809549317992182e-06, 'epochs': 199, 'loss': 'mse', 'optimizer': 'adam', 'graph_mode': 'off', 'use_snp_selection': False}. Best is trial 3 with value: 0.31625725454098597.
[I 2025-12-06 06:53:52,568] Trial 7 finished with value: 0.3081887901482334 and parameters: {'model_type': 'mlp', 'hidden_dims': '[512, 256]', 'dropout': 0.15343979219678458, 'batch_norm': True, 'lr': 6.234003099047341e-05, 'weight_decay': 3.894760610535477e-07, 'epochs': 97, 'loss': 'mse', 'optimizer': 'adam', 'graph_mode': 'off', 'use_snp_selection': False}. Best is trial 3 with value: 0.31625725454098597.
[I 2025-12-06 06:54:52,478] Trial 8 finished with value: 0.3145440437073335 and parameters: {'model_type': 'mlp', 'hidden_dims': '[512, 128]', 'dropout': 0.10743001231661406, 'batch_norm': True, 'lr': 0.00023728538449271062, 'weight_decay': 1.7629071578048637e-05, 'epochs': 312, 'loss': 'mae', 'optimizer': 'adam', 'graph_mode': 'off', 'use_snp_selection': False}. Best is trial 3 with value: 0.31625725454098597.
[I 2025-12-06 06:55:28,384] Trial 9 finished with value: 0.3127271006038795 and parameters: {'model_type': 'mlp', 'hidden_dims': '[512, 64]', 'dropout': 0.14505336736221927, 'batch_norm': True, 'lr': 5.8619638388111826e-05, 'weight_decay': 6.200156172669308e-07, 'epochs': 175, 'loss': 'mse', 'optimizer': 'adam', 'graph_mode': 'off', 'use_snp_selection': False}. Best is trial 3 with value: 0.31625725454098597.
[I 2025-12-06 06:55:43,107] Trial 10 finished with value: 0.27620139244673125 and parameters: {'model_type': 'mlp', 'hidden_dims': '[512, 64]', 'dropout': 0.5885461262002587, 'batch_norm': False, 'lr': 8.769366258768696e-06, 'weight_decay': 2.78273193871783e-06, 'epochs': 55, 'loss': 'mae', 'optimizer': 'adam', 'graph_mode': 'off', 'use_snp_selection': False}. Best is trial 3 with value: 0.31625725454098597.
[I 2025-12-06 06:56:48,233] Trial 11 finished with value: 0.3023513842832902 and parameters: {'model_type': 'mlp', 'hidden_dims': '[512, 128]', 'dropout': 0.583942291816117, 'batch_norm': False, 'lr': 0.0007607980626791682, 'weight_decay': 2.11387030344014e-05, 'epochs': 346, 'loss': 'mae', 'optimizer': 'adam', 'graph_mode': 'off', 'use_snp_selection': False}. Best is trial 3 with value: 0.31625725454098597.
[I 2025-12-06 06:57:44,348] Trial 12 finished with value: 0.30898131892613423 and parameters: {'model_type': 'mlp', 'hidden_dims': '[512, 128]', 'dropout': 0.2637316882220091, 'batch_norm': False, 'lr': 0.000384886887018818, 'weight_decay': 6.23587291883057e-05, 'epochs': 294, 'loss': 'mae', 'optimizer': 'adam', 'graph_mode': 'off', 'use_snp_selection': False}. Best is trial 3 with value: 0.31625725454098597.
[I 2025-12-06 06:58:03,418] Trial 13 finished with value: 0.30858592028302406 and parameters: {'model_type': 'mlp', 'hidden_dims': '[128, 64]', 'dropout': 0.5255276925359322, 'batch_norm': False, 'lr': 1.3373175420781734e-05, 'weight_decay': 2.875929917712265e-06, 'epochs': 285, 'loss': 'mae', 'optimizer': 'adam', 'graph_mode': 'off', 'use_snp_selection': False}. Best is trial 3 with value: 0.31625725454098597.
[I 2025-12-06 06:58:29,975] Trial 14 finished with value: 0.31073762206281463 and parameters: {'model_type': 'mlp', 'hidden_dims': '[256, 128, 64]', 'dropout': 0.3012984444538551, 'batch_norm': True, 'lr': 0.0002108574938852793, 'weight_decay': 1.1414924884997386e-07, 'epochs': 237, 'loss': 'mae', 'optimizer': 'adam', 'graph_mode': 'off', 'use_snp_selection': False}. Best is trial 3 with value: 0.31625725454098597.
[I 2025-12-06 06:59:29,810] Trial 15 finished with value: 0.31503799883982625 and parameters: {'model_type': 'mlp', 'hidden_dims': '[512, 256]', 'dropout': 0.48263162073930665, 'batch_norm': False, 'lr': 1.8411764708572348e-05, 'weight_decay': 4.4084956876871386e-05, 'epochs': 314, 'loss': 'mae', 'optimizer': 'adam', 'graph_mode': 'off', 'use_snp_selection': False}. Best is trial 3 with value: 0.31625725454098597.
[I 2025-12-06 07:00:17,507] Trial 16 finished with value: 0.31433657827231387 and parameters: {'model_type': 'mlp', 'hidden_dims': '[512, 256]', 'dropout': 0.4969375229785773, 'batch_norm': False, 'lr': 1.967678703307444e-05, 'weight_decay': 9.043551683276156e-05, 'epochs': 244, 'loss': 'mae', 'optimizer': 'adam', 'graph_mode': 'off', 'use_snp_selection': False}. Best is trial 3 with value: 0.31625725454098597.
[I 2025-12-06 07:01:24,009] Trial 17 finished with value: 0.3199931949585276 and parameters: {'model_type': 'mlp', 'hidden_dims': '[512, 256]', 'dropout': 0.4976434386489672, 'batch_norm': False, 'lr': 7.28449232493469e-06, 'weight_decay': 6.503919561253859e-06, 'epochs': 350, 'loss': 'mae', 'optimizer': 'adam', 'graph_mode': 'off', 'use_snp_selection': False}. Best is trial 17 with value: 0.3199931949585276.
[I 2025-12-06 07:02:56,888] Trial 18 finished with value: 0.318841654530175 and parameters: {'model_type': 'mlp', 'hidden_dims': '[512, 256]', 'dropout': 0.5398991661089085, 'batch_norm': False, 'lr': 5.4850663591507836e-06, 'weight_decay': 5.409591144113358e-06, 'epochs': 343, 'loss': 'mae', 'optimizer': 'adam', 'graph_mode': 'off', 'use_snp_selection': True, 'num_snps': 58241}. Best is trial 17 with value: 0.3199931949585276.
[I 2025-12-06 07:04:14,286] Trial 19 finished with value: 0.3061001260318189 and parameters: {'model_type': 'mlp', 'hidden_dims': '[512, 256]', 'dropout': 0.537703265431583, 'batch_norm': False, 'lr': 3.178805570854624e-06, 'weight_decay': 6.03149641474792e-06, 'epochs': 260, 'loss': 'mae', 'optimizer': 'adam', 'graph_mode': 'off', 'use_snp_selection': True, 'num_snps': 55667}. Best is trial 17 with value: 0.3199931949585276.
[I 2025-12-06 07:05:24,103] Trial 20 finished with value: 0.3111706422315668 and parameters: {'model_type': 'mlp', 'hidden_dims': '[512, 256]', 'dropout': 0.45460159906173375, 'batch_norm': False, 'lr': 7.494031193290426e-06, 'weight_decay': 6.308139560778467e-06, 'epochs': 202, 'loss': 'mae', 'optimizer': 'adam', 'graph_mode': 'off', 'use_snp_selection': True, 'num_snps': 57703}. Best is trial 17 with value: 0.3199931949585276.
[I 2025-12-06 07:05:59,565] Trial 21 finished with value: 0.2861381991313453 and parameters: {'model_type': 'mlp', 'hidden_dims': '[512, 64]', 'dropout': 0.5508675673451175, 'batch_norm': False, 'lr': 3.5714083088829407e-06, 'weight_decay': 1.4813945446051513e-06, 'epochs': 348, 'loss': 'mae', 'optimizer': 'adam', 'graph_mode': 'off', 'use_snp_selection': True, 'num_snps': 11878}. Best is trial 17 with value: 0.3199931949585276.
[I 2025-12-06 07:06:46,511] Trial 22 finished with value: 0.30728106084988205 and parameters: {'model_type': 'mlp', 'hidden_dims': '[512, 256]', 'dropout': 0.49438798410675605, 'batch_norm': False, 'lr': 6.029488967043612e-06, 'weight_decay': 2.478555969641428e-05, 'epochs': 320, 'loss': 'mae', 'optimizer': 'adam', 'graph_mode': 'off', 'use_snp_selection': True, 'num_snps': 22259}. Best is trial 17 with value: 0.3199931949585276.
[I 2025-12-06 07:08:00,352] Trial 23 finished with value: 0.31578881314475826 and parameters: {'model_type': 'mlp', 'hidden_dims': '[512, 256]', 'dropout': 0.5923850373798929, 'batch_norm': False, 'lr': 2.738534126101666e-05, 'weight_decay': 6.3553713971194135e-06, 'epochs': 305, 'loss': 'mae', 'optimizer': 'adam', 'graph_mode': 'off', 'use_snp_selection': True, 'num_snps': 46925}. Best is trial 17 with value: 0.3199931949585276.
[I 2025-12-06 07:09:05,790] Trial 24 finished with value: 0.3150764829254168 and parameters: {'model_type': 'mlp', 'hidden_dims': '[512, 64]', 'dropout': 0.5357155178948195, 'batch_norm': False, 'lr': 8.36794934070151e-06, 'weight_decay': 0.00011660780779308084, 'epochs': 348, 'loss': 'mae', 'optimizer': 'adam', 'graph_mode': 'off', 'use_snp_selection': False}. Best is trial 17 with value: 0.3199931949585276.
[I 2025-12-06 07:09:58,656] Trial 25 finished with value: 0.3075672749097548 and parameters: {'model_type': 'mlp', 'hidden_dims': '[512, 256]', 'dropout': 0.4570861214961936, 'batch_norm': False, 'lr': 2.9702346243772555e-06, 'weight_decay': 3.134863387967167e-06, 'epochs': 272, 'loss': 'mae', 'optimizer': 'adam', 'graph_mode': 'off', 'use_snp_selection': False}. Best is trial 17 with value: 0.3199931949585276.
[I 2025-12-06 07:10:21,523] Trial 26 finished with value: 0.2651787947375148 and parameters: {'model_type': 'mlp', 'hidden_dims': '[128, 64]', 'dropout': 0.3444519897227373, 'batch_norm': False, 'lr': 5.2614032428997835e-06, 'weight_decay': 1.1334583702730412e-05, 'epochs': 327, 'loss': 'mse', 'optimizer': 'adam', 'graph_mode': 'off', 'use_snp_selection': True, 'num_snps': 2344}. Best is trial 17 with value: 0.3199931949585276.
[I 2025-12-06 07:10:46,249] Trial 27 finished with value: 0.3090230536447858 and parameters: {'model_type': 'mlp', 'hidden_dims': '[256, 128]', 'dropout': 0.5586821557443514, 'batch_norm': False, 'lr': 1.1997412428780102e-05, 'weight_decay': 5.882345609145746e-07, 'epochs': 222, 'loss': 'mae', 'optimizer': 'adam', 'graph_mode': 'off', 'use_snp_selection': False}. Best is trial 17 with value: 0.3199931949585276.
[I 2025-12-06 07:11:41,185] Trial 28 finished with value: 0.27923679437543336 and parameters: {'model_type': 'mlp', 'hidden_dims': '[256, 128, 64]', 'dropout': 0.49472968253417826, 'batch_norm': False, 'lr': 2.1212754463335467e-06, 'weight_decay': 1.280618643801206e-06, 'epochs': 295, 'loss': 'mae', 'optimizer': 'adam', 'graph_mode': 'off', 'use_snp_selection': True, 'num_snps': 48700}. Best is trial 17 with value: 0.3199931949585276.
[I 2025-12-06 07:12:16,560] Trial 29 finished with value: 0.30840062537541724 and parameters: {'model_type': 'mlp', 'hidden_dims': '[128, 64]', 'dropout': 0.33888670362120077, 'batch_norm': False, 'lr': 3.160808437645906e-05, 'weight_decay': 3.3119524521746254e-05, 'epochs': 328, 'loss': 'mae', 'optimizer': 'adam', 'graph_mode': 'off', 'use_snp_selection': True, 'num_snps': 26940}. Best is trial 17 with value: 0.3199931949585276.
[I 2025-12-06 07:13:07,798] Trial 30 finished with value: 0.2680753685286408 and parameters: {'model_type': 'mlp', 'hidden_dims': '[512, 64]', 'dropout': 0.5703615999608569, 'batch_norm': False, 'lr': 1.0984687100810053e-06, 'weight_decay': 4.663583082332408e-06, 'epochs': 266, 'loss': 'mae', 'optimizer': 'adam', 'graph_mode': 'off', 'use_snp_selection': False}. Best is trial 17 with value: 0.3199931949585276.
[I 2025-12-06 07:14:20,938] Trial 31 finished with value: 0.31824413519850875 and parameters: {'model_type': 'mlp', 'hidden_dims': '[512, 256]', 'dropout': 0.5993030909641737, 'batch_norm': False, 'lr': 2.546914440303722e-05, 'weight_decay': 9.650313792236238e-06, 'epochs': 305, 'loss': 'mae', 'optimizer': 'adam', 'graph_mode': 'off', 'use_snp_selection': True, 'num_snps': 46596}. Best is trial 17 with value: 0.3199931949585276.
[I 2025-12-06 07:15:54,287] Trial 32 finished with value: 0.3132298627380351 and parameters: {'model_type': 'mlp', 'hidden_dims': '[512, 256]', 'dropout': 0.5243165148645363, 'batch_norm': False, 'lr': 1.269317316324161e-05, 'weight_decay': 1.245946113335278e-05, 'epochs': 334, 'loss': 'mae', 'optimizer': 'adam', 'graph_mode': 'off', 'use_snp_selection': True, 'num_snps': 59732}. Best is trial 17 with value: 0.3199931949585276.
[I 2025-12-06 07:17:12,390] Trial 33 finished with value: 0.31159422619105304 and parameters: {'model_type': 'mlp', 'hidden_dims': '[512, 256]', 'dropout': 0.5648389083298772, 'batch_norm': False, 'lr': 4.65371680152691e-06, 'weight_decay': 9.847466629017369e-06, 'epochs': 300, 'loss': 'mae', 'optimizer': 'adam', 'graph_mode': 'off', 'use_snp_selection': True, 'num_snps': 51129}. Best is trial 17 with value: 0.3199931949585276.
[I 2025-12-06 07:18:20,960] Trial 34 finished with value: 0.3069732169292715 and parameters: {'model_type': 'mlp', 'hidden_dims': '[512, 256]', 'dropout': 0.5200403160749499, 'batch_norm': False, 'lr': 0.00010705636685819741, 'weight_decay': 0.0001529051529381839, 'epochs': 329, 'loss': 'mae', 'optimizer': 'adam', 'graph_mode': 'off', 'use_snp_selection': True, 'num_snps': 39805}. Best is trial 17 with value: 0.3199931949585276.
[I 2025-12-06 07:19:22,804] Trial 35 finished with value: 0.31597742851769134 and parameters: {'model_type': 'mlp', 'hidden_dims': '[256, 128]', 'dropout': 0.42344664818846134, 'batch_norm': False, 'lr': 2.189030063786486e-06, 'weight_decay': 1.4372476393433988e-05, 'epochs': 350, 'loss': 'mse', 'optimizer': 'adam', 'graph_mode': 'off', 'use_snp_selection': True, 'num_snps': 53373}. Best is trial 17 with value: 0.3199931949585276.
[I 2025-12-06 07:20:29,591] Trial 36 finished with value: 0.3175460531479942 and parameters: {'model_type': 'mlp', 'hidden_dims': '[512, 256]', 'dropout': 0.5967458269862148, 'batch_norm': False, 'lr': 2.1868770123676037e-05, 'weight_decay': 3.218743795431099e-05, 'epochs': 283, 'loss': 'mae', 'optimizer': 'adam', 'graph_mode': 'off', 'use_snp_selection': True, 'num_snps': 43153}. Best is trial 17 with value: 0.3199931949585276.
[I 2025-12-06 07:21:31,416] Trial 37 finished with value: 0.31154761570146683 and parameters: {'model_type': 'mlp', 'hidden_dims': '[512, 256]', 'dropout': 0.5992993085547327, 'batch_norm': False, 'lr': 4.06341094604709e-05, 'weight_decay': 4.713820732366923e-05, 'epochs': 250, 'loss': 'mae', 'optimizer': 'adam', 'graph_mode': 'off', 'use_snp_selection': True, 'num_snps': 42051}. Best is trial 17 with value: 0.3199931949585276.
[I 2025-12-06 07:22:46,007] Trial 38 finished with value: 0.30461981177260833 and parameters: {'model_type': 'mlp', 'hidden_dims': '[512, 256]', 'dropout': 0.4538409866364157, 'batch_norm': True, 'lr': 2.085401126215367e-05, 'weight_decay': 0.0003055601788636501, 'epochs': 285, 'loss': 'mse', 'optimizer': 'adam', 'graph_mode': 'off', 'use_snp_selection': True, 'num_snps': 49447}. Best is trial 17 with value: 0.3199931949585276.
[I 2025-12-06 07:23:40,617] Trial 39 finished with value: 0.30854219671400074 and parameters: {'model_type': 'mlp', 'hidden_dims': '[512, 256]', 'dropout': 0.39264881590554135, 'batch_norm': False, 'lr': 8.712740198473983e-05, 'weight_decay': 9.344867805023094e-06, 'epochs': 226, 'loss': 'mae', 'optimizer': 'adam', 'graph_mode': 'off', 'use_snp_selection': True, 'num_snps': 36887}. Best is trial 17 with value: 0.3199931949585276.
[I 2025-12-06 07:24:24,139] Trial 40 finished with value: 0.28567709336392755 and parameters: {'model_type': 'mlp', 'hidden_dims': '[256, 128, 64]', 'dropout': 0.5641617482168063, 'batch_norm': True, 'lr': 1.0631521591225574e-05, 'weight_decay': 0.0009236047417364131, 'epochs': 150, 'loss': 'mae', 'optimizer': 'adam', 'graph_mode': 'off', 'use_snp_selection': True, 'num_snps': 44954}. Best is trial 17 with value: 0.3199931949585276.
[I 2025-12-06 07:25:48,023] Trial 41 finished with value: 0.3159760408918532 and parameters: {'model_type': 'mlp', 'hidden_dims': '[512, 256]', 'dropout': 0.5989328498822974, 'batch_norm': False, 'lr': 6.5145509402095566e-06, 'weight_decay': 3.0190178646980907e-05, 'epochs': 313, 'loss': 'mae', 'optimizer': 'adam', 'graph_mode': 'off', 'use_snp_selection': True, 'num_snps': 54930}. Best is trial 17 with value: 0.3199931949585276.
[I 2025-12-06 07:26:51,198] Trial 42 finished with value: 0.3120294227852731 and parameters: {'model_type': 'mlp', 'hidden_dims': '[512, 64]', 'dropout': 0.5521135324126315, 'batch_norm': False, 'lr': 1.7688294178630336e-05, 'weight_decay': 4.4649987869695275e-06, 'epochs': 335, 'loss': 'mae', 'optimizer': 'adam', 'graph_mode': 'off', 'use_snp_selection': False}. Best is trial 17 with value: 0.3199931949585276.
