[I 2025-12-05 15:32:44,530] Trial 20 finished with value: 0.11184323417697367 and parameters: {'model_type': 'mlp', 'hidden_dims': '[512, 128]', 'dropout': 0.24280079961225087, 'batch_norm': True, 'lr': 0.00027854139843726527, 'weight_decay': 0.0001247981980720522, 'epochs': 209, 'loss': 'mae', 'optimizer': 'adam', 'graph_mode': 'off', 'use_snp_selection': False}. Best is trial 13 with value: 0.12554297740943787.
[I 2025-12-05 15:32:46,529] Trial 21 finished with value: 0.12019491910595509 and parameters: {'model_type': 'mlp', 'hidden_dims': '[512, 256]', 'dropout': 0.10476293573460951, 'batch_norm': True, 'lr': 0.0007192598632976957, 'weight_decay': 1.0387569766350335e-07, 'epochs': 262, 'loss': 'mae', 'optimizer': 'adam', 'graph_mode': 'off', 'use_snp_selection': False}. Best is trial 13 with value: 0.12554297740943787.
[I 2025-12-05 15:32:48,580] Trial 22 finished with value: 0.11405918424450211 and parameters: {'model_type': 'mlp', 'hidden_dims': '[512, 256]', 'dropout': 0.1593965393324864, 'batch_norm': True, 'lr': 0.00011032640406744552, 'weight_decay': 3.021383471596515e-07, 'epochs': 268, 'loss': 'mae', 'optimizer': 'adam', 'graph_mode': 'off', 'use_snp_selection': False}. Best is trial 13 with value: 0.12554297740943787.
[I 2025-12-05 15:32:50,751] Trial 23 finished with value: 0.12632940702399062 and parameters: {'model_type': 'mlp', 'hidden_dims': '[512, 256]', 'dropout': 0.1341205394438499, 'batch_norm': True, 'lr': 0.0009488759326036804, 'weight_decay': 1.0045315168651077e-07, 'epochs': 301, 'loss': 'mae', 'optimizer': 'adam', 'graph_mode': 'off', 'use_snp_selection': False}. Best is trial 23 with value: 0.12632940702399062.
[I 2025-12-05 15:32:52,947] Trial 24 finished with value: 0.11256489947758548 and parameters: {'model_type': 'mlp', 'hidden_dims': '[512, 128]', 'dropout': 0.191974616894514, 'batch_norm': True, 'lr': 0.0003468049419368994, 'weight_decay': 1.011770947645211e-06, 'epochs': 309, 'loss': 'mae', 'optimizer': 'adam', 'graph_mode': 'off', 'use_snp_selection': False}. Best is trial 23 with value: 0.12632940702399062.
[I 2025-12-05 15:32:54,409] Trial 25 finished with value: 0.09542635071888456 and parameters: {'model_type': 'mlp', 'hidden_dims': '[256, 128, 64]', 'dropout': 0.13862398524245284, 'batch_norm': True, 'lr': 2.5195225772198312e-05, 'weight_decay': 5.657106896308733e-06, 'epochs': 327, 'loss': 'mae', 'optimizer': 'adam', 'graph_mode': 'off', 'use_snp_selection': False}. Best is trial 23 with value: 0.12632940702399062.
[I 2025-12-05 15:32:55,493] Trial 26 finished with value: 0.09830714309962889 and parameters: {'model_type': 'mlp', 'hidden_dims': '[256, 128]', 'dropout': 0.21724036928116555, 'batch_norm': True, 'lr': 0.00024288162899868923, 'weight_decay': 2.417039343963891e-07, 'epochs': 288, 'loss': 'mae', 'optimizer': 'adam', 'graph_mode': 'off', 'use_snp_selection': True, 'num_snps': 3842}. Best is trial 23 with value: 0.12632940702399062.
[I 2025-12-05 15:32:56,434] Trial 27 finished with value: 0.10124858896443091 and parameters: {'model_type': 'mlp', 'hidden_dims': '[128, 64]', 'dropout': 0.1744849071055855, 'batch_norm': False, 'lr': 9.93915585566656e-05, 'weight_decay': 2.502820389878854e-06, 'epochs': 231, 'loss': 'mae', 'optimizer': 'adam', 'graph_mode': 'off', 'use_snp_selection': False}. Best is trial 23 with value: 0.12632940702399062.
[I 2025-12-05 15:32:58,854] Trial 28 finished with value: 0.11198410242324981 and parameters: {'model_type': 'mlp', 'hidden_dims': '[512, 256]', 'dropout': 0.1305043000233017, 'batch_norm': True, 'lr': 0.0009922981535435693, 'weight_decay': 8.74418883788382e-07, 'epochs': 350, 'loss': 'mae', 'optimizer': 'adam', 'graph_mode': 'off', 'use_snp_selection': False}. Best is trial 23 with value: 0.12632940702399062.
[I 2025-12-05 15:33:00,433] Trial 29 finished with value: 0.10328292849962026 and parameters: {'model_type': 'mlp', 'hidden_dims': '[128, 64]', 'dropout': 0.3098974207435964, 'batch_norm': True, 'lr': 0.0005388560200940643, 'weight_decay': 2.863104443991659e-05, 'epochs': 323, 'loss': 'mae', 'optimizer': 'adam', 'graph_mode': 'off', 'use_snp_selection': True, 'num_snps': 19468}. Best is trial 23 with value: 0.12632940702399062.
[I 2025-12-05 15:33:02,391] Trial 30 finished with value: 0.1144329805773312 and parameters: {'model_type': 'mlp', 'hidden_dims': '[512, 128]', 'dropout': 0.21291629422228292, 'batch_norm': True, 'lr': 0.00011108388119934771, 'weight_decay': 1.8150700606003345e-05, 'epochs': 257, 'loss': 'mae', 'optimizer': 'adam', 'graph_mode': 'off', 'use_snp_selection': False}. Best is trial 23 with value: 0.12632940702399062.
[I 2025-12-05 15:33:04,342] Trial 31 finished with value: 0.11089862641396528 and parameters: {'model_type': 'mlp', 'hidden_dims': '[512, 256]', 'dropout': 0.10452865787787058, 'batch_norm': True, 'lr': 0.0007682492525329413, 'weight_decay': 1.0029857029095271e-07, 'epochs': 255, 'loss': 'mae', 'optimizer': 'adam', 'graph_mode': 'off', 'use_snp_selection': False}. Best is trial 23 with value: 0.12632940702399062.
[I 2025-12-05 15:33:06,154] Trial 32 finished with value: 0.12126266459999731 and parameters: {'model_type': 'mlp', 'hidden_dims': '[512, 256]', 'dropout': 0.12998920133371566, 'batch_norm': True, 'lr': 0.0004566924412256056, 'weight_decay': 1.7416766806340917e-07, 'epochs': 219, 'loss': 'mae', 'optimizer': 'adam', 'graph_mode': 'off', 'use_snp_selection': False}. Best is trial 23 with value: 0.12632940702399062.
[I 2025-12-05 15:33:07,752] Trial 33 finished with value: 0.11877338965609027 and parameters: {'model_type': 'mlp', 'hidden_dims': '[512, 256]', 'dropout': 0.1711219126015809, 'batch_norm': True, 'lr': 0.00041364595565734723, 'weight_decay': 2.2406559089181043e-07, 'epochs': 172, 'loss': 'mae', 'optimizer': 'adam', 'graph_mode': 'off', 'use_snp_selection': False}. Best is trial 23 with value: 0.12632940702399062.
[I 2025-12-05 15:33:09,552] Trial 34 finished with value: 0.1208156561198217 and parameters: {'model_type': 'mlp', 'hidden_dims': '[512, 256]', 'dropout': 0.13631048162085938, 'batch_norm': True, 'lr': 0.00024693398847029885, 'weight_decay': 5.835211738859762e-07, 'epochs': 215, 'loss': 'mae', 'optimizer': 'adam', 'graph_mode': 'off', 'use_snp_selection': False}. Best is trial 23 with value: 0.12632940702399062.
[I 2025-12-05 15:33:11,325] Trial 35 finished with value: 0.09698810039441408 and parameters: {'model_type': 'mlp', 'hidden_dims': '[512, 256]', 'dropout': 0.47656250797170563, 'batch_norm': False, 'lr': 0.0005189129170331736, 'weight_decay': 5.73846214341993e-07, 'epochs': 215, 'loss': 'mae', 'optimizer': 'adam', 'graph_mode': 'off', 'use_snp_selection': False}. Best is trial 23 with value: 0.12632940702399062.
[I 2025-12-05 15:33:14,483] Trial 36 finished with value: 0.12355549379918045 and parameters: {'model_type': 'mlp', 'hidden_dims': '[512, 256]', 'dropout': 0.2455490289182055, 'batch_norm': True, 'lr': 0.00028897232979797005, 'weight_decay': 1.975925448647616e-07, 'epochs': 165, 'loss': 'mse', 'optimizer': 'adam', 'graph_mode': 'off', 'use_snp_selection': True, 'num_snps': 58661}. Best is trial 23 with value: 0.12632940702399062.
[I 2025-12-05 15:33:17,178] Trial 37 finished with value: 0.023731244835431913 and parameters: {'model_type': 'mlp', 'hidden_dims': '[256, 128]', 'dropout': 0.24657362872392924, 'batch_norm': True, 'lr': 3.2960060893625088e-06, 'weight_decay': 2.2757874964598332e-07, 'epochs': 126, 'loss': 'mse', 'optimizer': 'adam', 'graph_mode': 'off', 'use_snp_selection': True, 'num_snps': 57733}. Best is trial 23 with value: 0.12632940702399062.
[I 2025-12-05 15:33:19,891] Trial 38 finished with value: 0.08755368854147146 and parameters: {'model_type': 'mlp', 'hidden_dims': '[512, 256]', 'dropout': 0.27801881229527636, 'batch_norm': False, 'lr': 4.225742179310148e-05, 'weight_decay': 1.4658294024486884e-07, 'epochs': 184, 'loss': 'mse', 'optimizer': 'adam', 'graph_mode': 'off', 'use_snp_selection': True, 'num_snps': 46312}. Best is trial 23 with value: 0.12632940702399062.
[I 2025-12-05 15:33:21,421] Trial 39 finished with value: 0.11643497219889214 and parameters: {'model_type': 'mlp', 'hidden_dims': '[512, 64]', 'dropout': 0.3685503103229054, 'batch_norm': True, 'lr': 8.683899069123396e-05, 'weight_decay': 1.630749319172809e-07, 'epochs': 153, 'loss': 'mse', 'optimizer': 'adam', 'graph_mode': 'off', 'use_snp_selection': True, 'num_snps': 19621}. Best is trial 23 with value: 0.12632940702399062.
[I 2025-12-05 15:33:23,629] Trial 40 finished with value: 0.11156290319545237 and parameters: {'model_type': 'mlp', 'hidden_dims': '[256, 128, 64]', 'dropout': 0.5832815775516413, 'batch_norm': True, 'lr': 0.00013614888015089184, 'weight_decay': 3.8106407715330573e-07, 'epochs': 136, 'loss': 'mse', 'optimizer': 'adam', 'graph_mode': 'off', 'use_snp_selection': True, 'num_snps': 46840}. Best is trial 23 with value: 0.12632940702399062.
[I 2025-12-05 15:33:25,449] Trial 41 finished with value: 0.1318840164883516 and parameters: {'model_type': 'mlp', 'hidden_dims': '[512, 256]', 'dropout': 0.19572290619534083, 'batch_norm': True, 'lr': 0.0003355540579508516, 'weight_decay': 5.402412492225752e-07, 'epochs': 218, 'loss': 'mse', 'optimizer': 'adam', 'graph_mode': 'off', 'use_snp_selection': True, 'num_snps': 25404}. Best is trial 41 with value: 0.1318840164883516.
[I 2025-12-05 15:33:26,931] Trial 42 finished with value: 0.120249787415565 and parameters: {'model_type': 'mlp', 'hidden_dims': '[512, 256]', 'dropout': 0.2050777092978204, 'batch_norm': True, 'lr': 0.0003956489200693447, 'weight_decay': 1.9081442702169198e-07, 'epochs': 162, 'loss': 'mse', 'optimizer': 'adam', 'graph_mode': 'off', 'use_snp_selection': True, 'num_snps': 21115}. Best is trial 41 with value: 0.1318840164883516.
[I 2025-12-05 15:33:28,868] Trial 43 finished with value: 0.129993989431745 and parameters: {'model_type': 'mlp', 'hidden_dims': '[512, 256]', 'dropout': 0.23739330993674013, 'batch_norm': True, 'lr': 0.0002945807639890343, 'weight_decay': 4.987649665361037e-07, 'epochs': 194, 'loss': 'mse', 'optimizer': 'adam', 'graph_mode': 'off', 'use_snp_selection': True, 'num_snps': 29722}. Best is trial 41 with value: 0.1318840164883516.
[I 2025-12-05 15:33:30,516] Trial 44 finished with value: 0.12941170279156022 and parameters: {'model_type': 'mlp', 'hidden_dims': '[512, 256]', 'dropout': 0.26244284831762527, 'batch_norm': True, 'lr': 0.0003370638735756021, 'weight_decay': 5.102748292902327e-07, 'epochs': 183, 'loss': 'mse', 'optimizer': 'adam', 'graph_mode': 'off', 'use_snp_selection': True, 'num_snps': 23951}. Best is trial 41 with value: 0.1318840164883516.
[I 2025-12-05 15:33:32,210] Trial 45 finished with value: 0.12262386063338404 and parameters: {'model_type': 'mlp', 'hidden_dims': '[512, 256]', 'dropout': 0.26562649439925123, 'batch_norm': True, 'lr': 0.0006618416603569632, 'weight_decay': 2.0448002455594943e-06, 'epochs': 198, 'loss': 'mse', 'optimizer': 'adam', 'graph_mode': 'off', 'use_snp_selection': True, 'num_snps': 24970}. Best is trial 41 with value: 0.1318840164883516.
[I 2025-12-05 15:33:34,059] Trial 46 finished with value: 0.12167471604513584 and parameters: {'model_type': 'mlp', 'hidden_dims': '[512, 64]', 'dropout': 0.3091660353041539, 'batch_norm': True, 'lr': 0.0001948678252199722, 'weight_decay': 4.4488064228747186e-07, 'epochs': 180, 'loss': 'mse', 'optimizer': 'adam', 'graph_mode': 'off', 'use_snp_selection': True, 'num_snps': 29045}. Best is trial 41 with value: 0.1318840164883516.
[I 2025-12-05 15:33:36,390] Trial 47 finished with value: 0.1081425441810847 and parameters: {'model_type': 'mlp', 'hidden_dims': '[512, 256]', 'dropout': 0.23012548561016288, 'batch_norm': False, 'lr': 0.0003372058697673986, 'weight_decay': 8.132130366842522e-07, 'epochs': 246, 'loss': 'mse', 'optimizer': 'adam', 'graph_mode': 'off', 'use_snp_selection': True, 'num_snps': 35649}. Best is trial 41 with value: 0.1318840164883516.
[I 2025-12-05 15:33:37,701] Trial 48 finished with value: 0.08663279163753886 and parameters: {'model_type': 'mlp', 'hidden_dims': '[256, 128]', 'dropout': 0.18897593806808574, 'batch_norm': True, 'lr': 6.411353606875784e-05, 'weight_decay': 1.1896306576100553e-06, 'epochs': 191, 'loss': 'mse', 'optimizer': 'adam', 'graph_mode': 'off', 'use_snp_selection': True, 'num_snps': 14760}. Best is trial 41 with value: 0.1318840164883516.
[I 2025-12-05 15:33:39,340] Trial 49 finished with value: 0.11704034075625863 and parameters: {'model_type': 'mlp', 'hidden_dims': '[512, 256]', 'dropout': 0.29273336967323305, 'batch_norm': True, 'lr': 0.00014731276649354222, 'weight_decay': 5.656125459717183e-06, 'epochs': 124, 'loss': 'mse', 'optimizer': 'adam', 'graph_mode': 'off', 'use_snp_selection': True, 'num_snps': 26419}. Best is trial 41 with value: 0.1318840164883516.
[I 2025-12-05 15:33:41,862] Trial 50 finished with value: -0.0162640831267742 and parameters: {'model_type': 'mlp', 'hidden_dims': '[512, 256]', 'dropout': 0.3367645592832789, 'batch_norm': True, 'lr': 1.0622088740885973e-06, 'weight_decay': 1.7029827272740412e-06, 'epochs': 279, 'loss': 'mse', 'optimizer': 'adam', 'graph_mode': 'off', 'use_snp_selection': True, 'num_snps': 38281}. Best is trial 41 with value: 0.1318840164883516.
[I 2025-12-05 15:33:43,769] Trial 51 finished with value: 0.11283012463193895 and parameters: {'model_type': 'mlp', 'hidden_dims': '[512, 256]', 'dropout': 0.2557097607402549, 'batch_norm': True, 'lr': 0.0002796801573707868, 'weight_decay': 4.344464741008327e-07, 'epochs': 163, 'loss': 'mse', 'optimizer': 'adam', 'graph_mode': 'off', 'use_snp_selection': True, 'num_snps': 30694}. Best is trial 41 with value: 0.1318840164883516.
[I 2025-12-05 15:33:45,392] Trial 52 finished with value: 0.12818968084641444 and parameters: {'model_type': 'mlp', 'hidden_dims': '[512, 256]', 'dropout': 0.23205155560018853, 'batch_norm': True, 'lr': 0.0003290618429494993, 'weight_decay': 2.8404132048239523e-07, 'epochs': 202, 'loss': 'mse', 'optimizer': 'adam', 'graph_mode': 'off', 'use_snp_selection': True, 'num_snps': 22496}. Best is trial 41 with value: 0.1318840164883516.
[I 2025-12-05 15:33:46,648] Trial 53 finished with value: 0.11460734350591302 and parameters: {'model_type': 'mlp', 'hidden_dims': '[512, 256]', 'dropout': 0.23522296201004825, 'batch_norm': True, 'lr': 0.0005488419742005603, 'weight_decay': 2.8866134034861624e-07, 'epochs': 201, 'loss': 'mse', 'optimizer': 'adam', 'graph_mode': 'off', 'use_snp_selection': True, 'num_snps': 12122}. Best is trial 41 with value: 0.1318840164883516.
[I 2025-12-05 15:33:48,271] Trial 54 finished with value: 0.12090659322576316 and parameters: {'model_type': 'mlp', 'hidden_dims': '[512, 256]', 'dropout': 0.16729066595272157, 'batch_norm': True, 'lr': 0.0007992722617030454, 'weight_decay': 6.617322294231786e-07, 'epochs': 227, 'loss': 'mse', 'optimizer': 'adam', 'graph_mode': 'off', 'use_snp_selection': True, 'num_snps': 22189}. Best is trial 41 with value: 0.1318840164883516.
[I 2025-12-05 15:33:49,668] Trial 55 finished with value: 0.10859234696069503 and parameters: {'model_type': 'mlp', 'hidden_dims': '[128, 64]', 'dropout': 0.27189651130627224, 'batch_norm': True, 'lr': 0.00022587915494817862, 'weight_decay': 3.360732529898894e-07, 'epochs': 240, 'loss': 'mse', 'optimizer': 'adam', 'graph_mode': 'off', 'use_snp_selection': True, 'num_snps': 16203}. Best is trial 41 with value: 0.1318840164883516.
[I 2025-12-05 15:33:51,421] Trial 56 finished with value: 0.11037128395982203 and parameters: {'model_type': 'mlp', 'hidden_dims': '[512, 64]', 'dropout': 0.20877023228644698, 'batch_norm': True, 'lr': 0.00013832411011466356, 'weight_decay': 3.40695195673277e-06, 'epochs': 206, 'loss': 'mse', 'optimizer': 'adam', 'graph_mode': 'off', 'use_snp_selection': True, 'num_snps': 25740}. Best is trial 41 with value: 0.1318840164883516.
[I 2025-12-05 15:33:53,254] Trial 57 finished with value: 0.11942892387538334 and parameters: {'model_type': 'mlp', 'hidden_dims': '[256, 128, 64]', 'dropout': 0.18690604621105975, 'batch_norm': True, 'lr': 0.0003490254389630122, 'weight_decay': 1.5366637232454474e-07, 'epochs': 187, 'loss': 'mse', 'optimizer': 'adam', 'graph_mode': 'off', 'use_snp_selection': True, 'num_snps': 31150}. Best is trial 41 with value: 0.1318840164883516.
[I 2025-12-05 15:33:54,266] Trial 58 finished with value: 0.08163121392441054 and parameters: {'model_type': 'mlp', 'hidden_dims': '[512, 128]', 'dropout': 0.29223926684574547, 'batch_norm': False, 'lr': 0.0001982894137729427, 'weight_decay': 5.565748840742693e-07, 'epochs': 246, 'loss': 'mse', 'optimizer': 'adam', 'graph_mode': 'off', 'use_snp_selection': True, 'num_snps': 5940}. Best is trial 41 with value: 0.1318840164883516.
[I 2025-12-05 15:33:56,949] Trial 59 finished with value: 0.10101778956445367 and parameters: {'model_type': 'mlp', 'hidden_dims': '[512, 256]', 'dropout': 0.1507711934197931, 'batch_norm': True, 'lr': 6.174868591915433e-06, 'weight_decay': 0.0008627845833040022, 'epochs': 284, 'loss': 'mse', 'optimizer': 'adam', 'graph_mode': 'off', 'use_snp_selection': True, 'num_snps': 40084}. Best is trial 41 with value: 0.1318840164883516.
[I 2025-12-05 15:33:58,717] Trial 60 finished with value: 0.12752691479634343 and parameters: {'model_type': 'mlp', 'hidden_dims': '[512, 256]', 'dropout': 0.2254400161585514, 'batch_norm': True, 'lr': 0.0006135675797326128, 'weight_decay': 1.2541395240758373e-07, 'epochs': 226, 'loss': 'mse', 'optimizer': 'adam', 'graph_mode': 'off', 'use_snp_selection': True, 'num_snps': 23886}. Best is trial 41 with value: 0.1318840164883516.
[I 2025-12-05 15:34:00,433] Trial 61 finished with value: 0.13087864453605086 and parameters: {'model_type': 'mlp', 'hidden_dims': '[512, 256]', 'dropout': 0.214934082268026, 'batch_norm': True, 'lr': 0.0005942228320137948, 'weight_decay': 1.1475463615301255e-07, 'epochs': 225, 'loss': 'mse', 'optimizer': 'adam', 'graph_mode': 'off', 'use_snp_selection': True, 'num_snps': 24137}. Best is trial 41 with value: 0.1318840164883516.
[I 2025-12-05 15:34:02,147] Trial 62 finished with value: 0.1235622487843054 and parameters: {'model_type': 'mlp', 'hidden_dims': '[512, 256]', 'dropout': 0.22572663853965225, 'batch_norm': True, 'lr': 0.0006115935361745589, 'weight_decay': 1.2959748466025038e-07, 'epochs': 227, 'loss': 'mse', 'optimizer': 'adam', 'graph_mode': 'off', 'use_snp_selection': True, 'num_snps': 23932}. Best is trial 41 with value: 0.1318840164883516.
[I 2025-12-05 15:34:04,013] Trial 63 finished with value: 0.12174590632153531 and parameters: {'model_type': 'mlp', 'hidden_dims': '[512, 256]', 'dropout': 0.18020798579403213, 'batch_norm': True, 'lr': 0.0008483414955428748, 'weight_decay': 2.854132980328917e-07, 'epochs': 195, 'loss': 'mse', 'optimizer': 'adam', 'graph_mode': 'off', 'use_snp_selection': True, 'num_snps': 27496}. Best is trial 41 with value: 0.1318840164883516.
[I 2025-12-05 15:34:05,411] Trial 64 finished with value: 0.1205659307007913 and parameters: {'model_type': 'mlp', 'hidden_dims': '[512, 256]', 'dropout': 0.19869201945630832, 'batch_norm': True, 'lr': 0.0004663593961843017, 'weight_decay': 0.0003871857177265734, 'epochs': 208, 'loss': 'mse', 'optimizer': 'adam', 'graph_mode': 'off', 'use_snp_selection': True, 'num_snps': 16999}. Best is trial 41 with value: 0.1318840164883516.
[I 2025-12-05 15:34:07,061] Trial 65 finished with value: 0.12044937347002801 and parameters: {'model_type': 'mlp', 'hidden_dims': '[512, 256]', 'dropout': 0.2556764168635977, 'batch_norm': True, 'lr': 0.000692120244697776, 'weight_decay': 4.0928691628056147e-07, 'epochs': 221, 'loss': 'mse', 'optimizer': 'adam', 'graph_mode': 'off', 'use_snp_selection': True, 'num_snps': 22663}. Best is trial 41 with value: 0.1318840164883516.
[I 2025-12-05 15:34:09,262] Trial 66 finished with value: 0.12034908318697152 and parameters: {'model_type': 'mlp', 'hidden_dims': '[512, 256]', 'dropout': 0.11950140760590025, 'batch_norm': True, 'lr': 0.000990086976509957, 'weight_decay': 1.2721089139194175e-07, 'epochs': 236, 'loss': 'mse', 'optimizer': 'adam', 'graph_mode': 'off', 'use_snp_selection': True, 'num_snps': 33654}. Best is trial 41 with value: 0.1318840164883516.
[I 2025-12-05 15:34:11,076] Trial 67 finished with value: 0.12515216896637193 and parameters: {'model_type': 'mlp', 'hidden_dims': '[512, 256]', 'dropout': 0.15507375268815815, 'batch_norm': True, 'lr': 0.0003052595791219055, 'weight_decay': 2.514882882254328e-07, 'epochs': 172, 'loss': 'mse', 'optimizer': 'adam', 'graph_mode': 'off', 'use_snp_selection': True, 'num_snps': 28362}. Best is trial 41 with value: 0.1318840164883516.
[I 2025-12-05 15:34:12,535] Trial 68 finished with value: 0.13168333919400627 and parameters: {'model_type': 'mlp', 'hidden_dims': '[512, 256]', 'dropout': 0.21897980837265085, 'batch_norm': True, 'lr': 0.0004070806364076318, 'weight_decay': 9.85982530856272e-07, 'epochs': 151, 'loss': 'mse', 'optimizer': 'adam', 'graph_mode': 'off', 'use_snp_selection': True, 'num_snps': 20832}. Best is trial 41 with value: 0.1318840164883516.
[I 2025-12-05 15:34:13,953] Trial 69 finished with value: 0.13128380819093177 and parameters: {'model_type': 'mlp', 'hidden_dims': '[512, 256]', 'dropout': 0.22052691435435107, 'batch_norm': True, 'lr': 0.0004075850387506537, 'weight_decay': 7.321346770571057e-07, 'epochs': 151, 'loss': 'mse', 'optimizer': 'adam', 'graph_mode': 'off', 'use_snp_selection': True, 'num_snps': 19447}. Best is trial 41 with value: 0.1318840164883516.
[I 2025-12-05 15:34:15,200] Trial 70 finished with value: 0.09563397841892345 and parameters: {'model_type': 'mlp', 'hidden_dims': '[256, 128]', 'dropout': 0.2091378026994698, 'batch_norm': False, 'lr': 0.00039243790993551424, 'weight_decay': 1.0683141507438947e-06, 'epochs': 111, 'loss': 'mse', 'optimizer': 'adam', 'graph_mode': 'off', 'use_snp_selection': True, 'num_snps': 18889}. Best is trial 41 with value: 0.1318840164883516.
