[I 2025-12-06 15:05:21,180] Trial 145 finished with value: 0.27186945641614246 and parameters: {'model_type': 'mlp', 'hidden_dims': '[512, 256]', 'dropout': 0.26031385617947406, 'batch_norm': False, 'lr': 9.358217971378434e-06, 'weight_decay': 6.874773263390388e-07, 'epochs': 109, 'loss': 'mae', 'optimizer': 'adam', 'graph_mode': 'off', 'use_snp_selection': False}. Best is trial 88 with value: 0.2792669062575092.
[I 2025-12-06 15:05:56,628] Trial 146 finished with value: 0.2655510882924377 and parameters: {'model_type': 'mlp', 'hidden_dims': '[512, 256]', 'dropout': 0.26553182249899093, 'batch_norm': False, 'lr': 3.932466109192545e-05, 'weight_decay': 6.098440919716885e-07, 'epochs': 102, 'loss': 'mae', 'optimizer': 'adam', 'graph_mode': 'off', 'use_snp_selection': False}. Best is trial 88 with value: 0.2792669062575092.
[I 2025-12-06 15:06:34,321] Trial 147 finished with value: 0.26539320134234445 and parameters: {'model_type': 'mlp', 'hidden_dims': '[512, 128]', 'dropout': 0.256766764402856, 'batch_norm': False, 'lr': 1.4397739217380775e-05, 'weight_decay': 5.366953451214493e-07, 'epochs': 109, 'loss': 'mae', 'optimizer': 'adam', 'graph_mode': 'off', 'use_snp_selection': False}. Best is trial 88 with value: 0.2792669062575092.
[I 2025-12-06 15:07:04,418] Trial 148 finished with value: 0.2596844956882157 and parameters: {'model_type': 'mlp', 'hidden_dims': '[128, 64]', 'dropout': 0.5005670966109883, 'batch_norm': False, 'lr': 2.8396606753349218e-05, 'weight_decay': 1.2411165683481805e-06, 'epochs': 341, 'loss': 'mae', 'optimizer': 'adam', 'graph_mode': 'off', 'use_snp_selection': False}. Best is trial 88 with value: 0.2792669062575092.
[I 2025-12-06 15:07:39,054] Trial 149 finished with value: 0.260747637212137 and parameters: {'model_type': 'mlp', 'hidden_dims': '[512, 256]', 'dropout': 0.5179375420750549, 'batch_norm': False, 'lr': 9.815044946850775e-06, 'weight_decay': 1.9043923061052154e-07, 'epochs': 97, 'loss': 'mae', 'optimizer': 'adam', 'graph_mode': 'off', 'use_snp_selection': False}. Best is trial 88 with value: 0.2792669062575092.
