[I 2025-12-05 14:28:39,076] Trial 53 finished with value: 0.10737385224328394 and parameters: {'model_type': 'mlp', 'hidden_dims': '[512, 64]', 'dropout': 0.1753088940066529, 'batch_norm': False, 'lr': 0.00021703220132669433, 'weight_decay': 0.0004250585356523155, 'epochs': 229, 'loss': 'mae', 'optimizer': 'adam', 'graph_mode': 'off', 'use_snp_selection': False}. Best is trial 32 with value: 0.1302124254881053.
[I 2025-12-05 14:28:41,168] Trial 54 finished with value: 0.0976384085583076 and parameters: {'model_type': 'mlp', 'hidden_dims': '[512, 64]', 'dropout': 0.3212563845470413, 'batch_norm': False, 'lr': 0.00013456935096407504, 'weight_decay': 1.3877295973186256e-05, 'epochs': 265, 'loss': 'mae', 'optimizer': 'adam', 'graph_mode': 'off', 'use_snp_selection': False}. Best is trial 32 with value: 0.1302124254881053.
[I 2025-12-05 14:28:42,436] Trial 55 finished with value: 0.11406801552690798 and parameters: {'model_type': 'mlp', 'hidden_dims': '[256, 128]', 'dropout': 0.3369592523106022, 'batch_norm': True, 'lr': 9.432381477280697e-05, 'weight_decay': 2.2943408314025952e-05, 'epochs': 218, 'loss': 'mae', 'optimizer': 'adam', 'graph_mode': 'off', 'use_snp_selection': False}. Best is trial 32 with value: 0.1302124254881053.
[I 2025-12-05 14:28:43,753] Trial 56 finished with value: 0.09145538595171575 and parameters: {'model_type': 'mlp', 'hidden_dims': '[256, 128]', 'dropout': 0.281053829574222, 'batch_norm': True, 'lr': 0.0004230259268188116, 'weight_decay': 8.088372619127388e-06, 'epochs': 248, 'loss': 'mae', 'optimizer': 'adam', 'graph_mode': 'off', 'use_snp_selection': False}. Best is trial 32 with value: 0.1302124254881053.
[I 2025-12-05 14:28:44,626] Trial 57 finished with value: 0.08532740742582447 and parameters: {'model_type': 'mlp', 'hidden_dims': '[128, 64]', 'dropout': 0.4524672200199514, 'batch_norm': False, 'lr': 4.171162314142003e-05, 'weight_decay': 9.732067264960767e-05, 'epochs': 166, 'loss': 'mae', 'optimizer': 'adam', 'graph_mode': 'off', 'use_snp_selection': False}. Best is trial 32 with value: 0.1302124254881053.
[I 2025-12-05 14:28:45,825] Trial 58 finished with value: 0.10595322445157497 and parameters: {'model_type': 'mlp', 'hidden_dims': '[256, 128, 64]', 'dropout': 0.3035202862233946, 'batch_norm': True, 'lr': 0.00028826610830935256, 'weight_decay': 3.862974852578458e-06, 'epochs': 186, 'loss': 'mae', 'optimizer': 'adam', 'graph_mode': 'off', 'use_snp_selection': False}. Best is trial 32 with value: 0.1302124254881053.
[I 2025-12-05 14:28:48,083] Trial 59 finished with value: 0.10747782955381857 and parameters: {'model_type': 'mlp', 'hidden_dims': '[512, 256]', 'dropout': 0.42568393466290283, 'batch_norm': False, 'lr': 0.0001268325398585348, 'weight_decay': 6.83236023812252e-05, 'epochs': 300, 'loss': 'mae', 'optimizer': 'adam', 'graph_mode': 'off', 'use_snp_selection': False}. Best is trial 32 with value: 0.1302124254881053.
[I 2025-12-05 14:28:49,003] Trial 60 finished with value: 0.08646015142190963 and parameters: {'model_type': 'mlp', 'hidden_dims': '[256, 128]', 'dropout': 0.36318019262711354, 'batch_norm': True, 'lr': 2.9386999859176603e-05, 'weight_decay': 8.1043272155458e-06, 'epochs': 138, 'loss': 'mse', 'optimizer': 'adam', 'graph_mode': 'off', 'use_snp_selection': True, 'num_snps': 2400}. Best is trial 32 with value: 0.1302124254881053.
[I 2025-12-05 14:28:51,180] Trial 61 finished with value: 0.116066636970866 and parameters: {'model_type': 'mlp', 'hidden_dims': '[512, 64]', 'dropout': 0.381999000351794, 'batch_norm': False, 'lr': 5.217821147419533e-05, 'weight_decay': 0.00019347359489748628, 'epochs': 283, 'loss': 'mae', 'optimizer': 'adam', 'graph_mode': 'off', 'use_snp_selection': False}. Best is trial 32 with value: 0.1302124254881053.
[I 2025-12-05 14:28:53,113] Trial 62 finished with value: 0.11666731264486598 and parameters: {'model_type': 'mlp', 'hidden_dims': '[512, 64]', 'dropout': 0.3846459813799752, 'batch_norm': False, 'lr': 9.0778930027647e-05, 'weight_decay': 0.0001269104489299842, 'epochs': 237, 'loss': 'mae', 'optimizer': 'adam', 'graph_mode': 'off', 'use_snp_selection': False}. Best is trial 32 with value: 0.1302124254881053.
[I 2025-12-05 14:28:55,014] Trial 63 finished with value: 0.09827488028137059 and parameters: {'model_type': 'mlp', 'hidden_dims': '[512, 64]', 'dropout': 0.3433161333544127, 'batch_norm': False, 'lr': 9.497191296102633e-05, 'weight_decay': 4.8729692046842454e-05, 'epochs': 238, 'loss': 'mae', 'optimizer': 'adam', 'graph_mode': 'off', 'use_snp_selection': False}. Best is trial 32 with value: 0.1302124254881053.
[I 2025-12-05 14:28:56,828] Trial 64 finished with value: 0.11784044861570082 and parameters: {'model_type': 'mlp', 'hidden_dims': '[512, 64]', 'dropout': 0.3295314774643626, 'batch_norm': False, 'lr': 8.360269733347337e-05, 'weight_decay': 0.00012873685643605736, 'epochs': 209, 'loss': 'mae', 'optimizer': 'adam', 'graph_mode': 'off', 'use_snp_selection': False}. Best is trial 32 with value: 0.1302124254881053.
[I 2025-12-05 14:28:58,084] Trial 65 finished with value: 0.09900964143766644 and parameters: {'model_type': 'mlp', 'hidden_dims': '[256, 128]', 'dropout': 0.2655409442700971, 'batch_norm': False, 'lr': 0.0001746759881091842, 'weight_decay': 0.0005347179017355345, 'epochs': 209, 'loss': 'mae', 'optimizer': 'adam', 'graph_mode': 'off', 'use_snp_selection': False}. Best is trial 32 with value: 0.1302124254881053.
[I 2025-12-05 14:28:59,396] Trial 66 finished with value: 0.0990415899141227 and parameters: {'model_type': 'mlp', 'hidden_dims': '[256, 128, 64]', 'dropout': 0.3251877540349081, 'batch_norm': True, 'lr': 6.139334850099621e-05, 'weight_decay': 4.0934928935646034e-05, 'epochs': 222, 'loss': 'mae', 'optimizer': 'adam', 'graph_mode': 'off', 'use_snp_selection': False}. Best is trial 32 with value: 0.1302124254881053.
[I 2025-12-05 14:29:01,157] Trial 67 finished with value: 0.10153560664955744 and parameters: {'model_type': 'mlp', 'hidden_dims': '[512, 64]', 'dropout': 0.290368099258388, 'batch_norm': False, 'lr': 0.00015259244124352913, 'weight_decay': 8.16047940740546e-05, 'epochs': 201, 'loss': 'mae', 'optimizer': 'adam', 'graph_mode': 'off', 'use_snp_selection': False}. Best is trial 32 with value: 0.1302124254881053.
[I 2025-12-05 14:29:02,804] Trial 68 finished with value: 0.09653509534286704 and parameters: {'model_type': 'mlp', 'hidden_dims': '[512, 128]', 'dropout': 0.314172854934648, 'batch_norm': False, 'lr': 7.432116984385524e-05, 'weight_decay': 2.4572627319952097e-06, 'epochs': 172, 'loss': 'mae', 'optimizer': 'adam', 'graph_mode': 'off', 'use_snp_selection': False}. Best is trial 32 with value: 0.1302124254881053.
[I 2025-12-05 14:29:04,187] Trial 69 finished with value: 0.11733802234484096 and parameters: {'model_type': 'mlp', 'hidden_dims': '[256, 128]', 'dropout': 0.10581166303183756, 'batch_norm': True, 'lr': 0.00010915122002773095, 'weight_decay': 0.00011613219701447153, 'epochs': 260, 'loss': 'mae', 'optimizer': 'adam', 'graph_mode': 'off', 'use_snp_selection': False}. Best is trial 32 with value: 0.1302124254881053.
[I 2025-12-05 14:29:05,495] Trial 70 finished with value: 0.10464375593912617 and parameters: {'model_type': 'mlp', 'hidden_dims': '[256, 128, 64]', 'dropout': 0.3568350358257225, 'batch_norm': False, 'lr': 0.00022376339022945937, 'weight_decay': 0.0002789681892615567, 'epochs': 246, 'loss': 'mae', 'optimizer': 'adam', 'graph_mode': 'off', 'use_snp_selection': False}. Best is trial 32 with value: 0.1302124254881053.
[I 2025-12-05 14:29:06,901] Trial 71 finished with value: 0.12356546184279532 and parameters: {'model_type': 'mlp', 'hidden_dims': '[256, 128]', 'dropout': 0.1398325822790052, 'batch_norm': True, 'lr': 0.00011027273633272524, 'weight_decay': 0.0001242073670131923, 'epochs': 264, 'loss': 'mae', 'optimizer': 'adam', 'graph_mode': 'off', 'use_snp_selection': False}. Best is trial 32 with value: 0.1302124254881053.
[I 2025-12-05 14:29:08,195] Trial 72 finished with value: 0.10575379911983394 and parameters: {'model_type': 'mlp', 'hidden_dims': '[256, 128]', 'dropout': 0.16440741422112468, 'batch_norm': True, 'lr': 0.00016918700584606395, 'weight_decay': 0.00015495823991664096, 'epochs': 217, 'loss': 'mae', 'optimizer': 'adam', 'graph_mode': 'off', 'use_snp_selection': False}. Best is trial 32 with value: 0.1302124254881053.
[I 2025-12-05 14:29:09,454] Trial 73 finished with value: 0.1178020797916497 and parameters: {'model_type': 'mlp', 'hidden_dims': '[256, 128]', 'dropout': 0.14054857443194282, 'batch_norm': True, 'lr': 0.00012252296150117194, 'weight_decay': 1.8046448664708175e-07, 'epochs': 204, 'loss': 'mae', 'optimizer': 'adam', 'graph_mode': 'off', 'use_snp_selection': False}. Best is trial 32 with value: 0.1302124254881053.
[I 2025-12-05 14:29:10,639] Trial 74 finished with value: 0.0988051844843064 and parameters: {'model_type': 'mlp', 'hidden_dims': '[256, 128]', 'dropout': 0.12307416379437175, 'batch_norm': True, 'lr': 4.078038257986158e-05, 'weight_decay': 3.217360656488393e-05, 'epochs': 186, 'loss': 'mae', 'optimizer': 'adam', 'graph_mode': 'off', 'use_snp_selection': False}. Best is trial 32 with value: 0.1302124254881053.
[I 2025-12-05 14:29:11,605] Trial 75 finished with value: 0.12001728677198825 and parameters: {'model_type': 'mlp', 'hidden_dims': '[128, 64]', 'dropout': 0.19651999700510292, 'batch_norm': True, 'lr': 8.002806867260639e-05, 'weight_decay': 5.882702693227348e-05, 'epochs': 253, 'loss': 'mae', 'optimizer': 'adam', 'graph_mode': 'off', 'use_snp_selection': False}. Best is trial 32 with value: 0.1302124254881053.
[I 2025-12-05 14:29:14,238] Trial 76 finished with value: 0.10693701589151021 and parameters: {'model_type': 'mlp', 'hidden_dims': '[128, 64]', 'dropout': 0.2101859578551401, 'batch_norm': True, 'lr': 6.033245657135906e-05, 'weight_decay': 5.592069798602186e-05, 'epochs': 227, 'loss': 'mae', 'optimizer': 'adam', 'graph_mode': 'off', 'use_snp_selection': True, 'num_snps': 49234}. Best is trial 32 with value: 0.1302124254881053.
[I 2025-12-05 14:29:15,347] Trial 77 finished with value: 0.02117779002206666 and parameters: {'model_type': 'mlp', 'hidden_dims': '[128, 64]', 'dropout': 0.12830277608480695, 'batch_norm': True, 'lr': 2.24208017577082e-06, 'weight_decay': 1.3904772481424094e-05, 'epochs': 255, 'loss': 'mae', 'optimizer': 'adam', 'graph_mode': 'off', 'use_snp_selection': False}. Best is trial 32 with value: 0.1302124254881053.
[I 2025-12-05 14:29:16,328] Trial 78 finished with value: 0.10541560124732216 and parameters: {'model_type': 'mlp', 'hidden_dims': '[128, 64]', 'dropout': 0.1829025521313886, 'batch_norm': True, 'lr': 8.525053059466819e-05, 'weight_decay': 7.933911647047929e-05, 'epochs': 232, 'loss': 'mse', 'optimizer': 'adam', 'graph_mode': 'off', 'use_snp_selection': False}. Best is trial 32 with value: 0.1302124254881053.
[I 2025-12-05 14:29:17,317] Trial 79 finished with value: 0.10426171253669923 and parameters: {'model_type': 'mlp', 'hidden_dims': '[128, 64]', 'dropout': 0.1982867573594509, 'batch_norm': True, 'lr': 2.3143489677545154e-05, 'weight_decay': 2.4732618781729e-05, 'epochs': 244, 'loss': 'mae', 'optimizer': 'adam', 'graph_mode': 'off', 'use_snp_selection': False}. Best is trial 32 with value: 0.1302124254881053.
[I 2025-12-05 14:29:18,594] Trial 80 finished with value: 0.10045594300844322 and parameters: {'model_type': 'mlp', 'hidden_dims': '[256, 128, 64]', 'dropout': 0.4450085885194657, 'batch_norm': True, 'lr': 3.172687792520665e-05, 'weight_decay': 3.819826475252682e-05, 'epochs': 213, 'loss': 'mae', 'optimizer': 'adam', 'graph_mode': 'off', 'use_snp_selection': False}. Best is trial 32 with value: 0.1302124254881053.
[I 2025-12-05 14:29:20,020] Trial 81 finished with value: 0.11170910524204286 and parameters: {'model_type': 'mlp', 'hidden_dims': '[256, 128]', 'dropout': 0.4129312286399289, 'batch_norm': True, 'lr': 0.00010605547297270621, 'weight_decay': 5.976558393263718e-05, 'epochs': 267, 'loss': 'mae', 'optimizer': 'adam', 'graph_mode': 'off', 'use_snp_selection': False}. Best is trial 32 with value: 0.1302124254881053.
[I 2025-12-05 14:29:21,460] Trial 82 finished with value: 0.11024099442849922 and parameters: {'model_type': 'mlp', 'hidden_dims': '[256, 128, 64]', 'dropout': 0.23176118977731616, 'batch_norm': False, 'lr': 0.00038769994235211705, 'weight_decay': 1.9936102117946525e-05, 'epochs': 274, 'loss': 'mae', 'optimizer': 'adam', 'graph_mode': 'off', 'use_snp_selection': False}. Best is trial 32 with value: 0.1302124254881053.
[I 2025-12-05 14:29:23,493] Trial 83 finished with value: 0.10949516182012432 and parameters: {'model_type': 'mlp', 'hidden_dims': '[512, 256]', 'dropout': 0.330304576820075, 'batch_norm': True, 'lr': 0.0002843913258439524, 'weight_decay': 9.500601469688564e-05, 'epochs': 250, 'loss': 'mae', 'optimizer': 'adam', 'graph_mode': 'off', 'use_snp_selection': False}. Best is trial 32 with value: 0.1302124254881053.
[I 2025-12-05 14:29:25,666] Trial 84 finished with value: 0.09594077385950062 and parameters: {'model_type': 'mlp', 'hidden_dims': '[512, 64]', 'dropout': 0.3511766247445774, 'batch_norm': False, 'lr': 0.0006154394544067957, 'weight_decay': 4.434779606034202e-05, 'epochs': 284, 'loss': 'mae', 'optimizer': 'adam', 'graph_mode': 'off', 'use_snp_selection': False}. Best is trial 32 with value: 0.1302124254881053.
[I 2025-12-05 14:29:27,174] Trial 85 finished with value: 0.10600143944205788 and parameters: {'model_type': 'mlp', 'hidden_dims': '[256, 128]', 'dropout': 0.4004710168809469, 'batch_norm': True, 'lr': 7.275920186049226e-05, 'weight_decay': 0.0001415668725117008, 'epochs': 296, 'loss': 'mae', 'optimizer': 'adam', 'graph_mode': 'off', 'use_snp_selection': False}. Best is trial 32 with value: 0.1302124254881053.
[I 2025-12-05 14:29:28,577] Trial 86 finished with value: 0.09077159255149458 and parameters: {'model_type': 'mlp', 'hidden_dims': '[256, 128, 64]', 'dropout': 0.4656091381885583, 'batch_norm': False, 'lr': 0.0001971525534253871, 'weight_decay': 1.4788268249456112e-05, 'epochs': 264, 'loss': 'mae', 'optimizer': 'adam', 'graph_mode': 'off', 'use_snp_selection': False}. Best is trial 32 with value: 0.1302124254881053.
[I 2025-12-05 14:29:30,223] Trial 87 finished with value: 0.12280813882147183 and parameters: {'model_type': 'mlp', 'hidden_dims': '[512, 128]', 'dropout': 0.3810754051905686, 'batch_norm': False, 'lr': 0.00014880921722270523, 'weight_decay': 0.00021731201569145185, 'epochs': 193, 'loss': 'mae', 'optimizer': 'adam', 'graph_mode': 'off', 'use_snp_selection': True, 'num_snps': 21748}. Best is trial 32 with value: 0.1302124254881053.
[I 2025-12-05 14:29:32,052] Trial 88 finished with value: 0.1058021739951352 and parameters: {'model_type': 'mlp', 'hidden_dims': '[512, 128]', 'dropout': 0.37769051003101184, 'batch_norm': True, 'lr': 0.0001555464868203159, 'weight_decay': 0.0003427245562539762, 'epochs': 186, 'loss': 'mse', 'optimizer': 'adam', 'graph_mode': 'off', 'use_snp_selection': True, 'num_snps': 24485}. Best is trial 32 with value: 0.1302124254881053.
[I 2025-12-05 14:29:33,279] Trial 89 finished with value: 0.10090036727142819 and parameters: {'model_type': 'mlp', 'hidden_dims': '[512, 128]', 'dropout': 0.42351747829952147, 'batch_norm': False, 'lr': 7.834034548883802e-05, 'weight_decay': 0.0002046097304901622, 'epochs': 196, 'loss': 'mae', 'optimizer': 'adam', 'graph_mode': 'off', 'use_snp_selection': True, 'num_snps': 11138}. Best is trial 32 with value: 0.1302124254881053.
[I 2025-12-05 14:29:35,292] Trial 90 finished with value: 0.11480413281749355 and parameters: {'model_type': 'mlp', 'hidden_dims': '[512, 128]', 'dropout': 0.38799463997537004, 'batch_norm': False, 'lr': 4.8097041613189515e-05, 'weight_decay': 3.523648770107153e-05, 'epochs': 224, 'loss': 'mae', 'optimizer': 'adam', 'graph_mode': 'off', 'use_snp_selection': True, 'num_snps': 29088}. Best is trial 32 with value: 0.1302124254881053.
[I 2025-12-05 14:29:36,706] Trial 91 finished with value: 0.10970138911355828 and parameters: {'model_type': 'mlp', 'hidden_dims': '[512, 128]', 'dropout': 0.3626010946570281, 'batch_norm': False, 'lr': 0.00014017900346145805, 'weight_decay': 0.00010837801311992026, 'epochs': 204, 'loss': 'mae', 'optimizer': 'adam', 'graph_mode': 'off', 'use_snp_selection': True, 'num_snps': 15283}. Best is trial 32 with value: 0.1302124254881053.
[I 2025-12-05 14:29:38,752] Trial 92 finished with value: 0.10045107274975094 and parameters: {'model_type': 'mlp', 'hidden_dims': '[128, 64]', 'dropout': 0.4066772332274289, 'batch_norm': False, 'lr': 6.611182361772704e-05, 'weight_decay': 0.0001701982532172713, 'epochs': 233, 'loss': 'mae', 'optimizer': 'adam', 'graph_mode': 'off', 'use_snp_selection': True, 'num_snps': 36709}. Best is trial 32 with value: 0.1302124254881053.
[I 2025-12-05 14:29:40,053] Trial 93 finished with value: 0.1116550584831697 and parameters: {'model_type': 'mlp', 'hidden_dims': '[256, 128]', 'dropout': 0.43732391526405495, 'batch_norm': False, 'lr': 0.00020915073837129403, 'weight_decay': 7.934688971828416e-05, 'epochs': 240, 'loss': 'mae', 'optimizer': 'adam', 'graph_mode': 'off', 'use_snp_selection': False}. Best is trial 32 with value: 0.1302124254881053.
[I 2025-12-05 14:29:41,850] Trial 94 finished with value: 0.10941730618390853 and parameters: {'model_type': 'mlp', 'hidden_dims': '[512, 64]', 'dropout': 0.35004278523181986, 'batch_norm': False, 'lr': 0.00024776067704500163, 'weight_decay': 0.00027060918214278756, 'epochs': 215, 'loss': 'mae', 'optimizer': 'adam', 'graph_mode': 'off', 'use_snp_selection': False}. Best is trial 32 with value: 0.1302124254881053.
[I 2025-12-05 14:29:43,379] Trial 95 finished with value: 0.11189909816212112 and parameters: {'model_type': 'mlp', 'hidden_dims': '[256, 128, 64]', 'dropout': 0.3732872865995881, 'batch_norm': False, 'lr': 9.67594271025381e-05, 'weight_decay': 0.00042810291592596146, 'epochs': 308, 'loss': 'mae', 'optimizer': 'adam', 'graph_mode': 'off', 'use_snp_selection': False}. Best is trial 32 with value: 0.1302124254881053.
[I 2025-12-05 14:29:45,406] Trial 96 finished with value: 0.0848058638801448 and parameters: {'model_type': 'mlp', 'hidden_dims': '[256, 128, 64]', 'dropout': 0.39327476804679495, 'batch_norm': True, 'lr': 0.0001177691427778249, 'weight_decay': 6.438918317698277e-05, 'epochs': 250, 'loss': 'mae', 'optimizer': 'adam', 'graph_mode': 'off', 'use_snp_selection': True, 'num_snps': 30286}. Best is trial 32 with value: 0.1302124254881053.
[I 2025-12-05 14:29:46,590] Trial 97 finished with value: 0.11276215974830224 and parameters: {'model_type': 'mlp', 'hidden_dims': '[256, 128]', 'dropout': 0.1567337599964462, 'batch_norm': False, 'lr': 0.00017181408051879455, 'weight_decay': 2.6490780345417792e-05, 'epochs': 192, 'loss': 'mae', 'optimizer': 'adam', 'graph_mode': 'off', 'use_snp_selection': False}. Best is trial 32 with value: 0.1302124254881053.
[I 2025-12-05 14:29:48,221] Trial 98 finished with value: 0.1211267507908396 and parameters: {'model_type': 'mlp', 'hidden_dims': '[512, 64]', 'dropout': 0.4227962199133076, 'batch_norm': False, 'lr': 0.000313585421116272, 'weight_decay': 0.00011403329406169878, 'epochs': 177, 'loss': 'mae', 'optimizer': 'adam', 'graph_mode': 'off', 'use_snp_selection': False}. Best is trial 32 with value: 0.1302124254881053.
[I 2025-12-05 14:29:49,749] Trial 99 finished with value: 0.11598170574899139 and parameters: {'model_type': 'mlp', 'hidden_dims': '[512, 128]', 'dropout': 0.42758516468915975, 'batch_norm': True, 'lr': 0.0003378244095302641, 'weight_decay': 5.419899734408084e-06, 'epochs': 145, 'loss': 'mae', 'optimizer': 'adam', 'graph_mode': 'off', 'use_snp_selection': False}. Best is trial 32 with value: 0.1302124254881053.
[I 2025-12-05 14:29:51,380] Trial 100 finished with value: 0.1105908633843808 and parameters: {'model_type': 'mlp', 'hidden_dims': '[512, 256]', 'dropout': 0.4726163089426981, 'batch_norm': False, 'lr': 8.112914675945931e-05, 'weight_decay': 4.759897065037805e-05, 'epochs': 172, 'loss': 'mae', 'optimizer': 'adam', 'graph_mode': 'off', 'use_snp_selection': False}. Best is trial 32 with value: 0.1302124254881053.
[I 2025-12-05 14:29:53,029] Trial 101 finished with value: 0.08763909710309889 and parameters: {'model_type': 'mlp', 'hidden_dims': '[512, 64]', 'dropout': 0.41862293198677825, 'batch_norm': False, 'lr': 0.00013088292711866957, 'weight_decay': 0.0002290981009228478, 'epochs': 181, 'loss': 'mae', 'optimizer': 'adam', 'graph_mode': 'off', 'use_snp_selection': False}. Best is trial 32 with value: 0.1302124254881053.
[I 2025-12-05 14:29:54,559] Trial 102 finished with value: 0.08944833645996857 and parameters: {'model_type': 'mlp', 'hidden_dims': '[512, 64]', 'dropout': 0.49142603668610674, 'batch_norm': False, 'lr': 0.0002889009900551754, 'weight_decay': 0.00011857814182014675, 'epochs': 156, 'loss': 'mae', 'optimizer': 'adam', 'graph_mode': 'off', 'use_snp_selection': False}. Best is trial 32 with value: 0.1302124254881053.
[I 2025-12-05 14:29:56,663] Trial 103 finished with value: 0.10103987758013588 and parameters: {'model_type': 'mlp', 'hidden_dims': '[512, 64]', 'dropout': 0.4403891967562049, 'batch_norm': False, 'lr': 0.0005041505069910602, 'weight_decay': 9.067514314016999e-05, 'epochs': 270, 'loss': 'mae', 'optimizer': 'adam', 'graph_mode': 'off', 'use_snp_selection': False}. Best is trial 32 with value: 0.1302124254881053.
[I 2025-12-05 14:29:58,454] Trial 104 finished with value: 0.10131131851635644 and parameters: {'model_type': 'mlp', 'hidden_dims': '[512, 64]', 'dropout': 0.3111286154434027, 'batch_norm': False, 'lr': 0.00023590666981949374, 'weight_decay': 0.00014685065854100462, 'epochs': 208, 'loss': 'mae', 'optimizer': 'adam', 'graph_mode': 'off', 'use_snp_selection': False}. Best is trial 32 with value: 0.1302124254881053.
