[I 2025-12-05 15:49:14,578] Trial 35 finished with value: 0.0005725458855590551 and parameters: {'model_type': 'mlp', 'hidden_dims': '[256, 128]', 'dropout': 0.5736481135896393, 'batch_norm': False, 'lr': 3.519449140766006e-06, 'weight_decay': 7.561483398058526e-07, 'epochs': 206, 'loss': 'mae', 'optimizer': 'adam', 'graph_mode': 'off', 'use_snp_selection': True, 'num_snps': 4274}. Best is trial 31 with value: 0.05841416553166555.
[I 2025-12-05 15:49:15,426] Trial 36 finished with value: -0.0034852053277700475 and parameters: {'model_type': 'mlp', 'hidden_dims': '[512, 64]', 'dropout': 0.5157046798128726, 'batch_norm': False, 'lr': 4.438694438472416e-05, 'weight_decay': 1.7671198263567516e-06, 'epochs': 176, 'loss': 'mse', 'optimizer': 'adam', 'graph_mode': 'off', 'use_snp_selection': True, 'num_snps': 6118}. Best is trial 31 with value: 0.05841416553166555.
[I 2025-12-05 15:49:16,686] Trial 37 finished with value: 0.04632564362922047 and parameters: {'model_type': 'mlp', 'hidden_dims': '[256, 128, 64]', 'dropout': 0.40170919214752, 'batch_norm': False, 'lr': 7.972064250408825e-05, 'weight_decay': 3.665743098928086e-07, 'epochs': 296, 'loss': 'mae', 'optimizer': 'adam', 'graph_mode': 'off', 'use_snp_selection': True, 'num_snps': 13737}. Best is trial 31 with value: 0.05841416553166555.
[I 2025-12-05 15:49:17,922] Trial 38 finished with value: 0.03159469785515 and parameters: {'model_type': 'mlp', 'hidden_dims': '[512, 128]', 'dropout': 0.46711905166097956, 'batch_norm': False, 'lr': 2.0666704567227137e-05, 'weight_decay': 1.0159998691334256e-07, 'epochs': 144, 'loss': 'mse', 'optimizer': 'adam', 'graph_mode': 'off', 'use_snp_selection': False}. Best is trial 31 with value: 0.05841416553166555.
[I 2025-12-05 15:49:20,039] Trial 39 finished with value: -0.004678790718754393 and parameters: {'model_type': 'mlp', 'hidden_dims': '[256, 128]', 'dropout': 0.5712163882530944, 'batch_norm': True, 'lr': 3.989530875971189e-05, 'weight_decay': 9.927828356622684e-06, 'epochs': 251, 'loss': 'mae', 'optimizer': 'adam', 'graph_mode': 'off', 'use_snp_selection': True, 'num_snps': 42953}. Best is trial 31 with value: 0.05841416553166555.
[I 2025-12-05 15:49:21,678] Trial 40 finished with value: 0.009483093471958394 and parameters: {'model_type': 'mlp', 'hidden_dims': '[512, 128]', 'dropout': 0.5224075125478564, 'batch_norm': True, 'lr': 0.0003387026142980359, 'weight_decay': 2.51917194985929e-05, 'epochs': 229, 'loss': 'mae', 'optimizer': 'adam', 'graph_mode': 'off', 'use_snp_selection': False}. Best is trial 31 with value: 0.05841416553166555.
[I 2025-12-05 15:49:22,942] Trial 41 finished with value: 0.038854644002350086 and parameters: {'model_type': 'mlp', 'hidden_dims': '[256, 128, 64]', 'dropout': 0.4180142451651142, 'batch_norm': False, 'lr': 6.601110305729223e-05, 'weight_decay': 3.5605620542224965e-07, 'epochs': 298, 'loss': 'mae', 'optimizer': 'adam', 'graph_mode': 'off', 'use_snp_selection': True, 'num_snps': 13749}. Best is trial 31 with value: 0.05841416553166555.
[I 2025-12-05 15:49:23,987] Trial 42 finished with value: 0.057039535253878615 and parameters: {'model_type': 'mlp', 'hidden_dims': '[256, 128, 64]', 'dropout': 0.39134673955151833, 'batch_norm': False, 'lr': 0.0001753589086759719, 'weight_decay': 1.772269450668321e-07, 'epochs': 307, 'loss': 'mae', 'optimizer': 'adam', 'graph_mode': 'off', 'use_snp_selection': True, 'num_snps': 7229}. Best is trial 31 with value: 0.05841416553166555.
[I 2025-12-05 15:49:24,871] Trial 43 finished with value: 0.02574644180332755 and parameters: {'model_type': 'mlp', 'hidden_dims': '[256, 128, 64]', 'dropout': 0.37820918873157355, 'batch_norm': False, 'lr': 0.00019632297972605825, 'weight_decay': 2.1375872825008912e-07, 'epochs': 180, 'loss': 'mae', 'optimizer': 'adam', 'graph_mode': 'off', 'use_snp_selection': True, 'num_snps': 7490}. Best is trial 31 with value: 0.05841416553166555.
[I 2025-12-05 15:49:25,934] Trial 44 finished with value: 0.05876329844938989 and parameters: {'model_type': 'mlp', 'hidden_dims': '[256, 128, 64]', 'dropout': 0.31329907560859327, 'batch_norm': False, 'lr': 0.0006414823374756896, 'weight_decay': 9.090918472727493e-07, 'epochs': 337, 'loss': 'mse', 'optimizer': 'adam', 'graph_mode': 'off', 'use_snp_selection': True, 'num_snps': 5051}. Best is trial 44 with value: 0.05876329844938989.
[I 2025-12-05 15:49:27,005] Trial 45 finished with value: 0.038752427421427246 and parameters: {'model_type': 'mlp', 'hidden_dims': '[256, 128, 64]', 'dropout': 0.34249991778348954, 'batch_norm': False, 'lr': 0.0006315057349433268, 'weight_decay': 9.048893422633252e-07, 'epochs': 330, 'loss': 'mse', 'optimizer': 'adam', 'graph_mode': 'off', 'use_snp_selection': True, 'num_snps': 5169}. Best is trial 44 with value: 0.05876329844938989.
[I 2025-12-05 15:49:28,381] Trial 46 finished with value: -0.004472712720580535 and parameters: {'model_type': 'mlp', 'hidden_dims': '[256, 128, 64]', 'dropout': 0.3147208761931702, 'batch_norm': True, 'lr': 0.00016508702503918233, 'weight_decay': 5.081643311095402e-07, 'epochs': 350, 'loss': 'mse', 'optimizer': 'adam', 'graph_mode': 'off', 'use_snp_selection': False}. Best is trial 44 with value: 0.05876329844938989.
[I 2025-12-05 15:49:31,037] Trial 47 finished with value: -0.008102749115734074 and parameters: {'model_type': 'mlp', 'hidden_dims': '[256, 128, 64]', 'dropout': 0.2310801596549027, 'batch_norm': False, 'lr': 0.00033382279897434074, 'weight_decay': 1.7650223847556747e-06, 'epochs': 310, 'loss': 'mse', 'optimizer': 'adam', 'graph_mode': 'off', 'use_snp_selection': True, 'num_snps': 57127}. Best is trial 44 with value: 0.05876329844938989.
[I 2025-12-05 15:49:32,261] Trial 48 finished with value: 0.028665133000217065 and parameters: {'model_type': 'mlp', 'hidden_dims': '[512, 64]', 'dropout': 0.2935150922501837, 'batch_norm': True, 'lr': 0.0006626178565829753, 'weight_decay': 1.469680913885399e-07, 'epochs': 332, 'loss': 'mse', 'optimizer': 'adam', 'graph_mode': 'off', 'use_snp_selection': True, 'num_snps': 11533}. Best is trial 44 with value: 0.05876329844938989.
[I 2025-12-05 15:49:33,588] Trial 49 finished with value: 0.04317754638700698 and parameters: {'model_type': 'mlp', 'hidden_dims': '[512, 256]', 'dropout': 0.36250514399067313, 'batch_norm': False, 'lr': 0.0002694019117434463, 'weight_decay': 3.716378795419685e-06, 'epochs': 272, 'loss': 'mse', 'optimizer': 'adam', 'graph_mode': 'off', 'use_snp_selection': True, 'num_snps': 16642}. Best is trial 44 with value: 0.05876329844938989.
[I 2025-12-05 15:49:35,271] Trial 50 finished with value: 0.01043771777985191 and parameters: {'model_type': 'mlp', 'hidden_dims': '[256, 128, 64]', 'dropout': 0.39074800990649144, 'batch_norm': True, 'lr': 0.0007914261069951968, 'weight_decay': 2.7381316497593096e-07, 'epochs': 322, 'loss': 'mse', 'optimizer': 'adam', 'graph_mode': 'off', 'use_snp_selection': True, 'num_snps': 20846}. Best is trial 44 with value: 0.05876329844938989.
[I 2025-12-05 15:49:36,165] Trial 51 finished with value: 0.028620503541042213 and parameters: {'model_type': 'mlp', 'hidden_dims': '[512, 128]', 'dropout': 0.44877333131084474, 'batch_norm': False, 'lr': 9.118594735144972e-05, 'weight_decay': 1.9148045743866766e-06, 'epochs': 158, 'loss': 'mae', 'optimizer': 'adam', 'graph_mode': 'off', 'use_snp_selection': True, 'num_snps': 8206}. Best is trial 44 with value: 0.05876329844938989.
[I 2025-12-05 15:49:37,019] Trial 52 finished with value: -0.01950972532796454 and parameters: {'model_type': 'mlp', 'hidden_dims': '[256, 128, 64]', 'dropout': 0.557878812467993, 'batch_norm': False, 'lr': 5.737582366368242e-05, 'weight_decay': 5.254108660272719e-07, 'epochs': 206, 'loss': 'mae', 'optimizer': 'adam', 'graph_mode': 'off', 'use_snp_selection': True, 'num_snps': 4105}. Best is trial 44 with value: 0.05876329844938989.
[I 2025-12-05 15:49:38,055] Trial 53 finished with value: 0.0528899904422626 and parameters: {'model_type': 'mlp', 'hidden_dims': '[256, 128]', 'dropout': 0.4826658225905353, 'batch_norm': False, 'lr': 0.0003234033867283877, 'weight_decay': 2.5356470617984893e-06, 'epochs': 302, 'loss': 'mae', 'optimizer': 'adam', 'graph_mode': 'off', 'use_snp_selection': True, 'num_snps': 9254}. Best is trial 44 with value: 0.05876329844938989.
[I 2025-12-05 15:49:39,134] Trial 54 finished with value: 0.023419631612895994 and parameters: {'model_type': 'mlp', 'hidden_dims': '[256, 128]', 'dropout': 0.4796072776756089, 'batch_norm': False, 'lr': 0.000312548847967251, 'weight_decay': 1.1217944696521412e-06, 'epochs': 291, 'loss': 'mae', 'optimizer': 'adam', 'graph_mode': 'off', 'use_snp_selection': True, 'num_snps': 11524}. Best is trial 44 with value: 0.05876329844938989.
[I 2025-12-05 15:49:40,021] Trial 55 finished with value: 0.03961781092046689 and parameters: {'model_type': 'mlp', 'hidden_dims': '[256, 128]', 'dropout': 0.45007068420858787, 'batch_norm': False, 'lr': 0.0005331052633898801, 'weight_decay': 2.31009790409006e-06, 'epochs': 313, 'loss': 'mse', 'optimizer': 'adam', 'graph_mode': 'off', 'use_snp_selection': True, 'num_snps': 2244}. Best is trial 44 with value: 0.05876329844938989.
[I 2025-12-05 15:49:41,114] Trial 56 finished with value: 0.051511088490259024 and parameters: {'model_type': 'mlp', 'hidden_dims': '[256, 128]', 'dropout': 0.29309917428906457, 'batch_norm': False, 'lr': 0.0009836453872131624, 'weight_decay': 0.0008946259409421015, 'epochs': 303, 'loss': 'mae', 'optimizer': 'adam', 'graph_mode': 'off', 'use_snp_selection': True, 'num_snps': 8332}. Best is trial 44 with value: 0.05876329844938989.
[I 2025-12-05 15:49:42,289] Trial 57 finished with value: 0.0004091220016239074 and parameters: {'model_type': 'mlp', 'hidden_dims': '[256, 128]', 'dropout': 0.2455849277054425, 'batch_norm': False, 'lr': 0.000916117488287032, 'weight_decay': 1.3576946523123385e-07, 'epochs': 267, 'loss': 'mae', 'optimizer': 'adam', 'graph_mode': 'off', 'use_snp_selection': False}. Best is trial 44 with value: 0.05876329844938989.
[I 2025-12-05 15:49:43,405] Trial 58 finished with value: 0.03468284464892652 and parameters: {'model_type': 'mlp', 'hidden_dims': '[128, 64]', 'dropout': 0.28506861445153503, 'batch_norm': False, 'lr': 0.0001593449604291838, 'weight_decay': 0.0005141565610541663, 'epochs': 342, 'loss': 'mae', 'optimizer': 'adam', 'graph_mode': 'off', 'use_snp_selection': True, 'num_snps': 9303}. Best is trial 44 with value: 0.05876329844938989.
[I 2025-12-05 15:49:45,209] Trial 59 finished with value: 0.03669104609959009 and parameters: {'model_type': 'mlp', 'hidden_dims': '[256, 128]', 'dropout': 0.19440161067692913, 'batch_norm': False, 'lr': 0.00021740070954047908, 'weight_decay': 2.449639696469342e-07, 'epochs': 308, 'loss': 'mae', 'optimizer': 'adam', 'graph_mode': 'off', 'use_snp_selection': True, 'num_snps': 34964}. Best is trial 44 with value: 0.05876329844938989.
[I 2025-12-05 15:49:46,424] Trial 60 finished with value: 0.008173663253319722 and parameters: {'model_type': 'mlp', 'hidden_dims': '[512, 64]', 'dropout': 0.30398446098344356, 'batch_norm': False, 'lr': 0.0003827617872422315, 'weight_decay': 0.0007575215065309138, 'epochs': 285, 'loss': 'mse', 'optimizer': 'adam', 'graph_mode': 'off', 'use_snp_selection': True, 'num_snps': 15846}. Best is trial 44 with value: 0.05876329844938989.
[I 2025-12-05 15:49:47,591] Trial 61 finished with value: 0.036637497311127594 and parameters: {'model_type': 'mlp', 'hidden_dims': '[256, 128]', 'dropout': 0.26889150803787626, 'batch_norm': True, 'lr': 0.0005669867867273794, 'weight_decay': 4.41893632881525e-06, 'epochs': 303, 'loss': 'mae', 'optimizer': 'adam', 'graph_mode': 'off', 'use_snp_selection': True, 'num_snps': 8615}. Best is trial 44 with value: 0.05876329844938989.
[I 2025-12-05 15:49:48,585] Trial 62 finished with value: 0.03756714890386445 and parameters: {'model_type': 'mlp', 'hidden_dims': '[256, 128]', 'dropout': 0.3198980588125308, 'batch_norm': False, 'lr': 1.038788092140181e-06, 'weight_decay': 0.0002104380154951638, 'epochs': 325, 'loss': 'mae', 'optimizer': 'adam', 'graph_mode': 'off', 'use_snp_selection': True, 'num_snps': 4424}. Best is trial 44 with value: 0.05876329844938989.
[I 2025-12-05 15:49:49,752] Trial 63 finished with value: 0.028050763565553288 and parameters: {'model_type': 'mlp', 'hidden_dims': '[256, 128]', 'dropout': 0.3364777566428831, 'batch_norm': False, 'lr': 0.0007190520401123665, 'weight_decay': 5.857150907228503e-06, 'epochs': 285, 'loss': 'mae', 'optimizer': 'adam', 'graph_mode': 'off', 'use_snp_selection': True, 'num_snps': 11921}. Best is trial 44 with value: 0.05876329844938989.
[I 2025-12-05 15:49:50,742] Trial 64 finished with value: 0.055621706225801266 and parameters: {'model_type': 'mlp', 'hidden_dims': '[512, 256]', 'dropout': 0.514580528892087, 'batch_norm': False, 'lr': 0.000990086976509957, 'weight_decay': 1.4224455461527662e-06, 'epochs': 338, 'loss': 'mae', 'optimizer': 'adam', 'graph_mode': 'off', 'use_snp_selection': True, 'num_snps': 4573}. Best is trial 44 with value: 0.05876329844938989.
[I 2025-12-05 15:49:51,711] Trial 65 finished with value: 0.025158318212852214 and parameters: {'model_type': 'mlp', 'hidden_dims': '[512, 256]', 'dropout': 0.49193602379519796, 'batch_norm': False, 'lr': 0.000479971919405208, 'weight_decay': 1.2533221761336066e-06, 'epochs': 338, 'loss': 'mae', 'optimizer': 'adam', 'graph_mode': 'off', 'use_snp_selection': True, 'num_snps': 3781}. Best is trial 44 with value: 0.05876329844938989.
[I 2025-12-05 15:49:52,809] Trial 66 finished with value: 0.046693602223136926 and parameters: {'model_type': 'mlp', 'hidden_dims': '[512, 256]', 'dropout': 0.41157989676396217, 'batch_norm': False, 'lr': 0.0009956938503537906, 'weight_decay': 8.263617311407376e-07, 'epochs': 318, 'loss': 'mae', 'optimizer': 'adam', 'graph_mode': 'off', 'use_snp_selection': True, 'num_snps': 9982}. Best is trial 44 with value: 0.05876329844938989.
[I 2025-12-05 15:49:54,167] Trial 67 finished with value: 0.020524456852654662 and parameters: {'model_type': 'mlp', 'hidden_dims': '[512, 256]', 'dropout': 0.37001328207044026, 'batch_norm': False, 'lr': 0.0002880071091644387, 'weight_decay': 4.837935735479868e-07, 'epochs': 322, 'loss': 'mae', 'optimizer': 'adam', 'graph_mode': 'off', 'use_snp_selection': True, 'num_snps': 18846}. Best is trial 44 with value: 0.05876329844938989.
[I 2025-12-05 15:49:55,110] Trial 68 finished with value: 0.004167401217199081 and parameters: {'model_type': 'mlp', 'hidden_dims': '[512, 256]', 'dropout': 0.5307434245234888, 'batch_norm': False, 'lr': 0.0008208057569507158, 'weight_decay': 3.001303925118644e-06, 'epochs': 341, 'loss': 'mae', 'optimizer': 'adam', 'graph_mode': 'off', 'use_snp_selection': True, 'num_snps': 2199}. Best is trial 44 with value: 0.05876329844938989.
[I 2025-12-05 15:49:56,415] Trial 69 finished with value: 0.029392825015964113 and parameters: {'model_type': 'mlp', 'hidden_dims': '[256, 128, 64]', 'dropout': 0.21899201842492444, 'batch_norm': False, 'lr': 0.00043584334257186784, 'weight_decay': 1.489448911985115e-07, 'epochs': 332, 'loss': 'mae', 'optimizer': 'adam', 'graph_mode': 'off', 'use_snp_selection': True, 'num_snps': 12490}. Best is trial 44 with value: 0.05876329844938989.
[I 2025-12-05 15:49:57,742] Trial 70 finished with value: -0.020067646391155037 and parameters: {'model_type': 'mlp', 'hidden_dims': '[128, 64]', 'dropout': 0.27128818303951896, 'batch_norm': False, 'lr': 0.0001710202785847264, 'weight_decay': 8.623066965923417e-05, 'epochs': 40, 'loss': 'mae', 'optimizer': 'adam', 'graph_mode': 'off', 'use_snp_selection': True, 'num_snps': 27265}. Best is trial 44 with value: 0.05876329844938989.
[I 2025-12-05 15:49:58,822] Trial 71 finished with value: 0.04251433987374446 and parameters: {'model_type': 'mlp', 'hidden_dims': '[256, 128]', 'dropout': 0.5129980940769363, 'batch_norm': True, 'lr': 0.0006064309588291614, 'weight_decay': 2.3629940674477215e-06, 'epochs': 264, 'loss': 'mae', 'optimizer': 'adam', 'graph_mode': 'off', 'use_snp_selection': True, 'num_snps': 7375}. Best is trial 44 with value: 0.05876329844938989.
[I 2025-12-05 15:49:59,664] Trial 72 finished with value: 0.03921279963714714 and parameters: {'model_type': 'mlp', 'hidden_dims': '[256, 128]', 'dropout': 0.48014152428693474, 'batch_norm': False, 'lr': 0.00011811250389180083, 'weight_decay': 1.3357296344245061e-06, 'epochs': 219, 'loss': 'mae', 'optimizer': 'adam', 'graph_mode': 'off', 'use_snp_selection': True, 'num_snps': 5403}. Best is trial 44 with value: 0.05876329844938989.
[I 2025-12-05 15:50:00,631] Trial 73 finished with value: 0.015693843743919397 and parameters: {'model_type': 'mlp', 'hidden_dims': '[512, 128]', 'dropout': 0.5012263924850633, 'batch_norm': False, 'lr': 0.00023279772403149955, 'weight_decay': 3.6219737022915304e-06, 'epochs': 247, 'loss': 'mae', 'optimizer': 'adam', 'graph_mode': 'off', 'use_snp_selection': True, 'num_snps': 8540}. Best is trial 44 with value: 0.05876329844938989.
[I 2025-12-05 15:50:01,712] Trial 74 finished with value: -0.000457716213002816 and parameters: {'model_type': 'mlp', 'hidden_dims': '[512, 256]', 'dropout': 0.5253032013429434, 'batch_norm': False, 'lr': 0.0003661011087004487, 'weight_decay': 5.173396936110245e-06, 'epochs': 302, 'loss': 'mae', 'optimizer': 'adam', 'graph_mode': 'off', 'use_snp_selection': True, 'num_snps': 10178}. Best is trial 44 with value: 0.05876329844938989.
[I 2025-12-05 15:50:02,942] Trial 75 finished with value: 0.0075938685682729185 and parameters: {'model_type': 'mlp', 'hidden_dims': '[256, 128]', 'dropout': 0.5961285304303068, 'batch_norm': True, 'lr': 0.0008377237115420986, 'weight_decay': 1.552452459393464e-06, 'epochs': 293, 'loss': 'mae', 'optimizer': 'adam', 'graph_mode': 'off', 'use_snp_selection': False}. Best is trial 44 with value: 0.05876329844938989.
[I 2025-12-05 15:50:03,865] Trial 76 finished with value: 0.010103578840870266 and parameters: {'model_type': 'mlp', 'hidden_dims': '[256, 128, 64]', 'dropout': 0.5459796616381463, 'batch_norm': False, 'lr': 0.0005184091276881119, 'weight_decay': 8.587769010261943e-07, 'epochs': 185, 'loss': 'mae', 'optimizer': 'adam', 'graph_mode': 'off', 'use_snp_selection': True, 'num_snps': 6608}. Best is trial 44 with value: 0.05876329844938989.
[I 2025-12-05 15:50:04,813] Trial 77 finished with value: 0.03744977990061978 and parameters: {'model_type': 'mlp', 'hidden_dims': '[512, 128]', 'dropout': 0.43662889980407027, 'batch_norm': False, 'lr': 0.0006868630955618844, 'weight_decay': 2.911961810660027e-07, 'epochs': 277, 'loss': 'mae', 'optimizer': 'adam', 'graph_mode': 'off', 'use_snp_selection': True, 'num_snps': 4597}. Best is trial 44 with value: 0.05876329844938989.
[I 2025-12-05 15:50:05,912] Trial 78 finished with value: 0.020707968611172887 and parameters: {'model_type': 'mlp', 'hidden_dims': '[256, 128]', 'dropout': 0.5535179792772036, 'batch_norm': False, 'lr': 0.00013996936657671987, 'weight_decay': 2.2385598337739144e-06, 'epochs': 232, 'loss': 'mae', 'optimizer': 'adam', 'graph_mode': 'off', 'use_snp_selection': True, 'num_snps': 13002}. Best is trial 44 with value: 0.05876329844938989.
[I 2025-12-05 15:50:06,986] Trial 79 finished with value: 0.033606381796647156 and parameters: {'model_type': 'mlp', 'hidden_dims': '[512, 64]', 'dropout': 0.4645356228798805, 'batch_norm': True, 'lr': 9.845187823112612e-05, 'weight_decay': 6.847354526935624e-07, 'epochs': 316, 'loss': 'mse', 'optimizer': 'adam', 'graph_mode': 'off', 'use_snp_selection': True, 'num_snps': 6432}. Best is trial 44 with value: 0.05876329844938989.
[I 2025-12-05 15:50:07,820] Trial 80 finished with value: 0.03489935137430547 and parameters: {'model_type': 'mlp', 'hidden_dims': '[256, 128, 64]', 'dropout': 0.34705841735778986, 'batch_norm': False, 'lr': 0.000420740620190308, 'weight_decay': 1.3482714389003713e-05, 'epochs': 204, 'loss': 'mae', 'optimizer': 'adam', 'graph_mode': 'off', 'use_snp_selection': True, 'num_snps': 3322}. Best is trial 44 with value: 0.05876329844938989.
[I 2025-12-05 15:50:08,636] Trial 81 finished with value: 0.044181774640996783 and parameters: {'model_type': 'mlp', 'hidden_dims': '[512, 128]', 'dropout': 0.5091886753840802, 'batch_norm': False, 'lr': 8.124373262682063e-06, 'weight_decay': 7.67665324162098e-06, 'epochs': 168, 'loss': 'mae', 'optimizer': 'adam', 'graph_mode': 'off', 'use_snp_selection': True, 'num_snps': 6153}. Best is trial 44 with value: 0.05876329844938989.
[I 2025-12-05 15:50:09,611] Trial 82 finished with value: 0.0007559001167692709 and parameters: {'model_type': 'mlp', 'hidden_dims': '[512, 128]', 'dropout': 0.5611301110922526, 'batch_norm': False, 'lr': 3.107860761290415e-06, 'weight_decay': 7.043225036526914e-06, 'epochs': 191, 'loss': 'mae', 'optimizer': 'adam', 'graph_mode': 'off', 'use_snp_selection': True, 'num_snps': 9790}. Best is trial 44 with value: 0.05876329844938989.
[I 2025-12-05 15:50:10,517] Trial 83 finished with value: 0.007047172228051124 and parameters: {'model_type': 'mlp', 'hidden_dims': '[512, 128]', 'dropout': 0.5329650355067022, 'batch_norm': False, 'lr': 1.3759858424526634e-05, 'weight_decay': 3.220372670195542e-06, 'epochs': 137, 'loss': 'mae', 'optimizer': 'adam', 'graph_mode': 'off', 'use_snp_selection': True, 'num_snps': 7935}. Best is trial 44 with value: 0.05876329844938989.
[I 2025-12-05 15:50:11,339] Trial 84 finished with value: 0.015387376132139264 and parameters: {'model_type': 'mlp', 'hidden_dims': '[512, 128]', 'dropout': 0.5862982525416294, 'batch_norm': False, 'lr': 0.0007562692727219798, 'weight_decay': 1.9212079191069716e-05, 'epochs': 159, 'loss': 'mae', 'optimizer': 'adam', 'graph_mode': 'off', 'use_snp_selection': True, 'num_snps': 5148}. Best is trial 44 with value: 0.05876329844938989.
