[I 2025-12-05 14:55:11,983] Trial 31 finished with value: 0.09840584129463616 and parameters: {'model_type': 'mlp', 'hidden_dims': '[128, 64]', 'dropout': 0.2971518912776574, 'batch_norm': True, 'lr': 0.0001077935484095717, 'weight_decay': 4.786818854496644e-05, 'epochs': 219, 'loss': 'mae', 'optimizer': 'adam', 'graph_mode': 'off', 'use_snp_selection': True, 'num_snps': 20689}. Best is trial 14 with value: 0.14489011797967669.
[I 2025-12-05 14:55:13,539] Trial 32 finished with value: 0.09772071007476466 and parameters: {'model_type': 'mlp', 'hidden_dims': '[128, 64]', 'dropout': 0.3085175102520266, 'batch_norm': True, 'lr': 8.854788627990045e-05, 'weight_decay': 0.00011809158335117671, 'epochs': 350, 'loss': 'mae', 'optimizer': 'adam', 'graph_mode': 'off', 'use_snp_selection': True, 'num_snps': 20754}. Best is trial 14 with value: 0.14489011797967669.
[I 2025-12-05 14:55:15,857] Trial 33 finished with value: 0.12410937489320169 and parameters: {'model_type': 'mlp', 'hidden_dims': '[128, 64]', 'dropout': 0.32452540017996256, 'batch_norm': True, 'lr': 0.00023510907362743052, 'weight_decay': 7.796389556545804e-06, 'epochs': 248, 'loss': 'mae', 'optimizer': 'adam', 'graph_mode': 'off', 'use_snp_selection': True, 'num_snps': 50127}. Best is trial 14 with value: 0.14489011797967669.
[I 2025-12-05 14:55:16,798] Trial 34 finished with value: 0.10555703079654477 and parameters: {'model_type': 'mlp', 'hidden_dims': '[128, 64]', 'dropout': 0.22358794048359731, 'batch_norm': True, 'lr': 0.0001731272800908065, 'weight_decay': 5.1827226209740166e-05, 'epochs': 231, 'loss': 'mae', 'optimizer': 'adam', 'graph_mode': 'off', 'use_snp_selection': True, 'num_snps': 4311}. Best is trial 14 with value: 0.14489011797967669.
[I 2025-12-05 14:55:18,373] Trial 35 finished with value: 0.09925303451293059 and parameters: {'model_type': 'mlp', 'hidden_dims': '[128, 64]', 'dropout': 0.4071093657429766, 'batch_norm': False, 'lr': 4.202461633273681e-05, 'weight_decay': 2.798378117998535e-05, 'epochs': 303, 'loss': 'mae', 'optimizer': 'adam', 'graph_mode': 'off', 'use_snp_selection': True, 'num_snps': 26222}. Best is trial 14 with value: 0.14489011797967669.
[I 2025-12-05 14:55:19,331] Trial 36 finished with value: 0.10709265327615568 and parameters: {'model_type': 'mlp', 'hidden_dims': '[128, 64]', 'dropout': 0.20584121487001242, 'batch_norm': True, 'lr': 7.691615361483608e-05, 'weight_decay': 0.00015971386220198832, 'epochs': 266, 'loss': 'mse', 'optimizer': 'adam', 'graph_mode': 'off', 'use_snp_selection': False}. Best is trial 14 with value: 0.14489011797967669.
[I 2025-12-05 14:55:21,815] Trial 37 finished with value: 0.022769553316857427 and parameters: {'model_type': 'mlp', 'hidden_dims': '[512, 256]', 'dropout': 0.36730827819140527, 'batch_norm': True, 'lr': 2.6246285399617145e-06, 'weight_decay': 2.4419013599037505e-06, 'epochs': 330, 'loss': 'mae', 'optimizer': 'adam', 'graph_mode': 'off', 'use_snp_selection': True, 'num_snps': 38290}. Best is trial 14 with value: 0.14489011797967669.
[I 2025-12-05 14:55:22,823] Trial 38 finished with value: 0.11926089774950488 and parameters: {'model_type': 'mlp', 'hidden_dims': '[256, 128, 64]', 'dropout': 0.4341716327735321, 'batch_norm': False, 'lr': 1.9604308706366528e-05, 'weight_decay': 0.0006033356943215123, 'epochs': 186, 'loss': 'mse', 'optimizer': 'adam', 'graph_mode': 'off', 'use_snp_selection': False}. Best is trial 14 with value: 0.14489011797967669.
[I 2025-12-05 14:55:24,121] Trial 39 finished with value: 0.11804225400119425 and parameters: {'model_type': 'mlp', 'hidden_dims': '[512, 64]', 'dropout': 0.24995239520251838, 'batch_norm': True, 'lr': 0.0002614635592650015, 'weight_decay': 1.0393823867987084e-05, 'epochs': 292, 'loss': 'mae', 'optimizer': 'adam', 'graph_mode': 'off', 'use_snp_selection': True, 'num_snps': 13361}. Best is trial 14 with value: 0.14489011797967669.
[I 2025-12-05 14:55:25,000] Trial 40 finished with value: 0.1091659104016742 and parameters: {'model_type': 'mlp', 'hidden_dims': '[128, 64]', 'dropout': 0.33530443938577337, 'batch_norm': True, 'lr': 0.00013920748177866072, 'weight_decay': 2.4546376311567043e-05, 'epochs': 207, 'loss': 'mae', 'optimizer': 'adam', 'graph_mode': 'off', 'use_snp_selection': False}. Best is trial 14 with value: 0.14489011797967669.
[I 2025-12-05 14:55:26,153] Trial 41 finished with value: 0.11787832621364444 and parameters: {'model_type': 'mlp', 'hidden_dims': '[256, 128]', 'dropout': 0.5027051357053457, 'batch_norm': True, 'lr': 0.000693741805252789, 'weight_decay': 3.542440218147066e-07, 'epochs': 238, 'loss': 'mae', 'optimizer': 'adam', 'graph_mode': 'off', 'use_snp_selection': False}. Best is trial 14 with value: 0.14489011797967669.
[I 2025-12-05 14:55:27,128] Trial 42 finished with value: 0.09127122507012769 and parameters: {'model_type': 'mlp', 'hidden_dims': '[256, 128]', 'dropout': 0.5665293920396149, 'batch_norm': True, 'lr': 0.00040287848793912293, 'weight_decay': 1.4232157373031594e-07, 'epochs': 161, 'loss': 'mae', 'optimizer': 'adam', 'graph_mode': 'off', 'use_snp_selection': False}. Best is trial 14 with value: 0.14489011797967669.
[I 2025-12-05 14:55:28,800] Trial 43 finished with value: 0.13020944335735263 and parameters: {'model_type': 'mlp', 'hidden_dims': '[512, 64]', 'dropout': 0.38205198236701077, 'batch_norm': True, 'lr': 0.00026316682962134136, 'weight_decay': 1.062165367248826e-06, 'epochs': 242, 'loss': 'mae', 'optimizer': 'adam', 'graph_mode': 'off', 'use_snp_selection': False}. Best is trial 14 with value: 0.14489011797967669.
[I 2025-12-05 14:55:30,584] Trial 44 finished with value: 0.11550076048285773 and parameters: {'model_type': 'mlp', 'hidden_dims': '[512, 64]', 'dropout': 0.39116728642442355, 'batch_norm': True, 'lr': 0.00020730874783961192, 'weight_decay': 9.939673633613136e-07, 'epochs': 273, 'loss': 'mae', 'optimizer': 'adam', 'graph_mode': 'off', 'use_snp_selection': False}. Best is trial 14 with value: 0.14489011797967669.
[I 2025-12-05 14:55:32,300] Trial 45 finished with value: 0.1156640100439627 and parameters: {'model_type': 'mlp', 'hidden_dims': '[512, 64]', 'dropout': 0.2889493342224735, 'batch_norm': True, 'lr': 4.1699846435508064e-05, 'weight_decay': 3.138893117832146e-06, 'epochs': 254, 'loss': 'mse', 'optimizer': 'adam', 'graph_mode': 'off', 'use_snp_selection': False}. Best is trial 14 with value: 0.14489011797967669.
[I 2025-12-05 14:55:33,847] Trial 46 finished with value: 0.1182383471784641 and parameters: {'model_type': 'mlp', 'hidden_dims': '[512, 64]', 'dropout': 0.37358910761811365, 'batch_norm': True, 'lr': 9.275383042125998e-05, 'weight_decay': 4.402592011163953e-06, 'epochs': 206, 'loss': 'mae', 'optimizer': 'adam', 'graph_mode': 'off', 'use_snp_selection': False}. Best is trial 14 with value: 0.14489011797967669.
[I 2025-12-05 14:55:35,322] Trial 47 finished with value: 0.12623326854346067 and parameters: {'model_type': 'mlp', 'hidden_dims': '[512, 128]', 'dropout': 0.4152657959007888, 'batch_norm': False, 'lr': 8.240101671305666e-06, 'weight_decay': 5.307264395857073e-07, 'epochs': 189, 'loss': 'mae', 'optimizer': 'adam', 'graph_mode': 'off', 'use_snp_selection': False}. Best is trial 14 with value: 0.14489011797967669.
[I 2025-12-05 14:55:36,996] Trial 48 finished with value: 0.1346148540466618 and parameters: {'model_type': 'mlp', 'hidden_dims': '[512, 64]', 'dropout': 0.3227529001131943, 'batch_norm': True, 'lr': 5.676261351946244e-05, 'weight_decay': 2.041306741036746e-06, 'epochs': 230, 'loss': 'mae', 'optimizer': 'adam', 'graph_mode': 'off', 'use_snp_selection': False}. Best is trial 14 with value: 0.14489011797967669.
[I 2025-12-05 14:55:38,613] Trial 49 finished with value: 0.12407803865672065 and parameters: {'model_type': 'mlp', 'hidden_dims': '[512, 256]', 'dropout': 0.2708212275294394, 'batch_norm': True, 'lr': 6.713727632967944e-05, 'weight_decay': 1.768961745185087e-05, 'epochs': 220, 'loss': 'mse', 'optimizer': 'adam', 'graph_mode': 'off', 'use_snp_selection': False}. Best is trial 14 with value: 0.14489011797967669.
[I 2025-12-05 14:55:39,393] Trial 50 finished with value: 0.09431279177298182 and parameters: {'model_type': 'mlp', 'hidden_dims': '[128, 64]', 'dropout': 0.30905285192491366, 'batch_norm': True, 'lr': 5.625919613205142e-05, 'weight_decay': 2.0457229917807965e-06, 'epochs': 128, 'loss': 'mae', 'optimizer': 'adam', 'graph_mode': 'off', 'use_snp_selection': False}. Best is trial 14 with value: 0.14489011797967669.
[I 2025-12-05 14:55:41,085] Trial 51 finished with value: 0.12443477931320908 and parameters: {'model_type': 'mlp', 'hidden_dims': '[512, 64]', 'dropout': 0.3224959454654492, 'batch_norm': True, 'lr': 0.0001437809770598927, 'weight_decay': 5.915580682022433e-06, 'epochs': 237, 'loss': 'mae', 'optimizer': 'adam', 'graph_mode': 'off', 'use_snp_selection': False}. Best is trial 14 with value: 0.14489011797967669.
[I 2025-12-05 14:55:42,734] Trial 52 finished with value: 0.1289948230992391 and parameters: {'model_type': 'mlp', 'hidden_dims': '[512, 64]', 'dropout': 0.24112652449487326, 'batch_norm': True, 'lr': 0.00033761443568814634, 'weight_decay': 1.1319057495024063e-06, 'epochs': 228, 'loss': 'mae', 'optimizer': 'adam', 'graph_mode': 'off', 'use_snp_selection': False}. Best is trial 14 with value: 0.14489011797967669.
[I 2025-12-05 14:55:44,528] Trial 53 finished with value: 0.1159225760682388 and parameters: {'model_type': 'mlp', 'hidden_dims': '[512, 64]', 'dropout': 0.3564683609550775, 'batch_norm': True, 'lr': 0.0002383549608794379, 'weight_decay': 2.889543017197337e-07, 'epochs': 262, 'loss': 'mae', 'optimizer': 'adam', 'graph_mode': 'off', 'use_snp_selection': False}. Best is trial 14 with value: 0.14489011797967669.
[I 2025-12-05 14:55:46,225] Trial 54 finished with value: 0.11542475092574571 and parameters: {'model_type': 'mlp', 'hidden_dims': '[512, 64]', 'dropout': 0.48380439623779387, 'batch_norm': True, 'lr': 7.902191336641543e-05, 'weight_decay': 7.83581659436432e-07, 'epochs': 246, 'loss': 'mae', 'optimizer': 'adam', 'graph_mode': 'off', 'use_snp_selection': False}. Best is trial 14 with value: 0.14489011797967669.
[I 2025-12-05 14:55:47,782] Trial 55 finished with value: 0.11886332080258345 and parameters: {'model_type': 'mlp', 'hidden_dims': '[512, 128]', 'dropout': 0.1713395345479497, 'batch_norm': True, 'lr': 0.0001617631370787801, 'weight_decay': 1.6076006098428806e-06, 'epochs': 211, 'loss': 'mae', 'optimizer': 'adam', 'graph_mode': 'off', 'use_snp_selection': False}. Best is trial 14 with value: 0.14489011797967669.
[I 2025-12-05 14:55:49,581] Trial 56 finished with value: 0.12475582145964854 and parameters: {'model_type': 'mlp', 'hidden_dims': '[512, 64]', 'dropout': 0.2699901402012369, 'batch_norm': True, 'lr': 4.890908980753071e-05, 'weight_decay': 3.883435561583441e-06, 'epochs': 275, 'loss': 'mae', 'optimizer': 'adam', 'graph_mode': 'off', 'use_snp_selection': False}. Best is trial 14 with value: 0.14489011797967669.
[I 2025-12-05 14:55:50,635] Trial 57 finished with value: 0.10115148447393689 and parameters: {'model_type': 'mlp', 'hidden_dims': '[256, 128, 64]', 'dropout': 0.41174461020224884, 'batch_norm': True, 'lr': 0.00010580964960877335, 'weight_decay': 1.5073116966566626e-07, 'epochs': 194, 'loss': 'mae', 'optimizer': 'adam', 'graph_mode': 'off', 'use_snp_selection': False}. Best is trial 14 with value: 0.14489011797967669.
[I 2025-12-05 14:55:52,312] Trial 58 finished with value: 0.10232942628581962 and parameters: {'model_type': 'mlp', 'hidden_dims': '[256, 128]', 'dropout': 0.45153270730293676, 'batch_norm': False, 'lr': 0.00028819481069898757, 'weight_decay': 4.590232918772108e-07, 'epochs': 243, 'loss': 'mae', 'optimizer': 'adam', 'graph_mode': 'off', 'use_snp_selection': True, 'num_snps': 28730}. Best is trial 14 with value: 0.14489011797967669.
[I 2025-12-05 14:55:53,933] Trial 59 finished with value: 0.11414085307541533 and parameters: {'model_type': 'mlp', 'hidden_dims': '[512, 256]', 'dropout': 0.5128447741141364, 'batch_norm': True, 'lr': 0.00038328108264602427, 'weight_decay': 1.275332988644173e-05, 'epochs': 227, 'loss': 'mae', 'optimizer': 'adam', 'graph_mode': 'off', 'use_snp_selection': False}. Best is trial 14 with value: 0.14489011797967669.
[I 2025-12-05 14:55:54,894] Trial 60 finished with value: 0.11349401242385243 and parameters: {'model_type': 'mlp', 'hidden_dims': '[128, 64]', 'dropout': 0.34585542110297013, 'batch_norm': True, 'lr': 0.0002078004335901405, 'weight_decay': 1.972701090718491e-06, 'epochs': 261, 'loss': 'mae', 'optimizer': 'adam', 'graph_mode': 'off', 'use_snp_selection': False}. Best is trial 14 with value: 0.14489011797967669.
[I 2025-12-05 14:55:56,523] Trial 61 finished with value: 0.12018428751766498 and parameters: {'model_type': 'mlp', 'hidden_dims': '[512, 64]', 'dropout': 0.23132747781020718, 'batch_norm': True, 'lr': 0.00029588673990135013, 'weight_decay': 1.1470273357497603e-06, 'epochs': 229, 'loss': 'mae', 'optimizer': 'adam', 'graph_mode': 'off', 'use_snp_selection': False}. Best is trial 14 with value: 0.14489011797967669.
[I 2025-12-05 14:55:58,129] Trial 62 finished with value: 0.12689468889170458 and parameters: {'model_type': 'mlp', 'hidden_dims': '[512, 64]', 'dropout': 0.2472757628751596, 'batch_norm': True, 'lr': 0.000662776911639293, 'weight_decay': 1.063660944213353e-06, 'epochs': 212, 'loss': 'mae', 'optimizer': 'adam', 'graph_mode': 'off', 'use_snp_selection': False}. Best is trial 14 with value: 0.14489011797967669.
[I 2025-12-05 14:55:59,838] Trial 63 finished with value: 0.11598831700644083 and parameters: {'model_type': 'mlp', 'hidden_dims': '[512, 64]', 'dropout': 0.29028274562668, 'batch_norm': True, 'lr': 0.0001280411645783253, 'weight_decay': 5.597900307227065e-06, 'epochs': 250, 'loss': 'mae', 'optimizer': 'adam', 'graph_mode': 'off', 'use_snp_selection': False}. Best is trial 14 with value: 0.14489011797967669.
[I 2025-12-05 14:56:01,678] Trial 64 finished with value: 0.137235179563451 and parameters: {'model_type': 'mlp', 'hidden_dims': '[512, 64]', 'dropout': 0.3114958880374137, 'batch_norm': True, 'lr': 0.00048387575273367827, 'weight_decay': 8.248922281890726e-07, 'epochs': 285, 'loss': 'mae', 'optimizer': 'adam', 'graph_mode': 'off', 'use_snp_selection': False}. Best is trial 14 with value: 0.14489011797967669.
[I 2025-12-05 14:56:02,903] Trial 65 finished with value: 0.12509655222336422 and parameters: {'model_type': 'mlp', 'hidden_dims': '[256, 128]', 'dropout': 0.30969018964759143, 'batch_norm': True, 'lr': 0.0005128096684987842, 'weight_decay': 7.76715263968773e-07, 'epochs': 286, 'loss': 'mae', 'optimizer': 'adam', 'graph_mode': 'off', 'use_snp_selection': False}. Best is trial 14 with value: 0.14489011797967669.
[I 2025-12-05 14:56:04,187] Trial 66 finished with value: 0.12386092529797368 and parameters: {'model_type': 'mlp', 'hidden_dims': '[512, 64]', 'dropout': 0.33216498202770556, 'batch_norm': True, 'lr': 0.0004419416657867986, 'weight_decay': 3.115287588545585e-07, 'epochs': 268, 'loss': 'mae', 'optimizer': 'adam', 'graph_mode': 'off', 'use_snp_selection': True, 'num_snps': 12975}. Best is trial 14 with value: 0.14489011797967669.
[I 2025-12-05 14:56:05,231] Trial 67 finished with value: 0.1241699841925672 and parameters: {'model_type': 'mlp', 'hidden_dims': '[128, 64]', 'dropout': 0.27744656588127153, 'batch_norm': True, 'lr': 0.0001992472983949015, 'weight_decay': 4.542831438757134e-07, 'epochs': 314, 'loss': 'mae', 'optimizer': 'adam', 'graph_mode': 'off', 'use_snp_selection': False}. Best is trial 14 with value: 0.14489011797967669.
[I 2025-12-05 14:56:06,473] Trial 68 finished with value: -0.013164065587032505 and parameters: {'model_type': 'mlp', 'hidden_dims': '[256, 128]', 'dropout': 0.3802171214195478, 'batch_norm': True, 'lr': 1.083602449748085e-06, 'weight_decay': 0.0003036631098209926, 'epochs': 295, 'loss': 'mse', 'optimizer': 'adam', 'graph_mode': 'off', 'use_snp_selection': False}. Best is trial 14 with value: 0.14489011797967669.
[I 2025-12-05 14:56:08,815] Trial 69 finished with value: 0.08603197216999958 and parameters: {'model_type': 'mlp', 'hidden_dims': '[512, 128]', 'dropout': 0.4858979507966786, 'batch_norm': False, 'lr': 0.0008217653447266709, 'weight_decay': 3.64231941100841e-05, 'epochs': 200, 'loss': 'mae', 'optimizer': 'adam', 'graph_mode': 'off', 'use_snp_selection': True, 'num_snps': 42394}. Best is trial 14 with value: 0.14489011797967669.
[I 2025-12-05 14:56:09,796] Trial 70 finished with value: 0.09181690095911027 and parameters: {'model_type': 'mlp', 'hidden_dims': '[128, 64]', 'dropout': 0.39669386823580977, 'batch_norm': True, 'lr': 3.487536581852488e-05, 'weight_decay': 2.2357612575043995e-07, 'epochs': 283, 'loss': 'mae', 'optimizer': 'adam', 'graph_mode': 'off', 'use_snp_selection': False}. Best is trial 14 with value: 0.14489011797967669.
[I 2025-12-05 14:56:11,446] Trial 71 finished with value: 0.12829842181165957 and parameters: {'model_type': 'mlp', 'hidden_dims': '[512, 64]', 'dropout': 0.20544207715835067, 'batch_norm': True, 'lr': 0.000340452051685277, 'weight_decay': 1.546716810709099e-06, 'epochs': 234, 'loss': 'mae', 'optimizer': 'adam', 'graph_mode': 'off', 'use_snp_selection': False}. Best is trial 14 with value: 0.14489011797967669.
[I 2025-12-05 14:56:12,429] Trial 72 finished with value: 0.10751882163030178 and parameters: {'model_type': 'mlp', 'hidden_dims': '[512, 64]', 'dropout': 0.2336282734702801, 'batch_norm': True, 'lr': 0.0005013711166769112, 'weight_decay': 2.929529926128129e-06, 'epochs': 59, 'loss': 'mae', 'optimizer': 'adam', 'graph_mode': 'off', 'use_snp_selection': False}. Best is trial 14 with value: 0.14489011797967669.
[I 2025-12-05 14:56:14,068] Trial 73 finished with value: 0.12373171537987283 and parameters: {'model_type': 'mlp', 'hidden_dims': '[512, 64]', 'dropout': 0.2998916732041104, 'batch_norm': True, 'lr': 0.0001710518038778317, 'weight_decay': 7.562354198479184e-07, 'epochs': 225, 'loss': 'mae', 'optimizer': 'adam', 'graph_mode': 'off', 'use_snp_selection': False}. Best is trial 14 with value: 0.14489011797967669.
[I 2025-12-05 14:56:15,642] Trial 74 finished with value: 0.10974698412787959 and parameters: {'model_type': 'mlp', 'hidden_dims': '[512, 64]', 'dropout': 0.1801935777328075, 'batch_norm': True, 'lr': 0.00025573600678625554, 'weight_decay': 1.3364706919065782e-06, 'epochs': 216, 'loss': 'mae', 'optimizer': 'adam', 'graph_mode': 'off', 'use_snp_selection': False}. Best is trial 14 with value: 0.14489011797967669.
[I 2025-12-05 14:56:16,833] Trial 75 finished with value: 0.12131626744356946 and parameters: {'model_type': 'mlp', 'hidden_dims': '[256, 128, 64]', 'dropout': 0.32197808696206354, 'batch_norm': True, 'lr': 0.0003582133186738777, 'weight_decay': 2.0988410024483324e-06, 'epochs': 241, 'loss': 'mae', 'optimizer': 'adam', 'graph_mode': 'off', 'use_snp_selection': False}. Best is trial 14 with value: 0.14489011797967669.
[I 2025-12-05 14:56:17,997] Trial 76 finished with value: 0.09948018183155433 and parameters: {'model_type': 'mlp', 'hidden_dims': '[256, 128]', 'dropout': 0.45157437218513896, 'batch_norm': True, 'lr': 9.868309825562673e-05, 'weight_decay': 1.6112171984346844e-07, 'epochs': 254, 'loss': 'mae', 'optimizer': 'adam', 'graph_mode': 'off', 'use_snp_selection': False}. Best is trial 14 with value: 0.14489011797967669.
[I 2025-12-05 14:56:20,980] Trial 77 finished with value: 0.07083281650059033 and parameters: {'model_type': 'mlp', 'hidden_dims': '[512, 64]', 'dropout': 0.2576722779930529, 'batch_norm': True, 'lr': 2.2325483952045905e-05, 'weight_decay': 1.0117199619534213e-07, 'epochs': 179, 'loss': 'mae', 'optimizer': 'adam', 'graph_mode': 'off', 'use_snp_selection': True, 'num_snps': 58644}. Best is trial 14 with value: 0.14489011797967669.
[I 2025-12-05 14:56:21,885] Trial 78 finished with value: 0.1237767025916234 and parameters: {'model_type': 'mlp', 'hidden_dims': '[128, 64]', 'dropout': 0.3636981768297874, 'batch_norm': True, 'lr': 0.00014711159089061973, 'weight_decay': 9.095845126734902e-07, 'epochs': 202, 'loss': 'mae', 'optimizer': 'adam', 'graph_mode': 'off', 'use_snp_selection': False}. Best is trial 14 with value: 0.14489011797967669.
[I 2025-12-05 14:56:23,081] Trial 79 finished with value: 0.11336654397587499 and parameters: {'model_type': 'mlp', 'hidden_dims': '[256, 128]', 'dropout': 0.42415199143026383, 'batch_norm': True, 'lr': 5.794724225288996e-05, 'weight_decay': 2.7313471183977028e-06, 'epochs': 269, 'loss': 'mse', 'optimizer': 'adam', 'graph_mode': 'off', 'use_snp_selection': False}. Best is trial 14 with value: 0.14489011797967669.
[I 2025-12-05 14:56:24,684] Trial 80 finished with value: 0.11062083135765503 and parameters: {'model_type': 'mlp', 'hidden_dims': '[512, 64]', 'dropout': 0.34809352637013435, 'batch_norm': False, 'lr': 0.0006719931804292528, 'weight_decay': 5.460647863558486e-07, 'epochs': 234, 'loss': 'mae', 'optimizer': 'adam', 'graph_mode': 'off', 'use_snp_selection': True, 'num_snps': 24808}. Best is trial 14 with value: 0.14489011797967669.
[I 2025-12-05 14:56:26,307] Trial 81 finished with value: 0.11799364684423244 and parameters: {'model_type': 'mlp', 'hidden_dims': '[512, 64]', 'dropout': 0.20471283962016534, 'batch_norm': True, 'lr': 0.00043014178016359864, 'weight_decay': 1.5369384525922473e-06, 'epochs': 230, 'loss': 'mae', 'optimizer': 'adam', 'graph_mode': 'off', 'use_snp_selection': False}. Best is trial 14 with value: 0.14489011797967669.
[I 2025-12-05 14:56:27,892] Trial 82 finished with value: 0.12754424115923702 and parameters: {'model_type': 'mlp', 'hidden_dims': '[512, 64]', 'dropout': 0.1876852819148529, 'batch_norm': True, 'lr': 0.00036290256679588043, 'weight_decay': 8.568435352294314e-05, 'epochs': 220, 'loss': 'mae', 'optimizer': 'adam', 'graph_mode': 'off', 'use_snp_selection': False}. Best is trial 14 with value: 0.14489011797967669.
