[I 2025-12-05 15:52:40,516] Trial 141 finished with value: 0.10290780119561824 and parameters: {'model_type': 'mlp', 'hidden_dims': '[256, 128, 64]', 'dropout': 0.2973793673339851, 'batch_norm': True, 'lr': 0.00029427451220766525, 'weight_decay': 1.5603102867468956e-06, 'epochs': 194, 'loss': 'mse', 'optimizer': 'adam', 'graph_mode': 'off', 'use_snp_selection': False}. Best is trial 133 with value: 0.1252175471440221.
[I 2025-12-05 15:52:41,492] Trial 142 finished with value: 0.12715480469228246 and parameters: {'model_type': 'mlp', 'hidden_dims': '[256, 128, 64]', 'dropout': 0.2773810721538515, 'batch_norm': True, 'lr': 0.0002652295579302099, 'weight_decay': 5.676203707691085e-06, 'epochs': 225, 'loss': 'mse', 'optimizer': 'adam', 'graph_mode': 'off', 'use_snp_selection': False}. Best is trial 142 with value: 0.12715480469228246.
[I 2025-12-05 15:52:42,309] Trial 143 finished with value: 0.09850590685505002 and parameters: {'model_type': 'mlp', 'hidden_dims': '[128, 64]', 'dropout': 0.2822657437287598, 'batch_norm': True, 'lr': 0.00019038894802152345, 'weight_decay': 5.767678041046254e-06, 'epochs': 224, 'loss': 'mse', 'optimizer': 'adam', 'graph_mode': 'off', 'use_snp_selection': False}. Best is trial 142 with value: 0.12715480469228246.
[I 2025-12-05 15:52:43,290] Trial 144 finished with value: 0.08903072071543992 and parameters: {'model_type': 'mlp', 'hidden_dims': '[256, 128, 64]', 'dropout': 0.27355454379001515, 'batch_norm': True, 'lr': 0.00044813462373451953, 'weight_decay': 7.056505241086188e-06, 'epochs': 228, 'loss': 'mse', 'optimizer': 'adam', 'graph_mode': 'off', 'use_snp_selection': False}. Best is trial 142 with value: 0.12715480469228246.
[I 2025-12-05 15:52:44,739] Trial 145 finished with value: 0.10464809338871 and parameters: {'model_type': 'mlp', 'hidden_dims': '[512, 64]', 'dropout': 0.2629300129604176, 'batch_norm': True, 'lr': 0.00026387346697205247, 'weight_decay': 9.53550796177995e-06, 'epochs': 237, 'loss': 'mse', 'optimizer': 'adam', 'graph_mode': 'off', 'use_snp_selection': False}. Best is trial 142 with value: 0.12715480469228246.
[I 2025-12-05 15:52:45,536] Trial 146 finished with value: 0.09799270852294066 and parameters: {'model_type': 'mlp', 'hidden_dims': '[128, 64]', 'dropout': 0.2920600812185123, 'batch_norm': True, 'lr': 0.00016448793648082255, 'weight_decay': 3.989375056868955e-06, 'epochs': 205, 'loss': 'mse', 'optimizer': 'adam', 'graph_mode': 'off', 'use_snp_selection': False}. Best is trial 142 with value: 0.12715480469228246.
[I 2025-12-05 15:52:46,475] Trial 147 finished with value: 0.11285551350884344 and parameters: {'model_type': 'mlp', 'hidden_dims': '[256, 128]', 'dropout': 0.30897073092036575, 'batch_norm': True, 'lr': 0.0005831317833326841, 'weight_decay': 5.128317111709846e-06, 'epochs': 215, 'loss': 'mse', 'optimizer': 'adam', 'graph_mode': 'off', 'use_snp_selection': False}. Best is trial 142 with value: 0.12715480469228246.
[I 2025-12-05 15:52:47,419] Trial 148 finished with value: 0.08696516786150413 and parameters: {'model_type': 'mlp', 'hidden_dims': '[256, 128]', 'dropout': 0.3487585666798262, 'batch_norm': True, 'lr': 0.0005377131880824798, 'weight_decay': 1.6953518634982015e-05, 'epochs': 216, 'loss': 'mse', 'optimizer': 'adam', 'graph_mode': 'off', 'use_snp_selection': False}. Best is trial 142 with value: 0.12715480469228246.
[I 2025-12-05 15:52:48,441] Trial 149 finished with value: 0.065285188981337 and parameters: {'model_type': 'mlp', 'hidden_dims': '[256, 128]', 'dropout': 0.3112881218542488, 'batch_norm': True, 'lr': 3.922103526300729e-05, 'weight_decay': 0.0002805056018929511, 'epochs': 261, 'loss': 'mse', 'optimizer': 'adam', 'graph_mode': 'off', 'use_snp_selection': False}. Best is trial 142 with value: 0.12715480469228246.
[I 2025-12-05 15:52:50,644] Trial 0 finished with value: 0.007513637758896564 and parameters: {'model_type': 'mlp', 'hidden_dims': '[128, 64]', 'dropout': 0.199031432379812, 'batch_norm': True, 'lr': 1.8408544111075837e-06, 'weight_decay': 5.5136510071208614e-05, 'epochs': 336, 'loss': 'mae', 'optimizer': 'adam', 'graph_mode': 'off', 'use_snp_selection': True, 'num_snps': 43862}. Best is trial 0 with value: 0.007513637758896564.
[I 2025-12-05 15:52:51,747] Trial 1 finished with value: 0.033459693040369026 and parameters: {'model_type': 'mlp', 'hidden_dims': '[256, 128]', 'dropout': 0.4370668075331726, 'batch_norm': True, 'lr': 7.133471581159139e-05, 'weight_decay': 1.128633586803549e-05, 'epochs': 242, 'loss': 'mae', 'optimizer': 'adam', 'graph_mode': 'off', 'use_snp_selection': False}. Best is trial 1 with value: 0.033459693040369026.
[I 2025-12-05 15:52:52,778] Trial 2 finished with value: 0.0180953266934692 and parameters: {'model_type': 'mlp', 'hidden_dims': '[256, 128, 64]', 'dropout': 0.41314357415569625, 'batch_norm': False, 'lr': 3.952233718592101e-06, 'weight_decay': 0.00026754769258252603, 'epochs': 149, 'loss': 'mse', 'optimizer': 'adam', 'graph_mode': 'off', 'use_snp_selection': True, 'num_snps': 11571}. Best is trial 1 with value: 0.033459693040369026.
[I 2025-12-05 15:52:54,763] Trial 3 finished with value: 0.01860495949014505 and parameters: {'model_type': 'mlp', 'hidden_dims': '[512, 64]', 'dropout': 0.5938127374509361, 'batch_norm': False, 'lr': 5.67704586114731e-06, 'weight_decay': 2.4518087630137052e-05, 'epochs': 320, 'loss': 'mae', 'optimizer': 'adam', 'graph_mode': 'off', 'use_snp_selection': False}. Best is trial 1 with value: 0.033459693040369026.
[I 2025-12-05 15:52:56,997] Trial 4 finished with value: -0.03440406547572465 and parameters: {'model_type': 'mlp', 'hidden_dims': '[512, 128]', 'dropout': 0.25746343592134413, 'batch_norm': True, 'lr': 1.3467657668402788e-06, 'weight_decay': 0.00033087251918647806, 'epochs': 277, 'loss': 'mse', 'optimizer': 'adam', 'graph_mode': 'off', 'use_snp_selection': True, 'num_snps': 36675}. Best is trial 1 with value: 0.033459693040369026.
[I 2025-12-05 15:52:58,743] Trial 5 finished with value: 0.024106914719326435 and parameters: {'model_type': 'mlp', 'hidden_dims': '[512, 64]', 'dropout': 0.38275350994408375, 'batch_norm': True, 'lr': 1.5586664309232824e-06, 'weight_decay': 0.0008227664668621182, 'epochs': 145, 'loss': 'mae', 'optimizer': 'adam', 'graph_mode': 'off', 'use_snp_selection': True, 'num_snps': 32148}. Best is trial 1 with value: 0.033459693040369026.
[I 2025-12-05 15:52:59,723] Trial 6 finished with value: 0.017276943741631474 and parameters: {'model_type': 'mlp', 'hidden_dims': '[256, 128]', 'dropout': 0.3930109900265879, 'batch_norm': False, 'lr': 4.892964372128395e-05, 'weight_decay': 1.5809549317992182e-06, 'epochs': 199, 'loss': 'mse', 'optimizer': 'adam', 'graph_mode': 'off', 'use_snp_selection': False}. Best is trial 1 with value: 0.033459693040369026.
[I 2025-12-05 15:53:00,794] Trial 7 finished with value: 0.02079482852053984 and parameters: {'model_type': 'mlp', 'hidden_dims': '[512, 256]', 'dropout': 0.15343979219678458, 'batch_norm': True, 'lr': 6.234003099047341e-05, 'weight_decay': 3.894760610535477e-07, 'epochs': 97, 'loss': 'mse', 'optimizer': 'adam', 'graph_mode': 'off', 'use_snp_selection': False}. Best is trial 1 with value: 0.033459693040369026.
[I 2025-12-05 15:53:02,775] Trial 8 finished with value: 0.045505761421733404 and parameters: {'model_type': 'mlp', 'hidden_dims': '[512, 128]', 'dropout': 0.10743001231661406, 'batch_norm': True, 'lr': 0.00023728538449271062, 'weight_decay': 1.7629071578048637e-05, 'epochs': 312, 'loss': 'mae', 'optimizer': 'adam', 'graph_mode': 'off', 'use_snp_selection': False}. Best is trial 8 with value: 0.045505761421733404.
[I 2025-12-05 15:53:04,193] Trial 9 finished with value: 0.045128982054642934 and parameters: {'model_type': 'mlp', 'hidden_dims': '[512, 64]', 'dropout': 0.14505336736221927, 'batch_norm': True, 'lr': 5.8619638388111826e-05, 'weight_decay': 6.200156172669308e-07, 'epochs': 175, 'loss': 'mse', 'optimizer': 'adam', 'graph_mode': 'off', 'use_snp_selection': False}. Best is trial 8 with value: 0.045505761421733404.
[I 2025-12-05 15:53:05,100] Trial 10 finished with value: -0.002593499223676247 and parameters: {'model_type': 'mlp', 'hidden_dims': '[512, 128]', 'dropout': 0.2800030442581858, 'batch_norm': False, 'lr': 0.0004919806695968258, 'weight_decay': 2.9953888095455486e-06, 'epochs': 55, 'loss': 'mae', 'optimizer': 'adam', 'graph_mode': 'off', 'use_snp_selection': False}. Best is trial 8 with value: 0.045505761421733404.
[I 2025-12-05 15:53:06,683] Trial 11 finished with value: 0.04356269388223762 and parameters: {'model_type': 'mlp', 'hidden_dims': '[512, 128]', 'dropout': 0.10095648685224448, 'batch_norm': True, 'lr': 0.0003411435764085616, 'weight_decay': 1.2045055692919657e-07, 'epochs': 216, 'loss': 'mse', 'optimizer': 'adam', 'graph_mode': 'off', 'use_snp_selection': False}. Best is trial 8 with value: 0.045505761421733404.
[I 2025-12-05 15:53:08,536] Trial 12 finished with value: 0.04603461324521496 and parameters: {'model_type': 'mlp', 'hidden_dims': '[512, 64]', 'dropout': 0.10344600881777158, 'batch_norm': True, 'lr': 0.00018400807026440393, 'weight_decay': 2.071258764988014e-06, 'epochs': 281, 'loss': 'mae', 'optimizer': 'adam', 'graph_mode': 'off', 'use_snp_selection': False}. Best is trial 12 with value: 0.04603461324521496.
[I 2025-12-05 15:53:09,447] Trial 13 finished with value: 0.039070677902408875 and parameters: {'model_type': 'mlp', 'hidden_dims': '[128, 64]', 'dropout': 0.24294613148916022, 'batch_norm': True, 'lr': 0.00020209017454184854, 'weight_decay': 4.439089487662099e-06, 'epochs': 285, 'loss': 'mae', 'optimizer': 'adam', 'graph_mode': 'off', 'use_snp_selection': False}. Best is trial 12 with value: 0.04603461324521496.
[I 2025-12-05 15:53:10,660] Trial 14 finished with value: 0.05761900834365336 and parameters: {'model_type': 'mlp', 'hidden_dims': '[256, 128, 64]', 'dropout': 0.3221595656802847, 'batch_norm': True, 'lr': 0.0008417026281429627, 'weight_decay': 5.724103314313124e-05, 'epochs': 282, 'loss': 'mae', 'optimizer': 'adam', 'graph_mode': 'off', 'use_snp_selection': False}. Best is trial 14 with value: 0.05761900834365336.
[I 2025-12-05 15:53:11,814] Trial 15 finished with value: 0.018407329368169998 and parameters: {'model_type': 'mlp', 'hidden_dims': '[256, 128, 64]', 'dropout': 0.4919686891470568, 'batch_norm': True, 'lr': 0.0007585667411138011, 'weight_decay': 7.886437726517413e-05, 'epochs': 256, 'loss': 'mae', 'optimizer': 'adam', 'graph_mode': 'off', 'use_snp_selection': False}. Best is trial 14 with value: 0.05761900834365336.
[I 2025-12-05 15:53:13,181] Trial 16 finished with value: 0.025865233018797187 and parameters: {'model_type': 'mlp', 'hidden_dims': '[256, 128, 64]', 'dropout': 0.32867349263672585, 'batch_norm': True, 'lr': 0.0001498240145929046, 'weight_decay': 5.9790783510214155e-05, 'epochs': 350, 'loss': 'mae', 'optimizer': 'adam', 'graph_mode': 'off', 'use_snp_selection': False}. Best is trial 14 with value: 0.05761900834365336.
[I 2025-12-05 15:53:14,866] Trial 17 finished with value: 0.031627829153007575 and parameters: {'model_type': 'mlp', 'hidden_dims': '[512, 256]', 'dropout': 0.5260020523685199, 'batch_norm': True, 'lr': 0.000906375209920231, 'weight_decay': 5.400992065404888e-06, 'epochs': 239, 'loss': 'mae', 'optimizer': 'adam', 'graph_mode': 'off', 'use_snp_selection': False}. Best is trial 14 with value: 0.05761900834365336.
[I 2025-12-05 15:53:17,607] Trial 18 finished with value: 0.029412269133610874 and parameters: {'model_type': 'mlp', 'hidden_dims': '[256, 128, 64]', 'dropout': 0.3124176708262755, 'batch_norm': False, 'lr': 2.797772152750264e-05, 'weight_decay': 1.3157026583586933e-06, 'epochs': 295, 'loss': 'mae', 'optimizer': 'adam', 'graph_mode': 'off', 'use_snp_selection': True, 'num_snps': 58241}. Best is trial 14 with value: 0.05761900834365336.
[I 2025-12-05 15:53:19,457] Trial 19 finished with value: 0.05997559653439694 and parameters: {'model_type': 'mlp', 'hidden_dims': '[512, 64]', 'dropout': 0.21626923229526662, 'batch_norm': True, 'lr': 1.352570837276448e-05, 'weight_decay': 1.1354159408743119e-07, 'epochs': 269, 'loss': 'mae', 'optimizer': 'adam', 'graph_mode': 'off', 'use_snp_selection': False}. Best is trial 19 with value: 0.05997559653439694.
[I 2025-12-05 15:53:20,518] Trial 20 finished with value: -0.013781355851850498 and parameters: {'model_type': 'mlp', 'hidden_dims': '[256, 128, 64]', 'dropout': 0.20464292721050056, 'batch_norm': True, 'lr': 1.64655195956836e-05, 'weight_decay': 1.4238432529117994e-07, 'epochs': 221, 'loss': 'mae', 'optimizer': 'adam', 'graph_mode': 'off', 'use_snp_selection': False}. Best is trial 19 with value: 0.05997559653439694.
[I 2025-12-05 15:53:22,333] Trial 21 finished with value: -0.00901876077678021 and parameters: {'model_type': 'mlp', 'hidden_dims': '[512, 64]', 'dropout': 0.19787897232432566, 'batch_norm': True, 'lr': 9.901338724282483e-06, 'weight_decay': 2.925799393817309e-07, 'epochs': 272, 'loss': 'mae', 'optimizer': 'adam', 'graph_mode': 'off', 'use_snp_selection': False}. Best is trial 19 with value: 0.05997559653439694.
[I 2025-12-05 15:53:24,278] Trial 22 finished with value: 0.03607831800937662 and parameters: {'model_type': 'mlp', 'hidden_dims': '[512, 64]', 'dropout': 0.15181983510568844, 'batch_norm': True, 'lr': 0.00011532400467202075, 'weight_decay': 8.352352014045231e-07, 'epochs': 304, 'loss': 'mae', 'optimizer': 'adam', 'graph_mode': 'off', 'use_snp_selection': False}. Best is trial 19 with value: 0.05997559653439694.
[I 2025-12-05 15:53:26,031] Trial 23 finished with value: 0.0372365520926002 and parameters: {'model_type': 'mlp', 'hidden_dims': '[512, 64]', 'dropout': 0.2876501150877918, 'batch_norm': True, 'lr': 2.1923769896784e-05, 'weight_decay': 0.00014061128063276327, 'epochs': 258, 'loss': 'mae', 'optimizer': 'adam', 'graph_mode': 'off', 'use_snp_selection': False}. Best is trial 19 with value: 0.05997559653439694.
[I 2025-12-05 15:53:27,652] Trial 24 finished with value: 0.041024108668204544 and parameters: {'model_type': 'mlp', 'hidden_dims': '[512, 64]', 'dropout': 0.35375693059235125, 'batch_norm': True, 'lr': 0.0004248826137113187, 'weight_decay': 2.515297256305191e-05, 'epochs': 225, 'loss': 'mae', 'optimizer': 'adam', 'graph_mode': 'off', 'use_snp_selection': False}. Best is trial 19 with value: 0.05997559653439694.
[I 2025-12-05 15:53:29,699] Trial 25 finished with value: 0.038714412634402645 and parameters: {'model_type': 'mlp', 'hidden_dims': '[512, 64]', 'dropout': 0.20659399060640374, 'batch_norm': True, 'lr': 0.00010695951638904161, 'weight_decay': 2.337775289937781e-07, 'epochs': 328, 'loss': 'mae', 'optimizer': 'adam', 'graph_mode': 'off', 'use_snp_selection': False}. Best is trial 19 with value: 0.05997559653439694.
[I 2025-12-05 15:53:30,586] Trial 26 finished with value: 0.03929387902397627 and parameters: {'model_type': 'mlp', 'hidden_dims': '[256, 128]', 'dropout': 0.24527735646797869, 'batch_norm': True, 'lr': 1.2550693142833744e-05, 'weight_decay': 2.443643243280606e-06, 'epochs': 195, 'loss': 'mae', 'optimizer': 'adam', 'graph_mode': 'off', 'use_snp_selection': True, 'num_snps': 3842}. Best is trial 19 with value: 0.05997559653439694.
[I 2025-12-05 15:53:31,394] Trial 27 finished with value: 0.01718682440667922 and parameters: {'model_type': 'mlp', 'hidden_dims': '[128, 64]', 'dropout': 0.1711102529184621, 'batch_norm': False, 'lr': 6.1997482334625326e-06, 'weight_decay': 7.881611925153906e-06, 'epochs': 263, 'loss': 'mae', 'optimizer': 'adam', 'graph_mode': 'off', 'use_snp_selection': False}. Best is trial 19 with value: 0.05997559653439694.
[I 2025-12-05 15:53:33,305] Trial 28 finished with value: 0.043815692668081795 and parameters: {'model_type': 'mlp', 'hidden_dims': '[512, 256]', 'dropout': 0.1289666168399863, 'batch_norm': True, 'lr': 0.0006507717791259136, 'weight_decay': 8.74418883788382e-07, 'epochs': 293, 'loss': 'mae', 'optimizer': 'adam', 'graph_mode': 'off', 'use_snp_selection': False}. Best is trial 19 with value: 0.05997559653439694.
[I 2025-12-05 15:53:34,792] Trial 29 finished with value: 0.04871346991300006 and parameters: {'model_type': 'mlp', 'hidden_dims': '[128, 64]', 'dropout': 0.2253758553079369, 'batch_norm': True, 'lr': 2.8966762461994946e-06, 'weight_decay': 0.00012363202694194868, 'epochs': 333, 'loss': 'mae', 'optimizer': 'adam', 'graph_mode': 'off', 'use_snp_selection': True, 'num_snps': 19468}. Best is trial 19 with value: 0.05997559653439694.
[I 2025-12-05 15:53:36,253] Trial 30 finished with value: -0.004715779573163085 and parameters: {'model_type': 'mlp', 'hidden_dims': '[128, 64]', 'dropout': 0.34259278767560636, 'batch_norm': True, 'lr': 2.6679246309236726e-06, 'weight_decay': 0.00012024423044171738, 'epochs': 333, 'loss': 'mae', 'optimizer': 'adam', 'graph_mode': 'off', 'use_snp_selection': True, 'num_snps': 18365}. Best is trial 19 with value: 0.05997559653439694.
[I 2025-12-05 15:53:37,818] Trial 31 finished with value: 0.06273970869678712 and parameters: {'model_type': 'mlp', 'hidden_dims': '[128, 64]', 'dropout': 0.22352092458443154, 'batch_norm': True, 'lr': 1.0057291823561953e-06, 'weight_decay': 3.771244332504334e-05, 'epochs': 342, 'loss': 'mae', 'optimizer': 'adam', 'graph_mode': 'off', 'use_snp_selection': True, 'num_snps': 20689}. Best is trial 31 with value: 0.06273970869678712.
[I 2025-12-05 15:53:39,321] Trial 32 finished with value: 0.05125816510244294 and parameters: {'model_type': 'mlp', 'hidden_dims': '[128, 64]', 'dropout': 0.21920751072759084, 'batch_norm': True, 'lr': 1.1211122388869994e-06, 'weight_decay': 4.215742106750673e-05, 'epochs': 350, 'loss': 'mae', 'optimizer': 'adam', 'graph_mode': 'off', 'use_snp_selection': True, 'num_snps': 19001}. Best is trial 31 with value: 0.06273970869678712.
[I 2025-12-05 15:53:40,925] Trial 33 finished with value: -0.006152357569264133 and parameters: {'model_type': 'mlp', 'hidden_dims': '[128, 64]', 'dropout': 0.27797368209038004, 'batch_norm': True, 'lr': 2.0056049579929636e-06, 'weight_decay': 3.979306659379665e-05, 'epochs': 348, 'loss': 'mae', 'optimizer': 'adam', 'graph_mode': 'off', 'use_snp_selection': True, 'num_snps': 22388}. Best is trial 31 with value: 0.06273970869678712.
[I 2025-12-05 15:53:42,580] Trial 34 finished with value: 0.024074470697261055 and parameters: {'model_type': 'mlp', 'hidden_dims': '[128, 64]', 'dropout': 0.18017654558130222, 'batch_norm': True, 'lr': 1.1655672316630893e-06, 'weight_decay': 1.6055737230778332e-05, 'epochs': 315, 'loss': 'mae', 'optimizer': 'adam', 'graph_mode': 'off', 'use_snp_selection': True, 'num_snps': 25680}. Best is trial 31 with value: 0.06273970869678712.
[I 2025-12-05 15:53:43,767] Trial 35 finished with value: 0.050142158802578975 and parameters: {'model_type': 'mlp', 'hidden_dims': '[128, 64]', 'dropout': 0.43535234370721276, 'batch_norm': False, 'lr': 1.0335517133789841e-06, 'weight_decay': 4.04807903310428e-05, 'epochs': 349, 'loss': 'mae', 'optimizer': 'adam', 'graph_mode': 'off', 'use_snp_selection': True, 'num_snps': 9268}. Best is trial 31 with value: 0.06273970869678712.
[I 2025-12-05 15:53:45,918] Trial 36 finished with value: -0.01246314086770796 and parameters: {'model_type': 'mlp', 'hidden_dims': '[256, 128, 64]', 'dropout': 0.31501402984828647, 'batch_norm': True, 'lr': 6.4504988289879994e-06, 'weight_decay': 0.00033407153174837544, 'epochs': 313, 'loss': 'mse', 'optimizer': 'adam', 'graph_mode': 'off', 'use_snp_selection': True, 'num_snps': 38703}. Best is trial 31 with value: 0.06273970869678712.
[I 2025-12-05 15:53:47,144] Trial 37 finished with value: 0.015099189753639672 and parameters: {'model_type': 'mlp', 'hidden_dims': '[128, 64]', 'dropout': 0.22853997462330322, 'batch_norm': True, 'lr': 4.2436551961295615e-06, 'weight_decay': 1.037906986467434e-05, 'epochs': 245, 'loss': 'mae', 'optimizer': 'adam', 'graph_mode': 'off', 'use_snp_selection': True, 'num_snps': 13351}. Best is trial 31 with value: 0.06273970869678712.
[I 2025-12-05 15:53:48,808] Trial 38 finished with value: 0.029104134800196184 and parameters: {'model_type': 'mlp', 'hidden_dims': '[256, 128]', 'dropout': 0.2728136302962639, 'batch_norm': False, 'lr': 1.9978149385303798e-06, 'weight_decay': 0.0002113533557036832, 'epochs': 298, 'loss': 'mse', 'optimizer': 'adam', 'graph_mode': 'off', 'use_snp_selection': True, 'num_snps': 28887}. Best is trial 31 with value: 0.06273970869678712.
[I 2025-12-05 15:53:51,002] Trial 39 finished with value: 0.05478663631754267 and parameters: {'model_type': 'mlp', 'hidden_dims': '[128, 64]', 'dropout': 0.17433012434726633, 'batch_norm': True, 'lr': 3.981511242158729e-05, 'weight_decay': 0.0007039256747749402, 'epochs': 138, 'loss': 'mae', 'optimizer': 'adam', 'graph_mode': 'off', 'use_snp_selection': True, 'num_snps': 53041}. Best is trial 31 with value: 0.06273970869678712.
[I 2025-12-05 15:53:53,312] Trial 40 finished with value: 0.04014087890250807 and parameters: {'model_type': 'mlp', 'hidden_dims': '[256, 128, 64]', 'dropout': 0.3716081310069049, 'batch_norm': True, 'lr': 8.76456735027197e-06, 'weight_decay': 0.0006900177194939316, 'epochs': 112, 'loss': 'mae', 'optimizer': 'adam', 'graph_mode': 'off', 'use_snp_selection': True, 'num_snps': 53730}. Best is trial 31 with value: 0.06273970869678712.
[I 2025-12-05 15:53:55,255] Trial 41 finished with value: 0.0045872405323001885 and parameters: {'model_type': 'mlp', 'hidden_dims': '[128, 64]', 'dropout': 0.1956809886247423, 'batch_norm': True, 'lr': 3.7622605656921635e-06, 'weight_decay': 2.813039809949031e-05, 'epochs': 167, 'loss': 'mae', 'optimizer': 'adam', 'graph_mode': 'off', 'use_snp_selection': True, 'num_snps': 42014}. Best is trial 31 with value: 0.06273970869678712.
