[I 2025-12-06 02:27:29,306] Trial 135 finished with value: 0.2996874015750974 and parameters: {'model_type': 'mlp', 'hidden_dims': '[512, 64]', 'dropout': 0.5780844228582072, 'batch_norm': False, 'lr': 3.5594101855885695e-06, 'weight_decay': 1.9580937502560016e-07, 'epochs': 204, 'loss': 'mse', 'optimizer': 'adam', 'graph_mode': 'off', 'use_snp_selection': False}. Best is trial 107 with value: 0.30348553717700794.
[I 2025-12-06 02:27:56,341] Trial 136 finished with value: 0.28807208730848327 and parameters: {'model_type': 'mlp', 'hidden_dims': '[256, 128, 64]', 'dropout': 0.566351894630837, 'batch_norm': False, 'lr': 4.599947897559345e-06, 'weight_decay': 3.914996972784223e-06, 'epochs': 244, 'loss': 'mse', 'optimizer': 'adam', 'graph_mode': 'off', 'use_snp_selection': False}. Best is trial 107 with value: 0.30348553717700794.
[I 2025-12-06 02:28:42,681] Trial 137 finished with value: 0.2935922791950243 and parameters: {'model_type': 'mlp', 'hidden_dims': '[512, 64]', 'dropout': 0.22655032272753, 'batch_norm': False, 'lr': 2.0408235583657477e-06, 'weight_decay': 3.8138459305055546e-07, 'epochs': 235, 'loss': 'mse', 'optimizer': 'adam', 'graph_mode': 'off', 'use_snp_selection': False}. Best is trial 107 with value: 0.30348553717700794.
[I 2025-12-06 02:29:24,924] Trial 138 finished with value: 0.29581599944851045 and parameters: {'model_type': 'mlp', 'hidden_dims': '[512, 64]', 'dropout': 0.5522126700230499, 'batch_norm': False, 'lr': 2.6646288761912774e-06, 'weight_decay': 2.7152564223234405e-05, 'epochs': 212, 'loss': 'mse', 'optimizer': 'adam', 'graph_mode': 'off', 'use_snp_selection': False}. Best is trial 107 with value: 0.30348553717700794.
[I 2025-12-06 02:29:48,521] Trial 139 finished with value: 0.2548268392740585 and parameters: {'model_type': 'mlp', 'hidden_dims': '[512, 128]', 'dropout': 0.5165733273136649, 'batch_norm': False, 'lr': 3.170284390300536e-06, 'weight_decay': 2.5497103999469e-07, 'epochs': 258, 'loss': 'mse', 'optimizer': 'adam', 'graph_mode': 'off', 'use_snp_selection': True, 'num_snps': 2571}. Best is trial 107 with value: 0.30348553717700794.
[I 2025-12-06 02:30:33,165] Trial 140 finished with value: 0.27805059949964833 and parameters: {'model_type': 'mlp', 'hidden_dims': '[512, 64]', 'dropout': 0.5885166728512652, 'batch_norm': True, 'lr': 3.9560787716646535e-06, 'weight_decay': 9.02215095628115e-05, 'epochs': 225, 'loss': 'mse', 'optimizer': 'adam', 'graph_mode': 'off', 'use_snp_selection': False}. Best is trial 107 with value: 0.30348553717700794.
[I 2025-12-06 02:31:22,021] Trial 141 finished with value: 0.3007282982697613 and parameters: {'model_type': 'mlp', 'hidden_dims': '[512, 64]', 'dropout': 0.5829452125029674, 'batch_norm': False, 'lr': 3.773897318354535e-06, 'weight_decay': 6.888955508707944e-07, 'epochs': 250, 'loss': 'mse', 'optimizer': 'adam', 'graph_mode': 'off', 'use_snp_selection': False}. Best is trial 107 with value: 0.30348553717700794.
[I 2025-12-06 02:32:11,094] Trial 142 finished with value: 0.29817331559925914 and parameters: {'model_type': 'mlp', 'hidden_dims': '[512, 64]', 'dropout': 0.5775100357155631, 'batch_norm': False, 'lr': 3.5245114110581538e-06, 'weight_decay': 3.0623888180479373e-07, 'epochs': 251, 'loss': 'mse', 'optimizer': 'adam', 'graph_mode': 'off', 'use_snp_selection': False}. Best is trial 107 with value: 0.30348553717700794.
[I 2025-12-06 02:32:43,485] Trial 143 finished with value: 0.2933126268174934 and parameters: {'model_type': 'mlp', 'hidden_dims': '[512, 64]', 'dropout': 0.5632428759140308, 'batch_norm': False, 'lr': 5.519427149153136e-06, 'weight_decay': 4.8925627686968405e-05, 'epochs': 156, 'loss': 'mse', 'optimizer': 'adam', 'graph_mode': 'off', 'use_snp_selection': False}. Best is trial 107 with value: 0.30348553717700794.
[I 2025-12-06 02:33:30,888] Trial 144 finished with value: 0.29546707189389787 and parameters: {'model_type': 'mlp', 'hidden_dims': '[512, 64]', 'dropout': 0.5917261541650258, 'batch_norm': False, 'lr': 4.381585311071955e-06, 'weight_decay': 6.686564699977014e-07, 'epochs': 242, 'loss': 'mse', 'optimizer': 'adam', 'graph_mode': 'off', 'use_snp_selection': False}. Best is trial 107 with value: 0.30348553717700794.
[I 2025-12-06 02:34:23,907] Trial 145 finished with value: 0.2993611122460788 and parameters: {'model_type': 'mlp', 'hidden_dims': '[512, 64]', 'dropout': 0.5700191268135515, 'batch_norm': False, 'lr': 2.3300219024318587e-06, 'weight_decay': 4.774259634091006e-07, 'epochs': 274, 'loss': 'mse', 'optimizer': 'adam', 'graph_mode': 'off', 'use_snp_selection': False}. Best is trial 107 with value: 0.30348553717700794.
[I 2025-12-06 02:35:09,279] Trial 146 finished with value: 0.2993902604987242 and parameters: {'model_type': 'mlp', 'hidden_dims': '[512, 64]', 'dropout': 0.5411557397005763, 'batch_norm': False, 'lr': 2.8787045190948084e-06, 'weight_decay': 1.7720678412357302e-07, 'epochs': 230, 'loss': 'mse', 'optimizer': 'adam', 'graph_mode': 'off', 'use_snp_selection': False}. Best is trial 107 with value: 0.30348553717700794.
[I 2025-12-06 02:35:36,503] Trial 147 finished with value: 0.2983976112700464 and parameters: {'model_type': 'mlp', 'hidden_dims': '[256, 128]', 'dropout': 0.5816422569118942, 'batch_norm': False, 'lr': 3.3367709079506403e-06, 'weight_decay': 2.2298118064552923e-07, 'epochs': 247, 'loss': 'mse', 'optimizer': 'adam', 'graph_mode': 'off', 'use_snp_selection': False}. Best is trial 107 with value: 0.30348553717700794.
[I 2025-12-06 02:36:19,907] Trial 148 finished with value: 0.2975887336244859 and parameters: {'model_type': 'mlp', 'hidden_dims': '[512, 64]', 'dropout': 0.5579917027531776, 'batch_norm': False, 'lr': 3.8964800911730045e-06, 'weight_decay': 1.382264734795858e-07, 'epochs': 219, 'loss': 'mse', 'optimizer': 'adam', 'graph_mode': 'off', 'use_snp_selection': False}. Best is trial 107 with value: 0.30348553717700794.
[I 2025-12-06 02:37:06,296] Trial 149 finished with value: 0.2860753599598458 and parameters: {'model_type': 'mlp', 'hidden_dims': '[512, 64]', 'dropout': 0.5987581709696828, 'batch_norm': False, 'lr': 1.2967482689458855e-06, 'weight_decay': 6.297307566386988e-06, 'epochs': 236, 'loss': 'mse', 'optimizer': 'adam', 'graph_mode': 'off', 'use_snp_selection': False}. Best is trial 107 with value: 0.30348553717700794.
[I 2025-12-06 02:38:02,721] Trial 0 finished with value: 0.25860409928814193 and parameters: {'model_type': 'mlp', 'hidden_dims': '[128, 64]', 'dropout': 0.199031432379812, 'batch_norm': True, 'lr': 1.8408544111075837e-06, 'weight_decay': 5.5136510071208614e-05, 'epochs': 336, 'loss': 'mae', 'optimizer': 'adam', 'graph_mode': 'off', 'use_snp_selection': True, 'num_snps': 43862}. Best is trial 0 with value: 0.25860409928814193.
[I 2025-12-06 02:38:29,565] Trial 1 finished with value: 0.2864036887726768 and parameters: {'model_type': 'mlp', 'hidden_dims': '[256, 128]', 'dropout': 0.4370668075331726, 'batch_norm': True, 'lr': 7.133471581159139e-05, 'weight_decay': 1.128633586803549e-05, 'epochs': 242, 'loss': 'mae', 'optimizer': 'adam', 'graph_mode': 'off', 'use_snp_selection': False}. Best is trial 1 with value: 0.2864036887726768.
[I 2025-12-06 02:38:56,004] Trial 2 finished with value: 0.2676040427994756 and parameters: {'model_type': 'mlp', 'hidden_dims': '[256, 128, 64]', 'dropout': 0.41314357415569625, 'batch_norm': False, 'lr': 3.952233718592101e-06, 'weight_decay': 0.00026754769258252603, 'epochs': 149, 'loss': 'mse', 'optimizer': 'adam', 'graph_mode': 'off', 'use_snp_selection': True, 'num_snps': 11571}. Best is trial 1 with value: 0.2864036887726768.
[I 2025-12-06 02:39:56,705] Trial 3 finished with value: 0.2915799186010739 and parameters: {'model_type': 'mlp', 'hidden_dims': '[512, 64]', 'dropout': 0.5938127374509361, 'batch_norm': False, 'lr': 5.67704586114731e-06, 'weight_decay': 2.4518087630137052e-05, 'epochs': 320, 'loss': 'mae', 'optimizer': 'adam', 'graph_mode': 'off', 'use_snp_selection': False}. Best is trial 3 with value: 0.2915799186010739.
[I 2025-12-06 02:40:57,145] Trial 4 finished with value: 0.2756633384982729 and parameters: {'model_type': 'mlp', 'hidden_dims': '[512, 128]', 'dropout': 0.25746343592134413, 'batch_norm': True, 'lr': 1.3467657668402788e-06, 'weight_decay': 0.00033087251918647806, 'epochs': 277, 'loss': 'mse', 'optimizer': 'adam', 'graph_mode': 'off', 'use_snp_selection': True, 'num_snps': 36675}. Best is trial 3 with value: 0.2915799186010739.
[I 2025-12-06 02:41:40,253] Trial 5 finished with value: 0.23872605295908783 and parameters: {'model_type': 'mlp', 'hidden_dims': '[512, 64]', 'dropout': 0.38275350994408375, 'batch_norm': True, 'lr': 1.5586664309232824e-06, 'weight_decay': 0.0008227664668621182, 'epochs': 145, 'loss': 'mae', 'optimizer': 'adam', 'graph_mode': 'off', 'use_snp_selection': True, 'num_snps': 32148}. Best is trial 3 with value: 0.2915799186010739.
[I 2025-12-06 02:42:02,855] Trial 6 finished with value: 0.282030860629595 and parameters: {'model_type': 'mlp', 'hidden_dims': '[256, 128]', 'dropout': 0.3930109900265879, 'batch_norm': False, 'lr': 4.892964372128395e-05, 'weight_decay': 1.5809549317992182e-06, 'epochs': 199, 'loss': 'mse', 'optimizer': 'adam', 'graph_mode': 'off', 'use_snp_selection': False}. Best is trial 3 with value: 0.2915799186010739.
[I 2025-12-06 02:42:25,161] Trial 7 finished with value: 0.2853235483424015 and parameters: {'model_type': 'mlp', 'hidden_dims': '[512, 256]', 'dropout': 0.15343979219678458, 'batch_norm': True, 'lr': 6.234003099047341e-05, 'weight_decay': 3.894760610535477e-07, 'epochs': 97, 'loss': 'mse', 'optimizer': 'adam', 'graph_mode': 'off', 'use_snp_selection': False}. Best is trial 3 with value: 0.2915799186010739.
[I 2025-12-06 02:43:25,221] Trial 8 finished with value: 0.28644396302287994 and parameters: {'model_type': 'mlp', 'hidden_dims': '[512, 128]', 'dropout': 0.10743001231661406, 'batch_norm': True, 'lr': 0.00023728538449271062, 'weight_decay': 1.7629071578048637e-05, 'epochs': 312, 'loss': 'mae', 'optimizer': 'adam', 'graph_mode': 'off', 'use_snp_selection': False}. Best is trial 3 with value: 0.2915799186010739.
[I 2025-12-06 02:44:01,131] Trial 9 finished with value: 0.2856977151606449 and parameters: {'model_type': 'mlp', 'hidden_dims': '[512, 64]', 'dropout': 0.14505336736221927, 'batch_norm': True, 'lr': 5.8619638388111826e-05, 'weight_decay': 6.200156172669308e-07, 'epochs': 175, 'loss': 'mse', 'optimizer': 'adam', 'graph_mode': 'off', 'use_snp_selection': False}. Best is trial 3 with value: 0.2915799186010739.
[I 2025-12-06 02:44:15,983] Trial 10 finished with value: 0.2502847801934859 and parameters: {'model_type': 'mlp', 'hidden_dims': '[512, 64]', 'dropout': 0.5885461262002587, 'batch_norm': False, 'lr': 8.769366258768696e-06, 'weight_decay': 2.78273193871783e-06, 'epochs': 55, 'loss': 'mae', 'optimizer': 'adam', 'graph_mode': 'off', 'use_snp_selection': False}. Best is trial 3 with value: 0.2915799186010739.
[I 2025-12-06 02:45:21,246] Trial 11 finished with value: 0.23088436134958817 and parameters: {'model_type': 'mlp', 'hidden_dims': '[512, 128]', 'dropout': 0.583942291816117, 'batch_norm': False, 'lr': 0.0007607980626791682, 'weight_decay': 2.11387030344014e-05, 'epochs': 346, 'loss': 'mae', 'optimizer': 'adam', 'graph_mode': 'off', 'use_snp_selection': False}. Best is trial 3 with value: 0.2915799186010739.
[I 2025-12-06 02:46:17,515] Trial 12 finished with value: 0.2796087231688427 and parameters: {'model_type': 'mlp', 'hidden_dims': '[512, 128]', 'dropout': 0.2637316882220091, 'batch_norm': False, 'lr': 0.000384886887018818, 'weight_decay': 6.23587291883057e-05, 'epochs': 294, 'loss': 'mae', 'optimizer': 'adam', 'graph_mode': 'off', 'use_snp_selection': False}. Best is trial 3 with value: 0.2915799186010739.
[I 2025-12-06 02:46:36,691] Trial 13 finished with value: 0.28660701559260227 and parameters: {'model_type': 'mlp', 'hidden_dims': '[128, 64]', 'dropout': 0.5255276925359322, 'batch_norm': False, 'lr': 1.3373175420781734e-05, 'weight_decay': 2.875929917712265e-06, 'epochs': 285, 'loss': 'mae', 'optimizer': 'adam', 'graph_mode': 'off', 'use_snp_selection': False}. Best is trial 3 with value: 0.2915799186010739.
[I 2025-12-06 02:46:53,619] Trial 14 finished with value: 0.2838857941436749 and parameters: {'model_type': 'mlp', 'hidden_dims': '[128, 64]', 'dropout': 0.4841249530929294, 'batch_norm': False, 'lr': 1.3128901291408973e-05, 'weight_decay': 1.1414924884997386e-07, 'epochs': 241, 'loss': 'mae', 'optimizer': 'adam', 'graph_mode': 'off', 'use_snp_selection': False}. Best is trial 3 with value: 0.2915799186010739.
[I 2025-12-06 02:47:11,414] Trial 15 finished with value: 0.288017973004416 and parameters: {'model_type': 'mlp', 'hidden_dims': '[128, 64]', 'dropout': 0.5175762982265439, 'batch_norm': False, 'lr': 1.8411764708572348e-05, 'weight_decay': 4.61164678661027e-06, 'epochs': 258, 'loss': 'mae', 'optimizer': 'adam', 'graph_mode': 'off', 'use_snp_selection': False}. Best is trial 3 with value: 0.2915799186010739.
[I 2025-12-06 02:47:38,162] Trial 16 finished with value: 0.2712371092059511 and parameters: {'model_type': 'mlp', 'hidden_dims': '[256, 128, 64]', 'dropout': 0.51814941375595, 'batch_norm': False, 'lr': 6.013316929814413e-06, 'weight_decay': 5.098763140321504e-06, 'epochs': 240, 'loss': 'mae', 'optimizer': 'adam', 'graph_mode': 'off', 'use_snp_selection': False}. Best is trial 3 with value: 0.2915799186010739.
[I 2025-12-06 02:48:29,135] Trial 17 finished with value: 0.2895600589899203 and parameters: {'model_type': 'mlp', 'hidden_dims': '[512, 256]', 'dropout': 0.31793710483525317, 'batch_norm': False, 'lr': 2.349300150160787e-05, 'weight_decay': 5.7836943269890636e-05, 'epochs': 262, 'loss': 'mae', 'optimizer': 'adam', 'graph_mode': 'off', 'use_snp_selection': False}. Best is trial 3 with value: 0.2915799186010739.
[I 2025-12-06 02:49:40,963] Trial 18 finished with value: 0.2886034219679751 and parameters: {'model_type': 'mlp', 'hidden_dims': '[512, 256]', 'dropout': 0.2825164393200346, 'batch_norm': False, 'lr': 3.2102227468981598e-06, 'weight_decay': 7.197637349971628e-05, 'epochs': 210, 'loss': 'mae', 'optimizer': 'adam', 'graph_mode': 'off', 'use_snp_selection': True, 'num_snps': 58241}. Best is trial 3 with value: 0.2915799186010739.
[I 2025-12-06 02:50:40,849] Trial 19 finished with value: 0.2861084504801952 and parameters: {'model_type': 'mlp', 'hidden_dims': '[512, 256]', 'dropout': 0.3255732506546632, 'batch_norm': False, 'lr': 2.4439368381186264e-05, 'weight_decay': 0.00015299712892081902, 'epochs': 314, 'loss': 'mae', 'optimizer': 'adam', 'graph_mode': 'off', 'use_snp_selection': False}. Best is trial 3 with value: 0.2915799186010739.
[I 2025-12-06 02:51:41,393] Trial 20 finished with value: 0.29240472635744613 and parameters: {'model_type': 'mlp', 'hidden_dims': '[512, 64]', 'dropout': 0.3383846326806768, 'batch_norm': False, 'lr': 5.446670185967407e-06, 'weight_decay': 3.02402431522846e-05, 'epochs': 317, 'loss': 'mae', 'optimizer': 'adam', 'graph_mode': 'off', 'use_snp_selection': False}. Best is trial 20 with value: 0.29240472635744613.
[I 2025-12-06 02:52:42,530] Trial 21 finished with value: 0.2878968983427037 and parameters: {'model_type': 'mlp', 'hidden_dims': '[512, 64]', 'dropout': 0.3379142414382605, 'batch_norm': False, 'lr': 4.902347814651543e-06, 'weight_decay': 3.363492503521338e-05, 'epochs': 319, 'loss': 'mae', 'optimizer': 'adam', 'graph_mode': 'off', 'use_snp_selection': False}. Best is trial 20 with value: 0.29240472635744613.
[I 2025-12-06 02:53:35,035] Trial 22 finished with value: 0.2774070604309804 and parameters: {'model_type': 'mlp', 'hidden_dims': '[512, 64]', 'dropout': 0.3104012823328307, 'batch_norm': False, 'lr': 0.00013125309290784544, 'weight_decay': 0.00012506009376990192, 'epochs': 273, 'loss': 'mae', 'optimizer': 'adam', 'graph_mode': 'off', 'use_snp_selection': False}. Best is trial 20 with value: 0.29240472635744613.
[I 2025-12-06 02:54:41,121] Trial 23 finished with value: 0.28808248909895356 and parameters: {'model_type': 'mlp', 'hidden_dims': '[512, 256]', 'dropout': 0.23070381072043317, 'batch_norm': False, 'lr': 8.342273027354459e-06, 'weight_decay': 1.0488901139924964e-05, 'epochs': 346, 'loss': 'mae', 'optimizer': 'adam', 'graph_mode': 'off', 'use_snp_selection': False}. Best is trial 20 with value: 0.29240472635744613.
[I 2025-12-06 02:55:38,946] Trial 24 finished with value: 0.28582429039136636 and parameters: {'model_type': 'mlp', 'hidden_dims': '[512, 64]', 'dropout': 0.449253594067678, 'batch_norm': False, 'lr': 2.589517193432649e-06, 'weight_decay': 3.297534356614483e-05, 'epochs': 301, 'loss': 'mae', 'optimizer': 'adam', 'graph_mode': 'off', 'use_snp_selection': False}. Best is trial 20 with value: 0.29240472635744613.
[I 2025-12-06 02:56:29,606] Trial 25 finished with value: 0.2864599578271755 and parameters: {'model_type': 'mlp', 'hidden_dims': '[512, 64]', 'dropout': 0.3708904476363604, 'batch_norm': False, 'lr': 2.7581639884760957e-05, 'weight_decay': 0.0008835998501523608, 'epochs': 262, 'loss': 'mae', 'optimizer': 'adam', 'graph_mode': 'off', 'use_snp_selection': False}. Best is trial 20 with value: 0.29240472635744613.
[I 2025-12-06 02:56:55,649] Trial 26 finished with value: 0.27728349999634816 and parameters: {'model_type': 'mlp', 'hidden_dims': '[512, 256]', 'dropout': 0.30068221704358744, 'batch_norm': False, 'lr': 8.960196115319643e-06, 'weight_decay': 0.00015265805543382736, 'epochs': 312, 'loss': 'mse', 'optimizer': 'adam', 'graph_mode': 'off', 'use_snp_selection': True, 'num_snps': 3842}. Best is trial 20 with value: 0.29240472635744613.
[I 2025-12-06 02:57:38,821] Trial 27 finished with value: 0.28326321274322214 and parameters: {'model_type': 'mlp', 'hidden_dims': '[512, 64]', 'dropout': 0.22711347713250862, 'batch_norm': False, 'lr': 3.708794373669967e-05, 'weight_decay': 2.6086871179536294e-05, 'epochs': 219, 'loss': 'mae', 'optimizer': 'adam', 'graph_mode': 'off', 'use_snp_selection': False}. Best is trial 20 with value: 0.29240472635744613.
[I 2025-12-06 02:58:13,660] Trial 28 finished with value: 0.28749410229924977 and parameters: {'model_type': 'mlp', 'hidden_dims': '[256, 128]', 'dropout': 0.44617667283535833, 'batch_norm': False, 'lr': 1.597687963134124e-05, 'weight_decay': 7.791471289835363e-06, 'epochs': 332, 'loss': 'mae', 'optimizer': 'adam', 'graph_mode': 'off', 'use_snp_selection': False}. Best is trial 20 with value: 0.29240472635744613.
[I 2025-12-06 02:58:49,335] Trial 29 finished with value: 0.26324693087752243 and parameters: {'model_type': 'mlp', 'hidden_dims': '[256, 128, 64]', 'dropout': 0.3467572556454796, 'batch_norm': False, 'lr': 2.320440320155318e-06, 'weight_decay': 5.5227103357724904e-05, 'epochs': 328, 'loss': 'mae', 'optimizer': 'adam', 'graph_mode': 'off', 'use_snp_selection': True, 'num_snps': 19468}. Best is trial 20 with value: 0.29240472635744613.
[I 2025-12-06 02:59:45,433] Trial 30 finished with value: 0.28729880210320397 and parameters: {'model_type': 'mlp', 'hidden_dims': '[512, 256]', 'dropout': 0.3548591552517591, 'batch_norm': False, 'lr': 7.226035017644617e-06, 'weight_decay': 8.811772910543637e-05, 'epochs': 291, 'loss': 'mae', 'optimizer': 'adam', 'graph_mode': 'off', 'use_snp_selection': False}. Best is trial 20 with value: 0.29240472635744613.
[I 2025-12-06 03:00:57,554] Trial 31 finished with value: 0.2910846650635294 and parameters: {'model_type': 'mlp', 'hidden_dims': '[512, 256]', 'dropout': 0.2823593614275003, 'batch_norm': False, 'lr': 3.175388624673393e-06, 'weight_decay': 4.480544570387384e-05, 'epochs': 213, 'loss': 'mae', 'optimizer': 'adam', 'graph_mode': 'off', 'use_snp_selection': True, 'num_snps': 57714}. Best is trial 20 with value: 0.29240472635744613.
[I 2025-12-06 03:02:04,592] Trial 32 finished with value: 0.2872468500242348 and parameters: {'model_type': 'mlp', 'hidden_dims': '[512, 256]', 'dropout': 0.19118256961538754, 'batch_norm': False, 'lr': 4.178833588685135e-06, 'weight_decay': 1.3751121384689825e-05, 'epochs': 180, 'loss': 'mae', 'optimizer': 'adam', 'graph_mode': 'off', 'use_snp_selection': True, 'num_snps': 58010}. Best is trial 20 with value: 0.29240472635744613.
[I 2025-12-06 03:03:13,238] Trial 33 finished with value: 0.28511214322375433 and parameters: {'model_type': 'mlp', 'hidden_dims': '[512, 256]', 'dropout': 0.28860308817386016, 'batch_norm': False, 'lr': 1.6546199694472265e-06, 'weight_decay': 3.791376353009183e-05, 'epochs': 256, 'loss': 'mae', 'optimizer': 'adam', 'graph_mode': 'off', 'use_snp_selection': True, 'num_snps': 47339}. Best is trial 20 with value: 0.29240472635744613.
[I 2025-12-06 03:03:54,727] Trial 34 finished with value: 0.2352368035856288 and parameters: {'model_type': 'mlp', 'hidden_dims': '[512, 256]', 'dropout': 0.40231617470862907, 'batch_norm': True, 'lr': 1.0693095775852578e-06, 'weight_decay': 0.00029192159504806713, 'epochs': 226, 'loss': 'mae', 'optimizer': 'adam', 'graph_mode': 'off', 'use_snp_selection': True, 'num_snps': 22340}. Best is trial 20 with value: 0.29240472635744613.
[I 2025-12-06 03:04:46,713] Trial 35 finished with value: 0.29642516424402854 and parameters: {'model_type': 'mlp', 'hidden_dims': '[512, 64]', 'dropout': 0.24320095995047786, 'batch_norm': False, 'lr': 3.3575074744659014e-06, 'weight_decay': 4.2013440314260814e-05, 'epochs': 140, 'loss': 'mse', 'optimizer': 'adam', 'graph_mode': 'off', 'use_snp_selection': True, 'num_snps': 45518}. Best is trial 35 with value: 0.29642516424402854.
[I 2025-12-06 03:05:40,637] Trial 36 finished with value: 0.29946446024589535 and parameters: {'model_type': 'mlp', 'hidden_dims': '[512, 64]', 'dropout': 0.22580883846211278, 'batch_norm': False, 'lr': 3.6036684858549458e-06, 'weight_decay': 6.7405030220288095e-06, 'epochs': 140, 'loss': 'mse', 'optimizer': 'adam', 'graph_mode': 'off', 'use_snp_selection': True, 'num_snps': 48249}. Best is trial 36 with value: 0.29946446024589535.
