Running from this directory: /cluster/work/simennes/Project_thesis/Project_thesis
Name of job: mlp_m_ens
ID of job: 23690565
The job was run on these nodes: idun-07-04
[I 2025-12-05 14:21:57,667] Trial 0 finished with value: 0.007415387435475141 and parameters: {'model_type': 'mlp', 'hidden_dims': '[128, 64]', 'dropout': 0.199031432379812, 'batch_norm': True, 'lr': 1.8408544111075837e-06, 'weight_decay': 5.5136510071208614e-05, 'epochs': 336, 'loss': 'mae', 'optimizer': 'adam', 'graph_mode': 'off', 'use_snp_selection': True, 'num_snps': 43862}. Best is trial 0 with value: 0.007415387435475141.
[I 2025-12-05 14:21:58,760] Trial 1 finished with value: 0.08681188020692338 and parameters: {'model_type': 'mlp', 'hidden_dims': '[256, 128]', 'dropout': 0.4370668075331726, 'batch_norm': True, 'lr': 7.133471581159139e-05, 'weight_decay': 1.128633586803549e-05, 'epochs': 242, 'loss': 'mae', 'optimizer': 'adam', 'graph_mode': 'off', 'use_snp_selection': False}. Best is trial 1 with value: 0.08681188020692338.
[I 2025-12-05 14:21:59,760] Trial 2 finished with value: 0.019266719448288894 and parameters: {'model_type': 'mlp', 'hidden_dims': '[256, 128, 64]', 'dropout': 0.41314357415569625, 'batch_norm': False, 'lr': 3.952233718592101e-06, 'weight_decay': 0.00026754769258252603, 'epochs': 149, 'loss': 'mse', 'optimizer': 'adam', 'graph_mode': 'off', 'use_snp_selection': True, 'num_snps': 11571}. Best is trial 1 with value: 0.08681188020692338.
[I 2025-12-05 14:22:01,499] Trial 3 finished with value: 0.039753923900819506 and parameters: {'model_type': 'mlp', 'hidden_dims': '[512, 64]', 'dropout': 0.5938127374509361, 'batch_norm': False, 'lr': 5.67704586114731e-06, 'weight_decay': 2.4518087630137052e-05, 'epochs': 320, 'loss': 'mae', 'optimizer': 'adam', 'graph_mode': 'off', 'use_snp_selection': False}. Best is trial 1 with value: 0.08681188020692338.
[I 2025-12-05 14:22:03,596] Trial 4 finished with value: 0.01965274029038863 and parameters: {'model_type': 'mlp', 'hidden_dims': '[512, 128]', 'dropout': 0.25746343592134413, 'batch_norm': True, 'lr': 1.3467657668402788e-06, 'weight_decay': 0.00033087251918647806, 'epochs': 277, 'loss': 'mse', 'optimizer': 'adam', 'graph_mode': 'off', 'use_snp_selection': True, 'num_snps': 36675}. Best is trial 1 with value: 0.08681188020692338.
[I 2025-12-05 14:22:05,268] Trial 5 finished with value: 0.04358334676087969 and parameters: {'model_type': 'mlp', 'hidden_dims': '[512, 64]', 'dropout': 0.38275350994408375, 'batch_norm': True, 'lr': 1.5586664309232824e-06, 'weight_decay': 0.0008227664668621182, 'epochs': 145, 'loss': 'mae', 'optimizer': 'adam', 'graph_mode': 'off', 'use_snp_selection': True, 'num_snps': 32148}. Best is trial 1 with value: 0.08681188020692338.
[I 2025-12-05 14:22:06,216] Trial 6 finished with value: 0.0634665018644211 and parameters: {'model_type': 'mlp', 'hidden_dims': '[256, 128]', 'dropout': 0.3930109900265879, 'batch_norm': False, 'lr': 4.892964372128395e-05, 'weight_decay': 1.5809549317992182e-06, 'epochs': 199, 'loss': 'mse', 'optimizer': 'adam', 'graph_mode': 'off', 'use_snp_selection': False}. Best is trial 1 with value: 0.08681188020692338.
[I 2025-12-05 14:22:07,266] Trial 7 finished with value: 0.11714583492557695 and parameters: {'model_type': 'mlp', 'hidden_dims': '[512, 256]', 'dropout': 0.15343979219678458, 'batch_norm': True, 'lr': 6.234003099047341e-05, 'weight_decay': 3.894760610535477e-07, 'epochs': 97, 'loss': 'mse', 'optimizer': 'adam', 'graph_mode': 'off', 'use_snp_selection': False}. Best is trial 7 with value: 0.11714583492557695.
[I 2025-12-05 14:22:08,988] Trial 8 finished with value: 0.10706456157093815 and parameters: {'model_type': 'mlp', 'hidden_dims': '[512, 128]', 'dropout': 0.10743001231661406, 'batch_norm': True, 'lr': 0.00023728538449271062, 'weight_decay': 1.7629071578048637e-05, 'epochs': 312, 'loss': 'mae', 'optimizer': 'adam', 'graph_mode': 'off', 'use_snp_selection': False}. Best is trial 7 with value: 0.11714583492557695.
[I 2025-12-05 14:22:10,277] Trial 9 finished with value: 0.12005949336951839 and parameters: {'model_type': 'mlp', 'hidden_dims': '[512, 64]', 'dropout': 0.14505336736221927, 'batch_norm': True, 'lr': 5.8619638388111826e-05, 'weight_decay': 6.200156172669308e-07, 'epochs': 175, 'loss': 'mse', 'optimizer': 'adam', 'graph_mode': 'off', 'use_snp_selection': False}. Best is trial 9 with value: 0.12005949336951839.
[I 2025-12-05 14:22:11,158] Trial 10 finished with value: 0.0235336813852242 and parameters: {'model_type': 'mlp', 'hidden_dims': '[512, 64]', 'dropout': 0.27531666245262887, 'batch_norm': False, 'lr': 0.00032393778075602147, 'weight_decay': 1.1714031539166647e-07, 'epochs': 44, 'loss': 'mse', 'optimizer': 'adam', 'graph_mode': 'off', 'use_snp_selection': False}. Best is trial 9 with value: 0.12005949336951839.
[I 2025-12-05 14:22:12,115] Trial 11 finished with value: 0.11668840222074008 and parameters: {'model_type': 'mlp', 'hidden_dims': '[512, 256]', 'dropout': 0.10095648685224448, 'batch_norm': True, 'lr': 1.6474108386126448e-05, 'weight_decay': 6.203180869264506e-07, 'epochs': 67, 'loss': 'mse', 'optimizer': 'adam', 'graph_mode': 'off', 'use_snp_selection': False}. Best is trial 9 with value: 0.12005949336951839.
[I 2025-12-05 14:22:13,221] Trial 12 finished with value: 0.10235841223960894 and parameters: {'model_type': 'mlp', 'hidden_dims': '[512, 256]', 'dropout': 0.1977119287227368, 'batch_norm': True, 'lr': 0.000121041789182661, 'weight_decay': 1.2192432071058163e-06, 'epochs': 106, 'loss': 'mse', 'optimizer': 'adam', 'graph_mode': 'off', 'use_snp_selection': False}. Best is trial 9 with value: 0.12005949336951839.
[I 2025-12-05 14:22:14,539] Trial 13 finished with value: 0.049149429824201965 and parameters: {'model_type': 'mlp', 'hidden_dims': '[512, 256]', 'dropout': 0.17892004217860003, 'batch_norm': True, 'lr': 1.9472380101128875e-05, 'weight_decay': 1.1026057540153843e-07, 'epochs': 181, 'loss': 'mse', 'optimizer': 'adam', 'graph_mode': 'off', 'use_snp_selection': False}. Best is trial 9 with value: 0.12005949336951839.
[I 2025-12-05 14:22:15,273] Trial 14 finished with value: 0.09719404675129589 and parameters: {'model_type': 'mlp', 'hidden_dims': '[128, 64]', 'dropout': 0.3012984444538551, 'batch_norm': True, 'lr': 0.0006681578335050954, 'weight_decay': 4.814764599662762e-07, 'epochs': 105, 'loss': 'mse', 'optimizer': 'adam', 'graph_mode': 'off', 'use_snp_selection': False}. Best is trial 9 with value: 0.12005949336951839.
[I 2025-12-05 14:22:16,305] Trial 15 finished with value: 0.04993313457277995 and parameters: {'model_type': 'mlp', 'hidden_dims': '[256, 128, 64]', 'dropout': 0.49061215024256943, 'batch_norm': True, 'lr': 2.200457974768058e-05, 'weight_decay': 3.0158133721245484e-06, 'epochs': 219, 'loss': 'mse', 'optimizer': 'adam', 'graph_mode': 'off', 'use_snp_selection': False}. Best is trial 9 with value: 0.12005949336951839.
[I 2025-12-05 14:22:17,379] Trial 16 finished with value: 0.11640774033623301 and parameters: {'model_type': 'mlp', 'hidden_dims': '[512, 64]', 'dropout': 0.16016829601914256, 'batch_norm': True, 'lr': 0.0001154043714215127, 'weight_decay': 4.411191520975561e-06, 'epochs': 104, 'loss': 'mse', 'optimizer': 'adam', 'graph_mode': 'off', 'use_snp_selection': False}. Best is trial 9 with value: 0.12005949336951839.
[I 2025-12-05 14:22:18,653] Trial 17 finished with value: 0.0565258245587101 and parameters: {'model_type': 'mlp', 'hidden_dims': '[512, 256]', 'dropout': 0.31793710483525317, 'batch_norm': True, 'lr': 9.746523544442226e-06, 'weight_decay': 3.539465486244914e-07, 'epochs': 166, 'loss': 'mse', 'optimizer': 'adam', 'graph_mode': 'off', 'use_snp_selection': False}. Best is trial 9 with value: 0.12005949336951839.
[I 2025-12-05 14:22:21,331] Trial 18 finished with value: 0.10252487174566283 and parameters: {'model_type': 'mlp', 'hidden_dims': '[512, 256]', 'dropout': 0.23917094658642962, 'batch_norm': False, 'lr': 4.286919484755962e-05, 'weight_decay': 2.457070557037528e-07, 'epochs': 123, 'loss': 'mse', 'optimizer': 'adam', 'graph_mode': 'off', 'use_snp_selection': True, 'num_snps': 58241}. Best is trial 9 with value: 0.12005949336951839.
[I 2025-12-05 14:22:22,330] Trial 19 finished with value: 0.11715657726909218 and parameters: {'model_type': 'mlp', 'hidden_dims': '[512, 64]', 'dropout': 0.14397347595664306, 'batch_norm': True, 'lr': 0.00014334793979738487, 'weight_decay': 5.616604511856029e-06, 'epochs': 69, 'loss': 'mse', 'optimizer': 'adam', 'graph_mode': 'off', 'use_snp_selection': False}. Best is trial 9 with value: 0.12005949336951839.
[I 2025-12-05 14:22:23,864] Trial 20 finished with value: 0.10915379506546469 and parameters: {'model_type': 'mlp', 'hidden_dims': '[512, 64]', 'dropout': 0.22713525795094816, 'batch_norm': True, 'lr': 0.0002995209451731648, 'weight_decay': 5.749400013478273e-06, 'epochs': 243, 'loss': 'mse', 'optimizer': 'adam', 'graph_mode': 'off', 'use_snp_selection': False}. Best is trial 9 with value: 0.12005949336951839.
[I 2025-12-05 14:22:24,831] Trial 21 finished with value: 0.09826278066926097 and parameters: {'model_type': 'mlp', 'hidden_dims': '[512, 64]', 'dropout': 0.152725720410351, 'batch_norm': True, 'lr': 0.00011467620668229786, 'weight_decay': 1.27259278429389e-06, 'epochs': 66, 'loss': 'mse', 'optimizer': 'adam', 'graph_mode': 'off', 'use_snp_selection': False}. Best is trial 9 with value: 0.12005949336951839.
[I 2025-12-05 14:22:25,818] Trial 22 finished with value: 0.1224820314504053 and parameters: {'model_type': 'mlp', 'hidden_dims': '[512, 64]', 'dropout': 0.13096596943730135, 'batch_norm': True, 'lr': 0.0006767672126108538, 'weight_decay': 4.638381661303438e-05, 'epochs': 73, 'loss': 'mse', 'optimizer': 'adam', 'graph_mode': 'off', 'use_snp_selection': False}. Best is trial 22 with value: 0.1224820314504053.
[I 2025-12-05 14:22:26,691] Trial 23 finished with value: 0.12150481328709832 and parameters: {'model_type': 'mlp', 'hidden_dims': '[512, 64]', 'dropout': 0.12530647633340045, 'batch_norm': True, 'lr': 0.0009421174375343029, 'weight_decay': 5.349496429750466e-05, 'epochs': 40, 'loss': 'mse', 'optimizer': 'adam', 'graph_mode': 'off', 'use_snp_selection': False}. Best is trial 22 with value: 0.1224820314504053.
[I 2025-12-05 14:22:27,576] Trial 24 finished with value: 0.12114134775796472 and parameters: {'model_type': 'mlp', 'hidden_dims': '[512, 64]', 'dropout': 0.10746826515900122, 'batch_norm': True, 'lr': 0.0009028759239782406, 'weight_decay': 6.0180132116681076e-05, 'epochs': 41, 'loss': 'mse', 'optimizer': 'adam', 'graph_mode': 'off', 'use_snp_selection': False}. Best is trial 22 with value: 0.1224820314504053.
[I 2025-12-05 14:22:28,473] Trial 25 finished with value: 0.11310765741717003 and parameters: {'model_type': 'mlp', 'hidden_dims': '[512, 64]', 'dropout': 0.11009138244764777, 'batch_norm': True, 'lr': 0.0009908942583774373, 'weight_decay': 7.125301700730608e-05, 'epochs': 47, 'loss': 'mse', 'optimizer': 'adam', 'graph_mode': 'off', 'use_snp_selection': False}. Best is trial 22 with value: 0.1224820314504053.
[I 2025-12-05 14:22:29,097] Trial 26 finished with value: 0.062301684876684554 and parameters: {'model_type': 'mlp', 'hidden_dims': '[512, 64]', 'dropout': 0.2172403692811655, 'batch_norm': True, 'lr': 0.0006024587053361898, 'weight_decay': 6.052257330217201e-05, 'epochs': 40, 'loss': 'mse', 'optimizer': 'adam', 'graph_mode': 'off', 'use_snp_selection': True, 'num_snps': 3842}. Best is trial 22 with value: 0.1224820314504053.
[I 2025-12-05 14:22:30,098] Trial 27 finished with value: 0.0019919953027215404 and parameters: {'model_type': 'mlp', 'hidden_dims': '[512, 64]', 'dropout': 0.3313606710423199, 'batch_norm': False, 'lr': 0.0005009572817396128, 'weight_decay': 0.00012632372277862608, 'epochs': 76, 'loss': 'mae', 'optimizer': 'adam', 'graph_mode': 'off', 'use_snp_selection': False}. Best is trial 22 with value: 0.1224820314504053.
[I 2025-12-05 14:22:30,803] Trial 28 finished with value: 0.11716903020371897 and parameters: {'model_type': 'mlp', 'hidden_dims': '[128, 64]', 'dropout': 0.12347874145735656, 'batch_norm': True, 'lr': 0.0009936882405471475, 'weight_decay': 3.0146128911843334e-05, 'epochs': 78, 'loss': 'mse', 'optimizer': 'adam', 'graph_mode': 'off', 'use_snp_selection': False}. Best is trial 22 with value: 0.1224820314504053.
[I 2025-12-05 14:22:32,015] Trial 29 finished with value: 0.10371174061546222 and parameters: {'model_type': 'mlp', 'hidden_dims': '[256, 128]', 'dropout': 0.1934894258285787, 'batch_norm': True, 'lr': 0.00047432127057608865, 'weight_decay': 0.00012363202694194868, 'epochs': 130, 'loss': 'mae', 'optimizer': 'adam', 'graph_mode': 'off', 'use_snp_selection': True, 'num_snps': 19468}. Best is trial 22 with value: 0.1224820314504053.
[I 2025-12-05 14:22:33,049] Trial 30 finished with value: 0.11495476264496868 and parameters: {'model_type': 'mlp', 'hidden_dims': '[512, 128]', 'dropout': 0.2824458475484643, 'batch_norm': True, 'lr': 0.00023360739081706988, 'weight_decay': 4.64080195030235e-05, 'epochs': 86, 'loss': 'mse', 'optimizer': 'adam', 'graph_mode': 'off', 'use_snp_selection': False}. Best is trial 22 with value: 0.1224820314504053.
[I 2025-12-05 14:22:33,988] Trial 31 finished with value: 0.10968825706294963 and parameters: {'model_type': 'mlp', 'hidden_dims': '[512, 64]', 'dropout': 0.17804262563905504, 'batch_norm': True, 'lr': 0.0008018309198273649, 'weight_decay': 1.1741211090141565e-05, 'epochs': 55, 'loss': 'mse', 'optimizer': 'adam', 'graph_mode': 'off', 'use_snp_selection': False}. Best is trial 22 with value: 0.1224820314504053.
[I 2025-12-05 14:22:34,874] Trial 32 finished with value: 0.1152721181797504 and parameters: {'model_type': 'mlp', 'hidden_dims': '[512, 64]', 'dropout': 0.1354817858955793, 'batch_norm': True, 'lr': 0.00038354817666717096, 'weight_decay': 0.00012814720310863387, 'epochs': 42, 'loss': 'mse', 'optimizer': 'adam', 'graph_mode': 'off', 'use_snp_selection': False}. Best is trial 22 with value: 0.1224820314504053.
[I 2025-12-05 14:22:36,046] Trial 33 finished with value: 0.10904324604313204 and parameters: {'model_type': 'mlp', 'hidden_dims': '[256, 128, 64]', 'dropout': 0.138225815067275, 'batch_norm': True, 'lr': 0.00016933367574538375, 'weight_decay': 0.0002903127811679105, 'epochs': 277, 'loss': 'mse', 'optimizer': 'adam', 'graph_mode': 'off', 'use_snp_selection': False}. Best is trial 22 with value: 0.1224820314504053.
[I 2025-12-05 14:22:37,221] Trial 34 finished with value: 0.03449314243676179 and parameters: {'model_type': 'mlp', 'hidden_dims': '[512, 64]', 'dropout': 0.4776495763450488, 'batch_norm': True, 'lr': 3.8190281669228594e-06, 'weight_decay': 3.08224596803375e-05, 'epochs': 133, 'loss': 'mae', 'optimizer': 'adam', 'graph_mode': 'off', 'use_snp_selection': False}. Best is trial 22 with value: 0.1224820314504053.
[I 2025-12-05 14:22:38,552] Trial 35 finished with value: -0.020606290962212722 and parameters: {'model_type': 'mlp', 'hidden_dims': '[512, 64]', 'dropout': 0.2127065693647457, 'batch_norm': False, 'lr': 0.0006289154617160051, 'weight_decay': 1.7479081285587815e-05, 'epochs': 173, 'loss': 'mse', 'optimizer': 'adam', 'graph_mode': 'off', 'use_snp_selection': False}. Best is trial 22 with value: 0.1224820314504053.
[I 2025-12-05 14:22:41,016] Trial 36 finished with value: 0.10214554359728918 and parameters: {'model_type': 'mlp', 'hidden_dims': '[128, 64]', 'dropout': 0.17448295005900571, 'batch_norm': True, 'lr': 8.185115576456684e-05, 'weight_decay': 0.0005684977343047862, 'epochs': 153, 'loss': 'mse', 'optimizer': 'adam', 'graph_mode': 'off', 'use_snp_selection': True, 'num_snps': 58661}. Best is trial 22 with value: 0.1224820314504053.
[I 2025-12-05 14:22:41,886] Trial 37 finished with value: 0.10988960302588119 and parameters: {'model_type': 'mlp', 'hidden_dims': '[256, 128]', 'dropout': 0.2446458335588721, 'batch_norm': True, 'lr': 0.0004137005062276543, 'weight_decay': 9.096918760018813e-05, 'epochs': 91, 'loss': 'mae', 'optimizer': 'adam', 'graph_mode': 'off', 'use_snp_selection': False}. Best is trial 22 with value: 0.1224820314504053.
[I 2025-12-05 14:22:43,228] Trial 38 finished with value: 0.045874847003301154 and parameters: {'model_type': 'mlp', 'hidden_dims': '[512, 64]', 'dropout': 0.5749822693823109, 'batch_norm': False, 'lr': 0.0002132963501226098, 'weight_decay': 0.00017957523895029845, 'epochs': 210, 'loss': 'mse', 'optimizer': 'adam', 'graph_mode': 'off', 'use_snp_selection': True, 'num_snps': 19911}. Best is trial 22 with value: 0.1224820314504053.
[I 2025-12-05 14:22:43,995] Trial 39 finished with value: 0.11591982790250693 and parameters: {'model_type': 'mlp', 'hidden_dims': '[256, 128, 64]', 'dropout': 0.10092919390807824, 'batch_norm': True, 'lr': 0.0007580641053803074, 'weight_decay': 3.8455018339969256e-05, 'epochs': 58, 'loss': 'mse', 'optimizer': 'adam', 'graph_mode': 'off', 'use_snp_selection': False}. Best is trial 22 with value: 0.1224820314504053.
[I 2025-12-05 14:22:45,860] Trial 40 finished with value: 0.038157439981870496 and parameters: {'model_type': 'mlp', 'hidden_dims': '[512, 128]', 'dropout': 0.357870498838371, 'batch_norm': True, 'lr': 4.767147905519569e-06, 'weight_decay': 2.0037269597481084e-05, 'epochs': 347, 'loss': 'mae', 'optimizer': 'adam', 'graph_mode': 'off', 'use_snp_selection': False}. Best is trial 22 with value: 0.1224820314504053.
[I 2025-12-05 14:22:46,566] Trial 41 finished with value: 0.10964493032646275 and parameters: {'model_type': 'mlp', 'hidden_dims': '[128, 64]', 'dropout': 0.12697420873982737, 'batch_norm': True, 'lr': 0.0009249910509775914, 'weight_decay': 1.1092937818150672e-05, 'epochs': 75, 'loss': 'mse', 'optimizer': 'adam', 'graph_mode': 'off', 'use_snp_selection': False}. Best is trial 22 with value: 0.1224820314504053.
[I 2025-12-05 14:22:47,332] Trial 42 finished with value: 0.10919203701070622 and parameters: {'model_type': 'mlp', 'hidden_dims': '[128, 64]', 'dropout': 0.1211755705816548, 'batch_norm': True, 'lr': 0.000955824404360909, 'weight_decay': 3.6513734580503285e-05, 'epochs': 113, 'loss': 'mse', 'optimizer': 'adam', 'graph_mode': 'off', 'use_snp_selection': False}. Best is trial 22 with value: 0.1224820314504053.
[I 2025-12-05 14:22:48,103] Trial 43 finished with value: 0.004818301535118684 and parameters: {'model_type': 'mlp', 'hidden_dims': '[128, 64]', 'dropout': 0.16721649992558799, 'batch_norm': True, 'lr': 2.1409924724993155e-06, 'weight_decay': 2.4951817445755212e-05, 'epochs': 91, 'loss': 'mse', 'optimizer': 'adam', 'graph_mode': 'off', 'use_snp_selection': False}. Best is trial 22 with value: 0.1224820314504053.
[I 2025-12-05 14:22:49,127] Trial 44 finished with value: 0.11458826082544903 and parameters: {'model_type': 'mlp', 'hidden_dims': '[512, 64]', 'dropout': 0.1294310799067917, 'batch_norm': True, 'lr': 0.0002944825084356873, 'weight_decay': 6.779219092858744e-05, 'epochs': 80, 'loss': 'mse', 'optimizer': 'adam', 'graph_mode': 'off', 'use_snp_selection': False}. Best is trial 22 with value: 0.1224820314504053.
[I 2025-12-05 14:22:49,822] Trial 45 finished with value: 0.10979474168271512 and parameters: {'model_type': 'mlp', 'hidden_dims': '[128, 64]', 'dropout': 0.19405363181784926, 'batch_norm': True, 'lr': 0.0005968118773374596, 'weight_decay': 0.0002287325988719863, 'epochs': 58, 'loss': 'mse', 'optimizer': 'adam', 'graph_mode': 'off', 'use_snp_selection': False}. Best is trial 22 with value: 0.1224820314504053.
[I 2025-12-05 14:22:51,441] Trial 46 finished with value: 0.08650825729283992 and parameters: {'model_type': 'mlp', 'hidden_dims': '[512, 64]', 'dropout': 0.15631397564464306, 'batch_norm': False, 'lr': 9.350741792069603e-06, 'weight_decay': 8.752506360670128e-06, 'epochs': 262, 'loss': 'mse', 'optimizer': 'adam', 'graph_mode': 'off', 'use_snp_selection': False}. Best is trial 22 with value: 0.1224820314504053.
[I 2025-12-05 14:22:52,582] Trial 47 finished with value: 0.12124869588084393 and parameters: {'model_type': 'mlp', 'hidden_dims': '[512, 64]', 'dropout': 0.10051693971559178, 'batch_norm': True, 'lr': 0.00046590506355073875, 'weight_decay': 0.0005290117395919608, 'epochs': 118, 'loss': 'mse', 'optimizer': 'adam', 'graph_mode': 'off', 'use_snp_selection': False}. Best is trial 22 with value: 0.1224820314504053.
[I 2025-12-05 14:22:53,985] Trial 48 finished with value: 0.11860072841915333 and parameters: {'model_type': 'mlp', 'hidden_dims': '[512, 64]', 'dropout': 0.10373903849504845, 'batch_norm': True, 'lr': 0.000358282172492404, 'weight_decay': 0.0005055034126800592, 'epochs': 190, 'loss': 'mse', 'optimizer': 'adam', 'graph_mode': 'off', 'use_snp_selection': False}. Best is trial 22 with value: 0.1224820314504053.
[I 2025-12-05 14:22:56,335] Trial 49 finished with value: 0.09939873769562917 and parameters: {'model_type': 'mlp', 'hidden_dims': '[512, 64]', 'dropout': 0.1506307510898956, 'batch_norm': True, 'lr': 8.587088860510313e-05, 'weight_decay': 0.0005066159281116349, 'epochs': 151, 'loss': 'mse', 'optimizer': 'adam', 'graph_mode': 'off', 'use_snp_selection': True, 'num_snps': 46888}. Best is trial 22 with value: 0.1224820314504053.
[I 2025-12-05 14:22:57,559] Trial 50 finished with value: 0.0837184097090326 and parameters: {'model_type': 'mlp', 'hidden_dims': '[512, 64]', 'dropout': 0.1800531100321091, 'batch_norm': True, 'lr': 2.9080389679666406e-05, 'weight_decay': 0.0007612041588438145, 'epochs': 116, 'loss': 'mse', 'optimizer': 'adam', 'graph_mode': 'off', 'use_snp_selection': False}. Best is trial 22 with value: 0.1224820314504053.
[I 2025-12-05 14:22:58,978] Trial 51 finished with value: 0.11547648596225242 and parameters: {'model_type': 'mlp', 'hidden_dims': '[512, 64]', 'dropout': 0.11702359982895354, 'batch_norm': True, 'lr': 0.00042929365192080453, 'weight_decay': 0.0004359283256572386, 'epochs': 199, 'loss': 'mse', 'optimizer': 'adam', 'graph_mode': 'off', 'use_snp_selection': False}. Best is trial 22 with value: 0.1224820314504053.
