[I 2025-12-05 15:51:29,570] Trial 98 finished with value: 0.033457516165140054 and parameters: {'model_type': 'mlp', 'hidden_dims': '[512, 256]', 'dropout': 0.24113377504067918, 'batch_norm': True, 'lr': 0.0007330952698927337, 'weight_decay': 8.305317735532129e-06, 'epochs': 315, 'loss': 'mse', 'optimizer': 'adam', 'graph_mode': 'off', 'use_snp_selection': True, 'num_snps': 5469}. Best is trial 16 with value: 0.08817918641086803.
[I 2025-12-05 15:51:31,294] Trial 99 finished with value: 0.03413475436460908 and parameters: {'model_type': 'mlp', 'hidden_dims': '[512, 64]', 'dropout': 0.22832762501819123, 'batch_norm': True, 'lr': 0.00045621987206325793, 'weight_decay': 2.2021693666225398e-07, 'epochs': 303, 'loss': 'mse', 'optimizer': 'adam', 'graph_mode': 'off', 'use_snp_selection': False}. Best is trial 16 with value: 0.08817918641086803.
[I 2025-12-05 15:51:32,874] Trial 100 finished with value: 0.08059468405120741 and parameters: {'model_type': 'mlp', 'hidden_dims': '[512, 64]', 'dropout': 0.2590602687245278, 'batch_norm': True, 'lr': 0.0005940073802525985, 'weight_decay': 6.429368218246975e-05, 'epochs': 258, 'loss': 'mae', 'optimizer': 'adam', 'graph_mode': 'off', 'use_snp_selection': False}. Best is trial 16 with value: 0.08817918641086803.
[I 2025-12-05 15:51:34,365] Trial 101 finished with value: 0.056589571505601094 and parameters: {'model_type': 'mlp', 'hidden_dims': '[512, 64]', 'dropout': 0.2610849860481223, 'batch_norm': True, 'lr': 0.0005907433155787428, 'weight_decay': 6.316152353790786e-05, 'epochs': 239, 'loss': 'mae', 'optimizer': 'adam', 'graph_mode': 'off', 'use_snp_selection': False}. Best is trial 16 with value: 0.08817918641086803.
[I 2025-12-05 15:51:35,910] Trial 102 finished with value: 0.07956105794532023 and parameters: {'model_type': 'mlp', 'hidden_dims': '[512, 64]', 'dropout': 0.2776568049324762, 'batch_norm': True, 'lr': 0.0009777262014957747, 'weight_decay': 0.00012901452527647655, 'epochs': 255, 'loss': 'mae', 'optimizer': 'adam', 'graph_mode': 'off', 'use_snp_selection': False}. Best is trial 16 with value: 0.08817918641086803.
[I 2025-12-05 15:51:37,450] Trial 103 finished with value: 0.061483802579858096 and parameters: {'model_type': 'mlp', 'hidden_dims': '[512, 64]', 'dropout': 0.27828398579604474, 'batch_norm': True, 'lr': 0.0006767555839150703, 'weight_decay': 0.0001451548937719379, 'epochs': 257, 'loss': 'mae', 'optimizer': 'adam', 'graph_mode': 'off', 'use_snp_selection': False}. Best is trial 16 with value: 0.08817918641086803.
[I 2025-12-05 15:51:39,035] Trial 104 finished with value: 0.05238495144840336 and parameters: {'model_type': 'mlp', 'hidden_dims': '[512, 64]', 'dropout': 0.311789659432287, 'batch_norm': True, 'lr': 0.0008476623083144701, 'weight_decay': 0.000266657872284764, 'epochs': 271, 'loss': 'mae', 'optimizer': 'adam', 'graph_mode': 'off', 'use_snp_selection': False}. Best is trial 16 with value: 0.08817918641086803.
[I 2025-12-05 15:51:40,437] Trial 105 finished with value: 0.04736447685431436 and parameters: {'model_type': 'mlp', 'hidden_dims': '[512, 64]', 'dropout': 0.2529400932244657, 'batch_norm': True, 'lr': 0.0005138571252666153, 'weight_decay': 9.057460572992026e-05, 'epochs': 213, 'loss': 'mae', 'optimizer': 'adam', 'graph_mode': 'off', 'use_snp_selection': False}. Best is trial 16 with value: 0.08817918641086803.
[I 2025-12-05 15:51:41,573] Trial 106 finished with value: 0.02976711075897651 and parameters: {'model_type': 'mlp', 'hidden_dims': '[512, 64]', 'dropout': 0.32237417714838795, 'batch_norm': True, 'lr': 0.000911701848953032, 'weight_decay': 0.0002567618209302655, 'epochs': 118, 'loss': 'mse', 'optimizer': 'adam', 'graph_mode': 'off', 'use_snp_selection': False}. Best is trial 16 with value: 0.08817918641086803.
[I 2025-12-05 15:51:43,256] Trial 107 finished with value: 0.07730999595786756 and parameters: {'model_type': 'mlp', 'hidden_dims': '[512, 64]', 'dropout': 0.3014778112088093, 'batch_norm': True, 'lr': 0.0009970224058412217, 'weight_decay': 0.0005207708617226349, 'epochs': 286, 'loss': 'mae', 'optimizer': 'adam', 'graph_mode': 'off', 'use_snp_selection': False}. Best is trial 16 with value: 0.08817918641086803.
[I 2025-12-05 15:51:44,908] Trial 108 finished with value: 0.06572166530709232 and parameters: {'model_type': 'mlp', 'hidden_dims': '[512, 64]', 'dropout': 0.30515201440764433, 'batch_norm': True, 'lr': 0.000994659241390621, 'weight_decay': 0.0006328179654266914, 'epochs': 277, 'loss': 'mae', 'optimizer': 'adam', 'graph_mode': 'off', 'use_snp_selection': False}. Best is trial 16 with value: 0.08817918641086803.
[I 2025-12-05 15:51:46,566] Trial 109 finished with value: 0.02478893730040538 and parameters: {'model_type': 'mlp', 'hidden_dims': '[512, 64]', 'dropout': 0.28506116344409027, 'batch_norm': False, 'lr': 0.0006044967073347613, 'weight_decay': 5.386178894290668e-05, 'epochs': 288, 'loss': 'mae', 'optimizer': 'adam', 'graph_mode': 'off', 'use_snp_selection': False}. Best is trial 16 with value: 0.08817918641086803.
[I 2025-12-05 15:51:48,121] Trial 110 finished with value: 0.055663454123103556 and parameters: {'model_type': 'mlp', 'hidden_dims': '[512, 64]', 'dropout': 0.29220528455984124, 'batch_norm': True, 'lr': 0.00085548317532248, 'weight_decay': 0.0004348859844250648, 'epochs': 245, 'loss': 'mae', 'optimizer': 'adam', 'graph_mode': 'off', 'use_snp_selection': False}. Best is trial 16 with value: 0.08817918641086803.
[I 2025-12-05 15:51:49,797] Trial 111 finished with value: 0.06485086535193972 and parameters: {'model_type': 'mlp', 'hidden_dims': '[512, 64]', 'dropout': 0.27169053987509256, 'batch_norm': True, 'lr': 0.0007672391930007608, 'weight_decay': 1.0565711608018367e-05, 'epochs': 298, 'loss': 'mae', 'optimizer': 'adam', 'graph_mode': 'off', 'use_snp_selection': False}. Best is trial 16 with value: 0.08817918641086803.
[I 2025-12-05 15:51:51,341] Trial 112 finished with value: 0.0371941058474293 and parameters: {'model_type': 'mlp', 'hidden_dims': '[512, 64]', 'dropout': 0.3645066878780468, 'batch_norm': True, 'lr': 0.0003689444309830816, 'weight_decay': 0.00012818558354509287, 'epochs': 258, 'loss': 'mae', 'optimizer': 'adam', 'graph_mode': 'off', 'use_snp_selection': False}. Best is trial 16 with value: 0.08817918641086803.
[I 2025-12-05 15:51:52,999] Trial 113 finished with value: 0.056269543770822 and parameters: {'model_type': 'mlp', 'hidden_dims': '[512, 64]', 'dropout': 0.24959663528441428, 'batch_norm': True, 'lr': 0.0006760124424098569, 'weight_decay': 0.00018290610675482534, 'epochs': 294, 'loss': 'mse', 'optimizer': 'adam', 'graph_mode': 'off', 'use_snp_selection': False}. Best is trial 16 with value: 0.08817918641086803.
[I 2025-12-05 15:51:54,108] Trial 114 finished with value: 0.0765767365615429 and parameters: {'model_type': 'mlp', 'hidden_dims': '[256, 128, 64]', 'dropout': 0.30107395693872185, 'batch_norm': True, 'lr': 0.0005370475432990635, 'weight_decay': 5.476566108283269e-06, 'epochs': 281, 'loss': 'mae', 'optimizer': 'adam', 'graph_mode': 'off', 'use_snp_selection': False}. Best is trial 16 with value: 0.08817918641086803.
[I 2025-12-05 15:51:55,242] Trial 115 finished with value: 0.07190993966390093 and parameters: {'model_type': 'mlp', 'hidden_dims': '[256, 128, 64]', 'dropout': 0.2601041998360082, 'batch_norm': True, 'lr': 0.0005516385525900444, 'weight_decay': 5.602115224762638e-06, 'epochs': 281, 'loss': 'mae', 'optimizer': 'adam', 'graph_mode': 'off', 'use_snp_selection': False}. Best is trial 16 with value: 0.08817918641086803.
[I 2025-12-05 15:51:56,342] Trial 116 finished with value: 0.06932497303064385 and parameters: {'model_type': 'mlp', 'hidden_dims': '[256, 128, 64]', 'dropout': 0.30302718610538804, 'batch_norm': True, 'lr': 0.0008435040664967329, 'weight_decay': 8.052573537827999e-06, 'epochs': 275, 'loss': 'mae', 'optimizer': 'adam', 'graph_mode': 'off', 'use_snp_selection': False}. Best is trial 16 with value: 0.08817918641086803.
[I 2025-12-05 15:51:57,764] Trial 117 finished with value: 0.0493882938445835 and parameters: {'model_type': 'mlp', 'hidden_dims': '[256, 128, 64]', 'dropout': 0.3529677551035185, 'batch_norm': True, 'lr': 0.0004289974579887537, 'weight_decay': 0.00021232613034329167, 'epochs': 267, 'loss': 'mae', 'optimizer': 'adam', 'graph_mode': 'off', 'use_snp_selection': True, 'num_snps': 15949}. Best is trial 16 with value: 0.08817918641086803.
[I 2025-12-05 15:51:58,939] Trial 118 finished with value: 0.0652398872090869 and parameters: {'model_type': 'mlp', 'hidden_dims': '[256, 128, 64]', 'dropout': 0.29623226398678515, 'batch_norm': True, 'lr': 0.0005052417155284794, 'weight_decay': 0.0007096038648641654, 'epochs': 287, 'loss': 'mae', 'optimizer': 'adam', 'graph_mode': 'off', 'use_snp_selection': False}. Best is trial 16 with value: 0.08817918641086803.
[I 2025-12-05 15:52:00,675] Trial 119 finished with value: 0.07943384876562865 and parameters: {'model_type': 'mlp', 'hidden_dims': '[512, 128]', 'dropout': 0.2778328130689831, 'batch_norm': True, 'lr': 0.0009821129641994016, 'weight_decay': 3.1003527613573154e-06, 'epochs': 301, 'loss': 'mae', 'optimizer': 'adam', 'graph_mode': 'off', 'use_snp_selection': False}. Best is trial 16 with value: 0.08817918641086803.
[I 2025-12-05 15:52:02,405] Trial 120 finished with value: 0.060187247967538826 and parameters: {'model_type': 'mlp', 'hidden_dims': '[512, 128]', 'dropout': 0.28294014406985574, 'batch_norm': True, 'lr': 0.0009754514024180471, 'weight_decay': 3.1044763670847325e-06, 'epochs': 305, 'loss': 'mae', 'optimizer': 'adam', 'graph_mode': 'off', 'use_snp_selection': False}. Best is trial 16 with value: 0.08817918641086803.
[I 2025-12-05 15:52:04,080] Trial 121 finished with value: 0.05486983070558259 and parameters: {'model_type': 'mlp', 'hidden_dims': '[512, 128]', 'dropout': 0.2690439001423194, 'batch_norm': True, 'lr': 0.0007013400017167223, 'weight_decay': 4.070143128702117e-06, 'epochs': 298, 'loss': 'mae', 'optimizer': 'adam', 'graph_mode': 'off', 'use_snp_selection': False}. Best is trial 16 with value: 0.08817918641086803.
[I 2025-12-05 15:52:05,787] Trial 122 finished with value: 0.0643017859345161 and parameters: {'model_type': 'mlp', 'hidden_dims': '[512, 128]', 'dropout': 0.2756976733389598, 'batch_norm': True, 'lr': 0.0008126167505344576, 'weight_decay': 1.2464302397264404e-05, 'epochs': 309, 'loss': 'mae', 'optimizer': 'adam', 'graph_mode': 'off', 'use_snp_selection': False}. Best is trial 16 with value: 0.08817918641086803.
[I 2025-12-05 15:52:07,428] Trial 123 finished with value: 0.0713076502888979 and parameters: {'model_type': 'mlp', 'hidden_dims': '[512, 128]', 'dropout': 0.33083335531641095, 'batch_norm': True, 'lr': 0.0005917668066067447, 'weight_decay': 0.0004007830525537574, 'epochs': 284, 'loss': 'mae', 'optimizer': 'adam', 'graph_mode': 'off', 'use_snp_selection': False}. Best is trial 16 with value: 0.08817918641086803.
[I 2025-12-05 15:52:09,167] Trial 124 finished with value: 0.05982425003943305 and parameters: {'model_type': 'mlp', 'hidden_dims': '[512, 64]', 'dropout': 0.3197107723360195, 'batch_norm': True, 'lr': 0.0006512107221477624, 'weight_decay': 6.325601380103998e-06, 'epochs': 319, 'loss': 'mae', 'optimizer': 'adam', 'graph_mode': 'off', 'use_snp_selection': False}. Best is trial 16 with value: 0.08817918641086803.
[I 2025-12-05 15:52:10,687] Trial 125 finished with value: 0.05852896027002438 and parameters: {'model_type': 'mlp', 'hidden_dims': '[512, 128]', 'dropout': 0.30758063648442713, 'batch_norm': True, 'lr': 0.0009907380998318218, 'weight_decay': 2.5756075683353406e-06, 'epochs': 250, 'loss': 'mae', 'optimizer': 'adam', 'graph_mode': 'off', 'use_snp_selection': False}. Best is trial 16 with value: 0.08817918641086803.
[I 2025-12-05 15:52:12,381] Trial 126 finished with value: 0.057326744823617805 and parameters: {'model_type': 'mlp', 'hidden_dims': '[512, 64]', 'dropout': 0.3780668409292726, 'batch_norm': True, 'lr': 0.00046335126950885016, 'weight_decay': 4.665702291957334e-06, 'epochs': 291, 'loss': 'mae', 'optimizer': 'adam', 'graph_mode': 'off', 'use_snp_selection': False}. Best is trial 16 with value: 0.08817918641086803.
[I 2025-12-05 15:52:13,465] Trial 127 finished with value: 0.06385878646672977 and parameters: {'model_type': 'mlp', 'hidden_dims': '[256, 128, 64]', 'dropout': 0.261342543852476, 'batch_norm': True, 'lr': 0.0003400533943393321, 'weight_decay': 2.625408504989542e-05, 'epochs': 234, 'loss': 'mae', 'optimizer': 'adam', 'graph_mode': 'off', 'use_snp_selection': False}. Best is trial 16 with value: 0.08817918641086803.
[I 2025-12-05 15:52:15,100] Trial 128 finished with value: -0.021859217894973883 and parameters: {'model_type': 'mlp', 'hidden_dims': '[512, 128]', 'dropout': 0.28672046195216133, 'batch_norm': True, 'lr': 3.9588545961928384e-06, 'weight_decay': 2.044644253602346e-05, 'epochs': 272, 'loss': 'mae', 'optimizer': 'adam', 'graph_mode': 'off', 'use_snp_selection': False}. Best is trial 16 with value: 0.08817918641086803.
[I 2025-12-05 15:52:16,679] Trial 129 finished with value: 0.058428326352870014 and parameters: {'model_type': 'mlp', 'hidden_dims': '[512, 64]', 'dropout': 0.24021443796384906, 'batch_norm': True, 'lr': 0.0007804313227327592, 'weight_decay': 4.317138432046569e-05, 'epochs': 258, 'loss': 'mae', 'optimizer': 'adam', 'graph_mode': 'off', 'use_snp_selection': False}. Best is trial 16 with value: 0.08817918641086803.
[I 2025-12-05 15:52:17,808] Trial 130 finished with value: 0.027380159294864977 and parameters: {'model_type': 'mlp', 'hidden_dims': '[256, 128]', 'dropout': 0.22324068360916874, 'batch_norm': False, 'lr': 0.0003923016191223897, 'weight_decay': 7.708366022762925e-05, 'epochs': 299, 'loss': 'mse', 'optimizer': 'adam', 'graph_mode': 'off', 'use_snp_selection': False}. Best is trial 16 with value: 0.08817918641086803.
[I 2025-12-05 15:52:19,534] Trial 131 finished with value: 0.05478917761210292 and parameters: {'model_type': 'mlp', 'hidden_dims': '[512, 64]', 'dropout': 0.23792058404717975, 'batch_norm': True, 'lr': 0.00023787170924279192, 'weight_decay': 1.0595643851462617e-06, 'epochs': 313, 'loss': 'mse', 'optimizer': 'adam', 'graph_mode': 'off', 'use_snp_selection': False}. Best is trial 16 with value: 0.08817918641086803.
[I 2025-12-05 15:52:21,353] Trial 132 finished with value: 0.06108928156761199 and parameters: {'model_type': 'mlp', 'hidden_dims': '[512, 128]', 'dropout': 0.25299914306152316, 'batch_norm': True, 'lr': 0.0002011431225158248, 'weight_decay': 6.064467056249763e-07, 'epochs': 344, 'loss': 'mse', 'optimizer': 'adam', 'graph_mode': 'off', 'use_snp_selection': False}. Best is trial 16 with value: 0.08817918641086803.
[I 2025-12-05 15:52:22,434] Trial 133 finished with value: 0.057100898705995135 and parameters: {'model_type': 'mlp', 'hidden_dims': '[256, 128, 64]', 'dropout': 0.4967702687809522, 'batch_norm': True, 'lr': 0.0005570758128035103, 'weight_decay': 1.98295732352458e-06, 'epochs': 264, 'loss': 'mse', 'optimizer': 'adam', 'graph_mode': 'off', 'use_snp_selection': False}. Best is trial 16 with value: 0.08817918641086803.
[I 2025-12-05 15:52:24,203] Trial 134 finished with value: 0.051949551280679976 and parameters: {'model_type': 'mlp', 'hidden_dims': '[512, 64]', 'dropout': 0.20591743753743028, 'batch_norm': True, 'lr': 0.00029333021753466347, 'weight_decay': 8.754231708012991e-07, 'epochs': 326, 'loss': 'mse', 'optimizer': 'adam', 'graph_mode': 'off', 'use_snp_selection': False}. Best is trial 16 with value: 0.08817918641086803.
[I 2025-12-05 15:52:25,864] Trial 135 finished with value: 0.0600314176377695 and parameters: {'model_type': 'mlp', 'hidden_dims': '[512, 256]', 'dropout': 0.10016192932610343, 'batch_norm': True, 'lr': 0.000714143720300781, 'weight_decay': 3.343582866678111e-06, 'epochs': 277, 'loss': 'mse', 'optimizer': 'adam', 'graph_mode': 'off', 'use_snp_selection': False}. Best is trial 16 with value: 0.08817918641086803.
[I 2025-12-05 15:52:27,570] Trial 136 finished with value: 0.07702426080996905 and parameters: {'model_type': 'mlp', 'hidden_dims': '[512, 128]', 'dropout': 0.2749870635778259, 'batch_norm': True, 'lr': 0.0008537981579901713, 'weight_decay': 1.47526735014025e-06, 'epochs': 292, 'loss': 'mse', 'optimizer': 'adam', 'graph_mode': 'off', 'use_snp_selection': False}. Best is trial 16 with value: 0.08817918641086803.
[I 2025-12-05 15:52:29,263] Trial 137 finished with value: 0.056300433575745656 and parameters: {'model_type': 'mlp', 'hidden_dims': '[512, 128]', 'dropout': 0.29904530291521497, 'batch_norm': True, 'lr': 0.0008492834613437883, 'weight_decay': 1.7474959686504628e-06, 'epochs': 292, 'loss': 'mae', 'optimizer': 'adam', 'graph_mode': 'off', 'use_snp_selection': False}. Best is trial 16 with value: 0.08817918641086803.
[I 2025-12-05 15:52:31,131] Trial 138 finished with value: 0.051231313261834006 and parameters: {'model_type': 'mlp', 'hidden_dims': '[512, 128]', 'dropout': 0.2749266682316006, 'batch_norm': True, 'lr': 0.00048738347925738354, 'weight_decay': 5.4922317884140045e-06, 'epochs': 302, 'loss': 'mse', 'optimizer': 'adam', 'graph_mode': 'off', 'use_snp_selection': True, 'num_snps': 29475}. Best is trial 16 with value: 0.08817918641086803.
[I 2025-12-05 15:52:32,717] Trial 139 finished with value: 0.07162482711120069 and parameters: {'model_type': 'mlp', 'hidden_dims': '[512, 128]', 'dropout': 0.2647162847420707, 'batch_norm': True, 'lr': 0.0006104056019161684, 'weight_decay': 1.413676652524751e-06, 'epochs': 269, 'loss': 'mae', 'optimizer': 'adam', 'graph_mode': 'off', 'use_snp_selection': False}. Best is trial 16 with value: 0.08817918641086803.
[I 2025-12-05 15:52:34,345] Trial 140 finished with value: 0.052219933022278245 and parameters: {'model_type': 'mlp', 'hidden_dims': '[512, 128]', 'dropout': 0.28651871060279016, 'batch_norm': True, 'lr': 0.000729740425699318, 'weight_decay': 3.31469968394695e-05, 'epochs': 284, 'loss': 'mse', 'optimizer': 'adam', 'graph_mode': 'off', 'use_snp_selection': False}. Best is trial 16 with value: 0.08817918641086803.
[I 2025-12-05 15:52:36,055] Trial 141 finished with value: 0.06416251350311983 and parameters: {'model_type': 'mlp', 'hidden_dims': '[512, 64]', 'dropout': 0.27454136094792236, 'batch_norm': True, 'lr': 0.0008797851119008963, 'weight_decay': 1.2285429261035286e-06, 'epochs': 307, 'loss': 'mse', 'optimizer': 'adam', 'graph_mode': 'off', 'use_snp_selection': False}. Best is trial 16 with value: 0.08817918641086803.
[I 2025-12-05 15:52:37,394] Trial 142 finished with value: 0.053336852100597 and parameters: {'model_type': 'mlp', 'hidden_dims': '[512, 128]', 'dropout': 0.24830552088737579, 'batch_norm': True, 'lr': 0.00010008128586714039, 'weight_decay': 7.286669718853592e-06, 'epochs': 191, 'loss': 'mse', 'optimizer': 'adam', 'graph_mode': 'off', 'use_snp_selection': False}. Best is trial 16 with value: 0.08817918641086803.
[I 2025-12-05 15:52:39,222] Trial 143 finished with value: 0.055267131094091426 and parameters: {'model_type': 'mlp', 'hidden_dims': '[512, 64]', 'dropout': 0.25694418383159684, 'batch_norm': True, 'lr': 0.0006293275830063818, 'weight_decay': 9.477240483913024e-07, 'epochs': 335, 'loss': 'mse', 'optimizer': 'adam', 'graph_mode': 'off', 'use_snp_selection': False}. Best is trial 16 with value: 0.08817918641086803.
[I 2025-12-05 15:52:40,450] Trial 144 finished with value: 0.06567200146345964 and parameters: {'model_type': 'mlp', 'hidden_dims': '[256, 128, 64]', 'dropout': 0.24271666886504945, 'batch_norm': True, 'lr': 0.00042530180424416063, 'weight_decay': 3.810689042952431e-07, 'epochs': 319, 'loss': 'mse', 'optimizer': 'adam', 'graph_mode': 'off', 'use_snp_selection': False}. Best is trial 16 with value: 0.08817918641086803.
[I 2025-12-05 15:52:42,167] Trial 145 finished with value: 0.05587883539730216 and parameters: {'model_type': 'mlp', 'hidden_dims': '[512, 64]', 'dropout': 0.2998307300562875, 'batch_norm': True, 'lr': 0.0009550533396671766, 'weight_decay': 7.32949541600297e-07, 'epochs': 294, 'loss': 'mse', 'optimizer': 'adam', 'graph_mode': 'off', 'use_snp_selection': False}. Best is trial 16 with value: 0.08817918641086803.
[I 2025-12-05 15:52:43,826] Trial 146 finished with value: 0.06295176106200297 and parameters: {'model_type': 'mlp', 'hidden_dims': '[512, 128]', 'dropout': 0.23303259681994964, 'batch_norm': True, 'lr': 0.0005350157384207136, 'weight_decay': 0.00032109820280619124, 'epochs': 282, 'loss': 'mae', 'optimizer': 'adam', 'graph_mode': 'off', 'use_snp_selection': False}. Best is trial 16 with value: 0.08817918641086803.
[I 2025-12-05 15:52:45,495] Trial 147 finished with value: 0.05084126806184466 and parameters: {'model_type': 'mlp', 'hidden_dims': '[512, 64]', 'dropout': 0.26720172886116417, 'batch_norm': True, 'lr': 0.0007464599753738216, 'weight_decay': 5.040890861911582e-07, 'epochs': 288, 'loss': 'mse', 'optimizer': 'adam', 'graph_mode': 'off', 'use_snp_selection': False}. Best is trial 16 with value: 0.08817918641086803.
[I 2025-12-05 15:52:47,110] Trial 148 finished with value: 0.043046091238588505 and parameters: {'model_type': 'mlp', 'hidden_dims': '[512, 128]', 'dropout': 0.3103622161830002, 'batch_norm': True, 'lr': 0.00018115459872739776, 'weight_decay': 1.4274839687595272e-05, 'epochs': 279, 'loss': 'mae', 'optimizer': 'adam', 'graph_mode': 'off', 'use_snp_selection': False}. Best is trial 16 with value: 0.08817918641086803.
[I 2025-12-05 15:52:48,665] Trial 149 finished with value: 0.058973778298566204 and parameters: {'model_type': 'mlp', 'hidden_dims': '[512, 64]', 'dropout': 0.1146656793039092, 'batch_norm': True, 'lr': 0.00013195190082653386, 'weight_decay': 2.807762302121682e-06, 'epochs': 253, 'loss': 'mse', 'optimizer': 'adam', 'graph_mode': 'off', 'use_snp_selection': False}. Best is trial 16 with value: 0.08817918641086803.
