[I 2025-12-05 15:40:24,576] Trial 83 finished with value: 0.16629951198101153 and parameters: {'model_type': 'mlp', 'hidden_dims': '[512, 128]', 'dropout': 0.36624701711129853, 'batch_norm': True, 'lr': 0.000636886240047691, 'weight_decay': 2.4133927071158345e-07, 'epochs': 256, 'loss': 'mae', 'optimizer': 'adam', 'graph_mode': 'off', 'use_snp_selection': False}. Best is trial 32 with value: 0.18114673494920122.
[I 2025-12-05 15:40:26,312] Trial 84 finished with value: 0.1718727092010086 and parameters: {'model_type': 'mlp', 'hidden_dims': '[512, 128]', 'dropout': 0.3458496703942715, 'batch_norm': True, 'lr': 0.00042049557999017005, 'weight_decay': 1.0275658763180761e-07, 'epochs': 272, 'loss': 'mae', 'optimizer': 'adam', 'graph_mode': 'off', 'use_snp_selection': False}. Best is trial 32 with value: 0.18114673494920122.
[I 2025-12-05 15:40:28,391] Trial 85 finished with value: 0.16234775167792448 and parameters: {'model_type': 'mlp', 'hidden_dims': '[512, 128]', 'dropout': 0.3048039275254561, 'batch_norm': True, 'lr': 0.00021331791954281259, 'weight_decay': 1.288683213964168e-07, 'epochs': 154, 'loss': 'mae', 'optimizer': 'adam', 'graph_mode': 'off', 'use_snp_selection': True, 'num_snps': 37681}. Best is trial 32 with value: 0.18114673494920122.
[I 2025-12-05 15:40:29,578] Trial 86 finished with value: 0.15428562055177486 and parameters: {'model_type': 'mlp', 'hidden_dims': '[128, 64]', 'dropout': 0.2328405382651097, 'batch_norm': True, 'lr': 0.00029509113716568483, 'weight_decay': 5.061511730338902e-07, 'epochs': 143, 'loss': 'mae', 'optimizer': 'adam', 'graph_mode': 'off', 'use_snp_selection': True, 'num_snps': 15894}. Best is trial 32 with value: 0.18114673494920122.
[I 2025-12-05 15:40:30,575] Trial 87 finished with value: 0.11241457196790103 and parameters: {'model_type': 'mlp', 'hidden_dims': '[256, 128, 64]', 'dropout': 0.41788522093370845, 'batch_norm': False, 'lr': 0.0009917137051877036, 'weight_decay': 2.1393043608499886e-07, 'epochs': 190, 'loss': 'mae', 'optimizer': 'adam', 'graph_mode': 'off', 'use_snp_selection': False}. Best is trial 32 with value: 0.18114673494920122.
[I 2025-12-05 15:40:31,787] Trial 88 finished with value: 0.1813422032951818 and parameters: {'model_type': 'mlp', 'hidden_dims': '[512, 128]', 'dropout': 0.28016081419876526, 'batch_norm': True, 'lr': 0.0007214246326865324, 'weight_decay': 1.7265356412106508e-07, 'epochs': 238, 'loss': 'mae', 'optimizer': 'adam', 'graph_mode': 'off', 'use_snp_selection': True, 'num_snps': 12638}. Best is trial 88 with value: 0.1813422032951818.
[I 2025-12-05 15:40:33,363] Trial 89 finished with value: 0.1536732194194655 and parameters: {'model_type': 'mlp', 'hidden_dims': '[512, 64]', 'dropout': 0.2806921101615007, 'batch_norm': True, 'lr': 0.0004913169127196563, 'weight_decay': 3.433018651155375e-07, 'epochs': 238, 'loss': 'mae', 'optimizer': 'adam', 'graph_mode': 'off', 'use_snp_selection': False}. Best is trial 88 with value: 0.1813422032951818.
[I 2025-12-05 15:40:34,587] Trial 90 finished with value: 0.18341997937441007 and parameters: {'model_type': 'mlp', 'hidden_dims': '[512, 128]', 'dropout': 0.2658276333111472, 'batch_norm': True, 'lr': 0.0007290684241631265, 'weight_decay': 3.014557077745034e-07, 'epochs': 251, 'loss': 'mse', 'optimizer': 'adam', 'graph_mode': 'off', 'use_snp_selection': True, 'num_snps': 12995}. Best is trial 90 with value: 0.18341997937441007.
[I 2025-12-05 15:40:35,701] Trial 91 finished with value: 0.17463258747987137 and parameters: {'model_type': 'mlp', 'hidden_dims': '[512, 128]', 'dropout': 0.26481348443254515, 'batch_norm': True, 'lr': 0.0005581473386812105, 'weight_decay': 3.3829327788543305e-07, 'epochs': 247, 'loss': 'mse', 'optimizer': 'adam', 'graph_mode': 'off', 'use_snp_selection': True, 'num_snps': 8327}. Best is trial 90 with value: 0.18341997937441007.
[I 2025-12-05 15:40:37,049] Trial 92 finished with value: 0.1833492214629617 and parameters: {'model_type': 'mlp', 'hidden_dims': '[512, 128]', 'dropout': 0.32718745403610566, 'batch_norm': True, 'lr': 0.0007013601066575525, 'weight_decay': 1.3316555238404305e-07, 'epochs': 272, 'loss': 'mse', 'optimizer': 'adam', 'graph_mode': 'off', 'use_snp_selection': True, 'num_snps': 12270}. Best is trial 90 with value: 0.18341997937441007.
[I 2025-12-05 15:40:38,396] Trial 93 finished with value: 0.1816617663909083 and parameters: {'model_type': 'mlp', 'hidden_dims': '[512, 128]', 'dropout': 0.29558685494454484, 'batch_norm': True, 'lr': 0.0007141067024375016, 'weight_decay': 8.35156594537287e-07, 'epochs': 268, 'loss': 'mse', 'optimizer': 'adam', 'graph_mode': 'off', 'use_snp_selection': True, 'num_snps': 12910}. Best is trial 90 with value: 0.18341997937441007.
[I 2025-12-05 15:40:39,736] Trial 94 finished with value: 0.17590896664638486 and parameters: {'model_type': 'mlp', 'hidden_dims': '[512, 128]', 'dropout': 0.2998372761958763, 'batch_norm': True, 'lr': 0.0003588937215661031, 'weight_decay': 1.3758203510048629e-07, 'epochs': 268, 'loss': 'mse', 'optimizer': 'adam', 'graph_mode': 'off', 'use_snp_selection': True, 'num_snps': 12405}. Best is trial 90 with value: 0.18341997937441007.
[I 2025-12-05 15:40:40,902] Trial 95 finished with value: 0.16453683218364304 and parameters: {'model_type': 'mlp', 'hidden_dims': '[512, 128]', 'dropout': 0.21834090634538625, 'batch_norm': True, 'lr': 0.0007329372793444023, 'weight_decay': 2.5260419781132014e-07, 'epochs': 262, 'loss': 'mse', 'optimizer': 'adam', 'graph_mode': 'off', 'use_snp_selection': True, 'num_snps': 9209}. Best is trial 90 with value: 0.18341997937441007.
[I 2025-12-05 15:40:42,181] Trial 96 finished with value: 0.17101243279306594 and parameters: {'model_type': 'mlp', 'hidden_dims': '[256, 128]', 'dropout': 0.32532935765101817, 'batch_norm': True, 'lr': 0.0006613986628174872, 'weight_decay': 6.558391809702508e-07, 'epochs': 250, 'loss': 'mse', 'optimizer': 'adam', 'graph_mode': 'off', 'use_snp_selection': True, 'num_snps': 13550}. Best is trial 90 with value: 0.18341997937441007.
[I 2025-12-05 15:40:43,648] Trial 97 finished with value: 0.17528002785120408 and parameters: {'model_type': 'mlp', 'hidden_dims': '[512, 128]', 'dropout': 0.2546097586498321, 'batch_norm': True, 'lr': 0.0008695665272119875, 'weight_decay': 9.050335032587589e-07, 'epochs': 255, 'loss': 'mse', 'optimizer': 'adam', 'graph_mode': 'off', 'use_snp_selection': True, 'num_snps': 18180}. Best is trial 90 with value: 0.18341997937441007.
[I 2025-12-05 15:40:44,910] Trial 98 finished with value: 0.17014056004096278 and parameters: {'model_type': 'mlp', 'hidden_dims': '[512, 128]', 'dropout': 0.33331819634190246, 'batch_norm': True, 'lr': 0.0004149421490684103, 'weight_decay': 0.0009989905457929976, 'epochs': 239, 'loss': 'mse', 'optimizer': 'adam', 'graph_mode': 'off', 'use_snp_selection': True, 'num_snps': 14648}. Best is trial 90 with value: 0.18341997937441007.
[I 2025-12-05 15:40:45,999] Trial 99 finished with value: 0.17302911187693995 and parameters: {'model_type': 'mlp', 'hidden_dims': '[512, 128]', 'dropout': 0.27760340433015834, 'batch_norm': True, 'lr': 0.0005091232404258255, 'weight_decay': 5.909234369760796e-06, 'epochs': 299, 'loss': 'mse', 'optimizer': 'adam', 'graph_mode': 'off', 'use_snp_selection': True, 'num_snps': 5813}. Best is trial 90 with value: 0.18341997937441007.
[I 2025-12-05 15:40:47,115] Trial 100 finished with value: 0.15773009998965629 and parameters: {'model_type': 'mlp', 'hidden_dims': '[256, 128]', 'dropout': 0.23560331718726213, 'batch_norm': False, 'lr': 0.00017532747171083963, 'weight_decay': 2.876715420641928e-06, 'epochs': 272, 'loss': 'mse', 'optimizer': 'adam', 'graph_mode': 'off', 'use_snp_selection': True, 'num_snps': 11285}. Best is trial 90 with value: 0.18341997937441007.
[I 2025-12-05 15:40:48,535] Trial 101 finished with value: 0.17983550884959743 and parameters: {'model_type': 'mlp', 'hidden_dims': '[512, 128]', 'dropout': 0.2956759934171705, 'batch_norm': True, 'lr': 0.0007674434524435779, 'weight_decay': 1.226627033274735e-07, 'epochs': 288, 'loss': 'mse', 'optimizer': 'adam', 'graph_mode': 'off', 'use_snp_selection': True, 'num_snps': 17617}. Best is trial 90 with value: 0.18341997937441007.
[I 2025-12-05 15:40:50,087] Trial 102 finished with value: 0.18397016518376783 and parameters: {'model_type': 'mlp', 'hidden_dims': '[512, 128]', 'dropout': 0.29722622586667263, 'batch_norm': True, 'lr': 0.0008896026689790399, 'weight_decay': 1.0066983150547023e-07, 'epochs': 287, 'loss': 'mse', 'optimizer': 'adam', 'graph_mode': 'off', 'use_snp_selection': True, 'num_snps': 18081}. Best is trial 102 with value: 0.18397016518376783.
[I 2025-12-05 15:40:51,574] Trial 103 finished with value: 0.1692360216813396 and parameters: {'model_type': 'mlp', 'hidden_dims': '[512, 128]', 'dropout': 0.2635890587352627, 'batch_norm': True, 'lr': 0.0009688317518872806, 'weight_decay': 1.1944029953094028e-07, 'epochs': 292, 'loss': 'mse', 'optimizer': 'adam', 'graph_mode': 'off', 'use_snp_selection': True, 'num_snps': 15847}. Best is trial 102 with value: 0.18397016518376783.
[I 2025-12-05 15:40:52,952] Trial 104 finished with value: 0.16906530034947023 and parameters: {'model_type': 'mlp', 'hidden_dims': '[512, 128]', 'dropout': 0.29302835809690636, 'batch_norm': True, 'lr': 0.0007238582289790013, 'weight_decay': 1.0208528064091919e-07, 'epochs': 309, 'loss': 'mse', 'optimizer': 'adam', 'graph_mode': 'off', 'use_snp_selection': True, 'num_snps': 12056}. Best is trial 102 with value: 0.18397016518376783.
[I 2025-12-05 15:40:54,536] Trial 105 finished with value: 0.17273469516451606 and parameters: {'model_type': 'mlp', 'hidden_dims': '[512, 128]', 'dropout': 0.30982637953274744, 'batch_norm': True, 'lr': 0.0008422832845909364, 'weight_decay': 1.322430386891245e-07, 'epochs': 288, 'loss': 'mse', 'optimizer': 'adam', 'graph_mode': 'off', 'use_snp_selection': True, 'num_snps': 19869}. Best is trial 102 with value: 0.18397016518376783.
[I 2025-12-05 15:40:55,811] Trial 106 finished with value: 0.1738724109800107 and parameters: {'model_type': 'mlp', 'hidden_dims': '[512, 128]', 'dropout': 0.29484641480043605, 'batch_norm': True, 'lr': 0.0006697698682365847, 'weight_decay': 2.463925818059848e-07, 'epochs': 316, 'loss': 'mse', 'optimizer': 'adam', 'graph_mode': 'off', 'use_snp_selection': True, 'num_snps': 9509}. Best is trial 102 with value: 0.18397016518376783.
[I 2025-12-05 15:40:57,400] Trial 107 finished with value: 0.17607691617692145 and parameters: {'model_type': 'mlp', 'hidden_dims': '[512, 128]', 'dropout': 0.27514626035715695, 'batch_norm': True, 'lr': 0.000595512038641931, 'weight_decay': 1.3165269511071096e-05, 'epochs': 263, 'loss': 'mse', 'optimizer': 'adam', 'graph_mode': 'off', 'use_snp_selection': True, 'num_snps': 22893}. Best is trial 102 with value: 0.18397016518376783.
[I 2025-12-05 15:40:58,549] Trial 108 finished with value: 0.16228606340699547 and parameters: {'model_type': 'mlp', 'hidden_dims': '[256, 128, 64]', 'dropout': 0.2830399134011531, 'batch_norm': True, 'lr': 0.0008870432178915427, 'weight_decay': 3.1038589862847776e-07, 'epochs': 277, 'loss': 'mse', 'optimizer': 'adam', 'graph_mode': 'off', 'use_snp_selection': True, 'num_snps': 6392}. Best is trial 102 with value: 0.18397016518376783.
[I 2025-12-05 15:40:59,940] Trial 109 finished with value: 0.16760568993602812 and parameters: {'model_type': 'mlp', 'hidden_dims': '[128, 64]', 'dropout': 0.2477145887018788, 'batch_norm': True, 'lr': 0.0004518453158887833, 'weight_decay': 1.8798632708055566e-07, 'epochs': 297, 'loss': 'mse', 'optimizer': 'adam', 'graph_mode': 'off', 'use_snp_selection': True, 'num_snps': 17126}. Best is trial 102 with value: 0.18397016518376783.
[I 2025-12-05 15:41:01,248] Trial 110 finished with value: 0.16480070632241414 and parameters: {'model_type': 'mlp', 'hidden_dims': '[512, 128]', 'dropout': 0.3262190153115074, 'batch_norm': True, 'lr': 0.0007708948798963948, 'weight_decay': 4.181181588788026e-07, 'epochs': 284, 'loss': 'mse', 'optimizer': 'adam', 'graph_mode': 'off', 'use_snp_selection': True, 'num_snps': 14316}. Best is trial 102 with value: 0.18397016518376783.
[I 2025-12-05 15:41:02,693] Trial 111 finished with value: 0.180597224451137 and parameters: {'model_type': 'mlp', 'hidden_dims': '[512, 128]', 'dropout': 0.3417178215182523, 'batch_norm': True, 'lr': 0.0003579179454173391, 'weight_decay': 1.6061488517432832e-07, 'epochs': 266, 'loss': 'mse', 'optimizer': 'adam', 'graph_mode': 'off', 'use_snp_selection': True, 'num_snps': 18288}. Best is trial 102 with value: 0.18397016518376783.
[I 2025-12-05 15:41:04,407] Trial 112 finished with value: 0.02600888537350597 and parameters: {'model_type': 'mlp', 'hidden_dims': '[512, 128]', 'dropout': 0.31007696776868776, 'batch_norm': True, 'lr': 2.317829498873686e-06, 'weight_decay': 2.2279175642537927e-07, 'epochs': 229, 'loss': 'mse', 'optimizer': 'adam', 'graph_mode': 'off', 'use_snp_selection': True, 'num_snps': 25654}. Best is trial 102 with value: 0.18397016518376783.
[I 2025-12-05 15:41:05,990] Trial 113 finished with value: 0.17373696640115474 and parameters: {'model_type': 'mlp', 'hidden_dims': '[512, 128]', 'dropout': 0.35118484553384405, 'batch_norm': True, 'lr': 0.0005210817609250858, 'weight_decay': 1.534199218536067e-07, 'epochs': 266, 'loss': 'mse', 'optimizer': 'adam', 'graph_mode': 'off', 'use_snp_selection': True, 'num_snps': 19135}. Best is trial 102 with value: 0.18397016518376783.
[I 2025-12-05 15:41:07,621] Trial 114 finished with value: 0.19455525211499858 and parameters: {'model_type': 'mlp', 'hidden_dims': '[512, 128]', 'dropout': 0.2591882416141074, 'batch_norm': True, 'lr': 0.0003517225371582177, 'weight_decay': 1.2640875272953588e-07, 'epochs': 275, 'loss': 'mse', 'optimizer': 'adam', 'graph_mode': 'off', 'use_snp_selection': True, 'num_snps': 21352}. Best is trial 114 with value: 0.19455525211499858.
[I 2025-12-05 15:41:09,257] Trial 115 finished with value: 0.18147857500744288 and parameters: {'model_type': 'mlp', 'hidden_dims': '[512, 128]', 'dropout': 0.2626042230285079, 'batch_norm': True, 'lr': 0.0003753986995054555, 'weight_decay': 1.275710999384204e-07, 'epochs': 275, 'loss': 'mse', 'optimizer': 'adam', 'graph_mode': 'off', 'use_snp_selection': True, 'num_snps': 21754}. Best is trial 114 with value: 0.19455525211499858.
[I 2025-12-05 15:41:10,213] Trial 116 finished with value: 0.056572497569741254 and parameters: {'model_type': 'mlp', 'hidden_dims': '[256, 128]', 'dropout': 0.26187167421324964, 'batch_norm': True, 'lr': 5.0457920335775005e-06, 'weight_decay': 1.2139555147884927e-07, 'epochs': 274, 'loss': 'mse', 'optimizer': 'adam', 'graph_mode': 'off', 'use_snp_selection': True, 'num_snps': 2355}. Best is trial 114 with value: 0.19455525211499858.
[I 2025-12-05 15:41:11,746] Trial 117 finished with value: 0.1765124192132231 and parameters: {'model_type': 'mlp', 'hidden_dims': '[512, 64]', 'dropout': 0.24210935605049094, 'batch_norm': True, 'lr': 0.0006486179395487209, 'weight_decay': 1.1906605255586944e-07, 'epochs': 257, 'loss': 'mse', 'optimizer': 'adam', 'graph_mode': 'off', 'use_snp_selection': True, 'num_snps': 21135}. Best is trial 114 with value: 0.19455525211499858.
[I 2025-12-05 15:41:13,137] Trial 118 finished with value: 0.18300368602992784 and parameters: {'model_type': 'mlp', 'hidden_dims': '[512, 128]', 'dropout': 0.21426363638164034, 'batch_norm': True, 'lr': 0.00045867406002119446, 'weight_decay': 1.6986803051291664e-07, 'epochs': 288, 'loss': 'mse', 'optimizer': 'adam', 'graph_mode': 'off', 'use_snp_selection': True, 'num_snps': 16263}. Best is trial 114 with value: 0.19455525211499858.
[I 2025-12-05 15:41:14,396] Trial 119 finished with value: 0.16822879710828106 and parameters: {'model_type': 'mlp', 'hidden_dims': '[512, 128]', 'dropout': 0.22251797346174002, 'batch_norm': True, 'lr': 0.0004470619084017949, 'weight_decay': 1.0189772529364693e-07, 'epochs': 278, 'loss': 'mse', 'optimizer': 'adam', 'graph_mode': 'off', 'use_snp_selection': True, 'num_snps': 12914}. Best is trial 114 with value: 0.19455525211499858.
[I 2025-12-05 15:41:15,737] Trial 120 finished with value: 0.157726047283235 and parameters: {'model_type': 'mlp', 'hidden_dims': '[512, 128]', 'dropout': 0.1568026168311717, 'batch_norm': False, 'lr': 0.0003409707041089417, 'weight_decay': 1.7263250028497187e-07, 'epochs': 302, 'loss': 'mse', 'optimizer': 'adam', 'graph_mode': 'off', 'use_snp_selection': True, 'num_snps': 16101}. Best is trial 114 with value: 0.19455525211499858.
[I 2025-12-05 15:41:17,156] Trial 121 finished with value: 0.17825180196774637 and parameters: {'model_type': 'mlp', 'hidden_dims': '[512, 128]', 'dropout': 0.17549248782775834, 'batch_norm': True, 'lr': 0.00054030237877925, 'weight_decay': 1.3459972608418177e-07, 'epochs': 289, 'loss': 'mse', 'optimizer': 'adam', 'graph_mode': 'off', 'use_snp_selection': True, 'num_snps': 17700}. Best is trial 114 with value: 0.19455525211499858.
[I 2025-12-05 15:41:18,700] Trial 122 finished with value: 0.1682457340032194 and parameters: {'model_type': 'mlp', 'hidden_dims': '[512, 128]', 'dropout': 0.19873537815907683, 'batch_norm': True, 'lr': 0.000733354542679375, 'weight_decay': 1.5680401981270182e-07, 'epochs': 252, 'loss': 'mse', 'optimizer': 'adam', 'graph_mode': 'off', 'use_snp_selection': True, 'num_snps': 19316}. Best is trial 114 with value: 0.19455525211499858.
[I 2025-12-05 15:41:20,111] Trial 123 finished with value: 0.17308785323085962 and parameters: {'model_type': 'mlp', 'hidden_dims': '[512, 128]', 'dropout': 0.27266923170153995, 'batch_norm': True, 'lr': 0.0008902191058339767, 'weight_decay': 1.8822205889762223e-07, 'epochs': 267, 'loss': 'mse', 'optimizer': 'adam', 'graph_mode': 'off', 'use_snp_selection': True, 'num_snps': 15082}. Best is trial 114 with value: 0.19455525211499858.
[I 2025-12-05 15:41:21,849] Trial 124 finished with value: 0.1711823465829155 and parameters: {'model_type': 'mlp', 'hidden_dims': '[512, 128]', 'dropout': 0.2541250525531919, 'batch_norm': True, 'lr': 0.0005999696804585094, 'weight_decay': 0.00011096201799782868, 'epochs': 285, 'loss': 'mse', 'optimizer': 'adam', 'graph_mode': 'off', 'use_snp_selection': True, 'num_snps': 23818}. Best is trial 114 with value: 0.19455525211499858.
[I 2025-12-05 15:41:23,475] Trial 125 finished with value: 0.16684371491141642 and parameters: {'model_type': 'mlp', 'hidden_dims': '[512, 128]', 'dropout': 0.48353261731585434, 'batch_norm': True, 'lr': 0.00038645881767586566, 'weight_decay': 1.4408662198899523e-07, 'epochs': 294, 'loss': 'mse', 'optimizer': 'adam', 'graph_mode': 'off', 'use_snp_selection': True, 'num_snps': 21718}. Best is trial 114 with value: 0.19455525211499858.
[I 2025-12-05 15:41:24,774] Trial 126 finished with value: 0.16396013980252963 and parameters: {'model_type': 'mlp', 'hidden_dims': '[512, 128]', 'dropout': 0.2854976312149833, 'batch_norm': True, 'lr': 0.00048066188815412437, 'weight_decay': 1.1910678639421874e-07, 'epochs': 306, 'loss': 'mse', 'optimizer': 'adam', 'graph_mode': 'off', 'use_snp_selection': True, 'num_snps': 10525}. Best is trial 114 with value: 0.19455525211499858.
[I 2025-12-05 15:41:26,080] Trial 127 finished with value: 0.1716449824771732 and parameters: {'model_type': 'mlp', 'hidden_dims': '[512, 128]', 'dropout': 0.5090842018509616, 'batch_norm': True, 'lr': 0.0009969570217357314, 'weight_decay': 1.9388246323490288e-07, 'epochs': 276, 'loss': 'mse', 'optimizer': 'adam', 'graph_mode': 'off', 'use_snp_selection': True, 'num_snps': 13804}. Best is trial 114 with value: 0.19455525211499858.
[I 2025-12-05 15:41:27,471] Trial 128 finished with value: 0.18364362616491614 and parameters: {'model_type': 'mlp', 'hidden_dims': '[256, 128]', 'dropout': 0.2062229893643368, 'batch_norm': True, 'lr': 0.0007446156942657445, 'weight_decay': 1.7144235141128578e-06, 'epochs': 259, 'loss': 'mse', 'optimizer': 'adam', 'graph_mode': 'off', 'use_snp_selection': True, 'num_snps': 16932}. Best is trial 114 with value: 0.19455525211499858.
[I 2025-12-05 15:41:28,911] Trial 129 finished with value: 0.16519110030853046 and parameters: {'model_type': 'mlp', 'hidden_dims': '[256, 128]', 'dropout': 0.20198544448474742, 'batch_norm': True, 'lr': 0.0006137829303950884, 'weight_decay': 1.0336429556295257e-06, 'epochs': 261, 'loss': 'mse', 'optimizer': 'adam', 'graph_mode': 'off', 'use_snp_selection': True, 'num_snps': 16463}. Best is trial 114 with value: 0.19455525211499858.
[I 2025-12-05 15:41:30,479] Trial 130 finished with value: 0.154788070629429 and parameters: {'model_type': 'mlp', 'hidden_dims': '[256, 128]', 'dropout': 0.5468028390382208, 'batch_norm': True, 'lr': 0.0002723147337333905, 'weight_decay': 1.5624665716555735e-06, 'epochs': 235, 'loss': 'mse', 'optimizer': 'adam', 'graph_mode': 'off', 'use_snp_selection': True, 'num_snps': 20608}. Best is trial 114 with value: 0.19455525211499858.
[I 2025-12-05 15:41:31,921] Trial 131 finished with value: 0.1587220156194351 and parameters: {'model_type': 'mlp', 'hidden_dims': '[256, 128]', 'dropout': 0.1737646675373611, 'batch_norm': True, 'lr': 0.0007692414773023136, 'weight_decay': 1.8911507862765545e-06, 'epochs': 245, 'loss': 'mse', 'optimizer': 'adam', 'graph_mode': 'off', 'use_snp_selection': True, 'num_snps': 18073}. Best is trial 114 with value: 0.19455525211499858.
[I 2025-12-05 15:41:33,195] Trial 132 finished with value: 0.18000672733716974 and parameters: {'model_type': 'mlp', 'hidden_dims': '[256, 128]', 'dropout': 0.237463090283463, 'batch_norm': True, 'lr': 0.0006808833038689657, 'weight_decay': 1.0089429045364788e-07, 'epochs': 271, 'loss': 'mse', 'optimizer': 'adam', 'graph_mode': 'off', 'use_snp_selection': True, 'num_snps': 12629}. Best is trial 114 with value: 0.19455525211499858.
