[I 2025-12-05 15:51:13,528] Trial 135 finished with value: 0.05637935508390542 and parameters: {'model_type': 'mlp', 'hidden_dims': '[512, 128]', 'dropout': 0.2238517501664233, 'batch_norm': False, 'lr': 0.0001825551252236508, 'weight_decay': 0.0001819002707107937, 'epochs': 350, 'loss': 'mae', 'optimizer': 'adam', 'graph_mode': 'off', 'use_snp_selection': True, 'num_snps': 8077}. Best is trial 128 with value: 0.06205779707559564.
[I 2025-12-05 15:51:14,608] Trial 136 finished with value: 0.04020916695608207 and parameters: {'model_type': 'mlp', 'hidden_dims': '[512, 128]', 'dropout': 0.2184986346670661, 'batch_norm': False, 'lr': 0.00015771096784042386, 'weight_decay': 1.290397787107528e-06, 'epochs': 350, 'loss': 'mae', 'optimizer': 'adam', 'graph_mode': 'off', 'use_snp_selection': True, 'num_snps': 6422}. Best is trial 128 with value: 0.06205779707559564.
[I 2025-12-05 15:51:15,581] Trial 137 finished with value: 0.01999691834210012 and parameters: {'model_type': 'mlp', 'hidden_dims': '[512, 128]', 'dropout': 0.24809766612118792, 'batch_norm': False, 'lr': 0.00018815263715284242, 'weight_decay': 3.622274425539746e-05, 'epochs': 338, 'loss': 'mae', 'optimizer': 'adam', 'graph_mode': 'off', 'use_snp_selection': True, 'num_snps': 2646}. Best is trial 128 with value: 0.06205779707559564.
[I 2025-12-05 15:51:16,700] Trial 138 finished with value: 0.03376410311971356 and parameters: {'model_type': 'mlp', 'hidden_dims': '[512, 256]', 'dropout': 0.22044367276459986, 'batch_norm': False, 'lr': 0.00029795315788833934, 'weight_decay': 2.5294905465991567e-06, 'epochs': 327, 'loss': 'mae', 'optimizer': 'adam', 'graph_mode': 'off', 'use_snp_selection': True, 'num_snps': 8072}. Best is trial 128 with value: 0.06205779707559564.
[I 2025-12-05 15:51:17,669] Trial 139 finished with value: 0.056714860195478806 and parameters: {'model_type': 'mlp', 'hidden_dims': '[512, 128]', 'dropout': 0.2549134147352951, 'batch_norm': False, 'lr': 0.00018672324321886507, 'weight_decay': 7.395765369760247e-07, 'epochs': 319, 'loss': 'mse', 'optimizer': 'adam', 'graph_mode': 'off', 'use_snp_selection': True, 'num_snps': 4782}. Best is trial 128 with value: 0.06205779707559564.
[I 2025-12-05 15:51:18,611] Trial 140 finished with value: 0.038772493064321935 and parameters: {'model_type': 'mlp', 'hidden_dims': '[512, 128]', 'dropout': 0.2537018027781593, 'batch_norm': False, 'lr': 0.00023286956027138085, 'weight_decay': 6.971318127371919e-07, 'epochs': 309, 'loss': 'mse', 'optimizer': 'adam', 'graph_mode': 'off', 'use_snp_selection': True, 'num_snps': 4150}. Best is trial 128 with value: 0.06205779707559564.
[I 2025-12-05 15:51:19,576] Trial 141 finished with value: 0.04179774880061426 and parameters: {'model_type': 'mlp', 'hidden_dims': '[512, 128]', 'dropout': 0.2091144958705649, 'batch_norm': False, 'lr': 0.00018096970511773992, 'weight_decay': 9.747205119645841e-07, 'epochs': 335, 'loss': 'mse', 'optimizer': 'adam', 'graph_mode': 'off', 'use_snp_selection': True, 'num_snps': 5362}. Best is trial 128 with value: 0.06205779707559564.
[I 2025-12-05 15:51:23,016] Trial 142 finished with value: 0.02259251837835574 and parameters: {'model_type': 'mlp', 'hidden_dims': '[512, 128]', 'dropout': 0.2346370363514585, 'batch_norm': False, 'lr': 0.000347136940879702, 'weight_decay': 8.234264169702619e-07, 'epochs': 320, 'loss': 'mse', 'optimizer': 'adam', 'graph_mode': 'off', 'use_snp_selection': True, 'num_snps': 59656}. Best is trial 128 with value: 0.06205779707559564.
[I 2025-12-05 15:51:24,054] Trial 143 finished with value: 0.026019077179950393 and parameters: {'model_type': 'mlp', 'hidden_dims': '[512, 128]', 'dropout': 0.2615812431059814, 'batch_norm': False, 'lr': 0.0001101837032657096, 'weight_decay': 1.7868771461375767e-06, 'epochs': 323, 'loss': 'mse', 'optimizer': 'adam', 'graph_mode': 'off', 'use_snp_selection': True, 'num_snps': 6946}. Best is trial 128 with value: 0.06205779707559564.
[I 2025-12-05 15:51:25,176] Trial 144 finished with value: 0.03626397291170322 and parameters: {'model_type': 'mlp', 'hidden_dims': '[256, 128, 64]', 'dropout': 0.27681159524225224, 'batch_norm': False, 'lr': 0.00013624967243411765, 'weight_decay': 4.2202870120159556e-07, 'epochs': 329, 'loss': 'mse', 'optimizer': 'adam', 'graph_mode': 'off', 'use_snp_selection': True, 'num_snps': 8033}. Best is trial 128 with value: 0.06205779707559564.
[I 2025-12-05 15:51:26,154] Trial 145 finished with value: 0.040549837720269155 and parameters: {'model_type': 'mlp', 'hidden_dims': '[512, 64]', 'dropout': 0.24483755530185178, 'batch_norm': False, 'lr': 0.00015002212972198124, 'weight_decay': 2.1222444025330302e-05, 'epochs': 343, 'loss': 'mae', 'optimizer': 'adam', 'graph_mode': 'off', 'use_snp_selection': True, 'num_snps': 4689}. Best is trial 128 with value: 0.06205779707559564.
[I 2025-12-05 15:51:28,038] Trial 146 finished with value: 0.028984916240684135 and parameters: {'model_type': 'mlp', 'hidden_dims': '[512, 128]', 'dropout': 0.1887969983749892, 'batch_norm': False, 'lr': 0.0002175685534041834, 'weight_decay': 1.4650714005940996e-06, 'epochs': 314, 'loss': 'mae', 'optimizer': 'adam', 'graph_mode': 'off', 'use_snp_selection': False}. Best is trial 128 with value: 0.06205779707559564.
[I 2025-12-05 15:51:29,011] Trial 147 finished with value: 0.010845256464447584 and parameters: {'model_type': 'mlp', 'hidden_dims': '[512, 128]', 'dropout': 0.20160110201070627, 'batch_norm': False, 'lr': 0.0002742147182541346, 'weight_decay': 2.937501019118336e-07, 'epochs': 337, 'loss': 'mae', 'optimizer': 'adam', 'graph_mode': 'off', 'use_snp_selection': True, 'num_snps': 2821}. Best is trial 128 with value: 0.06205779707559564.
[I 2025-12-05 15:51:30,423] Trial 148 finished with value: 0.028358090777857645 and parameters: {'model_type': 'mlp', 'hidden_dims': '[128, 64]', 'dropout': 0.25400604911541036, 'batch_norm': False, 'lr': 0.00019485510452221412, 'weight_decay': 0.00017796197279697267, 'epochs': 330, 'loss': 'mse', 'optimizer': 'adam', 'graph_mode': 'off', 'use_snp_selection': True, 'num_snps': 20301}. Best is trial 128 with value: 0.06205779707559564.
[I 2025-12-05 15:51:32,455] Trial 149 finished with value: 0.026136311955186082 and parameters: {'model_type': 'mlp', 'hidden_dims': '[512, 128]', 'dropout': 0.22991042940665624, 'batch_norm': False, 'lr': 0.00040436417745382187, 'weight_decay': 1.1886708554623339e-06, 'epochs': 305, 'loss': 'mae', 'optimizer': 'adam', 'graph_mode': 'off', 'use_snp_selection': True, 'num_snps': 34180}. Best is trial 128 with value: 0.06205779707559564.
[I 2025-12-05 15:51:34,699] Trial 0 finished with value: -0.0002494669231646997 and parameters: {'model_type': 'mlp', 'hidden_dims': '[128, 64]', 'dropout': 0.199031432379812, 'batch_norm': True, 'lr': 1.8408544111075837e-06, 'weight_decay': 5.5136510071208614e-05, 'epochs': 336, 'loss': 'mae', 'optimizer': 'adam', 'graph_mode': 'off', 'use_snp_selection': True, 'num_snps': 43862}. Best is trial 0 with value: -0.0002494669231646997.
[I 2025-12-05 15:51:35,791] Trial 1 finished with value: 0.0005452792730258923 and parameters: {'model_type': 'mlp', 'hidden_dims': '[256, 128]', 'dropout': 0.4370668075331726, 'batch_norm': True, 'lr': 7.133471581159139e-05, 'weight_decay': 1.128633586803549e-05, 'epochs': 242, 'loss': 'mae', 'optimizer': 'adam', 'graph_mode': 'off', 'use_snp_selection': False}. Best is trial 1 with value: 0.0005452792730258923.
[I 2025-12-05 15:51:36,749] Trial 2 finished with value: 0.004616360502193995 and parameters: {'model_type': 'mlp', 'hidden_dims': '[256, 128, 64]', 'dropout': 0.41314357415569625, 'batch_norm': False, 'lr': 3.952233718592101e-06, 'weight_decay': 0.00026754769258252603, 'epochs': 149, 'loss': 'mse', 'optimizer': 'adam', 'graph_mode': 'off', 'use_snp_selection': True, 'num_snps': 11571}. Best is trial 2 with value: 0.004616360502193995.
[I 2025-12-05 15:51:38,478] Trial 3 finished with value: 0.003550323183922979 and parameters: {'model_type': 'mlp', 'hidden_dims': '[512, 64]', 'dropout': 0.5938127374509361, 'batch_norm': False, 'lr': 5.67704586114731e-06, 'weight_decay': 2.4518087630137052e-05, 'epochs': 320, 'loss': 'mae', 'optimizer': 'adam', 'graph_mode': 'off', 'use_snp_selection': False}. Best is trial 2 with value: 0.004616360502193995.
[I 2025-12-05 15:51:40,626] Trial 4 finished with value: -0.017321497439232336 and parameters: {'model_type': 'mlp', 'hidden_dims': '[512, 128]', 'dropout': 0.25746343592134413, 'batch_norm': True, 'lr': 1.3467657668402788e-06, 'weight_decay': 0.00033087251918647806, 'epochs': 277, 'loss': 'mse', 'optimizer': 'adam', 'graph_mode': 'off', 'use_snp_selection': True, 'num_snps': 36675}. Best is trial 2 with value: 0.004616360502193995.
[I 2025-12-05 15:51:42,290] Trial 5 finished with value: -0.006134700073436661 and parameters: {'model_type': 'mlp', 'hidden_dims': '[512, 64]', 'dropout': 0.38275350994408375, 'batch_norm': True, 'lr': 1.5586664309232824e-06, 'weight_decay': 0.0008227664668621182, 'epochs': 145, 'loss': 'mae', 'optimizer': 'adam', 'graph_mode': 'off', 'use_snp_selection': True, 'num_snps': 32148}. Best is trial 2 with value: 0.004616360502193995.
[I 2025-12-05 15:51:43,238] Trial 6 finished with value: 0.0052882475595822575 and parameters: {'model_type': 'mlp', 'hidden_dims': '[256, 128]', 'dropout': 0.3930109900265879, 'batch_norm': False, 'lr': 4.892964372128395e-05, 'weight_decay': 1.5809549317992182e-06, 'epochs': 199, 'loss': 'mse', 'optimizer': 'adam', 'graph_mode': 'off', 'use_snp_selection': False}. Best is trial 6 with value: 0.0052882475595822575.
[I 2025-12-05 15:51:44,303] Trial 7 finished with value: 0.018558071036519946 and parameters: {'model_type': 'mlp', 'hidden_dims': '[512, 256]', 'dropout': 0.15343979219678458, 'batch_norm': True, 'lr': 6.234003099047341e-05, 'weight_decay': 3.894760610535477e-07, 'epochs': 97, 'loss': 'mse', 'optimizer': 'adam', 'graph_mode': 'off', 'use_snp_selection': False}. Best is trial 7 with value: 0.018558071036519946.
[I 2025-12-05 15:51:46,086] Trial 8 finished with value: -0.01222924338011821 and parameters: {'model_type': 'mlp', 'hidden_dims': '[512, 128]', 'dropout': 0.10743001231661406, 'batch_norm': True, 'lr': 0.00023728538449271062, 'weight_decay': 1.7629071578048637e-05, 'epochs': 312, 'loss': 'mae', 'optimizer': 'adam', 'graph_mode': 'off', 'use_snp_selection': False}. Best is trial 7 with value: 0.018558071036519946.
[I 2025-12-05 15:51:47,404] Trial 9 finished with value: -0.002274800114029039 and parameters: {'model_type': 'mlp', 'hidden_dims': '[512, 64]', 'dropout': 0.14505336736221927, 'batch_norm': True, 'lr': 5.8619638388111826e-05, 'weight_decay': 6.200156172669308e-07, 'epochs': 175, 'loss': 'mse', 'optimizer': 'adam', 'graph_mode': 'off', 'use_snp_selection': False}. Best is trial 7 with value: 0.018558071036519946.
[I 2025-12-05 15:51:48,303] Trial 10 finished with value: 0.0024194340958102784 and parameters: {'model_type': 'mlp', 'hidden_dims': '[512, 256]', 'dropout': 0.2736992815328032, 'batch_norm': False, 'lr': 0.00032393778075602147, 'weight_decay': 1.1511946696017092e-07, 'epochs': 41, 'loss': 'mse', 'optimizer': 'adam', 'graph_mode': 'off', 'use_snp_selection': False}. Best is trial 7 with value: 0.018558071036519946.
[I 2025-12-05 15:51:49,059] Trial 11 finished with value: -0.005375433199267344 and parameters: {'model_type': 'mlp', 'hidden_dims': '[256, 128]', 'dropout': 0.4976577565047725, 'batch_norm': False, 'lr': 1.6474108386126448e-05, 'weight_decay': 1.4494794384169763e-06, 'epochs': 77, 'loss': 'mse', 'optimizer': 'adam', 'graph_mode': 'off', 'use_snp_selection': False}. Best is trial 7 with value: 0.018558071036519946.
[I 2025-12-05 15:51:50,511] Trial 12 finished with value: 0.013706037482541051 and parameters: {'model_type': 'mlp', 'hidden_dims': '[512, 256]', 'dropout': 0.33506312640228997, 'batch_norm': False, 'lr': 2.1908156534290234e-05, 'weight_decay': 1.255784110448998e-06, 'epochs': 218, 'loss': 'mse', 'optimizer': 'adam', 'graph_mode': 'off', 'use_snp_selection': False}. Best is trial 7 with value: 0.018558071036519946.
[I 2025-12-05 15:51:51,574] Trial 13 finished with value: 0.010631666393606276 and parameters: {'model_type': 'mlp', 'hidden_dims': '[512, 256]', 'dropout': 0.2976711894809366, 'batch_norm': False, 'lr': 1.6203139973043888e-05, 'weight_decay': 1.8410744279331143e-07, 'epochs': 87, 'loss': 'mse', 'optimizer': 'adam', 'graph_mode': 'off', 'use_snp_selection': False}. Best is trial 7 with value: 0.018558071036519946.
[I 2025-12-05 15:51:53,086] Trial 14 finished with value: 0.019023249619715004 and parameters: {'model_type': 'mlp', 'hidden_dims': '[512, 256]', 'dropout': 0.19164604697284818, 'batch_norm': True, 'lr': 0.0001457690241539883, 'weight_decay': 2.6592580957229975e-06, 'epochs': 229, 'loss': 'mse', 'optimizer': 'adam', 'graph_mode': 'off', 'use_snp_selection': False}. Best is trial 14 with value: 0.019023249619715004.
[I 2025-12-05 15:51:54,275] Trial 15 finished with value: -0.007254512261345615 and parameters: {'model_type': 'mlp', 'hidden_dims': '[512, 256]', 'dropout': 0.20377973878137012, 'batch_norm': True, 'lr': 0.0001572871022003765, 'weight_decay': 4.647398975110266e-06, 'epochs': 128, 'loss': 'mse', 'optimizer': 'adam', 'graph_mode': 'off', 'use_snp_selection': False}. Best is trial 14 with value: 0.019023249619715004.
[I 2025-12-05 15:51:55,866] Trial 16 finished with value: 0.0012069834453709417 and parameters: {'model_type': 'mlp', 'hidden_dims': '[512, 256]', 'dropout': 0.18838292592624284, 'batch_norm': True, 'lr': 0.0006753634252778753, 'weight_decay': 3.749525779502734e-07, 'epochs': 258, 'loss': 'mse', 'optimizer': 'adam', 'graph_mode': 'off', 'use_snp_selection': False}. Best is trial 14 with value: 0.019023249619715004.
[I 2025-12-05 15:51:56,569] Trial 17 finished with value: -0.003709368405388949 and parameters: {'model_type': 'mlp', 'hidden_dims': '[128, 64]', 'dropout': 0.10230308008198463, 'batch_norm': True, 'lr': 0.00011492121034538856, 'weight_decay': 3.784040923164914e-06, 'epochs': 88, 'loss': 'mse', 'optimizer': 'adam', 'graph_mode': 'off', 'use_snp_selection': False}. Best is trial 14 with value: 0.019023249619715004.
[I 2025-12-05 15:51:59,208] Trial 18 finished with value: 0.00017498623227529125 and parameters: {'model_type': 'mlp', 'hidden_dims': '[256, 128, 64]', 'dropout': 0.2312628506238401, 'batch_norm': True, 'lr': 0.0009700460844600156, 'weight_decay': 3.793590444654012e-07, 'epochs': 182, 'loss': 'mse', 'optimizer': 'adam', 'graph_mode': 'off', 'use_snp_selection': True, 'num_snps': 58241}. Best is trial 14 with value: 0.019023249619715004.
[I 2025-12-05 15:52:00,926] Trial 19 finished with value: -0.0027250426372219727 and parameters: {'model_type': 'mlp', 'hidden_dims': '[512, 256]', 'dropout': 0.15485564678473862, 'batch_norm': True, 'lr': 0.0003243255649615631, 'weight_decay': 4.786878087308249e-06, 'epochs': 286, 'loss': 'mse', 'optimizer': 'adam', 'graph_mode': 'off', 'use_snp_selection': False}. Best is trial 14 with value: 0.019023249619715004.
[I 2025-12-05 15:52:02,362] Trial 20 finished with value: -0.007035591428785339 and parameters: {'model_type': 'mlp', 'hidden_dims': '[512, 256]', 'dropout': 0.32699987302790623, 'batch_norm': True, 'lr': 7.951283186534742e-06, 'weight_decay': 4.679666515308887e-05, 'epochs': 222, 'loss': 'mse', 'optimizer': 'adam', 'graph_mode': 'off', 'use_snp_selection': False}. Best is trial 14 with value: 0.019023249619715004.
[I 2025-12-05 15:52:03,812] Trial 21 finished with value: 0.008945211261080145 and parameters: {'model_type': 'mlp', 'hidden_dims': '[512, 256]', 'dropout': 0.3395871048586837, 'batch_norm': False, 'lr': 2.4256837794722e-05, 'weight_decay': 1.27259278429389e-06, 'epochs': 220, 'loss': 'mse', 'optimizer': 'adam', 'graph_mode': 'off', 'use_snp_selection': False}. Best is trial 14 with value: 0.019023249619715004.
[I 2025-12-05 15:52:05,248] Trial 22 finished with value: 0.022763159205916747 and parameters: {'model_type': 'mlp', 'hidden_dims': '[512, 256]', 'dropout': 0.1498878370546235, 'batch_norm': False, 'lr': 3.511276726977528e-05, 'weight_decay': 7.807472065158404e-07, 'epochs': 212, 'loss': 'mse', 'optimizer': 'adam', 'graph_mode': 'off', 'use_snp_selection': False}. Best is trial 22 with value: 0.022763159205916747.
[I 2025-12-05 15:52:06,371] Trial 23 finished with value: 0.006069357222941304 and parameters: {'model_type': 'mlp', 'hidden_dims': '[512, 256]', 'dropout': 0.15208358268794653, 'batch_norm': False, 'lr': 0.0001099839906046416, 'weight_decay': 4.326254794011964e-07, 'epochs': 115, 'loss': 'mse', 'optimizer': 'adam', 'graph_mode': 'off', 'use_snp_selection': False}. Best is trial 22 with value: 0.022763159205916747.
[I 2025-12-05 15:52:07,667] Trial 24 finished with value: 0.006785687520228841 and parameters: {'model_type': 'mlp', 'hidden_dims': '[512, 256]', 'dropout': 0.2361975234822196, 'batch_norm': True, 'lr': 3.978049943836133e-05, 'weight_decay': 2.83783364942571e-06, 'epochs': 169, 'loss': 'mse', 'optimizer': 'adam', 'graph_mode': 'off', 'use_snp_selection': False}. Best is trial 22 with value: 0.022763159205916747.
[I 2025-12-05 15:52:09,178] Trial 25 finished with value: 0.005845367032854761 and parameters: {'model_type': 'mlp', 'hidden_dims': '[512, 256]', 'dropout': 0.15306942726151015, 'batch_norm': True, 'lr': 8.650893356257638e-05, 'weight_decay': 1.8900719936690945e-07, 'epochs': 245, 'loss': 'mse', 'optimizer': 'adam', 'graph_mode': 'off', 'use_snp_selection': False}. Best is trial 22 with value: 0.022763159205916747.
[I 2025-12-05 15:52:09,767] Trial 26 finished with value: -0.0033022838208998286 and parameters: {'model_type': 'mlp', 'hidden_dims': '[512, 128]', 'dropout': 0.18391890205095943, 'batch_norm': False, 'lr': 0.00017648613047543656, 'weight_decay': 7.236217018681029e-07, 'epochs': 40, 'loss': 'mae', 'optimizer': 'adam', 'graph_mode': 'off', 'use_snp_selection': True, 'num_snps': 3842}. Best is trial 22 with value: 0.022763159205916747.
[I 2025-12-05 15:52:10,791] Trial 27 finished with value: 0.0004503128148749998 and parameters: {'model_type': 'mlp', 'hidden_dims': '[256, 128, 64]', 'dropout': 0.12351618468002254, 'batch_norm': True, 'lr': 9.58419571081476e-06, 'weight_decay': 8.139158222817736e-06, 'epochs': 199, 'loss': 'mse', 'optimizer': 'adam', 'graph_mode': 'off', 'use_snp_selection': False}. Best is trial 22 with value: 0.022763159205916747.
[I 2025-12-05 15:52:11,688] Trial 28 finished with value: -0.020568085189967496 and parameters: {'model_type': 'mlp', 'hidden_dims': '[128, 64]', 'dropout': 0.219196935871986, 'batch_norm': False, 'lr': 3.381650089617754e-05, 'weight_decay': 1.0061189383111765e-07, 'epochs': 276, 'loss': 'mse', 'optimizer': 'adam', 'graph_mode': 'off', 'use_snp_selection': False}. Best is trial 22 with value: 0.022763159205916747.
[I 2025-12-05 15:52:12,878] Trial 29 finished with value: -0.01664755560237671 and parameters: {'model_type': 'mlp', 'hidden_dims': '[128, 64]', 'dropout': 0.18021146499615326, 'batch_norm': True, 'lr': 2.8966762461994946e-06, 'weight_decay': 2.3253696516103376e-06, 'epochs': 156, 'loss': 'mae', 'optimizer': 'adam', 'graph_mode': 'off', 'use_snp_selection': True, 'num_snps': 19468}. Best is trial 22 with value: 0.022763159205916747.
[I 2025-12-05 15:52:14,028] Trial 30 finished with value: 0.0069878386991377535 and parameters: {'model_type': 'mlp', 'hidden_dims': '[512, 256]', 'dropout': 0.2927062561867923, 'batch_norm': True, 'lr': 0.0004720488710972087, 'weight_decay': 7.23133287117146e-07, 'epochs': 108, 'loss': 'mse', 'optimizer': 'adam', 'graph_mode': 'off', 'use_snp_selection': False}. Best is trial 22 with value: 0.022763159205916747.
[I 2025-12-05 15:52:15,490] Trial 31 finished with value: 0.010972778848113394 and parameters: {'model_type': 'mlp', 'hidden_dims': '[512, 256]', 'dropout': 0.503366767490185, 'batch_norm': False, 'lr': 2.26194455056655e-05, 'weight_decay': 1.0730279478949625e-06, 'epochs': 224, 'loss': 'mse', 'optimizer': 'adam', 'graph_mode': 'off', 'use_snp_selection': False}. Best is trial 22 with value: 0.022763159205916747.
[I 2025-12-05 15:52:16,921] Trial 32 finished with value: -0.004594086934804224 and parameters: {'model_type': 'mlp', 'hidden_dims': '[512, 256]', 'dropout': 0.24090939868998731, 'batch_norm': False, 'lr': 6.498771111495683e-05, 'weight_decay': 2.479573009690106e-07, 'epochs': 208, 'loss': 'mse', 'optimizer': 'adam', 'graph_mode': 'off', 'use_snp_selection': False}. Best is trial 22 with value: 0.022763159205916747.
[I 2025-12-05 15:52:18,448] Trial 33 finished with value: 0.00105556780636868 and parameters: {'model_type': 'mlp', 'hidden_dims': '[512, 256]', 'dropout': 0.4495915146943971, 'batch_norm': False, 'lr': 1.2667781567992057e-05, 'weight_decay': 1.8777710902463409e-06, 'epochs': 242, 'loss': 'mse', 'optimizer': 'adam', 'graph_mode': 'off', 'use_snp_selection': False}. Best is trial 22 with value: 0.022763159205916747.
[I 2025-12-05 15:52:19,504] Trial 34 finished with value: 0.017083253152902864 and parameters: {'model_type': 'mlp', 'hidden_dims': '[256, 128]', 'dropout': 0.13009178324872478, 'batch_norm': False, 'lr': 2.891357772684738e-05, 'weight_decay': 8.656113636343499e-06, 'epochs': 245, 'loss': 'mae', 'optimizer': 'adam', 'graph_mode': 'off', 'use_snp_selection': False}. Best is trial 22 with value: 0.022763159205916747.
[I 2025-12-05 15:52:20,530] Trial 35 finished with value: -0.0041290459487900956 and parameters: {'model_type': 'mlp', 'hidden_dims': '[256, 128]', 'dropout': 0.12831172993572967, 'batch_norm': False, 'lr': 3.330819681690642e-05, 'weight_decay': 6.87617343577614e-06, 'epochs': 245, 'loss': 'mae', 'optimizer': 'adam', 'graph_mode': 'off', 'use_snp_selection': False}. Best is trial 22 with value: 0.022763159205916747.
