[I 2025-12-05 15:00:28,898] Trial 89 finished with value: 0.04460442835480146 and parameters: {'model_type': 'mlp', 'hidden_dims': '[128, 64]', 'dropout': 0.5184462493441782, 'batch_norm': False, 'lr': 1.2170475779054658e-05, 'weight_decay': 3.1857614735155427e-06, 'epochs': 305, 'loss': 'mse', 'optimizer': 'adam', 'graph_mode': 'off', 'use_snp_selection': False}. Best is trial 3 with value: 0.08939730523412698.
[I 2025-12-05 15:00:30,170] Trial 90 finished with value: 0.000560372097545048 and parameters: {'model_type': 'mlp', 'hidden_dims': '[256, 128]', 'dropout': 0.589758869006735, 'batch_norm': False, 'lr': 2.6436550274309448e-06, 'weight_decay': 1.4732661932519758e-05, 'epochs': 322, 'loss': 'mae', 'optimizer': 'adam', 'graph_mode': 'off', 'use_snp_selection': False}. Best is trial 3 with value: 0.08939730523412698.
[I 2025-12-05 15:00:32,077] Trial 91 finished with value: 0.05244947017070123 and parameters: {'model_type': 'mlp', 'hidden_dims': '[512, 128]', 'dropout': 0.5634505554644741, 'batch_norm': False, 'lr': 1.6108368305891433e-05, 'weight_decay': 0.00016666802802908472, 'epochs': 333, 'loss': 'mae', 'optimizer': 'adam', 'graph_mode': 'off', 'use_snp_selection': False}. Best is trial 3 with value: 0.08939730523412698.
[I 2025-12-05 15:00:33,320] Trial 92 finished with value: 0.035991398855351395 and parameters: {'model_type': 'mlp', 'hidden_dims': '[512, 128]', 'dropout': 0.3371861535730329, 'batch_norm': False, 'lr': 2.51574419046255e-05, 'weight_decay': 0.000467894204728941, 'epochs': 138, 'loss': 'mae', 'optimizer': 'adam', 'graph_mode': 'off', 'use_snp_selection': False}. Best is trial 3 with value: 0.08939730523412698.
[I 2025-12-05 15:00:34,476] Trial 93 finished with value: 0.03722076932030324 and parameters: {'model_type': 'mlp', 'hidden_dims': '[256, 128, 64]', 'dropout': 0.5491670030989619, 'batch_norm': False, 'lr': 2.1825186838045275e-05, 'weight_decay': 0.0003268669853426677, 'epochs': 252, 'loss': 'mae', 'optimizer': 'adam', 'graph_mode': 'off', 'use_snp_selection': False}. Best is trial 3 with value: 0.08939730523412698.
[I 2025-12-05 15:00:35,573] Trial 94 finished with value: 0.07000234162891451 and parameters: {'model_type': 'mlp', 'hidden_dims': '[512, 64]', 'dropout': 0.5346528210102853, 'batch_norm': False, 'lr': 6.186436237868484e-05, 'weight_decay': 0.0002314080091242245, 'epochs': 97, 'loss': 'mae', 'optimizer': 'adam', 'graph_mode': 'off', 'use_snp_selection': False}. Best is trial 3 with value: 0.08939730523412698.
[I 2025-12-05 15:00:36,665] Trial 95 finished with value: 0.039913351076445 and parameters: {'model_type': 'mlp', 'hidden_dims': '[512, 64]', 'dropout': 0.5018037920103687, 'batch_norm': False, 'lr': 0.00016085619182768996, 'weight_decay': 0.00021831869604684408, 'epochs': 96, 'loss': 'mae', 'optimizer': 'adam', 'graph_mode': 'off', 'use_snp_selection': False}. Best is trial 3 with value: 0.08939730523412698.
[I 2025-12-05 15:00:37,726] Trial 96 finished with value: 0.078289304947556 and parameters: {'model_type': 'mlp', 'hidden_dims': '[512, 64]', 'dropout': 0.5284077922354935, 'batch_norm': False, 'lr': 4.1036466548933884e-05, 'weight_decay': 0.0002545773969250953, 'epochs': 78, 'loss': 'mae', 'optimizer': 'adam', 'graph_mode': 'off', 'use_snp_selection': False}. Best is trial 3 with value: 0.08939730523412698.
[I 2025-12-05 15:00:38,755] Trial 97 finished with value: 0.06935366913760259 and parameters: {'model_type': 'mlp', 'hidden_dims': '[512, 64]', 'dropout': 0.48901960632947594, 'batch_norm': True, 'lr': 5.8333622112907507e-05, 'weight_decay': 0.00042809621068703584, 'epochs': 76, 'loss': 'mae', 'optimizer': 'adam', 'graph_mode': 'off', 'use_snp_selection': False}. Best is trial 3 with value: 0.08939730523412698.
[I 2025-12-05 15:00:39,772] Trial 98 finished with value: 0.0186749361623898 and parameters: {'model_type': 'mlp', 'hidden_dims': '[512, 64]', 'dropout': 0.4366509689464938, 'batch_norm': True, 'lr': 6.512401407012555e-05, 'weight_decay': 0.0004075331180598943, 'epochs': 73, 'loss': 'mae', 'optimizer': 'adam', 'graph_mode': 'off', 'use_snp_selection': False}. Best is trial 3 with value: 0.08939730523412698.
[I 2025-12-05 15:00:40,821] Trial 99 finished with value: 0.01684390355042234 and parameters: {'model_type': 'mlp', 'hidden_dims': '[512, 64]', 'dropout': 0.4865448329365346, 'batch_norm': True, 'lr': 0.00011373681019319431, 'weight_decay': 0.0004557094427461463, 'epochs': 82, 'loss': 'mae', 'optimizer': 'adam', 'graph_mode': 'off', 'use_snp_selection': False}. Best is trial 3 with value: 0.08939730523412698.
[I 2025-12-05 15:00:41,802] Trial 100 finished with value: 0.0017607865490582722 and parameters: {'model_type': 'mlp', 'hidden_dims': '[512, 64]', 'dropout': 0.5154446737341056, 'batch_norm': True, 'lr': 5.727649542928074e-05, 'weight_decay': 8.93959041910207e-06, 'epochs': 53, 'loss': 'mae', 'optimizer': 'adam', 'graph_mode': 'off', 'use_snp_selection': False}. Best is trial 3 with value: 0.08939730523412698.
[I 2025-12-05 15:00:42,789] Trial 101 finished with value: 0.04817975989344555 and parameters: {'model_type': 'mlp', 'hidden_dims': '[512, 64]', 'dropout': 0.53332831067366, 'batch_norm': True, 'lr': 8.441357095251512e-05, 'weight_decay': 0.0002768458218930281, 'epochs': 64, 'loss': 'mae', 'optimizer': 'adam', 'graph_mode': 'off', 'use_snp_selection': False}. Best is trial 3 with value: 0.08939730523412698.
[I 2025-12-05 15:00:43,795] Trial 102 finished with value: 0.031649688860757724 and parameters: {'model_type': 'mlp', 'hidden_dims': '[512, 64]', 'dropout': 0.4948166997234533, 'batch_norm': True, 'lr': 4.8285393578122414e-05, 'weight_decay': 0.0008176053544514538, 'epochs': 70, 'loss': 'mae', 'optimizer': 'adam', 'graph_mode': 'off', 'use_snp_selection': False}. Best is trial 3 with value: 0.08939730523412698.
[I 2025-12-05 15:00:44,880] Trial 103 finished with value: 0.03610794396174147 and parameters: {'model_type': 'mlp', 'hidden_dims': '[512, 64]', 'dropout': 0.5075774610572448, 'batch_norm': False, 'lr': 4.075738938079384e-05, 'weight_decay': 4.021923649815542e-05, 'epochs': 87, 'loss': 'mae', 'optimizer': 'adam', 'graph_mode': 'off', 'use_snp_selection': False}. Best is trial 3 with value: 0.08939730523412698.
[I 2025-12-05 15:00:46,002] Trial 104 finished with value: 0.018344801049980486 and parameters: {'model_type': 'mlp', 'hidden_dims': '[512, 64]', 'dropout': 0.5229353419861442, 'batch_norm': False, 'lr': 6.694957230374504e-05, 'weight_decay': 8.767334315648179e-05, 'epochs': 101, 'loss': 'mae', 'optimizer': 'adam', 'graph_mode': 'off', 'use_snp_selection': False}. Best is trial 3 with value: 0.08939730523412698.
[I 2025-12-05 15:00:47,039] Trial 105 finished with value: 0.0667545380572573 and parameters: {'model_type': 'mlp', 'hidden_dims': '[512, 64]', 'dropout': 0.5461346075495127, 'batch_norm': False, 'lr': 0.00010216678904554182, 'weight_decay': 0.00023641502043337634, 'epochs': 80, 'loss': 'mae', 'optimizer': 'adam', 'graph_mode': 'off', 'use_snp_selection': False}. Best is trial 3 with value: 0.08939730523412698.
[I 2025-12-05 15:00:47,954] Trial 106 finished with value: 0.010571868881393774 and parameters: {'model_type': 'mlp', 'hidden_dims': '[512, 64]', 'dropout': 0.46038430891636467, 'batch_norm': False, 'lr': 9.544866221167915e-05, 'weight_decay': 0.00012696533745525172, 'epochs': 45, 'loss': 'mae', 'optimizer': 'adam', 'graph_mode': 'off', 'use_snp_selection': False}. Best is trial 3 with value: 0.08939730523412698.
[I 2025-12-05 15:00:48,966] Trial 107 finished with value: 0.017246513250038422 and parameters: {'model_type': 'mlp', 'hidden_dims': '[512, 64]', 'dropout': 0.41911188613023376, 'batch_norm': True, 'lr': 0.00011312588960359471, 'weight_decay': 0.000184222681958562, 'epochs': 62, 'loss': 'mse', 'optimizer': 'adam', 'graph_mode': 'off', 'use_snp_selection': True, 'num_snps': 13942}. Best is trial 3 with value: 0.08939730523412698.
[I 2025-12-05 15:00:50,046] Trial 108 finished with value: 0.02306819833435659 and parameters: {'model_type': 'mlp', 'hidden_dims': '[512, 64]', 'dropout': 0.5378396675482598, 'batch_norm': False, 'lr': 5.732248180271547e-05, 'weight_decay': 0.0005377671161411893, 'epochs': 93, 'loss': 'mae', 'optimizer': 'adam', 'graph_mode': 'off', 'use_snp_selection': False}. Best is trial 3 with value: 0.08939730523412698.
[I 2025-12-05 15:00:51,189] Trial 109 finished with value: 0.051455626962099515 and parameters: {'model_type': 'mlp', 'hidden_dims': '[512, 64]', 'dropout': 0.5793607885032317, 'batch_norm': False, 'lr': 7.295384594164812e-05, 'weight_decay': 2.169240254359785e-05, 'epochs': 112, 'loss': 'mae', 'optimizer': 'adam', 'graph_mode': 'off', 'use_snp_selection': False}. Best is trial 3 with value: 0.08939730523412698.
[I 2025-12-05 15:00:52,224] Trial 110 finished with value: 0.044047253544238864 and parameters: {'model_type': 'mlp', 'hidden_dims': '[512, 64]', 'dropout': 0.47878128597110226, 'batch_norm': False, 'lr': 4.5251675028992675e-05, 'weight_decay': 5.997141249758443e-05, 'epochs': 80, 'loss': 'mae', 'optimizer': 'adam', 'graph_mode': 'off', 'use_snp_selection': False}. Best is trial 3 with value: 0.08939730523412698.
[I 2025-12-05 15:00:53,333] Trial 111 finished with value: 0.009829989078171905 and parameters: {'model_type': 'mlp', 'hidden_dims': '[512, 64]', 'dropout': 0.5452414432444952, 'batch_norm': False, 'lr': 0.0007857719611355031, 'weight_decay': 0.00023277016626845734, 'epochs': 102, 'loss': 'mae', 'optimizer': 'adam', 'graph_mode': 'off', 'use_snp_selection': False}. Best is trial 3 with value: 0.08939730523412698.
[I 2025-12-05 15:00:54,409] Trial 112 finished with value: 0.04357260728660816 and parameters: {'model_type': 'mlp', 'hidden_dims': '[512, 256]', 'dropout': 0.5068637449257088, 'batch_norm': False, 'lr': 0.00016261035945815613, 'weight_decay': 0.00024145127828339023, 'epochs': 78, 'loss': 'mae', 'optimizer': 'adam', 'graph_mode': 'off', 'use_snp_selection': False}. Best is trial 3 with value: 0.08939730523412698.
[I 2025-12-05 15:00:55,174] Trial 113 finished with value: 0.03510210902524118 and parameters: {'model_type': 'mlp', 'hidden_dims': '[256, 128]', 'dropout': 0.5271571500820256, 'batch_norm': False, 'lr': 2.9972735223882e-05, 'weight_decay': 0.00032260452723773637, 'epochs': 58, 'loss': 'mae', 'optimizer': 'adam', 'graph_mode': 'off', 'use_snp_selection': False}. Best is trial 3 with value: 0.08939730523412698.
[I 2025-12-05 15:00:55,901] Trial 114 finished with value: 0.0524956384993087 and parameters: {'model_type': 'mlp', 'hidden_dims': '[128, 64]', 'dropout': 0.5600435042214464, 'batch_norm': False, 'lr': 3.9206088307540774e-05, 'weight_decay': 0.0001969792863210973, 'epochs': 125, 'loss': 'mae', 'optimizer': 'adam', 'graph_mode': 'off', 'use_snp_selection': False}. Best is trial 3 with value: 0.08939730523412698.
[I 2025-12-05 15:00:57,062] Trial 115 finished with value: 0.05364653567031563 and parameters: {'model_type': 'mlp', 'hidden_dims': '[512, 64]', 'dropout': 0.5493811180447921, 'batch_norm': False, 'lr': 8.059815280278153e-05, 'weight_decay': 0.0001537066455269863, 'epochs': 111, 'loss': 'mae', 'optimizer': 'adam', 'graph_mode': 'off', 'use_snp_selection': False}. Best is trial 3 with value: 0.08939730523412698.
[I 2025-12-05 15:00:58,070] Trial 116 finished with value: 0.0197941065065297 and parameters: {'model_type': 'mlp', 'hidden_dims': '[512, 64]', 'dropout': 0.5996409190080496, 'batch_norm': False, 'lr': 1.4118109941835291e-05, 'weight_decay': 0.0006611873618302284, 'epochs': 72, 'loss': 'mae', 'optimizer': 'adam', 'graph_mode': 'off', 'use_snp_selection': False}. Best is trial 3 with value: 0.08939730523412698.
[I 2025-12-05 15:00:59,230] Trial 117 finished with value: 0.03827892017518518 and parameters: {'model_type': 'mlp', 'hidden_dims': '[256, 128]', 'dropout': 0.5127800074425476, 'batch_norm': False, 'lr': 1.7864301951513405e-05, 'weight_decay': 0.0002765835489667964, 'epochs': 279, 'loss': 'mae', 'optimizer': 'adam', 'graph_mode': 'off', 'use_snp_selection': False}. Best is trial 3 with value: 0.08939730523412698.
[I 2025-12-05 15:01:00,300] Trial 118 finished with value: 0.041991388615925364 and parameters: {'model_type': 'mlp', 'hidden_dims': '[512, 64]', 'dropout': 0.4948676455446399, 'batch_norm': False, 'lr': 0.00010008950873908788, 'weight_decay': 0.00010101532183257161, 'epochs': 90, 'loss': 'mae', 'optimizer': 'adam', 'graph_mode': 'off', 'use_snp_selection': False}. Best is trial 3 with value: 0.08939730523412698.
[I 2025-12-05 15:01:01,266] Trial 119 finished with value: 0.04734756168818669 and parameters: {'model_type': 'mlp', 'hidden_dims': '[128, 64]', 'dropout': 0.5295876283682771, 'batch_norm': False, 'lr': 6.236209590054517e-05, 'weight_decay': 7.448603482365135e-05, 'epochs': 344, 'loss': 'mae', 'optimizer': 'adam', 'graph_mode': 'off', 'use_snp_selection': False}. Best is trial 3 with value: 0.08939730523412698.
[I 2025-12-05 15:01:02,669] Trial 120 finished with value: -0.003973954890219149 and parameters: {'model_type': 'mlp', 'hidden_dims': '[512, 128]', 'dropout': 0.5396247047841018, 'batch_norm': True, 'lr': 2.073583114133989e-05, 'weight_decay': 0.0004672679397658512, 'epochs': 183, 'loss': 'mae', 'optimizer': 'adam', 'graph_mode': 'off', 'use_snp_selection': False}. Best is trial 3 with value: 0.08939730523412698.
[I 2025-12-05 15:01:03,928] Trial 121 finished with value: 0.02161721234854772 and parameters: {'model_type': 'mlp', 'hidden_dims': '[256, 128, 64]', 'dropout': 0.5717257760209365, 'batch_norm': False, 'lr': 5.164623689094152e-05, 'weight_decay': 0.0003348880262503503, 'epochs': 325, 'loss': 'mae', 'optimizer': 'adam', 'graph_mode': 'off', 'use_snp_selection': False}. Best is trial 3 with value: 0.08939730523412698.
[I 2025-12-05 15:01:05,162] Trial 122 finished with value: 0.04705302514553761 and parameters: {'model_type': 'mlp', 'hidden_dims': '[256, 128, 64]', 'dropout': 0.5860786110001674, 'batch_norm': False, 'lr': 3.273864485989144e-05, 'weight_decay': 0.000402154630225619, 'epochs': 312, 'loss': 'mae', 'optimizer': 'adam', 'graph_mode': 'off', 'use_snp_selection': False}. Best is trial 3 with value: 0.08939730523412698.
[I 2025-12-05 15:01:06,431] Trial 123 finished with value: 0.020550817629256715 and parameters: {'model_type': 'mlp', 'hidden_dims': '[256, 128, 64]', 'dropout': 0.561306164465835, 'batch_norm': False, 'lr': 2.8000508509560997e-05, 'weight_decay': 0.0003372245524813948, 'epochs': 330, 'loss': 'mae', 'optimizer': 'adam', 'graph_mode': 'off', 'use_snp_selection': False}. Best is trial 3 with value: 0.08939730523412698.
[I 2025-12-05 15:01:07,737] Trial 124 finished with value: 0.04218634760713084 and parameters: {'model_type': 'mlp', 'hidden_dims': '[256, 128, 64]', 'dropout': 0.5780940998539024, 'batch_norm': False, 'lr': 3.464752036405799e-05, 'weight_decay': 0.0005743929653951327, 'epochs': 319, 'loss': 'mae', 'optimizer': 'adam', 'graph_mode': 'off', 'use_snp_selection': False}. Best is trial 3 with value: 0.08939730523412698.
[I 2025-12-05 15:01:09,036] Trial 125 finished with value: 0.026974260351334562 and parameters: {'model_type': 'mlp', 'hidden_dims': '[256, 128, 64]', 'dropout': 0.5512691499387508, 'batch_norm': False, 'lr': 4.327068576326252e-05, 'weight_decay': 5.946116926854065e-06, 'epochs': 343, 'loss': 'mae', 'optimizer': 'adam', 'graph_mode': 'off', 'use_snp_selection': False}. Best is trial 3 with value: 0.08939730523412698.
[I 2025-12-05 15:01:11,329] Trial 126 finished with value: 0.03176395715356931 and parameters: {'model_type': 'mlp', 'hidden_dims': '[512, 64]', 'dropout': 0.5237870154646426, 'batch_norm': False, 'lr': 7.170990310657234e-06, 'weight_decay': 0.0002599532525231117, 'epochs': 301, 'loss': 'mae', 'optimizer': 'adam', 'graph_mode': 'off', 'use_snp_selection': True, 'num_snps': 37890}. Best is trial 3 with value: 0.08939730523412698.
[I 2025-12-05 15:01:12,382] Trial 127 finished with value: 0.017369156654937136 and parameters: {'model_type': 'mlp', 'hidden_dims': '[512, 256]', 'dropout': 0.5662339155864216, 'batch_norm': False, 'lr': 1.043136371316307e-05, 'weight_decay': 0.0008245937529128958, 'epochs': 84, 'loss': 'mae', 'optimizer': 'adam', 'graph_mode': 'off', 'use_snp_selection': False}. Best is trial 3 with value: 0.08939730523412698.
[I 2025-12-05 15:01:13,448] Trial 128 finished with value: 0.04394641404065143 and parameters: {'model_type': 'mlp', 'hidden_dims': '[256, 128]', 'dropout': 0.4796381666818692, 'batch_norm': False, 'lr': 0.00013193441689458296, 'weight_decay': 1.2075792421668848e-05, 'epochs': 228, 'loss': 'mse', 'optimizer': 'adam', 'graph_mode': 'off', 'use_snp_selection': False}. Best is trial 3 with value: 0.08939730523412698.
[I 2025-12-05 15:01:14,735] Trial 129 finished with value: 0.04487117879760953 and parameters: {'model_type': 'mlp', 'hidden_dims': '[256, 128, 64]', 'dropout': 0.5371583424062629, 'batch_norm': False, 'lr': 2.3521459713429105e-05, 'weight_decay': 0.00014613419055604408, 'epochs': 338, 'loss': 'mae', 'optimizer': 'adam', 'graph_mode': 'off', 'use_snp_selection': False}. Best is trial 3 with value: 0.08939730523412698.
[I 2025-12-05 15:01:15,733] Trial 130 finished with value: 0.03332896571966806 and parameters: {'model_type': 'mlp', 'hidden_dims': '[512, 128]', 'dropout': 0.5932845957597637, 'batch_norm': False, 'lr': 5.232669735745979e-05, 'weight_decay': 0.000198753745480542, 'epochs': 68, 'loss': 'mae', 'optimizer': 'adam', 'graph_mode': 'off', 'use_snp_selection': False}. Best is trial 3 with value: 0.08939730523412698.
[I 2025-12-05 15:01:16,905] Trial 131 finished with value: 0.06950812138422438 and parameters: {'model_type': 'mlp', 'hidden_dims': '[512, 128]', 'dropout': 0.552345216160591, 'batch_norm': False, 'lr': 1.624554887822585e-05, 'weight_decay': 0.0003098910443818485, 'epochs': 119, 'loss': 'mae', 'optimizer': 'adam', 'graph_mode': 'off', 'use_snp_selection': False}. Best is trial 3 with value: 0.08939730523412698.
[I 2025-12-05 15:01:18,386] Trial 132 finished with value: 0.03920030149603634 and parameters: {'model_type': 'mlp', 'hidden_dims': '[512, 128]', 'dropout': 0.5528702728493304, 'batch_norm': False, 'lr': 1.4866067588616283e-05, 'weight_decay': 0.0003141368804462733, 'epochs': 209, 'loss': 'mae', 'optimizer': 'adam', 'graph_mode': 'off', 'use_snp_selection': False}. Best is trial 3 with value: 0.08939730523412698.
[I 2025-12-05 15:01:19,563] Trial 133 finished with value: 0.05054749727628464 and parameters: {'model_type': 'mlp', 'hidden_dims': '[512, 128]', 'dropout': 0.5190740487446086, 'batch_norm': False, 'lr': 1.2228249090177415e-05, 'weight_decay': 0.00041546170964458414, 'epochs': 117, 'loss': 'mae', 'optimizer': 'adam', 'graph_mode': 'off', 'use_snp_selection': False}. Best is trial 3 with value: 0.08939730523412698.
[I 2025-12-05 15:01:20,713] Trial 134 finished with value: 0.013164299130790817 and parameters: {'model_type': 'mlp', 'hidden_dims': '[512, 128]', 'dropout': 0.5735792805558403, 'batch_norm': False, 'lr': 1.956182172747643e-05, 'weight_decay': 0.00023429784897054643, 'epochs': 103, 'loss': 'mae', 'optimizer': 'adam', 'graph_mode': 'off', 'use_snp_selection': False}. Best is trial 3 with value: 0.08939730523412698.
[I 2025-12-05 15:01:21,419] Trial 135 finished with value: 0.01287467399023124 and parameters: {'model_type': 'mlp', 'hidden_dims': '[128, 64]', 'dropout': 0.49944706109833803, 'batch_norm': False, 'lr': 1.6720578136998953e-05, 'weight_decay': 0.00036398963107968086, 'epochs': 92, 'loss': 'mae', 'optimizer': 'adam', 'graph_mode': 'off', 'use_snp_selection': False}. Best is trial 3 with value: 0.08939730523412698.
[I 2025-12-05 15:01:22,544] Trial 136 finished with value: 0.029633169284480954 and parameters: {'model_type': 'mlp', 'hidden_dims': '[512, 64]', 'dropout': 0.5425225295999151, 'batch_norm': False, 'lr': 2.380635370393995e-06, 'weight_decay': 0.0002824972024358677, 'epochs': 97, 'loss': 'mae', 'optimizer': 'adam', 'graph_mode': 'off', 'use_snp_selection': False}. Best is trial 3 with value: 0.08939730523412698.
[I 2025-12-05 15:01:23,743] Trial 137 finished with value: 0.053244578676464364 and parameters: {'model_type': 'mlp', 'hidden_dims': '[512, 128]', 'dropout': 0.5602794560702066, 'batch_norm': False, 'lr': 3.4251964519432795e-05, 'weight_decay': 7.602003578250668e-06, 'epochs': 125, 'loss': 'mae', 'optimizer': 'adam', 'graph_mode': 'off', 'use_snp_selection': False}. Best is trial 3 with value: 0.08939730523412698.
[I 2025-12-05 15:01:25,065] Trial 138 finished with value: 0.04167654211896257 and parameters: {'model_type': 'mlp', 'hidden_dims': '[256, 128, 64]', 'dropout': 0.5091696145457776, 'batch_norm': True, 'lr': 7.592977617715923e-05, 'weight_decay': 0.00018799277927047283, 'epochs': 334, 'loss': 'mae', 'optimizer': 'adam', 'graph_mode': 'off', 'use_snp_selection': False}. Best is trial 3 with value: 0.08939730523412698.
[I 2025-12-05 15:01:26,221] Trial 139 finished with value: 0.00632351697053523 and parameters: {'model_type': 'mlp', 'hidden_dims': '[512, 64]', 'dropout': 0.5328909792086307, 'batch_norm': False, 'lr': 2.626064968136387e-05, 'weight_decay': 0.0005586103630186783, 'epochs': 110, 'loss': 'mae', 'optimizer': 'adam', 'graph_mode': 'off', 'use_snp_selection': False}. Best is trial 3 with value: 0.08939730523412698.
[I 2025-12-05 15:01:27,483] Trial 140 finished with value: 0.05681420836683694 and parameters: {'model_type': 'mlp', 'hidden_dims': '[512, 128]', 'dropout': 0.5826133154145224, 'batch_norm': False, 'lr': 0.00010289520610710951, 'weight_decay': 4.7462786759382084e-05, 'epochs': 143, 'loss': 'mae', 'optimizer': 'adam', 'graph_mode': 'off', 'use_snp_selection': False}. Best is trial 3 with value: 0.08939730523412698.
