[I 2025-12-06 09:58:25,937] Trial 38 finished with value: 0.2244800269974528 and parameters: {'model_type': 'mlp', 'hidden_dims': '[512, 256]', 'dropout': 0.3709839603566887, 'batch_norm': True, 'lr': 2.414166076147122e-06, 'weight_decay': 2.626208069570169e-06, 'epochs': 191, 'loss': 'mse', 'optimizer': 'adam', 'graph_mode': 'off', 'use_snp_selection': True, 'num_snps': 51979}. Best is trial 31 with value: 0.2766321586300571.
[I 2025-12-06 10:00:30,972] Trial 39 finished with value: 0.27671488886099627 and parameters: {'model_type': 'mlp', 'hidden_dims': '[512, 256]', 'dropout': 0.4306397443536212, 'batch_norm': False, 'lr': 1.5211408032241199e-06, 'weight_decay': 5.040439716504656e-07, 'epochs': 287, 'loss': 'mae', 'optimizer': 'adam', 'graph_mode': 'off', 'use_snp_selection': True, 'num_snps': 59791}. Best is trial 39 with value: 0.27671488886099627.
[I 2025-12-06 10:01:36,568] Trial 40 finished with value: 0.17645605208639029 and parameters: {'model_type': 'mlp', 'hidden_dims': '[256, 128, 64]', 'dropout': 0.4218864829666502, 'batch_norm': True, 'lr': 1.5699343762165312e-06, 'weight_decay': 4.1770229121554266e-07, 'epochs': 290, 'loss': 'mae', 'optimizer': 'adam', 'graph_mode': 'off', 'use_snp_selection': True, 'num_snps': 35535}. Best is trial 39 with value: 0.27671488886099627.
[I 2025-12-06 10:03:35,235] Trial 41 finished with value: 0.2610758848048268 and parameters: {'model_type': 'mlp', 'hidden_dims': '[512, 256]', 'dropout': 0.5067628081654255, 'batch_norm': False, 'lr': 1.656805556800002e-06, 'weight_decay': 1.4236932925193566e-06, 'epochs': 263, 'loss': 'mae', 'optimizer': 'adam', 'graph_mode': 'off', 'use_snp_selection': True, 'num_snps': 59639}. Best is trial 39 with value: 0.27671488886099627.
[I 2025-12-06 10:05:30,913] Trial 42 finished with value: 0.2599648764550674 and parameters: {'model_type': 'mlp', 'hidden_dims': '[512, 256]', 'dropout': 0.44719801911655466, 'batch_norm': False, 'lr': 3.7956408620828664e-06, 'weight_decay': 1.9022422861624577e-07, 'epochs': 288, 'loss': 'mae', 'optimizer': 'adam', 'graph_mode': 'off', 'use_snp_selection': True, 'num_snps': 54070}. Best is trial 39 with value: 0.27671488886099627.
[I 2025-12-06 10:06:44,728] Trial 43 finished with value: 0.25919529164280186 and parameters: {'model_type': 'mlp', 'hidden_dims': '[512, 256]', 'dropout': 0.5157142775588985, 'batch_norm': False, 'lr': 2.2097483818132857e-06, 'weight_decay': 5.385383504540388e-07, 'epochs': 133, 'loss': 'mae', 'optimizer': 'adam', 'graph_mode': 'off', 'use_snp_selection': True, 'num_snps': 47565}. Best is trial 39 with value: 0.27671488886099627.
[I 2025-12-06 10:08:14,703] Trial 44 finished with value: 0.2535854958055653 and parameters: {'model_type': 'mlp', 'hidden_dims': '[512, 256]', 'dropout': 0.5627769445423525, 'batch_norm': False, 'lr': 0.00011511907739587827, 'weight_decay': 1.0603322239329904e-06, 'epochs': 156, 'loss': 'mae', 'optimizer': 'adam', 'graph_mode': 'off', 'use_snp_selection': True, 'num_snps': 59635}. Best is trial 39 with value: 0.27671488886099627.
[I 2025-12-06 10:09:48,202] Trial 45 finished with value: 0.23463897064263345 and parameters: {'model_type': 'mlp', 'hidden_dims': '[512, 256]', 'dropout': 0.467077096307295, 'batch_norm': False, 'lr': 1.3151488114458439e-06, 'weight_decay': 4.331646762452793e-06, 'epochs': 190, 'loss': 'mse', 'optimizer': 'adam', 'graph_mode': 'off', 'use_snp_selection': True, 'num_snps': 55232}. Best is trial 39 with value: 0.27671488886099627.
[I 2025-12-06 10:11:35,899] Trial 46 finished with value: 0.20648872033824248 and parameters: {'model_type': 'mlp', 'hidden_dims': '[512, 128]', 'dropout': 0.4026764109824789, 'batch_norm': True, 'lr': 9.254265850873523e-06, 'weight_decay': 2.220620942170529e-06, 'epochs': 332, 'loss': 'mae', 'optimizer': 'adam', 'graph_mode': 'off', 'use_snp_selection': True, 'num_snps': 44663}. Best is trial 39 with value: 0.27671488886099627.
[I 2025-12-06 10:12:52,527] Trial 47 finished with value: 0.2566326375884139 and parameters: {'model_type': 'mlp', 'hidden_dims': '[256, 128]', 'dropout': 0.26729916930629344, 'batch_norm': False, 'lr': 4.19998332534894e-05, 'weight_decay': 1.3202014105671873e-05, 'epochs': 276, 'loss': 'mae', 'optimizer': 'adam', 'graph_mode': 'off', 'use_snp_selection': True, 'num_snps': 49868}. Best is trial 39 with value: 0.27671488886099627.
[I 2025-12-06 10:14:15,081] Trial 48 finished with value: 0.26645474455034884 and parameters: {'model_type': 'mlp', 'hidden_dims': '[512, 256]', 'dropout': 0.3683463474681907, 'batch_norm': False, 'lr': 2.289534687646472e-06, 'weight_decay': 7.0731221383491475e-06, 'epochs': 213, 'loss': 'mae', 'optimizer': 'adam', 'graph_mode': 'off', 'use_snp_selection': True, 'num_snps': 42544}. Best is trial 39 with value: 0.27671488886099627.
[I 2025-12-06 10:16:00,544] Trial 49 finished with value: 0.2611140908285857 and parameters: {'model_type': 'mlp', 'hidden_dims': '[512, 256]', 'dropout': 0.49176029057258824, 'batch_norm': False, 'lr': 3.876342292543653e-06, 'weight_decay': 5.075024467781556e-07, 'epochs': 230, 'loss': 'mse', 'optimizer': 'adam', 'graph_mode': 'off', 'use_snp_selection': True, 'num_snps': 56135}. Best is trial 39 with value: 0.27671488886099627.
[I 2025-12-06 10:16:48,386] Trial 50 finished with value: 0.2590909730971582 and parameters: {'model_type': 'mlp', 'hidden_dims': '[128, 64]', 'dropout': 0.4328844394239148, 'batch_norm': False, 'lr': 7.978479716741764e-06, 'weight_decay': 2.572482564362951e-07, 'epochs': 349, 'loss': 'mae', 'optimizer': 'adam', 'graph_mode': 'off', 'use_snp_selection': True, 'num_snps': 24662}. Best is trial 39 with value: 0.27671488886099627.
[I 2025-12-06 10:17:07,321] Trial 51 finished with value: 0.2594194036103764 and parameters: {'model_type': 'mlp', 'hidden_dims': '[512, 64]', 'dropout': 0.5681970017298646, 'batch_norm': False, 'lr': 1.4906012153166078e-05, 'weight_decay': 2.785345592574247e-05, 'epochs': 42, 'loss': 'mae', 'optimizer': 'adam', 'graph_mode': 'off', 'use_snp_selection': False}. Best is trial 39 with value: 0.27671488886099627.
[I 2025-12-06 10:18:41,983] Trial 52 finished with value: 0.2707179554425907 and parameters: {'model_type': 'mlp', 'hidden_dims': '[512, 64]', 'dropout': 0.5932786549616261, 'batch_norm': False, 'lr': 4.591417473124761e-06, 'weight_decay': 2.0451622871516576e-05, 'epochs': 316, 'loss': 'mae', 'optimizer': 'adam', 'graph_mode': 'off', 'use_snp_selection': False}. Best is trial 39 with value: 0.27671488886099627.
[I 2025-12-06 10:20:17,185] Trial 53 finished with value: 0.26201097246943994 and parameters: {'model_type': 'mlp', 'hidden_dims': '[512, 64]', 'dropout': 0.5218155403822403, 'batch_norm': False, 'lr': 4.967939297181686e-06, 'weight_decay': 3.858758832609968e-05, 'epochs': 315, 'loss': 'mae', 'optimizer': 'adam', 'graph_mode': 'off', 'use_snp_selection': False}. Best is trial 39 with value: 0.27671488886099627.
[I 2025-12-06 10:21:48,399] Trial 54 finished with value: 0.275534093464074 and parameters: {'model_type': 'mlp', 'hidden_dims': '[512, 256]', 'dropout': 0.47409914900825484, 'batch_norm': False, 'lr': 1.3166240051862259e-06, 'weight_decay': 1.643646710917371e-05, 'epochs': 298, 'loss': 'mae', 'optimizer': 'adam', 'graph_mode': 'off', 'use_snp_selection': False}. Best is trial 39 with value: 0.27671488886099627.
[I 2025-12-06 10:23:20,458] Trial 55 finished with value: 0.26573889890911045 and parameters: {'model_type': 'mlp', 'hidden_dims': '[512, 256]', 'dropout': 0.4703884122000809, 'batch_norm': False, 'lr': 1.3252462592336058e-06, 'weight_decay': 1.42169635377926e-05, 'epochs': 301, 'loss': 'mae', 'optimizer': 'adam', 'graph_mode': 'off', 'use_snp_selection': False}. Best is trial 39 with value: 0.27671488886099627.
[I 2025-12-06 10:24:44,409] Trial 56 finished with value: 0.24846621216540749 and parameters: {'model_type': 'mlp', 'hidden_dims': '[512, 256]', 'dropout': 0.4737713774232094, 'batch_norm': False, 'lr': 3.0084913897128202e-06, 'weight_decay': 0.0007580672327126504, 'epochs': 272, 'loss': 'mae', 'optimizer': 'adam', 'graph_mode': 'off', 'use_snp_selection': False}. Best is trial 39 with value: 0.27671488886099627.
[I 2025-12-06 10:26:03,298] Trial 57 finished with value: 0.24429104352884998 and parameters: {'model_type': 'mlp', 'hidden_dims': '[512, 256]', 'dropout': 0.5003277297632022, 'batch_norm': True, 'lr': 0.00034321292087354833, 'weight_decay': 3.582838495011957e-06, 'epochs': 252, 'loss': 'mae', 'optimizer': 'adam', 'graph_mode': 'off', 'use_snp_selection': False}. Best is trial 39 with value: 0.27671488886099627.
[I 2025-12-06 10:27:35,223] Trial 58 finished with value: 0.26163419302904783 and parameters: {'model_type': 'mlp', 'hidden_dims': '[512, 128]', 'dropout': 0.44640517865002766, 'batch_norm': False, 'lr': 1.0515545348915543e-06, 'weight_decay': 7.660955888986791e-07, 'epochs': 302, 'loss': 'mae', 'optimizer': 'adam', 'graph_mode': 'off', 'use_snp_selection': False}. Best is trial 39 with value: 0.27671488886099627.
[I 2025-12-06 10:29:25,609] Trial 59 finished with value: 0.27340830560579726 and parameters: {'model_type': 'mlp', 'hidden_dims': '[512, 256]', 'dropout': 0.4188313348412014, 'batch_norm': False, 'lr': 1.8768508016790368e-06, 'weight_decay': 6.74544716154396e-06, 'epochs': 335, 'loss': 'mae', 'optimizer': 'adam', 'graph_mode': 'off', 'use_snp_selection': True, 'num_snps': 45548}. Best is trial 39 with value: 0.27671488886099627.
[I 2025-12-06 10:30:36,110] Trial 60 finished with value: 0.263686609358987 and parameters: {'model_type': 'mlp', 'hidden_dims': '[256, 128, 64]', 'dropout': 0.41298822188330564, 'batch_norm': False, 'lr': 1.8882841100727503e-06, 'weight_decay': 5.693861282891927e-06, 'epochs': 336, 'loss': 'mae', 'optimizer': 'adam', 'graph_mode': 'off', 'use_snp_selection': True, 'num_snps': 37647}. Best is trial 39 with value: 0.27671488886099627.
[I 2025-12-06 10:32:19,804] Trial 61 finished with value: 0.2625625834910786 and parameters: {'model_type': 'mlp', 'hidden_dims': '[512, 256]', 'dropout': 0.39481052039166653, 'batch_norm': False, 'lr': 1.377676951554039e-06, 'weight_decay': 1.294091687569356e-06, 'epochs': 297, 'loss': 'mae', 'optimizer': 'adam', 'graph_mode': 'off', 'use_snp_selection': True, 'num_snps': 45475}. Best is trial 39 with value: 0.27671488886099627.
[I 2025-12-06 10:33:45,195] Trial 62 finished with value: 0.2687354867912975 and parameters: {'model_type': 'mlp', 'hidden_dims': '[512, 256]', 'dropout': 0.43709574958653263, 'batch_norm': False, 'lr': 2.5334313187310763e-06, 'weight_decay': 1.82201708006737e-06, 'epochs': 328, 'loss': 'mae', 'optimizer': 'adam', 'graph_mode': 'off', 'use_snp_selection': True, 'num_snps': 32373}. Best is trial 39 with value: 0.27671488886099627.
[I 2025-12-06 10:35:36,925] Trial 63 finished with value: 0.2748615934534045 and parameters: {'model_type': 'mlp', 'hidden_dims': '[512, 256]', 'dropout': 0.45723222206562514, 'batch_norm': False, 'lr': 2.0145374202734004e-06, 'weight_decay': 8.01324025622212e-06, 'epochs': 288, 'loss': 'mae', 'optimizer': 'adam', 'graph_mode': 'off', 'use_snp_selection': True, 'num_snps': 51716}. Best is trial 39 with value: 0.27671488886099627.
[I 2025-12-06 10:37:24,191] Trial 64 finished with value: 0.2749991373576351 and parameters: {'model_type': 'mlp', 'hidden_dims': '[512, 256]', 'dropout': 0.3286860418120392, 'batch_norm': False, 'lr': 2.0143759303846435e-06, 'weight_decay': 8.296317807992093e-06, 'epochs': 280, 'loss': 'mae', 'optimizer': 'adam', 'graph_mode': 'off', 'use_snp_selection': True, 'num_snps': 49886}. Best is trial 39 with value: 0.27671488886099627.
[I 2025-12-06 10:39:13,872] Trial 65 finished with value: 0.26024981436446815 and parameters: {'model_type': 'mlp', 'hidden_dims': '[512, 256]', 'dropout': 0.3274108861035045, 'batch_norm': False, 'lr': 1.864944035494262e-06, 'weight_decay': 1.7538151441474087e-05, 'epochs': 284, 'loss': 'mae', 'optimizer': 'adam', 'graph_mode': 'off', 'use_snp_selection': True, 'num_snps': 51036}. Best is trial 39 with value: 0.27671488886099627.
[I 2025-12-06 10:41:05,771] Trial 66 finished with value: 0.2616991834680606 and parameters: {'model_type': 'mlp', 'hidden_dims': '[512, 256]', 'dropout': 0.370994549584134, 'batch_norm': False, 'lr': 3.230189597513754e-06, 'weight_decay': 8.551050401426476e-06, 'epochs': 269, 'loss': 'mae', 'optimizer': 'adam', 'graph_mode': 'off', 'use_snp_selection': True, 'num_snps': 54895}. Best is trial 39 with value: 0.27671488886099627.
[I 2025-12-06 10:42:50,955] Trial 67 finished with value: 0.25709256389775115 and parameters: {'model_type': 'mlp', 'hidden_dims': '[512, 256]', 'dropout': 0.4633351652767236, 'batch_norm': False, 'lr': 1.3739985703717424e-06, 'weight_decay': 3.284491446792779e-05, 'epochs': 280, 'loss': 'mae', 'optimizer': 'adam', 'graph_mode': 'off', 'use_snp_selection': True, 'num_snps': 48864}. Best is trial 39 with value: 0.27671488886099627.
[I 2025-12-06 10:44:39,841] Trial 68 finished with value: 0.25972283113284933 and parameters: {'model_type': 'mlp', 'hidden_dims': '[512, 256]', 'dropout': 0.42244359389927744, 'batch_norm': False, 'lr': 2.1548164600083845e-06, 'weight_decay': 6.725283668767592e-05, 'epochs': 343, 'loss': 'mse', 'optimizer': 'adam', 'graph_mode': 'off', 'use_snp_selection': True, 'num_snps': 44878}. Best is trial 39 with value: 0.27671488886099627.
[I 2025-12-06 10:45:44,279] Trial 69 finished with value: 0.24786205239709713 and parameters: {'model_type': 'mlp', 'hidden_dims': '[128, 64]', 'dropout': 0.49148687716846823, 'batch_norm': False, 'lr': 2.728185477785994e-06, 'weight_decay': 1.0433543845238862e-05, 'epochs': 243, 'loss': 'mae', 'optimizer': 'adam', 'graph_mode': 'off', 'use_snp_selection': True, 'num_snps': 56498}. Best is trial 39 with value: 0.27671488886099627.
[I 2025-12-06 10:47:08,328] Trial 70 finished with value: 0.2666087548959214 and parameters: {'model_type': 'mlp', 'hidden_dims': '[256, 128]', 'dropout': 0.38264755658941607, 'batch_norm': False, 'lr': 1.7190214299407475e-06, 'weight_decay': 6.915750261444808e-06, 'epochs': 311, 'loss': 'mae', 'optimizer': 'adam', 'graph_mode': 'off', 'use_snp_selection': True, 'num_snps': 52611}. Best is trial 39 with value: 0.27671488886099627.
[I 2025-12-06 10:48:37,524] Trial 71 finished with value: 0.2700621833108911 and parameters: {'model_type': 'mlp', 'hidden_dims': '[512, 256]', 'dropout': 0.3014174908557307, 'batch_norm': False, 'lr': 1.0012825032450837e-06, 'weight_decay': 4.294569881656876e-06, 'epochs': 294, 'loss': 'mae', 'optimizer': 'adam', 'graph_mode': 'off', 'use_snp_selection': False}. Best is trial 39 with value: 0.27671488886099627.
[I 2025-12-06 10:50:03,848] Trial 72 finished with value: 0.2551720353407337 and parameters: {'model_type': 'mlp', 'hidden_dims': '[512, 256]', 'dropout': 0.33197863005030986, 'batch_norm': False, 'lr': 3.528776413823445e-06, 'weight_decay': 3.7512647927975922e-06, 'epochs': 264, 'loss': 'mae', 'optimizer': 'adam', 'graph_mode': 'off', 'use_snp_selection': True, 'num_snps': 39159}. Best is trial 39 with value: 0.27671488886099627.
[I 2025-12-06 10:51:12,743] Trial 73 finished with value: 0.21181722735003894 and parameters: {'model_type': 'mlp', 'hidden_dims': '[512, 256]', 'dropout': 0.2731517110744733, 'batch_norm': False, 'lr': 1.2331169279642926e-06, 'weight_decay': 1.4284556208335172e-05, 'epochs': 78, 'loss': 'mae', 'optimizer': 'adam', 'graph_mode': 'off', 'use_snp_selection': True, 'num_snps': 57574}. Best is trial 39 with value: 0.27671488886099627.
[I 2025-12-06 10:52:50,143] Trial 74 finished with value: 0.2669468228085162 and parameters: {'model_type': 'mlp', 'hidden_dims': '[512, 256]', 'dropout': 0.3573328233739269, 'batch_norm': False, 'lr': 6.539145879495885e-06, 'weight_decay': 6.86617614533513e-06, 'epochs': 324, 'loss': 'mae', 'optimizer': 'adam', 'graph_mode': 'off', 'use_snp_selection': False}. Best is trial 39 with value: 0.27671488886099627.
[I 2025-12-06 10:54:37,869] Trial 75 finished with value: 0.14688985384547318 and parameters: {'model_type': 'mlp', 'hidden_dims': '[512, 256]', 'dropout': 0.243467754723735, 'batch_norm': True, 'lr': 1.5731401850863239e-06, 'weight_decay': 2.582367848804418e-06, 'epochs': 302, 'loss': 'mae', 'optimizer': 'adam', 'graph_mode': 'off', 'use_snp_selection': True, 'num_snps': 46996}. Best is trial 39 with value: 0.27671488886099627.
[I 2025-12-06 10:56:13,318] Trial 76 finished with value: 0.26817389811656855 and parameters: {'model_type': 'mlp', 'hidden_dims': '[512, 256]', 'dropout': 0.30932162869662116, 'batch_norm': False, 'lr': 2.729710720896586e-06, 'weight_decay': 1.844159713421208e-05, 'epochs': 285, 'loss': 'mae', 'optimizer': 'adam', 'graph_mode': 'off', 'use_snp_selection': True, 'num_snps': 42863}. Best is trial 39 with value: 0.27671488886099627.
[I 2025-12-06 10:57:44,622] Trial 77 finished with value: 0.25522309739007587 and parameters: {'model_type': 'mlp', 'hidden_dims': '[512, 128]', 'dropout': 0.29003015313576247, 'batch_norm': False, 'lr': 9.783479620170457e-05, 'weight_decay': 5.180308911680085e-06, 'epochs': 309, 'loss': 'mae', 'optimizer': 'adam', 'graph_mode': 'off', 'use_snp_selection': False}. Best is trial 39 with value: 0.27671488886099627.
[I 2025-12-06 10:58:53,620] Trial 78 finished with value: 0.2693042461333491 and parameters: {'model_type': 'mlp', 'hidden_dims': '[256, 128, 64]', 'dropout': 0.48385141830105327, 'batch_norm': False, 'lr': 1.9856624759188243e-06, 'weight_decay': 1.0228098808652018e-05, 'epochs': 339, 'loss': 'mae', 'optimizer': 'adam', 'graph_mode': 'off', 'use_snp_selection': True, 'num_snps': 35367}. Best is trial 39 with value: 0.27671488886099627.
[I 2025-12-06 10:59:45,436] Trial 79 finished with value: 0.24184353544533277 and parameters: {'model_type': 'mlp', 'hidden_dims': '[512, 256]', 'dropout': 0.5333749524496554, 'batch_norm': False, 'lr': 1.519270320220984e-06, 'weight_decay': 3.235804516153636e-06, 'epochs': 278, 'loss': 'mse', 'optimizer': 'adam', 'graph_mode': 'off', 'use_snp_selection': True, 'num_snps': 15002}. Best is trial 39 with value: 0.27671488886099627.
[I 2025-12-06 11:01:21,779] Trial 80 finished with value: 0.2701136605092699 and parameters: {'model_type': 'mlp', 'hidden_dims': '[512, 256]', 'dropout': 0.4546252285341769, 'batch_norm': False, 'lr': 1.2162142869072373e-06, 'weight_decay': 6.0192640649987435e-06, 'epochs': 320, 'loss': 'mae', 'optimizer': 'adam', 'graph_mode': 'off', 'use_snp_selection': False}. Best is trial 39 with value: 0.27671488886099627.
[I 2025-12-06 11:03:01,312] Trial 81 finished with value: 0.2677136142209871 and parameters: {'model_type': 'mlp', 'hidden_dims': '[512, 256]', 'dropout': 0.513507530862375, 'batch_norm': False, 'lr': 2.4681051284465296e-06, 'weight_decay': 2.130323126242177e-06, 'epochs': 205, 'loss': 'mae', 'optimizer': 'adam', 'graph_mode': 'off', 'use_snp_selection': True, 'num_snps': 56900}. Best is trial 39 with value: 0.27671488886099627.
[I 2025-12-06 11:04:44,147] Trial 82 finished with value: 0.2753182009742273 and parameters: {'model_type': 'mlp', 'hidden_dims': '[512, 256]', 'dropout': 0.4814172181405379, 'batch_norm': False, 'lr': 3.967411640169604e-06, 'weight_decay': 6.882114829844578e-07, 'epochs': 252, 'loss': 'mae', 'optimizer': 'adam', 'graph_mode': 'off', 'use_snp_selection': True, 'num_snps': 51080}. Best is trial 39 with value: 0.27671488886099627.
[I 2025-12-06 11:06:28,030] Trial 83 finished with value: 0.2775974438816244 and parameters: {'model_type': 'mlp', 'hidden_dims': '[512, 256]', 'dropout': 0.47843929855517014, 'batch_norm': False, 'lr': 1.917691616961292e-06, 'weight_decay': 6.802089018784302e-07, 'epochs': 254, 'loss': 'mae', 'optimizer': 'adam', 'graph_mode': 'off', 'use_snp_selection': True, 'num_snps': 51528}. Best is trial 83 with value: 0.2775974438816244.
[I 2025-12-06 11:08:06,142] Trial 84 finished with value: 0.2631507709052523 and parameters: {'model_type': 'mlp', 'hidden_dims': '[512, 256]', 'dropout': 0.48239051104038266, 'batch_norm': False, 'lr': 2.0336009155883477e-06, 'weight_decay': 6.711802115649933e-07, 'epochs': 237, 'loss': 'mae', 'optimizer': 'adam', 'graph_mode': 'off', 'use_snp_selection': True, 'num_snps': 49876}. Best is trial 83 with value: 0.2775974438816244.
[I 2025-12-06 11:09:52,040] Trial 85 finished with value: 0.2607133924043742 and parameters: {'model_type': 'mlp', 'hidden_dims': '[512, 256]', 'dropout': 0.440529496931, 'batch_norm': False, 'lr': 3.5282316716252405e-06, 'weight_decay': 3.3322504323405754e-07, 'epochs': 251, 'loss': 'mae', 'optimizer': 'adam', 'graph_mode': 'off', 'use_snp_selection': True, 'num_snps': 53216}. Best is trial 83 with value: 0.2775974438816244.
[I 2025-12-06 11:11:32,278] Trial 86 finished with value: 0.2614831315888421 and parameters: {'model_type': 'mlp', 'hidden_dims': '[512, 256]', 'dropout': 0.46211431641411144, 'batch_norm': False, 'lr': 1.503963469955222e-06, 'weight_decay': 1.0788680626384525e-06, 'epochs': 260, 'loss': 'mae', 'optimizer': 'adam', 'graph_mode': 'off', 'use_snp_selection': True, 'num_snps': 48095}. Best is trial 83 with value: 0.2775974438816244.
[I 2025-12-06 11:13:20,110] Trial 87 finished with value: 0.2626298407757583 and parameters: {'model_type': 'mlp', 'hidden_dims': '[512, 256]', 'dropout': 0.5014500277827092, 'batch_norm': False, 'lr': 1.8222821000930133e-06, 'weight_decay': 4.1494825316237723e-07, 'epochs': 272, 'loss': 'mae', 'optimizer': 'adam', 'graph_mode': 'off', 'use_snp_selection': True, 'num_snps': 51365}. Best is trial 83 with value: 0.2775974438816244.
[I 2025-12-06 11:14:34,978] Trial 88 finished with value: 0.20329836128284878 and parameters: {'model_type': 'mlp', 'hidden_dims': '[256, 128]', 'dropout': 0.41690555178218075, 'batch_norm': True, 'lr': 4.2991785085605594e-06, 'weight_decay': 5.378970340459593e-07, 'epochs': 224, 'loss': 'mae', 'optimizer': 'adam', 'graph_mode': 'off', 'use_snp_selection': True, 'num_snps': 54240}. Best is trial 83 with value: 0.2775974438816244.
