[I 2025-12-06 03:14:12,534] Trial 29 finished with value: 0.242112989902677 and parameters: {'model_type': 'mlp', 'hidden_dims': '[128, 64]', 'dropout': 0.3410026008167736, 'batch_norm': False, 'lr': 1.917485833390482e-06, 'weight_decay': 6.7665359218163e-05, 'epochs': 322, 'loss': 'mae', 'optimizer': 'adam', 'graph_mode': 'off', 'use_snp_selection': True, 'num_snps': 26940}. Best is trial 25 with value: 0.2478799228636881.
[I 2025-12-06 03:14:53,272] Trial 30 finished with value: 0.2217701424647684 and parameters: {'model_type': 'mlp', 'hidden_dims': '[256, 128, 64]', 'dropout': 0.44130222136633734, 'batch_norm': False, 'lr': 1.0492725860129813e-06, 'weight_decay': 2.744423818834789e-05, 'epochs': 258, 'loss': 'mae', 'optimizer': 'adam', 'graph_mode': 'off', 'use_snp_selection': False}. Best is trial 25 with value: 0.2478799228636881.
[I 2025-12-06 03:15:37,515] Trial 31 finished with value: 0.23454845612711064 and parameters: {'model_type': 'mlp', 'hidden_dims': '[128, 64]', 'dropout': 0.3145841259555193, 'batch_norm': False, 'lr': 2.005368290845079e-06, 'weight_decay': 7.458024008678552e-05, 'epochs': 328, 'loss': 'mae', 'optimizer': 'adam', 'graph_mode': 'off', 'use_snp_selection': True, 'num_snps': 23431}. Best is trial 25 with value: 0.2478799228636881.
[I 2025-12-06 03:16:20,900] Trial 32 finished with value: 0.22614524092505878 and parameters: {'model_type': 'mlp', 'hidden_dims': '[128, 64]', 'dropout': 0.2744223375223583, 'batch_norm': False, 'lr': 1.986158596335774e-06, 'weight_decay': 5.195391720392708e-05, 'epochs': 302, 'loss': 'mae', 'optimizer': 'adam', 'graph_mode': 'off', 'use_snp_selection': True, 'num_snps': 22738}. Best is trial 25 with value: 0.2478799228636881.
[I 2025-12-06 03:17:13,630] Trial 33 finished with value: 0.22531247635670965 and parameters: {'model_type': 'mlp', 'hidden_dims': '[128, 64]', 'dropout': 0.35686726382805684, 'batch_norm': False, 'lr': 3.8190281669228594e-06, 'weight_decay': 0.00020084911970171733, 'epochs': 336, 'loss': 'mae', 'optimizer': 'adam', 'graph_mode': 'off', 'use_snp_selection': True, 'num_snps': 34826}. Best is trial 25 with value: 0.2478799228636881.
[I 2025-12-06 03:18:08,151] Trial 34 finished with value: 0.13509227982050181 and parameters: {'model_type': 'mlp', 'hidden_dims': '[128, 64]', 'dropout': 0.42037783173487303, 'batch_norm': True, 'lr': 2.5665224375044347e-06, 'weight_decay': 0.00011989470253335132, 'epochs': 296, 'loss': 'mae', 'optimizer': 'adam', 'graph_mode': 'off', 'use_snp_selection': True, 'num_snps': 41079}. Best is trial 25 with value: 0.2478799228636881.
[I 2025-12-06 03:19:11,976] Trial 35 finished with value: 0.21036480927941872 and parameters: {'model_type': 'mlp', 'hidden_dims': '[512, 128]', 'dropout': 0.20989887708704513, 'batch_norm': False, 'lr': 1.5002065247942937e-06, 'weight_decay': 0.00038939323308526564, 'epochs': 244, 'loss': 'mse', 'optimizer': 'adam', 'graph_mode': 'off', 'use_snp_selection': True, 'num_snps': 26607}. Best is trial 25 with value: 0.2478799228636881.
[I 2025-12-06 03:19:51,969] Trial 36 finished with value: 0.2332728757497789 and parameters: {'model_type': 'mlp', 'hidden_dims': '[256, 128]', 'dropout': 0.3851539205292295, 'batch_norm': False, 'lr': 7.009072427886161e-06, 'weight_decay': 1.0735644043687974e-05, 'epochs': 224, 'loss': 'mae', 'optimizer': 'adam', 'graph_mode': 'off', 'use_snp_selection': True, 'num_snps': 15007}. Best is trial 25 with value: 0.2478799228636881.
[I 2025-12-06 03:20:59,029] Trial 37 finished with value: 0.20461428331267412 and parameters: {'model_type': 'mlp', 'hidden_dims': '[256, 128]', 'dropout': 0.23348041836414035, 'batch_norm': True, 'lr': 3.546421873780211e-05, 'weight_decay': 5.4684716584133625e-05, 'epochs': 197, 'loss': 'mse', 'optimizer': 'adam', 'graph_mode': 'off', 'use_snp_selection': True, 'num_snps': 52065}. Best is trial 25 with value: 0.2478799228636881.
[I 2025-12-06 03:21:15,331] Trial 38 finished with value: 0.21642009673837742 and parameters: {'model_type': 'mlp', 'hidden_dims': '[128, 64]', 'dropout': 0.3598913015124553, 'batch_norm': False, 'lr': 1.4584649463993635e-06, 'weight_decay': 0.000497849365814644, 'epochs': 154, 'loss': 'mae', 'optimizer': 'adam', 'graph_mode': 'off', 'use_snp_selection': False}. Best is trial 25 with value: 0.2478799228636881.
[I 2025-12-06 03:22:31,097] Trial 39 finished with value: 0.21394592470237753 and parameters: {'model_type': 'mlp', 'hidden_dims': '[512, 128]', 'dropout': 0.5633874100374826, 'batch_norm': True, 'lr': 4.129162786439649e-06, 'weight_decay': 2.8358769946598857e-05, 'epochs': 258, 'loss': 'mae', 'optimizer': 'adam', 'graph_mode': 'off', 'use_snp_selection': False}. Best is trial 25 with value: 0.2478799228636881.
[I 2025-12-06 03:23:26,674] Trial 40 finished with value: 0.23523734628113607 and parameters: {'model_type': 'mlp', 'hidden_dims': '[256, 128, 64]', 'dropout': 0.40910052052082474, 'batch_norm': False, 'lr': 1.78653821113679e-06, 'weight_decay': 1.1671967342035288e-05, 'epochs': 294, 'loss': 'mse', 'optimizer': 'adam', 'graph_mode': 'off', 'use_snp_selection': True, 'num_snps': 28569}. Best is trial 25 with value: 0.2478799228636881.
[I 2025-12-06 03:24:07,617] Trial 41 finished with value: 0.2346810254008173 and parameters: {'model_type': 'mlp', 'hidden_dims': '[512, 64]', 'dropout': 0.5738769664046809, 'batch_norm': False, 'lr': 1.0267605980217818e-05, 'weight_decay': 3.4211565554026058e-06, 'epochs': 129, 'loss': 'mae', 'optimizer': 'adam', 'graph_mode': 'off', 'use_snp_selection': False}. Best is trial 25 with value: 0.2478799228636881.
[I 2025-12-06 03:24:56,807] Trial 42 finished with value: 0.2357778601243659 and parameters: {'model_type': 'mlp', 'hidden_dims': '[512, 64]', 'dropout': 0.5146640683439616, 'batch_norm': False, 'lr': 1.4763088880063817e-05, 'weight_decay': 1.8580977134506543e-06, 'epochs': 160, 'loss': 'mae', 'optimizer': 'adam', 'graph_mode': 'off', 'use_snp_selection': False}. Best is trial 25 with value: 0.2478799228636881.
[I 2025-12-06 03:26:28,867] Trial 43 finished with value: 0.2464671402573364 and parameters: {'model_type': 'mlp', 'hidden_dims': '[512, 64]', 'dropout': 0.4806354268378679, 'batch_norm': False, 'lr': 4.7528441122310515e-06, 'weight_decay': 4.852641239864643e-06, 'epochs': 319, 'loss': 'mae', 'optimizer': 'adam', 'graph_mode': 'off', 'use_snp_selection': False}. Best is trial 25 with value: 0.2478799228636881.
[I 2025-12-06 03:28:02,805] Trial 44 finished with value: 0.24421010343107108 and parameters: {'model_type': 'mlp', 'hidden_dims': '[512, 256]', 'dropout': 0.4693140325380718, 'batch_norm': False, 'lr': 5.334158230952482e-06, 'weight_decay': 7.68174546239232e-07, 'epochs': 324, 'loss': 'mae', 'optimizer': 'adam', 'graph_mode': 'off', 'use_snp_selection': False}. Best is trial 25 with value: 0.2478799228636881.
[I 2025-12-06 03:29:41,247] Trial 45 finished with value: 0.19959102861729772 and parameters: {'model_type': 'mlp', 'hidden_dims': '[512, 256]', 'dropout': 0.4824465577746737, 'batch_norm': True, 'lr': 5.754985002784066e-06, 'weight_decay': 4.2176908009040965e-07, 'epochs': 338, 'loss': 'mae', 'optimizer': 'adam', 'graph_mode': 'off', 'use_snp_selection': False}. Best is trial 25 with value: 0.2478799228636881.
[I 2025-12-06 03:31:19,743] Trial 46 finished with value: 0.21576234999080154 and parameters: {'model_type': 'mlp', 'hidden_dims': '[512, 256]', 'dropout': 0.43426783347215286, 'batch_norm': False, 'lr': 1.8369839970713867e-05, 'weight_decay': 1.0470547229594338e-06, 'epochs': 346, 'loss': 'mae', 'optimizer': 'adam', 'graph_mode': 'off', 'use_snp_selection': False}. Best is trial 25 with value: 0.2478799228636881.
[I 2025-12-06 03:32:50,122] Trial 47 finished with value: 0.23879235727027712 and parameters: {'model_type': 'mlp', 'hidden_dims': '[512, 256]', 'dropout': 0.5226962438720195, 'batch_norm': False, 'lr': 8.73559801638414e-06, 'weight_decay': 1.343116285894356e-07, 'epochs': 313, 'loss': 'mae', 'optimizer': 'adam', 'graph_mode': 'off', 'use_snp_selection': False}. Best is trial 25 with value: 0.2478799228636881.
[I 2025-12-06 03:34:14,462] Trial 48 finished with value: 0.22361475346311796 and parameters: {'model_type': 'mlp', 'hidden_dims': '[512, 256]', 'dropout': 0.4856535262054089, 'batch_norm': False, 'lr': 4.613513469352938e-06, 'weight_decay': 5.790268961793359e-06, 'epochs': 289, 'loss': 'mse', 'optimizer': 'adam', 'graph_mode': 'off', 'use_snp_selection': False}. Best is trial 25 with value: 0.2478799228636881.
[I 2025-12-06 03:35:34,565] Trial 49 finished with value: 0.24857785897681794 and parameters: {'model_type': 'mlp', 'hidden_dims': '[512, 64]', 'dropout': 0.44615699629538735, 'batch_norm': False, 'lr': 2.935240075114062e-06, 'weight_decay': 6.598422774674345e-07, 'epochs': 274, 'loss': 'mae', 'optimizer': 'adam', 'graph_mode': 'off', 'use_snp_selection': False}. Best is trial 49 with value: 0.24857785897681794.
[I 2025-12-06 03:36:54,031] Trial 50 finished with value: 0.20311988202895487 and parameters: {'model_type': 'mlp', 'hidden_dims': '[512, 64]', 'dropout': 0.4489033915108777, 'batch_norm': True, 'lr': 3.0651105692781552e-06, 'weight_decay': 2.2705804982206645e-06, 'epochs': 269, 'loss': 'mae', 'optimizer': 'adam', 'graph_mode': 'off', 'use_snp_selection': False}. Best is trial 49 with value: 0.24857785897681794.
[I 2025-12-06 03:38:26,368] Trial 51 finished with value: 0.23463312170252232 and parameters: {'model_type': 'mlp', 'hidden_dims': '[512, 64]', 'dropout': 0.4046030480366572, 'batch_norm': False, 'lr': 6.139499582064612e-06, 'weight_decay': 2.418794501314912e-07, 'epochs': 320, 'loss': 'mae', 'optimizer': 'adam', 'graph_mode': 'off', 'use_snp_selection': False}. Best is trial 49 with value: 0.24857785897681794.
[I 2025-12-06 03:39:35,008] Trial 52 finished with value: 0.22545995458058082 and parameters: {'model_type': 'mlp', 'hidden_dims': '[512, 64]', 'dropout': 0.4959950542973892, 'batch_norm': False, 'lr': 2.6958697322596844e-06, 'weight_decay': 8.574762194334213e-07, 'epochs': 231, 'loss': 'mae', 'optimizer': 'adam', 'graph_mode': 'off', 'use_snp_selection': False}. Best is trial 49 with value: 0.24857785897681794.
[I 2025-12-06 03:40:36,834] Trial 53 finished with value: 0.23610969398585274 and parameters: {'model_type': 'mlp', 'hidden_dims': '[512, 64]', 'dropout': 0.4662135643086363, 'batch_norm': False, 'lr': 0.00016447062560800502, 'weight_decay': 5.115644297363807e-07, 'epochs': 210, 'loss': 'mae', 'optimizer': 'adam', 'graph_mode': 'off', 'use_snp_selection': False}. Best is trial 49 with value: 0.24857785897681794.
[I 2025-12-06 03:41:58,049] Trial 54 finished with value: 0.2279499719345719 and parameters: {'model_type': 'mlp', 'hidden_dims': '[512, 64]', 'dropout': 0.4267142669842169, 'batch_norm': False, 'lr': 4.398460181386528e-06, 'weight_decay': 2.4515143054439463e-07, 'epochs': 278, 'loss': 'mae', 'optimizer': 'adam', 'graph_mode': 'off', 'use_snp_selection': False}. Best is trial 49 with value: 0.24857785897681794.
[I 2025-12-06 03:42:45,527] Trial 55 finished with value: 0.23967115439958658 and parameters: {'model_type': 'mlp', 'hidden_dims': '[256, 128]', 'dropout': 0.5455555562276643, 'batch_norm': False, 'lr': 3.533838634994636e-06, 'weight_decay': 3.24018909664733e-06, 'epochs': 305, 'loss': 'mae', 'optimizer': 'adam', 'graph_mode': 'off', 'use_snp_selection': False}. Best is trial 49 with value: 0.24857785897681794.
[I 2025-12-06 03:44:21,576] Trial 56 finished with value: 0.23821271680474046 and parameters: {'model_type': 'mlp', 'hidden_dims': '[512, 128]', 'dropout': 0.5161664575933348, 'batch_norm': False, 'lr': 1.2626915916338772e-06, 'weight_decay': 7.52883763846743e-07, 'epochs': 334, 'loss': 'mae', 'optimizer': 'adam', 'graph_mode': 'off', 'use_snp_selection': False}. Best is trial 49 with value: 0.24857785897681794.
[I 2025-12-06 03:45:44,736] Trial 57 finished with value: 0.2229688433396698 and parameters: {'model_type': 'mlp', 'hidden_dims': '[512, 64]', 'dropout': 0.5548936084238297, 'batch_norm': False, 'lr': 1.088056108192695e-05, 'weight_decay': 1.3258888613864673e-06, 'epochs': 288, 'loss': 'mae', 'optimizer': 'adam', 'graph_mode': 'off', 'use_snp_selection': False}. Best is trial 49 with value: 0.24857785897681794.
[I 2025-12-06 03:46:57,471] Trial 58 finished with value: 0.2397112741109321 and parameters: {'model_type': 'mlp', 'hidden_dims': '[512, 256]', 'dropout': 0.4816797335955731, 'batch_norm': False, 'lr': 7.947767074623469e-06, 'weight_decay': 4.900293413135101e-06, 'epochs': 246, 'loss': 'mae', 'optimizer': 'adam', 'graph_mode': 'off', 'use_snp_selection': False}. Best is trial 49 with value: 0.24857785897681794.
[I 2025-12-06 03:48:15,420] Trial 59 finished with value: 0.2296367048668329 and parameters: {'model_type': 'mlp', 'hidden_dims': '[512, 64]', 'dropout': 0.4508285170756436, 'batch_norm': False, 'lr': 2.408891977385776e-06, 'weight_decay': 8.141015454914065e-06, 'epochs': 266, 'loss': 'mae', 'optimizer': 'adam', 'graph_mode': 'off', 'use_snp_selection': False}. Best is trial 49 with value: 0.24857785897681794.
[I 2025-12-06 03:48:46,499] Trial 60 finished with value: 0.21603648367149245 and parameters: {'model_type': 'mlp', 'hidden_dims': '[256, 128, 64]', 'dropout': 0.5767568459786913, 'batch_norm': False, 'lr': 4.778050027240076e-06, 'weight_decay': 1.5320904205913322e-05, 'epochs': 184, 'loss': 'mse', 'optimizer': 'adam', 'graph_mode': 'off', 'use_snp_selection': False}. Best is trial 49 with value: 0.24857785897681794.
[I 2025-12-06 03:49:18,014] Trial 61 finished with value: 0.12382520005892221 and parameters: {'model_type': 'mlp', 'hidden_dims': '[128, 64]', 'dropout': 0.5024629034777748, 'batch_norm': False, 'lr': 2.0350859395106763e-06, 'weight_decay': 6.632101401515358e-05, 'epochs': 322, 'loss': 'mae', 'optimizer': 'adam', 'graph_mode': 'off', 'use_snp_selection': True, 'num_snps': 4641}. Best is trial 49 with value: 0.24857785897681794.
[I 2025-12-06 03:50:07,332] Trial 62 finished with value: 0.23912142788700802 and parameters: {'model_type': 'mlp', 'hidden_dims': '[256, 128]', 'dropout': 0.3319960349918777, 'batch_norm': False, 'lr': 3.018404427999027e-06, 'weight_decay': 1.858168253949098e-05, 'epochs': 321, 'loss': 'mae', 'optimizer': 'adam', 'graph_mode': 'off', 'use_snp_selection': False}. Best is trial 49 with value: 0.24857785897681794.
[I 2025-12-06 03:51:47,402] Trial 63 finished with value: 0.23921794000422952 and parameters: {'model_type': 'mlp', 'hidden_dims': '[512, 64]', 'dropout': 0.39931522131285113, 'batch_norm': False, 'lr': 1.287368345225998e-06, 'weight_decay': 7.697678791210175e-05, 'epochs': 349, 'loss': 'mae', 'optimizer': 'adam', 'graph_mode': 'off', 'use_snp_selection': False}. Best is trial 49 with value: 0.24857785897681794.
[I 2025-12-06 03:53:15,985] Trial 64 finished with value: 0.23799117986288362 and parameters: {'model_type': 'mlp', 'hidden_dims': '[512, 64]', 'dropout': 0.3718429611845277, 'batch_norm': False, 'lr': 0.0007048450315433005, 'weight_decay': 3.7896748214074944e-05, 'epochs': 308, 'loss': 'mae', 'optimizer': 'adam', 'graph_mode': 'off', 'use_snp_selection': True, 'num_snps': 38884}. Best is trial 49 with value: 0.24857785897681794.
[I 2025-12-06 03:53:36,420] Trial 65 finished with value: 0.2213864755277525 and parameters: {'model_type': 'mlp', 'hidden_dims': '[128, 64]', 'dropout': 0.3077262685439964, 'batch_norm': False, 'lr': 1.9705193598750376e-06, 'weight_decay': 3.62973900097961e-05, 'epochs': 212, 'loss': 'mae', 'optimizer': 'adam', 'graph_mode': 'off', 'use_snp_selection': False}. Best is trial 49 with value: 0.24857785897681794.
[I 2025-12-06 03:54:31,739] Trial 66 finished with value: 0.2132868557595208 and parameters: {'model_type': 'mlp', 'hidden_dims': '[512, 256]', 'dropout': 0.523315633676644, 'batch_norm': False, 'lr': 9.709468112010056e-05, 'weight_decay': 2.6750403288076095e-07, 'epochs': 328, 'loss': 'mae', 'optimizer': 'adam', 'graph_mode': 'off', 'use_snp_selection': True, 'num_snps': 16746}. Best is trial 49 with value: 0.24857785897681794.
[I 2025-12-06 03:56:08,761] Trial 67 finished with value: 0.23086810340890804 and parameters: {'model_type': 'mlp', 'hidden_dims': '[512, 64]', 'dropout': 0.28208464301068736, 'batch_norm': False, 'lr': 6.582798468284426e-06, 'weight_decay': 0.00017245234053856333, 'epochs': 340, 'loss': 'mae', 'optimizer': 'adam', 'graph_mode': 'off', 'use_snp_selection': False}. Best is trial 49 with value: 0.24857785897681794.
[I 2025-12-06 03:57:30,275] Trial 68 finished with value: 0.2369275413471848 and parameters: {'model_type': 'mlp', 'hidden_dims': '[256, 128]', 'dropout': 0.33564066718037794, 'batch_norm': False, 'lr': 1.667376884291372e-06, 'weight_decay': 0.00012058944660840044, 'epochs': 286, 'loss': 'mae', 'optimizer': 'adam', 'graph_mode': 'off', 'use_snp_selection': True, 'num_snps': 59124}. Best is trial 49 with value: 0.24857785897681794.
[I 2025-12-06 03:57:58,016] Trial 69 finished with value: 0.19199724951916192 and parameters: {'model_type': 'mlp', 'hidden_dims': '[128, 64]', 'dropout': 0.4551479990858863, 'batch_norm': True, 'lr': 3.6841131360675604e-06, 'weight_decay': 2.012563848893312e-05, 'epochs': 315, 'loss': 'mae', 'optimizer': 'adam', 'graph_mode': 'off', 'use_snp_selection': False}. Best is trial 49 with value: 0.24857785897681794.
[I 2025-12-06 03:59:15,377] Trial 70 finished with value: 0.23418721634281212 and parameters: {'model_type': 'mlp', 'hidden_dims': '[512, 128]', 'dropout': 0.37720794407704006, 'batch_norm': False, 'lr': 2.3529113253747916e-06, 'weight_decay': 1.7462303090474542e-06, 'epochs': 300, 'loss': 'mae', 'optimizer': 'adam', 'graph_mode': 'off', 'use_snp_selection': True, 'num_snps': 32216}. Best is trial 49 with value: 0.24857785897681794.
[I 2025-12-06 03:59:37,931] Trial 71 finished with value: 0.24192232378084552 and parameters: {'model_type': 'mlp', 'hidden_dims': '[512, 64]', 'dropout': 0.5777626709701132, 'batch_norm': False, 'lr': 1.0781831535309722e-05, 'weight_decay': 3.840314182027355e-06, 'epochs': 59, 'loss': 'mae', 'optimizer': 'adam', 'graph_mode': 'off', 'use_snp_selection': False}. Best is trial 49 with value: 0.24857785897681794.
[I 2025-12-06 04:00:09,452] Trial 72 finished with value: 0.23499123673967565 and parameters: {'model_type': 'mlp', 'hidden_dims': '[512, 64]', 'dropout': 0.5827171933916688, 'batch_norm': False, 'lr': 5.423941687442211e-06, 'weight_decay': 2.2946629527471187e-06, 'epochs': 93, 'loss': 'mae', 'optimizer': 'adam', 'graph_mode': 'off', 'use_snp_selection': False}. Best is trial 49 with value: 0.24857785897681794.
[I 2025-12-06 04:01:01,773] Trial 73 finished with value: 0.23808671892044933 and parameters: {'model_type': 'mlp', 'hidden_dims': '[512, 64]', 'dropout': 0.5996644772512147, 'batch_norm': False, 'lr': 7.4679443444450845e-06, 'weight_decay': 5.217252487596829e-06, 'epochs': 172, 'loss': 'mae', 'optimizer': 'adam', 'graph_mode': 'off', 'use_snp_selection': False}. Best is trial 49 with value: 0.24857785897681794.
[I 2025-12-06 04:02:35,374] Trial 74 finished with value: 0.23316570719243485 and parameters: {'model_type': 'mlp', 'hidden_dims': '[512, 64]', 'dropout': 0.5599326696452372, 'batch_norm': False, 'lr': 9.893475510961762e-06, 'weight_decay': 8.732167585203654e-06, 'epochs': 328, 'loss': 'mae', 'optimizer': 'adam', 'graph_mode': 'off', 'use_snp_selection': False}. Best is trial 49 with value: 0.24857785897681794.
[I 2025-12-06 04:03:32,152] Trial 75 finished with value: 0.24345517472318892 and parameters: {'model_type': 'mlp', 'hidden_dims': '[512, 64]', 'dropout': 0.5375733245967473, 'batch_norm': False, 'lr': 1.4728673027922539e-05, 'weight_decay': 1.1324201175030543e-05, 'epochs': 189, 'loss': 'mae', 'optimizer': 'adam', 'graph_mode': 'off', 'use_snp_selection': False}. Best is trial 49 with value: 0.24857785897681794.
[I 2025-12-06 04:04:03,149] Trial 76 finished with value: 0.23695035765213546 and parameters: {'model_type': 'mlp', 'hidden_dims': '[256, 128, 64]', 'dropout': 0.47206437858913586, 'batch_norm': False, 'lr': 1.562715845591967e-05, 'weight_decay': 1.2316731219229594e-05, 'epochs': 185, 'loss': 'mae', 'optimizer': 'adam', 'graph_mode': 'off', 'use_snp_selection': False}. Best is trial 49 with value: 0.24857785897681794.
[I 2025-12-06 04:05:10,140] Trial 77 finished with value: 0.22374269814225908 and parameters: {'model_type': 'mlp', 'hidden_dims': '[256, 128]', 'dropout': 0.5321958522737419, 'batch_norm': False, 'lr': 2.11650676371102e-05, 'weight_decay': 9.220308481489341e-05, 'epochs': 205, 'loss': 'mse', 'optimizer': 'adam', 'graph_mode': 'off', 'use_snp_selection': True, 'num_snps': 53767}. Best is trial 49 with value: 0.24857785897681794.
[I 2025-12-06 04:06:14,337] Trial 78 finished with value: 0.2340152475853019 and parameters: {'model_type': 'mlp', 'hidden_dims': '[512, 64]', 'dropout': 0.48703635719663424, 'batch_norm': False, 'lr': 3.600396297538744e-05, 'weight_decay': 0.0002538305801123099, 'epochs': 221, 'loss': 'mae', 'optimizer': 'adam', 'graph_mode': 'off', 'use_snp_selection': False}. Best is trial 49 with value: 0.24857785897681794.
[I 2025-12-06 04:07:05,067] Trial 79 finished with value: 0.23135318038505032 and parameters: {'model_type': 'mlp', 'hidden_dims': '[512, 256]', 'dropout': 0.5075963324178459, 'batch_norm': False, 'lr': 4.118087867999655e-06, 'weight_decay': 6.5629327077328136e-06, 'epochs': 164, 'loss': 'mae', 'optimizer': 'adam', 'graph_mode': 'off', 'use_snp_selection': False}. Best is trial 49 with value: 0.24857785897681794.
[I 2025-12-06 04:08:32,235] Trial 80 finished with value: 0.22256537915997857 and parameters: {'model_type': 'mlp', 'hidden_dims': '[512, 64]', 'dropout': 0.13919397989091056, 'batch_norm': False, 'lr': 2.7943762950602177e-05, 'weight_decay': 3.239990025747595e-05, 'epochs': 267, 'loss': 'mae', 'optimizer': 'adam', 'graph_mode': 'off', 'use_snp_selection': True, 'num_snps': 41829}. Best is trial 49 with value: 0.24857785897681794.
