[I 2025-12-05 16:27:34,551] Trial 138 finished with value: 0.015155187530606061 and parameters: {'model_type': 'mlp', 'hidden_dims': '[512, 256]', 'dropout': 0.16314421502629875, 'batch_norm': True, 'lr': 3.286810730097579e-05, 'weight_decay': 2.9173083343383508e-05, 'epochs': 95, 'loss': 'mae', 'optimizer': 'adam', 'graph_mode': 'off', 'use_snp_selection': False}. Best is trial 135 with value: 0.09721150571484476.
[I 2025-12-05 16:27:36,334] Trial 139 finished with value: 0.05961702205224833 and parameters: {'model_type': 'mlp', 'hidden_dims': '[512, 256]', 'dropout': 0.2030986159068971, 'batch_norm': True, 'lr': 7.042546130303431e-05, 'weight_decay': 9.950351260778625e-06, 'epochs': 299, 'loss': 'mae', 'optimizer': 'adam', 'graph_mode': 'off', 'use_snp_selection': False}. Best is trial 135 with value: 0.09721150571484476.
[I 2025-12-05 16:27:37,282] Trial 140 finished with value: 0.017735219487552172 and parameters: {'model_type': 'mlp', 'hidden_dims': '[512, 256]', 'dropout': 0.4404163627368806, 'batch_norm': True, 'lr': 2.1960120819207913e-05, 'weight_decay': 7.017567410224291e-06, 'epochs': 46, 'loss': 'mae', 'optimizer': 'adam', 'graph_mode': 'off', 'use_snp_selection': False}. Best is trial 135 with value: 0.09721150571484476.
[I 2025-12-05 16:27:38,306] Trial 141 finished with value: 0.051073599417167596 and parameters: {'model_type': 'mlp', 'hidden_dims': '[512, 256]', 'dropout': 0.13338730487401193, 'batch_norm': True, 'lr': 4.240124257229985e-05, 'weight_decay': 3.646507398071522e-06, 'epochs': 66, 'loss': 'mae', 'optimizer': 'adam', 'graph_mode': 'off', 'use_snp_selection': False}. Best is trial 135 with value: 0.09721150571484476.
[I 2025-12-05 16:27:39,363] Trial 142 finished with value: 0.07534273547471236 and parameters: {'model_type': 'mlp', 'hidden_dims': '[512, 256]', 'dropout': 0.1783946619245459, 'batch_norm': True, 'lr': 3.4893017835677636e-05, 'weight_decay': 1.803159842252959e-07, 'epochs': 81, 'loss': 'mae', 'optimizer': 'adam', 'graph_mode': 'off', 'use_snp_selection': False}. Best is trial 135 with value: 0.09721150571484476.
[I 2025-12-05 16:27:40,427] Trial 143 finished with value: 0.018969840751033126 and parameters: {'model_type': 'mlp', 'hidden_dims': '[512, 256]', 'dropout': 0.17813377148240678, 'batch_norm': True, 'lr': 3.114554436478643e-05, 'weight_decay': 1.9262000637290605e-07, 'epochs': 81, 'loss': 'mae', 'optimizer': 'adam', 'graph_mode': 'off', 'use_snp_selection': False}. Best is trial 135 with value: 0.09721150571484476.
[I 2025-12-05 16:27:41,391] Trial 144 finished with value: 0.0399603936958352 and parameters: {'model_type': 'mlp', 'hidden_dims': '[512, 256]', 'dropout': 0.15936710912304575, 'batch_norm': True, 'lr': 3.6887955492617815e-05, 'weight_decay': 1.464098894603987e-07, 'epochs': 54, 'loss': 'mae', 'optimizer': 'adam', 'graph_mode': 'off', 'use_snp_selection': False}. Best is trial 135 with value: 0.09721150571484476.
[I 2025-12-05 16:27:42,469] Trial 145 finished with value: 0.021220577547880065 and parameters: {'model_type': 'mlp', 'hidden_dims': '[512, 256]', 'dropout': 0.19345617464979092, 'batch_norm': True, 'lr': 2.5618447852690274e-05, 'weight_decay': 2.5872753873798233e-07, 'epochs': 87, 'loss': 'mae', 'optimizer': 'adam', 'graph_mode': 'off', 'use_snp_selection': False}. Best is trial 135 with value: 0.09721150571484476.
[I 2025-12-05 16:27:43,291] Trial 146 finished with value: 0.011102250248689997 and parameters: {'model_type': 'mlp', 'hidden_dims': '[256, 128]', 'dropout': 0.14275373369036667, 'batch_norm': True, 'lr': 1.9655139716126652e-05, 'weight_decay': 1.5413479204595682e-05, 'epochs': 74, 'loss': 'mae', 'optimizer': 'adam', 'graph_mode': 'off', 'use_snp_selection': False}. Best is trial 135 with value: 0.09721150571484476.
[I 2025-12-05 16:27:44,455] Trial 147 finished with value: 0.02482217683503454 and parameters: {'model_type': 'mlp', 'hidden_dims': '[512, 64]', 'dropout': 0.4251245446801841, 'batch_norm': True, 'lr': 3.5969060064420696e-05, 'weight_decay': 4.312443614297062e-06, 'epochs': 106, 'loss': 'mae', 'optimizer': 'adam', 'graph_mode': 'off', 'use_snp_selection': False}. Best is trial 135 with value: 0.09721150571484476.
[I 2025-12-05 16:27:46,120] Trial 148 finished with value: 0.061570378039915795 and parameters: {'model_type': 'mlp', 'hidden_dims': '[512, 256]', 'dropout': 0.17160116911533754, 'batch_norm': True, 'lr': 5.334757734195818e-05, 'weight_decay': 2.2756667697851322e-07, 'epochs': 249, 'loss': 'mae', 'optimizer': 'adam', 'graph_mode': 'off', 'use_snp_selection': False}. Best is trial 135 with value: 0.09721150571484476.
[I 2025-12-05 16:27:47,109] Trial 149 finished with value: 0.04540864827790673 and parameters: {'model_type': 'mlp', 'hidden_dims': '[512, 256]', 'dropout': 0.14981896593383875, 'batch_norm': True, 'lr': 2.995886332021474e-05, 'weight_decay': 9.132032720499765e-06, 'epochs': 61, 'loss': 'mae', 'optimizer': 'adam', 'graph_mode': 'off', 'use_snp_selection': False}. Best is trial 135 with value: 0.09721150571484476.
[I 2025-12-05 16:27:49,322] Trial 0 finished with value: 0.02018168736252824 and parameters: {'model_type': 'mlp', 'hidden_dims': '[128, 64]', 'dropout': 0.199031432379812, 'batch_norm': True, 'lr': 1.8408544111075837e-06, 'weight_decay': 5.5136510071208614e-05, 'epochs': 336, 'loss': 'mae', 'optimizer': 'adam', 'graph_mode': 'off', 'use_snp_selection': True, 'num_snps': 43862}. Best is trial 0 with value: 0.02018168736252824.
[I 2025-12-05 16:27:50,381] Trial 1 finished with value: 0.001540411985199085 and parameters: {'model_type': 'mlp', 'hidden_dims': '[256, 128]', 'dropout': 0.4370668075331726, 'batch_norm': True, 'lr': 7.133471581159139e-05, 'weight_decay': 1.128633586803549e-05, 'epochs': 242, 'loss': 'mae', 'optimizer': 'adam', 'graph_mode': 'off', 'use_snp_selection': False}. Best is trial 0 with value: 0.02018168736252824.
[I 2025-12-05 16:27:51,325] Trial 2 finished with value: 0.05571758432869884 and parameters: {'model_type': 'mlp', 'hidden_dims': '[256, 128, 64]', 'dropout': 0.41314357415569625, 'batch_norm': False, 'lr': 3.952233718592101e-06, 'weight_decay': 0.00026754769258252603, 'epochs': 149, 'loss': 'mse', 'optimizer': 'adam', 'graph_mode': 'off', 'use_snp_selection': True, 'num_snps': 11571}. Best is trial 2 with value: 0.05571758432869884.
[I 2025-12-05 16:27:53,163] Trial 3 finished with value: 0.0679859581105568 and parameters: {'model_type': 'mlp', 'hidden_dims': '[512, 64]', 'dropout': 0.5938127374509361, 'batch_norm': False, 'lr': 5.67704586114731e-06, 'weight_decay': 2.4518087630137052e-05, 'epochs': 320, 'loss': 'mae', 'optimizer': 'adam', 'graph_mode': 'off', 'use_snp_selection': False}. Best is trial 3 with value: 0.0679859581105568.
[I 2025-12-05 16:27:55,426] Trial 4 finished with value: 0.01871177640640514 and parameters: {'model_type': 'mlp', 'hidden_dims': '[512, 128]', 'dropout': 0.25746343592134413, 'batch_norm': True, 'lr': 1.3467657668402788e-06, 'weight_decay': 0.00033087251918647806, 'epochs': 277, 'loss': 'mse', 'optimizer': 'adam', 'graph_mode': 'off', 'use_snp_selection': True, 'num_snps': 36675}. Best is trial 3 with value: 0.0679859581105568.
[I 2025-12-05 16:27:57,274] Trial 5 finished with value: -0.046435525241360374 and parameters: {'model_type': 'mlp', 'hidden_dims': '[512, 64]', 'dropout': 0.38275350994408375, 'batch_norm': True, 'lr': 1.5586664309232824e-06, 'weight_decay': 0.0008227664668621182, 'epochs': 145, 'loss': 'mae', 'optimizer': 'adam', 'graph_mode': 'off', 'use_snp_selection': True, 'num_snps': 32148}. Best is trial 3 with value: 0.0679859581105568.
[I 2025-12-05 16:27:58,293] Trial 6 finished with value: -0.018036168802803756 and parameters: {'model_type': 'mlp', 'hidden_dims': '[256, 128]', 'dropout': 0.3930109900265879, 'batch_norm': False, 'lr': 4.892964372128395e-05, 'weight_decay': 1.5809549317992182e-06, 'epochs': 199, 'loss': 'mse', 'optimizer': 'adam', 'graph_mode': 'off', 'use_snp_selection': False}. Best is trial 3 with value: 0.0679859581105568.
[I 2025-12-05 16:27:59,400] Trial 7 finished with value: 0.05147018604434359 and parameters: {'model_type': 'mlp', 'hidden_dims': '[512, 256]', 'dropout': 0.15343979219678458, 'batch_norm': True, 'lr': 6.234003099047341e-05, 'weight_decay': 3.894760610535477e-07, 'epochs': 97, 'loss': 'mse', 'optimizer': 'adam', 'graph_mode': 'off', 'use_snp_selection': False}. Best is trial 3 with value: 0.0679859581105568.
[I 2025-12-05 16:28:01,242] Trial 8 finished with value: 0.05112445525814098 and parameters: {'model_type': 'mlp', 'hidden_dims': '[512, 128]', 'dropout': 0.10743001231661406, 'batch_norm': True, 'lr': 0.00023728538449271062, 'weight_decay': 1.7629071578048637e-05, 'epochs': 312, 'loss': 'mae', 'optimizer': 'adam', 'graph_mode': 'off', 'use_snp_selection': False}. Best is trial 3 with value: 0.0679859581105568.
[I 2025-12-05 16:28:02,605] Trial 9 finished with value: 0.011453324880451967 and parameters: {'model_type': 'mlp', 'hidden_dims': '[512, 64]', 'dropout': 0.14505336736221927, 'batch_norm': True, 'lr': 5.8619638388111826e-05, 'weight_decay': 6.200156172669308e-07, 'epochs': 175, 'loss': 'mse', 'optimizer': 'adam', 'graph_mode': 'off', 'use_snp_selection': False}. Best is trial 3 with value: 0.0679859581105568.
[I 2025-12-05 16:28:03,523] Trial 10 finished with value: 0.0037470702996999167 and parameters: {'model_type': 'mlp', 'hidden_dims': '[512, 64]', 'dropout': 0.5885461262002587, 'batch_norm': False, 'lr': 8.769366258768696e-06, 'weight_decay': 2.78273193871783e-06, 'epochs': 55, 'loss': 'mae', 'optimizer': 'adam', 'graph_mode': 'off', 'use_snp_selection': False}. Best is trial 3 with value: 0.0679859581105568.
[I 2025-12-05 16:28:04,423] Trial 11 finished with value: 0.027130833570090055 and parameters: {'model_type': 'mlp', 'hidden_dims': '[256, 128, 64]', 'dropout': 0.5856267066773996, 'batch_norm': False, 'lr': 8.596969843802065e-06, 'weight_decay': 7.644279067619585e-05, 'epochs': 222, 'loss': 'mse', 'optimizer': 'adam', 'graph_mode': 'off', 'use_snp_selection': True, 'num_snps': 5419}. Best is trial 3 with value: 0.0679859581105568.
[I 2025-12-05 16:28:05,340] Trial 12 finished with value: 0.01120235482245737 and parameters: {'model_type': 'mlp', 'hidden_dims': '[256, 128, 64]', 'dropout': 0.49541318006391155, 'batch_norm': False, 'lr': 8.040010782675621e-06, 'weight_decay': 0.00012297995556334715, 'epochs': 147, 'loss': 'mae', 'optimizer': 'adam', 'graph_mode': 'off', 'use_snp_selection': True, 'num_snps': 7003}. Best is trial 3 with value: 0.0679859581105568.
[I 2025-12-05 16:28:08,200] Trial 13 finished with value: 0.00354995556298598 and parameters: {'model_type': 'mlp', 'hidden_dims': '[256, 128, 64]', 'dropout': 0.29125366674822484, 'batch_norm': False, 'lr': 5.160505268156064e-06, 'weight_decay': 3.1999034495941446e-05, 'epochs': 282, 'loss': 'mse', 'optimizer': 'adam', 'graph_mode': 'off', 'use_snp_selection': True, 'num_snps': 59978}. Best is trial 3 with value: 0.0679859581105568.
[I 2025-12-05 16:28:08,913] Trial 14 finished with value: 0.0021570945099975295 and parameters: {'model_type': 'mlp', 'hidden_dims': '[128, 64]', 'dropout': 0.47880568694936143, 'batch_norm': False, 'lr': 0.000996727461936671, 'weight_decay': 0.00025686800421847447, 'epochs': 105, 'loss': 'mae', 'optimizer': 'adam', 'graph_mode': 'off', 'use_snp_selection': False}. Best is trial 3 with value: 0.0679859581105568.
[I 2025-12-05 16:28:10,447] Trial 15 finished with value: 0.033777745817579086 and parameters: {'model_type': 'mlp', 'hidden_dims': '[512, 256]', 'dropout': 0.5303211456902688, 'batch_norm': False, 'lr': 1.98648288753574e-05, 'weight_decay': 3.797795084560882e-06, 'epochs': 347, 'loss': 'mse', 'optimizer': 'adam', 'graph_mode': 'off', 'use_snp_selection': True, 'num_snps': 19093}. Best is trial 3 with value: 0.0679859581105568.
[I 2025-12-05 16:28:12,069] Trial 16 finished with value: 0.0038609420750536105 and parameters: {'model_type': 'mlp', 'hidden_dims': '[512, 64]', 'dropout': 0.33587209601766577, 'batch_norm': False, 'lr': 3.284888101997687e-06, 'weight_decay': 0.0007812431650451949, 'epochs': 243, 'loss': 'mae', 'optimizer': 'adam', 'graph_mode': 'off', 'use_snp_selection': False}. Best is trial 3 with value: 0.0679859581105568.
[I 2025-12-05 16:28:13,212] Trial 17 finished with value: -0.03508601334540245 and parameters: {'model_type': 'mlp', 'hidden_dims': '[256, 128, 64]', 'dropout': 0.5387456221645408, 'batch_norm': False, 'lr': 1.8081964730854778e-05, 'weight_decay': 1.40022675967374e-07, 'epochs': 45, 'loss': 'mse', 'optimizer': 'adam', 'graph_mode': 'off', 'use_snp_selection': True, 'num_snps': 18228}. Best is trial 3 with value: 0.0679859581105568.
[I 2025-12-05 16:28:14,497] Trial 18 finished with value: 0.035002873739340995 and parameters: {'model_type': 'mlp', 'hidden_dims': '[256, 128, 64]', 'dropout': 0.4460705703142783, 'batch_norm': False, 'lr': 3.0160351840952202e-06, 'weight_decay': 0.00016137076761448376, 'epochs': 146, 'loss': 'mse', 'optimizer': 'adam', 'graph_mode': 'off', 'use_snp_selection': True, 'num_snps': 20445}. Best is trial 3 with value: 0.0679859581105568.
[I 2025-12-05 16:28:15,627] Trial 19 finished with value: 0.0153221432266843 and parameters: {'model_type': 'mlp', 'hidden_dims': '[512, 64]', 'dropout': 0.3225190164399214, 'batch_norm': False, 'lr': 2.1895310330086162e-05, 'weight_decay': 2.9656384841560222e-05, 'epochs': 110, 'loss': 'mae', 'optimizer': 'adam', 'graph_mode': 'off', 'use_snp_selection': False}. Best is trial 3 with value: 0.0679859581105568.
[I 2025-12-05 16:28:17,062] Trial 20 finished with value: 0.019033145827482483 and parameters: {'model_type': 'mlp', 'hidden_dims': '[512, 128]', 'dropout': 0.24943597987893662, 'batch_norm': False, 'lr': 0.00014715045903500684, 'weight_decay': 6.646777320363832e-06, 'epochs': 193, 'loss': 'mae', 'optimizer': 'adam', 'graph_mode': 'off', 'use_snp_selection': False}. Best is trial 3 with value: 0.0679859581105568.
[I 2025-12-05 16:28:18,150] Trial 21 finished with value: 0.04062929894614836 and parameters: {'model_type': 'mlp', 'hidden_dims': '[512, 256]', 'dropout': 0.19074524441792948, 'batch_norm': True, 'lr': 0.0001926183496651524, 'weight_decay': 1.214283665406053e-07, 'epochs': 90, 'loss': 'mse', 'optimizer': 'adam', 'graph_mode': 'off', 'use_snp_selection': False}. Best is trial 3 with value: 0.0679859581105568.
[I 2025-12-05 16:28:19,241] Trial 22 finished with value: 0.02430145019146651 and parameters: {'model_type': 'mlp', 'hidden_dims': '[512, 256]', 'dropout': 0.39200416604353894, 'batch_norm': True, 'lr': 1.2824867935215106e-05, 'weight_decay': 5.122701130113604e-07, 'epochs': 94, 'loss': 'mse', 'optimizer': 'adam', 'graph_mode': 'off', 'use_snp_selection': False}. Best is trial 3 with value: 0.0679859581105568.
[I 2025-12-05 16:28:20,244] Trial 23 finished with value: 0.02183533902502916 and parameters: {'model_type': 'mlp', 'hidden_dims': '[512, 256]', 'dropout': 0.22001661158880384, 'batch_norm': True, 'lr': 3.851579445299818e-06, 'weight_decay': 7.453946588408512e-07, 'epochs': 71, 'loss': 'mse', 'optimizer': 'adam', 'graph_mode': 'off', 'use_snp_selection': False}. Best is trial 3 with value: 0.0679859581105568.
[I 2025-12-05 16:28:21,474] Trial 24 finished with value: 0.011306099359647624 and parameters: {'model_type': 'mlp', 'hidden_dims': '[512, 256]', 'dropout': 0.15521074261230133, 'batch_norm': False, 'lr': 3.623048808305884e-05, 'weight_decay': 7.824593786572773e-06, 'epochs': 138, 'loss': 'mse', 'optimizer': 'adam', 'graph_mode': 'off', 'use_snp_selection': False}. Best is trial 3 with value: 0.0679859581105568.
[I 2025-12-05 16:28:22,439] Trial 25 finished with value: 0.029948629271796683 and parameters: {'model_type': 'mlp', 'hidden_dims': '[256, 128]', 'dropout': 0.2986528111716758, 'batch_norm': False, 'lr': 0.00011681638085435488, 'weight_decay': 1.6159508703933453e-06, 'epochs': 177, 'loss': 'mse', 'optimizer': 'adam', 'graph_mode': 'off', 'use_snp_selection': False}. Best is trial 3 with value: 0.0679859581105568.
[I 2025-12-05 16:28:23,151] Trial 26 finished with value: 0.01554115854434123 and parameters: {'model_type': 'mlp', 'hidden_dims': '[128, 64]', 'dropout': 0.5445682649322785, 'batch_norm': True, 'lr': 5.5635966890258884e-06, 'weight_decay': 0.00036917761172284734, 'epochs': 129, 'loss': 'mse', 'optimizer': 'adam', 'graph_mode': 'off', 'use_snp_selection': True, 'num_snps': 2344}. Best is trial 3 with value: 0.0679859581105568.
[I 2025-12-05 16:28:24,031] Trial 27 finished with value: 0.007402956906668863 and parameters: {'model_type': 'mlp', 'hidden_dims': '[256, 128, 64]', 'dropout': 0.4350066369539406, 'batch_norm': False, 'lr': 0.00034827181131339124, 'weight_decay': 2.677922139666298e-07, 'epochs': 119, 'loss': 'mse', 'optimizer': 'adam', 'graph_mode': 'off', 'use_snp_selection': False}. Best is trial 3 with value: 0.0679859581105568.
[I 2025-12-05 16:28:26,910] Trial 28 finished with value: 0.024677116710895553 and parameters: {'model_type': 'mlp', 'hidden_dims': '[512, 64]', 'dropout': 0.48749705834167145, 'batch_norm': True, 'lr': 2.4641378278529227e-06, 'weight_decay': 4.285669377885081e-05, 'epochs': 279, 'loss': 'mae', 'optimizer': 'adam', 'graph_mode': 'off', 'use_snp_selection': True, 'num_snps': 48700}. Best is trial 3 with value: 0.0679859581105568.
[I 2025-12-05 16:28:28,320] Trial 29 finished with value: 0.012200961095870422 and parameters: {'model_type': 'mlp', 'hidden_dims': '[128, 64]', 'dropout': 0.3586199191445084, 'batch_norm': True, 'lr': 3.160808437645906e-05, 'weight_decay': 7.53974239020132e-05, 'epochs': 307, 'loss': 'mae', 'optimizer': 'adam', 'graph_mode': 'off', 'use_snp_selection': True, 'num_snps': 14367}. Best is trial 3 with value: 0.0679859581105568.
[I 2025-12-05 16:28:29,698] Trial 30 finished with value: -0.008997434176300398 and parameters: {'model_type': 'mlp', 'hidden_dims': '[512, 256]', 'dropout': 0.1908357312363561, 'batch_norm': False, 'lr': 1.0718606912624685e-06, 'weight_decay': 1.7462803172026462e-05, 'epochs': 170, 'loss': 'mse', 'optimizer': 'adam', 'graph_mode': 'off', 'use_snp_selection': False}. Best is trial 3 with value: 0.0679859581105568.
[I 2025-12-05 16:28:31,599] Trial 31 finished with value: 0.051364546199799625 and parameters: {'model_type': 'mlp', 'hidden_dims': '[512, 128]', 'dropout': 0.11642475878703679, 'batch_norm': True, 'lr': 0.000346229753049316, 'weight_decay': 1.860128977023462e-05, 'epochs': 321, 'loss': 'mae', 'optimizer': 'adam', 'graph_mode': 'off', 'use_snp_selection': False}. Best is trial 3 with value: 0.0679859581105568.
[I 2025-12-05 16:28:33,476] Trial 32 finished with value: 0.07082068485710658 and parameters: {'model_type': 'mlp', 'hidden_dims': '[512, 128]', 'dropout': 0.10074791525910773, 'batch_norm': True, 'lr': 0.0005256107936625393, 'weight_decay': 2.2463118264503542e-05, 'epochs': 314, 'loss': 'mae', 'optimizer': 'adam', 'graph_mode': 'off', 'use_snp_selection': False}. Best is trial 32 with value: 0.07082068485710658.
[I 2025-12-05 16:28:35,110] Trial 33 finished with value: 0.04405900593496607 and parameters: {'model_type': 'mlp', 'hidden_dims': '[512, 128]', 'dropout': 0.13463024068447857, 'batch_norm': True, 'lr': 0.0006802307484359983, 'weight_decay': 5.676098230782498e-06, 'epochs': 256, 'loss': 'mae', 'optimizer': 'adam', 'graph_mode': 'off', 'use_snp_selection': False}. Best is trial 32 with value: 0.07082068485710658.
[I 2025-12-05 16:28:36,879] Trial 34 finished with value: 0.020184491619688907 and parameters: {'model_type': 'mlp', 'hidden_dims': '[512, 128]', 'dropout': 0.16265543010719535, 'batch_norm': True, 'lr': 9.581867307939553e-05, 'weight_decay': 1.1288470994087877e-05, 'epochs': 296, 'loss': 'mae', 'optimizer': 'adam', 'graph_mode': 'off', 'use_snp_selection': False}. Best is trial 32 with value: 0.07082068485710658.
[I 2025-12-05 16:28:38,165] Trial 35 finished with value: 0.0277868566820358 and parameters: {'model_type': 'mlp', 'hidden_dims': '[256, 128]', 'dropout': 0.24817062879682025, 'batch_norm': True, 'lr': 2.0104567765053474e-06, 'weight_decay': 0.00012985898702336422, 'epochs': 327, 'loss': 'mae', 'optimizer': 'adam', 'graph_mode': 'off', 'use_snp_selection': False}. Best is trial 32 with value: 0.07082068485710658.
[I 2025-12-05 16:28:39,236] Trial 36 finished with value: 0.008899294747271878 and parameters: {'model_type': 'mlp', 'hidden_dims': '[512, 128]', 'dropout': 0.22029235372673178, 'batch_norm': True, 'lr': 1.3447036526313609e-05, 'weight_decay': 1.950220850384008e-06, 'epochs': 78, 'loss': 'mae', 'optimizer': 'adam', 'graph_mode': 'off', 'use_snp_selection': False}. Best is trial 32 with value: 0.07082068485710658.
[I 2025-12-05 16:28:41,252] Trial 37 finished with value: 0.03764352711744758 and parameters: {'model_type': 'mlp', 'hidden_dims': '[512, 64]', 'dropout': 0.4234520700360994, 'batch_norm': True, 'lr': 7.705828554831139e-05, 'weight_decay': 0.00043823773792286855, 'epochs': 348, 'loss': 'mae', 'optimizer': 'adam', 'graph_mode': 'off', 'use_snp_selection': True, 'num_snps': 27759}. Best is trial 32 with value: 0.07082068485710658.
[I 2025-12-05 16:28:42,317] Trial 38 finished with value: 0.05468115564373339 and parameters: {'model_type': 'mlp', 'hidden_dims': '[256, 128]', 'dropout': 0.11180436096217222, 'batch_norm': True, 'lr': 0.0005644748164900712, 'weight_decay': 5.3180420788505876e-05, 'epochs': 212, 'loss': 'mse', 'optimizer': 'adam', 'graph_mode': 'off', 'use_snp_selection': False}. Best is trial 32 with value: 0.07082068485710658.
[I 2025-12-05 16:28:43,386] Trial 39 finished with value: 0.01900762481145717 and parameters: {'model_type': 'mlp', 'hidden_dims': '[256, 128]', 'dropout': 0.11079021444178712, 'batch_norm': True, 'lr': 0.0005640411967957849, 'weight_decay': 6.522255387590573e-05, 'epochs': 217, 'loss': 'mse', 'optimizer': 'adam', 'graph_mode': 'off', 'use_snp_selection': False}. Best is trial 32 with value: 0.07082068485710658.
