[I 2025-12-05 18:02:35,973] Trial 11 finished with value: 0.26575284458592363 and parameters: {'model_type': 'mlp', 'hidden_dims': '[512, 256]', 'dropout': 0.583942291816117, 'batch_norm': False, 'lr': 7.811409765921478e-06, 'weight_decay': 2.0596806983850726e-06, 'epochs': 77, 'loss': 'mae', 'optimizer': 'adam', 'graph_mode': 'off', 'use_snp_selection': False}. Best is trial 7 with value: 0.29814995432124725.
[I 2025-12-05 18:02:57,436] Trial 12 finished with value: 0.2832511829287229 and parameters: {'model_type': 'mlp', 'hidden_dims': '[512, 256]', 'dropout': 0.5873431926823272, 'batch_norm': False, 'lr': 1.3209655691727925e-05, 'weight_decay': 1.3081036432574914e-07, 'epochs': 93, 'loss': 'mae', 'optimizer': 'adam', 'graph_mode': 'off', 'use_snp_selection': False}. Best is trial 7 with value: 0.29814995432124725.
[I 2025-12-05 18:03:43,793] Trial 13 finished with value: 0.28849232909574274 and parameters: {'model_type': 'mlp', 'hidden_dims': '[512, 64]', 'dropout': 0.5038644356477802, 'batch_norm': False, 'lr': 1.4304506621636526e-05, 'weight_decay': 4.373608364627903e-05, 'epochs': 237, 'loss': 'mse', 'optimizer': 'adam', 'graph_mode': 'off', 'use_snp_selection': False}. Best is trial 7 with value: 0.29814995432124725.
[I 2025-12-05 18:03:54,131] Trial 14 finished with value: 0.2818764595740988 and parameters: {'model_type': 'mlp', 'hidden_dims': '[128, 64]', 'dropout': 0.3012984444538551, 'batch_norm': True, 'lr': 0.0001457690241539883, 'weight_decay': 3.0607358611649674e-06, 'epochs': 114, 'loss': 'mse', 'optimizer': 'adam', 'graph_mode': 'off', 'use_snp_selection': False}. Best is trial 7 with value: 0.29814995432124725.
[I 2025-12-05 18:04:18,442] Trial 15 finished with value: 0.2838734049025553 and parameters: {'model_type': 'mlp', 'hidden_dims': '[256, 128, 64]', 'dropout': 0.48263162073930665, 'batch_norm': False, 'lr': 2.2873500775644262e-05, 'weight_decay': 3.9169083908621594e-07, 'epochs': 216, 'loss': 'mae', 'optimizer': 'adam', 'graph_mode': 'off', 'use_snp_selection': False}. Best is trial 7 with value: 0.29814995432124725.
[I 2025-12-05 18:05:13,617] Trial 16 finished with value: 0.2895792533436873 and parameters: {'model_type': 'mlp', 'hidden_dims': '[512, 256]', 'dropout': 0.20597729258687042, 'batch_norm': True, 'lr': 6.013316929814413e-06, 'weight_decay': 5.098763140321504e-06, 'epochs': 283, 'loss': 'mse', 'optimizer': 'adam', 'graph_mode': 'off', 'use_snp_selection': False}. Best is trial 7 with value: 0.29814995432124725.
[I 2025-12-05 18:06:19,270] Trial 17 finished with value: 0.20587695183152058 and parameters: {'model_type': 'mlp', 'hidden_dims': '[512, 64]', 'dropout': 0.32888830259108426, 'batch_norm': False, 'lr': 0.000906375209920231, 'weight_decay': 4.279596648260934e-05, 'epochs': 349, 'loss': 'mae', 'optimizer': 'adam', 'graph_mode': 'off', 'use_snp_selection': False}. Best is trial 7 with value: 0.29814995432124725.
[I 2025-12-05 18:07:23,349] Trial 18 finished with value: 0.2868819549344094 and parameters: {'model_type': 'mlp', 'hidden_dims': '[512, 256]', 'dropout': 0.5139576333133464, 'batch_norm': False, 'lr': 2.797772152750264e-05, 'weight_decay': 3.5038679530849885e-07, 'epochs': 164, 'loss': 'mse', 'optimizer': 'adam', 'graph_mode': 'off', 'use_snp_selection': True, 'num_snps': 58241}. Best is trial 7 with value: 0.29814995432124725.
[I 2025-12-05 18:07:37,129] Trial 19 finished with value: 0.24635821873305663 and parameters: {'model_type': 'mlp', 'hidden_dims': '[512, 64]', 'dropout': 0.21972527923816063, 'batch_norm': True, 'lr': 3.502882181800776e-06, 'weight_decay': 0.00015299712892081902, 'epochs': 49, 'loss': 'mae', 'optimizer': 'adam', 'graph_mode': 'off', 'use_snp_selection': False}. Best is trial 7 with value: 0.29814995432124725.
[I 2025-12-05 18:08:03,363] Trial 20 finished with value: 0.2751063512237934 and parameters: {'model_type': 'mlp', 'hidden_dims': '[512, 128]', 'dropout': 0.3479554994523537, 'batch_norm': False, 'lr': 0.00014058530570495862, 'weight_decay': 5.6086896540041565e-06, 'epochs': 121, 'loss': 'mae', 'optimizer': 'adam', 'graph_mode': 'off', 'use_snp_selection': False}. Best is trial 7 with value: 0.29814995432124725.
[I 2025-12-05 18:08:26,423] Trial 21 finished with value: 0.1994227891208976 and parameters: {'model_type': 'mlp', 'hidden_dims': '[256, 128, 64]', 'dropout': 0.44953538445282826, 'batch_norm': False, 'lr': 3.608639590682193e-06, 'weight_decay': 0.00012400061805349665, 'epochs': 124, 'loss': 'mse', 'optimizer': 'adam', 'graph_mode': 'off', 'use_snp_selection': True, 'num_snps': 4891}. Best is trial 7 with value: 0.29814995432124725.
[I 2025-12-05 18:08:49,514] Trial 22 finished with value: 0.19933953495272036 and parameters: {'model_type': 'mlp', 'hidden_dims': '[256, 128, 64]', 'dropout': 0.4013090312694687, 'batch_norm': False, 'lr': 3.150846556770649e-06, 'weight_decay': 0.0008328236812719736, 'epochs': 80, 'loss': 'mse', 'optimizer': 'adam', 'graph_mode': 'off', 'use_snp_selection': True, 'num_snps': 5970}. Best is trial 7 with value: 0.29814995432124725.
[I 2025-12-05 18:09:20,423] Trial 23 finished with value: 0.29535585124284036 and parameters: {'model_type': 'mlp', 'hidden_dims': '[256, 128, 64]', 'dropout': 0.5341787702966053, 'batch_norm': False, 'lr': 8.43120530363261e-06, 'weight_decay': 2.240504506979302e-05, 'epochs': 151, 'loss': 'mse', 'optimizer': 'adam', 'graph_mode': 'off', 'use_snp_selection': True, 'num_snps': 19891}. Best is trial 7 with value: 0.29814995432124725.
[I 2025-12-05 18:09:51,440] Trial 24 finished with value: 0.2899913173099769 and parameters: {'model_type': 'mlp', 'hidden_dims': '[256, 128, 64]', 'dropout': 0.5501136007034853, 'batch_norm': False, 'lr': 1.1534709451212975e-05, 'weight_decay': 1.9921195632412032e-05, 'epochs': 175, 'loss': 'mse', 'optimizer': 'adam', 'graph_mode': 'off', 'use_snp_selection': True, 'num_snps': 19121}. Best is trial 7 with value: 0.29814995432124725.
[I 2025-12-05 18:10:20,803] Trial 25 finished with value: 0.29670622499790167 and parameters: {'model_type': 'mlp', 'hidden_dims': '[256, 128]', 'dropout': 0.5461927916812873, 'batch_norm': False, 'lr': 2.1327007056610556e-05, 'weight_decay': 1.0929546930008826e-06, 'epochs': 101, 'loss': 'mse', 'optimizer': 'adam', 'graph_mode': 'off', 'use_snp_selection': True, 'num_snps': 20569}. Best is trial 7 with value: 0.29814995432124725.
[I 2025-12-05 18:10:49,842] Trial 26 finished with value: 0.2848834634756546 and parameters: {'model_type': 'mlp', 'hidden_dims': '[256, 128]', 'dropout': 0.5387863658506276, 'batch_norm': True, 'lr': 3.72874286480512e-05, 'weight_decay': 8.210852147660032e-07, 'epochs': 104, 'loss': 'mse', 'optimizer': 'adam', 'graph_mode': 'off', 'use_snp_selection': True, 'num_snps': 19322}. Best is trial 7 with value: 0.29814995432124725.
[I 2025-12-05 18:11:18,672] Trial 27 finished with value: 0.29241428942625924 and parameters: {'model_type': 'mlp', 'hidden_dims': '[256, 128]', 'dropout': 0.46291185717352823, 'batch_norm': False, 'lr': 1.9949450484977675e-05, 'weight_decay': 2.251236434002934e-07, 'epochs': 62, 'loss': 'mse', 'optimizer': 'adam', 'graph_mode': 'off', 'use_snp_selection': True, 'num_snps': 21596}. Best is trial 7 with value: 0.29814995432124725.
[I 2025-12-05 18:11:51,765] Trial 28 finished with value: 0.2809970886823542 and parameters: {'model_type': 'mlp', 'hidden_dims': '[256, 128]', 'dropout': 0.5438358441131678, 'batch_norm': True, 'lr': 8.924242447185213e-05, 'weight_decay': 9.786752275289114e-07, 'epochs': 139, 'loss': 'mse', 'optimizer': 'adam', 'graph_mode': 'off', 'use_snp_selection': True, 'num_snps': 25270}. Best is trial 7 with value: 0.29814995432124725.
[I 2025-12-05 18:12:17,222] Trial 29 finished with value: 0.27456650223777535 and parameters: {'model_type': 'mlp', 'hidden_dims': '[128, 64]', 'dropout': 0.158646538937562, 'batch_norm': True, 'lr': 3.52496664741113e-05, 'weight_decay': 5.8719376067353354e-06, 'epochs': 90, 'loss': 'mse', 'optimizer': 'adam', 'graph_mode': 'off', 'use_snp_selection': True, 'num_snps': 13283}. Best is trial 7 with value: 0.29814995432124725.
[I 2025-12-05 18:12:51,504] Trial 30 finished with value: 0.2884361014803075 and parameters: {'model_type': 'mlp', 'hidden_dims': '[128, 64]', 'dropout': 0.24107635501409821, 'batch_norm': False, 'lr': 9.407662828090984e-06, 'weight_decay': 1.7671990398297825e-06, 'epochs': 68, 'loss': 'mse', 'optimizer': 'adam', 'graph_mode': 'off', 'use_snp_selection': True, 'num_snps': 40581}. Best is trial 7 with value: 0.29814995432124725.
[I 2025-12-05 18:13:33,451] Trial 31 finished with value: 0.294831323029864 and parameters: {'model_type': 'mlp', 'hidden_dims': '[256, 128, 64]', 'dropout': 0.5869613396945403, 'batch_norm': False, 'lr': 6.56299250940482e-06, 'weight_decay': 2.714620391063601e-05, 'epochs': 318, 'loss': 'mse', 'optimizer': 'adam', 'graph_mode': 'off', 'use_snp_selection': True, 'num_snps': 28626}. Best is trial 7 with value: 0.29814995432124725.
[I 2025-12-05 18:14:10,470] Trial 32 finished with value: 0.29309832311905676 and parameters: {'model_type': 'mlp', 'hidden_dims': '[256, 128, 64]', 'dropout': 0.5624216271481717, 'batch_norm': False, 'lr': 1.7522851066224262e-05, 'weight_decay': 8.36510674737704e-05, 'epochs': 203, 'loss': 'mse', 'optimizer': 'adam', 'graph_mode': 'off', 'use_snp_selection': True, 'num_snps': 28276}. Best is trial 7 with value: 0.29814995432124725.
[I 2025-12-05 18:14:38,087] Trial 33 finished with value: 0.23817603370198354 and parameters: {'model_type': 'mlp', 'hidden_dims': '[256, 128, 64]', 'dropout': 0.5092232566413951, 'batch_norm': False, 'lr': 2.228780330196809e-06, 'weight_decay': 1.1321672587025866e-05, 'epochs': 131, 'loss': 'mse', 'optimizer': 'adam', 'graph_mode': 'off', 'use_snp_selection': True, 'num_snps': 14448}. Best is trial 7 with value: 0.29814995432124725.
[I 2025-12-05 18:15:15,281] Trial 34 finished with value: 0.2908910471819664 and parameters: {'model_type': 'mlp', 'hidden_dims': '[256, 128, 64]', 'dropout': 0.4794415268388569, 'batch_norm': False, 'lr': 5.846144725607903e-06, 'weight_decay': 2.942248528077278e-05, 'epochs': 158, 'loss': 'mse', 'optimizer': 'adam', 'graph_mode': 'off', 'use_snp_selection': True, 'num_snps': 32362}. Best is trial 7 with value: 0.29814995432124725.
[I 2025-12-05 18:15:52,445] Trial 35 finished with value: 0.2971683656847037 and parameters: {'model_type': 'mlp', 'hidden_dims': '[256, 128]', 'dropout': 0.5693216453798496, 'batch_norm': False, 'lr': 8.624228347489908e-06, 'weight_decay': 1.1283027868592454e-05, 'epochs': 264, 'loss': 'mse', 'optimizer': 'adam', 'graph_mode': 'off', 'use_snp_selection': True, 'num_snps': 24788}. Best is trial 7 with value: 0.29814995432124725.
[I 2025-12-05 18:16:26,838] Trial 36 finished with value: 0.28647749008181805 and parameters: {'model_type': 'mlp', 'hidden_dims': '[256, 128]', 'dropout': 0.5251933394776815, 'batch_norm': True, 'lr': 8.911834323686984e-05, 'weight_decay': 1.088330811468832e-05, 'epochs': 266, 'loss': 'mse', 'optimizer': 'adam', 'graph_mode': 'off', 'use_snp_selection': True, 'num_snps': 20726}. Best is trial 7 with value: 0.29814995432124725.
[I 2025-12-05 18:17:18,075] Trial 37 finished with value: 0.28428070353900686 and parameters: {'model_type': 'mlp', 'hidden_dims': '[256, 128]', 'dropout': 0.44220173882354097, 'batch_norm': False, 'lr': 4.431091024594926e-05, 'weight_decay': 2.2770373967125918e-07, 'epochs': 229, 'loss': 'mse', 'optimizer': 'adam', 'graph_mode': 'off', 'use_snp_selection': True, 'num_snps': 50473}. Best is trial 7 with value: 0.29814995432124725.
[I 2025-12-05 18:17:51,798] Trial 38 finished with value: 0.2681307341586672 and parameters: {'model_type': 'mlp', 'hidden_dims': '[256, 128]', 'dropout': 0.42670931975003323, 'batch_norm': False, 'lr': 1.0661807028389818e-06, 'weight_decay': 3.7588360906651955e-06, 'epochs': 185, 'loss': 'mse', 'optimizer': 'adam', 'graph_mode': 'off', 'use_snp_selection': True, 'num_snps': 24172}. Best is trial 7 with value: 0.29814995432124725.
[I 2025-12-05 18:18:19,242] Trial 39 finished with value: 0.26655192736691247 and parameters: {'model_type': 'mlp', 'hidden_dims': '[256, 128]', 'dropout': 0.3714858195952754, 'batch_norm': True, 'lr': 2.65354402201826e-05, 'weight_decay': 8.602232344833824e-06, 'epochs': 105, 'loss': 'mse', 'optimizer': 'adam', 'graph_mode': 'off', 'use_snp_selection': True, 'num_snps': 15409}. Best is trial 7 with value: 0.29814995432124725.
[I 2025-12-05 18:18:46,573] Trial 40 finished with value: 0.26842366764962966 and parameters: {'model_type': 'mlp', 'hidden_dims': '[512, 128]', 'dropout': 0.5692393019763864, 'batch_norm': False, 'lr': 6.101953480476081e-05, 'weight_decay': 1.0180751623994228e-06, 'epochs': 148, 'loss': 'mse', 'optimizer': 'adam', 'graph_mode': 'off', 'use_snp_selection': True, 'num_snps': 9374}. Best is trial 7 with value: 0.29814995432124725.
[I 2025-12-05 18:19:28,186] Trial 41 finished with value: 0.2953265705587974 and parameters: {'model_type': 'mlp', 'hidden_dims': '[256, 128, 64]', 'dropout': 0.5893660105800396, 'batch_norm': False, 'lr': 2.155458340174251e-06, 'weight_decay': 1.5625253462062567e-05, 'epochs': 309, 'loss': 'mse', 'optimizer': 'adam', 'graph_mode': 'off', 'use_snp_selection': True, 'num_snps': 28343}. Best is trial 7 with value: 0.29814995432124725.
[I 2025-12-05 18:20:17,841] Trial 42 finished with value: 0.2950830376304875 and parameters: {'model_type': 'mlp', 'hidden_dims': '[512, 256]', 'dropout': 0.5603339312669798, 'batch_norm': False, 'lr': 2.0797058814051454e-06, 'weight_decay': 8.459934478755786e-06, 'epochs': 303, 'loss': 'mse', 'optimizer': 'adam', 'graph_mode': 'off', 'use_snp_selection': True, 'num_snps': 25717}. Best is trial 7 with value: 0.29814995432124725.
[I 2025-12-05 18:21:00,472] Trial 43 finished with value: 0.30059533810835426 and parameters: {'model_type': 'mlp', 'hidden_dims': '[256, 128]', 'dropout': 0.4875211082614949, 'batch_norm': False, 'lr': 4.782161113031396e-06, 'weight_decay': 1.621590567747949e-05, 'epochs': 260, 'loss': 'mse', 'optimizer': 'adam', 'graph_mode': 'off', 'use_snp_selection': True, 'num_snps': 33956}. Best is trial 43 with value: 0.30059533810835426.
[I 2025-12-05 18:21:44,913] Trial 44 finished with value: 0.3004028148135583 and parameters: {'model_type': 'mlp', 'hidden_dims': '[256, 128]', 'dropout': 0.47390822787946785, 'batch_norm': False, 'lr': 4.824735523804576e-06, 'weight_decay': 6.326719956903521e-05, 'epochs': 260, 'loss': 'mse', 'optimizer': 'adam', 'graph_mode': 'off', 'use_snp_selection': True, 'num_snps': 36519}. Best is trial 43 with value: 0.30059533810835426.
[I 2025-12-05 18:22:29,377] Trial 45 finished with value: 0.29624873502907695 and parameters: {'model_type': 'mlp', 'hidden_dims': '[256, 128]', 'dropout': 0.48471087850743055, 'batch_norm': False, 'lr': 4.624424176359465e-06, 'weight_decay': 0.0003470270526369785, 'epochs': 257, 'loss': 'mse', 'optimizer': 'adam', 'graph_mode': 'off', 'use_snp_selection': True, 'num_snps': 36894}. Best is trial 43 with value: 0.30059533810835426.
[I 2025-12-05 18:23:24,558] Trial 46 finished with value: 0.27872490346623396 and parameters: {'model_type': 'mlp', 'hidden_dims': '[256, 128]', 'dropout': 0.4247195032467042, 'batch_norm': True, 'lr': 1.0671627000262414e-05, 'weight_decay': 2.586465633915221e-06, 'epochs': 296, 'loss': 'mse', 'optimizer': 'adam', 'graph_mode': 'off', 'use_snp_selection': True, 'num_snps': 48640}. Best is trial 43 with value: 0.30059533810835426.
[I 2025-12-05 18:23:52,055] Trial 47 finished with value: 0.2784748987623993 and parameters: {'model_type': 'mlp', 'hidden_dims': '[256, 128]', 'dropout': 0.17109478935532332, 'batch_norm': False, 'lr': 1.582851470111704e-05, 'weight_decay': 6.556399076137253e-05, 'epochs': 252, 'loss': 'mse', 'optimizer': 'adam', 'graph_mode': 'off', 'use_snp_selection': False}. Best is trial 43 with value: 0.30059533810835426.
[I 2025-12-05 18:24:37,700] Trial 48 finished with value: 0.28499960680512004 and parameters: {'model_type': 'mlp', 'hidden_dims': '[256, 128]', 'dropout': 0.11702190037435414, 'batch_norm': False, 'lr': 4.4537800721894094e-06, 'weight_decay': 4.990685900213402e-07, 'epochs': 291, 'loss': 'mse', 'optimizer': 'adam', 'graph_mode': 'off', 'use_snp_selection': True, 'num_snps': 35201}. Best is trial 43 with value: 0.30059533810835426.
[I 2025-12-05 18:25:07,060] Trial 49 finished with value: 0.2785440320475729 and parameters: {'model_type': 'mlp', 'hidden_dims': '[256, 128]', 'dropout': 0.29097967478882236, 'batch_norm': True, 'lr': 2.944447115899625e-06, 'weight_decay': 3.922440403191647e-05, 'epochs': 270, 'loss': 'mse', 'optimizer': 'adam', 'graph_mode': 'off', 'use_snp_selection': False}. Best is trial 43 with value: 0.30059533810835426.
[I 2025-12-05 18:26:20,133] Trial 50 finished with value: 0.2777686192055421 and parameters: {'model_type': 'mlp', 'hidden_dims': '[512, 256]', 'dropout': 0.4935941167284606, 'batch_norm': False, 'lr': 1.5891075680526322e-06, 'weight_decay': 0.00018999579704985237, 'epochs': 332, 'loss': 'mae', 'optimizer': 'adam', 'graph_mode': 'off', 'use_snp_selection': True, 'num_snps': 43081}. Best is trial 43 with value: 0.30059533810835426.
[I 2025-12-05 18:27:04,679] Trial 51 finished with value: 0.3004509482158487 and parameters: {'model_type': 'mlp', 'hidden_dims': '[256, 128]', 'dropout': 0.4727452742103992, 'batch_norm': False, 'lr': 4.208152616838036e-06, 'weight_decay': 0.000517183522487578, 'epochs': 252, 'loss': 'mse', 'optimizer': 'adam', 'graph_mode': 'off', 'use_snp_selection': True, 'num_snps': 37246}. Best is trial 43 with value: 0.30059533810835426.
[I 2025-12-05 18:27:49,965] Trial 52 finished with value: 0.2972185461579545 and parameters: {'model_type': 'mlp', 'hidden_dims': '[256, 128]', 'dropout': 0.45475514155957253, 'batch_norm': False, 'lr': 7.699841918329295e-06, 'weight_decay': 0.0005319851184157527, 'epochs': 236, 'loss': 'mse', 'optimizer': 'adam', 'graph_mode': 'off', 'use_snp_selection': True, 'num_snps': 39387}. Best is trial 43 with value: 0.30059533810835426.
[I 2025-12-05 18:28:34,599] Trial 53 finished with value: 0.29832901173266296 and parameters: {'model_type': 'mlp', 'hidden_dims': '[256, 128]', 'dropout': 0.36926378328156306, 'batch_norm': False, 'lr': 4.830171618412007e-06, 'weight_decay': 0.0005085682106246012, 'epochs': 225, 'loss': 'mse', 'optimizer': 'adam', 'graph_mode': 'off', 'use_snp_selection': True, 'num_snps': 39318}. Best is trial 43 with value: 0.30059533810835426.
[I 2025-12-05 18:28:59,640] Trial 54 finished with value: 0.29898577121817466 and parameters: {'model_type': 'mlp', 'hidden_dims': '[256, 128]', 'dropout': 0.3751782710350493, 'batch_norm': False, 'lr': 5.570609223865269e-06, 'weight_decay': 0.0005283757538307104, 'epochs': 225, 'loss': 'mse', 'optimizer': 'adam', 'graph_mode': 'off', 'use_snp_selection': False}. Best is trial 43 with value: 0.30059533810835426.
[I 2025-12-05 18:29:43,580] Trial 55 finished with value: 0.30310428546197843 and parameters: {'model_type': 'mlp', 'hidden_dims': '[512, 256]', 'dropout': 0.36584092981992516, 'batch_norm': False, 'lr': 2.6209422480933736e-06, 'weight_decay': 0.0004966379918301767, 'epochs': 222, 'loss': 'mse', 'optimizer': 'adam', 'graph_mode': 'off', 'use_snp_selection': False}. Best is trial 55 with value: 0.30310428546197843.
[I 2025-12-05 18:30:08,037] Trial 56 finished with value: 0.2989564698207555 and parameters: {'model_type': 'mlp', 'hidden_dims': '[256, 128]', 'dropout': 0.36750992714989406, 'batch_norm': False, 'lr': 2.983413292094254e-06, 'weight_decay': 0.0004536791365698027, 'epochs': 218, 'loss': 'mse', 'optimizer': 'adam', 'graph_mode': 'off', 'use_snp_selection': False}. Best is trial 55 with value: 0.30310428546197843.
[I 2025-12-05 18:30:50,181] Trial 57 finished with value: 0.30073031339698914 and parameters: {'model_type': 'mlp', 'hidden_dims': '[512, 256]', 'dropout': 0.3247702922653595, 'batch_norm': False, 'lr': 2.9397229135834736e-06, 'weight_decay': 0.00026210417349086895, 'epochs': 211, 'loss': 'mse', 'optimizer': 'adam', 'graph_mode': 'off', 'use_snp_selection': False}. Best is trial 55 with value: 0.30310428546197843.
[I 2025-12-05 18:31:39,096] Trial 58 finished with value: 0.2679025783827094 and parameters: {'model_type': 'mlp', 'hidden_dims': '[512, 256]', 'dropout': 0.32879474388577945, 'batch_norm': False, 'lr': 1.1923767920815825e-06, 'weight_decay': 0.00024258876581182494, 'epochs': 249, 'loss': 'mae', 'optimizer': 'adam', 'graph_mode': 'off', 'use_snp_selection': False}. Best is trial 55 with value: 0.30310428546197843.
[I 2025-12-05 18:32:20,625] Trial 59 finished with value: 0.29595967401332246 and parameters: {'model_type': 'mlp', 'hidden_dims': '[512, 256]', 'dropout': 0.40937480134487175, 'batch_norm': False, 'lr': 1.3811403346813842e-06, 'weight_decay': 0.00010982830851103828, 'epochs': 207, 'loss': 'mse', 'optimizer': 'adam', 'graph_mode': 'off', 'use_snp_selection': False}. Best is trial 55 with value: 0.30310428546197843.
[I 2025-12-05 18:33:07,976] Trial 60 finished with value: 0.29959500234153624 and parameters: {'model_type': 'mlp', 'hidden_dims': '[512, 256]', 'dropout': 0.32804763573167883, 'batch_norm': False, 'lr': 2.5746058955725373e-06, 'weight_decay': 0.0009651350071508655, 'epochs': 240, 'loss': 'mse', 'optimizer': 'adam', 'graph_mode': 'off', 'use_snp_selection': False}. Best is trial 55 with value: 0.30310428546197843.
[I 2025-12-05 18:33:55,543] Trial 61 finished with value: 0.3015126656550815 and parameters: {'model_type': 'mlp', 'hidden_dims': '[512, 256]', 'dropout': 0.33577119343182105, 'batch_norm': False, 'lr': 2.5446494388123717e-06, 'weight_decay': 0.0009678073685613558, 'epochs': 241, 'loss': 'mse', 'optimizer': 'adam', 'graph_mode': 'off', 'use_snp_selection': False}. Best is trial 55 with value: 0.30310428546197843.
