[I 2025-12-06 01:56:25,263] Trial 63 finished with value: 0.3779823720321005 and parameters: {'model_type': 'mlp', 'hidden_dims': '[512, 256]', 'dropout': 0.4464141142319012, 'batch_norm': False, 'lr': 3.016796773773785e-06, 'weight_decay': 0.0002983093973859541, 'epochs': 261, 'loss': 'mae', 'optimizer': 'adam', 'graph_mode': 'off', 'use_snp_selection': False}. Best is trial 51 with value: 0.3842203610377356.
[I 2025-12-06 01:56:44,258] Trial 64 finished with value: 0.3697318957847814 and parameters: {'model_type': 'mlp', 'hidden_dims': '[512, 256]', 'dropout': 0.5125635834804686, 'batch_norm': False, 'lr': 5.74642536470168e-06, 'weight_decay': 0.00017954095696368246, 'epochs': 75, 'loss': 'mae', 'optimizer': 'adam', 'graph_mode': 'off', 'use_snp_selection': False}. Best is trial 51 with value: 0.3842203610377356.
[I 2025-12-06 01:57:47,796] Trial 65 finished with value: 0.3806552346086164 and parameters: {'model_type': 'mlp', 'hidden_dims': '[512, 64]', 'dropout': 0.5330948517536456, 'batch_norm': False, 'lr': 2.2001529507987876e-06, 'weight_decay': 0.00045209638744562097, 'epochs': 309, 'loss': 'mae', 'optimizer': 'adam', 'graph_mode': 'off', 'use_snp_selection': False}. Best is trial 51 with value: 0.3842203610377356.
[I 2025-12-06 01:58:33,634] Trial 66 finished with value: 0.3492744076233286 and parameters: {'model_type': 'mlp', 'hidden_dims': '[512, 256]', 'dropout': 0.46293848761831713, 'batch_norm': False, 'lr': 1.1343646336329905e-06, 'weight_decay': 5.3410786615627756e-05, 'epochs': 248, 'loss': 'mae', 'optimizer': 'adam', 'graph_mode': 'off', 'use_snp_selection': True, 'num_snps': 22881}. Best is trial 51 with value: 0.3842203610377356.
[I 2025-12-06 01:59:05,097] Trial 67 finished with value: 0.3752124431167717 and parameters: {'model_type': 'mlp', 'hidden_dims': '[256, 128]', 'dropout': 0.4788272903697638, 'batch_norm': False, 'lr': 7.42203979589228e-06, 'weight_decay': 0.00011701266509243766, 'epochs': 276, 'loss': 'mae', 'optimizer': 'adam', 'graph_mode': 'off', 'use_snp_selection': False}. Best is trial 51 with value: 0.3842203610377356.
[I 2025-12-06 02:00:16,643] Trial 68 finished with value: 0.3770624370216015 and parameters: {'model_type': 'mlp', 'hidden_dims': '[512, 256]', 'dropout': 0.5799347149549375, 'batch_norm': False, 'lr': 4.218297039177453e-06, 'weight_decay': 0.0002194779677522415, 'epochs': 349, 'loss': 'mae', 'optimizer': 'adam', 'graph_mode': 'off', 'use_snp_selection': False}. Best is trial 51 with value: 0.3842203610377356.
[I 2025-12-06 02:00:38,335] Trial 69 finished with value: 0.3713761065765749 and parameters: {'model_type': 'mlp', 'hidden_dims': '[128, 64]', 'dropout': 0.5513115401150331, 'batch_norm': False, 'lr': 1.5006379676206754e-05, 'weight_decay': 3.238251318456543e-05, 'epochs': 324, 'loss': 'mae', 'optimizer': 'adam', 'graph_mode': 'off', 'use_snp_selection': False}. Best is trial 51 with value: 0.3842203610377356.
[I 2025-12-06 02:01:39,300] Trial 70 finished with value: 0.3260109844065463 and parameters: {'model_type': 'mlp', 'hidden_dims': '[512, 128]', 'dropout': 0.2833082857186198, 'batch_norm': True, 'lr': 3.2367872707903654e-06, 'weight_decay': 0.00014030330002663433, 'epochs': 291, 'loss': 'mae', 'optimizer': 'adam', 'graph_mode': 'off', 'use_snp_selection': False}. Best is trial 51 with value: 0.3842203610377356.
[I 2025-12-06 02:02:41,956] Trial 71 finished with value: 0.3819200799686423 and parameters: {'model_type': 'mlp', 'hidden_dims': '[512, 256]', 'dropout': 0.5005328118808076, 'batch_norm': False, 'lr': 2.430823934523866e-06, 'weight_decay': 8.5752237305751e-05, 'epochs': 302, 'loss': 'mae', 'optimizer': 'adam', 'graph_mode': 'off', 'use_snp_selection': False}. Best is trial 51 with value: 0.3842203610377356.
[I 2025-12-06 02:03:45,178] Trial 72 finished with value: 0.382122143763195 and parameters: {'model_type': 'mlp', 'hidden_dims': '[512, 256]', 'dropout': 0.49959449623510144, 'batch_norm': False, 'lr': 2.43864108157557e-06, 'weight_decay': 8.996881568966579e-05, 'epochs': 305, 'loss': 'mae', 'optimizer': 'adam', 'graph_mode': 'off', 'use_snp_selection': False}. Best is trial 51 with value: 0.3842203610377356.
[I 2025-12-06 02:04:48,560] Trial 73 finished with value: 0.37888038438110305 and parameters: {'model_type': 'mlp', 'hidden_dims': '[512, 256]', 'dropout': 0.5244342251639855, 'batch_norm': False, 'lr': 2.429195753977842e-06, 'weight_decay': 6.7241096146744644e-06, 'epochs': 306, 'loss': 'mae', 'optimizer': 'adam', 'graph_mode': 'off', 'use_snp_selection': False}. Best is trial 51 with value: 0.3842203610377356.
[I 2025-12-06 02:05:47,931] Trial 74 finished with value: 0.3794702649315369 and parameters: {'model_type': 'mlp', 'hidden_dims': '[512, 256]', 'dropout': 0.4938335968233374, 'batch_norm': False, 'lr': 1.7353136125186194e-06, 'weight_decay': 8.604746000340784e-05, 'epochs': 285, 'loss': 'mae', 'optimizer': 'adam', 'graph_mode': 'off', 'use_snp_selection': False}. Best is trial 51 with value: 0.3842203610377356.
[I 2025-12-06 02:06:43,644] Trial 75 finished with value: 0.3811364388095956 and parameters: {'model_type': 'mlp', 'hidden_dims': '[512, 256]', 'dropout': 0.19651999700510298, 'batch_norm': False, 'lr': 1.55924780442917e-06, 'weight_decay': 6.0133775903278356e-05, 'epochs': 265, 'loss': 'mae', 'optimizer': 'adam', 'graph_mode': 'off', 'use_snp_selection': False}. Best is trial 51 with value: 0.3842203610377356.
[I 2025-12-06 02:07:46,902] Trial 76 finished with value: 0.37736128016329207 and parameters: {'model_type': 'mlp', 'hidden_dims': '[512, 256]', 'dropout': 0.43182336772600904, 'batch_norm': False, 'lr': 4.36404119049553e-06, 'weight_decay': 1.4460055893813594e-05, 'epochs': 305, 'loss': 'mae', 'optimizer': 'adam', 'graph_mode': 'off', 'use_snp_selection': False}. Best is trial 51 with value: 0.3842203610377356.
[I 2025-12-06 02:08:19,100] Trial 77 finished with value: 0.38061097142421385 and parameters: {'model_type': 'mlp', 'hidden_dims': '[256, 128, 64]', 'dropout': 0.44879972955346875, 'batch_norm': False, 'lr': 2.633783175905434e-06, 'weight_decay': 0.00028986634409963285, 'epochs': 279, 'loss': 'mse', 'optimizer': 'adam', 'graph_mode': 'off', 'use_snp_selection': False}. Best is trial 51 with value: 0.3842203610377356.
[I 2025-12-06 02:08:43,463] Trial 78 finished with value: 0.28941091964454957 and parameters: {'model_type': 'mlp', 'hidden_dims': '[512, 256]', 'dropout': 0.5095903014946855, 'batch_norm': False, 'lr': 2.0042660233731914e-06, 'weight_decay': 0.0002186777809760896, 'epochs': 294, 'loss': 'mae', 'optimizer': 'adam', 'graph_mode': 'off', 'use_snp_selection': True, 'num_snps': 2246}. Best is trial 51 with value: 0.3842203610377356.
[I 2025-12-06 02:09:48,748] Trial 79 finished with value: 0.3775143265206721 and parameters: {'model_type': 'mlp', 'hidden_dims': '[512, 256]', 'dropout': 0.4826803268544565, 'batch_norm': False, 'lr': 3.967055949453939e-06, 'weight_decay': 0.0005488755254416521, 'epochs': 318, 'loss': 'mae', 'optimizer': 'adam', 'graph_mode': 'off', 'use_snp_selection': False}. Best is trial 51 with value: 0.3842203610377356.
[I 2025-12-06 02:10:51,841] Trial 80 finished with value: 0.37378032374666453 and parameters: {'model_type': 'mlp', 'hidden_dims': '[512, 256]', 'dropout': 0.49921139470438597, 'batch_norm': False, 'lr': 1.4370262757694236e-06, 'weight_decay': 2.952984899654725e-05, 'epochs': 304, 'loss': 'mae', 'optimizer': 'adam', 'graph_mode': 'off', 'use_snp_selection': False}. Best is trial 51 with value: 0.3842203610377356.
[I 2025-12-06 02:12:00,842] Trial 81 finished with value: 0.3795602281681256 and parameters: {'model_type': 'mlp', 'hidden_dims': '[512, 256]', 'dropout': 0.46198513152822956, 'batch_norm': False, 'lr': 3.1849797444191553e-06, 'weight_decay': 9.757857076995268e-05, 'epochs': 335, 'loss': 'mae', 'optimizer': 'adam', 'graph_mode': 'off', 'use_snp_selection': False}. Best is trial 51 with value: 0.3842203610377356.
[I 2025-12-06 02:13:07,955] Trial 82 finished with value: 0.3844016530527869 and parameters: {'model_type': 'mlp', 'hidden_dims': '[512, 256]', 'dropout': 0.531579314051602, 'batch_norm': False, 'lr': 2.566234030393574e-06, 'weight_decay': 6.87212410714008e-05, 'epochs': 326, 'loss': 'mae', 'optimizer': 'adam', 'graph_mode': 'off', 'use_snp_selection': False}. Best is trial 82 with value: 0.3844016530527869.
[I 2025-12-06 02:14:15,196] Trial 83 finished with value: 0.38144755467552705 and parameters: {'model_type': 'mlp', 'hidden_dims': '[512, 256]', 'dropout': 0.5356722300577728, 'batch_norm': False, 'lr': 5.43213187012073e-06, 'weight_decay': 5.095072222682632e-05, 'epochs': 327, 'loss': 'mae', 'optimizer': 'adam', 'graph_mode': 'off', 'use_snp_selection': False}. Best is trial 82 with value: 0.3844016530527869.
[I 2025-12-06 02:14:55,119] Trial 84 finished with value: 0.3683044585985062 and parameters: {'model_type': 'mlp', 'hidden_dims': '[512, 256]', 'dropout': 0.5187210989688927, 'batch_norm': False, 'lr': 2.3761479838512873e-06, 'weight_decay': 2.1974707835605155e-07, 'epochs': 184, 'loss': 'mae', 'optimizer': 'adam', 'graph_mode': 'off', 'use_snp_selection': False}. Best is trial 82 with value: 0.3844016530527869.
[I 2025-12-06 02:15:59,720] Trial 85 finished with value: 0.3780652316064613 and parameters: {'model_type': 'mlp', 'hidden_dims': '[512, 256]', 'dropout': 0.40031945832789784, 'batch_norm': False, 'lr': 1.1290424399177022e-06, 'weight_decay': 6.78105958435975e-05, 'epochs': 312, 'loss': 'mae', 'optimizer': 'adam', 'graph_mode': 'off', 'use_snp_selection': False}. Best is trial 82 with value: 0.3844016530527869.
[I 2025-12-06 02:17:01,905] Trial 86 finished with value: 0.381656710826421 and parameters: {'model_type': 'mlp', 'hidden_dims': '[512, 256]', 'dropout': 0.46940652939218624, 'batch_norm': False, 'lr': 2.830065246005247e-06, 'weight_decay': 0.0001373990038890886, 'epochs': 300, 'loss': 'mae', 'optimizer': 'adam', 'graph_mode': 'off', 'use_snp_selection': False}. Best is trial 82 with value: 0.3844016530527869.
[I 2025-12-06 02:18:04,342] Trial 87 finished with value: 0.35198431207373243 and parameters: {'model_type': 'mlp', 'hidden_dims': '[512, 64]', 'dropout': 0.5509811935196718, 'batch_norm': True, 'lr': 1.7570955044439648e-06, 'weight_decay': 8.414432391697408e-05, 'epochs': 300, 'loss': 'mae', 'optimizer': 'adam', 'graph_mode': 'off', 'use_snp_selection': False}. Best is trial 82 with value: 0.3844016530527869.
[I 2025-12-06 02:18:40,498] Trial 88 finished with value: 0.3779846139349824 and parameters: {'model_type': 'mlp', 'hidden_dims': '[256, 128]', 'dropout': 0.4725878096065762, 'batch_norm': False, 'lr': 3.487918070467411e-06, 'weight_decay': 4.524001566692033e-05, 'epochs': 321, 'loss': 'mae', 'optimizer': 'adam', 'graph_mode': 'off', 'use_snp_selection': False}. Best is trial 82 with value: 0.3844016530527869.
[I 2025-12-06 02:19:26,497] Trial 89 finished with value: 0.37738979940548245 and parameters: {'model_type': 'mlp', 'hidden_dims': '[128, 64]', 'dropout': 0.5750515752011063, 'batch_norm': False, 'lr': 4.645500979311817e-06, 'weight_decay': 2.227322455008441e-05, 'epochs': 340, 'loss': 'mse', 'optimizer': 'adam', 'graph_mode': 'off', 'use_snp_selection': True, 'num_snps': 45058}. Best is trial 82 with value: 0.3844016530527869.
[I 2025-12-06 02:20:30,666] Trial 90 finished with value: 0.37398893170733805 and parameters: {'model_type': 'mlp', 'hidden_dims': '[512, 256]', 'dropout': 0.4219640698793183, 'batch_norm': False, 'lr': 6.404815025820951e-06, 'weight_decay': 0.0001884134987622482, 'epochs': 313, 'loss': 'mae', 'optimizer': 'adam', 'graph_mode': 'off', 'use_snp_selection': False}. Best is trial 82 with value: 0.3844016530527869.
[I 2025-12-06 02:21:30,868] Trial 91 finished with value: 0.38153072658465026 and parameters: {'model_type': 'mlp', 'hidden_dims': '[512, 256]', 'dropout': 0.4994813023303405, 'batch_norm': False, 'lr': 2.6682629615610587e-06, 'weight_decay': 0.00016382154210919011, 'epochs': 290, 'loss': 'mae', 'optimizer': 'adam', 'graph_mode': 'off', 'use_snp_selection': False}. Best is trial 82 with value: 0.3844016530527869.
[I 2025-12-06 02:22:31,174] Trial 92 finished with value: 0.38262989876621134 and parameters: {'model_type': 'mlp', 'hidden_dims': '[512, 256]', 'dropout': 0.5025592771831027, 'batch_norm': False, 'lr': 2.1671555441823186e-06, 'weight_decay': 0.00012336098891051577, 'epochs': 290, 'loss': 'mae', 'optimizer': 'adam', 'graph_mode': 'off', 'use_snp_selection': False}. Best is trial 82 with value: 0.3844016530527869.
[I 2025-12-06 02:23:31,634] Trial 93 finished with value: 0.37823004670235016 and parameters: {'model_type': 'mlp', 'hidden_dims': '[512, 256]', 'dropout': 0.5263678796726746, 'batch_norm': False, 'lr': 2.1125386756304495e-06, 'weight_decay': 0.00012945206523617966, 'epochs': 291, 'loss': 'mae', 'optimizer': 'adam', 'graph_mode': 'off', 'use_snp_selection': False}. Best is trial 82 with value: 0.3844016530527869.
[I 2025-12-06 02:24:28,605] Trial 94 finished with value: 0.3785242764474357 and parameters: {'model_type': 'mlp', 'hidden_dims': '[512, 256]', 'dropout': 0.48790488090998335, 'batch_norm': False, 'lr': 2.7824526816830163e-06, 'weight_decay': 0.0003643545121926669, 'epochs': 273, 'loss': 'mae', 'optimizer': 'adam', 'graph_mode': 'off', 'use_snp_selection': False}. Best is trial 82 with value: 0.3844016530527869.
[I 2025-12-06 02:25:26,723] Trial 95 finished with value: 0.3798804895311661 and parameters: {'model_type': 'mlp', 'hidden_dims': '[512, 256]', 'dropout': 0.5054222616527548, 'batch_norm': False, 'lr': 1.57789006997444e-06, 'weight_decay': 0.0002474997779713358, 'epochs': 279, 'loss': 'mae', 'optimizer': 'adam', 'graph_mode': 'off', 'use_snp_selection': False}. Best is trial 82 with value: 0.3844016530527869.
[I 2025-12-06 02:26:28,229] Trial 96 finished with value: 0.3684728375837486 and parameters: {'model_type': 'mlp', 'hidden_dims': '[512, 128]', 'dropout': 0.5411558669757107, 'batch_norm': False, 'lr': 1.3016042594392785e-06, 'weight_decay': 0.00017495577908212216, 'epochs': 298, 'loss': 'mae', 'optimizer': 'adam', 'graph_mode': 'off', 'use_snp_selection': False}. Best is trial 82 with value: 0.3844016530527869.
[I 2025-12-06 02:27:22,560] Trial 97 finished with value: 0.3797771270568519 and parameters: {'model_type': 'mlp', 'hidden_dims': '[512, 256]', 'dropout': 0.4410782806057319, 'batch_norm': False, 'lr': 2.0366571424750433e-06, 'weight_decay': 0.00042808676466179904, 'epochs': 259, 'loss': 'mae', 'optimizer': 'adam', 'graph_mode': 'off', 'use_snp_selection': False}. Best is trial 82 with value: 0.3844016530527869.
[I 2025-12-06 02:28:23,274] Trial 98 finished with value: 0.3788311430339117 and parameters: {'model_type': 'mlp', 'hidden_dims': '[512, 256]', 'dropout': 0.4962900325646051, 'batch_norm': False, 'lr': 3.6963922769815712e-06, 'weight_decay': 0.00010002665871913786, 'epochs': 291, 'loss': 'mae', 'optimizer': 'adam', 'graph_mode': 'off', 'use_snp_selection': False}. Best is trial 82 with value: 0.3844016530527869.
[I 2025-12-06 02:28:52,577] Trial 99 finished with value: 0.3677263047811882 and parameters: {'model_type': 'mlp', 'hidden_dims': '[256, 128, 64]', 'dropout': 0.5116621319573459, 'batch_norm': False, 'lr': 2.989342278398937e-06, 'weight_decay': 0.00012080517364259415, 'epochs': 251, 'loss': 'mae', 'optimizer': 'adam', 'graph_mode': 'off', 'use_snp_selection': False}. Best is trial 82 with value: 0.3844016530527869.
[I 2025-12-06 02:29:42,787] Trial 100 finished with value: 0.3804916257141277 and parameters: {'model_type': 'mlp', 'hidden_dims': '[512, 256]', 'dropout': 0.3702599170999101, 'batch_norm': False, 'lr': 1.7756830808937907e-06, 'weight_decay': 0.0003175082260691417, 'epochs': 237, 'loss': 'mae', 'optimizer': 'adam', 'graph_mode': 'off', 'use_snp_selection': False}. Best is trial 82 with value: 0.3844016530527869.
[I 2025-12-06 02:30:51,168] Trial 101 finished with value: 0.37879531571481884 and parameters: {'model_type': 'mlp', 'hidden_dims': '[512, 256]', 'dropout': 0.5310347965753559, 'batch_norm': False, 'lr': 3.924129172765499e-06, 'weight_decay': 7.228547673950077e-05, 'epochs': 332, 'loss': 'mae', 'optimizer': 'adam', 'graph_mode': 'off', 'use_snp_selection': False}. Best is trial 82 with value: 0.3844016530527869.
[I 2025-12-06 02:31:54,589] Trial 102 finished with value: 0.3777839901600696 and parameters: {'model_type': 'mlp', 'hidden_dims': '[512, 256]', 'dropout': 0.556525715933123, 'batch_norm': False, 'lr': 2.680090752659054e-06, 'weight_decay': 0.00016065912012294006, 'epochs': 303, 'loss': 'mae', 'optimizer': 'adam', 'graph_mode': 'off', 'use_snp_selection': False}. Best is trial 82 with value: 0.3844016530527869.
[I 2025-12-06 02:32:58,044] Trial 103 finished with value: 0.3552207616168114 and parameters: {'model_type': 'mlp', 'hidden_dims': '[512, 256]', 'dropout': 0.48262257152602067, 'batch_norm': False, 'lr': 8.427082884538236e-05, 'weight_decay': 8.913475887040982e-05, 'epochs': 316, 'loss': 'mae', 'optimizer': 'adam', 'graph_mode': 'off', 'use_snp_selection': False}. Best is trial 82 with value: 0.3844016530527869.
[I 2025-12-06 02:34:04,942] Trial 104 finished with value: 0.3791661658954001 and parameters: {'model_type': 'mlp', 'hidden_dims': '[512, 256]', 'dropout': 0.5181132511109726, 'batch_norm': False, 'lr': 3.2094219605977056e-06, 'weight_decay': 0.00023731455162403388, 'epochs': 324, 'loss': 'mae', 'optimizer': 'adam', 'graph_mode': 'off', 'use_snp_selection': False}. Best is trial 82 with value: 0.3844016530527869.
[I 2025-12-06 02:35:04,411] Trial 105 finished with value: 0.35217509658675084 and parameters: {'model_type': 'mlp', 'hidden_dims': '[512, 256]', 'dropout': 0.49969202348154695, 'batch_norm': True, 'lr': 2.147941038143576e-06, 'weight_decay': 0.00013911764480643268, 'epochs': 282, 'loss': 'mae', 'optimizer': 'adam', 'graph_mode': 'off', 'use_snp_selection': False}. Best is trial 82 with value: 0.3844016530527869.
[I 2025-12-06 02:35:58,967] Trial 106 finished with value: 0.357932370571849 and parameters: {'model_type': 'mlp', 'hidden_dims': '[512, 256]', 'dropout': 0.47107756332081213, 'batch_norm': False, 'lr': 4.185771180013458e-05, 'weight_decay': 5.6587904062080805e-05, 'epochs': 267, 'loss': 'mae', 'optimizer': 'adam', 'graph_mode': 'off', 'use_snp_selection': False}. Best is trial 82 with value: 0.3844016530527869.
[I 2025-12-06 02:37:03,464] Trial 107 finished with value: 0.36801215212611427 and parameters: {'model_type': 'mlp', 'hidden_dims': '[512, 256]', 'dropout': 0.3384141697551572, 'batch_norm': False, 'lr': 2.328795214848386e-06, 'weight_decay': 0.00011472083880124623, 'epochs': 311, 'loss': 'mse', 'optimizer': 'adam', 'graph_mode': 'off', 'use_snp_selection': False}. Best is trial 82 with value: 0.3844016530527869.
[I 2025-12-06 02:37:38,311] Trial 108 finished with value: 0.3753358228766322 and parameters: {'model_type': 'mlp', 'hidden_dims': '[512, 256]', 'dropout': 0.48455947752239115, 'batch_norm': False, 'lr': 4.6622297912473575e-06, 'weight_decay': 0.00019640108274761786, 'epochs': 294, 'loss': 'mae', 'optimizer': 'adam', 'graph_mode': 'off', 'use_snp_selection': True, 'num_snps': 11322}. Best is trial 82 with value: 0.3844016530527869.
[I 2025-12-06 02:38:11,397] Trial 109 finished with value: 0.33162697523254153 and parameters: {'model_type': 'mlp', 'hidden_dims': '[512, 256]', 'dropout': 0.451450045722465, 'batch_norm': False, 'lr': 0.00037610220606246186, 'weight_decay': 7.670839348292452e-05, 'epochs': 155, 'loss': 'mae', 'optimizer': 'adam', 'graph_mode': 'off', 'use_snp_selection': False}. Best is trial 82 with value: 0.3844016530527869.
[I 2025-12-06 02:38:58,910] Trial 110 finished with value: 0.37581754282085755 and parameters: {'model_type': 'mlp', 'hidden_dims': '[512, 64]', 'dropout': 0.5195469905629135, 'batch_norm': False, 'lr': 2.71348656188746e-06, 'weight_decay': 0.000613908883173441, 'epochs': 225, 'loss': 'mae', 'optimizer': 'adam', 'graph_mode': 'off', 'use_snp_selection': False}. Best is trial 82 with value: 0.3844016530527869.
[I 2025-12-06 02:39:58,265] Trial 111 finished with value: 0.38063272966284806 and parameters: {'model_type': 'mlp', 'hidden_dims': '[512, 256]', 'dropout': 0.45592053410756356, 'batch_norm': False, 'lr': 2.4246513643059902e-06, 'weight_decay': 0.00016538283593531955, 'epochs': 285, 'loss': 'mae', 'optimizer': 'adam', 'graph_mode': 'off', 'use_snp_selection': False}. Best is trial 82 with value: 0.3844016530527869.
[I 2025-12-06 02:40:43,200] Trial 112 finished with value: 0.37483444305914915 and parameters: {'model_type': 'mlp', 'hidden_dims': '[512, 256]', 'dropout': 0.49283226430513327, 'batch_norm': False, 'lr': 1.8972459114126122e-06, 'weight_decay': 0.00010835499442023905, 'epochs': 210, 'loss': 'mae', 'optimizer': 'adam', 'graph_mode': 'off', 'use_snp_selection': False}. Best is trial 82 with value: 0.3844016530527869.
[I 2025-12-06 02:41:40,228] Trial 113 finished with value: 0.3812207421561542 and parameters: {'model_type': 'mlp', 'hidden_dims': '[512, 256]', 'dropout': 0.4642567541711337, 'batch_norm': False, 'lr': 3.4045304954170777e-06, 'weight_decay': 0.00014015928381428192, 'epochs': 273, 'loss': 'mae', 'optimizer': 'adam', 'graph_mode': 'off', 'use_snp_selection': False}. Best is trial 82 with value: 0.3844016530527869.
[I 2025-12-06 02:42:42,639] Trial 114 finished with value: 0.37844888436143675 and parameters: {'model_type': 'mlp', 'hidden_dims': '[512, 256]', 'dropout': 0.5078203280782018, 'batch_norm': False, 'lr': 2.5975889248902e-06, 'weight_decay': 2.9189768220037662e-06, 'epochs': 301, 'loss': 'mae', 'optimizer': 'adam', 'graph_mode': 'off', 'use_snp_selection': False}. Best is trial 82 with value: 0.3844016530527869.
