[I 2025-12-05 15:41:00,342] Trial 76 finished with value: 0.09896817870728057 and parameters: {'model_type': 'mlp', 'hidden_dims': '[512, 64]', 'dropout': 0.18473240149992762, 'batch_norm': True, 'lr': 0.00042825147778596015, 'weight_decay': 1.875999625967326e-07, 'epochs': 190, 'loss': 'mse', 'optimizer': 'adam', 'graph_mode': 'off', 'use_snp_selection': False}. Best is trial 52 with value: 0.10875387441577535.
[I 2025-12-05 15:41:01,775] Trial 77 finished with value: 0.04503882490821784 and parameters: {'model_type': 'mlp', 'hidden_dims': '[512, 64]', 'dropout': 0.1804166928172319, 'batch_norm': True, 'lr': 1.9067584181326899e-06, 'weight_decay': 1.9455359884186568e-07, 'epochs': 193, 'loss': 'mse', 'optimizer': 'adam', 'graph_mode': 'off', 'use_snp_selection': False}. Best is trial 52 with value: 0.10875387441577535.
[I 2025-12-05 15:41:04,075] Trial 78 finished with value: 0.07837621398546746 and parameters: {'model_type': 'mlp', 'hidden_dims': '[256, 128, 64]', 'dropout': 0.24031198143386728, 'batch_norm': False, 'lr': 0.0004178619309466827, 'weight_decay': 1.275409105861227e-07, 'epochs': 250, 'loss': 'mse', 'optimizer': 'adam', 'graph_mode': 'off', 'use_snp_selection': True, 'num_snps': 47926}. Best is trial 52 with value: 0.10875387441577535.
[I 2025-12-05 15:41:05,269] Trial 79 finished with value: 0.09095031868148651 and parameters: {'model_type': 'mlp', 'hidden_dims': '[512, 256]', 'dropout': 0.21987073348162667, 'batch_norm': True, 'lr': 0.0002760489863016447, 'weight_decay': 1.1192099146433137e-06, 'epochs': 117, 'loss': 'mse', 'optimizer': 'adam', 'graph_mode': 'off', 'use_snp_selection': False}. Best is trial 52 with value: 0.10875387441577535.
[I 2025-12-05 15:41:06,497] Trial 80 finished with value: 0.07092189156324648 and parameters: {'model_type': 'mlp', 'hidden_dims': '[512, 64]', 'dropout': 0.18943435026773425, 'batch_norm': True, 'lr': 8.96779426958401e-05, 'weight_decay': 2.000528179870577e-05, 'epochs': 141, 'loss': 'mse', 'optimizer': 'adam', 'graph_mode': 'off', 'use_snp_selection': False}. Best is trial 52 with value: 0.10875387441577535.
[I 2025-12-05 15:41:07,657] Trial 81 finished with value: 0.0813857447027146 and parameters: {'model_type': 'mlp', 'hidden_dims': '[512, 256]', 'dropout': 0.1494778380478707, 'batch_norm': True, 'lr': 0.00031250132696293326, 'weight_decay': 1.1471897505287585e-06, 'epochs': 121, 'loss': 'mse', 'optimizer': 'adam', 'graph_mode': 'off', 'use_snp_selection': False}. Best is trial 52 with value: 0.10875387441577535.
[I 2025-12-05 15:41:08,772] Trial 82 finished with value: 0.07510020108808109 and parameters: {'model_type': 'mlp', 'hidden_dims': '[512, 256]', 'dropout': 0.2780265783632174, 'batch_norm': True, 'lr': 0.0002580617809438376, 'weight_decay': 4.298991919207884e-06, 'epochs': 107, 'loss': 'mse', 'optimizer': 'adam', 'graph_mode': 'off', 'use_snp_selection': False}. Best is trial 52 with value: 0.10875387441577535.
[I 2025-12-05 15:41:10,356] Trial 83 finished with value: 0.08577953693167517 and parameters: {'model_type': 'mlp', 'hidden_dims': '[512, 256]', 'dropout': 0.2145995243229728, 'batch_norm': True, 'lr': 0.0004515261489742644, 'weight_decay': 3.7349019704167367e-07, 'epochs': 233, 'loss': 'mse', 'optimizer': 'adam', 'graph_mode': 'off', 'use_snp_selection': False}. Best is trial 52 with value: 0.10875387441577535.
[I 2025-12-05 15:41:11,722] Trial 84 finished with value: 0.08189111799969734 and parameters: {'model_type': 'mlp', 'hidden_dims': '[512, 256]', 'dropout': 0.23810709433312494, 'batch_norm': True, 'lr': 0.00014344736947420828, 'weight_decay': 9.780385873004916e-07, 'epochs': 176, 'loss': 'mse', 'optimizer': 'adam', 'graph_mode': 'off', 'use_snp_selection': False}. Best is trial 52 with value: 0.10875387441577535.
[I 2025-12-05 15:41:13,207] Trial 85 finished with value: 0.05412194583941506 and parameters: {'model_type': 'mlp', 'hidden_dims': '[512, 64]', 'dropout': 0.1742226241498618, 'batch_norm': True, 'lr': 1.1435796732476212e-05, 'weight_decay': 5.138931020773512e-05, 'epochs': 208, 'loss': 'mae', 'optimizer': 'adam', 'graph_mode': 'off', 'use_snp_selection': False}. Best is trial 52 with value: 0.10875387441577535.
[I 2025-12-05 15:41:14,623] Trial 86 finished with value: 0.074641903828119 and parameters: {'model_type': 'mlp', 'hidden_dims': '[512, 64]', 'dropout': 0.20386577676975223, 'batch_norm': True, 'lr': 0.0005275711645160518, 'weight_decay': 1.4458550092569927e-06, 'epochs': 190, 'loss': 'mse', 'optimizer': 'adam', 'graph_mode': 'off', 'use_snp_selection': False}. Best is trial 52 with value: 0.10875387441577535.
[I 2025-12-05 15:41:15,804] Trial 87 finished with value: 0.04741068732190563 and parameters: {'model_type': 'mlp', 'hidden_dims': '[512, 256]', 'dropout': 0.5509811935196718, 'batch_norm': False, 'lr': 0.00035139782867544015, 'weight_decay': 5.794749688414384e-07, 'epochs': 125, 'loss': 'mae', 'optimizer': 'adam', 'graph_mode': 'off', 'use_snp_selection': False}. Best is trial 52 with value: 0.10875387441577535.
[I 2025-12-05 15:41:16,584] Trial 88 finished with value: 0.06877421333623973 and parameters: {'model_type': 'mlp', 'hidden_dims': '[256, 128]', 'dropout': 0.13008195996384042, 'batch_norm': True, 'lr': 0.00018628550156075553, 'weight_decay': 1.0526848685155725e-05, 'epochs': 94, 'loss': 'mse', 'optimizer': 'adam', 'graph_mode': 'off', 'use_snp_selection': False}. Best is trial 52 with value: 0.10875387441577535.
[I 2025-12-05 15:41:18,179] Trial 89 finished with value: 0.015094917780300008 and parameters: {'model_type': 'mlp', 'hidden_dims': '[512, 64]', 'dropout': 0.3051937851426647, 'batch_norm': True, 'lr': 4.645500979311817e-06, 'weight_decay': 6.225800669229923e-06, 'epochs': 256, 'loss': 'mse', 'optimizer': 'adam', 'graph_mode': 'off', 'use_snp_selection': True, 'num_snps': 23366}. Best is trial 52 with value: 0.10875387441577535.
[I 2025-12-05 15:41:19,113] Trial 90 finished with value: 0.0816350245441185 and parameters: {'model_type': 'mlp', 'hidden_dims': '[128, 64]', 'dropout': 0.1560553633165384, 'batch_norm': True, 'lr': 0.00023443736601922073, 'weight_decay': 7.419727494698391e-07, 'epochs': 285, 'loss': 'mae', 'optimizer': 'adam', 'graph_mode': 'off', 'use_snp_selection': False}. Best is trial 52 with value: 0.10875387441577535.
[I 2025-12-05 15:41:20,400] Trial 91 finished with value: 0.0787244198585061 and parameters: {'model_type': 'mlp', 'hidden_dims': '[512, 64]', 'dropout': 0.16852294585941244, 'batch_norm': True, 'lr': 0.000825028417735706, 'weight_decay': 2.528449602328972e-07, 'epochs': 155, 'loss': 'mse', 'optimizer': 'adam', 'graph_mode': 'off', 'use_snp_selection': False}. Best is trial 52 with value: 0.10875387441577535.
[I 2025-12-05 15:41:21,723] Trial 92 finished with value: 0.08210894150006506 and parameters: {'model_type': 'mlp', 'hidden_dims': '[512, 64]', 'dropout': 0.18950144222528628, 'batch_norm': True, 'lr': 0.000614839251846841, 'weight_decay': 2.941656715572042e-07, 'epochs': 166, 'loss': 'mse', 'optimizer': 'adam', 'graph_mode': 'off', 'use_snp_selection': False}. Best is trial 52 with value: 0.10875387441577535.
[I 2025-12-05 15:41:22,990] Trial 93 finished with value: 0.085031252703823 and parameters: {'model_type': 'mlp', 'hidden_dims': '[512, 64]', 'dropout': 0.11420757280344015, 'batch_norm': True, 'lr': 0.0009992167211603056, 'weight_decay': 2.0233277642460022e-07, 'epochs': 151, 'loss': 'mse', 'optimizer': 'adam', 'graph_mode': 'off', 'use_snp_selection': False}. Best is trial 52 with value: 0.10875387441577535.
[I 2025-12-05 15:41:24,373] Trial 94 finished with value: 0.07650151339122618 and parameters: {'model_type': 'mlp', 'hidden_dims': '[512, 64]', 'dropout': 0.2200189522859497, 'batch_norm': True, 'lr': 0.0007927705028826712, 'weight_decay': 4.3182280184860754e-07, 'epochs': 180, 'loss': 'mse', 'optimizer': 'adam', 'graph_mode': 'off', 'use_snp_selection': False}. Best is trial 52 with value: 0.10875387441577535.
[I 2025-12-05 15:41:25,582] Trial 95 finished with value: 0.07426091982183324 and parameters: {'model_type': 'mlp', 'hidden_dims': '[512, 64]', 'dropout': 0.14282865552510704, 'batch_norm': True, 'lr': 0.0004928260636263124, 'weight_decay': 1.7177631017269837e-07, 'epochs': 135, 'loss': 'mse', 'optimizer': 'adam', 'graph_mode': 'off', 'use_snp_selection': False}. Best is trial 52 with value: 0.10875387441577535.
[I 2025-12-05 15:41:27,035] Trial 96 finished with value: 0.059832777361752756 and parameters: {'model_type': 'mlp', 'hidden_dims': '[512, 64]', 'dropout': 0.4841987633729384, 'batch_norm': False, 'lr': 4.004512537680303e-05, 'weight_decay': 2.835842388537368e-07, 'epochs': 203, 'loss': 'mse', 'optimizer': 'adam', 'graph_mode': 'off', 'use_snp_selection': False}. Best is trial 52 with value: 0.10875387441577535.
[I 2025-12-05 15:41:28,354] Trial 97 finished with value: 0.08283450019439115 and parameters: {'model_type': 'mlp', 'hidden_dims': '[512, 64]', 'dropout': 0.17395015624268145, 'batch_norm': True, 'lr': 0.0006332430181364868, 'weight_decay': 1.370656724695009e-07, 'epochs': 158, 'loss': 'mae', 'optimizer': 'adam', 'graph_mode': 'off', 'use_snp_selection': False}. Best is trial 52 with value: 0.10875387441577535.
[I 2025-12-05 15:41:29,593] Trial 98 finished with value: 0.07817917407169987 and parameters: {'model_type': 'mlp', 'hidden_dims': '[512, 128]', 'dropout': 0.1990944869239745, 'batch_norm': True, 'lr': 0.00041329112346904633, 'weight_decay': 9.728857077387931e-07, 'epochs': 144, 'loss': 'mse', 'optimizer': 'adam', 'graph_mode': 'off', 'use_snp_selection': False}. Best is trial 52 with value: 0.10875387441577535.
[I 2025-12-05 15:41:30,857] Trial 99 finished with value: 0.09200170497387039 and parameters: {'model_type': 'mlp', 'hidden_dims': '[256, 128, 64]', 'dropout': 0.1809301264754994, 'batch_norm': True, 'lr': 0.0003118602731697869, 'weight_decay': 2.0339539028828106e-06, 'epochs': 321, 'loss': 'mse', 'optimizer': 'adam', 'graph_mode': 'off', 'use_snp_selection': False}. Best is trial 52 with value: 0.10875387441577535.
[I 2025-12-05 15:41:32,870] Trial 100 finished with value: 0.07160090843160465 and parameters: {'model_type': 'mlp', 'hidden_dims': '[512, 256]', 'dropout': 0.3702599170999101, 'batch_norm': True, 'lr': 0.0002912925626113891, 'weight_decay': 2.4909176977008955e-06, 'epochs': 344, 'loss': 'mae', 'optimizer': 'adam', 'graph_mode': 'off', 'use_snp_selection': False}. Best is trial 52 with value: 0.10875387441577535.
[I 2025-12-05 15:41:34,139] Trial 101 finished with value: 0.06662823831027428 and parameters: {'model_type': 'mlp', 'hidden_dims': '[256, 128, 64]', 'dropout': 0.15424363737649735, 'batch_norm': True, 'lr': 0.0003439357624689341, 'weight_decay': 1.5854565113394106e-06, 'epochs': 320, 'loss': 'mse', 'optimizer': 'adam', 'graph_mode': 'off', 'use_snp_selection': False}. Best is trial 52 with value: 0.10875387441577535.
[I 2025-12-05 15:41:36,015] Trial 102 finished with value: 0.079846404793141 and parameters: {'model_type': 'mlp', 'hidden_dims': '[512, 64]', 'dropout': 0.18003745494885623, 'batch_norm': True, 'lr': 0.0007154719397862886, 'weight_decay': 3.6759840339180127e-06, 'epochs': 307, 'loss': 'mse', 'optimizer': 'adam', 'graph_mode': 'off', 'use_snp_selection': False}. Best is trial 52 with value: 0.10875387441577535.
[I 2025-12-05 15:41:37,233] Trial 103 finished with value: 0.08142809848120794 and parameters: {'model_type': 'mlp', 'hidden_dims': '[256, 128, 64]', 'dropout': 0.16083052610428974, 'batch_norm': True, 'lr': 0.00021660449948963294, 'weight_decay': 1.929438583673891e-06, 'epochs': 295, 'loss': 'mse', 'optimizer': 'adam', 'graph_mode': 'off', 'use_snp_selection': False}. Best is trial 52 with value: 0.10875387441577535.
[I 2025-12-05 15:41:38,497] Trial 104 finished with value: 0.08014801485935047 and parameters: {'model_type': 'mlp', 'hidden_dims': '[256, 128, 64]', 'dropout': 0.13549201233484864, 'batch_norm': True, 'lr': 0.0005480119358808782, 'weight_decay': 6.829939179442984e-07, 'epochs': 320, 'loss': 'mse', 'optimizer': 'adam', 'graph_mode': 'off', 'use_snp_selection': False}. Best is trial 52 with value: 0.10875387441577535.
[I 2025-12-05 15:41:39,446] Trial 105 finished with value: 0.08515702566468714 and parameters: {'model_type': 'mlp', 'hidden_dims': '[256, 128, 64]', 'dropout': 0.2539682166804883, 'batch_norm': True, 'lr': 0.00037752482098481974, 'weight_decay': 3.351200477714556e-07, 'epochs': 171, 'loss': 'mse', 'optimizer': 'adam', 'graph_mode': 'off', 'use_snp_selection': False}. Best is trial 52 with value: 0.10875387441577535.
[I 2025-12-05 15:41:41,392] Trial 106 finished with value: 0.023188461331313873 and parameters: {'model_type': 'mlp', 'hidden_dims': '[512, 64]', 'dropout': 0.19181064910359116, 'batch_norm': False, 'lr': 0.0004771840703559799, 'weight_decay': 2.9392985839549825e-05, 'epochs': 336, 'loss': 'mse', 'optimizer': 'adam', 'graph_mode': 'off', 'use_snp_selection': False}. Best is trial 52 with value: 0.10875387441577535.
[I 2025-12-05 15:41:42,818] Trial 107 finished with value: 0.07717850412355516 and parameters: {'model_type': 'mlp', 'hidden_dims': '[512, 64]', 'dropout': 0.3384141697551572, 'batch_norm': True, 'lr': 0.0006553941697689331, 'weight_decay': 2.253869345636191e-06, 'epochs': 186, 'loss': 'mse', 'optimizer': 'adam', 'graph_mode': 'off', 'use_snp_selection': False}. Best is trial 52 with value: 0.10875387441577535.
[I 2025-12-05 15:41:43,988] Trial 108 finished with value: 0.08052902232453765 and parameters: {'model_type': 'mlp', 'hidden_dims': '[512, 128]', 'dropout': 0.16929425855021657, 'batch_norm': True, 'lr': 0.0008788852452078285, 'weight_decay': 1.3659761697335724e-06, 'epochs': 150, 'loss': 'mse', 'optimizer': 'adam', 'graph_mode': 'off', 'use_snp_selection': True, 'num_snps': 15022}. Best is trial 52 with value: 0.10875387441577535.
[I 2025-12-05 15:41:45,044] Trial 109 finished with value: 0.07333462254008435 and parameters: {'model_type': 'mlp', 'hidden_dims': '[256, 128, 64]', 'dropout': 0.23103143297031137, 'batch_norm': True, 'lr': 0.00031471014646041183, 'weight_decay': 1.7934659339499507e-05, 'epochs': 220, 'loss': 'mae', 'optimizer': 'adam', 'graph_mode': 'off', 'use_snp_selection': False}. Best is trial 52 with value: 0.10875387441577535.
[I 2025-12-05 15:41:45,963] Trial 110 finished with value: 0.06286367408704978 and parameters: {'model_type': 'mlp', 'hidden_dims': '[256, 128]', 'dropout': 0.21117448407012002, 'batch_norm': True, 'lr': 5.3233074785525595e-05, 'weight_decay': 3.0357434472264896e-06, 'epochs': 165, 'loss': 'mse', 'optimizer': 'adam', 'graph_mode': 'off', 'use_snp_selection': False}. Best is trial 52 with value: 0.10875387441577535.
[I 2025-12-05 15:41:47,273] Trial 111 finished with value: 0.07958348373717547 and parameters: {'model_type': 'mlp', 'hidden_dims': '[512, 64]', 'dropout': 0.12603273615496807, 'batch_norm': True, 'lr': 0.0007381327172097388, 'weight_decay': 5.300995395735072e-07, 'epochs': 161, 'loss': 'mse', 'optimizer': 'adam', 'graph_mode': 'off', 'use_snp_selection': False}. Best is trial 52 with value: 0.10875387441577535.
[I 2025-12-05 15:41:49,230] Trial 112 finished with value: 0.08608756999769185 and parameters: {'model_type': 'mlp', 'hidden_dims': '[512, 64]', 'dropout': 0.5756593307913548, 'batch_norm': True, 'lr': 0.0005633451400951804, 'weight_decay': 8.520630414545213e-07, 'epochs': 329, 'loss': 'mse', 'optimizer': 'adam', 'graph_mode': 'off', 'use_snp_selection': False}. Best is trial 52 with value: 0.10875387441577535.
[I 2025-12-05 15:41:50,426] Trial 113 finished with value: 0.07703968746728446 and parameters: {'model_type': 'mlp', 'hidden_dims': '[512, 64]', 'dropout': 0.11740770213292549, 'batch_norm': True, 'lr': 0.000417330891837694, 'weight_decay': 1.0445856899998593e-06, 'epochs': 129, 'loss': 'mse', 'optimizer': 'adam', 'graph_mode': 'off', 'use_snp_selection': False}. Best is trial 52 with value: 0.10875387441577535.
[I 2025-12-05 15:41:51,652] Trial 114 finished with value: 0.09272525769947117 and parameters: {'model_type': 'mlp', 'hidden_dims': '[512, 64]', 'dropout': 0.14444691182128888, 'batch_norm': True, 'lr': 0.000793636517553542, 'weight_decay': 1.3261576663233509e-05, 'epochs': 140, 'loss': 'mse', 'optimizer': 'adam', 'graph_mode': 'off', 'use_snp_selection': False}. Best is trial 52 with value: 0.10875387441577535.
[I 2025-12-05 15:41:52,885] Trial 115 finished with value: 0.08118653219968222 and parameters: {'model_type': 'mlp', 'hidden_dims': '[512, 64]', 'dropout': 0.14540618805475516, 'batch_norm': True, 'lr': 0.0008050872180594133, 'weight_decay': 1.2590616380765586e-05, 'epochs': 140, 'loss': 'mse', 'optimizer': 'adam', 'graph_mode': 'off', 'use_snp_selection': False}. Best is trial 52 with value: 0.10875387441577535.
[I 2025-12-05 15:41:54,036] Trial 116 finished with value: 0.06014406618886524 and parameters: {'model_type': 'mlp', 'hidden_dims': '[512, 64]', 'dropout': 0.1828096087882101, 'batch_norm': False, 'lr': 7.181553074183587e-05, 'weight_decay': 7.575522792074671e-06, 'epochs': 122, 'loss': 'mse', 'optimizer': 'adam', 'graph_mode': 'off', 'use_snp_selection': False}. Best is trial 52 with value: 0.10875387441577535.
[I 2025-12-05 15:41:55,146] Trial 117 finished with value: 0.06006220641437183 and parameters: {'model_type': 'mlp', 'hidden_dims': '[512, 64]', 'dropout': 0.1367265416781188, 'batch_norm': True, 'lr': 2.210147265627812e-05, 'weight_decay': 4.8928364484987e-06, 'epochs': 110, 'loss': 'mse', 'optimizer': 'adam', 'graph_mode': 'off', 'use_snp_selection': False}. Best is trial 52 with value: 0.10875387441577535.
[I 2025-12-05 15:41:56,154] Trial 118 finished with value: 0.019042007612453712 and parameters: {'model_type': 'mlp', 'hidden_dims': '[512, 64]', 'dropout': 0.16560368969591976, 'batch_norm': True, 'lr': 2.978180605979622e-06, 'weight_decay': 9.546183720683294e-06, 'epochs': 82, 'loss': 'mae', 'optimizer': 'adam', 'graph_mode': 'off', 'use_snp_selection': False}. Best is trial 52 with value: 0.10875387441577535.
[I 2025-12-05 15:41:57,237] Trial 119 finished with value: 0.08153484823788336 and parameters: {'model_type': 'mlp', 'hidden_dims': '[512, 128]', 'dropout': 0.20040598416961375, 'batch_norm': True, 'lr': 0.0009273197205953992, 'weight_decay': 2.736992975778938e-05, 'epochs': 100, 'loss': 'mse', 'optimizer': 'adam', 'graph_mode': 'off', 'use_snp_selection': False}. Best is trial 52 with value: 0.10875387441577535.
[I 2025-12-05 15:41:58,021] Trial 120 finished with value: 0.06430971088800427 and parameters: {'model_type': 'mlp', 'hidden_dims': '[128, 64]', 'dropout': 0.1523876966036735, 'batch_norm': True, 'lr': 0.0002477386481928752, 'weight_decay': 2.020360268535163e-07, 'epochs': 175, 'loss': 'mse', 'optimizer': 'adam', 'graph_mode': 'off', 'use_snp_selection': False}. Best is trial 52 with value: 0.10875387441577535.
[I 2025-12-05 15:41:59,330] Trial 121 finished with value: 0.08930830313672224 and parameters: {'model_type': 'mlp', 'hidden_dims': '[512, 64]', 'dropout': 0.10687348660906087, 'batch_norm': True, 'lr': 0.000690396175518341, 'weight_decay': 3.631852951289201e-05, 'epochs': 157, 'loss': 'mse', 'optimizer': 'adam', 'graph_mode': 'off', 'use_snp_selection': False}. Best is trial 52 with value: 0.10875387441577535.
[I 2025-12-05 15:42:00,463] Trial 122 finished with value: 0.09396303945021339 and parameters: {'model_type': 'mlp', 'hidden_dims': '[512, 64]', 'dropout': 0.12680966400435786, 'batch_norm': True, 'lr': 0.000642562296008133, 'weight_decay': 1.4582440207841178e-05, 'epochs': 116, 'loss': 'mse', 'optimizer': 'adam', 'graph_mode': 'off', 'use_snp_selection': False}. Best is trial 52 with value: 0.10875387441577535.
[I 2025-12-05 15:42:01,673] Trial 123 finished with value: 0.08346352661229509 and parameters: {'model_type': 'mlp', 'hidden_dims': '[512, 64]', 'dropout': 0.1161696082760821, 'batch_norm': True, 'lr': 0.0006188026058236041, 'weight_decay': 3.416714093438407e-05, 'epochs': 135, 'loss': 'mse', 'optimizer': 'adam', 'graph_mode': 'off', 'use_snp_selection': False}. Best is trial 52 with value: 0.10875387441577535.
[I 2025-12-05 15:42:02,960] Trial 124 finished with value: 0.0805919085129119 and parameters: {'model_type': 'mlp', 'hidden_dims': '[512, 64]', 'dropout': 0.10828988728413001, 'batch_norm': True, 'lr': 0.0004794326941597095, 'weight_decay': 1.8988451984373413e-05, 'epochs': 149, 'loss': 'mse', 'optimizer': 'adam', 'graph_mode': 'off', 'use_snp_selection': False}. Best is trial 52 with value: 0.10875387441577535.
[I 2025-12-05 15:42:04,116] Trial 125 finished with value: 0.09205569220884423 and parameters: {'model_type': 'mlp', 'hidden_dims': '[512, 64]', 'dropout': 0.10603179026664271, 'batch_norm': True, 'lr': 0.0005086227068734522, 'weight_decay': 1.4611246619451177e-05, 'epochs': 120, 'loss': 'mse', 'optimizer': 'adam', 'graph_mode': 'off', 'use_snp_selection': False}. Best is trial 52 with value: 0.10875387441577535.
[I 2025-12-05 15:42:05,204] Trial 126 finished with value: 0.08297787624965516 and parameters: {'model_type': 'mlp', 'hidden_dims': '[512, 256]', 'dropout': 0.13210599319997854, 'batch_norm': True, 'lr': 0.0005367412857262597, 'weight_decay': 1.4770118752748441e-05, 'epochs': 103, 'loss': 'mse', 'optimizer': 'adam', 'graph_mode': 'off', 'use_snp_selection': False}. Best is trial 52 with value: 0.10875387441577535.
[I 2025-12-05 15:42:06,360] Trial 127 finished with value: 0.09742616425240713 and parameters: {'model_type': 'mlp', 'hidden_dims': '[512, 64]', 'dropout': 0.12517970353207442, 'batch_norm': True, 'lr': 0.000370486850723762, 'weight_decay': 2.259816909782751e-05, 'epochs': 121, 'loss': 'mse', 'optimizer': 'adam', 'graph_mode': 'off', 'use_snp_selection': False}. Best is trial 52 with value: 0.10875387441577535.
