[I 2025-12-05 22:29:29,849] Trial 117 finished with value: 0.24446537821243672 and parameters: {'model_type': 'mlp', 'hidden_dims': '[256, 128, 64]', 'dropout': 0.2947155649886503, 'batch_norm': False, 'lr': 1.3912622086663075e-06, 'weight_decay': 2.1037071221359074e-06, 'epochs': 320, 'loss': 'mse', 'optimizer': 'adam', 'graph_mode': 'off', 'use_snp_selection': False}. Best is trial 96 with value: 0.2653727993063316.
[I 2025-12-05 22:30:05,240] Trial 118 finished with value: 0.23258127596718445 and parameters: {'model_type': 'mlp', 'hidden_dims': '[256, 128, 64]', 'dropout': 0.2752736518616362, 'batch_norm': False, 'lr': 3.3919641796918354e-06, 'weight_decay': 1.7268876360818256e-05, 'epochs': 202, 'loss': 'mse', 'optimizer': 'adam', 'graph_mode': 'off', 'use_snp_selection': False}. Best is trial 96 with value: 0.2653727993063316.
[I 2025-12-05 22:30:59,295] Trial 119 finished with value: 0.23978876593735327 and parameters: {'model_type': 'mlp', 'hidden_dims': '[256, 128, 64]', 'dropout': 0.16811619443791656, 'batch_norm': False, 'lr': 1.1884349451346987e-06, 'weight_decay': 7.798607727317382e-06, 'epochs': 332, 'loss': 'mse', 'optimizer': 'adam', 'graph_mode': 'off', 'use_snp_selection': False}. Best is trial 96 with value: 0.2653727993063316.
[I 2025-12-05 22:32:15,500] Trial 120 finished with value: 0.24598034643459465 and parameters: {'model_type': 'mlp', 'hidden_dims': '[512, 256]', 'dropout': 0.25269682358820883, 'batch_norm': False, 'lr': 1.6501977159643396e-06, 'weight_decay': 2.6150195831060554e-05, 'epochs': 247, 'loss': 'mse', 'optimizer': 'adam', 'graph_mode': 'off', 'use_snp_selection': False}. Best is trial 96 with value: 0.2653727993063316.
[I 2025-12-05 22:33:00,484] Trial 121 finished with value: 0.24207106651924465 and parameters: {'model_type': 'mlp', 'hidden_dims': '[256, 128, 64]', 'dropout': 0.31067626799675085, 'batch_norm': False, 'lr': 1.5846286615691264e-06, 'weight_decay': 9.114851943731764e-07, 'epochs': 269, 'loss': 'mse', 'optimizer': 'adam', 'graph_mode': 'off', 'use_snp_selection': False}. Best is trial 96 with value: 0.2653727993063316.
[I 2025-12-05 22:33:43,461] Trial 122 finished with value: 0.2626574195998845 and parameters: {'model_type': 'mlp', 'hidden_dims': '[256, 128, 64]', 'dropout': 0.32666217383994556, 'batch_norm': False, 'lr': 1.904495131427371e-06, 'weight_decay': 1.3243280348375708e-05, 'epochs': 255, 'loss': 'mse', 'optimizer': 'adam', 'graph_mode': 'off', 'use_snp_selection': False}. Best is trial 96 with value: 0.2653727993063316.
[I 2025-12-05 22:34:26,124] Trial 123 finished with value: 0.24128276206817612 and parameters: {'model_type': 'mlp', 'hidden_dims': '[256, 128, 64]', 'dropout': 0.35944736867809546, 'batch_norm': False, 'lr': 1.876501962065369e-06, 'weight_decay': 6.021637954041025e-06, 'epochs': 253, 'loss': 'mse', 'optimizer': 'adam', 'graph_mode': 'off', 'use_snp_selection': False}. Best is trial 96 with value: 0.2653727993063316.
[I 2025-12-05 22:35:09,532] Trial 124 finished with value: 0.24022430361771607 and parameters: {'model_type': 'mlp', 'hidden_dims': '[256, 128, 64]', 'dropout': 0.3230462194578615, 'batch_norm': False, 'lr': 2.541072958033916e-06, 'weight_decay': 3.000628860917343e-06, 'epochs': 258, 'loss': 'mse', 'optimizer': 'adam', 'graph_mode': 'off', 'use_snp_selection': False}. Best is trial 96 with value: 0.2653727993063316.
[I 2025-12-05 22:35:50,175] Trial 125 finished with value: 0.2040062967851905 and parameters: {'model_type': 'mlp', 'hidden_dims': '[256, 128, 64]', 'dropout': 0.2584548414671462, 'batch_norm': False, 'lr': 2.332831021115922e-05, 'weight_decay': 0.00042880512930234193, 'epochs': 240, 'loss': 'mse', 'optimizer': 'adam', 'graph_mode': 'off', 'use_snp_selection': False}. Best is trial 96 with value: 0.2653727993063316.
[I 2025-12-05 22:36:36,527] Trial 126 finished with value: 0.20577312768360828 and parameters: {'model_type': 'mlp', 'hidden_dims': '[256, 128, 64]', 'dropout': 0.33924202640818785, 'batch_norm': False, 'lr': 4.612927980336347e-05, 'weight_decay': 1.348397164783018e-05, 'epochs': 285, 'loss': 'mse', 'optimizer': 'adam', 'graph_mode': 'off', 'use_snp_selection': False}. Best is trial 96 with value: 0.2653727993063316.
[I 2025-12-05 22:37:20,052] Trial 127 finished with value: 0.12410648012411099 and parameters: {'model_type': 'mlp', 'hidden_dims': '[256, 128, 64]', 'dropout': 0.18519267003314865, 'batch_norm': True, 'lr': 2.269769702087526e-06, 'weight_decay': 5.018458926671715e-06, 'epochs': 264, 'loss': 'mse', 'optimizer': 'adam', 'graph_mode': 'off', 'use_snp_selection': True, 'num_snps': 14257}. Best is trial 96 with value: 0.2653727993063316.
[I 2025-12-05 22:37:52,345] Trial 128 finished with value: 0.22716646550256187 and parameters: {'model_type': 'mlp', 'hidden_dims': '[256, 128, 64]', 'dropout': 0.29640789457040534, 'batch_norm': False, 'lr': 1.4388659349388494e-06, 'weight_decay': 8.034805395811801e-05, 'epochs': 182, 'loss': 'mse', 'optimizer': 'adam', 'graph_mode': 'off', 'use_snp_selection': False}. Best is trial 96 with value: 0.2653727993063316.
[I 2025-12-05 22:38:21,400] Trial 129 finished with value: 0.23641247899114584 and parameters: {'model_type': 'mlp', 'hidden_dims': '[256, 128]', 'dropout': 0.2776123562564612, 'batch_norm': False, 'lr': 2.055948037280133e-06, 'weight_decay': 9.115129588010556e-06, 'epochs': 159, 'loss': 'mse', 'optimizer': 'adam', 'graph_mode': 'off', 'use_snp_selection': False}. Best is trial 96 with value: 0.2653727993063316.
[I 2025-12-05 22:38:59,302] Trial 130 finished with value: 0.2449926923365751 and parameters: {'model_type': 'mlp', 'hidden_dims': '[256, 128, 64]', 'dropout': 0.2347963107538818, 'batch_norm': False, 'lr': 2.899726157223659e-06, 'weight_decay': 5.7680571634022876e-05, 'epochs': 219, 'loss': 'mse', 'optimizer': 'adam', 'graph_mode': 'off', 'use_snp_selection': False}. Best is trial 96 with value: 0.2653727993063316.
[I 2025-12-05 22:39:46,065] Trial 131 finished with value: 0.25883346436220167 and parameters: {'model_type': 'mlp', 'hidden_dims': '[256, 128, 64]', 'dropout': 0.32594972339905753, 'batch_norm': False, 'lr': 1.0009695325808597e-06, 'weight_decay': 1.2633879076443284e-05, 'epochs': 280, 'loss': 'mse', 'optimizer': 'adam', 'graph_mode': 'off', 'use_snp_selection': False}. Best is trial 96 with value: 0.2653727993063316.
[I 2025-12-05 22:40:32,980] Trial 132 finished with value: 0.2466000285370566 and parameters: {'model_type': 'mlp', 'hidden_dims': '[256, 128, 64]', 'dropout': 0.3496541954742034, 'batch_norm': False, 'lr': 1.1519293039388535e-06, 'weight_decay': 1.0396296520751455e-05, 'epochs': 282, 'loss': 'mse', 'optimizer': 'adam', 'graph_mode': 'off', 'use_snp_selection': False}. Best is trial 96 with value: 0.2653727993063316.
[I 2025-12-05 22:41:25,414] Trial 133 finished with value: 0.23482080772143593 and parameters: {'model_type': 'mlp', 'hidden_dims': '[256, 128, 64]', 'dropout': 0.37008767770765905, 'batch_norm': False, 'lr': 1.2773057074555528e-06, 'weight_decay': 7.0442176526926395e-06, 'epochs': 321, 'loss': 'mse', 'optimizer': 'adam', 'graph_mode': 'off', 'use_snp_selection': False}. Best is trial 96 with value: 0.2653727993063316.
[I 2025-12-05 22:42:08,240] Trial 134 finished with value: 0.2387569198029273 and parameters: {'model_type': 'mlp', 'hidden_dims': '[256, 128, 64]', 'dropout': 0.3216240864813693, 'batch_norm': False, 'lr': 1.025878469180968e-06, 'weight_decay': 1.649081068310409e-05, 'epochs': 254, 'loss': 'mse', 'optimizer': 'adam', 'graph_mode': 'off', 'use_snp_selection': False}. Best is trial 96 with value: 0.2653727993063316.
[I 2025-12-05 22:42:48,188] Trial 135 finished with value: 0.24113227248300148 and parameters: {'model_type': 'mlp', 'hidden_dims': '[256, 128, 64]', 'dropout': 0.28713145607402013, 'batch_norm': False, 'lr': 1.7936446975715875e-06, 'weight_decay': 1.6028637538861354e-06, 'epochs': 234, 'loss': 'mse', 'optimizer': 'adam', 'graph_mode': 'off', 'use_snp_selection': False}. Best is trial 96 with value: 0.2653727993063316.
[I 2025-12-05 22:44:20,585] Trial 136 finished with value: 0.22587536309212974 and parameters: {'model_type': 'mlp', 'hidden_dims': '[512, 256]', 'dropout': 0.3331572722794365, 'batch_norm': False, 'lr': 1.459807980042625e-06, 'weight_decay': 1.1912131339242979e-05, 'epochs': 305, 'loss': 'mse', 'optimizer': 'adam', 'graph_mode': 'off', 'use_snp_selection': False}. Best is trial 96 with value: 0.2653727993063316.
[I 2025-12-05 22:45:02,081] Trial 137 finished with value: 0.23795287441737178 and parameters: {'model_type': 'mlp', 'hidden_dims': '[256, 128, 64]', 'dropout': 0.22072103312356867, 'batch_norm': False, 'lr': 1.209823076680652e-06, 'weight_decay': 5.463134349338333e-07, 'epochs': 244, 'loss': 'mse', 'optimizer': 'adam', 'graph_mode': 'off', 'use_snp_selection': False}. Best is trial 96 with value: 0.2653727993063316.
[I 2025-12-05 22:45:26,993] Trial 138 finished with value: 0.23773290780470063 and parameters: {'model_type': 'mlp', 'hidden_dims': '[128, 64]', 'dropout': 0.3116679891776814, 'batch_norm': False, 'lr': 1.5964710171191956e-06, 'weight_decay': 4.5064011057168066e-06, 'epochs': 263, 'loss': 'mse', 'optimizer': 'adam', 'graph_mode': 'off', 'use_snp_selection': False}. Best is trial 96 with value: 0.2653727993063316.
[I 2025-12-05 22:46:12,024] Trial 139 finished with value: 0.23712878288015965 and parameters: {'model_type': 'mlp', 'hidden_dims': '[256, 128, 64]', 'dropout': 0.2996241732694465, 'batch_norm': False, 'lr': 1.9098292142332604e-06, 'weight_decay': 2.3835661016346573e-06, 'epochs': 270, 'loss': 'mse', 'optimizer': 'adam', 'graph_mode': 'off', 'use_snp_selection': False}. Best is trial 96 with value: 0.2653727993063316.
[I 2025-12-05 22:47:07,320] Trial 140 finished with value: 0.24108958107712905 and parameters: {'model_type': 'mlp', 'hidden_dims': '[256, 128, 64]', 'dropout': 0.2691282604669896, 'batch_norm': False, 'lr': 2.4522866482428732e-06, 'weight_decay': 5.989531972102474e-06, 'epochs': 341, 'loss': 'mse', 'optimizer': 'adam', 'graph_mode': 'off', 'use_snp_selection': False}. Best is trial 96 with value: 0.2653727993063316.
[I 2025-12-05 22:47:41,471] Trial 141 finished with value: 0.22828469700085438 and parameters: {'model_type': 'mlp', 'hidden_dims': '[256, 128, 64]', 'dropout': 0.3196665686097562, 'batch_norm': False, 'lr': 1.5059450380467344e-06, 'weight_decay': 1.3684065937365803e-05, 'epochs': 193, 'loss': 'mse', 'optimizer': 'adam', 'graph_mode': 'off', 'use_snp_selection': False}. Best is trial 96 with value: 0.2653727993063316.
[I 2025-12-05 22:48:27,557] Trial 142 finished with value: 0.2573863184761948 and parameters: {'model_type': 'mlp', 'hidden_dims': '[256, 128, 64]', 'dropout': 0.13563726820562977, 'batch_norm': False, 'lr': 1.3128988181041845e-06, 'weight_decay': 1.1985069693741837e-05, 'epochs': 276, 'loss': 'mse', 'optimizer': 'adam', 'graph_mode': 'off', 'use_snp_selection': False}. Best is trial 96 with value: 0.2653727993063316.
[I 2025-12-05 22:49:16,547] Trial 143 finished with value: 0.23075775001731533 and parameters: {'model_type': 'mlp', 'hidden_dims': '[256, 128, 64]', 'dropout': 0.14532687020517676, 'batch_norm': False, 'lr': 1.3267123347725478e-06, 'weight_decay': 2.1958774997194616e-05, 'epochs': 296, 'loss': 'mse', 'optimizer': 'adam', 'graph_mode': 'off', 'use_snp_selection': False}. Best is trial 96 with value: 0.2653727993063316.
[I 2025-12-05 22:50:03,288] Trial 144 finished with value: 0.25466505766361636 and parameters: {'model_type': 'mlp', 'hidden_dims': '[256, 128, 64]', 'dropout': 0.13174632379000153, 'batch_norm': False, 'lr': 1.0165902144261272e-06, 'weight_decay': 8.541602031806257e-06, 'epochs': 280, 'loss': 'mse', 'optimizer': 'adam', 'graph_mode': 'off', 'use_snp_selection': False}. Best is trial 96 with value: 0.2653727993063316.
[I 2025-12-05 22:50:50,017] Trial 145 finished with value: 0.2388660850047532 and parameters: {'model_type': 'mlp', 'hidden_dims': '[256, 128, 64]', 'dropout': 0.15915199052354037, 'batch_norm': False, 'lr': 1.018380447025138e-06, 'weight_decay': 1.056706916105853e-05, 'epochs': 280, 'loss': 'mse', 'optimizer': 'adam', 'graph_mode': 'off', 'use_snp_selection': False}. Best is trial 96 with value: 0.2653727993063316.
[I 2025-12-05 22:51:33,541] Trial 146 finished with value: 0.24126863241080215 and parameters: {'model_type': 'mlp', 'hidden_dims': '[256, 128, 64]', 'dropout': 0.12915474641513364, 'batch_norm': False, 'lr': 1.1575343932588023e-06, 'weight_decay': 7.95866890164194e-06, 'epochs': 258, 'loss': 'mse', 'optimizer': 'adam', 'graph_mode': 'off', 'use_snp_selection': False}. Best is trial 96 with value: 0.2653727993063316.
[I 2025-12-05 22:52:19,788] Trial 147 finished with value: 0.2520285832463018 and parameters: {'model_type': 'mlp', 'hidden_dims': '[256, 128, 64]', 'dropout': 0.10065614749484703, 'batch_norm': False, 'lr': 1.1652432740490565e-06, 'weight_decay': 7.400424883940924e-06, 'epochs': 277, 'loss': 'mse', 'optimizer': 'adam', 'graph_mode': 'off', 'use_snp_selection': False}. Best is trial 96 with value: 0.2653727993063316.
[I 2025-12-05 22:53:43,416] Trial 148 finished with value: 0.2306776443495447 and parameters: {'model_type': 'mlp', 'hidden_dims': '[512, 128]', 'dropout': 0.11306527287276807, 'batch_norm': False, 'lr': 1.0022001720319712e-06, 'weight_decay': 3.5931891690413917e-06, 'epochs': 274, 'loss': 'mse', 'optimizer': 'adam', 'graph_mode': 'off', 'use_snp_selection': False}. Best is trial 96 with value: 0.2653727993063316.
[I 2025-12-05 22:54:18,072] Trial 149 finished with value: 0.11044611932222474 and parameters: {'model_type': 'mlp', 'hidden_dims': '[512, 64]', 'dropout': 0.10176098192050559, 'batch_norm': True, 'lr': 1.295645754657347e-06, 'weight_decay': 5.607712704696608e-06, 'epochs': 284, 'loss': 'mse', 'optimizer': 'adam', 'graph_mode': 'off', 'use_snp_selection': True, 'num_snps': 2917}. Best is trial 96 with value: 0.2653727993063316.
[I 2025-12-05 22:55:18,938] Trial 0 finished with value: 0.1579371245821696 and parameters: {'model_type': 'mlp', 'hidden_dims': '[128, 64]', 'dropout': 0.199031432379812, 'batch_norm': True, 'lr': 1.8408544111075837e-06, 'weight_decay': 5.5136510071208614e-05, 'epochs': 336, 'loss': 'mae', 'optimizer': 'adam', 'graph_mode': 'off', 'use_snp_selection': True, 'num_snps': 43862}. Best is trial 0 with value: 0.1579371245821696.
[I 2025-12-05 22:55:56,238] Trial 1 finished with value: 0.2322140099975935 and parameters: {'model_type': 'mlp', 'hidden_dims': '[256, 128]', 'dropout': 0.4370668075331726, 'batch_norm': True, 'lr': 7.133471581159139e-05, 'weight_decay': 1.128633586803549e-05, 'epochs': 242, 'loss': 'mae', 'optimizer': 'adam', 'graph_mode': 'off', 'use_snp_selection': False}. Best is trial 1 with value: 0.2322140099975935.
[I 2025-12-05 22:56:29,605] Trial 2 finished with value: 0.213379592072171 and parameters: {'model_type': 'mlp', 'hidden_dims': '[256, 128, 64]', 'dropout': 0.41314357415569625, 'batch_norm': False, 'lr': 3.952233718592101e-06, 'weight_decay': 0.00026754769258252603, 'epochs': 149, 'loss': 'mse', 'optimizer': 'adam', 'graph_mode': 'off', 'use_snp_selection': True, 'num_snps': 11571}. Best is trial 1 with value: 0.2322140099975935.
[I 2025-12-05 22:57:56,163] Trial 3 finished with value: 0.23818067132568083 and parameters: {'model_type': 'mlp', 'hidden_dims': '[512, 64]', 'dropout': 0.5938127374509361, 'batch_norm': False, 'lr': 5.67704586114731e-06, 'weight_decay': 2.4518087630137052e-05, 'epochs': 320, 'loss': 'mae', 'optimizer': 'adam', 'graph_mode': 'off', 'use_snp_selection': False}. Best is trial 3 with value: 0.23818067132568083.
[I 2025-12-05 22:59:13,567] Trial 4 finished with value: 0.13969728727278682 and parameters: {'model_type': 'mlp', 'hidden_dims': '[512, 128]', 'dropout': 0.25746343592134413, 'batch_norm': True, 'lr': 1.3467657668402788e-06, 'weight_decay': 0.00033087251918647806, 'epochs': 277, 'loss': 'mse', 'optimizer': 'adam', 'graph_mode': 'off', 'use_snp_selection': True, 'num_snps': 36675}. Best is trial 3 with value: 0.23818067132568083.
[I 2025-12-05 23:00:07,792] Trial 5 finished with value: 0.19028067701777895 and parameters: {'model_type': 'mlp', 'hidden_dims': '[512, 64]', 'dropout': 0.38275350994408375, 'batch_norm': True, 'lr': 1.5586664309232824e-06, 'weight_decay': 0.0008227664668621182, 'epochs': 145, 'loss': 'mae', 'optimizer': 'adam', 'graph_mode': 'off', 'use_snp_selection': True, 'num_snps': 32148}. Best is trial 3 with value: 0.23818067132568083.
[I 2025-12-05 23:00:38,717] Trial 6 finished with value: 0.21412278764778483 and parameters: {'model_type': 'mlp', 'hidden_dims': '[256, 128]', 'dropout': 0.3930109900265879, 'batch_norm': False, 'lr': 4.892964372128395e-05, 'weight_decay': 1.5809549317992182e-06, 'epochs': 199, 'loss': 'mse', 'optimizer': 'adam', 'graph_mode': 'off', 'use_snp_selection': False}. Best is trial 3 with value: 0.23818067132568083.
[I 2025-12-05 23:01:10,299] Trial 7 finished with value: 0.23257421272284548 and parameters: {'model_type': 'mlp', 'hidden_dims': '[512, 256]', 'dropout': 0.15343979219678458, 'batch_norm': True, 'lr': 6.234003099047341e-05, 'weight_decay': 3.894760610535477e-07, 'epochs': 97, 'loss': 'mse', 'optimizer': 'adam', 'graph_mode': 'off', 'use_snp_selection': False}. Best is trial 3 with value: 0.23818067132568083.
[I 2025-12-05 23:02:36,538] Trial 8 finished with value: 0.2410108154713932 and parameters: {'model_type': 'mlp', 'hidden_dims': '[512, 128]', 'dropout': 0.10743001231661406, 'batch_norm': True, 'lr': 0.00023728538449271062, 'weight_decay': 1.7629071578048637e-05, 'epochs': 312, 'loss': 'mae', 'optimizer': 'adam', 'graph_mode': 'off', 'use_snp_selection': False}. Best is trial 8 with value: 0.2410108154713932.
[I 2025-12-05 23:03:28,142] Trial 9 finished with value: 0.21759920515537842 and parameters: {'model_type': 'mlp', 'hidden_dims': '[512, 64]', 'dropout': 0.14505336736221927, 'batch_norm': True, 'lr': 5.8619638388111826e-05, 'weight_decay': 6.200156172669308e-07, 'epochs': 175, 'loss': 'mse', 'optimizer': 'adam', 'graph_mode': 'off', 'use_snp_selection': False}. Best is trial 8 with value: 0.2410108154713932.
[I 2025-12-05 23:03:48,790] Trial 10 finished with value: 0.14950113424255504 and parameters: {'model_type': 'mlp', 'hidden_dims': '[512, 128]', 'dropout': 0.2800030442581858, 'batch_norm': False, 'lr': 0.0004919806695968258, 'weight_decay': 2.9953888095455486e-06, 'epochs': 55, 'loss': 'mae', 'optimizer': 'adam', 'graph_mode': 'off', 'use_snp_selection': False}. Best is trial 8 with value: 0.2410108154713932.
[I 2025-12-05 23:05:22,129] Trial 11 finished with value: 0.23725312922051667 and parameters: {'model_type': 'mlp', 'hidden_dims': '[512, 128]', 'dropout': 0.583942291816117, 'batch_norm': False, 'lr': 1.3250324970868088e-05, 'weight_decay': 2.11387030344014e-05, 'epochs': 346, 'loss': 'mae', 'optimizer': 'adam', 'graph_mode': 'off', 'use_snp_selection': False}. Best is trial 8 with value: 0.2410108154713932.
[I 2025-12-05 23:06:41,147] Trial 12 finished with value: 0.1896161443002779 and parameters: {'model_type': 'mlp', 'hidden_dims': '[512, 64]', 'dropout': 0.5873431926823272, 'batch_norm': False, 'lr': 0.0004844928893200377, 'weight_decay': 6.23587291883057e-05, 'epochs': 294, 'loss': 'mae', 'optimizer': 'adam', 'graph_mode': 'off', 'use_snp_selection': False}. Best is trial 8 with value: 0.2410108154713932.
[I 2025-12-05 23:07:05,886] Trial 13 finished with value: 0.24442939044342032 and parameters: {'model_type': 'mlp', 'hidden_dims': '[128, 64]', 'dropout': 0.5255276925359322, 'batch_norm': False, 'lr': 1.139383629587953e-05, 'weight_decay': 2.875929917712265e-06, 'epochs': 285, 'loss': 'mae', 'optimizer': 'adam', 'graph_mode': 'off', 'use_snp_selection': False}. Best is trial 13 with value: 0.24442939044342032.
[I 2025-12-05 23:07:27,972] Trial 14 finished with value: 0.2136154279119718 and parameters: {'model_type': 'mlp', 'hidden_dims': '[128, 64]', 'dropout': 0.4841249530929294, 'batch_norm': True, 'lr': 0.00017558188744418174, 'weight_decay': 1.1414924884997386e-07, 'epochs': 241, 'loss': 'mae', 'optimizer': 'adam', 'graph_mode': 'off', 'use_snp_selection': False}. Best is trial 13 with value: 0.24442939044342032.
[I 2025-12-05 23:07:50,523] Trial 15 finished with value: 0.2449629911447558 and parameters: {'model_type': 'mlp', 'hidden_dims': '[128, 64]', 'dropout': 0.500694544502818, 'batch_norm': False, 'lr': 1.5062894231391345e-05, 'weight_decay': 3.4756887075882723e-06, 'epochs': 254, 'loss': 'mae', 'optimizer': 'adam', 'graph_mode': 'off', 'use_snp_selection': False}. Best is trial 15 with value: 0.2449629911447558.
[I 2025-12-05 23:08:12,668] Trial 16 finished with value: 0.23773907048163218 and parameters: {'model_type': 'mlp', 'hidden_dims': '[128, 64]', 'dropout': 0.5002961316577875, 'batch_norm': False, 'lr': 1.663563870177638e-05, 'weight_decay': 5.098763140321504e-06, 'epochs': 249, 'loss': 'mae', 'optimizer': 'adam', 'graph_mode': 'off', 'use_snp_selection': False}. Best is trial 15 with value: 0.2449629911447558.
[I 2025-12-05 23:08:31,715] Trial 17 finished with value: 0.2331364563785295 and parameters: {'model_type': 'mlp', 'hidden_dims': '[128, 64]', 'dropout': 0.5189226808191895, 'batch_norm': False, 'lr': 1.215423465251024e-05, 'weight_decay': 1.1229260414607666e-06, 'epochs': 202, 'loss': 'mae', 'optimizer': 'adam', 'graph_mode': 'off', 'use_snp_selection': False}. Best is trial 15 with value: 0.2449629911447558.
[I 2025-12-05 23:09:32,214] Trial 18 finished with value: 0.24784724062379676 and parameters: {'model_type': 'mlp', 'hidden_dims': '[128, 64]', 'dropout': 0.5252551012642993, 'batch_norm': False, 'lr': 5.895320539592683e-06, 'weight_decay': 4.109412643182284e-06, 'epochs': 269, 'loss': 'mae', 'optimizer': 'adam', 'graph_mode': 'off', 'use_snp_selection': True, 'num_snps': 58241}. Best is trial 18 with value: 0.24784724062379676.
