[I 2025-12-05 15:53:57,314] Trial 42 finished with value: 0.006700747742987946 and parameters: {'model_type': 'mlp', 'hidden_dims': '[128, 64]', 'dropout': 0.23307433879963052, 'batch_norm': True, 'lr': 3.7873524574819145e-05, 'weight_decay': 0.00046773450920396364, 'epochs': 132, 'loss': 'mae', 'optimizer': 'adam', 'graph_mode': 'off', 'use_snp_selection': True, 'num_snps': 48268}. Best is trial 31 with value: 0.06273970869678712.
[I 2025-12-05 15:53:58,360] Trial 43 finished with value: -0.008059399232019072 and parameters: {'model_type': 'mlp', 'hidden_dims': '[128, 64]', 'dropout': 0.17322165363466163, 'batch_norm': True, 'lr': 1.6799178387774934e-06, 'weight_decay': 7.791257506538456e-05, 'epochs': 54, 'loss': 'mae', 'optimizer': 'adam', 'graph_mode': 'off', 'use_snp_selection': True, 'num_snps': 16347}. Best is trial 31 with value: 0.06273970869678712.
[I 2025-12-05 15:53:59,864] Trial 44 finished with value: 0.0010961611665271144 and parameters: {'model_type': 'mlp', 'hidden_dims': '[128, 64]', 'dropout': 0.13395531392938986, 'batch_norm': True, 'lr': 3.862928741481624e-05, 'weight_decay': 1.5751101803445108e-05, 'epochs': 103, 'loss': 'mse', 'optimizer': 'adam', 'graph_mode': 'off', 'use_snp_selection': True, 'num_snps': 31477}. Best is trial 31 with value: 0.06273970869678712.
[I 2025-12-05 15:54:01,496] Trial 45 finished with value: 0.00399135877218049 and parameters: {'model_type': 'mlp', 'hidden_dims': '[512, 128]', 'dropout': 0.2975292911202572, 'batch_norm': True, 'lr': 1.346409549230435e-06, 'weight_decay': 0.00019420605492074806, 'epochs': 177, 'loss': 'mae', 'optimizer': 'adam', 'graph_mode': 'off', 'use_snp_selection': True, 'num_snps': 24843}. Best is trial 31 with value: 0.06273970869678712.
[I 2025-12-05 15:54:02,661] Trial 46 finished with value: 0.0468079060132022 and parameters: {'model_type': 'mlp', 'hidden_dims': '[512, 256]', 'dropout': 0.2172453376959519, 'batch_norm': True, 'lr': 0.0003195478691298066, 'weight_decay': 0.0009669331628569786, 'epochs': 320, 'loss': 'mae', 'optimizer': 'adam', 'graph_mode': 'off', 'use_snp_selection': True, 'num_snps': 6334}. Best is trial 31 with value: 0.06273970869678712.
[I 2025-12-05 15:54:04,631] Trial 47 finished with value: 0.03695251134998831 and parameters: {'model_type': 'mlp', 'hidden_dims': '[128, 64]', 'dropout': 0.2605970599002593, 'batch_norm': False, 'lr': 7.554372348673208e-05, 'weight_decay': 4.722291503432883e-05, 'epochs': 86, 'loss': 'mae', 'optimizer': 'adam', 'graph_mode': 'off', 'use_snp_selection': True, 'num_snps': 48892}. Best is trial 31 with value: 0.06273970869678712.
[I 2025-12-05 15:54:06,397] Trial 48 finished with value: 0.032155754271031456 and parameters: {'model_type': 'mlp', 'hidden_dims': '[256, 128]', 'dropout': 0.40220786570801054, 'batch_norm': True, 'lr': 1.709668613438964e-05, 'weight_decay': 8.390725647926122e-05, 'epochs': 197, 'loss': 'mse', 'optimizer': 'adam', 'graph_mode': 'off', 'use_snp_selection': True, 'num_snps': 34192}. Best is trial 31 with value: 0.06273970869678712.
[I 2025-12-05 15:54:07,965] Trial 49 finished with value: 0.005929331657127224 and parameters: {'model_type': 'mlp', 'hidden_dims': '[256, 128, 64]', 'dropout': 0.2546964240891567, 'batch_norm': True, 'lr': 2.4714056148062314e-06, 'weight_decay': 6.016054066272091e-06, 'epochs': 154, 'loss': 'mae', 'optimizer': 'adam', 'graph_mode': 'off', 'use_snp_selection': True, 'num_snps': 27815}. Best is trial 31 with value: 0.06273970869678712.
[I 2025-12-05 15:54:08,951] Trial 50 finished with value: 0.015140257675678361 and parameters: {'model_type': 'mlp', 'hidden_dims': '[512, 128]', 'dropout': 0.16795086853272265, 'batch_norm': True, 'lr': 4.978216735073045e-06, 'weight_decay': 3.09800124982876e-05, 'epochs': 75, 'loss': 'mae', 'optimizer': 'adam', 'graph_mode': 'off', 'use_snp_selection': False}. Best is trial 31 with value: 0.06273970869678712.
[I 2025-12-05 15:54:10,088] Trial 51 finished with value: 0.028247049140452174 and parameters: {'model_type': 'mlp', 'hidden_dims': '[128, 64]', 'dropout': 0.5586514311410146, 'batch_norm': False, 'lr': 1.145840669831048e-06, 'weight_decay': 4.399119359169874e-05, 'epochs': 344, 'loss': 'mae', 'optimizer': 'adam', 'graph_mode': 'off', 'use_snp_selection': True, 'num_snps': 9632}. Best is trial 31 with value: 0.06273970869678712.
[I 2025-12-05 15:54:11,382] Trial 52 finished with value: -0.006541805102877263 and parameters: {'model_type': 'mlp', 'hidden_dims': '[128, 64]', 'dropout': 0.4548243596310757, 'batch_norm': False, 'lr': 1.0609075531221454e-06, 'weight_decay': 1.9536625366551336e-05, 'epochs': 338, 'loss': 'mae', 'optimizer': 'adam', 'graph_mode': 'off', 'use_snp_selection': True, 'num_snps': 15562}. Best is trial 31 with value: 0.06273970869678712.
[I 2025-12-05 15:54:12,452] Trial 53 finished with value: -0.0006072316756474722 and parameters: {'model_type': 'mlp', 'hidden_dims': '[128, 64]', 'dropout': 0.4303406361753054, 'batch_norm': False, 'lr': 1.5340128536138789e-06, 'weight_decay': 1.2500488766849206e-05, 'epochs': 325, 'loss': 'mae', 'optimizer': 'adam', 'graph_mode': 'off', 'use_snp_selection': True, 'num_snps': 8011}. Best is trial 31 with value: 0.06273970869678712.
[I 2025-12-05 15:54:13,881] Trial 54 finished with value: 0.004940428075323409 and parameters: {'model_type': 'mlp', 'hidden_dims': '[128, 64]', 'dropout': 0.4970013011916997, 'batch_norm': False, 'lr': 2.9512470234957762e-06, 'weight_decay': 7.139596068800631e-05, 'epochs': 307, 'loss': 'mae', 'optimizer': 'adam', 'graph_mode': 'off', 'use_snp_selection': True, 'num_snps': 21461}. Best is trial 31 with value: 0.06273970869678712.
[I 2025-12-05 15:54:15,747] Trial 55 finished with value: 0.012609757086614878 and parameters: {'model_type': 'mlp', 'hidden_dims': '[512, 64]', 'dropout': 0.3763534275562665, 'batch_norm': False, 'lr': 1.9240567917817568e-06, 'weight_decay': 3.8735152768258616e-06, 'epochs': 286, 'loss': 'mae', 'optimizer': 'adam', 'graph_mode': 'off', 'use_snp_selection': False}. Best is trial 31 with value: 0.06273970869678712.
[I 2025-12-05 15:54:16,641] Trial 56 finished with value: 0.015296746502170425 and parameters: {'model_type': 'mlp', 'hidden_dims': '[256, 128, 64]', 'dropout': 0.427095670747212, 'batch_norm': False, 'lr': 7.59795623386383e-05, 'weight_decay': 0.0005071115398300709, 'epochs': 207, 'loss': 'mae', 'optimizer': 'adam', 'graph_mode': 'off', 'use_snp_selection': True, 'num_snps': 3412}. Best is trial 31 with value: 0.06273970869678712.
[I 2025-12-05 15:54:17,528] Trial 57 finished with value: 0.03934110431439675 and parameters: {'model_type': 'mlp', 'hidden_dims': '[128, 64]', 'dropout': 0.45743751440873437, 'batch_norm': True, 'lr': 1.07127562825343e-06, 'weight_decay': 3.200998498368691e-05, 'epochs': 269, 'loss': 'mae', 'optimizer': 'adam', 'graph_mode': 'off', 'use_snp_selection': False}. Best is trial 31 with value: 0.06273970869678712.
[I 2025-12-05 15:54:19,255] Trial 58 finished with value: 0.02404930705278376 and parameters: {'model_type': 'mlp', 'hidden_dims': '[512, 256]', 'dropout': 0.12160756905112396, 'batch_norm': True, 'lr': 2.6433159809478617e-05, 'weight_decay': 0.00016794529566532923, 'epochs': 248, 'loss': 'mse', 'optimizer': 'adam', 'graph_mode': 'off', 'use_snp_selection': False}. Best is trial 31 with value: 0.06273970869678712.
[I 2025-12-05 15:54:20,623] Trial 59 finished with value: -0.009719607850536337 and parameters: {'model_type': 'mlp', 'hidden_dims': '[512, 64]', 'dropout': 0.19097136947664356, 'batch_norm': True, 'lr': 8.281935357108701e-06, 'weight_decay': 0.0002918045634008751, 'epochs': 343, 'loss': 'mae', 'optimizer': 'adam', 'graph_mode': 'off', 'use_snp_selection': True, 'num_snps': 12562}. Best is trial 31 with value: 0.06273970869678712.
[I 2025-12-05 15:54:21,402] Trial 60 finished with value: 0.006861364818820003 and parameters: {'model_type': 'mlp', 'hidden_dims': '[128, 64]', 'dropout': 0.15331983841218425, 'batch_norm': False, 'lr': 0.0002885126010779067, 'weight_decay': 9.956908081236901e-05, 'epochs': 229, 'loss': 'mae', 'optimizer': 'adam', 'graph_mode': 'off', 'use_snp_selection': False}. Best is trial 31 with value: 0.06273970869678712.
[I 2025-12-05 15:54:22,928] Trial 61 finished with value: 0.03555137394303072 and parameters: {'model_type': 'mlp', 'hidden_dims': '[128, 64]', 'dropout': 0.2268700463459025, 'batch_norm': True, 'lr': 3.501080780369279e-06, 'weight_decay': 5.811770855015193e-05, 'epochs': 331, 'loss': 'mae', 'optimizer': 'adam', 'graph_mode': 'off', 'use_snp_selection': True, 'num_snps': 19807}. Best is trial 31 with value: 0.06273970869678712.
[I 2025-12-05 15:54:24,356] Trial 62 finished with value: 0.04266201391662669 and parameters: {'model_type': 'mlp', 'hidden_dims': '[128, 64]', 'dropout': 0.21291469172340738, 'batch_norm': True, 'lr': 2.4757335963711632e-06, 'weight_decay': 2.007374212770146e-05, 'epochs': 337, 'loss': 'mae', 'optimizer': 'adam', 'graph_mode': 'off', 'use_snp_selection': True, 'num_snps': 16155}. Best is trial 31 with value: 0.06273970869678712.
[I 2025-12-05 15:54:26,011] Trial 63 finished with value: 0.027004977613844676 and parameters: {'model_type': 'mlp', 'hidden_dims': '[128, 64]', 'dropout': 0.2493345770469023, 'batch_norm': True, 'lr': 1.3516707888498674e-06, 'weight_decay': 0.00011893475588180634, 'epochs': 350, 'loss': 'mae', 'optimizer': 'adam', 'graph_mode': 'off', 'use_snp_selection': True, 'num_snps': 23905}. Best is trial 31 with value: 0.06273970869678712.
[I 2025-12-05 15:54:27,284] Trial 64 finished with value: 0.04287010996004659 and parameters: {'model_type': 'mlp', 'hidden_dims': '[128, 64]', 'dropout': 0.2658877904337663, 'batch_norm': True, 'lr': 1.4531193013977789e-06, 'weight_decay': 5.843401793076547e-05, 'epochs': 322, 'loss': 'mae', 'optimizer': 'adam', 'graph_mode': 'off', 'use_snp_selection': True, 'num_snps': 11253}. Best is trial 31 with value: 0.06273970869678712.
[I 2025-12-05 15:54:30,192] Trial 65 finished with value: -0.0117471729365514 and parameters: {'model_type': 'mlp', 'hidden_dims': '[256, 128, 64]', 'dropout': 0.29984674482858886, 'batch_norm': True, 'lr': 2.236309164166319e-06, 'weight_decay': 3.988626032630655e-05, 'epochs': 303, 'loss': 'mae', 'optimizer': 'adam', 'graph_mode': 'off', 'use_snp_selection': True, 'num_snps': 59509}. Best is trial 31 with value: 0.06273970869678712.
[I 2025-12-05 15:54:32,101] Trial 66 finished with value: 0.027540601948633767 and parameters: {'model_type': 'mlp', 'hidden_dims': '[512, 64]', 'dropout': 0.1886946049971965, 'batch_norm': True, 'lr': 2.9362182716192152e-06, 'weight_decay': 0.00039371108337404203, 'epochs': 280, 'loss': 'mae', 'optimizer': 'adam', 'graph_mode': 'off', 'use_snp_selection': False}. Best is trial 31 with value: 0.06273970869678712.
[I 2025-12-05 15:54:33,574] Trial 67 finished with value: 0.06557606848018405 and parameters: {'model_type': 'mlp', 'hidden_dims': '[256, 128]', 'dropout': 0.35680784845583063, 'batch_norm': True, 'lr': 1.4099809496989595e-05, 'weight_decay': 0.00014164087093783594, 'epochs': 331, 'loss': 'mae', 'optimizer': 'adam', 'graph_mode': 'off', 'use_snp_selection': True, 'num_snps': 18405}. Best is trial 67 with value: 0.06557606848018405.
[I 2025-12-05 15:54:34,773] Trial 68 finished with value: 0.02998419659636599 and parameters: {'model_type': 'mlp', 'hidden_dims': '[256, 128]', 'dropout': 0.3530260925254449, 'batch_norm': True, 'lr': 1.4918817698940587e-05, 'weight_decay': 0.00023321909567916037, 'epochs': 288, 'loss': 'mae', 'optimizer': 'adam', 'graph_mode': 'off', 'use_snp_selection': False}. Best is trial 67 with value: 0.06557606848018405.
[I 2025-12-05 15:54:36,098] Trial 69 finished with value: 0.03271332023262672 and parameters: {'model_type': 'mlp', 'hidden_dims': '[256, 128]', 'dropout': 0.32943664809547124, 'batch_norm': True, 'lr': 5.5215161449451666e-05, 'weight_decay': 2.4054681786944013e-05, 'epochs': 317, 'loss': 'mae', 'optimizer': 'adam', 'graph_mode': 'off', 'use_snp_selection': True, 'num_snps': 14151}. Best is trial 67 with value: 0.06557606848018405.
[I 2025-12-05 15:54:37,201] Trial 70 finished with value: 0.0022736346267160233 and parameters: {'model_type': 'mlp', 'hidden_dims': '[256, 128]', 'dropout': 0.49034036357017335, 'batch_norm': True, 'lr': 1.1414312246631008e-05, 'weight_decay': 1.2752681039980906e-05, 'epochs': 43, 'loss': 'mae', 'optimizer': 'adam', 'graph_mode': 'off', 'use_snp_selection': True, 'num_snps': 19605}. Best is trial 67 with value: 0.06557606848018405.
[I 2025-12-05 15:54:38,689] Trial 71 finished with value: 0.07073722804276542 and parameters: {'model_type': 'mlp', 'hidden_dims': '[256, 128]', 'dropout': 0.23884751518970793, 'batch_norm': True, 'lr': 1.9139111487215795e-05, 'weight_decay': 0.00017443898298983277, 'epochs': 329, 'loss': 'mae', 'optimizer': 'adam', 'graph_mode': 'off', 'use_snp_selection': True, 'num_snps': 19201}. Best is trial 71 with value: 0.07073722804276542.
[I 2025-12-05 15:54:40,429] Trial 72 finished with value: 0.02422158524985636 and parameters: {'model_type': 'mlp', 'hidden_dims': '[256, 128]', 'dropout': 0.23911793488494273, 'batch_norm': True, 'lr': 2.2294718013728596e-05, 'weight_decay': 0.00015749787758458908, 'epochs': 338, 'loss': 'mae', 'optimizer': 'adam', 'graph_mode': 'off', 'use_snp_selection': True, 'num_snps': 26171}. Best is trial 71 with value: 0.07073722804276542.
[I 2025-12-05 15:54:41,897] Trial 73 finished with value: 0.00046751286556860925 and parameters: {'model_type': 'mlp', 'hidden_dims': '[256, 128]', 'dropout': 0.3945147916472892, 'batch_norm': True, 'lr': 7.20148866779143e-06, 'weight_decay': 0.0006309275556492612, 'epochs': 327, 'loss': 'mae', 'optimizer': 'adam', 'graph_mode': 'off', 'use_snp_selection': True, 'num_snps': 17247}. Best is trial 71 with value: 0.07073722804276542.
[I 2025-12-05 15:54:43,455] Trial 74 finished with value: 0.062061051448798775 and parameters: {'model_type': 'mlp', 'hidden_dims': '[256, 128]', 'dropout': 0.2058979336382675, 'batch_norm': True, 'lr': 2.1093026968710447e-05, 'weight_decay': 9.946070176047094e-05, 'epochs': 310, 'loss': 'mae', 'optimizer': 'adam', 'graph_mode': 'off', 'use_snp_selection': True, 'num_snps': 21824}. Best is trial 71 with value: 0.07073722804276542.
[I 2025-12-05 15:54:45,012] Trial 75 finished with value: 0.03875016714308456 and parameters: {'model_type': 'mlp', 'hidden_dims': '[256, 128]', 'dropout': 0.16175404225931134, 'batch_norm': True, 'lr': 1.3868355355717508e-05, 'weight_decay': 0.0001062834778028728, 'epochs': 296, 'loss': 'mae', 'optimizer': 'adam', 'graph_mode': 'off', 'use_snp_selection': True, 'num_snps': 22355}. Best is trial 71 with value: 0.07073722804276542.
[I 2025-12-05 15:54:46,269] Trial 76 finished with value: 0.024443579526784057 and parameters: {'model_type': 'mlp', 'hidden_dims': '[256, 128]', 'dropout': 0.21175438403834007, 'batch_norm': True, 'lr': 1.7695760182579817e-05, 'weight_decay': 0.00024126922917161518, 'epochs': 312, 'loss': 'mse', 'optimizer': 'adam', 'graph_mode': 'off', 'use_snp_selection': False}. Best is trial 71 with value: 0.07073722804276542.
[I 2025-12-05 15:54:47,793] Trial 77 finished with value: 0.07069857733393811 and parameters: {'model_type': 'mlp', 'hidden_dims': '[256, 128]', 'dropout': 0.18193305496885856, 'batch_norm': True, 'lr': 3.388691215291163e-05, 'weight_decay': 9.047409629453883e-05, 'epochs': 130, 'loss': 'mae', 'optimizer': 'adam', 'graph_mode': 'off', 'use_snp_selection': True, 'num_snps': 28480}. Best is trial 71 with value: 0.07073722804276542.
[I 2025-12-05 15:54:49,470] Trial 78 finished with value: 0.06402705406542106 and parameters: {'model_type': 'mlp', 'hidden_dims': '[256, 128]', 'dropout': 0.1850060563801592, 'batch_norm': True, 'lr': 4.12020014345493e-05, 'weight_decay': 9.257897864903684e-05, 'epochs': 136, 'loss': 'mae', 'optimizer': 'adam', 'graph_mode': 'off', 'use_snp_selection': True, 'num_snps': 34367}. Best is trial 71 with value: 0.07073722804276542.
[I 2025-12-05 15:54:50,299] Trial 79 finished with value: 0.05128725723477158 and parameters: {'model_type': 'mlp', 'hidden_dims': '[256, 128]', 'dropout': 0.14513766772385636, 'batch_norm': True, 'lr': 3.120639455519596e-05, 'weight_decay': 9.199284841443046e-05, 'epochs': 120, 'loss': 'mae', 'optimizer': 'adam', 'graph_mode': 'off', 'use_snp_selection': False}. Best is trial 71 with value: 0.07073722804276542.
[I 2025-12-05 15:54:52,018] Trial 80 finished with value: 0.020760622758856418 and parameters: {'model_type': 'mlp', 'hidden_dims': '[256, 128]', 'dropout': 0.28660005047843323, 'batch_norm': True, 'lr': 2.0717977214933016e-05, 'weight_decay': 0.0001486628604660645, 'epochs': 158, 'loss': 'mae', 'optimizer': 'adam', 'graph_mode': 'off', 'use_snp_selection': True, 'num_snps': 34850}. Best is trial 71 with value: 0.07073722804276542.
[I 2025-12-05 15:54:53,547] Trial 81 finished with value: 0.038642669637201074 and parameters: {'model_type': 'mlp', 'hidden_dims': '[256, 128]', 'dropout': 0.1822507775885736, 'batch_norm': True, 'lr': 4.433640040562434e-05, 'weight_decay': 6.992389774042127e-05, 'epochs': 138, 'loss': 'mae', 'optimizer': 'adam', 'graph_mode': 'off', 'use_snp_selection': True, 'num_snps': 29220}. Best is trial 71 with value: 0.07073722804276542.
[I 2025-12-05 15:54:55,368] Trial 82 finished with value: 0.028468151237971268 and parameters: {'model_type': 'mlp', 'hidden_dims': '[256, 128]', 'dropout': 0.20911430425110078, 'batch_norm': True, 'lr': 3.7223863461571916e-05, 'weight_decay': 0.00012767650427002004, 'epochs': 142, 'loss': 'mae', 'optimizer': 'adam', 'graph_mode': 'off', 'use_snp_selection': True, 'num_snps': 37977}. Best is trial 71 with value: 0.07073722804276542.
[I 2025-12-05 15:54:56,656] Trial 83 finished with value: 0.04480333801757251 and parameters: {'model_type': 'mlp', 'hidden_dims': '[256, 128]', 'dropout': 0.1983434194325402, 'batch_norm': True, 'lr': 0.00010474616236430167, 'weight_decay': 0.00019010427754366646, 'epochs': 114, 'loss': 'mae', 'optimizer': 'adam', 'graph_mode': 'off', 'use_snp_selection': True, 'num_snps': 21871}. Best is trial 71 with value: 0.07073722804276542.
[I 2025-12-05 15:54:58,596] Trial 84 finished with value: 0.016209933755464166 and parameters: {'model_type': 'mlp', 'hidden_dims': '[256, 128]', 'dropout': 0.11877159369094835, 'batch_norm': True, 'lr': 2.9096601891321388e-05, 'weight_decay': 0.0003329664675204661, 'epochs': 127, 'loss': 'mae', 'optimizer': 'adam', 'graph_mode': 'off', 'use_snp_selection': True, 'num_snps': 43580}. Best is trial 71 with value: 0.07073722804276542.
[I 2025-12-05 15:55:01,029] Trial 85 finished with value: 0.0028283781007504664 and parameters: {'model_type': 'mlp', 'hidden_dims': '[256, 128]', 'dropout': 0.1616498109393086, 'batch_norm': True, 'lr': 1.1167435385738663e-05, 'weight_decay': 5.587741078552907e-05, 'epochs': 175, 'loss': 'mae', 'optimizer': 'adam', 'graph_mode': 'off', 'use_snp_selection': True, 'num_snps': 55357}. Best is trial 71 with value: 0.07073722804276542.
[I 2025-12-05 15:55:02,553] Trial 86 finished with value: 0.03432613699545287 and parameters: {'model_type': 'mlp', 'hidden_dims': '[256, 128]', 'dropout': 0.1404446993346269, 'batch_norm': True, 'lr': 6.419461276155984e-05, 'weight_decay': 4.189460271994317e-07, 'epochs': 148, 'loss': 'mae', 'optimizer': 'adam', 'graph_mode': 'off', 'use_snp_selection': True, 'num_snps': 26569}. Best is trial 71 with value: 0.07073722804276542.
[I 2025-12-05 15:55:04,308] Trial 87 finished with value: 0.037931787182062054 and parameters: {'model_type': 'mlp', 'hidden_dims': '[512, 128]', 'dropout': 0.3611649162183252, 'batch_norm': True, 'lr': 0.0009998876135976476, 'weight_decay': 1.4531704949439554e-06, 'epochs': 185, 'loss': 'mae', 'optimizer': 'adam', 'graph_mode': 'off', 'use_snp_selection': True, 'num_snps': 29847}. Best is trial 71 with value: 0.07073722804276542.
[I 2025-12-05 15:55:05,496] Trial 88 finished with value: 0.026086522714406257 and parameters: {'model_type': 'mlp', 'hidden_dims': '[256, 128, 64]', 'dropout': 0.1809148893389536, 'batch_norm': True, 'lr': 2.4088464828020635e-05, 'weight_decay': 8.525970166272803e-05, 'epochs': 273, 'loss': 'mae', 'optimizer': 'adam', 'graph_mode': 'off', 'use_snp_selection': False}. Best is trial 71 with value: 0.07073722804276542.
[I 2025-12-05 15:55:06,800] Trial 89 finished with value: 0.03325887960601902 and parameters: {'model_type': 'mlp', 'hidden_dims': '[256, 128]', 'dropout': 0.24307006602070758, 'batch_norm': True, 'lr': 0.00015020594799687484, 'weight_decay': 0.0002695663837550515, 'epochs': 93, 'loss': 'mse', 'optimizer': 'adam', 'graph_mode': 'off', 'use_snp_selection': True, 'num_snps': 23608}. Best is trial 71 with value: 0.07073722804276542.
[I 2025-12-05 15:55:08,705] Trial 90 finished with value: 0.039297043592219555 and parameters: {'model_type': 'mlp', 'hidden_dims': '[512, 64]', 'dropout': 0.20258239812459242, 'batch_norm': True, 'lr': 1.972810836691465e-05, 'weight_decay': 8.280954069411817e-06, 'epochs': 163, 'loss': 'mae', 'optimizer': 'adam', 'graph_mode': 'off', 'use_snp_selection': True, 'num_snps': 32727}. Best is trial 71 with value: 0.07073722804276542.
[I 2025-12-05 15:55:09,547] Trial 91 finished with value: 0.006037463776191899 and parameters: {'model_type': 'mlp', 'hidden_dims': '[256, 128]', 'dropout': 0.15458692336491742, 'batch_norm': True, 'lr': 3.1906219606285626e-05, 'weight_decay': 9.280362540311746e-05, 'epochs': 125, 'loss': 'mae', 'optimizer': 'adam', 'graph_mode': 'off', 'use_snp_selection': False}. Best is trial 71 with value: 0.07073722804276542.
[I 2025-12-05 15:55:10,369] Trial 92 finished with value: 0.012825169948796386 and parameters: {'model_type': 'mlp', 'hidden_dims': '[256, 128]', 'dropout': 0.14333246972013408, 'batch_norm': True, 'lr': 3.2304623754562664e-05, 'weight_decay': 7.080577661603255e-05, 'epochs': 116, 'loss': 'mae', 'optimizer': 'adam', 'graph_mode': 'off', 'use_snp_selection': False}. Best is trial 71 with value: 0.07073722804276542.
