[I 2025-12-05 15:38:42,772] Trial 74 finished with value: 0.109395117689578 and parameters: {'model_type': 'mlp', 'hidden_dims': '[512, 256]', 'dropout': 0.41547794268248006, 'batch_norm': True, 'lr': 8.581033554903063e-05, 'weight_decay': 6.8650932083396954e-06, 'epochs': 241, 'loss': 'mae', 'optimizer': 'adam', 'graph_mode': 'off', 'use_snp_selection': False}. Best is trial 16 with value: 0.14105610079653463.
[I 2025-12-05 15:38:43,730] Trial 75 finished with value: 0.10323492601203062 and parameters: {'model_type': 'mlp', 'hidden_dims': '[256, 128]', 'dropout': 0.5009484034202697, 'batch_norm': True, 'lr': 0.00019202607225305131, 'weight_decay': 1.2479362412678344e-05, 'epochs': 153, 'loss': 'mae', 'optimizer': 'adam', 'graph_mode': 'off', 'use_snp_selection': False}. Best is trial 16 with value: 0.14105610079653463.
[I 2025-12-05 15:38:44,413] Trial 76 finished with value: 0.0818715961067828 and parameters: {'model_type': 'mlp', 'hidden_dims': '[128, 64]', 'dropout': 0.5481434280442701, 'batch_norm': True, 'lr': 5.2930258154916657e-05, 'weight_decay': 2.158225729615348e-05, 'epochs': 40, 'loss': 'mae', 'optimizer': 'adam', 'graph_mode': 'off', 'use_snp_selection': False}. Best is trial 16 with value: 0.14105610079653463.
[I 2025-12-05 15:38:46,207] Trial 77 finished with value: 0.11288705044034948 and parameters: {'model_type': 'mlp', 'hidden_dims': '[512, 256]', 'dropout': 0.1336740741772825, 'batch_norm': True, 'lr': 0.00031471857609667234, 'weight_decay': 3.123333260904373e-05, 'epochs': 271, 'loss': 'mse', 'optimizer': 'adam', 'graph_mode': 'off', 'use_snp_selection': False}. Best is trial 16 with value: 0.14105610079653463.
[I 2025-12-05 15:38:47,184] Trial 78 finished with value: 0.05498535666820974 and parameters: {'model_type': 'mlp', 'hidden_dims': '[512, 256]', 'dropout': 0.4749164199646564, 'batch_norm': True, 'lr': 2.777381472666727e-05, 'weight_decay': 2.961545326121856e-06, 'epochs': 283, 'loss': 'mae', 'optimizer': 'adam', 'graph_mode': 'off', 'use_snp_selection': True, 'num_snps': 2246}. Best is trial 16 with value: 0.14105610079653463.
[I 2025-12-05 15:38:48,315] Trial 79 finished with value: 0.11152708195551554 and parameters: {'model_type': 'mlp', 'hidden_dims': '[256, 128, 64]', 'dropout': 0.44041797756120116, 'batch_norm': True, 'lr': 0.00011680532489913713, 'weight_decay': 4.813280758278328e-05, 'epochs': 227, 'loss': 'mae', 'optimizer': 'adam', 'graph_mode': 'off', 'use_snp_selection': False}. Best is trial 16 with value: 0.14105610079653463.
[I 2025-12-05 15:38:50,337] Trial 80 finished with value: 0.10590233355322178 and parameters: {'model_type': 'mlp', 'hidden_dims': '[512, 256]', 'dropout': 0.4102922602231514, 'batch_norm': False, 'lr': 9.866745259326758e-06, 'weight_decay': 4.31688072215719e-06, 'epochs': 330, 'loss': 'mae', 'optimizer': 'adam', 'graph_mode': 'off', 'use_snp_selection': False}. Best is trial 16 with value: 0.14105610079653463.
[I 2025-12-05 15:38:52,427] Trial 81 finished with value: 0.12104111445053745 and parameters: {'model_type': 'mlp', 'hidden_dims': '[512, 128]', 'dropout': 0.11562720602307426, 'batch_norm': True, 'lr': 0.0004113356875486543, 'weight_decay': 1.593638699689558e-05, 'epochs': 341, 'loss': 'mae', 'optimizer': 'adam', 'graph_mode': 'off', 'use_snp_selection': False}. Best is trial 16 with value: 0.14105610079653463.
[I 2025-12-05 15:38:54,347] Trial 82 finished with value: 0.1260711421223793 and parameters: {'model_type': 'mlp', 'hidden_dims': '[512, 128]', 'dropout': 0.16463841632005285, 'batch_norm': True, 'lr': 0.0005874722386583951, 'weight_decay': 1.3276977046873254e-05, 'epochs': 304, 'loss': 'mae', 'optimizer': 'adam', 'graph_mode': 'off', 'use_snp_selection': False}. Best is trial 16 with value: 0.14105610079653463.
[I 2025-12-05 15:38:56,260] Trial 83 finished with value: 0.1238671091507942 and parameters: {'model_type': 'mlp', 'hidden_dims': '[512, 128]', 'dropout': 0.16120983126478428, 'batch_norm': True, 'lr': 0.000681307162442945, 'weight_decay': 1.222047192493048e-05, 'epochs': 301, 'loss': 'mae', 'optimizer': 'adam', 'graph_mode': 'off', 'use_snp_selection': False}. Best is trial 16 with value: 0.14105610079653463.
[I 2025-12-05 15:38:58,223] Trial 84 finished with value: 0.12886170261954222 and parameters: {'model_type': 'mlp', 'hidden_dims': '[512, 128]', 'dropout': 0.16861893883711768, 'batch_norm': True, 'lr': 0.000745176704798838, 'weight_decay': 1.169638017639736e-05, 'epochs': 316, 'loss': 'mae', 'optimizer': 'adam', 'graph_mode': 'off', 'use_snp_selection': False}. Best is trial 16 with value: 0.14105610079653463.
[I 2025-12-05 15:39:00,213] Trial 85 finished with value: 0.12370932176267065 and parameters: {'model_type': 'mlp', 'hidden_dims': '[512, 128]', 'dropout': 0.1808843449772585, 'batch_norm': True, 'lr': 0.0005010296661320778, 'weight_decay': 9.120094509346715e-06, 'epochs': 318, 'loss': 'mae', 'optimizer': 'adam', 'graph_mode': 'off', 'use_snp_selection': False}. Best is trial 16 with value: 0.14105610079653463.
[I 2025-12-05 15:39:02,155] Trial 86 finished with value: 0.11013617454186506 and parameters: {'model_type': 'mlp', 'hidden_dims': '[512, 128]', 'dropout': 0.18988335364378944, 'batch_norm': True, 'lr': 0.0007926079106427636, 'weight_decay': 1.8742581074675604e-05, 'epochs': 304, 'loss': 'mae', 'optimizer': 'adam', 'graph_mode': 'off', 'use_snp_selection': False}. Best is trial 16 with value: 0.14105610079653463.
[I 2025-12-05 15:39:04,070] Trial 87 finished with value: 0.12470499089884347 and parameters: {'model_type': 'mlp', 'hidden_dims': '[512, 128]', 'dropout': 0.2081302077464204, 'batch_norm': True, 'lr': 0.0006136018528239645, 'weight_decay': 2.8191852959997343e-05, 'epochs': 295, 'loss': 'mae', 'optimizer': 'adam', 'graph_mode': 'off', 'use_snp_selection': False}. Best is trial 16 with value: 0.14105610079653463.
[I 2025-12-05 15:39:07,058] Trial 88 finished with value: 0.09586365351819033 and parameters: {'model_type': 'mlp', 'hidden_dims': '[512, 128]', 'dropout': 0.14504786192699917, 'batch_norm': True, 'lr': 0.0005926096528361916, 'weight_decay': 2.9946278988333735e-05, 'epochs': 341, 'loss': 'mse', 'optimizer': 'adam', 'graph_mode': 'off', 'use_snp_selection': True, 'num_snps': 48766}. Best is trial 16 with value: 0.14105610079653463.
[I 2025-12-05 15:39:08,978] Trial 89 finished with value: 0.11909527573279585 and parameters: {'model_type': 'mlp', 'hidden_dims': '[512, 128]', 'dropout': 0.16831331485901965, 'batch_norm': True, 'lr': 0.0009628725844420528, 'weight_decay': 1.2523121391131317e-05, 'epochs': 292, 'loss': 'mae', 'optimizer': 'adam', 'graph_mode': 'off', 'use_snp_selection': False}. Best is trial 16 with value: 0.14105610079653463.
[I 2025-12-05 15:39:10,930] Trial 90 finished with value: 0.11862633743267244 and parameters: {'model_type': 'mlp', 'hidden_dims': '[512, 128]', 'dropout': 0.1333199389198315, 'batch_norm': True, 'lr': 0.0007742093456786391, 'weight_decay': 4.156300987270892e-05, 'epochs': 311, 'loss': 'mae', 'optimizer': 'adam', 'graph_mode': 'off', 'use_snp_selection': False}. Best is trial 16 with value: 0.14105610079653463.
[I 2025-12-05 15:39:12,766] Trial 91 finished with value: 0.11632608432262531 and parameters: {'model_type': 'mlp', 'hidden_dims': '[512, 128]', 'dropout': 0.19822648126818476, 'batch_norm': True, 'lr': 0.000550347371383811, 'weight_decay': 2.0690142530385183e-05, 'epochs': 282, 'loss': 'mae', 'optimizer': 'adam', 'graph_mode': 'off', 'use_snp_selection': False}. Best is trial 16 with value: 0.14105610079653463.
[I 2025-12-05 15:39:14,784] Trial 92 finished with value: 0.11537513920442574 and parameters: {'model_type': 'mlp', 'hidden_dims': '[512, 128]', 'dropout': 0.22305606709852874, 'batch_norm': True, 'lr': 0.00046770539542684297, 'weight_decay': 6.484476695584976e-05, 'epochs': 325, 'loss': 'mae', 'optimizer': 'adam', 'graph_mode': 'off', 'use_snp_selection': False}. Best is trial 16 with value: 0.14105610079653463.
[I 2025-12-05 15:39:16,752] Trial 93 finished with value: 0.10914613942855828 and parameters: {'model_type': 'mlp', 'hidden_dims': '[512, 128]', 'dropout': 0.2077014433288709, 'batch_norm': True, 'lr': 0.00033843195370069045, 'weight_decay': 1.5224065069940357e-07, 'epochs': 317, 'loss': 'mae', 'optimizer': 'adam', 'graph_mode': 'off', 'use_snp_selection': False}. Best is trial 16 with value: 0.14105610079653463.
[I 2025-12-05 15:39:18,868] Trial 94 finished with value: 0.12093302416550762 and parameters: {'model_type': 'mlp', 'hidden_dims': '[512, 128]', 'dropout': 0.1572937590921244, 'batch_norm': True, 'lr': 0.0002685558991539003, 'weight_decay': 1.0065062703130785e-05, 'epochs': 348, 'loss': 'mae', 'optimizer': 'adam', 'graph_mode': 'off', 'use_snp_selection': False}. Best is trial 16 with value: 0.14105610079653463.
[I 2025-12-05 15:39:20,128] Trial 95 finished with value: 0.12533587099170068 and parameters: {'model_type': 'mlp', 'hidden_dims': '[256, 128]', 'dropout': 0.24826337038058288, 'batch_norm': True, 'lr': 0.0009928065079614038, 'weight_decay': 2.4623903909441543e-05, 'epochs': 298, 'loss': 'mae', 'optimizer': 'adam', 'graph_mode': 'off', 'use_snp_selection': False}. Best is trial 16 with value: 0.14105610079653463.
[I 2025-12-05 15:39:21,438] Trial 96 finished with value: 0.12552778782635893 and parameters: {'model_type': 'mlp', 'hidden_dims': '[256, 128]', 'dropout': 0.25896832286343135, 'batch_norm': True, 'lr': 0.0009653876144550985, 'weight_decay': 2.794443284195368e-05, 'epochs': 306, 'loss': 'mae', 'optimizer': 'adam', 'graph_mode': 'off', 'use_snp_selection': False}. Best is trial 16 with value: 0.14105610079653463.
[I 2025-12-05 15:39:22,764] Trial 97 finished with value: 0.12401739212322689 and parameters: {'model_type': 'mlp', 'hidden_dims': '[256, 128]', 'dropout': 0.14074013449180345, 'batch_norm': True, 'lr': 0.0008946655541958309, 'weight_decay': 1.4434897501018484e-05, 'epochs': 330, 'loss': 'mae', 'optimizer': 'adam', 'graph_mode': 'off', 'use_snp_selection': False}. Best is trial 16 with value: 0.14105610079653463.
[I 2025-12-05 15:39:24,107] Trial 98 finished with value: 0.11300618525979263 and parameters: {'model_type': 'mlp', 'hidden_dims': '[256, 128]', 'dropout': 0.2484015549655354, 'batch_norm': True, 'lr': 0.0008003842798893437, 'weight_decay': 2.4208102304501712e-05, 'epochs': 340, 'loss': 'mae', 'optimizer': 'adam', 'graph_mode': 'off', 'use_snp_selection': False}. Best is trial 16 with value: 0.14105610079653463.
[I 2025-12-05 15:39:25,387] Trial 99 finished with value: 0.11227165755344565 and parameters: {'model_type': 'mlp', 'hidden_dims': '[256, 128]', 'dropout': 0.265313176441485, 'batch_norm': False, 'lr': 0.000741046564782014, 'weight_decay': 3.49884345288698e-05, 'epochs': 307, 'loss': 'mae', 'optimizer': 'adam', 'graph_mode': 'off', 'use_snp_selection': False}. Best is trial 16 with value: 0.14105610079653463.
[I 2025-12-05 15:39:27,237] Trial 100 finished with value: 0.10763477384012061 and parameters: {'model_type': 'mlp', 'hidden_dims': '[512, 64]', 'dropout': 0.10860869694594116, 'batch_norm': True, 'lr': 1.8400792021744545e-05, 'weight_decay': 1.739062402007553e-05, 'epochs': 286, 'loss': 'mae', 'optimizer': 'adam', 'graph_mode': 'off', 'use_snp_selection': False}. Best is trial 16 with value: 0.14105610079653463.
[I 2025-12-05 15:39:28,471] Trial 101 finished with value: 0.10965647799567112 and parameters: {'model_type': 'mlp', 'hidden_dims': '[256, 128]', 'dropout': 0.29034894141030304, 'batch_norm': True, 'lr': 0.000993796272034907, 'weight_decay': 2.7165489873222856e-05, 'epochs': 278, 'loss': 'mae', 'optimizer': 'adam', 'graph_mode': 'off', 'use_snp_selection': False}. Best is trial 16 with value: 0.14105610079653463.
[I 2025-12-05 15:39:29,740] Trial 102 finished with value: 0.12157724501088017 and parameters: {'model_type': 'mlp', 'hidden_dims': '[256, 128]', 'dropout': 0.23886399466791897, 'batch_norm': True, 'lr': 0.0005771524325826575, 'weight_decay': 6.5593781873265075e-06, 'epochs': 296, 'loss': 'mae', 'optimizer': 'adam', 'graph_mode': 'off', 'use_snp_selection': False}. Best is trial 16 with value: 0.14105610079653463.
[I 2025-12-05 15:39:31,043] Trial 103 finished with value: 0.1178783678307804 and parameters: {'model_type': 'mlp', 'hidden_dims': '[256, 128]', 'dropout': 0.2276368467510667, 'batch_norm': True, 'lr': 0.0004333732258317284, 'weight_decay': 5.886227244237165e-05, 'epochs': 321, 'loss': 'mae', 'optimizer': 'adam', 'graph_mode': 'off', 'use_snp_selection': False}. Best is trial 16 with value: 0.14105610079653463.
[I 2025-12-05 15:39:32,349] Trial 104 finished with value: 0.11942546786878284 and parameters: {'model_type': 'mlp', 'hidden_dims': '[256, 128]', 'dropout': 0.1879368971920236, 'batch_norm': True, 'lr': 0.0006489867176819433, 'weight_decay': 1.3622899651047579e-05, 'epochs': 297, 'loss': 'mae', 'optimizer': 'adam', 'graph_mode': 'off', 'use_snp_selection': False}. Best is trial 16 with value: 0.14105610079653463.
[I 2025-12-05 15:39:34,267] Trial 105 finished with value: 0.11733658561609822 and parameters: {'model_type': 'mlp', 'hidden_dims': '[512, 128]', 'dropout': 0.12743799795846034, 'batch_norm': True, 'lr': 0.0005933818365664275, 'weight_decay': 8.193577123544075e-06, 'epochs': 305, 'loss': 'mae', 'optimizer': 'adam', 'graph_mode': 'off', 'use_snp_selection': False}. Best is trial 16 with value: 0.14105610079653463.
[I 2025-12-05 15:39:35,299] Trial 106 finished with value: 0.12589978654606984 and parameters: {'model_type': 'mlp', 'hidden_dims': '[128, 64]', 'dropout': 0.17440873676283772, 'batch_norm': True, 'lr': 0.0008625292208858615, 'weight_decay': 2.3492824476730314e-05, 'epochs': 314, 'loss': 'mae', 'optimizer': 'adam', 'graph_mode': 'off', 'use_snp_selection': False}. Best is trial 16 with value: 0.14105610079653463.
[I 2025-12-05 15:39:36,346] Trial 107 finished with value: 0.10774775859168048 and parameters: {'model_type': 'mlp', 'hidden_dims': '[128, 64]', 'dropout': 0.17300483147152212, 'batch_norm': True, 'lr': 0.0009017060417209805, 'weight_decay': 1.1147340814850422e-05, 'epochs': 327, 'loss': 'mse', 'optimizer': 'adam', 'graph_mode': 'off', 'use_snp_selection': False}. Best is trial 16 with value: 0.14105610079653463.
[I 2025-12-05 15:39:37,640] Trial 108 finished with value: 0.11777600245052906 and parameters: {'model_type': 'mlp', 'hidden_dims': '[128, 64]', 'dropout': 0.152571235380562, 'batch_norm': True, 'lr': 0.0009974271610184696, 'weight_decay': 2.1896119756409242e-05, 'epochs': 335, 'loss': 'mae', 'optimizer': 'adam', 'graph_mode': 'off', 'use_snp_selection': True, 'num_snps': 11322}. Best is trial 16 with value: 0.14105610079653463.
[I 2025-12-05 15:39:38,687] Trial 109 finished with value: 0.12563856822990824 and parameters: {'model_type': 'mlp', 'hidden_dims': '[128, 64]', 'dropout': 0.16260256800561218, 'batch_norm': True, 'lr': 0.0007021605371654231, 'weight_decay': 1.8323952386395358e-05, 'epochs': 310, 'loss': 'mae', 'optimizer': 'adam', 'graph_mode': 'off', 'use_snp_selection': False}. Best is trial 16 with value: 0.14105610079653463.
[I 2025-12-05 15:39:39,714] Trial 110 finished with value: 0.11422020816055316 and parameters: {'model_type': 'mlp', 'hidden_dims': '[128, 64]', 'dropout': 0.16329626148048715, 'batch_norm': True, 'lr': 8.047280179419535e-05, 'weight_decay': 5.416067586942798e-06, 'epochs': 315, 'loss': 'mae', 'optimizer': 'adam', 'graph_mode': 'off', 'use_snp_selection': False}. Best is trial 16 with value: 0.14105610079653463.
[I 2025-12-05 15:39:40,781] Trial 111 finished with value: 0.12522859082724114 and parameters: {'model_type': 'mlp', 'hidden_dims': '[128, 64]', 'dropout': 0.1231032312592669, 'batch_norm': True, 'lr': 0.000776996862167641, 'weight_decay': 1.714874782048792e-05, 'epochs': 312, 'loss': 'mae', 'optimizer': 'adam', 'graph_mode': 'off', 'use_snp_selection': False}. Best is trial 16 with value: 0.14105610079653463.
[I 2025-12-05 15:39:41,771] Trial 112 finished with value: 0.1183681318726607 and parameters: {'model_type': 'mlp', 'hidden_dims': '[128, 64]', 'dropout': 0.1463042945181101, 'batch_norm': True, 'lr': 0.0004943787316342902, 'weight_decay': 4.533000750035992e-05, 'epochs': 288, 'loss': 'mae', 'optimizer': 'adam', 'graph_mode': 'off', 'use_snp_selection': False}. Best is trial 16 with value: 0.14105610079653463.
[I 2025-12-05 15:39:42,850] Trial 113 finished with value: 0.11787305376867718 and parameters: {'model_type': 'mlp', 'hidden_dims': '[128, 64]', 'dropout': 0.10886403597560555, 'batch_norm': True, 'lr': 0.00083504631001362, 'weight_decay': 1.017874694964937e-05, 'epochs': 350, 'loss': 'mae', 'optimizer': 'adam', 'graph_mode': 'off', 'use_snp_selection': False}. Best is trial 16 with value: 0.14105610079653463.
[I 2025-12-05 15:39:43,879] Trial 114 finished with value: 0.1222495379900798 and parameters: {'model_type': 'mlp', 'hidden_dims': '[128, 64]', 'dropout': 0.1876259690336832, 'batch_norm': True, 'lr': 0.0007483984335744505, 'weight_decay': 3.616365951580221e-05, 'epochs': 303, 'loss': 'mae', 'optimizer': 'adam', 'graph_mode': 'off', 'use_snp_selection': False}. Best is trial 16 with value: 0.14105610079653463.
[I 2025-12-05 15:39:45,205] Trial 115 finished with value: 0.11523042038908028 and parameters: {'model_type': 'mlp', 'hidden_dims': '[256, 128, 64]', 'dropout': 0.17615196151530937, 'batch_norm': True, 'lr': 0.0006711685937125476, 'weight_decay': 2.3507646402341447e-05, 'epochs': 321, 'loss': 'mae', 'optimizer': 'adam', 'graph_mode': 'off', 'use_snp_selection': False}. Best is trial 16 with value: 0.14105610079653463.
[I 2025-12-05 15:39:46,405] Trial 116 finished with value: 0.1120085815200819 and parameters: {'model_type': 'mlp', 'hidden_dims': '[256, 128]', 'dropout': 0.13808264180818078, 'batch_norm': True, 'lr': 0.00010053951072799804, 'weight_decay': 1.4084675628476655e-05, 'epochs': 263, 'loss': 'mae', 'optimizer': 'adam', 'graph_mode': 'off', 'use_snp_selection': False}. Best is trial 16 with value: 0.14105610079653463.
[I 2025-12-05 15:39:47,449] Trial 117 finished with value: 0.12002740629713064 and parameters: {'model_type': 'mlp', 'hidden_dims': '[128, 64]', 'dropout': 0.1557941788672546, 'batch_norm': True, 'lr': 0.000246252777382135, 'weight_decay': 1.868933854915181e-05, 'epochs': 310, 'loss': 'mae', 'optimizer': 'adam', 'graph_mode': 'off', 'use_snp_selection': False}. Best is trial 16 with value: 0.14105610079653463.
[I 2025-12-05 15:39:48,753] Trial 118 finished with value: 0.109103335134049 and parameters: {'model_type': 'mlp', 'hidden_dims': '[256, 128]', 'dropout': 0.10062463851132221, 'batch_norm': False, 'lr': 6.335056396226562e-05, 'weight_decay': 7.629943402244136e-06, 'epochs': 328, 'loss': 'mae', 'optimizer': 'adam', 'graph_mode': 'off', 'use_snp_selection': False}. Best is trial 16 with value: 0.14105610079653463.
[I 2025-12-05 15:39:49,808] Trial 119 finished with value: 0.11228399435368533 and parameters: {'model_type': 'mlp', 'hidden_dims': '[128, 64]', 'dropout': 0.30988712147165876, 'batch_norm': True, 'lr': 0.0001243111024600946, 'weight_decay': 9.086601765355427e-06, 'epochs': 333, 'loss': 'mae', 'optimizer': 'adam', 'graph_mode': 'off', 'use_snp_selection': False}. Best is trial 16 with value: 0.14105610079653463.
[I 2025-12-05 15:39:51,880] Trial 120 finished with value: 0.10037973887928878 and parameters: {'model_type': 'mlp', 'hidden_dims': '[512, 128]', 'dropout': 0.3780252888919633, 'batch_norm': True, 'lr': 2.1983430006925554e-05, 'weight_decay': 8.632887226499505e-05, 'epochs': 344, 'loss': 'mae', 'optimizer': 'adam', 'graph_mode': 'off', 'use_snp_selection': False}. Best is trial 16 with value: 0.14105610079653463.
[I 2025-12-05 15:39:52,904] Trial 121 finished with value: 0.11855545959561284 and parameters: {'model_type': 'mlp', 'hidden_dims': '[128, 64]', 'dropout': 0.13282334269060042, 'batch_norm': True, 'lr': 0.0006940949029621547, 'weight_decay': 1.1279098369903357e-05, 'epochs': 312, 'loss': 'mae', 'optimizer': 'adam', 'graph_mode': 'off', 'use_snp_selection': False}. Best is trial 16 with value: 0.14105610079653463.
[I 2025-12-05 15:39:53,914] Trial 122 finished with value: 0.10746301202230492 and parameters: {'model_type': 'mlp', 'hidden_dims': '[128, 64]', 'dropout': 0.1229341022017872, 'batch_norm': True, 'lr': 0.0008456148630073618, 'weight_decay': 1.7036700601037794e-05, 'epochs': 301, 'loss': 'mae', 'optimizer': 'adam', 'graph_mode': 'off', 'use_snp_selection': False}. Best is trial 16 with value: 0.14105610079653463.
[I 2025-12-05 15:39:54,976] Trial 123 finished with value: 0.11214790699161169 and parameters: {'model_type': 'mlp', 'hidden_dims': '[128, 64]', 'dropout': 0.116508282329591, 'batch_norm': True, 'lr': 0.0005185822334049665, 'weight_decay': 1.5645605795120597e-05, 'epochs': 317, 'loss': 'mae', 'optimizer': 'adam', 'graph_mode': 'off', 'use_snp_selection': False}. Best is trial 16 with value: 0.14105610079653463.
[I 2025-12-05 15:39:56,902] Trial 124 finished with value: 0.11894609469852829 and parameters: {'model_type': 'mlp', 'hidden_dims': '[512, 64]', 'dropout': 0.1657252415511603, 'batch_norm': True, 'lr': 0.0003956934764521645, 'weight_decay': 3.249049874807487e-05, 'epochs': 308, 'loss': 'mae', 'optimizer': 'adam', 'graph_mode': 'off', 'use_snp_selection': False}. Best is trial 16 with value: 0.14105610079653463.
[I 2025-12-05 15:39:57,996] Trial 125 finished with value: 0.10666874574037802 and parameters: {'model_type': 'mlp', 'hidden_dims': '[128, 64]', 'dropout': 0.1275154023939214, 'batch_norm': True, 'lr': 0.0007773214086386513, 'weight_decay': 1.8676139367655636e-05, 'epochs': 324, 'loss': 'mae', 'optimizer': 'adam', 'graph_mode': 'off', 'use_snp_selection': False}. Best is trial 16 with value: 0.14105610079653463.
