[I 2025-12-05 15:05:17,954] Trial 140 finished with value: 0.056350564182321795 and parameters: {'model_type': 'mlp', 'hidden_dims': '[512, 128]', 'dropout': 0.19741029936391516, 'batch_norm': True, 'lr': 0.0002027984050360481, 'weight_decay': 1.5252927263880604e-05, 'epochs': 69, 'loss': 'mse', 'optimizer': 'adam', 'graph_mode': 'off', 'use_snp_selection': False}. Best is trial 63 with value: 0.07434790383048129.
[I 2025-12-05 15:05:19,285] Trial 141 finished with value: 0.046742497726657194 and parameters: {'model_type': 'mlp', 'hidden_dims': '[512, 128]', 'dropout': 0.2761365398879402, 'batch_norm': True, 'lr': 0.0004299899985255098, 'weight_decay': 0.0004895221833969561, 'epochs': 163, 'loss': 'mse', 'optimizer': 'adam', 'graph_mode': 'off', 'use_snp_selection': False}. Best is trial 63 with value: 0.07434790383048129.
[I 2025-12-05 15:05:20,661] Trial 142 finished with value: 0.05328685278894123 and parameters: {'model_type': 'mlp', 'hidden_dims': '[512, 128]', 'dropout': 0.2393973478231262, 'batch_norm': True, 'lr': 0.00047542113232905956, 'weight_decay': 0.0006362798279339321, 'epochs': 176, 'loss': 'mse', 'optimizer': 'adam', 'graph_mode': 'off', 'use_snp_selection': False}. Best is trial 63 with value: 0.07434790383048129.
[I 2025-12-05 15:05:21,807] Trial 143 finished with value: 0.06325511920302229 and parameters: {'model_type': 'mlp', 'hidden_dims': '[512, 128]', 'dropout': 0.25965090181107586, 'batch_norm': True, 'lr': 0.0006135825593908947, 'weight_decay': 6.577207453594483e-05, 'epochs': 116, 'loss': 'mse', 'optimizer': 'adam', 'graph_mode': 'off', 'use_snp_selection': False}. Best is trial 63 with value: 0.07434790383048129.
[I 2025-12-05 15:05:22,949] Trial 144 finished with value: 0.05326886901815865 and parameters: {'model_type': 'mlp', 'hidden_dims': '[512, 128]', 'dropout': 0.22791013965151116, 'batch_norm': True, 'lr': 0.0006360286376612422, 'weight_decay': 6.513990338129458e-05, 'epochs': 115, 'loss': 'mse', 'optimizer': 'adam', 'graph_mode': 'off', 'use_snp_selection': False}. Best is trial 63 with value: 0.07434790383048129.
[I 2025-12-05 15:05:24,081] Trial 145 finished with value: 0.045689133646568264 and parameters: {'model_type': 'mlp', 'hidden_dims': '[512, 128]', 'dropout': 0.25305159300611696, 'batch_norm': True, 'lr': 4.287443073905747e-05, 'weight_decay': 5.1451560126763716e-05, 'epochs': 105, 'loss': 'mse', 'optimizer': 'adam', 'graph_mode': 'off', 'use_snp_selection': False}. Best is trial 63 with value: 0.07434790383048129.
[I 2025-12-05 15:05:25,155] Trial 146 finished with value: 0.07614417638642079 and parameters: {'model_type': 'mlp', 'hidden_dims': '[512, 128]', 'dropout': 0.26608324960592605, 'batch_norm': True, 'lr': 0.00036880134065102695, 'weight_decay': 2.7323981839967337e-05, 'epochs': 83, 'loss': 'mse', 'optimizer': 'adam', 'graph_mode': 'off', 'use_snp_selection': False}. Best is trial 146 with value: 0.07614417638642079.
[I 2025-12-05 15:05:26,219] Trial 147 finished with value: 0.0382639519245217 and parameters: {'model_type': 'mlp', 'hidden_dims': '[512, 128]', 'dropout': 0.26089259386212305, 'batch_norm': True, 'lr': 0.0003829708588407985, 'weight_decay': 3.654387041952365e-05, 'epochs': 83, 'loss': 'mse', 'optimizer': 'adam', 'graph_mode': 'off', 'use_snp_selection': False}. Best is trial 146 with value: 0.07614417638642079.
[I 2025-12-05 15:05:27,314] Trial 148 finished with value: 0.05414285642453601 and parameters: {'model_type': 'mlp', 'hidden_dims': '[512, 128]', 'dropout': 0.2902658620763555, 'batch_norm': True, 'lr': 0.0005148980743049007, 'weight_decay': 2.7910877569644034e-05, 'epochs': 94, 'loss': 'mse', 'optimizer': 'adam', 'graph_mode': 'off', 'use_snp_selection': False}. Best is trial 146 with value: 0.07614417638642079.
[I 2025-12-05 15:05:28,320] Trial 149 finished with value: 0.021986726036415993 and parameters: {'model_type': 'mlp', 'hidden_dims': '[512, 128]', 'dropout': 0.26149817208817683, 'batch_norm': False, 'lr': 0.0003072445336349449, 'weight_decay': 0.0001522452292792165, 'epochs': 74, 'loss': 'mse', 'optimizer': 'adam', 'graph_mode': 'off', 'use_snp_selection': False}. Best is trial 146 with value: 0.07614417638642079.
[I 2025-12-05 15:05:41,624] Trial 0 finished with value: 0.02226642878056722 and parameters: {'model_type': 'mlp', 'hidden_dims': '[128, 64]', 'dropout': 0.199031432379812, 'batch_norm': True, 'lr': 1.8408544111075837e-06, 'weight_decay': 5.5136510071208614e-05, 'epochs': 336, 'loss': 'mae', 'optimizer': 'adam', 'graph_mode': 'off', 'use_snp_selection': True, 'num_snps': 43862}. Best is trial 0 with value: 0.02226642878056722.
[I 2025-12-05 15:05:42,667] Trial 1 finished with value: 0.041877621699136794 and parameters: {'model_type': 'mlp', 'hidden_dims': '[256, 128]', 'dropout': 0.4370668075331726, 'batch_norm': True, 'lr': 7.133471581159139e-05, 'weight_decay': 1.128633586803549e-05, 'epochs': 242, 'loss': 'mae', 'optimizer': 'adam', 'graph_mode': 'off', 'use_snp_selection': False}. Best is trial 1 with value: 0.041877621699136794.
[I 2025-12-05 15:05:43,655] Trial 2 finished with value: -0.007685987833734059 and parameters: {'model_type': 'mlp', 'hidden_dims': '[256, 128, 64]', 'dropout': 0.41314357415569625, 'batch_norm': False, 'lr': 3.952233718592101e-06, 'weight_decay': 0.00026754769258252603, 'epochs': 149, 'loss': 'mse', 'optimizer': 'adam', 'graph_mode': 'off', 'use_snp_selection': True, 'num_snps': 11571}. Best is trial 1 with value: 0.041877621699136794.
[I 2025-12-05 15:05:45,479] Trial 3 finished with value: -0.020557183256604713 and parameters: {'model_type': 'mlp', 'hidden_dims': '[512, 64]', 'dropout': 0.5938127374509361, 'batch_norm': False, 'lr': 5.67704586114731e-06, 'weight_decay': 2.4518087630137052e-05, 'epochs': 320, 'loss': 'mae', 'optimizer': 'adam', 'graph_mode': 'off', 'use_snp_selection': False}. Best is trial 1 with value: 0.041877621699136794.
[I 2025-12-05 15:05:47,752] Trial 4 finished with value: -0.024939302878075578 and parameters: {'model_type': 'mlp', 'hidden_dims': '[512, 128]', 'dropout': 0.25746343592134413, 'batch_norm': True, 'lr': 1.3467657668402788e-06, 'weight_decay': 0.00033087251918647806, 'epochs': 277, 'loss': 'mse', 'optimizer': 'adam', 'graph_mode': 'off', 'use_snp_selection': True, 'num_snps': 36675}. Best is trial 1 with value: 0.041877621699136794.
[I 2025-12-05 15:05:49,507] Trial 5 finished with value: -0.003541948511497568 and parameters: {'model_type': 'mlp', 'hidden_dims': '[512, 64]', 'dropout': 0.38275350994408375, 'batch_norm': True, 'lr': 1.5586664309232824e-06, 'weight_decay': 0.0008227664668621182, 'epochs': 145, 'loss': 'mae', 'optimizer': 'adam', 'graph_mode': 'off', 'use_snp_selection': True, 'num_snps': 32148}. Best is trial 1 with value: 0.041877621699136794.
[I 2025-12-05 15:05:50,443] Trial 6 finished with value: 0.027299419200858977 and parameters: {'model_type': 'mlp', 'hidden_dims': '[256, 128]', 'dropout': 0.3930109900265879, 'batch_norm': False, 'lr': 4.892964372128395e-05, 'weight_decay': 1.5809549317992182e-06, 'epochs': 199, 'loss': 'mse', 'optimizer': 'adam', 'graph_mode': 'off', 'use_snp_selection': False}. Best is trial 1 with value: 0.041877621699136794.
[I 2025-12-05 15:05:51,454] Trial 7 finished with value: 0.0675187428991723 and parameters: {'model_type': 'mlp', 'hidden_dims': '[512, 256]', 'dropout': 0.15343979219678458, 'batch_norm': True, 'lr': 6.234003099047341e-05, 'weight_decay': 3.894760610535477e-07, 'epochs': 97, 'loss': 'mse', 'optimizer': 'adam', 'graph_mode': 'off', 'use_snp_selection': False}. Best is trial 7 with value: 0.0675187428991723.
[I 2025-12-05 15:05:53,214] Trial 8 finished with value: 0.04119235637116993 and parameters: {'model_type': 'mlp', 'hidden_dims': '[512, 128]', 'dropout': 0.10743001231661406, 'batch_norm': True, 'lr': 0.00023728538449271062, 'weight_decay': 1.7629071578048637e-05, 'epochs': 312, 'loss': 'mae', 'optimizer': 'adam', 'graph_mode': 'off', 'use_snp_selection': False}. Best is trial 7 with value: 0.0675187428991723.
[I 2025-12-05 15:05:54,506] Trial 9 finished with value: 0.04339448377332719 and parameters: {'model_type': 'mlp', 'hidden_dims': '[512, 64]', 'dropout': 0.14505336736221927, 'batch_norm': True, 'lr': 5.8619638388111826e-05, 'weight_decay': 6.200156172669308e-07, 'epochs': 175, 'loss': 'mse', 'optimizer': 'adam', 'graph_mode': 'off', 'use_snp_selection': False}. Best is trial 7 with value: 0.0675187428991723.
[I 2025-12-05 15:05:55,344] Trial 10 finished with value: -0.014161588021908537 and parameters: {'model_type': 'mlp', 'hidden_dims': '[512, 256]', 'dropout': 0.2736992815328032, 'batch_norm': False, 'lr': 0.00032393778075602147, 'weight_decay': 1.1511946696017092e-07, 'epochs': 41, 'loss': 'mse', 'optimizer': 'adam', 'graph_mode': 'off', 'use_snp_selection': False}. Best is trial 7 with value: 0.0675187428991723.
[I 2025-12-05 15:05:56,342] Trial 11 finished with value: 0.013077164491854315 and parameters: {'model_type': 'mlp', 'hidden_dims': '[512, 256]', 'dropout': 0.10095648685224448, 'batch_norm': True, 'lr': 1.6474108386126448e-05, 'weight_decay': 6.203180869264506e-07, 'epochs': 77, 'loss': 'mse', 'optimizer': 'adam', 'graph_mode': 'off', 'use_snp_selection': False}. Best is trial 7 with value: 0.0675187428991723.
[I 2025-12-05 15:05:57,444] Trial 12 finished with value: 0.04501487591924778 and parameters: {'model_type': 'mlp', 'hidden_dims': '[512, 256]', 'dropout': 0.1977119287227368, 'batch_norm': True, 'lr': 0.000121041789182661, 'weight_decay': 1.2192432071058163e-06, 'epochs': 106, 'loss': 'mse', 'optimizer': 'adam', 'graph_mode': 'off', 'use_snp_selection': False}. Best is trial 7 with value: 0.0675187428991723.
[I 2025-12-05 15:05:58,546] Trial 13 finished with value: 0.023556258935594813 and parameters: {'model_type': 'mlp', 'hidden_dims': '[512, 256]', 'dropout': 0.22096278001553593, 'batch_norm': True, 'lr': 0.00013100665335591914, 'weight_decay': 2.215502086408347e-06, 'epochs': 111, 'loss': 'mse', 'optimizer': 'adam', 'graph_mode': 'off', 'use_snp_selection': False}. Best is trial 7 with value: 0.0675187428991723.
[I 2025-12-05 15:05:59,586] Trial 14 finished with value: 0.053394535691756125 and parameters: {'model_type': 'mlp', 'hidden_dims': '[512, 256]', 'dropout': 0.30473884411503666, 'batch_norm': True, 'lr': 0.0007929572531082917, 'weight_decay': 1.1356099766169029e-07, 'epochs': 93, 'loss': 'mse', 'optimizer': 'adam', 'graph_mode': 'off', 'use_snp_selection': False}. Best is trial 7 with value: 0.0675187428991723.
[I 2025-12-05 15:06:00,419] Trial 15 finished with value: 0.0569141675277794 and parameters: {'model_type': 'mlp', 'hidden_dims': '[512, 256]', 'dropout': 0.31557371815447827, 'batch_norm': True, 'lr': 0.0006458964420444877, 'weight_decay': 1.1212901139879828e-07, 'epochs': 41, 'loss': 'mse', 'optimizer': 'adam', 'graph_mode': 'off', 'use_snp_selection': False}. Best is trial 7 with value: 0.0675187428991723.
[I 2025-12-05 15:06:01,085] Trial 16 finished with value: 0.01721475783575116 and parameters: {'model_type': 'mlp', 'hidden_dims': '[256, 128, 64]', 'dropout': 0.4942699064299083, 'batch_norm': True, 'lr': 0.0007722335950364933, 'weight_decay': 2.561351924486045e-07, 'epochs': 43, 'loss': 'mse', 'optimizer': 'adam', 'graph_mode': 'off', 'use_snp_selection': False}. Best is trial 7 with value: 0.0675187428991723.
[I 2025-12-05 15:06:01,712] Trial 17 finished with value: 0.04019748550568986 and parameters: {'model_type': 'mlp', 'hidden_dims': '[128, 64]', 'dropout': 0.32888830259108426, 'batch_norm': True, 'lr': 2.349300150160787e-05, 'weight_decay': 4.88687621797449e-06, 'epochs': 71, 'loss': 'mse', 'optimizer': 'adam', 'graph_mode': 'off', 'use_snp_selection': False}. Best is trial 7 with value: 0.0675187428991723.
[I 2025-12-05 15:06:04,394] Trial 18 finished with value: 0.012178436679145168 and parameters: {'model_type': 'mlp', 'hidden_dims': '[512, 256]', 'dropout': 0.5098431992326697, 'batch_norm': False, 'lr': 0.0003193744707898419, 'weight_decay': 3.1913556729660404e-07, 'epochs': 133, 'loss': 'mse', 'optimizer': 'adam', 'graph_mode': 'off', 'use_snp_selection': True, 'num_snps': 58241}. Best is trial 7 with value: 0.0675187428991723.
[I 2025-12-05 15:06:05,925] Trial 19 finished with value: 0.06757389302384245 and parameters: {'model_type': 'mlp', 'hidden_dims': '[512, 256]', 'dropout': 0.16043013932667408, 'batch_norm': True, 'lr': 1.0948955842261321e-05, 'weight_decay': 4.209065619043004e-06, 'epochs': 220, 'loss': 'mse', 'optimizer': 'adam', 'graph_mode': 'off', 'use_snp_selection': False}. Best is trial 19 with value: 0.06757389302384245.
[I 2025-12-05 15:06:07,418] Trial 20 finished with value: 0.015744884414197576 and parameters: {'model_type': 'mlp', 'hidden_dims': '[512, 256]', 'dropout': 0.15532587154440167, 'batch_norm': True, 'lr': 1.1857669757062643e-05, 'weight_decay': 4.573628791604782e-06, 'epochs': 222, 'loss': 'mse', 'optimizer': 'adam', 'graph_mode': 'off', 'use_snp_selection': False}. Best is trial 19 with value: 0.06757389302384245.
[I 2025-12-05 15:06:09,076] Trial 21 finished with value: -0.0009037903122554977 and parameters: {'model_type': 'mlp', 'hidden_dims': '[512, 256]', 'dropout': 0.2560433296597369, 'batch_norm': True, 'lr': 8.227529678929203e-06, 'weight_decay': 2.7421923971903877e-07, 'epochs': 272, 'loss': 'mse', 'optimizer': 'adam', 'graph_mode': 'off', 'use_snp_selection': False}. Best is trial 19 with value: 0.06757389302384245.
[I 2025-12-05 15:06:10,449] Trial 22 finished with value: 0.021806516797396782 and parameters: {'model_type': 'mlp', 'hidden_dims': '[512, 256]', 'dropout': 0.16378419421054377, 'batch_norm': True, 'lr': 3.356443183277184e-05, 'weight_decay': 6.344835971964851e-07, 'epochs': 197, 'loss': 'mse', 'optimizer': 'adam', 'graph_mode': 'off', 'use_snp_selection': False}. Best is trial 19 with value: 0.06757389302384245.
[I 2025-12-05 15:06:11,339] Trial 23 finished with value: 0.0374387670071252 and parameters: {'model_type': 'mlp', 'hidden_dims': '[512, 256]', 'dropout': 0.22971583480261082, 'batch_norm': True, 'lr': 3.6266769746928844e-06, 'weight_decay': 1.0370036088312293e-07, 'epochs': 62, 'loss': 'mse', 'optimizer': 'adam', 'graph_mode': 'off', 'use_snp_selection': False}. Best is trial 19 with value: 0.06757389302384245.
[I 2025-12-05 15:06:12,602] Trial 24 finished with value: 0.04944768032454669 and parameters: {'model_type': 'mlp', 'hidden_dims': '[512, 256]', 'dropout': 0.31187291641122705, 'batch_norm': True, 'lr': 0.00012933696064794652, 'weight_decay': 2.564407165054635e-06, 'epochs': 169, 'loss': 'mse', 'optimizer': 'adam', 'graph_mode': 'off', 'use_snp_selection': False}. Best is trial 19 with value: 0.06757389302384245.
[I 2025-12-05 15:06:13,624] Trial 25 finished with value: 0.04113909237155206 and parameters: {'model_type': 'mlp', 'hidden_dims': '[256, 128, 64]', 'dropout': 0.1359123527074296, 'batch_norm': True, 'lr': 2.5085127063267275e-05, 'weight_decay': 6.441642337048761e-05, 'epochs': 238, 'loss': 'mse', 'optimizer': 'adam', 'graph_mode': 'off', 'use_snp_selection': False}. Best is trial 19 with value: 0.06757389302384245.
[I 2025-12-05 15:06:14,388] Trial 26 finished with value: -0.045905939672636495 and parameters: {'model_type': 'mlp', 'hidden_dims': '[512, 128]', 'dropout': 0.1871546197485401, 'batch_norm': True, 'lr': 1.2550693142833744e-05, 'weight_decay': 2.869851977173518e-07, 'epochs': 128, 'loss': 'mae', 'optimizer': 'adam', 'graph_mode': 'off', 'use_snp_selection': True, 'num_snps': 3842}. Best is trial 19 with value: 0.06757389302384245.
[I 2025-12-05 15:06:15,008] Trial 27 finished with value: -0.007626226963794908 and parameters: {'model_type': 'mlp', 'hidden_dims': '[128, 64]', 'dropout': 0.27536711783756684, 'batch_norm': False, 'lr': 0.0005703430075516442, 'weight_decay': 4.881339110858778e-06, 'epochs': 91, 'loss': 'mse', 'optimizer': 'adam', 'graph_mode': 'off', 'use_snp_selection': False}. Best is trial 19 with value: 0.06757389302384245.
[I 2025-12-05 15:06:15,726] Trial 28 finished with value: 0.05182840741819731 and parameters: {'model_type': 'mlp', 'hidden_dims': '[256, 128]', 'dropout': 0.219196935871986, 'batch_norm': True, 'lr': 0.00018823080611407532, 'weight_decay': 8.74418883788382e-07, 'epochs': 62, 'loss': 'mse', 'optimizer': 'adam', 'graph_mode': 'off', 'use_snp_selection': False}. Best is trial 19 with value: 0.06757389302384245.
[I 2025-12-05 15:06:17,090] Trial 29 finished with value: 0.0007484886843343185 and parameters: {'model_type': 'mlp', 'hidden_dims': '[128, 64]', 'dropout': 0.3467572556454796, 'batch_norm': True, 'lr': 2.8966762461994946e-06, 'weight_decay': 5.522710335772481e-05, 'epochs': 169, 'loss': 'mae', 'optimizer': 'adam', 'graph_mode': 'off', 'use_snp_selection': True, 'num_snps': 19468}. Best is trial 19 with value: 0.06757389302384245.
[I 2025-12-05 15:06:18,825] Trial 30 finished with value: 0.04248100771479254 and parameters: {'model_type': 'mlp', 'hidden_dims': '[512, 256]', 'dropout': 0.1863698947749949, 'batch_norm': True, 'lr': 7.23483957302171e-06, 'weight_decay': 2.0826053255669232e-07, 'epochs': 274, 'loss': 'mse', 'optimizer': 'adam', 'graph_mode': 'off', 'use_snp_selection': False}. Best is trial 19 with value: 0.06757389302384245.
[I 2025-12-05 15:06:19,848] Trial 31 finished with value: 0.03421463611905121 and parameters: {'model_type': 'mlp', 'hidden_dims': '[512, 256]', 'dropout': 0.285245900890249, 'batch_norm': True, 'lr': 0.0005412763729734681, 'weight_decay': 1.4047100622141207e-07, 'epochs': 95, 'loss': 'mse', 'optimizer': 'adam', 'graph_mode': 'off', 'use_snp_selection': False}. Best is trial 19 with value: 0.06757389302384245.
[I 2025-12-05 15:06:20,821] Trial 32 finished with value: 0.05412918420294217 and parameters: {'model_type': 'mlp', 'hidden_dims': '[512, 256]', 'dropout': 0.3147518483395101, 'batch_norm': True, 'lr': 0.0009179856398254046, 'weight_decay': 4.185039517955413e-07, 'epochs': 84, 'loss': 'mse', 'optimizer': 'adam', 'graph_mode': 'off', 'use_snp_selection': False}. Best is trial 19 with value: 0.06757389302384245.
[I 2025-12-05 15:06:21,682] Trial 33 finished with value: 0.03451059872357039 and parameters: {'model_type': 'mlp', 'hidden_dims': '[512, 256]', 'dropout': 0.3613899791583047, 'batch_norm': True, 'lr': 0.0009366624267992565, 'weight_decay': 6.212262983456248e-07, 'epochs': 53, 'loss': 'mse', 'optimizer': 'adam', 'graph_mode': 'off', 'use_snp_selection': False}. Best is trial 19 with value: 0.06757389302384245.
[I 2025-12-05 15:06:22,658] Trial 34 finished with value: 0.041250279515872776 and parameters: {'model_type': 'mlp', 'hidden_dims': '[256, 128]', 'dropout': 0.44764125238313845, 'batch_norm': True, 'lr': 0.0004428699771151555, 'weight_decay': 3.658140451021425e-07, 'epochs': 220, 'loss': 'mae', 'optimizer': 'adam', 'graph_mode': 'off', 'use_snp_selection': False}. Best is trial 19 with value: 0.06757389302384245.
[I 2025-12-05 15:06:23,600] Trial 35 finished with value: 0.016685313665836442 and parameters: {'model_type': 'mlp', 'hidden_dims': '[512, 256]', 'dropout': 0.43024169205778806, 'batch_norm': False, 'lr': 7.896538683669511e-05, 'weight_decay': 9.019218976270567e-06, 'epochs': 78, 'loss': 'mse', 'optimizer': 'adam', 'graph_mode': 'off', 'use_snp_selection': False}. Best is trial 19 with value: 0.06757389302384245.
[I 2025-12-05 15:06:26,461] Trial 36 finished with value: -0.012621495915887897 and parameters: {'model_type': 'mlp', 'hidden_dims': '[512, 64]', 'dropout': 0.12653961076855547, 'batch_norm': True, 'lr': 2.2595649246158207e-06, 'weight_decay': 2.8265393205425683e-05, 'epochs': 117, 'loss': 'mse', 'optimizer': 'adam', 'graph_mode': 'off', 'use_snp_selection': True, 'num_snps': 58661}. Best is trial 19 with value: 0.06757389302384245.
[I 2025-12-05 15:06:27,410] Trial 37 finished with value: 0.04253468822339714 and parameters: {'model_type': 'mlp', 'hidden_dims': '[256, 128, 64]', 'dropout': 0.49017343959823556, 'batch_norm': True, 'lr': 5.001646604457823e-06, 'weight_decay': 1.2450350506309487e-06, 'epochs': 152, 'loss': 'mae', 'optimizer': 'adam', 'graph_mode': 'off', 'use_snp_selection': False}. Best is trial 19 with value: 0.06757389302384245.
[I 2025-12-05 15:06:28,776] Trial 38 finished with value: 0.036654403903611965 and parameters: {'model_type': 'mlp', 'hidden_dims': '[512, 256]', 'dropout': 0.5749822693823109, 'batch_norm': False, 'lr': 4.513567648913652e-05, 'weight_decay': 0.0001565397144887208, 'epochs': 248, 'loss': 'mse', 'optimizer': 'adam', 'graph_mode': 'off', 'use_snp_selection': True, 'num_snps': 19911}. Best is trial 19 with value: 0.06757389302384245.
[I 2025-12-05 15:06:30,498] Trial 39 finished with value: 0.03893146028192449 and parameters: {'model_type': 'mlp', 'hidden_dims': '[512, 128]', 'dropout': 0.2557750474927368, 'batch_norm': True, 'lr': 8.851445551359375e-05, 'weight_decay': 4.5992238221604143e-07, 'epochs': 298, 'loss': 'mse', 'optimizer': 'adam', 'graph_mode': 'off', 'use_snp_selection': False}. Best is trial 19 with value: 0.06757389302384245.
[I 2025-12-05 15:06:31,816] Trial 40 finished with value: 0.04013519789593358 and parameters: {'model_type': 'mlp', 'hidden_dims': '[512, 64]', 'dropout': 0.38097025336556156, 'batch_norm': True, 'lr': 0.0002245117034135198, 'weight_decay': 1.942087004802439e-07, 'epochs': 184, 'loss': 'mae', 'optimizer': 'adam', 'graph_mode': 'off', 'use_snp_selection': False}. Best is trial 19 with value: 0.06757389302384245.
[I 2025-12-05 15:06:32,800] Trial 41 finished with value: 0.03997139724299168 and parameters: {'model_type': 'mlp', 'hidden_dims': '[512, 256]', 'dropout': 0.2923642427349459, 'batch_norm': True, 'lr': 0.0007271652991408863, 'weight_decay': 1.7469559077227518e-07, 'epochs': 88, 'loss': 'mse', 'optimizer': 'adam', 'graph_mode': 'off', 'use_snp_selection': False}. Best is trial 19 with value: 0.06757389302384245.
