[I 2025-12-05 21:24:25,720] Trial 9 finished with value: 0.19600724170355938 and parameters: {'model_type': 'mlp', 'hidden_dims': '[512, 64]', 'dropout': 0.14505336736221927, 'batch_norm': True, 'lr': 5.8619638388111826e-05, 'weight_decay': 6.200156172669308e-07, 'epochs': 175, 'loss': 'mse', 'optimizer': 'adam', 'graph_mode': 'off', 'use_snp_selection': False}. Best is trial 7 with value: 0.2060338907838885.
[I 2025-12-05 21:24:44,163] Trial 10 finished with value: 0.1233870611290809 and parameters: {'model_type': 'mlp', 'hidden_dims': '[512, 256]', 'dropout': 0.2736992815328032, 'batch_norm': False, 'lr': 0.00032393778075602147, 'weight_decay': 1.1511946696017092e-07, 'epochs': 41, 'loss': 'mse', 'optimizer': 'adam', 'graph_mode': 'off', 'use_snp_selection': False}. Best is trial 7 with value: 0.2060338907838885.
[I 2025-12-05 21:25:12,466] Trial 11 finished with value: 0.1865861093534067 and parameters: {'model_type': 'mlp', 'hidden_dims': '[512, 256]', 'dropout': 0.583942291816117, 'batch_norm': False, 'lr': 7.811409765921478e-06, 'weight_decay': 2.0596806983850726e-06, 'epochs': 77, 'loss': 'mae', 'optimizer': 'adam', 'graph_mode': 'off', 'use_snp_selection': False}. Best is trial 7 with value: 0.2060338907838885.
[I 2025-12-05 21:25:45,069] Trial 12 finished with value: 0.19452706489530633 and parameters: {'model_type': 'mlp', 'hidden_dims': '[512, 256]', 'dropout': 0.5873431926823272, 'batch_norm': False, 'lr': 1.3209655691727925e-05, 'weight_decay': 1.3081036432574914e-07, 'epochs': 93, 'loss': 'mae', 'optimizer': 'adam', 'graph_mode': 'off', 'use_snp_selection': False}. Best is trial 7 with value: 0.2060338907838885.
[I 2025-12-05 21:26:56,149] Trial 13 finished with value: 0.18788008162010966 and parameters: {'model_type': 'mlp', 'hidden_dims': '[512, 64]', 'dropout': 0.5038644356477802, 'batch_norm': False, 'lr': 1.4304506621636526e-05, 'weight_decay': 4.373608364627903e-05, 'epochs': 237, 'loss': 'mse', 'optimizer': 'adam', 'graph_mode': 'off', 'use_snp_selection': False}. Best is trial 7 with value: 0.2060338907838885.
[I 2025-12-05 21:27:10,159] Trial 14 finished with value: 0.19698686841085997 and parameters: {'model_type': 'mlp', 'hidden_dims': '[128, 64]', 'dropout': 0.3012984444538551, 'batch_norm': True, 'lr': 0.0001457690241539883, 'weight_decay': 3.0607358611649674e-06, 'epochs': 114, 'loss': 'mse', 'optimizer': 'adam', 'graph_mode': 'off', 'use_snp_selection': False}. Best is trial 7 with value: 0.2060338907838885.
[I 2025-12-05 21:27:46,466] Trial 15 finished with value: 0.19540488186966323 and parameters: {'model_type': 'mlp', 'hidden_dims': '[256, 128, 64]', 'dropout': 0.48263162073930665, 'batch_norm': False, 'lr': 2.2873500775644262e-05, 'weight_decay': 3.9169083908621594e-07, 'epochs': 216, 'loss': 'mae', 'optimizer': 'adam', 'graph_mode': 'off', 'use_snp_selection': False}. Best is trial 7 with value: 0.2060338907838885.
[I 2025-12-05 21:29:11,453] Trial 16 finished with value: 0.1703325343970573 and parameters: {'model_type': 'mlp', 'hidden_dims': '[512, 256]', 'dropout': 0.20597729258687042, 'batch_norm': True, 'lr': 6.013316929814413e-06, 'weight_decay': 5.098763140321504e-06, 'epochs': 283, 'loss': 'mse', 'optimizer': 'adam', 'graph_mode': 'off', 'use_snp_selection': False}. Best is trial 7 with value: 0.2060338907838885.
[I 2025-12-05 21:30:51,316] Trial 17 finished with value: 0.18188761305073092 and parameters: {'model_type': 'mlp', 'hidden_dims': '[512, 64]', 'dropout': 0.32888830259108426, 'batch_norm': False, 'lr': 0.000906375209920231, 'weight_decay': 4.279596648260934e-05, 'epochs': 349, 'loss': 'mae', 'optimizer': 'adam', 'graph_mode': 'off', 'use_snp_selection': False}. Best is trial 7 with value: 0.2060338907838885.
[I 2025-12-05 21:32:20,577] Trial 18 finished with value: 0.1872449071392235 and parameters: {'model_type': 'mlp', 'hidden_dims': '[512, 256]', 'dropout': 0.5139576333133464, 'batch_norm': False, 'lr': 2.797772152750264e-05, 'weight_decay': 3.5038679530849885e-07, 'epochs': 164, 'loss': 'mse', 'optimizer': 'adam', 'graph_mode': 'off', 'use_snp_selection': True, 'num_snps': 58241}. Best is trial 7 with value: 0.2060338907838885.
[I 2025-12-05 21:32:41,416] Trial 19 finished with value: 0.0998559025052355 and parameters: {'model_type': 'mlp', 'hidden_dims': '[512, 64]', 'dropout': 0.21972527923816063, 'batch_norm': True, 'lr': 3.502882181800776e-06, 'weight_decay': 0.00015299712892081902, 'epochs': 49, 'loss': 'mae', 'optimizer': 'adam', 'graph_mode': 'off', 'use_snp_selection': False}. Best is trial 7 with value: 0.2060338907838885.
[I 2025-12-05 21:33:20,843] Trial 20 finished with value: 0.19297362560084352 and parameters: {'model_type': 'mlp', 'hidden_dims': '[512, 128]', 'dropout': 0.3479554994523537, 'batch_norm': False, 'lr': 0.00014058530570495862, 'weight_decay': 5.6086896540041565e-06, 'epochs': 121, 'loss': 'mae', 'optimizer': 'adam', 'graph_mode': 'off', 'use_snp_selection': False}. Best is trial 7 with value: 0.2060338907838885.
[I 2025-12-05 21:34:01,934] Trial 21 finished with value: 0.20572550851194835 and parameters: {'model_type': 'mlp', 'hidden_dims': '[256, 128]', 'dropout': 0.44552738895131905, 'batch_norm': True, 'lr': 9.520584916307997e-05, 'weight_decay': 2.1381599681008143e-05, 'epochs': 247, 'loss': 'mae', 'optimizer': 'adam', 'graph_mode': 'off', 'use_snp_selection': False}. Best is trial 7 with value: 0.2060338907838885.
[I 2025-12-05 21:34:47,321] Trial 22 finished with value: 0.19873618996095394 and parameters: {'model_type': 'mlp', 'hidden_dims': '[256, 128]', 'dropout': 0.5447308805905808, 'batch_norm': True, 'lr': 9.869731699621108e-05, 'weight_decay': 2.234736040373779e-05, 'epochs': 276, 'loss': 'mae', 'optimizer': 'adam', 'graph_mode': 'off', 'use_snp_selection': False}. Best is trial 7 with value: 0.2060338907838885.
[I 2025-12-05 21:35:36,940] Trial 23 finished with value: 0.19761150274971168 and parameters: {'model_type': 'mlp', 'hidden_dims': '[256, 128]', 'dropout': 0.45700288156596985, 'batch_norm': True, 'lr': 3.746877337880461e-05, 'weight_decay': 8.900543690060752e-05, 'epochs': 306, 'loss': 'mae', 'optimizer': 'adam', 'graph_mode': 'off', 'use_snp_selection': False}. Best is trial 7 with value: 0.2060338907838885.
[I 2025-12-05 21:36:28,689] Trial 24 finished with value: 0.19365576633121734 and parameters: {'model_type': 'mlp', 'hidden_dims': '[256, 128]', 'dropout': 0.5413752887867185, 'batch_norm': True, 'lr': 0.0004055138799270616, 'weight_decay': 9.1951275336441e-06, 'epochs': 321, 'loss': 'mae', 'optimizer': 'adam', 'graph_mode': 'off', 'use_snp_selection': False}. Best is trial 7 with value: 0.2060338907838885.
[I 2025-12-05 21:37:10,386] Trial 25 finished with value: 0.17971429323327917 and parameters: {'model_type': 'mlp', 'hidden_dims': '[256, 128, 64]', 'dropout': 0.5986130442762192, 'batch_norm': True, 'lr': 1.680280835150185e-05, 'weight_decay': 1.0077734665942408e-06, 'epochs': 249, 'loss': 'mae', 'optimizer': 'adam', 'graph_mode': 'off', 'use_snp_selection': False}. Best is trial 7 with value: 0.2060338907838885.
[I 2025-12-05 21:37:42,511] Trial 26 finished with value: 0.17382950582542905 and parameters: {'model_type': 'mlp', 'hidden_dims': '[128, 64]', 'dropout': 0.44798271860978767, 'batch_norm': True, 'lr': 0.00010468432845632438, 'weight_decay': 1.3308829628507102e-05, 'epochs': 217, 'loss': 'mse', 'optimizer': 'adam', 'graph_mode': 'off', 'use_snp_selection': True, 'num_snps': 3842}. Best is trial 7 with value: 0.2060338907838885.
[I 2025-12-05 21:39:00,946] Trial 27 finished with value: 0.1983927309902155 and parameters: {'model_type': 'mlp', 'hidden_dims': '[512, 64]', 'dropout': 0.14201787846424646, 'batch_norm': True, 'lr': 0.0006452253741341223, 'weight_decay': 2.6086871179536294e-05, 'epochs': 261, 'loss': 'mae', 'optimizer': 'adam', 'graph_mode': 'off', 'use_snp_selection': False}. Best is trial 7 with value: 0.2060338907838885.
[I 2025-12-05 21:39:48,073] Trial 28 finished with value: 0.1855422256633628 and parameters: {'model_type': 'mlp', 'hidden_dims': '[256, 128]', 'dropout': 0.5446517125861265, 'batch_norm': False, 'lr': 0.00017831143260063374, 'weight_decay': 9.513924334678051e-05, 'epochs': 301, 'loss': 'mse', 'optimizer': 'adam', 'graph_mode': 'off', 'use_snp_selection': False}. Best is trial 7 with value: 0.2060338907838885.
[I 2025-12-05 21:40:27,906] Trial 29 finished with value: 0.13335507865821433 and parameters: {'model_type': 'mlp', 'hidden_dims': '[128, 64]', 'dropout': 0.37401580284062474, 'batch_norm': True, 'lr': 2.5087654566083747e-06, 'weight_decay': 6.186036610161667e-06, 'epochs': 188, 'loss': 'mae', 'optimizer': 'adam', 'graph_mode': 'off', 'use_snp_selection': True, 'num_snps': 19468}. Best is trial 7 with value: 0.2060338907838885.
[I 2025-12-05 21:42:04,549] Trial 30 finished with value: 0.1772712995440379 and parameters: {'model_type': 'mlp', 'hidden_dims': '[512, 256]', 'dropout': 0.2523135802350327, 'batch_norm': True, 'lr': 8.668888692922407e-06, 'weight_decay': 3.4447664747708866e-06, 'epochs': 327, 'loss': 'mae', 'optimizer': 'adam', 'graph_mode': 'off', 'use_snp_selection': False}. Best is trial 7 with value: 0.2060338907838885.
[I 2025-12-05 21:42:51,110] Trial 31 finished with value: 0.19526311674583588 and parameters: {'model_type': 'mlp', 'hidden_dims': '[256, 128]', 'dropout': 0.562950951404381, 'batch_norm': True, 'lr': 9.224406421576836e-05, 'weight_decay': 2.5778267021198683e-05, 'epochs': 284, 'loss': 'mae', 'optimizer': 'adam', 'graph_mode': 'off', 'use_snp_selection': False}. Best is trial 7 with value: 0.2060338907838885.
[I 2025-12-05 21:43:35,238] Trial 32 finished with value: 0.19314460588486435 and parameters: {'model_type': 'mlp', 'hidden_dims': '[256, 128]', 'dropout': 0.5035171433231763, 'batch_norm': True, 'lr': 7.309891311120923e-05, 'weight_decay': 2.5937815691909453e-05, 'epochs': 267, 'loss': 'mae', 'optimizer': 'adam', 'graph_mode': 'off', 'use_snp_selection': False}. Best is trial 7 with value: 0.2060338907838885.
[I 2025-12-05 21:44:14,626] Trial 33 finished with value: 0.20054797884612502 and parameters: {'model_type': 'mlp', 'hidden_dims': '[256, 128]', 'dropout': 0.42501486974563607, 'batch_norm': True, 'lr': 4.722470819982246e-05, 'weight_decay': 6.963411756056795e-05, 'epochs': 233, 'loss': 'mae', 'optimizer': 'adam', 'graph_mode': 'off', 'use_snp_selection': False}. Best is trial 7 with value: 0.2060338907838885.
[I 2025-12-05 21:44:51,852] Trial 34 finished with value: 0.19810476762527024 and parameters: {'model_type': 'mlp', 'hidden_dims': '[256, 128]', 'dropout': 0.4249533214041145, 'batch_norm': True, 'lr': 4.051677752876535e-05, 'weight_decay': 6.670121098189931e-05, 'epochs': 218, 'loss': 'mae', 'optimizer': 'adam', 'graph_mode': 'off', 'use_snp_selection': False}. Best is trial 7 with value: 0.2060338907838885.
[I 2025-12-05 21:46:10,460] Trial 35 finished with value: 0.20075618587680144 and parameters: {'model_type': 'mlp', 'hidden_dims': '[256, 128]', 'dropout': 0.47656250797170563, 'batch_norm': True, 'lr': 2.0463570704610496e-05, 'weight_decay': 0.00016009818144723697, 'epochs': 236, 'loss': 'mae', 'optimizer': 'adam', 'graph_mode': 'off', 'use_snp_selection': True, 'num_snps': 57586}. Best is trial 7 with value: 0.2060338907838885.
[I 2025-12-05 21:48:28,173] Trial 36 finished with value: 0.21044374189205542 and parameters: {'model_type': 'mlp', 'hidden_dims': '[512, 128]', 'dropout': 0.47544637034821163, 'batch_norm': True, 'lr': 2.161386104653954e-05, 'weight_decay': 0.00028202451505161363, 'epochs': 343, 'loss': 'mse', 'optimizer': 'adam', 'graph_mode': 'off', 'use_snp_selection': True, 'num_snps': 59835}. Best is trial 36 with value: 0.21044374189205542.
[I 2025-12-05 21:50:19,724] Trial 37 finished with value: 0.1942181284821581 and parameters: {'model_type': 'mlp', 'hidden_dims': '[512, 128]', 'dropout': 0.3967440405746906, 'batch_norm': True, 'lr': 1.000605855140007e-05, 'weight_decay': 0.0007299368343695225, 'epochs': 339, 'loss': 'mse', 'optimizer': 'adam', 'graph_mode': 'off', 'use_snp_selection': True, 'num_snps': 46050}. Best is trial 36 with value: 0.21044374189205542.
[I 2025-12-05 21:51:28,042] Trial 38 finished with value: 0.2082431718543507 and parameters: {'model_type': 'mlp', 'hidden_dims': '[512, 128]', 'dropout': 0.35050183614605157, 'batch_norm': False, 'lr': 4.062048861784486e-06, 'weight_decay': 0.00037300120650209556, 'epochs': 350, 'loss': 'mse', 'optimizer': 'adam', 'graph_mode': 'off', 'use_snp_selection': True, 'num_snps': 22300}. Best is trial 36 with value: 0.21044374189205542.
[I 2025-12-05 21:52:38,050] Trial 39 finished with value: 0.19830679417276692 and parameters: {'model_type': 'mlp', 'hidden_dims': '[512, 128]', 'dropout': 0.3230482045657812, 'batch_norm': False, 'lr': 1.2103727732165146e-06, 'weight_decay': 0.0006280872811967446, 'epochs': 350, 'loss': 'mse', 'optimizer': 'adam', 'graph_mode': 'off', 'use_snp_selection': True, 'num_snps': 22585}. Best is trial 36 with value: 0.21044374189205542.
[I 2025-12-05 21:53:30,323] Trial 40 finished with value: 0.17967407586014733 and parameters: {'model_type': 'mlp', 'hidden_dims': '[512, 128]', 'dropout': 0.36913109913654274, 'batch_norm': True, 'lr': 3.92450675509738e-06, 'weight_decay': 0.0003311458229582499, 'epochs': 149, 'loss': 'mse', 'optimizer': 'adam', 'graph_mode': 'off', 'use_snp_selection': True, 'num_snps': 23879}. Best is trial 36 with value: 0.21044374189205542.
[I 2025-12-05 21:55:15,941] Trial 41 finished with value: 0.19132710055885702 and parameters: {'model_type': 'mlp', 'hidden_dims': '[512, 128]', 'dropout': 0.2939382100587587, 'batch_norm': False, 'lr': 2.090170330533094e-06, 'weight_decay': 0.0004371947066425331, 'epochs': 303, 'loss': 'mse', 'optimizer': 'adam', 'graph_mode': 'off', 'use_snp_selection': True, 'num_snps': 47330}. Best is trial 36 with value: 0.21044374189205542.
[I 2025-12-05 21:56:11,329] Trial 42 finished with value: 0.2116719636914916 and parameters: {'model_type': 'mlp', 'hidden_dims': '[512, 128]', 'dropout': 0.16291737952585753, 'batch_norm': False, 'lr': 5.40286159030307e-06, 'weight_decay': 0.00014426091258253854, 'epochs': 332, 'loss': 'mse', 'optimizer': 'adam', 'graph_mode': 'off', 'use_snp_selection': True, 'num_snps': 15427}. Best is trial 42 with value: 0.2116719636914916.
[I 2025-12-05 21:57:04,958] Trial 43 finished with value: 0.2089465388394755 and parameters: {'model_type': 'mlp', 'hidden_dims': '[512, 128]', 'dropout': 0.16781522129828896, 'batch_norm': False, 'lr': 5.743336598059775e-06, 'weight_decay': 0.00016985088854796585, 'epochs': 330, 'loss': 'mse', 'optimizer': 'adam', 'graph_mode': 'off', 'use_snp_selection': True, 'num_snps': 14191}. Best is trial 42 with value: 0.2116719636914916.
[I 2025-12-05 21:57:55,989] Trial 44 finished with value: 0.2123899864190842 and parameters: {'model_type': 'mlp', 'hidden_dims': '[512, 128]', 'dropout': 0.16748525760757513, 'batch_norm': False, 'lr': 5.7866356133475056e-06, 'weight_decay': 0.00019956941022281492, 'epochs': 334, 'loss': 'mse', 'optimizer': 'adam', 'graph_mode': 'off', 'use_snp_selection': True, 'num_snps': 12486}. Best is trial 44 with value: 0.2123899864190842.
[I 2025-12-05 21:58:47,400] Trial 45 finished with value: 0.22042093462114573 and parameters: {'model_type': 'mlp', 'hidden_dims': '[512, 128]', 'dropout': 0.16922954312300453, 'batch_norm': False, 'lr': 5.503700536267817e-06, 'weight_decay': 0.0002495827377269251, 'epochs': 337, 'loss': 'mse', 'optimizer': 'adam', 'graph_mode': 'off', 'use_snp_selection': True, 'num_snps': 12733}. Best is trial 45 with value: 0.22042093462114573.
[I 2025-12-05 21:59:35,926] Trial 46 finished with value: 0.19688429051819695 and parameters: {'model_type': 'mlp', 'hidden_dims': '[512, 128]', 'dropout': 0.17186717381326871, 'batch_norm': False, 'lr': 6.306750612714882e-06, 'weight_decay': 0.0001979885053027805, 'epochs': 336, 'loss': 'mse', 'optimizer': 'adam', 'graph_mode': 'off', 'use_snp_selection': True, 'num_snps': 11370}. Best is trial 45 with value: 0.22042093462114573.
[I 2025-12-05 22:00:23,112] Trial 47 finished with value: 0.1994828343033997 and parameters: {'model_type': 'mlp', 'hidden_dims': '[512, 128]', 'dropout': 0.1080124419021056, 'batch_norm': False, 'lr': 3.0386670589633674e-06, 'weight_decay': 0.00023465253909358131, 'epochs': 295, 'loss': 'mse', 'optimizer': 'adam', 'graph_mode': 'off', 'use_snp_selection': True, 'num_snps': 11897}. Best is trial 45 with value: 0.22042093462114573.
[I 2025-12-05 22:01:00,238] Trial 48 finished with value: 0.1627478805046608 and parameters: {'model_type': 'mlp', 'hidden_dims': '[512, 128]', 'dropout': 0.17637108986787253, 'batch_norm': False, 'lr': 1.0744650586572161e-05, 'weight_decay': 0.0005401710192579082, 'epochs': 321, 'loss': 'mse', 'optimizer': 'adam', 'graph_mode': 'off', 'use_snp_selection': True, 'num_snps': 4514}. Best is trial 45 with value: 0.22042093462114573.
[I 2025-12-05 22:01:54,946] Trial 49 finished with value: 0.20689925988694577 and parameters: {'model_type': 'mlp', 'hidden_dims': '[512, 128]', 'dropout': 0.22270132138654714, 'batch_norm': False, 'lr': 4.9776369711778566e-06, 'weight_decay': 0.00012244086803163127, 'epochs': 334, 'loss': 'mse', 'optimizer': 'adam', 'graph_mode': 'off', 'use_snp_selection': True, 'num_snps': 15138}. Best is trial 45 with value: 0.22042093462114573.
[I 2025-12-05 22:02:49,921] Trial 50 finished with value: 0.20757839479943924 and parameters: {'model_type': 'mlp', 'hidden_dims': '[512, 128]', 'dropout': 0.12300578549488012, 'batch_norm': False, 'lr': 1.959055118705707e-06, 'weight_decay': 0.0008651408360164486, 'epochs': 312, 'loss': 'mse', 'optimizer': 'adam', 'graph_mode': 'off', 'use_snp_selection': True, 'num_snps': 15733}. Best is trial 45 with value: 0.22042093462114573.
[I 2025-12-05 22:03:51,904] Trial 51 finished with value: 0.21928802737908198 and parameters: {'model_type': 'mlp', 'hidden_dims': '[512, 128]', 'dropout': 0.1725987648165251, 'batch_norm': False, 'lr': 4.845391743230039e-06, 'weight_decay': 0.00040181188978138043, 'epochs': 348, 'loss': 'mse', 'optimizer': 'adam', 'graph_mode': 'off', 'use_snp_selection': True, 'num_snps': 18944}. Best is trial 45 with value: 0.22042093462114573.
[I 2025-12-05 22:04:35,196] Trial 52 finished with value: 0.1920116388183347 and parameters: {'model_type': 'mlp', 'hidden_dims': '[512, 128]', 'dropout': 0.1847915412671458, 'batch_norm': False, 'lr': 6.914504919999375e-06, 'weight_decay': 0.0002619541311118121, 'epochs': 334, 'loss': 'mse', 'optimizer': 'adam', 'graph_mode': 'off', 'use_snp_selection': True, 'num_snps': 7907}. Best is trial 45 with value: 0.22042093462114573.
[I 2025-12-05 22:05:31,202] Trial 53 finished with value: 0.20967099197698086 and parameters: {'model_type': 'mlp', 'hidden_dims': '[512, 128]', 'dropout': 0.1590631688172132, 'batch_norm': False, 'lr': 4.831391895588935e-06, 'weight_decay': 0.0009793059788888035, 'epochs': 318, 'loss': 'mse', 'optimizer': 'adam', 'graph_mode': 'off', 'use_snp_selection': True, 'num_snps': 16232}. Best is trial 45 with value: 0.22042093462114573.
[I 2025-12-05 22:06:28,917] Trial 54 finished with value: 0.2161898006289486 and parameters: {'model_type': 'mlp', 'hidden_dims': '[512, 128]', 'dropout': 0.20145580857472264, 'batch_norm': False, 'lr': 1.124834428159764e-05, 'weight_decay': 0.0004977686673785124, 'epochs': 292, 'loss': 'mse', 'optimizer': 'adam', 'graph_mode': 'off', 'use_snp_selection': True, 'num_snps': 18740}. Best is trial 45 with value: 0.22042093462114573.
[I 2025-12-05 22:07:39,252] Trial 55 finished with value: 0.21507695941164603 and parameters: {'model_type': 'mlp', 'hidden_dims': '[512, 128]', 'dropout': 0.24612121144366783, 'batch_norm': False, 'lr': 1.234746620307276e-05, 'weight_decay': 0.0003824447950263934, 'epochs': 290, 'loss': 'mse', 'optimizer': 'adam', 'graph_mode': 'off', 'use_snp_selection': True, 'num_snps': 26486}. Best is trial 45 with value: 0.22042093462114573.
[I 2025-12-05 22:08:50,596] Trial 56 finished with value: 0.20298139318664826 and parameters: {'model_type': 'mlp', 'hidden_dims': '[512, 128]', 'dropout': 0.23866203756994783, 'batch_norm': False, 'lr': 1.1095347930921332e-05, 'weight_decay': 0.0004902681754666916, 'epochs': 297, 'loss': 'mse', 'optimizer': 'adam', 'graph_mode': 'off', 'use_snp_selection': True, 'num_snps': 27480}. Best is trial 45 with value: 0.22042093462114573.
[I 2025-12-05 22:09:37,790] Trial 57 finished with value: 0.21766686123852114 and parameters: {'model_type': 'mlp', 'hidden_dims': '[256, 128, 64]', 'dropout': 0.201862158755453, 'batch_norm': False, 'lr': 1.4819795192155289e-05, 'weight_decay': 0.00010572511777279955, 'epochs': 281, 'loss': 'mse', 'optimizer': 'adam', 'graph_mode': 'off', 'use_snp_selection': True, 'num_snps': 18791}. Best is trial 45 with value: 0.22042093462114573.
[I 2025-12-05 22:10:26,433] Trial 58 finished with value: 0.21158197646990518 and parameters: {'model_type': 'mlp', 'hidden_dims': '[256, 128, 64]', 'dropout': 0.1942476392956617, 'batch_norm': False, 'lr': 1.4365527181156163e-05, 'weight_decay': 4.0130073097938113e-05, 'epochs': 291, 'loss': 'mse', 'optimizer': 'adam', 'graph_mode': 'off', 'use_snp_selection': True, 'num_snps': 20021}. Best is trial 45 with value: 0.22042093462114573.
[I 2025-12-05 22:11:19,798] Trial 59 finished with value: 0.21904226820592987 and parameters: {'model_type': 'mlp', 'hidden_dims': '[256, 128, 64]', 'dropout': 0.2266763267350972, 'batch_norm': False, 'lr': 2.8076934479770522e-05, 'weight_decay': 0.00036194230029657046, 'epochs': 260, 'loss': 'mse', 'optimizer': 'adam', 'graph_mode': 'off', 'use_snp_selection': True, 'num_snps': 27244}. Best is trial 45 with value: 0.22042093462114573.
