[I 2025-12-05 15:32:25,669] Trial 114 finished with value: 0.11317567449688531 and parameters: {'model_type': 'mlp', 'hidden_dims': '[256, 128, 64]', 'dropout': 0.21751388229503008, 'batch_norm': True, 'lr': 0.0005697980094500906, 'weight_decay': 5.335314232244195e-06, 'epochs': 121, 'loss': 'mae', 'optimizer': 'adam', 'graph_mode': 'off', 'use_snp_selection': False}. Best is trial 50 with value: 0.13183701202040027.
[I 2025-12-05 15:32:26,684] Trial 115 finished with value: 0.10093880901279079 and parameters: {'model_type': 'mlp', 'hidden_dims': '[256, 128, 64]', 'dropout': 0.17585728762014552, 'batch_norm': True, 'lr': 0.0003629700411152018, 'weight_decay': 1.186860895888767e-06, 'epochs': 140, 'loss': 'mae', 'optimizer': 'adam', 'graph_mode': 'off', 'use_snp_selection': False}. Best is trial 50 with value: 0.13183701202040027.
[I 2025-12-05 15:32:27,612] Trial 116 finished with value: 0.10598164840455304 and parameters: {'model_type': 'mlp', 'hidden_dims': '[256, 128, 64]', 'dropout': 0.25360428322741974, 'batch_norm': True, 'lr': 0.0009829826446028436, 'weight_decay': 8.719613102736297e-06, 'epochs': 97, 'loss': 'mae', 'optimizer': 'adam', 'graph_mode': 'off', 'use_snp_selection': False}. Best is trial 50 with value: 0.13183701202040027.
[I 2025-12-05 15:32:28,722] Trial 117 finished with value: 0.11263546421444201 and parameters: {'model_type': 'mlp', 'hidden_dims': '[256, 128, 64]', 'dropout': 0.2003996085765002, 'batch_norm': True, 'lr': 0.0007084325700631172, 'weight_decay': 2.4107641569072308e-05, 'epochs': 153, 'loss': 'mae', 'optimizer': 'adam', 'graph_mode': 'off', 'use_snp_selection': False}. Best is trial 50 with value: 0.13183701202040027.
[I 2025-12-05 15:32:29,686] Trial 118 finished with value: 0.10005943400189893 and parameters: {'model_type': 'mlp', 'hidden_dims': '[256, 128, 64]', 'dropout': 0.2327495489882742, 'batch_norm': True, 'lr': 0.00047805717672941045, 'weight_decay': 3.3149104775789458e-06, 'epochs': 109, 'loss': 'mae', 'optimizer': 'adam', 'graph_mode': 'off', 'use_snp_selection': False}. Best is trial 50 with value: 0.13183701202040027.
[I 2025-12-05 15:32:31,381] Trial 119 finished with value: 0.10124652087909708 and parameters: {'model_type': 'mlp', 'hidden_dims': '[512, 256]', 'dropout': 0.2956114996324906, 'batch_norm': True, 'lr': 0.00042842615344192955, 'weight_decay': 6.265987726570887e-06, 'epochs': 162, 'loss': 'mae', 'optimizer': 'adam', 'graph_mode': 'off', 'use_snp_selection': False}. Best is trial 50 with value: 0.13183701202040027.
[I 2025-12-05 15:32:33,132] Trial 120 finished with value: 0.11485153019403106 and parameters: {'model_type': 'mlp', 'hidden_dims': '[512, 128]', 'dropout': 0.22318604454556876, 'batch_norm': True, 'lr': 0.0007820664028105963, 'weight_decay': 4.635195420209864e-06, 'epochs': 176, 'loss': 'mae', 'optimizer': 'adam', 'graph_mode': 'off', 'use_snp_selection': False}. Best is trial 50 with value: 0.13183701202040027.
[I 2025-12-05 15:32:34,127] Trial 121 finished with value: 0.1065895386665359 and parameters: {'model_type': 'mlp', 'hidden_dims': '[256, 128]', 'dropout': 0.16279072315399465, 'batch_norm': False, 'lr': 4.612927980336347e-05, 'weight_decay': 7.651053361210953e-06, 'epochs': 142, 'loss': 'mae', 'optimizer': 'adam', 'graph_mode': 'off', 'use_snp_selection': False}. Best is trial 50 with value: 0.13183701202040027.
[I 2025-12-05 15:32:35,101] Trial 122 finished with value: 0.11877150851109411 and parameters: {'model_type': 'mlp', 'hidden_dims': '[256, 128]', 'dropout': 0.18877951472874474, 'batch_norm': True, 'lr': 0.0005847596994609005, 'weight_decay': 1.551493727774113e-05, 'epochs': 130, 'loss': 'mae', 'optimizer': 'adam', 'graph_mode': 'off', 'use_snp_selection': False}. Best is trial 50 with value: 0.13183701202040027.
[I 2025-12-05 15:32:36,082] Trial 123 finished with value: 0.12303218351097617 and parameters: {'model_type': 'mlp', 'hidden_dims': '[256, 128, 64]', 'dropout': 0.18506246588551514, 'batch_norm': True, 'lr': 0.0006116580100354559, 'weight_decay': 1.0373340938735479e-05, 'epochs': 129, 'loss': 'mae', 'optimizer': 'adam', 'graph_mode': 'off', 'use_snp_selection': False}. Best is trial 50 with value: 0.13183701202040027.
[I 2025-12-05 15:32:36,832] Trial 124 finished with value: 0.10550084335815112 and parameters: {'model_type': 'mlp', 'hidden_dims': '[128, 64]', 'dropout': 0.19205491860849322, 'batch_norm': True, 'lr': 0.0005524002514159933, 'weight_decay': 1.5350004162831647e-05, 'epochs': 133, 'loss': 'mae', 'optimizer': 'adam', 'graph_mode': 'off', 'use_snp_selection': False}. Best is trial 50 with value: 0.13183701202040027.
[I 2025-12-05 15:32:37,682] Trial 125 finished with value: 0.09977530744010989 and parameters: {'model_type': 'mlp', 'hidden_dims': '[256, 128]', 'dropout': 0.1826546066353685, 'batch_norm': True, 'lr': 0.00033533465354605176, 'weight_decay': 1.170227354877768e-05, 'epochs': 89, 'loss': 'mae', 'optimizer': 'adam', 'graph_mode': 'off', 'use_snp_selection': False}. Best is trial 50 with value: 0.13183701202040027.
[I 2025-12-05 15:32:38,672] Trial 126 finished with value: 0.11540947217268581 and parameters: {'model_type': 'mlp', 'hidden_dims': '[256, 128, 64]', 'dropout': 0.20669287141432097, 'batch_norm': True, 'lr': 0.0005618119144927494, 'weight_decay': 1.7444360536451115e-05, 'epochs': 116, 'loss': 'mse', 'optimizer': 'adam', 'graph_mode': 'off', 'use_snp_selection': False}. Best is trial 50 with value: 0.13183701202040027.
[I 2025-12-05 15:32:39,631] Trial 127 finished with value: 0.10476319151579151 and parameters: {'model_type': 'mlp', 'hidden_dims': '[256, 128, 64]', 'dropout': 0.17130221341045554, 'batch_norm': True, 'lr': 0.00040053096776132845, 'weight_decay': 9.0351204085383e-06, 'epochs': 103, 'loss': 'mae', 'optimizer': 'adam', 'graph_mode': 'off', 'use_snp_selection': False}. Best is trial 50 with value: 0.13183701202040027.
[I 2025-12-05 15:32:40,757] Trial 128 finished with value: 0.09167804164489338 and parameters: {'model_type': 'mlp', 'hidden_dims': '[512, 256]', 'dropout': 0.14638728627739847, 'batch_norm': True, 'lr': 0.0008613677084399569, 'weight_decay': 2.4682879077555465e-05, 'epochs': 65, 'loss': 'mae', 'optimizer': 'adam', 'graph_mode': 'off', 'use_snp_selection': False}. Best is trial 50 with value: 0.13183701202040027.
[I 2025-12-05 15:32:41,823] Trial 129 finished with value: 0.10268917136524622 and parameters: {'model_type': 'mlp', 'hidden_dims': '[256, 128, 64]', 'dropout': 0.12561679298130193, 'batch_norm': True, 'lr': 0.0002855835128012931, 'weight_decay': 1.0241194613918096e-05, 'epochs': 146, 'loss': 'mae', 'optimizer': 'adam', 'graph_mode': 'off', 'use_snp_selection': False}. Best is trial 50 with value: 0.13183701202040027.
[I 2025-12-05 15:32:43,251] Trial 130 finished with value: 0.0705910046747607 and parameters: {'model_type': 'mlp', 'hidden_dims': '[512, 64]', 'dropout': 0.18805930780929841, 'batch_norm': True, 'lr': 6.252967248321517e-06, 'weight_decay': 6.348630812219375e-06, 'epochs': 122, 'loss': 'mae', 'optimizer': 'adam', 'graph_mode': 'off', 'use_snp_selection': False}. Best is trial 50 with value: 0.13183701202040027.
[I 2025-12-05 15:32:44,249] Trial 131 finished with value: 0.12318250165032588 and parameters: {'model_type': 'mlp', 'hidden_dims': '[256, 128, 64]', 'dropout': 0.20989697626011827, 'batch_norm': True, 'lr': 0.000633878525761773, 'weight_decay': 3.6141606716149123e-06, 'epochs': 132, 'loss': 'mae', 'optimizer': 'adam', 'graph_mode': 'off', 'use_snp_selection': False}. Best is trial 50 with value: 0.13183701202040027.
[I 2025-12-05 15:32:45,262] Trial 132 finished with value: 0.1168007419007172 and parameters: {'model_type': 'mlp', 'hidden_dims': '[256, 128, 64]', 'dropout': 0.20632651399964164, 'batch_norm': True, 'lr': 0.000623698913437835, 'weight_decay': 2.9617325841035447e-06, 'epochs': 139, 'loss': 'mae', 'optimizer': 'adam', 'graph_mode': 'off', 'use_snp_selection': False}. Best is trial 50 with value: 0.13183701202040027.
[I 2025-12-05 15:32:46,195] Trial 133 finished with value: 0.11500755723903294 and parameters: {'model_type': 'mlp', 'hidden_dims': '[256, 128, 64]', 'dropout': 0.19692986334335993, 'batch_norm': True, 'lr': 0.0007536093742715049, 'weight_decay': 3.959013109777423e-06, 'epochs': 113, 'loss': 'mae', 'optimizer': 'adam', 'graph_mode': 'off', 'use_snp_selection': False}. Best is trial 50 with value: 0.13183701202040027.
[I 2025-12-05 15:32:47,019] Trial 134 finished with value: 0.11273149342578805 and parameters: {'model_type': 'mlp', 'hidden_dims': '[256, 128, 64]', 'dropout': 0.21472656496146086, 'batch_norm': True, 'lr': 0.000489746211870343, 'weight_decay': 2.2482762829914778e-06, 'epochs': 78, 'loss': 'mae', 'optimizer': 'adam', 'graph_mode': 'off', 'use_snp_selection': False}. Best is trial 50 with value: 0.13183701202040027.
[I 2025-12-05 15:32:47,988] Trial 135 finished with value: 0.03347245105504661 and parameters: {'model_type': 'mlp', 'hidden_dims': '[256, 128]', 'dropout': 0.17877838322532402, 'batch_norm': True, 'lr': 2.351998976930798e-06, 'weight_decay': 1.2685589699219837e-05, 'epochs': 128, 'loss': 'mae', 'optimizer': 'adam', 'graph_mode': 'off', 'use_snp_selection': False}. Best is trial 50 with value: 0.13183701202040027.
[I 2025-12-05 15:32:49,546] Trial 136 finished with value: 0.128550428089795 and parameters: {'model_type': 'mlp', 'hidden_dims': '[512, 128]', 'dropout': 0.13621763373823734, 'batch_norm': True, 'lr': 0.0006091044593672069, 'weight_decay': 3.6706783102677308e-06, 'epochs': 137, 'loss': 'mae', 'optimizer': 'adam', 'graph_mode': 'off', 'use_snp_selection': False}. Best is trial 50 with value: 0.13183701202040027.
[I 2025-12-05 15:32:51,192] Trial 137 finished with value: 0.10798828292027489 and parameters: {'model_type': 'mlp', 'hidden_dims': '[512, 128]', 'dropout': 0.13315285102207328, 'batch_norm': True, 'lr': 0.0006252303071158591, 'weight_decay': 5.565956987805569e-06, 'epochs': 152, 'loss': 'mae', 'optimizer': 'adam', 'graph_mode': 'off', 'use_snp_selection': False}. Best is trial 50 with value: 0.13183701202040027.
[I 2025-12-05 15:32:52,723] Trial 138 finished with value: 0.1045087508094481 and parameters: {'model_type': 'mlp', 'hidden_dims': '[512, 128]', 'dropout': 0.15689554613130152, 'batch_norm': True, 'lr': 0.000377558249473121, 'weight_decay': 7.5742718536355e-06, 'epochs': 135, 'loss': 'mae', 'optimizer': 'adam', 'graph_mode': 'off', 'use_snp_selection': False}. Best is trial 50 with value: 0.13183701202040027.
[I 2025-12-05 15:32:54,890] Trial 139 finished with value: 0.11546862039633278 and parameters: {'model_type': 'mlp', 'hidden_dims': '[512, 128]', 'dropout': 0.17006734416460012, 'batch_norm': True, 'lr': 0.0008314915535829119, 'weight_decay': 3.6884051511767595e-06, 'epochs': 246, 'loss': 'mae', 'optimizer': 'adam', 'graph_mode': 'off', 'use_snp_selection': False}. Best is trial 50 with value: 0.13183701202040027.
[I 2025-12-05 15:32:56,522] Trial 140 finished with value: 0.11328168813472707 and parameters: {'model_type': 'mlp', 'hidden_dims': '[512, 128]', 'dropout': 0.1122156032912627, 'batch_norm': True, 'lr': 0.0004383460631677086, 'weight_decay': 2.690431926003028e-06, 'epochs': 157, 'loss': 'mae', 'optimizer': 'adam', 'graph_mode': 'off', 'use_snp_selection': False}. Best is trial 50 with value: 0.13183701202040027.
[I 2025-12-05 15:32:57,266] Trial 141 finished with value: 0.1359282721019889 and parameters: {'model_type': 'mlp', 'hidden_dims': '[256, 128, 64]', 'dropout': 0.13906350565802494, 'batch_norm': True, 'lr': 0.0005441740509441334, 'weight_decay': 3.2193435449238065e-06, 'epochs': 52, 'loss': 'mae', 'optimizer': 'adam', 'graph_mode': 'off', 'use_snp_selection': False}. Best is trial 141 with value: 0.1359282721019889.
[I 2025-12-05 15:32:58,018] Trial 142 finished with value: 0.13398510557402687 and parameters: {'model_type': 'mlp', 'hidden_dims': '[256, 128, 64]', 'dropout': 0.14166865237654203, 'batch_norm': True, 'lr': 0.0009884074574137128, 'weight_decay': 2.054876410642166e-06, 'epochs': 54, 'loss': 'mae', 'optimizer': 'adam', 'graph_mode': 'off', 'use_snp_selection': False}. Best is trial 141 with value: 0.1359282721019889.
[I 2025-12-05 15:32:58,774] Trial 143 finished with value: 0.09330653120098019 and parameters: {'model_type': 'mlp', 'hidden_dims': '[256, 128, 64]', 'dropout': 0.14132059637808367, 'batch_norm': True, 'lr': 0.0009712450117044033, 'weight_decay': 1.6186744172979692e-06, 'epochs': 53, 'loss': 'mae', 'optimizer': 'adam', 'graph_mode': 'off', 'use_snp_selection': False}. Best is trial 141 with value: 0.1359282721019889.
[I 2025-12-05 15:32:59,759] Trial 144 finished with value: 0.10717356104448353 and parameters: {'model_type': 'mlp', 'hidden_dims': '[512, 128]', 'dropout': 0.40314085623309853, 'batch_norm': True, 'lr': 0.0005548878536280804, 'weight_decay': 2.0331608387866114e-06, 'epochs': 40, 'loss': 'mae', 'optimizer': 'adam', 'graph_mode': 'off', 'use_snp_selection': False}. Best is trial 141 with value: 0.1359282721019889.
[I 2025-12-05 15:33:00,560] Trial 145 finished with value: 0.10435483476538226 and parameters: {'model_type': 'mlp', 'hidden_dims': '[256, 128, 64]', 'dropout': 0.15102846120410754, 'batch_norm': True, 'lr': 0.0007755555378913682, 'weight_decay': 4.071890650397639e-06, 'epochs': 54, 'loss': 'mae', 'optimizer': 'adam', 'graph_mode': 'off', 'use_snp_selection': False}. Best is trial 141 with value: 0.1359282721019889.
[I 2025-12-05 15:33:01,362] Trial 146 finished with value: 0.10707527926449566 and parameters: {'model_type': 'mlp', 'hidden_dims': '[256, 128]', 'dropout': 0.11907274209959412, 'batch_norm': True, 'lr': 0.0002540296525819977, 'weight_decay': 1.069255074144542e-05, 'epochs': 61, 'loss': 'mae', 'optimizer': 'adam', 'graph_mode': 'off', 'use_snp_selection': False}. Best is trial 141 with value: 0.1359282721019889.
[I 2025-12-05 15:33:02,201] Trial 147 finished with value: 0.0864539764960588 and parameters: {'model_type': 'mlp', 'hidden_dims': '[256, 128, 64]', 'dropout': 0.1331338903596355, 'batch_norm': True, 'lr': 0.0006355715369648818, 'weight_decay': 5.326817132116336e-06, 'epochs': 69, 'loss': 'mae', 'optimizer': 'adam', 'graph_mode': 'off', 'use_snp_selection': False}. Best is trial 141 with value: 0.1359282721019889.
[I 2025-12-05 15:33:03,184] Trial 148 finished with value: 0.10592498283204209 and parameters: {'model_type': 'mlp', 'hidden_dims': '[512, 256]', 'dropout': 0.13903324763492977, 'batch_norm': True, 'lr': 0.0005086418447141346, 'weight_decay': 2.379484460229427e-06, 'epochs': 46, 'loss': 'mse', 'optimizer': 'adam', 'graph_mode': 'off', 'use_snp_selection': False}. Best is trial 141 with value: 0.1359282721019889.
[I 2025-12-05 15:33:03,944] Trial 149 finished with value: 0.08270110666349402 and parameters: {'model_type': 'mlp', 'hidden_dims': '[256, 128, 64]', 'dropout': 0.16098337773497332, 'batch_norm': True, 'lr': 0.00087434935641169, 'weight_decay': 1.4130917244777104e-06, 'epochs': 55, 'loss': 'mae', 'optimizer': 'adam', 'graph_mode': 'off', 'use_snp_selection': False}. Best is trial 141 with value: 0.1359282721019889.
[I 2025-12-05 15:33:06,299] Trial 0 finished with value: -0.01957156464446458 and parameters: {'model_type': 'mlp', 'hidden_dims': '[128, 64]', 'dropout': 0.199031432379812, 'batch_norm': True, 'lr': 1.8408544111075837e-06, 'weight_decay': 5.5136510071208614e-05, 'epochs': 336, 'loss': 'mae', 'optimizer': 'adam', 'graph_mode': 'off', 'use_snp_selection': True, 'num_snps': 43862}. Best is trial 0 with value: -0.01957156464446458.
[I 2025-12-05 15:33:07,510] Trial 1 finished with value: -0.0025614085755485375 and parameters: {'model_type': 'mlp', 'hidden_dims': '[256, 128]', 'dropout': 0.4370668075331726, 'batch_norm': True, 'lr': 7.133471581159139e-05, 'weight_decay': 1.128633586803549e-05, 'epochs': 242, 'loss': 'mae', 'optimizer': 'adam', 'graph_mode': 'off', 'use_snp_selection': False}. Best is trial 1 with value: -0.0025614085755485375.
[I 2025-12-05 15:33:08,709] Trial 2 finished with value: 0.008246679444345522 and parameters: {'model_type': 'mlp', 'hidden_dims': '[256, 128, 64]', 'dropout': 0.41314357415569625, 'batch_norm': False, 'lr': 3.952233718592101e-06, 'weight_decay': 0.00026754769258252603, 'epochs': 149, 'loss': 'mse', 'optimizer': 'adam', 'graph_mode': 'off', 'use_snp_selection': True, 'num_snps': 11571}. Best is trial 2 with value: 0.008246679444345522.
[I 2025-12-05 15:33:10,922] Trial 3 finished with value: 0.012319814620721577 and parameters: {'model_type': 'mlp', 'hidden_dims': '[512, 64]', 'dropout': 0.5938127374509361, 'batch_norm': False, 'lr': 5.67704586114731e-06, 'weight_decay': 2.4518087630137052e-05, 'epochs': 320, 'loss': 'mae', 'optimizer': 'adam', 'graph_mode': 'off', 'use_snp_selection': False}. Best is trial 3 with value: 0.012319814620721577.
[I 2025-12-05 15:33:13,415] Trial 4 finished with value: 0.006723010740680672 and parameters: {'model_type': 'mlp', 'hidden_dims': '[512, 128]', 'dropout': 0.25746343592134413, 'batch_norm': True, 'lr': 1.3467657668402788e-06, 'weight_decay': 0.00033087251918647806, 'epochs': 277, 'loss': 'mse', 'optimizer': 'adam', 'graph_mode': 'off', 'use_snp_selection': True, 'num_snps': 36675}. Best is trial 3 with value: 0.012319814620721577.
[I 2025-12-05 15:33:15,325] Trial 5 finished with value: 0.0030393516721830775 and parameters: {'model_type': 'mlp', 'hidden_dims': '[512, 64]', 'dropout': 0.38275350994408375, 'batch_norm': True, 'lr': 1.5586664309232824e-06, 'weight_decay': 0.0008227664668621182, 'epochs': 145, 'loss': 'mae', 'optimizer': 'adam', 'graph_mode': 'off', 'use_snp_selection': True, 'num_snps': 32148}. Best is trial 3 with value: 0.012319814620721577.
[I 2025-12-05 15:33:16,402] Trial 6 finished with value: -0.006763616943714696 and parameters: {'model_type': 'mlp', 'hidden_dims': '[256, 128]', 'dropout': 0.3930109900265879, 'batch_norm': False, 'lr': 4.892964372128395e-05, 'weight_decay': 1.5809549317992182e-06, 'epochs': 199, 'loss': 'mse', 'optimizer': 'adam', 'graph_mode': 'off', 'use_snp_selection': False}. Best is trial 3 with value: 0.012319814620721577.
[I 2025-12-05 15:33:17,553] Trial 7 finished with value: 0.009058715093990331 and parameters: {'model_type': 'mlp', 'hidden_dims': '[512, 256]', 'dropout': 0.15343979219678458, 'batch_norm': True, 'lr': 6.234003099047341e-05, 'weight_decay': 3.894760610535477e-07, 'epochs': 97, 'loss': 'mse', 'optimizer': 'adam', 'graph_mode': 'off', 'use_snp_selection': False}. Best is trial 3 with value: 0.012319814620721577.
[I 2025-12-05 15:33:19,771] Trial 8 finished with value: -0.008907021108688983 and parameters: {'model_type': 'mlp', 'hidden_dims': '[512, 128]', 'dropout': 0.10743001231661406, 'batch_norm': True, 'lr': 0.00023728538449271062, 'weight_decay': 1.7629071578048637e-05, 'epochs': 312, 'loss': 'mae', 'optimizer': 'adam', 'graph_mode': 'off', 'use_snp_selection': False}. Best is trial 3 with value: 0.012319814620721577.
[I 2025-12-05 15:33:21,318] Trial 9 finished with value: 0.012022638552006644 and parameters: {'model_type': 'mlp', 'hidden_dims': '[512, 64]', 'dropout': 0.14505336736221927, 'batch_norm': True, 'lr': 5.8619638388111826e-05, 'weight_decay': 6.200156172669308e-07, 'epochs': 175, 'loss': 'mse', 'optimizer': 'adam', 'graph_mode': 'off', 'use_snp_selection': False}. Best is trial 3 with value: 0.012319814620721577.
[I 2025-12-05 15:33:22,297] Trial 10 finished with value: 0.026692469015349163 and parameters: {'model_type': 'mlp', 'hidden_dims': '[512, 64]', 'dropout': 0.5885461262002587, 'batch_norm': False, 'lr': 8.769366258768696e-06, 'weight_decay': 2.78273193871783e-06, 'epochs': 55, 'loss': 'mae', 'optimizer': 'adam', 'graph_mode': 'off', 'use_snp_selection': False}. Best is trial 10 with value: 0.026692469015349163.
[I 2025-12-05 15:33:23,351] Trial 11 finished with value: 0.00815926181504366 and parameters: {'model_type': 'mlp', 'hidden_dims': '[512, 64]', 'dropout': 0.583942291816117, 'batch_norm': False, 'lr': 1.1821335968986158e-05, 'weight_decay': 4.061640528568547e-06, 'epochs': 77, 'loss': 'mae', 'optimizer': 'adam', 'graph_mode': 'off', 'use_snp_selection': False}. Best is trial 10 with value: 0.026692469015349163.
[I 2025-12-05 15:33:24,228] Trial 12 finished with value: 0.018137420471243844 and parameters: {'model_type': 'mlp', 'hidden_dims': '[512, 64]', 'dropout': 0.593097749012682, 'batch_norm': False, 'lr': 9.73724436814812e-06, 'weight_decay': 1.3081036432574914e-07, 'epochs': 40, 'loss': 'mae', 'optimizer': 'adam', 'graph_mode': 'off', 'use_snp_selection': False}. Best is trial 10 with value: 0.026692469015349163.
[I 2025-12-05 15:33:25,158] Trial 13 finished with value: 0.0011371678679118148 and parameters: {'model_type': 'mlp', 'hidden_dims': '[512, 64]', 'dropout': 0.48866185656206085, 'batch_norm': False, 'lr': 1.5004807436150273e-05, 'weight_decay': 1.0653385841198209e-07, 'epochs': 51, 'loss': 'mae', 'optimizer': 'adam', 'graph_mode': 'off', 'use_snp_selection': False}. Best is trial 10 with value: 0.026692469015349163.
[I 2025-12-05 15:33:25,740] Trial 14 finished with value: -0.005124404060868686 and parameters: {'model_type': 'mlp', 'hidden_dims': '[128, 64]', 'dropout': 0.5300180653494536, 'batch_norm': False, 'lr': 1.8357807037936876e-05, 'weight_decay': 1.0618560999107239e-07, 'epochs': 41, 'loss': 'mae', 'optimizer': 'adam', 'graph_mode': 'off', 'use_snp_selection': False}. Best is trial 10 with value: 0.026692469015349163.
[I 2025-12-05 15:33:26,933] Trial 15 finished with value: -0.02029689582034721 and parameters: {'model_type': 'mlp', 'hidden_dims': '[512, 256]', 'dropout': 0.2993347554530098, 'batch_norm': False, 'lr': 5.210440963099114e-06, 'weight_decay': 3.2517653863687634e-06, 'epochs': 106, 'loss': 'mae', 'optimizer': 'adam', 'graph_mode': 'off', 'use_snp_selection': False}. Best is trial 10 with value: 0.026692469015349163.
