[I 2025-12-06 04:00:00,311] Trial 32 finished with value: 0.3108495661920222 and parameters: {'model_type': 'mlp', 'hidden_dims': '[512, 128]', 'dropout': 0.5354039250643781, 'batch_norm': True, 'lr': 4.7451442443380825e-05, 'weight_decay': 4.214110580336414e-07, 'epochs': 136, 'loss': 'mae', 'optimizer': 'adam', 'graph_mode': 'off', 'use_snp_selection': False}. Best is trial 30 with value: 0.3140119736694639.
[I 2025-12-06 04:01:06,779] Trial 33 finished with value: 0.30670353399051586 and parameters: {'model_type': 'mlp', 'hidden_dims': '[512, 128]', 'dropout': 0.5341520902094788, 'batch_norm': True, 'lr': 8.90040628103512e-05, 'weight_decay': 2.0702214992534432e-07, 'epochs': 349, 'loss': 'mae', 'optimizer': 'adam', 'graph_mode': 'off', 'use_snp_selection': False}. Best is trial 30 with value: 0.3140119736694639.
[I 2025-12-06 04:01:26,568] Trial 34 finished with value: 0.3097836822323433 and parameters: {'model_type': 'mlp', 'hidden_dims': '[256, 128]', 'dropout': 0.44240244646765664, 'batch_norm': True, 'lr': 0.0002797498279012633, 'weight_decay': 2.861192595754324e-06, 'epochs': 164, 'loss': 'mae', 'optimizer': 'adam', 'graph_mode': 'off', 'use_snp_selection': False}. Best is trial 30 with value: 0.3140119736694639.
[I 2025-12-06 04:01:54,353] Trial 35 finished with value: 0.29956840895853926 and parameters: {'model_type': 'mlp', 'hidden_dims': '[512, 128]', 'dropout': 0.5969793460300727, 'batch_norm': False, 'lr': 0.00016482207678960008, 'weight_decay': 1.1713448588744846e-06, 'epochs': 130, 'loss': 'mae', 'optimizer': 'adam', 'graph_mode': 'off', 'use_snp_selection': False}. Best is trial 30 with value: 0.3140119736694639.
[I 2025-12-06 04:02:49,849] Trial 36 finished with value: 0.3076756719865419 and parameters: {'model_type': 'mlp', 'hidden_dims': '[256, 128, 64]', 'dropout': 0.4259061228636643, 'batch_norm': True, 'lr': 2.8050869020116803e-05, 'weight_decay': 1.0687295154404784e-05, 'epochs': 211, 'loss': 'mae', 'optimizer': 'adam', 'graph_mode': 'off', 'use_snp_selection': True, 'num_snps': 58661}. Best is trial 30 with value: 0.3140119736694639.
[I 2025-12-06 04:03:27,759] Trial 37 finished with value: 0.305325942713539 and parameters: {'model_type': 'mlp', 'hidden_dims': '[512, 64]', 'dropout': 0.4995638385102078, 'batch_norm': True, 'lr': 4.446294938689996e-06, 'weight_decay': 6.54532222963882e-07, 'epochs': 187, 'loss': 'mse', 'optimizer': 'adam', 'graph_mode': 'off', 'use_snp_selection': False}. Best is trial 30 with value: 0.3140119736694639.
[I 2025-12-06 04:04:02,916] Trial 38 finished with value: 0.2996422813970415 and parameters: {'model_type': 'mlp', 'hidden_dims': '[512, 128]', 'dropout': 0.38947673851928455, 'batch_norm': False, 'lr': 5.988652750976917e-05, 'weight_decay': 1.4684031691810173e-07, 'epochs': 152, 'loss': 'mae', 'optimizer': 'adam', 'graph_mode': 'off', 'use_snp_selection': True, 'num_snps': 19911}. Best is trial 30 with value: 0.3140119736694639.
[I 2025-12-06 04:04:21,081] Trial 39 finished with value: 0.30861187192869366 and parameters: {'model_type': 'mlp', 'hidden_dims': '[512, 64]', 'dropout': 0.12537497458294627, 'batch_norm': True, 'lr': 0.00012997396041141462, 'weight_decay': 7.292174767457787e-06, 'epochs': 74, 'loss': 'mse', 'optimizer': 'adam', 'graph_mode': 'off', 'use_snp_selection': False}. Best is trial 30 with value: 0.3140119736694639.
[I 2025-12-06 04:05:07,981] Trial 40 finished with value: 0.3092928212810106 and parameters: {'model_type': 'mlp', 'hidden_dims': '[512, 128]', 'dropout': 0.570394383375138, 'batch_norm': True, 'lr': 0.0005355631332513197, 'weight_decay': 3.8825923066640997e-07, 'epochs': 238, 'loss': 'mae', 'optimizer': 'adam', 'graph_mode': 'off', 'use_snp_selection': False}. Best is trial 30 with value: 0.3140119736694639.
[I 2025-12-06 04:06:05,123] Trial 41 finished with value: 0.31403928921380675 and parameters: {'model_type': 'mlp', 'hidden_dims': '[512, 256]', 'dropout': 0.17694873929892085, 'batch_norm': True, 'lr': 3.821487322655562e-05, 'weight_decay': 1.8854428361892052e-05, 'epochs': 295, 'loss': 'mae', 'optimizer': 'adam', 'graph_mode': 'off', 'use_snp_selection': False}. Best is trial 41 with value: 0.31403928921380675.
[I 2025-12-06 04:07:03,050] Trial 42 finished with value: 0.31195634906468916 and parameters: {'model_type': 'mlp', 'hidden_dims': '[512, 256]', 'dropout': 0.15718920895519284, 'batch_norm': True, 'lr': 4.459474856792323e-05, 'weight_decay': 2.5182837279309043e-05, 'epochs': 299, 'loss': 'mae', 'optimizer': 'adam', 'graph_mode': 'off', 'use_snp_selection': False}. Best is trial 41 with value: 0.31403928921380675.
[I 2025-12-06 04:07:56,051] Trial 43 finished with value: 0.27754573833728335 and parameters: {'model_type': 'mlp', 'hidden_dims': '[512, 256]', 'dropout': 0.21116654487922404, 'batch_norm': True, 'lr': 2.1409924724993155e-06, 'weight_decay': 3.02209729791328e-05, 'epochs': 271, 'loss': 'mae', 'optimizer': 'adam', 'graph_mode': 'off', 'use_snp_selection': False}. Best is trial 41 with value: 0.31403928921380675.
[I 2025-12-06 04:08:57,664] Trial 44 finished with value: 0.31006365355778787 and parameters: {'model_type': 'mlp', 'hidden_dims': '[512, 256]', 'dropout': 0.27554461132209773, 'batch_norm': True, 'lr': 7.469203912098526e-05, 'weight_decay': 0.00010040081007592979, 'epochs': 319, 'loss': 'mae', 'optimizer': 'adam', 'graph_mode': 'off', 'use_snp_selection': False}. Best is trial 41 with value: 0.31403928921380675.
[I 2025-12-06 04:09:37,500] Trial 45 finished with value: 0.3078821859963118 and parameters: {'model_type': 'mlp', 'hidden_dims': '[512, 256]', 'dropout': 0.10022305474693564, 'batch_norm': True, 'lr': 2.9518669609798156e-05, 'weight_decay': 1.5085264413647514e-05, 'epochs': 196, 'loss': 'mae', 'optimizer': 'adam', 'graph_mode': 'off', 'use_snp_selection': False}. Best is trial 41 with value: 0.31403928921380675.
[I 2025-12-06 04:10:09,067] Trial 46 finished with value: 0.30161536457591154 and parameters: {'model_type': 'mlp', 'hidden_dims': '[256, 128]', 'dropout': 0.1716548345341821, 'batch_norm': False, 'lr': 0.000215456443973691, 'weight_decay': 2.8184494940254023e-06, 'epochs': 298, 'loss': 'mse', 'optimizer': 'adam', 'graph_mode': 'off', 'use_snp_selection': False}. Best is trial 41 with value: 0.31403928921380675.
[I 2025-12-06 04:10:21,785] Trial 47 finished with value: 0.2908499045721652 and parameters: {'model_type': 'mlp', 'hidden_dims': '[128, 64]', 'dropout': 0.12295102347240233, 'batch_norm': True, 'lr': 1.0979919380813912e-05, 'weight_decay': 0.0002747942807856569, 'epochs': 161, 'loss': 'mae', 'optimizer': 'adam', 'graph_mode': 'off', 'use_snp_selection': False}. Best is trial 41 with value: 0.31403928921380675.
[I 2025-12-06 04:11:13,442] Trial 48 finished with value: 0.3125957939452986 and parameters: {'model_type': 'mlp', 'hidden_dims': '[512, 64]', 'dropout': 0.36839463865748534, 'batch_norm': True, 'lr': 5.285615384315501e-05, 'weight_decay': 1.5037814669961012e-07, 'epochs': 265, 'loss': 'mse', 'optimizer': 'adam', 'graph_mode': 'off', 'use_snp_selection': False}. Best is trial 41 with value: 0.31403928921380675.
[I 2025-12-06 04:12:19,950] Trial 49 finished with value: 0.31188965482414194 and parameters: {'model_type': 'mlp', 'hidden_dims': '[512, 128]', 'dropout': 0.15646974917087741, 'batch_norm': True, 'lr': 8.267845858564259e-05, 'weight_decay': 1.2953289771182035e-06, 'epochs': 244, 'loss': 'mae', 'optimizer': 'adam', 'graph_mode': 'off', 'use_snp_selection': True, 'num_snps': 46888}. Best is trial 41 with value: 0.31403928921380675.
[I 2025-12-06 04:12:34,350] Trial 50 finished with value: 0.3106964677577005 and parameters: {'model_type': 'mlp', 'hidden_dims': '[256, 128, 64]', 'dropout': 0.4017076249615191, 'batch_norm': True, 'lr': 0.0002991780015386373, 'weight_decay': 0.00011934186939604614, 'epochs': 106, 'loss': 'mse', 'optimizer': 'adam', 'graph_mode': 'off', 'use_snp_selection': False}. Best is trial 41 with value: 0.31403928921380675.
[I 2025-12-06 04:13:26,513] Trial 51 finished with value: 0.30758101645577723 and parameters: {'model_type': 'mlp', 'hidden_dims': '[512, 64]', 'dropout': 0.3708757841135524, 'batch_norm': True, 'lr': 5.906098883639777e-05, 'weight_decay': 1.5184760878554262e-07, 'epochs': 268, 'loss': 'mse', 'optimizer': 'adam', 'graph_mode': 'off', 'use_snp_selection': False}. Best is trial 41 with value: 0.31403928921380675.
[I 2025-12-06 04:14:21,462] Trial 52 finished with value: 0.3107106598747469 and parameters: {'model_type': 'mlp', 'hidden_dims': '[512, 64]', 'dropout': 0.4401482270125388, 'batch_norm': True, 'lr': 4.253997998418965e-05, 'weight_decay': 3.079477043800966e-07, 'epochs': 284, 'loss': 'mse', 'optimizer': 'adam', 'graph_mode': 'off', 'use_snp_selection': False}. Best is trial 41 with value: 0.31403928921380675.
[I 2025-12-06 04:15:05,065] Trial 53 finished with value: 0.30828870921334717 and parameters: {'model_type': 'mlp', 'hidden_dims': '[512, 64]', 'dropout': 0.36028939795101583, 'batch_norm': True, 'lr': 0.00011038551405939546, 'weight_decay': 1.384256174337449e-07, 'epochs': 219, 'loss': 'mse', 'optimizer': 'adam', 'graph_mode': 'off', 'use_snp_selection': False}. Best is trial 41 with value: 0.31403928921380675.
[I 2025-12-06 04:15:56,168] Trial 54 finished with value: 0.3081368113255383 and parameters: {'model_type': 'mlp', 'hidden_dims': '[512, 64]', 'dropout': 0.32705525823207426, 'batch_norm': True, 'lr': 2.2574577755917633e-05, 'weight_decay': 5.351596935828683e-07, 'epochs': 262, 'loss': 'mse', 'optimizer': 'adam', 'graph_mode': 'off', 'use_snp_selection': False}. Best is trial 41 with value: 0.31403928921380675.
[I 2025-12-06 04:16:55,637] Trial 55 finished with value: 0.3085312355262676 and parameters: {'model_type': 'mlp', 'hidden_dims': '[512, 128]', 'dropout': 0.28504372821791424, 'batch_norm': True, 'lr': 0.00016410520179603412, 'weight_decay': 1.7561875009957568e-07, 'epochs': 309, 'loss': 'mse', 'optimizer': 'adam', 'graph_mode': 'off', 'use_snp_selection': False}. Best is trial 41 with value: 0.31403928921380675.
[I 2025-12-06 04:17:42,611] Trial 56 finished with value: 0.30949834338620025 and parameters: {'model_type': 'mlp', 'hidden_dims': '[512, 256]', 'dropout': 0.13487161322637914, 'batch_norm': True, 'lr': 5.314611638274066e-05, 'weight_decay': 3.2479813453069373e-07, 'epochs': 237, 'loss': 'mse', 'optimizer': 'adam', 'graph_mode': 'off', 'use_snp_selection': False}. Best is trial 41 with value: 0.31403928921380675.
[I 2025-12-06 04:18:44,773] Trial 57 finished with value: 0.3052295083053797 and parameters: {'model_type': 'mlp', 'hidden_dims': '[512, 64]', 'dropout': 0.4695892290311977, 'batch_norm': False, 'lr': 3.2909519331158873e-05, 'weight_decay': 7.831973711387811e-07, 'epochs': 329, 'loss': 'mae', 'optimizer': 'adam', 'graph_mode': 'off', 'use_snp_selection': False}. Best is trial 41 with value: 0.31403928921380675.
[I 2025-12-06 04:19:26,706] Trial 58 finished with value: 0.31528413736659905 and parameters: {'model_type': 'mlp', 'hidden_dims': '[512, 128]', 'dropout': 0.5143453274380809, 'batch_norm': True, 'lr': 0.00011486013730956715, 'weight_decay': 1.817650727084341e-06, 'epochs': 209, 'loss': 'mae', 'optimizer': 'adam', 'graph_mode': 'off', 'use_snp_selection': False}. Best is trial 58 with value: 0.31528413736659905.
[I 2025-12-06 04:20:04,091] Trial 59 finished with value: 0.3129241642755609 and parameters: {'model_type': 'mlp', 'hidden_dims': '[512, 128]', 'dropout': 0.5605838831437671, 'batch_norm': True, 'lr': 0.00012912668726747906, 'weight_decay': 6.556535045773211e-06, 'epochs': 183, 'loss': 'mae', 'optimizer': 'adam', 'graph_mode': 'off', 'use_snp_selection': False}. Best is trial 58 with value: 0.31528413736659905.
[I 2025-12-06 04:20:45,907] Trial 60 finished with value: 0.3081266516602855 and parameters: {'model_type': 'mlp', 'hidden_dims': '[512, 128]', 'dropout': 0.5615232509635749, 'batch_norm': True, 'lr': 0.00012431231421731583, 'weight_decay': 7.694545058051732e-06, 'epochs': 208, 'loss': 'mae', 'optimizer': 'adam', 'graph_mode': 'off', 'use_snp_selection': False}. Best is trial 58 with value: 0.31528413736659905.
[I 2025-12-06 04:21:22,630] Trial 61 finished with value: 0.31166159278398947 and parameters: {'model_type': 'mlp', 'hidden_dims': '[512, 128]', 'dropout': 0.5185501410242659, 'batch_norm': True, 'lr': 7.77648390098392e-05, 'weight_decay': 1.8720170078477538e-06, 'epochs': 179, 'loss': 'mae', 'optimizer': 'adam', 'graph_mode': 'off', 'use_snp_selection': False}. Best is trial 58 with value: 0.31528413736659905.
[I 2025-12-06 04:22:00,732] Trial 62 finished with value: 0.3112387116638161 and parameters: {'model_type': 'mlp', 'hidden_dims': '[512, 128]', 'dropout': 0.5105633652279971, 'batch_norm': True, 'lr': 0.0001983399448414025, 'weight_decay': 1.4018410372147478e-05, 'epochs': 187, 'loss': 'mae', 'optimizer': 'adam', 'graph_mode': 'off', 'use_snp_selection': False}. Best is trial 58 with value: 0.31528413736659905.
[I 2025-12-06 04:22:36,221] Trial 63 finished with value: 0.3109194775969232 and parameters: {'model_type': 'mlp', 'hidden_dims': '[512, 128]', 'dropout': 0.5548294095678058, 'batch_norm': True, 'lr': 0.00010590534749611757, 'weight_decay': 3.001445290561085e-06, 'epochs': 172, 'loss': 'mae', 'optimizer': 'adam', 'graph_mode': 'off', 'use_snp_selection': False}. Best is trial 58 with value: 0.31528413736659905.
[I 2025-12-06 04:23:07,835] Trial 64 finished with value: 0.3133403934934983 and parameters: {'model_type': 'mlp', 'hidden_dims': '[512, 128]', 'dropout': 0.5462352571860088, 'batch_norm': True, 'lr': 0.00038295998730362264, 'weight_decay': 4.080299197552255e-06, 'epochs': 150, 'loss': 'mae', 'optimizer': 'adam', 'graph_mode': 'off', 'use_snp_selection': False}. Best is trial 58 with value: 0.31528413736659905.
[I 2025-12-06 04:23:38,921] Trial 65 finished with value: 0.31375821781285373 and parameters: {'model_type': 'mlp', 'hidden_dims': '[512, 128]', 'dropout': 0.5481214257131978, 'batch_norm': True, 'lr': 0.0003906323583537585, 'weight_decay': 7.990455379559497e-06, 'epochs': 147, 'loss': 'mae', 'optimizer': 'adam', 'graph_mode': 'off', 'use_snp_selection': False}. Best is trial 58 with value: 0.31528413736659905.
[I 2025-12-06 04:24:17,086] Trial 66 finished with value: 0.3023282685042124 and parameters: {'model_type': 'mlp', 'hidden_dims': '[512, 128]', 'dropout': 0.5403058798907521, 'batch_norm': True, 'lr': 0.000744672268943337, 'weight_decay': 0.0008281283468112786, 'epochs': 140, 'loss': 'mae', 'optimizer': 'adam', 'graph_mode': 'off', 'use_snp_selection': True, 'num_snps': 22881}. Best is trial 58 with value: 0.31528413736659905.
[I 2025-12-06 04:24:44,214] Trial 67 finished with value: 0.3123068042720689 and parameters: {'model_type': 'mlp', 'hidden_dims': '[512, 128]', 'dropout': 0.5791712788567697, 'batch_norm': True, 'lr': 0.000331841327148833, 'weight_decay': 3.866293137692757e-06, 'epochs': 125, 'loss': 'mae', 'optimizer': 'adam', 'graph_mode': 'off', 'use_snp_selection': False}. Best is trial 58 with value: 0.31528413736659905.
[I 2025-12-06 04:24:56,579] Trial 68 finished with value: 0.3083007388670354 and parameters: {'model_type': 'mlp', 'hidden_dims': '[128, 64]', 'dropout': 0.4890374608473013, 'batch_norm': True, 'lr': 0.0005511280769585186, 'weight_decay': 1.6026928616200082e-06, 'epochs': 153, 'loss': 'mae', 'optimizer': 'adam', 'graph_mode': 'off', 'use_snp_selection': False}. Best is trial 58 with value: 0.31528413736659905.
[I 2025-12-06 04:25:20,392] Trial 69 finished with value: 0.2923152905616454 and parameters: {'model_type': 'mlp', 'hidden_dims': '[512, 128]', 'dropout': 0.5875337302426419, 'batch_norm': False, 'lr': 0.0002623896237946485, 'weight_decay': 4.039726408939074e-05, 'epochs': 107, 'loss': 'mae', 'optimizer': 'adam', 'graph_mode': 'off', 'use_snp_selection': False}. Best is trial 58 with value: 0.31528413736659905.
[I 2025-12-06 04:25:39,500] Trial 70 finished with value: 0.3095865950557434 and parameters: {'model_type': 'mlp', 'hidden_dims': '[256, 128]', 'dropout': 0.5105703619042072, 'batch_norm': True, 'lr': 0.0003822585889589598, 'weight_decay': 8.656188408438864e-06, 'epochs': 157, 'loss': 'mae', 'optimizer': 'adam', 'graph_mode': 'off', 'use_snp_selection': False}. Best is trial 58 with value: 0.31528413736659905.
[I 2025-12-06 04:26:10,398] Trial 71 finished with value: 0.3076112106794645 and parameters: {'model_type': 'mlp', 'hidden_dims': '[512, 128]', 'dropout': 0.5475735676784736, 'batch_norm': True, 'lr': 0.0001612625409130217, 'weight_decay': 4.749507834462927e-06, 'epochs': 146, 'loss': 'mae', 'optimizer': 'adam', 'graph_mode': 'off', 'use_snp_selection': False}. Best is trial 58 with value: 0.31528413736659905.
[I 2025-12-06 04:26:48,469] Trial 72 finished with value: 0.30943579185199477 and parameters: {'model_type': 'mlp', 'hidden_dims': '[512, 128]', 'dropout': 0.5248142943922326, 'batch_norm': True, 'lr': 0.0009270268597628824, 'weight_decay': 6.890520650382944e-06, 'epochs': 187, 'loss': 'mae', 'optimizer': 'adam', 'graph_mode': 'off', 'use_snp_selection': False}. Best is trial 58 with value: 0.31528413736659905.
[I 2025-12-06 04:27:23,404] Trial 73 finished with value: 0.3096371737213529 and parameters: {'model_type': 'mlp', 'hidden_dims': '[512, 128]', 'dropout': 0.5581856255771823, 'batch_norm': True, 'lr': 0.0005767994888659864, 'weight_decay': 2.1543971383566588e-05, 'epochs': 169, 'loss': 'mae', 'optimizer': 'adam', 'graph_mode': 'off', 'use_snp_selection': False}. Best is trial 58 with value: 0.31528413736659905.
[I 2025-12-06 04:27:49,201] Trial 74 finished with value: 0.3100683915908729 and parameters: {'model_type': 'mlp', 'hidden_dims': '[512, 128]', 'dropout': 0.5848635753092826, 'batch_norm': True, 'lr': 6.551202720896886e-05, 'weight_decay': 6.060749254716592e-06, 'epochs': 117, 'loss': 'mae', 'optimizer': 'adam', 'graph_mode': 'off', 'use_snp_selection': False}. Best is trial 58 with value: 0.31528413736659905.
[I 2025-12-06 04:28:17,817] Trial 75 finished with value: 0.30997052731269586 and parameters: {'model_type': 'mlp', 'hidden_dims': '[512, 128]', 'dropout': 0.46736044503747615, 'batch_norm': True, 'lr': 3.9701274288260885e-05, 'weight_decay': 1.1549349609727613e-05, 'epochs': 133, 'loss': 'mae', 'optimizer': 'adam', 'graph_mode': 'off', 'use_snp_selection': False}. Best is trial 58 with value: 0.31528413736659905.
[I 2025-12-06 04:28:57,820] Trial 76 finished with value: 0.3122645426202449 and parameters: {'model_type': 'mlp', 'hidden_dims': '[512, 256]', 'dropout': 0.5481434280442701, 'batch_norm': True, 'lr': 0.00013694689525703795, 'weight_decay': 1.0347609961588416e-07, 'epochs': 197, 'loss': 'mae', 'optimizer': 'adam', 'graph_mode': 'off', 'use_snp_selection': False}. Best is trial 58 with value: 0.31528413736659905.
[I 2025-12-06 04:29:15,860] Trial 77 finished with value: 0.3081077565618674 and parameters: {'model_type': 'mlp', 'hidden_dims': '[256, 128, 64]', 'dropout': 0.5701687299080508, 'batch_norm': True, 'lr': 0.00038334605231674356, 'weight_decay': 2.0566272334510293e-06, 'epochs': 144, 'loss': 'mae', 'optimizer': 'adam', 'graph_mode': 'off', 'use_snp_selection': False}. Best is trial 58 with value: 0.31528413736659905.
[I 2025-12-06 04:29:39,625] Trial 78 finished with value: 0.11445691061494663 and parameters: {'model_type': 'mlp', 'hidden_dims': '[512, 128]', 'dropout': 0.4517535833969916, 'batch_norm': True, 'lr': 1.0087771566710253e-06, 'weight_decay': 1.760826829194046e-05, 'epochs': 209, 'loss': 'mae', 'optimizer': 'adam', 'graph_mode': 'off', 'use_snp_selection': True, 'num_snps': 2246}. Best is trial 58 with value: 0.31528413736659905.
[I 2025-12-06 04:30:00,349] Trial 79 finished with value: 0.3119866184939196 and parameters: {'model_type': 'mlp', 'hidden_dims': '[512, 128]', 'dropout': 0.5024928004366948, 'batch_norm': True, 'lr': 0.0002553791363075724, 'weight_decay': 8.789445413375361e-07, 'epochs': 88, 'loss': 'mae', 'optimizer': 'adam', 'graph_mode': 'off', 'use_snp_selection': False}. Best is trial 58 with value: 0.31528413736659905.
[I 2025-12-06 04:30:45,058] Trial 80 finished with value: 0.30237517706122163 and parameters: {'model_type': 'mlp', 'hidden_dims': '[512, 128]', 'dropout': 0.5999857957172268, 'batch_norm': False, 'lr': 9.286808673067377e-05, 'weight_decay': 3.6842914860872896e-06, 'epochs': 227, 'loss': 'mae', 'optimizer': 'adam', 'graph_mode': 'off', 'use_snp_selection': False}. Best is trial 58 with value: 0.31528413736659905.
[I 2025-12-06 04:31:18,448] Trial 81 finished with value: 0.3148333704244511 and parameters: {'model_type': 'mlp', 'hidden_dims': '[512, 128]', 'dropout': 0.17091920583313153, 'batch_norm': True, 'lr': 0.00018535696825809663, 'weight_decay': 2.333939429901739e-06, 'epochs': 160, 'loss': 'mae', 'optimizer': 'adam', 'graph_mode': 'off', 'use_snp_selection': False}. Best is trial 58 with value: 0.31528413736659905.
[I 2025-12-06 04:31:52,017] Trial 82 finished with value: 0.3081702230744733 and parameters: {'model_type': 'mlp', 'hidden_dims': '[512, 128]', 'dropout': 0.17755032418639563, 'batch_norm': True, 'lr': 0.00014202722088785204, 'weight_decay': 5.381426583786175e-06, 'epochs': 161, 'loss': 'mae', 'optimizer': 'adam', 'graph_mode': 'off', 'use_snp_selection': False}. Best is trial 58 with value: 0.31528413736659905.
[I 2025-12-06 04:32:29,477] Trial 83 finished with value: 0.3116119950901166 and parameters: {'model_type': 'mlp', 'hidden_dims': '[512, 128]', 'dropout': 0.5299385013466128, 'batch_norm': True, 'lr': 0.00023140578908827764, 'weight_decay': 1.4560435102746502e-06, 'epochs': 183, 'loss': 'mae', 'optimizer': 'adam', 'graph_mode': 'off', 'use_snp_selection': False}. Best is trial 58 with value: 0.31528413736659905.
