[I 2025-12-05 14:56:33,060] Trial 85 finished with value: 0.15696113725169925 and parameters: {'model_type': 'mlp', 'hidden_dims': '[512, 64]', 'dropout': 0.1868439640232244, 'batch_norm': True, 'lr': 0.0006427402078766297, 'weight_decay': 2.8605228840362087e-05, 'epochs': 106, 'loss': 'mse', 'optimizer': 'adam', 'graph_mode': 'off', 'use_snp_selection': True, 'num_snps': 25322}. Best is trial 59 with value: 0.17338871024337962.
[I 2025-12-05 14:56:34,963] Trial 86 finished with value: 0.1330403643234425 and parameters: {'model_type': 'mlp', 'hidden_dims': '[512, 64]', 'dropout': 0.2261947654955383, 'batch_norm': True, 'lr': 0.0005012108767186886, 'weight_decay': 1.3783264807541448e-05, 'epochs': 122, 'loss': 'mse', 'optimizer': 'adam', 'graph_mode': 'off', 'use_snp_selection': True, 'num_snps': 32722}. Best is trial 59 with value: 0.17338871024337962.
[I 2025-12-05 14:56:37,074] Trial 87 finished with value: 0.1123118765349031 and parameters: {'model_type': 'mlp', 'hidden_dims': '[512, 64]', 'dropout': 0.1477227909539822, 'batch_norm': False, 'lr': 0.00025649676654418765, 'weight_decay': 3.8167839211681954e-05, 'epochs': 103, 'loss': 'mse', 'optimizer': 'adam', 'graph_mode': 'off', 'use_snp_selection': True, 'num_snps': 39348}. Best is trial 59 with value: 0.17338871024337962.
[I 2025-12-05 14:56:38,450] Trial 88 finished with value: 0.1605314922512251 and parameters: {'model_type': 'mlp', 'hidden_dims': '[512, 64]', 'dropout': 0.2015832595490122, 'batch_norm': True, 'lr': 0.00032026803875903636, 'weight_decay': 7.042990781253872e-05, 'epochs': 86, 'loss': 'mse', 'optimizer': 'adam', 'graph_mode': 'off', 'use_snp_selection': True, 'num_snps': 20064}. Best is trial 59 with value: 0.17338871024337962.
[I 2025-12-05 14:56:40,528] Trial 89 finished with value: 0.16481686714610178 and parameters: {'model_type': 'mlp', 'hidden_dims': '[512, 64]', 'dropout': 0.1983730052529913, 'batch_norm': True, 'lr': 0.00013656380475165114, 'weight_decay': 0.00014672439900618236, 'epochs': 76, 'loss': 'mse', 'optimizer': 'adam', 'graph_mode': 'off', 'use_snp_selection': True, 'num_snps': 40858}. Best is trial 59 with value: 0.17338871024337962.
[I 2025-12-05 14:56:42,872] Trial 90 finished with value: 0.16053955959296157 and parameters: {'model_type': 'mlp', 'hidden_dims': '[512, 64]', 'dropout': 0.17016946085523382, 'batch_norm': True, 'lr': 0.00017568609912716103, 'weight_decay': 0.0005281742854690884, 'epochs': 66, 'loss': 'mse', 'optimizer': 'adam', 'graph_mode': 'off', 'use_snp_selection': True, 'num_snps': 50662}. Best is trial 59 with value: 0.17338871024337962.
[I 2025-12-05 14:56:45,189] Trial 91 finished with value: 0.13766959638107099 and parameters: {'model_type': 'mlp', 'hidden_dims': '[512, 64]', 'dropout': 0.17990226546980637, 'batch_norm': True, 'lr': 0.00013367521702610822, 'weight_decay': 0.0005508080882151386, 'epochs': 67, 'loss': 'mse', 'optimizer': 'adam', 'graph_mode': 'off', 'use_snp_selection': True, 'num_snps': 49177}. Best is trial 59 with value: 0.17338871024337962.
[I 2025-12-05 14:56:47,791] Trial 92 finished with value: 0.12075349879462778 and parameters: {'model_type': 'mlp', 'hidden_dims': '[512, 64]', 'dropout': 0.3332208529730045, 'batch_norm': True, 'lr': 0.0001999730108419233, 'weight_decay': 0.00014751075596239636, 'epochs': 79, 'loss': 'mse', 'optimizer': 'adam', 'graph_mode': 'off', 'use_snp_selection': True, 'num_snps': 51680}. Best is trial 59 with value: 0.17338871024337962.
[I 2025-12-05 14:56:49,799] Trial 93 finished with value: 0.1387911629733164 and parameters: {'model_type': 'mlp', 'hidden_dims': '[512, 64]', 'dropout': 0.16831603643915408, 'batch_norm': True, 'lr': 0.00010207342671404247, 'weight_decay': 0.00024571722583616634, 'epochs': 56, 'loss': 'mse', 'optimizer': 'adam', 'graph_mode': 'off', 'use_snp_selection': True, 'num_snps': 41115}. Best is trial 59 with value: 0.17338871024337962.
[I 2025-12-05 14:56:51,889] Trial 94 finished with value: 0.10426203003453166 and parameters: {'model_type': 'mlp', 'hidden_dims': '[512, 64]', 'dropout': 0.14274561899133803, 'batch_norm': True, 'lr': 7.017362795297108e-05, 'weight_decay': 0.0005312109364027896, 'epochs': 97, 'loss': 'mse', 'optimizer': 'adam', 'graph_mode': 'off', 'use_snp_selection': True, 'num_snps': 41948}. Best is trial 59 with value: 0.17338871024337962.
[I 2025-12-05 14:56:54,226] Trial 95 finished with value: 0.1434302453184918 and parameters: {'model_type': 'mlp', 'hidden_dims': '[512, 64]', 'dropout': 0.1534841733627193, 'batch_norm': True, 'lr': 0.00013966693903189693, 'weight_decay': 0.0009582885547241673, 'epochs': 56, 'loss': 'mse', 'optimizer': 'adam', 'graph_mode': 'off', 'use_snp_selection': True, 'num_snps': 52496}. Best is trial 59 with value: 0.17338871024337962.
[I 2025-12-05 14:56:55,815] Trial 96 finished with value: 0.1466243327814547 and parameters: {'model_type': 'mlp', 'hidden_dims': '[512, 64]', 'dropout': 0.21967966398458222, 'batch_norm': True, 'lr': 0.00019139686416064534, 'weight_decay': 1.9988620197633348e-05, 'epochs': 42, 'loss': 'mse', 'optimizer': 'adam', 'graph_mode': 'off', 'use_snp_selection': True, 'num_snps': 32104}. Best is trial 59 with value: 0.17338871024337962.
[I 2025-12-05 14:56:56,685] Trial 97 finished with value: 0.14805157008966197 and parameters: {'model_type': 'mlp', 'hidden_dims': '[256, 128]', 'dropout': 0.20081167592390714, 'batch_norm': True, 'lr': 0.00017492810110503987, 'weight_decay': 0.0003864738932283634, 'epochs': 123, 'loss': 'mse', 'optimizer': 'adam', 'graph_mode': 'off', 'use_snp_selection': False}. Best is trial 59 with value: 0.17338871024337962.
[I 2025-12-05 14:56:59,571] Trial 98 finished with value: 0.1361421461002347 and parameters: {'model_type': 'mlp', 'hidden_dims': '[512, 64]', 'dropout': 0.11119405740877467, 'batch_norm': True, 'lr': 9.5516831930961e-05, 'weight_decay': 2.4183129895137857e-05, 'epochs': 209, 'loss': 'mse', 'optimizer': 'adam', 'graph_mode': 'off', 'use_snp_selection': True, 'num_snps': 54687}. Best is trial 59 with value: 0.17338871024337962.
[I 2025-12-05 14:57:00,257] Trial 99 finished with value: 0.11705311955226189 and parameters: {'model_type': 'mlp', 'hidden_dims': '[128, 64]', 'dropout': 0.2983415733025294, 'batch_norm': False, 'lr': 0.00011433653648539141, 'weight_decay': 4.145131506866832e-05, 'epochs': 67, 'loss': 'mse', 'optimizer': 'adam', 'graph_mode': 'off', 'use_snp_selection': False}. Best is trial 59 with value: 0.17338871024337962.
[I 2025-12-05 14:57:01,341] Trial 100 finished with value: 0.14367611567277427 and parameters: {'model_type': 'mlp', 'hidden_dims': '[256, 128, 64]', 'dropout': 0.24107539664292643, 'batch_norm': True, 'lr': 0.00024164315527235657, 'weight_decay': 0.00012541830563817224, 'epochs': 229, 'loss': 'mse', 'optimizer': 'adam', 'graph_mode': 'off', 'use_snp_selection': False}. Best is trial 59 with value: 0.17338871024337962.
[I 2025-12-05 14:57:03,150] Trial 101 finished with value: 0.15043559860259528 and parameters: {'model_type': 'mlp', 'hidden_dims': '[512, 64]', 'dropout': 0.19869313095866645, 'batch_norm': True, 'lr': 0.0003053331270073272, 'weight_decay': 8.153681767917155e-05, 'epochs': 82, 'loss': 'mse', 'optimizer': 'adam', 'graph_mode': 'off', 'use_snp_selection': True, 'num_snps': 36195}. Best is trial 59 with value: 0.17338871024337962.
[I 2025-12-05 14:57:04,383] Trial 102 finished with value: 0.15465557474076153 and parameters: {'model_type': 'mlp', 'hidden_dims': '[512, 64]', 'dropout': 0.1777815561365861, 'batch_norm': True, 'lr': 0.00034664076101112673, 'weight_decay': 3.1023480365408927e-05, 'epochs': 89, 'loss': 'mse', 'optimizer': 'adam', 'graph_mode': 'off', 'use_snp_selection': True, 'num_snps': 18898}. Best is trial 59 with value: 0.17338871024337962.
[I 2025-12-05 14:57:05,946] Trial 103 finished with value: 0.15000787111362024 and parameters: {'model_type': 'mlp', 'hidden_dims': '[512, 64]', 'dropout': 0.12551247280523412, 'batch_norm': True, 'lr': 0.0001520312144784954, 'weight_decay': 5.669872247217961e-05, 'epochs': 100, 'loss': 'mse', 'optimizer': 'adam', 'graph_mode': 'off', 'use_snp_selection': True, 'num_snps': 29671}. Best is trial 59 with value: 0.17338871024337962.
[I 2025-12-05 14:57:07,726] Trial 104 finished with value: 0.027815160124013534 and parameters: {'model_type': 'mlp', 'hidden_dims': '[512, 64]', 'dropout': 0.16179814215153446, 'batch_norm': True, 'lr': 1.1435213377551931e-06, 'weight_decay': 0.00017013447825079965, 'epochs': 111, 'loss': 'mse', 'optimizer': 'adam', 'graph_mode': 'off', 'use_snp_selection': True, 'num_snps': 34204}. Best is trial 59 with value: 0.17338871024337962.
[I 2025-12-05 14:57:09,030] Trial 105 finished with value: 0.09955967103698421 and parameters: {'model_type': 'mlp', 'hidden_dims': '[512, 64]', 'dropout': 0.19245232742985205, 'batch_norm': True, 'lr': 5.0112020087151246e-05, 'weight_decay': 0.00010953761369340659, 'epochs': 88, 'loss': 'mse', 'optimizer': 'adam', 'graph_mode': 'off', 'use_snp_selection': True, 'num_snps': 21179}. Best is trial 59 with value: 0.17338871024337962.
[I 2025-12-05 14:57:10,001] Trial 106 finished with value: 0.15897509257509754 and parameters: {'model_type': 'mlp', 'hidden_dims': '[512, 256]', 'dropout': 0.13884535140344553, 'batch_norm': True, 'lr': 0.00026210335173529136, 'weight_decay': 6.663189345574073e-05, 'epochs': 61, 'loss': 'mse', 'optimizer': 'adam', 'graph_mode': 'off', 'use_snp_selection': False}. Best is trial 59 with value: 0.17338871024337962.
[I 2025-12-05 14:57:12,745] Trial 107 finished with value: 0.1520193327004148 and parameters: {'model_type': 'mlp', 'hidden_dims': '[512, 64]', 'dropout': 0.2593187033105293, 'batch_norm': True, 'lr': 0.0005571279423229321, 'weight_decay': 4.152610187023097e-05, 'epochs': 342, 'loss': 'mse', 'optimizer': 'adam', 'graph_mode': 'off', 'use_snp_selection': True, 'num_snps': 44146}. Best is trial 59 with value: 0.17338871024337962.
[I 2025-12-05 14:57:13,566] Trial 108 finished with value: 0.1437798784361956 and parameters: {'model_type': 'mlp', 'hidden_dims': '[256, 128, 64]', 'dropout': 0.15200336663478548, 'batch_norm': True, 'lr': 0.0008672698010070292, 'weight_decay': 0.0002657028849680263, 'epochs': 74, 'loss': 'mae', 'optimizer': 'adam', 'graph_mode': 'off', 'use_snp_selection': False}. Best is trial 59 with value: 0.17338871024337962.
[I 2025-12-05 14:57:15,601] Trial 109 finished with value: 0.1520207142083592 and parameters: {'model_type': 'mlp', 'hidden_dims': '[256, 128]', 'dropout': 0.16806622206620653, 'batch_norm': True, 'lr': 0.00038445448453951284, 'weight_decay': 9.421321552633224e-05, 'epochs': 82, 'loss': 'mse', 'optimizer': 'adam', 'graph_mode': 'off', 'use_snp_selection': True, 'num_snps': 47779}. Best is trial 59 with value: 0.17338871024337962.
[I 2025-12-05 14:57:16,713] Trial 110 finished with value: 0.1250612982500156 and parameters: {'model_type': 'mlp', 'hidden_dims': '[512, 128]', 'dropout': 0.12406807427504701, 'batch_norm': False, 'lr': 2.7274510367880434e-05, 'weight_decay': 2.521075845700442e-05, 'epochs': 96, 'loss': 'mae', 'optimizer': 'adam', 'graph_mode': 'off', 'use_snp_selection': False}. Best is trial 59 with value: 0.17338871024337962.
[I 2025-12-05 14:57:17,739] Trial 111 finished with value: 0.15195402147093814 and parameters: {'model_type': 'mlp', 'hidden_dims': '[512, 256]', 'dropout': 0.14469001266237883, 'batch_norm': True, 'lr': 0.0002610562753451025, 'weight_decay': 6.049924944217926e-05, 'epochs': 65, 'loss': 'mse', 'optimizer': 'adam', 'graph_mode': 'off', 'use_snp_selection': False}. Best is trial 59 with value: 0.17338871024337962.
[I 2025-12-05 14:57:18,718] Trial 112 finished with value: 0.15542633837813716 and parameters: {'model_type': 'mlp', 'hidden_dims': '[512, 256]', 'dropout': 0.13709283665461203, 'batch_norm': True, 'lr': 0.00030030378925819534, 'weight_decay': 7.661125256775844e-05, 'epochs': 62, 'loss': 'mse', 'optimizer': 'adam', 'graph_mode': 'off', 'use_snp_selection': False}. Best is trial 59 with value: 0.17338871024337962.
[I 2025-12-05 14:57:19,726] Trial 113 finished with value: 0.14934299174385698 and parameters: {'model_type': 'mlp', 'hidden_dims': '[512, 256]', 'dropout': 0.1590628128925265, 'batch_norm': True, 'lr': 0.0006824654724460806, 'weight_decay': 3.3676852331763884e-05, 'epochs': 72, 'loss': 'mse', 'optimizer': 'adam', 'graph_mode': 'off', 'use_snp_selection': False}. Best is trial 59 with value: 0.17338871024337962.
[I 2025-12-05 14:57:20,920] Trial 114 finished with value: 0.13157766064217744 and parameters: {'model_type': 'mlp', 'hidden_dims': '[512, 256]', 'dropout': 0.10962426692288278, 'batch_norm': True, 'lr': 0.00016574673914976652, 'weight_decay': 4.813598856424655e-05, 'epochs': 116, 'loss': 'mse', 'optimizer': 'adam', 'graph_mode': 'off', 'use_snp_selection': False}. Best is trial 59 with value: 0.17338871024337962.
[I 2025-12-05 14:57:21,868] Trial 115 finished with value: 0.09096334075731992 and parameters: {'model_type': 'mlp', 'hidden_dims': '[512, 128]', 'dropout': 0.5784838935234434, 'batch_norm': True, 'lr': 0.0003755649778182361, 'weight_decay': 1.5231605361067249e-05, 'epochs': 47, 'loss': 'mse', 'optimizer': 'adam', 'graph_mode': 'off', 'use_snp_selection': False}. Best is trial 59 with value: 0.17338871024337962.
[I 2025-12-05 14:57:23,085] Trial 116 finished with value: 0.15242855697186652 and parameters: {'model_type': 'mlp', 'hidden_dims': '[512, 256]', 'dropout': 0.13778773078553236, 'batch_norm': True, 'lr': 0.00047100901102432917, 'weight_decay': 6.431400966202955e-05, 'epochs': 129, 'loss': 'mae', 'optimizer': 'adam', 'graph_mode': 'off', 'use_snp_selection': False}. Best is trial 59 with value: 0.17338871024337962.
[I 2025-12-05 14:57:23,759] Trial 117 finished with value: 0.13792521917174827 and parameters: {'model_type': 'mlp', 'hidden_dims': '[128, 64]', 'dropout': 0.20430829806898598, 'batch_norm': True, 'lr': 0.0002295931146969461, 'weight_decay': 2.1151738994870442e-05, 'epochs': 61, 'loss': 'mae', 'optimizer': 'adam', 'graph_mode': 'off', 'use_snp_selection': False}. Best is trial 59 with value: 0.17338871024337962.
[I 2025-12-05 14:57:25,174] Trial 118 finished with value: 0.07890181318620182 and parameters: {'model_type': 'mlp', 'hidden_dims': '[512, 128]', 'dropout': 0.41604764247678677, 'batch_norm': False, 'lr': 9.345753736238606e-06, 'weight_decay': 3.87377287666244e-05, 'epochs': 84, 'loss': 'mae', 'optimizer': 'adam', 'graph_mode': 'off', 'use_snp_selection': True, 'num_snps': 25003}. Best is trial 59 with value: 0.17338871024337962.
[I 2025-12-05 14:57:26,276] Trial 119 finished with value: 0.13712925076287777 and parameters: {'model_type': 'mlp', 'hidden_dims': '[512, 64]', 'dropout': 0.182414491925834, 'batch_norm': True, 'lr': 0.0002154923079639486, 'weight_decay': 9.937956700382311e-06, 'epochs': 95, 'loss': 'mse', 'optimizer': 'adam', 'graph_mode': 'off', 'use_snp_selection': False}. Best is trial 59 with value: 0.17338871024337962.
[I 2025-12-05 14:57:28,404] Trial 120 finished with value: 0.1613521025568716 and parameters: {'model_type': 'mlp', 'hidden_dims': '[512, 128]', 'dropout': 0.1012099211631481, 'batch_norm': True, 'lr': 0.0006117639473999328, 'weight_decay': 5.321719896218415e-05, 'epochs': 168, 'loss': 'mae', 'optimizer': 'adam', 'graph_mode': 'off', 'use_snp_selection': True, 'num_snps': 40543}. Best is trial 59 with value: 0.17338871024337962.
[I 2025-12-05 14:57:30,624] Trial 121 finished with value: 0.16686104721734976 and parameters: {'model_type': 'mlp', 'hidden_dims': '[512, 128]', 'dropout': 0.10323082907691737, 'batch_norm': True, 'lr': 0.0006336588561477179, 'weight_decay': 2.4746353498984194e-07, 'epochs': 184, 'loss': 'mae', 'optimizer': 'adam', 'graph_mode': 'off', 'use_snp_selection': True, 'num_snps': 40667}. Best is trial 59 with value: 0.17338871024337962.
[I 2025-12-05 14:57:32,706] Trial 122 finished with value: 0.16915950004449762 and parameters: {'model_type': 'mlp', 'hidden_dims': '[512, 128]', 'dropout': 0.1006006554500493, 'batch_norm': True, 'lr': 0.000611224582691328, 'weight_decay': 6.01440896158954e-07, 'epochs': 171, 'loss': 'mae', 'optimizer': 'adam', 'graph_mode': 'off', 'use_snp_selection': True, 'num_snps': 39762}. Best is trial 59 with value: 0.17338871024337962.
[I 2025-12-05 14:57:34,949] Trial 123 finished with value: 0.15125882436645077 and parameters: {'model_type': 'mlp', 'hidden_dims': '[512, 128]', 'dropout': 0.1027448564445926, 'batch_norm': True, 'lr': 0.0005942279107733665, 'weight_decay': 3.5041865832993753e-07, 'epochs': 183, 'loss': 'mae', 'optimizer': 'adam', 'graph_mode': 'off', 'use_snp_selection': True, 'num_snps': 40724}. Best is trial 59 with value: 0.17338871024337962.
[I 2025-12-05 14:57:37,047] Trial 124 finished with value: 0.16270310092640577 and parameters: {'model_type': 'mlp', 'hidden_dims': '[512, 128]', 'dropout': 0.12218170007789453, 'batch_norm': True, 'lr': 0.000753666022593672, 'weight_decay': 1.679506376266307e-07, 'epochs': 199, 'loss': 'mae', 'optimizer': 'adam', 'graph_mode': 'off', 'use_snp_selection': True, 'num_snps': 38744}. Best is trial 59 with value: 0.17338871024337962.
[I 2025-12-05 14:57:39,184] Trial 125 finished with value: 0.16639790025110382 and parameters: {'model_type': 'mlp', 'hidden_dims': '[512, 128]', 'dropout': 0.11768892647559964, 'batch_norm': True, 'lr': 0.0007443542202386353, 'weight_decay': 2.2954846722486185e-07, 'epochs': 172, 'loss': 'mae', 'optimizer': 'adam', 'graph_mode': 'off', 'use_snp_selection': True, 'num_snps': 39174}. Best is trial 59 with value: 0.17338871024337962.
[I 2025-12-05 14:57:41,204] Trial 126 finished with value: 0.16636393964373328 and parameters: {'model_type': 'mlp', 'hidden_dims': '[512, 128]', 'dropout': 0.11294325130025763, 'batch_norm': True, 'lr': 0.0009941886151397011, 'weight_decay': 1.889088503866222e-07, 'epochs': 169, 'loss': 'mae', 'optimizer': 'adam', 'graph_mode': 'off', 'use_snp_selection': True, 'num_snps': 38450}. Best is trial 59 with value: 0.17338871024337962.
[I 2025-12-05 14:57:43,213] Trial 127 finished with value: 0.1528601055198875 and parameters: {'model_type': 'mlp', 'hidden_dims': '[512, 128]', 'dropout': 0.12028735184390225, 'batch_norm': True, 'lr': 0.0008234679914445968, 'weight_decay': 1.757475662589058e-07, 'epochs': 170, 'loss': 'mae', 'optimizer': 'adam', 'graph_mode': 'off', 'use_snp_selection': True, 'num_snps': 38034}. Best is trial 59 with value: 0.17338871024337962.
[I 2025-12-05 14:57:45,518] Trial 128 finished with value: 0.14631725052335776 and parameters: {'model_type': 'mlp', 'hidden_dims': '[512, 128]', 'dropout': 0.11284618288451466, 'batch_norm': False, 'lr': 0.0007322197436007075, 'weight_decay': 2.3573483844736938e-07, 'epochs': 198, 'loss': 'mae', 'optimizer': 'adam', 'graph_mode': 'off', 'use_snp_selection': True, 'num_snps': 43268}. Best is trial 59 with value: 0.17338871024337962.
[I 2025-12-05 14:57:47,558] Trial 129 finished with value: 0.16109487098579833 and parameters: {'model_type': 'mlp', 'hidden_dims': '[512, 128]', 'dropout': 0.12755506492667903, 'batch_norm': True, 'lr': 0.0009941884232734124, 'weight_decay': 1.2587713730625705e-07, 'epochs': 180, 'loss': 'mae', 'optimizer': 'adam', 'graph_mode': 'off', 'use_snp_selection': True, 'num_snps': 37880}. Best is trial 59 with value: 0.17338871024337962.
[I 2025-12-05 14:57:49,485] Trial 130 finished with value: 0.15934125323417958 and parameters: {'model_type': 'mlp', 'hidden_dims': '[512, 128]', 'dropout': 0.10013165704481253, 'batch_norm': True, 'lr': 0.0007003402544035365, 'weight_decay': 2.600538973580731e-07, 'epochs': 188, 'loss': 'mae', 'optimizer': 'adam', 'graph_mode': 'off', 'use_snp_selection': True, 'num_snps': 35203}. Best is trial 59 with value: 0.17338871024337962.
[I 2025-12-05 14:57:51,770] Trial 131 finished with value: 0.16219900923157438 and parameters: {'model_type': 'mlp', 'hidden_dims': '[512, 128]', 'dropout': 0.11275904010199518, 'batch_norm': True, 'lr': 0.0008563458181597667, 'weight_decay': 5.620912403038855e-07, 'epochs': 169, 'loss': 'mae', 'optimizer': 'adam', 'graph_mode': 'off', 'use_snp_selection': True, 'num_snps': 42136}. Best is trial 59 with value: 0.17338871024337962.
[I 2025-12-05 14:57:54,093] Trial 132 finished with value: 0.1664340494722257 and parameters: {'model_type': 'mlp', 'hidden_dims': '[512, 128]', 'dropout': 0.11323771067384404, 'batch_norm': True, 'lr': 0.0009182761045730447, 'weight_decay': 5.309012954473339e-07, 'epochs': 205, 'loss': 'mae', 'optimizer': 'adam', 'graph_mode': 'off', 'use_snp_selection': True, 'num_snps': 42728}. Best is trial 59 with value: 0.17338871024337962.
[I 2025-12-05 14:57:56,526] Trial 133 finished with value: 0.16798499238656336 and parameters: {'model_type': 'mlp', 'hidden_dims': '[512, 128]', 'dropout': 0.12224871227634457, 'batch_norm': True, 'lr': 0.0009871259471934683, 'weight_decay': 5.194855913379e-07, 'epochs': 206, 'loss': 'mae', 'optimizer': 'adam', 'graph_mode': 'off', 'use_snp_selection': True, 'num_snps': 45755}. Best is trial 59 with value: 0.17338871024337962.
[I 2025-12-05 14:57:58,947] Trial 134 finished with value: 0.16104135857065627 and parameters: {'model_type': 'mlp', 'hidden_dims': '[512, 128]', 'dropout': 0.12563957152053223, 'batch_norm': True, 'lr': 0.0009979918876350216, 'weight_decay': 5.530770087538043e-07, 'epochs': 218, 'loss': 'mae', 'optimizer': 'adam', 'graph_mode': 'off', 'use_snp_selection': True, 'num_snps': 44533}. Best is trial 59 with value: 0.17338871024337962.
[I 2025-12-05 14:58:01,372] Trial 135 finished with value: 0.14508353988006448 and parameters: {'model_type': 'mlp', 'hidden_dims': '[512, 128]', 'dropout': 0.11869482744630351, 'batch_norm': True, 'lr': 0.0008477473635031402, 'weight_decay': 8.895062527296498e-07, 'epochs': 202, 'loss': 'mae', 'optimizer': 'adam', 'graph_mode': 'off', 'use_snp_selection': True, 'num_snps': 45812}. Best is trial 59 with value: 0.17338871024337962.
