[I 2025-12-06 06:30:22,074] Trial 139 finished with value: 0.30368448452734764 and parameters: {'model_type': 'mlp', 'hidden_dims': '[512, 256]', 'dropout': 0.16190603431310469, 'batch_norm': False, 'lr': 5.8950165956427765e-06, 'weight_decay': 0.00020702341087304238, 'epochs': 171, 'loss': 'mse', 'optimizer': 'adam', 'graph_mode': 'off', 'use_snp_selection': False}. Best is trial 41 with value: 0.3104019414454807.
[I 2025-12-06 06:31:30,933] Trial 140 finished with value: 0.30811152100146966 and parameters: {'model_type': 'mlp', 'hidden_dims': '[512, 256]', 'dropout': 0.2175776405049589, 'batch_norm': False, 'lr': 3.776523244956823e-06, 'weight_decay': 2.3522785756517584e-05, 'epochs': 185, 'loss': 'mse', 'optimizer': 'adam', 'graph_mode': 'off', 'use_snp_selection': True, 'num_snps': 58880}. Best is trial 41 with value: 0.3104019414454807.
[I 2025-12-06 06:32:39,590] Trial 141 finished with value: 0.30431942983479054 and parameters: {'model_type': 'mlp', 'hidden_dims': '[512, 256]', 'dropout': 0.21492649798004906, 'batch_norm': False, 'lr': 3.666090132666954e-06, 'weight_decay': 1.9559637790978637e-05, 'epochs': 183, 'loss': 'mse', 'optimizer': 'adam', 'graph_mode': 'off', 'use_snp_selection': True, 'num_snps': 58858}. Best is trial 41 with value: 0.3104019414454807.
[I 2025-12-06 06:33:24,393] Trial 142 finished with value: 0.2961788079195264 and parameters: {'model_type': 'mlp', 'hidden_dims': '[512, 256]', 'dropout': 0.14927653421917914, 'batch_norm': False, 'lr': 4.874014405400412e-06, 'weight_decay': 2.6291142323543036e-05, 'epochs': 193, 'loss': 'mse', 'optimizer': 'adam', 'graph_mode': 'off', 'use_snp_selection': True, 'num_snps': 28926}. Best is trial 41 with value: 0.3104019414454807.
[I 2025-12-06 06:34:32,842] Trial 143 finished with value: 0.3056651094449182 and parameters: {'model_type': 'mlp', 'hidden_dims': '[512, 256]', 'dropout': 0.22276810493085303, 'batch_norm': False, 'lr': 4.074281303626993e-06, 'weight_decay': 3.315202747301419e-05, 'epochs': 178, 'loss': 'mse', 'optimizer': 'adam', 'graph_mode': 'off', 'use_snp_selection': True, 'num_snps': 59973}. Best is trial 41 with value: 0.3104019414454807.
[I 2025-12-06 06:35:23,339] Trial 144 finished with value: 0.3000318670922363 and parameters: {'model_type': 'mlp', 'hidden_dims': '[512, 256]', 'dropout': 0.23910555103668357, 'batch_norm': False, 'lr': 3.080911074656674e-06, 'weight_decay': 2.3103384767152688e-05, 'epochs': 79, 'loss': 'mse', 'optimizer': 'adam', 'graph_mode': 'off', 'use_snp_selection': True, 'num_snps': 57584}. Best is trial 41 with value: 0.3104019414454807.
[I 2025-12-06 06:36:08,578] Trial 145 finished with value: 0.2976029321554615 and parameters: {'model_type': 'mlp', 'hidden_dims': '[128, 64]', 'dropout': 0.18983255793037623, 'batch_norm': False, 'lr': 2.5948490525584537e-06, 'weight_decay': 1.5160023408874918e-05, 'epochs': 188, 'loss': 'mse', 'optimizer': 'adam', 'graph_mode': 'off', 'use_snp_selection': True, 'num_snps': 56411}. Best is trial 41 with value: 0.3104019414454807.
[I 2025-12-06 06:37:09,402] Trial 146 finished with value: 0.27478961909902405 and parameters: {'model_type': 'mlp', 'hidden_dims': '[512, 256]', 'dropout': 0.20505947388905865, 'batch_norm': True, 'lr': 4.700981580443625e-06, 'weight_decay': 1.3239077785804177e-05, 'epochs': 162, 'loss': 'mse', 'optimizer': 'adam', 'graph_mode': 'off', 'use_snp_selection': True, 'num_snps': 53330}. Best is trial 41 with value: 0.3104019414454807.
[I 2025-12-06 06:38:01,413] Trial 147 finished with value: 0.3078221109750977 and parameters: {'model_type': 'mlp', 'hidden_dims': '[512, 128]', 'dropout': 0.1714476884731635, 'batch_norm': False, 'lr': 5.783849656737944e-06, 'weight_decay': 5.897151543506837e-05, 'epochs': 97, 'loss': 'mse', 'optimizer': 'adam', 'graph_mode': 'off', 'use_snp_selection': True, 'num_snps': 55007}. Best is trial 41 with value: 0.3104019414454807.
[I 2025-12-06 06:38:47,154] Trial 148 finished with value: 0.3003160054938821 and parameters: {'model_type': 'mlp', 'hidden_dims': '[256, 128, 64]', 'dropout': 0.13940194809131115, 'batch_norm': False, 'lr': 5.776797209454696e-06, 'weight_decay': 5.828676608946406e-05, 'epochs': 111, 'loss': 'mse', 'optimizer': 'adam', 'graph_mode': 'off', 'use_snp_selection': True, 'num_snps': 55418}. Best is trial 41 with value: 0.3104019414454807.
[I 2025-12-06 06:39:40,221] Trial 149 finished with value: 0.2867602157462882 and parameters: {'model_type': 'mlp', 'hidden_dims': '[512, 128]', 'dropout': 0.17694990434208413, 'batch_norm': False, 'lr': 0.00016810307203217494, 'weight_decay': 8.182233246686283e-05, 'epochs': 96, 'loss': 'mse', 'optimizer': 'adam', 'graph_mode': 'off', 'use_snp_selection': True, 'num_snps': 57761}. Best is trial 41 with value: 0.3104019414454807.
[I 2025-12-06 06:40:37,192] Trial 0 finished with value: 0.2512423981055098 and parameters: {'model_type': 'mlp', 'hidden_dims': '[128, 64]', 'dropout': 0.199031432379812, 'batch_norm': True, 'lr': 1.8408544111075837e-06, 'weight_decay': 5.5136510071208614e-05, 'epochs': 336, 'loss': 'mae', 'optimizer': 'adam', 'graph_mode': 'off', 'use_snp_selection': True, 'num_snps': 43862}. Best is trial 0 with value: 0.2512423981055098.
[I 2025-12-06 06:41:03,962] Trial 1 finished with value: 0.27915427449409425 and parameters: {'model_type': 'mlp', 'hidden_dims': '[256, 128]', 'dropout': 0.4370668075331726, 'batch_norm': True, 'lr': 7.133471581159139e-05, 'weight_decay': 1.128633586803549e-05, 'epochs': 242, 'loss': 'mae', 'optimizer': 'adam', 'graph_mode': 'off', 'use_snp_selection': False}. Best is trial 1 with value: 0.27915427449409425.
[I 2025-12-06 06:41:30,691] Trial 2 finished with value: 0.2702606662156718 and parameters: {'model_type': 'mlp', 'hidden_dims': '[256, 128, 64]', 'dropout': 0.41314357415569625, 'batch_norm': False, 'lr': 3.952233718592101e-06, 'weight_decay': 0.00026754769258252603, 'epochs': 149, 'loss': 'mse', 'optimizer': 'adam', 'graph_mode': 'off', 'use_snp_selection': True, 'num_snps': 11571}. Best is trial 1 with value: 0.27915427449409425.
[I 2025-12-06 06:42:31,452] Trial 3 finished with value: 0.29046677075838767 and parameters: {'model_type': 'mlp', 'hidden_dims': '[512, 64]', 'dropout': 0.5938127374509361, 'batch_norm': False, 'lr': 5.67704586114731e-06, 'weight_decay': 2.4518087630137052e-05, 'epochs': 320, 'loss': 'mae', 'optimizer': 'adam', 'graph_mode': 'off', 'use_snp_selection': False}. Best is trial 3 with value: 0.29046677075838767.
[I 2025-12-06 06:43:32,213] Trial 4 finished with value: 0.27120073650872817 and parameters: {'model_type': 'mlp', 'hidden_dims': '[512, 128]', 'dropout': 0.25746343592134413, 'batch_norm': True, 'lr': 1.3467657668402788e-06, 'weight_decay': 0.00033087251918647806, 'epochs': 277, 'loss': 'mse', 'optimizer': 'adam', 'graph_mode': 'off', 'use_snp_selection': True, 'num_snps': 36675}. Best is trial 3 with value: 0.29046677075838767.
[I 2025-12-06 06:44:15,381] Trial 5 finished with value: 0.24234632843074838 and parameters: {'model_type': 'mlp', 'hidden_dims': '[512, 64]', 'dropout': 0.38275350994408375, 'batch_norm': True, 'lr': 1.5586664309232824e-06, 'weight_decay': 0.0008227664668621182, 'epochs': 145, 'loss': 'mae', 'optimizer': 'adam', 'graph_mode': 'off', 'use_snp_selection': True, 'num_snps': 32148}. Best is trial 3 with value: 0.29046677075838767.
[I 2025-12-06 06:44:38,096] Trial 6 finished with value: 0.28633563267107415 and parameters: {'model_type': 'mlp', 'hidden_dims': '[256, 128]', 'dropout': 0.3930109900265879, 'batch_norm': False, 'lr': 4.892964372128395e-05, 'weight_decay': 1.5809549317992182e-06, 'epochs': 199, 'loss': 'mse', 'optimizer': 'adam', 'graph_mode': 'off', 'use_snp_selection': False}. Best is trial 3 with value: 0.29046677075838767.
[I 2025-12-06 06:45:00,416] Trial 7 finished with value: 0.2907009487652231 and parameters: {'model_type': 'mlp', 'hidden_dims': '[512, 256]', 'dropout': 0.15343979219678458, 'batch_norm': True, 'lr': 6.234003099047341e-05, 'weight_decay': 3.894760610535477e-07, 'epochs': 97, 'loss': 'mse', 'optimizer': 'adam', 'graph_mode': 'off', 'use_snp_selection': False}. Best is trial 7 with value: 0.2907009487652231.
[I 2025-12-06 06:46:00,568] Trial 8 finished with value: 0.2894632047942721 and parameters: {'model_type': 'mlp', 'hidden_dims': '[512, 128]', 'dropout': 0.10743001231661406, 'batch_norm': True, 'lr': 0.00023728538449271062, 'weight_decay': 1.7629071578048637e-05, 'epochs': 312, 'loss': 'mae', 'optimizer': 'adam', 'graph_mode': 'off', 'use_snp_selection': False}. Best is trial 7 with value: 0.2907009487652231.
[I 2025-12-06 06:46:36,597] Trial 9 finished with value: 0.28703004360254125 and parameters: {'model_type': 'mlp', 'hidden_dims': '[512, 64]', 'dropout': 0.14505336736221927, 'batch_norm': True, 'lr': 5.8619638388111826e-05, 'weight_decay': 6.200156172669308e-07, 'epochs': 175, 'loss': 'mse', 'optimizer': 'adam', 'graph_mode': 'off', 'use_snp_selection': False}. Best is trial 7 with value: 0.2907009487652231.
[I 2025-12-06 06:46:48,988] Trial 10 finished with value: 0.2150648063249677 and parameters: {'model_type': 'mlp', 'hidden_dims': '[512, 256]', 'dropout': 0.2736992815328032, 'batch_norm': False, 'lr': 0.00032393778075602147, 'weight_decay': 1.1511946696017092e-07, 'epochs': 41, 'loss': 'mse', 'optimizer': 'adam', 'graph_mode': 'off', 'use_snp_selection': False}. Best is trial 7 with value: 0.2907009487652231.
[I 2025-12-06 06:47:07,663] Trial 11 finished with value: 0.26471788817745856 and parameters: {'model_type': 'mlp', 'hidden_dims': '[512, 256]', 'dropout': 0.583942291816117, 'batch_norm': False, 'lr': 7.811409765921478e-06, 'weight_decay': 2.0596806983850726e-06, 'epochs': 77, 'loss': 'mae', 'optimizer': 'adam', 'graph_mode': 'off', 'use_snp_selection': False}. Best is trial 7 with value: 0.2907009487652231.
[I 2025-12-06 06:47:29,099] Trial 12 finished with value: 0.2788387139932495 and parameters: {'model_type': 'mlp', 'hidden_dims': '[512, 256]', 'dropout': 0.5873431926823272, 'batch_norm': False, 'lr': 1.3209655691727925e-05, 'weight_decay': 1.3081036432574914e-07, 'epochs': 93, 'loss': 'mae', 'optimizer': 'adam', 'graph_mode': 'off', 'use_snp_selection': False}. Best is trial 7 with value: 0.2907009487652231.
[I 2025-12-06 06:48:15,464] Trial 13 finished with value: 0.2878208709203564 and parameters: {'model_type': 'mlp', 'hidden_dims': '[512, 64]', 'dropout': 0.5038644356477802, 'batch_norm': False, 'lr': 1.4304506621636526e-05, 'weight_decay': 4.373608364627903e-05, 'epochs': 237, 'loss': 'mse', 'optimizer': 'adam', 'graph_mode': 'off', 'use_snp_selection': False}. Best is trial 7 with value: 0.2907009487652231.
[I 2025-12-06 06:48:25,694] Trial 14 finished with value: 0.2818817979122728 and parameters: {'model_type': 'mlp', 'hidden_dims': '[128, 64]', 'dropout': 0.3012984444538551, 'batch_norm': True, 'lr': 0.0001457690241539883, 'weight_decay': 3.0607358611649674e-06, 'epochs': 114, 'loss': 'mse', 'optimizer': 'adam', 'graph_mode': 'off', 'use_snp_selection': False}. Best is trial 7 with value: 0.2907009487652231.
[I 2025-12-06 06:48:49,933] Trial 15 finished with value: 0.27499093872145164 and parameters: {'model_type': 'mlp', 'hidden_dims': '[256, 128, 64]', 'dropout': 0.48263162073930665, 'batch_norm': False, 'lr': 2.2873500775644262e-05, 'weight_decay': 3.9169083908621594e-07, 'epochs': 216, 'loss': 'mae', 'optimizer': 'adam', 'graph_mode': 'off', 'use_snp_selection': False}. Best is trial 7 with value: 0.2907009487652231.
[I 2025-12-06 06:49:45,158] Trial 16 finished with value: 0.2740828377178485 and parameters: {'model_type': 'mlp', 'hidden_dims': '[512, 256]', 'dropout': 0.20597729258687042, 'batch_norm': True, 'lr': 6.013316929814413e-06, 'weight_decay': 5.098763140321504e-06, 'epochs': 283, 'loss': 'mse', 'optimizer': 'adam', 'graph_mode': 'off', 'use_snp_selection': False}. Best is trial 7 with value: 0.2907009487652231.
[I 2025-12-06 06:50:50,812] Trial 17 finished with value: 0.21234314756462078 and parameters: {'model_type': 'mlp', 'hidden_dims': '[512, 64]', 'dropout': 0.32888830259108426, 'batch_norm': False, 'lr': 0.000906375209920231, 'weight_decay': 4.279596648260934e-05, 'epochs': 349, 'loss': 'mae', 'optimizer': 'adam', 'graph_mode': 'off', 'use_snp_selection': False}. Best is trial 7 with value: 0.2907009487652231.
[I 2025-12-06 06:51:54,674] Trial 18 finished with value: 0.28950722747137553 and parameters: {'model_type': 'mlp', 'hidden_dims': '[512, 256]', 'dropout': 0.5139576333133464, 'batch_norm': False, 'lr': 2.797772152750264e-05, 'weight_decay': 3.5038679530849885e-07, 'epochs': 164, 'loss': 'mse', 'optimizer': 'adam', 'graph_mode': 'off', 'use_snp_selection': True, 'num_snps': 58241}. Best is trial 7 with value: 0.2907009487652231.
[I 2025-12-06 06:52:08,415] Trial 19 finished with value: 0.2488889515506596 and parameters: {'model_type': 'mlp', 'hidden_dims': '[512, 64]', 'dropout': 0.21972527923816063, 'batch_norm': True, 'lr': 3.502882181800776e-06, 'weight_decay': 0.00015299712892081902, 'epochs': 49, 'loss': 'mae', 'optimizer': 'adam', 'graph_mode': 'off', 'use_snp_selection': False}. Best is trial 7 with value: 0.2907009487652231.
[I 2025-12-06 06:52:34,590] Trial 20 finished with value: 0.2820294200878775 and parameters: {'model_type': 'mlp', 'hidden_dims': '[512, 128]', 'dropout': 0.3479554994523537, 'batch_norm': False, 'lr': 0.00014058530570495862, 'weight_decay': 5.6086896540041565e-06, 'epochs': 121, 'loss': 'mae', 'optimizer': 'adam', 'graph_mode': 'off', 'use_snp_selection': False}. Best is trial 7 with value: 0.2907009487652231.
[I 2025-12-06 06:53:37,830] Trial 21 finished with value: 0.2910356074261394 and parameters: {'model_type': 'mlp', 'hidden_dims': '[512, 256]', 'dropout': 0.538584982289782, 'batch_norm': False, 'lr': 2.308656352011792e-05, 'weight_decay': 4.7602141248397423e-07, 'epochs': 161, 'loss': 'mse', 'optimizer': 'adam', 'graph_mode': 'off', 'use_snp_selection': True, 'num_snps': 57741}. Best is trial 21 with value: 0.2910356074261394.
[I 2025-12-06 06:54:34,398] Trial 22 finished with value: 0.2953904098504692 and parameters: {'model_type': 'mlp', 'hidden_dims': '[512, 256]', 'dropout': 0.5480149314797894, 'batch_norm': False, 'lr': 1.8536284099115774e-05, 'weight_decay': 7.805364826565781e-07, 'epochs': 112, 'loss': 'mse', 'optimizer': 'adam', 'graph_mode': 'off', 'use_snp_selection': True, 'num_snps': 59634}. Best is trial 22 with value: 0.2953904098504692.
[I 2025-12-06 06:55:24,518] Trial 23 finished with value: 0.29196628834362215 and parameters: {'model_type': 'mlp', 'hidden_dims': '[512, 256]', 'dropout': 0.5322371534764443, 'batch_norm': False, 'lr': 1.5869926392888467e-05, 'weight_decay': 9.258871311540186e-07, 'epochs': 80, 'loss': 'mse', 'optimizer': 'adam', 'graph_mode': 'off', 'use_snp_selection': True, 'num_snps': 57498}. Best is trial 22 with value: 0.2953904098504692.
[I 2025-12-06 06:56:14,057] Trial 24 finished with value: 0.2989587078928079 and parameters: {'model_type': 'mlp', 'hidden_dims': '[512, 256]', 'dropout': 0.5298743628767619, 'batch_norm': False, 'lr': 1.737888139176462e-05, 'weight_decay': 1.189032054179172e-06, 'epochs': 69, 'loss': 'mse', 'optimizer': 'adam', 'graph_mode': 'off', 'use_snp_selection': True, 'num_snps': 59828}. Best is trial 24 with value: 0.2989587078928079.
[I 2025-12-06 06:57:03,375] Trial 25 finished with value: 0.2973553472972892 and parameters: {'model_type': 'mlp', 'hidden_dims': '[512, 256]', 'dropout': 0.45559604197696124, 'batch_norm': False, 'lr': 1.2748491380445782e-05, 'weight_decay': 1.131407456617341e-06, 'epochs': 68, 'loss': 'mse', 'optimizer': 'adam', 'graph_mode': 'off', 'use_snp_selection': True, 'num_snps': 60000}. Best is trial 24 with value: 0.2989587078928079.
[I 2025-12-06 06:57:45,984] Trial 26 finished with value: 0.29975099303053165 and parameters: {'model_type': 'mlp', 'hidden_dims': '[512, 256]', 'dropout': 0.45259881665424695, 'batch_norm': False, 'lr': 1.1459880299341678e-05, 'weight_decay': 1.1842550409092657e-06, 'epochs': 64, 'loss': 'mse', 'optimizer': 'adam', 'graph_mode': 'off', 'use_snp_selection': True, 'num_snps': 47054}. Best is trial 26 with value: 0.29975099303053165.
[I 2025-12-06 06:58:27,667] Trial 27 finished with value: 0.29304288604755796 and parameters: {'model_type': 'mlp', 'hidden_dims': '[512, 256]', 'dropout': 0.4582248448853449, 'batch_norm': False, 'lr': 1.0002126808204742e-05, 'weight_decay': 2.070526894300854e-07, 'epochs': 60, 'loss': 'mse', 'optimizer': 'adam', 'graph_mode': 'off', 'use_snp_selection': True, 'num_snps': 45898}. Best is trial 26 with value: 0.29975099303053165.
[I 2025-12-06 06:59:10,865] Trial 28 finished with value: 0.28047391778224723 and parameters: {'model_type': 'mlp', 'hidden_dims': '[512, 256]', 'dropout': 0.45274148271225084, 'batch_norm': False, 'lr': 4.1137060232354485e-06, 'weight_decay': 1.253762816457099e-06, 'epochs': 68, 'loss': 'mse', 'optimizer': 'adam', 'graph_mode': 'off', 'use_snp_selection': True, 'num_snps': 46990}. Best is trial 26 with value: 0.29975099303053165.
[I 2025-12-06 06:59:50,246] Trial 29 finished with value: 0.2548614190177141 and parameters: {'model_type': 'mlp', 'hidden_dims': '[128, 64]', 'dropout': 0.4766502980550948, 'batch_norm': False, 'lr': 2.433376688355292e-06, 'weight_decay': 3.862766903309887e-06, 'epochs': 131, 'loss': 'mse', 'optimizer': 'adam', 'graph_mode': 'off', 'use_snp_selection': True, 'num_snps': 49138}. Best is trial 26 with value: 0.29975099303053165.
[I 2025-12-06 07:00:15,364] Trial 30 finished with value: 0.2797066598487287 and parameters: {'model_type': 'mlp', 'hidden_dims': '[256, 128]', 'dropout': 0.4230080847097564, 'batch_norm': False, 'lr': 3.950332594957027e-05, 'weight_decay': 9.145755516907455e-06, 'epochs': 40, 'loss': 'mse', 'optimizer': 'adam', 'graph_mode': 'off', 'use_snp_selection': True, 'num_snps': 13712}. Best is trial 26 with value: 0.29975099303053165.
[I 2025-12-06 07:01:08,753] Trial 31 finished with value: 0.29566956510788417 and parameters: {'model_type': 'mlp', 'hidden_dims': '[512, 256]', 'dropout': 0.5419824390652626, 'batch_norm': False, 'lr': 1.0273407939218448e-05, 'weight_decay': 8.367774605844134e-07, 'epochs': 98, 'loss': 'mse', 'optimizer': 'adam', 'graph_mode': 'off', 'use_snp_selection': True, 'num_snps': 58523}. Best is trial 26 with value: 0.29975099303053165.
[I 2025-12-06 07:01:58,140] Trial 32 finished with value: 0.2978434393427222 and parameters: {'model_type': 'mlp', 'hidden_dims': '[512, 256]', 'dropout': 0.5625249898294151, 'batch_norm': False, 'lr': 9.439039568045533e-06, 'weight_decay': 2.2268068130355924e-06, 'epochs': 93, 'loss': 'mse', 'optimizer': 'adam', 'graph_mode': 'off', 'use_snp_selection': True, 'num_snps': 52091}. Best is trial 26 with value: 0.29975099303053165.
[I 2025-12-06 07:02:37,760] Trial 33 finished with value: 0.27114124492429975 and parameters: {'model_type': 'mlp', 'hidden_dims': '[256, 128, 64]', 'dropout': 0.49538235144258447, 'batch_norm': False, 'lr': 7.255526789448723e-06, 'weight_decay': 2.316439586589913e-06, 'epochs': 61, 'loss': 'mse', 'optimizer': 'adam', 'graph_mode': 'off', 'use_snp_selection': True, 'num_snps': 51197}. Best is trial 26 with value: 0.29975099303053165.
[I 2025-12-06 07:03:25,657] Trial 34 finished with value: 0.29594952623419285 and parameters: {'model_type': 'mlp', 'hidden_dims': '[512, 256]', 'dropout': 0.5617205174721167, 'batch_norm': False, 'lr': 3.634465311972336e-05, 'weight_decay': 1.6590135078120931e-06, 'epochs': 83, 'loss': 'mse', 'optimizer': 'adam', 'graph_mode': 'off', 'use_snp_selection': True, 'num_snps': 51979}. Best is trial 26 with value: 0.29975099303053165.
[I 2025-12-06 07:03:59,173] Trial 35 finished with value: 0.2061336612073617 and parameters: {'model_type': 'mlp', 'hidden_dims': '[128, 64]', 'dropout': 0.44083202853396064, 'batch_norm': False, 'lr': 2.2104451098293453e-06, 'weight_decay': 7.944168888417749e-06, 'epochs': 63, 'loss': 'mse', 'optimizer': 'adam', 'graph_mode': 'off', 'use_snp_selection': True, 'num_snps': 38756}. Best is trial 26 with value: 0.29975099303053165.
[I 2025-12-06 07:04:35,938] Trial 36 finished with value: 0.29103614619753115 and parameters: {'model_type': 'mlp', 'hidden_dims': '[512, 256]', 'dropout': 0.3923490870327273, 'batch_norm': False, 'lr': 4.18641151602776e-06, 'weight_decay': 2.2171294912487298e-07, 'epochs': 128, 'loss': 'mse', 'optimizer': 'adam', 'graph_mode': 'off', 'use_snp_selection': True, 'num_snps': 24747}. Best is trial 26 with value: 0.29975099303053165.
[I 2025-12-06 07:05:19,491] Trial 37 finished with value: 0.29334079010437464 and parameters: {'model_type': 'mlp', 'hidden_dims': '[256, 128]', 'dropout': 0.5680524437383423, 'batch_norm': False, 'lr': 9.666574344392878e-06, 'weight_decay': 2.9978253665144847e-06, 'epochs': 105, 'loss': 'mse', 'optimizer': 'adam', 'graph_mode': 'off', 'use_snp_selection': True, 'num_snps': 52423}. Best is trial 26 with value: 0.29975099303053165.
[I 2025-12-06 07:06:05,837] Trial 38 finished with value: 0.18225277907934204 and parameters: {'model_type': 'mlp', 'hidden_dims': '[256, 128, 64]', 'dropout': 0.5165835594204332, 'batch_norm': False, 'lr': 1.0661807028389818e-06, 'weight_decay': 1.1357615489820293e-06, 'epochs': 137, 'loss': 'mse', 'optimizer': 'adam', 'graph_mode': 'off', 'use_snp_selection': True, 'num_snps': 52905}. Best is trial 26 with value: 0.29975099303053165.
[I 2025-12-06 07:06:28,228] Trial 39 finished with value: 0.19294002185018821 and parameters: {'model_type': 'mlp', 'hidden_dims': '[512, 256]', 'dropout': 0.3714858195952754, 'batch_norm': False, 'lr': 2.960680442651644e-06, 'weight_decay': 2.1988364313560856e-05, 'epochs': 87, 'loss': 'mse', 'optimizer': 'adam', 'graph_mode': 'off', 'use_snp_selection': True, 'num_snps': 2975}. Best is trial 26 with value: 0.29975099303053165.
