[I 2025-12-05 14:37:19,224] Trial 115 finished with value: 0.07717155024459343 and parameters: {'model_type': 'mlp', 'hidden_dims': '[512, 64]', 'dropout': 0.15745470859858834, 'batch_norm': False, 'lr': 4.139828422214087e-05, 'weight_decay': 0.00011603913145906441, 'epochs': 222, 'loss': 'mae', 'optimizer': 'adam', 'graph_mode': 'off', 'use_snp_selection': False}. Best is trial 44 with value: 0.11896642691647082.
[I 2025-12-05 14:37:20,431] Trial 116 finished with value: 0.056482508344865234 and parameters: {'model_type': 'mlp', 'hidden_dims': '[256, 128, 64]', 'dropout': 0.5053821398124488, 'batch_norm': False, 'lr': 2.809846370936283e-05, 'weight_decay': 7.469271266632809e-07, 'epochs': 160, 'loss': 'mse', 'optimizer': 'adam', 'graph_mode': 'off', 'use_snp_selection': False}. Best is trial 44 with value: 0.11896642691647082.
[I 2025-12-05 14:37:22,511] Trial 117 finished with value: 0.054896677303393676 and parameters: {'model_type': 'mlp', 'hidden_dims': '[512, 128]', 'dropout': 0.34379032021351236, 'batch_norm': True, 'lr': 5.810199143964337e-05, 'weight_decay': 1.5524000169067223e-06, 'epochs': 179, 'loss': 'mae', 'optimizer': 'adam', 'graph_mode': 'off', 'use_snp_selection': False}. Best is trial 44 with value: 0.11896642691647082.
[I 2025-12-05 14:37:24,040] Trial 118 finished with value: 0.05910798464352961 and parameters: {'model_type': 'mlp', 'hidden_dims': '[256, 128]', 'dropout': 0.24854708272843745, 'batch_norm': False, 'lr': 0.00018819088195223797, 'weight_decay': 9.285321948558496e-06, 'epochs': 239, 'loss': 'mae', 'optimizer': 'adam', 'graph_mode': 'off', 'use_snp_selection': True, 'num_snps': 15070}. Best is trial 44 with value: 0.11896642691647082.
[I 2025-12-05 14:37:26,297] Trial 119 finished with value: 0.097462523525666 and parameters: {'model_type': 'mlp', 'hidden_dims': '[512, 128]', 'dropout': 0.1720675507326418, 'batch_norm': False, 'lr': 7.24124535065349e-05, 'weight_decay': 5.865581642103305e-06, 'epochs': 205, 'loss': 'mae', 'optimizer': 'adam', 'graph_mode': 'off', 'use_snp_selection': False}. Best is trial 44 with value: 0.11896642691647082.
[I 2025-12-05 14:37:28,553] Trial 120 finished with value: 0.07741556366043001 and parameters: {'model_type': 'mlp', 'hidden_dims': '[512, 128]', 'dropout': 0.39446473116603303, 'batch_norm': False, 'lr': 0.0001306264055464068, 'weight_decay': 5.657214533041247e-06, 'epochs': 205, 'loss': 'mae', 'optimizer': 'adam', 'graph_mode': 'off', 'use_snp_selection': False}. Best is trial 44 with value: 0.11896642691647082.
[I 2025-12-05 14:37:30,881] Trial 121 finished with value: 0.0881115750407256 and parameters: {'model_type': 'mlp', 'hidden_dims': '[512, 128]', 'dropout': 0.14254208476360355, 'batch_norm': False, 'lr': 5.105879088677673e-05, 'weight_decay': 7.170383063989731e-06, 'epochs': 213, 'loss': 'mae', 'optimizer': 'adam', 'graph_mode': 'off', 'use_snp_selection': False}. Best is trial 44 with value: 0.11896642691647082.
[I 2025-12-05 14:37:33,026] Trial 122 finished with value: 0.10930667047800562 and parameters: {'model_type': 'mlp', 'hidden_dims': '[512, 128]', 'dropout': 0.18165865310091037, 'batch_norm': False, 'lr': 7.302718361561089e-05, 'weight_decay': 1.7511519259439475e-05, 'epochs': 190, 'loss': 'mae', 'optimizer': 'adam', 'graph_mode': 'off', 'use_snp_selection': False}. Best is trial 44 with value: 0.11896642691647082.
[I 2025-12-05 14:37:35,178] Trial 123 finished with value: 0.08589889574368174 and parameters: {'model_type': 'mlp', 'hidden_dims': '[512, 128]', 'dropout': 0.148088280289824, 'batch_norm': False, 'lr': 6.992833502926223e-05, 'weight_decay': 1.4361937792691149e-05, 'epochs': 191, 'loss': 'mae', 'optimizer': 'adam', 'graph_mode': 'off', 'use_snp_selection': False}. Best is trial 44 with value: 0.11896642691647082.
[I 2025-12-05 14:37:37,293] Trial 124 finished with value: 0.07304993591169812 and parameters: {'model_type': 'mlp', 'hidden_dims': '[512, 128]', 'dropout': 0.1673259665105485, 'batch_norm': False, 'lr': 0.0007794207317568247, 'weight_decay': 2.0251075896549567e-05, 'epochs': 185, 'loss': 'mae', 'optimizer': 'adam', 'graph_mode': 'off', 'use_snp_selection': False}. Best is trial 44 with value: 0.11896642691647082.
[I 2025-12-05 14:37:39,507] Trial 125 finished with value: 0.0824307446545619 and parameters: {'model_type': 'mlp', 'hidden_dims': '[512, 128]', 'dropout': 0.13080740351226972, 'batch_norm': False, 'lr': 0.0001650195230231536, 'weight_decay': 3.8965728997457246e-05, 'epochs': 199, 'loss': 'mae', 'optimizer': 'adam', 'graph_mode': 'off', 'use_snp_selection': False}. Best is trial 44 with value: 0.11896642691647082.
[I 2025-12-05 14:37:41,537] Trial 126 finished with value: 0.07364523553360752 and parameters: {'model_type': 'mlp', 'hidden_dims': '[512, 128]', 'dropout': 0.36510373391486173, 'batch_norm': False, 'lr': 9.607575075630642e-05, 'weight_decay': 1.1436397318800238e-05, 'epochs': 174, 'loss': 'mae', 'optimizer': 'adam', 'graph_mode': 'off', 'use_snp_selection': False}. Best is trial 44 with value: 0.11896642691647082.
[I 2025-12-05 14:37:43,829] Trial 127 finished with value: 0.06825012819575124 and parameters: {'model_type': 'mlp', 'hidden_dims': '[512, 128]', 'dropout': 0.21159609271746327, 'batch_norm': False, 'lr': 7.382948403051719e-05, 'weight_decay': 6.575654195261336e-06, 'epochs': 207, 'loss': 'mse', 'optimizer': 'adam', 'graph_mode': 'off', 'use_snp_selection': False}. Best is trial 44 with value: 0.11896642691647082.
[I 2025-12-05 14:37:45,978] Trial 128 finished with value: 0.03443653545138631 and parameters: {'model_type': 'mlp', 'hidden_dims': '[512, 128]', 'dropout': 0.185064580614465, 'batch_norm': True, 'lr': 3.9845262417870496e-05, 'weight_decay': 1.687590552741246e-05, 'epochs': 188, 'loss': 'mae', 'optimizer': 'adam', 'graph_mode': 'off', 'use_snp_selection': False}. Best is trial 44 with value: 0.11896642691647082.
[I 2025-12-05 14:37:47,240] Trial 129 finished with value: 0.054506212726877626 and parameters: {'model_type': 'mlp', 'hidden_dims': '[512, 128]', 'dropout': 0.38125112916547854, 'batch_norm': False, 'lr': 3.282250885307547e-05, 'weight_decay': 8.860949554665823e-06, 'epochs': 199, 'loss': 'mae', 'optimizer': 'adam', 'graph_mode': 'off', 'use_snp_selection': True, 'num_snps': 7165}. Best is trial 44 with value: 0.11896642691647082.
[I 2025-12-05 14:37:48,683] Trial 130 finished with value: 0.08255307730324943 and parameters: {'model_type': 'mlp', 'hidden_dims': '[256, 128]', 'dropout': 0.1741949668219514, 'batch_norm': False, 'lr': 6.329106870051952e-05, 'weight_decay': 8.021233098662451e-06, 'epochs': 229, 'loss': 'mae', 'optimizer': 'adam', 'graph_mode': 'off', 'use_snp_selection': False}. Best is trial 44 with value: 0.11896642691647082.
[I 2025-12-05 14:37:51,045] Trial 131 finished with value: 0.08550679908758561 and parameters: {'model_type': 'mlp', 'hidden_dims': '[512, 64]', 'dropout': 0.18790787949625035, 'batch_norm': False, 'lr': 5.0540743258697225e-05, 'weight_decay': 5.540735854932165e-07, 'epochs': 218, 'loss': 'mae', 'optimizer': 'adam', 'graph_mode': 'off', 'use_snp_selection': False}. Best is trial 44 with value: 0.11896642691647082.
[I 2025-12-05 14:37:53,338] Trial 132 finished with value: 0.07709836794021845 and parameters: {'model_type': 'mlp', 'hidden_dims': '[512, 256]', 'dropout': 0.2640653319552846, 'batch_norm': False, 'lr': 8.355209384882142e-05, 'weight_decay': 4.152336663625713e-06, 'epochs': 209, 'loss': 'mae', 'optimizer': 'adam', 'graph_mode': 'off', 'use_snp_selection': False}. Best is trial 44 with value: 0.11896642691647082.
[I 2025-12-05 14:37:55,526] Trial 133 finished with value: 0.09424949176398233 and parameters: {'model_type': 'mlp', 'hidden_dims': '[512, 128]', 'dropout': 0.19685328712659642, 'batch_norm': False, 'lr': 4.650691558452365e-05, 'weight_decay': 1.3552834108755832e-05, 'epochs': 196, 'loss': 'mae', 'optimizer': 'adam', 'graph_mode': 'off', 'use_snp_selection': False}. Best is trial 44 with value: 0.11896642691647082.
[I 2025-12-05 14:37:56,795] Trial 134 finished with value: 0.07596672945058408 and parameters: {'model_type': 'mlp', 'hidden_dims': '[256, 128]', 'dropout': 0.35650132224390385, 'batch_norm': False, 'lr': 3.5503610411647574e-05, 'weight_decay': 4.3426459645722777e-07, 'epochs': 179, 'loss': 'mae', 'optimizer': 'adam', 'graph_mode': 'off', 'use_snp_selection': False}. Best is trial 44 with value: 0.11896642691647082.
[I 2025-12-05 14:37:59,372] Trial 135 finished with value: 0.08622353730795955 and parameters: {'model_type': 'mlp', 'hidden_dims': '[512, 128]', 'dropout': 0.16826503020219383, 'batch_norm': False, 'lr': 5.804484386277465e-05, 'weight_decay': 1.1843868404132351e-06, 'epochs': 248, 'loss': 'mae', 'optimizer': 'adam', 'graph_mode': 'off', 'use_snp_selection': False}. Best is trial 44 with value: 0.11896642691647082.
[I 2025-12-05 14:38:00,801] Trial 136 finished with value: 0.08488331761656231 and parameters: {'model_type': 'mlp', 'hidden_dims': '[256, 128]', 'dropout': 0.33555660014548966, 'batch_norm': False, 'lr': 2.6895869091519155e-05, 'weight_decay': 2.4938730789959624e-05, 'epochs': 222, 'loss': 'mae', 'optimizer': 'adam', 'graph_mode': 'off', 'use_snp_selection': False}. Best is trial 44 with value: 0.11896642691647082.
[I 2025-12-05 14:38:03,270] Trial 137 finished with value: 0.06281184619850838 and parameters: {'model_type': 'mlp', 'hidden_dims': '[512, 128]', 'dropout': 0.12879867327584638, 'batch_norm': False, 'lr': 1.9666109894856684e-05, 'weight_decay': 2.144975717075546e-06, 'epochs': 234, 'loss': 'mae', 'optimizer': 'adam', 'graph_mode': 'off', 'use_snp_selection': False}. Best is trial 44 with value: 0.11896642691647082.
[I 2025-12-05 14:38:04,661] Trial 138 finished with value: 0.07482234016230806 and parameters: {'model_type': 'mlp', 'hidden_dims': '[256, 128, 64]', 'dropout': 0.15758097452088063, 'batch_norm': False, 'lr': 0.0003703315015738331, 'weight_decay': 4.990602131163648e-07, 'epochs': 212, 'loss': 'mse', 'optimizer': 'adam', 'graph_mode': 'off', 'use_snp_selection': False}. Best is trial 44 with value: 0.11896642691647082.
[I 2025-12-05 14:38:06,023] Trial 139 finished with value: 0.04124209018008578 and parameters: {'model_type': 'mlp', 'hidden_dims': '[256, 128]', 'dropout': 0.4201729900581867, 'batch_norm': True, 'lr': 7.55253835578934e-05, 'weight_decay': 0.0009043936909643864, 'epochs': 202, 'loss': 'mae', 'optimizer': 'adam', 'graph_mode': 'off', 'use_snp_selection': False}. Best is trial 44 with value: 0.11896642691647082.
[I 2025-12-05 14:38:08,033] Trial 140 finished with value: 0.09451062654738991 and parameters: {'model_type': 'mlp', 'hidden_dims': '[512, 64]', 'dropout': 0.44255625945303056, 'batch_norm': False, 'lr': 4.062743252964432e-05, 'weight_decay': 1.4910796389540302e-06, 'epochs': 192, 'loss': 'mae', 'optimizer': 'adam', 'graph_mode': 'off', 'use_snp_selection': True, 'num_snps': 22695}. Best is trial 44 with value: 0.11896642691647082.
[I 2025-12-05 14:38:10,123] Trial 141 finished with value: 0.0974662548594934 and parameters: {'model_type': 'mlp', 'hidden_dims': '[512, 128]', 'dropout': 0.29524999216482883, 'batch_norm': False, 'lr': 4.185850744027059e-05, 'weight_decay': 5.962844647454199e-07, 'epochs': 181, 'loss': 'mae', 'optimizer': 'adam', 'graph_mode': 'off', 'use_snp_selection': False}. Best is trial 44 with value: 0.11896642691647082.
[I 2025-12-05 14:38:12,217] Trial 142 finished with value: 0.07183254274753376 and parameters: {'model_type': 'mlp', 'hidden_dims': '[512, 128]', 'dropout': 0.28405242235627315, 'batch_norm': False, 'lr': 5.424816909443107e-05, 'weight_decay': 3.790826017186079e-07, 'epochs': 183, 'loss': 'mae', 'optimizer': 'adam', 'graph_mode': 'off', 'use_snp_selection': False}. Best is trial 44 with value: 0.11896642691647082.
[I 2025-12-05 14:38:14,230] Trial 143 finished with value: 0.08946529240445816 and parameters: {'model_type': 'mlp', 'hidden_dims': '[512, 128]', 'dropout': 0.3243204316362878, 'batch_norm': False, 'lr': 4.5387300484349965e-05, 'weight_decay': 8.847708253092798e-07, 'epochs': 172, 'loss': 'mae', 'optimizer': 'adam', 'graph_mode': 'off', 'use_snp_selection': False}. Best is trial 44 with value: 0.11896642691647082.
[I 2025-12-05 14:38:16,502] Trial 144 finished with value: 0.093592430808948 and parameters: {'model_type': 'mlp', 'hidden_dims': '[512, 128]', 'dropout': 0.29633070373604237, 'batch_norm': False, 'lr': 6.500671913360223e-05, 'weight_decay': 1.8128922277464787e-05, 'epochs': 205, 'loss': 'mae', 'optimizer': 'adam', 'graph_mode': 'off', 'use_snp_selection': False}. Best is trial 44 with value: 0.11896642691647082.
[I 2025-12-05 14:38:17,421] Trial 145 finished with value: 0.06520739722292479 and parameters: {'model_type': 'mlp', 'hidden_dims': '[128, 64]', 'dropout': 0.4688033223298457, 'batch_norm': False, 'lr': 0.00022300073670173092, 'weight_decay': 6.718168247364973e-07, 'epochs': 187, 'loss': 'mae', 'optimizer': 'adam', 'graph_mode': 'off', 'use_snp_selection': False}. Best is trial 44 with value: 0.11896642691647082.
[I 2025-12-05 14:38:19,753] Trial 146 finished with value: 0.11390265564613365 and parameters: {'model_type': 'mlp', 'hidden_dims': '[512, 256]', 'dropout': 0.311841640688876, 'batch_norm': False, 'lr': 3.701742597794964e-05, 'weight_decay': 1.1331715692045208e-05, 'epochs': 214, 'loss': 'mae', 'optimizer': 'adam', 'graph_mode': 'off', 'use_snp_selection': False}. Best is trial 44 with value: 0.11896642691647082.
[I 2025-12-05 14:38:21,734] Trial 147 finished with value: 0.08914101366058116 and parameters: {'model_type': 'mlp', 'hidden_dims': '[512, 256]', 'dropout': 0.3094116472958248, 'batch_norm': False, 'lr': 3.0967561376102244e-05, 'weight_decay': 1.0313172036978956e-05, 'epochs': 167, 'loss': 'mae', 'optimizer': 'adam', 'graph_mode': 'off', 'use_snp_selection': False}. Best is trial 44 with value: 0.11896642691647082.
[I 2025-12-05 14:38:23,936] Trial 148 finished with value: 0.07285768226091177 and parameters: {'model_type': 'mlp', 'hidden_dims': '[512, 256]', 'dropout': 0.31905658496921585, 'batch_norm': False, 'lr': 3.789500784643092e-05, 'weight_decay': 2.7563325645734487e-06, 'epochs': 197, 'loss': 'mae', 'optimizer': 'adam', 'graph_mode': 'off', 'use_snp_selection': False}. Best is trial 44 with value: 0.11896642691647082.
[I 2025-12-05 14:38:25,853] Trial 149 finished with value: 0.040423193415811264 and parameters: {'model_type': 'mlp', 'hidden_dims': '[512, 128]', 'dropout': 0.37150230712145105, 'batch_norm': False, 'lr': 0.0008738350066447111, 'weight_decay': 1.1769772582525839e-05, 'epochs': 156, 'loss': 'mae', 'optimizer': 'adam', 'graph_mode': 'off', 'use_snp_selection': False}. Best is trial 44 with value: 0.11896642691647082.
[I 2025-12-05 14:38:29,044] Trial 0 finished with value: 0.04225375783502773 and parameters: {'model_type': 'mlp', 'hidden_dims': '[128, 64]', 'dropout': 0.199031432379812, 'batch_norm': True, 'lr': 1.8408544111075837e-06, 'weight_decay': 5.5136510071208614e-05, 'epochs': 336, 'loss': 'mae', 'optimizer': 'adam', 'graph_mode': 'off', 'use_snp_selection': True, 'num_snps': 43862}. Best is trial 0 with value: 0.04225375783502773.
[I 2025-12-05 14:38:31,212] Trial 1 finished with value: 0.1365572218957897 and parameters: {'model_type': 'mlp', 'hidden_dims': '[256, 128]', 'dropout': 0.4370668075331726, 'batch_norm': True, 'lr': 7.133471581159139e-05, 'weight_decay': 1.128633586803549e-05, 'epochs': 242, 'loss': 'mae', 'optimizer': 'adam', 'graph_mode': 'off', 'use_snp_selection': False}. Best is trial 1 with value: 0.1365572218957897.
[I 2025-12-05 14:38:32,965] Trial 2 finished with value: 0.04324897565561709 and parameters: {'model_type': 'mlp', 'hidden_dims': '[256, 128, 64]', 'dropout': 0.41314357415569625, 'batch_norm': False, 'lr': 3.952233718592101e-06, 'weight_decay': 0.00026754769258252603, 'epochs': 149, 'loss': 'mse', 'optimizer': 'adam', 'graph_mode': 'off', 'use_snp_selection': True, 'num_snps': 11571}. Best is trial 1 with value: 0.1365572218957897.
[I 2025-12-05 14:38:37,408] Trial 3 finished with value: 0.12024457391756685 and parameters: {'model_type': 'mlp', 'hidden_dims': '[512, 64]', 'dropout': 0.5938127374509361, 'batch_norm': False, 'lr': 5.67704586114731e-06, 'weight_decay': 2.4518087630137052e-05, 'epochs': 320, 'loss': 'mae', 'optimizer': 'adam', 'graph_mode': 'off', 'use_snp_selection': False}. Best is trial 1 with value: 0.1365572218957897.
[I 2025-12-05 14:38:41,617] Trial 4 finished with value: 0.07048685731313356 and parameters: {'model_type': 'mlp', 'hidden_dims': '[512, 128]', 'dropout': 0.25746343592134413, 'batch_norm': True, 'lr': 1.3467657668402788e-06, 'weight_decay': 0.00033087251918647806, 'epochs': 277, 'loss': 'mse', 'optimizer': 'adam', 'graph_mode': 'off', 'use_snp_selection': True, 'num_snps': 36675}. Best is trial 1 with value: 0.1365572218957897.
[I 2025-12-05 14:38:44,701] Trial 5 finished with value: 0.06308752119687265 and parameters: {'model_type': 'mlp', 'hidden_dims': '[512, 64]', 'dropout': 0.38275350994408375, 'batch_norm': True, 'lr': 1.5586664309232824e-06, 'weight_decay': 0.0008227664668621182, 'epochs': 145, 'loss': 'mae', 'optimizer': 'adam', 'graph_mode': 'off', 'use_snp_selection': True, 'num_snps': 32148}. Best is trial 1 with value: 0.1365572218957897.
[I 2025-12-05 14:38:46,573] Trial 6 finished with value: 0.11616591908216714 and parameters: {'model_type': 'mlp', 'hidden_dims': '[256, 128]', 'dropout': 0.3930109900265879, 'batch_norm': False, 'lr': 4.892964372128395e-05, 'weight_decay': 1.5809549317992182e-06, 'epochs': 199, 'loss': 'mse', 'optimizer': 'adam', 'graph_mode': 'off', 'use_snp_selection': False}. Best is trial 1 with value: 0.1365572218957897.
[I 2025-12-05 14:38:48,450] Trial 7 finished with value: 0.11345317636489392 and parameters: {'model_type': 'mlp', 'hidden_dims': '[512, 256]', 'dropout': 0.15343979219678458, 'batch_norm': True, 'lr': 6.234003099047341e-05, 'weight_decay': 3.894760610535477e-07, 'epochs': 97, 'loss': 'mse', 'optimizer': 'adam', 'graph_mode': 'off', 'use_snp_selection': False}. Best is trial 1 with value: 0.1365572218957897.
[I 2025-12-05 14:38:52,843] Trial 8 finished with value: 0.15062274617222998 and parameters: {'model_type': 'mlp', 'hidden_dims': '[512, 128]', 'dropout': 0.10743001231661406, 'batch_norm': True, 'lr': 0.00023728538449271062, 'weight_decay': 1.7629071578048637e-05, 'epochs': 312, 'loss': 'mae', 'optimizer': 'adam', 'graph_mode': 'off', 'use_snp_selection': False}. Best is trial 8 with value: 0.15062274617222998.
[I 2025-12-05 14:38:55,646] Trial 9 finished with value: 0.13448524208952348 and parameters: {'model_type': 'mlp', 'hidden_dims': '[512, 64]', 'dropout': 0.14505336736221927, 'batch_norm': True, 'lr': 5.8619638388111826e-05, 'weight_decay': 6.200156172669308e-07, 'epochs': 175, 'loss': 'mse', 'optimizer': 'adam', 'graph_mode': 'off', 'use_snp_selection': False}. Best is trial 8 with value: 0.15062274617222998.
[I 2025-12-05 14:38:57,039] Trial 10 finished with value: 0.0608165625002078 and parameters: {'model_type': 'mlp', 'hidden_dims': '[512, 128]', 'dropout': 0.2800030442581858, 'batch_norm': False, 'lr': 0.0004919806695968258, 'weight_decay': 2.9953888095455486e-06, 'epochs': 55, 'loss': 'mae', 'optimizer': 'adam', 'graph_mode': 'off', 'use_snp_selection': False}. Best is trial 8 with value: 0.15062274617222998.
[I 2025-12-05 14:38:59,196] Trial 11 finished with value: 0.14205298211667505 and parameters: {'model_type': 'mlp', 'hidden_dims': '[256, 128]', 'dropout': 0.5025533409127559, 'batch_norm': True, 'lr': 0.0004219456914890788, 'weight_decay': 7.0869802591332905e-06, 'epochs': 239, 'loss': 'mae', 'optimizer': 'adam', 'graph_mode': 'off', 'use_snp_selection': False}. Best is trial 8 with value: 0.15062274617222998.
[I 2025-12-05 14:39:03,090] Trial 12 finished with value: 0.14671321543063334 and parameters: {'model_type': 'mlp', 'hidden_dims': '[512, 128]', 'dropout': 0.5266996967984326, 'batch_norm': True, 'lr': 0.0006753264773209732, 'weight_decay': 4.19780668911197e-06, 'epochs': 268, 'loss': 'mae', 'optimizer': 'adam', 'graph_mode': 'off', 'use_snp_selection': False}. Best is trial 8 with value: 0.15062274617222998.
[I 2025-12-05 14:39:07,181] Trial 13 finished with value: 0.1279303600155989 and parameters: {'model_type': 'mlp', 'hidden_dims': '[512, 128]', 'dropout': 0.5982500509908173, 'batch_norm': True, 'lr': 0.00020263148232071683, 'weight_decay': 1.3270569831995856e-07, 'epochs': 285, 'loss': 'mae', 'optimizer': 'adam', 'graph_mode': 'off', 'use_snp_selection': False}. Best is trial 8 with value: 0.15062274617222998.
[I 2025-12-05 14:39:11,262] Trial 14 finished with value: 0.14286295903847707 and parameters: {'model_type': 'mlp', 'hidden_dims': '[512, 128]', 'dropout': 0.3012984444538551, 'batch_norm': True, 'lr': 0.000922330603992367, 'weight_decay': 5.724103314313124e-05, 'epochs': 284, 'loss': 'mae', 'optimizer': 'adam', 'graph_mode': 'off', 'use_snp_selection': False}. Best is trial 8 with value: 0.15062274617222998.
[I 2025-12-05 14:39:14,729] Trial 15 finished with value: 0.14127697434944592 and parameters: {'model_type': 'mlp', 'hidden_dims': '[512, 128]', 'dropout': 0.5007053064244442, 'batch_norm': True, 'lr': 0.00018429018027102804, 'weight_decay': 3.4756887075882723e-06, 'epochs': 231, 'loss': 'mae', 'optimizer': 'adam', 'graph_mode': 'off', 'use_snp_selection': False}. Best is trial 8 with value: 0.15062274617222998.
[I 2025-12-05 14:39:17,630] Trial 16 finished with value: 0.05203096861438764 and parameters: {'model_type': 'mlp', 'hidden_dims': '[256, 128, 64]', 'dropout': 0.5018277706612104, 'batch_norm': True, 'lr': 1.2586985041154999e-05, 'weight_decay': 2.1685692407459168e-05, 'epochs': 350, 'loss': 'mae', 'optimizer': 'adam', 'graph_mode': 'off', 'use_snp_selection': False}. Best is trial 8 with value: 0.15062274617222998.
