[I 2025-12-05 18:31:51,944] Trial 57 finished with value: 0.18418085373612667 and parameters: {'model_type': 'mlp', 'hidden_dims': '[256, 128, 64]', 'dropout': 0.3310978515682992, 'batch_norm': False, 'lr': 2.9249081053592883e-06, 'weight_decay': 2.1055936485192273e-07, 'epochs': 299, 'loss': 'mae', 'optimizer': 'adam', 'graph_mode': 'off', 'use_snp_selection': True, 'num_snps': 36072}. Best is trial 19 with value: 0.19602741631124895.
[I 2025-12-05 18:32:53,392] Trial 58 finished with value: 0.13137819680611273 and parameters: {'model_type': 'mlp', 'hidden_dims': '[512, 256]', 'dropout': 0.4029901221741644, 'batch_norm': True, 'lr': 2.075383041203911e-06, 'weight_decay': 2.2106296145352383e-05, 'epochs': 188, 'loss': 'mae', 'optimizer': 'adam', 'graph_mode': 'off', 'use_snp_selection': False}. Best is trial 19 with value: 0.19602741631124895.
[I 2025-12-05 18:34:11,776] Trial 59 finished with value: 0.19014375562335198 and parameters: {'model_type': 'mlp', 'hidden_dims': '[512, 64]', 'dropout': 0.46952190779840125, 'batch_norm': False, 'lr': 4.259847872979166e-06, 'weight_decay': 0.000152838681423953, 'epochs': 319, 'loss': 'mae', 'optimizer': 'adam', 'graph_mode': 'off', 'use_snp_selection': True, 'num_snps': 28154}. Best is trial 19 with value: 0.19602741631124895.
[I 2025-12-05 18:35:40,990] Trial 60 finished with value: 0.18400804300462523 and parameters: {'model_type': 'mlp', 'hidden_dims': '[512, 128]', 'dropout': 0.5452821384844071, 'batch_norm': False, 'lr': 9.251414790541006e-06, 'weight_decay': 1.6138641751134297e-06, 'epochs': 289, 'loss': 'mae', 'optimizer': 'adam', 'graph_mode': 'off', 'use_snp_selection': False}. Best is trial 19 with value: 0.19602741631124895.
[I 2025-12-05 18:37:25,860] Trial 61 finished with value: 0.18241327139722033 and parameters: {'model_type': 'mlp', 'hidden_dims': '[512, 64]', 'dropout': 0.15777666071681193, 'batch_norm': False, 'lr': 6.311873447724838e-06, 'weight_decay': 0.0001069792273228531, 'epochs': 341, 'loss': 'mae', 'optimizer': 'adam', 'graph_mode': 'off', 'use_snp_selection': False}. Best is trial 19 with value: 0.19602741631124895.
[I 2025-12-05 18:39:05,221] Trial 62 finished with value: 0.18095116799832017 and parameters: {'model_type': 'mlp', 'hidden_dims': '[512, 64]', 'dropout': 0.101963359490823, 'batch_norm': False, 'lr': 2.7632540397548445e-06, 'weight_decay': 7.417416022752646e-05, 'epochs': 321, 'loss': 'mae', 'optimizer': 'adam', 'graph_mode': 'off', 'use_snp_selection': False}. Best is trial 19 with value: 0.19602741631124895.
[I 2025-12-05 18:40:51,304] Trial 63 finished with value: 0.19221964295418864 and parameters: {'model_type': 'mlp', 'hidden_dims': '[512, 64]', 'dropout': 0.12737543039876367, 'batch_norm': False, 'lr': 3.817143701246774e-06, 'weight_decay': 5.380200890450452e-05, 'epochs': 345, 'loss': 'mae', 'optimizer': 'adam', 'graph_mode': 'off', 'use_snp_selection': False}. Best is trial 19 with value: 0.19602741631124895.
[I 2025-12-05 18:42:19,681] Trial 64 finished with value: 0.18726254031904113 and parameters: {'model_type': 'mlp', 'hidden_dims': '[512, 64]', 'dropout': 0.1276906735103239, 'batch_norm': False, 'lr': 1.440534499401783e-06, 'weight_decay': 3.0318866142781975e-05, 'epochs': 283, 'loss': 'mae', 'optimizer': 'adam', 'graph_mode': 'off', 'use_snp_selection': False}. Best is trial 19 with value: 0.19602741631124895.
[I 2025-12-05 18:44:02,317] Trial 65 finished with value: 0.1887749151312012 and parameters: {'model_type': 'mlp', 'hidden_dims': '[512, 64]', 'dropout': 0.17524547969709786, 'batch_norm': False, 'lr': 4.020721781895645e-06, 'weight_decay': 6.0556200611065284e-05, 'epochs': 333, 'loss': 'mae', 'optimizer': 'adam', 'graph_mode': 'off', 'use_snp_selection': False}. Best is trial 19 with value: 0.19602741631124895.
[I 2025-12-05 18:45:55,236] Trial 66 finished with value: 0.18587530038112535 and parameters: {'model_type': 'mlp', 'hidden_dims': '[512, 64]', 'dropout': 0.1579234437804267, 'batch_norm': False, 'lr': 2.010480396938628e-06, 'weight_decay': 4.313733488574102e-05, 'epochs': 307, 'loss': 'mae', 'optimizer': 'adam', 'graph_mode': 'off', 'use_snp_selection': True, 'num_snps': 47902}. Best is trial 19 with value: 0.19602741631124895.
[I 2025-12-05 18:46:52,454] Trial 67 finished with value: 0.18357282437483957 and parameters: {'model_type': 'mlp', 'hidden_dims': '[256, 128]', 'dropout': 0.19397522716939727, 'batch_norm': False, 'lr': 1.2396916939850792e-06, 'weight_decay': 0.0004917783154403117, 'epochs': 350, 'loss': 'mae', 'optimizer': 'adam', 'graph_mode': 'off', 'use_snp_selection': False}. Best is trial 19 with value: 0.19602741631124895.
[I 2025-12-05 18:48:47,180] Trial 68 finished with value: 0.18283404352910554 and parameters: {'model_type': 'mlp', 'hidden_dims': '[512, 64]', 'dropout': 0.5957265846778377, 'batch_norm': False, 'lr': 3.762394399013141e-06, 'weight_decay': 0.00016191604348770295, 'epochs': 258, 'loss': 'mse', 'optimizer': 'adam', 'graph_mode': 'off', 'use_snp_selection': True, 'num_snps': 55833}. Best is trial 19 with value: 0.19602741631124895.
[I 2025-12-05 18:49:18,086] Trial 69 finished with value: 0.17146119184690098 and parameters: {'model_type': 'mlp', 'hidden_dims': '[128, 64]', 'dropout': 0.5060360499126809, 'batch_norm': False, 'lr': 2.728435787798912e-06, 'weight_decay': 8.921442297517834e-05, 'epochs': 339, 'loss': 'mae', 'optimizer': 'adam', 'graph_mode': 'off', 'use_snp_selection': False}. Best is trial 19 with value: 0.19602741631124895.
[I 2025-12-05 18:50:42,417] Trial 70 finished with value: 0.18345397486567094 and parameters: {'model_type': 'mlp', 'hidden_dims': '[512, 64]', 'dropout': 0.49213991000825785, 'batch_norm': False, 'lr': 1.1057267841864982e-05, 'weight_decay': 1.6273846794485472e-05, 'epochs': 226, 'loss': 'mae', 'optimizer': 'adam', 'graph_mode': 'off', 'use_snp_selection': True, 'num_snps': 40487}. Best is trial 19 with value: 0.19602741631124895.
[I 2025-12-05 18:52:29,331] Trial 71 finished with value: 0.19241322679436107 and parameters: {'model_type': 'mlp', 'hidden_dims': '[512, 64]', 'dropout': 0.12477101761436818, 'batch_norm': False, 'lr': 8.524049230631304e-06, 'weight_decay': 5.551632025331465e-05, 'epochs': 350, 'loss': 'mae', 'optimizer': 'adam', 'graph_mode': 'off', 'use_snp_selection': False}. Best is trial 19 with value: 0.19602741631124895.
[I 2025-12-05 18:54:10,821] Trial 72 finished with value: 0.18888867535873594 and parameters: {'model_type': 'mlp', 'hidden_dims': '[512, 64]', 'dropout': 0.1382591206700686, 'batch_norm': False, 'lr': 5.244847183292789e-06, 'weight_decay': 5.219768225742946e-05, 'epochs': 328, 'loss': 'mae', 'optimizer': 'adam', 'graph_mode': 'off', 'use_snp_selection': False}. Best is trial 19 with value: 0.19602741631124895.
[I 2025-12-05 18:55:56,012] Trial 73 finished with value: 0.18293585173575186 and parameters: {'model_type': 'mlp', 'hidden_dims': '[512, 64]', 'dropout': 0.11317209210870117, 'batch_norm': False, 'lr': 7.4579204611073595e-06, 'weight_decay': 3.3572331532669315e-05, 'epochs': 341, 'loss': 'mae', 'optimizer': 'adam', 'graph_mode': 'off', 'use_snp_selection': False}. Best is trial 19 with value: 0.19602741631124895.
[I 2025-12-05 18:57:32,308] Trial 74 finished with value: 0.18259805420226435 and parameters: {'model_type': 'mlp', 'hidden_dims': '[512, 64]', 'dropout': 0.15246301387006866, 'batch_norm': False, 'lr': 1.772291067017737e-05, 'weight_decay': 0.000253044571164925, 'epochs': 314, 'loss': 'mae', 'optimizer': 'adam', 'graph_mode': 'off', 'use_snp_selection': False}. Best is trial 19 with value: 0.19602741631124895.
[I 2025-12-05 18:58:26,201] Trial 75 finished with value: 0.19157831596246006 and parameters: {'model_type': 'mlp', 'hidden_dims': '[256, 128, 64]', 'dropout': 0.251323259364043, 'batch_norm': False, 'lr': 3.4495330000301785e-06, 'weight_decay': 8.779742171950236e-06, 'epochs': 324, 'loss': 'mae', 'optimizer': 'adam', 'graph_mode': 'off', 'use_snp_selection': False}. Best is trial 19 with value: 0.19602741631124895.
[I 2025-12-05 18:59:19,928] Trial 76 finished with value: 0.18242844190483232 and parameters: {'model_type': 'mlp', 'hidden_dims': '[256, 128, 64]', 'dropout': 0.20786667222383853, 'batch_norm': False, 'lr': 1.4617206194351618e-05, 'weight_decay': 7.49779315622462e-05, 'epochs': 324, 'loss': 'mae', 'optimizer': 'adam', 'graph_mode': 'off', 'use_snp_selection': False}. Best is trial 19 with value: 0.19602741631124895.
[I 2025-12-05 19:00:10,041] Trial 77 finished with value: 0.158442771835882 and parameters: {'model_type': 'mlp', 'hidden_dims': '[256, 128, 64]', 'dropout': 0.12111615421735149, 'batch_norm': True, 'lr': 2.7047087117568148e-05, 'weight_decay': 8.24792148156431e-06, 'epochs': 349, 'loss': 'mae', 'optimizer': 'adam', 'graph_mode': 'off', 'use_snp_selection': True, 'num_snps': 16518}. Best is trial 19 with value: 0.19602741631124895.
[I 2025-12-05 19:01:04,052] Trial 78 finished with value: 0.18875401480253534 and parameters: {'model_type': 'mlp', 'hidden_dims': '[256, 128, 64]', 'dropout': 0.2555185024613274, 'batch_norm': False, 'lr': 8.987524035299345e-06, 'weight_decay': 1.0686014588934123e-06, 'epochs': 329, 'loss': 'mae', 'optimizer': 'adam', 'graph_mode': 'off', 'use_snp_selection': False}. Best is trial 19 with value: 0.19602741631124895.
[I 2025-12-05 19:01:54,258] Trial 79 finished with value: 0.1298572749928209 and parameters: {'model_type': 'mlp', 'hidden_dims': '[256, 128, 64]', 'dropout': 0.4314899119394073, 'batch_norm': False, 'lr': 0.0006719931804292528, 'weight_decay': 0.0002092726847528347, 'epochs': 310, 'loss': 'mse', 'optimizer': 'adam', 'graph_mode': 'off', 'use_snp_selection': False}. Best is trial 19 with value: 0.19602741631124895.
[I 2025-12-05 19:03:24,380] Trial 80 finished with value: 0.1813480871190249 and parameters: {'model_type': 'mlp', 'hidden_dims': '[512, 256]', 'dropout': 0.16944149381363116, 'batch_norm': False, 'lr': 3.4063990529095114e-06, 'weight_decay': 0.0003213688756618288, 'epochs': 342, 'loss': 'mae', 'optimizer': 'adam', 'graph_mode': 'off', 'use_snp_selection': True, 'num_snps': 32421}. Best is trial 19 with value: 0.19602741631124895.
[I 2025-12-05 19:04:57,998] Trial 81 finished with value: 0.18560837275819883 and parameters: {'model_type': 'mlp', 'hidden_dims': '[512, 64]', 'dropout': 0.2842484838133815, 'batch_norm': False, 'lr': 4.678039925211287e-06, 'weight_decay': 2.4534521816554375e-05, 'epochs': 303, 'loss': 'mae', 'optimizer': 'adam', 'graph_mode': 'off', 'use_snp_selection': False}. Best is trial 19 with value: 0.19602741631124895.
[I 2025-12-05 19:06:37,248] Trial 82 finished with value: 0.1974749614965266 and parameters: {'model_type': 'mlp', 'hidden_dims': '[512, 64]', 'dropout': 0.2286792825839225, 'batch_norm': False, 'lr': 1.6078473406215825e-06, 'weight_decay': 1.9586134257435713e-05, 'epochs': 321, 'loss': 'mae', 'optimizer': 'adam', 'graph_mode': 'off', 'use_snp_selection': False}. Best is trial 82 with value: 0.1974749614965266.
[I 2025-12-05 19:08:16,263] Trial 83 finished with value: 0.1829142370290036 and parameters: {'model_type': 'mlp', 'hidden_dims': '[512, 64]', 'dropout': 0.19421058430920152, 'batch_norm': False, 'lr': 1.7027836913530931e-06, 'weight_decay': 5.4202886030845366e-05, 'epochs': 320, 'loss': 'mae', 'optimizer': 'adam', 'graph_mode': 'off', 'use_snp_selection': False}. Best is trial 82 with value: 0.1974749614965266.
[I 2025-12-05 19:09:58,630] Trial 84 finished with value: 0.18793406569340057 and parameters: {'model_type': 'mlp', 'hidden_dims': '[512, 128]', 'dropout': 0.536436974628037, 'batch_norm': False, 'lr': 6.099233933112636e-06, 'weight_decay': 0.0001353907785838401, 'epochs': 333, 'loss': 'mae', 'optimizer': 'adam', 'graph_mode': 'off', 'use_snp_selection': False}. Best is trial 82 with value: 0.1974749614965266.
[I 2025-12-05 19:11:39,385] Trial 85 finished with value: 0.1897259109299912 and parameters: {'model_type': 'mlp', 'hidden_dims': '[512, 64]', 'dropout': 0.24536918989745946, 'batch_norm': False, 'lr': 2.526698379678679e-06, 'weight_decay': 1.897731265899783e-05, 'epochs': 326, 'loss': 'mae', 'optimizer': 'adam', 'graph_mode': 'off', 'use_snp_selection': False}. Best is trial 82 with value: 0.1974749614965266.
[I 2025-12-05 19:12:27,627] Trial 86 finished with value: 0.1848795651448574 and parameters: {'model_type': 'mlp', 'hidden_dims': '[256, 128]', 'dropout': 0.5173741362486217, 'batch_norm': False, 'lr': 3.154432752430188e-06, 'weight_decay': 2.8409634957556066e-05, 'epochs': 287, 'loss': 'mae', 'optimizer': 'adam', 'graph_mode': 'off', 'use_snp_selection': False}. Best is trial 82 with value: 0.1974749614965266.
[I 2025-12-05 19:14:13,115] Trial 87 finished with value: 0.18303215848124063 and parameters: {'model_type': 'mlp', 'hidden_dims': '[512, 64]', 'dropout': 0.22407373537693498, 'batch_norm': False, 'lr': 1.2187808729970636e-06, 'weight_decay': 3.790685592243438e-05, 'epochs': 343, 'loss': 'mae', 'optimizer': 'adam', 'graph_mode': 'off', 'use_snp_selection': False}. Best is trial 82 with value: 0.1974749614965266.
[I 2025-12-05 19:15:29,737] Trial 88 finished with value: 0.11252764278404999 and parameters: {'model_type': 'mlp', 'hidden_dims': '[256, 128, 64]', 'dropout': 0.20653346046045729, 'batch_norm': True, 'lr': 1.6287202306041578e-06, 'weight_decay': 1.1594945783358763e-05, 'epochs': 311, 'loss': 'mae', 'optimizer': 'adam', 'graph_mode': 'off', 'use_snp_selection': True, 'num_snps': 43278}. Best is trial 82 with value: 0.1974749614965266.
[I 2025-12-05 19:16:00,213] Trial 89 finished with value: 0.1913734777910105 and parameters: {'model_type': 'mlp', 'hidden_dims': '[128, 64]', 'dropout': 0.2656778727994038, 'batch_norm': False, 'lr': 5.1819682392933235e-06, 'weight_decay': 2.6239168045515285e-06, 'epochs': 335, 'loss': 'mae', 'optimizer': 'adam', 'graph_mode': 'off', 'use_snp_selection': False}. Best is trial 82 with value: 0.1974749614965266.
[I 2025-12-05 19:17:38,303] Trial 90 finished with value: 0.18474123153411623 and parameters: {'model_type': 'mlp', 'hidden_dims': '[512, 64]', 'dropout': 0.3134030927116046, 'batch_norm': False, 'lr': 4.087166473038778e-06, 'weight_decay': 0.00011714681923359483, 'epochs': 318, 'loss': 'mae', 'optimizer': 'adam', 'graph_mode': 'off', 'use_snp_selection': False}. Best is trial 82 with value: 0.1974749614965266.
[I 2025-12-05 19:18:08,949] Trial 91 finished with value: 0.19128230466782667 and parameters: {'model_type': 'mlp', 'hidden_dims': '[128, 64]', 'dropout': 0.2699517669848327, 'batch_norm': False, 'lr': 5.010904455258192e-06, 'weight_decay': 2.859153065211159e-06, 'epochs': 334, 'loss': 'mae', 'optimizer': 'adam', 'graph_mode': 'off', 'use_snp_selection': False}. Best is trial 82 with value: 0.1974749614965266.
[I 2025-12-05 19:18:40,886] Trial 92 finished with value: 0.1847030502682209 and parameters: {'model_type': 'mlp', 'hidden_dims': '[128, 64]', 'dropout': 0.2403015693443833, 'batch_norm': False, 'lr': 7.928551345651057e-06, 'weight_decay': 2.257455251293914e-06, 'epochs': 350, 'loss': 'mae', 'optimizer': 'adam', 'graph_mode': 'off', 'use_snp_selection': False}. Best is trial 82 with value: 0.1974749614965266.
[I 2025-12-05 19:19:08,929] Trial 93 finished with value: 0.17917931092921074 and parameters: {'model_type': 'mlp', 'hidden_dims': '[128, 64]', 'dropout': 0.2576585582173116, 'batch_norm': False, 'lr': 3.5145526239690035e-06, 'weight_decay': 5.4962790936310985e-06, 'epochs': 298, 'loss': 'mae', 'optimizer': 'adam', 'graph_mode': 'off', 'use_snp_selection': False}. Best is trial 82 with value: 0.1974749614965266.
[I 2025-12-05 19:19:35,183] Trial 94 finished with value: 0.17455187959697196 and parameters: {'model_type': 'mlp', 'hidden_dims': '[128, 64]', 'dropout': 0.21703306993382965, 'batch_norm': False, 'lr': 2.095604089543595e-06, 'weight_decay': 7.38765829994247e-07, 'epochs': 274, 'loss': 'mae', 'optimizer': 'adam', 'graph_mode': 'off', 'use_snp_selection': False}. Best is trial 82 with value: 0.1974749614965266.
[I 2025-12-05 19:21:18,810] Trial 95 finished with value: 0.18834092210084213 and parameters: {'model_type': 'mlp', 'hidden_dims': '[512, 64]', 'dropout': 0.29419640812890235, 'batch_norm': False, 'lr': 2.5165734730075055e-06, 'weight_decay': 8.232370130464025e-06, 'epochs': 336, 'loss': 'mae', 'optimizer': 'adam', 'graph_mode': 'off', 'use_snp_selection': False}. Best is trial 82 with value: 0.1974749614965266.
[I 2025-12-05 19:22:57,042] Trial 96 finished with value: 0.18146228013415835 and parameters: {'model_type': 'mlp', 'hidden_dims': '[512, 64]', 'dropout': 0.564337356697187, 'batch_norm': False, 'lr': 0.00010351174069322486, 'weight_decay': 1.1720898253324306e-06, 'epochs': 326, 'loss': 'mse', 'optimizer': 'adam', 'graph_mode': 'off', 'use_snp_selection': False}. Best is trial 82 with value: 0.1974749614965266.
[I 2025-12-05 19:23:31,877] Trial 97 finished with value: 0.14640843609015233 and parameters: {'model_type': 'mlp', 'hidden_dims': '[512, 64]', 'dropout': 0.14239318898901832, 'batch_norm': False, 'lr': 3.8697074376630254e-05, 'weight_decay': 3.7530423251277804e-06, 'epochs': 345, 'loss': 'mae', 'optimizer': 'adam', 'graph_mode': 'off', 'use_snp_selection': True, 'num_snps': 2218}. Best is trial 82 with value: 0.1974749614965266.
[I 2025-12-05 19:24:00,022] Trial 98 finished with value: 0.19028867464247137 and parameters: {'model_type': 'mlp', 'hidden_dims': '[128, 64]', 'dropout': 0.4755019309345116, 'batch_norm': False, 'lr': 6.513585863389173e-06, 'weight_decay': 0.00040188208379361153, 'epochs': 305, 'loss': 'mae', 'optimizer': 'adam', 'graph_mode': 'off', 'use_snp_selection': False}. Best is trial 82 with value: 0.1974749614965266.
[I 2025-12-05 19:24:49,337] Trial 99 finished with value: 0.19884837975887945 and parameters: {'model_type': 'mlp', 'hidden_dims': '[512, 64]', 'dropout': 0.4574182844634307, 'batch_norm': False, 'lr': 5.248938585995757e-06, 'weight_decay': 8.84274867429868e-05, 'epochs': 148, 'loss': 'mae', 'optimizer': 'adam', 'graph_mode': 'off', 'use_snp_selection': False}. Best is trial 99 with value: 0.19884837975887945.
[I 2025-12-05 19:26:08,849] Trial 100 finished with value: 0.17835568041389374 and parameters: {'model_type': 'mlp', 'hidden_dims': '[512, 64]', 'dropout': 0.5012586722049104, 'batch_norm': False, 'lr': 2.916904988353632e-06, 'weight_decay': 8.312143523744649e-05, 'epochs': 131, 'loss': 'mae', 'optimizer': 'adam', 'graph_mode': 'off', 'use_snp_selection': True, 'num_snps': 52021}. Best is trial 99 with value: 0.19884837975887945.
[I 2025-12-05 19:27:00,934] Trial 101 finished with value: 0.1917145118287154 and parameters: {'model_type': 'mlp', 'hidden_dims': '[512, 64]', 'dropout': 0.5217290180693687, 'batch_norm': False, 'lr': 5.255962171849943e-06, 'weight_decay': 0.00010731199671997116, 'epochs': 159, 'loss': 'mae', 'optimizer': 'adam', 'graph_mode': 'off', 'use_snp_selection': False}. Best is trial 99 with value: 0.19884837975887945.
[I 2025-12-05 19:27:55,289] Trial 102 finished with value: 0.18590169876641624 and parameters: {'model_type': 'mlp', 'hidden_dims': '[512, 64]', 'dropout': 0.4591949807667338, 'batch_norm': False, 'lr': 1.0878263473357106e-05, 'weight_decay': 0.00018352286425601962, 'epochs': 166, 'loss': 'mae', 'optimizer': 'adam', 'graph_mode': 'off', 'use_snp_selection': False}. Best is trial 99 with value: 0.19884837975887945.
[I 2025-12-05 19:28:44,248] Trial 103 finished with value: 0.18523390916050123 and parameters: {'model_type': 'mlp', 'hidden_dims': '[512, 64]', 'dropout': 0.48779208128104296, 'batch_norm': False, 'lr': 4.562976902850335e-06, 'weight_decay': 6.712380846637906e-05, 'epochs': 146, 'loss': 'mae', 'optimizer': 'adam', 'graph_mode': 'off', 'use_snp_selection': False}. Best is trial 99 with value: 0.19884837975887945.
[I 2025-12-05 19:29:38,040] Trial 104 finished with value: 0.20611400028218546 and parameters: {'model_type': 'mlp', 'hidden_dims': '[512, 64]', 'dropout': 0.5158912935711838, 'batch_norm': False, 'lr': 4.057664316154951e-06, 'weight_decay': 0.00010545288076174893, 'epochs': 163, 'loss': 'mae', 'optimizer': 'adam', 'graph_mode': 'off', 'use_snp_selection': False}. Best is trial 104 with value: 0.20611400028218546.
[I 2025-12-05 19:30:31,057] Trial 105 finished with value: 0.1879584157593673 and parameters: {'model_type': 'mlp', 'hidden_dims': '[512, 64]', 'dropout': 0.5169129484334749, 'batch_norm': False, 'lr': 5.990579036331441e-06, 'weight_decay': 0.00010361219147038841, 'epochs': 160, 'loss': 'mae', 'optimizer': 'adam', 'graph_mode': 'off', 'use_snp_selection': False}. Best is trial 104 with value: 0.20611400028218546.
[I 2025-12-05 19:31:16,641] Trial 106 finished with value: 0.19812441375776102 and parameters: {'model_type': 'mlp', 'hidden_dims': '[512, 64]', 'dropout': 0.535867978530476, 'batch_norm': False, 'lr': 6.788693428672303e-06, 'weight_decay': 0.00015336022659767265, 'epochs': 134, 'loss': 'mae', 'optimizer': 'adam', 'graph_mode': 'off', 'use_snp_selection': False}. Best is trial 104 with value: 0.20611400028218546.
[I 2025-12-05 19:32:02,693] Trial 107 finished with value: 0.18057209078337338 and parameters: {'model_type': 'mlp', 'hidden_dims': '[512, 64]', 'dropout': 0.5376942763360233, 'batch_norm': True, 'lr': 1.0207265833228274e-05, 'weight_decay': 0.00014033154336505268, 'epochs': 134, 'loss': 'mae', 'optimizer': 'adam', 'graph_mode': 'off', 'use_snp_selection': False}. Best is trial 104 with value: 0.20611400028218546.
[I 2025-12-05 19:32:42,372] Trial 108 finished with value: 0.1968366009031273 and parameters: {'model_type': 'mlp', 'hidden_dims': '[512, 64]', 'dropout': 0.5251502807678372, 'batch_norm': False, 'lr': 8.040414989699322e-06, 'weight_decay': 0.00021147314049753754, 'epochs': 113, 'loss': 'mae', 'optimizer': 'adam', 'graph_mode': 'off', 'use_snp_selection': False}. Best is trial 104 with value: 0.20611400028218546.
