[I 2025-12-05 15:57:53,727] Trial 46 finished with value: 0.09487313365294298 and parameters: {'model_type': 'mlp', 'hidden_dims': '[256, 128]', 'dropout': 0.26676516154555746, 'batch_norm': True, 'lr': 5.92391400382169e-05, 'weight_decay': 1.6340737492960885e-07, 'epochs': 300, 'loss': 'mae', 'optimizer': 'adam', 'graph_mode': 'off', 'use_snp_selection': False}. Best is trial 11 with value: 0.12971328550290812.
[I 2025-12-05 15:57:55,213] Trial 47 finished with value: 0.030428372001260567 and parameters: {'model_type': 'mlp', 'hidden_dims': '[256, 128]', 'dropout': 0.24606105040525134, 'batch_norm': False, 'lr': 2.0008326910525856e-06, 'weight_decay': 6.501727223492121e-07, 'epochs': 250, 'loss': 'mse', 'optimizer': 'adam', 'graph_mode': 'off', 'use_snp_selection': False}. Best is trial 11 with value: 0.12971328550290812.
[I 2025-12-05 15:57:57,502] Trial 48 finished with value: 0.054605914905913655 and parameters: {'model_type': 'mlp', 'hidden_dims': '[512, 128]', 'dropout': 0.29475096979288434, 'batch_norm': False, 'lr': 1.1170552432785515e-06, 'weight_decay': 3.3255042572243382e-06, 'epochs': 212, 'loss': 'mae', 'optimizer': 'adam', 'graph_mode': 'off', 'use_snp_selection': False}. Best is trial 11 with value: 0.12971328550290812.
[I 2025-12-05 15:57:59,937] Trial 49 finished with value: 0.09261352913399273 and parameters: {'model_type': 'mlp', 'hidden_dims': '[128, 64]', 'dropout': 0.36860818707907705, 'batch_norm': False, 'lr': 4.76173933111733e-05, 'weight_decay': 6.250451307174044e-05, 'epochs': 270, 'loss': 'mae', 'optimizer': 'adam', 'graph_mode': 'off', 'use_snp_selection': True, 'num_snps': 46888}. Best is trial 11 with value: 0.12971328550290812.
[I 2025-12-05 15:58:00,994] Trial 50 finished with value: 0.05515640871407744 and parameters: {'model_type': 'mlp', 'hidden_dims': '[256, 128, 64]', 'dropout': 0.5093240590532264, 'batch_norm': False, 'lr': 2.3507971294780317e-05, 'weight_decay': 1.0296570289641963e-05, 'epochs': 132, 'loss': 'mae', 'optimizer': 'adam', 'graph_mode': 'off', 'use_snp_selection': False}. Best is trial 11 with value: 0.12971328550290812.
[I 2025-12-05 15:58:02,327] Trial 51 finished with value: 0.10177956308259464 and parameters: {'model_type': 'mlp', 'hidden_dims': '[256, 128]', 'dropout': 0.30662751579742326, 'batch_norm': False, 'lr': 9.342168367225543e-06, 'weight_decay': 3.8300162104621104e-05, 'epochs': 199, 'loss': 'mae', 'optimizer': 'adam', 'graph_mode': 'off', 'use_snp_selection': False}. Best is trial 11 with value: 0.12971328550290812.
[I 2025-12-05 15:58:03,633] Trial 52 finished with value: 0.08460678154794285 and parameters: {'model_type': 'mlp', 'hidden_dims': '[256, 128]', 'dropout': 0.3167845211536867, 'batch_norm': False, 'lr': 5.255649014654823e-06, 'weight_decay': 2.7740092720441875e-05, 'epochs': 197, 'loss': 'mae', 'optimizer': 'adam', 'graph_mode': 'off', 'use_snp_selection': False}. Best is trial 11 with value: 0.12971328550290812.
[I 2025-12-05 15:58:04,806] Trial 53 finished with value: 0.07262462029661668 and parameters: {'model_type': 'mlp', 'hidden_dims': '[256, 128]', 'dropout': 0.3469287379696337, 'batch_norm': False, 'lr': 7.858814692995029e-06, 'weight_decay': 1.918886132288974e-05, 'epochs': 164, 'loss': 'mae', 'optimizer': 'adam', 'graph_mode': 'off', 'use_snp_selection': False}. Best is trial 11 with value: 0.12971328550290812.
[I 2025-12-05 15:58:05,537] Trial 54 finished with value: 0.03587089628554963 and parameters: {'model_type': 'mlp', 'hidden_dims': '[256, 128]', 'dropout': 0.2844166509283964, 'batch_norm': False, 'lr': 1.5996427798033232e-05, 'weight_decay': 8.95613922631643e-05, 'epochs': 46, 'loss': 'mae', 'optimizer': 'adam', 'graph_mode': 'off', 'use_snp_selection': False}. Best is trial 11 with value: 0.12971328550290812.
[I 2025-12-05 15:58:07,011] Trial 55 finished with value: 0.09042321042956501 and parameters: {'model_type': 'mlp', 'hidden_dims': '[256, 128]', 'dropout': 0.210908755950278, 'batch_norm': False, 'lr': 1.0185553253097659e-05, 'weight_decay': 2.3612591712114033e-05, 'epochs': 244, 'loss': 'mae', 'optimizer': 'adam', 'graph_mode': 'off', 'use_snp_selection': False}. Best is trial 11 with value: 0.12971328550290812.
[I 2025-12-05 15:58:08,438] Trial 56 finished with value: 0.10071244548580088 and parameters: {'model_type': 'mlp', 'hidden_dims': '[256, 128]', 'dropout': 0.18158272596631708, 'batch_norm': False, 'lr': 2.5232396841974224e-05, 'weight_decay': 3.9321994500163856e-06, 'epochs': 231, 'loss': 'mae', 'optimizer': 'adam', 'graph_mode': 'off', 'use_snp_selection': False}. Best is trial 11 with value: 0.12971328550290812.
[I 2025-12-05 15:58:11,295] Trial 57 finished with value: 3.620226703179929e-05 and parameters: {'model_type': 'mlp', 'hidden_dims': '[512, 256]', 'dropout': 0.2365474675960174, 'batch_norm': True, 'lr': 3.804489418628488e-06, 'weight_decay': 7.167645713073718e-06, 'epochs': 280, 'loss': 'mae', 'optimizer': 'adam', 'graph_mode': 'off', 'use_snp_selection': False}. Best is trial 11 with value: 0.12971328550290812.
[I 2025-12-05 15:58:13,964] Trial 58 finished with value: 0.09160236826191759 and parameters: {'model_type': 'mlp', 'hidden_dims': '[512, 64]', 'dropout': 0.3301328969710959, 'batch_norm': False, 'lr': 1.3068356007254032e-05, 'weight_decay': 1.2680813046019918e-05, 'epochs': 259, 'loss': 'mse', 'optimizer': 'adam', 'graph_mode': 'off', 'use_snp_selection': False}. Best is trial 11 with value: 0.12971328550290812.
[I 2025-12-05 15:58:15,302] Trial 59 finished with value: 0.09753513745404553 and parameters: {'model_type': 'mlp', 'hidden_dims': '[256, 128]', 'dropout': 0.300588818062126, 'batch_norm': False, 'lr': 3.7388405892897846e-05, 'weight_decay': 2.2283683924135658e-06, 'epochs': 209, 'loss': 'mae', 'optimizer': 'adam', 'graph_mode': 'off', 'use_snp_selection': False}. Best is trial 11 with value: 0.12971328550290812.
[I 2025-12-05 15:58:17,047] Trial 60 finished with value: 0.07461701521675633 and parameters: {'model_type': 'mlp', 'hidden_dims': '[256, 128]', 'dropout': 0.3804074454329719, 'batch_norm': False, 'lr': 1.7424240831688635e-05, 'weight_decay': 6.902771800244821e-07, 'epochs': 192, 'loss': 'mae', 'optimizer': 'adam', 'graph_mode': 'off', 'use_snp_selection': True, 'num_snps': 24139}. Best is trial 11 with value: 0.12971328550290812.
[I 2025-12-05 15:58:18,476] Trial 61 finished with value: 0.09850811660609211 and parameters: {'model_type': 'mlp', 'hidden_dims': '[256, 128]', 'dropout': 0.3512472916516626, 'batch_norm': False, 'lr': 2.6448614793015733e-05, 'weight_decay': 2.112497008798546e-05, 'epochs': 224, 'loss': 'mae', 'optimizer': 'adam', 'graph_mode': 'off', 'use_snp_selection': False}. Best is trial 11 with value: 0.12971328550290812.
[I 2025-12-05 15:58:19,885] Trial 62 finished with value: 0.10809167376491911 and parameters: {'model_type': 'mlp', 'hidden_dims': '[256, 128]', 'dropout': 0.34285556781592674, 'batch_norm': False, 'lr': 2.0300905273204664e-05, 'weight_decay': 1.465147265367558e-05, 'epochs': 225, 'loss': 'mae', 'optimizer': 'adam', 'graph_mode': 'off', 'use_snp_selection': False}. Best is trial 11 with value: 0.12971328550290812.
[I 2025-12-05 15:58:21,366] Trial 63 finished with value: 0.0868579346959991 and parameters: {'model_type': 'mlp', 'hidden_dims': '[256, 128]', 'dropout': 0.31217087733093846, 'batch_norm': False, 'lr': 1.946823095776684e-05, 'weight_decay': 5.84582532018184e-06, 'epochs': 240, 'loss': 'mae', 'optimizer': 'adam', 'graph_mode': 'off', 'use_snp_selection': False}. Best is trial 11 with value: 0.12971328550290812.
[I 2025-12-05 15:58:22,740] Trial 64 finished with value: 0.06856064628397301 and parameters: {'model_type': 'mlp', 'hidden_dims': '[256, 128]', 'dropout': 0.2697752937416607, 'batch_norm': False, 'lr': 8.323745285636311e-06, 'weight_decay': 4.706385488733668e-05, 'epochs': 216, 'loss': 'mae', 'optimizer': 'adam', 'graph_mode': 'off', 'use_snp_selection': False}. Best is trial 11 with value: 0.12971328550290812.
[I 2025-12-05 15:58:23,955] Trial 65 finished with value: 0.09334597444646033 and parameters: {'model_type': 'mlp', 'hidden_dims': '[256, 128]', 'dropout': 0.3320272863289472, 'batch_norm': False, 'lr': 1.3046366479438684e-05, 'weight_decay': 9.663169494692038e-06, 'epochs': 175, 'loss': 'mae', 'optimizer': 'adam', 'graph_mode': 'off', 'use_snp_selection': False}. Best is trial 11 with value: 0.12971328550290812.
[I 2025-12-05 15:58:24,948] Trial 66 finished with value: 0.0876279753630712 and parameters: {'model_type': 'mlp', 'hidden_dims': '[128, 64]', 'dropout': 0.4466530005065789, 'batch_norm': False, 'lr': 7.585948700021718e-05, 'weight_decay': 0.00019167479753394966, 'epochs': 257, 'loss': 'mae', 'optimizer': 'adam', 'graph_mode': 'off', 'use_snp_selection': False}. Best is trial 11 with value: 0.12971328550290812.
[I 2025-12-05 15:58:26,283] Trial 67 finished with value: 0.10367091093119818 and parameters: {'model_type': 'mlp', 'hidden_dims': '[256, 128]', 'dropout': 0.4036525131169069, 'batch_norm': False, 'lr': 6.819570929624599e-06, 'weight_decay': 1.3868868807426021e-05, 'epochs': 206, 'loss': 'mae', 'optimizer': 'adam', 'graph_mode': 'off', 'use_snp_selection': False}. Best is trial 11 with value: 0.12971328550290812.
[I 2025-12-05 15:58:28,656] Trial 68 finished with value: 0.13608435133868688 and parameters: {'model_type': 'mlp', 'hidden_dims': '[512, 128]', 'dropout': 0.36480198979601336, 'batch_norm': False, 'lr': 0.0005511280769585186, 'weight_decay': 1.5373760560647771e-06, 'epochs': 224, 'loss': 'mae', 'optimizer': 'adam', 'graph_mode': 'off', 'use_snp_selection': False}. Best is trial 68 with value: 0.13608435133868688.
[I 2025-12-05 15:58:31,031] Trial 69 finished with value: 0.084539606251329 and parameters: {'model_type': 'mlp', 'hidden_dims': '[512, 128]', 'dropout': 0.3677605306321731, 'batch_norm': False, 'lr': 0.0008925222241173445, 'weight_decay': 1.4263336779840747e-06, 'epochs': 222, 'loss': 'mae', 'optimizer': 'adam', 'graph_mode': 'off', 'use_snp_selection': False}. Best is trial 68 with value: 0.13608435133868688.
[I 2025-12-05 15:58:32,320] Trial 70 finished with value: 0.0655159032352607 and parameters: {'model_type': 'mlp', 'hidden_dims': '[512, 128]', 'dropout': 0.47239571987285967, 'batch_norm': True, 'lr': 0.0003822585889589598, 'weight_decay': 2.990246945137504e-07, 'epochs': 233, 'loss': 'mae', 'optimizer': 'adam', 'graph_mode': 'off', 'use_snp_selection': True, 'num_snps': 4823}. Best is trial 68 with value: 0.13608435133868688.
[I 2025-12-05 15:58:33,456] Trial 71 finished with value: 0.07034416392375714 and parameters: {'model_type': 'mlp', 'hidden_dims': '[512, 128]', 'dropout': 0.2973557177580085, 'batch_norm': False, 'lr': 0.00018556492152925873, 'weight_decay': 4.8018781899159875e-06, 'epochs': 61, 'loss': 'mae', 'optimizer': 'adam', 'graph_mode': 'off', 'use_snp_selection': False}. Best is trial 68 with value: 0.13608435133868688.
[I 2025-12-05 15:58:36,036] Trial 72 finished with value: 0.09040775613259543 and parameters: {'model_type': 'mlp', 'hidden_dims': '[512, 128]', 'dropout': 0.27993297044657367, 'batch_norm': False, 'lr': 1.1975900531592098e-05, 'weight_decay': 1.763340613245583e-07, 'epochs': 248, 'loss': 'mae', 'optimizer': 'adam', 'graph_mode': 'off', 'use_snp_selection': False}. Best is trial 68 with value: 0.13608435133868688.
[I 2025-12-05 15:58:37,486] Trial 73 finished with value: 0.07823800607612635 and parameters: {'model_type': 'mlp', 'hidden_dims': '[256, 128, 64]', 'dropout': 0.43145018598976165, 'batch_norm': False, 'lr': 0.0005667195497297021, 'weight_decay': 4.4263642492243725e-07, 'epochs': 239, 'loss': 'mae', 'optimizer': 'adam', 'graph_mode': 'off', 'use_snp_selection': False}. Best is trial 68 with value: 0.13608435133868688.
[I 2025-12-05 15:58:38,858] Trial 74 finished with value: 0.09203728714533965 and parameters: {'model_type': 'mlp', 'hidden_dims': '[256, 128]', 'dropout': 0.3362932201894484, 'batch_norm': False, 'lr': 0.0001258582754220926, 'weight_decay': 3.2559796239670792e-06, 'epochs': 219, 'loss': 'mae', 'optimizer': 'adam', 'graph_mode': 'off', 'use_snp_selection': False}. Best is trial 68 with value: 0.13608435133868688.
[I 2025-12-05 15:58:40,942] Trial 75 finished with value: 0.11052301932899616 and parameters: {'model_type': 'mlp', 'hidden_dims': '[512, 256]', 'dropout': 0.25803973729084456, 'batch_norm': False, 'lr': 1.973378390882001e-05, 'weight_decay': 8.068477526864125e-06, 'epochs': 183, 'loss': 'mae', 'optimizer': 'adam', 'graph_mode': 'off', 'use_snp_selection': False}. Best is trial 68 with value: 0.13608435133868688.
[I 2025-12-05 15:58:43,056] Trial 76 finished with value: 0.09032752967416616 and parameters: {'model_type': 'mlp', 'hidden_dims': '[512, 256]', 'dropout': 0.25392122140770257, 'batch_norm': False, 'lr': 3.420334212589935e-05, 'weight_decay': 7.800233708109141e-06, 'epochs': 187, 'loss': 'mse', 'optimizer': 'adam', 'graph_mode': 'off', 'use_snp_selection': False}. Best is trial 68 with value: 0.13608435133868688.
[I 2025-12-05 15:58:45,307] Trial 77 finished with value: 0.09692507888453489 and parameters: {'model_type': 'mlp', 'hidden_dims': '[512, 256]', 'dropout': 0.5512720146418945, 'batch_norm': False, 'lr': 2.0339509136681846e-05, 'weight_decay': 1.865208144787468e-06, 'epochs': 206, 'loss': 'mae', 'optimizer': 'adam', 'graph_mode': 'off', 'use_snp_selection': False}. Best is trial 68 with value: 0.13608435133868688.
[I 2025-12-05 15:58:48,050] Trial 78 finished with value: 0.07920091443254001 and parameters: {'model_type': 'mlp', 'hidden_dims': '[512, 256]', 'dropout': 0.3535347779660747, 'batch_norm': False, 'lr': 1.5317357600795342e-05, 'weight_decay': 2.58395877939481e-06, 'epochs': 268, 'loss': 'mae', 'optimizer': 'adam', 'graph_mode': 'off', 'use_snp_selection': False}. Best is trial 68 with value: 0.13608435133868688.
[I 2025-12-05 15:58:50,088] Trial 79 finished with value: 0.11643095136807619 and parameters: {'model_type': 'mlp', 'hidden_dims': '[512, 256]', 'dropout': 0.220668146451046, 'batch_norm': False, 'lr': 3.0238200161104723e-05, 'weight_decay': 4.12224342346343e-06, 'epochs': 177, 'loss': 'mae', 'optimizer': 'adam', 'graph_mode': 'off', 'use_snp_selection': False}. Best is trial 68 with value: 0.13608435133868688.
[I 2025-12-05 15:58:52,068] Trial 80 finished with value: 0.09580156042898826 and parameters: {'model_type': 'mlp', 'hidden_dims': '[512, 256]', 'dropout': 0.13030991771331704, 'batch_norm': False, 'lr': 6.792894880434349e-05, 'weight_decay': 4.27888031644229e-06, 'epochs': 171, 'loss': 'mae', 'optimizer': 'adam', 'graph_mode': 'off', 'use_snp_selection': False}. Best is trial 68 with value: 0.13608435133868688.
[I 2025-12-05 15:58:53,887] Trial 81 finished with value: 0.09805028259760047 and parameters: {'model_type': 'mlp', 'hidden_dims': '[512, 256]', 'dropout': 0.26342062568434454, 'batch_norm': False, 'lr': 4.97953399496374e-05, 'weight_decay': 5.559954871912348e-06, 'epochs': 150, 'loss': 'mae', 'optimizer': 'adam', 'graph_mode': 'off', 'use_snp_selection': False}. Best is trial 68 with value: 0.13608435133868688.
[I 2025-12-05 15:58:56,298] Trial 82 finished with value: 0.1008615182367067 and parameters: {'model_type': 'mlp', 'hidden_dims': '[512, 256]', 'dropout': 0.2180824995444719, 'batch_norm': False, 'lr': 2.9408034766192584e-05, 'weight_decay': 8.967885501099933e-06, 'epochs': 226, 'loss': 'mae', 'optimizer': 'adam', 'graph_mode': 'off', 'use_snp_selection': False}. Best is trial 68 with value: 0.13608435133868688.
[I 2025-12-05 15:58:58,925] Trial 83 finished with value: 0.0993113197707177 and parameters: {'model_type': 'mlp', 'hidden_dims': '[512, 256]', 'dropout': 0.17087355495336026, 'batch_norm': False, 'lr': 1.9672066773177425e-05, 'weight_decay': 9.401553757123033e-07, 'epochs': 253, 'loss': 'mae', 'optimizer': 'adam', 'graph_mode': 'off', 'use_snp_selection': False}. Best is trial 68 with value: 0.13608435133868688.
[I 2025-12-05 15:59:01,017] Trial 84 finished with value: 0.10009590380969434 and parameters: {'model_type': 'mlp', 'hidden_dims': '[512, 64]', 'dropout': 0.2430126024272954, 'batch_norm': False, 'lr': 1.0755942492699368e-05, 'weight_decay': 3.559330563867929e-06, 'epochs': 184, 'loss': 'mae', 'optimizer': 'adam', 'graph_mode': 'off', 'use_snp_selection': False}. Best is trial 68 with value: 0.13608435133868688.
[I 2025-12-05 15:59:03,508] Trial 85 finished with value: 0.11958643922584167 and parameters: {'model_type': 'mlp', 'hidden_dims': '[512, 128]', 'dropout': 0.28846990423837826, 'batch_norm': False, 'lr': 2.7975456340683587e-05, 'weight_decay': 1.1408026145803179e-05, 'epochs': 237, 'loss': 'mae', 'optimizer': 'adam', 'graph_mode': 'off', 'use_snp_selection': False}. Best is trial 68 with value: 0.13608435133868688.
[I 2025-12-05 15:59:06,007] Trial 86 finished with value: 0.0970060132243526 and parameters: {'model_type': 'mlp', 'hidden_dims': '[512, 128]', 'dropout': 0.32172407351459226, 'batch_norm': False, 'lr': 4.668173285958009e-05, 'weight_decay': 1.0592837101421083e-05, 'epochs': 239, 'loss': 'mae', 'optimizer': 'adam', 'graph_mode': 'off', 'use_snp_selection': False}. Best is trial 68 with value: 0.13608435133868688.
[I 2025-12-05 15:59:07,893] Trial 87 finished with value: 0.05956910181370713 and parameters: {'model_type': 'mlp', 'hidden_dims': '[512, 128]', 'dropout': 0.28624996708352385, 'batch_norm': True, 'lr': 2.8583474398931014e-05, 'weight_decay': 1.834481861801747e-05, 'epochs': 156, 'loss': 'mae', 'optimizer': 'adam', 'graph_mode': 'off', 'use_snp_selection': False}. Best is trial 68 with value: 0.13608435133868688.
[I 2025-12-05 15:59:11,341] Trial 88 finished with value: 0.08389355987986585 and parameters: {'model_type': 'mlp', 'hidden_dims': '[512, 128]', 'dropout': 0.22523685802083115, 'batch_norm': False, 'lr': 2.2588840123828098e-05, 'weight_decay': 6.353726707897863e-06, 'epochs': 214, 'loss': 'mse', 'optimizer': 'adam', 'graph_mode': 'off', 'use_snp_selection': True, 'num_snps': 48766}. Best is trial 68 with value: 0.13608435133868688.
[I 2025-12-05 15:59:13,802] Trial 89 finished with value: 0.09874582150013665 and parameters: {'model_type': 'mlp', 'hidden_dims': '[512, 128]', 'dropout': 0.2707495678143674, 'batch_norm': False, 'lr': 3.278654276711336e-05, 'weight_decay': 1.1486447788286807e-05, 'epochs': 233, 'loss': 'mae', 'optimizer': 'adam', 'graph_mode': 'off', 'use_snp_selection': False}. Best is trial 68 with value: 0.13608435133868688.
[I 2025-12-05 15:59:15,962] Trial 90 finished with value: 0.10412292124676553 and parameters: {'model_type': 'mlp', 'hidden_dims': '[512, 256]', 'dropout': 0.1963090883148395, 'batch_norm': False, 'lr': 1.722223663338249e-05, 'weight_decay': 3.1453195922147956e-05, 'epochs': 193, 'loss': 'mae', 'optimizer': 'adam', 'graph_mode': 'off', 'use_snp_selection': False}. Best is trial 68 with value: 0.13608435133868688.
[I 2025-12-05 15:59:16,991] Trial 91 finished with value: 0.07338576355370975 and parameters: {'model_type': 'mlp', 'hidden_dims': '[128, 64]', 'dropout': 0.25562746789465945, 'batch_norm': False, 'lr': 1.3687435808682324e-05, 'weight_decay': 4.5264720816359265e-06, 'epochs': 263, 'loss': 'mae', 'optimizer': 'adam', 'graph_mode': 'off', 'use_snp_selection': False}. Best is trial 68 with value: 0.13608435133868688.
[I 2025-12-05 15:59:18,310] Trial 92 finished with value: 0.08661346701855593 and parameters: {'model_type': 'mlp', 'hidden_dims': '[256, 128]', 'dropout': 0.3075625572017828, 'batch_norm': False, 'lr': 3.912771192463022e-05, 'weight_decay': 3.016287967965494e-06, 'epochs': 203, 'loss': 'mae', 'optimizer': 'adam', 'graph_mode': 'off', 'use_snp_selection': False}. Best is trial 68 with value: 0.13608435133868688.
[I 2025-12-05 15:59:19,742] Trial 93 finished with value: 0.1063923741204302 and parameters: {'model_type': 'mlp', 'hidden_dims': '[256, 128, 64]', 'dropout': 0.2915034439479238, 'batch_norm': False, 'lr': 2.3119176639678592e-05, 'weight_decay': 7.24676199265195e-06, 'epochs': 230, 'loss': 'mae', 'optimizer': 'adam', 'graph_mode': 'off', 'use_snp_selection': False}. Best is trial 68 with value: 0.13608435133868688.
[I 2025-12-05 15:59:21,232] Trial 94 finished with value: 0.09967526481380053 and parameters: {'model_type': 'mlp', 'hidden_dims': '[256, 128]', 'dropout': 0.38629816295946, 'batch_norm': False, 'lr': 1.7894899117253315e-05, 'weight_decay': 1.536832028550052e-05, 'epochs': 247, 'loss': 'mae', 'optimizer': 'adam', 'graph_mode': 'off', 'use_snp_selection': False}. Best is trial 68 with value: 0.13608435133868688.
[I 2025-12-05 15:59:23,552] Trial 95 finished with value: 0.11171949757466722 and parameters: {'model_type': 'mlp', 'hidden_dims': '[512, 128]', 'dropout': 0.2399905030657355, 'batch_norm': False, 'lr': 0.0002510466799975599, 'weight_decay': 2.0759029481322074e-06, 'epochs': 213, 'loss': 'mae', 'optimizer': 'adam', 'graph_mode': 'off', 'use_snp_selection': False}. Best is trial 68 with value: 0.13608435133868688.
[I 2025-12-05 15:59:25,904] Trial 96 finished with value: 0.11390054237380934 and parameters: {'model_type': 'mlp', 'hidden_dims': '[512, 128]', 'dropout': 0.23555709595131918, 'batch_norm': False, 'lr': 0.0002941037869453532, 'weight_decay': 2.0567347669155506e-06, 'epochs': 220, 'loss': 'mae', 'optimizer': 'adam', 'graph_mode': 'off', 'use_snp_selection': False}. Best is trial 68 with value: 0.13608435133868688.
[I 2025-12-05 15:59:28,196] Trial 97 finished with value: 0.10082381777216556 and parameters: {'model_type': 'mlp', 'hidden_dims': '[512, 128]', 'dropout': 0.21059837408408533, 'batch_norm': False, 'lr': 0.00031197849982323616, 'weight_decay': 1.6458028959807053e-06, 'epochs': 212, 'loss': 'mae', 'optimizer': 'adam', 'graph_mode': 'off', 'use_snp_selection': False}. Best is trial 68 with value: 0.13608435133868688.
