[I 2025-12-06 04:17:03,193] Trial 65 finished with value: 0.22322163256025554 and parameters: {'model_type': 'mlp', 'hidden_dims': '[512, 64]', 'dropout': 0.11698060490091372, 'batch_norm': True, 'lr': 1.591882401410405e-05, 'weight_decay': 3.7551259598824506e-05, 'epochs': 275, 'loss': 'mae', 'optimizer': 'adam', 'graph_mode': 'off', 'use_snp_selection': False}. Best is trial 65 with value: 0.22322163256025554.
[I 2025-12-06 04:17:37,630] Trial 66 finished with value: 0.16114467535226176 and parameters: {'model_type': 'mlp', 'hidden_dims': '[512, 64]', 'dropout': 0.1192876662546911, 'batch_norm': True, 'lr': 6.485679042919369e-06, 'weight_decay': 3.5342515763573256e-05, 'epochs': 311, 'loss': 'mae', 'optimizer': 'adam', 'graph_mode': 'off', 'use_snp_selection': True, 'num_snps': 3487}. Best is trial 65 with value: 0.22322163256025554.
[I 2025-12-06 04:18:01,869] Trial 67 finished with value: 0.18798027317844707 and parameters: {'model_type': 'mlp', 'hidden_dims': '[128, 64]', 'dropout': 0.12023864220289057, 'batch_norm': True, 'lr': 1.5406989833419332e-05, 'weight_decay': 5.475757161455408e-05, 'epochs': 269, 'loss': 'mae', 'optimizer': 'adam', 'graph_mode': 'off', 'use_snp_selection': False}. Best is trial 65 with value: 0.22322163256025554.
[I 2025-12-06 04:19:13,877] Trial 68 finished with value: 0.2097356969312775 and parameters: {'model_type': 'mlp', 'hidden_dims': '[512, 128]', 'dropout': 0.14751504772475688, 'batch_norm': False, 'lr': 9.715340040061403e-06, 'weight_decay': 1.628901717129187e-05, 'epochs': 249, 'loss': 'mae', 'optimizer': 'adam', 'graph_mode': 'off', 'use_snp_selection': False}. Best is trial 65 with value: 0.22322163256025554.
[I 2025-12-06 04:20:46,869] Trial 69 finished with value: 0.21035262975993446 and parameters: {'model_type': 'mlp', 'hidden_dims': '[512, 64]', 'dropout': 0.46421322752359917, 'batch_norm': True, 'lr': 2.6567256596145836e-05, 'weight_decay': 4.701423147066077e-05, 'epochs': 326, 'loss': 'mae', 'optimizer': 'adam', 'graph_mode': 'off', 'use_snp_selection': False}. Best is trial 65 with value: 0.22322163256025554.
[I 2025-12-06 04:22:06,316] Trial 70 finished with value: 0.21128764761742821 and parameters: {'model_type': 'mlp', 'hidden_dims': '[512, 64]', 'dropout': 0.5436426490450732, 'batch_norm': True, 'lr': 4.386928383407248e-06, 'weight_decay': 3.180390827930167e-05, 'epochs': 275, 'loss': 'mae', 'optimizer': 'adam', 'graph_mode': 'off', 'use_snp_selection': False}. Best is trial 65 with value: 0.22322163256025554.
[I 2025-12-06 04:23:33,023] Trial 71 finished with value: 0.22064678665265114 and parameters: {'model_type': 'mlp', 'hidden_dims': '[512, 64]', 'dropout': 0.17436403985178697, 'batch_norm': True, 'lr': 4.98972984510244e-05, 'weight_decay': 6.868719579653165e-05, 'epochs': 303, 'loss': 'mae', 'optimizer': 'adam', 'graph_mode': 'off', 'use_snp_selection': False}. Best is trial 65 with value: 0.22322163256025554.
[I 2025-12-06 04:25:10,363] Trial 72 finished with value: 0.2137397005925 and parameters: {'model_type': 'mlp', 'hidden_dims': '[512, 64]', 'dropout': 0.17757916659462594, 'batch_norm': True, 'lr': 4.0360894890519346e-05, 'weight_decay': 9.066317367079562e-05, 'epochs': 343, 'loss': 'mae', 'optimizer': 'adam', 'graph_mode': 'off', 'use_snp_selection': False}. Best is trial 65 with value: 0.22322163256025554.
[I 2025-12-06 04:26:39,753] Trial 73 finished with value: 0.21349368047071446 and parameters: {'model_type': 'mlp', 'hidden_dims': '[512, 64]', 'dropout': 0.10997543842093283, 'batch_norm': True, 'lr': 3.169649901535821e-05, 'weight_decay': 0.0001239765966309307, 'epochs': 313, 'loss': 'mae', 'optimizer': 'adam', 'graph_mode': 'off', 'use_snp_selection': False}. Best is trial 65 with value: 0.22322163256025554.
[I 2025-12-06 04:28:12,526] Trial 74 finished with value: 0.22017826347837977 and parameters: {'model_type': 'mlp', 'hidden_dims': '[512, 64]', 'dropout': 0.1371354014976484, 'batch_norm': True, 'lr': 2.281037888184515e-05, 'weight_decay': 2.3496900870148692e-05, 'epochs': 326, 'loss': 'mae', 'optimizer': 'adam', 'graph_mode': 'off', 'use_snp_selection': False}. Best is trial 65 with value: 0.22322163256025554.
[I 2025-12-06 04:29:46,641] Trial 75 finished with value: 0.21838529854779543 and parameters: {'model_type': 'mlp', 'hidden_dims': '[512, 64]', 'dropout': 0.15686159517422085, 'batch_norm': True, 'lr': 2.44724670740945e-05, 'weight_decay': 1.4468316259815333e-05, 'epochs': 331, 'loss': 'mae', 'optimizer': 'adam', 'graph_mode': 'off', 'use_snp_selection': False}. Best is trial 65 with value: 0.22322163256025554.
[I 2025-12-06 04:31:23,507] Trial 76 finished with value: 0.2152004177869923 and parameters: {'model_type': 'mlp', 'hidden_dims': '[512, 128]', 'dropout': 0.13551047318725262, 'batch_norm': True, 'lr': 2.2436963917320928e-05, 'weight_decay': 2.2361404736059143e-05, 'epochs': 341, 'loss': 'mae', 'optimizer': 'adam', 'graph_mode': 'off', 'use_snp_selection': False}. Best is trial 65 with value: 0.22322163256025554.
[I 2025-12-06 04:32:51,095] Trial 77 finished with value: 0.2136139724514113 and parameters: {'model_type': 'mlp', 'hidden_dims': '[512, 64]', 'dropout': 0.126237347009922, 'batch_norm': True, 'lr': 1.5927295503021333e-05, 'weight_decay': 5.4110895256281606e-05, 'epochs': 306, 'loss': 'mae', 'optimizer': 'adam', 'graph_mode': 'off', 'use_snp_selection': False}. Best is trial 65 with value: 0.22322163256025554.
[I 2025-12-06 04:33:50,971] Trial 78 finished with value: 0.204637568829028 and parameters: {'model_type': 'mlp', 'hidden_dims': '[128, 64]', 'dropout': 0.1011127582001361, 'batch_norm': True, 'lr': 6.485187798503575e-05, 'weight_decay': 8.110636206629237e-05, 'epochs': 321, 'loss': 'mae', 'optimizer': 'adam', 'graph_mode': 'off', 'use_snp_selection': True, 'num_snps': 47926}. Best is trial 65 with value: 0.22322163256025554.
[I 2025-12-06 04:34:57,180] Trial 79 finished with value: 0.19942979709690098 and parameters: {'model_type': 'mlp', 'hidden_dims': '[512, 64]', 'dropout': 0.14626964667690548, 'batch_norm': True, 'lr': 1.1306381760847444e-05, 'weight_decay': 3.5440696586496e-05, 'epochs': 226, 'loss': 'mae', 'optimizer': 'adam', 'graph_mode': 'off', 'use_snp_selection': False}. Best is trial 65 with value: 0.22322163256025554.
[I 2025-12-06 04:36:30,485] Trial 80 finished with value: 0.21413094646937658 and parameters: {'model_type': 'mlp', 'hidden_dims': '[512, 128]', 'dropout': 0.17977476273435428, 'batch_norm': True, 'lr': 5.4786769794742355e-05, 'weight_decay': 6.455162347096928e-05, 'epochs': 327, 'loss': 'mae', 'optimizer': 'adam', 'graph_mode': 'off', 'use_snp_selection': False}. Best is trial 65 with value: 0.22322163256025554.
[I 2025-12-06 04:37:54,727] Trial 81 finished with value: 0.21602658937742972 and parameters: {'model_type': 'mlp', 'hidden_dims': '[512, 64]', 'dropout': 0.16646126701930697, 'batch_norm': True, 'lr': 3.295235509844843e-05, 'weight_decay': 2.2829549610663317e-05, 'epochs': 293, 'loss': 'mae', 'optimizer': 'adam', 'graph_mode': 'off', 'use_snp_selection': False}. Best is trial 65 with value: 0.22322163256025554.
[I 2025-12-06 04:39:32,371] Trial 82 finished with value: 0.2127214844511422 and parameters: {'model_type': 'mlp', 'hidden_dims': '[512, 64]', 'dropout': 0.41057511038432165, 'batch_norm': True, 'lr': 9.281206263179366e-05, 'weight_decay': 2.6842846897872674e-05, 'epochs': 344, 'loss': 'mae', 'optimizer': 'adam', 'graph_mode': 'off', 'use_snp_selection': False}. Best is trial 65 with value: 0.22322163256025554.
[I 2025-12-06 04:41:01,982] Trial 83 finished with value: 0.21267308121610512 and parameters: {'model_type': 'mlp', 'hidden_dims': '[512, 64]', 'dropout': 0.23749061909763086, 'batch_norm': False, 'lr': 2.0713775470607646e-06, 'weight_decay': 1.7125850684427773e-05, 'epochs': 316, 'loss': 'mae', 'optimizer': 'adam', 'graph_mode': 'off', 'use_snp_selection': False}. Best is trial 65 with value: 0.22322163256025554.
[I 2025-12-06 04:41:53,106] Trial 84 finished with value: 0.22003350726678236 and parameters: {'model_type': 'mlp', 'hidden_dims': '[256, 128, 64]', 'dropout': 0.4923757848293242, 'batch_norm': True, 'lr': 2.094479617481805e-05, 'weight_decay': 4.1224913518173186e-05, 'epochs': 333, 'loss': 'mae', 'optimizer': 'adam', 'graph_mode': 'off', 'use_snp_selection': False}. Best is trial 65 with value: 0.22322163256025554.
[I 2025-12-06 04:42:43,935] Trial 85 finished with value: 0.20457363807712298 and parameters: {'model_type': 'mlp', 'hidden_dims': '[256, 128, 64]', 'dropout': 0.5085226343060134, 'batch_norm': True, 'lr': 1.8767492518507086e-05, 'weight_decay': 4.700318635374333e-05, 'epochs': 331, 'loss': 'mae', 'optimizer': 'adam', 'graph_mode': 'off', 'use_snp_selection': False}. Best is trial 65 with value: 0.22322163256025554.
[I 2025-12-06 04:43:28,090] Trial 86 finished with value: 0.211865819737517 and parameters: {'model_type': 'mlp', 'hidden_dims': '[256, 128, 64]', 'dropout': 0.11012857125679544, 'batch_norm': True, 'lr': 3.9902573776078704e-05, 'weight_decay': 9.642664621134697e-05, 'epochs': 281, 'loss': 'mae', 'optimizer': 'adam', 'graph_mode': 'off', 'use_snp_selection': False}. Best is trial 65 with value: 0.22322163256025554.
[I 2025-12-06 04:44:21,537] Trial 87 finished with value: 0.22420772121771262 and parameters: {'model_type': 'mlp', 'hidden_dims': '[256, 128, 64]', 'dropout': 0.4920274725359478, 'batch_norm': True, 'lr': 1.3691364224667128e-05, 'weight_decay': 3.704448467622372e-05, 'epochs': 350, 'loss': 'mae', 'optimizer': 'adam', 'graph_mode': 'off', 'use_snp_selection': False}. Best is trial 87 with value: 0.22420772121771262.
[I 2025-12-06 04:45:14,863] Trial 88 finished with value: 0.19165159315798772 and parameters: {'model_type': 'mlp', 'hidden_dims': '[256, 128, 64]', 'dropout': 0.1423716080941874, 'batch_norm': True, 'lr': 1.3554115222092673e-05, 'weight_decay': 0.00014287168162451422, 'epochs': 349, 'loss': 'mae', 'optimizer': 'adam', 'graph_mode': 'off', 'use_snp_selection': False}. Best is trial 87 with value: 0.22420772121771262.
[I 2025-12-06 04:46:06,727] Trial 89 finished with value: 0.20674308809137082 and parameters: {'model_type': 'mlp', 'hidden_dims': '[256, 128, 64]', 'dropout': 0.27733715696749994, 'batch_norm': True, 'lr': 2.576944131958792e-05, 'weight_decay': 7.842342573110081e-06, 'epochs': 338, 'loss': 'mae', 'optimizer': 'adam', 'graph_mode': 'off', 'use_snp_selection': False}. Best is trial 87 with value: 0.22420772121771262.
[I 2025-12-06 04:46:54,758] Trial 90 finished with value: 0.18406322935792907 and parameters: {'model_type': 'mlp', 'hidden_dims': '[512, 128]', 'dropout': 0.19863758927761607, 'batch_norm': True, 'lr': 7.708819180377897e-06, 'weight_decay': 6.264130807410256e-05, 'epochs': 186, 'loss': 'mae', 'optimizer': 'adam', 'graph_mode': 'off', 'use_snp_selection': True, 'num_snps': 18400}. Best is trial 87 with value: 0.22420772121771262.
[I 2025-12-06 04:47:44,762] Trial 91 finished with value: 0.21545615254196596 and parameters: {'model_type': 'mlp', 'hidden_dims': '[256, 128, 64]', 'dropout': 0.49063466011438067, 'batch_norm': True, 'lr': 2.8299744548613035e-05, 'weight_decay': 3.229193120449546e-05, 'epochs': 326, 'loss': 'mae', 'optimizer': 'adam', 'graph_mode': 'off', 'use_snp_selection': False}. Best is trial 87 with value: 0.22420772121771262.
[I 2025-12-06 04:48:32,417] Trial 92 finished with value: 0.21535989973391595 and parameters: {'model_type': 'mlp', 'hidden_dims': '[256, 128, 64]', 'dropout': 0.46110381479470325, 'batch_norm': True, 'lr': 2.2134360158490923e-05, 'weight_decay': 3.706100998746244e-05, 'epochs': 307, 'loss': 'mae', 'optimizer': 'adam', 'graph_mode': 'off', 'use_snp_selection': False}. Best is trial 87 with value: 0.22420772121771262.
[I 2025-12-06 04:49:06,698] Trial 93 finished with value: 0.19817608884221707 and parameters: {'model_type': 'mlp', 'hidden_dims': '[256, 128, 64]', 'dropout': 0.5227389380125681, 'batch_norm': True, 'lr': 1.5556049827761124e-05, 'weight_decay': 4.899727946204967e-05, 'epochs': 208, 'loss': 'mae', 'optimizer': 'adam', 'graph_mode': 'off', 'use_snp_selection': False}. Best is trial 87 with value: 0.22420772121771262.
[I 2025-12-06 04:49:58,356] Trial 94 finished with value: 0.20109327967980736 and parameters: {'model_type': 'mlp', 'hidden_dims': '[256, 128, 64]', 'dropout': 0.4818991610000317, 'batch_norm': True, 'lr': 0.0009759757218298173, 'weight_decay': 0.00020816397063243636, 'epochs': 336, 'loss': 'mae', 'optimizer': 'adam', 'graph_mode': 'off', 'use_snp_selection': False}. Best is trial 87 with value: 0.22420772121771262.
[I 2025-12-06 04:50:45,149] Trial 95 finished with value: 0.20621122841941855 and parameters: {'model_type': 'mlp', 'hidden_dims': '[256, 128, 64]', 'dropout': 0.3982723604720614, 'batch_norm': True, 'lr': 5.148769945660522e-05, 'weight_decay': 1.4073619792842489e-05, 'epochs': 300, 'loss': 'mae', 'optimizer': 'adam', 'graph_mode': 'off', 'use_snp_selection': False}. Best is trial 87 with value: 0.22420772121771262.
[I 2025-12-06 04:52:16,436] Trial 96 finished with value: 0.19789906252066042 and parameters: {'model_type': 'mlp', 'hidden_dims': '[512, 64]', 'dropout': 0.21545804818361664, 'batch_norm': True, 'lr': 1.9554724773189184e-05, 'weight_decay': 1.9150904324106997e-05, 'epochs': 320, 'loss': 'mae', 'optimizer': 'adam', 'graph_mode': 'off', 'use_snp_selection': False}. Best is trial 87 with value: 0.22420772121771262.
[I 2025-12-06 04:52:46,240] Trial 97 finished with value: 0.2066548809503545 and parameters: {'model_type': 'mlp', 'hidden_dims': '[128, 64]', 'dropout': 0.12934016950480953, 'batch_norm': True, 'lr': 3.5668990050569615e-05, 'weight_decay': 3.987535378033642e-05, 'epochs': 346, 'loss': 'mae', 'optimizer': 'adam', 'graph_mode': 'off', 'use_snp_selection': False}. Best is trial 87 with value: 0.22420772121771262.
[I 2025-12-06 04:54:20,918] Trial 98 finished with value: 0.2074500331990364 and parameters: {'model_type': 'mlp', 'hidden_dims': '[512, 64]', 'dropout': 0.44879807072885375, 'batch_norm': True, 'lr': 6.792655241998469e-05, 'weight_decay': 6.876337735717764e-05, 'epochs': 333, 'loss': 'mae', 'optimizer': 'adam', 'graph_mode': 'off', 'use_snp_selection': False}. Best is trial 87 with value: 0.22420772121771262.
[I 2025-12-06 04:55:09,619] Trial 99 finished with value: 0.2165127887266431 and parameters: {'model_type': 'mlp', 'hidden_dims': '[256, 128, 64]', 'dropout': 0.42765422152214566, 'batch_norm': True, 'lr': 1.123312192602706e-05, 'weight_decay': 2.42226930712041e-05, 'epochs': 315, 'loss': 'mae', 'optimizer': 'adam', 'graph_mode': 'off', 'use_snp_selection': False}. Best is trial 87 with value: 0.22420772121771262.
[I 2025-12-06 04:56:43,232] Trial 100 finished with value: 0.2178449371223672 and parameters: {'model_type': 'mlp', 'hidden_dims': '[512, 256]', 'dropout': 0.3147439455446907, 'batch_norm': True, 'lr': 4.794540625522958e-05, 'weight_decay': 0.0004223600691985146, 'epochs': 328, 'loss': 'mae', 'optimizer': 'adam', 'graph_mode': 'off', 'use_snp_selection': False}. Best is trial 87 with value: 0.22420772121771262.
[I 2025-12-06 04:58:18,763] Trial 101 finished with value: 0.21394152027281188 and parameters: {'model_type': 'mlp', 'hidden_dims': '[512, 64]', 'dropout': 0.5987742026777311, 'batch_norm': False, 'lr': 5.207411558059347e-06, 'weight_decay': 2.9993377337078232e-05, 'epochs': 341, 'loss': 'mae', 'optimizer': 'adam', 'graph_mode': 'off', 'use_snp_selection': False}. Best is trial 87 with value: 0.22420772121771262.
[I 2025-12-06 04:59:52,789] Trial 102 finished with value: 0.21214071697728917 and parameters: {'model_type': 'mlp', 'hidden_dims': '[512, 64]', 'dropout': 0.556525715933123, 'batch_norm': False, 'lr': 3.3837553641453373e-06, 'weight_decay': 7.731292074768192e-05, 'epochs': 335, 'loss': 'mae', 'optimizer': 'adam', 'graph_mode': 'off', 'use_snp_selection': False}. Best is trial 87 with value: 0.22420772121771262.
[I 2025-12-06 05:01:24,084] Trial 103 finished with value: 0.20390236722172012 and parameters: {'model_type': 'mlp', 'hidden_dims': '[512, 64]', 'dropout': 0.5892318346365688, 'batch_norm': True, 'lr': 2.9653124126706945e-05, 'weight_decay': 8.5888357156735e-06, 'epochs': 321, 'loss': 'mse', 'optimizer': 'adam', 'graph_mode': 'off', 'use_snp_selection': False}. Best is trial 87 with value: 0.22420772121771262.
[I 2025-12-06 05:03:01,789] Trial 104 finished with value: 0.21895574873214216 and parameters: {'model_type': 'mlp', 'hidden_dims': '[512, 64]', 'dropout': 0.5742440312103514, 'batch_norm': True, 'lr': 1.697976555933902e-05, 'weight_decay': 0.00010994331218672714, 'epochs': 345, 'loss': 'mae', 'optimizer': 'adam', 'graph_mode': 'off', 'use_snp_selection': False}. Best is trial 87 with value: 0.22420772121771262.
[I 2025-12-06 05:04:30,413] Trial 105 finished with value: 0.20704237181578994 and parameters: {'model_type': 'mlp', 'hidden_dims': '[512, 128]', 'dropout': 0.5323225671096166, 'batch_norm': True, 'lr': 1.3355851180271997e-05, 'weight_decay': 5.694090634258053e-05, 'epochs': 309, 'loss': 'mae', 'optimizer': 'adam', 'graph_mode': 'off', 'use_snp_selection': False}. Best is trial 87 with value: 0.22420772121771262.
[I 2025-12-06 05:05:54,207] Trial 106 finished with value: 0.20893528130911543 and parameters: {'model_type': 'mlp', 'hidden_dims': '[512, 64]', 'dropout': 0.3356449137231752, 'batch_norm': False, 'lr': 0.0001345818544176435, 'weight_decay': 3.8061020898232106e-05, 'epochs': 300, 'loss': 'mae', 'optimizer': 'adam', 'graph_mode': 'off', 'use_snp_selection': False}. Best is trial 87 with value: 0.22420772121771262.
[I 2025-12-06 05:07:17,317] Trial 107 finished with value: 0.2138147541019742 and parameters: {'model_type': 'mlp', 'hidden_dims': '[512, 64]', 'dropout': 0.15547754719508217, 'batch_norm': True, 'lr': 2.044090262323727e-05, 'weight_decay': 4.395268958794275e-05, 'epochs': 289, 'loss': 'mae', 'optimizer': 'adam', 'graph_mode': 'off', 'use_snp_selection': False}. Best is trial 87 with value: 0.22420772121771262.
[I 2025-12-06 05:08:10,372] Trial 108 finished with value: 0.22747687994382543 and parameters: {'model_type': 'mlp', 'hidden_dims': '[256, 128, 64]', 'dropout': 0.1179753256648306, 'batch_norm': True, 'lr': 4.1350626813619166e-05, 'weight_decay': 2.0604613591821203e-05, 'epochs': 317, 'loss': 'mae', 'optimizer': 'adam', 'graph_mode': 'off', 'use_snp_selection': True, 'num_snps': 24773}. Best is trial 108 with value: 0.22747687994382543.
[I 2025-12-06 05:09:05,054] Trial 109 finished with value: 0.2072292463194692 and parameters: {'model_type': 'mlp', 'hidden_dims': '[256, 128, 64]', 'dropout': 0.11277542805608168, 'batch_norm': True, 'lr': 3.953408334260111e-05, 'weight_decay': 1.9995977286899224e-05, 'epochs': 350, 'loss': 'mae', 'optimizer': 'adam', 'graph_mode': 'off', 'use_snp_selection': True, 'num_snps': 24718}. Best is trial 108 with value: 0.22747687994382543.
[I 2025-12-06 05:10:02,933] Trial 110 finished with value: 0.20377232559171157 and parameters: {'model_type': 'mlp', 'hidden_dims': '[256, 128, 64]', 'dropout': 0.1727531281163627, 'batch_norm': True, 'lr': 3.31733516396213e-05, 'weight_decay': 2.815968247350838e-05, 'epochs': 327, 'loss': 'mae', 'optimizer': 'adam', 'graph_mode': 'off', 'use_snp_selection': True, 'num_snps': 29764}. Best is trial 108 with value: 0.22747687994382543.
[I 2025-12-06 05:10:51,372] Trial 111 finished with value: 0.20596328583404663 and parameters: {'model_type': 'mlp', 'hidden_dims': '[256, 128, 64]', 'dropout': 0.13985388604334884, 'batch_norm': True, 'lr': 5.725094337319721e-05, 'weight_decay': 1.4924552261361733e-05, 'epochs': 317, 'loss': 'mae', 'optimizer': 'adam', 'graph_mode': 'off', 'use_snp_selection': False}. Best is trial 108 with value: 0.22747687994382543.
[I 2025-12-06 05:11:33,029] Trial 112 finished with value: 0.21799980508747702 and parameters: {'model_type': 'mlp', 'hidden_dims': '[256, 128, 64]', 'dropout': 0.1266327266128402, 'batch_norm': True, 'lr': 2.6094482931895182e-05, 'weight_decay': 5.228206151250477e-05, 'epochs': 337, 'loss': 'mae', 'optimizer': 'adam', 'graph_mode': 'off', 'use_snp_selection': True, 'num_snps': 12489}. Best is trial 108 with value: 0.22747687994382543.
[I 2025-12-06 05:13:03,348] Trial 113 finished with value: 0.2117643479644471 and parameters: {'model_type': 'mlp', 'hidden_dims': '[512, 64]', 'dropout': 0.3746590597491931, 'batch_norm': True, 'lr': 4.4105106893222686e-05, 'weight_decay': 1.1975248386857972e-05, 'epochs': 323, 'loss': 'mae', 'optimizer': 'adam', 'graph_mode': 'off', 'use_snp_selection': True, 'num_snps': 38037}. Best is trial 108 with value: 0.22747687994382543.
[I 2025-12-06 05:14:53,670] Trial 114 finished with value: 0.21132436511364766 and parameters: {'model_type': 'mlp', 'hidden_dims': '[512, 64]', 'dropout': 0.5651313794079336, 'batch_norm': True, 'lr': 8.872047088871389e-05, 'weight_decay': 2.550465393276151e-05, 'epochs': 314, 'loss': 'mae', 'optimizer': 'adam', 'graph_mode': 'off', 'use_snp_selection': True, 'num_snps': 51777}. Best is trial 108 with value: 0.22747687994382543.
[I 2025-12-06 05:16:27,660] Trial 115 finished with value: 0.2100254873285059 and parameters: {'model_type': 'mlp', 'hidden_dims': '[512, 128]', 'dropout': 0.11548513947733095, 'batch_norm': True, 'lr': 7.493360242331938e-05, 'weight_decay': 3.2619772940260875e-05, 'epochs': 332, 'loss': 'mae', 'optimizer': 'adam', 'graph_mode': 'off', 'use_snp_selection': False}. Best is trial 108 with value: 0.22747687994382543.
[I 2025-12-06 05:16:56,752] Trial 116 finished with value: 0.19569437826330427 and parameters: {'model_type': 'mlp', 'hidden_dims': '[256, 128, 64]', 'dropout': 0.10094045133164414, 'batch_norm': True, 'lr': 2.3734629505101593e-05, 'weight_decay': 2.0380297525672588e-05, 'epochs': 170, 'loss': 'mse', 'optimizer': 'adam', 'graph_mode': 'off', 'use_snp_selection': False}. Best is trial 108 with value: 0.22747687994382543.
