[I 2025-12-05 16:15:52,462] Trial 121 finished with value: 0.09969534412712702 and parameters: {'model_type': 'mlp', 'hidden_dims': '[256, 128, 64]', 'dropout': 0.24719557232592432, 'batch_norm': True, 'lr': 0.0009908490864976869, 'weight_decay': 1.571470539435117e-07, 'epochs': 211, 'loss': 'mae', 'optimizer': 'adam', 'graph_mode': 'off', 'use_snp_selection': True, 'num_snps': 55116}. Best is trial 79 with value: 0.12154521220053922.
[I 2025-12-05 16:15:55,390] Trial 122 finished with value: 0.11081560165344499 and parameters: {'model_type': 'mlp', 'hidden_dims': '[256, 128, 64]', 'dropout': 0.21229679930932466, 'batch_norm': True, 'lr': 0.0006515876884372812, 'weight_decay': 2.4002908605302943e-07, 'epochs': 181, 'loss': 'mae', 'optimizer': 'adam', 'graph_mode': 'off', 'use_snp_selection': True, 'num_snps': 59699}. Best is trial 79 with value: 0.12154521220053922.
[I 2025-12-05 16:15:58,170] Trial 123 finished with value: 0.0979417041216659 and parameters: {'model_type': 'mlp', 'hidden_dims': '[256, 128, 64]', 'dropout': 0.28343234282678376, 'batch_norm': True, 'lr': 0.0006587755996568022, 'weight_decay': 2.1499017576253248e-07, 'epochs': 164, 'loss': 'mae', 'optimizer': 'adam', 'graph_mode': 'off', 'use_snp_selection': True, 'num_snps': 59669}. Best is trial 79 with value: 0.12154521220053922.
[I 2025-12-05 16:16:00,656] Trial 124 finished with value: 0.10591562196003954 and parameters: {'model_type': 'mlp', 'hidden_dims': '[128, 64]', 'dropout': 0.2607143416860624, 'batch_norm': True, 'lr': 0.0007943763938666954, 'weight_decay': 4.173964192509571e-07, 'epochs': 182, 'loss': 'mae', 'optimizer': 'adam', 'graph_mode': 'off', 'use_snp_selection': True, 'num_snps': 56826}. Best is trial 79 with value: 0.12154521220053922.
[I 2025-12-05 16:16:03,308] Trial 125 finished with value: 0.006962258569680193 and parameters: {'model_type': 'mlp', 'hidden_dims': '[256, 128, 64]', 'dropout': 0.21253087273571758, 'batch_norm': True, 'lr': 3.842502575884526e-06, 'weight_decay': 5.448364847635712e-07, 'epochs': 229, 'loss': 'mae', 'optimizer': 'adam', 'graph_mode': 'off', 'use_snp_selection': True, 'num_snps': 52281}. Best is trial 79 with value: 0.12154521220053922.
[I 2025-12-05 16:16:05,733] Trial 126 finished with value: 0.09042055518627744 and parameters: {'model_type': 'mlp', 'hidden_dims': '[256, 128, 64]', 'dropout': 0.1872900845266045, 'batch_norm': True, 'lr': 0.0009825689030060084, 'weight_decay': 2.4531341030716146e-07, 'epochs': 204, 'loss': 'mae', 'optimizer': 'adam', 'graph_mode': 'off', 'use_snp_selection': True, 'num_snps': 45161}. Best is trial 79 with value: 0.12154521220053922.
[I 2025-12-05 16:16:08,129] Trial 127 finished with value: 0.09425557186891145 and parameters: {'model_type': 'mlp', 'hidden_dims': '[256, 128, 64]', 'dropout': 0.19749656335891394, 'batch_norm': True, 'lr': 0.0006386333677205296, 'weight_decay': 3.6820287025350586e-05, 'epochs': 244, 'loss': 'mae', 'optimizer': 'adam', 'graph_mode': 'off', 'use_snp_selection': True, 'num_snps': 39552}. Best is trial 79 with value: 0.12154521220053922.
[I 2025-12-05 16:16:10,583] Trial 128 finished with value: 0.09184530659465255 and parameters: {'model_type': 'mlp', 'hidden_dims': '[256, 128, 64]', 'dropout': 0.22319649059378413, 'batch_norm': True, 'lr': 0.0007331612003080792, 'weight_decay': 1.2913413856340413e-06, 'epochs': 145, 'loss': 'mae', 'optimizer': 'adam', 'graph_mode': 'off', 'use_snp_selection': True, 'num_snps': 49266}. Best is trial 79 with value: 0.12154521220053922.
[I 2025-12-05 16:16:13,372] Trial 129 finished with value: 0.0893115982825907 and parameters: {'model_type': 'mlp', 'hidden_dims': '[128, 64]', 'dropout': 0.206336037489488, 'batch_norm': True, 'lr': 0.0008352640317369774, 'weight_decay': 3.4043574894354894e-07, 'epochs': 342, 'loss': 'mae', 'optimizer': 'adam', 'graph_mode': 'off', 'use_snp_selection': True, 'num_snps': 59898}. Best is trial 79 with value: 0.12154521220053922.
[I 2025-12-05 16:16:16,511] Trial 130 finished with value: 0.0923401052349271 and parameters: {'model_type': 'mlp', 'hidden_dims': '[512, 128]', 'dropout': 0.2366948717250001, 'batch_norm': True, 'lr': 0.0005679640327369738, 'weight_decay': 6.905488382258863e-07, 'epochs': 194, 'loss': 'mae', 'optimizer': 'adam', 'graph_mode': 'off', 'use_snp_selection': True, 'num_snps': 54355}. Best is trial 79 with value: 0.12154521220053922.
[I 2025-12-05 16:16:18,992] Trial 131 finished with value: 0.08431975455959742 and parameters: {'model_type': 'mlp', 'hidden_dims': '[128, 64]', 'dropout': 0.2623104811592312, 'batch_norm': True, 'lr': 0.0007372663866194617, 'weight_decay': 4.3532278584154343e-07, 'epochs': 176, 'loss': 'mae', 'optimizer': 'adam', 'graph_mode': 'off', 'use_snp_selection': True, 'num_snps': 56983}. Best is trial 79 with value: 0.12154521220053922.
[I 2025-12-05 16:16:21,670] Trial 132 finished with value: 0.08892635291193322 and parameters: {'model_type': 'mlp', 'hidden_dims': '[128, 64]', 'dropout': 0.30142743426626206, 'batch_norm': True, 'lr': 0.0008164705657889142, 'weight_decay': 2.85298374508635e-07, 'epochs': 179, 'loss': 'mae', 'optimizer': 'adam', 'graph_mode': 'off', 'use_snp_selection': True, 'num_snps': 57821}. Best is trial 79 with value: 0.12154521220053922.
[I 2025-12-05 16:16:24,069] Trial 133 finished with value: 0.09205700448252388 and parameters: {'model_type': 'mlp', 'hidden_dims': '[128, 64]', 'dropout': 0.250070006939481, 'batch_norm': True, 'lr': 0.0008695919258831129, 'weight_decay': 8.158483354021348e-07, 'epochs': 199, 'loss': 'mae', 'optimizer': 'adam', 'graph_mode': 'off', 'use_snp_selection': True, 'num_snps': 48075}. Best is trial 79 with value: 0.12154521220053922.
[I 2025-12-05 16:16:26,536] Trial 134 finished with value: 0.09291266036874232 and parameters: {'model_type': 'mlp', 'hidden_dims': '[128, 64]', 'dropout': 0.25851425038981046, 'batch_norm': True, 'lr': 0.00046695713088386234, 'weight_decay': 3.986277176488014e-07, 'epochs': 182, 'loss': 'mae', 'optimizer': 'adam', 'graph_mode': 'off', 'use_snp_selection': True, 'num_snps': 52717}. Best is trial 79 with value: 0.12154521220053922.
[I 2025-12-05 16:16:29,456] Trial 135 finished with value: 0.09455397592817971 and parameters: {'model_type': 'mlp', 'hidden_dims': '[512, 64]', 'dropout': 0.2776843106976407, 'batch_norm': True, 'lr': 0.0009949529549322265, 'weight_decay': 5.347709892519212e-07, 'epochs': 223, 'loss': 'mae', 'optimizer': 'adam', 'graph_mode': 'off', 'use_snp_selection': True, 'num_snps': 45933}. Best is trial 79 with value: 0.12154521220053922.
[I 2025-12-05 16:16:31,886] Trial 136 finished with value: 0.12006785593379438 and parameters: {'model_type': 'mlp', 'hidden_dims': '[128, 64]', 'dropout': 0.4735194612464144, 'batch_norm': True, 'lr': 0.0006470847220340437, 'weight_decay': 1.110767580973973e-05, 'epochs': 168, 'loss': 'mae', 'optimizer': 'adam', 'graph_mode': 'off', 'use_snp_selection': True, 'num_snps': 56488}. Best is trial 79 with value: 0.12154521220053922.
[I 2025-12-05 16:16:32,902] Trial 137 finished with value: 0.050834716223048866 and parameters: {'model_type': 'mlp', 'hidden_dims': '[128, 64]', 'dropout': 0.46243661825765964, 'batch_norm': False, 'lr': 0.00011345601330604379, 'weight_decay': 8.524863587040288e-06, 'epochs': 254, 'loss': 'mae', 'optimizer': 'adam', 'graph_mode': 'off', 'use_snp_selection': True, 'num_snps': 4232}. Best is trial 79 with value: 0.12154521220053922.
[I 2025-12-05 16:16:34,586] Trial 138 finished with value: 0.10514622552760193 and parameters: {'model_type': 'mlp', 'hidden_dims': '[512, 128]', 'dropout': 0.21802509446690385, 'batch_norm': True, 'lr': 0.0005912055446181214, 'weight_decay': 1.2855210545900464e-05, 'epochs': 165, 'loss': 'mae', 'optimizer': 'adam', 'graph_mode': 'off', 'use_snp_selection': False}. Best is trial 79 with value: 0.12154521220053922.
[I 2025-12-05 16:16:36,531] Trial 139 finished with value: 0.09883806095639948 and parameters: {'model_type': 'mlp', 'hidden_dims': '[128, 64]', 'dropout': 0.5322186850229067, 'batch_norm': True, 'lr': 0.0006748274536439959, 'weight_decay': 1.896944297068232e-05, 'epochs': 147, 'loss': 'mae', 'optimizer': 'adam', 'graph_mode': 'off', 'use_snp_selection': True, 'num_snps': 34155}. Best is trial 79 with value: 0.12154521220053922.
[I 2025-12-05 16:16:37,829] Trial 140 finished with value: 0.0961084761324496 and parameters: {'model_type': 'mlp', 'hidden_dims': '[256, 128]', 'dropout': 0.4346355602176244, 'batch_norm': True, 'lr': 0.0005282147395573385, 'weight_decay': 1.1345123927635815e-05, 'epochs': 236, 'loss': 'mae', 'optimizer': 'adam', 'graph_mode': 'off', 'use_snp_selection': False}. Best is trial 79 with value: 0.12154521220053922.
[I 2025-12-05 16:16:40,415] Trial 141 finished with value: 0.09529945334204379 and parameters: {'model_type': 'mlp', 'hidden_dims': '[128, 64]', 'dropout': 0.23238735748053316, 'batch_norm': True, 'lr': 0.0007554306970370113, 'weight_decay': 1.0212058323660909e-07, 'epochs': 154, 'loss': 'mae', 'optimizer': 'adam', 'graph_mode': 'off', 'use_snp_selection': True, 'num_snps': 56722}. Best is trial 79 with value: 0.12154521220053922.
[I 2025-12-05 16:16:42,780] Trial 142 finished with value: 0.0981103817736772 and parameters: {'model_type': 'mlp', 'hidden_dims': '[128, 64]', 'dropout': 0.5884810065241829, 'batch_norm': True, 'lr': 0.0008467480773967176, 'weight_decay': 6.230764703108976e-06, 'epochs': 191, 'loss': 'mae', 'optimizer': 'adam', 'graph_mode': 'off', 'use_snp_selection': True, 'num_snps': 51214}. Best is trial 79 with value: 0.12154521220053922.
[I 2025-12-05 16:16:45,249] Trial 143 finished with value: 0.10181006936108167 and parameters: {'model_type': 'mlp', 'hidden_dims': '[128, 64]', 'dropout': 0.176448021878221, 'batch_norm': True, 'lr': 0.0006186734835773069, 'weight_decay': 6.410738697216444e-07, 'epochs': 212, 'loss': 'mae', 'optimizer': 'adam', 'graph_mode': 'off', 'use_snp_selection': True, 'num_snps': 54000}. Best is trial 79 with value: 0.12154521220053922.
[I 2025-12-05 16:16:47,754] Trial 144 finished with value: 0.09097238385105279 and parameters: {'model_type': 'mlp', 'hidden_dims': '[128, 64]', 'dropout': 0.36558650882487387, 'batch_norm': True, 'lr': 0.0006996299209647227, 'weight_decay': 1.7959839968812886e-07, 'epochs': 188, 'loss': 'mae', 'optimizer': 'adam', 'graph_mode': 'off', 'use_snp_selection': True, 'num_snps': 58075}. Best is trial 79 with value: 0.12154521220053922.
[I 2025-12-05 16:16:50,050] Trial 145 finished with value: 0.09759971052584322 and parameters: {'model_type': 'mlp', 'hidden_dims': '[128, 64]', 'dropout': 0.493860184508805, 'batch_norm': True, 'lr': 0.0008868591105451071, 'weight_decay': 8.911482116827924e-05, 'epochs': 166, 'loss': 'mae', 'optimizer': 'adam', 'graph_mode': 'off', 'use_snp_selection': True, 'num_snps': 50912}. Best is trial 79 with value: 0.12154521220053922.
[I 2025-12-05 16:16:51,190] Trial 146 finished with value: 0.11257129094096945 and parameters: {'model_type': 'mlp', 'hidden_dims': '[256, 128, 64]', 'dropout': 0.19382061549192323, 'batch_norm': True, 'lr': 0.000465556016759268, 'weight_decay': 2.2732979824852647e-07, 'epochs': 171, 'loss': 'mae', 'optimizer': 'adam', 'graph_mode': 'off', 'use_snp_selection': False}. Best is trial 79 with value: 0.12154521220053922.
[I 2025-12-05 16:16:52,343] Trial 147 finished with value: 0.09629393952435249 and parameters: {'model_type': 'mlp', 'hidden_dims': '[256, 128, 64]', 'dropout': 0.18864462177560903, 'batch_norm': True, 'lr': 0.0003754342559346748, 'weight_decay': 2.3561222902969302e-07, 'epochs': 172, 'loss': 'mae', 'optimizer': 'adam', 'graph_mode': 'off', 'use_snp_selection': False}. Best is trial 79 with value: 0.12154521220053922.
[I 2025-12-05 16:16:53,936] Trial 148 finished with value: 0.11218705290991873 and parameters: {'model_type': 'mlp', 'hidden_dims': '[256, 128, 64]', 'dropout': 0.16376634128705483, 'batch_norm': True, 'lr': 0.0004638959661186867, 'weight_decay': 2.485691292614621e-06, 'epochs': 335, 'loss': 'mae', 'optimizer': 'adam', 'graph_mode': 'off', 'use_snp_selection': False}. Best is trial 79 with value: 0.12154521220053922.
[I 2025-12-05 16:16:55,575] Trial 149 finished with value: 0.11570693289877004 and parameters: {'model_type': 'mlp', 'hidden_dims': '[256, 128, 64]', 'dropout': 0.16124357679007745, 'batch_norm': True, 'lr': 0.00043539515541070887, 'weight_decay': 2.929703116862019e-06, 'epochs': 350, 'loss': 'mae', 'optimizer': 'adam', 'graph_mode': 'off', 'use_snp_selection': False}. Best is trial 79 with value: 0.12154521220053922.
[I 2025-12-05 16:16:57,823] Trial 0 finished with value: -0.005346785520685615 and parameters: {'model_type': 'mlp', 'hidden_dims': '[128, 64]', 'dropout': 0.199031432379812, 'batch_norm': True, 'lr': 1.8408544111075837e-06, 'weight_decay': 5.5136510071208614e-05, 'epochs': 336, 'loss': 'mae', 'optimizer': 'adam', 'graph_mode': 'off', 'use_snp_selection': True, 'num_snps': 43862}. Best is trial 0 with value: -0.005346785520685615.
[I 2025-12-05 16:16:59,008] Trial 1 finished with value: 0.05449071216912766 and parameters: {'model_type': 'mlp', 'hidden_dims': '[256, 128]', 'dropout': 0.4370668075331726, 'batch_norm': True, 'lr': 7.133471581159139e-05, 'weight_decay': 1.128633586803549e-05, 'epochs': 242, 'loss': 'mae', 'optimizer': 'adam', 'graph_mode': 'off', 'use_snp_selection': False}. Best is trial 1 with value: 0.05449071216912766.
[I 2025-12-05 16:17:00,035] Trial 2 finished with value: 0.03949902045569174 and parameters: {'model_type': 'mlp', 'hidden_dims': '[256, 128, 64]', 'dropout': 0.41314357415569625, 'batch_norm': False, 'lr': 3.952233718592101e-06, 'weight_decay': 0.00026754769258252603, 'epochs': 149, 'loss': 'mse', 'optimizer': 'adam', 'graph_mode': 'off', 'use_snp_selection': True, 'num_snps': 11571}. Best is trial 1 with value: 0.05449071216912766.
[I 2025-12-05 16:17:02,135] Trial 3 finished with value: 0.03939754791069599 and parameters: {'model_type': 'mlp', 'hidden_dims': '[512, 64]', 'dropout': 0.5938127374509361, 'batch_norm': False, 'lr': 5.67704586114731e-06, 'weight_decay': 2.4518087630137052e-05, 'epochs': 320, 'loss': 'mae', 'optimizer': 'adam', 'graph_mode': 'off', 'use_snp_selection': False}. Best is trial 1 with value: 0.05449071216912766.
[I 2025-12-05 16:17:04,493] Trial 4 finished with value: 0.02678103072932676 and parameters: {'model_type': 'mlp', 'hidden_dims': '[512, 128]', 'dropout': 0.25746343592134413, 'batch_norm': True, 'lr': 1.3467657668402788e-06, 'weight_decay': 0.00033087251918647806, 'epochs': 277, 'loss': 'mse', 'optimizer': 'adam', 'graph_mode': 'off', 'use_snp_selection': True, 'num_snps': 36675}. Best is trial 1 with value: 0.05449071216912766.
[I 2025-12-05 16:17:06,381] Trial 5 finished with value: 0.041236743908775964 and parameters: {'model_type': 'mlp', 'hidden_dims': '[512, 64]', 'dropout': 0.38275350994408375, 'batch_norm': True, 'lr': 1.5586664309232824e-06, 'weight_decay': 0.0008227664668621182, 'epochs': 145, 'loss': 'mae', 'optimizer': 'adam', 'graph_mode': 'off', 'use_snp_selection': True, 'num_snps': 32148}. Best is trial 1 with value: 0.05449071216912766.
[I 2025-12-05 16:17:07,513] Trial 6 finished with value: 0.027377559340885052 and parameters: {'model_type': 'mlp', 'hidden_dims': '[256, 128]', 'dropout': 0.3930109900265879, 'batch_norm': False, 'lr': 4.892964372128395e-05, 'weight_decay': 1.5809549317992182e-06, 'epochs': 199, 'loss': 'mse', 'optimizer': 'adam', 'graph_mode': 'off', 'use_snp_selection': False}. Best is trial 1 with value: 0.05449071216912766.
[I 2025-12-05 16:17:08,718] Trial 7 finished with value: 0.03764822479148527 and parameters: {'model_type': 'mlp', 'hidden_dims': '[512, 256]', 'dropout': 0.15343979219678458, 'batch_norm': True, 'lr': 6.234003099047341e-05, 'weight_decay': 3.894760610535477e-07, 'epochs': 97, 'loss': 'mse', 'optimizer': 'adam', 'graph_mode': 'off', 'use_snp_selection': False}. Best is trial 1 with value: 0.05449071216912766.
[I 2025-12-05 16:17:10,849] Trial 8 finished with value: 0.040732880248405774 and parameters: {'model_type': 'mlp', 'hidden_dims': '[512, 128]', 'dropout': 0.10743001231661406, 'batch_norm': True, 'lr': 0.00023728538449271062, 'weight_decay': 1.7629071578048637e-05, 'epochs': 312, 'loss': 'mae', 'optimizer': 'adam', 'graph_mode': 'off', 'use_snp_selection': False}. Best is trial 1 with value: 0.05449071216912766.
[I 2025-12-05 16:17:12,380] Trial 9 finished with value: 0.0291393071788048 and parameters: {'model_type': 'mlp', 'hidden_dims': '[512, 64]', 'dropout': 0.14505336736221927, 'batch_norm': True, 'lr': 5.8619638388111826e-05, 'weight_decay': 6.200156172669308e-07, 'epochs': 175, 'loss': 'mse', 'optimizer': 'adam', 'graph_mode': 'off', 'use_snp_selection': False}. Best is trial 1 with value: 0.05449071216912766.
[I 2025-12-05 16:17:13,559] Trial 10 finished with value: 0.049139289211524384 and parameters: {'model_type': 'mlp', 'hidden_dims': '[256, 128]', 'dropout': 0.5365714961141473, 'batch_norm': False, 'lr': 0.00032955828969150785, 'weight_decay': 3.381683344261174e-06, 'epochs': 236, 'loss': 'mae', 'optimizer': 'adam', 'graph_mode': 'off', 'use_snp_selection': False}. Best is trial 1 with value: 0.05449071216912766.
[I 2025-12-05 16:17:14,741] Trial 11 finished with value: -0.0002343596877582265 and parameters: {'model_type': 'mlp', 'hidden_dims': '[256, 128]', 'dropout': 0.5245918176739586, 'batch_norm': False, 'lr': 0.0008032461098320499, 'weight_decay': 3.590337640024813e-06, 'epochs': 239, 'loss': 'mae', 'optimizer': 'adam', 'graph_mode': 'off', 'use_snp_selection': False}. Best is trial 1 with value: 0.05449071216912766.
[I 2025-12-05 16:17:15,948] Trial 12 finished with value: 0.00043695180978653436 and parameters: {'model_type': 'mlp', 'hidden_dims': '[256, 128]', 'dropout': 0.4813940450675722, 'batch_norm': False, 'lr': 0.00026576228959612443, 'weight_decay': 1.3081036432574914e-07, 'epochs': 234, 'loss': 'mae', 'optimizer': 'adam', 'graph_mode': 'off', 'use_snp_selection': False}. Best is trial 1 with value: 0.05449071216912766.
[I 2025-12-05 16:17:17,173] Trial 13 finished with value: 0.026325616880896383 and parameters: {'model_type': 'mlp', 'hidden_dims': '[256, 128]', 'dropout': 0.4972381959269697, 'batch_norm': False, 'lr': 1.8184704710575438e-05, 'weight_decay': 6.641543531184558e-06, 'epochs': 256, 'loss': 'mae', 'optimizer': 'adam', 'graph_mode': 'off', 'use_snp_selection': False}. Best is trial 1 with value: 0.05449071216912766.
[I 2025-12-05 16:17:17,887] Trial 14 finished with value: 0.04381506885295848 and parameters: {'model_type': 'mlp', 'hidden_dims': '[256, 128]', 'dropout': 0.3012984444538551, 'batch_norm': True, 'lr': 0.0002108574938852793, 'weight_decay': 6.9442169885097e-05, 'epochs': 42, 'loss': 'mae', 'optimizer': 'adam', 'graph_mode': 'off', 'use_snp_selection': False}. Best is trial 1 with value: 0.05449071216912766.
[I 2025-12-05 16:17:18,703] Trial 15 finished with value: 0.0551729892126319 and parameters: {'model_type': 'mlp', 'hidden_dims': '[128, 64]', 'dropout': 0.5975304352136959, 'batch_norm': False, 'lr': 0.0005897942264929748, 'weight_decay': 2.3807353114632773e-06, 'epochs': 202, 'loss': 'mae', 'optimizer': 'adam', 'graph_mode': 'off', 'use_snp_selection': False}. Best is trial 15 with value: 0.0551729892126319.
[I 2025-12-05 16:17:19,560] Trial 16 finished with value: 0.03821956538403162 and parameters: {'model_type': 'mlp', 'hidden_dims': '[128, 64]', 'dropout': 0.45139118798037386, 'batch_norm': True, 'lr': 0.0007814725850485319, 'weight_decay': 1.3863650262743918e-06, 'epochs': 189, 'loss': 'mae', 'optimizer': 'adam', 'graph_mode': 'off', 'use_snp_selection': False}. Best is trial 15 with value: 0.0551729892126319.
[I 2025-12-05 16:17:20,490] Trial 17 finished with value: 0.03404451300219072 and parameters: {'model_type': 'mlp', 'hidden_dims': '[128, 64]', 'dropout': 0.5927566423610104, 'batch_norm': False, 'lr': 2.349300150160787e-05, 'weight_decay': 7.470963505970814e-06, 'epochs': 287, 'loss': 'mae', 'optimizer': 'adam', 'graph_mode': 'off', 'use_snp_selection': False}. Best is trial 15 with value: 0.0551729892126319.
[I 2025-12-05 16:17:23,440] Trial 18 finished with value: 0.016294168506047466 and parameters: {'model_type': 'mlp', 'hidden_dims': '[512, 256]', 'dropout': 0.4397817820374784, 'batch_norm': False, 'lr': 0.00011122414681406602, 'weight_decay': 5.1284909832915915e-05, 'epochs': 114, 'loss': 'mae', 'optimizer': 'adam', 'graph_mode': 'off', 'use_snp_selection': True, 'num_snps': 58241}. Best is trial 15 with value: 0.0551729892126319.
[I 2025-12-05 16:17:24,622] Trial 19 finished with value: 0.030850111397271254 and parameters: {'model_type': 'mlp', 'hidden_dims': '[256, 128, 64]', 'dropout': 0.30830793017362135, 'batch_norm': True, 'lr': 1.0948955842261321e-05, 'weight_decay': 1.1354159408743119e-07, 'epochs': 208, 'loss': 'mae', 'optimizer': 'adam', 'graph_mode': 'off', 'use_snp_selection': False}. Best is trial 15 with value: 0.0551729892126319.
[I 2025-12-05 16:17:25,614] Trial 20 finished with value: 0.055891923018492315 and parameters: {'model_type': 'mlp', 'hidden_dims': '[128, 64]', 'dropout': 0.5539228636407943, 'batch_norm': True, 'lr': 0.00011906975871883695, 'weight_decay': 4.946620551771411e-07, 'epochs': 279, 'loss': 'mae', 'optimizer': 'adam', 'graph_mode': 'off', 'use_snp_selection': False}. Best is trial 20 with value: 0.055891923018492315.
[I 2025-12-05 16:17:26,598] Trial 21 finished with value: 0.04615752868021986 and parameters: {'model_type': 'mlp', 'hidden_dims': '[128, 64]', 'dropout': 0.5500568667703395, 'batch_norm': True, 'lr': 0.00011467620668229786, 'weight_decay': 4.858526771158181e-07, 'epochs': 282, 'loss': 'mae', 'optimizer': 'adam', 'graph_mode': 'off', 'use_snp_selection': False}. Best is trial 20 with value: 0.055891923018492315.
