[I 2025-12-05 15:33:01,072] Trial 104 finished with value: 0.26385897747243836 and parameters: {'model_type': 'mlp', 'hidden_dims': '[512, 256]', 'dropout': 0.5634933002620198, 'batch_norm': False, 'lr': 5.43742836610937e-05, 'weight_decay': 1.394227628447298e-06, 'epochs': 63, 'loss': 'mae', 'optimizer': 'adam', 'graph_mode': 'off', 'use_snp_selection': False}. Best is trial 88 with value: 0.2809523674077484.
[I 2025-12-05 15:33:20,871] Trial 105 finished with value: 0.2572566166108654 and parameters: {'model_type': 'mlp', 'hidden_dims': '[512, 256]', 'dropout': 0.5385781009928999, 'batch_norm': False, 'lr': 0.00025384320723617594, 'weight_decay': 5.381425755276124e-07, 'epochs': 44, 'loss': 'mae', 'optimizer': 'adam', 'graph_mode': 'off', 'use_snp_selection': False}. Best is trial 88 with value: 0.2809523674077484.
[I 2025-12-05 15:34:31,703] Trial 106 finished with value: 0.26115922860527285 and parameters: {'model_type': 'mlp', 'hidden_dims': '[512, 64]', 'dropout': 0.46038430891636467, 'batch_norm': False, 'lr': 7.427341709252211e-05, 'weight_decay': 8.720493113383884e-07, 'epochs': 230, 'loss': 'mae', 'optimizer': 'adam', 'graph_mode': 'off', 'use_snp_selection': False}. Best is trial 88 with value: 0.2809523674077484.
[I 2025-12-05 15:35:11,336] Trial 107 finished with value: 0.24289910669521406 and parameters: {'model_type': 'mlp', 'hidden_dims': '[512, 64]', 'dropout': 0.36191546078503756, 'batch_norm': False, 'lr': 4.4407695491401405e-05, 'weight_decay': 1.1011603661557514e-07, 'epochs': 77, 'loss': 'mae', 'optimizer': 'adam', 'graph_mode': 'off', 'use_snp_selection': True, 'num_snps': 13942}. Best is trial 88 with value: 0.2809523674077484.
[I 2025-12-05 15:35:34,451] Trial 108 finished with value: 0.26344209154724624 and parameters: {'model_type': 'mlp', 'hidden_dims': '[512, 256]', 'dropout': 0.5915973035542598, 'batch_norm': False, 'lr': 3.087757335793062e-05, 'weight_decay': 2.46043201006975e-06, 'epochs': 56, 'loss': 'mse', 'optimizer': 'adam', 'graph_mode': 'off', 'use_snp_selection': False}. Best is trial 88 with value: 0.2809523674077484.
[I 2025-12-05 15:36:04,783] Trial 109 finished with value: 0.25360614159423517 and parameters: {'model_type': 'mlp', 'hidden_dims': '[512, 64]', 'dropout': 0.571869312220198, 'batch_norm': False, 'lr': 6.968617337905267e-05, 'weight_decay': 1.1447344930307279e-05, 'epochs': 83, 'loss': 'mae', 'optimizer': 'adam', 'graph_mode': 'off', 'use_snp_selection': False}. Best is trial 88 with value: 0.2809523674077484.
[I 2025-12-05 15:36:25,240] Trial 110 finished with value: 0.26366159854801224 and parameters: {'model_type': 'mlp', 'hidden_dims': '[256, 128]', 'dropout': 0.47623805973856304, 'batch_norm': False, 'lr': 2.2431035803303443e-05, 'weight_decay': 6.193270694868057e-06, 'epochs': 98, 'loss': 'mae', 'optimizer': 'adam', 'graph_mode': 'off', 'use_snp_selection': False}. Best is trial 88 with value: 0.2809523674077484.
[I 2025-12-05 15:36:57,351] Trial 111 finished with value: 0.27335154690273067 and parameters: {'model_type': 'mlp', 'hidden_dims': '[512, 128]', 'dropout': 0.5222145735615159, 'batch_norm': False, 'lr': 3.662408833068993e-05, 'weight_decay': 4.5996761894019715e-06, 'epochs': 89, 'loss': 'mae', 'optimizer': 'adam', 'graph_mode': 'off', 'use_snp_selection': False}. Best is trial 88 with value: 0.2809523674077484.
[I 2025-12-05 15:37:24,490] Trial 112 finished with value: 0.2675407407725673 and parameters: {'model_type': 'mlp', 'hidden_dims': '[512, 128]', 'dropout': 0.5205543301780982, 'batch_norm': False, 'lr': 3.423485829526282e-05, 'weight_decay': 4.3768373412893964e-06, 'epochs': 71, 'loss': 'mae', 'optimizer': 'adam', 'graph_mode': 'off', 'use_snp_selection': False}. Best is trial 88 with value: 0.2809523674077484.
[I 2025-12-05 15:37:46,512] Trial 113 finished with value: 0.2611596948209724 and parameters: {'model_type': 'mlp', 'hidden_dims': '[512, 128]', 'dropout': 0.2790616588036308, 'batch_norm': False, 'lr': 3.8250292892923824e-05, 'weight_decay': 2.7085138904530015e-06, 'epochs': 52, 'loss': 'mae', 'optimizer': 'adam', 'graph_mode': 'off', 'use_snp_selection': False}. Best is trial 88 with value: 0.2809523674077484.
[I 2025-12-05 15:37:58,471] Trial 114 finished with value: 0.2680125927733139 and parameters: {'model_type': 'mlp', 'hidden_dims': '[128, 64]', 'dropout': 0.55046241308285, 'batch_norm': False, 'lr': 8.981315546567796e-05, 'weight_decay': 1.2946272703453007e-06, 'epochs': 84, 'loss': 'mae', 'optimizer': 'adam', 'graph_mode': 'off', 'use_snp_selection': False}. Best is trial 88 with value: 0.2809523674077484.
[I 2025-12-05 15:38:31,045] Trial 115 finished with value: 0.27256909236001714 and parameters: {'model_type': 'mlp', 'hidden_dims': '[512, 64]', 'dropout': 0.5307978043810996, 'batch_norm': False, 'lr': 5.396118111349313e-05, 'weight_decay': 1.8678474776035242e-06, 'epochs': 91, 'loss': 'mae', 'optimizer': 'adam', 'graph_mode': 'off', 'use_snp_selection': False}. Best is trial 88 with value: 0.2809523674077484.
[I 2025-12-05 15:39:03,390] Trial 116 finished with value: 0.2582397890815949 and parameters: {'model_type': 'mlp', 'hidden_dims': '[512, 64]', 'dropout': 0.488807708096416, 'batch_norm': False, 'lr': 5.048616541173826e-05, 'weight_decay': 1.7721341954922881e-06, 'epochs': 90, 'loss': 'mae', 'optimizer': 'adam', 'graph_mode': 'off', 'use_snp_selection': False}. Best is trial 88 with value: 0.2809523674077484.
[I 2025-12-05 15:39:40,103] Trial 117 finished with value: 0.27177093590387175 and parameters: {'model_type': 'mlp', 'hidden_dims': '[512, 128]', 'dropout': 0.4985391795629032, 'batch_norm': False, 'lr': 5.873946860727009e-05, 'weight_decay': 2.119646255092406e-06, 'epochs': 106, 'loss': 'mae', 'optimizer': 'adam', 'graph_mode': 'off', 'use_snp_selection': False}. Best is trial 88 with value: 0.2809523674077484.
[I 2025-12-05 15:40:15,512] Trial 118 finished with value: 0.2552264794625541 and parameters: {'model_type': 'mlp', 'hidden_dims': '[512, 256]', 'dropout': 0.5018396240287533, 'batch_norm': False, 'lr': 6.133972379704852e-05, 'weight_decay': 2.06674154451381e-06, 'epochs': 101, 'loss': 'mae', 'optimizer': 'adam', 'graph_mode': 'off', 'use_snp_selection': False}. Best is trial 88 with value: 0.2809523674077484.
[I 2025-12-05 15:40:57,891] Trial 119 finished with value: 0.25562218737770265 and parameters: {'model_type': 'mlp', 'hidden_dims': '[512, 128]', 'dropout': 0.521243622102616, 'batch_norm': False, 'lr': 2.7532276827555853e-05, 'weight_decay': 8.045277451966363e-06, 'epochs': 126, 'loss': 'mae', 'optimizer': 'adam', 'graph_mode': 'off', 'use_snp_selection': False}. Best is trial 88 with value: 0.2809523674077484.
[I 2025-12-05 15:41:20,567] Trial 120 finished with value: 0.24813906522040968 and parameters: {'model_type': 'mlp', 'hidden_dims': '[256, 128, 64]', 'dropout': 0.5310359796331403, 'batch_norm': True, 'lr': 7.807237871606433e-05, 'weight_decay': 3.5204884301708666e-06, 'epochs': 110, 'loss': 'mae', 'optimizer': 'adam', 'graph_mode': 'off', 'use_snp_selection': False}. Best is trial 88 with value: 0.2809523674077484.
[I 2025-12-05 15:41:53,276] Trial 121 finished with value: 0.2675951433121955 and parameters: {'model_type': 'mlp', 'hidden_dims': '[512, 128]', 'dropout': 0.5410238881012547, 'batch_norm': False, 'lr': 5.8021543328156174e-05, 'weight_decay': 4.9179957279177505e-06, 'epochs': 91, 'loss': 'mae', 'optimizer': 'adam', 'graph_mode': 'off', 'use_snp_selection': False}. Best is trial 88 with value: 0.2809523674077484.
[I 2025-12-05 15:42:19,133] Trial 122 finished with value: 0.2592453790164453 and parameters: {'model_type': 'mlp', 'hidden_dims': '[512, 128]', 'dropout': 0.5078433783705539, 'batch_norm': False, 'lr': 0.00010760601717505456, 'weight_decay': 2.945343912002424e-06, 'epochs': 66, 'loss': 'mae', 'optimizer': 'adam', 'graph_mode': 'off', 'use_snp_selection': False}. Best is trial 88 with value: 0.2809523674077484.
[I 2025-12-05 15:42:55,972] Trial 123 finished with value: 0.27222707222746534 and parameters: {'model_type': 'mlp', 'hidden_dims': '[512, 128]', 'dropout': 0.5195888672803955, 'batch_norm': False, 'lr': 4.8033793758665085e-05, 'weight_decay': 1.1023752257124498e-06, 'epochs': 106, 'loss': 'mae', 'optimizer': 'adam', 'graph_mode': 'off', 'use_snp_selection': False}. Best is trial 88 with value: 0.2809523674077484.
[I 2025-12-05 15:43:30,611] Trial 124 finished with value: 0.26240310636926045 and parameters: {'model_type': 'mlp', 'hidden_dims': '[512, 128]', 'dropout': 0.5155506469119722, 'batch_norm': False, 'lr': 4.438004602527851e-05, 'weight_decay': 6.493755442845253e-07, 'epochs': 98, 'loss': 'mae', 'optimizer': 'adam', 'graph_mode': 'off', 'use_snp_selection': False}. Best is trial 88 with value: 0.2809523674077484.
[I 2025-12-05 15:44:07,187] Trial 125 finished with value: 0.25840220626955407 and parameters: {'model_type': 'mlp', 'hidden_dims': '[512, 128]', 'dropout': 0.4945476266826012, 'batch_norm': False, 'lr': 5.107545905145384e-05, 'weight_decay': 9.231350650011346e-07, 'epochs': 105, 'loss': 'mae', 'optimizer': 'adam', 'graph_mode': 'off', 'use_snp_selection': False}. Best is trial 88 with value: 0.2809523674077484.
[I 2025-12-05 15:44:47,016] Trial 126 finished with value: 0.2584596405218751 and parameters: {'model_type': 'mlp', 'hidden_dims': '[512, 64]', 'dropout': 0.5314621690120896, 'batch_norm': False, 'lr': 6.810867809448881e-05, 'weight_decay': 1.360840496303516e-06, 'epochs': 117, 'loss': 'mae', 'optimizer': 'adam', 'graph_mode': 'off', 'use_snp_selection': False}. Best is trial 88 with value: 0.2809523674077484.
[I 2025-12-05 15:45:15,138] Trial 127 finished with value: 0.2646028672931527 and parameters: {'model_type': 'mlp', 'hidden_dims': '[512, 128]', 'dropout': 0.19739911943470953, 'batch_norm': False, 'lr': 3.351580784588649e-05, 'weight_decay': 2.0101423729193793e-06, 'epochs': 74, 'loss': 'mae', 'optimizer': 'adam', 'graph_mode': 'off', 'use_snp_selection': False}. Best is trial 88 with value: 0.2809523674077484.
[I 2025-12-05 15:46:07,252] Trial 128 finished with value: 0.27101697414862375 and parameters: {'model_type': 'mlp', 'hidden_dims': '[512, 64]', 'dropout': 0.4803431719195092, 'batch_norm': False, 'lr': 4.2531386663679045e-05, 'weight_decay': 3.839706807009981e-06, 'epochs': 88, 'loss': 'mae', 'optimizer': 'adam', 'graph_mode': 'off', 'use_snp_selection': True, 'num_snps': 30083}. Best is trial 88 with value: 0.2809523674077484.
[I 2025-12-05 15:46:58,498] Trial 129 finished with value: 0.26815259506780376 and parameters: {'model_type': 'mlp', 'hidden_dims': '[512, 64]', 'dropout': 0.45800432685166925, 'batch_norm': False, 'lr': 4.006446893195231e-05, 'weight_decay': 5.732278045849897e-06, 'epochs': 87, 'loss': 'mae', 'optimizer': 'adam', 'graph_mode': 'off', 'use_snp_selection': True, 'num_snps': 28996}. Best is trial 88 with value: 0.2809523674077484.
[I 2025-12-05 15:47:49,984] Trial 130 finished with value: 0.26418369563788413 and parameters: {'model_type': 'mlp', 'hidden_dims': '[512, 64]', 'dropout': 0.4864741159798832, 'batch_norm': False, 'lr': 2.9979135358833465e-05, 'weight_decay': 1.0504612869717347e-06, 'epochs': 80, 'loss': 'mse', 'optimizer': 'adam', 'graph_mode': 'off', 'use_snp_selection': True, 'num_snps': 30888}. Best is trial 88 with value: 0.2809523674077484.
[I 2025-12-05 15:48:50,494] Trial 131 finished with value: 0.2679144573276743 and parameters: {'model_type': 'mlp', 'hidden_dims': '[512, 64]', 'dropout': 0.501155628058418, 'batch_norm': False, 'lr': 4.428926734861906e-05, 'weight_decay': 4.064412767011083e-06, 'epochs': 95, 'loss': 'mae', 'optimizer': 'adam', 'graph_mode': 'off', 'use_snp_selection': True, 'num_snps': 40300}. Best is trial 88 with value: 0.2809523674077484.
[I 2025-12-05 15:50:01,820] Trial 132 finished with value: 0.2709473138015831 and parameters: {'model_type': 'mlp', 'hidden_dims': '[512, 64]', 'dropout': 0.5207768458687874, 'batch_norm': False, 'lr': 5.6055285651694706e-05, 'weight_decay': 2.57769126827798e-06, 'epochs': 107, 'loss': 'mae', 'optimizer': 'adam', 'graph_mode': 'off', 'use_snp_selection': True, 'num_snps': 50313}. Best is trial 88 with value: 0.2809523674077484.
[I 2025-12-05 15:51:13,981] Trial 133 finished with value: 0.25527473902694253 and parameters: {'model_type': 'mlp', 'hidden_dims': '[512, 64]', 'dropout': 0.5262588560276509, 'batch_norm': False, 'lr': 2.4522024227920248e-05, 'weight_decay': 2.4475773100408093e-06, 'epochs': 108, 'loss': 'mae', 'optimizer': 'adam', 'graph_mode': 'off', 'use_snp_selection': True, 'num_snps': 50819}. Best is trial 88 with value: 0.2809523674077484.
[I 2025-12-05 15:52:15,823] Trial 134 finished with value: 0.2804406990225377 and parameters: {'model_type': 'mlp', 'hidden_dims': '[512, 64]', 'dropout': 0.5150215648974958, 'batch_norm': False, 'lr': 4.981359429229075e-05, 'weight_decay': 3.4787259056707888e-06, 'epochs': 61, 'loss': 'mae', 'optimizer': 'adam', 'graph_mode': 'off', 'use_snp_selection': True, 'num_snps': 50759}. Best is trial 88 with value: 0.2809523674077484.
[I 2025-12-05 15:53:07,674] Trial 135 finished with value: 0.25195614229706553 and parameters: {'model_type': 'mlp', 'hidden_dims': '[512, 64]', 'dropout': 0.47999718502837535, 'batch_norm': False, 'lr': 4.8659984028686513e-05, 'weight_decay': 3.748361745268063e-06, 'epochs': 62, 'loss': 'mae', 'optimizer': 'adam', 'graph_mode': 'off', 'use_snp_selection': True, 'num_snps': 35416}. Best is trial 88 with value: 0.2809523674077484.
[I 2025-12-05 15:53:55,106] Trial 136 finished with value: 0.2615943457432389 and parameters: {'model_type': 'mlp', 'hidden_dims': '[512, 64]', 'dropout': 0.5404460262198352, 'batch_norm': False, 'lr': 3.971868334220333e-05, 'weight_decay': 6.829812149080755e-06, 'epochs': 70, 'loss': 'mae', 'optimizer': 'adam', 'graph_mode': 'off', 'use_snp_selection': True, 'num_snps': 26867}. Best is trial 88 with value: 0.2809523674077484.
[I 2025-12-05 15:54:58,057] Trial 137 finished with value: 0.2691319636509518 and parameters: {'model_type': 'mlp', 'hidden_dims': '[512, 64]', 'dropout': 0.5536422595635508, 'batch_norm': False, 'lr': 3.5180065560153706e-05, 'weight_decay': 1.5129108449032966e-06, 'epochs': 57, 'loss': 'mae', 'optimizer': 'adam', 'graph_mode': 'off', 'use_snp_selection': True, 'num_snps': 54221}. Best is trial 88 with value: 0.2809523674077484.
[I 2025-12-05 15:55:52,874] Trial 138 finished with value: 0.24189225786066873 and parameters: {'model_type': 'mlp', 'hidden_dims': '[512, 128]', 'dropout': 0.5116071653523143, 'batch_norm': False, 'lr': 9.632393496178623e-05, 'weight_decay': 4.809405812787295e-06, 'epochs': 40, 'loss': 'mae', 'optimizer': 'adam', 'graph_mode': 'off', 'use_snp_selection': True, 'num_snps': 46119}. Best is trial 88 with value: 0.2809523674077484.
[I 2025-12-05 15:56:34,454] Trial 139 finished with value: 0.2606555615144769 and parameters: {'model_type': 'mlp', 'hidden_dims': '[512, 64]', 'dropout': 0.49398251053961434, 'batch_norm': False, 'lr': 1.9599497593750034e-05, 'weight_decay': 3.2721690656367817e-06, 'epochs': 81, 'loss': 'mae', 'optimizer': 'adam', 'graph_mode': 'off', 'use_snp_selection': True, 'num_snps': 16704}. Best is trial 88 with value: 0.2809523674077484.
[I 2025-12-05 15:57:00,125] Trial 140 finished with value: 0.2393298850233175 and parameters: {'model_type': 'mlp', 'hidden_dims': '[512, 128]', 'dropout': 0.5324395949819846, 'batch_norm': True, 'lr': 6.39463321184372e-05, 'weight_decay': 4.4327696191070185e-06, 'epochs': 65, 'loss': 'mae', 'optimizer': 'adam', 'graph_mode': 'off', 'use_snp_selection': False}. Best is trial 88 with value: 0.2809523674077484.
[I 2025-12-05 15:57:58,608] Trial 141 finished with value: 0.27071516931559164 and parameters: {'model_type': 'mlp', 'hidden_dims': '[512, 64]', 'dropout': 0.5156767575317168, 'batch_norm': False, 'lr': 5.1428938284074456e-05, 'weight_decay': 2.626454444997389e-06, 'epochs': 88, 'loss': 'mae', 'optimizer': 'adam', 'graph_mode': 'off', 'use_snp_selection': True, 'num_snps': 39290}. Best is trial 88 with value: 0.2809523674077484.
[I 2025-12-05 15:59:04,226] Trial 142 finished with value: 0.2646855401220177 and parameters: {'model_type': 'mlp', 'hidden_dims': '[512, 64]', 'dropout': 0.32842342337317976, 'batch_norm': False, 'lr': 8.225832452859105e-05, 'weight_decay': 3.0970671715116015e-06, 'epochs': 74, 'loss': 'mae', 'optimizer': 'adam', 'graph_mode': 'off', 'use_snp_selection': True, 'num_snps': 52059}. Best is trial 88 with value: 0.2809523674077484.
[I 2025-12-05 16:00:18,491] Trial 143 finished with value: 0.2678838613284762 and parameters: {'model_type': 'mlp', 'hidden_dims': '[512, 64]', 'dropout': 0.5190061635730207, 'batch_norm': False, 'lr': 5.712239927250151e-05, 'weight_decay': 1.739940367504722e-06, 'epochs': 105, 'loss': 'mae', 'optimizer': 'adam', 'graph_mode': 'off', 'use_snp_selection': True, 'num_snps': 55110}. Best is trial 88 with value: 0.2809523674077484.
[I 2025-12-05 16:01:22,003] Trial 144 finished with value: 0.2647193184215884 and parameters: {'model_type': 'mlp', 'hidden_dims': '[512, 64]', 'dropout': 0.5246011491962493, 'batch_norm': False, 'lr': 3.589252936666651e-05, 'weight_decay': 5.791163764167292e-06, 'epochs': 91, 'loss': 'mae', 'optimizer': 'adam', 'graph_mode': 'off', 'use_snp_selection': True, 'num_snps': 45402}. Best is trial 88 with value: 0.2809523674077484.
[I 2025-12-05 16:02:33,650] Trial 145 finished with value: 0.2635216023470849 and parameters: {'model_type': 'mlp', 'hidden_dims': '[512, 64]', 'dropout': 0.47208422908623393, 'batch_norm': False, 'lr': 2.8063282944842874e-05, 'weight_decay': 2.342367040341248e-06, 'epochs': 121, 'loss': 'mae', 'optimizer': 'adam', 'graph_mode': 'off', 'use_snp_selection': True, 'num_snps': 47786}. Best is trial 88 with value: 0.2809523674077484.
[I 2025-12-05 16:03:32,983] Trial 146 finished with value: 0.2629695399256487 and parameters: {'model_type': 'mlp', 'hidden_dims': '[256, 128]', 'dropout': 0.5476010373995582, 'batch_norm': False, 'lr': 4.473366807641798e-05, 'weight_decay': 1.1522372351528355e-06, 'epochs': 155, 'loss': 'mae', 'optimizer': 'adam', 'graph_mode': 'off', 'use_snp_selection': True, 'num_snps': 41934}. Best is trial 88 with value: 0.2809523674077484.
[I 2025-12-05 16:03:54,767] Trial 147 finished with value: 0.25700544252199375 and parameters: {'model_type': 'mlp', 'hidden_dims': '[512, 64]', 'dropout': 0.502097589028367, 'batch_norm': False, 'lr': 3.181529407530191e-05, 'weight_decay': 6.645340159361551e-07, 'epochs': 52, 'loss': 'mae', 'optimizer': 'adam', 'graph_mode': 'off', 'use_snp_selection': False}. Best is trial 88 with value: 0.2809523674077484.
[I 2025-12-05 16:04:22,777] Trial 148 finished with value: 0.2662845932329568 and parameters: {'model_type': 'mlp', 'hidden_dims': '[512, 128]', 'dropout': 0.3065690950432266, 'batch_norm': False, 'lr': 0.00012785555921688283, 'weight_decay': 8.396584357880385e-06, 'epochs': 75, 'loss': 'mae', 'optimizer': 'adam', 'graph_mode': 'off', 'use_snp_selection': False}. Best is trial 88 with value: 0.2809523674077484.
[I 2025-12-05 16:04:52,770] Trial 149 finished with value: 0.2655581214018177 and parameters: {'model_type': 'mlp', 'hidden_dims': '[512, 64]', 'dropout': 0.5378468657023365, 'batch_norm': False, 'lr': 5.126088801756594e-05, 'weight_decay': 3.813802897213229e-06, 'epochs': 82, 'loss': 'mae', 'optimizer': 'adam', 'graph_mode': 'off', 'use_snp_selection': False}. Best is trial 88 with value: 0.2809523674077484.
[I 2025-12-05 16:05:58,971] Trial 0 finished with value: 0.1740775449519214 and parameters: {'model_type': 'mlp', 'hidden_dims': '[128, 64]', 'dropout': 0.199031432379812, 'batch_norm': True, 'lr': 1.8408544111075837e-06, 'weight_decay': 5.5136510071208614e-05, 'epochs': 336, 'loss': 'mae', 'optimizer': 'adam', 'graph_mode': 'off', 'use_snp_selection': True, 'num_snps': 43862}. Best is trial 0 with value: 0.1740775449519214.
[I 2025-12-05 16:06:40,194] Trial 1 finished with value: 0.21607664936101206 and parameters: {'model_type': 'mlp', 'hidden_dims': '[256, 128]', 'dropout': 0.4370668075331726, 'batch_norm': True, 'lr': 7.133471581159139e-05, 'weight_decay': 1.128633586803549e-05, 'epochs': 242, 'loss': 'mae', 'optimizer': 'adam', 'graph_mode': 'off', 'use_snp_selection': False}. Best is trial 1 with value: 0.21607664936101206.
[I 2025-12-05 16:07:18,378] Trial 2 finished with value: 0.2026830716631264 and parameters: {'model_type': 'mlp', 'hidden_dims': '[256, 128, 64]', 'dropout': 0.41314357415569625, 'batch_norm': False, 'lr': 3.952233718592101e-06, 'weight_decay': 0.00026754769258252603, 'epochs': 149, 'loss': 'mse', 'optimizer': 'adam', 'graph_mode': 'off', 'use_snp_selection': True, 'num_snps': 11571}. Best is trial 1 with value: 0.21607664936101206.
[I 2025-12-05 16:08:55,338] Trial 3 finished with value: 0.24045905308731358 and parameters: {'model_type': 'mlp', 'hidden_dims': '[512, 64]', 'dropout': 0.5938127374509361, 'batch_norm': False, 'lr': 5.67704586114731e-06, 'weight_decay': 2.4518087630137052e-05, 'epochs': 320, 'loss': 'mae', 'optimizer': 'adam', 'graph_mode': 'off', 'use_snp_selection': False}. Best is trial 3 with value: 0.24045905308731358.
[I 2025-12-05 16:10:22,856] Trial 4 finished with value: 0.15764044371382577 and parameters: {'model_type': 'mlp', 'hidden_dims': '[512, 128]', 'dropout': 0.25746343592134413, 'batch_norm': True, 'lr': 1.3467657668402788e-06, 'weight_decay': 0.00033087251918647806, 'epochs': 277, 'loss': 'mse', 'optimizer': 'adam', 'graph_mode': 'off', 'use_snp_selection': True, 'num_snps': 36675}. Best is trial 3 with value: 0.24045905308731358.
[I 2025-12-05 16:11:24,305] Trial 5 finished with value: 0.18402520509011125 and parameters: {'model_type': 'mlp', 'hidden_dims': '[512, 64]', 'dropout': 0.38275350994408375, 'batch_norm': True, 'lr': 1.5586664309232824e-06, 'weight_decay': 0.0008227664668621182, 'epochs': 145, 'loss': 'mae', 'optimizer': 'adam', 'graph_mode': 'off', 'use_snp_selection': True, 'num_snps': 32148}. Best is trial 3 with value: 0.24045905308731358.
