[I 2025-12-05 17:20:52,819] Trial 5 finished with value: 0.12164032037441723 and parameters: {'model_type': 'mlp', 'hidden_dims': '[512, 64]', 'dropout': 0.38275350994408375, 'batch_norm': True, 'lr': 1.5586664309232824e-06, 'weight_decay': 0.0008227664668621182, 'epochs': 145, 'loss': 'mae', 'optimizer': 'adam', 'graph_mode': 'off', 'use_snp_selection': True, 'num_snps': 32148}. Best is trial 3 with value: 0.19024951900346437.
[I 2025-12-05 17:21:27,147] Trial 6 finished with value: 0.17664485153577897 and parameters: {'model_type': 'mlp', 'hidden_dims': '[256, 128]', 'dropout': 0.3930109900265879, 'batch_norm': False, 'lr': 4.892964372128395e-05, 'weight_decay': 1.5809549317992182e-06, 'epochs': 199, 'loss': 'mse', 'optimizer': 'adam', 'graph_mode': 'off', 'use_snp_selection': False}. Best is trial 3 with value: 0.19024951900346437.
[I 2025-12-05 17:22:02,387] Trial 7 finished with value: 0.17698668107844234 and parameters: {'model_type': 'mlp', 'hidden_dims': '[512, 256]', 'dropout': 0.15343979219678458, 'batch_norm': True, 'lr': 6.234003099047341e-05, 'weight_decay': 3.894760610535477e-07, 'epochs': 97, 'loss': 'mse', 'optimizer': 'adam', 'graph_mode': 'off', 'use_snp_selection': False}. Best is trial 3 with value: 0.19024951900346437.
[I 2025-12-05 17:23:39,173] Trial 8 finished with value: 0.18787622458781622 and parameters: {'model_type': 'mlp', 'hidden_dims': '[512, 128]', 'dropout': 0.10743001231661406, 'batch_norm': True, 'lr': 0.00023728538449271062, 'weight_decay': 1.7629071578048637e-05, 'epochs': 312, 'loss': 'mae', 'optimizer': 'adam', 'graph_mode': 'off', 'use_snp_selection': False}. Best is trial 3 with value: 0.19024951900346437.
[I 2025-12-05 17:24:36,951] Trial 9 finished with value: 0.18506284613584068 and parameters: {'model_type': 'mlp', 'hidden_dims': '[512, 64]', 'dropout': 0.14505336736221927, 'batch_norm': True, 'lr': 5.8619638388111826e-05, 'weight_decay': 6.200156172669308e-07, 'epochs': 175, 'loss': 'mse', 'optimizer': 'adam', 'graph_mode': 'off', 'use_snp_selection': False}. Best is trial 3 with value: 0.19024951900346437.
[I 2025-12-05 17:25:00,185] Trial 10 finished with value: 0.16576772377543605 and parameters: {'model_type': 'mlp', 'hidden_dims': '[512, 64]', 'dropout': 0.5885461262002587, 'batch_norm': False, 'lr': 8.769366258768696e-06, 'weight_decay': 2.78273193871783e-06, 'epochs': 55, 'loss': 'mae', 'optimizer': 'adam', 'graph_mode': 'off', 'use_snp_selection': False}. Best is trial 3 with value: 0.19024951900346437.
[I 2025-12-05 17:26:43,170] Trial 11 finished with value: 0.18425393536684426 and parameters: {'model_type': 'mlp', 'hidden_dims': '[512, 128]', 'dropout': 0.583942291816117, 'batch_norm': False, 'lr': 0.0007607980626791682, 'weight_decay': 2.11387030344014e-05, 'epochs': 346, 'loss': 'mae', 'optimizer': 'adam', 'graph_mode': 'off', 'use_snp_selection': False}. Best is trial 3 with value: 0.19024951900346437.
[I 2025-12-05 17:28:12,372] Trial 12 finished with value: 0.18237053515018256 and parameters: {'model_type': 'mlp', 'hidden_dims': '[512, 128]', 'dropout': 0.2637316882220091, 'batch_norm': False, 'lr': 0.000384886887018818, 'weight_decay': 6.23587291883057e-05, 'epochs': 294, 'loss': 'mae', 'optimizer': 'adam', 'graph_mode': 'off', 'use_snp_selection': False}. Best is trial 3 with value: 0.19024951900346437.
[I 2025-12-05 17:28:39,298] Trial 13 finished with value: 0.17839010235618818 and parameters: {'model_type': 'mlp', 'hidden_dims': '[128, 64]', 'dropout': 0.5255276925359322, 'batch_norm': False, 'lr': 1.3373175420781734e-05, 'weight_decay': 2.875929917712265e-06, 'epochs': 285, 'loss': 'mae', 'optimizer': 'adam', 'graph_mode': 'off', 'use_snp_selection': False}. Best is trial 3 with value: 0.19024951900346437.
[I 2025-12-05 17:29:20,708] Trial 14 finished with value: 0.172090008905954 and parameters: {'model_type': 'mlp', 'hidden_dims': '[256, 128, 64]', 'dropout': 0.3012984444538551, 'batch_norm': True, 'lr': 0.0002108574938852793, 'weight_decay': 1.1414924884997386e-07, 'epochs': 237, 'loss': 'mae', 'optimizer': 'adam', 'graph_mode': 'off', 'use_snp_selection': False}. Best is trial 3 with value: 0.19024951900346437.
[I 2025-12-05 17:30:57,098] Trial 15 finished with value: 0.18405097918770655 and parameters: {'model_type': 'mlp', 'hidden_dims': '[512, 256]', 'dropout': 0.48263162073930665, 'batch_norm': False, 'lr': 1.8411764708572348e-05, 'weight_decay': 4.4084956876871386e-05, 'epochs': 314, 'loss': 'mae', 'optimizer': 'adam', 'graph_mode': 'off', 'use_snp_selection': False}. Best is trial 3 with value: 0.19024951900346437.
[I 2025-12-05 17:32:14,917] Trial 16 finished with value: 0.18185809753460044 and parameters: {'model_type': 'mlp', 'hidden_dims': '[512, 128]', 'dropout': 0.32560328266296623, 'batch_norm': True, 'lr': 0.00017549215405955411, 'weight_decay': 6.80662468241148e-06, 'epochs': 244, 'loss': 'mae', 'optimizer': 'adam', 'graph_mode': 'off', 'use_snp_selection': False}. Best is trial 3 with value: 0.19024951900346437.
[I 2025-12-05 17:34:02,410] Trial 17 finished with value: 0.19046549592597084 and parameters: {'model_type': 'mlp', 'hidden_dims': '[512, 64]', 'dropout': 0.10230308008198463, 'batch_norm': False, 'lr': 7.28449232493469e-06, 'weight_decay': 0.00010542713361476925, 'epochs': 350, 'loss': 'mae', 'optimizer': 'adam', 'graph_mode': 'off', 'use_snp_selection': False}. Best is trial 17 with value: 0.19046549592597084.
[I 2025-12-05 17:36:22,021] Trial 18 finished with value: 0.19190179016872494 and parameters: {'model_type': 'mlp', 'hidden_dims': '[512, 64]', 'dropout': 0.5098431992326697, 'batch_norm': False, 'lr': 5.4850663591507836e-06, 'weight_decay': 0.00012164960502320116, 'epochs': 343, 'loss': 'mae', 'optimizer': 'adam', 'graph_mode': 'off', 'use_snp_selection': True, 'num_snps': 58241}. Best is trial 18 with value: 0.19190179016872494.
[I 2025-12-05 17:38:17,215] Trial 19 finished with value: 0.19602741631124895 and parameters: {'model_type': 'mlp', 'hidden_dims': '[512, 64]', 'dropout': 0.4925583658889997, 'batch_norm': False, 'lr': 3.178805570854624e-06, 'weight_decay': 0.00018394665196424628, 'epochs': 260, 'loss': 'mae', 'optimizer': 'adam', 'graph_mode': 'off', 'use_snp_selection': True, 'num_snps': 55667}. Best is trial 19 with value: 0.19602741631124895.
[I 2025-12-05 17:40:16,244] Trial 20 finished with value: 0.18453140294509635 and parameters: {'model_type': 'mlp', 'hidden_dims': '[512, 64]', 'dropout': 0.5118420813867631, 'batch_norm': False, 'lr': 3.163939573640055e-06, 'weight_decay': 0.00019726017534817884, 'epochs': 267, 'loss': 'mae', 'optimizer': 'adam', 'graph_mode': 'off', 'use_snp_selection': True, 'num_snps': 57703}. Best is trial 19 with value: 0.19602741631124895.
[I 2025-12-05 17:42:38,823] Trial 21 finished with value: 0.18612274755516256 and parameters: {'model_type': 'mlp', 'hidden_dims': '[512, 64]', 'dropout': 0.4727088783203093, 'batch_norm': False, 'lr': 7.604951498908812e-06, 'weight_decay': 0.00011727750911803841, 'epochs': 342, 'loss': 'mae', 'optimizer': 'adam', 'graph_mode': 'off', 'use_snp_selection': True, 'num_snps': 59811}. Best is trial 19 with value: 0.19602741631124895.
[I 2025-12-05 17:44:12,124] Trial 22 finished with value: 0.1804204132426164 and parameters: {'model_type': 'mlp', 'hidden_dims': '[512, 64]', 'dropout': 0.532533255193764, 'batch_norm': False, 'lr': 2.472503651944613e-05, 'weight_decay': 0.0008743985635468675, 'epochs': 210, 'loss': 'mae', 'optimizer': 'adam', 'graph_mode': 'off', 'use_snp_selection': True, 'num_snps': 48956}. Best is trial 19 with value: 0.19602741631124895.
[I 2025-12-05 17:45:12,463] Trial 23 finished with value: 0.17575195130524165 and parameters: {'model_type': 'mlp', 'hidden_dims': '[512, 64]', 'dropout': 0.45057541590522787, 'batch_norm': False, 'lr': 2.452751974630692e-06, 'weight_decay': 0.00013560156868239358, 'epochs': 302, 'loss': 'mae', 'optimizer': 'adam', 'graph_mode': 'off', 'use_snp_selection': True, 'num_snps': 18234}. Best is trial 19 with value: 0.19602741631124895.
[I 2025-12-05 17:46:57,824] Trial 24 finished with value: 0.18453832499983308 and parameters: {'model_type': 'mlp', 'hidden_dims': '[512, 64]', 'dropout': 0.36580162833925, 'batch_norm': False, 'lr': 1.0333892139015809e-06, 'weight_decay': 9.62424193503568e-05, 'epochs': 260, 'loss': 'mae', 'optimizer': 'adam', 'graph_mode': 'off', 'use_snp_selection': True, 'num_snps': 49519}. Best is trial 19 with value: 0.19602741631124895.
[I 2025-12-05 17:48:10,539] Trial 25 finished with value: 0.18366157308145475 and parameters: {'model_type': 'mlp', 'hidden_dims': '[512, 64]', 'dropout': 0.5472566816920805, 'batch_norm': False, 'lr': 4.937588255580185e-06, 'weight_decay': 0.00040298260349232927, 'epochs': 346, 'loss': 'mae', 'optimizer': 'adam', 'graph_mode': 'off', 'use_snp_selection': True, 'num_snps': 23071}. Best is trial 19 with value: 0.19602741631124895.
[I 2025-12-05 17:49:36,555] Trial 26 finished with value: 0.18289081905954047 and parameters: {'model_type': 'mlp', 'hidden_dims': '[512, 64]', 'dropout': 0.22422593999956644, 'batch_norm': False, 'lr': 1.2345361527808871e-05, 'weight_decay': 0.0003763305002251773, 'epochs': 216, 'loss': 'mae', 'optimizer': 'adam', 'graph_mode': 'off', 'use_snp_selection': True, 'num_snps': 43733}. Best is trial 19 with value: 0.19602741631124895.
[I 2025-12-05 17:51:04,682] Trial 27 finished with value: 0.17835909639877937 and parameters: {'model_type': 'mlp', 'hidden_dims': '[256, 128]', 'dropout': 0.4858736092433408, 'batch_norm': False, 'lr': 3.165188719022422e-06, 'weight_decay': 5.751830686410744e-05, 'epochs': 322, 'loss': 'mse', 'optimizer': 'adam', 'graph_mode': 'off', 'use_snp_selection': True, 'num_snps': 53852}. Best is trial 19 with value: 0.19602741631124895.
[I 2025-12-05 17:51:37,858] Trial 28 finished with value: 0.16245891883723915 and parameters: {'model_type': 'mlp', 'hidden_dims': '[128, 64]', 'dropout': 0.34188033617956426, 'batch_norm': False, 'lr': 7.548456123703922e-06, 'weight_decay': 3.108249273083781e-05, 'epochs': 175, 'loss': 'mae', 'optimizer': 'adam', 'graph_mode': 'off', 'use_snp_selection': True, 'num_snps': 5032}. Best is trial 19 with value: 0.19602741631124895.
[I 2025-12-05 17:53:16,740] Trial 29 finished with value: 0.1893409806864905 and parameters: {'model_type': 'mlp', 'hidden_dims': '[512, 256]', 'dropout': 0.17814825172909, 'batch_norm': False, 'lr': 1.8615811865390378e-06, 'weight_decay': 8.58970861149538e-05, 'epochs': 331, 'loss': 'mae', 'optimizer': 'adam', 'graph_mode': 'off', 'use_snp_selection': True, 'num_snps': 38770}. Best is trial 19 with value: 0.19602741631124895.
[I 2025-12-05 17:54:13,252] Trial 30 finished with value: 0.1645321214022764 and parameters: {'model_type': 'mlp', 'hidden_dims': '[256, 128, 64]', 'dropout': 0.5483705808220569, 'batch_norm': False, 'lr': 3.190135196273966e-05, 'weight_decay': 0.0005846008492620691, 'epochs': 291, 'loss': 'mae', 'optimizer': 'adam', 'graph_mode': 'off', 'use_snp_selection': True, 'num_snps': 25912}. Best is trial 19 with value: 0.19602741631124895.
[I 2025-12-05 17:55:51,940] Trial 31 finished with value: 0.1945945556810766 and parameters: {'model_type': 'mlp', 'hidden_dims': '[512, 64]', 'dropout': 0.5068315363281304, 'batch_norm': False, 'lr': 5.657600134569061e-06, 'weight_decay': 0.00017580292230596112, 'epochs': 325, 'loss': 'mae', 'optimizer': 'adam', 'graph_mode': 'off', 'use_snp_selection': False}. Best is trial 19 with value: 0.19602741631124895.
[I 2025-12-05 17:57:38,577] Trial 32 finished with value: 0.1823699452054993 and parameters: {'model_type': 'mlp', 'hidden_dims': '[512, 64]', 'dropout': 0.4225291389816354, 'batch_norm': False, 'lr': 1.2801867593936436e-05, 'weight_decay': 0.00018376536133576292, 'epochs': 350, 'loss': 'mae', 'optimizer': 'adam', 'graph_mode': 'off', 'use_snp_selection': False}. Best is trial 19 with value: 0.19602741631124895.
[I 2025-12-05 17:59:20,459] Trial 33 finished with value: 0.18344786746968242 and parameters: {'model_type': 'mlp', 'hidden_dims': '[512, 64]', 'dropout': 0.45131338500806784, 'batch_norm': False, 'lr': 4.674884985698473e-06, 'weight_decay': 8.429352999918547e-06, 'epochs': 331, 'loss': 'mae', 'optimizer': 'adam', 'graph_mode': 'off', 'use_snp_selection': False}. Best is trial 19 with value: 0.19602741631124895.
[I 2025-12-05 18:00:24,691] Trial 34 finished with value: 0.1680716243718456 and parameters: {'model_type': 'mlp', 'hidden_dims': '[128, 64]', 'dropout': 0.5075987718195653, 'batch_norm': False, 'lr': 2.4174708007846326e-06, 'weight_decay': 0.0002029860808817076, 'epochs': 254, 'loss': 'mae', 'optimizer': 'adam', 'graph_mode': 'off', 'use_snp_selection': True, 'num_snps': 51790}. Best is trial 19 with value: 0.19602741631124895.
[I 2025-12-05 18:01:58,526] Trial 35 finished with value: 0.18686336332562006 and parameters: {'model_type': 'mlp', 'hidden_dims': '[512, 64]', 'dropout': 0.5641039438047597, 'batch_norm': False, 'lr': 6.768596746450905e-06, 'weight_decay': 3.8119334479391896e-05, 'epochs': 307, 'loss': 'mae', 'optimizer': 'adam', 'graph_mode': 'off', 'use_snp_selection': False}. Best is trial 19 with value: 0.19602741631124895.
[I 2025-12-05 18:04:04,758] Trial 36 finished with value: 0.18410001435374304 and parameters: {'model_type': 'mlp', 'hidden_dims': '[512, 64]', 'dropout': 0.3988157048277522, 'batch_norm': False, 'lr': 3.5952583003021524e-06, 'weight_decay': 0.000540310634721938, 'epochs': 279, 'loss': 'mse', 'optimizer': 'adam', 'graph_mode': 'off', 'use_snp_selection': True, 'num_snps': 59774}. Best is trial 19 with value: 0.19602741631124895.
[I 2025-12-05 18:04:44,201] Trial 37 finished with value: 0.18635712967199508 and parameters: {'model_type': 'mlp', 'hidden_dims': '[256, 128]', 'dropout': 0.4974782566005044, 'batch_norm': False, 'lr': 9.899250890210902e-06, 'weight_decay': 0.00028847497933590067, 'epochs': 229, 'loss': 'mae', 'optimizer': 'adam', 'graph_mode': 'off', 'use_snp_selection': False}. Best is trial 19 with value: 0.19602741631124895.
[I 2025-12-05 18:06:04,997] Trial 38 finished with value: 0.16968374512354506 and parameters: {'model_type': 'mlp', 'hidden_dims': '[256, 128, 64]', 'dropout': 0.44242477483649906, 'batch_norm': False, 'lr': 1.8304372365002835e-05, 'weight_decay': 7.186060623232288e-05, 'epochs': 329, 'loss': 'mse', 'optimizer': 'adam', 'graph_mode': 'off', 'use_snp_selection': True, 'num_snps': 45116}. Best is trial 19 with value: 0.19602741631124895.
[I 2025-12-05 18:07:37,923] Trial 39 finished with value: 0.1911392910310859 and parameters: {'model_type': 'mlp', 'hidden_dims': '[512, 64]', 'dropout': 0.29832509822124575, 'batch_norm': False, 'lr': 2.077239296971927e-06, 'weight_decay': 1.4242220393793995e-05, 'epochs': 301, 'loss': 'mae', 'optimizer': 'adam', 'graph_mode': 'off', 'use_snp_selection': False}. Best is trial 19 with value: 0.19602741631124895.
[I 2025-12-05 18:09:33,204] Trial 40 finished with value: 0.13285608064956012 and parameters: {'model_type': 'mlp', 'hidden_dims': '[512, 64]', 'dropout': 0.2780019450424066, 'batch_norm': True, 'lr': 1.1231652612296812e-06, 'weight_decay': 1.4407082918237598e-05, 'epochs': 268, 'loss': 'mae', 'optimizer': 'adam', 'graph_mode': 'off', 'use_snp_selection': True, 'num_snps': 54588}. Best is trial 19 with value: 0.19602741631124895.
[I 2025-12-05 18:11:10,208] Trial 41 finished with value: 0.18006597052414194 and parameters: {'model_type': 'mlp', 'hidden_dims': '[512, 64]', 'dropout': 0.2116249696446564, 'batch_norm': False, 'lr': 1.8286723258909866e-06, 'weight_decay': 0.0001282501419635604, 'epochs': 314, 'loss': 'mae', 'optimizer': 'adam', 'graph_mode': 'off', 'use_snp_selection': False}. Best is trial 19 with value: 0.19602741631124895.
[I 2025-12-05 18:12:42,265] Trial 42 finished with value: 0.1860943395273593 and parameters: {'model_type': 'mlp', 'hidden_dims': '[512, 64]', 'dropout': 0.11190813254044232, 'batch_norm': False, 'lr': 5.45966239294472e-06, 'weight_decay': 5.2991983395518776e-06, 'epochs': 295, 'loss': 'mae', 'optimizer': 'adam', 'graph_mode': 'off', 'use_snp_selection': False}. Best is trial 19 with value: 0.19602741631124895.
[I 2025-12-05 18:14:22,748] Trial 43 finished with value: 0.18819831348683141 and parameters: {'model_type': 'mlp', 'hidden_dims': '[512, 64]', 'dropout': 0.23017968778781234, 'batch_norm': False, 'lr': 2.3862181447922654e-06, 'weight_decay': 0.00024705826347864025, 'epochs': 325, 'loss': 'mae', 'optimizer': 'adam', 'graph_mode': 'off', 'use_snp_selection': False}. Best is trial 19 with value: 0.19602741631124895.
[I 2025-12-05 18:15:57,705] Trial 44 finished with value: 0.19356370562310252 and parameters: {'model_type': 'mlp', 'hidden_dims': '[512, 64]', 'dropout': 0.1850642582051809, 'batch_norm': False, 'lr': 1.480396372004329e-06, 'weight_decay': 2.4600983456697882e-05, 'epochs': 306, 'loss': 'mae', 'optimizer': 'adam', 'graph_mode': 'off', 'use_snp_selection': False}. Best is trial 19 with value: 0.19602741631124895.
[I 2025-12-05 18:17:25,166] Trial 45 finished with value: 0.17978740127781984 and parameters: {'model_type': 'mlp', 'hidden_dims': '[512, 256]', 'dropout': 0.3080963723797761, 'batch_norm': False, 'lr': 1.5691541140603474e-06, 'weight_decay': 1.2918614126272714e-05, 'epochs': 279, 'loss': 'mse', 'optimizer': 'adam', 'graph_mode': 'off', 'use_snp_selection': False}. Best is trial 19 with value: 0.19602741631124895.
[I 2025-12-05 18:18:15,887] Trial 46 finished with value: 0.12477541008716575 and parameters: {'model_type': 'mlp', 'hidden_dims': '[256, 128]', 'dropout': 0.18263403023477004, 'batch_norm': True, 'lr': 1.4632914553717321e-06, 'weight_decay': 2.5472462395118095e-05, 'epochs': 302, 'loss': 'mae', 'optimizer': 'adam', 'graph_mode': 'off', 'use_snp_selection': False}. Best is trial 19 with value: 0.19602741631124895.
[I 2025-12-05 18:18:40,043] Trial 47 finished with value: 0.17270950624532194 and parameters: {'model_type': 'mlp', 'hidden_dims': '[512, 64]', 'dropout': 0.4182235706447566, 'batch_norm': False, 'lr': 3.601696866783041e-06, 'weight_decay': 3.566018033306966e-06, 'epochs': 58, 'loss': 'mae', 'optimizer': 'adam', 'graph_mode': 'off', 'use_snp_selection': False}. Best is trial 19 with value: 0.19602741631124895.
[I 2025-12-05 18:20:15,912] Trial 48 finished with value: 0.19139939424118335 and parameters: {'model_type': 'mlp', 'hidden_dims': '[512, 64]', 'dropout': 0.3689630404046206, 'batch_norm': False, 'lr': 2.4539415294736575e-06, 'weight_decay': 1.5525054854614143e-06, 'epochs': 310, 'loss': 'mae', 'optimizer': 'adam', 'graph_mode': 'off', 'use_snp_selection': False}. Best is trial 19 with value: 0.19602741631124895.
[I 2025-12-05 18:20:45,601] Trial 49 finished with value: 0.16285138290826384 and parameters: {'model_type': 'mlp', 'hidden_dims': '[128, 64]', 'dropout': 0.4648118918796913, 'batch_norm': True, 'lr': 4.431974804734411e-06, 'weight_decay': 1.105861762206359e-06, 'epochs': 317, 'loss': 'mse', 'optimizer': 'adam', 'graph_mode': 'off', 'use_snp_selection': False}. Best is trial 19 with value: 0.19602741631124895.
[I 2025-12-05 18:22:28,698] Trial 50 finished with value: 0.18107572563255034 and parameters: {'model_type': 'mlp', 'hidden_dims': '[512, 128]', 'dropout': 0.3786058615146993, 'batch_norm': False, 'lr': 3.0314945800178092e-06, 'weight_decay': 3.833740330311534e-07, 'epochs': 335, 'loss': 'mae', 'optimizer': 'adam', 'graph_mode': 'off', 'use_snp_selection': False}. Best is trial 19 with value: 0.19602741631124895.
[I 2025-12-05 18:24:00,241] Trial 51 finished with value: 0.18966942507940893 and parameters: {'model_type': 'mlp', 'hidden_dims': '[512, 64]', 'dropout': 0.2420077698391292, 'batch_norm': False, 'lr': 2.2350224925746755e-06, 'weight_decay': 4.695248868333834e-06, 'epochs': 294, 'loss': 'mae', 'optimizer': 'adam', 'graph_mode': 'off', 'use_snp_selection': False}. Best is trial 19 with value: 0.19602741631124895.
[I 2025-12-05 18:25:36,129] Trial 52 finished with value: 0.18661384192150846 and parameters: {'model_type': 'mlp', 'hidden_dims': '[512, 64]', 'dropout': 0.27958803233063273, 'batch_norm': False, 'lr': 1.7788265093833332e-06, 'weight_decay': 1.0385407414835471e-05, 'epochs': 309, 'loss': 'mae', 'optimizer': 'adam', 'graph_mode': 'off', 'use_snp_selection': False}. Best is trial 19 with value: 0.19602741631124895.
[I 2025-12-05 18:26:19,523] Trial 53 finished with value: 0.15806187938871785 and parameters: {'model_type': 'mlp', 'hidden_dims': '[512, 64]', 'dropout': 0.1323607385994608, 'batch_norm': False, 'lr': 1.3104997201601e-06, 'weight_decay': 1.687857735080423e-06, 'epochs': 125, 'loss': 'mae', 'optimizer': 'adam', 'graph_mode': 'off', 'use_snp_selection': False}. Best is trial 19 with value: 0.19602741631124895.
[I 2025-12-05 18:27:42,310] Trial 54 finished with value: 0.18769455873905172 and parameters: {'model_type': 'mlp', 'hidden_dims': '[512, 64]', 'dropout': 0.5733575912447281, 'batch_norm': False, 'lr': 8.573034669780623e-05, 'weight_decay': 1.765936101851156e-05, 'epochs': 271, 'loss': 'mae', 'optimizer': 'adam', 'graph_mode': 'off', 'use_snp_selection': False}. Best is trial 19 with value: 0.19602741631124895.
[I 2025-12-05 18:29:00,228] Trial 55 finished with value: 0.16629040493850739 and parameters: {'model_type': 'mlp', 'hidden_dims': '[512, 64]', 'dropout': 0.5260218431763798, 'batch_norm': False, 'lr': 1.0001849889633762e-06, 'weight_decay': 4.396273552717576e-05, 'epochs': 247, 'loss': 'mae', 'optimizer': 'adam', 'graph_mode': 'off', 'use_snp_selection': False}. Best is trial 19 with value: 0.19602741631124895.
[I 2025-12-05 18:30:43,847] Trial 56 finished with value: 0.1895326668722854 and parameters: {'model_type': 'mlp', 'hidden_dims': '[512, 64]', 'dropout': 0.3601333602028284, 'batch_norm': False, 'lr': 5.738331616380311e-06, 'weight_decay': 4.6484062226640807e-07, 'epochs': 337, 'loss': 'mae', 'optimizer': 'adam', 'graph_mode': 'off', 'use_snp_selection': False}. Best is trial 19 with value: 0.19602741631124895.
