[I 2025-12-06 04:08:58,550] Trial 81 finished with value: 0.19784750054326344 and parameters: {'model_type': 'mlp', 'hidden_dims': '[512, 64]', 'dropout': 0.5479217817036283, 'batch_norm': False, 'lr': 3.0355665126385975e-06, 'weight_decay': 4.252767136770966e-06, 'epochs': 73, 'loss': 'mae', 'optimizer': 'adam', 'graph_mode': 'off', 'use_snp_selection': False}. Best is trial 49 with value: 0.24857785897681794.
[I 2025-12-06 04:09:17,489] Trial 82 finished with value: 0.24218922601852105 and parameters: {'model_type': 'mlp', 'hidden_dims': '[512, 64]', 'dropout': 0.52951480941952, 'batch_norm': False, 'lr': 1.2582982328081003e-05, 'weight_decay': 2.705651341866045e-06, 'epochs': 45, 'loss': 'mae', 'optimizer': 'adam', 'graph_mode': 'off', 'use_snp_selection': False}. Best is trial 49 with value: 0.24857785897681794.
[I 2025-12-06 04:10:26,557] Trial 83 finished with value: 0.23943122019178414 and parameters: {'model_type': 'mlp', 'hidden_dims': '[512, 64]', 'dropout': 0.5345070576791363, 'batch_norm': False, 'lr': 1.4192061495202052e-05, 'weight_decay': 2.5749308899120874e-06, 'epochs': 237, 'loss': 'mae', 'optimizer': 'adam', 'graph_mode': 'off', 'use_snp_selection': False}. Best is trial 49 with value: 0.24857785897681794.
[I 2025-12-06 04:11:25,337] Trial 84 finished with value: 0.1963849345351017 and parameters: {'model_type': 'mlp', 'hidden_dims': '[512, 64]', 'dropout': 0.49154732526417844, 'batch_norm': True, 'lr': 5.322846796806671e-06, 'weight_decay': 6.149529857139036e-07, 'epochs': 193, 'loss': 'mae', 'optimizer': 'adam', 'graph_mode': 'off', 'use_snp_selection': False}. Best is trial 49 with value: 0.24857785897681794.
[I 2025-12-06 04:12:05,291] Trial 85 finished with value: 0.22876104580836162 and parameters: {'model_type': 'mlp', 'hidden_dims': '[512, 64]', 'dropout': 0.5141686994712109, 'batch_norm': False, 'lr': 8.833263387398487e-06, 'weight_decay': 1.4319423408089176e-06, 'epochs': 124, 'loss': 'mae', 'optimizer': 'adam', 'graph_mode': 'off', 'use_snp_selection': False}. Best is trial 49 with value: 0.24857785897681794.
[I 2025-12-06 04:12:28,351] Trial 86 finished with value: 0.2438602704886625 and parameters: {'model_type': 'mlp', 'hidden_dims': '[128, 64]', 'dropout': 0.440641445638442, 'batch_norm': False, 'lr': 1.2432326255340017e-05, 'weight_decay': 1.0384982346984842e-06, 'epochs': 251, 'loss': 'mae', 'optimizer': 'adam', 'graph_mode': 'off', 'use_snp_selection': False}. Best is trial 49 with value: 0.24857785897681794.
[I 2025-12-06 04:12:50,279] Trial 87 finished with value: 0.22600631726615358 and parameters: {'model_type': 'mlp', 'hidden_dims': '[128, 64]', 'dropout': 0.4413776140371352, 'batch_norm': False, 'lr': 1.2678853930595588e-05, 'weight_decay': 1.1488890839766737e-06, 'epochs': 235, 'loss': 'mae', 'optimizer': 'adam', 'graph_mode': 'off', 'use_snp_selection': False}. Best is trial 49 with value: 0.24857785897681794.
[I 2025-12-06 04:14:01,987] Trial 88 finished with value: 0.22463890505583847 and parameters: {'model_type': 'mlp', 'hidden_dims': '[512, 64]', 'dropout': 0.41725131038093555, 'batch_norm': False, 'lr': 1.7281476526411568e-05, 'weight_decay': 1.0326572808205116e-06, 'epochs': 246, 'loss': 'mae', 'optimizer': 'adam', 'graph_mode': 'off', 'use_snp_selection': False}. Best is trial 49 with value: 0.24857785897681794.
[I 2025-12-06 04:14:42,613] Trial 89 finished with value: 0.2288196238412942 and parameters: {'model_type': 'mlp', 'hidden_dims': '[256, 128]', 'dropout': 0.47767581825322414, 'batch_norm': False, 'lr': 6.788677924880078e-06, 'weight_decay': 3.414959850991977e-07, 'epochs': 256, 'loss': 'mse', 'optimizer': 'adam', 'graph_mode': 'off', 'use_snp_selection': False}. Best is trial 49 with value: 0.24857785897681794.
[I 2025-12-06 04:15:49,696] Trial 90 finished with value: 0.22505172706011348 and parameters: {'model_type': 'mlp', 'hidden_dims': '[512, 256]', 'dropout': 0.4652298549164542, 'batch_norm': False, 'lr': 2.317864996983096e-05, 'weight_decay': 7.695219424012017e-07, 'epochs': 229, 'loss': 'mae', 'optimizer': 'adam', 'graph_mode': 'off', 'use_snp_selection': False}. Best is trial 49 with value: 0.24857785897681794.
[I 2025-12-06 04:16:16,301] Trial 91 finished with value: 0.2176805918101857 and parameters: {'model_type': 'mlp', 'hidden_dims': '[128, 64]', 'dropout': 0.4988100395498609, 'batch_norm': False, 'lr': 2.6623809854461433e-06, 'weight_decay': 3.1569207061378094e-06, 'epochs': 300, 'loss': 'mae', 'optimizer': 'adam', 'graph_mode': 'off', 'use_snp_selection': False}. Best is trial 49 with value: 0.24857785897681794.
[I 2025-12-06 04:16:29,639] Trial 92 finished with value: 0.2457366953482444 and parameters: {'model_type': 'mlp', 'hidden_dims': '[128, 64]', 'dropout': 0.44228371050289783, 'batch_norm': False, 'lr': 4.232168022186226e-05, 'weight_decay': 5.739477642707906e-07, 'epochs': 112, 'loss': 'mae', 'optimizer': 'adam', 'graph_mode': 'off', 'use_snp_selection': False}. Best is trial 49 with value: 0.24857785897681794.
[I 2025-12-06 04:16:42,733] Trial 93 finished with value: 0.23973828893036025 and parameters: {'model_type': 'mlp', 'hidden_dims': '[128, 64]', 'dropout': 0.42384301340460223, 'batch_norm': False, 'lr': 4.0920408632975054e-05, 'weight_decay': 5.076642383861525e-07, 'epochs': 108, 'loss': 'mae', 'optimizer': 'adam', 'graph_mode': 'off', 'use_snp_selection': False}. Best is trial 49 with value: 0.24857785897681794.
[I 2025-12-06 04:16:58,039] Trial 94 finished with value: 0.2410146120435328 and parameters: {'model_type': 'mlp', 'hidden_dims': '[128, 64]', 'dropout': 0.44370261210757195, 'batch_norm': False, 'lr': 2.9537347285081984e-05, 'weight_decay': 2.0161459174720134e-06, 'epochs': 140, 'loss': 'mae', 'optimizer': 'adam', 'graph_mode': 'off', 'use_snp_selection': False}. Best is trial 49 with value: 0.24857785897681794.
[I 2025-12-06 04:17:17,100] Trial 95 finished with value: 0.23931861290094875 and parameters: {'model_type': 'mlp', 'hidden_dims': '[512, 64]', 'dropout': 0.4629804037125391, 'batch_norm': False, 'lr': 5.1849778141849036e-05, 'weight_decay': 3.8255786104712285e-07, 'epochs': 45, 'loss': 'mae', 'optimizer': 'adam', 'graph_mode': 'off', 'use_snp_selection': False}. Best is trial 49 with value: 0.24857785897681794.
[I 2025-12-06 04:17:46,635] Trial 96 finished with value: 0.24078280543511682 and parameters: {'model_type': 'mlp', 'hidden_dims': '[512, 128]', 'dropout': 0.43514724633160207, 'batch_norm': False, 'lr': 7.054056743737993e-05, 'weight_decay': 1.040438307832108e-05, 'epochs': 86, 'loss': 'mae', 'optimizer': 'adam', 'graph_mode': 'off', 'use_snp_selection': False}. Best is trial 49 with value: 0.24857785897681794.
[I 2025-12-06 04:18:06,645] Trial 97 finished with value: 0.2107873698033976 and parameters: {'model_type': 'mlp', 'hidden_dims': '[128, 64]', 'dropout': 0.5213286597737428, 'batch_norm': True, 'lr': 9.93220158085952e-05, 'weight_decay': 6.325524156478602e-07, 'epochs': 203, 'loss': 'mae', 'optimizer': 'adam', 'graph_mode': 'off', 'use_snp_selection': False}. Best is trial 49 with value: 0.24857785897681794.
[I 2025-12-06 04:19:10,431] Trial 98 finished with value: 0.2236917373596033 and parameters: {'model_type': 'mlp', 'hidden_dims': '[512, 64]', 'dropout': 0.5065967331380976, 'batch_norm': False, 'lr': 1.9975305922733625e-05, 'weight_decay': 8.800072165877774e-07, 'epochs': 216, 'loss': 'mae', 'optimizer': 'adam', 'graph_mode': 'off', 'use_snp_selection': False}. Best is trial 49 with value: 0.24857785897681794.
[I 2025-12-06 04:19:24,684] Trial 99 finished with value: 0.13270076150310572 and parameters: {'model_type': 'mlp', 'hidden_dims': '[256, 128, 64]', 'dropout': 0.5404064804139865, 'batch_norm': False, 'lr': 3.4177312892836042e-06, 'weight_decay': 1.3626973216368622e-05, 'epochs': 60, 'loss': 'mae', 'optimizer': 'adam', 'graph_mode': 'off', 'use_snp_selection': False}. Best is trial 49 with value: 0.24857785897681794.
[I 2025-12-06 04:19:45,119] Trial 100 finished with value: 0.2275896940643431 and parameters: {'model_type': 'mlp', 'hidden_dims': '[256, 128]', 'dropout': 0.4734217004006336, 'batch_norm': False, 'lr': 8.581627193850529e-06, 'weight_decay': 1.9453211526562197e-07, 'epochs': 106, 'loss': 'mae', 'optimizer': 'adam', 'graph_mode': 'off', 'use_snp_selection': False}. Best is trial 49 with value: 0.24857785897681794.
[I 2025-12-06 04:20:42,590] Trial 101 finished with value: 0.22859536144291698 and parameters: {'model_type': 'mlp', 'hidden_dims': '[128, 64]', 'dropout': 0.39062168633934813, 'batch_norm': False, 'lr': 2.1483744338190905e-06, 'weight_decay': 6.182578740905161e-06, 'epochs': 317, 'loss': 'mae', 'optimizer': 'adam', 'graph_mode': 'off', 'use_snp_selection': True, 'num_snps': 45172}. Best is trial 49 with value: 0.24857785897681794.
[I 2025-12-06 04:22:30,802] Trial 102 finished with value: 0.2511280319682983 and parameters: {'model_type': 'mlp', 'hidden_dims': '[512, 256]', 'dropout': 0.4923759171443286, 'batch_norm': False, 'lr': 4.657010094337657e-06, 'weight_decay': 2.33016288791698e-05, 'epochs': 308, 'loss': 'mae', 'optimizer': 'adam', 'graph_mode': 'off', 'use_snp_selection': True, 'num_snps': 50818}. Best is trial 102 with value: 0.2511280319682983.
[I 2025-12-06 04:23:56,260] Trial 103 finished with value: 0.2209471342130569 and parameters: {'model_type': 'mlp', 'hidden_dims': '[512, 256]', 'dropout': 0.45186426382046296, 'batch_norm': False, 'lr': 4.208473360322625e-06, 'weight_decay': 7.437396775387091e-06, 'epochs': 295, 'loss': 'mae', 'optimizer': 'adam', 'graph_mode': 'off', 'use_snp_selection': False}. Best is trial 102 with value: 0.2511280319682983.
[I 2025-12-06 04:25:45,035] Trial 104 finished with value: 0.247760046275812 and parameters: {'model_type': 'mlp', 'hidden_dims': '[512, 256]', 'dropout': 0.4899271847214188, 'batch_norm': False, 'lr': 6.041423859785621e-06, 'weight_decay': 2.1910312243390237e-05, 'epochs': 306, 'loss': 'mae', 'optimizer': 'adam', 'graph_mode': 'off', 'use_snp_selection': True, 'num_snps': 51212}. Best is trial 102 with value: 0.2511280319682983.
[I 2025-12-06 04:27:26,641] Trial 105 finished with value: 0.23227544555888904 and parameters: {'model_type': 'mlp', 'hidden_dims': '[512, 256]', 'dropout': 0.4915621248089074, 'batch_norm': False, 'lr': 5.767725400746961e-06, 'weight_decay': 2.0670972883192197e-05, 'epochs': 273, 'loss': 'mae', 'optimizer': 'adam', 'graph_mode': 'off', 'use_snp_selection': True, 'num_snps': 51225}. Best is trial 102 with value: 0.2511280319682983.
[I 2025-12-06 04:29:29,491] Trial 106 finished with value: 0.23469072856782836 and parameters: {'model_type': 'mlp', 'hidden_dims': '[512, 256]', 'dropout': 0.45622383343746525, 'batch_norm': False, 'lr': 4.679071972430934e-06, 'weight_decay': 2.34686268874702e-05, 'epochs': 307, 'loss': 'mae', 'optimizer': 'adam', 'graph_mode': 'off', 'use_snp_selection': True, 'num_snps': 59838}. Best is trial 102 with value: 0.2511280319682983.
[I 2025-12-06 04:31:18,261] Trial 107 finished with value: 0.2444619827177826 and parameters: {'model_type': 'mlp', 'hidden_dims': '[512, 256]', 'dropout': 0.47845328345184956, 'batch_norm': False, 'lr': 3.84944322209609e-06, 'weight_decay': 2.782287785698577e-05, 'epochs': 284, 'loss': 'mse', 'optimizer': 'adam', 'graph_mode': 'off', 'use_snp_selection': True, 'num_snps': 54829}. Best is trial 102 with value: 0.2511280319682983.
[I 2025-12-06 04:32:59,716] Trial 108 finished with value: 0.23666579566743695 and parameters: {'model_type': 'mlp', 'hidden_dims': '[512, 256]', 'dropout': 0.4295852995729634, 'batch_norm': False, 'lr': 2.8781939815932618e-06, 'weight_decay': 1.5928194784127024e-05, 'epochs': 288, 'loss': 'mse', 'optimizer': 'adam', 'graph_mode': 'off', 'use_snp_selection': True, 'num_snps': 48873}. Best is trial 102 with value: 0.2511280319682983.
[I 2025-12-06 04:34:43,674] Trial 109 finished with value: 0.2285885490389778 and parameters: {'model_type': 'mlp', 'hidden_dims': '[512, 256]', 'dropout': 0.4769365887834146, 'batch_norm': False, 'lr': 3.5041137451083417e-06, 'weight_decay': 4.207187195937218e-05, 'epochs': 252, 'loss': 'mse', 'optimizer': 'adam', 'graph_mode': 'off', 'use_snp_selection': True, 'num_snps': 55445}. Best is trial 102 with value: 0.2511280319682983.
[I 2025-12-06 04:36:27,533] Trial 110 finished with value: 0.2267485361619957 and parameters: {'model_type': 'mlp', 'hidden_dims': '[512, 256]', 'dropout': 0.40933575297046276, 'batch_norm': False, 'lr': 4.990285137801353e-06, 'weight_decay': 0.0006446290682817063, 'epochs': 279, 'loss': 'mse', 'optimizer': 'adam', 'graph_mode': 'off', 'use_snp_selection': True, 'num_snps': 51796}. Best is trial 102 with value: 0.2511280319682983.
[I 2025-12-06 04:38:24,143] Trial 111 finished with value: 0.21896049444180052 and parameters: {'model_type': 'mlp', 'hidden_dims': '[512, 256]', 'dropout': 0.509246612464406, 'batch_norm': False, 'lr': 3.897159031716872e-06, 'weight_decay': 3.103215109756553e-05, 'epochs': 310, 'loss': 'mse', 'optimizer': 'adam', 'graph_mode': 'off', 'use_snp_selection': True, 'num_snps': 55448}. Best is trial 102 with value: 0.2511280319682983.
[I 2025-12-06 04:40:16,528] Trial 112 finished with value: 0.2169987912114122 and parameters: {'model_type': 'mlp', 'hidden_dims': '[512, 256]', 'dropout': 0.4941891560468542, 'batch_norm': False, 'lr': 6.0997194134971256e-06, 'weight_decay': 2.3507646402341447e-05, 'epochs': 282, 'loss': 'mse', 'optimizer': 'adam', 'graph_mode': 'off', 'use_snp_selection': True, 'num_snps': 57103}. Best is trial 102 with value: 0.2511280319682983.
[I 2025-12-06 04:41:58,548] Trial 113 finished with value: 0.2322453677079926 and parameters: {'model_type': 'mlp', 'hidden_dims': '[512, 256]', 'dropout': 0.4677469236931446, 'batch_norm': False, 'lr': 3.1719601346698844e-06, 'weight_decay': 9.620729279841297e-06, 'epochs': 330, 'loss': 'mae', 'optimizer': 'adam', 'graph_mode': 'off', 'use_snp_selection': True, 'num_snps': 44124}. Best is trial 102 with value: 0.2511280319682983.
[I 2025-12-06 04:43:40,976] Trial 114 finished with value: 0.23512271827479309 and parameters: {'model_type': 'mlp', 'hidden_dims': '[512, 256]', 'dropout': 0.48196334251596273, 'batch_norm': False, 'lr': 7.410356697143255e-06, 'weight_decay': 5.281768529468403e-05, 'epochs': 302, 'loss': 'mae', 'optimizer': 'adam', 'graph_mode': 'off', 'use_snp_selection': True, 'num_snps': 47962}. Best is trial 102 with value: 0.2511280319682983.
[I 2025-12-06 04:45:36,193] Trial 115 finished with value: 0.23708681161129103 and parameters: {'model_type': 'mlp', 'hidden_dims': '[512, 256]', 'dropout': 0.456155875443293, 'batch_norm': False, 'lr': 2.3137025876665914e-06, 'weight_decay': 1.636378611597596e-05, 'epochs': 341, 'loss': 'mae', 'optimizer': 'adam', 'graph_mode': 'off', 'use_snp_selection': True, 'num_snps': 50739}. Best is trial 102 with value: 0.2511280319682983.
[I 2025-12-06 04:47:26,779] Trial 116 finished with value: 0.23933854437364493 and parameters: {'model_type': 'mlp', 'hidden_dims': '[512, 256]', 'dropout': 0.5670486554802939, 'batch_norm': False, 'lr': 4.60278505740231e-06, 'weight_decay': 4.545376642594941e-07, 'epochs': 293, 'loss': 'mae', 'optimizer': 'adam', 'graph_mode': 'off', 'use_snp_selection': True, 'num_snps': 54367}. Best is trial 102 with value: 0.2511280319682983.
[I 2025-12-06 04:48:27,692] Trial 117 finished with value: 0.22678222680716584 and parameters: {'model_type': 'mlp', 'hidden_dims': '[256, 128]', 'dropout': 0.5526050513186958, 'batch_norm': False, 'lr': 5.567504494443324e-06, 'weight_decay': 3.0816409521290904e-07, 'epochs': 192, 'loss': 'mse', 'optimizer': 'adam', 'graph_mode': 'off', 'use_snp_selection': True, 'num_snps': 45879}. Best is trial 102 with value: 0.2511280319682983.
[I 2025-12-06 04:48:51,882] Trial 118 finished with value: 0.17329311122011115 and parameters: {'model_type': 'mlp', 'hidden_dims': '[128, 64]', 'dropout': 0.5006035086717435, 'batch_norm': True, 'lr': 4.041218833981975e-06, 'weight_decay': 1.2646786857597571e-05, 'epochs': 265, 'loss': 'mae', 'optimizer': 'adam', 'graph_mode': 'off', 'use_snp_selection': False}. Best is trial 102 with value: 0.2511280319682983.
[I 2025-12-06 04:50:50,447] Trial 119 finished with value: 0.2284727458403896 and parameters: {'model_type': 'mlp', 'hidden_dims': '[512, 256]', 'dropout': 0.5246314196111763, 'batch_norm': False, 'lr': 4.29268127266661e-05, 'weight_decay': 1.9814225568435262e-05, 'epochs': 316, 'loss': 'mae', 'optimizer': 'adam', 'graph_mode': 'off', 'use_snp_selection': True, 'num_snps': 57322}. Best is trial 102 with value: 0.2511280319682983.
[I 2025-12-06 04:52:10,112] Trial 120 finished with value: 0.24336859679437808 and parameters: {'model_type': 'mlp', 'hidden_dims': '[512, 128]', 'dropout': 0.4886184493908393, 'batch_norm': False, 'lr': 6.3497437982533054e-06, 'weight_decay': 6.048257155398407e-07, 'epochs': 274, 'loss': 'mae', 'optimizer': 'adam', 'graph_mode': 'off', 'use_snp_selection': False}. Best is trial 102 with value: 0.2511280319682983.
[I 2025-12-06 04:53:43,296] Trial 121 finished with value: 0.23857487309564815 and parameters: {'model_type': 'mlp', 'hidden_dims': '[512, 128]', 'dropout': 0.4816913746375475, 'batch_norm': False, 'lr': 9.299995053852626e-06, 'weight_decay': 5.99911476306164e-07, 'epochs': 324, 'loss': 'mae', 'optimizer': 'adam', 'graph_mode': 'off', 'use_snp_selection': False}. Best is trial 102 with value: 0.2511280319682983.
[I 2025-12-06 04:55:03,738] Trial 122 finished with value: 0.22624001983170322 and parameters: {'model_type': 'mlp', 'hidden_dims': '[512, 128]', 'dropout': 0.4454361495440588, 'batch_norm': False, 'lr': 6.823096188123496e-06, 'weight_decay': 7.136838577071643e-07, 'epochs': 275, 'loss': 'mae', 'optimizer': 'adam', 'graph_mode': 'off', 'use_snp_selection': False}. Best is trial 102 with value: 0.2511280319682983.
[I 2025-12-06 04:56:25,758] Trial 123 finished with value: 0.23278453991458417 and parameters: {'model_type': 'mlp', 'hidden_dims': '[512, 128]', 'dropout': 0.5135316987453956, 'batch_norm': False, 'lr': 8.031236354514055e-06, 'weight_decay': 1.0007197246857784e-06, 'epochs': 282, 'loss': 'mae', 'optimizer': 'adam', 'graph_mode': 'off', 'use_snp_selection': False}. Best is trial 102 with value: 0.2511280319682983.
[I 2025-12-06 04:58:01,403] Trial 124 finished with value: 0.2446202957061035 and parameters: {'model_type': 'mlp', 'hidden_dims': '[512, 128]', 'dropout': 0.4948944347303248, 'batch_norm': False, 'lr': 6.296094365041402e-06, 'weight_decay': 1.0051161798185568e-07, 'epochs': 333, 'loss': 'mae', 'optimizer': 'adam', 'graph_mode': 'off', 'use_snp_selection': False}. Best is trial 102 with value: 0.2511280319682983.
[I 2025-12-06 04:59:40,381] Trial 125 finished with value: 0.22919069900505645 and parameters: {'model_type': 'mlp', 'hidden_dims': '[512, 64]', 'dropout': 0.4680655155480259, 'batch_norm': False, 'lr': 5.040593996240235e-06, 'weight_decay': 1.617361668353528e-07, 'epochs': 346, 'loss': 'mae', 'optimizer': 'adam', 'graph_mode': 'off', 'use_snp_selection': False}. Best is trial 102 with value: 0.2511280319682983.
[I 2025-12-06 05:00:32,124] Trial 126 finished with value: 0.2499903604433989 and parameters: {'model_type': 'mlp', 'hidden_dims': '[256, 128, 64]', 'dropout': 0.5001031939796786, 'batch_norm': False, 'lr': 2.6322931559019046e-06, 'weight_decay': 2.5856216709670006e-05, 'epochs': 336, 'loss': 'mae', 'optimizer': 'adam', 'graph_mode': 'off', 'use_snp_selection': False}. Best is trial 102 with value: 0.2511280319682983.
[I 2025-12-06 05:01:23,760] Trial 127 finished with value: 0.2301447558255001 and parameters: {'model_type': 'mlp', 'hidden_dims': '[256, 128, 64]', 'dropout': 0.4368195153749843, 'batch_norm': False, 'lr': 1.7686393633297538e-06, 'weight_decay': 2.69881735894069e-05, 'epochs': 335, 'loss': 'mae', 'optimizer': 'adam', 'graph_mode': 'off', 'use_snp_selection': False}. Best is trial 102 with value: 0.2511280319682983.
[I 2025-12-06 05:02:14,863] Trial 128 finished with value: 0.242881543156854 and parameters: {'model_type': 'mlp', 'hidden_dims': '[256, 128, 64]', 'dropout': 0.46195216032720765, 'batch_norm': False, 'lr': 2.596337526793119e-06, 'weight_decay': 1.1479062706919879e-07, 'epochs': 331, 'loss': 'mae', 'optimizer': 'adam', 'graph_mode': 'off', 'use_snp_selection': False}. Best is trial 102 with value: 0.2511280319682983.
[I 2025-12-06 05:03:56,335] Trial 129 finished with value: 0.23899141393636034 and parameters: {'model_type': 'mlp', 'hidden_dims': '[512, 128]', 'dropout': 0.49212721358600275, 'batch_norm': False, 'lr': 3.1542936198531213e-06, 'weight_decay': 4.7085104971133816e-05, 'epochs': 341, 'loss': 'mae', 'optimizer': 'adam', 'graph_mode': 'off', 'use_snp_selection': True, 'num_snps': 42406}. Best is trial 102 with value: 0.2511280319682983.
[I 2025-12-06 05:04:46,008] Trial 130 finished with value: 0.24967506064894388 and parameters: {'model_type': 'mlp', 'hidden_dims': '[256, 128, 64]', 'dropout': 0.4760147913075204, 'batch_norm': False, 'lr': 3.691190667168032e-06, 'weight_decay': 3.4242360049164963e-05, 'epochs': 322, 'loss': 'mae', 'optimizer': 'adam', 'graph_mode': 'off', 'use_snp_selection': False}. Best is trial 102 with value: 0.2511280319682983.
[I 2025-12-06 05:05:36,065] Trial 131 finished with value: 0.24206540539752944 and parameters: {'model_type': 'mlp', 'hidden_dims': '[256, 128, 64]', 'dropout': 0.4732145396153731, 'batch_norm': False, 'lr': 3.619681117753608e-06, 'weight_decay': 3.696138534383296e-05, 'epochs': 324, 'loss': 'mae', 'optimizer': 'adam', 'graph_mode': 'off', 'use_snp_selection': False}. Best is trial 102 with value: 0.2511280319682983.
