[I 2025-12-05 15:51:45,454] Trial 89 finished with value: 0.0770837247253646 and parameters: {'model_type': 'mlp', 'hidden_dims': '[512, 64]', 'dropout': 0.334796896870593, 'batch_norm': True, 'lr': 0.0006789064351886693, 'weight_decay': 2.054334571682551e-06, 'epochs': 66, 'loss': 'mse', 'optimizer': 'adam', 'graph_mode': 'off', 'use_snp_selection': False}. Best is trial 23 with value: 0.11977490981415422.
[I 2025-12-05 15:51:46,296] Trial 90 finished with value: 0.07814037446217842 and parameters: {'model_type': 'mlp', 'hidden_dims': '[128, 64]', 'dropout': 0.2774822229622745, 'batch_norm': True, 'lr': 2.561337529768338e-05, 'weight_decay': 1.3827379198641825e-05, 'epochs': 223, 'loss': 'mse', 'optimizer': 'adam', 'graph_mode': 'off', 'use_snp_selection': False}. Best is trial 23 with value: 0.11977490981415422.
[I 2025-12-05 15:51:47,088] Trial 91 finished with value: 0.07490996004031263 and parameters: {'model_type': 'mlp', 'hidden_dims': '[128, 64]', 'dropout': 0.30958292647193597, 'batch_norm': True, 'lr': 0.0008841192974070754, 'weight_decay': 4.056997958510579e-06, 'epochs': 209, 'loss': 'mse', 'optimizer': 'adam', 'graph_mode': 'off', 'use_snp_selection': False}. Best is trial 23 with value: 0.11977490981415422.
[I 2025-12-05 15:51:47,910] Trial 92 finished with value: 0.1183710617725584 and parameters: {'model_type': 'mlp', 'hidden_dims': '[128, 64]', 'dropout': 0.3250492997317982, 'batch_norm': True, 'lr': 0.0009924314929856584, 'weight_decay': 5.252527114202649e-06, 'epochs': 229, 'loss': 'mse', 'optimizer': 'adam', 'graph_mode': 'off', 'use_snp_selection': False}. Best is trial 23 with value: 0.11977490981415422.
[I 2025-12-05 15:51:48,672] Trial 93 finished with value: 0.09522036518432223 and parameters: {'model_type': 'mlp', 'hidden_dims': '[128, 64]', 'dropout': 0.38006396421772914, 'batch_norm': True, 'lr': 0.0009982469042714482, 'weight_decay': 2.880987879635668e-06, 'epochs': 159, 'loss': 'mse', 'optimizer': 'adam', 'graph_mode': 'off', 'use_snp_selection': False}. Best is trial 23 with value: 0.11977490981415422.
[I 2025-12-05 15:51:49,511] Trial 94 finished with value: 0.09814158201315899 and parameters: {'model_type': 'mlp', 'hidden_dims': '[128, 64]', 'dropout': 0.32229798386212116, 'batch_norm': True, 'lr': 0.0005296837141456661, 'weight_decay': 9.037101071066548e-06, 'epochs': 239, 'loss': 'mse', 'optimizer': 'adam', 'graph_mode': 'off', 'use_snp_selection': False}. Best is trial 23 with value: 0.11977490981415422.
[I 2025-12-05 15:51:50,291] Trial 95 finished with value: 0.11218536750896035 and parameters: {'model_type': 'mlp', 'hidden_dims': '[128, 64]', 'dropout': 0.3426806925341939, 'batch_norm': True, 'lr': 0.0003353434268184469, 'weight_decay': 5.490562531842973e-06, 'epochs': 201, 'loss': 'mse', 'optimizer': 'adam', 'graph_mode': 'off', 'use_snp_selection': False}. Best is trial 23 with value: 0.11977490981415422.
[I 2025-12-05 15:51:51,594] Trial 96 finished with value: 0.1020646727873325 and parameters: {'model_type': 'mlp', 'hidden_dims': '[512, 128]', 'dropout': 0.34898154812900267, 'batch_norm': True, 'lr': 0.00031859960444124974, 'weight_decay': 4.6758153732212455e-05, 'epochs': 198, 'loss': 'mse', 'optimizer': 'adam', 'graph_mode': 'off', 'use_snp_selection': False}. Best is trial 23 with value: 0.11977490981415422.
[I 2025-12-05 15:51:52,497] Trial 97 finished with value: 0.09025962635402915 and parameters: {'model_type': 'mlp', 'hidden_dims': '[256, 128, 64]', 'dropout': 0.3684673133696331, 'batch_norm': True, 'lr': 0.00024818632720245514, 'weight_decay': 4.798956918776451e-06, 'epochs': 188, 'loss': 'mse', 'optimizer': 'adam', 'graph_mode': 'off', 'use_snp_selection': False}. Best is trial 23 with value: 0.11977490981415422.
[I 2025-12-05 15:51:53,286] Trial 98 finished with value: 0.10039351951575363 and parameters: {'model_type': 'mlp', 'hidden_dims': '[128, 64]', 'dropout': 0.33676406594517505, 'batch_norm': True, 'lr': 0.00038199703481043857, 'weight_decay': 2.0022143386136015e-05, 'epochs': 204, 'loss': 'mse', 'optimizer': 'adam', 'graph_mode': 'off', 'use_snp_selection': False}. Best is trial 23 with value: 0.11977490981415422.
[I 2025-12-05 15:51:54,771] Trial 99 finished with value: 0.05164395462117347 and parameters: {'model_type': 'mlp', 'hidden_dims': '[512, 256]', 'dropout': 0.38877095148203167, 'batch_norm': False, 'lr': 0.0006845455547626435, 'weight_decay': 5.693082984602135e-06, 'epochs': 260, 'loss': 'mae', 'optimizer': 'adam', 'graph_mode': 'off', 'use_snp_selection': False}. Best is trial 23 with value: 0.11977490981415422.
[I 2025-12-05 15:51:55,851] Trial 100 finished with value: 0.10298137902499292 and parameters: {'model_type': 'mlp', 'hidden_dims': '[256, 128, 64]', 'dropout': 0.2974591207552187, 'batch_norm': True, 'lr': 0.00015063855192521403, 'weight_decay': 6.979829055020699e-05, 'epochs': 279, 'loss': 'mse', 'optimizer': 'adam', 'graph_mode': 'off', 'use_snp_selection': False}. Best is trial 23 with value: 0.11977490981415422.
[I 2025-12-05 15:51:56,653] Trial 101 finished with value: 0.10006115793005564 and parameters: {'model_type': 'mlp', 'hidden_dims': '[128, 64]', 'dropout': 0.30943123928737387, 'batch_norm': True, 'lr': 0.0004503369380298127, 'weight_decay': 0.00015070245388513784, 'epochs': 212, 'loss': 'mse', 'optimizer': 'adam', 'graph_mode': 'off', 'use_snp_selection': False}. Best is trial 23 with value: 0.11977490981415422.
[I 2025-12-05 15:51:57,463] Trial 102 finished with value: 0.1050406910555865 and parameters: {'model_type': 'mlp', 'hidden_dims': '[128, 64]', 'dropout': 0.3248143803238591, 'batch_norm': True, 'lr': 0.0007667655844589158, 'weight_decay': 3.315253957990138e-06, 'epochs': 220, 'loss': 'mse', 'optimizer': 'adam', 'graph_mode': 'off', 'use_snp_selection': False}. Best is trial 23 with value: 0.11977490981415422.
[I 2025-12-05 15:51:58,288] Trial 103 finished with value: 0.09555353204411433 and parameters: {'model_type': 'mlp', 'hidden_dims': '[128, 64]', 'dropout': 0.3549018056663055, 'batch_norm': True, 'lr': 0.00051819321138323, 'weight_decay': 0.00010260152628257635, 'epochs': 232, 'loss': 'mse', 'optimizer': 'adam', 'graph_mode': 'off', 'use_snp_selection': False}. Best is trial 23 with value: 0.11977490981415422.
[I 2025-12-05 15:51:59,527] Trial 104 finished with value: 0.09099096415357064 and parameters: {'model_type': 'mlp', 'hidden_dims': '[512, 64]', 'dropout': 0.2922299146182221, 'batch_norm': True, 'lr': 0.00034166446955032575, 'weight_decay': 1.7941505741486782e-06, 'epochs': 178, 'loss': 'mse', 'optimizer': 'adam', 'graph_mode': 'off', 'use_snp_selection': False}. Best is trial 23 with value: 0.11977490981415422.
[I 2025-12-05 15:52:00,346] Trial 105 finished with value: 0.11115982216352549 and parameters: {'model_type': 'mlp', 'hidden_dims': '[128, 64]', 'dropout': 0.2766267404830243, 'batch_norm': True, 'lr': 0.00042146329671935944, 'weight_decay': 2.2363834875701716e-06, 'epochs': 226, 'loss': 'mse', 'optimizer': 'adam', 'graph_mode': 'off', 'use_snp_selection': False}. Best is trial 23 with value: 0.11977490981415422.
[I 2025-12-05 15:52:01,161] Trial 106 finished with value: 0.0928907068691518 and parameters: {'model_type': 'mlp', 'hidden_dims': '[128, 64]', 'dropout': 0.26147305600298865, 'batch_norm': True, 'lr': 0.0004204652683025344, 'weight_decay': 7.471100355177916e-06, 'epochs': 226, 'loss': 'mse', 'optimizer': 'adam', 'graph_mode': 'off', 'use_snp_selection': False}. Best is trial 23 with value: 0.11977490981415422.
[I 2025-12-05 15:52:02,107] Trial 107 finished with value: 0.1023479916471497 and parameters: {'model_type': 'mlp', 'hidden_dims': '[256, 128, 64]', 'dropout': 0.2770420171982342, 'batch_norm': True, 'lr': 0.0002851167681016255, 'weight_decay': 2.3769550197018543e-06, 'epochs': 194, 'loss': 'mse', 'optimizer': 'adam', 'graph_mode': 'off', 'use_snp_selection': False}. Best is trial 23 with value: 0.11977490981415422.
[I 2025-12-05 15:52:03,214] Trial 108 finished with value: 0.08623570861715364 and parameters: {'model_type': 'mlp', 'hidden_dims': '[512, 128]', 'dropout': 0.34254370519432326, 'batch_norm': True, 'lr': 0.0005998738237628213, 'weight_decay': 1.310901178613157e-06, 'epochs': 248, 'loss': 'mse', 'optimizer': 'adam', 'graph_mode': 'off', 'use_snp_selection': True, 'num_snps': 11322}. Best is trial 23 with value: 0.11977490981415422.
[I 2025-12-05 15:52:04,055] Trial 109 finished with value: -0.022100386550837108 and parameters: {'model_type': 'mlp', 'hidden_dims': '[128, 64]', 'dropout': 0.4219760636243896, 'batch_norm': True, 'lr': 1.1221908914200985e-05, 'weight_decay': 2.981489901457723e-05, 'epochs': 241, 'loss': 'mse', 'optimizer': 'adam', 'graph_mode': 'off', 'use_snp_selection': False}. Best is trial 23 with value: 0.11977490981415422.
[I 2025-12-05 15:52:05,094] Trial 110 finished with value: 0.07661819445822798 and parameters: {'model_type': 'mlp', 'hidden_dims': '[256, 128, 64]', 'dropout': 0.24135258829192677, 'batch_norm': True, 'lr': 5.3916758451324007e-05, 'weight_decay': 0.0002182063808938595, 'epochs': 254, 'loss': 'mse', 'optimizer': 'adam', 'graph_mode': 'off', 'use_snp_selection': False}. Best is trial 23 with value: 0.11977490981415422.
[I 2025-12-05 15:52:05,897] Trial 111 finished with value: 0.09502514463735419 and parameters: {'model_type': 'mlp', 'hidden_dims': '[128, 64]', 'dropout': 0.316380818227463, 'batch_norm': True, 'lr': 0.000857106249959879, 'weight_decay': 5.1702282485005525e-06, 'epochs': 214, 'loss': 'mse', 'optimizer': 'adam', 'graph_mode': 'off', 'use_snp_selection': False}. Best is trial 23 with value: 0.11977490981415422.
[I 2025-12-05 15:52:06,684] Trial 112 finished with value: 0.10854129755205322 and parameters: {'model_type': 'mlp', 'hidden_dims': '[128, 64]', 'dropout': 0.28203958361289405, 'batch_norm': True, 'lr': 0.00020045760521416865, 'weight_decay': 2.6729503028099075e-06, 'epochs': 201, 'loss': 'mse', 'optimizer': 'adam', 'graph_mode': 'off', 'use_snp_selection': False}. Best is trial 23 with value: 0.11977490981415422.
[I 2025-12-05 15:52:07,468] Trial 113 finished with value: 0.10207737345886628 and parameters: {'model_type': 'mlp', 'hidden_dims': '[128, 64]', 'dropout': 0.22433373784831231, 'batch_norm': True, 'lr': 0.00017360363855562722, 'weight_decay': 2.9252799411561973e-06, 'epochs': 202, 'loss': 'mse', 'optimizer': 'adam', 'graph_mode': 'off', 'use_snp_selection': False}. Best is trial 23 with value: 0.11977490981415422.
[I 2025-12-05 15:52:08,313] Trial 114 finished with value: 0.10938094877674863 and parameters: {'model_type': 'mlp', 'hidden_dims': '[128, 64]', 'dropout': 0.28372322057475097, 'batch_norm': True, 'lr': 0.00020634627825185758, 'weight_decay': 4.026269878132726e-06, 'epochs': 221, 'loss': 'mse', 'optimizer': 'adam', 'graph_mode': 'off', 'use_snp_selection': False}. Best is trial 23 with value: 0.11977490981415422.
[I 2025-12-05 15:52:09,286] Trial 115 finished with value: 0.08168042278920416 and parameters: {'model_type': 'mlp', 'hidden_dims': '[256, 128]', 'dropout': 0.2672339464997235, 'batch_norm': True, 'lr': 8.411449916430646e-05, 'weight_decay': 3.7903919675359456e-06, 'epochs': 234, 'loss': 'mse', 'optimizer': 'adam', 'graph_mode': 'off', 'use_snp_selection': False}. Best is trial 23 with value: 0.11977490981415422.
[I 2025-12-05 15:52:10,097] Trial 116 finished with value: 0.09928303050134857 and parameters: {'model_type': 'mlp', 'hidden_dims': '[128, 64]', 'dropout': 0.14014500223148083, 'batch_norm': True, 'lr': 0.0001325895303102403, 'weight_decay': 1.1806004333504448e-05, 'epochs': 222, 'loss': 'mse', 'optimizer': 'adam', 'graph_mode': 'off', 'use_snp_selection': False}. Best is trial 23 with value: 0.11977490981415422.
[I 2025-12-05 15:52:11,041] Trial 117 finished with value: 0.09643698020071935 and parameters: {'model_type': 'mlp', 'hidden_dims': '[256, 128, 64]', 'dropout': 0.30327948267932126, 'batch_norm': True, 'lr': 0.00025884531077175946, 'weight_decay': 4.144561070654278e-06, 'epochs': 208, 'loss': 'mse', 'optimizer': 'adam', 'graph_mode': 'off', 'use_snp_selection': False}. Best is trial 23 with value: 0.11977490981415422.
[I 2025-12-05 15:52:12,442] Trial 118 finished with value: 0.11533652813134682 and parameters: {'model_type': 'mlp', 'hidden_dims': '[512, 64]', 'dropout': 0.32927830747531156, 'batch_norm': True, 'lr': 0.00023110235745743232, 'weight_decay': 5.173196242980921e-06, 'epochs': 229, 'loss': 'mse', 'optimizer': 'adam', 'graph_mode': 'off', 'use_snp_selection': False}. Best is trial 23 with value: 0.11977490981415422.
[I 2025-12-05 15:52:13,823] Trial 119 finished with value: 0.08346986903008587 and parameters: {'model_type': 'mlp', 'hidden_dims': '[512, 64]', 'dropout': 0.3290691253506569, 'batch_norm': False, 'lr': 0.0002372314603224902, 'weight_decay': 6.015037601158417e-06, 'epochs': 228, 'loss': 'mae', 'optimizer': 'adam', 'graph_mode': 'off', 'use_snp_selection': False}. Best is trial 23 with value: 0.11977490981415422.
[I 2025-12-05 15:52:15,291] Trial 120 finished with value: 0.11058859100301816 and parameters: {'model_type': 'mlp', 'hidden_dims': '[512, 64]', 'dropout': 0.3574813726986602, 'batch_norm': True, 'lr': 0.0003510511669254032, 'weight_decay': 1.0121530645820855e-05, 'epochs': 248, 'loss': 'mse', 'optimizer': 'adam', 'graph_mode': 'off', 'use_snp_selection': False}. Best is trial 23 with value: 0.11977490981415422.
[I 2025-12-05 15:52:16,736] Trial 121 finished with value: 0.09909845499174436 and parameters: {'model_type': 'mlp', 'hidden_dims': '[512, 64]', 'dropout': 0.36092901332632776, 'batch_norm': True, 'lr': 0.0003472336612172608, 'weight_decay': 8.146144279522775e-06, 'epochs': 245, 'loss': 'mse', 'optimizer': 'adam', 'graph_mode': 'off', 'use_snp_selection': False}. Best is trial 23 with value: 0.11977490981415422.
[I 2025-12-05 15:52:18,158] Trial 122 finished with value: 0.10511388135717341 and parameters: {'model_type': 'mlp', 'hidden_dims': '[512, 64]', 'dropout': 0.38040916457544877, 'batch_norm': True, 'lr': 0.0003879043966297383, 'weight_decay': 9.786814783295965e-06, 'epochs': 236, 'loss': 'mse', 'optimizer': 'adam', 'graph_mode': 'off', 'use_snp_selection': False}. Best is trial 23 with value: 0.11977490981415422.
[I 2025-12-05 15:52:19,523] Trial 123 finished with value: 0.10785081639085138 and parameters: {'model_type': 'mlp', 'hidden_dims': '[512, 64]', 'dropout': 0.40600868687520447, 'batch_norm': True, 'lr': 0.0004608252154541199, 'weight_decay': 1.3571143820553536e-05, 'epochs': 218, 'loss': 'mse', 'optimizer': 'adam', 'graph_mode': 'off', 'use_snp_selection': False}. Best is trial 23 with value: 0.11977490981415422.
[I 2025-12-05 15:52:21,066] Trial 124 finished with value: 0.0912775667455486 and parameters: {'model_type': 'mlp', 'hidden_dims': '[512, 64]', 'dropout': 0.2911904088434932, 'batch_norm': True, 'lr': 0.00020517136079848043, 'weight_decay': 6.660923202537511e-06, 'epochs': 264, 'loss': 'mse', 'optimizer': 'adam', 'graph_mode': 'off', 'use_snp_selection': False}. Best is trial 23 with value: 0.11977490981415422.
[I 2025-12-05 15:52:22,558] Trial 125 finished with value: 0.10569245474239353 and parameters: {'model_type': 'mlp', 'hidden_dims': '[512, 64]', 'dropout': 0.3432521888607385, 'batch_norm': True, 'lr': 0.0005657917648056533, 'weight_decay': 5.164428266913326e-05, 'epochs': 257, 'loss': 'mse', 'optimizer': 'adam', 'graph_mode': 'off', 'use_snp_selection': False}. Best is trial 23 with value: 0.11977490981415422.
[I 2025-12-05 15:52:23,954] Trial 126 finished with value: 0.09334562311868652 and parameters: {'model_type': 'mlp', 'hidden_dims': '[512, 64]', 'dropout': 0.33047669391411455, 'batch_norm': True, 'lr': 0.00033081680424562355, 'weight_decay': 5.0093257573300225e-06, 'epochs': 227, 'loss': 'mse', 'optimizer': 'adam', 'graph_mode': 'off', 'use_snp_selection': False}. Best is trial 23 with value: 0.11977490981415422.
[I 2025-12-05 15:52:25,430] Trial 127 finished with value: 0.10290194339902128 and parameters: {'model_type': 'mlp', 'hidden_dims': '[512, 64]', 'dropout': 0.3119236847021997, 'batch_norm': True, 'lr': 0.000175127044748348, 'weight_decay': 0.00013584967736062953, 'epochs': 251, 'loss': 'mse', 'optimizer': 'adam', 'graph_mode': 'off', 'use_snp_selection': False}. Best is trial 23 with value: 0.11977490981415422.
[I 2025-12-05 15:52:27,509] Trial 128 finished with value: 0.10306807058752306 and parameters: {'model_type': 'mlp', 'hidden_dims': '[512, 128]', 'dropout': 0.37123451573985977, 'batch_norm': True, 'lr': 0.0006521047444734598, 'weight_decay': 3.1655422898712494e-07, 'epochs': 241, 'loss': 'mse', 'optimizer': 'adam', 'graph_mode': 'off', 'use_snp_selection': True, 'num_snps': 39076}. Best is trial 23 with value: 0.11977490981415422.
[I 2025-12-05 15:52:28,389] Trial 129 finished with value: 0.058923184051802587 and parameters: {'model_type': 'mlp', 'hidden_dims': '[128, 64]', 'dropout': 0.5455311078243965, 'batch_norm': True, 'lr': 3.2289382844579264e-06, 'weight_decay': 4.495104324088805e-06, 'epochs': 269, 'loss': 'mse', 'optimizer': 'adam', 'graph_mode': 'off', 'use_snp_selection': False}. Best is trial 23 with value: 0.11977490981415422.
[I 2025-12-05 15:52:29,739] Trial 130 finished with value: 0.09677760973074581 and parameters: {'model_type': 'mlp', 'hidden_dims': '[512, 64]', 'dropout': 0.35169666910308, 'batch_norm': True, 'lr': 0.0004966495624550996, 'weight_decay': 0.00010012877511661136, 'epochs': 213, 'loss': 'mse', 'optimizer': 'adam', 'graph_mode': 'off', 'use_snp_selection': False}. Best is trial 23 with value: 0.11977490981415422.
[I 2025-12-05 15:52:30,717] Trial 131 finished with value: 0.09814531703670921 and parameters: {'model_type': 'mlp', 'hidden_dims': '[256, 128, 64]', 'dropout': 0.320294288690604, 'batch_norm': True, 'lr': 0.00029297164145347714, 'weight_decay': 2.2149586338060647e-06, 'epochs': 222, 'loss': 'mse', 'optimizer': 'adam', 'graph_mode': 'off', 'use_snp_selection': False}. Best is trial 23 with value: 0.11977490981415422.
[I 2025-12-05 15:52:31,707] Trial 132 finished with value: 0.10098986417471964 and parameters: {'model_type': 'mlp', 'hidden_dims': '[256, 128, 64]', 'dropout': 0.2525406526122011, 'batch_norm': True, 'lr': 0.00040294193042489796, 'weight_decay': 3.213575723551924e-06, 'epochs': 232, 'loss': 'mse', 'optimizer': 'adam', 'graph_mode': 'off', 'use_snp_selection': False}. Best is trial 23 with value: 0.11977490981415422.
[I 2025-12-05 15:52:32,569] Trial 133 finished with value: 0.1252175471440221 and parameters: {'model_type': 'mlp', 'hidden_dims': '[128, 64]', 'dropout': 0.3005830754451409, 'batch_norm': True, 'lr': 0.00023474744609896023, 'weight_decay': 6.644158564234236e-05, 'epochs': 245, 'loss': 'mse', 'optimizer': 'adam', 'graph_mode': 'off', 'use_snp_selection': False}. Best is trial 133 with value: 0.1252175471440221.
[I 2025-12-05 15:52:33,416] Trial 134 finished with value: 0.09108645797444345 and parameters: {'model_type': 'mlp', 'hidden_dims': '[128, 64]', 'dropout': 0.28651186458889943, 'batch_norm': True, 'lr': 0.00022447713550674295, 'weight_decay': 6.286782117175514e-05, 'epochs': 247, 'loss': 'mse', 'optimizer': 'adam', 'graph_mode': 'off', 'use_snp_selection': False}. Best is trial 133 with value: 0.1252175471440221.
[I 2025-12-05 15:52:34,255] Trial 135 finished with value: 0.0933183345210931 and parameters: {'model_type': 'mlp', 'hidden_dims': '[128, 64]', 'dropout': 0.2693034760341351, 'batch_norm': True, 'lr': 0.00024623861337994934, 'weight_decay': 4.0402469292963665e-05, 'epochs': 241, 'loss': 'mse', 'optimizer': 'adam', 'graph_mode': 'off', 'use_snp_selection': False}. Best is trial 133 with value: 0.1252175471440221.
[I 2025-12-05 15:52:35,084] Trial 136 finished with value: 0.0834017003234891 and parameters: {'model_type': 'mlp', 'hidden_dims': '[128, 64]', 'dropout': 0.33802122091435355, 'batch_norm': True, 'lr': 0.00010821387297401538, 'weight_decay': 7.857011199765514e-05, 'epochs': 234, 'loss': 'mse', 'optimizer': 'adam', 'graph_mode': 'off', 'use_snp_selection': False}. Best is trial 133 with value: 0.1252175471440221.
[I 2025-12-05 15:52:36,567] Trial 137 finished with value: 0.1013537704062176 and parameters: {'model_type': 'mlp', 'hidden_dims': '[512, 256]', 'dropout': 0.3018158912659027, 'batch_norm': True, 'lr': 0.000754616174249739, 'weight_decay': 0.00018347299262283206, 'epochs': 254, 'loss': 'mse', 'optimizer': 'adam', 'graph_mode': 'off', 'use_snp_selection': False}. Best is trial 133 with value: 0.1252175471440221.
[I 2025-12-05 15:52:37,370] Trial 138 finished with value: 0.08108920111417056 and parameters: {'model_type': 'mlp', 'hidden_dims': '[128, 64]', 'dropout': 0.3151625825242292, 'batch_norm': True, 'lr': 0.00013878026930887882, 'weight_decay': 7.730439581191992e-07, 'epochs': 217, 'loss': 'mse', 'optimizer': 'adam', 'graph_mode': 'off', 'use_snp_selection': False}. Best is trial 133 with value: 0.1252175471440221.
[I 2025-12-05 15:52:38,130] Trial 139 finished with value: 0.07363971973085458 and parameters: {'model_type': 'mlp', 'hidden_dims': '[128, 64]', 'dropout': 0.36439667061278475, 'batch_norm': False, 'lr': 0.0003754368257852168, 'weight_decay': 7.079574572517561e-05, 'epochs': 209, 'loss': 'mse', 'optimizer': 'adam', 'graph_mode': 'off', 'use_snp_selection': False}. Best is trial 133 with value: 0.1252175471440221.
[I 2025-12-05 15:52:39,593] Trial 140 finished with value: 0.08911255012201857 and parameters: {'model_type': 'mlp', 'hidden_dims': '[512, 128]', 'dropout': 0.32794947975911215, 'batch_norm': True, 'lr': 0.0003298230376002166, 'weight_decay': 0.0003990026959044451, 'epochs': 245, 'loss': 'mae', 'optimizer': 'adam', 'graph_mode': 'off', 'use_snp_selection': False}. Best is trial 133 with value: 0.1252175471440221.
