[I 2025-12-05 14:54:42,786] Trial 124 finished with value: 0.01230262026166347 and parameters: {'model_type': 'mlp', 'hidden_dims': '[512, 256]', 'dropout': 0.13661465517713192, 'batch_norm': True, 'lr': 2.8147712957915907e-06, 'weight_decay': 7.263512112591745e-06, 'epochs': 108, 'loss': 'mse', 'optimizer': 'adam', 'graph_mode': 'off', 'use_snp_selection': True, 'num_snps': 37353}. Best is trial 61 with value: 0.06672729345569342.
[I 2025-12-05 14:54:44,836] Trial 125 finished with value: 0.03891882589171897 and parameters: {'model_type': 'mlp', 'hidden_dims': '[512, 256]', 'dropout': 0.11975261133968228, 'batch_norm': True, 'lr': 0.0005787963264938642, 'weight_decay': 8.684676475380238e-06, 'epochs': 178, 'loss': 'mse', 'optimizer': 'adam', 'graph_mode': 'off', 'use_snp_selection': True, 'num_snps': 30669}. Best is trial 61 with value: 0.06672729345569342.
[I 2025-12-05 14:54:46,602] Trial 126 finished with value: 0.043052619022604405 and parameters: {'model_type': 'mlp', 'hidden_dims': '[512, 256]', 'dropout': 0.10797730837659177, 'batch_norm': True, 'lr': 0.0007843500969424276, 'weight_decay': 1.8194863366622642e-06, 'epochs': 185, 'loss': 'mse', 'optimizer': 'adam', 'graph_mode': 'off', 'use_snp_selection': True, 'num_snps': 26719}. Best is trial 61 with value: 0.06672729345569342.
[I 2025-12-05 14:54:48,168] Trial 127 finished with value: 0.043037197113052 and parameters: {'model_type': 'mlp', 'hidden_dims': '[512, 64]', 'dropout': 0.17103649641088625, 'batch_norm': True, 'lr': 0.00046519374034453907, 'weight_decay': 3.710777105896077e-06, 'epochs': 169, 'loss': 'mse', 'optimizer': 'adam', 'graph_mode': 'off', 'use_snp_selection': True, 'num_snps': 22823}. Best is trial 61 with value: 0.06672729345569342.
[I 2025-12-05 14:54:50,501] Trial 128 finished with value: 0.05082770367894791 and parameters: {'model_type': 'mlp', 'hidden_dims': '[512, 256]', 'dropout': 0.14789745936517654, 'batch_norm': True, 'lr': 0.00030954569119095093, 'weight_decay': 2.5531932429522597e-06, 'epochs': 198, 'loss': 'mse', 'optimizer': 'adam', 'graph_mode': 'off', 'use_snp_selection': True, 'num_snps': 38839}. Best is trial 61 with value: 0.06672729345569342.
[I 2025-12-05 14:54:53,029] Trial 129 finished with value: 0.02413016838712897 and parameters: {'model_type': 'mlp', 'hidden_dims': '[256, 128]', 'dropout': 0.18060969234484167, 'batch_norm': True, 'lr': 0.00029486109907495077, 'weight_decay': 1.1499123095312532e-06, 'epochs': 147, 'loss': 'mse', 'optimizer': 'adam', 'graph_mode': 'off', 'use_snp_selection': True, 'num_snps': 49852}. Best is trial 61 with value: 0.06672729345569342.
[I 2025-12-05 14:54:55,346] Trial 130 finished with value: 0.04117900281129505 and parameters: {'model_type': 'mlp', 'hidden_dims': '[512, 256]', 'dropout': 0.15071345076970616, 'batch_norm': True, 'lr': 0.00025147845776572015, 'weight_decay': 2.455947331679162e-06, 'epochs': 140, 'loss': 'mse', 'optimizer': 'adam', 'graph_mode': 'off', 'use_snp_selection': True, 'num_snps': 38845}. Best is trial 61 with value: 0.06672729345569342.
[I 2025-12-05 14:54:57,719] Trial 131 finished with value: 0.04932646619533746 and parameters: {'model_type': 'mlp', 'hidden_dims': '[512, 256]', 'dropout': 0.1383299059950173, 'batch_norm': True, 'lr': 0.0006619910855423927, 'weight_decay': 1.441117863076396e-06, 'epochs': 162, 'loss': 'mse', 'optimizer': 'adam', 'graph_mode': 'off', 'use_snp_selection': True, 'num_snps': 40653}. Best is trial 61 with value: 0.06672729345569342.
[I 2025-12-05 14:55:00,136] Trial 132 finished with value: 0.04175180750241313 and parameters: {'model_type': 'mlp', 'hidden_dims': '[512, 256]', 'dropout': 0.16077297523436268, 'batch_norm': True, 'lr': 0.0004086697847697287, 'weight_decay': 1.417853077888975e-06, 'epochs': 160, 'loss': 'mse', 'optimizer': 'adam', 'graph_mode': 'off', 'use_snp_selection': True, 'num_snps': 40988}. Best is trial 61 with value: 0.06672729345569342.
[I 2025-12-05 14:55:02,466] Trial 133 finished with value: 0.03810556422085045 and parameters: {'model_type': 'mlp', 'hidden_dims': '[512, 256]', 'dropout': 0.13769866614426018, 'batch_norm': True, 'lr': 0.00032826480838414954, 'weight_decay': 1.918565268509754e-06, 'epochs': 151, 'loss': 'mse', 'optimizer': 'adam', 'graph_mode': 'off', 'use_snp_selection': True, 'num_snps': 40346}. Best is trial 61 with value: 0.06672729345569342.
[I 2025-12-05 14:55:05,266] Trial 134 finished with value: 0.034917669184023 and parameters: {'model_type': 'mlp', 'hidden_dims': '[512, 256]', 'dropout': 0.12615120993742468, 'batch_norm': True, 'lr': 0.0006608091479968036, 'weight_decay': 2.2860667003516545e-06, 'epochs': 199, 'loss': 'mse', 'optimizer': 'adam', 'graph_mode': 'off', 'use_snp_selection': True, 'num_snps': 43138}. Best is trial 61 with value: 0.06672729345569342.
[I 2025-12-05 14:55:07,548] Trial 135 finished with value: 0.047093206023867226 and parameters: {'model_type': 'mlp', 'hidden_dims': '[512, 256]', 'dropout': 0.14711030350190527, 'batch_norm': True, 'lr': 0.0005574637458849813, 'weight_decay': 3.144682781934678e-06, 'epochs': 128, 'loss': 'mse', 'optimizer': 'adam', 'graph_mode': 'off', 'use_snp_selection': True, 'num_snps': 38438}. Best is trial 61 with value: 0.06672729345569342.
[I 2025-12-05 14:55:10,357] Trial 136 finished with value: 0.0378140212039496 and parameters: {'model_type': 'mlp', 'hidden_dims': '[512, 256]', 'dropout': 0.15034959273102924, 'batch_norm': True, 'lr': 0.0004585567316437605, 'weight_decay': 1.4706084777969529e-06, 'epochs': 236, 'loss': 'mse', 'optimizer': 'adam', 'graph_mode': 'off', 'use_snp_selection': True, 'num_snps': 44493}. Best is trial 61 with value: 0.06672729345569342.
[I 2025-12-05 14:55:12,213] Trial 137 finished with value: 0.031166955197307056 and parameters: {'model_type': 'mlp', 'hidden_dims': '[128, 64]', 'dropout': 0.11811212166547105, 'batch_norm': True, 'lr': 0.0005323326914345762, 'weight_decay': 4.735493110037474e-06, 'epochs': 126, 'loss': 'mae', 'optimizer': 'adam', 'graph_mode': 'off', 'use_snp_selection': True, 'num_snps': 38435}. Best is trial 61 with value: 0.06672729345569342.
[I 2025-12-05 14:55:14,483] Trial 138 finished with value: 0.0456528172984684 and parameters: {'model_type': 'mlp', 'hidden_dims': '[512, 256]', 'dropout': 0.3919125756285937, 'batch_norm': True, 'lr': 0.0005275507485414598, 'weight_decay': 9.161662941855664e-07, 'epochs': 119, 'loss': 'mse', 'optimizer': 'adam', 'graph_mode': 'off', 'use_snp_selection': True, 'num_snps': 42305}. Best is trial 61 with value: 0.06672729345569342.
[I 2025-12-05 14:55:17,174] Trial 139 finished with value: 0.037925627506738176 and parameters: {'model_type': 'mlp', 'hidden_dims': '[512, 256]', 'dropout': 0.13022556091933296, 'batch_norm': True, 'lr': 0.00034872893966556045, 'weight_decay': 2.6477180073020052e-06, 'epochs': 139, 'loss': 'mse', 'optimizer': 'adam', 'graph_mode': 'off', 'use_snp_selection': True, 'num_snps': 45655}. Best is trial 61 with value: 0.06672729345569342.
[I 2025-12-05 14:55:19,638] Trial 140 finished with value: 0.038394460969939065 and parameters: {'model_type': 'mlp', 'hidden_dims': '[256, 128, 64]', 'dropout': 0.14198402666705393, 'batch_norm': True, 'lr': 0.0007585047002859501, 'weight_decay': 7.27569363430093e-07, 'epochs': 177, 'loss': 'mse', 'optimizer': 'adam', 'graph_mode': 'off', 'use_snp_selection': True, 'num_snps': 46943}. Best is trial 61 with value: 0.06672729345569342.
[I 2025-12-05 14:55:21,795] Trial 141 finished with value: 0.03177716057391046 and parameters: {'model_type': 'mlp', 'hidden_dims': '[512, 256]', 'dropout': 0.16028561918761125, 'batch_norm': True, 'lr': 0.0006428193659112024, 'weight_decay': 2.96110851047483e-06, 'epochs': 164, 'loss': 'mse', 'optimizer': 'adam', 'graph_mode': 'off', 'use_snp_selection': True, 'num_snps': 35245}. Best is trial 61 with value: 0.06672729345569342.
[I 2025-12-05 14:55:22,695] Trial 142 finished with value: 0.04476739240975016 and parameters: {'model_type': 'mlp', 'hidden_dims': '[512, 256]', 'dropout': 0.17501062509886586, 'batch_norm': True, 'lr': 0.00040795975172907314, 'weight_decay': 3.2167762291827845e-06, 'epochs': 114, 'loss': 'mse', 'optimizer': 'adam', 'graph_mode': 'off', 'use_snp_selection': True, 'num_snps': 5014}. Best is trial 61 with value: 0.06672729345569342.
[I 2025-12-05 14:55:25,055] Trial 143 finished with value: 0.04709249072118071 and parameters: {'model_type': 'mlp', 'hidden_dims': '[512, 256]', 'dropout': 0.13185899147020036, 'batch_norm': True, 'lr': 0.0006026649508232822, 'weight_decay': 4.319336481970164e-06, 'epochs': 170, 'loss': 'mse', 'optimizer': 'adam', 'graph_mode': 'off', 'use_snp_selection': True, 'num_snps': 39778}. Best is trial 61 with value: 0.06672729345569342.
[I 2025-12-05 14:55:27,404] Trial 144 finished with value: 0.03882845431117939 and parameters: {'model_type': 'mlp', 'hidden_dims': '[512, 256]', 'dropout': 0.5965006933558834, 'batch_norm': True, 'lr': 0.000591260906600451, 'weight_decay': 5.64391656450508e-06, 'epochs': 169, 'loss': 'mse', 'optimizer': 'adam', 'graph_mode': 'off', 'use_snp_selection': True, 'num_snps': 39698}. Best is trial 61 with value: 0.06672729345569342.
[I 2025-12-05 14:55:29,275] Trial 145 finished with value: 0.05391254101314507 and parameters: {'model_type': 'mlp', 'hidden_dims': '[512, 256]', 'dropout': 0.11336940071405774, 'batch_norm': True, 'lr': 0.0004558672760513314, 'weight_decay': 4.490589708378583e-06, 'epochs': 132, 'loss': 'mse', 'optimizer': 'adam', 'graph_mode': 'off', 'use_snp_selection': True, 'num_snps': 28560}. Best is trial 61 with value: 0.06672729345569342.
[I 2025-12-05 14:55:31,115] Trial 146 finished with value: 0.04590128865372603 and parameters: {'model_type': 'mlp', 'hidden_dims': '[512, 256]', 'dropout': 0.550706956474721, 'batch_norm': True, 'lr': 0.0004578270941678556, 'weight_decay': 4.004336935246728e-06, 'epochs': 134, 'loss': 'mse', 'optimizer': 'adam', 'graph_mode': 'off', 'use_snp_selection': True, 'num_snps': 29274}. Best is trial 61 with value: 0.06672729345569342.
[I 2025-12-05 14:55:32,437] Trial 147 finished with value: 0.033172590935044106 and parameters: {'model_type': 'mlp', 'hidden_dims': '[512, 256]', 'dropout': 0.13228545955747775, 'batch_norm': False, 'lr': 0.0003654155167616494, 'weight_decay': 4.9197682910441196e-06, 'epochs': 127, 'loss': 'mse', 'optimizer': 'adam', 'graph_mode': 'off', 'use_snp_selection': False}. Best is trial 61 with value: 0.06672729345569342.
[I 2025-12-05 14:55:33,923] Trial 148 finished with value: 0.044433006285556104 and parameters: {'model_type': 'mlp', 'hidden_dims': '[256, 128]', 'dropout': 0.11334725448681762, 'batch_norm': True, 'lr': 0.0005024051727930767, 'weight_decay': 6.190791317401167e-06, 'epochs': 147, 'loss': 'mse', 'optimizer': 'adam', 'graph_mode': 'off', 'use_snp_selection': True, 'num_snps': 24097}. Best is trial 61 with value: 0.06672729345569342.
[I 2025-12-05 14:55:36,084] Trial 149 finished with value: 0.03244162258536511 and parameters: {'model_type': 'mlp', 'hidden_dims': '[512, 256]', 'dropout': 0.1413420503272389, 'batch_norm': True, 'lr': 0.00021214189154143044, 'weight_decay': 4.599204192111001e-06, 'epochs': 257, 'loss': 'mae', 'optimizer': 'adam', 'graph_mode': 'off', 'use_snp_selection': True, 'num_snps': 31572}. Best is trial 61 with value: 0.06672729345569342.
[I 2025-12-05 14:55:38,294] Trial 0 finished with value: 0.04072247562211174 and parameters: {'model_type': 'mlp', 'hidden_dims': '[128, 64]', 'dropout': 0.199031432379812, 'batch_norm': True, 'lr': 1.8408544111075837e-06, 'weight_decay': 5.5136510071208614e-05, 'epochs': 336, 'loss': 'mae', 'optimizer': 'adam', 'graph_mode': 'off', 'use_snp_selection': True, 'num_snps': 43862}. Best is trial 0 with value: 0.04072247562211174.
[I 2025-12-05 14:55:39,399] Trial 1 finished with value: 0.1008938299432873 and parameters: {'model_type': 'mlp', 'hidden_dims': '[256, 128]', 'dropout': 0.4370668075331726, 'batch_norm': True, 'lr': 7.133471581159139e-05, 'weight_decay': 1.128633586803549e-05, 'epochs': 242, 'loss': 'mae', 'optimizer': 'adam', 'graph_mode': 'off', 'use_snp_selection': False}. Best is trial 1 with value: 0.1008938299432873.
[I 2025-12-05 14:55:40,479] Trial 2 finished with value: 0.05166157758284009 and parameters: {'model_type': 'mlp', 'hidden_dims': '[256, 128, 64]', 'dropout': 0.41314357415569625, 'batch_norm': False, 'lr': 3.952233718592101e-06, 'weight_decay': 0.00026754769258252603, 'epochs': 149, 'loss': 'mse', 'optimizer': 'adam', 'graph_mode': 'off', 'use_snp_selection': True, 'num_snps': 11571}. Best is trial 1 with value: 0.1008938299432873.
[I 2025-12-05 14:55:42,412] Trial 3 finished with value: 0.07152354353478141 and parameters: {'model_type': 'mlp', 'hidden_dims': '[512, 64]', 'dropout': 0.5938127374509361, 'batch_norm': False, 'lr': 5.67704586114731e-06, 'weight_decay': 2.4518087630137052e-05, 'epochs': 320, 'loss': 'mae', 'optimizer': 'adam', 'graph_mode': 'off', 'use_snp_selection': False}. Best is trial 1 with value: 0.1008938299432873.
[I 2025-12-05 14:55:44,616] Trial 4 finished with value: 0.016505558682774965 and parameters: {'model_type': 'mlp', 'hidden_dims': '[512, 128]', 'dropout': 0.25746343592134413, 'batch_norm': True, 'lr': 1.3467657668402788e-06, 'weight_decay': 0.00033087251918647806, 'epochs': 277, 'loss': 'mse', 'optimizer': 'adam', 'graph_mode': 'off', 'use_snp_selection': True, 'num_snps': 36675}. Best is trial 1 with value: 0.1008938299432873.
[I 2025-12-05 14:55:46,348] Trial 5 finished with value: 0.06356629637210968 and parameters: {'model_type': 'mlp', 'hidden_dims': '[512, 64]', 'dropout': 0.38275350994408375, 'batch_norm': True, 'lr': 1.5586664309232824e-06, 'weight_decay': 0.0008227664668621182, 'epochs': 145, 'loss': 'mae', 'optimizer': 'adam', 'graph_mode': 'off', 'use_snp_selection': True, 'num_snps': 32148}. Best is trial 1 with value: 0.1008938299432873.
[I 2025-12-05 14:55:47,300] Trial 6 finished with value: 0.11609046145835972 and parameters: {'model_type': 'mlp', 'hidden_dims': '[256, 128]', 'dropout': 0.3930109900265879, 'batch_norm': False, 'lr': 4.892964372128395e-05, 'weight_decay': 1.5809549317992182e-06, 'epochs': 199, 'loss': 'mse', 'optimizer': 'adam', 'graph_mode': 'off', 'use_snp_selection': False}. Best is trial 6 with value: 0.11609046145835972.
[I 2025-12-05 14:55:48,338] Trial 7 finished with value: 0.1158608282081993 and parameters: {'model_type': 'mlp', 'hidden_dims': '[512, 256]', 'dropout': 0.15343979219678458, 'batch_norm': True, 'lr': 6.234003099047341e-05, 'weight_decay': 3.894760610535477e-07, 'epochs': 97, 'loss': 'mse', 'optimizer': 'adam', 'graph_mode': 'off', 'use_snp_selection': False}. Best is trial 6 with value: 0.11609046145835972.
[I 2025-12-05 14:55:50,241] Trial 8 finished with value: 0.11717227403320875 and parameters: {'model_type': 'mlp', 'hidden_dims': '[512, 128]', 'dropout': 0.10743001231661406, 'batch_norm': True, 'lr': 0.00023728538449271062, 'weight_decay': 1.7629071578048637e-05, 'epochs': 312, 'loss': 'mae', 'optimizer': 'adam', 'graph_mode': 'off', 'use_snp_selection': False}. Best is trial 8 with value: 0.11717227403320875.
[I 2025-12-05 14:55:51,611] Trial 9 finished with value: 0.11761231443421842 and parameters: {'model_type': 'mlp', 'hidden_dims': '[512, 64]', 'dropout': 0.14505336736221927, 'batch_norm': True, 'lr': 5.8619638388111826e-05, 'weight_decay': 6.200156172669308e-07, 'epochs': 175, 'loss': 'mse', 'optimizer': 'adam', 'graph_mode': 'off', 'use_snp_selection': False}. Best is trial 9 with value: 0.11761231443421842.
[I 2025-12-05 14:55:52,494] Trial 10 finished with value: 0.002487676396842212 and parameters: {'model_type': 'mlp', 'hidden_dims': '[512, 64]', 'dropout': 0.27531666245262887, 'batch_norm': False, 'lr': 0.00032393778075602147, 'weight_decay': 1.1714031539166647e-07, 'epochs': 44, 'loss': 'mse', 'optimizer': 'adam', 'graph_mode': 'off', 'use_snp_selection': False}. Best is trial 9 with value: 0.11761231443421842.
[I 2025-12-05 14:55:54,007] Trial 11 finished with value: 0.12517443724346763 and parameters: {'model_type': 'mlp', 'hidden_dims': '[512, 128]', 'dropout': 0.10095648685224448, 'batch_norm': True, 'lr': 0.0007381466848241802, 'weight_decay': 1.969664044175748e-06, 'epochs': 216, 'loss': 'mae', 'optimizer': 'adam', 'graph_mode': 'off', 'use_snp_selection': False}. Best is trial 11 with value: 0.12517443724346763.
[I 2025-12-05 14:55:55,482] Trial 12 finished with value: 0.10951937512549803 and parameters: {'model_type': 'mlp', 'hidden_dims': '[512, 128]', 'dropout': 0.10344600881777158, 'batch_norm': True, 'lr': 0.0006753264773209732, 'weight_decay': 2.0975627484345868e-06, 'epochs': 208, 'loss': 'mae', 'optimizer': 'adam', 'graph_mode': 'off', 'use_snp_selection': False}. Best is trial 11 with value: 0.12517443724346763.
[I 2025-12-05 14:55:56,204] Trial 13 finished with value: 0.08230505814180857 and parameters: {'model_type': 'mlp', 'hidden_dims': '[128, 64]', 'dropout': 0.22096278001553593, 'batch_norm': True, 'lr': 1.3373175420781734e-05, 'weight_decay': 2.1978369390547452e-06, 'epochs': 147, 'loss': 'mse', 'optimizer': 'adam', 'graph_mode': 'off', 'use_snp_selection': False}. Best is trial 11 with value: 0.12517443724346763.
[I 2025-12-05 14:55:57,309] Trial 14 finished with value: 0.11529515737569988 and parameters: {'model_type': 'mlp', 'hidden_dims': '[256, 128, 64]', 'dropout': 0.31612449728949465, 'batch_norm': True, 'lr': 0.0008980959006851178, 'weight_decay': 5.631894527472498e-07, 'epochs': 254, 'loss': 'mse', 'optimizer': 'adam', 'graph_mode': 'off', 'use_snp_selection': False}. Best is trial 11 with value: 0.12517443724346763.
[I 2025-12-05 14:55:58,660] Trial 15 finished with value: 0.1192066544950273 and parameters: {'model_type': 'mlp', 'hidden_dims': '[512, 256]', 'dropout': 0.1723492905468449, 'batch_norm': True, 'lr': 0.0001572871022003765, 'weight_decay': 1.3159354875897403e-07, 'epochs': 175, 'loss': 'mae', 'optimizer': 'adam', 'graph_mode': 'off', 'use_snp_selection': False}. Best is trial 11 with value: 0.12517443724346763.
[I 2025-12-05 14:55:59,715] Trial 16 finished with value: 0.10624618512131256 and parameters: {'model_type': 'mlp', 'hidden_dims': '[512, 256]', 'dropout': 0.18730952098171647, 'batch_norm': True, 'lr': 0.00017549215405955411, 'weight_decay': 1.1145136050510854e-07, 'epochs': 98, 'loss': 'mae', 'optimizer': 'adam', 'graph_mode': 'off', 'use_snp_selection': False}. Best is trial 11 with value: 0.12517443724346763.
[I 2025-12-05 14:56:01,300] Trial 17 finished with value: 0.10687528754653629 and parameters: {'model_type': 'mlp', 'hidden_dims': '[512, 256]', 'dropout': 0.5033738936959701, 'batch_norm': True, 'lr': 0.00014908853371523303, 'weight_decay': 2.94815681827102e-06, 'epochs': 225, 'loss': 'mae', 'optimizer': 'adam', 'graph_mode': 'off', 'use_snp_selection': False}. Best is trial 11 with value: 0.12517443724346763.
[I 2025-12-05 14:56:04,651] Trial 18 finished with value: 0.10933791484645 and parameters: {'model_type': 'mlp', 'hidden_dims': '[512, 128]', 'dropout': 0.316278883892647, 'batch_norm': False, 'lr': 0.0004350793199725942, 'weight_decay': 2.855598826329304e-07, 'epochs': 281, 'loss': 'mae', 'optimizer': 'adam', 'graph_mode': 'off', 'use_snp_selection': True, 'num_snps': 58241}. Best is trial 11 with value: 0.12517443724346763.
[I 2025-12-05 14:56:06,083] Trial 19 finished with value: 0.09678333885039268 and parameters: {'model_type': 'mlp', 'hidden_dims': '[512, 256]', 'dropout': 0.23740597688310255, 'batch_norm': True, 'lr': 1.8406343648145557e-05, 'weight_decay': 5.1428505731499965e-06, 'epochs': 185, 'loss': 'mae', 'optimizer': 'adam', 'graph_mode': 'off', 'use_snp_selection': False}. Best is trial 11 with value: 0.12517443724346763.
[I 2025-12-05 14:56:07,161] Trial 20 finished with value: 0.11690962329261441 and parameters: {'model_type': 'mlp', 'hidden_dims': '[512, 128]', 'dropout': 0.16266692789073742, 'batch_norm': True, 'lr': 0.0005466690500031585, 'weight_decay': 8.255719709919185e-07, 'epochs': 106, 'loss': 'mae', 'optimizer': 'adam', 'graph_mode': 'off', 'use_snp_selection': False}. Best is trial 11 with value: 0.12517443724346763.
[I 2025-12-05 14:56:08,492] Trial 21 finished with value: 0.12768670899961604 and parameters: {'model_type': 'mlp', 'hidden_dims': '[512, 64]', 'dropout': 0.13922474411477634, 'batch_norm': True, 'lr': 0.00011467620668229786, 'weight_decay': 2.078428901708435e-07, 'epochs': 173, 'loss': 'mse', 'optimizer': 'adam', 'graph_mode': 'off', 'use_snp_selection': False}. Best is trial 21 with value: 0.12768670899961604.
[I 2025-12-05 14:56:09,805] Trial 22 finished with value: 0.11357144919983936 and parameters: {'model_type': 'mlp', 'hidden_dims': '[512, 256]', 'dropout': 0.1059050834167968, 'batch_norm': True, 'lr': 0.00011577917763340625, 'weight_decay': 1.909095374725153e-07, 'epochs': 167, 'loss': 'mae', 'optimizer': 'adam', 'graph_mode': 'off', 'use_snp_selection': False}. Best is trial 21 with value: 0.12768670899961604.
[I 2025-12-05 14:56:10,965] Trial 23 finished with value: 0.08006685771256003 and parameters: {'model_type': 'mlp', 'hidden_dims': '[512, 64]', 'dropout': 0.14998459981815512, 'batch_norm': True, 'lr': 2.7433100193760986e-05, 'weight_decay': 1.0420177130957557e-06, 'epochs': 126, 'loss': 'mse', 'optimizer': 'adam', 'graph_mode': 'off', 'use_snp_selection': False}. Best is trial 21 with value: 0.12768670899961604.
[I 2025-12-05 14:56:11,983] Trial 24 finished with value: 0.11399699312079586 and parameters: {'model_type': 'mlp', 'hidden_dims': '[256, 128, 64]', 'dropout': 0.1890263102936179, 'batch_norm': True, 'lr': 0.00012518728656299994, 'weight_decay': 2.3210132886435995e-07, 'epochs': 216, 'loss': 'mae', 'optimizer': 'adam', 'graph_mode': 'off', 'use_snp_selection': False}. Best is trial 21 with value: 0.12768670899961604.
