[I 2025-12-05 16:21:16,942] Trial 22 finished with value: 0.07738416931951458 and parameters: {'model_type': 'mlp', 'hidden_dims': '[512, 256]', 'dropout': 0.5447308805905808, 'batch_norm': True, 'lr': 0.0003565638572874522, 'weight_decay': 7.951533523367903e-07, 'epochs': 215, 'loss': 'mae', 'optimizer': 'adam', 'graph_mode': 'off', 'use_snp_selection': False}. Best is trial 17 with value: 0.11157945279125966.
[I 2025-12-05 16:21:17,754] Trial 23 finished with value: 0.06394540487566575 and parameters: {'model_type': 'mlp', 'hidden_dims': '[128, 64]', 'dropout': 0.45700288156596985, 'batch_norm': True, 'lr': 0.0009257186399181518, 'weight_decay': 2.6074809110640117e-07, 'epochs': 173, 'loss': 'mae', 'optimizer': 'adam', 'graph_mode': 'off', 'use_snp_selection': False}. Best is trial 17 with value: 0.11157945279125966.
[I 2025-12-05 16:21:19,532] Trial 24 finished with value: 0.08237944965241416 and parameters: {'model_type': 'mlp', 'hidden_dims': '[512, 256]', 'dropout': 0.5607765859384273, 'batch_norm': True, 'lr': 0.00012933696064794652, 'weight_decay': 2.067232992384477e-06, 'epochs': 262, 'loss': 'mae', 'optimizer': 'adam', 'graph_mode': 'off', 'use_snp_selection': False}. Best is trial 17 with value: 0.11157945279125966.
[I 2025-12-05 16:21:20,602] Trial 25 finished with value: 0.07631082104294422 and parameters: {'model_type': 'mlp', 'hidden_dims': '[128, 64]', 'dropout': 0.34971414103281967, 'batch_norm': True, 'lr': 0.0003520216080723657, 'weight_decay': 1.0147250237013458e-07, 'epochs': 309, 'loss': 'mae', 'optimizer': 'adam', 'graph_mode': 'off', 'use_snp_selection': False}. Best is trial 17 with value: 0.11157945279125966.
[I 2025-12-05 16:21:21,520] Trial 26 finished with value: 0.09213001205893194 and parameters: {'model_type': 'mlp', 'hidden_dims': '[256, 128]', 'dropout': 0.5156361218849151, 'batch_norm': True, 'lr': 0.000596808407823208, 'weight_decay': 7.379473126904063e-07, 'epochs': 179, 'loss': 'mae', 'optimizer': 'adam', 'graph_mode': 'off', 'use_snp_selection': True, 'num_snps': 3842}. Best is trial 17 with value: 0.11157945279125966.
[I 2025-12-05 16:21:22,752] Trial 27 finished with value: 0.08125869699464822 and parameters: {'model_type': 'mlp', 'hidden_dims': '[256, 128, 64]', 'dropout': 0.5627475224868568, 'batch_norm': False, 'lr': 0.00016091288360470897, 'weight_decay': 2.00713249575297e-07, 'epochs': 276, 'loss': 'mse', 'optimizer': 'adam', 'graph_mode': 'off', 'use_snp_selection': False}. Best is trial 17 with value: 0.11157945279125966.
[I 2025-12-05 16:21:23,532] Trial 28 finished with value: 0.06651112431927013 and parameters: {'model_type': 'mlp', 'hidden_dims': '[128, 64]', 'dropout': 0.5999453500713052, 'batch_norm': True, 'lr': 0.00026623040264104215, 'weight_decay': 5.256269290037069e-07, 'epochs': 128, 'loss': 'mae', 'optimizer': 'adam', 'graph_mode': 'off', 'use_snp_selection': False}. Best is trial 17 with value: 0.11157945279125966.
[I 2025-12-05 16:21:24,980] Trial 29 finished with value: 0.08244919736253925 and parameters: {'model_type': 'mlp', 'hidden_dims': '[512, 256]', 'dropout': 0.2086607835877312, 'batch_norm': True, 'lr': 0.00010310045425837981, 'weight_decay': 4.187174591688447e-06, 'epochs': 215, 'loss': 'mae', 'optimizer': 'adam', 'graph_mode': 'off', 'use_snp_selection': True, 'num_snps': 19468}. Best is trial 17 with value: 0.11157945279125966.
[I 2025-12-05 16:21:26,312] Trial 30 finished with value: 0.0669521571059622 and parameters: {'model_type': 'mlp', 'hidden_dims': '[256, 128]', 'dropout': 0.3344834858130451, 'batch_norm': True, 'lr': 3.034910675740413e-05, 'weight_decay': 1.1150876247932537e-06, 'epochs': 323, 'loss': 'mae', 'optimizer': 'adam', 'graph_mode': 'off', 'use_snp_selection': False}. Best is trial 17 with value: 0.11157945279125966.
[I 2025-12-05 16:21:27,196] Trial 31 finished with value: 0.09758320954184375 and parameters: {'model_type': 'mlp', 'hidden_dims': '[256, 128]', 'dropout': 0.5303813980469703, 'batch_norm': True, 'lr': 0.0005652015122946017, 'weight_decay': 2.778255015261506e-07, 'epochs': 185, 'loss': 'mae', 'optimizer': 'adam', 'graph_mode': 'off', 'use_snp_selection': True, 'num_snps': 3443}. Best is trial 17 with value: 0.11157945279125966.
[I 2025-12-05 16:21:28,659] Trial 32 finished with value: 0.08701129909350265 and parameters: {'model_type': 'mlp', 'hidden_dims': '[256, 128]', 'dropout': 0.43363688468621087, 'batch_norm': True, 'lr': 0.0006706668530974458, 'weight_decay': 2.9404894692820407e-07, 'epochs': 228, 'loss': 'mae', 'optimizer': 'adam', 'graph_mode': 'off', 'use_snp_selection': True, 'num_snps': 21575}. Best is trial 17 with value: 0.11157945279125966.
[I 2025-12-05 16:21:29,547] Trial 33 finished with value: 0.07490071097559461 and parameters: {'model_type': 'mlp', 'hidden_dims': '[256, 128]', 'dropout': 0.5402670540670185, 'batch_norm': True, 'lr': 0.000990837065650381, 'weight_decay': 1.7042942268797453e-07, 'epochs': 195, 'loss': 'mae', 'optimizer': 'adam', 'graph_mode': 'off', 'use_snp_selection': True, 'num_snps': 4581}. Best is trial 17 with value: 0.11157945279125966.
[I 2025-12-05 16:21:30,879] Trial 34 finished with value: 0.0751446198151058 and parameters: {'model_type': 'mlp', 'hidden_dims': '[256, 128]', 'dropout': 0.48049548191417946, 'batch_norm': True, 'lr': 0.0003329701421429593, 'weight_decay': 4.545126910614496e-07, 'epochs': 153, 'loss': 'mae', 'optimizer': 'adam', 'graph_mode': 'off', 'use_snp_selection': True, 'num_snps': 20168}. Best is trial 17 with value: 0.11157945279125966.
[I 2025-12-05 16:21:33,386] Trial 35 finished with value: 0.03891041735295427 and parameters: {'model_type': 'mlp', 'hidden_dims': '[128, 64]', 'dropout': 0.3876772451901408, 'batch_norm': False, 'lr': 9.648176685529374e-05, 'weight_decay': 6.968638120905918e-05, 'epochs': 252, 'loss': 'mae', 'optimizer': 'adam', 'graph_mode': 'off', 'use_snp_selection': True, 'num_snps': 52889}. Best is trial 17 with value: 0.11157945279125966.
[I 2025-12-05 16:21:34,473] Trial 36 finished with value: 0.012928642307336546 and parameters: {'model_type': 'mlp', 'hidden_dims': '[256, 128]', 'dropout': 0.44055718740741623, 'batch_norm': True, 'lr': 3.6036684858549458e-06, 'weight_decay': 2.231956588249452e-06, 'epochs': 124, 'loss': 'mse', 'optimizer': 'adam', 'graph_mode': 'off', 'use_snp_selection': True, 'num_snps': 12703}. Best is trial 17 with value: 0.11157945279125966.
[I 2025-12-05 16:21:37,035] Trial 37 finished with value: 0.09734920049763646 and parameters: {'model_type': 'mlp', 'hidden_dims': '[512, 64]', 'dropout': 0.5768621022815893, 'batch_norm': True, 'lr': 0.00048597598014055377, 'weight_decay': 1.0318675119415256e-06, 'epochs': 290, 'loss': 'mae', 'optimizer': 'adam', 'graph_mode': 'off', 'use_snp_selection': True, 'num_snps': 42441}. Best is trial 17 with value: 0.11157945279125966.
[I 2025-12-05 16:21:39,941] Trial 38 finished with value: 0.044282532405425436 and parameters: {'model_type': 'mlp', 'hidden_dims': '[512, 64]', 'dropout': 0.574580921530953, 'batch_norm': False, 'lr': 0.0006187134706680808, 'weight_decay': 1.7513166763733498e-07, 'epochs': 343, 'loss': 'mse', 'optimizer': 'adam', 'graph_mode': 'off', 'use_snp_selection': True, 'num_snps': 44510}. Best is trial 17 with value: 0.11157945279125966.
[I 2025-12-05 16:21:42,599] Trial 39 finished with value: 0.073332683763169 and parameters: {'model_type': 'mlp', 'hidden_dims': '[512, 64]', 'dropout': 0.2774161414323595, 'batch_norm': True, 'lr': 0.00026991338170945575, 'weight_decay': 3.400765014086342e-07, 'epochs': 332, 'loss': 'mae', 'optimizer': 'adam', 'graph_mode': 'off', 'use_snp_selection': True, 'num_snps': 40223}. Best is trial 17 with value: 0.11157945279125966.
[I 2025-12-05 16:21:44,599] Trial 40 finished with value: 0.08261104630389621 and parameters: {'model_type': 'mlp', 'hidden_dims': '[512, 64]', 'dropout': 0.36660178406795974, 'batch_norm': True, 'lr': 0.0004970081601728969, 'weight_decay': 6.767920935431015e-06, 'epochs': 296, 'loss': 'mae', 'optimizer': 'adam', 'graph_mode': 'off', 'use_snp_selection': True, 'num_snps': 28152}. Best is trial 17 with value: 0.11157945279125966.
[I 2025-12-05 16:21:46,505] Trial 41 finished with value: 0.08498252379019139 and parameters: {'model_type': 'mlp', 'hidden_dims': '[512, 64]', 'dropout': 0.5552670608345426, 'batch_norm': True, 'lr': 0.0006955643767831617, 'weight_decay': 1.1204379509492522e-06, 'epochs': 257, 'loss': 'mae', 'optimizer': 'adam', 'graph_mode': 'off', 'use_snp_selection': True, 'num_snps': 29354}. Best is trial 17 with value: 0.11157945279125966.
[I 2025-12-05 16:21:48,940] Trial 42 finished with value: 0.09112945188272564 and parameters: {'model_type': 'mlp', 'hidden_dims': '[256, 128, 64]', 'dropout': 0.522778437299372, 'batch_norm': True, 'lr': 0.00041178024633753483, 'weight_decay': 7.357628222239423e-07, 'epochs': 282, 'loss': 'mae', 'optimizer': 'adam', 'graph_mode': 'off', 'use_snp_selection': True, 'num_snps': 50722}. Best is trial 17 with value: 0.11157945279125966.
[I 2025-12-05 16:21:50,670] Trial 43 finished with value: 0.08635661872606461 and parameters: {'model_type': 'mlp', 'hidden_dims': '[512, 64]', 'dropout': 0.5943218156172124, 'batch_norm': True, 'lr': 0.0001875927490145227, 'weight_decay': 5.144018771966124e-07, 'epochs': 235, 'loss': 'mae', 'optimizer': 'adam', 'graph_mode': 'off', 'use_snp_selection': False}. Best is trial 17 with value: 0.11157945279125966.
[I 2025-12-05 16:21:51,741] Trial 44 finished with value: 0.06851905331499256 and parameters: {'model_type': 'mlp', 'hidden_dims': '[256, 128]', 'dropout': 0.5346819442004661, 'batch_norm': True, 'lr': 0.000498889521244861, 'weight_decay': 1.6828502106266668e-06, 'epochs': 189, 'loss': 'mae', 'optimizer': 'adam', 'graph_mode': 'off', 'use_snp_selection': False}. Best is trial 17 with value: 0.11157945279125966.
[I 2025-12-05 16:21:54,017] Trial 45 finished with value: 0.09559695011520747 and parameters: {'model_type': 'mlp', 'hidden_dims': '[512, 128]', 'dropout': 0.4095159612065577, 'batch_norm': True, 'lr': 0.00030979555691212153, 'weight_decay': 2.8854138858008153e-07, 'epochs': 310, 'loss': 'mse', 'optimizer': 'adam', 'graph_mode': 'off', 'use_snp_selection': True, 'num_snps': 35181}. Best is trial 17 with value: 0.11157945279125966.
[I 2025-12-05 16:21:56,287] Trial 46 finished with value: 0.00607480946586545 and parameters: {'model_type': 'mlp', 'hidden_dims': '[512, 128]', 'dropout': 0.4128886501944806, 'batch_norm': True, 'lr': 1.0775369796266179e-06, 'weight_decay': 1.6612734161006104e-07, 'epochs': 308, 'loss': 'mse', 'optimizer': 'adam', 'graph_mode': 'off', 'use_snp_selection': True, 'num_snps': 35104}. Best is trial 17 with value: 0.11157945279125966.
[I 2025-12-05 16:21:59,142] Trial 47 finished with value: 0.03736739551404865 and parameters: {'model_type': 'mlp', 'hidden_dims': '[512, 128]', 'dropout': 0.506878826768006, 'batch_norm': False, 'lr': 8.007738406156e-05, 'weight_decay': 2.411817735470508e-05, 'epochs': 331, 'loss': 'mse', 'optimizer': 'adam', 'graph_mode': 'off', 'use_snp_selection': True, 'num_snps': 47245}. Best is trial 17 with value: 0.11157945279125966.
[I 2025-12-05 16:22:01,000] Trial 48 finished with value: 0.08210368175478508 and parameters: {'model_type': 'mlp', 'hidden_dims': '[512, 128]', 'dropout': 0.5744973702719405, 'batch_norm': True, 'lr': 0.00022162893860103722, 'weight_decay': 0.0001190189477789592, 'epochs': 305, 'loss': 'mse', 'optimizer': 'adam', 'graph_mode': 'off', 'use_snp_selection': True, 'num_snps': 25054}. Best is trial 17 with value: 0.11157945279125966.
[I 2025-12-05 16:22:03,184] Trial 49 finished with value: 0.06346602038304891 and parameters: {'model_type': 'mlp', 'hidden_dims': '[512, 128]', 'dropout': 0.30890111940530574, 'batch_norm': True, 'lr': 4.64188087192277e-05, 'weight_decay': 2.973996732846855e-07, 'epochs': 160, 'loss': 'mse', 'optimizer': 'adam', 'graph_mode': 'off', 'use_snp_selection': True, 'num_snps': 37732}. Best is trial 17 with value: 0.11157945279125966.
[I 2025-12-05 16:22:04,220] Trial 50 finished with value: 0.09282835026251392 and parameters: {'model_type': 'mlp', 'hidden_dims': '[512, 256]', 'dropout': 0.29053798114698637, 'batch_norm': True, 'lr': 0.0008259122699970072, 'weight_decay': 1.3109871805606263e-07, 'epochs': 43, 'loss': 'mse', 'optimizer': 'adam', 'graph_mode': 'off', 'use_snp_selection': True, 'num_snps': 14244}. Best is trial 17 with value: 0.11157945279125966.
[I 2025-12-05 16:22:05,115] Trial 51 finished with value: 0.07768252553323396 and parameters: {'model_type': 'mlp', 'hidden_dims': '[512, 256]', 'dropout': 0.25177086018572276, 'batch_norm': True, 'lr': 0.0007336216804427285, 'weight_decay': 1.3541144653260693e-07, 'epochs': 48, 'loss': 'mse', 'optimizer': 'adam', 'graph_mode': 'off', 'use_snp_selection': True, 'num_snps': 10106}. Best is trial 17 with value: 0.11157945279125966.
[I 2025-12-05 16:22:05,961] Trial 52 finished with value: 0.08559153297406343 and parameters: {'model_type': 'mlp', 'hidden_dims': '[512, 256]', 'dropout': 0.28947179394105393, 'batch_norm': True, 'lr': 0.0008322336397630423, 'weight_decay': 2.4044109663686153e-07, 'epochs': 72, 'loss': 'mse', 'optimizer': 'adam', 'graph_mode': 'off', 'use_snp_selection': True, 'num_snps': 7773}. Best is trial 17 with value: 0.11157945279125966.
[I 2025-12-05 16:22:07,045] Trial 53 finished with value: 0.0824652090563849 and parameters: {'model_type': 'mlp', 'hidden_dims': '[512, 256]', 'dropout': 0.21238039316207896, 'batch_norm': True, 'lr': 0.0002884517378288242, 'weight_decay': 0.0008658651548732487, 'epochs': 92, 'loss': 'mse', 'optimizer': 'adam', 'graph_mode': 'off', 'use_snp_selection': True, 'num_snps': 13404}. Best is trial 17 with value: 0.11157945279125966.
[I 2025-12-05 16:22:08,592] Trial 54 finished with value: 0.08564356517482868 and parameters: {'model_type': 'mlp', 'hidden_dims': '[512, 256]', 'dropout': 0.37068526777442207, 'batch_norm': True, 'lr': 0.0005223219757661998, 'weight_decay': 1.0006092194981835e-07, 'epochs': 320, 'loss': 'mse', 'optimizer': 'adam', 'graph_mode': 'off', 'use_snp_selection': True, 'num_snps': 17051}. Best is trial 17 with value: 0.11157945279125966.
[I 2025-12-05 16:22:10,611] Trial 55 finished with value: 0.0809176669406862 and parameters: {'model_type': 'mlp', 'hidden_dims': '[128, 64]', 'dropout': 0.2971863441448952, 'batch_norm': True, 'lr': 0.0007904250251014798, 'weight_decay': 4.1141346494048574e-07, 'epochs': 274, 'loss': 'mse', 'optimizer': 'adam', 'graph_mode': 'off', 'use_snp_selection': True, 'num_snps': 40939}. Best is trial 17 with value: 0.11157945279125966.
[I 2025-12-05 16:22:11,683] Trial 56 finished with value: 0.05281481211640864 and parameters: {'model_type': 'mlp', 'hidden_dims': '[512, 256]', 'dropout': 0.3373386411337843, 'batch_norm': True, 'lr': 9.328698603053435e-06, 'weight_decay': 1.5791810405402136e-07, 'epochs': 287, 'loss': 'mse', 'optimizer': 'adam', 'graph_mode': 'off', 'use_snp_selection': True, 'num_snps': 6423}. Best is trial 17 with value: 0.11157945279125966.
[I 2025-12-05 16:22:13,588] Trial 57 finished with value: 0.08428867645715 and parameters: {'model_type': 'mlp', 'hidden_dims': '[512, 128]', 'dropout': 0.18306266215904027, 'batch_norm': True, 'lr': 0.00041093761415411824, 'weight_decay': 2.464336741664415e-07, 'epochs': 141, 'loss': 'mse', 'optimizer': 'adam', 'graph_mode': 'off', 'use_snp_selection': True, 'num_snps': 32264}. Best is trial 17 with value: 0.11157945279125966.
[I 2025-12-05 16:22:14,763] Trial 58 finished with value: 0.02189684823900022 and parameters: {'model_type': 'mlp', 'hidden_dims': '[512, 64]', 'dropout': 0.27159048834891064, 'batch_norm': False, 'lr': 0.00032273280295945256, 'weight_decay': 3.589083494447845e-07, 'epochs': 100, 'loss': 'mae', 'optimizer': 'adam', 'graph_mode': 'off', 'use_snp_selection': False}. Best is trial 17 with value: 0.11157945279125966.
[I 2025-12-05 16:22:15,902] Trial 59 finished with value: 0.09423296897201057 and parameters: {'model_type': 'mlp', 'hidden_dims': '[256, 128, 64]', 'dropout': 0.5794929180626486, 'batch_norm': True, 'lr': 0.00020350879184865712, 'weight_decay': 1.2503308111700093e-05, 'epochs': 300, 'loss': 'mae', 'optimizer': 'adam', 'graph_mode': 'off', 'use_snp_selection': True, 'num_snps': 2613}. Best is trial 17 with value: 0.11157945279125966.
[I 2025-12-05 16:22:17,188] Trial 60 finished with value: 0.06982731153927456 and parameters: {'model_type': 'mlp', 'hidden_dims': '[256, 128, 64]', 'dropout': 0.5828487935296228, 'batch_norm': True, 'lr': 0.00014157075507477795, 'weight_decay': 7.306817688257963e-06, 'epochs': 299, 'loss': 'mae', 'optimizer': 'adam', 'graph_mode': 'off', 'use_snp_selection': False}. Best is trial 17 with value: 0.11157945279125966.
[I 2025-12-05 16:22:18,305] Trial 61 finished with value: 0.06544159227738054 and parameters: {'model_type': 'mlp', 'hidden_dims': '[256, 128, 64]', 'dropout': 0.5581145035794688, 'batch_norm': True, 'lr': 0.00021773094005764, 'weight_decay': 1.446041554569453e-05, 'epochs': 315, 'loss': 'mae', 'optimizer': 'adam', 'graph_mode': 'off', 'use_snp_selection': True, 'num_snps': 2731}. Best is trial 17 with value: 0.11157945279125966.
[I 2025-12-05 16:22:19,790] Trial 62 finished with value: 0.06097765436110447 and parameters: {'model_type': 'mlp', 'hidden_dims': '[256, 128, 64]', 'dropout': 0.4926195494260055, 'batch_norm': True, 'lr': 0.00017763629704632239, 'weight_decay': 4.384556446157388e-05, 'epochs': 272, 'loss': 'mae', 'optimizer': 'adam', 'graph_mode': 'off', 'use_snp_selection': True, 'num_snps': 15306}. Best is trial 17 with value: 0.11157945279125966.
[I 2025-12-05 16:22:20,963] Trial 63 finished with value: 0.07079980563178917 and parameters: {'model_type': 'mlp', 'hidden_dims': '[128, 64]', 'dropout': 0.22903545838296588, 'batch_norm': True, 'lr': 0.0004960263446168255, 'weight_decay': 9.640137869886517e-06, 'epochs': 264, 'loss': 'mae', 'optimizer': 'adam', 'graph_mode': 'off', 'use_snp_selection': True, 'num_snps': 8982}. Best is trial 17 with value: 0.11157945279125966.
[I 2025-12-05 16:22:22,727] Trial 64 finished with value: 0.07659844257615951 and parameters: {'model_type': 'mlp', 'hidden_dims': '[256, 128, 64]', 'dropout': 0.5824185339605213, 'batch_norm': True, 'lr': 0.0005986804886105062, 'weight_decay': 2.2917989123490968e-07, 'epochs': 287, 'loss': 'mae', 'optimizer': 'adam', 'graph_mode': 'off', 'use_snp_selection': True, 'num_snps': 26256}. Best is trial 17 with value: 0.11157945279125966.
[I 2025-12-05 16:22:23,445] Trial 65 finished with value: 0.08303626681542295 and parameters: {'model_type': 'mlp', 'hidden_dims': '[512, 256]', 'dropout': 0.4118520895003167, 'batch_norm': True, 'lr': 0.0009748388175416147, 'weight_decay': 4.045081512946041e-06, 'epochs': 63, 'loss': 'mae', 'optimizer': 'adam', 'graph_mode': 'off', 'use_snp_selection': True, 'num_snps': 2868}. Best is trial 17 with value: 0.11157945279125966.
[I 2025-12-05 16:22:25,606] Trial 66 finished with value: 0.06242252960273584 and parameters: {'model_type': 'mlp', 'hidden_dims': '[512, 256]', 'dropout': 0.46933846507994825, 'batch_norm': True, 'lr': 0.0003855219714110737, 'weight_decay': 0.0005659046662357489, 'epochs': 341, 'loss': 'mae', 'optimizer': 'adam', 'graph_mode': 'off', 'use_snp_selection': False}. Best is trial 17 with value: 0.11157945279125966.
[I 2025-12-05 16:22:27,546] Trial 67 finished with value: 0.09241650100183768 and parameters: {'model_type': 'mlp', 'hidden_dims': '[128, 64]', 'dropout': 0.331373949716997, 'batch_norm': True, 'lr': 0.00027968120020461503, 'weight_decay': 1.1787360540910814e-07, 'epochs': 221, 'loss': 'mse', 'optimizer': 'adam', 'graph_mode': 'off', 'use_snp_selection': True, 'num_snps': 35312}. Best is trial 17 with value: 0.11157945279125966.
[I 2025-12-05 16:22:29,616] Trial 68 finished with value: 0.06596103315604289 and parameters: {'model_type': 'mlp', 'hidden_dims': '[512, 128]', 'dropout': 0.5717880406675716, 'batch_norm': True, 'lr': 0.0007525519735307046, 'weight_decay': 9.814594487671454e-07, 'epochs': 350, 'loss': 'mae', 'optimizer': 'adam', 'graph_mode': 'off', 'use_snp_selection': False}. Best is trial 17 with value: 0.11157945279125966.
[I 2025-12-05 16:22:30,690] Trial 69 finished with value: 0.0613007781185424 and parameters: {'model_type': 'mlp', 'hidden_dims': '[256, 128, 64]', 'dropout': 0.5972136078699546, 'batch_norm': False, 'lr': 0.0005651977001667582, 'weight_decay': 5.835110770879302e-07, 'epochs': 327, 'loss': 'mae', 'optimizer': 'adam', 'graph_mode': 'off', 'use_snp_selection': True, 'num_snps': 5717}. Best is trial 17 with value: 0.11157945279125966.
[I 2025-12-05 16:22:32,633] Trial 70 finished with value: 0.07899229247781095 and parameters: {'model_type': 'mlp', 'hidden_dims': '[512, 64]', 'dropout': 0.5449017818972901, 'batch_norm': True, 'lr': 0.00010458468377262759, 'weight_decay': 1.392676797292648e-07, 'epochs': 297, 'loss': 'mae', 'optimizer': 'adam', 'graph_mode': 'off', 'use_snp_selection': False}. Best is trial 17 with value: 0.11157945279125966.
[I 2025-12-05 16:22:34,596] Trial 71 finished with value: 0.08829447161059494 and parameters: {'model_type': 'mlp', 'hidden_dims': '[128, 64]', 'dropout': 0.32565267946797305, 'batch_norm': True, 'lr': 0.00028528798568450527, 'weight_decay': 1.154392474931694e-07, 'epochs': 217, 'loss': 'mse', 'optimizer': 'adam', 'graph_mode': 'off', 'use_snp_selection': True, 'num_snps': 36595}. Best is trial 17 with value: 0.11157945279125966.
[I 2025-12-05 16:22:36,504] Trial 72 finished with value: 0.08500281312943085 and parameters: {'model_type': 'mlp', 'hidden_dims': '[128, 64]', 'dropout': 0.3549818570933647, 'batch_norm': True, 'lr': 0.00022986681830911937, 'weight_decay': 2.0840692069726476e-07, 'epochs': 248, 'loss': 'mse', 'optimizer': 'adam', 'graph_mode': 'off', 'use_snp_selection': True, 'num_snps': 33124}. Best is trial 17 with value: 0.11157945279125966.
