[I 2025-12-06 12:02:16,530] Trial 94 finished with value: 0.21952918073128705 and parameters: {'model_type': 'mlp', 'hidden_dims': '[512, 128]', 'dropout': 0.119530975968659, 'batch_norm': False, 'lr': 0.00016342026802395595, 'weight_decay': 0.00038576108952654875, 'epochs': 92, 'loss': 'mse', 'optimizer': 'adam', 'graph_mode': 'off', 'use_snp_selection': False}. Best is trial 86 with value: 0.22734500484490874.
[I 2025-12-06 12:02:54,839] Trial 95 finished with value: 0.22479163553142736 and parameters: {'model_type': 'mlp', 'hidden_dims': '[512, 128]', 'dropout': 0.13657224754505362, 'batch_norm': False, 'lr': 0.0001125457790929615, 'weight_decay': 0.00020522566684864774, 'epochs': 112, 'loss': 'mse', 'optimizer': 'adam', 'graph_mode': 'off', 'use_snp_selection': False}. Best is trial 86 with value: 0.22734500484490874.
[I 2025-12-06 12:03:32,046] Trial 96 finished with value: 0.22390783553827182 and parameters: {'model_type': 'mlp', 'hidden_dims': '[512, 128]', 'dropout': 0.1500831371505752, 'batch_norm': False, 'lr': 0.00012565606017866381, 'weight_decay': 0.0001753683997242341, 'epochs': 108, 'loss': 'mse', 'optimizer': 'adam', 'graph_mode': 'off', 'use_snp_selection': False}. Best is trial 86 with value: 0.22734500484490874.
[I 2025-12-06 12:04:09,234] Trial 97 finished with value: 0.21791217512944416 and parameters: {'model_type': 'mlp', 'hidden_dims': '[512, 128]', 'dropout': 0.13998175706286045, 'batch_norm': False, 'lr': 0.0001316180356878261, 'weight_decay': 0.00023431907591916552, 'epochs': 108, 'loss': 'mae', 'optimizer': 'adam', 'graph_mode': 'off', 'use_snp_selection': False}. Best is trial 86 with value: 0.22734500484490874.
[I 2025-12-06 12:04:43,684] Trial 98 finished with value: 0.22725040868104013 and parameters: {'model_type': 'mlp', 'hidden_dims': '[512, 128]', 'dropout': 0.14980952987406507, 'batch_norm': False, 'lr': 0.00012302877439741616, 'weight_decay': 0.00011868946520224232, 'epochs': 98, 'loss': 'mse', 'optimizer': 'adam', 'graph_mode': 'off', 'use_snp_selection': False}. Best is trial 86 with value: 0.22734500484490874.
[I 2025-12-06 12:05:19,195] Trial 99 finished with value: 0.21773208367969935 and parameters: {'model_type': 'mlp', 'hidden_dims': '[512, 128]', 'dropout': 0.1155672697789494, 'batch_norm': False, 'lr': 0.00020136300833683142, 'weight_decay': 0.0001367611290598185, 'epochs': 102, 'loss': 'mse', 'optimizer': 'adam', 'graph_mode': 'off', 'use_snp_selection': False}. Best is trial 86 with value: 0.22734500484490874.
[I 2025-12-06 12:06:55,473] Trial 100 finished with value: 0.21525094327345182 and parameters: {'model_type': 'mlp', 'hidden_dims': '[512, 128]', 'dropout': 0.13797130444155878, 'batch_norm': False, 'lr': 0.000319044475800432, 'weight_decay': 7.029514492429003e-05, 'epochs': 323, 'loss': 'mse', 'optimizer': 'adam', 'graph_mode': 'off', 'use_snp_selection': False}. Best is trial 86 with value: 0.22734500484490874.
[I 2025-12-06 12:07:29,896] Trial 101 finished with value: 0.21985484363013746 and parameters: {'model_type': 'mlp', 'hidden_dims': '[512, 128]', 'dropout': 0.15008283839218878, 'batch_norm': False, 'lr': 0.00011184197262487078, 'weight_decay': 0.0001979229435005216, 'epochs': 98, 'loss': 'mse', 'optimizer': 'adam', 'graph_mode': 'off', 'use_snp_selection': False}. Best is trial 86 with value: 0.22734500484490874.
[I 2025-12-06 12:08:08,019] Trial 102 finished with value: 0.07874434116765663 and parameters: {'model_type': 'mlp', 'hidden_dims': '[512, 128]', 'dropout': 0.1869267351797057, 'batch_norm': False, 'lr': 0.0009992428137735015, 'weight_decay': 9.807895810238486e-05, 'epochs': 112, 'loss': 'mse', 'optimizer': 'adam', 'graph_mode': 'off', 'use_snp_selection': False}. Best is trial 86 with value: 0.22734500484490874.
[I 2025-12-06 12:08:36,339] Trial 103 finished with value: 0.2059057722781379 and parameters: {'model_type': 'mlp', 'hidden_dims': '[512, 128]', 'dropout': 0.16989319618801166, 'batch_norm': False, 'lr': 0.00021450403507133117, 'weight_decay': 0.00011334848983304477, 'epochs': 76, 'loss': 'mse', 'optimizer': 'adam', 'graph_mode': 'off', 'use_snp_selection': False}. Best is trial 86 with value: 0.22734500484490874.
[I 2025-12-06 12:09:10,182] Trial 104 finished with value: 0.22506353126393064 and parameters: {'model_type': 'mlp', 'hidden_dims': '[512, 128]', 'dropout': 0.12984092699823932, 'batch_norm': False, 'lr': 0.00015202372083683794, 'weight_decay': 0.00018586495881205072, 'epochs': 96, 'loss': 'mse', 'optimizer': 'adam', 'graph_mode': 'off', 'use_snp_selection': False}. Best is trial 86 with value: 0.22734500484490874.
[I 2025-12-06 12:09:43,476] Trial 105 finished with value: 0.2246335993446264 and parameters: {'model_type': 'mlp', 'hidden_dims': '[512, 128]', 'dropout': 0.13359823099743734, 'batch_norm': False, 'lr': 0.0001581687745881677, 'weight_decay': 0.00018799733471001111, 'epochs': 94, 'loss': 'mse', 'optimizer': 'adam', 'graph_mode': 'off', 'use_snp_selection': False}. Best is trial 86 with value: 0.22734500484490874.
[I 2025-12-06 12:10:17,297] Trial 106 finished with value: 0.21083440395458303 and parameters: {'model_type': 'mlp', 'hidden_dims': '[512, 128]', 'dropout': 0.13421475765123975, 'batch_norm': False, 'lr': 0.0002881607125960742, 'weight_decay': 0.00019960386970413693, 'epochs': 96, 'loss': 'mse', 'optimizer': 'adam', 'graph_mode': 'off', 'use_snp_selection': False}. Best is trial 86 with value: 0.22734500484490874.
[I 2025-12-06 12:10:53,070] Trial 107 finished with value: 0.21787582348991422 and parameters: {'model_type': 'mlp', 'hidden_dims': '[512, 128]', 'dropout': 0.10866276435625308, 'batch_norm': False, 'lr': 0.00025909379039861945, 'weight_decay': 0.0001629860969409259, 'epochs': 103, 'loss': 'mse', 'optimizer': 'adam', 'graph_mode': 'off', 'use_snp_selection': False}. Best is trial 86 with value: 0.22734500484490874.
[I 2025-12-06 12:11:22,559] Trial 108 finished with value: 0.2237092868851102 and parameters: {'model_type': 'mlp', 'hidden_dims': '[512, 128]', 'dropout': 0.14962506606199855, 'batch_norm': False, 'lr': 0.0001520812298326314, 'weight_decay': 7.048429120938531e-05, 'epochs': 80, 'loss': 'mse', 'optimizer': 'adam', 'graph_mode': 'off', 'use_snp_selection': False}. Best is trial 86 with value: 0.22734500484490874.
[I 2025-12-06 12:12:01,673] Trial 109 finished with value: 0.2278803744136968 and parameters: {'model_type': 'mlp', 'hidden_dims': '[512, 128]', 'dropout': 0.13247488160923396, 'batch_norm': False, 'lr': 0.0001768854446482737, 'weight_decay': 0.00019330126397478439, 'epochs': 115, 'loss': 'mse', 'optimizer': 'adam', 'graph_mode': 'off', 'use_snp_selection': False}. Best is trial 109 with value: 0.2278803744136968.
[I 2025-12-06 12:12:41,606] Trial 110 finished with value: 0.21689429401355476 and parameters: {'model_type': 'mlp', 'hidden_dims': '[512, 128]', 'dropout': 0.13063007444686034, 'batch_norm': False, 'lr': 0.0003793109730091859, 'weight_decay': 5.313915211457688e-05, 'epochs': 118, 'loss': 'mse', 'optimizer': 'adam', 'graph_mode': 'off', 'use_snp_selection': False}. Best is trial 109 with value: 0.2278803744136968.
[I 2025-12-06 12:13:19,089] Trial 111 finished with value: 0.2216637203606365 and parameters: {'model_type': 'mlp', 'hidden_dims': '[512, 128]', 'dropout': 0.10912956615760072, 'batch_norm': False, 'lr': 0.00014775928720218908, 'weight_decay': 0.0002717671377340078, 'epochs': 109, 'loss': 'mse', 'optimizer': 'adam', 'graph_mode': 'off', 'use_snp_selection': False}. Best is trial 109 with value: 0.2278803744136968.
[I 2025-12-06 12:13:52,686] Trial 112 finished with value: 0.20563836442000488 and parameters: {'model_type': 'mlp', 'hidden_dims': '[512, 128]', 'dropout': 0.19616864840488957, 'batch_norm': False, 'lr': 0.00020319002772956166, 'weight_decay': 0.000184401189326263, 'epochs': 95, 'loss': 'mse', 'optimizer': 'adam', 'graph_mode': 'off', 'use_snp_selection': False}. Best is trial 109 with value: 0.2278803744136968.
[I 2025-12-06 12:14:25,030] Trial 113 finished with value: 0.22119808821852188 and parameters: {'model_type': 'mlp', 'hidden_dims': '[512, 128]', 'dropout': 0.15390714522066443, 'batch_norm': False, 'lr': 0.00012509723731622623, 'weight_decay': 0.00012087764157122436, 'epochs': 88, 'loss': 'mse', 'optimizer': 'adam', 'graph_mode': 'off', 'use_snp_selection': False}. Best is trial 109 with value: 0.2278803744136968.
[I 2025-12-06 12:15:06,466] Trial 114 finished with value: 0.21920629472196546 and parameters: {'model_type': 'mlp', 'hidden_dims': '[512, 128]', 'dropout': 0.21624749478311167, 'batch_norm': False, 'lr': 0.0001686701961342882, 'weight_decay': 0.00014187948330916672, 'epochs': 122, 'loss': 'mse', 'optimizer': 'adam', 'graph_mode': 'off', 'use_snp_selection': False}. Best is trial 109 with value: 0.2278803744136968.
[I 2025-12-06 12:15:33,839] Trial 115 finished with value: 0.21929324821403878 and parameters: {'model_type': 'mlp', 'hidden_dims': '[512, 64]', 'dropout': 0.12567810554682826, 'batch_norm': False, 'lr': 4.3215885412062575e-05, 'weight_decay': 0.00046077246688267523, 'epochs': 72, 'loss': 'mse', 'optimizer': 'adam', 'graph_mode': 'off', 'use_snp_selection': False}. Best is trial 109 with value: 0.2278803744136968.
[I 2025-12-06 12:16:16,993] Trial 116 finished with value: 0.22155196039190636 and parameters: {'model_type': 'mlp', 'hidden_dims': '[512, 128]', 'dropout': 0.11637468645064544, 'batch_norm': False, 'lr': 3.332837715163992e-05, 'weight_decay': 0.00027040570347469574, 'epochs': 129, 'loss': 'mae', 'optimizer': 'adam', 'graph_mode': 'off', 'use_snp_selection': False}. Best is trial 109 with value: 0.2278803744136968.
[I 2025-12-06 12:16:51,834] Trial 117 finished with value: 0.2218376422831112 and parameters: {'model_type': 'mlp', 'hidden_dims': '[512, 256]', 'dropout': 0.1454143999510071, 'batch_norm': False, 'lr': 0.0001789197297392271, 'weight_decay': 0.0002239454523204357, 'epochs': 99, 'loss': 'mse', 'optimizer': 'adam', 'graph_mode': 'off', 'use_snp_selection': False}. Best is trial 109 with value: 0.2278803744136968.
[I 2025-12-06 12:17:30,179] Trial 118 finished with value: 0.21880544387435177 and parameters: {'model_type': 'mlp', 'hidden_dims': '[512, 128]', 'dropout': 0.1543688476929657, 'batch_norm': False, 'lr': 6.56615544187931e-05, 'weight_decay': 0.0001016498661097768, 'epochs': 112, 'loss': 'mse', 'optimizer': 'adam', 'graph_mode': 'off', 'use_snp_selection': False}. Best is trial 109 with value: 0.2278803744136968.
[I 2025-12-06 12:18:00,450] Trial 119 finished with value: 0.22139848107052665 and parameters: {'model_type': 'mlp', 'hidden_dims': '[512, 128]', 'dropout': 0.1919819609501017, 'batch_norm': False, 'lr': 0.0001199477567428558, 'weight_decay': 0.00032895109929810166, 'epochs': 83, 'loss': 'mse', 'optimizer': 'adam', 'graph_mode': 'off', 'use_snp_selection': False}. Best is trial 109 with value: 0.2278803744136968.
[I 2025-12-06 12:18:23,369] Trial 120 finished with value: 0.226689327944744 and parameters: {'model_type': 'mlp', 'hidden_dims': '[512, 128]', 'dropout': 0.178704076052521, 'batch_norm': False, 'lr': 4.8627605043370955e-05, 'weight_decay': 0.00016539919517453045, 'epochs': 56, 'loss': 'mse', 'optimizer': 'adam', 'graph_mode': 'off', 'use_snp_selection': False}. Best is trial 109 with value: 0.2278803744136968.
[I 2025-12-06 12:18:46,926] Trial 121 finished with value: 0.22691413075087635 and parameters: {'model_type': 'mlp', 'hidden_dims': '[512, 128]', 'dropout': 0.18047737419744522, 'batch_norm': False, 'lr': 2.437137044425124e-05, 'weight_decay': 0.00016847739677572831, 'epochs': 58, 'loss': 'mse', 'optimizer': 'adam', 'graph_mode': 'off', 'use_snp_selection': False}. Best is trial 109 with value: 0.2278803744136968.
[I 2025-12-06 12:19:09,949] Trial 122 finished with value: 0.22987141000414538 and parameters: {'model_type': 'mlp', 'hidden_dims': '[512, 128]', 'dropout': 0.1793976228794959, 'batch_norm': False, 'lr': 2.458251549609619e-05, 'weight_decay': 3.4816631796572944e-05, 'epochs': 56, 'loss': 'mse', 'optimizer': 'adam', 'graph_mode': 'off', 'use_snp_selection': False}. Best is trial 122 with value: 0.22987141000414538.
[I 2025-12-06 12:19:30,666] Trial 123 finished with value: 0.21436678957830568 and parameters: {'model_type': 'mlp', 'hidden_dims': '[512, 128]', 'dropout': 0.17427344653069046, 'batch_norm': False, 'lr': 4.87718970503391e-05, 'weight_decay': 3.623325494067735e-05, 'epochs': 48, 'loss': 'mse', 'optimizer': 'adam', 'graph_mode': 'off', 'use_snp_selection': False}. Best is trial 122 with value: 0.22987141000414538.
[I 2025-12-06 12:19:53,367] Trial 124 finished with value: 0.22107218461037453 and parameters: {'model_type': 'mlp', 'hidden_dims': '[512, 128]', 'dropout': 0.21128281304515933, 'batch_norm': False, 'lr': 2.756145057568778e-05, 'weight_decay': 6.72067165514566e-05, 'epochs': 55, 'loss': 'mse', 'optimizer': 'adam', 'graph_mode': 'off', 'use_snp_selection': False}. Best is trial 122 with value: 0.22987141000414538.
[I 2025-12-06 12:20:19,723] Trial 125 finished with value: 0.2062529380633645 and parameters: {'model_type': 'mlp', 'hidden_dims': '[512, 128]', 'dropout': 0.100248849537726, 'batch_norm': False, 'lr': 0.00022224912985219073, 'weight_decay': 8.44349334071553e-05, 'epochs': 69, 'loss': 'mse', 'optimizer': 'adam', 'graph_mode': 'off', 'use_snp_selection': False}. Best is trial 122 with value: 0.22987141000414538.
[I 2025-12-06 12:20:43,614] Trial 126 finished with value: 0.22216838214120097 and parameters: {'model_type': 'mlp', 'hidden_dims': '[512, 128]', 'dropout': 0.16231546501900762, 'batch_norm': False, 'lr': 1.7901404118839812e-05, 'weight_decay': 1.9790999682661764e-06, 'epochs': 59, 'loss': 'mse', 'optimizer': 'adam', 'graph_mode': 'off', 'use_snp_selection': False}. Best is trial 122 with value: 0.22987141000414538.
[I 2025-12-06 12:21:04,144] Trial 127 finished with value: 0.22788394488994507 and parameters: {'model_type': 'mlp', 'hidden_dims': '[512, 128]', 'dropout': 0.13115133984295724, 'batch_norm': False, 'lr': 2.1394798049368155e-05, 'weight_decay': 0.00014164299171258137, 'epochs': 47, 'loss': 'mse', 'optimizer': 'adam', 'graph_mode': 'off', 'use_snp_selection': False}. Best is trial 122 with value: 0.22987141000414538.
[I 2025-12-06 12:21:24,333] Trial 128 finished with value: 0.22624496530764698 and parameters: {'model_type': 'mlp', 'hidden_dims': '[512, 128]', 'dropout': 0.13664824376372647, 'batch_norm': False, 'lr': 2.7278171749059956e-05, 'weight_decay': 0.00014294484884372745, 'epochs': 46, 'loss': 'mse', 'optimizer': 'adam', 'graph_mode': 'off', 'use_snp_selection': False}. Best is trial 122 with value: 0.22987141000414538.
[I 2025-12-06 12:21:44,275] Trial 129 finished with value: 0.22512668323871 and parameters: {'model_type': 'mlp', 'hidden_dims': '[512, 128]', 'dropout': 0.14120756119267505, 'batch_norm': False, 'lr': 2.185797850156255e-05, 'weight_decay': 2.645161670274415e-05, 'epochs': 45, 'loss': 'mse', 'optimizer': 'adam', 'graph_mode': 'off', 'use_snp_selection': False}. Best is trial 122 with value: 0.22987141000414538.
[I 2025-12-06 12:22:02,797] Trial 130 finished with value: 0.21449463416732112 and parameters: {'model_type': 'mlp', 'hidden_dims': '[512, 128]', 'dropout': 0.1415274501089836, 'batch_norm': False, 'lr': 2.5491165986045323e-05, 'weight_decay': 2.742354199363786e-05, 'epochs': 40, 'loss': 'mse', 'optimizer': 'adam', 'graph_mode': 'off', 'use_snp_selection': False}. Best is trial 122 with value: 0.22987141000414538.
[I 2025-12-06 12:22:23,268] Trial 131 finished with value: 0.21485195461171966 and parameters: {'model_type': 'mlp', 'hidden_dims': '[512, 128]', 'dropout': 0.12440660615550513, 'batch_norm': False, 'lr': 2.175599447887128e-05, 'weight_decay': 1.928062176902402e-05, 'epochs': 47, 'loss': 'mse', 'optimizer': 'adam', 'graph_mode': 'off', 'use_snp_selection': False}. Best is trial 122 with value: 0.22987141000414538.
[I 2025-12-06 12:22:46,460] Trial 132 finished with value: 0.2217396571323746 and parameters: {'model_type': 'mlp', 'hidden_dims': '[512, 128]', 'dropout': 0.15847877835596347, 'batch_norm': False, 'lr': 2.4674342997685333e-05, 'weight_decay': 1.5584137847023853e-05, 'epochs': 57, 'loss': 'mse', 'optimizer': 'adam', 'graph_mode': 'off', 'use_snp_selection': False}. Best is trial 122 with value: 0.22987141000414538.
[I 2025-12-06 12:23:06,583] Trial 133 finished with value: 0.22108920679337646 and parameters: {'model_type': 'mlp', 'hidden_dims': '[512, 128]', 'dropout': 0.11637442295196491, 'batch_norm': False, 'lr': 3.241758374438714e-05, 'weight_decay': 4.188500168154216e-05, 'epochs': 46, 'loss': 'mse', 'optimizer': 'adam', 'graph_mode': 'off', 'use_snp_selection': False}. Best is trial 122 with value: 0.22987141000414538.
[I 2025-12-06 12:23:29,015] Trial 134 finished with value: 0.2218266239324615 and parameters: {'model_type': 'mlp', 'hidden_dims': '[512, 128]', 'dropout': 0.19940300209945866, 'batch_norm': False, 'lr': 1.8089805953877623e-05, 'weight_decay': 0.00014031541059058, 'epochs': 54, 'loss': 'mse', 'optimizer': 'adam', 'graph_mode': 'off', 'use_snp_selection': False}. Best is trial 122 with value: 0.22987141000414538.
[I 2025-12-06 12:23:50,439] Trial 135 finished with value: 0.21366241072710895 and parameters: {'model_type': 'mlp', 'hidden_dims': '[512, 128]', 'dropout': 0.18563721377934, 'batch_norm': False, 'lr': 4.010310971506348e-05, 'weight_decay': 3.3454121616105616e-05, 'epochs': 51, 'loss': 'mse', 'optimizer': 'adam', 'graph_mode': 'off', 'use_snp_selection': False}. Best is trial 122 with value: 0.22987141000414538.
[I 2025-12-06 12:24:18,582] Trial 136 finished with value: 0.22177973586472297 and parameters: {'model_type': 'mlp', 'hidden_dims': '[512, 128]', 'dropout': 0.16687285385154021, 'batch_norm': False, 'lr': 2.171315035856579e-05, 'weight_decay': 0.00011230742437827969, 'epochs': 75, 'loss': 'mse', 'optimizer': 'adam', 'graph_mode': 'off', 'use_snp_selection': False}. Best is trial 122 with value: 0.22987141000414538.
[I 2025-12-06 12:24:37,010] Trial 137 finished with value: 0.19982386925066328 and parameters: {'model_type': 'mlp', 'hidden_dims': '[512, 128]', 'dropout': 0.1318562005049809, 'batch_norm': False, 'lr': 2.9837198191788555e-05, 'weight_decay': 5.9473316530567576e-05, 'epochs': 40, 'loss': 'mae', 'optimizer': 'adam', 'graph_mode': 'off', 'use_snp_selection': False}. Best is trial 122 with value: 0.22987141000414538.
[I 2025-12-06 12:25:02,290] Trial 138 finished with value: 0.22315483243901815 and parameters: {'model_type': 'mlp', 'hidden_dims': '[512, 64]', 'dropout': 0.1434225198902522, 'batch_norm': False, 'lr': 2.6855405362926453e-05, 'weight_decay': 0.00015917459753776083, 'epochs': 65, 'loss': 'mse', 'optimizer': 'adam', 'graph_mode': 'off', 'use_snp_selection': False}. Best is trial 122 with value: 0.22987141000414538.
[I 2025-12-06 12:25:25,483] Trial 139 finished with value: 0.22562038429059453 and parameters: {'model_type': 'mlp', 'hidden_dims': '[512, 128]', 'dropout': 0.17828830701674425, 'batch_norm': False, 'lr': 1.9483548198712935e-05, 'weight_decay': 2.257144332847114e-05, 'epochs': 57, 'loss': 'mse', 'optimizer': 'adam', 'graph_mode': 'off', 'use_snp_selection': False}. Best is trial 122 with value: 0.22987141000414538.
[I 2025-12-06 12:25:45,892] Trial 140 finished with value: 0.2234090204963372 and parameters: {'model_type': 'mlp', 'hidden_dims': '[512, 128]', 'dropout': 0.15758286294508264, 'batch_norm': False, 'lr': 2.2203284933602402e-05, 'weight_decay': 2.9499953107258525e-05, 'epochs': 47, 'loss': 'mse', 'optimizer': 'adam', 'graph_mode': 'off', 'use_snp_selection': False}. Best is trial 122 with value: 0.22987141000414538.
[I 2025-12-06 12:26:09,650] Trial 141 finished with value: 0.2165988459605519 and parameters: {'model_type': 'mlp', 'hidden_dims': '[512, 128]', 'dropout': 0.178049079923217, 'batch_norm': False, 'lr': 1.559706099204152e-05, 'weight_decay': 2.2423964452385094e-05, 'epochs': 59, 'loss': 'mse', 'optimizer': 'adam', 'graph_mode': 'off', 'use_snp_selection': False}. Best is trial 122 with value: 0.22987141000414538.
[I 2025-12-06 12:26:35,146] Trial 142 finished with value: 0.21455098746011414 and parameters: {'model_type': 'mlp', 'hidden_dims': '[512, 128]', 'dropout': 0.16732882496453097, 'batch_norm': False, 'lr': 3.798391797006414e-05, 'weight_decay': 1.3568147824336095e-05, 'epochs': 66, 'loss': 'mse', 'optimizer': 'adam', 'graph_mode': 'off', 'use_snp_selection': False}. Best is trial 122 with value: 0.22987141000414538.
[I 2025-12-06 12:26:57,537] Trial 143 finished with value: 0.2191844984335376 and parameters: {'model_type': 'mlp', 'hidden_dims': '[512, 256]', 'dropout': 0.2028564024622326, 'batch_norm': False, 'lr': 1.9651976692810798e-05, 'weight_decay': 4.201489927993933e-05, 'epochs': 54, 'loss': 'mse', 'optimizer': 'adam', 'graph_mode': 'off', 'use_snp_selection': False}. Best is trial 122 with value: 0.22987141000414538.
[I 2025-12-06 12:27:25,297] Trial 144 finished with value: 0.22686492221434826 and parameters: {'model_type': 'mlp', 'hidden_dims': '[512, 128]', 'dropout': 0.14366919785524504, 'batch_norm': False, 'lr': 3.1966851714508415e-05, 'weight_decay': 0.0002124659936661669, 'epochs': 74, 'loss': 'mse', 'optimizer': 'adam', 'graph_mode': 'off', 'use_snp_selection': False}. Best is trial 122 with value: 0.22987141000414538.
[I 2025-12-06 12:28:46,431] Trial 145 finished with value: 0.20816882286604335 and parameters: {'model_type': 'mlp', 'hidden_dims': '[512, 128]', 'dropout': 0.14333555526500796, 'batch_norm': False, 'lr': 3.206885495597831e-05, 'weight_decay': 5.080315454463367e-05, 'epochs': 268, 'loss': 'mse', 'optimizer': 'adam', 'graph_mode': 'off', 'use_snp_selection': False}. Best is trial 122 with value: 0.22987141000414538.
