[I 2025-12-06 04:33:04,942] Trial 84 finished with value: 0.30876589894765866 and parameters: {'model_type': 'mlp', 'hidden_dims': '[512, 256]', 'dropout': 0.22673315988266776, 'batch_norm': True, 'lr': 0.0004620019240219961, 'weight_decay': 2.3643164211800654e-06, 'epochs': 171, 'loss': 'mae', 'optimizer': 'adam', 'graph_mode': 'off', 'use_snp_selection': False}. Best is trial 58 with value: 0.31528413736659905.
[I 2025-12-06 04:33:36,972] Trial 85 finished with value: 0.3128091864483589 and parameters: {'model_type': 'mlp', 'hidden_dims': '[512, 128]', 'dropout': 0.4214633908769001, 'batch_norm': True, 'lr': 7.136386760192483e-05, 'weight_decay': 5.341464451699496e-07, 'epochs': 152, 'loss': 'mae', 'optimizer': 'adam', 'graph_mode': 'off', 'use_snp_selection': False}. Best is trial 58 with value: 0.31528413736659905.
[I 2025-12-06 04:33:47,666] Trial 86 finished with value: 0.30752193983751325 and parameters: {'model_type': 'mlp', 'hidden_dims': '[128, 64]', 'dropout': 0.11354383896328861, 'batch_norm': True, 'lr': 0.0001961365342605655, 'weight_decay': 9.25609219541837e-06, 'epochs': 120, 'loss': 'mae', 'optimizer': 'adam', 'graph_mode': 'off', 'use_snp_selection': False}. Best is trial 58 with value: 0.31528413736659905.
[I 2025-12-06 04:34:26,524] Trial 87 finished with value: 0.3103413109738129 and parameters: {'model_type': 'mlp', 'hidden_dims': '[512, 128]', 'dropout': 0.2533525480639581, 'batch_norm': True, 'lr': 0.00010345199633534403, 'weight_decay': 3.6554488714083344e-06, 'epochs': 191, 'loss': 'mae', 'optimizer': 'adam', 'graph_mode': 'off', 'use_snp_selection': False}. Best is trial 58 with value: 0.31528413736659905.
[I 2025-12-06 04:34:50,131] Trial 88 finished with value: 0.3135618865041975 and parameters: {'model_type': 'mlp', 'hidden_dims': '[256, 128]', 'dropout': 0.5755575229310093, 'batch_norm': True, 'lr': 8.406664091210853e-05, 'weight_decay': 3.2131548013358e-06, 'epochs': 205, 'loss': 'mae', 'optimizer': 'adam', 'graph_mode': 'off', 'use_snp_selection': False}. Best is trial 58 with value: 0.31528413736659905.
[I 2025-12-06 04:35:40,874] Trial 89 finished with value: 0.3100042040545279 and parameters: {'model_type': 'mlp', 'hidden_dims': '[256, 128]', 'dropout': 0.1678138922354122, 'batch_norm': True, 'lr': 8.320349662414408e-05, 'weight_decay': 0.0005966869876800607, 'epochs': 247, 'loss': 'mae', 'optimizer': 'adam', 'graph_mode': 'off', 'use_snp_selection': True, 'num_snps': 45058}. Best is trial 58 with value: 0.31528413736659905.
[I 2025-12-06 04:36:00,890] Trial 90 finished with value: 0.31008846587676364 and parameters: {'model_type': 'mlp', 'hidden_dims': '[256, 128]', 'dropout': 0.1450274878668336, 'batch_norm': True, 'lr': 3.793470297307252e-05, 'weight_decay': 1.1018825586139606e-06, 'epochs': 167, 'loss': 'mae', 'optimizer': 'adam', 'graph_mode': 'off', 'use_snp_selection': False}. Best is trial 58 with value: 0.31528413736659905.
[I 2025-12-06 04:36:24,347] Trial 91 finished with value: 0.30936842334893033 and parameters: {'model_type': 'mlp', 'hidden_dims': '[256, 128]', 'dropout': 0.20034394270702138, 'batch_norm': True, 'lr': 5.236616759588118e-05, 'weight_decay': 3.2273631612669034e-06, 'epochs': 204, 'loss': 'mae', 'optimizer': 'adam', 'graph_mode': 'off', 'use_snp_selection': False}. Best is trial 58 with value: 0.31528413736659905.
[I 2025-12-06 04:36:49,192] Trial 92 finished with value: 0.30945499197977316 and parameters: {'model_type': 'mlp', 'hidden_dims': '[256, 128]', 'dropout': 0.5743054592177675, 'batch_norm': True, 'lr': 0.00012136804445667672, 'weight_decay': 4.491836959647284e-06, 'epochs': 219, 'loss': 'mae', 'optimizer': 'adam', 'graph_mode': 'off', 'use_snp_selection': False}. Best is trial 58 with value: 0.31528413736659905.
[I 2025-12-06 04:37:29,943] Trial 93 finished with value: 0.3133237808741303 and parameters: {'model_type': 'mlp', 'hidden_dims': '[512, 128]', 'dropout': 0.5416771127764392, 'batch_norm': True, 'lr': 2.5692660674706e-05, 'weight_decay': 5.9160161674210496e-06, 'epochs': 202, 'loss': 'mae', 'optimizer': 'adam', 'graph_mode': 'off', 'use_snp_selection': False}. Best is trial 58 with value: 0.31528413736659905.
[I 2025-12-06 04:38:10,489] Trial 94 finished with value: 0.3054633752958982 and parameters: {'model_type': 'mlp', 'hidden_dims': '[512, 256]', 'dropout': 0.4823559701027379, 'batch_norm': True, 'lr': 1.6356395408411844e-05, 'weight_decay': 1.1979116892793164e-05, 'epochs': 200, 'loss': 'mae', 'optimizer': 'adam', 'graph_mode': 'off', 'use_snp_selection': False}. Best is trial 58 with value: 0.31528413736659905.
[I 2025-12-06 04:38:28,188] Trial 95 finished with value: 0.2915013185728155 and parameters: {'model_type': 'mlp', 'hidden_dims': '[256, 128, 64]', 'dropout': 0.5456338585877202, 'batch_norm': True, 'lr': 1.043865543708804e-05, 'weight_decay': 1.85937981477181e-07, 'epochs': 138, 'loss': 'mae', 'optimizer': 'adam', 'graph_mode': 'off', 'use_snp_selection': False}. Best is trial 58 with value: 0.31528413736659905.
[I 2025-12-06 04:39:04,200] Trial 96 finished with value: 0.30576266988816075 and parameters: {'model_type': 'mlp', 'hidden_dims': '[512, 128]', 'dropout': 0.5197258426318833, 'batch_norm': True, 'lr': 2.2146428191995212e-05, 'weight_decay': 4.953205340814065e-06, 'epochs': 175, 'loss': 'mae', 'optimizer': 'adam', 'graph_mode': 'off', 'use_snp_selection': False}. Best is trial 58 with value: 0.31528413736659905.
[I 2025-12-06 04:39:47,501] Trial 97 finished with value: 0.3152159210562445 and parameters: {'model_type': 'mlp', 'hidden_dims': '[512, 128]', 'dropout': 0.5332310438063184, 'batch_norm': True, 'lr': 2.5267303661709832e-05, 'weight_decay': 2.998178667618413e-07, 'epochs': 217, 'loss': 'mae', 'optimizer': 'adam', 'graph_mode': 'off', 'use_snp_selection': False}. Best is trial 58 with value: 0.31528413736659905.
[I 2025-12-06 04:40:13,088] Trial 98 finished with value: 0.04732627079658749 and parameters: {'model_type': 'mlp', 'hidden_dims': '[256, 128]', 'dropout': 0.5663253359247362, 'batch_norm': False, 'lr': 0.0006707142507370225, 'weight_decay': 3.51878809189822e-07, 'epochs': 231, 'loss': 'mae', 'optimizer': 'adam', 'graph_mode': 'off', 'use_snp_selection': False}. Best is trial 58 with value: 0.31528413736659905.
[I 2025-12-06 04:40:56,956] Trial 99 finished with value: 0.30970290110118326 and parameters: {'model_type': 'mlp', 'hidden_dims': '[512, 128]', 'dropout': 0.5325472621767204, 'batch_norm': True, 'lr': 5.821163374843855e-05, 'weight_decay': 2.6470271841566876e-07, 'epochs': 220, 'loss': 'mse', 'optimizer': 'adam', 'graph_mode': 'off', 'use_snp_selection': False}. Best is trial 58 with value: 0.31528413736659905.
[I 2025-12-06 04:41:39,951] Trial 100 finished with value: 0.3094046579220341 and parameters: {'model_type': 'mlp', 'hidden_dims': '[512, 64]', 'dropout': 0.5821964522189518, 'batch_norm': True, 'lr': 0.0003412860640271471, 'weight_decay': 1.76251454246024e-06, 'epochs': 215, 'loss': 'mae', 'optimizer': 'adam', 'graph_mode': 'off', 'use_snp_selection': False}. Best is trial 58 with value: 0.31528413736659905.
[I 2025-12-06 04:42:46,302] Trial 101 finished with value: 0.3149831775393216 and parameters: {'model_type': 'mlp', 'hidden_dims': '[512, 128]', 'dropout': 0.5417921142537152, 'batch_norm': True, 'lr': 2.8597789132750665e-05, 'weight_decay': 2.4266947868621054e-06, 'epochs': 348, 'loss': 'mae', 'optimizer': 'adam', 'graph_mode': 'off', 'use_snp_selection': False}. Best is trial 58 with value: 0.31528413736659905.
[I 2025-12-06 04:43:19,101] Trial 102 finished with value: 0.30791441748657067 and parameters: {'model_type': 'mlp', 'hidden_dims': '[512, 128]', 'dropout': 0.5058635308688595, 'batch_norm': True, 'lr': 1.9240614138327113e-05, 'weight_decay': 2.474853891617114e-06, 'epochs': 157, 'loss': 'mae', 'optimizer': 'adam', 'graph_mode': 'off', 'use_snp_selection': False}. Best is trial 58 with value: 0.31528413736659905.
[I 2025-12-06 04:44:25,488] Trial 103 finished with value: 0.3083856577411871 and parameters: {'model_type': 'mlp', 'hidden_dims': '[512, 128]', 'dropout': 0.5499516351630114, 'batch_norm': True, 'lr': 4.556956577699906e-05, 'weight_decay': 2.999656610329733e-07, 'epochs': 348, 'loss': 'mae', 'optimizer': 'adam', 'graph_mode': 'off', 'use_snp_selection': False}. Best is trial 58 with value: 0.31528413736659905.
[I 2025-12-06 04:45:26,420] Trial 104 finished with value: 0.30778467290659345 and parameters: {'model_type': 'mlp', 'hidden_dims': '[512, 128]', 'dropout': 0.5183496976402258, 'batch_norm': True, 'lr': 3.068930810439681e-05, 'weight_decay': 1.318519924118529e-07, 'epochs': 317, 'loss': 'mae', 'optimizer': 'adam', 'graph_mode': 'off', 'use_snp_selection': False}. Best is trial 58 with value: 0.31528413736659905.
[I 2025-12-06 04:46:29,131] Trial 105 finished with value: 0.308128155391841 and parameters: {'model_type': 'mlp', 'hidden_dims': '[512, 128]', 'dropout': 0.49316412475548277, 'batch_norm': True, 'lr': 1.3355851180271997e-05, 'weight_decay': 1.4285415566912593e-06, 'epochs': 327, 'loss': 'mae', 'optimizer': 'adam', 'graph_mode': 'off', 'use_snp_selection': False}. Best is trial 58 with value: 0.31528413736659905.
[I 2025-12-06 04:47:34,734] Trial 106 finished with value: 0.3123472833999477 and parameters: {'model_type': 'mlp', 'hidden_dims': '[512, 256]', 'dropout': 0.18686880227266253, 'batch_norm': True, 'lr': 3.6156055253451124e-05, 'weight_decay': 4.818139838906218e-07, 'epochs': 342, 'loss': 'mae', 'optimizer': 'adam', 'graph_mode': 'off', 'use_snp_selection': False}. Best is trial 58 with value: 0.31528413736659905.
[I 2025-12-06 04:48:02,626] Trial 107 finished with value: 0.3038166226775908 and parameters: {'model_type': 'mlp', 'hidden_dims': '[512, 128]', 'dropout': 0.3384141697551572, 'batch_norm': True, 'lr': 2.6269055453330904e-05, 'weight_decay': 7.406045562846388e-07, 'epochs': 129, 'loss': 'mse', 'optimizer': 'adam', 'graph_mode': 'off', 'use_snp_selection': False}. Best is trial 58 with value: 0.31528413736659905.
[I 2025-12-06 04:48:28,124] Trial 108 finished with value: 0.29570484450503437 and parameters: {'model_type': 'mlp', 'hidden_dims': '[128, 64]', 'dropout': 0.5878484651531617, 'batch_norm': True, 'lr': 7.462594770426451e-05, 'weight_decay': 2.219379158319636e-07, 'epochs': 143, 'loss': 'mae', 'optimizer': 'adam', 'graph_mode': 'off', 'use_snp_selection': True, 'num_snps': 11322}. Best is trial 58 with value: 0.31528413736659905.
[I 2025-12-06 04:49:26,588] Trial 109 finished with value: 0.3103933960654094 and parameters: {'model_type': 'mlp', 'hidden_dims': '[512, 128]', 'dropout': 0.5585367398827759, 'batch_norm': True, 'lr': 0.00017329083388119832, 'weight_decay': 1.800935246702337e-07, 'epochs': 304, 'loss': 'mae', 'optimizer': 'adam', 'graph_mode': 'off', 'use_snp_selection': False}. Best is trial 58 with value: 0.31528413736659905.
[I 2025-12-06 04:50:22,127] Trial 110 finished with value: 0.30628871629380944 and parameters: {'model_type': 'mlp', 'hidden_dims': '[512, 64]', 'dropout': 0.20423107779417818, 'batch_norm': True, 'lr': 8.458322037602263e-06, 'weight_decay': 2.288527561120614e-06, 'epochs': 287, 'loss': 'mae', 'optimizer': 'adam', 'graph_mode': 'off', 'use_snp_selection': False}. Best is trial 58 with value: 0.31528413736659905.
[I 2025-12-06 04:51:03,225] Trial 111 finished with value: 0.3083722482321276 and parameters: {'model_type': 'mlp', 'hidden_dims': '[512, 128]', 'dropout': 0.5365211664172882, 'batch_norm': True, 'lr': 1.7942625834135924e-05, 'weight_decay': 3.256256084966313e-06, 'epochs': 204, 'loss': 'mae', 'optimizer': 'adam', 'graph_mode': 'off', 'use_snp_selection': False}. Best is trial 58 with value: 0.31528413736659905.
[I 2025-12-06 04:51:42,558] Trial 112 finished with value: 0.3108092076481146 and parameters: {'model_type': 'mlp', 'hidden_dims': '[512, 128]', 'dropout': 0.5450469104951315, 'batch_norm': True, 'lr': 2.6018184381976308e-05, 'weight_decay': 5.866756233928607e-06, 'epochs': 194, 'loss': 'mae', 'optimizer': 'adam', 'graph_mode': 'off', 'use_snp_selection': False}. Best is trial 58 with value: 0.31528413736659905.
[I 2025-12-06 04:52:28,551] Trial 113 finished with value: 0.30728979050676564 and parameters: {'model_type': 'mlp', 'hidden_dims': '[512, 128]', 'dropout': 0.30266302731269207, 'batch_norm': True, 'lr': 2.3333328704270042e-05, 'weight_decay': 7.943093274655898e-06, 'epochs': 232, 'loss': 'mae', 'optimizer': 'adam', 'graph_mode': 'off', 'use_snp_selection': False}. Best is trial 58 with value: 0.31528413736659905.
[I 2025-12-06 04:53:10,693] Trial 114 finished with value: 0.3108618478068423 and parameters: {'model_type': 'mlp', 'hidden_dims': '[512, 128]', 'dropout': 0.5229309991214521, 'batch_norm': True, 'lr': 4.5032584566592796e-05, 'weight_decay': 3.559102904861749e-05, 'epochs': 210, 'loss': 'mae', 'optimizer': 'adam', 'graph_mode': 'off', 'use_snp_selection': False}. Best is trial 58 with value: 0.31528413736659905.
[I 2025-12-06 04:53:44,396] Trial 115 finished with value: 0.31396783653055343 and parameters: {'model_type': 'mlp', 'hidden_dims': '[512, 128]', 'dropout': 0.575564877366457, 'batch_norm': True, 'lr': 3.2713339613249825e-05, 'weight_decay': 1.0293110462733473e-07, 'epochs': 162, 'loss': 'mae', 'optimizer': 'adam', 'graph_mode': 'off', 'use_snp_selection': False}. Best is trial 58 with value: 0.31528413736659905.
[I 2025-12-06 04:54:15,643] Trial 116 finished with value: 0.3068779667407545 and parameters: {'model_type': 'mlp', 'hidden_dims': '[512, 128]', 'dropout': 0.5773850913218282, 'batch_norm': True, 'lr': 3.407095597814155e-05, 'weight_decay': 1.1002594860612144e-07, 'epochs': 148, 'loss': 'mae', 'optimizer': 'adam', 'graph_mode': 'off', 'use_snp_selection': False}. Best is trial 58 with value: 0.31528413736659905.
[I 2025-12-06 04:54:35,246] Trial 117 finished with value: 0.3031270250967938 and parameters: {'model_type': 'mlp', 'hidden_dims': '[256, 128, 64]', 'dropout': 0.14444993392822736, 'batch_norm': False, 'lr': 6.66664965132794e-05, 'weight_decay': 1.5531449343085172e-07, 'epochs': 164, 'loss': 'mse', 'optimizer': 'adam', 'graph_mode': 'off', 'use_snp_selection': False}. Best is trial 58 with value: 0.31528413736659905.
[I 2025-12-06 04:55:11,580] Trial 118 finished with value: 0.3085383868631788 and parameters: {'model_type': 'mlp', 'hidden_dims': '[512, 128]', 'dropout': 0.5937459965502709, 'batch_norm': True, 'lr': 9.10325156200285e-05, 'weight_decay': 1.2157046012455934e-07, 'epochs': 177, 'loss': 'mae', 'optimizer': 'adam', 'graph_mode': 'off', 'use_snp_selection': False}. Best is trial 58 with value: 0.31528413736659905.
[I 2025-12-06 04:55:44,555] Trial 119 finished with value: 0.31357819055199154 and parameters: {'model_type': 'mlp', 'hidden_dims': '[512, 256]', 'dropout': 0.5641637552688445, 'batch_norm': True, 'lr': 5.0577890933916154e-05, 'weight_decay': 9.231079340302662e-07, 'epochs': 157, 'loss': 'mae', 'optimizer': 'adam', 'graph_mode': 'off', 'use_snp_selection': False}. Best is trial 58 with value: 0.31528413736659905.
[I 2025-12-06 04:56:37,977] Trial 120 finished with value: 0.3131872279233255 and parameters: {'model_type': 'mlp', 'hidden_dims': '[512, 256]', 'dropout': 0.5688710694884597, 'batch_norm': True, 'lr': 5.2468988312027865e-05, 'weight_decay': 8.734562896410779e-07, 'epochs': 273, 'loss': 'mae', 'optimizer': 'adam', 'graph_mode': 'off', 'use_snp_selection': False}. Best is trial 58 with value: 0.31528413736659905.
[I 2025-12-06 04:57:11,096] Trial 121 finished with value: 0.311735615960369 and parameters: {'model_type': 'mlp', 'hidden_dims': '[512, 256]', 'dropout': 0.5605136750870567, 'batch_norm': True, 'lr': 4.677347112974539e-05, 'weight_decay': 6.045238654214435e-07, 'epochs': 158, 'loss': 'mae', 'optimizer': 'adam', 'graph_mode': 'off', 'use_snp_selection': False}. Best is trial 58 with value: 0.31528413736659905.
[I 2025-12-06 04:57:42,929] Trial 122 finished with value: 0.3106178019654954 and parameters: {'model_type': 'mlp', 'hidden_dims': '[512, 256]', 'dropout': 0.5530336778754164, 'batch_norm': True, 'lr': 4.043609593602722e-05, 'weight_decay': 1.0275021208746604e-06, 'epochs': 151, 'loss': 'mae', 'optimizer': 'adam', 'graph_mode': 'off', 'use_snp_selection': False}. Best is trial 58 with value: 0.31528413736659905.
[I 2025-12-06 04:57:57,278] Trial 123 finished with value: 0.2985263145387765 and parameters: {'model_type': 'mlp', 'hidden_dims': '[512, 256]', 'dropout': 0.5323650445325818, 'batch_norm': True, 'lr': 3.1717407660240805e-05, 'weight_decay': 2.690470777056325e-07, 'epochs': 52, 'loss': 'mae', 'optimizer': 'adam', 'graph_mode': 'off', 'use_snp_selection': False}. Best is trial 58 with value: 0.31528413736659905.
[I 2025-12-06 04:58:24,935] Trial 124 finished with value: 0.3086140510492392 and parameters: {'model_type': 'mlp', 'hidden_dims': '[256, 128]', 'dropout': 0.5128244913433668, 'batch_norm': True, 'lr': 6.30113577775587e-05, 'weight_decay': 2.6478329659879135e-06, 'epochs': 251, 'loss': 'mae', 'optimizer': 'adam', 'graph_mode': 'off', 'use_snp_selection': False}. Best is trial 58 with value: 0.31528413736659905.
[I 2025-12-06 04:58:49,803] Trial 125 finished with value: 0.3107072610056277 and parameters: {'model_type': 'mlp', 'hidden_dims': '[512, 128]', 'dropout': 0.16324939353172815, 'batch_norm': True, 'lr': 0.0001039778093071074, 'weight_decay': 1.969061078643396e-06, 'epochs': 112, 'loss': 'mae', 'optimizer': 'adam', 'graph_mode': 'off', 'use_snp_selection': False}. Best is trial 58 with value: 0.31528413736659905.
[I 2025-12-06 04:59:18,789] Trial 126 finished with value: 0.3089222002981972 and parameters: {'model_type': 'mlp', 'hidden_dims': '[512, 256]', 'dropout': 0.5700573126163149, 'batch_norm': True, 'lr': 0.00014819291163771934, 'weight_decay': 3.864783430334901e-07, 'epochs': 135, 'loss': 'mae', 'optimizer': 'adam', 'graph_mode': 'off', 'use_snp_selection': False}. Best is trial 58 with value: 0.31528413736659905.
[I 2025-12-06 04:59:54,031] Trial 127 finished with value: 0.3115024291594347 and parameters: {'model_type': 'mlp', 'hidden_dims': '[512, 128]', 'dropout': 0.13508474064366588, 'batch_norm': True, 'lr': 8.259087484471705e-05, 'weight_decay': 1.1871640094218572e-06, 'epochs': 171, 'loss': 'mae', 'optimizer': 'adam', 'graph_mode': 'off', 'use_snp_selection': False}. Best is trial 58 with value: 0.31528413736659905.
[I 2025-12-06 05:00:47,826] Trial 128 finished with value: 0.3075927658743031 and parameters: {'model_type': 'mlp', 'hidden_dims': '[512, 64]', 'dropout': 0.4020561040071308, 'batch_norm': True, 'lr': 5.603253625252644e-05, 'weight_decay': 1.0323371045884936e-07, 'epochs': 124, 'loss': 'mse', 'optimizer': 'adam', 'graph_mode': 'off', 'use_snp_selection': True, 'num_snps': 51726}. Best is trial 58 with value: 0.31528413736659905.
[I 2025-12-06 05:01:24,946] Trial 129 finished with value: 0.3104541935129205 and parameters: {'model_type': 'mlp', 'hidden_dims': '[512, 128]', 'dropout': 0.5771875706499359, 'batch_norm': True, 'lr': 0.00029703046923083696, 'weight_decay': 1.688324591601631e-06, 'epochs': 182, 'loss': 'mae', 'optimizer': 'adam', 'graph_mode': 'off', 'use_snp_selection': False}. Best is trial 58 with value: 0.31528413736659905.
[I 2025-12-06 05:02:21,563] Trial 130 finished with value: 0.3100595539008103 and parameters: {'model_type': 'mlp', 'hidden_dims': '[512, 128]', 'dropout': 0.5386814543652021, 'batch_norm': True, 'lr': 0.00011227198959762953, 'weight_decay': 2.0202618846078413e-07, 'epochs': 293, 'loss': 'mae', 'optimizer': 'adam', 'graph_mode': 'off', 'use_snp_selection': False}. Best is trial 58 with value: 0.31528413736659905.
[I 2025-12-06 05:03:00,157] Trial 131 finished with value: 0.3095725391379446 and parameters: {'model_type': 'mlp', 'hidden_dims': '[512, 128]', 'dropout': 0.5510536644282107, 'batch_norm': True, 'lr': 2.7986221355011014e-05, 'weight_decay': 3.8973958781139046e-06, 'epochs': 190, 'loss': 'mae', 'optimizer': 'adam', 'graph_mode': 'off', 'use_snp_selection': False}. Best is trial 58 with value: 0.31528413736659905.
[I 2025-12-06 05:03:34,322] Trial 132 finished with value: 0.3104751950508995 and parameters: {'model_type': 'mlp', 'hidden_dims': '[512, 128]', 'dropout': 0.5412438041113073, 'batch_norm': True, 'lr': 3.642492103505986e-05, 'weight_decay': 9.959209582407446e-06, 'epochs': 165, 'loss': 'mae', 'optimizer': 'adam', 'graph_mode': 'off', 'use_snp_selection': False}. Best is trial 58 with value: 0.31528413736659905.
[I 2025-12-06 05:04:18,871] Trial 133 finished with value: 0.30102159353404645 and parameters: {'model_type': 'mlp', 'hidden_dims': '[512, 128]', 'dropout': 0.5625848969527318, 'batch_norm': True, 'lr': 2.0559611809079006e-05, 'weight_decay': 3.022650031857454e-06, 'epochs': 224, 'loss': 'mae', 'optimizer': 'adam', 'graph_mode': 'off', 'use_snp_selection': False}. Best is trial 58 with value: 0.31528413736659905.
[I 2025-12-06 05:04:48,855] Trial 134 finished with value: 0.3015083655390748 and parameters: {'model_type': 'mlp', 'hidden_dims': '[512, 128]', 'dropout': 0.525041509261115, 'batch_norm': True, 'lr': 1.3959646500070298e-05, 'weight_decay': 1.364576192138806e-05, 'epochs': 141, 'loss': 'mae', 'optimizer': 'adam', 'graph_mode': 'off', 'use_snp_selection': False}. Best is trial 58 with value: 0.31528413736659905.
[I 2025-12-06 05:05:31,838] Trial 135 finished with value: 0.3093610472599194 and parameters: {'model_type': 'mlp', 'hidden_dims': '[512, 128]', 'dropout': 0.11674572973671116, 'batch_norm': True, 'lr': 2.596738668726931e-05, 'weight_decay': 4.667286500413885e-06, 'epochs': 215, 'loss': 'mae', 'optimizer': 'adam', 'graph_mode': 'off', 'use_snp_selection': False}. Best is trial 58 with value: 0.31528413736659905.
