[I 2025-12-05 16:22:38,666] Trial 73 finished with value: 0.0868175049691788 and parameters: {'model_type': 'mlp', 'hidden_dims': '[128, 64]', 'dropout': 0.26460235418555755, 'batch_norm': True, 'lr': 0.00044056400581509196, 'weight_decay': 3.059827636358413e-07, 'epochs': 225, 'loss': 'mse', 'optimizer': 'adam', 'graph_mode': 'off', 'use_snp_selection': True, 'num_snps': 43082}. Best is trial 17 with value: 0.11157945279125966.
[I 2025-12-05 16:22:40,619] Trial 74 finished with value: 0.07119607459150336 and parameters: {'model_type': 'mlp', 'hidden_dims': '[128, 64]', 'dropout': 0.3081967314597598, 'batch_norm': True, 'lr': 0.00013113105798877195, 'weight_decay': 4.4904667266655083e-07, 'epochs': 188, 'loss': 'mse', 'optimizer': 'adam', 'graph_mode': 'off', 'use_snp_selection': True, 'num_snps': 39135}. Best is trial 17 with value: 0.11157945279125966.
[I 2025-12-05 16:22:42,017] Trial 75 finished with value: 0.09766863459226553 and parameters: {'model_type': 'mlp', 'hidden_dims': '[128, 64]', 'dropout': 0.3481874025730255, 'batch_norm': True, 'lr': 0.00033370989097891913, 'weight_decay': 1.2738378740288735e-07, 'epochs': 209, 'loss': 'mse', 'optimizer': 'adam', 'graph_mode': 'off', 'use_snp_selection': True, 'num_snps': 22899}. Best is trial 17 with value: 0.11157945279125966.
[I 2025-12-05 16:22:43,540] Trial 76 finished with value: 0.09007407510957653 and parameters: {'model_type': 'mlp', 'hidden_dims': '[512, 256]', 'dropout': 0.3962777390038146, 'batch_norm': True, 'lr': 0.0008487052184147661, 'weight_decay': 1.9299995101747895e-07, 'epochs': 199, 'loss': 'mse', 'optimizer': 'adam', 'graph_mode': 'off', 'use_snp_selection': True, 'num_snps': 24034}. Best is trial 17 with value: 0.11157945279125966.
[I 2025-12-05 16:22:44,991] Trial 77 finished with value: 0.10211027877414239 and parameters: {'model_type': 'mlp', 'hidden_dims': '[256, 128]', 'dropout': 0.2924027534724317, 'batch_norm': True, 'lr': 0.0003444758551500274, 'weight_decay': 6.43064810909647e-07, 'epochs': 205, 'loss': 'mae', 'optimizer': 'adam', 'graph_mode': 'off', 'use_snp_selection': True, 'num_snps': 19164}. Best is trial 17 with value: 0.11157945279125966.
[I 2025-12-05 16:22:46,106] Trial 78 finished with value: 0.08508428024237782 and parameters: {'model_type': 'mlp', 'hidden_dims': '[256, 128]', 'dropout': 0.34849541672711576, 'batch_norm': True, 'lr': 0.00034065623556063827, 'weight_decay': 1.3683957292119488e-06, 'epochs': 209, 'loss': 'mae', 'optimizer': 'adam', 'graph_mode': 'off', 'use_snp_selection': False}. Best is trial 17 with value: 0.11157945279125966.
[I 2025-12-05 16:22:47,454] Trial 79 finished with value: 0.06806553852408362 and parameters: {'model_type': 'mlp', 'hidden_dims': '[256, 128]', 'dropout': 0.5194318798738115, 'batch_norm': True, 'lr': 0.000164212191875973, 'weight_decay': 6.87230966143001e-07, 'epochs': 169, 'loss': 'mae', 'optimizer': 'adam', 'graph_mode': 'off', 'use_snp_selection': True, 'num_snps': 18306}. Best is trial 17 with value: 0.11157945279125966.
[I 2025-12-05 16:22:48,533] Trial 80 finished with value: 0.07067874468445545 and parameters: {'model_type': 'mlp', 'hidden_dims': '[256, 128]', 'dropout': 0.10914931702323669, 'batch_norm': False, 'lr': 0.00020320514546705813, 'weight_decay': 2.44594496480007e-06, 'epochs': 185, 'loss': 'mae', 'optimizer': 'adam', 'graph_mode': 'off', 'use_snp_selection': False}. Best is trial 17 with value: 0.11157945279125966.
[I 2025-12-05 16:22:49,701] Trial 81 finished with value: 0.08395870762129609 and parameters: {'model_type': 'mlp', 'hidden_dims': '[256, 128]', 'dropout': 0.29503512463775144, 'batch_norm': True, 'lr': 0.0006700377049833592, 'weight_decay': 1.4686465291547487e-07, 'epochs': 208, 'loss': 'mae', 'optimizer': 'adam', 'graph_mode': 'off', 'use_snp_selection': True, 'num_snps': 12156}. Best is trial 17 with value: 0.11157945279125966.
[I 2025-12-05 16:22:51,349] Trial 82 finished with value: 0.08482847164281185 and parameters: {'model_type': 'mlp', 'hidden_dims': '[512, 64]', 'dropout': 0.3208453803619201, 'batch_norm': True, 'lr': 0.0004577488649570135, 'weight_decay': 3.529101339229226e-07, 'epochs': 235, 'loss': 'mae', 'optimizer': 'adam', 'graph_mode': 'off', 'use_snp_selection': True, 'num_snps': 22887}. Best is trial 17 with value: 0.11157945279125966.
[I 2025-12-05 16:22:52,959] Trial 83 finished with value: 0.09009742164010447 and parameters: {'model_type': 'mlp', 'hidden_dims': '[512, 128]', 'dropout': 0.5627788624955598, 'batch_norm': True, 'lr': 0.00033474245140673395, 'weight_decay': 5.980735616060951e-07, 'epochs': 304, 'loss': 'mae', 'optimizer': 'adam', 'graph_mode': 'off', 'use_snp_selection': True, 'num_snps': 21018}. Best is trial 17 with value: 0.11157945279125966.
[I 2025-12-05 16:22:54,664] Trial 84 finished with value: 0.08393798441509148 and parameters: {'model_type': 'mlp', 'hidden_dims': '[256, 128]', 'dropout': 0.2518022051743861, 'batch_norm': True, 'lr': 0.0005864681063183001, 'weight_decay': 2.097399086299901e-05, 'epochs': 313, 'loss': 'mae', 'optimizer': 'adam', 'graph_mode': 'off', 'use_snp_selection': True, 'num_snps': 27729}. Best is trial 17 with value: 0.11157945279125966.
[I 2025-12-05 16:22:56,008] Trial 85 finished with value: 0.09554543615432547 and parameters: {'model_type': 'mlp', 'hidden_dims': '[128, 64]', 'dropout': 0.3050947535463243, 'batch_norm': True, 'lr': 0.00039408348524061374, 'weight_decay': 9.360838710506596e-07, 'epochs': 245, 'loss': 'mse', 'optimizer': 'adam', 'graph_mode': 'off', 'use_snp_selection': True, 'num_snps': 15100}. Best is trial 17 with value: 0.11157945279125966.
[I 2025-12-05 16:22:57,440] Trial 86 finished with value: 0.09969300810635415 and parameters: {'model_type': 'mlp', 'hidden_dims': '[128, 64]', 'dropout': 0.376252857018036, 'batch_norm': True, 'lr': 0.0002555278189298822, 'weight_decay': 3.396838141184006e-05, 'epochs': 242, 'loss': 'mae', 'optimizer': 'adam', 'graph_mode': 'off', 'use_snp_selection': True, 'num_snps': 16761}. Best is trial 17 with value: 0.11157945279125966.
[I 2025-12-05 16:22:58,786] Trial 87 finished with value: 0.057135674959809285 and parameters: {'model_type': 'mlp', 'hidden_dims': '[128, 64]', 'dropout': 0.36635215220411815, 'batch_norm': True, 'lr': 0.0002572281698127624, 'weight_decay': 9.097565757865043e-07, 'epochs': 243, 'loss': 'mse', 'optimizer': 'adam', 'graph_mode': 'off', 'use_snp_selection': True, 'num_snps': 16606}. Best is trial 17 with value: 0.11157945279125966.
[I 2025-12-05 16:23:00,106] Trial 88 finished with value: 0.007762762608071508 and parameters: {'model_type': 'mlp', 'hidden_dims': '[128, 64]', 'dropout': 0.39774799727442506, 'batch_norm': True, 'lr': 2.0672167021334857e-06, 'weight_decay': 1.7778366857479925e-06, 'epochs': 201, 'loss': 'mae', 'optimizer': 'adam', 'graph_mode': 'off', 'use_snp_selection': True, 'num_snps': 19087}. Best is trial 17 with value: 0.11157945279125966.
[I 2025-12-05 16:23:01,078] Trial 89 finished with value: 0.0912660331272295 and parameters: {'model_type': 'mlp', 'hidden_dims': '[128, 64]', 'dropout': 0.38071461349821395, 'batch_norm': True, 'lr': 0.00040761738870845267, 'weight_decay': 3.0425622353948257e-05, 'epochs': 257, 'loss': 'mae', 'optimizer': 'adam', 'graph_mode': 'off', 'use_snp_selection': False}. Best is trial 17 with value: 0.11157945279125966.
[I 2025-12-05 16:23:02,620] Trial 90 finished with value: 0.05932789881844655 and parameters: {'model_type': 'mlp', 'hidden_dims': '[128, 64]', 'dropout': 0.4407184628961204, 'batch_norm': True, 'lr': 1.7027022356816734e-05, 'weight_decay': 0.00016582374600799326, 'epochs': 228, 'loss': 'mse', 'optimizer': 'adam', 'graph_mode': 'off', 'use_snp_selection': True, 'num_snps': 22488}. Best is trial 17 with value: 0.11157945279125966.
[I 2025-12-05 16:23:03,818] Trial 91 finished with value: 0.08861368525379909 and parameters: {'model_type': 'mlp', 'hidden_dims': '[128, 64]', 'dropout': 0.3421133201203388, 'batch_norm': True, 'lr': 0.0003081972355954249, 'weight_decay': 1.0826595854179493e-05, 'epochs': 281, 'loss': 'mae', 'optimizer': 'adam', 'graph_mode': 'off', 'use_snp_selection': True, 'num_snps': 10187}. Best is trial 17 with value: 0.11157945279125966.
[I 2025-12-05 16:23:06,453] Trial 92 finished with value: 0.08470188334623477 and parameters: {'model_type': 'mlp', 'hidden_dims': '[128, 64]', 'dropout': 0.532900945917004, 'batch_norm': True, 'lr': 0.00024253888113486496, 'weight_decay': 5.04466361719482e-07, 'epochs': 241, 'loss': 'mae', 'optimizer': 'adam', 'graph_mode': 'off', 'use_snp_selection': True, 'num_snps': 59533}. Best is trial 17 with value: 0.11157945279125966.
[I 2025-12-05 16:23:07,418] Trial 93 finished with value: 0.0772176191181941 and parameters: {'model_type': 'mlp', 'hidden_dims': '[128, 64]', 'dropout': 0.3562139355442966, 'batch_norm': True, 'lr': 0.00015010354436292888, 'weight_decay': 7.520768972107007e-05, 'epochs': 180, 'loss': 'mae', 'optimizer': 'adam', 'graph_mode': 'off', 'use_snp_selection': True, 'num_snps': 4909}. Best is trial 17 with value: 0.11157945279125966.
[I 2025-12-05 16:23:09,704] Trial 94 finished with value: 0.08220574223516483 and parameters: {'model_type': 'mlp', 'hidden_dims': '[256, 128, 64]', 'dropout': 0.3109762566836487, 'batch_norm': True, 'lr': 0.000374753897690401, 'weight_decay': 3.0424659179292216e-07, 'epochs': 167, 'loss': 'mae', 'optimizer': 'adam', 'graph_mode': 'off', 'use_snp_selection': True, 'num_snps': 45801}. Best is trial 17 with value: 0.11157945279125966.
[I 2025-12-05 16:23:11,351] Trial 95 finished with value: 0.059871481943593104 and parameters: {'model_type': 'mlp', 'hidden_dims': '[256, 128]', 'dropout': 0.5852911706345808, 'batch_norm': True, 'lr': 0.00019500099433075767, 'weight_decay': 1.3215718959050084e-05, 'epochs': 213, 'loss': 'mae', 'optimizer': 'adam', 'graph_mode': 'off', 'use_snp_selection': True, 'num_snps': 30393}. Best is trial 17 with value: 0.11157945279125966.
[I 2025-12-05 16:23:12,603] Trial 96 finished with value: 0.07613314200357012 and parameters: {'model_type': 'mlp', 'hidden_dims': '[512, 64]', 'dropout': 0.28195831710139774, 'batch_norm': True, 'lr': 0.0005325114295824096, 'weight_decay': 1.309408668857841e-06, 'epochs': 193, 'loss': 'mae', 'optimizer': 'adam', 'graph_mode': 'off', 'use_snp_selection': True, 'num_snps': 16045}. Best is trial 17 with value: 0.11157945279125966.
[I 2025-12-05 16:23:13,513] Trial 97 finished with value: 0.06431401894144231 and parameters: {'model_type': 'mlp', 'hidden_dims': '[128, 64]', 'dropout': 0.5483664662447179, 'batch_norm': True, 'lr': 3.858785069260124e-05, 'weight_decay': 7.453320562943447e-07, 'epochs': 202, 'loss': 'mae', 'optimizer': 'adam', 'graph_mode': 'off', 'use_snp_selection': False}. Best is trial 17 with value: 0.11157945279125966.
[I 2025-12-05 16:23:16,742] Trial 98 finished with value: 0.07040878548813315 and parameters: {'model_type': 'mlp', 'hidden_dims': '[512, 128]', 'dropout': 0.305791193938634, 'batch_norm': False, 'lr': 0.00044168060518335624, 'weight_decay': 4.4662441770290603e-05, 'epochs': 319, 'loss': 'mse', 'optimizer': 'adam', 'graph_mode': 'off', 'use_snp_selection': True, 'num_snps': 52020}. Best is trial 17 with value: 0.11157945279125966.
[I 2025-12-05 16:23:19,132] Trial 99 finished with value: 0.08557498091174266 and parameters: {'model_type': 'mlp', 'hidden_dims': '[128, 64]', 'dropout': 0.5706220324633, 'batch_norm': True, 'lr': 6.750037367885144e-05, 'weight_decay': 5.909234369760796e-06, 'epochs': 291, 'loss': 'mae', 'optimizer': 'adam', 'graph_mode': 'off', 'use_snp_selection': True, 'num_snps': 49240}. Best is trial 17 with value: 0.11157945279125966.
[I 2025-12-05 16:23:20,247] Trial 100 finished with value: 0.07584435788609444 and parameters: {'model_type': 'mlp', 'hidden_dims': '[256, 128]', 'dropout': 0.4246966213580704, 'batch_norm': True, 'lr': 0.00011741152380104878, 'weight_decay': 3.0100000773164614e-06, 'epochs': 264, 'loss': 'mse', 'optimizer': 'adam', 'graph_mode': 'off', 'use_snp_selection': True, 'num_snps': 6846}. Best is trial 17 with value: 0.11157945279125966.
[I 2025-12-05 16:23:21,507] Trial 101 finished with value: 0.08358016015746554 and parameters: {'model_type': 'mlp', 'hidden_dims': '[512, 256]', 'dropout': 0.2990254890478102, 'batch_norm': True, 'lr': 0.0006800663578306866, 'weight_decay': 2.5066182038879176e-07, 'epochs': 234, 'loss': 'mse', 'optimizer': 'adam', 'graph_mode': 'off', 'use_snp_selection': True, 'num_snps': 12945}. Best is trial 17 with value: 0.11157945279125966.
[I 2025-12-05 16:23:22,615] Trial 102 finished with value: 0.09031078388287263 and parameters: {'model_type': 'mlp', 'hidden_dims': '[512, 256]', 'dropout': 0.23567123209460908, 'batch_norm': True, 'lr': 0.000812208921003551, 'weight_decay': 3.14659938376001e-05, 'epochs': 106, 'loss': 'mse', 'optimizer': 'adam', 'graph_mode': 'off', 'use_snp_selection': True, 'num_snps': 14387}. Best is trial 17 with value: 0.11157945279125966.
[I 2025-12-05 16:23:24,102] Trial 103 finished with value: 0.08765110765203772 and parameters: {'model_type': 'mlp', 'hidden_dims': '[256, 128, 64]', 'dropout': 0.2875787076584097, 'batch_norm': True, 'lr': 0.0003568824379750501, 'weight_decay': 4.1259944177154766e-07, 'epochs': 250, 'loss': 'mse', 'optimizer': 'adam', 'graph_mode': 'off', 'use_snp_selection': True, 'num_snps': 17670}. Best is trial 17 with value: 0.11157945279125966.
[I 2025-12-05 16:23:25,749] Trial 104 finished with value: 0.08642391533417068 and parameters: {'model_type': 'mlp', 'hidden_dims': '[512, 256]', 'dropout': 0.3222253623671073, 'batch_norm': True, 'lr': 0.0005211234560313534, 'weight_decay': 1.6446153372568376e-07, 'epochs': 283, 'loss': 'mse', 'optimizer': 'adam', 'graph_mode': 'off', 'use_snp_selection': True, 'num_snps': 20632}. Best is trial 17 with value: 0.11157945279125966.
[I 2025-12-05 16:23:26,959] Trial 105 finished with value: 0.08382518284214228 and parameters: {'model_type': 'mlp', 'hidden_dims': '[512, 64]', 'dropout': 0.26916087217476503, 'batch_norm': True, 'lr': 0.0006310605392260199, 'weight_decay': 1.2977399937531535e-07, 'epochs': 221, 'loss': 'mse', 'optimizer': 'adam', 'graph_mode': 'off', 'use_snp_selection': True, 'num_snps': 10629}. Best is trial 17 with value: 0.11157945279125966.
[I 2025-12-05 16:23:28,874] Trial 106 finished with value: 0.08926670395135322 and parameters: {'model_type': 'mlp', 'hidden_dims': '[512, 128]', 'dropout': 0.3416118984130962, 'batch_norm': True, 'lr': 0.0002542709658086655, 'weight_decay': 1.9034748301508164e-07, 'epochs': 300, 'loss': 'mae', 'optimizer': 'adam', 'graph_mode': 'off', 'use_snp_selection': False}. Best is trial 17 with value: 0.11157945279125966.
[I 2025-12-05 16:23:29,942] Trial 107 finished with value: 0.08444333152604253 and parameters: {'model_type': 'mlp', 'hidden_dims': '[128, 64]', 'dropout': 0.37134623770368475, 'batch_norm': True, 'lr': 0.0009322032122199865, 'weight_decay': 1.0640529480549984e-07, 'epochs': 270, 'loss': 'mse', 'optimizer': 'adam', 'graph_mode': 'off', 'use_snp_selection': True, 'num_snps': 7616}. Best is trial 17 with value: 0.11157945279125966.
[I 2025-12-05 16:23:33,379] Trial 108 finished with value: 0.09085082250651101 and parameters: {'model_type': 'mlp', 'hidden_dims': '[512, 256]', 'dropout': 0.45124851507011526, 'batch_norm': True, 'lr': 8.459250280213728e-05, 'weight_decay': 1.7584697063846612e-05, 'epochs': 326, 'loss': 'mae', 'optimizer': 'adam', 'graph_mode': 'off', 'use_snp_selection': True, 'num_snps': 55872}. Best is trial 17 with value: 0.11157945279125966.
[I 2025-12-05 16:23:34,511] Trial 109 finished with value: 0.07944352625608363 and parameters: {'model_type': 'mlp', 'hidden_dims': '[128, 64]', 'dropout': 0.3294474329999765, 'batch_norm': True, 'lr': 0.00017420176740825773, 'weight_decay': 1.028928897820294e-06, 'epochs': 337, 'loss': 'mae', 'optimizer': 'adam', 'graph_mode': 'off', 'use_snp_selection': False}. Best is trial 17 with value: 0.11157945279125966.
[I 2025-12-05 16:23:35,671] Trial 110 finished with value: 0.07934155375751024 and parameters: {'model_type': 'mlp', 'hidden_dims': '[256, 128]', 'dropout': 0.259801547882635, 'batch_norm': True, 'lr': 0.0002935763818648482, 'weight_decay': 5.364015724317978e-07, 'epochs': 125, 'loss': 'mse', 'optimizer': 'adam', 'graph_mode': 'off', 'use_snp_selection': True, 'num_snps': 13793}. Best is trial 17 with value: 0.11157945279125966.
[I 2025-12-05 16:23:37,512] Trial 111 finished with value: 0.079469003964088 and parameters: {'model_type': 'mlp', 'hidden_dims': '[128, 64]', 'dropout': 0.33066484106920263, 'batch_norm': True, 'lr': 0.00028912805634798237, 'weight_decay': 1.26658005287721e-07, 'epochs': 221, 'loss': 'mse', 'optimizer': 'adam', 'graph_mode': 'off', 'use_snp_selection': True, 'num_snps': 34869}. Best is trial 17 with value: 0.11157945279125966.
[I 2025-12-05 16:23:39,600] Trial 112 finished with value: 0.08174655211819382 and parameters: {'model_type': 'mlp', 'hidden_dims': '[128, 64]', 'dropout': 0.35795762873599396, 'batch_norm': True, 'lr': 0.0002183982782768122, 'weight_decay': 2.826925761724484e-07, 'epochs': 232, 'loss': 'mse', 'optimizer': 'adam', 'graph_mode': 'off', 'use_snp_selection': True, 'num_snps': 42043}. Best is trial 17 with value: 0.11157945279125966.
[I 2025-12-05 16:23:41,473] Trial 113 finished with value: 0.07188375271240395 and parameters: {'model_type': 'mlp', 'hidden_dims': '[128, 64]', 'dropout': 0.3160488283361632, 'batch_norm': True, 'lr': 0.00045973269129069886, 'weight_decay': 2.0397658441928562e-07, 'epochs': 257, 'loss': 'mse', 'optimizer': 'adam', 'graph_mode': 'off', 'use_snp_selection': True, 'num_snps': 33711}. Best is trial 17 with value: 0.11157945279125966.
[I 2025-12-05 16:23:42,804] Trial 114 finished with value: 0.09645627892226755 and parameters: {'model_type': 'mlp', 'hidden_dims': '[128, 64]', 'dropout': 0.5928046936189637, 'batch_norm': True, 'lr': 0.00037365161972361706, 'weight_decay': 1.5351877206342422e-07, 'epochs': 221, 'loss': 'mse', 'optimizer': 'adam', 'graph_mode': 'off', 'use_snp_selection': True, 'num_snps': 18969}. Best is trial 17 with value: 0.11157945279125966.
[I 2025-12-05 16:23:44,427] Trial 115 finished with value: 0.08106612989387284 and parameters: {'model_type': 'mlp', 'hidden_dims': '[256, 128, 64]', 'dropout': 0.5941418645544282, 'batch_norm': True, 'lr': 0.0003848905187291787, 'weight_decay': 1.6171144156553044e-07, 'epochs': 306, 'loss': 'mse', 'optimizer': 'adam', 'graph_mode': 'off', 'use_snp_selection': True, 'num_snps': 19150}. Best is trial 17 with value: 0.11157945279125966.
[I 2025-12-05 16:23:45,389] Trial 116 finished with value: 0.07346635639213588 and parameters: {'model_type': 'mlp', 'hidden_dims': '[128, 64]', 'dropout': 0.5796913933370895, 'batch_norm': True, 'lr': 0.0007578137870905667, 'weight_decay': 3.705821021023291e-07, 'epochs': 212, 'loss': 'mae', 'optimizer': 'adam', 'graph_mode': 'off', 'use_snp_selection': True, 'num_snps': 3760}. Best is trial 17 with value: 0.11157945279125966.
[I 2025-12-05 16:23:46,582] Trial 117 finished with value: 0.060398999940513044 and parameters: {'model_type': 'mlp', 'hidden_dims': '[512, 64]', 'dropout': 0.5644075718016053, 'batch_norm': False, 'lr': 0.0003306804928942901, 'weight_decay': 1.0009960523742817e-07, 'epochs': 83, 'loss': 'mse', 'optimizer': 'adam', 'graph_mode': 'off', 'use_snp_selection': True, 'num_snps': 15818}. Best is trial 17 with value: 0.11157945279125966.
[I 2025-12-05 16:23:48,176] Trial 118 finished with value: 0.08401800086479666 and parameters: {'model_type': 'mlp', 'hidden_dims': '[512, 128]', 'dropout': 0.27878435389306483, 'batch_norm': True, 'lr': 0.0005704727562530062, 'weight_decay': 2.481315791548623e-07, 'epochs': 206, 'loss': 'mae', 'optimizer': 'adam', 'graph_mode': 'off', 'use_snp_selection': False}. Best is trial 17 with value: 0.11157945279125966.
[I 2025-12-05 16:23:49,753] Trial 119 finished with value: 0.07866786948043178 and parameters: {'model_type': 'mlp', 'hidden_dims': '[512, 256]', 'dropout': 0.5552298081590156, 'batch_norm': True, 'lr': 0.0008682394673351068, 'weight_decay': 1.4616633162143856e-07, 'epochs': 242, 'loss': 'mse', 'optimizer': 'adam', 'graph_mode': 'off', 'use_snp_selection': True, 'num_snps': 23752}. Best is trial 17 with value: 0.11157945279125966.
[I 2025-12-05 16:23:51,293] Trial 120 finished with value: 0.08260630592450396 and parameters: {'model_type': 'mlp', 'hidden_dims': '[256, 128]', 'dropout': 0.5890409650971125, 'batch_norm': True, 'lr': 0.0004771136261889932, 'weight_decay': 8.563205154444112e-07, 'epochs': 224, 'loss': 'mae', 'optimizer': 'adam', 'graph_mode': 'off', 'use_snp_selection': True, 'num_snps': 26236}. Best is trial 17 with value: 0.11157945279125966.
[I 2025-12-05 16:23:53,131] Trial 121 finished with value: 0.05371076222795476 and parameters: {'model_type': 'mlp', 'hidden_dims': '[128, 64]', 'dropout': 0.5989148381352323, 'batch_norm': True, 'lr': 0.0002539096337880297, 'weight_decay': 1.8386132460241202e-07, 'epochs': 139, 'loss': 'mse', 'optimizer': 'adam', 'graph_mode': 'off', 'use_snp_selection': True, 'num_snps': 37756}. Best is trial 17 with value: 0.11157945279125966.
[I 2025-12-05 16:23:54,588] Trial 122 finished with value: 0.08852837068792221 and parameters: {'model_type': 'mlp', 'hidden_dims': '[128, 64]', 'dropout': 0.29953193781109716, 'batch_norm': True, 'lr': 0.00031065368144687656, 'weight_decay': 1.192945547234998e-07, 'epochs': 220, 'loss': 'mse', 'optimizer': 'adam', 'graph_mode': 'off', 'use_snp_selection': True, 'num_snps': 20255}. Best is trial 17 with value: 0.11157945279125966.
