[I 2025-12-05 15:31:19,069] Trial 118 finished with value: 0.023326578530469634 and parameters: {'model_type': 'mlp', 'hidden_dims': '[128, 64]', 'dropout': 0.5653782476116005, 'batch_norm': False, 'lr': 0.00022212624582925518, 'weight_decay': 3.489151774075839e-06, 'epochs': 56, 'loss': 'mse', 'optimizer': 'adam', 'graph_mode': 'off', 'use_snp_selection': False}. Best is trial 18 with value: 0.10370338241819542.
[I 2025-12-05 15:31:19,906] Trial 119 finished with value: 0.0411189268839844 and parameters: {'model_type': 'mlp', 'hidden_dims': '[256, 128]', 'dropout': 0.42944554873545643, 'batch_norm': True, 'lr': 2.4483636651533788e-05, 'weight_decay': 5.069629878432575e-07, 'epochs': 63, 'loss': 'mae', 'optimizer': 'adam', 'graph_mode': 'off', 'use_snp_selection': False}. Best is trial 18 with value: 0.10370338241819542.
[I 2025-12-05 15:31:21,440] Trial 120 finished with value: 0.04304909581715535 and parameters: {'model_type': 'mlp', 'hidden_dims': '[512, 256]', 'dropout': 0.40221372631361174, 'batch_norm': False, 'lr': 0.0003508395263614034, 'weight_decay': 3.120218602812583e-05, 'epochs': 72, 'loss': 'mse', 'optimizer': 'adam', 'graph_mode': 'off', 'use_snp_selection': True, 'num_snps': 22662}. Best is trial 18 with value: 0.10370338241819542.
[I 2025-12-05 15:31:22,600] Trial 121 finished with value: 0.0714389865948852 and parameters: {'model_type': 'mlp', 'hidden_dims': '[256, 128]', 'dropout': 0.37120254308523914, 'batch_norm': False, 'lr': 9.688678299050752e-05, 'weight_decay': 7.776005351108937e-07, 'epochs': 185, 'loss': 'mse', 'optimizer': 'adam', 'graph_mode': 'off', 'use_snp_selection': False}. Best is trial 18 with value: 0.10370338241819542.
[I 2025-12-05 15:31:23,869] Trial 122 finished with value: 0.06647343473267074 and parameters: {'model_type': 'mlp', 'hidden_dims': '[256, 128]', 'dropout': 0.10003794090714312, 'batch_norm': False, 'lr': 4.104257051956012e-05, 'weight_decay': 1.1879461082777909e-06, 'epochs': 217, 'loss': 'mse', 'optimizer': 'adam', 'graph_mode': 'off', 'use_snp_selection': False}. Best is trial 18 with value: 0.10370338241819542.
[I 2025-12-05 15:31:25,093] Trial 123 finished with value: 0.05908797456132599 and parameters: {'model_type': 'mlp', 'hidden_dims': '[256, 128]', 'dropout': 0.46454502159823696, 'batch_norm': False, 'lr': 0.0002750590106243974, 'weight_decay': 1.3718197664513463e-07, 'epochs': 209, 'loss': 'mse', 'optimizer': 'adam', 'graph_mode': 'off', 'use_snp_selection': False}. Best is trial 18 with value: 0.10370338241819542.
[I 2025-12-05 15:31:26,272] Trial 124 finished with value: 0.0870086120920427 and parameters: {'model_type': 'mlp', 'hidden_dims': '[256, 128]', 'dropout': 0.30622139511903657, 'batch_norm': False, 'lr': 0.00018320215963559493, 'weight_decay': 1.7160988085698839e-06, 'epochs': 193, 'loss': 'mse', 'optimizer': 'adam', 'graph_mode': 'off', 'use_snp_selection': False}. Best is trial 18 with value: 0.10370338241819542.
[I 2025-12-05 15:31:27,453] Trial 125 finished with value: 0.05377110740212901 and parameters: {'model_type': 'mlp', 'hidden_dims': '[256, 128]', 'dropout': 0.34316866772633264, 'batch_norm': False, 'lr': 0.00018108336097729438, 'weight_decay': 1.7687003300817751e-06, 'epochs': 194, 'loss': 'mse', 'optimizer': 'adam', 'graph_mode': 'off', 'use_snp_selection': False}. Best is trial 18 with value: 0.10370338241819542.
[I 2025-12-05 15:31:28,535] Trial 126 finished with value: 0.07745441933320292 and parameters: {'model_type': 'mlp', 'hidden_dims': '[256, 128, 64]', 'dropout': 0.29851191630784946, 'batch_norm': False, 'lr': 0.00012579373811494454, 'weight_decay': 2.588001371044835e-06, 'epochs': 155, 'loss': 'mse', 'optimizer': 'adam', 'graph_mode': 'off', 'use_snp_selection': False}. Best is trial 18 with value: 0.10370338241819542.
[I 2025-12-05 15:31:29,405] Trial 127 finished with value: 0.05697661646316224 and parameters: {'model_type': 'mlp', 'hidden_dims': '[128, 64]', 'dropout': 0.3104121232714926, 'batch_norm': True, 'lr': 0.0001565654035588131, 'weight_decay': 1.4370641936218107e-06, 'epochs': 172, 'loss': 'mse', 'optimizer': 'adam', 'graph_mode': 'off', 'use_snp_selection': False}. Best is trial 18 with value: 0.10370338241819542.
[I 2025-12-05 15:31:30,568] Trial 128 finished with value: 0.03303918490817326 and parameters: {'model_type': 'mlp', 'hidden_dims': '[512, 256]', 'dropout': 0.1423747052727696, 'batch_norm': False, 'lr': 0.00024201326240460904, 'weight_decay': 9.107114053384797e-07, 'epochs': 40, 'loss': 'mae', 'optimizer': 'adam', 'graph_mode': 'off', 'use_snp_selection': True, 'num_snps': 14203}. Best is trial 18 with value: 0.10370338241819542.
[I 2025-12-05 15:31:32,706] Trial 129 finished with value: 0.07256504023170306 and parameters: {'model_type': 'mlp', 'hidden_dims': '[512, 64]', 'dropout': 0.11959096283986234, 'batch_norm': True, 'lr': 0.0007431879073659621, 'weight_decay': 4.297024544242118e-06, 'epochs': 224, 'loss': 'mse', 'optimizer': 'adam', 'graph_mode': 'off', 'use_snp_selection': False}. Best is trial 18 with value: 0.10370338241819542.
[I 2025-12-05 15:31:33,575] Trial 130 finished with value: 0.04828011677651812 and parameters: {'model_type': 'mlp', 'hidden_dims': '[256, 128]', 'dropout': 0.27514979988627364, 'batch_norm': False, 'lr': 0.00031103213408003216, 'weight_decay': 2.396858918238221e-06, 'epochs': 81, 'loss': 'mse', 'optimizer': 'adam', 'graph_mode': 'off', 'use_snp_selection': False}. Best is trial 18 with value: 0.10370338241819542.
[I 2025-12-05 15:31:34,771] Trial 131 finished with value: 0.01321831233930313 and parameters: {'model_type': 'mlp', 'hidden_dims': '[256, 128]', 'dropout': 0.44568933338145844, 'batch_norm': False, 'lr': 0.0004802110794020671, 'weight_decay': 3.131536031079185e-06, 'epochs': 199, 'loss': 'mse', 'optimizer': 'adam', 'graph_mode': 'off', 'use_snp_selection': False}. Best is trial 18 with value: 0.10370338241819542.
[I 2025-12-05 15:31:35,981] Trial 132 finished with value: 0.06727633970308237 and parameters: {'model_type': 'mlp', 'hidden_dims': '[256, 128]', 'dropout': 0.3337563038067781, 'batch_norm': False, 'lr': 0.0002129258042836005, 'weight_decay': 3.325315453181494e-07, 'epochs': 204, 'loss': 'mse', 'optimizer': 'adam', 'graph_mode': 'off', 'use_snp_selection': False}. Best is trial 18 with value: 0.10370338241819542.
[I 2025-12-05 15:31:37,281] Trial 133 finished with value: 0.06946732174161006 and parameters: {'model_type': 'mlp', 'hidden_dims': '[256, 128]', 'dropout': 0.3867386875666861, 'batch_norm': False, 'lr': 8.45219310092595e-05, 'weight_decay': 6.031476797437577e-07, 'epochs': 229, 'loss': 'mse', 'optimizer': 'adam', 'graph_mode': 'off', 'use_snp_selection': False}. Best is trial 18 with value: 0.10370338241819542.
[I 2025-12-05 15:31:38,515] Trial 134 finished with value: 0.07545406373050417 and parameters: {'model_type': 'mlp', 'hidden_dims': '[256, 128]', 'dropout': 0.3220591037284014, 'batch_norm': False, 'lr': 2.4677527367388004e-05, 'weight_decay': 5.5675273327810585e-06, 'epochs': 211, 'loss': 'mse', 'optimizer': 'adam', 'graph_mode': 'off', 'use_snp_selection': False}. Best is trial 18 with value: 0.10370338241819542.
[I 2025-12-05 15:31:40,910] Trial 135 finished with value: 0.0693534301238756 and parameters: {'model_type': 'mlp', 'hidden_dims': '[128, 64]', 'dropout': 0.30344898205472215, 'batch_norm': False, 'lr': 0.000569808945233425, 'weight_decay': 1.9629628951010276e-06, 'epochs': 188, 'loss': 'mse', 'optimizer': 'adam', 'graph_mode': 'off', 'use_snp_selection': True, 'num_snps': 51752}. Best is trial 18 with value: 0.10370338241819542.
[I 2025-12-05 15:31:42,806] Trial 136 finished with value: 0.08621936982174168 and parameters: {'model_type': 'mlp', 'hidden_dims': '[512, 256]', 'dropout': 0.39900454938011054, 'batch_norm': False, 'lr': 0.00018608440426276385, 'weight_decay': 8.676373671021684e-06, 'epochs': 177, 'loss': 'mae', 'optimizer': 'adam', 'graph_mode': 'off', 'use_snp_selection': False}. Best is trial 18 with value: 0.10370338241819542.
[I 2025-12-05 15:31:44,554] Trial 137 finished with value: 0.06794174791505506 and parameters: {'model_type': 'mlp', 'hidden_dims': '[512, 256]', 'dropout': 0.4116508185488085, 'batch_norm': True, 'lr': 0.0008737632925480753, 'weight_decay': 9.114519648473538e-06, 'epochs': 165, 'loss': 'mae', 'optimizer': 'adam', 'graph_mode': 'off', 'use_snp_selection': False}. Best is trial 18 with value: 0.10370338241819542.
[I 2025-12-05 15:31:46,377] Trial 138 finished with value: 0.05318311452088633 and parameters: {'model_type': 'mlp', 'hidden_dims': '[512, 256]', 'dropout': 0.35787647965050506, 'batch_norm': False, 'lr': 0.0002032738154784083, 'weight_decay': 7.607306586754653e-06, 'epochs': 179, 'loss': 'mae', 'optimizer': 'adam', 'graph_mode': 'off', 'use_snp_selection': False}. Best is trial 18 with value: 0.10370338241819542.
[I 2025-12-05 15:31:47,459] Trial 139 finished with value: 0.04603748900321218 and parameters: {'model_type': 'mlp', 'hidden_dims': '[512, 256]', 'dropout': 0.4010551533518876, 'batch_norm': False, 'lr': 0.000259310335341238, 'weight_decay': 1.3018237830264185e-05, 'epochs': 50, 'loss': 'mae', 'optimizer': 'adam', 'graph_mode': 'off', 'use_snp_selection': False}. Best is trial 18 with value: 0.10370338241819542.
[I 2025-12-05 15:31:49,909] Trial 140 finished with value: 0.08092825347348337 and parameters: {'model_type': 'mlp', 'hidden_dims': '[512, 256]', 'dropout': 0.5597749774589829, 'batch_norm': True, 'lr': 0.00010636216980740663, 'weight_decay': 4.155086396570749e-06, 'epochs': 104, 'loss': 'mae', 'optimizer': 'adam', 'graph_mode': 'off', 'use_snp_selection': True, 'num_snps': 43757}. Best is trial 18 with value: 0.10370338241819542.
[I 2025-12-05 15:31:52,366] Trial 141 finished with value: 0.08913617334493835 and parameters: {'model_type': 'mlp', 'hidden_dims': '[512, 256]', 'dropout': 0.5446288478948101, 'batch_norm': True, 'lr': 0.00010511471726122713, 'weight_decay': 4.205479778371803e-06, 'epochs': 88, 'loss': 'mae', 'optimizer': 'adam', 'graph_mode': 'off', 'use_snp_selection': True, 'num_snps': 44037}. Best is trial 18 with value: 0.10370338241819542.
[I 2025-12-05 15:31:55,334] Trial 142 finished with value: 0.0536109640312489 and parameters: {'model_type': 'mlp', 'hidden_dims': '[512, 256]', 'dropout': 0.5025639133919355, 'batch_norm': True, 'lr': 0.00014159616714100039, 'weight_decay': 6.001318416436918e-06, 'epochs': 90, 'loss': 'mae', 'optimizer': 'adam', 'graph_mode': 'off', 'use_snp_selection': True, 'num_snps': 56023}. Best is trial 18 with value: 0.10370338241819542.
[I 2025-12-05 15:31:56,807] Trial 143 finished with value: 0.08182896276115148 and parameters: {'model_type': 'mlp', 'hidden_dims': '[512, 256]', 'dropout': 0.5257641835050562, 'batch_norm': True, 'lr': 0.00015340850782212453, 'weight_decay': 5.03426545951839e-06, 'epochs': 85, 'loss': 'mae', 'optimizer': 'adam', 'graph_mode': 'off', 'use_snp_selection': True, 'num_snps': 19041}. Best is trial 18 with value: 0.10370338241819542.
[I 2025-12-05 15:31:59,560] Trial 144 finished with value: 0.0739937402857942 and parameters: {'model_type': 'mlp', 'hidden_dims': '[512, 256]', 'dropout': 0.540918898179466, 'batch_norm': True, 'lr': 0.00018889232361662798, 'weight_decay': 3.0604209911596627e-06, 'epochs': 96, 'loss': 'mae', 'optimizer': 'adam', 'graph_mode': 'off', 'use_snp_selection': True, 'num_snps': 51011}. Best is trial 18 with value: 0.10370338241819542.
[I 2025-12-05 15:32:03,220] Trial 145 finished with value: 0.07841434887650793 and parameters: {'model_type': 'mlp', 'hidden_dims': '[512, 256]', 'dropout': 0.5741494067728744, 'batch_norm': True, 'lr': 0.0003535001649956139, 'weight_decay': 1.0393305948313339e-05, 'epochs': 196, 'loss': 'mae', 'optimizer': 'adam', 'graph_mode': 'off', 'use_snp_selection': True, 'num_snps': 59212}. Best is trial 18 with value: 0.10370338241819542.
[I 2025-12-05 15:32:04,427] Trial 146 finished with value: 0.09033038104238604 and parameters: {'model_type': 'mlp', 'hidden_dims': '[512, 256]', 'dropout': 0.5879603148208496, 'batch_norm': False, 'lr': 0.0001784795637352028, 'weight_decay': 1.7168199040645428e-05, 'epochs': 62, 'loss': 'mae', 'optimizer': 'adam', 'graph_mode': 'off', 'use_snp_selection': False}. Best is trial 18 with value: 0.10370338241819542.
[I 2025-12-05 15:32:05,529] Trial 147 finished with value: 0.043969818000806994 and parameters: {'model_type': 'mlp', 'hidden_dims': '[512, 256]', 'dropout': 0.5949788352614986, 'batch_norm': False, 'lr': 0.00016890262638649092, 'weight_decay': 1.765802869431907e-05, 'epochs': 59, 'loss': 'mae', 'optimizer': 'adam', 'graph_mode': 'off', 'use_snp_selection': False}. Best is trial 18 with value: 0.10370338241819542.
[I 2025-12-05 15:32:07,274] Trial 148 finished with value: 0.0575216436982782 and parameters: {'model_type': 'mlp', 'hidden_dims': '[512, 256]', 'dropout': 0.5892299387428702, 'batch_norm': False, 'lr': 0.00013120047874368374, 'weight_decay': 2.754069383086051e-05, 'epochs': 72, 'loss': 'mae', 'optimizer': 'adam', 'graph_mode': 'off', 'use_snp_selection': True, 'num_snps': 27745}. Best is trial 18 with value: 0.10370338241819542.
[I 2025-12-05 15:32:08,303] Trial 149 finished with value: 0.07066268013841266 and parameters: {'model_type': 'mlp', 'hidden_dims': '[512, 256]', 'dropout': 0.5586998922060483, 'batch_norm': False, 'lr': 0.0002165284407506965, 'weight_decay': 2.127105408844188e-05, 'epochs': 45, 'loss': 'mae', 'optimizer': 'adam', 'graph_mode': 'off', 'use_snp_selection': False}. Best is trial 18 with value: 0.10370338241819542.
[I 2025-12-05 15:32:10,623] Trial 0 finished with value: 0.06945909596887513 and parameters: {'model_type': 'mlp', 'hidden_dims': '[128, 64]', 'dropout': 0.199031432379812, 'batch_norm': True, 'lr': 1.8408544111075837e-06, 'weight_decay': 5.5136510071208614e-05, 'epochs': 336, 'loss': 'mae', 'optimizer': 'adam', 'graph_mode': 'off', 'use_snp_selection': True, 'num_snps': 43862}. Best is trial 0 with value: 0.06945909596887513.
[I 2025-12-05 15:32:11,840] Trial 1 finished with value: 0.09926342990100627 and parameters: {'model_type': 'mlp', 'hidden_dims': '[256, 128]', 'dropout': 0.4370668075331726, 'batch_norm': True, 'lr': 7.133471581159139e-05, 'weight_decay': 1.128633586803549e-05, 'epochs': 242, 'loss': 'mae', 'optimizer': 'adam', 'graph_mode': 'off', 'use_snp_selection': False}. Best is trial 1 with value: 0.09926342990100627.
[I 2025-12-05 15:32:12,930] Trial 2 finished with value: 0.016850256354505693 and parameters: {'model_type': 'mlp', 'hidden_dims': '[256, 128, 64]', 'dropout': 0.41314357415569625, 'batch_norm': False, 'lr': 3.952233718592101e-06, 'weight_decay': 0.00026754769258252603, 'epochs': 149, 'loss': 'mse', 'optimizer': 'adam', 'graph_mode': 'off', 'use_snp_selection': True, 'num_snps': 11571}. Best is trial 1 with value: 0.09926342990100627.
[I 2025-12-05 15:32:15,204] Trial 3 finished with value: 0.10822437682949822 and parameters: {'model_type': 'mlp', 'hidden_dims': '[512, 64]', 'dropout': 0.5938127374509361, 'batch_norm': False, 'lr': 5.67704586114731e-06, 'weight_decay': 2.4518087630137052e-05, 'epochs': 320, 'loss': 'mae', 'optimizer': 'adam', 'graph_mode': 'off', 'use_snp_selection': False}. Best is trial 3 with value: 0.10822437682949822.
[I 2025-12-05 15:32:17,647] Trial 4 finished with value: 0.022843346720615623 and parameters: {'model_type': 'mlp', 'hidden_dims': '[512, 128]', 'dropout': 0.25746343592134413, 'batch_norm': True, 'lr': 1.3467657668402788e-06, 'weight_decay': 0.00033087251918647806, 'epochs': 277, 'loss': 'mse', 'optimizer': 'adam', 'graph_mode': 'off', 'use_snp_selection': True, 'num_snps': 36675}. Best is trial 3 with value: 0.10822437682949822.
[I 2025-12-05 15:32:19,547] Trial 5 finished with value: 0.03228361790152634 and parameters: {'model_type': 'mlp', 'hidden_dims': '[512, 64]', 'dropout': 0.38275350994408375, 'batch_norm': True, 'lr': 1.5586664309232824e-06, 'weight_decay': 0.0008227664668621182, 'epochs': 145, 'loss': 'mae', 'optimizer': 'adam', 'graph_mode': 'off', 'use_snp_selection': True, 'num_snps': 32148}. Best is trial 3 with value: 0.10822437682949822.
[I 2025-12-05 15:32:20,648] Trial 6 finished with value: 0.09095895918849543 and parameters: {'model_type': 'mlp', 'hidden_dims': '[256, 128]', 'dropout': 0.3930109900265879, 'batch_norm': False, 'lr': 4.892964372128395e-05, 'weight_decay': 1.5809549317992182e-06, 'epochs': 199, 'loss': 'mse', 'optimizer': 'adam', 'graph_mode': 'off', 'use_snp_selection': False}. Best is trial 3 with value: 0.10822437682949822.
[I 2025-12-05 15:32:21,846] Trial 7 finished with value: 0.11301695530821886 and parameters: {'model_type': 'mlp', 'hidden_dims': '[512, 256]', 'dropout': 0.15343979219678458, 'batch_norm': True, 'lr': 6.234003099047341e-05, 'weight_decay': 3.894760610535477e-07, 'epochs': 97, 'loss': 'mse', 'optimizer': 'adam', 'graph_mode': 'off', 'use_snp_selection': False}. Best is trial 7 with value: 0.11301695530821886.
[I 2025-12-05 15:32:24,042] Trial 8 finished with value: 0.12059041491749767 and parameters: {'model_type': 'mlp', 'hidden_dims': '[512, 128]', 'dropout': 0.10743001231661406, 'batch_norm': True, 'lr': 0.00023728538449271062, 'weight_decay': 1.7629071578048637e-05, 'epochs': 312, 'loss': 'mae', 'optimizer': 'adam', 'graph_mode': 'off', 'use_snp_selection': False}. Best is trial 8 with value: 0.12059041491749767.
[I 2025-12-05 15:32:25,602] Trial 9 finished with value: 0.11070315318669952 and parameters: {'model_type': 'mlp', 'hidden_dims': '[512, 64]', 'dropout': 0.14505336736221927, 'batch_norm': True, 'lr': 5.8619638388111826e-05, 'weight_decay': 6.200156172669308e-07, 'epochs': 175, 'loss': 'mse', 'optimizer': 'adam', 'graph_mode': 'off', 'use_snp_selection': False}. Best is trial 8 with value: 0.12059041491749767.
[I 2025-12-05 15:32:26,643] Trial 10 finished with value: 0.04680093967964404 and parameters: {'model_type': 'mlp', 'hidden_dims': '[512, 128]', 'dropout': 0.2800030442581858, 'batch_norm': False, 'lr': 0.0004919806695968258, 'weight_decay': 2.9953888095455486e-06, 'epochs': 55, 'loss': 'mae', 'optimizer': 'adam', 'graph_mode': 'off', 'use_snp_selection': False}. Best is trial 8 with value: 0.12059041491749767.
[I 2025-12-05 15:32:27,731] Trial 11 finished with value: 0.1192626411385369 and parameters: {'model_type': 'mlp', 'hidden_dims': '[512, 256]', 'dropout': 0.10095648685224448, 'batch_norm': True, 'lr': 0.0003926892266729099, 'weight_decay': 3.172181990533228e-07, 'epochs': 70, 'loss': 'mse', 'optimizer': 'adam', 'graph_mode': 'off', 'use_snp_selection': False}. Best is trial 8 with value: 0.12059041491749767.
[I 2025-12-05 15:32:28,675] Trial 12 finished with value: 0.11939322175927734 and parameters: {'model_type': 'mlp', 'hidden_dims': '[512, 256]', 'dropout': 0.10344600881777158, 'batch_norm': True, 'lr': 0.0006753264773209732, 'weight_decay': 1.3081036432574914e-07, 'epochs': 40, 'loss': 'mae', 'optimizer': 'adam', 'graph_mode': 'off', 'use_snp_selection': False}. Best is trial 8 with value: 0.12059041491749767.
[I 2025-12-05 15:32:30,605] Trial 13 finished with value: 0.12554297740943787 and parameters: {'model_type': 'mlp', 'hidden_dims': '[512, 128]', 'dropout': 0.24294613148916022, 'batch_norm': True, 'lr': 0.00020263148232071683, 'weight_decay': 1.0885943577911259e-07, 'epochs': 253, 'loss': 'mae', 'optimizer': 'adam', 'graph_mode': 'off', 'use_snp_selection': False}. Best is trial 13 with value: 0.12554297740943787.
[I 2025-12-05 15:32:32,622] Trial 14 finished with value: 0.10520193642772223 and parameters: {'model_type': 'mlp', 'hidden_dims': '[512, 128]', 'dropout': 0.28397504683850705, 'batch_norm': True, 'lr': 0.00017558188744418174, 'weight_decay': 4.57067734295802e-06, 'epochs': 271, 'loss': 'mae', 'optimizer': 'adam', 'graph_mode': 'off', 'use_snp_selection': False}. Best is trial 13 with value: 0.12554297740943787.
[I 2025-12-05 15:32:34,760] Trial 15 finished with value: 0.10851400643607471 and parameters: {'model_type': 'mlp', 'hidden_dims': '[512, 128]', 'dropout': 0.22335347277447043, 'batch_norm': True, 'lr': 0.00018478936662210077, 'weight_decay': 6.682546297843178e-05, 'epochs': 297, 'loss': 'mae', 'optimizer': 'adam', 'graph_mode': 'off', 'use_snp_selection': False}. Best is trial 13 with value: 0.12554297740943787.
[I 2025-12-05 15:32:36,634] Trial 16 finished with value: 0.07892000549128311 and parameters: {'model_type': 'mlp', 'hidden_dims': '[512, 128]', 'dropout': 0.31933752608504873, 'batch_norm': True, 'lr': 1.2586985041154999e-05, 'weight_decay': 1.0765286122019607e-05, 'epochs': 232, 'loss': 'mae', 'optimizer': 'adam', 'graph_mode': 'off', 'use_snp_selection': False}. Best is trial 13 with value: 0.12554297740943787.
[I 2025-12-05 15:32:37,732] Trial 17 finished with value: 0.11320784047511186 and parameters: {'model_type': 'mlp', 'hidden_dims': '[128, 64]', 'dropout': 0.489356533221193, 'batch_norm': True, 'lr': 0.00016638026344127548, 'weight_decay': 1.3398043894594233e-06, 'epochs': 350, 'loss': 'mae', 'optimizer': 'adam', 'graph_mode': 'off', 'use_snp_selection': False}. Best is trial 13 with value: 0.12554297740943787.
[I 2025-12-05 15:32:40,602] Trial 18 finished with value: 0.0990782487334223 and parameters: {'model_type': 'mlp', 'hidden_dims': '[256, 128, 64]', 'dropout': 0.18825375894851226, 'batch_norm': False, 'lr': 0.0009898808870711364, 'weight_decay': 3.8406508332565465e-05, 'epochs': 240, 'loss': 'mae', 'optimizer': 'adam', 'graph_mode': 'off', 'use_snp_selection': True, 'num_snps': 58241}. Best is trial 13 with value: 0.12554297740943787.
[I 2025-12-05 15:32:42,796] Trial 19 finished with value: 0.10736799941368258 and parameters: {'model_type': 'mlp', 'hidden_dims': '[512, 128]', 'dropout': 0.3376781722252936, 'batch_norm': True, 'lr': 1.61677566690156e-05, 'weight_decay': 1.1354159408743119e-07, 'epochs': 301, 'loss': 'mae', 'optimizer': 'adam', 'graph_mode': 'off', 'use_snp_selection': False}. Best is trial 13 with value: 0.12554297740943787.
