[I 2025-12-05 15:46:35,668] Trial 82 finished with value: 0.05456641660590843 and parameters: {'model_type': 'mlp', 'hidden_dims': '[128, 64]', 'dropout': 0.11672305973119275, 'batch_norm': False, 'lr': 9.442272089408879e-06, 'weight_decay': 7.85974560808062e-06, 'epochs': 227, 'loss': 'mse', 'optimizer': 'adam', 'graph_mode': 'off', 'use_snp_selection': False}. Best is trial 25 with value: 0.0824597717905614.
[I 2025-12-05 15:46:36,466] Trial 83 finished with value: 0.03494340667346293 and parameters: {'model_type': 'mlp', 'hidden_dims': '[128, 64]', 'dropout': 0.1386006019086905, 'batch_norm': False, 'lr': 1.852933598862837e-05, 'weight_decay': 0.00010023413180663966, 'epochs': 181, 'loss': 'mse', 'optimizer': 'adam', 'graph_mode': 'off', 'use_snp_selection': False}. Best is trial 25 with value: 0.0824597717905614.
[I 2025-12-05 15:46:37,272] Trial 84 finished with value: 0.05015578188672224 and parameters: {'model_type': 'mlp', 'hidden_dims': '[128, 64]', 'dropout': 0.15393259065797604, 'batch_norm': False, 'lr': 2.715164838610728e-06, 'weight_decay': 0.00016099499881720012, 'epochs': 200, 'loss': 'mse', 'optimizer': 'adam', 'graph_mode': 'off', 'use_snp_selection': False}. Best is trial 25 with value: 0.0824597717905614.
[I 2025-12-05 15:46:39,114] Trial 85 finished with value: 0.06580513944668175 and parameters: {'model_type': 'mlp', 'hidden_dims': '[512, 64]', 'dropout': 0.12623856226782432, 'batch_norm': False, 'lr': 2.5188181459402056e-05, 'weight_decay': 2.3207164365138746e-07, 'epochs': 274, 'loss': 'mse', 'optimizer': 'adam', 'graph_mode': 'off', 'use_snp_selection': False}. Best is trial 25 with value: 0.0824597717905614.
[I 2025-12-05 15:46:40,711] Trial 86 finished with value: 0.04305902008585065 and parameters: {'model_type': 'mlp', 'hidden_dims': '[512, 64]', 'dropout': 0.11354383896328861, 'batch_norm': False, 'lr': 7.895106845608946e-06, 'weight_decay': 2.981021459533933e-07, 'epochs': 212, 'loss': 'mse', 'optimizer': 'adam', 'graph_mode': 'off', 'use_snp_selection': False}. Best is trial 25 with value: 0.0824597717905614.
[I 2025-12-05 15:46:41,870] Trial 87 finished with value: 0.06655527502572613 and parameters: {'model_type': 'mlp', 'hidden_dims': '[256, 128]', 'dropout': 0.1655057229568272, 'batch_norm': False, 'lr': 1.6361725873193958e-05, 'weight_decay': 1.261172517994071e-07, 'epochs': 252, 'loss': 'mae', 'optimizer': 'adam', 'graph_mode': 'off', 'use_snp_selection': False}. Best is trial 25 with value: 0.0824597717905614.
[I 2025-12-05 15:46:42,762] Trial 88 finished with value: 0.030848458699914292 and parameters: {'model_type': 'mlp', 'hidden_dims': '[128, 64]', 'dropout': 0.14250403792943486, 'batch_norm': False, 'lr': 3.2230659451000535e-05, 'weight_decay': 7.403903976093162e-05, 'epochs': 246, 'loss': 'mse', 'optimizer': 'adam', 'graph_mode': 'off', 'use_snp_selection': False}. Best is trial 25 with value: 0.0824597717905614.
[I 2025-12-05 15:46:45,150] Trial 89 finished with value: 0.04574494966358137 and parameters: {'model_type': 'mlp', 'hidden_dims': '[256, 128, 64]', 'dropout': 0.10297471902275626, 'batch_norm': False, 'lr': 4.4353399133738607e-05, 'weight_decay': 0.0005966869876800607, 'epochs': 238, 'loss': 'mse', 'optimizer': 'adam', 'graph_mode': 'off', 'use_snp_selection': True, 'num_snps': 45058}. Best is trial 25 with value: 0.0824597717905614.
[I 2025-12-05 15:46:46,525] Trial 90 finished with value: 0.0375455334847408 and parameters: {'model_type': 'mlp', 'hidden_dims': '[512, 64]', 'dropout': 0.15180981665350796, 'batch_norm': False, 'lr': 1.246633579609716e-05, 'weight_decay': 4.399689546387888e-05, 'epochs': 129, 'loss': 'mae', 'optimizer': 'adam', 'graph_mode': 'off', 'use_snp_selection': False}. Best is trial 25 with value: 0.0824597717905614.
[I 2025-12-05 15:46:47,743] Trial 91 finished with value: 0.04095632981708638 and parameters: {'model_type': 'mlp', 'hidden_dims': '[256, 128]', 'dropout': 0.12985808443574456, 'batch_norm': False, 'lr': 1.7309560442022915e-05, 'weight_decay': 1.266927587249181e-07, 'epochs': 251, 'loss': 'mae', 'optimizer': 'adam', 'graph_mode': 'off', 'use_snp_selection': False}. Best is trial 25 with value: 0.0824597717905614.
[I 2025-12-05 15:46:48,792] Trial 92 finished with value: 0.04524668244762689 and parameters: {'model_type': 'mlp', 'hidden_dims': '[256, 128]', 'dropout': 0.16676808026657014, 'batch_norm': False, 'lr': 7.106453322872655e-05, 'weight_decay': 1.8895900602952822e-07, 'epochs': 164, 'loss': 'mae', 'optimizer': 'adam', 'graph_mode': 'off', 'use_snp_selection': False}. Best is trial 25 with value: 0.0824597717905614.
[I 2025-12-05 15:46:49,960] Trial 93 finished with value: 0.06379397810557375 and parameters: {'model_type': 'mlp', 'hidden_dims': '[256, 128]', 'dropout': 0.1807594409267454, 'batch_norm': False, 'lr': 2.1556324105810788e-05, 'weight_decay': 1.7800015255616525e-07, 'epochs': 225, 'loss': 'mae', 'optimizer': 'adam', 'graph_mode': 'off', 'use_snp_selection': False}. Best is trial 25 with value: 0.0824597717905614.
[I 2025-12-05 15:46:51,190] Trial 94 finished with value: 0.05521356593042379 and parameters: {'model_type': 'mlp', 'hidden_dims': '[256, 128]', 'dropout': 0.15978479708492938, 'batch_norm': False, 'lr': 1.5687029599000714e-05, 'weight_decay': 3.3867274873694774e-07, 'epochs': 256, 'loss': 'mae', 'optimizer': 'adam', 'graph_mode': 'off', 'use_snp_selection': False}. Best is trial 25 with value: 0.0824597717905614.
[I 2025-12-05 15:46:52,744] Trial 95 finished with value: 0.049585440987835315 and parameters: {'model_type': 'mlp', 'hidden_dims': '[512, 128]', 'dropout': 0.11190564304067563, 'batch_norm': False, 'lr': 2.5401172575378558e-05, 'weight_decay': 4.0699307852418884e-07, 'epochs': 207, 'loss': 'mae', 'optimizer': 'adam', 'graph_mode': 'off', 'use_snp_selection': False}. Best is trial 25 with value: 0.0824597717905614.
[I 2025-12-05 15:46:53,935] Trial 96 finished with value: 0.05305924890362458 and parameters: {'model_type': 'mlp', 'hidden_dims': '[256, 128]', 'dropout': 0.1916700201543255, 'batch_norm': False, 'lr': 7.183054292400944e-06, 'weight_decay': 1.1908140756278515e-07, 'epochs': 243, 'loss': 'mae', 'optimizer': 'adam', 'graph_mode': 'off', 'use_snp_selection': False}. Best is trial 25 with value: 0.0824597717905614.
[I 2025-12-05 15:46:55,570] Trial 97 finished with value: 0.046615746457977975 and parameters: {'model_type': 'mlp', 'hidden_dims': '[512, 64]', 'dropout': 0.12219861986631803, 'batch_norm': False, 'lr': 9.117081653970022e-05, 'weight_decay': 1.0158226790704436e-07, 'epochs': 217, 'loss': 'mse', 'optimizer': 'adam', 'graph_mode': 'off', 'use_snp_selection': False}. Best is trial 25 with value: 0.0824597717905614.
[I 2025-12-05 15:46:57,399] Trial 98 finished with value: 0.03318951557611016 and parameters: {'model_type': 'mlp', 'hidden_dims': '[512, 256]', 'dropout': 0.2065218113485517, 'batch_norm': True, 'lr': 3.17691860025005e-05, 'weight_decay': 2.115732972538642e-07, 'epochs': 269, 'loss': 'mae', 'optimizer': 'adam', 'graph_mode': 'off', 'use_snp_selection': False}. Best is trial 25 with value: 0.0824597717905614.
[I 2025-12-05 15:46:58,396] Trial 99 finished with value: 0.047638180885492126 and parameters: {'model_type': 'mlp', 'hidden_dims': '[256, 128]', 'dropout': 0.13897763790271916, 'batch_norm': False, 'lr': 3.588451191796357e-05, 'weight_decay': 2.586699062954774e-07, 'epochs': 155, 'loss': 'mse', 'optimizer': 'adam', 'graph_mode': 'off', 'use_snp_selection': False}. Best is trial 25 with value: 0.0824597717905614.
[I 2025-12-05 15:46:59,975] Trial 100 finished with value: 0.05826169613020479 and parameters: {'model_type': 'mlp', 'hidden_dims': '[512, 64]', 'dropout': 0.16729755624901455, 'batch_norm': True, 'lr': 5.803873447819973e-05, 'weight_decay': 1.634552083734972e-05, 'epochs': 194, 'loss': 'mse', 'optimizer': 'adam', 'graph_mode': 'off', 'use_snp_selection': False}. Best is trial 25 with value: 0.0824597717905614.
[I 2025-12-05 15:47:01,899] Trial 101 finished with value: 0.060419868960226615 and parameters: {'model_type': 'mlp', 'hidden_dims': '[512, 64]', 'dropout': 0.13023486682896718, 'batch_norm': False, 'lr': 2.6672625882673445e-05, 'weight_decay': 1.5518057108474736e-07, 'epochs': 290, 'loss': 'mse', 'optimizer': 'adam', 'graph_mode': 'off', 'use_snp_selection': False}. Best is trial 25 with value: 0.0824597717905614.
[I 2025-12-05 15:47:03,722] Trial 102 finished with value: 0.06323180097191644 and parameters: {'model_type': 'mlp', 'hidden_dims': '[512, 64]', 'dropout': 0.12460197113286467, 'batch_norm': False, 'lr': 2.2487193033345747e-05, 'weight_decay': 2.3930943051456334e-07, 'epochs': 278, 'loss': 'mse', 'optimizer': 'adam', 'graph_mode': 'off', 'use_snp_selection': False}. Best is trial 25 with value: 0.0824597717905614.
[I 2025-12-05 15:47:05,588] Trial 103 finished with value: 0.03479039629436395 and parameters: {'model_type': 'mlp', 'hidden_dims': '[512, 64]', 'dropout': 0.14970098021521142, 'batch_norm': False, 'lr': 4.671947149244597e-05, 'weight_decay': 5.593611293045605e-07, 'epochs': 275, 'loss': 'mse', 'optimizer': 'adam', 'graph_mode': 'off', 'use_snp_selection': False}. Best is trial 25 with value: 0.0824597717905614.
[I 2025-12-05 15:47:07,357] Trial 104 finished with value: 0.06919841738867677 and parameters: {'model_type': 'mlp', 'hidden_dims': '[512, 64]', 'dropout': 0.10996931923206889, 'batch_norm': False, 'lr': 1.0515227924424506e-05, 'weight_decay': 4.400200951762973e-07, 'epochs': 254, 'loss': 'mse', 'optimizer': 'adam', 'graph_mode': 'off', 'use_snp_selection': False}. Best is trial 25 with value: 0.0824597717905614.
[I 2025-12-05 15:47:08,544] Trial 105 finished with value: 0.039367585430454856 and parameters: {'model_type': 'mlp', 'hidden_dims': '[256, 128, 64]', 'dropout': 0.11355241354524956, 'batch_norm': False, 'lr': 5.71638229255535e-06, 'weight_decay': 4.387469394073544e-07, 'epochs': 256, 'loss': 'mse', 'optimizer': 'adam', 'graph_mode': 'off', 'use_snp_selection': False}. Best is trial 25 with value: 0.0824597717905614.
[I 2025-12-05 15:47:10,269] Trial 106 finished with value: 0.05601595748244955 and parameters: {'model_type': 'mlp', 'hidden_dims': '[512, 64]', 'dropout': 0.17909230110812255, 'batch_norm': True, 'lr': 9.823870513236935e-06, 'weight_decay': 2.7913700401228465e-05, 'epochs': 232, 'loss': 'mae', 'optimizer': 'adam', 'graph_mode': 'off', 'use_snp_selection': False}. Best is trial 25 with value: 0.0824597717905614.
[I 2025-12-05 15:47:11,230] Trial 107 finished with value: 0.054546774695846824 and parameters: {'model_type': 'mlp', 'hidden_dims': '[128, 64]', 'dropout': 0.10070289522098277, 'batch_norm': False, 'lr': 1.1643274430868253e-05, 'weight_decay': 2.6606009253778303e-06, 'epochs': 261, 'loss': 'mse', 'optimizer': 'adam', 'graph_mode': 'off', 'use_snp_selection': False}. Best is trial 25 with value: 0.0824597717905614.
[I 2025-12-05 15:47:12,515] Trial 108 finished with value: 0.018833264324646038 and parameters: {'model_type': 'mlp', 'hidden_dims': '[256, 128]', 'dropout': 0.1569673989552361, 'batch_norm': True, 'lr': 1.4017999094153973e-05, 'weight_decay': 9.595430623374723e-07, 'epochs': 241, 'loss': 'mae', 'optimizer': 'adam', 'graph_mode': 'off', 'use_snp_selection': True, 'num_snps': 11322}. Best is trial 25 with value: 0.0824597717905614.
[I 2025-12-05 15:47:14,301] Trial 109 finished with value: 0.06541671641809603 and parameters: {'model_type': 'mlp', 'hidden_dims': '[512, 64]', 'dropout': 0.16734069909144672, 'batch_norm': False, 'lr': 6.417850450545467e-06, 'weight_decay': 1.661838498080552e-06, 'epochs': 251, 'loss': 'mse', 'optimizer': 'adam', 'graph_mode': 'off', 'use_snp_selection': False}. Best is trial 25 with value: 0.0824597717905614.
[I 2025-12-05 15:47:16,380] Trial 110 finished with value: 0.02615977791329351 and parameters: {'model_type': 'mlp', 'hidden_dims': '[512, 64]', 'dropout': 0.13971717896197927, 'batch_norm': True, 'lr': 1.6976861344288044e-05, 'weight_decay': 6.520829380311132e-07, 'epochs': 326, 'loss': 'mse', 'optimizer': 'adam', 'graph_mode': 'off', 'use_snp_selection': False}. Best is trial 25 with value: 0.0824597717905614.
[I 2025-12-05 15:47:18,204] Trial 111 finished with value: 0.04938593027279636 and parameters: {'model_type': 'mlp', 'hidden_dims': '[512, 64]', 'dropout': 0.12759343185425653, 'batch_norm': False, 'lr': 7.230437598047816e-05, 'weight_decay': 3.013966839770545e-07, 'epochs': 271, 'loss': 'mse', 'optimizer': 'adam', 'graph_mode': 'off', 'use_snp_selection': False}. Best is trial 25 with value: 0.0824597717905614.
[I 2025-12-05 15:47:19,668] Trial 112 finished with value: 0.04534367327407919 and parameters: {'model_type': 'mlp', 'hidden_dims': '[512, 64]', 'dropout': 0.11248130796544123, 'batch_norm': False, 'lr': 8.733193791882932e-06, 'weight_decay': 2.055364436309584e-07, 'epochs': 174, 'loss': 'mse', 'optimizer': 'adam', 'graph_mode': 'off', 'use_snp_selection': False}. Best is trial 25 with value: 0.0824597717905614.
[I 2025-12-05 15:47:21,645] Trial 113 finished with value: 0.03880227664315966 and parameters: {'model_type': 'mlp', 'hidden_dims': '[512, 64]', 'dropout': 0.11988923317975997, 'batch_norm': False, 'lr': 4.128065441579664e-06, 'weight_decay': 3.6758625435398776e-07, 'epochs': 302, 'loss': 'mse', 'optimizer': 'adam', 'graph_mode': 'off', 'use_snp_selection': False}. Best is trial 25 with value: 0.0824597717905614.
[I 2025-12-05 15:47:23,341] Trial 114 finished with value: 0.039459747227553923 and parameters: {'model_type': 'mlp', 'hidden_dims': '[512, 64]', 'dropout': 0.13505635582578585, 'batch_norm': False, 'lr': 1.9356052574415838e-05, 'weight_decay': 1.6503254635933505e-07, 'epochs': 234, 'loss': 'mse', 'optimizer': 'adam', 'graph_mode': 'off', 'use_snp_selection': False}. Best is trial 25 with value: 0.0824597717905614.
[I 2025-12-05 15:47:24,647] Trial 115 finished with value: 0.029861119612809565 and parameters: {'model_type': 'mlp', 'hidden_dims': '[256, 128, 64]', 'dropout': 0.3833717262983919, 'batch_norm': False, 'lr': 2.3847136042761316e-05, 'weight_decay': 2.3870530564488204e-07, 'epochs': 284, 'loss': 'mse', 'optimizer': 'adam', 'graph_mode': 'off', 'use_snp_selection': False}. Best is trial 25 with value: 0.0824597717905614.
[I 2025-12-05 15:47:25,680] Trial 116 finished with value: -0.015628236953169554 and parameters: {'model_type': 'mlp', 'hidden_dims': '[128, 64]', 'dropout': 0.2342916436049861, 'batch_norm': True, 'lr': 1.303347975794814e-05, 'weight_decay': 4.6749578541835956e-07, 'epochs': 264, 'loss': 'mae', 'optimizer': 'adam', 'graph_mode': 'off', 'use_snp_selection': False}. Best is trial 25 with value: 0.0824597717905614.
[I 2025-12-05 15:47:27,698] Trial 117 finished with value: 0.06826202891979097 and parameters: {'model_type': 'mlp', 'hidden_dims': '[512, 64]', 'dropout': 0.14643064933362815, 'batch_norm': False, 'lr': 1.0492507572089103e-05, 'weight_decay': 1.1969258239148786e-07, 'epochs': 321, 'loss': 'mse', 'optimizer': 'adam', 'graph_mode': 'off', 'use_snp_selection': False}. Best is trial 25 with value: 0.0824597717905614.
[I 2025-12-05 15:47:29,094] Trial 118 finished with value: 0.014642636117192194 and parameters: {'model_type': 'mlp', 'hidden_dims': '[256, 128]', 'dropout': 0.18684246237251892, 'batch_norm': True, 'lr': 1.036776942643062e-05, 'weight_decay': 1.2501568652952266e-07, 'epochs': 338, 'loss': 'mse', 'optimizer': 'adam', 'graph_mode': 'off', 'use_snp_selection': False}. Best is trial 25 with value: 0.0824597717905614.
[I 2025-12-05 15:47:30,615] Trial 119 finished with value: 0.050121998507131144 and parameters: {'model_type': 'mlp', 'hidden_dims': '[512, 128]', 'dropout': 0.15058351617283583, 'batch_norm': False, 'lr': 9.248050186421084e-05, 'weight_decay': 1.4270493316159216e-07, 'epochs': 183, 'loss': 'mae', 'optimizer': 'adam', 'graph_mode': 'off', 'use_snp_selection': False}. Best is trial 25 with value: 0.0824597717905614.
[I 2025-12-05 15:47:32,666] Trial 120 finished with value: 0.020387342935162485 and parameters: {'model_type': 'mlp', 'hidden_dims': '[512, 64]', 'dropout': 0.17156322694503912, 'batch_norm': False, 'lr': 1.0884826390781753e-05, 'weight_decay': 1.6889197072434036e-07, 'epochs': 321, 'loss': 'mse', 'optimizer': 'adam', 'graph_mode': 'off', 'use_snp_selection': False}. Best is trial 25 with value: 0.0824597717905614.
[I 2025-12-05 15:47:34,682] Trial 121 finished with value: 0.0634756206569676 and parameters: {'model_type': 'mlp', 'hidden_dims': '[512, 64]', 'dropout': 0.14085471476290273, 'batch_norm': False, 'lr': 3.439210789796893e-05, 'weight_decay': 2.690012960398211e-07, 'epochs': 312, 'loss': 'mse', 'optimizer': 'adam', 'graph_mode': 'off', 'use_snp_selection': False}. Best is trial 25 with value: 0.0824597717905614.
[I 2025-12-05 15:47:36,446] Trial 122 finished with value: 0.08073348696246427 and parameters: {'model_type': 'mlp', 'hidden_dims': '[512, 64]', 'dropout': 0.10775892073915443, 'batch_norm': False, 'lr': 2.8232475048382752e-05, 'weight_decay': 1.0004645753826712e-07, 'epochs': 249, 'loss': 'mse', 'optimizer': 'adam', 'graph_mode': 'off', 'use_snp_selection': False}. Best is trial 25 with value: 0.0824597717905614.
[I 2025-12-05 15:47:38,170] Trial 123 finished with value: 0.06801242887342916 and parameters: {'model_type': 'mlp', 'hidden_dims': '[512, 64]', 'dropout': 0.11028298537643053, 'batch_norm': False, 'lr': 5.2435351904650766e-05, 'weight_decay': 1.2928779991354152e-07, 'epochs': 246, 'loss': 'mse', 'optimizer': 'adam', 'graph_mode': 'off', 'use_snp_selection': False}. Best is trial 25 with value: 0.0824597717905614.
[I 2025-12-05 15:47:39,824] Trial 124 finished with value: 0.04724763683740649 and parameters: {'model_type': 'mlp', 'hidden_dims': '[512, 64]', 'dropout': 0.1106051939881928, 'batch_norm': False, 'lr': 5.205092528832412e-05, 'weight_decay': 1.0599982867616656e-07, 'epochs': 222, 'loss': 'mse', 'optimizer': 'adam', 'graph_mode': 'off', 'use_snp_selection': False}. Best is trial 25 with value: 0.0824597717905614.
[I 2025-12-05 15:47:41,967] Trial 125 finished with value: 0.05105264652908612 and parameters: {'model_type': 'mlp', 'hidden_dims': '[512, 64]', 'dropout': 0.10615877184140587, 'batch_norm': False, 'lr': 4.0677778472163804e-05, 'weight_decay': 1.839440746277805e-07, 'epochs': 346, 'loss': 'mse', 'optimizer': 'adam', 'graph_mode': 'off', 'use_snp_selection': False}. Best is trial 25 with value: 0.0824597717905614.
[I 2025-12-05 15:47:43,701] Trial 126 finished with value: 0.06938274327213158 and parameters: {'model_type': 'mlp', 'hidden_dims': '[512, 64]', 'dropout': 0.12007345144933113, 'batch_norm': True, 'lr': 7.08074345357508e-05, 'weight_decay': 1.0136043115597262e-07, 'epochs': 238, 'loss': 'mse', 'optimizer': 'adam', 'graph_mode': 'off', 'use_snp_selection': False}. Best is trial 25 with value: 0.0824597717905614.
[I 2025-12-05 15:47:45,422] Trial 127 finished with value: 0.05275288235695183 and parameters: {'model_type': 'mlp', 'hidden_dims': '[512, 64]', 'dropout': 0.12005631636553671, 'batch_norm': False, 'lr': 6.426378057243741e-05, 'weight_decay': 1.4083854261227206e-07, 'epochs': 236, 'loss': 'mse', 'optimizer': 'adam', 'graph_mode': 'off', 'use_snp_selection': False}. Best is trial 25 with value: 0.0824597717905614.
[I 2025-12-05 15:47:48,465] Trial 128 finished with value: 0.05391034559360165 and parameters: {'model_type': 'mlp', 'hidden_dims': '[512, 64]', 'dropout': 0.14897997398033544, 'batch_norm': True, 'lr': 2.9378576888999606e-05, 'weight_decay': 1.0218386466155415e-07, 'epochs': 244, 'loss': 'mse', 'optimizer': 'adam', 'graph_mode': 'off', 'use_snp_selection': True, 'num_snps': 51726}. Best is trial 25 with value: 0.0824597717905614.
[I 2025-12-05 15:47:50,614] Trial 129 finished with value: 0.042668871402305825 and parameters: {'model_type': 'mlp', 'hidden_dims': '[512, 64]', 'dropout': 0.1355332519395581, 'batch_norm': False, 'lr': 5.551863001124217e-05, 'weight_decay': 1.2435919395251168e-07, 'epochs': 337, 'loss': 'mse', 'optimizer': 'adam', 'graph_mode': 'off', 'use_snp_selection': False}. Best is trial 25 with value: 0.0824597717905614.
[I 2025-12-05 15:47:52,091] Trial 130 finished with value: 0.04048401819049779 and parameters: {'model_type': 'mlp', 'hidden_dims': '[512, 64]', 'dropout': 0.1966113921299622, 'batch_norm': True, 'lr': 4.435961576474959e-05, 'weight_decay': 1.544538914786669e-07, 'epochs': 169, 'loss': 'mse', 'optimizer': 'adam', 'graph_mode': 'off', 'use_snp_selection': False}. Best is trial 25 with value: 0.0824597717905614.
[I 2025-12-05 15:47:53,748] Trial 131 finished with value: 0.029199710702634187 and parameters: {'model_type': 'mlp', 'hidden_dims': '[512, 64]', 'dropout': 0.10142914480651252, 'batch_norm': True, 'lr': 7.376013238384858e-05, 'weight_decay': 1.8483697442552803e-07, 'epochs': 215, 'loss': 'mse', 'optimizer': 'adam', 'graph_mode': 'off', 'use_snp_selection': False}. Best is trial 25 with value: 0.0824597717905614.
[I 2025-12-05 15:47:55,437] Trial 132 finished with value: 0.04541141698339993 and parameters: {'model_type': 'mlp', 'hidden_dims': '[512, 64]', 'dropout': 0.11889744795722011, 'batch_norm': True, 'lr': 0.00012297616861538257, 'weight_decay': 6.484172612073512e-06, 'epochs': 229, 'loss': 'mse', 'optimizer': 'adam', 'graph_mode': 'off', 'use_snp_selection': False}. Best is trial 25 with value: 0.0824597717905614.
[I 2025-12-05 15:47:57,198] Trial 133 finished with value: 0.03338420730691584 and parameters: {'model_type': 'mlp', 'hidden_dims': '[512, 64]', 'dropout': 0.5005286756291119, 'batch_norm': True, 'lr': 4.8805194990336165e-05, 'weight_decay': 2.043098671705399e-07, 'epochs': 245, 'loss': 'mse', 'optimizer': 'adam', 'graph_mode': 'off', 'use_snp_selection': False}. Best is trial 25 with value: 0.0824597717905614.
