[I 2025-12-05 15:23:43,143] Trial 14 finished with value: 0.10839534598707916 and parameters: {'model_type': 'mlp', 'hidden_dims': '[256, 128, 64]', 'dropout': 0.4774917249809648, 'batch_norm': True, 'lr': 0.0006681578335050954, 'weight_decay': 1.0971024377881592e-07, 'epochs': 263, 'loss': 'mse', 'optimizer': 'adam', 'graph_mode': 'off', 'use_snp_selection': False}. Best is trial 9 with value: 0.13572837038988797.
[I 2025-12-05 15:23:46,143] Trial 15 finished with value: 0.09815474764488147 and parameters: {'model_type': 'mlp', 'hidden_dims': '[512, 256]', 'dropout': 0.5699025908888742, 'batch_norm': True, 'lr': 0.0001045571331345049, 'weight_decay': 7.236536090132001e-06, 'epochs': 190, 'loss': 'mae', 'optimizer': 'adam', 'graph_mode': 'off', 'use_snp_selection': False}. Best is trial 9 with value: 0.13572837038988797.
[I 2025-12-05 15:23:47,463] Trial 16 finished with value: 0.05502266022132023 and parameters: {'model_type': 'mlp', 'hidden_dims': '[256, 128]', 'dropout': 0.3400578620313633, 'batch_norm': True, 'lr': 2.1517090787442848e-05, 'weight_decay': 7.882980925273178e-05, 'epochs': 98, 'loss': 'mse', 'optimizer': 'adam', 'graph_mode': 'off', 'use_snp_selection': False}. Best is trial 9 with value: 0.13572837038988797.
[I 2025-12-05 15:23:51,527] Trial 17 finished with value: 0.10720243455710442 and parameters: {'model_type': 'mlp', 'hidden_dims': '[512, 64]', 'dropout': 0.2174542087235227, 'batch_norm': True, 'lr': 9.746523544442226e-06, 'weight_decay': 7.208825532007247e-07, 'epochs': 279, 'loss': 'mae', 'optimizer': 'adam', 'graph_mode': 'off', 'use_snp_selection': False}. Best is trial 9 with value: 0.13572837038988797.
[I 2025-12-05 15:23:55,567] Trial 18 finished with value: 0.03134011291837182 and parameters: {'model_type': 'mlp', 'hidden_dims': '[256, 128]', 'dropout': 0.10884892417738423, 'batch_norm': False, 'lr': 0.0009735993119677173, 'weight_decay': 1.0315216097288506e-05, 'epochs': 184, 'loss': 'mse', 'optimizer': 'adam', 'graph_mode': 'off', 'use_snp_selection': True, 'num_snps': 58241}. Best is trial 9 with value: 0.13572837038988797.
[I 2025-12-05 15:23:59,209] Trial 19 finished with value: 0.10430920978781169 and parameters: {'model_type': 'mlp', 'hidden_dims': '[512, 64]', 'dropout': 0.42887889798689083, 'batch_norm': True, 'lr': 5.356605669826495e-05, 'weight_decay': 3.210676296043814e-07, 'epochs': 244, 'loss': 'mae', 'optimizer': 'adam', 'graph_mode': 'off', 'use_snp_selection': False}. Best is trial 9 with value: 0.13572837038988797.
[I 2025-12-05 15:24:01,317] Trial 20 finished with value: 0.13368508206036167 and parameters: {'model_type': 'mlp', 'hidden_dims': '[512, 128]', 'dropout': 0.34297698673380095, 'batch_norm': True, 'lr': 0.00018572983005243663, 'weight_decay': 1.8907823396101775e-06, 'epochs': 113, 'loss': 'mae', 'optimizer': 'adam', 'graph_mode': 'off', 'use_snp_selection': False}. Best is trial 9 with value: 0.13572837038988797.
[I 2025-12-05 15:24:03,009] Trial 21 finished with value: 0.10779063306093678 and parameters: {'model_type': 'mlp', 'hidden_dims': '[512, 128]', 'dropout': 0.3426036956588672, 'batch_norm': True, 'lr': 0.00018883741319897782, 'weight_decay': 1.5330795279190887e-06, 'epochs': 77, 'loss': 'mae', 'optimizer': 'adam', 'graph_mode': 'off', 'use_snp_selection': False}. Best is trial 9 with value: 0.13572837038988797.
[I 2025-12-05 15:24:05,217] Trial 22 finished with value: 0.10847221016129892 and parameters: {'model_type': 'mlp', 'hidden_dims': '[512, 128]', 'dropout': 0.527068617035195, 'batch_norm': True, 'lr': 0.00041657079075973146, 'weight_decay': 2.4009270565043595e-06, 'epochs': 120, 'loss': 'mae', 'optimizer': 'adam', 'graph_mode': 'off', 'use_snp_selection': False}. Best is trial 9 with value: 0.13572837038988797.
[I 2025-12-05 15:24:07,990] Trial 23 finished with value: 0.12910554214323483 and parameters: {'model_type': 'mlp', 'hidden_dims': '[512, 128]', 'dropout': 0.4479565970622254, 'batch_norm': True, 'lr': 0.0001239870569445819, 'weight_decay': 5.0120379461963505e-06, 'epochs': 170, 'loss': 'mae', 'optimizer': 'adam', 'graph_mode': 'off', 'use_snp_selection': False}. Best is trial 9 with value: 0.13572837038988797.
[I 2025-12-05 15:24:10,761] Trial 24 finished with value: 0.12988240770332235 and parameters: {'model_type': 'mlp', 'hidden_dims': '[512, 128]', 'dropout': 0.19672525008505004, 'batch_norm': True, 'lr': 0.00015246911584826527, 'weight_decay': 8.681840737695748e-07, 'epochs': 169, 'loss': 'mae', 'optimizer': 'adam', 'graph_mode': 'off', 'use_snp_selection': False}. Best is trial 9 with value: 0.13572837038988797.
[I 2025-12-05 15:24:12,968] Trial 25 finished with value: 0.10662301103591508 and parameters: {'model_type': 'mlp', 'hidden_dims': '[512, 128]', 'dropout': 0.1859606717259252, 'batch_norm': True, 'lr': 3.775256329745003e-05, 'weight_decay': 2.541606909583134e-07, 'epochs': 124, 'loss': 'mae', 'optimizer': 'adam', 'graph_mode': 'off', 'use_snp_selection': False}. Best is trial 9 with value: 0.13572837038988797.
[I 2025-12-05 15:24:14,504] Trial 26 finished with value: 0.07473281548132006 and parameters: {'model_type': 'mlp', 'hidden_dims': '[512, 128]', 'dropout': 0.2524278198701546, 'batch_norm': True, 'lr': 0.00018833836311308886, 'weight_decay': 7.786263538034662e-07, 'epochs': 127, 'loss': 'mse', 'optimizer': 'adam', 'graph_mode': 'off', 'use_snp_selection': True, 'num_snps': 3842}. Best is trial 9 with value: 0.13572837038988797.
[I 2025-12-05 15:24:15,784] Trial 27 finished with value: 0.044039213425442536 and parameters: {'model_type': 'mlp', 'hidden_dims': '[512, 128]', 'dropout': 0.16353502257597163, 'batch_norm': False, 'lr': 0.000452104557474273, 'weight_decay': 1.5658863032594448e-06, 'epochs': 44, 'loss': 'mae', 'optimizer': 'adam', 'graph_mode': 'off', 'use_snp_selection': False}. Best is trial 9 with value: 0.13572837038988797.
[I 2025-12-05 15:24:16,633] Trial 28 finished with value: 0.1162293731421789 and parameters: {'model_type': 'mlp', 'hidden_dims': '[128, 64]', 'dropout': 0.13498724060077172, 'batch_norm': True, 'lr': 9.568559894915624e-05, 'weight_decay': 1.9529583312049092e-07, 'epochs': 93, 'loss': 'mse', 'optimizer': 'adam', 'graph_mode': 'off', 'use_snp_selection': False}. Best is trial 9 with value: 0.13572837038988797.
[I 2025-12-05 15:24:19,312] Trial 29 finished with value: 0.08944891315386087 and parameters: {'model_type': 'mlp', 'hidden_dims': '[512, 256]', 'dropout': 0.22621903346837774, 'batch_norm': True, 'lr': 3.094373901205357e-05, 'weight_decay': 5.278433335242992e-07, 'epochs': 215, 'loss': 'mae', 'optimizer': 'adam', 'graph_mode': 'off', 'use_snp_selection': True, 'num_snps': 19468}. Best is trial 9 with value: 0.13572837038988797.
[I 2025-12-05 15:24:21,068] Trial 30 finished with value: 0.11982561231467087 and parameters: {'model_type': 'mlp', 'hidden_dims': '[256, 128, 64]', 'dropout': 0.19803440081675222, 'batch_norm': True, 'lr': 0.0001787155823809422, 'weight_decay': 1.0309858851836335e-06, 'epochs': 172, 'loss': 'mae', 'optimizer': 'adam', 'graph_mode': 'off', 'use_snp_selection': False}. Best is trial 9 with value: 0.13572837038988797.
[I 2025-12-05 15:24:23,749] Trial 31 finished with value: 0.11892401124757071 and parameters: {'model_type': 'mlp', 'hidden_dims': '[512, 128]', 'dropout': 0.285245900890249, 'batch_norm': True, 'lr': 0.00012331577472026795, 'weight_decay': 4.864870859504538e-06, 'epochs': 160, 'loss': 'mae', 'optimizer': 'adam', 'graph_mode': 'off', 'use_snp_selection': False}. Best is trial 9 with value: 0.13572837038988797.
[I 2025-12-05 15:24:26,547] Trial 32 finished with value: 0.12040745201764826 and parameters: {'model_type': 'mlp', 'hidden_dims': '[512, 128]', 'dropout': 0.31104881526997114, 'batch_norm': True, 'lr': 8.114059197998195e-05, 'weight_decay': 3.268459626612755e-06, 'epochs': 171, 'loss': 'mae', 'optimizer': 'adam', 'graph_mode': 'off', 'use_snp_selection': False}. Best is trial 9 with value: 0.13572837038988797.
[I 2025-12-05 15:24:28,966] Trial 33 finished with value: 0.12201411845487346 and parameters: {'model_type': 'mlp', 'hidden_dims': '[512, 128]', 'dropout': 0.37503436792054945, 'batch_norm': True, 'lr': 0.0002611037014841862, 'weight_decay': 4.249215375275058e-05, 'epochs': 140, 'loss': 'mae', 'optimizer': 'adam', 'graph_mode': 'off', 'use_snp_selection': False}. Best is trial 9 with value: 0.13572837038988797.
[I 2025-12-05 15:24:32,182] Trial 34 finished with value: 0.11546563767842853 and parameters: {'model_type': 'mlp', 'hidden_dims': '[512, 128]', 'dropout': 0.4444847423616253, 'batch_norm': True, 'lr': 0.00014052635103740425, 'weight_decay': 6.4852361265944225e-06, 'epochs': 208, 'loss': 'mae', 'optimizer': 'adam', 'graph_mode': 'off', 'use_snp_selection': False}. Best is trial 9 with value: 0.13572837038988797.
[I 2025-12-05 15:24:33,768] Trial 35 finished with value: 0.1103068698871002 and parameters: {'model_type': 'mlp', 'hidden_dims': '[512, 64]', 'dropout': 0.23546468494124714, 'batch_norm': False, 'lr': 7.322586663635906e-05, 'weight_decay': 1.1713448588744846e-06, 'epochs': 72, 'loss': 'mae', 'optimizer': 'adam', 'graph_mode': 'off', 'use_snp_selection': False}. Best is trial 9 with value: 0.13572837038988797.
[I 2025-12-05 15:24:37,206] Trial 36 finished with value: 0.09818231729576225 and parameters: {'model_type': 'mlp', 'hidden_dims': '[128, 64]', 'dropout': 0.17521200946810195, 'batch_norm': True, 'lr': 3.37832037845598e-05, 'weight_decay': 1.74960045707239e-05, 'epochs': 177, 'loss': 'mae', 'optimizer': 'adam', 'graph_mode': 'off', 'use_snp_selection': True, 'num_snps': 58661}. Best is trial 9 with value: 0.13572837038988797.
[I 2025-12-05 15:24:39,601] Trial 37 finished with value: 0.11690725001533384 and parameters: {'model_type': 'mlp', 'hidden_dims': '[512, 128]', 'dropout': 0.12617056917313207, 'batch_norm': True, 'lr': 0.00046492826823403815, 'weight_decay': 2.165069909670635e-06, 'epochs': 137, 'loss': 'mse', 'optimizer': 'adam', 'graph_mode': 'off', 'use_snp_selection': False}. Best is trial 9 with value: 0.13572837038988797.
[I 2025-12-05 15:24:41,974] Trial 38 finished with value: 0.11250629673104114 and parameters: {'model_type': 'mlp', 'hidden_dims': '[512, 64]', 'dropout': 0.5597306869164105, 'batch_norm': False, 'lr': 4.8780333551811074e-05, 'weight_decay': 3.9911285421431353e-07, 'epochs': 108, 'loss': 'mae', 'optimizer': 'adam', 'graph_mode': 'off', 'use_snp_selection': True, 'num_snps': 19911}. Best is trial 9 with value: 0.13572837038988797.
[I 2025-12-05 15:24:43,664] Trial 39 finished with value: 0.11557415922163458 and parameters: {'model_type': 'mlp', 'hidden_dims': '[256, 128, 64]', 'dropout': 0.40491549826838436, 'batch_norm': True, 'lr': 0.0003113042190477232, 'weight_decay': 0.00010412398872024411, 'epochs': 158, 'loss': 'mse', 'optimizer': 'adam', 'graph_mode': 'off', 'use_snp_selection': False}. Best is trial 9 with value: 0.13572837038988797.
[I 2025-12-05 15:24:46,694] Trial 40 finished with value: 0.08954604385324177 and parameters: {'model_type': 'mlp', 'hidden_dims': '[512, 128]', 'dropout': 0.1485044917648436, 'batch_norm': True, 'lr': 4.767147905519569e-06, 'weight_decay': 1.9452193667888908e-07, 'epochs': 194, 'loss': 'mae', 'optimizer': 'adam', 'graph_mode': 'off', 'use_snp_selection': False}. Best is trial 9 with value: 0.13572837038988797.
[I 2025-12-05 15:24:49,083] Trial 41 finished with value: 0.05544975194933096 and parameters: {'model_type': 'mlp', 'hidden_dims': '[512, 128]', 'dropout': 0.3716081310069049, 'batch_norm': True, 'lr': 2.320370617557869e-06, 'weight_decay': 4.4447291415443666e-05, 'epochs': 137, 'loss': 'mae', 'optimizer': 'adam', 'graph_mode': 'off', 'use_snp_selection': False}. Best is trial 9 with value: 0.13572837038988797.
[I 2025-12-05 15:24:51,566] Trial 42 finished with value: 0.13036492085349566 and parameters: {'model_type': 'mlp', 'hidden_dims': '[512, 128]', 'dropout': 0.36642324976660423, 'batch_norm': True, 'lr': 0.00027001649540566374, 'weight_decay': 3.3102706340019984e-05, 'epochs': 147, 'loss': 'mae', 'optimizer': 'adam', 'graph_mode': 'off', 'use_snp_selection': False}. Best is trial 9 with value: 0.13572837038988797.
[I 2025-12-05 15:24:54,261] Trial 43 finished with value: 0.10354757587910994 and parameters: {'model_type': 'mlp', 'hidden_dims': '[512, 128]', 'dropout': 0.4502901047746143, 'batch_norm': True, 'lr': 0.00014786378333572802, 'weight_decay': 2.698520222863864e-05, 'epochs': 166, 'loss': 'mae', 'optimizer': 'adam', 'graph_mode': 'off', 'use_snp_selection': False}. Best is trial 9 with value: 0.13572837038988797.
[I 2025-12-05 15:24:56,786] Trial 44 finished with value: 0.12382345625365127 and parameters: {'model_type': 'mlp', 'hidden_dims': '[512, 128]', 'dropout': 0.36094684316203407, 'batch_norm': True, 'lr': 0.00025121132715862684, 'weight_decay': 0.000256266460247336, 'epochs': 148, 'loss': 'mae', 'optimizer': 'adam', 'graph_mode': 'off', 'use_snp_selection': False}. Best is trial 9 with value: 0.13572837038988797.
[I 2025-12-05 15:24:58,861] Trial 45 finished with value: 0.12390551909210108 and parameters: {'model_type': 'mlp', 'hidden_dims': '[512, 64]', 'dropout': 0.32856336447719675, 'batch_norm': True, 'lr': 0.0006855243531449244, 'weight_decay': 1.4980608103365028e-05, 'epochs': 110, 'loss': 'mae', 'optimizer': 'adam', 'graph_mode': 'off', 'use_snp_selection': False}. Best is trial 9 with value: 0.13572837038988797.
[I 2025-12-05 15:25:02,249] Trial 46 finished with value: 0.10436935974693347 and parameters: {'model_type': 'mlp', 'hidden_dims': '[512, 256]', 'dropout': 0.4137382399338502, 'batch_norm': False, 'lr': 8.476642486840155e-05, 'weight_decay': 6.230356920227035e-06, 'epochs': 224, 'loss': 'mse', 'optimizer': 'adam', 'graph_mode': 'off', 'use_snp_selection': False}. Best is trial 9 with value: 0.13572837038988797.
[I 2025-12-05 15:25:05,336] Trial 47 finished with value: 0.10190811556148395 and parameters: {'model_type': 'mlp', 'hidden_dims': '[512, 128]', 'dropout': 0.47981792189754, 'batch_norm': True, 'lr': 0.0003368406379275874, 'weight_decay': 3.855344133836964e-06, 'epochs': 199, 'loss': 'mae', 'optimizer': 'adam', 'graph_mode': 'off', 'use_snp_selection': False}. Best is trial 9 with value: 0.13572837038988797.
[I 2025-12-05 15:25:06,133] Trial 48 finished with value: 0.09837591638046367 and parameters: {'model_type': 'mlp', 'hidden_dims': '[128, 64]', 'dropout': 0.275352306403822, 'batch_norm': True, 'lr': 6.33844414395998e-05, 'weight_decay': 1.9537642385261768e-06, 'epochs': 75, 'loss': 'mse', 'optimizer': 'adam', 'graph_mode': 'off', 'use_snp_selection': False}. Best is trial 9 with value: 0.13572837038988797.
[I 2025-12-05 15:25:10,393] Trial 49 finished with value: 0.13589578695926052 and parameters: {'model_type': 'mlp', 'hidden_dims': '[512, 64]', 'dropout': 0.10018926791749536, 'batch_norm': True, 'lr': 0.00019112880734719836, 'weight_decay': 1.0713867365046883e-06, 'epochs': 180, 'loss': 'mae', 'optimizer': 'adam', 'graph_mode': 'off', 'use_snp_selection': True, 'num_snps': 46888}. Best is trial 49 with value: 0.13589578695926052.
[I 2025-12-05 15:25:15,251] Trial 50 finished with value: 0.11531900644869578 and parameters: {'model_type': 'mlp', 'hidden_dims': '[512, 64]', 'dropout': 0.10944127012094482, 'batch_norm': True, 'lr': 0.0006800072895545312, 'weight_decay': 5.091286715100075e-07, 'epochs': 234, 'loss': 'mae', 'optimizer': 'adam', 'graph_mode': 'off', 'use_snp_selection': True, 'num_snps': 46345}. Best is trial 49 with value: 0.13589578695926052.
[I 2025-12-05 15:25:19,639] Trial 51 finished with value: 0.12127211667718248 and parameters: {'model_type': 'mlp', 'hidden_dims': '[512, 64]', 'dropout': 0.14065011777182165, 'batch_norm': True, 'lr': 0.00019820321686848596, 'weight_decay': 1.057288969418683e-06, 'epochs': 180, 'loss': 'mae', 'optimizer': 'adam', 'graph_mode': 'off', 'use_snp_selection': True, 'num_snps': 47105}. Best is trial 49 with value: 0.13589578695926052.
[I 2025-12-05 15:25:22,204] Trial 52 finished with value: 0.12034590875915306 and parameters: {'model_type': 'mlp', 'hidden_dims': '[512, 64]', 'dropout': 0.11997595211931679, 'batch_norm': True, 'lr': 0.00011599019854138009, 'weight_decay': 1.0311783677709957e-05, 'epochs': 153, 'loss': 'mae', 'optimizer': 'adam', 'graph_mode': 'off', 'use_snp_selection': True, 'num_snps': 22057}. Best is trial 49 with value: 0.13589578695926052.
[I 2025-12-05 15:25:27,018] Trial 53 finished with value: 0.10723636608292596 and parameters: {'model_type': 'mlp', 'hidden_dims': '[512, 64]', 'dropout': 0.17268310640637008, 'batch_norm': True, 'lr': 0.00023003198203987111, 'weight_decay': 2.5720936379451195e-05, 'epochs': 348, 'loss': 'mae', 'optimizer': 'adam', 'graph_mode': 'off', 'use_snp_selection': True, 'num_snps': 37397}. Best is trial 49 with value: 0.13589578695926052.
[I 2025-12-05 15:25:31,931] Trial 54 finished with value: 0.11383660021920927 and parameters: {'model_type': 'mlp', 'hidden_dims': '[512, 128]', 'dropout': 0.19631586130512352, 'batch_norm': True, 'lr': 0.00015300299795722183, 'weight_decay': 8.682297115043438e-07, 'epochs': 205, 'loss': 'mae', 'optimizer': 'adam', 'graph_mode': 'off', 'use_snp_selection': True, 'num_snps': 51553}. Best is trial 49 with value: 0.13589578695926052.
[I 2025-12-05 15:25:33,430] Trial 55 finished with value: 0.1320966708982812 and parameters: {'model_type': 'mlp', 'hidden_dims': '[256, 128, 64]', 'dropout': 0.10217280117556773, 'batch_norm': True, 'lr': 0.00036467182736937305, 'weight_decay': 5.346973269296676e-07, 'epochs': 132, 'loss': 'mse', 'optimizer': 'adam', 'graph_mode': 'off', 'use_snp_selection': False}. Best is trial 49 with value: 0.13589578695926052.
[I 2025-12-05 15:25:34,932] Trial 56 finished with value: 0.12934213378441317 and parameters: {'model_type': 'mlp', 'hidden_dims': '[256, 128, 64]', 'dropout': 0.15552614155939004, 'batch_norm': True, 'lr': 0.0005361807719839151, 'weight_decay': 5.471319227505277e-07, 'epochs': 129, 'loss': 'mse', 'optimizer': 'adam', 'graph_mode': 'off', 'use_snp_selection': False}. Best is trial 49 with value: 0.13589578695926052.
[I 2025-12-05 15:25:36,787] Trial 57 finished with value: 0.11679647203671756 and parameters: {'model_type': 'mlp', 'hidden_dims': '[256, 128, 64]', 'dropout': 0.12328858521532242, 'batch_norm': True, 'lr': 0.0009459732853939171, 'weight_decay': 3.258435903613283e-07, 'epochs': 187, 'loss': 'mse', 'optimizer': 'adam', 'graph_mode': 'off', 'use_snp_selection': False}. Best is trial 49 with value: 0.13589578695926052.
[I 2025-12-05 15:25:39,037] Trial 58 finished with value: 0.11358693812172607 and parameters: {'model_type': 'mlp', 'hidden_dims': '[256, 128, 64]', 'dropout': 0.10989529273745768, 'batch_norm': False, 'lr': 0.0003270606939171952, 'weight_decay': 1.6782783060689628e-07, 'epochs': 87, 'loss': 'mse', 'optimizer': 'adam', 'graph_mode': 'off', 'use_snp_selection': True, 'num_snps': 26798}. Best is trial 49 with value: 0.13589578695926052.
[I 2025-12-05 15:25:40,440] Trial 59 finished with value: 0.10277531124216449 and parameters: {'model_type': 'mlp', 'hidden_dims': '[256, 128]', 'dropout': 0.24954618352468538, 'batch_norm': True, 'lr': 0.00038272158245000043, 'weight_decay': 1.4644218071580419e-06, 'epochs': 114, 'loss': 'mse', 'optimizer': 'adam', 'graph_mode': 'off', 'use_snp_selection': False}. Best is trial 49 with value: 0.13589578695926052.
[I 2025-12-05 15:25:42,061] Trial 60 finished with value: 0.08598427833133811 and parameters: {'model_type': 'mlp', 'hidden_dims': '[256, 128, 64]', 'dropout': 0.21288024694056054, 'batch_norm': True, 'lr': 1.155190594380778e-05, 'weight_decay': 6.552952715141651e-07, 'epochs': 144, 'loss': 'mse', 'optimizer': 'adam', 'graph_mode': 'off', 'use_snp_selection': False}. Best is trial 49 with value: 0.13589578695926052.
[I 2025-12-05 15:25:43,596] Trial 61 finished with value: 0.12465154651923904 and parameters: {'model_type': 'mlp', 'hidden_dims': '[256, 128, 64]', 'dropout': 0.15403157192589284, 'batch_norm': True, 'lr': 0.0005465895620786314, 'weight_decay': 4.767207605191249e-07, 'epochs': 130, 'loss': 'mse', 'optimizer': 'adam', 'graph_mode': 'off', 'use_snp_selection': False}. Best is trial 49 with value: 0.13589578695926052.
[I 2025-12-05 15:25:45,123] Trial 62 finished with value: 0.12614085941257347 and parameters: {'model_type': 'mlp', 'hidden_dims': '[256, 128, 64]', 'dropout': 0.10330054843269833, 'batch_norm': True, 'lr': 0.0005131455008127386, 'weight_decay': 3.0439247174579324e-07, 'epochs': 129, 'loss': 'mse', 'optimizer': 'adam', 'graph_mode': 'off', 'use_snp_selection': False}. Best is trial 49 with value: 0.13589578695926052.
[I 2025-12-05 15:25:46,466] Trial 63 finished with value: 0.11321450300023606 and parameters: {'model_type': 'mlp', 'hidden_dims': '[256, 128, 64]', 'dropout': 0.1590017054304973, 'batch_norm': True, 'lr': 0.0002595873093951659, 'weight_decay': 5.675934298418616e-07, 'epochs': 104, 'loss': 'mse', 'optimizer': 'adam', 'graph_mode': 'off', 'use_snp_selection': False}. Best is trial 49 with value: 0.13589578695926052.
[I 2025-12-05 15:25:48,110] Trial 64 finished with value: 0.10172896327444529 and parameters: {'model_type': 'mlp', 'hidden_dims': '[256, 128, 64]', 'dropout': 0.13551918706185534, 'batch_norm': True, 'lr': 0.0002036453603247784, 'weight_decay': 1.2295880240909205e-06, 'epochs': 150, 'loss': 'mse', 'optimizer': 'adam', 'graph_mode': 'off', 'use_snp_selection': False}. Best is trial 49 with value: 0.13589578695926052.
[I 2025-12-05 15:25:50,803] Trial 65 finished with value: 0.1298645074518835 and parameters: {'model_type': 'mlp', 'hidden_dims': '[512, 256]', 'dropout': 0.18342845514950995, 'batch_norm': True, 'lr': 0.0002997564340002792, 'weight_decay': 1.4409859446786668e-07, 'epochs': 163, 'loss': 'mse', 'optimizer': 'adam', 'graph_mode': 'off', 'use_snp_selection': False}. Best is trial 49 with value: 0.13589578695926052.
