[I 2025-12-06 05:49:42,738] Trial 88 finished with value: 0.26358246545030417 and parameters: {'model_type': 'mlp', 'hidden_dims': '[512, 256]', 'dropout': 0.11541611672213117, 'batch_norm': True, 'lr': 4.88798480550373e-06, 'weight_decay': 1.4240546778429917e-05, 'epochs': 87, 'loss': 'mse', 'optimizer': 'adam', 'graph_mode': 'off', 'use_snp_selection': True, 'num_snps': 58295}. Best is trial 41 with value: 0.3104019414454807.
[I 2025-12-06 05:50:08,496] Trial 89 finished with value: 0.28279671068075174 and parameters: {'model_type': 'mlp', 'hidden_dims': '[128, 64]', 'dropout': 0.16846586759315157, 'batch_norm': False, 'lr': 1.0615019904617211e-05, 'weight_decay': 1.0802895141888765e-05, 'epochs': 79, 'loss': 'mse', 'optimizer': 'adam', 'graph_mode': 'off', 'use_snp_selection': True, 'num_snps': 14606}. Best is trial 41 with value: 0.3104019414454807.
[I 2025-12-06 05:50:33,640] Trial 90 finished with value: 0.30629016982679674 and parameters: {'model_type': 'mlp', 'hidden_dims': '[512, 128]', 'dropout': 0.20104401143357237, 'batch_norm': False, 'lr': 8.485362700414713e-06, 'weight_decay': 6.951118566365551e-06, 'epochs': 115, 'loss': 'mse', 'optimizer': 'adam', 'graph_mode': 'off', 'use_snp_selection': False}. Best is trial 41 with value: 0.3104019414454807.
[I 2025-12-06 05:51:24,383] Trial 91 finished with value: 0.30756300499599526 and parameters: {'model_type': 'mlp', 'hidden_dims': '[512, 256]', 'dropout': 0.18226695937838067, 'batch_norm': False, 'lr': 4.929169868752543e-06, 'weight_decay': 1.9434658178211223e-05, 'epochs': 94, 'loss': 'mse', 'optimizer': 'adam', 'graph_mode': 'off', 'use_snp_selection': True, 'num_snps': 54453}. Best is trial 41 with value: 0.3104019414454807.
[I 2025-12-06 05:52:16,136] Trial 92 finished with value: 0.30746392404116185 and parameters: {'model_type': 'mlp', 'hidden_dims': '[512, 256]', 'dropout': 0.15044336640623665, 'batch_norm': False, 'lr': 5.1424700617443844e-06, 'weight_decay': 1.762265424307369e-05, 'epochs': 101, 'loss': 'mse', 'optimizer': 'adam', 'graph_mode': 'off', 'use_snp_selection': True, 'num_snps': 54467}. Best is trial 41 with value: 0.3104019414454807.
[I 2025-12-06 05:53:07,550] Trial 93 finished with value: 0.3040042793300955 and parameters: {'model_type': 'mlp', 'hidden_dims': '[512, 256]', 'dropout': 0.18133851797219036, 'batch_norm': False, 'lr': 4.025027816102555e-06, 'weight_decay': 1.6497778654193032e-05, 'epochs': 98, 'loss': 'mse', 'optimizer': 'adam', 'graph_mode': 'off', 'use_snp_selection': True, 'num_snps': 54111}. Best is trial 41 with value: 0.3104019414454807.
[I 2025-12-06 05:53:59,364] Trial 94 finished with value: 0.3060227077801774 and parameters: {'model_type': 'mlp', 'hidden_dims': '[512, 256]', 'dropout': 0.16897543216916067, 'batch_norm': False, 'lr': 6.2849021412376e-06, 'weight_decay': 7.777412133727492e-06, 'epochs': 91, 'loss': 'mse', 'optimizer': 'adam', 'graph_mode': 'off', 'use_snp_selection': True, 'num_snps': 57019}. Best is trial 41 with value: 0.3104019414454807.
[I 2025-12-06 05:54:38,841] Trial 95 finished with value: 0.29963452866072704 and parameters: {'model_type': 'mlp', 'hidden_dims': '[512, 256]', 'dropout': 0.15366700879333892, 'batch_norm': False, 'lr': 5.089703248034494e-06, 'weight_decay': 4.0793862227911696e-05, 'epochs': 63, 'loss': 'mse', 'optimizer': 'adam', 'graph_mode': 'off', 'use_snp_selection': True, 'num_snps': 39972}. Best is trial 41 with value: 0.3104019414454807.
[I 2025-12-06 05:56:03,935] Trial 96 finished with value: 0.28964483505602984 and parameters: {'model_type': 'mlp', 'hidden_dims': '[512, 256]', 'dropout': 0.2010304941945597, 'batch_norm': False, 'lr': 7.5884831826390004e-06, 'weight_decay': 1.1061351134684932e-05, 'epochs': 350, 'loss': 'mse', 'optimizer': 'adam', 'graph_mode': 'off', 'use_snp_selection': True, 'num_snps': 50715}. Best is trial 41 with value: 0.3104019414454807.
[I 2025-12-06 05:56:51,992] Trial 97 finished with value: 0.3049483029526915 and parameters: {'model_type': 'mlp', 'hidden_dims': '[512, 256]', 'dropout': 0.19299687790200296, 'batch_norm': False, 'lr': 4.291812023244073e-06, 'weight_decay': 6.24783550340179e-05, 'epochs': 103, 'loss': 'mse', 'optimizer': 'adam', 'graph_mode': 'off', 'use_snp_selection': True, 'num_snps': 47161}. Best is trial 41 with value: 0.3104019414454807.
[I 2025-12-06 05:57:33,733] Trial 98 finished with value: 0.2991346303428907 and parameters: {'model_type': 'mlp', 'hidden_dims': '[256, 128, 64]', 'dropout': 0.11204159475202677, 'batch_norm': False, 'lr': 2.1973273572329745e-05, 'weight_decay': 1.3042370165531185e-05, 'epochs': 53, 'loss': 'mse', 'optimizer': 'adam', 'graph_mode': 'off', 'use_snp_selection': True, 'num_snps': 58695}. Best is trial 41 with value: 0.3104019414454807.
[I 2025-12-06 05:58:21,310] Trial 99 finished with value: 0.24563884078511194 and parameters: {'model_type': 'mlp', 'hidden_dims': '[512, 256]', 'dropout': 0.45600375139033655, 'batch_norm': False, 'lr': 3.572799199041954e-06, 'weight_decay': 2.1820027711898847e-05, 'epochs': 74, 'loss': 'mae', 'optimizer': 'adam', 'graph_mode': 'off', 'use_snp_selection': True, 'num_snps': 54173}. Best is trial 41 with value: 0.3104019414454807.
[I 2025-12-06 05:59:17,829] Trial 100 finished with value: 0.2931960311455525 and parameters: {'model_type': 'mlp', 'hidden_dims': '[512, 64]', 'dropout': 0.21422041748052034, 'batch_norm': True, 'lr': 9.314517581375854e-06, 'weight_decay': 4.785888262120954e-06, 'epochs': 124, 'loss': 'mse', 'optimizer': 'adam', 'graph_mode': 'off', 'use_snp_selection': True, 'num_snps': 56182}. Best is trial 41 with value: 0.3104019414454807.
[I 2025-12-06 06:00:11,662] Trial 101 finished with value: 0.30297314931517805 and parameters: {'model_type': 'mlp', 'hidden_dims': '[512, 256]', 'dropout': 0.13410640641896576, 'batch_norm': False, 'lr': 5.028835208257581e-06, 'weight_decay': 1.7947571886600402e-05, 'epochs': 109, 'loss': 'mse', 'optimizer': 'adam', 'graph_mode': 'off', 'use_snp_selection': True, 'num_snps': 55403}. Best is trial 41 with value: 0.3104019414454807.
[I 2025-12-06 06:01:07,573] Trial 102 finished with value: 0.3055391676583561 and parameters: {'model_type': 'mlp', 'hidden_dims': '[512, 256]', 'dropout': 0.14495715689225142, 'batch_norm': False, 'lr': 5.433683283885479e-06, 'weight_decay': 2.9276018740804456e-05, 'epochs': 116, 'loss': 'mse', 'optimizer': 'adam', 'graph_mode': 'off', 'use_snp_selection': True, 'num_snps': 56965}. Best is trial 41 with value: 0.3104019414454807.
[I 2025-12-06 06:01:30,074] Trial 103 finished with value: 0.27126777322579537 and parameters: {'model_type': 'mlp', 'hidden_dims': '[512, 256]', 'dropout': 0.16884147445146727, 'batch_norm': False, 'lr': 6.0887851716475115e-06, 'weight_decay': 9.313989803069595e-06, 'epochs': 81, 'loss': 'mse', 'optimizer': 'adam', 'graph_mode': 'off', 'use_snp_selection': True, 'num_snps': 3502}. Best is trial 41 with value: 0.3104019414454807.
[I 2025-12-06 06:02:23,739] Trial 104 finished with value: 0.3056004634222888 and parameters: {'model_type': 'mlp', 'hidden_dims': '[512, 256]', 'dropout': 0.1853075432683416, 'batch_norm': False, 'lr': 6.917555092318272e-06, 'weight_decay': 1.9420541954441353e-05, 'epochs': 93, 'loss': 'mse', 'optimizer': 'adam', 'graph_mode': 'off', 'use_snp_selection': True, 'num_snps': 59904}. Best is trial 41 with value: 0.3104019414454807.
[I 2025-12-06 06:03:15,299] Trial 105 finished with value: 0.29783155814538514 and parameters: {'model_type': 'mlp', 'hidden_dims': '[512, 256]', 'dropout': 0.15058580237502497, 'batch_norm': False, 'lr': 2.0945445376700832e-06, 'weight_decay': 4.4667193909345806e-05, 'epochs': 102, 'loss': 'mse', 'optimizer': 'adam', 'graph_mode': 'off', 'use_snp_selection': True, 'num_snps': 53657}. Best is trial 41 with value: 0.3104019414454807.
[I 2025-12-06 06:04:01,472] Trial 106 finished with value: 0.2961113985463892 and parameters: {'model_type': 'mlp', 'hidden_dims': '[256, 128]', 'dropout': 0.24833204318949556, 'batch_norm': False, 'lr': 2.6026859595899966e-06, 'weight_decay': 0.0003271239241350027, 'epochs': 112, 'loss': 'mse', 'optimizer': 'adam', 'graph_mode': 'off', 'use_snp_selection': True, 'num_snps': 57792}. Best is trial 41 with value: 0.3104019414454807.
[I 2025-12-06 06:04:34,240] Trial 107 finished with value: 0.2991852564130838 and parameters: {'model_type': 'mlp', 'hidden_dims': '[512, 256]', 'dropout': 0.26077010330707284, 'batch_norm': False, 'lr': 1.1569285512030419e-05, 'weight_decay': 2.472928510937374e-05, 'epochs': 98, 'loss': 'mse', 'optimizer': 'adam', 'graph_mode': 'off', 'use_snp_selection': True, 'num_snps': 21494}. Best is trial 41 with value: 0.3104019414454807.
[I 2025-12-06 06:05:39,694] Trial 108 finished with value: 0.299136707244992 and parameters: {'model_type': 'mlp', 'hidden_dims': '[512, 256]', 'dropout': 0.127714199566067, 'batch_norm': False, 'lr': 3.1893784739800816e-06, 'weight_decay': 3.5094368053581325e-05, 'epochs': 212, 'loss': 'mse', 'optimizer': 'adam', 'graph_mode': 'off', 'use_snp_selection': True, 'num_snps': 50662}. Best is trial 41 with value: 0.3104019414454807.
[I 2025-12-06 06:06:51,340] Trial 109 finished with value: 0.29915903214029627 and parameters: {'model_type': 'mlp', 'hidden_dims': '[512, 256]', 'dropout': 0.1665475714108998, 'batch_norm': False, 'lr': 4.491903283278651e-06, 'weight_decay': 5.608726858116467e-05, 'epochs': 224, 'loss': 'mse', 'optimizer': 'adam', 'graph_mode': 'off', 'use_snp_selection': True, 'num_snps': 55418}. Best is trial 41 with value: 0.3104019414454807.
[I 2025-12-06 06:07:17,369] Trial 110 finished with value: 0.3089116797213582 and parameters: {'model_type': 'mlp', 'hidden_dims': '[512, 256]', 'dropout': 0.14051119324066288, 'batch_norm': False, 'lr': 3.6515466478498087e-06, 'weight_decay': 1.6324262109724467e-05, 'epochs': 119, 'loss': 'mse', 'optimizer': 'adam', 'graph_mode': 'off', 'use_snp_selection': False}. Best is trial 41 with value: 0.3104019414454807.
[I 2025-12-06 06:07:43,794] Trial 111 finished with value: 0.3051215605578859 and parameters: {'model_type': 'mlp', 'hidden_dims': '[512, 256]', 'dropout': 0.1370099960159867, 'batch_norm': False, 'lr': 3.868867408011531e-06, 'weight_decay': 1.6411631033646333e-05, 'epochs': 121, 'loss': 'mse', 'optimizer': 'adam', 'graph_mode': 'off', 'use_snp_selection': False}. Best is trial 41 with value: 0.3104019414454807.
[I 2025-12-06 06:08:04,258] Trial 112 finished with value: 0.30609717738019127 and parameters: {'model_type': 'mlp', 'hidden_dims': '[512, 256]', 'dropout': 0.17653260784455804, 'batch_norm': False, 'lr': 5.425083199483272e-06, 'weight_decay': 1.4230608691307858e-05, 'epochs': 87, 'loss': 'mse', 'optimizer': 'adam', 'graph_mode': 'off', 'use_snp_selection': False}. Best is trial 41 with value: 0.3104019414454807.
[I 2025-12-06 06:08:28,641] Trial 113 finished with value: 0.30299202427529986 and parameters: {'model_type': 'mlp', 'hidden_dims': '[512, 256]', 'dropout': 0.15994832445457102, 'batch_norm': False, 'lr': 4.035280177508659e-05, 'weight_decay': 1.214167279844666e-05, 'epochs': 110, 'loss': 'mse', 'optimizer': 'adam', 'graph_mode': 'off', 'use_snp_selection': False}. Best is trial 41 with value: 0.3104019414454807.
[I 2025-12-06 06:08:56,468] Trial 114 finished with value: 0.3024969640992368 and parameters: {'model_type': 'mlp', 'hidden_dims': '[512, 256]', 'dropout': 0.2285605474586933, 'batch_norm': False, 'lr': 7.777720853474828e-05, 'weight_decay': 9.053534996039134e-05, 'epochs': 130, 'loss': 'mse', 'optimizer': 'adam', 'graph_mode': 'off', 'use_snp_selection': False}. Best is trial 41 with value: 0.3104019414454807.
[I 2025-12-06 06:09:22,570] Trial 115 finished with value: 0.30574045618097745 and parameters: {'model_type': 'mlp', 'hidden_dims': '[512, 256]', 'dropout': 0.11959806680078744, 'batch_norm': False, 'lr': 2.9234775914425986e-06, 'weight_decay': 6.345677167923902e-06, 'epochs': 119, 'loss': 'mse', 'optimizer': 'adam', 'graph_mode': 'off', 'use_snp_selection': False}. Best is trial 41 with value: 0.3104019414454807.
[I 2025-12-06 06:10:02,842] Trial 116 finished with value: 0.294520801030296 and parameters: {'model_type': 'mlp', 'hidden_dims': '[128, 64]', 'dropout': 0.1951066112442203, 'batch_norm': False, 'lr': 4.508147065920515e-06, 'weight_decay': 2.2615448937613443e-05, 'epochs': 126, 'loss': 'mse', 'optimizer': 'adam', 'graph_mode': 'off', 'use_snp_selection': True, 'num_snps': 52319}. Best is trial 41 with value: 0.3104019414454807.
[I 2025-12-06 06:10:50,499] Trial 117 finished with value: 0.30226958546854965 and parameters: {'model_type': 'mlp', 'hidden_dims': '[512, 256]', 'dropout': 0.14429037698707475, 'batch_norm': False, 'lr': 3.6616796375877606e-06, 'weight_decay': 2.8080725590392995e-05, 'epochs': 100, 'loss': 'mse', 'optimizer': 'adam', 'graph_mode': 'off', 'use_snp_selection': True, 'num_snps': 47446}. Best is trial 41 with value: 0.3104019414454807.
[I 2025-12-06 06:11:30,684] Trial 118 finished with value: 0.2971101911888453 and parameters: {'model_type': 'mlp', 'hidden_dims': '[512, 128]', 'dropout': 0.1022965833148185, 'batch_norm': False, 'lr': 7.653697948453909e-06, 'weight_decay': 1.9150860121953646e-05, 'epochs': 201, 'loss': 'mae', 'optimizer': 'adam', 'graph_mode': 'off', 'use_snp_selection': False}. Best is trial 41 with value: 0.3104019414454807.
[I 2025-12-06 06:12:20,120] Trial 119 finished with value: 0.2676779142828007 and parameters: {'model_type': 'mlp', 'hidden_dims': '[512, 256]', 'dropout': 0.20516484262330353, 'batch_norm': False, 'lr': 1.7912184854073275e-06, 'weight_decay': 3.51610977804564e-05, 'epochs': 70, 'loss': 'mse', 'optimizer': 'adam', 'graph_mode': 'off', 'use_snp_selection': True, 'num_snps': 58875}. Best is trial 41 with value: 0.3104019414454807.
[I 2025-12-06 06:13:03,740] Trial 120 finished with value: 0.2729081044362172 and parameters: {'model_type': 'mlp', 'hidden_dims': '[512, 256]', 'dropout': 0.2781493009013744, 'batch_norm': True, 'lr': 2.3782212409545095e-06, 'weight_decay': 4.827887532494494e-05, 'epochs': 138, 'loss': 'mse', 'optimizer': 'adam', 'graph_mode': 'off', 'use_snp_selection': True, 'num_snps': 33486}. Best is trial 41 with value: 0.3104019414454807.
[I 2025-12-06 06:14:05,791] Trial 121 finished with value: 0.3052825255910595 and parameters: {'model_type': 'mlp', 'hidden_dims': '[512, 256]', 'dropout': 0.21506908955569193, 'batch_norm': False, 'lr': 3.277187031224762e-06, 'weight_decay': 2.2635096749641287e-05, 'epochs': 180, 'loss': 'mse', 'optimizer': 'adam', 'graph_mode': 'off', 'use_snp_selection': True, 'num_snps': 52012}. Best is trial 41 with value: 0.3104019414454807.
[I 2025-12-06 06:15:04,321] Trial 122 finished with value: 0.30440692238023564 and parameters: {'model_type': 'mlp', 'hidden_dims': '[512, 256]', 'dropout': 0.2312904219874803, 'batch_norm': False, 'lr': 6.334298218301832e-06, 'weight_decay': 1.516806573139006e-05, 'epochs': 146, 'loss': 'mse', 'optimizer': 'adam', 'graph_mode': 'off', 'use_snp_selection': True, 'num_snps': 54469}. Best is trial 41 with value: 0.3104019414454807.
[I 2025-12-06 06:16:06,332] Trial 123 finished with value: 0.30225593341705465 and parameters: {'model_type': 'mlp', 'hidden_dims': '[512, 256]', 'dropout': 0.18276222434123884, 'batch_norm': False, 'lr': 3.339814297470739e-06, 'weight_decay': 8.643570400708298e-06, 'epochs': 191, 'loss': 'mse', 'optimizer': 'adam', 'graph_mode': 'off', 'use_snp_selection': True, 'num_snps': 49934}. Best is trial 41 with value: 0.3104019414454807.
[I 2025-12-06 06:17:00,635] Trial 124 finished with value: 0.30522879941058134 and parameters: {'model_type': 'mlp', 'hidden_dims': '[512, 256]', 'dropout': 0.24536764546230075, 'batch_norm': False, 'lr': 4.3116188769540604e-06, 'weight_decay': 0.0005725783414435215, 'epochs': 105, 'loss': 'mse', 'optimizer': 'adam', 'graph_mode': 'off', 'use_snp_selection': True, 'num_snps': 57109}. Best is trial 41 with value: 0.3104019414454807.
[I 2025-12-06 06:17:49,392] Trial 125 finished with value: 0.30416880261563883 and parameters: {'model_type': 'mlp', 'hidden_dims': '[512, 256]', 'dropout': 0.1567814621201949, 'batch_norm': False, 'lr': 5.386730172255873e-06, 'weight_decay': 0.00012476366812935445, 'epochs': 84, 'loss': 'mse', 'optimizer': 'adam', 'graph_mode': 'off', 'use_snp_selection': True, 'num_snps': 52953}. Best is trial 41 with value: 0.3104019414454807.
[I 2025-12-06 06:18:29,311] Trial 126 finished with value: 0.27899678709575676 and parameters: {'model_type': 'mlp', 'hidden_dims': '[256, 128, 64]', 'dropout': 0.2984195302073575, 'batch_norm': False, 'lr': 3.687860175003922e-06, 'weight_decay': 2.7696471330608305e-05, 'epochs': 94, 'loss': 'mse', 'optimizer': 'adam', 'graph_mode': 'off', 'use_snp_selection': True, 'num_snps': 45274}. Best is trial 41 with value: 0.3104019414454807.
[I 2025-12-06 06:19:31,051] Trial 127 finished with value: 0.30912190262847916 and parameters: {'model_type': 'mlp', 'hidden_dims': '[512, 256]', 'dropout': 0.21893354710888868, 'batch_norm': False, 'lr': 2.636980152731097e-06, 'weight_decay': 1.1948415812473834e-05, 'epochs': 156, 'loss': 'mse', 'optimizer': 'adam', 'graph_mode': 'off', 'use_snp_selection': True, 'num_snps': 56216}. Best is trial 41 with value: 0.3104019414454807.
[I 2025-12-06 06:20:35,678] Trial 128 finished with value: 0.3042531257552422 and parameters: {'model_type': 'mlp', 'hidden_dims': '[512, 256]', 'dropout': 0.18944974442062495, 'batch_norm': False, 'lr': 2.446300314258205e-06, 'weight_decay': 9.843220404092477e-06, 'epochs': 175, 'loss': 'mse', 'optimizer': 'adam', 'graph_mode': 'off', 'use_snp_selection': True, 'num_snps': 56077}. Best is trial 41 with value: 0.3104019414454807.
[I 2025-12-06 06:21:38,373] Trial 129 finished with value: 0.3012774520502529 and parameters: {'model_type': 'mlp', 'hidden_dims': '[512, 64]', 'dropout': 0.2358073796114186, 'batch_norm': False, 'lr': 1.9341696762320817e-06, 'weight_decay': 1.3239346591550485e-05, 'epochs': 152, 'loss': 'mse', 'optimizer': 'adam', 'graph_mode': 'off', 'use_snp_selection': True, 'num_snps': 58601}. Best is trial 41 with value: 0.3104019414454807.
[I 2025-12-06 06:22:34,486] Trial 130 finished with value: 0.25306188205856867 and parameters: {'model_type': 'mlp', 'hidden_dims': '[512, 256]', 'dropout': 0.5626138956699389, 'batch_norm': False, 'lr': 1.36469197591379e-06, 'weight_decay': 1.792857765922227e-05, 'epochs': 127, 'loss': 'mse', 'optimizer': 'adam', 'graph_mode': 'off', 'use_snp_selection': True, 'num_snps': 54769}. Best is trial 41 with value: 0.3104019414454807.
[I 2025-12-06 06:23:33,672] Trial 131 finished with value: 0.298091659289459 and parameters: {'model_type': 'mlp', 'hidden_dims': '[512, 256]', 'dropout': 0.22028866732425503, 'batch_norm': False, 'lr': 2.915658421439142e-06, 'weight_decay': 1.168213693729081e-05, 'epochs': 164, 'loss': 'mse', 'optimizer': 'adam', 'graph_mode': 'off', 'use_snp_selection': True, 'num_snps': 51197}. Best is trial 41 with value: 0.3104019414454807.
[I 2025-12-06 06:24:31,754] Trial 132 finished with value: 0.3042441421903762 and parameters: {'model_type': 'mlp', 'hidden_dims': '[512, 256]', 'dropout': 0.26096613872968655, 'batch_norm': False, 'lr': 5.001029609544319e-06, 'weight_decay': 2.1130150345183605e-05, 'epochs': 145, 'loss': 'mse', 'optimizer': 'adam', 'graph_mode': 'off', 'use_snp_selection': True, 'num_snps': 53434}. Best is trial 41 with value: 0.3104019414454807.
[I 2025-12-06 06:25:27,915] Trial 133 finished with value: 0.30114066313248367 and parameters: {'model_type': 'mlp', 'hidden_dims': '[512, 256]', 'dropout': 0.2085928279521415, 'batch_norm': False, 'lr': 2.707750330326065e-06, 'weight_decay': 3.897529505943225e-05, 'epochs': 156, 'loss': 'mse', 'optimizer': 'adam', 'graph_mode': 'off', 'use_snp_selection': True, 'num_snps': 48134}. Best is trial 41 with value: 0.3104019414454807.
[I 2025-12-06 06:26:23,265] Trial 134 finished with value: 0.30142761178913424 and parameters: {'model_type': 'mlp', 'hidden_dims': '[512, 256]', 'dropout': 0.175755675117226, 'batch_norm': False, 'lr': 4.3393303139407235e-06, 'weight_decay': 7.296202256448879e-06, 'epochs': 109, 'loss': 'mse', 'optimizer': 'adam', 'graph_mode': 'off', 'use_snp_selection': True, 'num_snps': 57582}. Best is trial 41 with value: 0.3104019414454807.
[I 2025-12-06 06:27:10,373] Trial 135 finished with value: 0.3056382941087123 and parameters: {'model_type': 'mlp', 'hidden_dims': '[256, 128]', 'dropout': 0.19803630504226663, 'batch_norm': False, 'lr': 6.994305484443678e-06, 'weight_decay': 3.039173063482929e-05, 'epochs': 138, 'loss': 'mse', 'optimizer': 'adam', 'graph_mode': 'off', 'use_snp_selection': True, 'num_snps': 54695}. Best is trial 41 with value: 0.3104019414454807.
[I 2025-12-06 06:28:14,120] Trial 136 finished with value: 0.301865237840747 and parameters: {'model_type': 'mlp', 'hidden_dims': '[512, 256]', 'dropout': 0.2490948354135319, 'batch_norm': False, 'lr': 2.2080539213076992e-06, 'weight_decay': 1.625762714370164e-05, 'epochs': 168, 'loss': 'mse', 'optimizer': 'adam', 'graph_mode': 'off', 'use_snp_selection': True, 'num_snps': 56094}. Best is trial 41 with value: 0.3104019414454807.
[I 2025-12-06 06:28:57,815] Trial 137 finished with value: 0.3016227946702651 and parameters: {'model_type': 'mlp', 'hidden_dims': '[512, 256]', 'dropout': 0.12722477987679154, 'batch_norm': False, 'lr': 8.195968531290052e-06, 'weight_decay': 5.388366663734058e-06, 'epochs': 116, 'loss': 'mse', 'optimizer': 'adam', 'graph_mode': 'off', 'use_snp_selection': True, 'num_snps': 36658}. Best is trial 41 with value: 0.3104019414454807.
[I 2025-12-06 06:29:46,921] Trial 138 finished with value: 0.284960234125062 and parameters: {'model_type': 'mlp', 'hidden_dims': '[512, 256]', 'dropout': 0.230450044229951, 'batch_norm': False, 'lr': 3.2284761682807313e-06, 'weight_decay': 1.084568450388522e-05, 'epochs': 91, 'loss': 'mae', 'optimizer': 'adam', 'graph_mode': 'off', 'use_snp_selection': True, 'num_snps': 51587}. Best is trial 41 with value: 0.3104019414454807.
