[I 2025-12-05 17:04:19,140] Trial 57 finished with value: 0.2444481883767952 and parameters: {'model_type': 'mlp', 'hidden_dims': '[256, 128, 64]', 'dropout': 0.5443268851010709, 'batch_norm': True, 'lr': 2.4692848909925794e-05, 'weight_decay': 3.5026821902437186e-07, 'epochs': 120, 'loss': 'mae', 'optimizer': 'adam', 'graph_mode': 'off', 'use_snp_selection': True, 'num_snps': 40099}. Best is trial 37 with value: 0.25786006345063966.
[I 2025-12-05 17:04:43,804] Trial 58 finished with value: 0.23793755070079 and parameters: {'model_type': 'mlp', 'hidden_dims': '[512, 64]', 'dropout': 0.5770057033431168, 'batch_norm': False, 'lr': 4.491376289054609e-05, 'weight_decay': 7.782858421225302e-06, 'epochs': 62, 'loss': 'mae', 'optimizer': 'adam', 'graph_mode': 'off', 'use_snp_selection': False}. Best is trial 37 with value: 0.25786006345063966.
[I 2025-12-05 17:05:46,249] Trial 59 finished with value: 0.19158342190462874 and parameters: {'model_type': 'mlp', 'hidden_dims': '[512, 256]', 'dropout': 0.5569827570694869, 'batch_norm': False, 'lr': 1.4130333731794654e-06, 'weight_decay': 0.0005918719149403503, 'epochs': 171, 'loss': 'mae', 'optimizer': 'adam', 'graph_mode': 'off', 'use_snp_selection': True, 'num_snps': 28807}. Best is trial 37 with value: 0.25786006345063966.
[I 2025-12-05 17:07:12,659] Trial 60 finished with value: 0.23206093413220388 and parameters: {'model_type': 'mlp', 'hidden_dims': '[512, 64]', 'dropout': 0.47689833342149024, 'batch_norm': False, 'lr': 4.685617105978253e-06, 'weight_decay': 3.681205669096282e-06, 'epochs': 145, 'loss': 'mae', 'optimizer': 'adam', 'graph_mode': 'off', 'use_snp_selection': True, 'num_snps': 55586}. Best is trial 37 with value: 0.25786006345063966.
[I 2025-12-05 17:08:57,154] Trial 61 finished with value: 0.23187507543592423 and parameters: {'model_type': 'mlp', 'hidden_dims': '[512, 64]', 'dropout': 0.5174611169242659, 'batch_norm': False, 'lr': 3.946765989385806e-06, 'weight_decay': 0.000168743911707141, 'epochs': 214, 'loss': 'mae', 'optimizer': 'adam', 'graph_mode': 'off', 'use_snp_selection': True, 'num_snps': 57064}. Best is trial 37 with value: 0.25786006345063966.
[I 2025-12-05 17:10:49,837] Trial 62 finished with value: 0.2287939628031257 and parameters: {'model_type': 'mlp', 'hidden_dims': '[512, 64]', 'dropout': 0.5261517983572633, 'batch_norm': False, 'lr': 9.627104922055764e-06, 'weight_decay': 0.0002876357595349512, 'epochs': 279, 'loss': 'mae', 'optimizer': 'adam', 'graph_mode': 'off', 'use_snp_selection': True, 'num_snps': 52074}. Best is trial 37 with value: 0.25786006345063966.
[I 2025-12-05 17:12:15,058] Trial 63 finished with value: 0.25553549546887677 and parameters: {'model_type': 'mlp', 'hidden_dims': '[512, 64]', 'dropout': 0.5392760866724712, 'batch_norm': False, 'lr': 1.70066925572117e-05, 'weight_decay': 0.00010322076086265843, 'epochs': 185, 'loss': 'mae', 'optimizer': 'adam', 'graph_mode': 'off', 'use_snp_selection': True, 'num_snps': 47451}. Best is trial 37 with value: 0.25786006345063966.
[I 2025-12-05 17:13:42,645] Trial 64 finished with value: 0.23890239470910543 and parameters: {'model_type': 'mlp', 'hidden_dims': '[512, 64]', 'dropout': 0.5847664690816206, 'batch_norm': False, 'lr': 1.7575710815957476e-05, 'weight_decay': 3.8506199874443745e-05, 'epochs': 187, 'loss': 'mae', 'optimizer': 'adam', 'graph_mode': 'off', 'use_snp_selection': True, 'num_snps': 48932}. Best is trial 37 with value: 0.25786006345063966.
[I 2025-12-05 17:14:57,824] Trial 65 finished with value: 0.24459087301906987 and parameters: {'model_type': 'mlp', 'hidden_dims': '[512, 64]', 'dropout': 0.5527469078492705, 'batch_norm': False, 'lr': 1.2974559488976768e-05, 'weight_decay': 2.222246597531938e-05, 'epochs': 166, 'loss': 'mae', 'optimizer': 'adam', 'graph_mode': 'off', 'use_snp_selection': True, 'num_snps': 42294}. Best is trial 37 with value: 0.25786006345063966.
[I 2025-12-05 17:15:29,970] Trial 66 finished with value: 0.22681200476884963 and parameters: {'model_type': 'mlp', 'hidden_dims': '[256, 128]', 'dropout': 0.5371534899997036, 'batch_norm': False, 'lr': 2.1461883804470374e-05, 'weight_decay': 1.1540429765809248e-05, 'epochs': 183, 'loss': 'mae', 'optimizer': 'adam', 'graph_mode': 'off', 'use_snp_selection': False}. Best is trial 37 with value: 0.25786006345063966.
[I 2025-12-05 17:17:05,222] Trial 67 finished with value: 0.22446658113423273 and parameters: {'model_type': 'mlp', 'hidden_dims': '[512, 256]', 'dropout': 0.5999369550753098, 'batch_norm': False, 'lr': 6.520212484731386e-05, 'weight_decay': 8.152096475772346e-05, 'epochs': 313, 'loss': 'mae', 'optimizer': 'adam', 'graph_mode': 'off', 'use_snp_selection': True, 'num_snps': 38853}. Best is trial 37 with value: 0.25786006345063966.
[I 2025-12-05 17:18:13,054] Trial 68 finished with value: 0.23781992415182923 and parameters: {'model_type': 'mlp', 'hidden_dims': '[512, 128]', 'dropout': 0.561626147088798, 'batch_norm': False, 'lr': 8.596885789687485e-06, 'weight_decay': 5.6114487775338226e-05, 'epochs': 100, 'loss': 'mse', 'optimizer': 'adam', 'graph_mode': 'off', 'use_snp_selection': True, 'num_snps': 46442}. Best is trial 37 with value: 0.25786006345063966.
[I 2025-12-05 17:19:13,116] Trial 69 finished with value: 0.23284480366569643 and parameters: {'model_type': 'mlp', 'hidden_dims': '[128, 64]', 'dropout': 0.5013638718911158, 'batch_norm': False, 'lr': 1.4072759206693012e-05, 'weight_decay': 0.00044251356007275636, 'epochs': 197, 'loss': 'mae', 'optimizer': 'adam', 'graph_mode': 'off', 'use_snp_selection': True, 'num_snps': 52289}. Best is trial 37 with value: 0.25786006345063966.
[I 2025-12-05 17:20:12,414] Trial 70 finished with value: 0.23648956343449107 and parameters: {'model_type': 'mlp', 'hidden_dims': '[256, 128, 64]', 'dropout': 0.36874585208978095, 'batch_norm': True, 'lr': 3.0614955697084684e-05, 'weight_decay': 1.7140432724218144e-05, 'epochs': 224, 'loss': 'mae', 'optimizer': 'adam', 'graph_mode': 'off', 'use_snp_selection': True, 'num_snps': 33753}. Best is trial 37 with value: 0.25786006345063966.
[I 2025-12-05 17:21:57,204] Trial 71 finished with value: 0.222127125383243 and parameters: {'model_type': 'mlp', 'hidden_dims': '[512, 64]', 'dropout': 0.4550310944716406, 'batch_norm': False, 'lr': 2.3602070735313467e-06, 'weight_decay': 0.00010563552748537043, 'epochs': 211, 'loss': 'mae', 'optimizer': 'adam', 'graph_mode': 'off', 'use_snp_selection': True, 'num_snps': 58559}. Best is trial 37 with value: 0.25786006345063966.
[I 2025-12-05 17:23:25,957] Trial 72 finished with value: 0.25101247832711204 and parameters: {'model_type': 'mlp', 'hidden_dims': '[512, 64]', 'dropout': 0.5328712458657051, 'batch_norm': False, 'lr': 4.729722207759661e-06, 'weight_decay': 0.00015843489207215065, 'epochs': 152, 'loss': 'mae', 'optimizer': 'adam', 'graph_mode': 'off', 'use_snp_selection': True, 'num_snps': 56846}. Best is trial 37 with value: 0.25786006345063966.
[I 2025-12-05 17:24:52,195] Trial 73 finished with value: 0.24271820294653046 and parameters: {'model_type': 'mlp', 'hidden_dims': '[512, 64]', 'dropout': 0.5356701739994624, 'batch_norm': False, 'lr': 5.262378981148141e-06, 'weight_decay': 0.00022958205685287623, 'epochs': 150, 'loss': 'mae', 'optimizer': 'adam', 'graph_mode': 'off', 'use_snp_selection': True, 'num_snps': 55295}. Best is trial 37 with value: 0.25786006345063966.
[I 2025-12-05 17:26:18,333] Trial 74 finished with value: 0.24173396059924973 and parameters: {'model_type': 'mlp', 'hidden_dims': '[512, 64]', 'dropout': 0.5767644608844726, 'batch_norm': False, 'lr': 3.1674740465423067e-06, 'weight_decay': 0.0001437012884480484, 'epochs': 141, 'loss': 'mae', 'optimizer': 'adam', 'graph_mode': 'off', 'use_snp_selection': True, 'num_snps': 57140}. Best is trial 37 with value: 0.25786006345063966.
[I 2025-12-05 17:27:43,984] Trial 75 finished with value: 0.2411427235270332 and parameters: {'model_type': 'mlp', 'hidden_dims': '[512, 64]', 'dropout': 0.47528350974424116, 'batch_norm': False, 'lr': 7.96598155876545e-06, 'weight_decay': 0.00035875228039872344, 'epochs': 156, 'loss': 'mae', 'optimizer': 'adam', 'graph_mode': 'off', 'use_snp_selection': True, 'num_snps': 53155}. Best is trial 37 with value: 0.25786006345063966.
[I 2025-12-05 17:29:11,530] Trial 76 finished with value: 0.23547613700405745 and parameters: {'model_type': 'mlp', 'hidden_dims': '[512, 64]', 'dropout': 0.30908524788095504, 'batch_norm': False, 'lr': 6.0908588328431164e-06, 'weight_decay': 5.194423124290413e-06, 'epochs': 178, 'loss': 'mae', 'optimizer': 'adam', 'graph_mode': 'off', 'use_snp_selection': True, 'num_snps': 50041}. Best is trial 37 with value: 0.25786006345063966.
[I 2025-12-05 17:29:42,678] Trial 77 finished with value: 0.2447298864493413 and parameters: {'model_type': 'mlp', 'hidden_dims': '[512, 256]', 'dropout': 0.5839339210969722, 'batch_norm': False, 'lr': 2.3492592859659567e-05, 'weight_decay': 3.890691886198312e-05, 'epochs': 85, 'loss': 'mae', 'optimizer': 'adam', 'graph_mode': 'off', 'use_snp_selection': False}. Best is trial 37 with value: 0.25786006345063966.
[I 2025-12-05 17:30:55,514] Trial 78 finished with value: 0.23963238841762485 and parameters: {'model_type': 'mlp', 'hidden_dims': '[512, 64]', 'dropout': 0.5660228352697975, 'batch_norm': False, 'lr': 4.646280953600904e-06, 'weight_decay': 6.871057011736385e-05, 'epochs': 120, 'loss': 'mae', 'optimizer': 'adam', 'graph_mode': 'off', 'use_snp_selection': True, 'num_snps': 47775}. Best is trial 37 with value: 0.25786006345063966.
[I 2025-12-05 17:32:40,267] Trial 79 finished with value: 0.20824750701736366 and parameters: {'model_type': 'mlp', 'hidden_dims': '[512, 64]', 'dropout': 0.4135025124263918, 'batch_norm': False, 'lr': 1.711007240128535e-05, 'weight_decay': 2.9668015360434475e-06, 'epochs': 332, 'loss': 'mse', 'optimizer': 'adam', 'graph_mode': 'off', 'use_snp_selection': True, 'num_snps': 42869}. Best is trial 37 with value: 0.25786006345063966.
[I 2025-12-05 17:33:51,020] Trial 80 finished with value: 0.22325572602986493 and parameters: {'model_type': 'mlp', 'hidden_dims': '[512, 64]', 'dropout': 0.4377218088815696, 'batch_norm': False, 'lr': 3.5221856897162265e-06, 'weight_decay': 2.7176364196673523e-05, 'epochs': 70, 'loss': 'mae', 'optimizer': 'adam', 'graph_mode': 'off', 'use_snp_selection': True, 'num_snps': 59994}. Best is trial 37 with value: 0.25786006345063966.
[I 2025-12-05 17:35:32,696] Trial 81 finished with value: 0.2255815709965913 and parameters: {'model_type': 'mlp', 'hidden_dims': '[512, 64]', 'dropout': 0.5161122440100212, 'batch_norm': False, 'lr': 2.824493612419214e-06, 'weight_decay': 0.0001531071119743212, 'epochs': 205, 'loss': 'mae', 'optimizer': 'adam', 'graph_mode': 'off', 'use_snp_selection': True, 'num_snps': 57127}. Best is trial 37 with value: 0.25786006345063966.
[I 2025-12-05 17:36:53,737] Trial 82 finished with value: 0.25173933091348755 and parameters: {'model_type': 'mlp', 'hidden_dims': '[512, 64]', 'dropout': 0.4883667532087784, 'batch_norm': False, 'lr': 1.800035488961113e-06, 'weight_decay': 0.00021717204007564843, 'epochs': 133, 'loss': 'mae', 'optimizer': 'adam', 'graph_mode': 'off', 'use_snp_selection': True, 'num_snps': 54400}. Best is trial 37 with value: 0.25786006345063966.
[I 2025-12-05 17:38:15,448] Trial 83 finished with value: 0.25174248790740444 and parameters: {'model_type': 'mlp', 'hidden_dims': '[512, 64]', 'dropout': 0.49443255469473385, 'batch_norm': False, 'lr': 1.9697252413381647e-06, 'weight_decay': 0.0005771890508838752, 'epochs': 134, 'loss': 'mae', 'optimizer': 'adam', 'graph_mode': 'off', 'use_snp_selection': True, 'num_snps': 54130}. Best is trial 37 with value: 0.25786006345063966.
[I 2025-12-05 17:39:36,417] Trial 84 finished with value: 0.21190176817688725 and parameters: {'model_type': 'mlp', 'hidden_dims': '[512, 64]', 'dropout': 0.4878699620006812, 'batch_norm': False, 'lr': 1.8715654177728426e-06, 'weight_decay': 0.00022385022978403579, 'epochs': 132, 'loss': 'mae', 'optimizer': 'adam', 'graph_mode': 'off', 'use_snp_selection': True, 'num_snps': 53768}. Best is trial 37 with value: 0.25786006345063966.
[I 2025-12-05 17:41:02,193] Trial 85 finished with value: 0.22528664359721656 and parameters: {'model_type': 'mlp', 'hidden_dims': '[512, 64]', 'dropout': 0.5013767996115692, 'batch_norm': False, 'lr': 1.3242486891679457e-06, 'weight_decay': 0.0009025326508412183, 'epochs': 166, 'loss': 'mae', 'optimizer': 'adam', 'graph_mode': 'off', 'use_snp_selection': True, 'num_snps': 50473}. Best is trial 37 with value: 0.25786006345063966.
[I 2025-12-05 17:42:10,339] Trial 86 finished with value: 0.2183611619493953 and parameters: {'model_type': 'mlp', 'hidden_dims': '[256, 128]', 'dropout': 0.46413935098407944, 'batch_norm': False, 'lr': 2.0545657894502735e-06, 'weight_decay': 0.0004059127991450432, 'epochs': 136, 'loss': 'mae', 'optimizer': 'adam', 'graph_mode': 'off', 'use_snp_selection': True, 'num_snps': 56320}. Best is trial 37 with value: 0.25786006345063966.
[I 2025-12-05 17:43:09,349] Trial 87 finished with value: 0.10298180254142957 and parameters: {'model_type': 'mlp', 'hidden_dims': '[128, 64]', 'dropout': 0.5312187801929307, 'batch_norm': True, 'lr': 1.3175025501239648e-06, 'weight_decay': 9.330983723526108e-05, 'epochs': 152, 'loss': 'mae', 'optimizer': 'adam', 'graph_mode': 'off', 'use_snp_selection': True, 'num_snps': 54589}. Best is trial 37 with value: 0.25786006345063966.
[I 2025-12-05 17:44:08,729] Trial 88 finished with value: 0.23447266249783438 and parameters: {'model_type': 'mlp', 'hidden_dims': '[512, 64]', 'dropout': 0.47855532033638504, 'batch_norm': False, 'lr': 2.5303539868297604e-06, 'weight_decay': 0.0005373669935042694, 'epochs': 106, 'loss': 'mae', 'optimizer': 'adam', 'graph_mode': 'off', 'use_snp_selection': True, 'num_snps': 35853}. Best is trial 37 with value: 0.25786006345063966.
[I 2025-12-05 17:45:29,857] Trial 89 finished with value: 0.21086031359893412 and parameters: {'model_type': 'mlp', 'hidden_dims': '[512, 128]', 'dropout': 0.44898286586970426, 'batch_norm': False, 'lr': 1.6285299768428391e-06, 'weight_decay': 0.0002802641483820161, 'epochs': 117, 'loss': 'mae', 'optimizer': 'adam', 'graph_mode': 'off', 'use_snp_selection': True, 'num_snps': 58091}. Best is trial 37 with value: 0.25786006345063966.
[I 2025-12-05 17:46:03,570] Trial 90 finished with value: 0.19044581433471738 and parameters: {'model_type': 'mlp', 'hidden_dims': '[512, 256]', 'dropout': 0.5121883364867643, 'batch_norm': False, 'lr': 0.0008591258697358648, 'weight_decay': 0.0007292196693941708, 'epochs': 143, 'loss': 'mae', 'optimizer': 'adam', 'graph_mode': 'off', 'use_snp_selection': True, 'num_snps': 3009}. Best is trial 37 with value: 0.25786006345063966.
[I 2025-12-05 17:47:00,723] Trial 91 finished with value: 0.20487565996380405 and parameters: {'model_type': 'mlp', 'hidden_dims': '[512, 64]', 'dropout': 0.5469622414958006, 'batch_norm': False, 'lr': 2.221658002548013e-06, 'weight_decay': 0.0001935685674311963, 'epochs': 125, 'loss': 'mae', 'optimizer': 'adam', 'graph_mode': 'off', 'use_snp_selection': True, 'num_snps': 30286}. Best is trial 37 with value: 0.25786006345063966.
[I 2025-12-05 17:47:53,038] Trial 92 finished with value: 0.23294688602156727 and parameters: {'model_type': 'mlp', 'hidden_dims': '[512, 64]', 'dropout': 0.5876386892923905, 'batch_norm': False, 'lr': 6.6635514316121614e-06, 'weight_decay': 8.988529618859872e-06, 'epochs': 161, 'loss': 'mae', 'optimizer': 'adam', 'graph_mode': 'off', 'use_snp_selection': False}. Best is trial 37 with value: 0.25786006345063966.
[I 2025-12-05 17:48:54,466] Trial 93 finished with value: 0.23327044844302378 and parameters: {'model_type': 'mlp', 'hidden_dims': '[512, 64]', 'dropout': 0.5623161117466834, 'batch_norm': False, 'lr': 1.1698192708693057e-05, 'weight_decay': 0.0006641023562242874, 'epochs': 48, 'loss': 'mae', 'optimizer': 'adam', 'graph_mode': 'off', 'use_snp_selection': True, 'num_snps': 53248}. Best is trial 37 with value: 0.25786006345063966.
[I 2025-12-05 17:50:20,612] Trial 94 finished with value: 0.21581417139240133 and parameters: {'model_type': 'mlp', 'hidden_dims': '[512, 64]', 'dropout': 0.4936763060360381, 'batch_norm': False, 'lr': 2.698309750553611e-05, 'weight_decay': 2.124378275716312e-06, 'epochs': 169, 'loss': 'mae', 'optimizer': 'adam', 'graph_mode': 'off', 'use_snp_selection': True, 'num_snps': 51199}. Best is trial 37 with value: 0.25786006345063966.
[I 2025-12-05 17:51:25,554] Trial 95 finished with value: 0.2548982935782619 and parameters: {'model_type': 'mlp', 'hidden_dims': '[512, 64]', 'dropout': 0.5465219520112283, 'batch_norm': False, 'lr': 0.0002087355683225882, 'weight_decay': 0.00012332262729711937, 'epochs': 130, 'loss': 'mae', 'optimizer': 'adam', 'graph_mode': 'off', 'use_snp_selection': True, 'num_snps': 38558}. Best is trial 37 with value: 0.25786006345063966.
[I 2025-12-05 17:52:20,213] Trial 96 finished with value: 0.21336083087514973 and parameters: {'model_type': 'mlp', 'hidden_dims': '[256, 128, 64]', 'dropout': 0.2747704568144968, 'batch_norm': False, 'lr': 0.00019625826860598797, 'weight_decay': 0.0001328482922255898, 'epochs': 130, 'loss': 'mse', 'optimizer': 'adam', 'graph_mode': 'off', 'use_snp_selection': True, 'num_snps': 37934}. Best is trial 37 with value: 0.25786006345063966.
[I 2025-12-05 17:53:29,654] Trial 97 finished with value: 0.23836130162540323 and parameters: {'model_type': 'mlp', 'hidden_dims': '[512, 64]', 'dropout': 0.5406943960316246, 'batch_norm': False, 'lr': 0.00031582323498524737, 'weight_decay': 9.461493947544197e-05, 'epochs': 181, 'loss': 'mae', 'optimizer': 'adam', 'graph_mode': 'off', 'use_snp_selection': True, 'num_snps': 35027}. Best is trial 37 with value: 0.25786006345063966.
[I 2025-12-05 17:54:39,454] Trial 98 finished with value: 0.24637476087761975 and parameters: {'model_type': 'mlp', 'hidden_dims': '[512, 64]', 'dropout': 0.5245891012323035, 'batch_norm': False, 'lr': 0.00012689482534682694, 'weight_decay': 6.635295206907834e-05, 'epochs': 151, 'loss': 'mae', 'optimizer': 'adam', 'graph_mode': 'off', 'use_snp_selection': True, 'num_snps': 39787}. Best is trial 37 with value: 0.25786006345063966.
[I 2025-12-05 17:55:44,173] Trial 99 finished with value: 0.2117964952376997 and parameters: {'model_type': 'mlp', 'hidden_dims': '[512, 64]', 'dropout': 0.12169008555450297, 'batch_norm': False, 'lr': 1.1965676063724674e-06, 'weight_decay': 4.8304347263636985e-05, 'epochs': 109, 'loss': 'mae', 'optimizer': 'adam', 'graph_mode': 'off', 'use_snp_selection': True, 'num_snps': 41400}. Best is trial 37 with value: 0.25786006345063966.
[I 2025-12-05 17:56:51,682] Trial 100 finished with value: 0.23332340862603568 and parameters: {'model_type': 'mlp', 'hidden_dims': '[512, 256]', 'dropout': 0.5135189375863334, 'batch_norm': True, 'lr': 0.000213701922789726, 'weight_decay': 0.00026160534724141226, 'epochs': 145, 'loss': 'mae', 'optimizer': 'adam', 'graph_mode': 'off', 'use_snp_selection': True, 'num_snps': 37331}. Best is trial 37 with value: 0.25786006345063966.
[I 2025-12-05 17:58:07,537] Trial 101 finished with value: 0.22316001466211888 and parameters: {'model_type': 'mlp', 'hidden_dims': '[512, 64]', 'dropout': 0.5314484949954561, 'batch_norm': False, 'lr': 0.0001399306885618781, 'weight_decay': 0.00011683249407505818, 'epochs': 155, 'loss': 'mae', 'optimizer': 'adam', 'graph_mode': 'off', 'use_snp_selection': True, 'num_snps': 44646}. Best is trial 37 with value: 0.25786006345063966.
[I 2025-12-05 17:59:08,328] Trial 102 finished with value: 0.23960375772433556 and parameters: {'model_type': 'mlp', 'hidden_dims': '[512, 64]', 'dropout': 0.5242331238916786, 'batch_norm': False, 'lr': 0.00014351477849873777, 'weight_decay': 6.243926259834823e-05, 'epochs': 139, 'loss': 'mae', 'optimizer': 'adam', 'graph_mode': 'off', 'use_snp_selection': True, 'num_snps': 32307}. Best is trial 37 with value: 0.25786006345063966.
[I 2025-12-05 18:00:19,217] Trial 103 finished with value: 0.24939840026051438 and parameters: {'model_type': 'mlp', 'hidden_dims': '[512, 64]', 'dropout': 0.551933420646622, 'batch_norm': False, 'lr': 0.0002636037596562785, 'weight_decay': 3.5934609436731236e-05, 'epochs': 161, 'loss': 'mae', 'optimizer': 'adam', 'graph_mode': 'off', 'use_snp_selection': True, 'num_snps': 39681}. Best is trial 37 with value: 0.25786006345063966.
[I 2025-12-05 18:01:49,187] Trial 104 finished with value: 0.19128240114324377 and parameters: {'model_type': 'mlp', 'hidden_dims': '[512, 64]', 'dropout': 0.5527511703815505, 'batch_norm': False, 'lr': 0.0006325660592914936, 'weight_decay': 3.9514634955756574e-05, 'epochs': 162, 'loss': 'mae', 'optimizer': 'adam', 'graph_mode': 'off', 'use_snp_selection': True, 'num_snps': 55875}. Best is trial 37 with value: 0.25786006345063966.
[I 2025-12-05 18:03:03,637] Trial 105 finished with value: 0.2517374255965524 and parameters: {'model_type': 'mlp', 'hidden_dims': '[512, 64]', 'dropout': 0.5717731581684743, 'batch_norm': False, 'lr': 0.0003956737131730951, 'weight_decay': 0.00017227711448775, 'epochs': 187, 'loss': 'mae', 'optimizer': 'adam', 'graph_mode': 'off', 'use_snp_selection': True, 'num_snps': 39134}. Best is trial 37 with value: 0.25786006345063966.
[I 2025-12-05 18:04:14,255] Trial 106 finished with value: 0.24959475096495432 and parameters: {'model_type': 'mlp', 'hidden_dims': '[512, 64]', 'dropout': 0.5712982535496448, 'batch_norm': False, 'lr': 0.0004379304327030024, 'weight_decay': 0.00017504623740827844, 'epochs': 191, 'loss': 'mae', 'optimizer': 'adam', 'graph_mode': 'off', 'use_snp_selection': True, 'num_snps': 34375}. Best is trial 37 with value: 0.25786006345063966.
