[I 2025-12-05 14:41:13,962] Trial 66 finished with value: 0.15678119328312953 and parameters: {'model_type': 'mlp', 'hidden_dims': '[512, 128]', 'dropout': 0.16042613048368212, 'batch_norm': True, 'lr': 0.00045224593747748897, 'weight_decay': 1.3175762620008855e-06, 'epochs': 247, 'loss': 'mae', 'optimizer': 'adam', 'graph_mode': 'off', 'use_snp_selection': False}. Best is trial 52 with value: 0.1769979941376395.
[I 2025-12-05 14:41:17,141] Trial 67 finished with value: 0.11818133209457267 and parameters: {'model_type': 'mlp', 'hidden_dims': '[512, 256]', 'dropout': 0.18011272112427135, 'batch_norm': True, 'lr': 0.00010117023530751639, 'weight_decay': 2.4926237275568092e-06, 'epochs': 260, 'loss': 'mae', 'optimizer': 'adam', 'graph_mode': 'off', 'use_snp_selection': True, 'num_snps': 22951}. Best is trial 52 with value: 0.1769979941376395.
[I 2025-12-05 14:41:20,466] Trial 68 finished with value: 0.13615932669708358 and parameters: {'model_type': 'mlp', 'hidden_dims': '[512, 128]', 'dropout': 0.15607202936535305, 'batch_norm': True, 'lr': 5.959104562001616e-05, 'weight_decay': 6.056679145399965e-07, 'epochs': 214, 'loss': 'mae', 'optimizer': 'adam', 'graph_mode': 'off', 'use_snp_selection': False}. Best is trial 52 with value: 0.1769979941376395.
[I 2025-12-05 14:41:24,233] Trial 69 finished with value: 0.15097173369267253 and parameters: {'model_type': 'mlp', 'hidden_dims': '[512, 128]', 'dropout': 0.1374007147815603, 'batch_norm': True, 'lr': 0.0003431536185068721, 'weight_decay': 2.3047972229011737e-07, 'epochs': 247, 'loss': 'mae', 'optimizer': 'adam', 'graph_mode': 'off', 'use_snp_selection': False}. Best is trial 52 with value: 0.1769979941376395.
[I 2025-12-05 14:41:25,565] Trial 70 finished with value: 0.13214706015820687 and parameters: {'model_type': 'mlp', 'hidden_dims': '[128, 64]', 'dropout': 0.11642359650701754, 'batch_norm': False, 'lr': 0.00022343123268950084, 'weight_decay': 8.172406135246646e-07, 'epochs': 257, 'loss': 'mae', 'optimizer': 'adam', 'graph_mode': 'off', 'use_snp_selection': False}. Best is trial 52 with value: 0.1769979941376395.
[I 2025-12-05 14:41:30,046] Trial 71 finished with value: 0.16503324687059112 and parameters: {'model_type': 'mlp', 'hidden_dims': '[512, 128]', 'dropout': 0.1128879643870341, 'batch_norm': True, 'lr': 0.0008084238295167394, 'weight_decay': 2.84611424784611e-07, 'epochs': 306, 'loss': 'mae', 'optimizer': 'adam', 'graph_mode': 'off', 'use_snp_selection': False}. Best is trial 52 with value: 0.1769979941376395.
[I 2025-12-05 14:41:34,077] Trial 72 finished with value: 0.1642652043142504 and parameters: {'model_type': 'mlp', 'hidden_dims': '[512, 128]', 'dropout': 0.1022196159049846, 'batch_norm': True, 'lr': 0.0007922202181124758, 'weight_decay': 2.8523332789024276e-07, 'epochs': 266, 'loss': 'mae', 'optimizer': 'adam', 'graph_mode': 'off', 'use_snp_selection': False}. Best is trial 52 with value: 0.1769979941376395.
[I 2025-12-05 14:41:38,255] Trial 73 finished with value: 0.1655393258228112 and parameters: {'model_type': 'mlp', 'hidden_dims': '[512, 128]', 'dropout': 0.14054857443194282, 'batch_norm': True, 'lr': 0.0006318043775009291, 'weight_decay': 0.0009723175659163882, 'epochs': 281, 'loss': 'mae', 'optimizer': 'adam', 'graph_mode': 'off', 'use_snp_selection': False}. Best is trial 52 with value: 0.1769979941376395.
[I 2025-12-05 14:41:40,450] Trial 74 finished with value: 0.15826324693552707 and parameters: {'model_type': 'mlp', 'hidden_dims': '[256, 128]', 'dropout': 0.16850468309062722, 'batch_norm': True, 'lr': 0.0005796952188623777, 'weight_decay': 0.0008866247593370236, 'epochs': 233, 'loss': 'mae', 'optimizer': 'adam', 'graph_mode': 'off', 'use_snp_selection': False}. Best is trial 52 with value: 0.1769979941376395.
[I 2025-12-05 14:41:44,995] Trial 75 finished with value: 0.16004674599059934 and parameters: {'model_type': 'mlp', 'hidden_dims': '[512, 128]', 'dropout': 0.13708382535496338, 'batch_norm': True, 'lr': 0.0002975605834171266, 'weight_decay': 0.0004350935129184041, 'epochs': 311, 'loss': 'mae', 'optimizer': 'adam', 'graph_mode': 'off', 'use_snp_selection': False}. Best is trial 52 with value: 0.1769979941376395.
[I 2025-12-05 14:41:46,215] Trial 76 finished with value: 0.15055150647792626 and parameters: {'model_type': 'mlp', 'hidden_dims': '[512, 256]', 'dropout': 0.1923409772843789, 'batch_norm': True, 'lr': 0.0007933555649530295, 'weight_decay': 0.00012571559457429763, 'epochs': 40, 'loss': 'mae', 'optimizer': 'adam', 'graph_mode': 'off', 'use_snp_selection': False}. Best is trial 52 with value: 0.1769979941376395.
[I 2025-12-05 14:41:49,505] Trial 77 finished with value: 0.15720781555186164 and parameters: {'model_type': 'mlp', 'hidden_dims': '[512, 128]', 'dropout': 0.15307130558161006, 'batch_norm': True, 'lr': 0.00014304543633611322, 'weight_decay': 0.0007447688264389933, 'epochs': 208, 'loss': 'mse', 'optimizer': 'adam', 'graph_mode': 'off', 'use_snp_selection': False}. Best is trial 52 with value: 0.1769979941376395.
[I 2025-12-05 14:41:51,395] Trial 78 finished with value: -0.01800444422389279 and parameters: {'model_type': 'mlp', 'hidden_dims': '[256, 128, 64]', 'dropout': 0.36604304893717643, 'batch_norm': True, 'lr': 1.0087771566710253e-06, 'weight_decay': 0.0001871159865235435, 'epochs': 301, 'loss': 'mae', 'optimizer': 'adam', 'graph_mode': 'off', 'use_snp_selection': True, 'num_snps': 2246}. Best is trial 52 with value: 0.1769979941376395.
[I 2025-12-05 14:41:55,463] Trial 79 finished with value: 0.1574640687234688 and parameters: {'model_type': 'mlp', 'hidden_dims': '[512, 64]', 'dropout': 0.20659100872138075, 'batch_norm': True, 'lr': 0.00041856672260680045, 'weight_decay': 3.355536014281153e-07, 'epochs': 269, 'loss': 'mae', 'optimizer': 'adam', 'graph_mode': 'off', 'use_snp_selection': False}. Best is trial 52 with value: 0.1769979941376395.
[I 2025-12-05 14:42:00,348] Trial 80 finished with value: 0.15203637696446895 and parameters: {'model_type': 'mlp', 'hidden_dims': '[512, 128]', 'dropout': 0.11282748877804989, 'batch_norm': True, 'lr': 0.00026306097579094535, 'weight_decay': 1.4682812884761924e-07, 'epochs': 335, 'loss': 'mae', 'optimizer': 'adam', 'graph_mode': 'off', 'use_snp_selection': False}. Best is trial 52 with value: 0.1769979941376395.
[I 2025-12-05 14:42:04,487] Trial 81 finished with value: 0.15261732515766874 and parameters: {'model_type': 'mlp', 'hidden_dims': '[512, 128]', 'dropout': 0.1273890838839467, 'batch_norm': True, 'lr': 0.0005965879422595544, 'weight_decay': 8.014215312371498e-05, 'epochs': 278, 'loss': 'mae', 'optimizer': 'adam', 'graph_mode': 'off', 'use_snp_selection': False}. Best is trial 52 with value: 0.1769979941376395.
[I 2025-12-05 14:42:08,790] Trial 82 finished with value: 0.1610329009787449 and parameters: {'model_type': 'mlp', 'hidden_dims': '[512, 128]', 'dropout': 0.11337469400298907, 'batch_norm': True, 'lr': 0.0004733422347701767, 'weight_decay': 1.6951983914844138e-06, 'epochs': 290, 'loss': 'mae', 'optimizer': 'adam', 'graph_mode': 'off', 'use_snp_selection': False}. Best is trial 52 with value: 0.1769979941376395.
[I 2025-12-05 14:42:13,001] Trial 83 finished with value: 0.15899114549802126 and parameters: {'model_type': 'mlp', 'hidden_dims': '[512, 128]', 'dropout': 0.13772442701940668, 'batch_norm': True, 'lr': 0.0008358500397078958, 'weight_decay': 5.682464254324578e-07, 'epochs': 280, 'loss': 'mae', 'optimizer': 'adam', 'graph_mode': 'off', 'use_snp_selection': False}. Best is trial 52 with value: 0.1769979941376395.
[I 2025-12-05 14:42:16,888] Trial 84 finished with value: 0.14591946341816553 and parameters: {'model_type': 'mlp', 'hidden_dims': '[512, 128]', 'dropout': 0.171656654447689, 'batch_norm': True, 'lr': 0.0003510087281083489, 'weight_decay': 0.0002418006209207913, 'epochs': 255, 'loss': 'mae', 'optimizer': 'adam', 'graph_mode': 'off', 'use_snp_selection': False}. Best is trial 52 with value: 0.1769979941376395.
[I 2025-12-05 14:42:19,092] Trial 85 finished with value: 0.15614647614198643 and parameters: {'model_type': 'mlp', 'hidden_dims': '[256, 128]', 'dropout': 0.15136508173050572, 'batch_norm': True, 'lr': 0.0006298938013556017, 'weight_decay': 8.542436902840388e-07, 'epochs': 241, 'loss': 'mae', 'optimizer': 'adam', 'graph_mode': 'off', 'use_snp_selection': False}. Best is trial 52 with value: 0.1769979941376395.
[I 2025-12-05 14:42:23,471] Trial 86 finished with value: 0.12928123590613294 and parameters: {'model_type': 'mlp', 'hidden_dims': '[512, 128]', 'dropout': 0.1243719089984482, 'batch_norm': False, 'lr': 0.0002064392554581273, 'weight_decay': 1.2437259328694047e-06, 'epochs': 305, 'loss': 'mae', 'optimizer': 'adam', 'graph_mode': 'off', 'use_snp_selection': False}. Best is trial 52 with value: 0.1769979941376395.
[I 2025-12-05 14:42:26,939] Trial 87 finished with value: 0.16151449936754514 and parameters: {'model_type': 'mlp', 'hidden_dims': '[512, 256]', 'dropout': 0.1868439640232244, 'batch_norm': True, 'lr': 0.00043194973313013125, 'weight_decay': 2.3767640676653992e-07, 'epochs': 221, 'loss': 'mae', 'optimizer': 'adam', 'graph_mode': 'off', 'use_snp_selection': False}. Best is trial 52 with value: 0.1769979941376395.
[I 2025-12-05 14:42:31,638] Trial 88 finished with value: 0.16701745897891798 and parameters: {'model_type': 'mlp', 'hidden_dims': '[512, 128]', 'dropout': 0.1139671865233482, 'batch_norm': True, 'lr': 0.0005205865244343455, 'weight_decay': 3.667915241452381e-05, 'epochs': 322, 'loss': 'mse', 'optimizer': 'adam', 'graph_mode': 'off', 'use_snp_selection': False}. Best is trial 52 with value: 0.1769979941376395.
[I 2025-12-05 14:42:36,407] Trial 89 finished with value: 0.1553659607809757 and parameters: {'model_type': 'mlp', 'hidden_dims': '[512, 128]', 'dropout': 0.29383300175032123, 'batch_norm': True, 'lr': 0.00033033483392213404, 'weight_decay': 3.5926131427441394e-05, 'epochs': 326, 'loss': 'mse', 'optimizer': 'adam', 'graph_mode': 'off', 'use_snp_selection': False}. Best is trial 52 with value: 0.1769979941376395.
[I 2025-12-05 14:42:39,878] Trial 90 finished with value: 0.13582790616599927 and parameters: {'model_type': 'mlp', 'hidden_dims': '[128, 64]', 'dropout': 0.10088589222976221, 'batch_norm': True, 'lr': 0.0007000521340909207, 'weight_decay': 6.89222255278922e-05, 'epochs': 322, 'loss': 'mse', 'optimizer': 'adam', 'graph_mode': 'off', 'use_snp_selection': True, 'num_snps': 48165}. Best is trial 52 with value: 0.1769979941376395.
[I 2025-12-05 14:42:44,262] Trial 91 finished with value: 0.1580166744379176 and parameters: {'model_type': 'mlp', 'hidden_dims': '[512, 128]', 'dropout': 0.11648423307835412, 'batch_norm': True, 'lr': 0.0005196893824423447, 'weight_decay': 3.3237176111302833e-07, 'epochs': 296, 'loss': 'mse', 'optimizer': 'adam', 'graph_mode': 'off', 'use_snp_selection': False}. Best is trial 52 with value: 0.1769979941376395.
[I 2025-12-05 14:42:49,199] Trial 92 finished with value: 0.1594140059639814 and parameters: {'model_type': 'mlp', 'hidden_dims': '[512, 128]', 'dropout': 0.144855336613578, 'batch_norm': True, 'lr': 0.0009959402985735848, 'weight_decay': 3.5907915394341386e-06, 'epochs': 343, 'loss': 'mse', 'optimizer': 'adam', 'graph_mode': 'off', 'use_snp_selection': False}. Best is trial 52 with value: 0.1769979941376395.
[I 2025-12-05 14:42:52,791] Trial 93 finished with value: 0.15964849656512514 and parameters: {'model_type': 'mlp', 'hidden_dims': '[512, 128]', 'dropout': 0.1343410902062817, 'batch_norm': True, 'lr': 0.0005281782324451231, 'weight_decay': 4.325266058929418e-05, 'epochs': 232, 'loss': 'mse', 'optimizer': 'adam', 'graph_mode': 'off', 'use_snp_selection': False}. Best is trial 52 with value: 0.1769979941376395.
[I 2025-12-05 14:42:56,907] Trial 94 finished with value: 0.17059747251632162 and parameters: {'model_type': 'mlp', 'hidden_dims': '[512, 128]', 'dropout': 0.11202222719041693, 'batch_norm': True, 'lr': 0.0003751946755140437, 'weight_decay': 3.0383052669432404e-05, 'epochs': 273, 'loss': 'mae', 'optimizer': 'adam', 'graph_mode': 'off', 'use_snp_selection': False}. Best is trial 52 with value: 0.1769979941376395.
[I 2025-12-05 14:42:59,362] Trial 95 finished with value: 0.15189929562796037 and parameters: {'model_type': 'mlp', 'hidden_dims': '[256, 128]', 'dropout': 0.15724276596432546, 'batch_norm': True, 'lr': 0.0002676130658726676, 'weight_decay': 2.5710609091094164e-05, 'epochs': 271, 'loss': 'mae', 'optimizer': 'adam', 'graph_mode': 'off', 'use_snp_selection': False}. Best is trial 52 with value: 0.1769979941376395.
[I 2025-12-05 14:43:03,147] Trial 96 finished with value: 0.16946545431000937 and parameters: {'model_type': 'mlp', 'hidden_dims': '[512, 128]', 'dropout': 0.10988622922176265, 'batch_norm': True, 'lr': 0.0001698403189079197, 'weight_decay': 5.712338872227405e-05, 'epochs': 246, 'loss': 'mae', 'optimizer': 'adam', 'graph_mode': 'off', 'use_snp_selection': False}. Best is trial 52 with value: 0.1769979941376395.
[I 2025-12-05 14:43:06,910] Trial 97 finished with value: 0.16193836350022311 and parameters: {'model_type': 'mlp', 'hidden_dims': '[512, 128]', 'dropout': 0.12817089569371404, 'batch_norm': True, 'lr': 7.017362795297108e-05, 'weight_decay': 2.984519156958246e-05, 'epochs': 245, 'loss': 'mse', 'optimizer': 'adam', 'graph_mode': 'off', 'use_snp_selection': False}. Best is trial 52 with value: 0.1769979941376395.
[I 2025-12-05 14:43:10,907] Trial 98 finished with value: 0.157175700042983 and parameters: {'model_type': 'mlp', 'hidden_dims': '[512, 256]', 'dropout': 0.17470395134843583, 'batch_norm': True, 'lr': 0.00037934413935299333, 'weight_decay': 4.812535141402476e-05, 'epochs': 262, 'loss': 'mae', 'optimizer': 'adam', 'graph_mode': 'off', 'use_snp_selection': False}. Best is trial 52 with value: 0.1769979941376395.
[I 2025-12-05 14:43:13,991] Trial 99 finished with value: 0.15943404004419104 and parameters: {'model_type': 'mlp', 'hidden_dims': '[512, 64]', 'dropout': 0.10030162499108676, 'batch_norm': True, 'lr': 0.00016116791164677745, 'weight_decay': 2.025106243807319e-05, 'epochs': 193, 'loss': 'mae', 'optimizer': 'adam', 'graph_mode': 'off', 'use_snp_selection': False}. Best is trial 52 with value: 0.1769979941376395.
[I 2025-12-05 14:43:15,117] Trial 100 finished with value: 0.11082975448604468 and parameters: {'model_type': 'mlp', 'hidden_dims': '[256, 128, 64]', 'dropout': 0.1452293650553967, 'batch_norm': False, 'lr': 0.0008067063960498227, 'weight_decay': 6.759263843625452e-05, 'epochs': 78, 'loss': 'mae', 'optimizer': 'adam', 'graph_mode': 'off', 'use_snp_selection': False}. Best is trial 52 with value: 0.1769979941376395.
[I 2025-12-05 14:43:18,959] Trial 101 finished with value: 0.15677077763146297 and parameters: {'model_type': 'mlp', 'hidden_dims': '[512, 128]', 'dropout': 0.111337123692311, 'batch_norm': True, 'lr': 0.0003176495432732077, 'weight_decay': 1.4828912283328849e-05, 'epochs': 254, 'loss': 'mae', 'optimizer': 'adam', 'graph_mode': 'off', 'use_snp_selection': False}. Best is trial 52 with value: 0.1769979941376395.
[I 2025-12-05 14:43:22,602] Trial 102 finished with value: 0.15931011616799393 and parameters: {'model_type': 'mlp', 'hidden_dims': '[512, 128]', 'dropout': 0.12341861699963817, 'batch_norm': True, 'lr': 0.00019696164984779087, 'weight_decay': 0.00011419465890568175, 'epochs': 236, 'loss': 'mae', 'optimizer': 'adam', 'graph_mode': 'off', 'use_snp_selection': False}. Best is trial 52 with value: 0.1769979941376395.
[I 2025-12-05 14:43:26,421] Trial 103 finished with value: 0.1567033252628333 and parameters: {'model_type': 'mlp', 'hidden_dims': '[512, 128]', 'dropout': 0.1103962314586567, 'batch_norm': True, 'lr': 0.00011932888021890137, 'weight_decay': 3.463187324268335e-05, 'epochs': 250, 'loss': 'mae', 'optimizer': 'adam', 'graph_mode': 'off', 'use_snp_selection': False}. Best is trial 52 with value: 0.1769979941376395.
[I 2025-12-05 14:43:30,688] Trial 104 finished with value: 0.1451699214145804 and parameters: {'model_type': 'mlp', 'hidden_dims': '[512, 128]', 'dropout': 0.1349801692763462, 'batch_norm': True, 'lr': 0.0002459497676237889, 'weight_decay': 9.041710813227893e-05, 'epochs': 284, 'loss': 'mae', 'optimizer': 'adam', 'graph_mode': 'off', 'use_snp_selection': False}. Best is trial 52 with value: 0.1769979941376395.
[I 2025-12-05 14:43:35,309] Trial 105 finished with value: 0.15567944548275925 and parameters: {'model_type': 'mlp', 'hidden_dims': '[512, 128]', 'dropout': 0.16322361993050336, 'batch_norm': True, 'lr': 0.0004649061112587867, 'weight_decay': 1.1767010240233774e-05, 'epochs': 316, 'loss': 'mae', 'optimizer': 'adam', 'graph_mode': 'off', 'use_snp_selection': False}. Best is trial 52 with value: 0.1769979941376395.
[I 2025-12-05 14:43:39,439] Trial 106 finished with value: 0.15334485480636595 and parameters: {'model_type': 'mlp', 'hidden_dims': '[512, 128]', 'dropout': 0.44003765300960274, 'batch_norm': True, 'lr': 0.0003783045212234835, 'weight_decay': 5.6174278087226215e-05, 'epochs': 274, 'loss': 'mae', 'optimizer': 'adam', 'graph_mode': 'off', 'use_snp_selection': False}. Best is trial 52 with value: 0.1769979941376395.
[I 2025-12-05 14:43:43,474] Trial 107 finished with value: 0.1559484628673288 and parameters: {'model_type': 'mlp', 'hidden_dims': '[512, 128]', 'dropout': 0.11167884245752982, 'batch_norm': True, 'lr': 0.0006324156017192055, 'weight_decay': 0.000185536149190017, 'epochs': 265, 'loss': 'mae', 'optimizer': 'adam', 'graph_mode': 'off', 'use_snp_selection': False}. Best is trial 52 with value: 0.1769979941376395.
[I 2025-12-05 14:43:45,637] Trial 108 finished with value: 0.14628733562374546 and parameters: {'model_type': 'mlp', 'hidden_dims': '[256, 128]', 'dropout': 0.14853524710529015, 'batch_norm': True, 'lr': 0.0002139643339693233, 'weight_decay': 2.066680663632463e-05, 'epochs': 228, 'loss': 'mae', 'optimizer': 'adam', 'graph_mode': 'off', 'use_snp_selection': False}. Best is trial 52 with value: 0.1769979941376395.
[I 2025-12-05 14:43:49,234] Trial 109 finished with value: 0.1476179748041241 and parameters: {'model_type': 'mlp', 'hidden_dims': '[512, 128]', 'dropout': 0.13093705660233387, 'batch_norm': True, 'lr': 0.0002956352252473387, 'weight_decay': 0.0007189786450276221, 'epochs': 243, 'loss': 'mae', 'optimizer': 'adam', 'graph_mode': 'off', 'use_snp_selection': True, 'num_snps': 28308}. Best is trial 52 with value: 0.1769979941376395.
[I 2025-12-05 14:43:53,761] Trial 110 finished with value: 0.147961141124333 and parameters: {'model_type': 'mlp', 'hidden_dims': '[512, 256]', 'dropout': 0.12026067281195008, 'batch_norm': True, 'lr': 9.249279168464375e-05, 'weight_decay': 0.00037177416303352386, 'epochs': 308, 'loss': 'mse', 'optimizer': 'adam', 'graph_mode': 'off', 'use_snp_selection': False}. Best is trial 52 with value: 0.1769979941376395.
[I 2025-12-05 14:43:58,006] Trial 111 finished with value: 0.16158300487905064 and parameters: {'model_type': 'mlp', 'hidden_dims': '[512, 128]', 'dropout': 0.11895940332159605, 'batch_norm': True, 'lr': 0.0005633725496300584, 'weight_decay': 1.9843155095871686e-07, 'epochs': 286, 'loss': 'mae', 'optimizer': 'adam', 'graph_mode': 'off', 'use_snp_selection': False}. Best is trial 52 with value: 0.1769979941376395.
[I 2025-12-05 14:44:01,945] Trial 112 finished with value: 0.17097910056530985 and parameters: {'model_type': 'mlp', 'hidden_dims': '[512, 128]', 'dropout': 0.14013136054322006, 'batch_norm': True, 'lr': 0.00017601161839291178, 'weight_decay': 2.8510801073573666e-05, 'epochs': 258, 'loss': 'mae', 'optimizer': 'adam', 'graph_mode': 'off', 'use_snp_selection': False}. Best is trial 52 with value: 0.1769979941376395.
[I 2025-12-05 14:44:05,849] Trial 113 finished with value: 0.15565924326765096 and parameters: {'model_type': 'mlp', 'hidden_dims': '[512, 128]', 'dropout': 0.14093665104799802, 'batch_norm': True, 'lr': 0.00017298271672977215, 'weight_decay': 2.55051497391638e-05, 'epochs': 258, 'loss': 'mae', 'optimizer': 'adam', 'graph_mode': 'off', 'use_snp_selection': False}. Best is trial 52 with value: 0.1769979941376395.
[I 2025-12-05 14:44:09,882] Trial 114 finished with value: 0.16005498812303143 and parameters: {'model_type': 'mlp', 'hidden_dims': '[512, 128]', 'dropout': 0.15664477792528803, 'batch_norm': True, 'lr': 0.00013644838842205204, 'weight_decay': 4.035701921367125e-05, 'epochs': 267, 'loss': 'mae', 'optimizer': 'adam', 'graph_mode': 'off', 'use_snp_selection': False}. Best is trial 52 with value: 0.1769979941376395.
[I 2025-12-05 14:44:13,329] Trial 115 finished with value: 0.16561694786921471 and parameters: {'model_type': 'mlp', 'hidden_dims': '[512, 128]', 'dropout': 0.10770784637517444, 'batch_norm': True, 'lr': 0.00024845646377695156, 'weight_decay': 6.564253535455257e-06, 'epochs': 218, 'loss': 'mae', 'optimizer': 'adam', 'graph_mode': 'off', 'use_snp_selection': False}. Best is trial 52 with value: 0.1769979941376395.
[I 2025-12-05 14:44:16,752] Trial 116 finished with value: 0.16064074246057414 and parameters: {'model_type': 'mlp', 'hidden_dims': '[512, 128]', 'dropout': 0.10498004785442859, 'batch_norm': True, 'lr': 0.00015955518788166934, 'weight_decay': 8.658303787867709e-06, 'epochs': 219, 'loss': 'mae', 'optimizer': 'adam', 'graph_mode': 'off', 'use_snp_selection': False}. Best is trial 52 with value: 0.1769979941376395.
[I 2025-12-05 14:44:17,853] Trial 117 finished with value: 0.14293905754372782 and parameters: {'model_type': 'mlp', 'hidden_dims': '[128, 64]', 'dropout': 0.13124892398728136, 'batch_norm': True, 'lr': 0.00022860475489834583, 'weight_decay': 5.794149484971986e-06, 'epochs': 179, 'loss': 'mae', 'optimizer': 'adam', 'graph_mode': 'off', 'use_snp_selection': False}. Best is trial 52 with value: 0.1769979941376395.
