[I 2025-12-06 07:19:34,632] Trial 70 finished with value: 0.2096761385386035 and parameters: {'model_type': 'mlp', 'hidden_dims': '[512, 128]', 'dropout': 0.4792370066976631, 'batch_norm': True, 'lr': 0.00031819127815934934, 'weight_decay': 5.582595012863523e-07, 'epochs': 339, 'loss': 'mae', 'optimizer': 'adam', 'graph_mode': 'off', 'use_snp_selection': True, 'num_snps': 54535}. Best is trial 52 with value: 0.2136954913941534.
[I 2025-12-06 07:21:25,918] Trial 71 finished with value: 0.2111987763026874 and parameters: {'model_type': 'mlp', 'hidden_dims': '[512, 128]', 'dropout': 0.4216127783358714, 'batch_norm': True, 'lr': 0.00030025684610927227, 'weight_decay': 1.306359808874727e-05, 'epochs': 347, 'loss': 'mae', 'optimizer': 'adam', 'graph_mode': 'off', 'use_snp_selection': True, 'num_snps': 46400}. Best is trial 52 with value: 0.2136954913941534.
[I 2025-12-06 07:23:11,354] Trial 72 finished with value: 0.21209189592895933 and parameters: {'model_type': 'mlp', 'hidden_dims': '[512, 128]', 'dropout': 0.44845925905266576, 'batch_norm': True, 'lr': 0.0002520877361668058, 'weight_decay': 6.535814662922955e-06, 'epochs': 329, 'loss': 'mae', 'optimizer': 'adam', 'graph_mode': 'off', 'use_snp_selection': True, 'num_snps': 45068}. Best is trial 52 with value: 0.2136954913941534.
[I 2025-12-06 07:24:52,276] Trial 73 finished with value: 0.21087189773922815 and parameters: {'model_type': 'mlp', 'hidden_dims': '[512, 128]', 'dropout': 0.39890071582475317, 'batch_norm': True, 'lr': 0.0002338644811536169, 'weight_decay': 2.013491261506742e-06, 'epochs': 327, 'loss': 'mae', 'optimizer': 'adam', 'graph_mode': 'off', 'use_snp_selection': True, 'num_snps': 42831}. Best is trial 52 with value: 0.2136954913941534.
[I 2025-12-06 07:26:27,689] Trial 74 finished with value: 0.2071753605200553 and parameters: {'model_type': 'mlp', 'hidden_dims': '[512, 128]', 'dropout': 0.4949723092095406, 'batch_norm': True, 'lr': 0.0004373558650283209, 'weight_decay': 3.1494664951791556e-07, 'epochs': 288, 'loss': 'mae', 'optimizer': 'adam', 'graph_mode': 'off', 'use_snp_selection': True, 'num_snps': 43457}. Best is trial 52 with value: 0.2136954913941534.
[I 2025-12-06 07:27:32,180] Trial 75 finished with value: 0.2151003407179239 and parameters: {'model_type': 'mlp', 'hidden_dims': '[256, 128]', 'dropout': 0.45392582470061293, 'batch_norm': True, 'lr': 0.00015475308154367585, 'weight_decay': 6.920206661692215e-07, 'epochs': 312, 'loss': 'mae', 'optimizer': 'adam', 'graph_mode': 'off', 'use_snp_selection': True, 'num_snps': 35182}. Best is trial 75 with value: 0.2151003407179239.
[I 2025-12-06 07:28:36,088] Trial 76 finished with value: 0.21349920753366178 and parameters: {'model_type': 'mlp', 'hidden_dims': '[256, 128]', 'dropout': 0.4499672265058271, 'batch_norm': True, 'lr': 0.0001504380366881794, 'weight_decay': 6.85043742151413e-07, 'epochs': 331, 'loss': 'mae', 'optimizer': 'adam', 'graph_mode': 'off', 'use_snp_selection': True, 'num_snps': 33882}. Best is trial 75 with value: 0.2151003407179239.
[I 2025-12-06 07:29:39,502] Trial 77 finished with value: 0.21411914117026648 and parameters: {'model_type': 'mlp', 'hidden_dims': '[256, 128]', 'dropout': 0.4456208703275416, 'batch_norm': True, 'lr': 0.00011189091499125255, 'weight_decay': 8.23043240878875e-06, 'epochs': 323, 'loss': 'mae', 'optimizer': 'adam', 'graph_mode': 'off', 'use_snp_selection': True, 'num_snps': 34200}. Best is trial 75 with value: 0.2151003407179239.
[I 2025-12-06 07:30:41,202] Trial 78 finished with value: 0.21582232962962183 and parameters: {'model_type': 'mlp', 'hidden_dims': '[256, 128]', 'dropout': 0.44679538403314206, 'batch_norm': True, 'lr': 0.00011005290137850673, 'weight_decay': 8.730376531414496e-06, 'epochs': 318, 'loss': 'mae', 'optimizer': 'adam', 'graph_mode': 'off', 'use_snp_selection': True, 'num_snps': 32189}. Best is trial 78 with value: 0.21582232962962183.
[I 2025-12-06 07:31:38,709] Trial 79 finished with value: 0.21903836538686833 and parameters: {'model_type': 'mlp', 'hidden_dims': '[256, 128]', 'dropout': 0.41326870958539585, 'batch_norm': True, 'lr': 0.00010899457962349168, 'weight_decay': 9.027759457278847e-06, 'epochs': 317, 'loss': 'mae', 'optimizer': 'adam', 'graph_mode': 'off', 'use_snp_selection': True, 'num_snps': 27868}. Best is trial 79 with value: 0.21903836538686833.
[I 2025-12-06 07:32:36,747] Trial 80 finished with value: 0.21474626625758533 and parameters: {'model_type': 'mlp', 'hidden_dims': '[256, 128]', 'dropout': 0.41052446257966835, 'batch_norm': True, 'lr': 0.00010360894050147679, 'weight_decay': 1.4824486999089822e-05, 'epochs': 317, 'loss': 'mse', 'optimizer': 'adam', 'graph_mode': 'off', 'use_snp_selection': True, 'num_snps': 28510}. Best is trial 79 with value: 0.21903836538686833.
[I 2025-12-06 07:33:34,432] Trial 81 finished with value: 0.21316576220177405 and parameters: {'model_type': 'mlp', 'hidden_dims': '[256, 128]', 'dropout': 0.3816905371087731, 'batch_norm': True, 'lr': 0.00011246322740692387, 'weight_decay': 1.6657928246520755e-05, 'epochs': 316, 'loss': 'mse', 'optimizer': 'adam', 'graph_mode': 'off', 'use_snp_selection': True, 'num_snps': 28195}. Best is trial 79 with value: 0.21903836538686833.
[I 2025-12-06 07:34:31,886] Trial 82 finished with value: 0.2196049931802731 and parameters: {'model_type': 'mlp', 'hidden_dims': '[256, 128]', 'dropout': 0.410767884051098, 'batch_norm': True, 'lr': 0.00010663710353241367, 'weight_decay': 1.5739619255135146e-05, 'epochs': 317, 'loss': 'mse', 'optimizer': 'adam', 'graph_mode': 'off', 'use_snp_selection': True, 'num_snps': 28079}. Best is trial 82 with value: 0.2196049931802731.
[I 2025-12-06 07:35:27,633] Trial 83 finished with value: 0.21613918374096558 and parameters: {'model_type': 'mlp', 'hidden_dims': '[256, 128]', 'dropout': 0.412035807733887, 'batch_norm': True, 'lr': 0.00010658537341683623, 'weight_decay': 1.5386953657005864e-05, 'epochs': 318, 'loss': 'mse', 'optimizer': 'adam', 'graph_mode': 'off', 'use_snp_selection': True, 'num_snps': 27288}. Best is trial 82 with value: 0.2196049931802731.
[I 2025-12-06 07:36:23,455] Trial 84 finished with value: 0.20924816176645483 and parameters: {'model_type': 'mlp', 'hidden_dims': '[256, 128]', 'dropout': 0.40747618961437554, 'batch_norm': True, 'lr': 0.00010090841882565853, 'weight_decay': 1.4211707876766486e-05, 'epochs': 292, 'loss': 'mse', 'optimizer': 'adam', 'graph_mode': 'off', 'use_snp_selection': True, 'num_snps': 27853}. Best is trial 82 with value: 0.2196049931802731.
[I 2025-12-06 07:37:19,009] Trial 85 finished with value: 0.2171668033794501 and parameters: {'model_type': 'mlp', 'hidden_dims': '[256, 128]', 'dropout': 0.3727221179252889, 'batch_norm': True, 'lr': 6.719498511059039e-05, 'weight_decay': 9.398788667176352e-06, 'epochs': 272, 'loss': 'mse', 'optimizer': 'adam', 'graph_mode': 'off', 'use_snp_selection': True, 'num_snps': 29460}. Best is trial 82 with value: 0.2196049931802731.
[I 2025-12-06 07:38:14,299] Trial 86 finished with value: 0.21179990547370756 and parameters: {'model_type': 'mlp', 'hidden_dims': '[256, 128]', 'dropout': 0.37322334410463487, 'batch_norm': True, 'lr': 6.492261944712325e-05, 'weight_decay': 2.6534983276049108e-05, 'epochs': 277, 'loss': 'mse', 'optimizer': 'adam', 'graph_mode': 'off', 'use_snp_selection': True, 'num_snps': 28610}. Best is trial 82 with value: 0.2196049931802731.
[I 2025-12-06 07:39:03,654] Trial 87 finished with value: 0.22052493367726528 and parameters: {'model_type': 'mlp', 'hidden_dims': '[256, 128]', 'dropout': 0.3353454955993742, 'batch_norm': True, 'lr': 0.00012164759490201254, 'weight_decay': 1.0868195622917515e-05, 'epochs': 252, 'loss': 'mse', 'optimizer': 'adam', 'graph_mode': 'off', 'use_snp_selection': True, 'num_snps': 24003}. Best is trial 87 with value: 0.22052493367726528.
[I 2025-12-06 07:39:52,273] Trial 88 finished with value: 0.22076226041951852 and parameters: {'model_type': 'mlp', 'hidden_dims': '[256, 128]', 'dropout': 0.3377413814974522, 'batch_norm': True, 'lr': 0.00011861382085872013, 'weight_decay': 1.9889268763912132e-05, 'epochs': 256, 'loss': 'mse', 'optimizer': 'adam', 'graph_mode': 'off', 'use_snp_selection': True, 'num_snps': 22508}. Best is trial 88 with value: 0.22076226041951852.
[I 2025-12-06 07:40:40,608] Trial 89 finished with value: 0.20752517234412907 and parameters: {'model_type': 'mlp', 'hidden_dims': '[256, 128]', 'dropout': 0.3405314887090981, 'batch_norm': True, 'lr': 9.170967219868461e-05, 'weight_decay': 1.1606130755806709e-05, 'epochs': 246, 'loss': 'mse', 'optimizer': 'adam', 'graph_mode': 'off', 'use_snp_selection': True, 'num_snps': 23026}. Best is trial 88 with value: 0.22076226041951852.
[I 2025-12-06 07:41:30,917] Trial 90 finished with value: 0.21474503222305516 and parameters: {'model_type': 'mlp', 'hidden_dims': '[256, 128]', 'dropout': 0.34222175001454813, 'batch_norm': True, 'lr': 7.407575631888046e-05, 'weight_decay': 4.800451314112322e-05, 'epochs': 254, 'loss': 'mse', 'optimizer': 'adam', 'graph_mode': 'off', 'use_snp_selection': True, 'num_snps': 24390}. Best is trial 88 with value: 0.22076226041951852.
[I 2025-12-06 07:42:19,995] Trial 91 finished with value: 0.20828871501292362 and parameters: {'model_type': 'mlp', 'hidden_dims': '[256, 128]', 'dropout': 0.34962568712559766, 'batch_norm': True, 'lr': 7.254799152127637e-05, 'weight_decay': 2.1642587752011595e-05, 'epochs': 234, 'loss': 'mse', 'optimizer': 'adam', 'graph_mode': 'off', 'use_snp_selection': True, 'num_snps': 24672}. Best is trial 88 with value: 0.22076226041951852.
[I 2025-12-06 07:43:05,144] Trial 92 finished with value: 0.19812443309057762 and parameters: {'model_type': 'mlp', 'hidden_dims': '[256, 128]', 'dropout': 0.3088942055996713, 'batch_norm': True, 'lr': 0.00013511906465807306, 'weight_decay': 4.5115477850921495e-05, 'epochs': 255, 'loss': 'mse', 'optimizer': 'adam', 'graph_mode': 'off', 'use_snp_selection': True, 'num_snps': 18872}. Best is trial 88 with value: 0.22076226041951852.
[I 2025-12-06 07:44:01,882] Trial 93 finished with value: 0.20844664645883335 and parameters: {'model_type': 'mlp', 'hidden_dims': '[256, 128]', 'dropout': 0.33228398303949797, 'batch_norm': True, 'lr': 8.262178562931453e-05, 'weight_decay': 1.6066746366409786e-05, 'epochs': 274, 'loss': 'mse', 'optimizer': 'adam', 'graph_mode': 'off', 'use_snp_selection': True, 'num_snps': 30786}. Best is trial 88 with value: 0.22076226041951852.
[I 2025-12-06 07:44:47,167] Trial 94 finished with value: 0.2018725130027308 and parameters: {'model_type': 'mlp', 'hidden_dims': '[256, 128]', 'dropout': 0.3553011491854836, 'batch_norm': True, 'lr': 0.0001228458261357551, 'weight_decay': 1.0092279707843205e-05, 'epochs': 251, 'loss': 'mse', 'optimizer': 'adam', 'graph_mode': 'off', 'use_snp_selection': True, 'num_snps': 19347}. Best is trial 88 with value: 0.22076226041951852.
[I 2025-12-06 07:45:36,991] Trial 95 finished with value: 0.21301560131824115 and parameters: {'model_type': 'mlp', 'hidden_dims': '[256, 128]', 'dropout': 0.39138599158735005, 'batch_norm': True, 'lr': 5.392558779961091e-05, 'weight_decay': 3.170072977398599e-05, 'epochs': 230, 'loss': 'mse', 'optimizer': 'adam', 'graph_mode': 'off', 'use_snp_selection': True, 'num_snps': 25585}. Best is trial 88 with value: 0.22076226041951852.
[I 2025-12-06 07:46:21,483] Trial 96 finished with value: 0.2030917450634214 and parameters: {'model_type': 'mlp', 'hidden_dims': '[256, 128]', 'dropout': 0.41766248853432975, 'batch_norm': True, 'lr': 0.00010362503027120657, 'weight_decay': 5.422178256741835e-06, 'epochs': 282, 'loss': 'mse', 'optimizer': 'adam', 'graph_mode': 'off', 'use_snp_selection': True, 'num_snps': 16741}. Best is trial 88 with value: 0.22076226041951852.
[I 2025-12-06 07:47:17,470] Trial 97 finished with value: 0.2118286656068377 and parameters: {'model_type': 'mlp', 'hidden_dims': '[256, 128]', 'dropout': 0.37372930062987736, 'batch_norm': True, 'lr': 3.5677928195125135e-05, 'weight_decay': 2.185794797500855e-05, 'epochs': 262, 'loss': 'mse', 'optimizer': 'adam', 'graph_mode': 'off', 'use_snp_selection': True, 'num_snps': 30829}. Best is trial 88 with value: 0.22076226041951852.
[I 2025-12-06 07:48:11,541] Trial 98 finished with value: 0.21107898767282665 and parameters: {'model_type': 'mlp', 'hidden_dims': '[256, 128]', 'dropout': 0.34670219625591603, 'batch_norm': True, 'lr': 6.815130349305593e-05, 'weight_decay': 5.327341231984529e-05, 'epochs': 298, 'loss': 'mse', 'optimizer': 'adam', 'graph_mode': 'off', 'use_snp_selection': True, 'num_snps': 25976}. Best is trial 88 with value: 0.22076226041951852.
[I 2025-12-06 07:49:00,571] Trial 99 finished with value: 0.22423367231619915 and parameters: {'model_type': 'mlp', 'hidden_dims': '[256, 128]', 'dropout': 0.3619111399986228, 'batch_norm': True, 'lr': 9.213078747211725e-05, 'weight_decay': 1.8678837091453818e-05, 'epochs': 269, 'loss': 'mse', 'optimizer': 'adam', 'graph_mode': 'off', 'use_snp_selection': True, 'num_snps': 22088}. Best is trial 99 with value: 0.22423367231619915.
[I 2025-12-06 07:49:49,510] Trial 100 finished with value: 0.22410449206366306 and parameters: {'model_type': 'mlp', 'hidden_dims': '[256, 128]', 'dropout': 0.2796406567876088, 'batch_norm': True, 'lr': 9.057578340591535e-05, 'weight_decay': 1.8891007670582986e-05, 'epochs': 267, 'loss': 'mse', 'optimizer': 'adam', 'graph_mode': 'off', 'use_snp_selection': True, 'num_snps': 22116}. Best is trial 99 with value: 0.22423367231619915.
[I 2025-12-06 07:50:37,974] Trial 101 finished with value: 0.21818415908145344 and parameters: {'model_type': 'mlp', 'hidden_dims': '[256, 128]', 'dropout': 0.4003761390082287, 'batch_norm': True, 'lr': 9.277957715782044e-05, 'weight_decay': 1.7856786366174864e-05, 'epochs': 268, 'loss': 'mse', 'optimizer': 'adam', 'graph_mode': 'off', 'use_snp_selection': True, 'num_snps': 21624}. Best is trial 99 with value: 0.22423367231619915.
[I 2025-12-06 07:51:25,365] Trial 102 finished with value: 0.2048548856423741 and parameters: {'model_type': 'mlp', 'hidden_dims': '[256, 128]', 'dropout': 0.36152894552423487, 'batch_norm': True, 'lr': 8.90055892786312e-05, 'weight_decay': 1.903461068228173e-05, 'epochs': 237, 'loss': 'mse', 'optimizer': 'adam', 'graph_mode': 'off', 'use_snp_selection': True, 'num_snps': 21766}. Best is trial 99 with value: 0.22423367231619915.
[I 2025-12-06 07:52:07,472] Trial 103 finished with value: 0.2003249901320002 and parameters: {'model_type': 'mlp', 'hidden_dims': '[256, 128]', 'dropout': 0.2854106117001547, 'batch_norm': True, 'lr': 5.7953347323998784e-05, 'weight_decay': 1.0861491084654355e-05, 'epochs': 266, 'loss': 'mse', 'optimizer': 'adam', 'graph_mode': 'off', 'use_snp_selection': True, 'num_snps': 14266}. Best is trial 99 with value: 0.22423367231619915.
[I 2025-12-06 07:52:54,833] Trial 104 finished with value: 0.21295440882521546 and parameters: {'model_type': 'mlp', 'hidden_dims': '[256, 128]', 'dropout': 0.31916623883991224, 'batch_norm': True, 'lr': 0.0001712067479845937, 'weight_decay': 3.228639293696367e-05, 'epochs': 269, 'loss': 'mse', 'optimizer': 'adam', 'graph_mode': 'off', 'use_snp_selection': True, 'num_snps': 20563}. Best is trial 99 with value: 0.22423367231619915.
[I 2025-12-06 07:53:38,147] Trial 105 finished with value: 0.22232194678877087 and parameters: {'model_type': 'mlp', 'hidden_dims': '[128, 64]', 'dropout': 0.39577911515739433, 'batch_norm': True, 'lr': 0.00012431026493875974, 'weight_decay': 9.321311209274708e-06, 'epochs': 280, 'loss': 'mse', 'optimizer': 'adam', 'graph_mode': 'off', 'use_snp_selection': True, 'num_snps': 22148}. Best is trial 99 with value: 0.22423367231619915.
[I 2025-12-06 07:54:20,914] Trial 106 finished with value: 0.21679258379982635 and parameters: {'model_type': 'mlp', 'hidden_dims': '[128, 64]', 'dropout': 0.3965687831916029, 'batch_norm': True, 'lr': 0.00011792240976813652, 'weight_decay': 9.064207734623331e-06, 'epochs': 244, 'loss': 'mse', 'optimizer': 'adam', 'graph_mode': 'off', 'use_snp_selection': True, 'num_snps': 22760}. Best is trial 99 with value: 0.22423367231619915.
[I 2025-12-06 07:55:03,807] Trial 107 finished with value: 0.21958916421891334 and parameters: {'model_type': 'mlp', 'hidden_dims': '[128, 64]', 'dropout': 0.2699432647298314, 'batch_norm': True, 'lr': 0.0001244962488953854, 'weight_decay': 1.2368983578196043e-05, 'epochs': 242, 'loss': 'mse', 'optimizer': 'adam', 'graph_mode': 'off', 'use_snp_selection': True, 'num_snps': 22726}. Best is trial 99 with value: 0.22423367231619915.
[I 2025-12-06 07:55:46,918] Trial 108 finished with value: 0.21241568131108757 and parameters: {'model_type': 'mlp', 'hidden_dims': '[128, 64]', 'dropout': 0.24189221469121708, 'batch_norm': True, 'lr': 0.000124246492930881, 'weight_decay': 1.2077276061763833e-05, 'epochs': 245, 'loss': 'mse', 'optimizer': 'adam', 'graph_mode': 'off', 'use_snp_selection': True, 'num_snps': 23218}. Best is trial 99 with value: 0.22423367231619915.
[I 2025-12-06 07:56:28,752] Trial 109 finished with value: 0.22377859334467698 and parameters: {'model_type': 'mlp', 'hidden_dims': '[128, 64]', 'dropout': 0.3052153000074604, 'batch_norm': True, 'lr': 9.37389115942048e-05, 'weight_decay': 1.951175693870522e-05, 'epochs': 240, 'loss': 'mse', 'optimizer': 'adam', 'graph_mode': 'off', 'use_snp_selection': True, 'num_snps': 21146}. Best is trial 99 with value: 0.22423367231619915.
[I 2025-12-06 07:57:11,112] Trial 110 finished with value: 0.22493778386264257 and parameters: {'model_type': 'mlp', 'hidden_dims': '[128, 64]', 'dropout': 0.274208012936424, 'batch_norm': True, 'lr': 8.844052312003935e-05, 'weight_decay': 2.3669371626119902e-05, 'epochs': 279, 'loss': 'mse', 'optimizer': 'adam', 'graph_mode': 'off', 'use_snp_selection': True, 'num_snps': 20720}. Best is trial 110 with value: 0.22493778386264257.
[I 2025-12-06 07:57:53,821] Trial 111 finished with value: 0.19936678011256237 and parameters: {'model_type': 'mlp', 'hidden_dims': '[128, 64]', 'dropout': 0.2700824024555976, 'batch_norm': True, 'lr': 4.685611529141125e-05, 'weight_decay': 2.4063676112933835e-05, 'epochs': 280, 'loss': 'mse', 'optimizer': 'adam', 'graph_mode': 'off', 'use_snp_selection': True, 'num_snps': 20785}. Best is trial 110 with value: 0.22493778386264257.
[I 2025-12-06 07:58:33,097] Trial 112 finished with value: 0.1827015569366867 and parameters: {'model_type': 'mlp', 'hidden_dims': '[128, 64]', 'dropout': 0.2767495768691072, 'batch_norm': True, 'lr': 8.852215819321596e-05, 'weight_decay': 2.0628279297357824e-05, 'epochs': 224, 'loss': 'mse', 'optimizer': 'adam', 'graph_mode': 'off', 'use_snp_selection': True, 'num_snps': 17263}. Best is trial 110 with value: 0.22493778386264257.
[I 2025-12-06 07:59:13,240] Trial 113 finished with value: 0.21563962342571497 and parameters: {'model_type': 'mlp', 'hidden_dims': '[128, 64]', 'dropout': 0.30935834435292103, 'batch_norm': True, 'lr': 6.43525285810307e-05, 'weight_decay': 1.8087627071214827e-05, 'epochs': 260, 'loss': 'mse', 'optimizer': 'adam', 'graph_mode': 'off', 'use_snp_selection': True, 'num_snps': 17558}. Best is trial 110 with value: 0.22493778386264257.
[I 2025-12-06 07:59:56,034] Trial 114 finished with value: 0.22052480782280548 and parameters: {'model_type': 'mlp', 'hidden_dims': '[128, 64]', 'dropout': 0.2995558965698044, 'batch_norm': True, 'lr': 0.0002035140836440197, 'weight_decay': 3.6148844192657484e-05, 'epochs': 270, 'loss': 'mse', 'optimizer': 'adam', 'graph_mode': 'off', 'use_snp_selection': True, 'num_snps': 21656}. Best is trial 110 with value: 0.22493778386264257.
[I 2025-12-06 08:00:38,201] Trial 115 finished with value: 0.21950241853792832 and parameters: {'model_type': 'mlp', 'hidden_dims': '[128, 64]', 'dropout': 0.29560265394091945, 'batch_norm': True, 'lr': 0.0002159091175947998, 'weight_decay': 2.9718268962115647e-05, 'epochs': 250, 'loss': 'mse', 'optimizer': 'adam', 'graph_mode': 'off', 'use_snp_selection': True, 'num_snps': 21186}. Best is trial 110 with value: 0.22493778386264257.
[I 2025-12-06 08:01:17,132] Trial 116 finished with value: 0.20581013123655315 and parameters: {'model_type': 'mlp', 'hidden_dims': '[128, 64]', 'dropout': 0.29636661521895236, 'batch_norm': True, 'lr': 0.0002087679527278431, 'weight_decay': 3.603704320681952e-05, 'epochs': 251, 'loss': 'mse', 'optimizer': 'adam', 'graph_mode': 'off', 'use_snp_selection': True, 'num_snps': 15590}. Best is trial 110 with value: 0.22493778386264257.
[I 2025-12-06 08:02:00,823] Trial 117 finished with value: 0.2145537966626064 and parameters: {'model_type': 'mlp', 'hidden_dims': '[128, 64]', 'dropout': 0.2594311083755203, 'batch_norm': True, 'lr': 0.00018761266883608675, 'weight_decay': 2.94181330230616e-05, 'epochs': 238, 'loss': 'mse', 'optimizer': 'adam', 'graph_mode': 'off', 'use_snp_selection': True, 'num_snps': 24620}. Best is trial 110 with value: 0.22493778386264257.
[I 2025-12-06 08:02:41,973] Trial 118 finished with value: 0.215831026958513 and parameters: {'model_type': 'mlp', 'hidden_dims': '[128, 64]', 'dropout': 0.3008398825407325, 'batch_norm': True, 'lr': 0.00014414623214094446, 'weight_decay': 2.5570830035353097e-05, 'epochs': 257, 'loss': 'mse', 'optimizer': 'adam', 'graph_mode': 'off', 'use_snp_selection': True, 'num_snps': 20264}. Best is trial 110 with value: 0.22493778386264257.
[I 2025-12-06 08:03:26,302] Trial 119 finished with value: 0.21750697536108032 and parameters: {'model_type': 'mlp', 'hidden_dims': '[128, 64]', 'dropout': 0.25182180556035916, 'batch_norm': True, 'lr': 0.00021085376896801548, 'weight_decay': 1.322919013730626e-05, 'epochs': 228, 'loss': 'mse', 'optimizer': 'adam', 'graph_mode': 'off', 'use_snp_selection': True, 'num_snps': 26390}. Best is trial 110 with value: 0.22493778386264257.
