[I 2025-12-05 17:03:00,453] Trial 4 finished with value: 0.18770371230722777 and parameters: {'model_type': 'mlp', 'hidden_dims': '[512, 128]', 'dropout': 0.25746343592134413, 'batch_norm': True, 'lr': 1.3467657668402788e-06, 'weight_decay': 0.00033087251918647806, 'epochs': 277, 'loss': 'mse', 'optimizer': 'adam', 'graph_mode': 'off', 'use_snp_selection': True, 'num_snps': 36675}. Best is trial 3 with value: 0.23340910603345705.
[I 2025-12-05 17:04:02,126] Trial 5 finished with value: 0.16674069946833645 and parameters: {'model_type': 'mlp', 'hidden_dims': '[512, 64]', 'dropout': 0.38275350994408375, 'batch_norm': True, 'lr': 1.5586664309232824e-06, 'weight_decay': 0.0008227664668621182, 'epochs': 145, 'loss': 'mae', 'optimizer': 'adam', 'graph_mode': 'off', 'use_snp_selection': True, 'num_snps': 32148}. Best is trial 3 with value: 0.23340910603345705.
[I 2025-12-05 17:04:36,029] Trial 6 finished with value: 0.21734391700806405 and parameters: {'model_type': 'mlp', 'hidden_dims': '[256, 128]', 'dropout': 0.3930109900265879, 'batch_norm': False, 'lr': 4.892964372128395e-05, 'weight_decay': 1.5809549317992182e-06, 'epochs': 199, 'loss': 'mse', 'optimizer': 'adam', 'graph_mode': 'off', 'use_snp_selection': False}. Best is trial 3 with value: 0.23340910603345705.
[I 2025-12-05 17:05:10,776] Trial 7 finished with value: 0.22097869893933245 and parameters: {'model_type': 'mlp', 'hidden_dims': '[512, 256]', 'dropout': 0.15343979219678458, 'batch_norm': True, 'lr': 6.234003099047341e-05, 'weight_decay': 3.894760610535477e-07, 'epochs': 97, 'loss': 'mse', 'optimizer': 'adam', 'graph_mode': 'off', 'use_snp_selection': False}. Best is trial 3 with value: 0.23340910603345705.
[I 2025-12-05 17:06:45,456] Trial 8 finished with value: 0.2222467819610796 and parameters: {'model_type': 'mlp', 'hidden_dims': '[512, 128]', 'dropout': 0.10743001231661406, 'batch_norm': True, 'lr': 0.00023728538449271062, 'weight_decay': 1.7629071578048637e-05, 'epochs': 312, 'loss': 'mae', 'optimizer': 'adam', 'graph_mode': 'off', 'use_snp_selection': False}. Best is trial 3 with value: 0.23340910603345705.
[I 2025-12-05 17:07:41,963] Trial 9 finished with value: 0.2253765942054668 and parameters: {'model_type': 'mlp', 'hidden_dims': '[512, 64]', 'dropout': 0.14505336736221927, 'batch_norm': True, 'lr': 5.8619638388111826e-05, 'weight_decay': 6.200156172669308e-07, 'epochs': 175, 'loss': 'mse', 'optimizer': 'adam', 'graph_mode': 'off', 'use_snp_selection': False}. Best is trial 3 with value: 0.23340910603345705.
[I 2025-12-05 17:08:04,907] Trial 10 finished with value: 0.21520651733950752 and parameters: {'model_type': 'mlp', 'hidden_dims': '[512, 64]', 'dropout': 0.5885461262002587, 'batch_norm': False, 'lr': 8.769366258768696e-06, 'weight_decay': 2.78273193871783e-06, 'epochs': 55, 'loss': 'mae', 'optimizer': 'adam', 'graph_mode': 'off', 'use_snp_selection': False}. Best is trial 3 with value: 0.23340910603345705.
[I 2025-12-05 17:09:11,119] Trial 11 finished with value: 0.22734991201740237 and parameters: {'model_type': 'mlp', 'hidden_dims': '[512, 64]', 'dropout': 0.583942291816117, 'batch_norm': False, 'lr': 1.422933652790185e-05, 'weight_decay': 1.2045055692919657e-07, 'epochs': 213, 'loss': 'mse', 'optimizer': 'adam', 'graph_mode': 'off', 'use_snp_selection': False}. Best is trial 3 with value: 0.23340910603345705.
[I 2025-12-05 17:10:27,550] Trial 12 finished with value: 0.22866460433878721 and parameters: {'model_type': 'mlp', 'hidden_dims': '[512, 64]', 'dropout': 0.593097749012682, 'batch_norm': False, 'lr': 1.1374686318732863e-05, 'weight_decay': 1.3081036432574914e-07, 'epochs': 250, 'loss': 'mae', 'optimizer': 'adam', 'graph_mode': 'off', 'use_snp_selection': False}. Best is trial 3 with value: 0.23340910603345705.
[I 2025-12-05 17:11:53,736] Trial 13 finished with value: 0.22874847349469846 and parameters: {'model_type': 'mlp', 'hidden_dims': '[512, 64]', 'dropout': 0.5043641748401543, 'batch_norm': False, 'lr': 1.262035332095525e-05, 'weight_decay': 4.80586993129494e-05, 'epochs': 285, 'loss': 'mae', 'optimizer': 'adam', 'graph_mode': 'off', 'use_snp_selection': False}. Best is trial 3 with value: 0.23340910603345705.
[I 2025-12-05 17:12:24,750] Trial 14 finished with value: 0.22734342578085848 and parameters: {'model_type': 'mlp', 'hidden_dims': '[128, 64]', 'dropout': 0.48369972861071203, 'batch_norm': False, 'lr': 5.096356034191146e-06, 'weight_decay': 6.9442169885097e-05, 'epochs': 346, 'loss': 'mae', 'optimizer': 'adam', 'graph_mode': 'off', 'use_snp_selection': False}. Best is trial 3 with value: 0.23340910603345705.
[I 2025-12-05 17:13:53,632] Trial 15 finished with value: 0.22696084551747978 and parameters: {'model_type': 'mlp', 'hidden_dims': '[512, 256]', 'dropout': 0.49962106881650387, 'batch_norm': False, 'lr': 1.8411764708572348e-05, 'weight_decay': 4.4084956876871386e-05, 'epochs': 294, 'loss': 'mae', 'optimizer': 'adam', 'graph_mode': 'off', 'use_snp_selection': False}. Best is trial 3 with value: 0.23340910603345705.
[I 2025-12-05 17:14:37,911] Trial 16 finished with value: 0.21098617665553424 and parameters: {'model_type': 'mlp', 'hidden_dims': '[256, 128, 64]', 'dropout': 0.3113370581957565, 'batch_norm': False, 'lr': 0.00017549215405955411, 'weight_decay': 5.098763140321504e-06, 'epochs': 270, 'loss': 'mae', 'optimizer': 'adam', 'graph_mode': 'off', 'use_snp_selection': False}. Best is trial 3 with value: 0.23340910603345705.
[I 2025-12-05 17:16:09,920] Trial 17 finished with value: 0.06451556075218658 and parameters: {'model_type': 'mlp', 'hidden_dims': '[512, 64]', 'dropout': 0.4976434386489672, 'batch_norm': False, 'lr': 0.000906375209920231, 'weight_decay': 2.5157504144511443e-05, 'epochs': 312, 'loss': 'mae', 'optimizer': 'adam', 'graph_mode': 'off', 'use_snp_selection': False}. Best is trial 3 with value: 0.23340910603345705.
[I 2025-12-05 17:18:02,951] Trial 18 finished with value: 0.22376790746461905 and parameters: {'model_type': 'mlp', 'hidden_dims': '[512, 64]', 'dropout': 0.5393829161631665, 'batch_norm': False, 'lr': 3.546828848247229e-06, 'weight_decay': 0.00010312401360366706, 'epochs': 245, 'loss': 'mae', 'optimizer': 'adam', 'graph_mode': 'off', 'use_snp_selection': True, 'num_snps': 58241}. Best is trial 3 with value: 0.23340910603345705.
[I 2025-12-05 17:19:35,863] Trial 19 finished with value: 0.22801448956525672 and parameters: {'model_type': 'mlp', 'hidden_dims': '[512, 64]', 'dropout': 0.5441884957330794, 'batch_norm': False, 'lr': 2.5035534179461352e-05, 'weight_decay': 6.221915494664243e-06, 'epochs': 314, 'loss': 'mae', 'optimizer': 'adam', 'graph_mode': 'off', 'use_snp_selection': False}. Best is trial 3 with value: 0.23340910603345705.
[I 2025-12-05 17:20:45,087] Trial 20 finished with value: 0.22836032099780765 and parameters: {'model_type': 'mlp', 'hidden_dims': '[512, 128]', 'dropout': 0.45536213267728864, 'batch_norm': False, 'lr': 6.91107062941075e-06, 'weight_decay': 0.00015711537877451736, 'epochs': 222, 'loss': 'mae', 'optimizer': 'adam', 'graph_mode': 'off', 'use_snp_selection': False}. Best is trial 3 with value: 0.23340910603345705.
[I 2025-12-05 17:22:05,425] Trial 21 finished with value: 0.23289500582495948 and parameters: {'model_type': 'mlp', 'hidden_dims': '[512, 64]', 'dropout': 0.5473667212831466, 'batch_norm': False, 'lr': 1.158325141936583e-05, 'weight_decay': 3.0445452179760565e-05, 'epochs': 264, 'loss': 'mae', 'optimizer': 'adam', 'graph_mode': 'off', 'use_snp_selection': False}. Best is trial 3 with value: 0.23340910603345705.
[I 2025-12-05 17:23:29,471] Trial 22 finished with value: 0.2347618692681591 and parameters: {'model_type': 'mlp', 'hidden_dims': '[512, 64]', 'dropout': 0.541396770943889, 'batch_norm': False, 'lr': 2.6840724107978715e-06, 'weight_decay': 2.2880973570439495e-05, 'epochs': 276, 'loss': 'mae', 'optimizer': 'adam', 'graph_mode': 'off', 'use_snp_selection': False}. Best is trial 22 with value: 0.2347618692681591.
[I 2025-12-05 17:24:50,004] Trial 23 finished with value: 0.23535351002450952 and parameters: {'model_type': 'mlp', 'hidden_dims': '[512, 64]', 'dropout': 0.5575646581781077, 'batch_norm': False, 'lr': 3.239890279055581e-06, 'weight_decay': 2.1345288729172833e-05, 'epochs': 263, 'loss': 'mae', 'optimizer': 'adam', 'graph_mode': 'off', 'use_snp_selection': False}. Best is trial 23 with value: 0.23535351002450952.
[I 2025-12-05 17:26:28,766] Trial 24 finished with value: 0.2291824678504478 and parameters: {'model_type': 'mlp', 'hidden_dims': '[512, 64]', 'dropout': 0.5491564275192613, 'batch_norm': False, 'lr': 2.8455355283854396e-06, 'weight_decay': 1.2163082593741659e-05, 'epochs': 329, 'loss': 'mae', 'optimizer': 'adam', 'graph_mode': 'off', 'use_snp_selection': False}. Best is trial 23 with value: 0.23535351002450952.
[I 2025-12-05 17:27:58,762] Trial 25 finished with value: 0.21123186102273364 and parameters: {'model_type': 'mlp', 'hidden_dims': '[512, 256]', 'dropout': 0.599048443037655, 'batch_norm': False, 'lr': 1.0257118844281672e-06, 'weight_decay': 4.751187313604646e-06, 'epochs': 296, 'loss': 'mae', 'optimizer': 'adam', 'graph_mode': 'off', 'use_snp_selection': False}. Best is trial 23 with value: 0.23535351002450952.
[I 2025-12-05 17:28:33,064] Trial 26 finished with value: 0.1363151674114254 and parameters: {'model_type': 'mlp', 'hidden_dims': '[256, 128]', 'dropout': 0.4535328577616604, 'batch_norm': False, 'lr': 2.032115160939138e-06, 'weight_decay': 1.9949887264719048e-05, 'epochs': 241, 'loss': 'mae', 'optimizer': 'adam', 'graph_mode': 'off', 'use_snp_selection': True, 'num_snps': 3842}. Best is trial 23 with value: 0.23535351002450952.
[I 2025-12-05 17:28:54,773] Trial 27 finished with value: 0.21511983606275825 and parameters: {'model_type': 'mlp', 'hidden_dims': '[128, 64]', 'dropout': 0.5261710018838016, 'batch_norm': False, 'lr': 5.878160027914134e-06, 'weight_decay': 2.2071757353474347e-06, 'epochs': 219, 'loss': 'mae', 'optimizer': 'adam', 'graph_mode': 'off', 'use_snp_selection': False}. Best is trial 23 with value: 0.23535351002450952.
[I 2025-12-05 17:29:50,875] Trial 28 finished with value: 0.21950778229430057 and parameters: {'model_type': 'mlp', 'hidden_dims': '[256, 128, 64]', 'dropout': 0.3254314863734792, 'batch_norm': False, 'lr': 3.0022095696380734e-06, 'weight_decay': 0.00011837572117061313, 'epochs': 350, 'loss': 'mae', 'optimizer': 'adam', 'graph_mode': 'off', 'use_snp_selection': False}. Best is trial 23 with value: 0.23535351002450952.
[I 2025-12-05 17:30:35,822] Trial 29 finished with value: 0.2190953067414617 and parameters: {'model_type': 'mlp', 'hidden_dims': '[128, 64]', 'dropout': 0.21745968990550668, 'batch_norm': False, 'lr': 2.1754542053674725e-06, 'weight_decay': 7.926704399551403e-06, 'epochs': 327, 'loss': 'mae', 'optimizer': 'adam', 'graph_mode': 'off', 'use_snp_selection': True, 'num_snps': 19468}. Best is trial 23 with value: 0.23535351002450952.
[I 2025-12-05 17:31:31,189] Trial 30 finished with value: 0.22300218324589743 and parameters: {'model_type': 'mlp', 'hidden_dims': '[512, 64]', 'dropout': 0.5647216768818658, 'batch_norm': False, 'lr': 5.514469614350219e-06, 'weight_decay': 9.507805071019158e-07, 'epochs': 174, 'loss': 'mae', 'optimizer': 'adam', 'graph_mode': 'off', 'use_snp_selection': False}. Best is trial 23 with value: 0.23535351002450952.
[I 2025-12-05 17:32:54,314] Trial 31 finished with value: 0.23385552535742654 and parameters: {'model_type': 'mlp', 'hidden_dims': '[512, 64]', 'dropout': 0.5248002040593783, 'batch_norm': False, 'lr': 8.12037381555579e-06, 'weight_decay': 3.586593507491519e-05, 'epochs': 274, 'loss': 'mae', 'optimizer': 'adam', 'graph_mode': 'off', 'use_snp_selection': False}. Best is trial 23 with value: 0.23535351002450952.
[I 2025-12-05 17:34:12,906] Trial 32 finished with value: 0.22452231042226103 and parameters: {'model_type': 'mlp', 'hidden_dims': '[512, 64]', 'dropout': 0.47351657968757993, 'batch_norm': False, 'lr': 3.035088004027062e-05, 'weight_decay': 1.3624044736567819e-05, 'epochs': 260, 'loss': 'mae', 'optimizer': 'adam', 'graph_mode': 'off', 'use_snp_selection': False}. Best is trial 23 with value: 0.23535351002450952.
[I 2025-12-05 17:35:43,858] Trial 33 finished with value: 0.23190608295868778 and parameters: {'model_type': 'mlp', 'hidden_dims': '[512, 64]', 'dropout': 0.5305044859341174, 'batch_norm': False, 'lr': 3.5992591149086856e-06, 'weight_decay': 3.583076508551562e-05, 'epochs': 301, 'loss': 'mae', 'optimizer': 'adam', 'graph_mode': 'off', 'use_snp_selection': False}. Best is trial 23 with value: 0.23535351002450952.
[I 2025-12-05 17:36:30,156] Trial 34 finished with value: 0.21390221614721897 and parameters: {'model_type': 'mlp', 'hidden_dims': '[256, 128]', 'dropout': 0.43356795524892644, 'batch_norm': True, 'lr': 8.184092507051742e-06, 'weight_decay': 7.394174851719774e-05, 'epochs': 278, 'loss': 'mae', 'optimizer': 'adam', 'graph_mode': 'off', 'use_snp_selection': False}. Best is trial 23 with value: 0.23535351002450952.
[I 2025-12-05 17:38:19,319] Trial 35 finished with value: 0.2088168403475649 and parameters: {'model_type': 'mlp', 'hidden_dims': '[512, 64]', 'dropout': 0.5680077082369309, 'batch_norm': False, 'lr': 1.0947899149030808e-06, 'weight_decay': 0.00019096624281136478, 'epochs': 234, 'loss': 'mse', 'optimizer': 'adam', 'graph_mode': 'off', 'use_snp_selection': True, 'num_snps': 57586}. Best is trial 23 with value: 0.23535351002450952.
[I 2025-12-05 17:39:12,238] Trial 36 finished with value: 0.2230642800883289 and parameters: {'model_type': 'mlp', 'hidden_dims': '[256, 128, 64]', 'dropout': 0.5140185435886063, 'batch_norm': False, 'lr': 1.7193532652106327e-06, 'weight_decay': 1.2154969966315278e-05, 'epochs': 328, 'loss': 'mae', 'optimizer': 'adam', 'graph_mode': 'off', 'use_snp_selection': False}. Best is trial 23 with value: 0.23535351002450952.
[I 2025-12-05 17:40:17,494] Trial 37 finished with value: 0.21958764340470202 and parameters: {'model_type': 'mlp', 'hidden_dims': '[512, 128]', 'dropout': 0.39795440693804296, 'batch_norm': True, 'lr': 4.446294938689996e-06, 'weight_decay': 0.0005179049924786015, 'epochs': 286, 'loss': 'mse', 'optimizer': 'adam', 'graph_mode': 'off', 'use_snp_selection': True, 'num_snps': 22282}. Best is trial 23 with value: 0.23535351002450952.
[I 2025-12-05 17:41:20,187] Trial 38 finished with value: 0.23240551571925966 and parameters: {'model_type': 'mlp', 'hidden_dims': '[512, 64]', 'dropout': 0.36175017025624956, 'batch_norm': False, 'lr': 2.435387939371008e-06, 'weight_decay': 2.845497563862512e-05, 'epochs': 200, 'loss': 'mae', 'optimizer': 'adam', 'graph_mode': 'off', 'use_snp_selection': False}. Best is trial 23 with value: 0.23535351002450952.
[I 2025-12-05 17:42:38,875] Trial 39 finished with value: 0.22184517072700038 and parameters: {'model_type': 'mlp', 'hidden_dims': '[512, 64]', 'dropout': 0.4246116819735686, 'batch_norm': True, 'lr': 2.0690401761147022e-05, 'weight_decay': 5.7405836886783164e-05, 'epochs': 255, 'loss': 'mae', 'optimizer': 'adam', 'graph_mode': 'off', 'use_snp_selection': False}. Best is trial 23 with value: 0.23535351002450952.
[I 2025-12-05 17:44:10,676] Trial 40 finished with value: 0.220588515139511 and parameters: {'model_type': 'mlp', 'hidden_dims': '[512, 256]', 'dropout': 0.5656137028387085, 'batch_norm': False, 'lr': 0.00010299837783030175, 'weight_decay': 3.3219814922623904e-06, 'epochs': 310, 'loss': 'mse', 'optimizer': 'adam', 'graph_mode': 'off', 'use_snp_selection': False}. Best is trial 23 with value: 0.23535351002450952.
[I 2025-12-05 17:45:32,018] Trial 41 finished with value: 0.2314079113539233 and parameters: {'model_type': 'mlp', 'hidden_dims': '[512, 64]', 'dropout': 0.5609707883293926, 'batch_norm': False, 'lr': 1.0623914580898997e-05, 'weight_decay': 2.4617922306800508e-05, 'epochs': 267, 'loss': 'mae', 'optimizer': 'adam', 'graph_mode': 'off', 'use_snp_selection': False}. Best is trial 23 with value: 0.23535351002450952.
[I 2025-12-05 17:46:55,754] Trial 42 finished with value: 0.2278677087913556 and parameters: {'model_type': 'mlp', 'hidden_dims': '[512, 64]', 'dropout': 0.46840656616372833, 'batch_norm': False, 'lr': 3.8789306035811206e-05, 'weight_decay': 1.7382226653137513e-05, 'epochs': 279, 'loss': 'mae', 'optimizer': 'adam', 'graph_mode': 'off', 'use_snp_selection': False}. Best is trial 23 with value: 0.23535351002450952.
[I 2025-12-05 17:48:06,657] Trial 43 finished with value: 0.22202646496693795 and parameters: {'model_type': 'mlp', 'hidden_dims': '[512, 64]', 'dropout': 0.5282022319159855, 'batch_norm': False, 'lr': 7.849391180227986e-06, 'weight_decay': 8.987814263057534e-06, 'epochs': 228, 'loss': 'mae', 'optimizer': 'adam', 'graph_mode': 'off', 'use_snp_selection': False}. Best is trial 23 with value: 0.23535351002450952.
[I 2025-12-05 17:48:54,804] Trial 44 finished with value: 0.22803153064484133 and parameters: {'model_type': 'mlp', 'hidden_dims': '[512, 64]', 'dropout': 0.5790968453088796, 'batch_norm': False, 'lr': 1.6097712180154143e-05, 'weight_decay': 8.976387833611856e-05, 'epochs': 147, 'loss': 'mae', 'optimizer': 'adam', 'graph_mode': 'off', 'use_snp_selection': False}. Best is trial 23 with value: 0.23535351002450952.
[I 2025-12-05 17:49:17,267] Trial 45 finished with value: 0.1833986194739797 and parameters: {'model_type': 'mlp', 'hidden_dims': '[256, 128]', 'dropout': 0.5119125929616941, 'batch_norm': True, 'lr': 3.823859446423282e-06, 'weight_decay': 3.922147093796029e-05, 'epochs': 110, 'loss': 'mae', 'optimizer': 'adam', 'graph_mode': 'off', 'use_snp_selection': False}. Best is trial 23 with value: 0.23535351002450952.
[I 2025-12-05 17:50:37,204] Trial 46 finished with value: 0.21680573666550923 and parameters: {'model_type': 'mlp', 'hidden_dims': '[512, 64]', 'dropout': 0.5985264693895012, 'batch_norm': False, 'lr': 6.1251170801122185e-06, 'weight_decay': 3.117922121251465e-05, 'epochs': 262, 'loss': 'mse', 'optimizer': 'adam', 'graph_mode': 'off', 'use_snp_selection': False}. Best is trial 23 with value: 0.23535351002450952.
[I 2025-12-05 17:51:34,695] Trial 47 finished with value: 0.23559119926943253 and parameters: {'model_type': 'mlp', 'hidden_dims': '[512, 128]', 'dropout': 0.2577310256444136, 'batch_norm': False, 'lr': 9.8069920045934e-06, 'weight_decay': 0.0002747942807856569, 'epochs': 179, 'loss': 'mae', 'optimizer': 'adam', 'graph_mode': 'off', 'use_snp_selection': False}. Best is trial 47 with value: 0.23559119926943253.
[I 2025-12-05 17:52:27,501] Trial 48 finished with value: 0.21815349214783097 and parameters: {'model_type': 'mlp', 'hidden_dims': '[512, 128]', 'dropout': 0.27060623941244266, 'batch_norm': False, 'lr': 1.6621637338238077e-06, 'weight_decay': 0.00043458200832715167, 'epochs': 162, 'loss': 'mae', 'optimizer': 'adam', 'graph_mode': 'off', 'use_snp_selection': False}. Best is trial 47 with value: 0.23559119926943253.
[I 2025-12-05 17:53:41,686] Trial 49 finished with value: 0.23368054642597183 and parameters: {'model_type': 'mlp', 'hidden_dims': '[512, 128]', 'dropout': 0.17413895299029275, 'batch_norm': False, 'lr': 4.693020873208618e-06, 'weight_decay': 0.000287191443674494, 'epochs': 131, 'loss': 'mae', 'optimizer': 'adam', 'graph_mode': 'off', 'use_snp_selection': True, 'num_snps': 46888}. Best is trial 47 with value: 0.23559119926943253.
[I 2025-12-05 17:54:54,586] Trial 50 finished with value: 0.20477855510965695 and parameters: {'model_type': 'mlp', 'hidden_dims': '[512, 128]', 'dropout': 0.18424970285160377, 'batch_norm': False, 'lr': 1.3042436427051639e-06, 'weight_decay': 0.0007362481073197121, 'epochs': 126, 'loss': 'mae', 'optimizer': 'adam', 'graph_mode': 'off', 'use_snp_selection': True, 'num_snps': 46345}. Best is trial 47 with value: 0.23559119926943253.
[I 2025-12-05 17:55:56,845] Trial 51 finished with value: 0.21496544266485834 and parameters: {'model_type': 'mlp', 'hidden_dims': '[512, 128]', 'dropout': 0.11892545851456848, 'batch_norm': False, 'lr': 4.850290267567814e-06, 'weight_decay': 0.00028411142005418293, 'epochs': 70, 'loss': 'mae', 'optimizer': 'adam', 'graph_mode': 'off', 'use_snp_selection': True, 'num_snps': 47105}. Best is trial 47 with value: 0.23559119926943253.
[I 2025-12-05 17:57:02,405] Trial 52 finished with value: 0.21884548806376042 and parameters: {'model_type': 'mlp', 'hidden_dims': '[512, 128]', 'dropout': 0.24152908034122328, 'batch_norm': False, 'lr': 9.055526612540476e-06, 'weight_decay': 0.0009845768042598573, 'epochs': 130, 'loss': 'mae', 'optimizer': 'adam', 'graph_mode': 'off', 'use_snp_selection': True, 'num_snps': 38747}. Best is trial 47 with value: 0.23559119926943253.
[I 2025-12-05 17:58:02,157] Trial 53 finished with value: 0.23242787335898424 and parameters: {'model_type': 'mlp', 'hidden_dims': '[512, 128]', 'dropout': 0.27329941692739435, 'batch_norm': False, 'lr': 3.123001708723124e-06, 'weight_decay': 0.00015995684290271548, 'epochs': 193, 'loss': 'mae', 'optimizer': 'adam', 'graph_mode': 'off', 'use_snp_selection': True, 'num_snps': 25278}. Best is trial 47 with value: 0.23559119926943253.
[I 2025-12-05 17:59:36,781] Trial 54 finished with value: 0.21920314506650063 and parameters: {'model_type': 'mlp', 'hidden_dims': '[512, 128]', 'dropout': 0.17415308565595858, 'batch_norm': False, 'lr': 2.3122918389724846e-06, 'weight_decay': 0.00034075472173797003, 'epochs': 205, 'loss': 'mae', 'optimizer': 'adam', 'graph_mode': 'off', 'use_snp_selection': True, 'num_snps': 51553}. Best is trial 47 with value: 0.23559119926943253.
[I 2025-12-05 18:00:35,103] Trial 55 finished with value: 0.22783472890458062 and parameters: {'model_type': 'mlp', 'hidden_dims': '[512, 128]', 'dropout': 0.30995901700270595, 'batch_norm': False, 'lr': 1.3653639049469161e-05, 'weight_decay': 0.0001885806405739421, 'epochs': 185, 'loss': 'mae', 'optimizer': 'adam', 'graph_mode': 'off', 'use_snp_selection': False}. Best is trial 47 with value: 0.23559119926943253.
