[I 2025-12-05 15:22:20,959] Trial 14 finished with value: 0.11591004000817406 and parameters: {'model_type': 'mlp', 'hidden_dims': '[512, 128]', 'dropout': 0.22759640072963888, 'batch_norm': True, 'lr': 0.0009999560149105526, 'weight_decay': 0.00018970122358818916, 'epochs': 209, 'loss': 'mse', 'optimizer': 'adam', 'graph_mode': 'off', 'use_snp_selection': False}. Best is trial 4 with value: 0.1263244619776328.
[I 2025-12-05 15:22:23,651] Trial 15 finished with value: 0.06726029549570303 and parameters: {'model_type': 'mlp', 'hidden_dims': '[128, 64]', 'dropout': 0.322305564382335, 'batch_norm': True, 'lr': 1.544404094249274e-05, 'weight_decay': 0.0009805723528270268, 'epochs': 347, 'loss': 'mse', 'optimizer': 'adam', 'graph_mode': 'off', 'use_snp_selection': True, 'num_snps': 27767}. Best is trial 4 with value: 0.1263244619776328.
[I 2025-12-05 15:22:24,968] Trial 16 finished with value: 0.09815818905302295 and parameters: {'model_type': 'mlp', 'hidden_dims': '[512, 256]', 'dropout': 0.19837544951616343, 'batch_norm': True, 'lr': 0.00019347760195272327, 'weight_decay': 6.997426951559611e-05, 'epochs': 41, 'loss': 'mse', 'optimizer': 'adam', 'graph_mode': 'off', 'use_snp_selection': False}. Best is trial 4 with value: 0.1263244619776328.
[I 2025-12-05 15:22:30,457] Trial 17 finished with value: 0.030898012465810323 and parameters: {'model_type': 'mlp', 'hidden_dims': '[512, 128]', 'dropout': 0.4978127166512159, 'batch_norm': True, 'lr': 1.0138541947475892e-06, 'weight_decay': 1.40022675967374e-07, 'epochs': 294, 'loss': 'mse', 'optimizer': 'adam', 'graph_mode': 'off', 'use_snp_selection': True, 'num_snps': 45694}. Best is trial 4 with value: 0.1263244619776328.
[I 2025-12-05 15:22:32,923] Trial 18 finished with value: 0.12030927588061188 and parameters: {'model_type': 'mlp', 'hidden_dims': '[256, 128, 64]', 'dropout': 0.2597272741158347, 'batch_norm': False, 'lr': 1.2800675017306217e-05, 'weight_decay': 0.0003406785749946293, 'epochs': 237, 'loss': 'mse', 'optimizer': 'adam', 'graph_mode': 'off', 'use_snp_selection': True, 'num_snps': 20445}. Best is trial 4 with value: 0.1263244619776328.
[I 2025-12-05 15:22:35,357] Trial 19 finished with value: 0.09480906736574608 and parameters: {'model_type': 'mlp', 'hidden_dims': '[256, 128, 64]', 'dropout': 0.34251826970328825, 'batch_norm': False, 'lr': 2.1680577087603364e-05, 'weight_decay': 0.00033615734003032525, 'epochs': 241, 'loss': 'mse', 'optimizer': 'adam', 'graph_mode': 'off', 'use_snp_selection': True, 'num_snps': 18117}. Best is trial 4 with value: 0.1263244619776328.
[I 2025-12-05 15:22:38,820] Trial 20 finished with value: 0.07938182507484459 and parameters: {'model_type': 'mlp', 'hidden_dims': '[256, 128, 64]', 'dropout': 0.4878430952415107, 'batch_norm': False, 'lr': 4.219168330354138e-06, 'weight_decay': 4.86189792563168e-06, 'epochs': 228, 'loss': 'mse', 'optimizer': 'adam', 'graph_mode': 'off', 'use_snp_selection': True, 'num_snps': 39424}. Best is trial 4 with value: 0.1263244619776328.
[I 2025-12-05 15:22:41,344] Trial 21 finished with value: 0.12228352030899226 and parameters: {'model_type': 'mlp', 'hidden_dims': '[256, 128, 64]', 'dropout': 0.2592980027822515, 'batch_norm': False, 'lr': 8.654751816817481e-06, 'weight_decay': 0.0004334313195706938, 'epochs': 290, 'loss': 'mse', 'optimizer': 'adam', 'graph_mode': 'off', 'use_snp_selection': True, 'num_snps': 18239}. Best is trial 4 with value: 0.1263244619776328.
[I 2025-12-05 15:22:43,847] Trial 22 finished with value: 0.10481627019961619 and parameters: {'model_type': 'mlp', 'hidden_dims': '[256, 128, 64]', 'dropout': 0.2847508271213162, 'batch_norm': False, 'lr': 8.511607078962902e-06, 'weight_decay': 8.272602708038883e-05, 'epochs': 282, 'loss': 'mse', 'optimizer': 'adam', 'graph_mode': 'off', 'use_snp_selection': True, 'num_snps': 19189}. Best is trial 4 with value: 0.1263244619776328.
[I 2025-12-05 15:22:46,228] Trial 23 finished with value: 0.12716034891539385 and parameters: {'model_type': 'mlp', 'hidden_dims': '[256, 128, 64]', 'dropout': 0.180849735372543, 'batch_norm': False, 'lr': 2.6098820095361706e-06, 'weight_decay': 0.00038016969208500587, 'epochs': 229, 'loss': 'mse', 'optimizer': 'adam', 'graph_mode': 'off', 'use_snp_selection': True, 'num_snps': 18517}. Best is trial 23 with value: 0.12716034891539385.
[I 2025-12-05 15:22:48,163] Trial 24 finished with value: 0.11363164856169848 and parameters: {'model_type': 'mlp', 'hidden_dims': '[256, 128, 64]', 'dropout': 0.17760199873678104, 'batch_norm': False, 'lr': 2.8569019792782497e-06, 'weight_decay': 3.222196026009043e-05, 'epochs': 216, 'loss': 'mse', 'optimizer': 'adam', 'graph_mode': 'off', 'use_snp_selection': True, 'num_snps': 12126}. Best is trial 23 with value: 0.12716034891539385.
[I 2025-12-05 15:22:49,899] Trial 25 finished with value: 0.06467199714848161 and parameters: {'model_type': 'mlp', 'hidden_dims': '[256, 128, 64]', 'dropout': 0.1001162591703924, 'batch_norm': False, 'lr': 1.8862310961054846e-06, 'weight_decay': 0.0004748631611660458, 'epochs': 260, 'loss': 'mse', 'optimizer': 'adam', 'graph_mode': 'off', 'use_snp_selection': True, 'num_snps': 2878}. Best is trial 23 with value: 0.12716034891539385.
[I 2025-12-05 15:22:52,988] Trial 26 finished with value: 0.11480252566890108 and parameters: {'model_type': 'mlp', 'hidden_dims': '[256, 128, 64]', 'dropout': 0.20921925456038298, 'batch_norm': False, 'lr': 5.692330459046467e-06, 'weight_decay': 0.0001428936527441123, 'epochs': 179, 'loss': 'mse', 'optimizer': 'adam', 'graph_mode': 'off', 'use_snp_selection': True, 'num_snps': 35776}. Best is trial 23 with value: 0.12716034891539385.
[I 2025-12-05 15:22:56,669] Trial 27 finished with value: 0.07131877621293609 and parameters: {'model_type': 'mlp', 'hidden_dims': '[512, 256]', 'dropout': 0.16047291836769068, 'batch_norm': False, 'lr': 1.1401605038233244e-06, 'weight_decay': 0.00011580457427835778, 'epochs': 316, 'loss': 'mse', 'optimizer': 'adam', 'graph_mode': 'off', 'use_snp_selection': True, 'num_snps': 24516}. Best is trial 23 with value: 0.12716034891539385.
[I 2025-12-05 15:22:59,004] Trial 28 finished with value: 0.06402174073397598 and parameters: {'model_type': 'mlp', 'hidden_dims': '[256, 128]', 'dropout': 0.3260019631505258, 'batch_norm': False, 'lr': 2.5841417734208227e-06, 'weight_decay': 5.156756106236568e-05, 'epochs': 291, 'loss': 'mse', 'optimizer': 'adam', 'graph_mode': 'off', 'use_snp_selection': True, 'num_snps': 13915}. Best is trial 23 with value: 0.12716034891539385.
[I 2025-12-05 15:23:02,765] Trial 29 finished with value: 0.08650335630649311 and parameters: {'model_type': 'mlp', 'hidden_dims': '[128, 64]', 'dropout': 0.19340326564036608, 'batch_norm': False, 'lr': 1.9034954182974553e-06, 'weight_decay': 0.00042165893742003493, 'epochs': 331, 'loss': 'mae', 'optimizer': 'adam', 'graph_mode': 'off', 'use_snp_selection': True, 'num_snps': 51719}. Best is trial 23 with value: 0.12716034891539385.
[I 2025-12-05 15:23:05,145] Trial 30 finished with value: 0.1164821508723248 and parameters: {'model_type': 'mlp', 'hidden_dims': '[128, 64]', 'dropout': 0.13198796083142958, 'batch_norm': False, 'lr': 2.7054914810435258e-05, 'weight_decay': 3.503784241402885e-05, 'epochs': 165, 'loss': 'mse', 'optimizer': 'adam', 'graph_mode': 'off', 'use_snp_selection': True, 'num_snps': 24434}. Best is trial 23 with value: 0.12716034891539385.
[I 2025-12-05 15:23:07,608] Trial 31 finished with value: 0.13489085392412814 and parameters: {'model_type': 'mlp', 'hidden_dims': '[256, 128, 64]', 'dropout': 0.24920237212502666, 'batch_norm': False, 'lr': 9.21015801871532e-06, 'weight_decay': 0.00024250193461983023, 'epochs': 231, 'loss': 'mse', 'optimizer': 'adam', 'graph_mode': 'off', 'use_snp_selection': True, 'num_snps': 19324}. Best is trial 31 with value: 0.13489085392412814.
[I 2025-12-05 15:23:09,912] Trial 32 finished with value: 0.10856083369616681 and parameters: {'model_type': 'mlp', 'hidden_dims': '[256, 128, 64]', 'dropout': 0.2639322384773576, 'batch_norm': False, 'lr': 7.283182405877604e-06, 'weight_decay': 0.000523339875991667, 'epochs': 253, 'loss': 'mse', 'optimizer': 'adam', 'graph_mode': 'off', 'use_snp_selection': True, 'num_snps': 16950}. Best is trial 31 with value: 0.13489085392412814.
[I 2025-12-05 15:23:12,617] Trial 33 finished with value: 0.087183440478801 and parameters: {'model_type': 'mlp', 'hidden_dims': '[256, 128, 64]', 'dropout': 0.21286468171379055, 'batch_norm': False, 'lr': 3.1363057186863395e-06, 'weight_decay': 0.00020776306801236435, 'epochs': 221, 'loss': 'mse', 'optimizer': 'adam', 'graph_mode': 'off', 'use_snp_selection': True, 'num_snps': 23315}. Best is trial 31 with value: 0.13489085392412814.
[I 2025-12-05 15:23:15,920] Trial 34 finished with value: 0.09117623994608745 and parameters: {'model_type': 'mlp', 'hidden_dims': '[256, 128, 64]', 'dropout': 0.23600743122570905, 'batch_norm': False, 'lr': 4.511964511522414e-06, 'weight_decay': 9.441503917032941e-05, 'epochs': 274, 'loss': 'mae', 'optimizer': 'adam', 'graph_mode': 'off', 'use_snp_selection': True, 'num_snps': 34243}. Best is trial 31 with value: 0.13489085392412814.
[I 2025-12-05 15:23:17,777] Trial 35 finished with value: 0.10737687289133398 and parameters: {'model_type': 'mlp', 'hidden_dims': '[256, 128, 64]', 'dropout': 0.3730906829284106, 'batch_norm': False, 'lr': 1.833801089930158e-05, 'weight_decay': 0.0002809765702431695, 'epochs': 191, 'loss': 'mse', 'optimizer': 'adam', 'graph_mode': 'off', 'use_snp_selection': True, 'num_snps': 7933}. Best is trial 31 with value: 0.13489085392412814.
[I 2025-12-05 15:23:20,764] Trial 36 finished with value: 0.11878677415422054 and parameters: {'model_type': 'mlp', 'hidden_dims': '[256, 128]', 'dropout': 0.31092432680863913, 'batch_norm': False, 'lr': 3.546421873780211e-05, 'weight_decay': 0.0005812162070569776, 'epochs': 246, 'loss': 'mse', 'optimizer': 'adam', 'graph_mode': 'off', 'use_snp_selection': True, 'num_snps': 29638}. Best is trial 31 with value: 0.13489085392412814.
[I 2025-12-05 15:23:22,997] Trial 37 finished with value: 0.0848170044521667 and parameters: {'model_type': 'mlp', 'hidden_dims': '[512, 64]', 'dropout': 0.17567331180240817, 'batch_norm': False, 'lr': 1.4395791543915922e-06, 'weight_decay': 8.140712460985424e-06, 'epochs': 138, 'loss': 'mae', 'optimizer': 'adam', 'graph_mode': 'off', 'use_snp_selection': True, 'num_snps': 15113}. Best is trial 31 with value: 0.13489085392412814.
[I 2025-12-05 15:23:26,807] Trial 38 finished with value: 0.10004767682847791 and parameters: {'model_type': 'mlp', 'hidden_dims': '[256, 128, 64]', 'dropout': 0.1272074082016861, 'batch_norm': False, 'lr': 6.3432057840803685e-06, 'weight_decay': 0.0001782060383870413, 'epochs': 305, 'loss': 'mse', 'optimizer': 'adam', 'graph_mode': 'off', 'use_snp_selection': True, 'num_snps': 40206}. Best is trial 31 with value: 0.13489085392412814.
[I 2025-12-05 15:23:29,796] Trial 39 finished with value: 0.09145130228380813 and parameters: {'model_type': 'mlp', 'hidden_dims': '[512, 256]', 'dropout': 0.44536224472771696, 'batch_norm': True, 'lr': 2.582093124283181e-06, 'weight_decay': 5.208669767918214e-05, 'epochs': 201, 'loss': 'mse', 'optimizer': 'adam', 'graph_mode': 'off', 'use_snp_selection': True, 'num_snps': 22142}. Best is trial 31 with value: 0.13489085392412814.
[I 2025-12-05 15:23:35,512] Trial 40 finished with value: 0.11798498191988498 and parameters: {'model_type': 'mlp', 'hidden_dims': '[512, 64]', 'dropout': 0.5937685227205456, 'batch_norm': False, 'lr': 9.345109505922713e-06, 'weight_decay': 0.0002536433437080699, 'epochs': 329, 'loss': 'mae', 'optimizer': 'adam', 'graph_mode': 'off', 'use_snp_selection': True, 'num_snps': 46468}. Best is trial 31 with value: 0.13489085392412814.
[I 2025-12-05 15:23:38,011] Trial 41 finished with value: 0.1084065511494775 and parameters: {'model_type': 'mlp', 'hidden_dims': '[256, 128, 64]', 'dropout': 0.2671874002286349, 'batch_norm': False, 'lr': 1.2345528999949268e-05, 'weight_decay': 0.0003576659778123856, 'epochs': 234, 'loss': 'mse', 'optimizer': 'adam', 'graph_mode': 'off', 'use_snp_selection': True, 'num_snps': 20425}. Best is trial 31 with value: 0.13489085392412814.
[I 2025-12-05 15:23:39,882] Trial 42 finished with value: 0.08014811610263162 and parameters: {'model_type': 'mlp', 'hidden_dims': '[256, 128, 64]', 'dropout': 0.2536370199482301, 'batch_norm': False, 'lr': 1.2045983721798036e-05, 'weight_decay': 0.0005931189726731049, 'epochs': 227, 'loss': 'mse', 'optimizer': 'adam', 'graph_mode': 'off', 'use_snp_selection': True, 'num_snps': 9606}. Best is trial 31 with value: 0.13489085392412814.
[I 2025-12-05 15:23:42,721] Trial 43 finished with value: 0.12014534912111222 and parameters: {'model_type': 'mlp', 'hidden_dims': '[256, 128, 64]', 'dropout': 0.2785111750710251, 'batch_norm': False, 'lr': 0.00011511907739587827, 'weight_decay': 0.0002701321812637684, 'epochs': 269, 'loss': 'mse', 'optimizer': 'adam', 'graph_mode': 'off', 'use_snp_selection': True, 'num_snps': 26059}. Best is trial 31 with value: 0.13489085392412814.
[I 2025-12-05 15:23:45,897] Trial 44 finished with value: 0.11659092446713812 and parameters: {'model_type': 'mlp', 'hidden_dims': '[256, 128, 64]', 'dropout': 0.2360726107041748, 'batch_norm': False, 'lr': 4.220319439741245e-05, 'weight_decay': 1.9501073793343183e-05, 'epochs': 248, 'loss': 'mse', 'optimizer': 'adam', 'graph_mode': 'off', 'use_snp_selection': True, 'num_snps': 32273}. Best is trial 31 with value: 0.13489085392412814.
[I 2025-12-05 15:23:48,460] Trial 45 finished with value: 0.08226122911050132 and parameters: {'model_type': 'mlp', 'hidden_dims': '[256, 128]', 'dropout': 0.35732178985260465, 'batch_norm': True, 'lr': 4.6754250011952366e-06, 'weight_decay': 0.0006879122760567299, 'epochs': 286, 'loss': 'mse', 'optimizer': 'adam', 'graph_mode': 'off', 'use_snp_selection': False}. Best is trial 31 with value: 0.13489085392412814.
[I 2025-12-05 15:23:51,119] Trial 46 finished with value: 0.06700541548435829 and parameters: {'model_type': 'mlp', 'hidden_dims': '[512, 128]', 'dropout': 0.2988848501216552, 'batch_norm': True, 'lr': 2.468549163307584e-05, 'weight_decay': 0.0001396624881987086, 'epochs': 236, 'loss': 'mse', 'optimizer': 'adam', 'graph_mode': 'off', 'use_snp_selection': True, 'num_snps': 16374}. Best is trial 31 with value: 0.13489085392412814.
[I 2025-12-05 15:23:53,499] Trial 47 finished with value: 0.05779063640820445 and parameters: {'model_type': 'mlp', 'hidden_dims': '[256, 128, 64]', 'dropout': 0.2158827000327683, 'batch_norm': False, 'lr': 3.583840350516501e-06, 'weight_decay': 1.2102758243236956e-06, 'epochs': 207, 'loss': 'mse', 'optimizer': 'adam', 'graph_mode': 'off', 'use_snp_selection': True, 'num_snps': 20565}. Best is trial 31 with value: 0.13489085392412814.
[I 2025-12-05 15:23:55,812] Trial 48 finished with value: 0.08691023924439452 and parameters: {'model_type': 'mlp', 'hidden_dims': '[512, 128]', 'dropout': 0.1808791803189823, 'batch_norm': True, 'lr': 1.6374187753808292e-05, 'weight_decay': 0.0003807500947812181, 'epochs': 124, 'loss': 'mae', 'optimizer': 'adam', 'graph_mode': 'off', 'use_snp_selection': False}. Best is trial 31 with value: 0.13489085392412814.
[I 2025-12-05 15:23:57,775] Trial 49 finished with value: 0.06903682778726293 and parameters: {'model_type': 'mlp', 'hidden_dims': '[128, 64]', 'dropout': 0.2520755689950264, 'batch_norm': False, 'lr': 1.545813155792974e-06, 'weight_decay': 0.00019988160656012865, 'epochs': 260, 'loss': 'mse', 'optimizer': 'adam', 'graph_mode': 'off', 'use_snp_selection': True, 'num_snps': 11961}. Best is trial 31 with value: 0.13489085392412814.
[I 2025-12-05 15:23:59,352] Trial 50 finished with value: 0.05034859807683965 and parameters: {'model_type': 'mlp', 'hidden_dims': '[512, 64]', 'dropout': 0.15884227898686143, 'batch_norm': True, 'lr': 2.384977459769081e-06, 'weight_decay': 0.0009926097402557187, 'epochs': 67, 'loss': 'mse', 'optimizer': 'adam', 'graph_mode': 'off', 'use_snp_selection': False}. Best is trial 31 with value: 0.13489085392412814.
[I 2025-12-05 15:24:02,155] Trial 51 finished with value: 0.13217976764631884 and parameters: {'model_type': 'mlp', 'hidden_dims': '[256, 128, 64]', 'dropout': 0.27654623749573365, 'batch_norm': False, 'lr': 8.201272858357795e-05, 'weight_decay': 0.00025584578989114375, 'epochs': 271, 'loss': 'mse', 'optimizer': 'adam', 'graph_mode': 'off', 'use_snp_selection': True, 'num_snps': 26502}. Best is trial 31 with value: 0.13489085392412814.
[I 2025-12-05 15:24:05,054] Trial 52 finished with value: 0.11520638762728946 and parameters: {'model_type': 'mlp', 'hidden_dims': '[256, 128, 64]', 'dropout': 0.33138995115428366, 'batch_norm': False, 'lr': 0.00012556290007694902, 'weight_decay': 0.00010846437835892919, 'epochs': 269, 'loss': 'mse', 'optimizer': 'adam', 'graph_mode': 'off', 'use_snp_selection': True, 'num_snps': 26487}. Best is trial 31 with value: 0.13489085392412814.
[I 2025-12-05 15:24:07,778] Trial 53 finished with value: 0.11185888905430476 and parameters: {'model_type': 'mlp', 'hidden_dims': '[256, 128, 64]', 'dropout': 0.3107889349237442, 'batch_norm': False, 'lr': 8.064748241077036e-05, 'weight_decay': 0.0006692708194403651, 'epochs': 303, 'loss': 'mse', 'optimizer': 'adam', 'graph_mode': 'off', 'use_snp_selection': True, 'num_snps': 21779}. Best is trial 31 with value: 0.13489085392412814.
[I 2025-12-05 15:24:10,626] Trial 54 finished with value: 0.052277363010155745 and parameters: {'model_type': 'mlp', 'hidden_dims': '[256, 128, 64]', 'dropout': 0.27852243900383444, 'batch_norm': False, 'lr': 7.993844849186163e-06, 'weight_decay': 6.827814082986372e-05, 'epochs': 191, 'loss': 'mse', 'optimizer': 'adam', 'graph_mode': 'off', 'use_snp_selection': True, 'num_snps': 28966}. Best is trial 31 with value: 0.13489085392412814.
[I 2025-12-05 15:24:13,266] Trial 55 finished with value: 0.12638754335798869 and parameters: {'model_type': 'mlp', 'hidden_dims': '[512, 128]', 'dropout': 0.24822294617914636, 'batch_norm': False, 'lr': 5.5249045474320956e-05, 'weight_decay': 0.0003062534273886686, 'epochs': 284, 'loss': 'mse', 'optimizer': 'adam', 'graph_mode': 'off', 'use_snp_selection': True, 'num_snps': 14949}. Best is trial 31 with value: 0.13489085392412814.
[I 2025-12-05 15:24:18,109] Trial 56 finished with value: 0.10719254254725731 and parameters: {'model_type': 'mlp', 'hidden_dims': '[512, 128]', 'dropout': 0.22638461469482882, 'batch_norm': False, 'lr': 7.919049604417178e-05, 'weight_decay': 0.0001784762205221432, 'epochs': 345, 'loss': 'mse', 'optimizer': 'adam', 'graph_mode': 'off', 'use_snp_selection': True, 'num_snps': 37654}. Best is trial 31 with value: 0.13489085392412814.
[I 2025-12-05 15:24:20,953] Trial 57 finished with value: 0.10481892422706256 and parameters: {'model_type': 'mlp', 'hidden_dims': '[512, 128]', 'dropout': 0.19943270688664494, 'batch_norm': True, 'lr': 5.5724493895839927e-05, 'weight_decay': 0.0004587127818962433, 'epochs': 311, 'loss': 'mse', 'optimizer': 'adam', 'graph_mode': 'off', 'use_snp_selection': True, 'num_snps': 15650}. Best is trial 31 with value: 0.13489085392412814.
[I 2025-12-05 15:24:22,658] Trial 58 finished with value: 0.12037238769743966 and parameters: {'model_type': 'mlp', 'hidden_dims': '[512, 128]', 'dropout': 0.244728405464076, 'batch_norm': False, 'lr': 0.00011964493544727401, 'weight_decay': 0.00023863150379865598, 'epochs': 279, 'loss': 'mse', 'optimizer': 'adam', 'graph_mode': 'off', 'use_snp_selection': True, 'num_snps': 4493}. Best is trial 31 with value: 0.13489085392412814.
[I 2025-12-05 15:24:26,925] Trial 59 finished with value: 0.11478224139813922 and parameters: {'model_type': 'mlp', 'hidden_dims': '[512, 128]', 'dropout': 0.41142278739938354, 'batch_norm': False, 'lr': 0.00016884814627511307, 'weight_decay': 0.00014782957254800002, 'epochs': 294, 'loss': 'mse', 'optimizer': 'adam', 'graph_mode': 'off', 'use_snp_selection': False}. Best is trial 31 with value: 0.13489085392412814.
[I 2025-12-05 15:24:29,909] Trial 60 finished with value: 0.11765674707717226 and parameters: {'model_type': 'mlp', 'hidden_dims': '[512, 256]', 'dropout': 0.2956516056866087, 'batch_norm': True, 'lr': 3.284162271839927e-05, 'weight_decay': 0.00032967505294002327, 'epochs': 325, 'loss': 'mse', 'optimizer': 'adam', 'graph_mode': 'off', 'use_snp_selection': True, 'num_snps': 17647}. Best is trial 31 with value: 0.13489085392412814.
[I 2025-12-05 15:24:31,788] Trial 61 finished with value: 0.10725575323488962 and parameters: {'model_type': 'mlp', 'hidden_dims': '[512, 128]', 'dropout': 0.24166748173414568, 'batch_norm': False, 'lr': 0.00011417589305271088, 'weight_decay': 0.00024389328788223331, 'epochs': 281, 'loss': 'mse', 'optimizer': 'adam', 'graph_mode': 'off', 'use_snp_selection': True, 'num_snps': 6734}. Best is trial 31 with value: 0.13489085392412814.
[I 2025-12-05 15:24:33,851] Trial 62 finished with value: 0.10030459073230497 and parameters: {'model_type': 'mlp', 'hidden_dims': '[512, 128]', 'dropout': 0.22220924950847282, 'batch_norm': False, 'lr': 0.0002747762599889789, 'weight_decay': 0.00068891136046415, 'epochs': 257, 'loss': 'mse', 'optimizer': 'adam', 'graph_mode': 'off', 'use_snp_selection': True, 'num_snps': 9678}. Best is trial 31 with value: 0.13489085392412814.
[I 2025-12-05 15:24:35,487] Trial 63 finished with value: 0.10312896136245389 and parameters: {'model_type': 'mlp', 'hidden_dims': '[512, 128]', 'dropout': 0.27061237339233923, 'batch_norm': False, 'lr': 6.927004210973045e-05, 'weight_decay': 0.00045185946316723475, 'epochs': 281, 'loss': 'mse', 'optimizer': 'adam', 'graph_mode': 'off', 'use_snp_selection': True, 'num_snps': 2071}. Best is trial 31 with value: 0.13489085392412814.
