[I 2025-12-05 15:15:24,073] Trial 103 finished with value: 0.05015993332678291 and parameters: {'model_type': 'mlp', 'hidden_dims': '[512, 128]', 'dropout': 0.10938367197162127, 'batch_norm': True, 'lr': 0.0008225474083625322, 'weight_decay': 8.492104633252738e-06, 'epochs': 274, 'loss': 'mse', 'optimizer': 'adam', 'graph_mode': 'off', 'use_snp_selection': True, 'num_snps': 12735}. Best is trial 83 with value: 0.08294699249778348.
[I 2025-12-05 15:15:25,393] Trial 104 finished with value: 0.046629688376469386 and parameters: {'model_type': 'mlp', 'hidden_dims': '[512, 128]', 'dropout': 0.12511229683814834, 'batch_norm': True, 'lr': 0.0006381718703216334, 'weight_decay': 1.099755482300388e-05, 'epochs': 284, 'loss': 'mse', 'optimizer': 'adam', 'graph_mode': 'off', 'use_snp_selection': True, 'num_snps': 10541}. Best is trial 83 with value: 0.08294699249778348.
[I 2025-12-05 15:15:26,883] Trial 105 finished with value: 0.06647736584094768 and parameters: {'model_type': 'mlp', 'hidden_dims': '[512, 128]', 'dropout': 0.14151193768509118, 'batch_norm': True, 'lr': 0.0008010108366144839, 'weight_decay': 1.807525371953209e-05, 'epochs': 252, 'loss': 'mse', 'optimizer': 'adam', 'graph_mode': 'off', 'use_snp_selection': True, 'num_snps': 16391}. Best is trial 83 with value: 0.08294699249778348.
[I 2025-12-05 15:15:28,360] Trial 106 finished with value: 0.053785810187305744 and parameters: {'model_type': 'mlp', 'hidden_dims': '[512, 128]', 'dropout': 0.1453179574054432, 'batch_norm': True, 'lr': 0.000992026386133727, 'weight_decay': 1.937839047075351e-05, 'epochs': 279, 'loss': 'mse', 'optimizer': 'adam', 'graph_mode': 'off', 'use_snp_selection': True, 'num_snps': 15469}. Best is trial 83 with value: 0.08294699249778348.
[I 2025-12-05 15:15:29,773] Trial 107 finished with value: 0.055259464553060966 and parameters: {'model_type': 'mlp', 'hidden_dims': '[512, 128]', 'dropout': 0.13908473696127233, 'batch_norm': True, 'lr': 0.0007636306787132993, 'weight_decay': 1.5902608906846254e-05, 'epochs': 293, 'loss': 'mse', 'optimizer': 'adam', 'graph_mode': 'off', 'use_snp_selection': True, 'num_snps': 13770}. Best is trial 83 with value: 0.08294699249778348.
[I 2025-12-05 15:15:31,215] Trial 108 finished with value: 0.05009373563166097 and parameters: {'model_type': 'mlp', 'hidden_dims': '[512, 128]', 'dropout': 0.1120049525536476, 'batch_norm': True, 'lr': 0.0005930356408809092, 'weight_decay': 0.0002158964643820024, 'epochs': 264, 'loss': 'mse', 'optimizer': 'adam', 'graph_mode': 'off', 'use_snp_selection': True, 'num_snps': 16928}. Best is trial 83 with value: 0.08294699249778348.
[I 2025-12-05 15:15:32,383] Trial 109 finished with value: 0.05004953826114242 and parameters: {'model_type': 'mlp', 'hidden_dims': '[512, 128]', 'dropout': 0.15703249942091685, 'batch_norm': True, 'lr': 0.0009198901943905387, 'weight_decay': 4.79368290797606e-06, 'epochs': 255, 'loss': 'mse', 'optimizer': 'adam', 'graph_mode': 'off', 'use_snp_selection': True, 'num_snps': 8609}. Best is trial 83 with value: 0.08294699249778348.
[I 2025-12-05 15:15:33,866] Trial 110 finished with value: 0.055586425969208694 and parameters: {'model_type': 'mlp', 'hidden_dims': '[512, 128]', 'dropout': 0.17899183852671335, 'batch_norm': True, 'lr': 0.0004510467534348846, 'weight_decay': 9.402447870953849e-06, 'epochs': 273, 'loss': 'mae', 'optimizer': 'adam', 'graph_mode': 'off', 'use_snp_selection': True, 'num_snps': 17658}. Best is trial 83 with value: 0.08294699249778348.
[I 2025-12-05 15:15:35,268] Trial 111 finished with value: 0.054373222905123864 and parameters: {'model_type': 'mlp', 'hidden_dims': '[512, 128]', 'dropout': 0.10025765783947711, 'batch_norm': True, 'lr': 0.0005323065307178465, 'weight_decay': 3.785104192120293e-05, 'epochs': 266, 'loss': 'mse', 'optimizer': 'adam', 'graph_mode': 'off', 'use_snp_selection': True, 'num_snps': 15707}. Best is trial 83 with value: 0.08294699249778348.
[I 2025-12-05 15:15:36,721] Trial 112 finished with value: 0.0526052341335104 and parameters: {'model_type': 'mlp', 'hidden_dims': '[512, 128]', 'dropout': 0.1242308225583056, 'batch_norm': True, 'lr': 0.0008027789230212108, 'weight_decay': 2.5090902904450894e-05, 'epochs': 286, 'loss': 'mse', 'optimizer': 'adam', 'graph_mode': 'off', 'use_snp_selection': True, 'num_snps': 14094}. Best is trial 83 with value: 0.08294699249778348.
[I 2025-12-05 15:15:38,153] Trial 113 finished with value: 0.05448209684066494 and parameters: {'model_type': 'mlp', 'hidden_dims': '[512, 128]', 'dropout': 0.11089532541817189, 'batch_norm': True, 'lr': 0.0006795381671441245, 'weight_decay': 7.5085866931871616e-06, 'epochs': 311, 'loss': 'mse', 'optimizer': 'adam', 'graph_mode': 'off', 'use_snp_selection': True, 'num_snps': 11870}. Best is trial 83 with value: 0.08294699249778348.
[I 2025-12-05 15:15:39,690] Trial 114 finished with value: 0.053115243339374785 and parameters: {'model_type': 'mlp', 'hidden_dims': '[512, 128]', 'dropout': 0.1363808386004607, 'batch_norm': True, 'lr': 0.00083684456413759, 'weight_decay': 1.0904646422752353e-05, 'epochs': 247, 'loss': 'mse', 'optimizer': 'adam', 'graph_mode': 'off', 'use_snp_selection': True, 'num_snps': 18701}. Best is trial 83 with value: 0.08294699249778348.
[I 2025-12-05 15:15:40,921] Trial 115 finished with value: 0.05057279213033358 and parameters: {'model_type': 'mlp', 'hidden_dims': '[128, 64]', 'dropout': 0.1506865712899472, 'batch_norm': True, 'lr': 0.00041189957105913907, 'weight_decay': 5.787013873858778e-06, 'epochs': 348, 'loss': 'mse', 'optimizer': 'adam', 'graph_mode': 'off', 'use_snp_selection': True, 'num_snps': 6159}. Best is trial 83 with value: 0.08294699249778348.
[I 2025-12-05 15:15:42,395] Trial 116 finished with value: 0.055052902343429515 and parameters: {'model_type': 'mlp', 'hidden_dims': '[512, 128]', 'dropout': 0.12194577915772767, 'batch_norm': True, 'lr': 0.0005736137618346062, 'weight_decay': 1.3758161329519679e-05, 'epochs': 278, 'loss': 'mse', 'optimizer': 'adam', 'graph_mode': 'off', 'use_snp_selection': True, 'num_snps': 16278}. Best is trial 83 with value: 0.08294699249778348.
[I 2025-12-05 15:15:43,621] Trial 117 finished with value: 0.06193424423408332 and parameters: {'model_type': 'mlp', 'hidden_dims': '[512, 128]', 'dropout': 0.13248642998933588, 'batch_norm': True, 'lr': 0.00037126335871060325, 'weight_decay': 1.987477054474671e-05, 'epochs': 256, 'loss': 'mse', 'optimizer': 'adam', 'graph_mode': 'off', 'use_snp_selection': True, 'num_snps': 9981}. Best is trial 83 with value: 0.08294699249778348.
[I 2025-12-05 15:15:44,885] Trial 118 finished with value: 0.03987183272870949 and parameters: {'model_type': 'mlp', 'hidden_dims': '[512, 128]', 'dropout': 0.13320225014939047, 'batch_norm': True, 'lr': 0.00036898106104611824, 'weight_decay': 2.1045401374093307e-05, 'epochs': 304, 'loss': 'mse', 'optimizer': 'adam', 'graph_mode': 'off', 'use_snp_selection': True, 'num_snps': 9651}. Best is trial 83 with value: 0.08294699249778348.
[I 2025-12-05 15:15:46,165] Trial 119 finished with value: 0.05516518862482204 and parameters: {'model_type': 'mlp', 'hidden_dims': '[512, 128]', 'dropout': 0.10857970046841656, 'batch_norm': True, 'lr': 0.0006560696649965108, 'weight_decay': 1.720675918878788e-05, 'epochs': 253, 'loss': 'mse', 'optimizer': 'adam', 'graph_mode': 'off', 'use_snp_selection': True, 'num_snps': 12533}. Best is trial 83 with value: 0.08294699249778348.
[I 2025-12-05 15:15:47,331] Trial 120 finished with value: 0.05187696225919478 and parameters: {'model_type': 'mlp', 'hidden_dims': '[512, 128]', 'dropout': 0.162076630482716, 'batch_norm': True, 'lr': 0.0005029144451434302, 'weight_decay': 1.1964631860232098e-05, 'epochs': 177, 'loss': 'mse', 'optimizer': 'adam', 'graph_mode': 'off', 'use_snp_selection': True, 'num_snps': 11153}. Best is trial 83 with value: 0.08294699249778348.
[I 2025-12-05 15:15:48,401] Trial 121 finished with value: 0.04317411302236987 and parameters: {'model_type': 'mlp', 'hidden_dims': '[512, 128]', 'dropout': 0.12008389030709861, 'batch_norm': True, 'lr': 0.0002608047764837381, 'weight_decay': 7.258881750912585e-05, 'epochs': 263, 'loss': 'mse', 'optimizer': 'adam', 'graph_mode': 'off', 'use_snp_selection': True, 'num_snps': 3122}. Best is trial 83 with value: 0.08294699249778348.
[I 2025-12-05 15:15:51,154] Trial 122 finished with value: 0.0392613169580504 and parameters: {'model_type': 'mlp', 'hidden_dims': '[512, 128]', 'dropout': 0.1416893599879126, 'batch_norm': True, 'lr': 0.00017205787358055353, 'weight_decay': 2.768992498177679e-05, 'epochs': 293, 'loss': 'mse', 'optimizer': 'adam', 'graph_mode': 'off', 'use_snp_selection': True, 'num_snps': 40666}. Best is trial 83 with value: 0.08294699249778348.
[I 2025-12-05 15:15:52,544] Trial 123 finished with value: 0.06318259064427803 and parameters: {'model_type': 'mlp', 'hidden_dims': '[512, 128]', 'dropout': 0.12981793631076416, 'batch_norm': True, 'lr': 0.00021998350513441402, 'weight_decay': 1.491107472365602e-05, 'epochs': 272, 'loss': 'mse', 'optimizer': 'adam', 'graph_mode': 'off', 'use_snp_selection': True, 'num_snps': 14636}. Best is trial 83 with value: 0.08294699249778348.
[I 2025-12-05 15:15:53,929] Trial 124 finished with value: 0.05239315955013424 and parameters: {'model_type': 'mlp', 'hidden_dims': '[512, 128]', 'dropout': 0.12925663310638086, 'batch_norm': True, 'lr': 0.000746438240188928, 'weight_decay': 8.025736321572798e-06, 'epochs': 275, 'loss': 'mse', 'optimizer': 'adam', 'graph_mode': 'off', 'use_snp_selection': True, 'num_snps': 14950}. Best is trial 83 with value: 0.08294699249778348.
[I 2025-12-05 15:15:55,261] Trial 125 finished with value: 0.04556904153226418 and parameters: {'model_type': 'mlp', 'hidden_dims': '[512, 128]', 'dropout': 0.1475044521927176, 'batch_norm': True, 'lr': 0.00020925029173820322, 'weight_decay': 1.4440518789729094e-05, 'epochs': 269, 'loss': 'mse', 'optimizer': 'adam', 'graph_mode': 'off', 'use_snp_selection': True, 'num_snps': 13357}. Best is trial 83 with value: 0.08294699249778348.
[I 2025-12-05 15:15:56,749] Trial 126 finished with value: 0.0472841005407941 and parameters: {'model_type': 'mlp', 'hidden_dims': '[512, 128]', 'dropout': 0.10094001379112927, 'batch_norm': True, 'lr': 0.0002913980226539129, 'weight_decay': 9.854086888735321e-06, 'epochs': 287, 'loss': 'mse', 'optimizer': 'adam', 'graph_mode': 'off', 'use_snp_selection': True, 'num_snps': 17427}. Best is trial 83 with value: 0.08294699249778348.
[I 2025-12-05 15:15:58,123] Trial 127 finished with value: 0.05704950620171946 and parameters: {'model_type': 'mlp', 'hidden_dims': '[128, 64]', 'dropout': 0.1131025214483677, 'batch_norm': True, 'lr': 0.0009916932346256894, 'weight_decay': 1.9391497871861906e-05, 'epochs': 166, 'loss': 'mse', 'optimizer': 'adam', 'graph_mode': 'off', 'use_snp_selection': True, 'num_snps': 18083}. Best is trial 83 with value: 0.08294699249778348.
[I 2025-12-05 15:15:59,181] Trial 128 finished with value: 0.04862311867745103 and parameters: {'model_type': 'mlp', 'hidden_dims': '[128, 64]', 'dropout': 0.11309485045357623, 'batch_norm': True, 'lr': 0.0008503276563875388, 'weight_decay': 2.1196831383544685e-05, 'epochs': 156, 'loss': 'mse', 'optimizer': 'adam', 'graph_mode': 'off', 'use_snp_selection': True, 'num_snps': 7881}. Best is trial 83 with value: 0.08294699249778348.
[I 2025-12-05 15:16:00,302] Trial 129 finished with value: 0.05069325931194111 and parameters: {'model_type': 'mlp', 'hidden_dims': '[512, 256]', 'dropout': 0.11757527993173553, 'batch_norm': True, 'lr': 0.0009458909383178467, 'weight_decay': 4.025602863973132e-05, 'epochs': 143, 'loss': 'mae', 'optimizer': 'adam', 'graph_mode': 'off', 'use_snp_selection': True, 'num_snps': 10413}. Best is trial 83 with value: 0.08294699249778348.
[I 2025-12-05 15:16:01,546] Trial 130 finished with value: 0.04167262531319957 and parameters: {'model_type': 'mlp', 'hidden_dims': '[128, 64]', 'dropout': 0.285548002280353, 'batch_norm': True, 'lr': 3.0140908285253558e-05, 'weight_decay': 1.7321962564842756e-05, 'epochs': 186, 'loss': 'mse', 'optimizer': 'adam', 'graph_mode': 'off', 'use_snp_selection': True, 'num_snps': 14166}. Best is trial 83 with value: 0.08294699249778348.
[I 2025-12-05 15:16:02,774] Trial 131 finished with value: 0.05775081767377591 and parameters: {'model_type': 'mlp', 'hidden_dims': '[128, 64]', 'dropout': 0.1352150364607214, 'batch_norm': True, 'lr': 0.00013955355037967318, 'weight_decay': 1.178660700426853e-05, 'epochs': 163, 'loss': 'mse', 'optimizer': 'adam', 'graph_mode': 'off', 'use_snp_selection': True, 'num_snps': 15658}. Best is trial 83 with value: 0.08294699249778348.
[I 2025-12-05 15:16:04,105] Trial 132 finished with value: 0.03331815780119943 and parameters: {'model_type': 'mlp', 'hidden_dims': '[128, 64]', 'dropout': 0.13402039570163055, 'batch_norm': True, 'lr': 3.8102404968682193e-05, 'weight_decay': 1.1935356796466724e-05, 'epochs': 168, 'loss': 'mse', 'optimizer': 'adam', 'graph_mode': 'off', 'use_snp_selection': True, 'num_snps': 18783}. Best is trial 83 with value: 0.08294699249778348.
[I 2025-12-05 15:16:05,314] Trial 133 finished with value: 0.05870494225483315 and parameters: {'model_type': 'mlp', 'hidden_dims': '[128, 64]', 'dropout': 0.49042582314640293, 'batch_norm': True, 'lr': 0.0007069104735371599, 'weight_decay': 6.572183203306085e-06, 'epochs': 146, 'loss': 'mse', 'optimizer': 'adam', 'graph_mode': 'off', 'use_snp_selection': True, 'num_snps': 15827}. Best is trial 83 with value: 0.08294699249778348.
[I 2025-12-05 15:16:06,530] Trial 134 finished with value: 0.030908954770595395 and parameters: {'model_type': 'mlp', 'hidden_dims': '[128, 64]', 'dropout': 0.5344472575766477, 'batch_norm': True, 'lr': 0.00014409642713572728, 'weight_decay': 6.6184689763321e-06, 'epochs': 133, 'loss': 'mse', 'optimizer': 'adam', 'graph_mode': 'off', 'use_snp_selection': True, 'num_snps': 15590}. Best is trial 83 with value: 0.08294699249778348.
[I 2025-12-05 15:16:07,683] Trial 135 finished with value: 0.013389489914109827 and parameters: {'model_type': 'mlp', 'hidden_dims': '[128, 64]', 'dropout': 0.5409400393553575, 'batch_norm': True, 'lr': 9.119556310648975e-05, 'weight_decay': 8.820045126768894e-06, 'epochs': 119, 'loss': 'mse', 'optimizer': 'adam', 'graph_mode': 'off', 'use_snp_selection': True, 'num_snps': 12254}. Best is trial 83 with value: 0.08294699249778348.
[I 2025-12-05 15:16:08,922] Trial 136 finished with value: 0.05291783434549278 and parameters: {'model_type': 'mlp', 'hidden_dims': '[128, 64]', 'dropout': 0.4994051070180986, 'batch_norm': True, 'lr': 0.0007171068086020669, 'weight_decay': 3.930331993668158e-06, 'epochs': 144, 'loss': 'mse', 'optimizer': 'adam', 'graph_mode': 'off', 'use_snp_selection': True, 'num_snps': 14663}. Best is trial 83 with value: 0.08294699249778348.
[I 2025-12-05 15:16:11,703] Trial 137 finished with value: 0.04858725753409983 and parameters: {'model_type': 'mlp', 'hidden_dims': '[512, 64]', 'dropout': 0.15402675081752548, 'batch_norm': True, 'lr': 0.0006239660706594087, 'weight_decay': 5.074716117799672e-06, 'epochs': 153, 'loss': 'mse', 'optimizer': 'adam', 'graph_mode': 'off', 'use_snp_selection': True, 'num_snps': 52245}. Best is trial 83 with value: 0.08294699249778348.
[I 2025-12-05 15:16:13,027] Trial 138 finished with value: 0.05201966086933774 and parameters: {'model_type': 'mlp', 'hidden_dims': '[256, 128, 64]', 'dropout': 0.14198402666705393, 'batch_norm': True, 'lr': 0.00013581740095928475, 'weight_decay': 7.2200447318889205e-06, 'epochs': 162, 'loss': 'mse', 'optimizer': 'adam', 'graph_mode': 'off', 'use_snp_selection': True, 'num_snps': 16550}. Best is trial 83 with value: 0.08294699249778348.
[I 2025-12-05 15:16:14,048] Trial 139 finished with value: 0.037668569201341075 and parameters: {'model_type': 'mlp', 'hidden_dims': '[128, 64]', 'dropout': 0.4687437424887619, 'batch_norm': True, 'lr': 0.00019412521819641877, 'weight_decay': 0.00048309756435719047, 'epochs': 67, 'loss': 'mse', 'optimizer': 'adam', 'graph_mode': 'off', 'use_snp_selection': True, 'num_snps': 13084}. Best is trial 83 with value: 0.08294699249778348.
[I 2025-12-05 15:16:15,239] Trial 140 finished with value: 0.056929179637040334 and parameters: {'model_type': 'mlp', 'hidden_dims': '[512, 256]', 'dropout': 0.16760139825874787, 'batch_norm': True, 'lr': 0.00047120139301532225, 'weight_decay': 0.0001312673835744797, 'epochs': 197, 'loss': 'mae', 'optimizer': 'adam', 'graph_mode': 'off', 'use_snp_selection': True, 'num_snps': 11521}. Best is trial 83 with value: 0.08294699249778348.
[I 2025-12-05 15:16:16,506] Trial 141 finished with value: 0.04700715286342952 and parameters: {'model_type': 'mlp', 'hidden_dims': '[128, 64]', 'dropout': 0.10943764935298424, 'batch_norm': True, 'lr': 0.0009559320256152183, 'weight_decay': 1.0863352180419565e-05, 'epochs': 163, 'loss': 'mse', 'optimizer': 'adam', 'graph_mode': 'off', 'use_snp_selection': True, 'num_snps': 17207}. Best is trial 83 with value: 0.08294699249778348.
[I 2025-12-05 15:16:17,906] Trial 142 finished with value: 0.04862426143888596 and parameters: {'model_type': 'mlp', 'hidden_dims': '[128, 64]', 'dropout': 0.5965006933558833, 'batch_norm': True, 'lr': 0.0009863594609615131, 'weight_decay': 1.7127999223438143e-05, 'epochs': 174, 'loss': 'mse', 'optimizer': 'adam', 'graph_mode': 'off', 'use_snp_selection': True, 'num_snps': 18352}. Best is trial 83 with value: 0.08294699249778348.
[I 2025-12-05 15:16:19,264] Trial 143 finished with value: 0.050037605206268924 and parameters: {'model_type': 'mlp', 'hidden_dims': '[128, 64]', 'dropout': 0.5678851386720539, 'batch_norm': True, 'lr': 0.0005777685349865028, 'weight_decay': 1.296265209391914e-05, 'epochs': 181, 'loss': 'mse', 'optimizer': 'adam', 'graph_mode': 'off', 'use_snp_selection': True, 'num_snps': 15901}. Best is trial 83 with value: 0.08294699249778348.
[I 2025-12-05 15:16:20,912] Trial 144 finished with value: 0.04290776145976265 and parameters: {'model_type': 'mlp', 'hidden_dims': '[128, 64]', 'dropout': 0.12285639305764094, 'batch_norm': True, 'lr': 0.0007583055319662033, 'weight_decay': 2.795594545165636e-05, 'epochs': 282, 'loss': 'mse', 'optimizer': 'adam', 'graph_mode': 'off', 'use_snp_selection': True, 'num_snps': 22300}. Best is trial 83 with value: 0.08294699249778348.
[I 2025-12-05 15:16:22,257] Trial 145 finished with value: 0.051311331309860354 and parameters: {'model_type': 'mlp', 'hidden_dims': '[128, 64]', 'dropout': 0.13099596091577292, 'batch_norm': True, 'lr': 0.0006730497964111564, 'weight_decay': 2.3675846955197286e-05, 'epochs': 143, 'loss': 'mse', 'optimizer': 'adam', 'graph_mode': 'off', 'use_snp_selection': True, 'num_snps': 19785}. Best is trial 83 with value: 0.08294699249778348.
[I 2025-12-05 15:16:23,628] Trial 146 finished with value: 0.052638845964754356 and parameters: {'model_type': 'mlp', 'hidden_dims': '[512, 64]', 'dropout': 0.10015901069035285, 'batch_norm': True, 'lr': 0.0008342882573638495, 'weight_decay': 9.65085682233739e-06, 'epochs': 168, 'loss': 'mse', 'optimizer': 'adam', 'graph_mode': 'off', 'use_snp_selection': True, 'num_snps': 17775}. Best is trial 83 with value: 0.08294699249778348.
[I 2025-12-05 15:16:24,768] Trial 147 finished with value: 0.04691077053443579 and parameters: {'model_type': 'mlp', 'hidden_dims': '[512, 128]', 'dropout': 0.11585080168888728, 'batch_norm': True, 'lr': 0.00021514622065867798, 'weight_decay': 6.179331251608843e-06, 'epochs': 115, 'loss': 'mse', 'optimizer': 'adam', 'graph_mode': 'off', 'use_snp_selection': True, 'num_snps': 13969}. Best is trial 83 with value: 0.08294699249778348.
[I 2025-12-05 15:16:26,166] Trial 148 finished with value: 0.03342396201413876 and parameters: {'model_type': 'mlp', 'hidden_dims': '[512, 128]', 'dropout': 0.14127245185745643, 'batch_norm': True, 'lr': 0.00010798376610363218, 'weight_decay': 1.8851232625353262e-05, 'epochs': 157, 'loss': 'mse', 'optimizer': 'adam', 'graph_mode': 'off', 'use_snp_selection': False}. Best is trial 83 with value: 0.08294699249778348.
[I 2025-12-05 15:16:27,173] Trial 149 finished with value: 0.04402740114930572 and parameters: {'model_type': 'mlp', 'hidden_dims': '[128, 64]', 'dropout': 0.2592173281655918, 'batch_norm': True, 'lr': 0.00042097663188929283, 'weight_decay': 0.0001631896931981253, 'epochs': 136, 'loss': 'mse', 'optimizer': 'adam', 'graph_mode': 'off', 'use_snp_selection': True, 'num_snps': 9269}. Best is trial 83 with value: 0.08294699249778348.
[I 2025-12-05 15:16:30,030] Trial 0 finished with value: 0.028249672852137656 and parameters: {'model_type': 'mlp', 'hidden_dims': '[128, 64]', 'dropout': 0.199031432379812, 'batch_norm': True, 'lr': 1.8408544111075837e-06, 'weight_decay': 5.5136510071208614e-05, 'epochs': 336, 'loss': 'mae', 'optimizer': 'adam', 'graph_mode': 'off', 'use_snp_selection': True, 'num_snps': 43862}. Best is trial 0 with value: 0.028249672852137656.
[I 2025-12-05 15:16:31,552] Trial 1 finished with value: 0.06286898655394244 and parameters: {'model_type': 'mlp', 'hidden_dims': '[256, 128]', 'dropout': 0.4370668075331726, 'batch_norm': True, 'lr': 7.133471581159139e-05, 'weight_decay': 1.128633586803549e-05, 'epochs': 242, 'loss': 'mae', 'optimizer': 'adam', 'graph_mode': 'off', 'use_snp_selection': False}. Best is trial 1 with value: 0.06286898655394244.
[I 2025-12-05 15:16:32,959] Trial 2 finished with value: 0.010737972442380403 and parameters: {'model_type': 'mlp', 'hidden_dims': '[256, 128, 64]', 'dropout': 0.41314357415569625, 'batch_norm': False, 'lr': 3.952233718592101e-06, 'weight_decay': 0.00026754769258252603, 'epochs': 149, 'loss': 'mse', 'optimizer': 'adam', 'graph_mode': 'off', 'use_snp_selection': True, 'num_snps': 11571}. Best is trial 1 with value: 0.06286898655394244.
