[I 2025-12-05 15:44:04,841] Trial 129 finished with value: 0.0840811249445707 and parameters: {'model_type': 'mlp', 'hidden_dims': '[512, 128]', 'dropout': 0.13770255252248226, 'batch_norm': False, 'lr': 0.00014317043674906644, 'weight_decay': 7.299667431766567e-06, 'epochs': 151, 'loss': 'mae', 'optimizer': 'adam', 'graph_mode': 'off', 'use_snp_selection': True, 'num_snps': 20035}. Best is trial 125 with value: 0.1039116816153847.
[I 2025-12-05 15:44:06,274] Trial 130 finished with value: 0.1111828814506791 and parameters: {'model_type': 'mlp', 'hidden_dims': '[512, 128]', 'dropout': 0.1478974397611802, 'batch_norm': False, 'lr': 0.00011837416066784729, 'weight_decay': 4.592631801223305e-06, 'epochs': 139, 'loss': 'mae', 'optimizer': 'adam', 'graph_mode': 'off', 'use_snp_selection': True, 'num_snps': 24028}. Best is trial 130 with value: 0.1111828814506791.
[I 2025-12-05 15:44:07,755] Trial 131 finished with value: 0.09393568328099369 and parameters: {'model_type': 'mlp', 'hidden_dims': '[512, 128]', 'dropout': 0.14753437987921827, 'batch_norm': False, 'lr': 0.0001467014266312136, 'weight_decay': 3.8009783295001363e-06, 'epochs': 130, 'loss': 'mae', 'optimizer': 'adam', 'graph_mode': 'off', 'use_snp_selection': True, 'num_snps': 24857}. Best is trial 130 with value: 0.1111828814506791.
[I 2025-12-05 15:44:09,112] Trial 132 finished with value: 0.08904991589043673 and parameters: {'model_type': 'mlp', 'hidden_dims': '[512, 128]', 'dropout': 0.14919141670490274, 'batch_norm': False, 'lr': 0.000116246393471357, 'weight_decay': 2.6972278241322052e-06, 'epochs': 138, 'loss': 'mae', 'optimizer': 'adam', 'graph_mode': 'off', 'use_snp_selection': True, 'num_snps': 21490}. Best is trial 130 with value: 0.1111828814506791.
[I 2025-12-05 15:44:10,556] Trial 133 finished with value: 0.08752347232634525 and parameters: {'model_type': 'mlp', 'hidden_dims': '[512, 128]', 'dropout': 0.1687322702844279, 'batch_norm': False, 'lr': 0.0001353576713902432, 'weight_decay': 2.0468335259772956e-06, 'epochs': 130, 'loss': 'mae', 'optimizer': 'adam', 'graph_mode': 'off', 'use_snp_selection': True, 'num_snps': 24656}. Best is trial 130 with value: 0.1111828814506791.
[I 2025-12-05 15:44:12,122] Trial 134 finished with value: 0.07548833854201503 and parameters: {'model_type': 'mlp', 'hidden_dims': '[512, 128]', 'dropout': 0.16164342660014752, 'batch_norm': False, 'lr': 0.00022071938950353581, 'weight_decay': 4.845277732463442e-06, 'epochs': 146, 'loss': 'mae', 'optimizer': 'adam', 'graph_mode': 'off', 'use_snp_selection': True, 'num_snps': 26442}. Best is trial 130 with value: 0.1111828814506791.
[I 2025-12-05 15:44:13,352] Trial 135 finished with value: 0.07623010889515008 and parameters: {'model_type': 'mlp', 'hidden_dims': '[512, 128]', 'dropout': 0.18899182745042298, 'batch_norm': False, 'lr': 0.0001108527635621776, 'weight_decay': 1.0603327231824515e-05, 'epochs': 155, 'loss': 'mae', 'optimizer': 'adam', 'graph_mode': 'off', 'use_snp_selection': True, 'num_snps': 18510}. Best is trial 130 with value: 0.1111828814506791.
[I 2025-12-05 15:44:14,732] Trial 136 finished with value: 0.0460975102015687 and parameters: {'model_type': 'mlp', 'hidden_dims': '[512, 128]', 'dropout': 0.5610457123659542, 'batch_norm': False, 'lr': 0.00011533120458741763, 'weight_decay': 4.1009024423179425e-06, 'epochs': 114, 'loss': 'mae', 'optimizer': 'adam', 'graph_mode': 'off', 'use_snp_selection': True, 'num_snps': 23447}. Best is trial 130 with value: 0.1111828814506791.
[I 2025-12-05 15:44:16,236] Trial 137 finished with value: 0.08429546264320477 and parameters: {'model_type': 'mlp', 'hidden_dims': '[512, 128]', 'dropout': 0.1295727235302772, 'batch_norm': False, 'lr': 0.0001433190408000668, 'weight_decay': 3.4223890243484923e-06, 'epochs': 125, 'loss': 'mae', 'optimizer': 'adam', 'graph_mode': 'off', 'use_snp_selection': True, 'num_snps': 24925}. Best is trial 130 with value: 0.1111828814506791.
[I 2025-12-05 15:44:17,549] Trial 138 finished with value: 0.06836764217770547 and parameters: {'model_type': 'mlp', 'hidden_dims': '[512, 128]', 'dropout': 0.14166865237654203, 'batch_norm': False, 'lr': 0.00018897841242912212, 'weight_decay': 6.494924202007531e-06, 'epochs': 136, 'loss': 'mae', 'optimizer': 'adam', 'graph_mode': 'off', 'use_snp_selection': True, 'num_snps': 21169}. Best is trial 130 with value: 0.1111828814506791.
[I 2025-12-05 15:44:19,251] Trial 139 finished with value: 0.07694699517912812 and parameters: {'model_type': 'mlp', 'hidden_dims': '[512, 128]', 'dropout': 0.10240463567784878, 'batch_norm': False, 'lr': 9.409923296015152e-05, 'weight_decay': 4.947953990892579e-06, 'epochs': 130, 'loss': 'mae', 'optimizer': 'adam', 'graph_mode': 'off', 'use_snp_selection': True, 'num_snps': 31803}. Best is trial 130 with value: 0.1111828814506791.
[I 2025-12-05 15:44:20,853] Trial 140 finished with value: 0.07248093193084308 and parameters: {'model_type': 'mlp', 'hidden_dims': '[512, 128]', 'dropout': 0.14823329766202348, 'batch_norm': True, 'lr': 0.00015418375448375066, 'weight_decay': 2.1670663741140005e-07, 'epochs': 150, 'loss': 'mae', 'optimizer': 'adam', 'graph_mode': 'off', 'use_snp_selection': True, 'num_snps': 27414}. Best is trial 130 with value: 0.1111828814506791.
[I 2025-12-05 15:44:22,424] Trial 141 finished with value: 0.08834443473482644 and parameters: {'model_type': 'mlp', 'hidden_dims': '[512, 128]', 'dropout': 0.11305142072509955, 'batch_norm': False, 'lr': 7.319297422154949e-05, 'weight_decay': 2.97741889809453e-06, 'epochs': 116, 'loss': 'mae', 'optimizer': 'adam', 'graph_mode': 'off', 'use_snp_selection': True, 'num_snps': 28697}. Best is trial 130 with value: 0.1111828814506791.
[I 2025-12-05 15:44:24,063] Trial 142 finished with value: 0.08633215372240384 and parameters: {'model_type': 'mlp', 'hidden_dims': '[512, 128]', 'dropout': 0.1214752423643961, 'batch_norm': False, 'lr': 0.00016381260152817105, 'weight_decay': 1.4044681415298104e-05, 'epochs': 121, 'loss': 'mae', 'optimizer': 'adam', 'graph_mode': 'off', 'use_snp_selection': True, 'num_snps': 29560}. Best is trial 130 with value: 0.1111828814506791.
[I 2025-12-05 15:44:25,601] Trial 143 finished with value: 0.07957360726904615 and parameters: {'model_type': 'mlp', 'hidden_dims': '[256, 128, 64]', 'dropout': 0.13461368242302252, 'batch_norm': False, 'lr': 0.0002977763532145282, 'weight_decay': 7.004043623700417e-06, 'epochs': 139, 'loss': 'mae', 'optimizer': 'adam', 'graph_mode': 'off', 'use_snp_selection': True, 'num_snps': 27075}. Best is trial 130 with value: 0.1111828814506791.
[I 2025-12-05 15:44:27,432] Trial 144 finished with value: 0.08037778790183553 and parameters: {'model_type': 'mlp', 'hidden_dims': '[512, 128]', 'dropout': 0.11221325601715916, 'batch_norm': False, 'lr': 0.0002050095796643854, 'weight_decay': 4.108671756444072e-06, 'epochs': 142, 'loss': 'mae', 'optimizer': 'adam', 'graph_mode': 'off', 'use_snp_selection': True, 'num_snps': 31627}. Best is trial 130 with value: 0.1111828814506791.
[I 2025-12-05 15:44:28,170] Trial 145 finished with value: 0.06521109060936295 and parameters: {'model_type': 'mlp', 'hidden_dims': '[512, 64]', 'dropout': 0.3205453111534218, 'batch_norm': False, 'lr': 5.912480994851499e-05, 'weight_decay': 1.5120845090530657e-06, 'epochs': 108, 'loss': 'mae', 'optimizer': 'adam', 'graph_mode': 'off', 'use_snp_selection': True, 'num_snps': 3344}. Best is trial 130 with value: 0.1111828814506791.
[I 2025-12-05 15:44:29,547] Trial 146 finished with value: 0.08096217798561786 and parameters: {'model_type': 'mlp', 'hidden_dims': '[128, 64]', 'dropout': 0.15420906106625004, 'batch_norm': False, 'lr': 0.00010038586708249448, 'weight_decay': 9.31761216055287e-06, 'epochs': 159, 'loss': 'mae', 'optimizer': 'adam', 'graph_mode': 'off', 'use_snp_selection': True, 'num_snps': 24354}. Best is trial 130 with value: 0.1111828814506791.
[I 2025-12-05 15:44:31,479] Trial 147 finished with value: 0.08395718399534854 and parameters: {'model_type': 'mlp', 'hidden_dims': '[512, 256]', 'dropout': 0.12608496640193154, 'batch_norm': False, 'lr': 4.283804144305629e-05, 'weight_decay': 1.1090615545231698e-05, 'epochs': 133, 'loss': 'mae', 'optimizer': 'adam', 'graph_mode': 'off', 'use_snp_selection': True, 'num_snps': 36511}. Best is trial 130 with value: 0.1111828814506791.
[I 2025-12-05 15:44:33,453] Trial 148 finished with value: 0.08852865945337382 and parameters: {'model_type': 'mlp', 'hidden_dims': '[512, 128]', 'dropout': 0.1746268106451927, 'batch_norm': False, 'lr': 8.22712306899382e-05, 'weight_decay': 0.0005652816103996585, 'epochs': 121, 'loss': 'mae', 'optimizer': 'adam', 'graph_mode': 'off', 'use_snp_selection': True, 'num_snps': 38923}. Best is trial 130 with value: 0.1111828814506791.
[I 2025-12-05 15:44:34,590] Trial 149 finished with value: 0.05064950714467893 and parameters: {'model_type': 'mlp', 'hidden_dims': '[256, 128]', 'dropout': 0.1641295857287905, 'batch_norm': False, 'lr': 2.298355449315918e-06, 'weight_decay': 0.00013066358494038705, 'epochs': 104, 'loss': 'mae', 'optimizer': 'adam', 'graph_mode': 'off', 'use_snp_selection': True, 'num_snps': 16109}. Best is trial 130 with value: 0.1111828814506791.
[I 2025-12-05 15:44:36,840] Trial 0 finished with value: 0.03698179929092352 and parameters: {'model_type': 'mlp', 'hidden_dims': '[128, 64]', 'dropout': 0.199031432379812, 'batch_norm': True, 'lr': 1.8408544111075837e-06, 'weight_decay': 5.5136510071208614e-05, 'epochs': 336, 'loss': 'mae', 'optimizer': 'adam', 'graph_mode': 'off', 'use_snp_selection': True, 'num_snps': 43862}. Best is trial 0 with value: 0.03698179929092352.
[I 2025-12-05 15:44:37,990] Trial 1 finished with value: 0.05750856780549039 and parameters: {'model_type': 'mlp', 'hidden_dims': '[256, 128]', 'dropout': 0.4370668075331726, 'batch_norm': True, 'lr': 7.133471581159139e-05, 'weight_decay': 1.128633586803549e-05, 'epochs': 242, 'loss': 'mae', 'optimizer': 'adam', 'graph_mode': 'off', 'use_snp_selection': False}. Best is trial 1 with value: 0.05750856780549039.
[I 2025-12-05 15:44:39,042] Trial 2 finished with value: -0.028530066995646388 and parameters: {'model_type': 'mlp', 'hidden_dims': '[256, 128, 64]', 'dropout': 0.41314357415569625, 'batch_norm': False, 'lr': 3.952233718592101e-06, 'weight_decay': 0.00026754769258252603, 'epochs': 149, 'loss': 'mse', 'optimizer': 'adam', 'graph_mode': 'off', 'use_snp_selection': True, 'num_snps': 11571}. Best is trial 1 with value: 0.05750856780549039.
[I 2025-12-05 15:44:41,046] Trial 3 finished with value: -0.003488205476261253 and parameters: {'model_type': 'mlp', 'hidden_dims': '[512, 64]', 'dropout': 0.5938127374509361, 'batch_norm': False, 'lr': 5.67704586114731e-06, 'weight_decay': 2.4518087630137052e-05, 'epochs': 320, 'loss': 'mae', 'optimizer': 'adam', 'graph_mode': 'off', 'use_snp_selection': False}. Best is trial 1 with value: 0.05750856780549039.
[I 2025-12-05 15:44:43,335] Trial 4 finished with value: -0.042890390808375235 and parameters: {'model_type': 'mlp', 'hidden_dims': '[512, 128]', 'dropout': 0.25746343592134413, 'batch_norm': True, 'lr': 1.3467657668402788e-06, 'weight_decay': 0.00033087251918647806, 'epochs': 277, 'loss': 'mse', 'optimizer': 'adam', 'graph_mode': 'off', 'use_snp_selection': True, 'num_snps': 36675}. Best is trial 1 with value: 0.05750856780549039.
[I 2025-12-05 15:44:45,105] Trial 5 finished with value: 0.004800759716555639 and parameters: {'model_type': 'mlp', 'hidden_dims': '[512, 64]', 'dropout': 0.38275350994408375, 'batch_norm': True, 'lr': 1.5586664309232824e-06, 'weight_decay': 0.0008227664668621182, 'epochs': 145, 'loss': 'mae', 'optimizer': 'adam', 'graph_mode': 'off', 'use_snp_selection': True, 'num_snps': 32148}. Best is trial 1 with value: 0.05750856780549039.
[I 2025-12-05 15:44:46,142] Trial 6 finished with value: 0.03931065873032278 and parameters: {'model_type': 'mlp', 'hidden_dims': '[256, 128]', 'dropout': 0.3930109900265879, 'batch_norm': False, 'lr': 4.892964372128395e-05, 'weight_decay': 1.5809549317992182e-06, 'epochs': 199, 'loss': 'mse', 'optimizer': 'adam', 'graph_mode': 'off', 'use_snp_selection': False}. Best is trial 1 with value: 0.05750856780549039.
[I 2025-12-05 15:44:47,292] Trial 7 finished with value: 0.03216925069584195 and parameters: {'model_type': 'mlp', 'hidden_dims': '[512, 256]', 'dropout': 0.15343979219678458, 'batch_norm': True, 'lr': 6.234003099047341e-05, 'weight_decay': 3.894760610535477e-07, 'epochs': 97, 'loss': 'mse', 'optimizer': 'adam', 'graph_mode': 'off', 'use_snp_selection': False}. Best is trial 1 with value: 0.05750856780549039.
[I 2025-12-05 15:44:49,289] Trial 8 finished with value: 0.06187959672804528 and parameters: {'model_type': 'mlp', 'hidden_dims': '[512, 128]', 'dropout': 0.10743001231661406, 'batch_norm': True, 'lr': 0.00023728538449271062, 'weight_decay': 1.7629071578048637e-05, 'epochs': 312, 'loss': 'mae', 'optimizer': 'adam', 'graph_mode': 'off', 'use_snp_selection': False}. Best is trial 8 with value: 0.06187959672804528.
[I 2025-12-05 15:44:50,721] Trial 9 finished with value: 0.06850663563695682 and parameters: {'model_type': 'mlp', 'hidden_dims': '[512, 64]', 'dropout': 0.14505336736221927, 'batch_norm': True, 'lr': 5.8619638388111826e-05, 'weight_decay': 6.200156172669308e-07, 'epochs': 175, 'loss': 'mse', 'optimizer': 'adam', 'graph_mode': 'off', 'use_snp_selection': False}. Best is trial 9 with value: 0.06850663563695682.
[I 2025-12-05 15:44:51,639] Trial 10 finished with value: 0.026927954860705535 and parameters: {'model_type': 'mlp', 'hidden_dims': '[512, 64]', 'dropout': 0.27531666245262887, 'batch_norm': False, 'lr': 0.00032393778075602147, 'weight_decay': 1.1714031539166647e-07, 'epochs': 44, 'loss': 'mse', 'optimizer': 'adam', 'graph_mode': 'off', 'use_snp_selection': False}. Best is trial 9 with value: 0.06850663563695682.
[I 2025-12-05 15:44:53,265] Trial 11 finished with value: 0.05581589063064637 and parameters: {'model_type': 'mlp', 'hidden_dims': '[512, 128]', 'dropout': 0.10095648685224448, 'batch_norm': True, 'lr': 0.0007381466848241802, 'weight_decay': 1.969664044175748e-06, 'epochs': 216, 'loss': 'mae', 'optimizer': 'adam', 'graph_mode': 'off', 'use_snp_selection': False}. Best is trial 9 with value: 0.06850663563695682.
[I 2025-12-05 15:44:55,104] Trial 12 finished with value: 0.05566374845285032 and parameters: {'model_type': 'mlp', 'hidden_dims': '[512, 128]', 'dropout': 0.10344600881777158, 'batch_norm': True, 'lr': 0.00018400807026440393, 'weight_decay': 2.652725854953085e-06, 'epochs': 281, 'loss': 'mae', 'optimizer': 'adam', 'graph_mode': 'off', 'use_snp_selection': False}. Best is trial 9 with value: 0.06850663563695682.
[I 2025-12-05 15:44:55,937] Trial 13 finished with value: -0.006068699727103609 and parameters: {'model_type': 'mlp', 'hidden_dims': '[128, 64]', 'dropout': 0.21562224788131257, 'batch_norm': True, 'lr': 1.343038855084232e-05, 'weight_decay': 5.9577988329204815e-05, 'epochs': 156, 'loss': 'mse', 'optimizer': 'adam', 'graph_mode': 'off', 'use_snp_selection': False}. Best is trial 9 with value: 0.06850663563695682.
[I 2025-12-05 15:44:57,148] Trial 14 finished with value: 0.06346972101695708 and parameters: {'model_type': 'mlp', 'hidden_dims': '[256, 128, 64]', 'dropout': 0.3012984444538551, 'batch_norm': True, 'lr': 0.00017558188744418174, 'weight_decay': 4.841366235436571e-06, 'epochs': 262, 'loss': 'mse', 'optimizer': 'adam', 'graph_mode': 'off', 'use_snp_selection': False}. Best is trial 9 with value: 0.06850663563695682.
[I 2025-12-05 15:44:58,290] Trial 15 finished with value: 0.03170642348535894 and parameters: {'model_type': 'mlp', 'hidden_dims': '[256, 128, 64]', 'dropout': 0.31359178219967865, 'batch_norm': True, 'lr': 1.89989485263331e-05, 'weight_decay': 4.5695438936681996e-07, 'epochs': 231, 'loss': 'mse', 'optimizer': 'adam', 'graph_mode': 'off', 'use_snp_selection': False}. Best is trial 9 with value: 0.06850663563695682.
[I 2025-12-05 15:44:59,517] Trial 16 finished with value: 0.04413714510681218 and parameters: {'model_type': 'mlp', 'hidden_dims': '[256, 128, 64]', 'dropout': 0.4818096937014661, 'batch_norm': True, 'lr': 0.00012396403352551432, 'weight_decay': 5.098763140321504e-06, 'epochs': 268, 'loss': 'mse', 'optimizer': 'adam', 'graph_mode': 'off', 'use_snp_selection': False}. Best is trial 9 with value: 0.06850663563695682.
[I 2025-12-05 15:45:00,977] Trial 17 finished with value: 0.03647096306712567 and parameters: {'model_type': 'mlp', 'hidden_dims': '[512, 256]', 'dropout': 0.32888830259108426, 'batch_norm': True, 'lr': 0.000906375209920231, 'weight_decay': 6.089712260625037e-07, 'epochs': 175, 'loss': 'mse', 'optimizer': 'adam', 'graph_mode': 'off', 'use_snp_selection': False}. Best is trial 9 with value: 0.06850663563695682.
[I 2025-12-05 15:45:03,343] Trial 18 finished with value: 0.023514455538876947 and parameters: {'model_type': 'mlp', 'hidden_dims': '[256, 128, 64]', 'dropout': 0.5139576333133464, 'batch_norm': False, 'lr': 2.797772152750264e-05, 'weight_decay': 2.427593612355222e-07, 'epochs': 69, 'loss': 'mse', 'optimizer': 'adam', 'graph_mode': 'off', 'use_snp_selection': True, 'num_snps': 58241}. Best is trial 9 with value: 0.06850663563695682.
[I 2025-12-05 15:45:04,624] Trial 19 finished with value: 0.06290235420045386 and parameters: {'model_type': 'mlp', 'hidden_dims': '[512, 64]', 'dropout': 0.18625362219272576, 'batch_norm': True, 'lr': 0.00048753983738097695, 'weight_decay': 9.380564728509147e-07, 'epochs': 119, 'loss': 'mse', 'optimizer': 'adam', 'graph_mode': 'off', 'use_snp_selection': False}. Best is trial 9 with value: 0.06850663563695682.
[I 2025-12-05 15:45:06,100] Trial 20 finished with value: 0.0545444313057834 and parameters: {'model_type': 'mlp', 'hidden_dims': '[512, 64]', 'dropout': 0.26300688004381517, 'batch_norm': True, 'lr': 0.00010303661336735763, 'weight_decay': 5.069812038405685e-06, 'epochs': 187, 'loss': 'mse', 'optimizer': 'adam', 'graph_mode': 'off', 'use_snp_selection': False}. Best is trial 9 with value: 0.06850663563695682.
[I 2025-12-05 15:45:07,400] Trial 21 finished with value: 0.06056332599776631 and parameters: {'model_type': 'mlp', 'hidden_dims': '[512, 64]', 'dropout': 0.17763649958162053, 'batch_norm': True, 'lr': 0.00041376255734449193, 'weight_decay': 8.858528207535195e-07, 'epochs': 138, 'loss': 'mse', 'optimizer': 'adam', 'graph_mode': 'off', 'use_snp_selection': False}. Best is trial 9 with value: 0.06850663563695682.
[I 2025-12-05 15:45:08,584] Trial 22 finished with value: 0.05046713364248907 and parameters: {'model_type': 'mlp', 'hidden_dims': '[512, 64]', 'dropout': 0.16028208508320546, 'batch_norm': True, 'lr': 0.0004845283963114626, 'weight_decay': 1.2010995539599145e-07, 'epochs': 110, 'loss': 'mse', 'optimizer': 'adam', 'graph_mode': 'off', 'use_snp_selection': False}. Best is trial 9 with value: 0.06850663563695682.
[I 2025-12-05 15:45:09,818] Trial 23 finished with value: 0.03524042850795813 and parameters: {'model_type': 'mlp', 'hidden_dims': '[512, 64]', 'dropout': 0.23042728124048079, 'batch_norm': True, 'lr': 0.0001977461683466294, 'weight_decay': 1.1727167378240018e-06, 'epochs': 117, 'loss': 'mse', 'optimizer': 'adam', 'graph_mode': 'off', 'use_snp_selection': False}. Best is trial 9 with value: 0.06850663563695682.
[I 2025-12-05 15:45:10,631] Trial 24 finished with value: 0.048384624844828604 and parameters: {'model_type': 'mlp', 'hidden_dims': '[256, 128, 64]', 'dropout': 0.30239350311564905, 'batch_norm': True, 'lr': 0.00012933696064794652, 'weight_decay': 4.91855104141511e-06, 'epochs': 74, 'loss': 'mse', 'optimizer': 'adam', 'graph_mode': 'off', 'use_snp_selection': False}. Best is trial 9 with value: 0.06850663563695682.
[I 2025-12-05 15:45:12,357] Trial 25 finished with value: 0.0824597717905614 and parameters: {'model_type': 'mlp', 'hidden_dims': '[512, 64]', 'dropout': 0.14997957960969308, 'batch_norm': True, 'lr': 3.775256329745003e-05, 'weight_decay': 2.541606909583134e-07, 'epochs': 245, 'loss': 'mse', 'optimizer': 'adam', 'graph_mode': 'off', 'use_snp_selection': False}. Best is trial 25 with value: 0.0824597717905614.
[I 2025-12-05 15:45:13,359] Trial 26 finished with value: 0.02481859098532533 and parameters: {'model_type': 'mlp', 'hidden_dims': '[256, 128]', 'dropout': 0.1362575988114282, 'batch_norm': True, 'lr': 3.556212441365743e-05, 'weight_decay': 1.8829468433995606e-07, 'epochs': 254, 'loss': 'mse', 'optimizer': 'adam', 'graph_mode': 'off', 'use_snp_selection': True, 'num_snps': 3842}. Best is trial 25 with value: 0.0824597717905614.
[I 2025-12-05 15:45:14,287] Trial 27 finished with value: 0.040047408449785826 and parameters: {'model_type': 'mlp', 'hidden_dims': '[128, 64]', 'dropout': 0.22757879415785207, 'batch_norm': False, 'lr': 1.0260921745532436e-05, 'weight_decay': 3.341200831972639e-07, 'epochs': 298, 'loss': 'mse', 'optimizer': 'adam', 'graph_mode': 'off', 'use_snp_selection': False}. Best is trial 25 with value: 0.0824597717905614.
[I 2025-12-05 15:45:15,925] Trial 28 finished with value: 0.05860527969253799 and parameters: {'model_type': 'mlp', 'hidden_dims': '[512, 256]', 'dropout': 0.14286847749851114, 'batch_norm': True, 'lr': 3.2770015919897887e-05, 'weight_decay': 2.9641959243217467e-06, 'epochs': 215, 'loss': 'mse', 'optimizer': 'adam', 'graph_mode': 'off', 'use_snp_selection': False}. Best is trial 25 with value: 0.0824597717905614.
[I 2025-12-05 15:45:17,325] Trial 29 finished with value: 0.060995254961215446 and parameters: {'model_type': 'mlp', 'hidden_dims': '[128, 64]', 'dropout': 0.3467572556454796, 'batch_norm': True, 'lr': 8.09060887149309e-05, 'weight_decay': 5.5227103357724904e-05, 'epochs': 173, 'loss': 'mse', 'optimizer': 'adam', 'graph_mode': 'off', 'use_snp_selection': True, 'num_snps': 19468}. Best is trial 25 with value: 0.0824597717905614.
