[I 2025-12-05 15:20:14,500] Trial 104 finished with value: 0.09146163932411315 and parameters: {'model_type': 'mlp', 'hidden_dims': '[256, 128]', 'dropout': 0.18873299662229132, 'batch_norm': False, 'lr': 3.134655398068284e-05, 'weight_decay': 5.8395387534631934e-05, 'epochs': 170, 'loss': 'mae', 'optimizer': 'adam', 'graph_mode': 'off', 'use_snp_selection': False}. Best is trial 94 with value: 0.10439684260630243.
[I 2025-12-05 15:20:15,782] Trial 105 finished with value: 0.09657071604705426 and parameters: {'model_type': 'mlp', 'hidden_dims': '[256, 128]', 'dropout': 0.14036711407827274, 'batch_norm': False, 'lr': 0.000688583246535496, 'weight_decay': 7.453215996569862e-05, 'epochs': 181, 'loss': 'mae', 'optimizer': 'adam', 'graph_mode': 'off', 'use_snp_selection': False}. Best is trial 94 with value: 0.10439684260630243.
[I 2025-12-05 15:20:16,987] Trial 106 finished with value: 0.0885487565345067 and parameters: {'model_type': 'mlp', 'hidden_dims': '[256, 128]', 'dropout': 0.14369503087105623, 'batch_norm': False, 'lr': 0.0006859791108030429, 'weight_decay': 7.827689850723638e-05, 'epochs': 153, 'loss': 'mae', 'optimizer': 'adam', 'graph_mode': 'off', 'use_snp_selection': False}. Best is trial 94 with value: 0.10439684260630243.
[I 2025-12-05 15:20:18,692] Trial 107 finished with value: 0.10691712285381737 and parameters: {'model_type': 'mlp', 'hidden_dims': '[256, 128]', 'dropout': 0.13155672905037352, 'batch_norm': False, 'lr': 0.0004897224519998154, 'weight_decay': 2.478472540722788e-05, 'epochs': 293, 'loss': 'mae', 'optimizer': 'adam', 'graph_mode': 'off', 'use_snp_selection': False}. Best is trial 107 with value: 0.10691712285381737.
[I 2025-12-05 15:20:19,984] Trial 108 finished with value: 0.024064519380530544 and parameters: {'model_type': 'mlp', 'hidden_dims': '[256, 128]', 'dropout': 0.21247145951993038, 'batch_norm': True, 'lr': 3.823880698012576e-06, 'weight_decay': 2.2402162012846095e-05, 'epochs': 180, 'loss': 'mae', 'optimizer': 'adam', 'graph_mode': 'off', 'use_snp_selection': False}. Best is trial 107 with value: 0.10691712285381737.
[I 2025-12-05 15:20:21,219] Trial 109 finished with value: 0.09724923130616515 and parameters: {'model_type': 'mlp', 'hidden_dims': '[256, 128]', 'dropout': 0.1330414771750511, 'batch_norm': False, 'lr': 0.0004962565417228342, 'weight_decay': 9.605967720323592e-06, 'epochs': 175, 'loss': 'mae', 'optimizer': 'adam', 'graph_mode': 'off', 'use_snp_selection': False}. Best is trial 107 with value: 0.10691712285381737.
[I 2025-12-05 15:20:22,563] Trial 110 finished with value: 0.09029749519453181 and parameters: {'model_type': 'mlp', 'hidden_dims': '[256, 128]', 'dropout': 0.17956981708963976, 'batch_norm': False, 'lr': 0.0004898477003071545, 'weight_decay': 8.84560027556231e-06, 'epochs': 205, 'loss': 'mae', 'optimizer': 'adam', 'graph_mode': 'off', 'use_snp_selection': False}. Best is trial 107 with value: 0.10691712285381737.
[I 2025-12-05 15:20:23,838] Trial 111 finished with value: 0.07500667113245396 and parameters: {'model_type': 'mlp', 'hidden_dims': '[256, 128]', 'dropout': 0.1349004656017636, 'batch_norm': False, 'lr': 0.0008580781544347665, 'weight_decay': 4.973812635693554e-06, 'epochs': 176, 'loss': 'mae', 'optimizer': 'adam', 'graph_mode': 'off', 'use_snp_selection': False}. Best is trial 107 with value: 0.10691712285381737.
[I 2025-12-05 15:20:25,157] Trial 112 finished with value: 0.10077806511438883 and parameters: {'model_type': 'mlp', 'hidden_dims': '[256, 128]', 'dropout': 0.15196404806455163, 'batch_norm': False, 'lr': 0.0007121045491911883, 'weight_decay': 1.3546978213901961e-05, 'epochs': 184, 'loss': 'mae', 'optimizer': 'adam', 'graph_mode': 'off', 'use_snp_selection': False}. Best is trial 107 with value: 0.10691712285381737.
[I 2025-12-05 15:20:26,507] Trial 113 finished with value: 0.08044558280233748 and parameters: {'model_type': 'mlp', 'hidden_dims': '[256, 128]', 'dropout': 0.15577668665552086, 'batch_norm': False, 'lr': 0.0005025141687833391, 'weight_decay': 1.3692308896621923e-05, 'epochs': 196, 'loss': 'mae', 'optimizer': 'adam', 'graph_mode': 'off', 'use_snp_selection': False}. Best is trial 107 with value: 0.10691712285381737.
[I 2025-12-05 15:20:27,717] Trial 114 finished with value: 0.06626356422216567 and parameters: {'model_type': 'mlp', 'hidden_dims': '[256, 128]', 'dropout': 0.1673629779548243, 'batch_norm': False, 'lr': 0.0007118366168478189, 'weight_decay': 1.0162125598633645e-05, 'epochs': 161, 'loss': 'mae', 'optimizer': 'adam', 'graph_mode': 'off', 'use_snp_selection': False}. Best is trial 107 with value: 0.10691712285381737.
[I 2025-12-05 15:20:28,939] Trial 115 finished with value: 0.08137674089580652 and parameters: {'model_type': 'mlp', 'hidden_dims': '[256, 128]', 'dropout': 0.1456677104416268, 'batch_norm': False, 'lr': 0.0009780545942837916, 'weight_decay': 2.4575316822277724e-05, 'epochs': 172, 'loss': 'mae', 'optimizer': 'adam', 'graph_mode': 'off', 'use_snp_selection': False}. Best is trial 107 with value: 0.10691712285381737.
[I 2025-12-05 15:20:30,201] Trial 116 finished with value: 0.06808002358301106 and parameters: {'model_type': 'mlp', 'hidden_dims': '[256, 128]', 'dropout': 0.13277783069494214, 'batch_norm': False, 'lr': 6.8715007157637115e-06, 'weight_decay': 6.436112126493558e-06, 'epochs': 181, 'loss': 'mae', 'optimizer': 'adam', 'graph_mode': 'off', 'use_snp_selection': False}. Best is trial 107 with value: 0.10691712285381737.
[I 2025-12-05 15:20:31,020] Trial 117 finished with value: 0.06509740114033738 and parameters: {'model_type': 'mlp', 'hidden_dims': '[128, 64]', 'dropout': 0.12768097552000895, 'batch_norm': False, 'lr': 0.00046530443645980064, 'weight_decay': 1.3410162697450834e-05, 'epochs': 155, 'loss': 'mse', 'optimizer': 'adam', 'graph_mode': 'off', 'use_snp_selection': False}. Best is trial 107 with value: 0.10691712285381737.
[I 2025-12-05 15:20:32,328] Trial 118 finished with value: 0.08433882965485284 and parameters: {'model_type': 'mlp', 'hidden_dims': '[256, 128]', 'dropout': 0.19498344809064386, 'batch_norm': False, 'lr': 0.0006618069927474993, 'weight_decay': 1.634460565287457e-05, 'epochs': 184, 'loss': 'mae', 'optimizer': 'adam', 'graph_mode': 'off', 'use_snp_selection': False}. Best is trial 107 with value: 0.10691712285381737.
[I 2025-12-05 15:20:34,070] Trial 119 finished with value: 0.09050831097229996 and parameters: {'model_type': 'mlp', 'hidden_dims': '[256, 128]', 'dropout': 0.1743864981688339, 'batch_norm': False, 'lr': 1.7327305609121897e-05, 'weight_decay': 4.3094949687438325e-06, 'epochs': 301, 'loss': 'mae', 'optimizer': 'adam', 'graph_mode': 'off', 'use_snp_selection': False}. Best is trial 107 with value: 0.10691712285381737.
[I 2025-12-05 15:20:35,181] Trial 120 finished with value: 0.10027693451701596 and parameters: {'model_type': 'mlp', 'hidden_dims': '[256, 128]', 'dropout': 0.15310785751386805, 'batch_norm': False, 'lr': 0.0008452129625741379, 'weight_decay': 2.803298489448702e-06, 'epochs': 136, 'loss': 'mae', 'optimizer': 'adam', 'graph_mode': 'off', 'use_snp_selection': False}. Best is trial 107 with value: 0.10691712285381737.
[I 2025-12-05 15:20:36,279] Trial 121 finished with value: 0.10420273771048873 and parameters: {'model_type': 'mlp', 'hidden_dims': '[256, 128]', 'dropout': 0.15463853771154012, 'batch_norm': False, 'lr': 0.0008276902775628483, 'weight_decay': 1.3166326583342272e-06, 'epochs': 141, 'loss': 'mae', 'optimizer': 'adam', 'graph_mode': 'off', 'use_snp_selection': False}. Best is trial 107 with value: 0.10691712285381737.
[I 2025-12-05 15:20:37,309] Trial 122 finished with value: 0.07594956222270717 and parameters: {'model_type': 'mlp', 'hidden_dims': '[256, 128]', 'dropout': 0.1531504318947856, 'batch_norm': False, 'lr': 0.0008777926935951282, 'weight_decay': 1.793984934265714e-06, 'epochs': 123, 'loss': 'mae', 'optimizer': 'adam', 'graph_mode': 'off', 'use_snp_selection': False}. Best is trial 107 with value: 0.10691712285381737.
[I 2025-12-05 15:20:38,388] Trial 123 finished with value: 0.08531780783258584 and parameters: {'model_type': 'mlp', 'hidden_dims': '[256, 128]', 'dropout': 0.16318045411127294, 'batch_norm': False, 'lr': 0.0007633196670921675, 'weight_decay': 2.979190515922877e-06, 'epochs': 135, 'loss': 'mae', 'optimizer': 'adam', 'graph_mode': 'off', 'use_snp_selection': False}. Best is trial 107 with value: 0.10691712285381737.
[I 2025-12-05 15:20:39,356] Trial 124 finished with value: 0.0946345259154764 and parameters: {'model_type': 'mlp', 'hidden_dims': '[256, 128]', 'dropout': 0.14123952728194883, 'batch_norm': False, 'lr': 0.0005534093255937802, 'weight_decay': 8.386941456838832e-07, 'epochs': 102, 'loss': 'mae', 'optimizer': 'adam', 'graph_mode': 'off', 'use_snp_selection': False}. Best is trial 107 with value: 0.10691712285381737.
[I 2025-12-05 15:20:40,477] Trial 125 finished with value: 0.06983573038790546 and parameters: {'model_type': 'mlp', 'hidden_dims': '[256, 128]', 'dropout': 0.15098066544813327, 'batch_norm': False, 'lr': 0.0008214057203963293, 'weight_decay': 2.806030252684375e-06, 'epochs': 134, 'loss': 'mae', 'optimizer': 'adam', 'graph_mode': 'off', 'use_snp_selection': False}. Best is trial 107 with value: 0.10691712285381737.
[I 2025-12-05 15:20:41,498] Trial 126 finished with value: 0.07822851641569589 and parameters: {'model_type': 'mlp', 'hidden_dims': '[256, 128]', 'dropout': 0.18032846975917832, 'batch_norm': False, 'lr': 0.0006298678708313825, 'weight_decay': 4.766000946913977e-07, 'epochs': 109, 'loss': 'mae', 'optimizer': 'adam', 'graph_mode': 'off', 'use_snp_selection': False}. Best is trial 107 with value: 0.10691712285381737.
[I 2025-12-05 15:20:42,722] Trial 127 finished with value: 0.08669893808910621 and parameters: {'model_type': 'mlp', 'hidden_dims': '[256, 128]', 'dropout': 0.16822459465196607, 'batch_norm': False, 'lr': 0.0004884099049172749, 'weight_decay': 1.4541805537561652e-06, 'epochs': 167, 'loss': 'mae', 'optimizer': 'adam', 'graph_mode': 'off', 'use_snp_selection': False}. Best is trial 107 with value: 0.10691712285381737.
[I 2025-12-05 15:20:43,867] Trial 128 finished with value: 0.06107833199787278 and parameters: {'model_type': 'mlp', 'hidden_dims': '[256, 128]', 'dropout': 0.2142994644678477, 'batch_norm': True, 'lr': 0.00038673641382166464, 'weight_decay': 1.994151541075007e-05, 'epochs': 141, 'loss': 'mae', 'optimizer': 'adam', 'graph_mode': 'off', 'use_snp_selection': False}. Best is trial 107 with value: 0.10691712285381737.
[I 2025-12-05 15:20:45,027] Trial 129 finished with value: 0.08115137360330564 and parameters: {'model_type': 'mlp', 'hidden_dims': '[256, 128, 64]', 'dropout': 0.12858721176227472, 'batch_norm': False, 'lr': 0.0009955969734101807, 'weight_decay': 2.969071664795079e-05, 'epochs': 155, 'loss': 'mae', 'optimizer': 'adam', 'graph_mode': 'off', 'use_snp_selection': False}. Best is trial 107 with value: 0.10691712285381737.
[I 2025-12-05 15:20:46,249] Trial 130 finished with value: 0.09264226221859512 and parameters: {'model_type': 'mlp', 'hidden_dims': '[256, 128]', 'dropout': 0.10746571407714098, 'batch_norm': False, 'lr': 0.0005529763139378608, 'weight_decay': 1.2858349042911432e-06, 'epochs': 175, 'loss': 'mae', 'optimizer': 'adam', 'graph_mode': 'off', 'use_snp_selection': False}. Best is trial 107 with value: 0.10691712285381737.
[I 2025-12-05 15:20:47,138] Trial 131 finished with value: 0.0785780742465753 and parameters: {'model_type': 'mlp', 'hidden_dims': '[128, 64]', 'dropout': 0.13629357178554874, 'batch_norm': False, 'lr': 0.000701021535690232, 'weight_decay': 2.105945199665333e-06, 'epochs': 195, 'loss': 'mae', 'optimizer': 'adam', 'graph_mode': 'off', 'use_snp_selection': False}. Best is trial 107 with value: 0.10691712285381737.
[I 2025-12-05 15:20:48,796] Trial 132 finished with value: 0.06334382042596257 and parameters: {'model_type': 'mlp', 'hidden_dims': '[512, 128]', 'dropout': 0.11087638081982511, 'batch_norm': False, 'lr': 0.0008291611706002871, 'weight_decay': 4.259532296074299e-05, 'epochs': 127, 'loss': 'mae', 'optimizer': 'adam', 'graph_mode': 'off', 'use_snp_selection': False}. Best is trial 107 with value: 0.10691712285381737.
[I 2025-12-05 15:20:51,960] Trial 133 finished with value: 0.08781611852142453 and parameters: {'model_type': 'mlp', 'hidden_dims': '[512, 256]', 'dropout': 0.1249069530643841, 'batch_norm': False, 'lr': 0.0006153249562652295, 'weight_decay': 2.5996712148451073e-05, 'epochs': 318, 'loss': 'mae', 'optimizer': 'adam', 'graph_mode': 'off', 'use_snp_selection': False}. Best is trial 107 with value: 0.10691712285381737.
[I 2025-12-05 15:20:53,148] Trial 134 finished with value: 0.07856150620233252 and parameters: {'model_type': 'mlp', 'hidden_dims': '[256, 128]', 'dropout': 0.1438851359450481, 'batch_norm': False, 'lr': 0.0007323919890762954, 'weight_decay': 2.366800024966332e-06, 'epochs': 151, 'loss': 'mae', 'optimizer': 'adam', 'graph_mode': 'off', 'use_snp_selection': False}. Best is trial 107 with value: 0.10691712285381737.
[I 2025-12-05 15:20:54,370] Trial 135 finished with value: 0.0900806855459557 and parameters: {'model_type': 'mlp', 'hidden_dims': '[256, 128]', 'dropout': 0.15758756514812614, 'batch_norm': False, 'lr': 0.0004588112981953505, 'weight_decay': 5.0699301557643186e-05, 'epochs': 164, 'loss': 'mae', 'optimizer': 'adam', 'graph_mode': 'off', 'use_snp_selection': False}. Best is trial 107 with value: 0.10691712285381737.
[I 2025-12-05 15:20:55,737] Trial 136 finished with value: 0.07929229354120718 and parameters: {'model_type': 'mlp', 'hidden_dims': '[256, 128]', 'dropout': 0.11076430153926246, 'batch_norm': False, 'lr': 0.0006579328548379826, 'weight_decay': 3.7248989830167436e-05, 'epochs': 206, 'loss': 'mae', 'optimizer': 'adam', 'graph_mode': 'off', 'use_snp_selection': False}. Best is trial 107 with value: 0.10691712285381737.
[I 2025-12-05 15:20:56,992] Trial 137 finished with value: 0.08345874370249545 and parameters: {'model_type': 'mlp', 'hidden_dims': '[256, 128]', 'dropout': 0.123184835440453, 'batch_norm': False, 'lr': 5.890413980831246e-05, 'weight_decay': 6.975046266435535e-07, 'epochs': 182, 'loss': 'mse', 'optimizer': 'adam', 'graph_mode': 'off', 'use_snp_selection': False}. Best is trial 107 with value: 0.10691712285381737.
[I 2025-12-05 15:20:57,788] Trial 138 finished with value: -0.03500293265521645 and parameters: {'model_type': 'mlp', 'hidden_dims': '[128, 64]', 'dropout': 0.5681233070174113, 'batch_norm': False, 'lr': 0.0008575463195555665, 'weight_decay': 1.1569410579686237e-06, 'epochs': 146, 'loss': 'mae', 'optimizer': 'adam', 'graph_mode': 'off', 'use_snp_selection': False}. Best is trial 107 with value: 0.10691712285381737.
[I 2025-12-05 15:20:59,798] Trial 139 finished with value: 0.08047031180931152 and parameters: {'model_type': 'mlp', 'hidden_dims': '[512, 128]', 'dropout': 0.13775856042283702, 'batch_norm': False, 'lr': 0.0005524347536439725, 'weight_decay': 3.984343039602038e-06, 'epochs': 174, 'loss': 'mae', 'optimizer': 'adam', 'graph_mode': 'off', 'use_snp_selection': False}. Best is trial 107 with value: 0.10691712285381737.
[I 2025-12-05 15:21:01,119] Trial 140 finished with value: 0.08413464855620993 and parameters: {'model_type': 'mlp', 'hidden_dims': '[256, 128]', 'dropout': 0.14587485022135332, 'batch_norm': False, 'lr': 4.490539234619595e-05, 'weight_decay': 9.282324567319236e-07, 'epochs': 199, 'loss': 'mae', 'optimizer': 'adam', 'graph_mode': 'off', 'use_snp_selection': False}. Best is trial 107 with value: 0.10691712285381737.
[I 2025-12-05 15:21:02,476] Trial 141 finished with value: 0.03755915818651322 and parameters: {'model_type': 'mlp', 'hidden_dims': '[256, 128]', 'dropout': 0.10086335150344235, 'batch_norm': False, 'lr': 0.0007389445592920542, 'weight_decay': 3.836602945426175e-05, 'epochs': 297, 'loss': 'mae', 'optimizer': 'adam', 'graph_mode': 'off', 'use_snp_selection': True, 'num_snps': 6870}. Best is trial 107 with value: 0.10691712285381737.
[I 2025-12-05 15:21:04,667] Trial 142 finished with value: 0.10161855254017878 and parameters: {'model_type': 'mlp', 'hidden_dims': '[256, 128]', 'dropout': 0.11981592768989462, 'batch_norm': False, 'lr': 0.0007558370393587277, 'weight_decay': 3.272595660529374e-05, 'epochs': 302, 'loss': 'mae', 'optimizer': 'adam', 'graph_mode': 'off', 'use_snp_selection': True, 'num_snps': 26938}. Best is trial 107 with value: 0.10691712285381737.
[I 2025-12-05 15:21:06,355] Trial 143 finished with value: 0.07754174960335804 and parameters: {'model_type': 'mlp', 'hidden_dims': '[256, 128]', 'dropout': 0.12970601690444647, 'batch_norm': False, 'lr': 0.0009856955154099035, 'weight_decay': 3.171941348342382e-05, 'epochs': 306, 'loss': 'mae', 'optimizer': 'adam', 'graph_mode': 'off', 'use_snp_selection': True, 'num_snps': 15217}. Best is trial 107 with value: 0.10691712285381737.
[I 2025-12-05 15:21:07,786] Trial 144 finished with value: 0.07335401241252347 and parameters: {'model_type': 'mlp', 'hidden_dims': '[256, 128]', 'dropout': 0.15518611903968568, 'batch_norm': False, 'lr': 0.0005993473443772728, 'weight_decay': 2.330850920966812e-05, 'epochs': 278, 'loss': 'mae', 'optimizer': 'adam', 'graph_mode': 'off', 'use_snp_selection': True, 'num_snps': 8951}. Best is trial 107 with value: 0.10691712285381737.
[I 2025-12-05 15:21:09,757] Trial 145 finished with value: 0.0968476014582062 and parameters: {'model_type': 'mlp', 'hidden_dims': '[256, 128]', 'dropout': 0.11989565545046754, 'batch_norm': False, 'lr': 0.00042587825153837637, 'weight_decay': 1.732950056033013e-05, 'epochs': 324, 'loss': 'mae', 'optimizer': 'adam', 'graph_mode': 'off', 'use_snp_selection': True, 'num_snps': 23997}. Best is trial 107 with value: 0.10691712285381737.
[I 2025-12-05 15:21:11,572] Trial 146 finished with value: 0.10101850452164651 and parameters: {'model_type': 'mlp', 'hidden_dims': '[256, 128]', 'dropout': 0.11977936114075695, 'batch_norm': False, 'lr': 0.0003970246465148769, 'weight_decay': 1.645112434578756e-05, 'epochs': 336, 'loss': 'mae', 'optimizer': 'adam', 'graph_mode': 'off', 'use_snp_selection': False}. Best is trial 107 with value: 0.10691712285381737.
[I 2025-12-05 15:21:13,552] Trial 147 finished with value: 0.0954412031892371 and parameters: {'model_type': 'mlp', 'hidden_dims': '[256, 128]', 'dropout': 0.11843569123201854, 'batch_norm': False, 'lr': 0.0003723522708379812, 'weight_decay': 1.1657795445477942e-05, 'epochs': 338, 'loss': 'mae', 'optimizer': 'adam', 'graph_mode': 'off', 'use_snp_selection': True, 'num_snps': 23628}. Best is trial 107 with value: 0.10691712285381737.
[I 2025-12-05 15:21:15,163] Trial 148 finished with value: 0.07565735080373956 and parameters: {'model_type': 'mlp', 'hidden_dims': '[256, 128]', 'dropout': 0.11139334012923816, 'batch_norm': False, 'lr': 0.00042646913833361785, 'weight_decay': 1.621455736362536e-05, 'epochs': 328, 'loss': 'mae', 'optimizer': 'adam', 'graph_mode': 'off', 'use_snp_selection': True, 'num_snps': 12983}. Best is trial 107 with value: 0.10691712285381737.
[I 2025-12-05 15:21:17,043] Trial 149 finished with value: 0.09096741239421526 and parameters: {'model_type': 'mlp', 'hidden_dims': '[256, 128]', 'dropout': 0.16470507792665579, 'batch_norm': False, 'lr': 0.0002935861455730099, 'weight_decay': 1.8672859818558522e-05, 'epochs': 338, 'loss': 'mae', 'optimizer': 'adam', 'graph_mode': 'off', 'use_snp_selection': False}. Best is trial 107 with value: 0.10691712285381737.
[I 2025-12-05 15:21:20,335] Trial 0 finished with value: 0.04733359262015159 and parameters: {'model_type': 'mlp', 'hidden_dims': '[128, 64]', 'dropout': 0.199031432379812, 'batch_norm': True, 'lr': 1.8408544111075837e-06, 'weight_decay': 5.5136510071208614e-05, 'epochs': 336, 'loss': 'mae', 'optimizer': 'adam', 'graph_mode': 'off', 'use_snp_selection': True, 'num_snps': 43862}. Best is trial 0 with value: 0.04733359262015159.
[I 2025-12-05 15:21:22,503] Trial 1 finished with value: 0.12179826101607956 and parameters: {'model_type': 'mlp', 'hidden_dims': '[256, 128]', 'dropout': 0.4370668075331726, 'batch_norm': True, 'lr': 7.133471581159139e-05, 'weight_decay': 1.128633586803549e-05, 'epochs': 242, 'loss': 'mae', 'optimizer': 'adam', 'graph_mode': 'off', 'use_snp_selection': False}. Best is trial 1 with value: 0.12179826101607956.
[I 2025-12-05 15:21:24,268] Trial 2 finished with value: 0.08038315851859545 and parameters: {'model_type': 'mlp', 'hidden_dims': '[256, 128, 64]', 'dropout': 0.41314357415569625, 'batch_norm': False, 'lr': 3.952233718592101e-06, 'weight_decay': 0.00026754769258252603, 'epochs': 149, 'loss': 'mse', 'optimizer': 'adam', 'graph_mode': 'off', 'use_snp_selection': True, 'num_snps': 11571}. Best is trial 1 with value: 0.12179826101607956.
[I 2025-12-05 15:21:28,818] Trial 3 finished with value: 0.0906908423673296 and parameters: {'model_type': 'mlp', 'hidden_dims': '[512, 64]', 'dropout': 0.5938127374509361, 'batch_norm': False, 'lr': 5.67704586114731e-06, 'weight_decay': 2.4518087630137052e-05, 'epochs': 320, 'loss': 'mae', 'optimizer': 'adam', 'graph_mode': 'off', 'use_snp_selection': False}. Best is trial 1 with value: 0.12179826101607956.
[I 2025-12-05 15:21:33,218] Trial 4 finished with value: 0.052645982736128506 and parameters: {'model_type': 'mlp', 'hidden_dims': '[512, 128]', 'dropout': 0.25746343592134413, 'batch_norm': True, 'lr': 1.3467657668402788e-06, 'weight_decay': 0.00033087251918647806, 'epochs': 277, 'loss': 'mse', 'optimizer': 'adam', 'graph_mode': 'off', 'use_snp_selection': True, 'num_snps': 36675}. Best is trial 1 with value: 0.12179826101607956.
[I 2025-12-05 15:21:36,513] Trial 5 finished with value: 0.05922412802805674 and parameters: {'model_type': 'mlp', 'hidden_dims': '[512, 64]', 'dropout': 0.38275350994408375, 'batch_norm': True, 'lr': 1.5586664309232824e-06, 'weight_decay': 0.0008227664668621182, 'epochs': 145, 'loss': 'mae', 'optimizer': 'adam', 'graph_mode': 'off', 'use_snp_selection': True, 'num_snps': 32148}. Best is trial 1 with value: 0.12179826101607956.
