[I 2025-12-05 14:46:53,074] Trial 20 finished with value: 0.1275984279561471 and parameters: {'model_type': 'mlp', 'hidden_dims': '[256, 128]', 'dropout': 0.45288397642049855, 'batch_norm': False, 'lr': 3.2145087327406406e-05, 'weight_decay': 4.170062865086698e-05, 'epochs': 286, 'loss': 'mse', 'optimizer': 'adam', 'graph_mode': 'off', 'use_snp_selection': True, 'num_snps': 57703}. Best is trial 6 with value: 0.12995315368379257.
[I 2025-12-05 14:46:56,316] Trial 21 finished with value: 0.11167883304254395 and parameters: {'model_type': 'mlp', 'hidden_dims': '[256, 128]', 'dropout': 0.45595352735786493, 'batch_norm': False, 'lr': 3.731801345408757e-05, 'weight_decay': 6.240828532429687e-05, 'epochs': 285, 'loss': 'mse', 'optimizer': 'adam', 'graph_mode': 'off', 'use_snp_selection': True, 'num_snps': 59811}. Best is trial 6 with value: 0.12995315368379257.
[I 2025-12-05 14:46:59,236] Trial 22 finished with value: 0.08934139929732805 and parameters: {'model_type': 'mlp', 'hidden_dims': '[256, 128]', 'dropout': 0.3728106006888768, 'batch_norm': False, 'lr': 8.941479647323712e-06, 'weight_decay': 4.51391726365562e-05, 'epochs': 338, 'loss': 'mse', 'optimizer': 'adam', 'graph_mode': 'off', 'use_snp_selection': True, 'num_snps': 48956}. Best is trial 6 with value: 0.12995315368379257.
[I 2025-12-05 14:47:00,777] Trial 23 finished with value: 0.13083647489442385 and parameters: {'model_type': 'mlp', 'hidden_dims': '[256, 128]', 'dropout': 0.5457724774320233, 'batch_norm': False, 'lr': 2.7084248762210538e-05, 'weight_decay': 4.105983745231249e-06, 'epochs': 300, 'loss': 'mse', 'optimizer': 'adam', 'graph_mode': 'off', 'use_snp_selection': True, 'num_snps': 18234}. Best is trial 23 with value: 0.13083647489442385.
[I 2025-12-05 14:47:02,105] Trial 24 finished with value: 0.11177799250207975 and parameters: {'model_type': 'mlp', 'hidden_dims': '[256, 128]', 'dropout': 0.5993693253932052, 'batch_norm': False, 'lr': 0.0001238093398564655, 'weight_decay': 3.3893653598025408e-06, 'epochs': 122, 'loss': 'mse', 'optimizer': 'adam', 'graph_mode': 'off', 'use_snp_selection': True, 'num_snps': 17685}. Best is trial 23 with value: 0.13083647489442385.
[I 2025-12-05 14:47:03,721] Trial 25 finished with value: 0.0884272624861003 and parameters: {'model_type': 'mlp', 'hidden_dims': '[256, 128]', 'dropout': 0.5472566816920805, 'batch_norm': False, 'lr': 1.5893147765538587e-05, 'weight_decay': 1.182924922540558e-06, 'epochs': 312, 'loss': 'mse', 'optimizer': 'adam', 'graph_mode': 'off', 'use_snp_selection': True, 'num_snps': 21700}. Best is trial 23 with value: 0.13083647489442385.
[I 2025-12-05 14:47:04,788] Trial 26 finished with value: 0.032967128949813844 and parameters: {'model_type': 'mlp', 'hidden_dims': '[256, 128]', 'dropout': 0.4956682225803344, 'batch_norm': False, 'lr': 4.962144858027397e-06, 'weight_decay': 8.287256916904938e-06, 'epochs': 261, 'loss': 'mae', 'optimizer': 'adam', 'graph_mode': 'off', 'use_snp_selection': True, 'num_snps': 4103}. Best is trial 23 with value: 0.13083647489442385.
[I 2025-12-05 14:47:06,349] Trial 27 finished with value: 0.10920172642489695 and parameters: {'model_type': 'mlp', 'hidden_dims': '[256, 128]', 'dropout': 0.5541516117604877, 'batch_norm': False, 'lr': 3.059652423567555e-05, 'weight_decay': 9.404297361389459e-07, 'epochs': 213, 'loss': 'mse', 'optimizer': 'adam', 'graph_mode': 'off', 'use_snp_selection': True, 'num_snps': 21313}. Best is trial 23 with value: 0.13083647489442385.
[I 2025-12-05 14:47:07,833] Trial 28 finished with value: 0.04604890163421254 and parameters: {'model_type': 'mlp', 'hidden_dims': '[128, 64]', 'dropout': 0.4226568525094813, 'batch_norm': False, 'lr': 2.8966762461994946e-06, 'weight_decay': 3.4560549434407116e-06, 'epochs': 78, 'loss': 'mse', 'optimizer': 'adam', 'graph_mode': 'off', 'use_snp_selection': True, 'num_snps': 26170}. Best is trial 23 with value: 0.13083647489442385.
[I 2025-12-05 14:47:11,149] Trial 29 finished with value: 0.1090393577910954 and parameters: {'model_type': 'mlp', 'hidden_dims': '[512, 256]', 'dropout': 0.25100413651564335, 'batch_norm': False, 'lr': 8.668888692922407e-06, 'weight_decay': 3.33063996908782e-07, 'epochs': 333, 'loss': 'mae', 'optimizer': 'adam', 'graph_mode': 'off', 'use_snp_selection': True, 'num_snps': 41497}. Best is trial 23 with value: 0.13083647489442385.
[I 2025-12-05 14:47:12,465] Trial 30 finished with value: 0.10280917643482981 and parameters: {'model_type': 'mlp', 'hidden_dims': '[512, 128]', 'dropout': 0.349039660768532, 'batch_norm': False, 'lr': 4.3834080781684247e-05, 'weight_decay': 1.586294170816382e-05, 'epochs': 303, 'loss': 'mse', 'optimizer': 'adam', 'graph_mode': 'off', 'use_snp_selection': True, 'num_snps': 10638}. Best is trial 23 with value: 0.13083647489442385.
[I 2025-12-05 14:47:15,516] Trial 31 finished with value: 0.10650622859831801 and parameters: {'model_type': 'mlp', 'hidden_dims': '[256, 128]', 'dropout': 0.46074812021157097, 'batch_norm': False, 'lr': 2.4953290026284272e-05, 'weight_decay': 7.156938793772145e-05, 'epochs': 350, 'loss': 'mse', 'optimizer': 'adam', 'graph_mode': 'off', 'use_snp_selection': True, 'num_snps': 53064}. Best is trial 23 with value: 0.13083647489442385.
[I 2025-12-05 14:47:18,352] Trial 32 finished with value: 0.07837198009884613 and parameters: {'model_type': 'mlp', 'hidden_dims': '[256, 128]', 'dropout': 0.43586512234392855, 'batch_norm': False, 'lr': 1.6934020056950103e-05, 'weight_decay': 3.657336687780101e-05, 'epochs': 276, 'loss': 'mse', 'optimizer': 'adam', 'graph_mode': 'off', 'use_snp_selection': True, 'num_snps': 50127}. Best is trial 23 with value: 0.13083647489442385.
[I 2025-12-05 14:47:21,626] Trial 33 finished with value: 0.11831990715158804 and parameters: {'model_type': 'mlp', 'hidden_dims': '[256, 128]', 'dropout': 0.4054089822247606, 'batch_norm': False, 'lr': 3.771686725861159e-05, 'weight_decay': 0.0001319717728224751, 'epochs': 233, 'loss': 'mse', 'optimizer': 'adam', 'graph_mode': 'off', 'use_snp_selection': True, 'num_snps': 59420}. Best is trial 23 with value: 0.13083647489442385.
[I 2025-12-05 14:47:24,379] Trial 34 finished with value: 0.08689969592584423 and parameters: {'model_type': 'mlp', 'hidden_dims': '[256, 128]', 'dropout': 0.5660495903201264, 'batch_norm': False, 'lr': 9.18419867869105e-05, 'weight_decay': 1.0707481808500851e-05, 'epochs': 293, 'loss': 'mae', 'optimizer': 'adam', 'graph_mode': 'off', 'use_snp_selection': True, 'num_snps': 44500}. Best is trial 23 with value: 0.13083647489442385.
[I 2025-12-05 14:47:26,326] Trial 35 finished with value: 0.03823696802653669 and parameters: {'model_type': 'mlp', 'hidden_dims': '[128, 64]', 'dropout': 0.4883126803406223, 'batch_norm': False, 'lr': 2.6106535073142584e-06, 'weight_decay': 5.869275962281847e-06, 'epochs': 266, 'loss': 'mse', 'optimizer': 'adam', 'graph_mode': 'off', 'use_snp_selection': True, 'num_snps': 31346}. Best is trial 23 with value: 0.13083647489442385.
[I 2025-12-05 14:47:29,515] Trial 36 finished with value: 0.11216785261542268 and parameters: {'model_type': 'mlp', 'hidden_dims': '[256, 128]', 'dropout': 0.4383132942051402, 'batch_norm': False, 'lr': 1.290275667461619e-05, 'weight_decay': 2.573967298227131e-05, 'epochs': 328, 'loss': 'mse', 'optimizer': 'adam', 'graph_mode': 'off', 'use_snp_selection': True, 'num_snps': 53955}. Best is trial 23 with value: 0.13083647489442385.
[I 2025-12-05 14:47:32,000] Trial 37 finished with value: 0.05171167982626618 and parameters: {'model_type': 'mlp', 'hidden_dims': '[256, 128]', 'dropout': 0.36843250965507507, 'batch_norm': True, 'lr': 7.101180917739733e-06, 'weight_decay': 0.00011716380651939923, 'epochs': 300, 'loss': 'mae', 'optimizer': 'adam', 'graph_mode': 'off', 'use_snp_selection': True, 'num_snps': 36998}. Best is trial 23 with value: 0.13083647489442385.
[I 2025-12-05 14:47:35,340] Trial 38 finished with value: 0.10688419617161811 and parameters: {'model_type': 'mlp', 'hidden_dims': '[512, 128]', 'dropout': 0.5172686721270366, 'batch_norm': False, 'lr': 5.1278548072709584e-05, 'weight_decay': 3.5947325356537655e-06, 'epochs': 228, 'loss': 'mse', 'optimizer': 'adam', 'graph_mode': 'off', 'use_snp_selection': True, 'num_snps': 48245}. Best is trial 23 with value: 0.13083647489442385.
[I 2025-12-05 14:47:36,780] Trial 39 finished with value: 0.08407481999094008 and parameters: {'model_type': 'mlp', 'hidden_dims': '[256, 128]', 'dropout': 0.41093125020629806, 'batch_norm': True, 'lr': 0.00013338510065703308, 'weight_decay': 2.2933335777539744e-06, 'epochs': 199, 'loss': 'mse', 'optimizer': 'adam', 'graph_mode': 'off', 'use_snp_selection': True, 'num_snps': 14031}. Best is trial 23 with value: 0.13083647489442385.
[I 2025-12-05 14:47:38,403] Trial 40 finished with value: 0.12817731364589177 and parameters: {'model_type': 'mlp', 'hidden_dims': '[512, 256]', 'dropout': 0.2835197806580561, 'batch_norm': False, 'lr': 2.5348451642959175e-05, 'weight_decay': 1.2598100030092001e-05, 'epochs': 154, 'loss': 'mae', 'optimizer': 'adam', 'graph_mode': 'off', 'use_snp_selection': False}. Best is trial 23 with value: 0.13083647489442385.
[I 2025-12-05 14:47:39,938] Trial 41 finished with value: 0.10983040363634942 and parameters: {'model_type': 'mlp', 'hidden_dims': '[512, 256]', 'dropout': 0.23323489259696992, 'batch_norm': False, 'lr': 2.665034781070673e-05, 'weight_decay': 1.6391927595751813e-05, 'epochs': 135, 'loss': 'mae', 'optimizer': 'adam', 'graph_mode': 'off', 'use_snp_selection': False}. Best is trial 23 with value: 0.13083647489442385.
[I 2025-12-05 14:47:41,577] Trial 42 finished with value: 0.09723483051376769 and parameters: {'model_type': 'mlp', 'hidden_dims': '[512, 256]', 'dropout': 0.2977160273799241, 'batch_norm': False, 'lr': 2.0016806128638766e-05, 'weight_decay': 1.306184774683245e-05, 'epochs': 158, 'loss': 'mae', 'optimizer': 'adam', 'graph_mode': 'off', 'use_snp_selection': False}. Best is trial 23 with value: 0.13083647489442385.
[I 2025-12-05 14:47:43,236] Trial 43 finished with value: 0.11521848860668094 and parameters: {'model_type': 'mlp', 'hidden_dims': '[512, 256]', 'dropout': 0.2752094282672461, 'batch_norm': False, 'lr': 6.79819154386693e-05, 'weight_decay': 2.432925389433615e-05, 'epochs': 156, 'loss': 'mae', 'optimizer': 'adam', 'graph_mode': 'off', 'use_snp_selection': False}. Best is trial 23 with value: 0.13083647489442385.
[I 2025-12-05 14:47:44,556] Trial 44 finished with value: 0.09080981783910536 and parameters: {'model_type': 'mlp', 'hidden_dims': '[512, 64]', 'dropout': 0.22878712440077814, 'batch_norm': False, 'lr': 1.2292135087417616e-05, 'weight_decay': 1.6569327653229418e-06, 'epochs': 102, 'loss': 'mae', 'optimizer': 'adam', 'graph_mode': 'off', 'use_snp_selection': False}. Best is trial 23 with value: 0.13083647489442385.
[I 2025-12-05 14:47:46,902] Trial 45 finished with value: 0.10435663842130878 and parameters: {'model_type': 'mlp', 'hidden_dims': '[512, 256]', 'dropout': 0.3643127416149839, 'batch_norm': True, 'lr': 3.238784742784616e-05, 'weight_decay': 5.022170416513198e-06, 'epochs': 272, 'loss': 'mae', 'optimizer': 'adam', 'graph_mode': 'off', 'use_snp_selection': False}. Best is trial 23 with value: 0.13083647489442385.
[I 2025-12-05 14:47:48,058] Trial 46 finished with value: 0.1137020847986529 and parameters: {'model_type': 'mlp', 'hidden_dims': '[256, 128]', 'dropout': 0.17862275230143393, 'batch_norm': False, 'lr': 5.2138644551679216e-05, 'weight_decay': 7.629873163628e-07, 'epochs': 193, 'loss': 'mse', 'optimizer': 'adam', 'graph_mode': 'off', 'use_snp_selection': False}. Best is trial 23 with value: 0.13083647489442385.
[I 2025-12-05 14:47:49,817] Trial 47 finished with value: 0.12616134264591328 and parameters: {'model_type': 'mlp', 'hidden_dims': '[512, 128]', 'dropout': 0.33527086201297185, 'batch_norm': False, 'lr': 2.0666716692977218e-05, 'weight_decay': 0.000330094884026644, 'epochs': 174, 'loss': 'mse', 'optimizer': 'adam', 'graph_mode': 'off', 'use_snp_selection': False}. Best is trial 23 with value: 0.13083647489442385.
[I 2025-12-05 14:47:51,340] Trial 48 finished with value: 0.04993317930176388 and parameters: {'model_type': 'mlp', 'hidden_dims': '[256, 128, 64]', 'dropout': 0.3873747129752213, 'batch_norm': False, 'lr': 5.854727455995542e-06, 'weight_decay': 8.935846313636572e-06, 'epochs': 312, 'loss': 'mae', 'optimizer': 'adam', 'graph_mode': 'off', 'use_snp_selection': False}. Best is trial 23 with value: 0.13083647489442385.
[I 2025-12-05 14:47:53,109] Trial 49 finished with value: 0.08956396725465726 and parameters: {'model_type': 'mlp', 'hidden_dims': '[512, 64]', 'dropout': 0.31252876503402355, 'batch_norm': True, 'lr': 9.280494293724656e-05, 'weight_decay': 2.4173235204186125e-05, 'epochs': 122, 'loss': 'mse', 'optimizer': 'adam', 'graph_mode': 'off', 'use_snp_selection': True, 'num_snps': 26158}. Best is trial 23 with value: 0.13083647489442385.
[I 2025-12-05 14:47:54,421] Trial 50 finished with value: 0.09817746896692009 and parameters: {'model_type': 'mlp', 'hidden_dims': '[256, 128]', 'dropout': 0.4624982505420907, 'batch_norm': False, 'lr': 1.407079264449077e-05, 'weight_decay': 2.42206554163901e-06, 'epochs': 253, 'loss': 'mse', 'optimizer': 'adam', 'graph_mode': 'off', 'use_snp_selection': False}. Best is trial 23 with value: 0.13083647489442385.
[I 2025-12-05 14:47:55,736] Trial 51 finished with value: 0.09661765734526084 and parameters: {'model_type': 'mlp', 'hidden_dims': '[256, 128, 64]', 'dropout': 0.32764614153300714, 'batch_norm': False, 'lr': 0.0006645367725007211, 'weight_decay': 3.258060809481867e-07, 'epochs': 254, 'loss': 'mse', 'optimizer': 'adam', 'graph_mode': 'off', 'use_snp_selection': False}. Best is trial 23 with value: 0.13083647489442385.
[I 2025-12-05 14:47:57,145] Trial 52 finished with value: 0.05596283991785281 and parameters: {'model_type': 'mlp', 'hidden_dims': '[256, 128, 64]', 'dropout': 0.2853578265458591, 'batch_norm': False, 'lr': 1.0673951939598245e-06, 'weight_decay': 1.4546563719680977e-07, 'epochs': 283, 'loss': 'mse', 'optimizer': 'adam', 'graph_mode': 'off', 'use_snp_selection': False}. Best is trial 23 with value: 0.13083647489442385.
[I 2025-12-05 14:47:58,588] Trial 53 finished with value: 0.1145314335612761 and parameters: {'model_type': 'mlp', 'hidden_dims': '[256, 128, 64]', 'dropout': 0.32204229875324925, 'batch_norm': False, 'lr': 0.00019984608752764973, 'weight_decay': 0.0008658651548732487, 'epochs': 296, 'loss': 'mse', 'optimizer': 'adam', 'graph_mode': 'off', 'use_snp_selection': False}. Best is trial 23 with value: 0.13083647489442385.
[I 2025-12-05 14:47:59,813] Trial 54 finished with value: 0.0985947286901484 and parameters: {'model_type': 'mlp', 'hidden_dims': '[256, 128, 64]', 'dropout': 0.3514793175992439, 'batch_norm': False, 'lr': 0.0004037774840736954, 'weight_decay': 2.1185667029088613e-07, 'epochs': 222, 'loss': 'mse', 'optimizer': 'adam', 'graph_mode': 'off', 'use_snp_selection': False}. Best is trial 23 with value: 0.13083647489442385.
[I 2025-12-05 14:48:00,701] Trial 55 finished with value: 0.08030947280436417 and parameters: {'model_type': 'mlp', 'hidden_dims': '[128, 64]', 'dropout': 0.39414313078203983, 'batch_norm': False, 'lr': 0.0003428350853135228, 'weight_decay': 1.417400535438359e-06, 'epochs': 239, 'loss': 'mse', 'optimizer': 'adam', 'graph_mode': 'off', 'use_snp_selection': False}. Best is trial 23 with value: 0.13083647489442385.
[I 2025-12-05 14:48:03,302] Trial 56 finished with value: 0.10342801077071775 and parameters: {'model_type': 'mlp', 'hidden_dims': '[512, 256]', 'dropout': 0.4405201412961037, 'batch_norm': False, 'lr': 1.0081068584198849e-05, 'weight_decay': 9.789397825614997e-05, 'epochs': 322, 'loss': 'mse', 'optimizer': 'adam', 'graph_mode': 'off', 'use_snp_selection': False}. Best is trial 23 with value: 0.13083647489442385.
[I 2025-12-05 14:48:04,300] Trial 57 finished with value: 0.08065024742153308 and parameters: {'model_type': 'mlp', 'hidden_dims': '[256, 128]', 'dropout': 0.5810452315244015, 'batch_norm': False, 'lr': 0.0001251600692246005, 'weight_decay': 0.00021901049970566352, 'epochs': 202, 'loss': 'mse', 'optimizer': 'adam', 'graph_mode': 'off', 'use_snp_selection': True, 'num_snps': 3983}. Best is trial 23 with value: 0.13083647489442385.
[I 2025-12-05 14:48:05,422] Trial 58 finished with value: 0.04455020406795689 and parameters: {'model_type': 'mlp', 'hidden_dims': '[256, 128, 64]', 'dropout': 0.5391357524173752, 'batch_norm': False, 'lr': 4.42700804039002e-06, 'weight_decay': 6.943357418297876e-06, 'epochs': 184, 'loss': 'mse', 'optimizer': 'adam', 'graph_mode': 'off', 'use_snp_selection': False}. Best is trial 23 with value: 0.13083647489442385.
[I 2025-12-05 14:48:07,687] Trial 59 finished with value: 0.11831748945467305 and parameters: {'model_type': 'mlp', 'hidden_dims': '[256, 128]', 'dropout': 0.2766147562134543, 'batch_norm': False, 'lr': 4.1978610195467156e-05, 'weight_decay': 3.8398455237251484e-06, 'epochs': 265, 'loss': 'mae', 'optimizer': 'adam', 'graph_mode': 'off', 'use_snp_selection': True, 'num_snps': 39161}. Best is trial 23 with value: 0.13083647489442385.
[I 2025-12-05 14:48:10,241] Trial 60 finished with value: 0.08590114569707409 and parameters: {'model_type': 'mlp', 'hidden_dims': '[256, 128]', 'dropout': 0.35469534213964726, 'batch_norm': True, 'lr': 2.5384266274644894e-05, 'weight_decay': 6.586123205701145e-07, 'epochs': 249, 'loss': 'mse', 'optimizer': 'adam', 'graph_mode': 'off', 'use_snp_selection': True, 'num_snps': 44525}. Best is trial 23 with value: 0.13083647489442385.
[I 2025-12-05 14:48:11,902] Trial 61 finished with value: 0.10632366750504241 and parameters: {'model_type': 'mlp', 'hidden_dims': '[512, 128]', 'dropout': 0.3358937110479459, 'batch_norm': False, 'lr': 1.77825941203319e-05, 'weight_decay': 0.00028842648381177547, 'epochs': 166, 'loss': 'mse', 'optimizer': 'adam', 'graph_mode': 'off', 'use_snp_selection': False}. Best is trial 23 with value: 0.13083647489442385.
[I 2025-12-05 14:48:13,631] Trial 62 finished with value: 0.11875938186627187 and parameters: {'model_type': 'mlp', 'hidden_dims': '[512, 128]', 'dropout': 0.37288493545534407, 'batch_norm': False, 'lr': 2.1643628721356108e-05, 'weight_decay': 0.0005694662466022691, 'epochs': 178, 'loss': 'mse', 'optimizer': 'adam', 'graph_mode': 'off', 'use_snp_selection': False}. Best is trial 23 with value: 0.13083647489442385.
[I 2025-12-05 14:48:15,183] Trial 63 finished with value: 0.11715845944424176 and parameters: {'model_type': 'mlp', 'hidden_dims': '[512, 128]', 'dropout': 0.30787977803819355, 'batch_norm': False, 'lr': 3.393496686667018e-05, 'weight_decay': 0.00046017083381360094, 'epochs': 143, 'loss': 'mse', 'optimizer': 'adam', 'graph_mode': 'off', 'use_snp_selection': False}. Best is trial 23 with value: 0.13083647489442385.
[I 2025-12-05 14:48:17,513] Trial 64 finished with value: 0.08983837473297002 and parameters: {'model_type': 'mlp', 'hidden_dims': '[512, 128]', 'dropout': 0.48441359818771523, 'batch_norm': False, 'lr': 7.202185280979326e-06, 'weight_decay': 3.26737474178966e-05, 'epochs': 280, 'loss': 'mse', 'optimizer': 'adam', 'graph_mode': 'off', 'use_snp_selection': False}. Best is trial 23 with value: 0.13083647489442385.
[I 2025-12-05 14:48:19,187] Trial 65 finished with value: 0.1236123152897451 and parameters: {'model_type': 'mlp', 'hidden_dims': '[512, 64]', 'dropout': 0.4258484160480347, 'batch_norm': False, 'lr': 1.1749324252504735e-05, 'weight_decay': 0.00016036444437446317, 'epochs': 168, 'loss': 'mse', 'optimizer': 'adam', 'graph_mode': 'off', 'use_snp_selection': False}. Best is trial 23 with value: 0.13083647489442385.
[I 2025-12-05 14:48:23,201] Trial 66 finished with value: 0.11701715009285794 and parameters: {'model_type': 'mlp', 'hidden_dims': '[512, 128]', 'dropout': 0.29023750953249233, 'batch_norm': False, 'lr': 2.8495155023779286e-05, 'weight_decay': 4.4487069381980154e-07, 'epochs': 313, 'loss': 'mse', 'optimizer': 'adam', 'graph_mode': 'off', 'use_snp_selection': True, 'num_snps': 56584}. Best is trial 23 with value: 0.13083647489442385.
[I 2025-12-05 14:48:24,196] Trial 67 finished with value: 0.11761862121610019 and parameters: {'model_type': 'mlp', 'hidden_dims': '[256, 128]', 'dropout': 0.32230530338046637, 'batch_norm': False, 'lr': 2.1016001300373827e-05, 'weight_decay': 2.679375060895605e-06, 'epochs': 124, 'loss': 'mse', 'optimizer': 'adam', 'graph_mode': 'off', 'use_snp_selection': False}. Best is trial 23 with value: 0.13083647489442385.
[I 2025-12-05 14:48:26,034] Trial 68 finished with value: 0.10787029625523227 and parameters: {'model_type': 'mlp', 'hidden_dims': '[512, 256]', 'dropout': 0.39961369266413116, 'batch_norm': False, 'lr': 5.128552358408701e-05, 'weight_decay': 1.0167632928439953e-06, 'epochs': 139, 'loss': 'mse', 'optimizer': 'adam', 'graph_mode': 'off', 'use_snp_selection': True, 'num_snps': 27132}. Best is trial 23 with value: 0.13083647489442385.
[I 2025-12-05 14:48:26,991] Trial 69 finished with value: 0.0799014427852592 and parameters: {'model_type': 'mlp', 'hidden_dims': '[128, 64]', 'dropout': 0.34270530274686584, 'batch_norm': False, 'lr': 0.0005361315809569503, 'weight_decay': 7.991145284575853e-05, 'epochs': 290, 'loss': 'mse', 'optimizer': 'adam', 'graph_mode': 'off', 'use_snp_selection': False}. Best is trial 23 with value: 0.13083647489442385.
[I 2025-12-05 14:48:28,930] Trial 70 finished with value: 0.1068105161151199 and parameters: {'model_type': 'mlp', 'hidden_dims': '[256, 128]', 'dropout': 0.3818140577590959, 'batch_norm': False, 'lr': 1.502376230019683e-05, 'weight_decay': 5.069710890258804e-06, 'epochs': 189, 'loss': 'mae', 'optimizer': 'adam', 'graph_mode': 'off', 'use_snp_selection': True, 'num_snps': 34115}. Best is trial 23 with value: 0.13083647489442385.
