[I 2025-12-05 14:34:20,337] Trial 60 finished with value: 0.0897968705209791 and parameters: {'model_type': 'mlp', 'hidden_dims': '[512, 256]', 'dropout': 0.12301057179188737, 'batch_norm': False, 'lr': 5.655949239763784e-05, 'weight_decay': 6.964710060388148e-07, 'epochs': 274, 'loss': 'mse', 'optimizer': 'adam', 'graph_mode': 'off', 'use_snp_selection': False}. Best is trial 45 with value: 0.1041517699556937.
[I 2025-12-05 14:34:23,022] Trial 61 finished with value: 0.0899787428573045 and parameters: {'model_type': 'mlp', 'hidden_dims': '[512, 256]', 'dropout': 0.16966788143025924, 'batch_norm': False, 'lr': 8.307050291155116e-05, 'weight_decay': 7.849673753590876e-06, 'epochs': 261, 'loss': 'mse', 'optimizer': 'adam', 'graph_mode': 'off', 'use_snp_selection': False}. Best is trial 45 with value: 0.1041517699556937.
[I 2025-12-05 14:34:25,351] Trial 62 finished with value: 0.08989149260397503 and parameters: {'model_type': 'mlp', 'hidden_dims': '[512, 256]', 'dropout': 0.20295338360254891, 'batch_norm': False, 'lr': 4.265561469305198e-05, 'weight_decay': 2.1981298591925696e-05, 'epochs': 214, 'loss': 'mse', 'optimizer': 'adam', 'graph_mode': 'off', 'use_snp_selection': False}. Best is trial 45 with value: 0.1041517699556937.
[I 2025-12-05 14:34:27,188] Trial 63 finished with value: 0.10216394764388677 and parameters: {'model_type': 'mlp', 'hidden_dims': '[256, 128]', 'dropout': 0.22130413146605404, 'batch_norm': False, 'lr': 0.00016877333629445888, 'weight_decay': 2.6600458370787983e-06, 'epochs': 340, 'loss': 'mse', 'optimizer': 'adam', 'graph_mode': 'off', 'use_snp_selection': False}. Best is trial 45 with value: 0.1041517699556937.
[I 2025-12-05 14:34:28,002] Trial 64 finished with value: 0.09628981052756264 and parameters: {'model_type': 'mlp', 'hidden_dims': '[128, 64]', 'dropout': 0.15988607578570363, 'batch_norm': False, 'lr': 0.00010681684051111175, 'weight_decay': 2.860679428031454e-06, 'epochs': 157, 'loss': 'mse', 'optimizer': 'adam', 'graph_mode': 'off', 'use_snp_selection': False}. Best is trial 45 with value: 0.1041517699556937.
[I 2025-12-05 14:34:29,292] Trial 65 finished with value: 0.10148222576909556 and parameters: {'model_type': 'mlp', 'hidden_dims': '[256, 128]', 'dropout': 0.19320202857367796, 'batch_norm': False, 'lr': 0.0001674271350963299, 'weight_decay': 4.8631623282939255e-06, 'epochs': 194, 'loss': 'mse', 'optimizer': 'adam', 'graph_mode': 'off', 'use_snp_selection': False}. Best is trial 45 with value: 0.1041517699556937.
[I 2025-12-05 14:34:30,606] Trial 66 finished with value: 0.07858675813299604 and parameters: {'model_type': 'mlp', 'hidden_dims': '[256, 128]', 'dropout': 0.2235600519406748, 'batch_norm': False, 'lr': 0.0001868442091513238, 'weight_decay': 4.858325988102467e-06, 'epochs': 200, 'loss': 'mse', 'optimizer': 'adam', 'graph_mode': 'off', 'use_snp_selection': False}. Best is trial 45 with value: 0.1041517699556937.
[I 2025-12-05 14:34:31,717] Trial 67 finished with value: 0.036960898703288364 and parameters: {'model_type': 'mlp', 'hidden_dims': '[256, 128]', 'dropout': 0.1959459900924155, 'batch_norm': False, 'lr': 0.0006135093759659025, 'weight_decay': 1.6293268508842863e-06, 'epochs': 139, 'loss': 'mse', 'optimizer': 'adam', 'graph_mode': 'off', 'use_snp_selection': False}. Best is trial 45 with value: 0.1041517699556937.
[I 2025-12-05 14:34:32,960] Trial 68 finished with value: 0.09563904184252318 and parameters: {'model_type': 'mlp', 'hidden_dims': '[256, 128]', 'dropout': 0.20980968313220025, 'batch_norm': False, 'lr': 0.0004191457982323132, 'weight_decay': 8.568437528892246e-07, 'epochs': 181, 'loss': 'mse', 'optimizer': 'adam', 'graph_mode': 'off', 'use_snp_selection': False}. Best is trial 45 with value: 0.1041517699556937.
[I 2025-12-05 14:34:34,777] Trial 69 finished with value: 0.0883274074870242 and parameters: {'model_type': 'mlp', 'hidden_dims': '[256, 128]', 'dropout': 0.1444063552556123, 'batch_norm': False, 'lr': 0.00014521501113628831, 'weight_decay': 2.378966429250344e-06, 'epochs': 335, 'loss': 'mse', 'optimizer': 'adam', 'graph_mode': 'off', 'use_snp_selection': False}. Best is trial 45 with value: 0.1041517699556937.
[I 2025-12-05 14:34:35,964] Trial 70 finished with value: 0.09782517504985666 and parameters: {'model_type': 'mlp', 'hidden_dims': '[256, 128]', 'dropout': 0.23787566344156802, 'batch_norm': False, 'lr': 0.0002941366815732733, 'weight_decay': 3.945855263210178e-06, 'epochs': 166, 'loss': 'mse', 'optimizer': 'adam', 'graph_mode': 'off', 'use_snp_selection': False}. Best is trial 45 with value: 0.1041517699556937.
[I 2025-12-05 14:34:37,058] Trial 71 finished with value: 0.07514927949551765 and parameters: {'model_type': 'mlp', 'hidden_dims': '[256, 128]', 'dropout': 0.2366287447325145, 'batch_norm': False, 'lr': 0.00028801468024196016, 'weight_decay': 3.6091220612240184e-06, 'epochs': 141, 'loss': 'mse', 'optimizer': 'adam', 'graph_mode': 'off', 'use_snp_selection': False}. Best is trial 45 with value: 0.1041517699556937.
[I 2025-12-05 14:34:38,202] Trial 72 finished with value: 0.09499022204828185 and parameters: {'model_type': 'mlp', 'hidden_dims': '[256, 128]', 'dropout': 0.19356201833168654, 'batch_norm': False, 'lr': 0.00037015250001712005, 'weight_decay': 4.6152476187628e-06, 'epochs': 154, 'loss': 'mse', 'optimizer': 'adam', 'graph_mode': 'off', 'use_snp_selection': False}. Best is trial 45 with value: 0.1041517699556937.
[I 2025-12-05 14:34:39,429] Trial 73 finished with value: 0.08938596053175775 and parameters: {'model_type': 'mlp', 'hidden_dims': '[256, 128]', 'dropout': 0.23517495960910478, 'batch_norm': False, 'lr': 0.0004837266700353046, 'weight_decay': 2.825084294658803e-06, 'epochs': 170, 'loss': 'mse', 'optimizer': 'adam', 'graph_mode': 'off', 'use_snp_selection': False}. Best is trial 45 with value: 0.1041517699556937.
[I 2025-12-05 14:34:40,743] Trial 74 finished with value: 0.06055788997422473 and parameters: {'model_type': 'mlp', 'hidden_dims': '[256, 128]', 'dropout': 0.2710462145036639, 'batch_norm': False, 'lr': 0.00016836096265140569, 'weight_decay': 5.783409814245623e-06, 'epochs': 193, 'loss': 'mse', 'optimizer': 'adam', 'graph_mode': 'off', 'use_snp_selection': False}. Best is trial 45 with value: 0.1041517699556937.
[I 2025-12-05 14:34:42,108] Trial 75 finished with value: 0.09487905679782899 and parameters: {'model_type': 'mlp', 'hidden_dims': '[256, 128]', 'dropout': 0.22017131486686986, 'batch_norm': False, 'lr': 0.00011449464174287888, 'weight_decay': 1.3774019750566834e-06, 'epochs': 204, 'loss': 'mse', 'optimizer': 'adam', 'graph_mode': 'off', 'use_snp_selection': False}. Best is trial 45 with value: 0.1041517699556937.
[I 2025-12-05 14:34:44,232] Trial 76 finished with value: 0.06353575447823824 and parameters: {'model_type': 'mlp', 'hidden_dims': '[256, 128]', 'dropout': 0.25467003761615004, 'batch_norm': True, 'lr': 0.00021001008062233572, 'weight_decay': 8.544857661292563e-06, 'epochs': 177, 'loss': 'mse', 'optimizer': 'adam', 'graph_mode': 'off', 'use_snp_selection': True, 'num_snps': 31940}. Best is trial 45 with value: 0.1041517699556937.
[I 2025-12-05 14:34:45,977] Trial 77 finished with value: 0.04918202726439388 and parameters: {'model_type': 'mlp', 'hidden_dims': '[512, 128]', 'dropout': 0.3164358210821674, 'batch_norm': False, 'lr': 5.281027063632753e-06, 'weight_decay': 3.5330983260689296e-06, 'epochs': 134, 'loss': 'mae', 'optimizer': 'adam', 'graph_mode': 'off', 'use_snp_selection': False}. Best is trial 45 with value: 0.1041517699556937.
[I 2025-12-05 14:34:48,764] Trial 78 finished with value: 0.08923300858447136 and parameters: {'model_type': 'mlp', 'hidden_dims': '[256, 128, 64]', 'dropout': 0.18270491462394756, 'batch_norm': False, 'lr': 0.0007423345685221395, 'weight_decay': 1.8851532002674767e-06, 'epochs': 316, 'loss': 'mse', 'optimizer': 'adam', 'graph_mode': 'off', 'use_snp_selection': True, 'num_snps': 40611}. Best is trial 45 with value: 0.1041517699556937.
[I 2025-12-05 14:34:52,039] Trial 79 finished with value: 0.08597526601020951 and parameters: {'model_type': 'mlp', 'hidden_dims': '[512, 64]', 'dropout': 0.27686800209021895, 'batch_norm': False, 'lr': 0.0005358747502410399, 'weight_decay': 1.2164188221411007e-05, 'epochs': 339, 'loss': 'mae', 'optimizer': 'adam', 'graph_mode': 'off', 'use_snp_selection': False}. Best is trial 45 with value: 0.1041517699556937.
[I 2025-12-05 14:34:53,357] Trial 80 finished with value: 0.06919769821084158 and parameters: {'model_type': 'mlp', 'hidden_dims': '[256, 128]', 'dropout': 0.152522083210045, 'batch_norm': False, 'lr': 0.00030361441984843847, 'weight_decay': 1.0113585579172275e-06, 'epochs': 169, 'loss': 'mse', 'optimizer': 'adam', 'graph_mode': 'off', 'use_snp_selection': True, 'num_snps': 10426}. Best is trial 45 with value: 0.1041517699556937.
[I 2025-12-05 14:34:56,202] Trial 81 finished with value: 0.0956420506163617 and parameters: {'model_type': 'mlp', 'hidden_dims': '[512, 256]', 'dropout': 0.21765430713660042, 'batch_norm': False, 'lr': 0.00014288458234320694, 'weight_decay': 5.4097359773023616e-06, 'epochs': 282, 'loss': 'mse', 'optimizer': 'adam', 'graph_mode': 'off', 'use_snp_selection': False}. Best is trial 45 with value: 0.1041517699556937.
[I 2025-12-05 14:34:57,615] Trial 82 finished with value: 0.09400320254800919 and parameters: {'model_type': 'mlp', 'hidden_dims': '[256, 128]', 'dropout': 0.1714158146040577, 'batch_norm': False, 'lr': 6.752082374507114e-05, 'weight_decay': 1.2498029774775384e-05, 'epochs': 220, 'loss': 'mse', 'optimizer': 'adam', 'graph_mode': 'off', 'use_snp_selection': False}. Best is trial 45 with value: 0.1041517699556937.
[I 2025-12-05 14:35:00,179] Trial 83 finished with value: 0.10023466927637983 and parameters: {'model_type': 'mlp', 'hidden_dims': '[512, 64]', 'dropout': 0.19210986209284167, 'batch_norm': False, 'lr': 9.333021104965944e-05, 'weight_decay': 3.513301230901217e-05, 'epochs': 245, 'loss': 'mse', 'optimizer': 'adam', 'graph_mode': 'off', 'use_snp_selection': False}. Best is trial 45 with value: 0.1041517699556937.
[I 2025-12-05 14:35:02,693] Trial 84 finished with value: 0.09168701970446806 and parameters: {'model_type': 'mlp', 'hidden_dims': '[512, 64]', 'dropout': 0.18829609787786747, 'batch_norm': False, 'lr': 9.340051440655451e-05, 'weight_decay': 3.617084206034225e-05, 'epochs': 238, 'loss': 'mse', 'optimizer': 'adam', 'graph_mode': 'off', 'use_snp_selection': False}. Best is trial 45 with value: 0.1041517699556937.
[I 2025-12-05 14:35:05,271] Trial 85 finished with value: 0.09465952490640639 and parameters: {'model_type': 'mlp', 'hidden_dims': '[512, 64]', 'dropout': 0.23670472571081522, 'batch_norm': False, 'lr': 0.0002348191648011241, 'weight_decay': 2.4637600863467526e-07, 'epochs': 248, 'loss': 'mae', 'optimizer': 'adam', 'graph_mode': 'off', 'use_snp_selection': False}. Best is trial 45 with value: 0.1041517699556937.
[I 2025-12-05 14:35:06,930] Trial 86 finished with value: 0.0766614131960869 and parameters: {'model_type': 'mlp', 'hidden_dims': '[512, 64]', 'dropout': 0.20460491564355662, 'batch_norm': False, 'lr': 0.00034469797143334743, 'weight_decay': 3.197876292823282e-06, 'epochs': 207, 'loss': 'mse', 'optimizer': 'adam', 'graph_mode': 'off', 'use_snp_selection': True, 'num_snps': 14389}. Best is trial 45 with value: 0.1041517699556937.
[I 2025-12-05 14:35:09,092] Trial 87 finished with value: 0.059815111397216104 and parameters: {'model_type': 'mlp', 'hidden_dims': '[512, 64]', 'dropout': 0.25529739547464625, 'batch_norm': True, 'lr': 0.00017863273987652408, 'weight_decay': 0.00010151604814894883, 'epochs': 188, 'loss': 'mae', 'optimizer': 'adam', 'graph_mode': 'off', 'use_snp_selection': False}. Best is trial 45 with value: 0.1041517699556937.
[I 2025-12-05 14:35:12,118] Trial 88 finished with value: 0.08783922271980892 and parameters: {'model_type': 'mlp', 'hidden_dims': '[256, 128]', 'dropout': 0.2894023717002111, 'batch_norm': False, 'lr': 0.00023633079190677888, 'weight_decay': 6.863962160345697e-06, 'epochs': 325, 'loss': 'mse', 'optimizer': 'adam', 'graph_mode': 'off', 'use_snp_selection': True, 'num_snps': 45803}. Best is trial 45 with value: 0.1041517699556937.
[I 2025-12-05 14:35:15,424] Trial 89 finished with value: 0.0804105259191866 and parameters: {'model_type': 'mlp', 'hidden_dims': '[512, 64]', 'dropout': 0.3715663354895967, 'batch_norm': False, 'lr': 0.0001314116980493883, 'weight_decay': 4.650362243761542e-06, 'epochs': 340, 'loss': 'mae', 'optimizer': 'adam', 'graph_mode': 'off', 'use_snp_selection': False}. Best is trial 45 with value: 0.1041517699556937.
[I 2025-12-05 14:35:17,602] Trial 90 finished with value: 0.0901352372453262 and parameters: {'model_type': 'mlp', 'hidden_dims': '[128, 64]', 'dropout': 0.131458047810138, 'batch_norm': False, 'lr': 0.00010412119139435771, 'weight_decay': 0.0006339527474532524, 'epochs': 232, 'loss': 'mae', 'optimizer': 'adam', 'graph_mode': 'off', 'use_snp_selection': True, 'num_snps': 38415}. Best is trial 45 with value: 0.1041517699556937.
[I 2025-12-05 14:35:19,261] Trial 91 finished with value: 0.09115414765906776 and parameters: {'model_type': 'mlp', 'hidden_dims': '[256, 128]', 'dropout': 0.1927133514416803, 'batch_norm': False, 'lr': 5.2917271680680104e-05, 'weight_decay': 2.335260391374165e-05, 'epochs': 291, 'loss': 'mse', 'optimizer': 'adam', 'graph_mode': 'off', 'use_snp_selection': False}. Best is trial 45 with value: 0.1041517699556937.
[I 2025-12-05 14:35:20,649] Trial 92 finished with value: 0.09053953623182508 and parameters: {'model_type': 'mlp', 'hidden_dims': '[256, 128]', 'dropout': 0.20972810781698176, 'batch_norm': False, 'lr': 6.541379423748594e-05, 'weight_decay': 1.004427597136752e-05, 'epochs': 219, 'loss': 'mse', 'optimizer': 'adam', 'graph_mode': 'off', 'use_snp_selection': False}. Best is trial 45 with value: 0.1041517699556937.
[I 2025-12-05 14:35:23,296] Trial 93 finished with value: 0.09706663909436462 and parameters: {'model_type': 'mlp', 'hidden_dims': '[512, 256]', 'dropout': 0.165008296970949, 'batch_norm': False, 'lr': 3.637588829777476e-05, 'weight_decay': 3.507208640356451e-05, 'epochs': 254, 'loss': 'mse', 'optimizer': 'adam', 'graph_mode': 'off', 'use_snp_selection': False}. Best is trial 45 with value: 0.1041517699556937.
[I 2025-12-05 14:35:26,031] Trial 94 finished with value: 0.08548595655665442 and parameters: {'model_type': 'mlp', 'hidden_dims': '[512, 128]', 'dropout': 0.2277708584457114, 'batch_norm': False, 'lr': 8.520117837983922e-05, 'weight_decay': 2.248824413686925e-06, 'epochs': 268, 'loss': 'mse', 'optimizer': 'adam', 'graph_mode': 'off', 'use_snp_selection': False}. Best is trial 45 with value: 0.1041517699556937.
[I 2025-12-05 14:35:28,447] Trial 95 finished with value: 0.08197861802279544 and parameters: {'model_type': 'mlp', 'hidden_dims': '[512, 64]', 'dropout': 0.3292654447130909, 'batch_norm': False, 'lr': 1.904265779843317e-05, 'weight_decay': 4.789425131019194e-07, 'epochs': 224, 'loss': 'mse', 'optimizer': 'adam', 'graph_mode': 'off', 'use_snp_selection': False}. Best is trial 45 with value: 0.1041517699556937.
[I 2025-12-05 14:35:30,148] Trial 96 finished with value: 0.07433068449733161 and parameters: {'model_type': 'mlp', 'hidden_dims': '[256, 128]', 'dropout': 0.46069315486061047, 'batch_norm': False, 'lr': 0.00016695928690094923, 'weight_decay': 1.4732188105288059e-05, 'epochs': 303, 'loss': 'mse', 'optimizer': 'adam', 'graph_mode': 'off', 'use_snp_selection': False}. Best is trial 45 with value: 0.1041517699556937.
[I 2025-12-05 14:35:33,339] Trial 97 finished with value: 0.09875200550750723 and parameters: {'model_type': 'mlp', 'hidden_dims': '[256, 128, 64]', 'dropout': 0.30476853946221893, 'batch_norm': False, 'lr': 1.3988440816833356e-05, 'weight_decay': 3.8974396372687625e-06, 'epochs': 261, 'loss': 'mae', 'optimizer': 'adam', 'graph_mode': 'off', 'use_snp_selection': True, 'num_snps': 53578}. Best is trial 45 with value: 0.1041517699556937.
[I 2025-12-05 14:35:36,455] Trial 98 finished with value: 0.05237243818854403 and parameters: {'model_type': 'mlp', 'hidden_dims': '[256, 128, 64]', 'dropout': 0.30011421009369427, 'batch_norm': False, 'lr': 1.3172753602971342e-05, 'weight_decay': 3.7583897593789898e-06, 'epochs': 194, 'loss': 'mae', 'optimizer': 'adam', 'graph_mode': 'off', 'use_snp_selection': True, 'num_snps': 54423}. Best is trial 45 with value: 0.1041517699556937.
[I 2025-12-05 14:35:39,750] Trial 99 finished with value: 0.05886516312492388 and parameters: {'model_type': 'mlp', 'hidden_dims': '[256, 128, 64]', 'dropout': 0.3205304220912851, 'batch_norm': False, 'lr': 2.4650300456921068e-05, 'weight_decay': 7.272594504604081e-06, 'epochs': 314, 'loss': 'mae', 'optimizer': 'adam', 'graph_mode': 'off', 'use_snp_selection': True, 'num_snps': 50164}. Best is trial 45 with value: 0.1041517699556937.
[I 2025-12-05 14:35:43,427] Trial 100 finished with value: 0.020130131330293614 and parameters: {'model_type': 'mlp', 'hidden_dims': '[256, 128, 64]', 'dropout': 0.24689386629492713, 'batch_norm': True, 'lr': 8.645877867956413e-06, 'weight_decay': 2.5666233026301444e-06, 'epochs': 330, 'loss': 'mae', 'optimizer': 'adam', 'graph_mode': 'off', 'use_snp_selection': True, 'num_snps': 56576}. Best is trial 45 with value: 0.1041517699556937.
[I 2025-12-05 14:35:45,548] Trial 101 finished with value: 0.08624493689678535 and parameters: {'model_type': 'mlp', 'hidden_dims': '[256, 128]', 'dropout': 0.3054154027388924, 'batch_norm': False, 'lr': 0.00019155773355866696, 'weight_decay': 5.836596009647949e-05, 'epochs': 207, 'loss': 'mae', 'optimizer': 'adam', 'graph_mode': 'off', 'use_snp_selection': True, 'num_snps': 30338}. Best is trial 45 with value: 0.1041517699556937.
[I 2025-12-05 14:35:47,167] Trial 102 finished with value: 0.06936069156507724 and parameters: {'model_type': 'mlp', 'hidden_dims': '[256, 128, 64]', 'dropout': 0.3432162692331626, 'batch_norm': False, 'lr': 4.686551660288175e-05, 'weight_decay': 1.9984879117848556e-05, 'epochs': 263, 'loss': 'mae', 'optimizer': 'adam', 'graph_mode': 'off', 'use_snp_selection': True, 'num_snps': 15969}. Best is trial 45 with value: 0.1041517699556937.
[I 2025-12-05 14:35:50,005] Trial 103 finished with value: 0.08975612918889918 and parameters: {'model_type': 'mlp', 'hidden_dims': '[512, 64]', 'dropout': 0.1813455361207476, 'batch_norm': False, 'lr': 2.8522231925601424e-05, 'weight_decay': 5.589423571858959e-06, 'epochs': 276, 'loss': 'mae', 'optimizer': 'adam', 'graph_mode': 'off', 'use_snp_selection': False}. Best is trial 45 with value: 0.1041517699556937.
[I 2025-12-05 14:35:51,159] Trial 104 finished with value: 0.0010397662338940605 and parameters: {'model_type': 'mlp', 'hidden_dims': '[512, 256]', 'dropout': 0.1482558183913465, 'batch_norm': False, 'lr': 1.3040337890524298e-05, 'weight_decay': 4.174635555470674e-06, 'epochs': 245, 'loss': 'mse', 'optimizer': 'adam', 'graph_mode': 'off', 'use_snp_selection': True, 'num_snps': 2079}. Best is trial 45 with value: 0.1041517699556937.
[I 2025-12-05 14:35:52,664] Trial 105 finished with value: 0.09890397267025916 and parameters: {'model_type': 'mlp', 'hidden_dims': '[256, 128]', 'dropout': 0.21542475044321746, 'batch_norm': False, 'lr': 7.512408232126292e-05, 'weight_decay': 3.100181420918439e-06, 'epochs': 252, 'loss': 'mae', 'optimizer': 'adam', 'graph_mode': 'off', 'use_snp_selection': False}. Best is trial 45 with value: 0.1041517699556937.
[I 2025-12-05 14:35:54,167] Trial 106 finished with value: 0.1031583774455817 and parameters: {'model_type': 'mlp', 'hidden_dims': '[256, 128]', 'dropout': 0.2126181649622708, 'batch_norm': False, 'lr': 0.00011274949738424202, 'weight_decay': 1.4074308507712372e-06, 'epochs': 252, 'loss': 'mae', 'optimizer': 'adam', 'graph_mode': 'off', 'use_snp_selection': False}. Best is trial 45 with value: 0.1041517699556937.
[I 2025-12-05 14:35:55,675] Trial 107 finished with value: 0.0929772307916953 and parameters: {'model_type': 'mlp', 'hidden_dims': '[256, 128]', 'dropout': 0.2641135327728067, 'batch_norm': False, 'lr': 0.00011598214631229175, 'weight_decay': 8.028796066208352e-07, 'epochs': 254, 'loss': 'mae', 'optimizer': 'adam', 'graph_mode': 'off', 'use_snp_selection': False}. Best is trial 45 with value: 0.1041517699556937.
[I 2025-12-05 14:35:57,107] Trial 108 finished with value: 0.09324029655883118 and parameters: {'model_type': 'mlp', 'hidden_dims': '[256, 128]', 'dropout': 0.23049947672699128, 'batch_norm': False, 'lr': 0.00013936868013921376, 'weight_decay': 1.4721656172768141e-06, 'epochs': 233, 'loss': 'mae', 'optimizer': 'adam', 'graph_mode': 'off', 'use_snp_selection': False}. Best is trial 45 with value: 0.1041517699556937.
[I 2025-12-05 14:35:58,577] Trial 109 finished with value: 0.0966885726701878 and parameters: {'model_type': 'mlp', 'hidden_dims': '[256, 128]', 'dropout': 0.21796585994853154, 'batch_norm': False, 'lr': 7.784010153001112e-05, 'weight_decay': 2.009184548962025e-06, 'epochs': 242, 'loss': 'mae', 'optimizer': 'adam', 'graph_mode': 'off', 'use_snp_selection': False}. Best is trial 45 with value: 0.1041517699556937.
[I 2025-12-05 14:36:00,102] Trial 110 finished with value: 0.09437624457997207 and parameters: {'model_type': 'mlp', 'hidden_dims': '[256, 128]', 'dropout': 0.24068439335742317, 'batch_norm': False, 'lr': 9.922332281797225e-05, 'weight_decay': 1.2207382641083778e-06, 'epochs': 257, 'loss': 'mae', 'optimizer': 'adam', 'graph_mode': 'off', 'use_snp_selection': False}. Best is trial 45 with value: 0.1041517699556937.
[I 2025-12-05 14:36:01,733] Trial 111 finished with value: 0.10997558096353947 and parameters: {'model_type': 'mlp', 'hidden_dims': '[256, 128]', 'dropout': 0.19679334113262725, 'batch_norm': False, 'lr': 0.0002755158811440876, 'weight_decay': 2.9650470353421607e-06, 'epochs': 284, 'loss': 'mae', 'optimizer': 'adam', 'graph_mode': 'off', 'use_snp_selection': False}. Best is trial 111 with value: 0.10997558096353947.
