[I 2025-12-05 16:12:43,164] Trial 17 finished with value: 0.015267042866812198 and parameters: {'model_type': 'mlp', 'hidden_dims': '[128, 64]', 'dropout': 0.5029508764276859, 'batch_norm': True, 'lr': 1.7075459989479874e-05, 'weight_decay': 3.6954002645349686e-06, 'epochs': 287, 'loss': 'mse', 'optimizer': 'adam', 'graph_mode': 'off', 'use_snp_selection': False}. Best is trial 15 with value: 0.11091910312757376.
[I 2025-12-05 16:12:47,055] Trial 18 finished with value: 0.05104674739009835 and parameters: {'model_type': 'mlp', 'hidden_dims': '[512, 256]', 'dropout': 0.18666334338261442, 'batch_norm': False, 'lr': 0.000990842629404931, 'weight_decay': 2.855598826329304e-07, 'epochs': 283, 'loss': 'mae', 'optimizer': 'adam', 'graph_mode': 'off', 'use_snp_selection': True, 'num_snps': 58241}. Best is trial 15 with value: 0.11091910312757376.
[I 2025-12-05 16:12:48,038] Trial 19 finished with value: 0.08698116981552069 and parameters: {'model_type': 'mlp', 'hidden_dims': '[256, 128, 64]', 'dropout': 0.31360174192324075, 'batch_norm': True, 'lr': 0.00014334793979738487, 'weight_decay': 1.586826200758918e-06, 'epochs': 119, 'loss': 'mse', 'optimizer': 'adam', 'graph_mode': 'off', 'use_snp_selection': False}. Best is trial 15 with value: 0.11091910312757376.
[I 2025-12-05 16:12:48,947] Trial 20 finished with value: 0.0296546770780264 and parameters: {'model_type': 'mlp', 'hidden_dims': '[128, 64]', 'dropout': 0.2333704671534715, 'batch_norm': True, 'lr': 2.1084638038713785e-05, 'weight_decay': 2.698347425508657e-07, 'epochs': 209, 'loss': 'mse', 'optimizer': 'adam', 'graph_mode': 'off', 'use_snp_selection': False}. Best is trial 15 with value: 0.11091910312757376.
[I 2025-12-05 16:12:51,173] Trial 21 finished with value: 0.09960219213867402 and parameters: {'model_type': 'mlp', 'hidden_dims': '[512, 128]', 'dropout': 0.10123371976289115, 'batch_norm': True, 'lr': 0.0004837833650814961, 'weight_decay': 1.096365594589293e-07, 'epochs': 257, 'loss': 'mae', 'optimizer': 'adam', 'graph_mode': 'off', 'use_snp_selection': False}. Best is trial 15 with value: 0.11091910312757376.
[I 2025-12-05 16:12:53,191] Trial 22 finished with value: 0.10851517549327805 and parameters: {'model_type': 'mlp', 'hidden_dims': '[512, 128]', 'dropout': 0.14577633173610025, 'batch_norm': True, 'lr': 0.0009148532821511736, 'weight_decay': 2.44793957672376e-07, 'epochs': 220, 'loss': 'mae', 'optimizer': 'adam', 'graph_mode': 'off', 'use_snp_selection': False}. Best is trial 15 with value: 0.11091910312757376.
[I 2025-12-05 16:12:54,034] Trial 23 finished with value: 0.10358957057319124 and parameters: {'model_type': 'mlp', 'hidden_dims': '[128, 64]', 'dropout': 0.16334751262877475, 'batch_norm': True, 'lr': 0.0009556463210935803, 'weight_decay': 1.0330916997198744e-06, 'epochs': 171, 'loss': 'mae', 'optimizer': 'adam', 'graph_mode': 'off', 'use_snp_selection': False}. Best is trial 15 with value: 0.11091910312757376.
[I 2025-12-05 16:12:56,019] Trial 24 finished with value: 0.09572736055398823 and parameters: {'model_type': 'mlp', 'hidden_dims': '[512, 128]', 'dropout': 0.14331248824847015, 'batch_norm': True, 'lr': 0.00034275588644047905, 'weight_decay': 3.079400158314276e-07, 'epochs': 223, 'loss': 'mae', 'optimizer': 'adam', 'graph_mode': 'off', 'use_snp_selection': False}. Best is trial 15 with value: 0.11091910312757376.
[I 2025-12-05 16:12:58,471] Trial 25 finished with value: 0.1016670054667626 and parameters: {'model_type': 'mlp', 'hidden_dims': '[512, 256]', 'dropout': 0.1859606717259252, 'batch_norm': True, 'lr': 0.00011096085242131185, 'weight_decay': 4.32614069125766e-06, 'epochs': 304, 'loss': 'mae', 'optimizer': 'adam', 'graph_mode': 'off', 'use_snp_selection': False}. Best is trial 15 with value: 0.11091910312757376.
[I 2025-12-05 16:12:59,566] Trial 26 finished with value: 0.057321070594599975 and parameters: {'model_type': 'mlp', 'hidden_dims': '[256, 128, 64]', 'dropout': 0.13635930298458102, 'batch_norm': True, 'lr': 0.00027455243899656437, 'weight_decay': 4.870377976730247e-07, 'epochs': 179, 'loss': 'mae', 'optimizer': 'adam', 'graph_mode': 'off', 'use_snp_selection': True, 'num_snps': 3842}. Best is trial 15 with value: 0.11091910312757376.
[I 2025-12-05 16:13:00,905] Trial 27 finished with value: 0.07352458120862855 and parameters: {'model_type': 'mlp', 'hidden_dims': '[256, 128]', 'dropout': 0.34418779240099373, 'batch_norm': False, 'lr': 0.0003562678027953083, 'weight_decay': 2.236346922689874e-07, 'epochs': 262, 'loss': 'mae', 'optimizer': 'adam', 'graph_mode': 'off', 'use_snp_selection': False}. Best is trial 15 with value: 0.11091910312757376.
[I 2025-12-05 16:13:01,994] Trial 28 finished with value: 0.10975031235267478 and parameters: {'model_type': 'mlp', 'hidden_dims': '[128, 64]', 'dropout': 0.219196935871986, 'batch_norm': True, 'lr': 0.000993276838701808, 'weight_decay': 1.8925268542868328e-06, 'epochs': 344, 'loss': 'mse', 'optimizer': 'adam', 'graph_mode': 'off', 'use_snp_selection': False}. Best is trial 15 with value: 0.11091910312757376.
[I 2025-12-05 16:13:03,750] Trial 29 finished with value: 0.06597693561531599 and parameters: {'model_type': 'mlp', 'hidden_dims': '[128, 64]', 'dropout': 0.20223303089763892, 'batch_norm': True, 'lr': 0.00010901845631456741, 'weight_decay': 5.5227103357724904e-05, 'epochs': 344, 'loss': 'mse', 'optimizer': 'adam', 'graph_mode': 'off', 'use_snp_selection': True, 'num_snps': 19468}. Best is trial 15 with value: 0.11091910312757376.
[I 2025-12-05 16:13:04,819] Trial 30 finished with value: 0.09224719441387833 and parameters: {'model_type': 'mlp', 'hidden_dims': '[128, 64]', 'dropout': 0.2523135802350327, 'batch_norm': True, 'lr': 0.00038558581625409126, 'weight_decay': 1.9169137375858258e-06, 'epochs': 328, 'loss': 'mse', 'optimizer': 'adam', 'graph_mode': 'off', 'use_snp_selection': False}. Best is trial 15 with value: 0.11091910312757376.
[I 2025-12-05 16:13:05,929] Trial 31 finished with value: 0.09530777843102654 and parameters: {'model_type': 'mlp', 'hidden_dims': '[128, 64]', 'dropout': 0.17267760325074633, 'batch_norm': True, 'lr': 0.0007713450079097099, 'weight_decay': 6.966831906143906e-07, 'epochs': 350, 'loss': 'mse', 'optimizer': 'adam', 'graph_mode': 'off', 'use_snp_selection': False}. Best is trial 15 with value: 0.11091910312757376.
[I 2025-12-05 16:13:06,960] Trial 32 finished with value: 0.09471207364111675 and parameters: {'model_type': 'mlp', 'hidden_dims': '[128, 64]', 'dropout': 0.12530905978781628, 'batch_norm': True, 'lr': 0.0006107469915586993, 'weight_decay': 1.859135779373866e-07, 'epochs': 302, 'loss': 'mse', 'optimizer': 'adam', 'graph_mode': 'off', 'use_snp_selection': False}. Best is trial 15 with value: 0.11091910312757376.
[I 2025-12-05 16:13:08,991] Trial 33 finished with value: 0.09857804756283627 and parameters: {'model_type': 'mlp', 'hidden_dims': '[512, 128]', 'dropout': 0.20920805569287942, 'batch_norm': True, 'lr': 0.0009667687956613859, 'weight_decay': 4.0351947932246816e-07, 'epochs': 222, 'loss': 'mae', 'optimizer': 'adam', 'graph_mode': 'off', 'use_snp_selection': False}. Best is trial 15 with value: 0.11091910312757376.
[I 2025-12-05 16:13:09,993] Trial 34 finished with value: 0.04039018598808737 and parameters: {'model_type': 'mlp', 'hidden_dims': '[128, 64]', 'dropout': 0.1231939640777123, 'batch_norm': True, 'lr': 6.003623229413168e-06, 'weight_decay': 7.689750603572956e-06, 'epochs': 271, 'loss': 'mse', 'optimizer': 'adam', 'graph_mode': 'off', 'use_snp_selection': False}. Best is trial 15 with value: 0.11091910312757376.
[I 2025-12-05 16:13:11,412] Trial 35 finished with value: 0.08092354266226934 and parameters: {'model_type': 'mlp', 'hidden_dims': '[256, 128, 64]', 'dropout': 0.16877605672889634, 'batch_norm': False, 'lr': 0.0004298526536256108, 'weight_decay': 1.1425069690503316e-06, 'epochs': 293, 'loss': 'mae', 'optimizer': 'adam', 'graph_mode': 'off', 'use_snp_selection': False}. Best is trial 15 with value: 0.11091910312757376.
[I 2025-12-05 16:13:14,444] Trial 36 finished with value: 0.08423126833363831 and parameters: {'model_type': 'mlp', 'hidden_dims': '[256, 128]', 'dropout': 0.23977607536842238, 'batch_norm': True, 'lr': 0.0007280753354527588, 'weight_decay': 1.9171332222634427e-07, 'epochs': 328, 'loss': 'mse', 'optimizer': 'adam', 'graph_mode': 'off', 'use_snp_selection': True, 'num_snps': 58661}. Best is trial 15 with value: 0.11091910312757376.
[I 2025-12-05 16:13:16,534] Trial 37 finished with value: 0.09415328738589714 and parameters: {'model_type': 'mlp', 'hidden_dims': '[512, 64]', 'dropout': 0.12808352088345104, 'batch_norm': True, 'lr': 0.0002972994242315354, 'weight_decay': 7.01974621474349e-06, 'epochs': 236, 'loss': 'mae', 'optimizer': 'adam', 'graph_mode': 'off', 'use_snp_selection': False}. Best is trial 15 with value: 0.11091910312757376.
[I 2025-12-05 16:13:18,139] Trial 38 finished with value: 0.0566253461171634 and parameters: {'model_type': 'mlp', 'hidden_dims': '[512, 128]', 'dropout': 0.4634843905908045, 'batch_norm': False, 'lr': 1.0498564952391943e-05, 'weight_decay': 2.174804806843992e-06, 'epochs': 159, 'loss': 'mse', 'optimizer': 'adam', 'graph_mode': 'off', 'use_snp_selection': True, 'num_snps': 19911}. Best is trial 15 with value: 0.11091910312757376.
[I 2025-12-05 16:13:19,223] Trial 39 finished with value: 0.08777977836412865 and parameters: {'model_type': 'mlp', 'hidden_dims': '[128, 64]', 'dropout': 0.15883078530349068, 'batch_norm': True, 'lr': 8.432799946389163e-05, 'weight_decay': 4.4614131559715145e-05, 'epochs': 318, 'loss': 'mae', 'optimizer': 'adam', 'graph_mode': 'off', 'use_snp_selection': False}. Best is trial 15 with value: 0.11091910312757376.
[I 2025-12-05 16:13:21,068] Trial 40 finished with value: 0.10752896600625388 and parameters: {'model_type': 'mlp', 'hidden_dims': '[512, 256]', 'dropout': 0.26865493192131673, 'batch_norm': True, 'lr': 0.0006669882205604788, 'weight_decay': 5.089048377862908e-07, 'epochs': 190, 'loss': 'mse', 'optimizer': 'adam', 'graph_mode': 'off', 'use_snp_selection': False}. Best is trial 15 with value: 0.11091910312757376.
[I 2025-12-05 16:13:22,929] Trial 41 finished with value: 0.011281697950199187 and parameters: {'model_type': 'mlp', 'hidden_dims': '[512, 256]', 'dropout': 0.19722839971686992, 'batch_norm': True, 'lr': 2.320370617557869e-06, 'weight_decay': 5.469683639642904e-07, 'epochs': 196, 'loss': 'mse', 'optimizer': 'adam', 'graph_mode': 'off', 'use_snp_selection': False}. Best is trial 15 with value: 0.11091910312757376.
[I 2025-12-05 16:13:24,462] Trial 42 finished with value: 0.07936352528772081 and parameters: {'model_type': 'mlp', 'hidden_dims': '[512, 256]', 'dropout': 0.27359010286449453, 'batch_norm': True, 'lr': 0.0006737022093626234, 'weight_decay': 1.0409214020964031e-06, 'epochs': 136, 'loss': 'mse', 'optimizer': 'adam', 'graph_mode': 'off', 'use_snp_selection': False}. Best is trial 15 with value: 0.11091910312757376.
[I 2025-12-05 16:13:26,295] Trial 43 finished with value: 0.10572818710675588 and parameters: {'model_type': 'mlp', 'hidden_dims': '[512, 256]', 'dropout': 0.10209844361435547, 'batch_norm': True, 'lr': 0.0004842487121438225, 'weight_decay': 1.5765283022555525e-07, 'epochs': 188, 'loss': 'mse', 'optimizer': 'adam', 'graph_mode': 'off', 'use_snp_selection': False}. Best is trial 15 with value: 0.11091910312757376.
[I 2025-12-05 16:13:28,302] Trial 44 finished with value: 0.09753871105312141 and parameters: {'model_type': 'mlp', 'hidden_dims': '[512, 64]', 'dropout': 0.21679003280709547, 'batch_norm': True, 'lr': 3.414897632450377e-05, 'weight_decay': 4.147822366540187e-07, 'epochs': 222, 'loss': 'mse', 'optimizer': 'adam', 'graph_mode': 'off', 'use_snp_selection': False}. Best is trial 15 with value: 0.11091910312757376.
[I 2025-12-05 16:13:29,987] Trial 45 finished with value: 0.08585479098673149 and parameters: {'model_type': 'mlp', 'hidden_dims': '[512, 128]', 'dropout': 0.3611621926781241, 'batch_norm': True, 'lr': 0.0002300226355390722, 'weight_decay': 6.931970740669483e-07, 'epochs': 165, 'loss': 'mse', 'optimizer': 'adam', 'graph_mode': 'off', 'use_snp_selection': False}. Best is trial 15 with value: 0.11091910312757376.
[I 2025-12-05 16:13:32,103] Trial 46 finished with value: 0.09136077976932458 and parameters: {'model_type': 'mlp', 'hidden_dims': '[512, 256]', 'dropout': 0.32007625902818015, 'batch_norm': True, 'lr': 0.0007651055513051968, 'weight_decay': 2.850616209924763e-07, 'epochs': 247, 'loss': 'mse', 'optimizer': 'adam', 'graph_mode': 'off', 'use_snp_selection': False}. Best is trial 15 with value: 0.11091910312757376.
[I 2025-12-05 16:13:32,820] Trial 47 finished with value: 0.027987791368486108 and parameters: {'model_type': 'mlp', 'hidden_dims': '[256, 128]', 'dropout': 0.28667142641212684, 'batch_norm': False, 'lr': 0.000538452439705902, 'weight_decay': 1.6777036893524075e-07, 'epochs': 44, 'loss': 'mae', 'optimizer': 'adam', 'graph_mode': 'off', 'use_snp_selection': False}. Best is trial 15 with value: 0.11091910312757376.
[I 2025-12-05 16:13:35,126] Trial 48 finished with value: 0.09837446828391141 and parameters: {'model_type': 'mlp', 'hidden_dims': '[512, 128]', 'dropout': 0.25478809445328215, 'batch_norm': True, 'lr': 0.0001543018270987969, 'weight_decay': 0.0006963874766430621, 'epochs': 273, 'loss': 'mse', 'optimizer': 'adam', 'graph_mode': 'off', 'use_snp_selection': False}. Best is trial 15 with value: 0.11091910312757376.
[I 2025-12-05 16:13:38,086] Trial 49 finished with value: 0.1092994688223246 and parameters: {'model_type': 'mlp', 'hidden_dims': '[512, 128]', 'dropout': 0.1503253946043684, 'batch_norm': True, 'lr': 0.0009513813662773798, 'weight_decay': 1.3255341366241583e-06, 'epochs': 187, 'loss': 'mae', 'optimizer': 'adam', 'graph_mode': 'off', 'use_snp_selection': True, 'num_snps': 46888}. Best is trial 15 with value: 0.11091910312757376.
[I 2025-12-05 16:13:40,708] Trial 50 finished with value: 0.09774843583118284 and parameters: {'model_type': 'mlp', 'hidden_dims': '[512, 128]', 'dropout': 0.11978810277646827, 'batch_norm': True, 'lr': 0.0009251543454345152, 'weight_decay': 3.099914574201832e-06, 'epochs': 133, 'loss': 'mae', 'optimizer': 'adam', 'graph_mode': 'off', 'use_snp_selection': True, 'num_snps': 46345}. Best is trial 15 with value: 0.11091910312757376.
[I 2025-12-05 16:13:43,541] Trial 51 finished with value: 0.10538170901198828 and parameters: {'model_type': 'mlp', 'hidden_dims': '[512, 128]', 'dropout': 0.14812793599188628, 'batch_norm': True, 'lr': 0.0006021065986694689, 'weight_decay': 9.992826642957497e-07, 'epochs': 187, 'loss': 'mae', 'optimizer': 'adam', 'graph_mode': 'off', 'use_snp_selection': True, 'num_snps': 47105}. Best is trial 15 with value: 0.11091910312757376.
[I 2025-12-05 16:13:45,237] Trial 52 finished with value: 0.09164085015894921 and parameters: {'model_type': 'mlp', 'hidden_dims': '[512, 128]', 'dropout': 0.18317024489733186, 'batch_norm': True, 'lr': 0.0004255468716384263, 'weight_decay': 1.4536088713889519e-06, 'epochs': 213, 'loss': 'mae', 'optimizer': 'adam', 'graph_mode': 'off', 'use_snp_selection': True, 'num_snps': 22057}. Best is trial 15 with value: 0.11091910312757376.
[I 2025-12-05 16:13:47,632] Trial 53 finished with value: 0.09242660268161182 and parameters: {'model_type': 'mlp', 'hidden_dims': '[512, 128]', 'dropout': 0.22974953380241575, 'batch_norm': True, 'lr': 0.0008000299022437049, 'weight_decay': 3.953291199620747e-07, 'epochs': 197, 'loss': 'mae', 'optimizer': 'adam', 'graph_mode': 'off', 'use_snp_selection': True, 'num_snps': 37397}. Best is trial 15 with value: 0.11091910312757376.
[I 2025-12-05 16:13:49,903] Trial 54 finished with value: 0.08631509868067909 and parameters: {'model_type': 'mlp', 'hidden_dims': '[128, 64]', 'dropout': 0.15881497364279287, 'batch_norm': True, 'lr': 0.00030213758331965957, 'weight_decay': 5.823449119237367e-07, 'epochs': 156, 'loss': 'mae', 'optimizer': 'adam', 'graph_mode': 'off', 'use_snp_selection': True, 'num_snps': 51553}. Best is trial 15 with value: 0.11091910312757376.
[I 2025-12-05 16:13:51,261] Trial 55 finished with value: 0.09142813757865834 and parameters: {'model_type': 'mlp', 'hidden_dims': '[512, 128]', 'dropout': 0.1156837838658708, 'batch_norm': True, 'lr': 0.0005722280225057521, 'weight_decay': 1.6185264382401898e-05, 'epochs': 80, 'loss': 'mse', 'optimizer': 'adam', 'graph_mode': 'off', 'use_snp_selection': False}. Best is trial 15 with value: 0.11091910312757376.
[I 2025-12-05 16:13:53,316] Trial 56 finished with value: 0.08103523977837854 and parameters: {'model_type': 'mlp', 'hidden_dims': '[512, 256]', 'dropout': 0.13895792594093256, 'batch_norm': True, 'lr': 0.00019740957725030117, 'weight_decay': 2.5066820305112214e-07, 'epochs': 226, 'loss': 'mae', 'optimizer': 'adam', 'graph_mode': 'off', 'use_snp_selection': False}. Best is trial 15 with value: 0.11091910312757376.
[I 2025-12-05 16:13:54,469] Trial 57 finished with value: 0.09702772200017401 and parameters: {'model_type': 'mlp', 'hidden_dims': '[256, 128, 64]', 'dropout': 0.17177211623185126, 'batch_norm': True, 'lr': 0.0009901148949697423, 'weight_decay': 1.2950641808435564e-07, 'epochs': 177, 'loss': 'mae', 'optimizer': 'adam', 'graph_mode': 'off', 'use_snp_selection': False}. Best is trial 15 with value: 0.11091910312757376.
[I 2025-12-05 16:13:56,438] Trial 58 finished with value: 0.07138646771912452 and parameters: {'model_type': 'mlp', 'hidden_dims': '[512, 64]', 'dropout': 0.1926704647551926, 'batch_norm': False, 'lr': 0.0004209726851980298, 'weight_decay': 4.850442857344727e-06, 'epochs': 208, 'loss': 'mse', 'optimizer': 'adam', 'graph_mode': 'off', 'use_snp_selection': True, 'num_snps': 26798}. Best is trial 15 with value: 0.11091910312757376.
[I 2025-12-05 16:13:57,403] Trial 59 finished with value: 0.11155179944425214 and parameters: {'model_type': 'mlp', 'hidden_dims': '[128, 64]', 'dropout': 0.10120822262060564, 'batch_norm': True, 'lr': 0.0007370054935123828, 'weight_decay': 3.433585950979029e-07, 'epochs': 253, 'loss': 'mae', 'optimizer': 'adam', 'graph_mode': 'off', 'use_snp_selection': False}. Best is trial 59 with value: 0.11155179944425214.
[I 2025-12-05 16:13:58,312] Trial 60 finished with value: 0.09602584526598387 and parameters: {'model_type': 'mlp', 'hidden_dims': '[128, 64]', 'dropout': 0.10253384786157696, 'batch_norm': True, 'lr': 0.0002801708014803219, 'weight_decay': 2.3945687857858514e-06, 'epochs': 238, 'loss': 'mae', 'optimizer': 'adam', 'graph_mode': 'off', 'use_snp_selection': False}. Best is trial 59 with value: 0.11155179944425214.
[I 2025-12-05 16:13:59,262] Trial 61 finished with value: 0.08022608553776507 and parameters: {'model_type': 'mlp', 'hidden_dims': '[128, 64]', 'dropout': 0.1424023459667511, 'batch_norm': True, 'lr': 0.0007636330493516573, 'weight_decay': 3.3123246744035336e-07, 'epochs': 268, 'loss': 'mae', 'optimizer': 'adam', 'graph_mode': 'off', 'use_snp_selection': False}. Best is trial 59 with value: 0.11155179944425214.
[I 2025-12-05 16:14:00,190] Trial 62 finished with value: 0.0819697193740016 and parameters: {'model_type': 'mlp', 'hidden_dims': '[128, 64]', 'dropout': 0.12164576366980946, 'batch_norm': True, 'lr': 0.0005559400314181573, 'weight_decay': 7.123106091777703e-07, 'epochs': 245, 'loss': 'mae', 'optimizer': 'adam', 'graph_mode': 'off', 'use_snp_selection': False}. Best is trial 59 with value: 0.11155179944425214.
[I 2025-12-05 16:14:01,111] Trial 63 finished with value: 0.10192631787299845 and parameters: {'model_type': 'mlp', 'hidden_dims': '[128, 64]', 'dropout': 0.13638308031083796, 'batch_norm': True, 'lr': 0.0006584834472454979, 'weight_decay': 2.092415855482002e-07, 'epochs': 230, 'loss': 'mae', 'optimizer': 'adam', 'graph_mode': 'off', 'use_snp_selection': False}. Best is trial 59 with value: 0.11155179944425214.
[I 2025-12-05 16:14:03,261] Trial 64 finished with value: 0.10351798612979989 and parameters: {'model_type': 'mlp', 'hidden_dims': '[512, 128]', 'dropout': 0.10238471124200771, 'batch_norm': True, 'lr': 0.0009873503610240437, 'weight_decay': 1.4619549876615256e-06, 'epochs': 254, 'loss': 'mae', 'optimizer': 'adam', 'graph_mode': 'off', 'use_snp_selection': False}. Best is trial 59 with value: 0.11155179944425214.
[I 2025-12-05 16:14:04,129] Trial 65 finished with value: 0.08942217780530373 and parameters: {'model_type': 'mlp', 'hidden_dims': '[128, 64]', 'dropout': 0.15401679560990522, 'batch_norm': True, 'lr': 0.0003742537036355596, 'weight_decay': 4.922576106326886e-07, 'epochs': 214, 'loss': 'mse', 'optimizer': 'adam', 'graph_mode': 'off', 'use_snp_selection': False}. Best is trial 59 with value: 0.11155179944425214.
[I 2025-12-05 16:14:05,300] Trial 66 finished with value: 0.09747274974384185 and parameters: {'model_type': 'mlp', 'hidden_dims': '[256, 128]', 'dropout': 0.1802273027264213, 'batch_norm': True, 'lr': 0.00046856021211976536, 'weight_decay': 3.115287588545585e-07, 'epochs': 203, 'loss': 'mae', 'optimizer': 'adam', 'graph_mode': 'off', 'use_snp_selection': False}. Best is trial 59 with value: 0.11155179944425214.
[I 2025-12-05 16:14:07,126] Trial 67 finished with value: 0.08043852701742765 and parameters: {'model_type': 'mlp', 'hidden_dims': '[512, 128]', 'dropout': 0.11793750192119591, 'batch_norm': True, 'lr': 0.0008009128563298108, 'weight_decay': 1.365709798694381e-07, 'epochs': 188, 'loss': 'mse', 'optimizer': 'adam', 'graph_mode': 'off', 'use_snp_selection': False}. Best is trial 59 with value: 0.11155179944425214.
[I 2025-12-05 16:14:09,413] Trial 68 finished with value: 0.10943470078559497 and parameters: {'model_type': 'mlp', 'hidden_dims': '[128, 64]', 'dropout': 0.20298735532590173, 'batch_norm': True, 'lr': 0.0006322378053127331, 'weight_decay': 9.188394654542319e-07, 'epochs': 281, 'loss': 'mae', 'optimizer': 'adam', 'graph_mode': 'off', 'use_snp_selection': True, 'num_snps': 38939}. Best is trial 59 with value: 0.11155179944425214.
