[I 2025-12-05 16:19:56,420] Trial 126 finished with value: 0.00774287061536812 and parameters: {'model_type': 'mlp', 'hidden_dims': '[256, 128, 64]', 'dropout': 0.48741056270819966, 'batch_norm': False, 'lr': 1.1017339604164697e-05, 'weight_decay': 7.428156615688847e-06, 'epochs': 299, 'loss': 'mae', 'optimizer': 'adam', 'graph_mode': 'off', 'use_snp_selection': False}. Best is trial 39 with value: 0.06766369665432428.
[I 2025-12-05 16:19:58,244] Trial 127 finished with value: 0.017461424419304275 and parameters: {'model_type': 'mlp', 'hidden_dims': '[512, 128]', 'dropout': 0.5983605318225237, 'batch_norm': True, 'lr': 1.6115437981930286e-05, 'weight_decay': 1.1656246684284914e-05, 'epochs': 250, 'loss': 'mae', 'optimizer': 'adam', 'graph_mode': 'off', 'use_snp_selection': False}. Best is trial 39 with value: 0.06766369665432428.
[I 2025-12-05 16:19:59,981] Trial 128 finished with value: 0.05505056472146833 and parameters: {'model_type': 'mlp', 'hidden_dims': '[512, 256]', 'dropout': 0.4603365846180122, 'batch_norm': False, 'lr': 3.4983815403135557e-06, 'weight_decay': 4.481748320783615e-06, 'epochs': 232, 'loss': 'mae', 'optimizer': 'adam', 'graph_mode': 'off', 'use_snp_selection': False}. Best is trial 39 with value: 0.06766369665432428.
[I 2025-12-05 16:20:01,716] Trial 129 finished with value: 0.009235460890256663 and parameters: {'model_type': 'mlp', 'hidden_dims': '[512, 256]', 'dropout': 0.46344460862141723, 'batch_norm': False, 'lr': 3.2289382844579264e-06, 'weight_decay': 2.5212318733290596e-06, 'epochs': 232, 'loss': 'mae', 'optimizer': 'adam', 'graph_mode': 'off', 'use_snp_selection': False}. Best is trial 39 with value: 0.06766369665432428.
[I 2025-12-05 16:20:02,889] Trial 130 finished with value: 0.007672152379574668 and parameters: {'model_type': 'mlp', 'hidden_dims': '[512, 256]', 'dropout': 0.4747848477976088, 'batch_norm': False, 'lr': 1.940315703058623e-06, 'weight_decay': 4.069407202024437e-06, 'epochs': 98, 'loss': 'mae', 'optimizer': 'adam', 'graph_mode': 'off', 'use_snp_selection': False}. Best is trial 39 with value: 0.06766369665432428.
[I 2025-12-05 16:20:04,688] Trial 131 finished with value: 0.032419124571515745 and parameters: {'model_type': 'mlp', 'hidden_dims': '[512, 256]', 'dropout': 0.4333587924440772, 'batch_norm': False, 'lr': 4.308337866719712e-06, 'weight_decay': 0.0004438319799318286, 'epochs': 240, 'loss': 'mae', 'optimizer': 'adam', 'graph_mode': 'off', 'use_snp_selection': False}. Best is trial 39 with value: 0.06766369665432428.
[I 2025-12-05 16:20:06,648] Trial 132 finished with value: 0.06485921918757362 and parameters: {'model_type': 'mlp', 'hidden_dims': '[512, 256]', 'dropout': 0.45264437280175657, 'batch_norm': False, 'lr': 2.113765725403638e-06, 'weight_decay': 8.06752703746129e-06, 'epochs': 282, 'loss': 'mae', 'optimizer': 'adam', 'graph_mode': 'off', 'use_snp_selection': False}. Best is trial 39 with value: 0.06766369665432428.
[I 2025-12-05 16:20:08,611] Trial 133 finished with value: 0.03603096104380041 and parameters: {'model_type': 'mlp', 'hidden_dims': '[512, 256]', 'dropout': 0.45535940054368157, 'batch_norm': False, 'lr': 2.3380152776675057e-06, 'weight_decay': 4.424010849933315e-06, 'epochs': 284, 'loss': 'mae', 'optimizer': 'adam', 'graph_mode': 'off', 'use_snp_selection': False}. Best is trial 39 with value: 0.06766369665432428.
[I 2025-12-05 16:20:10,496] Trial 134 finished with value: 0.04404589171777172 and parameters: {'model_type': 'mlp', 'hidden_dims': '[512, 256]', 'dropout': 0.44535872002273924, 'batch_norm': False, 'lr': 1.4759049463938503e-06, 'weight_decay': 0.0006112183937510826, 'epochs': 266, 'loss': 'mae', 'optimizer': 'adam', 'graph_mode': 'off', 'use_snp_selection': False}. Best is trial 39 with value: 0.06766369665432428.
[I 2025-12-05 16:20:12,436] Trial 135 finished with value: 0.028257913788091837 and parameters: {'model_type': 'mlp', 'hidden_dims': '[512, 256]', 'dropout': 0.561508322697829, 'batch_norm': False, 'lr': 1.7244717520362092e-06, 'weight_decay': 5.602513712003737e-06, 'epochs': 279, 'loss': 'mae', 'optimizer': 'adam', 'graph_mode': 'off', 'use_snp_selection': False}. Best is trial 39 with value: 0.06766369665432428.
[I 2025-12-05 16:20:14,458] Trial 136 finished with value: 0.04468997395956425 and parameters: {'model_type': 'mlp', 'hidden_dims': '[512, 256]', 'dropout': 0.487011016850049, 'batch_norm': False, 'lr': 1.1166033471021903e-06, 'weight_decay': 7.886821629923246e-06, 'epochs': 292, 'loss': 'mae', 'optimizer': 'adam', 'graph_mode': 'off', 'use_snp_selection': False}. Best is trial 39 with value: 0.06766369665432428.
[I 2025-12-05 16:20:16,367] Trial 137 finished with value: 0.03973356443209009 and parameters: {'model_type': 'mlp', 'hidden_dims': '[512, 256]', 'dropout': 0.5002238016031059, 'batch_norm': False, 'lr': 2.2975734365990353e-06, 'weight_decay': 3.417857413797348e-06, 'epochs': 260, 'loss': 'mae', 'optimizer': 'adam', 'graph_mode': 'off', 'use_snp_selection': False}. Best is trial 39 with value: 0.06766369665432428.
[I 2025-12-05 16:20:17,751] Trial 138 finished with value: 0.08308297080377497 and parameters: {'model_type': 'mlp', 'hidden_dims': '[512, 128]', 'dropout': 0.4683918362984528, 'batch_norm': False, 'lr': 2.606898383248583e-05, 'weight_decay': 0.00014678155483317305, 'epochs': 139, 'loss': 'mae', 'optimizer': 'adam', 'graph_mode': 'off', 'use_snp_selection': False}. Best is trial 138 with value: 0.08308297080377497.
[I 2025-12-05 16:20:19,150] Trial 139 finished with value: 0.04853283938714832 and parameters: {'model_type': 'mlp', 'hidden_dims': '[512, 128]', 'dropout': 0.5353711826928613, 'batch_norm': False, 'lr': 1.9866128206289727e-05, 'weight_decay': 0.00018242474710237548, 'epochs': 143, 'loss': 'mae', 'optimizer': 'adam', 'graph_mode': 'off', 'use_snp_selection': False}. Best is trial 138 with value: 0.08308297080377497.
[I 2025-12-05 16:20:20,484] Trial 140 finished with value: 0.060195520065893585 and parameters: {'model_type': 'mlp', 'hidden_dims': '[512, 64]', 'dropout': 0.11136234177636778, 'batch_norm': False, 'lr': 2.6853446916472293e-05, 'weight_decay': 8.842440129135249e-05, 'epochs': 134, 'loss': 'mae', 'optimizer': 'adam', 'graph_mode': 'off', 'use_snp_selection': False}. Best is trial 138 with value: 0.08308297080377497.
[I 2025-12-05 16:20:21,897] Trial 141 finished with value: 0.028542037951248156 and parameters: {'model_type': 'mlp', 'hidden_dims': '[512, 64]', 'dropout': 0.11345206828189808, 'batch_norm': False, 'lr': 2.2488453566971496e-05, 'weight_decay': 9.621359625583843e-05, 'epochs': 151, 'loss': 'mae', 'optimizer': 'adam', 'graph_mode': 'off', 'use_snp_selection': False}. Best is trial 138 with value: 0.08308297080377497.
[I 2025-12-05 16:20:23,215] Trial 142 finished with value: 0.019753002727952503 and parameters: {'model_type': 'mlp', 'hidden_dims': '[512, 64]', 'dropout': 0.18723018025027244, 'batch_norm': False, 'lr': 3.660991969093234e-05, 'weight_decay': 0.00028970943538160547, 'epochs': 135, 'loss': 'mae', 'optimizer': 'adam', 'graph_mode': 'off', 'use_snp_selection': False}. Best is trial 138 with value: 0.08308297080377497.
[I 2025-12-05 16:20:24,482] Trial 143 finished with value: 0.021909574591644693 and parameters: {'model_type': 'mlp', 'hidden_dims': '[512, 64]', 'dropout': 0.21662283345264155, 'batch_norm': False, 'lr': 2.7181811145841592e-05, 'weight_decay': 0.000138842925059917, 'epochs': 118, 'loss': 'mae', 'optimizer': 'adam', 'graph_mode': 'off', 'use_snp_selection': False}. Best is trial 138 with value: 0.08308297080377497.
[I 2025-12-05 16:20:25,766] Trial 144 finished with value: 0.02510254544036104 and parameters: {'model_type': 'mlp', 'hidden_dims': '[512, 64]', 'dropout': 0.46801185643636795, 'batch_norm': False, 'lr': 2.8305315121660277e-05, 'weight_decay': 0.0001119395635307214, 'epochs': 129, 'loss': 'mae', 'optimizer': 'adam', 'graph_mode': 'off', 'use_snp_selection': False}. Best is trial 138 with value: 0.08308297080377497.
[I 2025-12-05 16:20:26,616] Trial 145 finished with value: 0.02408099217590137 and parameters: {'model_type': 'mlp', 'hidden_dims': '[128, 64]', 'dropout': 0.5484348320854016, 'batch_norm': False, 'lr': 3.090651458652003e-06, 'weight_decay': 7.415076794236015e-05, 'epochs': 223, 'loss': 'mae', 'optimizer': 'adam', 'graph_mode': 'off', 'use_snp_selection': False}. Best is trial 138 with value: 0.08308297080377497.
[I 2025-12-05 16:20:27,837] Trial 146 finished with value: 0.02567687418930392 and parameters: {'model_type': 'mlp', 'hidden_dims': '[512, 256]', 'dropout': 0.4818137435674584, 'batch_norm': False, 'lr': 3.8110337736415345e-05, 'weight_decay': 0.00014469271143423653, 'epochs': 108, 'loss': 'mae', 'optimizer': 'adam', 'graph_mode': 'off', 'use_snp_selection': False}. Best is trial 138 with value: 0.08308297080377497.
[I 2025-12-05 16:20:29,053] Trial 147 finished with value: 0.029434437547692722 and parameters: {'model_type': 'mlp', 'hidden_dims': '[512, 64]', 'dropout': 0.5884810065241829, 'batch_norm': False, 'lr': 0.0005393115392064695, 'weight_decay': 0.00020334250678752058, 'epochs': 162, 'loss': 'mse', 'optimizer': 'adam', 'graph_mode': 'off', 'use_snp_selection': True, 'num_snps': 14336}. Best is trial 138 with value: 0.08308297080377497.
[I 2025-12-05 16:20:30,451] Trial 148 finished with value: 0.06706857156355997 and parameters: {'model_type': 'mlp', 'hidden_dims': '[512, 128]', 'dropout': 0.4672848184414959, 'batch_norm': False, 'lr': 0.0004393774716979016, 'weight_decay': 0.00027046338641491046, 'epochs': 143, 'loss': 'mae', 'optimizer': 'adam', 'graph_mode': 'off', 'use_snp_selection': False}. Best is trial 138 with value: 0.08308297080377497.
[I 2025-12-05 16:20:31,871] Trial 149 finished with value: 0.021681225105858744 and parameters: {'model_type': 'mlp', 'hidden_dims': '[512, 128]', 'dropout': 0.5781778043728948, 'batch_norm': False, 'lr': 0.0003970866647517962, 'weight_decay': 0.00024899867892871577, 'epochs': 150, 'loss': 'mae', 'optimizer': 'adam', 'graph_mode': 'off', 'use_snp_selection': False}. Best is trial 138 with value: 0.08308297080377497.
[I 2025-12-05 16:20:34,071] Trial 0 finished with value: 0.04416762029123357 and parameters: {'model_type': 'mlp', 'hidden_dims': '[128, 64]', 'dropout': 0.199031432379812, 'batch_norm': True, 'lr': 1.8408544111075837e-06, 'weight_decay': 5.5136510071208614e-05, 'epochs': 336, 'loss': 'mae', 'optimizer': 'adam', 'graph_mode': 'off', 'use_snp_selection': True, 'num_snps': 43862}. Best is trial 0 with value: 0.04416762029123357.
[I 2025-12-05 16:20:35,147] Trial 1 finished with value: 0.15153079345144504 and parameters: {'model_type': 'mlp', 'hidden_dims': '[256, 128]', 'dropout': 0.4370668075331726, 'batch_norm': True, 'lr': 7.133471581159139e-05, 'weight_decay': 1.128633586803549e-05, 'epochs': 242, 'loss': 'mae', 'optimizer': 'adam', 'graph_mode': 'off', 'use_snp_selection': False}. Best is trial 1 with value: 0.15153079345144504.
[I 2025-12-05 16:20:36,146] Trial 2 finished with value: 0.03579607742183964 and parameters: {'model_type': 'mlp', 'hidden_dims': '[256, 128, 64]', 'dropout': 0.41314357415569625, 'batch_norm': False, 'lr': 3.952233718592101e-06, 'weight_decay': 0.00026754769258252603, 'epochs': 149, 'loss': 'mse', 'optimizer': 'adam', 'graph_mode': 'off', 'use_snp_selection': True, 'num_snps': 11571}. Best is trial 1 with value: 0.15153079345144504.
[I 2025-12-05 16:20:37,943] Trial 3 finished with value: 0.10428471907799125 and parameters: {'model_type': 'mlp', 'hidden_dims': '[512, 64]', 'dropout': 0.5938127374509361, 'batch_norm': False, 'lr': 5.67704586114731e-06, 'weight_decay': 2.4518087630137052e-05, 'epochs': 320, 'loss': 'mae', 'optimizer': 'adam', 'graph_mode': 'off', 'use_snp_selection': False}. Best is trial 1 with value: 0.15153079345144504.
[I 2025-12-05 16:20:40,005] Trial 4 finished with value: 0.033133658720250134 and parameters: {'model_type': 'mlp', 'hidden_dims': '[512, 128]', 'dropout': 0.25746343592134413, 'batch_norm': True, 'lr': 1.3467657668402788e-06, 'weight_decay': 0.00033087251918647806, 'epochs': 277, 'loss': 'mse', 'optimizer': 'adam', 'graph_mode': 'off', 'use_snp_selection': True, 'num_snps': 36675}. Best is trial 1 with value: 0.15153079345144504.
[I 2025-12-05 16:20:41,821] Trial 5 finished with value: 0.024974706380341934 and parameters: {'model_type': 'mlp', 'hidden_dims': '[512, 64]', 'dropout': 0.38275350994408375, 'batch_norm': True, 'lr': 1.5586664309232824e-06, 'weight_decay': 0.0008227664668621182, 'epochs': 145, 'loss': 'mae', 'optimizer': 'adam', 'graph_mode': 'off', 'use_snp_selection': True, 'num_snps': 32148}. Best is trial 1 with value: 0.15153079345144504.
[I 2025-12-05 16:20:42,813] Trial 6 finished with value: 0.12408148223486982 and parameters: {'model_type': 'mlp', 'hidden_dims': '[256, 128]', 'dropout': 0.3930109900265879, 'batch_norm': False, 'lr': 4.892964372128395e-05, 'weight_decay': 1.5809549317992182e-06, 'epochs': 199, 'loss': 'mse', 'optimizer': 'adam', 'graph_mode': 'off', 'use_snp_selection': False}. Best is trial 1 with value: 0.15153079345144504.
[I 2025-12-05 16:20:43,911] Trial 7 finished with value: 0.1317540672954613 and parameters: {'model_type': 'mlp', 'hidden_dims': '[512, 256]', 'dropout': 0.15343979219678458, 'batch_norm': True, 'lr': 6.234003099047341e-05, 'weight_decay': 3.894760610535477e-07, 'epochs': 97, 'loss': 'mse', 'optimizer': 'adam', 'graph_mode': 'off', 'use_snp_selection': False}. Best is trial 1 with value: 0.15153079345144504.
[I 2025-12-05 16:20:45,738] Trial 8 finished with value: 0.17290552329434974 and parameters: {'model_type': 'mlp', 'hidden_dims': '[512, 128]', 'dropout': 0.10743001231661406, 'batch_norm': True, 'lr': 0.00023728538449271062, 'weight_decay': 1.7629071578048637e-05, 'epochs': 312, 'loss': 'mae', 'optimizer': 'adam', 'graph_mode': 'off', 'use_snp_selection': False}. Best is trial 8 with value: 0.17290552329434974.
[I 2025-12-05 16:20:47,095] Trial 9 finished with value: 0.16865290064028052 and parameters: {'model_type': 'mlp', 'hidden_dims': '[512, 64]', 'dropout': 0.14505336736221927, 'batch_norm': True, 'lr': 5.8619638388111826e-05, 'weight_decay': 6.200156172669308e-07, 'epochs': 175, 'loss': 'mse', 'optimizer': 'adam', 'graph_mode': 'off', 'use_snp_selection': False}. Best is trial 8 with value: 0.17290552329434974.
[I 2025-12-05 16:20:48,008] Trial 10 finished with value: -0.007214235653964923 and parameters: {'model_type': 'mlp', 'hidden_dims': '[512, 128]', 'dropout': 0.2800030442581858, 'batch_norm': False, 'lr': 0.0004919806695968258, 'weight_decay': 2.9953888095455486e-06, 'epochs': 55, 'loss': 'mae', 'optimizer': 'adam', 'graph_mode': 'off', 'use_snp_selection': False}. Best is trial 8 with value: 0.17290552329434974.
[I 2025-12-05 16:20:49,476] Trial 11 finished with value: 0.17096925433164425 and parameters: {'model_type': 'mlp', 'hidden_dims': '[512, 128]', 'dropout': 0.10095648685224448, 'batch_norm': True, 'lr': 0.0003411435764085616, 'weight_decay': 1.2045055692919657e-07, 'epochs': 216, 'loss': 'mse', 'optimizer': 'adam', 'graph_mode': 'off', 'use_snp_selection': False}. Best is trial 8 with value: 0.17290552329434974.
[I 2025-12-05 16:20:51,077] Trial 12 finished with value: 0.17098273113771 and parameters: {'model_type': 'mlp', 'hidden_dims': '[512, 128]', 'dropout': 0.10344600881777158, 'batch_norm': True, 'lr': 0.0006674532614549997, 'weight_decay': 1.3081036432574914e-07, 'epochs': 255, 'loss': 'mae', 'optimizer': 'adam', 'graph_mode': 'off', 'use_snp_selection': False}. Best is trial 8 with value: 0.17290552329434974.
[I 2025-12-05 16:20:52,835] Trial 13 finished with value: 0.18477349904482088 and parameters: {'model_type': 'mlp', 'hidden_dims': '[512, 128]', 'dropout': 0.24294613148916022, 'batch_norm': True, 'lr': 0.00020263148232071683, 'weight_decay': 5.014770300041101e-06, 'epochs': 285, 'loss': 'mae', 'optimizer': 'adam', 'graph_mode': 'off', 'use_snp_selection': False}. Best is trial 13 with value: 0.18477349904482088.
[I 2025-12-05 16:20:54,660] Trial 14 finished with value: 0.17485262654070985 and parameters: {'model_type': 'mlp', 'hidden_dims': '[512, 128]', 'dropout': 0.28397504683850705, 'batch_norm': True, 'lr': 0.00017558188744418174, 'weight_decay': 4.57067734295802e-06, 'epochs': 303, 'loss': 'mae', 'optimizer': 'adam', 'graph_mode': 'off', 'use_snp_selection': False}. Best is trial 13 with value: 0.18477349904482088.
[I 2025-12-05 16:20:55,671] Trial 15 finished with value: 0.13351687075062246 and parameters: {'model_type': 'mlp', 'hidden_dims': '[128, 64]', 'dropout': 0.31126623674851783, 'batch_norm': True, 'lr': 0.0001572871022003765, 'weight_decay': 4.390183213645603e-06, 'epochs': 290, 'loss': 'mae', 'optimizer': 'adam', 'graph_mode': 'off', 'use_snp_selection': False}. Best is trial 13 with value: 0.18477349904482088.
[I 2025-12-05 16:20:57,010] Trial 16 finished with value: 0.09739367503619376 and parameters: {'model_type': 'mlp', 'hidden_dims': '[256, 128, 64]', 'dropout': 0.23252090215536952, 'batch_norm': True, 'lr': 1.2586985041154999e-05, 'weight_decay': 9.813780541295223e-05, 'epochs': 350, 'loss': 'mae', 'optimizer': 'adam', 'graph_mode': 'off', 'use_snp_selection': False}. Best is trial 13 with value: 0.18477349904482088.
[I 2025-12-05 16:20:58,605] Trial 17 finished with value: 0.16265494159486446 and parameters: {'model_type': 'mlp', 'hidden_dims': '[512, 256]', 'dropout': 0.4804441292467301, 'batch_norm': True, 'lr': 0.00012599880027451253, 'weight_decay': 1.3398043894594233e-06, 'epochs': 239, 'loss': 'mae', 'optimizer': 'adam', 'graph_mode': 'off', 'use_snp_selection': False}. Best is trial 13 with value: 0.18477349904482088.
[I 2025-12-05 16:21:01,673] Trial 18 finished with value: 0.15096390345594835 and parameters: {'model_type': 'mlp', 'hidden_dims': '[512, 128]', 'dropout': 0.3386014461927706, 'batch_norm': False, 'lr': 0.0009887104939833925, 'weight_decay': 5.409591144113358e-06, 'epochs': 283, 'loss': 'mae', 'optimizer': 'adam', 'graph_mode': 'off', 'use_snp_selection': True, 'num_snps': 58241}. Best is trial 13 with value: 0.18477349904482088.
[I 2025-12-05 16:21:03,464] Trial 19 finished with value: 0.12446858959768556 and parameters: {'model_type': 'mlp', 'hidden_dims': '[512, 128]', 'dropout': 0.2068077968798162, 'batch_norm': True, 'lr': 1.735184075376246e-05, 'weight_decay': 4.451650358493329e-05, 'epochs': 309, 'loss': 'mae', 'optimizer': 'adam', 'graph_mode': 'off', 'use_snp_selection': False}. Best is trial 13 with value: 0.18477349904482088.
[I 2025-12-05 16:21:05,145] Trial 20 finished with value: 0.10611073319749266 and parameters: {'model_type': 'mlp', 'hidden_dims': '[512, 128]', 'dropout': 0.29419210768836246, 'batch_norm': True, 'lr': 2.554001901615424e-05, 'weight_decay': 7.807406803999786e-06, 'epochs': 267, 'loss': 'mae', 'optimizer': 'adam', 'graph_mode': 'off', 'use_snp_selection': False}. Best is trial 13 with value: 0.18477349904482088.
[I 2025-12-05 16:21:06,961] Trial 21 finished with value: 0.1666528839128976 and parameters: {'model_type': 'mlp', 'hidden_dims': '[512, 128]', 'dropout': 0.17670246540520163, 'batch_norm': True, 'lr': 0.0002392409032040518, 'weight_decay': 9.379600410328287e-06, 'epochs': 309, 'loss': 'mae', 'optimizer': 'adam', 'graph_mode': 'off', 'use_snp_selection': False}. Best is trial 13 with value: 0.18477349904482088.
[I 2025-12-05 16:21:08,787] Trial 22 finished with value: 0.16742448794053205 and parameters: {'model_type': 'mlp', 'hidden_dims': '[512, 128]', 'dropout': 0.23330461483745885, 'batch_norm': True, 'lr': 0.00014450916680181156, 'weight_decay': 2.0194861655161403e-05, 'epochs': 312, 'loss': 'mae', 'optimizer': 'adam', 'graph_mode': 'off', 'use_snp_selection': False}. Best is trial 13 with value: 0.18477349904482088.
[I 2025-12-05 16:21:10,312] Trial 23 finished with value: 0.15581295965009392 and parameters: {'model_type': 'mlp', 'hidden_dims': '[512, 128]', 'dropout': 0.33626142682777654, 'batch_norm': True, 'lr': 0.0003016140254855497, 'weight_decay': 2.0958136363584896e-06, 'epochs': 225, 'loss': 'mae', 'optimizer': 'adam', 'graph_mode': 'off', 'use_snp_selection': False}. Best is trial 13 with value: 0.18477349904482088.
[I 2025-12-05 16:21:12,268] Trial 24 finished with value: 0.18049778293487947 and parameters: {'model_type': 'mlp', 'hidden_dims': '[512, 128]', 'dropout': 0.13707550357917025, 'batch_norm': True, 'lr': 0.00010603285158512833, 'weight_decay': 7.876216464051479e-07, 'epochs': 349, 'loss': 'mae', 'optimizer': 'adam', 'graph_mode': 'off', 'use_snp_selection': False}. Best is trial 13 with value: 0.18477349904482088.
[I 2025-12-05 16:21:14,185] Trial 25 finished with value: 0.1535995527706735 and parameters: {'model_type': 'mlp', 'hidden_dims': '[512, 256]', 'dropout': 0.24825153512199427, 'batch_norm': True, 'lr': 0.00011222314235298908, 'weight_decay': 5.467521862435228e-07, 'epochs': 347, 'loss': 'mae', 'optimizer': 'adam', 'graph_mode': 'off', 'use_snp_selection': False}. Best is trial 13 with value: 0.18477349904482088.
[I 2025-12-05 16:21:15,218] Trial 26 finished with value: 0.16992386399932338 and parameters: {'model_type': 'mlp', 'hidden_dims': '[256, 128]', 'dropout': 0.15771774409526254, 'batch_norm': True, 'lr': 0.00010074882356606814, 'weight_decay': 8.440684044215267e-07, 'epochs': 329, 'loss': 'mae', 'optimizer': 'adam', 'graph_mode': 'off', 'use_snp_selection': True, 'num_snps': 3842}. Best is trial 13 with value: 0.18477349904482088.
[I 2025-12-05 16:21:16,363] Trial 27 finished with value: 0.1679438185445321 and parameters: {'model_type': 'mlp', 'hidden_dims': '[256, 128, 64]', 'dropout': 0.2135486792384293, 'batch_norm': False, 'lr': 3.708794373669967e-05, 'weight_decay': 3.0000453867305273e-07, 'epochs': 296, 'loss': 'mae', 'optimizer': 'adam', 'graph_mode': 'off', 'use_snp_selection': False}. Best is trial 13 with value: 0.18477349904482088.
