[I 2025-12-05 14:26:08,824] Trial 56 finished with value: 0.02438240754084385 and parameters: {'model_type': 'mlp', 'hidden_dims': '[256, 128, 64]', 'dropout': 0.37657730416504565, 'batch_norm': False, 'lr': 2.219818593170418e-05, 'weight_decay': 7.190541526647866e-06, 'epochs': 131, 'loss': 'mse', 'optimizer': 'adam', 'graph_mode': 'off', 'use_snp_selection': False}. Best is trial 2 with value: 0.08225658756223755.
[I 2025-12-05 14:26:11,801] Trial 57 finished with value: 0.055176502333303845 and parameters: {'model_type': 'mlp', 'hidden_dims': '[512, 256]', 'dropout': 0.4990188452360609, 'batch_norm': False, 'lr': 5.736330551197028e-06, 'weight_decay': 1.5320904205913322e-05, 'epochs': 170, 'loss': 'mae', 'optimizer': 'adam', 'graph_mode': 'off', 'use_snp_selection': True, 'num_snps': 49669}. Best is trial 2 with value: 0.08225658756223755.
[I 2025-12-05 14:26:13,610] Trial 58 finished with value: 0.07000842894032938 and parameters: {'model_type': 'mlp', 'hidden_dims': '[256, 128]', 'dropout': 0.4221490394589598, 'batch_norm': False, 'lr': 1.2844049063030258e-05, 'weight_decay': 0.00011642876078847953, 'epochs': 191, 'loss': 'mse', 'optimizer': 'adam', 'graph_mode': 'off', 'use_snp_selection': True, 'num_snps': 28242}. Best is trial 2 with value: 0.08225658756223755.
[I 2025-12-05 14:26:15,511] Trial 59 finished with value: 0.057700368196641066 and parameters: {'model_type': 'mlp', 'hidden_dims': '[256, 128]', 'dropout': 0.42662448797532077, 'batch_norm': False, 'lr': 4.703640054550654e-06, 'weight_decay': 0.0004994938560523906, 'epochs': 187, 'loss': 'mse', 'optimizer': 'adam', 'graph_mode': 'off', 'use_snp_selection': True, 'num_snps': 34448}. Best is trial 2 with value: 0.08225658756223755.
[I 2025-12-05 14:26:17,184] Trial 60 finished with value: 0.059704079456968824 and parameters: {'model_type': 'mlp', 'hidden_dims': '[256, 128]', 'dropout': 0.4660930988145458, 'batch_norm': False, 'lr': 1.1191877267861052e-05, 'weight_decay': 0.00010260243041758465, 'epochs': 156, 'loss': 'mse', 'optimizer': 'adam', 'graph_mode': 'off', 'use_snp_selection': True, 'num_snps': 29929}. Best is trial 2 with value: 0.08225658756223755.
[I 2025-12-05 14:26:18,583] Trial 61 finished with value: 0.05285357070793766 and parameters: {'model_type': 'mlp', 'hidden_dims': '[256, 128]', 'dropout': 0.4217460579783474, 'batch_norm': False, 'lr': 1.55909944637183e-05, 'weight_decay': 8.412741626374917e-06, 'epochs': 223, 'loss': 'mse', 'optimizer': 'adam', 'graph_mode': 'off', 'use_snp_selection': True, 'num_snps': 18555}. Best is trial 2 with value: 0.08225658756223755.
[I 2025-12-05 14:26:20,525] Trial 62 finished with value: 0.04268792688838716 and parameters: {'model_type': 'mlp', 'hidden_dims': '[256, 128]', 'dropout': 0.3918647920252498, 'batch_norm': False, 'lr': 8.873650334251157e-06, 'weight_decay': 1.0520489568880448e-07, 'epochs': 317, 'loss': 'mse', 'optimizer': 'adam', 'graph_mode': 'off', 'use_snp_selection': True, 'num_snps': 28508}. Best is trial 2 with value: 0.08225658756223755.
[I 2025-12-05 14:26:21,844] Trial 63 finished with value: 0.04286660627221917 and parameters: {'model_type': 'mlp', 'hidden_dims': '[256, 128, 64]', 'dropout': 0.36246976665866104, 'batch_norm': False, 'lr': 1.2867459202277507e-05, 'weight_decay': 2.4572627319952097e-06, 'epochs': 179, 'loss': 'mse', 'optimizer': 'adam', 'graph_mode': 'off', 'use_snp_selection': True, 'num_snps': 13061}. Best is trial 2 with value: 0.08225658756223755.
[I 2025-12-05 14:26:23,432] Trial 64 finished with value: 0.04497456731169412 and parameters: {'model_type': 'mlp', 'hidden_dims': '[256, 128, 64]', 'dropout': 0.4545945722567285, 'batch_norm': False, 'lr': 2.146912704875651e-06, 'weight_decay': 6.655938417292973e-05, 'epochs': 197, 'loss': 'mse', 'optimizer': 'adam', 'graph_mode': 'off', 'use_snp_selection': True, 'num_snps': 23264}. Best is trial 2 with value: 0.08225658756223755.
[I 2025-12-05 14:26:24,709] Trial 65 finished with value: 0.03061912520567983 and parameters: {'model_type': 'mlp', 'hidden_dims': '[256, 128]', 'dropout': 0.5221628755655651, 'batch_norm': False, 'lr': 2.4472382038240997e-05, 'weight_decay': 0.00012571994530315647, 'epochs': 116, 'loss': 'mse', 'optimizer': 'adam', 'graph_mode': 'off', 'use_snp_selection': True, 'num_snps': 18287}. Best is trial 2 with value: 0.08225658756223755.
[I 2025-12-05 14:26:26,356] Trial 66 finished with value: 0.03532040218753926 and parameters: {'model_type': 'mlp', 'hidden_dims': '[512, 128]', 'dropout': 0.33131990872224637, 'batch_norm': False, 'lr': 6.8614753973003425e-06, 'weight_decay': 3.665571798541627e-05, 'epochs': 134, 'loss': 'mse', 'optimizer': 'adam', 'graph_mode': 'off', 'use_snp_selection': True, 'num_snps': 25432}. Best is trial 2 with value: 0.08225658756223755.
[I 2025-12-05 14:26:28,047] Trial 67 finished with value: 0.07996749938785984 and parameters: {'model_type': 'mlp', 'hidden_dims': '[256, 128, 64]', 'dropout': 0.4784657755903483, 'batch_norm': False, 'lr': 3.7397909771054844e-06, 'weight_decay': 2.3434372901995588e-05, 'epochs': 48, 'loss': 'mse', 'optimizer': 'adam', 'graph_mode': 'off', 'use_snp_selection': True, 'num_snps': 33138}. Best is trial 2 with value: 0.08225658756223755.
[I 2025-12-05 14:26:29,282] Trial 68 finished with value: 0.07444575760513217 and parameters: {'model_type': 'mlp', 'hidden_dims': '[256, 128, 64]', 'dropout': 0.4761068290629354, 'batch_norm': False, 'lr': 3.6200840779323504e-06, 'weight_decay': 2.383579613284844e-05, 'epochs': 213, 'loss': 'mae', 'optimizer': 'adam', 'graph_mode': 'off', 'use_snp_selection': False}. Best is trial 2 with value: 0.08225658756223755.
[I 2025-12-05 14:26:30,655] Trial 69 finished with value: 0.026306782400342787 and parameters: {'model_type': 'mlp', 'hidden_dims': '[256, 128, 64]', 'dropout': 0.4808558396750168, 'batch_norm': True, 'lr': 3.5809423775661917e-06, 'weight_decay': 2.2131958188350216e-05, 'epochs': 276, 'loss': 'mae', 'optimizer': 'adam', 'graph_mode': 'off', 'use_snp_selection': False}. Best is trial 2 with value: 0.08225658756223755.
[I 2025-12-05 14:26:31,395] Trial 70 finished with value: -0.012320485038088287 and parameters: {'model_type': 'mlp', 'hidden_dims': '[256, 128, 64]', 'dropout': 0.5124282653182856, 'batch_norm': False, 'lr': 1.889163399574219e-06, 'weight_decay': 2.728882677510984e-05, 'epochs': 50, 'loss': 'mae', 'optimizer': 'adam', 'graph_mode': 'off', 'use_snp_selection': False}. Best is trial 2 with value: 0.08225658756223755.
[I 2025-12-05 14:26:32,607] Trial 71 finished with value: 0.05213029674680101 and parameters: {'model_type': 'mlp', 'hidden_dims': '[256, 128, 64]', 'dropout': 0.4806744665982359, 'batch_norm': False, 'lr': 3.014310767244209e-06, 'weight_decay': 1.5873266907373345e-05, 'epochs': 237, 'loss': 'mae', 'optimizer': 'adam', 'graph_mode': 'off', 'use_snp_selection': False}. Best is trial 2 with value: 0.08225658756223755.
[I 2025-12-05 14:26:33,762] Trial 72 finished with value: 0.03294694099135411 and parameters: {'model_type': 'mlp', 'hidden_dims': '[256, 128, 64]', 'dropout': 0.5569518305400875, 'batch_norm': False, 'lr': 4.890881976059374e-06, 'weight_decay': 7.561624059632071e-05, 'epochs': 218, 'loss': 'mae', 'optimizer': 'adam', 'graph_mode': 'off', 'use_snp_selection': False}. Best is trial 2 with value: 0.08225658756223755.
[I 2025-12-05 14:26:34,901] Trial 73 finished with value: 0.07424264233466053 and parameters: {'model_type': 'mlp', 'hidden_dims': '[256, 128, 64]', 'dropout': 0.4439186554382683, 'batch_norm': False, 'lr': 2.242352478925309e-06, 'weight_decay': 0.00032104078219539133, 'epochs': 211, 'loss': 'mae', 'optimizer': 'adam', 'graph_mode': 'off', 'use_snp_selection': False}. Best is trial 2 with value: 0.08225658756223755.
[I 2025-12-05 14:26:36,039] Trial 74 finished with value: 0.060514219062366904 and parameters: {'model_type': 'mlp', 'hidden_dims': '[256, 128, 64]', 'dropout': 0.4478686684154815, 'batch_norm': False, 'lr': 2.343860064300228e-06, 'weight_decay': 1.2081082332102846e-05, 'epochs': 212, 'loss': 'mae', 'optimizer': 'adam', 'graph_mode': 'off', 'use_snp_selection': False}. Best is trial 2 with value: 0.08225658756223755.
[I 2025-12-05 14:26:37,312] Trial 75 finished with value: 0.05900535577715807 and parameters: {'model_type': 'mlp', 'hidden_dims': '[256, 128, 64]', 'dropout': 0.48434374989214485, 'batch_norm': False, 'lr': 1.1943917288911587e-06, 'weight_decay': 0.0009865682263423196, 'epochs': 242, 'loss': 'mae', 'optimizer': 'adam', 'graph_mode': 'off', 'use_snp_selection': False}. Best is trial 2 with value: 0.08225658756223755.
[I 2025-12-05 14:26:38,611] Trial 76 finished with value: 0.013506031607863558 and parameters: {'model_type': 'mlp', 'hidden_dims': '[256, 128, 64]', 'dropout': 0.4067220130551103, 'batch_norm': False, 'lr': 1.670002981839469e-06, 'weight_decay': 0.00033019749276679716, 'epochs': 258, 'loss': 'mae', 'optimizer': 'adam', 'graph_mode': 'off', 'use_snp_selection': False}. Best is trial 2 with value: 0.08225658756223755.
[I 2025-12-05 14:26:39,620] Trial 77 finished with value: 0.05240387136888665 and parameters: {'model_type': 'mlp', 'hidden_dims': '[256, 128, 64]', 'dropout': 0.3140663499788983, 'batch_norm': False, 'lr': 3.978612933805511e-06, 'weight_decay': 0.00018257193320013663, 'epochs': 151, 'loss': 'mae', 'optimizer': 'adam', 'graph_mode': 'off', 'use_snp_selection': False}. Best is trial 2 with value: 0.08225658756223755.
[I 2025-12-05 14:26:40,637] Trial 78 finished with value: 0.003817319077636722 and parameters: {'model_type': 'mlp', 'hidden_dims': '[256, 128, 64]', 'dropout': 0.53196772867967, 'batch_norm': False, 'lr': 2.650265236657546e-06, 'weight_decay': 0.0005495501415648078, 'epochs': 165, 'loss': 'mae', 'optimizer': 'adam', 'graph_mode': 'off', 'use_snp_selection': False}. Best is trial 2 with value: 0.08225658756223755.
[I 2025-12-05 14:26:41,449] Trial 79 finished with value: 0.06618874044053442 and parameters: {'model_type': 'mlp', 'hidden_dims': '[128, 64]', 'dropout': 0.4691995344834856, 'batch_norm': False, 'lr': 6.575589336294781e-06, 'weight_decay': 0.0003903588550706671, 'epochs': 202, 'loss': 'mae', 'optimizer': 'adam', 'graph_mode': 'off', 'use_snp_selection': False}. Best is trial 2 with value: 0.08225658756223755.
[I 2025-12-05 14:26:42,709] Trial 80 finished with value: 0.025792903124950733 and parameters: {'model_type': 'mlp', 'hidden_dims': '[256, 128, 64]', 'dropout': 0.49305700294503113, 'batch_norm': True, 'lr': 3.449180166767778e-06, 'weight_decay': 1.266747052535274e-05, 'epochs': 248, 'loss': 'mae', 'optimizer': 'adam', 'graph_mode': 'off', 'use_snp_selection': False}. Best is trial 2 with value: 0.08225658756223755.
[I 2025-12-05 14:26:45,013] Trial 81 finished with value: 0.028129211629584358 and parameters: {'model_type': 'mlp', 'hidden_dims': '[256, 128, 64]', 'dropout': 0.4276182880530747, 'batch_norm': False, 'lr': 1.8979602492973232e-05, 'weight_decay': 5.207130811243524e-05, 'epochs': 193, 'loss': 'mse', 'optimizer': 'adam', 'graph_mode': 'off', 'use_snp_selection': True, 'num_snps': 40946}. Best is trial 2 with value: 0.08225658756223755.
[I 2025-12-05 14:26:47,011] Trial 82 finished with value: 0.05148378946436061 and parameters: {'model_type': 'mlp', 'hidden_dims': '[256, 128]', 'dropout': 0.4413580251812212, 'batch_norm': False, 'lr': 1.006944644959102e-05, 'weight_decay': 0.000266801915857446, 'epochs': 231, 'loss': 'mse', 'optimizer': 'adam', 'graph_mode': 'off', 'use_snp_selection': True, 'num_snps': 32273}. Best is trial 2 with value: 0.08225658756223755.
[I 2025-12-05 14:26:48,935] Trial 83 finished with value: 0.04842769910167985 and parameters: {'model_type': 'mlp', 'hidden_dims': '[512, 64]', 'dropout': 0.4122554834021001, 'batch_norm': False, 'lr': 5.11974216965052e-06, 'weight_decay': 0.00011063041511785422, 'epochs': 208, 'loss': 'mse', 'optimizer': 'adam', 'graph_mode': 'off', 'use_snp_selection': True, 'num_snps': 28050}. Best is trial 2 with value: 0.08225658756223755.
[I 2025-12-05 14:26:51,675] Trial 84 finished with value: 0.0611608069800741 and parameters: {'model_type': 'mlp', 'hidden_dims': '[512, 256]', 'dropout': 0.4555155317006253, 'batch_norm': False, 'lr': 1.4689232443197046e-06, 'weight_decay': 6.0120494689150705e-06, 'epochs': 184, 'loss': 'mse', 'optimizer': 'adam', 'graph_mode': 'off', 'use_snp_selection': True, 'num_snps': 47188}. Best is trial 2 with value: 0.08225658756223755.
[I 2025-12-05 14:26:53,928] Trial 85 finished with value: 0.06096171907249696 and parameters: {'model_type': 'mlp', 'hidden_dims': '[256, 128, 64]', 'dropout': 0.5109123928446411, 'batch_norm': False, 'lr': 5.6646633845917375e-06, 'weight_decay': 3.1194791492790423e-06, 'epochs': 298, 'loss': 'mse', 'optimizer': 'adam', 'graph_mode': 'off', 'use_snp_selection': True, 'num_snps': 34395}. Best is trial 2 with value: 0.08225658756223755.
[I 2025-12-05 14:26:56,773] Trial 86 finished with value: 0.0494355426630334 and parameters: {'model_type': 'mlp', 'hidden_dims': '[256, 128]', 'dropout': 0.303896616320675, 'batch_norm': False, 'lr': 4.114895824611889e-06, 'weight_decay': 0.0006710399810676971, 'epochs': 175, 'loss': 'mse', 'optimizer': 'adam', 'graph_mode': 'off', 'use_snp_selection': True, 'num_snps': 57770}. Best is trial 2 with value: 0.08225658756223755.
[I 2025-12-05 14:26:58,124] Trial 87 finished with value: 0.05243578090543092 and parameters: {'model_type': 'mlp', 'hidden_dims': '[256, 128, 64]', 'dropout': 0.34206351845332483, 'batch_norm': False, 'lr': 2.535717590199442e-05, 'weight_decay': 0.00018774339166933947, 'epochs': 216, 'loss': 'mse', 'optimizer': 'adam', 'graph_mode': 'off', 'use_snp_selection': True, 'num_snps': 15809}. Best is trial 2 with value: 0.08225658756223755.
[I 2025-12-05 14:26:59,457] Trial 88 finished with value: 0.08537550920671354 and parameters: {'model_type': 'mlp', 'hidden_dims': '[256, 128, 64]', 'dropout': 0.47338751277172253, 'batch_norm': False, 'lr': 7.622973477981949e-06, 'weight_decay': 0.000409263213426356, 'epochs': 109, 'loss': 'mse', 'optimizer': 'adam', 'graph_mode': 'off', 'use_snp_selection': True, 'num_snps': 20032}. Best is trial 88 with value: 0.08537550920671354.
[I 2025-12-05 14:27:00,772] Trial 89 finished with value: 0.02293235783820598 and parameters: {'model_type': 'mlp', 'hidden_dims': '[256, 128, 64]', 'dropout': 0.5759612147477612, 'batch_norm': False, 'lr': 7.63111198318855e-06, 'weight_decay': 0.00043876588771449304, 'epochs': 107, 'loss': 'mse', 'optimizer': 'adam', 'graph_mode': 'off', 'use_snp_selection': True, 'num_snps': 19873}. Best is trial 88 with value: 0.08537550920671354.
[I 2025-12-05 14:27:02,338] Trial 90 finished with value: 0.025946688060551115 and parameters: {'model_type': 'mlp', 'hidden_dims': '[256, 128, 64]', 'dropout': 0.47428738175664015, 'batch_norm': False, 'lr': 2.725645013870927e-06, 'weight_decay': 0.0003248446879984922, 'epochs': 84, 'loss': 'mae', 'optimizer': 'adam', 'graph_mode': 'off', 'use_snp_selection': True, 'num_snps': 23974}. Best is trial 88 with value: 0.08537550920671354.
[I 2025-12-05 14:27:03,987] Trial 91 finished with value: 0.04883693535443387 and parameters: {'model_type': 'mlp', 'hidden_dims': '[256, 128, 64]', 'dropout': 0.43355929903297163, 'batch_norm': False, 'lr': 1.3553625347158918e-05, 'weight_decay': 0.00023744925809228925, 'epochs': 125, 'loss': 'mse', 'optimizer': 'adam', 'graph_mode': 'off', 'use_snp_selection': True, 'num_snps': 26071}. Best is trial 88 with value: 0.08537550920671354.
[I 2025-12-05 14:27:06,132] Trial 92 finished with value: 0.04449194669492954 and parameters: {'model_type': 'mlp', 'hidden_dims': '[256, 128, 64]', 'dropout': 0.38576933814361336, 'batch_norm': False, 'lr': 3.39098194289607e-05, 'weight_decay': 0.00016617359617976144, 'epochs': 138, 'loss': 'mse', 'optimizer': 'adam', 'graph_mode': 'off', 'use_snp_selection': True, 'num_snps': 43250}. Best is trial 88 with value: 0.08537550920671354.
[I 2025-12-05 14:27:07,339] Trial 93 finished with value: 0.04498914377176868 and parameters: {'model_type': 'mlp', 'hidden_dims': '[256, 128]', 'dropout': 0.49029045394017573, 'batch_norm': False, 'lr': 9.156531813722797e-06, 'weight_decay': 0.0005849041179181369, 'epochs': 99, 'loss': 'mse', 'optimizer': 'adam', 'graph_mode': 'off', 'use_snp_selection': True, 'num_snps': 16727}. Best is trial 88 with value: 0.08537550920671354.
[I 2025-12-05 14:27:09,474] Trial 94 finished with value: 0.041893524350289466 and parameters: {'model_type': 'mlp', 'hidden_dims': '[128, 64]', 'dropout': 0.517817118779262, 'batch_norm': False, 'lr': 2.0522797948046625e-05, 'weight_decay': 0.0003611292060933643, 'epochs': 348, 'loss': 'mse', 'optimizer': 'adam', 'graph_mode': 'off', 'use_snp_selection': True, 'num_snps': 39260}. Best is trial 88 with value: 0.08537550920671354.
[I 2025-12-05 14:27:10,790] Trial 95 finished with value: 0.030434949947166 and parameters: {'model_type': 'mlp', 'hidden_dims': '[256, 128, 64]', 'dropout': 0.40107378959069334, 'batch_norm': False, 'lr': 1.9486585349904803e-06, 'weight_decay': 8.923195391885403e-06, 'epochs': 153, 'loss': 'mse', 'optimizer': 'adam', 'graph_mode': 'off', 'use_snp_selection': True, 'num_snps': 14515}. Best is trial 88 with value: 0.08537550920671354.
[I 2025-12-05 14:27:12,271] Trial 96 finished with value: 0.03702184194819917 and parameters: {'model_type': 'mlp', 'hidden_dims': '[256, 128]', 'dropout': 0.4178082520388285, 'batch_norm': False, 'lr': 5.90445330448534e-06, 'weight_decay': 0.0008274839678124658, 'epochs': 146, 'loss': 'mse', 'optimizer': 'adam', 'graph_mode': 'off', 'use_snp_selection': True, 'num_snps': 20296}. Best is trial 88 with value: 0.08537550920671354.
[I 2025-12-05 14:27:14,103] Trial 97 finished with value: 0.0675434264258168 and parameters: {'model_type': 'mlp', 'hidden_dims': '[512, 64]', 'dropout': 0.4664185571353817, 'batch_norm': True, 'lr': 0.0009992428137735015, 'weight_decay': 0.00014770952608598165, 'epochs': 161, 'loss': 'mse', 'optimizer': 'adam', 'graph_mode': 'off', 'use_snp_selection': True, 'num_snps': 26940}. Best is trial 88 with value: 0.08537550920671354.
[I 2025-12-05 14:27:15,033] Trial 98 finished with value: 0.05480207523024809 and parameters: {'model_type': 'mlp', 'hidden_dims': '[256, 128, 64]', 'dropout': 0.45116914504947214, 'batch_norm': False, 'lr': 1.1078420132718674e-05, 'weight_decay': 0.00022553274800539072, 'epochs': 131, 'loss': 'mse', 'optimizer': 'adam', 'graph_mode': 'off', 'use_snp_selection': False}. Best is trial 88 with value: 0.08537550920671354.
[I 2025-12-05 14:27:16,752] Trial 99 finished with value: 0.0537449911336578 and parameters: {'model_type': 'mlp', 'hidden_dims': '[256, 128]', 'dropout': 0.549193171233548, 'batch_norm': False, 'lr': 3.1603573112610095e-06, 'weight_decay': 7.858115448310899e-05, 'epochs': 116, 'loss': 'mse', 'optimizer': 'adam', 'graph_mode': 'off', 'use_snp_selection': True, 'num_snps': 33008}. Best is trial 88 with value: 0.08537550920671354.
[I 2025-12-05 14:27:18,468] Trial 100 finished with value: 0.03288638550795317 and parameters: {'model_type': 'mlp', 'hidden_dims': '[512, 256]', 'dropout': 0.5060838657106596, 'batch_norm': False, 'lr': 2.340544210752045e-06, 'weight_decay': 3.302338195538635e-05, 'epochs': 229, 'loss': 'mse', 'optimizer': 'adam', 'graph_mode': 'off', 'use_snp_selection': True, 'num_snps': 22780}. Best is trial 88 with value: 0.08537550920671354.
[I 2025-12-05 14:27:19,539] Trial 101 finished with value: 0.0800484844800696 and parameters: {'model_type': 'mlp', 'hidden_dims': '[512, 128]', 'dropout': 0.27351293984534136, 'batch_norm': False, 'lr': 1.3944837813000385e-05, 'weight_decay': 5.6712858057346674e-05, 'epochs': 40, 'loss': 'mse', 'optimizer': 'adam', 'graph_mode': 'off', 'use_snp_selection': True, 'num_snps': 11589}. Best is trial 88 with value: 0.08537550920671354.
[I 2025-12-05 14:27:21,374] Trial 102 finished with value: 0.0734009517989456 and parameters: {'model_type': 'mlp', 'hidden_dims': '[512, 128]', 'dropout': 0.27567628748154205, 'batch_norm': False, 'lr': 1.80293861575295e-05, 'weight_decay': 5.891543644744499e-05, 'epochs': 44, 'loss': 'mse', 'optimizer': 'adam', 'graph_mode': 'off', 'use_snp_selection': True, 'num_snps': 30514}. Best is trial 88 with value: 0.08537550920671354.
[I 2025-12-05 14:27:22,302] Trial 103 finished with value: 0.05631991681821794 and parameters: {'model_type': 'mlp', 'hidden_dims': '[512, 128]', 'dropout': 0.2755221179925226, 'batch_norm': False, 'lr': 1.753487574104006e-05, 'weight_decay': 3.107136903363113e-05, 'epochs': 45, 'loss': 'mse', 'optimizer': 'adam', 'graph_mode': 'off', 'use_snp_selection': True, 'num_snps': 7269}. Best is trial 88 with value: 0.08537550920671354.
[I 2025-12-05 14:27:23,382] Trial 104 finished with value: 0.04136357753603899 and parameters: {'model_type': 'mlp', 'hidden_dims': '[512, 128]', 'dropout': 0.2502208204899919, 'batch_norm': False, 'lr': 1.5197791404394445e-05, 'weight_decay': 2.2866298887778633e-05, 'epochs': 56, 'loss': 'mse', 'optimizer': 'adam', 'graph_mode': 'off', 'use_snp_selection': True, 'num_snps': 11695}. Best is trial 88 with value: 0.08537550920671354.
[I 2025-12-05 14:27:25,055] Trial 105 finished with value: 0.04854364934479176 and parameters: {'model_type': 'mlp', 'hidden_dims': '[512, 128]', 'dropout': 0.26353601990979514, 'batch_norm': False, 'lr': 7.899140011217064e-06, 'weight_decay': 5.793659214940819e-05, 'epochs': 41, 'loss': 'mse', 'optimizer': 'adam', 'graph_mode': 'off', 'use_snp_selection': True, 'num_snps': 30648}. Best is trial 88 with value: 0.08537550920671354.
[I 2025-12-05 14:27:26,171] Trial 106 finished with value: 0.08859831686662437 and parameters: {'model_type': 'mlp', 'hidden_dims': '[512, 128]', 'dropout': 0.28587944901670914, 'batch_norm': False, 'lr': 2.6762667142543516e-05, 'weight_decay': 3.895631970232606e-05, 'epochs': 75, 'loss': 'mse', 'optimizer': 'adam', 'graph_mode': 'off', 'use_snp_selection': True, 'num_snps': 13746}. Best is trial 106 with value: 0.08859831686662437.
