[I 2025-12-06 05:47:18,634] Trial 34 finished with value: 0.283015653328886 and parameters: {'model_type': 'mlp', 'hidden_dims': '[512, 256]', 'dropout': 0.41015014061216554, 'batch_norm': False, 'lr': 0.00040735582689873073, 'weight_decay': 1.0578112431470581e-05, 'epochs': 67, 'loss': 'mae', 'optimizer': 'adam', 'graph_mode': 'off', 'use_snp_selection': True, 'num_snps': 20424}. Best is trial 29 with value: 0.2940019562924307.
[I 2025-12-06 05:47:56,726] Trial 35 finished with value: 0.2595013245548538 and parameters: {'model_type': 'mlp', 'hidden_dims': '[512, 256]', 'dropout': 0.3379096544189599, 'batch_norm': False, 'lr': 0.00011026772504143659, 'weight_decay': 0.00023108152097416025, 'epochs': 75, 'loss': 'mae', 'optimizer': 'adam', 'graph_mode': 'off', 'use_snp_selection': True, 'num_snps': 15505}. Best is trial 29 with value: 0.2940019562924307.
[I 2025-12-06 05:48:39,420] Trial 36 finished with value: 0.28483295742354725 and parameters: {'model_type': 'mlp', 'hidden_dims': '[512, 256]', 'dropout': 0.44761605862701703, 'batch_norm': False, 'lr': 0.0003682007706162307, 'weight_decay': 2.088430322016178e-05, 'epochs': 59, 'loss': 'mae', 'optimizer': 'adam', 'graph_mode': 'off', 'use_snp_selection': True, 'num_snps': 25264}. Best is trial 29 with value: 0.2940019562924307.
[I 2025-12-06 05:49:12,126] Trial 37 finished with value: 0.2750115813193566 and parameters: {'model_type': 'mlp', 'hidden_dims': '[512, 256]', 'dropout': 0.3635976168347946, 'batch_norm': False, 'lr': 0.000582102113442509, 'weight_decay': 6.88812158269585e-05, 'epochs': 41, 'loss': 'mae', 'optimizer': 'adam', 'graph_mode': 'off', 'use_snp_selection': True, 'num_snps': 9072}. Best is trial 29 with value: 0.2940019562924307.
[I 2025-12-06 05:49:56,232] Trial 38 finished with value: 0.26968065243354955 and parameters: {'model_type': 'mlp', 'hidden_dims': '[256, 128, 64]', 'dropout': 0.42258009395122337, 'batch_norm': False, 'lr': 0.000995081204518274, 'weight_decay': 1.4089006700519878e-05, 'epochs': 85, 'loss': 'mae', 'optimizer': 'adam', 'graph_mode': 'off', 'use_snp_selection': True, 'num_snps': 31215}. Best is trial 29 with value: 0.2940019562924307.
[I 2025-12-06 05:50:45,022] Trial 39 finished with value: 0.26857494858818903 and parameters: {'model_type': 'mlp', 'hidden_dims': '[512, 256]', 'dropout': 0.397600459759616, 'batch_norm': False, 'lr': 0.0001003502925678127, 'weight_decay': 0.0004349248592375836, 'epochs': 108, 'loss': 'mae', 'optimizer': 'adam', 'graph_mode': 'off', 'use_snp_selection': True, 'num_snps': 26278}. Best is trial 29 with value: 0.2940019562924307.
[I 2025-12-06 05:51:25,725] Trial 40 finished with value: 0.26072915360347926 and parameters: {'model_type': 'mlp', 'hidden_dims': '[512, 256]', 'dropout': 0.4591439107754118, 'batch_norm': True, 'lr': 0.00018025094488212002, 'weight_decay': 0.000526774835348484, 'epochs': 149, 'loss': 'mae', 'optimizer': 'adam', 'graph_mode': 'off', 'use_snp_selection': True, 'num_snps': 12943}. Best is trial 29 with value: 0.2940019562924307.
[I 2025-12-06 05:51:56,122] Trial 41 finished with value: 0.24318904079088483 and parameters: {'model_type': 'mlp', 'hidden_dims': '[256, 128]', 'dropout': 0.49058248616722444, 'batch_norm': False, 'lr': 4.53240907111306e-05, 'weight_decay': 0.00018504357226522254, 'epochs': 113, 'loss': 'mae', 'optimizer': 'adam', 'graph_mode': 'off', 'use_snp_selection': True, 'num_snps': 3749}. Best is trial 29 with value: 0.2940019562924307.
[I 2025-12-06 05:52:42,890] Trial 42 finished with value: 0.28635706326599014 and parameters: {'model_type': 'mlp', 'hidden_dims': '[512, 256]', 'dropout': 0.5258939793100982, 'batch_norm': False, 'lr': 0.0002466954591115047, 'weight_decay': 6.50356222474539e-05, 'epochs': 87, 'loss': 'mae', 'optimizer': 'adam', 'graph_mode': 'off', 'use_snp_selection': True, 'num_snps': 26898}. Best is trial 29 with value: 0.2940019562924307.
[I 2025-12-06 05:53:28,862] Trial 43 finished with value: 0.28121900291649327 and parameters: {'model_type': 'mlp', 'hidden_dims': '[512, 256]', 'dropout': 0.37780703013108596, 'batch_norm': False, 'lr': 0.00021286007050565594, 'weight_decay': 5.448606577885428e-05, 'epochs': 91, 'loss': 'mae', 'optimizer': 'adam', 'graph_mode': 'off', 'use_snp_selection': True, 'num_snps': 25290}. Best is trial 29 with value: 0.2940019562924307.
[I 2025-12-06 05:54:08,011] Trial 44 finished with value: 0.29160904712548175 and parameters: {'model_type': 'mlp', 'hidden_dims': '[512, 256]', 'dropout': 0.5153139630859861, 'batch_norm': False, 'lr': 0.00028993481148363007, 'weight_decay': 2.6186715442616503e-05, 'epochs': 66, 'loss': 'mae', 'optimizer': 'adam', 'graph_mode': 'off', 'use_snp_selection': True, 'num_snps': 17989}. Best is trial 29 with value: 0.2940019562924307.
[I 2025-12-06 05:54:45,984] Trial 45 finished with value: 0.2788750988235582 and parameters: {'model_type': 'mlp', 'hidden_dims': '[512, 256]', 'dropout': 0.5172699758034226, 'batch_norm': False, 'lr': 0.0004725926205994896, 'weight_decay': 3.3926701143985367e-05, 'epochs': 60, 'loss': 'mae', 'optimizer': 'adam', 'graph_mode': 'off', 'use_snp_selection': True, 'num_snps': 17050}. Best is trial 29 with value: 0.2940019562924307.
[I 2025-12-06 05:55:17,594] Trial 46 finished with value: 0.2592964015472897 and parameters: {'model_type': 'mlp', 'hidden_dims': '[128, 64]', 'dropout': 0.43526538198128195, 'batch_norm': True, 'lr': 0.0003080949715180612, 'weight_decay': 2.6151427437441666e-06, 'epochs': 54, 'loss': 'mae', 'optimizer': 'adam', 'graph_mode': 'off', 'use_snp_selection': True, 'num_snps': 9808}. Best is trial 29 with value: 0.2940019562924307.
[I 2025-12-06 05:55:58,855] Trial 47 finished with value: 0.2581983347063218 and parameters: {'model_type': 'mlp', 'hidden_dims': '[512, 256]', 'dropout': 0.5760796965281578, 'batch_norm': False, 'lr': 0.0001458313155355763, 'weight_decay': 2.8267112521843435e-05, 'epochs': 77, 'loss': 'mse', 'optimizer': 'adam', 'graph_mode': 'off', 'use_snp_selection': True, 'num_snps': 20340}. Best is trial 29 with value: 0.2940019562924307.
[I 2025-12-06 05:56:40,761] Trial 48 finished with value: 0.2470484919850684 and parameters: {'model_type': 'mlp', 'hidden_dims': '[512, 256]', 'dropout': 0.5614755584693105, 'batch_norm': False, 'lr': 7.526359303329302e-05, 'weight_decay': 8.204488261651964e-07, 'epochs': 138, 'loss': 'mae', 'optimizer': 'adam', 'graph_mode': 'off', 'use_snp_selection': True, 'num_snps': 15348}. Best is trial 29 with value: 0.2940019562924307.
[I 2025-12-06 05:57:26,029] Trial 49 finished with value: 0.2641709282455797 and parameters: {'model_type': 'mlp', 'hidden_dims': '[256, 128, 64]', 'dropout': 0.4722260268767063, 'batch_norm': True, 'lr': 0.0005037010281191932, 'weight_decay': 1.9211402809960455e-07, 'epochs': 65, 'loss': 'mse', 'optimizer': 'adam', 'graph_mode': 'off', 'use_snp_selection': True, 'num_snps': 36282}. Best is trial 29 with value: 0.2940019562924307.
[I 2025-12-06 05:57:57,177] Trial 50 finished with value: 0.27154077069627547 and parameters: {'model_type': 'mlp', 'hidden_dims': '[512, 64]', 'dropout': 0.22468280724464673, 'batch_norm': False, 'lr': 0.0007625520723837662, 'weight_decay': 1.410861796580741e-05, 'epochs': 48, 'loss': 'mae', 'optimizer': 'adam', 'graph_mode': 'off', 'use_snp_selection': True, 'num_snps': 5889}. Best is trial 29 with value: 0.2940019562924307.
[I 2025-12-06 05:58:41,505] Trial 51 finished with value: 0.27817852202504184 and parameters: {'model_type': 'mlp', 'hidden_dims': '[512, 256]', 'dropout': 0.5353455854185282, 'batch_norm': False, 'lr': 0.00025192532994852484, 'weight_decay': 8.565397554263767e-05, 'epochs': 87, 'loss': 'mae', 'optimizer': 'adam', 'graph_mode': 'off', 'use_snp_selection': True, 'num_snps': 23314}. Best is trial 29 with value: 0.2940019562924307.
[I 2025-12-06 05:59:28,532] Trial 52 finished with value: 0.2814660096704028 and parameters: {'model_type': 'mlp', 'hidden_dims': '[512, 256]', 'dropout': 0.5125702555180133, 'batch_norm': False, 'lr': 0.0003190821416789448, 'weight_decay': 5.182220477528203e-05, 'epochs': 80, 'loss': 'mae', 'optimizer': 'adam', 'graph_mode': 'off', 'use_snp_selection': True, 'num_snps': 27803}. Best is trial 29 with value: 0.2940019562924307.
[I 2025-12-06 06:00:08,689] Trial 53 finished with value: 0.25285509778755644 and parameters: {'model_type': 'mlp', 'hidden_dims': '[512, 256]', 'dropout': 0.5008764375667608, 'batch_norm': False, 'lr': 0.0002339159210972105, 'weight_decay': 8.356794626752412e-05, 'epochs': 95, 'loss': 'mae', 'optimizer': 'adam', 'graph_mode': 'off', 'use_snp_selection': True, 'num_snps': 15998}. Best is trial 29 with value: 0.2940019562924307.
[I 2025-12-06 06:00:58,917] Trial 54 finished with value: 0.2758731986851311 and parameters: {'model_type': 'mlp', 'hidden_dims': '[512, 256]', 'dropout': 0.5351560723696546, 'batch_norm': False, 'lr': 0.00014212789584616177, 'weight_decay': 7.742058815509546e-06, 'epochs': 106, 'loss': 'mae', 'optimizer': 'adam', 'graph_mode': 'off', 'use_snp_selection': True, 'num_snps': 28364}. Best is trial 29 with value: 0.2940019562924307.
[I 2025-12-06 06:01:41,094] Trial 55 finished with value: 0.25252772910047455 and parameters: {'model_type': 'mlp', 'hidden_dims': '[512, 64]', 'dropout': 0.5718148781091779, 'batch_norm': False, 'lr': 0.0004897707163557955, 'weight_decay': 4.633863331224753e-05, 'epochs': 64, 'loss': 'mae', 'optimizer': 'adam', 'graph_mode': 'off', 'use_snp_selection': True, 'num_snps': 23336}. Best is trial 29 with value: 0.2940019562924307.
[I 2025-12-06 06:02:16,729] Trial 56 finished with value: 0.28310354585911246 and parameters: {'model_type': 'mlp', 'hidden_dims': '[512, 256]', 'dropout': 0.47485856780495106, 'batch_norm': False, 'lr': 0.0007129718280851641, 'weight_decay': 2.656498774396972e-05, 'epochs': 56, 'loss': 'mae', 'optimizer': 'adam', 'graph_mode': 'off', 'use_snp_selection': True, 'num_snps': 13203}. Best is trial 29 with value: 0.2940019562924307.
[I 2025-12-06 06:03:17,017] Trial 57 finished with value: 0.2616907108897132 and parameters: {'model_type': 'mlp', 'hidden_dims': '[512, 256]', 'dropout': 0.33794664277484165, 'batch_norm': False, 'lr': 8.463055405226707e-05, 'weight_decay': 0.00021047441488315189, 'epochs': 138, 'loss': 'mse', 'optimizer': 'adam', 'graph_mode': 'off', 'use_snp_selection': True, 'num_snps': 35650}. Best is trial 29 with value: 0.2940019562924307.
[I 2025-12-06 06:04:07,234] Trial 58 finished with value: 0.2653245738736544 and parameters: {'model_type': 'mlp', 'hidden_dims': '[128, 64]', 'dropout': 0.4354408200636254, 'batch_norm': True, 'lr': 0.00021077616795275335, 'weight_decay': 1.608017488826748e-05, 'epochs': 163, 'loss': 'mae', 'optimizer': 'adam', 'graph_mode': 'off', 'use_snp_selection': True, 'num_snps': 42528}. Best is trial 29 with value: 0.2940019562924307.
[I 2025-12-06 06:04:58,322] Trial 59 finished with value: 0.24860919836835765 and parameters: {'model_type': 'mlp', 'hidden_dims': '[512, 64]', 'dropout': 0.4628559319071076, 'batch_norm': False, 'lr': 0.00012441763798320076, 'weight_decay': 0.00012969849567706212, 'epochs': 225, 'loss': 'mae', 'optimizer': 'adam', 'graph_mode': 'off', 'use_snp_selection': True, 'num_snps': 18116}. Best is trial 29 with value: 0.2940019562924307.
[I 2025-12-06 06:06:05,421] Trial 60 finished with value: 0.279675114465133 and parameters: {'model_type': 'mlp', 'hidden_dims': '[256, 128, 64]', 'dropout': 0.40403039279260355, 'batch_norm': False, 'lr': 0.0001864251440837483, 'weight_decay': 4.4407537100914495e-05, 'epochs': 190, 'loss': 'mae', 'optimizer': 'adam', 'graph_mode': 'off', 'use_snp_selection': True, 'num_snps': 53045}. Best is trial 29 with value: 0.2940019562924307.
[I 2025-12-06 06:06:24,705] Trial 61 finished with value: 0.2973721170442463 and parameters: {'model_type': 'mlp', 'hidden_dims': '[256, 128]', 'dropout': 0.529289219517481, 'batch_norm': False, 'lr': 4.5249161069493355e-05, 'weight_decay': 0.00010632252453933963, 'epochs': 98, 'loss': 'mae', 'optimizer': 'adam', 'graph_mode': 'off', 'use_snp_selection': False}. Best is trial 61 with value: 0.2973721170442463.
[I 2025-12-06 06:06:43,996] Trial 62 finished with value: 0.29182127786208 and parameters: {'model_type': 'mlp', 'hidden_dims': '[256, 128]', 'dropout': 0.5257975074376099, 'batch_norm': False, 'lr': 4.82703761268848e-05, 'weight_decay': 9.831094653549264e-05, 'epochs': 98, 'loss': 'mae', 'optimizer': 'adam', 'graph_mode': 'off', 'use_snp_selection': False}. Best is trial 61 with value: 0.2973721170442463.
[I 2025-12-06 06:07:02,944] Trial 63 finished with value: 0.2807663265950591 and parameters: {'model_type': 'mlp', 'hidden_dims': '[256, 128]', 'dropout': 0.384104295442743, 'batch_norm': False, 'lr': 4.594846084846302e-05, 'weight_decay': 9.858848007318639e-05, 'epochs': 95, 'loss': 'mae', 'optimizer': 'adam', 'graph_mode': 'off', 'use_snp_selection': False}. Best is trial 61 with value: 0.2973721170442463.
[I 2025-12-06 06:07:18,485] Trial 64 finished with value: 0.2779363804683761 and parameters: {'model_type': 'mlp', 'hidden_dims': '[256, 128]', 'dropout': 0.5455121713142029, 'batch_norm': False, 'lr': 3.446608968625305e-05, 'weight_decay': 0.00017888839801609178, 'epochs': 69, 'loss': 'mae', 'optimizer': 'adam', 'graph_mode': 'off', 'use_snp_selection': False}. Best is trial 61 with value: 0.2973721170442463.
[I 2025-12-06 06:07:59,157] Trial 65 finished with value: 0.2743366645594073 and parameters: {'model_type': 'mlp', 'hidden_dims': '[256, 128]', 'dropout': 0.4993174331993122, 'batch_norm': False, 'lr': 5.973474224270157e-05, 'weight_decay': 3.4106515186038614e-05, 'epochs': 256, 'loss': 'mae', 'optimizer': 'adam', 'graph_mode': 'off', 'use_snp_selection': False}. Best is trial 61 with value: 0.2973721170442463.
[I 2025-12-06 06:08:21,166] Trial 66 finished with value: 0.29456963329821917 and parameters: {'model_type': 'mlp', 'hidden_dims': '[256, 128]', 'dropout': 0.285254042033786, 'batch_norm': False, 'lr': 1.9788332626490263e-05, 'weight_decay': 0.0002782214710154571, 'epochs': 115, 'loss': 'mae', 'optimizer': 'adam', 'graph_mode': 'off', 'use_snp_selection': False}. Best is trial 61 with value: 0.2973721170442463.
[I 2025-12-06 06:08:34,019] Trial 67 finished with value: 0.2803916356607466 and parameters: {'model_type': 'mlp', 'hidden_dims': '[256, 128]', 'dropout': 0.27498790050805627, 'batch_norm': False, 'lr': 1.7452672157325477e-05, 'weight_decay': 0.0003053625817310193, 'epochs': 48, 'loss': 'mse', 'optimizer': 'adam', 'graph_mode': 'off', 'use_snp_selection': False}. Best is trial 61 with value: 0.2973721170442463.
[I 2025-12-06 06:08:54,186] Trial 68 finished with value: 0.2715582655733587 and parameters: {'model_type': 'mlp', 'hidden_dims': '[256, 128]', 'dropout': 0.30070276482691255, 'batch_norm': False, 'lr': 3.430976545829336e-05, 'weight_decay': 0.00047952340265424397, 'epochs': 102, 'loss': 'mae', 'optimizer': 'adam', 'graph_mode': 'off', 'use_snp_selection': False}. Best is trial 61 with value: 0.2973721170442463.
[I 2025-12-06 06:09:18,649] Trial 69 finished with value: 0.2865624054896044 and parameters: {'model_type': 'mlp', 'hidden_dims': '[256, 128]', 'dropout': 0.1972454899643335, 'batch_norm': False, 'lr': 2.440955825151637e-05, 'weight_decay': 0.00015036114229475517, 'epochs': 133, 'loss': 'mae', 'optimizer': 'adam', 'graph_mode': 'off', 'use_snp_selection': False}. Best is trial 61 with value: 0.2973721170442463.
[I 2025-12-06 06:09:35,998] Trial 70 finished with value: 0.28408400654618354 and parameters: {'model_type': 'mlp', 'hidden_dims': '[256, 128]', 'dropout': 0.24576690887793132, 'batch_norm': False, 'lr': 1.0712464736032335e-05, 'weight_decay': 0.0006892827528175299, 'epochs': 80, 'loss': 'mae', 'optimizer': 'adam', 'graph_mode': 'off', 'use_snp_selection': False}. Best is trial 61 with value: 0.2973721170442463.
[I 2025-12-06 06:09:55,836] Trial 71 finished with value: 0.20956997712843278 and parameters: {'model_type': 'mlp', 'hidden_dims': '[256, 128]', 'dropout': 0.5637288640881147, 'batch_norm': False, 'lr': 0.0003428634776768936, 'weight_decay': 0.00010674583683410269, 'epochs': 101, 'loss': 'mae', 'optimizer': 'adam', 'graph_mode': 'off', 'use_snp_selection': False}. Best is trial 61 with value: 0.2973721170442463.
[I 2025-12-06 06:10:32,874] Trial 72 finished with value: 0.2870893553637843 and parameters: {'model_type': 'mlp', 'hidden_dims': '[512, 128]', 'dropout': 0.522598221683756, 'batch_norm': False, 'lr': 1.752514178690177e-05, 'weight_decay': 7.139803597386935e-05, 'epochs': 112, 'loss': 'mae', 'optimizer': 'adam', 'graph_mode': 'off', 'use_snp_selection': False}. Best is trial 61 with value: 0.2973721170442463.
[I 2025-12-06 06:11:10,221] Trial 73 finished with value: 0.28464392068662864 and parameters: {'model_type': 'mlp', 'hidden_dims': '[512, 64]', 'dropout': 0.3175449730194641, 'batch_norm': False, 'lr': 3.736429143797025e-05, 'weight_decay': 9.845141041554214e-07, 'epochs': 114, 'loss': 'mae', 'optimizer': 'adam', 'graph_mode': 'off', 'use_snp_selection': False}. Best is trial 61 with value: 0.2973721170442463.
[I 2025-12-06 06:11:33,152] Trial 74 finished with value: 0.276214669816489 and parameters: {'model_type': 'mlp', 'hidden_dims': '[256, 128]', 'dropout': 0.48594720949849446, 'batch_norm': False, 'lr': 2.075987445754171e-05, 'weight_decay': 2.340986320297466e-05, 'epochs': 122, 'loss': 'mae', 'optimizer': 'adam', 'graph_mode': 'off', 'use_snp_selection': False}. Best is trial 61 with value: 0.2973721170442463.
[I 2025-12-06 06:11:44,934] Trial 75 finished with value: 0.2521145360416451 and parameters: {'model_type': 'mlp', 'hidden_dims': '[256, 128]', 'dropout': 0.4264037503535753, 'batch_norm': False, 'lr': 1.0507114881664243e-05, 'weight_decay': 0.0002723419145195247, 'epochs': 40, 'loss': 'mae', 'optimizer': 'adam', 'graph_mode': 'off', 'use_snp_selection': False}. Best is trial 61 with value: 0.2973721170442463.
[I 2025-12-06 06:11:55,732] Trial 76 finished with value: 0.28748176529680236 and parameters: {'model_type': 'mlp', 'hidden_dims': '[128, 64]', 'dropout': 0.5923706875703401, 'batch_norm': True, 'lr': 0.0005946980173187962, 'weight_decay': 0.00014473584283996032, 'epochs': 71, 'loss': 'mae', 'optimizer': 'adam', 'graph_mode': 'off', 'use_snp_selection': False}. Best is trial 61 with value: 0.2973721170442463.
[I 2025-12-06 06:12:24,240] Trial 77 finished with value: 0.07793006202228943 and parameters: {'model_type': 'mlp', 'hidden_dims': '[512, 64]', 'dropout': 0.5481107527198434, 'batch_norm': False, 'lr': 0.00045174139057471187, 'weight_decay': 1.6550610256030668e-07, 'epochs': 81, 'loss': 'mae', 'optimizer': 'adam', 'graph_mode': 'off', 'use_snp_selection': False}. Best is trial 61 with value: 0.2973721170442463.
[I 2025-12-06 06:12:51,249] Trial 78 finished with value: 0.2881326091437182 and parameters: {'model_type': 'mlp', 'hidden_dims': '[256, 128]', 'dropout': 0.44855068844134066, 'batch_norm': False, 'lr': 6.923601738923145e-05, 'weight_decay': 3.915485224799361e-05, 'epochs': 154, 'loss': 'mae', 'optimizer': 'adam', 'graph_mode': 'off', 'use_snp_selection': False}. Best is trial 61 with value: 0.2973721170442463.
[I 2025-12-06 06:13:12,814] Trial 79 finished with value: 0.2939063195047248 and parameters: {'model_type': 'mlp', 'hidden_dims': '[512, 256]', 'dropout': 0.3656335752865204, 'batch_norm': False, 'lr': 5.24356148824977e-05, 'weight_decay': 6.566659551686238e-05, 'epochs': 54, 'loss': 'mae', 'optimizer': 'adam', 'graph_mode': 'off', 'use_snp_selection': False}. Best is trial 61 with value: 0.2973721170442463.
[I 2025-12-06 06:13:33,834] Trial 80 finished with value: 0.2841956589244485 and parameters: {'model_type': 'mlp', 'hidden_dims': '[512, 256]', 'dropout': 0.3661990942030914, 'batch_norm': False, 'lr': 5.3195208115384357e-05, 'weight_decay': 5.519829495491407e-05, 'epochs': 52, 'loss': 'mse', 'optimizer': 'adam', 'graph_mode': 'off', 'use_snp_selection': False}. Best is trial 61 with value: 0.2973721170442463.
[I 2025-12-06 06:14:05,692] Trial 81 finished with value: 0.2321083783898083 and parameters: {'model_type': 'mlp', 'hidden_dims': '[512, 256]', 'dropout': 0.28168972170575746, 'batch_norm': False, 'lr': 1.134738792785762e-06, 'weight_decay': 9.221838313027398e-05, 'epochs': 91, 'loss': 'mae', 'optimizer': 'adam', 'graph_mode': 'off', 'use_snp_selection': False}. Best is trial 61 with value: 0.2973721170442463.
[I 2025-12-06 06:14:31,491] Trial 82 finished with value: 0.28525469061448355 and parameters: {'model_type': 'mlp', 'hidden_dims': '[512, 256]', 'dropout': 0.34788302270073795, 'batch_norm': False, 'lr': 4.059084298506909e-05, 'weight_decay': 6.69309736323121e-05, 'epochs': 70, 'loss': 'mae', 'optimizer': 'adam', 'graph_mode': 'off', 'use_snp_selection': False}. Best is trial 61 with value: 0.2973721170442463.
[I 2025-12-06 06:14:54,839] Trial 83 finished with value: 0.2804581913276455 and parameters: {'model_type': 'mlp', 'hidden_dims': '[512, 256]', 'dropout': 0.4143344760989186, 'batch_norm': False, 'lr': 9.462071650310493e-05, 'weight_decay': 0.000197497372955304, 'epochs': 61, 'loss': 'mae', 'optimizer': 'adam', 'graph_mode': 'off', 'use_snp_selection': False}. Best is trial 61 with value: 0.2973721170442463.
[I 2025-12-06 06:15:14,984] Trial 84 finished with value: 0.21815415904699592 and parameters: {'model_type': 'mlp', 'hidden_dims': '[512, 128]', 'dropout': 0.38783456450671067, 'batch_norm': False, 'lr': 0.00038503323939753474, 'weight_decay': 0.00011947062988804639, 'epochs': 49, 'loss': 'mae', 'optimizer': 'adam', 'graph_mode': 'off', 'use_snp_selection': False}. Best is trial 61 with value: 0.2973721170442463.
