[I 2025-12-06 01:05:45,079] Trial 31 finished with value: 0.3027435084983816 and parameters: {'model_type': 'mlp', 'hidden_dims': '[512, 256]', 'dropout': 0.5993030909641737, 'batch_norm': False, 'lr': 2.899983273771225e-06, 'weight_decay': 2.901482880467091e-05, 'epochs': 259, 'loss': 'mse', 'optimizer': 'adam', 'graph_mode': 'off', 'use_snp_selection': False}. Best is trial 31 with value: 0.3027435084983816.
[I 2025-12-06 01:06:35,774] Trial 32 finished with value: 0.2951555605304725 and parameters: {'model_type': 'mlp', 'hidden_dims': '[512, 256]', 'dropout': 0.5999714667764142, 'batch_norm': False, 'lr': 2.5392991485115925e-06, 'weight_decay': 3.459134107713107e-05, 'epochs': 259, 'loss': 'mse', 'optimizer': 'adam', 'graph_mode': 'off', 'use_snp_selection': False}. Best is trial 31 with value: 0.3027435084983816.
[I 2025-12-06 01:07:33,424] Trial 33 finished with value: 0.2925410394521073 and parameters: {'model_type': 'mlp', 'hidden_dims': '[512, 256]', 'dropout': 0.5345837339899857, 'batch_norm': False, 'lr': 4.5280776258153085e-06, 'weight_decay': 1.1330473170673167e-05, 'epochs': 298, 'loss': 'mse', 'optimizer': 'adam', 'graph_mode': 'off', 'use_snp_selection': False}. Best is trial 31 with value: 0.3027435084983816.
[I 2025-12-06 01:07:58,082] Trial 34 finished with value: 0.2547872387950557 and parameters: {'model_type': 'mlp', 'hidden_dims': '[256, 128]', 'dropout': 0.5607621625066977, 'batch_norm': True, 'lr': 1.5073130327589326e-06, 'weight_decay': 8.282437928974976e-05, 'epochs': 216, 'loss': 'mse', 'optimizer': 'adam', 'graph_mode': 'off', 'use_snp_selection': False}. Best is trial 31 with value: 0.3027435084983816.
[I 2025-12-06 01:09:01,246] Trial 35 finished with value: 0.2986846756609591 and parameters: {'model_type': 'mlp', 'hidden_dims': '[512, 256]', 'dropout': 0.41523776389123956, 'batch_norm': False, 'lr': 1.0314255209296193e-06, 'weight_decay': 1.1928835506507174e-05, 'epochs': 328, 'loss': 'mse', 'optimizer': 'adam', 'graph_mode': 'off', 'use_snp_selection': False}. Best is trial 31 with value: 0.3027435084983816.
[I 2025-12-06 01:09:52,245] Trial 36 finished with value: 0.2875650481058 and parameters: {'model_type': 'mlp', 'hidden_dims': '[512, 256]', 'dropout': 0.42355530831555016, 'batch_norm': False, 'lr': 1.003172972886011e-06, 'weight_decay': 1.2469090353431816e-05, 'epochs': 260, 'loss': 'mse', 'optimizer': 'adam', 'graph_mode': 'off', 'use_snp_selection': False}. Best is trial 31 with value: 0.3027435084983816.
[I 2025-12-06 01:11:00,825] Trial 37 finished with value: 0.2962941553900746 and parameters: {'model_type': 'mlp', 'hidden_dims': '[512, 256]', 'dropout': 0.3480811165651798, 'batch_norm': False, 'lr': 1.8409362752040445e-06, 'weight_decay': 0.0003929055178796776, 'epochs': 338, 'loss': 'mse', 'optimizer': 'adam', 'graph_mode': 'off', 'use_snp_selection': True, 'num_snps': 38290}. Best is trial 31 with value: 0.3027435084983816.
[I 2025-12-06 01:11:57,500] Trial 38 finished with value: 0.2651767990968328 and parameters: {'model_type': 'mlp', 'hidden_dims': '[512, 256]', 'dropout': 0.38930188002278754, 'batch_norm': True, 'lr': 3.5643150762682265e-06, 'weight_decay': 6.809731715650987e-06, 'epochs': 291, 'loss': 'mse', 'optimizer': 'adam', 'graph_mode': 'off', 'use_snp_selection': False}. Best is trial 31 with value: 0.3027435084983816.
[I 2025-12-06 01:12:55,185] Trial 39 finished with value: 0.27760006371340207 and parameters: {'model_type': 'mlp', 'hidden_dims': '[256, 128, 64]', 'dropout': 0.48783548362327533, 'batch_norm': False, 'lr': 1.4043172416520631e-06, 'weight_decay': 0.00017141295969187498, 'epochs': 325, 'loss': 'mse', 'optimizer': 'adam', 'graph_mode': 'off', 'use_snp_selection': True, 'num_snps': 48815}. Best is trial 31 with value: 0.3027435084983816.
[I 2025-12-06 01:13:44,724] Trial 40 finished with value: 0.26865817136484177 and parameters: {'model_type': 'mlp', 'hidden_dims': '[512, 256]', 'dropout': 0.47193032425271153, 'batch_norm': True, 'lr': 2.8054754858028347e-06, 'weight_decay': 1.663056541843511e-05, 'epochs': 251, 'loss': 'mse', 'optimizer': 'adam', 'graph_mode': 'off', 'use_snp_selection': False}. Best is trial 31 with value: 0.3027435084983816.
[I 2025-12-06 01:14:46,662] Trial 41 finished with value: 0.30103467828105923 and parameters: {'model_type': 'mlp', 'hidden_dims': '[512, 128]', 'dropout': 0.5718831220116981, 'batch_norm': False, 'lr': 1.8716820483852483e-06, 'weight_decay': 3.077132844569534e-05, 'epochs': 324, 'loss': 'mse', 'optimizer': 'adam', 'graph_mode': 'off', 'use_snp_selection': False}. Best is trial 31 with value: 0.3027435084983816.
[I 2025-12-06 01:15:49,691] Trial 42 finished with value: 0.29568442643777415 and parameters: {'model_type': 'mlp', 'hidden_dims': '[512, 128]', 'dropout': 0.5618236931925369, 'batch_norm': False, 'lr': 1.880487657679311e-06, 'weight_decay': 2.9203227310861243e-05, 'epochs': 330, 'loss': 'mse', 'optimizer': 'adam', 'graph_mode': 'off', 'use_snp_selection': False}. Best is trial 31 with value: 0.3027435084983816.
[I 2025-12-06 01:16:42,052] Trial 43 finished with value: 0.28907422294964513 and parameters: {'model_type': 'mlp', 'hidden_dims': '[512, 128]', 'dropout': 0.5111557151497796, 'batch_norm': False, 'lr': 1.244772949632001e-06, 'weight_decay': 5.444447869928601e-05, 'epochs': 269, 'loss': 'mse', 'optimizer': 'adam', 'graph_mode': 'off', 'use_snp_selection': False}. Best is trial 31 with value: 0.3027435084983816.
[I 2025-12-06 01:17:29,118] Trial 44 finished with value: 0.28901176307831067 and parameters: {'model_type': 'mlp', 'hidden_dims': '[512, 128]', 'dropout': 0.5735127703526679, 'batch_norm': False, 'lr': 7.579053858433124e-06, 'weight_decay': 8.777292856181206e-06, 'epochs': 239, 'loss': 'mse', 'optimizer': 'adam', 'graph_mode': 'off', 'use_snp_selection': False}. Best is trial 31 with value: 0.3027435084983816.
[I 2025-12-06 01:18:26,711] Trial 45 finished with value: 0.29488637820457403 and parameters: {'model_type': 'mlp', 'hidden_dims': '[512, 128]', 'dropout': 0.5367748136510873, 'batch_norm': False, 'lr': 3.6347513552948384e-06, 'weight_decay': 3.5716952243654004e-06, 'epochs': 299, 'loss': 'mse', 'optimizer': 'adam', 'graph_mode': 'off', 'use_snp_selection': False}. Best is trial 31 with value: 0.3027435084983816.
[I 2025-12-06 01:19:10,567] Trial 46 finished with value: 0.26904123817164366 and parameters: {'model_type': 'mlp', 'hidden_dims': '[512, 256]', 'dropout': 0.41174803194592485, 'batch_norm': True, 'lr': 1.9427986334379527e-06, 'weight_decay': 1.7289709177381116e-05, 'epochs': 218, 'loss': 'mse', 'optimizer': 'adam', 'graph_mode': 'off', 'use_snp_selection': False}. Best is trial 31 with value: 0.3027435084983816.
[I 2025-12-06 01:19:46,718] Trial 47 finished with value: 0.26216812574197124 and parameters: {'model_type': 'mlp', 'hidden_dims': '[256, 128]', 'dropout': 0.3634545376991152, 'batch_norm': False, 'lr': 9.487992374702257e-05, 'weight_decay': 0.0009669331628569786, 'epochs': 347, 'loss': 'mse', 'optimizer': 'adam', 'graph_mode': 'off', 'use_snp_selection': False}. Best is trial 31 with value: 0.3027435084983816.
[I 2025-12-06 01:20:41,843] Trial 48 finished with value: 0.29419431813672225 and parameters: {'model_type': 'mlp', 'hidden_dims': '[512, 256]', 'dropout': 0.5776805709791165, 'batch_norm': False, 'lr': 5.2562082828628716e-06, 'weight_decay': 3.542146989778909e-05, 'epochs': 284, 'loss': 'mse', 'optimizer': 'adam', 'graph_mode': 'off', 'use_snp_selection': False}. Best is trial 31 with value: 0.3027435084983816.
[I 2025-12-06 01:21:22,486] Trial 49 finished with value: 0.2847833791899891 and parameters: {'model_type': 'mlp', 'hidden_dims': '[512, 128]', 'dropout': 0.5123631435176682, 'batch_norm': False, 'lr': 1.2342107141659546e-06, 'weight_decay': 7.300540849442028e-05, 'epochs': 202, 'loss': 'mse', 'optimizer': 'adam', 'graph_mode': 'off', 'use_snp_selection': False}. Best is trial 31 with value: 0.3027435084983816.
[I 2025-12-06 01:22:15,186] Trial 50 finished with value: 0.2979677756677506 and parameters: {'model_type': 'mlp', 'hidden_dims': '[512, 256]', 'dropout': 0.533787468876286, 'batch_norm': False, 'lr': 2.6854643648431826e-06, 'weight_decay': 0.0002835029157742102, 'epochs': 270, 'loss': 'mse', 'optimizer': 'adam', 'graph_mode': 'off', 'use_snp_selection': False}. Best is trial 31 with value: 0.3027435084983816.
[I 2025-12-06 01:23:08,560] Trial 51 finished with value: 0.29461089831271725 and parameters: {'model_type': 'mlp', 'hidden_dims': '[512, 256]', 'dropout': 0.5323575190321997, 'batch_norm': False, 'lr': 2.8602254084458333e-06, 'weight_decay': 0.0006293672493467045, 'epochs': 274, 'loss': 'mse', 'optimizer': 'adam', 'graph_mode': 'off', 'use_snp_selection': False}. Best is trial 31 with value: 0.3027435084983816.
[I 2025-12-06 01:23:53,967] Trial 52 finished with value: 0.284378443328681 and parameters: {'model_type': 'mlp', 'hidden_dims': '[512, 256]', 'dropout': 0.5991356943435358, 'batch_norm': False, 'lr': 1.7155988723457458e-06, 'weight_decay': 0.0002837491643030816, 'epochs': 229, 'loss': 'mse', 'optimizer': 'adam', 'graph_mode': 'off', 'use_snp_selection': False}. Best is trial 31 with value: 0.3027435084983816.
[I 2025-12-06 01:24:52,405] Trial 53 finished with value: 0.2894076661991599 and parameters: {'model_type': 'mlp', 'hidden_dims': '[512, 256]', 'dropout': 0.5749129467732461, 'batch_norm': False, 'lr': 4.908738962037585e-06, 'weight_decay': 0.00013134841808117782, 'epochs': 303, 'loss': 'mse', 'optimizer': 'adam', 'graph_mode': 'off', 'use_snp_selection': False}. Best is trial 31 with value: 0.3027435084983816.
[I 2025-12-06 01:25:40,686] Trial 54 finished with value: 0.29418622314269627 and parameters: {'model_type': 'mlp', 'hidden_dims': '[512, 256]', 'dropout': 0.4838080527000856, 'batch_norm': False, 'lr': 3.4001379059276104e-06, 'weight_decay': 0.0002438822358606748, 'epochs': 245, 'loss': 'mse', 'optimizer': 'adam', 'graph_mode': 'off', 'use_snp_selection': False}. Best is trial 31 with value: 0.3027435084983816.
[I 2025-12-06 01:26:01,562] Trial 55 finished with value: 0.2841633508735941 and parameters: {'model_type': 'mlp', 'hidden_dims': '[128, 64]', 'dropout': 0.5446363934296122, 'batch_norm': False, 'lr': 2.1941648039478904e-06, 'weight_decay': 5.369127688059047e-05, 'epochs': 319, 'loss': 'mse', 'optimizer': 'adam', 'graph_mode': 'off', 'use_snp_selection': False}. Best is trial 31 with value: 0.3027435084983816.
[I 2025-12-06 01:26:52,971] Trial 56 finished with value: 0.2795824213687671 and parameters: {'model_type': 'mlp', 'hidden_dims': '[512, 256]', 'dropout': 0.4510105267986973, 'batch_norm': False, 'lr': 0.0005361807719839151, 'weight_decay': 1.5146074442015618e-05, 'epochs': 265, 'loss': 'mse', 'optimizer': 'adam', 'graph_mode': 'off', 'use_snp_selection': False}. Best is trial 31 with value: 0.3027435084983816.
[I 2025-12-06 01:27:29,121] Trial 57 finished with value: 0.24385079518222005 and parameters: {'model_type': 'mlp', 'hidden_dims': '[256, 128, 64]', 'dropout': 0.2726764558313637, 'batch_norm': True, 'lr': 1.4906248788728137e-06, 'weight_decay': 4.1006741168831854e-05, 'epochs': 289, 'loss': 'mse', 'optimizer': 'adam', 'graph_mode': 'off', 'use_snp_selection': True, 'num_snps': 21034}. Best is trial 31 with value: 0.3027435084983816.
[I 2025-12-06 01:28:33,398] Trial 58 finished with value: 0.27874759618651485 and parameters: {'model_type': 'mlp', 'hidden_dims': '[512, 256]', 'dropout': 0.5756580256870819, 'batch_norm': False, 'lr': 8.206434890288709e-06, 'weight_decay': 0.0004146724476828074, 'epochs': 338, 'loss': 'mse', 'optimizer': 'adam', 'graph_mode': 'off', 'use_snp_selection': False}. Best is trial 31 with value: 0.3027435084983816.
[I 2025-12-06 01:29:07,991] Trial 59 finished with value: 0.2740625127348668 and parameters: {'model_type': 'mlp', 'hidden_dims': '[512, 256]', 'dropout': 0.5154729584949206, 'batch_norm': False, 'lr': 1.1056093038138966e-06, 'weight_decay': 9.34582844965352e-05, 'epochs': 167, 'loss': 'mse', 'optimizer': 'adam', 'graph_mode': 'off', 'use_snp_selection': False}. Best is trial 31 with value: 0.3027435084983816.
[I 2025-12-06 01:30:21,350] Trial 60 finished with value: 0.2773944161803458 and parameters: {'model_type': 'mlp', 'hidden_dims': '[512, 128]', 'dropout': 0.43200903119651707, 'batch_norm': False, 'lr': 1.1587228917690746e-05, 'weight_decay': 2.4080176146814677e-05, 'epochs': 243, 'loss': 'mse', 'optimizer': 'adam', 'graph_mode': 'off', 'use_snp_selection': True, 'num_snps': 54359}. Best is trial 31 with value: 0.3027435084983816.
[I 2025-12-06 01:31:22,469] Trial 61 finished with value: 0.2911755411492537 and parameters: {'model_type': 'mlp', 'hidden_dims': '[512, 64]', 'dropout': 0.5832982595083379, 'batch_norm': False, 'lr': 4.395123055503552e-06, 'weight_decay': 2.5995699612814483e-05, 'epochs': 321, 'loss': 'mae', 'optimizer': 'adam', 'graph_mode': 'off', 'use_snp_selection': False}. Best is trial 31 with value: 0.3027435084983816.
[I 2025-12-06 01:32:21,765] Trial 62 finished with value: 0.29104504889701743 and parameters: {'model_type': 'mlp', 'hidden_dims': '[512, 64]', 'dropout': 0.5514298577523442, 'batch_norm': False, 'lr': 6.26593337777392e-06, 'weight_decay': 8.092783501645905e-06, 'epochs': 310, 'loss': 'mae', 'optimizer': 'adam', 'graph_mode': 'off', 'use_snp_selection': False}. Best is trial 31 with value: 0.3027435084983816.
[I 2025-12-06 01:33:25,196] Trial 63 finished with value: 0.2894428311641004 and parameters: {'model_type': 'mlp', 'hidden_dims': '[512, 64]', 'dropout': 0.5276314004202302, 'batch_norm': False, 'lr': 2.451623944530101e-06, 'weight_decay': 4.6726937795737434e-06, 'epochs': 333, 'loss': 'mae', 'optimizer': 'adam', 'graph_mode': 'off', 'use_snp_selection': False}. Best is trial 31 with value: 0.3027435084983816.
[I 2025-12-06 01:34:31,793] Trial 64 finished with value: 0.28959440310785256 and parameters: {'model_type': 'mlp', 'hidden_dims': '[512, 64]', 'dropout': 0.1802439821269111, 'batch_norm': False, 'lr': 2.999889692839544e-06, 'weight_decay': 6.490962313789721e-05, 'epochs': 350, 'loss': 'mae', 'optimizer': 'adam', 'graph_mode': 'off', 'use_snp_selection': False}. Best is trial 31 with value: 0.3027435084983816.
[I 2025-12-06 01:35:25,607] Trial 65 finished with value: 0.2786288638744149 and parameters: {'model_type': 'mlp', 'hidden_dims': '[512, 256]', 'dropout': 0.5699324790557418, 'batch_norm': False, 'lr': 4.0647199424857926e-05, 'weight_decay': 1.108482017776784e-05, 'epochs': 279, 'loss': 'mae', 'optimizer': 'adam', 'graph_mode': 'off', 'use_snp_selection': False}. Best is trial 31 with value: 0.3027435084983816.
[I 2025-12-06 01:36:16,371] Trial 66 finished with value: 0.2937453267946092 and parameters: {'model_type': 'mlp', 'hidden_dims': '[256, 128]', 'dropout': 0.5478831058373328, 'batch_norm': False, 'lr': 5.8875153395337e-06, 'weight_decay': 0.0001476839446919044, 'epochs': 293, 'loss': 'mae', 'optimizer': 'adam', 'graph_mode': 'off', 'use_snp_selection': True, 'num_snps': 42494}. Best is trial 31 with value: 0.3027435084983816.
[I 2025-12-06 01:36:47,392] Trial 67 finished with value: 0.27073203936388374 and parameters: {'model_type': 'mlp', 'hidden_dims': '[512, 256]', 'dropout': 0.5899002135415611, 'batch_norm': False, 'lr': 1.6469730232759883e-06, 'weight_decay': 1.9904190583859886e-05, 'epochs': 148, 'loss': 'mse', 'optimizer': 'adam', 'graph_mode': 'off', 'use_snp_selection': False}. Best is trial 31 with value: 0.3027435084983816.
[I 2025-12-06 01:37:02,116] Trial 68 finished with value: 0.2861119136851641 and parameters: {'model_type': 'mlp', 'hidden_dims': '[128, 64]', 'dropout': 0.5866823620813052, 'batch_norm': False, 'lr': 3.838348698305791e-06, 'weight_decay': 0.00021355442539093645, 'epochs': 201, 'loss': 'mse', 'optimizer': 'adam', 'graph_mode': 'off', 'use_snp_selection': False}. Best is trial 31 with value: 0.3027435084983816.
[I 2025-12-06 01:37:55,607] Trial 69 finished with value: 0.2695886426593773 and parameters: {'model_type': 'mlp', 'hidden_dims': '[512, 64]', 'dropout': 0.49636995208766416, 'batch_norm': True, 'lr': 2.062247749086548e-06, 'weight_decay': 3.2469422672253904e-05, 'epochs': 307, 'loss': 'mse', 'optimizer': 'adam', 'graph_mode': 'off', 'use_snp_selection': True, 'num_snps': 28586}. Best is trial 31 with value: 0.3027435084983816.
[I 2025-12-06 01:38:29,086] Trial 70 finished with value: 0.24784997771368866 and parameters: {'model_type': 'mlp', 'hidden_dims': '[256, 128, 64]', 'dropout': 0.5585736962293003, 'batch_norm': False, 'lr': 2.6066574532049905e-06, 'weight_decay': 4.333135465767223e-05, 'epochs': 316, 'loss': 'mae', 'optimizer': 'adam', 'graph_mode': 'off', 'use_snp_selection': False}. Best is trial 31 with value: 0.3027435084983816.
[I 2025-12-06 01:39:37,354] Trial 71 finished with value: 0.295170528697824 and parameters: {'model_type': 'mlp', 'hidden_dims': '[512, 256]', 'dropout': 0.35043931931900874, 'batch_norm': False, 'lr': 1.3504985993516143e-06, 'weight_decay': 0.0003619182301542982, 'epochs': 337, 'loss': 'mse', 'optimizer': 'adam', 'graph_mode': 'off', 'use_snp_selection': True, 'num_snps': 38570}. Best is trial 31 with value: 0.3027435084983816.
[I 2025-12-06 01:41:04,896] Trial 72 finished with value: 0.29623863446512255 and parameters: {'model_type': 'mlp', 'hidden_dims': '[512, 256]', 'dropout': 0.32963380109279466, 'batch_norm': False, 'lr': 1.7904162785900732e-06, 'weight_decay': 0.00035127673065183106, 'epochs': 338, 'loss': 'mse', 'optimizer': 'adam', 'graph_mode': 'off', 'use_snp_selection': True, 'num_snps': 54049}. Best is trial 31 with value: 0.3027435084983816.
[I 2025-12-06 01:42:07,605] Trial 73 finished with value: 0.29384817193687846 and parameters: {'model_type': 'mlp', 'hidden_dims': '[512, 256]', 'dropout': 0.3742173000395903, 'batch_norm': False, 'lr': 3.2437626686358887e-06, 'weight_decay': 0.0005478977556561516, 'epochs': 329, 'loss': 'mse', 'optimizer': 'adam', 'graph_mode': 'off', 'use_snp_selection': True, 'num_snps': 34680}. Best is trial 31 with value: 0.3027435084983816.
[I 2025-12-06 01:43:11,214] Trial 74 finished with value: 0.2903479843843072 and parameters: {'model_type': 'mlp', 'hidden_dims': '[512, 256]', 'dropout': 0.3057177726659799, 'batch_norm': False, 'lr': 4.160128024817446e-06, 'weight_decay': 0.0007139538980292027, 'epochs': 256, 'loss': 'mse', 'optimizer': 'adam', 'graph_mode': 'off', 'use_snp_selection': True, 'num_snps': 42558}. Best is trial 31 with value: 0.3027435084983816.
[I 2025-12-06 01:44:19,321] Trial 75 finished with value: 0.2949588748592704 and parameters: {'model_type': 'mlp', 'hidden_dims': '[512, 256]', 'dropout': 0.10124962183369429, 'batch_norm': False, 'lr': 2.1232678222961155e-06, 'weight_decay': 0.0004741566595993206, 'epochs': 223, 'loss': 'mse', 'optimizer': 'adam', 'graph_mode': 'off', 'use_snp_selection': True, 'num_snps': 51730}. Best is trial 31 with value: 0.3027435084983816.
[I 2025-12-06 01:45:05,761] Trial 76 finished with value: 0.27951632195692844 and parameters: {'model_type': 'mlp', 'hidden_dims': '[512, 128]', 'dropout': 0.4096886107016686, 'batch_norm': False, 'lr': 1.1449926594972155e-06, 'weight_decay': 0.0001882719646387145, 'epochs': 272, 'loss': 'mse', 'optimizer': 'adam', 'graph_mode': 'off', 'use_snp_selection': True, 'num_snps': 24510}. Best is trial 31 with value: 0.3027435084983816.
[I 2025-12-06 01:45:47,544] Trial 77 finished with value: 0.2953743325893387 and parameters: {'model_type': 'mlp', 'hidden_dims': '[512, 256]', 'dropout': 0.3253463981735234, 'batch_norm': False, 'lr': 1.440853387940702e-06, 'weight_decay': 0.00011519738346002545, 'epochs': 209, 'loss': 'mse', 'optimizer': 'adam', 'graph_mode': 'off', 'use_snp_selection': False}. Best is trial 31 with value: 0.3027435084983816.
[I 2025-12-06 01:46:25,974] Trial 78 finished with value: 0.2961721464173122 and parameters: {'model_type': 'mlp', 'hidden_dims': '[512, 256]', 'dropout': 0.26373916418682686, 'batch_norm': False, 'lr': 2.555426281306566e-06, 'weight_decay': 1.990052259301865e-06, 'epochs': 189, 'loss': 'mse', 'optimizer': 'adam', 'graph_mode': 'off', 'use_snp_selection': False}. Best is trial 31 with value: 0.3027435084983816.
[I 2025-12-06 01:47:31,441] Trial 79 finished with value: 0.29390182773278684 and parameters: {'model_type': 'mlp', 'hidden_dims': '[512, 256]', 'dropout': 0.5996991818286523, 'batch_norm': False, 'lr': 1.8282081891442468e-06, 'weight_decay': 1.2803071807654496e-05, 'epochs': 343, 'loss': 'mse', 'optimizer': 'adam', 'graph_mode': 'off', 'use_snp_selection': False}. Best is trial 31 with value: 0.3027435084983816.
[I 2025-12-06 01:48:26,980] Trial 80 finished with value: 0.2706297043217739 and parameters: {'model_type': 'mlp', 'hidden_dims': '[256, 128]', 'dropout': 0.5264782200826187, 'batch_norm': True, 'lr': 5.087147691955058e-06, 'weight_decay': 2.0667775064545622e-05, 'epochs': 324, 'loss': 'mae', 'optimizer': 'adam', 'graph_mode': 'off', 'use_snp_selection': True, 'num_snps': 45725}. Best is trial 31 with value: 0.3027435084983816.
[I 2025-12-06 01:48:52,375] Trial 81 finished with value: 0.2888915503963549 and parameters: {'model_type': 'mlp', 'hidden_dims': '[512, 256]', 'dropout': 0.5632010835981911, 'batch_norm': False, 'lr': 1.899123938103099e-05, 'weight_decay': 5.700563796624235e-07, 'epochs': 116, 'loss': 'mse', 'optimizer': 'adam', 'graph_mode': 'off', 'use_snp_selection': False}. Best is trial 31 with value: 0.3027435084983816.
[I 2025-12-06 01:49:12,206] Trial 82 finished with value: 0.29336521250679315 and parameters: {'model_type': 'mlp', 'hidden_dims': '[512, 256]', 'dropout': 0.5437555075564346, 'batch_norm': False, 'lr': 1.1848913017334768e-05, 'weight_decay': 6.362465832745985e-05, 'epochs': 84, 'loss': 'mse', 'optimizer': 'adam', 'graph_mode': 'off', 'use_snp_selection': False}. Best is trial 31 with value: 0.3027435084983816.
