[I 2025-12-05 14:58:28,288] Trial 129 finished with value: 0.11389089620112403 and parameters: {'model_type': 'mlp', 'hidden_dims': '[256, 128, 64]', 'dropout': 0.17912087890659062, 'batch_norm': False, 'lr': 4.236600889181334e-05, 'weight_decay': 0.00019050471022983545, 'epochs': 305, 'loss': 'mae', 'optimizer': 'adam', 'graph_mode': 'off', 'use_snp_selection': True, 'num_snps': 9760}. Best is trial 105 with value: 0.13730927959914407.
[I 2025-12-05 14:58:29,433] Trial 130 finished with value: 0.11906106324303911 and parameters: {'model_type': 'mlp', 'hidden_dims': '[256, 128]', 'dropout': 0.16495958035581595, 'batch_norm': False, 'lr': 7.820365839487346e-05, 'weight_decay': 5.102364252936796e-05, 'epochs': 286, 'loss': 'mae', 'optimizer': 'adam', 'graph_mode': 'off', 'use_snp_selection': False}. Best is trial 105 with value: 0.13730927959914407.
[I 2025-12-05 14:58:30,497] Trial 131 finished with value: 0.1335946663124397 and parameters: {'model_type': 'mlp', 'hidden_dims': '[256, 128, 64]', 'dropout': 0.1291898733556344, 'batch_norm': False, 'lr': 2.438045442845686e-05, 'weight_decay': 0.0007096734837423072, 'epochs': 242, 'loss': 'mae', 'optimizer': 'adam', 'graph_mode': 'off', 'use_snp_selection': False}. Best is trial 105 with value: 0.13730927959914407.
[I 2025-12-05 14:58:31,544] Trial 132 finished with value: 0.11990483725132958 and parameters: {'model_type': 'mlp', 'hidden_dims': '[256, 128, 64]', 'dropout': 0.12534163011546273, 'batch_norm': False, 'lr': 2.2965430567824966e-05, 'weight_decay': 0.0008863607600230631, 'epochs': 233, 'loss': 'mae', 'optimizer': 'adam', 'graph_mode': 'off', 'use_snp_selection': False}. Best is trial 105 with value: 0.13730927959914407.
[I 2025-12-05 14:58:32,609] Trial 133 finished with value: 0.12412223892381832 and parameters: {'model_type': 'mlp', 'hidden_dims': '[256, 128, 64]', 'dropout': 0.10248324179360269, 'batch_norm': False, 'lr': 2.615104117940743e-05, 'weight_decay': 0.00031564979205499455, 'epochs': 242, 'loss': 'mae', 'optimizer': 'adam', 'graph_mode': 'off', 'use_snp_selection': False}. Best is trial 105 with value: 0.13730927959914407.
[I 2025-12-05 14:58:33,630] Trial 134 finished with value: 0.12304268559349169 and parameters: {'model_type': 'mlp', 'hidden_dims': '[256, 128, 64]', 'dropout': 0.1356949240291237, 'batch_norm': False, 'lr': 1.0691740675333345e-05, 'weight_decay': 0.0006089696832821689, 'epochs': 221, 'loss': 'mae', 'optimizer': 'adam', 'graph_mode': 'off', 'use_snp_selection': False}. Best is trial 105 with value: 0.13730927959914407.
[I 2025-12-05 14:58:34,356] Trial 135 finished with value: 0.12141264611519942 and parameters: {'model_type': 'mlp', 'hidden_dims': '[256, 128, 64]', 'dropout': 0.15683025384137775, 'batch_norm': False, 'lr': 1.4862991517001644e-05, 'weight_decay': 0.0007819702633338582, 'epochs': 72, 'loss': 'mae', 'optimizer': 'adam', 'graph_mode': 'off', 'use_snp_selection': False}. Best is trial 105 with value: 0.13730927959914407.
[I 2025-12-05 14:58:35,426] Trial 136 finished with value: 0.11230580764069331 and parameters: {'model_type': 'mlp', 'hidden_dims': '[256, 128]', 'dropout': 0.1129540907160434, 'batch_norm': False, 'lr': 3.830680561078977e-05, 'weight_decay': 0.0004317767769518893, 'epochs': 253, 'loss': 'mae', 'optimizer': 'adam', 'graph_mode': 'off', 'use_snp_selection': False}. Best is trial 105 with value: 0.13730927959914407.
[I 2025-12-05 14:58:37,143] Trial 137 finished with value: 0.14100746446841728 and parameters: {'model_type': 'mlp', 'hidden_dims': '[512, 128]', 'dropout': 0.14429509636969862, 'batch_norm': False, 'lr': 1.7851136323268184e-05, 'weight_decay': 0.00024717476274665285, 'epochs': 262, 'loss': 'mae', 'optimizer': 'adam', 'graph_mode': 'off', 'use_snp_selection': False}. Best is trial 137 with value: 0.14100746446841728.
[I 2025-12-05 14:58:38,848] Trial 138 finished with value: 0.1323478927493861 and parameters: {'model_type': 'mlp', 'hidden_dims': '[512, 128]', 'dropout': 0.19124698633112733, 'batch_norm': False, 'lr': 3.1340324494855494e-05, 'weight_decay': 0.0002484657152784892, 'epochs': 263, 'loss': 'mse', 'optimizer': 'adam', 'graph_mode': 'off', 'use_snp_selection': False}. Best is trial 137 with value: 0.14100746446841728.
[I 2025-12-05 14:58:40,576] Trial 139 finished with value: 0.11399505265285773 and parameters: {'model_type': 'mlp', 'hidden_dims': '[512, 128]', 'dropout': 0.2060846855442855, 'batch_norm': False, 'lr': 1.9182152013243844e-05, 'weight_decay': 0.0002317572378618669, 'epochs': 272, 'loss': 'mse', 'optimizer': 'adam', 'graph_mode': 'off', 'use_snp_selection': False}. Best is trial 137 with value: 0.14100746446841728.
[I 2025-12-05 14:58:42,237] Trial 140 finished with value: 0.11837204007011833 and parameters: {'model_type': 'mlp', 'hidden_dims': '[512, 128]', 'dropout': 0.17724579191683404, 'batch_norm': False, 'lr': 3.191437489140768e-05, 'weight_decay': 0.00017077820284634057, 'epochs': 261, 'loss': 'mse', 'optimizer': 'adam', 'graph_mode': 'off', 'use_snp_selection': False}. Best is trial 137 with value: 0.14100746446841728.
[I 2025-12-05 14:58:43,876] Trial 141 finished with value: 0.12127168317004029 and parameters: {'model_type': 'mlp', 'hidden_dims': '[512, 128]', 'dropout': 0.19205351697657772, 'batch_norm': False, 'lr': 2.4717989413047827e-05, 'weight_decay': 0.000362227931572412, 'epochs': 254, 'loss': 'mse', 'optimizer': 'adam', 'graph_mode': 'off', 'use_snp_selection': False}. Best is trial 137 with value: 0.14100746446841728.
[I 2025-12-05 14:58:45,477] Trial 142 finished with value: 0.13770147028087798 and parameters: {'model_type': 'mlp', 'hidden_dims': '[512, 128]', 'dropout': 0.1871588255243151, 'batch_norm': False, 'lr': 1.7242735941930635e-05, 'weight_decay': 0.0005165026776805789, 'epochs': 245, 'loss': 'mse', 'optimizer': 'adam', 'graph_mode': 'off', 'use_snp_selection': False}. Best is trial 137 with value: 0.14100746446841728.
[I 2025-12-05 14:58:47,095] Trial 143 finished with value: 0.12135217117708229 and parameters: {'model_type': 'mlp', 'hidden_dims': '[512, 128]', 'dropout': 0.1680119062882338, 'batch_norm': False, 'lr': 1.49442234866465e-05, 'weight_decay': 0.0004916215256412806, 'epochs': 248, 'loss': 'mse', 'optimizer': 'adam', 'graph_mode': 'off', 'use_snp_selection': False}. Best is trial 137 with value: 0.14100746446841728.
[I 2025-12-05 14:58:48,680] Trial 144 finished with value: 0.12020414367986998 and parameters: {'model_type': 'mlp', 'hidden_dims': '[512, 128]', 'dropout': 0.14931286267262125, 'batch_norm': False, 'lr': 2.9065095630688325e-05, 'weight_decay': 0.0006094515797178934, 'epochs': 230, 'loss': 'mse', 'optimizer': 'adam', 'graph_mode': 'off', 'use_snp_selection': False}. Best is trial 137 with value: 0.14100746446841728.
[I 2025-12-05 14:58:50,313] Trial 145 finished with value: 0.12489596396371293 and parameters: {'model_type': 'mlp', 'hidden_dims': '[512, 128]', 'dropout': 0.21196529243108703, 'batch_norm': False, 'lr': 1.7502111522636523e-05, 'weight_decay': 0.0004227786208733899, 'epochs': 240, 'loss': 'mse', 'optimizer': 'adam', 'graph_mode': 'off', 'use_snp_selection': False}. Best is trial 137 with value: 0.14100746446841728.
[I 2025-12-05 14:58:51,998] Trial 146 finished with value: 0.12240765194853956 and parameters: {'model_type': 'mlp', 'hidden_dims': '[512, 128]', 'dropout': 0.185096747706813, 'batch_norm': False, 'lr': 2.0801508244564005e-05, 'weight_decay': 0.0003151825534229153, 'epochs': 259, 'loss': 'mse', 'optimizer': 'adam', 'graph_mode': 'off', 'use_snp_selection': False}. Best is trial 137 with value: 0.14100746446841728.
[I 2025-12-05 14:58:53,675] Trial 147 finished with value: 0.1253594076463995 and parameters: {'model_type': 'mlp', 'hidden_dims': '[512, 128]', 'dropout': 0.157410724921065, 'batch_norm': False, 'lr': 1.3774393132954031e-05, 'weight_decay': 0.00010239122140054283, 'epochs': 265, 'loss': 'mse', 'optimizer': 'adam', 'graph_mode': 'off', 'use_snp_selection': False}. Best is trial 137 with value: 0.14100746446841728.
[I 2025-12-05 14:58:55,277] Trial 148 finished with value: 0.07146497425202111 and parameters: {'model_type': 'mlp', 'hidden_dims': '[512, 128]', 'dropout': 0.5017886158172431, 'batch_norm': False, 'lr': 0.000287708590448156, 'weight_decay': 0.0007204951406849902, 'epochs': 245, 'loss': 'mse', 'optimizer': 'adam', 'graph_mode': 'off', 'use_snp_selection': False}. Best is trial 137 with value: 0.14100746446841728.
[I 2025-12-05 14:58:56,750] Trial 149 finished with value: 0.1121754945795492 and parameters: {'model_type': 'mlp', 'hidden_dims': '[512, 128]', 'dropout': 0.3118652879672704, 'batch_norm': False, 'lr': 3.512392992701179e-05, 'weight_decay': 0.0001305020805942735, 'epochs': 210, 'loss': 'mse', 'optimizer': 'adam', 'graph_mode': 'off', 'use_snp_selection': False}. Best is trial 137 with value: 0.14100746446841728.
[I 2025-12-05 14:58:58,957] Trial 0 finished with value: 0.030497083197475832 and parameters: {'model_type': 'mlp', 'hidden_dims': '[128, 64]', 'dropout': 0.199031432379812, 'batch_norm': True, 'lr': 1.8408544111075837e-06, 'weight_decay': 5.5136510071208614e-05, 'epochs': 336, 'loss': 'mae', 'optimizer': 'adam', 'graph_mode': 'off', 'use_snp_selection': True, 'num_snps': 43862}. Best is trial 0 with value: 0.030497083197475832.
[I 2025-12-05 14:59:00,061] Trial 1 finished with value: 0.06589956088610621 and parameters: {'model_type': 'mlp', 'hidden_dims': '[256, 128]', 'dropout': 0.4370668075331726, 'batch_norm': True, 'lr': 7.133471581159139e-05, 'weight_decay': 1.128633586803549e-05, 'epochs': 242, 'loss': 'mae', 'optimizer': 'adam', 'graph_mode': 'off', 'use_snp_selection': False}. Best is trial 1 with value: 0.06589956088610621.
[I 2025-12-05 14:59:01,145] Trial 2 finished with value: -0.0028320148522636376 and parameters: {'model_type': 'mlp', 'hidden_dims': '[256, 128, 64]', 'dropout': 0.41314357415569625, 'batch_norm': False, 'lr': 3.952233718592101e-06, 'weight_decay': 0.00026754769258252603, 'epochs': 149, 'loss': 'mse', 'optimizer': 'adam', 'graph_mode': 'off', 'use_snp_selection': True, 'num_snps': 11571}. Best is trial 1 with value: 0.06589956088610621.
[I 2025-12-05 14:59:03,055] Trial 3 finished with value: 0.04473753423998496 and parameters: {'model_type': 'mlp', 'hidden_dims': '[512, 64]', 'dropout': 0.5938127374509361, 'batch_norm': False, 'lr': 5.67704586114731e-06, 'weight_decay': 2.4518087630137052e-05, 'epochs': 320, 'loss': 'mae', 'optimizer': 'adam', 'graph_mode': 'off', 'use_snp_selection': False}. Best is trial 1 with value: 0.06589956088610621.
[I 2025-12-05 14:59:05,286] Trial 4 finished with value: 0.02567856648246993 and parameters: {'model_type': 'mlp', 'hidden_dims': '[512, 128]', 'dropout': 0.25746343592134413, 'batch_norm': True, 'lr': 1.3467657668402788e-06, 'weight_decay': 0.00033087251918647806, 'epochs': 277, 'loss': 'mse', 'optimizer': 'adam', 'graph_mode': 'off', 'use_snp_selection': True, 'num_snps': 36675}. Best is trial 1 with value: 0.06589956088610621.
[I 2025-12-05 14:59:07,033] Trial 5 finished with value: -0.018574699771261742 and parameters: {'model_type': 'mlp', 'hidden_dims': '[512, 64]', 'dropout': 0.38275350994408375, 'batch_norm': True, 'lr': 1.5586664309232824e-06, 'weight_decay': 0.0008227664668621182, 'epochs': 145, 'loss': 'mae', 'optimizer': 'adam', 'graph_mode': 'off', 'use_snp_selection': True, 'num_snps': 32148}. Best is trial 1 with value: 0.06589956088610621.
[I 2025-12-05 14:59:07,992] Trial 6 finished with value: 0.06346903077557649 and parameters: {'model_type': 'mlp', 'hidden_dims': '[256, 128]', 'dropout': 0.3930109900265879, 'batch_norm': False, 'lr': 4.892964372128395e-05, 'weight_decay': 1.5809549317992182e-06, 'epochs': 199, 'loss': 'mse', 'optimizer': 'adam', 'graph_mode': 'off', 'use_snp_selection': False}. Best is trial 1 with value: 0.06589956088610621.
[I 2025-12-05 14:59:09,039] Trial 7 finished with value: 0.0677226890754063 and parameters: {'model_type': 'mlp', 'hidden_dims': '[512, 256]', 'dropout': 0.15343979219678458, 'batch_norm': True, 'lr': 6.234003099047341e-05, 'weight_decay': 3.894760610535477e-07, 'epochs': 97, 'loss': 'mse', 'optimizer': 'adam', 'graph_mode': 'off', 'use_snp_selection': False}. Best is trial 7 with value: 0.0677226890754063.
[I 2025-12-05 14:59:10,952] Trial 8 finished with value: 0.07992299560724207 and parameters: {'model_type': 'mlp', 'hidden_dims': '[512, 128]', 'dropout': 0.10743001231661406, 'batch_norm': True, 'lr': 0.00023728538449271062, 'weight_decay': 1.7629071578048637e-05, 'epochs': 312, 'loss': 'mae', 'optimizer': 'adam', 'graph_mode': 'off', 'use_snp_selection': False}. Best is trial 8 with value: 0.07992299560724207.
[I 2025-12-05 14:59:12,339] Trial 9 finished with value: 0.0681542962746394 and parameters: {'model_type': 'mlp', 'hidden_dims': '[512, 64]', 'dropout': 0.14505336736221927, 'batch_norm': True, 'lr': 5.8619638388111826e-05, 'weight_decay': 6.200156172669308e-07, 'epochs': 175, 'loss': 'mse', 'optimizer': 'adam', 'graph_mode': 'off', 'use_snp_selection': False}. Best is trial 8 with value: 0.07992299560724207.
[I 2025-12-05 14:59:13,267] Trial 10 finished with value: 0.014598869617864703 and parameters: {'model_type': 'mlp', 'hidden_dims': '[512, 128]', 'dropout': 0.2800030442581858, 'batch_norm': False, 'lr': 0.0004919806695968258, 'weight_decay': 2.9953888095455486e-06, 'epochs': 55, 'loss': 'mae', 'optimizer': 'adam', 'graph_mode': 'off', 'use_snp_selection': False}. Best is trial 8 with value: 0.07992299560724207.
[I 2025-12-05 14:59:14,800] Trial 11 finished with value: 0.07497412914888985 and parameters: {'model_type': 'mlp', 'hidden_dims': '[512, 128]', 'dropout': 0.10095648685224448, 'batch_norm': True, 'lr': 0.0003411435764085616, 'weight_decay': 1.2045055692919657e-07, 'epochs': 216, 'loss': 'mse', 'optimizer': 'adam', 'graph_mode': 'off', 'use_snp_selection': False}. Best is trial 8 with value: 0.07992299560724207.
[I 2025-12-05 14:59:16,460] Trial 12 finished with value: 0.08149620217729851 and parameters: {'model_type': 'mlp', 'hidden_dims': '[512, 128]', 'dropout': 0.10344600881777158, 'batch_norm': True, 'lr': 0.0006674532614549997, 'weight_decay': 1.3081036432574914e-07, 'epochs': 255, 'loss': 'mae', 'optimizer': 'adam', 'graph_mode': 'off', 'use_snp_selection': False}. Best is trial 12 with value: 0.08149620217729851.
[I 2025-12-05 14:59:18,235] Trial 13 finished with value: 0.09011124815719353 and parameters: {'model_type': 'mlp', 'hidden_dims': '[512, 128]', 'dropout': 0.24294613148916022, 'batch_norm': True, 'lr': 0.00020263148232071683, 'weight_decay': 5.014770300041101e-06, 'epochs': 285, 'loss': 'mae', 'optimizer': 'adam', 'graph_mode': 'off', 'use_snp_selection': False}. Best is trial 13 with value: 0.09011124815719353.
[I 2025-12-05 14:59:19,978] Trial 14 finished with value: 0.07741977998137299 and parameters: {'model_type': 'mlp', 'hidden_dims': '[512, 128]', 'dropout': 0.28397504683850705, 'batch_norm': True, 'lr': 0.0008506803461065948, 'weight_decay': 1.1414924884997386e-07, 'epochs': 271, 'loss': 'mae', 'optimizer': 'adam', 'graph_mode': 'off', 'use_snp_selection': False}. Best is trial 13 with value: 0.09011124815719353.
[I 2025-12-05 14:59:20,864] Trial 15 finished with value: 0.07406888623264472 and parameters: {'model_type': 'mlp', 'hidden_dims': '[128, 64]', 'dropout': 0.2242589908578348, 'batch_norm': True, 'lr': 0.0001572871022003765, 'weight_decay': 3.587527636990087e-06, 'epochs': 264, 'loss': 'mae', 'optimizer': 'adam', 'graph_mode': 'off', 'use_snp_selection': False}. Best is trial 13 with value: 0.09011124815719353.
[I 2025-12-05 14:59:22,128] Trial 16 finished with value: 0.022088566244838174 and parameters: {'model_type': 'mlp', 'hidden_dims': '[256, 128, 64]', 'dropout': 0.3222546829382267, 'batch_norm': True, 'lr': 1.2586985041154999e-05, 'weight_decay': 5.80411511398968e-07, 'epochs': 299, 'loss': 'mae', 'optimizer': 'adam', 'graph_mode': 'off', 'use_snp_selection': False}. Best is trial 13 with value: 0.09011124815719353.
[I 2025-12-05 14:59:24,190] Trial 17 finished with value: 0.07634599994977379 and parameters: {'model_type': 'mlp', 'hidden_dims': '[512, 256]', 'dropout': 0.49525219385709973, 'batch_norm': True, 'lr': 0.000922802540406458, 'weight_decay': 5.5589412090866225e-05, 'epochs': 350, 'loss': 'mae', 'optimizer': 'adam', 'graph_mode': 'off', 'use_snp_selection': False}. Best is trial 13 with value: 0.09011124815719353.
[I 2025-12-05 14:59:27,267] Trial 18 finished with value: 0.08574780276680961 and parameters: {'model_type': 'mlp', 'hidden_dims': '[512, 128]', 'dropout': 0.18929888384865357, 'batch_norm': False, 'lr': 0.00016515111182346172, 'weight_decay': 4.109412643182284e-06, 'epochs': 227, 'loss': 'mae', 'optimizer': 'adam', 'graph_mode': 'off', 'use_snp_selection': True, 'num_snps': 58241}. Best is trial 13 with value: 0.09011124815719353.
[I 2025-12-05 14:59:30,293] Trial 19 finished with value: 0.07839772961398965 and parameters: {'model_type': 'mlp', 'hidden_dims': '[512, 128]', 'dropout': 0.2029503471791004, 'batch_norm': False, 'lr': 0.00014334793979738487, 'weight_decay': 4.783105564689756e-06, 'epochs': 229, 'loss': 'mae', 'optimizer': 'adam', 'graph_mode': 'off', 'use_snp_selection': True, 'num_snps': 55667}. Best is trial 13 with value: 0.09011124815719353.
[I 2025-12-05 14:59:33,397] Trial 20 finished with value: 0.08032641323659193 and parameters: {'model_type': 'mlp', 'hidden_dims': '[512, 128]', 'dropout': 0.34069652731592737, 'batch_norm': False, 'lr': 2.0000763562656867e-05, 'weight_decay': 1.3595287644937575e-06, 'epochs': 183, 'loss': 'mae', 'optimizer': 'adam', 'graph_mode': 'off', 'use_snp_selection': True, 'num_snps': 57703}. Best is trial 13 with value: 0.09011124815719353.
[I 2025-12-05 14:59:34,561] Trial 21 finished with value: 0.0672363724800825 and parameters: {'model_type': 'mlp', 'hidden_dims': '[512, 128]', 'dropout': 0.16548135929381044, 'batch_norm': False, 'lr': 0.0004029834673993843, 'weight_decay': 2.2456925222709162e-07, 'epochs': 247, 'loss': 'mae', 'optimizer': 'adam', 'graph_mode': 'off', 'use_snp_selection': True, 'num_snps': 11878}. Best is trial 13 with value: 0.09011124815719353.
[I 2025-12-05 14:59:36,143] Trial 22 finished with value: 0.07340776029272122 and parameters: {'model_type': 'mlp', 'hidden_dims': '[512, 128]', 'dropout': 0.2478701895191911, 'batch_norm': False, 'lr': 0.00011752166377662582, 'weight_decay': 5.8846240989229435e-06, 'epochs': 290, 'loss': 'mae', 'optimizer': 'adam', 'graph_mode': 'off', 'use_snp_selection': True, 'num_snps': 22259}. Best is trial 13 with value: 0.09011124815719353.
[I 2025-12-05 14:59:38,685] Trial 23 finished with value: 0.07603829396921113 and parameters: {'model_type': 'mlp', 'hidden_dims': '[512, 128]', 'dropout': 0.17942284185892782, 'batch_norm': False, 'lr': 0.00021658897178490253, 'weight_decay': 3.5201963196535535e-05, 'epochs': 209, 'loss': 'mae', 'optimizer': 'adam', 'graph_mode': 'off', 'use_snp_selection': True, 'num_snps': 46925}. Best is trial 13 with value: 0.09011124815719353.
[I 2025-12-05 14:59:40,438] Trial 24 finished with value: 0.07509203225138449 and parameters: {'model_type': 'mlp', 'hidden_dims': '[512, 128]', 'dropout': 0.1358550877561121, 'batch_norm': True, 'lr': 0.0005957854938004813, 'weight_decay': 1.2975562876949637e-06, 'epochs': 256, 'loss': 'mae', 'optimizer': 'adam', 'graph_mode': 'off', 'use_snp_selection': False}. Best is trial 13 with value: 0.09011124815719353.
[I 2025-12-05 14:59:41,557] Trial 25 finished with value: 0.07328457325891699 and parameters: {'model_type': 'mlp', 'hidden_dims': '[256, 128, 64]', 'dropout': 0.23026862667634151, 'batch_norm': True, 'lr': 0.00025753890685934735, 'weight_decay': 0.00014995603611042205, 'epochs': 235, 'loss': 'mae', 'optimizer': 'adam', 'graph_mode': 'off', 'use_snp_selection': False}. Best is trial 13 with value: 0.09011124815719353.
[I 2025-12-05 14:59:42,350] Trial 26 finished with value: 0.0489983672400143 and parameters: {'model_type': 'mlp', 'hidden_dims': '[128, 64]', 'dropout': 0.2995265463715879, 'batch_norm': False, 'lr': 0.00010404141603069648, 'weight_decay': 9.07635624472999e-06, 'epochs': 155, 'loss': 'mae', 'optimizer': 'adam', 'graph_mode': 'off', 'use_snp_selection': True, 'num_snps': 2344}. Best is trial 13 with value: 0.09011124815719353.
[I 2025-12-05 14:59:43,550] Trial 27 finished with value: 0.05969089961548159 and parameters: {'model_type': 'mlp', 'hidden_dims': '[256, 128]', 'dropout': 0.123831812977727, 'batch_norm': True, 'lr': 3.66672575522164e-05, 'weight_decay': 2.1571862825229127e-06, 'epochs': 287, 'loss': 'mae', 'optimizer': 'adam', 'graph_mode': 'off', 'use_snp_selection': False}. Best is trial 13 with value: 0.09011124815719353.
[I 2025-12-05 14:59:45,912] Trial 28 finished with value: 0.08173511858186008 and parameters: {'model_type': 'mlp', 'hidden_dims': '[512, 256]', 'dropout': 0.18885800146350032, 'batch_norm': False, 'lr': 2.2502925142646104e-05, 'weight_decay': 2.789799750592747e-07, 'epochs': 117, 'loss': 'mae', 'optimizer': 'adam', 'graph_mode': 'off', 'use_snp_selection': True, 'num_snps': 48700}. Best is trial 13 with value: 0.09011124815719353.
[I 2025-12-05 14:59:48,329] Trial 29 finished with value: 0.0788385472837613 and parameters: {'model_type': 'mlp', 'hidden_dims': '[512, 256]', 'dropout': 0.20281383784017806, 'batch_norm': False, 'lr': 1.89072014172964e-05, 'weight_decay': 6.13770654147158e-05, 'epochs': 116, 'loss': 'mae', 'optimizer': 'adam', 'graph_mode': 'off', 'use_snp_selection': True, 'num_snps': 49145}. Best is trial 13 with value: 0.09011124815719353.
[I 2025-12-05 14:59:51,170] Trial 30 finished with value: 0.05417433228065475 and parameters: {'model_type': 'mlp', 'hidden_dims': '[512, 256]', 'dropout': 0.18850024230886603, 'batch_norm': False, 'lr': 1.242098875382297e-05, 'weight_decay': 2.9310702303566687e-07, 'epochs': 94, 'loss': 'mae', 'optimizer': 'adam', 'graph_mode': 'off', 'use_snp_selection': True, 'num_snps': 59016}. Best is trial 13 with value: 0.09011124815719353.
