[I 2025-12-05 15:38:36,694] Trial 122 finished with value: 0.10005942353005953 and parameters: {'model_type': 'mlp', 'hidden_dims': '[512, 256]', 'dropout': 0.1345909898441856, 'batch_norm': True, 'lr': 0.00022185927175992213, 'weight_decay': 4.0773229015565793e-07, 'epochs': 150, 'loss': 'mse', 'optimizer': 'adam', 'graph_mode': 'off', 'use_snp_selection': False}. Best is trial 112 with value: 0.1324077695104809.
[I 2025-12-05 15:38:37,929] Trial 123 finished with value: 0.1100371866242531 and parameters: {'model_type': 'mlp', 'hidden_dims': '[512, 256]', 'dropout': 0.12303392474321688, 'batch_norm': True, 'lr': 0.0005547440103440168, 'weight_decay': 0.0004191883027406746, 'epochs': 143, 'loss': 'mse', 'optimizer': 'adam', 'graph_mode': 'off', 'use_snp_selection': False}. Best is trial 112 with value: 0.1324077695104809.
[I 2025-12-05 15:38:39,529] Trial 124 finished with value: 0.10793685733312502 and parameters: {'model_type': 'mlp', 'hidden_dims': '[512, 256]', 'dropout': 0.15702455814309857, 'batch_norm': True, 'lr': 0.00020667604447422168, 'weight_decay': 2.1095171398903e-07, 'epochs': 239, 'loss': 'mse', 'optimizer': 'adam', 'graph_mode': 'off', 'use_snp_selection': False}. Best is trial 112 with value: 0.1324077695104809.
[I 2025-12-05 15:38:40,577] Trial 125 finished with value: 0.11922848871727049 and parameters: {'model_type': 'mlp', 'hidden_dims': '[512, 256]', 'dropout': 0.14226678243450228, 'batch_norm': True, 'lr': 0.0006543981572964555, 'weight_decay': 5.552658339996832e-07, 'epochs': 95, 'loss': 'mse', 'optimizer': 'adam', 'graph_mode': 'off', 'use_snp_selection': False}. Best is trial 112 with value: 0.1324077695104809.
[I 2025-12-05 15:38:42,130] Trial 126 finished with value: 0.09551241638709008 and parameters: {'model_type': 'mlp', 'hidden_dims': '[512, 256]', 'dropout': 0.5437196642319234, 'batch_norm': True, 'lr': 0.0002721222581412305, 'weight_decay': 6.819827916276246e-07, 'epochs': 108, 'loss': 'mse', 'optimizer': 'adam', 'graph_mode': 'off', 'use_snp_selection': True, 'num_snps': 28304}. Best is trial 112 with value: 0.1324077695104809.
[I 2025-12-05 15:38:42,958] Trial 127 finished with value: 0.11775330170197543 and parameters: {'model_type': 'mlp', 'hidden_dims': '[256, 128]', 'dropout': 0.18519267003314865, 'batch_norm': True, 'lr': 0.0008870851088608307, 'weight_decay': 8.968839954694915e-07, 'epochs': 114, 'loss': 'mse', 'optimizer': 'adam', 'graph_mode': 'off', 'use_snp_selection': False}. Best is trial 112 with value: 0.1324077695104809.
[I 2025-12-05 15:38:44,586] Trial 128 finished with value: 0.10681460436312455 and parameters: {'model_type': 'mlp', 'hidden_dims': '[512, 256]', 'dropout': 0.4584927665641505, 'batch_norm': True, 'lr': 0.00037518841930636544, 'weight_decay': 1.1257047494664374e-06, 'epochs': 247, 'loss': 'mse', 'optimizer': 'adam', 'graph_mode': 'off', 'use_snp_selection': False}. Best is trial 112 with value: 0.1324077695104809.
[I 2025-12-05 15:38:45,278] Trial 129 finished with value: 0.10307529993944599 and parameters: {'model_type': 'mlp', 'hidden_dims': '[128, 64]', 'dropout': 0.12083506829573819, 'batch_norm': True, 'lr': 0.0007275103407747555, 'weight_decay': 4.505002045052479e-07, 'epochs': 126, 'loss': 'mse', 'optimizer': 'adam', 'graph_mode': 'off', 'use_snp_selection': False}. Best is trial 112 with value: 0.1324077695104809.
[I 2025-12-05 15:38:46,278] Trial 130 finished with value: 0.09318393051930886 and parameters: {'model_type': 'mlp', 'hidden_dims': '[512, 64]', 'dropout': 0.10888922518462991, 'batch_norm': True, 'lr': 0.00031262262969986704, 'weight_decay': 3.935049029166292e-06, 'epochs': 78, 'loss': 'mse', 'optimizer': 'adam', 'graph_mode': 'off', 'use_snp_selection': False}. Best is trial 112 with value: 0.1324077695104809.
[I 2025-12-05 15:38:47,464] Trial 131 finished with value: 0.10398680056425907 and parameters: {'model_type': 'mlp', 'hidden_dims': '[512, 256]', 'dropout': 0.11139575682391582, 'batch_norm': True, 'lr': 0.0003207383522743959, 'weight_decay': 1.4256944872075684e-06, 'epochs': 131, 'loss': 'mse', 'optimizer': 'adam', 'graph_mode': 'off', 'use_snp_selection': False}. Best is trial 112 with value: 0.1324077695104809.
[I 2025-12-05 15:38:48,672] Trial 132 finished with value: 0.10879764052951088 and parameters: {'model_type': 'mlp', 'hidden_dims': '[512, 256]', 'dropout': 0.12997946231545152, 'batch_norm': True, 'lr': 0.00016734763495592698, 'weight_decay': 7.803357669804151e-07, 'epochs': 138, 'loss': 'mse', 'optimizer': 'adam', 'graph_mode': 'off', 'use_snp_selection': False}. Best is trial 112 with value: 0.1324077695104809.
[I 2025-12-05 15:38:49,963] Trial 133 finished with value: 0.11522882771888192 and parameters: {'model_type': 'mlp', 'hidden_dims': '[512, 256]', 'dropout': 0.1460586651149785, 'batch_norm': True, 'lr': 0.0002451367394333714, 'weight_decay': 1.7181114590468922e-06, 'epochs': 154, 'loss': 'mse', 'optimizer': 'adam', 'graph_mode': 'off', 'use_snp_selection': False}. Best is trial 112 with value: 0.1324077695104809.
[I 2025-12-05 15:38:51,271] Trial 134 finished with value: 0.12280734244982816 and parameters: {'model_type': 'mlp', 'hidden_dims': '[512, 256]', 'dropout': 0.16322065496149277, 'batch_norm': True, 'lr': 0.0004062056806088798, 'weight_decay': 5.874901538837683e-07, 'epochs': 164, 'loss': 'mse', 'optimizer': 'adam', 'graph_mode': 'off', 'use_snp_selection': False}. Best is trial 112 with value: 0.1324077695104809.
[I 2025-12-05 15:38:52,572] Trial 135 finished with value: 0.11559738820942804 and parameters: {'model_type': 'mlp', 'hidden_dims': '[512, 256]', 'dropout': 0.16725555147650442, 'batch_norm': True, 'lr': 0.00043920880947911667, 'weight_decay': 6.093680300213548e-07, 'epochs': 162, 'loss': 'mse', 'optimizer': 'adam', 'graph_mode': 'off', 'use_snp_selection': False}. Best is trial 112 with value: 0.1324077695104809.
[I 2025-12-05 15:38:53,914] Trial 136 finished with value: 0.10949391738158001 and parameters: {'model_type': 'mlp', 'hidden_dims': '[512, 128]', 'dropout': 0.22123706642961533, 'batch_norm': True, 'lr': 0.00047937419424018917, 'weight_decay': 1.3101680305669188e-07, 'epochs': 171, 'loss': 'mae', 'optimizer': 'adam', 'graph_mode': 'off', 'use_snp_selection': False}. Best is trial 112 with value: 0.1324077695104809.
[I 2025-12-05 15:38:54,799] Trial 137 finished with value: 0.08287993264244177 and parameters: {'model_type': 'mlp', 'hidden_dims': '[256, 128]', 'dropout': 0.3423432985186522, 'batch_norm': True, 'lr': 0.0007619648596686033, 'weight_decay': 3.355141348466038e-07, 'epochs': 153, 'loss': 'mse', 'optimizer': 'adam', 'graph_mode': 'off', 'use_snp_selection': False}. Best is trial 112 with value: 0.1324077695104809.
[I 2025-12-05 15:38:56,230] Trial 138 finished with value: 0.08132737900324469 and parameters: {'model_type': 'mlp', 'hidden_dims': '[512, 256]', 'dropout': 0.16143836289755467, 'batch_norm': False, 'lr': 0.00038329218411529715, 'weight_decay': 5.180327168088628e-07, 'epochs': 192, 'loss': 'mse', 'optimizer': 'adam', 'graph_mode': 'off', 'use_snp_selection': False}. Best is trial 112 with value: 0.1324077695104809.
[I 2025-12-05 15:38:57,481] Trial 139 finished with value: 0.10614125372056725 and parameters: {'model_type': 'mlp', 'hidden_dims': '[512, 256]', 'dropout': 0.13521689404983536, 'batch_norm': True, 'lr': 0.00018868808751002042, 'weight_decay': 5.152784929408032e-06, 'epochs': 147, 'loss': 'mse', 'optimizer': 'adam', 'graph_mode': 'off', 'use_snp_selection': False}. Best is trial 112 with value: 0.1324077695104809.
[I 2025-12-05 15:38:58,145] Trial 140 finished with value: 0.046913127465292595 and parameters: {'model_type': 'mlp', 'hidden_dims': '[128, 64]', 'dropout': 0.2023430773013658, 'batch_norm': True, 'lr': 1.9730972906485243e-06, 'weight_decay': 2.2845961232446584e-06, 'epochs': 103, 'loss': 'mse', 'optimizer': 'adam', 'graph_mode': 'off', 'use_snp_selection': False}. Best is trial 112 with value: 0.1324077695104809.
[I 2025-12-05 15:38:59,376] Trial 141 finished with value: 0.08503665007112512 and parameters: {'model_type': 'mlp', 'hidden_dims': '[512, 256]', 'dropout': 0.11790162357070576, 'batch_norm': True, 'lr': 1.766772597958174e-05, 'weight_decay': 1.0610945731002902e-06, 'epochs': 144, 'loss': 'mse', 'optimizer': 'adam', 'graph_mode': 'off', 'use_snp_selection': False}. Best is trial 112 with value: 0.1324077695104809.
[I 2025-12-05 15:39:00,736] Trial 142 finished with value: 0.11898471979831544 and parameters: {'model_type': 'mlp', 'hidden_dims': '[512, 256]', 'dropout': 0.1483274203954937, 'batch_norm': True, 'lr': 0.0002958590498445139, 'weight_decay': 7.854200894364437e-07, 'epochs': 177, 'loss': 'mse', 'optimizer': 'adam', 'graph_mode': 'off', 'use_snp_selection': False}. Best is trial 112 with value: 0.1324077695104809.
[I 2025-12-05 15:39:01,907] Trial 143 finished with value: 0.10118467805262554 and parameters: {'model_type': 'mlp', 'hidden_dims': '[512, 256]', 'dropout': 0.1063102482948116, 'batch_norm': True, 'lr': 0.0009921466959763802, 'weight_decay': 1.3316606625914144e-06, 'epochs': 122, 'loss': 'mse', 'optimizer': 'adam', 'graph_mode': 'off', 'use_snp_selection': False}. Best is trial 112 with value: 0.1324077695104809.
[I 2025-12-05 15:39:03,115] Trial 144 finished with value: 0.09978473007135347 and parameters: {'model_type': 'mlp', 'hidden_dims': '[512, 256]', 'dropout': 0.12446729922757788, 'batch_norm': True, 'lr': 0.00035287068539836624, 'weight_decay': 2.783578332441947e-06, 'epochs': 138, 'loss': 'mse', 'optimizer': 'adam', 'graph_mode': 'off', 'use_snp_selection': False}. Best is trial 112 with value: 0.1324077695104809.
[I 2025-12-05 15:39:03,827] Trial 145 finished with value: 0.09764945470778133 and parameters: {'model_type': 'mlp', 'hidden_dims': '[256, 128]', 'dropout': 0.18304031299969067, 'batch_norm': True, 'lr': 0.00023141999424229178, 'weight_decay': 9.503683939910177e-07, 'epochs': 66, 'loss': 'mse', 'optimizer': 'adam', 'graph_mode': 'off', 'use_snp_selection': False}. Best is trial 112 with value: 0.1324077695104809.
[I 2025-12-05 15:39:05,219] Trial 146 finished with value: 0.1183953238567626 and parameters: {'model_type': 'mlp', 'hidden_dims': '[512, 256]', 'dropout': 0.14208606987564945, 'batch_norm': True, 'lr': 0.0005882667911712317, 'weight_decay': 1.2044312681730412e-06, 'epochs': 186, 'loss': 'mse', 'optimizer': 'adam', 'graph_mode': 'off', 'use_snp_selection': False}. Best is trial 112 with value: 0.1324077695104809.
[I 2025-12-05 15:39:06,137] Trial 147 finished with value: 0.10048257831749252 and parameters: {'model_type': 'mlp', 'hidden_dims': '[256, 128, 64]', 'dropout': 0.11608079655547517, 'batch_norm': True, 'lr': 0.0001374108369172456, 'weight_decay': 1.973058256648192e-06, 'epochs': 162, 'loss': 'mse', 'optimizer': 'adam', 'graph_mode': 'off', 'use_snp_selection': False}. Best is trial 112 with value: 0.1324077695104809.
[I 2025-12-05 15:39:07,267] Trial 148 finished with value: 0.10634163624942511 and parameters: {'model_type': 'mlp', 'hidden_dims': '[256, 128]', 'dropout': 0.10088598837851878, 'batch_norm': True, 'lr': 0.00026115977164216787, 'weight_decay': 7.26989104823515e-07, 'epochs': 215, 'loss': 'mae', 'optimizer': 'adam', 'graph_mode': 'off', 'use_snp_selection': True, 'num_snps': 12132}. Best is trial 112 with value: 0.1324077695104809.
[I 2025-12-05 15:39:08,303] Trial 149 finished with value: 0.1104659021981977 and parameters: {'model_type': 'mlp', 'hidden_dims': '[512, 256]', 'dropout': 0.12981713056916735, 'batch_norm': True, 'lr': 0.00020802172803056934, 'weight_decay': 1.552788126455482e-06, 'epochs': 86, 'loss': 'mse', 'optimizer': 'adam', 'graph_mode': 'off', 'use_snp_selection': False}. Best is trial 112 with value: 0.1324077695104809.
[I 2025-12-05 15:39:10,530] Trial 0 finished with value: 0.055452094483305285 and parameters: {'model_type': 'mlp', 'hidden_dims': '[128, 64]', 'dropout': 0.199031432379812, 'batch_norm': True, 'lr': 1.8408544111075837e-06, 'weight_decay': 5.5136510071208614e-05, 'epochs': 336, 'loss': 'mae', 'optimizer': 'adam', 'graph_mode': 'off', 'use_snp_selection': True, 'num_snps': 43862}. Best is trial 0 with value: 0.055452094483305285.
[I 2025-12-05 15:39:11,597] Trial 1 finished with value: 0.07485095217339273 and parameters: {'model_type': 'mlp', 'hidden_dims': '[256, 128]', 'dropout': 0.4370668075331726, 'batch_norm': True, 'lr': 7.133471581159139e-05, 'weight_decay': 1.128633586803549e-05, 'epochs': 242, 'loss': 'mae', 'optimizer': 'adam', 'graph_mode': 'off', 'use_snp_selection': False}. Best is trial 1 with value: 0.07485095217339273.
[I 2025-12-05 15:39:12,607] Trial 2 finished with value: -0.00245323367612324 and parameters: {'model_type': 'mlp', 'hidden_dims': '[256, 128, 64]', 'dropout': 0.41314357415569625, 'batch_norm': False, 'lr': 3.952233718592101e-06, 'weight_decay': 0.00026754769258252603, 'epochs': 149, 'loss': 'mse', 'optimizer': 'adam', 'graph_mode': 'off', 'use_snp_selection': True, 'num_snps': 11571}. Best is trial 1 with value: 0.07485095217339273.
[I 2025-12-05 15:39:14,477] Trial 3 finished with value: 0.09232537096264276 and parameters: {'model_type': 'mlp', 'hidden_dims': '[512, 64]', 'dropout': 0.5938127374509361, 'batch_norm': False, 'lr': 5.67704586114731e-06, 'weight_decay': 2.4518087630137052e-05, 'epochs': 320, 'loss': 'mae', 'optimizer': 'adam', 'graph_mode': 'off', 'use_snp_selection': False}. Best is trial 3 with value: 0.09232537096264276.
[I 2025-12-05 15:39:16,700] Trial 4 finished with value: 0.035907441760413515 and parameters: {'model_type': 'mlp', 'hidden_dims': '[512, 128]', 'dropout': 0.25746343592134413, 'batch_norm': True, 'lr': 1.3467657668402788e-06, 'weight_decay': 0.00033087251918647806, 'epochs': 277, 'loss': 'mse', 'optimizer': 'adam', 'graph_mode': 'off', 'use_snp_selection': True, 'num_snps': 36675}. Best is trial 3 with value: 0.09232537096264276.
[I 2025-12-05 15:39:18,442] Trial 5 finished with value: 0.043742675796603854 and parameters: {'model_type': 'mlp', 'hidden_dims': '[512, 64]', 'dropout': 0.38275350994408375, 'batch_norm': True, 'lr': 1.5586664309232824e-06, 'weight_decay': 0.0008227664668621182, 'epochs': 145, 'loss': 'mae', 'optimizer': 'adam', 'graph_mode': 'off', 'use_snp_selection': True, 'num_snps': 32148}. Best is trial 3 with value: 0.09232537096264276.
[I 2025-12-05 15:39:19,405] Trial 6 finished with value: 0.06623080076712126 and parameters: {'model_type': 'mlp', 'hidden_dims': '[256, 128]', 'dropout': 0.3930109900265879, 'batch_norm': False, 'lr': 4.892964372128395e-05, 'weight_decay': 1.5809549317992182e-06, 'epochs': 199, 'loss': 'mse', 'optimizer': 'adam', 'graph_mode': 'off', 'use_snp_selection': False}. Best is trial 3 with value: 0.09232537096264276.
[I 2025-12-05 15:39:20,453] Trial 7 finished with value: 0.06219731553896294 and parameters: {'model_type': 'mlp', 'hidden_dims': '[512, 256]', 'dropout': 0.15343979219678458, 'batch_norm': True, 'lr': 6.234003099047341e-05, 'weight_decay': 3.894760610535477e-07, 'epochs': 97, 'loss': 'mse', 'optimizer': 'adam', 'graph_mode': 'off', 'use_snp_selection': False}. Best is trial 3 with value: 0.09232537096264276.
[I 2025-12-05 15:39:22,330] Trial 8 finished with value: 0.07921745580972885 and parameters: {'model_type': 'mlp', 'hidden_dims': '[512, 128]', 'dropout': 0.10743001231661406, 'batch_norm': True, 'lr': 0.00023728538449271062, 'weight_decay': 1.7629071578048637e-05, 'epochs': 312, 'loss': 'mae', 'optimizer': 'adam', 'graph_mode': 'off', 'use_snp_selection': False}. Best is trial 3 with value: 0.09232537096264276.
[I 2025-12-05 15:39:23,669] Trial 9 finished with value: 0.08683571627331009 and parameters: {'model_type': 'mlp', 'hidden_dims': '[512, 64]', 'dropout': 0.14505336736221927, 'batch_norm': True, 'lr': 5.8619638388111826e-05, 'weight_decay': 6.200156172669308e-07, 'epochs': 175, 'loss': 'mse', 'optimizer': 'adam', 'graph_mode': 'off', 'use_snp_selection': False}. Best is trial 3 with value: 0.09232537096264276.
[I 2025-12-05 15:39:24,559] Trial 10 finished with value: 0.02865961252084535 and parameters: {'model_type': 'mlp', 'hidden_dims': '[512, 64]', 'dropout': 0.5885461262002587, 'batch_norm': False, 'lr': 8.769366258768696e-06, 'weight_decay': 2.78273193871783e-06, 'epochs': 55, 'loss': 'mae', 'optimizer': 'adam', 'graph_mode': 'off', 'use_snp_selection': False}. Best is trial 3 with value: 0.09232537096264276.
[I 2025-12-05 15:39:26,040] Trial 11 finished with value: 0.013868437225615333 and parameters: {'model_type': 'mlp', 'hidden_dims': '[512, 64]', 'dropout': 0.583942291816117, 'batch_norm': False, 'lr': 1.422933652790185e-05, 'weight_decay': 1.2045055692919657e-07, 'epochs': 213, 'loss': 'mse', 'optimizer': 'adam', 'graph_mode': 'off', 'use_snp_selection': False}. Best is trial 3 with value: 0.09232537096264276.
[I 2025-12-05 15:39:27,299] Trial 12 finished with value: 0.017311835815752828 and parameters: {'model_type': 'mlp', 'hidden_dims': '[512, 64]', 'dropout': 0.2637316882220091, 'batch_norm': False, 'lr': 0.0006753264773209732, 'weight_decay': 1.6488595357534196e-06, 'epochs': 154, 'loss': 'mae', 'optimizer': 'adam', 'graph_mode': 'off', 'use_snp_selection': False}. Best is trial 3 with value: 0.09232537096264276.
[I 2025-12-05 15:39:28,985] Trial 13 finished with value: 0.05524252690976439 and parameters: {'model_type': 'mlp', 'hidden_dims': '[512, 64]', 'dropout': 0.5086194929129976, 'batch_norm': False, 'lr': 1.4304506621636526e-05, 'weight_decay': 4.373608364627903e-05, 'epochs': 261, 'loss': 'mse', 'optimizer': 'adam', 'graph_mode': 'off', 'use_snp_selection': False}. Best is trial 3 with value: 0.09232537096264276.
[I 2025-12-05 15:39:29,903] Trial 14 finished with value: 0.06667839685133321 and parameters: {'model_type': 'mlp', 'hidden_dims': '[128, 64]', 'dropout': 0.3012984444538551, 'batch_norm': True, 'lr': 0.00017558188744418174, 'weight_decay': 4.57067734295802e-06, 'epochs': 293, 'loss': 'mse', 'optimizer': 'adam', 'graph_mode': 'off', 'use_snp_selection': False}. Best is trial 3 with value: 0.09232537096264276.
[I 2025-12-05 15:39:31,453] Trial 15 finished with value: 0.049005404131121096 and parameters: {'model_type': 'mlp', 'hidden_dims': '[512, 256]', 'dropout': 0.48263162073930665, 'batch_norm': False, 'lr': 2.200457974768058e-05, 'weight_decay': 4.081624813577402e-07, 'epochs': 231, 'loss': 'mae', 'optimizer': 'adam', 'graph_mode': 'off', 'use_snp_selection': False}. Best is trial 3 with value: 0.09232537096264276.
[I 2025-12-05 15:39:32,777] Trial 16 finished with value: 0.03353159146827215 and parameters: {'model_type': 'mlp', 'hidden_dims': '[256, 128, 64]', 'dropout': 0.3148124780833136, 'batch_norm': True, 'lr': 6.013316929814413e-06, 'weight_decay': 3.895033692555648e-05, 'epochs': 350, 'loss': 'mse', 'optimizer': 'adam', 'graph_mode': 'off', 'use_snp_selection': False}. Best is trial 3 with value: 0.09232537096264276.
[I 2025-12-05 15:39:33,883] Trial 17 finished with value: 0.023446300663168853 and parameters: {'model_type': 'mlp', 'hidden_dims': '[512, 64]', 'dropout': 0.5199905774474576, 'batch_norm': False, 'lr': 0.00015757341301155474, 'weight_decay': 5.666950082267898e-07, 'epochs': 113, 'loss': 'mae', 'optimizer': 'adam', 'graph_mode': 'off', 'use_snp_selection': False}. Best is trial 3 with value: 0.09232537096264276.
[I 2025-12-05 15:39:36,801] Trial 18 finished with value: 0.05996741948890113 and parameters: {'model_type': 'mlp', 'hidden_dims': '[512, 64]', 'dropout': 0.20963792418383684, 'batch_norm': False, 'lr': 2.797772152750264e-05, 'weight_decay': 5.409591144113358e-06, 'epochs': 172, 'loss': 'mse', 'optimizer': 'adam', 'graph_mode': 'off', 'use_snp_selection': True, 'num_snps': 58241}. Best is trial 3 with value: 0.09232537096264276.
[I 2025-12-05 15:39:38,223] Trial 19 finished with value: -0.010288633484572292 and parameters: {'model_type': 'mlp', 'hidden_dims': '[512, 64]', 'dropout': 0.3374688803808355, 'batch_norm': True, 'lr': 3.3494044772935343e-06, 'weight_decay': 1.1354159408743119e-07, 'epochs': 185, 'loss': 'mae', 'optimizer': 'adam', 'graph_mode': 'off', 'use_snp_selection': False}. Best is trial 3 with value: 0.09232537096264276.
[I 2025-12-05 15:39:39,064] Trial 20 finished with value: 0.041897268843070136 and parameters: {'model_type': 'mlp', 'hidden_dims': '[512, 128]', 'dropout': 0.14114479152057646, 'batch_norm': False, 'lr': 0.0002995209451731648, 'weight_decay': 0.00015711537877451736, 'epochs': 43, 'loss': 'mae', 'optimizer': 'adam', 'graph_mode': 'off', 'use_snp_selection': False}. Best is trial 3 with value: 0.09232537096264276.
[I 2025-12-05 15:39:40,937] Trial 21 finished with value: 0.0847951614395948 and parameters: {'model_type': 'mlp', 'hidden_dims': '[512, 128]', 'dropout': 0.10290428437530558, 'batch_norm': True, 'lr': 0.0005324560544855536, 'weight_decay': 1.5685969505030866e-05, 'epochs': 311, 'loss': 'mae', 'optimizer': 'adam', 'graph_mode': 'off', 'use_snp_selection': False}. Best is trial 3 with value: 0.09232537096264276.
[I 2025-12-05 15:39:42,811] Trial 22 finished with value: 0.07752818834048752 and parameters: {'model_type': 'mlp', 'hidden_dims': '[512, 128]', 'dropout': 0.10433455259703313, 'batch_norm': True, 'lr': 0.000632426996592353, 'weight_decay': 2.234736040373779e-05, 'epochs': 312, 'loss': 'mae', 'optimizer': 'adam', 'graph_mode': 'off', 'use_snp_selection': False}. Best is trial 3 with value: 0.09232537096264276.
[I 2025-12-05 15:39:44,491] Trial 23 finished with value: 0.06882488820497129 and parameters: {'model_type': 'mlp', 'hidden_dims': '[512, 128]', 'dropout': 0.1813698559219638, 'batch_norm': True, 'lr': 0.0009166468720883459, 'weight_decay': 8.900543690060752e-05, 'epochs': 258, 'loss': 'mae', 'optimizer': 'adam', 'graph_mode': 'off', 'use_snp_selection': False}. Best is trial 3 with value: 0.09232537096264276.
