[I 2025-12-06 07:27:47,791] Trial 43 finished with value: 0.3103918033245513 and parameters: {'model_type': 'mlp', 'hidden_dims': '[512, 256]', 'dropout': 0.5104477808400714, 'batch_norm': False, 'lr': 2.680941953034859e-05, 'weight_decay': 1.8553557616577732e-05, 'epochs': 309, 'loss': 'mse', 'optimizer': 'adam', 'graph_mode': 'off', 'use_snp_selection': True, 'num_snps': 31192}. Best is trial 17 with value: 0.3199931949585276.
[I 2025-12-06 07:28:42,164] Trial 44 finished with value: 0.3128580942192907 and parameters: {'model_type': 'mlp', 'hidden_dims': '[512, 128]', 'dropout': 0.5762943577291183, 'batch_norm': False, 'lr': 3.795800771601492e-05, 'weight_decay': 2.140669802398178e-06, 'epochs': 284, 'loss': 'mae', 'optimizer': 'adam', 'graph_mode': 'off', 'use_snp_selection': False}. Best is trial 17 with value: 0.3199931949585276.
[I 2025-12-06 07:29:16,209] Trial 45 finished with value: 0.29548142639716873 and parameters: {'model_type': 'mlp', 'hidden_dims': '[256, 128]', 'dropout': 0.47981792189754, 'batch_norm': True, 'lr': 4.393227504656441e-06, 'weight_decay': 6.098159398911521e-05, 'epochs': 320, 'loss': 'mae', 'optimizer': 'adam', 'graph_mode': 'off', 'use_snp_selection': False}. Best is trial 17 with value: 0.3199931949585276.
[I 2025-12-06 07:29:59,782] Trial 46 finished with value: 0.3007100776897908 and parameters: {'model_type': 'mlp', 'hidden_dims': '[512, 64]', 'dropout': 0.5445607334084813, 'batch_norm': False, 'lr': 1.0109216252326946e-05, 'weight_decay': 9.889151884372833e-07, 'epochs': 110, 'loss': 'mae', 'optimizer': 'adam', 'graph_mode': 'off', 'use_snp_selection': True, 'num_snps': 38489}. Best is trial 17 with value: 0.3199931949585276.
[I 2025-12-06 07:30:12,858] Trial 47 finished with value: 0.2827287019693407 and parameters: {'model_type': 'mlp', 'hidden_dims': '[512, 256]', 'dropout': 0.1853182659628498, 'batch_norm': False, 'lr': 1.4935165006694169e-05, 'weight_decay': 0.00018532886992778008, 'epochs': 45, 'loss': 'mae', 'optimizer': 'adam', 'graph_mode': 'off', 'use_snp_selection': False}. Best is trial 17 with value: 0.3199931949585276.
[I 2025-12-06 07:30:32,649] Trial 48 finished with value: 0.28418687775139234 and parameters: {'model_type': 'mlp', 'hidden_dims': '[128, 64]', 'dropout': 0.5736812052970792, 'batch_norm': True, 'lr': 1.680321251791039e-06, 'weight_decay': 9.002139125877295e-06, 'epochs': 297, 'loss': 'mse', 'optimizer': 'adam', 'graph_mode': 'off', 'use_snp_selection': False}. Best is trial 17 with value: 0.3199931949585276.
[I 2025-12-06 07:31:46,044] Trial 49 finished with value: 0.3083434169285515 and parameters: {'model_type': 'mlp', 'hidden_dims': '[512, 128]', 'dropout': 0.37214798737468235, 'batch_norm': False, 'lr': 0.0001220805098420146, 'weight_decay': 1.693148873372154e-05, 'epochs': 259, 'loss': 'mae', 'optimizer': 'adam', 'graph_mode': 'off', 'use_snp_selection': True, 'num_snps': 53083}. Best is trial 17 with value: 0.3199931949585276.
[I 2025-12-06 07:32:50,173] Trial 50 finished with value: 0.31110910830591887 and parameters: {'model_type': 'mlp', 'hidden_dims': '[512, 256]', 'dropout': 0.5121729978374642, 'batch_norm': False, 'lr': 5.5068786050972334e-05, 'weight_decay': 4.003542353234787e-05, 'epochs': 339, 'loss': 'mae', 'optimizer': 'adam', 'graph_mode': 'off', 'use_snp_selection': False}. Best is trial 17 with value: 0.3199931949585276.
[I 2025-12-06 07:33:57,165] Trial 51 finished with value: 0.3121068576714813 and parameters: {'model_type': 'mlp', 'hidden_dims': '[256, 128]', 'dropout': 0.4351949514594231, 'batch_norm': False, 'lr': 2.139049258889681e-06, 'weight_decay': 1.626171000359284e-05, 'epochs': 350, 'loss': 'mse', 'optimizer': 'adam', 'graph_mode': 'off', 'use_snp_selection': True, 'num_snps': 59839}. Best is trial 17 with value: 0.3199931949585276.
[I 2025-12-06 07:34:58,110] Trial 52 finished with value: 0.3194865950263027 and parameters: {'model_type': 'mlp', 'hidden_dims': '[256, 128]', 'dropout': 0.47214086213466966, 'batch_norm': False, 'lr': 3.067064765441881e-06, 'weight_decay': 7.586239405902906e-05, 'epochs': 338, 'loss': 'mse', 'optimizer': 'adam', 'graph_mode': 'off', 'use_snp_selection': True, 'num_snps': 52394}. Best is trial 17 with value: 0.3199931949585276.
[I 2025-12-06 07:35:55,828] Trial 53 finished with value: 0.3164441629361902 and parameters: {'model_type': 'mlp', 'hidden_dims': '[256, 128]', 'dropout': 0.4768234863536297, 'batch_norm': False, 'lr': 3.0237587222792224e-06, 'weight_decay': 3.7526148677535172e-06, 'epochs': 322, 'loss': 'mse', 'optimizer': 'adam', 'graph_mode': 'off', 'use_snp_selection': True, 'num_snps': 50440}. Best is trial 17 with value: 0.3199931949585276.
[I 2025-12-06 07:36:54,133] Trial 54 finished with value: 0.31551200778255806 and parameters: {'model_type': 'mlp', 'hidden_dims': '[256, 128]', 'dropout': 0.46284409098455026, 'batch_norm': False, 'lr': 3.3214447421705356e-06, 'weight_decay': 0.00043559375780113924, 'epochs': 334, 'loss': 'mse', 'optimizer': 'adam', 'graph_mode': 'off', 'use_snp_selection': True, 'num_snps': 50033}. Best is trial 17 with value: 0.3199931949585276.
[I 2025-12-06 07:37:46,635] Trial 55 finished with value: 0.30831447041522536 and parameters: {'model_type': 'mlp', 'hidden_dims': '[256, 128]', 'dropout': 0.47682541744551477, 'batch_norm': False, 'lr': 2.7521297954461548e-06, 'weight_decay': 8.27869399927089e-05, 'epochs': 317, 'loss': 'mse', 'optimizer': 'adam', 'graph_mode': 'off', 'use_snp_selection': True, 'num_snps': 43999}. Best is trial 17 with value: 0.3199931949585276.
[I 2025-12-06 07:38:40,398] Trial 56 finished with value: 0.2948299993324768 and parameters: {'model_type': 'mlp', 'hidden_dims': '[256, 128]', 'dropout': 0.5088618687139175, 'batch_norm': False, 'lr': 1.426663031468604e-06, 'weight_decay': 4.379566659659448e-06, 'epochs': 305, 'loss': 'mse', 'optimizer': 'adam', 'graph_mode': 'off', 'use_snp_selection': True, 'num_snps': 45933}. Best is trial 17 with value: 0.3199931949585276.
[I 2025-12-06 07:39:39,702] Trial 57 finished with value: 0.3179067281941143 and parameters: {'model_type': 'mlp', 'hidden_dims': '[256, 128]', 'dropout': 0.41056355984931203, 'batch_norm': False, 'lr': 4.215355745243411e-06, 'weight_decay': 1.99647530863279e-06, 'epochs': 283, 'loss': 'mse', 'optimizer': 'adam', 'graph_mode': 'off', 'use_snp_selection': True, 'num_snps': 55579}. Best is trial 17 with value: 0.3199931949585276.
[I 2025-12-06 07:40:39,198] Trial 58 finished with value: 0.31297260379933856 and parameters: {'model_type': 'mlp', 'hidden_dims': '[256, 128]', 'dropout': 0.4087208474273638, 'batch_norm': False, 'lr': 7.394384490668413e-06, 'weight_decay': 7.449990183057893e-06, 'epochs': 281, 'loss': 'mse', 'optimizer': 'adam', 'graph_mode': 'off', 'use_snp_selection': True, 'num_snps': 56444}. Best is trial 17 with value: 0.3199931949585276.
[I 2025-12-06 07:41:29,313] Trial 59 finished with value: 0.30659032916920914 and parameters: {'model_type': 'mlp', 'hidden_dims': '[256, 128, 64]', 'dropout': 0.36718895239927285, 'batch_norm': False, 'lr': 4.130957271630739e-06, 'weight_decay': 2.2640745937389483e-06, 'epochs': 291, 'loss': 'mse', 'optimizer': 'adam', 'graph_mode': 'off', 'use_snp_selection': True, 'num_snps': 41713}. Best is trial 17 with value: 0.3199931949585276.
[I 2025-12-06 07:42:32,746] Trial 60 finished with value: 0.3175691847674357 and parameters: {'model_type': 'mlp', 'hidden_dims': '[512, 256]', 'dropout': 0.5353951475041129, 'batch_norm': False, 'lr': 5.996721382527741e-06, 'weight_decay': 7.206717633349382e-07, 'epochs': 181, 'loss': 'mse', 'optimizer': 'adam', 'graph_mode': 'off', 'use_snp_selection': True, 'num_snps': 53965}. Best is trial 17 with value: 0.3199931949585276.
[I 2025-12-06 07:43:34,733] Trial 61 finished with value: 0.31440124108658785 and parameters: {'model_type': 'mlp', 'hidden_dims': '[512, 256]', 'dropout': 0.5446999717462235, 'batch_norm': False, 'lr': 5.581242528746332e-06, 'weight_decay': 1.8446840053987577e-07, 'epochs': 172, 'loss': 'mse', 'optimizer': 'adam', 'graph_mode': 'off', 'use_snp_selection': True, 'num_snps': 53718}. Best is trial 17 with value: 0.3199931949585276.
[I 2025-12-06 07:44:40,998] Trial 62 finished with value: 0.31688350412302024 and parameters: {'model_type': 'mlp', 'hidden_dims': '[512, 256]', 'dropout': 0.5821662371844364, 'batch_norm': False, 'lr': 9.576370740312905e-06, 'weight_decay': 9.032297433488082e-07, 'epochs': 184, 'loss': 'mse', 'optimizer': 'adam', 'graph_mode': 'off', 'use_snp_selection': True, 'num_snps': 56909}. Best is trial 17 with value: 0.3199931949585276.
[I 2025-12-06 07:45:49,725] Trial 63 finished with value: 0.31317447637020474 and parameters: {'model_type': 'mlp', 'hidden_dims': '[512, 256]', 'dropout': 0.5330575211910239, 'batch_norm': False, 'lr': 7.295503213572195e-06, 'weight_decay': 4.3403998005451845e-07, 'epochs': 219, 'loss': 'mse', 'optimizer': 'adam', 'graph_mode': 'off', 'use_snp_selection': True, 'num_snps': 53680}. Best is trial 17 with value: 0.3199931949585276.
[I 2025-12-06 07:46:44,886] Trial 64 finished with value: 0.31503008529327714 and parameters: {'model_type': 'mlp', 'hidden_dims': '[512, 256]', 'dropout': 0.3218574392559842, 'batch_norm': False, 'lr': 4.004948667242066e-06, 'weight_decay': 2.864366655422502e-06, 'epochs': 156, 'loss': 'mse', 'optimizer': 'adam', 'graph_mode': 'off', 'use_snp_selection': True, 'num_snps': 47322}. Best is trial 17 with value: 0.3199931949585276.
[I 2025-12-06 07:47:55,406] Trial 65 finished with value: 0.31160632396452825 and parameters: {'model_type': 'mlp', 'hidden_dims': '[512, 256]', 'dropout': 0.44195795592149556, 'batch_norm': False, 'lr': 2.297070335102261e-05, 'weight_decay': 3.124092201725831e-07, 'epochs': 209, 'loss': 'mse', 'optimizer': 'adam', 'graph_mode': 'off', 'use_snp_selection': True, 'num_snps': 57550}. Best is trial 17 with value: 0.3199931949585276.
[I 2025-12-06 07:48:55,283] Trial 66 finished with value: 0.3082618082219134 and parameters: {'model_type': 'mlp', 'hidden_dims': '[256, 128]', 'dropout': 0.41589376411967244, 'batch_norm': False, 'lr': 1.616497298648685e-05, 'weight_decay': 1.7597737660494606e-06, 'epochs': 341, 'loss': 'mse', 'optimizer': 'adam', 'graph_mode': 'off', 'use_snp_selection': True, 'num_snps': 51802}. Best is trial 17 with value: 0.3199931949585276.
[I 2025-12-06 07:50:04,273] Trial 67 finished with value: 0.300378154793114 and parameters: {'model_type': 'mlp', 'hidden_dims': '[512, 256]', 'dropout': 0.49143131322990274, 'batch_norm': True, 'lr': 2.629072563629067e-06, 'weight_decay': 9.447824091514642e-07, 'epochs': 183, 'loss': 'mse', 'optimizer': 'adam', 'graph_mode': 'off', 'use_snp_selection': True, 'num_snps': 59821}. Best is trial 17 with value: 0.3199931949585276.
[I 2025-12-06 07:50:45,139] Trial 68 finished with value: 0.2679150858691454 and parameters: {'model_type': 'mlp', 'hidden_dims': '[128, 64]', 'dropout': 0.5547535990638341, 'batch_norm': False, 'lr': 4.989520637694332e-06, 'weight_decay': 5.678641310517259e-06, 'epochs': 103, 'loss': 'mae', 'optimizer': 'adam', 'graph_mode': 'off', 'use_snp_selection': True, 'num_snps': 55600}. Best is trial 17 with value: 0.3199931949585276.
[I 2025-12-06 07:51:37,116] Trial 69 finished with value: 0.3140510716663126 and parameters: {'model_type': 'mlp', 'hidden_dims': '[512, 256]', 'dropout': 0.5018506545219206, 'batch_norm': False, 'lr': 8.660975114920506e-06, 'weight_decay': 2.3391095130613544e-05, 'epochs': 132, 'loss': 'mse', 'optimizer': 'adam', 'graph_mode': 'off', 'use_snp_selection': True, 'num_snps': 47570}. Best is trial 17 with value: 0.3199931949585276.
[I 2025-12-06 07:52:25,532] Trial 70 finished with value: 0.27917318694377735 and parameters: {'model_type': 'mlp', 'hidden_dims': '[512, 128]', 'dropout': 0.5247240933729898, 'batch_norm': False, 'lr': 1.1893667625678159e-06, 'weight_decay': 7.718419081515382e-06, 'epochs': 270, 'loss': 'mae', 'optimizer': 'adam', 'graph_mode': 'off', 'use_snp_selection': True, 'num_snps': 26903}. Best is trial 17 with value: 0.3199931949585276.
[I 2025-12-06 07:53:32,460] Trial 71 finished with value: 0.3204759444484463 and parameters: {'model_type': 'mlp', 'hidden_dims': '[512, 256]', 'dropout': 0.5881716085578599, 'batch_norm': False, 'lr': 8.958396449358627e-06, 'weight_decay': 7.152023059476145e-07, 'epochs': 190, 'loss': 'mse', 'optimizer': 'adam', 'graph_mode': 'off', 'use_snp_selection': True, 'num_snps': 56463}. Best is trial 71 with value: 0.3204759444484463.
[I 2025-12-06 07:54:31,286] Trial 72 finished with value: 0.30756473419658314 and parameters: {'model_type': 'mlp', 'hidden_dims': '[512, 256]', 'dropout': 0.5815137431951082, 'batch_norm': False, 'lr': 6.26276486602545e-06, 'weight_decay': 2.6580946703230223e-07, 'epochs': 162, 'loss': 'mse', 'optimizer': 'adam', 'graph_mode': 'off', 'use_snp_selection': True, 'num_snps': 51522}. Best is trial 71 with value: 0.3204759444484463.
[I 2025-12-06 07:55:19,749] Trial 73 finished with value: 0.3024544203622585 and parameters: {'model_type': 'mlp', 'hidden_dims': '[512, 256]', 'dropout': 0.5893545745697775, 'batch_norm': False, 'lr': 3.4917380479158633e-06, 'weight_decay': 5.088633465963774e-07, 'epochs': 193, 'loss': 'mse', 'optimizer': 'adam', 'graph_mode': 'off', 'use_snp_selection': True, 'num_snps': 33753}. Best is trial 71 with value: 0.3204759444484463.
[I 2025-12-06 07:56:35,311] Trial 74 finished with value: 0.3101587018083914 and parameters: {'model_type': 'mlp', 'hidden_dims': '[512, 256]', 'dropout': 0.27133144196621717, 'batch_norm': False, 'lr': 1.2628004761703405e-05, 'weight_decay': 7.635503236272652e-07, 'epochs': 239, 'loss': 'mse', 'optimizer': 'adam', 'graph_mode': 'off', 'use_snp_selection': True, 'num_snps': 57758}. Best is trial 71 with value: 0.3204759444484463.
[I 2025-12-06 07:57:41,861] Trial 75 finished with value: 0.31633823610046463 and parameters: {'model_type': 'mlp', 'hidden_dims': '[512, 256]', 'dropout': 0.5698051574122333, 'batch_norm': False, 'lr': 2.3834949750525078e-05, 'weight_decay': 7.71157133927748e-05, 'epochs': 199, 'loss': 'mse', 'optimizer': 'adam', 'graph_mode': 'off', 'use_snp_selection': True, 'num_snps': 54925}. Best is trial 71 with value: 0.3204759444484463.
[I 2025-12-06 07:58:25,817] Trial 76 finished with value: 0.22821739043784403 and parameters: {'model_type': 'mlp', 'hidden_dims': '[256, 128, 64]', 'dropout': 0.5347403687884711, 'batch_norm': False, 'lr': 0.0006970955856030173, 'weight_decay': 1.3466366395021768e-06, 'epochs': 139, 'loss': 'mae', 'optimizer': 'adam', 'graph_mode': 'off', 'use_snp_selection': True, 'num_snps': 48398}. Best is trial 71 with value: 0.3204759444484463.
[I 2025-12-06 07:58:57,355] Trial 77 finished with value: 0.30602167520287854 and parameters: {'model_type': 'mlp', 'hidden_dims': '[512, 256]', 'dropout': 0.5598041482008286, 'batch_norm': False, 'lr': 3.9968964667021036e-05, 'weight_decay': 1.801896550143162e-06, 'epochs': 212, 'loss': 'mae', 'optimizer': 'adam', 'graph_mode': 'off', 'use_snp_selection': True, 'num_snps': 12171}. Best is trial 71 with value: 0.3204759444484463.
[I 2025-12-06 08:00:01,569] Trial 78 finished with value: 0.3157695128552524 and parameters: {'model_type': 'mlp', 'hidden_dims': '[256, 128]', 'dropout': 0.5987330620043806, 'batch_norm': False, 'lr': 1.0868028360493646e-05, 'weight_decay': 3.0311038575702604e-05, 'epochs': 339, 'loss': 'mse', 'optimizer': 'adam', 'graph_mode': 'off', 'use_snp_selection': True, 'num_snps': 57730}. Best is trial 71 with value: 0.3204759444484463.
[I 2025-12-06 08:01:13,332] Trial 79 finished with value: 0.29667773255736146 and parameters: {'model_type': 'mlp', 'hidden_dims': '[512, 256]', 'dropout': 0.4648629935730655, 'batch_norm': True, 'lr': 5.307347242060916e-06, 'weight_decay': 1.1915438141041782e-05, 'epochs': 325, 'loss': 'mae', 'optimizer': 'adam', 'graph_mode': 'off', 'use_snp_selection': True, 'num_snps': 42346}. Best is trial 71 with value: 0.3204759444484463.
[I 2025-12-06 08:02:25,995] Trial 80 finished with value: 0.3182013877613765 and parameters: {'model_type': 'mlp', 'hidden_dims': '[512, 256]', 'dropout': 0.5423730797428492, 'batch_norm': False, 'lr': 1.4642944236164038e-05, 'weight_decay': 0.00012083129231889132, 'epochs': 254, 'loss': 'mae', 'optimizer': 'adam', 'graph_mode': 'off', 'use_snp_selection': True, 'num_snps': 52201}. Best is trial 71 with value: 0.3204759444484463.
[I 2025-12-06 08:03:39,565] Trial 81 finished with value: 0.31497400937290093 and parameters: {'model_type': 'mlp', 'hidden_dims': '[512, 256]', 'dropout': 0.5453315822903073, 'batch_norm': False, 'lr': 1.3625553186422148e-05, 'weight_decay': 0.0001410438708756295, 'epochs': 258, 'loss': 'mae', 'optimizer': 'adam', 'graph_mode': 'off', 'use_snp_selection': True, 'num_snps': 52485}. Best is trial 71 with value: 0.3204759444484463.
[I 2025-12-06 08:04:48,800] Trial 82 finished with value: 0.3116687269333426 and parameters: {'model_type': 'mlp', 'hidden_dims': '[512, 256]', 'dropout': 0.516515471715318, 'batch_norm': False, 'lr': 2.9897167934548217e-05, 'weight_decay': 0.00019238307923335834, 'epochs': 249, 'loss': 'mae', 'optimizer': 'adam', 'graph_mode': 'off', 'use_snp_selection': True, 'num_snps': 49814}. Best is trial 71 with value: 0.3204759444484463.
[I 2025-12-06 08:06:06,848] Trial 83 finished with value: 0.31093343754761904 and parameters: {'model_type': 'mlp', 'hidden_dims': '[512, 256]', 'dropout': 0.5836546125009267, 'batch_norm': False, 'lr': 1.884588450046724e-05, 'weight_decay': 9.370066701419629e-05, 'epochs': 274, 'loss': 'mae', 'optimizer': 'adam', 'graph_mode': 'off', 'use_snp_selection': True, 'num_snps': 54864}. Best is trial 71 with value: 0.3204759444484463.
[I 2025-12-06 08:07:21,939] Trial 84 finished with value: 0.31445993642398523 and parameters: {'model_type': 'mlp', 'hidden_dims': '[512, 256]', 'dropout': 0.5650627533136253, 'batch_norm': False, 'lr': 7.997401176042081e-06, 'weight_decay': 3.5584523357794604e-06, 'epochs': 233, 'loss': 'mae', 'optimizer': 'adam', 'graph_mode': 'off', 'use_snp_selection': True, 'num_snps': 58572}. Best is trial 71 with value: 0.3204759444484463.
[I 2025-12-06 08:08:20,114] Trial 85 finished with value: 0.31352816566918973 and parameters: {'model_type': 'mlp', 'hidden_dims': '[512, 256]', 'dropout': 0.5310056158495745, 'batch_norm': False, 'lr': 6.5128271445965745e-06, 'weight_decay': 0.0005725347683811827, 'epochs': 304, 'loss': 'mae', 'optimizer': 'adam', 'graph_mode': 'off', 'use_snp_selection': False}. Best is trial 71 with value: 0.3204759444484463.
[I 2025-12-06 08:09:12,872] Trial 86 finished with value: 0.31196475842446003 and parameters: {'model_type': 'mlp', 'hidden_dims': '[256, 128]', 'dropout': 0.4895573924536082, 'batch_norm': False, 'lr': 1.4657215108439935e-05, 'weight_decay': 6.415651846157985e-07, 'epochs': 290, 'loss': 'mae', 'optimizer': 'adam', 'graph_mode': 'off', 'use_snp_selection': True, 'num_snps': 46151}. Best is trial 71 with value: 0.3204759444484463.
[I 2025-12-06 08:10:13,902] Trial 87 finished with value: 0.31791724756801953 and parameters: {'model_type': 'mlp', 'hidden_dims': '[512, 256]', 'dropout': 0.5431812302751914, 'batch_norm': False, 'lr': 1.1332912636711262e-05, 'weight_decay': 2.350106305522107e-06, 'epochs': 173, 'loss': 'mse', 'optimizer': 'adam', 'graph_mode': 'off', 'use_snp_selection': True, 'num_snps': 52020}. Best is trial 71 with value: 0.3204759444484463.
[I 2025-12-06 08:10:55,889] Trial 88 finished with value: 0.3096405385294886 and parameters: {'model_type': 'mlp', 'hidden_dims': '[128, 64]', 'dropout': 0.5025295202673048, 'batch_norm': False, 'lr': 9.540132324321942e-06, 'weight_decay': 2.233910147456314e-06, 'epochs': 168, 'loss': 'mse', 'optimizer': 'adam', 'graph_mode': 'off', 'use_snp_selection': True, 'num_snps': 52051}. Best is trial 71 with value: 0.3204759444484463.
[I 2025-12-06 08:11:33,073] Trial 89 finished with value: 0.3117191642455719 and parameters: {'model_type': 'mlp', 'hidden_dims': '[512, 256]', 'dropout': 0.44277048613685227, 'batch_norm': False, 'lr': 2.52214446811577e-06, 'weight_decay': 1.247077881864817e-06, 'epochs': 184, 'loss': 'mse', 'optimizer': 'adam', 'graph_mode': 'off', 'use_snp_selection': False}. Best is trial 71 with value: 0.3204759444484463.
[I 2025-12-06 08:12:57,881] Trial 90 finished with value: 0.31404529024739725 and parameters: {'model_type': 'mlp', 'hidden_dims': '[512, 64]', 'dropout': 0.5502506280308888, 'batch_norm': False, 'lr': 1.1756620785851383e-05, 'weight_decay': 5.018820813569769e-06, 'epochs': 312, 'loss': 'mse', 'optimizer': 'adam', 'graph_mode': 'off', 'use_snp_selection': True, 'num_snps': 55681}. Best is trial 71 with value: 0.3204759444484463.
[I 2025-12-06 08:14:19,922] Trial 91 finished with value: 0.3172270135926192 and parameters: {'model_type': 'mlp', 'hidden_dims': '[512, 256]', 'dropout': 0.5757458808105294, 'batch_norm': False, 'lr': 4.847810231263322e-06, 'weight_decay': 0.00011744197350732635, 'epochs': 344, 'loss': 'mse', 'optimizer': 'adam', 'graph_mode': 'off', 'use_snp_selection': True, 'num_snps': 49138}. Best is trial 71 with value: 0.3204759444484463.
[I 2025-12-06 08:15:24,612] Trial 92 finished with value: 0.3100174179096302 and parameters: {'model_type': 'mlp', 'hidden_dims': '[512, 256]', 'dropout': 0.519490531679492, 'batch_norm': False, 'lr': 1.762401041967918e-05, 'weight_decay': 7.004899282756711e-06, 'epochs': 194, 'loss': 'mse', 'optimizer': 'adam', 'graph_mode': 'off', 'use_snp_selection': True, 'num_snps': 53245}. Best is trial 71 with value: 0.3204759444484463.
[I 2025-12-06 08:16:46,064] Trial 93 finished with value: 0.31519731934393624 and parameters: {'model_type': 'mlp', 'hidden_dims': '[512, 256]', 'dropout': 0.540543875242059, 'batch_norm': False, 'lr': 3.59326095529723e-05, 'weight_decay': 0.00024187959108497057, 'epochs': 331, 'loss': 'mae', 'optimizer': 'adam', 'graph_mode': 'off', 'use_snp_selection': True, 'num_snps': 50561}. Best is trial 71 with value: 0.3204759444484463.
