[I 2025-12-05 20:16:39,206] Trial 66 finished with value: 0.29746427188683133 and parameters: {'model_type': 'mlp', 'hidden_dims': '[512, 128]', 'dropout': 0.4551410597971243, 'batch_norm': False, 'lr': 4.687770402479029e-06, 'weight_decay': 1.1949593069905637e-05, 'epochs': 251, 'loss': 'mse', 'optimizer': 'adam', 'graph_mode': 'off', 'use_snp_selection': False}. Best is trial 51 with value: 0.3005070042178704.
[I 2025-12-05 20:17:28,164] Trial 67 finished with value: 0.28003418555649656 and parameters: {'model_type': 'mlp', 'hidden_dims': '[512, 128]', 'dropout': 0.5569195763218895, 'batch_norm': False, 'lr': 7.76805482859674e-05, 'weight_decay': 0.0009835132126400584, 'epochs': 252, 'loss': 'mse', 'optimizer': 'adam', 'graph_mode': 'off', 'use_snp_selection': False}. Best is trial 51 with value: 0.3005070042178704.
[I 2025-12-05 20:18:06,491] Trial 68 finished with value: 0.289979182001009 and parameters: {'model_type': 'mlp', 'hidden_dims': '[512, 128]', 'dropout': 0.1637678056572207, 'batch_norm': False, 'lr': 4.95777046054445e-06, 'weight_decay': 3.1506354229574334e-06, 'epochs': 189, 'loss': 'mse', 'optimizer': 'adam', 'graph_mode': 'off', 'use_snp_selection': False}. Best is trial 51 with value: 0.3005070042178704.
[I 2025-12-05 20:18:21,708] Trial 69 finished with value: 0.2700058725439788 and parameters: {'model_type': 'mlp', 'hidden_dims': '[512, 128]', 'dropout': 0.11694605272854883, 'batch_norm': False, 'lr': 3.57558172677667e-06, 'weight_decay': 4.424185857221738e-05, 'epochs': 57, 'loss': 'mse', 'optimizer': 'adam', 'graph_mode': 'off', 'use_snp_selection': False}. Best is trial 51 with value: 0.3005070042178704.
[I 2025-12-05 20:19:09,478] Trial 70 finished with value: 0.27038642960609693 and parameters: {'model_type': 'mlp', 'hidden_dims': '[512, 128]', 'dropout': 0.34274191666976184, 'batch_norm': True, 'lr': 6.52498741310575e-06, 'weight_decay': 1.1882455793034792e-06, 'epochs': 242, 'loss': 'mse', 'optimizer': 'adam', 'graph_mode': 'off', 'use_snp_selection': False}. Best is trial 51 with value: 0.3005070042178704.
[I 2025-12-05 20:19:28,392] Trial 71 finished with value: 0.29014777444115286 and parameters: {'model_type': 'mlp', 'hidden_dims': '[128, 64]', 'dropout': 0.4567047507917257, 'batch_norm': False, 'lr': 1.7184819217487023e-05, 'weight_decay': 1.1170393013446255e-05, 'epochs': 283, 'loss': 'mse', 'optimizer': 'adam', 'graph_mode': 'off', 'use_snp_selection': False}. Best is trial 51 with value: 0.3005070042178704.
[I 2025-12-05 20:20:20,934] Trial 72 finished with value: 0.26811263507369476 and parameters: {'model_type': 'mlp', 'hidden_dims': '[256, 128, 64]', 'dropout': 0.5017211854617598, 'batch_norm': False, 'lr': 2.497753697354458e-06, 'weight_decay': 2.049327934951238e-05, 'epochs': 264, 'loss': 'mse', 'optimizer': 'adam', 'graph_mode': 'off', 'use_snp_selection': True, 'num_snps': 48471}. Best is trial 51 with value: 0.3005070042178704.
[I 2025-12-05 20:21:15,397] Trial 73 finished with value: 0.2957620130253219 and parameters: {'model_type': 'mlp', 'hidden_dims': '[256, 128]', 'dropout': 0.49990588903445254, 'batch_norm': False, 'lr': 4.351139418688995e-06, 'weight_decay': 7.53900518977993e-06, 'epochs': 310, 'loss': 'mse', 'optimizer': 'adam', 'graph_mode': 'off', 'use_snp_selection': True, 'num_snps': 47186}. Best is trial 51 with value: 0.3005070042178704.
[I 2025-12-05 20:21:30,482] Trial 74 finished with value: 0.2945056085175307 and parameters: {'model_type': 'mlp', 'hidden_dims': '[128, 64]', 'dropout': 0.397313067963705, 'batch_norm': False, 'lr': 1.023714970654505e-05, 'weight_decay': 1.3207480202838587e-05, 'epochs': 209, 'loss': 'mse', 'optimizer': 'adam', 'graph_mode': 'off', 'use_snp_selection': False}. Best is trial 51 with value: 0.3005070042178704.
[I 2025-12-05 20:22:32,618] Trial 75 finished with value: 0.27814783264336035 and parameters: {'model_type': 'mlp', 'hidden_dims': '[512, 128]', 'dropout': 0.4360000796265836, 'batch_norm': False, 'lr': 0.0001877969440167001, 'weight_decay': 7.61745843489467e-07, 'epochs': 257, 'loss': 'mse', 'optimizer': 'adam', 'graph_mode': 'off', 'use_snp_selection': True, 'num_snps': 41579}. Best is trial 51 with value: 0.3005070042178704.
[I 2025-12-05 20:23:21,880] Trial 76 finished with value: 0.29587546447757596 and parameters: {'model_type': 'mlp', 'hidden_dims': '[128, 64]', 'dropout': 0.419629269225252, 'batch_norm': False, 'lr': 6.07897874900111e-06, 'weight_decay': 4.020096818715989e-06, 'epochs': 292, 'loss': 'mse', 'optimizer': 'adam', 'graph_mode': 'off', 'use_snp_selection': True, 'num_snps': 55341}. Best is trial 51 with value: 0.3005070042178704.
[I 2025-12-05 20:24:22,138] Trial 77 finished with value: 0.2914070710542279 and parameters: {'model_type': 'mlp', 'hidden_dims': '[256, 128, 64]', 'dropout': 0.31514508771882743, 'batch_norm': False, 'lr': 8.02772793832018e-06, 'weight_decay': 5.97998473579018e-06, 'epochs': 293, 'loss': 'mse', 'optimizer': 'adam', 'graph_mode': 'off', 'use_snp_selection': True, 'num_snps': 55649}. Best is trial 51 with value: 0.3005070042178704.
[I 2025-12-05 20:25:02,187] Trial 78 finished with value: 0.2820782074963408 and parameters: {'model_type': 'mlp', 'hidden_dims': '[128, 64]', 'dropout': 0.41274461619012015, 'batch_norm': False, 'lr': 6.537096471149143e-06, 'weight_decay': 3.29833916380227e-06, 'epochs': 320, 'loss': 'mae', 'optimizer': 'adam', 'graph_mode': 'off', 'use_snp_selection': True, 'num_snps': 35553}. Best is trial 51 with value: 0.3005070042178704.
[I 2025-12-05 20:25:47,942] Trial 79 finished with value: 0.2854713647677527 and parameters: {'model_type': 'mlp', 'hidden_dims': '[512, 128]', 'dropout': 0.1966582964365758, 'batch_norm': False, 'lr': 0.000324121692483509, 'weight_decay': 4.033837174788779e-06, 'epochs': 234, 'loss': 'mse', 'optimizer': 'adam', 'graph_mode': 'off', 'use_snp_selection': False}. Best is trial 51 with value: 0.3005070042178704.
[I 2025-12-05 20:26:30,340] Trial 80 finished with value: 0.29500834705704826 and parameters: {'model_type': 'mlp', 'hidden_dims': '[128, 64]', 'dropout': 0.2645693342070289, 'batch_norm': False, 'lr': 2.9269537405033345e-06, 'weight_decay': 0.0002631887629652531, 'epochs': 332, 'loss': 'mse', 'optimizer': 'adam', 'graph_mode': 'off', 'use_snp_selection': True, 'num_snps': 39661}. Best is trial 51 with value: 0.3005070042178704.
[I 2025-12-05 20:27:15,623] Trial 81 finished with value: 0.2919405617061338 and parameters: {'model_type': 'mlp', 'hidden_dims': '[128, 64]', 'dropout': 0.4559465055999977, 'batch_norm': False, 'lr': 1.2878774266299273e-05, 'weight_decay': 6.7970155719945625e-06, 'epochs': 272, 'loss': 'mse', 'optimizer': 'adam', 'graph_mode': 'off', 'use_snp_selection': True, 'num_snps': 49528}. Best is trial 51 with value: 0.3005070042178704.
[I 2025-12-05 20:28:03,831] Trial 82 finished with value: 0.2930104755855602 and parameters: {'model_type': 'mlp', 'hidden_dims': '[128, 64]', 'dropout': 0.36620984708985477, 'batch_norm': False, 'lr': 3.6646069599029002e-06, 'weight_decay': 1.3743066895392942e-05, 'epochs': 302, 'loss': 'mse', 'optimizer': 'adam', 'graph_mode': 'off', 'use_snp_selection': True, 'num_snps': 53684}. Best is trial 51 with value: 0.3005070042178704.
[I 2025-12-05 20:28:54,356] Trial 83 finished with value: 0.2923513655966839 and parameters: {'model_type': 'mlp', 'hidden_dims': '[128, 64]', 'dropout': 0.4743984486144405, 'batch_norm': False, 'lr': 5.842760905612518e-06, 'weight_decay': 9.54427458546371e-06, 'epochs': 289, 'loss': 'mse', 'optimizer': 'adam', 'graph_mode': 'off', 'use_snp_selection': True, 'num_snps': 58424}. Best is trial 51 with value: 0.3005070042178704.
[I 2025-12-05 20:29:37,856] Trial 84 finished with value: 0.29758441633303373 and parameters: {'model_type': 'mlp', 'hidden_dims': '[128, 64]', 'dropout': 0.4219640698793183, 'batch_norm': False, 'lr': 4.714666931816127e-06, 'weight_decay': 4.342178912880623e-06, 'epochs': 278, 'loss': 'mse', 'optimizer': 'adam', 'graph_mode': 'off', 'use_snp_selection': True, 'num_snps': 45135}. Best is trial 51 with value: 0.3005070042178704.
[I 2025-12-05 20:30:43,974] Trial 85 finished with value: 0.2960122107253557 and parameters: {'model_type': 'mlp', 'hidden_dims': '[512, 64]', 'dropout': 0.41804517476530473, 'batch_norm': False, 'lr': 4.8278694657944725e-06, 'weight_decay': 4.163917874333761e-06, 'epochs': 249, 'loss': 'mse', 'optimizer': 'adam', 'graph_mode': 'off', 'use_snp_selection': True, 'num_snps': 46343}. Best is trial 51 with value: 0.3005070042178704.
[I 2025-12-05 20:31:49,766] Trial 86 finished with value: 0.2898714132793748 and parameters: {'model_type': 'mlp', 'hidden_dims': '[512, 64]', 'dropout': 0.4883768891592023, 'batch_norm': False, 'lr': 2.1919268410114227e-06, 'weight_decay': 1.4531704949439554e-06, 'epochs': 247, 'loss': 'mse', 'optimizer': 'adam', 'graph_mode': 'off', 'use_snp_selection': True, 'num_snps': 46282}. Best is trial 51 with value: 0.3005070042178704.
[I 2025-12-05 20:32:53,410] Trial 87 finished with value: 0.29863162099985735 and parameters: {'model_type': 'mlp', 'hidden_dims': '[512, 64]', 'dropout': 0.3992160064537953, 'batch_norm': False, 'lr': 4.595015718295397e-06, 'weight_decay': 2.6205048409023153e-06, 'epochs': 265, 'loss': 'mse', 'optimizer': 'adam', 'graph_mode': 'off', 'use_snp_selection': True, 'num_snps': 41590}. Best is trial 51 with value: 0.3005070042178704.
[I 2025-12-05 20:33:54,974] Trial 88 finished with value: 0.2799312009930038 and parameters: {'model_type': 'mlp', 'hidden_dims': '[512, 64]', 'dropout': 0.44924589167280093, 'batch_norm': True, 'lr': 4.719644966015072e-06, 'weight_decay': 3.266421171383965e-07, 'epochs': 241, 'loss': 'mse', 'optimizer': 'adam', 'graph_mode': 'off', 'use_snp_selection': True, 'num_snps': 42153}. Best is trial 51 with value: 0.3005070042178704.
[I 2025-12-05 20:34:55,995] Trial 89 finished with value: 0.29857384991104685 and parameters: {'model_type': 'mlp', 'hidden_dims': '[512, 64]', 'dropout': 0.3854252479322569, 'batch_norm': False, 'lr': 3.7538876701354572e-06, 'weight_decay': 2.6309396518427127e-06, 'epochs': 220, 'loss': 'mse', 'optimizer': 'adam', 'graph_mode': 'off', 'use_snp_selection': True, 'num_snps': 44889}. Best is trial 51 with value: 0.3005070042178704.
[I 2025-12-05 20:35:57,121] Trial 90 finished with value: 0.2533333672570519 and parameters: {'model_type': 'mlp', 'hidden_dims': '[512, 64]', 'dropout': 0.38468753894987584, 'batch_norm': False, 'lr': 1.685138592843805e-06, 'weight_decay': 6.336083510192061e-07, 'epochs': 222, 'loss': 'mae', 'optimizer': 'adam', 'graph_mode': 'off', 'use_snp_selection': True, 'num_snps': 44308}. Best is trial 51 with value: 0.3005070042178704.
[I 2025-12-05 20:37:02,218] Trial 91 finished with value: 0.29307824606074256 and parameters: {'model_type': 'mlp', 'hidden_dims': '[512, 64]', 'dropout': 0.41166713737628446, 'batch_norm': False, 'lr': 3.7067261286264642e-06, 'weight_decay': 2.4861301539231857e-06, 'epochs': 234, 'loss': 'mse', 'optimizer': 'adam', 'graph_mode': 'off', 'use_snp_selection': True, 'num_snps': 47225}. Best is trial 51 with value: 0.3005070042178704.
[I 2025-12-05 20:38:08,776] Trial 92 finished with value: 0.2995238350305539 and parameters: {'model_type': 'mlp', 'hidden_dims': '[512, 64]', 'dropout': 0.4006472682236296, 'batch_norm': False, 'lr': 2.933623310613979e-06, 'weight_decay': 0.0005751538055581405, 'epochs': 256, 'loss': 'mse', 'optimizer': 'adam', 'graph_mode': 'off', 'use_snp_selection': True, 'num_snps': 45586}. Best is trial 51 with value: 0.3005070042178704.
[I 2025-12-05 20:38:48,982] Trial 93 finished with value: 0.2838046985405589 and parameters: {'model_type': 'mlp', 'hidden_dims': '[512, 64]', 'dropout': 0.3968063112977504, 'batch_norm': False, 'lr': 2.7519498618503425e-06, 'weight_decay': 0.0007181179376509468, 'epochs': 261, 'loss': 'mse', 'optimizer': 'adam', 'graph_mode': 'off', 'use_snp_selection': True, 'num_snps': 19048}. Best is trial 51 with value: 0.3005070042178704.
[I 2025-12-05 20:39:51,969] Trial 94 finished with value: 0.29404256361448877 and parameters: {'model_type': 'mlp', 'hidden_dims': '[512, 64]', 'dropout': 0.22315698482700383, 'batch_norm': False, 'lr': 3.8051986509317722e-06, 'weight_decay': 0.0004960293895033681, 'epochs': 265, 'loss': 'mse', 'optimizer': 'adam', 'graph_mode': 'off', 'use_snp_selection': True, 'num_snps': 41301}. Best is trial 51 with value: 0.3005070042178704.
[I 2025-12-05 20:40:45,325] Trial 95 finished with value: 0.27746965286991265 and parameters: {'model_type': 'mlp', 'hidden_dims': '[512, 64]', 'dropout': 0.37298121997668254, 'batch_norm': False, 'lr': 0.00010344733172741367, 'weight_decay': 0.0005508635820962296, 'epochs': 208, 'loss': 'mse', 'optimizer': 'adam', 'graph_mode': 'off', 'use_snp_selection': True, 'num_snps': 38045}. Best is trial 51 with value: 0.3005070042178704.
[I 2025-12-05 20:41:49,714] Trial 96 finished with value: 0.30102989585135365 and parameters: {'model_type': 'mlp', 'hidden_dims': '[512, 64]', 'dropout': 0.3469747068190708, 'batch_norm': False, 'lr': 3.2161685314563027e-06, 'weight_decay': 0.0004141384355102058, 'epochs': 256, 'loss': 'mse', 'optimizer': 'adam', 'graph_mode': 'off', 'use_snp_selection': True, 'num_snps': 43448}. Best is trial 96 with value: 0.30102989585135365.
[I 2025-12-05 20:42:54,198] Trial 97 finished with value: 0.29291249682013454 and parameters: {'model_type': 'mlp', 'hidden_dims': '[512, 64]', 'dropout': 0.3490082950651687, 'batch_norm': False, 'lr': 2.14788976147464e-06, 'weight_decay': 0.00036801526192420164, 'epochs': 253, 'loss': 'mse', 'optimizer': 'adam', 'graph_mode': 'off', 'use_snp_selection': True, 'num_snps': 44098}. Best is trial 96 with value: 0.30102989585135365.
[I 2025-12-05 20:43:55,905] Trial 98 finished with value: 0.2953539444473484 and parameters: {'model_type': 'mlp', 'hidden_dims': '[512, 64]', 'dropout': 0.402592298951971, 'batch_norm': False, 'lr': 3.1398386996441832e-06, 'weight_decay': 0.00020745112523796772, 'epochs': 238, 'loss': 'mse', 'optimizer': 'adam', 'graph_mode': 'off', 'use_snp_selection': True, 'num_snps': 42937}. Best is trial 96 with value: 0.30102989585135365.
[I 2025-12-05 20:44:49,405] Trial 99 finished with value: 0.29698385755208345 and parameters: {'model_type': 'mlp', 'hidden_dims': '[512, 64]', 'dropout': 0.4470606589323027, 'batch_norm': False, 'lr': 4.13352583525202e-06, 'weight_decay': 0.00015310364063284048, 'epochs': 278, 'loss': 'mse', 'optimizer': 'adam', 'graph_mode': 'off', 'use_snp_selection': False}. Best is trial 96 with value: 0.30102989585135365.
[I 2025-12-05 20:45:43,193] Trial 100 finished with value: 0.2955003243977347 and parameters: {'model_type': 'mlp', 'hidden_dims': '[512, 64]', 'dropout': 0.44552740827333215, 'batch_norm': False, 'lr': 2.6508103853070947e-06, 'weight_decay': 0.0001620866359687066, 'epochs': 279, 'loss': 'mse', 'optimizer': 'adam', 'graph_mode': 'off', 'use_snp_selection': False}. Best is trial 96 with value: 0.30102989585135365.
[I 2025-12-05 20:46:35,133] Trial 101 finished with value: 0.2933485207258587 and parameters: {'model_type': 'mlp', 'hidden_dims': '[512, 64]', 'dropout': 0.4251296188801098, 'batch_norm': False, 'lr': 4.221171399206285e-06, 'weight_decay': 0.00011742400424527406, 'epochs': 268, 'loss': 'mse', 'optimizer': 'adam', 'graph_mode': 'off', 'use_snp_selection': False}. Best is trial 96 with value: 0.30102989585135365.
[I 2025-12-05 20:47:29,831] Trial 102 finished with value: 0.29241553852432817 and parameters: {'model_type': 'mlp', 'hidden_dims': '[512, 64]', 'dropout': 0.38755300202574394, 'batch_norm': False, 'lr': 5.224404495486978e-06, 'weight_decay': 0.00044418539386602176, 'epochs': 284, 'loss': 'mse', 'optimizer': 'adam', 'graph_mode': 'off', 'use_snp_selection': False}. Best is trial 96 with value: 0.30102989585135365.
[I 2025-12-05 20:48:20,553] Trial 103 finished with value: 0.29845378294451996 and parameters: {'model_type': 'mlp', 'hidden_dims': '[512, 64]', 'dropout': 0.4280573158243482, 'batch_norm': False, 'lr': 3.5109462559209454e-06, 'weight_decay': 0.00029893235783184387, 'epochs': 261, 'loss': 'mse', 'optimizer': 'adam', 'graph_mode': 'off', 'use_snp_selection': False}. Best is trial 96 with value: 0.30102989585135365.
[I 2025-12-05 20:49:10,426] Trial 104 finished with value: 0.29782098520196076 and parameters: {'model_type': 'mlp', 'hidden_dims': '[512, 64]', 'dropout': 0.4366075878469443, 'batch_norm': False, 'lr': 3.40561251618607e-06, 'weight_decay': 0.00033652943014254866, 'epochs': 256, 'loss': 'mse', 'optimizer': 'adam', 'graph_mode': 'off', 'use_snp_selection': False}. Best is trial 96 with value: 0.30102989585135365.
[I 2025-12-05 20:50:00,772] Trial 105 finished with value: 0.2988169216912909 and parameters: {'model_type': 'mlp', 'hidden_dims': '[512, 64]', 'dropout': 0.4661556334292329, 'batch_norm': False, 'lr': 2.3963284117194004e-06, 'weight_decay': 9.165111179152609e-05, 'epochs': 259, 'loss': 'mse', 'optimizer': 'adam', 'graph_mode': 'off', 'use_snp_selection': False}. Best is trial 96 with value: 0.30102989585135365.
[I 2025-12-05 20:50:50,590] Trial 106 finished with value: 0.2791996909299931 and parameters: {'model_type': 'mlp', 'hidden_dims': '[512, 64]', 'dropout': 0.4687855466133845, 'batch_norm': False, 'lr': 1.3320898078206783e-06, 'weight_decay': 0.0006417171923318167, 'epochs': 256, 'loss': 'mse', 'optimizer': 'adam', 'graph_mode': 'off', 'use_snp_selection': False}. Best is trial 96 with value: 0.30102989585135365.
[I 2025-12-05 20:51:35,375] Trial 107 finished with value: 0.2931165102682166 and parameters: {'model_type': 'mlp', 'hidden_dims': '[512, 64]', 'dropout': 0.43183475956427225, 'batch_norm': False, 'lr': 1.9238599642049523e-06, 'weight_decay': 3.3605307867719085e-05, 'epochs': 227, 'loss': 'mse', 'optimizer': 'adam', 'graph_mode': 'off', 'use_snp_selection': False}. Best is trial 96 with value: 0.30102989585135365.
[I 2025-12-05 20:52:24,478] Trial 108 finished with value: 0.27638798429382844 and parameters: {'model_type': 'mlp', 'hidden_dims': '[512, 64]', 'dropout': 0.5243376511613294, 'batch_norm': True, 'lr': 3.359986529985916e-06, 'weight_decay': 7.460763741185415e-05, 'epochs': 250, 'loss': 'mse', 'optimizer': 'adam', 'graph_mode': 'off', 'use_snp_selection': False}. Best is trial 96 with value: 0.30102989585135365.
[I 2025-12-05 20:53:14,428] Trial 109 finished with value: 0.29373967847927684 and parameters: {'model_type': 'mlp', 'hidden_dims': '[512, 64]', 'dropout': 0.484437766490494, 'batch_norm': False, 'lr': 2.215777690247226e-06, 'weight_decay': 0.000298292799685087, 'epochs': 257, 'loss': 'mse', 'optimizer': 'adam', 'graph_mode': 'off', 'use_snp_selection': False}. Best is trial 96 with value: 0.30102989585135365.
[I 2025-12-05 20:54:06,394] Trial 110 finished with value: 0.2929589597775699 and parameters: {'model_type': 'mlp', 'hidden_dims': '[512, 64]', 'dropout': 0.4070830248206342, 'batch_norm': False, 'lr': 2.851215100112852e-06, 'weight_decay': 2.1229731676796567e-06, 'epochs': 268, 'loss': 'mse', 'optimizer': 'adam', 'graph_mode': 'off', 'use_snp_selection': False}. Best is trial 96 with value: 0.30102989585135365.
[I 2025-12-05 20:54:59,683] Trial 111 finished with value: 0.29455367479577393 and parameters: {'model_type': 'mlp', 'hidden_dims': '[512, 64]', 'dropout': 0.4416156829955571, 'batch_norm': False, 'lr': 2.4469100584126957e-06, 'weight_decay': 0.0001757238081578589, 'epochs': 276, 'loss': 'mse', 'optimizer': 'adam', 'graph_mode': 'off', 'use_snp_selection': False}. Best is trial 96 with value: 0.30102989585135365.
[I 2025-12-05 20:55:50,328] Trial 112 finished with value: 0.2989771723743445 and parameters: {'model_type': 'mlp', 'hidden_dims': '[512, 64]', 'dropout': 0.4631618752344168, 'batch_norm': False, 'lr': 3.4901223306324123e-06, 'weight_decay': 0.00010335051676960715, 'epochs': 261, 'loss': 'mse', 'optimizer': 'adam', 'graph_mode': 'off', 'use_snp_selection': False}. Best is trial 96 with value: 0.30102989585135365.
[I 2025-12-05 20:56:41,250] Trial 113 finished with value: 0.29813393514667846 and parameters: {'model_type': 'mlp', 'hidden_dims': '[512, 64]', 'dropout': 0.3726872976166792, 'batch_norm': False, 'lr': 3.2519440091762193e-06, 'weight_decay': 5.5120558623809016e-05, 'epochs': 262, 'loss': 'mse', 'optimizer': 'adam', 'graph_mode': 'off', 'use_snp_selection': False}. Best is trial 96 with value: 0.30102989585135365.
[I 2025-12-05 20:57:28,231] Trial 114 finished with value: 0.2943803650351894 and parameters: {'model_type': 'mlp', 'hidden_dims': '[512, 64]', 'dropout': 0.3682527947248029, 'batch_norm': False, 'lr': 3.229585908114129e-06, 'weight_decay': 9.239350257713827e-05, 'epochs': 239, 'loss': 'mse', 'optimizer': 'adam', 'graph_mode': 'off', 'use_snp_selection': False}. Best is trial 96 with value: 0.30102989585135365.
[I 2025-12-05 20:58:19,471] Trial 115 finished with value: 0.26653161295119726 and parameters: {'model_type': 'mlp', 'hidden_dims': '[512, 64]', 'dropout': 0.43007087228867735, 'batch_norm': False, 'lr': 1.7508535122045948e-06, 'weight_decay': 5.321567616797431e-05, 'epochs': 264, 'loss': 'mae', 'optimizer': 'adam', 'graph_mode': 'off', 'use_snp_selection': False}. Best is trial 96 with value: 0.30102989585135365.
[I 2025-12-05 20:59:09,842] Trial 116 finished with value: 0.29773578293767045 and parameters: {'model_type': 'mlp', 'hidden_dims': '[512, 64]', 'dropout': 0.39370562048350516, 'batch_norm': False, 'lr': 2.3375092532055025e-06, 'weight_decay': 9.578237321751028e-05, 'epochs': 259, 'loss': 'mse', 'optimizer': 'adam', 'graph_mode': 'off', 'use_snp_selection': False}. Best is trial 96 with value: 0.30102989585135365.
