[I 2025-12-05 14:48:00,119] Trial 71 finished with value: 0.07614887351471965 and parameters: {'model_type': 'mlp', 'hidden_dims': '[512, 128]', 'dropout': 0.39412159509409767, 'batch_norm': False, 'lr': 6.748311112546124e-05, 'weight_decay': 1.9146391801114853e-05, 'epochs': 261, 'loss': 'mse', 'optimizer': 'adam', 'graph_mode': 'off', 'use_snp_selection': True, 'num_snps': 55674}. Best is trial 18 with value: 0.11411391432010902.
[I 2025-12-05 14:48:02,619] Trial 72 finished with value: 0.0525102157508009 and parameters: {'model_type': 'mlp', 'hidden_dims': '[256, 128]', 'dropout': 0.41055928626307364, 'batch_norm': False, 'lr': 4.1069632090964364e-05, 'weight_decay': 0.00021628568531291328, 'epochs': 227, 'loss': 'mse', 'optimizer': 'adam', 'graph_mode': 'off', 'use_snp_selection': True, 'num_snps': 43967}. Best is trial 18 with value: 0.11411391432010902.
[I 2025-12-05 14:48:05,475] Trial 73 finished with value: 0.06659225463878943 and parameters: {'model_type': 'mlp', 'hidden_dims': '[256, 128]', 'dropout': 0.5513198308181735, 'batch_norm': False, 'lr': 2.356300665106512e-05, 'weight_decay': 1.0440012115895523e-05, 'epochs': 347, 'loss': 'mse', 'optimizer': 'adam', 'graph_mode': 'off', 'use_snp_selection': True, 'num_snps': 47400}. Best is trial 18 with value: 0.11411391432010902.
[I 2025-12-05 14:48:08,602] Trial 74 finished with value: 0.08823403528584735 and parameters: {'model_type': 'mlp', 'hidden_dims': '[256, 128]', 'dropout': 0.4710886961550613, 'batch_norm': False, 'lr': 1.1059506262640723e-05, 'weight_decay': 3.853359289195401e-05, 'epochs': 282, 'loss': 'mse', 'optimizer': 'adam', 'graph_mode': 'off', 'use_snp_selection': True, 'num_snps': 56770}. Best is trial 18 with value: 0.11411391432010902.
[I 2025-12-05 14:48:11,844] Trial 75 finished with value: 0.07900012034275078 and parameters: {'model_type': 'mlp', 'hidden_dims': '[512, 256]', 'dropout': 0.41999972885603326, 'batch_norm': False, 'lr': 0.00016335855412141615, 'weight_decay': 3.2401297494988697e-06, 'epochs': 186, 'loss': 'mse', 'optimizer': 'adam', 'graph_mode': 'off', 'use_snp_selection': True, 'num_snps': 52057}. Best is trial 18 with value: 0.11411391432010902.
[I 2025-12-05 14:48:14,111] Trial 76 finished with value: 0.0903673986941565 and parameters: {'model_type': 'mlp', 'hidden_dims': '[512, 64]', 'dropout': 0.11907044296807826, 'batch_norm': True, 'lr': 3.0238200161104723e-05, 'weight_decay': 8.544857661292563e-06, 'epochs': 244, 'loss': 'mse', 'optimizer': 'adam', 'graph_mode': 'off', 'use_snp_selection': False}. Best is trial 18 with value: 0.11411391432010902.
[I 2025-12-05 14:48:16,332] Trial 77 finished with value: 0.10574505720144534 and parameters: {'model_type': 'mlp', 'hidden_dims': '[512, 64]', 'dropout': 0.13030991771331704, 'batch_norm': True, 'lr': 1.8622234598964806e-05, 'weight_decay': 2.946894036905154e-05, 'epochs': 246, 'loss': 'mae', 'optimizer': 'adam', 'graph_mode': 'off', 'use_snp_selection': False}. Best is trial 18 with value: 0.11411391432010902.
[I 2025-12-05 14:48:18,571] Trial 78 finished with value: 0.0878262102344626 and parameters: {'model_type': 'mlp', 'hidden_dims': '[512, 64]', 'dropout': 0.11717346612405483, 'batch_norm': True, 'lr': 1.8887801799483453e-05, 'weight_decay': 2.6837535207716132e-05, 'epochs': 250, 'loss': 'mae', 'optimizer': 'adam', 'graph_mode': 'off', 'use_snp_selection': False}. Best is trial 18 with value: 0.11411391432010902.
[I 2025-12-05 14:48:20,824] Trial 79 finished with value: 0.07506659029873286 and parameters: {'model_type': 'mlp', 'hidden_dims': '[512, 64]', 'dropout': 0.17327732735167434, 'batch_norm': True, 'lr': 5.669902452782608e-06, 'weight_decay': 6.377615778334175e-06, 'epochs': 246, 'loss': 'mae', 'optimizer': 'adam', 'graph_mode': 'off', 'use_snp_selection': False}. Best is trial 18 with value: 0.11411391432010902.
[I 2025-12-05 14:48:22,968] Trial 80 finished with value: 0.09509166502551405 and parameters: {'model_type': 'mlp', 'hidden_dims': '[512, 64]', 'dropout': 0.13769747509450853, 'batch_norm': True, 'lr': 1.617158205707213e-05, 'weight_decay': 9.03409588056387e-06, 'epochs': 233, 'loss': 'mae', 'optimizer': 'adam', 'graph_mode': 'off', 'use_snp_selection': False}. Best is trial 18 with value: 0.11411391432010902.
[I 2025-12-05 14:48:25,097] Trial 81 finished with value: 0.07736496206983272 and parameters: {'model_type': 'mlp', 'hidden_dims': '[512, 64]', 'dropout': 0.10283545438747538, 'batch_norm': True, 'lr': 1.5976142313566443e-05, 'weight_decay': 3.4845133693299464e-06, 'epochs': 231, 'loss': 'mae', 'optimizer': 'adam', 'graph_mode': 'off', 'use_snp_selection': False}. Best is trial 18 with value: 0.11411391432010902.
[I 2025-12-05 14:48:27,440] Trial 82 finished with value: 0.055744220056860194 and parameters: {'model_type': 'mlp', 'hidden_dims': '[512, 64]', 'dropout': 0.14514515862414762, 'batch_norm': True, 'lr': 9.65398391755176e-06, 'weight_decay': 9.497675607929325e-06, 'epochs': 261, 'loss': 'mae', 'optimizer': 'adam', 'graph_mode': 'off', 'use_snp_selection': False}. Best is trial 18 with value: 0.11411391432010902.
[I 2025-12-05 14:48:29,423] Trial 83 finished with value: 0.08513355874915428 and parameters: {'model_type': 'mlp', 'hidden_dims': '[512, 64]', 'dropout': 0.12940779155010956, 'batch_norm': True, 'lr': 3.257620194312956e-05, 'weight_decay': 4.782888460500103e-06, 'epochs': 206, 'loss': 'mae', 'optimizer': 'adam', 'graph_mode': 'off', 'use_snp_selection': False}. Best is trial 18 with value: 0.11411391432010902.
[I 2025-12-05 14:48:31,593] Trial 84 finished with value: 0.048422019473786104 and parameters: {'model_type': 'mlp', 'hidden_dims': '[512, 64]', 'dropout': 0.1812531587999331, 'batch_norm': True, 'lr': 8.035864823702096e-06, 'weight_decay': 8.118529923283574e-06, 'epochs': 238, 'loss': 'mae', 'optimizer': 'adam', 'graph_mode': 'off', 'use_snp_selection': False}. Best is trial 18 with value: 0.11411391432010902.
[I 2025-12-05 14:48:33,796] Trial 85 finished with value: 0.08535960219435669 and parameters: {'model_type': 'mlp', 'hidden_dims': '[512, 64]', 'dropout': 0.22315117625869293, 'batch_norm': True, 'lr': 2.1482676236037546e-05, 'weight_decay': 1.873829571612427e-06, 'epochs': 243, 'loss': 'mae', 'optimizer': 'adam', 'graph_mode': 'off', 'use_snp_selection': False}. Best is trial 18 with value: 0.11411391432010902.
[I 2025-12-05 14:48:35,718] Trial 86 finished with value: 0.062142566504873945 and parameters: {'model_type': 'mlp', 'hidden_dims': '[512, 64]', 'dropout': 0.13290484920039444, 'batch_norm': True, 'lr': 1.2323851657181093e-05, 'weight_decay': 5.919227836133684e-07, 'epochs': 196, 'loss': 'mae', 'optimizer': 'adam', 'graph_mode': 'off', 'use_snp_selection': False}. Best is trial 18 with value: 0.11411391432010902.
[I 2025-12-05 14:48:37,408] Trial 87 finished with value: 0.08676530059673299 and parameters: {'model_type': 'mlp', 'hidden_dims': '[512, 64]', 'dropout': 0.15217075445998623, 'batch_norm': True, 'lr': 2.824772852790597e-05, 'weight_decay': 1.246549642894024e-05, 'epochs': 156, 'loss': 'mae', 'optimizer': 'adam', 'graph_mode': 'off', 'use_snp_selection': False}. Best is trial 18 with value: 0.11411391432010902.
[I 2025-12-05 14:48:39,485] Trial 88 finished with value: 0.06807845473556354 and parameters: {'model_type': 'mlp', 'hidden_dims': '[512, 64]', 'dropout': 0.1701171455245984, 'batch_norm': True, 'lr': 1.7597233519264605e-05, 'weight_decay': 2.089722710195229e-05, 'epochs': 222, 'loss': 'mae', 'optimizer': 'adam', 'graph_mode': 'off', 'use_snp_selection': False}. Best is trial 18 with value: 0.11411391432010902.
[I 2025-12-05 14:48:41,636] Trial 89 finished with value: 0.09321209934887689 and parameters: {'model_type': 'mlp', 'hidden_dims': '[512, 64]', 'dropout': 0.12383812115023372, 'batch_norm': True, 'lr': 4.764990965358146e-05, 'weight_decay': 3.0077043328154046e-05, 'epochs': 233, 'loss': 'mae', 'optimizer': 'adam', 'graph_mode': 'off', 'use_snp_selection': False}. Best is trial 18 with value: 0.11411391432010902.
[I 2025-12-05 14:48:43,765] Trial 90 finished with value: 0.08624313482701688 and parameters: {'model_type': 'mlp', 'hidden_dims': '[512, 64]', 'dropout': 0.12031048083689082, 'batch_norm': True, 'lr': 5.505873016213062e-05, 'weight_decay': 2.8779394652019116e-05, 'epochs': 231, 'loss': 'mae', 'optimizer': 'adam', 'graph_mode': 'off', 'use_snp_selection': False}. Best is trial 18 with value: 0.11411391432010902.
[I 2025-12-05 14:48:46,043] Trial 91 finished with value: 0.08481289186097113 and parameters: {'model_type': 'mlp', 'hidden_dims': '[512, 64]', 'dropout': 0.19810078609563764, 'batch_norm': True, 'lr': 2.6332446111723495e-05, 'weight_decay': 6.719718085425875e-05, 'epochs': 256, 'loss': 'mae', 'optimizer': 'adam', 'graph_mode': 'off', 'use_snp_selection': False}. Best is trial 18 with value: 0.11411391432010902.
[I 2025-12-05 14:48:48,052] Trial 92 finished with value: 0.09318566987832609 and parameters: {'model_type': 'mlp', 'hidden_dims': '[512, 64]', 'dropout': 0.10559925983041604, 'batch_norm': True, 'lr': 4.6072218951091146e-05, 'weight_decay': 5.089177386015407e-05, 'epochs': 210, 'loss': 'mae', 'optimizer': 'adam', 'graph_mode': 'off', 'use_snp_selection': False}. Best is trial 18 with value: 0.11411391432010902.
[I 2025-12-05 14:48:50,082] Trial 93 finished with value: 0.07345599215396059 and parameters: {'model_type': 'mlp', 'hidden_dims': '[512, 64]', 'dropout': 0.13467005287420275, 'batch_norm': True, 'lr': 4.818257561334367e-05, 'weight_decay': 3.212461596623738e-05, 'epochs': 209, 'loss': 'mae', 'optimizer': 'adam', 'graph_mode': 'off', 'use_snp_selection': False}. Best is trial 18 with value: 0.11411391432010902.
[I 2025-12-05 14:48:52,159] Trial 94 finished with value: 0.09254546420503224 and parameters: {'model_type': 'mlp', 'hidden_dims': '[512, 64]', 'dropout': 0.1130044135880908, 'batch_norm': True, 'lr': 3.4914768752280066e-05, 'weight_decay': 1.658700184008521e-05, 'epochs': 222, 'loss': 'mae', 'optimizer': 'adam', 'graph_mode': 'off', 'use_snp_selection': False}. Best is trial 18 with value: 0.11411391432010902.
[I 2025-12-05 14:48:54,335] Trial 95 finished with value: 0.07228156173017847 and parameters: {'model_type': 'mlp', 'hidden_dims': '[512, 64]', 'dropout': 0.10455450980933392, 'batch_norm': True, 'lr': 7.585584380880761e-05, 'weight_decay': 1.6060271805289937e-05, 'epochs': 233, 'loss': 'mae', 'optimizer': 'adam', 'graph_mode': 'off', 'use_snp_selection': False}. Best is trial 18 with value: 0.11411391432010902.
[I 2025-12-05 14:48:56,417] Trial 96 finished with value: 0.08039487505190265 and parameters: {'model_type': 'mlp', 'hidden_dims': '[512, 64]', 'dropout': 0.1508678803688033, 'batch_norm': True, 'lr': 2.1737820833350297e-05, 'weight_decay': 5.24852271521401e-05, 'epochs': 221, 'loss': 'mae', 'optimizer': 'adam', 'graph_mode': 'off', 'use_snp_selection': False}. Best is trial 18 with value: 0.11411391432010902.
[I 2025-12-05 14:48:58,431] Trial 97 finished with value: 0.08999791162260684 and parameters: {'model_type': 'mlp', 'hidden_dims': '[512, 64]', 'dropout': 0.1614612282520244, 'batch_norm': True, 'lr': 1.4108385828779637e-05, 'weight_decay': 8.96775252448632e-05, 'epochs': 212, 'loss': 'mae', 'optimizer': 'adam', 'graph_mode': 'off', 'use_snp_selection': False}. Best is trial 18 with value: 0.11411391432010902.
[I 2025-12-05 14:48:59,351] Trial 98 finished with value: 0.0738247557421925 and parameters: {'model_type': 'mlp', 'hidden_dims': '[128, 64]', 'dropout': 0.29096155162447573, 'batch_norm': True, 'lr': 3.4751063112512707e-05, 'weight_decay': 4.745762313907879e-05, 'epochs': 198, 'loss': 'mae', 'optimizer': 'adam', 'graph_mode': 'off', 'use_snp_selection': False}. Best is trial 18 with value: 0.11411391432010902.
[I 2025-12-05 14:49:00,812] Trial 99 finished with value: 0.07976824421168954 and parameters: {'model_type': 'mlp', 'hidden_dims': '[256, 128, 64]', 'dropout': 0.11260934043719864, 'batch_norm': True, 'lr': 6.29634032610216e-05, 'weight_decay': 2.0980306384554895e-05, 'epochs': 273, 'loss': 'mae', 'optimizer': 'adam', 'graph_mode': 'off', 'use_snp_selection': False}. Best is trial 18 with value: 0.11411391432010902.
[I 2025-12-05 14:49:02,658] Trial 100 finished with value: 0.08950983318833658 and parameters: {'model_type': 'mlp', 'hidden_dims': '[512, 64]', 'dropout': 0.13831237389514797, 'batch_norm': True, 'lr': 0.0009563386096855215, 'weight_decay': 7.295578924063054e-05, 'epochs': 183, 'loss': 'mae', 'optimizer': 'adam', 'graph_mode': 'off', 'use_snp_selection': False}. Best is trial 18 with value: 0.11411391432010902.
[I 2025-12-05 14:49:04,865] Trial 101 finished with value: 0.08562290816490527 and parameters: {'model_type': 'mlp', 'hidden_dims': '[512, 64]', 'dropout': 0.1282422990698187, 'batch_norm': True, 'lr': 2.955299092491156e-05, 'weight_decay': 1.5830536158969523e-05, 'epochs': 244, 'loss': 'mae', 'optimizer': 'adam', 'graph_mode': 'off', 'use_snp_selection': False}. Best is trial 18 with value: 0.11411391432010902.
[I 2025-12-05 14:49:07,003] Trial 102 finished with value: 0.08072558823348583 and parameters: {'model_type': 'mlp', 'hidden_dims': '[512, 64]', 'dropout': 0.11891463289670658, 'batch_norm': True, 'lr': 4.196172166926646e-05, 'weight_decay': 2.3874599955849336e-05, 'epochs': 224, 'loss': 'mae', 'optimizer': 'adam', 'graph_mode': 'off', 'use_snp_selection': False}. Best is trial 18 with value: 0.11411391432010902.
[I 2025-12-05 14:49:08,112] Trial 103 finished with value: 0.04883208476655157 and parameters: {'model_type': 'mlp', 'hidden_dims': '[512, 64]', 'dropout': 0.10734878961730515, 'batch_norm': True, 'lr': 1.1542609150401145e-05, 'weight_decay': 0.0001128254336490944, 'epochs': 58, 'loss': 'mae', 'optimizer': 'adam', 'graph_mode': 'off', 'use_snp_selection': False}. Best is trial 18 with value: 0.11411391432010902.
[I 2025-12-05 14:49:10,266] Trial 104 finished with value: 0.08995836133628027 and parameters: {'model_type': 'mlp', 'hidden_dims': '[512, 64]', 'dropout': 0.12365094440118068, 'batch_norm': True, 'lr': 1.6022000112641623e-05, 'weight_decay': 1.2551582936668934e-05, 'epochs': 235, 'loss': 'mae', 'optimizer': 'adam', 'graph_mode': 'off', 'use_snp_selection': False}. Best is trial 18 with value: 0.11411391432010902.
[I 2025-12-05 14:49:12,590] Trial 105 finished with value: 0.07353329731468526 and parameters: {'model_type': 'mlp', 'hidden_dims': '[512, 256]', 'dropout': 0.2518312239779291, 'batch_norm': True, 'lr': 8.84398114655657e-06, 'weight_decay': 3.368534726297826e-05, 'epochs': 262, 'loss': 'mae', 'optimizer': 'adam', 'graph_mode': 'off', 'use_snp_selection': False}. Best is trial 18 with value: 0.11411391432010902.
[I 2025-12-05 14:49:14,838] Trial 106 finished with value: 0.09030734631429325 and parameters: {'model_type': 'mlp', 'hidden_dims': '[512, 64]', 'dropout': 0.14319893742940745, 'batch_norm': True, 'lr': 3.6005238055862876e-05, 'weight_decay': 8.832115402480415e-06, 'epochs': 250, 'loss': 'mae', 'optimizer': 'adam', 'graph_mode': 'off', 'use_snp_selection': False}. Best is trial 18 with value: 0.11411391432010902.
[I 2025-12-05 14:49:16,800] Trial 107 finished with value: 0.06781920939902086 and parameters: {'model_type': 'mlp', 'hidden_dims': '[512, 64]', 'dropout': 0.5152367592105029, 'batch_norm': True, 'lr': 4.62241657096125e-05, 'weight_decay': 4.279010542448086e-05, 'epochs': 203, 'loss': 'mae', 'optimizer': 'adam', 'graph_mode': 'off', 'use_snp_selection': False}. Best is trial 18 with value: 0.11411391432010902.
[I 2025-12-05 14:49:18,100] Trial 108 finished with value: 0.04557882645544745 and parameters: {'model_type': 'mlp', 'hidden_dims': '[256, 128]', 'dropout': 0.5846224774513213, 'batch_norm': True, 'lr': 1.8986360857505607e-05, 'weight_decay': 5.612489248420945e-05, 'epochs': 214, 'loss': 'mae', 'optimizer': 'adam', 'graph_mode': 'off', 'use_snp_selection': False}. Best is trial 18 with value: 0.11411391432010902.
[I 2025-12-05 14:49:19,445] Trial 109 finished with value: 0.05833842310337505 and parameters: {'model_type': 'mlp', 'hidden_dims': '[256, 128]', 'dropout': 0.10066942870539955, 'batch_norm': True, 'lr': 2.323519512496722e-05, 'weight_decay': 1.8509961036885778e-05, 'epochs': 240, 'loss': 'mse', 'optimizer': 'adam', 'graph_mode': 'off', 'use_snp_selection': False}. Best is trial 18 with value: 0.11411391432010902.
[I 2025-12-05 14:49:21,595] Trial 110 finished with value: 0.07029797621738137 and parameters: {'model_type': 'mlp', 'hidden_dims': '[512, 64]', 'dropout': 0.49013056016810747, 'batch_norm': True, 'lr': 5.3674817363478395e-05, 'weight_decay': 6.040371561903873e-06, 'epochs': 227, 'loss': 'mse', 'optimizer': 'adam', 'graph_mode': 'off', 'use_snp_selection': False}. Best is trial 18 with value: 0.11411391432010902.
[I 2025-12-05 14:49:23,886] Trial 111 finished with value: 0.08638510859599782 and parameters: {'model_type': 'mlp', 'hidden_dims': '[512, 64]', 'dropout': 0.1374757330265453, 'batch_norm': True, 'lr': 3.469776267982456e-05, 'weight_decay': 8.12111319596176e-06, 'epochs': 250, 'loss': 'mae', 'optimizer': 'adam', 'graph_mode': 'off', 'use_snp_selection': False}. Best is trial 18 with value: 0.11411391432010902.
[I 2025-12-05 14:49:26,219] Trial 112 finished with value: 0.06848481889017596 and parameters: {'model_type': 'mlp', 'hidden_dims': '[512, 64]', 'dropout': 0.16111364281860574, 'batch_norm': True, 'lr': 3.0665657346124736e-05, 'weight_decay': 9.006732750509459e-06, 'epochs': 256, 'loss': 'mae', 'optimizer': 'adam', 'graph_mode': 'off', 'use_snp_selection': False}. Best is trial 18 with value: 0.11411391432010902.
[I 2025-12-05 14:49:28,312] Trial 113 finished with value: 0.08429449367525797 and parameters: {'model_type': 'mlp', 'hidden_dims': '[512, 64]', 'dropout': 0.14689628552089293, 'batch_norm': True, 'lr': 2.5791218013465266e-05, 'weight_decay': 1.1271860145148725e-05, 'epochs': 219, 'loss': 'mae', 'optimizer': 'adam', 'graph_mode': 'off', 'use_snp_selection': False}. Best is trial 18 with value: 0.11411391432010902.
[I 2025-12-05 14:49:30,607] Trial 114 finished with value: 0.08069600840354837 and parameters: {'model_type': 'mlp', 'hidden_dims': '[512, 64]', 'dropout': 0.11166736464628017, 'batch_norm': True, 'lr': 4.0015011534423125e-05, 'weight_decay': 2.3863022658178788e-05, 'epochs': 248, 'loss': 'mae', 'optimizer': 'adam', 'graph_mode': 'off', 'use_snp_selection': False}. Best is trial 18 with value: 0.11411391432010902.
[I 2025-12-05 14:49:31,489] Trial 115 finished with value: 0.06085906195084128 and parameters: {'model_type': 'mlp', 'hidden_dims': '[128, 64]', 'dropout': 0.45370476895431966, 'batch_norm': True, 'lr': 7.413279189053875e-05, 'weight_decay': 4.457019305921677e-06, 'epochs': 175, 'loss': 'mae', 'optimizer': 'adam', 'graph_mode': 'off', 'use_snp_selection': False}. Best is trial 18 with value: 0.11411391432010902.
[I 2025-12-05 14:49:32,870] Trial 116 finished with value: 0.0768006152621171 and parameters: {'model_type': 'mlp', 'hidden_dims': '[256, 128]', 'dropout': 0.19183920718855937, 'batch_norm': True, 'lr': 9.356973562437738e-05, 'weight_decay': 2.7821912209394735e-05, 'epochs': 235, 'loss': 'mse', 'optimizer': 'adam', 'graph_mode': 'off', 'use_snp_selection': False}. Best is trial 18 with value: 0.11411391432010902.
[I 2025-12-05 14:49:35,233] Trial 117 finished with value: 0.09728838487901591 and parameters: {'model_type': 'mlp', 'hidden_dims': '[512, 64]', 'dropout': 0.12668914664920078, 'batch_norm': True, 'lr': 1.0349059849860187e-05, 'weight_decay': 1.4095224828117882e-05, 'epochs': 267, 'loss': 'mae', 'optimizer': 'adam', 'graph_mode': 'off', 'use_snp_selection': False}. Best is trial 18 with value: 0.11411391432010902.
[I 2025-12-05 14:49:36,514] Trial 118 finished with value: 0.08422416755626744 and parameters: {'model_type': 'mlp', 'hidden_dims': '[256, 128, 64]', 'dropout': 0.1656601139776074, 'batch_norm': True, 'lr': 7.70652146783893e-06, 'weight_decay': 3.5652402144435445e-05, 'epochs': 194, 'loss': 'mse', 'optimizer': 'adam', 'graph_mode': 'off', 'use_snp_selection': False}. Best is trial 18 with value: 0.11411391432010902.
[I 2025-12-05 14:49:38,012] Trial 119 finished with value: 0.09054159807969117 and parameters: {'model_type': 'mlp', 'hidden_dims': '[256, 128]', 'dropout': 0.12360994383238086, 'batch_norm': True, 'lr': 1.0042567882833602e-05, 'weight_decay': 1.5383182890842077e-05, 'epochs': 288, 'loss': 'mae', 'optimizer': 'adam', 'graph_mode': 'off', 'use_snp_selection': False}. Best is trial 18 with value: 0.11411391432010902.
[I 2025-12-05 14:49:39,562] Trial 120 finished with value: 0.05062372968214716 and parameters: {'model_type': 'mlp', 'hidden_dims': '[256, 128]', 'dropout': 0.1829058211496813, 'batch_norm': True, 'lr': 4.199597811353786e-06, 'weight_decay': 1.4408466147312854e-05, 'epochs': 291, 'loss': 'mae', 'optimizer': 'adam', 'graph_mode': 'off', 'use_snp_selection': False}. Best is trial 18 with value: 0.11411391432010902.
[I 2025-12-05 14:49:41,105] Trial 121 finished with value: 0.07325542314931192 and parameters: {'model_type': 'mlp', 'hidden_dims': '[256, 128]', 'dropout': 0.11945760253263425, 'batch_norm': True, 'lr': 1.040061784866236e-05, 'weight_decay': 1.6972961686469743e-05, 'epochs': 289, 'loss': 'mae', 'optimizer': 'adam', 'graph_mode': 'off', 'use_snp_selection': False}. Best is trial 18 with value: 0.11411391432010902.
[I 2025-12-05 14:49:42,578] Trial 122 finished with value: 0.09575698542881078 and parameters: {'model_type': 'mlp', 'hidden_dims': '[256, 128]', 'dropout': 0.12688199374999087, 'batch_norm': True, 'lr': 6.067172252919628e-06, 'weight_decay': 1.1887681740878546e-05, 'epochs': 267, 'loss': 'mae', 'optimizer': 'adam', 'graph_mode': 'off', 'use_snp_selection': False}. Best is trial 18 with value: 0.11411391432010902.
