[I 2025-12-05 15:25:53,523] Trial 66 finished with value: 0.1157140937349067 and parameters: {'model_type': 'mlp', 'hidden_dims': '[512, 256]', 'dropout': 0.1760078737575033, 'batch_norm': True, 'lr': 0.00015919449738750627, 'weight_decay': 1.3925920151581832e-07, 'epochs': 163, 'loss': 'mse', 'optimizer': 'adam', 'graph_mode': 'off', 'use_snp_selection': False}. Best is trial 49 with value: 0.13589578695926052.
[I 2025-12-05 15:25:56,427] Trial 67 finished with value: 0.11355987984589927 and parameters: {'model_type': 'mlp', 'hidden_dims': '[512, 256]', 'dropout': 0.3218574392559842, 'batch_norm': True, 'lr': 9.964241919592281e-05, 'weight_decay': 3.012620496904471e-06, 'epochs': 178, 'loss': 'mse', 'optimizer': 'adam', 'graph_mode': 'off', 'use_snp_selection': False}. Best is trial 49 with value: 0.13589578695926052.
[I 2025-12-05 15:25:57,917] Trial 68 finished with value: 0.10528651412543451 and parameters: {'model_type': 'mlp', 'hidden_dims': '[512, 256]', 'dropout': 0.2962620650982095, 'batch_norm': True, 'lr': 0.0003030987834219006, 'weight_decay': 2.6366272465647573e-07, 'epochs': 60, 'loss': 'mse', 'optimizer': 'adam', 'graph_mode': 'off', 'use_snp_selection': False}. Best is trial 49 with value: 0.13589578695926052.
[I 2025-12-05 15:26:02,150] Trial 69 finished with value: 0.11384276140899487 and parameters: {'model_type': 'mlp', 'hidden_dims': '[512, 256]', 'dropout': 0.19020137019172106, 'batch_norm': False, 'lr': 0.00039385281031009033, 'weight_decay': 8.101852151989281e-07, 'epochs': 117, 'loss': 'mae', 'optimizer': 'adam', 'graph_mode': 'off', 'use_snp_selection': True, 'num_snps': 52937}. Best is trial 49 with value: 0.13589578695926052.
[I 2025-12-05 15:26:05,171] Trial 70 finished with value: 0.1297511365780842 and parameters: {'model_type': 'mlp', 'hidden_dims': '[512, 64]', 'dropout': 0.1295356341721411, 'batch_norm': True, 'lr': 0.00024433959790295885, 'weight_decay': 1.1342324464847083e-07, 'epochs': 190, 'loss': 'mse', 'optimizer': 'adam', 'graph_mode': 'off', 'use_snp_selection': False}. Best is trial 49 with value: 0.13589578695926052.
[I 2025-12-05 15:26:08,198] Trial 71 finished with value: 0.12129934011241222 and parameters: {'model_type': 'mlp', 'hidden_dims': '[512, 64]', 'dropout': 0.13669903290959554, 'batch_norm': True, 'lr': 0.00024015534380589733, 'weight_decay': 2.2376890413461682e-07, 'epochs': 189, 'loss': 'mse', 'optimizer': 'adam', 'graph_mode': 'off', 'use_snp_selection': False}. Best is trial 49 with value: 0.13589578695926052.
[I 2025-12-05 15:26:10,937] Trial 72 finished with value: 0.11439833244750923 and parameters: {'model_type': 'mlp', 'hidden_dims': '[512, 64]', 'dropout': 0.12260805696487043, 'batch_norm': True, 'lr': 0.00016570842791917734, 'weight_decay': 1.3458360498496665e-07, 'epochs': 165, 'loss': 'mse', 'optimizer': 'adam', 'graph_mode': 'off', 'use_snp_selection': False}. Best is trial 49 with value: 0.13589578695926052.
[I 2025-12-05 15:26:14,198] Trial 73 finished with value: 0.14060769318641766 and parameters: {'model_type': 'mlp', 'hidden_dims': '[512, 64]', 'dropout': 0.10051342914927588, 'batch_norm': True, 'lr': 0.00029731276505726053, 'weight_decay': 1.0976572314712745e-07, 'epochs': 210, 'loss': 'mse', 'optimizer': 'adam', 'graph_mode': 'off', 'use_snp_selection': False}. Best is trial 73 with value: 0.14060769318641766.
[I 2025-12-05 15:26:17,442] Trial 74 finished with value: 0.1006630275692676 and parameters: {'model_type': 'mlp', 'hidden_dims': '[512, 64]', 'dropout': 0.10003728651266337, 'batch_norm': True, 'lr': 2.3617096465687534e-05, 'weight_decay': 1.0176146940328963e-07, 'epochs': 208, 'loss': 'mse', 'optimizer': 'adam', 'graph_mode': 'off', 'use_snp_selection': False}. Best is trial 73 with value: 0.14060769318641766.
[I 2025-12-05 15:26:19,570] Trial 75 finished with value: 0.12121194169629734 and parameters: {'model_type': 'mlp', 'hidden_dims': '[256, 128]', 'dropout': 0.39043184591126945, 'batch_norm': True, 'lr': 4.176664436658777e-05, 'weight_decay': 4.379217285526076e-07, 'epochs': 223, 'loss': 'mse', 'optimizer': 'adam', 'graph_mode': 'off', 'use_snp_selection': False}. Best is trial 73 with value: 0.14060769318641766.
[I 2025-12-05 15:26:23,460] Trial 76 finished with value: 0.11919625336244441 and parameters: {'model_type': 'mlp', 'hidden_dims': '[512, 64]', 'dropout': 0.21555849411048694, 'batch_norm': True, 'lr': 0.0001342483735293883, 'weight_decay': 8.373169105594098e-05, 'epochs': 263, 'loss': 'mae', 'optimizer': 'adam', 'graph_mode': 'off', 'use_snp_selection': False}. Best is trial 73 with value: 0.14060769318641766.
[I 2025-12-05 15:26:24,539] Trial 77 finished with value: 0.11745787095347028 and parameters: {'model_type': 'mlp', 'hidden_dims': '[128, 64]', 'dropout': 0.17378481589912237, 'batch_norm': True, 'lr': 0.0003698185590249802, 'weight_decay': 1.610128931845959e-07, 'epochs': 156, 'loss': 'mae', 'optimizer': 'adam', 'graph_mode': 'off', 'use_snp_selection': False}. Best is trial 73 with value: 0.14060769318641766.
[I 2025-12-05 15:26:27,018] Trial 78 finished with value: 0.11021877124352517 and parameters: {'model_type': 'mlp', 'hidden_dims': '[512, 128]', 'dropout': 0.3551296671286116, 'batch_norm': True, 'lr': 0.00030340414497465507, 'weight_decay': 3.5063204799298527e-07, 'epochs': 146, 'loss': 'mse', 'optimizer': 'adam', 'graph_mode': 'off', 'use_snp_selection': False}. Best is trial 73 with value: 0.14060769318641766.
[I 2025-12-05 15:26:31,016] Trial 79 finished with value: 0.12543462418034612 and parameters: {'model_type': 'mlp', 'hidden_dims': '[512, 256]', 'dropout': 0.145280692803661, 'batch_norm': True, 'lr': 0.00020687869792254516, 'weight_decay': 2.2430755171775764e-06, 'epochs': 175, 'loss': 'mae', 'optimizer': 'adam', 'graph_mode': 'off', 'use_snp_selection': True, 'num_snps': 40993}. Best is trial 73 with value: 0.14060769318641766.
[I 2025-12-05 15:26:35,344] Trial 80 finished with value: 0.09557312689918344 and parameters: {'model_type': 'mlp', 'hidden_dims': '[512, 64]', 'dropout': 0.11468249611497615, 'batch_norm': False, 'lr': 9.074238694924221e-05, 'weight_decay': 1.846766649058617e-06, 'epochs': 307, 'loss': 'mse', 'optimizer': 'adam', 'graph_mode': 'off', 'use_snp_selection': False}. Best is trial 73 with value: 0.14060769318641766.
[I 2025-12-05 15:26:38,305] Trial 81 finished with value: 0.11732552057907654 and parameters: {'model_type': 'mlp', 'hidden_dims': '[512, 64]', 'dropout': 0.12766435735004106, 'batch_norm': True, 'lr': 0.0002858330281383169, 'weight_decay': 2.223973235645998e-07, 'epochs': 184, 'loss': 'mse', 'optimizer': 'adam', 'graph_mode': 'off', 'use_snp_selection': False}. Best is trial 73 with value: 0.14060769318641766.
[I 2025-12-05 15:26:41,627] Trial 82 finished with value: 0.1308922943890988 and parameters: {'model_type': 'mlp', 'hidden_dims': '[512, 64]', 'dropout': 0.10000729457179441, 'batch_norm': True, 'lr': 0.00044657315269974057, 'weight_decay': 1.264145309627823e-07, 'epochs': 215, 'loss': 'mse', 'optimizer': 'adam', 'graph_mode': 'off', 'use_snp_selection': False}. Best is trial 73 with value: 0.14060769318641766.
[I 2025-12-05 15:26:44,894] Trial 83 finished with value: 0.13724681891438895 and parameters: {'model_type': 'mlp', 'hidden_dims': '[512, 64]', 'dropout': 0.10014828252849063, 'batch_norm': True, 'lr': 0.00044780066004336175, 'weight_decay': 1.693078543378889e-07, 'epochs': 214, 'loss': 'mse', 'optimizer': 'adam', 'graph_mode': 'off', 'use_snp_selection': False}. Best is trial 73 with value: 0.14060769318641766.
[I 2025-12-05 15:26:48,399] Trial 84 finished with value: 0.11326932155217612 and parameters: {'model_type': 'mlp', 'hidden_dims': '[512, 64]', 'dropout': 0.11361309176447731, 'batch_norm': True, 'lr': 0.000843280555212034, 'weight_decay': 0.0008888858800507451, 'epochs': 230, 'loss': 'mse', 'optimizer': 'adam', 'graph_mode': 'off', 'use_snp_selection': False}. Best is trial 73 with value: 0.14060769318641766.
[I 2025-12-05 15:26:51,723] Trial 85 finished with value: 0.13044692127108093 and parameters: {'model_type': 'mlp', 'hidden_dims': '[512, 64]', 'dropout': 0.10178992756148857, 'batch_norm': True, 'lr': 0.000452870605759459, 'weight_decay': 1.988990292916493e-07, 'epochs': 216, 'loss': 'mae', 'optimizer': 'adam', 'graph_mode': 'off', 'use_snp_selection': False}. Best is trial 73 with value: 0.14060769318641766.
[I 2025-12-05 15:26:55,342] Trial 86 finished with value: 0.11017150800726015 and parameters: {'model_type': 'mlp', 'hidden_dims': '[512, 64]', 'dropout': 0.10940812242515291, 'batch_norm': True, 'lr': 0.0007314503376923237, 'weight_decay': 1.8585618876291838e-07, 'epochs': 244, 'loss': 'mse', 'optimizer': 'adam', 'graph_mode': 'off', 'use_snp_selection': False}. Best is trial 73 with value: 0.14060769318641766.
[I 2025-12-05 15:26:58,671] Trial 87 finished with value: 0.14103690049444517 and parameters: {'model_type': 'mlp', 'hidden_dims': '[512, 64]', 'dropout': 0.10004925460832324, 'batch_norm': True, 'lr': 0.0006273594120033662, 'weight_decay': 2.5950905187408837e-07, 'epochs': 215, 'loss': 'mae', 'optimizer': 'adam', 'graph_mode': 'off', 'use_snp_selection': False}. Best is trial 87 with value: 0.14103690049444517.
[I 2025-12-05 15:27:02,425] Trial 88 finished with value: 0.13452788890265677 and parameters: {'model_type': 'mlp', 'hidden_dims': '[512, 64]', 'dropout': 0.10161027675972943, 'batch_norm': True, 'lr': 0.0005725318311248113, 'weight_decay': 2.7402092776876894e-07, 'epochs': 253, 'loss': 'mae', 'optimizer': 'adam', 'graph_mode': 'off', 'use_snp_selection': False}. Best is trial 87 with value: 0.14103690049444517.
[I 2025-12-05 15:27:06,233] Trial 89 finished with value: 0.12054742063366201 and parameters: {'model_type': 'mlp', 'hidden_dims': '[512, 64]', 'dropout': 0.14286154877574098, 'batch_norm': True, 'lr': 0.0005968594715446422, 'weight_decay': 2.8082961626756176e-07, 'epochs': 257, 'loss': 'mse', 'optimizer': 'adam', 'graph_mode': 'off', 'use_snp_selection': False}. Best is trial 87 with value: 0.14103690049444517.
[I 2025-12-05 15:27:09,946] Trial 90 finished with value: 0.1144881426610562 and parameters: {'model_type': 'mlp', 'hidden_dims': '[512, 64]', 'dropout': 0.10017134920032357, 'batch_norm': True, 'lr': 0.0007378248226700544, 'weight_decay': 1.0165631709625991e-07, 'epochs': 249, 'loss': 'mae', 'optimizer': 'adam', 'graph_mode': 'off', 'use_snp_selection': True, 'num_snps': 30661}. Best is trial 87 with value: 0.14103690049444517.
[I 2025-12-05 15:27:13,225] Trial 91 finished with value: 0.11927135111512784 and parameters: {'model_type': 'mlp', 'hidden_dims': '[512, 64]', 'dropout': 0.11946139359198137, 'batch_norm': True, 'lr': 0.0005007899857925384, 'weight_decay': 2.2982831945728077e-07, 'epochs': 215, 'loss': 'mae', 'optimizer': 'adam', 'graph_mode': 'off', 'use_snp_selection': False}. Best is trial 87 with value: 0.14103690049444517.
[I 2025-12-05 15:27:16,333] Trial 92 finished with value: 0.1363070155838239 and parameters: {'model_type': 'mlp', 'hidden_dims': '[512, 64]', 'dropout': 0.1012112401604007, 'batch_norm': True, 'lr': 0.000460442074587811, 'weight_decay': 3.5589896816360216e-07, 'epochs': 201, 'loss': 'mae', 'optimizer': 'adam', 'graph_mode': 'off', 'use_snp_selection': False}. Best is trial 87 with value: 0.14103690049444517.
[I 2025-12-05 15:27:20,506] Trial 93 finished with value: 0.12609130319191467 and parameters: {'model_type': 'mlp', 'hidden_dims': '[512, 64]', 'dropout': 0.12715265497098738, 'batch_norm': True, 'lr': 0.000609564740104091, 'weight_decay': 3.969854298756228e-07, 'epochs': 288, 'loss': 'mae', 'optimizer': 'adam', 'graph_mode': 'off', 'use_snp_selection': False}. Best is trial 87 with value: 0.14103690049444517.
[I 2025-12-05 15:27:23,699] Trial 94 finished with value: 0.1288150992842649 and parameters: {'model_type': 'mlp', 'hidden_dims': '[512, 64]', 'dropout': 0.14571054409580053, 'batch_norm': True, 'lr': 0.00043245755178433624, 'weight_decay': 6.408873467507133e-07, 'epochs': 204, 'loss': 'mae', 'optimizer': 'adam', 'graph_mode': 'off', 'use_snp_selection': False}. Best is trial 87 with value: 0.14103690049444517.
[I 2025-12-05 15:27:26,851] Trial 95 finished with value: 0.11317572501336064 and parameters: {'model_type': 'mlp', 'hidden_dims': '[512, 64]', 'dropout': 0.1624585637451128, 'batch_norm': True, 'lr': 0.0008299266825356611, 'weight_decay': 3.2652359058683484e-07, 'epochs': 201, 'loss': 'mae', 'optimizer': 'adam', 'graph_mode': 'off', 'use_snp_selection': False}. Best is trial 87 with value: 0.14103690049444517.
[I 2025-12-05 15:27:30,331] Trial 96 finished with value: 0.10934051356877655 and parameters: {'model_type': 'mlp', 'hidden_dims': '[512, 64]', 'dropout': 0.11742307106753981, 'batch_norm': True, 'lr': 0.00037024163125569533, 'weight_decay': 1.2665533295902066e-07, 'epochs': 231, 'loss': 'mae', 'optimizer': 'adam', 'graph_mode': 'off', 'use_snp_selection': False}. Best is trial 87 with value: 0.14103690049444517.
[I 2025-12-05 15:27:33,563] Trial 97 finished with value: 0.12700618807716793 and parameters: {'model_type': 'mlp', 'hidden_dims': '[512, 64]', 'dropout': 0.1366531774056286, 'batch_norm': True, 'lr': 0.000577303946919897, 'weight_decay': 4.3582697120698264e-07, 'epochs': 211, 'loss': 'mae', 'optimizer': 'adam', 'graph_mode': 'off', 'use_snp_selection': False}. Best is trial 87 with value: 0.14103690049444517.
[I 2025-12-05 15:27:36,648] Trial 98 finished with value: 0.14040987288650544 and parameters: {'model_type': 'mlp', 'hidden_dims': '[512, 64]', 'dropout': 0.11322966481841948, 'batch_norm': True, 'lr': 0.0009856998726827813, 'weight_decay': 9.007840933968586e-07, 'epochs': 198, 'loss': 'mse', 'optimizer': 'adam', 'graph_mode': 'off', 'use_snp_selection': False}. Best is trial 87 with value: 0.14103690049444517.
[I 2025-12-05 15:27:38,298] Trial 99 finished with value: 0.06872135818755404 and parameters: {'model_type': 'mlp', 'hidden_dims': '[512, 64]', 'dropout': 0.11645001361030774, 'batch_norm': False, 'lr': 0.000988313193823269, 'weight_decay': 1.2107881471031356e-06, 'epochs': 198, 'loss': 'mae', 'optimizer': 'adam', 'graph_mode': 'off', 'use_snp_selection': True, 'num_snps': 2833}. Best is trial 87 with value: 0.14103690049444517.
[I 2025-12-05 15:27:41,725] Trial 100 finished with value: 0.11347876979323322 and parameters: {'model_type': 'mlp', 'hidden_dims': '[512, 64]', 'dropout': 0.1314772179095725, 'batch_norm': True, 'lr': 0.0007965867239037158, 'weight_decay': 6.980109301005769e-07, 'epochs': 225, 'loss': 'mse', 'optimizer': 'adam', 'graph_mode': 'off', 'use_snp_selection': False}. Best is trial 87 with value: 0.14103690049444517.
[I 2025-12-05 15:27:45,298] Trial 101 finished with value: 0.10753086258052386 and parameters: {'model_type': 'mlp', 'hidden_dims': '[512, 64]', 'dropout': 0.1011376684017578, 'batch_norm': True, 'lr': 0.00044560885837233486, 'weight_decay': 8.551698421203287e-07, 'epochs': 239, 'loss': 'mse', 'optimizer': 'adam', 'graph_mode': 'off', 'use_snp_selection': False}. Best is trial 87 with value: 0.14103690049444517.
[I 2025-12-05 15:27:48,347] Trial 102 finished with value: 0.13576859394559873 and parameters: {'model_type': 'mlp', 'hidden_dims': '[512, 64]', 'dropout': 0.11199315664600024, 'batch_norm': True, 'lr': 0.0006238882635049784, 'weight_decay': 2.6530065412810396e-07, 'epochs': 196, 'loss': 'mse', 'optimizer': 'adam', 'graph_mode': 'off', 'use_snp_selection': False}. Best is trial 87 with value: 0.14103690049444517.
[I 2025-12-05 15:27:51,407] Trial 103 finished with value: 0.12695296684513768 and parameters: {'model_type': 'mlp', 'hidden_dims': '[512, 64]', 'dropout': 0.11068941646091127, 'batch_norm': True, 'lr': 0.0006625545500485579, 'weight_decay': 2.5597528232392915e-07, 'epochs': 197, 'loss': 'mse', 'optimizer': 'adam', 'graph_mode': 'off', 'use_snp_selection': False}. Best is trial 87 with value: 0.14103690049444517.
[I 2025-12-05 15:27:55,423] Trial 104 finished with value: 0.11017427906492938 and parameters: {'model_type': 'mlp', 'hidden_dims': '[512, 64]', 'dropout': 0.15057397484780083, 'batch_norm': True, 'lr': 0.0006203556917319119, 'weight_decay': 1.0033589853654002e-06, 'epochs': 275, 'loss': 'mse', 'optimizer': 'adam', 'graph_mode': 'off', 'use_snp_selection': False}. Best is trial 87 with value: 0.14103690049444517.
[I 2025-12-05 15:27:58,454] Trial 105 finished with value: 0.1302907659114425 and parameters: {'model_type': 'mlp', 'hidden_dims': '[512, 64]', 'dropout': 0.12423988851263008, 'batch_norm': True, 'lr': 0.0003543535278092612, 'weight_decay': 5.566206152108096e-07, 'epochs': 191, 'loss': 'mse', 'optimizer': 'adam', 'graph_mode': 'off', 'use_snp_selection': False}. Best is trial 87 with value: 0.14103690049444517.
[I 2025-12-05 15:28:00,271] Trial 106 finished with value: 0.1209304993192425 and parameters: {'model_type': 'mlp', 'hidden_dims': '[256, 128]', 'dropout': 0.5261913058747589, 'batch_norm': True, 'lr': 0.0005459221761716511, 'weight_decay': 1.5929143432303916e-07, 'epochs': 184, 'loss': 'mse', 'optimizer': 'adam', 'graph_mode': 'off', 'use_snp_selection': False}. Best is trial 87 with value: 0.14103690049444517.
[I 2025-12-05 15:28:03,486] Trial 107 finished with value: 0.04335083275629123 and parameters: {'model_type': 'mlp', 'hidden_dims': '[512, 64]', 'dropout': 0.16680123535919644, 'batch_norm': True, 'lr': 1.1435213377551931e-06, 'weight_decay': 4.0219408926050984e-07, 'epochs': 210, 'loss': 'mae', 'optimizer': 'adam', 'graph_mode': 'off', 'use_snp_selection': False}. Best is trial 87 with value: 0.14103690049444517.
[I 2025-12-05 15:28:04,673] Trial 108 finished with value: 0.10523576589603179 and parameters: {'model_type': 'mlp', 'hidden_dims': '[128, 64]', 'dropout': 0.13484378102876282, 'batch_norm': True, 'lr': 0.0008889375608477026, 'weight_decay': 3.384698282283228e-07, 'epochs': 196, 'loss': 'mse', 'optimizer': 'adam', 'graph_mode': 'off', 'use_snp_selection': False}. Best is trial 87 with value: 0.14103690049444517.
[I 2025-12-05 15:28:06,607] Trial 109 finished with value: 0.10209464391395046 and parameters: {'model_type': 'mlp', 'hidden_dims': '[512, 64]', 'dropout': 0.11253519909282761, 'batch_norm': True, 'lr': 0.0007369706362051887, 'weight_decay': 2.759427328519956e-07, 'epochs': 100, 'loss': 'mae', 'optimizer': 'adam', 'graph_mode': 'off', 'use_snp_selection': True, 'num_snps': 13443}. Best is trial 87 with value: 0.14103690049444517.
[I 2025-12-05 15:28:09,986] Trial 110 finished with value: 0.12541536013424523 and parameters: {'model_type': 'mlp', 'hidden_dims': '[512, 64]', 'dropout': 0.12124774113124907, 'batch_norm': True, 'lr': 0.0002167689221407653, 'weight_decay': 5.926762848939926e-07, 'epochs': 220, 'loss': 'mse', 'optimizer': 'adam', 'graph_mode': 'off', 'use_snp_selection': False}. Best is trial 87 with value: 0.14103690049444517.
[I 2025-12-05 15:28:13,166] Trial 111 finished with value: 0.12402481989690475 and parameters: {'model_type': 'mlp', 'hidden_dims': '[512, 64]', 'dropout': 0.10563938680788881, 'batch_norm': True, 'lr': 0.0003896524033717153, 'weight_decay': 1.9533809659957998e-07, 'epochs': 204, 'loss': 'mse', 'optimizer': 'adam', 'graph_mode': 'off', 'use_snp_selection': False}. Best is trial 87 with value: 0.14103690049444517.
[I 2025-12-05 15:28:16,587] Trial 112 finished with value: 0.10736704859827145 and parameters: {'model_type': 'mlp', 'hidden_dims': '[512, 64]', 'dropout': 0.1096309999521002, 'batch_norm': True, 'lr': 0.0004788549175668515, 'weight_decay': 1.455351052421544e-06, 'epochs': 226, 'loss': 'mse', 'optimizer': 'adam', 'graph_mode': 'off', 'use_snp_selection': False}. Best is trial 87 with value: 0.14103690049444517.
[I 2025-12-05 15:28:20,122] Trial 113 finished with value: 0.11689720501467586 and parameters: {'model_type': 'mlp', 'hidden_dims': '[512, 64]', 'dropout': 0.13010095047732864, 'batch_norm': True, 'lr': 0.0004177268155961813, 'weight_decay': 1.2953189533143678e-07, 'epochs': 237, 'loss': 'mse', 'optimizer': 'adam', 'graph_mode': 'off', 'use_snp_selection': False}. Best is trial 87 with value: 0.14103690049444517.
[I 2025-12-05 15:28:23,371] Trial 114 finished with value: 0.10669759274923643 and parameters: {'model_type': 'mlp', 'hidden_dims': '[512, 64]', 'dropout': 0.10105219844974454, 'batch_norm': True, 'lr': 0.0005092653625027596, 'weight_decay': 4.784894550429061e-07, 'epochs': 213, 'loss': 'mse', 'optimizer': 'adam', 'graph_mode': 'off', 'use_snp_selection': False}. Best is trial 87 with value: 0.14103690049444517.
[I 2025-12-05 15:28:26,730] Trial 115 finished with value: 0.04547007818546174 and parameters: {'model_type': 'mlp', 'hidden_dims': '[512, 64]', 'dropout': 0.14341266706325786, 'batch_norm': True, 'lr': 7.114972227625743e-06, 'weight_decay': 1.67191609759248e-07, 'epochs': 219, 'loss': 'mse', 'optimizer': 'adam', 'graph_mode': 'off', 'use_snp_selection': False}. Best is trial 87 with value: 0.14103690049444517.
[I 2025-12-05 15:28:29,537] Trial 116 finished with value: 0.1413608877438965 and parameters: {'model_type': 'mlp', 'hidden_dims': '[512, 64]', 'dropout': 0.11932157059402564, 'batch_norm': True, 'lr': 0.00034151019633639685, 'weight_decay': 9.620915496101142e-07, 'epochs': 172, 'loss': 'mse', 'optimizer': 'adam', 'graph_mode': 'off', 'use_snp_selection': False}. Best is trial 116 with value: 0.1413608877438965.
[I 2025-12-05 15:28:32,302] Trial 117 finished with value: 0.12258684143099183 and parameters: {'model_type': 'mlp', 'hidden_dims': '[512, 64]', 'dropout': 0.1522089812852514, 'batch_norm': True, 'lr': 0.00017561866438567725, 'weight_decay': 7.605192609078324e-07, 'epochs': 171, 'loss': 'mae', 'optimizer': 'adam', 'graph_mode': 'off', 'use_snp_selection': False}. Best is trial 116 with value: 0.1413608877438965.
