[I 2025-12-05 15:36:21,056] Trial 78 finished with value: 0.06056798549464537 and parameters: {'model_type': 'mlp', 'hidden_dims': '[128, 64]', 'dropout': 0.11521319583445237, 'batch_norm': True, 'lr': 1.4922168324926453e-05, 'weight_decay': 6.122340251870822e-05, 'epochs': 346, 'loss': 'mse', 'optimizer': 'adam', 'graph_mode': 'off', 'use_snp_selection': False}. Best is trial 0 with value: 0.07830712685738.
[I 2025-12-05 15:36:22,703] Trial 79 finished with value: 0.05357951858440469 and parameters: {'model_type': 'mlp', 'hidden_dims': '[512, 256]', 'dropout': 0.19686063406733617, 'batch_norm': False, 'lr': 6.792894880434349e-05, 'weight_decay': 0.00018004924422665425, 'epochs': 193, 'loss': 'mse', 'optimizer': 'adam', 'graph_mode': 'off', 'use_snp_selection': False}. Best is trial 0 with value: 0.07830712685738.
[I 2025-12-05 15:36:25,503] Trial 80 finished with value: 0.05063112831892004 and parameters: {'model_type': 'mlp', 'hidden_dims': '[128, 64]', 'dropout': 0.18242186324748597, 'batch_norm': True, 'lr': 5.370020406431832e-05, 'weight_decay': 0.00046195921778021933, 'epochs': 272, 'loss': 'mse', 'optimizer': 'adam', 'graph_mode': 'off', 'use_snp_selection': True, 'num_snps': 52502}. Best is trial 0 with value: 0.07830712685738.
[I 2025-12-05 15:36:26,588] Trial 81 finished with value: 0.030705852752609897 and parameters: {'model_type': 'mlp', 'hidden_dims': '[128, 64]', 'dropout': 0.11414529676763895, 'batch_norm': True, 'lr': 7.820611719291091e-06, 'weight_decay': 4.4717612262901916e-05, 'epochs': 327, 'loss': 'mse', 'optimizer': 'adam', 'graph_mode': 'off', 'use_snp_selection': False}. Best is trial 0 with value: 0.07830712685738.
[I 2025-12-05 15:36:27,692] Trial 82 finished with value: -0.002916851338432323 and parameters: {'model_type': 'mlp', 'hidden_dims': '[128, 64]', 'dropout': 0.13759288547395304, 'batch_norm': True, 'lr': 1.4051840439161395e-05, 'weight_decay': 5.598393525754992e-05, 'epochs': 350, 'loss': 'mse', 'optimizer': 'adam', 'graph_mode': 'off', 'use_snp_selection': False}. Best is trial 0 with value: 0.07830712685738.
[I 2025-12-05 15:36:28,744] Trial 83 finished with value: 0.056855238662904886 and parameters: {'model_type': 'mlp', 'hidden_dims': '[128, 64]', 'dropout': 0.11400351518991739, 'batch_norm': True, 'lr': 0.00030685620157280623, 'weight_decay': 9.155871647710611e-05, 'epochs': 316, 'loss': 'mse', 'optimizer': 'adam', 'graph_mode': 'off', 'use_snp_selection': False}. Best is trial 0 with value: 0.07830712685738.
[I 2025-12-05 15:36:29,544] Trial 84 finished with value: 0.041977112125277403 and parameters: {'model_type': 'mlp', 'hidden_dims': '[128, 64]', 'dropout': 0.1008142192705696, 'batch_norm': True, 'lr': 2.224408210526142e-05, 'weight_decay': 7.213417814069978e-07, 'epochs': 156, 'loss': 'mse', 'optimizer': 'adam', 'graph_mode': 'off', 'use_snp_selection': False}. Best is trial 0 with value: 0.07830712685738.
[I 2025-12-05 15:36:31,830] Trial 85 finished with value: -0.030318151849019443 and parameters: {'model_type': 'mlp', 'hidden_dims': '[512, 64]', 'dropout': 0.1561079346912594, 'batch_norm': True, 'lr': 3.569925660681723e-06, 'weight_decay': 1.4652337848167494e-05, 'epochs': 334, 'loss': 'mse', 'optimizer': 'adam', 'graph_mode': 'off', 'use_snp_selection': False}. Best is trial 0 with value: 0.07830712685738.
[I 2025-12-05 15:36:32,944] Trial 86 finished with value: 0.051783645145700295 and parameters: {'model_type': 'mlp', 'hidden_dims': '[128, 64]', 'dropout': 0.13418997990222173, 'batch_norm': True, 'lr': 0.00012790204018174405, 'weight_decay': 0.0001393940508749386, 'epochs': 346, 'loss': 'mse', 'optimizer': 'adam', 'graph_mode': 'off', 'use_snp_selection': False}. Best is trial 0 with value: 0.07830712685738.
[I 2025-12-05 15:36:34,528] Trial 87 finished with value: 0.05122347478797162 and parameters: {'model_type': 'mlp', 'hidden_dims': '[512, 64]', 'dropout': 0.11592297382400746, 'batch_norm': True, 'lr': 3.8589151794087844e-05, 'weight_decay': 0.0002461551963220006, 'epochs': 177, 'loss': 'mae', 'optimizer': 'adam', 'graph_mode': 'off', 'use_snp_selection': False}. Best is trial 0 with value: 0.07830712685738.
[I 2025-12-05 15:36:36,670] Trial 88 finished with value: 0.0566530676305832 and parameters: {'model_type': 'mlp', 'hidden_dims': '[512, 128]', 'dropout': 0.2651383966259828, 'batch_norm': True, 'lr': 8.618862272879534e-05, 'weight_decay': 1.8060316082082554e-06, 'epochs': 303, 'loss': 'mse', 'optimizer': 'adam', 'graph_mode': 'off', 'use_snp_selection': False}. Best is trial 0 with value: 0.07830712685738.
[I 2025-12-05 15:36:37,682] Trial 89 finished with value: 0.04318172836712459 and parameters: {'model_type': 'mlp', 'hidden_dims': '[256, 128]', 'dropout': 0.1759674933916241, 'batch_norm': True, 'lr': 0.00048130360942950706, 'weight_decay': 2.8556291537313676e-06, 'epochs': 149, 'loss': 'mse', 'optimizer': 'adam', 'graph_mode': 'off', 'use_snp_selection': False}. Best is trial 0 with value: 0.07830712685738.
[I 2025-12-05 15:36:39,872] Trial 90 finished with value: 0.06127203672042171 and parameters: {'model_type': 'mlp', 'hidden_dims': '[256, 128, 64]', 'dropout': 0.1451672731255714, 'batch_norm': True, 'lr': 0.00081518804654272, 'weight_decay': 0.0009926016049416975, 'epochs': 185, 'loss': 'mse', 'optimizer': 'adam', 'graph_mode': 'off', 'use_snp_selection': True, 'num_snps': 35811}. Best is trial 0 with value: 0.07830712685738.
[I 2025-12-05 15:36:41,984] Trial 91 finished with value: 0.05576172695938987 and parameters: {'model_type': 'mlp', 'hidden_dims': '[256, 128, 64]', 'dropout': 0.14867171275486873, 'batch_norm': True, 'lr': 0.0008449070170458256, 'weight_decay': 0.0009994980034089222, 'epochs': 185, 'loss': 'mse', 'optimizer': 'adam', 'graph_mode': 'off', 'use_snp_selection': True, 'num_snps': 34827}. Best is trial 0 with value: 0.07830712685738.
[I 2025-12-05 15:36:43,760] Trial 92 finished with value: 0.03860147052114234 and parameters: {'model_type': 'mlp', 'hidden_dims': '[256, 128, 64]', 'dropout': 0.23395678838513, 'batch_norm': True, 'lr': 0.0009833239494906033, 'weight_decay': 5.678007570709488e-07, 'epochs': 173, 'loss': 'mse', 'optimizer': 'adam', 'graph_mode': 'off', 'use_snp_selection': True, 'num_snps': 26888}. Best is trial 0 with value: 0.07830712685738.
[I 2025-12-05 15:36:45,195] Trial 93 finished with value: 0.02726792717034306 and parameters: {'model_type': 'mlp', 'hidden_dims': '[256, 128, 64]', 'dropout': 0.12927967713036842, 'batch_norm': True, 'lr': 0.0007055042015675614, 'weight_decay': 8.530538326026011e-07, 'epochs': 191, 'loss': 'mse', 'optimizer': 'adam', 'graph_mode': 'off', 'use_snp_selection': True, 'num_snps': 18408}. Best is trial 0 with value: 0.07830712685738.
[I 2025-12-05 15:36:47,312] Trial 94 finished with value: 0.055305062555851436 and parameters: {'model_type': 'mlp', 'hidden_dims': '[256, 128, 64]', 'dropout': 0.21098323852496687, 'batch_norm': True, 'lr': 0.0003396275632591744, 'weight_decay': 7.828880986094815e-05, 'epochs': 206, 'loss': 'mse', 'optimizer': 'adam', 'graph_mode': 'off', 'use_snp_selection': True, 'num_snps': 38153}. Best is trial 0 with value: 0.07830712685738.
[I 2025-12-05 15:36:50,239] Trial 95 finished with value: 0.04872456443741716 and parameters: {'model_type': 'mlp', 'hidden_dims': '[512, 64]', 'dropout': 0.11168876890363286, 'batch_norm': True, 'lr': 0.0004933955329130052, 'weight_decay': 0.0007336920703221063, 'epochs': 226, 'loss': 'mse', 'optimizer': 'adam', 'graph_mode': 'off', 'use_snp_selection': True, 'num_snps': 45629}. Best is trial 0 with value: 0.07830712685738.
[I 2025-12-05 15:36:51,223] Trial 96 finished with value: 0.046454550016674964 and parameters: {'model_type': 'mlp', 'hidden_dims': '[512, 64]', 'dropout': 0.16323189089490375, 'batch_norm': True, 'lr': 0.0006023497603778959, 'weight_decay': 2.5572089988143217e-05, 'epochs': 40, 'loss': 'mae', 'optimizer': 'adam', 'graph_mode': 'off', 'use_snp_selection': False}. Best is trial 0 with value: 0.07830712685738.
[I 2025-12-05 15:36:53,143] Trial 97 finished with value: 0.0217868328791783 and parameters: {'model_type': 'mlp', 'hidden_dims': '[128, 64]', 'dropout': 0.12907404874049483, 'batch_norm': False, 'lr': 1.4605255213810202e-05, 'weight_decay': 0.0004952692103050004, 'epochs': 165, 'loss': 'mse', 'optimizer': 'adam', 'graph_mode': 'off', 'use_snp_selection': True, 'num_snps': 34438}. Best is trial 0 with value: 0.07830712685738.
[I 2025-12-05 15:36:54,615] Trial 98 finished with value: 0.05006795796396438 and parameters: {'model_type': 'mlp', 'hidden_dims': '[512, 64]', 'dropout': 0.13941290619428587, 'batch_norm': True, 'lr': 4.5294627073418667e-05, 'weight_decay': 4.2072268215126665e-07, 'epochs': 155, 'loss': 'mse', 'optimizer': 'adam', 'graph_mode': 'off', 'use_snp_selection': False}. Best is trial 0 with value: 0.07830712685738.
[I 2025-12-05 15:36:55,948] Trial 99 finished with value: 0.050033135618738296 and parameters: {'model_type': 'mlp', 'hidden_dims': '[512, 256]', 'dropout': 0.1204509302498444, 'batch_norm': True, 'lr': 0.00020640416581579223, 'weight_decay': 1.013650943068076e-06, 'epochs': 128, 'loss': 'mse', 'optimizer': 'adam', 'graph_mode': 'off', 'use_snp_selection': False}. Best is trial 0 with value: 0.07830712685738.
[I 2025-12-05 15:36:56,880] Trial 100 finished with value: 0.03198008219183224 and parameters: {'model_type': 'mlp', 'hidden_dims': '[128, 64]', 'dropout': 0.15803265435092723, 'batch_norm': True, 'lr': 1.1275258033197538e-06, 'weight_decay': 0.00011098708191131803, 'epochs': 253, 'loss': 'mse', 'optimizer': 'adam', 'graph_mode': 'off', 'use_snp_selection': False}. Best is trial 0 with value: 0.07830712685738.
[I 2025-12-05 15:36:58,469] Trial 101 finished with value: 0.0503124869794452 and parameters: {'model_type': 'mlp', 'hidden_dims': '[512, 64]', 'dropout': 0.12338185288237599, 'batch_norm': True, 'lr': 0.0006310005634577819, 'weight_decay': 3.60042204802098e-07, 'epochs': 181, 'loss': 'mse', 'optimizer': 'adam', 'graph_mode': 'off', 'use_snp_selection': False}. Best is trial 0 with value: 0.07830712685738.
[I 2025-12-05 15:37:00,004] Trial 102 finished with value: 0.03740884426050889 and parameters: {'model_type': 'mlp', 'hidden_dims': '[512, 64]', 'dropout': 0.4280431026356834, 'batch_norm': True, 'lr': 0.0004142510357256242, 'weight_decay': 2.702782771696838e-07, 'epochs': 164, 'loss': 'mse', 'optimizer': 'adam', 'graph_mode': 'off', 'use_snp_selection': False}. Best is trial 0 with value: 0.07830712685738.
[I 2025-12-05 15:37:01,596] Trial 103 finished with value: 0.04039852489910531 and parameters: {'model_type': 'mlp', 'hidden_dims': '[512, 64]', 'dropout': 0.10118635956706952, 'batch_norm': True, 'lr': 0.0007562398617591376, 'weight_decay': 6.185502584702137e-07, 'epochs': 174, 'loss': 'mse', 'optimizer': 'adam', 'graph_mode': 'off', 'use_snp_selection': False}. Best is trial 0 with value: 0.07830712685738.
[I 2025-12-05 15:37:03,015] Trial 104 finished with value: 0.06550603567033822 and parameters: {'model_type': 'mlp', 'hidden_dims': '[512, 64]', 'dropout': 0.14130695937080137, 'batch_norm': True, 'lr': 0.0009048436547230326, 'weight_decay': 3.452808358959133e-05, 'epochs': 139, 'loss': 'mse', 'optimizer': 'adam', 'graph_mode': 'off', 'use_snp_selection': False}. Best is trial 0 with value: 0.07830712685738.
[I 2025-12-05 15:37:04,453] Trial 105 finished with value: 0.04524821483798994 and parameters: {'model_type': 'mlp', 'hidden_dims': '[512, 64]', 'dropout': 0.15036421557678903, 'batch_norm': True, 'lr': 0.0008413056808591368, 'weight_decay': 3.208942975745599e-05, 'epochs': 142, 'loss': 'mse', 'optimizer': 'adam', 'graph_mode': 'off', 'use_snp_selection': False}. Best is trial 0 with value: 0.07830712685738.
[I 2025-12-05 15:37:05,637] Trial 106 finished with value: -0.01290363480554696 and parameters: {'model_type': 'mlp', 'hidden_dims': '[512, 64]', 'dropout': 0.14322997793752168, 'batch_norm': True, 'lr': 2.094680416644583e-06, 'weight_decay': 2.2326944809277167e-05, 'epochs': 93, 'loss': 'mae', 'optimizer': 'adam', 'graph_mode': 'off', 'use_snp_selection': False}. Best is trial 0 with value: 0.07830712685738.
[I 2025-12-05 15:37:06,875] Trial 107 finished with value: 0.044230819242127226 and parameters: {'model_type': 'mlp', 'hidden_dims': '[256, 128, 64]', 'dropout': 0.5259641222807426, 'batch_norm': True, 'lr': 0.0005207094832978645, 'weight_decay': 5.6190642058288944e-05, 'epochs': 117, 'loss': 'mse', 'optimizer': 'adam', 'graph_mode': 'off', 'use_snp_selection': True, 'num_snps': 14237}. Best is trial 0 with value: 0.07830712685738.
[I 2025-12-05 15:37:09,044] Trial 108 finished with value: 0.03980861647152387 and parameters: {'model_type': 'mlp', 'hidden_dims': '[512, 64]', 'dropout': 0.3365641583203377, 'batch_norm': True, 'lr': 6.160898925835488e-05, 'weight_decay': 4.003649043743362e-05, 'epochs': 320, 'loss': 'mse', 'optimizer': 'adam', 'graph_mode': 'off', 'use_snp_selection': False}. Best is trial 0 with value: 0.07830712685738.
[I 2025-12-05 15:37:09,817] Trial 109 finished with value: 0.05816231713916742 and parameters: {'model_type': 'mlp', 'hidden_dims': '[128, 64]', 'dropout': 0.16690264767209223, 'batch_norm': True, 'lr': 0.00043499483568822155, 'weight_decay': 1.2805846122084897e-06, 'epochs': 136, 'loss': 'mse', 'optimizer': 'adam', 'graph_mode': 'off', 'use_snp_selection': False}. Best is trial 0 with value: 0.07830712685738.
[I 2025-12-05 15:37:12,066] Trial 110 finished with value: 0.04412222584292967 and parameters: {'model_type': 'mlp', 'hidden_dims': '[512, 64]', 'dropout': 0.18191468563722782, 'batch_norm': False, 'lr': 0.00010032402397249047, 'weight_decay': 7.647522240707537e-05, 'epochs': 333, 'loss': 'mse', 'optimizer': 'adam', 'graph_mode': 'off', 'use_snp_selection': False}. Best is trial 0 with value: 0.07830712685738.
[I 2025-12-05 15:37:13,737] Trial 111 finished with value: 0.06344370535332874 and parameters: {'model_type': 'mlp', 'hidden_dims': '[512, 64]', 'dropout': 0.11008943520957573, 'batch_norm': True, 'lr': 0.0005556596706665559, 'weight_decay': 7.587397184956305e-07, 'epochs': 195, 'loss': 'mse', 'optimizer': 'adam', 'graph_mode': 'off', 'use_snp_selection': False}. Best is trial 0 with value: 0.07830712685738.
[I 2025-12-05 15:37:15,400] Trial 112 finished with value: 0.0498005998267287 and parameters: {'model_type': 'mlp', 'hidden_dims': '[512, 64]', 'dropout': 0.11057098921180239, 'batch_norm': True, 'lr': 0.000930867895116798, 'weight_decay': 5.524797919220627e-07, 'epochs': 197, 'loss': 'mse', 'optimizer': 'adam', 'graph_mode': 'off', 'use_snp_selection': False}. Best is trial 0 with value: 0.07830712685738.
[I 2025-12-05 15:37:17,456] Trial 113 finished with value: 0.052477058736544784 and parameters: {'model_type': 'mlp', 'hidden_dims': '[512, 64]', 'dropout': 0.1297820484609172, 'batch_norm': True, 'lr': 0.000669619491610546, 'weight_decay': 7.730554595043898e-07, 'epochs': 287, 'loss': 'mse', 'optimizer': 'adam', 'graph_mode': 'off', 'use_snp_selection': False}. Best is trial 0 with value: 0.07830712685738.
[I 2025-12-05 15:37:19,164] Trial 114 finished with value: 0.057077077112728164 and parameters: {'model_type': 'mlp', 'hidden_dims': '[512, 64]', 'dropout': 0.1130405676425712, 'batch_norm': True, 'lr': 0.0002762559014605103, 'weight_decay': 5.484594516739854e-05, 'epochs': 216, 'loss': 'mse', 'optimizer': 'adam', 'graph_mode': 'off', 'use_snp_selection': False}. Best is trial 0 with value: 0.07830712685738.
[I 2025-12-05 15:37:19,995] Trial 115 finished with value: 0.043885933401788035 and parameters: {'model_type': 'mlp', 'hidden_dims': '[128, 64]', 'dropout': 0.1424860594444421, 'batch_norm': True, 'lr': 7.45348014006139e-05, 'weight_decay': 0.00018295414210818065, 'epochs': 184, 'loss': 'mse', 'optimizer': 'adam', 'graph_mode': 'off', 'use_snp_selection': False}. Best is trial 0 with value: 0.07830712685738.
[I 2025-12-05 15:37:21,157] Trial 116 finished with value: 0.05871862067551804 and parameters: {'model_type': 'mlp', 'hidden_dims': '[256, 128]', 'dropout': 0.13190022779410407, 'batch_norm': True, 'lr': 0.00036798757799822373, 'weight_decay': 1.7301635769210887e-05, 'epochs': 193, 'loss': 'mse', 'optimizer': 'adam', 'graph_mode': 'off', 'use_snp_selection': False}. Best is trial 0 with value: 0.07830712685738.
[I 2025-12-05 15:37:23,939] Trial 117 finished with value: 0.04690972007317834 and parameters: {'model_type': 'mlp', 'hidden_dims': '[512, 128]', 'dropout': 0.12146108545671586, 'batch_norm': True, 'lr': 0.0007535276023734401, 'weight_decay': 1.461760194805486e-06, 'epochs': 239, 'loss': 'mae', 'optimizer': 'adam', 'graph_mode': 'off', 'use_snp_selection': True, 'num_snps': 41205}. Best is trial 0 with value: 0.07830712685738.
[I 2025-12-05 15:37:25,622] Trial 118 finished with value: 0.05806868542544023 and parameters: {'model_type': 'mlp', 'hidden_dims': '[512, 64]', 'dropout': 0.10128008567578574, 'batch_norm': True, 'lr': 0.0005663345716870181, 'weight_decay': 0.00031827709594397087, 'epochs': 200, 'loss': 'mse', 'optimizer': 'adam', 'graph_mode': 'off', 'use_snp_selection': False}. Best is trial 0 with value: 0.07830712685738.
[I 2025-12-05 15:37:26,476] Trial 119 finished with value: 0.03930747638546453 and parameters: {'model_type': 'mlp', 'hidden_dims': '[128, 64]', 'dropout': 0.15647655664342836, 'batch_norm': True, 'lr': 0.0008774478798595403, 'weight_decay': 6.133067020459705e-06, 'epochs': 160, 'loss': 'mse', 'optimizer': 'adam', 'graph_mode': 'off', 'use_snp_selection': False}. Best is trial 0 with value: 0.07830712685738.
[I 2025-12-05 15:37:27,923] Trial 120 finished with value: 0.0250258685159157 and parameters: {'model_type': 'mlp', 'hidden_dims': '[512, 64]', 'dropout': 0.20250699113561108, 'batch_norm': True, 'lr': 4.531558971066421e-06, 'weight_decay': 9.329024439422597e-07, 'epochs': 153, 'loss': 'mse', 'optimizer': 'adam', 'graph_mode': 'off', 'use_snp_selection': False}. Best is trial 0 with value: 0.07830712685738.
[I 2025-12-05 15:37:29,437] Trial 121 finished with value: 0.07699436056962788 and parameters: {'model_type': 'mlp', 'hidden_dims': '[512, 64]', 'dropout': 0.10950631887950295, 'batch_norm': True, 'lr': 0.0006531472640352727, 'weight_decay': 3.391588492948949e-07, 'epochs': 171, 'loss': 'mse', 'optimizer': 'adam', 'graph_mode': 'off', 'use_snp_selection': False}. Best is trial 0 with value: 0.07830712685738.
[I 2025-12-05 15:37:30,979] Trial 122 finished with value: 0.055814528763484056 and parameters: {'model_type': 'mlp', 'hidden_dims': '[512, 64]', 'dropout': 0.11043144728856473, 'batch_norm': True, 'lr': 0.0007516901739748036, 'weight_decay': 5.169822427634206e-07, 'epochs': 172, 'loss': 'mse', 'optimizer': 'adam', 'graph_mode': 'off', 'use_snp_selection': False}. Best is trial 0 with value: 0.07830712685738.
[I 2025-12-05 15:37:32,440] Trial 123 finished with value: 0.04341008778146946 and parameters: {'model_type': 'mlp', 'hidden_dims': '[512, 64]', 'dropout': 0.12086292009517592, 'batch_norm': True, 'lr': 0.0004649955628292458, 'weight_decay': 7.206550617299532e-07, 'epochs': 147, 'loss': 'mse', 'optimizer': 'adam', 'graph_mode': 'off', 'use_snp_selection': False}. Best is trial 0 with value: 0.07830712685738.
[I 2025-12-05 15:37:34,097] Trial 124 finished with value: 0.03965078412785861 and parameters: {'model_type': 'mlp', 'hidden_dims': '[512, 64]', 'dropout': 0.13705319936775942, 'batch_norm': True, 'lr': 0.0006541664791437238, 'weight_decay': 4.4277561980855376e-07, 'epochs': 190, 'loss': 'mse', 'optimizer': 'adam', 'graph_mode': 'off', 'use_snp_selection': False}. Best is trial 0 with value: 0.07830712685738.
[I 2025-12-05 15:37:36,404] Trial 125 finished with value: 0.04608610905992439 and parameters: {'model_type': 'mlp', 'hidden_dims': '[512, 64]', 'dropout': 0.10871106926897538, 'batch_norm': True, 'lr': 0.00031488325468456604, 'weight_decay': 1.169662893342512e-06, 'epochs': 343, 'loss': 'mse', 'optimizer': 'adam', 'graph_mode': 'off', 'use_snp_selection': False}. Best is trial 0 with value: 0.07830712685738.
[I 2025-12-05 15:37:37,559] Trial 126 finished with value: 0.05696510781426034 and parameters: {'model_type': 'mlp', 'hidden_dims': '[256, 128, 64]', 'dropout': 0.14359265449027875, 'batch_norm': True, 'lr': 0.0005142296423809414, 'weight_decay': 1.5814207716386964e-07, 'epochs': 181, 'loss': 'mse', 'optimizer': 'adam', 'graph_mode': 'off', 'use_snp_selection': False}. Best is trial 0 with value: 0.07830712685738.
[I 2025-12-05 15:37:39,982] Trial 127 finished with value: 0.035291947663728895 and parameters: {'model_type': 'mlp', 'hidden_dims': '[128, 64]', 'dropout': 0.2205794447110819, 'batch_norm': True, 'lr': 0.00037685593689329433, 'weight_decay': 1.1122677378593066e-07, 'epochs': 210, 'loss': 'mae', 'optimizer': 'adam', 'graph_mode': 'off', 'use_snp_selection': True, 'num_snps': 50905}. Best is trial 0 with value: 0.07830712685738.
[I 2025-12-05 15:37:42,284] Trial 128 finished with value: -0.015149628098298031 and parameters: {'model_type': 'mlp', 'hidden_dims': '[512, 64]', 'dropout': 0.12849396461293813, 'batch_norm': True, 'lr': 2.9747143155237328e-06, 'weight_decay': 2.4274274710824385e-07, 'epochs': 350, 'loss': 'mse', 'optimizer': 'adam', 'graph_mode': 'off', 'use_snp_selection': False}. Best is trial 0 with value: 0.07830712685738.
[I 2025-12-05 15:37:43,787] Trial 129 finished with value: 0.06560509624060452 and parameters: {'model_type': 'mlp', 'hidden_dims': '[512, 256]', 'dropout': 0.1738992679174854, 'batch_norm': True, 'lr': 0.0009919665338600939, 'weight_decay': 1.1061549701841202e-05, 'epochs': 168, 'loss': 'mse', 'optimizer': 'adam', 'graph_mode': 'off', 'use_snp_selection': False}. Best is trial 0 with value: 0.07830712685738.
