[I 2025-12-05 15:02:45,836] Trial 38 finished with value: 0.04316250197387908 and parameters: {'model_type': 'mlp', 'hidden_dims': '[512, 128]', 'dropout': 0.4213292169983287, 'batch_norm': False, 'lr': 7.021266950121049e-05, 'weight_decay': 7.142408889478725e-07, 'epochs': 162, 'loss': 'mae', 'optimizer': 'adam', 'graph_mode': 'off', 'use_snp_selection': False}. Best is trial 34 with value: 0.08422594760083942.
[I 2025-12-05 15:02:47,011] Trial 39 finished with value: 0.015692353379311536 and parameters: {'model_type': 'mlp', 'hidden_dims': '[256, 128]', 'dropout': 0.5996184529897317, 'batch_norm': True, 'lr': 2.693865489098271e-05, 'weight_decay': 1.4718775555476421e-05, 'epochs': 242, 'loss': 'mae', 'optimizer': 'adam', 'graph_mode': 'off', 'use_snp_selection': False}. Best is trial 34 with value: 0.08422594760083942.
[I 2025-12-05 15:02:48,900] Trial 40 finished with value: 0.021500481013770785 and parameters: {'model_type': 'mlp', 'hidden_dims': '[512, 64]', 'dropout': 0.47538252497217937, 'batch_norm': False, 'lr': 1.56896508808982e-05, 'weight_decay': 6.609413412746865e-06, 'epochs': 297, 'loss': 'mae', 'optimizer': 'adam', 'graph_mode': 'off', 'use_snp_selection': False}. Best is trial 34 with value: 0.08422594760083942.
[I 2025-12-05 15:02:50,649] Trial 41 finished with value: 0.025650361746739743 and parameters: {'model_type': 'mlp', 'hidden_dims': '[512, 128]', 'dropout': 0.5541728913220493, 'batch_norm': False, 'lr': 9.365798856759947e-06, 'weight_decay': 2.7137968942100262e-05, 'epochs': 263, 'loss': 'mae', 'optimizer': 'adam', 'graph_mode': 'off', 'use_snp_selection': False}. Best is trial 34 with value: 0.08422594760083942.
[I 2025-12-05 15:02:52,312] Trial 42 finished with value: 0.005177655051166028 and parameters: {'model_type': 'mlp', 'hidden_dims': '[512, 128]', 'dropout': 0.5101363962448249, 'batch_norm': False, 'lr': 6.406587122376995e-06, 'weight_decay': 3.138862426878311e-05, 'epochs': 239, 'loss': 'mae', 'optimizer': 'adam', 'graph_mode': 'off', 'use_snp_selection': False}. Best is trial 34 with value: 0.08422594760083942.
[I 2025-12-05 15:02:54,145] Trial 43 finished with value: 0.012615656300796653 and parameters: {'model_type': 'mlp', 'hidden_dims': '[512, 128]', 'dropout': 0.5534526603087795, 'batch_norm': False, 'lr': 2.7130532416278374e-06, 'weight_decay': 1.3452156995232769e-05, 'epochs': 282, 'loss': 'mae', 'optimizer': 'adam', 'graph_mode': 'off', 'use_snp_selection': False}. Best is trial 34 with value: 0.08422594760083942.
[I 2025-12-05 15:02:55,781] Trial 44 finished with value: 0.0027837711527107078 and parameters: {'model_type': 'mlp', 'hidden_dims': '[512, 128]', 'dropout': 0.44057225980390713, 'batch_norm': False, 'lr': 1.2222545723043004e-05, 'weight_decay': 3.1201082549471417e-06, 'epochs': 227, 'loss': 'mae', 'optimizer': 'adam', 'graph_mode': 'off', 'use_snp_selection': False}. Best is trial 34 with value: 0.08422594760083942.
[I 2025-12-05 15:02:57,267] Trial 45 finished with value: -0.025585986095235793 and parameters: {'model_type': 'mlp', 'hidden_dims': '[256, 128, 64]', 'dropout': 0.402704053182218, 'batch_norm': False, 'lr': 9.294615997933812e-06, 'weight_decay': 1.8592093938862576e-05, 'epochs': 249, 'loss': 'mae', 'optimizer': 'adam', 'graph_mode': 'off', 'use_snp_selection': True, 'num_snps': 22568}. Best is trial 34 with value: 0.08422594760083942.
[I 2025-12-05 15:02:59,341] Trial 46 finished with value: 0.0292916635918188 and parameters: {'model_type': 'mlp', 'hidden_dims': '[512, 256]', 'dropout': 0.5335565157495642, 'batch_norm': True, 'lr': 5.141172811679841e-06, 'weight_decay': 0.00043589239871133744, 'epochs': 329, 'loss': 'mae', 'optimizer': 'adam', 'graph_mode': 'off', 'use_snp_selection': False}. Best is trial 34 with value: 0.08422594760083942.
[I 2025-12-05 15:03:02,076] Trial 47 finished with value: -0.0027626507615348254 and parameters: {'model_type': 'mlp', 'hidden_dims': '[512, 128]', 'dropout': 0.4774339964902175, 'batch_norm': False, 'lr': 1.2957414676194042e-06, 'weight_decay': 0.00011355166485302445, 'epochs': 258, 'loss': 'mae', 'optimizer': 'adam', 'graph_mode': 'off', 'use_snp_selection': True, 'num_snps': 46439}. Best is trial 34 with value: 0.08422594760083942.
[I 2025-12-05 15:03:03,185] Trial 48 finished with value: 0.05382344470795365 and parameters: {'model_type': 'mlp', 'hidden_dims': '[256, 128]', 'dropout': 0.37636839019379087, 'batch_norm': False, 'lr': 2.1240232724652375e-05, 'weight_decay': 6.71602216840677e-06, 'epochs': 209, 'loss': 'mae', 'optimizer': 'adam', 'graph_mode': 'off', 'use_snp_selection': False}. Best is trial 34 with value: 0.08422594760083942.
[I 2025-12-05 15:03:04,301] Trial 49 finished with value: 0.03657090935929501 and parameters: {'model_type': 'mlp', 'hidden_dims': '[256, 128]', 'dropout': 0.3846785825370681, 'batch_norm': True, 'lr': 6.181767567296088e-05, 'weight_decay': 4.113187725025489e-06, 'epochs': 208, 'loss': 'mae', 'optimizer': 'adam', 'graph_mode': 'off', 'use_snp_selection': False}. Best is trial 34 with value: 0.08422594760083942.
[I 2025-12-05 15:03:05,336] Trial 50 finished with value: 0.027631773309794036 and parameters: {'model_type': 'mlp', 'hidden_dims': '[256, 128]', 'dropout': 0.43555293014146834, 'batch_norm': False, 'lr': 2.1871948164670026e-05, 'weight_decay': 1.882737047406791e-06, 'epochs': 191, 'loss': 'mae', 'optimizer': 'adam', 'graph_mode': 'off', 'use_snp_selection': False}. Best is trial 34 with value: 0.08422594760083942.
[I 2025-12-05 15:03:06,472] Trial 51 finished with value: 0.039732291845107036 and parameters: {'model_type': 'mlp', 'hidden_dims': '[256, 128]', 'dropout': 0.45942001506660113, 'batch_norm': False, 'lr': 3.1951169371437116e-05, 'weight_decay': 6.201904724341181e-06, 'epochs': 229, 'loss': 'mae', 'optimizer': 'adam', 'graph_mode': 'off', 'use_snp_selection': False}. Best is trial 34 with value: 0.08422594760083942.
[I 2025-12-05 15:03:07,567] Trial 52 finished with value: 0.031239288430697676 and parameters: {'model_type': 'mlp', 'hidden_dims': '[256, 128]', 'dropout': 0.3725736740435046, 'batch_norm': False, 'lr': 1.2059314304769415e-05, 'weight_decay': 1.835426167549151e-05, 'epochs': 217, 'loss': 'mae', 'optimizer': 'adam', 'graph_mode': 'off', 'use_snp_selection': False}. Best is trial 34 with value: 0.08422594760083942.
[I 2025-12-05 15:03:08,724] Trial 53 finished with value: 0.0072898120937976724 and parameters: {'model_type': 'mlp', 'hidden_dims': '[256, 128, 64]', 'dropout': 0.5825001262495509, 'batch_norm': False, 'lr': 1.8543829104362397e-05, 'weight_decay': 8.058349466281764e-07, 'epochs': 236, 'loss': 'mae', 'optimizer': 'adam', 'graph_mode': 'off', 'use_snp_selection': False}. Best is trial 34 with value: 0.08422594760083942.
[I 2025-12-05 15:03:10,530] Trial 54 finished with value: 0.0430476652161711 and parameters: {'model_type': 'mlp', 'hidden_dims': '[512, 64]', 'dropout': 0.4923704150842725, 'batch_norm': False, 'lr': 7.455806076040501e-06, 'weight_decay': 3.8625153546185705e-05, 'epochs': 269, 'loss': 'mse', 'optimizer': 'adam', 'graph_mode': 'off', 'use_snp_selection': False}. Best is trial 34 with value: 0.08422594760083942.
[I 2025-12-05 15:03:12,070] Trial 55 finished with value: 0.019141141346573277 and parameters: {'model_type': 'mlp', 'hidden_dims': '[512, 256]', 'dropout': 0.28635807307843913, 'batch_norm': False, 'lr': 4.70550142754323e-05, 'weight_decay': 6.9537928963148225e-06, 'epochs': 200, 'loss': 'mae', 'optimizer': 'adam', 'graph_mode': 'off', 'use_snp_selection': False}. Best is trial 34 with value: 0.08422594760083942.
[I 2025-12-05 15:03:13,552] Trial 56 finished with value: 0.015503358235335277 and parameters: {'model_type': 'mlp', 'hidden_dims': '[256, 128]', 'dropout': 0.5412506166658556, 'batch_norm': False, 'lr': 8.064983935561914e-05, 'weight_decay': 3.3654397765894374e-06, 'epochs': 252, 'loss': 'mae', 'optimizer': 'adam', 'graph_mode': 'off', 'use_snp_selection': True, 'num_snps': 23550}. Best is trial 34 with value: 0.08422594760083942.
[I 2025-12-05 15:03:14,358] Trial 57 finished with value: 0.03782423059090142 and parameters: {'model_type': 'mlp', 'hidden_dims': '[128, 64]', 'dropout': 0.451483549509923, 'batch_norm': True, 'lr': 2.7155517197629993e-05, 'weight_decay': 7.489652734859584e-05, 'epochs': 150, 'loss': 'mae', 'optimizer': 'adam', 'graph_mode': 'off', 'use_snp_selection': False}. Best is trial 34 with value: 0.08422594760083942.
[I 2025-12-05 15:03:15,580] Trial 58 finished with value: 0.007361594470452327 and parameters: {'model_type': 'mlp', 'hidden_dims': '[256, 128]', 'dropout': 0.417832421714174, 'batch_norm': False, 'lr': 1.1268267359954047e-05, 'weight_decay': 9.95975450419772e-06, 'epochs': 282, 'loss': 'mse', 'optimizer': 'adam', 'graph_mode': 'off', 'use_snp_selection': False}. Best is trial 34 with value: 0.08422594760083942.
[I 2025-12-05 15:03:17,540] Trial 59 finished with value: 0.027320671266860188 and parameters: {'model_type': 'mlp', 'hidden_dims': '[512, 128]', 'dropout': 0.21877823463548735, 'batch_norm': False, 'lr': 1.55998744511564e-05, 'weight_decay': 1.590083672834199e-05, 'epochs': 315, 'loss': 'mae', 'optimizer': 'adam', 'graph_mode': 'off', 'use_snp_selection': False}. Best is trial 34 with value: 0.08422594760083942.
[I 2025-12-05 15:03:19,041] Trial 60 finished with value: -0.01497556023091586 and parameters: {'model_type': 'mlp', 'hidden_dims': '[512, 256]', 'dropout': 0.5288789350485307, 'batch_norm': True, 'lr': 3.981906930783032e-05, 'weight_decay': 2.259408276021383e-05, 'epochs': 184, 'loss': 'mae', 'optimizer': 'adam', 'graph_mode': 'off', 'use_snp_selection': False}. Best is trial 34 with value: 0.08422594760083942.
[I 2025-12-05 15:03:19,753] Trial 61 finished with value: 0.011197608942114988 and parameters: {'model_type': 'mlp', 'hidden_dims': '[128, 64]', 'dropout': 0.3770565738331859, 'batch_norm': False, 'lr': 1.7396053831439358e-05, 'weight_decay': 1.8788313640805598e-07, 'epochs': 105, 'loss': 'mse', 'optimizer': 'adam', 'graph_mode': 'off', 'use_snp_selection': False}. Best is trial 34 with value: 0.08422594760083942.
[I 2025-12-05 15:03:20,528] Trial 62 finished with value: -0.012746261290491013 and parameters: {'model_type': 'mlp', 'hidden_dims': '[128, 64]', 'dropout': 0.3244316591602214, 'batch_norm': False, 'lr': 2.1564333139250827e-05, 'weight_decay': 3.2672873995214433e-07, 'epochs': 137, 'loss': 'mse', 'optimizer': 'adam', 'graph_mode': 'off', 'use_snp_selection': False}. Best is trial 34 with value: 0.08422594760083942.
[I 2025-12-05 15:03:21,183] Trial 63 finished with value: 0.02202283852584984 and parameters: {'model_type': 'mlp', 'hidden_dims': '[128, 64]', 'dropout': 0.3504472264618317, 'batch_norm': False, 'lr': 2.9665462422641226e-05, 'weight_decay': 6.0727940577590785e-05, 'epochs': 53, 'loss': 'mse', 'optimizer': 'adam', 'graph_mode': 'off', 'use_snp_selection': False}. Best is trial 34 with value: 0.08422594760083942.
[I 2025-12-05 15:03:22,031] Trial 64 finished with value: 0.06935822839094216 and parameters: {'model_type': 'mlp', 'hidden_dims': '[128, 64]', 'dropout': 0.3031036844297457, 'batch_norm': False, 'lr': 8.467182122276682e-06, 'weight_decay': 9.827903962208463e-07, 'epochs': 226, 'loss': 'mse', 'optimizer': 'adam', 'graph_mode': 'off', 'use_snp_selection': False}. Best is trial 34 with value: 0.08422594760083942.
[I 2025-12-05 15:03:22,923] Trial 65 finished with value: 0.03948770886421957 and parameters: {'model_type': 'mlp', 'hidden_dims': '[128, 64]', 'dropout': 0.30555586867570905, 'batch_norm': False, 'lr': 8.833653223979594e-06, 'weight_decay': 4.97873714569163e-07, 'epochs': 232, 'loss': 'mse', 'optimizer': 'adam', 'graph_mode': 'off', 'use_snp_selection': False}. Best is trial 34 with value: 0.08422594760083942.
[I 2025-12-05 15:03:24,047] Trial 66 finished with value: 0.03205573159199579 and parameters: {'model_type': 'mlp', 'hidden_dims': '[256, 128]', 'dropout': 0.5057656729688047, 'batch_norm': False, 'lr': 5.9887832580248445e-06, 'weight_decay': 2.018802886950068e-06, 'epochs': 217, 'loss': 'mse', 'optimizer': 'adam', 'graph_mode': 'off', 'use_snp_selection': False}. Best is trial 34 with value: 0.08422594760083942.
[I 2025-12-05 15:03:25,746] Trial 67 finished with value: 0.021227262744989605 and parameters: {'model_type': 'mlp', 'hidden_dims': '[512, 128]', 'dropout': 0.2735285758277016, 'batch_norm': False, 'lr': 0.0003107013556684162, 'weight_decay': 1.2692852711131523e-06, 'epochs': 246, 'loss': 'mae', 'optimizer': 'adam', 'graph_mode': 'off', 'use_snp_selection': False}. Best is trial 34 with value: 0.08422594760083942.
[I 2025-12-05 15:03:28,460] Trial 68 finished with value: 0.0352789502685536 and parameters: {'model_type': 'mlp', 'hidden_dims': '[512, 256]', 'dropout': 0.5722389254209452, 'batch_norm': False, 'lr': 1.3843101353525546e-05, 'weight_decay': 1.0139024444524032e-06, 'epochs': 200, 'loss': 'mae', 'optimizer': 'adam', 'graph_mode': 'off', 'use_snp_selection': True, 'num_snps': 48932}. Best is trial 34 with value: 0.08422594760083942.
[I 2025-12-05 15:03:29,713] Trial 69 finished with value: 0.009710844496637554 and parameters: {'model_type': 'mlp', 'hidden_dims': '[256, 128]', 'dropout': 0.4656564611191932, 'batch_norm': True, 'lr': 1.0591294706045704e-05, 'weight_decay': 4.488549976235906e-06, 'epochs': 270, 'loss': 'mse', 'optimizer': 'adam', 'graph_mode': 'off', 'use_snp_selection': False}. Best is trial 34 with value: 0.08422594760083942.
[I 2025-12-05 15:03:30,906] Trial 70 finished with value: -0.00748575898196362 and parameters: {'model_type': 'mlp', 'hidden_dims': '[256, 128, 64]', 'dropout': 0.4000211795448997, 'batch_norm': False, 'lr': 7.104646489366721e-06, 'weight_decay': 1.2046691719596664e-05, 'epochs': 261, 'loss': 'mae', 'optimizer': 'adam', 'graph_mode': 'off', 'use_snp_selection': False}. Best is trial 34 with value: 0.08422594760083942.
[I 2025-12-05 15:03:31,786] Trial 71 finished with value: 0.06393261989381213 and parameters: {'model_type': 'mlp', 'hidden_dims': '[128, 64]', 'dropout': 0.2878003991915263, 'batch_norm': False, 'lr': 2.035258708076679e-05, 'weight_decay': 1.9077792808914706e-07, 'epochs': 219, 'loss': 'mse', 'optimizer': 'adam', 'graph_mode': 'off', 'use_snp_selection': False}. Best is trial 34 with value: 0.08422594760083942.
[I 2025-12-05 15:03:32,637] Trial 72 finished with value: 0.07342546594863111 and parameters: {'model_type': 'mlp', 'hidden_dims': '[128, 64]', 'dropout': 0.23018362270241272, 'batch_norm': False, 'lr': 2.2211219689968828e-05, 'weight_decay': 1.9261225002569756e-07, 'epochs': 223, 'loss': 'mse', 'optimizer': 'adam', 'graph_mode': 'off', 'use_snp_selection': False}. Best is trial 34 with value: 0.08422594760083942.
[I 2025-12-05 15:03:33,477] Trial 73 finished with value: 0.06622281468928613 and parameters: {'model_type': 'mlp', 'hidden_dims': '[128, 64]', 'dropout': 0.2426666435801396, 'batch_norm': False, 'lr': 5.253168679265675e-05, 'weight_decay': 1.7957288640465175e-07, 'epochs': 220, 'loss': 'mse', 'optimizer': 'adam', 'graph_mode': 'off', 'use_snp_selection': False}. Best is trial 34 with value: 0.08422594760083942.
[I 2025-12-05 15:03:34,305] Trial 74 finished with value: 0.02032915375504317 and parameters: {'model_type': 'mlp', 'hidden_dims': '[128, 64]', 'dropout': 0.23951388487057157, 'batch_norm': False, 'lr': 0.0001106691577700929, 'weight_decay': 2.2779696658456642e-07, 'epochs': 211, 'loss': 'mse', 'optimizer': 'adam', 'graph_mode': 'off', 'use_snp_selection': False}. Best is trial 34 with value: 0.08422594760083942.
[I 2025-12-05 15:03:35,147] Trial 75 finished with value: 0.0009472148904303208 and parameters: {'model_type': 'mlp', 'hidden_dims': '[128, 64]', 'dropout': 0.21311383362936245, 'batch_norm': False, 'lr': 5.250542931339706e-05, 'weight_decay': 1.1711785675619274e-07, 'epochs': 225, 'loss': 'mse', 'optimizer': 'adam', 'graph_mode': 'off', 'use_snp_selection': False}. Best is trial 34 with value: 0.08422594760083942.
[I 2025-12-05 15:03:35,962] Trial 76 finished with value: 0.05688776209451255 and parameters: {'model_type': 'mlp', 'hidden_dims': '[128, 64]', 'dropout': 0.2460878202173012, 'batch_norm': False, 'lr': 1.0174140506253665e-06, 'weight_decay': 4.7217357495247e-07, 'epochs': 169, 'loss': 'mse', 'optimizer': 'adam', 'graph_mode': 'off', 'use_snp_selection': False}. Best is trial 34 with value: 0.08422594760083942.
[I 2025-12-05 15:03:36,751] Trial 77 finished with value: 0.0028930392775152 and parameters: {'model_type': 'mlp', 'hidden_dims': '[128, 64]', 'dropout': 0.1712864682218297, 'batch_norm': False, 'lr': 1.7414280928738312e-06, 'weight_decay': 4.5924134352494955e-07, 'epochs': 160, 'loss': 'mse', 'optimizer': 'adam', 'graph_mode': 'off', 'use_snp_selection': False}. Best is trial 34 with value: 0.08422594760083942.
[I 2025-12-05 15:03:37,541] Trial 78 finished with value: 0.0445867826429687 and parameters: {'model_type': 'mlp', 'hidden_dims': '[128, 64]', 'dropout': 0.23827654580309995, 'batch_norm': False, 'lr': 8.6209852184322e-05, 'weight_decay': 2.4706531484657015e-07, 'epochs': 174, 'loss': 'mse', 'optimizer': 'adam', 'graph_mode': 'off', 'use_snp_selection': False}. Best is trial 34 with value: 0.08422594760083942.
[I 2025-12-05 15:03:38,358] Trial 79 finished with value: 0.027734671278819234 and parameters: {'model_type': 'mlp', 'hidden_dims': '[128, 64]', 'dropout': 0.28592362690331796, 'batch_norm': True, 'lr': 3.3495861692361965e-05, 'weight_decay': 1.505899550347448e-07, 'epochs': 165, 'loss': 'mse', 'optimizer': 'adam', 'graph_mode': 'off', 'use_snp_selection': False}. Best is trial 34 with value: 0.08422594760083942.
[I 2025-12-05 15:03:39,176] Trial 80 finished with value: 0.028280935887376544 and parameters: {'model_type': 'mlp', 'hidden_dims': '[128, 64]', 'dropout': 0.18255513606452067, 'batch_norm': False, 'lr': 0.0001586413094343657, 'weight_decay': 3.5567357465491873e-07, 'epochs': 199, 'loss': 'mse', 'optimizer': 'adam', 'graph_mode': 'off', 'use_snp_selection': False}. Best is trial 34 with value: 0.08422594760083942.
[I 2025-12-05 15:03:40,062] Trial 81 finished with value: 0.025357063004534726 and parameters: {'model_type': 'mlp', 'hidden_dims': '[128, 64]', 'dropout': 0.254149992415289, 'batch_norm': False, 'lr': 2.4885226638427487e-05, 'weight_decay': 5.504624279719909e-07, 'epochs': 237, 'loss': 'mse', 'optimizer': 'adam', 'graph_mode': 'off', 'use_snp_selection': False}. Best is trial 34 with value: 0.08422594760083942.
[I 2025-12-05 15:03:40,888] Trial 82 finished with value: 0.0035698854040872555 and parameters: {'model_type': 'mlp', 'hidden_dims': '[128, 64]', 'dropout': 0.218895120939307, 'batch_norm': False, 'lr': 1.0239105169957832e-06, 'weight_decay': 1.0088865240912821e-07, 'epochs': 181, 'loss': 'mse', 'optimizer': 'adam', 'graph_mode': 'off', 'use_snp_selection': False}. Best is trial 34 with value: 0.08422594760083942.
[I 2025-12-05 15:03:41,722] Trial 83 finished with value: 0.04856887970818172 and parameters: {'model_type': 'mlp', 'hidden_dims': '[128, 64]', 'dropout': 0.29110377415737004, 'batch_norm': False, 'lr': 1.979697037997553e-05, 'weight_decay': 2.594808401796182e-07, 'epochs': 215, 'loss': 'mse', 'optimizer': 'adam', 'graph_mode': 'off', 'use_snp_selection': False}. Best is trial 34 with value: 0.08422594760083942.
[I 2025-12-05 15:03:42,529] Trial 84 finished with value: 0.05804270817933426 and parameters: {'model_type': 'mlp', 'hidden_dims': '[128, 64]', 'dropout': 0.13180428381038417, 'batch_norm': False, 'lr': 5.631489418887433e-05, 'weight_decay': 1.5877559855975854e-07, 'epochs': 193, 'loss': 'mse', 'optimizer': 'adam', 'graph_mode': 'off', 'use_snp_selection': False}. Best is trial 34 with value: 0.08422594760083942.
[I 2025-12-05 15:03:43,339] Trial 85 finished with value: 0.0431867917850641 and parameters: {'model_type': 'mlp', 'hidden_dims': '[128, 64]', 'dropout': 0.10516222028736455, 'batch_norm': False, 'lr': 5.808004757851874e-05, 'weight_decay': 1.5835516627565876e-07, 'epochs': 192, 'loss': 'mse', 'optimizer': 'adam', 'graph_mode': 'off', 'use_snp_selection': False}. Best is trial 34 with value: 0.08422594760083942.
[I 2025-12-05 15:03:44,196] Trial 86 finished with value: 0.057138350817647926 and parameters: {'model_type': 'mlp', 'hidden_dims': '[128, 64]', 'dropout': 0.15658351525938713, 'batch_norm': False, 'lr': 6.44297193628523e-05, 'weight_decay': 4.1244886960039166e-07, 'epochs': 208, 'loss': 'mse', 'optimizer': 'adam', 'graph_mode': 'off', 'use_snp_selection': False}. Best is trial 34 with value: 0.08422594760083942.
[I 2025-12-05 15:03:46,019] Trial 87 finished with value: 0.05424903767091221 and parameters: {'model_type': 'mlp', 'hidden_dims': '[128, 64]', 'dropout': 0.1422051568687515, 'batch_norm': False, 'lr': 7.353638794069112e-05, 'weight_decay': 1.9425886028833998e-07, 'epochs': 169, 'loss': 'mse', 'optimizer': 'adam', 'graph_mode': 'off', 'use_snp_selection': True, 'num_snps': 38258}. Best is trial 34 with value: 0.08422594760083942.
[I 2025-12-05 15:03:46,893] Trial 88 finished with value: 0.03694426704553603 and parameters: {'model_type': 'mlp', 'hidden_dims': '[128, 64]', 'dropout': 0.1263411475418039, 'batch_norm': True, 'lr': 0.00010872886091946478, 'weight_decay': 3.055765048040062e-07, 'epochs': 205, 'loss': 'mse', 'optimizer': 'adam', 'graph_mode': 'off', 'use_snp_selection': False}. Best is trial 34 with value: 0.08422594760083942.
[I 2025-12-05 15:03:47,698] Trial 89 finished with value: 0.0165104101057982 and parameters: {'model_type': 'mlp', 'hidden_dims': '[128, 64]', 'dropout': 0.19818497875811752, 'batch_norm': False, 'lr': 0.00013249029777754232, 'weight_decay': 4.222472797568304e-07, 'epochs': 153, 'loss': 'mse', 'optimizer': 'adam', 'graph_mode': 'off', 'use_snp_selection': False}. Best is trial 34 with value: 0.08422594760083942.
