[I 2025-12-05 15:58:41,766] Trial 53 finished with value: 0.10031634786942097 and parameters: {'model_type': 'mlp', 'hidden_dims': '[512, 256]', 'dropout': 0.10046294171831734, 'batch_norm': True, 'lr': 0.00014934530843961863, 'weight_decay': 0.0003211508695921364, 'epochs': 315, 'loss': 'mae', 'optimizer': 'adam', 'graph_mode': 'off', 'use_snp_selection': False}. Best is trial 34 with value: 0.11728138395587136.
[I 2025-12-05 15:58:43,815] Trial 54 finished with value: 0.10267397334615817 and parameters: {'model_type': 'mlp', 'hidden_dims': '[512, 256]', 'dropout': 0.14328598650377114, 'batch_norm': True, 'lr': 0.000686102795962589, 'weight_decay': 0.0009493510198610651, 'epochs': 335, 'loss': 'mae', 'optimizer': 'adam', 'graph_mode': 'off', 'use_snp_selection': False}. Best is trial 34 with value: 0.11728138395587136.
[I 2025-12-05 15:58:45,677] Trial 55 finished with value: 0.08332193496426596 and parameters: {'model_type': 'mlp', 'hidden_dims': '[512, 256]', 'dropout': 0.15917829119012514, 'batch_norm': True, 'lr': 0.00043150299119878603, 'weight_decay': 0.0006160968159975823, 'epochs': 290, 'loss': 'mae', 'optimizer': 'adam', 'graph_mode': 'off', 'use_snp_selection': False}. Best is trial 34 with value: 0.11728138395587136.
[I 2025-12-05 15:58:47,578] Trial 56 finished with value: 0.09341837246573856 and parameters: {'model_type': 'mlp', 'hidden_dims': '[512, 256]', 'dropout': 0.3761399747365586, 'batch_norm': False, 'lr': 0.00019847830805295904, 'weight_decay': 8.029041165149096e-05, 'epochs': 306, 'loss': 'mae', 'optimizer': 'adam', 'graph_mode': 'off', 'use_snp_selection': False}. Best is trial 34 with value: 0.11728138395587136.
[I 2025-12-05 15:58:48,825] Trial 57 finished with value: 0.06277515732212646 and parameters: {'model_type': 'mlp', 'hidden_dims': '[256, 128, 64]', 'dropout': 0.17624625613085312, 'batch_norm': True, 'lr': 5.88401626897747e-05, 'weight_decay': 0.00029939491090850273, 'epochs': 271, 'loss': 'mae', 'optimizer': 'adam', 'graph_mode': 'off', 'use_snp_selection': False}. Best is trial 34 with value: 0.11728138395587136.
[I 2025-12-05 15:58:50,541] Trial 58 finished with value: 0.11020063929381968 and parameters: {'model_type': 'mlp', 'hidden_dims': '[512, 128]', 'dropout': 0.20660483606825308, 'batch_norm': True, 'lr': 0.0003116535050002055, 'weight_decay': 6.032697685998128e-06, 'epochs': 244, 'loss': 'mae', 'optimizer': 'adam', 'graph_mode': 'off', 'use_snp_selection': False}. Best is trial 34 with value: 0.11728138395587136.
[I 2025-12-05 15:58:52,253] Trial 59 finished with value: 0.02208961922751042 and parameters: {'model_type': 'mlp', 'hidden_dims': '[512, 128]', 'dropout': 0.2782729290549593, 'batch_norm': True, 'lr': 7.2377871999429165e-06, 'weight_decay': 2.725663311561382e-06, 'epochs': 242, 'loss': 'mae', 'optimizer': 'adam', 'graph_mode': 'off', 'use_snp_selection': False}. Best is trial 34 with value: 0.11728138395587136.
[I 2025-12-05 15:58:53,837] Trial 60 finished with value: 0.10581569552582995 and parameters: {'model_type': 'mlp', 'hidden_dims': '[512, 128]', 'dropout': 0.22406894091658985, 'batch_norm': True, 'lr': 0.00032103498889930895, 'weight_decay': 5.6945802799954905e-06, 'epochs': 210, 'loss': 'mae', 'optimizer': 'adam', 'graph_mode': 'off', 'use_snp_selection': False}. Best is trial 34 with value: 0.11728138395587136.
[I 2025-12-05 15:58:55,504] Trial 61 finished with value: 0.08453682790626786 and parameters: {'model_type': 'mlp', 'hidden_dims': '[512, 128]', 'dropout': 0.25679902487556683, 'batch_norm': True, 'lr': 0.0002889705246374642, 'weight_decay': 1.304085961481598e-05, 'epochs': 226, 'loss': 'mae', 'optimizer': 'adam', 'graph_mode': 'off', 'use_snp_selection': False}. Best is trial 34 with value: 0.11728138395587136.
[I 2025-12-05 15:58:57,437] Trial 62 finished with value: 0.11382064628444533 and parameters: {'model_type': 'mlp', 'hidden_dims': '[512, 128]', 'dropout': 0.20227185003813067, 'batch_norm': True, 'lr': 9.859827460491004e-05, 'weight_decay': 4.861501900332416e-06, 'epochs': 296, 'loss': 'mae', 'optimizer': 'adam', 'graph_mode': 'off', 'use_snp_selection': False}. Best is trial 34 with value: 0.11728138395587136.
[I 2025-12-05 15:58:59,340] Trial 63 finished with value: 0.10132555436654452 and parameters: {'model_type': 'mlp', 'hidden_dims': '[512, 128]', 'dropout': 0.20317550652602687, 'batch_norm': True, 'lr': 8.967791858372548e-05, 'weight_decay': 3.924967203715783e-06, 'epochs': 292, 'loss': 'mae', 'optimizer': 'adam', 'graph_mode': 'off', 'use_snp_selection': False}. Best is trial 34 with value: 0.11728138395587136.
[I 2025-12-05 15:59:01,296] Trial 64 finished with value: 0.09125723389641721 and parameters: {'model_type': 'mlp', 'hidden_dims': '[512, 128]', 'dropout': 0.20347953217007292, 'batch_norm': True, 'lr': 0.0008012431589750222, 'weight_decay': 7.091374596446026e-06, 'epochs': 300, 'loss': 'mae', 'optimizer': 'adam', 'graph_mode': 'off', 'use_snp_selection': False}. Best is trial 34 with value: 0.11728138395587136.
[I 2025-12-05 15:59:03,304] Trial 65 finished with value: 0.1004151851563093 and parameters: {'model_type': 'mlp', 'hidden_dims': '[512, 128]', 'dropout': 0.1782897924477682, 'batch_norm': True, 'lr': 0.0004996368735846737, 'weight_decay': 1.7771059850715085e-06, 'epochs': 317, 'loss': 'mae', 'optimizer': 'adam', 'graph_mode': 'off', 'use_snp_selection': False}. Best is trial 34 with value: 0.11728138395587136.
[I 2025-12-05 15:59:04,891] Trial 66 finished with value: 0.09074779461804927 and parameters: {'model_type': 'mlp', 'hidden_dims': '[512, 128]', 'dropout': 0.221548345278324, 'batch_norm': True, 'lr': 0.0001210030438742657, 'weight_decay': 2.2759813927363418e-05, 'epochs': 245, 'loss': 'mae', 'optimizer': 'adam', 'graph_mode': 'off', 'use_snp_selection': True, 'num_snps': 22881}. Best is trial 34 with value: 0.11728138395587136.
[I 2025-12-05 15:59:06,734] Trial 67 finished with value: -0.027631887053183608 and parameters: {'model_type': 'mlp', 'hidden_dims': '[512, 128]', 'dropout': 0.26402187884003986, 'batch_norm': True, 'lr': 1.038788092140181e-06, 'weight_decay': 3.5781454543719275e-06, 'epochs': 273, 'loss': 'mse', 'optimizer': 'adam', 'graph_mode': 'off', 'use_snp_selection': False}. Best is trial 34 with value: 0.11728138395587136.
[I 2025-12-05 15:59:08,193] Trial 68 finished with value: 0.07628955772719491 and parameters: {'model_type': 'mlp', 'hidden_dims': '[512, 64]', 'dropout': 0.4454920450694526, 'batch_norm': False, 'lr': 0.00021204958667766371, 'weight_decay': 2.1211930885607206e-06, 'epochs': 180, 'loss': 'mae', 'optimizer': 'adam', 'graph_mode': 'off', 'use_snp_selection': False}. Best is trial 34 with value: 0.11728138395587136.
[I 2025-12-05 15:59:10,177] Trial 69 finished with value: 0.09219871846811345 and parameters: {'model_type': 'mlp', 'hidden_dims': '[512, 128]', 'dropout': 0.5614711718709352, 'batch_norm': True, 'lr': 0.00035037656314219966, 'weight_decay': 1.0819860331532863e-06, 'epochs': 314, 'loss': 'mae', 'optimizer': 'adam', 'graph_mode': 'off', 'use_snp_selection': False}. Best is trial 34 with value: 0.11728138395587136.
[I 2025-12-05 15:59:10,981] Trial 70 finished with value: 0.05056245834606511 and parameters: {'model_type': 'mlp', 'hidden_dims': '[128, 64]', 'dropout': 0.29655463283537775, 'batch_norm': True, 'lr': 0.00010009712778941605, 'weight_decay': 1.4205918058135857e-05, 'epochs': 154, 'loss': 'mae', 'optimizer': 'adam', 'graph_mode': 'off', 'use_snp_selection': False}. Best is trial 34 with value: 0.11728138395587136.
[I 2025-12-05 15:59:13,042] Trial 71 finished with value: 0.11598763387227956 and parameters: {'model_type': 'mlp', 'hidden_dims': '[512, 256]', 'dropout': 0.13281152695692855, 'batch_norm': True, 'lr': 0.00015685331024729808, 'weight_decay': 7.201316265182264e-06, 'epochs': 328, 'loss': 'mae', 'optimizer': 'adam', 'graph_mode': 'off', 'use_snp_selection': False}. Best is trial 34 with value: 0.11728138395587136.
[I 2025-12-05 15:59:15,152] Trial 72 finished with value: 0.0861091038235144 and parameters: {'model_type': 'mlp', 'hidden_dims': '[512, 256]', 'dropout': 0.15618422465616522, 'batch_norm': True, 'lr': 0.00013872836062128546, 'weight_decay': 6.769919065194118e-06, 'epochs': 343, 'loss': 'mae', 'optimizer': 'adam', 'graph_mode': 'off', 'use_snp_selection': False}. Best is trial 34 with value: 0.11728138395587136.
[I 2025-12-05 15:59:16,201] Trial 73 finished with value: 0.12343974487497228 and parameters: {'model_type': 'mlp', 'hidden_dims': '[256, 128]', 'dropout': 0.13470806796341567, 'batch_norm': True, 'lr': 0.0002633300826215563, 'weight_decay': 4.088823119233207e-06, 'epochs': 198, 'loss': 'mae', 'optimizer': 'adam', 'graph_mode': 'off', 'use_snp_selection': False}. Best is trial 73 with value: 0.12343974487497228.
[I 2025-12-05 15:59:17,261] Trial 74 finished with value: 0.06710841923855088 and parameters: {'model_type': 'mlp', 'hidden_dims': '[256, 128]', 'dropout': 0.13592755736960577, 'batch_norm': True, 'lr': 4.418794453805814e-05, 'weight_decay': 4.157985924221069e-06, 'epochs': 204, 'loss': 'mae', 'optimizer': 'adam', 'graph_mode': 'off', 'use_snp_selection': False}. Best is trial 73 with value: 0.12343974487497228.
[I 2025-12-05 15:59:18,349] Trial 75 finished with value: 0.09095514118645603 and parameters: {'model_type': 'mlp', 'hidden_dims': '[256, 128]', 'dropout': 0.13576634674918267, 'batch_norm': True, 'lr': 0.00026024719543920835, 'weight_decay': 2.5178876604542542e-06, 'epochs': 215, 'loss': 'mae', 'optimizer': 'adam', 'graph_mode': 'off', 'use_snp_selection': False}. Best is trial 73 with value: 0.12343974487497228.
[I 2025-12-05 15:59:19,394] Trial 76 finished with value: 0.09546261825213449 and parameters: {'model_type': 'mlp', 'hidden_dims': '[256, 128]', 'dropout': 0.11619327863917311, 'batch_norm': True, 'lr': 0.0002023447576567904, 'weight_decay': 8.531796864222006e-06, 'epochs': 192, 'loss': 'mae', 'optimizer': 'adam', 'graph_mode': 'off', 'use_snp_selection': False}. Best is trial 73 with value: 0.12343974487497228.
[I 2025-12-05 15:59:20,401] Trial 77 finished with value: 0.09739248106549368 and parameters: {'model_type': 'mlp', 'hidden_dims': '[256, 128]', 'dropout': 0.18301269108184198, 'batch_norm': True, 'lr': 0.00014167810380758854, 'weight_decay': 2.934504985030709e-07, 'epochs': 170, 'loss': 'mae', 'optimizer': 'adam', 'graph_mode': 'off', 'use_snp_selection': False}. Best is trial 73 with value: 0.12343974487497228.
[I 2025-12-05 15:59:21,281] Trial 78 finished with value: 0.020034292999642465 and parameters: {'model_type': 'mlp', 'hidden_dims': '[512, 128]', 'dropout': 0.19726358146077805, 'batch_norm': True, 'lr': 7.952393128729671e-05, 'weight_decay': 4.654747199050411e-06, 'epochs': 196, 'loss': 'mse', 'optimizer': 'adam', 'graph_mode': 'off', 'use_snp_selection': True, 'num_snps': 2246}. Best is trial 73 with value: 0.12343974487497228.
[I 2025-12-05 15:59:22,419] Trial 79 finished with value: 0.12010008063633897 and parameters: {'model_type': 'mlp', 'hidden_dims': '[256, 128, 64]', 'dropout': 0.15057910692013943, 'batch_norm': True, 'lr': 0.000441226751236085, 'weight_decay': 3.3148590870330056e-06, 'epochs': 230, 'loss': 'mae', 'optimizer': 'adam', 'graph_mode': 'off', 'use_snp_selection': False}. Best is trial 73 with value: 0.12343974487497228.
[I 2025-12-05 15:59:23,585] Trial 80 finished with value: 0.07707019860277994 and parameters: {'model_type': 'mlp', 'hidden_dims': '[256, 128, 64]', 'dropout': 0.15034564440612347, 'batch_norm': True, 'lr': 6.792894880434349e-05, 'weight_decay': 1.4112073201456454e-06, 'epochs': 234, 'loss': 'mae', 'optimizer': 'adam', 'graph_mode': 'off', 'use_snp_selection': False}. Best is trial 73 with value: 0.12343974487497228.
[I 2025-12-05 15:59:24,723] Trial 81 finished with value: 0.08700071558004553 and parameters: {'model_type': 'mlp', 'hidden_dims': '[256, 128, 64]', 'dropout': 0.16752088792714595, 'batch_norm': True, 'lr': 0.00043952599256090507, 'weight_decay': 6.195287816699643e-06, 'epochs': 220, 'loss': 'mae', 'optimizer': 'adam', 'graph_mode': 'off', 'use_snp_selection': False}. Best is trial 73 with value: 0.12343974487497228.
[I 2025-12-05 15:59:25,936] Trial 82 finished with value: 0.0946387691896314 and parameters: {'model_type': 'mlp', 'hidden_dims': '[256, 128, 64]', 'dropout': 0.13257930902355974, 'batch_norm': True, 'lr': 0.0005598868589618899, 'weight_decay': 3.28150640772209e-06, 'epochs': 261, 'loss': 'mae', 'optimizer': 'adam', 'graph_mode': 'off', 'use_snp_selection': False}. Best is trial 73 with value: 0.12343974487497228.
[I 2025-12-05 15:59:27,066] Trial 83 finished with value: 0.08677572542929007 and parameters: {'model_type': 'mlp', 'hidden_dims': '[256, 128, 64]', 'dropout': 0.12196392929787317, 'batch_norm': True, 'lr': 0.00032952164953198103, 'weight_decay': 5.005684889253738e-06, 'epochs': 227, 'loss': 'mae', 'optimizer': 'adam', 'graph_mode': 'off', 'use_snp_selection': False}. Best is trial 73 with value: 0.12343974487497228.
[I 2025-12-05 15:59:28,085] Trial 84 finished with value: 0.09232484363883192 and parameters: {'model_type': 'mlp', 'hidden_dims': '[256, 128]', 'dropout': 0.1471705879620595, 'batch_norm': True, 'lr': 0.00018357082481794277, 'weight_decay': 9.806152394186953e-06, 'epochs': 184, 'loss': 'mae', 'optimizer': 'adam', 'graph_mode': 'off', 'use_snp_selection': False}. Best is trial 73 with value: 0.12343974487497228.
[I 2025-12-05 15:59:29,994] Trial 85 finished with value: 0.09865983959056729 and parameters: {'model_type': 'mlp', 'hidden_dims': '[512, 128]', 'dropout': 0.16623345265604192, 'batch_norm': True, 'lr': 0.0002597505140133076, 'weight_decay': 2.2021473725527288e-06, 'epochs': 298, 'loss': 'mae', 'optimizer': 'adam', 'graph_mode': 'off', 'use_snp_selection': False}. Best is trial 73 with value: 0.12343974487497228.
[I 2025-12-05 15:59:31,740] Trial 86 finished with value: 0.07681972211465363 and parameters: {'model_type': 'mlp', 'hidden_dims': '[512, 256]', 'dropout': 0.1123864119006701, 'batch_norm': False, 'lr': 0.00040981784803001745, 'weight_decay': 7.71167159950532e-06, 'epochs': 255, 'loss': 'mae', 'optimizer': 'adam', 'graph_mode': 'off', 'use_snp_selection': False}. Best is trial 73 with value: 0.12343974487497228.
[I 2025-12-05 15:59:33,291] Trial 87 finished with value: 0.09211275617280595 and parameters: {'model_type': 'mlp', 'hidden_dims': '[512, 64]', 'dropout': 0.21103018743737034, 'batch_norm': True, 'lr': 0.00022670692318324049, 'weight_decay': 1.8382716806221328e-05, 'epochs': 203, 'loss': 'mae', 'optimizer': 'adam', 'graph_mode': 'off', 'use_snp_selection': False}. Best is trial 73 with value: 0.12343974487497228.
[I 2025-12-05 15:59:34,352] Trial 88 finished with value: 0.07397800947014094 and parameters: {'model_type': 'mlp', 'hidden_dims': '[128, 64]', 'dropout': 0.25151268702331636, 'batch_norm': True, 'lr': 0.00029915292041749863, 'weight_decay': 0.00015498614474534445, 'epochs': 325, 'loss': 'mae', 'optimizer': 'adam', 'graph_mode': 'off', 'use_snp_selection': False}. Best is trial 73 with value: 0.12343974487497228.
[I 2025-12-05 15:59:36,817] Trial 89 finished with value: 0.10149445713446051 and parameters: {'model_type': 'mlp', 'hidden_dims': '[512, 256]', 'dropout': 0.18954452323283769, 'batch_norm': True, 'lr': 0.000568256840917591, 'weight_decay': 0.00040753362862602294, 'epochs': 142, 'loss': 'mae', 'optimizer': 'adam', 'graph_mode': 'off', 'use_snp_selection': True, 'num_snps': 45058}. Best is trial 73 with value: 0.12343974487497228.
[I 2025-12-05 15:59:37,998] Trial 90 finished with value: 0.08572748444861839 and parameters: {'model_type': 'mlp', 'hidden_dims': '[256, 128, 64]', 'dropout': 0.23604335097170753, 'batch_norm': True, 'lr': 0.00011434962681295142, 'weight_decay': 1.0988600337198151e-05, 'epochs': 241, 'loss': 'mse', 'optimizer': 'adam', 'graph_mode': 'off', 'use_snp_selection': False}. Best is trial 73 with value: 0.12343974487497228.
[I 2025-12-05 15:59:39,861] Trial 91 finished with value: 0.09341517707944898 and parameters: {'model_type': 'mlp', 'hidden_dims': '[512, 256]', 'dropout': 0.17073375270996594, 'batch_norm': True, 'lr': 0.00035302455305232563, 'weight_decay': 3.8466352918850645e-05, 'epochs': 280, 'loss': 'mae', 'optimizer': 'adam', 'graph_mode': 'off', 'use_snp_selection': False}. Best is trial 73 with value: 0.12343974487497228.
[I 2025-12-05 15:59:41,812] Trial 92 finished with value: 0.10840217717491542 and parameters: {'model_type': 'mlp', 'hidden_dims': '[512, 256]', 'dropout': 0.13104178375811906, 'batch_norm': True, 'lr': 0.0007971328937987337, 'weight_decay': 2.8775119846791465e-05, 'epochs': 308, 'loss': 'mae', 'optimizer': 'adam', 'graph_mode': 'off', 'use_snp_selection': False}. Best is trial 73 with value: 0.12343974487497228.
[I 2025-12-05 15:59:43,849] Trial 93 finished with value: 0.10146440396530244 and parameters: {'model_type': 'mlp', 'hidden_dims': '[512, 256]', 'dropout': 0.1296756493621965, 'batch_norm': True, 'lr': 0.0009878150901038581, 'weight_decay': 0.00024334426295641271, 'epochs': 323, 'loss': 'mae', 'optimizer': 'adam', 'graph_mode': 'off', 'use_snp_selection': False}. Best is trial 73 with value: 0.12343974487497228.
[I 2025-12-05 15:59:45,972] Trial 94 finished with value: 0.0989481568091869 and parameters: {'model_type': 'mlp', 'hidden_dims': '[512, 256]', 'dropout': 0.15437628929389152, 'batch_norm': True, 'lr': 0.0006793612744332677, 'weight_decay': 1.4207732952226925e-05, 'epochs': 341, 'loss': 'mae', 'optimizer': 'adam', 'graph_mode': 'off', 'use_snp_selection': False}. Best is trial 73 with value: 0.12343974487497228.
[I 2025-12-05 15:59:47,983] Trial 95 finished with value: 0.10656149613707415 and parameters: {'model_type': 'mlp', 'hidden_dims': '[512, 256]', 'dropout': 0.10659942207716427, 'batch_norm': True, 'lr': 0.0008201339540102917, 'weight_decay': 9.94855274306947e-05, 'epochs': 312, 'loss': 'mae', 'optimizer': 'adam', 'graph_mode': 'off', 'use_snp_selection': False}. Best is trial 73 with value: 0.12343974487497228.
[I 2025-12-05 15:59:49,957] Trial 96 finished with value: 0.08410315130086538 and parameters: {'model_type': 'mlp', 'hidden_dims': '[512, 128]', 'dropout': 0.14215491409828998, 'batch_norm': True, 'lr': 0.00016511740674385414, 'weight_decay': 3.220306481190692e-06, 'epochs': 307, 'loss': 'mae', 'optimizer': 'adam', 'graph_mode': 'off', 'use_snp_selection': False}. Best is trial 73 with value: 0.12343974487497228.
[I 2025-12-05 15:59:52,025] Trial 97 finished with value: 0.10705728152590187 and parameters: {'model_type': 'mlp', 'hidden_dims': '[512, 256]', 'dropout': 0.11688792231961873, 'batch_norm': True, 'lr': 0.00047281885456304675, 'weight_decay': 3.00110858777781e-05, 'epochs': 332, 'loss': 'mae', 'optimizer': 'adam', 'graph_mode': 'off', 'use_snp_selection': False}. Best is trial 73 with value: 0.12343974487497228.
[I 2025-12-05 15:59:53,258] Trial 98 finished with value: 0.06490813971998458 and parameters: {'model_type': 'mlp', 'hidden_dims': '[256, 128]', 'dropout': 0.10115509482618526, 'batch_norm': False, 'lr': 0.0005820567897590602, 'weight_decay': 5.7541971598251876e-05, 'epochs': 294, 'loss': 'mae', 'optimizer': 'adam', 'graph_mode': 'off', 'use_snp_selection': False}. Best is trial 73 with value: 0.12343974487497228.
[I 2025-12-05 15:59:54,868] Trial 99 finished with value: 0.09713870247679487 and parameters: {'model_type': 'mlp', 'hidden_dims': '[512, 256]', 'dropout': 0.18133204236581768, 'batch_norm': True, 'lr': 0.0002852251575596505, 'weight_decay': 4.8527136371816585e-06, 'epochs': 219, 'loss': 'mae', 'optimizer': 'adam', 'graph_mode': 'off', 'use_snp_selection': False}. Best is trial 73 with value: 0.12343974487497228.
[I 2025-12-05 15:59:56,635] Trial 100 finished with value: 0.10409303048047355 and parameters: {'model_type': 'mlp', 'hidden_dims': '[512, 256]', 'dropout': 0.22013944792473317, 'batch_norm': True, 'lr': 0.00037307502657461106, 'weight_decay': 3.9428213731562845e-06, 'epochs': 250, 'loss': 'mae', 'optimizer': 'adam', 'graph_mode': 'off', 'use_snp_selection': False}. Best is trial 73 with value: 0.12343974487497228.
[I 2025-12-05 15:59:58,739] Trial 101 finished with value: 0.1042963569030263 and parameters: {'model_type': 'mlp', 'hidden_dims': '[512, 256]', 'dropout': 0.1241201689776953, 'batch_norm': True, 'lr': 0.0004522846451589569, 'weight_decay': 1.667515979857445e-05, 'epochs': 334, 'loss': 'mae', 'optimizer': 'adam', 'graph_mode': 'off', 'use_snp_selection': False}. Best is trial 73 with value: 0.12343974487497228.
[I 2025-12-05 16:00:00,750] Trial 102 finished with value: 0.08540133915128316 and parameters: {'model_type': 'mlp', 'hidden_dims': '[512, 256]', 'dropout': 0.12092216882747457, 'batch_norm': True, 'lr': 0.0007088534259973026, 'weight_decay': 4.805728369170548e-05, 'epochs': 310, 'loss': 'mae', 'optimizer': 'adam', 'graph_mode': 'off', 'use_snp_selection': False}. Best is trial 73 with value: 0.12343974487497228.
[I 2025-12-05 16:00:02,778] Trial 103 finished with value: 0.09865843623118971 and parameters: {'model_type': 'mlp', 'hidden_dims': '[512, 256]', 'dropout': 0.1581924492014911, 'batch_norm': True, 'lr': 0.0004900030660064074, 'weight_decay': 2.60930134861071e-05, 'epochs': 321, 'loss': 'mae', 'optimizer': 'adam', 'graph_mode': 'off', 'use_snp_selection': False}. Best is trial 73 with value: 0.12343974487497228.
[I 2025-12-05 16:00:04,800] Trial 104 finished with value: 0.08837856939220551 and parameters: {'model_type': 'mlp', 'hidden_dims': '[512, 128]', 'dropout': 0.13619696165500828, 'batch_norm': True, 'lr': 0.0002467586275189681, 'weight_decay': 2.0033346676215946e-05, 'epochs': 327, 'loss': 'mae', 'optimizer': 'adam', 'graph_mode': 'off', 'use_snp_selection': False}. Best is trial 73 with value: 0.12343974487497228.
