[I 2025-12-05 15:37:13,188] Trial 22 finished with value: 0.1030801698691891 and parameters: {'model_type': 'mlp', 'hidden_dims': '[512, 256]', 'dropout': 0.16482687806697485, 'batch_norm': True, 'lr': 1.4604102770411516e-05, 'weight_decay': 7.228108383438107e-06, 'epochs': 108, 'loss': 'mae', 'optimizer': 'adam', 'graph_mode': 'off', 'use_snp_selection': False}. Best is trial 16 with value: 0.14105610079653463.
[I 2025-12-05 15:37:14,572] Trial 23 finished with value: 0.10596643403319943 and parameters: {'model_type': 'mlp', 'hidden_dims': '[512, 256]', 'dropout': 0.3387219674053214, 'batch_norm': True, 'lr': 0.0001124385149518785, 'weight_decay': 0.00014061128063276327, 'epochs': 165, 'loss': 'mae', 'optimizer': 'adam', 'graph_mode': 'off', 'use_snp_selection': False}. Best is trial 16 with value: 0.14105610079653463.
[I 2025-12-05 15:37:15,790] Trial 24 finished with value: 0.07288593527389647 and parameters: {'model_type': 'mlp', 'hidden_dims': '[512, 256]', 'dropout': 0.22155857590843597, 'batch_norm': True, 'lr': 4.00186241257344e-06, 'weight_decay': 2.9783009346140106e-05, 'epochs': 122, 'loss': 'mae', 'optimizer': 'adam', 'graph_mode': 'off', 'use_snp_selection': False}. Best is trial 16 with value: 0.14105610079653463.
[I 2025-12-05 15:37:17,390] Trial 25 finished with value: 0.08935802343985455 and parameters: {'model_type': 'mlp', 'hidden_dims': '[512, 256]', 'dropout': 0.2787553339811677, 'batch_norm': True, 'lr': 3.200046581636839e-05, 'weight_decay': 1.063069753619167e-05, 'epochs': 213, 'loss': 'mae', 'optimizer': 'adam', 'graph_mode': 'off', 'use_snp_selection': False}. Best is trial 16 with value: 0.14105610079653463.
[I 2025-12-05 15:37:18,125] Trial 26 finished with value: 0.06253701974061734 and parameters: {'model_type': 'mlp', 'hidden_dims': '[512, 256]', 'dropout': 0.47701014067551106, 'batch_norm': True, 'lr': 0.00010937382539687734, 'weight_decay': 9.516657810025634e-05, 'epochs': 81, 'loss': 'mae', 'optimizer': 'adam', 'graph_mode': 'off', 'use_snp_selection': True, 'num_snps': 3842}. Best is trial 16 with value: 0.14105610079653463.
[I 2025-12-05 15:37:20,053] Trial 27 finished with value: 0.08967556493873087 and parameters: {'model_type': 'mlp', 'hidden_dims': '[512, 256]', 'dropout': 0.14201787846424646, 'batch_norm': False, 'lr': 7.463657728714996e-06, 'weight_decay': 1.2098587394209665e-06, 'epochs': 314, 'loss': 'mae', 'optimizer': 'adam', 'graph_mode': 'off', 'use_snp_selection': False}. Best is trial 16 with value: 0.14105610079653463.
[I 2025-12-05 15:37:21,007] Trial 28 finished with value: 0.0912115095742043 and parameters: {'model_type': 'mlp', 'hidden_dims': '[128, 64]', 'dropout': 0.19619381716213838, 'batch_norm': True, 'lr': 1.597687963134124e-05, 'weight_decay': 3.894746833113853e-06, 'epochs': 259, 'loss': 'mae', 'optimizer': 'adam', 'graph_mode': 'off', 'use_snp_selection': False}. Best is trial 16 with value: 0.14105610079653463.
[I 2025-12-05 15:37:22,572] Trial 29 finished with value: 0.015190839312916812 and parameters: {'model_type': 'mlp', 'hidden_dims': '[256, 128]', 'dropout': 0.3669044734832708, 'batch_norm': True, 'lr': 2.8966762461994946e-06, 'weight_decay': 4.6559807902799564e-05, 'epochs': 333, 'loss': 'mae', 'optimizer': 'adam', 'graph_mode': 'off', 'use_snp_selection': True, 'num_snps': 19468}. Best is trial 16 with value: 0.14105610079653463.
[I 2025-12-05 15:37:23,601] Trial 30 finished with value: 0.08825698707021698 and parameters: {'model_type': 'mlp', 'hidden_dims': '[256, 128, 64]', 'dropout': 0.21173851504297397, 'batch_norm': True, 'lr': 3.3550116376510116e-05, 'weight_decay': 2.0505410639690408e-05, 'epochs': 181, 'loss': 'mae', 'optimizer': 'adam', 'graph_mode': 'off', 'use_snp_selection': False}. Best is trial 16 with value: 0.14105610079653463.
[I 2025-12-05 15:37:25,557] Trial 31 finished with value: 0.12265261597339805 and parameters: {'model_type': 'mlp', 'hidden_dims': '[512, 128]', 'dropout': 0.113896624159191, 'batch_norm': True, 'lr': 0.0003757595806411763, 'weight_decay': 1.582942314792138e-05, 'epochs': 315, 'loss': 'mae', 'optimizer': 'adam', 'graph_mode': 'off', 'use_snp_selection': False}. Best is trial 16 with value: 0.14105610079653463.
[I 2025-12-05 15:37:27,484] Trial 32 finished with value: 0.12263302878999342 and parameters: {'model_type': 'mlp', 'hidden_dims': '[512, 128]', 'dropout': 0.1396498496661149, 'batch_norm': True, 'lr': 0.00013084514440037215, 'weight_decay': 1.5072948889347477e-05, 'epochs': 301, 'loss': 'mae', 'optimizer': 'adam', 'graph_mode': 'off', 'use_snp_selection': False}. Best is trial 16 with value: 0.14105610079653463.
[I 2025-12-05 15:37:29,408] Trial 33 finished with value: 0.13005873124283798 and parameters: {'model_type': 'mlp', 'hidden_dims': '[512, 128]', 'dropout': 0.13483319565156204, 'batch_norm': True, 'lr': 0.00011072285245258389, 'weight_decay': 9.950111180219765e-06, 'epochs': 301, 'loss': 'mae', 'optimizer': 'adam', 'graph_mode': 'off', 'use_snp_selection': False}. Best is trial 16 with value: 0.14105610079653463.
[I 2025-12-05 15:37:31,524] Trial 34 finished with value: 0.11846400726942227 and parameters: {'model_type': 'mlp', 'hidden_dims': '[512, 128]', 'dropout': 0.12366450703168422, 'batch_norm': True, 'lr': 0.0005073630465350576, 'weight_decay': 7.1630700675609866e-06, 'epochs': 348, 'loss': 'mae', 'optimizer': 'adam', 'graph_mode': 'off', 'use_snp_selection': False}. Best is trial 16 with value: 0.14105610079653463.
[I 2025-12-05 15:37:33,511] Trial 35 finished with value: 0.09075566917062544 and parameters: {'model_type': 'mlp', 'hidden_dims': '[512, 128]', 'dropout': 0.17336458786647835, 'batch_norm': False, 'lr': 0.00035082701229811295, 'weight_decay': 5.561140874430432e-06, 'epochs': 325, 'loss': 'mae', 'optimizer': 'adam', 'graph_mode': 'off', 'use_snp_selection': False}. Best is trial 16 with value: 0.14105610079653463.
[I 2025-12-05 15:37:36,944] Trial 36 finished with value: 0.1054515051257194 and parameters: {'model_type': 'mlp', 'hidden_dims': '[512, 128]', 'dropout': 0.1883634076900596, 'batch_norm': True, 'lr': 8.62644491381044e-05, 'weight_decay': 1.1033981296982448e-05, 'epochs': 300, 'loss': 'mse', 'optimizer': 'adam', 'graph_mode': 'off', 'use_snp_selection': True, 'num_snps': 58661}. Best is trial 16 with value: 0.14105610079653463.
[I 2025-12-05 15:37:37,955] Trial 37 finished with value: 0.1208189363608016 and parameters: {'model_type': 'mlp', 'hidden_dims': '[128, 64]', 'dropout': 0.13507771370469546, 'batch_norm': True, 'lr': 0.0009035744975472461, 'weight_decay': 3.879261419425585e-05, 'epochs': 263, 'loss': 'mae', 'optimizer': 'adam', 'graph_mode': 'off', 'use_snp_selection': False}. Best is trial 16 with value: 0.14105610079653463.
[I 2025-12-05 15:37:39,278] Trial 38 finished with value: 0.09508280745533013 and parameters: {'model_type': 'mlp', 'hidden_dims': '[256, 128]', 'dropout': 0.2535778598931014, 'batch_norm': False, 'lr': 4.610345991335269e-05, 'weight_decay': 2.674328262810259e-06, 'epochs': 229, 'loss': 'mse', 'optimizer': 'adam', 'graph_mode': 'off', 'use_snp_selection': True, 'num_snps': 19911}. Best is trial 16 with value: 0.14105610079653463.
[I 2025-12-05 15:37:41,166] Trial 39 finished with value: 0.10222792916235018 and parameters: {'model_type': 'mlp', 'hidden_dims': '[512, 128]', 'dropout': 0.593444752072398, 'batch_norm': True, 'lr': 0.00029073975329268207, 'weight_decay': 0.000494866061743946, 'epochs': 298, 'loss': 'mae', 'optimizer': 'adam', 'graph_mode': 'off', 'use_snp_selection': False}. Best is trial 16 with value: 0.14105610079653463.
[I 2025-12-05 15:37:43,166] Trial 40 finished with value: 0.11703595160297356 and parameters: {'model_type': 'mlp', 'hidden_dims': '[512, 128]', 'dropout': 0.16521432861581617, 'batch_norm': True, 'lr': 0.0005355631332513197, 'weight_decay': 1.4278741616746945e-05, 'epochs': 328, 'loss': 'mae', 'optimizer': 'adam', 'graph_mode': 'off', 'use_snp_selection': False}. Best is trial 16 with value: 0.14105610079653463.
[I 2025-12-05 15:37:45,076] Trial 41 finished with value: 0.13644753010966462 and parameters: {'model_type': 'mlp', 'hidden_dims': '[512, 128]', 'dropout': 0.12270641891700806, 'batch_norm': True, 'lr': 0.00014116854522943883, 'weight_decay': 1.4150487395841992e-05, 'epochs': 302, 'loss': 'mae', 'optimizer': 'adam', 'graph_mode': 'off', 'use_snp_selection': False}. Best is trial 16 with value: 0.14105610079653463.
[I 2025-12-05 15:37:46,872] Trial 42 finished with value: 0.10651757997746632 and parameters: {'model_type': 'mlp', 'hidden_dims': '[512, 128]', 'dropout': 0.11922260225912434, 'batch_norm': True, 'lr': 0.00015944299421706795, 'weight_decay': 1.2047179341103142e-05, 'epochs': 267, 'loss': 'mae', 'optimizer': 'adam', 'graph_mode': 'off', 'use_snp_selection': False}. Best is trial 16 with value: 0.14105610079653463.
[I 2025-12-05 15:37:48,917] Trial 43 finished with value: 0.13614086630275296 and parameters: {'model_type': 'mlp', 'hidden_dims': '[512, 128]', 'dropout': 0.12058563537791031, 'batch_norm': True, 'lr': 8.208283269498048e-05, 'weight_decay': 5.637051862363348e-06, 'epochs': 337, 'loss': 'mae', 'optimizer': 'adam', 'graph_mode': 'off', 'use_snp_selection': False}. Best is trial 16 with value: 0.14105610079653463.
[I 2025-12-05 15:37:50,953] Trial 44 finished with value: 0.11168611695248679 and parameters: {'model_type': 'mlp', 'hidden_dims': '[512, 128]', 'dropout': 0.15313084141005925, 'batch_norm': True, 'lr': 9.437086260656473e-05, 'weight_decay': 9.828602836120522e-07, 'epochs': 336, 'loss': 'mse', 'optimizer': 'adam', 'graph_mode': 'off', 'use_snp_selection': False}. Best is trial 16 with value: 0.14105610079653463.
[I 2025-12-05 15:37:53,055] Trial 45 finished with value: 0.11969645890833637 and parameters: {'model_type': 'mlp', 'hidden_dims': '[512, 64]', 'dropout': 0.1001318279577307, 'batch_norm': True, 'lr': 7.183783551923377e-05, 'weight_decay': 4.527266571146081e-06, 'epochs': 349, 'loss': 'mae', 'optimizer': 'adam', 'graph_mode': 'off', 'use_snp_selection': False}. Best is trial 16 with value: 0.14105610079653463.
[I 2025-12-05 15:37:54,329] Trial 46 finished with value: 0.10746115516891791 and parameters: {'model_type': 'mlp', 'hidden_dims': '[256, 128, 64]', 'dropout': 0.13032595547226372, 'batch_norm': True, 'lr': 5.488578625689869e-05, 'weight_decay': 2.140669802398178e-06, 'epochs': 294, 'loss': 'mae', 'optimizer': 'adam', 'graph_mode': 'off', 'use_snp_selection': False}. Best is trial 16 with value: 0.14105610079653463.
[I 2025-12-05 15:37:56,275] Trial 47 finished with value: 0.11359072282023377 and parameters: {'model_type': 'mlp', 'hidden_dims': '[512, 128]', 'dropout': 0.19846009527442923, 'batch_norm': False, 'lr': 0.00015592546800275185, 'weight_decay': 6.359895876866024e-06, 'epochs': 310, 'loss': 'mae', 'optimizer': 'adam', 'graph_mode': 'off', 'use_snp_selection': False}. Best is trial 16 with value: 0.14105610079653463.
[I 2025-12-05 15:37:58,255] Trial 48 finished with value: 0.0942530936432924 and parameters: {'model_type': 'mlp', 'hidden_dims': '[512, 128]', 'dropout': 0.23497728937739962, 'batch_norm': True, 'lr': 4.1657230337384445e-05, 'weight_decay': 8.065599038641602e-05, 'epochs': 322, 'loss': 'mse', 'optimizer': 'adam', 'graph_mode': 'off', 'use_snp_selection': False}. Best is trial 16 with value: 0.14105610079653463.
[I 2025-12-05 15:38:00,559] Trial 49 finished with value: 0.11278208795776479 and parameters: {'model_type': 'mlp', 'hidden_dims': '[256, 128]', 'dropout': 0.15732930630842687, 'batch_norm': True, 'lr': 7.516495065688077e-05, 'weight_decay': 3.946637445760036e-07, 'epochs': 276, 'loss': 'mae', 'optimizer': 'adam', 'graph_mode': 'off', 'use_snp_selection': True, 'num_snps': 46888}. Best is trial 16 with value: 0.14105610079653463.
[I 2025-12-05 15:38:02,648] Trial 50 finished with value: 0.11938826396543817 and parameters: {'model_type': 'mlp', 'hidden_dims': '[512, 64]', 'dropout': 0.17361365900231598, 'batch_norm': True, 'lr': 0.00021284858712059085, 'weight_decay': 3.606768106298067e-05, 'epochs': 335, 'loss': 'mae', 'optimizer': 'adam', 'graph_mode': 'off', 'use_snp_selection': False}. Best is trial 16 with value: 0.14105610079653463.
[I 2025-12-05 15:38:04,596] Trial 51 finished with value: 0.11185321680989951 and parameters: {'model_type': 'mlp', 'hidden_dims': '[512, 128]', 'dropout': 0.12068683163096937, 'batch_norm': True, 'lr': 0.0002682329083663666, 'weight_decay': 1.59272518193992e-05, 'epochs': 313, 'loss': 'mae', 'optimizer': 'adam', 'graph_mode': 'off', 'use_snp_selection': False}. Best is trial 16 with value: 0.14105610079653463.
[I 2025-12-05 15:38:06,448] Trial 52 finished with value: 0.12228396028008182 and parameters: {'model_type': 'mlp', 'hidden_dims': '[512, 128]', 'dropout': 0.11085685402255839, 'batch_norm': True, 'lr': 0.0004270136526765163, 'weight_decay': 9.872796401544927e-06, 'epochs': 289, 'loss': 'mae', 'optimizer': 'adam', 'graph_mode': 'off', 'use_snp_selection': False}. Best is trial 16 with value: 0.14105610079653463.
[I 2025-12-05 15:38:08,520] Trial 53 finished with value: 0.11336990733836869 and parameters: {'model_type': 'mlp', 'hidden_dims': '[512, 128]', 'dropout': 0.10041113882041745, 'batch_norm': True, 'lr': 0.0006508806361979766, 'weight_decay': 1.9067272449656347e-05, 'epochs': 341, 'loss': 'mae', 'optimizer': 'adam', 'graph_mode': 'off', 'use_snp_selection': False}. Best is trial 16 with value: 0.14105610079653463.
[I 2025-12-05 15:38:10,446] Trial 54 finished with value: 0.12168632502341037 and parameters: {'model_type': 'mlp', 'hidden_dims': '[512, 128]', 'dropout': 0.14558801682908667, 'batch_norm': True, 'lr': 0.00013456935096407504, 'weight_decay': 3.7046586126275304e-06, 'epochs': 307, 'loss': 'mae', 'optimizer': 'adam', 'graph_mode': 'off', 'use_snp_selection': False}. Best is trial 16 with value: 0.14105610079653463.
[I 2025-12-05 15:38:11,488] Trial 55 finished with value: 0.11655136837236071 and parameters: {'model_type': 'mlp', 'hidden_dims': '[128, 64]', 'dropout': 0.12638891713213765, 'batch_norm': True, 'lr': 0.00024565288820271045, 'weight_decay': 9.647081572239826e-06, 'epochs': 322, 'loss': 'mae', 'optimizer': 'adam', 'graph_mode': 'off', 'use_snp_selection': False}. Best is trial 16 with value: 0.14105610079653463.
[I 2025-12-05 15:38:12,699] Trial 56 finished with value: 0.09048928810140115 and parameters: {'model_type': 'mlp', 'hidden_dims': '[256, 128, 64]', 'dropout': 0.180942777282961, 'batch_norm': True, 'lr': 2.3141567300077595e-05, 'weight_decay': 2.4577798102883076e-05, 'epochs': 248, 'loss': 'mae', 'optimizer': 'adam', 'graph_mode': 'off', 'use_snp_selection': False}. Best is trial 16 with value: 0.14105610079653463.
[I 2025-12-05 15:38:14,530] Trial 57 finished with value: 0.11605078429993784 and parameters: {'model_type': 'mlp', 'hidden_dims': '[512, 128]', 'dropout': 0.15076202828012228, 'batch_norm': True, 'lr': 0.00019554151684799315, 'weight_decay': 4.883188272561733e-06, 'epochs': 274, 'loss': 'mae', 'optimizer': 'adam', 'graph_mode': 'off', 'use_snp_selection': False}. Best is trial 16 with value: 0.14105610079653463.
[I 2025-12-05 15:38:16,372] Trial 58 finished with value: 0.10523313186735084 and parameters: {'model_type': 'mlp', 'hidden_dims': '[512, 256]', 'dropout': 0.11681722832278607, 'batch_norm': False, 'lr': 9.759783363954087e-05, 'weight_decay': 7.837563602978264e-06, 'epochs': 290, 'loss': 'mse', 'optimizer': 'adam', 'graph_mode': 'off', 'use_snp_selection': False}. Best is trial 16 with value: 0.14105610079653463.
[I 2025-12-05 15:38:18,057] Trial 59 finished with value: 0.12460533194144936 and parameters: {'model_type': 'mlp', 'hidden_dims': '[512, 256]', 'dropout': 0.20726055300238377, 'batch_norm': True, 'lr': 0.0003412254897254642, 'weight_decay': 2.725663311561382e-06, 'epochs': 236, 'loss': 'mae', 'optimizer': 'adam', 'graph_mode': 'off', 'use_snp_selection': False}. Best is trial 16 with value: 0.14105610079653463.
[I 2025-12-05 15:38:19,617] Trial 60 finished with value: 0.1148856040445703 and parameters: {'model_type': 'mlp', 'hidden_dims': '[512, 256]', 'dropout': 0.2116330431060989, 'batch_norm': True, 'lr': 6.425308265189455e-05, 'weight_decay': 1.581431171109205e-06, 'epochs': 211, 'loss': 'mae', 'optimizer': 'adam', 'graph_mode': 'off', 'use_snp_selection': False}. Best is trial 16 with value: 0.14105610079653463.
[I 2025-12-05 15:38:21,297] Trial 61 finished with value: 0.1259034489255006 and parameters: {'model_type': 'mlp', 'hidden_dims': '[512, 256]', 'dropout': 0.42417783964919636, 'batch_norm': True, 'lr': 0.00033849681296871294, 'weight_decay': 2.766261366085716e-06, 'epochs': 235, 'loss': 'mae', 'optimizer': 'adam', 'graph_mode': 'off', 'use_snp_selection': False}. Best is trial 16 with value: 0.14105610079653463.
[I 2025-12-05 15:38:22,974] Trial 62 finished with value: 0.11308610692664334 and parameters: {'model_type': 'mlp', 'hidden_dims': '[512, 256]', 'dropout': 0.42488629894016383, 'batch_norm': True, 'lr': 0.0003011573212563718, 'weight_decay': 2.870667739167413e-06, 'epochs': 234, 'loss': 'mae', 'optimizer': 'adam', 'graph_mode': 'off', 'use_snp_selection': False}. Best is trial 16 with value: 0.14105610079653463.
[I 2025-12-05 15:38:24,610] Trial 63 finished with value: 0.11560779641328425 and parameters: {'model_type': 'mlp', 'hidden_dims': '[512, 256]', 'dropout': 0.5082713180219749, 'batch_norm': True, 'lr': 0.00013360452714385459, 'weight_decay': 8.637529807125993e-07, 'epochs': 222, 'loss': 'mae', 'optimizer': 'adam', 'graph_mode': 'off', 'use_snp_selection': False}. Best is trial 16 with value: 0.14105610079653463.
[I 2025-12-05 15:38:26,121] Trial 64 finished with value: 0.11929094165931359 and parameters: {'model_type': 'mlp', 'hidden_dims': '[512, 256]', 'dropout': 0.38696730808494373, 'batch_norm': True, 'lr': 0.0006765661177326395, 'weight_decay': 1.548619938090874e-06, 'epochs': 197, 'loss': 'mae', 'optimizer': 'adam', 'graph_mode': 'off', 'use_snp_selection': False}. Best is trial 16 with value: 0.14105610079653463.
[I 2025-12-05 15:38:27,851] Trial 65 finished with value: 0.12353234377161464 and parameters: {'model_type': 'mlp', 'hidden_dims': '[512, 256]', 'dropout': 0.4457142431301934, 'batch_norm': True, 'lr': 0.00016161084478744342, 'weight_decay': 3.3239679423178815e-06, 'epochs': 247, 'loss': 'mae', 'optimizer': 'adam', 'graph_mode': 'off', 'use_snp_selection': False}. Best is trial 16 with value: 0.14105610079653463.
[I 2025-12-05 15:38:29,320] Trial 66 finished with value: 0.11810665192970898 and parameters: {'model_type': 'mlp', 'hidden_dims': '[512, 256]', 'dropout': 0.35791071226121873, 'batch_norm': True, 'lr': 0.00022757510966059643, 'weight_decay': 5.547133139502116e-06, 'epochs': 185, 'loss': 'mae', 'optimizer': 'adam', 'graph_mode': 'off', 'use_snp_selection': True, 'num_snps': 22881}. Best is trial 16 with value: 0.14105610079653463.
[I 2025-12-05 15:38:30,859] Trial 67 finished with value: 0.0040598791991905405 and parameters: {'model_type': 'mlp', 'hidden_dims': '[512, 256]', 'dropout': 0.23361087723523027, 'batch_norm': True, 'lr': 1.038788092140181e-06, 'weight_decay': 1.915000761574849e-06, 'epochs': 206, 'loss': 'mae', 'optimizer': 'adam', 'graph_mode': 'off', 'use_snp_selection': False}. Best is trial 16 with value: 0.14105610079653463.
[I 2025-12-05 15:38:32,601] Trial 68 finished with value: 0.10597802940142668 and parameters: {'model_type': 'mlp', 'hidden_dims': '[512, 256]', 'dropout': 0.3326798987697642, 'batch_norm': True, 'lr': 3.866058471057247e-05, 'weight_decay': 8.402330907888122e-06, 'epochs': 255, 'loss': 'mae', 'optimizer': 'adam', 'graph_mode': 'off', 'use_snp_selection': False}. Best is trial 16 with value: 0.14105610079653463.
[I 2025-12-05 15:38:34,239] Trial 69 finished with value: 0.1007008844505552 and parameters: {'model_type': 'mlp', 'hidden_dims': '[512, 256]', 'dropout': 0.27131809744639485, 'batch_norm': False, 'lr': 0.00010928156341602067, 'weight_decay': 6.178836853457794e-07, 'epochs': 235, 'loss': 'mae', 'optimizer': 'adam', 'graph_mode': 'off', 'use_snp_selection': False}. Best is trial 16 with value: 0.14105610079653463.
[I 2025-12-05 15:38:36,012] Trial 70 finished with value: 0.11583836075613003 and parameters: {'model_type': 'mlp', 'hidden_dims': '[512, 64]', 'dropout': 0.29838913062766403, 'batch_norm': True, 'lr': 0.0003822585889589598, 'weight_decay': 2.3466801239151004e-06, 'epochs': 268, 'loss': 'mae', 'optimizer': 'adam', 'graph_mode': 'off', 'use_snp_selection': False}. Best is trial 16 with value: 0.14105610079653463.
[I 2025-12-05 15:38:37,731] Trial 71 finished with value: 0.11519078525382742 and parameters: {'model_type': 'mlp', 'hidden_dims': '[512, 256]', 'dropout': 0.456105726113162, 'batch_norm': True, 'lr': 0.00017260522968964525, 'weight_decay': 3.36584424751653e-06, 'epochs': 247, 'loss': 'mae', 'optimizer': 'adam', 'graph_mode': 'off', 'use_snp_selection': False}. Best is trial 16 with value: 0.14105610079653463.
[I 2025-12-05 15:38:39,468] Trial 72 finished with value: 0.0854362258117978 and parameters: {'model_type': 'mlp', 'hidden_dims': '[512, 256]', 'dropout': 0.44979235372557425, 'batch_norm': True, 'lr': 1.749993227491082e-05, 'weight_decay': 3.7775224278662733e-06, 'epochs': 256, 'loss': 'mae', 'optimizer': 'adam', 'graph_mode': 'off', 'use_snp_selection': False}. Best is trial 16 with value: 0.14105610079653463.
[I 2025-12-05 15:38:41,089] Trial 73 finished with value: 0.11156307854581314 and parameters: {'model_type': 'mlp', 'hidden_dims': '[512, 256]', 'dropout': 0.4607577825113262, 'batch_norm': True, 'lr': 0.00014501711156436798, 'weight_decay': 5.569762580291602e-06, 'epochs': 222, 'loss': 'mae', 'optimizer': 'adam', 'graph_mode': 'off', 'use_snp_selection': False}. Best is trial 16 with value: 0.14105610079653463.
