[I 2025-12-06 02:00:19,717] Trial 125 finished with value: 0.30899271489569546 and parameters: {'model_type': 'mlp', 'hidden_dims': '[512, 256]', 'dropout': 0.17344846206970452, 'batch_norm': True, 'lr': 0.00012263834715859929, 'weight_decay': 0.0006799729409221223, 'epochs': 129, 'loss': 'mse', 'optimizer': 'adam', 'graph_mode': 'off', 'use_snp_selection': True, 'num_snps': 46591}. Best is trial 89 with value: 0.31639482456999446.
[I 2025-12-06 02:01:33,971] Trial 126 finished with value: 0.30385597232869305 and parameters: {'model_type': 'mlp', 'hidden_dims': '[512, 64]', 'dropout': 0.11157448306256432, 'batch_norm': True, 'lr': 4.357769703276867e-05, 'weight_decay': 0.0002729276763471076, 'epochs': 248, 'loss': 'mae', 'optimizer': 'adam', 'graph_mode': 'off', 'use_snp_selection': True, 'num_snps': 54398}. Best is trial 89 with value: 0.31639482456999446.
[I 2025-12-06 02:02:44,409] Trial 127 finished with value: 0.3128300511003813 and parameters: {'model_type': 'mlp', 'hidden_dims': '[512, 64]', 'dropout': 0.13668593420383063, 'batch_norm': True, 'lr': 6.754629470807392e-05, 'weight_decay': 0.0005785722260186783, 'epochs': 261, 'loss': 'mse', 'optimizer': 'adam', 'graph_mode': 'off', 'use_snp_selection': True, 'num_snps': 48405}. Best is trial 89 with value: 0.31639482456999446.
[I 2025-12-06 02:04:04,242] Trial 128 finished with value: 0.3080378108099452 and parameters: {'model_type': 'mlp', 'hidden_dims': '[512, 64]', 'dropout': 0.20235157320820227, 'batch_norm': True, 'lr': 7.035551592071747e-05, 'weight_decay': 0.000597299278103482, 'epochs': 328, 'loss': 'mse', 'optimizer': 'adam', 'graph_mode': 'off', 'use_snp_selection': True, 'num_snps': 48669}. Best is trial 89 with value: 0.31639482456999446.
[I 2025-12-06 02:05:15,982] Trial 129 finished with value: 0.3100754296887882 and parameters: {'model_type': 'mlp', 'hidden_dims': '[512, 64]', 'dropout': 0.13625799719060075, 'batch_norm': True, 'lr': 5.351501555716026e-05, 'weight_decay': 0.00032871644581024826, 'epochs': 294, 'loss': 'mse', 'optimizer': 'adam', 'graph_mode': 'off', 'use_snp_selection': True, 'num_snps': 45566}. Best is trial 89 with value: 0.31639482456999446.
[I 2025-12-06 02:06:06,344] Trial 130 finished with value: 0.2363000154854693 and parameters: {'model_type': 'mlp', 'hidden_dims': '[512, 64]', 'dropout': 0.16350929859384186, 'batch_norm': True, 'lr': 1.0641329189400756e-06, 'weight_decay': 0.0002249234656326677, 'epochs': 99, 'loss': 'mae', 'optimizer': 'adam', 'graph_mode': 'off', 'use_snp_selection': True, 'num_snps': 51573}. Best is trial 89 with value: 0.31639482456999446.
[I 2025-12-06 02:07:10,467] Trial 131 finished with value: 0.31329795110466024 and parameters: {'model_type': 'mlp', 'hidden_dims': '[512, 64]', 'dropout': 0.14803678133857123, 'batch_norm': True, 'lr': 2.9577778548462283e-05, 'weight_decay': 0.0008182339329983148, 'epochs': 264, 'loss': 'mse', 'optimizer': 'adam', 'graph_mode': 'off', 'use_snp_selection': True, 'num_snps': 41795}. Best is trial 89 with value: 0.31639482456999446.
[I 2025-12-06 02:08:14,218] Trial 132 finished with value: 0.31286017816139144 and parameters: {'model_type': 'mlp', 'hidden_dims': '[512, 64]', 'dropout': 0.14738361666927088, 'batch_norm': True, 'lr': 2.8216222845302567e-05, 'weight_decay': 0.0007812823147588169, 'epochs': 258, 'loss': 'mse', 'optimizer': 'adam', 'graph_mode': 'off', 'use_snp_selection': True, 'num_snps': 42261}. Best is trial 89 with value: 0.31639482456999446.
[I 2025-12-06 02:09:17,079] Trial 133 finished with value: 0.310881403081101 and parameters: {'model_type': 'mlp', 'hidden_dims': '[512, 64]', 'dropout': 0.14122455381145668, 'batch_norm': True, 'lr': 2.873305010138957e-05, 'weight_decay': 0.0008049973463700907, 'epochs': 254, 'loss': 'mse', 'optimizer': 'adam', 'graph_mode': 'off', 'use_snp_selection': True, 'num_snps': 41653}. Best is trial 89 with value: 0.31639482456999446.
[I 2025-12-06 02:10:19,284] Trial 134 finished with value: 0.3027603250679671 and parameters: {'model_type': 'mlp', 'hidden_dims': '[512, 64]', 'dropout': 0.1794762741314219, 'batch_norm': True, 'lr': 2.441130810220042e-05, 'weight_decay': 0.0005921997120433312, 'epochs': 260, 'loss': 'mse', 'optimizer': 'adam', 'graph_mode': 'off', 'use_snp_selection': True, 'num_snps': 39863}. Best is trial 89 with value: 0.31639482456999446.
[I 2025-12-06 02:11:25,289] Trial 135 finished with value: 0.3065870610398623 and parameters: {'model_type': 'mlp', 'hidden_dims': '[512, 64]', 'dropout': 0.16866685875798465, 'batch_norm': True, 'lr': 3.37213272157079e-05, 'weight_decay': 0.000741959535876343, 'epochs': 266, 'loss': 'mse', 'optimizer': 'adam', 'graph_mode': 'off', 'use_snp_selection': True, 'num_snps': 43350}. Best is trial 89 with value: 0.31639482456999446.
[I 2025-12-06 02:12:32,892] Trial 136 finished with value: 0.3015178496012486 and parameters: {'model_type': 'mlp', 'hidden_dims': '[512, 64]', 'dropout': 0.1494553022670912, 'batch_norm': True, 'lr': 1.3247843198002364e-05, 'weight_decay': 0.0008868422656796093, 'epochs': 238, 'loss': 'mse', 'optimizer': 'adam', 'graph_mode': 'off', 'use_snp_selection': True, 'num_snps': 48706}. Best is trial 89 with value: 0.31639482456999446.
[I 2025-12-06 02:13:23,372] Trial 137 finished with value: 0.30286633637992416 and parameters: {'model_type': 'mlp', 'hidden_dims': '[512, 64]', 'dropout': 0.13024775903173064, 'batch_norm': True, 'lr': 2.0936519976173332e-05, 'weight_decay': 0.0005281996124802262, 'epochs': 91, 'loss': 'mse', 'optimizer': 'adam', 'graph_mode': 'off', 'use_snp_selection': True, 'num_snps': 54108}. Best is trial 89 with value: 0.31639482456999446.
[I 2025-12-06 02:14:34,847] Trial 138 finished with value: 0.3038690024271131 and parameters: {'model_type': 'mlp', 'hidden_dims': '[512, 64]', 'dropout': 0.21611753563881667, 'batch_norm': True, 'lr': 2.767415073686206e-05, 'weight_decay': 0.0004081443410023599, 'epochs': 276, 'loss': 'mse', 'optimizer': 'adam', 'graph_mode': 'off', 'use_snp_selection': True, 'num_snps': 46882}. Best is trial 89 with value: 0.31639482456999446.
[I 2025-12-06 02:15:25,794] Trial 139 finished with value: 0.3074542975338459 and parameters: {'model_type': 'mlp', 'hidden_dims': '[512, 64]', 'dropout': 0.1913122777783497, 'batch_norm': True, 'lr': 3.9078255353969226e-05, 'weight_decay': 0.0006431471841060165, 'epochs': 111, 'loss': 'mse', 'optimizer': 'adam', 'graph_mode': 'off', 'use_snp_selection': True, 'num_snps': 49968}. Best is trial 89 with value: 0.31639482456999446.
[I 2025-12-06 02:16:35,765] Trial 140 finished with value: 0.3034931858903652 and parameters: {'model_type': 'mlp', 'hidden_dims': '[512, 64]', 'dropout': 0.16119530539262059, 'batch_norm': False, 'lr': 6.116096387602e-05, 'weight_decay': 0.00012546198409344364, 'epochs': 287, 'loss': 'mae', 'optimizer': 'adam', 'graph_mode': 'off', 'use_snp_selection': True, 'num_snps': 45300}. Best is trial 89 with value: 0.31639482456999446.
[I 2025-12-06 02:17:36,449] Trial 141 finished with value: 0.3092586737174552 and parameters: {'model_type': 'mlp', 'hidden_dims': '[512, 128]', 'dropout': 0.14574953438263283, 'batch_norm': True, 'lr': 4.863043425109743e-05, 'weight_decay': 0.00048656963838079116, 'epochs': 241, 'loss': 'mse', 'optimizer': 'adam', 'graph_mode': 'off', 'use_snp_selection': True, 'num_snps': 41385}. Best is trial 89 with value: 0.31639482456999446.
[I 2025-12-06 02:18:16,202] Trial 142 finished with value: 0.30911257647173984 and parameters: {'model_type': 'mlp', 'hidden_dims': '[128, 64]', 'dropout': 0.15491515846815931, 'batch_norm': True, 'lr': 3.9634296922342176e-05, 'weight_decay': 0.0009799724021840556, 'epochs': 259, 'loss': 'mse', 'optimizer': 'adam', 'graph_mode': 'off', 'use_snp_selection': True, 'num_snps': 38138}. Best is trial 89 with value: 0.31639482456999446.
[I 2025-12-06 02:19:39,136] Trial 143 finished with value: 0.31151157819524494 and parameters: {'model_type': 'mlp', 'hidden_dims': '[512, 64]', 'dropout': 0.11818165196300179, 'batch_norm': True, 'lr': 3.2764755390393256e-05, 'weight_decay': 0.0007341868540859448, 'epochs': 319, 'loss': 'mse', 'optimizer': 'adam', 'graph_mode': 'off', 'use_snp_selection': True, 'num_snps': 52460}. Best is trial 89 with value: 0.31639482456999446.
[I 2025-12-06 02:21:02,154] Trial 144 finished with value: 0.3082867872094324 and parameters: {'model_type': 'mlp', 'hidden_dims': '[512, 64]', 'dropout': 0.11402215557897077, 'batch_norm': True, 'lr': 3.22801192325518e-05, 'weight_decay': 0.0007836392190328717, 'epochs': 316, 'loss': 'mse', 'optimizer': 'adam', 'graph_mode': 'off', 'use_snp_selection': True, 'num_snps': 52794}. Best is trial 89 with value: 0.31639482456999446.
[I 2025-12-06 02:22:23,508] Trial 145 finished with value: 0.30736074225245685 and parameters: {'model_type': 'mlp', 'hidden_dims': '[512, 64]', 'dropout': 0.1275383114970322, 'batch_norm': True, 'lr': 1.800064919108315e-05, 'weight_decay': 0.000679000455504428, 'epochs': 323, 'loss': 'mse', 'optimizer': 'adam', 'graph_mode': 'off', 'use_snp_selection': True, 'num_snps': 50700}. Best is trial 89 with value: 0.31639482456999446.
[I 2025-12-06 02:23:21,988] Trial 146 finished with value: 0.2999995783548266 and parameters: {'model_type': 'mlp', 'hidden_dims': '[512, 64]', 'dropout': 0.13802272501745633, 'batch_norm': True, 'lr': 2.377562707848025e-05, 'weight_decay': 0.0005518763802100461, 'epochs': 143, 'loss': 'mse', 'optimizer': 'adam', 'graph_mode': 'off', 'use_snp_selection': True, 'num_snps': 54958}. Best is trial 89 with value: 0.31639482456999446.
[I 2025-12-06 02:24:47,730] Trial 147 finished with value: 0.3121222309206565 and parameters: {'model_type': 'mlp', 'hidden_dims': '[512, 64]', 'dropout': 0.12200572430011289, 'batch_norm': True, 'lr': 2.928231731493952e-05, 'weight_decay': 0.0003846299209707, 'epochs': 303, 'loss': 'mse', 'optimizer': 'adam', 'graph_mode': 'off', 'use_snp_selection': True, 'num_snps': 57856}. Best is trial 89 with value: 0.31639482456999446.
[I 2025-12-06 02:26:14,225] Trial 148 finished with value: 0.3092946477385773 and parameters: {'model_type': 'mlp', 'hidden_dims': '[512, 64]', 'dropout': 0.17531506181279927, 'batch_norm': True, 'lr': 2.752778756329971e-05, 'weight_decay': 0.0003343103024391033, 'epochs': 302, 'loss': 'mse', 'optimizer': 'adam', 'graph_mode': 'off', 'use_snp_selection': True, 'num_snps': 58451}. Best is trial 89 with value: 0.31639482456999446.
[I 2025-12-06 02:27:15,140] Trial 149 finished with value: 0.2915222243388626 and parameters: {'model_type': 'mlp', 'hidden_dims': '[256, 128]', 'dropout': 0.18492381471567307, 'batch_norm': True, 'lr': 2.0699915344213477e-05, 'weight_decay': 0.00041735629771636314, 'epochs': 295, 'loss': 'mse', 'optimizer': 'adam', 'graph_mode': 'off', 'use_snp_selection': True, 'num_snps': 56467}. Best is trial 89 with value: 0.31639482456999446.
[I 2025-12-06 02:28:19,274] Trial 0 finished with value: 0.27279753473463403 and parameters: {'model_type': 'mlp', 'hidden_dims': '[128, 64]', 'dropout': 0.199031432379812, 'batch_norm': True, 'lr': 1.8408544111075837e-06, 'weight_decay': 5.5136510071208614e-05, 'epochs': 336, 'loss': 'mae', 'optimizer': 'adam', 'graph_mode': 'off', 'use_snp_selection': True, 'num_snps': 43862}. Best is trial 0 with value: 0.27279753473463403.
[I 2025-12-06 02:28:45,909] Trial 1 finished with value: 0.31398555176937043 and parameters: {'model_type': 'mlp', 'hidden_dims': '[256, 128]', 'dropout': 0.4370668075331726, 'batch_norm': True, 'lr': 7.133471581159139e-05, 'weight_decay': 1.128633586803549e-05, 'epochs': 242, 'loss': 'mae', 'optimizer': 'adam', 'graph_mode': 'off', 'use_snp_selection': False}. Best is trial 1 with value: 0.31398555176937043.
[I 2025-12-06 02:29:12,207] Trial 2 finished with value: 0.280409519062544 and parameters: {'model_type': 'mlp', 'hidden_dims': '[256, 128, 64]', 'dropout': 0.41314357415569625, 'batch_norm': False, 'lr': 3.952233718592101e-06, 'weight_decay': 0.00026754769258252603, 'epochs': 149, 'loss': 'mse', 'optimizer': 'adam', 'graph_mode': 'off', 'use_snp_selection': True, 'num_snps': 11571}. Best is trial 1 with value: 0.31398555176937043.
[I 2025-12-06 02:30:12,787] Trial 3 finished with value: 0.30944562078781035 and parameters: {'model_type': 'mlp', 'hidden_dims': '[512, 64]', 'dropout': 0.5938127374509361, 'batch_norm': False, 'lr': 5.67704586114731e-06, 'weight_decay': 2.4518087630137052e-05, 'epochs': 320, 'loss': 'mae', 'optimizer': 'adam', 'graph_mode': 'off', 'use_snp_selection': False}. Best is trial 1 with value: 0.31398555176937043.
[I 2025-12-06 02:31:12,922] Trial 4 finished with value: 0.2750875715879237 and parameters: {'model_type': 'mlp', 'hidden_dims': '[512, 128]', 'dropout': 0.25746343592134413, 'batch_norm': True, 'lr': 1.3467657668402788e-06, 'weight_decay': 0.00033087251918647806, 'epochs': 277, 'loss': 'mse', 'optimizer': 'adam', 'graph_mode': 'off', 'use_snp_selection': True, 'num_snps': 36675}. Best is trial 1 with value: 0.31398555176937043.
[I 2025-12-06 02:31:55,599] Trial 5 finished with value: 0.27064906636989267 and parameters: {'model_type': 'mlp', 'hidden_dims': '[512, 64]', 'dropout': 0.38275350994408375, 'batch_norm': True, 'lr': 1.5586664309232824e-06, 'weight_decay': 0.0008227664668621182, 'epochs': 145, 'loss': 'mae', 'optimizer': 'adam', 'graph_mode': 'off', 'use_snp_selection': True, 'num_snps': 32148}. Best is trial 1 with value: 0.31398555176937043.
[I 2025-12-06 02:32:18,160] Trial 6 finished with value: 0.309784365908163 and parameters: {'model_type': 'mlp', 'hidden_dims': '[256, 128]', 'dropout': 0.3930109900265879, 'batch_norm': False, 'lr': 4.892964372128395e-05, 'weight_decay': 1.5809549317992182e-06, 'epochs': 199, 'loss': 'mse', 'optimizer': 'adam', 'graph_mode': 'off', 'use_snp_selection': False}. Best is trial 1 with value: 0.31398555176937043.
[I 2025-12-06 02:32:40,362] Trial 7 finished with value: 0.31238996345093967 and parameters: {'model_type': 'mlp', 'hidden_dims': '[512, 256]', 'dropout': 0.15343979219678458, 'batch_norm': True, 'lr': 6.234003099047341e-05, 'weight_decay': 3.894760610535477e-07, 'epochs': 97, 'loss': 'mse', 'optimizer': 'adam', 'graph_mode': 'off', 'use_snp_selection': False}. Best is trial 1 with value: 0.31398555176937043.
[I 2025-12-06 02:33:40,240] Trial 8 finished with value: 0.31193474241823416 and parameters: {'model_type': 'mlp', 'hidden_dims': '[512, 128]', 'dropout': 0.10743001231661406, 'batch_norm': True, 'lr': 0.00023728538449271062, 'weight_decay': 1.7629071578048637e-05, 'epochs': 312, 'loss': 'mae', 'optimizer': 'adam', 'graph_mode': 'off', 'use_snp_selection': False}. Best is trial 1 with value: 0.31398555176937043.
[I 2025-12-06 02:34:16,043] Trial 9 finished with value: 0.31347492195194215 and parameters: {'model_type': 'mlp', 'hidden_dims': '[512, 64]', 'dropout': 0.14505336736221927, 'batch_norm': True, 'lr': 5.8619638388111826e-05, 'weight_decay': 6.200156172669308e-07, 'epochs': 175, 'loss': 'mse', 'optimizer': 'adam', 'graph_mode': 'off', 'use_snp_selection': False}. Best is trial 1 with value: 0.31398555176937043.
[I 2025-12-06 02:34:41,960] Trial 10 finished with value: 0.2318885450005153 and parameters: {'model_type': 'mlp', 'hidden_dims': '[256, 128]', 'dropout': 0.5365714961141473, 'batch_norm': False, 'lr': 0.00032955828969150785, 'weight_decay': 3.381683344261174e-06, 'epochs': 236, 'loss': 'mae', 'optimizer': 'adam', 'graph_mode': 'off', 'use_snp_selection': False}. Best is trial 1 with value: 0.31398555176937043.
[I 2025-12-06 02:35:06,961] Trial 11 finished with value: 0.30591555840877016 and parameters: {'model_type': 'mlp', 'hidden_dims': '[256, 128]', 'dropout': 0.2851700052976396, 'batch_norm': True, 'lr': 1.6474108386126448e-05, 'weight_decay': 1.2045055692919657e-07, 'epochs': 222, 'loss': 'mse', 'optimizer': 'adam', 'graph_mode': 'off', 'use_snp_selection': False}. Best is trial 1 with value: 0.31398555176937043.
[I 2025-12-06 02:35:19,659] Trial 12 finished with value: 0.31249190413414696 and parameters: {'model_type': 'mlp', 'hidden_dims': '[512, 64]', 'dropout': 0.4779690972965961, 'batch_norm': True, 'lr': 0.000121041789182661, 'weight_decay': 2.1974776777319986e-06, 'epochs': 43, 'loss': 'mae', 'optimizer': 'adam', 'graph_mode': 'off', 'use_snp_selection': False}. Best is trial 1 with value: 0.31398555176937043.
[I 2025-12-06 02:35:32,112] Trial 13 finished with value: 0.30436584830870517 and parameters: {'model_type': 'mlp', 'hidden_dims': '[128, 64]', 'dropout': 0.3041365173646664, 'batch_norm': True, 'lr': 1.8184704710575438e-05, 'weight_decay': 5.529355006935713e-07, 'epochs': 157, 'loss': 'mse', 'optimizer': 'adam', 'graph_mode': 'off', 'use_snp_selection': False}. Best is trial 1 with value: 0.31398555176937043.
[I 2025-12-06 02:36:00,971] Trial 14 finished with value: 0.31124246923144877 and parameters: {'model_type': 'mlp', 'hidden_dims': '[256, 128, 64]', 'dropout': 0.4668543239728036, 'batch_norm': True, 'lr': 0.0006681578335050954, 'weight_decay': 5.023111485526689e-06, 'epochs': 263, 'loss': 'mse', 'optimizer': 'adam', 'graph_mode': 'off', 'use_snp_selection': False}. Best is trial 1 with value: 0.31398555176937043.
[I 2025-12-06 02:36:39,584] Trial 15 finished with value: 0.3154072864453376 and parameters: {'model_type': 'mlp', 'hidden_dims': '[512, 256]', 'dropout': 0.2097289363457977, 'batch_norm': True, 'lr': 0.0001045571331345049, 'weight_decay': 6.682546297843178e-05, 'epochs': 190, 'loss': 'mae', 'optimizer': 'adam', 'graph_mode': 'off', 'use_snp_selection': False}. Best is trial 15 with value: 0.3154072864453376.
[I 2025-12-06 02:37:02,016] Trial 16 finished with value: 0.3179573060770403 and parameters: {'model_type': 'mlp', 'hidden_dims': '[512, 256]', 'dropout': 0.22781274601568705, 'batch_norm': True, 'lr': 0.00017549215405955411, 'weight_decay': 0.00011431726695115916, 'epochs': 98, 'loss': 'mae', 'optimizer': 'adam', 'graph_mode': 'off', 'use_snp_selection': False}. Best is trial 16 with value: 0.3179573060770403.
[I 2025-12-06 02:37:22,690] Trial 17 finished with value: 0.31446811616712017 and parameters: {'model_type': 'mlp', 'hidden_dims': '[512, 256]', 'dropout': 0.2203226251510242, 'batch_norm': True, 'lr': 0.000906375209920231, 'weight_decay': 0.00011856342958587011, 'epochs': 88, 'loss': 'mae', 'optimizer': 'adam', 'graph_mode': 'off', 'use_snp_selection': False}. Best is trial 16 with value: 0.3179573060770403.
[I 2025-12-06 02:38:18,816] Trial 18 finished with value: 0.3043063588442928 and parameters: {'model_type': 'mlp', 'hidden_dims': '[512, 256]', 'dropout': 0.32987616884302656, 'batch_norm': False, 'lr': 0.00015917794232643608, 'weight_decay': 5.8891443332300574e-05, 'epochs': 116, 'loss': 'mae', 'optimizer': 'adam', 'graph_mode': 'off', 'use_snp_selection': True, 'num_snps': 58241}. Best is trial 16 with value: 0.3179573060770403.
[I 2025-12-06 02:38:32,620] Trial 19 finished with value: 0.30739619218863207 and parameters: {'model_type': 'mlp', 'hidden_dims': '[512, 256]', 'dropout': 0.2255261129697436, 'batch_norm': True, 'lr': 2.443503678282962e-05, 'weight_decay': 0.00014276755743957846, 'epochs': 49, 'loss': 'mae', 'optimizer': 'adam', 'graph_mode': 'off', 'use_snp_selection': False}. Best is trial 16 with value: 0.3179573060770403.
[I 2025-12-06 02:38:58,762] Trial 20 finished with value: 0.3121673099610923 and parameters: {'model_type': 'mlp', 'hidden_dims': '[512, 256]', 'dropout': 0.17760657633908383, 'batch_norm': True, 'lr': 0.00043967429239271435, 'weight_decay': 4.679666515308887e-05, 'epochs': 119, 'loss': 'mae', 'optimizer': 'adam', 'graph_mode': 'off', 'use_snp_selection': False}. Best is trial 16 with value: 0.3179573060770403.
[I 2025-12-06 02:39:18,837] Trial 21 finished with value: 0.3171666880353531 and parameters: {'model_type': 'mlp', 'hidden_dims': '[512, 256]', 'dropout': 0.25263360354560555, 'batch_norm': True, 'lr': 0.0004673156216379674, 'weight_decay': 0.00013023874884750025, 'epochs': 85, 'loss': 'mae', 'optimizer': 'adam', 'graph_mode': 'off', 'use_snp_selection': False}. Best is trial 16 with value: 0.3179573060770403.
[I 2025-12-06 02:39:39,096] Trial 22 finished with value: 0.31030983327680906 and parameters: {'model_type': 'mlp', 'hidden_dims': '[512, 256]', 'dropout': 0.2544663741612563, 'batch_norm': True, 'lr': 0.00013909033232651778, 'weight_decay': 0.0003837936896780517, 'epochs': 86, 'loss': 'mae', 'optimizer': 'adam', 'graph_mode': 'off', 'use_snp_selection': False}. Best is trial 16 with value: 0.3179573060770403.
[I 2025-12-06 02:39:54,622] Trial 23 finished with value: 0.31059685802837295 and parameters: {'model_type': 'mlp', 'hidden_dims': '[512, 256]', 'dropout': 0.3342248724319328, 'batch_norm': True, 'lr': 0.00038466512322935366, 'weight_decay': 0.00012012303956871141, 'epochs': 59, 'loss': 'mae', 'optimizer': 'adam', 'graph_mode': 'off', 'use_snp_selection': False}. Best is trial 16 with value: 0.3179573060770403.
[I 2025-12-06 02:40:33,312] Trial 24 finished with value: 0.3173380932829125 and parameters: {'model_type': 'mlp', 'hidden_dims': '[512, 256]', 'dropout': 0.25525420557258827, 'batch_norm': True, 'lr': 0.0001993371167379768, 'weight_decay': 3.279592428637022e-05, 'epochs': 190, 'loss': 'mae', 'optimizer': 'adam', 'graph_mode': 'off', 'use_snp_selection': False}. Best is trial 16 with value: 0.3179573060770403.
[I 2025-12-06 02:41:00,363] Trial 25 finished with value: 0.31337124871883704 and parameters: {'model_type': 'mlp', 'hidden_dims': '[512, 256]', 'dropout': 0.2725986788877922, 'batch_norm': True, 'lr': 0.0002557080786642394, 'weight_decay': 0.0008835998501523608, 'epochs': 124, 'loss': 'mae', 'optimizer': 'adam', 'graph_mode': 'off', 'use_snp_selection': False}. Best is trial 16 with value: 0.3179573060770403.
