[I 2025-12-05 15:03:48,546] Trial 90 finished with value: 0.0460784811669436 and parameters: {'model_type': 'mlp', 'hidden_dims': '[128, 64]', 'dropout': 0.12419287385520822, 'batch_norm': False, 'lr': 4.306591149322593e-05, 'weight_decay': 7.105601133596986e-07, 'epochs': 223, 'loss': 'mse', 'optimizer': 'adam', 'graph_mode': 'off', 'use_snp_selection': False}. Best is trial 34 with value: 0.08422594760083942.
[I 2025-12-05 15:03:50,358] Trial 91 finished with value: -0.005303666282463444 and parameters: {'model_type': 'mlp', 'hidden_dims': '[128, 64]', 'dropout': 0.15570609345855685, 'batch_norm': False, 'lr': 7.373323026927483e-05, 'weight_decay': 1.9952319955933994e-07, 'epochs': 166, 'loss': 'mse', 'optimizer': 'adam', 'graph_mode': 'off', 'use_snp_selection': True, 'num_snps': 37373}. Best is trial 34 with value: 0.08422594760083942.
[I 2025-12-05 15:03:51,831] Trial 92 finished with value: 0.01743241886202941 and parameters: {'model_type': 'mlp', 'hidden_dims': '[128, 64]', 'dropout': 0.1515957198182944, 'batch_norm': False, 'lr': 6.072060368127499e-05, 'weight_decay': 1.207019462784637e-07, 'epochs': 185, 'loss': 'mse', 'optimizer': 'adam', 'graph_mode': 'off', 'use_snp_selection': True, 'num_snps': 25485}. Best is trial 34 with value: 0.08422594760083942.
[I 2025-12-05 15:03:54,125] Trial 93 finished with value: 0.029821545509576892 and parameters: {'model_type': 'mlp', 'hidden_dims': '[128, 64]', 'dropout': 0.13106305638867746, 'batch_norm': False, 'lr': 5.184799854057212e-05, 'weight_decay': 1.552240946149775e-07, 'epochs': 244, 'loss': 'mse', 'optimizer': 'adam', 'graph_mode': 'off', 'use_snp_selection': True, 'num_snps': 51017}. Best is trial 34 with value: 0.08422594760083942.
[I 2025-12-05 15:03:56,067] Trial 94 finished with value: 0.02288786021486384 and parameters: {'model_type': 'mlp', 'hidden_dims': '[128, 64]', 'dropout': 0.2711994845051353, 'batch_norm': False, 'lr': 7.05486811686461e-05, 'weight_decay': 2.1566110448321554e-07, 'epochs': 232, 'loss': 'mse', 'optimizer': 'adam', 'graph_mode': 'off', 'use_snp_selection': True, 'num_snps': 39310}. Best is trial 34 with value: 0.08422594760083942.
[I 2025-12-05 15:03:57,655] Trial 95 finished with value: 0.01110446500131871 and parameters: {'model_type': 'mlp', 'hidden_dims': '[128, 64]', 'dropout': 0.18820290239373158, 'batch_norm': False, 'lr': 2.2636316796943265e-06, 'weight_decay': 3.744295984866663e-07, 'epochs': 194, 'loss': 'mse', 'optimizer': 'adam', 'graph_mode': 'off', 'use_snp_selection': True, 'num_snps': 30198}. Best is trial 34 with value: 0.08422594760083942.
[I 2025-12-05 15:03:58,853] Trial 96 finished with value: 0.0027840110772874523 and parameters: {'model_type': 'mlp', 'hidden_dims': '[128, 64]', 'dropout': 0.1371615534011412, 'batch_norm': False, 'lr': 9.02473787055592e-05, 'weight_decay': 2.755102404629629e-07, 'epochs': 218, 'loss': 'mse', 'optimizer': 'adam', 'graph_mode': 'off', 'use_snp_selection': True, 'num_snps': 15692}. Best is trial 34 with value: 0.08422594760083942.
[I 2025-12-05 15:04:00,287] Trial 97 finished with value: 0.08135421626006582 and parameters: {'model_type': 'mlp', 'hidden_dims': '[512, 64]', 'dropout': 0.11587942019980757, 'batch_norm': False, 'lr': 3.541949730984951e-05, 'weight_decay': 1.0106150328028644e-07, 'epochs': 172, 'loss': 'mse', 'optimizer': 'adam', 'graph_mode': 'off', 'use_snp_selection': False}. Best is trial 34 with value: 0.08422594760083942.
[I 2025-12-05 15:04:01,839] Trial 98 finished with value: 0.043171291502084624 and parameters: {'model_type': 'mlp', 'hidden_dims': '[512, 64]', 'dropout': 0.23469973246778086, 'batch_norm': True, 'lr': 3.5308820833931344e-05, 'weight_decay': 1.0946555530468708e-07, 'epochs': 203, 'loss': 'mse', 'optimizer': 'adam', 'graph_mode': 'off', 'use_snp_selection': False}. Best is trial 34 with value: 0.08422594760083942.
[I 2025-12-05 15:04:03,272] Trial 99 finished with value: 0.03500350779989371 and parameters: {'model_type': 'mlp', 'hidden_dims': '[512, 64]', 'dropout': 0.16703939954291497, 'batch_norm': False, 'lr': 2.8467261089770528e-05, 'weight_decay': 1.6227125255028768e-07, 'epochs': 178, 'loss': 'mse', 'optimizer': 'adam', 'graph_mode': 'off', 'use_snp_selection': False}. Best is trial 34 with value: 0.08422594760083942.
[I 2025-12-05 15:04:04,592] Trial 100 finished with value: 0.031155120808553143 and parameters: {'model_type': 'mlp', 'hidden_dims': '[512, 64]', 'dropout': 0.11585016888371766, 'batch_norm': False, 'lr': 4.2889794491370054e-05, 'weight_decay': 1.3083184100669444e-07, 'epochs': 143, 'loss': 'mse', 'optimizer': 'adam', 'graph_mode': 'off', 'use_snp_selection': False}. Best is trial 34 with value: 0.08422594760083942.
[I 2025-12-05 15:04:05,826] Trial 101 finished with value: 0.0397728704953813 and parameters: {'model_type': 'mlp', 'hidden_dims': '[512, 64]', 'dropout': 0.13874490389136723, 'batch_norm': False, 'lr': 4.927353350342744e-05, 'weight_decay': 1.973840360898615e-07, 'epochs': 124, 'loss': 'mse', 'optimizer': 'adam', 'graph_mode': 'off', 'use_snp_selection': False}. Best is trial 34 with value: 0.08422594760083942.
[I 2025-12-05 15:04:06,634] Trial 102 finished with value: 0.020342319919165266 and parameters: {'model_type': 'mlp', 'hidden_dims': '[128, 64]', 'dropout': 0.26138428537708824, 'batch_norm': False, 'lr': 8.007603293630872e-05, 'weight_decay': 5.771339955881406e-07, 'epochs': 170, 'loss': 'mse', 'optimizer': 'adam', 'graph_mode': 'off', 'use_snp_selection': False}. Best is trial 34 with value: 0.08422594760083942.
[I 2025-12-05 15:04:07,404] Trial 103 finished with value: 0.027493876661100775 and parameters: {'model_type': 'mlp', 'hidden_dims': '[128, 64]', 'dropout': 0.16433684389003705, 'batch_norm': False, 'lr': 0.00011988164039083133, 'weight_decay': 8.905975441257702e-07, 'epochs': 158, 'loss': 'mse', 'optimizer': 'adam', 'graph_mode': 'off', 'use_snp_selection': False}. Best is trial 34 with value: 0.08422594760083942.
[I 2025-12-05 15:04:08,208] Trial 104 finished with value: 0.03169692415366358 and parameters: {'model_type': 'mlp', 'hidden_dims': '[128, 64]', 'dropout': 0.10151747567749837, 'batch_norm': False, 'lr': 6.697555945197128e-05, 'weight_decay': 1.7632073357623127e-07, 'epochs': 187, 'loss': 'mse', 'optimizer': 'adam', 'graph_mode': 'off', 'use_snp_selection': False}. Best is trial 34 with value: 0.08422594760083942.
[I 2025-12-05 15:04:09,099] Trial 105 finished with value: 0.018003783284883546 and parameters: {'model_type': 'mlp', 'hidden_dims': '[128, 64]', 'dropout': 0.11619861892304902, 'batch_norm': False, 'lr': 3.829301747815602e-05, 'weight_decay': 2.835981221202925e-07, 'epochs': 229, 'loss': 'mse', 'optimizer': 'adam', 'graph_mode': 'off', 'use_snp_selection': False}. Best is trial 34 with value: 0.08422594760083942.
[I 2025-12-05 15:04:10,195] Trial 106 finished with value: -0.0081546634412326 and parameters: {'model_type': 'mlp', 'hidden_dims': '[256, 128, 64]', 'dropout': 0.30019808661313485, 'batch_norm': False, 'lr': 2.4096670073529772e-05, 'weight_decay': 2.542335302418813e-07, 'epochs': 211, 'loss': 'mse', 'optimizer': 'adam', 'graph_mode': 'off', 'use_snp_selection': False}. Best is trial 34 with value: 0.08422594760083942.
[I 2025-12-05 15:04:11,607] Trial 107 finished with value: 0.044158798229869095 and parameters: {'model_type': 'mlp', 'hidden_dims': '[512, 64]', 'dropout': 0.20735294831262807, 'batch_norm': False, 'lr': 0.00021942184902379582, 'weight_decay': 1.0008995451853861e-07, 'epochs': 172, 'loss': 'mse', 'optimizer': 'adam', 'graph_mode': 'off', 'use_snp_selection': False}. Best is trial 34 with value: 0.08422594760083942.
[I 2025-12-05 15:04:12,514] Trial 108 finished with value: 0.0645288105211782 and parameters: {'model_type': 'mlp', 'hidden_dims': '[128, 64]', 'dropout': 0.14852997932977827, 'batch_norm': True, 'lr': 5.608844697262198e-05, 'weight_decay': 1.338225212612621e-07, 'epochs': 194, 'loss': 'mse', 'optimizer': 'adam', 'graph_mode': 'off', 'use_snp_selection': False}. Best is trial 34 with value: 0.08422594760083942.
[I 2025-12-05 15:04:13,380] Trial 109 finished with value: 0.010404943027106529 and parameters: {'model_type': 'mlp', 'hidden_dims': '[128, 64]', 'dropout': 0.2483129658932517, 'batch_norm': True, 'lr': 5.5274159274173765e-05, 'weight_decay': 1.3621280634657172e-07, 'epochs': 196, 'loss': 'mse', 'optimizer': 'adam', 'graph_mode': 'off', 'use_snp_selection': False}. Best is trial 34 with value: 0.08422594760083942.
[I 2025-12-05 15:04:14,300] Trial 110 finished with value: 0.020471278142971408 and parameters: {'model_type': 'mlp', 'hidden_dims': '[128, 64]', 'dropout': 0.2255034366391916, 'batch_norm': True, 'lr': 3.3066892625807814e-05, 'weight_decay': 1.398863362439787e-07, 'epochs': 240, 'loss': 'mse', 'optimizer': 'adam', 'graph_mode': 'off', 'use_snp_selection': False}. Best is trial 34 with value: 0.08422594760083942.
[I 2025-12-05 15:04:15,153] Trial 111 finished with value: 0.07774543279818763 and parameters: {'model_type': 'mlp', 'hidden_dims': '[128, 64]', 'dropout': 0.1487358335005401, 'batch_norm': True, 'lr': 9.633475492697909e-05, 'weight_decay': 1.8415928563915423e-07, 'epochs': 190, 'loss': 'mse', 'optimizer': 'adam', 'graph_mode': 'off', 'use_snp_selection': False}. Best is trial 34 with value: 0.08422594760083942.
[I 2025-12-05 15:04:16,043] Trial 112 finished with value: 0.03433286280932827 and parameters: {'model_type': 'mlp', 'hidden_dims': '[128, 64]', 'dropout': 0.15543748934154614, 'batch_norm': True, 'lr': 6.513417788769068e-05, 'weight_decay': 3.9397393913447847e-07, 'epochs': 191, 'loss': 'mse', 'optimizer': 'adam', 'graph_mode': 'off', 'use_snp_selection': False}. Best is trial 34 with value: 0.08422594760083942.
[I 2025-12-05 15:04:16,942] Trial 113 finished with value: 0.03204765670931576 and parameters: {'model_type': 'mlp', 'hidden_dims': '[128, 64]', 'dropout': 0.18698367311016845, 'batch_norm': True, 'lr': 0.00010105304211177522, 'weight_decay': 2.3557273804746314e-07, 'epochs': 222, 'loss': 'mse', 'optimizer': 'adam', 'graph_mode': 'off', 'use_snp_selection': False}. Best is trial 34 with value: 0.08422594760083942.
[I 2025-12-05 15:04:17,875] Trial 114 finished with value: 0.030257485582213486 and parameters: {'model_type': 'mlp', 'hidden_dims': '[128, 64]', 'dropout': 0.11554057249136815, 'batch_norm': True, 'lr': 4.926250853468916e-05, 'weight_decay': 1.2746115162314652e-07, 'epochs': 249, 'loss': 'mse', 'optimizer': 'adam', 'graph_mode': 'off', 'use_snp_selection': False}. Best is trial 34 with value: 0.08422594760083942.
[I 2025-12-05 15:04:18,758] Trial 115 finished with value: 0.036881217693238905 and parameters: {'model_type': 'mlp', 'hidden_dims': '[128, 64]', 'dropout': 0.18010147013937142, 'batch_norm': True, 'lr': 0.0001579146591369286, 'weight_decay': 3.287228275319416e-07, 'epochs': 214, 'loss': 'mse', 'optimizer': 'adam', 'graph_mode': 'off', 'use_snp_selection': False}. Best is trial 34 with value: 0.08422594760083942.
[I 2025-12-05 15:04:20,338] Trial 116 finished with value: -0.008998884710512904 and parameters: {'model_type': 'mlp', 'hidden_dims': '[512, 128]', 'dropout': 0.3411832575815905, 'batch_norm': True, 'lr': 4.36599973220822e-06, 'weight_decay': 1.7015175476021454e-07, 'epochs': 204, 'loss': 'mse', 'optimizer': 'adam', 'graph_mode': 'off', 'use_snp_selection': False}. Best is trial 34 with value: 0.08422594760083942.
[I 2025-12-05 15:04:21,180] Trial 117 finished with value: 0.008250120660888932 and parameters: {'model_type': 'mlp', 'hidden_dims': '[128, 64]', 'dropout': 0.27890367099600566, 'batch_norm': True, 'lr': 1.5895549481493725e-05, 'weight_decay': 4.76848683584209e-07, 'epochs': 180, 'loss': 'mse', 'optimizer': 'adam', 'graph_mode': 'off', 'use_snp_selection': False}. Best is trial 34 with value: 0.08422594760083942.
[I 2025-12-05 15:04:22,029] Trial 118 finished with value: 0.03515557709688764 and parameters: {'model_type': 'mlp', 'hidden_dims': '[128, 64]', 'dropout': 0.19639752761054202, 'batch_norm': True, 'lr': 0.0009864527267273893, 'weight_decay': 2.2130017769265644e-07, 'epochs': 187, 'loss': 'mse', 'optimizer': 'adam', 'graph_mode': 'off', 'use_snp_selection': False}. Best is trial 34 with value: 0.08422594760083942.
[I 2025-12-05 15:04:23,781] Trial 119 finished with value: 0.06158944356610336 and parameters: {'model_type': 'mlp', 'hidden_dims': '[512, 64]', 'dropout': 0.3115242462023586, 'batch_norm': True, 'lr': 3.892968108284048e-05, 'weight_decay': 3.0674346168751474e-07, 'epochs': 256, 'loss': 'mse', 'optimizer': 'adam', 'graph_mode': 'off', 'use_snp_selection': False}. Best is trial 34 with value: 0.08422594760083942.
[I 2025-12-05 15:04:25,588] Trial 120 finished with value: 0.024063007513785685 and parameters: {'model_type': 'mlp', 'hidden_dims': '[512, 64]', 'dropout': 0.3061492707081941, 'batch_norm': True, 'lr': 3.070379861223503e-05, 'weight_decay': 3.6005626723423343e-07, 'epochs': 262, 'loss': 'mse', 'optimizer': 'adam', 'graph_mode': 'off', 'use_snp_selection': False}. Best is trial 34 with value: 0.08422594760083942.
[I 2025-12-05 15:04:27,511] Trial 121 finished with value: -0.0007510101905425457 and parameters: {'model_type': 'mlp', 'hidden_dims': '[512, 64]', 'dropout': 0.32970814642194535, 'batch_norm': True, 'lr': 3.1277774494577673e-06, 'weight_decay': 6.528705743924334e-07, 'epochs': 291, 'loss': 'mse', 'optimizer': 'adam', 'graph_mode': 'off', 'use_snp_selection': False}. Best is trial 34 with value: 0.08422594760083942.
[I 2025-12-05 15:04:29,190] Trial 122 finished with value: 0.05017307719627681 and parameters: {'model_type': 'mlp', 'hidden_dims': '[512, 64]', 'dropout': 0.17505721553316053, 'batch_norm': True, 'lr': 4.441527788066757e-05, 'weight_decay': 8.241950313280516e-06, 'epochs': 228, 'loss': 'mse', 'optimizer': 'adam', 'graph_mode': 'off', 'use_snp_selection': False}. Best is trial 34 with value: 0.08422594760083942.
[I 2025-12-05 15:04:30,941] Trial 123 finished with value: 0.029025551478342064 and parameters: {'model_type': 'mlp', 'hidden_dims': '[512, 64]', 'dropout': 0.3176459842963055, 'batch_norm': True, 'lr': 4.031764390127302e-05, 'weight_decay': 2.9741117021444987e-07, 'epochs': 255, 'loss': 'mse', 'optimizer': 'adam', 'graph_mode': 'off', 'use_snp_selection': False}. Best is trial 34 with value: 0.08422594760083942.
[I 2025-12-05 15:04:31,858] Trial 124 finished with value: 0.01455178847451387 and parameters: {'model_type': 'mlp', 'hidden_dims': '[128, 64]', 'dropout': 0.29403845597460143, 'batch_norm': True, 'lr': 5.647655969954712e-05, 'weight_decay': 1.8024826081296478e-07, 'epochs': 235, 'loss': 'mse', 'optimizer': 'adam', 'graph_mode': 'off', 'use_snp_selection': False}. Best is trial 34 with value: 0.08422594760083942.
[I 2025-12-05 15:04:33,421] Trial 125 finished with value: 0.025840695415367213 and parameters: {'model_type': 'mlp', 'hidden_dims': '[512, 128]', 'dropout': 0.2576014354567298, 'batch_norm': True, 'lr': 2.5235276285907372e-05, 'weight_decay': 1.1911545903533864e-07, 'epochs': 207, 'loss': 'mse', 'optimizer': 'adam', 'graph_mode': 'off', 'use_snp_selection': False}. Best is trial 34 with value: 0.08422594760083942.
[I 2025-12-05 15:04:34,641] Trial 126 finished with value: 0.04064495421454836 and parameters: {'model_type': 'mlp', 'hidden_dims': '[256, 128, 64]', 'dropout': 0.15207821290592913, 'batch_norm': False, 'lr': 8.882172943255866e-05, 'weight_decay': 1.4451693443773037e-07, 'epochs': 275, 'loss': 'mse', 'optimizer': 'adam', 'graph_mode': 'off', 'use_snp_selection': False}. Best is trial 34 with value: 0.08422594760083942.
[I 2025-12-05 15:04:35,596] Trial 127 finished with value: -0.023407777415364386 and parameters: {'model_type': 'mlp', 'hidden_dims': '[128, 64]', 'dropout': 0.355990780893095, 'batch_norm': True, 'lr': 2.2373431367115067e-05, 'weight_decay': 2.1451988964323556e-05, 'epochs': 245, 'loss': 'mse', 'optimizer': 'adam', 'graph_mode': 'off', 'use_snp_selection': False}. Best is trial 34 with value: 0.08422594760083942.
[I 2025-12-05 15:04:36,447] Trial 128 finished with value: 0.02304411693820774 and parameters: {'model_type': 'mlp', 'hidden_dims': '[128, 64]', 'dropout': 0.2799153986763653, 'batch_norm': False, 'lr': 7.766723577327513e-05, 'weight_decay': 2.1846588526183265e-07, 'epochs': 220, 'loss': 'mse', 'optimizer': 'adam', 'graph_mode': 'off', 'use_snp_selection': False}. Best is trial 34 with value: 0.08422594760083942.
[I 2025-12-05 15:04:37,963] Trial 129 finished with value: 0.021435748318629485 and parameters: {'model_type': 'mlp', 'hidden_dims': '[512, 64]', 'dropout': 0.22964273621532091, 'batch_norm': False, 'lr': 6.075338110361187e-05, 'weight_decay': 4.253176416270637e-07, 'epochs': 199, 'loss': 'mse', 'optimizer': 'adam', 'graph_mode': 'off', 'use_snp_selection': False}. Best is trial 34 with value: 0.08422594760083942.
[I 2025-12-05 15:04:38,858] Trial 130 finished with value: 0.03468543310952093 and parameters: {'model_type': 'mlp', 'hidden_dims': '[128, 64]', 'dropout': 0.1320155743603785, 'batch_norm': False, 'lr': 3.6339070559656424e-05, 'weight_decay': 1.0264282617242382e-07, 'epochs': 266, 'loss': 'mse', 'optimizer': 'adam', 'graph_mode': 'off', 'use_snp_selection': False}. Best is trial 34 with value: 0.08422594760083942.
[I 2025-12-05 15:04:41,155] Trial 131 finished with value: 0.04819187899889428 and parameters: {'model_type': 'mlp', 'hidden_dims': '[128, 64]', 'dropout': 0.1472127191341497, 'batch_norm': False, 'lr': 6.769241317376041e-05, 'weight_decay': 1.9028860847514776e-07, 'epochs': 169, 'loss': 'mse', 'optimizer': 'adam', 'graph_mode': 'off', 'use_snp_selection': True, 'num_snps': 53967}. Best is trial 34 with value: 0.08422594760083942.
[I 2025-12-05 15:04:43,148] Trial 132 finished with value: 0.03859686713931037 and parameters: {'model_type': 'mlp', 'hidden_dims': '[128, 64]', 'dropout': 0.14219247524037176, 'batch_norm': False, 'lr': 0.00013204410705270687, 'weight_decay': 2.7155304050288376e-07, 'epochs': 159, 'loss': 'mse', 'optimizer': 'adam', 'graph_mode': 'off', 'use_snp_selection': True, 'num_snps': 42317}. Best is trial 34 with value: 0.08422594760083942.
[I 2025-12-05 15:04:43,964] Trial 133 finished with value: 0.040679897854093254 and parameters: {'model_type': 'mlp', 'hidden_dims': '[128, 64]', 'dropout': 0.16215618542685117, 'batch_norm': False, 'lr': 1.3513921005781563e-05, 'weight_decay': 1.1666516138691875e-05, 'epochs': 176, 'loss': 'mse', 'optimizer': 'adam', 'graph_mode': 'off', 'use_snp_selection': False}. Best is trial 34 with value: 0.08422594760083942.
[I 2025-12-05 15:04:44,779] Trial 134 finished with value: 0.041124383995334045 and parameters: {'model_type': 'mlp', 'hidden_dims': '[128, 64]', 'dropout': 0.34006832911403256, 'batch_norm': False, 'lr': 4.637996148543239e-05, 'weight_decay': 1.6822548388446417e-07, 'epochs': 194, 'loss': 'mse', 'optimizer': 'adam', 'graph_mode': 'off', 'use_snp_selection': False}. Best is trial 34 with value: 0.08422594760083942.
[I 2025-12-05 15:04:45,607] Trial 135 finished with value: 0.04432777450047963 and parameters: {'model_type': 'mlp', 'hidden_dims': '[128, 64]', 'dropout': 0.12429593922040796, 'batch_norm': False, 'lr': 7.574754093575038e-05, 'weight_decay': 2.962050986835006e-05, 'epochs': 211, 'loss': 'mse', 'optimizer': 'adam', 'graph_mode': 'off', 'use_snp_selection': False}. Best is trial 34 with value: 0.08422594760083942.
[I 2025-12-05 15:04:46,405] Trial 136 finished with value: 0.05575173552140958 and parameters: {'model_type': 'mlp', 'hidden_dims': '[128, 64]', 'dropout': 0.3130293739810419, 'batch_norm': False, 'lr': 0.00010031886957697214, 'weight_decay': 2.104999916765835e-07, 'epochs': 182, 'loss': 'mse', 'optimizer': 'adam', 'graph_mode': 'off', 'use_snp_selection': False}. Best is trial 34 with value: 0.08422594760083942.
[I 2025-12-05 15:04:47,204] Trial 137 finished with value: -0.0039037704090022773 and parameters: {'model_type': 'mlp', 'hidden_dims': '[128, 64]', 'dropout': 0.30809130377123056, 'batch_norm': False, 'lr': 9.508235057788895e-05, 'weight_decay': 3.303757835921493e-07, 'epochs': 182, 'loss': 'mse', 'optimizer': 'adam', 'graph_mode': 'off', 'use_snp_selection': False}. Best is trial 34 with value: 0.08422594760083942.
[I 2025-12-05 15:04:48,734] Trial 138 finished with value: 0.045739110465009995 and parameters: {'model_type': 'mlp', 'hidden_dims': '[512, 128]', 'dropout': 0.32100656532428906, 'batch_norm': True, 'lr': 1.9092115234264984e-05, 'weight_decay': 2.4645969391664465e-07, 'epochs': 189, 'loss': 'mse', 'optimizer': 'adam', 'graph_mode': 'off', 'use_snp_selection': False}. Best is trial 34 with value: 0.08422594760083942.
[I 2025-12-05 15:04:50,349] Trial 139 finished with value: 0.03225288943901562 and parameters: {'model_type': 'mlp', 'hidden_dims': '[512, 64]', 'dropout': 0.26603433300168416, 'batch_norm': False, 'lr': 2.828552233530624e-05, 'weight_decay': 1.333659404570078e-07, 'epochs': 225, 'loss': 'mse', 'optimizer': 'adam', 'graph_mode': 'off', 'use_snp_selection': False}. Best is trial 34 with value: 0.08422594760083942.
[I 2025-12-05 15:04:51,216] Trial 140 finished with value: 0.021315523506340164 and parameters: {'model_type': 'mlp', 'hidden_dims': '[128, 64]', 'dropout': 0.2955875963083928, 'batch_norm': False, 'lr': 0.00018011386656706168, 'weight_decay': 0.000502239846196226, 'epochs': 241, 'loss': 'mse', 'optimizer': 'adam', 'graph_mode': 'off', 'use_snp_selection': False}. Best is trial 34 with value: 0.08422594760083942.
[I 2025-12-05 15:04:52,010] Trial 141 finished with value: 0.020499554032688994 and parameters: {'model_type': 'mlp', 'hidden_dims': '[128, 64]', 'dropout': 0.24383317104603008, 'batch_norm': False, 'lr': 0.00010869888514911242, 'weight_decay': 2.202845993225373e-07, 'epochs': 153, 'loss': 'mse', 'optimizer': 'adam', 'graph_mode': 'off', 'use_snp_selection': False}. Best is trial 34 with value: 0.08422594760083942.
