[I 2025-12-05 21:41:30,701] Trial 17 finished with value: 0.2032144695163877 and parameters: {'model_type': 'mlp', 'hidden_dims': '[512, 256]', 'dropout': 0.31793710483525317, 'batch_norm': True, 'lr': 0.00018031610994843547, 'weight_decay': 4.368059241049692e-06, 'epochs': 43, 'loss': 'mse', 'optimizer': 'adam', 'graph_mode': 'off', 'use_snp_selection': False}. Best is trial 7 with value: 0.21015320505109805.
[I 2025-12-05 21:42:50,256] Trial 18 finished with value: 0.13038146455688523 and parameters: {'model_type': 'mlp', 'hidden_dims': '[512, 256]', 'dropout': 0.2312628506238401, 'batch_norm': False, 'lr': 0.0009700460844600156, 'weight_decay': 2.66041496444795e-07, 'epochs': 121, 'loss': 'mse', 'optimizer': 'adam', 'graph_mode': 'off', 'use_snp_selection': True, 'num_snps': 58241}. Best is trial 7 with value: 0.21015320505109805.
[I 2025-12-05 21:43:20,950] Trial 19 finished with value: 0.16145470077790192 and parameters: {'model_type': 'mlp', 'hidden_dims': '[512, 64]', 'dropout': 0.15434656230825822, 'batch_norm': True, 'lr': 1.0436614786391874e-05, 'weight_decay': 5.204760421597671e-06, 'epochs': 84, 'loss': 'mse', 'optimizer': 'adam', 'graph_mode': 'off', 'use_snp_selection': False}. Best is trial 7 with value: 0.21015320505109805.
[I 2025-12-05 21:44:12,483] Trial 20 finished with value: 0.20897541277475198 and parameters: {'model_type': 'mlp', 'hidden_dims': '[512, 128]', 'dropout': 0.3376262867581705, 'batch_norm': True, 'lr': 0.00010819146253297384, 'weight_decay': 4.679666515308887e-05, 'epochs': 158, 'loss': 'mse', 'optimizer': 'adam', 'graph_mode': 'off', 'use_snp_selection': False}. Best is trial 7 with value: 0.21015320505109805.
[I 2025-12-05 21:45:00,087] Trial 21 finished with value: 0.2041068607263598 and parameters: {'model_type': 'mlp', 'hidden_dims': '[512, 128]', 'dropout': 0.47632191147621256, 'batch_norm': True, 'lr': 9.935931292459106e-05, 'weight_decay': 6.331291676273367e-05, 'epochs': 143, 'loss': 'mse', 'optimizer': 'adam', 'graph_mode': 'off', 'use_snp_selection': False}. Best is trial 7 with value: 0.21015320505109805.
[I 2025-12-05 21:45:53,251] Trial 22 finished with value: 0.1962380673711905 and parameters: {'model_type': 'mlp', 'hidden_dims': '[512, 128]', 'dropout': 0.3442993429628492, 'batch_norm': True, 'lr': 3.511276726977528e-05, 'weight_decay': 4.6881323524619394e-05, 'epochs': 162, 'loss': 'mse', 'optimizer': 'adam', 'graph_mode': 'off', 'use_snp_selection': False}. Best is trial 7 with value: 0.21015320505109805.
[I 2025-12-05 21:47:02,037] Trial 23 finished with value: 0.2065235648321948 and parameters: {'model_type': 'mlp', 'hidden_dims': '[512, 128]', 'dropout': 0.2332773239964132, 'batch_norm': True, 'lr': 0.0003016140254855497, 'weight_decay': 0.00014061128063276327, 'epochs': 217, 'loss': 'mse', 'optimizer': 'adam', 'graph_mode': 'off', 'use_snp_selection': False}. Best is trial 7 with value: 0.21015320505109805.
[I 2025-12-05 21:47:26,407] Trial 24 finished with value: 0.1934677714907297 and parameters: {'model_type': 'mlp', 'hidden_dims': '[256, 128]', 'dropout': 0.5723214760704807, 'batch_norm': True, 'lr': 0.00012933696064794652, 'weight_decay': 7.155673581155691e-06, 'epochs': 124, 'loss': 'mse', 'optimizer': 'adam', 'graph_mode': 'off', 'use_snp_selection': False}. Best is trial 7 with value: 0.21015320505109805.
[I 2025-12-05 21:47:44,240] Trial 25 finished with value: 0.1977107487410443 and parameters: {'model_type': 'mlp', 'hidden_dims': '[256, 128, 64]', 'dropout': 0.1337666292612962, 'batch_norm': True, 'lr': 0.000484327050340622, 'weight_decay': 1.8115377144144532e-06, 'epochs': 78, 'loss': 'mse', 'optimizer': 'adam', 'graph_mode': 'off', 'use_snp_selection': False}. Best is trial 7 with value: 0.21015320505109805.
[I 2025-12-05 21:48:17,146] Trial 26 finished with value: 0.1438078430729802 and parameters: {'model_type': 'mlp', 'hidden_dims': '[128, 64]', 'dropout': 0.5327197320987523, 'batch_norm': True, 'lr': 3.5652153356401597e-05, 'weight_decay': 2.7383500740357065e-05, 'epochs': 241, 'loss': 'mae', 'optimizer': 'adam', 'graph_mode': 'off', 'use_snp_selection': True, 'num_snps': 3842}. Best is trial 7 with value: 0.21015320505109805.
[I 2025-12-05 21:49:18,671] Trial 27 finished with value: 0.19481869476350216 and parameters: {'model_type': 'mlp', 'hidden_dims': '[512, 256]', 'dropout': 0.22220326384964104, 'batch_norm': False, 'lr': 9.071120844048233e-05, 'weight_decay': 3.1721174960915974e-07, 'epochs': 199, 'loss': 'mse', 'optimizer': 'adam', 'graph_mode': 'off', 'use_snp_selection': False}. Best is trial 7 with value: 0.21015320505109805.
[I 2025-12-05 21:49:53,353] Trial 28 finished with value: 0.19771003138009707 and parameters: {'model_type': 'mlp', 'hidden_dims': '[512, 64]', 'dropout': 0.28071871550615585, 'batch_norm': True, 'lr': 0.00016622650300031908, 'weight_decay': 0.0001172224663475062, 'epochs': 97, 'loss': 'mse', 'optimizer': 'adam', 'graph_mode': 'off', 'use_snp_selection': False}. Best is trial 7 with value: 0.21015320505109805.
[I 2025-12-05 21:50:30,642] Trial 29 finished with value: 0.16971784101359672 and parameters: {'model_type': 'mlp', 'hidden_dims': '[128, 64]', 'dropout': 0.17506263398251654, 'batch_norm': True, 'lr': 5.2004146898908164e-05, 'weight_decay': 1.2876228840363315e-05, 'epochs': 65, 'loss': 'mae', 'optimizer': 'adam', 'graph_mode': 'off', 'use_snp_selection': True, 'num_snps': 19468}. Best is trial 7 with value: 0.21015320505109805.
[I 2025-12-05 21:51:13,869] Trial 30 finished with value: 0.18462355213414838 and parameters: {'model_type': 'mlp', 'hidden_dims': '[512, 128]', 'dropout': 0.3219183103721302, 'batch_norm': True, 'lr': 1.0845091371785035e-05, 'weight_decay': 2.8032487386946294e-06, 'epochs': 129, 'loss': 'mse', 'optimizer': 'adam', 'graph_mode': 'off', 'use_snp_selection': False}. Best is trial 7 with value: 0.21015320505109805.
[I 2025-12-05 21:52:08,774] Trial 31 finished with value: 0.21126628997076163 and parameters: {'model_type': 'mlp', 'hidden_dims': '[512, 64]', 'dropout': 0.13415760552771047, 'batch_norm': True, 'lr': 6.217431627436781e-05, 'weight_decay': 7.773935432591092e-07, 'epochs': 170, 'loss': 'mse', 'optimizer': 'adam', 'graph_mode': 'off', 'use_snp_selection': False}. Best is trial 31 with value: 0.21126628997076163.
[I 2025-12-05 21:53:03,600] Trial 32 finished with value: 0.20153281503272297 and parameters: {'model_type': 'mlp', 'hidden_dims': '[512, 64]', 'dropout': 0.1277334570966638, 'batch_norm': True, 'lr': 8.243559570362877e-05, 'weight_decay': 9.644128140876098e-07, 'epochs': 169, 'loss': 'mse', 'optimizer': 'adam', 'graph_mode': 'off', 'use_snp_selection': False}. Best is trial 31 with value: 0.21126628997076163.
[I 2025-12-05 21:53:54,232] Trial 33 finished with value: 0.21897778420797964 and parameters: {'model_type': 'mlp', 'hidden_dims': '[512, 64]', 'dropout': 0.19547990147536237, 'batch_norm': True, 'lr': 6.56812534199945e-05, 'weight_decay': 1.9437687383595705e-07, 'epochs': 154, 'loss': 'mse', 'optimizer': 'adam', 'graph_mode': 'off', 'use_snp_selection': False}. Best is trial 33 with value: 0.21897778420797964.
[I 2025-12-05 21:54:54,251] Trial 34 finished with value: 0.19838656272675775 and parameters: {'model_type': 'mlp', 'hidden_dims': '[512, 64]', 'dropout': 0.17351563595902184, 'batch_norm': True, 'lr': 2.9472982348637156e-05, 'weight_decay': 2.1005634256672667e-07, 'epochs': 187, 'loss': 'mae', 'optimizer': 'adam', 'graph_mode': 'off', 'use_snp_selection': False}. Best is trial 33 with value: 0.21897778420797964.
[I 2025-12-05 21:55:38,924] Trial 35 finished with value: 0.2056538244249762 and parameters: {'model_type': 'mlp', 'hidden_dims': '[512, 64]', 'dropout': 0.20795347464532, 'batch_norm': False, 'lr': 6.0795762765271074e-05, 'weight_decay': 1.9876171605951303e-07, 'epochs': 136, 'loss': 'mse', 'optimizer': 'adam', 'graph_mode': 'off', 'use_snp_selection': False}. Best is trial 33 with value: 0.21897778420797964.
[I 2025-12-05 21:57:35,540] Trial 36 finished with value: 0.198488318101097 and parameters: {'model_type': 'mlp', 'hidden_dims': '[512, 64]', 'dropout': 0.25053068189896693, 'batch_norm': True, 'lr': 0.00018336890780698946, 'weight_decay': 4.128774933369035e-07, 'epochs': 262, 'loss': 'mse', 'optimizer': 'adam', 'graph_mode': 'off', 'use_snp_selection': True, 'num_snps': 58661}. Best is trial 33 with value: 0.21897778420797964.
[I 2025-12-05 21:58:43,973] Trial 37 finished with value: 0.18202887048523836 and parameters: {'model_type': 'mlp', 'hidden_dims': '[512, 64]', 'dropout': 0.16458817849499252, 'batch_norm': True, 'lr': 4.446294938689996e-06, 'weight_decay': 9.56677025328524e-07, 'epochs': 219, 'loss': 'mae', 'optimizer': 'adam', 'graph_mode': 'off', 'use_snp_selection': False}. Best is trial 33 with value: 0.21897778420797964.
[I 2025-12-05 21:59:26,629] Trial 38 finished with value: 0.17575729732516862 and parameters: {'model_type': 'mlp', 'hidden_dims': '[256, 128]', 'dropout': 0.1221422456773937, 'batch_norm': False, 'lr': 3.976131772829477e-05, 'weight_decay': 1.9532651930599367e-06, 'epochs': 155, 'loss': 'mse', 'optimizer': 'adam', 'graph_mode': 'off', 'use_snp_selection': True, 'num_snps': 19911}. Best is trial 33 with value: 0.21897778420797964.
[I 2025-12-05 22:00:30,177] Trial 39 finished with value: 0.2004142976525139 and parameters: {'model_type': 'mlp', 'hidden_dims': '[512, 64]', 'dropout': 0.18710033263433368, 'batch_norm': True, 'lr': 6.969032310488327e-05, 'weight_decay': 1.688537095436329e-07, 'epochs': 203, 'loss': 'mse', 'optimizer': 'adam', 'graph_mode': 'off', 'use_snp_selection': False}. Best is trial 33 with value: 0.21897778420797964.
[I 2025-12-05 22:00:50,441] Trial 40 finished with value: 0.18948765109992644 and parameters: {'model_type': 'mlp', 'hidden_dims': '[256, 128, 64]', 'dropout': 0.15206559511193432, 'batch_norm': True, 'lr': 2.716580414620856e-05, 'weight_decay': 8.16146224216266e-07, 'epochs': 97, 'loss': 'mae', 'optimizer': 'adam', 'graph_mode': 'off', 'use_snp_selection': False}. Best is trial 33 with value: 0.21897778420797964.
[I 2025-12-05 22:01:41,064] Trial 41 finished with value: 0.16721950889167422 and parameters: {'model_type': 'mlp', 'hidden_dims': '[512, 64]', 'dropout': 0.3716081310069049, 'batch_norm': True, 'lr': 2.320370617557869e-06, 'weight_decay': 9.834145571576335e-06, 'epochs': 155, 'loss': 'mse', 'optimizer': 'adam', 'graph_mode': 'off', 'use_snp_selection': False}. Best is trial 33 with value: 0.21897778420797964.
[I 2025-12-05 22:03:26,338] Trial 42 finished with value: 0.19263330956288258 and parameters: {'model_type': 'mlp', 'hidden_dims': '[512, 128]', 'dropout': 0.44570757133251226, 'batch_norm': True, 'lr': 9.654626431903909e-05, 'weight_decay': 0.0005654865083000712, 'epochs': 348, 'loss': 'mse', 'optimizer': 'adam', 'graph_mode': 'off', 'use_snp_selection': False}. Best is trial 33 with value: 0.21897778420797964.
[I 2025-12-05 22:04:22,353] Trial 43 finished with value: 0.1995880810314785 and parameters: {'model_type': 'mlp', 'hidden_dims': '[512, 64]', 'dropout': 0.10415603547139413, 'batch_norm': True, 'lr': 0.0001311477566367104, 'weight_decay': 3.8759209811280994e-07, 'epochs': 173, 'loss': 'mse', 'optimizer': 'adam', 'graph_mode': 'off', 'use_snp_selection': False}. Best is trial 33 with value: 0.21897778420797964.
[I 2025-12-05 22:05:23,003] Trial 44 finished with value: 0.2015173914703181 and parameters: {'model_type': 'mlp', 'hidden_dims': '[512, 256]', 'dropout': 0.20002886237536643, 'batch_norm': True, 'lr': 0.00031408713928606765, 'weight_decay': 3.063821997053756e-05, 'epochs': 189, 'loss': 'mse', 'optimizer': 'adam', 'graph_mode': 'off', 'use_snp_selection': False}. Best is trial 33 with value: 0.21897778420797964.
[I 2025-12-05 22:05:49,104] Trial 45 finished with value: 0.1976150643699194 and parameters: {'model_type': 'mlp', 'hidden_dims': '[256, 128]', 'dropout': 0.13389421231916707, 'batch_norm': True, 'lr': 5.278646124895805e-05, 'weight_decay': 1.4543529062494032e-07, 'epochs': 138, 'loss': 'mse', 'optimizer': 'adam', 'graph_mode': 'off', 'use_snp_selection': False}. Best is trial 33 with value: 0.21897778420797964.
[I 2025-12-05 22:06:36,604] Trial 46 finished with value: 0.2152662805190788 and parameters: {'model_type': 'mlp', 'hidden_dims': '[512, 64]', 'dropout': 0.249611784699085, 'batch_norm': False, 'lr': 0.00023124596431137602, 'weight_decay': 5.049629787801717e-07, 'epochs': 148, 'loss': 'mse', 'optimizer': 'adam', 'graph_mode': 'off', 'use_snp_selection': False}. Best is trial 33 with value: 0.21897778420797964.
[I 2025-12-05 22:07:15,209] Trial 47 finished with value: 0.14032521706594164 and parameters: {'model_type': 'mlp', 'hidden_dims': '[512, 64]', 'dropout': 0.2577310256444136, 'batch_norm': False, 'lr': 0.0004900230427221237, 'weight_decay': 5.386637994530954e-07, 'epochs': 115, 'loss': 'mse', 'optimizer': 'adam', 'graph_mode': 'off', 'use_snp_selection': False}. Best is trial 33 with value: 0.21897778420797964.
[I 2025-12-05 22:08:27,288] Trial 48 finished with value: 0.20698127611674252 and parameters: {'model_type': 'mlp', 'hidden_dims': '[512, 64]', 'dropout': 0.20792123011826646, 'batch_norm': False, 'lr': 0.00021453882975150948, 'weight_decay': 1.0030513697065783e-07, 'epochs': 237, 'loss': 'mse', 'optimizer': 'adam', 'graph_mode': 'off', 'use_snp_selection': False}. Best is trial 33 with value: 0.21897778420797964.
[I 2025-12-05 22:09:42,231] Trial 49 finished with value: 0.18705940172719784 and parameters: {'model_type': 'mlp', 'hidden_dims': '[512, 64]', 'dropout': 0.15589292592105455, 'batch_norm': False, 'lr': 7.201147414306197e-05, 'weight_decay': 2.521363583935018e-07, 'epochs': 147, 'loss': 'mse', 'optimizer': 'adam', 'graph_mode': 'off', 'use_snp_selection': True, 'num_snps': 46888}. Best is trial 33 with value: 0.21897778420797964.
[I 2025-12-05 22:10:06,660] Trial 50 finished with value: 0.19076510716686826 and parameters: {'model_type': 'mlp', 'hidden_dims': '[512, 256]', 'dropout': 0.2863017741428352, 'batch_norm': False, 'lr': 0.0002502518531236499, 'weight_decay': 1.2233028123413475e-06, 'epochs': 63, 'loss': 'mse', 'optimizer': 'adam', 'graph_mode': 'off', 'use_snp_selection': False}. Best is trial 33 with value: 0.21897778420797964.
[I 2025-12-05 22:10:58,071] Trial 51 finished with value: 0.20301496798414215 and parameters: {'model_type': 'mlp', 'hidden_dims': '[512, 64]', 'dropout': 0.4137732777141835, 'batch_norm': False, 'lr': 0.00014170714566010638, 'weight_decay': 5.690601620076072e-07, 'epochs': 163, 'loss': 'mse', 'optimizer': 'adam', 'graph_mode': 'off', 'use_snp_selection': False}. Best is trial 33 with value: 0.21897778420797964.
[I 2025-12-05 22:11:54,722] Trial 52 finished with value: 0.20322489191647577 and parameters: {'model_type': 'mlp', 'hidden_dims': '[512, 128]', 'dropout': 0.24888860761697373, 'batch_norm': True, 'lr': 8.915270861104501e-05, 'weight_decay': 3.0869363362762066e-06, 'epochs': 176, 'loss': 'mse', 'optimizer': 'adam', 'graph_mode': 'off', 'use_snp_selection': False}. Best is trial 33 with value: 0.21897778420797964.
[I 2025-12-05 22:12:11,768] Trial 53 finished with value: 0.18633519726666428 and parameters: {'model_type': 'mlp', 'hidden_dims': '[128, 64]', 'dropout': 0.2178398725085285, 'batch_norm': True, 'lr': 4.388393142039393e-05, 'weight_decay': 7.193352717811418e-07, 'epochs': 154, 'loss': 'mse', 'optimizer': 'adam', 'graph_mode': 'off', 'use_snp_selection': False}. Best is trial 33 with value: 0.21897778420797964.
[I 2025-12-05 22:12:56,635] Trial 54 finished with value: 0.20620338911120512 and parameters: {'model_type': 'mlp', 'hidden_dims': '[512, 64]', 'dropout': 0.19220090349751962, 'batch_norm': True, 'lr': 0.0001131639349560413, 'weight_decay': 3.5527959261611423e-07, 'epochs': 134, 'loss': 'mse', 'optimizer': 'adam', 'graph_mode': 'off', 'use_snp_selection': False}. Best is trial 33 with value: 0.21897778420797964.
[I 2025-12-05 22:13:32,663] Trial 55 finished with value: 0.21012968611250474 and parameters: {'model_type': 'mlp', 'hidden_dims': '[512, 256]', 'dropout': 0.115382779892159, 'batch_norm': False, 'lr': 0.00037954899785858684, 'weight_decay': 1.4044538921542452e-06, 'epochs': 105, 'loss': 'mse', 'optimizer': 'adam', 'graph_mode': 'off', 'use_snp_selection': False}. Best is trial 33 with value: 0.21897778420797964.
[I 2025-12-05 22:14:08,131] Trial 56 finished with value: 0.20441325375899755 and parameters: {'model_type': 'mlp', 'hidden_dims': '[512, 256]', 'dropout': 0.11556134672428026, 'batch_norm': False, 'lr': 0.0004904047103163978, 'weight_decay': 1.339954659417194e-06, 'epochs': 103, 'loss': 'mse', 'optimizer': 'adam', 'graph_mode': 'off', 'use_snp_selection': False}. Best is trial 33 with value: 0.21897778420797964.
[I 2025-12-05 22:14:39,221] Trial 57 finished with value: 0.17607601240424714 and parameters: {'model_type': 'mlp', 'hidden_dims': '[512, 256]', 'dropout': 0.14429230305152715, 'batch_norm': False, 'lr': 0.0008088816319967441, 'weight_decay': 2.1519171973963205e-06, 'epochs': 87, 'loss': 'mse', 'optimizer': 'adam', 'graph_mode': 'off', 'use_snp_selection': False}. Best is trial 33 with value: 0.21897778420797964.
[I 2025-12-05 22:15:17,915] Trial 58 finished with value: 0.21002604226633323 and parameters: {'model_type': 'mlp', 'hidden_dims': '[512, 256]', 'dropout': 0.17249708017301313, 'batch_norm': False, 'lr': 0.00028496367363656943, 'weight_decay': 5.035918879855934e-06, 'epochs': 115, 'loss': 'mae', 'optimizer': 'adam', 'graph_mode': 'off', 'use_snp_selection': False}. Best is trial 33 with value: 0.21897778420797964.
[I 2025-12-05 22:15:56,351] Trial 59 finished with value: 0.21514236745626167 and parameters: {'model_type': 'mlp', 'hidden_dims': '[512, 256]', 'dropout': 0.10332225170341047, 'batch_norm': False, 'lr': 0.00038042728531466363, 'weight_decay': 7.029356395318098e-07, 'epochs': 114, 'loss': 'mae', 'optimizer': 'adam', 'graph_mode': 'off', 'use_snp_selection': False}. Best is trial 33 with value: 0.21897778420797964.
[I 2025-12-05 22:16:37,492] Trial 60 finished with value: 0.21520690148695304 and parameters: {'model_type': 'mlp', 'hidden_dims': '[512, 256]', 'dropout': 0.10301438314710681, 'batch_norm': False, 'lr': 0.00039137585483600196, 'weight_decay': 2.7700247415711025e-07, 'epochs': 124, 'loss': 'mae', 'optimizer': 'adam', 'graph_mode': 'off', 'use_snp_selection': False}. Best is trial 33 with value: 0.21897778420797964.
[I 2025-12-05 22:17:18,912] Trial 61 finished with value: 0.20625612731986526 and parameters: {'model_type': 'mlp', 'hidden_dims': '[512, 256]', 'dropout': 0.10540108193656322, 'batch_norm': False, 'lr': 0.00048137401897969777, 'weight_decay': 2.9516617758004506e-07, 'epochs': 125, 'loss': 'mae', 'optimizer': 'adam', 'graph_mode': 'off', 'use_snp_selection': False}. Best is trial 33 with value: 0.21897778420797964.
[I 2025-12-05 22:17:51,399] Trial 62 finished with value: 0.2128672474151066 and parameters: {'model_type': 'mlp', 'hidden_dims': '[512, 256]', 'dropout': 0.1364621694760458, 'batch_norm': False, 'lr': 0.00033444085679447795, 'weight_decay': 1.4615432671475972e-07, 'epochs': 92, 'loss': 'mae', 'optimizer': 'adam', 'graph_mode': 'off', 'use_snp_selection': False}. Best is trial 33 with value: 0.21897778420797964.
[I 2025-12-05 22:18:16,773] Trial 63 finished with value: 0.1829287687223557 and parameters: {'model_type': 'mlp', 'hidden_dims': '[512, 256]', 'dropout': 0.10007060196415729, 'batch_norm': False, 'lr': 0.0007207630902016555, 'weight_decay': 1.4572323047321502e-07, 'epochs': 66, 'loss': 'mae', 'optimizer': 'adam', 'graph_mode': 'off', 'use_snp_selection': False}. Best is trial 33 with value: 0.21897778420797964.
[I 2025-12-05 22:18:47,570] Trial 64 finished with value: 0.21493981566380307 and parameters: {'model_type': 'mlp', 'hidden_dims': '[512, 256]', 'dropout': 0.13854310027444608, 'batch_norm': False, 'lr': 0.00040235013433720536, 'weight_decay': 2.3401741787680653e-07, 'epochs': 86, 'loss': 'mae', 'optimizer': 'adam', 'graph_mode': 'off', 'use_snp_selection': False}. Best is trial 33 with value: 0.21897778420797964.
[I 2025-12-05 22:19:18,679] Trial 65 finished with value: 0.2094204483595429 and parameters: {'model_type': 'mlp', 'hidden_dims': '[512, 256]', 'dropout': 0.13562378562531313, 'batch_norm': False, 'lr': 0.0003835257069195501, 'weight_decay': 2.427668993037442e-07, 'epochs': 87, 'loss': 'mae', 'optimizer': 'adam', 'graph_mode': 'off', 'use_snp_selection': False}. Best is trial 33 with value: 0.21897778420797964.
[I 2025-12-05 22:19:57,961] Trial 66 finished with value: 0.21164365987437112 and parameters: {'model_type': 'mlp', 'hidden_dims': '[512, 256]', 'dropout': 0.14212601384373771, 'batch_norm': False, 'lr': 0.0005550089109014248, 'weight_decay': 1.471950025569363e-07, 'epochs': 117, 'loss': 'mae', 'optimizer': 'adam', 'graph_mode': 'off', 'use_snp_selection': False}. Best is trial 33 with value: 0.21897778420797964.
[I 2025-12-05 22:20:40,381] Trial 67 finished with value: 0.2016669486577805 and parameters: {'model_type': 'mlp', 'hidden_dims': '[512, 256]', 'dropout': 0.14910781620811436, 'batch_norm': False, 'lr': 0.0006201871447743306, 'weight_decay': 1.505171944509849e-07, 'epochs': 52, 'loss': 'mae', 'optimizer': 'adam', 'graph_mode': 'off', 'use_snp_selection': True, 'num_snps': 22951}. Best is trial 33 with value: 0.21897778420797964.
[I 2025-12-05 22:21:19,241] Trial 68 finished with value: 0.21175340033166257 and parameters: {'model_type': 'mlp', 'hidden_dims': '[512, 256]', 'dropout': 0.18643223432297998, 'batch_norm': False, 'lr': 0.0006252037277491221, 'weight_decay': 1.1361806337924028e-07, 'epochs': 117, 'loss': 'mae', 'optimizer': 'adam', 'graph_mode': 'off', 'use_snp_selection': False}. Best is trial 33 with value: 0.21897778420797964.
