[I 2025-12-05 15:09:58,736] Trial 1 finished with value: 0.0927457943990127 and parameters: {'model_type': 'mlp', 'hidden_dims': '[256, 128]', 'dropout': 0.4370668075331726, 'batch_norm': True, 'lr': 7.133471581159139e-05, 'weight_decay': 1.128633586803549e-05, 'epochs': 242, 'loss': 'mae', 'optimizer': 'adam', 'graph_mode': 'off', 'use_snp_selection': False}. Best is trial 1 with value: 0.0927457943990127.
[I 2025-12-05 15:09:59,905] Trial 2 finished with value: 0.06035044622452715 and parameters: {'model_type': 'mlp', 'hidden_dims': '[256, 128, 64]', 'dropout': 0.41314357415569625, 'batch_norm': False, 'lr': 3.952233718592101e-06, 'weight_decay': 0.00026754769258252603, 'epochs': 149, 'loss': 'mse', 'optimizer': 'adam', 'graph_mode': 'off', 'use_snp_selection': True, 'num_snps': 11571}. Best is trial 1 with value: 0.0927457943990127.
[I 2025-12-05 15:10:02,121] Trial 3 finished with value: 0.1053840940609349 and parameters: {'model_type': 'mlp', 'hidden_dims': '[512, 64]', 'dropout': 0.5938127374509361, 'batch_norm': False, 'lr': 5.67704586114731e-06, 'weight_decay': 2.4518087630137052e-05, 'epochs': 320, 'loss': 'mae', 'optimizer': 'adam', 'graph_mode': 'off', 'use_snp_selection': False}. Best is trial 3 with value: 0.1053840940609349.
[I 2025-12-05 15:10:04,679] Trial 4 finished with value: 0.06852360244927103 and parameters: {'model_type': 'mlp', 'hidden_dims': '[512, 128]', 'dropout': 0.25746343592134413, 'batch_norm': True, 'lr': 1.3467657668402788e-06, 'weight_decay': 0.00033087251918647806, 'epochs': 277, 'loss': 'mse', 'optimizer': 'adam', 'graph_mode': 'off', 'use_snp_selection': True, 'num_snps': 36675}. Best is trial 3 with value: 0.1053840940609349.
[I 2025-12-05 15:10:06,769] Trial 5 finished with value: 0.047666062600193716 and parameters: {'model_type': 'mlp', 'hidden_dims': '[512, 64]', 'dropout': 0.38275350994408375, 'batch_norm': True, 'lr': 1.5586664309232824e-06, 'weight_decay': 0.0008227664668621182, 'epochs': 145, 'loss': 'mae', 'optimizer': 'adam', 'graph_mode': 'off', 'use_snp_selection': True, 'num_snps': 32148}. Best is trial 3 with value: 0.1053840940609349.
[I 2025-12-05 15:10:07,919] Trial 6 finished with value: 0.09516285922183944 and parameters: {'model_type': 'mlp', 'hidden_dims': '[256, 128]', 'dropout': 0.3930109900265879, 'batch_norm': False, 'lr': 4.892964372128395e-05, 'weight_decay': 1.5809549317992182e-06, 'epochs': 199, 'loss': 'mse', 'optimizer': 'adam', 'graph_mode': 'off', 'use_snp_selection': False}. Best is trial 3 with value: 0.1053840940609349.
[I 2025-12-05 15:10:09,149] Trial 7 finished with value: 0.08874204782049987 and parameters: {'model_type': 'mlp', 'hidden_dims': '[512, 256]', 'dropout': 0.15343979219678458, 'batch_norm': True, 'lr': 6.234003099047341e-05, 'weight_decay': 3.894760610535477e-07, 'epochs': 97, 'loss': 'mse', 'optimizer': 'adam', 'graph_mode': 'off', 'use_snp_selection': False}. Best is trial 3 with value: 0.1053840940609349.
[I 2025-12-05 15:10:11,361] Trial 8 finished with value: 0.13164862515247325 and parameters: {'model_type': 'mlp', 'hidden_dims': '[512, 128]', 'dropout': 0.10743001231661406, 'batch_norm': True, 'lr': 0.00023728538449271062, 'weight_decay': 1.7629071578048637e-05, 'epochs': 312, 'loss': 'mae', 'optimizer': 'adam', 'graph_mode': 'off', 'use_snp_selection': False}. Best is trial 8 with value: 0.13164862515247325.
[I 2025-12-05 15:10:12,937] Trial 9 finished with value: 0.1081851220684078 and parameters: {'model_type': 'mlp', 'hidden_dims': '[512, 64]', 'dropout': 0.14505336736221927, 'batch_norm': True, 'lr': 5.8619638388111826e-05, 'weight_decay': 6.200156172669308e-07, 'epochs': 175, 'loss': 'mse', 'optimizer': 'adam', 'graph_mode': 'off', 'use_snp_selection': False}. Best is trial 8 with value: 0.13164862515247325.
[I 2025-12-05 15:10:13,989] Trial 10 finished with value: 0.01701736641871717 and parameters: {'model_type': 'mlp', 'hidden_dims': '[512, 128]', 'dropout': 0.2800030442581858, 'batch_norm': False, 'lr': 0.0004919806695968258, 'weight_decay': 2.9953888095455486e-06, 'epochs': 55, 'loss': 'mae', 'optimizer': 'adam', 'graph_mode': 'off', 'use_snp_selection': False}. Best is trial 8 with value: 0.13164862515247325.
[I 2025-12-05 15:10:15,785] Trial 11 finished with value: 0.12110751859092221 and parameters: {'model_type': 'mlp', 'hidden_dims': '[512, 128]', 'dropout': 0.10095648685224448, 'batch_norm': True, 'lr': 0.0003411435764085616, 'weight_decay': 1.2045055692919657e-07, 'epochs': 216, 'loss': 'mse', 'optimizer': 'adam', 'graph_mode': 'off', 'use_snp_selection': False}. Best is trial 8 with value: 0.13164862515247325.
[I 2025-12-05 15:10:17,741] Trial 12 finished with value: 0.11910000330267796 and parameters: {'model_type': 'mlp', 'hidden_dims': '[512, 128]', 'dropout': 0.10344600881777158, 'batch_norm': True, 'lr': 0.0006674532614549997, 'weight_decay': 1.3081036432574914e-07, 'epochs': 255, 'loss': 'mae', 'optimizer': 'adam', 'graph_mode': 'off', 'use_snp_selection': False}. Best is trial 8 with value: 0.13164862515247325.
[I 2025-12-05 15:10:19,810] Trial 13 finished with value: 0.11768589301487914 and parameters: {'model_type': 'mlp', 'hidden_dims': '[512, 128]', 'dropout': 0.23699951708513148, 'batch_norm': True, 'lr': 0.00023284399572303963, 'weight_decay': 5.125175759678148e-06, 'epochs': 292, 'loss': 'mse', 'optimizer': 'adam', 'graph_mode': 'off', 'use_snp_selection': False}. Best is trial 8 with value: 0.13164862515247325.
[I 2025-12-05 15:10:21,542] Trial 14 finished with value: 0.10712825733732338 and parameters: {'model_type': 'mlp', 'hidden_dims': '[512, 128]', 'dropout': 0.3205812984508333, 'batch_norm': True, 'lr': 0.0002108574938852793, 'weight_decay': 5.724103314313124e-05, 'epochs': 217, 'loss': 'mse', 'optimizer': 'adam', 'graph_mode': 'off', 'use_snp_selection': False}. Best is trial 8 with value: 0.13164862515247325.
[I 2025-12-05 15:10:22,545] Trial 15 finished with value: 0.1236031920642133 and parameters: {'model_type': 'mlp', 'hidden_dims': '[128, 64]', 'dropout': 0.10515697852451877, 'batch_norm': True, 'lr': 1.5760371838154937e-05, 'weight_decay': 1.2322027943135258e-07, 'epochs': 302, 'loss': 'mae', 'optimizer': 'adam', 'graph_mode': 'off', 'use_snp_selection': False}. Best is trial 8 with value: 0.13164862515247325.
[I 2025-12-05 15:10:23,612] Trial 16 finished with value: 0.07658330352650672 and parameters: {'model_type': 'mlp', 'hidden_dims': '[128, 64]', 'dropout': 0.1930554518103474, 'batch_norm': True, 'lr': 1.72721085392348e-05, 'weight_decay': 1.3688344971449645e-05, 'epochs': 350, 'loss': 'mae', 'optimizer': 'adam', 'graph_mode': 'off', 'use_snp_selection': False}. Best is trial 8 with value: 0.13164862515247325.
[I 2025-12-05 15:10:24,614] Trial 17 finished with value: 0.07510903554500083 and parameters: {'model_type': 'mlp', 'hidden_dims': '[128, 64]', 'dropout': 0.5434692890636532, 'batch_norm': True, 'lr': 2.0796451568787424e-05, 'weight_decay': 1.3398043894594233e-06, 'epochs': 302, 'loss': 'mae', 'optimizer': 'adam', 'graph_mode': 'off', 'use_snp_selection': False}. Best is trial 8 with value: 0.13164862515247325.
[I 2025-12-05 15:10:28,122] Trial 18 finished with value: 0.1222473365020445 and parameters: {'model_type': 'mlp', 'hidden_dims': '[512, 256]', 'dropout': 0.46470375425664545, 'batch_norm': False, 'lr': 0.00011489443607323223, 'weight_decay': 5.1284909832915915e-05, 'epochs': 263, 'loss': 'mae', 'optimizer': 'adam', 'graph_mode': 'off', 'use_snp_selection': True, 'num_snps': 58241}. Best is trial 8 with value: 0.13164862515247325.
[I 2025-12-05 15:10:29,552] Trial 19 finished with value: 0.03547193769351961 and parameters: {'model_type': 'mlp', 'hidden_dims': '[256, 128, 64]', 'dropout': 0.31957266005491125, 'batch_norm': True, 'lr': 9.68778069322751e-06, 'weight_decay': 3.886175306152644e-07, 'epochs': 312, 'loss': 'mae', 'optimizer': 'adam', 'graph_mode': 'off', 'use_snp_selection': False}. Best is trial 8 with value: 0.13164862515247325.
[I 2025-12-05 15:10:30,503] Trial 20 finished with value: 0.07734115863540064 and parameters: {'model_type': 'mlp', 'hidden_dims': '[128, 64]', 'dropout': 0.1696175915922814, 'batch_norm': True, 'lr': 2.5163504803467723e-05, 'weight_decay': 0.0001247981980720522, 'epochs': 240, 'loss': 'mae', 'optimizer': 'adam', 'graph_mode': 'off', 'use_snp_selection': False}. Best is trial 8 with value: 0.13164862515247325.
[I 2025-12-05 15:10:33,969] Trial 21 finished with value: 0.12318618229629862 and parameters: {'model_type': 'mlp', 'hidden_dims': '[512, 256]', 'dropout': 0.47188441374389706, 'batch_norm': False, 'lr': 0.0001233861441709155, 'weight_decay': 3.224197278724675e-05, 'epochs': 269, 'loss': 'mae', 'optimizer': 'adam', 'graph_mode': 'off', 'use_snp_selection': True, 'num_snps': 57741}. Best is trial 8 with value: 0.13164862515247325.
[I 2025-12-05 15:10:37,576] Trial 22 finished with value: 0.12671683087421728 and parameters: {'model_type': 'mlp', 'hidden_dims': '[512, 256]', 'dropout': 0.49305308720634916, 'batch_norm': False, 'lr': 0.00011981774816864091, 'weight_decay': 6.300180905554503e-06, 'epochs': 284, 'loss': 'mae', 'optimizer': 'adam', 'graph_mode': 'off', 'use_snp_selection': True, 'num_snps': 59634}. Best is trial 8 with value: 0.13164862515247325.
[I 2025-12-05 15:10:38,959] Trial 23 finished with value: 0.11103858906995863 and parameters: {'model_type': 'mlp', 'hidden_dims': '[512, 256]', 'dropout': 0.5132419221641198, 'batch_norm': False, 'lr': 0.0009001403382035346, 'weight_decay': 3.977638798351806e-06, 'epochs': 326, 'loss': 'mae', 'optimizer': 'adam', 'graph_mode': 'off', 'use_snp_selection': True, 'num_snps': 13925}. Best is trial 8 with value: 0.13164862515247325.
[I 2025-12-05 15:10:41,206] Trial 24 finished with value: 0.1228024467050341 and parameters: {'model_type': 'mlp', 'hidden_dims': '[128, 64]', 'dropout': 0.21818778993135277, 'batch_norm': False, 'lr': 0.00013207520118911178, 'weight_decay': 7.196362384413773e-06, 'epochs': 287, 'loss': 'mae', 'optimizer': 'adam', 'graph_mode': 'off', 'use_snp_selection': True, 'num_snps': 44910}. Best is trial 8 with value: 0.13164862515247325.
[I 2025-12-05 15:10:42,279] Trial 25 finished with value: 0.08990277373283945 and parameters: {'model_type': 'mlp', 'hidden_dims': '[512, 256]', 'dropout': 0.3382423599835631, 'batch_norm': False, 'lr': 1.4018639288378355e-05, 'weight_decay': 1.5468934496157961e-06, 'epochs': 346, 'loss': 'mae', 'optimizer': 'adam', 'graph_mode': 'off', 'use_snp_selection': True, 'num_snps': 2026}. Best is trial 8 with value: 0.13164862515247325.
[I 2025-12-05 15:10:43,842] Trial 26 finished with value: 0.12339019681077497 and parameters: {'model_type': 'mlp', 'hidden_dims': '[256, 128]', 'dropout': 0.12485539371289488, 'batch_norm': False, 'lr': 0.00021838808731740097, 'weight_decay': 2.14029219924189e-05, 'epochs': 305, 'loss': 'mae', 'optimizer': 'adam', 'graph_mode': 'off', 'use_snp_selection': True, 'num_snps': 21573}. Best is trial 8 with value: 0.13164862515247325.
[I 2025-12-05 15:10:45,078] Trial 27 finished with value: 0.09591164940625525 and parameters: {'model_type': 'mlp', 'hidden_dims': '[256, 128, 64]', 'dropout': 0.26975675568834634, 'batch_norm': True, 'lr': 3.645372213226761e-05, 'weight_decay': 2.677922139666298e-07, 'epochs': 235, 'loss': 'mae', 'optimizer': 'adam', 'graph_mode': 'off', 'use_snp_selection': False}. Best is trial 8 with value: 0.13164862515247325.
[I 2025-12-05 15:10:47,436] Trial 28 finished with value: 0.10326667358174003 and parameters: {'model_type': 'mlp', 'hidden_dims': '[128, 64]', 'dropout': 0.5888612183933422, 'batch_norm': False, 'lr': 0.00042193906010098276, 'weight_decay': 8.637475628278311e-07, 'epochs': 283, 'loss': 'mae', 'optimizer': 'adam', 'graph_mode': 'off', 'use_snp_selection': True, 'num_snps': 48700}. Best is trial 8 with value: 0.13164862515247325.
[I 2025-12-05 15:10:49,508] Trial 29 finished with value: 0.06949551051259624 and parameters: {'model_type': 'mlp', 'hidden_dims': '[512, 256]', 'dropout': 0.2006389639777375, 'batch_norm': True, 'lr': 7.231055082136382e-06, 'weight_decay': 0.00011879344796485523, 'epochs': 340, 'loss': 'mae', 'optimizer': 'adam', 'graph_mode': 'off', 'use_snp_selection': True, 'num_snps': 26415}. Best is trial 8 with value: 0.13164862515247325.
[I 2025-12-05 15:10:50,539] Trial 30 finished with value: 0.021392006618298234 and parameters: {'model_type': 'mlp', 'hidden_dims': '[128, 64]', 'dropout': 0.5204789130246721, 'batch_norm': True, 'lr': 3.3218861711051793e-06, 'weight_decay': 2.4731302355529378e-06, 'epochs': 323, 'loss': 'mae', 'optimizer': 'adam', 'graph_mode': 'off', 'use_snp_selection': False}. Best is trial 8 with value: 0.13164862515247325.
[I 2025-12-05 15:10:52,222] Trial 31 finished with value: 0.12540664940797625 and parameters: {'model_type': 'mlp', 'hidden_dims': '[256, 128]', 'dropout': 0.1436307844601364, 'batch_norm': False, 'lr': 0.00023721744789752957, 'weight_decay': 1.4417443750112894e-05, 'epochs': 303, 'loss': 'mae', 'optimizer': 'adam', 'graph_mode': 'off', 'use_snp_selection': True, 'num_snps': 22630}. Best is trial 8 with value: 0.13164862515247325.
[I 2025-12-05 15:10:53,850] Trial 32 finished with value: 0.12030687706959028 and parameters: {'model_type': 'mlp', 'hidden_dims': '[256, 128]', 'dropout': 0.16663128968259194, 'batch_norm': False, 'lr': 0.00011141113101259206, 'weight_decay': 1.3326491574091975e-05, 'epochs': 308, 'loss': 'mae', 'optimizer': 'adam', 'graph_mode': 'off', 'use_snp_selection': True, 'num_snps': 18702}. Best is trial 8 with value: 0.13164862515247325.
[I 2025-12-05 15:10:55,907] Trial 33 finished with value: 0.1240670204197075 and parameters: {'model_type': 'mlp', 'hidden_dims': '[256, 128]', 'dropout': 0.13169992262333385, 'batch_norm': False, 'lr': 0.0002927311855158918, 'weight_decay': 8.547661416776994e-06, 'epochs': 255, 'loss': 'mae', 'optimizer': 'adam', 'graph_mode': 'off', 'use_snp_selection': True, 'num_snps': 34449}. Best is trial 8 with value: 0.13164862515247325.
[I 2025-12-05 15:10:58,024] Trial 34 finished with value: 0.1408370898515687 and parameters: {'model_type': 'mlp', 'hidden_dims': '[256, 128]', 'dropout': 0.13717864587562753, 'batch_norm': False, 'lr': 0.0002746454404815622, 'weight_decay': 9.302102916634023e-06, 'epochs': 262, 'loss': 'mae', 'optimizer': 'adam', 'graph_mode': 'off', 'use_snp_selection': True, 'num_snps': 35662}. Best is trial 34 with value: 0.1408370898515687.
[I 2025-12-05 15:10:59,679] Trial 35 finished with value: 0.12044187597567678 and parameters: {'model_type': 'mlp', 'hidden_dims': '[256, 128]', 'dropout': 0.17810793668135197, 'batch_norm': False, 'lr': 0.0001787327990548052, 'weight_decay': 1.7088089671728047e-05, 'epochs': 224, 'loss': 'mae', 'optimizer': 'adam', 'graph_mode': 'off', 'use_snp_selection': True, 'num_snps': 26607}. Best is trial 34 with value: 0.1408370898515687.
[I 2025-12-05 15:11:02,380] Trial 36 finished with value: 0.13095147686838707 and parameters: {'model_type': 'mlp', 'hidden_dims': '[256, 128]', 'dropout': 0.23129301816501524, 'batch_norm': False, 'lr': 9.162491858096282e-05, 'weight_decay': 3.43656940003328e-05, 'epochs': 275, 'loss': 'mae', 'optimizer': 'adam', 'graph_mode': 'off', 'use_snp_selection': True, 'num_snps': 52271}. Best is trial 34 with value: 0.1408370898515687.
[I 2025-12-05 15:11:05,136] Trial 37 finished with value: 0.15090821081568856 and parameters: {'model_type': 'mlp', 'hidden_dims': '[256, 128]', 'dropout': 0.23348041836414035, 'batch_norm': False, 'lr': 8.80831276831573e-05, 'weight_decay': 3.9532843998328955e-05, 'epochs': 274, 'loss': 'mae', 'optimizer': 'adam', 'graph_mode': 'off', 'use_snp_selection': True, 'num_snps': 52065}. Best is trial 37 with value: 0.15090821081568856.
[I 2025-12-05 15:11:07,615] Trial 38 finished with value: 0.1270593521215095 and parameters: {'model_type': 'mlp', 'hidden_dims': '[256, 128]', 'dropout': 0.22430135230993473, 'batch_norm': False, 'lr': 8.483724529074716e-05, 'weight_decay': 3.543316916201872e-05, 'epochs': 180, 'loss': 'mae', 'optimizer': 'adam', 'graph_mode': 'off', 'use_snp_selection': True, 'num_snps': 51292}. Best is trial 37 with value: 0.15090821081568856.
[I 2025-12-05 15:11:09,921] Trial 39 finished with value: 0.1390317906924361 and parameters: {'model_type': 'mlp', 'hidden_dims': '[256, 128]', 'dropout': 0.29905574837641685, 'batch_norm': False, 'lr': 4.255150425149671e-05, 'weight_decay': 0.00011277341158042598, 'epochs': 199, 'loss': 'mae', 'optimizer': 'adam', 'graph_mode': 'off', 'use_snp_selection': True, 'num_snps': 40417}. Best is trial 37 with value: 0.15090821081568856.
[I 2025-12-05 15:11:12,061] Trial 40 finished with value: 0.11892558059394341 and parameters: {'model_type': 'mlp', 'hidden_dims': '[256, 128]', 'dropout': 0.3829614377213328, 'batch_norm': False, 'lr': 3.7620563797655015e-05, 'weight_decay': 0.0004167309351932342, 'epochs': 150, 'loss': 'mse', 'optimizer': 'adam', 'graph_mode': 'off', 'use_snp_selection': True, 'num_snps': 39113}. Best is trial 37 with value: 0.15090821081568856.
[I 2025-12-05 15:11:14,816] Trial 41 finished with value: 0.12433675985591648 and parameters: {'model_type': 'mlp', 'hidden_dims': '[256, 128]', 'dropout': 0.2532044728607662, 'batch_norm': False, 'lr': 8.121399928690166e-05, 'weight_decay': 9.643083742136386e-05, 'epochs': 254, 'loss': 'mae', 'optimizer': 'adam', 'graph_mode': 'off', 'use_snp_selection': True, 'num_snps': 52084}. Best is trial 37 with value: 0.15090821081568856.
[I 2025-12-05 15:11:16,902] Trial 42 finished with value: 0.1266256080754592 and parameters: {'model_type': 'mlp', 'hidden_dims': '[256, 128]', 'dropout': 0.28706114001580946, 'batch_norm': False, 'lr': 5.12642993204397e-05, 'weight_decay': 0.00023836177277621477, 'epochs': 117, 'loss': 'mae', 'optimizer': 'adam', 'graph_mode': 'off', 'use_snp_selection': True, 'num_snps': 42054}. Best is trial 37 with value: 0.15090821081568856.
[I 2025-12-05 15:11:19,671] Trial 43 finished with value: 0.12308829547990476 and parameters: {'model_type': 'mlp', 'hidden_dims': '[512, 64]', 'dropout': 0.2891796155445609, 'batch_norm': False, 'lr': 0.00016072365033046118, 'weight_decay': 7.15976050869731e-05, 'epochs': 206, 'loss': 'mae', 'optimizer': 'adam', 'graph_mode': 'off', 'use_snp_selection': True, 'num_snps': 47824}. Best is trial 37 with value: 0.15090821081568856.
[I 2025-12-05 15:11:22,398] Trial 44 finished with value: 0.14525129883710372 and parameters: {'model_type': 'mlp', 'hidden_dims': '[256, 128]', 'dropout': 0.20189159433368775, 'batch_norm': False, 'lr': 8.256088389977521e-05, 'weight_decay': 0.00020962041659460486, 'epochs': 273, 'loss': 'mae', 'optimizer': 'adam', 'graph_mode': 'off', 'use_snp_selection': True, 'num_snps': 53089}. Best is trial 37 with value: 0.15090821081568856.
[I 2025-12-05 15:11:24,494] Trial 45 finished with value: 0.14071035039939764 and parameters: {'model_type': 'mlp', 'hidden_dims': '[256, 128]', 'dropout': 0.1989368284192443, 'batch_norm': False, 'lr': 0.0004896345236623755, 'weight_decay': 0.00019371187359321738, 'epochs': 192, 'loss': 'mae', 'optimizer': 'adam', 'graph_mode': 'off', 'use_snp_selection': True, 'num_snps': 39019}. Best is trial 37 with value: 0.15090821081568856.
[I 2025-12-05 15:11:26,740] Trial 46 finished with value: 0.13897140496424581 and parameters: {'model_type': 'mlp', 'hidden_dims': '[256, 128]', 'dropout': 0.20332680562702404, 'batch_norm': False, 'lr': 0.0006315057349433268, 'weight_decay': 0.000815058739214887, 'epochs': 182, 'loss': 'mae', 'optimizer': 'adam', 'graph_mode': 'off', 'use_snp_selection': True, 'num_snps': 39308}. Best is trial 37 with value: 0.15090821081568856.
[I 2025-12-05 15:11:28,628] Trial 47 finished with value: 0.11757298791305947 and parameters: {'model_type': 'mlp', 'hidden_dims': '[256, 128]', 'dropout': 0.2492890023949146, 'batch_norm': False, 'lr': 0.0004173012066235459, 'weight_decay': 0.00019248684778110813, 'epochs': 196, 'loss': 'mse', 'optimizer': 'adam', 'graph_mode': 'off', 'use_snp_selection': True, 'num_snps': 31621}. Best is trial 37 with value: 0.15090821081568856.
[I 2025-12-05 15:11:31,299] Trial 48 finished with value: 0.01587179777716647 and parameters: {'model_type': 'mlp', 'hidden_dims': '[256, 128]', 'dropout': 0.3092754959252583, 'batch_norm': False, 'lr': 1.0379953803372485e-06, 'weight_decay': 0.0006162253712652542, 'epochs': 156, 'loss': 'mae', 'optimizer': 'adam', 'graph_mode': 'off', 'use_snp_selection': True, 'num_snps': 54772}. Best is trial 37 with value: 0.15090821081568856.
[I 2025-12-05 15:11:33,409] Trial 49 finished with value: 0.11980783136551837 and parameters: {'model_type': 'mlp', 'hidden_dims': '[256, 128]', 'dropout': 0.3501263694529843, 'batch_norm': False, 'lr': 5.9322372041413545e-05, 'weight_decay': 0.0001773819478437588, 'epochs': 128, 'loss': 'mae', 'optimizer': 'adam', 'graph_mode': 'off', 'use_snp_selection': True, 'num_snps': 43623}. Best is trial 37 with value: 0.15090821081568856.
[I 2025-12-05 15:11:36,226] Trial 50 finished with value: 0.09690884375224698 and parameters: {'model_type': 'mlp', 'hidden_dims': '[512, 64]', 'dropout': 0.18385560947045737, 'batch_norm': False, 'lr': 0.0008584780348343771, 'weight_decay': 0.0003250203825316878, 'epochs': 232, 'loss': 'mse', 'optimizer': 'adam', 'graph_mode': 'off', 'use_snp_selection': True, 'num_snps': 46943}. Best is trial 37 with value: 0.15090821081568856.
[I 2025-12-05 15:11:38,275] Trial 51 finished with value: 0.14148424920714675 and parameters: {'model_type': 'mlp', 'hidden_dims': '[256, 128]', 'dropout': 0.21012503181041992, 'batch_norm': False, 'lr': 0.0005868698442819852, 'weight_decay': 0.000693561995532884, 'epochs': 178, 'loss': 'mae', 'optimizer': 'adam', 'graph_mode': 'off', 'use_snp_selection': True, 'num_snps': 39620}. Best is trial 37 with value: 0.15090821081568856.
