Running from this directory: /cluster/work/simennes/Project_thesis/Project_thesis
Name of job: mlp_w
ID of job: 23690571
The job was run on these nodes: idun-07-04
[I 2025-12-05 14:24:44,921] Trial 0 finished with value: 0.18523291832573074 and parameters: {'model_type': 'mlp', 'hidden_dims': '[128, 64]', 'dropout': 0.199031432379812, 'batch_norm': True, 'lr': 1.8408544111075837e-06, 'weight_decay': 5.5136510071208614e-05, 'epochs': 336, 'loss': 'mae', 'optimizer': 'adam', 'graph_mode': 'off', 'use_snp_selection': True, 'num_snps': 43862}. Best is trial 0 with value: 0.18523291832573074.
[I 2025-12-05 14:25:25,476] Trial 1 finished with value: 0.24598969809998877 and parameters: {'model_type': 'mlp', 'hidden_dims': '[256, 128]', 'dropout': 0.4370668075331726, 'batch_norm': True, 'lr': 7.133471581159139e-05, 'weight_decay': 1.128633586803549e-05, 'epochs': 242, 'loss': 'mae', 'optimizer': 'adam', 'graph_mode': 'off', 'use_snp_selection': False}. Best is trial 1 with value: 0.24598969809998877.
[I 2025-12-05 14:26:03,824] Trial 2 finished with value: 0.20537882149838776 and parameters: {'model_type': 'mlp', 'hidden_dims': '[256, 128, 64]', 'dropout': 0.41314357415569625, 'batch_norm': False, 'lr': 3.952233718592101e-06, 'weight_decay': 0.00026754769258252603, 'epochs': 149, 'loss': 'mse', 'optimizer': 'adam', 'graph_mode': 'off', 'use_snp_selection': True, 'num_snps': 11571}. Best is trial 1 with value: 0.24598969809998877.
[I 2025-12-05 14:27:38,527] Trial 3 finished with value: 0.24563902100968477 and parameters: {'model_type': 'mlp', 'hidden_dims': '[512, 64]', 'dropout': 0.5938127374509361, 'batch_norm': False, 'lr': 5.67704586114731e-06, 'weight_decay': 2.4518087630137052e-05, 'epochs': 320, 'loss': 'mae', 'optimizer': 'adam', 'graph_mode': 'off', 'use_snp_selection': False}. Best is trial 1 with value: 0.24598969809998877.
[I 2025-12-05 14:29:05,568] Trial 4 finished with value: 0.19493337052805312 and parameters: {'model_type': 'mlp', 'hidden_dims': '[512, 128]', 'dropout': 0.25746343592134413, 'batch_norm': True, 'lr': 1.3467657668402788e-06, 'weight_decay': 0.00033087251918647806, 'epochs': 277, 'loss': 'mse', 'optimizer': 'adam', 'graph_mode': 'off', 'use_snp_selection': True, 'num_snps': 36675}. Best is trial 1 with value: 0.24598969809998877.
[I 2025-12-05 14:30:07,012] Trial 5 finished with value: 0.19131523597044903 and parameters: {'model_type': 'mlp', 'hidden_dims': '[512, 64]', 'dropout': 0.38275350994408375, 'batch_norm': True, 'lr': 1.5586664309232824e-06, 'weight_decay': 0.0008227664668621182, 'epochs': 145, 'loss': 'mae', 'optimizer': 'adam', 'graph_mode': 'off', 'use_snp_selection': True, 'num_snps': 32148}. Best is trial 1 with value: 0.24598969809998877.
[I 2025-12-05 14:30:40,831] Trial 6 finished with value: 0.23054616751721624 and parameters: {'model_type': 'mlp', 'hidden_dims': '[256, 128]', 'dropout': 0.3930109900265879, 'batch_norm': False, 'lr': 4.892964372128395e-05, 'weight_decay': 1.5809549317992182e-06, 'epochs': 199, 'loss': 'mse', 'optimizer': 'adam', 'graph_mode': 'off', 'use_snp_selection': False}. Best is trial 1 with value: 0.24598969809998877.
[I 2025-12-05 14:31:15,430] Trial 7 finished with value: 0.24010735757840954 and parameters: {'model_type': 'mlp', 'hidden_dims': '[512, 256]', 'dropout': 0.15343979219678458, 'batch_norm': True, 'lr': 6.234003099047341e-05, 'weight_decay': 3.894760610535477e-07, 'epochs': 97, 'loss': 'mse', 'optimizer': 'adam', 'graph_mode': 'off', 'use_snp_selection': False}. Best is trial 1 with value: 0.24598969809998877.
[I 2025-12-05 14:32:49,862] Trial 8 finished with value: 0.24149217134827822 and parameters: {'model_type': 'mlp', 'hidden_dims': '[512, 128]', 'dropout': 0.10743001231661406, 'batch_norm': True, 'lr': 0.00023728538449271062, 'weight_decay': 1.7629071578048637e-05, 'epochs': 312, 'loss': 'mae', 'optimizer': 'adam', 'graph_mode': 'off', 'use_snp_selection': False}. Best is trial 1 with value: 0.24598969809998877.
[I 2025-12-05 14:33:46,248] Trial 9 finished with value: 0.24447803473781682 and parameters: {'model_type': 'mlp', 'hidden_dims': '[512, 64]', 'dropout': 0.14505336736221927, 'batch_norm': True, 'lr': 5.8619638388111826e-05, 'weight_decay': 6.200156172669308e-07, 'epochs': 175, 'loss': 'mse', 'optimizer': 'adam', 'graph_mode': 'off', 'use_snp_selection': False}. Best is trial 1 with value: 0.24598969809998877.
[I 2025-12-05 14:34:25,247] Trial 10 finished with value: 0.21500421687885693 and parameters: {'model_type': 'mlp', 'hidden_dims': '[256, 128]', 'dropout': 0.5365714961141473, 'batch_norm': False, 'lr': 0.00032955828969150785, 'weight_decay': 3.381683344261174e-06, 'epochs': 236, 'loss': 'mae', 'optimizer': 'adam', 'graph_mode': 'off', 'use_snp_selection': False}. Best is trial 1 with value: 0.24598969809998877.
[I 2025-12-05 14:35:05,964] Trial 11 finished with value: 0.23831074333185417 and parameters: {'model_type': 'mlp', 'hidden_dims': '[256, 128]', 'dropout': 0.5874224943486895, 'batch_norm': False, 'lr': 1.0179754910949672e-05, 'weight_decay': 2.2706826306130984e-05, 'epochs': 243, 'loss': 'mae', 'optimizer': 'adam', 'graph_mode': 'off', 'use_snp_selection': False}. Best is trial 1 with value: 0.24598969809998877.
[I 2025-12-05 14:36:32,673] Trial 12 finished with value: 0.244324022170826 and parameters: {'model_type': 'mlp', 'hidden_dims': '[512, 64]', 'dropout': 0.4856805755923864, 'batch_norm': False, 'lr': 1.3209655691727925e-05, 'weight_decay': 5.275092102447975e-06, 'epochs': 288, 'loss': 'mae', 'optimizer': 'adam', 'graph_mode': 'off', 'use_snp_selection': False}. Best is trial 1 with value: 0.24598969809998877.
[I 2025-12-05 14:36:42,493] Trial 13 finished with value: 0.228426174091523 and parameters: {'model_type': 'mlp', 'hidden_dims': '[128, 64]', 'dropout': 0.2928077166712909, 'batch_norm': False, 'lr': 1.3373175420781734e-05, 'weight_decay': 6.713476180492357e-05, 'epochs': 52, 'loss': 'mae', 'optimizer': 'adam', 'graph_mode': 'off', 'use_snp_selection': False}. Best is trial 1 with value: 0.24598969809998877.
[I 2025-12-05 14:37:38,827] Trial 14 finished with value: 0.2465965927344266 and parameters: {'model_type': 'mlp', 'hidden_dims': '[256, 128, 64]', 'dropout': 0.47766466243485906, 'batch_norm': True, 'lr': 0.0001457690241539883, 'weight_decay': 1.1414924884997386e-07, 'epochs': 348, 'loss': 'mae', 'optimizer': 'adam', 'graph_mode': 'off', 'use_snp_selection': False}. Best is trial 14 with value: 0.2465965927344266.
[I 2025-12-05 14:38:19,610] Trial 15 finished with value: 0.24594577720761013 and parameters: {'model_type': 'mlp', 'hidden_dims': '[256, 128, 64]', 'dropout': 0.46747358890446983, 'batch_norm': True, 'lr': 0.0001484615019442469, 'weight_decay': 1.2323424272263762e-07, 'epochs': 239, 'loss': 'mae', 'optimizer': 'adam', 'graph_mode': 'off', 'use_snp_selection': False}. Best is trial 14 with value: 0.2465965927344266.
[I 2025-12-05 14:39:16,248] Trial 16 finished with value: 0.23879506577210424 and parameters: {'model_type': 'mlp', 'hidden_dims': '[256, 128, 64]', 'dropout': 0.4618478150007869, 'batch_norm': True, 'lr': 0.0007022212212973277, 'weight_decay': 1.3072048124779758e-07, 'epochs': 349, 'loss': 'mae', 'optimizer': 'adam', 'graph_mode': 'off', 'use_snp_selection': False}. Best is trial 14 with value: 0.2465965927344266.
[I 2025-12-05 14:40:43,136] Trial 17 finished with value: 0.24790590556583103 and parameters: {'model_type': 'mlp', 'hidden_dims': '[512, 256]', 'dropout': 0.32307229329471576, 'batch_norm': True, 'lr': 0.0001275431231574476, 'weight_decay': 1.3398043894594233e-06, 'epochs': 283, 'loss': 'mae', 'optimizer': 'adam', 'graph_mode': 'off', 'use_snp_selection': False}. Best is trial 17 with value: 0.24790590556583103.
[I 2025-12-05 14:42:45,543] Trial 18 finished with value: 0.24363185532914153 and parameters: {'model_type': 'mlp', 'hidden_dims': '[512, 256]', 'dropout': 0.2867756763701994, 'batch_norm': True, 'lr': 0.000985592983325599, 'weight_decay': 4.853122657129429e-07, 'epochs': 283, 'loss': 'mae', 'optimizer': 'adam', 'graph_mode': 'off', 'use_snp_selection': True, 'num_snps': 58241}. Best is trial 17 with value: 0.24790590556583103.
[I 2025-12-05 14:44:18,209] Trial 19 finished with value: 0.24252680554454958 and parameters: {'model_type': 'mlp', 'hidden_dims': '[512, 256]', 'dropout': 0.33800336817648224, 'batch_norm': True, 'lr': 0.00014334793979738487, 'weight_decay': 1.4795269493140538e-06, 'epochs': 305, 'loss': 'mae', 'optimizer': 'adam', 'graph_mode': 'off', 'use_snp_selection': False}. Best is trial 17 with value: 0.24790590556583103.
[I 2025-12-05 14:45:02,598] Trial 20 finished with value: 0.22969936907187982 and parameters: {'model_type': 'mlp', 'hidden_dims': '[256, 128, 64]', 'dropout': 0.3450329587477516, 'batch_norm': True, 'lr': 2.4268541441863785e-05, 'weight_decay': 2.6502820248218645e-07, 'epochs': 264, 'loss': 'mae', 'optimizer': 'adam', 'graph_mode': 'off', 'use_snp_selection': False}. Best is trial 17 with value: 0.24790590556583103.
[I 2025-12-05 14:45:37,867] Trial 21 finished with value: 0.24359740776985594 and parameters: {'model_type': 'mlp', 'hidden_dims': '[256, 128]', 'dropout': 0.42402645236597214, 'batch_norm': True, 'lr': 0.00011467620668229786, 'weight_decay': 6.128200887702149e-06, 'epochs': 201, 'loss': 'mae', 'optimizer': 'adam', 'graph_mode': 'off', 'use_snp_selection': False}. Best is trial 17 with value: 0.24790590556583103.
[I 2025-12-05 14:46:56,389] Trial 22 finished with value: 0.24266945736144763 and parameters: {'model_type': 'mlp', 'hidden_dims': '[512, 256]', 'dropout': 0.5245528156692202, 'batch_norm': True, 'lr': 0.00042407954375582856, 'weight_decay': 1.5239177099132598e-06, 'epochs': 253, 'loss': 'mae', 'optimizer': 'adam', 'graph_mode': 'off', 'use_snp_selection': False}. Best is trial 17 with value: 0.24790590556583103.
[I 2025-12-05 14:47:35,006] Trial 23 finished with value: 0.2521825967980717 and parameters: {'model_type': 'mlp', 'hidden_dims': '[256, 128]', 'dropout': 0.430798315849405, 'batch_norm': True, 'lr': 3.155110279703723e-05, 'weight_decay': 2.841244902572497e-06, 'epochs': 225, 'loss': 'mae', 'optimizer': 'adam', 'graph_mode': 'off', 'use_snp_selection': False}. Best is trial 23 with value: 0.2521825967980717.
[I 2025-12-05 14:48:13,340] Trial 24 finished with value: 0.25073067427132656 and parameters: {'model_type': 'mlp', 'hidden_dims': '[256, 128, 64]', 'dropout': 0.5246088664271388, 'batch_norm': True, 'lr': 2.7163386299652186e-05, 'weight_decay': 9.372805358999055e-07, 'epochs': 222, 'loss': 'mae', 'optimizer': 'adam', 'graph_mode': 'off', 'use_snp_selection': False}. Best is trial 23 with value: 0.2521825967980717.
[I 2025-12-05 14:49:20,812] Trial 25 finished with value: 0.2500787260489191 and parameters: {'model_type': 'mlp', 'hidden_dims': '[512, 256]', 'dropout': 0.5335323239954018, 'batch_norm': True, 'lr': 3.6336420956738786e-05, 'weight_decay': 2.746576925737542e-06, 'epochs': 214, 'loss': 'mae', 'optimizer': 'adam', 'graph_mode': 'off', 'use_snp_selection': False}. Best is trial 23 with value: 0.2521825967980717.
[I 2025-12-05 14:49:56,387] Trial 26 finished with value: 0.20295347324549357 and parameters: {'model_type': 'mlp', 'hidden_dims': '[512, 128]', 'dropout': 0.539320019634568, 'batch_norm': True, 'lr': 2.2544421020662615e-05, 'weight_decay': 2.443643243280606e-06, 'epochs': 214, 'loss': 'mae', 'optimizer': 'adam', 'graph_mode': 'off', 'use_snp_selection': True, 'num_snps': 3842}. Best is trial 23 with value: 0.2521825967980717.
[I 2025-12-05 14:50:14,579] Trial 27 finished with value: 0.2418589606145781 and parameters: {'model_type': 'mlp', 'hidden_dims': '[128, 64]', 'dropout': 0.5574296547790313, 'batch_norm': True, 'lr': 3.708794373669967e-05, 'weight_decay': 6.777086077327474e-07, 'epochs': 169, 'loss': 'mse', 'optimizer': 'adam', 'graph_mode': 'off', 'use_snp_selection': False}. Best is trial 23 with value: 0.2521825967980717.
[I 2025-12-05 14:50:38,783] Trial 28 finished with value: 0.23273990646825565 and parameters: {'model_type': 'mlp', 'hidden_dims': '[256, 128]', 'dropout': 0.5764047855168238, 'batch_norm': True, 'lr': 2.1365297372215946e-05, 'weight_decay': 6.0422878942728895e-06, 'epochs': 125, 'loss': 'mae', 'optimizer': 'adam', 'graph_mode': 'off', 'use_snp_selection': False}. Best is trial 23 with value: 0.2521825967980717.
[I 2025-12-05 14:51:20,974] Trial 29 finished with value: 0.1571119883804442 and parameters: {'model_type': 'mlp', 'hidden_dims': '[128, 64]', 'dropout': 0.5127049387778695, 'batch_norm': True, 'lr': 3.1868653642222323e-06, 'weight_decay': 5.5227103357724904e-05, 'epochs': 220, 'loss': 'mae', 'optimizer': 'adam', 'graph_mode': 'off', 'use_snp_selection': True, 'num_snps': 19468}. Best is trial 23 with value: 0.2521825967980717.
[I 2025-12-05 14:51:53,555] Trial 30 finished with value: 0.2055646313466632 and parameters: {'model_type': 'mlp', 'hidden_dims': '[256, 128, 64]', 'dropout': 0.4999955354716147, 'batch_norm': True, 'lr': 7.6088254603734275e-06, 'weight_decay': 9.800678496263306e-07, 'epochs': 183, 'loss': 'mae', 'optimizer': 'adam', 'graph_mode': 'off', 'use_snp_selection': False}. Best is trial 23 with value: 0.2521825967980717.
[I 2025-12-05 14:53:03,573] Trial 31 finished with value: 0.2456284348364001 and parameters: {'model_type': 'mlp', 'hidden_dims': '[512, 256]', 'dropout': 0.21752397352559874, 'batch_norm': True, 'lr': 3.3887151354418794e-05, 'weight_decay': 2.931347468819864e-06, 'epochs': 224, 'loss': 'mae', 'optimizer': 'adam', 'graph_mode': 'off', 'use_snp_selection': False}. Best is trial 23 with value: 0.2521825967980717.
[I 2025-12-05 14:54:24,391] Trial 32 finished with value: 0.2503696062996014 and parameters: {'model_type': 'mlp', 'hidden_dims': '[512, 256]', 'dropout': 0.44834601656039064, 'batch_norm': True, 'lr': 1.62816787013334e-05, 'weight_decay': 9.447515136934253e-07, 'epochs': 262, 'loss': 'mae', 'optimizer': 'adam', 'graph_mode': 'off', 'use_snp_selection': False}. Best is trial 23 with value: 0.2521825967980717.
[I 2025-12-05 14:55:44,287] Trial 33 finished with value: 0.2390065741750751 and parameters: {'model_type': 'mlp', 'hidden_dims': '[512, 256]', 'dropout': 0.44601680415613654, 'batch_norm': True, 'lr': 1.6010275128429304e-05, 'weight_decay': 9.847270471981176e-06, 'epochs': 258, 'loss': 'mae', 'optimizer': 'adam', 'graph_mode': 'off', 'use_snp_selection': False}. Best is trial 23 with value: 0.2521825967980717.
[I 2025-12-05 14:56:49,131] Trial 34 finished with value: 0.2466471947007809 and parameters: {'model_type': 'mlp', 'hidden_dims': '[512, 256]', 'dropout': 0.39407353961426334, 'batch_norm': True, 'lr': 7.901818026240622e-05, 'weight_decay': 3.4657253715846446e-07, 'epochs': 204, 'loss': 'mae', 'optimizer': 'adam', 'graph_mode': 'off', 'use_snp_selection': False}. Best is trial 23 with value: 0.2521825967980717.
[I 2025-12-05 14:57:48,324] Trial 35 finished with value: 0.21674198844063208 and parameters: {'model_type': 'mlp', 'hidden_dims': '[512, 256]', 'dropout': 0.43024169205778806, 'batch_norm': True, 'lr': 3.1102925098534055e-06, 'weight_decay': 2.4149823039197786e-07, 'epochs': 184, 'loss': 'mae', 'optimizer': 'adam', 'graph_mode': 'off', 'use_snp_selection': False}. Best is trial 23 with value: 0.2521825967980717.
[I 2025-12-05 14:59:00,091] Trial 36 finished with value: 0.22510122481298916 and parameters: {'model_type': 'mlp', 'hidden_dims': '[256, 128]', 'dropout': 0.5605582824567368, 'batch_norm': True, 'lr': 6.47529206789951e-06, 'weight_decay': 7.950335121351407e-07, 'epochs': 160, 'loss': 'mse', 'optimizer': 'adam', 'graph_mode': 'off', 'use_snp_selection': True, 'num_snps': 58661}. Best is trial 23 with value: 0.2521825967980717.
[I 2025-12-05 14:59:39,590] Trial 37 finished with value: 0.24800176808369537 and parameters: {'model_type': 'mlp', 'hidden_dims': '[256, 128, 64]', 'dropout': 0.37851420907435895, 'batch_norm': True, 'lr': 3.817683982422633e-05, 'weight_decay': 2.412077575940257e-06, 'epochs': 232, 'loss': 'mae', 'optimizer': 'adam', 'graph_mode': 'off', 'use_snp_selection': False}. Best is trial 23 with value: 0.2521825967980717.
[I 2025-12-05 15:00:39,944] Trial 38 finished with value: 0.24728437568262623 and parameters: {'model_type': 'mlp', 'hidden_dims': '[512, 256]', 'dropout': 0.5017210251335661, 'batch_norm': False, 'lr': 8.725513339320602e-05, 'weight_decay': 4.3752329093801525e-06, 'epochs': 267, 'loss': 'mse', 'optimizer': 'adam', 'graph_mode': 'off', 'use_snp_selection': True, 'num_snps': 19911}. Best is trial 23 with value: 0.2521825967980717.
[I 2025-12-05 15:02:09,946] Trial 39 finished with value: 0.21316390225723736 and parameters: {'model_type': 'mlp', 'hidden_dims': '[512, 128]', 'dropout': 0.4502369293078068, 'batch_norm': True, 'lr': 4.642307621909076e-06, 'weight_decay': 1.4718775555476421e-05, 'epochs': 298, 'loss': 'mae', 'optimizer': 'adam', 'graph_mode': 'off', 'use_snp_selection': False}. Best is trial 23 with value: 0.2521825967980717.
[I 2025-12-05 15:02:46,681] Trial 40 finished with value: 0.2426796688659484 and parameters: {'model_type': 'mlp', 'hidden_dims': '[256, 128]', 'dropout': 0.42022565324696204, 'batch_norm': True, 'lr': 4.769981732268114e-05, 'weight_decay': 9.090167228471526e-06, 'epochs': 213, 'loss': 'mae', 'optimizer': 'adam', 'graph_mode': 'off', 'use_snp_selection': False}. Best is trial 23 with value: 0.2521825967980717.
[I 2025-12-05 15:03:26,804] Trial 41 finished with value: 0.24818776003611495 and parameters: {'model_type': 'mlp', 'hidden_dims': '[256, 128, 64]', 'dropout': 0.3716081310069049, 'batch_norm': True, 'lr': 2.9362447562949258e-05, 'weight_decay': 2.6547006755559354e-06, 'epochs': 235, 'loss': 'mae', 'optimizer': 'adam', 'graph_mode': 'off', 'use_snp_selection': False}. Best is trial 23 with value: 0.2521825967980717.
[I 2025-12-05 15:04:08,851] Trial 42 finished with value: 0.24083092496285782 and parameters: {'model_type': 'mlp', 'hidden_dims': '[256, 128, 64]', 'dropout': 0.3669787567870859, 'batch_norm': True, 'lr': 1.77525834319578e-05, 'weight_decay': 2.11146931910023e-06, 'epochs': 248, 'loss': 'mae', 'optimizer': 'adam', 'graph_mode': 'off', 'use_snp_selection': False}. Best is trial 23 with value: 0.2521825967980717.
[I 2025-12-05 15:04:42,608] Trial 43 finished with value: 0.24072276604775583 and parameters: {'model_type': 'mlp', 'hidden_dims': '[256, 128, 64]', 'dropout': 0.4138272414411194, 'batch_norm': True, 'lr': 2.695483057891215e-05, 'weight_decay': 1.178331755437855e-06, 'epochs': 190, 'loss': 'mae', 'optimizer': 'adam', 'graph_mode': 'off', 'use_snp_selection': False}. Best is trial 23 with value: 0.2521825967980717.
[I 2025-12-05 15:06:05,151] Trial 44 finished with value: 0.22731317326153958 and parameters: {'model_type': 'mlp', 'hidden_dims': '[512, 64]', 'dropout': 0.48485447432484496, 'batch_norm': True, 'lr': 9.885984258322839e-06, 'weight_decay': 8.059021016813298e-07, 'epochs': 270, 'loss': 'mae', 'optimizer': 'adam', 'graph_mode': 'off', 'use_snp_selection': False}. Best is trial 23 with value: 0.2521825967980717.
[I 2025-12-05 15:06:30,373] Trial 45 finished with value: 0.23462917583305054 and parameters: {'model_type': 'mlp', 'hidden_dims': '[256, 128, 64]', 'dropout': 0.3993663007794331, 'batch_norm': False, 'lr': 4.8326533158410193e-05, 'weight_decay': 3.2872889486178993e-05, 'epochs': 133, 'loss': 'mse', 'optimizer': 'adam', 'graph_mode': 'off', 'use_snp_selection': False}. Best is trial 23 with value: 0.2521825967980717.
[I 2025-12-05 15:07:09,210] Trial 46 finished with value: 0.22280105983765425 and parameters: {'model_type': 'mlp', 'hidden_dims': '[256, 128, 64]', 'dropout': 0.5978823819996755, 'batch_norm': True, 'lr': 9.781055565906641e-06, 'weight_decay': 4.3730126245138554e-06, 'epochs': 225, 'loss': 'mae', 'optimizer': 'adam', 'graph_mode': 'off', 'use_snp_selection': False}. Best is trial 23 with value: 0.2521825967980717.
[I 2025-12-05 15:07:45,366] Trial 47 finished with value: 0.23604318326201423 and parameters: {'model_type': 'mlp', 'hidden_dims': '[256, 128]', 'dropout': 0.5376643813544225, 'batch_norm': True, 'lr': 3.250731211652954e-05, 'weight_decay': 1.8666498631270566e-06, 'epochs': 208, 'loss': 'mae', 'optimizer': 'adam', 'graph_mode': 'off', 'use_snp_selection': False}. Best is trial 23 with value: 0.2521825967980717.
[I 2025-12-05 15:08:57,811] Trial 48 finished with value: 0.23708816653229592 and parameters: {'model_type': 'mlp', 'hidden_dims': '[512, 128]', 'dropout': 0.3125974926623337, 'batch_norm': False, 'lr': 6.248710654964747e-05, 'weight_decay': 3.7000470621611806e-06, 'epochs': 240, 'loss': 'mae', 'optimizer': 'adam', 'graph_mode': 'off', 'use_snp_selection': False}. Best is trial 23 with value: 0.2521825967980717.
[I 2025-12-05 15:10:36,495] Trial 49 finished with value: 0.23709305098307726 and parameters: {'model_type': 'mlp', 'hidden_dims': '[512, 64]', 'dropout': 0.36167318450128966, 'batch_norm': True, 'lr': 1.5436909279420444e-05, 'weight_decay': 5.199797077128906e-07, 'epochs': 254, 'loss': 'mse', 'optimizer': 'adam', 'graph_mode': 'off', 'use_snp_selection': True, 'num_snps': 46888}. Best is trial 23 with value: 0.2521825967980717.
[I 2025-12-05 15:10:56,580] Trial 50 finished with value: 0.2339518348833835 and parameters: {'model_type': 'mlp', 'hidden_dims': '[128, 64]', 'dropout': 0.45850443978451955, 'batch_norm': True, 'lr': 2.0024062321654754e-05, 'weight_decay': 6.774830206481257e-06, 'epochs': 195, 'loss': 'mae', 'optimizer': 'adam', 'graph_mode': 'off', 'use_snp_selection': False}. Best is trial 23 with value: 0.2521825967980717.
[I 2025-12-05 15:11:35,154] Trial 51 finished with value: 0.24857182315597517 and parameters: {'model_type': 'mlp', 'hidden_dims': '[256, 128, 64]', 'dropout': 0.3944691353538601, 'batch_norm': True, 'lr': 3.901045533396151e-05, 'weight_decay': 2.725694388232458e-06, 'epochs': 225, 'loss': 'mae', 'optimizer': 'adam', 'graph_mode': 'off', 'use_snp_selection': False}. Best is trial 23 with value: 0.2521825967980717.
