[I 2025-12-05 14:59:53,187] Trial 31 finished with value: 0.06703829950392944 and parameters: {'model_type': 'mlp', 'hidden_dims': '[512, 256]', 'dropout': 0.16523927838264735, 'batch_norm': False, 'lr': 3.0789743887487395e-05, 'weight_decay': 5.991387654728241e-07, 'epochs': 56, 'loss': 'mae', 'optimizer': 'adam', 'graph_mode': 'off', 'use_snp_selection': True, 'num_snps': 39432}. Best is trial 13 with value: 0.09011124815719353.
[I 2025-12-05 14:59:55,503] Trial 32 finished with value: 0.07249603306136249 and parameters: {'model_type': 'mlp', 'hidden_dims': '[128, 64]', 'dropout': 0.21302742992307389, 'batch_norm': False, 'lr': 8.940921365126957e-05, 'weight_decay': 1.4511654501648528e-07, 'epochs': 229, 'loss': 'mae', 'optimizer': 'adam', 'graph_mode': 'off', 'use_snp_selection': True, 'num_snps': 51869}. Best is trial 13 with value: 0.09011124815719353.
[I 2025-12-05 14:59:57,271] Trial 33 finished with value: 0.08727401985132469 and parameters: {'model_type': 'mlp', 'hidden_dims': '[512, 256]', 'dropout': 0.2434469904593523, 'batch_norm': True, 'lr': 0.0006153013534260378, 'weight_decay': 8.187627274842485e-07, 'epochs': 177, 'loss': 'mae', 'optimizer': 'adam', 'graph_mode': 'off', 'use_snp_selection': True, 'num_snps': 28639}. Best is trial 13 with value: 0.09011124815719353.
[I 2025-12-05 14:59:58,709] Trial 34 finished with value: 0.06770307828353463 and parameters: {'model_type': 'mlp', 'hidden_dims': '[512, 256]', 'dropout': 0.25821460926059314, 'batch_norm': False, 'lr': 0.00035583342646440037, 'weight_decay': 9.800256073455649e-06, 'epochs': 123, 'loss': 'mae', 'optimizer': 'adam', 'graph_mode': 'off', 'use_snp_selection': True, 'num_snps': 24599}. Best is trial 13 with value: 0.09011124815719353.
[I 2025-12-05 15:00:00,281] Trial 35 finished with value: 0.04473575170889038 and parameters: {'model_type': 'mlp', 'hidden_dims': '[512, 256]', 'dropout': 0.45475278926631024, 'batch_norm': False, 'lr': 8.41083366494698e-06, 'weight_decay': 8.906733673198652e-07, 'epochs': 164, 'loss': 'mae', 'optimizer': 'adam', 'graph_mode': 'off', 'use_snp_selection': True, 'num_snps': 26363}. Best is trial 13 with value: 0.09011124815719353.
[I 2025-12-05 15:00:02,560] Trial 36 finished with value: 0.010292093611682726 and parameters: {'model_type': 'mlp', 'hidden_dims': '[512, 256]', 'dropout': 0.3058693365710339, 'batch_norm': True, 'lr': 3.10252794293614e-06, 'weight_decay': 2.3264595379091287e-06, 'epochs': 123, 'loss': 'mse', 'optimizer': 'adam', 'graph_mode': 'off', 'use_snp_selection': True, 'num_snps': 42311}. Best is trial 13 with value: 0.09011124815719353.
[I 2025-12-05 15:00:04,406] Trial 37 finished with value: 0.06737984908878575 and parameters: {'model_type': 'mlp', 'hidden_dims': '[256, 128]', 'dropout': 0.24609237050778623, 'batch_norm': True, 'lr': 0.00019506992985598558, 'weight_decay': 1.5601780781102917e-05, 'epochs': 188, 'loss': 'mae', 'optimizer': 'adam', 'graph_mode': 'off', 'use_snp_selection': True, 'num_snps': 32813}. Best is trial 13 with value: 0.09011124815719353.
[I 2025-12-05 15:00:06,986] Trial 38 finished with value: 0.06154136942585728 and parameters: {'model_type': 'mlp', 'hidden_dims': '[512, 64]', 'dropout': 0.3621269752553935, 'batch_norm': False, 'lr': 3.77360444656538e-05, 'weight_decay': 1.0559621156581787e-06, 'epochs': 139, 'loss': 'mse', 'optimizer': 'adam', 'graph_mode': 'off', 'use_snp_selection': True, 'num_snps': 52094}. Best is trial 13 with value: 0.09011124815719353.
[I 2025-12-05 15:00:09,437] Trial 39 finished with value: 0.0394635763925091 and parameters: {'model_type': 'mlp', 'hidden_dims': '[512, 256]', 'dropout': 0.5759184926124662, 'batch_norm': True, 'lr': 8.872397753806898e-05, 'weight_decay': 6.2507591315976694e-06, 'epochs': 79, 'loss': 'mae', 'optimizer': 'adam', 'graph_mode': 'off', 'use_snp_selection': True, 'num_snps': 53290}. Best is trial 13 with value: 0.09011124815719353.
[I 2025-12-05 15:00:10,925] Trial 40 finished with value: 0.0432376005988081 and parameters: {'model_type': 'mlp', 'hidden_dims': '[256, 128, 64]', 'dropout': 0.269269437149507, 'batch_norm': False, 'lr': 4.197132957062296e-06, 'weight_decay': 2.2042630206541186e-06, 'epochs': 322, 'loss': 'mae', 'optimizer': 'adam', 'graph_mode': 'off', 'use_snp_selection': True, 'num_snps': 19921}. Best is trial 13 with value: 0.09011124815719353.
[I 2025-12-05 15:00:12,425] Trial 41 finished with value: 0.08583958444725713 and parameters: {'model_type': 'mlp', 'hidden_dims': '[512, 128]', 'dropout': 0.13182144938501464, 'batch_norm': True, 'lr': 0.000692843076500582, 'weight_decay': 1.9676519647305144e-07, 'epochs': 205, 'loss': 'mae', 'optimizer': 'adam', 'graph_mode': 'off', 'use_snp_selection': False}. Best is trial 13 with value: 0.09011124815719353.
[I 2025-12-05 15:00:13,972] Trial 42 finished with value: 0.07226761018350979 and parameters: {'model_type': 'mlp', 'hidden_dims': '[512, 128]', 'dropout': 0.18186882205408456, 'batch_norm': True, 'lr': 0.0005323541515322679, 'weight_decay': 3.4372399661067973e-07, 'epochs': 216, 'loss': 'mae', 'optimizer': 'adam', 'graph_mode': 'off', 'use_snp_selection': False}. Best is trial 13 with value: 0.09011124815719353.
[I 2025-12-05 15:00:15,444] Trial 43 finished with value: 0.07543773151884223 and parameters: {'model_type': 'mlp', 'hidden_dims': '[512, 64]', 'dropout': 0.13662113576926788, 'batch_norm': True, 'lr': 0.0003145450948739789, 'weight_decay': 2.1169293713605152e-07, 'epochs': 199, 'loss': 'mae', 'optimizer': 'adam', 'graph_mode': 'off', 'use_snp_selection': False}. Best is trial 13 with value: 0.09011124815719353.
[I 2025-12-05 15:00:17,464] Trial 44 finished with value: 0.08874326290045645 and parameters: {'model_type': 'mlp', 'hidden_dims': '[512, 128]', 'dropout': 0.23238510850405963, 'batch_norm': True, 'lr': 0.000749730670243568, 'weight_decay': 5.276223165256618e-07, 'epochs': 167, 'loss': 'mse', 'optimizer': 'adam', 'graph_mode': 'off', 'use_snp_selection': True, 'num_snps': 36348}. Best is trial 13 with value: 0.09011124815719353.
[I 2025-12-05 15:00:18,806] Trial 45 finished with value: 0.07902126971170247 and parameters: {'model_type': 'mlp', 'hidden_dims': '[512, 128]', 'dropout': 0.22911611937849394, 'batch_norm': True, 'lr': 0.0007421391060514283, 'weight_decay': 4.969642840587664e-07, 'epochs': 172, 'loss': 'mse', 'optimizer': 'adam', 'graph_mode': 'off', 'use_snp_selection': False}. Best is trial 13 with value: 0.09011124815719353.
[I 2025-12-05 15:00:20,019] Trial 46 finished with value: 0.09240118364054609 and parameters: {'model_type': 'mlp', 'hidden_dims': '[512, 128]', 'dropout': 0.16554536509183512, 'batch_norm': True, 'lr': 0.0004598305693522178, 'weight_decay': 7.591218262365538e-07, 'epochs': 195, 'loss': 'mse', 'optimizer': 'adam', 'graph_mode': 'off', 'use_snp_selection': True, 'num_snps': 14647}. Best is trial 46 with value: 0.09240118364054609.
[I 2025-12-05 15:00:21,265] Trial 47 finished with value: 0.08473466040807945 and parameters: {'model_type': 'mlp', 'hidden_dims': '[512, 128]', 'dropout': 0.15870502810968434, 'batch_norm': True, 'lr': 0.0004929887452465604, 'weight_decay': 8.31060521028039e-07, 'epochs': 146, 'loss': 'mse', 'optimizer': 'adam', 'graph_mode': 'off', 'use_snp_selection': False}. Best is trial 46 with value: 0.09240118364054609.
[I 2025-12-05 15:00:22,689] Trial 48 finished with value: 0.08497327010704026 and parameters: {'model_type': 'mlp', 'hidden_dims': '[512, 128]', 'dropout': 0.12242763477213003, 'batch_norm': True, 'lr': 0.0009060017067376966, 'weight_decay': 4.3664436267127294e-07, 'epochs': 194, 'loss': 'mse', 'optimizer': 'adam', 'graph_mode': 'off', 'use_snp_selection': False}. Best is trial 46 with value: 0.09240118364054609.
[I 2025-12-05 15:00:23,966] Trial 49 finished with value: 0.08012789206646558 and parameters: {'model_type': 'mlp', 'hidden_dims': '[512, 128]', 'dropout': 0.2890475494595357, 'batch_norm': True, 'lr': 0.00044313152919910217, 'weight_decay': 1.6151094914807943e-07, 'epochs': 162, 'loss': 'mse', 'optimizer': 'adam', 'graph_mode': 'off', 'use_snp_selection': True, 'num_snps': 15776}. Best is trial 46 with value: 0.09240118364054609.
[I 2025-12-05 15:00:24,875] Trial 50 finished with value: 0.09694604426009384 and parameters: {'model_type': 'mlp', 'hidden_dims': '[256, 128]', 'dropout': 0.22986584773922514, 'batch_norm': True, 'lr': 0.0006747416622906824, 'weight_decay': 1.7167515585950303e-06, 'epochs': 134, 'loss': 'mse', 'optimizer': 'adam', 'graph_mode': 'off', 'use_snp_selection': False}. Best is trial 50 with value: 0.09694604426009384.
[I 2025-12-05 15:00:25,778] Trial 51 finished with value: 0.08542535935899118 and parameters: {'model_type': 'mlp', 'hidden_dims': '[256, 128]', 'dropout': 0.23841433122994396, 'batch_norm': True, 'lr': 0.0006684625568474611, 'weight_decay': 7.507997996956988e-07, 'epochs': 139, 'loss': 'mse', 'optimizer': 'adam', 'graph_mode': 'off', 'use_snp_selection': False}. Best is trial 50 with value: 0.09694604426009384.
[I 2025-12-05 15:00:26,748] Trial 52 finished with value: 0.08541786253203149 and parameters: {'model_type': 'mlp', 'hidden_dims': '[256, 128]', 'dropout': 0.21443307616299284, 'batch_norm': True, 'lr': 0.0002886110765342108, 'weight_decay': 1.6455882899286212e-06, 'epochs': 173, 'loss': 'mse', 'optimizer': 'adam', 'graph_mode': 'off', 'use_snp_selection': False}. Best is trial 50 with value: 0.09694604426009384.
[I 2025-12-05 15:00:27,731] Trial 53 finished with value: 0.0883913950618263 and parameters: {'model_type': 'mlp', 'hidden_dims': '[256, 128]', 'dropout': 0.32389209188657797, 'batch_norm': True, 'lr': 0.000748682115193929, 'weight_decay': 2.6316134850882943e-06, 'epochs': 182, 'loss': 'mse', 'optimizer': 'adam', 'graph_mode': 'off', 'use_snp_selection': False}. Best is trial 50 with value: 0.09694604426009384.
[I 2025-12-05 15:00:28,683] Trial 54 finished with value: 0.07329800709693589 and parameters: {'model_type': 'mlp', 'hidden_dims': '[256, 128]', 'dropout': 0.3216497999815237, 'batch_norm': True, 'lr': 0.0009439987310334694, 'weight_decay': 2.7829940027554178e-06, 'epochs': 181, 'loss': 'mse', 'optimizer': 'adam', 'graph_mode': 'off', 'use_snp_selection': False}. Best is trial 50 with value: 0.09694604426009384.
[I 2025-12-05 15:00:29,537] Trial 55 finished with value: 0.08415194002553995 and parameters: {'model_type': 'mlp', 'hidden_dims': '[256, 128]', 'dropout': 0.27058574981775063, 'batch_norm': True, 'lr': 0.00040752080007671004, 'weight_decay': 1.3528415461842607e-06, 'epochs': 132, 'loss': 'mse', 'optimizer': 'adam', 'graph_mode': 'off', 'use_snp_selection': False}. Best is trial 50 with value: 0.09694604426009384.
[I 2025-12-05 15:00:30,438] Trial 56 finished with value: 0.09020172665314846 and parameters: {'model_type': 'mlp', 'hidden_dims': '[256, 128]', 'dropout': 0.39256927510404904, 'batch_norm': True, 'lr': 0.0005563975930869377, 'weight_decay': 1.795219617486398e-06, 'epochs': 157, 'loss': 'mse', 'optimizer': 'adam', 'graph_mode': 'off', 'use_snp_selection': False}. Best is trial 50 with value: 0.09694604426009384.
[I 2025-12-05 15:00:31,337] Trial 57 finished with value: 0.07584759016129065 and parameters: {'model_type': 'mlp', 'hidden_dims': '[256, 128]', 'dropout': 0.4273957568431878, 'batch_norm': True, 'lr': 0.0004933678310967957, 'weight_decay': 3.727642405594762e-06, 'epochs': 157, 'loss': 'mse', 'optimizer': 'adam', 'graph_mode': 'off', 'use_snp_selection': False}. Best is trial 50 with value: 0.09694604426009384.
[I 2025-12-05 15:00:32,308] Trial 58 finished with value: 0.08810455538459662 and parameters: {'model_type': 'mlp', 'hidden_dims': '[256, 128]', 'dropout': 0.397746027214853, 'batch_norm': True, 'lr': 0.00025007561275583896, 'weight_decay': 6.946159634965138e-06, 'epochs': 191, 'loss': 'mse', 'optimizer': 'adam', 'graph_mode': 'off', 'use_snp_selection': False}. Best is trial 50 with value: 0.09694604426009384.
[I 2025-12-05 15:00:33,334] Trial 59 finished with value: 0.07906525608840972 and parameters: {'model_type': 'mlp', 'hidden_dims': '[256, 128]', 'dropout': 0.380536119106786, 'batch_norm': True, 'lr': 0.0009647582032433248, 'weight_decay': 1.6411605483505002e-06, 'epochs': 218, 'loss': 'mse', 'optimizer': 'adam', 'graph_mode': 'off', 'use_snp_selection': False}. Best is trial 50 with value: 0.09694604426009384.
[I 2025-12-05 15:00:34,118] Trial 60 finished with value: 0.09486701759862853 and parameters: {'model_type': 'mlp', 'hidden_dims': '[256, 128]', 'dropout': 0.34923214413795434, 'batch_norm': True, 'lr': 0.00035726458407920345, 'weight_decay': 1.5398817251816497e-05, 'epochs': 98, 'loss': 'mse', 'optimizer': 'adam', 'graph_mode': 'off', 'use_snp_selection': False}. Best is trial 50 with value: 0.09694604426009384.
[I 2025-12-05 15:00:34,944] Trial 61 finished with value: 0.06498820027837604 and parameters: {'model_type': 'mlp', 'hidden_dims': '[256, 128]', 'dropout': 0.3481852409479451, 'batch_norm': True, 'lr': 0.0003503582941039175, 'weight_decay': 2.171070889525816e-05, 'epochs': 95, 'loss': 'mse', 'optimizer': 'adam', 'graph_mode': 'off', 'use_snp_selection': False}. Best is trial 50 with value: 0.09694604426009384.
[I 2025-12-05 15:00:35,800] Trial 62 finished with value: 0.0986576692760171 and parameters: {'model_type': 'mlp', 'hidden_dims': '[256, 128]', 'dropout': 0.461216091476102, 'batch_norm': True, 'lr': 0.0007211758806171183, 'weight_decay': 1.209433962247564e-05, 'epochs': 108, 'loss': 'mse', 'optimizer': 'adam', 'graph_mode': 'off', 'use_snp_selection': False}. Best is trial 62 with value: 0.0986576692760171.
[I 2025-12-05 15:00:36,648] Trial 63 finished with value: 0.07111494793052786 and parameters: {'model_type': 'mlp', 'hidden_dims': '[256, 128]', 'dropout': 0.4756891681421803, 'batch_norm': True, 'lr': 0.0001879862004360048, 'weight_decay': 1.4251104437096855e-05, 'epochs': 104, 'loss': 'mse', 'optimizer': 'adam', 'graph_mode': 'off', 'use_snp_selection': False}. Best is trial 62 with value: 0.0986576692760171.
[I 2025-12-05 15:00:37,429] Trial 64 finished with value: 0.06980754027074182 and parameters: {'model_type': 'mlp', 'hidden_dims': '[256, 128]', 'dropout': 0.45409714478561397, 'batch_norm': True, 'lr': 0.000569191519654972, 'weight_decay': 4.959137183740886e-06, 'epochs': 80, 'loss': 'mse', 'optimizer': 'adam', 'graph_mode': 'off', 'use_snp_selection': False}. Best is trial 62 with value: 0.0986576692760171.
[I 2025-12-05 15:00:38,127] Trial 65 finished with value: -0.008859409596080843 and parameters: {'model_type': 'mlp', 'hidden_dims': '[128, 64]', 'dropout': 0.530750515102338, 'batch_norm': True, 'lr': 1.038788092140181e-06, 'weight_decay': 2.502123904958087e-05, 'epochs': 105, 'loss': 'mse', 'optimizer': 'adam', 'graph_mode': 'off', 'use_snp_selection': False}. Best is trial 62 with value: 0.0986576692760171.
[I 2025-12-05 15:00:38,891] Trial 66 finished with value: 0.07694486001914022 and parameters: {'model_type': 'mlp', 'hidden_dims': '[256, 128]', 'dropout': 0.4115565171069979, 'batch_norm': True, 'lr': 0.0004099271076274841, 'weight_decay': 7.54832718609755e-06, 'epochs': 74, 'loss': 'mse', 'optimizer': 'adam', 'graph_mode': 'off', 'use_snp_selection': False}. Best is trial 62 with value: 0.0986576692760171.
[I 2025-12-05 15:00:39,751] Trial 67 finished with value: 0.07870811088111132 and parameters: {'model_type': 'mlp', 'hidden_dims': '[256, 128, 64]', 'dropout': 0.5045836366283617, 'batch_norm': True, 'lr': 0.0002927293427207516, 'weight_decay': 4.0397264089390675e-05, 'epochs': 129, 'loss': 'mse', 'optimizer': 'adam', 'graph_mode': 'off', 'use_snp_selection': False}. Best is trial 62 with value: 0.0986576692760171.
[I 2025-12-05 15:00:40,647] Trial 68 finished with value: 0.08216976444537742 and parameters: {'model_type': 'mlp', 'hidden_dims': '[256, 128]', 'dropout': 0.36098955530685406, 'batch_norm': True, 'lr': 0.00012991464700981613, 'weight_decay': 1.1342222731899841e-05, 'epochs': 152, 'loss': 'mse', 'optimizer': 'adam', 'graph_mode': 'off', 'use_snp_selection': False}. Best is trial 62 with value: 0.0986576692760171.
[I 2025-12-05 15:00:41,494] Trial 69 finished with value: 0.05716514852292143 and parameters: {'model_type': 'mlp', 'hidden_dims': '[512, 64]', 'dropout': 0.43797843556310573, 'batch_norm': True, 'lr': 0.0007327824295731936, 'weight_decay': 0.00013307178966639641, 'epochs': 42, 'loss': 'mse', 'optimizer': 'adam', 'graph_mode': 'off', 'use_snp_selection': False}. Best is trial 62 with value: 0.0986576692760171.
[I 2025-12-05 15:00:42,604] Trial 70 finished with value: 0.09058274361397695 and parameters: {'model_type': 'mlp', 'hidden_dims': '[512, 128]', 'dropout': 0.3868532762205744, 'batch_norm': True, 'lr': 0.0005529958287971352, 'weight_decay': 3.2393855347009105e-06, 'epochs': 111, 'loss': 'mse', 'optimizer': 'adam', 'graph_mode': 'off', 'use_snp_selection': False}. Best is trial 62 with value: 0.0986576692760171.
[I 2025-12-05 15:00:43,719] Trial 71 finished with value: 0.09478368075392657 and parameters: {'model_type': 'mlp', 'hidden_dims': '[512, 128]', 'dropout': 0.4019784156359469, 'batch_norm': True, 'lr': 0.0005224205970068157, 'weight_decay': 0.0009723175659163882, 'epochs': 110, 'loss': 'mse', 'optimizer': 'adam', 'graph_mode': 'off', 'use_snp_selection': False}. Best is trial 62 with value: 0.0986576692760171.
[I 2025-12-05 15:00:44,823] Trial 72 finished with value: 0.09483629324094166 and parameters: {'model_type': 'mlp', 'hidden_dims': '[512, 128]', 'dropout': 0.3815007288258884, 'batch_norm': True, 'lr': 0.0005391355660164373, 'weight_decay': 0.0007701797697900288, 'epochs': 110, 'loss': 'mse', 'optimizer': 'adam', 'graph_mode': 'off', 'use_snp_selection': False}. Best is trial 62 with value: 0.0986576692760171.
[I 2025-12-05 15:00:45,917] Trial 73 finished with value: 0.07513977633894801 and parameters: {'model_type': 'mlp', 'hidden_dims': '[512, 128]', 'dropout': 0.381698762951615, 'batch_norm': True, 'lr': 0.00037066742011731277, 'weight_decay': 0.0007037152712103526, 'epochs': 108, 'loss': 'mse', 'optimizer': 'adam', 'graph_mode': 'off', 'use_snp_selection': False}. Best is trial 62 with value: 0.0986576692760171.
[I 2025-12-05 15:00:46,974] Trial 74 finished with value: 0.08907144757805029 and parameters: {'model_type': 'mlp', 'hidden_dims': '[512, 128]', 'dropout': 0.4044981080633146, 'batch_norm': True, 'lr': 0.0005956445539489819, 'weight_decay': 0.000589530039799774, 'epochs': 85, 'loss': 'mse', 'optimizer': 'adam', 'graph_mode': 'off', 'use_snp_selection': False}. Best is trial 62 with value: 0.0986576692760171.
[I 2025-12-05 15:00:47,958] Trial 75 finished with value: 0.07550055555399902 and parameters: {'model_type': 'mlp', 'hidden_dims': '[512, 128]', 'dropout': 0.42406238957650044, 'batch_norm': True, 'lr': 0.00046712894502498164, 'weight_decay': 0.0003249234014913756, 'epochs': 64, 'loss': 'mse', 'optimizer': 'adam', 'graph_mode': 'off', 'use_snp_selection': False}. Best is trial 62 with value: 0.0986576692760171.
[I 2025-12-05 15:00:48,802] Trial 76 finished with value: 0.0870187204636848 and parameters: {'model_type': 'mlp', 'hidden_dims': '[256, 128]', 'dropout': 0.3717138491221525, 'batch_norm': True, 'lr': 0.00026748356666502475, 'weight_decay': 0.0004508963126038782, 'epochs': 110, 'loss': 'mse', 'optimizer': 'adam', 'graph_mode': 'off', 'use_snp_selection': False}. Best is trial 62 with value: 0.0986576692760171.
[I 2025-12-05 15:00:49,485] Trial 77 finished with value: 0.07634719260261344 and parameters: {'model_type': 'mlp', 'hidden_dims': '[128, 64]', 'dropout': 0.33431679154725313, 'batch_norm': True, 'lr': 0.0005631052763518445, 'weight_decay': 0.000890692134054523, 'epochs': 92, 'loss': 'mse', 'optimizer': 'adam', 'graph_mode': 'off', 'use_snp_selection': False}. Best is trial 62 with value: 0.0986576692760171.
[I 2025-12-05 15:00:50,659] Trial 78 finished with value: 0.09407542924683444 and parameters: {'model_type': 'mlp', 'hidden_dims': '[512, 128]', 'dropout': 0.39429508197766977, 'batch_norm': True, 'lr': 0.0008197134815496842, 'weight_decay': 0.00012973649699329833, 'epochs': 119, 'loss': 'mse', 'optimizer': 'adam', 'graph_mode': 'off', 'use_snp_selection': False}. Best is trial 62 with value: 0.0986576692760171.
[I 2025-12-05 15:00:51,798] Trial 79 finished with value: 0.06130334996284174 and parameters: {'model_type': 'mlp', 'hidden_dims': '[512, 128]', 'dropout': 0.4628900350632747, 'batch_norm': True, 'lr': 0.000847059701406995, 'weight_decay': 9.129699730290295e-05, 'epochs': 116, 'loss': 'mse', 'optimizer': 'adam', 'graph_mode': 'off', 'use_snp_selection': False}. Best is trial 62 with value: 0.0986576692760171.
[I 2025-12-05 15:00:52,866] Trial 80 finished with value: 0.09211397863501916 and parameters: {'model_type': 'mlp', 'hidden_dims': '[512, 128]', 'dropout': 0.4323511035269408, 'batch_norm': True, 'lr': 0.00022234046304296824, 'weight_decay': 0.00018335386628839785, 'epochs': 100, 'loss': 'mse', 'optimizer': 'adam', 'graph_mode': 'off', 'use_snp_selection': False}. Best is trial 62 with value: 0.0986576692760171.
[I 2025-12-05 15:00:53,928] Trial 81 finished with value: 0.06462360983766408 and parameters: {'model_type': 'mlp', 'hidden_dims': '[512, 128]', 'dropout': 0.4383139604300828, 'batch_norm': True, 'lr': 0.00032967259148845114, 'weight_decay': 0.00019383017914366307, 'epochs': 98, 'loss': 'mse', 'optimizer': 'adam', 'graph_mode': 'off', 'use_snp_selection': False}. Best is trial 62 with value: 0.0986576692760171.
[I 2025-12-05 15:00:55,102] Trial 82 finished with value: 0.08709095921033774 and parameters: {'model_type': 'mlp', 'hidden_dims': '[512, 128]', 'dropout': 0.4887976974414822, 'batch_norm': True, 'lr': 0.0002310998467666918, 'weight_decay': 0.0004963824222693809, 'epochs': 128, 'loss': 'mse', 'optimizer': 'adam', 'graph_mode': 'off', 'use_snp_selection': False}. Best is trial 62 with value: 0.0986576692760171.
