[I 2025-12-06 06:47:12,372] Trial 136 finished with value: 0.27239851726568975 and parameters: {'model_type': 'mlp', 'hidden_dims': '[256, 128]', 'dropout': 0.41826084556814336, 'batch_norm': False, 'lr': 3.6810959246600386e-05, 'weight_decay': 0.00012393612160502737, 'epochs': 45, 'loss': 'mae', 'optimizer': 'adam', 'graph_mode': 'off', 'use_snp_selection': True, 'num_snps': 25440}. Best is trial 125 with value: 0.30599796733831386.
[I 2025-12-06 06:47:58,714] Trial 137 finished with value: 0.28672863542436383 and parameters: {'model_type': 'mlp', 'hidden_dims': '[256, 128]', 'dropout': 0.35565191660788187, 'batch_norm': False, 'lr': 2.5154035341593116e-05, 'weight_decay': 0.0006628090543303534, 'epochs': 59, 'loss': 'mae', 'optimizer': 'adam', 'graph_mode': 'off', 'use_snp_selection': True, 'num_snps': 39736}. Best is trial 125 with value: 0.30599796733831386.
[I 2025-12-06 06:48:44,321] Trial 138 finished with value: 0.299465488568457 and parameters: {'model_type': 'mlp', 'hidden_dims': '[256, 128]', 'dropout': 0.44081159601147046, 'batch_norm': False, 'lr': 6.960545147180641e-05, 'weight_decay': 0.0002960740923066516, 'epochs': 65, 'loss': 'mae', 'optimizer': 'adam', 'graph_mode': 'off', 'use_snp_selection': True, 'num_snps': 36225}. Best is trial 125 with value: 0.30599796733831386.
[I 2025-12-06 06:49:30,277] Trial 139 finished with value: 0.2926987246431561 and parameters: {'model_type': 'mlp', 'hidden_dims': '[256, 128]', 'dropout': 0.44302433020487775, 'batch_norm': False, 'lr': 6.896187623976158e-05, 'weight_decay': 0.00028784572225718614, 'epochs': 73, 'loss': 'mse', 'optimizer': 'adam', 'graph_mode': 'off', 'use_snp_selection': True, 'num_snps': 36089}. Best is trial 125 with value: 0.30599796733831386.
[I 2025-12-06 06:50:13,392] Trial 140 finished with value: 0.3074972080514263 and parameters: {'model_type': 'mlp', 'hidden_dims': '[256, 128]', 'dropout': 0.4544818524208739, 'batch_norm': False, 'lr': 8.670952344499222e-05, 'weight_decay': 0.000389334304661704, 'epochs': 65, 'loss': 'mae', 'optimizer': 'adam', 'graph_mode': 'off', 'use_snp_selection': True, 'num_snps': 31485}. Best is trial 140 with value: 0.3074972080514263.
[I 2025-12-06 06:50:56,022] Trial 141 finished with value: 0.28787136287869897 and parameters: {'model_type': 'mlp', 'hidden_dims': '[256, 128]', 'dropout': 0.4600424415166746, 'batch_norm': False, 'lr': 8.872928959058849e-05, 'weight_decay': 0.00036109454194465876, 'epochs': 66, 'loss': 'mae', 'optimizer': 'adam', 'graph_mode': 'off', 'use_snp_selection': True, 'num_snps': 30808}. Best is trial 140 with value: 0.3074972080514263.
[I 2025-12-06 06:51:39,244] Trial 142 finished with value: 0.2944042027699804 and parameters: {'model_type': 'mlp', 'hidden_dims': '[256, 128]', 'dropout': 0.43457588935517544, 'batch_norm': False, 'lr': 0.00011222821373850737, 'weight_decay': 0.0005534419427469631, 'epochs': 52, 'loss': 'mae', 'optimizer': 'adam', 'graph_mode': 'off', 'use_snp_selection': True, 'num_snps': 34182}. Best is trial 140 with value: 0.3074972080514263.
[I 2025-12-06 06:52:22,283] Trial 143 finished with value: 0.30281141952634316 and parameters: {'model_type': 'mlp', 'hidden_dims': '[256, 128]', 'dropout': 0.4299845206742885, 'batch_norm': False, 'lr': 0.0001169814223533309, 'weight_decay': 0.0009599070652847523, 'epochs': 52, 'loss': 'mae', 'optimizer': 'adam', 'graph_mode': 'off', 'use_snp_selection': True, 'num_snps': 33716}. Best is trial 140 with value: 0.3074972080514263.
[I 2025-12-06 06:53:05,238] Trial 144 finished with value: 0.2877339265507646 and parameters: {'model_type': 'mlp', 'hidden_dims': '[256, 128]', 'dropout': 0.4234207081882715, 'batch_norm': False, 'lr': 0.00010896765669798, 'weight_decay': 0.0006019214746149722, 'epochs': 50, 'loss': 'mae', 'optimizer': 'adam', 'graph_mode': 'off', 'use_snp_selection': True, 'num_snps': 33449}. Best is trial 140 with value: 0.3074972080514263.
[I 2025-12-06 06:53:51,141] Trial 145 finished with value: 0.2934878000335153 and parameters: {'model_type': 'mlp', 'hidden_dims': '[256, 128]', 'dropout': 0.43508930648987876, 'batch_norm': False, 'lr': 7.681236296671184e-05, 'weight_decay': 0.0009771739395940471, 'epochs': 61, 'loss': 'mae', 'optimizer': 'adam', 'graph_mode': 'off', 'use_snp_selection': True, 'num_snps': 38224}. Best is trial 140 with value: 0.3074972080514263.
[I 2025-12-06 06:54:34,145] Trial 146 finished with value: 0.29285396055580515 and parameters: {'model_type': 'mlp', 'hidden_dims': '[256, 128]', 'dropout': 0.45393269920118545, 'batch_norm': False, 'lr': 0.00012418404361700704, 'weight_decay': 0.0007740692923046565, 'epochs': 46, 'loss': 'mae', 'optimizer': 'adam', 'graph_mode': 'off', 'use_snp_selection': True, 'num_snps': 34384}. Best is trial 140 with value: 0.3074972080514263.
[I 2025-12-06 06:55:15,863] Trial 147 finished with value: 0.2919805783124759 and parameters: {'model_type': 'mlp', 'hidden_dims': '[256, 128]', 'dropout': 0.4157869688825464, 'batch_norm': False, 'lr': 6.36889616501156e-05, 'weight_decay': 0.0004624414595739301, 'epochs': 69, 'loss': 'mae', 'optimizer': 'adam', 'graph_mode': 'off', 'use_snp_selection': True, 'num_snps': 27956}. Best is trial 140 with value: 0.3074972080514263.
[I 2025-12-06 06:56:14,785] Trial 148 finished with value: 0.26737778205164175 and parameters: {'model_type': 'mlp', 'hidden_dims': '[256, 128]', 'dropout': 0.4396908628791667, 'batch_norm': False, 'lr': 9.671887125625099e-05, 'weight_decay': 0.0005008815218197773, 'epochs': 293, 'loss': 'mae', 'optimizer': 'adam', 'graph_mode': 'off', 'use_snp_selection': True, 'num_snps': 32185}. Best is trial 140 with value: 0.3074972080514263.
[I 2025-12-06 06:56:59,548] Trial 149 finished with value: 0.29914883600577513 and parameters: {'model_type': 'mlp', 'hidden_dims': '[256, 128]', 'dropout': 0.40659883658404633, 'batch_norm': False, 'lr': 0.0001353379769365556, 'weight_decay': 0.0003156653938867428, 'epochs': 56, 'loss': 'mae', 'optimizer': 'adam', 'graph_mode': 'off', 'use_snp_selection': True, 'num_snps': 36746}. Best is trial 140 with value: 0.3074972080514263.
[I 2025-12-06 06:58:05,776] Trial 0 finished with value: 0.16678676202066584 and parameters: {'model_type': 'mlp', 'hidden_dims': '[128, 64]', 'dropout': 0.199031432379812, 'batch_norm': True, 'lr': 1.8408544111075837e-06, 'weight_decay': 5.5136510071208614e-05, 'epochs': 336, 'loss': 'mae', 'optimizer': 'adam', 'graph_mode': 'off', 'use_snp_selection': True, 'num_snps': 43862}. Best is trial 0 with value: 0.16678676202066584.
[I 2025-12-06 06:58:46,427] Trial 1 finished with value: 0.2070072083210761 and parameters: {'model_type': 'mlp', 'hidden_dims': '[256, 128]', 'dropout': 0.4370668075331726, 'batch_norm': True, 'lr': 7.133471581159139e-05, 'weight_decay': 1.128633586803549e-05, 'epochs': 242, 'loss': 'mae', 'optimizer': 'adam', 'graph_mode': 'off', 'use_snp_selection': False}. Best is trial 1 with value: 0.2070072083210761.
[I 2025-12-06 06:59:23,609] Trial 2 finished with value: 0.20939963140639675 and parameters: {'model_type': 'mlp', 'hidden_dims': '[256, 128, 64]', 'dropout': 0.41314357415569625, 'batch_norm': False, 'lr': 3.952233718592101e-06, 'weight_decay': 0.00026754769258252603, 'epochs': 149, 'loss': 'mse', 'optimizer': 'adam', 'graph_mode': 'off', 'use_snp_selection': True, 'num_snps': 11571}. Best is trial 2 with value: 0.20939963140639675.
[I 2025-12-06 07:00:59,160] Trial 3 finished with value: 0.23567779523788507 and parameters: {'model_type': 'mlp', 'hidden_dims': '[512, 64]', 'dropout': 0.5938127374509361, 'batch_norm': False, 'lr': 5.67704586114731e-06, 'weight_decay': 2.4518087630137052e-05, 'epochs': 320, 'loss': 'mae', 'optimizer': 'adam', 'graph_mode': 'off', 'use_snp_selection': False}. Best is trial 3 with value: 0.23567779523788507.
[I 2025-12-06 07:02:25,198] Trial 4 finished with value: 0.12156927585410152 and parameters: {'model_type': 'mlp', 'hidden_dims': '[512, 128]', 'dropout': 0.25746343592134413, 'batch_norm': True, 'lr': 1.3467657668402788e-06, 'weight_decay': 0.00033087251918647806, 'epochs': 277, 'loss': 'mse', 'optimizer': 'adam', 'graph_mode': 'off', 'use_snp_selection': True, 'num_snps': 36675}. Best is trial 3 with value: 0.23567779523788507.
[I 2025-12-06 07:03:25,344] Trial 5 finished with value: 0.1674167089286019 and parameters: {'model_type': 'mlp', 'hidden_dims': '[512, 64]', 'dropout': 0.38275350994408375, 'batch_norm': True, 'lr': 1.5586664309232824e-06, 'weight_decay': 0.0008227664668621182, 'epochs': 145, 'loss': 'mae', 'optimizer': 'adam', 'graph_mode': 'off', 'use_snp_selection': True, 'num_snps': 32148}. Best is trial 3 with value: 0.23567779523788507.
[I 2025-12-06 07:03:59,104] Trial 6 finished with value: 0.20288295351270064 and parameters: {'model_type': 'mlp', 'hidden_dims': '[256, 128]', 'dropout': 0.3930109900265879, 'batch_norm': False, 'lr': 4.892964372128395e-05, 'weight_decay': 1.5809549317992182e-06, 'epochs': 199, 'loss': 'mse', 'optimizer': 'adam', 'graph_mode': 'off', 'use_snp_selection': False}. Best is trial 3 with value: 0.23567779523788507.
[I 2025-12-06 07:04:33,867] Trial 7 finished with value: 0.20569147057134782 and parameters: {'model_type': 'mlp', 'hidden_dims': '[512, 256]', 'dropout': 0.15343979219678458, 'batch_norm': True, 'lr': 6.234003099047341e-05, 'weight_decay': 3.894760610535477e-07, 'epochs': 97, 'loss': 'mse', 'optimizer': 'adam', 'graph_mode': 'off', 'use_snp_selection': False}. Best is trial 3 with value: 0.23567779523788507.
[I 2025-12-06 07:06:09,455] Trial 8 finished with value: 0.22156956191870725 and parameters: {'model_type': 'mlp', 'hidden_dims': '[512, 128]', 'dropout': 0.10743001231661406, 'batch_norm': True, 'lr': 0.00023728538449271062, 'weight_decay': 1.7629071578048637e-05, 'epochs': 312, 'loss': 'mae', 'optimizer': 'adam', 'graph_mode': 'off', 'use_snp_selection': False}. Best is trial 3 with value: 0.23567779523788507.
[I 2025-12-06 07:07:06,326] Trial 9 finished with value: 0.21735796823624498 and parameters: {'model_type': 'mlp', 'hidden_dims': '[512, 64]', 'dropout': 0.14505336736221927, 'batch_norm': True, 'lr': 5.8619638388111826e-05, 'weight_decay': 6.200156172669308e-07, 'epochs': 175, 'loss': 'mse', 'optimizer': 'adam', 'graph_mode': 'off', 'use_snp_selection': False}. Best is trial 3 with value: 0.23567779523788507.
[I 2025-12-06 07:07:29,125] Trial 10 finished with value: 0.2107861063397861 and parameters: {'model_type': 'mlp', 'hidden_dims': '[512, 64]', 'dropout': 0.5885461262002587, 'batch_norm': False, 'lr': 8.769366258768696e-06, 'weight_decay': 2.78273193871783e-06, 'epochs': 55, 'loss': 'mae', 'optimizer': 'adam', 'graph_mode': 'off', 'use_snp_selection': False}. Best is trial 3 with value: 0.23567779523788507.
[I 2025-12-06 07:09:10,388] Trial 11 finished with value: 0.18434676176917325 and parameters: {'model_type': 'mlp', 'hidden_dims': '[512, 128]', 'dropout': 0.583942291816117, 'batch_norm': False, 'lr': 0.0007607980626791682, 'weight_decay': 2.11387030344014e-05, 'epochs': 346, 'loss': 'mae', 'optimizer': 'adam', 'graph_mode': 'off', 'use_snp_selection': False}. Best is trial 3 with value: 0.23567779523788507.
[I 2025-12-06 07:10:37,946] Trial 12 finished with value: 0.21094058214914635 and parameters: {'model_type': 'mlp', 'hidden_dims': '[512, 128]', 'dropout': 0.2637316882220091, 'batch_norm': False, 'lr': 0.000384886887018818, 'weight_decay': 6.23587291883057e-05, 'epochs': 294, 'loss': 'mae', 'optimizer': 'adam', 'graph_mode': 'off', 'use_snp_selection': False}. Best is trial 3 with value: 0.23567779523788507.
[I 2025-12-06 07:11:04,297] Trial 13 finished with value: 0.23500031567335117 and parameters: {'model_type': 'mlp', 'hidden_dims': '[128, 64]', 'dropout': 0.5255276925359322, 'batch_norm': False, 'lr': 1.3373175420781734e-05, 'weight_decay': 2.875929917712265e-06, 'epochs': 285, 'loss': 'mae', 'optimizer': 'adam', 'graph_mode': 'off', 'use_snp_selection': False}. Best is trial 3 with value: 0.23567779523788507.
[I 2025-12-06 07:11:27,501] Trial 14 finished with value: 0.2336022094802394 and parameters: {'model_type': 'mlp', 'hidden_dims': '[128, 64]', 'dropout': 0.4841249530929294, 'batch_norm': False, 'lr': 1.3128901291408973e-05, 'weight_decay': 1.1414924884997386e-07, 'epochs': 241, 'loss': 'mae', 'optimizer': 'adam', 'graph_mode': 'off', 'use_snp_selection': False}. Best is trial 3 with value: 0.23567779523788507.
[I 2025-12-06 07:11:51,818] Trial 15 finished with value: 0.227171010332961 and parameters: {'model_type': 'mlp', 'hidden_dims': '[128, 64]', 'dropout': 0.5175762982265439, 'batch_norm': False, 'lr': 1.8411764708572348e-05, 'weight_decay': 4.61164678661027e-06, 'epochs': 258, 'loss': 'mae', 'optimizer': 'adam', 'graph_mode': 'off', 'use_snp_selection': False}. Best is trial 3 with value: 0.23567779523788507.
[I 2025-12-06 07:12:29,492] Trial 16 finished with value: 0.24970866148910517 and parameters: {'model_type': 'mlp', 'hidden_dims': '[256, 128, 64]', 'dropout': 0.5185364264420361, 'batch_norm': False, 'lr': 6.013316929814413e-06, 'weight_decay': 6.714274798411626e-05, 'epochs': 220, 'loss': 'mae', 'optimizer': 'adam', 'graph_mode': 'off', 'use_snp_selection': False}. Best is trial 16 with value: 0.24970866148910517.
[I 2025-12-06 07:13:04,731] Trial 17 finished with value: 0.23709783660586642 and parameters: {'model_type': 'mlp', 'hidden_dims': '[256, 128, 64]', 'dropout': 0.31793710483525317, 'batch_norm': False, 'lr': 4.9431155417972025e-06, 'weight_decay': 5.7836943269890636e-05, 'epochs': 202, 'loss': 'mae', 'optimizer': 'adam', 'graph_mode': 'off', 'use_snp_selection': False}. Best is trial 16 with value: 0.24970866148910517.
[I 2025-12-06 07:14:22,086] Trial 18 finished with value: 0.24643582515247978 and parameters: {'model_type': 'mlp', 'hidden_dims': '[256, 128, 64]', 'dropout': 0.2825164393200346, 'batch_norm': False, 'lr': 5.690197399749777e-06, 'weight_decay': 0.00010312401360366706, 'epochs': 218, 'loss': 'mae', 'optimizer': 'adam', 'graph_mode': 'off', 'use_snp_selection': True, 'num_snps': 58241}. Best is trial 16 with value: 0.24970866148910517.
[I 2025-12-06 07:15:38,377] Trial 19 finished with value: 0.23103266771241454 and parameters: {'model_type': 'mlp', 'hidden_dims': '[256, 128, 64]', 'dropout': 0.3182882796271034, 'batch_norm': False, 'lr': 2.874379667093895e-06, 'weight_decay': 0.0001431846948915075, 'epochs': 220, 'loss': 'mae', 'optimizer': 'adam', 'graph_mode': 'off', 'use_snp_selection': True, 'num_snps': 55667}. Best is trial 16 with value: 0.24970866148910517.
[I 2025-12-06 07:16:46,767] Trial 20 finished with value: 0.23348698418278988 and parameters: {'model_type': 'mlp', 'hidden_dims': '[256, 128, 64]', 'dropout': 0.2431719530449259, 'batch_norm': False, 'lr': 1.9922178813915162e-05, 'weight_decay': 0.00014747719872240265, 'epochs': 152, 'loss': 'mae', 'optimizer': 'adam', 'graph_mode': 'off', 'use_snp_selection': True, 'num_snps': 57703}. Best is trial 16 with value: 0.24970866148910517.
[I 2025-12-06 07:17:25,659] Trial 21 finished with value: 0.2462851037802304 and parameters: {'model_type': 'mlp', 'hidden_dims': '[256, 128, 64]', 'dropout': 0.31996257258033156, 'batch_norm': False, 'lr': 6.470365532130121e-06, 'weight_decay': 6.09659883298008e-05, 'epochs': 201, 'loss': 'mae', 'optimizer': 'adam', 'graph_mode': 'off', 'use_snp_selection': True, 'num_snps': 11878}. Best is trial 16 with value: 0.24970866148910517.
[I 2025-12-06 07:18:01,902] Trial 22 finished with value: 0.21368386897966046 and parameters: {'model_type': 'mlp', 'hidden_dims': '[256, 128, 64]', 'dropout': 0.327690978777973, 'batch_norm': False, 'lr': 7.404623033004661e-06, 'weight_decay': 0.0008598484403132802, 'epochs': 174, 'loss': 'mae', 'optimizer': 'adam', 'graph_mode': 'off', 'use_snp_selection': True, 'num_snps': 9310}. Best is trial 16 with value: 0.24970866148910517.
[I 2025-12-06 07:18:42,874] Trial 23 finished with value: 0.1975207906249018 and parameters: {'model_type': 'mlp', 'hidden_dims': '[256, 128, 64]', 'dropout': 0.3557770707535657, 'batch_norm': False, 'lr': 2.8397514514519616e-06, 'weight_decay': 0.00013074479204139983, 'epochs': 114, 'loss': 'mae', 'optimizer': 'adam', 'graph_mode': 'off', 'use_snp_selection': True, 'num_snps': 20180}. Best is trial 16 with value: 0.24970866148910517.
[I 2025-12-06 07:19:30,260] Trial 24 finished with value: 0.2016003848616183 and parameters: {'model_type': 'mlp', 'hidden_dims': '[256, 128, 64]', 'dropout': 0.28775349086206725, 'batch_norm': False, 'lr': 2.5566769410941933e-05, 'weight_decay': 3.9703699952443393e-05, 'epochs': 225, 'loss': 'mae', 'optimizer': 'adam', 'graph_mode': 'off', 'use_snp_selection': True, 'num_snps': 21095}. Best is trial 16 with value: 0.24970866148910517.
[I 2025-12-06 07:20:47,580] Trial 25 finished with value: 0.210173876701461 and parameters: {'model_type': 'mlp', 'hidden_dims': '[512, 256]', 'dropout': 0.21471879809756317, 'batch_norm': False, 'lr': 1.0358816255482434e-06, 'weight_decay': 0.0003887565022534695, 'epochs': 180, 'loss': 'mae', 'optimizer': 'adam', 'graph_mode': 'off', 'use_snp_selection': True, 'num_snps': 43217}. Best is trial 16 with value: 0.24970866148910517.
[I 2025-12-06 07:21:21,325] Trial 26 finished with value: 0.2142148445149644 and parameters: {'model_type': 'mlp', 'hidden_dims': '[256, 128, 64]', 'dropout': 0.4698412133051065, 'batch_norm': False, 'lr': 1.1670871254589645e-05, 'weight_decay': 9.27835910115047e-06, 'epochs': 259, 'loss': 'mae', 'optimizer': 'adam', 'graph_mode': 'off', 'use_snp_selection': True, 'num_snps': 4103}. Best is trial 16 with value: 0.24970866148910517.
[I 2025-12-06 07:22:08,010] Trial 27 finished with value: 0.21378223634556584 and parameters: {'model_type': 'mlp', 'hidden_dims': '[256, 128, 64]', 'dropout': 0.3580784973857611, 'batch_norm': False, 'lr': 4.278689223929362e-06, 'weight_decay': 0.0001095111068277806, 'epochs': 210, 'loss': 'mse', 'optimizer': 'adam', 'graph_mode': 'off', 'use_snp_selection': True, 'num_snps': 21313}. Best is trial 16 with value: 0.24970866148910517.
[I 2025-12-06 07:23:13,888] Trial 28 finished with value: 0.2663812453467505 and parameters: {'model_type': 'mlp', 'hidden_dims': '[256, 128, 64]', 'dropout': 0.29952236284251943, 'batch_norm': False, 'lr': 2.5764793135100935e-06, 'weight_decay': 3.4164646350312926e-05, 'epochs': 233, 'loss': 'mae', 'optimizer': 'adam', 'graph_mode': 'off', 'use_snp_selection': True, 'num_snps': 42058}. Best is trial 28 with value: 0.2663812453467505.
[I 2025-12-06 07:24:26,622] Trial 29 finished with value: 0.23084400637535207 and parameters: {'model_type': 'mlp', 'hidden_dims': '[256, 128, 64]', 'dropout': 0.2884768616217766, 'batch_norm': False, 'lr': 2.3118803050646158e-06, 'weight_decay': 3.4034833418289594e-05, 'epochs': 239, 'loss': 'mae', 'optimizer': 'adam', 'graph_mode': 'off', 'use_snp_selection': True, 'num_snps': 49906}. Best is trial 28 with value: 0.2663812453467505.
[I 2025-12-06 07:25:39,654] Trial 30 finished with value: 0.22833588235089847 and parameters: {'model_type': 'mlp', 'hidden_dims': '[256, 128]', 'dropout': 0.17871609390601595, 'batch_norm': False, 'lr': 1.8717720058235835e-06, 'weight_decay': 8.20140395983459e-06, 'epochs': 262, 'loss': 'mae', 'optimizer': 'adam', 'graph_mode': 'off', 'use_snp_selection': True, 'num_snps': 47860}. Best is trial 28 with value: 0.2663812453467505.
[I 2025-12-06 07:26:33,812] Trial 31 finished with value: 0.24520867759259574 and parameters: {'model_type': 'mlp', 'hidden_dims': '[256, 128, 64]', 'dropout': 0.22632537540239778, 'batch_norm': False, 'lr': 7.512785028021778e-06, 'weight_decay': 7.43073756596928e-05, 'epochs': 226, 'loss': 'mae', 'optimizer': 'adam', 'graph_mode': 'off', 'use_snp_selection': True, 'num_snps': 29087}. Best is trial 28 with value: 0.2663812453467505.
[I 2025-12-06 07:27:32,787] Trial 32 finished with value: 0.24950375848815307 and parameters: {'model_type': 'mlp', 'hidden_dims': '[256, 128, 64]', 'dropout': 0.3015168640087561, 'batch_norm': False, 'lr': 3.215623863999571e-06, 'weight_decay': 3.8833381808510846e-05, 'epochs': 187, 'loss': 'mae', 'optimizer': 'adam', 'graph_mode': 'off', 'use_snp_selection': True, 'num_snps': 38652}. Best is trial 28 with value: 0.2663812453467505.
[I 2025-12-06 07:28:29,786] Trial 33 finished with value: 0.257153593903361 and parameters: {'model_type': 'mlp', 'hidden_dims': '[256, 128, 64]', 'dropout': 0.2801416432240323, 'batch_norm': False, 'lr': 3.388391061758262e-06, 'weight_decay': 1.483539220599754e-05, 'epochs': 182, 'loss': 'mae', 'optimizer': 'adam', 'graph_mode': 'off', 'use_snp_selection': True, 'num_snps': 37098}. Best is trial 28 with value: 0.2663812453467505.
[I 2025-12-06 07:29:23,227] Trial 34 finished with value: 0.22165315828965002 and parameters: {'model_type': 'mlp', 'hidden_dims': '[256, 128, 64]', 'dropout': 0.43929149805784284, 'batch_norm': False, 'lr': 2.7598836279028923e-06, 'weight_decay': 1.4091802663346212e-05, 'epochs': 137, 'loss': 'mae', 'optimizer': 'adam', 'graph_mode': 'off', 'use_snp_selection': True, 'num_snps': 37536}. Best is trial 28 with value: 0.2663812453467505.
[I 2025-12-06 07:30:32,587] Trial 35 finished with value: 0.12979466332900874 and parameters: {'model_type': 'mlp', 'hidden_dims': '[512, 256]', 'dropout': 0.20048799095456937, 'batch_norm': True, 'lr': 1.0045606983989238e-06, 'weight_decay': 3.198874674028855e-05, 'epochs': 167, 'loss': 'mae', 'optimizer': 'adam', 'graph_mode': 'off', 'use_snp_selection': True, 'num_snps': 37918}. Best is trial 28 with value: 0.2663812453467505.
[I 2025-12-06 07:31:22,214] Trial 36 finished with value: 0.23675897180528657 and parameters: {'model_type': 'mlp', 'hidden_dims': '[256, 128, 64]', 'dropout': 0.41852052749934954, 'batch_norm': False, 'lr': 3.6452253170045465e-06, 'weight_decay': 6.0210561973237835e-06, 'epochs': 129, 'loss': 'mse', 'optimizer': 'adam', 'graph_mode': 'off', 'use_snp_selection': True, 'num_snps': 31963}. Best is trial 28 with value: 0.2663812453467505.
