[I 2025-12-05 15:15:03,448] Trial 106 finished with value: 0.09924191372302064 and parameters: {'model_type': 'mlp', 'hidden_dims': '[512, 64]', 'dropout': 0.27499235442611164, 'batch_norm': False, 'lr': 8.271764122418822e-05, 'weight_decay': 1.0836125113357685e-05, 'epochs': 246, 'loss': 'mae', 'optimizer': 'adam', 'graph_mode': 'off', 'use_snp_selection': False}. Best is trial 101 with value: 0.1278019507532439.
[I 2025-12-05 15:15:05,490] Trial 107 finished with value: 0.10674900404455673 and parameters: {'model_type': 'mlp', 'hidden_dims': '[512, 64]', 'dropout': 0.10204216572906005, 'batch_norm': True, 'lr': 0.0002644586593759636, 'weight_decay': 1.7732982892844763e-05, 'epochs': 321, 'loss': 'mae', 'optimizer': 'adam', 'graph_mode': 'off', 'use_snp_selection': False}. Best is trial 101 with value: 0.1278019507532439.
[I 2025-12-05 15:15:07,640] Trial 108 finished with value: 0.11743648619070195 and parameters: {'model_type': 'mlp', 'hidden_dims': '[512, 64]', 'dropout': 0.23339076880407286, 'batch_norm': True, 'lr': 6.465545001150869e-05, 'weight_decay': 8.725524234184072e-05, 'epochs': 342, 'loss': 'mae', 'optimizer': 'adam', 'graph_mode': 'off', 'use_snp_selection': False}. Best is trial 101 with value: 0.1278019507532439.
[I 2025-12-05 15:15:09,763] Trial 109 finished with value: 0.10269188163533566 and parameters: {'model_type': 'mlp', 'hidden_dims': '[512, 64]', 'dropout': 0.23833210782060024, 'batch_norm': True, 'lr': 5.536041014201101e-05, 'weight_decay': 0.0002037090936725543, 'epochs': 343, 'loss': 'mae', 'optimizer': 'adam', 'graph_mode': 'off', 'use_snp_selection': False}. Best is trial 101 with value: 0.1278019507532439.
[I 2025-12-05 15:15:11,833] Trial 110 finished with value: 0.11214711412809573 and parameters: {'model_type': 'mlp', 'hidden_dims': '[512, 64]', 'dropout': 0.1878833449660556, 'batch_norm': True, 'lr': 6.531234726802858e-05, 'weight_decay': 0.00011952246569233395, 'epochs': 330, 'loss': 'mae', 'optimizer': 'adam', 'graph_mode': 'off', 'use_snp_selection': False}. Best is trial 101 with value: 0.1278019507532439.
[I 2025-12-05 15:15:13,973] Trial 111 finished with value: 0.08960259058202977 and parameters: {'model_type': 'mlp', 'hidden_dims': '[512, 64]', 'dropout': 0.25449874052950444, 'batch_norm': True, 'lr': 0.00010335403277856048, 'weight_decay': 1.8897156362766978e-06, 'epochs': 342, 'loss': 'mae', 'optimizer': 'adam', 'graph_mode': 'off', 'use_snp_selection': False}. Best is trial 101 with value: 0.1278019507532439.
[I 2025-12-05 15:15:15,762] Trial 112 finished with value: 0.07608508196557603 and parameters: {'model_type': 'mlp', 'hidden_dims': '[512, 64]', 'dropout': 0.22360276362883233, 'batch_norm': True, 'lr': 1.101923891625895e-05, 'weight_decay': 2.499604048421399e-05, 'epochs': 252, 'loss': 'mae', 'optimizer': 'adam', 'graph_mode': 'off', 'use_snp_selection': False}. Best is trial 101 with value: 0.1278019507532439.
[I 2025-12-05 15:15:17,122] Trial 113 finished with value: 0.10869798382258619 and parameters: {'model_type': 'mlp', 'hidden_dims': '[256, 128]', 'dropout': 0.21187140203443836, 'batch_norm': True, 'lr': 0.00020629935163081562, 'weight_decay': 3.664666243050299e-05, 'epochs': 330, 'loss': 'mae', 'optimizer': 'adam', 'graph_mode': 'off', 'use_snp_selection': False}. Best is trial 101 with value: 0.1278019507532439.
[I 2025-12-05 15:15:18,108] Trial 114 finished with value: 0.11744284733203478 and parameters: {'model_type': 'mlp', 'hidden_dims': '[128, 64]', 'dropout': 0.24154136038218263, 'batch_norm': False, 'lr': 0.0001266319480266653, 'weight_decay': 3.065963573084726e-05, 'epochs': 310, 'loss': 'mae', 'optimizer': 'adam', 'graph_mode': 'off', 'use_snp_selection': False}. Best is trial 101 with value: 0.1278019507532439.
[I 2025-12-05 15:15:19,143] Trial 115 finished with value: 0.10274014300465567 and parameters: {'model_type': 'mlp', 'hidden_dims': '[128, 64]', 'dropout': 0.24583224843989504, 'batch_norm': True, 'lr': 0.00012697853671438976, 'weight_decay': 9.292314847692427e-05, 'epochs': 313, 'loss': 'mae', 'optimizer': 'adam', 'graph_mode': 'off', 'use_snp_selection': False}. Best is trial 101 with value: 0.1278019507532439.
[I 2025-12-05 15:15:20,120] Trial 116 finished with value: 0.1132996782400835 and parameters: {'model_type': 'mlp', 'hidden_dims': '[128, 64]', 'dropout': 0.2320013550320654, 'batch_norm': False, 'lr': 8.138725630231978e-05, 'weight_decay': 8.031409253912483e-05, 'epochs': 335, 'loss': 'mae', 'optimizer': 'adam', 'graph_mode': 'off', 'use_snp_selection': False}. Best is trial 101 with value: 0.1278019507532439.
[I 2025-12-05 15:15:21,198] Trial 117 finished with value: 0.10776414197217031 and parameters: {'model_type': 'mlp', 'hidden_dims': '[128, 64]', 'dropout': 0.19791959161734413, 'batch_norm': True, 'lr': 4.745200777894075e-05, 'weight_decay': 2.9099048812387485e-05, 'epochs': 323, 'loss': 'mae', 'optimizer': 'adam', 'graph_mode': 'off', 'use_snp_selection': False}. Best is trial 101 with value: 0.1278019507532439.
[I 2025-12-05 15:15:23,106] Trial 118 finished with value: 0.09655725790757483 and parameters: {'model_type': 'mlp', 'hidden_dims': '[512, 64]', 'dropout': 0.27886008629418524, 'batch_norm': False, 'lr': 0.0001237502963844184, 'weight_decay': 6.200247226808395e-05, 'epochs': 295, 'loss': 'mae', 'optimizer': 'adam', 'graph_mode': 'off', 'use_snp_selection': False}. Best is trial 101 with value: 0.1278019507532439.
[I 2025-12-05 15:15:24,610] Trial 119 finished with value: 0.116022124019248 and parameters: {'model_type': 'mlp', 'hidden_dims': '[256, 128, 64]', 'dropout': 0.13506886763674614, 'batch_norm': True, 'lr': 7.303782802840403e-05, 'weight_decay': 1.5269012905984528e-05, 'epochs': 306, 'loss': 'mae', 'optimizer': 'adam', 'graph_mode': 'off', 'use_snp_selection': True, 'num_snps': 14617}. Best is trial 101 with value: 0.1278019507532439.
[I 2025-12-05 15:15:25,570] Trial 120 finished with value: 0.10510809960725574 and parameters: {'model_type': 'mlp', 'hidden_dims': '[128, 64]', 'dropout': 0.17493728923405652, 'batch_norm': False, 'lr': 0.00015908157598905709, 'weight_decay': 0.000605153109172086, 'epochs': 317, 'loss': 'mae', 'optimizer': 'adam', 'graph_mode': 'off', 'use_snp_selection': False}. Best is trial 101 with value: 0.1278019507532439.
[I 2025-12-05 15:15:26,733] Trial 121 finished with value: 0.10506413775856488 and parameters: {'model_type': 'mlp', 'hidden_dims': '[256, 128]', 'dropout': 0.11197642807675189, 'batch_norm': False, 'lr': 0.00017810793914865128, 'weight_decay': 2.1580039652415242e-05, 'epochs': 232, 'loss': 'mae', 'optimizer': 'adam', 'graph_mode': 'off', 'use_snp_selection': False}. Best is trial 101 with value: 0.1278019507532439.
[I 2025-12-05 15:15:28,600] Trial 122 finished with value: 0.11478155579562002 and parameters: {'model_type': 'mlp', 'hidden_dims': '[512, 128]', 'dropout': 0.2381970600227586, 'batch_norm': False, 'lr': 0.00014463593958596695, 'weight_decay': 1.1277177904321412e-05, 'epochs': 283, 'loss': 'mae', 'optimizer': 'adam', 'graph_mode': 'off', 'use_snp_selection': False}. Best is trial 101 with value: 0.1278019507532439.
[I 2025-12-05 15:15:30,404] Trial 123 finished with value: 0.08906168056294457 and parameters: {'model_type': 'mlp', 'hidden_dims': '[512, 64]', 'dropout': 0.3029498477187992, 'batch_norm': False, 'lr': 0.0002207075032291966, 'weight_decay': 1.853237889781123e-05, 'epochs': 267, 'loss': 'mae', 'optimizer': 'adam', 'graph_mode': 'off', 'use_snp_selection': False}. Best is trial 101 with value: 0.1278019507532439.
[I 2025-12-05 15:15:31,295] Trial 124 finished with value: 0.09158429962934272 and parameters: {'model_type': 'mlp', 'hidden_dims': '[128, 64]', 'dropout': 0.26548726042159226, 'batch_norm': False, 'lr': 0.0002726148870706666, 'weight_decay': 4.708204521683187e-05, 'epochs': 258, 'loss': 'mae', 'optimizer': 'adam', 'graph_mode': 'off', 'use_snp_selection': False}. Best is trial 101 with value: 0.1278019507532439.
[I 2025-12-05 15:15:32,916] Trial 125 finished with value: 0.10867157508986722 and parameters: {'model_type': 'mlp', 'hidden_dims': '[512, 256]', 'dropout': 0.19413979835560674, 'batch_norm': False, 'lr': 3.97172255174099e-05, 'weight_decay': 1.0421962340709414e-06, 'epochs': 219, 'loss': 'mse', 'optimizer': 'adam', 'graph_mode': 'off', 'use_snp_selection': False}. Best is trial 101 with value: 0.1278019507532439.
[I 2025-12-05 15:15:34,881] Trial 126 finished with value: 0.08456633439204592 and parameters: {'model_type': 'mlp', 'hidden_dims': '[512, 128]', 'dropout': 0.4790293454152971, 'batch_norm': True, 'lr': 8.746336436528461e-05, 'weight_decay': 2.437580914216026e-05, 'epochs': 302, 'loss': 'mae', 'optimizer': 'adam', 'graph_mode': 'off', 'use_snp_selection': False}. Best is trial 101 with value: 0.1278019507532439.
[I 2025-12-05 15:15:36,792] Trial 127 finished with value: 0.10482068598451044 and parameters: {'model_type': 'mlp', 'hidden_dims': '[512, 64]', 'dropout': 0.21592493212820976, 'batch_norm': False, 'lr': 0.00010699900901767191, 'weight_decay': 3.159994402818865e-05, 'epochs': 290, 'loss': 'mae', 'optimizer': 'adam', 'graph_mode': 'off', 'use_snp_selection': False}. Best is trial 101 with value: 0.1278019507532439.
[I 2025-12-05 15:15:38,957] Trial 128 finished with value: 0.10448158831616927 and parameters: {'model_type': 'mlp', 'hidden_dims': '[512, 128]', 'dropout': 0.4153122940242429, 'batch_norm': True, 'lr': 0.0001931302563452163, 'weight_decay': 5.131789950863257e-06, 'epochs': 349, 'loss': 'mae', 'optimizer': 'adam', 'graph_mode': 'off', 'use_snp_selection': False}. Best is trial 101 with value: 0.1278019507532439.
[I 2025-12-05 15:15:40,470] Trial 129 finished with value: 0.1156842307154076 and parameters: {'model_type': 'mlp', 'hidden_dims': '[512, 256]', 'dropout': 0.164500433419547, 'batch_norm': False, 'lr': 0.00016811689401302567, 'weight_decay': 6.734025541741587e-06, 'epochs': 185, 'loss': 'mae', 'optimizer': 'adam', 'graph_mode': 'off', 'use_snp_selection': False}. Best is trial 101 with value: 0.1278019507532439.
[I 2025-12-05 15:15:42,241] Trial 130 finished with value: 0.10723860133662345 and parameters: {'model_type': 'mlp', 'hidden_dims': '[512, 128]', 'dropout': 0.1262871428784882, 'batch_norm': True, 'lr': 0.00012784296354478384, 'weight_decay': 3.621098143839696e-05, 'epochs': 241, 'loss': 'mae', 'optimizer': 'adam', 'graph_mode': 'off', 'use_snp_selection': False}. Best is trial 101 with value: 0.1278019507532439.
[I 2025-12-05 15:15:44,069] Trial 131 finished with value: 0.07148738131856211 and parameters: {'model_type': 'mlp', 'hidden_dims': '[512, 256]', 'dropout': 0.4248241175305512, 'batch_norm': False, 'lr': 0.0003787052552977361, 'weight_decay': 7.650117849136967e-06, 'epochs': 273, 'loss': 'mae', 'optimizer': 'adam', 'graph_mode': 'off', 'use_snp_selection': False}. Best is trial 101 with value: 0.1278019507532439.
[I 2025-12-05 15:15:45,844] Trial 132 finished with value: 0.08499420202136729 and parameters: {'model_type': 'mlp', 'hidden_dims': '[512, 256]', 'dropout': 0.40553886123440425, 'batch_norm': False, 'lr': 0.00032821562292095356, 'weight_decay': 4.382918923909172e-06, 'epochs': 260, 'loss': 'mae', 'optimizer': 'adam', 'graph_mode': 'off', 'use_snp_selection': False}. Best is trial 101 with value: 0.1278019507532439.
[I 2025-12-05 15:15:47,592] Trial 133 finished with value: 0.09954125037361566 and parameters: {'model_type': 'mlp', 'hidden_dims': '[512, 256]', 'dropout': 0.500528675629112, 'batch_norm': False, 'lr': 0.00027767928418130015, 'weight_decay': 1.2129774340292782e-05, 'epochs': 253, 'loss': 'mae', 'optimizer': 'adam', 'graph_mode': 'off', 'use_snp_selection': False}. Best is trial 101 with value: 0.1278019507532439.
[I 2025-12-05 15:15:49,666] Trial 134 finished with value: 0.10773633764743754 and parameters: {'model_type': 'mlp', 'hidden_dims': '[512, 256]', 'dropout': 0.3604904744766407, 'batch_norm': False, 'lr': 2.515394796763105e-05, 'weight_decay': 9.080362201038382e-06, 'epochs': 332, 'loss': 'mae', 'optimizer': 'adam', 'graph_mode': 'off', 'use_snp_selection': False}. Best is trial 101 with value: 0.1278019507532439.
[I 2025-12-05 15:15:50,905] Trial 135 finished with value: 0.06151622481282531 and parameters: {'model_type': 'mlp', 'hidden_dims': '[256, 128]', 'dropout': 0.3793189198751633, 'batch_norm': False, 'lr': 6.252967248321517e-06, 'weight_decay': 1.4440518789729094e-05, 'epochs': 277, 'loss': 'mae', 'optimizer': 'adam', 'graph_mode': 'off', 'use_snp_selection': False}. Best is trial 101 with value: 0.1278019507532439.
[I 2025-12-05 15:15:52,882] Trial 136 finished with value: 0.09615212656454776 and parameters: {'model_type': 'mlp', 'hidden_dims': '[512, 256]', 'dropout': 0.20434604197537448, 'batch_norm': False, 'lr': 0.0002225582608680056, 'weight_decay': 1.813002553978427e-05, 'epochs': 310, 'loss': 'mae', 'optimizer': 'adam', 'graph_mode': 'off', 'use_snp_selection': False}. Best is trial 101 with value: 0.1278019507532439.
[I 2025-12-05 15:15:54,734] Trial 137 finished with value: 0.10541749901418816 and parameters: {'model_type': 'mlp', 'hidden_dims': '[512, 64]', 'dropout': 0.4439309593380962, 'batch_norm': True, 'lr': 0.000349433452620855, 'weight_decay': 2.59036270191818e-06, 'epochs': 267, 'loss': 'mae', 'optimizer': 'adam', 'graph_mode': 'off', 'use_snp_selection': False}. Best is trial 101 with value: 0.1278019507532439.
[I 2025-12-05 15:15:56,670] Trial 138 finished with value: 0.10291603756977813 and parameters: {'model_type': 'mlp', 'hidden_dims': '[256, 128, 64]', 'dropout': 0.3404598210585184, 'batch_norm': True, 'lr': 0.000496606406141165, 'weight_decay': 8.479715822511737e-06, 'epochs': 296, 'loss': 'mae', 'optimizer': 'adam', 'graph_mode': 'off', 'use_snp_selection': True, 'num_snps': 29204}. Best is trial 101 with value: 0.1278019507532439.
[I 2025-12-05 15:15:58,400] Trial 139 finished with value: 0.08609267466179998 and parameters: {'model_type': 'mlp', 'hidden_dims': '[512, 128]', 'dropout': 0.43217858456433395, 'batch_norm': False, 'lr': 0.0006461476083487073, 'weight_decay': 3.0911459905159596e-06, 'epochs': 247, 'loss': 'mae', 'optimizer': 'adam', 'graph_mode': 'off', 'use_snp_selection': False}. Best is trial 101 with value: 0.1278019507532439.
[I 2025-12-05 15:16:00,456] Trial 140 finished with value: 0.11012370332300633 and parameters: {'model_type': 'mlp', 'hidden_dims': '[512, 256]', 'dropout': 0.22797945887428095, 'batch_norm': True, 'lr': 5.668221162069569e-05, 'weight_decay': 5.59642354099088e-06, 'epochs': 325, 'loss': 'mae', 'optimizer': 'adam', 'graph_mode': 'off', 'use_snp_selection': False}. Best is trial 101 with value: 0.1278019507532439.
[I 2025-12-05 15:16:02,025] Trial 141 finished with value: 0.1103374832762752 and parameters: {'model_type': 'mlp', 'hidden_dims': '[512, 128]', 'dropout': 0.14707731542903857, 'batch_norm': True, 'lr': 0.00044625480210291044, 'weight_decay': 1.3461092337526182e-05, 'epochs': 203, 'loss': 'mae', 'optimizer': 'adam', 'graph_mode': 'off', 'use_snp_selection': False}. Best is trial 101 with value: 0.1278019507532439.
[I 2025-12-05 15:16:03,639] Trial 142 finished with value: 0.10494783337847782 and parameters: {'model_type': 'mlp', 'hidden_dims': '[512, 128]', 'dropout': 0.398174400847668, 'batch_norm': True, 'lr': 0.00024197021990472633, 'weight_decay': 2.1543432166048594e-05, 'epochs': 213, 'loss': 'mae', 'optimizer': 'adam', 'graph_mode': 'off', 'use_snp_selection': False}. Best is trial 101 with value: 0.1278019507532439.
[I 2025-12-05 15:16:05,156] Trial 143 finished with value: 0.11607686488250314 and parameters: {'model_type': 'mlp', 'hidden_dims': '[512, 128]', 'dropout': 0.24570647790460973, 'batch_norm': True, 'lr': 0.0002897537246832193, 'weight_decay': 2.623004634069332e-05, 'epochs': 189, 'loss': 'mae', 'optimizer': 'adam', 'graph_mode': 'off', 'use_snp_selection': False}. Best is trial 101 with value: 0.1278019507532439.
[I 2025-12-05 15:16:06,766] Trial 144 finished with value: 0.10581419480483327 and parameters: {'model_type': 'mlp', 'hidden_dims': '[512, 128]', 'dropout': 0.3752744001039197, 'batch_norm': True, 'lr': 0.0008503597459003686, 'weight_decay': 1.5921489921203208e-05, 'epochs': 211, 'loss': 'mae', 'optimizer': 'adam', 'graph_mode': 'off', 'use_snp_selection': False}. Best is trial 101 with value: 0.1278019507532439.
[I 2025-12-05 15:16:07,675] Trial 145 finished with value: 0.10204530697125835 and parameters: {'model_type': 'mlp', 'hidden_dims': '[128, 64]', 'dropout': 0.32190746997338904, 'batch_norm': True, 'lr': 0.00019387623906487537, 'weight_decay': 9.654730538680564e-06, 'epochs': 221, 'loss': 'mse', 'optimizer': 'adam', 'graph_mode': 'off', 'use_snp_selection': False}. Best is trial 101 with value: 0.1278019507532439.
[I 2025-12-05 15:16:09,354] Trial 146 finished with value: 0.11396024374814669 and parameters: {'model_type': 'mlp', 'hidden_dims': '[512, 64]', 'dropout': 0.3906499650031732, 'batch_norm': False, 'lr': 0.00014264557764919034, 'weight_decay': 7.012915831103598e-06, 'epochs': 230, 'loss': 'mae', 'optimizer': 'adam', 'graph_mode': 'off', 'use_snp_selection': False}. Best is trial 101 with value: 0.1278019507532439.
[I 2025-12-05 15:16:11,094] Trial 147 finished with value: 0.11577014940118957 and parameters: {'model_type': 'mlp', 'hidden_dims': '[512, 128]', 'dropout': 0.11417003242926363, 'batch_norm': True, 'lr': 0.0003313010850307009, 'weight_decay': 1.933010516223827e-05, 'epochs': 243, 'loss': 'mae', 'optimizer': 'adam', 'graph_mode': 'off', 'use_snp_selection': False}. Best is trial 101 with value: 0.1278019507532439.
[I 2025-12-05 15:16:12,449] Trial 148 finished with value: 0.08866635104872495 and parameters: {'model_type': 'mlp', 'hidden_dims': '[256, 128]', 'dropout': 0.4121609152552762, 'batch_norm': False, 'lr': 0.00041790126708117595, 'weight_decay': 4.2385376584114256e-05, 'epochs': 340, 'loss': 'mae', 'optimizer': 'adam', 'graph_mode': 'off', 'use_snp_selection': False}. Best is trial 101 with value: 0.1278019507532439.
[I 2025-12-05 15:16:14,475] Trial 149 finished with value: 0.11132500995973954 and parameters: {'model_type': 'mlp', 'hidden_dims': '[512, 256]', 'dropout': 0.10129266891789783, 'batch_norm': True, 'lr': 0.000164943037627287, 'weight_decay': 1.1409508159171531e-05, 'epochs': 317, 'loss': 'mae', 'optimizer': 'adam', 'graph_mode': 'off', 'use_snp_selection': False}. Best is trial 101 with value: 0.1278019507532439.
[I 2025-12-05 15:16:17,114] Trial 0 finished with value: -0.011681739838866542 and parameters: {'model_type': 'mlp', 'hidden_dims': '[128, 64]', 'dropout': 0.199031432379812, 'batch_norm': True, 'lr': 1.8408544111075837e-06, 'weight_decay': 5.5136510071208614e-05, 'epochs': 336, 'loss': 'mae', 'optimizer': 'adam', 'graph_mode': 'off', 'use_snp_selection': True, 'num_snps': 43862}. Best is trial 0 with value: -0.011681739838866542.
[I 2025-12-05 15:16:18,678] Trial 1 finished with value: 0.05040791695173405 and parameters: {'model_type': 'mlp', 'hidden_dims': '[256, 128]', 'dropout': 0.4370668075331726, 'batch_norm': True, 'lr': 7.133471581159139e-05, 'weight_decay': 1.128633586803549e-05, 'epochs': 242, 'loss': 'mae', 'optimizer': 'adam', 'graph_mode': 'off', 'use_snp_selection': False}. Best is trial 1 with value: 0.05040791695173405.
[I 2025-12-05 15:16:20,010] Trial 2 finished with value: 0.014820702839439944 and parameters: {'model_type': 'mlp', 'hidden_dims': '[256, 128, 64]', 'dropout': 0.41314357415569625, 'batch_norm': False, 'lr': 3.952233718592101e-06, 'weight_decay': 0.00026754769258252603, 'epochs': 149, 'loss': 'mse', 'optimizer': 'adam', 'graph_mode': 'off', 'use_snp_selection': True, 'num_snps': 11571}. Best is trial 1 with value: 0.05040791695173405.
[I 2025-12-05 15:16:23,238] Trial 3 finished with value: 0.05410400594978558 and parameters: {'model_type': 'mlp', 'hidden_dims': '[512, 64]', 'dropout': 0.5938127374509361, 'batch_norm': False, 'lr': 5.67704586114731e-06, 'weight_decay': 2.4518087630137052e-05, 'epochs': 320, 'loss': 'mae', 'optimizer': 'adam', 'graph_mode': 'off', 'use_snp_selection': False}. Best is trial 3 with value: 0.05410400594978558.
[I 2025-12-05 15:16:26,540] Trial 4 finished with value: 0.03693006098193832 and parameters: {'model_type': 'mlp', 'hidden_dims': '[512, 128]', 'dropout': 0.25746343592134413, 'batch_norm': True, 'lr': 1.3467657668402788e-06, 'weight_decay': 0.00033087251918647806, 'epochs': 277, 'loss': 'mse', 'optimizer': 'adam', 'graph_mode': 'off', 'use_snp_selection': True, 'num_snps': 36675}. Best is trial 3 with value: 0.05410400594978558.
[I 2025-12-05 15:16:29,017] Trial 5 finished with value: 0.04025208195707009 and parameters: {'model_type': 'mlp', 'hidden_dims': '[512, 64]', 'dropout': 0.38275350994408375, 'batch_norm': True, 'lr': 1.5586664309232824e-06, 'weight_decay': 0.0008227664668621182, 'epochs': 145, 'loss': 'mae', 'optimizer': 'adam', 'graph_mode': 'off', 'use_snp_selection': True, 'num_snps': 32148}. Best is trial 3 with value: 0.05410400594978558.
[I 2025-12-05 15:16:30,394] Trial 6 finished with value: 0.0547001213340938 and parameters: {'model_type': 'mlp', 'hidden_dims': '[256, 128]', 'dropout': 0.3930109900265879, 'batch_norm': False, 'lr': 4.892964372128395e-05, 'weight_decay': 1.5809549317992182e-06, 'epochs': 199, 'loss': 'mse', 'optimizer': 'adam', 'graph_mode': 'off', 'use_snp_selection': False}. Best is trial 6 with value: 0.0547001213340938.
[I 2025-12-05 15:16:31,948] Trial 7 finished with value: 0.04215810328759606 and parameters: {'model_type': 'mlp', 'hidden_dims': '[512, 256]', 'dropout': 0.15343979219678458, 'batch_norm': True, 'lr': 6.234003099047341e-05, 'weight_decay': 3.894760610535477e-07, 'epochs': 97, 'loss': 'mse', 'optimizer': 'adam', 'graph_mode': 'off', 'use_snp_selection': False}. Best is trial 6 with value: 0.0547001213340938.
