[I 2025-12-05 14:56:13,085] Trial 25 finished with value: 0.1340284223496243 and parameters: {'model_type': 'mlp', 'hidden_dims': '[256, 128]', 'dropout': 0.2728491886002558, 'batch_norm': True, 'lr': 0.0002854233644992322, 'weight_decay': 5.083257129043506e-06, 'epochs': 240, 'loss': 'mae', 'optimizer': 'adam', 'graph_mode': 'off', 'use_snp_selection': False}. Best is trial 25 with value: 0.1340284223496243.
[I 2025-12-05 14:56:14,065] Trial 26 finished with value: 0.09359569171841314 and parameters: {'model_type': 'mlp', 'hidden_dims': '[256, 128]', 'dropout': 0.2918871336665922, 'batch_norm': True, 'lr': 0.0002544462347417552, 'weight_decay': 3.960090088798958e-06, 'epochs': 241, 'loss': 'mse', 'optimizer': 'adam', 'graph_mode': 'off', 'use_snp_selection': True, 'num_snps': 3842}. Best is trial 25 with value: 0.1340284223496243.
[I 2025-12-05 14:56:15,215] Trial 27 finished with value: 0.10701839803417341 and parameters: {'model_type': 'mlp', 'hidden_dims': '[256, 128]', 'dropout': 0.33500182459404687, 'batch_norm': False, 'lr': 0.00044138077824897785, 'weight_decay': 3.7728781986273995e-05, 'epochs': 282, 'loss': 'mae', 'optimizer': 'adam', 'graph_mode': 'off', 'use_snp_selection': False}. Best is trial 25 with value: 0.1340284223496243.
[I 2025-12-05 14:56:16,338] Trial 28 finished with value: 0.10972108836383498 and parameters: {'model_type': 'mlp', 'hidden_dims': '[256, 128]', 'dropout': 0.219196935871986, 'batch_norm': True, 'lr': 0.0009968161050984126, 'weight_decay': 6.825426084391172e-06, 'epochs': 258, 'loss': 'mse', 'optimizer': 'adam', 'graph_mode': 'off', 'use_snp_selection': False}. Best is trial 25 with value: 0.1340284223496243.
[I 2025-12-05 14:56:17,509] Trial 29 finished with value: 0.11684402770369617 and parameters: {'model_type': 'mlp', 'hidden_dims': '[128, 64]', 'dropout': 0.1286649224902829, 'batch_norm': True, 'lr': 0.00031851747965755867, 'weight_decay': 7.556740997596586e-05, 'epochs': 65, 'loss': 'mae', 'optimizer': 'adam', 'graph_mode': 'off', 'use_snp_selection': True, 'num_snps': 19468}. Best is trial 25 with value: 0.1340284223496243.
[I 2025-12-05 14:56:18,338] Trial 30 finished with value: 0.12170030054557901 and parameters: {'model_type': 'mlp', 'hidden_dims': '[128, 64]', 'dropout': 0.20802820480143952, 'batch_norm': True, 'lr': 0.0005867277789168243, 'weight_decay': 8.58970861149538e-05, 'epochs': 225, 'loss': 'mae', 'optimizer': 'adam', 'graph_mode': 'off', 'use_snp_selection': False}. Best is trial 25 with value: 0.1340284223496243.
[I 2025-12-05 14:56:19,160] Trial 31 finished with value: 0.11966941885954929 and parameters: {'model_type': 'mlp', 'hidden_dims': '[128, 64]', 'dropout': 0.20701426846116516, 'batch_norm': True, 'lr': 0.0006249380095612065, 'weight_decay': 7.400137834247897e-05, 'epochs': 224, 'loss': 'mae', 'optimizer': 'adam', 'graph_mode': 'off', 'use_snp_selection': False}. Best is trial 25 with value: 0.1340284223496243.
[I 2025-12-05 14:56:19,938] Trial 32 finished with value: 0.11594946645664345 and parameters: {'model_type': 'mlp', 'hidden_dims': '[128, 64]', 'dropout': 0.2406365123097409, 'batch_norm': True, 'lr': 0.00035102964528338113, 'weight_decay': 1.2542958005684545e-05, 'epochs': 191, 'loss': 'mae', 'optimizer': 'adam', 'graph_mode': 'off', 'use_snp_selection': False}. Best is trial 25 with value: 0.1340284223496243.
[I 2025-12-05 14:56:20,795] Trial 33 finished with value: 0.11316132770941885 and parameters: {'model_type': 'mlp', 'hidden_dims': '[128, 64]', 'dropout': 0.26874974291015846, 'batch_norm': True, 'lr': 8.613404321373549e-05, 'weight_decay': 0.00014897499838525637, 'epochs': 242, 'loss': 'mae', 'optimizer': 'adam', 'graph_mode': 'off', 'use_snp_selection': False}. Best is trial 25 with value: 0.1340284223496243.
[I 2025-12-05 14:56:21,783] Trial 34 finished with value: 0.1284699750604131 and parameters: {'model_type': 'mlp', 'hidden_dims': '[256, 128]', 'dropout': 0.1899642885297323, 'batch_norm': True, 'lr': 0.00022026592797017578, 'weight_decay': 1.1485006650961136e-05, 'epochs': 205, 'loss': 'mae', 'optimizer': 'adam', 'graph_mode': 'off', 'use_snp_selection': False}. Best is trial 25 with value: 0.1340284223496243.
[I 2025-12-05 14:56:22,673] Trial 35 finished with value: 0.11531241517472658 and parameters: {'model_type': 'mlp', 'hidden_dims': '[256, 128]', 'dropout': 0.13305909563382562, 'batch_norm': False, 'lr': 0.00022235862688257268, 'weight_decay': 8.41492666322683e-06, 'epochs': 163, 'loss': 'mae', 'optimizer': 'adam', 'graph_mode': 'off', 'use_snp_selection': False}. Best is trial 25 with value: 0.1340284223496243.
[I 2025-12-05 14:56:25,550] Trial 36 finished with value: 0.09249153842842775 and parameters: {'model_type': 'mlp', 'hidden_dims': '[256, 128]', 'dropout': 0.17521200946810195, 'batch_norm': True, 'lr': 3.155373478959233e-05, 'weight_decay': 2.0238045787512804e-05, 'epochs': 307, 'loss': 'mae', 'optimizer': 'adam', 'graph_mode': 'off', 'use_snp_selection': True, 'num_snps': 58661}. Best is trial 25 with value: 0.1340284223496243.
[I 2025-12-05 14:56:26,650] Trial 37 finished with value: 0.09457285865424908 and parameters: {'model_type': 'mlp', 'hidden_dims': '[256, 128]', 'dropout': 0.3554265736043042, 'batch_norm': True, 'lr': 8.228829947257752e-05, 'weight_decay': 3.656678482516435e-05, 'epochs': 204, 'loss': 'mse', 'optimizer': 'adam', 'graph_mode': 'off', 'use_snp_selection': False}. Best is trial 25 with value: 0.1340284223496243.
[I 2025-12-05 14:56:28,109] Trial 38 finished with value: 0.09874446204365178 and parameters: {'model_type': 'mlp', 'hidden_dims': '[512, 64]', 'dropout': 0.4634843905908045, 'batch_norm': False, 'lr': 0.0002132963501226098, 'weight_decay': 1.1690776204021993e-06, 'epochs': 266, 'loss': 'mae', 'optimizer': 'adam', 'graph_mode': 'off', 'use_snp_selection': True, 'num_snps': 19911}. Best is trial 25 with value: 0.1340284223496243.
[I 2025-12-05 14:56:28,973] Trial 39 finished with value: 0.12177883597568405 and parameters: {'model_type': 'mlp', 'hidden_dims': '[256, 128]', 'dropout': 0.593444752072398, 'batch_norm': True, 'lr': 0.00010396186549651231, 'weight_decay': 3.994216691755296e-06, 'epochs': 131, 'loss': 'mse', 'optimizer': 'adam', 'graph_mode': 'off', 'use_snp_selection': False}. Best is trial 25 with value: 0.1340284223496243.
[I 2025-12-05 14:56:30,921] Trial 40 finished with value: 0.0785572487545677 and parameters: {'model_type': 'mlp', 'hidden_dims': '[512, 128]', 'dropout': 0.1340291732586209, 'batch_norm': True, 'lr': 4.767147905519569e-06, 'weight_decay': 1.227611830623877e-05, 'epochs': 334, 'loss': 'mae', 'optimizer': 'adam', 'graph_mode': 'off', 'use_snp_selection': False}. Best is trial 25 with value: 0.1340284223496243.
[I 2025-12-05 14:56:31,798] Trial 41 finished with value: 0.078417837615551 and parameters: {'model_type': 'mlp', 'hidden_dims': '[256, 128]', 'dropout': 0.5586189875836668, 'batch_norm': True, 'lr': 4.509155910408901e-05, 'weight_decay': 4.186010005023668e-06, 'epochs': 151, 'loss': 'mse', 'optimizer': 'adam', 'graph_mode': 'off', 'use_snp_selection': False}. Best is trial 25 with value: 0.1340284223496243.
[I 2025-12-05 14:56:32,622] Trial 42 finished with value: 0.0978961411928983 and parameters: {'model_type': 'mlp', 'hidden_dims': '[256, 128]', 'dropout': 0.5956857692368834, 'batch_norm': True, 'lr': 0.00011123608701400978, 'weight_decay': 1.7489992909411888e-06, 'epochs': 124, 'loss': 'mse', 'optimizer': 'adam', 'graph_mode': 'off', 'use_snp_selection': False}. Best is trial 25 with value: 0.1340284223496243.
[I 2025-12-05 14:56:33,462] Trial 43 finished with value: 0.015913519706329367 and parameters: {'model_type': 'mlp', 'hidden_dims': '[256, 128]', 'dropout': 0.4361672715042264, 'batch_norm': True, 'lr': 2.1409924724993155e-06, 'weight_decay': 6.5044664217495126e-06, 'epochs': 131, 'loss': 'mse', 'optimizer': 'adam', 'graph_mode': 'off', 'use_snp_selection': False}. Best is trial 25 with value: 0.1340284223496243.
[I 2025-12-05 14:56:34,854] Trial 44 finished with value: 0.11266880142766666 and parameters: {'model_type': 'mlp', 'hidden_dims': '[512, 64]', 'dropout': 0.3747762117911848, 'batch_norm': True, 'lr': 0.00028636848239238386, 'weight_decay': 2.927523407334628e-06, 'epochs': 189, 'loss': 'mse', 'optimizer': 'adam', 'graph_mode': 'off', 'use_snp_selection': False}. Best is trial 25 with value: 0.1340284223496243.
[I 2025-12-05 14:56:35,909] Trial 45 finished with value: 0.06703135290842123 and parameters: {'model_type': 'mlp', 'hidden_dims': '[256, 128]', 'dropout': 0.5610239148071743, 'batch_norm': True, 'lr': 8.837563616256678e-05, 'weight_decay': 1.0759879461860426e-05, 'epochs': 239, 'loss': 'mse', 'optimizer': 'adam', 'graph_mode': 'off', 'use_snp_selection': False}. Best is trial 25 with value: 0.1340284223496243.
[I 2025-12-05 14:56:37,410] Trial 46 finished with value: 0.12409890132571157 and parameters: {'model_type': 'mlp', 'hidden_dims': '[512, 128]', 'dropout': 0.12102843799340512, 'batch_norm': True, 'lr': 5.43312152412376e-05, 'weight_decay': 6.105240370438355e-07, 'epochs': 207, 'loss': 'mse', 'optimizer': 'adam', 'graph_mode': 'off', 'use_snp_selection': False}. Best is trial 25 with value: 0.1340284223496243.
[I 2025-12-05 14:56:38,901] Trial 47 finished with value: 0.12425063329255383 and parameters: {'model_type': 'mlp', 'hidden_dims': '[512, 128]', 'dropout': 0.12282134761424188, 'batch_norm': False, 'lr': 4.678923512656094e-05, 'weight_decay': 2.7836715934175814e-07, 'epochs': 208, 'loss': 'mse', 'optimizer': 'adam', 'graph_mode': 'off', 'use_snp_selection': False}. Best is trial 25 with value: 0.1340284223496243.
[I 2025-12-05 14:56:40,711] Trial 48 finished with value: 0.13056029039223815 and parameters: {'model_type': 'mlp', 'hidden_dims': '[512, 128]', 'dropout': 0.15806628007300688, 'batch_norm': False, 'lr': 2.3834490809075554e-05, 'weight_decay': 0.0006963874766430621, 'epochs': 296, 'loss': 'mae', 'optimizer': 'adam', 'graph_mode': 'off', 'use_snp_selection': False}. Best is trial 25 with value: 0.1340284223496243.
[I 2025-12-05 14:56:43,460] Trial 49 finished with value: 0.09155363471695038 and parameters: {'model_type': 'mlp', 'hidden_dims': '[512, 128]', 'dropout': 0.24402546065241032, 'batch_norm': False, 'lr': 1.5058305807058059e-05, 'weight_decay': 0.0005066159281116349, 'epochs': 295, 'loss': 'mae', 'optimizer': 'adam', 'graph_mode': 'off', 'use_snp_selection': True, 'num_snps': 46888}. Best is trial 25 with value: 0.1340284223496243.
[I 2025-12-05 14:56:44,720] Trial 50 finished with value: 0.126663182869753 and parameters: {'model_type': 'mlp', 'hidden_dims': '[256, 128, 64]', 'dropout': 0.16171394776758002, 'batch_norm': False, 'lr': 2.252085832684076e-05, 'weight_decay': 0.0006544118315687703, 'epochs': 333, 'loss': 'mae', 'optimizer': 'adam', 'graph_mode': 'off', 'use_snp_selection': False}. Best is trial 25 with value: 0.1340284223496243.
[I 2025-12-05 14:56:45,953] Trial 51 finished with value: 0.11367909400776727 and parameters: {'model_type': 'mlp', 'hidden_dims': '[256, 128, 64]', 'dropout': 0.16118773109856954, 'batch_norm': False, 'lr': 8.26991777858618e-06, 'weight_decay': 0.0007670520268396716, 'epochs': 329, 'loss': 'mae', 'optimizer': 'adam', 'graph_mode': 'off', 'use_snp_selection': False}. Best is trial 25 with value: 0.1340284223496243.
[I 2025-12-05 14:56:47,224] Trial 52 finished with value: 0.13484623215983205 and parameters: {'model_type': 'mlp', 'hidden_dims': '[256, 128, 64]', 'dropout': 0.18817976755214402, 'batch_norm': False, 'lr': 2.6537103780543282e-05, 'weight_decay': 0.00024275616768090205, 'epochs': 348, 'loss': 'mae', 'optimizer': 'adam', 'graph_mode': 'off', 'use_snp_selection': False}. Best is trial 52 with value: 0.13484623215983205.
[I 2025-12-05 14:56:48,493] Trial 53 finished with value: 0.12918312906147034 and parameters: {'model_type': 'mlp', 'hidden_dims': '[256, 128, 64]', 'dropout': 0.18866161170033258, 'batch_norm': False, 'lr': 2.3925035527906313e-05, 'weight_decay': 0.00025580885071347997, 'epochs': 348, 'loss': 'mae', 'optimizer': 'adam', 'graph_mode': 'off', 'use_snp_selection': False}. Best is trial 52 with value: 0.13484623215983205.
[I 2025-12-05 14:56:49,812] Trial 54 finished with value: 0.1121360829992995 and parameters: {'model_type': 'mlp', 'hidden_dims': '[256, 128, 64]', 'dropout': 0.1937105932288775, 'batch_norm': False, 'lr': 8.451325794060518e-06, 'weight_decay': 0.00021308224378711695, 'epochs': 347, 'loss': 'mae', 'optimizer': 'adam', 'graph_mode': 'off', 'use_snp_selection': False}. Best is trial 52 with value: 0.13484623215983205.
[I 2025-12-05 14:56:51,132] Trial 55 finished with value: 0.10606378355547579 and parameters: {'model_type': 'mlp', 'hidden_dims': '[256, 128, 64]', 'dropout': 0.2899043542435357, 'batch_norm': False, 'lr': 3.738239383992607e-05, 'weight_decay': 0.00030185502647081807, 'epochs': 346, 'loss': 'mae', 'optimizer': 'adam', 'graph_mode': 'off', 'use_snp_selection': False}. Best is trial 52 with value: 0.13484623215983205.
[I 2025-12-05 14:56:52,383] Trial 56 finished with value: 0.11401114556986228 and parameters: {'model_type': 'mlp', 'hidden_dims': '[256, 128, 64]', 'dropout': 0.22562009277631087, 'batch_norm': False, 'lr': 1.2943300519766774e-05, 'weight_decay': 0.0003976916736120055, 'epochs': 321, 'loss': 'mae', 'optimizer': 'adam', 'graph_mode': 'off', 'use_snp_selection': False}. Best is trial 52 with value: 0.13484623215983205.
[I 2025-12-05 14:56:54,185] Trial 57 finished with value: 0.1368237737487214 and parameters: {'model_type': 'mlp', 'hidden_dims': '[512, 64]', 'dropout': 0.1831048246709711, 'batch_norm': False, 'lr': 2.1783808480363784e-05, 'weight_decay': 0.00016148538621824118, 'epochs': 292, 'loss': 'mae', 'optimizer': 'adam', 'graph_mode': 'off', 'use_snp_selection': False}. Best is trial 57 with value: 0.1368237737487214.
[I 2025-12-05 14:56:55,373] Trial 58 finished with value: 0.1005912315236919 and parameters: {'model_type': 'mlp', 'hidden_dims': '[256, 128, 64]', 'dropout': 0.2532289624946392, 'batch_norm': False, 'lr': 2.1573552540903014e-05, 'weight_decay': 0.00016284276039189602, 'epochs': 305, 'loss': 'mae', 'optimizer': 'adam', 'graph_mode': 'off', 'use_snp_selection': False}. Best is trial 57 with value: 0.1368237737487214.
[I 2025-12-05 14:56:57,164] Trial 59 finished with value: 0.09886865720303645 and parameters: {'model_type': 'mlp', 'hidden_dims': '[512, 64]', 'dropout': 0.1771825505223273, 'batch_norm': False, 'lr': 1.1265543075356678e-05, 'weight_decay': 0.00014144043448895884, 'epochs': 297, 'loss': 'mae', 'optimizer': 'adam', 'graph_mode': 'off', 'use_snp_selection': False}. Best is trial 57 with value: 0.1368237737487214.
[I 2025-12-05 14:56:58,383] Trial 60 finished with value: 0.09429745634795081 and parameters: {'model_type': 'mlp', 'hidden_dims': '[256, 128, 64]', 'dropout': 0.22147192709407595, 'batch_norm': False, 'lr': 2.6564849424871683e-05, 'weight_decay': 0.0004663635348404016, 'epochs': 322, 'loss': 'mae', 'optimizer': 'adam', 'graph_mode': 'off', 'use_snp_selection': False}. Best is trial 57 with value: 0.1368237737487214.
[I 2025-12-05 14:57:00,079] Trial 61 finished with value: 0.11957710386436943 and parameters: {'model_type': 'mlp', 'hidden_dims': '[512, 64]', 'dropout': 0.14820900155460273, 'batch_norm': False, 'lr': 1.8891592355923768e-05, 'weight_decay': 0.00023241582270471756, 'epochs': 272, 'loss': 'mae', 'optimizer': 'adam', 'graph_mode': 'off', 'use_snp_selection': False}. Best is trial 57 with value: 0.1368237737487214.
[I 2025-12-05 14:57:01,833] Trial 62 finished with value: 0.10677537131661384 and parameters: {'model_type': 'mlp', 'hidden_dims': '[512, 64]', 'dropout': 0.19606051540945552, 'batch_norm': False, 'lr': 3.88312734121112e-05, 'weight_decay': 0.00011885038827165868, 'epochs': 288, 'loss': 'mae', 'optimizer': 'adam', 'graph_mode': 'off', 'use_snp_selection': False}. Best is trial 57 with value: 0.1368237737487214.
[I 2025-12-05 14:57:03,851] Trial 63 finished with value: 0.12791525532770684 and parameters: {'model_type': 'mlp', 'hidden_dims': '[512, 64]', 'dropout': 0.1836583609097201, 'batch_norm': False, 'lr': 6.802874617500196e-05, 'weight_decay': 4.566536314632794e-05, 'epochs': 350, 'loss': 'mae', 'optimizer': 'adam', 'graph_mode': 'off', 'use_snp_selection': False}. Best is trial 57 with value: 0.1368237737487214.
[I 2025-12-05 14:57:05,866] Trial 64 finished with value: 0.10253467647905055 and parameters: {'model_type': 'mlp', 'hidden_dims': '[512, 64]', 'dropout': 0.18319966004980107, 'batch_norm': False, 'lr': 8.927411021748276e-06, 'weight_decay': 4.667402277646923e-05, 'epochs': 349, 'loss': 'mae', 'optimizer': 'adam', 'graph_mode': 'off', 'use_snp_selection': False}. Best is trial 57 with value: 0.1368237737487214.
[I 2025-12-05 14:57:07,087] Trial 65 finished with value: 0.1184690907570129 and parameters: {'model_type': 'mlp', 'hidden_dims': '[256, 128, 64]', 'dropout': 0.20429367573545146, 'batch_norm': False, 'lr': 6.405245950766574e-05, 'weight_decay': 0.000965521156157672, 'epochs': 315, 'loss': 'mae', 'optimizer': 'adam', 'graph_mode': 'off', 'use_snp_selection': False}. Best is trial 57 with value: 0.1368237737487214.
[I 2025-12-05 14:57:08,997] Trial 66 finished with value: 0.1226757760519915 and parameters: {'model_type': 'mlp', 'hidden_dims': '[512, 64]', 'dropout': 0.16001755053977856, 'batch_norm': False, 'lr': 2.9466324343444005e-05, 'weight_decay': 0.00033408320529460325, 'epochs': 325, 'loss': 'mae', 'optimizer': 'adam', 'graph_mode': 'off', 'use_snp_selection': False}. Best is trial 57 with value: 0.1368237737487214.
[I 2025-12-05 14:57:10,653] Trial 67 finished with value: 0.10589064648553712 and parameters: {'model_type': 'mlp', 'hidden_dims': '[512, 64]', 'dropout': 0.270586556675082, 'batch_norm': False, 'lr': 1.6416709379037787e-05, 'weight_decay': 2.965265210987233e-05, 'epochs': 340, 'loss': 'mae', 'optimizer': 'adam', 'graph_mode': 'off', 'use_snp_selection': True, 'num_snps': 22951}. Best is trial 57 with value: 0.1368237737487214.
[I 2025-12-05 14:57:12,293] Trial 68 finished with value: 0.12581036394699338 and parameters: {'model_type': 'mlp', 'hidden_dims': '[512, 256]', 'dropout': 0.22125408508595318, 'batch_norm': False, 'lr': 3.80104021969503e-05, 'weight_decay': 0.000619734435143855, 'epochs': 255, 'loss': 'mae', 'optimizer': 'adam', 'graph_mode': 'off', 'use_snp_selection': False}. Best is trial 57 with value: 0.1368237737487214.
[I 2025-12-05 14:57:13,546] Trial 69 finished with value: 0.12123857578434895 and parameters: {'model_type': 'mlp', 'hidden_dims': '[256, 128, 64]', 'dropout': 0.305591648746157, 'batch_norm': False, 'lr': 0.00018710546618466673, 'weight_decay': 0.00011012366663869417, 'epochs': 339, 'loss': 'mae', 'optimizer': 'adam', 'graph_mode': 'off', 'use_snp_selection': False}. Best is trial 57 with value: 0.1368237737487214.
[I 2025-12-05 14:57:15,444] Trial 70 finished with value: 0.11563343119391975 and parameters: {'model_type': 'mlp', 'hidden_dims': '[512, 128]', 'dropout': 0.17252297396949673, 'batch_norm': False, 'lr': 2.2557849148862493e-05, 'weight_decay': 0.00019641860655211131, 'epochs': 312, 'loss': 'mae', 'optimizer': 'adam', 'graph_mode': 'off', 'use_snp_selection': False}. Best is trial 57 with value: 0.1368237737487214.
[I 2025-12-05 14:57:16,855] Trial 71 finished with value: 0.11700271667835214 and parameters: {'model_type': 'mlp', 'hidden_dims': '[512, 64]', 'dropout': 0.14383860856351832, 'batch_norm': False, 'lr': 0.00015614586953342454, 'weight_decay': 6.16171541158942e-05, 'epochs': 182, 'loss': 'mae', 'optimizer': 'adam', 'graph_mode': 'off', 'use_snp_selection': False}. Best is trial 57 with value: 0.1368237737487214.
[I 2025-12-05 14:57:18,309] Trial 72 finished with value: 0.11770660055101903 and parameters: {'model_type': 'mlp', 'hidden_dims': '[512, 64]', 'dropout': 0.11147738469434437, 'batch_norm': False, 'lr': 7.420752918535719e-05, 'weight_decay': 1.8183321400530717e-05, 'epochs': 197, 'loss': 'mae', 'optimizer': 'adam', 'graph_mode': 'off', 'use_snp_selection': False}. Best is trial 57 with value: 0.1368237737487214.
[I 2025-12-05 14:57:20,108] Trial 73 finished with value: 0.1082297958612719 and parameters: {'model_type': 'mlp', 'hidden_dims': '[512, 64]', 'dropout': 0.14054857443194282, 'batch_norm': False, 'lr': 6.096677541712183e-05, 'weight_decay': 0.00026204930163440786, 'epochs': 299, 'loss': 'mae', 'optimizer': 'adam', 'graph_mode': 'off', 'use_snp_selection': False}. Best is trial 57 with value: 0.1368237737487214.
[I 2025-12-05 14:57:21,445] Trial 74 finished with value: 0.09864465607677379 and parameters: {'model_type': 'mlp', 'hidden_dims': '[512, 64]', 'dropout': 0.20969435610174397, 'batch_norm': False, 'lr': 0.00041179258427827574, 'weight_decay': 9.525027779655442e-05, 'epochs': 175, 'loss': 'mae', 'optimizer': 'adam', 'graph_mode': 'off', 'use_snp_selection': False}. Best is trial 57 with value: 0.1368237737487214.
[I 2025-12-05 14:57:22,475] Trial 75 finished with value: 0.13094228067362781 and parameters: {'model_type': 'mlp', 'hidden_dims': '[256, 128]', 'dropout': 0.18899514479336588, 'batch_norm': False, 'lr': 0.00013093106571441585, 'weight_decay': 0.0003899318804755315, 'epochs': 232, 'loss': 'mae', 'optimizer': 'adam', 'graph_mode': 'off', 'use_snp_selection': False}. Best is trial 57 with value: 0.1368237737487214.
[I 2025-12-05 14:57:23,511] Trial 76 finished with value: 0.11744344821285467 and parameters: {'model_type': 'mlp', 'hidden_dims': '[256, 128]', 'dropout': 0.23169645523476978, 'batch_norm': False, 'lr': 0.0001368211607034091, 'weight_decay': 0.0003785804287173536, 'epochs': 235, 'loss': 'mae', 'optimizer': 'adam', 'graph_mode': 'off', 'use_snp_selection': False}. Best is trial 57 with value: 0.1368237737487214.
