[I 2025-12-05 14:53:59,401] Trial 129 finished with value: 0.12766612292103263 and parameters: {'model_type': 'mlp', 'hidden_dims': '[512, 64]', 'dropout': 0.24086684131132158, 'batch_norm': True, 'lr': 0.00019356963326597678, 'weight_decay': 8.774537941953106e-06, 'epochs': 176, 'loss': 'mse', 'optimizer': 'adam', 'graph_mode': 'off', 'use_snp_selection': False}. Best is trial 45 with value: 0.14826626548093985.
[I 2025-12-05 14:54:01,704] Trial 130 finished with value: 0.14036977262641134 and parameters: {'model_type': 'mlp', 'hidden_dims': '[512, 128]', 'dropout': 0.279682658292212, 'batch_norm': True, 'lr': 0.0002853053069931122, 'weight_decay': 1.6707403244293e-06, 'epochs': 331, 'loss': 'mse', 'optimizer': 'adam', 'graph_mode': 'off', 'use_snp_selection': False}. Best is trial 45 with value: 0.14826626548093985.
[I 2025-12-05 14:54:03,037] Trial 131 finished with value: 0.12481038939003072 and parameters: {'model_type': 'mlp', 'hidden_dims': '[512, 128]', 'dropout': 0.20428898243942414, 'batch_norm': True, 'lr': 0.0001637205366520658, 'weight_decay': 8.530323524398151e-05, 'epochs': 124, 'loss': 'mse', 'optimizer': 'adam', 'graph_mode': 'off', 'use_snp_selection': False}. Best is trial 45 with value: 0.14826626548093985.
[I 2025-12-05 14:54:04,306] Trial 132 finished with value: 0.14501863770853746 and parameters: {'model_type': 'mlp', 'hidden_dims': '[512, 128]', 'dropout': 0.16383588329917184, 'batch_norm': True, 'lr': 0.00011805846353944312, 'weight_decay': 6.05868650221418e-05, 'epochs': 110, 'loss': 'mse', 'optimizer': 'adam', 'graph_mode': 'off', 'use_snp_selection': False}. Best is trial 45 with value: 0.14826626548093985.
[I 2025-12-05 14:54:05,489] Trial 133 finished with value: 0.12793089053633727 and parameters: {'model_type': 'mlp', 'hidden_dims': '[512, 128]', 'dropout': 0.17556187128549303, 'batch_norm': True, 'lr': 0.00012850791268204212, 'weight_decay': 2.278852385452334e-05, 'epochs': 92, 'loss': 'mse', 'optimizer': 'adam', 'graph_mode': 'off', 'use_snp_selection': False}. Best is trial 45 with value: 0.14826626548093985.
[I 2025-12-05 14:54:07,227] Trial 134 finished with value: 0.12920652980619596 and parameters: {'model_type': 'mlp', 'hidden_dims': '[512, 128]', 'dropout': 0.16324899303162146, 'batch_norm': True, 'lr': 8.984444611667953e-05, 'weight_decay': 5.283417607512602e-05, 'epochs': 211, 'loss': 'mse', 'optimizer': 'adam', 'graph_mode': 'off', 'use_snp_selection': False}. Best is trial 45 with value: 0.14826626548093985.
[I 2025-12-05 14:54:08,330] Trial 135 finished with value: 0.13103652141589206 and parameters: {'model_type': 'mlp', 'hidden_dims': '[512, 128]', 'dropout': 0.1876002500531105, 'batch_norm': True, 'lr': 0.0002197717584460594, 'weight_decay': 3.930963202823483e-05, 'epochs': 72, 'loss': 'mse', 'optimizer': 'adam', 'graph_mode': 'off', 'use_snp_selection': False}. Best is trial 45 with value: 0.14826626548093985.
[I 2025-12-05 14:54:10,168] Trial 136 finished with value: 0.1366913119859021 and parameters: {'model_type': 'mlp', 'hidden_dims': '[512, 128]', 'dropout': 0.12263613075870888, 'batch_norm': True, 'lr': 0.00015327208386199082, 'weight_decay': 0.00013826984500809868, 'epochs': 232, 'loss': 'mse', 'optimizer': 'adam', 'graph_mode': 'off', 'use_snp_selection': False}. Best is trial 45 with value: 0.14826626548093985.
[I 2025-12-05 14:54:11,539] Trial 137 finished with value: 0.01500812276828118 and parameters: {'model_type': 'mlp', 'hidden_dims': '[512, 256]', 'dropout': 0.26565282698848175, 'batch_norm': True, 'lr': 2.2975734365990353e-06, 'weight_decay': 0.00023565990285813083, 'epochs': 132, 'loss': 'mse', 'optimizer': 'adam', 'graph_mode': 'off', 'use_snp_selection': False}. Best is trial 45 with value: 0.14826626548093985.
[I 2025-12-05 14:54:12,878] Trial 138 finished with value: 0.13946071112398845 and parameters: {'model_type': 'mlp', 'hidden_dims': '[512, 128]', 'dropout': 0.14542847145170262, 'batch_norm': True, 'lr': 0.0004379501861121217, 'weight_decay': 6.63156094480883e-05, 'epochs': 119, 'loss': 'mse', 'optimizer': 'adam', 'graph_mode': 'off', 'use_snp_selection': False}. Best is trial 45 with value: 0.14826626548093985.
[I 2025-12-05 14:54:14,101] Trial 139 finished with value: 0.11220126115973815 and parameters: {'model_type': 'mlp', 'hidden_dims': '[512, 128]', 'dropout': 0.28709358840538496, 'batch_norm': False, 'lr': 0.00011773895964003928, 'weight_decay': 0.00018244395414160537, 'epochs': 102, 'loss': 'mse', 'optimizer': 'adam', 'graph_mode': 'off', 'use_snp_selection': False}. Best is trial 45 with value: 0.14826626548093985.
[I 2025-12-05 14:54:15,610] Trial 140 finished with value: 0.14782695107709148 and parameters: {'model_type': 'mlp', 'hidden_dims': '[512, 64]', 'dropout': 0.11136234177636778, 'batch_norm': True, 'lr': 0.00018664160435804506, 'weight_decay': 3.0644837808913305e-07, 'epochs': 163, 'loss': 'mse', 'optimizer': 'adam', 'graph_mode': 'off', 'use_snp_selection': False}. Best is trial 45 with value: 0.14826626548093985.
[I 2025-12-05 14:54:16,896] Trial 141 finished with value: 0.13463864347411672 and parameters: {'model_type': 'mlp', 'hidden_dims': '[512, 64]', 'dropout': 0.11345206828189808, 'batch_norm': True, 'lr': 0.00018511802748493844, 'weight_decay': 3.1961812077398113e-07, 'epochs': 113, 'loss': 'mse', 'optimizer': 'adam', 'graph_mode': 'off', 'use_snp_selection': False}. Best is trial 45 with value: 0.14826626548093985.
[I 2025-12-05 14:54:18,375] Trial 142 finished with value: 0.12859052178142044 and parameters: {'model_type': 'mlp', 'hidden_dims': '[512, 64]', 'dropout': 0.24964721083955568, 'batch_norm': True, 'lr': 0.00017303617827073173, 'weight_decay': 2.4163771352795717e-07, 'epochs': 156, 'loss': 'mse', 'optimizer': 'adam', 'graph_mode': 'off', 'use_snp_selection': False}. Best is trial 45 with value: 0.14826626548093985.
[I 2025-12-05 14:54:20,001] Trial 143 finished with value: 0.14554287868714122 and parameters: {'model_type': 'mlp', 'hidden_dims': '[512, 64]', 'dropout': 0.135492049375185, 'batch_norm': True, 'lr': 0.0002487834226437511, 'weight_decay': 1.6518514105323739e-07, 'epochs': 182, 'loss': 'mse', 'optimizer': 'adam', 'graph_mode': 'off', 'use_snp_selection': False}. Best is trial 45 with value: 0.14826626548093985.
[I 2025-12-05 14:54:21,552] Trial 144 finished with value: 0.14107090622051968 and parameters: {'model_type': 'mlp', 'hidden_dims': '[512, 64]', 'dropout': 0.10507340410177785, 'batch_norm': True, 'lr': 0.00014316718146053687, 'weight_decay': 1.5378403895165438e-07, 'epochs': 171, 'loss': 'mse', 'optimizer': 'adam', 'graph_mode': 'off', 'use_snp_selection': False}. Best is trial 45 with value: 0.14826626548093985.
[I 2025-12-05 14:54:23,167] Trial 145 finished with value: 0.13858035751955644 and parameters: {'model_type': 'mlp', 'hidden_dims': '[512, 64]', 'dropout': 0.12727011618269352, 'batch_norm': True, 'lr': 0.0002426813501807301, 'weight_decay': 1.419527421837382e-07, 'epochs': 185, 'loss': 'mse', 'optimizer': 'adam', 'graph_mode': 'off', 'use_snp_selection': False}. Best is trial 45 with value: 0.14826626548093985.
[I 2025-12-05 14:54:24,715] Trial 146 finished with value: 0.13816462740100038 and parameters: {'model_type': 'mlp', 'hidden_dims': '[512, 64]', 'dropout': 0.14339610914492398, 'batch_norm': True, 'lr': 0.00020195367378857726, 'weight_decay': 2.7323981839967337e-05, 'epochs': 164, 'loss': 'mse', 'optimizer': 'adam', 'graph_mode': 'off', 'use_snp_selection': False}. Best is trial 45 with value: 0.14826626548093985.
[I 2025-12-05 14:54:26,385] Trial 147 finished with value: 0.13315212299692736 and parameters: {'model_type': 'mlp', 'hidden_dims': '[512, 64]', 'dropout': 0.14166865237654203, 'batch_norm': True, 'lr': 0.00010977031467489224, 'weight_decay': 2.119865510264504e-07, 'epochs': 194, 'loss': 'mae', 'optimizer': 'adam', 'graph_mode': 'off', 'use_snp_selection': False}. Best is trial 45 with value: 0.14826626548093985.
[I 2025-12-05 14:54:27,990] Trial 148 finished with value: 0.1312372808121061 and parameters: {'model_type': 'mlp', 'hidden_dims': '[512, 64]', 'dropout': 0.15918948983394032, 'batch_norm': True, 'lr': 0.0002635551452627807, 'weight_decay': 2.866997611294265e-07, 'epochs': 181, 'loss': 'mse', 'optimizer': 'adam', 'graph_mode': 'off', 'use_snp_selection': False}. Best is trial 45 with value: 0.14826626548093985.
[I 2025-12-05 14:54:29,400] Trial 149 finished with value: 0.12826397664309158 and parameters: {'model_type': 'mlp', 'hidden_dims': '[512, 64]', 'dropout': 0.16994164092453917, 'batch_norm': True, 'lr': 7.838820862782466e-05, 'weight_decay': 1.8431517141151296e-07, 'epochs': 141, 'loss': 'mse', 'optimizer': 'adam', 'graph_mode': 'off', 'use_snp_selection': False}. Best is trial 45 with value: 0.14826626548093985.
[I 2025-12-05 14:54:31,609] Trial 0 finished with value: 0.033339978517496295 and parameters: {'model_type': 'mlp', 'hidden_dims': '[128, 64]', 'dropout': 0.199031432379812, 'batch_norm': True, 'lr': 1.8408544111075837e-06, 'weight_decay': 5.5136510071208614e-05, 'epochs': 336, 'loss': 'mae', 'optimizer': 'adam', 'graph_mode': 'off', 'use_snp_selection': True, 'num_snps': 43862}. Best is trial 0 with value: 0.033339978517496295.
[I 2025-12-05 14:54:32,735] Trial 1 finished with value: 0.11289716827190863 and parameters: {'model_type': 'mlp', 'hidden_dims': '[256, 128]', 'dropout': 0.4370668075331726, 'batch_norm': True, 'lr': 7.133471581159139e-05, 'weight_decay': 1.128633586803549e-05, 'epochs': 242, 'loss': 'mae', 'optimizer': 'adam', 'graph_mode': 'off', 'use_snp_selection': False}. Best is trial 1 with value: 0.11289716827190863.
[I 2025-12-05 14:54:33,782] Trial 2 finished with value: 0.06362579463567414 and parameters: {'model_type': 'mlp', 'hidden_dims': '[256, 128, 64]', 'dropout': 0.41314357415569625, 'batch_norm': False, 'lr': 3.952233718592101e-06, 'weight_decay': 0.00026754769258252603, 'epochs': 149, 'loss': 'mse', 'optimizer': 'adam', 'graph_mode': 'off', 'use_snp_selection': True, 'num_snps': 11571}. Best is trial 1 with value: 0.11289716827190863.
[I 2025-12-05 14:54:35,757] Trial 3 finished with value: 0.08932073498709782 and parameters: {'model_type': 'mlp', 'hidden_dims': '[512, 64]', 'dropout': 0.5938127374509361, 'batch_norm': False, 'lr': 5.67704586114731e-06, 'weight_decay': 2.4518087630137052e-05, 'epochs': 320, 'loss': 'mae', 'optimizer': 'adam', 'graph_mode': 'off', 'use_snp_selection': False}. Best is trial 1 with value: 0.11289716827190863.
[I 2025-12-05 14:54:37,963] Trial 4 finished with value: 0.019290487165273835 and parameters: {'model_type': 'mlp', 'hidden_dims': '[512, 128]', 'dropout': 0.25746343592134413, 'batch_norm': True, 'lr': 1.3467657668402788e-06, 'weight_decay': 0.00033087251918647806, 'epochs': 277, 'loss': 'mse', 'optimizer': 'adam', 'graph_mode': 'off', 'use_snp_selection': True, 'num_snps': 36675}. Best is trial 1 with value: 0.11289716827190863.
[I 2025-12-05 14:54:39,704] Trial 5 finished with value: 0.04441928095265693 and parameters: {'model_type': 'mlp', 'hidden_dims': '[512, 64]', 'dropout': 0.38275350994408375, 'batch_norm': True, 'lr': 1.5586664309232824e-06, 'weight_decay': 0.0008227664668621182, 'epochs': 145, 'loss': 'mae', 'optimizer': 'adam', 'graph_mode': 'off', 'use_snp_selection': True, 'num_snps': 32148}. Best is trial 1 with value: 0.11289716827190863.
[I 2025-12-05 14:54:40,745] Trial 6 finished with value: 0.1107186703945124 and parameters: {'model_type': 'mlp', 'hidden_dims': '[256, 128]', 'dropout': 0.3930109900265879, 'batch_norm': False, 'lr': 4.892964372128395e-05, 'weight_decay': 1.5809549317992182e-06, 'epochs': 199, 'loss': 'mse', 'optimizer': 'adam', 'graph_mode': 'off', 'use_snp_selection': False}. Best is trial 1 with value: 0.11289716827190863.
[I 2025-12-05 14:54:41,860] Trial 7 finished with value: 0.10845210295421381 and parameters: {'model_type': 'mlp', 'hidden_dims': '[512, 256]', 'dropout': 0.15343979219678458, 'batch_norm': True, 'lr': 6.234003099047341e-05, 'weight_decay': 3.894760610535477e-07, 'epochs': 97, 'loss': 'mse', 'optimizer': 'adam', 'graph_mode': 'off', 'use_snp_selection': False}. Best is trial 1 with value: 0.11289716827190863.
[I 2025-12-05 14:54:43,777] Trial 8 finished with value: 0.11640428873208597 and parameters: {'model_type': 'mlp', 'hidden_dims': '[512, 128]', 'dropout': 0.10743001231661406, 'batch_norm': True, 'lr': 0.00023728538449271062, 'weight_decay': 1.7629071578048637e-05, 'epochs': 312, 'loss': 'mae', 'optimizer': 'adam', 'graph_mode': 'off', 'use_snp_selection': False}. Best is trial 8 with value: 0.11640428873208597.
[I 2025-12-05 14:54:45,174] Trial 9 finished with value: 0.10715574244404476 and parameters: {'model_type': 'mlp', 'hidden_dims': '[512, 64]', 'dropout': 0.14505336736221927, 'batch_norm': True, 'lr': 5.8619638388111826e-05, 'weight_decay': 6.200156172669308e-07, 'epochs': 175, 'loss': 'mse', 'optimizer': 'adam', 'graph_mode': 'off', 'use_snp_selection': False}. Best is trial 8 with value: 0.11640428873208597.
[I 2025-12-05 14:54:46,156] Trial 10 finished with value: 0.10256477778809275 and parameters: {'model_type': 'mlp', 'hidden_dims': '[512, 128]', 'dropout': 0.2800030442581858, 'batch_norm': False, 'lr': 0.0004919806695968258, 'weight_decay': 2.9953888095455486e-06, 'epochs': 55, 'loss': 'mae', 'optimizer': 'adam', 'graph_mode': 'off', 'use_snp_selection': False}. Best is trial 8 with value: 0.11640428873208597.
[I 2025-12-05 14:54:47,279] Trial 11 finished with value: 0.12462341590952702 and parameters: {'model_type': 'mlp', 'hidden_dims': '[256, 128]', 'dropout': 0.5025533409127559, 'batch_norm': True, 'lr': 0.0004219456914890788, 'weight_decay': 7.0869802591332905e-06, 'epochs': 239, 'loss': 'mae', 'optimizer': 'adam', 'graph_mode': 'off', 'use_snp_selection': False}. Best is trial 11 with value: 0.12462341590952702.
[I 2025-12-05 14:54:49,048] Trial 12 finished with value: 0.11951484800109727 and parameters: {'model_type': 'mlp', 'hidden_dims': '[512, 128]', 'dropout': 0.5266996967984326, 'batch_norm': True, 'lr': 0.0006753264773209732, 'weight_decay': 4.19780668911197e-06, 'epochs': 268, 'loss': 'mae', 'optimizer': 'adam', 'graph_mode': 'off', 'use_snp_selection': False}. Best is trial 11 with value: 0.12462341590952702.
[I 2025-12-05 14:54:50,173] Trial 13 finished with value: 0.1260557196051889 and parameters: {'model_type': 'mlp', 'hidden_dims': '[256, 128]', 'dropout': 0.5315584915037047, 'batch_norm': True, 'lr': 0.0005708634147974784, 'weight_decay': 1.3270569831995856e-07, 'epochs': 238, 'loss': 'mae', 'optimizer': 'adam', 'graph_mode': 'off', 'use_snp_selection': False}. Best is trial 13 with value: 0.1260557196051889.
[I 2025-12-05 14:54:51,281] Trial 14 finished with value: 0.14489011797967669 and parameters: {'model_type': 'mlp', 'hidden_dims': '[256, 128]', 'dropout': 0.5013965675737065, 'batch_norm': True, 'lr': 0.0002108574938852793, 'weight_decay': 1.0783833902090374e-07, 'epochs': 220, 'loss': 'mae', 'optimizer': 'adam', 'graph_mode': 'off', 'use_snp_selection': False}. Best is trial 14 with value: 0.14489011797967669.
[I 2025-12-05 14:54:52,322] Trial 15 finished with value: 0.09541124482635303 and parameters: {'model_type': 'mlp', 'hidden_dims': '[256, 128]', 'dropout': 0.5990252109813637, 'batch_norm': True, 'lr': 0.00018429018027102804, 'weight_decay': 1.1190381219549156e-07, 'epochs': 199, 'loss': 'mae', 'optimizer': 'adam', 'graph_mode': 'off', 'use_snp_selection': False}. Best is trial 14 with value: 0.14489011797967669.
[I 2025-12-05 14:54:53,412] Trial 16 finished with value: 0.07046633639708214 and parameters: {'model_type': 'mlp', 'hidden_dims': '[256, 128]', 'dropout': 0.500380019364942, 'batch_norm': True, 'lr': 1.2586985041154999e-05, 'weight_decay': 1.059030865050228e-07, 'epochs': 223, 'loss': 'mae', 'optimizer': 'adam', 'graph_mode': 'off', 'use_snp_selection': False}. Best is trial 14 with value: 0.14489011797967669.
[I 2025-12-05 14:54:54,379] Trial 17 finished with value: 0.10258135792966921 and parameters: {'model_type': 'mlp', 'hidden_dims': '[128, 64]', 'dropout': 0.4599163501058064, 'batch_norm': True, 'lr': 0.0001674551048072027, 'weight_decay': 3.539465486244914e-07, 'epochs': 280, 'loss': 'mae', 'optimizer': 'adam', 'graph_mode': 'off', 'use_snp_selection': False}. Best is trial 14 with value: 0.14489011797967669.
[I 2025-12-05 14:54:57,224] Trial 18 finished with value: 0.07018059508871881 and parameters: {'model_type': 'mlp', 'hidden_dims': '[512, 256]', 'dropout': 0.5474956124254974, 'batch_norm': False, 'lr': 0.000994041864003684, 'weight_decay': 1.0796977688104246e-06, 'epochs': 141, 'loss': 'mae', 'optimizer': 'adam', 'graph_mode': 'off', 'use_snp_selection': True, 'num_snps': 58241}. Best is trial 14 with value: 0.14489011797967669.
[I 2025-12-05 14:54:58,130] Trial 19 finished with value: 0.026752098101088525 and parameters: {'model_type': 'mlp', 'hidden_dims': '[256, 128, 64]', 'dropout': 0.34637568076412795, 'batch_norm': True, 'lr': 1.576401930746709e-05, 'weight_decay': 2.4447578815574765e-07, 'epochs': 96, 'loss': 'mae', 'optimizer': 'adam', 'graph_mode': 'off', 'use_snp_selection': False}. Best is trial 14 with value: 0.14489011797967669.
[I 2025-12-05 14:54:59,218] Trial 20 finished with value: 0.13946122047947548 and parameters: {'model_type': 'mlp', 'hidden_dims': '[256, 128]', 'dropout': 0.4701618276786523, 'batch_norm': True, 'lr': 0.0002952580934046458, 'weight_decay': 1.704455949632074e-07, 'epochs': 222, 'loss': 'mae', 'optimizer': 'adam', 'graph_mode': 'off', 'use_snp_selection': False}. Best is trial 14 with value: 0.14489011797967669.
[I 2025-12-05 14:55:00,303] Trial 21 finished with value: 0.11658194569139628 and parameters: {'model_type': 'mlp', 'hidden_dims': '[256, 128]', 'dropout': 0.4739738509695388, 'batch_norm': True, 'lr': 0.00031038747505743823, 'weight_decay': 1.9393630416387757e-07, 'epochs': 221, 'loss': 'mae', 'optimizer': 'adam', 'graph_mode': 'off', 'use_snp_selection': False}. Best is trial 14 with value: 0.14489011797967669.
[I 2025-12-05 14:55:01,485] Trial 22 finished with value: 0.12339721945386262 and parameters: {'model_type': 'mlp', 'hidden_dims': '[256, 128]', 'dropout': 0.5524517697872755, 'batch_norm': True, 'lr': 0.0001117665926815876, 'weight_decay': 6.344835971964851e-07, 'epochs': 257, 'loss': 'mae', 'optimizer': 'adam', 'graph_mode': 'off', 'use_snp_selection': False}. Best is trial 14 with value: 0.14489011797967669.
[I 2025-12-05 14:55:02,480] Trial 23 finished with value: 0.11431577114189564 and parameters: {'model_type': 'mlp', 'hidden_dims': '[256, 128]', 'dropout': 0.35408534822369575, 'batch_norm': True, 'lr': 0.0009205000032141336, 'weight_decay': 1.0106749741563562e-07, 'epochs': 176, 'loss': 'mae', 'optimizer': 'adam', 'graph_mode': 'off', 'use_snp_selection': False}. Best is trial 14 with value: 0.14489011797967669.
[I 2025-12-05 14:55:03,726] Trial 24 finished with value: 0.1245980523377158 and parameters: {'model_type': 'mlp', 'hidden_dims': '[256, 128]', 'dropout': 0.46987033741278, 'batch_norm': True, 'lr': 0.00012561252589954336, 'weight_decay': 1.4608049085539226e-06, 'epochs': 286, 'loss': 'mae', 'optimizer': 'adam', 'graph_mode': 'off', 'use_snp_selection': False}. Best is trial 14 with value: 0.14489011797967669.
[I 2025-12-05 14:55:04,790] Trial 25 finished with value: 0.11889487638434255 and parameters: {'model_type': 'mlp', 'hidden_dims': '[256, 128]', 'dropout': 0.5335323239954017, 'batch_norm': True, 'lr': 0.0003417094457813154, 'weight_decay': 2.0616972258210822e-07, 'epochs': 210, 'loss': 'mae', 'optimizer': 'adam', 'graph_mode': 'off', 'use_snp_selection': False}. Best is trial 14 with value: 0.14489011797967669.
[I 2025-12-05 14:55:05,641] Trial 26 finished with value: 0.05411297749461318 and parameters: {'model_type': 'mlp', 'hidden_dims': '[256, 128]', 'dropout': 0.5680625853878558, 'batch_norm': True, 'lr': 3.0279821522639866e-05, 'weight_decay': 6.216455498105533e-07, 'epochs': 174, 'loss': 'mae', 'optimizer': 'adam', 'graph_mode': 'off', 'use_snp_selection': True, 'num_snps': 3842}. Best is trial 14 with value: 0.14489011797967669.
[I 2025-12-05 14:55:06,878] Trial 27 finished with value: 0.09860690576095242 and parameters: {'model_type': 'mlp', 'hidden_dims': '[256, 128, 64]', 'dropout': 0.435460469320275, 'batch_norm': False, 'lr': 0.0005568952276328655, 'weight_decay': 1.9228104800372243e-07, 'epochs': 301, 'loss': 'mse', 'optimizer': 'adam', 'graph_mode': 'off', 'use_snp_selection': False}. Best is trial 14 with value: 0.14489011797967669.
[I 2025-12-05 14:55:07,800] Trial 28 finished with value: 0.13960041650782465 and parameters: {'model_type': 'mlp', 'hidden_dims': '[128, 64]', 'dropout': 0.3254314863734792, 'batch_norm': True, 'lr': 0.0001074099628777878, 'weight_decay': 2.5982925023707017e-06, 'epochs': 243, 'loss': 'mae', 'optimizer': 'adam', 'graph_mode': 'off', 'use_snp_selection': False}. Best is trial 14 with value: 0.14489011797967669.
[I 2025-12-05 14:55:09,192] Trial 29 finished with value: 0.14459263756458107 and parameters: {'model_type': 'mlp', 'hidden_dims': '[128, 64]', 'dropout': 0.28262567909073366, 'batch_norm': True, 'lr': 9.928911743858145e-05, 'weight_decay': 5.522710335772481e-05, 'epochs': 259, 'loss': 'mae', 'optimizer': 'adam', 'graph_mode': 'off', 'use_snp_selection': True, 'num_snps': 19468}. Best is trial 14 with value: 0.14489011797967669.
[I 2025-12-05 14:55:10,572] Trial 30 finished with value: 0.07603174138725771 and parameters: {'model_type': 'mlp', 'hidden_dims': '[128, 64]', 'dropout': 0.25586593682911535, 'batch_norm': True, 'lr': 2.7576335062017104e-05, 'weight_decay': 8.589708611495364e-05, 'epochs': 255, 'loss': 'mae', 'optimizer': 'adam', 'graph_mode': 'off', 'use_snp_selection': True, 'num_snps': 18365}. Best is trial 14 with value: 0.14489011797967669.
