[I 2025-12-06 09:36:06,277] Trial 72 finished with value: 0.22747322000577888 and parameters: {'model_type': 'mlp', 'hidden_dims': '[512, 128]', 'dropout': 0.42414861321594177, 'batch_norm': False, 'lr': 0.00018103239219802826, 'weight_decay': 3.0069175130362208e-05, 'epochs': 117, 'loss': 'mse', 'optimizer': 'adam', 'graph_mode': 'off', 'use_snp_selection': True, 'num_snps': 14943}. Best is trial 52 with value: 0.24579295833830703.
[I 2025-12-06 09:37:10,753] Trial 73 finished with value: 0.22360197982907634 and parameters: {'model_type': 'mlp', 'hidden_dims': '[512, 128]', 'dropout': 0.5674378289756059, 'batch_norm': False, 'lr': 9.790812585840256e-05, 'weight_decay': 1.8703445302737813e-05, 'epochs': 158, 'loss': 'mae', 'optimizer': 'adam', 'graph_mode': 'off', 'use_snp_selection': True, 'num_snps': 35168}. Best is trial 52 with value: 0.24579295833830703.
[I 2025-12-06 09:37:51,185] Trial 74 finished with value: 0.221669117094407 and parameters: {'model_type': 'mlp', 'hidden_dims': '[512, 128]', 'dropout': 0.47039430894269363, 'batch_norm': False, 'lr': 7.290109093104333e-05, 'weight_decay': 1.1374488495767916e-05, 'epochs': 40, 'loss': 'mse', 'optimizer': 'adam', 'graph_mode': 'off', 'use_snp_selection': True, 'num_snps': 20517}. Best is trial 52 with value: 0.24579295833830703.
[I 2025-12-06 09:38:44,038] Trial 75 finished with value: 0.23379397178512637 and parameters: {'model_type': 'mlp', 'hidden_dims': '[512, 64]', 'dropout': 0.445750912545214, 'batch_norm': False, 'lr': 5.228519309931397e-05, 'weight_decay': 5.2081805691069916e-05, 'epochs': 102, 'loss': 'mae', 'optimizer': 'adam', 'graph_mode': 'off', 'use_snp_selection': True, 'num_snps': 30329}. Best is trial 52 with value: 0.24579295833830703.
[I 2025-12-06 09:39:25,992] Trial 76 finished with value: 0.22784102196425415 and parameters: {'model_type': 'mlp', 'hidden_dims': '[512, 128]', 'dropout': 0.4834154185971655, 'batch_norm': False, 'lr': 1.210199952310194e-05, 'weight_decay': 1.909665811082068e-05, 'epochs': 89, 'loss': 'mae', 'optimizer': 'adam', 'graph_mode': 'off', 'use_snp_selection': True, 'num_snps': 17254}. Best is trial 52 with value: 0.24579295833830703.
[I 2025-12-06 09:39:50,401] Trial 77 finished with value: 0.22142059740218048 and parameters: {'model_type': 'mlp', 'hidden_dims': '[256, 128, 64]', 'dropout': 0.5090901606011387, 'batch_norm': True, 'lr': 0.00022575090418980523, 'weight_decay': 4.2249253157726326e-06, 'epochs': 128, 'loss': 'mae', 'optimizer': 'adam', 'graph_mode': 'off', 'use_snp_selection': False}. Best is trial 52 with value: 0.24579295833830703.
[I 2025-12-06 09:40:24,074] Trial 78 finished with value: 0.19725849683737579 and parameters: {'model_type': 'mlp', 'hidden_dims': '[512, 128]', 'dropout': 0.3954961529185193, 'batch_norm': False, 'lr': 0.00016665091398884155, 'weight_decay': 7.055248842015302e-06, 'epochs': 66, 'loss': 'mse', 'optimizer': 'adam', 'graph_mode': 'off', 'use_snp_selection': True, 'num_snps': 6695}. Best is trial 52 with value: 0.24579295833830703.
[I 2025-12-06 09:41:01,402] Trial 79 finished with value: 0.22412756844479262 and parameters: {'model_type': 'mlp', 'hidden_dims': '[512, 64]', 'dropout': 0.5412406265617562, 'batch_norm': False, 'lr': 6.0069499390305425e-05, 'weight_decay': 2.4057645888446737e-05, 'epochs': 113, 'loss': 'mae', 'optimizer': 'adam', 'graph_mode': 'off', 'use_snp_selection': False}. Best is trial 52 with value: 0.24579295833830703.
[I 2025-12-06 09:41:44,921] Trial 80 finished with value: 0.23629943533602377 and parameters: {'model_type': 'mlp', 'hidden_dims': '[512, 256]', 'dropout': 0.3803479721709208, 'batch_norm': False, 'lr': 9.005102059072765e-05, 'weight_decay': 0.00010641115179126846, 'epochs': 177, 'loss': 'mae', 'optimizer': 'adam', 'graph_mode': 'off', 'use_snp_selection': True, 'num_snps': 13014}. Best is trial 52 with value: 0.24579295833830703.
[I 2025-12-06 09:42:23,804] Trial 81 finished with value: 0.2263360844813717 and parameters: {'model_type': 'mlp', 'hidden_dims': '[512, 256]', 'dropout': 0.46045312784344355, 'batch_norm': False, 'lr': 0.00011727419432700096, 'weight_decay': 0.00012823625594601741, 'epochs': 181, 'loss': 'mae', 'optimizer': 'adam', 'graph_mode': 'off', 'use_snp_selection': True, 'num_snps': 7909}. Best is trial 52 with value: 0.24579295833830703.
[I 2025-12-06 09:43:06,139] Trial 82 finished with value: 0.24026506424031507 and parameters: {'model_type': 'mlp', 'hidden_dims': '[512, 256]', 'dropout': 0.4205518392208871, 'batch_norm': False, 'lr': 8.525977306347077e-05, 'weight_decay': 0.00020124374163129572, 'epochs': 155, 'loss': 'mae', 'optimizer': 'adam', 'graph_mode': 'off', 'use_snp_selection': True, 'num_snps': 12582}. Best is trial 52 with value: 0.24579295833830703.
[I 2025-12-06 09:43:49,310] Trial 83 finished with value: 0.23456781275760824 and parameters: {'model_type': 'mlp', 'hidden_dims': '[512, 256]', 'dropout': 0.3823542044775584, 'batch_norm': False, 'lr': 9.19394349453523e-05, 'weight_decay': 0.0005673108134189399, 'epochs': 171, 'loss': 'mae', 'optimizer': 'adam', 'graph_mode': 'off', 'use_snp_selection': True, 'num_snps': 12387}. Best is trial 52 with value: 0.24579295833830703.
[I 2025-12-06 09:44:32,967] Trial 84 finished with value: 0.2309941077586608 and parameters: {'model_type': 'mlp', 'hidden_dims': '[512, 256]', 'dropout': 0.3530085548531146, 'batch_norm': False, 'lr': 7.035603118689389e-06, 'weight_decay': 0.00022019162887232063, 'epochs': 158, 'loss': 'mae', 'optimizer': 'adam', 'graph_mode': 'off', 'use_snp_selection': True, 'num_snps': 13791}. Best is trial 52 with value: 0.24579295833830703.
[I 2025-12-06 09:45:09,662] Trial 85 finished with value: 0.19692056019773946 and parameters: {'model_type': 'mlp', 'hidden_dims': '[512, 256]', 'dropout': 0.41646415957038024, 'batch_norm': True, 'lr': 6.37867329768747e-05, 'weight_decay': 0.0004446383961193731, 'epochs': 180, 'loss': 'mae', 'optimizer': 'adam', 'graph_mode': 'off', 'use_snp_selection': True, 'num_snps': 5660}. Best is trial 52 with value: 0.24579295833830703.
[I 2025-12-06 09:46:08,971] Trial 86 finished with value: 0.2214695077975958 and parameters: {'model_type': 'mlp', 'hidden_dims': '[512, 256]', 'dropout': 0.3638092711469014, 'batch_norm': False, 'lr': 4.2886132692324104e-05, 'weight_decay': 0.00011097890621801486, 'epochs': 195, 'loss': 'mae', 'optimizer': 'adam', 'graph_mode': 'off', 'use_snp_selection': False}. Best is trial 52 with value: 0.24579295833830703.
[I 2025-12-06 09:47:24,229] Trial 87 finished with value: 0.2134321591759773 and parameters: {'model_type': 'mlp', 'hidden_dims': '[512, 256]', 'dropout': 0.43595229609566544, 'batch_norm': False, 'lr': 7.635681337318968e-05, 'weight_decay': 0.00031219188275248447, 'epochs': 138, 'loss': 'mse', 'optimizer': 'adam', 'graph_mode': 'off', 'use_snp_selection': True, 'num_snps': 48911}. Best is trial 52 with value: 0.24579295833830703.
[I 2025-12-06 09:47:58,011] Trial 88 finished with value: 0.19312168803237428 and parameters: {'model_type': 'mlp', 'hidden_dims': '[512, 256]', 'dropout': 0.3816732160809158, 'batch_norm': False, 'lr': 3.1169586943165246e-05, 'weight_decay': 0.00020641981791814424, 'epochs': 267, 'loss': 'mae', 'optimizer': 'adam', 'graph_mode': 'off', 'use_snp_selection': True, 'num_snps': 2261}. Best is trial 52 with value: 0.24579295833830703.
[I 2025-12-06 09:48:45,797] Trial 89 finished with value: 0.23050155523619548 and parameters: {'model_type': 'mlp', 'hidden_dims': '[512, 256]', 'dropout': 0.40733703080094263, 'batch_norm': False, 'lr': 1.702453671076639e-05, 'weight_decay': 4.5098421797268195e-05, 'epochs': 149, 'loss': 'mae', 'optimizer': 'adam', 'graph_mode': 'off', 'use_snp_selection': False}. Best is trial 52 with value: 0.24579295833830703.
[I 2025-12-06 09:49:33,872] Trial 90 finished with value: 0.17187678405273896 and parameters: {'model_type': 'mlp', 'hidden_dims': '[256, 128]', 'dropout': 0.5952866133823507, 'batch_norm': True, 'lr': 2.865433062445272e-06, 'weight_decay': 6.75269735706293e-05, 'epochs': 341, 'loss': 'mse', 'optimizer': 'adam', 'graph_mode': 'off', 'use_snp_selection': True, 'num_snps': 16558}. Best is trial 52 with value: 0.24579295833830703.
[I 2025-12-06 09:50:17,427] Trial 91 finished with value: 0.24307040947845387 and parameters: {'model_type': 'mlp', 'hidden_dims': '[512, 256]', 'dropout': 0.3364865737674536, 'batch_norm': False, 'lr': 8.819712222517746e-05, 'weight_decay': 0.0009808394969748043, 'epochs': 171, 'loss': 'mae', 'optimizer': 'adam', 'graph_mode': 'off', 'use_snp_selection': True, 'num_snps': 12731}. Best is trial 52 with value: 0.24579295833830703.
[I 2025-12-06 09:51:02,093] Trial 92 finished with value: 0.24230501750288513 and parameters: {'model_type': 'mlp', 'hidden_dims': '[512, 256]', 'dropout': 0.3378361994981602, 'batch_norm': False, 'lr': 9.630060142290046e-06, 'weight_decay': 0.0004471609846690229, 'epochs': 189, 'loss': 'mae', 'optimizer': 'adam', 'graph_mode': 'off', 'use_snp_selection': True, 'num_snps': 13002}. Best is trial 52 with value: 0.24579295833830703.
[I 2025-12-06 09:51:45,815] Trial 93 finished with value: 0.23855264569155624 and parameters: {'model_type': 'mlp', 'hidden_dims': '[512, 256]', 'dropout': 0.2971897443098289, 'batch_norm': False, 'lr': 0.00013024534110375478, 'weight_decay': 0.0008422396421585676, 'epochs': 188, 'loss': 'mae', 'optimizer': 'adam', 'graph_mode': 'off', 'use_snp_selection': True, 'num_snps': 12121}. Best is trial 52 with value: 0.24579295833830703.
[I 2025-12-06 09:52:30,058] Trial 94 finished with value: 0.2357548327798685 and parameters: {'model_type': 'mlp', 'hidden_dims': '[512, 256]', 'dropout': 0.30000126375764563, 'batch_norm': False, 'lr': 0.00013066006084629285, 'weight_decay': 0.0009939598003584301, 'epochs': 191, 'loss': 'mae', 'optimizer': 'adam', 'graph_mode': 'off', 'use_snp_selection': True, 'num_snps': 12473}. Best is trial 52 with value: 0.24579295833830703.
[I 2025-12-06 09:53:13,737] Trial 95 finished with value: 0.21273020285083274 and parameters: {'model_type': 'mlp', 'hidden_dims': '[512, 256]', 'dropout': 0.31761237423557787, 'batch_norm': False, 'lr': 8.695910621996271e-05, 'weight_decay': 0.0006185830814473132, 'epochs': 211, 'loss': 'mae', 'optimizer': 'adam', 'graph_mode': 'off', 'use_snp_selection': True, 'num_snps': 11256}. Best is trial 52 with value: 0.24579295833830703.
[I 2025-12-06 09:53:51,891] Trial 96 finished with value: 0.21840141021356177 and parameters: {'model_type': 'mlp', 'hidden_dims': '[512, 256]', 'dropout': 0.33915872103032824, 'batch_norm': False, 'lr': 0.00018310199886091105, 'weight_decay': 0.00043624686822123, 'epochs': 162, 'loss': 'mae', 'optimizer': 'adam', 'graph_mode': 'off', 'use_snp_selection': True, 'num_snps': 8195}. Best is trial 52 with value: 0.24579295833830703.
[I 2025-12-06 09:54:36,049] Trial 97 finished with value: 0.23941153629412487 and parameters: {'model_type': 'mlp', 'hidden_dims': '[512, 256]', 'dropout': 0.29807397738994257, 'batch_norm': False, 'lr': 4.8278684761080826e-05, 'weight_decay': 0.0006969751111231883, 'epochs': 175, 'loss': 'mae', 'optimizer': 'adam', 'graph_mode': 'off', 'use_snp_selection': True, 'num_snps': 13521}. Best is trial 52 with value: 0.24579295833830703.
[I 2025-12-06 09:55:26,499] Trial 98 finished with value: 0.239633519230447 and parameters: {'model_type': 'mlp', 'hidden_dims': '[512, 256]', 'dropout': 0.3063303070791588, 'batch_norm': False, 'lr': 4.701865757305716e-05, 'weight_decay': 0.0007496297361493353, 'epochs': 188, 'loss': 'mae', 'optimizer': 'adam', 'graph_mode': 'off', 'use_snp_selection': True, 'num_snps': 18245}. Best is trial 52 with value: 0.24579295833830703.
[I 2025-12-06 09:56:16,743] Trial 99 finished with value: 0.23642446105877152 and parameters: {'model_type': 'mlp', 'hidden_dims': '[512, 256]', 'dropout': 0.29420545657797087, 'batch_norm': False, 'lr': 5.336922278868098e-05, 'weight_decay': 0.0007175182785866016, 'epochs': 189, 'loss': 'mae', 'optimizer': 'adam', 'graph_mode': 'off', 'use_snp_selection': True, 'num_snps': 18142}. Best is trial 52 with value: 0.24579295833830703.
[I 2025-12-06 09:57:02,467] Trial 100 finished with value: 0.24381426804795958 and parameters: {'model_type': 'mlp', 'hidden_dims': '[512, 256]', 'dropout': 0.2631083024462687, 'batch_norm': False, 'lr': 6.946638126995983e-05, 'weight_decay': 0.0004473458972047681, 'epochs': 174, 'loss': 'mae', 'optimizer': 'adam', 'graph_mode': 'off', 'use_snp_selection': True, 'num_snps': 15158}. Best is trial 52 with value: 0.24579295833830703.
[I 2025-12-06 09:57:48,928] Trial 101 finished with value: 0.24201347858503963 and parameters: {'model_type': 'mlp', 'hidden_dims': '[512, 256]', 'dropout': 0.32834127344957875, 'batch_norm': False, 'lr': 7.017278243457784e-05, 'weight_decay': 0.0009971846349423079, 'epochs': 172, 'loss': 'mae', 'optimizer': 'adam', 'graph_mode': 'off', 'use_snp_selection': True, 'num_snps': 15620}. Best is trial 52 with value: 0.24579295833830703.
[I 2025-12-06 09:58:35,403] Trial 102 finished with value: 0.23718986802588712 and parameters: {'model_type': 'mlp', 'hidden_dims': '[512, 256]', 'dropout': 0.2612725924309229, 'batch_norm': False, 'lr': 6.916557236818406e-05, 'weight_decay': 0.0004858287805750752, 'epochs': 170, 'loss': 'mae', 'optimizer': 'adam', 'graph_mode': 'off', 'use_snp_selection': True, 'num_snps': 15743}. Best is trial 52 with value: 0.24579295833830703.
[I 2025-12-06 09:59:29,305] Trial 103 finished with value: 0.24207621673558247 and parameters: {'model_type': 'mlp', 'hidden_dims': '[512, 256]', 'dropout': 0.3089831763221986, 'batch_norm': False, 'lr': 5.061736444519266e-05, 'weight_decay': 0.0009646519896933605, 'epochs': 188, 'loss': 'mae', 'optimizer': 'adam', 'graph_mode': 'off', 'use_snp_selection': True, 'num_snps': 21781}. Best is trial 52 with value: 0.24579295833830703.
[I 2025-12-06 10:00:15,585] Trial 104 finished with value: 0.24697369548177325 and parameters: {'model_type': 'mlp', 'hidden_dims': '[512, 256]', 'dropout': 0.32884053869962676, 'batch_norm': False, 'lr': 4.7114638022707044e-05, 'weight_decay': 0.0008038077905093253, 'epochs': 185, 'loss': 'mae', 'optimizer': 'adam', 'graph_mode': 'off', 'use_snp_selection': True, 'num_snps': 14820}. Best is trial 104 with value: 0.24697369548177325.
[I 2025-12-06 10:01:10,882] Trial 105 finished with value: 0.2353448756033933 and parameters: {'model_type': 'mlp', 'hidden_dims': '[512, 256]', 'dropout': 0.30866755424534376, 'batch_norm': False, 'lr': 4.7746935436970316e-05, 'weight_decay': 0.0009492256620339572, 'epochs': 186, 'loss': 'mae', 'optimizer': 'adam', 'graph_mode': 'off', 'use_snp_selection': True, 'num_snps': 22543}. Best is trial 104 with value: 0.24697369548177325.
[I 2025-12-06 10:02:00,646] Trial 106 finished with value: 0.24100610888961768 and parameters: {'model_type': 'mlp', 'hidden_dims': '[512, 256]', 'dropout': 0.33527130442993625, 'batch_norm': False, 'lr': 3.528108005516344e-05, 'weight_decay': 0.00034386725659564694, 'epochs': 208, 'loss': 'mae', 'optimizer': 'adam', 'graph_mode': 'off', 'use_snp_selection': True, 'num_snps': 16520}. Best is trial 104 with value: 0.24697369548177325.
[I 2025-12-06 10:02:49,863] Trial 107 finished with value: 0.23856182976353724 and parameters: {'model_type': 'mlp', 'hidden_dims': '[512, 256]', 'dropout': 0.33036468527142465, 'batch_norm': False, 'lr': 3.9399625781328686e-05, 'weight_decay': 0.00036574267975534675, 'epochs': 207, 'loss': 'mae', 'optimizer': 'adam', 'graph_mode': 'off', 'use_snp_selection': True, 'num_snps': 15823}. Best is trial 104 with value: 0.24697369548177325.
[I 2025-12-06 10:03:43,437] Trial 108 finished with value: 0.23349184063945913 and parameters: {'model_type': 'mlp', 'hidden_dims': '[512, 256]', 'dropout': 0.3280057817329713, 'batch_norm': False, 'lr': 3.563149786914574e-05, 'weight_decay': 0.0006781369140696997, 'epochs': 227, 'loss': 'mae', 'optimizer': 'adam', 'graph_mode': 'off', 'use_snp_selection': True, 'num_snps': 18475}. Best is trial 104 with value: 0.24697369548177325.
[I 2025-12-06 10:04:31,035] Trial 109 finished with value: 0.24000010857842566 and parameters: {'model_type': 'mlp', 'hidden_dims': '[512, 256]', 'dropout': 0.26792975306884875, 'batch_norm': False, 'lr': 2.613817849267487e-05, 'weight_decay': 0.0005369091012121427, 'epochs': 197, 'loss': 'mae', 'optimizer': 'adam', 'graph_mode': 'off', 'use_snp_selection': True, 'num_snps': 15123}. Best is trial 104 with value: 0.24697369548177325.
[I 2025-12-06 10:05:20,990] Trial 110 finished with value: 0.23834846661138714 and parameters: {'model_type': 'mlp', 'hidden_dims': '[512, 256]', 'dropout': 0.2709422967809886, 'batch_norm': False, 'lr': 2.8506025022411573e-05, 'weight_decay': 0.0005269995181504954, 'epochs': 202, 'loss': 'mae', 'optimizer': 'adam', 'graph_mode': 'off', 'use_snp_selection': True, 'num_snps': 17116}. Best is trial 104 with value: 0.24697369548177325.
[I 2025-12-06 10:06:07,805] Trial 111 finished with value: 0.24114495603788993 and parameters: {'model_type': 'mlp', 'hidden_dims': '[512, 256]', 'dropout': 0.28832309413750606, 'batch_norm': False, 'lr': 2.4645869062848414e-05, 'weight_decay': 0.00037096065423507826, 'epochs': 174, 'loss': 'mae', 'optimizer': 'adam', 'graph_mode': 'off', 'use_snp_selection': True, 'num_snps': 15570}. Best is trial 104 with value: 0.24697369548177325.
[I 2025-12-06 10:06:53,028] Trial 112 finished with value: 0.24855246542575732 and parameters: {'model_type': 'mlp', 'hidden_dims': '[512, 256]', 'dropout': 0.34547775858099716, 'batch_norm': False, 'lr': 3.1485644227980364e-05, 'weight_decay': 0.00037643587743451247, 'epochs': 165, 'loss': 'mae', 'optimizer': 'adam', 'graph_mode': 'off', 'use_snp_selection': True, 'num_snps': 14854}. Best is trial 112 with value: 0.24855246542575732.
[I 2025-12-06 10:07:35,341] Trial 113 finished with value: 0.2168068253170244 and parameters: {'model_type': 'mlp', 'hidden_dims': '[512, 256]', 'dropout': 0.2864985447644253, 'batch_norm': False, 'lr': 3.205670676919548e-05, 'weight_decay': 0.000365381575576452, 'epochs': 197, 'loss': 'mae', 'optimizer': 'adam', 'graph_mode': 'off', 'use_snp_selection': True, 'num_snps': 10489}. Best is trial 112 with value: 0.24855246542575732.
[I 2025-12-06 10:08:20,785] Trial 114 finished with value: 0.24054768126287995 and parameters: {'model_type': 'mlp', 'hidden_dims': '[512, 256]', 'dropout': 0.24307944687720173, 'batch_norm': False, 'lr': 2.537868867786009e-05, 'weight_decay': 0.0002544282782307201, 'epochs': 164, 'loss': 'mae', 'optimizer': 'adam', 'graph_mode': 'off', 'use_snp_selection': True, 'num_snps': 15359}. Best is trial 112 with value: 0.24855246542575732.
[I 2025-12-06 10:09:10,989] Trial 115 finished with value: 0.2454241156781123 and parameters: {'model_type': 'mlp', 'hidden_dims': '[512, 256]', 'dropout': 0.34400236604473095, 'batch_norm': False, 'lr': 5.716585490674003e-05, 'weight_decay': 0.00027546079236673944, 'epochs': 164, 'loss': 'mae', 'optimizer': 'adam', 'graph_mode': 'off', 'use_snp_selection': True, 'num_snps': 19952}. Best is trial 112 with value: 0.24855246542575732.
[I 2025-12-06 10:09:51,491] Trial 116 finished with value: 0.24136632971454847 and parameters: {'model_type': 'mlp', 'hidden_dims': '[128, 64]', 'dropout': 0.34583363017141794, 'batch_norm': False, 'lr': 2.0803201733165055e-05, 'weight_decay': 0.0002931728800965395, 'epochs': 166, 'loss': 'mae', 'optimizer': 'adam', 'graph_mode': 'off', 'use_snp_selection': True, 'num_snps': 20622}. Best is trial 112 with value: 0.24855246542575732.
[I 2025-12-06 10:10:32,311] Trial 117 finished with value: 0.24100371407845605 and parameters: {'model_type': 'mlp', 'hidden_dims': '[128, 64]', 'dropout': 0.3463580137048197, 'batch_norm': False, 'lr': 2.0923638689961605e-05, 'weight_decay': 0.0002956767626746808, 'epochs': 169, 'loss': 'mae', 'optimizer': 'adam', 'graph_mode': 'off', 'use_snp_selection': True, 'num_snps': 20740}. Best is trial 112 with value: 0.24855246542575732.
[I 2025-12-06 10:11:15,180] Trial 118 finished with value: 0.239277815096415 and parameters: {'model_type': 'mlp', 'hidden_dims': '[128, 64]', 'dropout': 0.3542310506719982, 'batch_norm': False, 'lr': 2.3506697867936973e-05, 'weight_decay': 0.0003940405424808336, 'epochs': 212, 'loss': 'mae', 'optimizer': 'adam', 'graph_mode': 'off', 'use_snp_selection': True, 'num_snps': 22496}. Best is trial 112 with value: 0.24855246542575732.
[I 2025-12-06 10:11:58,171] Trial 119 finished with value: 0.23431890732790794 and parameters: {'model_type': 'mlp', 'hidden_dims': '[128, 64]', 'dropout': 0.33261440767998063, 'batch_norm': False, 'lr': 5.6425736558477956e-05, 'weight_decay': 0.00016678639911999556, 'epochs': 174, 'loss': 'mae', 'optimizer': 'adam', 'graph_mode': 'off', 'use_snp_selection': True, 'num_snps': 24830}. Best is trial 112 with value: 0.24855246542575732.
[I 2025-12-06 10:12:37,595] Trial 120 finished with value: 0.23409822704791922 and parameters: {'model_type': 'mlp', 'hidden_dims': '[128, 64]', 'dropout': 0.3254445082876785, 'batch_norm': False, 'lr': 4.081102444331509e-05, 'weight_decay': 0.0002623620709977972, 'epochs': 152, 'loss': 'mae', 'optimizer': 'adam', 'graph_mode': 'off', 'use_snp_selection': True, 'num_snps': 18829}. Best is trial 112 with value: 0.24855246542575732.
[I 2025-12-06 10:13:18,332] Trial 121 finished with value: 0.24094840929135503 and parameters: {'model_type': 'mlp', 'hidden_dims': '[128, 64]', 'dropout': 0.3471975473599045, 'batch_norm': False, 'lr': 2.207824505394626e-05, 'weight_decay': 0.00031715165143369827, 'epochs': 179, 'loss': 'mae', 'optimizer': 'adam', 'graph_mode': 'off', 'use_snp_selection': True, 'num_snps': 20398}. Best is trial 112 with value: 0.24855246542575732.
