[I 2025-12-05 16:18:30,390] Trial 74 finished with value: 0.03331665567300094 and parameters: {'model_type': 'mlp', 'hidden_dims': '[128, 64]', 'dropout': 0.3159238169009797, 'batch_norm': False, 'lr': 9.831513055912246e-05, 'weight_decay': 1.418392609168942e-06, 'epochs': 165, 'loss': 'mse', 'optimizer': 'adam', 'graph_mode': 'off', 'use_snp_selection': False}. Best is trial 39 with value: 0.06766369665432428.
[I 2025-12-05 16:18:32,191] Trial 75 finished with value: 0.037038492267717334 and parameters: {'model_type': 'mlp', 'hidden_dims': '[512, 128]', 'dropout': 0.34771040419179855, 'batch_norm': False, 'lr': 0.00018967766116666948, 'weight_decay': 3.2699242324135134e-07, 'epochs': 241, 'loss': 'mse', 'optimizer': 'adam', 'graph_mode': 'off', 'use_snp_selection': False}. Best is trial 39 with value: 0.06766369665432428.
[I 2025-12-05 16:18:33,323] Trial 76 finished with value: 0.04273229227844374 and parameters: {'model_type': 'mlp', 'hidden_dims': '[256, 128]', 'dropout': 0.30054060728430143, 'batch_norm': False, 'lr': 6.844211353774363e-05, 'weight_decay': 3.472957887396782e-06, 'epochs': 207, 'loss': 'mse', 'optimizer': 'adam', 'graph_mode': 'off', 'use_snp_selection': False}. Best is trial 39 with value: 0.06766369665432428.
[I 2025-12-05 16:18:34,330] Trial 77 finished with value: 0.04969772742532568 and parameters: {'model_type': 'mlp', 'hidden_dims': '[128, 64]', 'dropout': 0.4829683448850411, 'batch_norm': False, 'lr': 0.00027369588148504166, 'weight_decay': 8.355805544488444e-07, 'epochs': 316, 'loss': 'mae', 'optimizer': 'adam', 'graph_mode': 'off', 'use_snp_selection': False}. Best is trial 39 with value: 0.06766369665432428.
[I 2025-12-05 16:18:36,170] Trial 78 finished with value: 0.05901785869157888 and parameters: {'model_type': 'mlp', 'hidden_dims': '[512, 256]', 'dropout': 0.557914116015502, 'batch_norm': True, 'lr': 0.0003690823319053519, 'weight_decay': 0.0003919701720674888, 'epochs': 252, 'loss': 'mse', 'optimizer': 'adam', 'graph_mode': 'off', 'use_snp_selection': False}. Best is trial 39 with value: 0.06766369665432428.
[I 2025-12-05 16:18:38,067] Trial 79 finished with value: 0.027265154193605916 and parameters: {'model_type': 'mlp', 'hidden_dims': '[512, 256]', 'dropout': 0.5601524676194162, 'batch_norm': True, 'lr': 0.0001333412095051559, 'weight_decay': 0.0005360722984448426, 'epochs': 254, 'loss': 'mae', 'optimizer': 'adam', 'graph_mode': 'off', 'use_snp_selection': False}. Best is trial 39 with value: 0.06766369665432428.
[I 2025-12-05 16:18:40,045] Trial 80 finished with value: 0.03200325827773592 and parameters: {'model_type': 'mlp', 'hidden_dims': '[512, 256]', 'dropout': 0.5127561804063178, 'batch_norm': True, 'lr': 0.0005760723498280602, 'weight_decay': 0.00035524558922997386, 'epochs': 270, 'loss': 'mse', 'optimizer': 'adam', 'graph_mode': 'off', 'use_snp_selection': False}. Best is trial 39 with value: 0.06766369665432428.
[I 2025-12-05 16:18:41,799] Trial 81 finished with value: 0.03548257043528254 and parameters: {'model_type': 'mlp', 'hidden_dims': '[512, 256]', 'dropout': 0.3443555656159866, 'batch_norm': True, 'lr': 0.00037989340674224743, 'weight_decay': 0.00023313973715409467, 'epochs': 222, 'loss': 'mse', 'optimizer': 'adam', 'graph_mode': 'off', 'use_snp_selection': False}. Best is trial 39 with value: 0.06766369665432428.
[I 2025-12-05 16:18:43,613] Trial 82 finished with value: 0.031582549728743636 and parameters: {'model_type': 'mlp', 'hidden_dims': '[512, 256]', 'dropout': 0.551529716495543, 'batch_norm': True, 'lr': 8.811544522677219e-05, 'weight_decay': 0.00014169322147645244, 'epochs': 236, 'loss': 'mse', 'optimizer': 'adam', 'graph_mode': 'off', 'use_snp_selection': False}. Best is trial 39 with value: 0.06766369665432428.
[I 2025-12-05 16:18:45,435] Trial 83 finished with value: 0.0488283833189722 and parameters: {'model_type': 'mlp', 'hidden_dims': '[512, 128]', 'dropout': 0.5720267161271646, 'batch_norm': True, 'lr': 0.0006813071624429455, 'weight_decay': 0.0006179115371931166, 'epochs': 249, 'loss': 'mse', 'optimizer': 'adam', 'graph_mode': 'off', 'use_snp_selection': False}. Best is trial 39 with value: 0.06766369665432428.
[I 2025-12-05 16:18:47,291] Trial 84 finished with value: 0.017657954671180046 and parameters: {'model_type': 'mlp', 'hidden_dims': '[512, 64]', 'dropout': 0.4553347722614177, 'batch_norm': False, 'lr': 2.715164838610728e-06, 'weight_decay': 2.6925570625253795e-07, 'epochs': 260, 'loss': 'mse', 'optimizer': 'adam', 'graph_mode': 'off', 'use_snp_selection': False}. Best is trial 39 with value: 0.06766369665432428.
[I 2025-12-05 16:18:49,295] Trial 85 finished with value: 0.03060990947687955 and parameters: {'model_type': 'mlp', 'hidden_dims': '[512, 128]', 'dropout': 0.428428258484698, 'batch_norm': True, 'lr': 0.00016548815146480826, 'weight_decay': 6.592319884186951e-05, 'epochs': 280, 'loss': 'mse', 'optimizer': 'adam', 'graph_mode': 'off', 'use_snp_selection': False}. Best is trial 39 with value: 0.06766369665432428.
[I 2025-12-05 16:18:50,163] Trial 86 finished with value: -0.028716303461094193 and parameters: {'model_type': 'mlp', 'hidden_dims': '[128, 64]', 'dropout': 0.5853757741872395, 'batch_norm': False, 'lr': 0.000465597307564964, 'weight_decay': 0.00031972874887322995, 'epochs': 202, 'loss': 'mae', 'optimizer': 'adam', 'graph_mode': 'off', 'use_snp_selection': False}. Best is trial 39 with value: 0.06766369665432428.
[I 2025-12-05 16:18:52,383] Trial 87 finished with value: 0.038652731590858296 and parameters: {'model_type': 'mlp', 'hidden_dims': '[256, 128]', 'dropout': 0.47373151357915866, 'batch_norm': False, 'lr': 0.0003490123593715731, 'weight_decay': 1.1069058650180326e-06, 'epochs': 174, 'loss': 'mse', 'optimizer': 'adam', 'graph_mode': 'off', 'use_snp_selection': True, 'num_snps': 43141}. Best is trial 39 with value: 0.06766369665432428.
[I 2025-12-05 16:18:53,810] Trial 88 finished with value: 0.03629865195790863 and parameters: {'model_type': 'mlp', 'hidden_dims': '[512, 128]', 'dropout': 0.3884463758681866, 'batch_norm': True, 'lr': 0.00024651337858245896, 'weight_decay': 1.690086556706543e-06, 'epochs': 144, 'loss': 'mae', 'optimizer': 'adam', 'graph_mode': 'off', 'use_snp_selection': False}. Best is trial 39 with value: 0.06766369665432428.
[I 2025-12-05 16:18:55,401] Trial 89 finished with value: 0.03131256297441089 and parameters: {'model_type': 'mlp', 'hidden_dims': '[512, 256]', 'dropout': 0.4432181708577451, 'batch_norm': False, 'lr': 0.0008797706477957354, 'weight_decay': 0.0003945148684507384, 'epochs': 187, 'loss': 'mse', 'optimizer': 'adam', 'graph_mode': 'off', 'use_snp_selection': False}. Best is trial 39 with value: 0.06766369665432428.
[I 2025-12-05 16:18:56,416] Trial 90 finished with value: 0.04868893815826355 and parameters: {'model_type': 'mlp', 'hidden_dims': '[128, 64]', 'dropout': 0.5455244427950565, 'batch_norm': True, 'lr': 0.00021241007323616876, 'weight_decay': 0.00021126281327574263, 'epochs': 300, 'loss': 'mae', 'optimizer': 'adam', 'graph_mode': 'off', 'use_snp_selection': False}. Best is trial 39 with value: 0.06766369665432428.
[I 2025-12-05 16:18:57,450] Trial 91 finished with value: 0.01986647573984191 and parameters: {'model_type': 'mlp', 'hidden_dims': '[128, 64]', 'dropout': 0.4833695971451309, 'batch_norm': False, 'lr': 0.00028734624711601397, 'weight_decay': 0.0009518914023131803, 'epochs': 325, 'loss': 'mae', 'optimizer': 'adam', 'graph_mode': 'off', 'use_snp_selection': False}. Best is trial 39 with value: 0.06766369665432428.
[I 2025-12-05 16:18:58,511] Trial 92 finished with value: -0.00263585987279353 and parameters: {'model_type': 'mlp', 'hidden_dims': '[128, 64]', 'dropout': 0.5026696121483981, 'batch_norm': False, 'lr': 0.00012327200817642667, 'weight_decay': 7.491377643270329e-07, 'epochs': 350, 'loss': 'mae', 'optimizer': 'adam', 'graph_mode': 'off', 'use_snp_selection': False}. Best is trial 39 with value: 0.06766369665432428.
[I 2025-12-05 16:18:59,535] Trial 93 finished with value: 0.062099965984531824 and parameters: {'model_type': 'mlp', 'hidden_dims': '[128, 64]', 'dropout': 0.5289400837792639, 'batch_norm': False, 'lr': 0.00029205421074773885, 'weight_decay': 5.655162531249051e-07, 'epochs': 318, 'loss': 'mae', 'optimizer': 'adam', 'graph_mode': 'off', 'use_snp_selection': False}. Best is trial 39 with value: 0.06766369665432428.
[I 2025-12-05 16:19:00,424] Trial 94 finished with value: 0.0454627733324514 and parameters: {'model_type': 'mlp', 'hidden_dims': '[128, 64]', 'dropout': 0.5631423323438102, 'batch_norm': False, 'lr': 0.0005898826573201517, 'weight_decay': 6.163242181332854e-07, 'epochs': 213, 'loss': 'mae', 'optimizer': 'adam', 'graph_mode': 'off', 'use_snp_selection': False}. Best is trial 39 with value: 0.06766369665432428.
[I 2025-12-05 16:19:01,422] Trial 95 finished with value: 0.05286562120998805 and parameters: {'model_type': 'mlp', 'hidden_dims': '[128, 64]', 'dropout': 0.5251666270115605, 'batch_norm': False, 'lr': 5.638911674784066e-05, 'weight_decay': 6.797683629018941e-06, 'epochs': 309, 'loss': 'mae', 'optimizer': 'adam', 'graph_mode': 'off', 'use_snp_selection': False}. Best is trial 39 with value: 0.06766369665432428.
[I 2025-12-05 16:19:03,460] Trial 96 finished with value: 0.05732347977826689 and parameters: {'model_type': 'mlp', 'hidden_dims': '[512, 128]', 'dropout': 0.5368887449584988, 'batch_norm': False, 'lr': 2.9831401988548026e-05, 'weight_decay': 7.405913236143013e-06, 'epochs': 292, 'loss': 'mae', 'optimizer': 'adam', 'graph_mode': 'off', 'use_snp_selection': False}. Best is trial 39 with value: 0.06766369665432428.
[I 2025-12-05 16:19:05,554] Trial 97 finished with value: 0.01969397101610214 and parameters: {'model_type': 'mlp', 'hidden_dims': '[512, 128]', 'dropout': 0.5288421344200289, 'batch_norm': False, 'lr': 3.371282193427779e-05, 'weight_decay': 6.2768066088469635e-06, 'epochs': 308, 'loss': 'mae', 'optimizer': 'adam', 'graph_mode': 'off', 'use_snp_selection': False}. Best is trial 39 with value: 0.06766369665432428.
[I 2025-12-05 16:19:07,584] Trial 98 finished with value: 0.017301413626778252 and parameters: {'model_type': 'mlp', 'hidden_dims': '[512, 128]', 'dropout': 0.5417252364866398, 'batch_norm': False, 'lr': 4.723704935845645e-05, 'weight_decay': 8.126704898218246e-06, 'epochs': 283, 'loss': 'mae', 'optimizer': 'adam', 'graph_mode': 'off', 'use_snp_selection': False}. Best is trial 39 with value: 0.06766369665432428.
[I 2025-12-05 16:19:09,848] Trial 99 finished with value: 0.05023190769187265 and parameters: {'model_type': 'mlp', 'hidden_dims': '[512, 128]', 'dropout': 0.5128618469491824, 'batch_norm': True, 'lr': 3.0152674874141927e-05, 'weight_decay': 1.2334449875194403e-05, 'epochs': 332, 'loss': 'mae', 'optimizer': 'adam', 'graph_mode': 'off', 'use_snp_selection': False}. Best is trial 39 with value: 0.06766369665432428.
[I 2025-12-05 16:19:13,078] Trial 100 finished with value: 0.04360400310525077 and parameters: {'model_type': 'mlp', 'hidden_dims': '[512, 128]', 'dropout': 0.5838918857820705, 'batch_norm': False, 'lr': 5.419711636429181e-05, 'weight_decay': 2.6137017087884297e-05, 'epochs': 303, 'loss': 'mae', 'optimizer': 'adam', 'graph_mode': 'off', 'use_snp_selection': True, 'num_snps': 50880}. Best is trial 39 with value: 0.06766369665432428.
[I 2025-12-05 16:19:14,426] Trial 101 finished with value: 0.027886304325170436 and parameters: {'model_type': 'mlp', 'hidden_dims': '[256, 128, 64]', 'dropout': 0.5356403466636949, 'batch_norm': False, 'lr': 6.324727222570336e-05, 'weight_decay': 5.74818056439153e-06, 'epochs': 295, 'loss': 'mae', 'optimizer': 'adam', 'graph_mode': 'off', 'use_snp_selection': False}. Best is trial 39 with value: 0.06766369665432428.
[I 2025-12-05 16:19:16,403] Trial 102 finished with value: 0.030725827494378386 and parameters: {'model_type': 'mlp', 'hidden_dims': '[512, 64]', 'dropout': 0.4981256494637752, 'batch_norm': False, 'lr': 1.8031753501669074e-05, 'weight_decay': 2.7989407292649564e-06, 'epochs': 287, 'loss': 'mae', 'optimizer': 'adam', 'graph_mode': 'off', 'use_snp_selection': False}. Best is trial 39 with value: 0.06766369665432428.
[I 2025-12-05 16:19:17,827] Trial 103 finished with value: 0.030722673935535863 and parameters: {'model_type': 'mlp', 'hidden_dims': '[256, 128]', 'dropout': 0.5547660012544465, 'batch_norm': False, 'lr': 8.112301600154907e-05, 'weight_decay': 9.611451192888232e-06, 'epochs': 335, 'loss': 'mae', 'optimizer': 'adam', 'graph_mode': 'off', 'use_snp_selection': False}. Best is trial 39 with value: 0.06766369665432428.
[I 2025-12-05 16:19:19,925] Trial 104 finished with value: 0.028069927268799255 and parameters: {'model_type': 'mlp', 'hidden_dims': '[512, 128]', 'dropout': 0.5186950031509889, 'batch_norm': False, 'lr': 9.775658824979943e-05, 'weight_decay': 1.3664510171156373e-05, 'epochs': 309, 'loss': 'mae', 'optimizer': 'adam', 'graph_mode': 'off', 'use_snp_selection': False}. Best is trial 39 with value: 0.06766369665432428.
[I 2025-12-05 16:19:20,912] Trial 105 finished with value: 0.025614630672812066 and parameters: {'model_type': 'mlp', 'hidden_dims': '[128, 64]', 'dropout': 0.5729294997640555, 'batch_norm': False, 'lr': 4.1181305610204126e-05, 'weight_decay': 1.0121473046890001e-05, 'epochs': 320, 'loss': 'mae', 'optimizer': 'adam', 'graph_mode': 'off', 'use_snp_selection': False}. Best is trial 39 with value: 0.06766369665432428.
[I 2025-12-05 16:19:21,819] Trial 106 finished with value: 0.057766111699503714 and parameters: {'model_type': 'mlp', 'hidden_dims': '[128, 64]', 'dropout': 0.46063141900828136, 'batch_norm': False, 'lr': 6.829093512548098e-05, 'weight_decay': 4.601289796292147e-06, 'epochs': 271, 'loss': 'mae', 'optimizer': 'adam', 'graph_mode': 'off', 'use_snp_selection': False}. Best is trial 39 with value: 0.06766369665432428.
[I 2025-12-05 16:19:23,733] Trial 107 finished with value: 0.05263986739950737 and parameters: {'model_type': 'mlp', 'hidden_dims': '[512, 128]', 'dropout': 0.47355959279749826, 'batch_norm': False, 'lr': 3.010708703390202e-05, 'weight_decay': 5.210230891950651e-06, 'epochs': 272, 'loss': 'mae', 'optimizer': 'adam', 'graph_mode': 'off', 'use_snp_selection': False}. Best is trial 39 with value: 0.06766369665432428.
[I 2025-12-05 16:19:24,701] Trial 108 finished with value: 0.051797191687674625 and parameters: {'model_type': 'mlp', 'hidden_dims': '[128, 64]', 'dropout': 0.4629957748711704, 'batch_norm': True, 'lr': 7.498733572737347e-05, 'weight_decay': 4.079830295666623e-06, 'epochs': 294, 'loss': 'mae', 'optimizer': 'adam', 'graph_mode': 'off', 'use_snp_selection': False}. Best is trial 39 with value: 0.06766369665432428.
[I 2025-12-05 16:19:26,591] Trial 109 finished with value: 0.014964450541118977 and parameters: {'model_type': 'mlp', 'hidden_dims': '[512, 256]', 'dropout': 0.4102215536796936, 'batch_norm': False, 'lr': 5.436479198831614e-05, 'weight_decay': 2.4568687375954694e-06, 'epochs': 265, 'loss': 'mae', 'optimizer': 'adam', 'graph_mode': 'off', 'use_snp_selection': False}. Best is trial 39 with value: 0.06766369665432428.
[I 2025-12-05 16:19:28,607] Trial 110 finished with value: 0.041352234114488774 and parameters: {'model_type': 'mlp', 'hidden_dims': '[512, 128]', 'dropout': 0.5260725665766596, 'batch_norm': False, 'lr': 2.0659279771879464e-05, 'weight_decay': 7.063793708564561e-06, 'epochs': 285, 'loss': 'mae', 'optimizer': 'adam', 'graph_mode': 'off', 'use_snp_selection': False}. Best is trial 39 with value: 0.06766369665432428.
[I 2025-12-05 16:19:30,526] Trial 111 finished with value: 0.06019872607987837 and parameters: {'model_type': 'mlp', 'hidden_dims': '[512, 128]', 'dropout': 0.4743874836239988, 'batch_norm': False, 'lr': 1.287879172505288e-05, 'weight_decay': 5.025181799946187e-06, 'epochs': 273, 'loss': 'mae', 'optimizer': 'adam', 'graph_mode': 'off', 'use_snp_selection': False}. Best is trial 39 with value: 0.06766369665432428.
[I 2025-12-05 16:19:32,448] Trial 112 finished with value: 0.023379426865009528 and parameters: {'model_type': 'mlp', 'hidden_dims': '[512, 128]', 'dropout': 0.4344522099402075, 'batch_norm': False, 'lr': 1.0980240346205594e-05, 'weight_decay': 3.839876981906114e-06, 'epochs': 274, 'loss': 'mae', 'optimizer': 'adam', 'graph_mode': 'off', 'use_snp_selection': False}. Best is trial 39 with value: 0.06766369665432428.
[I 2025-12-05 16:19:34,392] Trial 113 finished with value: 0.054706336688693624 and parameters: {'model_type': 'mlp', 'hidden_dims': '[512, 128]', 'dropout': 0.4530058379614724, 'batch_norm': False, 'lr': 9.124927390342598e-06, 'weight_decay': 1.574970697095721e-05, 'epochs': 279, 'loss': 'mae', 'optimizer': 'adam', 'graph_mode': 'off', 'use_snp_selection': False}. Best is trial 39 with value: 0.06766369665432428.
[I 2025-12-05 16:19:36,337] Trial 114 finished with value: 0.06332798129370214 and parameters: {'model_type': 'mlp', 'hidden_dims': '[512, 128]', 'dropout': 0.4484189113401381, 'batch_norm': False, 'lr': 8.459877992657293e-06, 'weight_decay': 1.6285315696225327e-05, 'epochs': 279, 'loss': 'mae', 'optimizer': 'adam', 'graph_mode': 'off', 'use_snp_selection': False}. Best is trial 39 with value: 0.06766369665432428.
[I 2025-12-05 16:19:38,273] Trial 115 finished with value: 0.019230374431084624 and parameters: {'model_type': 'mlp', 'hidden_dims': '[512, 128]', 'dropout': 0.4517646509582798, 'batch_norm': False, 'lr': 1.313945302093928e-05, 'weight_decay': 1.915411229175787e-05, 'epochs': 277, 'loss': 'mae', 'optimizer': 'adam', 'graph_mode': 'off', 'use_snp_selection': False}. Best is trial 39 with value: 0.06766369665432428.
[I 2025-12-05 16:19:40,160] Trial 116 finished with value: 0.036982853811770106 and parameters: {'model_type': 'mlp', 'hidden_dims': '[512, 128]', 'dropout': 0.4202240729837843, 'batch_norm': False, 'lr': 8.566627378444294e-06, 'weight_decay': 3.6207461454800194e-05, 'epochs': 257, 'loss': 'mae', 'optimizer': 'adam', 'graph_mode': 'off', 'use_snp_selection': False}. Best is trial 39 with value: 0.06766369665432428.
[I 2025-12-05 16:19:41,436] Trial 117 finished with value: 0.015357532286941854 and parameters: {'model_type': 'mlp', 'hidden_dims': '[512, 128]', 'dropout': 0.49314363973005115, 'batch_norm': False, 'lr': 5.851699731310997e-06, 'weight_decay': 2.498569069603539e-05, 'epochs': 125, 'loss': 'mae', 'optimizer': 'adam', 'graph_mode': 'off', 'use_snp_selection': False}. Best is trial 39 with value: 0.06766369665432428.
[I 2025-12-05 16:19:43,328] Trial 118 finished with value: 0.03854065745426164 and parameters: {'model_type': 'mlp', 'hidden_dims': '[512, 128]', 'dropout': 0.46474085642914525, 'batch_norm': False, 'lr': 5.710353070866013e-06, 'weight_decay': 3.1879053215611192e-06, 'epochs': 265, 'loss': 'mae', 'optimizer': 'adam', 'graph_mode': 'off', 'use_snp_selection': False}. Best is trial 39 with value: 0.06766369665432428.
[I 2025-12-05 16:19:44,556] Trial 119 finished with value: 0.029494864384917455 and parameters: {'model_type': 'mlp', 'hidden_dims': '[512, 128]', 'dropout': 0.4412174768196113, 'batch_norm': False, 'lr': 1.3829517628849625e-05, 'weight_decay': 1.6120507097567657e-05, 'epochs': 114, 'loss': 'mae', 'optimizer': 'adam', 'graph_mode': 'off', 'use_snp_selection': False}. Best is trial 39 with value: 0.06766369665432428.
[I 2025-12-05 16:19:46,553] Trial 120 finished with value: 0.017909096677625955 and parameters: {'model_type': 'mlp', 'hidden_dims': '[512, 128]', 'dropout': 0.4780385214942387, 'batch_norm': False, 'lr': 8.776229737418834e-06, 'weight_decay': 0.00026369986787824025, 'epochs': 291, 'loss': 'mae', 'optimizer': 'adam', 'graph_mode': 'off', 'use_snp_selection': False}. Best is trial 39 with value: 0.06766369665432428.
[I 2025-12-05 16:19:48,373] Trial 121 finished with value: 0.022401832230751942 and parameters: {'model_type': 'mlp', 'hidden_dims': '[512, 128]', 'dropout': 0.45608829642545995, 'batch_norm': True, 'lr': 4.830775057647844e-06, 'weight_decay': 8.763313282373028e-06, 'epochs': 247, 'loss': 'mae', 'optimizer': 'adam', 'graph_mode': 'off', 'use_snp_selection': False}. Best is trial 39 with value: 0.06766369665432428.
[I 2025-12-05 16:19:50,274] Trial 122 finished with value: 0.027539982883542313 and parameters: {'model_type': 'mlp', 'hidden_dims': '[512, 128]', 'dropout': 0.44461393336201227, 'batch_norm': False, 'lr': 7.461552455978088e-06, 'weight_decay': 1.4582440207841178e-05, 'epochs': 269, 'loss': 'mae', 'optimizer': 'adam', 'graph_mode': 'off', 'use_snp_selection': False}. Best is trial 39 with value: 0.06766369665432428.
[I 2025-12-05 16:19:51,594] Trial 123 finished with value: 0.018651697874098642 and parameters: {'model_type': 'mlp', 'hidden_dims': '[256, 128]', 'dropout': 0.42606432434697544, 'batch_norm': False, 'lr': 7.049595603973174e-06, 'weight_decay': 1.0456615573663189e-05, 'epochs': 277, 'loss': 'mae', 'optimizer': 'adam', 'graph_mode': 'off', 'use_snp_selection': False}. Best is trial 39 with value: 0.06766369665432428.
[I 2025-12-05 16:19:53,490] Trial 124 finished with value: 0.04429907013685236 and parameters: {'model_type': 'mlp', 'hidden_dims': '[512, 128]', 'dropout': 0.40853734169984357, 'batch_norm': True, 'lr': 1.4504751778719533e-05, 'weight_decay': 5.409136637553425e-06, 'epochs': 258, 'loss': 'mae', 'optimizer': 'adam', 'graph_mode': 'off', 'use_snp_selection': False}. Best is trial 39 with value: 0.06766369665432428.
[I 2025-12-05 16:19:55,085] Trial 125 finished with value: 0.05146931985251641 and parameters: {'model_type': 'mlp', 'hidden_dims': '[512, 128]', 'dropout': 0.5094633799451723, 'batch_norm': False, 'lr': 8.399988255946788e-06, 'weight_decay': 1.9275110050928956e-05, 'epochs': 132, 'loss': 'mae', 'optimizer': 'adam', 'graph_mode': 'off', 'use_snp_selection': True, 'num_snps': 27002}. Best is trial 39 with value: 0.06766369665432428.
