[I 2025-12-05 15:57:16,644] Trial 1 finished with value: 0.07017873866675622 and parameters: {'model_type': 'mlp', 'hidden_dims': '[256, 128]', 'dropout': 0.4370668075331726, 'batch_norm': True, 'lr': 7.133471581159139e-05, 'weight_decay': 1.128633586803549e-05, 'epochs': 242, 'loss': 'mae', 'optimizer': 'adam', 'graph_mode': 'off', 'use_snp_selection': False}. Best is trial 1 with value: 0.07017873866675622.
[I 2025-12-05 15:57:17,752] Trial 2 finished with value: 0.06373311564503503 and parameters: {'model_type': 'mlp', 'hidden_dims': '[256, 128, 64]', 'dropout': 0.41314357415569625, 'batch_norm': False, 'lr': 3.952233718592101e-06, 'weight_decay': 0.00026754769258252603, 'epochs': 149, 'loss': 'mse', 'optimizer': 'adam', 'graph_mode': 'off', 'use_snp_selection': True, 'num_snps': 11571}. Best is trial 1 with value: 0.07017873866675622.
[I 2025-12-05 15:57:19,730] Trial 3 finished with value: 0.07167910749037568 and parameters: {'model_type': 'mlp', 'hidden_dims': '[512, 64]', 'dropout': 0.5938127374509361, 'batch_norm': False, 'lr': 5.67704586114731e-06, 'weight_decay': 2.4518087630137052e-05, 'epochs': 320, 'loss': 'mae', 'optimizer': 'adam', 'graph_mode': 'off', 'use_snp_selection': False}. Best is trial 3 with value: 0.07167910749037568.
[I 2025-12-05 15:57:22,060] Trial 4 finished with value: 0.016730101304335845 and parameters: {'model_type': 'mlp', 'hidden_dims': '[512, 128]', 'dropout': 0.25746343592134413, 'batch_norm': True, 'lr': 1.3467657668402788e-06, 'weight_decay': 0.00033087251918647806, 'epochs': 277, 'loss': 'mse', 'optimizer': 'adam', 'graph_mode': 'off', 'use_snp_selection': True, 'num_snps': 36675}. Best is trial 3 with value: 0.07167910749037568.
[I 2025-12-05 15:57:23,874] Trial 5 finished with value: -0.03985249942710447 and parameters: {'model_type': 'mlp', 'hidden_dims': '[512, 64]', 'dropout': 0.38275350994408375, 'batch_norm': True, 'lr': 1.5586664309232824e-06, 'weight_decay': 0.0008227664668621182, 'epochs': 145, 'loss': 'mae', 'optimizer': 'adam', 'graph_mode': 'off', 'use_snp_selection': True, 'num_snps': 32148}. Best is trial 3 with value: 0.07167910749037568.
[I 2025-12-05 15:57:24,909] Trial 6 finished with value: 0.06529375442823687 and parameters: {'model_type': 'mlp', 'hidden_dims': '[256, 128]', 'dropout': 0.3930109900265879, 'batch_norm': False, 'lr': 4.892964372128395e-05, 'weight_decay': 1.5809549317992182e-06, 'epochs': 199, 'loss': 'mse', 'optimizer': 'adam', 'graph_mode': 'off', 'use_snp_selection': False}. Best is trial 3 with value: 0.07167910749037568.
[I 2025-12-05 15:57:26,039] Trial 7 finished with value: 0.0675888586893228 and parameters: {'model_type': 'mlp', 'hidden_dims': '[512, 256]', 'dropout': 0.15343979219678458, 'batch_norm': True, 'lr': 6.234003099047341e-05, 'weight_decay': 3.894760610535477e-07, 'epochs': 97, 'loss': 'mse', 'optimizer': 'adam', 'graph_mode': 'off', 'use_snp_selection': False}. Best is trial 3 with value: 0.07167910749037568.
[I 2025-12-05 15:57:27,971] Trial 8 finished with value: 0.11176370039013242 and parameters: {'model_type': 'mlp', 'hidden_dims': '[512, 128]', 'dropout': 0.10743001231661406, 'batch_norm': True, 'lr': 0.00023728538449271062, 'weight_decay': 1.7629071578048637e-05, 'epochs': 312, 'loss': 'mae', 'optimizer': 'adam', 'graph_mode': 'off', 'use_snp_selection': False}. Best is trial 8 with value: 0.11176370039013242.
[I 2025-12-05 15:57:29,383] Trial 9 finished with value: 0.060952640539024744 and parameters: {'model_type': 'mlp', 'hidden_dims': '[512, 64]', 'dropout': 0.14505336736221927, 'batch_norm': True, 'lr': 5.8619638388111826e-05, 'weight_decay': 6.200156172669308e-07, 'epochs': 175, 'loss': 'mse', 'optimizer': 'adam', 'graph_mode': 'off', 'use_snp_selection': False}. Best is trial 8 with value: 0.11176370039013242.
[I 2025-12-05 15:57:30,317] Trial 10 finished with value: 0.033811770648795605 and parameters: {'model_type': 'mlp', 'hidden_dims': '[512, 128]', 'dropout': 0.2800030442581858, 'batch_norm': False, 'lr': 0.0004919806695968258, 'weight_decay': 2.9953888095455486e-06, 'epochs': 55, 'loss': 'mae', 'optimizer': 'adam', 'graph_mode': 'off', 'use_snp_selection': False}. Best is trial 8 with value: 0.11176370039013242.
[I 2025-12-05 15:57:32,367] Trial 11 finished with value: 0.06201442207936519 and parameters: {'model_type': 'mlp', 'hidden_dims': '[512, 128]', 'dropout': 0.583942291816117, 'batch_norm': False, 'lr': 1.3250324970868088e-05, 'weight_decay': 2.11387030344014e-05, 'epochs': 346, 'loss': 'mae', 'optimizer': 'adam', 'graph_mode': 'off', 'use_snp_selection': False}. Best is trial 8 with value: 0.11176370039013242.
[I 2025-12-05 15:57:34,257] Trial 12 finished with value: 0.06002746442284806 and parameters: {'model_type': 'mlp', 'hidden_dims': '[512, 64]', 'dropout': 0.5873431926823272, 'batch_norm': False, 'lr': 0.0004844928893200377, 'weight_decay': 6.23587291883057e-05, 'epochs': 294, 'loss': 'mae', 'optimizer': 'adam', 'graph_mode': 'off', 'use_snp_selection': False}. Best is trial 8 with value: 0.11176370039013242.
[I 2025-12-05 15:57:35,127] Trial 13 finished with value: 0.05406550801543968 and parameters: {'model_type': 'mlp', 'hidden_dims': '[128, 64]', 'dropout': 0.5255276925359322, 'batch_norm': False, 'lr': 1.139383629587953e-05, 'weight_decay': 2.875929917712265e-06, 'epochs': 285, 'loss': 'mae', 'optimizer': 'adam', 'graph_mode': 'off', 'use_snp_selection': False}. Best is trial 8 with value: 0.11176370039013242.
[I 2025-12-05 15:57:36,246] Trial 14 finished with value: 0.08294235279804667 and parameters: {'model_type': 'mlp', 'hidden_dims': '[256, 128, 64]', 'dropout': 0.4853142563074505, 'batch_norm': True, 'lr': 0.0002108574938852793, 'weight_decay': 1.1414924884997386e-07, 'epochs': 237, 'loss': 'mae', 'optimizer': 'adam', 'graph_mode': 'off', 'use_snp_selection': False}. Best is trial 8 with value: 0.11176370039013242.
[I 2025-12-05 15:57:37,350] Trial 15 finished with value: 0.0856326237222351 and parameters: {'model_type': 'mlp', 'hidden_dims': '[256, 128, 64]', 'dropout': 0.48263162073930665, 'batch_norm': True, 'lr': 0.00018728330685798084, 'weight_decay': 1.2323424272263762e-07, 'epochs': 231, 'loss': 'mae', 'optimizer': 'adam', 'graph_mode': 'off', 'use_snp_selection': False}. Best is trial 8 with value: 0.11176370039013242.
[I 2025-12-05 15:57:38,514] Trial 16 finished with value: 0.08024225714522631 and parameters: {'model_type': 'mlp', 'hidden_dims': '[256, 128, 64]', 'dropout': 0.3128503411094534, 'batch_norm': True, 'lr': 0.00017853610340821838, 'weight_decay': 1.3069063478385084e-07, 'epochs': 233, 'loss': 'mae', 'optimizer': 'adam', 'graph_mode': 'off', 'use_snp_selection': False}. Best is trial 8 with value: 0.11176370039013242.
[I 2025-12-05 15:57:40,093] Trial 17 finished with value: 0.09581746164328304 and parameters: {'model_type': 'mlp', 'hidden_dims': '[512, 256]', 'dropout': 0.10230308008198463, 'batch_norm': True, 'lr': 0.000906375209920231, 'weight_decay': 4.987370804229425e-06, 'epochs': 202, 'loss': 'mae', 'optimizer': 'adam', 'graph_mode': 'off', 'use_snp_selection': False}. Best is trial 8 with value: 0.11176370039013242.
[I 2025-12-05 15:57:42,806] Trial 18 finished with value: 0.08614237522508722 and parameters: {'model_type': 'mlp', 'hidden_dims': '[512, 256]', 'dropout': 0.10884892417738423, 'batch_norm': True, 'lr': 0.0009897362511876527, 'weight_decay': 5.409591144113358e-06, 'epochs': 109, 'loss': 'mae', 'optimizer': 'adam', 'graph_mode': 'off', 'use_snp_selection': True, 'num_snps': 58241}. Best is trial 8 with value: 0.11176370039013242.
[I 2025-12-05 15:57:44,378] Trial 19 finished with value: 0.10295032216648539 and parameters: {'model_type': 'mlp', 'hidden_dims': '[512, 256]', 'dropout': 0.2149040071457289, 'batch_norm': True, 'lr': 0.0008651287964196489, 'weight_decay': 7.870963196891377e-05, 'epochs': 208, 'loss': 'mae', 'optimizer': 'adam', 'graph_mode': 'off', 'use_snp_selection': False}. Best is trial 8 with value: 0.11176370039013242.
[I 2025-12-05 15:57:46,293] Trial 20 finished with value: 0.10602623360058366 and parameters: {'model_type': 'mlp', 'hidden_dims': '[512, 128]', 'dropout': 0.2110298254093279, 'batch_norm': True, 'lr': 0.0003516836857329344, 'weight_decay': 0.0001247981980720522, 'epochs': 307, 'loss': 'mae', 'optimizer': 'adam', 'graph_mode': 'off', 'use_snp_selection': False}. Best is trial 8 with value: 0.11176370039013242.
[I 2025-12-05 15:57:48,240] Trial 21 finished with value: 0.08838254182808794 and parameters: {'model_type': 'mlp', 'hidden_dims': '[512, 128]', 'dropout': 0.20661009488766746, 'batch_norm': True, 'lr': 0.0003601699385541026, 'weight_decay': 0.00010789740432432072, 'epochs': 316, 'loss': 'mae', 'optimizer': 'adam', 'graph_mode': 'off', 'use_snp_selection': False}. Best is trial 8 with value: 0.11176370039013242.
[I 2025-12-05 15:57:49,990] Trial 22 finished with value: 0.0995063700421383 and parameters: {'model_type': 'mlp', 'hidden_dims': '[512, 128]', 'dropout': 0.21531462419382422, 'batch_norm': True, 'lr': 0.00012686947685088993, 'weight_decay': 0.0001263395291409032, 'epochs': 263, 'loss': 'mae', 'optimizer': 'adam', 'graph_mode': 'off', 'use_snp_selection': False}. Best is trial 8 with value: 0.11176370039013242.
[I 2025-12-05 15:57:51,998] Trial 23 finished with value: 0.1064945856639763 and parameters: {'model_type': 'mlp', 'hidden_dims': '[512, 256]', 'dropout': 0.16629854581151118, 'batch_norm': True, 'lr': 0.00033440919282800376, 'weight_decay': 2.708614598307402e-05, 'epochs': 317, 'loss': 'mae', 'optimizer': 'adam', 'graph_mode': 'off', 'use_snp_selection': False}. Best is trial 8 with value: 0.11176370039013242.
[I 2025-12-05 15:57:53,942] Trial 24 finished with value: 0.08625619617067928 and parameters: {'model_type': 'mlp', 'hidden_dims': '[512, 128]', 'dropout': 0.1573917359537377, 'batch_norm': True, 'lr': 0.000315756729626158, 'weight_decay': 2.847846277150369e-05, 'epochs': 303, 'loss': 'mae', 'optimizer': 'adam', 'graph_mode': 'off', 'use_snp_selection': False}. Best is trial 8 with value: 0.11176370039013242.
[I 2025-12-05 15:57:56,042] Trial 25 finished with value: 0.07989442808126389 and parameters: {'model_type': 'mlp', 'hidden_dims': '[512, 128]', 'dropout': 0.26907181078135045, 'batch_norm': True, 'lr': 0.0001134889437129769, 'weight_decay': 1.1830734427782562e-05, 'epochs': 347, 'loss': 'mae', 'optimizer': 'adam', 'graph_mode': 'off', 'use_snp_selection': False}. Best is trial 8 with value: 0.11176370039013242.
[I 2025-12-05 15:57:57,058] Trial 26 finished with value: 0.05526092122159798 and parameters: {'model_type': 'mlp', 'hidden_dims': '[512, 256]', 'dropout': 0.32280124400713955, 'batch_norm': True, 'lr': 3.3575571782287665e-05, 'weight_decay': 0.00022123062859658268, 'epochs': 260, 'loss': 'mae', 'optimizer': 'adam', 'graph_mode': 'off', 'use_snp_selection': True, 'num_snps': 3842}. Best is trial 8 with value: 0.11176370039013242.
[I 2025-12-05 15:57:59,083] Trial 27 finished with value: 0.10231045630605358 and parameters: {'model_type': 'mlp', 'hidden_dims': '[512, 128]', 'dropout': 0.1663464079810561, 'batch_norm': True, 'lr': 0.000558874342140533, 'weight_decay': 3.7728781986273995e-05, 'epochs': 322, 'loss': 'mse', 'optimizer': 'adam', 'graph_mode': 'off', 'use_snp_selection': False}. Best is trial 8 with value: 0.11176370039013242.
[I 2025-12-05 15:58:00,111] Trial 28 finished with value: 0.0946077815672668 and parameters: {'model_type': 'mlp', 'hidden_dims': '[128, 64]', 'dropout': 0.12613884170513187, 'batch_norm': True, 'lr': 0.000272418170203813, 'weight_decay': 0.0007192001914198804, 'epochs': 303, 'loss': 'mae', 'optimizer': 'adam', 'graph_mode': 'off', 'use_snp_selection': False}. Best is trial 8 with value: 0.11176370039013242.
[I 2025-12-05 15:58:01,657] Trial 29 finished with value: 0.07717660641819961 and parameters: {'model_type': 'mlp', 'hidden_dims': '[256, 128]', 'dropout': 0.18871559173138464, 'batch_norm': True, 'lr': 0.00011176149717096834, 'weight_decay': 1.6427297318476053e-05, 'epochs': 328, 'loss': 'mae', 'optimizer': 'adam', 'graph_mode': 'off', 'use_snp_selection': True, 'num_snps': 19468}. Best is trial 8 with value: 0.11176370039013242.
[I 2025-12-05 15:58:02,648] Trial 30 finished with value: 0.08854030975816246 and parameters: {'model_type': 'mlp', 'hidden_dims': '[128, 64]', 'dropout': 0.23330261630579277, 'batch_norm': True, 'lr': 2.4319973815038606e-05, 'weight_decay': 4.379275899035174e-05, 'epochs': 267, 'loss': 'mae', 'optimizer': 'adam', 'graph_mode': 'off', 'use_snp_selection': False}. Best is trial 8 with value: 0.11176370039013242.
[I 2025-12-05 15:58:04,788] Trial 31 finished with value: 0.10136857780699726 and parameters: {'model_type': 'mlp', 'hidden_dims': '[512, 256]', 'dropout': 0.19029764586440082, 'batch_norm': True, 'lr': 0.0006390668619708711, 'weight_decay': 7.80341734960282e-05, 'epochs': 350, 'loss': 'mae', 'optimizer': 'adam', 'graph_mode': 'off', 'use_snp_selection': False}. Best is trial 8 with value: 0.11176370039013242.
[I 2025-12-05 15:58:06,396] Trial 32 finished with value: 0.1090205144328458 and parameters: {'model_type': 'mlp', 'hidden_dims': '[512, 256]', 'dropout': 0.2406365123097409, 'batch_norm': True, 'lr': 0.00039729732260386253, 'weight_decay': 0.0001487046164338939, 'epochs': 219, 'loss': 'mae', 'optimizer': 'adam', 'graph_mode': 'off', 'use_snp_selection': False}. Best is trial 8 with value: 0.11176370039013242.
[I 2025-12-05 15:58:08,152] Trial 33 finished with value: 0.101904453182379 and parameters: {'model_type': 'mlp', 'hidden_dims': '[512, 256]', 'dropout': 0.2452887540407266, 'batch_norm': True, 'lr': 0.00038427000496767013, 'weight_decay': 0.00020619522023523944, 'epochs': 255, 'loss': 'mae', 'optimizer': 'adam', 'graph_mode': 'off', 'use_snp_selection': False}. Best is trial 8 with value: 0.11176370039013242.
[I 2025-12-05 15:58:10,045] Trial 34 finished with value: 0.11728138395587136 and parameters: {'model_type': 'mlp', 'hidden_dims': '[512, 256]', 'dropout': 0.1790305037799047, 'batch_norm': True, 'lr': 0.0002465237061633034, 'weight_decay': 0.000523339875991667, 'epochs': 300, 'loss': 'mae', 'optimizer': 'adam', 'graph_mode': 'off', 'use_snp_selection': False}. Best is trial 34 with value: 0.11728138395587136.
[I 2025-12-05 15:58:11,442] Trial 35 finished with value: 0.11315499577415583 and parameters: {'model_type': 'mlp', 'hidden_dims': '[512, 256]', 'dropout': 0.13036455703525734, 'batch_norm': True, 'lr': 0.00013630547647543504, 'weight_decay': 0.0005010676776921072, 'epochs': 174, 'loss': 'mae', 'optimizer': 'adam', 'graph_mode': 'off', 'use_snp_selection': False}. Best is trial 34 with value: 0.11728138395587136.
[I 2025-12-05 15:58:14,462] Trial 36 finished with value: 0.08706444525290002 and parameters: {'model_type': 'mlp', 'hidden_dims': '[512, 256]', 'dropout': 0.12408209063420159, 'batch_norm': True, 'lr': 0.00013456233156433, 'weight_decay': 0.000495810171737856, 'epochs': 186, 'loss': 'mse', 'optimizer': 'adam', 'graph_mode': 'off', 'use_snp_selection': True, 'num_snps': 58661}. Best is trial 34 with value: 0.11728138395587136.
[I 2025-12-05 15:58:15,865] Trial 37 finished with value: 0.10058281845807468 and parameters: {'model_type': 'mlp', 'hidden_dims': '[512, 256]', 'dropout': 0.12983742531341913, 'batch_norm': True, 'lr': 0.00023894786781718228, 'weight_decay': 0.0003488231770851837, 'epochs': 160, 'loss': 'mae', 'optimizer': 'adam', 'graph_mode': 'off', 'use_snp_selection': False}. Best is trial 34 with value: 0.11728138395587136.
[I 2025-12-05 15:58:17,229] Trial 38 finished with value: 0.06964806798900597 and parameters: {'model_type': 'mlp', 'hidden_dims': '[256, 128]', 'dropout': 0.18320443755927326, 'batch_norm': False, 'lr': 7.347986683807752e-05, 'weight_decay': 0.000981569464424033, 'epochs': 129, 'loss': 'mse', 'optimizer': 'adam', 'graph_mode': 'off', 'use_snp_selection': True, 'num_snps': 19911}. Best is trial 34 with value: 0.11728138395587136.
[I 2025-12-05 15:58:18,837] Trial 39 finished with value: 0.08196975210900093 and parameters: {'model_type': 'mlp', 'hidden_dims': '[512, 256]', 'dropout': 0.29500127100883317, 'batch_norm': True, 'lr': 8.169108484144613e-05, 'weight_decay': 0.000494866061743946, 'epochs': 212, 'loss': 'mae', 'optimizer': 'adam', 'graph_mode': 'off', 'use_snp_selection': False}. Best is trial 34 with value: 0.11728138395587136.
[I 2025-12-05 15:58:20,252] Trial 40 finished with value: 0.08291627288279893 and parameters: {'model_type': 'mlp', 'hidden_dims': '[512, 256]', 'dropout': 0.1382852594401136, 'batch_norm': True, 'lr': 4.079874705489515e-05, 'weight_decay': 0.00017660759745604288, 'epochs': 166, 'loss': 'mse', 'optimizer': 'adam', 'graph_mode': 'off', 'use_snp_selection': False}. Best is trial 34 with value: 0.11728138395587136.
[I 2025-12-05 15:58:22,106] Trial 41 finished with value: 0.058852837959255604 and parameters: {'model_type': 'mlp', 'hidden_dims': '[512, 256]', 'dropout': 0.16394378936064408, 'batch_norm': True, 'lr': 2.320370617557869e-06, 'weight_decay': 0.00038945229604378794, 'epochs': 282, 'loss': 'mae', 'optimizer': 'adam', 'graph_mode': 'off', 'use_snp_selection': False}. Best is trial 34 with value: 0.11728138395587136.
[I 2025-12-05 15:58:24,120] Trial 42 finished with value: 0.1060983551235556 and parameters: {'model_type': 'mlp', 'hidden_dims': '[512, 256]', 'dropout': 0.10489899917432062, 'batch_norm': True, 'lr': 0.00016891997991974584, 'weight_decay': 0.0006409365900958927, 'epochs': 331, 'loss': 'mae', 'optimizer': 'adam', 'graph_mode': 'off', 'use_snp_selection': False}. Best is trial 34 with value: 0.11728138395587136.
[I 2025-12-05 15:58:25,417] Trial 43 finished with value: 0.10608915014874998 and parameters: {'model_type': 'mlp', 'hidden_dims': '[512, 256]', 'dropout': 0.3473491345871079, 'batch_norm': True, 'lr': 0.0006535725641721415, 'weight_decay': 0.00025939625273309363, 'epochs': 135, 'loss': 'mae', 'optimizer': 'adam', 'graph_mode': 'off', 'use_snp_selection': False}. Best is trial 34 with value: 0.11728138395587136.
[I 2025-12-05 15:58:26,445] Trial 44 finished with value: 0.0232258331455868 and parameters: {'model_type': 'mlp', 'hidden_dims': '[512, 64]', 'dropout': 0.1727765543000827, 'batch_norm': False, 'lr': 0.00027783330163765285, 'weight_decay': 8.796476660844718e-06, 'epochs': 67, 'loss': 'mae', 'optimizer': 'adam', 'graph_mode': 'off', 'use_snp_selection': False}. Best is trial 34 with value: 0.11728138395587136.
[I 2025-12-05 15:58:28,081] Trial 45 finished with value: 0.0926961779980146 and parameters: {'model_type': 'mlp', 'hidden_dims': '[512, 256]', 'dropout': 0.24186541993440108, 'batch_norm': True, 'lr': 9.782232999244217e-05, 'weight_decay': 5.053600989078584e-05, 'epochs': 221, 'loss': 'mae', 'optimizer': 'adam', 'graph_mode': 'off', 'use_snp_selection': False}. Best is trial 34 with value: 0.11728138395587136.
[I 2025-12-05 15:58:29,112] Trial 46 finished with value: 0.10284542595099916 and parameters: {'model_type': 'mlp', 'hidden_dims': '[256, 128]', 'dropout': 0.14962747455628747, 'batch_norm': True, 'lr': 0.000400627441700949, 'weight_decay': 2.982392773797359e-05, 'epochs': 191, 'loss': 'mae', 'optimizer': 'adam', 'graph_mode': 'off', 'use_snp_selection': False}. Best is trial 34 with value: 0.11728138395587136.
[I 2025-12-05 15:58:30,825] Trial 47 finished with value: 0.09231942282806324 and parameters: {'model_type': 'mlp', 'hidden_dims': '[512, 256]', 'dropout': 0.14406222291414117, 'batch_norm': False, 'lr': 0.000160767208173323, 'weight_decay': 1.799542225466396e-05, 'epochs': 250, 'loss': 'mae', 'optimizer': 'adam', 'graph_mode': 'off', 'use_snp_selection': False}. Best is trial 34 with value: 0.11728138395587136.
[I 2025-12-05 15:58:32,035] Trial 48 finished with value: 0.08808333435650029 and parameters: {'model_type': 'mlp', 'hidden_dims': '[256, 128, 64]', 'dropout': 0.23291514661115287, 'batch_norm': True, 'lr': 0.00022798578467103035, 'weight_decay': 1.0201310005877701e-06, 'epochs': 278, 'loss': 'mae', 'optimizer': 'adam', 'graph_mode': 'off', 'use_snp_selection': False}. Best is trial 34 with value: 0.11728138395587136.
[I 2025-12-05 15:58:34,696] Trial 49 finished with value: 0.08838270689448077 and parameters: {'model_type': 'mlp', 'hidden_dims': '[512, 64]', 'dropout': 0.12273063838101722, 'batch_norm': True, 'lr': 0.000501083416923212, 'weight_decay': 0.00014374557715460915, 'epochs': 287, 'loss': 'mse', 'optimizer': 'adam', 'graph_mode': 'off', 'use_snp_selection': True, 'num_snps': 46888}. Best is trial 34 with value: 0.11728138395587136.
[I 2025-12-05 15:58:35,556] Trial 50 finished with value: 0.08873429602997975 and parameters: {'model_type': 'mlp', 'hidden_dims': '[128, 64]', 'dropout': 0.1935417597662704, 'batch_norm': True, 'lr': 2.0024062321654754e-05, 'weight_decay': 9.582919220019364e-06, 'epochs': 176, 'loss': 'mae', 'optimizer': 'adam', 'graph_mode': 'off', 'use_snp_selection': False}. Best is trial 34 with value: 0.11728138395587136.
[I 2025-12-05 15:58:37,638] Trial 51 finished with value: 0.09094407246252947 and parameters: {'model_type': 'mlp', 'hidden_dims': '[512, 256]', 'dropout': 0.11724546078317466, 'batch_norm': True, 'lr': 0.00017170082975889695, 'weight_decay': 0.0007082069145392281, 'epochs': 329, 'loss': 'mae', 'optimizer': 'adam', 'graph_mode': 'off', 'use_snp_selection': False}. Best is trial 34 with value: 0.11728138395587136.
[I 2025-12-05 15:58:39,751] Trial 52 finished with value: 0.09123162176934382 and parameters: {'model_type': 'mlp', 'hidden_dims': '[512, 256]', 'dropout': 0.10890006780361305, 'batch_norm': True, 'lr': 0.00024065851829388978, 'weight_decay': 0.0004977406255501337, 'epochs': 338, 'loss': 'mae', 'optimizer': 'adam', 'graph_mode': 'off', 'use_snp_selection': False}. Best is trial 34 with value: 0.11728138395587136.
