[I 2025-12-05 16:12:05,306] Trial 57 finished with value: 0.13901385111359846 and parameters: {'model_type': 'mlp', 'hidden_dims': '[256, 128]', 'dropout': 0.24497923614596231, 'batch_norm': False, 'lr': 0.00043133481604813837, 'weight_decay': 4.1694260909179086e-05, 'epochs': 333, 'loss': 'mae', 'optimizer': 'adam', 'graph_mode': 'off', 'use_snp_selection': True, 'num_snps': 27690}. Best is trial 31 with value: 0.15668429220257676.
[I 2025-12-05 16:12:06,548] Trial 58 finished with value: 0.11877321557560624 and parameters: {'model_type': 'mlp', 'hidden_dims': '[256, 128]', 'dropout': 0.17857152282941777, 'batch_norm': False, 'lr': 5.426862112119999e-05, 'weight_decay': 8.068866222968153e-05, 'epochs': 271, 'loss': 'mae', 'optimizer': 'adam', 'graph_mode': 'off', 'use_snp_selection': True, 'num_snps': 11700}. Best is trial 31 with value: 0.15668429220257676.
[I 2025-12-05 16:12:07,911] Trial 59 finished with value: 0.1298606507286059 and parameters: {'model_type': 'mlp', 'hidden_dims': '[256, 128]', 'dropout': 0.1024113047042409, 'batch_norm': False, 'lr': 1.037929960904721e-05, 'weight_decay': 0.0001535241911710377, 'epochs': 250, 'loss': 'mae', 'optimizer': 'adam', 'graph_mode': 'off', 'use_snp_selection': True, 'num_snps': 15533}. Best is trial 31 with value: 0.15668429220257676.
[I 2025-12-05 16:12:09,138] Trial 60 finished with value: 0.12340553193351364 and parameters: {'model_type': 'mlp', 'hidden_dims': '[128, 64]', 'dropout': 0.40403039279260355, 'batch_norm': True, 'lr': 0.00033343038721345657, 'weight_decay': 1.433592634002329e-05, 'epochs': 286, 'loss': 'mae', 'optimizer': 'adam', 'graph_mode': 'off', 'use_snp_selection': True, 'num_snps': 7378}. Best is trial 31 with value: 0.15668429220257676.
[I 2025-12-05 16:12:10,598] Trial 61 finished with value: 0.15335701343128363 and parameters: {'model_type': 'mlp', 'hidden_dims': '[256, 128]', 'dropout': 0.15791733647548875, 'batch_norm': False, 'lr': 0.00019139377299204544, 'weight_decay': 0.00025615255175080146, 'epochs': 322, 'loss': 'mae', 'optimizer': 'adam', 'graph_mode': 'off', 'use_snp_selection': True, 'num_snps': 17159}. Best is trial 31 with value: 0.15668429220257676.
[I 2025-12-05 16:12:12,071] Trial 62 finished with value: 0.15725047618264015 and parameters: {'model_type': 'mlp', 'hidden_dims': '[256, 128]', 'dropout': 0.15554890031692914, 'batch_norm': False, 'lr': 0.00014976387247495773, 'weight_decay': 0.00024906477239253775, 'epochs': 318, 'loss': 'mae', 'optimizer': 'adam', 'graph_mode': 'off', 'use_snp_selection': True, 'num_snps': 18083}. Best is trial 62 with value: 0.15725047618264015.
[I 2025-12-05 16:12:13,397] Trial 63 finished with value: 0.1280123967369075 and parameters: {'model_type': 'mlp', 'hidden_dims': '[256, 128]', 'dropout': 0.14919881798571494, 'batch_norm': False, 'lr': 0.0001280029242236512, 'weight_decay': 0.0002642687521841706, 'epochs': 303, 'loss': 'mae', 'optimizer': 'adam', 'graph_mode': 'off', 'use_snp_selection': True, 'num_snps': 13409}. Best is trial 62 with value: 0.15725047618264015.
[I 2025-12-05 16:12:14,791] Trial 64 finished with value: 0.1386889946207045 and parameters: {'model_type': 'mlp', 'hidden_dims': '[256, 128]', 'dropout': 0.1706022404305999, 'batch_norm': False, 'lr': 0.00017574008277675203, 'weight_decay': 0.0006746888694292129, 'epochs': 233, 'loss': 'mae', 'optimizer': 'adam', 'graph_mode': 'off', 'use_snp_selection': True, 'num_snps': 18549}. Best is trial 62 with value: 0.15725047618264015.
[I 2025-12-05 16:12:18,726] Trial 65 finished with value: 0.14900898485802697 and parameters: {'model_type': 'mlp', 'hidden_dims': '[512, 128]', 'dropout': 0.12883926634784343, 'batch_norm': False, 'lr': 0.00022199425929197482, 'weight_decay': 0.00022046181706090524, 'epochs': 320, 'loss': 'mae', 'optimizer': 'adam', 'graph_mode': 'off', 'use_snp_selection': True, 'num_snps': 56415}. Best is trial 62 with value: 0.15725047618264015.
[I 2025-12-05 16:12:22,351] Trial 66 finished with value: 0.14485233338030531 and parameters: {'model_type': 'mlp', 'hidden_dims': '[512, 128]', 'dropout': 0.12036569285306256, 'batch_norm': False, 'lr': 0.0002553076980574076, 'weight_decay': 0.00033273724698897343, 'epochs': 319, 'loss': 'mae', 'optimizer': 'adam', 'graph_mode': 'off', 'use_snp_selection': True, 'num_snps': 50204}. Best is trial 62 with value: 0.15725047618264015.
[I 2025-12-05 16:12:26,578] Trial 67 finished with value: 0.15385238915414245 and parameters: {'model_type': 'mlp', 'hidden_dims': '[512, 128]', 'dropout': 0.14349349168242578, 'batch_norm': False, 'lr': 0.00014030604959987475, 'weight_decay': 0.0002135488850902688, 'epochs': 343, 'loss': 'mae', 'optimizer': 'adam', 'graph_mode': 'off', 'use_snp_selection': True, 'num_snps': 57016}. Best is trial 62 with value: 0.15725047618264015.
[I 2025-12-05 16:12:29,444] Trial 68 finished with value: 0.1340282876821025 and parameters: {'model_type': 'mlp', 'hidden_dims': '[512, 128]', 'dropout': 0.14728481666035967, 'batch_norm': False, 'lr': 0.0001449894890968271, 'weight_decay': 0.00012488292381073599, 'epochs': 344, 'loss': 'mae', 'optimizer': 'adam', 'graph_mode': 'off', 'use_snp_selection': True, 'num_snps': 35684}. Best is trial 62 with value: 0.15725047618264015.
[I 2025-12-05 16:12:31,352] Trial 69 finished with value: 0.12901805647345893 and parameters: {'model_type': 'mlp', 'hidden_dims': '[512, 256]', 'dropout': 0.18315546275615094, 'batch_norm': False, 'lr': 3.844088114015775e-05, 'weight_decay': 0.000384690713107442, 'epochs': 149, 'loss': 'mae', 'optimizer': 'adam', 'graph_mode': 'off', 'use_snp_selection': True, 'num_snps': 28747}. Best is trial 62 with value: 0.15725047618264015.
[I 2025-12-05 16:12:33,201] Trial 70 finished with value: 0.13778308049208224 and parameters: {'model_type': 'mlp', 'hidden_dims': '[512, 128]', 'dropout': 0.15785400264281066, 'batch_norm': False, 'lr': 0.0005439521888710965, 'weight_decay': 0.0007044761287852835, 'epochs': 328, 'loss': 'mae', 'optimizer': 'adam', 'graph_mode': 'off', 'use_snp_selection': True, 'num_snps': 20547}. Best is trial 62 with value: 0.15725047618264015.
[I 2025-12-05 16:12:37,078] Trial 71 finished with value: 0.14323325878772608 and parameters: {'model_type': 'mlp', 'hidden_dims': '[512, 128]', 'dropout': 0.13541209556669873, 'batch_norm': False, 'lr': 0.000108503923754403, 'weight_decay': 0.0002026825801172432, 'epochs': 318, 'loss': 'mae', 'optimizer': 'adam', 'graph_mode': 'off', 'use_snp_selection': True, 'num_snps': 55720}. Best is trial 62 with value: 0.15725047618264015.
[I 2025-12-05 16:12:40,917] Trial 72 finished with value: 0.1445821615684877 and parameters: {'model_type': 'mlp', 'hidden_dims': '[512, 128]', 'dropout': 0.11925978425318576, 'batch_norm': False, 'lr': 0.00021768939132522846, 'weight_decay': 0.00025366920101644355, 'epochs': 303, 'loss': 'mae', 'optimizer': 'adam', 'graph_mode': 'off', 'use_snp_selection': True, 'num_snps': 55054}. Best is trial 62 with value: 0.15725047618264015.
[I 2025-12-05 16:12:45,178] Trial 73 finished with value: 0.13971637153703056 and parameters: {'model_type': 'mlp', 'hidden_dims': '[512, 128]', 'dropout': 0.10071639758010746, 'batch_norm': False, 'lr': 0.00030994433161546955, 'weight_decay': 0.00019207216106825194, 'epochs': 341, 'loss': 'mae', 'optimizer': 'adam', 'graph_mode': 'off', 'use_snp_selection': True, 'num_snps': 59411}. Best is trial 62 with value: 0.15725047618264015.
[I 2025-12-05 16:12:48,075] Trial 74 finished with value: 0.1456400186151312 and parameters: {'model_type': 'mlp', 'hidden_dims': '[256, 128, 64]', 'dropout': 0.2168186345180036, 'batch_norm': False, 'lr': 0.00013905666212649185, 'weight_decay': 0.00010047151819090167, 'epochs': 329, 'loss': 'mae', 'optimizer': 'adam', 'graph_mode': 'off', 'use_snp_selection': True, 'num_snps': 50983}. Best is trial 62 with value: 0.15725047618264015.
[I 2025-12-05 16:12:50,727] Trial 75 finished with value: 0.13016350282923325 and parameters: {'model_type': 'mlp', 'hidden_dims': '[512, 128]', 'dropout': 0.15185316874974022, 'batch_norm': False, 'lr': 6.792894880434349e-05, 'weight_decay': 0.00014718179057294565, 'epochs': 130, 'loss': 'mae', 'optimizer': 'adam', 'graph_mode': 'off', 'use_snp_selection': True, 'num_snps': 47389}. Best is trial 62 with value: 0.15725047618264015.
[I 2025-12-05 16:12:54,601] Trial 76 finished with value: 0.13958708139232232 and parameters: {'model_type': 'mlp', 'hidden_dims': '[512, 128]', 'dropout': 0.13407408710127972, 'batch_norm': False, 'lr': 0.0006776771459283907, 'weight_decay': 0.00029424242186423404, 'epochs': 290, 'loss': 'mae', 'optimizer': 'adam', 'graph_mode': 'off', 'use_snp_selection': True, 'num_snps': 55847}. Best is trial 62 with value: 0.15725047618264015.
[I 2025-12-05 16:12:57,019] Trial 77 finished with value: 0.1391260203547378 and parameters: {'model_type': 'mlp', 'hidden_dims': '[256, 128]', 'dropout': 0.18501079841884185, 'batch_norm': False, 'lr': 9.172275405984205e-05, 'weight_decay': 0.0005835581598130547, 'epochs': 313, 'loss': 'mae', 'optimizer': 'adam', 'graph_mode': 'off', 'use_snp_selection': True, 'num_snps': 41070}. Best is trial 62 with value: 0.15725047618264015.
[I 2025-12-05 16:12:59,069] Trial 78 finished with value: 0.1333434462413008 and parameters: {'model_type': 'mlp', 'hidden_dims': '[512, 256]', 'dropout': 0.17037605809695194, 'batch_norm': False, 'lr': 0.00035329645266432124, 'weight_decay': 0.00040524725079853403, 'epochs': 297, 'loss': 'mae', 'optimizer': 'adam', 'graph_mode': 'off', 'use_snp_selection': True, 'num_snps': 23477}. Best is trial 62 with value: 0.15725047618264015.
[I 2025-12-05 16:13:00,611] Trial 79 finished with value: 0.12773783882257594 and parameters: {'model_type': 'mlp', 'hidden_dims': '[256, 128]', 'dropout': 0.5125063660449517, 'batch_norm': True, 'lr': 0.0002676932820349345, 'weight_decay': 6.748036489805967e-05, 'epochs': 344, 'loss': 'mae', 'optimizer': 'adam', 'graph_mode': 'off', 'use_snp_selection': True, 'num_snps': 14712}. Best is trial 62 with value: 0.15725047618264015.
[I 2025-12-05 16:13:02,044] Trial 80 finished with value: 0.1239763919815234 and parameters: {'model_type': 'mlp', 'hidden_dims': '[128, 64]', 'dropout': 0.27129489568654597, 'batch_norm': False, 'lr': 0.00015907516781435047, 'weight_decay': 0.00022407692905465843, 'epochs': 182, 'loss': 'mae', 'optimizer': 'adam', 'graph_mode': 'off', 'use_snp_selection': True, 'num_snps': 21530}. Best is trial 62 with value: 0.15725047618264015.
[I 2025-12-05 16:13:03,503] Trial 81 finished with value: 0.14752066004705403 and parameters: {'model_type': 'mlp', 'hidden_dims': '[256, 128]', 'dropout': 0.19520676299076528, 'batch_norm': False, 'lr': 0.0001912704424949925, 'weight_decay': 3.08021088163876e-05, 'epochs': 330, 'loss': 'mae', 'optimizer': 'adam', 'graph_mode': 'off', 'use_snp_selection': True, 'num_snps': 16235}. Best is trial 62 with value: 0.15725047618264015.
[I 2025-12-05 16:13:05,022] Trial 82 finished with value: 0.1394071591118936 and parameters: {'model_type': 'mlp', 'hidden_dims': '[256, 128]', 'dropout': 0.15460293771851183, 'batch_norm': False, 'lr': 0.0002006496836965485, 'weight_decay': 9.527718879503533e-05, 'epochs': 308, 'loss': 'mae', 'optimizer': 'adam', 'graph_mode': 'off', 'use_snp_selection': True, 'num_snps': 19389}. Best is trial 62 with value: 0.15725047618264015.
[I 2025-12-05 16:13:06,067] Trial 83 finished with value: 0.10944429963558885 and parameters: {'model_type': 'mlp', 'hidden_dims': '[256, 128]', 'dropout': 0.17490368053773306, 'batch_norm': False, 'lr': 0.0002336722762541861, 'weight_decay': 0.0001683779160378757, 'epochs': 281, 'loss': 'mae', 'optimizer': 'adam', 'graph_mode': 'off', 'use_snp_selection': True, 'num_snps': 2365}. Best is trial 62 with value: 0.15725047618264015.
[I 2025-12-05 16:13:07,366] Trial 84 finished with value: 0.1258676621741768 and parameters: {'model_type': 'mlp', 'hidden_dims': '[256, 128]', 'dropout': 0.23100457720615386, 'batch_norm': False, 'lr': 0.0003050630517718955, 'weight_decay': 4.929301458080948e-05, 'epochs': 318, 'loss': 'mae', 'optimizer': 'adam', 'graph_mode': 'off', 'use_snp_selection': True, 'num_snps': 10872}. Best is trial 62 with value: 0.15725047618264015.
[I 2025-12-05 16:13:09,082] Trial 85 finished with value: 0.12796078552868095 and parameters: {'model_type': 'mlp', 'hidden_dims': '[256, 128]', 'dropout': 0.13389727027738324, 'batch_norm': False, 'lr': 0.0004190220586707058, 'weight_decay': 8.463649524196475e-06, 'epochs': 338, 'loss': 'mae', 'optimizer': 'adam', 'graph_mode': 'off', 'use_snp_selection': True, 'num_snps': 24444}. Best is trial 62 with value: 0.15725047618264015.
[I 2025-12-05 16:13:10,666] Trial 86 finished with value: 0.14272861313613583 and parameters: {'model_type': 'mlp', 'hidden_dims': '[256, 128]', 'dropout': 0.11305447627069506, 'batch_norm': True, 'lr': 0.00011384097347737738, 'weight_decay': 2.3690872575607488e-05, 'epochs': 325, 'loss': 'mae', 'optimizer': 'adam', 'graph_mode': 'off', 'use_snp_selection': True, 'num_snps': 17519}. Best is trial 62 with value: 0.15725047618264015.
[I 2025-12-05 16:13:12,344] Trial 87 finished with value: 0.13248385258675438 and parameters: {'model_type': 'mlp', 'hidden_dims': '[256, 128, 64]', 'dropout': 0.1922918342692725, 'batch_norm': False, 'lr': 0.0006140170684994862, 'weight_decay': 0.00013036385527905454, 'epochs': 350, 'loss': 'mae', 'optimizer': 'adam', 'graph_mode': 'off', 'use_snp_selection': True, 'num_snps': 21029}. Best is trial 62 with value: 0.15725047618264015.
[I 2025-12-05 16:13:13,661] Trial 88 finished with value: 0.12406950996052624 and parameters: {'model_type': 'mlp', 'hidden_dims': '[256, 128]', 'dropout': 0.2157477749641431, 'batch_norm': True, 'lr': 0.0007959698711591409, 'weight_decay': 0.0003344923062573878, 'epochs': 208, 'loss': 'mae', 'optimizer': 'adam', 'graph_mode': 'off', 'use_snp_selection': True, 'num_snps': 13065}. Best is trial 62 with value: 0.15725047618264015.
[I 2025-12-05 16:13:15,424] Trial 89 finished with value: 0.14779377516713044 and parameters: {'model_type': 'mlp', 'hidden_dims': '[512, 128]', 'dropout': 0.16165827839015454, 'batch_norm': False, 'lr': 0.00017060398242353756, 'weight_decay': 0.00044872406252454507, 'epochs': 302, 'loss': 'mae', 'optimizer': 'adam', 'graph_mode': 'off', 'use_snp_selection': True, 'num_snps': 19256}. Best is trial 62 with value: 0.15725047618264015.
[I 2025-12-05 16:13:18,518] Trial 90 finished with value: 0.12777085248927414 and parameters: {'model_type': 'mlp', 'hidden_dims': '[256, 128]', 'dropout': 0.20311799018472146, 'batch_norm': False, 'lr': 7.970830554857416e-05, 'weight_decay': 7.038222166020995e-05, 'epochs': 339, 'loss': 'mae', 'optimizer': 'adam', 'graph_mode': 'off', 'use_snp_selection': True, 'num_snps': 57740}. Best is trial 62 with value: 0.15725047618264015.
[I 2025-12-05 16:13:20,108] Trial 91 finished with value: 0.1494456245895534 and parameters: {'model_type': 'mlp', 'hidden_dims': '[256, 128]', 'dropout': 0.19035118706485216, 'batch_norm': True, 'lr': 0.0004545831045749971, 'weight_decay': 4.324656219717387e-05, 'epochs': 334, 'loss': 'mae', 'optimizer': 'adam', 'graph_mode': 'off', 'use_snp_selection': True, 'num_snps': 16447}. Best is trial 62 with value: 0.15725047618264015.
[I 2025-12-05 16:13:21,645] Trial 92 finished with value: 0.14245289684977608 and parameters: {'model_type': 'mlp', 'hidden_dims': '[256, 128]', 'dropout': 0.1429220317898048, 'batch_norm': True, 'lr': 0.00046996172906598827, 'weight_decay': 4.218722981793846e-05, 'epochs': 316, 'loss': 'mae', 'optimizer': 'adam', 'graph_mode': 'off', 'use_snp_selection': True, 'num_snps': 16036}. Best is trial 62 with value: 0.15725047618264015.
[I 2025-12-05 16:13:23,220] Trial 93 finished with value: 0.14313765195279443 and parameters: {'model_type': 'mlp', 'hidden_dims': '[256, 128]', 'dropout': 0.18553628098201466, 'batch_norm': True, 'lr': 0.0003473902140669293, 'weight_decay': 1.5632143310060727e-05, 'epochs': 332, 'loss': 'mae', 'optimizer': 'adam', 'graph_mode': 'off', 'use_snp_selection': True, 'num_snps': 16832}. Best is trial 62 with value: 0.15725047618264015.
[I 2025-12-05 16:13:24,698] Trial 94 finished with value: 0.12738242753067558 and parameters: {'model_type': 'mlp', 'hidden_dims': '[256, 128]', 'dropout': 0.16956075036835386, 'batch_norm': True, 'lr': 0.0002295804121140648, 'weight_decay': 2.1603084362817625e-05, 'epochs': 323, 'loss': 'mae', 'optimizer': 'adam', 'graph_mode': 'off', 'use_snp_selection': True, 'num_snps': 13967}. Best is trial 62 with value: 0.15725047618264015.
[I 2025-12-05 16:13:27,593] Trial 95 finished with value: 0.13233670131503628 and parameters: {'model_type': 'mlp', 'hidden_dims': '[256, 128]', 'dropout': 0.12401814803295286, 'batch_norm': True, 'lr': 0.0005518594548220643, 'weight_decay': 5.876870804340706e-05, 'epochs': 306, 'loss': 'mae', 'optimizer': 'adam', 'graph_mode': 'off', 'use_snp_selection': True, 'num_snps': 52847}. Best is trial 62 with value: 0.15725047618264015.
[I 2025-12-05 16:13:29,252] Trial 96 finished with value: 0.14760480875852433 and parameters: {'model_type': 'mlp', 'hidden_dims': '[256, 128]', 'dropout': 0.22769414005147204, 'batch_norm': True, 'lr': 0.00028118708786827046, 'weight_decay': 3.705193963984517e-05, 'epochs': 343, 'loss': 'mae', 'optimizer': 'adam', 'graph_mode': 'off', 'use_snp_selection': True, 'num_snps': 18511}. Best is trial 62 with value: 0.15725047618264015.
[I 2025-12-05 16:13:30,700] Trial 97 finished with value: 0.12034008447189509 and parameters: {'model_type': 'mlp', 'hidden_dims': '[256, 128]', 'dropout': 0.15486057953549007, 'batch_norm': True, 'lr': 0.0007612734117084374, 'weight_decay': 8.877877661269582e-05, 'epochs': 336, 'loss': 'mae', 'optimizer': 'adam', 'graph_mode': 'off', 'use_snp_selection': True, 'num_snps': 11873}. Best is trial 62 with value: 0.15725047618264015.
[I 2025-12-05 16:13:32,642] Trial 98 finished with value: 0.07800073483417573 and parameters: {'model_type': 'mlp', 'hidden_dims': '[512, 256]', 'dropout': 0.4247845778688286, 'batch_norm': False, 'lr': 4.337516929432747e-06, 'weight_decay': 0.0001795929906980196, 'epochs': 325, 'loss': 'mae', 'optimizer': 'adam', 'graph_mode': 'off', 'use_snp_selection': True, 'num_snps': 21433}. Best is trial 62 with value: 0.15725047618264015.
[I 2025-12-05 16:13:34,724] Trial 99 finished with value: 0.12457703099410972 and parameters: {'model_type': 'mlp', 'hidden_dims': '[512, 128]', 'dropout': 0.2069909710829162, 'batch_norm': False, 'lr': 0.0003989578174182494, 'weight_decay': 1.9951726434494077e-06, 'epochs': 293, 'loss': 'mae', 'optimizer': 'adam', 'graph_mode': 'off', 'use_snp_selection': True, 'num_snps': 25571}. Best is trial 62 with value: 0.15725047618264015.
[I 2025-12-05 16:13:36,214] Trial 100 finished with value: 0.13195621953709188 and parameters: {'model_type': 'mlp', 'hidden_dims': '[256, 128]', 'dropout': 0.245915259585532, 'batch_norm': True, 'lr': 0.0001386805661977674, 'weight_decay': 0.00023361537368908638, 'epochs': 311, 'loss': 'mae', 'optimizer': 'adam', 'graph_mode': 'off', 'use_snp_selection': False}. Best is trial 62 with value: 0.15725047618264015.
[I 2025-12-05 16:13:37,749] Trial 101 finished with value: 0.13894764151872807 and parameters: {'model_type': 'mlp', 'hidden_dims': '[256, 128]', 'dropout': 0.1920137263586527, 'batch_norm': True, 'lr': 0.00047275256276158766, 'weight_decay': 4.9271740822338556e-05, 'epochs': 334, 'loss': 'mae', 'optimizer': 'adam', 'graph_mode': 'off', 'use_snp_selection': True, 'num_snps': 15057}. Best is trial 62 with value: 0.15725047618264015.
[I 2025-12-05 16:13:39,426] Trial 102 finished with value: 0.14123171469064133 and parameters: {'model_type': 'mlp', 'hidden_dims': '[256, 128]', 'dropout': 0.2000005122291546, 'batch_norm': True, 'lr': 0.0001758935737099324, 'weight_decay': 0.00011355467704920121, 'epochs': 343, 'loss': 'mae', 'optimizer': 'adam', 'graph_mode': 'off', 'use_snp_selection': True, 'num_snps': 19956}. Best is trial 62 with value: 0.15725047618264015.
[I 2025-12-05 16:13:41,042] Trial 103 finished with value: 0.14996545918835405 and parameters: {'model_type': 'mlp', 'hidden_dims': '[256, 128]', 'dropout': 0.21851610828785317, 'batch_norm': True, 'lr': 0.00021516325754964693, 'weight_decay': 5.930869418261189e-05, 'epochs': 349, 'loss': 'mae', 'optimizer': 'adam', 'graph_mode': 'off', 'use_snp_selection': True, 'num_snps': 17420}. Best is trial 62 with value: 0.15725047618264015.
[I 2025-12-05 16:13:42,704] Trial 104 finished with value: 0.1461469452842488 and parameters: {'model_type': 'mlp', 'hidden_dims': '[256, 128]', 'dropout': 0.14311816770783375, 'batch_norm': True, 'lr': 0.0002019934898397913, 'weight_decay': 2.8695391751891552e-05, 'epochs': 346, 'loss': 'mae', 'optimizer': 'adam', 'graph_mode': 'off', 'use_snp_selection': True, 'num_snps': 17928}. Best is trial 62 with value: 0.15725047618264015.
[I 2025-12-05 16:13:44,015] Trial 105 finished with value: 0.1018926634779458 and parameters: {'model_type': 'mlp', 'hidden_dims': '[128, 64]', 'dropout': 0.3746590597491931, 'batch_norm': True, 'lr': 0.00027060872529559754, 'weight_decay': 0.00013978751503526752, 'epochs': 350, 'loss': 'mse', 'optimizer': 'adam', 'graph_mode': 'off', 'use_snp_selection': True, 'num_snps': 7678}. Best is trial 62 with value: 0.15725047618264015.
[I 2025-12-05 16:13:45,261] Trial 106 finished with value: 0.11413784579713579 and parameters: {'model_type': 'mlp', 'hidden_dims': '[256, 128]', 'dropout': 0.1780926433747195, 'batch_norm': False, 'lr': 0.00023065161543681914, 'weight_decay': 0.00031779623430228294, 'epochs': 328, 'loss': 'mae', 'optimizer': 'adam', 'graph_mode': 'off', 'use_snp_selection': True, 'num_snps': 9354}. Best is trial 62 with value: 0.15725047618264015.
