[I 2025-12-06 08:17:49,050] Trial 94 finished with value: 0.31529990236852523 and parameters: {'model_type': 'mlp', 'hidden_dims': '[512, 128]', 'dropout': 0.5916756242702254, 'batch_norm': False, 'lr': 2.283791182304085e-05, 'weight_decay': 1.129087559860985e-06, 'epochs': 177, 'loss': 'mse', 'optimizer': 'adam', 'graph_mode': 'off', 'use_snp_selection': True, 'num_snps': 54780}. Best is trial 71 with value: 0.3204759444484463.
[I 2025-12-06 08:18:39,672] Trial 95 finished with value: 0.3124979888701411 and parameters: {'model_type': 'mlp', 'hidden_dims': '[256, 128]', 'dropout': 0.5584107521335783, 'batch_norm': False, 'lr': 7.3675628098599405e-06, 'weight_decay': 4.9020485846631245e-05, 'epochs': 278, 'loss': 'mae', 'optimizer': 'adam', 'graph_mode': 'off', 'use_snp_selection': True, 'num_snps': 44517}. Best is trial 71 with value: 0.3204759444484463.
[I 2025-12-06 08:20:04,459] Trial 96 finished with value: 0.30488620693153184 and parameters: {'model_type': 'mlp', 'hidden_dims': '[512, 256]', 'dropout': 0.5726760347881297, 'batch_norm': True, 'lr': 3.9500630516275764e-06, 'weight_decay': 3.881019147091292e-06, 'epochs': 301, 'loss': 'mae', 'optimizer': 'adam', 'graph_mode': 'off', 'use_snp_selection': True, 'num_snps': 56581}. Best is trial 71 with value: 0.3204759444484463.
[I 2025-12-06 08:20:27,905] Trial 97 finished with value: 0.27980658397226466 and parameters: {'model_type': 'mlp', 'hidden_dims': '[256, 128, 64]', 'dropout': 0.5277014648658392, 'batch_norm': False, 'lr': 1.8359438372961606e-06, 'weight_decay': 2.9319145247293847e-06, 'epochs': 207, 'loss': 'mse', 'optimizer': 'adam', 'graph_mode': 'off', 'use_snp_selection': False}. Best is trial 71 with value: 0.3204759444484463.
[I 2025-12-06 08:21:30,182] Trial 98 finished with value: 0.31834064326991635 and parameters: {'model_type': 'mlp', 'hidden_dims': '[512, 256]', 'dropout': 0.4705558583558035, 'batch_norm': False, 'lr': 5.842576446610872e-06, 'weight_decay': 1.3731903425586215e-05, 'epochs': 188, 'loss': 'mse', 'optimizer': 'adam', 'graph_mode': 'off', 'use_snp_selection': True, 'num_snps': 51254}. Best is trial 71 with value: 0.3204759444484463.
[I 2025-12-06 08:22:30,954] Trial 99 finished with value: 0.31697906183275826 and parameters: {'model_type': 'mlp', 'hidden_dims': '[512, 256]', 'dropout': 0.48262591514298225, 'batch_norm': False, 'lr': 5.956480728640053e-06, 'weight_decay': 1.3210906556212935e-05, 'epochs': 165, 'loss': 'mse', 'optimizer': 'adam', 'graph_mode': 'off', 'use_snp_selection': True, 'num_snps': 53630}. Best is trial 71 with value: 0.3204759444484463.
[I 2025-12-06 08:23:24,138] Trial 100 finished with value: 0.3156199082443418 and parameters: {'model_type': 'mlp', 'hidden_dims': '[256, 128]', 'dropout': 0.468777067628137, 'batch_norm': False, 'lr': 9.002616155942065e-06, 'weight_decay': 9.095748918995087e-06, 'epochs': 190, 'loss': 'mse', 'optimizer': 'adam', 'graph_mode': 'off', 'use_snp_selection': True, 'num_snps': 58953}. Best is trial 71 with value: 0.3204759444484463.
[I 2025-12-06 08:24:25,082] Trial 101 finished with value: 0.3141824849489853 and parameters: {'model_type': 'mlp', 'hidden_dims': '[512, 256]', 'dropout': 0.43227059396903, 'batch_norm': False, 'lr': 1.1283858437881474e-05, 'weight_decay': 3.557992759074211e-05, 'epochs': 178, 'loss': 'mse', 'optimizer': 'adam', 'graph_mode': 'off', 'use_snp_selection': True, 'num_snps': 51219}. Best is trial 71 with value: 0.3204759444484463.
[I 2025-12-06 08:25:34,837] Trial 102 finished with value: 0.3162971538660263 and parameters: {'model_type': 'mlp', 'hidden_dims': '[512, 256]', 'dropout': 0.39218610678216104, 'batch_norm': False, 'lr': 4.579547140405706e-06, 'weight_decay': 5.6549960594058925e-06, 'epochs': 265, 'loss': 'mse', 'optimizer': 'adam', 'graph_mode': 'off', 'use_snp_selection': True, 'num_snps': 47889}. Best is trial 71 with value: 0.3204759444484463.
[I 2025-12-06 08:26:31,455] Trial 103 finished with value: 0.315737397604687 and parameters: {'model_type': 'mlp', 'hidden_dims': '[512, 256]', 'dropout': 0.514427913652344, 'batch_norm': False, 'lr': 6.796631946731781e-06, 'weight_decay': 2.5467121096010896e-05, 'epochs': 157, 'loss': 'mse', 'optimizer': 'adam', 'graph_mode': 'off', 'use_snp_selection': True, 'num_snps': 49324}. Best is trial 71 with value: 0.3204759444484463.
[I 2025-12-06 08:27:15,841] Trial 104 finished with value: 0.2791107823933613 and parameters: {'model_type': 'mlp', 'hidden_dims': '[512, 256]', 'dropout': 0.5025020741947762, 'batch_norm': False, 'lr': 3.7718589868289364e-06, 'weight_decay': 5.806002092640343e-05, 'epochs': 81, 'loss': 'mae', 'optimizer': 'adam', 'graph_mode': 'off', 'use_snp_selection': True, 'num_snps': 46033}. Best is trial 71 with value: 0.3204759444484463.
[I 2025-12-06 08:28:42,542] Trial 105 finished with value: 0.3127872122495424 and parameters: {'model_type': 'mlp', 'hidden_dims': '[512, 256]', 'dropout': 0.5892225013773283, 'batch_norm': False, 'lr': 1.635121439983519e-05, 'weight_decay': 1.4945080115743804e-05, 'epochs': 320, 'loss': 'mse', 'optimizer': 'adam', 'graph_mode': 'off', 'use_snp_selection': True, 'num_snps': 56375}. Best is trial 71 with value: 0.3204759444484463.
[I 2025-12-06 08:29:50,112] Trial 106 finished with value: 0.31490964583554576 and parameters: {'model_type': 'mlp', 'hidden_dims': '[512, 256]', 'dropout': 0.4043394057997489, 'batch_norm': False, 'lr': 5.747821867802549e-06, 'weight_decay': 1.0027691096720052e-05, 'epochs': 215, 'loss': 'mae', 'optimizer': 'adam', 'graph_mode': 'off', 'use_snp_selection': True, 'num_snps': 52606}. Best is trial 71 with value: 0.3204759444484463.
[I 2025-12-06 08:30:27,963] Trial 107 finished with value: 0.3193568943421584 and parameters: {'model_type': 'mlp', 'hidden_dims': '[512, 256]', 'dropout': 0.5525705315761952, 'batch_norm': False, 'lr': 1.3930375386362716e-05, 'weight_decay': 7.722843614451474e-07, 'epochs': 188, 'loss': 'mse', 'optimizer': 'adam', 'graph_mode': 'off', 'use_snp_selection': False}. Best is trial 71 with value: 0.3204759444484463.
[I 2025-12-06 08:30:48,022] Trial 108 finished with value: 0.31743328099509893 and parameters: {'model_type': 'mlp', 'hidden_dims': '[256, 128]', 'dropout': 0.5412782142430279, 'batch_norm': False, 'lr': 8.258447271286251e-06, 'weight_decay': 7.843816735960326e-07, 'epochs': 170, 'loss': 'mse', 'optimizer': 'adam', 'graph_mode': 'off', 'use_snp_selection': False}. Best is trial 71 with value: 0.3204759444484463.
[I 2025-12-06 08:31:28,533] Trial 109 finished with value: 0.3141492099346007 and parameters: {'model_type': 'mlp', 'hidden_dims': '[512, 256]', 'dropout': 0.1051462079786658, 'batch_norm': False, 'lr': 1.0144761993971234e-05, 'weight_decay': 3.8833930401608104e-07, 'epochs': 202, 'loss': 'mse', 'optimizer': 'adam', 'graph_mode': 'off', 'use_snp_selection': False}. Best is trial 71 with value: 0.3204759444484463.
[I 2025-12-06 08:31:42,658] Trial 110 finished with value: 0.30856062764830783 and parameters: {'model_type': 'mlp', 'hidden_dims': '[128, 64]', 'dropout': 0.4478960495178816, 'batch_norm': True, 'lr': 1.3633751243439621e-05, 'weight_decay': 1.484911209893814e-06, 'epochs': 188, 'loss': 'mse', 'optimizer': 'adam', 'graph_mode': 'off', 'use_snp_selection': False}. Best is trial 71 with value: 0.3204759444484463.
[I 2025-12-06 08:32:27,793] Trial 111 finished with value: 0.31169177485051647 and parameters: {'model_type': 'mlp', 'hidden_dims': '[512, 256]', 'dropout': 0.5633870076008481, 'batch_norm': False, 'lr': 2.431785258141671e-05, 'weight_decay': 6.724541767908577e-07, 'epochs': 230, 'loss': 'mse', 'optimizer': 'adam', 'graph_mode': 'off', 'use_snp_selection': False}. Best is trial 71 with value: 0.3204759444484463.
[I 2025-12-06 08:33:04,196] Trial 112 finished with value: 0.31386620973502705 and parameters: {'model_type': 'mlp', 'hidden_dims': '[512, 256]', 'dropout': 0.5523968724338147, 'batch_norm': False, 'lr': 2.0670908099979237e-05, 'weight_decay': 5.230131629509139e-07, 'epochs': 180, 'loss': 'mse', 'optimizer': 'adam', 'graph_mode': 'off', 'use_snp_selection': False}. Best is trial 71 with value: 0.3204759444484463.
[I 2025-12-06 08:34:10,573] Trial 113 finished with value: 0.31397600570579665 and parameters: {'model_type': 'mlp', 'hidden_dims': '[512, 256]', 'dropout': 0.5793907694617065, 'batch_norm': False, 'lr': 2.7129119455523205e-05, 'weight_decay': 6.994236140709807e-05, 'epochs': 203, 'loss': 'mse', 'optimizer': 'adam', 'graph_mode': 'off', 'use_snp_selection': True, 'num_snps': 54577}. Best is trial 71 with value: 0.3204759444484463.
[I 2025-12-06 08:35:34,551] Trial 114 finished with value: 0.31069413245651495 and parameters: {'model_type': 'mlp', 'hidden_dims': '[512, 256]', 'dropout': 0.534421120856512, 'batch_norm': False, 'lr': 3.256200474168123e-06, 'weight_decay': 2.0736881565227745e-05, 'epochs': 346, 'loss': 'mae', 'optimizer': 'adam', 'graph_mode': 'off', 'use_snp_selection': True, 'num_snps': 51037}. Best is trial 71 with value: 0.3204759444484463.
[I 2025-12-06 08:36:29,960] Trial 115 finished with value: 0.30858466150887054 and parameters: {'model_type': 'mlp', 'hidden_dims': '[512, 256]', 'dropout': 0.12023820248953951, 'batch_norm': False, 'lr': 1.4467958958901882e-05, 'weight_decay': 2.514625244740436e-06, 'epochs': 289, 'loss': 'mse', 'optimizer': 'adam', 'graph_mode': 'off', 'use_snp_selection': False}. Best is trial 71 with value: 0.3204759444484463.
[I 2025-12-06 08:37:40,951] Trial 116 finished with value: 0.3130038515003564 and parameters: {'model_type': 'mlp', 'hidden_dims': '[512, 64]', 'dropout': 0.5954054608556931, 'batch_norm': False, 'lr': 4.435092259094272e-06, 'weight_decay': 1.7284267843331683e-06, 'epochs': 327, 'loss': 'mae', 'optimizer': 'adam', 'graph_mode': 'off', 'use_snp_selection': True, 'num_snps': 42540}. Best is trial 71 with value: 0.3204759444484463.
[I 2025-12-06 08:38:41,228] Trial 117 finished with value: 0.3006651704291863 and parameters: {'model_type': 'mlp', 'hidden_dims': '[512, 256]', 'dropout': 0.47165579853245887, 'batch_norm': False, 'lr': 2.399486826965472e-06, 'weight_decay': 0.00010067054264912001, 'epochs': 145, 'loss': 'mse', 'optimizer': 'adam', 'graph_mode': 'off', 'use_snp_selection': True, 'num_snps': 58112}. Best is trial 71 with value: 0.3204759444484463.
[I 2025-12-06 08:39:21,130] Trial 118 finished with value: 0.30558956163405304 and parameters: {'model_type': 'mlp', 'hidden_dims': '[512, 128]', 'dropout': 0.4932454885194819, 'batch_norm': False, 'lr': 3.371239904686211e-05, 'weight_decay': 2.578914279135296e-07, 'epochs': 339, 'loss': 'mae', 'optimizer': 'adam', 'graph_mode': 'off', 'use_snp_selection': True, 'num_snps': 15660}. Best is trial 71 with value: 0.3204759444484463.
[I 2025-12-06 08:40:01,928] Trial 119 finished with value: 0.307875115823279 and parameters: {'model_type': 'mlp', 'hidden_dims': '[256, 128]', 'dropout': 0.42381702495395, 'batch_norm': False, 'lr': 4.686769167083058e-05, 'weight_decay': 1.0417186038287239e-06, 'epochs': 173, 'loss': 'mse', 'optimizer': 'adam', 'graph_mode': 'off', 'use_snp_selection': True, 'num_snps': 38881}. Best is trial 71 with value: 0.3204759444484463.
[I 2025-12-06 08:41:00,666] Trial 120 finished with value: 0.31644464170036174 and parameters: {'model_type': 'mlp', 'hidden_dims': '[512, 256]', 'dropout': 0.5700507752066455, 'batch_norm': False, 'lr': 8.429779558544196e-06, 'weight_decay': 8.434599188036713e-07, 'epochs': 309, 'loss': 'mae', 'optimizer': 'adam', 'graph_mode': 'off', 'use_snp_selection': False}. Best is trial 71 with value: 0.3204759444484463.
[I 2025-12-06 08:41:19,515] Trial 121 finished with value: 0.31285499473511585 and parameters: {'model_type': 'mlp', 'hidden_dims': '[256, 128]', 'dropout': 0.5218246170460098, 'batch_norm': False, 'lr': 8.342936770898137e-06, 'weight_decay': 8.063432581706888e-07, 'epochs': 158, 'loss': 'mse', 'optimizer': 'adam', 'graph_mode': 'off', 'use_snp_selection': False}. Best is trial 71 with value: 0.3204759444484463.
[I 2025-12-06 08:41:39,335] Trial 122 finished with value: 0.3142230878948705 and parameters: {'model_type': 'mlp', 'hidden_dims': '[256, 128]', 'dropout': 0.5445939046767, 'batch_norm': False, 'lr': 1.2089598408868385e-05, 'weight_decay': 4.7182805576614717e-07, 'epochs': 169, 'loss': 'mse', 'optimizer': 'adam', 'graph_mode': 'off', 'use_snp_selection': False}. Best is trial 71 with value: 0.3204759444484463.
[I 2025-12-06 08:42:01,678] Trial 123 finished with value: 0.31068766590859703 and parameters: {'model_type': 'mlp', 'hidden_dims': '[256, 128]', 'dropout': 0.5090617394049498, 'batch_norm': False, 'lr': 6.884810981066475e-06, 'weight_decay': 6.788968607409939e-07, 'epochs': 196, 'loss': 'mse', 'optimizer': 'adam', 'graph_mode': 'off', 'use_snp_selection': False}. Best is trial 71 with value: 0.3204759444484463.
[I 2025-12-06 08:42:23,268] Trial 124 finished with value: 0.3175104754892033 and parameters: {'model_type': 'mlp', 'hidden_dims': '[256, 128]', 'dropout': 0.5411442527235092, 'batch_norm': False, 'lr': 1.07063689015019e-05, 'weight_decay': 3.7065922393123543e-07, 'epochs': 188, 'loss': 'mse', 'optimizer': 'adam', 'graph_mode': 'off', 'use_snp_selection': False}. Best is trial 71 with value: 0.3204759444484463.
[I 2025-12-06 08:42:47,890] Trial 125 finished with value: 0.31746198989543944 and parameters: {'model_type': 'mlp', 'hidden_dims': '[256, 128]', 'dropout': 0.5548410075998833, 'batch_norm': False, 'lr': 1.6825121157976358e-05, 'weight_decay': 1.803003633226694e-07, 'epochs': 222, 'loss': 'mse', 'optimizer': 'adam', 'graph_mode': 'off', 'use_snp_selection': False}. Best is trial 71 with value: 0.3204759444484463.
[I 2025-12-06 08:43:37,546] Trial 126 finished with value: 0.3104958013917361 and parameters: {'model_type': 'mlp', 'hidden_dims': '[256, 128, 64]', 'dropout': 0.5822262587086564, 'batch_norm': False, 'lr': 1.0018234434018601e-05, 'weight_decay': 3.524972795110769e-07, 'epochs': 189, 'loss': 'mse', 'optimizer': 'adam', 'graph_mode': 'off', 'use_snp_selection': True, 'num_snps': 53896}. Best is trial 71 with value: 0.3204759444484463.
[I 2025-12-06 08:44:00,443] Trial 127 finished with value: 0.2617850801164159 and parameters: {'model_type': 'mlp', 'hidden_dims': '[512, 256]', 'dropout': 0.5664968461468508, 'batch_norm': False, 'lr': 5.124210245212062e-06, 'weight_decay': 7.790125366949501e-06, 'epochs': 199, 'loss': 'mae', 'optimizer': 'adam', 'graph_mode': 'off', 'use_snp_selection': True, 'num_snps': 2521}. Best is trial 71 with value: 0.3204759444484463.
[I 2025-12-06 08:44:56,808] Trial 128 finished with value: 0.3126261227361617 and parameters: {'model_type': 'mlp', 'hidden_dims': '[512, 256]', 'dropout': 0.5996109304266032, 'batch_norm': False, 'lr': 1.904244695622399e-05, 'weight_decay': 2.0004877192649738e-07, 'epochs': 296, 'loss': 'mse', 'optimizer': 'adam', 'graph_mode': 'off', 'use_snp_selection': False}. Best is trial 71 with value: 0.3204759444484463.
[I 2025-12-06 08:46:05,496] Trial 129 finished with value: 0.30761768472938833 and parameters: {'model_type': 'mlp', 'hidden_dims': '[512, 256]', 'dropout': 0.5266059853833504, 'batch_norm': False, 'lr': 5.745157463733358e-06, 'weight_decay': 3.4699374412408993e-06, 'epochs': 186, 'loss': 'mae', 'optimizer': 'adam', 'graph_mode': 'off', 'use_snp_selection': True, 'num_snps': 59899}. Best is trial 71 with value: 0.3204759444484463.
[I 2025-12-06 08:46:56,131] Trial 130 finished with value: 0.28124967956247393 and parameters: {'model_type': 'mlp', 'hidden_dims': '[256, 128]', 'dropout': 0.5389006213363564, 'batch_norm': True, 'lr': 2.9494553978707704e-06, 'weight_decay': 1.2975493563471261e-07, 'epochs': 175, 'loss': 'mse', 'optimizer': 'adam', 'graph_mode': 'off', 'use_snp_selection': True, 'num_snps': 56580}. Best is trial 71 with value: 0.3204759444484463.
[I 2025-12-06 08:47:23,260] Trial 131 finished with value: 0.31663466932291157 and parameters: {'model_type': 'mlp', 'hidden_dims': '[256, 128]', 'dropout': 0.5545058049775012, 'batch_norm': False, 'lr': 1.6070146747784047e-05, 'weight_decay': 2.808892254582681e-07, 'epochs': 251, 'loss': 'mse', 'optimizer': 'adam', 'graph_mode': 'off', 'use_snp_selection': False}. Best is trial 71 with value: 0.3204759444484463.
[I 2025-12-06 08:47:48,017] Trial 132 finished with value: 0.3122347141126277 and parameters: {'model_type': 'mlp', 'hidden_dims': '[256, 128]', 'dropout': 0.553615561943472, 'batch_norm': False, 'lr': 1.282943446838246e-05, 'weight_decay': 1.5427899914424852e-07, 'epochs': 224, 'loss': 'mse', 'optimizer': 'adam', 'graph_mode': 'off', 'use_snp_selection': False}. Best is trial 71 with value: 0.3204759444484463.
[I 2025-12-06 08:48:12,209] Trial 133 finished with value: 0.31948987748524277 and parameters: {'model_type': 'mlp', 'hidden_dims': '[256, 128]', 'dropout': 0.5615136645120696, 'batch_norm': False, 'lr': 1.0854838533440144e-05, 'weight_decay': 1.013270960950692e-07, 'epochs': 217, 'loss': 'mse', 'optimizer': 'adam', 'graph_mode': 'off', 'use_snp_selection': False}. Best is trial 71 with value: 0.3204759444484463.
[I 2025-12-06 08:48:46,991] Trial 134 finished with value: 0.31882101472729335 and parameters: {'model_type': 'mlp', 'hidden_dims': '[256, 128]', 'dropout': 0.5769112070415529, 'batch_norm': False, 'lr': 1.0496538572739016e-05, 'weight_decay': 5.421737028787339e-07, 'epochs': 334, 'loss': 'mse', 'optimizer': 'adam', 'graph_mode': 'off', 'use_snp_selection': False}. Best is trial 71 with value: 0.3204759444484463.
[I 2025-12-06 08:49:49,900] Trial 135 finished with value: 0.3142709684566087 and parameters: {'model_type': 'mlp', 'hidden_dims': '[512, 256]', 'dropout': 0.5848971672194524, 'batch_norm': False, 'lr': 7.5340000834885624e-06, 'weight_decay': 5.259111597572331e-06, 'epochs': 331, 'loss': 'mse', 'optimizer': 'adam', 'graph_mode': 'off', 'use_snp_selection': False}. Best is trial 71 with value: 0.3204759444484463.
[I 2025-12-06 08:50:41,509] Trial 136 finished with value: 0.31625511988660093 and parameters: {'model_type': 'mlp', 'hidden_dims': '[256, 128]', 'dropout': 0.5736198263306934, 'batch_norm': False, 'lr': 6.621036931371091e-06, 'weight_decay': 5.654733419658138e-07, 'epochs': 350, 'loss': 'mse', 'optimizer': 'adam', 'graph_mode': 'off', 'use_snp_selection': True, 'num_snps': 40616}. Best is trial 71 with value: 0.3204759444484463.
[I 2025-12-06 08:51:46,199] Trial 137 finished with value: 0.3202786804607589 and parameters: {'model_type': 'mlp', 'hidden_dims': '[512, 256]', 'dropout': 0.5898547554340703, 'batch_norm': False, 'lr': 1.1479067870950288e-05, 'weight_decay': 6.184675506986957e-06, 'epochs': 343, 'loss': 'mae', 'optimizer': 'adam', 'graph_mode': 'off', 'use_snp_selection': False}. Best is trial 71 with value: 0.3204759444484463.
[I 2025-12-06 08:52:49,262] Trial 138 finished with value: 0.31766785112818746 and parameters: {'model_type': 'mlp', 'hidden_dims': '[512, 256]', 'dropout': 0.5647837739156607, 'batch_norm': False, 'lr': 1.1258283820285275e-05, 'weight_decay': 6.04121760766373e-06, 'epochs': 333, 'loss': 'mae', 'optimizer': 'adam', 'graph_mode': 'off', 'use_snp_selection': False}. Best is trial 71 with value: 0.3204759444484463.
[I 2025-12-06 08:53:10,863] Trial 139 finished with value: 0.30827649618430886 and parameters: {'model_type': 'mlp', 'hidden_dims': '[128, 64]', 'dropout': 0.3603507358326674, 'batch_norm': False, 'lr': 9.637192219201056e-06, 'weight_decay': 6.551616711482746e-06, 'epochs': 336, 'loss': 'mae', 'optimizer': 'adam', 'graph_mode': 'off', 'use_snp_selection': False}. Best is trial 71 with value: 0.3204759444484463.
[I 2025-12-06 08:54:16,005] Trial 140 finished with value: 0.31962375512994584 and parameters: {'model_type': 'mlp', 'hidden_dims': '[512, 256]', 'dropout': 0.5619600920013905, 'batch_norm': False, 'lr': 1.2321080561318256e-05, 'weight_decay': 1.0568601816982371e-07, 'epochs': 345, 'loss': 'mae', 'optimizer': 'adam', 'graph_mode': 'off', 'use_snp_selection': False}. Best is trial 71 with value: 0.3204759444484463.
[I 2025-12-06 08:55:21,040] Trial 141 finished with value: 0.319696604897642 and parameters: {'model_type': 'mlp', 'hidden_dims': '[512, 256]', 'dropout': 0.4566834104043859, 'batch_norm': False, 'lr': 1.1527380316326485e-05, 'weight_decay': 1.247365801603482e-07, 'epochs': 343, 'loss': 'mae', 'optimizer': 'adam', 'graph_mode': 'off', 'use_snp_selection': False}. Best is trial 71 with value: 0.3204759444484463.
[I 2025-12-06 08:56:25,987] Trial 142 finished with value: 0.3142402863198443 and parameters: {'model_type': 'mlp', 'hidden_dims': '[512, 256]', 'dropout': 0.46038457778491443, 'batch_norm': False, 'lr': 1.4102144241766804e-05, 'weight_decay': 1.6159695782141927e-07, 'epochs': 344, 'loss': 'mae', 'optimizer': 'adam', 'graph_mode': 'off', 'use_snp_selection': False}. Best is trial 71 with value: 0.3204759444484463.
[I 2025-12-06 08:57:31,443] Trial 143 finished with value: 0.31467314561994086 and parameters: {'model_type': 'mlp', 'hidden_dims': '[512, 256]', 'dropout': 0.4484718000380144, 'batch_norm': False, 'lr': 1.1962039424785002e-05, 'weight_decay': 8.347847037623447e-06, 'epochs': 345, 'loss': 'mae', 'optimizer': 'adam', 'graph_mode': 'off', 'use_snp_selection': False}. Best is trial 71 with value: 0.3204759444484463.
[I 2025-12-06 08:58:35,529] Trial 144 finished with value: 0.31701864525361223 and parameters: {'model_type': 'mlp', 'hidden_dims': '[512, 256]', 'dropout': 0.4813528769712868, 'batch_norm': False, 'lr': 9.082685442909124e-06, 'weight_decay': 1.0287828346151258e-07, 'epochs': 337, 'loss': 'mae', 'optimizer': 'adam', 'graph_mode': 'off', 'use_snp_selection': False}. Best is trial 71 with value: 0.3204759444484463.
