[I 2025-12-05 16:37:22,424] Trial 50 finished with value: 0.06092818994322329 and parameters: {'model_type': 'mlp', 'hidden_dims': '[128, 64]', 'dropout': 0.2908277461424863, 'batch_norm': True, 'lr': 0.00013282022866337715, 'weight_decay': 0.00016876653524974607, 'epochs': 183, 'loss': 'mae', 'optimizer': 'adam', 'graph_mode': 'off', 'use_snp_selection': True, 'num_snps': 55661}. Best is trial 33 with value: 0.09495280931084094.
[I 2025-12-05 16:37:24,419] Trial 51 finished with value: 0.06498495066073279 and parameters: {'model_type': 'mlp', 'hidden_dims': '[128, 64]', 'dropout': 0.3185961484112068, 'batch_norm': True, 'lr': 0.00023339448205413147, 'weight_decay': 0.00023101197207456327, 'epochs': 250, 'loss': 'mae', 'optimizer': 'adam', 'graph_mode': 'off', 'use_snp_selection': True, 'num_snps': 37616}. Best is trial 33 with value: 0.09495280931084094.
[I 2025-12-05 16:37:26,431] Trial 52 finished with value: 0.07554035872669267 and parameters: {'model_type': 'mlp', 'hidden_dims': '[128, 64]', 'dropout': 0.3006895901244645, 'batch_norm': True, 'lr': 0.0007588334279788728, 'weight_decay': 7.485523656661962e-05, 'epochs': 233, 'loss': 'mae', 'optimizer': 'adam', 'graph_mode': 'off', 'use_snp_selection': True, 'num_snps': 40485}. Best is trial 33 with value: 0.09495280931084094.
[I 2025-12-05 16:37:28,358] Trial 53 finished with value: 0.09752576844108456 and parameters: {'model_type': 'mlp', 'hidden_dims': '[128, 64]', 'dropout': 0.26915643568130354, 'batch_norm': True, 'lr': 0.0002705370484568887, 'weight_decay': 0.00015529576275434797, 'epochs': 221, 'loss': 'mae', 'optimizer': 'adam', 'graph_mode': 'off', 'use_snp_selection': True, 'num_snps': 34874}. Best is trial 53 with value: 0.09752576844108456.
[I 2025-12-05 16:37:30,503] Trial 54 finished with value: 0.07740333957709877 and parameters: {'model_type': 'mlp', 'hidden_dims': '[128, 64]', 'dropout': 0.26799674414499813, 'batch_norm': True, 'lr': 0.00032687884044006586, 'weight_decay': 8.317078249550787e-06, 'epochs': 216, 'loss': 'mae', 'optimizer': 'adam', 'graph_mode': 'off', 'use_snp_selection': True, 'num_snps': 44385}. Best is trial 53 with value: 0.09752576844108456.
[I 2025-12-05 16:37:32,208] Trial 55 finished with value: 0.09502516378763638 and parameters: {'model_type': 'mlp', 'hidden_dims': '[256, 128, 64]', 'dropout': 0.23606228270658436, 'batch_norm': True, 'lr': 0.000480890138249327, 'weight_decay': 0.0008704143801624773, 'epochs': 202, 'loss': 'mae', 'optimizer': 'adam', 'graph_mode': 'off', 'use_snp_selection': True, 'num_snps': 29491}. Best is trial 53 with value: 0.09752576844108456.
[I 2025-12-05 16:37:33,844] Trial 56 finished with value: 0.08419549751380045 and parameters: {'model_type': 'mlp', 'hidden_dims': '[256, 128, 64]', 'dropout': 0.1673664030961149, 'batch_norm': True, 'lr': 0.0007297412296595093, 'weight_decay': 0.0008467319421469535, 'epochs': 199, 'loss': 'mae', 'optimizer': 'adam', 'graph_mode': 'off', 'use_snp_selection': True, 'num_snps': 28380}. Best is trial 53 with value: 0.09752576844108456.
[I 2025-12-05 16:37:35,300] Trial 57 finished with value: 0.07747911445125448 and parameters: {'model_type': 'mlp', 'hidden_dims': '[256, 128, 64]', 'dropout': 0.23844351039856382, 'batch_norm': True, 'lr': 0.0005044228943574369, 'weight_decay': 0.0005888677550221485, 'epochs': 146, 'loss': 'mae', 'optimizer': 'adam', 'graph_mode': 'off', 'use_snp_selection': True, 'num_snps': 24236}. Best is trial 53 with value: 0.09752576844108456.
[I 2025-12-05 16:37:37,083] Trial 58 finished with value: 0.04953678725279332 and parameters: {'model_type': 'mlp', 'hidden_dims': '[256, 128, 64]', 'dropout': 0.20806492264619036, 'batch_norm': False, 'lr': 0.0008145053946086181, 'weight_decay': 3.084787028051107e-05, 'epochs': 179, 'loss': 'mae', 'optimizer': 'adam', 'graph_mode': 'off', 'use_snp_selection': True, 'num_snps': 32725}. Best is trial 53 with value: 0.09752576844108456.
[I 2025-12-05 16:37:38,329] Trial 59 finished with value: 0.09982220214188064 and parameters: {'model_type': 'mlp', 'hidden_dims': '[512, 128]', 'dropout': 0.26528893588389535, 'batch_norm': True, 'lr': 0.00041805906068195504, 'weight_decay': 0.0002918864846993671, 'epochs': 206, 'loss': 'mse', 'optimizer': 'adam', 'graph_mode': 'off', 'use_snp_selection': True, 'num_snps': 15304}. Best is trial 59 with value: 0.09982220214188064.
[I 2025-12-05 16:37:39,509] Trial 60 finished with value: 0.08292487116580351 and parameters: {'model_type': 'mlp', 'hidden_dims': '[512, 128]', 'dropout': 0.2715918202991129, 'batch_norm': True, 'lr': 0.0003084682857747893, 'weight_decay': 0.0003021368153669544, 'epochs': 207, 'loss': 'mse', 'optimizer': 'adam', 'graph_mode': 'off', 'use_snp_selection': True, 'num_snps': 14434}. Best is trial 59 with value: 0.09982220214188064.
[I 2025-12-05 16:37:40,712] Trial 61 finished with value: 0.0879619639767152 and parameters: {'model_type': 'mlp', 'hidden_dims': '[512, 128]', 'dropout': 0.22410677421138797, 'batch_norm': True, 'lr': 0.0004189999100650507, 'weight_decay': 0.00013482842413043298, 'epochs': 220, 'loss': 'mse', 'optimizer': 'adam', 'graph_mode': 'off', 'use_snp_selection': True, 'num_snps': 14743}. Best is trial 59 with value: 0.09982220214188064.
[I 2025-12-05 16:37:41,706] Trial 62 finished with value: 0.07518530898734906 and parameters: {'model_type': 'mlp', 'hidden_dims': '[512, 128]', 'dropout': 0.26507789651686703, 'batch_norm': True, 'lr': 0.0006230949678295954, 'weight_decay': 0.000487719782640284, 'epochs': 190, 'loss': 'mse', 'optimizer': 'adam', 'graph_mode': 'off', 'use_snp_selection': True, 'num_snps': 9674}. Best is trial 59 with value: 0.09982220214188064.
[I 2025-12-05 16:37:43,711] Trial 63 finished with value: 0.083397601308804 and parameters: {'model_type': 'mlp', 'hidden_dims': '[512, 128]', 'dropout': 0.24188587239991033, 'batch_norm': True, 'lr': 0.000198258104004265, 'weight_decay': 0.0002490044239459215, 'epochs': 225, 'loss': 'mse', 'optimizer': 'adam', 'graph_mode': 'off', 'use_snp_selection': True, 'num_snps': 36183}. Best is trial 59 with value: 0.09982220214188064.
[I 2025-12-05 16:37:45,051] Trial 64 finished with value: 0.07544656224768082 and parameters: {'model_type': 'mlp', 'hidden_dims': '[256, 128, 64]', 'dropout': 0.20999553694732426, 'batch_norm': True, 'lr': 0.0005493859748075273, 'weight_decay': 5.7367671294015175e-05, 'epochs': 205, 'loss': 'mse', 'optimizer': 'adam', 'graph_mode': 'off', 'use_snp_selection': True, 'num_snps': 16924}. Best is trial 59 with value: 0.09982220214188064.
[I 2025-12-05 16:37:46,728] Trial 65 finished with value: 0.09825992547966517 and parameters: {'model_type': 'mlp', 'hidden_dims': '[512, 256]', 'dropout': 0.15604738123421377, 'batch_norm': True, 'lr': 0.0008260829079937443, 'weight_decay': 0.0007009356295770914, 'epochs': 155, 'loss': 'mse', 'optimizer': 'adam', 'graph_mode': 'off', 'use_snp_selection': True, 'num_snps': 30531}. Best is trial 59 with value: 0.09982220214188064.
[I 2025-12-05 16:37:48,606] Trial 66 finished with value: 0.11892044442214227 and parameters: {'model_type': 'mlp', 'hidden_dims': '[512, 256]', 'dropout': 0.13048216485427058, 'batch_norm': True, 'lr': 0.0003822585889589598, 'weight_decay': 0.0009405389627218077, 'epochs': 160, 'loss': 'mse', 'optimizer': 'adam', 'graph_mode': 'off', 'use_snp_selection': True, 'num_snps': 34699}. Best is trial 66 with value: 0.11892044442214227.
[I 2025-12-05 16:37:50,482] Trial 67 finished with value: 0.09886655681094979 and parameters: {'model_type': 'mlp', 'hidden_dims': '[512, 256]', 'dropout': 0.12345949449137256, 'batch_norm': True, 'lr': 0.00033995792421811447, 'weight_decay': 0.0008281036150941154, 'epochs': 157, 'loss': 'mse', 'optimizer': 'adam', 'graph_mode': 'off', 'use_snp_selection': True, 'num_snps': 34844}. Best is trial 66 with value: 0.11892044442214227.
[I 2025-12-05 16:37:52,307] Trial 68 finished with value: 0.09316003798218363 and parameters: {'model_type': 'mlp', 'hidden_dims': '[512, 256]', 'dropout': 0.16185076344881333, 'batch_norm': True, 'lr': 0.00039375096123976845, 'weight_decay': 0.0008866224952458596, 'epochs': 157, 'loss': 'mse', 'optimizer': 'adam', 'graph_mode': 'off', 'use_snp_selection': True, 'num_snps': 34759}. Best is trial 66 with value: 0.11892044442214227.
[I 2025-12-05 16:37:53,913] Trial 69 finished with value: 0.09360552034066706 and parameters: {'model_type': 'mlp', 'hidden_dims': '[512, 256]', 'dropout': 0.12557723793385095, 'batch_norm': True, 'lr': 0.00013928721392459208, 'weight_decay': 0.0007255884485225768, 'epochs': 127, 'loss': 'mse', 'optimizer': 'adam', 'graph_mode': 'off', 'use_snp_selection': True, 'num_snps': 30433}. Best is trial 66 with value: 0.11892044442214227.
[I 2025-12-05 16:37:55,332] Trial 70 finished with value: 0.06413354313072728 and parameters: {'model_type': 'mlp', 'hidden_dims': '[512, 256]', 'dropout': 0.11613915646565141, 'batch_norm': False, 'lr': 0.0003527918514472871, 'weight_decay': 0.0004410389074774347, 'epochs': 167, 'loss': 'mse', 'optimizer': 'adam', 'graph_mode': 'off', 'use_snp_selection': True, 'num_snps': 25776}. Best is trial 66 with value: 0.11892044442214227.
[I 2025-12-05 16:37:57,006] Trial 71 finished with value: 0.10644833002790553 and parameters: {'model_type': 'mlp', 'hidden_dims': '[512, 256]', 'dropout': 0.13796509641012536, 'batch_norm': True, 'lr': 0.00029763004089508344, 'weight_decay': 0.00038472235662513296, 'epochs': 119, 'loss': 'mse', 'optimizer': 'adam', 'graph_mode': 'off', 'use_snp_selection': True, 'num_snps': 35469}. Best is trial 66 with value: 0.11892044442214227.
[I 2025-12-05 16:37:58,516] Trial 72 finished with value: 0.11107206831241839 and parameters: {'model_type': 'mlp', 'hidden_dims': '[512, 256]', 'dropout': 0.15104615818087647, 'batch_norm': True, 'lr': 0.00044701598720252664, 'weight_decay': 0.0003581007430596154, 'epochs': 86, 'loss': 'mse', 'optimizer': 'adam', 'graph_mode': 'off', 'use_snp_selection': True, 'num_snps': 30030}. Best is trial 66 with value: 0.11892044442214227.
[I 2025-12-05 16:38:00,289] Trial 73 finished with value: 0.11044674657215568 and parameters: {'model_type': 'mlp', 'hidden_dims': '[512, 256]', 'dropout': 0.14049541790791928, 'batch_norm': True, 'lr': 0.0004468519810896683, 'weight_decay': 0.0006737127722058839, 'epochs': 82, 'loss': 'mse', 'optimizer': 'adam', 'graph_mode': 'off', 'use_snp_selection': True, 'num_snps': 34945}. Best is trial 66 with value: 0.11892044442214227.
[I 2025-12-05 16:38:02,085] Trial 74 finished with value: 0.08464794763127262 and parameters: {'model_type': 'mlp', 'hidden_dims': '[512, 256]', 'dropout': 0.14293919824016263, 'batch_norm': True, 'lr': 0.0006531732978202192, 'weight_decay': 0.0003534489972865968, 'epochs': 86, 'loss': 'mse', 'optimizer': 'adam', 'graph_mode': 'off', 'use_snp_selection': True, 'num_snps': 34614}. Best is trial 66 with value: 0.11892044442214227.
[I 2025-12-05 16:38:03,920] Trial 75 finished with value: 0.10502856526867049 and parameters: {'model_type': 'mlp', 'hidden_dims': '[512, 256]', 'dropout': 0.15459492733871666, 'batch_norm': True, 'lr': 0.00030947244723196444, 'weight_decay': 0.0006578411765097687, 'epochs': 73, 'loss': 'mse', 'optimizer': 'adam', 'graph_mode': 'off', 'use_snp_selection': True, 'num_snps': 35898}. Best is trial 66 with value: 0.11892044442214227.
[I 2025-12-05 16:38:05,525] Trial 76 finished with value: 0.03251035612734203 and parameters: {'model_type': 'mlp', 'hidden_dims': '[512, 256]', 'dropout': 0.15970696357643085, 'batch_norm': True, 'lr': 1.0618598153533742e-05, 'weight_decay': 0.0006593595204655659, 'epochs': 57, 'loss': 'mse', 'optimizer': 'adam', 'graph_mode': 'off', 'use_snp_selection': True, 'num_snps': 31909}. Best is trial 66 with value: 0.11892044442214227.
[I 2025-12-05 16:38:07,491] Trial 77 finished with value: 0.08865805818499191 and parameters: {'model_type': 'mlp', 'hidden_dims': '[512, 256]', 'dropout': 0.12313894978669106, 'batch_norm': True, 'lr': 0.0003647109872187939, 'weight_decay': 0.0004017353846473078, 'epochs': 110, 'loss': 'mse', 'optimizer': 'adam', 'graph_mode': 'off', 'use_snp_selection': True, 'num_snps': 41070}. Best is trial 66 with value: 0.11892044442214227.
[I 2025-12-05 16:38:09,159] Trial 78 finished with value: 0.10144992224598329 and parameters: {'model_type': 'mlp', 'hidden_dims': '[512, 256]', 'dropout': 0.14593477459592907, 'batch_norm': True, 'lr': 0.0004544869688551073, 'weight_decay': 0.0009810130035739545, 'epochs': 96, 'loss': 'mse', 'optimizer': 'adam', 'graph_mode': 'off', 'use_snp_selection': True, 'num_snps': 36081}. Best is trial 66 with value: 0.11892044442214227.
[I 2025-12-05 16:38:10,813] Trial 79 finished with value: 0.06823452788815565 and parameters: {'model_type': 'mlp', 'hidden_dims': '[512, 256]', 'dropout': 0.11313697512641331, 'batch_norm': True, 'lr': 0.00020755497166539063, 'weight_decay': 0.0005138366874029469, 'epochs': 98, 'loss': 'mse', 'optimizer': 'adam', 'graph_mode': 'off', 'use_snp_selection': True, 'num_snps': 35706}. Best is trial 66 with value: 0.11892044442214227.
[I 2025-12-05 16:38:11,514] Trial 80 finished with value: 0.08357678124236124 and parameters: {'model_type': 'mlp', 'hidden_dims': '[512, 256]', 'dropout': 0.14281527947708875, 'batch_norm': True, 'lr': 0.00042670425657412124, 'weight_decay': 0.0002761047160024768, 'epochs': 63, 'loss': 'mse', 'optimizer': 'adam', 'graph_mode': 'off', 'use_snp_selection': True, 'num_snps': 6025}. Best is trial 66 with value: 0.11892044442214227.
[I 2025-12-05 16:38:13,213] Trial 81 finished with value: 0.07629795625157781 and parameters: {'model_type': 'mlp', 'hidden_dims': '[512, 256]', 'dropout': 0.1483733011867304, 'batch_norm': True, 'lr': 0.000533184172614351, 'weight_decay': 0.000692525302550346, 'epochs': 83, 'loss': 'mse', 'optimizer': 'adam', 'graph_mode': 'off', 'use_snp_selection': True, 'num_snps': 37589}. Best is trial 66 with value: 0.11892044442214227.
[I 2025-12-05 16:38:14,981] Trial 82 finished with value: 0.09035909733716867 and parameters: {'model_type': 'mlp', 'hidden_dims': '[512, 256]', 'dropout': 0.17958409888168375, 'batch_norm': True, 'lr': 0.0007471792137734355, 'weight_decay': 0.000931143066644271, 'epochs': 122, 'loss': 'mse', 'optimizer': 'adam', 'graph_mode': 'off', 'use_snp_selection': True, 'num_snps': 32727}. Best is trial 66 with value: 0.11892044442214227.
[I 2025-12-05 16:38:15,670] Trial 83 finished with value: 0.06913746795173735 and parameters: {'model_type': 'mlp', 'hidden_dims': '[512, 256]', 'dropout': 0.13198105490822368, 'batch_norm': True, 'lr': 0.0003076914968302448, 'weight_decay': 0.0009665578064362929, 'epochs': 96, 'loss': 'mse', 'optimizer': 'adam', 'graph_mode': 'off', 'use_snp_selection': True, 'num_snps': 2253}. Best is trial 66 with value: 0.11892044442214227.
[I 2025-12-05 16:38:17,657] Trial 84 finished with value: 0.09095830692563728 and parameters: {'model_type': 'mlp', 'hidden_dims': '[512, 256]', 'dropout': 0.1066614751582279, 'batch_norm': True, 'lr': 0.0005868062769185208, 'weight_decay': 0.0005772892742538343, 'epochs': 74, 'loss': 'mse', 'optimizer': 'adam', 'graph_mode': 'off', 'use_snp_selection': True, 'num_snps': 40177}. Best is trial 66 with value: 0.11892044442214227.
[I 2025-12-05 16:38:19,105] Trial 85 finished with value: 0.08840533845278732 and parameters: {'model_type': 'mlp', 'hidden_dims': '[512, 256]', 'dropout': 0.15154148947716517, 'batch_norm': True, 'lr': 0.00099836845381753, 'weight_decay': 0.0007442115275314414, 'epochs': 41, 'loss': 'mse', 'optimizer': 'adam', 'graph_mode': 'off', 'use_snp_selection': True, 'num_snps': 27675}. Best is trial 66 with value: 0.11892044442214227.
[I 2025-12-05 16:38:20,894] Trial 86 finished with value: 0.08442415223451352 and parameters: {'model_type': 'mlp', 'hidden_dims': '[512, 256]', 'dropout': 0.1738354692699392, 'batch_norm': True, 'lr': 0.0004596358189591872, 'weight_decay': 0.0003633927766931235, 'epochs': 101, 'loss': 'mse', 'optimizer': 'adam', 'graph_mode': 'off', 'use_snp_selection': True, 'num_snps': 36981}. Best is trial 66 with value: 0.11892044442214227.
[I 2025-12-05 16:38:22,510] Trial 87 finished with value: 0.09707046272135594 and parameters: {'model_type': 'mlp', 'hidden_dims': '[512, 256]', 'dropout': 0.13699655372274322, 'batch_norm': True, 'lr': 0.0003547506542692394, 'weight_decay': 0.0005210116277274079, 'epochs': 119, 'loss': 'mse', 'optimizer': 'adam', 'graph_mode': 'off', 'use_snp_selection': True, 'num_snps': 33438}. Best is trial 66 with value: 0.11892044442214227.
[I 2025-12-05 16:38:23,930] Trial 88 finished with value: 0.05070175259824124 and parameters: {'model_type': 'mlp', 'hidden_dims': '[512, 256]', 'dropout': 0.12032185706959445, 'batch_norm': False, 'lr': 0.0001613201487946573, 'weight_decay': 0.0002117001154221105, 'epochs': 58, 'loss': 'mse', 'optimizer': 'adam', 'graph_mode': 'off', 'use_snp_selection': True, 'num_snps': 30262}. Best is trial 66 with value: 0.11892044442214227.
[I 2025-12-05 16:38:25,929] Trial 89 finished with value: 0.09388664406855814 and parameters: {'model_type': 'mlp', 'hidden_dims': '[512, 256]', 'dropout': 0.10040381377254487, 'batch_norm': True, 'lr': 0.000678821379953392, 'weight_decay': 0.000300086814220987, 'epochs': 87, 'loss': 'mse', 'optimizer': 'adam', 'graph_mode': 'off', 'use_snp_selection': True, 'num_snps': 44535}. Best is trial 66 with value: 0.11892044442214227.
[I 2025-12-05 16:38:28,101] Trial 90 finished with value: 0.017367676359912234 and parameters: {'model_type': 'mlp', 'hidden_dims': '[512, 256]', 'dropout': 0.16021458685912063, 'batch_norm': True, 'lr': 2.290642450232906e-06, 'weight_decay': 0.0006705351458357761, 'epochs': 141, 'loss': 'mse', 'optimizer': 'adam', 'graph_mode': 'off', 'use_snp_selection': True, 'num_snps': 41758}. Best is trial 66 with value: 0.11892044442214227.
