[I 2025-12-05 20:59:57,745] Trial 117 finished with value: 0.2965313754428903 and parameters: {'model_type': 'mlp', 'hidden_dims': '[512, 64]', 'dropout': 0.37747481274419176, 'batch_norm': False, 'lr': 2.3766908704002025e-06, 'weight_decay': 6.134259536163927e-05, 'epochs': 245, 'loss': 'mse', 'optimizer': 'adam', 'graph_mode': 'off', 'use_snp_selection': False}. Best is trial 96 with value: 0.30102989585135365.
[I 2025-12-05 21:00:48,306] Trial 118 finished with value: 0.3008074341497351 and parameters: {'model_type': 'mlp', 'hidden_dims': '[512, 64]', 'dropout': 0.333770540157584, 'batch_norm': False, 'lr': 2.7902569261664145e-06, 'weight_decay': 0.00012815859744715838, 'epochs': 260, 'loss': 'mse', 'optimizer': 'adam', 'graph_mode': 'off', 'use_snp_selection': False}. Best is trial 96 with value: 0.30102989585135365.
[I 2025-12-05 21:01:40,652] Trial 119 finished with value: 0.296279188291404 and parameters: {'model_type': 'mlp', 'hidden_dims': '[512, 64]', 'dropout': 0.3204743456150143, 'batch_norm': False, 'lr': 1.9544583642078295e-06, 'weight_decay': 7.613679512010762e-05, 'epochs': 270, 'loss': 'mse', 'optimizer': 'adam', 'graph_mode': 'off', 'use_snp_selection': False}. Best is trial 96 with value: 0.30102989585135365.
[I 2025-12-05 21:02:26,795] Trial 120 finished with value: 0.29361124292464047 and parameters: {'model_type': 'mlp', 'hidden_dims': '[512, 256]', 'dropout': 0.33751270519899734, 'batch_norm': False, 'lr': 1.4420899186643582e-06, 'weight_decay': 0.00013504372543941506, 'epochs': 233, 'loss': 'mse', 'optimizer': 'adam', 'graph_mode': 'off', 'use_snp_selection': False}. Best is trial 96 with value: 0.30102989585135365.
[I 2025-12-05 21:03:17,228] Trial 121 finished with value: 0.28361483247792824 and parameters: {'model_type': 'mlp', 'hidden_dims': '[512, 64]', 'dropout': 0.3873190049198038, 'batch_norm': False, 'lr': 1.1183550580228923e-06, 'weight_decay': 0.00011051705227366409, 'epochs': 259, 'loss': 'mse', 'optimizer': 'adam', 'graph_mode': 'off', 'use_snp_selection': False}. Best is trial 96 with value: 0.30102989585135365.
[I 2025-12-05 21:04:08,200] Trial 122 finished with value: 0.29632262313313945 and parameters: {'model_type': 'mlp', 'hidden_dims': '[512, 64]', 'dropout': 0.3494174513510044, 'batch_norm': False, 'lr': 2.754736086181105e-06, 'weight_decay': 0.00010042561691689545, 'epochs': 262, 'loss': 'mse', 'optimizer': 'adam', 'graph_mode': 'off', 'use_snp_selection': False}. Best is trial 96 with value: 0.30102989585135365.
[I 2025-12-05 21:04:57,922] Trial 123 finished with value: 0.29814334663517733 and parameters: {'model_type': 'mlp', 'hidden_dims': '[512, 64]', 'dropout': 0.3999776428180948, 'batch_norm': False, 'lr': 3.3885331394407594e-06, 'weight_decay': 4.9064900624051854e-05, 'epochs': 255, 'loss': 'mse', 'optimizer': 'adam', 'graph_mode': 'off', 'use_snp_selection': False}. Best is trial 96 with value: 0.30102989585135365.
[I 2025-12-05 21:05:46,273] Trial 124 finished with value: 0.2931710364594935 and parameters: {'model_type': 'mlp', 'hidden_dims': '[512, 64]', 'dropout': 0.35879415853251045, 'batch_norm': False, 'lr': 3.580029700030915e-06, 'weight_decay': 3.7732652340280634e-05, 'epochs': 247, 'loss': 'mse', 'optimizer': 'adam', 'graph_mode': 'off', 'use_snp_selection': False}. Best is trial 96 with value: 0.30102989585135365.
[I 2025-12-05 21:06:36,044] Trial 125 finished with value: 0.2938659941261843 and parameters: {'model_type': 'mlp', 'hidden_dims': '[512, 64]', 'dropout': 0.3811916347387764, 'batch_norm': False, 'lr': 2.950625455051083e-06, 'weight_decay': 4.8199231930864864e-05, 'epochs': 255, 'loss': 'mse', 'optimizer': 'adam', 'graph_mode': 'off', 'use_snp_selection': False}. Best is trial 96 with value: 0.30102989585135365.
[I 2025-12-05 21:07:28,112] Trial 126 finished with value: 0.29416316558655364 and parameters: {'model_type': 'mlp', 'hidden_dims': '[512, 64]', 'dropout': 0.28790592743609533, 'batch_norm': False, 'lr': 3.3307827860207692e-06, 'weight_decay': 0.00023225892493357344, 'epochs': 268, 'loss': 'mse', 'optimizer': 'adam', 'graph_mode': 'off', 'use_snp_selection': False}. Best is trial 96 with value: 0.30102989585135365.
[I 2025-12-05 21:08:10,708] Trial 127 finished with value: 0.2980869743116913 and parameters: {'model_type': 'mlp', 'hidden_dims': '[512, 64]', 'dropout': 0.3278851338554065, 'batch_norm': False, 'lr': 2.6405272559346605e-06, 'weight_decay': 2.328767738162213e-05, 'epochs': 214, 'loss': 'mse', 'optimizer': 'adam', 'graph_mode': 'off', 'use_snp_selection': False}. Best is trial 96 with value: 0.30102989585135365.
[I 2025-12-05 21:08:34,872] Trial 128 finished with value: 0.2671854384334822 and parameters: {'model_type': 'mlp', 'hidden_dims': '[256, 128]', 'dropout': 0.36541233022306924, 'batch_norm': True, 'lr': 4.025150066040241e-06, 'weight_decay': 2.4206557356871374e-05, 'epochs': 212, 'loss': 'mse', 'optimizer': 'adam', 'graph_mode': 'off', 'use_snp_selection': False}. Best is trial 96 with value: 0.30102989585135365.
[I 2025-12-05 21:09:18,434] Trial 129 finished with value: 0.29818131397510206 and parameters: {'model_type': 'mlp', 'hidden_dims': '[512, 64]', 'dropout': 0.3399439292774557, 'batch_norm': False, 'lr': 1.8661560697389427e-06, 'weight_decay': 6.123014197979756e-05, 'epochs': 220, 'loss': 'mse', 'optimizer': 'adam', 'graph_mode': 'off', 'use_snp_selection': False}. Best is trial 96 with value: 0.30102989585135365.
[I 2025-12-05 21:09:57,494] Trial 130 finished with value: 0.2916124382457377 and parameters: {'model_type': 'mlp', 'hidden_dims': '[512, 64]', 'dropout': 0.23799245415392467, 'batch_norm': False, 'lr': 1.2862659188091614e-06, 'weight_decay': 6.67192062629808e-05, 'epochs': 194, 'loss': 'mse', 'optimizer': 'adam', 'graph_mode': 'off', 'use_snp_selection': False}. Best is trial 96 with value: 0.30102989585135365.
[I 2025-12-05 21:10:40,403] Trial 131 finished with value: 0.29671727952021787 and parameters: {'model_type': 'mlp', 'hidden_dims': '[512, 64]', 'dropout': 0.33717151621227076, 'batch_norm': False, 'lr': 1.6202635737859672e-06, 'weight_decay': 3.440372047428532e-05, 'epochs': 216, 'loss': 'mse', 'optimizer': 'adam', 'graph_mode': 'off', 'use_snp_selection': False}. Best is trial 96 with value: 0.30102989585135365.
[I 2025-12-05 21:11:20,367] Trial 132 finished with value: 0.2930677148067572 and parameters: {'model_type': 'mlp', 'hidden_dims': '[512, 64]', 'dropout': 0.30969855324592194, 'batch_norm': False, 'lr': 1.9021417716486055e-06, 'weight_decay': 4.81781013253002e-05, 'epochs': 199, 'loss': 'mse', 'optimizer': 'adam', 'graph_mode': 'off', 'use_snp_selection': False}. Best is trial 96 with value: 0.30102989585135365.
[I 2025-12-05 21:12:04,529] Trial 133 finished with value: 0.296763589938161 and parameters: {'model_type': 'mlp', 'hidden_dims': '[512, 64]', 'dropout': 0.3279455296811884, 'batch_norm': False, 'lr': 2.5982626648421213e-06, 'weight_decay': 8.273909995069149e-05, 'epochs': 223, 'loss': 'mse', 'optimizer': 'adam', 'graph_mode': 'off', 'use_snp_selection': False}. Best is trial 96 with value: 0.30102989585135365.
[I 2025-12-05 21:12:40,274] Trial 134 finished with value: 0.2971306589236739 and parameters: {'model_type': 'mlp', 'hidden_dims': '[512, 64]', 'dropout': 0.32966533666557335, 'batch_norm': False, 'lr': 2.9942231054540837e-06, 'weight_decay': 6.348914924717492e-05, 'epochs': 175, 'loss': 'mse', 'optimizer': 'adam', 'graph_mode': 'off', 'use_snp_selection': False}. Best is trial 96 with value: 0.30102989585135365.
[I 2025-12-05 21:13:25,453] Trial 135 finished with value: 0.3025140777785166 and parameters: {'model_type': 'mlp', 'hidden_dims': '[512, 64]', 'dropout': 0.2940442054047911, 'batch_norm': False, 'lr': 2.2365027011992993e-06, 'weight_decay': 5.4832314885214426e-05, 'epochs': 229, 'loss': 'mse', 'optimizer': 'adam', 'graph_mode': 'off', 'use_snp_selection': False}. Best is trial 135 with value: 0.3025140777785166.
[I 2025-12-05 21:14:12,050] Trial 136 finished with value: 0.2697203206266227 and parameters: {'model_type': 'mlp', 'hidden_dims': '[512, 64]', 'dropout': 0.27084212491860893, 'batch_norm': False, 'lr': 2.084729864064287e-06, 'weight_decay': 2.965605642650693e-05, 'epochs': 237, 'loss': 'mae', 'optimizer': 'adam', 'graph_mode': 'off', 'use_snp_selection': False}. Best is trial 135 with value: 0.3025140777785166.
[I 2025-12-05 21:14:57,242] Trial 137 finished with value: 0.295068686127152 and parameters: {'model_type': 'mlp', 'hidden_dims': '[512, 64]', 'dropout': 0.2559394090188922, 'batch_norm': False, 'lr': 3.842893346602891e-06, 'weight_decay': 5.265851334976235e-05, 'epochs': 229, 'loss': 'mse', 'optimizer': 'adam', 'graph_mode': 'off', 'use_snp_selection': False}. Best is trial 135 with value: 0.3025140777785166.
[I 2025-12-05 21:15:46,292] Trial 138 finished with value: 0.29409725918527974 and parameters: {'model_type': 'mlp', 'hidden_dims': '[512, 256]', 'dropout': 0.4048649665725554, 'batch_norm': False, 'lr': 1.4908203863346414e-06, 'weight_decay': 0.0006124583252256176, 'epochs': 250, 'loss': 'mse', 'optimizer': 'adam', 'graph_mode': 'off', 'use_snp_selection': False}. Best is trial 135 with value: 0.3025140777785166.
[I 2025-12-05 21:16:34,253] Trial 139 finished with value: 0.2943384764583471 and parameters: {'model_type': 'mlp', 'hidden_dims': '[512, 64]', 'dropout': 0.34405282384369945, 'batch_norm': False, 'lr': 2.2155139284383776e-06, 'weight_decay': 0.0008088128680830106, 'epochs': 245, 'loss': 'mse', 'optimizer': 'adam', 'graph_mode': 'off', 'use_snp_selection': False}. Best is trial 135 with value: 0.3025140777785166.
[I 2025-12-05 21:17:27,132] Trial 140 finished with value: 0.2879495591111549 and parameters: {'model_type': 'mlp', 'hidden_dims': '[512, 64]', 'dropout': 0.2954037881585815, 'batch_norm': False, 'lr': 7.431012815382946e-06, 'weight_decay': 4.103684882051842e-05, 'epochs': 273, 'loss': 'mse', 'optimizer': 'adam', 'graph_mode': 'off', 'use_snp_selection': False}. Best is trial 135 with value: 0.3025140777785166.
[I 2025-12-05 21:18:08,680] Trial 141 finished with value: 0.29999718559220706 and parameters: {'model_type': 'mlp', 'hidden_dims': '[512, 64]', 'dropout': 0.3550266475213172, 'batch_norm': False, 'lr': 2.6676274919513865e-06, 'weight_decay': 2.4391357596786496e-05, 'epochs': 208, 'loss': 'mse', 'optimizer': 'adam', 'graph_mode': 'off', 'use_snp_selection': False}. Best is trial 135 with value: 0.3025140777785166.
[I 2025-12-05 21:18:53,396] Trial 142 finished with value: 0.2975463027152669 and parameters: {'model_type': 'mlp', 'hidden_dims': '[512, 64]', 'dropout': 0.3515855206097145, 'batch_norm': False, 'lr': 3.2070720099762137e-06, 'weight_decay': 6.225153478572941e-05, 'epochs': 226, 'loss': 'mse', 'optimizer': 'adam', 'graph_mode': 'off', 'use_snp_selection': False}. Best is trial 135 with value: 0.3025140777785166.
[I 2025-12-05 21:19:34,572] Trial 143 finished with value: 0.2868449445555712 and parameters: {'model_type': 'mlp', 'hidden_dims': '[512, 64]', 'dropout': 0.35708569773321486, 'batch_norm': False, 'lr': 1.8147549110525753e-06, 'weight_decay': 7.933451569440808e-05, 'epochs': 206, 'loss': 'mse', 'optimizer': 'adam', 'graph_mode': 'off', 'use_snp_selection': False}. Best is trial 135 with value: 0.3025140777785166.
[I 2025-12-05 21:20:25,899] Trial 144 finished with value: 0.2917914914528676 and parameters: {'model_type': 'mlp', 'hidden_dims': '[512, 64]', 'dropout': 0.3743221028210567, 'batch_norm': False, 'lr': 5.3279515370107475e-06, 'weight_decay': 4.271064487645041e-05, 'epochs': 264, 'loss': 'mse', 'optimizer': 'adam', 'graph_mode': 'off', 'use_snp_selection': False}. Best is trial 135 with value: 0.3025140777785166.
[I 2025-12-05 21:21:21,103] Trial 145 finished with value: 0.291893242837146 and parameters: {'model_type': 'mlp', 'hidden_dims': '[512, 64]', 'dropout': 0.3950634642834214, 'batch_norm': False, 'lr': 4.464753996137504e-06, 'weight_decay': 0.00012557615840271815, 'epochs': 286, 'loss': 'mse', 'optimizer': 'adam', 'graph_mode': 'off', 'use_snp_selection': False}. Best is trial 135 with value: 0.3025140777785166.
[I 2025-12-05 21:22:01,632] Trial 146 finished with value: 0.29720806252023635 and parameters: {'model_type': 'mlp', 'hidden_dims': '[512, 64]', 'dropout': 0.3184804905445097, 'batch_norm': False, 'lr': 2.4753309496598626e-06, 'weight_decay': 0.0004059756719949372, 'epochs': 202, 'loss': 'mse', 'optimizer': 'adam', 'graph_mode': 'off', 'use_snp_selection': False}. Best is trial 135 with value: 0.3025140777785166.
[I 2025-12-05 21:22:26,286] Trial 147 finished with value: 0.29556875070550837 and parameters: {'model_type': 'mlp', 'hidden_dims': '[256, 128]', 'dropout': 0.3785519410661596, 'batch_norm': False, 'lr': 3.6886394121883682e-06, 'weight_decay': 2.027714756660529e-05, 'epochs': 219, 'loss': 'mse', 'optimizer': 'adam', 'graph_mode': 'off', 'use_snp_selection': False}. Best is trial 135 with value: 0.3025140777785166.
[I 2025-12-05 21:23:12,862] Trial 148 finished with value: 0.2955793610913771 and parameters: {'model_type': 'mlp', 'hidden_dims': '[512, 64]', 'dropout': 0.46464109375732443, 'batch_norm': False, 'lr': 2.8314125149101335e-06, 'weight_decay': 3.170716037849683e-05, 'epochs': 237, 'loss': 'mse', 'optimizer': 'adam', 'graph_mode': 'off', 'use_snp_selection': False}. Best is trial 135 with value: 0.3025140777785166.
[I 2025-12-05 21:24:22,537] Trial 149 finished with value: 0.2990860414876787 and parameters: {'model_type': 'mlp', 'hidden_dims': '[512, 64]', 'dropout': 0.414656761932345, 'batch_norm': False, 'lr': 4.142979529196509e-06, 'weight_decay': 9.409100961088565e-05, 'epochs': 242, 'loss': 'mse', 'optimizer': 'adam', 'graph_mode': 'off', 'use_snp_selection': True, 'num_snps': 50801}. Best is trial 135 with value: 0.3025140777785166.
[I 2025-12-05 21:25:18,984] Trial 0 finished with value: 0.23678372805400666 and parameters: {'model_type': 'mlp', 'hidden_dims': '[128, 64]', 'dropout': 0.199031432379812, 'batch_norm': True, 'lr': 1.8408544111075837e-06, 'weight_decay': 5.5136510071208614e-05, 'epochs': 336, 'loss': 'mae', 'optimizer': 'adam', 'graph_mode': 'off', 'use_snp_selection': True, 'num_snps': 43862}. Best is trial 0 with value: 0.23678372805400666.
[I 2025-12-05 21:25:45,631] Trial 1 finished with value: 0.27552173564737287 and parameters: {'model_type': 'mlp', 'hidden_dims': '[256, 128]', 'dropout': 0.4370668075331726, 'batch_norm': True, 'lr': 7.133471581159139e-05, 'weight_decay': 1.128633586803549e-05, 'epochs': 242, 'loss': 'mae', 'optimizer': 'adam', 'graph_mode': 'off', 'use_snp_selection': False}. Best is trial 1 with value: 0.27552173564737287.
[I 2025-12-05 21:26:12,121] Trial 2 finished with value: 0.23446777276033134 and parameters: {'model_type': 'mlp', 'hidden_dims': '[256, 128, 64]', 'dropout': 0.41314357415569625, 'batch_norm': False, 'lr': 3.952233718592101e-06, 'weight_decay': 0.00026754769258252603, 'epochs': 149, 'loss': 'mse', 'optimizer': 'adam', 'graph_mode': 'off', 'use_snp_selection': True, 'num_snps': 11571}. Best is trial 1 with value: 0.27552173564737287.
[I 2025-12-05 21:27:12,740] Trial 3 finished with value: 0.2898352607031641 and parameters: {'model_type': 'mlp', 'hidden_dims': '[512, 64]', 'dropout': 0.5938127374509361, 'batch_norm': False, 'lr': 5.67704586114731e-06, 'weight_decay': 2.4518087630137052e-05, 'epochs': 320, 'loss': 'mae', 'optimizer': 'adam', 'graph_mode': 'off', 'use_snp_selection': False}. Best is trial 3 with value: 0.2898352607031641.
[I 2025-12-05 21:28:13,079] Trial 4 finished with value: 0.2685422391668701 and parameters: {'model_type': 'mlp', 'hidden_dims': '[512, 128]', 'dropout': 0.25746343592134413, 'batch_norm': True, 'lr': 1.3467657668402788e-06, 'weight_decay': 0.00033087251918647806, 'epochs': 277, 'loss': 'mse', 'optimizer': 'adam', 'graph_mode': 'off', 'use_snp_selection': True, 'num_snps': 36675}. Best is trial 3 with value: 0.2898352607031641.
[I 2025-12-05 21:28:55,933] Trial 5 finished with value: 0.25211026084479704 and parameters: {'model_type': 'mlp', 'hidden_dims': '[512, 64]', 'dropout': 0.38275350994408375, 'batch_norm': True, 'lr': 1.5586664309232824e-06, 'weight_decay': 0.0008227664668621182, 'epochs': 145, 'loss': 'mae', 'optimizer': 'adam', 'graph_mode': 'off', 'use_snp_selection': True, 'num_snps': 32148}. Best is trial 3 with value: 0.2898352607031641.
[I 2025-12-05 21:29:18,531] Trial 6 finished with value: 0.28421727542284647 and parameters: {'model_type': 'mlp', 'hidden_dims': '[256, 128]', 'dropout': 0.3930109900265879, 'batch_norm': False, 'lr': 4.892964372128395e-05, 'weight_decay': 1.5809549317992182e-06, 'epochs': 199, 'loss': 'mse', 'optimizer': 'adam', 'graph_mode': 'off', 'use_snp_selection': False}. Best is trial 3 with value: 0.2898352607031641.
[I 2025-12-05 21:29:40,816] Trial 7 finished with value: 0.27435302552255064 and parameters: {'model_type': 'mlp', 'hidden_dims': '[512, 256]', 'dropout': 0.15343979219678458, 'batch_norm': True, 'lr': 6.234003099047341e-05, 'weight_decay': 3.894760610535477e-07, 'epochs': 97, 'loss': 'mse', 'optimizer': 'adam', 'graph_mode': 'off', 'use_snp_selection': False}. Best is trial 3 with value: 0.2898352607031641.
[I 2025-12-05 21:30:40,873] Trial 8 finished with value: 0.2788622467922081 and parameters: {'model_type': 'mlp', 'hidden_dims': '[512, 128]', 'dropout': 0.10743001231661406, 'batch_norm': True, 'lr': 0.00023728538449271062, 'weight_decay': 1.7629071578048637e-05, 'epochs': 312, 'loss': 'mae', 'optimizer': 'adam', 'graph_mode': 'off', 'use_snp_selection': False}. Best is trial 3 with value: 0.2898352607031641.
[I 2025-12-05 21:31:16,749] Trial 9 finished with value: 0.28074288882134146 and parameters: {'model_type': 'mlp', 'hidden_dims': '[512, 64]', 'dropout': 0.14505336736221927, 'batch_norm': True, 'lr': 5.8619638388111826e-05, 'weight_decay': 6.200156172669308e-07, 'epochs': 175, 'loss': 'mse', 'optimizer': 'adam', 'graph_mode': 'off', 'use_snp_selection': False}. Best is trial 3 with value: 0.2898352607031641.
[I 2025-12-05 21:31:31,479] Trial 10 finished with value: 0.22847436469581503 and parameters: {'model_type': 'mlp', 'hidden_dims': '[512, 64]', 'dropout': 0.5885461262002587, 'batch_norm': False, 'lr': 8.769366258768696e-06, 'weight_decay': 2.78273193871783e-06, 'epochs': 55, 'loss': 'mae', 'optimizer': 'adam', 'graph_mode': 'off', 'use_snp_selection': False}. Best is trial 3 with value: 0.2898352607031641.
[I 2025-12-05 21:31:57,024] Trial 11 finished with value: 0.28981501935080073 and parameters: {'model_type': 'mlp', 'hidden_dims': '[256, 128]', 'dropout': 0.583942291816117, 'batch_norm': False, 'lr': 1.422933652790185e-05, 'weight_decay': 2.805519019095577e-06, 'epochs': 231, 'loss': 'mse', 'optimizer': 'adam', 'graph_mode': 'off', 'use_snp_selection': False}. Best is trial 3 with value: 0.2898352607031641.
[I 2025-12-05 21:32:22,783] Trial 12 finished with value: 0.2880148331969433 and parameters: {'model_type': 'mlp', 'hidden_dims': '[256, 128]', 'dropout': 0.593097749012682, 'batch_norm': False, 'lr': 1.1374686318732863e-05, 'weight_decay': 1.3081036432574914e-07, 'epochs': 233, 'loss': 'mae', 'optimizer': 'adam', 'graph_mode': 'off', 'use_snp_selection': False}. Best is trial 3 with value: 0.2898352607031641.
[I 2025-12-05 21:32:41,817] Trial 13 finished with value: 0.28971771953969744 and parameters: {'model_type': 'mlp', 'hidden_dims': '[128, 64]', 'dropout': 0.5043641748401543, 'batch_norm': False, 'lr': 1.4304506621636526e-05, 'weight_decay': 4.373608364627903e-05, 'epochs': 285, 'loss': 'mse', 'optimizer': 'adam', 'graph_mode': 'off', 'use_snp_selection': False}. Best is trial 3 with value: 0.2898352607031641.
[I 2025-12-05 21:33:47,450] Trial 14 finished with value: 0.2888324629784718 and parameters: {'model_type': 'mlp', 'hidden_dims': '[512, 256]', 'dropout': 0.5300180653494536, 'batch_norm': False, 'lr': 5.096356034191146e-06, 'weight_decay': 3.5579647976315255e-06, 'epochs': 345, 'loss': 'mse', 'optimizer': 'adam', 'graph_mode': 'off', 'use_snp_selection': False}. Best is trial 3 with value: 0.2898352607031641.
[I 2025-12-05 21:34:14,692] Trial 15 finished with value: 0.2862617628757781 and parameters: {'model_type': 'mlp', 'hidden_dims': '[256, 128, 64]', 'dropout': 0.29817671914947536, 'batch_norm': False, 'lr': 1.8411764708572348e-05, 'weight_decay': 5.343087596659364e-05, 'epochs': 248, 'loss': 'mae', 'optimizer': 'adam', 'graph_mode': 'off', 'use_snp_selection': False}. Best is trial 3 with value: 0.2898352607031641.
[I 2025-12-05 21:34:46,271] Trial 16 finished with value: 0.2708952821188565 and parameters: {'model_type': 'mlp', 'hidden_dims': '[256, 128]', 'dropout': 0.4992385332513618, 'batch_norm': False, 'lr': 0.00017549215405955411, 'weight_decay': 6.80662468241148e-06, 'epochs': 298, 'loss': 'mse', 'optimizer': 'adam', 'graph_mode': 'off', 'use_snp_selection': False}. Best is trial 3 with value: 0.2898352607031641.
[I 2025-12-05 21:35:26,436] Trial 17 finished with value: 0.12775438908535758 and parameters: {'model_type': 'mlp', 'hidden_dims': '[512, 64]', 'dropout': 0.543474321376226, 'batch_norm': False, 'lr': 0.000906375209920231, 'weight_decay': 1.2403128387387171e-06, 'epochs': 202, 'loss': 'mae', 'optimizer': 'adam', 'graph_mode': 'off', 'use_snp_selection': False}. Best is trial 3 with value: 0.2898352607031641.
[I 2025-12-05 21:36:25,306] Trial 18 finished with value: 0.292005467600474 and parameters: {'model_type': 'mlp', 'hidden_dims': '[256, 128]', 'dropout': 0.4928065509878574, 'batch_norm': False, 'lr': 3.8282888633697165e-06, 'weight_decay': 1.4785860713169379e-05, 'epochs': 263, 'loss': 'mse', 'optimizer': 'adam', 'graph_mode': 'off', 'use_snp_selection': True, 'num_snps': 58241}. Best is trial 18 with value: 0.292005467600474.
