[I 2025-12-05 22:54:01,037] Trial 17 finished with value: 0.30471533179497007 and parameters: {'model_type': 'mlp', 'hidden_dims': '[512, 64]', 'dropout': 0.17958502443247115, 'batch_norm': False, 'lr': 0.00015757341301155474, 'weight_decay': 6.503919561253859e-06, 'epochs': 287, 'loss': 'mae', 'optimizer': 'adam', 'graph_mode': 'off', 'use_snp_selection': False}. Best is trial 3 with value: 0.3109150115799696.
[I 2025-12-05 22:55:12,821] Trial 18 finished with value: 0.30239602364307905 and parameters: {'model_type': 'mlp', 'hidden_dims': '[512, 256]', 'dropout': 0.5139576333133464, 'batch_norm': False, 'lr': 0.0006372689902154905, 'weight_decay': 3.5038679530849885e-07, 'epochs': 214, 'loss': 'mse', 'optimizer': 'adam', 'graph_mode': 'off', 'use_snp_selection': True, 'num_snps': 58241}. Best is trial 3 with value: 0.3109150115799696.
[I 2025-12-05 22:55:39,916] Trial 19 finished with value: 0.28152396630292537 and parameters: {'model_type': 'mlp', 'hidden_dims': '[512, 64]', 'dropout': 0.21972527923816063, 'batch_norm': True, 'lr': 3.502882181800776e-06, 'weight_decay': 2.8130326038007742e-05, 'epochs': 125, 'loss': 'mae', 'optimizer': 'adam', 'graph_mode': 'off', 'use_snp_selection': False}. Best is trial 3 with value: 0.3109150115799696.
[I 2025-12-05 22:56:31,214] Trial 20 finished with value: 0.30585122160169126 and parameters: {'model_type': 'mlp', 'hidden_dims': '[512, 128]', 'dropout': 0.3400065648259248, 'batch_norm': False, 'lr': 2.3361432915417936e-05, 'weight_decay': 0.00015711537877451736, 'epochs': 266, 'loss': 'mae', 'optimizer': 'adam', 'graph_mode': 'off', 'use_snp_selection': False}. Best is trial 3 with value: 0.3109150115799696.
[I 2025-12-05 22:57:32,384] Trial 21 finished with value: 0.3075093770146087 and parameters: {'model_type': 'mlp', 'hidden_dims': '[512, 128]', 'dropout': 0.10128168781903274, 'batch_norm': True, 'lr': 0.00023076784501907524, 'weight_decay': 1.281711767721596e-05, 'epochs': 319, 'loss': 'mae', 'optimizer': 'adam', 'graph_mode': 'off', 'use_snp_selection': False}. Best is trial 3 with value: 0.3109150115799696.
[I 2025-12-05 22:58:30,914] Trial 22 finished with value: 0.3066914486242921 and parameters: {'model_type': 'mlp', 'hidden_dims': '[512, 128]', 'dropout': 0.10449324692222597, 'batch_norm': True, 'lr': 0.00031823610895294867, 'weight_decay': 1.9270192035675102e-05, 'epochs': 304, 'loss': 'mae', 'optimizer': 'adam', 'graph_mode': 'off', 'use_snp_selection': False}. Best is trial 3 with value: 0.3109150115799696.
[I 2025-12-05 22:59:31,733] Trial 23 finished with value: 0.30814246422042374 and parameters: {'model_type': 'mlp', 'hidden_dims': '[512, 128]', 'dropout': 0.16005014567332465, 'batch_norm': True, 'lr': 8.342787146249289e-05, 'weight_decay': 6.041903558187218e-06, 'epochs': 317, 'loss': 'mae', 'optimizer': 'adam', 'graph_mode': 'off', 'use_snp_selection': False}. Best is trial 3 with value: 0.3109150115799696.
[I 2025-12-05 22:59:52,012] Trial 24 finished with value: 0.30733651544737595 and parameters: {'model_type': 'mlp', 'hidden_dims': '[256, 128, 64]', 'dropout': 0.12932822753058773, 'batch_norm': True, 'lr': 0.00010659720373605358, 'weight_decay': 1.5116983557601256e-06, 'epochs': 169, 'loss': 'mae', 'optimizer': 'adam', 'graph_mode': 'off', 'use_snp_selection': False}. Best is trial 3 with value: 0.3109150115799696.
[I 2025-12-05 23:00:20,627] Trial 25 finished with value: 0.30614512873387745 and parameters: {'model_type': 'mlp', 'hidden_dims': '[256, 128]', 'dropout': 0.23243262950649224, 'batch_norm': True, 'lr': 0.0003839415168420757, 'weight_decay': 0.00010551842609068181, 'epochs': 261, 'loss': 'mae', 'optimizer': 'adam', 'graph_mode': 'off', 'use_snp_selection': False}. Best is trial 3 with value: 0.3109150115799696.
[I 2025-12-05 23:00:44,458] Trial 26 finished with value: 0.272275603365559 and parameters: {'model_type': 'mlp', 'hidden_dims': '[128, 64]', 'dropout': 0.5559220312450137, 'batch_norm': True, 'lr': 4.111650011744325e-05, 'weight_decay': 7.229794675382694e-06, 'epochs': 300, 'loss': 'mse', 'optimizer': 'adam', 'graph_mode': 'off', 'use_snp_selection': True, 'num_snps': 3842}. Best is trial 3 with value: 0.3109150115799696.
[I 2025-12-05 23:01:30,429] Trial 27 finished with value: 0.3098470382884347 and parameters: {'model_type': 'mlp', 'hidden_dims': '[512, 64]', 'dropout': 0.17908249642181706, 'batch_norm': True, 'lr': 0.0001245513659731859, 'weight_decay': 2.164816576134148e-05, 'epochs': 233, 'loss': 'mae', 'optimizer': 'adam', 'graph_mode': 'off', 'use_snp_selection': False}. Best is trial 3 with value: 0.3109150115799696.
[I 2025-12-05 23:02:15,116] Trial 28 finished with value: 0.3022411778345485 and parameters: {'model_type': 'mlp', 'hidden_dims': '[512, 64]', 'dropout': 0.26673595624506075, 'batch_norm': False, 'lr': 0.00010773910969812628, 'weight_decay': 9.6168749471789e-05, 'epochs': 228, 'loss': 'mse', 'optimizer': 'adam', 'graph_mode': 'off', 'use_snp_selection': False}. Best is trial 3 with value: 0.3109150115799696.
[I 2025-12-05 23:02:51,923] Trial 29 finished with value: 0.26889659734060845 and parameters: {'model_type': 'mlp', 'hidden_dims': '[512, 64]', 'dropout': 0.19685901908949177, 'batch_norm': True, 'lr': 2.5087654566083747e-06, 'weight_decay': 2.863104443991659e-05, 'epochs': 188, 'loss': 'mae', 'optimizer': 'adam', 'graph_mode': 'off', 'use_snp_selection': True, 'num_snps': 19468}. Best is trial 3 with value: 0.3109150115799696.
[I 2025-12-05 23:03:40,935] Trial 30 finished with value: 0.31280682310133995 and parameters: {'model_type': 'mlp', 'hidden_dims': '[512, 64]', 'dropout': 0.4485007649909121, 'batch_norm': True, 'lr': 2.7083615829215742e-05, 'weight_decay': 3.4447664747708866e-06, 'epochs': 250, 'loss': 'mae', 'optimizer': 'adam', 'graph_mode': 'off', 'use_snp_selection': False}. Best is trial 30 with value: 0.31280682310133995.
[I 2025-12-05 23:04:31,284] Trial 31 finished with value: 0.3064414985821518 and parameters: {'model_type': 'mlp', 'hidden_dims': '[512, 64]', 'dropout': 0.45616798681493353, 'batch_norm': True, 'lr': 3.3887151354418794e-05, 'weight_decay': 2.874109398241491e-07, 'epochs': 254, 'loss': 'mae', 'optimizer': 'adam', 'graph_mode': 'off', 'use_snp_selection': False}. Best is trial 30 with value: 0.31280682310133995.
[I 2025-12-05 23:05:12,615] Trial 32 finished with value: 0.3091593336187953 and parameters: {'model_type': 'mlp', 'hidden_dims': '[512, 64]', 'dropout': 0.5419824390652626, 'batch_norm': True, 'lr': 1.2139719063819843e-05, 'weight_decay': 3.7013830052272834e-06, 'epochs': 206, 'loss': 'mae', 'optimizer': 'adam', 'graph_mode': 'off', 'use_snp_selection': False}. Best is trial 30 with value: 0.31280682310133995.
[I 2025-12-05 23:06:16,787] Trial 33 finished with value: 0.30642084956603466 and parameters: {'model_type': 'mlp', 'hidden_dims': '[512, 64]', 'dropout': 0.4252747092781676, 'batch_norm': True, 'lr': 2.1520888648113466e-05, 'weight_decay': 1.0883146213810942e-05, 'epochs': 336, 'loss': 'mae', 'optimizer': 'adam', 'graph_mode': 'off', 'use_snp_selection': False}. Best is trial 30 with value: 0.31280682310133995.
[I 2025-12-05 23:07:01,699] Trial 34 finished with value: 0.2916731310103837 and parameters: {'model_type': 'mlp', 'hidden_dims': '[512, 64]', 'dropout': 0.3685687117236634, 'batch_norm': True, 'lr': 6.003623229413168e-06, 'weight_decay': 1.180075781551467e-06, 'epochs': 226, 'loss': 'mae', 'optimizer': 'adam', 'graph_mode': 'off', 'use_snp_selection': False}. Best is trial 30 with value: 0.31280682310133995.
[I 2025-12-05 23:07:51,779] Trial 35 finished with value: 0.3008063991535395 and parameters: {'model_type': 'mlp', 'hidden_dims': '[128, 64]', 'dropout': 0.4585890055940572, 'batch_norm': True, 'lr': 7.509282869823027e-05, 'weight_decay': 3.777479197444609e-05, 'epochs': 284, 'loss': 'mae', 'optimizer': 'adam', 'graph_mode': 'off', 'use_snp_selection': True, 'num_snps': 57586}. Best is trial 30 with value: 0.31280682310133995.
[I 2025-12-05 23:08:19,202] Trial 36 finished with value: 0.30680311781509984 and parameters: {'model_type': 'mlp', 'hidden_dims': '[256, 128]', 'dropout': 0.17693132394680264, 'batch_norm': True, 'lr': 0.00012534478084213045, 'weight_decay': 7.88630957741931e-05, 'epochs': 249, 'loss': 'mse', 'optimizer': 'adam', 'graph_mode': 'off', 'use_snp_selection': False}. Best is trial 30 with value: 0.31280682310133995.
[I 2025-12-05 23:08:56,440] Trial 37 finished with value: 0.23026089979284872 and parameters: {'model_type': 'mlp', 'hidden_dims': '[512, 64]', 'dropout': 0.3408900469952887, 'batch_norm': True, 'lr': 1.0887483442261242e-06, 'weight_decay': 0.0002724070141892404, 'epochs': 162, 'loss': 'mae', 'optimizer': 'adam', 'graph_mode': 'off', 'use_snp_selection': True, 'num_snps': 22282}. Best is trial 30 with value: 0.31280682310133995.
[I 2025-12-05 23:09:25,853] Trial 38 finished with value: 0.30562952169669627 and parameters: {'model_type': 'mlp', 'hidden_dims': '[512, 256]', 'dropout': 0.39635577948774675, 'batch_norm': False, 'lr': 5.308317060987293e-05, 'weight_decay': 9.999921259239157e-07, 'epochs': 139, 'loss': 'mse', 'optimizer': 'adam', 'graph_mode': 'off', 'use_snp_selection': False}. Best is trial 30 with value: 0.31280682310133995.
[I 2025-12-05 23:09:48,399] Trial 39 finished with value: 0.3005898510092867 and parameters: {'model_type': 'mlp', 'hidden_dims': '[256, 128, 64]', 'dropout': 0.23337199180730533, 'batch_norm': True, 'lr': 3.400590450806056e-05, 'weight_decay': 0.000494866061743946, 'epochs': 194, 'loss': 'mae', 'optimizer': 'adam', 'graph_mode': 'off', 'use_snp_selection': False}. Best is trial 30 with value: 0.31280682310133995.
[I 2025-12-05 23:10:41,013] Trial 40 finished with value: 0.3025447071674157 and parameters: {'model_type': 'mlp', 'hidden_dims': '[512, 64]', 'dropout': 0.30452012800416023, 'batch_norm': False, 'lr': 2.3067791584255804e-06, 'weight_decay': 4.300538437639765e-06, 'epochs': 272, 'loss': 'mae', 'optimizer': 'adam', 'graph_mode': 'off', 'use_snp_selection': False}. Best is trial 30 with value: 0.31280682310133995.
[I 2025-12-05 23:11:22,053] Trial 41 finished with value: 0.30530736082267945 and parameters: {'model_type': 'mlp', 'hidden_dims': '[512, 64]', 'dropout': 0.551862474886677, 'batch_norm': True, 'lr': 1.188723219037459e-05, 'weight_decay': 2.6547006755559354e-06, 'epochs': 205, 'loss': 'mae', 'optimizer': 'adam', 'graph_mode': 'off', 'use_snp_selection': False}. Best is trial 30 with value: 0.31280682310133995.
[I 2025-12-05 23:12:05,035] Trial 42 finished with value: 0.3056552842614009 and parameters: {'model_type': 'mlp', 'hidden_dims': '[512, 64]', 'dropout': 0.5515756948995151, 'batch_norm': True, 'lr': 7.175376830234193e-06, 'weight_decay': 1.6451752703974903e-05, 'epochs': 216, 'loss': 'mae', 'optimizer': 'adam', 'graph_mode': 'off', 'use_snp_selection': False}. Best is trial 30 with value: 0.31280682310133995.
[I 2025-12-05 23:12:42,810] Trial 43 finished with value: 0.2906897592742749 and parameters: {'model_type': 'mlp', 'hidden_dims': '[512, 64]', 'dropout': 0.5893660105800396, 'batch_norm': True, 'lr': 4.139997796169015e-06, 'weight_decay': 3.6154050358954065e-06, 'epochs': 186, 'loss': 'mae', 'optimizer': 'adam', 'graph_mode': 'off', 'use_snp_selection': False}. Best is trial 30 with value: 0.31280682310133995.
[I 2025-12-05 23:13:30,245] Trial 44 finished with value: 0.3010136760812422 and parameters: {'model_type': 'mlp', 'hidden_dims': '[512, 64]', 'dropout': 0.5234409367149019, 'batch_norm': True, 'lr': 1.2375917322560486e-05, 'weight_decay': 1.7633979734379642e-06, 'epochs': 241, 'loss': 'mae', 'optimizer': 'adam', 'graph_mode': 'off', 'use_snp_selection': False}. Best is trial 30 with value: 0.31280682310133995.
[I 2025-12-05 23:13:49,518] Trial 45 finished with value: 0.2949519491368359 and parameters: {'model_type': 'mlp', 'hidden_dims': '[512, 256]', 'dropout': 0.5656772910497198, 'batch_norm': True, 'lr': 9.013784127553868e-06, 'weight_decay': 2.214411750609798e-07, 'epochs': 80, 'loss': 'mse', 'optimizer': 'adam', 'graph_mode': 'off', 'use_snp_selection': False}. Best is trial 30 with value: 0.31280682310133995.
[I 2025-12-05 23:14:13,562] Trial 46 finished with value: 0.3073041434429978 and parameters: {'model_type': 'mlp', 'hidden_dims': '[256, 128]', 'dropout': 0.49258896445037337, 'batch_norm': True, 'lr': 1.7776081890701418e-05, 'weight_decay': 5.681259192139237e-07, 'epochs': 211, 'loss': 'mae', 'optimizer': 'adam', 'graph_mode': 'off', 'use_snp_selection': False}. Best is trial 30 with value: 0.31280682310133995.
[I 2025-12-05 23:14:49,168] Trial 47 finished with value: 0.30300450500287746 and parameters: {'model_type': 'mlp', 'hidden_dims': '[512, 64]', 'dropout': 0.5242153132064944, 'batch_norm': False, 'lr': 6.535229010187248e-05, 'weight_decay': 8.9587679926466e-06, 'epochs': 176, 'loss': 'mse', 'optimizer': 'adam', 'graph_mode': 'off', 'use_snp_selection': False}. Best is trial 30 with value: 0.31280682310133995.
[I 2025-12-05 23:15:40,735] Trial 48 finished with value: 0.30692284948212295 and parameters: {'model_type': 'mlp', 'hidden_dims': '[512, 256]', 'dropout': 0.13026642538080258, 'batch_norm': True, 'lr': 2.6970053081648863e-05, 'weight_decay': 4.507834674655116e-06, 'epochs': 150, 'loss': 'mae', 'optimizer': 'adam', 'graph_mode': 'off', 'use_snp_selection': True, 'num_snps': 43224}. Best is trial 30 with value: 0.31280682310133995.
[I 2025-12-05 23:16:03,562] Trial 49 finished with value: 0.2945805350319319 and parameters: {'model_type': 'mlp', 'hidden_dims': '[512, 64]', 'dropout': 0.4642043510298989, 'batch_norm': False, 'lr': 1.6424125233830874e-05, 'weight_decay': 2.3493624466688175e-06, 'epochs': 102, 'loss': 'mae', 'optimizer': 'adam', 'graph_mode': 'off', 'use_snp_selection': False}. Best is trial 30 with value: 0.31280682310133995.
[I 2025-12-05 23:16:19,667] Trial 50 finished with value: 0.28842750659620425 and parameters: {'model_type': 'mlp', 'hidden_dims': '[128, 64]', 'dropout': 0.5992708554709387, 'batch_norm': True, 'lr': 4.529404367851309e-06, 'weight_decay': 2.372118712992683e-05, 'epochs': 227, 'loss': 'mse', 'optimizer': 'adam', 'graph_mode': 'off', 'use_snp_selection': False}. Best is trial 30 with value: 0.31280682310133995.
[I 2025-12-05 23:17:23,092] Trial 51 finished with value: 0.3064288849191311 and parameters: {'model_type': 'mlp', 'hidden_dims': '[512, 128]', 'dropout': 0.15479377200206682, 'batch_norm': True, 'lr': 0.0002229267068787888, 'weight_decay': 1.4444893367575535e-05, 'epochs': 332, 'loss': 'mae', 'optimizer': 'adam', 'graph_mode': 'off', 'use_snp_selection': False}. Best is trial 30 with value: 0.31280682310133995.
[I 2025-12-05 23:18:23,435] Trial 52 finished with value: 0.3052119117767718 and parameters: {'model_type': 'mlp', 'hidden_dims': '[512, 128]', 'dropout': 0.5758356068140982, 'batch_norm': True, 'lr': 0.0003468291380779383, 'weight_decay': 5.554232750793423e-05, 'epochs': 314, 'loss': 'mae', 'optimizer': 'adam', 'graph_mode': 'off', 'use_snp_selection': False}. Best is trial 30 with value: 0.31280682310133995.
[I 2025-12-05 23:19:19,040] Trial 53 finished with value: 0.307354689712353 and parameters: {'model_type': 'mlp', 'hidden_dims': '[512, 256]', 'dropout': 0.13352554932798916, 'batch_norm': True, 'lr': 0.0004998451718328387, 'weight_decay': 1.0236769517732865e-05, 'epochs': 286, 'loss': 'mae', 'optimizer': 'adam', 'graph_mode': 'off', 'use_snp_selection': False}. Best is trial 30 with value: 0.31280682310133995.
[I 2025-12-05 23:20:24,348] Trial 54 finished with value: 0.3031321836232902 and parameters: {'model_type': 'mlp', 'hidden_dims': '[512, 128]', 'dropout': 0.5376155583222224, 'batch_norm': False, 'lr': 0.00017094057985229846, 'weight_decay': 2.307938836020087e-05, 'epochs': 347, 'loss': 'mae', 'optimizer': 'adam', 'graph_mode': 'off', 'use_snp_selection': False}. Best is trial 30 with value: 0.31280682310133995.
[I 2025-12-05 23:21:22,155] Trial 55 finished with value: 0.307854954619161 and parameters: {'model_type': 'mlp', 'hidden_dims': '[512, 64]', 'dropout': 0.11378402262899724, 'batch_norm': True, 'lr': 4.794716304454481e-05, 'weight_decay': 8.738757549488642e-07, 'epochs': 300, 'loss': 'mae', 'optimizer': 'adam', 'graph_mode': 'off', 'use_snp_selection': False}. Best is trial 30 with value: 0.31280682310133995.
[I 2025-12-05 23:21:32,357] Trial 56 finished with value: 0.3028552408497279 and parameters: {'model_type': 'mlp', 'hidden_dims': '[256, 128, 64]', 'dropout': 0.17323567493844017, 'batch_norm': True, 'lr': 0.0002460624270049785, 'weight_decay': 5.949516770037336e-06, 'epochs': 60, 'loss': 'mae', 'optimizer': 'adam', 'graph_mode': 'off', 'use_snp_selection': False}. Best is trial 30 with value: 0.31280682310133995.
[I 2025-12-05 23:22:25,185] Trial 57 finished with value: 0.11206345742761696 and parameters: {'model_type': 'mlp', 'hidden_dims': '[512, 128]', 'dropout': 0.2160372848627593, 'batch_norm': False, 'lr': 0.0008088816319967441, 'weight_decay': 3.929258209430776e-05, 'epochs': 275, 'loss': 'mse', 'optimizer': 'adam', 'graph_mode': 'off', 'use_snp_selection': False}. Best is trial 30 with value: 0.31280682310133995.
[I 2025-12-05 23:23:27,158] Trial 58 finished with value: 0.30599012146481563 and parameters: {'model_type': 'mlp', 'hidden_dims': '[512, 64]', 'dropout': 0.27535159402210535, 'batch_norm': True, 'lr': 9.040355758723521e-05, 'weight_decay': 8.387338890416534e-06, 'epochs': 324, 'loss': 'mae', 'optimizer': 'adam', 'graph_mode': 'off', 'use_snp_selection': False}. Best is trial 30 with value: 0.31280682310133995.
[I 2025-12-05 23:24:18,396] Trial 59 finished with value: 0.3090201627222233 and parameters: {'model_type': 'mlp', 'hidden_dims': '[512, 256]', 'dropout': 0.20229197665180157, 'batch_norm': True, 'lr': 0.0001443987381939633, 'weight_decay': 1.6139406775110432e-07, 'epochs': 261, 'loss': 'mae', 'optimizer': 'adam', 'graph_mode': 'off', 'use_snp_selection': False}. Best is trial 30 with value: 0.31280682310133995.
[I 2025-12-05 23:24:42,330] Trial 60 finished with value: 0.2774814013908093 and parameters: {'model_type': 'mlp', 'hidden_dims': '[512, 256]', 'dropout': 0.4805795709804086, 'batch_norm': True, 'lr': 0.00013291423292568773, 'weight_decay': 1.5829589878047061e-07, 'epochs': 257, 'loss': 'mae', 'optimizer': 'adam', 'graph_mode': 'off', 'use_snp_selection': True, 'num_snps': 2400}. Best is trial 30 with value: 0.31280682310133995.
[I 2025-12-05 23:25:30,407] Trial 61 finished with value: 0.306221237361902 and parameters: {'model_type': 'mlp', 'hidden_dims': '[512, 256]', 'dropout': 0.19286781053788996, 'batch_norm': True, 'lr': 0.00027636499636866273, 'weight_decay': 3.8644270498382864e-07, 'epochs': 244, 'loss': 'mae', 'optimizer': 'adam', 'graph_mode': 'off', 'use_snp_selection': False}. Best is trial 30 with value: 0.31280682310133995.
[I 2025-12-05 23:26:16,640] Trial 62 finished with value: 0.30892393323111306 and parameters: {'model_type': 'mlp', 'hidden_dims': '[512, 256]', 'dropout': 0.14890364489095267, 'batch_norm': True, 'lr': 0.0001980798739457902, 'weight_decay': 2.1486423466450504e-07, 'epochs': 233, 'loss': 'mae', 'optimizer': 'adam', 'graph_mode': 'off', 'use_snp_selection': False}. Best is trial 30 with value: 0.31280682310133995.
[I 2025-12-05 23:27:03,496] Trial 63 finished with value: 0.31052359297084353 and parameters: {'model_type': 'mlp', 'hidden_dims': '[512, 256]', 'dropout': 0.14660271717114917, 'batch_norm': True, 'lr': 0.00014878339497610335, 'weight_decay': 1.743908166170105e-07, 'epochs': 236, 'loss': 'mae', 'optimizer': 'adam', 'graph_mode': 'off', 'use_snp_selection': False}. Best is trial 30 with value: 0.31280682310133995.
[I 2025-12-05 23:27:47,646] Trial 64 finished with value: 0.3127034339747194 and parameters: {'model_type': 'mlp', 'hidden_dims': '[512, 256]', 'dropout': 0.17278222044200917, 'batch_norm': True, 'lr': 9.57968042035164e-05, 'weight_decay': 1.2447081886451145e-07, 'epochs': 221, 'loss': 'mae', 'optimizer': 'adam', 'graph_mode': 'off', 'use_snp_selection': False}. Best is trial 30 with value: 0.31280682310133995.
[I 2025-12-05 23:28:31,597] Trial 65 finished with value: 0.31060945525065453 and parameters: {'model_type': 'mlp', 'hidden_dims': '[512, 256]', 'dropout': 0.2452078148664061, 'batch_norm': True, 'lr': 8.973980632754944e-05, 'weight_decay': 1.0858904287301985e-07, 'epochs': 220, 'loss': 'mae', 'optimizer': 'adam', 'graph_mode': 'off', 'use_snp_selection': False}. Best is trial 30 with value: 0.31280682310133995.
[I 2025-12-05 23:29:15,582] Trial 66 finished with value: 0.3069456724678786 and parameters: {'model_type': 'mlp', 'hidden_dims': '[512, 256]', 'dropout': 0.24854703090576186, 'batch_norm': True, 'lr': 0.00011305315868618164, 'weight_decay': 1.1168115493489267e-07, 'epochs': 220, 'loss': 'mae', 'optimizer': 'adam', 'graph_mode': 'off', 'use_snp_selection': False}. Best is trial 30 with value: 0.31280682310133995.
[I 2025-12-05 23:30:02,747] Trial 67 finished with value: 0.2959475515739566 and parameters: {'model_type': 'mlp', 'hidden_dims': '[512, 256]', 'dropout': 0.16386623510106227, 'batch_norm': False, 'lr': 9.219295714380809e-05, 'weight_decay': 1.009124292262863e-07, 'epochs': 241, 'loss': 'mse', 'optimizer': 'adam', 'graph_mode': 'off', 'use_snp_selection': False}. Best is trial 30 with value: 0.31280682310133995.
[I 2025-12-05 23:30:42,205] Trial 68 finished with value: 0.30574309321560417 and parameters: {'model_type': 'mlp', 'hidden_dims': '[512, 256]', 'dropout': 0.18643223432297998, 'batch_norm': True, 'lr': 6.176807060588837e-05, 'weight_decay': 4.5616743067161246e-07, 'epochs': 194, 'loss': 'mae', 'optimizer': 'adam', 'graph_mode': 'off', 'use_snp_selection': False}. Best is trial 30 with value: 0.31280682310133995.
