Running from this directory: /cluster/work/simennes/Project_thesis/Project_thesis
Name of job: mlp_m
ID of job: 23690566
The job was run on these nodes: idun-07-04
[I 2025-12-05 14:23:05,721] Trial 0 finished with value: 0.14726130839660417 and parameters: {'model_type': 'mlp', 'hidden_dims': '[128, 64]', 'dropout': 0.199031432379812, 'batch_norm': True, 'lr': 1.8408544111075837e-06, 'weight_decay': 5.5136510071208614e-05, 'epochs': 336, 'loss': 'mae', 'optimizer': 'adam', 'graph_mode': 'off', 'use_snp_selection': True, 'num_snps': 43862}. Best is trial 0 with value: 0.14726130839660417.
[I 2025-12-05 14:23:46,589] Trial 1 finished with value: 0.19741905611545987 and parameters: {'model_type': 'mlp', 'hidden_dims': '[256, 128]', 'dropout': 0.4370668075331726, 'batch_norm': True, 'lr': 7.133471581159139e-05, 'weight_decay': 1.128633586803549e-05, 'epochs': 242, 'loss': 'mae', 'optimizer': 'adam', 'graph_mode': 'off', 'use_snp_selection': False}. Best is trial 1 with value: 0.19741905611545987.
[I 2025-12-05 14:24:24,367] Trial 2 finished with value: 0.1683522286279193 and parameters: {'model_type': 'mlp', 'hidden_dims': '[256, 128, 64]', 'dropout': 0.41314357415569625, 'batch_norm': False, 'lr': 3.952233718592101e-06, 'weight_decay': 0.00026754769258252603, 'epochs': 149, 'loss': 'mse', 'optimizer': 'adam', 'graph_mode': 'off', 'use_snp_selection': True, 'num_snps': 11571}. Best is trial 1 with value: 0.19741905611545987.
[I 2025-12-05 14:26:00,961] Trial 3 finished with value: 0.2213050243622921 and parameters: {'model_type': 'mlp', 'hidden_dims': '[512, 64]', 'dropout': 0.5938127374509361, 'batch_norm': False, 'lr': 5.67704586114731e-06, 'weight_decay': 2.4518087630137052e-05, 'epochs': 320, 'loss': 'mae', 'optimizer': 'adam', 'graph_mode': 'off', 'use_snp_selection': False}. Best is trial 3 with value: 0.2213050243622921.
[I 2025-12-05 14:27:28,070] Trial 4 finished with value: 0.16675111319439462 and parameters: {'model_type': 'mlp', 'hidden_dims': '[512, 128]', 'dropout': 0.25746343592134413, 'batch_norm': True, 'lr': 1.3467657668402788e-06, 'weight_decay': 0.00033087251918647806, 'epochs': 277, 'loss': 'mse', 'optimizer': 'adam', 'graph_mode': 'off', 'use_snp_selection': True, 'num_snps': 36675}. Best is trial 3 with value: 0.2213050243622921.
[I 2025-12-05 14:28:30,075] Trial 5 finished with value: 0.1227679617678766 and parameters: {'model_type': 'mlp', 'hidden_dims': '[512, 64]', 'dropout': 0.38275350994408375, 'batch_norm': True, 'lr': 1.5586664309232824e-06, 'weight_decay': 0.0008227664668621182, 'epochs': 145, 'loss': 'mae', 'optimizer': 'adam', 'graph_mode': 'off', 'use_snp_selection': True, 'num_snps': 32148}. Best is trial 3 with value: 0.2213050243622921.
[I 2025-12-05 14:29:04,368] Trial 6 finished with value: 0.20373056615499174 and parameters: {'model_type': 'mlp', 'hidden_dims': '[256, 128]', 'dropout': 0.3930109900265879, 'batch_norm': False, 'lr': 4.892964372128395e-05, 'weight_decay': 1.5809549317992182e-06, 'epochs': 199, 'loss': 'mse', 'optimizer': 'adam', 'graph_mode': 'off', 'use_snp_selection': False}. Best is trial 3 with value: 0.2213050243622921.
[I 2025-12-05 14:29:39,510] Trial 7 finished with value: 0.2080255446231162 and parameters: {'model_type': 'mlp', 'hidden_dims': '[512, 256]', 'dropout': 0.15343979219678458, 'batch_norm': True, 'lr': 6.234003099047341e-05, 'weight_decay': 3.894760610535477e-07, 'epochs': 97, 'loss': 'mse', 'optimizer': 'adam', 'graph_mode': 'off', 'use_snp_selection': False}. Best is trial 3 with value: 0.2213050243622921.
[I 2025-12-05 14:31:16,067] Trial 8 finished with value: 0.20407085247491819 and parameters: {'model_type': 'mlp', 'hidden_dims': '[512, 128]', 'dropout': 0.10743001231661406, 'batch_norm': True, 'lr': 0.00023728538449271062, 'weight_decay': 1.7629071578048637e-05, 'epochs': 312, 'loss': 'mae', 'optimizer': 'adam', 'graph_mode': 'off', 'use_snp_selection': False}. Best is trial 3 with value: 0.2213050243622921.
[I 2025-12-05 14:32:13,704] Trial 9 finished with value: 0.2003050987510396 and parameters: {'model_type': 'mlp', 'hidden_dims': '[512, 64]', 'dropout': 0.14505336736221927, 'batch_norm': True, 'lr': 5.8619638388111826e-05, 'weight_decay': 6.200156172669308e-07, 'epochs': 175, 'loss': 'mse', 'optimizer': 'adam', 'graph_mode': 'off', 'use_snp_selection': False}. Best is trial 3 with value: 0.2213050243622921.
[I 2025-12-05 14:32:36,887] Trial 10 finished with value: 0.19400144733057686 and parameters: {'model_type': 'mlp', 'hidden_dims': '[512, 64]', 'dropout': 0.5885461262002587, 'batch_norm': False, 'lr': 8.769366258768696e-06, 'weight_decay': 2.78273193871783e-06, 'epochs': 55, 'loss': 'mae', 'optimizer': 'adam', 'graph_mode': 'off', 'use_snp_selection': False}. Best is trial 3 with value: 0.2213050243622921.
[I 2025-12-05 14:33:06,292] Trial 11 finished with value: 0.21452790680254302 and parameters: {'model_type': 'mlp', 'hidden_dims': '[512, 256]', 'dropout': 0.583942291816117, 'batch_norm': False, 'lr': 1.422933652790185e-05, 'weight_decay': 1.18635098029648e-07, 'epochs': 77, 'loss': 'mse', 'optimizer': 'adam', 'graph_mode': 'off', 'use_snp_selection': False}. Best is trial 3 with value: 0.2213050243622921.
[I 2025-12-05 14:33:25,336] Trial 12 finished with value: 0.1775875209412348 and parameters: {'model_type': 'mlp', 'hidden_dims': '[512, 256]', 'dropout': 0.593097749012682, 'batch_norm': False, 'lr': 1.1374686318732863e-05, 'weight_decay': 1.3081036432574914e-07, 'epochs': 40, 'loss': 'mae', 'optimizer': 'adam', 'graph_mode': 'off', 'use_snp_selection': False}. Best is trial 3 with value: 0.2213050243622921.
[I 2025-12-05 14:34:39,273] Trial 13 finished with value: 0.20509642173554216 and parameters: {'model_type': 'mlp', 'hidden_dims': '[512, 256]', 'dropout': 0.5043641748401543, 'batch_norm': False, 'lr': 1.4304506621636526e-05, 'weight_decay': 5.0135437753417527e-05, 'epochs': 235, 'loss': 'mse', 'optimizer': 'adam', 'graph_mode': 'off', 'use_snp_selection': False}. Best is trial 3 with value: 0.2213050243622921.
[I 2025-12-05 14:34:52,169] Trial 14 finished with value: 0.16090114353532464 and parameters: {'model_type': 'mlp', 'hidden_dims': '[128, 64]', 'dropout': 0.5300180653494536, 'batch_norm': False, 'lr': 5.096356034191146e-06, 'weight_decay': 3.0607358611649674e-06, 'epochs': 93, 'loss': 'mse', 'optimizer': 'adam', 'graph_mode': 'off', 'use_snp_selection': False}. Best is trial 3 with value: 0.2213050243622921.
[I 2025-12-05 14:35:38,796] Trial 15 finished with value: 0.2100758567052788 and parameters: {'model_type': 'mlp', 'hidden_dims': '[256, 128, 64]', 'dropout': 0.29817671914947536, 'batch_norm': False, 'lr': 1.8411764708572348e-05, 'weight_decay': 4.4084956876871386e-05, 'epochs': 278, 'loss': 'mae', 'optimizer': 'adam', 'graph_mode': 'off', 'use_snp_selection': False}. Best is trial 3 with value: 0.2213050243622921.
[I 2025-12-05 14:37:23,203] Trial 16 finished with value: 0.19771490604328926 and parameters: {'model_type': 'mlp', 'hidden_dims': '[512, 256]', 'dropout': 0.4992385332513618, 'batch_norm': False, 'lr': 0.00017549215405955411, 'weight_decay': 1.3070443894198984e-07, 'epochs': 350, 'loss': 'mse', 'optimizer': 'adam', 'graph_mode': 'off', 'use_snp_selection': False}. Best is trial 3 with value: 0.2213050243622921.
[I 2025-12-05 14:38:02,093] Trial 17 finished with value: 0.05263008401807284 and parameters: {'model_type': 'mlp', 'hidden_dims': '[512, 64]', 'dropout': 0.543474321376226, 'batch_norm': False, 'lr': 0.000906375209920231, 'weight_decay': 6.503919561253859e-06, 'epochs': 113, 'loss': 'mae', 'optimizer': 'adam', 'graph_mode': 'off', 'use_snp_selection': False}. Best is trial 3 with value: 0.2213050243622921.
[I 2025-12-05 14:39:47,824] Trial 18 finished with value: 0.21590057148347253 and parameters: {'model_type': 'mlp', 'hidden_dims': '[512, 256]', 'dropout': 0.4928065509878574, 'batch_norm': False, 'lr': 3.8282888633697165e-06, 'weight_decay': 0.00015435589843114137, 'epochs': 214, 'loss': 'mse', 'optimizer': 'adam', 'graph_mode': 'off', 'use_snp_selection': True, 'num_snps': 58241}. Best is trial 3 with value: 0.2213050243622921.
[I 2025-12-05 14:41:31,645] Trial 19 finished with value: 0.21144784013909365 and parameters: {'model_type': 'mlp', 'hidden_dims': '[512, 64]', 'dropout': 0.47355279224247543, 'batch_norm': False, 'lr': 3.776052753656041e-06, 'weight_decay': 0.00015299712892081902, 'epochs': 220, 'loss': 'mae', 'optimizer': 'adam', 'graph_mode': 'off', 'use_snp_selection': True, 'num_snps': 55667}. Best is trial 3 with value: 0.2213050243622921.
[I 2025-12-05 14:42:41,014] Trial 20 finished with value: 0.2067011559466559 and parameters: {'model_type': 'mlp', 'hidden_dims': '[128, 64]', 'dropout': 0.34258156279977026, 'batch_norm': False, 'lr': 2.8365080110951606e-06, 'weight_decay': 0.00011741442269133286, 'epochs': 279, 'loss': 'mae', 'optimizer': 'adam', 'graph_mode': 'off', 'use_snp_selection': True, 'num_snps': 57703}. Best is trial 3 with value: 0.2213050243622921.
[I 2025-12-05 14:43:23,732] Trial 21 finished with value: 0.18293900075120043 and parameters: {'model_type': 'mlp', 'hidden_dims': '[512, 256]', 'dropout': 0.5675598050602048, 'batch_norm': False, 'lr': 6.788409120150372e-06, 'weight_decay': 1.7594781433893848e-05, 'epochs': 172, 'loss': 'mse', 'optimizer': 'adam', 'graph_mode': 'off', 'use_snp_selection': True, 'num_snps': 11878}. Best is trial 3 with value: 0.2213050243622921.
[I 2025-12-05 14:44:25,693] Trial 22 finished with value: 0.1816568217829661 and parameters: {'model_type': 'mlp', 'hidden_dims': '[512, 256]', 'dropout': 0.4606876289530824, 'batch_norm': False, 'lr': 2.4880512057502122e-05, 'weight_decay': 0.00077823505059201, 'epochs': 256, 'loss': 'mse', 'optimizer': 'adam', 'graph_mode': 'off', 'use_snp_selection': True, 'num_snps': 22259}. Best is trial 3 with value: 0.2213050243622921.
[I 2025-12-05 14:46:16,740] Trial 23 finished with value: 0.20793849619393914 and parameters: {'model_type': 'mlp', 'hidden_dims': '[512, 256]', 'dropout': 0.5457724774320233, 'batch_norm': False, 'lr': 2.590096042123008e-06, 'weight_decay': 2.366762302054458e-05, 'epochs': 312, 'loss': 'mse', 'optimizer': 'adam', 'graph_mode': 'off', 'use_snp_selection': True, 'num_snps': 46925}. Best is trial 3 with value: 0.2213050243622921.
[I 2025-12-05 14:46:43,936] Trial 24 finished with value: 0.10732508364710072 and parameters: {'model_type': 'mlp', 'hidden_dims': '[512, 256]', 'dropout': 0.5997927039447736, 'batch_norm': False, 'lr': 1.039365661316365e-06, 'weight_decay': 6.732923323931719e-07, 'epochs': 70, 'loss': 'mse', 'optimizer': 'adam', 'graph_mode': 'off', 'use_snp_selection': False}. Best is trial 3 with value: 0.2213050243622921.
[I 2025-12-05 14:47:19,841] Trial 25 finished with value: 0.21005784892450552 and parameters: {'model_type': 'mlp', 'hidden_dims': '[256, 128, 64]', 'dropout': 0.5082623722482305, 'batch_norm': False, 'lr': 7.57803033512188e-06, 'weight_decay': 9.182426164417397e-05, 'epochs': 205, 'loss': 'mse', 'optimizer': 'adam', 'graph_mode': 'off', 'use_snp_selection': False}. Best is trial 3 with value: 0.2213050243622921.
[I 2025-12-05 14:47:51,446] Trial 26 finished with value: 0.18463537039004768 and parameters: {'model_type': 'mlp', 'hidden_dims': '[256, 128]', 'dropout': 0.5461496679117663, 'batch_norm': False, 'lr': 3.051896769720413e-05, 'weight_decay': 4.6364529941211926e-06, 'epochs': 125, 'loss': 'mse', 'optimizer': 'adam', 'graph_mode': 'off', 'use_snp_selection': True, 'num_snps': 2344}. Best is trial 3 with value: 0.2213050243622921.
[I 2025-12-05 14:48:48,408] Trial 27 finished with value: 0.20418107096558885 and parameters: {'model_type': 'mlp', 'hidden_dims': '[512, 128]', 'dropout': 0.46365036219937616, 'batch_norm': False, 'lr': 1.8706878230062665e-05, 'weight_decay': 0.00036075611445864504, 'epochs': 178, 'loss': 'mse', 'optimizer': 'adam', 'graph_mode': 'off', 'use_snp_selection': False}. Best is trial 3 with value: 0.2213050243622921.
[I 2025-12-05 14:50:40,394] Trial 28 finished with value: 0.21015374893730168 and parameters: {'model_type': 'mlp', 'hidden_dims': '[512, 64]', 'dropout': 0.5627879476624107, 'batch_norm': False, 'lr': 5.876305852724293e-06, 'weight_decay': 3.359455779210116e-05, 'epochs': 300, 'loss': 'mae', 'optimizer': 'adam', 'graph_mode': 'off', 'use_snp_selection': True, 'num_snps': 48700}. Best is trial 3 with value: 0.2213050243622921.
[I 2025-12-05 14:51:24,421] Trial 29 finished with value: 0.14971191763992425 and parameters: {'model_type': 'mlp', 'hidden_dims': '[128, 64]', 'dropout': 0.4995339633737297, 'batch_norm': False, 'lr': 2.2341930466279717e-06, 'weight_decay': 7.136198737480179e-05, 'epochs': 146, 'loss': 'mae', 'optimizer': 'adam', 'graph_mode': 'off', 'use_snp_selection': True, 'num_snps': 26940}. Best is trial 3 with value: 0.2213050243622921.
[I 2025-12-05 14:53:03,261] Trial 30 finished with value: 0.20001780060383445 and parameters: {'model_type': 'mlp', 'hidden_dims': '[512, 256]', 'dropout': 0.3487516919088518, 'batch_norm': False, 'lr': 1.1559384955547435e-05, 'weight_decay': 1.0365676432040612e-05, 'epochs': 325, 'loss': 'mse', 'optimizer': 'adam', 'graph_mode': 'off', 'use_snp_selection': False}. Best is trial 3 with value: 0.2213050243622921.
[I 2025-12-05 14:54:50,887] Trial 31 finished with value: 0.21743471471212947 and parameters: {'model_type': 'mlp', 'hidden_dims': '[512, 64]', 'dropout': 0.47322934747152057, 'batch_norm': False, 'lr': 4.2575578658276965e-06, 'weight_decay': 0.00014623041191863195, 'epochs': 220, 'loss': 'mae', 'optimizer': 'adam', 'graph_mode': 'off', 'use_snp_selection': True, 'num_snps': 58538}. Best is trial 3 with value: 0.2213050243622921.
[I 2025-12-05 14:56:49,276] Trial 32 finished with value: 0.21950614657777864 and parameters: {'model_type': 'mlp', 'hidden_dims': '[512, 64]', 'dropout': 0.43266800059228483, 'batch_norm': False, 'lr': 3.573883073832012e-06, 'weight_decay': 0.00016887581626409074, 'epochs': 254, 'loss': 'mae', 'optimizer': 'adam', 'graph_mode': 'off', 'use_snp_selection': True, 'num_snps': 59537}. Best is trial 3 with value: 0.2213050243622921.
[I 2025-12-05 14:58:47,874] Trial 33 finished with value: 0.22339341481506128 and parameters: {'model_type': 'mlp', 'hidden_dims': '[512, 64]', 'dropout': 0.43472210663758126, 'batch_norm': False, 'lr': 3.8190281669228594e-06, 'weight_decay': 0.00018424296411547288, 'epochs': 257, 'loss': 'mae', 'optimizer': 'adam', 'graph_mode': 'off', 'use_snp_selection': True, 'num_snps': 59426}. Best is trial 33 with value: 0.22339341481506128.
[I 2025-12-05 15:00:34,108] Trial 34 finished with value: 0.16334701170206564 and parameters: {'model_type': 'mlp', 'hidden_dims': '[512, 64]', 'dropout': 0.421544183174075, 'batch_norm': True, 'lr': 2.353703625260742e-06, 'weight_decay': 0.00042205208999991384, 'epochs': 255, 'loss': 'mae', 'optimizer': 'adam', 'graph_mode': 'off', 'use_snp_selection': True, 'num_snps': 51696}. Best is trial 33 with value: 0.22339341481506128.
[I 2025-12-05 15:02:27,157] Trial 35 finished with value: 0.22127860750439327 and parameters: {'model_type': 'mlp', 'hidden_dims': '[512, 64]', 'dropout': 0.3135946336242142, 'batch_norm': False, 'lr': 1.5466774333521382e-06, 'weight_decay': 0.00020195360178015584, 'epochs': 234, 'loss': 'mae', 'optimizer': 'adam', 'graph_mode': 'off', 'use_snp_selection': True, 'num_snps': 59683}. Best is trial 33 with value: 0.22339341481506128.
[I 2025-12-05 15:03:56,968] Trial 36 finished with value: 0.22339838524676997 and parameters: {'model_type': 'mlp', 'hidden_dims': '[512, 64]', 'dropout': 0.27260627230396717, 'batch_norm': False, 'lr': 1.5187582478952065e-06, 'weight_decay': 0.00026977530184619337, 'epochs': 246, 'loss': 'mae', 'optimizer': 'adam', 'graph_mode': 'off', 'use_snp_selection': True, 'num_snps': 43153}. Best is trial 36 with value: 0.22339838524676997.
[I 2025-12-05 15:05:33,892] Trial 37 finished with value: 0.1370946442379563 and parameters: {'model_type': 'mlp', 'hidden_dims': '[512, 64]', 'dropout': 0.23348041836414035, 'batch_norm': True, 'lr': 1.4286962199105468e-06, 'weight_decay': 0.0009792673900057428, 'epochs': 296, 'loss': 'mae', 'optimizer': 'adam', 'graph_mode': 'off', 'use_snp_selection': True, 'num_snps': 41059}. Best is trial 36 with value: 0.22339838524676997.
[I 2025-12-05 15:07:16,137] Trial 38 finished with value: 0.1919237033821375 and parameters: {'model_type': 'mlp', 'hidden_dims': '[512, 64]', 'dropout': 0.29810732482525804, 'batch_norm': False, 'lr': 1.221194823944866e-06, 'weight_decay': 0.00025005769913296797, 'epochs': 240, 'loss': 'mae', 'optimizer': 'adam', 'graph_mode': 'off', 'use_snp_selection': True, 'num_snps': 51326}. Best is trial 36 with value: 0.22339838524676997.
[I 2025-12-05 15:08:48,633] Trial 39 finished with value: 0.15701435030681274 and parameters: {'model_type': 'mlp', 'hidden_dims': '[512, 64]', 'dropout': 0.31129109355453455, 'batch_norm': True, 'lr': 1.9585540207518377e-06, 'weight_decay': 0.00048819902326395574, 'epochs': 289, 'loss': 'mae', 'optimizer': 'adam', 'graph_mode': 'off', 'use_snp_selection': True, 'num_snps': 39586}. Best is trial 36 with value: 0.22339838524676997.
[I 2025-12-05 15:10:07,095] Trial 40 finished with value: 0.2098106303433151 and parameters: {'model_type': 'mlp', 'hidden_dims': '[256, 128]', 'dropout': 0.24530811715034653, 'batch_norm': False, 'lr': 1.6984416689365106e-06, 'weight_decay': 0.0006279252263740875, 'epochs': 268, 'loss': 'mae', 'optimizer': 'adam', 'graph_mode': 'off', 'use_snp_selection': True, 'num_snps': 50905}. Best is trial 36 with value: 0.22339838524676997.
[I 2025-12-05 15:12:06,478] Trial 41 finished with value: 0.21564609536687648 and parameters: {'model_type': 'mlp', 'hidden_dims': '[512, 64]', 'dropout': 0.3820321405508026, 'batch_norm': False, 'lr': 3.216521916092634e-06, 'weight_decay': 0.00024111681507818592, 'epochs': 259, 'loss': 'mae', 'optimizer': 'adam', 'graph_mode': 'off', 'use_snp_selection': True, 'num_snps': 59932}. Best is trial 36 with value: 0.22339838524676997.
[I 2025-12-05 15:13:51,214] Trial 42 finished with value: 0.20345075017003947 and parameters: {'model_type': 'mlp', 'hidden_dims': '[512, 64]', 'dropout': 0.3257235453251947, 'batch_norm': False, 'lr': 1.6974850719017005e-06, 'weight_decay': 0.00023433305726455232, 'epochs': 235, 'loss': 'mae', 'optimizer': 'adam', 'graph_mode': 'off', 'use_snp_selection': True, 'num_snps': 53868}. Best is trial 36 with value: 0.22339838524676997.
[I 2025-12-05 15:15:13,288] Trial 43 finished with value: 0.21133763646327752 and parameters: {'model_type': 'mlp', 'hidden_dims': '[512, 64]', 'dropout': 0.27054931274953, 'batch_norm': False, 'lr': 4.917910598673879e-06, 'weight_decay': 7.20136697538095e-05, 'epochs': 187, 'loss': 'mae', 'optimizer': 'adam', 'graph_mode': 'off', 'use_snp_selection': True, 'num_snps': 45472}. Best is trial 36 with value: 0.22339838524676997.
[I 2025-12-05 15:17:01,896] Trial 44 finished with value: 0.19347111856271873 and parameters: {'model_type': 'mlp', 'hidden_dims': '[512, 64]', 'dropout': 0.38098191272136017, 'batch_norm': False, 'lr': 1.0773027077741985e-06, 'weight_decay': 0.00019666742844721418, 'epochs': 248, 'loss': 'mae', 'optimizer': 'adam', 'graph_mode': 'off', 'use_snp_selection': True, 'num_snps': 54617}. Best is trial 36 with value: 0.22339838524676997.
[I 2025-12-05 15:19:22,389] Trial 45 finished with value: 0.19359807680556682 and parameters: {'model_type': 'mlp', 'hidden_dims': '[512, 128]', 'dropout': 0.19502003638520116, 'batch_norm': True, 'lr': 8.716513897150678e-06, 'weight_decay': 9.064272510413912e-05, 'epochs': 334, 'loss': 'mae', 'optimizer': 'adam', 'graph_mode': 'off', 'use_snp_selection': True, 'num_snps': 59916}. Best is trial 36 with value: 0.22339838524676997.
[I 2025-12-05 15:20:39,281] Trial 46 finished with value: 0.20529117031851718 and parameters: {'model_type': 'mlp', 'hidden_dims': '[512, 64]', 'dropout': 0.3994381890573384, 'batch_norm': False, 'lr': 2.0412971305679587e-06, 'weight_decay': 3.779222817636746e-05, 'epochs': 230, 'loss': 'mae', 'optimizer': 'adam', 'graph_mode': 'off', 'use_snp_selection': True, 'num_snps': 35357}. Best is trial 36 with value: 0.22339838524676997.
[I 2025-12-05 15:22:32,892] Trial 47 finished with value: 0.21442868418949051 and parameters: {'model_type': 'mlp', 'hidden_dims': '[512, 64]', 'dropout': 0.27459740740483046, 'batch_norm': False, 'lr': 2.9101476863250776e-06, 'weight_decay': 0.00042766209520390047, 'epochs': 272, 'loss': 'mae', 'optimizer': 'adam', 'graph_mode': 'off', 'use_snp_selection': True, 'num_snps': 53868}. Best is trial 36 with value: 0.22339838524676997.
[I 2025-12-05 15:23:56,697] Trial 48 finished with value: 0.19686700752421576 and parameters: {'model_type': 'mlp', 'hidden_dims': '[512, 64]', 'dropout': 0.21065141301191112, 'batch_norm': False, 'lr': 1.3928101989677849e-06, 'weight_decay': 2.6015988758703688e-05, 'epochs': 205, 'loss': 'mae', 'optimizer': 'adam', 'graph_mode': 'off', 'use_snp_selection': True, 'num_snps': 44318}. Best is trial 36 with value: 0.22339838524676997.
[I 2025-12-05 15:25:18,954] Trial 49 finished with value: 0.19015110317151745 and parameters: {'model_type': 'mlp', 'hidden_dims': '[256, 128, 64]', 'dropout': 0.43743074682226524, 'batch_norm': False, 'lr': 0.00012390451171823995, 'weight_decay': 1.6406065530654777e-05, 'epochs': 319, 'loss': 'mae', 'optimizer': 'adam', 'graph_mode': 'off', 'use_snp_selection': True, 'num_snps': 49352}. Best is trial 36 with value: 0.22339838524676997.
[I 2025-12-05 15:27:05,427] Trial 50 finished with value: 0.19885617095224445 and parameters: {'model_type': 'mlp', 'hidden_dims': '[512, 64]', 'dropout': 0.4255494502398089, 'batch_norm': True, 'lr': 5.238383695351619e-06, 'weight_decay': 5.888357472728179e-05, 'epochs': 349, 'loss': 'mae', 'optimizer': 'adam', 'graph_mode': 'off', 'use_snp_selection': True, 'num_snps': 41695}. Best is trial 36 with value: 0.22339838524676997.
