[I 2025-12-05 15:13:35,177] Trial 54 finished with value: 0.10387734889837442 and parameters: {'model_type': 'mlp', 'hidden_dims': '[512, 128]', 'dropout': 0.18667976826426352, 'batch_norm': True, 'lr': 0.00039667566101649196, 'weight_decay': 3.481246943608387e-05, 'epochs': 248, 'loss': 'mae', 'optimizer': 'adam', 'graph_mode': 'off', 'use_snp_selection': False}. Best is trial 24 with value: 0.12485782695779535.
[I 2025-12-05 15:13:37,062] Trial 55 finished with value: 0.1093654038342046 and parameters: {'model_type': 'mlp', 'hidden_dims': '[512, 64]', 'dropout': 0.15292084673689457, 'batch_norm': True, 'lr': 0.0002628704811344889, 'weight_decay': 1.0260720658727224e-05, 'epochs': 272, 'loss': 'mae', 'optimizer': 'adam', 'graph_mode': 'off', 'use_snp_selection': False}. Best is trial 24 with value: 0.12485782695779535.
[I 2025-12-05 15:13:38,905] Trial 56 finished with value: 0.10824333764920639 and parameters: {'model_type': 'mlp', 'hidden_dims': '[512, 256]', 'dropout': 0.13622964050641503, 'batch_norm': True, 'lr': 9.699872635319036e-05, 'weight_decay': 2.6419050728425427e-06, 'epochs': 264, 'loss': 'mae', 'optimizer': 'adam', 'graph_mode': 'off', 'use_snp_selection': False}. Best is trial 24 with value: 0.12485782695779535.
[I 2025-12-05 15:13:41,034] Trial 57 finished with value: 0.1046910650931626 and parameters: {'model_type': 'mlp', 'hidden_dims': '[512, 128]', 'dropout': 0.22260367063177333, 'batch_norm': True, 'lr': 5.600326107300262e-05, 'weight_decay': 4.34164838189614e-06, 'epochs': 336, 'loss': 'mae', 'optimizer': 'adam', 'graph_mode': 'off', 'use_snp_selection': False}. Best is trial 24 with value: 0.12485782695779535.
[I 2025-12-05 15:13:42,170] Trial 58 finished with value: 0.1020510562434025 and parameters: {'model_type': 'mlp', 'hidden_dims': '[256, 128]', 'dropout': 0.4591897289726491, 'batch_norm': False, 'lr': 0.00018223957857596348, 'weight_decay': 0.00010075935845631274, 'epochs': 233, 'loss': 'mae', 'optimizer': 'adam', 'graph_mode': 'off', 'use_snp_selection': False}. Best is trial 24 with value: 0.12485782695779535.
[I 2025-12-05 15:13:45,178] Trial 59 finished with value: 0.10748182825578419 and parameters: {'model_type': 'mlp', 'hidden_dims': '[512, 128]', 'dropout': 0.4292474745969925, 'batch_norm': True, 'lr': 0.00014090140151655316, 'weight_decay': 1.6139406775110432e-07, 'epochs': 284, 'loss': 'mse', 'optimizer': 'adam', 'graph_mode': 'off', 'use_snp_selection': True, 'num_snps': 49106}. Best is trial 24 with value: 0.12485782695779535.
[I 2025-12-05 15:13:46,834] Trial 60 finished with value: 0.11623904133211055 and parameters: {'model_type': 'mlp', 'hidden_dims': '[512, 128]', 'dropout': 0.3473962935498962, 'batch_norm': True, 'lr': 0.0003148888825430898, 'weight_decay': 1.352520043162119e-05, 'epochs': 213, 'loss': 'mae', 'optimizer': 'adam', 'graph_mode': 'off', 'use_snp_selection': False}. Best is trial 24 with value: 0.12485782695779535.
[I 2025-12-05 15:13:48,559] Trial 61 finished with value: 0.0859337998604768 and parameters: {'model_type': 'mlp', 'hidden_dims': '[512, 256]', 'dropout': 0.4073610501109933, 'batch_norm': False, 'lr': 0.00038144867615450836, 'weight_decay': 1.2663549060259867e-06, 'epochs': 249, 'loss': 'mae', 'optimizer': 'adam', 'graph_mode': 'off', 'use_snp_selection': False}. Best is trial 24 with value: 0.12485782695779535.
[I 2025-12-05 15:13:50,355] Trial 62 finished with value: 0.10401201129891956 and parameters: {'model_type': 'mlp', 'hidden_dims': '[512, 256]', 'dropout': 0.36699444255920344, 'batch_norm': False, 'lr': 0.0002255977186257849, 'weight_decay': 2.2640745937389483e-06, 'epochs': 265, 'loss': 'mae', 'optimizer': 'adam', 'graph_mode': 'off', 'use_snp_selection': False}. Best is trial 24 with value: 0.12485782695779535.
[I 2025-12-05 15:13:52,193] Trial 63 finished with value: 0.11624656238148967 and parameters: {'model_type': 'mlp', 'hidden_dims': '[512, 256]', 'dropout': 0.39318640989124926, 'batch_norm': False, 'lr': 0.00034170661730126446, 'weight_decay': 7.711692223445815e-06, 'epochs': 276, 'loss': 'mae', 'optimizer': 'adam', 'graph_mode': 'off', 'use_snp_selection': False}. Best is trial 24 with value: 0.12485782695779535.
[I 2025-12-05 15:13:54,236] Trial 64 finished with value: 0.1209212076961254 and parameters: {'model_type': 'mlp', 'hidden_dims': '[512, 256]', 'dropout': 0.3967902849938453, 'batch_norm': False, 'lr': 0.0006529216885998257, 'weight_decay': 2.224846222271109e-05, 'epochs': 329, 'loss': 'mae', 'optimizer': 'adam', 'graph_mode': 'off', 'use_snp_selection': False}. Best is trial 24 with value: 0.12485782695779535.
[I 2025-12-05 15:13:56,317] Trial 65 finished with value: 0.09424029103598847 and parameters: {'model_type': 'mlp', 'hidden_dims': '[512, 256]', 'dropout': 0.45003801452217707, 'batch_norm': False, 'lr': 0.0008671720811347968, 'weight_decay': 5.406554578323809e-05, 'epochs': 338, 'loss': 'mae', 'optimizer': 'adam', 'graph_mode': 'off', 'use_snp_selection': False}. Best is trial 24 with value: 0.12485782695779535.
[I 2025-12-05 15:13:57,413] Trial 66 finished with value: 0.11456733886315676 and parameters: {'model_type': 'mlp', 'hidden_dims': '[128, 64]', 'dropout': 0.11298144955152782, 'batch_norm': True, 'lr': 0.0006382086783596998, 'weight_decay': 2.5632814664681907e-05, 'epochs': 326, 'loss': 'mae', 'optimizer': 'adam', 'graph_mode': 'off', 'use_snp_selection': False}. Best is trial 24 with value: 0.12485782695779535.
[I 2025-12-05 15:13:59,400] Trial 67 finished with value: 0.10351563261478668 and parameters: {'model_type': 'mlp', 'hidden_dims': '[512, 128]', 'dropout': 0.39250194865481375, 'batch_norm': False, 'lr': 0.00044647668314209016, 'weight_decay': 1.9794966981899013e-05, 'epochs': 309, 'loss': 'mae', 'optimizer': 'adam', 'graph_mode': 'off', 'use_snp_selection': False}. Best is trial 24 with value: 0.12485782695779535.
[I 2025-12-05 15:14:00,737] Trial 68 finished with value: 0.09596539008910439 and parameters: {'model_type': 'mlp', 'hidden_dims': '[256, 128, 64]', 'dropout': 0.13944365041281465, 'batch_norm': True, 'lr': 0.00011478751609575505, 'weight_decay': 0.0002591787421298467, 'epochs': 295, 'loss': 'mae', 'optimizer': 'adam', 'graph_mode': 'off', 'use_snp_selection': False}. Best is trial 24 with value: 0.12485782695779535.
[I 2025-12-05 15:14:01,807] Trial 69 finished with value: 0.10015270804506121 and parameters: {'model_type': 'mlp', 'hidden_dims': '[256, 128]', 'dropout': 0.3264108195443436, 'batch_norm': True, 'lr': 8.448819739659864e-05, 'weight_decay': 3.565378820014395e-06, 'epochs': 192, 'loss': 'mae', 'optimizer': 'adam', 'graph_mode': 'off', 'use_snp_selection': False}. Best is trial 24 with value: 0.12485782695779535.
[I 2025-12-05 15:14:03,638] Trial 70 finished with value: 0.09468022769090845 and parameters: {'model_type': 'mlp', 'hidden_dims': '[512, 128]', 'dropout': 0.5998421747029579, 'batch_norm': False, 'lr': 0.0002467454849687204, 'weight_decay': 3.212010002756521e-05, 'epochs': 337, 'loss': 'mae', 'optimizer': 'adam', 'graph_mode': 'off', 'use_snp_selection': True, 'num_snps': 24605}. Best is trial 24 with value: 0.12485782695779535.
[I 2025-12-05 15:14:05,358] Trial 71 finished with value: 0.09960488858976596 and parameters: {'model_type': 'mlp', 'hidden_dims': '[512, 256]', 'dropout': 0.42034969172632525, 'batch_norm': False, 'lr': 0.0003042071830444662, 'weight_decay': 6.237996310294742e-06, 'epochs': 242, 'loss': 'mae', 'optimizer': 'adam', 'graph_mode': 'off', 'use_snp_selection': False}. Best is trial 24 with value: 0.12485782695779535.
[I 2025-12-05 15:14:07,212] Trial 72 finished with value: 0.09551928949815255 and parameters: {'model_type': 'mlp', 'hidden_dims': '[512, 256]', 'dropout': 0.47906528325637987, 'batch_norm': False, 'lr': 0.0004915601722056507, 'weight_decay': 1.932323210953447e-06, 'epochs': 271, 'loss': 'mae', 'optimizer': 'adam', 'graph_mode': 'off', 'use_snp_selection': False}. Best is trial 24 with value: 0.12485782695779535.
[I 2025-12-05 15:14:08,870] Trial 73 finished with value: 0.11169895571245421 and parameters: {'model_type': 'mlp', 'hidden_dims': '[512, 256]', 'dropout': 0.405184989401038, 'batch_norm': False, 'lr': 0.0009791654904104615, 'weight_decay': 3.7084987957871207e-06, 'epochs': 227, 'loss': 'mae', 'optimizer': 'adam', 'graph_mode': 'off', 'use_snp_selection': False}. Best is trial 24 with value: 0.12485782695779535.
[I 2025-12-05 15:14:10,907] Trial 74 finished with value: 0.08977740600732928 and parameters: {'model_type': 'mlp', 'hidden_dims': '[512, 256]', 'dropout': 0.35620364976568514, 'batch_norm': False, 'lr': 0.000598292265694626, 'weight_decay': 9.064253604704375e-06, 'epochs': 322, 'loss': 'mae', 'optimizer': 'adam', 'graph_mode': 'off', 'use_snp_selection': False}. Best is trial 24 with value: 0.12485782695779535.
[I 2025-12-05 15:14:12,836] Trial 75 finished with value: 0.10635935708803244 and parameters: {'model_type': 'mlp', 'hidden_dims': '[512, 256]', 'dropout': 0.46657854963617595, 'batch_norm': False, 'lr': 0.00016878336427351875, 'weight_decay': 1.273980889750741e-05, 'epochs': 303, 'loss': 'mae', 'optimizer': 'adam', 'graph_mode': 'off', 'use_snp_selection': False}. Best is trial 24 with value: 0.12485782695779535.
[I 2025-12-05 15:14:14,754] Trial 76 finished with value: 0.07868598438981537 and parameters: {'model_type': 'mlp', 'hidden_dims': '[512, 64]', 'dropout': 0.44020861431352215, 'batch_norm': True, 'lr': 3.8755996836539004e-05, 'weight_decay': 2.1782596372697522e-05, 'epochs': 287, 'loss': 'mse', 'optimizer': 'adam', 'graph_mode': 'off', 'use_snp_selection': False}. Best is trial 24 with value: 0.12485782695779535.
[I 2025-12-05 15:14:16,509] Trial 77 finished with value: 0.059439783321204476 and parameters: {'model_type': 'mlp', 'hidden_dims': '[512, 128]', 'dropout': 0.2951223655069457, 'batch_norm': False, 'lr': 2.24208017577082e-06, 'weight_decay': 5.499258313752377e-06, 'epochs': 257, 'loss': 'mae', 'optimizer': 'adam', 'graph_mode': 'off', 'use_snp_selection': False}. Best is trial 24 with value: 0.12485782695779535.
[I 2025-12-05 15:14:17,818] Trial 78 finished with value: 0.09145749852327173 and parameters: {'model_type': 'mlp', 'hidden_dims': '[256, 128]', 'dropout': 0.5274020133966341, 'batch_norm': True, 'lr': 0.00020223398685740063, 'weight_decay': 4.203371019885973e-05, 'epochs': 313, 'loss': 'mae', 'optimizer': 'adam', 'graph_mode': 'off', 'use_snp_selection': False}. Best is trial 24 with value: 0.12485782695779535.
[I 2025-12-05 15:14:18,816] Trial 79 finished with value: 0.0795980837270205 and parameters: {'model_type': 'mlp', 'hidden_dims': '[512, 256]', 'dropout': 0.38274668663773864, 'batch_norm': True, 'lr': 2.3143489677545154e-05, 'weight_decay': 1.4233966452741689e-05, 'epochs': 53, 'loss': 'mae', 'optimizer': 'adam', 'graph_mode': 'off', 'use_snp_selection': False}. Best is trial 24 with value: 0.12485782695779535.
[I 2025-12-05 15:14:20,918] Trial 80 finished with value: 0.10717121470689782 and parameters: {'model_type': 'mlp', 'hidden_dims': '[512, 128]', 'dropout': 0.422002247925497, 'batch_norm': False, 'lr': 7.355292473156307e-05, 'weight_decay': 5.333474076960771e-05, 'epochs': 348, 'loss': 'mae', 'optimizer': 'adam', 'graph_mode': 'off', 'use_snp_selection': False}. Best is trial 24 with value: 0.12485782695779535.
[I 2025-12-05 15:14:22,777] Trial 81 finished with value: 0.10555329483211769 and parameters: {'model_type': 'mlp', 'hidden_dims': '[512, 256]', 'dropout': 0.3987408556732036, 'batch_norm': False, 'lr': 0.0003447135732464845, 'weight_decay': 7.556041265977862e-06, 'epochs': 275, 'loss': 'mae', 'optimizer': 'adam', 'graph_mode': 'off', 'use_snp_selection': False}. Best is trial 24 with value: 0.12485782695779535.
[I 2025-12-05 15:14:24,611] Trial 82 finished with value: 0.08200360407717094 and parameters: {'model_type': 'mlp', 'hidden_dims': '[512, 256]', 'dropout': 0.39371084179552496, 'batch_norm': False, 'lr': 0.00028185191574742636, 'weight_decay': 2.496218236912525e-06, 'epochs': 278, 'loss': 'mae', 'optimizer': 'adam', 'graph_mode': 'off', 'use_snp_selection': False}. Best is trial 24 with value: 0.12485782695779535.
[I 2025-12-05 15:14:26,328] Trial 83 finished with value: 0.09104587491418786 and parameters: {'model_type': 'mlp', 'hidden_dims': '[512, 256]', 'dropout': 0.36726426734650097, 'batch_norm': False, 'lr': 0.00043903453380605045, 'weight_decay': 1.0247333444530688e-05, 'epochs': 240, 'loss': 'mae', 'optimizer': 'adam', 'graph_mode': 'off', 'use_snp_selection': False}. Best is trial 24 with value: 0.12485782695779535.
[I 2025-12-05 15:14:28,206] Trial 84 finished with value: 0.07948606125780232 and parameters: {'model_type': 'mlp', 'hidden_dims': '[512, 256]', 'dropout': 0.4923757848293242, 'batch_norm': False, 'lr': 0.0001094114528365809, 'weight_decay': 8.460959991953026e-06, 'epochs': 289, 'loss': 'mae', 'optimizer': 'adam', 'graph_mode': 'off', 'use_snp_selection': False}. Best is trial 24 with value: 0.12485782695779535.
[I 2025-12-05 15:14:29,074] Trial 85 finished with value: 0.09839527765983153 and parameters: {'model_type': 'mlp', 'hidden_dims': '[128, 64]', 'dropout': 0.10876934525590609, 'batch_norm': False, 'lr': 0.00014743358456040928, 'weight_decay': 1.4546402402346697e-06, 'epochs': 251, 'loss': 'mae', 'optimizer': 'adam', 'graph_mode': 'off', 'use_snp_selection': False}. Best is trial 24 with value: 0.12485782695779535.
[I 2025-12-05 15:14:32,004] Trial 86 finished with value: 0.10962849343118597 and parameters: {'model_type': 'mlp', 'hidden_dims': '[512, 256]', 'dropout': 0.1284653198980504, 'batch_norm': True, 'lr': 0.0007271643896245331, 'weight_decay': 6.088273608273624e-06, 'epochs': 264, 'loss': 'mae', 'optimizer': 'adam', 'graph_mode': 'off', 'use_snp_selection': True, 'num_snps': 49704}. Best is trial 24 with value: 0.12485782695779535.
[I 2025-12-05 15:14:33,386] Trial 87 finished with value: 0.09268618585609394 and parameters: {'model_type': 'mlp', 'hidden_dims': '[256, 128, 64]', 'dropout': 0.43857526482453524, 'batch_norm': True, 'lr': 0.00019943763642756056, 'weight_decay': 1.850653040430049e-05, 'epochs': 300, 'loss': 'mse', 'optimizer': 'adam', 'graph_mode': 'off', 'use_snp_selection': False}. Best is trial 24 with value: 0.12485782695779535.
[I 2025-12-05 15:14:34,959] Trial 88 finished with value: 0.0886361123402904 and parameters: {'model_type': 'mlp', 'hidden_dims': '[512, 128]', 'dropout': 0.38695185345247496, 'batch_norm': False, 'lr': 0.00035166590577077314, 'weight_decay': 3.282275114295767e-05, 'epochs': 208, 'loss': 'mae', 'optimizer': 'adam', 'graph_mode': 'off', 'use_snp_selection': False}. Best is trial 24 with value: 0.12485782695779535.
[I 2025-12-05 15:14:36,167] Trial 89 finished with value: 0.11160591245504464 and parameters: {'model_type': 'mlp', 'hidden_dims': '[256, 128]', 'dropout': 0.4560228230963692, 'batch_norm': True, 'lr': 0.000248272391314076, 'weight_decay': 7.001499216589168e-05, 'epochs': 256, 'loss': 'mae', 'optimizer': 'adam', 'graph_mode': 'off', 'use_snp_selection': False}. Best is trial 24 with value: 0.12485782695779535.
[I 2025-12-05 15:14:37,840] Trial 90 finished with value: 0.10676714377096197 and parameters: {'model_type': 'mlp', 'hidden_dims': '[512, 128]', 'dropout': 0.33259895051122446, 'batch_norm': True, 'lr': 0.0003141758543900812, 'weight_decay': 5.962735499893976e-07, 'epochs': 228, 'loss': 'mae', 'optimizer': 'adam', 'graph_mode': 'off', 'use_snp_selection': False}. Best is trial 24 with value: 0.12485782695779535.
[I 2025-12-05 15:14:39,445] Trial 91 finished with value: 0.10037091733483844 and parameters: {'model_type': 'mlp', 'hidden_dims': '[512, 128]', 'dropout': 0.2665333315693793, 'batch_norm': True, 'lr': 0.0005372513827150092, 'weight_decay': 1.422908616542753e-05, 'epochs': 213, 'loss': 'mae', 'optimizer': 'adam', 'graph_mode': 'off', 'use_snp_selection': False}. Best is trial 24 with value: 0.12485782695779535.
[I 2025-12-05 15:14:41,119] Trial 92 finished with value: 0.10959343209398227 and parameters: {'model_type': 'mlp', 'hidden_dims': '[512, 128]', 'dropout': 0.3515655504657204, 'batch_norm': True, 'lr': 0.00030787562267810525, 'weight_decay': 3.949170955090386e-06, 'epochs': 224, 'loss': 'mae', 'optimizer': 'adam', 'graph_mode': 'off', 'use_snp_selection': False}. Best is trial 24 with value: 0.12485782695779535.
[I 2025-12-05 15:14:42,824] Trial 93 finished with value: 0.10990284339664656 and parameters: {'model_type': 'mlp', 'hidden_dims': '[512, 128]', 'dropout': 0.31145755025410926, 'batch_norm': True, 'lr': 0.00040406297197071985, 'weight_decay': 3.051251353625081e-06, 'epochs': 238, 'loss': 'mae', 'optimizer': 'adam', 'graph_mode': 'off', 'use_snp_selection': False}. Best is trial 24 with value: 0.12485782695779535.
[I 2025-12-05 15:14:44,225] Trial 94 finished with value: 0.1108278702378014 and parameters: {'model_type': 'mlp', 'hidden_dims': '[512, 128]', 'dropout': 0.24957499529952987, 'batch_norm': True, 'lr': 0.0002243993440267741, 'weight_decay': 1.3150118814851596e-05, 'epochs': 159, 'loss': 'mae', 'optimizer': 'adam', 'graph_mode': 'off', 'use_snp_selection': False}. Best is trial 24 with value: 0.12485782695779535.
[I 2025-12-05 15:14:45,779] Trial 95 finished with value: 0.12103729709162965 and parameters: {'model_type': 'mlp', 'hidden_dims': '[512, 64]', 'dropout': 0.2124261039760527, 'batch_norm': True, 'lr': 0.00018121020786885728, 'weight_decay': 2.3135719568992944e-05, 'epochs': 200, 'loss': 'mae', 'optimizer': 'adam', 'graph_mode': 'off', 'use_snp_selection': False}. Best is trial 24 with value: 0.12485782695779535.
[I 2025-12-05 15:14:47,662] Trial 96 finished with value: 0.11180574702126567 and parameters: {'model_type': 'mlp', 'hidden_dims': '[512, 64]', 'dropout': 0.1607002121521624, 'batch_norm': True, 'lr': 0.0001762860288440608, 'weight_decay': 2.8311345527117315e-05, 'epochs': 279, 'loss': 'mae', 'optimizer': 'adam', 'graph_mode': 'off', 'use_snp_selection': False}. Best is trial 24 with value: 0.12485782695779535.
[I 2025-12-05 15:14:49,387] Trial 97 finished with value: 0.12017620446299485 and parameters: {'model_type': 'mlp', 'hidden_dims': '[512, 64]', 'dropout': 0.20676914649735795, 'batch_norm': False, 'lr': 0.0001329933483761432, 'weight_decay': 2.167478004496301e-05, 'epochs': 246, 'loss': 'mae', 'optimizer': 'adam', 'graph_mode': 'off', 'use_snp_selection': False}. Best is trial 24 with value: 0.12485782695779535.
[I 2025-12-05 15:14:50,884] Trial 98 finished with value: 0.10252423333251431 and parameters: {'model_type': 'mlp', 'hidden_dims': '[512, 64]', 'dropout': 0.22215172307567074, 'batch_norm': True, 'lr': 0.00014449886811815325, 'weight_decay': 2.128027317258747e-05, 'epochs': 176, 'loss': 'mae', 'optimizer': 'adam', 'graph_mode': 'off', 'use_snp_selection': False}. Best is trial 24 with value: 0.12485782695779535.
[I 2025-12-05 15:14:51,836] Trial 99 finished with value: 0.0988964746825055 and parameters: {'model_type': 'mlp', 'hidden_dims': '[512, 64]', 'dropout': 0.20948747523226846, 'batch_norm': True, 'lr': 9.713389774083276e-05, 'weight_decay': 3.9390784710659354e-05, 'epochs': 246, 'loss': 'mae', 'optimizer': 'adam', 'graph_mode': 'off', 'use_snp_selection': True, 'num_snps': 2218}. Best is trial 24 with value: 0.12485782695779535.
[I 2025-12-05 15:14:53,361] Trial 100 finished with value: 0.10655637166056757 and parameters: {'model_type': 'mlp', 'hidden_dims': '[512, 64]', 'dropout': 0.12055229272138211, 'batch_norm': False, 'lr': 0.00011248543427419436, 'weight_decay': 2.856574285070773e-05, 'epochs': 197, 'loss': 'mse', 'optimizer': 'adam', 'graph_mode': 'off', 'use_snp_selection': False}. Best is trial 24 with value: 0.12485782695779535.
[I 2025-12-05 15:14:55,153] Trial 101 finished with value: 0.1278019507532439 and parameters: {'model_type': 'mlp', 'hidden_dims': '[512, 64]', 'dropout': 0.19128038729575714, 'batch_norm': False, 'lr': 0.00019515070254895177, 'weight_decay': 1.666301692722538e-05, 'epochs': 264, 'loss': 'mae', 'optimizer': 'adam', 'graph_mode': 'off', 'use_snp_selection': False}. Best is trial 101 with value: 0.1278019507532439.
[I 2025-12-05 15:14:56,955] Trial 102 finished with value: 0.11172290156477871 and parameters: {'model_type': 'mlp', 'hidden_dims': '[512, 64]', 'dropout': 0.18873575226880002, 'batch_norm': False, 'lr': 0.00013475175152862886, 'weight_decay': 2.2323244079325913e-05, 'epochs': 269, 'loss': 'mae', 'optimizer': 'adam', 'graph_mode': 'off', 'use_snp_selection': False}. Best is trial 101 with value: 0.1278019507532439.
[I 2025-12-05 15:14:58,253] Trial 103 finished with value: 0.09009191660616754 and parameters: {'model_type': 'mlp', 'hidden_dims': '[512, 64]', 'dropout': 0.21001978722476627, 'batch_norm': False, 'lr': 0.00018782342726402857, 'weight_decay': 5.475968546834864e-05, 'epochs': 130, 'loss': 'mae', 'optimizer': 'adam', 'graph_mode': 'off', 'use_snp_selection': False}. Best is trial 101 with value: 0.1278019507532439.
[I 2025-12-05 15:14:59,931] Trial 104 finished with value: 0.11309040858684427 and parameters: {'model_type': 'mlp', 'hidden_dims': '[512, 64]', 'dropout': 0.17492882936389725, 'batch_norm': False, 'lr': 0.0001591042828266761, 'weight_decay': 1.639744374673635e-05, 'epochs': 235, 'loss': 'mae', 'optimizer': 'adam', 'graph_mode': 'off', 'use_snp_selection': False}. Best is trial 101 with value: 0.1278019507532439.
[I 2025-12-05 15:15:01,729] Trial 105 finished with value: 0.1105131040241392 and parameters: {'model_type': 'mlp', 'hidden_dims': '[512, 64]', 'dropout': 0.1489451293464254, 'batch_norm': False, 'lr': 0.00023804492827759623, 'weight_decay': 4.635134090234791e-05, 'epochs': 262, 'loss': 'mae', 'optimizer': 'adam', 'graph_mode': 'off', 'use_snp_selection': False}. Best is trial 101 with value: 0.1278019507532439.
