[I 2025-12-06 04:14:47,739] Trial 78 finished with value: 0.19365453081609987 and parameters: {'model_type': 'mlp', 'hidden_dims': '[512, 64]', 'dropout': 0.2734888489159242, 'batch_norm': False, 'lr': 3.148035369641288e-05, 'weight_decay': 9.317483404219723e-06, 'epochs': 53, 'loss': 'mse', 'optimizer': 'adam', 'graph_mode': 'off', 'use_snp_selection': True, 'num_snps': 22208}. Best is trial 76 with value: 0.21110188042063088.
[I 2025-12-06 04:15:24,501] Trial 79 finished with value: 0.19255357151113206 and parameters: {'model_type': 'mlp', 'hidden_dims': '[512, 64]', 'dropout': 0.2956386557677382, 'batch_norm': False, 'lr': 4.691015990615866e-05, 'weight_decay': 6.112869485201917e-06, 'epochs': 58, 'loss': 'mae', 'optimizer': 'adam', 'graph_mode': 'off', 'use_snp_selection': True, 'num_snps': 15115}. Best is trial 76 with value: 0.21110188042063088.
[I 2025-12-06 04:16:08,034] Trial 80 finished with value: 0.18495494169215443 and parameters: {'model_type': 'mlp', 'hidden_dims': '[512, 64]', 'dropout': 0.23699758308597155, 'batch_norm': False, 'lr': 6.127753938304005e-06, 'weight_decay': 1.636104559679183e-05, 'epochs': 50, 'loss': 'mae', 'optimizer': 'adam', 'graph_mode': 'off', 'use_snp_selection': True, 'num_snps': 28203}. Best is trial 76 with value: 0.21110188042063088.
[I 2025-12-06 04:16:55,046] Trial 81 finished with value: 0.1892736646067208 and parameters: {'model_type': 'mlp', 'hidden_dims': '[512, 64]', 'dropout': 0.2660812214726088, 'batch_norm': False, 'lr': 4.088938009362062e-05, 'weight_decay': 1.1913980630974262e-05, 'epochs': 76, 'loss': 'mae', 'optimizer': 'adam', 'graph_mode': 'off', 'use_snp_selection': True, 'num_snps': 29077}. Best is trial 76 with value: 0.21110188042063088.
[I 2025-12-06 04:17:27,832] Trial 82 finished with value: 0.18334398635947297 and parameters: {'model_type': 'mlp', 'hidden_dims': '[512, 64]', 'dropout': 0.3103540393587937, 'batch_norm': False, 'lr': 0.00010918566520142409, 'weight_decay': 4.5674031900477595e-06, 'epochs': 43, 'loss': 'mae', 'optimizer': 'adam', 'graph_mode': 'off', 'use_snp_selection': True, 'num_snps': 9195}. Best is trial 76 with value: 0.21110188042063088.
[I 2025-12-06 04:18:20,164] Trial 83 finished with value: 0.1913575473003621 and parameters: {'model_type': 'mlp', 'hidden_dims': '[512, 64]', 'dropout': 0.3299274958162167, 'batch_norm': False, 'lr': 2.2750318045563644e-05, 'weight_decay': 1.1794551612106155e-05, 'epochs': 67, 'loss': 'mae', 'optimizer': 'adam', 'graph_mode': 'off', 'use_snp_selection': True, 'num_snps': 38806}. Best is trial 76 with value: 0.21110188042063088.
[I 2025-12-06 04:19:00,989] Trial 84 finished with value: 0.18155745986515212 and parameters: {'model_type': 'mlp', 'hidden_dims': '[512, 64]', 'dropout': 0.2465635281931438, 'batch_norm': False, 'lr': 6.023093636807331e-05, 'weight_decay': 2.5764510937257782e-06, 'epochs': 92, 'loss': 'mae', 'optimizer': 'adam', 'graph_mode': 'off', 'use_snp_selection': True, 'num_snps': 17523}. Best is trial 76 with value: 0.21110188042063088.
[I 2025-12-06 04:20:05,209] Trial 85 finished with value: 0.17005140354084078 and parameters: {'model_type': 'mlp', 'hidden_dims': '[512, 64]', 'dropout': 0.295807220386718, 'batch_norm': False, 'lr': 7.405881747198217e-05, 'weight_decay': 1.6199427433974593e-05, 'epochs': 271, 'loss': 'mae', 'optimizer': 'adam', 'graph_mode': 'off', 'use_snp_selection': True, 'num_snps': 25379}. Best is trial 76 with value: 0.21110188042063088.
[I 2025-12-06 04:20:54,175] Trial 86 finished with value: 0.19453168794861767 and parameters: {'model_type': 'mlp', 'hidden_dims': '[512, 64]', 'dropout': 0.28188621599878355, 'batch_norm': False, 'lr': 3.626916468985616e-05, 'weight_decay': 6.238503391552109e-06, 'epochs': 61, 'loss': 'mae', 'optimizer': 'adam', 'graph_mode': 'off', 'use_snp_selection': True, 'num_snps': 34970}. Best is trial 76 with value: 0.21110188042063088.
[I 2025-12-06 04:21:29,880] Trial 87 finished with value: 0.19192926916161746 and parameters: {'model_type': 'mlp', 'hidden_dims': '[512, 64]', 'dropout': 0.19551002149198493, 'batch_norm': False, 'lr': 1.4797008425587347e-05, 'weight_decay': 9.649944265844385e-06, 'epochs': 79, 'loss': 'mae', 'optimizer': 'adam', 'graph_mode': 'off', 'use_snp_selection': True, 'num_snps': 11639}. Best is trial 76 with value: 0.21110188042063088.
[I 2025-12-06 04:22:20,828] Trial 88 finished with value: 0.18517510941235155 and parameters: {'model_type': 'mlp', 'hidden_dims': '[512, 64]', 'dropout': 0.21104383229140597, 'batch_norm': False, 'lr': 4.3550923661134985e-05, 'weight_decay': 1.9434951474556906e-05, 'epochs': 47, 'loss': 'mae', 'optimizer': 'adam', 'graph_mode': 'off', 'use_snp_selection': True, 'num_snps': 41824}. Best is trial 76 with value: 0.21110188042063088.
[I 2025-12-06 04:23:30,782] Trial 89 finished with value: 0.18435956060438216 and parameters: {'model_type': 'mlp', 'hidden_dims': '[512, 64]', 'dropout': 0.5694304479019825, 'batch_norm': False, 'lr': 2.018739373735541e-05, 'weight_decay': 1.3146035650122322e-05, 'epochs': 243, 'loss': 'mse', 'optimizer': 'adam', 'graph_mode': 'off', 'use_snp_selection': False}. Best is trial 76 with value: 0.21110188042063088.
[I 2025-12-06 04:23:56,607] Trial 90 finished with value: 0.19337431330604585 and parameters: {'model_type': 'mlp', 'hidden_dims': '[512, 64]', 'dropout': 0.5999705009947164, 'batch_norm': False, 'lr': 5.4269900483603006e-05, 'weight_decay': 3.1686471379391336e-06, 'epochs': 71, 'loss': 'mae', 'optimizer': 'adam', 'graph_mode': 'off', 'use_snp_selection': False}. Best is trial 76 with value: 0.21110188042063088.
[I 2025-12-06 04:24:14,608] Trial 91 finished with value: 0.19937879653074628 and parameters: {'model_type': 'mlp', 'hidden_dims': '[256, 128]', 'dropout': 0.2705746667497331, 'batch_norm': False, 'lr': 2.9006782792513498e-05, 'weight_decay': 2.983758442441506e-05, 'epochs': 87, 'loss': 'mae', 'optimizer': 'adam', 'graph_mode': 'off', 'use_snp_selection': False}. Best is trial 76 with value: 0.21110188042063088.
[I 2025-12-06 04:24:35,584] Trial 92 finished with value: 0.20643691170034884 and parameters: {'model_type': 'mlp', 'hidden_dims': '[256, 128]', 'dropout': 0.17344962045719645, 'batch_norm': False, 'lr': 3.466207452321821e-05, 'weight_decay': 7.78529497072912e-06, 'epochs': 110, 'loss': 'mae', 'optimizer': 'adam', 'graph_mode': 'off', 'use_snp_selection': False}. Best is trial 76 with value: 0.21110188042063088.
[I 2025-12-06 04:25:12,874] Trial 93 finished with value: 0.19220028246273818 and parameters: {'model_type': 'mlp', 'hidden_dims': '[512, 64]', 'dropout': 0.17942932906270048, 'batch_norm': False, 'lr': 3.504205088666183e-05, 'weight_decay': 6.680539676829285e-06, 'epochs': 115, 'loss': 'mae', 'optimizer': 'adam', 'graph_mode': 'off', 'use_snp_selection': False}. Best is trial 76 with value: 0.21110188042063088.
[I 2025-12-06 04:25:41,363] Trial 94 finished with value: 0.1937191229188355 and parameters: {'model_type': 'mlp', 'hidden_dims': '[512, 64]', 'dropout': 0.21485178934490887, 'batch_norm': False, 'lr': 2.5618793195291957e-05, 'weight_decay': 8.995876107751592e-06, 'epochs': 81, 'loss': 'mae', 'optimizer': 'adam', 'graph_mode': 'off', 'use_snp_selection': False}. Best is trial 76 with value: 0.21110188042063088.
[I 2025-12-06 04:26:16,524] Trial 95 finished with value: 0.19477524757255743 and parameters: {'model_type': 'mlp', 'hidden_dims': '[512, 128]', 'dropout': 0.14590431126321335, 'batch_norm': False, 'lr': 1.8395678625430274e-05, 'weight_decay': 4.954347784114934e-06, 'epochs': 106, 'loss': 'mae', 'optimizer': 'adam', 'graph_mode': 'off', 'use_snp_selection': False}. Best is trial 76 with value: 0.21110188042063088.
[I 2025-12-06 04:26:26,801] Trial 96 finished with value: 0.18991754692460305 and parameters: {'model_type': 'mlp', 'hidden_dims': '[128, 64]', 'dropout': 0.29680672014658127, 'batch_norm': False, 'lr': 3.9585766765325266e-05, 'weight_decay': 1.178055553114611e-05, 'epochs': 66, 'loss': 'mae', 'optimizer': 'adam', 'graph_mode': 'off', 'use_snp_selection': False}. Best is trial 76 with value: 0.21110188042063088.
[I 2025-12-06 04:26:46,225] Trial 97 finished with value: 0.18741425937354833 and parameters: {'model_type': 'mlp', 'hidden_dims': '[256, 128]', 'dropout': 0.16952594449414735, 'batch_norm': False, 'lr': 9.486033606488337e-06, 'weight_decay': 7.998156218320659e-06, 'epochs': 97, 'loss': 'mae', 'optimizer': 'adam', 'graph_mode': 'off', 'use_snp_selection': False}. Best is trial 76 with value: 0.21110188042063088.
[I 2025-12-06 04:27:27,504] Trial 98 finished with value: 0.2031371145776087 and parameters: {'model_type': 'mlp', 'hidden_dims': '[512, 256]', 'dropout': 0.2409334387003869, 'batch_norm': False, 'lr': 1.1722686750329327e-05, 'weight_decay': 1.4536322010047043e-05, 'epochs': 128, 'loss': 'mae', 'optimizer': 'adam', 'graph_mode': 'off', 'use_snp_selection': False}. Best is trial 76 with value: 0.21110188042063088.
[I 2025-12-06 04:28:35,046] Trial 99 finished with value: 0.18894402661641435 and parameters: {'model_type': 'mlp', 'hidden_dims': '[512, 256]', 'dropout': 0.19675305588729156, 'batch_norm': False, 'lr': 1.3203988095632906e-05, 'weight_decay': 2.0954559014838017e-05, 'epochs': 113, 'loss': 'mae', 'optimizer': 'adam', 'graph_mode': 'off', 'use_snp_selection': True, 'num_snps': 48823}. Best is trial 76 with value: 0.21110188042063088.
[I 2025-12-06 04:29:15,623] Trial 100 finished with value: 0.19453187142674383 and parameters: {'model_type': 'mlp', 'hidden_dims': '[512, 256]', 'dropout': 0.24193479861491007, 'batch_norm': False, 'lr': 7.1386378134266805e-06, 'weight_decay': 1.6604091699003885e-05, 'epochs': 126, 'loss': 'mae', 'optimizer': 'adam', 'graph_mode': 'off', 'use_snp_selection': False}. Best is trial 76 with value: 0.21110188042063088.
[I 2025-12-06 04:30:07,626] Trial 101 finished with value: 0.1939220912341822 and parameters: {'model_type': 'mlp', 'hidden_dims': '[512, 256]', 'dropout': 0.26196777215651834, 'batch_norm': False, 'lr': 1.5441394777825058e-05, 'weight_decay': 1.1228441696657053e-05, 'epochs': 169, 'loss': 'mae', 'optimizer': 'adam', 'graph_mode': 'off', 'use_snp_selection': False}. Best is trial 76 with value: 0.21110188042063088.
[I 2025-12-06 04:30:42,531] Trial 102 finished with value: 0.1895699509655443 and parameters: {'model_type': 'mlp', 'hidden_dims': '[512, 256]', 'dropout': 0.22247803050280457, 'batch_norm': False, 'lr': 1.1462606011162252e-05, 'weight_decay': 1.4432383370063907e-05, 'epochs': 104, 'loss': 'mae', 'optimizer': 'adam', 'graph_mode': 'off', 'use_snp_selection': False}. Best is trial 76 with value: 0.21110188042063088.
[I 2025-12-06 04:31:05,339] Trial 103 finished with value: 0.17355000832948259 and parameters: {'model_type': 'mlp', 'hidden_dims': '[512, 64]', 'dropout': 0.33056924079446603, 'batch_norm': False, 'lr': 4.9065549072990585e-05, 'weight_decay': 2.3249900779359635e-05, 'epochs': 60, 'loss': 'mae', 'optimizer': 'adam', 'graph_mode': 'off', 'use_snp_selection': False}. Best is trial 76 with value: 0.21110188042063088.
[I 2025-12-06 04:31:31,358] Trial 104 finished with value: 0.1942180469380414 and parameters: {'model_type': 'mlp', 'hidden_dims': '[512, 64]', 'dropout': 0.5456159639037521, 'batch_norm': False, 'lr': 2.248841249524206e-05, 'weight_decay': 7.098004042970057e-06, 'epochs': 72, 'loss': 'mae', 'optimizer': 'adam', 'graph_mode': 'off', 'use_snp_selection': False}. Best is trial 76 with value: 0.21110188042063088.
[I 2025-12-06 04:31:59,383] Trial 105 finished with value: 0.20011232015283667 and parameters: {'model_type': 'mlp', 'hidden_dims': '[512, 64]', 'dropout': 0.27677106497073045, 'batch_norm': False, 'lr': 2.9496158241924142e-05, 'weight_decay': 5.379870000287506e-06, 'epochs': 80, 'loss': 'mae', 'optimizer': 'adam', 'graph_mode': 'off', 'use_snp_selection': False}. Best is trial 76 with value: 0.21110188042063088.
[I 2025-12-06 04:32:29,496] Trial 106 finished with value: 0.19448223452062605 and parameters: {'model_type': 'mlp', 'hidden_dims': '[512, 64]', 'dropout': 0.2546906161635678, 'batch_norm': False, 'lr': 3.2873223153751095e-05, 'weight_decay': 1.0104800814491917e-05, 'epochs': 88, 'loss': 'mae', 'optimizer': 'adam', 'graph_mode': 'off', 'use_snp_selection': False}. Best is trial 76 with value: 0.21110188042063088.
[I 2025-12-06 04:32:53,472] Trial 107 finished with value: 0.19641395365323497 and parameters: {'model_type': 'mlp', 'hidden_dims': '[256, 128]', 'dropout': 0.17245652856822216, 'batch_norm': False, 'lr': 1.7829283669436805e-05, 'weight_decay': 0.00023537602245444326, 'epochs': 133, 'loss': 'mse', 'optimizer': 'adam', 'graph_mode': 'off', 'use_snp_selection': False}. Best is trial 76 with value: 0.21110188042063088.
[I 2025-12-06 04:33:32,190] Trial 108 finished with value: 0.19257066599631456 and parameters: {'model_type': 'mlp', 'hidden_dims': '[512, 256]', 'dropout': 0.20688560104320505, 'batch_norm': False, 'lr': 2.4666856659745877e-05, 'weight_decay': 3.6365816010039456e-06, 'epochs': 120, 'loss': 'mae', 'optimizer': 'adam', 'graph_mode': 'off', 'use_snp_selection': False}. Best is trial 76 with value: 0.21110188042063088.
[I 2025-12-06 04:34:04,954] Trial 109 finished with value: 0.1836120971322442 and parameters: {'model_type': 'mlp', 'hidden_dims': '[512, 64]', 'dropout': 0.3204056048316071, 'batch_norm': False, 'lr': 4.956918534115278e-06, 'weight_decay': 2.605689968271155e-05, 'epochs': 96, 'loss': 'mae', 'optimizer': 'adam', 'graph_mode': 'off', 'use_snp_selection': False}. Best is trial 76 with value: 0.21110188042063088.
[I 2025-12-06 04:34:24,152] Trial 110 finished with value: 0.16966841351831502 and parameters: {'model_type': 'mlp', 'hidden_dims': '[512, 64]', 'dropout': 0.18823350117565205, 'batch_norm': False, 'lr': 1.317150160388259e-05, 'weight_decay': 1.8845789021723913e-05, 'epochs': 45, 'loss': 'mae', 'optimizer': 'adam', 'graph_mode': 'off', 'use_snp_selection': False}. Best is trial 76 with value: 0.21110188042063088.
[I 2025-12-06 04:34:45,594] Trial 111 finished with value: 0.19940519807612528 and parameters: {'model_type': 'mlp', 'hidden_dims': '[512, 64]', 'dropout': 0.2770583742077897, 'batch_norm': False, 'lr': 2.9985100266032288e-05, 'weight_decay': 2.343728420041062e-06, 'epochs': 54, 'loss': 'mae', 'optimizer': 'adam', 'graph_mode': 'off', 'use_snp_selection': False}. Best is trial 76 with value: 0.21110188042063088.
[I 2025-12-06 04:35:13,215] Trial 112 finished with value: 0.19853384020403123 and parameters: {'model_type': 'mlp', 'hidden_dims': '[512, 64]', 'dropout': 0.3055306135659399, 'batch_norm': False, 'lr': 4.109059623218641e-05, 'weight_decay': 5.511813028282e-06, 'epochs': 78, 'loss': 'mae', 'optimizer': 'adam', 'graph_mode': 'off', 'use_snp_selection': False}. Best is trial 76 with value: 0.21110188042063088.
[I 2025-12-06 04:35:37,668] Trial 113 finished with value: 0.20652516121159933 and parameters: {'model_type': 'mlp', 'hidden_dims': '[512, 64]', 'dropout': 0.28810418929361814, 'batch_norm': False, 'lr': 4.9419359549169465e-05, 'weight_decay': 7.944858857772523e-06, 'epochs': 66, 'loss': 'mae', 'optimizer': 'adam', 'graph_mode': 'off', 'use_snp_selection': False}. Best is trial 76 with value: 0.21110188042063088.
[I 2025-12-06 04:36:33,622] Trial 114 finished with value: 0.188524657656462 and parameters: {'model_type': 'mlp', 'hidden_dims': '[512, 64]', 'dropout': 0.23692151808918505, 'batch_norm': False, 'lr': 6.811404365892885e-05, 'weight_decay': 1.4104228200390233e-05, 'epochs': 187, 'loss': 'mae', 'optimizer': 'adam', 'graph_mode': 'off', 'use_snp_selection': False}. Best is trial 76 with value: 0.21110188042063088.
[I 2025-12-06 04:38:09,637] Trial 115 finished with value: 0.19404310136836547 and parameters: {'model_type': 'mlp', 'hidden_dims': '[512, 64]', 'dropout': 0.5829215106862083, 'batch_norm': False, 'lr': 4.93377067269163e-05, 'weight_decay': 0.00043703496009064483, 'epochs': 341, 'loss': 'mae', 'optimizer': 'adam', 'graph_mode': 'off', 'use_snp_selection': False}. Best is trial 76 with value: 0.21110188042063088.
[I 2025-12-06 04:38:35,160] Trial 116 finished with value: 0.19598979852297788 and parameters: {'model_type': 'mlp', 'hidden_dims': '[512, 64]', 'dropout': 0.2906443406402754, 'batch_norm': False, 'lr': 5.870136429444775e-05, 'weight_decay': 8.409482167772923e-06, 'epochs': 68, 'loss': 'mae', 'optimizer': 'adam', 'graph_mode': 'off', 'use_snp_selection': False}. Best is trial 76 with value: 0.21110188042063088.
[I 2025-12-06 04:39:13,694] Trial 117 finished with value: 0.20261309966349383 and parameters: {'model_type': 'mlp', 'hidden_dims': '[128, 64]', 'dropout': 0.5149495496854086, 'batch_norm': False, 'lr': 3.5443917801485866e-05, 'weight_decay': 3.8545163630107346e-05, 'epochs': 89, 'loss': 'mae', 'optimizer': 'adam', 'graph_mode': 'off', 'use_snp_selection': True, 'num_snps': 25382}. Best is trial 76 with value: 0.21110188042063088.
[I 2025-12-06 04:39:51,989] Trial 118 finished with value: 0.1969955073749729 and parameters: {'model_type': 'mlp', 'hidden_dims': '[128, 64]', 'dropout': 0.5252498151629078, 'batch_norm': False, 'lr': 3.609885392281446e-05, 'weight_decay': 3.405278894933482e-05, 'epochs': 89, 'loss': 'mae', 'optimizer': 'adam', 'graph_mode': 'off', 'use_snp_selection': True, 'num_snps': 25186}. Best is trial 76 with value: 0.21110188042063088.
[I 2025-12-06 04:40:31,491] Trial 119 finished with value: 0.15498681416292964 and parameters: {'model_type': 'mlp', 'hidden_dims': '[128, 64]', 'dropout': 0.5062734355439854, 'batch_norm': False, 'lr': 2.0041063658437998e-05, 'weight_decay': 7.402766518898354e-05, 'epochs': 40, 'loss': 'mae', 'optimizer': 'adam', 'graph_mode': 'off', 'use_snp_selection': True, 'num_snps': 32667}. Best is trial 76 with value: 0.21110188042063088.
[I 2025-12-06 04:41:22,851] Trial 120 finished with value: 0.18802427204136057 and parameters: {'model_type': 'mlp', 'hidden_dims': '[512, 128]', 'dropout': 0.5223946025102142, 'batch_norm': False, 'lr': 8.099950603414695e-06, 'weight_decay': 0.00010048665345738529, 'epochs': 304, 'loss': 'mae', 'optimizer': 'adam', 'graph_mode': 'off', 'use_snp_selection': True, 'num_snps': 14878}. Best is trial 76 with value: 0.21110188042063088.
[I 2025-12-06 04:42:01,153] Trial 121 finished with value: 0.10671572747219098 and parameters: {'model_type': 'mlp', 'hidden_dims': '[128, 64]', 'dropout': 0.2600322281260903, 'batch_norm': False, 'lr': 2.4920946232873876e-06, 'weight_decay': 5.050139882908814e-05, 'epochs': 63, 'loss': 'mae', 'optimizer': 'adam', 'graph_mode': 'off', 'use_snp_selection': True, 'num_snps': 25772}. Best is trial 76 with value: 0.21110188042063088.
[I 2025-12-06 04:42:44,800] Trial 122 finished with value: 0.19136609373107366 and parameters: {'model_type': 'mlp', 'hidden_dims': '[512, 64]', 'dropout': 0.24713513344963983, 'batch_norm': False, 'lr': 4.542324028758957e-05, 'weight_decay': 3.946948305801196e-05, 'epochs': 98, 'loss': 'mae', 'optimizer': 'adam', 'graph_mode': 'off', 'use_snp_selection': True, 'num_snps': 20901}. Best is trial 76 with value: 0.21110188042063088.
[I 2025-12-06 04:42:57,939] Trial 123 finished with value: 0.1985719413115347 and parameters: {'model_type': 'mlp', 'hidden_dims': '[128, 64]', 'dropout': 0.15387707846698095, 'batch_norm': False, 'lr': 3.2796337790722296e-05, 'weight_decay': 1.0258026748225875e-05, 'epochs': 109, 'loss': 'mae', 'optimizer': 'adam', 'graph_mode': 'off', 'use_snp_selection': False}. Best is trial 76 with value: 0.21110188042063088.
[I 2025-12-06 04:43:30,042] Trial 124 finished with value: 0.19895102559557204 and parameters: {'model_type': 'mlp', 'hidden_dims': '[256, 128]', 'dropout': 0.5579176778886898, 'batch_norm': False, 'lr': 8.062133869557286e-05, 'weight_decay': 1.6460093141899424e-05, 'epochs': 75, 'loss': 'mae', 'optimizer': 'adam', 'graph_mode': 'off', 'use_snp_selection': True, 'num_snps': 8174}. Best is trial 76 with value: 0.21110188042063088.
[I 2025-12-06 04:44:37,869] Trial 125 finished with value: 0.18792561716480574 and parameters: {'model_type': 'mlp', 'hidden_dims': '[512, 64]', 'dropout': 0.34003489976705975, 'batch_norm': False, 'lr': 2.3151972259806324e-05, 'weight_decay': 1.400934188855181e-05, 'epochs': 235, 'loss': 'mae', 'optimizer': 'adam', 'graph_mode': 'off', 'use_snp_selection': False}. Best is trial 76 with value: 0.21110188042063088.
[I 2025-12-06 04:44:59,488] Trial 126 finished with value: 0.17777448539518154 and parameters: {'model_type': 'mlp', 'hidden_dims': '[512, 64]', 'dropout': 0.4820475426464592, 'batch_norm': False, 'lr': 4.007445309990791e-05, 'weight_decay': 7.704072361286367e-06, 'epochs': 55, 'loss': 'mae', 'optimizer': 'adam', 'graph_mode': 'off', 'use_snp_selection': False}. Best is trial 76 with value: 0.21110188042063088.
[I 2025-12-06 04:45:38,488] Trial 127 finished with value: 0.18375012870409485 and parameters: {'model_type': 'mlp', 'hidden_dims': '[512, 64]', 'dropout': 0.5380323167398868, 'batch_norm': False, 'lr': 5.4498447188174036e-05, 'weight_decay': 1.941075161222138e-05, 'epochs': 82, 'loss': 'mse', 'optimizer': 'adam', 'graph_mode': 'off', 'use_snp_selection': True, 'num_snps': 16179}. Best is trial 76 with value: 0.21110188042063088.
[I 2025-12-06 04:45:54,190] Trial 128 finished with value: 0.19377388611470797 and parameters: {'model_type': 'mlp', 'hidden_dims': '[128, 64]', 'dropout': 0.5794925212416328, 'batch_norm': False, 'lr': 2.903076419215846e-05, 'weight_decay': 1.1894437790578978e-05, 'epochs': 147, 'loss': 'mae', 'optimizer': 'adam', 'graph_mode': 'off', 'use_snp_selection': False}. Best is trial 76 with value: 0.21110188042063088.
