[I 2025-12-06 09:01:46,447] Trial 137 finished with value: 0.22455238018612786 and parameters: {'model_type': 'mlp', 'hidden_dims': '[256, 128, 64]', 'dropout': 0.39656769954602034, 'batch_norm': False, 'lr': 8.360153307411584e-06, 'weight_decay': 2.733703606276871e-06, 'epochs': 62, 'loss': 'mae', 'optimizer': 'adam', 'graph_mode': 'off', 'use_snp_selection': True, 'num_snps': 39705}. Best is trial 28 with value: 0.2663812453467505.
[I 2025-12-06 09:02:36,030] Trial 138 finished with value: 0.2520824216031449 and parameters: {'model_type': 'mlp', 'hidden_dims': '[256, 128, 64]', 'dropout': 0.42689798351807834, 'batch_norm': False, 'lr': 1.58879776275124e-05, 'weight_decay': 2.168178368887842e-06, 'epochs': 113, 'loss': 'mae', 'optimizer': 'adam', 'graph_mode': 'off', 'use_snp_selection': True, 'num_snps': 34007}. Best is trial 28 with value: 0.2663812453467505.
[I 2025-12-06 09:03:30,039] Trial 139 finished with value: 0.22059423039222442 and parameters: {'model_type': 'mlp', 'hidden_dims': '[512, 256]', 'dropout': 0.45813037738851187, 'batch_norm': False, 'lr': 1.2632029007152671e-05, 'weight_decay': 2.1696775602057067e-06, 'epochs': 112, 'loss': 'mse', 'optimizer': 'adam', 'graph_mode': 'off', 'use_snp_selection': True, 'num_snps': 29765}. Best is trial 28 with value: 0.2663812453467505.
[I 2025-12-06 09:04:21,371] Trial 140 finished with value: 0.2583021726845037 and parameters: {'model_type': 'mlp', 'hidden_dims': '[256, 128, 64]', 'dropout': 0.4838271879641973, 'batch_norm': False, 'lr': 1.7651836844648303e-05, 'weight_decay': 4.205666744615775e-06, 'epochs': 132, 'loss': 'mae', 'optimizer': 'adam', 'graph_mode': 'off', 'use_snp_selection': True, 'num_snps': 34564}. Best is trial 28 with value: 0.2663812453467505.
[I 2025-12-06 09:05:12,362] Trial 141 finished with value: 0.23886725370753242 and parameters: {'model_type': 'mlp', 'hidden_dims': '[256, 128, 64]', 'dropout': 0.539648451737249, 'batch_norm': False, 'lr': 1.701884208133068e-05, 'weight_decay': 4.57918123719024e-06, 'epochs': 134, 'loss': 'mae', 'optimizer': 'adam', 'graph_mode': 'off', 'use_snp_selection': True, 'num_snps': 34284}. Best is trial 28 with value: 0.2663812453467505.
[I 2025-12-06 09:06:01,371] Trial 142 finished with value: 0.24845482074574093 and parameters: {'model_type': 'mlp', 'hidden_dims': '[256, 128, 64]', 'dropout': 0.4253660501891149, 'batch_norm': False, 'lr': 2.3573515270276672e-05, 'weight_decay': 3.9883586656371205e-06, 'epochs': 118, 'loss': 'mae', 'optimizer': 'adam', 'graph_mode': 'off', 'use_snp_selection': True, 'num_snps': 32483}. Best is trial 28 with value: 0.2663812453467505.
[I 2025-12-06 09:06:52,850] Trial 143 finished with value: 0.23637312803648663 and parameters: {'model_type': 'mlp', 'hidden_dims': '[256, 128, 64]', 'dropout': 0.5073768941402478, 'batch_norm': False, 'lr': 2.053398738304999e-05, 'weight_decay': 3.279302495244204e-06, 'epochs': 127, 'loss': 'mae', 'optimizer': 'adam', 'graph_mode': 'off', 'use_snp_selection': True, 'num_snps': 35457}. Best is trial 28 with value: 0.2663812453467505.
[I 2025-12-06 09:07:47,381] Trial 144 finished with value: 0.2583239885896574 and parameters: {'model_type': 'mlp', 'hidden_dims': '[256, 128, 64]', 'dropout': 0.49148538537870146, 'batch_norm': False, 'lr': 1.4902569637509797e-05, 'weight_decay': 2.72726166348477e-06, 'epochs': 112, 'loss': 'mae', 'optimizer': 'adam', 'graph_mode': 'off', 'use_snp_selection': True, 'num_snps': 42468}. Best is trial 28 with value: 0.2663812453467505.
[I 2025-12-06 09:08:38,609] Trial 145 finished with value: 0.2515982182974502 and parameters: {'model_type': 'mlp', 'hidden_dims': '[256, 128, 64]', 'dropout': 0.48969956007425053, 'batch_norm': False, 'lr': 1.787063465005889e-05, 'weight_decay': 2.5614325232126397e-06, 'epochs': 78, 'loss': 'mae', 'optimizer': 'adam', 'graph_mode': 'off', 'use_snp_selection': True, 'num_snps': 43177}. Best is trial 28 with value: 0.2663812453467505.
[I 2025-12-06 09:09:25,927] Trial 146 finished with value: 0.23263359381865642 and parameters: {'model_type': 'mlp', 'hidden_dims': '[128, 64]', 'dropout': 0.4897412370760692, 'batch_norm': False, 'lr': 1.2778520432160114e-05, 'weight_decay': 1.4793117516711793e-06, 'epochs': 89, 'loss': 'mae', 'optimizer': 'adam', 'graph_mode': 'off', 'use_snp_selection': True, 'num_snps': 41854}. Best is trial 28 with value: 0.2663812453467505.
[I 2025-12-06 09:10:18,130] Trial 147 finished with value: 0.254272650674162 and parameters: {'model_type': 'mlp', 'hidden_dims': '[256, 128, 64]', 'dropout': 0.44303645525237006, 'batch_norm': False, 'lr': 9.861848815128312e-06, 'weight_decay': 2.078816657616965e-06, 'epochs': 106, 'loss': 'mae', 'optimizer': 'adam', 'graph_mode': 'off', 'use_snp_selection': True, 'num_snps': 40411}. Best is trial 28 with value: 0.2663812453467505.
[I 2025-12-06 09:11:10,124] Trial 148 finished with value: 0.17417936547078955 and parameters: {'model_type': 'mlp', 'hidden_dims': '[256, 128]', 'dropout': 0.47895609281384643, 'batch_norm': True, 'lr': 9.934580323770152e-06, 'weight_decay': 1.1677312204790685e-06, 'epochs': 97, 'loss': 'mae', 'optimizer': 'adam', 'graph_mode': 'off', 'use_snp_selection': True, 'num_snps': 41347}. Best is trial 28 with value: 0.2663812453467505.
[I 2025-12-06 09:12:03,755] Trial 149 finished with value: 0.25111440751758046 and parameters: {'model_type': 'mlp', 'hidden_dims': '[256, 128, 64]', 'dropout': 0.5012204895619963, 'batch_norm': False, 'lr': 3.352080859222632e-05, 'weight_decay': 1.7344672555735652e-06, 'epochs': 107, 'loss': 'mae', 'optimizer': 'adam', 'graph_mode': 'off', 'use_snp_selection': True, 'num_snps': 42377}. Best is trial 28 with value: 0.2663812453467505.
[I 2025-12-06 09:13:11,843] Trial 0 finished with value: 0.1873800147536035 and parameters: {'model_type': 'mlp', 'hidden_dims': '[128, 64]', 'dropout': 0.199031432379812, 'batch_norm': True, 'lr': 1.8408544111075837e-06, 'weight_decay': 5.5136510071208614e-05, 'epochs': 336, 'loss': 'mae', 'optimizer': 'adam', 'graph_mode': 'off', 'use_snp_selection': True, 'num_snps': 43862}. Best is trial 0 with value: 0.1873800147536035.
[I 2025-12-06 09:13:52,476] Trial 1 finished with value: 0.2453284102913968 and parameters: {'model_type': 'mlp', 'hidden_dims': '[256, 128]', 'dropout': 0.4370668075331726, 'batch_norm': True, 'lr': 7.133471581159139e-05, 'weight_decay': 1.128633586803549e-05, 'epochs': 242, 'loss': 'mae', 'optimizer': 'adam', 'graph_mode': 'off', 'use_snp_selection': False}. Best is trial 1 with value: 0.2453284102913968.
[I 2025-12-06 09:14:29,726] Trial 2 finished with value: 0.2349901477933538 and parameters: {'model_type': 'mlp', 'hidden_dims': '[256, 128, 64]', 'dropout': 0.41314357415569625, 'batch_norm': False, 'lr': 3.952233718592101e-06, 'weight_decay': 0.00026754769258252603, 'epochs': 149, 'loss': 'mse', 'optimizer': 'adam', 'graph_mode': 'off', 'use_snp_selection': True, 'num_snps': 11571}. Best is trial 1 with value: 0.2453284102913968.
[I 2025-12-06 09:16:05,411] Trial 3 finished with value: 0.27065185795403957 and parameters: {'model_type': 'mlp', 'hidden_dims': '[512, 64]', 'dropout': 0.5938127374509361, 'batch_norm': False, 'lr': 5.67704586114731e-06, 'weight_decay': 2.4518087630137052e-05, 'epochs': 320, 'loss': 'mae', 'optimizer': 'adam', 'graph_mode': 'off', 'use_snp_selection': False}. Best is trial 3 with value: 0.27065185795403957.
[I 2025-12-06 09:17:31,616] Trial 4 finished with value: 0.13969222143502408 and parameters: {'model_type': 'mlp', 'hidden_dims': '[512, 128]', 'dropout': 0.25746343592134413, 'batch_norm': True, 'lr': 1.3467657668402788e-06, 'weight_decay': 0.00033087251918647806, 'epochs': 277, 'loss': 'mse', 'optimizer': 'adam', 'graph_mode': 'off', 'use_snp_selection': True, 'num_snps': 36675}. Best is trial 3 with value: 0.27065185795403957.
[I 2025-12-06 09:18:31,870] Trial 5 finished with value: 0.16021349227960052 and parameters: {'model_type': 'mlp', 'hidden_dims': '[512, 64]', 'dropout': 0.38275350994408375, 'batch_norm': True, 'lr': 1.5586664309232824e-06, 'weight_decay': 0.0008227664668621182, 'epochs': 145, 'loss': 'mae', 'optimizer': 'adam', 'graph_mode': 'off', 'use_snp_selection': True, 'num_snps': 32148}. Best is trial 3 with value: 0.27065185795403957.
[I 2025-12-06 09:19:05,607] Trial 6 finished with value: 0.23478123401500928 and parameters: {'model_type': 'mlp', 'hidden_dims': '[256, 128]', 'dropout': 0.3930109900265879, 'batch_norm': False, 'lr': 4.892964372128395e-05, 'weight_decay': 1.5809549317992182e-06, 'epochs': 199, 'loss': 'mse', 'optimizer': 'adam', 'graph_mode': 'off', 'use_snp_selection': False}. Best is trial 3 with value: 0.27065185795403957.
[I 2025-12-06 09:19:40,291] Trial 7 finished with value: 0.24325592107700422 and parameters: {'model_type': 'mlp', 'hidden_dims': '[512, 256]', 'dropout': 0.15343979219678458, 'batch_norm': True, 'lr': 6.234003099047341e-05, 'weight_decay': 3.894760610535477e-07, 'epochs': 97, 'loss': 'mse', 'optimizer': 'adam', 'graph_mode': 'off', 'use_snp_selection': False}. Best is trial 3 with value: 0.27065185795403957.
[I 2025-12-06 09:21:15,537] Trial 8 finished with value: 0.2522532095771948 and parameters: {'model_type': 'mlp', 'hidden_dims': '[512, 128]', 'dropout': 0.10743001231661406, 'batch_norm': True, 'lr': 0.00023728538449271062, 'weight_decay': 1.7629071578048637e-05, 'epochs': 312, 'loss': 'mae', 'optimizer': 'adam', 'graph_mode': 'off', 'use_snp_selection': False}. Best is trial 3 with value: 0.27065185795403957.
[I 2025-12-06 09:22:12,363] Trial 9 finished with value: 0.2446420564613095 and parameters: {'model_type': 'mlp', 'hidden_dims': '[512, 64]', 'dropout': 0.14505336736221927, 'batch_norm': True, 'lr': 5.8619638388111826e-05, 'weight_decay': 6.200156172669308e-07, 'epochs': 175, 'loss': 'mse', 'optimizer': 'adam', 'graph_mode': 'off', 'use_snp_selection': False}. Best is trial 3 with value: 0.27065185795403957.
[I 2025-12-06 09:22:35,222] Trial 10 finished with value: 0.239698699279464 and parameters: {'model_type': 'mlp', 'hidden_dims': '[512, 64]', 'dropout': 0.5885461262002587, 'batch_norm': False, 'lr': 8.769366258768696e-06, 'weight_decay': 2.78273193871783e-06, 'epochs': 55, 'loss': 'mae', 'optimizer': 'adam', 'graph_mode': 'off', 'use_snp_selection': False}. Best is trial 3 with value: 0.27065185795403957.
[I 2025-12-06 09:24:16,431] Trial 11 finished with value: 0.2573543117895648 and parameters: {'model_type': 'mlp', 'hidden_dims': '[512, 128]', 'dropout': 0.583942291816117, 'batch_norm': False, 'lr': 0.0007607980626791682, 'weight_decay': 2.11387030344014e-05, 'epochs': 346, 'loss': 'mae', 'optimizer': 'adam', 'graph_mode': 'off', 'use_snp_selection': False}. Best is trial 3 with value: 0.27065185795403957.
[I 2025-12-06 09:25:56,591] Trial 12 finished with value: 0.2200767035151591 and parameters: {'model_type': 'mlp', 'hidden_dims': '[512, 128]', 'dropout': 0.593097749012682, 'batch_norm': False, 'lr': 0.0006753264773209732, 'weight_decay': 5.486721578149049e-05, 'epochs': 342, 'loss': 'mae', 'optimizer': 'adam', 'graph_mode': 'off', 'use_snp_selection': False}. Best is trial 3 with value: 0.27065185795403957.
[I 2025-12-06 09:26:22,660] Trial 13 finished with value: 0.25211071631404297 and parameters: {'model_type': 'mlp', 'hidden_dims': '[128, 64]', 'dropout': 0.5043641748401543, 'batch_norm': False, 'lr': 1.2326138759927248e-05, 'weight_decay': 4.373608364627903e-05, 'epochs': 280, 'loss': 'mae', 'optimizer': 'adam', 'graph_mode': 'off', 'use_snp_selection': False}. Best is trial 3 with value: 0.27065185795403957.
[I 2025-12-06 09:27:02,569] Trial 14 finished with value: 0.12072453033387047 and parameters: {'model_type': 'mlp', 'hidden_dims': '[256, 128, 64]', 'dropout': 0.5300180653494536, 'batch_norm': False, 'lr': 0.0008800295981507219, 'weight_decay': 1.1414924884997386e-07, 'epochs': 242, 'loss': 'mae', 'optimizer': 'adam', 'graph_mode': 'off', 'use_snp_selection': False}. Best is trial 3 with value: 0.27065185795403957.
[I 2025-12-06 09:28:34,295] Trial 15 finished with value: 0.2712308115064357 and parameters: {'model_type': 'mlp', 'hidden_dims': '[512, 256]', 'dropout': 0.29817671914947536, 'batch_norm': False, 'lr': 1.8411764708572348e-05, 'weight_decay': 4.311010561628845e-06, 'epochs': 302, 'loss': 'mae', 'optimizer': 'adam', 'graph_mode': 'off', 'use_snp_selection': False}. Best is trial 15 with value: 0.2712308115064357.
[I 2025-12-06 09:29:56,666] Trial 16 finished with value: 0.2644462158781279 and parameters: {'model_type': 'mlp', 'hidden_dims': '[512, 256]', 'dropout': 0.30003809884667015, 'batch_norm': False, 'lr': 1.967678703307444e-05, 'weight_decay': 5.098763140321504e-06, 'epochs': 270, 'loss': 'mae', 'optimizer': 'adam', 'graph_mode': 'off', 'use_snp_selection': False}. Best is trial 15 with value: 0.2712308115064357.
[I 2025-12-06 09:31:29,009] Trial 17 finished with value: 0.26574507392673774 and parameters: {'model_type': 'mlp', 'hidden_dims': '[512, 256]', 'dropout': 0.31226206234945486, 'batch_norm': False, 'lr': 7.28449232493469e-06, 'weight_decay': 6.503919561253859e-06, 'epochs': 302, 'loss': 'mae', 'optimizer': 'adam', 'graph_mode': 'off', 'use_snp_selection': False}. Best is trial 15 with value: 0.2712308115064357.
[I 2025-12-06 09:33:12,215] Trial 18 finished with value: 0.27085048251071314 and parameters: {'model_type': 'mlp', 'hidden_dims': '[512, 256]', 'dropout': 0.4730989156594311, 'batch_norm': False, 'lr': 4.560712153535206e-06, 'weight_decay': 1.3157026583586933e-06, 'epochs': 211, 'loss': 'mae', 'optimizer': 'adam', 'graph_mode': 'off', 'use_snp_selection': True, 'num_snps': 58241}. Best is trial 15 with value: 0.2712308115064357.
[I 2025-12-06 09:34:53,739] Trial 19 finished with value: 0.2688438742470701 and parameters: {'model_type': 'mlp', 'hidden_dims': '[512, 256]', 'dropout': 0.4689687765529734, 'batch_norm': False, 'lr': 2.901303743629066e-06, 'weight_decay': 7.403320412807019e-07, 'epochs': 215, 'loss': 'mae', 'optimizer': 'adam', 'graph_mode': 'off', 'use_snp_selection': True, 'num_snps': 55667}. Best is trial 15 with value: 0.2712308115064357.
[I 2025-12-06 09:36:40,166] Trial 20 finished with value: 0.25641732604322304 and parameters: {'model_type': 'mlp', 'hidden_dims': '[512, 256]', 'dropout': 0.3479894915051742, 'batch_norm': False, 'lr': 2.574919721430717e-05, 'weight_decay': 1.109968730726807e-07, 'epochs': 231, 'loss': 'mae', 'optimizer': 'adam', 'graph_mode': 'off', 'use_snp_selection': True, 'num_snps': 57703}. Best is trial 15 with value: 0.2712308115064357.
[I 2025-12-06 09:37:28,947] Trial 21 finished with value: 0.24468624811817138 and parameters: {'model_type': 'mlp', 'hidden_dims': '[512, 64]', 'dropout': 0.4898000238162367, 'batch_norm': False, 'lr': 3.237339323013717e-06, 'weight_decay': 1.9636698712648833e-06, 'epochs': 308, 'loss': 'mae', 'optimizer': 'adam', 'graph_mode': 'off', 'use_snp_selection': True, 'num_snps': 11878}. Best is trial 15 with value: 0.2712308115064357.
[I 2025-12-06 09:38:30,027] Trial 22 finished with value: 0.2681966318369862 and parameters: {'model_type': 'mlp', 'hidden_dims': '[512, 256]', 'dropout': 0.540244004165196, 'batch_norm': False, 'lr': 5.5857618455834705e-06, 'weight_decay': 4.902902559033757e-06, 'epochs': 255, 'loss': 'mae', 'optimizer': 'adam', 'graph_mode': 'off', 'use_snp_selection': True, 'num_snps': 22259}. Best is trial 15 with value: 0.2712308115064357.
[I 2025-12-06 09:40:18,548] Trial 23 finished with value: 0.2644754202198858 and parameters: {'model_type': 'mlp', 'hidden_dims': '[512, 256]', 'dropout': 0.24357820614593453, 'batch_norm': False, 'lr': 1.449026097637266e-05, 'weight_decay': 3.296061035279437e-07, 'epochs': 309, 'loss': 'mae', 'optimizer': 'adam', 'graph_mode': 'off', 'use_snp_selection': True, 'num_snps': 46925}. Best is trial 15 with value: 0.2712308115064357.
[I 2025-12-06 09:41:13,322] Trial 24 finished with value: 0.26772976042803237 and parameters: {'model_type': 'mlp', 'hidden_dims': '[512, 64]', 'dropout': 0.44999114734430623, 'batch_norm': False, 'lr': 0.00014861645181562472, 'weight_decay': 2.6597778273530084e-05, 'epochs': 175, 'loss': 'mae', 'optimizer': 'adam', 'graph_mode': 'off', 'use_snp_selection': False}. Best is trial 15 with value: 0.2712308115064357.
[I 2025-12-06 09:41:49,808] Trial 25 finished with value: 0.2668598214623648 and parameters: {'model_type': 'mlp', 'hidden_dims': '[512, 256]', 'dropout': 0.5381131792190541, 'batch_norm': False, 'lr': 1.1039888177715118e-05, 'weight_decay': 0.00013700542808875256, 'epochs': 104, 'loss': 'mae', 'optimizer': 'adam', 'graph_mode': 'off', 'use_snp_selection': False}. Best is trial 15 with value: 0.2712308115064357.
[I 2025-12-06 09:42:21,994] Trial 26 finished with value: 0.1886068453080521 and parameters: {'model_type': 'mlp', 'hidden_dims': '[128, 64]', 'dropout': 0.3444519897227373, 'batch_norm': False, 'lr': 5.2614032428997835e-06, 'weight_decay': 2.814904921129076e-06, 'epochs': 292, 'loss': 'mse', 'optimizer': 'adam', 'graph_mode': 'off', 'use_snp_selection': True, 'num_snps': 2344}. Best is trial 15 with value: 0.2712308115064357.
[I 2025-12-06 09:43:13,038] Trial 27 finished with value: 0.2596371893871804 and parameters: {'model_type': 'mlp', 'hidden_dims': '[256, 128]', 'dropout': 0.28492587198312636, 'batch_norm': False, 'lr': 3.3458491148824767e-05, 'weight_decay': 8.986187725856165e-07, 'epochs': 322, 'loss': 'mae', 'optimizer': 'adam', 'graph_mode': 'off', 'use_snp_selection': False}. Best is trial 15 with value: 0.2712308115064357.
[I 2025-12-06 09:44:27,511] Trial 28 finished with value: 0.26179131357018764 and parameters: {'model_type': 'mlp', 'hidden_dims': '[256, 128, 64]', 'dropout': 0.5514029049895833, 'batch_norm': False, 'lr': 3.0245509607074917e-06, 'weight_decay': 9.641477867737046e-06, 'epochs': 258, 'loss': 'mae', 'optimizer': 'adam', 'graph_mode': 'off', 'use_snp_selection': True, 'num_snps': 48700}. Best is trial 15 with value: 0.2712308115064357.
[I 2025-12-06 09:45:12,723] Trial 29 finished with value: 0.22177331561769442 and parameters: {'model_type': 'mlp', 'hidden_dims': '[128, 64]', 'dropout': 0.21474291750074576, 'batch_norm': False, 'lr': 1.7931284713849043e-06, 'weight_decay': 7.833445881855029e-05, 'epochs': 217, 'loss': 'mae', 'optimizer': 'adam', 'graph_mode': 'off', 'use_snp_selection': True, 'num_snps': 26940}. Best is trial 15 with value: 0.2712308115064357.
[I 2025-12-06 09:46:48,741] Trial 30 finished with value: 0.2614981032163004 and parameters: {'model_type': 'mlp', 'hidden_dims': '[512, 64]', 'dropout': 0.4840543081260859, 'batch_norm': False, 'lr': 2.2930790066396734e-05, 'weight_decay': 2.2058574253649844e-07, 'epochs': 326, 'loss': 'mae', 'optimizer': 'adam', 'graph_mode': 'off', 'use_snp_selection': False}. Best is trial 15 with value: 0.2712308115064357.
[I 2025-12-06 09:48:29,152] Trial 31 finished with value: 0.2766321586300571 and parameters: {'model_type': 'mlp', 'hidden_dims': '[512, 256]', 'dropout': 0.4552524809726248, 'batch_norm': False, 'lr': 2.4772720075708877e-06, 'weight_decay': 1.5096404429263098e-06, 'epochs': 200, 'loss': 'mae', 'optimizer': 'adam', 'graph_mode': 'off', 'use_snp_selection': True, 'num_snps': 58538}. Best is trial 31 with value: 0.2766321586300571.
[I 2025-12-06 09:50:02,742] Trial 32 finished with value: 0.24496064967797232 and parameters: {'model_type': 'mlp', 'hidden_dims': '[512, 256]', 'dropout': 0.4285619228122615, 'batch_norm': False, 'lr': 2.232655968956241e-06, 'weight_decay': 1.568630651525606e-06, 'epochs': 166, 'loss': 'mae', 'optimizer': 'adam', 'graph_mode': 'off', 'use_snp_selection': True, 'num_snps': 59537}. Best is trial 31 with value: 0.2766321586300571.
[I 2025-12-06 09:51:34,718] Trial 33 finished with value: 0.25217480600256603 and parameters: {'model_type': 'mlp', 'hidden_dims': '[512, 256]', 'dropout': 0.38237116257697745, 'batch_norm': False, 'lr': 1.0969495620482614e-06, 'weight_decay': 1.2006147563474745e-05, 'epochs': 201, 'loss': 'mae', 'optimizer': 'adam', 'graph_mode': 'off', 'use_snp_selection': True, 'num_snps': 51129}. Best is trial 31 with value: 0.2766321586300571.
[I 2025-12-06 09:52:40,073] Trial 34 finished with value: 0.2407905975697215 and parameters: {'model_type': 'mlp', 'hidden_dims': '[512, 256]', 'dropout': 0.45461168908787203, 'batch_norm': True, 'lr': 6.35370876936703e-06, 'weight_decay': 1.1019418870776899e-06, 'epochs': 127, 'loss': 'mae', 'optimizer': 'adam', 'graph_mode': 'off', 'use_snp_selection': True, 'num_snps': 40108}. Best is trial 31 with value: 0.2766321586300571.
[I 2025-12-06 09:53:54,365] Trial 35 finished with value: 0.24854016429737177 and parameters: {'model_type': 'mlp', 'hidden_dims': '[256, 128]', 'dropout': 0.4057578206723854, 'batch_norm': False, 'lr': 4.4069616503522225e-06, 'weight_decay': 3.5849382521607466e-06, 'epochs': 227, 'loss': 'mse', 'optimizer': 'adam', 'graph_mode': 'off', 'use_snp_selection': True, 'num_snps': 53351}. Best is trial 31 with value: 0.2766321586300571.
[I 2025-12-06 09:55:27,874] Trial 36 finished with value: 0.27355343766587653 and parameters: {'model_type': 'mlp', 'hidden_dims': '[512, 256]', 'dropout': 0.513575748545779, 'batch_norm': False, 'lr': 2.1267962263788907e-06, 'weight_decay': 8.16266234123416e-06, 'epochs': 288, 'loss': 'mae', 'optimizer': 'adam', 'graph_mode': 'off', 'use_snp_selection': True, 'num_snps': 41424}. Best is trial 31 with value: 0.2766321586300571.
[I 2025-12-06 09:56:54,471] Trial 37 finished with value: 0.2582421153542621 and parameters: {'model_type': 'mlp', 'hidden_dims': '[512, 256]', 'dropout': 0.3279593282125356, 'batch_norm': False, 'lr': 1.0462222634872148e-06, 'weight_decay': 8.480644284238023e-06, 'epochs': 246, 'loss': 'mae', 'optimizer': 'adam', 'graph_mode': 'off', 'use_snp_selection': True, 'num_snps': 41259}. Best is trial 31 with value: 0.2766321586300571.
