[I 2025-12-05 21:55:10,507] Trial 63 finished with value: 0.30635552065494015 and parameters: {'model_type': 'mlp', 'hidden_dims': '[512, 64]', 'dropout': 0.380584441214703, 'batch_norm': False, 'lr': 1.6095450488227634e-05, 'weight_decay': 2.4972062792303815e-07, 'epochs': 177, 'loss': 'mse', 'optimizer': 'adam', 'graph_mode': 'off', 'use_snp_selection': False}. Best is trial 33 with value: 0.3133915102850672.
[I 2025-12-05 21:55:53,084] Trial 64 finished with value: 0.30520205790022337 and parameters: {'model_type': 'mlp', 'hidden_dims': '[512, 64]', 'dropout': 0.5379456227703207, 'batch_norm': False, 'lr': 1.1808934109176087e-05, 'weight_decay': 1.5400080659555746e-07, 'epochs': 216, 'loss': 'mse', 'optimizer': 'adam', 'graph_mode': 'off', 'use_snp_selection': False}. Best is trial 33 with value: 0.3133915102850672.
[I 2025-12-05 21:56:22,336] Trial 65 finished with value: 0.31078975284453636 and parameters: {'model_type': 'mlp', 'hidden_dims': '[512, 128]', 'dropout': 0.4366471660190096, 'batch_norm': False, 'lr': 7.312902927336191e-06, 'weight_decay': 7.208213158922292e-07, 'epochs': 138, 'loss': 'mse', 'optimizer': 'adam', 'graph_mode': 'off', 'use_snp_selection': False}. Best is trial 33 with value: 0.3133915102850672.
[I 2025-12-05 21:56:51,770] Trial 66 finished with value: 0.3037516496411917 and parameters: {'model_type': 'mlp', 'hidden_dims': '[512, 128]', 'dropout': 0.43628512015394283, 'batch_norm': False, 'lr': 5.355083529030147e-06, 'weight_decay': 6.70119623671009e-07, 'epochs': 139, 'loss': 'mae', 'optimizer': 'adam', 'graph_mode': 'off', 'use_snp_selection': False}. Best is trial 33 with value: 0.3133915102850672.
[I 2025-12-05 21:57:24,503] Trial 67 finished with value: 0.29334978648593946 and parameters: {'model_type': 'mlp', 'hidden_dims': '[512, 128]', 'dropout': 0.4907053835202926, 'batch_norm': False, 'lr': 1.980781325245238e-06, 'weight_decay': 3.624959881445457e-07, 'epochs': 158, 'loss': 'mse', 'optimizer': 'adam', 'graph_mode': 'off', 'use_snp_selection': False}. Best is trial 33 with value: 0.3133915102850672.
[I 2025-12-05 21:57:52,526] Trial 68 finished with value: 0.3089680430714773 and parameters: {'model_type': 'mlp', 'hidden_dims': '[512, 128]', 'dropout': 0.5178754335469755, 'batch_norm': False, 'lr': 7.791546026790487e-06, 'weight_decay': 1.0907122681703288e-06, 'epochs': 131, 'loss': 'mse', 'optimizer': 'adam', 'graph_mode': 'off', 'use_snp_selection': False}. Best is trial 33 with value: 0.3133915102850672.
[I 2025-12-05 21:58:59,105] Trial 69 finished with value: 0.29582883255704884 and parameters: {'model_type': 'mlp', 'hidden_dims': '[512, 128]', 'dropout': 0.46668958043551484, 'batch_norm': True, 'lr': 6.006121163448318e-06, 'weight_decay': 9.732149207694275e-06, 'epochs': 350, 'loss': 'mse', 'optimizer': 'adam', 'graph_mode': 'off', 'use_snp_selection': False}. Best is trial 33 with value: 0.3133915102850672.
[I 2025-12-05 21:59:31,015] Trial 70 finished with value: 0.2773076821950042 and parameters: {'model_type': 'mlp', 'hidden_dims': '[512, 256]', 'dropout': 0.2833082857186198, 'batch_norm': False, 'lr': 3.4918227954743088e-06, 'weight_decay': 3.5079025684480395e-05, 'epochs': 88, 'loss': 'mae', 'optimizer': 'adam', 'graph_mode': 'off', 'use_snp_selection': True, 'num_snps': 21177}. Best is trial 33 with value: 0.3133915102850672.
[I 2025-12-05 21:59:56,616] Trial 71 finished with value: 0.3098268061580049 and parameters: {'model_type': 'mlp', 'hidden_dims': '[512, 128]', 'dropout': 0.5140851417591881, 'batch_norm': False, 'lr': 7.419751054658042e-06, 'weight_decay': 1.2236497879490855e-06, 'epochs': 118, 'loss': 'mse', 'optimizer': 'adam', 'graph_mode': 'off', 'use_snp_selection': False}. Best is trial 33 with value: 0.3133915102850672.
[I 2025-12-05 22:00:22,381] Trial 72 finished with value: 0.30923099140005494 and parameters: {'model_type': 'mlp', 'hidden_dims': '[512, 128]', 'dropout': 0.47426295078109915, 'batch_norm': False, 'lr': 1.028808735159106e-05, 'weight_decay': 2.184524376415573e-06, 'epochs': 119, 'loss': 'mse', 'optimizer': 'adam', 'graph_mode': 'off', 'use_snp_selection': False}. Best is trial 33 with value: 0.3133915102850672.
[I 2025-12-05 22:00:52,830] Trial 73 finished with value: 0.3071488478770908 and parameters: {'model_type': 'mlp', 'hidden_dims': '[512, 128]', 'dropout': 0.4990488923238253, 'batch_norm': False, 'lr': 8.03468609845523e-06, 'weight_decay': 6.643322869135128e-05, 'epochs': 146, 'loss': 'mse', 'optimizer': 'adam', 'graph_mode': 'off', 'use_snp_selection': False}. Best is trial 33 with value: 0.3133915102850672.
[I 2025-12-05 22:01:29,508] Trial 74 finished with value: 0.30928027219267895 and parameters: {'model_type': 'mlp', 'hidden_dims': '[512, 128]', 'dropout': 0.459500891784168, 'batch_norm': False, 'lr': 4.851022389547085e-06, 'weight_decay': 1.1958871717771131e-06, 'epochs': 181, 'loss': 'mse', 'optimizer': 'adam', 'graph_mode': 'off', 'use_snp_selection': False}. Best is trial 33 with value: 0.3133915102850672.
[I 2025-12-05 22:01:44,198] Trial 75 finished with value: 0.2998354198231954 and parameters: {'model_type': 'mlp', 'hidden_dims': '[256, 128]', 'dropout': 0.4286147552098323, 'batch_norm': False, 'lr': 6.380572899287305e-06, 'weight_decay': 7.427628761652143e-07, 'epochs': 111, 'loss': 'mse', 'optimizer': 'adam', 'graph_mode': 'off', 'use_snp_selection': False}. Best is trial 33 with value: 0.3133915102850672.
[I 2025-12-05 22:01:54,867] Trial 76 finished with value: 0.2897886380185694 and parameters: {'model_type': 'mlp', 'hidden_dims': '[128, 64]', 'dropout': 0.443242636861671, 'batch_norm': False, 'lr': 4.190131174832952e-06, 'weight_decay': 4.7845042845578055e-06, 'epochs': 123, 'loss': 'mse', 'optimizer': 'adam', 'graph_mode': 'off', 'use_snp_selection': False}. Best is trial 33 with value: 0.3133915102850672.
[I 2025-12-05 22:02:17,951] Trial 77 finished with value: 0.3075757967109518 and parameters: {'model_type': 'mlp', 'hidden_dims': '[512, 256]', 'dropout': 0.47525244171729, 'batch_norm': False, 'lr': 9.833764054623078e-06, 'weight_decay': 4.907568583790125e-07, 'epochs': 103, 'loss': 'mse', 'optimizer': 'adam', 'graph_mode': 'off', 'use_snp_selection': False}. Best is trial 33 with value: 0.3133915102850672.
[I 2025-12-05 22:02:35,844] Trial 78 finished with value: 0.2806347240900711 and parameters: {'model_type': 'mlp', 'hidden_dims': '[256, 128, 64]', 'dropout': 0.5017576818756129, 'batch_norm': False, 'lr': 2.6712894205477875e-06, 'weight_decay': 2.501232285581077e-07, 'epochs': 146, 'loss': 'mse', 'optimizer': 'adam', 'graph_mode': 'off', 'use_snp_selection': False}. Best is trial 33 with value: 0.3133915102850672.
[I 2025-12-05 22:02:48,799] Trial 79 finished with value: 0.29267112310622917 and parameters: {'model_type': 'mlp', 'hidden_dims': '[512, 128]', 'dropout': 0.41182212435831833, 'batch_norm': False, 'lr': 2.3143489677545154e-05, 'weight_decay': 3.5432861668449985e-07, 'epochs': 45, 'loss': 'mse', 'optimizer': 'adam', 'graph_mode': 'off', 'use_snp_selection': False}. Best is trial 33 with value: 0.3133915102850672.
[I 2025-12-05 22:03:21,747] Trial 80 finished with value: 0.2977957438094241 and parameters: {'model_type': 'mlp', 'hidden_dims': '[512, 256]', 'dropout': 0.4468372777154086, 'batch_norm': True, 'lr': 1.2193445098818198e-05, 'weight_decay': 2.087318429846142e-05, 'epochs': 158, 'loss': 'mae', 'optimizer': 'adam', 'graph_mode': 'off', 'use_snp_selection': False}. Best is trial 33 with value: 0.3133915102850672.
[I 2025-12-05 22:03:58,927] Trial 81 finished with value: 0.31153775251887855 and parameters: {'model_type': 'mlp', 'hidden_dims': '[512, 128]', 'dropout': 0.45399032128754707, 'batch_norm': False, 'lr': 4.626735597523808e-06, 'weight_decay': 1.048126526557751e-06, 'epochs': 184, 'loss': 'mse', 'optimizer': 'adam', 'graph_mode': 'off', 'use_snp_selection': False}. Best is trial 33 with value: 0.3133915102850672.
[I 2025-12-05 22:04:37,708] Trial 82 finished with value: 0.3129848780134209 and parameters: {'model_type': 'mlp', 'hidden_dims': '[512, 128]', 'dropout': 0.4599350982981778, 'batch_norm': False, 'lr': 3.6968575293358254e-06, 'weight_decay': 3.052317907222275e-05, 'epochs': 193, 'loss': 'mse', 'optimizer': 'adam', 'graph_mode': 'off', 'use_snp_selection': False}. Best is trial 33 with value: 0.3133915102850672.
[I 2025-12-05 22:05:23,440] Trial 83 finished with value: 0.30809597207589007 and parameters: {'model_type': 'mlp', 'hidden_dims': '[512, 128]', 'dropout': 0.48356302055701667, 'batch_norm': False, 'lr': 3.7655593714232294e-06, 'weight_decay': 3.194227543438355e-05, 'epochs': 233, 'loss': 'mse', 'optimizer': 'adam', 'graph_mode': 'off', 'use_snp_selection': False}. Best is trial 33 with value: 0.3133915102850672.
[I 2025-12-05 22:06:04,670] Trial 84 finished with value: 0.2938304186684604 and parameters: {'model_type': 'mlp', 'hidden_dims': '[512, 128]', 'dropout': 0.4667030821105188, 'batch_norm': False, 'lr': 1.69370200568851e-06, 'weight_decay': 2.392759696843066e-06, 'epochs': 207, 'loss': 'mse', 'optimizer': 'adam', 'graph_mode': 'off', 'use_snp_selection': False}. Best is trial 33 with value: 0.3133915102850672.
[I 2025-12-05 22:06:41,947] Trial 85 finished with value: 0.31075246515156524 and parameters: {'model_type': 'mlp', 'hidden_dims': '[512, 128]', 'dropout': 0.39069538160389994, 'batch_norm': False, 'lr': 4.6848127703929445e-06, 'weight_decay': 1.817710201540284e-05, 'epochs': 184, 'loss': 'mse', 'optimizer': 'adam', 'graph_mode': 'off', 'use_snp_selection': False}. Best is trial 33 with value: 0.3133915102850672.
[I 2025-12-05 22:07:20,954] Trial 86 finished with value: 0.30865649727761446 and parameters: {'model_type': 'mlp', 'hidden_dims': '[512, 128]', 'dropout': 0.37107365134165476, 'batch_norm': False, 'lr': 4.6709487030560945e-06, 'weight_decay': 1.6876628761485408e-05, 'epochs': 194, 'loss': 'mse', 'optimizer': 'adam', 'graph_mode': 'off', 'use_snp_selection': False}. Best is trial 33 with value: 0.3133915102850672.
[I 2025-12-05 22:08:05,013] Trial 87 finished with value: 0.30837267824462633 and parameters: {'model_type': 'mlp', 'hidden_dims': '[512, 128]', 'dropout': 0.43336926711626955, 'batch_norm': False, 'lr': 2.875020300258746e-06, 'weight_decay': 4.435091739441616e-05, 'epochs': 223, 'loss': 'mse', 'optimizer': 'adam', 'graph_mode': 'off', 'use_snp_selection': False}. Best is trial 33 with value: 0.3133915102850672.
[I 2025-12-05 22:09:05,405] Trial 88 finished with value: 0.2910988560972953 and parameters: {'model_type': 'mlp', 'hidden_dims': '[512, 128]', 'dropout': 0.3871842995858763, 'batch_norm': False, 'lr': 1.360272375091414e-06, 'weight_decay': 9.52287713056867e-06, 'epochs': 188, 'loss': 'mse', 'optimizer': 'adam', 'graph_mode': 'off', 'use_snp_selection': True, 'num_snps': 48766}. Best is trial 33 with value: 0.3133915102850672.
[I 2025-12-05 22:09:52,965] Trial 89 finished with value: 0.3069765142980403 and parameters: {'model_type': 'mlp', 'hidden_dims': '[512, 128]', 'dropout': 0.4089430858547692, 'batch_norm': False, 'lr': 5.805324018457051e-06, 'weight_decay': 2.7849623626481432e-05, 'epochs': 244, 'loss': 'mse', 'optimizer': 'adam', 'graph_mode': 'off', 'use_snp_selection': False}. Best is trial 33 with value: 0.3133915102850672.
[I 2025-12-05 22:10:30,442] Trial 90 finished with value: 0.29096451720467953 and parameters: {'model_type': 'mlp', 'hidden_dims': '[512, 128]', 'dropout': 0.40078839317742515, 'batch_norm': False, 'lr': 2.3605300893032343e-06, 'weight_decay': 1.921448237658397e-05, 'epochs': 185, 'loss': 'mae', 'optimizer': 'adam', 'graph_mode': 'off', 'use_snp_selection': False}. Best is trial 33 with value: 0.3133915102850672.
[I 2025-12-05 22:11:05,618] Trial 91 finished with value: 0.311012325047773 and parameters: {'model_type': 'mlp', 'hidden_dims': '[512, 128]', 'dropout': 0.4421249529183681, 'batch_norm': False, 'lr': 4.87100970574823e-06, 'weight_decay': 1.2582003551285297e-05, 'epochs': 172, 'loss': 'mse', 'optimizer': 'adam', 'graph_mode': 'off', 'use_snp_selection': False}. Best is trial 33 with value: 0.3133915102850672.
[I 2025-12-05 22:11:40,662] Trial 92 finished with value: 0.30817291294260846 and parameters: {'model_type': 'mlp', 'hidden_dims': '[512, 128]', 'dropout': 0.13104178375811906, 'batch_norm': False, 'lr': 7.0674873238336985e-06, 'weight_decay': 1.1790555007862772e-05, 'epochs': 171, 'loss': 'mse', 'optimizer': 'adam', 'graph_mode': 'off', 'use_snp_selection': False}. Best is trial 33 with value: 0.3133915102850672.
[I 2025-12-05 22:12:19,851] Trial 93 finished with value: 0.30777617712828553 and parameters: {'model_type': 'mlp', 'hidden_dims': '[512, 128]', 'dropout': 0.4188793011345287, 'batch_norm': False, 'lr': 3.6285457933866266e-06, 'weight_decay': 1.759713245964526e-06, 'epochs': 195, 'loss': 'mse', 'optimizer': 'adam', 'graph_mode': 'off', 'use_snp_selection': False}. Best is trial 33 with value: 0.3133915102850672.
[I 2025-12-05 22:13:01,845] Trial 94 finished with value: 0.30779492242043727 and parameters: {'model_type': 'mlp', 'hidden_dims': '[512, 128]', 'dropout': 0.44670500914947686, 'batch_norm': False, 'lr': 4.450553595609188e-06, 'weight_decay': 1.3744350696192376e-05, 'epochs': 211, 'loss': 'mse', 'optimizer': 'adam', 'graph_mode': 'off', 'use_snp_selection': False}. Best is trial 33 with value: 0.3133915102850672.
[I 2025-12-05 22:13:37,544] Trial 95 finished with value: 0.3103179588916195 and parameters: {'model_type': 'mlp', 'hidden_dims': '[512, 128]', 'dropout': 0.42909796092830016, 'batch_norm': False, 'lr': 5.159976993503425e-06, 'weight_decay': 5.501462261344773e-06, 'epochs': 175, 'loss': 'mse', 'optimizer': 'adam', 'graph_mode': 'off', 'use_snp_selection': False}. Best is trial 33 with value: 0.3133915102850672.
[I 2025-12-05 22:14:17,816] Trial 96 finished with value: 0.30622926279603996 and parameters: {'model_type': 'mlp', 'hidden_dims': '[512, 128]', 'dropout': 0.42920165975199653, 'batch_norm': False, 'lr': 5.272915929172332e-06, 'weight_decay': 3.839309076893163e-06, 'epochs': 201, 'loss': 'mse', 'optimizer': 'adam', 'graph_mode': 'off', 'use_snp_selection': False}. Best is trial 33 with value: 0.3133915102850672.
[I 2025-12-05 22:14:53,189] Trial 97 finished with value: 0.308460202411985 and parameters: {'model_type': 'mlp', 'hidden_dims': '[512, 128]', 'dropout': 0.3921223025767856, 'batch_norm': False, 'lr': 6.530781368977835e-06, 'weight_decay': 8.306736965321396e-06, 'epochs': 173, 'loss': 'mse', 'optimizer': 'adam', 'graph_mode': 'off', 'use_snp_selection': False}. Best is trial 33 with value: 0.3133915102850672.
[I 2025-12-05 22:15:26,990] Trial 98 finished with value: 0.3019744266653821 and parameters: {'model_type': 'mlp', 'hidden_dims': '[512, 128]', 'dropout': 0.47789496396893105, 'batch_norm': False, 'lr': 3.197791042218238e-06, 'weight_decay': 6.638805495533975e-06, 'epochs': 164, 'loss': 'mse', 'optimizer': 'adam', 'graph_mode': 'off', 'use_snp_selection': False}. Best is trial 33 with value: 0.3133915102850672.
[I 2025-12-05 22:16:03,388] Trial 99 finished with value: 0.28968236044723533 and parameters: {'model_type': 'mlp', 'hidden_dims': '[512, 128]', 'dropout': 0.5233494655995677, 'batch_norm': True, 'lr': 2.6297066328467834e-06, 'weight_decay': 5.34841006753481e-06, 'epochs': 178, 'loss': 'mse', 'optimizer': 'adam', 'graph_mode': 'off', 'use_snp_selection': False}. Best is trial 33 with value: 0.3133915102850672.
[I 2025-12-05 22:16:32,272] Trial 100 finished with value: 0.31141400343876524 and parameters: {'model_type': 'mlp', 'hidden_dims': '[512, 128]', 'dropout': 0.44012542294871926, 'batch_norm': False, 'lr': 7.60862653914637e-06, 'weight_decay': 1.0141191212985092e-06, 'epochs': 136, 'loss': 'mse', 'optimizer': 'adam', 'graph_mode': 'off', 'use_snp_selection': False}. Best is trial 33 with value: 0.3133915102850672.
[I 2025-12-05 22:16:57,828] Trial 101 finished with value: 0.3109814147739883 and parameters: {'model_type': 'mlp', 'hidden_dims': '[512, 128]', 'dropout': 0.46499756715453155, 'batch_norm': False, 'lr': 7.6237908494609264e-06, 'weight_decay': 8.985623651134215e-07, 'epochs': 117, 'loss': 'mse', 'optimizer': 'adam', 'graph_mode': 'off', 'use_snp_selection': False}. Best is trial 33 with value: 0.3133915102850672.
[I 2025-12-05 22:17:26,915] Trial 102 finished with value: 0.3052130771288526 and parameters: {'model_type': 'mlp', 'hidden_dims': '[512, 128]', 'dropout': 0.4378721024729295, 'batch_norm': False, 'lr': 4.055372092306227e-06, 'weight_decay': 9.6700943320169e-07, 'epochs': 137, 'loss': 'mse', 'optimizer': 'adam', 'graph_mode': 'off', 'use_snp_selection': False}. Best is trial 33 with value: 0.3133915102850672.
[I 2025-12-05 22:17:54,120] Trial 103 finished with value: 0.3050766816829746 and parameters: {'model_type': 'mlp', 'hidden_dims': '[512, 128]', 'dropout': 0.4514775280336699, 'batch_norm': False, 'lr': 8.427082884538236e-05, 'weight_decay': 6.391581126972231e-07, 'epochs': 127, 'loss': 'mse', 'optimizer': 'adam', 'graph_mode': 'off', 'use_snp_selection': False}. Best is trial 33 with value: 0.3133915102850672.
[I 2025-12-05 22:18:27,629] Trial 104 finished with value: 0.31054084471686905 and parameters: {'model_type': 'mlp', 'hidden_dims': '[512, 256]', 'dropout': 0.4617845501022391, 'batch_norm': False, 'lr': 5.5689092044471446e-06, 'weight_decay': 1.8003718559217383e-06, 'epochs': 162, 'loss': 'mse', 'optimizer': 'adam', 'graph_mode': 'off', 'use_snp_selection': False}. Best is trial 33 with value: 0.3133915102850672.
[I 2025-12-05 22:19:01,136] Trial 105 finished with value: 0.3091923958216081 and parameters: {'model_type': 'mlp', 'hidden_dims': '[512, 256]', 'dropout': 0.4642432785462264, 'batch_norm': False, 'lr': 8.773811676283594e-06, 'weight_decay': 1.3825253994204367e-06, 'epochs': 162, 'loss': 'mse', 'optimizer': 'adam', 'graph_mode': 'off', 'use_snp_selection': False}. Best is trial 33 with value: 0.3133915102850672.
[I 2025-12-05 22:19:32,774] Trial 106 finished with value: 0.3074347999792774 and parameters: {'model_type': 'mlp', 'hidden_dims': '[512, 256]', 'dropout': 0.45960822363821796, 'batch_norm': False, 'lr': 6.05882271185651e-06, 'weight_decay': 4.2228810893633613e-07, 'epochs': 151, 'loss': 'mse', 'optimizer': 'adam', 'graph_mode': 'off', 'use_snp_selection': False}. Best is trial 33 with value: 0.3133915102850672.
[I 2025-12-05 22:20:19,361] Trial 107 finished with value: 0.3046177580997215 and parameters: {'model_type': 'mlp', 'hidden_dims': '[512, 256]', 'dropout': 0.4425062638611545, 'batch_norm': False, 'lr': 1.0259707300280234e-05, 'weight_decay': 1.9080277091070656e-06, 'epochs': 143, 'loss': 'mse', 'optimizer': 'adam', 'graph_mode': 'off', 'use_snp_selection': True, 'num_snps': 37972}. Best is trial 33 with value: 0.3133915102850672.
[I 2025-12-05 22:20:47,495] Trial 108 finished with value: 0.30623412482359735 and parameters: {'model_type': 'mlp', 'hidden_dims': '[512, 256]', 'dropout': 0.4915159531450102, 'batch_norm': False, 'lr': 4.590038257839875e-06, 'weight_decay': 7.802678503081929e-07, 'epochs': 132, 'loss': 'mse', 'optimizer': 'adam', 'graph_mode': 'off', 'use_snp_selection': False}. Best is trial 33 with value: 0.3133915102850672.
[I 2025-12-05 22:21:01,235] Trial 109 finished with value: 0.3022890653499516 and parameters: {'model_type': 'mlp', 'hidden_dims': '[128, 64]', 'dropout': 0.4219760636243896, 'batch_norm': False, 'lr': 7.296989951878051e-06, 'weight_decay': 1.0306367654931324e-06, 'epochs': 183, 'loss': 'mse', 'optimizer': 'adam', 'graph_mode': 'off', 'use_snp_selection': False}. Best is trial 33 with value: 0.3133915102850672.
[I 2025-12-05 22:21:20,355] Trial 110 finished with value: 0.30708518312327393 and parameters: {'model_type': 'mlp', 'hidden_dims': '[256, 128]', 'dropout': 0.47104540463901995, 'batch_norm': False, 'lr': 5.817028099890507e-06, 'weight_decay': 2.9102698333166074e-06, 'epochs': 160, 'loss': 'mse', 'optimizer': 'adam', 'graph_mode': 'off', 'use_snp_selection': False}. Best is trial 33 with value: 0.3133915102850672.
[I 2025-12-05 22:21:56,027] Trial 111 finished with value: 0.30938619951607327 and parameters: {'model_type': 'mlp', 'hidden_dims': '[512, 128]', 'dropout': 0.42786692048144837, 'batch_norm': False, 'lr': 5.413872182057291e-06, 'weight_decay': 5.464030900644623e-07, 'epochs': 175, 'loss': 'mse', 'optimizer': 'adam', 'graph_mode': 'off', 'use_snp_selection': False}. Best is trial 33 with value: 0.3133915102850672.
[I 2025-12-05 22:22:35,193] Trial 112 finished with value: 0.30807164273646637 and parameters: {'model_type': 'mlp', 'hidden_dims': '[512, 128]', 'dropout': 0.4537538486071049, 'batch_norm': False, 'lr': 3.6559833914731876e-06, 'weight_decay': 2.868170070962241e-05, 'epochs': 195, 'loss': 'mse', 'optimizer': 'adam', 'graph_mode': 'off', 'use_snp_selection': False}. Best is trial 33 with value: 0.3133915102850672.
[I 2025-12-05 22:23:06,966] Trial 113 finished with value: 0.30825732627439084 and parameters: {'model_type': 'mlp', 'hidden_dims': '[512, 256]', 'dropout': 0.41277925477033683, 'batch_norm': False, 'lr': 8.429645905687317e-06, 'weight_decay': 1.4560729880071829e-05, 'epochs': 152, 'loss': 'mse', 'optimizer': 'adam', 'graph_mode': 'off', 'use_snp_selection': False}. Best is trial 33 with value: 0.3133915102850672.
[I 2025-12-05 22:23:41,246] Trial 114 finished with value: 0.3097766099358974 and parameters: {'model_type': 'mlp', 'hidden_dims': '[512, 128]', 'dropout': 0.48217738807198707, 'batch_norm': False, 'lr': 5.085143377143034e-06, 'weight_decay': 1.4346769014587496e-06, 'epochs': 167, 'loss': 'mse', 'optimizer': 'adam', 'graph_mode': 'off', 'use_snp_selection': False}. Best is trial 33 with value: 0.3133915102850672.
