[I 2025-12-06 13:10:00,916] Trial 25 finished with value: 0.2355900913373063 and parameters: {'model_type': 'mlp', 'hidden_dims': '[512, 128]', 'dropout': 0.548896464886231, 'batch_norm': False, 'lr': 1.9115855978279352e-05, 'weight_decay': 3.0188306124413315e-07, 'epochs': 298, 'loss': 'mae', 'optimizer': 'adam', 'graph_mode': 'off', 'use_snp_selection': False}. Best is trial 11 with value: 0.24579365030383707.
[I 2025-12-06 13:10:32,672] Trial 26 finished with value: 0.1794874622133694 and parameters: {'model_type': 'mlp', 'hidden_dims': '[128, 64]', 'dropout': 0.5142601490474884, 'batch_norm': False, 'lr': 8.726728693694243e-06, 'weight_decay': 3.133671071334423e-05, 'epochs': 247, 'loss': 'mae', 'optimizer': 'adam', 'graph_mode': 'off', 'use_snp_selection': True, 'num_snps': 3842}. Best is trial 11 with value: 0.24579365030383707.
[I 2025-12-06 13:12:09,579] Trial 27 finished with value: 0.23365215253832267 and parameters: {'model_type': 'mlp', 'hidden_dims': '[512, 256]', 'dropout': 0.45690415032379017, 'batch_norm': False, 'lr': 2.5916391157690212e-06, 'weight_decay': 3.1824160069228768e-06, 'epochs': 329, 'loss': 'mse', 'optimizer': 'adam', 'graph_mode': 'off', 'use_snp_selection': False}. Best is trial 11 with value: 0.24579365030383707.
[I 2025-12-06 13:12:52,369] Trial 28 finished with value: 0.2223860240232749 and parameters: {'model_type': 'mlp', 'hidden_dims': '[256, 128]', 'dropout': 0.5698404280271102, 'batch_norm': False, 'lr': 1.0308224546471368e-06, 'weight_decay': 0.00011837572117061313, 'epochs': 262, 'loss': 'mae', 'optimizer': 'adam', 'graph_mode': 'off', 'use_snp_selection': False}. Best is trial 11 with value: 0.24579365030383707.
[I 2025-12-06 13:13:32,536] Trial 29 finished with value: 0.1986720877124376 and parameters: {'model_type': 'mlp', 'hidden_dims': '[128, 64]', 'dropout': 0.224937686019073, 'batch_norm': False, 'lr': 2.320440320155318e-06, 'weight_decay': 1.1525731109214924e-05, 'epochs': 215, 'loss': 'mae', 'optimizer': 'adam', 'graph_mode': 'off', 'use_snp_selection': True, 'num_snps': 19468}. Best is trial 11 with value: 0.24579365030383707.
[I 2025-12-06 13:15:10,350] Trial 30 finished with value: 0.23668656308741481 and parameters: {'model_type': 'mlp', 'hidden_dims': '[512, 64]', 'dropout': 0.48012753225371385, 'batch_norm': False, 'lr': 3.913584327983964e-05, 'weight_decay': 5.51608677078345e-05, 'epochs': 341, 'loss': 'mae', 'optimizer': 'adam', 'graph_mode': 'off', 'use_snp_selection': False}. Best is trial 11 with value: 0.24579365030383707.
[I 2025-12-06 13:16:46,705] Trial 31 finished with value: 0.2450665214644865 and parameters: {'model_type': 'mlp', 'hidden_dims': '[512, 64]', 'dropout': 0.5922305881238027, 'batch_norm': False, 'lr': 5.50313179909406e-06, 'weight_decay': 2.1861951461389466e-05, 'epochs': 327, 'loss': 'mae', 'optimizer': 'adam', 'graph_mode': 'off', 'use_snp_selection': False}. Best is trial 11 with value: 0.24579365030383707.
[I 2025-12-06 13:18:15,688] Trial 32 finished with value: 0.2502334903403615 and parameters: {'model_type': 'mlp', 'hidden_dims': '[512, 64]', 'dropout': 0.5285022550550614, 'batch_norm': False, 'lr': 5.93089834852679e-06, 'weight_decay': 1.2411234134982046e-05, 'epochs': 299, 'loss': 'mae', 'optimizer': 'adam', 'graph_mode': 'off', 'use_snp_selection': False}. Best is trial 32 with value: 0.2502334903403615.
[I 2025-12-06 13:19:44,642] Trial 33 finished with value: 0.24084757383338173 and parameters: {'model_type': 'mlp', 'hidden_dims': '[512, 64]', 'dropout': 0.5241374365268721, 'batch_norm': False, 'lr': 4.019905630776305e-06, 'weight_decay': 1.273551665887467e-05, 'epochs': 299, 'loss': 'mae', 'optimizer': 'adam', 'graph_mode': 'off', 'use_snp_selection': False}. Best is trial 32 with value: 0.2502334903403615.
[I 2025-12-06 13:21:21,168] Trial 34 finished with value: 0.24224547173837124 and parameters: {'model_type': 'mlp', 'hidden_dims': '[512, 64]', 'dropout': 0.5653250187894199, 'batch_norm': False, 'lr': 1.3095271331343716e-05, 'weight_decay': 3.3255376949067038e-06, 'epochs': 329, 'loss': 'mae', 'optimizer': 'adam', 'graph_mode': 'off', 'use_snp_selection': False}. Best is trial 32 with value: 0.2502334903403615.
[I 2025-12-06 13:22:05,674] Trial 35 finished with value: 0.23231561733000367 and parameters: {'model_type': 'mlp', 'hidden_dims': '[256, 128]', 'dropout': 0.5982155451710459, 'batch_norm': True, 'lr': 2.1003596008441902e-05, 'weight_decay': 9.085582684022365e-06, 'epochs': 269, 'loss': 'mae', 'optimizer': 'adam', 'graph_mode': 'off', 'use_snp_selection': False}. Best is trial 32 with value: 0.2502334903403615.
[I 2025-12-06 13:23:31,918] Trial 36 finished with value: 0.23880391113112792 and parameters: {'model_type': 'mlp', 'hidden_dims': '[256, 128, 64]', 'dropout': 0.4259061228636643, 'batch_norm': False, 'lr': 4.077264323677109e-06, 'weight_decay': 1.4902807680849382e-06, 'epochs': 292, 'loss': 'mse', 'optimizer': 'adam', 'graph_mode': 'off', 'use_snp_selection': True, 'num_snps': 58661}. Best is trial 32 with value: 0.2502334903403615.
[I 2025-12-06 13:24:27,076] Trial 37 finished with value: 0.23141018999408539 and parameters: {'model_type': 'mlp', 'hidden_dims': '[512, 64]', 'dropout': 0.5722204054356036, 'batch_norm': False, 'lr': 1.167804721260879e-05, 'weight_decay': 0.0002467255640921993, 'epochs': 178, 'loss': 'mae', 'optimizer': 'adam', 'graph_mode': 'off', 'use_snp_selection': False}. Best is trial 32 with value: 0.2502334903403615.
[I 2025-12-06 13:25:23,211] Trial 38 finished with value: 0.2425203544045277 and parameters: {'model_type': 'mlp', 'hidden_dims': '[512, 128]', 'dropout': 0.5256467273727918, 'batch_norm': True, 'lr': 5.489182617804901e-06, 'weight_decay': 1.4718740952094895e-05, 'epochs': 234, 'loss': 'mse', 'optimizer': 'adam', 'graph_mode': 'off', 'use_snp_selection': True, 'num_snps': 19911}. Best is trial 32 with value: 0.2502334903403615.
[I 2025-12-06 13:26:59,009] Trial 39 finished with value: 0.23625849543025773 and parameters: {'model_type': 'mlp', 'hidden_dims': '[512, 64]', 'dropout': 0.39442379379924, 'batch_norm': False, 'lr': 1.8965359839727641e-06, 'weight_decay': 0.000494866061743946, 'epochs': 326, 'loss': 'mae', 'optimizer': 'adam', 'graph_mode': 'off', 'use_snp_selection': False}. Best is trial 32 with value: 0.2502334903403615.
[I 2025-12-06 13:28:16,685] Trial 40 finished with value: 0.237159660534418 and parameters: {'model_type': 'mlp', 'hidden_dims': '[512, 256]', 'dropout': 0.47285226627907584, 'batch_norm': True, 'lr': 0.00010299837783030175, 'weight_decay': 6.932622228161615e-05, 'epochs': 254, 'loss': 'mae', 'optimizer': 'adam', 'graph_mode': 'off', 'use_snp_selection': False}. Best is trial 32 with value: 0.2502334903403615.
[I 2025-12-06 13:29:47,326] Trial 41 finished with value: 0.2378490929425548 and parameters: {'model_type': 'mlp', 'hidden_dims': '[512, 64]', 'dropout': 0.5714325293336806, 'batch_norm': False, 'lr': 7.837191568630445e-06, 'weight_decay': 2.520901407615589e-05, 'epochs': 306, 'loss': 'mae', 'optimizer': 'adam', 'graph_mode': 'off', 'use_snp_selection': False}. Best is trial 32 with value: 0.2502334903403615.
[I 2025-12-06 13:31:25,451] Trial 42 finished with value: 0.23859161227848244 and parameters: {'model_type': 'mlp', 'hidden_dims': '[512, 64]', 'dropout': 0.5983979072020393, 'batch_norm': False, 'lr': 6.2357395672431505e-06, 'weight_decay': 3.5727047516134106e-05, 'epochs': 334, 'loss': 'mae', 'optimizer': 'adam', 'graph_mode': 'off', 'use_snp_selection': False}. Best is trial 32 with value: 0.2502334903403615.
[I 2025-12-06 13:32:58,631] Trial 43 finished with value: 0.24020732177313314 and parameters: {'model_type': 'mlp', 'hidden_dims': '[512, 64]', 'dropout': 0.5354704636701373, 'batch_norm': False, 'lr': 1.696170946698764e-05, 'weight_decay': 2.459385438191044e-05, 'epochs': 318, 'loss': 'mae', 'optimizer': 'adam', 'graph_mode': 'off', 'use_snp_selection': False}. Best is trial 32 with value: 0.2502334903403615.
[I 2025-12-06 13:34:24,302] Trial 44 finished with value: 0.24766105436312205 and parameters: {'model_type': 'mlp', 'hidden_dims': '[512, 64]', 'dropout': 0.338513344078267, 'batch_norm': False, 'lr': 6.230682466449317e-06, 'weight_decay': 9.022897884006293e-06, 'epochs': 287, 'loss': 'mae', 'optimizer': 'adam', 'graph_mode': 'off', 'use_snp_selection': False}. Best is trial 32 with value: 0.2502334903403615.
[I 2025-12-06 13:35:09,126] Trial 45 finished with value: 0.2392172193394521 and parameters: {'model_type': 'mlp', 'hidden_dims': '[256, 128]', 'dropout': 0.3605812892157811, 'batch_norm': False, 'lr': 3.0122326703444297e-06, 'weight_decay': 5.934284244127921e-07, 'epochs': 275, 'loss': 'mse', 'optimizer': 'adam', 'graph_mode': 'off', 'use_snp_selection': False}. Best is trial 32 with value: 0.2502334903403615.
[I 2025-12-06 13:36:33,663] Trial 46 finished with value: 0.23793025088356318 and parameters: {'model_type': 'mlp', 'hidden_dims': '[512, 64]', 'dropout': 0.2881441649656979, 'batch_norm': True, 'lr': 2.5192193088915884e-05, 'weight_decay': 4.3730126245138554e-06, 'epochs': 281, 'loss': 'mae', 'optimizer': 'adam', 'graph_mode': 'off', 'use_snp_selection': False}. Best is trial 32 with value: 0.2502334903403615.
[I 2025-12-06 13:38:01,705] Trial 47 finished with value: 0.238241343043217 and parameters: {'model_type': 'mlp', 'hidden_dims': '[512, 128]', 'dropout': 0.32500055653793797, 'batch_norm': False, 'lr': 1.154000352475358e-05, 'weight_decay': 8.295226554807947e-06, 'epochs': 296, 'loss': 'mae', 'optimizer': 'adam', 'graph_mode': 'off', 'use_snp_selection': False}. Best is trial 32 with value: 0.2502334903403615.
[I 2025-12-06 13:38:23,343] Trial 48 finished with value: 0.1981345844155429 and parameters: {'model_type': 'mlp', 'hidden_dims': '[128, 64]', 'dropout': 0.3684398545255644, 'batch_norm': False, 'lr': 1.520127075331307e-06, 'weight_decay': 2.3240889106340206e-07, 'epochs': 223, 'loss': 'mae', 'optimizer': 'adam', 'graph_mode': 'off', 'use_snp_selection': False}. Best is trial 32 with value: 0.2502334903403615.
[I 2025-12-06 13:39:18,582] Trial 49 finished with value: 0.19942528029987905 and parameters: {'model_type': 'mlp', 'hidden_dims': '[512, 256]', 'dropout': 0.4070389543730335, 'batch_norm': False, 'lr': 3.3829457447727966e-06, 'weight_decay': 1.8903176676715605e-06, 'epochs': 48, 'loss': 'mse', 'optimizer': 'adam', 'graph_mode': 'off', 'use_snp_selection': True, 'num_snps': 46888}. Best is trial 32 with value: 0.2502334903403615.
[I 2025-12-06 13:40:12,424] Trial 50 finished with value: 0.24358729357244452 and parameters: {'model_type': 'mlp', 'hidden_dims': '[256, 128]', 'dropout': 0.2560211236643244, 'batch_norm': False, 'lr': 6.130766248605056e-06, 'weight_decay': 6.274437570762212e-07, 'epochs': 342, 'loss': 'mae', 'optimizer': 'adam', 'graph_mode': 'off', 'use_snp_selection': False}. Best is trial 32 with value: 0.2502334903403615.
[I 2025-12-06 13:41:44,389] Trial 51 finished with value: 0.24257175933575675 and parameters: {'model_type': 'mlp', 'hidden_dims': '[512, 64]', 'dropout': 0.49562849491008165, 'batch_norm': False, 'lr': 4.781320959831205e-06, 'weight_decay': 4.211711846983097e-05, 'epochs': 311, 'loss': 'mae', 'optimizer': 'adam', 'graph_mode': 'off', 'use_snp_selection': False}. Best is trial 32 with value: 0.2502334903403615.
[I 2025-12-06 13:43:09,810] Trial 52 finished with value: 0.24072152085490234 and parameters: {'model_type': 'mlp', 'hidden_dims': '[512, 64]', 'dropout': 0.5819833715278909, 'batch_norm': False, 'lr': 7.295604728349412e-06, 'weight_decay': 1.674038652438911e-05, 'epochs': 287, 'loss': 'mae', 'optimizer': 'adam', 'graph_mode': 'off', 'use_snp_selection': False}. Best is trial 32 with value: 0.2502334903403615.
[I 2025-12-06 13:44:44,605] Trial 53 finished with value: 0.2381439132231443 and parameters: {'model_type': 'mlp', 'hidden_dims': '[512, 64]', 'dropout': 0.5540424587546446, 'batch_norm': False, 'lr': 9.88562472438268e-06, 'weight_decay': 7.793672118039032e-05, 'epochs': 322, 'loss': 'mae', 'optimizer': 'adam', 'graph_mode': 'off', 'use_snp_selection': False}. Best is trial 32 with value: 0.2502334903403615.
[I 2025-12-06 13:46:01,240] Trial 54 finished with value: 0.23758989283973292 and parameters: {'model_type': 'mlp', 'hidden_dims': '[512, 64]', 'dropout': 0.5134497815755615, 'batch_norm': False, 'lr': 1.5996427798033232e-05, 'weight_decay': 2.2900022184993765e-05, 'epochs': 256, 'loss': 'mae', 'optimizer': 'adam', 'graph_mode': 'off', 'use_snp_selection': False}. Best is trial 32 with value: 0.2502334903403615.
[I 2025-12-06 13:46:50,572] Trial 55 finished with value: 0.23943596098379194 and parameters: {'model_type': 'mlp', 'hidden_dims': '[256, 128, 64]', 'dropout': 0.3056383579958246, 'batch_norm': False, 'lr': 7.189103860351776e-06, 'weight_decay': 0.00016137444400188833, 'epochs': 305, 'loss': 'mae', 'optimizer': 'adam', 'graph_mode': 'off', 'use_snp_selection': False}. Best is trial 32 with value: 0.2502334903403615.
[I 2025-12-06 13:48:32,031] Trial 56 finished with value: 0.23989147269188935 and parameters: {'model_type': 'mlp', 'hidden_dims': '[512, 64]', 'dropout': 0.5497762156133711, 'batch_norm': False, 'lr': 2.896455220106216e-05, 'weight_decay': 3.135929422677314e-05, 'epochs': 350, 'loss': 'mae', 'optimizer': 'adam', 'graph_mode': 'off', 'use_snp_selection': False}. Best is trial 32 with value: 0.2502334903403615.
[I 2025-12-06 13:49:54,373] Trial 57 finished with value: 0.21245477822313313 and parameters: {'model_type': 'mlp', 'hidden_dims': '[512, 256]', 'dropout': 0.4398382396120849, 'batch_norm': True, 'lr': 4.994659259440203e-06, 'weight_decay': 7.167645713073718e-06, 'epochs': 271, 'loss': 'mae', 'optimizer': 'adam', 'graph_mode': 'off', 'use_snp_selection': False}. Best is trial 32 with value: 0.2502334903403615.
[I 2025-12-06 13:50:48,019] Trial 58 finished with value: 0.23448629833140094 and parameters: {'model_type': 'mlp', 'hidden_dims': '[256, 128]', 'dropout': 0.5820119112028067, 'batch_norm': False, 'lr': 2.1900875734978785e-06, 'weight_decay': 1.771015218990446e-05, 'epochs': 338, 'loss': 'mae', 'optimizer': 'adam', 'graph_mode': 'off', 'use_snp_selection': False}. Best is trial 32 with value: 0.2502334903403615.
[I 2025-12-06 13:52:22,931] Trial 59 finished with value: 0.24904037858855657 and parameters: {'model_type': 'mlp', 'hidden_dims': '[512, 64]', 'dropout': 0.4893075370961544, 'batch_norm': False, 'lr': 3.3450320689032755e-06, 'weight_decay': 4.5838182068444506e-05, 'epochs': 321, 'loss': 'mae', 'optimizer': 'adam', 'graph_mode': 'off', 'use_snp_selection': False}. Best is trial 32 with value: 0.2502334903403615.
[I 2025-12-06 13:53:35,179] Trial 60 finished with value: 0.2458850651777708 and parameters: {'model_type': 'mlp', 'hidden_dims': '[512, 64]', 'dropout': 0.5305862307657206, 'batch_norm': False, 'lr': 3.4237003591175157e-06, 'weight_decay': 8.379734647289669e-07, 'epochs': 238, 'loss': 'mae', 'optimizer': 'adam', 'graph_mode': 'off', 'use_snp_selection': False}. Best is trial 32 with value: 0.2502334903403615.
[I 2025-12-06 13:54:47,996] Trial 61 finished with value: 0.2304831835747212 and parameters: {'model_type': 'mlp', 'hidden_dims': '[512, 64]', 'dropout': 0.5256692826534539, 'batch_norm': False, 'lr': 3.333679414876088e-06, 'weight_decay': 1.5436310200385566e-07, 'epochs': 240, 'loss': 'mae', 'optimizer': 'adam', 'graph_mode': 'off', 'use_snp_selection': False}. Best is trial 32 with value: 0.2502334903403615.
[I 2025-12-06 13:55:34,957] Trial 62 finished with value: 0.202050067942572 and parameters: {'model_type': 'mlp', 'hidden_dims': '[512, 64]', 'dropout': 0.4847638626769793, 'batch_norm': False, 'lr': 1.091331438165545e-06, 'weight_decay': 9.67555334167289e-07, 'epochs': 145, 'loss': 'mae', 'optimizer': 'adam', 'graph_mode': 'off', 'use_snp_selection': False}. Best is trial 32 with value: 0.2502334903403615.
[I 2025-12-06 13:56:39,337] Trial 63 finished with value: 0.23058120538154925 and parameters: {'model_type': 'mlp', 'hidden_dims': '[512, 64]', 'dropout': 0.4605742450663446, 'batch_norm': False, 'lr': 4.353304246886345e-06, 'weight_decay': 4.799316119382475e-05, 'epochs': 209, 'loss': 'mae', 'optimizer': 'adam', 'graph_mode': 'off', 'use_snp_selection': False}. Best is trial 32 with value: 0.2502334903403615.
[I 2025-12-06 13:58:14,709] Trial 64 finished with value: 0.2415884257331838 and parameters: {'model_type': 'mlp', 'hidden_dims': '[512, 256]', 'dropout': 0.5073993984086193, 'batch_norm': False, 'lr': 1.8870014966431509e-06, 'weight_decay': 4.491964770550466e-07, 'epochs': 321, 'loss': 'mae', 'optimizer': 'adam', 'graph_mode': 'off', 'use_snp_selection': False}. Best is trial 32 with value: 0.2502334903403615.
[I 2025-12-06 13:58:40,674] Trial 65 finished with value: 0.1913108367707631 and parameters: {'model_type': 'mlp', 'hidden_dims': '[512, 64]', 'dropout': 0.5580593255872353, 'batch_norm': False, 'lr': 3.5601680033703274e-06, 'weight_decay': 1.1433621261845271e-05, 'epochs': 68, 'loss': 'mae', 'optimizer': 'adam', 'graph_mode': 'off', 'use_snp_selection': False}. Best is trial 32 with value: 0.2502334903403615.
[I 2025-12-06 13:59:36,095] Trial 66 finished with value: 0.250220580506464 and parameters: {'model_type': 'mlp', 'hidden_dims': '[512, 64]', 'dropout': 0.33905983276171237, 'batch_norm': False, 'lr': 9.711425083841855e-06, 'weight_decay': 1.7468243910556096e-07, 'epochs': 193, 'loss': 'mae', 'optimizer': 'adam', 'graph_mode': 'off', 'use_snp_selection': True, 'num_snps': 22881}. Best is trial 32 with value: 0.2502334903403615.
[I 2025-12-06 14:00:25,456] Trial 67 finished with value: 0.2550382014475878 and parameters: {'model_type': 'mlp', 'hidden_dims': '[512, 64]', 'dropout': 0.340101122810946, 'batch_norm': False, 'lr': 9.804430328506988e-06, 'weight_decay': 2.112532858131444e-07, 'epochs': 185, 'loss': 'mae', 'optimizer': 'adam', 'graph_mode': 'off', 'use_snp_selection': True, 'num_snps': 18545}. Best is trial 67 with value: 0.2550382014475878.
[I 2025-12-06 14:01:18,761] Trial 68 finished with value: 0.24995428172664877 and parameters: {'model_type': 'mlp', 'hidden_dims': '[512, 64]', 'dropout': 0.3354533371333571, 'batch_norm': False, 'lr': 9.632894972633116e-06, 'weight_decay': 2.0960016208528772e-07, 'epochs': 187, 'loss': 'mse', 'optimizer': 'adam', 'graph_mode': 'off', 'use_snp_selection': True, 'num_snps': 22184}. Best is trial 67 with value: 0.2550382014475878.
[I 2025-12-06 14:02:12,442] Trial 69 finished with value: 0.25093712478282326 and parameters: {'model_type': 'mlp', 'hidden_dims': '[512, 64]', 'dropout': 0.3376231927843524, 'batch_norm': False, 'lr': 9.745865675689512e-06, 'weight_decay': 1.8689394424843785e-07, 'epochs': 188, 'loss': 'mse', 'optimizer': 'adam', 'graph_mode': 'off', 'use_snp_selection': True, 'num_snps': 22117}. Best is trial 67 with value: 0.2550382014475878.
[I 2025-12-06 14:03:06,144] Trial 70 finished with value: 0.2533541804208907 and parameters: {'model_type': 'mlp', 'hidden_dims': '[512, 64]', 'dropout': 0.33694622463185125, 'batch_norm': False, 'lr': 1.0423622873605565e-05, 'weight_decay': 1.84430953093011e-07, 'epochs': 179, 'loss': 'mse', 'optimizer': 'adam', 'graph_mode': 'off', 'use_snp_selection': True, 'num_snps': 22718}. Best is trial 67 with value: 0.2550382014475878.
[I 2025-12-06 14:03:59,124] Trial 71 finished with value: 0.2596386798200256 and parameters: {'model_type': 'mlp', 'hidden_dims': '[512, 64]', 'dropout': 0.3366858879250781, 'batch_norm': False, 'lr': 1.0435169926251465e-05, 'weight_decay': 2.1152202978465663e-07, 'epochs': 187, 'loss': 'mse', 'optimizer': 'adam', 'graph_mode': 'off', 'use_snp_selection': True, 'num_snps': 21772}. Best is trial 71 with value: 0.2596386798200256.
[I 2025-12-06 14:04:52,684] Trial 72 finished with value: 0.2512932201990118 and parameters: {'model_type': 'mlp', 'hidden_dims': '[512, 64]', 'dropout': 0.3129616037539819, 'batch_norm': False, 'lr': 1.083384064507814e-05, 'weight_decay': 2.110515740152481e-07, 'epochs': 187, 'loss': 'mse', 'optimizer': 'adam', 'graph_mode': 'off', 'use_snp_selection': True, 'num_snps': 22276}. Best is trial 71 with value: 0.2596386798200256.
[I 2025-12-06 14:05:47,304] Trial 73 finished with value: 0.24130983806165912 and parameters: {'model_type': 'mlp', 'hidden_dims': '[512, 64]', 'dropout': 0.31743584364257715, 'batch_norm': False, 'lr': 9.999699107506927e-06, 'weight_decay': 2.0221595822749028e-07, 'epochs': 186, 'loss': 'mse', 'optimizer': 'adam', 'graph_mode': 'off', 'use_snp_selection': True, 'num_snps': 23028}. Best is trial 71 with value: 0.2596386798200256.
[I 2025-12-06 14:06:40,875] Trial 74 finished with value: 0.2425356815039355 and parameters: {'model_type': 'mlp', 'hidden_dims': '[512, 64]', 'dropout': 0.27519055668062176, 'batch_norm': False, 'lr': 1.0348398665317695e-05, 'weight_decay': 3.029775662984519e-07, 'epochs': 158, 'loss': 'mse', 'optimizer': 'adam', 'graph_mode': 'off', 'use_snp_selection': True, 'num_snps': 24453}. Best is trial 71 with value: 0.2596386798200256.
[I 2025-12-06 14:07:27,806] Trial 75 finished with value: 0.23355068349648347 and parameters: {'model_type': 'mlp', 'hidden_dims': '[512, 64]', 'dropout': 0.377564353819451, 'batch_norm': False, 'lr': 1.4694493284882338e-05, 'weight_decay': 1.0571016027306608e-07, 'epochs': 160, 'loss': 'mse', 'optimizer': 'adam', 'graph_mode': 'off', 'use_snp_selection': True, 'num_snps': 17889}. Best is trial 71 with value: 0.2596386798200256.
[I 2025-12-06 14:08:26,736] Trial 76 finished with value: 0.2490758476168184 and parameters: {'model_type': 'mlp', 'hidden_dims': '[512, 64]', 'dropout': 0.34809480717711655, 'batch_norm': False, 'lr': 1.8679258665015597e-05, 'weight_decay': 1.9443619102939386e-07, 'epochs': 192, 'loss': 'mse', 'optimizer': 'adam', 'graph_mode': 'off', 'use_snp_selection': True, 'num_snps': 26324}. Best is trial 71 with value: 0.2596386798200256.
