[I 2025-12-05 15:38:58,671] Trial 32 finished with value: 0.18114673494920122 and parameters: {'model_type': 'mlp', 'hidden_dims': '[256, 128]', 'dropout': 0.49418744773262135, 'batch_norm': True, 'lr': 0.0002773997917244844, 'weight_decay': 0.0001846465777739665, 'epochs': 285, 'loss': 'mae', 'optimizer': 'adam', 'graph_mode': 'off', 'use_snp_selection': True, 'num_snps': 20754}. Best is trial 32 with value: 0.18114673494920122.
[I 2025-12-05 15:39:00,206] Trial 33 finished with value: 0.13155646246702726 and parameters: {'model_type': 'mlp', 'hidden_dims': '[256, 128]', 'dropout': 0.5636636952382231, 'batch_norm': True, 'lr': 0.00011312611291090117, 'weight_decay': 0.00014650368576279096, 'epochs': 289, 'loss': 'mae', 'optimizer': 'adam', 'graph_mode': 'off', 'use_snp_selection': True, 'num_snps': 22388}. Best is trial 32 with value: 0.18114673494920122.
[I 2025-12-05 15:39:01,373] Trial 34 finished with value: 0.16301608798602563 and parameters: {'model_type': 'mlp', 'hidden_dims': '[256, 128]', 'dropout': 0.4435609237889782, 'batch_norm': True, 'lr': 0.0002591011998806469, 'weight_decay': 0.000298895783827261, 'epochs': 260, 'loss': 'mae', 'optimizer': 'adam', 'graph_mode': 'off', 'use_snp_selection': True, 'num_snps': 10555}. Best is trial 32 with value: 0.18114673494920122.
[I 2025-12-05 15:39:03,083] Trial 35 finished with value: 0.1415348632365876 and parameters: {'model_type': 'mlp', 'hidden_dims': '[256, 128]', 'dropout': 0.42075704330293284, 'batch_norm': False, 'lr': 3.512894173582665e-05, 'weight_decay': 0.00014691939709855103, 'epochs': 314, 'loss': 'mae', 'optimizer': 'adam', 'graph_mode': 'off', 'use_snp_selection': True, 'num_snps': 27192}. Best is trial 32 with value: 0.18114673494920122.
[I 2025-12-05 15:39:05,244] Trial 36 finished with value: 0.04309685333372499 and parameters: {'model_type': 'mlp', 'hidden_dims': '[256, 128]', 'dropout': 0.3911394758528488, 'batch_norm': True, 'lr': 2.987810169692281e-06, 'weight_decay': 0.000821905645529073, 'epochs': 231, 'loss': 'mse', 'optimizer': 'adam', 'graph_mode': 'off', 'use_snp_selection': True, 'num_snps': 38703}. Best is trial 32 with value: 0.18114673494920122.
[I 2025-12-05 15:39:06,607] Trial 37 finished with value: 0.1485965933765278 and parameters: {'model_type': 'mlp', 'hidden_dims': '[256, 128]', 'dropout': 0.5598938912008625, 'batch_norm': True, 'lr': 0.00015606773995933737, 'weight_decay': 0.0005558776893298705, 'epochs': 294, 'loss': 'mae', 'optimizer': 'adam', 'graph_mode': 'off', 'use_snp_selection': True, 'num_snps': 13351}. Best is trial 32 with value: 0.18114673494920122.
[I 2025-12-05 15:39:08,593] Trial 38 finished with value: 0.16658478941777044 and parameters: {'model_type': 'mlp', 'hidden_dims': '[512, 64]', 'dropout': 0.20872089518724207, 'batch_norm': False, 'lr': 8.864823473226788e-05, 'weight_decay': 1.6371511832318505e-05, 'epochs': 348, 'loss': 'mse', 'optimizer': 'adam', 'graph_mode': 'off', 'use_snp_selection': True, 'num_snps': 28887}. Best is trial 32 with value: 0.18114673494920122.
[I 2025-12-05 15:39:09,654] Trial 39 finished with value: 0.03976257107807674 and parameters: {'model_type': 'mlp', 'hidden_dims': '[128, 64]', 'dropout': 0.5925380989311526, 'batch_norm': True, 'lr': 7.541763156017254e-06, 'weight_decay': 0.00015559631513344406, 'epochs': 263, 'loss': 'mae', 'optimizer': 'adam', 'graph_mode': 'off', 'use_snp_selection': True, 'num_snps': 5575}. Best is trial 32 with value: 0.18114673494920122.
[I 2025-12-05 15:39:12,075] Trial 40 finished with value: 0.17168140919173627 and parameters: {'model_type': 'mlp', 'hidden_dims': '[256, 128]', 'dropout': 0.25421726379079124, 'batch_norm': True, 'lr': 0.0003083043098747535, 'weight_decay': 0.0004061416482385793, 'epochs': 302, 'loss': 'mae', 'optimizer': 'adam', 'graph_mode': 'off', 'use_snp_selection': True, 'num_snps': 49994}. Best is trial 32 with value: 0.18114673494920122.
[I 2025-12-05 15:39:13,686] Trial 41 finished with value: 0.16566434222930151 and parameters: {'model_type': 'mlp', 'hidden_dims': '[256, 128, 64]', 'dropout': 0.49058248616722444, 'batch_norm': True, 'lr': 0.0006521037321738421, 'weight_decay': 3.776918160674332e-05, 'epochs': 324, 'loss': 'mae', 'optimizer': 'adam', 'graph_mode': 'off', 'use_snp_selection': True, 'num_snps': 18430}. Best is trial 32 with value: 0.18114673494920122.
[I 2025-12-05 15:39:15,390] Trial 42 finished with value: 0.1713373748729196 and parameters: {'model_type': 'mlp', 'hidden_dims': '[512, 256]', 'dropout': 0.49815563899575366, 'batch_norm': True, 'lr': 0.0005455545873310638, 'weight_decay': 1.7232990398658525e-05, 'epochs': 270, 'loss': 'mae', 'optimizer': 'adam', 'graph_mode': 'off', 'use_snp_selection': False}. Best is trial 32 with value: 0.18114673494920122.
[I 2025-12-05 15:39:17,278] Trial 43 finished with value: 0.16958730900254382 and parameters: {'model_type': 'mlp', 'hidden_dims': '[512, 64]', 'dropout': 0.44695884537714065, 'batch_norm': True, 'lr': 0.0004064259525453361, 'weight_decay': 8.76627403877163e-05, 'epochs': 328, 'loss': 'mae', 'optimizer': 'adam', 'graph_mode': 'off', 'use_snp_selection': False}. Best is trial 32 with value: 0.18114673494920122.
[I 2025-12-05 15:39:18,583] Trial 44 finished with value: 0.14184998707206026 and parameters: {'model_type': 'mlp', 'hidden_dims': '[512, 256]', 'dropout': 0.5346819442004661, 'batch_norm': True, 'lr': 0.0001808208895509276, 'weight_decay': 4.065695806533351e-06, 'epochs': 147, 'loss': 'mse', 'optimizer': 'adam', 'graph_mode': 'off', 'use_snp_selection': False}. Best is trial 32 with value: 0.18114673494920122.
[I 2025-12-05 15:39:20,362] Trial 45 finished with value: 0.18049189709005342 and parameters: {'model_type': 'mlp', 'hidden_dims': '[512, 128]', 'dropout': 0.40053643236538133, 'batch_norm': True, 'lr': 0.0007666328615977793, 'weight_decay': 7.954048794820996e-06, 'epochs': 247, 'loss': 'mae', 'optimizer': 'adam', 'graph_mode': 'off', 'use_snp_selection': True, 'num_snps': 25269}. Best is trial 32 with value: 0.18114673494920122.
[I 2025-12-05 15:39:22,117] Trial 46 finished with value: 0.056767458357846454 and parameters: {'model_type': 'mlp', 'hidden_dims': '[512, 128]', 'dropout': 0.4128886501944806, 'batch_norm': True, 'lr': 1.0775369796266179e-06, 'weight_decay': 7.2465805510052004e-06, 'epochs': 245, 'loss': 'mae', 'optimizer': 'adam', 'graph_mode': 'off', 'use_snp_selection': True, 'num_snps': 25523}. Best is trial 32 with value: 0.18114673494920122.
[I 2025-12-05 15:39:24,139] Trial 47 finished with value: 0.1686927045769522 and parameters: {'model_type': 'mlp', 'hidden_dims': '[512, 128]', 'dropout': 0.37363073052649737, 'batch_norm': False, 'lr': 0.0006902689363416118, 'weight_decay': 2.6216359368775333e-05, 'epochs': 279, 'loss': 'mae', 'optimizer': 'adam', 'graph_mode': 'off', 'use_snp_selection': True, 'num_snps': 31947}. Best is trial 32 with value: 0.18114673494920122.
[I 2025-12-05 15:39:25,565] Trial 48 finished with value: 0.1659008320000315 and parameters: {'model_type': 'mlp', 'hidden_dims': '[512, 128]', 'dropout': 0.1281414831840949, 'batch_norm': True, 'lr': 0.00022410655137263915, 'weight_decay': 5.383202842010749e-05, 'epochs': 305, 'loss': 'mse', 'optimizer': 'adam', 'graph_mode': 'off', 'use_snp_selection': True, 'num_snps': 15117}. Best is trial 32 with value: 0.18114673494920122.
[I 2025-12-05 15:39:27,117] Trial 49 finished with value: 0.16817296038678872 and parameters: {'model_type': 'mlp', 'hidden_dims': '[512, 128]', 'dropout': 0.4015495736324988, 'batch_norm': True, 'lr': 0.0004808048138526009, 'weight_decay': 1.2878038342111666e-05, 'epochs': 219, 'loss': 'mae', 'optimizer': 'adam', 'graph_mode': 'off', 'use_snp_selection': True, 'num_snps': 23474}. Best is trial 32 with value: 0.18114673494920122.
[I 2025-12-05 15:39:28,179] Trial 50 finished with value: 0.16958406975198625 and parameters: {'model_type': 'mlp', 'hidden_dims': '[256, 128]', 'dropout': 0.3316268484013193, 'batch_norm': True, 'lr': 0.0003420996497243724, 'weight_decay': 0.0001909595388710463, 'epochs': 234, 'loss': 'mae', 'optimizer': 'adam', 'graph_mode': 'off', 'use_snp_selection': True, 'num_snps': 8054}. Best is trial 32 with value: 0.18114673494920122.
[I 2025-12-05 15:39:29,616] Trial 51 finished with value: 0.17426785733522507 and parameters: {'model_type': 'mlp', 'hidden_dims': '[512, 256]', 'dropout': 0.49469956725059416, 'batch_norm': True, 'lr': 0.0007902484594607684, 'weight_decay': 7.898595135815637e-06, 'epochs': 197, 'loss': 'mae', 'optimizer': 'adam', 'graph_mode': 'off', 'use_snp_selection': False}. Best is trial 32 with value: 0.18114673494920122.
[I 2025-12-05 15:39:31,051] Trial 52 finished with value: 0.15348962618615936 and parameters: {'model_type': 'mlp', 'hidden_dims': '[512, 256]', 'dropout': 0.46189131862906535, 'batch_norm': True, 'lr': 0.0009927442843446269, 'weight_decay': 8.89136400053805e-06, 'epochs': 196, 'loss': 'mae', 'optimizer': 'adam', 'graph_mode': 'off', 'use_snp_selection': False}. Best is trial 32 with value: 0.18114673494920122.
[I 2025-12-05 15:39:32,416] Trial 53 finished with value: 0.17854885404020296 and parameters: {'model_type': 'mlp', 'hidden_dims': '[512, 128]', 'dropout': 0.2866683003242555, 'batch_norm': True, 'lr': 0.0007343546927594668, 'weight_decay': 1.9529732420666443e-07, 'epochs': 177, 'loss': 'mae', 'optimizer': 'adam', 'graph_mode': 'off', 'use_snp_selection': False}. Best is trial 32 with value: 0.18114673494920122.
[I 2025-12-05 15:39:33,710] Trial 54 finished with value: 0.17443954806667292 and parameters: {'model_type': 'mlp', 'hidden_dims': '[512, 128]', 'dropout': 0.2875622055435533, 'batch_norm': True, 'lr': 0.0007597380086483992, 'weight_decay': 1.7389624297145908e-06, 'epochs': 182, 'loss': 'mae', 'optimizer': 'adam', 'graph_mode': 'off', 'use_snp_selection': True, 'num_snps': 16737}. Best is trial 32 with value: 0.18114673494920122.
[I 2025-12-05 15:39:35,014] Trial 55 finished with value: 0.1766614556247616 and parameters: {'model_type': 'mlp', 'hidden_dims': '[512, 128]', 'dropout': 0.28755720561032716, 'batch_norm': True, 'lr': 0.0004925923344185325, 'weight_decay': 1.3105844656641887e-06, 'epochs': 181, 'loss': 'mae', 'optimizer': 'adam', 'graph_mode': 'off', 'use_snp_selection': True, 'num_snps': 16983}. Best is trial 32 with value: 0.18114673494920122.
[I 2025-12-05 15:39:36,557] Trial 56 finished with value: 0.1716089230702931 and parameters: {'model_type': 'mlp', 'hidden_dims': '[512, 128]', 'dropout': 0.22954451329196215, 'batch_norm': True, 'lr': 0.00047822039378540593, 'weight_decay': 4.4521587111318114e-07, 'epochs': 161, 'loss': 'mae', 'optimizer': 'adam', 'graph_mode': 'off', 'use_snp_selection': True, 'num_snps': 21580}. Best is trial 32 with value: 0.18114673494920122.
[I 2025-12-05 15:39:38,239] Trial 57 finished with value: 0.17944971849928681 and parameters: {'model_type': 'mlp', 'hidden_dims': '[512, 128]', 'dropout': 0.29679760506062275, 'batch_norm': True, 'lr': 0.00026260361285750686, 'weight_decay': 2.2345292358496254e-07, 'epochs': 182, 'loss': 'mae', 'optimizer': 'adam', 'graph_mode': 'off', 'use_snp_selection': True, 'num_snps': 25663}. Best is trial 32 with value: 0.18114673494920122.
[I 2025-12-05 15:39:40,260] Trial 58 finished with value: 0.1516430763564919 and parameters: {'model_type': 'mlp', 'hidden_dims': '[512, 128]', 'dropout': 0.2933471615410275, 'batch_norm': False, 'lr': 0.0002287661899255739, 'weight_decay': 1.7429040807664296e-07, 'epochs': 212, 'loss': 'mse', 'optimizer': 'adam', 'graph_mode': 'off', 'use_snp_selection': True, 'num_snps': 33816}. Best is trial 32 with value: 0.18114673494920122.
[I 2025-12-05 15:39:41,928] Trial 59 finished with value: 0.1687446527432601 and parameters: {'model_type': 'mlp', 'hidden_dims': '[512, 128]', 'dropout': 0.2677515303525374, 'batch_norm': True, 'lr': 0.00045486239645497296, 'weight_decay': 2.71812596066753e-07, 'epochs': 181, 'loss': 'mae', 'optimizer': 'adam', 'graph_mode': 'off', 'use_snp_selection': True, 'num_snps': 27301}. Best is trial 32 with value: 0.18114673494920122.
[I 2025-12-05 15:39:43,405] Trial 60 finished with value: 0.15258052254669968 and parameters: {'model_type': 'mlp', 'hidden_dims': '[512, 128]', 'dropout': 0.32346501142047995, 'batch_norm': True, 'lr': 7.595133365001193e-05, 'weight_decay': 9.968511598142446e-07, 'epochs': 131, 'loss': 'mae', 'optimizer': 'adam', 'graph_mode': 'off', 'use_snp_selection': True, 'num_snps': 24476}. Best is trial 32 with value: 0.18114673494920122.
[I 2025-12-05 15:39:44,674] Trial 61 finished with value: 0.1786742225008478 and parameters: {'model_type': 'mlp', 'hidden_dims': '[512, 128]', 'dropout': 0.34395988518127024, 'batch_norm': True, 'lr': 0.0003104119762066287, 'weight_decay': 1.5355254750596978e-07, 'epochs': 165, 'loss': 'mae', 'optimizer': 'adam', 'graph_mode': 'off', 'use_snp_selection': True, 'num_snps': 17946}. Best is trial 32 with value: 0.18114673494920122.
[I 2025-12-05 15:39:45,854] Trial 62 finished with value: 0.18078651119737044 and parameters: {'model_type': 'mlp', 'hidden_dims': '[512, 128]', 'dropout': 0.2737212020283803, 'batch_norm': True, 'lr': 0.0006074721855619626, 'weight_decay': 1.3791726763135773e-07, 'epochs': 156, 'loss': 'mae', 'optimizer': 'adam', 'graph_mode': 'off', 'use_snp_selection': True, 'num_snps': 14178}. Best is trial 32 with value: 0.18114673494920122.
[I 2025-12-05 15:39:46,908] Trial 63 finished with value: 0.14755074976657154 and parameters: {'model_type': 'mlp', 'hidden_dims': '[512, 128]', 'dropout': 0.2681952971414988, 'batch_norm': True, 'lr': 0.00014317014583831327, 'weight_decay': 1.4929218815473127e-07, 'epochs': 159, 'loss': 'mae', 'optimizer': 'adam', 'graph_mode': 'off', 'use_snp_selection': True, 'num_snps': 11024}. Best is trial 32 with value: 0.18114673494920122.
[I 2025-12-05 15:39:48,640] Trial 64 finished with value: 0.17978236851448803 and parameters: {'model_type': 'mlp', 'hidden_dims': '[512, 128]', 'dropout': 0.3439360810465122, 'batch_norm': True, 'lr': 0.0003791353399214038, 'weight_decay': 2.647471741327207e-07, 'epochs': 208, 'loss': 'mae', 'optimizer': 'adam', 'graph_mode': 'off', 'use_snp_selection': True, 'num_snps': 29178}. Best is trial 32 with value: 0.18114673494920122.
[I 2025-12-05 15:39:50,670] Trial 65 finished with value: 0.17290131579843068 and parameters: {'model_type': 'mlp', 'hidden_dims': '[512, 128]', 'dropout': 0.3404564720657338, 'batch_norm': True, 'lr': 0.00019176220345020948, 'weight_decay': 2.130465101397552e-07, 'epochs': 211, 'loss': 'mae', 'optimizer': 'adam', 'graph_mode': 'off', 'use_snp_selection': True, 'num_snps': 35865}. Best is trial 32 with value: 0.18114673494920122.
[I 2025-12-05 15:39:52,558] Trial 66 finished with value: 0.16503960007818896 and parameters: {'model_type': 'mlp', 'hidden_dims': '[512, 128]', 'dropout': 0.3055103708170689, 'batch_norm': True, 'lr': 0.00027337524610056535, 'weight_decay': 4.005990245550203e-07, 'epochs': 160, 'loss': 'mae', 'optimizer': 'adam', 'graph_mode': 'off', 'use_snp_selection': True, 'num_snps': 30611}. Best is trial 32 with value: 0.18114673494920122.
[I 2025-12-05 15:39:54,176] Trial 67 finished with value: 0.16972346746473932 and parameters: {'model_type': 'mlp', 'hidden_dims': '[512, 128]', 'dropout': 0.3647426400638681, 'batch_norm': True, 'lr': 0.0003873175273039944, 'weight_decay': 2.8209784585482214e-07, 'epochs': 132, 'loss': 'mae', 'optimizer': 'adam', 'graph_mode': 'off', 'use_snp_selection': True, 'num_snps': 24575}. Best is trial 32 with value: 0.18114673494920122.
[I 2025-12-05 15:39:55,939] Trial 68 finished with value: 0.13011204450239663 and parameters: {'model_type': 'mlp', 'hidden_dims': '[512, 128]', 'dropout': 0.24213226216831057, 'batch_norm': True, 'lr': 4.7438451345357256e-05, 'weight_decay': 1.1487816068200428e-07, 'epochs': 168, 'loss': 'mae', 'optimizer': 'adam', 'graph_mode': 'off', 'use_snp_selection': True, 'num_snps': 28901}. Best is trial 32 with value: 0.18114673494920122.
[I 2025-12-05 15:39:57,193] Trial 69 finished with value: 0.1661991239794522 and parameters: {'model_type': 'mlp', 'hidden_dims': '[512, 128]', 'dropout': 0.34770412254308375, 'batch_norm': True, 'lr': 0.0005739885765885388, 'weight_decay': 2.110515740152481e-07, 'epochs': 207, 'loss': 'mae', 'optimizer': 'adam', 'graph_mode': 'off', 'use_snp_selection': True, 'num_snps': 13749}. Best is trial 32 with value: 0.18114673494920122.
[I 2025-12-05 15:39:58,522] Trial 70 finished with value: 0.14898872987853937 and parameters: {'model_type': 'mlp', 'hidden_dims': '[512, 128]', 'dropout': 0.3160574459116345, 'batch_norm': False, 'lr': 0.0003563522907623455, 'weight_decay': 6.04758124238763e-07, 'epochs': 137, 'loss': 'mae', 'optimizer': 'adam', 'graph_mode': 'off', 'use_snp_selection': True, 'num_snps': 20778}. Best is trial 32 with value: 0.18114673494920122.
[I 2025-12-05 15:40:00,858] Trial 71 finished with value: 0.17777379216114558 and parameters: {'model_type': 'mlp', 'hidden_dims': '[512, 128]', 'dropout': 0.3776814588374029, 'batch_norm': True, 'lr': 0.0008326355471987338, 'weight_decay': 1.6834114347404228e-07, 'epochs': 187, 'loss': 'mae', 'optimizer': 'adam', 'graph_mode': 'off', 'use_snp_selection': True, 'num_snps': 43785}. Best is trial 32 with value: 0.18114673494920122.
[I 2025-12-05 15:40:03,596] Trial 72 finished with value: 0.16872943714861327 and parameters: {'model_type': 'mlp', 'hidden_dims': '[512, 128]', 'dropout': 0.35674334380314643, 'batch_norm': True, 'lr': 0.0007985844213224125, 'weight_decay': 1.5162854455588504e-07, 'epochs': 188, 'loss': 'mae', 'optimizer': 'adam', 'graph_mode': 'off', 'use_snp_selection': True, 'num_snps': 53021}. Best is trial 32 with value: 0.18114673494920122.
[I 2025-12-05 15:40:05,884] Trial 73 finished with value: 0.1760812540893731 and parameters: {'model_type': 'mlp', 'hidden_dims': '[512, 128]', 'dropout': 0.19045077192374704, 'batch_norm': True, 'lr': 0.0006078550474644083, 'weight_decay': 3.085369368810595e-07, 'epochs': 151, 'loss': 'mae', 'optimizer': 'adam', 'graph_mode': 'off', 'use_snp_selection': True, 'num_snps': 43740}. Best is trial 32 with value: 0.18114673494920122.
[I 2025-12-05 15:40:08,194] Trial 74 finished with value: 0.16702454705919006 and parameters: {'model_type': 'mlp', 'hidden_dims': '[512, 128]', 'dropout': 0.37547042191127983, 'batch_norm': True, 'lr': 0.0004208024711531143, 'weight_decay': 4.855959599207489e-07, 'epochs': 172, 'loss': 'mae', 'optimizer': 'adam', 'graph_mode': 'off', 'use_snp_selection': True, 'num_snps': 41254}. Best is trial 32 with value: 0.18114673494920122.
[I 2025-12-05 15:40:09,738] Trial 75 finished with value: 0.17111802615592675 and parameters: {'model_type': 'mlp', 'hidden_dims': '[128, 64]', 'dropout': 0.33602633072248944, 'batch_norm': True, 'lr': 0.0002544469739810297, 'weight_decay': 1.0612585768423281e-07, 'epochs': 246, 'loss': 'mae', 'optimizer': 'adam', 'graph_mode': 'off', 'use_snp_selection': True, 'num_snps': 19787}. Best is trial 32 with value: 0.18114673494920122.
[I 2025-12-05 15:40:11,447] Trial 76 finished with value: 0.15543114290702842 and parameters: {'model_type': 'mlp', 'hidden_dims': '[256, 128, 64]', 'dropout': 0.38775295506957363, 'batch_norm': True, 'lr': 0.0006777122547508867, 'weight_decay': 1.955743096188351e-07, 'epochs': 188, 'loss': 'mae', 'optimizer': 'adam', 'graph_mode': 'off', 'use_snp_selection': True, 'num_snps': 26562}. Best is trial 32 with value: 0.18114673494920122.
[I 2025-12-05 15:40:13,541] Trial 77 finished with value: 0.1734121372073974 and parameters: {'model_type': 'mlp', 'hidden_dims': '[512, 128]', 'dropout': 0.3011863167907608, 'batch_norm': True, 'lr': 0.0008434454485046267, 'weight_decay': 1.380684047696159e-07, 'epochs': 227, 'loss': 'mae', 'optimizer': 'adam', 'graph_mode': 'off', 'use_snp_selection': True, 'num_snps': 34534}. Best is trial 32 with value: 0.18114673494920122.
[I 2025-12-05 15:40:15,028] Trial 78 finished with value: 0.09291516303771785 and parameters: {'model_type': 'mlp', 'hidden_dims': '[512, 64]', 'dropout': 0.27448173406608745, 'batch_norm': True, 'lr': 1.4379762158296706e-05, 'weight_decay': 3.689677769810707e-07, 'epochs': 201, 'loss': 'mae', 'optimizer': 'adam', 'graph_mode': 'off', 'use_snp_selection': True, 'num_snps': 22436}. Best is trial 32 with value: 0.18114673494920122.
[I 2025-12-05 15:40:17,533] Trial 79 finished with value: 0.13267137964782838 and parameters: {'model_type': 'mlp', 'hidden_dims': '[512, 128]', 'dropout': 0.40082212422563757, 'batch_norm': True, 'lr': 0.00012403662508566178, 'weight_decay': 6.930385689432322e-07, 'epochs': 167, 'loss': 'mse', 'optimizer': 'adam', 'graph_mode': 'off', 'use_snp_selection': True, 'num_snps': 49719}. Best is trial 32 with value: 0.18114673494920122.
[I 2025-12-05 15:40:19,355] Trial 80 finished with value: 0.17306065790078992 and parameters: {'model_type': 'mlp', 'hidden_dims': '[512, 128]', 'dropout': 0.25042538522507074, 'batch_norm': True, 'lr': 0.0003242836227172924, 'weight_decay': 2.627709913911406e-07, 'epochs': 221, 'loss': 'mae', 'optimizer': 'adam', 'graph_mode': 'off', 'use_snp_selection': True, 'num_snps': 30011}. Best is trial 32 with value: 0.18114673494920122.
[I 2025-12-05 15:40:21,091] Trial 81 finished with value: 0.17797515545572587 and parameters: {'model_type': 'mlp', 'hidden_dims': '[512, 128]', 'dropout': 0.31831436775640165, 'batch_norm': True, 'lr': 0.0005730279190762517, 'weight_decay': 1.7631835642891273e-07, 'epochs': 282, 'loss': 'mae', 'optimizer': 'adam', 'graph_mode': 'off', 'use_snp_selection': False}. Best is trial 32 with value: 0.18114673494920122.
[I 2025-12-05 15:40:22,877] Trial 82 finished with value: 0.17624604483770628 and parameters: {'model_type': 'mlp', 'hidden_dims': '[512, 128]', 'dropout': 0.3171816039145113, 'batch_norm': True, 'lr': 0.0005438630939529681, 'weight_decay': 1.6802558009878255e-07, 'epochs': 281, 'loss': 'mae', 'optimizer': 'adam', 'graph_mode': 'off', 'use_snp_selection': False}. Best is trial 32 with value: 0.18114673494920122.
