[I 2025-12-05 14:39:12,232] Trial 112 finished with value: 0.06759576363409307 and parameters: {'model_type': 'mlp', 'hidden_dims': '[256, 128, 64]', 'dropout': 0.44950761541775647, 'batch_norm': True, 'lr': 0.0007136348191407643, 'weight_decay': 0.00012271616581889405, 'epochs': 271, 'loss': 'mae', 'optimizer': 'adam', 'graph_mode': 'off', 'use_snp_selection': False}. Best is trial 96 with value: 0.09884358697210388.
[I 2025-12-05 14:39:15,071] Trial 113 finished with value: 0.06828364320304307 and parameters: {'model_type': 'mlp', 'hidden_dims': '[512, 256]', 'dropout': 0.47976684528849045, 'batch_norm': True, 'lr': 0.0006130713055742475, 'weight_decay': 9.537781595446836e-05, 'epochs': 258, 'loss': 'mae', 'optimizer': 'adam', 'graph_mode': 'off', 'use_snp_selection': False}. Best is trial 96 with value: 0.09884358697210388.
[I 2025-12-05 14:39:17,816] Trial 114 finished with value: 0.05802999512367742 and parameters: {'model_type': 'mlp', 'hidden_dims': '[512, 128]', 'dropout': 0.5445985278429472, 'batch_norm': True, 'lr': 0.0004508101587657536, 'weight_decay': 0.00016517620559266635, 'epochs': 252, 'loss': 'mae', 'optimizer': 'adam', 'graph_mode': 'off', 'use_snp_selection': False}. Best is trial 96 with value: 0.09884358697210388.
[I 2025-12-05 14:39:18,938] Trial 115 finished with value: 0.05093637378282748 and parameters: {'model_type': 'mlp', 'hidden_dims': '[128, 64]', 'dropout': 0.49474262405919445, 'batch_norm': True, 'lr': 0.00026845260937761003, 'weight_decay': 3.4351070007871515e-06, 'epochs': 266, 'loss': 'mae', 'optimizer': 'adam', 'graph_mode': 'off', 'use_snp_selection': False}. Best is trial 96 with value: 0.09884358697210388.
[I 2025-12-05 14:39:21,958] Trial 116 finished with value: 0.058970180464019015 and parameters: {'model_type': 'mlp', 'hidden_dims': '[512, 64]', 'dropout': 0.5260466422286829, 'batch_norm': True, 'lr': 0.0003418846526482511, 'weight_decay': 0.00019585520728813432, 'epochs': 287, 'loss': 'mae', 'optimizer': 'adam', 'graph_mode': 'off', 'use_snp_selection': False}. Best is trial 96 with value: 0.09884358697210388.
[I 2025-12-05 14:39:23,095] Trial 117 finished with value: 0.07806261455048401 and parameters: {'model_type': 'mlp', 'hidden_dims': '[128, 64]', 'dropout': 0.46185950491432926, 'batch_norm': True, 'lr': 0.000542850299020601, 'weight_decay': 1.253010067861071e-05, 'epochs': 274, 'loss': 'mae', 'optimizer': 'adam', 'graph_mode': 'off', 'use_snp_selection': False}. Best is trial 96 with value: 0.09884358697210388.
[I 2025-12-05 14:39:24,894] Trial 118 finished with value: 0.07098055002839515 and parameters: {'model_type': 'mlp', 'hidden_dims': '[256, 128, 64]', 'dropout': 0.47639942335593605, 'batch_norm': True, 'lr': 0.00022403737451491743, 'weight_decay': 6.758636929522758e-06, 'epochs': 278, 'loss': 'mae', 'optimizer': 'adam', 'graph_mode': 'off', 'use_snp_selection': False}. Best is trial 96 with value: 0.09884358697210388.
[I 2025-12-05 14:39:26,109] Trial 119 finished with value: 0.038156453394778855 and parameters: {'model_type': 'mlp', 'hidden_dims': '[128, 64]', 'dropout': 0.12015952626295184, 'batch_norm': False, 'lr': 1.7347708219467912e-05, 'weight_decay': 1.2007275125148922e-05, 'epochs': 292, 'loss': 'mae', 'optimizer': 'adam', 'graph_mode': 'off', 'use_snp_selection': False}. Best is trial 96 with value: 0.09884358697210388.
[I 2025-12-05 14:39:27,277] Trial 120 finished with value: 0.07528750100982101 and parameters: {'model_type': 'mlp', 'hidden_dims': '[128, 64]', 'dropout': 0.5644316536945323, 'batch_norm': True, 'lr': 0.000132062309695318, 'weight_decay': 6.254971635711544e-06, 'epochs': 271, 'loss': 'mae', 'optimizer': 'adam', 'graph_mode': 'off', 'use_snp_selection': False}. Best is trial 96 with value: 0.09884358697210388.
[I 2025-12-05 14:39:28,412] Trial 121 finished with value: 0.06380709149198655 and parameters: {'model_type': 'mlp', 'hidden_dims': '[128, 64]', 'dropout': 0.46116908453701616, 'batch_norm': True, 'lr': 0.000552377783640105, 'weight_decay': 1.4010041349280546e-05, 'epochs': 250, 'loss': 'mae', 'optimizer': 'adam', 'graph_mode': 'off', 'use_snp_selection': False}. Best is trial 96 with value: 0.09884358697210388.
[I 2025-12-05 14:39:29,532] Trial 122 finished with value: 0.06878320184876378 and parameters: {'model_type': 'mlp', 'hidden_dims': '[128, 64]', 'dropout': 0.4481021791820539, 'batch_norm': True, 'lr': 0.0007718375538412698, 'weight_decay': 8.669641179231263e-06, 'epochs': 260, 'loss': 'mae', 'optimizer': 'adam', 'graph_mode': 'off', 'use_snp_selection': False}. Best is trial 96 with value: 0.09884358697210388.
[I 2025-12-05 14:39:30,690] Trial 123 finished with value: 0.02979677635196844 and parameters: {'model_type': 'mlp', 'hidden_dims': '[128, 64]', 'dropout': 0.49036552740213374, 'batch_norm': True, 'lr': 7.3028017958345795e-06, 'weight_decay': 1.6549681399803393e-05, 'epochs': 284, 'loss': 'mae', 'optimizer': 'adam', 'graph_mode': 'off', 'use_snp_selection': False}. Best is trial 96 with value: 0.09884358697210388.
[I 2025-12-05 14:39:31,813] Trial 124 finished with value: 0.06567369780006599 and parameters: {'model_type': 'mlp', 'hidden_dims': '[128, 64]', 'dropout': 0.46738790820336523, 'batch_norm': True, 'lr': 0.00038593429941529957, 'weight_decay': 0.00030370576912739906, 'epochs': 265, 'loss': 'mae', 'optimizer': 'adam', 'graph_mode': 'off', 'use_snp_selection': False}. Best is trial 96 with value: 0.09884358697210388.
[I 2025-12-05 14:39:32,953] Trial 125 finished with value: 0.08828007072394088 and parameters: {'model_type': 'mlp', 'hidden_dims': '[128, 64]', 'dropout': 0.5096443069944823, 'batch_norm': True, 'lr': 0.0005130610166437324, 'weight_decay': 0.00012603929074279103, 'epochs': 275, 'loss': 'mae', 'optimizer': 'adam', 'graph_mode': 'off', 'use_snp_selection': False}. Best is trial 96 with value: 0.09884358697210388.
[I 2025-12-05 14:39:35,953] Trial 126 finished with value: 0.0553341024880544 and parameters: {'model_type': 'mlp', 'hidden_dims': '[512, 128]', 'dropout': 0.5089465889471776, 'batch_norm': True, 'lr': 0.0002885392781700678, 'weight_decay': 0.00010479585101609814, 'epochs': 278, 'loss': 'mae', 'optimizer': 'adam', 'graph_mode': 'off', 'use_snp_selection': False}. Best is trial 96 with value: 0.09884358697210388.
[I 2025-12-05 14:39:37,128] Trial 127 finished with value: 0.07795338294664508 and parameters: {'model_type': 'mlp', 'hidden_dims': '[128, 64]', 'dropout': 0.5814803226609241, 'batch_norm': True, 'lr': 0.00046870303376346886, 'weight_decay': 5.150404176084171e-05, 'epochs': 272, 'loss': 'mae', 'optimizer': 'adam', 'graph_mode': 'off', 'use_snp_selection': False}. Best is trial 96 with value: 0.09884358697210388.
[I 2025-12-05 14:39:40,384] Trial 128 finished with value: 0.06817918421491699 and parameters: {'model_type': 'mlp', 'hidden_dims': '[512, 64]', 'dropout': 0.366067143787095, 'batch_norm': True, 'lr': 9.577904991460868e-05, 'weight_decay': 2.0576271399392666e-05, 'epochs': 316, 'loss': 'mae', 'optimizer': 'adam', 'graph_mode': 'off', 'use_snp_selection': False}. Best is trial 96 with value: 0.09884358697210388.
[I 2025-12-05 14:39:42,184] Trial 129 finished with value: 0.04969541126444359 and parameters: {'model_type': 'mlp', 'hidden_dims': '[256, 128, 64]', 'dropout': 0.42391575310593216, 'batch_norm': True, 'lr': 0.00018136574382535483, 'weight_decay': 2.3541379786530526e-06, 'epochs': 292, 'loss': 'mae', 'optimizer': 'adam', 'graph_mode': 'off', 'use_snp_selection': False}. Best is trial 96 with value: 0.09884358697210388.
[I 2025-12-05 14:39:43,426] Trial 130 finished with value: 0.055742083650009024 and parameters: {'model_type': 'mlp', 'hidden_dims': '[128, 64]', 'dropout': 0.5215773301791204, 'batch_norm': True, 'lr': 0.0005455893204099697, 'weight_decay': 4.60419081940949e-06, 'epochs': 309, 'loss': 'mse', 'optimizer': 'adam', 'graph_mode': 'off', 'use_snp_selection': False}. Best is trial 96 with value: 0.09884358697210388.
[I 2025-12-05 14:39:44,585] Trial 131 finished with value: 0.05680222608123738 and parameters: {'model_type': 'mlp', 'hidden_dims': '[128, 64]', 'dropout': 0.5537496430839405, 'batch_norm': True, 'lr': 0.0004843057502120965, 'weight_decay': 5.531883889918264e-05, 'epochs': 273, 'loss': 'mae', 'optimizer': 'adam', 'graph_mode': 'off', 'use_snp_selection': False}. Best is trial 96 with value: 0.09884358697210388.
[I 2025-12-05 14:39:45,800] Trial 132 finished with value: 0.0514888873748313 and parameters: {'model_type': 'mlp', 'hidden_dims': '[128, 64]', 'dropout': 0.5853554262537303, 'batch_norm': True, 'lr': 0.00040229812759452234, 'weight_decay': 6.563623734254746e-05, 'epochs': 283, 'loss': 'mae', 'optimizer': 'adam', 'graph_mode': 'off', 'use_snp_selection': False}. Best is trial 96 with value: 0.09884358697210388.
[I 2025-12-05 14:39:47,087] Trial 133 finished with value: 0.06835794368576521 and parameters: {'model_type': 'mlp', 'hidden_dims': '[128, 64]', 'dropout': 0.5393225353765041, 'batch_norm': True, 'lr': 0.0003319248974679006, 'weight_decay': 7.573610799274362e-05, 'epochs': 327, 'loss': 'mae', 'optimizer': 'adam', 'graph_mode': 'off', 'use_snp_selection': False}. Best is trial 96 with value: 0.09884358697210388.
[I 2025-12-05 14:39:48,220] Trial 134 finished with value: 0.06205828701045219 and parameters: {'model_type': 'mlp', 'hidden_dims': '[128, 64]', 'dropout': 0.4867135361386825, 'batch_norm': True, 'lr': 0.00011851089166932665, 'weight_decay': 4.8931102058798915e-05, 'epochs': 254, 'loss': 'mae', 'optimizer': 'adam', 'graph_mode': 'off', 'use_snp_selection': False}. Best is trial 96 with value: 0.09884358697210388.
[I 2025-12-05 14:39:49,433] Trial 135 finished with value: 0.06571095520294085 and parameters: {'model_type': 'mlp', 'hidden_dims': '[128, 64]', 'dropout': 0.4966210120471503, 'batch_norm': True, 'lr': 0.00044433122455574136, 'weight_decay': 1.0514808241886004e-05, 'epochs': 297, 'loss': 'mae', 'optimizer': 'adam', 'graph_mode': 'off', 'use_snp_selection': False}. Best is trial 96 with value: 0.09884358697210388.
[I 2025-12-05 14:39:51,025] Trial 136 finished with value: 0.06383779467953135 and parameters: {'model_type': 'mlp', 'hidden_dims': '[256, 128]', 'dropout': 0.5979887454514348, 'batch_norm': True, 'lr': 0.0005163254297592679, 'weight_decay': 0.00017621412198358404, 'epochs': 244, 'loss': 'mae', 'optimizer': 'adam', 'graph_mode': 'off', 'use_snp_selection': False}. Best is trial 96 with value: 0.09884358697210388.
[I 2025-12-05 14:39:52,313] Trial 137 finished with value: 0.06993583850434913 and parameters: {'model_type': 'mlp', 'hidden_dims': '[128, 64]', 'dropout': 0.5815899307720157, 'batch_norm': True, 'lr': 0.00024591987987333753, 'weight_decay': 0.00011373795936679069, 'epochs': 343, 'loss': 'mae', 'optimizer': 'adam', 'graph_mode': 'off', 'use_snp_selection': False}. Best is trial 96 with value: 0.09884358697210388.
[I 2025-12-05 14:39:53,415] Trial 138 finished with value: 0.05288886911223106 and parameters: {'model_type': 'mlp', 'hidden_dims': '[128, 64]', 'dropout': 0.4372944856779606, 'batch_norm': False, 'lr': 0.00020321907179244862, 'weight_decay': 4.2819242492879336e-07, 'epochs': 270, 'loss': 'mae', 'optimizer': 'adam', 'graph_mode': 'off', 'use_snp_selection': False}. Best is trial 96 with value: 0.09884358697210388.
[I 2025-12-05 14:39:56,411] Trial 139 finished with value: 0.06621101211576658 and parameters: {'model_type': 'mlp', 'hidden_dims': '[512, 256]', 'dropout': 0.5093119595258582, 'batch_norm': True, 'lr': 0.0001698094240828611, 'weight_decay': 2.7495379826666037e-05, 'epochs': 278, 'loss': 'mae', 'optimizer': 'adam', 'graph_mode': 'off', 'use_snp_selection': False}. Best is trial 96 with value: 0.09884358697210388.
[I 2025-12-05 14:39:58,228] Trial 140 finished with value: 0.07617686405381988 and parameters: {'model_type': 'mlp', 'hidden_dims': '[512, 128]', 'dropout': 0.47878240538640326, 'batch_norm': True, 'lr': 8.617342729227245e-05, 'weight_decay': 0.0002523680540651242, 'epochs': 127, 'loss': 'mae', 'optimizer': 'adam', 'graph_mode': 'off', 'use_snp_selection': False}. Best is trial 96 with value: 0.09884358697210388.
[I 2025-12-05 14:39:59,389] Trial 141 finished with value: 0.07334656423551655 and parameters: {'model_type': 'mlp', 'hidden_dims': '[128, 64]', 'dropout': 0.4631650104417709, 'batch_norm': True, 'lr': 0.0006090234504991004, 'weight_decay': 0.00013592368563245723, 'epochs': 264, 'loss': 'mae', 'optimizer': 'adam', 'graph_mode': 'off', 'use_snp_selection': False}. Best is trial 96 with value: 0.09884358697210388.
[I 2025-12-05 14:40:00,590] Trial 142 finished with value: 0.07156825043640933 and parameters: {'model_type': 'mlp', 'hidden_dims': '[128, 64]', 'dropout': 0.45172207807261566, 'batch_norm': True, 'lr': 0.0007443504026915399, 'weight_decay': 9.242854479893489e-05, 'epochs': 287, 'loss': 'mae', 'optimizer': 'adam', 'graph_mode': 'off', 'use_snp_selection': False}. Best is trial 96 with value: 0.09884358697210388.
[I 2025-12-05 14:40:01,695] Trial 143 finished with value: 0.07046368659768039 and parameters: {'model_type': 'mlp', 'hidden_dims': '[128, 64]', 'dropout': 0.4720248259780073, 'batch_norm': True, 'lr': 0.00037040032017965824, 'weight_decay': 0.00015144607887149108, 'epochs': 255, 'loss': 'mae', 'optimizer': 'adam', 'graph_mode': 'off', 'use_snp_selection': False}. Best is trial 96 with value: 0.09884358697210388.
[I 2025-12-05 14:40:02,810] Trial 144 finished with value: 0.0715423967938138 and parameters: {'model_type': 'mlp', 'hidden_dims': '[128, 64]', 'dropout': 0.4560219456382053, 'batch_norm': True, 'lr': 0.0005834042668210625, 'weight_decay': 3.7760535965471946e-05, 'epochs': 263, 'loss': 'mae', 'optimizer': 'adam', 'graph_mode': 'off', 'use_snp_selection': False}. Best is trial 96 with value: 0.09884358697210388.
[I 2025-12-05 14:40:03,847] Trial 145 finished with value: 0.08705600936385811 and parameters: {'model_type': 'mlp', 'hidden_dims': '[128, 64]', 'dropout': 0.4138909522606408, 'batch_norm': True, 'lr': 0.0004919990281443638, 'weight_decay': 7.611409371212186e-06, 'epochs': 224, 'loss': 'mae', 'optimizer': 'adam', 'graph_mode': 'off', 'use_snp_selection': False}. Best is trial 96 with value: 0.09884358697210388.
[I 2025-12-05 14:40:05,463] Trial 146 finished with value: 0.061824519410274704 and parameters: {'model_type': 'mlp', 'hidden_dims': '[256, 128, 64]', 'dropout': 0.41661185752777996, 'batch_norm': True, 'lr': 0.00030503461044411706, 'weight_decay': 9.826366737162733e-06, 'epochs': 246, 'loss': 'mae', 'optimizer': 'adam', 'graph_mode': 'off', 'use_snp_selection': False}. Best is trial 96 with value: 0.09884358697210388.
[I 2025-12-05 14:40:06,502] Trial 147 finished with value: 0.06403664339059734 and parameters: {'model_type': 'mlp', 'hidden_dims': '[128, 64]', 'dropout': 0.40651853004097876, 'batch_norm': True, 'lr': 0.0004903723938566582, 'weight_decay': 7.727600356631934e-06, 'epochs': 226, 'loss': 'mae', 'optimizer': 'adam', 'graph_mode': 'off', 'use_snp_selection': False}. Best is trial 96 with value: 0.09884358697210388.
[I 2025-12-05 14:40:09,021] Trial 148 finished with value: 0.05958528427704243 and parameters: {'model_type': 'mlp', 'hidden_dims': '[512, 64]', 'dropout': 0.33127266673741046, 'batch_norm': True, 'lr': 0.0004172287788694118, 'weight_decay': 1.295688504322867e-05, 'epochs': 216, 'loss': 'mae', 'optimizer': 'adam', 'graph_mode': 'off', 'use_snp_selection': False}. Best is trial 96 with value: 0.09884358697210388.
[I 2025-12-05 14:40:10,131] Trial 149 finished with value: 0.054067389966931216 and parameters: {'model_type': 'mlp', 'hidden_dims': '[128, 64]', 'dropout': 0.43115671607271144, 'batch_norm': True, 'lr': 0.00014194229742988193, 'weight_decay': 5.723466974715793e-06, 'epochs': 236, 'loss': 'mae', 'optimizer': 'adam', 'graph_mode': 'off', 'use_snp_selection': False}. Best is trial 96 with value: 0.09884358697210388.
[I 2025-12-05 14:40:13,466] Trial 0 finished with value: 0.05697407595900397 and parameters: {'model_type': 'mlp', 'hidden_dims': '[128, 64]', 'dropout': 0.199031432379812, 'batch_norm': True, 'lr': 1.8408544111075837e-06, 'weight_decay': 5.5136510071208614e-05, 'epochs': 336, 'loss': 'mae', 'optimizer': 'adam', 'graph_mode': 'off', 'use_snp_selection': True, 'num_snps': 43862}. Best is trial 0 with value: 0.05697407595900397.
[I 2025-12-05 14:40:15,702] Trial 1 finished with value: 0.10515983365411802 and parameters: {'model_type': 'mlp', 'hidden_dims': '[256, 128]', 'dropout': 0.4370668075331726, 'batch_norm': True, 'lr': 7.133471581159139e-05, 'weight_decay': 1.128633586803549e-05, 'epochs': 242, 'loss': 'mae', 'optimizer': 'adam', 'graph_mode': 'off', 'use_snp_selection': False}. Best is trial 1 with value: 0.10515983365411802.
[I 2025-12-05 14:40:17,492] Trial 2 finished with value: 0.04876389701039521 and parameters: {'model_type': 'mlp', 'hidden_dims': '[256, 128, 64]', 'dropout': 0.41314357415569625, 'batch_norm': False, 'lr': 3.952233718592101e-06, 'weight_decay': 0.00026754769258252603, 'epochs': 149, 'loss': 'mse', 'optimizer': 'adam', 'graph_mode': 'off', 'use_snp_selection': True, 'num_snps': 11571}. Best is trial 1 with value: 0.10515983365411802.
[I 2025-12-05 14:40:22,143] Trial 3 finished with value: 0.0897804058009274 and parameters: {'model_type': 'mlp', 'hidden_dims': '[512, 64]', 'dropout': 0.5938127374509361, 'batch_norm': False, 'lr': 5.67704586114731e-06, 'weight_decay': 2.4518087630137052e-05, 'epochs': 320, 'loss': 'mae', 'optimizer': 'adam', 'graph_mode': 'off', 'use_snp_selection': False}. Best is trial 1 with value: 0.10515983365411802.
[I 2025-12-05 14:40:26,541] Trial 4 finished with value: 0.06517865026710226 and parameters: {'model_type': 'mlp', 'hidden_dims': '[512, 128]', 'dropout': 0.25746343592134413, 'batch_norm': True, 'lr': 1.3467657668402788e-06, 'weight_decay': 0.00033087251918647806, 'epochs': 277, 'loss': 'mse', 'optimizer': 'adam', 'graph_mode': 'off', 'use_snp_selection': True, 'num_snps': 36675}. Best is trial 1 with value: 0.10515983365411802.
[I 2025-12-05 14:40:29,706] Trial 5 finished with value: 0.05311343638365443 and parameters: {'model_type': 'mlp', 'hidden_dims': '[512, 64]', 'dropout': 0.38275350994408375, 'batch_norm': True, 'lr': 1.5586664309232824e-06, 'weight_decay': 0.0008227664668621182, 'epochs': 145, 'loss': 'mae', 'optimizer': 'adam', 'graph_mode': 'off', 'use_snp_selection': True, 'num_snps': 32148}. Best is trial 1 with value: 0.10515983365411802.
[I 2025-12-05 14:40:31,621] Trial 6 finished with value: 0.08487567717028127 and parameters: {'model_type': 'mlp', 'hidden_dims': '[256, 128]', 'dropout': 0.3930109900265879, 'batch_norm': False, 'lr': 4.892964372128395e-05, 'weight_decay': 1.5809549317992182e-06, 'epochs': 199, 'loss': 'mse', 'optimizer': 'adam', 'graph_mode': 'off', 'use_snp_selection': False}. Best is trial 1 with value: 0.10515983365411802.
[I 2025-12-05 14:40:33,602] Trial 7 finished with value: 0.11937346209676132 and parameters: {'model_type': 'mlp', 'hidden_dims': '[512, 256]', 'dropout': 0.15343979219678458, 'batch_norm': True, 'lr': 6.234003099047341e-05, 'weight_decay': 3.894760610535477e-07, 'epochs': 97, 'loss': 'mse', 'optimizer': 'adam', 'graph_mode': 'off', 'use_snp_selection': False}. Best is trial 7 with value: 0.11937346209676132.
[I 2025-12-05 14:40:38,191] Trial 8 finished with value: 0.09662873949918518 and parameters: {'model_type': 'mlp', 'hidden_dims': '[512, 128]', 'dropout': 0.10743001231661406, 'batch_norm': True, 'lr': 0.00023728538449271062, 'weight_decay': 1.7629071578048637e-05, 'epochs': 312, 'loss': 'mae', 'optimizer': 'adam', 'graph_mode': 'off', 'use_snp_selection': False}. Best is trial 7 with value: 0.11937346209676132.
[I 2025-12-05 14:40:41,088] Trial 9 finished with value: 0.09419015075052618 and parameters: {'model_type': 'mlp', 'hidden_dims': '[512, 64]', 'dropout': 0.14505336736221927, 'batch_norm': True, 'lr': 5.8619638388111826e-05, 'weight_decay': 6.200156172669308e-07, 'epochs': 175, 'loss': 'mse', 'optimizer': 'adam', 'graph_mode': 'off', 'use_snp_selection': False}. Best is trial 7 with value: 0.11937346209676132.
[I 2025-12-05 14:40:42,330] Trial 10 finished with value: -0.010953087775882856 and parameters: {'model_type': 'mlp', 'hidden_dims': '[512, 256]', 'dropout': 0.2736992815328032, 'batch_norm': False, 'lr': 0.00032393778075602147, 'weight_decay': 1.1511946696017092e-07, 'epochs': 41, 'loss': 'mse', 'optimizer': 'adam', 'graph_mode': 'off', 'use_snp_selection': False}. Best is trial 7 with value: 0.11937346209676132.
[I 2025-12-05 14:40:43,535] Trial 11 finished with value: 0.053678600898913915 and parameters: {'model_type': 'mlp', 'hidden_dims': '[256, 128]', 'dropout': 0.5011246104824927, 'batch_norm': True, 'lr': 1.6474108386126448e-05, 'weight_decay': 2.8129958937311506e-06, 'epochs': 77, 'loss': 'mae', 'optimizer': 'adam', 'graph_mode': 'off', 'use_snp_selection': False}. Best is trial 7 with value: 0.11937346209676132.
[I 2025-12-05 14:40:47,384] Trial 12 finished with value: 0.10127142084101862 and parameters: {'model_type': 'mlp', 'hidden_dims': '[512, 256]', 'dropout': 0.4779690972965961, 'batch_norm': True, 'lr': 0.000121041789182661, 'weight_decay': 1.3081036432574914e-07, 'epochs': 248, 'loss': 'mae', 'optimizer': 'adam', 'graph_mode': 'off', 'use_snp_selection': False}. Best is trial 7 with value: 0.11937346209676132.
[I 2025-12-05 14:40:50,937] Trial 13 finished with value: 0.08030918364988364 and parameters: {'model_type': 'mlp', 'hidden_dims': '[512, 256]', 'dropout': 0.3015309124038663, 'batch_norm': True, 'lr': 1.8184704710575438e-05, 'weight_decay': 3.7813806106960503e-06, 'epochs': 224, 'loss': 'mse', 'optimizer': 'adam', 'graph_mode': 'off', 'use_snp_selection': False}. Best is trial 7 with value: 0.11937346209676132.
