[I 2025-12-05 17:19:58,755] Trial 109 finished with value: 0.2768941285426528 and parameters: {'model_type': 'mlp', 'hidden_dims': '[256, 128, 64]', 'dropout': 0.47724691976170064, 'batch_norm': False, 'lr': 4.554727432373807e-05, 'weight_decay': 2.6029440401614673e-05, 'epochs': 325, 'loss': 'mse', 'optimizer': 'adam', 'graph_mode': 'off', 'use_snp_selection': False}. Best is trial 53 with value: 0.3063562177890325.
[I 2025-12-05 17:20:05,555] Trial 110 finished with value: 0.25705962551554395 and parameters: {'model_type': 'mlp', 'hidden_dims': '[128, 64]', 'dropout': 0.5020399758635932, 'batch_norm': False, 'lr': 3.2591237147496675e-05, 'weight_decay': 0.0008363393674531791, 'epochs': 46, 'loss': 'mse', 'optimizer': 'adam', 'graph_mode': 'off', 'use_snp_selection': False}. Best is trial 53 with value: 0.3063562177890325.
[I 2025-12-05 17:20:25,957] Trial 111 finished with value: 0.3015797038696054 and parameters: {'model_type': 'mlp', 'hidden_dims': '[128, 64]', 'dropout': 0.5422540074491605, 'batch_norm': False, 'lr': 5.0462744486622255e-06, 'weight_decay': 0.0002606167388175366, 'epochs': 310, 'loss': 'mse', 'optimizer': 'adam', 'graph_mode': 'off', 'use_snp_selection': False}. Best is trial 53 with value: 0.3063562177890325.
[I 2025-12-05 17:20:47,691] Trial 112 finished with value: 0.3020984368622588 and parameters: {'model_type': 'mlp', 'hidden_dims': '[128, 64]', 'dropout': 0.5360354778197334, 'batch_norm': False, 'lr': 7.650789435403664e-06, 'weight_decay': 0.0005050551772483161, 'epochs': 336, 'loss': 'mse', 'optimizer': 'adam', 'graph_mode': 'off', 'use_snp_selection': False}. Best is trial 53 with value: 0.3063562177890325.
[I 2025-12-05 17:21:03,019] Trial 113 finished with value: 0.301679543218555 and parameters: {'model_type': 'mlp', 'hidden_dims': '[128, 64]', 'dropout': 0.5764932204559352, 'batch_norm': False, 'lr': 8.523567008689146e-06, 'weight_decay': 0.000575717722537473, 'epochs': 211, 'loss': 'mse', 'optimizer': 'adam', 'graph_mode': 'off', 'use_snp_selection': False}. Best is trial 53 with value: 0.3063562177890325.
[I 2025-12-05 17:21:23,063] Trial 114 finished with value: 0.2935218138768253 and parameters: {'model_type': 'mlp', 'hidden_dims': '[128, 64]', 'dropout': 0.521944907515301, 'batch_norm': False, 'lr': 3.4540479361119817e-06, 'weight_decay': 7.797037325757124e-06, 'epochs': 303, 'loss': 'mse', 'optimizer': 'adam', 'graph_mode': 'off', 'use_snp_selection': False}. Best is trial 53 with value: 0.3063562177890325.
[I 2025-12-05 17:22:22,792] Trial 115 finished with value: 0.29972919426494543 and parameters: {'model_type': 'mlp', 'hidden_dims': '[512, 128]', 'dropout': 0.5575302780418877, 'batch_norm': False, 'lr': 6.509129151642545e-06, 'weight_decay': 0.0003894281410110786, 'epochs': 314, 'loss': 'mse', 'optimizer': 'adam', 'graph_mode': 'off', 'use_snp_selection': False}. Best is trial 53 with value: 0.3063562177890325.
[I 2025-12-05 17:22:56,768] Trial 116 finished with value: 0.29397756811939374 and parameters: {'model_type': 'mlp', 'hidden_dims': '[256, 128]', 'dropout': 0.5490558841648543, 'batch_norm': False, 'lr': 1.1250430116566108e-05, 'weight_decay': 0.00016802055098217499, 'epochs': 323, 'loss': 'mse', 'optimizer': 'adam', 'graph_mode': 'off', 'use_snp_selection': False}. Best is trial 53 with value: 0.3063562177890325.
[I 2025-12-05 17:23:16,434] Trial 117 finished with value: 0.29884240864327066 and parameters: {'model_type': 'mlp', 'hidden_dims': '[128, 64]', 'dropout': 0.5100779546713726, 'batch_norm': False, 'lr': 5.6076725203629265e-06, 'weight_decay': 1.6166116363895463e-07, 'epochs': 296, 'loss': 'mse', 'optimizer': 'adam', 'graph_mode': 'off', 'use_snp_selection': False}. Best is trial 53 with value: 0.3063562177890325.
[I 2025-12-05 17:24:09,878] Trial 118 finished with value: 0.2900511772045497 and parameters: {'model_type': 'mlp', 'hidden_dims': '[512, 128]', 'dropout': 0.5957452764355228, 'batch_norm': False, 'lr': 2.2768731784923852e-05, 'weight_decay': 0.0008209090615621771, 'epochs': 278, 'loss': 'mse', 'optimizer': 'adam', 'graph_mode': 'off', 'use_snp_selection': False}. Best is trial 53 with value: 0.3063562177890325.
[I 2025-12-05 17:24:25,717] Trial 119 finished with value: 0.2874361107690548 and parameters: {'model_type': 'mlp', 'hidden_dims': '[128, 64]', 'dropout': 0.4177619933425662, 'batch_norm': False, 'lr': 2.7371024288646427e-06, 'weight_decay': 0.0002998659533418033, 'epochs': 222, 'loss': 'mse', 'optimizer': 'adam', 'graph_mode': 'off', 'use_snp_selection': False}. Best is trial 53 with value: 0.3063562177890325.
[I 2025-12-05 17:24:46,461] Trial 120 finished with value: 0.29386819675685716 and parameters: {'model_type': 'mlp', 'hidden_dims': '[128, 64]', 'dropout': 0.567626328468753, 'batch_norm': False, 'lr': 1.9532818102566887e-05, 'weight_decay': 1.7904817130171534e-05, 'epochs': 317, 'loss': 'mse', 'optimizer': 'adam', 'graph_mode': 'off', 'use_snp_selection': False}. Best is trial 53 with value: 0.3063562177890325.
[I 2025-12-05 17:26:14,709] Trial 121 finished with value: 0.28529357301090547 and parameters: {'model_type': 'mlp', 'hidden_dims': '[512, 256]', 'dropout': 0.5795314463333365, 'batch_norm': False, 'lr': 0.000206932575202112, 'weight_decay': 2.5731973039892e-06, 'epochs': 304, 'loss': 'mse', 'optimizer': 'adam', 'graph_mode': 'off', 'use_snp_selection': True, 'num_snps': 59543}. Best is trial 53 with value: 0.3063562177890325.
[I 2025-12-05 17:26:40,851] Trial 122 finished with value: 0.260966542007523 and parameters: {'model_type': 'mlp', 'hidden_dims': '[512, 256]', 'dropout': 0.5376490878602498, 'batch_norm': False, 'lr': 4.011271513946301e-06, 'weight_decay': 1.6526114832945857e-06, 'epochs': 74, 'loss': 'mse', 'optimizer': 'adam', 'graph_mode': 'off', 'use_snp_selection': True, 'num_snps': 10475}. Best is trial 53 with value: 0.3063562177890325.
[I 2025-12-05 17:28:11,707] Trial 123 finished with value: 0.30725395164750197 and parameters: {'model_type': 'mlp', 'hidden_dims': '[512, 256]', 'dropout': 0.5555959814753134, 'batch_norm': False, 'lr': 3.595949563594498e-06, 'weight_decay': 0.0004947677283529998, 'epochs': 343, 'loss': 'mse', 'optimizer': 'adam', 'graph_mode': 'off', 'use_snp_selection': True, 'num_snps': 56140}. Best is trial 123 with value: 0.30725395164750197.
[I 2025-12-05 17:29:43,939] Trial 124 finished with value: 0.2995450125501825 and parameters: {'model_type': 'mlp', 'hidden_dims': '[512, 256]', 'dropout': 0.5255349037724308, 'batch_norm': False, 'lr': 4.683824517090376e-06, 'weight_decay': 0.00036747929509801523, 'epochs': 344, 'loss': 'mse', 'optimizer': 'adam', 'graph_mode': 'off', 'use_snp_selection': True, 'num_snps': 57127}. Best is trial 123 with value: 0.30725395164750197.
[I 2025-12-05 17:31:04,852] Trial 125 finished with value: 0.29575594123835797 and parameters: {'model_type': 'mlp', 'hidden_dims': '[512, 64]', 'dropout': 0.5539105104010605, 'batch_norm': False, 'lr': 6.977973731944313e-06, 'weight_decay': 0.00047008227467958363, 'epochs': 334, 'loss': 'mse', 'optimizer': 'adam', 'graph_mode': 'off', 'use_snp_selection': True, 'num_snps': 49556}. Best is trial 123 with value: 0.30725395164750197.
[I 2025-12-05 17:31:55,863] Trial 126 finished with value: 0.27368190719988855 and parameters: {'model_type': 'mlp', 'hidden_dims': '[512, 128]', 'dropout': 0.19827049491251014, 'batch_norm': False, 'lr': 9.863007031427205e-06, 'weight_decay': 0.0005469646429442608, 'epochs': 341, 'loss': 'mse', 'optimizer': 'adam', 'graph_mode': 'off', 'use_snp_selection': True, 'num_snps': 24491}. Best is trial 123 with value: 0.30725395164750197.
[I 2025-12-05 17:32:17,130] Trial 127 finished with value: 0.2865039385345304 and parameters: {'model_type': 'mlp', 'hidden_dims': '[128, 64]', 'dropout': 0.5431118940531976, 'batch_norm': True, 'lr': 1.3191769342458412e-05, 'weight_decay': 5.629654755561224e-05, 'epochs': 326, 'loss': 'mae', 'optimizer': 'adam', 'graph_mode': 'off', 'use_snp_selection': False}. Best is trial 123 with value: 0.30725395164750197.
[I 2025-12-05 17:33:03,193] Trial 128 finished with value: 0.3004234016767916 and parameters: {'model_type': 'mlp', 'hidden_dims': '[128, 64]', 'dropout': 0.5723213800393198, 'batch_norm': False, 'lr': 5.643989780674228e-06, 'weight_decay': 0.0006572858841054601, 'epochs': 349, 'loss': 'mse', 'optimizer': 'adam', 'graph_mode': 'off', 'use_snp_selection': True, 'num_snps': 45443}. Best is trial 123 with value: 0.30725395164750197.
[I 2025-12-05 17:34:05,906] Trial 129 finished with value: 0.30654843601106807 and parameters: {'model_type': 'mlp', 'hidden_dims': '[512, 256]', 'dropout': 0.5157396784631924, 'batch_norm': False, 'lr': 3.1177694373459287e-06, 'weight_decay': 0.0007816420904089175, 'epochs': 330, 'loss': 'mse', 'optimizer': 'adam', 'graph_mode': 'off', 'use_snp_selection': False}. Best is trial 123 with value: 0.30725395164750197.
[I 2025-12-05 17:35:08,939] Trial 130 finished with value: 0.30220030239355145 and parameters: {'model_type': 'mlp', 'hidden_dims': '[512, 256]', 'dropout': 0.5153065906893688, 'batch_norm': False, 'lr': 3.0837495591782523e-06, 'weight_decay': 0.0002565464768153849, 'epochs': 330, 'loss': 'mse', 'optimizer': 'adam', 'graph_mode': 'off', 'use_snp_selection': False}. Best is trial 123 with value: 0.30725395164750197.
[I 2025-12-05 17:36:10,429] Trial 131 finished with value: 0.30483118190296754 and parameters: {'model_type': 'mlp', 'hidden_dims': '[512, 256]', 'dropout': 0.5603881016531023, 'batch_norm': False, 'lr': 2.5157223682469967e-06, 'weight_decay': 0.0009939680968077634, 'epochs': 321, 'loss': 'mse', 'optimizer': 'adam', 'graph_mode': 'off', 'use_snp_selection': False}. Best is trial 123 with value: 0.30725395164750197.
[I 2025-12-05 17:37:14,909] Trial 132 finished with value: 0.30282030007323524 and parameters: {'model_type': 'mlp', 'hidden_dims': '[512, 256]', 'dropout': 0.5614149715703711, 'batch_norm': False, 'lr': 2.3996078583234673e-06, 'weight_decay': 0.0008351243400200438, 'epochs': 338, 'loss': 'mse', 'optimizer': 'adam', 'graph_mode': 'off', 'use_snp_selection': False}. Best is trial 123 with value: 0.30725395164750197.
[I 2025-12-05 17:38:19,389] Trial 133 finished with value: 0.3016479915861171 and parameters: {'model_type': 'mlp', 'hidden_dims': '[512, 256]', 'dropout': 0.5646677811889486, 'batch_norm': False, 'lr': 2.117863252005575e-06, 'weight_decay': 0.0008799319708303862, 'epochs': 338, 'loss': 'mse', 'optimizer': 'adam', 'graph_mode': 'off', 'use_snp_selection': False}. Best is trial 123 with value: 0.30725395164750197.
[I 2025-12-05 17:39:21,384] Trial 134 finished with value: 0.30019771059666717 and parameters: {'model_type': 'mlp', 'hidden_dims': '[512, 256]', 'dropout': 0.5526548276845363, 'batch_norm': False, 'lr': 1.7038499114079334e-06, 'weight_decay': 0.0007329406282940174, 'epochs': 324, 'loss': 'mse', 'optimizer': 'adam', 'graph_mode': 'off', 'use_snp_selection': False}. Best is trial 123 with value: 0.30725395164750197.
[I 2025-12-05 17:40:27,961] Trial 135 finished with value: 0.3005462052716935 and parameters: {'model_type': 'mlp', 'hidden_dims': '[512, 256]', 'dropout': 0.5273728534424666, 'batch_norm': False, 'lr': 2.6182234479904663e-06, 'weight_decay': 0.000484520455034339, 'epochs': 350, 'loss': 'mse', 'optimizer': 'adam', 'graph_mode': 'off', 'use_snp_selection': False}. Best is trial 123 with value: 0.30725395164750197.
[I 2025-12-05 17:42:01,816] Trial 136 finished with value: 0.29401247750697335 and parameters: {'model_type': 'mlp', 'hidden_dims': '[512, 256]', 'dropout': 0.5635089483388553, 'batch_norm': False, 'lr': 1.328882279429607e-06, 'weight_decay': 2.521177052892021e-07, 'epochs': 332, 'loss': 'mse', 'optimizer': 'adam', 'graph_mode': 'off', 'use_snp_selection': True, 'num_snps': 59746}. Best is trial 123 with value: 0.30725395164750197.
[I 2025-12-05 17:43:07,085] Trial 137 finished with value: 0.30614346894565586 and parameters: {'model_type': 'mlp', 'hidden_dims': '[512, 256]', 'dropout': 0.4960185759381155, 'batch_norm': False, 'lr': 2.2586638930414304e-06, 'weight_decay': 0.0009696132964572594, 'epochs': 343, 'loss': 'mse', 'optimizer': 'adam', 'graph_mode': 'off', 'use_snp_selection': False}. Best is trial 123 with value: 0.30725395164750197.
[I 2025-12-05 17:44:12,295] Trial 138 finished with value: 0.29692247507551706 and parameters: {'model_type': 'mlp', 'hidden_dims': '[512, 256]', 'dropout': 0.4935435271970942, 'batch_norm': False, 'lr': 1.4876057583431912e-06, 'weight_decay': 0.0009941434262128138, 'epochs': 342, 'loss': 'mse', 'optimizer': 'adam', 'graph_mode': 'off', 'use_snp_selection': False}. Best is trial 123 with value: 0.30725395164750197.
[I 2025-12-05 17:45:16,330] Trial 139 finished with value: 0.3048232542547649 and parameters: {'model_type': 'mlp', 'hidden_dims': '[512, 256]', 'dropout': 0.5015358284632262, 'batch_norm': False, 'lr': 2.277077138066258e-06, 'weight_decay': 0.000816750900230022, 'epochs': 335, 'loss': 'mse', 'optimizer': 'adam', 'graph_mode': 'off', 'use_snp_selection': False}. Best is trial 123 with value: 0.30725395164750197.
[I 2025-12-05 17:46:21,719] Trial 140 finished with value: 0.29819074900382436 and parameters: {'model_type': 'mlp', 'hidden_dims': '[512, 256]', 'dropout': 0.5050346249577684, 'batch_norm': False, 'lr': 2.3249036096715585e-06, 'weight_decay': 0.0008136830651709759, 'epochs': 343, 'loss': 'mse', 'optimizer': 'adam', 'graph_mode': 'off', 'use_snp_selection': False}. Best is trial 123 with value: 0.30725395164750197.
[I 2025-12-05 17:47:25,913] Trial 141 finished with value: 0.30160395065252066 and parameters: {'model_type': 'mlp', 'hidden_dims': '[512, 256]', 'dropout': 0.4657774672378968, 'batch_norm': False, 'lr': 1.7989819536586887e-06, 'weight_decay': 0.0007160005968542032, 'epochs': 336, 'loss': 'mse', 'optimizer': 'adam', 'graph_mode': 'off', 'use_snp_selection': False}. Best is trial 123 with value: 0.30725395164750197.
[I 2025-12-05 17:48:27,424] Trial 142 finished with value: 0.3061713728669077 and parameters: {'model_type': 'mlp', 'hidden_dims': '[512, 256]', 'dropout': 0.4837274259152446, 'batch_norm': False, 'lr': 2.370247958272475e-06, 'weight_decay': 0.0009165935010204642, 'epochs': 321, 'loss': 'mse', 'optimizer': 'adam', 'graph_mode': 'off', 'use_snp_selection': False}. Best is trial 123 with value: 0.30725395164750197.
[I 2025-12-05 17:49:30,201] Trial 143 finished with value: 0.30137932022704766 and parameters: {'model_type': 'mlp', 'hidden_dims': '[512, 256]', 'dropout': 0.48114399675972896, 'batch_norm': False, 'lr': 2.1514401864741107e-06, 'weight_decay': 0.0008312759581948052, 'epochs': 328, 'loss': 'mse', 'optimizer': 'adam', 'graph_mode': 'off', 'use_snp_selection': False}. Best is trial 123 with value: 0.30725395164750197.
[I 2025-12-05 17:49:56,608] Trial 144 finished with value: 0.2927357727507648 and parameters: {'model_type': 'mlp', 'hidden_dims': '[512, 256]', 'dropout': 0.4531549488181607, 'batch_norm': False, 'lr': 2.9654213486861614e-06, 'weight_decay': 0.000984152605274719, 'epochs': 121, 'loss': 'mse', 'optimizer': 'adam', 'graph_mode': 'off', 'use_snp_selection': False}. Best is trial 123 with value: 0.30725395164750197.
[I 2025-12-05 17:50:57,899] Trial 145 finished with value: 0.30656700414531646 and parameters: {'model_type': 'mlp', 'hidden_dims': '[512, 256]', 'dropout': 0.49580017801881004, 'batch_norm': False, 'lr': 2.5895361111640323e-06, 'weight_decay': 0.0005811338874978082, 'epochs': 320, 'loss': 'mse', 'optimizer': 'adam', 'graph_mode': 'off', 'use_snp_selection': False}. Best is trial 123 with value: 0.30725395164750197.
[I 2025-12-05 17:51:59,061] Trial 146 finished with value: 0.3037975127438756 and parameters: {'model_type': 'mlp', 'hidden_dims': '[512, 256]', 'dropout': 0.49253643230837857, 'batch_norm': False, 'lr': 2.5006190388066304e-06, 'weight_decay': 0.0005470587919358735, 'epochs': 319, 'loss': 'mse', 'optimizer': 'adam', 'graph_mode': 'off', 'use_snp_selection': False}. Best is trial 123 with value: 0.30725395164750197.
[I 2025-12-05 17:53:00,056] Trial 147 finished with value: 0.2998348480214969 and parameters: {'model_type': 'mlp', 'hidden_dims': '[512, 256]', 'dropout': 0.49694222465068316, 'batch_norm': False, 'lr': 3.5842697078010675e-06, 'weight_decay': 0.000588484539514218, 'epochs': 318, 'loss': 'mse', 'optimizer': 'adam', 'graph_mode': 'off', 'use_snp_selection': False}. Best is trial 123 with value: 0.30725395164750197.
[I 2025-12-05 17:53:59,803] Trial 148 finished with value: 0.30504334557781104 and parameters: {'model_type': 'mlp', 'hidden_dims': '[512, 256]', 'dropout': 0.4683462390606202, 'batch_norm': False, 'lr': 2.6951702412784845e-06, 'weight_decay': 0.0004047677839783243, 'epochs': 311, 'loss': 'mse', 'optimizer': 'adam', 'graph_mode': 'off', 'use_snp_selection': False}. Best is trial 123 with value: 0.30725395164750197.
[I 2025-12-05 17:54:59,581] Trial 149 finished with value: 0.30594344984928434 and parameters: {'model_type': 'mlp', 'hidden_dims': '[512, 256]', 'dropout': 0.4709440607212517, 'batch_norm': False, 'lr': 1.9049294833522137e-06, 'weight_decay': 0.0003791358736302527, 'epochs': 311, 'loss': 'mse', 'optimizer': 'adam', 'graph_mode': 'off', 'use_snp_selection': False}. Best is trial 123 with value: 0.30725395164750197.
[I 2025-12-05 17:56:06,617] Trial 0 finished with value: 0.25756562921490933 and parameters: {'model_type': 'mlp', 'hidden_dims': '[128, 64]', 'dropout': 0.199031432379812, 'batch_norm': True, 'lr': 1.8408544111075837e-06, 'weight_decay': 5.5136510071208614e-05, 'epochs': 336, 'loss': 'mae', 'optimizer': 'adam', 'graph_mode': 'off', 'use_snp_selection': True, 'num_snps': 43862}. Best is trial 0 with value: 0.25756562921490933.
[I 2025-12-05 17:56:33,366] Trial 1 finished with value: 0.2869967237517613 and parameters: {'model_type': 'mlp', 'hidden_dims': '[256, 128]', 'dropout': 0.4370668075331726, 'batch_norm': True, 'lr': 7.133471581159139e-05, 'weight_decay': 1.128633586803549e-05, 'epochs': 242, 'loss': 'mae', 'optimizer': 'adam', 'graph_mode': 'off', 'use_snp_selection': False}. Best is trial 1 with value: 0.2869967237517613.
[I 2025-12-05 17:57:00,108] Trial 2 finished with value: 0.2936268944344248 and parameters: {'model_type': 'mlp', 'hidden_dims': '[256, 128, 64]', 'dropout': 0.41314357415569625, 'batch_norm': False, 'lr': 3.952233718592101e-06, 'weight_decay': 0.00026754769258252603, 'epochs': 149, 'loss': 'mse', 'optimizer': 'adam', 'graph_mode': 'off', 'use_snp_selection': True, 'num_snps': 11571}. Best is trial 2 with value: 0.2936268944344248.
[I 2025-12-05 17:58:00,775] Trial 3 finished with value: 0.29379150399108944 and parameters: {'model_type': 'mlp', 'hidden_dims': '[512, 64]', 'dropout': 0.5938127374509361, 'batch_norm': False, 'lr': 5.67704586114731e-06, 'weight_decay': 2.4518087630137052e-05, 'epochs': 320, 'loss': 'mae', 'optimizer': 'adam', 'graph_mode': 'off', 'use_snp_selection': False}. Best is trial 3 with value: 0.29379150399108944.
[I 2025-12-05 17:59:01,190] Trial 4 finished with value: 0.2871671209220378 and parameters: {'model_type': 'mlp', 'hidden_dims': '[512, 128]', 'dropout': 0.25746343592134413, 'batch_norm': True, 'lr': 1.3467657668402788e-06, 'weight_decay': 0.00033087251918647806, 'epochs': 277, 'loss': 'mse', 'optimizer': 'adam', 'graph_mode': 'off', 'use_snp_selection': True, 'num_snps': 36675}. Best is trial 3 with value: 0.29379150399108944.
[I 2025-12-05 17:59:44,115] Trial 5 finished with value: 0.24552058365655544 and parameters: {'model_type': 'mlp', 'hidden_dims': '[512, 64]', 'dropout': 0.38275350994408375, 'batch_norm': True, 'lr': 1.5586664309232824e-06, 'weight_decay': 0.0008227664668621182, 'epochs': 145, 'loss': 'mae', 'optimizer': 'adam', 'graph_mode': 'off', 'use_snp_selection': True, 'num_snps': 32148}. Best is trial 3 with value: 0.29379150399108944.
[I 2025-12-05 18:00:06,763] Trial 6 finished with value: 0.28419388366996173 and parameters: {'model_type': 'mlp', 'hidden_dims': '[256, 128]', 'dropout': 0.3930109900265879, 'batch_norm': False, 'lr': 4.892964372128395e-05, 'weight_decay': 1.5809549317992182e-06, 'epochs': 199, 'loss': 'mse', 'optimizer': 'adam', 'graph_mode': 'off', 'use_snp_selection': False}. Best is trial 3 with value: 0.29379150399108944.
[I 2025-12-05 18:00:28,999] Trial 7 finished with value: 0.29814995432124725 and parameters: {'model_type': 'mlp', 'hidden_dims': '[512, 256]', 'dropout': 0.15343979219678458, 'batch_norm': True, 'lr': 6.234003099047341e-05, 'weight_decay': 3.894760610535477e-07, 'epochs': 97, 'loss': 'mse', 'optimizer': 'adam', 'graph_mode': 'off', 'use_snp_selection': False}. Best is trial 7 with value: 0.29814995432124725.
[I 2025-12-05 18:01:28,962] Trial 8 finished with value: 0.2887653288808279 and parameters: {'model_type': 'mlp', 'hidden_dims': '[512, 128]', 'dropout': 0.10743001231661406, 'batch_norm': True, 'lr': 0.00023728538449271062, 'weight_decay': 1.7629071578048637e-05, 'epochs': 312, 'loss': 'mae', 'optimizer': 'adam', 'graph_mode': 'off', 'use_snp_selection': False}. Best is trial 7 with value: 0.29814995432124725.
[I 2025-12-05 18:02:04,897] Trial 9 finished with value: 0.29066870573560244 and parameters: {'model_type': 'mlp', 'hidden_dims': '[512, 64]', 'dropout': 0.14505336736221927, 'batch_norm': True, 'lr': 5.8619638388111826e-05, 'weight_decay': 6.200156172669308e-07, 'epochs': 175, 'loss': 'mse', 'optimizer': 'adam', 'graph_mode': 'off', 'use_snp_selection': False}. Best is trial 7 with value: 0.29814995432124725.
[I 2025-12-05 18:02:17,273] Trial 10 finished with value: 0.23870535809761587 and parameters: {'model_type': 'mlp', 'hidden_dims': '[512, 256]', 'dropout': 0.2736992815328032, 'batch_norm': False, 'lr': 0.00032393778075602147, 'weight_decay': 1.1511946696017092e-07, 'epochs': 41, 'loss': 'mse', 'optimizer': 'adam', 'graph_mode': 'off', 'use_snp_selection': False}. Best is trial 7 with value: 0.29814995432124725.
