[I 2025-12-05 15:28:51,094] Trial 51 finished with value: 0.21011148674198812 and parameters: {'model_type': 'mlp', 'hidden_dims': '[512, 64]', 'dropout': 0.4421531687682985, 'batch_norm': False, 'lr': 4.172845317750515e-06, 'weight_decay': 0.00014928380487963446, 'epochs': 220, 'loss': 'mae', 'optimizer': 'adam', 'graph_mode': 'off', 'use_snp_selection': True, 'num_snps': 57242}. Best is trial 36 with value: 0.22339838524676997.
[I 2025-12-05 15:30:34,150] Trial 52 finished with value: 0.20126433068660848 and parameters: {'model_type': 'mlp', 'hidden_dims': '[512, 64]', 'dropout': 0.3666438988645417, 'batch_norm': False, 'lr': 3.495938538686017e-06, 'weight_decay': 0.00010995571289080006, 'epochs': 222, 'loss': 'mae', 'optimizer': 'adam', 'graph_mode': 'off', 'use_snp_selection': True, 'num_snps': 55250}. Best is trial 36 with value: 0.22339838524676997.
[I 2025-12-05 15:32:15,879] Trial 53 finished with value: 0.20649107635905412 and parameters: {'model_type': 'mlp', 'hidden_dims': '[512, 64]', 'dropout': 0.40828457080609265, 'batch_norm': False, 'lr': 1.0207701636555414e-05, 'weight_decay': 0.0002923469066560145, 'epochs': 192, 'loss': 'mae', 'optimizer': 'adam', 'graph_mode': 'off', 'use_snp_selection': True, 'num_snps': 59176}. Best is trial 36 with value: 0.22339838524676997.
[I 2025-12-05 15:34:01,817] Trial 54 finished with value: 0.21067397965892068 and parameters: {'model_type': 'mlp', 'hidden_dims': '[512, 64]', 'dropout': 0.3304663026249348, 'batch_norm': False, 'lr': 4.640589157695636e-06, 'weight_decay': 0.00058662870690339, 'epochs': 246, 'loss': 'mae', 'optimizer': 'adam', 'graph_mode': 'off', 'use_snp_selection': True, 'num_snps': 52888}. Best is trial 36 with value: 0.22339838524676997.
[I 2025-12-05 15:34:30,550] Trial 55 finished with value: 0.17441610491309184 and parameters: {'model_type': 'mlp', 'hidden_dims': '[256, 128]', 'dropout': 0.3647496713391676, 'batch_norm': False, 'lr': 0.0008147919102239666, 'weight_decay': 0.0002059028614552276, 'epochs': 160, 'loss': 'mae', 'optimizer': 'adam', 'graph_mode': 'off', 'use_snp_selection': False}. Best is trial 36 with value: 0.22339838524676997.
[I 2025-12-05 15:35:40,374] Trial 56 finished with value: 0.2111693428770735 and parameters: {'model_type': 'mlp', 'hidden_dims': '[128, 64]', 'dropout': 0.521138336535879, 'batch_norm': False, 'lr': 6.497875317281783e-06, 'weight_decay': 0.00014376311806882226, 'epochs': 289, 'loss': 'mae', 'optimizer': 'adam', 'graph_mode': 'off', 'use_snp_selection': True, 'num_snps': 56897}. Best is trial 36 with value: 0.22339838524676997.
[I 2025-12-05 15:37:23,239] Trial 57 finished with value: 0.20704676843681363 and parameters: {'model_type': 'mlp', 'hidden_dims': '[512, 64]', 'dropout': 0.4844204005317565, 'batch_norm': False, 'lr': 2.423499298514926e-06, 'weight_decay': 0.00031303631527459364, 'epochs': 268, 'loss': 'mae', 'optimizer': 'adam', 'graph_mode': 'off', 'use_snp_selection': True, 'num_snps': 48152}. Best is trial 36 with value: 0.22339838524676997.
[I 2025-12-05 15:38:29,158] Trial 58 finished with value: 0.2195774809404289 and parameters: {'model_type': 'mlp', 'hidden_dims': '[512, 128]', 'dropout': 0.29803921914154013, 'batch_norm': False, 'lr': 3.023768623529518e-06, 'weight_decay': 5.463318813716247e-05, 'epochs': 208, 'loss': 'mae', 'optimizer': 'adam', 'graph_mode': 'off', 'use_snp_selection': False}. Best is trial 36 with value: 0.22339838524676997.
[I 2025-12-05 15:39:35,234] Trial 59 finished with value: 0.21712840173334627 and parameters: {'model_type': 'mlp', 'hidden_dims': '[512, 128]', 'dropout': 0.2899880446424741, 'batch_norm': False, 'lr': 1.6249127730823716e-06, 'weight_decay': 5.190324911281194e-05, 'epochs': 207, 'loss': 'mae', 'optimizer': 'adam', 'graph_mode': 'off', 'use_snp_selection': False}. Best is trial 36 with value: 0.22339838524676997.
[I 2025-12-05 15:40:56,045] Trial 60 finished with value: 0.21041575797911719 and parameters: {'model_type': 'mlp', 'hidden_dims': '[512, 128]', 'dropout': 0.2265279001964961, 'batch_norm': False, 'lr': 3.0533769887626983e-06, 'weight_decay': 3.076101165373939e-05, 'epochs': 258, 'loss': 'mae', 'optimizer': 'adam', 'graph_mode': 'off', 'use_snp_selection': False}. Best is trial 36 with value: 0.22339838524676997.
[I 2025-12-05 15:41:35,110] Trial 61 finished with value: 0.20606240264472286 and parameters: {'model_type': 'mlp', 'hidden_dims': '[256, 128, 64]', 'dropout': 0.2806487234483597, 'batch_norm': False, 'lr': 3.6795132986800847e-06, 'weight_decay': 0.00010477205455530855, 'epochs': 224, 'loss': 'mae', 'optimizer': 'adam', 'graph_mode': 'off', 'use_snp_selection': False}. Best is trial 36 with value: 0.22339838524676997.
[I 2025-12-05 15:42:43,209] Trial 62 finished with value: 0.2271013178846238 and parameters: {'model_type': 'mlp', 'hidden_dims': '[512, 128]', 'dropout': 0.31343758844773584, 'batch_norm': False, 'lr': 2.0545742388180167e-06, 'weight_decay': 6.678580824788258e-05, 'epochs': 213, 'loss': 'mae', 'optimizer': 'adam', 'graph_mode': 'off', 'use_snp_selection': False}. Best is trial 62 with value: 0.2271013178846238.
[I 2025-12-05 15:43:59,897] Trial 63 finished with value: 0.21167434581704567 and parameters: {'model_type': 'mlp', 'hidden_dims': '[512, 128]', 'dropout': 0.3141949730953512, 'batch_norm': False, 'lr': 1.3005792711541835e-06, 'weight_decay': 1.3501525660862359e-05, 'epochs': 243, 'loss': 'mae', 'optimizer': 'adam', 'graph_mode': 'off', 'use_snp_selection': False}. Best is trial 62 with value: 0.2271013178846238.
[I 2025-12-05 15:44:59,944] Trial 64 finished with value: 0.2158834251362515 and parameters: {'model_type': 'mlp', 'hidden_dims': '[512, 128]', 'dropout': 0.1654423217513007, 'batch_norm': False, 'lr': 1.985748649397451e-06, 'weight_decay': 6.430726060012895e-05, 'epochs': 184, 'loss': 'mae', 'optimizer': 'adam', 'graph_mode': 'off', 'use_snp_selection': False}. Best is trial 62 with value: 0.2271013178846238.
[I 2025-12-05 15:46:04,926] Trial 65 finished with value: 0.18876073167634294 and parameters: {'model_type': 'mlp', 'hidden_dims': '[512, 128]', 'dropout': 0.25444362679999577, 'batch_norm': False, 'lr': 1.0110731567662988e-06, 'weight_decay': 4.754245211121074e-05, 'epochs': 202, 'loss': 'mae', 'optimizer': 'adam', 'graph_mode': 'off', 'use_snp_selection': False}. Best is trial 62 with value: 0.2271013178846238.
[I 2025-12-05 15:47:18,105] Trial 66 finished with value: 0.21436232888296827 and parameters: {'model_type': 'mlp', 'hidden_dims': '[512, 128]', 'dropout': 0.3307162939928909, 'batch_norm': False, 'lr': 3.0335298544960093e-06, 'weight_decay': 8.437135973683457e-05, 'epochs': 231, 'loss': 'mae', 'optimizer': 'adam', 'graph_mode': 'off', 'use_snp_selection': False}. Best is trial 62 with value: 0.2271013178846238.
[I 2025-12-05 15:48:25,939] Trial 67 finished with value: 0.22868394823666835 and parameters: {'model_type': 'mlp', 'hidden_dims': '[512, 128]', 'dropout': 0.3600848785346611, 'batch_norm': False, 'lr': 2.344847127128921e-06, 'weight_decay': 2.569086311628394e-05, 'epochs': 212, 'loss': 'mae', 'optimizer': 'adam', 'graph_mode': 'off', 'use_snp_selection': False}. Best is trial 67 with value: 0.22868394823666835.
[I 2025-12-05 15:49:20,459] Trial 68 finished with value: 0.22088094265485067 and parameters: {'model_type': 'mlp', 'hidden_dims': '[512, 128]', 'dropout': 0.3060528587168528, 'batch_norm': False, 'lr': 2.438438375053427e-06, 'weight_decay': 2.4827959903383506e-05, 'epochs': 165, 'loss': 'mae', 'optimizer': 'adam', 'graph_mode': 'off', 'use_snp_selection': False}. Best is trial 67 with value: 0.22868394823666835.
[I 2025-12-05 15:50:04,681] Trial 69 finished with value: 0.11995641720917538 and parameters: {'model_type': 'mlp', 'hidden_dims': '[512, 128]', 'dropout': 0.3617117532909757, 'batch_norm': True, 'lr': 2.2591945840298924e-06, 'weight_decay': 6.320106943025415e-06, 'epochs': 128, 'loss': 'mae', 'optimizer': 'adam', 'graph_mode': 'off', 'use_snp_selection': False}. Best is trial 67 with value: 0.22868394823666835.
[I 2025-12-05 15:50:58,516] Trial 70 finished with value: 0.1835452693884966 and parameters: {'model_type': 'mlp', 'hidden_dims': '[512, 128]', 'dropout': 0.31412168924794953, 'batch_norm': False, 'lr': 1.5693947684095716e-06, 'weight_decay': 2.682710517281746e-05, 'epochs': 163, 'loss': 'mae', 'optimizer': 'adam', 'graph_mode': 'off', 'use_snp_selection': False}. Best is trial 67 with value: 0.22868394823666835.
[I 2025-12-05 15:52:01,472] Trial 71 finished with value: 0.2211685223245934 and parameters: {'model_type': 'mlp', 'hidden_dims': '[512, 128]', 'dropout': 0.2621088297975312, 'batch_norm': False, 'lr': 2.682045016394306e-06, 'weight_decay': 8.275719540216566e-06, 'epochs': 195, 'loss': 'mae', 'optimizer': 'adam', 'graph_mode': 'off', 'use_snp_selection': False}. Best is trial 67 with value: 0.22868394823666835.
[I 2025-12-05 15:53:03,641] Trial 72 finished with value: 0.21117730177054783 and parameters: {'model_type': 'mlp', 'hidden_dims': '[512, 128]', 'dropout': 0.2493609996212381, 'batch_norm': False, 'lr': 2.3853879728661505e-06, 'weight_decay': 7.140098181671331e-06, 'epochs': 192, 'loss': 'mae', 'optimizer': 'adam', 'graph_mode': 'off', 'use_snp_selection': False}. Best is trial 67 with value: 0.22868394823666835.
[I 2025-12-05 15:54:00,953] Trial 73 finished with value: 0.19709821613258444 and parameters: {'model_type': 'mlp', 'hidden_dims': '[512, 128]', 'dropout': 0.269467682704503, 'batch_norm': False, 'lr': 1.26747886993735e-06, 'weight_decay': 1.2157084968598906e-05, 'epochs': 175, 'loss': 'mae', 'optimizer': 'adam', 'graph_mode': 'off', 'use_snp_selection': False}. Best is trial 67 with value: 0.22868394823666835.
[I 2025-12-05 15:55:08,096] Trial 74 finished with value: 0.20889751356066064 and parameters: {'model_type': 'mlp', 'hidden_dims': '[512, 128]', 'dropout': 0.34353178866512396, 'batch_norm': False, 'lr': 4.2312117519023786e-05, 'weight_decay': 2.1644125843119723e-05, 'epochs': 214, 'loss': 'mae', 'optimizer': 'adam', 'graph_mode': 'off', 'use_snp_selection': False}. Best is trial 67 with value: 0.22868394823666835.
[I 2025-12-05 15:56:10,238] Trial 75 finished with value: 0.2148216585808278 and parameters: {'model_type': 'mlp', 'hidden_dims': '[512, 128]', 'dropout': 0.3159923038480142, 'batch_norm': False, 'lr': 1.9615055437062024e-06, 'weight_decay': 2.3477483053102764e-06, 'epochs': 192, 'loss': 'mae', 'optimizer': 'adam', 'graph_mode': 'off', 'use_snp_selection': False}. Best is trial 67 with value: 0.22868394823666835.
[I 2025-12-05 15:56:27,898] Trial 76 finished with value: 0.2187322615138893 and parameters: {'model_type': 'mlp', 'hidden_dims': '[128, 64]', 'dropout': 0.28818232599822663, 'batch_norm': False, 'lr': 5.895477210536911e-06, 'weight_decay': 3.989484068317853e-06, 'epochs': 158, 'loss': 'mae', 'optimizer': 'adam', 'graph_mode': 'off', 'use_snp_selection': False}. Best is trial 67 with value: 0.22868394823666835.
[I 2025-12-05 15:57:05,022] Trial 77 finished with value: 0.2172853108907701 and parameters: {'model_type': 'mlp', 'hidden_dims': '[256, 128]', 'dropout': 0.22188591863985296, 'batch_norm': False, 'lr': 2.585918570781693e-06, 'weight_decay': 8.704002745074045e-06, 'epochs': 212, 'loss': 'mae', 'optimizer': 'adam', 'graph_mode': 'off', 'use_snp_selection': False}. Best is trial 67 with value: 0.22868394823666835.
[I 2025-12-05 15:57:52,064] Trial 78 finished with value: 0.21015757269936083 and parameters: {'model_type': 'mlp', 'hidden_dims': '[512, 128]', 'dropout': 0.3034528357565222, 'batch_norm': False, 'lr': 1.6970562617233438e-06, 'weight_decay': 1.914926255921903e-05, 'epochs': 139, 'loss': 'mae', 'optimizer': 'adam', 'graph_mode': 'off', 'use_snp_selection': False}. Best is trial 67 with value: 0.22868394823666835.
[I 2025-12-05 15:59:25,998] Trial 79 finished with value: 0.2062274757662582 and parameters: {'model_type': 'mlp', 'hidden_dims': '[512, 128]', 'dropout': 0.23787042417297344, 'batch_norm': False, 'lr': 1.2190004952587502e-06, 'weight_decay': 3.9722102630154826e-05, 'epochs': 304, 'loss': 'mae', 'optimizer': 'adam', 'graph_mode': 'off', 'use_snp_selection': False}. Best is trial 67 with value: 0.22868394823666835.
[I 2025-12-05 16:00:21,909] Trial 80 finished with value: 0.18962136156824838 and parameters: {'model_type': 'mlp', 'hidden_dims': '[512, 128]', 'dropout': 0.26379670176281333, 'batch_norm': True, 'lr': 7.180833422300238e-06, 'weight_decay': 1.4038752715906982e-05, 'epochs': 169, 'loss': 'mae', 'optimizer': 'adam', 'graph_mode': 'off', 'use_snp_selection': False}. Best is trial 67 with value: 0.22868394823666835.
[I 2025-12-05 16:01:26,308] Trial 81 finished with value: 0.22135923040229466 and parameters: {'model_type': 'mlp', 'hidden_dims': '[512, 128]', 'dropout': 0.29094844702002665, 'batch_norm': False, 'lr': 2.83008873100796e-06, 'weight_decay': 3.217941147792595e-05, 'epochs': 200, 'loss': 'mae', 'optimizer': 'adam', 'graph_mode': 'off', 'use_snp_selection': False}. Best is trial 67 with value: 0.22868394823666835.
[I 2025-12-05 16:02:30,434] Trial 82 finished with value: 0.22977306550283125 and parameters: {'model_type': 'mlp', 'hidden_dims': '[512, 128]', 'dropout': 0.28705243979497036, 'batch_norm': False, 'lr': 2.6527096072534922e-06, 'weight_decay': 3.066972149048386e-05, 'epochs': 199, 'loss': 'mae', 'optimizer': 'adam', 'graph_mode': 'off', 'use_snp_selection': False}. Best is trial 82 with value: 0.22977306550283125.
[I 2025-12-05 16:03:05,431] Trial 83 finished with value: 0.21138333973800102 and parameters: {'model_type': 'mlp', 'hidden_dims': '[256, 128, 64]', 'dropout': 0.19210986209284167, 'batch_norm': False, 'lr': 4.238302306316329e-06, 'weight_decay': 3.379733775265248e-05, 'epochs': 196, 'loss': 'mae', 'optimizer': 'adam', 'graph_mode': 'off', 'use_snp_selection': False}. Best is trial 82 with value: 0.22977306550283125.
[I 2025-12-05 16:04:04,941] Trial 84 finished with value: 0.2080411062790779 and parameters: {'model_type': 'mlp', 'hidden_dims': '[512, 128]', 'dropout': 0.2842643716757156, 'batch_norm': False, 'lr': 1.8438520108762437e-06, 'weight_decay': 1.6605599664759737e-05, 'epochs': 183, 'loss': 'mae', 'optimizer': 'adam', 'graph_mode': 'off', 'use_snp_selection': False}. Best is trial 82 with value: 0.22977306550283125.
[I 2025-12-05 16:05:17,797] Trial 85 finished with value: 0.2116864797389178 and parameters: {'model_type': 'mlp', 'hidden_dims': '[512, 128]', 'dropout': 0.2598279053416193, 'batch_norm': False, 'lr': 1.4750524618391722e-06, 'weight_decay': 9.13765612006635e-06, 'epochs': 230, 'loss': 'mae', 'optimizer': 'adam', 'graph_mode': 'off', 'use_snp_selection': False}. Best is trial 82 with value: 0.22977306550283125.
[I 2025-12-05 16:06:21,576] Trial 86 finished with value: 0.19362531263706292 and parameters: {'model_type': 'mlp', 'hidden_dims': '[512, 64]', 'dropout': 0.5719683208775783, 'batch_norm': False, 'lr': 2.73236786615128e-06, 'weight_decay': 4.264570120248335e-05, 'epochs': 199, 'loss': 'mae', 'optimizer': 'adam', 'graph_mode': 'off', 'use_snp_selection': False}. Best is trial 82 with value: 0.22977306550283125.
[I 2025-12-05 16:06:44,970] Trial 87 finished with value: 0.20447518332474512 and parameters: {'model_type': 'mlp', 'hidden_dims': '[128, 64]', 'dropout': 0.10128088275808173, 'batch_norm': False, 'lr': 5.195932103271501e-06, 'weight_decay': 0.00012504189270897927, 'epochs': 237, 'loss': 'mse', 'optimizer': 'adam', 'graph_mode': 'off', 'use_snp_selection': False}. Best is trial 82 with value: 0.22977306550283125.
[I 2025-12-05 16:07:53,549] Trial 88 finished with value: 0.20920889326785796 and parameters: {'model_type': 'mlp', 'hidden_dims': '[512, 128]', 'dropout': 0.326483667830776, 'batch_norm': False, 'lr': 3.4158697058020537e-06, 'weight_decay': 8.913353621670364e-05, 'epochs': 215, 'loss': 'mae', 'optimizer': 'adam', 'graph_mode': 'off', 'use_snp_selection': False}. Best is trial 82 with value: 0.22977306550283125.
[I 2025-12-05 16:09:20,730] Trial 89 finished with value: 0.20709863531002326 and parameters: {'model_type': 'mlp', 'hidden_dims': '[512, 64]', 'dropout': 0.34137946372429834, 'batch_norm': False, 'lr': 3.94369915798011e-06, 'weight_decay': 7.386415589697268e-05, 'epochs': 281, 'loss': 'mae', 'optimizer': 'adam', 'graph_mode': 'off', 'use_snp_selection': False}. Best is trial 82 with value: 0.22977306550283125.
[I 2025-12-05 16:10:03,371] Trial 90 finished with value: 0.21178838221024962 and parameters: {'model_type': 'mlp', 'hidden_dims': '[256, 128]', 'dropout': 0.23923974899050127, 'batch_norm': False, 'lr': 2.0929401517309606e-06, 'weight_decay': 0.00036579656538133473, 'epochs': 250, 'loss': 'mae', 'optimizer': 'adam', 'graph_mode': 'off', 'use_snp_selection': False}. Best is trial 82 with value: 0.22977306550283125.
[I 2025-12-05 16:11:15,114] Trial 91 finished with value: 0.22377661410074162 and parameters: {'model_type': 'mlp', 'hidden_dims': '[512, 128]', 'dropout': 0.29738707110645046, 'batch_norm': False, 'lr': 1.8117895290337276e-06, 'weight_decay': 2.3414915792839545e-05, 'epochs': 226, 'loss': 'mae', 'optimizer': 'adam', 'graph_mode': 'off', 'use_snp_selection': False}. Best is trial 82 with value: 0.22977306550283125.
[I 2025-12-05 16:12:30,669] Trial 92 finished with value: 0.20021501869347605 and parameters: {'model_type': 'mlp', 'hidden_dims': '[512, 128]', 'dropout': 0.2914866543296569, 'batch_norm': False, 'lr': 1.184643879174452e-06, 'weight_decay': 1.9455862339161327e-05, 'epochs': 239, 'loss': 'mae', 'optimizer': 'adam', 'graph_mode': 'off', 'use_snp_selection': False}. Best is trial 82 with value: 0.22977306550283125.
[I 2025-12-05 16:13:41,976] Trial 93 finished with value: 0.2095594775398804 and parameters: {'model_type': 'mlp', 'hidden_dims': '[512, 128]', 'dropout': 0.276625450788752, 'batch_norm': False, 'lr': 1.5177627571062986e-06, 'weight_decay': 0.00018538413228884465, 'epochs': 224, 'loss': 'mae', 'optimizer': 'adam', 'graph_mode': 'off', 'use_snp_selection': False}. Best is trial 82 with value: 0.22977306550283125.
[I 2025-12-05 16:14:46,431] Trial 94 finished with value: 0.21697831516158597 and parameters: {'model_type': 'mlp', 'hidden_dims': '[512, 128]', 'dropout': 0.2988960317380525, 'batch_norm': False, 'lr': 1.8421726782729582e-06, 'weight_decay': 2.2215687501969557e-07, 'epochs': 200, 'loss': 'mae', 'optimizer': 'adam', 'graph_mode': 'off', 'use_snp_selection': False}. Best is trial 82 with value: 0.22977306550283125.
[I 2025-12-05 16:16:09,196] Trial 95 finished with value: 0.20727845071118148 and parameters: {'model_type': 'mlp', 'hidden_dims': '[512, 64]', 'dropout': 0.32048108398189146, 'batch_norm': False, 'lr': 2.5990756534250385e-06, 'weight_decay': 2.948214853202912e-05, 'epochs': 265, 'loss': 'mae', 'optimizer': 'adam', 'graph_mode': 'off', 'use_snp_selection': False}. Best is trial 82 with value: 0.22977306550283125.
[I 2025-12-05 16:17:20,081] Trial 96 finished with value: 0.21022016922030912 and parameters: {'model_type': 'mlp', 'hidden_dims': '[512, 256]', 'dropout': 0.355256132491621, 'batch_norm': False, 'lr': 0.0005180399004829335, 'weight_decay': 2.1340142964912612e-05, 'epochs': 229, 'loss': 'mae', 'optimizer': 'adam', 'graph_mode': 'off', 'use_snp_selection': False}. Best is trial 82 with value: 0.22977306550283125.
[I 2025-12-05 16:18:18,840] Trial 97 finished with value: 0.1901736601574585 and parameters: {'model_type': 'mlp', 'hidden_dims': '[512, 128]', 'dropout': 0.25922325800374135, 'batch_norm': False, 'lr': 9.22871244330152e-05, 'weight_decay': 3.721960310454231e-05, 'epochs': 210, 'loss': 'mae', 'optimizer': 'adam', 'graph_mode': 'off', 'use_snp_selection': True, 'num_snps': 22770}. Best is trial 82 with value: 0.22977306550283125.
[I 2025-12-05 16:19:18,038] Trial 98 finished with value: 0.17381818510555033 and parameters: {'model_type': 'mlp', 'hidden_dims': '[512, 64]', 'dropout': 0.33945756996985427, 'batch_norm': True, 'lr': 2.164603093868973e-06, 'weight_decay': 1.3074811397557044e-05, 'epochs': 183, 'loss': 'mae', 'optimizer': 'adam', 'graph_mode': 'off', 'use_snp_selection': False}. Best is trial 82 with value: 0.22977306550283125.
[I 2025-12-05 16:20:12,719] Trial 99 finished with value: 0.18783664542352413 and parameters: {'model_type': 'mlp', 'hidden_dims': '[256, 128, 64]', 'dropout': 0.38000639550092485, 'batch_norm': False, 'lr': 4.6807731070070915e-06, 'weight_decay': 1.529064153679331e-05, 'epochs': 218, 'loss': 'mse', 'optimizer': 'adam', 'graph_mode': 'off', 'use_snp_selection': True, 'num_snps': 28783}. Best is trial 82 with value: 0.22977306550283125.
[I 2025-12-05 16:21:28,648] Trial 100 finished with value: 0.21613826515182216 and parameters: {'model_type': 'mlp', 'hidden_dims': '[512, 128]', 'dropout': 0.4481194173346622, 'batch_norm': False, 'lr': 3.4292502831179736e-06, 'weight_decay': 4.6241552061197104e-05, 'epochs': 244, 'loss': 'mae', 'optimizer': 'adam', 'graph_mode': 'off', 'use_snp_selection': False}. Best is trial 82 with value: 0.22977306550283125.
[I 2025-12-05 16:22:40,224] Trial 101 finished with value: 0.21064294975004097 and parameters: {'model_type': 'mlp', 'hidden_dims': '[512, 128]', 'dropout': 0.3009088836966445, 'batch_norm': False, 'lr': 2.7455441541995005e-06, 'weight_decay': 2.611976808630394e-05, 'epochs': 226, 'loss': 'mae', 'optimizer': 'adam', 'graph_mode': 'off', 'use_snp_selection': False}. Best is trial 82 with value: 0.22977306550283125.
[I 2025-12-05 16:23:41,425] Trial 102 finished with value: 0.21206955460710347 and parameters: {'model_type': 'mlp', 'hidden_dims': '[512, 128]', 'dropout': 0.30828573640921836, 'batch_norm': False, 'lr': 2.3077774087155543e-06, 'weight_decay': 2.1936833586144977e-05, 'epochs': 189, 'loss': 'mae', 'optimizer': 'adam', 'graph_mode': 'off', 'use_snp_selection': False}. Best is trial 82 with value: 0.22977306550283125.
