[I 2025-12-05 15:28:35,134] Trial 118 finished with value: 0.09566052624531333 and parameters: {'model_type': 'mlp', 'hidden_dims': '[512, 64]', 'dropout': 0.11900021623838758, 'batch_norm': False, 'lr': 0.00027259754091615737, 'weight_decay': 1.0306392946210263e-06, 'epochs': 179, 'loss': 'mse', 'optimizer': 'adam', 'graph_mode': 'off', 'use_snp_selection': False}. Best is trial 116 with value: 0.1413608877438965.
[I 2025-12-05 15:28:37,062] Trial 119 finished with value: 0.06367261159126243 and parameters: {'model_type': 'mlp', 'hidden_dims': '[256, 128, 64]', 'dropout': 0.13424735440286506, 'batch_norm': True, 'lr': 2.317829498873686e-06, 'weight_decay': 3.6366247120907386e-07, 'epochs': 194, 'loss': 'mae', 'optimizer': 'adam', 'graph_mode': 'off', 'use_snp_selection': False}. Best is trial 116 with value: 0.1413608877438965.
[I 2025-12-05 15:28:41,891] Trial 120 finished with value: 0.09840501822102105 and parameters: {'model_type': 'mlp', 'hidden_dims': '[512, 64]', 'dropout': 0.11281911702017838, 'batch_norm': True, 'lr': 0.0003491536997770504, 'weight_decay': 1.6063411577822983e-06, 'epochs': 182, 'loss': 'mse', 'optimizer': 'adam', 'graph_mode': 'off', 'use_snp_selection': True, 'num_snps': 52293}. Best is trial 116 with value: 0.1413608877438965.
[I 2025-12-05 15:28:45,118] Trial 121 finished with value: 0.12158321284825765 and parameters: {'model_type': 'mlp', 'hidden_dims': '[512, 64]', 'dropout': 0.12373620400654889, 'batch_norm': True, 'lr': 0.00033537025275015423, 'weight_decay': 2.2506151253820072e-07, 'epochs': 208, 'loss': 'mse', 'optimizer': 'adam', 'graph_mode': 'off', 'use_snp_selection': False}. Best is trial 116 with value: 0.1413608877438965.
[I 2025-12-05 15:28:48,103] Trial 122 finished with value: 0.11943152895906721 and parameters: {'model_type': 'mlp', 'hidden_dims': '[512, 64]', 'dropout': 0.10176961276450108, 'batch_norm': True, 'lr': 0.0006141371814572767, 'weight_decay': 9.317673816618565e-07, 'epochs': 188, 'loss': 'mse', 'optimizer': 'adam', 'graph_mode': 'off', 'use_snp_selection': False}. Best is trial 116 with value: 0.1413608877438965.
[I 2025-12-05 15:28:50,287] Trial 123 finished with value: 0.12376164027149267 and parameters: {'model_type': 'mlp', 'hidden_dims': '[512, 64]', 'dropout': 0.11074999116914895, 'batch_norm': True, 'lr': 0.0004438809706879497, 'weight_decay': 1.2898915585979682e-06, 'epochs': 122, 'loss': 'mse', 'optimizer': 'adam', 'graph_mode': 'off', 'use_snp_selection': False}. Best is trial 116 with value: 0.1413608877438965.
[I 2025-12-05 15:28:53,407] Trial 124 finished with value: 0.13430991953562713 and parameters: {'model_type': 'mlp', 'hidden_dims': '[512, 64]', 'dropout': 0.14019621754170405, 'batch_norm': True, 'lr': 0.0005119469571529988, 'weight_decay': 6.604334963366177e-07, 'epochs': 202, 'loss': 'mse', 'optimizer': 'adam', 'graph_mode': 'off', 'use_snp_selection': False}. Best is trial 116 with value: 0.1413608877438965.
[I 2025-12-05 15:28:55,401] Trial 125 finished with value: 0.1397115242143268 and parameters: {'model_type': 'mlp', 'hidden_dims': '[256, 128]', 'dropout': 0.15788586670547208, 'batch_norm': True, 'lr': 0.0006921264232558155, 'weight_decay': 6.876471802177794e-07, 'epochs': 203, 'loss': 'mse', 'optimizer': 'adam', 'graph_mode': 'off', 'use_snp_selection': False}. Best is trial 116 with value: 0.1413608877438965.
[I 2025-12-05 15:28:57,378] Trial 126 finished with value: 0.117364548915572 and parameters: {'model_type': 'mlp', 'hidden_dims': '[256, 128]', 'dropout': 0.14329063652903629, 'batch_norm': True, 'lr': 0.000771246025635716, 'weight_decay': 7.388713824624757e-07, 'epochs': 202, 'loss': 'mse', 'optimizer': 'adam', 'graph_mode': 'off', 'use_snp_selection': False}. Best is trial 116 with value: 0.1413608877438965.
[I 2025-12-05 15:28:59,305] Trial 127 finished with value: 0.12500770218688917 and parameters: {'model_type': 'mlp', 'hidden_dims': '[256, 128]', 'dropout': 0.16156069040506893, 'batch_norm': True, 'lr': 0.0008915939838750695, 'weight_decay': 1.8122812172678853e-06, 'epochs': 192, 'loss': 'mae', 'optimizer': 'adam', 'graph_mode': 'off', 'use_snp_selection': False}. Best is trial 116 with value: 0.1413608877438965.
[I 2025-12-05 15:29:01,105] Trial 128 finished with value: 0.1077802201721718 and parameters: {'model_type': 'mlp', 'hidden_dims': '[256, 128]', 'dropout': 0.4632113311690019, 'batch_norm': True, 'lr': 0.00070258369122129, 'weight_decay': 2.6086761372932024e-06, 'epochs': 174, 'loss': 'mse', 'optimizer': 'adam', 'graph_mode': 'off', 'use_snp_selection': False}. Best is trial 116 with value: 0.1413608877438965.
[I 2025-12-05 15:29:03,031] Trial 129 finished with value: 0.131316271682747 and parameters: {'model_type': 'mlp', 'hidden_dims': '[256, 128]', 'dropout': 0.15482658719509382, 'batch_norm': True, 'lr': 0.0005496643056384976, 'weight_decay': 8.234211158455893e-06, 'epochs': 200, 'loss': 'mae', 'optimizer': 'adam', 'graph_mode': 'off', 'use_snp_selection': False}. Best is trial 116 with value: 0.1413608877438965.
[I 2025-12-05 15:29:05,763] Trial 130 finished with value: 0.1401986603742802 and parameters: {'model_type': 'mlp', 'hidden_dims': '[512, 64]', 'dropout': 0.12938874208797507, 'batch_norm': True, 'lr': 0.0009786674194240304, 'weight_decay': 6.879766242363426e-07, 'epochs': 168, 'loss': 'mse', 'optimizer': 'adam', 'graph_mode': 'off', 'use_snp_selection': False}. Best is trial 116 with value: 0.1413608877438965.
[I 2025-12-05 15:29:08,627] Trial 131 finished with value: 0.11081311433724106 and parameters: {'model_type': 'mlp', 'hidden_dims': '[512, 64]', 'dropout': 0.13055488783364325, 'batch_norm': True, 'lr': 0.0008539169615292675, 'weight_decay': 6.352175535210265e-07, 'epochs': 179, 'loss': 'mse', 'optimizer': 'adam', 'graph_mode': 'off', 'use_snp_selection': False}. Best is trial 116 with value: 0.1413608877438965.
[I 2025-12-05 15:29:12,352] Trial 132 finished with value: 0.10746659059812996 and parameters: {'model_type': 'mlp', 'hidden_dims': '[512, 64]', 'dropout': 0.5981894137471425, 'batch_norm': True, 'lr': 0.0009844480084616669, 'weight_decay': 4.808134162711233e-07, 'epochs': 249, 'loss': 'mse', 'optimizer': 'adam', 'graph_mode': 'off', 'use_snp_selection': False}. Best is trial 116 with value: 0.1413608877438965.
[I 2025-12-05 15:29:15,112] Trial 133 finished with value: 0.10543335717431347 and parameters: {'model_type': 'mlp', 'hidden_dims': '[512, 64]', 'dropout': 0.12064006752741638, 'batch_norm': True, 'lr': 0.0006514294970797544, 'weight_decay': 1.12512690079675e-06, 'epochs': 168, 'loss': 'mse', 'optimizer': 'adam', 'graph_mode': 'off', 'use_snp_selection': False}. Best is trial 116 with value: 0.1413608877438965.
[I 2025-12-05 15:29:15,889] Trial 134 finished with value: 0.12890306840665777 and parameters: {'model_type': 'mlp', 'hidden_dims': '[128, 64]', 'dropout': 0.13990312219940354, 'batch_norm': True, 'lr': 0.0005202891716308781, 'weight_decay': 0.0005559418151062557, 'epochs': 53, 'loss': 'mse', 'optimizer': 'adam', 'graph_mode': 'off', 'use_snp_selection': False}. Best is trial 116 with value: 0.1413608877438965.
[I 2025-12-05 15:29:18,816] Trial 135 finished with value: 0.12742249489130147 and parameters: {'model_type': 'mlp', 'hidden_dims': '[512, 64]', 'dropout': 0.12518004176313893, 'batch_norm': True, 'lr': 0.0006697336866927611, 'weight_decay': 9.028220259511097e-07, 'epochs': 185, 'loss': 'mse', 'optimizer': 'adam', 'graph_mode': 'off', 'use_snp_selection': False}. Best is trial 116 with value: 0.1413608877438965.
[I 2025-12-05 15:29:22,758] Trial 136 finished with value: 0.13506959441265187 and parameters: {'model_type': 'mlp', 'hidden_dims': '[512, 64]', 'dropout': 0.1142076868353897, 'batch_norm': True, 'lr': 2.6508161928615906e-05, 'weight_decay': 3.031744059878061e-07, 'epochs': 208, 'loss': 'mae', 'optimizer': 'adam', 'graph_mode': 'off', 'use_snp_selection': True, 'num_snps': 38490}. Best is trial 116 with value: 0.1413608877438965.
[I 2025-12-05 15:29:26,813] Trial 137 finished with value: 0.08842000024559857 and parameters: {'model_type': 'mlp', 'hidden_dims': '[512, 64]', 'dropout': 0.11545201059296228, 'batch_norm': True, 'lr': 1.9912312017810886e-05, 'weight_decay': 2.925418112755207e-07, 'epochs': 204, 'loss': 'mse', 'optimizer': 'adam', 'graph_mode': 'off', 'use_snp_selection': True, 'num_snps': 38418}. Best is trial 116 with value: 0.1413608877438965.
[I 2025-12-05 15:29:30,268] Trial 138 finished with value: 0.11507243231496656 and parameters: {'model_type': 'mlp', 'hidden_dims': '[512, 64]', 'dropout': 0.15043172755514406, 'batch_norm': True, 'lr': 4.2736614212451704e-05, 'weight_decay': 4.329132675972022e-07, 'epochs': 194, 'loss': 'mae', 'optimizer': 'adam', 'graph_mode': 'off', 'use_snp_selection': True, 'num_snps': 32026}. Best is trial 116 with value: 0.1413608877438965.
[I 2025-12-05 15:29:34,501] Trial 139 finished with value: 0.10940559995605485 and parameters: {'model_type': 'mlp', 'hidden_dims': '[512, 64]', 'dropout': 0.16890865771604524, 'batch_norm': True, 'lr': 2.4042564001863158e-05, 'weight_decay': 3.4781704487839823e-07, 'epochs': 155, 'loss': 'mse', 'optimizer': 'adam', 'graph_mode': 'off', 'use_snp_selection': True, 'num_snps': 48856}. Best is trial 116 with value: 0.1413608877438965.
[I 2025-12-05 15:29:38,722] Trial 140 finished with value: 0.1047631392149389 and parameters: {'model_type': 'mlp', 'hidden_dims': '[512, 64]', 'dropout': 0.182622401596035, 'batch_norm': False, 'lr': 2.7906750109593946e-05, 'weight_decay': 2.3945724863097324e-07, 'epochs': 209, 'loss': 'mae', 'optimizer': 'adam', 'graph_mode': 'off', 'use_snp_selection': True, 'num_snps': 42799}. Best is trial 116 with value: 0.1413608877438965.
[I 2025-12-05 15:29:44,181] Trial 141 finished with value: 0.11629493725024519 and parameters: {'model_type': 'mlp', 'hidden_dims': '[512, 64]', 'dropout': 0.1341879444464157, 'batch_norm': True, 'lr': 0.0007820108328517784, 'weight_decay': 7.351890826330825e-07, 'epochs': 219, 'loss': 'mae', 'optimizer': 'adam', 'graph_mode': 'off', 'use_snp_selection': True, 'num_snps': 55573}. Best is trial 116 with value: 0.1413608877438965.
[I 2025-12-05 15:29:46,850] Trial 142 finished with value: 0.13380352602498535 and parameters: {'model_type': 'mlp', 'hidden_dims': '[512, 64]', 'dropout': 0.26280022128183794, 'batch_norm': True, 'lr': 0.0005834911033438237, 'weight_decay': 6.25762209686312e-07, 'epochs': 161, 'loss': 'mae', 'optimizer': 'adam', 'graph_mode': 'off', 'use_snp_selection': False}. Best is trial 116 with value: 0.1413608877438965.
[I 2025-12-05 15:29:49,467] Trial 143 finished with value: 0.1062578944844975 and parameters: {'model_type': 'mlp', 'hidden_dims': '[512, 64]', 'dropout': 0.11001462366450496, 'batch_norm': True, 'lr': 3.173907873289959e-05, 'weight_decay': 5.740312215313675e-07, 'epochs': 159, 'loss': 'mae', 'optimizer': 'adam', 'graph_mode': 'off', 'use_snp_selection': False}. Best is trial 116 with value: 0.1413608877438965.
[I 2025-12-05 15:29:52,239] Trial 144 finished with value: 0.11603243009013545 and parameters: {'model_type': 'mlp', 'hidden_dims': '[512, 64]', 'dropout': 0.20491748071490867, 'batch_norm': True, 'lr': 0.0006082782630940682, 'weight_decay': 2.98616729992493e-07, 'epochs': 172, 'loss': 'mae', 'optimizer': 'adam', 'graph_mode': 'off', 'use_snp_selection': False}. Best is trial 116 with value: 0.1413608877438965.
[I 2025-12-05 15:29:54,920] Trial 145 finished with value: 0.09245601040082113 and parameters: {'model_type': 'mlp', 'hidden_dims': '[512, 64]', 'dropout': 0.12028219857513336, 'batch_norm': True, 'lr': 1.2275480147061428e-05, 'weight_decay': 4.690982773363157e-07, 'epochs': 165, 'loss': 'mae', 'optimizer': 'adam', 'graph_mode': 'off', 'use_snp_selection': False}. Best is trial 116 with value: 0.1413608877438965.
[I 2025-12-05 15:29:57,817] Trial 146 finished with value: 0.09510976717524613 and parameters: {'model_type': 'mlp', 'hidden_dims': '[512, 64]', 'dropout': 0.2429067925605516, 'batch_norm': True, 'lr': 0.0005111000417515722, 'weight_decay': 1.863850568558732e-07, 'epochs': 187, 'loss': 'mse', 'optimizer': 'adam', 'graph_mode': 'off', 'use_snp_selection': True, 'num_snps': 25475}. Best is trial 116 with value: 0.1413608877438965.
[I 2025-12-05 15:30:00,694] Trial 147 finished with value: 0.11736433812526584 and parameters: {'model_type': 'mlp', 'hidden_dims': '[512, 64]', 'dropout': 0.2649135014315621, 'batch_norm': True, 'lr': 6.412682275578268e-05, 'weight_decay': 3.915830822068649e-07, 'epochs': 177, 'loss': 'mae', 'optimizer': 'adam', 'graph_mode': 'off', 'use_snp_selection': False}. Best is trial 116 with value: 0.1413608877438965.
[I 2025-12-05 15:30:03,805] Trial 148 finished with value: 0.11751833734893515 and parameters: {'model_type': 'mlp', 'hidden_dims': '[512, 64]', 'dropout': 0.2278721992623598, 'batch_norm': True, 'lr': 0.0009844714097142317, 'weight_decay': 6.773569047086477e-07, 'epochs': 196, 'loss': 'mse', 'optimizer': 'adam', 'graph_mode': 'off', 'use_snp_selection': False}. Best is trial 116 with value: 0.1413608877438965.
[I 2025-12-05 15:30:07,085] Trial 149 finished with value: 0.13336395052556016 and parameters: {'model_type': 'mlp', 'hidden_dims': '[512, 64]', 'dropout': 0.1001978439938779, 'batch_norm': True, 'lr': 0.0007348002526630394, 'weight_decay': 5.382173744567906e-07, 'epochs': 213, 'loss': 'mae', 'optimizer': 'adam', 'graph_mode': 'off', 'use_snp_selection': False}. Best is trial 116 with value: 0.1413608877438965.
[I 2025-12-05 15:30:09,499] Trial 0 finished with value: 0.04031726034250805 and parameters: {'model_type': 'mlp', 'hidden_dims': '[128, 64]', 'dropout': 0.199031432379812, 'batch_norm': True, 'lr': 1.8408544111075837e-06, 'weight_decay': 5.5136510071208614e-05, 'epochs': 336, 'loss': 'mae', 'optimizer': 'adam', 'graph_mode': 'off', 'use_snp_selection': True, 'num_snps': 43862}. Best is trial 0 with value: 0.04031726034250805.
[I 2025-12-05 15:30:10,774] Trial 1 finished with value: 0.06495948724829732 and parameters: {'model_type': 'mlp', 'hidden_dims': '[256, 128]', 'dropout': 0.4370668075331726, 'batch_norm': True, 'lr': 7.133471581159139e-05, 'weight_decay': 1.128633586803549e-05, 'epochs': 242, 'loss': 'mae', 'optimizer': 'adam', 'graph_mode': 'off', 'use_snp_selection': False}. Best is trial 1 with value: 0.06495948724829732.
[I 2025-12-05 15:30:11,982] Trial 2 finished with value: 0.07031771717938408 and parameters: {'model_type': 'mlp', 'hidden_dims': '[256, 128, 64]', 'dropout': 0.41314357415569625, 'batch_norm': False, 'lr': 3.952233718592101e-06, 'weight_decay': 0.00026754769258252603, 'epochs': 149, 'loss': 'mse', 'optimizer': 'adam', 'graph_mode': 'off', 'use_snp_selection': True, 'num_snps': 11571}. Best is trial 2 with value: 0.07031771717938408.
[I 2025-12-05 15:30:14,538] Trial 3 finished with value: 0.0529576557048861 and parameters: {'model_type': 'mlp', 'hidden_dims': '[512, 64]', 'dropout': 0.5938127374509361, 'batch_norm': False, 'lr': 5.67704586114731e-06, 'weight_decay': 2.4518087630137052e-05, 'epochs': 320, 'loss': 'mae', 'optimizer': 'adam', 'graph_mode': 'off', 'use_snp_selection': False}. Best is trial 2 with value: 0.07031771717938408.
[I 2025-12-05 15:30:17,232] Trial 4 finished with value: 0.033853575355884055 and parameters: {'model_type': 'mlp', 'hidden_dims': '[512, 128]', 'dropout': 0.25746343592134413, 'batch_norm': True, 'lr': 1.3467657668402788e-06, 'weight_decay': 0.00033087251918647806, 'epochs': 277, 'loss': 'mse', 'optimizer': 'adam', 'graph_mode': 'off', 'use_snp_selection': True, 'num_snps': 36675}. Best is trial 2 with value: 0.07031771717938408.
[I 2025-12-05 15:30:19,386] Trial 5 finished with value: 0.04183952029416999 and parameters: {'model_type': 'mlp', 'hidden_dims': '[512, 64]', 'dropout': 0.38275350994408375, 'batch_norm': True, 'lr': 1.5586664309232824e-06, 'weight_decay': 0.0008227664668621182, 'epochs': 145, 'loss': 'mae', 'optimizer': 'adam', 'graph_mode': 'off', 'use_snp_selection': True, 'num_snps': 32148}. Best is trial 2 with value: 0.07031771717938408.
[I 2025-12-05 15:30:20,596] Trial 6 finished with value: 0.05298078252676072 and parameters: {'model_type': 'mlp', 'hidden_dims': '[256, 128]', 'dropout': 0.3930109900265879, 'batch_norm': False, 'lr': 4.892964372128395e-05, 'weight_decay': 1.5809549317992182e-06, 'epochs': 199, 'loss': 'mse', 'optimizer': 'adam', 'graph_mode': 'off', 'use_snp_selection': False}. Best is trial 2 with value: 0.07031771717938408.
[I 2025-12-05 15:30:21,935] Trial 7 finished with value: 0.10406888958612082 and parameters: {'model_type': 'mlp', 'hidden_dims': '[512, 256]', 'dropout': 0.15343979219678458, 'batch_norm': True, 'lr': 6.234003099047341e-05, 'weight_decay': 3.894760610535477e-07, 'epochs': 97, 'loss': 'mse', 'optimizer': 'adam', 'graph_mode': 'off', 'use_snp_selection': False}. Best is trial 7 with value: 0.10406888958612082.
[I 2025-12-05 15:30:24,479] Trial 8 finished with value: 0.08993713541506763 and parameters: {'model_type': 'mlp', 'hidden_dims': '[512, 128]', 'dropout': 0.10743001231661406, 'batch_norm': True, 'lr': 0.00023728538449271062, 'weight_decay': 1.7629071578048637e-05, 'epochs': 312, 'loss': 'mae', 'optimizer': 'adam', 'graph_mode': 'off', 'use_snp_selection': False}. Best is trial 7 with value: 0.10406888958612082.
[I 2025-12-05 15:30:26,240] Trial 9 finished with value: 0.07484848686727259 and parameters: {'model_type': 'mlp', 'hidden_dims': '[512, 64]', 'dropout': 0.14505336736221927, 'batch_norm': True, 'lr': 5.8619638388111826e-05, 'weight_decay': 6.200156172669308e-07, 'epochs': 175, 'loss': 'mse', 'optimizer': 'adam', 'graph_mode': 'off', 'use_snp_selection': False}. Best is trial 7 with value: 0.10406888958612082.
[I 2025-12-05 15:30:27,227] Trial 10 finished with value: -0.02127381396381544 and parameters: {'model_type': 'mlp', 'hidden_dims': '[512, 256]', 'dropout': 0.2736992815328032, 'batch_norm': False, 'lr': 0.00032393778075602147, 'weight_decay': 1.1511946696017092e-07, 'epochs': 41, 'loss': 'mse', 'optimizer': 'adam', 'graph_mode': 'off', 'use_snp_selection': False}. Best is trial 7 with value: 0.10406888958612082.
[I 2025-12-05 15:30:28,375] Trial 11 finished with value: 0.09841543687529039 and parameters: {'model_type': 'mlp', 'hidden_dims': '[512, 128]', 'dropout': 0.10095648685224448, 'batch_norm': True, 'lr': 0.0007666984023899753, 'weight_decay': 2.512571353186099e-06, 'epochs': 70, 'loss': 'mae', 'optimizer': 'adam', 'graph_mode': 'off', 'use_snp_selection': False}. Best is trial 7 with value: 0.10406888958612082.
[I 2025-12-05 15:30:29,516] Trial 12 finished with value: 0.053264308504159245 and parameters: {'model_type': 'mlp', 'hidden_dims': '[512, 256]', 'dropout': 0.10344600881777158, 'batch_norm': True, 'lr': 0.0006753264773209732, 'weight_decay': 1.2006458821839938e-06, 'epochs': 63, 'loss': 'mae', 'optimizer': 'adam', 'graph_mode': 'off', 'use_snp_selection': False}. Best is trial 7 with value: 0.10406888958612082.
[I 2025-12-05 15:30:30,792] Trial 13 finished with value: 0.004620624922827738 and parameters: {'model_type': 'mlp', 'hidden_dims': '[512, 256]', 'dropout': 0.206733630507397, 'batch_norm': True, 'lr': 1.3373175420781734e-05, 'weight_decay': 1.8965593394883618e-07, 'epochs': 92, 'loss': 'mse', 'optimizer': 'adam', 'graph_mode': 'off', 'use_snp_selection': False}. Best is trial 7 with value: 0.10406888958612082.
[I 2025-12-05 15:30:32,180] Trial 14 finished with value: 0.06537932658376211 and parameters: {'model_type': 'mlp', 'hidden_dims': '[512, 128]', 'dropout': 0.3012984444538551, 'batch_norm': True, 'lr': 0.0009000048932733863, 'weight_decay': 3.2568808920327207e-06, 'epochs': 110, 'loss': 'mae', 'optimizer': 'adam', 'graph_mode': 'off', 'use_snp_selection': False}. Best is trial 7 with value: 0.10406888958612082.
[I 2025-12-05 15:30:32,942] Trial 15 finished with value: 0.08900623640389468 and parameters: {'model_type': 'mlp', 'hidden_dims': '[128, 64]', 'dropout': 0.18406139084679396, 'batch_norm': True, 'lr': 0.0001572871022003765, 'weight_decay': 3.717609129469701e-07, 'epochs': 100, 'loss': 'mse', 'optimizer': 'adam', 'graph_mode': 'off', 'use_snp_selection': False}. Best is trial 7 with value: 0.10406888958612082.
[I 2025-12-05 15:30:33,773] Trial 16 finished with value: 0.02078555759583574 and parameters: {'model_type': 'mlp', 'hidden_dims': '[256, 128, 64]', 'dropout': 0.558513902174278, 'batch_norm': True, 'lr': 2.1517090787442848e-05, 'weight_decay': 5.098763140321504e-06, 'epochs': 69, 'loss': 'mae', 'optimizer': 'adam', 'graph_mode': 'off', 'use_snp_selection': False}. Best is trial 7 with value: 0.10406888958612082.
[I 2025-12-05 15:30:35,225] Trial 17 finished with value: 0.08365909417581424 and parameters: {'model_type': 'mlp', 'hidden_dims': '[512, 128]', 'dropout': 0.15847318111315195, 'batch_norm': True, 'lr': 0.00011620307138345767, 'weight_decay': 4.7456925405414646e-07, 'epochs': 124, 'loss': 'mse', 'optimizer': 'adam', 'graph_mode': 'off', 'use_snp_selection': False}. Best is trial 7 with value: 0.10406888958612082.
[I 2025-12-05 15:30:39,029] Trial 18 finished with value: 0.07223394759268448 and parameters: {'model_type': 'mlp', 'hidden_dims': '[512, 256]', 'dropout': 0.5005423020298181, 'batch_norm': False, 'lr': 0.0004833669444396415, 'weight_decay': 2.627558449918227e-06, 'epochs': 210, 'loss': 'mae', 'optimizer': 'adam', 'graph_mode': 'off', 'use_snp_selection': True, 'num_snps': 58241}. Best is trial 7 with value: 0.10406888958612082.
[I 2025-12-05 15:30:40,089] Trial 19 finished with value: 0.04886013554051241 and parameters: {'model_type': 'mlp', 'hidden_dims': '[512, 128]', 'dropout': 0.31692091263899563, 'batch_norm': True, 'lr': 1.352570837276448e-05, 'weight_decay': 6.12239461682469e-05, 'epochs': 46, 'loss': 'mse', 'optimizer': 'adam', 'graph_mode': 'off', 'use_snp_selection': False}. Best is trial 7 with value: 0.10406888958612082.
