[I 2025-12-05 16:32:39,281] Trial 124 finished with value: 0.04019896099331186 and parameters: {'model_type': 'mlp', 'hidden_dims': '[512, 256]', 'dropout': 0.15543272185430437, 'batch_norm': False, 'lr': 6.789383543248093e-05, 'weight_decay': 3.769130976635174e-07, 'epochs': 84, 'loss': 'mse', 'optimizer': 'adam', 'graph_mode': 'off', 'use_snp_selection': False}. Best is trial 97 with value: 0.08735465824458159.
[I 2025-12-05 16:32:40,309] Trial 125 finished with value: 0.07081312678932901 and parameters: {'model_type': 'mlp', 'hidden_dims': '[512, 256]', 'dropout': 0.12368761793668084, 'batch_norm': False, 'lr': 0.0001687847918680639, 'weight_decay': 6.95417636267036e-07, 'epochs': 98, 'loss': 'mse', 'optimizer': 'adam', 'graph_mode': 'off', 'use_snp_selection': False}. Best is trial 97 with value: 0.08735465824458159.
[I 2025-12-05 16:32:41,247] Trial 126 finished with value: 0.013460679340873681 and parameters: {'model_type': 'mlp', 'hidden_dims': '[512, 256]', 'dropout': 0.13216748162114303, 'batch_norm': False, 'lr': 0.0003464647069402998, 'weight_decay': 1.3894988682009856e-06, 'epochs': 65, 'loss': 'mse', 'optimizer': 'adam', 'graph_mode': 'off', 'use_snp_selection': False}. Best is trial 97 with value: 0.08735465824458159.
[I 2025-12-05 16:32:42,010] Trial 127 finished with value: 0.04929788486055277 and parameters: {'model_type': 'mlp', 'hidden_dims': '[256, 128, 64]', 'dropout': 0.12435918796811687, 'batch_norm': False, 'lr': 0.00015417978260558155, 'weight_decay': 6.477072996401344e-07, 'epochs': 98, 'loss': 'mse', 'optimizer': 'adam', 'graph_mode': 'off', 'use_snp_selection': False}. Best is trial 97 with value: 0.08735465824458159.
[I 2025-12-05 16:32:43,785] Trial 128 finished with value: 0.04911563360121671 and parameters: {'model_type': 'mlp', 'hidden_dims': '[512, 256]', 'dropout': 0.19959492515813, 'batch_norm': False, 'lr': 0.00011326841269942325, 'weight_decay': 1.1355689000891674e-06, 'epochs': 314, 'loss': 'mse', 'optimizer': 'adam', 'graph_mode': 'off', 'use_snp_selection': False}. Best is trial 97 with value: 0.08735465824458159.
[I 2025-12-05 16:32:44,851] Trial 129 finished with value: 0.06416468781730814 and parameters: {'model_type': 'mlp', 'hidden_dims': '[512, 256]', 'dropout': 0.1472895086634859, 'batch_norm': False, 'lr': 9.40547271316836e-05, 'weight_decay': 2.9732032778741817e-05, 'epochs': 110, 'loss': 'mse', 'optimizer': 'adam', 'graph_mode': 'off', 'use_snp_selection': False}. Best is trial 97 with value: 0.08735465824458159.
[I 2025-12-05 16:32:45,939] Trial 130 finished with value: 0.05899546045794298 and parameters: {'model_type': 'mlp', 'hidden_dims': '[512, 256]', 'dropout': 0.14309910741245005, 'batch_norm': False, 'lr': 8.950926518099131e-05, 'weight_decay': 2.9716897587185182e-05, 'epochs': 109, 'loss': 'mse', 'optimizer': 'adam', 'graph_mode': 'off', 'use_snp_selection': False}. Best is trial 97 with value: 0.08735465824458159.
[I 2025-12-05 16:32:46,896] Trial 131 finished with value: 0.021075958671983017 and parameters: {'model_type': 'mlp', 'hidden_dims': '[512, 256]', 'dropout': 0.17082664143342077, 'batch_norm': False, 'lr': 5.472291253867301e-05, 'weight_decay': 1.477014569051367e-05, 'epochs': 78, 'loss': 'mse', 'optimizer': 'adam', 'graph_mode': 'off', 'use_snp_selection': False}. Best is trial 97 with value: 0.08735465824458159.
[I 2025-12-05 16:32:47,986] Trial 132 finished with value: 0.04559782882766893 and parameters: {'model_type': 'mlp', 'hidden_dims': '[512, 256]', 'dropout': 0.158989721922755, 'batch_norm': False, 'lr': 0.00017661808583554068, 'weight_decay': 3.989060236973789e-05, 'epochs': 117, 'loss': 'mse', 'optimizer': 'adam', 'graph_mode': 'off', 'use_snp_selection': False}. Best is trial 97 with value: 0.08735465824458159.
[I 2025-12-05 16:32:48,995] Trial 133 finished with value: 0.04466569480838048 and parameters: {'model_type': 'mlp', 'hidden_dims': '[512, 256]', 'dropout': 0.12483062749806416, 'batch_norm': False, 'lr': 7.295429819450664e-05, 'weight_decay': 2.477978320958229e-05, 'epochs': 89, 'loss': 'mse', 'optimizer': 'adam', 'graph_mode': 'off', 'use_snp_selection': False}. Best is trial 97 with value: 0.08735465824458159.
[I 2025-12-05 16:32:50,099] Trial 134 finished with value: 0.020346000818692526 and parameters: {'model_type': 'mlp', 'hidden_dims': '[512, 128]', 'dropout': 0.4078830253484844, 'batch_norm': False, 'lr': 0.0007728171504261001, 'weight_decay': 7.20578835166916e-07, 'epochs': 122, 'loss': 'mse', 'optimizer': 'adam', 'graph_mode': 'off', 'use_snp_selection': False}. Best is trial 97 with value: 0.08735465824458159.
[I 2025-12-05 16:32:51,165] Trial 135 finished with value: 0.06629220314563404 and parameters: {'model_type': 'mlp', 'hidden_dims': '[512, 256]', 'dropout': 0.18463769216358192, 'batch_norm': False, 'lr': 8.710630706792461e-05, 'weight_decay': 4.7315099200362935e-07, 'epochs': 107, 'loss': 'mse', 'optimizer': 'adam', 'graph_mode': 'off', 'use_snp_selection': False}. Best is trial 97 with value: 0.08735465824458159.
[I 2025-12-05 16:32:52,213] Trial 136 finished with value: 0.024052201126450363 and parameters: {'model_type': 'mlp', 'hidden_dims': '[512, 256]', 'dropout': 0.13850075910438023, 'batch_norm': False, 'lr': 0.0001290829600154501, 'weight_decay': 8.560885869424892e-07, 'epochs': 105, 'loss': 'mse', 'optimizer': 'adam', 'graph_mode': 'off', 'use_snp_selection': False}. Best is trial 97 with value: 0.08735465824458159.
[I 2025-12-05 16:32:53,239] Trial 137 finished with value: 0.06338559762164346 and parameters: {'model_type': 'mlp', 'hidden_dims': '[512, 256]', 'dropout': 0.10873169702408607, 'batch_norm': False, 'lr': 0.00010578444055979248, 'weight_decay': 4.788809671263543e-07, 'epochs': 97, 'loss': 'mse', 'optimizer': 'adam', 'graph_mode': 'off', 'use_snp_selection': False}. Best is trial 97 with value: 0.08735465824458159.
[I 2025-12-05 16:32:54,253] Trial 138 finished with value: 0.040200160258460675 and parameters: {'model_type': 'mlp', 'hidden_dims': '[512, 256]', 'dropout': 0.10353590845772745, 'batch_norm': False, 'lr': 1.7806195207468007e-05, 'weight_decay': 4.821783904614501e-07, 'epochs': 95, 'loss': 'mse', 'optimizer': 'adam', 'graph_mode': 'off', 'use_snp_selection': False}. Best is trial 97 with value: 0.08735465824458159.
[I 2025-12-05 16:32:55,351] Trial 139 finished with value: 0.039036735323230695 and parameters: {'model_type': 'mlp', 'hidden_dims': '[512, 256]', 'dropout': 0.11539213992295841, 'batch_norm': False, 'lr': 0.0002114642194641739, 'weight_decay': 4.458742840324141e-07, 'epochs': 114, 'loss': 'mse', 'optimizer': 'adam', 'graph_mode': 'off', 'use_snp_selection': False}. Best is trial 97 with value: 0.08735465824458159.
[I 2025-12-05 16:32:56,132] Trial 140 finished with value: 0.04383460573512325 and parameters: {'model_type': 'mlp', 'hidden_dims': '[256, 128]', 'dropout': 0.1491851193251968, 'batch_norm': False, 'lr': 8.193509669824985e-05, 'weight_decay': 9.893563652519705e-07, 'epochs': 107, 'loss': 'mse', 'optimizer': 'adam', 'graph_mode': 'off', 'use_snp_selection': False}. Best is trial 97 with value: 0.08735465824458159.
[I 2025-12-05 16:32:57,159] Trial 141 finished with value: 0.02837932510634611 and parameters: {'model_type': 'mlp', 'hidden_dims': '[512, 256]', 'dropout': 0.18501570732559686, 'batch_norm': False, 'lr': 0.00010487165301828526, 'weight_decay': 6.206989783596748e-07, 'epochs': 98, 'loss': 'mse', 'optimizer': 'adam', 'graph_mode': 'off', 'use_snp_selection': False}. Best is trial 97 with value: 0.08735465824458159.
[I 2025-12-05 16:32:58,102] Trial 142 finished with value: 0.04675941755662339 and parameters: {'model_type': 'mlp', 'hidden_dims': '[512, 256]', 'dropout': 0.10048332380905659, 'batch_norm': False, 'lr': 9.15442950381193e-05, 'weight_decay': 7.116555046798618e-07, 'epochs': 74, 'loss': 'mse', 'optimizer': 'adam', 'graph_mode': 'off', 'use_snp_selection': False}. Best is trial 97 with value: 0.08735465824458159.
[I 2025-12-05 16:32:59,101] Trial 143 finished with value: 0.050487989206622265 and parameters: {'model_type': 'mlp', 'hidden_dims': '[512, 256]', 'dropout': 0.1257611263928277, 'batch_norm': False, 'lr': 6.940183476389639e-05, 'weight_decay': 1.898783996892157e-05, 'epochs': 91, 'loss': 'mse', 'optimizer': 'adam', 'graph_mode': 'off', 'use_snp_selection': False}. Best is trial 97 with value: 0.08735465824458159.
[I 2025-12-05 16:33:00,140] Trial 144 finished with value: 0.04298947838355732 and parameters: {'model_type': 'mlp', 'hidden_dims': '[512, 256]', 'dropout': 0.20917661627831163, 'batch_norm': False, 'lr': 0.00010429519570720286, 'weight_decay': 3.67703697402877e-07, 'epochs': 101, 'loss': 'mse', 'optimizer': 'adam', 'graph_mode': 'off', 'use_snp_selection': False}. Best is trial 97 with value: 0.08735465824458159.
[I 2025-12-05 16:33:01,134] Trial 145 finished with value: 0.053660796672762884 and parameters: {'model_type': 'mlp', 'hidden_dims': '[512, 256]', 'dropout': 0.16745465801043413, 'batch_norm': False, 'lr': 6.121753461602908e-05, 'weight_decay': 5.155038395703463e-07, 'epochs': 85, 'loss': 'mse', 'optimizer': 'adam', 'graph_mode': 'off', 'use_snp_selection': False}. Best is trial 97 with value: 0.08735465824458159.
[I 2025-12-05 16:33:02,850] Trial 146 finished with value: 0.061888022982815115 and parameters: {'model_type': 'mlp', 'hidden_dims': '[512, 256]', 'dropout': 0.13758241848516367, 'batch_norm': False, 'lr': 4.690562431519685e-05, 'weight_decay': 3.758671845489819e-05, 'epochs': 298, 'loss': 'mse', 'optimizer': 'adam', 'graph_mode': 'off', 'use_snp_selection': False}. Best is trial 97 with value: 0.08735465824458159.
[I 2025-12-05 16:33:03,925] Trial 147 finished with value: 0.03382987698883079 and parameters: {'model_type': 'mlp', 'hidden_dims': '[512, 256]', 'dropout': 0.15239995770816026, 'batch_norm': False, 'lr': 0.0002765793759034122, 'weight_decay': 5.123684810672372e-05, 'epochs': 112, 'loss': 'mse', 'optimizer': 'adam', 'graph_mode': 'off', 'use_snp_selection': False}. Best is trial 97 with value: 0.08735465824458159.
[I 2025-12-05 16:33:04,843] Trial 148 finished with value: 0.015574229201052416 and parameters: {'model_type': 'mlp', 'hidden_dims': '[512, 256]', 'dropout': 0.11228002204342026, 'batch_norm': False, 'lr': 8.082543032492737e-05, 'weight_decay': 2.385444930265615e-07, 'epochs': 68, 'loss': 'mse', 'optimizer': 'adam', 'graph_mode': 'off', 'use_snp_selection': False}. Best is trial 97 with value: 0.08735465824458159.
[I 2025-12-05 16:33:05,993] Trial 149 finished with value: 0.0548707428671048 and parameters: {'model_type': 'mlp', 'hidden_dims': '[512, 64]', 'dropout': 0.19446732088403085, 'batch_norm': False, 'lr': 0.00016696290830945358, 'weight_decay': 3.202447297749649e-07, 'epochs': 131, 'loss': 'mse', 'optimizer': 'adam', 'graph_mode': 'off', 'use_snp_selection': False}. Best is trial 97 with value: 0.08735465824458159.
[I 2025-12-05 16:33:08,111] Trial 0 finished with value: 0.05992447031740181 and parameters: {'model_type': 'mlp', 'hidden_dims': '[128, 64]', 'dropout': 0.199031432379812, 'batch_norm': True, 'lr': 1.8408544111075837e-06, 'weight_decay': 5.5136510071208614e-05, 'epochs': 336, 'loss': 'mae', 'optimizer': 'adam', 'graph_mode': 'off', 'use_snp_selection': True, 'num_snps': 43862}. Best is trial 0 with value: 0.05992447031740181.
[I 2025-12-05 16:33:09,116] Trial 1 finished with value: 0.10943592282927277 and parameters: {'model_type': 'mlp', 'hidden_dims': '[256, 128]', 'dropout': 0.4370668075331726, 'batch_norm': True, 'lr': 7.133471581159139e-05, 'weight_decay': 1.128633586803549e-05, 'epochs': 242, 'loss': 'mae', 'optimizer': 'adam', 'graph_mode': 'off', 'use_snp_selection': False}. Best is trial 1 with value: 0.10943592282927277.
[I 2025-12-05 16:33:10,056] Trial 2 finished with value: 0.031198830302657663 and parameters: {'model_type': 'mlp', 'hidden_dims': '[256, 128, 64]', 'dropout': 0.41314357415569625, 'batch_norm': False, 'lr': 3.952233718592101e-06, 'weight_decay': 0.00026754769258252603, 'epochs': 149, 'loss': 'mse', 'optimizer': 'adam', 'graph_mode': 'off', 'use_snp_selection': True, 'num_snps': 11571}. Best is trial 1 with value: 0.10943592282927277.
[I 2025-12-05 16:33:11,732] Trial 3 finished with value: 0.04874556033315616 and parameters: {'model_type': 'mlp', 'hidden_dims': '[512, 64]', 'dropout': 0.5938127374509361, 'batch_norm': False, 'lr': 5.67704586114731e-06, 'weight_decay': 2.4518087630137052e-05, 'epochs': 320, 'loss': 'mae', 'optimizer': 'adam', 'graph_mode': 'off', 'use_snp_selection': False}. Best is trial 1 with value: 0.10943592282927277.
[I 2025-12-05 16:33:13,801] Trial 4 finished with value: -0.002088129059225483 and parameters: {'model_type': 'mlp', 'hidden_dims': '[512, 128]', 'dropout': 0.25746343592134413, 'batch_norm': True, 'lr': 1.3467657668402788e-06, 'weight_decay': 0.00033087251918647806, 'epochs': 277, 'loss': 'mse', 'optimizer': 'adam', 'graph_mode': 'off', 'use_snp_selection': True, 'num_snps': 36675}. Best is trial 1 with value: 0.10943592282927277.
[I 2025-12-05 16:33:15,410] Trial 5 finished with value: 0.025130299017078077 and parameters: {'model_type': 'mlp', 'hidden_dims': '[512, 64]', 'dropout': 0.38275350994408375, 'batch_norm': True, 'lr': 1.5586664309232824e-06, 'weight_decay': 0.0008227664668621182, 'epochs': 145, 'loss': 'mae', 'optimizer': 'adam', 'graph_mode': 'off', 'use_snp_selection': True, 'num_snps': 32148}. Best is trial 1 with value: 0.10943592282927277.
[I 2025-12-05 16:33:16,335] Trial 6 finished with value: 0.07477260239693356 and parameters: {'model_type': 'mlp', 'hidden_dims': '[256, 128]', 'dropout': 0.3930109900265879, 'batch_norm': False, 'lr': 4.892964372128395e-05, 'weight_decay': 1.5809549317992182e-06, 'epochs': 199, 'loss': 'mse', 'optimizer': 'adam', 'graph_mode': 'off', 'use_snp_selection': False}. Best is trial 1 with value: 0.10943592282927277.
[I 2025-12-05 16:33:17,315] Trial 7 finished with value: 0.10042986832709261 and parameters: {'model_type': 'mlp', 'hidden_dims': '[512, 256]', 'dropout': 0.15343979219678458, 'batch_norm': True, 'lr': 6.234003099047341e-05, 'weight_decay': 3.894760610535477e-07, 'epochs': 97, 'loss': 'mse', 'optimizer': 'adam', 'graph_mode': 'off', 'use_snp_selection': False}. Best is trial 1 with value: 0.10943592282927277.
[I 2025-12-05 16:33:18,979] Trial 8 finished with value: 0.11483888533968921 and parameters: {'model_type': 'mlp', 'hidden_dims': '[512, 128]', 'dropout': 0.10743001231661406, 'batch_norm': True, 'lr': 0.00023728538449271062, 'weight_decay': 1.7629071578048637e-05, 'epochs': 312, 'loss': 'mae', 'optimizer': 'adam', 'graph_mode': 'off', 'use_snp_selection': False}. Best is trial 8 with value: 0.11483888533968921.
[I 2025-12-05 16:33:20,222] Trial 9 finished with value: 0.10733695200593285 and parameters: {'model_type': 'mlp', 'hidden_dims': '[512, 64]', 'dropout': 0.14505336736221927, 'batch_norm': True, 'lr': 5.8619638388111826e-05, 'weight_decay': 6.200156172669308e-07, 'epochs': 175, 'loss': 'mse', 'optimizer': 'adam', 'graph_mode': 'off', 'use_snp_selection': False}. Best is trial 8 with value: 0.11483888533968921.
[I 2025-12-05 16:33:21,070] Trial 10 finished with value: -0.02762426138920538 and parameters: {'model_type': 'mlp', 'hidden_dims': '[512, 128]', 'dropout': 0.2800030442581858, 'batch_norm': False, 'lr': 0.0004919806695968258, 'weight_decay': 2.9953888095455486e-06, 'epochs': 55, 'loss': 'mae', 'optimizer': 'adam', 'graph_mode': 'off', 'use_snp_selection': False}. Best is trial 8 with value: 0.11483888533968921.
[I 2025-12-05 16:33:22,048] Trial 11 finished with value: 0.10315562835930418 and parameters: {'model_type': 'mlp', 'hidden_dims': '[256, 128]', 'dropout': 0.5025533409127559, 'batch_norm': True, 'lr': 0.0004219456914890788, 'weight_decay': 7.0869802591332905e-06, 'epochs': 239, 'loss': 'mae', 'optimizer': 'adam', 'graph_mode': 'off', 'use_snp_selection': False}. Best is trial 8 with value: 0.11483888533968921.
[I 2025-12-05 16:33:23,585] Trial 12 finished with value: 0.09930877985303439 and parameters: {'model_type': 'mlp', 'hidden_dims': '[512, 128]', 'dropout': 0.4779690972965961, 'batch_norm': True, 'lr': 0.00026576228959612443, 'weight_decay': 4.7436725614905826e-05, 'epochs': 271, 'loss': 'mae', 'optimizer': 'adam', 'graph_mode': 'off', 'use_snp_selection': False}. Best is trial 8 with value: 0.11483888533968921.
[I 2025-12-05 16:33:24,563] Trial 13 finished with value: 0.11340023438643726 and parameters: {'model_type': 'mlp', 'hidden_dims': '[256, 128]', 'dropout': 0.3041365173646664, 'batch_norm': True, 'lr': 0.0001448400953749671, 'weight_decay': 1.152865323241676e-05, 'epochs': 237, 'loss': 'mae', 'optimizer': 'adam', 'graph_mode': 'off', 'use_snp_selection': False}. Best is trial 8 with value: 0.11483888533968921.
[I 2025-12-05 16:33:27,144] Trial 14 finished with value: 0.10854147776161115 and parameters: {'model_type': 'mlp', 'hidden_dims': '[512, 256]', 'dropout': 0.30297938950338094, 'batch_norm': True, 'lr': 0.00017558188744418174, 'weight_decay': 1.1414924884997386e-07, 'epochs': 303, 'loss': 'mae', 'optimizer': 'adam', 'graph_mode': 'off', 'use_snp_selection': False}. Best is trial 8 with value: 0.11483888533968921.
[I 2025-12-05 16:33:28,155] Trial 15 finished with value: 0.11347869930615524 and parameters: {'model_type': 'mlp', 'hidden_dims': '[128, 64]', 'dropout': 0.10433467686968022, 'batch_norm': True, 'lr': 0.000789806924142399, 'weight_decay': 0.000113291510652112, 'epochs': 231, 'loss': 'mae', 'optimizer': 'adam', 'graph_mode': 'off', 'use_snp_selection': False}. Best is trial 8 with value: 0.11483888533968921.
[I 2025-12-05 16:33:29,332] Trial 16 finished with value: 0.10083356646674599 and parameters: {'model_type': 'mlp', 'hidden_dims': '[128, 64]', 'dropout': 0.11113266384039287, 'batch_norm': True, 'lr': 0.0008579627146852668, 'weight_decay': 0.00011431726695115916, 'epochs': 350, 'loss': 'mae', 'optimizer': 'adam', 'graph_mode': 'off', 'use_snp_selection': False}. Best is trial 8 with value: 0.11483888533968921.
[I 2025-12-05 16:33:30,266] Trial 17 finished with value: 0.07280064132197038 and parameters: {'model_type': 'mlp', 'hidden_dims': '[128, 64]', 'dropout': 0.19615244573734286, 'batch_norm': True, 'lr': 2.0796451568787424e-05, 'weight_decay': 0.00012649433726766567, 'epochs': 287, 'loss': 'mae', 'optimizer': 'adam', 'graph_mode': 'off', 'use_snp_selection': False}. Best is trial 8 with value: 0.11483888533968921.
[I 2025-12-05 16:33:32,728] Trial 18 finished with value: 0.07368885590958713 and parameters: {'model_type': 'mlp', 'hidden_dims': '[256, 128, 64]', 'dropout': 0.10884892417738423, 'batch_norm': False, 'lr': 0.0009897362511876527, 'weight_decay': 3.615736329976439e-05, 'epochs': 211, 'loss': 'mae', 'optimizer': 'adam', 'graph_mode': 'off', 'use_snp_selection': True, 'num_snps': 58241}. Best is trial 8 with value: 0.11483888533968921.
[I 2025-12-05 16:33:34,303] Trial 19 finished with value: 0.051293101974846864 and parameters: {'model_type': 'mlp', 'hidden_dims': '[512, 128]', 'dropout': 0.2158352161235209, 'batch_norm': True, 'lr': 1.352570837276448e-05, 'weight_decay': 4.683851500825195e-06, 'epochs': 268, 'loss': 'mae', 'optimizer': 'adam', 'graph_mode': 'off', 'use_snp_selection': False}. Best is trial 8 with value: 0.11483888533968921.
[I 2025-12-05 16:33:35,229] Trial 20 finished with value: 0.09222762038760822 and parameters: {'model_type': 'mlp', 'hidden_dims': '[128, 64]', 'dropout': 0.15769399413604648, 'batch_norm': True, 'lr': 0.00012406050819111097, 'weight_decay': 2.0082809429039797e-05, 'epochs': 310, 'loss': 'mae', 'optimizer': 'adam', 'graph_mode': 'off', 'use_snp_selection': False}. Best is trial 8 with value: 0.11483888533968921.
[I 2025-12-05 16:33:36,194] Trial 21 finished with value: 0.10450891830366812 and parameters: {'model_type': 'mlp', 'hidden_dims': '[256, 128]', 'dropout': 0.3280197464231041, 'batch_norm': True, 'lr': 0.0003117907663484621, 'weight_decay': 1.4066365582416049e-05, 'epochs': 234, 'loss': 'mae', 'optimizer': 'adam', 'graph_mode': 'off', 'use_snp_selection': False}. Best is trial 8 with value: 0.11483888533968921.
[I 2025-12-05 16:33:37,596] Trial 22 finished with value: 0.09917158524855779 and parameters: {'model_type': 'mlp', 'hidden_dims': '[512, 128]', 'dropout': 0.25669178752649824, 'batch_norm': True, 'lr': 0.00013125309290784544, 'weight_decay': 9.488987626887824e-05, 'epochs': 222, 'loss': 'mae', 'optimizer': 'adam', 'graph_mode': 'off', 'use_snp_selection': False}. Best is trial 8 with value: 0.11483888533968921.
[I 2025-12-05 16:33:38,453] Trial 23 finished with value: 0.10374940953322719 and parameters: {'model_type': 'mlp', 'hidden_dims': '[256, 128]', 'dropout': 0.2216755659790004, 'batch_norm': True, 'lr': 0.00047344439770777356, 'weight_decay': 1.8251352643327644e-06, 'epochs': 172, 'loss': 'mae', 'optimizer': 'adam', 'graph_mode': 'off', 'use_snp_selection': False}. Best is trial 8 with value: 0.11483888533968921.
[I 2025-12-05 16:33:39,313] Trial 24 finished with value: 0.09451024940940828 and parameters: {'model_type': 'mlp', 'hidden_dims': '[128, 64]', 'dropout': 0.11617437063470447, 'batch_norm': True, 'lr': 0.00023198150141742413, 'weight_decay': 0.00027478619033360294, 'epochs': 260, 'loss': 'mae', 'optimizer': 'adam', 'graph_mode': 'off', 'use_snp_selection': False}. Best is trial 8 with value: 0.11483888533968921.
[I 2025-12-05 16:33:40,379] Trial 25 finished with value: 0.09692383595969682 and parameters: {'model_type': 'mlp', 'hidden_dims': '[512, 256]', 'dropout': 0.3533183830437012, 'batch_norm': True, 'lr': 0.0006069786966067758, 'weight_decay': 5.800036305818054e-06, 'epochs': 124, 'loss': 'mae', 'optimizer': 'adam', 'graph_mode': 'off', 'use_snp_selection': False}. Best is trial 8 with value: 0.11483888533968921.
