[I 2025-12-06 09:40:47,996] Trial 89 finished with value: 0.19092601971133943 and parameters: {'model_type': 'mlp', 'hidden_dims': '[512, 64]', 'dropout': 0.11159886557653562, 'batch_norm': True, 'lr': 0.00010928082904539779, 'weight_decay': 0.0003329664675204661, 'epochs': 194, 'loss': 'mae', 'optimizer': 'adam', 'graph_mode': 'off', 'use_snp_selection': True, 'num_snps': 45058}. Best is trial 43 with value: 0.2003803663756437.
[I 2025-12-06 09:41:53,016] Trial 90 finished with value: 0.19301905408335074 and parameters: {'model_type': 'mlp', 'hidden_dims': '[512, 64]', 'dropout': 0.14838930516416046, 'batch_norm': True, 'lr': 0.00027863549020807347, 'weight_decay': 2.275576739310057e-07, 'epochs': 205, 'loss': 'mae', 'optimizer': 'adam', 'graph_mode': 'off', 'use_snp_selection': False}. Best is trial 43 with value: 0.2003803663756437.
[I 2025-12-06 09:43:27,682] Trial 91 finished with value: 0.197916188452632 and parameters: {'model_type': 'mlp', 'hidden_dims': '[512, 128]', 'dropout': 0.12789899032414653, 'batch_norm': True, 'lr': 5.136969661595709e-05, 'weight_decay': 8.688954541912274e-05, 'epochs': 307, 'loss': 'mae', 'optimizer': 'adam', 'graph_mode': 'off', 'use_snp_selection': False}. Best is trial 43 with value: 0.2003803663756437.
[I 2025-12-06 09:44:18,528] Trial 92 finished with value: 0.1949949588205907 and parameters: {'model_type': 'mlp', 'hidden_dims': '[256, 128]', 'dropout': 0.16585317411543168, 'batch_norm': True, 'lr': 5.3771383832381444e-05, 'weight_decay': 0.00011782391027522575, 'epochs': 306, 'loss': 'mae', 'optimizer': 'adam', 'graph_mode': 'off', 'use_snp_selection': False}. Best is trial 43 with value: 0.2003803663756437.
[I 2025-12-06 09:45:13,852] Trial 93 finished with value: 0.18962791265233964 and parameters: {'model_type': 'mlp', 'hidden_dims': '[256, 128]', 'dropout': 0.1655327817522212, 'batch_norm': True, 'lr': 4.939323063064968e-05, 'weight_decay': 0.00012370878998282833, 'epochs': 337, 'loss': 'mae', 'optimizer': 'adam', 'graph_mode': 'off', 'use_snp_selection': False}. Best is trial 43 with value: 0.2003803663756437.
[I 2025-12-06 09:46:05,254] Trial 94 finished with value: 0.1885998974255393 and parameters: {'model_type': 'mlp', 'hidden_dims': '[256, 128]', 'dropout': 0.17294239295827696, 'batch_norm': True, 'lr': 2.6004520901079107e-05, 'weight_decay': 0.00022004236791443974, 'epochs': 310, 'loss': 'mae', 'optimizer': 'adam', 'graph_mode': 'off', 'use_snp_selection': False}. Best is trial 43 with value: 0.2003803663756437.
[I 2025-12-06 09:46:55,563] Trial 95 finished with value: 0.1960454041189275 and parameters: {'model_type': 'mlp', 'hidden_dims': '[256, 128]', 'dropout': 0.12674461595957728, 'batch_norm': True, 'lr': 3.645067504388351e-05, 'weight_decay': 0.0005431253729594783, 'epochs': 303, 'loss': 'mae', 'optimizer': 'adam', 'graph_mode': 'off', 'use_snp_selection': False}. Best is trial 43 with value: 0.2003803663756437.
[I 2025-12-06 09:47:46,154] Trial 96 finished with value: 0.18372769076584006 and parameters: {'model_type': 'mlp', 'hidden_dims': '[256, 128]', 'dropout': 0.13317680367415966, 'batch_norm': True, 'lr': 3.2002143716628336e-05, 'weight_decay': 0.0005176130788830758, 'epochs': 305, 'loss': 'mae', 'optimizer': 'adam', 'graph_mode': 'off', 'use_snp_selection': False}. Best is trial 43 with value: 0.2003803663756437.
[I 2025-12-06 09:48:33,790] Trial 97 finished with value: 0.1894495909553884 and parameters: {'model_type': 'mlp', 'hidden_dims': '[256, 128]', 'dropout': 0.14412579369830505, 'batch_norm': True, 'lr': 4.962121892083728e-05, 'weight_decay': 0.0007920928933367672, 'epochs': 284, 'loss': 'mse', 'optimizer': 'adam', 'graph_mode': 'off', 'use_snp_selection': False}. Best is trial 43 with value: 0.2003803663756437.
[I 2025-12-06 09:50:12,854] Trial 98 finished with value: 0.17268496878609524 and parameters: {'model_type': 'mlp', 'hidden_dims': '[512, 64]', 'dropout': 0.15905729639887026, 'batch_norm': True, 'lr': 1.392658903346312e-05, 'weight_decay': 8.603977595760411e-05, 'epochs': 323, 'loss': 'mae', 'optimizer': 'adam', 'graph_mode': 'off', 'use_snp_selection': False}. Best is trial 43 with value: 0.2003803663756437.
[I 2025-12-06 09:51:03,203] Trial 99 finished with value: 0.17309574581630643 and parameters: {'model_type': 'mlp', 'hidden_dims': '[256, 128, 64]', 'dropout': 0.4627318245445293, 'batch_norm': True, 'lr': 3.8697074376630254e-05, 'weight_decay': 0.0006085867729560471, 'epochs': 301, 'loss': 'mae', 'optimizer': 'adam', 'graph_mode': 'off', 'use_snp_selection': False}. Best is trial 43 with value: 0.2003803663756437.
[I 2025-12-06 09:51:14,636] Trial 100 finished with value: 0.17686032417136716 and parameters: {'model_type': 'mlp', 'hidden_dims': '[128, 64]', 'dropout': 0.11630916121469981, 'batch_norm': False, 'lr': 6.822679137974881e-05, 'weight_decay': 4.85989235180901e-05, 'epochs': 78, 'loss': 'mae', 'optimizer': 'adam', 'graph_mode': 'off', 'use_snp_selection': False}. Best is trial 43 with value: 0.2003803663756437.
[I 2025-12-06 09:52:06,645] Trial 101 finished with value: 0.18188079815513217 and parameters: {'model_type': 'mlp', 'hidden_dims': '[256, 128]', 'dropout': 0.5417921142537152, 'batch_norm': True, 'lr': 5.511928329659599e-05, 'weight_decay': 0.00016148409558586338, 'epochs': 315, 'loss': 'mae', 'optimizer': 'adam', 'graph_mode': 'off', 'use_snp_selection': False}. Best is trial 43 with value: 0.2003803663756437.
[I 2025-12-06 09:52:55,755] Trial 102 finished with value: 0.1798577170789287 and parameters: {'model_type': 'mlp', 'hidden_dims': '[256, 128]', 'dropout': 0.12488284963835407, 'batch_norm': True, 'lr': 2.8522758658776608e-05, 'weight_decay': 0.00024680500575173004, 'epochs': 294, 'loss': 'mae', 'optimizer': 'adam', 'graph_mode': 'off', 'use_snp_selection': False}. Best is trial 43 with value: 0.2003803663756437.
[I 2025-12-06 09:53:52,392] Trial 103 finished with value: 0.1840271720197571 and parameters: {'model_type': 'mlp', 'hidden_dims': '[256, 128]', 'dropout': 0.148708980082646, 'batch_norm': True, 'lr': 2.2776110328438097e-05, 'weight_decay': 0.0001109483564306505, 'epochs': 346, 'loss': 'mae', 'optimizer': 'adam', 'graph_mode': 'off', 'use_snp_selection': False}. Best is trial 43 with value: 0.2003803663756437.
[I 2025-12-06 09:54:30,859] Trial 104 finished with value: 0.17558291439972193 and parameters: {'model_type': 'mlp', 'hidden_dims': '[256, 128]', 'dropout': 0.17863964042449576, 'batch_norm': True, 'lr': 3.5708966179923886e-05, 'weight_decay': 0.000356714939319375, 'epochs': 221, 'loss': 'mae', 'optimizer': 'adam', 'graph_mode': 'off', 'use_snp_selection': False}. Best is trial 43 with value: 0.2003803663756437.
[I 2025-12-06 09:55:43,583] Trial 105 finished with value: 0.17764575435589028 and parameters: {'model_type': 'mlp', 'hidden_dims': '[512, 64]', 'dropout': 0.2461300401459558, 'batch_norm': True, 'lr': 9.795074288772368e-05, 'weight_decay': 0.00020311212198893867, 'epochs': 230, 'loss': 'mae', 'optimizer': 'adam', 'graph_mode': 'off', 'use_snp_selection': False}. Best is trial 43 with value: 0.2003803663756437.
[I 2025-12-06 09:57:24,463] Trial 106 finished with value: 0.19426022448743827 and parameters: {'model_type': 'mlp', 'hidden_dims': '[512, 64]', 'dropout': 0.2753748843609674, 'batch_norm': True, 'lr': 4.273074963805124e-05, 'weight_decay': 6.251755517259518e-05, 'epochs': 329, 'loss': 'mse', 'optimizer': 'adam', 'graph_mode': 'off', 'use_snp_selection': False}. Best is trial 43 with value: 0.2003803663756437.
[I 2025-12-06 09:59:06,669] Trial 107 finished with value: 0.1971283087856758 and parameters: {'model_type': 'mlp', 'hidden_dims': '[512, 64]', 'dropout': 0.10897876172515697, 'batch_norm': True, 'lr': 4.377052245390567e-05, 'weight_decay': 3.928193432335945e-05, 'epochs': 334, 'loss': 'mse', 'optimizer': 'adam', 'graph_mode': 'off', 'use_snp_selection': False}. Best is trial 43 with value: 0.2003803663756437.
[I 2025-12-06 10:00:45,432] Trial 108 finished with value: 0.19642265590381416 and parameters: {'model_type': 'mlp', 'hidden_dims': '[512, 64]', 'dropout': 0.11212784277275738, 'batch_norm': True, 'lr': 4.3953137681851194e-05, 'weight_decay': 6.107445488845711e-05, 'epochs': 322, 'loss': 'mse', 'optimizer': 'adam', 'graph_mode': 'off', 'use_snp_selection': False}. Best is trial 43 with value: 0.2003803663756437.
[I 2025-12-06 10:02:26,515] Trial 109 finished with value: 0.19187237525098116 and parameters: {'model_type': 'mlp', 'hidden_dims': '[512, 64]', 'dropout': 0.10859993228044447, 'batch_norm': True, 'lr': 4.357118799684487e-05, 'weight_decay': 6.152406990088375e-05, 'epochs': 330, 'loss': 'mse', 'optimizer': 'adam', 'graph_mode': 'off', 'use_snp_selection': False}. Best is trial 43 with value: 0.2003803663756437.
[I 2025-12-06 10:03:43,274] Trial 110 finished with value: 0.1719605561621707 and parameters: {'model_type': 'mlp', 'hidden_dims': '[512, 64]', 'dropout': 0.12368253027012166, 'batch_norm': True, 'lr': 6.093754211374608e-05, 'weight_decay': 3.707325847883577e-05, 'epochs': 333, 'loss': 'mse', 'optimizer': 'adam', 'graph_mode': 'off', 'use_snp_selection': True, 'num_snps': 26398}. Best is trial 43 with value: 0.2003803663756437.
[I 2025-12-06 10:05:21,816] Trial 111 finished with value: 0.1867246006398126 and parameters: {'model_type': 'mlp', 'hidden_dims': '[512, 64]', 'dropout': 0.13274436971275647, 'batch_norm': True, 'lr': 4.708151406257759e-05, 'weight_decay': 8.724716866153225e-05, 'epochs': 323, 'loss': 'mse', 'optimizer': 'adam', 'graph_mode': 'off', 'use_snp_selection': False}. Best is trial 43 with value: 0.2003803663756437.
[I 2025-12-06 10:07:06,535] Trial 112 finished with value: 0.18596007731504083 and parameters: {'model_type': 'mlp', 'hidden_dims': '[512, 64]', 'dropout': 0.11126540611415078, 'batch_norm': True, 'lr': 2.765797123982383e-05, 'weight_decay': 2.915451496436097e-05, 'epochs': 343, 'loss': 'mse', 'optimizer': 'adam', 'graph_mode': 'off', 'use_snp_selection': False}. Best is trial 43 with value: 0.2003803663756437.
[I 2025-12-06 10:08:42,598] Trial 113 finished with value: 0.1891877044068961 and parameters: {'model_type': 'mlp', 'hidden_dims': '[512, 64]', 'dropout': 0.14001598190273398, 'batch_norm': True, 'lr': 3.586196836030446e-05, 'weight_decay': 7.43288122129694e-05, 'epochs': 312, 'loss': 'mse', 'optimizer': 'adam', 'graph_mode': 'off', 'use_snp_selection': False}. Best is trial 43 with value: 0.2003803663756437.
[I 2025-12-06 10:10:25,027] Trial 114 finished with value: 0.19721506282165008 and parameters: {'model_type': 'mlp', 'hidden_dims': '[512, 64]', 'dropout': 0.16269800353358332, 'batch_norm': True, 'lr': 7.46566798507782e-05, 'weight_decay': 4.956484470700813e-05, 'epochs': 335, 'loss': 'mse', 'optimizer': 'adam', 'graph_mode': 'off', 'use_snp_selection': False}. Best is trial 43 with value: 0.2003803663756437.
[I 2025-12-06 10:12:07,929] Trial 115 finished with value: 0.18615035414742903 and parameters: {'model_type': 'mlp', 'hidden_dims': '[512, 64]', 'dropout': 0.16230481265143604, 'batch_norm': True, 'lr': 5.3922677191152624e-05, 'weight_decay': 0.00013023137685736201, 'epochs': 337, 'loss': 'mse', 'optimizer': 'adam', 'graph_mode': 'off', 'use_snp_selection': False}. Best is trial 43 with value: 0.2003803663756437.
[I 2025-12-06 10:13:47,462] Trial 116 finished with value: 0.19249724034302212 and parameters: {'model_type': 'mlp', 'hidden_dims': '[512, 64]', 'dropout': 0.12329903579588931, 'batch_norm': True, 'lr': 7.001280207987668e-05, 'weight_decay': 0.0001004623996980582, 'epochs': 325, 'loss': 'mse', 'optimizer': 'adam', 'graph_mode': 'off', 'use_snp_selection': False}. Best is trial 43 with value: 0.2003803663756437.
[I 2025-12-06 10:15:24,794] Trial 117 finished with value: 0.1896804119207784 and parameters: {'model_type': 'mlp', 'hidden_dims': '[512, 64]', 'dropout': 0.10750070625703892, 'batch_norm': True, 'lr': 4.2687435160861914e-05, 'weight_decay': 5.7621021037977956e-05, 'epochs': 317, 'loss': 'mse', 'optimizer': 'adam', 'graph_mode': 'off', 'use_snp_selection': False}. Best is trial 43 with value: 0.2003803663756437.
[I 2025-12-06 10:16:58,739] Trial 118 finished with value: 0.2024649360837997 and parameters: {'model_type': 'mlp', 'hidden_dims': '[512, 64]', 'dropout': 0.10147361034800512, 'batch_norm': True, 'lr': 7.930822344385841e-05, 'weight_decay': 4.8579636078123655e-05, 'epochs': 305, 'loss': 'mse', 'optimizer': 'adam', 'graph_mode': 'off', 'use_snp_selection': False}. Best is trial 118 with value: 0.2024649360837997.
[I 2025-12-06 10:18:45,539] Trial 119 finished with value: 0.1914039760086355 and parameters: {'model_type': 'mlp', 'hidden_dims': '[512, 64]', 'dropout': 0.10253148809178263, 'batch_norm': True, 'lr': 8.832331527531383e-05, 'weight_decay': 4.511998279413016e-05, 'epochs': 350, 'loss': 'mse', 'optimizer': 'adam', 'graph_mode': 'off', 'use_snp_selection': False}. Best is trial 118 with value: 0.2024649360837997.
[I 2025-12-06 10:20:16,824] Trial 120 finished with value: 0.1957208940391223 and parameters: {'model_type': 'mlp', 'hidden_dims': '[512, 256]', 'dropout': 0.1341876972244174, 'batch_norm': True, 'lr': 8.227353477119668e-05, 'weight_decay': 7.787455987789458e-05, 'epochs': 294, 'loss': 'mse', 'optimizer': 'adam', 'graph_mode': 'off', 'use_snp_selection': False}. Best is trial 118 with value: 0.2024649360837997.
[I 2025-12-06 10:21:48,130] Trial 121 finished with value: 0.19530932224787195 and parameters: {'model_type': 'mlp', 'hidden_dims': '[512, 256]', 'dropout': 0.1345169870844206, 'batch_norm': True, 'lr': 7.26461585319714e-05, 'weight_decay': 3.763578891993673e-05, 'epochs': 293, 'loss': 'mse', 'optimizer': 'adam', 'graph_mode': 'off', 'use_snp_selection': False}. Best is trial 118 with value: 0.2024649360837997.
[I 2025-12-06 10:23:22,497] Trial 122 finished with value: 0.19737670114403066 and parameters: {'model_type': 'mlp', 'hidden_dims': '[512, 256]', 'dropout': 0.1288624360254982, 'batch_norm': True, 'lr': 8.045707393538642e-05, 'weight_decay': 3.946652048672932e-05, 'epochs': 305, 'loss': 'mse', 'optimizer': 'adam', 'graph_mode': 'off', 'use_snp_selection': False}. Best is trial 118 with value: 0.2024649360837997.
[I 2025-12-06 10:24:49,455] Trial 123 finished with value: 0.19167844509899057 and parameters: {'model_type': 'mlp', 'hidden_dims': '[512, 256]', 'dropout': 0.12904722183111092, 'batch_norm': True, 'lr': 7.724431285453637e-05, 'weight_decay': 3.7553297111194443e-05, 'epochs': 279, 'loss': 'mse', 'optimizer': 'adam', 'graph_mode': 'off', 'use_snp_selection': False}. Best is trial 118 with value: 0.2024649360837997.
[I 2025-12-06 10:26:19,717] Trial 124 finished with value: 0.18123532636548376 and parameters: {'model_type': 'mlp', 'hidden_dims': '[512, 256]', 'dropout': 0.12010827953312679, 'batch_norm': True, 'lr': 8.237952953453412e-05, 'weight_decay': 2.4481655728391143e-05, 'epochs': 291, 'loss': 'mse', 'optimizer': 'adam', 'graph_mode': 'off', 'use_snp_selection': False}. Best is trial 118 with value: 0.2024649360837997.
[I 2025-12-06 10:27:52,780] Trial 125 finished with value: 0.19547932575686927 and parameters: {'model_type': 'mlp', 'hidden_dims': '[512, 256]', 'dropout': 0.1364471409008195, 'batch_norm': True, 'lr': 6.391926431877677e-05, 'weight_decay': 5.3022763456583185e-05, 'epochs': 301, 'loss': 'mse', 'optimizer': 'adam', 'graph_mode': 'off', 'use_snp_selection': False}. Best is trial 118 with value: 0.2024649360837997.
[I 2025-12-06 10:29:23,834] Trial 126 finished with value: 0.17998105813515938 and parameters: {'model_type': 'mlp', 'hidden_dims': '[512, 256]', 'dropout': 0.11075679176047741, 'batch_norm': False, 'lr': 6.507635010074263e-05, 'weight_decay': 4.978974962644101e-05, 'epochs': 302, 'loss': 'mse', 'optimizer': 'adam', 'graph_mode': 'off', 'use_snp_selection': False}. Best is trial 118 with value: 0.2024649360837997.
[I 2025-12-06 10:30:56,139] Trial 127 finished with value: 0.19324555092743384 and parameters: {'model_type': 'mlp', 'hidden_dims': '[512, 256]', 'dropout': 0.13358712191605632, 'batch_norm': True, 'lr': 0.00011453840799605298, 'weight_decay': 3.252756339310932e-05, 'epochs': 297, 'loss': 'mse', 'optimizer': 'adam', 'graph_mode': 'off', 'use_snp_selection': False}. Best is trial 118 with value: 0.2024649360837997.
[I 2025-12-06 10:32:25,668] Trial 128 finished with value: 0.18672354541642489 and parameters: {'model_type': 'mlp', 'hidden_dims': '[512, 256]', 'dropout': 0.15268232897679399, 'batch_norm': True, 'lr': 7.686556068861032e-05, 'weight_decay': 4.0499616516295914e-05, 'epochs': 288, 'loss': 'mse', 'optimizer': 'adam', 'graph_mode': 'off', 'use_snp_selection': False}. Best is trial 118 with value: 0.2024649360837997.
[I 2025-12-06 10:34:02,353] Trial 129 finished with value: 0.18704906941096647 and parameters: {'model_type': 'mlp', 'hidden_dims': '[512, 256]', 'dropout': 0.10040729365995098, 'batch_norm': True, 'lr': 6.242003111821127e-05, 'weight_decay': 2.9895429501430418e-05, 'epochs': 313, 'loss': 'mse', 'optimizer': 'adam', 'graph_mode': 'off', 'use_snp_selection': False}. Best is trial 118 with value: 0.2024649360837997.
[I 2025-12-06 10:35:40,498] Trial 130 finished with value: 0.18978177678700903 and parameters: {'model_type': 'mlp', 'hidden_dims': '[512, 256]', 'dropout': 0.11923123036352808, 'batch_norm': True, 'lr': 0.0001359128407641031, 'weight_decay': 0.0009707246063431301, 'epochs': 318, 'loss': 'mse', 'optimizer': 'adam', 'graph_mode': 'off', 'use_snp_selection': False}. Best is trial 118 with value: 0.2024649360837997.
[I 2025-12-06 10:37:15,546] Trial 131 finished with value: 0.20167214524585786 and parameters: {'model_type': 'mlp', 'hidden_dims': '[512, 256]', 'dropout': 0.14204337703118727, 'batch_norm': True, 'lr': 9.462483029433155e-05, 'weight_decay': 5.575226685508291e-05, 'epochs': 307, 'loss': 'mse', 'optimizer': 'adam', 'graph_mode': 'off', 'use_snp_selection': False}. Best is trial 118 with value: 0.2024649360837997.
[I 2025-12-06 10:38:50,545] Trial 132 finished with value: 0.2008608561873216 and parameters: {'model_type': 'mlp', 'hidden_dims': '[512, 256]', 'dropout': 0.1278806111461924, 'batch_norm': True, 'lr': 0.00010270599462620375, 'weight_decay': 5.38942381884138e-05, 'epochs': 307, 'loss': 'mse', 'optimizer': 'adam', 'graph_mode': 'off', 'use_snp_selection': False}. Best is trial 118 with value: 0.2024649360837997.
[I 2025-12-06 10:40:24,441] Trial 133 finished with value: 0.19191043066142083 and parameters: {'model_type': 'mlp', 'hidden_dims': '[512, 256]', 'dropout': 0.14621382705309457, 'batch_norm': True, 'lr': 9.857462282978012e-05, 'weight_decay': 5.339791624422391e-05, 'epochs': 303, 'loss': 'mse', 'optimizer': 'adam', 'graph_mode': 'off', 'use_snp_selection': False}. Best is trial 118 with value: 0.2024649360837997.
[I 2025-12-06 10:42:00,023] Trial 134 finished with value: 0.19375188851695246 and parameters: {'model_type': 'mlp', 'hidden_dims': '[512, 256]', 'dropout': 0.12507920147436732, 'batch_norm': True, 'lr': 0.0001165345871286092, 'weight_decay': 7.432801986840875e-05, 'epochs': 309, 'loss': 'mse', 'optimizer': 'adam', 'graph_mode': 'off', 'use_snp_selection': False}. Best is trial 118 with value: 0.2024649360837997.
[I 2025-12-06 10:42:47,088] Trial 135 finished with value: 0.19220215739588503 and parameters: {'model_type': 'mlp', 'hidden_dims': '[512, 256]', 'dropout': 0.11249583950599945, 'batch_norm': True, 'lr': 8.911439527083775e-05, 'weight_decay': 8.945145708611682e-05, 'epochs': 139, 'loss': 'mse', 'optimizer': 'adam', 'graph_mode': 'off', 'use_snp_selection': False}. Best is trial 118 with value: 0.2024649360837997.
[I 2025-12-06 10:43:31,903] Trial 136 finished with value: 0.16041005429410274 and parameters: {'model_type': 'mlp', 'hidden_dims': '[512, 256]', 'dropout': 0.15203071558845607, 'batch_norm': True, 'lr': 0.00014402153063165194, 'weight_decay': 6.481819072935993e-05, 'epochs': 283, 'loss': 'mse', 'optimizer': 'adam', 'graph_mode': 'off', 'use_snp_selection': True, 'num_snps': 9469}. Best is trial 118 with value: 0.2024649360837997.
[I 2025-12-06 10:45:05,933] Trial 137 finished with value: 0.19367032170367177 and parameters: {'model_type': 'mlp', 'hidden_dims': '[512, 256]', 'dropout': 0.11857042668723841, 'batch_norm': True, 'lr': 5.101437462703673e-05, 'weight_decay': 4.966543365073344e-05, 'epochs': 306, 'loss': 'mse', 'optimizer': 'adam', 'graph_mode': 'off', 'use_snp_selection': False}. Best is trial 118 with value: 0.2024649360837997.
[I 2025-12-06 10:46:44,740] Trial 138 finished with value: 0.1919119473754678 and parameters: {'model_type': 'mlp', 'hidden_dims': '[512, 256]', 'dropout': 0.100377394374687, 'batch_norm': True, 'lr': 0.00010492275708671363, 'weight_decay': 2.1277999107228356e-05, 'epochs': 320, 'loss': 'mse', 'optimizer': 'adam', 'graph_mode': 'off', 'use_snp_selection': False}. Best is trial 118 with value: 0.2024649360837997.
[I 2025-12-06 10:48:17,254] Trial 139 finished with value: 0.19918444620682493 and parameters: {'model_type': 'mlp', 'hidden_dims': '[512, 256]', 'dropout': 0.14001241521567867, 'batch_norm': True, 'lr': 6.15208580719506e-05, 'weight_decay': 4.2998828604008463e-05, 'epochs': 298, 'loss': 'mse', 'optimizer': 'adam', 'graph_mode': 'off', 'use_snp_selection': False}. Best is trial 118 with value: 0.2024649360837997.
[I 2025-12-06 10:50:00,549] Trial 140 finished with value: 0.17906301295388044 and parameters: {'model_type': 'mlp', 'hidden_dims': '[512, 256]', 'dropout': 0.12523318486971452, 'batch_norm': True, 'lr': 7.366966012588034e-05, 'weight_decay': 4.228095491273002e-05, 'epochs': 336, 'loss': 'mse', 'optimizer': 'adam', 'graph_mode': 'off', 'use_snp_selection': False}. Best is trial 118 with value: 0.2024649360837997.
