[I 2025-12-06 08:04:08,032] Trial 120 finished with value: 0.21428724629913196 and parameters: {'model_type': 'mlp', 'hidden_dims': '[128, 64]', 'dropout': 0.21008105156184498, 'batch_norm': True, 'lr': 0.00013107513332527487, 'weight_decay': 5.370484782524005e-06, 'epochs': 204, 'loss': 'mse', 'optimizer': 'adam', 'graph_mode': 'off', 'use_snp_selection': True, 'num_snps': 23211}. Best is trial 110 with value: 0.22493778386264257.
[I 2025-12-06 08:04:57,854] Trial 121 finished with value: 0.21314780538985428 and parameters: {'model_type': 'mlp', 'hidden_dims': '[256, 128, 64]', 'dropout': 0.33082658120243186, 'batch_norm': True, 'lr': 7.791204955894744e-05, 'weight_decay': 8.168788168551905e-05, 'epochs': 288, 'loss': 'mse', 'optimizer': 'adam', 'graph_mode': 'off', 'use_snp_selection': True, 'num_snps': 21690}. Best is trial 110 with value: 0.22493778386264257.
[I 2025-12-06 08:05:38,957] Trial 122 finished with value: 0.20225438329661158 and parameters: {'model_type': 'mlp', 'hidden_dims': '[128, 64]', 'dropout': 0.2757842708267765, 'batch_norm': True, 'lr': 9.462188058366724e-05, 'weight_decay': 3.6820287025350586e-05, 'epochs': 264, 'loss': 'mse', 'optimizer': 'adam', 'graph_mode': 'off', 'use_snp_selection': True, 'num_snps': 18621}. Best is trial 110 with value: 0.22493778386264257.
[I 2025-12-06 08:06:21,766] Trial 123 finished with value: 0.20891477381024584 and parameters: {'model_type': 'mlp', 'hidden_dims': '[128, 64]', 'dropout': 0.2898065438149369, 'batch_norm': True, 'lr': 0.00017155140399223884, 'weight_decay': 1.9191697013076853e-05, 'epochs': 268, 'loss': 'mse', 'optimizer': 'adam', 'graph_mode': 'off', 'use_snp_selection': True, 'num_snps': 21423}. Best is trial 110 with value: 0.22493778386264257.
[I 2025-12-06 08:07:05,014] Trial 124 finished with value: 0.20621674803245274 and parameters: {'model_type': 'mlp', 'hidden_dims': '[128, 64]', 'dropout': 0.311479395450147, 'batch_norm': True, 'lr': 0.00014688729186958916, 'weight_decay': 2.4635325081124553e-05, 'epochs': 240, 'loss': 'mse', 'optimizer': 'adam', 'graph_mode': 'off', 'use_snp_selection': True, 'num_snps': 23684}. Best is trial 110 with value: 0.22493778386264257.
[I 2025-12-06 08:07:46,100] Trial 125 finished with value: 0.21449207704682688 and parameters: {'model_type': 'mlp', 'hidden_dims': '[128, 64]', 'dropout': 0.24949860297216225, 'batch_norm': True, 'lr': 8.112983456592317e-05, 'weight_decay': 1.1463586755754956e-05, 'epochs': 249, 'loss': 'mse', 'optimizer': 'adam', 'graph_mode': 'off', 'use_snp_selection': True, 'num_snps': 19761}. Best is trial 110 with value: 0.22493778386264257.
[I 2025-12-06 08:08:24,102] Trial 126 finished with value: 0.20630900859842644 and parameters: {'model_type': 'mlp', 'hidden_dims': '[128, 64]', 'dropout': 0.38234013516349197, 'batch_norm': True, 'lr': 0.00012022616815417634, 'weight_decay': 1.4700678148163668e-05, 'epochs': 292, 'loss': 'mse', 'optimizer': 'adam', 'graph_mode': 'off', 'use_snp_selection': True, 'num_snps': 13293}. Best is trial 110 with value: 0.22493778386264257.
[I 2025-12-06 08:08:56,569] Trial 127 finished with value: 0.1501678850852834 and parameters: {'model_type': 'mlp', 'hidden_dims': '[128, 64]', 'dropout': 0.2685738117427076, 'batch_norm': True, 'lr': 0.0002313445731326417, 'weight_decay': 1.6819367523814475e-05, 'epochs': 277, 'loss': 'mse', 'optimizer': 'adam', 'graph_mode': 'off', 'use_snp_selection': True, 'num_snps': 2521}. Best is trial 110 with value: 0.22493778386264257.
[I 2025-12-06 08:09:41,744] Trial 128 finished with value: 0.2108773443264349 and parameters: {'model_type': 'mlp', 'hidden_dims': '[128, 64]', 'dropout': 0.32410003670573334, 'batch_norm': True, 'lr': 0.00017722027883180401, 'weight_decay': 5.932389106978886e-05, 'epochs': 259, 'loss': 'mse', 'optimizer': 'adam', 'graph_mode': 'off', 'use_snp_selection': True, 'num_snps': 26125}. Best is trial 110 with value: 0.22493778386264257.
[I 2025-12-06 08:10:34,477] Trial 129 finished with value: 0.21094877225477449 and parameters: {'model_type': 'mlp', 'hidden_dims': '[256, 128, 64]', 'dropout': 0.3001881092636641, 'batch_norm': True, 'lr': 9.19180514158043e-05, 'weight_decay': 2.948683040721243e-05, 'epochs': 284, 'loss': 'mse', 'optimizer': 'adam', 'graph_mode': 'off', 'use_snp_selection': True, 'num_snps': 24641}. Best is trial 110 with value: 0.22493778386264257.
[I 2025-12-06 08:11:09,259] Trial 130 finished with value: 0.20359266808415583 and parameters: {'model_type': 'mlp', 'hidden_dims': '[128, 64]', 'dropout': 0.28627741555304886, 'batch_norm': True, 'lr': 0.00013995436502010358, 'weight_decay': 7.208604289641216e-06, 'epochs': 302, 'loss': 'mse', 'optimizer': 'adam', 'graph_mode': 'off', 'use_snp_selection': True, 'num_snps': 7706}. Best is trial 110 with value: 0.22493778386264257.
[I 2025-12-06 08:11:53,666] Trial 131 finished with value: 0.20764133970840212 and parameters: {'model_type': 'mlp', 'hidden_dims': '[128, 64]', 'dropout': 0.24615689340814456, 'batch_norm': True, 'lr': 0.00021026187524026522, 'weight_decay': 1.2314548472340429e-05, 'epochs': 230, 'loss': 'mse', 'optimizer': 'adam', 'graph_mode': 'off', 'use_snp_selection': True, 'num_snps': 26451}. Best is trial 110 with value: 0.22493778386264257.
[I 2025-12-06 08:12:35,594] Trial 132 finished with value: 0.22411546571417246 and parameters: {'model_type': 'mlp', 'hidden_dims': '[128, 64]', 'dropout': 0.2555434348052548, 'batch_norm': True, 'lr': 0.00016803991223075703, 'weight_decay': 1.3651210903037932e-05, 'epochs': 221, 'loss': 'mse', 'optimizer': 'adam', 'graph_mode': 'off', 'use_snp_selection': True, 'num_snps': 22125}. Best is trial 110 with value: 0.22493778386264257.
[I 2025-12-06 08:13:17,443] Trial 133 finished with value: 0.2098026537884677 and parameters: {'model_type': 'mlp', 'hidden_dims': '[128, 64]', 'dropout': 0.33442805422194005, 'batch_norm': True, 'lr': 9.625487859045465e-05, 'weight_decay': 2.062600178175932e-05, 'epochs': 212, 'loss': 'mse', 'optimizer': 'adam', 'graph_mode': 'off', 'use_snp_selection': True, 'num_snps': 22104}. Best is trial 110 with value: 0.22493778386264257.
[I 2025-12-06 08:13:58,398] Trial 134 finished with value: 0.2048491641849895 and parameters: {'model_type': 'mlp', 'hidden_dims': '[128, 64]', 'dropout': 0.2360799927938778, 'batch_norm': True, 'lr': 0.00015770721765549303, 'weight_decay': 4.226575817818946e-05, 'epochs': 273, 'loss': 'mse', 'optimizer': 'adam', 'graph_mode': 'off', 'use_snp_selection': True, 'num_snps': 18285}. Best is trial 110 with value: 0.22493778386264257.
[I 2025-12-06 08:14:45,420] Trial 135 finished with value: 0.21840591769617693 and parameters: {'model_type': 'mlp', 'hidden_dims': '[256, 128]', 'dropout': 0.2933257038883903, 'batch_norm': True, 'lr': 0.0001181526352000822, 'weight_decay': 1.0071557333078589e-05, 'epochs': 254, 'loss': 'mse', 'optimizer': 'adam', 'graph_mode': 'off', 'use_snp_selection': True, 'num_snps': 20658}. Best is trial 110 with value: 0.22493778386264257.
[I 2025-12-06 08:15:26,050] Trial 136 finished with value: 0.21294881116800868 and parameters: {'model_type': 'mlp', 'hidden_dims': '[128, 64]', 'dropout': 0.22060195684846962, 'batch_norm': True, 'lr': 0.00011981161572892745, 'weight_decay': 1.0375594543078374e-05, 'epochs': 219, 'loss': 'mse', 'optimizer': 'adam', 'graph_mode': 'off', 'use_snp_selection': True, 'num_snps': 20052}. Best is trial 110 with value: 0.22493778386264257.
[I 2025-12-06 08:16:16,093] Trial 137 finished with value: 0.21935627230994306 and parameters: {'model_type': 'mlp', 'hidden_dims': '[256, 128]', 'dropout': 0.2594608340897524, 'batch_norm': True, 'lr': 0.00013736654184473776, 'weight_decay': 8.1319560282377e-06, 'epochs': 243, 'loss': 'mse', 'optimizer': 'adam', 'graph_mode': 'off', 'use_snp_selection': True, 'num_snps': 24252}. Best is trial 110 with value: 0.22493778386264257.
[I 2025-12-06 08:16:59,704] Trial 138 finished with value: 0.20678411532957086 and parameters: {'model_type': 'mlp', 'hidden_dims': '[128, 64]', 'dropout': 0.26081491395555606, 'batch_norm': True, 'lr': 0.00017837402449658735, 'weight_decay': 6.109112150759693e-06, 'epochs': 242, 'loss': 'mse', 'optimizer': 'adam', 'graph_mode': 'off', 'use_snp_selection': True, 'num_snps': 24179}. Best is trial 110 with value: 0.22493778386264257.
[I 2025-12-06 08:17:50,014] Trial 139 finished with value: 0.2220519506939139 and parameters: {'model_type': 'mlp', 'hidden_dims': '[256, 128]', 'dropout': 0.26993497649102177, 'batch_norm': True, 'lr': 0.0001353570027206343, 'weight_decay': 1.4180130371631176e-05, 'epochs': 235, 'loss': 'mse', 'optimizer': 'adam', 'graph_mode': 'off', 'use_snp_selection': True, 'num_snps': 25342}. Best is trial 110 with value: 0.22493778386264257.
[I 2025-12-06 08:18:38,138] Trial 140 finished with value: 0.20982032704589745 and parameters: {'model_type': 'mlp', 'hidden_dims': '[256, 128]', 'dropout': 0.27962522515439003, 'batch_norm': True, 'lr': 0.00013824302303007578, 'weight_decay': 1.4569388255795912e-05, 'epochs': 236, 'loss': 'mse', 'optimizer': 'adam', 'graph_mode': 'off', 'use_snp_selection': True, 'num_snps': 22785}. Best is trial 110 with value: 0.22493778386264257.
[I 2025-12-06 08:19:30,351] Trial 141 finished with value: 0.21188986718456007 and parameters: {'model_type': 'mlp', 'hidden_dims': '[256, 128]', 'dropout': 0.26834985399803907, 'batch_norm': True, 'lr': 0.00024201807829911663, 'weight_decay': 2.3417483370573575e-05, 'epochs': 244, 'loss': 'mse', 'optimizer': 'adam', 'graph_mode': 'off', 'use_snp_selection': True, 'num_snps': 27463}. Best is trial 110 with value: 0.22493778386264257.
[I 2025-12-06 08:20:22,986] Trial 142 finished with value: 0.21130652147537457 and parameters: {'model_type': 'mlp', 'hidden_dims': '[256, 128]', 'dropout': 0.31793368764252405, 'batch_norm': True, 'lr': 0.00010337756900658837, 'weight_decay': 7.793518715980372e-06, 'epochs': 223, 'loss': 'mse', 'optimizer': 'adam', 'graph_mode': 'off', 'use_snp_selection': True, 'num_snps': 29567}. Best is trial 110 with value: 0.22493778386264257.
[I 2025-12-06 08:21:14,543] Trial 143 finished with value: 0.20004552155725297 and parameters: {'model_type': 'mlp', 'hidden_dims': '[256, 128]', 'dropout': 0.25740269065619825, 'batch_norm': True, 'lr': 0.00015188989917663554, 'weight_decay': 1.3517146035633684e-05, 'epochs': 251, 'loss': 'mse', 'optimizer': 'adam', 'graph_mode': 'off', 'use_snp_selection': True, 'num_snps': 25759}. Best is trial 110 with value: 0.22493778386264257.
[I 2025-12-06 08:22:05,983] Trial 144 finished with value: 0.2107117850911724 and parameters: {'model_type': 'mlp', 'hidden_dims': '[256, 128]', 'dropout': 0.30561662074171875, 'batch_norm': True, 'lr': 0.00012859134141914857, 'weight_decay': 2.7095970765228607e-05, 'epochs': 261, 'loss': 'mse', 'optimizer': 'adam', 'graph_mode': 'off', 'use_snp_selection': True, 'num_snps': 24808}. Best is trial 110 with value: 0.22493778386264257.
[I 2025-12-06 08:22:48,350] Trial 145 finished with value: 0.20587667256011852 and parameters: {'model_type': 'mlp', 'hidden_dims': '[128, 64]', 'dropout': 0.23037030425400598, 'batch_norm': True, 'lr': 7.562096582082564e-05, 'weight_decay': 1.735184868265122e-05, 'epochs': 226, 'loss': 'mse', 'optimizer': 'adam', 'graph_mode': 'off', 'use_snp_selection': True, 'num_snps': 22512}. Best is trial 110 with value: 0.22493778386264257.
[I 2025-12-06 08:23:35,538] Trial 146 finished with value: 0.210874236820994 and parameters: {'model_type': 'mlp', 'hidden_dims': '[256, 128]', 'dropout': 0.28132259532652537, 'batch_norm': True, 'lr': 0.00010892970078602612, 'weight_decay': 9.071879209549974e-06, 'epochs': 214, 'loss': 'mse', 'optimizer': 'adam', 'graph_mode': 'off', 'use_snp_selection': True, 'num_snps': 23589}. Best is trial 110 with value: 0.22493778386264257.
[I 2025-12-06 08:24:19,321] Trial 147 finished with value: 0.20093828226489205 and parameters: {'model_type': 'mlp', 'hidden_dims': '[256, 128]', 'dropout': 0.27546722488798797, 'batch_norm': True, 'lr': 0.00019078819509631004, 'weight_decay': 1.1655318584973914e-05, 'epochs': 205, 'loss': 'mse', 'optimizer': 'adam', 'graph_mode': 'off', 'use_snp_selection': True, 'num_snps': 19146}. Best is trial 110 with value: 0.22493778386264257.
[I 2025-12-06 08:25:07,081] Trial 148 finished with value: 0.21294373029800084 and parameters: {'model_type': 'mlp', 'hidden_dims': '[256, 128, 64]', 'dropout': 0.35572431136228744, 'batch_norm': True, 'lr': 0.00015969589651261646, 'weight_decay': 2.068037660289848e-05, 'epochs': 235, 'loss': 'mse', 'optimizer': 'adam', 'graph_mode': 'off', 'use_snp_selection': True, 'num_snps': 22038}. Best is trial 110 with value: 0.22493778386264257.
[I 2025-12-06 08:25:46,690] Trial 149 finished with value: 0.1970521211409742 and parameters: {'model_type': 'mlp', 'hidden_dims': '[128, 64]', 'dropout': 0.2545264445175968, 'batch_norm': True, 'lr': 8.18586423692183e-05, 'weight_decay': 3.6112894246648122e-06, 'epochs': 250, 'loss': 'mse', 'optimizer': 'adam', 'graph_mode': 'off', 'use_snp_selection': True, 'num_snps': 16333}. Best is trial 110 with value: 0.22493778386264257.
[I 2025-12-06 08:26:53,354] Trial 0 finished with value: 0.17264967741305876 and parameters: {'model_type': 'mlp', 'hidden_dims': '[128, 64]', 'dropout': 0.199031432379812, 'batch_norm': True, 'lr': 1.8408544111075837e-06, 'weight_decay': 5.5136510071208614e-05, 'epochs': 336, 'loss': 'mae', 'optimizer': 'adam', 'graph_mode': 'off', 'use_snp_selection': True, 'num_snps': 43862}. Best is trial 0 with value: 0.17264967741305876.
[I 2025-12-06 08:27:33,592] Trial 1 finished with value: 0.22753817840923052 and parameters: {'model_type': 'mlp', 'hidden_dims': '[256, 128]', 'dropout': 0.4370668075331726, 'batch_norm': True, 'lr': 7.133471581159139e-05, 'weight_decay': 1.128633586803549e-05, 'epochs': 242, 'loss': 'mae', 'optimizer': 'adam', 'graph_mode': 'off', 'use_snp_selection': False}. Best is trial 1 with value: 0.22753817840923052.
[I 2025-12-06 08:28:11,396] Trial 2 finished with value: 0.18766851511317453 and parameters: {'model_type': 'mlp', 'hidden_dims': '[256, 128, 64]', 'dropout': 0.41314357415569625, 'batch_norm': False, 'lr': 3.952233718592101e-06, 'weight_decay': 0.00026754769258252603, 'epochs': 149, 'loss': 'mse', 'optimizer': 'adam', 'graph_mode': 'off', 'use_snp_selection': True, 'num_snps': 11571}. Best is trial 1 with value: 0.22753817840923052.
[I 2025-12-06 08:29:45,583] Trial 3 finished with value: 0.2357748137935643 and parameters: {'model_type': 'mlp', 'hidden_dims': '[512, 64]', 'dropout': 0.5938127374509361, 'batch_norm': False, 'lr': 5.67704586114731e-06, 'weight_decay': 2.4518087630137052e-05, 'epochs': 320, 'loss': 'mae', 'optimizer': 'adam', 'graph_mode': 'off', 'use_snp_selection': False}. Best is trial 3 with value: 0.2357748137935643.
[I 2025-12-06 08:31:11,633] Trial 4 finished with value: 0.18857546262734132 and parameters: {'model_type': 'mlp', 'hidden_dims': '[512, 128]', 'dropout': 0.25746343592134413, 'batch_norm': True, 'lr': 1.3467657668402788e-06, 'weight_decay': 0.00033087251918647806, 'epochs': 277, 'loss': 'mse', 'optimizer': 'adam', 'graph_mode': 'off', 'use_snp_selection': True, 'num_snps': 36675}. Best is trial 3 with value: 0.2357748137935643.
[I 2025-12-06 08:32:12,316] Trial 5 finished with value: 0.1687666375874754 and parameters: {'model_type': 'mlp', 'hidden_dims': '[512, 64]', 'dropout': 0.38275350994408375, 'batch_norm': True, 'lr': 1.5586664309232824e-06, 'weight_decay': 0.0008227664668621182, 'epochs': 145, 'loss': 'mae', 'optimizer': 'adam', 'graph_mode': 'off', 'use_snp_selection': True, 'num_snps': 32148}. Best is trial 3 with value: 0.2357748137935643.
[I 2025-12-06 08:32:45,841] Trial 6 finished with value: 0.21342153343464282 and parameters: {'model_type': 'mlp', 'hidden_dims': '[256, 128]', 'dropout': 0.3930109900265879, 'batch_norm': False, 'lr': 4.892964372128395e-05, 'weight_decay': 1.5809549317992182e-06, 'epochs': 199, 'loss': 'mse', 'optimizer': 'adam', 'graph_mode': 'off', 'use_snp_selection': False}. Best is trial 3 with value: 0.2357748137935643.
[I 2025-12-06 08:33:20,139] Trial 7 finished with value: 0.23708272111812953 and parameters: {'model_type': 'mlp', 'hidden_dims': '[512, 256]', 'dropout': 0.15343979219678458, 'batch_norm': True, 'lr': 6.234003099047341e-05, 'weight_decay': 3.894760610535477e-07, 'epochs': 97, 'loss': 'mse', 'optimizer': 'adam', 'graph_mode': 'off', 'use_snp_selection': False}. Best is trial 7 with value: 0.23708272111812953.
[I 2025-12-06 08:34:53,764] Trial 8 finished with value: 0.22074833805446864 and parameters: {'model_type': 'mlp', 'hidden_dims': '[512, 128]', 'dropout': 0.10743001231661406, 'batch_norm': True, 'lr': 0.00023728538449271062, 'weight_decay': 1.7629071578048637e-05, 'epochs': 312, 'loss': 'mae', 'optimizer': 'adam', 'graph_mode': 'off', 'use_snp_selection': False}. Best is trial 7 with value: 0.23708272111812953.
[I 2025-12-06 08:35:49,642] Trial 9 finished with value: 0.21272723777557015 and parameters: {'model_type': 'mlp', 'hidden_dims': '[512, 64]', 'dropout': 0.14505336736221927, 'batch_norm': True, 'lr': 5.8619638388111826e-05, 'weight_decay': 6.200156172669308e-07, 'epochs': 175, 'loss': 'mse', 'optimizer': 'adam', 'graph_mode': 'off', 'use_snp_selection': False}. Best is trial 7 with value: 0.23708272111812953.
[I 2025-12-06 08:36:08,336] Trial 10 finished with value: 0.1805152261896863 and parameters: {'model_type': 'mlp', 'hidden_dims': '[512, 256]', 'dropout': 0.2736992815328032, 'batch_norm': False, 'lr': 0.00032393778075602147, 'weight_decay': 1.1511946696017092e-07, 'epochs': 41, 'loss': 'mse', 'optimizer': 'adam', 'graph_mode': 'off', 'use_snp_selection': False}. Best is trial 7 with value: 0.23708272111812953.
[I 2025-12-06 08:36:37,017] Trial 11 finished with value: 0.21609061926342213 and parameters: {'model_type': 'mlp', 'hidden_dims': '[512, 256]', 'dropout': 0.583942291816117, 'batch_norm': False, 'lr': 7.811409765921478e-06, 'weight_decay': 2.0596806983850726e-06, 'epochs': 77, 'loss': 'mae', 'optimizer': 'adam', 'graph_mode': 'off', 'use_snp_selection': False}. Best is trial 7 with value: 0.23708272111812953.
[I 2025-12-06 08:37:09,993] Trial 12 finished with value: 0.22779898605458185 and parameters: {'model_type': 'mlp', 'hidden_dims': '[512, 256]', 'dropout': 0.5873431926823272, 'batch_norm': False, 'lr': 1.3209655691727925e-05, 'weight_decay': 1.3081036432574914e-07, 'epochs': 93, 'loss': 'mae', 'optimizer': 'adam', 'graph_mode': 'off', 'use_snp_selection': False}. Best is trial 7 with value: 0.23708272111812953.
[I 2025-12-06 08:38:21,948] Trial 13 finished with value: 0.21711533795495758 and parameters: {'model_type': 'mlp', 'hidden_dims': '[512, 64]', 'dropout': 0.5038644356477802, 'batch_norm': False, 'lr': 1.4304506621636526e-05, 'weight_decay': 4.373608364627903e-05, 'epochs': 237, 'loss': 'mse', 'optimizer': 'adam', 'graph_mode': 'off', 'use_snp_selection': False}. Best is trial 7 with value: 0.23708272111812953.
[I 2025-12-06 08:38:36,199] Trial 14 finished with value: 0.20954434822735202 and parameters: {'model_type': 'mlp', 'hidden_dims': '[128, 64]', 'dropout': 0.3012984444538551, 'batch_norm': True, 'lr': 0.0001457690241539883, 'weight_decay': 3.0607358611649674e-06, 'epochs': 114, 'loss': 'mse', 'optimizer': 'adam', 'graph_mode': 'off', 'use_snp_selection': False}. Best is trial 7 with value: 0.23708272111812953.
[I 2025-12-06 08:39:12,930] Trial 15 finished with value: 0.22386344014245654 and parameters: {'model_type': 'mlp', 'hidden_dims': '[256, 128, 64]', 'dropout': 0.48263162073930665, 'batch_norm': False, 'lr': 2.2873500775644262e-05, 'weight_decay': 3.9169083908621594e-07, 'epochs': 216, 'loss': 'mae', 'optimizer': 'adam', 'graph_mode': 'off', 'use_snp_selection': False}. Best is trial 7 with value: 0.23708272111812953.
[I 2025-12-06 08:40:39,329] Trial 16 finished with value: 0.18201830967412147 and parameters: {'model_type': 'mlp', 'hidden_dims': '[512, 256]', 'dropout': 0.20597729258687042, 'batch_norm': True, 'lr': 6.013316929814413e-06, 'weight_decay': 5.098763140321504e-06, 'epochs': 283, 'loss': 'mse', 'optimizer': 'adam', 'graph_mode': 'off', 'use_snp_selection': False}. Best is trial 7 with value: 0.23708272111812953.
[I 2025-12-06 08:42:20,551] Trial 17 finished with value: 0.14598716205738552 and parameters: {'model_type': 'mlp', 'hidden_dims': '[512, 64]', 'dropout': 0.32888830259108426, 'batch_norm': False, 'lr': 0.000906375209920231, 'weight_decay': 4.279596648260934e-05, 'epochs': 349, 'loss': 'mae', 'optimizer': 'adam', 'graph_mode': 'off', 'use_snp_selection': False}. Best is trial 7 with value: 0.23708272111812953.
[I 2025-12-06 08:43:51,382] Trial 18 finished with value: 0.217637507300196 and parameters: {'model_type': 'mlp', 'hidden_dims': '[512, 256]', 'dropout': 0.5139576333133464, 'batch_norm': False, 'lr': 2.797772152750264e-05, 'weight_decay': 3.5038679530849885e-07, 'epochs': 164, 'loss': 'mse', 'optimizer': 'adam', 'graph_mode': 'off', 'use_snp_selection': True, 'num_snps': 58241}. Best is trial 7 with value: 0.23708272111812953.
[I 2025-12-06 08:44:12,436] Trial 19 finished with value: 0.15957704361838598 and parameters: {'model_type': 'mlp', 'hidden_dims': '[512, 64]', 'dropout': 0.21972527923816063, 'batch_norm': True, 'lr': 3.502882181800776e-06, 'weight_decay': 0.00015299712892081902, 'epochs': 49, 'loss': 'mae', 'optimizer': 'adam', 'graph_mode': 'off', 'use_snp_selection': False}. Best is trial 7 with value: 0.23708272111812953.
[I 2025-12-06 08:44:52,275] Trial 20 finished with value: 0.2220578762030163 and parameters: {'model_type': 'mlp', 'hidden_dims': '[512, 128]', 'dropout': 0.3479554994523537, 'batch_norm': False, 'lr': 0.00014058530570495862, 'weight_decay': 5.6086896540041565e-06, 'epochs': 121, 'loss': 'mae', 'optimizer': 'adam', 'graph_mode': 'off', 'use_snp_selection': False}. Best is trial 7 with value: 0.23708272111812953.
