[I 2025-12-05 16:34:27,292] Trial 98 finished with value: 0.05754802416948051 and parameters: {'model_type': 'mlp', 'hidden_dims': '[512, 64]', 'dropout': 0.12657312511010058, 'batch_norm': True, 'lr': 3.344853289767859e-05, 'weight_decay': 2.1795484587232775e-06, 'epochs': 272, 'loss': 'mse', 'optimizer': 'adam', 'graph_mode': 'off', 'use_snp_selection': True, 'num_snps': 42461}. Best is trial 90 with value: 0.09879922542512554.
[I 2025-12-05 16:34:30,242] Trial 99 finished with value: 0.06371786247831582 and parameters: {'model_type': 'mlp', 'hidden_dims': '[512, 64]', 'dropout': 0.11036197539636264, 'batch_norm': True, 'lr': 1.823340930151639e-05, 'weight_decay': 9.019582152744764e-06, 'epochs': 250, 'loss': 'mse', 'optimizer': 'adam', 'graph_mode': 'off', 'use_snp_selection': True, 'num_snps': 52801}. Best is trial 90 with value: 0.09879922542512554.
[I 2025-12-05 16:34:32,298] Trial 100 finished with value: 0.06278276272392956 and parameters: {'model_type': 'mlp', 'hidden_dims': '[512, 64]', 'dropout': 0.235320091731661, 'batch_norm': True, 'lr': 0.00044972909700300166, 'weight_decay': 1.2968327804118194e-05, 'epochs': 315, 'loss': 'mse', 'optimizer': 'adam', 'graph_mode': 'off', 'use_snp_selection': True, 'num_snps': 32866}. Best is trial 90 with value: 0.09879922542512554.
[I 2025-12-05 16:34:33,835] Trial 101 finished with value: 0.08503674613826775 and parameters: {'model_type': 'mlp', 'hidden_dims': '[512, 128]', 'dropout': 0.1193510517806572, 'batch_norm': True, 'lr': 0.0006959696846844626, 'weight_decay': 3.3518921515524355e-07, 'epochs': 236, 'loss': 'mse', 'optimizer': 'adam', 'graph_mode': 'off', 'use_snp_selection': False}. Best is trial 90 with value: 0.09879922542512554.
[I 2025-12-05 16:34:35,507] Trial 102 finished with value: 0.06298243544984022 and parameters: {'model_type': 'mlp', 'hidden_dims': '[512, 128]', 'dropout': 0.10166739242290808, 'batch_norm': True, 'lr': 0.0005770118966759651, 'weight_decay': 1.1343177850818222e-06, 'epochs': 285, 'loss': 'mse', 'optimizer': 'adam', 'graph_mode': 'off', 'use_snp_selection': False}. Best is trial 90 with value: 0.09879922542512554.
[I 2025-12-05 16:34:36,607] Trial 103 finished with value: 0.0764273078756792 and parameters: {'model_type': 'mlp', 'hidden_dims': '[256, 128, 64]', 'dropout': 0.13207075236970917, 'batch_norm': True, 'lr': 0.0009992428137735015, 'weight_decay': 3.2237508761367887e-06, 'epochs': 263, 'loss': 'mse', 'optimizer': 'adam', 'graph_mode': 'off', 'use_snp_selection': False}. Best is trial 90 with value: 0.09879922542512554.
[I 2025-12-05 16:34:37,388] Trial 104 finished with value: 0.0379278624040637 and parameters: {'model_type': 'mlp', 'hidden_dims': '[128, 64]', 'dropout': 0.14268611141583215, 'batch_norm': False, 'lr': 0.0003885128579793272, 'weight_decay': 1.2250301842762782e-07, 'epochs': 204, 'loss': 'mse', 'optimizer': 'adam', 'graph_mode': 'off', 'use_snp_selection': False}. Best is trial 90 with value: 0.09879922542512554.
[I 2025-12-05 16:34:39,134] Trial 105 finished with value: 0.07283180883022643 and parameters: {'model_type': 'mlp', 'hidden_dims': '[512, 128]', 'dropout': 0.11018076115303906, 'batch_norm': True, 'lr': 0.0006335380463765981, 'weight_decay': 4.7256217455661477e-07, 'epochs': 300, 'loss': 'mse', 'optimizer': 'adam', 'graph_mode': 'off', 'use_snp_selection': False}. Best is trial 90 with value: 0.09879922542512554.
[I 2025-12-05 16:34:40,541] Trial 106 finished with value: 0.07092162001642453 and parameters: {'model_type': 'mlp', 'hidden_dims': '[512, 64]', 'dropout': 0.12301218909142718, 'batch_norm': True, 'lr': 0.00019487315345984225, 'weight_decay': 2.0702430616035393e-05, 'epochs': 191, 'loss': 'mse', 'optimizer': 'adam', 'graph_mode': 'off', 'use_snp_selection': False}. Best is trial 90 with value: 0.09879922542512554.
[I 2025-12-05 16:34:42,250] Trial 107 finished with value: 0.07335012360367663 and parameters: {'model_type': 'mlp', 'hidden_dims': '[512, 128]', 'dropout': 0.16880577459499302, 'batch_norm': True, 'lr': 0.0002441554383523793, 'weight_decay': 5.497894568795602e-06, 'epochs': 282, 'loss': 'mse', 'optimizer': 'adam', 'graph_mode': 'off', 'use_snp_selection': False}. Best is trial 90 with value: 0.09879922542512554.
[I 2025-12-05 16:34:43,998] Trial 108 finished with value: 0.05946187875770854 and parameters: {'model_type': 'mlp', 'hidden_dims': '[512, 128]', 'dropout': 0.1577770501223957, 'batch_norm': True, 'lr': 0.0005229078513370398, 'weight_decay': 7.562249146014179e-07, 'epochs': 224, 'loss': 'mse', 'optimizer': 'adam', 'graph_mode': 'off', 'use_snp_selection': True, 'num_snps': 26550}. Best is trial 90 with value: 0.09879922542512554.
[I 2025-12-05 16:34:45,564] Trial 109 finished with value: 0.08377573107918687 and parameters: {'model_type': 'mlp', 'hidden_dims': '[512, 64]', 'dropout': 0.1460828259992449, 'batch_norm': True, 'lr': 0.0008658172105002755, 'weight_decay': 1.8576182519316655e-07, 'epochs': 246, 'loss': 'mse', 'optimizer': 'adam', 'graph_mode': 'off', 'use_snp_selection': False}. Best is trial 90 with value: 0.09879922542512554.
[I 2025-12-05 16:34:47,317] Trial 110 finished with value: 0.06688913520931493 and parameters: {'model_type': 'mlp', 'hidden_dims': '[512, 128]', 'dropout': 0.13377045246398991, 'batch_norm': True, 'lr': 0.00033703742627337716, 'weight_decay': 1.3722798224347883e-07, 'epochs': 307, 'loss': 'mse', 'optimizer': 'adam', 'graph_mode': 'off', 'use_snp_selection': False}. Best is trial 90 with value: 0.09879922542512554.
[I 2025-12-05 16:34:48,814] Trial 111 finished with value: 0.06954738713988917 and parameters: {'model_type': 'mlp', 'hidden_dims': '[512, 128]', 'dropout': 0.12230830294512429, 'batch_norm': True, 'lr': 0.0007363956932283031, 'weight_decay': 3.010844476839969e-07, 'epochs': 238, 'loss': 'mse', 'optimizer': 'adam', 'graph_mode': 'off', 'use_snp_selection': False}. Best is trial 90 with value: 0.09879922542512554.
[I 2025-12-05 16:34:50,298] Trial 112 finished with value: 0.06893458476095432 and parameters: {'model_type': 'mlp', 'hidden_dims': '[512, 128]', 'dropout': 0.3038319990238486, 'batch_norm': True, 'lr': 0.0006672297024829344, 'weight_decay': 3.431345890492627e-07, 'epochs': 219, 'loss': 'mse', 'optimizer': 'adam', 'graph_mode': 'off', 'use_snp_selection': False}. Best is trial 90 with value: 0.09879922542512554.
[I 2025-12-05 16:34:51,812] Trial 113 finished with value: 0.05608307836106677 and parameters: {'model_type': 'mlp', 'hidden_dims': '[512, 128]', 'dropout': 0.11011404958301622, 'batch_norm': True, 'lr': 0.000436042642503192, 'weight_decay': 5.758292066923942e-07, 'epochs': 228, 'loss': 'mse', 'optimizer': 'adam', 'graph_mode': 'off', 'use_snp_selection': False}. Best is trial 90 with value: 0.09879922542512554.
[I 2025-12-05 16:34:53,274] Trial 114 finished with value: 0.0752464495126083 and parameters: {'model_type': 'mlp', 'hidden_dims': '[512, 128]', 'dropout': 0.11654374958170613, 'batch_norm': True, 'lr': 0.0005509768852413156, 'weight_decay': 2.6575279747962467e-07, 'epochs': 214, 'loss': 'mse', 'optimizer': 'adam', 'graph_mode': 'off', 'use_snp_selection': False}. Best is trial 90 with value: 0.09879922542512554.
[I 2025-12-05 16:34:54,388] Trial 115 finished with value: 0.06380810211251191 and parameters: {'model_type': 'mlp', 'hidden_dims': '[256, 128]', 'dropout': 0.10322541528893639, 'batch_norm': True, 'lr': 0.0007047990137778202, 'weight_decay': 1.6962262463654258e-07, 'epochs': 257, 'loss': 'mse', 'optimizer': 'adam', 'graph_mode': 'off', 'use_snp_selection': False}. Best is trial 90 with value: 0.09879922542512554.
[I 2025-12-05 16:34:56,110] Trial 116 finished with value: 0.08451652977254606 and parameters: {'model_type': 'mlp', 'hidden_dims': '[512, 128]', 'dropout': 0.12390149806663875, 'batch_norm': True, 'lr': 0.0008526624322416486, 'weight_decay': 4.175904211414615e-07, 'epochs': 295, 'loss': 'mse', 'optimizer': 'adam', 'graph_mode': 'off', 'use_snp_selection': False}. Best is trial 90 with value: 0.09879922542512554.
[I 2025-12-05 16:34:57,754] Trial 117 finished with value: 0.06626236236176636 and parameters: {'model_type': 'mlp', 'hidden_dims': '[512, 128]', 'dropout': 0.13667712052936834, 'batch_norm': True, 'lr': 0.00039271899251728496, 'weight_decay': 2.514991516938105e-07, 'epochs': 273, 'loss': 'mse', 'optimizer': 'adam', 'graph_mode': 'off', 'use_snp_selection': False}. Best is trial 90 with value: 0.09879922542512554.
[I 2025-12-05 16:34:59,424] Trial 118 finished with value: 0.031548943360369085 and parameters: {'model_type': 'mlp', 'hidden_dims': '[512, 128]', 'dropout': 0.10008907377096228, 'batch_norm': False, 'lr': 0.0004707985580790451, 'weight_decay': 8.676392570142782e-07, 'epochs': 288, 'loss': 'mse', 'optimizer': 'adam', 'graph_mode': 'off', 'use_snp_selection': False}. Best is trial 90 with value: 0.09879922542512554.
[I 2025-12-05 16:35:00,955] Trial 119 finished with value: 0.05504839250506542 and parameters: {'model_type': 'mlp', 'hidden_dims': '[512, 64]', 'dropout': 0.15128294940885734, 'batch_norm': True, 'lr': 5.664861839852395e-05, 'weight_decay': 1.2553746155688544e-07, 'epochs': 235, 'loss': 'mse', 'optimizer': 'adam', 'graph_mode': 'off', 'use_snp_selection': False}. Best is trial 90 with value: 0.09879922542512554.
[I 2025-12-05 16:35:01,929] Trial 120 finished with value: 0.07100027529726213 and parameters: {'model_type': 'mlp', 'hidden_dims': '[128, 64]', 'dropout': 0.1168207530567595, 'batch_norm': True, 'lr': 0.00016291986212903733, 'weight_decay': 1.4628814691964238e-06, 'epochs': 265, 'loss': 'mse', 'optimizer': 'adam', 'graph_mode': 'off', 'use_snp_selection': False}. Best is trial 90 with value: 0.09879922542512554.
[I 2025-12-05 16:35:03,669] Trial 121 finished with value: 0.08127540407238376 and parameters: {'model_type': 'mlp', 'hidden_dims': '[512, 256]', 'dropout': 0.11005875257366195, 'batch_norm': True, 'lr': 0.00031194137426417893, 'weight_decay': 2.1103501034841712e-07, 'epochs': 301, 'loss': 'mae', 'optimizer': 'adam', 'graph_mode': 'off', 'use_snp_selection': False}. Best is trial 90 with value: 0.09879922542512554.
[I 2025-12-05 16:35:05,482] Trial 122 finished with value: 0.09201213598629476 and parameters: {'model_type': 'mlp', 'hidden_dims': '[512, 256]', 'dropout': 0.1289819862305575, 'batch_norm': True, 'lr': 0.00025119632468899067, 'weight_decay': 3.207601698481742e-07, 'epochs': 326, 'loss': 'mae', 'optimizer': 'adam', 'graph_mode': 'off', 'use_snp_selection': False}. Best is trial 90 with value: 0.09879922542512554.
[I 2025-12-05 16:35:07,299] Trial 123 finished with value: 0.08031745469318187 and parameters: {'model_type': 'mlp', 'hidden_dims': '[512, 256]', 'dropout': 0.13285133364803672, 'batch_norm': True, 'lr': 0.000206932575202112, 'weight_decay': 3.099961337591595e-05, 'epochs': 324, 'loss': 'mae', 'optimizer': 'adam', 'graph_mode': 'off', 'use_snp_selection': False}. Best is trial 90 with value: 0.09879922542512554.
[I 2025-12-05 16:35:08,961] Trial 124 finished with value: 0.08544557199944648 and parameters: {'model_type': 'mlp', 'hidden_dims': '[512, 128]', 'dropout': 0.12527667749464852, 'batch_norm': True, 'lr': 0.0002715544125912086, 'weight_decay': 3.2246278122698394e-07, 'epochs': 276, 'loss': 'mae', 'optimizer': 'adam', 'graph_mode': 'off', 'use_snp_selection': False}. Best is trial 90 with value: 0.09879922542512554.
[I 2025-12-05 16:35:10,259] Trial 125 finished with value: 0.07570342608582833 and parameters: {'model_type': 'mlp', 'hidden_dims': '[512, 256]', 'dropout': 0.17406639869932794, 'batch_norm': True, 'lr': 0.0002280308612148776, 'weight_decay': 1.0323024095012726e-06, 'epochs': 163, 'loss': 'mae', 'optimizer': 'adam', 'graph_mode': 'off', 'use_snp_selection': False}. Best is trial 90 with value: 0.09879922542512554.
[I 2025-12-05 16:35:12,766] Trial 126 finished with value: 0.08624559119444178 and parameters: {'model_type': 'mlp', 'hidden_dims': '[256, 128, 64]', 'dropout': 0.14512861661306858, 'batch_norm': True, 'lr': 0.0002467744525534675, 'weight_decay': 1.7123010575378067e-07, 'epochs': 281, 'loss': 'mae', 'optimizer': 'adam', 'graph_mode': 'off', 'use_snp_selection': True, 'num_snps': 45612}. Best is trial 90 with value: 0.09879922542512554.
[I 2025-12-05 16:35:15,223] Trial 127 finished with value: 0.07171911750416052 and parameters: {'model_type': 'mlp', 'hidden_dims': '[256, 128, 64]', 'dropout': 0.15706199164156467, 'batch_norm': True, 'lr': 0.00024889387981881993, 'weight_decay': 6.608796469645241e-07, 'epochs': 280, 'loss': 'mae', 'optimizer': 'adam', 'graph_mode': 'off', 'use_snp_selection': True, 'num_snps': 47499}. Best is trial 90 with value: 0.09879922542512554.
[I 2025-12-05 16:35:17,283] Trial 128 finished with value: 0.02705358384668653 and parameters: {'model_type': 'mlp', 'hidden_dims': '[256, 128, 64]', 'dropout': 0.14112449341624048, 'batch_norm': True, 'lr': 8.574503474929173e-06, 'weight_decay': 5.171846334928793e-07, 'epochs': 289, 'loss': 'mae', 'optimizer': 'adam', 'graph_mode': 'off', 'use_snp_selection': True, 'num_snps': 35882}. Best is trial 90 with value: 0.09879922542512554.
[I 2025-12-05 16:35:19,500] Trial 129 finished with value: 0.06893847563259359 and parameters: {'model_type': 'mlp', 'hidden_dims': '[256, 128, 64]', 'dropout': 0.1961084494097676, 'batch_norm': True, 'lr': 0.00013878629678265578, 'weight_decay': 2.403283716833412e-07, 'epochs': 276, 'loss': 'mae', 'optimizer': 'adam', 'graph_mode': 'off', 'use_snp_selection': True, 'num_snps': 41332}. Best is trial 90 with value: 0.09879922542512554.
[I 2025-12-05 16:35:22,041] Trial 130 finished with value: 0.06830118763680937 and parameters: {'model_type': 'mlp', 'hidden_dims': '[256, 128, 64]', 'dropout': 0.12788637407681222, 'batch_norm': True, 'lr': 0.00017848011459693026, 'weight_decay': 1.7046470334801277e-07, 'epochs': 294, 'loss': 'mae', 'optimizer': 'adam', 'graph_mode': 'off', 'use_snp_selection': True, 'num_snps': 45078}. Best is trial 90 with value: 0.09879922542512554.
[I 2025-12-05 16:35:24,655] Trial 131 finished with value: 0.06706392851660992 and parameters: {'model_type': 'mlp', 'hidden_dims': '[512, 64]', 'dropout': 0.10897793774370788, 'batch_norm': True, 'lr': 0.00027859630942477436, 'weight_decay': 1.006707584282483e-07, 'epochs': 268, 'loss': 'mae', 'optimizer': 'adam', 'graph_mode': 'off', 'use_snp_selection': True, 'num_snps': 42866}. Best is trial 90 with value: 0.09879922542512554.
[I 2025-12-05 16:35:26,428] Trial 132 finished with value: 0.10842070088520533 and parameters: {'model_type': 'mlp', 'hidden_dims': '[512, 128]', 'dropout': 0.12304242149977081, 'batch_norm': True, 'lr': 0.0003398874058722973, 'weight_decay': 1.4928574517943237e-07, 'epochs': 310, 'loss': 'mae', 'optimizer': 'adam', 'graph_mode': 'off', 'use_snp_selection': False}. Best is trial 132 with value: 0.10842070088520533.
[I 2025-12-05 16:35:28,185] Trial 133 finished with value: 0.0996120744109703 and parameters: {'model_type': 'mlp', 'hidden_dims': '[512, 128]', 'dropout': 0.14665359953342103, 'batch_norm': True, 'lr': 0.0003483647135697708, 'weight_decay': 1.4763318622922334e-07, 'epochs': 312, 'loss': 'mae', 'optimizer': 'adam', 'graph_mode': 'off', 'use_snp_selection': False}. Best is trial 132 with value: 0.10842070088520533.
[I 2025-12-05 16:35:31,401] Trial 134 finished with value: 0.09557187535334626 and parameters: {'model_type': 'mlp', 'hidden_dims': '[512, 128]', 'dropout': 0.1466844055235192, 'batch_norm': True, 'lr': 0.00034217979597856216, 'weight_decay': 1.4366813494145147e-07, 'epochs': 337, 'loss': 'mae', 'optimizer': 'adam', 'graph_mode': 'off', 'use_snp_selection': True, 'num_snps': 54206}. Best is trial 132 with value: 0.10842070088520533.
[I 2025-12-05 16:35:34,686] Trial 135 finished with value: 0.06672782114370204 and parameters: {'model_type': 'mlp', 'hidden_dims': '[512, 128]', 'dropout': 0.187879949593667, 'batch_norm': True, 'lr': 0.00034887716776861767, 'weight_decay': 1.3704825154021195e-07, 'epochs': 337, 'loss': 'mae', 'optimizer': 'adam', 'graph_mode': 'off', 'use_snp_selection': True, 'num_snps': 54691}. Best is trial 132 with value: 0.10842070088520533.
[I 2025-12-05 16:35:37,542] Trial 136 finished with value: 0.06639853541443472 and parameters: {'model_type': 'mlp', 'hidden_dims': '[512, 128]', 'dropout': 0.16319321154543387, 'batch_norm': True, 'lr': 0.00032983112128419595, 'weight_decay': 1.6778846644133015e-07, 'epochs': 314, 'loss': 'mae', 'optimizer': 'adam', 'graph_mode': 'off', 'use_snp_selection': True, 'num_snps': 49990}. Best is trial 132 with value: 0.10842070088520533.
[I 2025-12-05 16:35:40,940] Trial 137 finished with value: 0.06387060726281626 and parameters: {'model_type': 'mlp', 'hidden_dims': '[512, 128]', 'dropout': 0.14878712849871245, 'batch_norm': True, 'lr': 0.00039781607956393286, 'weight_decay': 2.0004972037780916e-07, 'epochs': 329, 'loss': 'mae', 'optimizer': 'adam', 'graph_mode': 'off', 'use_snp_selection': True, 'num_snps': 59873}. Best is trial 132 with value: 0.10842070088520533.
[I 2025-12-05 16:35:44,190] Trial 138 finished with value: 0.06735914012530365 and parameters: {'model_type': 'mlp', 'hidden_dims': '[512, 128]', 'dropout': 0.14278894565658995, 'batch_norm': True, 'lr': 0.0002181078390425607, 'weight_decay': 1.1774584422200839e-07, 'epochs': 344, 'loss': 'mae', 'optimizer': 'adam', 'graph_mode': 'off', 'use_snp_selection': True, 'num_snps': 55450}. Best is trial 132 with value: 0.10842070088520533.
[I 2025-12-05 16:35:46,780] Trial 139 finished with value: 0.07763029039216827 and parameters: {'model_type': 'mlp', 'hidden_dims': '[512, 128]', 'dropout': 0.13495031126820356, 'batch_norm': True, 'lr': 0.0002966312634874366, 'weight_decay': 1.4732185260514344e-07, 'epochs': 309, 'loss': 'mae', 'optimizer': 'adam', 'graph_mode': 'off', 'use_snp_selection': True, 'num_snps': 45559}. Best is trial 132 with value: 0.10842070088520533.
[I 2025-12-05 16:35:48,712] Trial 140 finished with value: 0.05724327745930017 and parameters: {'model_type': 'mlp', 'hidden_dims': '[256, 128, 64]', 'dropout': 0.1727064197825614, 'batch_norm': False, 'lr': 0.0001101756067822185, 'weight_decay': 6.986468405408151e-06, 'epochs': 320, 'loss': 'mae', 'optimizer': 'adam', 'graph_mode': 'off', 'use_snp_selection': True, 'num_snps': 35209}. Best is trial 132 with value: 0.10842070088520533.
[I 2025-12-05 16:35:50,471] Trial 141 finished with value: 0.07393059185265617 and parameters: {'model_type': 'mlp', 'hidden_dims': '[512, 64]', 'dropout': 0.11742636394835673, 'batch_norm': True, 'lr': 0.0005087545136576416, 'weight_decay': 2.3186527973249016e-07, 'epochs': 303, 'loss': 'mae', 'optimizer': 'adam', 'graph_mode': 'off', 'use_snp_selection': False}. Best is trial 132 with value: 0.10842070088520533.
[I 2025-12-05 16:35:52,307] Trial 142 finished with value: 0.06168194335239428 and parameters: {'model_type': 'mlp', 'hidden_dims': '[512, 128]', 'dropout': 0.10981445834447827, 'batch_norm': True, 'lr': 0.0006061530930237814, 'weight_decay': 1.4727387836308285e-07, 'epochs': 325, 'loss': 'mae', 'optimizer': 'adam', 'graph_mode': 'off', 'use_snp_selection': False}. Best is trial 132 with value: 0.10842070088520533.
[I 2025-12-05 16:35:54,012] Trial 143 finished with value: 0.08793195178744792 and parameters: {'model_type': 'mlp', 'hidden_dims': '[512, 64]', 'dropout': 0.10002515257182605, 'batch_norm': True, 'lr': 0.0004248002213872003, 'weight_decay': 1.8397768603022273e-07, 'epochs': 284, 'loss': 'mae', 'optimizer': 'adam', 'graph_mode': 'off', 'use_snp_selection': False}. Best is trial 132 with value: 0.10842070088520533.
[I 2025-12-05 16:35:55,177] Trial 144 finished with value: 0.06619503105792486 and parameters: {'model_type': 'mlp', 'hidden_dims': '[256, 128]', 'dropout': 0.127710439703572, 'batch_norm': True, 'lr': 0.0003741836814470832, 'weight_decay': 9.528376824109572e-06, 'epochs': 286, 'loss': 'mae', 'optimizer': 'adam', 'graph_mode': 'off', 'use_snp_selection': False}. Best is trial 132 with value: 0.10842070088520533.
[I 2025-12-05 16:35:56,890] Trial 145 finished with value: -0.0003582866282651021 and parameters: {'model_type': 'mlp', 'hidden_dims': '[512, 128]', 'dropout': 0.14911051485105087, 'batch_norm': True, 'lr': 2.6741799409323544e-06, 'weight_decay': 1.9255573075136028e-07, 'epochs': 294, 'loss': 'mae', 'optimizer': 'adam', 'graph_mode': 'off', 'use_snp_selection': False}. Best is trial 132 with value: 0.10842070088520533.
[I 2025-12-05 16:35:59,615] Trial 146 finished with value: 0.07718309048139411 and parameters: {'model_type': 'mlp', 'hidden_dims': '[512, 64]', 'dropout': 0.11913126457942964, 'batch_norm': True, 'lr': 0.00043772024901445777, 'weight_decay': 1.191759820321295e-07, 'epochs': 315, 'loss': 'mae', 'optimizer': 'adam', 'graph_mode': 'off', 'use_snp_selection': True, 'num_snps': 49225}. Best is trial 132 with value: 0.10842070088520533.
[I 2025-12-05 16:36:01,472] Trial 147 finished with value: 0.06998797673628915 and parameters: {'model_type': 'mlp', 'hidden_dims': '[512, 256]', 'dropout': 0.15839410415642285, 'batch_norm': True, 'lr': 0.00025246963257357833, 'weight_decay': 1.971137237061849e-06, 'epochs': 337, 'loss': 'mae', 'optimizer': 'adam', 'graph_mode': 'off', 'use_snp_selection': False}. Best is trial 132 with value: 0.10842070088520533.
[I 2025-12-05 16:36:03,252] Trial 148 finished with value: 0.08943433278458174 and parameters: {'model_type': 'mlp', 'hidden_dims': '[512, 128]', 'dropout': 0.1377972051534864, 'batch_norm': True, 'lr': 0.00032231320408702843, 'weight_decay': 1.0054743982341072e-07, 'epochs': 306, 'loss': 'mae', 'optimizer': 'adam', 'graph_mode': 'off', 'use_snp_selection': False}. Best is trial 132 with value: 0.10842070088520533.
