[I 2025-12-05 14:25:10,812] Trial 101 finished with value: 0.10308042328252034 and parameters: {'model_type': 'mlp', 'hidden_dims': '[256, 128, 64]', 'dropout': 0.19310206370802432, 'batch_norm': True, 'lr': 0.0006730054349824984, 'weight_decay': 4.1947241257179494e-05, 'epochs': 195, 'loss': 'mse', 'optimizer': 'adam', 'graph_mode': 'off', 'use_snp_selection': True, 'num_snps': 5935}. Best is trial 60 with value: 0.11999688278480873.
[I 2025-12-05 14:25:11,877] Trial 102 finished with value: 0.11636377648025184 and parameters: {'model_type': 'mlp', 'hidden_dims': '[256, 128]', 'dropout': 0.16974396231286873, 'batch_norm': True, 'lr': 0.0007674564749067473, 'weight_decay': 1.9155634695517154e-05, 'epochs': 181, 'loss': 'mse', 'optimizer': 'adam', 'graph_mode': 'off', 'use_snp_selection': True, 'num_snps': 13213}. Best is trial 60 with value: 0.11999688278480873.
[I 2025-12-05 14:25:12,923] Trial 103 finished with value: 0.09883473275986003 and parameters: {'model_type': 'mlp', 'hidden_dims': '[256, 128]', 'dropout': 0.15951291516969068, 'batch_norm': True, 'lr': 0.0008217844065389622, 'weight_decay': 2.538561752049782e-05, 'epochs': 179, 'loss': 'mse', 'optimizer': 'adam', 'graph_mode': 'off', 'use_snp_selection': True, 'num_snps': 12397}. Best is trial 60 with value: 0.11999688278480873.
[I 2025-12-05 14:25:13,977] Trial 104 finished with value: 0.10590195744888717 and parameters: {'model_type': 'mlp', 'hidden_dims': '[256, 128]', 'dropout': 0.17539058476890054, 'batch_norm': True, 'lr': 0.000737570650267792, 'weight_decay': 2.0465827851799653e-05, 'epochs': 158, 'loss': 'mse', 'optimizer': 'adam', 'graph_mode': 'off', 'use_snp_selection': True, 'num_snps': 13855}. Best is trial 60 with value: 0.11999688278480873.
[I 2025-12-05 14:25:15,111] Trial 105 finished with value: 0.10557173197473535 and parameters: {'model_type': 'mlp', 'hidden_dims': '[256, 128]', 'dropout': 0.24104125905788096, 'batch_norm': True, 'lr': 0.0005875714143144181, 'weight_decay': 2.760682867716117e-07, 'epochs': 167, 'loss': 'mse', 'optimizer': 'adam', 'graph_mode': 'off', 'use_snp_selection': True, 'num_snps': 15820}. Best is trial 60 with value: 0.11999688278480873.
[I 2025-12-05 14:25:16,160] Trial 106 finished with value: 0.08745146808870584 and parameters: {'model_type': 'mlp', 'hidden_dims': '[256, 128]', 'dropout': 0.14495966738288216, 'batch_norm': True, 'lr': 0.0004954025951354398, 'weight_decay': 0.0005211783740169302, 'epochs': 266, 'loss': 'mse', 'optimizer': 'adam', 'graph_mode': 'off', 'use_snp_selection': False}. Best is trial 60 with value: 0.11999688278480873.
[I 2025-12-05 14:25:17,667] Trial 107 finished with value: 0.09380155488116576 and parameters: {'model_type': 'mlp', 'hidden_dims': '[128, 64]', 'dropout': 0.21128336607429635, 'batch_norm': True, 'lr': 0.0003431223087669981, 'weight_decay': 1.4097360829138636e-05, 'epochs': 182, 'loss': 'mae', 'optimizer': 'adam', 'graph_mode': 'off', 'use_snp_selection': True, 'num_snps': 28148}. Best is trial 60 with value: 0.11999688278480873.
[I 2025-12-05 14:25:19,210] Trial 108 finished with value: 0.11250530078251919 and parameters: {'model_type': 'mlp', 'hidden_dims': '[256, 128]', 'dropout': 0.16474801372125097, 'batch_norm': True, 'lr': 0.0009238893549517824, 'weight_decay': 1.8307326350288677e-05, 'epochs': 246, 'loss': 'mse', 'optimizer': 'adam', 'graph_mode': 'off', 'use_snp_selection': True, 'num_snps': 26242}. Best is trial 60 with value: 0.11999688278480873.
[I 2025-12-05 14:25:20,787] Trial 109 finished with value: 0.10987827018589683 and parameters: {'model_type': 'mlp', 'hidden_dims': '[512, 128]', 'dropout': 0.4281076335287226, 'batch_norm': True, 'lr': 0.0009127995662250826, 'weight_decay': 1.7815688630446325e-05, 'epochs': 226, 'loss': 'mse', 'optimizer': 'adam', 'graph_mode': 'off', 'use_snp_selection': True, 'num_snps': 26671}. Best is trial 60 with value: 0.11999688278480873.
[I 2025-12-05 14:25:22,193] Trial 110 finished with value: 0.09569866922808117 and parameters: {'model_type': 'mlp', 'hidden_dims': '[512, 64]', 'dropout': 0.38165919487204847, 'batch_norm': True, 'lr': 0.0007272935183881889, 'weight_decay': 2.980321155633578e-05, 'epochs': 238, 'loss': 'mse', 'optimizer': 'adam', 'graph_mode': 'off', 'use_snp_selection': True, 'num_snps': 20911}. Best is trial 60 with value: 0.11999688278480873.
[I 2025-12-05 14:25:23,710] Trial 111 finished with value: 0.1009759723299714 and parameters: {'model_type': 'mlp', 'hidden_dims': '[256, 128]', 'dropout': 0.1688821479886158, 'batch_norm': True, 'lr': 0.0006285718669372488, 'weight_decay': 4.433753900810156e-05, 'epochs': 250, 'loss': 'mse', 'optimizer': 'adam', 'graph_mode': 'off', 'use_snp_selection': True, 'num_snps': 25181}. Best is trial 60 with value: 0.11999688278480873.
[I 2025-12-05 14:25:25,423] Trial 112 finished with value: 0.10675342527627177 and parameters: {'model_type': 'mlp', 'hidden_dims': '[256, 128]', 'dropout': 0.18688306105445526, 'batch_norm': True, 'lr': 0.0008512033352368021, 'weight_decay': 1.8558925122816997e-05, 'epochs': 257, 'loss': 'mse', 'optimizer': 'adam', 'graph_mode': 'off', 'use_snp_selection': True, 'num_snps': 31038}. Best is trial 60 with value: 0.11999688278480873.
[I 2025-12-05 14:25:26,515] Trial 113 finished with value: 0.10487158499169152 and parameters: {'model_type': 'mlp', 'hidden_dims': '[256, 128]', 'dropout': 0.4492874874993124, 'batch_norm': True, 'lr': 0.00043534038408850453, 'weight_decay': 2.1604087697472602e-07, 'epochs': 270, 'loss': 'mse', 'optimizer': 'adam', 'graph_mode': 'off', 'use_snp_selection': True, 'num_snps': 10480}. Best is trial 60 with value: 0.11999688278480873.
[I 2025-12-05 14:25:27,840] Trial 114 finished with value: 0.09960988113180748 and parameters: {'model_type': 'mlp', 'hidden_dims': '[256, 128]', 'dropout': 0.13439001991797306, 'batch_norm': True, 'lr': 0.0005124924807340565, 'weight_decay': 1.6077345475998227e-07, 'epochs': 279, 'loss': 'mse', 'optimizer': 'adam', 'graph_mode': 'off', 'use_snp_selection': True, 'num_snps': 17442}. Best is trial 60 with value: 0.11999688278480873.
[I 2025-12-05 14:25:29,527] Trial 115 finished with value: 0.07302876247006813 and parameters: {'model_type': 'mlp', 'hidden_dims': '[512, 256]', 'dropout': 0.15082520028336865, 'batch_norm': True, 'lr': 2.2735418180387164e-05, 'weight_decay': 2.6403551965993333e-05, 'epochs': 246, 'loss': 'mae', 'optimizer': 'adam', 'graph_mode': 'off', 'use_snp_selection': True, 'num_snps': 28884}. Best is trial 60 with value: 0.11999688278480873.
[I 2025-12-05 14:25:31,342] Trial 116 finished with value: 0.08889027091114723 and parameters: {'model_type': 'mlp', 'hidden_dims': '[128, 64]', 'dropout': 0.3307115925989013, 'batch_norm': True, 'lr': 0.0009857849290889563, 'weight_decay': 1.6267286078274628e-06, 'epochs': 201, 'loss': 'mse', 'optimizer': 'adam', 'graph_mode': 'off', 'use_snp_selection': True, 'num_snps': 38085}. Best is trial 60 with value: 0.11999688278480873.
[I 2025-12-05 14:25:33,051] Trial 117 finished with value: 0.10225535528751 and parameters: {'model_type': 'mlp', 'hidden_dims': '[256, 128]', 'dropout': 0.11068296008710654, 'batch_norm': True, 'lr': 0.0007397185325065609, 'weight_decay': 6.330344856814864e-05, 'epochs': 212, 'loss': 'mae', 'optimizer': 'adam', 'graph_mode': 'off', 'use_snp_selection': True, 'num_snps': 32885}. Best is trial 60 with value: 0.11999688278480873.
[I 2025-12-05 14:25:34,182] Trial 118 finished with value: 0.02354271891650929 and parameters: {'model_type': 'mlp', 'hidden_dims': '[128, 64]', 'dropout': 0.20418299131480594, 'batch_norm': True, 'lr': 2.3732095640054574e-06, 'weight_decay': 0.00040186860839836884, 'epochs': 220, 'loss': 'mse', 'optimizer': 'adam', 'graph_mode': 'off', 'use_snp_selection': True, 'num_snps': 13858}. Best is trial 60 with value: 0.11999688278480873.
[I 2025-12-05 14:25:35,563] Trial 119 finished with value: 0.11294144923671036 and parameters: {'model_type': 'mlp', 'hidden_dims': '[256, 128, 64]', 'dropout': 0.140019470097237, 'batch_norm': False, 'lr': 0.0006099388248349311, 'weight_decay': 0.00010098330920756148, 'epochs': 192, 'loss': 'mse', 'optimizer': 'adam', 'graph_mode': 'off', 'use_snp_selection': True, 'num_snps': 23562}. Best is trial 60 with value: 0.11999688278480873.
[I 2025-12-05 14:25:36,904] Trial 120 finished with value: 0.05004584799123088 and parameters: {'model_type': 'mlp', 'hidden_dims': '[256, 128, 64]', 'dropout': 0.47727791279227094, 'batch_norm': False, 'lr': 0.00059394753183409, 'weight_decay': 0.0001017697334118203, 'epochs': 192, 'loss': 'mse', 'optimizer': 'adam', 'graph_mode': 'off', 'use_snp_selection': True, 'num_snps': 22287}. Best is trial 60 with value: 0.11999688278480873.
[I 2025-12-05 14:25:37,883] Trial 121 finished with value: 0.11753740649932617 and parameters: {'model_type': 'mlp', 'hidden_dims': '[256, 128, 64]', 'dropout': 0.16333899564910032, 'batch_norm': True, 'lr': 0.0007245445496858281, 'weight_decay': 0.00016918605705324588, 'epochs': 173, 'loss': 'mse', 'optimizer': 'adam', 'graph_mode': 'off', 'use_snp_selection': True, 'num_snps': 8904}. Best is trial 60 with value: 0.11999688278480873.
[I 2025-12-05 14:25:38,786] Trial 122 finished with value: 0.10908505691396023 and parameters: {'model_type': 'mlp', 'hidden_dims': '[256, 128, 64]', 'dropout': 0.16856809911487317, 'batch_norm': False, 'lr': 0.0007974300620424156, 'weight_decay': 0.00015898308132859974, 'epochs': 177, 'loss': 'mse', 'optimizer': 'adam', 'graph_mode': 'off', 'use_snp_selection': True, 'num_snps': 8665}. Best is trial 60 with value: 0.11999688278480873.
[I 2025-12-05 14:25:40,132] Trial 123 finished with value: 0.09682409960703563 and parameters: {'model_type': 'mlp', 'hidden_dims': '[256, 128, 64]', 'dropout': 0.1604167150166516, 'batch_norm': False, 'lr': 0.0006713197990512958, 'weight_decay': 0.00010242015123599265, 'epochs': 169, 'loss': 'mse', 'optimizer': 'adam', 'graph_mode': 'off', 'use_snp_selection': True, 'num_snps': 23717}. Best is trial 60 with value: 0.11999688278480873.
[I 2025-12-05 14:25:41,343] Trial 124 finished with value: 0.10200326639426738 and parameters: {'model_type': 'mlp', 'hidden_dims': '[256, 128, 64]', 'dropout': 0.14094070277625081, 'batch_norm': False, 'lr': 0.0008828844272649616, 'weight_decay': 5.166613385193021e-05, 'epochs': 162, 'loss': 'mse', 'optimizer': 'adam', 'graph_mode': 'off', 'use_snp_selection': True, 'num_snps': 19182}. Best is trial 60 with value: 0.11999688278480873.
[I 2025-12-05 14:25:42,259] Trial 125 finished with value: 0.07083703484114262 and parameters: {'model_type': 'mlp', 'hidden_dims': '[256, 128, 64]', 'dropout': 0.356960538291815, 'batch_norm': False, 'lr': 0.0005527182614682865, 'weight_decay': 7.856396085295464e-05, 'epochs': 185, 'loss': 'mse', 'optimizer': 'adam', 'graph_mode': 'off', 'use_snp_selection': False}. Best is trial 60 with value: 0.11999688278480873.
[I 2025-12-05 14:25:43,760] Trial 126 finished with value: 0.0904283815109505 and parameters: {'model_type': 'mlp', 'hidden_dims': '[256, 128, 64]', 'dropout': 0.18504070987195897, 'batch_norm': True, 'lr': 0.00039555981205615813, 'weight_decay': 0.00025439644533484956, 'epochs': 198, 'loss': 'mse', 'optimizer': 'adam', 'graph_mode': 'off', 'use_snp_selection': True, 'num_snps': 24985}. Best is trial 60 with value: 0.11999688278480873.
[I 2025-12-05 14:25:45,265] Trial 127 finished with value: 0.08663272015991737 and parameters: {'model_type': 'mlp', 'hidden_dims': '[256, 128, 64]', 'dropout': 0.5812212100755676, 'batch_norm': True, 'lr': 0.0006589923919699643, 'weight_decay': 3.7111584367550075e-05, 'epochs': 152, 'loss': 'mse', 'optimizer': 'adam', 'graph_mode': 'off', 'use_snp_selection': True, 'num_snps': 27498}. Best is trial 60 with value: 0.11999688278480873.
[I 2025-12-05 14:25:46,311] Trial 128 finished with value: 0.09831848589174164 and parameters: {'model_type': 'mlp', 'hidden_dims': '[256, 128, 64]', 'dropout': 0.12504248618716463, 'batch_norm': True, 'lr': 0.0007460654013411007, 'weight_decay': 0.0004539296227936736, 'epochs': 172, 'loss': 'mse', 'optimizer': 'adam', 'graph_mode': 'off', 'use_snp_selection': True, 'num_snps': 10864}. Best is trial 60 with value: 0.11999688278480873.
[I 2025-12-05 14:25:47,603] Trial 129 finished with value: 0.06914858349680236 and parameters: {'model_type': 'mlp', 'hidden_dims': '[128, 64]', 'dropout': 0.4090601291882183, 'batch_norm': False, 'lr': 1.1440370192628683e-05, 'weight_decay': 0.00058988464053363, 'epochs': 103, 'loss': 'mse', 'optimizer': 'adam', 'graph_mode': 'off', 'use_snp_selection': True, 'num_snps': 25949}. Best is trial 60 with value: 0.11999688278480873.
[I 2025-12-05 14:25:49,909] Trial 130 finished with value: 0.09403032628665868 and parameters: {'model_type': 'mlp', 'hidden_dims': '[256, 128, 64]', 'dropout': 0.1543210649555616, 'batch_norm': True, 'lr': 0.0004749183011999772, 'weight_decay': 0.0003155446490990055, 'epochs': 180, 'loss': 'mse', 'optimizer': 'adam', 'graph_mode': 'off', 'use_snp_selection': True, 'num_snps': 51672}. Best is trial 60 with value: 0.11999688278480873.
[I 2025-12-05 14:25:50,839] Trial 131 finished with value: 0.11495428871521213 and parameters: {'model_type': 'mlp', 'hidden_dims': '[256, 128]', 'dropout': 0.19502666519111123, 'batch_norm': True, 'lr': 0.0005886698682035288, 'weight_decay': 0.0006615366294527213, 'epochs': 284, 'loss': 'mae', 'optimizer': 'adam', 'graph_mode': 'off', 'use_snp_selection': True, 'num_snps': 3354}. Best is trial 60 with value: 0.11999688278480873.
[I 2025-12-05 14:25:51,785] Trial 132 finished with value: 0.1085994196322916 and parameters: {'model_type': 'mlp', 'hidden_dims': '[128, 64]', 'dropout': 0.18899182745042298, 'batch_norm': True, 'lr': 0.0006050881348760138, 'weight_decay': 0.0006620856811493955, 'epochs': 190, 'loss': 'mae', 'optimizer': 'adam', 'graph_mode': 'off', 'use_snp_selection': True, 'num_snps': 8819}. Best is trial 60 with value: 0.11999688278480873.
[I 2025-12-05 14:25:52,795] Trial 133 finished with value: 0.1106784386633646 and parameters: {'model_type': 'mlp', 'hidden_dims': '[256, 128, 64]', 'dropout': 0.2627731093979811, 'batch_norm': True, 'lr': 0.0009727647228088681, 'weight_decay': 0.0008340917247717498, 'epochs': 206, 'loss': 'mae', 'optimizer': 'adam', 'graph_mode': 'off', 'use_snp_selection': True, 'num_snps': 7580}. Best is trial 60 with value: 0.11999688278480873.
[I 2025-12-05 14:25:54,488] Trial 134 finished with value: 0.07392096518473408 and parameters: {'model_type': 'mlp', 'hidden_dims': '[256, 128]', 'dropout': 0.19992436015089157, 'batch_norm': True, 'lr': 5.544977522705523e-05, 'weight_decay': 0.0007975312005538685, 'epochs': 260, 'loss': 'mse', 'optimizer': 'adam', 'graph_mode': 'off', 'use_snp_selection': True, 'num_snps': 30283}. Best is trial 60 with value: 0.11999688278480873.
[I 2025-12-05 14:25:55,572] Trial 135 finished with value: 0.09745492749086335 and parameters: {'model_type': 'mlp', 'hidden_dims': '[256, 128, 64]', 'dropout': 0.21976156787105575, 'batch_norm': True, 'lr': 0.0007670166806227508, 'weight_decay': 1.4308220803171441e-05, 'epochs': 174, 'loss': 'mae', 'optimizer': 'adam', 'graph_mode': 'off', 'use_snp_selection': True, 'num_snps': 12140}. Best is trial 60 with value: 0.11999688278480873.
[I 2025-12-05 14:25:56,793] Trial 136 finished with value: 0.10569831542055708 and parameters: {'model_type': 'mlp', 'hidden_dims': '[128, 64]', 'dropout': 0.1763633988193144, 'batch_norm': True, 'lr': 0.0005264779978112442, 'weight_decay': 0.00019626122548012278, 'epochs': 128, 'loss': 'mse', 'optimizer': 'adam', 'graph_mode': 'off', 'use_snp_selection': True, 'num_snps': 21244}. Best is trial 60 with value: 0.11999688278480873.
[I 2025-12-05 14:25:57,922] Trial 137 finished with value: 0.09902544504549445 and parameters: {'model_type': 'mlp', 'hidden_dims': '[512, 64]', 'dropout': 0.5021629048119179, 'batch_norm': True, 'lr': 0.0004215591145034049, 'weight_decay': 6.1965276671347e-05, 'epochs': 163, 'loss': 'mse', 'optimizer': 'adam', 'graph_mode': 'off', 'use_snp_selection': True, 'num_snps': 15179}. Best is trial 60 with value: 0.11999688278480873.
[I 2025-12-05 14:25:59,305] Trial 138 finished with value: 0.09848242838341507 and parameters: {'model_type': 'mlp', 'hidden_dims': '[256, 128, 64]', 'dropout': 0.16619558990911593, 'batch_norm': True, 'lr': 0.0008380149056823492, 'weight_decay': 0.00011984540426367655, 'epochs': 156, 'loss': 'mae', 'optimizer': 'adam', 'graph_mode': 'off', 'use_snp_selection': True, 'num_snps': 22887}. Best is trial 60 with value: 0.11999688278480873.
[I 2025-12-05 14:26:01,647] Trial 139 finished with value: 0.09465331036826617 and parameters: {'model_type': 'mlp', 'hidden_dims': '[512, 128]', 'dropout': 0.5285493256853909, 'batch_norm': True, 'lr': 0.000685237478803406, 'weight_decay': 0.0005663922680036741, 'epochs': 295, 'loss': 'mse', 'optimizer': 'adam', 'graph_mode': 'off', 'use_snp_selection': True, 'num_snps': 41845}. Best is trial 60 with value: 0.11999688278480873.
[I 2025-12-05 14:26:03,153] Trial 140 finished with value: 0.09182558625755438 and parameters: {'model_type': 'mlp', 'hidden_dims': '[128, 64]', 'dropout': 0.32218402146663394, 'batch_norm': True, 'lr': 0.0003587147156093811, 'weight_decay': 9.939267751977156e-06, 'epochs': 184, 'loss': 'mae', 'optimizer': 'adam', 'graph_mode': 'off', 'use_snp_selection': True, 'num_snps': 28186}. Best is trial 60 with value: 0.11999688278480873.
[I 2025-12-05 14:26:04,180] Trial 141 finished with value: 0.10550237742376162 and parameters: {'model_type': 'mlp', 'hidden_dims': '[256, 128, 64]', 'dropout': 0.2875751645952651, 'batch_norm': True, 'lr': 0.000998598240569129, 'weight_decay': 0.0009375739816262151, 'epochs': 210, 'loss': 'mae', 'optimizer': 'adam', 'graph_mode': 'off', 'use_snp_selection': True, 'num_snps': 7940}. Best is trial 60 with value: 0.11999688278480873.
[I 2025-12-05 14:26:05,199] Trial 142 finished with value: 0.11098539607906963 and parameters: {'model_type': 'mlp', 'hidden_dims': '[256, 128, 64]', 'dropout': 0.25953312066095097, 'batch_norm': True, 'lr': 0.0008805112860344308, 'weight_decay': 0.0007912519411187706, 'epochs': 282, 'loss': 'mae', 'optimizer': 'adam', 'graph_mode': 'off', 'use_snp_selection': True, 'num_snps': 3344}. Best is trial 60 with value: 0.11999688278480873.
[I 2025-12-05 14:26:06,307] Trial 143 finished with value: 0.0947819807080294 and parameters: {'model_type': 'mlp', 'hidden_dims': '[256, 128, 64]', 'dropout': 0.3045480778831181, 'batch_norm': True, 'lr': 0.0005901532975449688, 'weight_decay': 0.0006460467518486772, 'epochs': 282, 'loss': 'mae', 'optimizer': 'adam', 'graph_mode': 'off', 'use_snp_selection': True, 'num_snps': 6502}. Best is trial 60 with value: 0.11999688278480873.
[I 2025-12-05 14:26:07,375] Trial 144 finished with value: 0.0992248419555031 and parameters: {'model_type': 'mlp', 'hidden_dims': '[256, 128, 64]', 'dropout': 0.23269063044208882, 'batch_norm': True, 'lr': 0.0008702212145537346, 'weight_decay': 0.0003830746640261023, 'epochs': 311, 'loss': 'mae', 'optimizer': 'adam', 'graph_mode': 'off', 'use_snp_selection': True, 'num_snps': 2999}. Best is trial 60 with value: 0.11999688278480873.
[I 2025-12-05 14:26:08,312] Trial 145 finished with value: 0.1176314492524627 and parameters: {'model_type': 'mlp', 'hidden_dims': '[256, 128]', 'dropout': 0.2463739173242218, 'batch_norm': True, 'lr': 0.0006995582113275988, 'weight_decay': 0.0007600698050217714, 'epochs': 272, 'loss': 'mae', 'optimizer': 'adam', 'graph_mode': 'off', 'use_snp_selection': True, 'num_snps': 4344}. Best is trial 60 with value: 0.11999688278480873.
[I 2025-12-05 14:26:09,206] Trial 146 finished with value: 0.09460163533786572 and parameters: {'model_type': 'mlp', 'hidden_dims': '[256, 128]', 'dropout': 0.2457816832528696, 'batch_norm': True, 'lr': 0.0007043460539051154, 'weight_decay': 0.000493265349785633, 'epochs': 286, 'loss': 'mae', 'optimizer': 'adam', 'graph_mode': 'off', 'use_snp_selection': True, 'num_snps': 2106}. Best is trial 60 with value: 0.11999688278480873.
[I 2025-12-05 14:26:10,263] Trial 147 finished with value: 0.09882354192451036 and parameters: {'model_type': 'mlp', 'hidden_dims': '[256, 128]', 'dropout': 0.2864484883127954, 'batch_norm': True, 'lr': 0.0007834360859541616, 'weight_decay': 0.0008072929551407334, 'epochs': 266, 'loss': 'mse', 'optimizer': 'adam', 'graph_mode': 'off', 'use_snp_selection': False}. Best is trial 60 with value: 0.11999688278480873.
[I 2025-12-05 14:26:11,111] Trial 148 finished with value: 0.10003367367670989 and parameters: {'model_type': 'mlp', 'hidden_dims': '[256, 128]', 'dropout': 0.3485344244935612, 'batch_norm': True, 'lr': 0.0004900273797241545, 'weight_decay': 0.0001474899994771866, 'epochs': 194, 'loss': 'mae', 'optimizer': 'adam', 'graph_mode': 'off', 'use_snp_selection': True, 'num_snps': 4929}. Best is trial 60 with value: 0.11999688278480873.
[I 2025-12-05 14:26:12,014] Trial 149 finished with value: 0.11774769933802023 and parameters: {'model_type': 'mlp', 'hidden_dims': '[256, 128]', 'dropout': 0.26704656429475726, 'batch_norm': True, 'lr': 0.0006319774214523362, 'weight_decay': 0.0005886758115596466, 'epochs': 272, 'loss': 'mse', 'optimizer': 'adam', 'graph_mode': 'off', 'use_snp_selection': True, 'num_snps': 3427}. Best is trial 60 with value: 0.11999688278480873.
[I 2025-12-05 14:26:14,327] Trial 0 finished with value: 0.029891606562086597 and parameters: {'model_type': 'mlp', 'hidden_dims': '[128, 64]', 'dropout': 0.199031432379812, 'batch_norm': True, 'lr': 1.8408544111075837e-06, 'weight_decay': 5.5136510071208614e-05, 'epochs': 336, 'loss': 'mae', 'optimizer': 'adam', 'graph_mode': 'off', 'use_snp_selection': True, 'num_snps': 43862}. Best is trial 0 with value: 0.029891606562086597.
