[I 2025-12-06 12:29:14,723] Trial 146 finished with value: 0.226398093234433 and parameters: {'model_type': 'mlp', 'hidden_dims': '[512, 128]', 'dropout': 0.12819094447351947, 'batch_norm': False, 'lr': 4.91156618768604e-05, 'weight_decay': 0.00020654041596651938, 'epochs': 76, 'loss': 'mse', 'optimizer': 'adam', 'graph_mode': 'off', 'use_snp_selection': False}. Best is trial 122 with value: 0.22987141000414538.
[I 2025-12-06 12:29:42,722] Trial 147 finished with value: 0.22443134904457834 and parameters: {'model_type': 'mlp', 'hidden_dims': '[512, 128]', 'dropout': 0.11101260858986173, 'batch_norm': False, 'lr': 5.2261847867818916e-05, 'weight_decay': 0.00028087484038423103, 'epochs': 75, 'loss': 'mse', 'optimizer': 'adam', 'graph_mode': 'off', 'use_snp_selection': False}. Best is trial 122 with value: 0.22987141000414538.
[I 2025-12-06 12:30:12,269] Trial 148 finished with value: 0.21964190588519988 and parameters: {'model_type': 'mlp', 'hidden_dims': '[512, 128]', 'dropout': 0.12085014937713402, 'batch_norm': False, 'lr': 2.4761753484877958e-05, 'weight_decay': 0.00014186037620599087, 'epochs': 80, 'loss': 'mse', 'optimizer': 'adam', 'graph_mode': 'off', 'use_snp_selection': False}. Best is trial 122 with value: 0.22987141000414538.
[I 2025-12-06 12:30:38,872] Trial 149 finished with value: 0.2197213976205358 and parameters: {'model_type': 'mlp', 'hidden_dims': '[512, 128]', 'dropout': 0.1317174537604036, 'batch_norm': False, 'lr': 4.783652215777787e-05, 'weight_decay': 0.00024177483483956986, 'epochs': 70, 'loss': 'mse', 'optimizer': 'adam', 'graph_mode': 'off', 'use_snp_selection': False}. Best is trial 122 with value: 0.22987141000414538.
[I 2025-12-06 12:31:42,659] Trial 0 finished with value: 0.15031762334128626 and parameters: {'model_type': 'mlp', 'hidden_dims': '[128, 64]', 'dropout': 0.199031432379812, 'batch_norm': True, 'lr': 1.8408544111075837e-06, 'weight_decay': 5.5136510071208614e-05, 'epochs': 336, 'loss': 'mae', 'optimizer': 'adam', 'graph_mode': 'off', 'use_snp_selection': True, 'num_snps': 43862}. Best is trial 0 with value: 0.15031762334128626.
[I 2025-12-06 12:32:23,351] Trial 1 finished with value: 0.19413275479003886 and parameters: {'model_type': 'mlp', 'hidden_dims': '[256, 128]', 'dropout': 0.4370668075331726, 'batch_norm': True, 'lr': 7.133471581159139e-05, 'weight_decay': 1.128633586803549e-05, 'epochs': 242, 'loss': 'mae', 'optimizer': 'adam', 'graph_mode': 'off', 'use_snp_selection': False}. Best is trial 1 with value: 0.19413275479003886.
[I 2025-12-06 12:33:00,109] Trial 2 finished with value: 0.18036802724467718 and parameters: {'model_type': 'mlp', 'hidden_dims': '[256, 128, 64]', 'dropout': 0.41314357415569625, 'batch_norm': False, 'lr': 3.952233718592101e-06, 'weight_decay': 0.00026754769258252603, 'epochs': 149, 'loss': 'mse', 'optimizer': 'adam', 'graph_mode': 'off', 'use_snp_selection': True, 'num_snps': 11571}. Best is trial 1 with value: 0.19413275479003886.
[I 2025-12-06 12:34:35,780] Trial 3 finished with value: 0.201839095315063 and parameters: {'model_type': 'mlp', 'hidden_dims': '[512, 64]', 'dropout': 0.5938127374509361, 'batch_norm': False, 'lr': 5.67704586114731e-06, 'weight_decay': 2.4518087630137052e-05, 'epochs': 320, 'loss': 'mae', 'optimizer': 'adam', 'graph_mode': 'off', 'use_snp_selection': False}. Best is trial 3 with value: 0.201839095315063.
[I 2025-12-06 12:36:01,358] Trial 4 finished with value: 0.17811129731299769 and parameters: {'model_type': 'mlp', 'hidden_dims': '[512, 128]', 'dropout': 0.25746343592134413, 'batch_norm': True, 'lr': 1.3467657668402788e-06, 'weight_decay': 0.00033087251918647806, 'epochs': 277, 'loss': 'mse', 'optimizer': 'adam', 'graph_mode': 'off', 'use_snp_selection': True, 'num_snps': 36675}. Best is trial 3 with value: 0.201839095315063.
[I 2025-12-06 12:37:01,047] Trial 5 finished with value: 0.14719538887661926 and parameters: {'model_type': 'mlp', 'hidden_dims': '[512, 64]', 'dropout': 0.38275350994408375, 'batch_norm': True, 'lr': 1.5586664309232824e-06, 'weight_decay': 0.0008227664668621182, 'epochs': 145, 'loss': 'mae', 'optimizer': 'adam', 'graph_mode': 'off', 'use_snp_selection': True, 'num_snps': 32148}. Best is trial 3 with value: 0.201839095315063.
[I 2025-12-06 12:37:34,785] Trial 6 finished with value: 0.19244658048982516 and parameters: {'model_type': 'mlp', 'hidden_dims': '[256, 128]', 'dropout': 0.3930109900265879, 'batch_norm': False, 'lr': 4.892964372128395e-05, 'weight_decay': 1.5809549317992182e-06, 'epochs': 199, 'loss': 'mse', 'optimizer': 'adam', 'graph_mode': 'off', 'use_snp_selection': False}. Best is trial 3 with value: 0.201839095315063.
[I 2025-12-06 12:38:09,520] Trial 7 finished with value: 0.19429403145256627 and parameters: {'model_type': 'mlp', 'hidden_dims': '[512, 256]', 'dropout': 0.15343979219678458, 'batch_norm': True, 'lr': 6.234003099047341e-05, 'weight_decay': 3.894760610535477e-07, 'epochs': 97, 'loss': 'mse', 'optimizer': 'adam', 'graph_mode': 'off', 'use_snp_selection': False}. Best is trial 3 with value: 0.201839095315063.
[I 2025-12-06 12:39:45,360] Trial 8 finished with value: 0.19374262197969722 and parameters: {'model_type': 'mlp', 'hidden_dims': '[512, 128]', 'dropout': 0.10743001231661406, 'batch_norm': True, 'lr': 0.00023728538449271062, 'weight_decay': 1.7629071578048637e-05, 'epochs': 312, 'loss': 'mae', 'optimizer': 'adam', 'graph_mode': 'off', 'use_snp_selection': False}. Best is trial 3 with value: 0.201839095315063.
[I 2025-12-06 12:40:42,309] Trial 9 finished with value: 0.19628671482573995 and parameters: {'model_type': 'mlp', 'hidden_dims': '[512, 64]', 'dropout': 0.14505336736221927, 'batch_norm': True, 'lr': 5.8619638388111826e-05, 'weight_decay': 6.200156172669308e-07, 'epochs': 175, 'loss': 'mse', 'optimizer': 'adam', 'graph_mode': 'off', 'use_snp_selection': False}. Best is trial 3 with value: 0.201839095315063.
[I 2025-12-06 12:41:05,104] Trial 10 finished with value: 0.2027088302488369 and parameters: {'model_type': 'mlp', 'hidden_dims': '[512, 64]', 'dropout': 0.5885461262002587, 'batch_norm': False, 'lr': 8.769366258768696e-06, 'weight_decay': 2.78273193871783e-06, 'epochs': 55, 'loss': 'mae', 'optimizer': 'adam', 'graph_mode': 'off', 'use_snp_selection': False}. Best is trial 10 with value: 0.2027088302488369.
[I 2025-12-06 12:41:33,929] Trial 11 finished with value: 0.20648818693456575 and parameters: {'model_type': 'mlp', 'hidden_dims': '[512, 64]', 'dropout': 0.583942291816117, 'batch_norm': False, 'lr': 1.1821335968986158e-05, 'weight_decay': 4.061640528568547e-06, 'epochs': 77, 'loss': 'mae', 'optimizer': 'adam', 'graph_mode': 'off', 'use_snp_selection': False}. Best is trial 11 with value: 0.20648818693456575.
[I 2025-12-06 12:41:52,492] Trial 12 finished with value: 0.16682753789441168 and parameters: {'model_type': 'mlp', 'hidden_dims': '[512, 64]', 'dropout': 0.5928626416900284, 'batch_norm': False, 'lr': 1.223742348275826e-05, 'weight_decay': 1.8994153527272504e-06, 'epochs': 40, 'loss': 'mae', 'optimizer': 'adam', 'graph_mode': 'off', 'use_snp_selection': False}. Best is trial 11 with value: 0.20648818693456575.
[I 2025-12-06 12:42:12,936] Trial 13 finished with value: 0.18872153122202642 and parameters: {'model_type': 'mlp', 'hidden_dims': '[512, 64]', 'dropout': 0.5021680908774464, 'batch_norm': False, 'lr': 1.5004807436150273e-05, 'weight_decay': 1.3191035460883088e-07, 'epochs': 47, 'loss': 'mae', 'optimizer': 'adam', 'graph_mode': 'off', 'use_snp_selection': False}. Best is trial 11 with value: 0.20648818693456575.
[I 2025-12-06 12:42:25,432] Trial 14 finished with value: 0.2009955371256329 and parameters: {'model_type': 'mlp', 'hidden_dims': '[128, 64]', 'dropout': 0.5300180653494536, 'batch_norm': False, 'lr': 1.8357807037936876e-05, 'weight_decay': 4.57067734295802e-06, 'epochs': 93, 'loss': 'mae', 'optimizer': 'adam', 'graph_mode': 'off', 'use_snp_selection': False}. Best is trial 11 with value: 0.20648818693456575.
[I 2025-12-06 12:42:59,863] Trial 15 finished with value: 0.20439628768806067 and parameters: {'model_type': 'mlp', 'hidden_dims': '[512, 256]', 'dropout': 0.29441318675491157, 'batch_norm': False, 'lr': 5.886637310193521e-06, 'weight_decay': 3.2513109021255193e-06, 'epochs': 96, 'loss': 'mae', 'optimizer': 'adam', 'graph_mode': 'off', 'use_snp_selection': False}. Best is trial 11 with value: 0.20648818693456575.
[I 2025-12-06 12:43:34,189] Trial 16 finished with value: 0.20309127874153377 and parameters: {'model_type': 'mlp', 'hidden_dims': '[512, 256]', 'dropout': 0.29858025320781567, 'batch_norm': False, 'lr': 0.00027447990780187626, 'weight_decay': 7.43296899645385e-05, 'epochs': 98, 'loss': 'mae', 'optimizer': 'adam', 'graph_mode': 'off', 'use_snp_selection': False}. Best is trial 11 with value: 0.20648818693456575.
[I 2025-12-06 12:44:09,927] Trial 17 finished with value: 0.188830197129474 and parameters: {'model_type': 'mlp', 'hidden_dims': '[512, 256]', 'dropout': 0.31226206234945486, 'batch_norm': False, 'lr': 0.000906375209920231, 'weight_decay': 7.470963505970814e-06, 'epochs': 103, 'loss': 'mae', 'optimizer': 'adam', 'graph_mode': 'off', 'use_snp_selection': False}. Best is trial 11 with value: 0.20648818693456575.
[I 2025-12-06 12:45:16,228] Trial 18 finished with value: 0.17841055706998832 and parameters: {'model_type': 'mlp', 'hidden_dims': '[256, 128, 64]', 'dropout': 0.4742540956608051, 'batch_norm': False, 'lr': 3.3776721727982097e-06, 'weight_decay': 8.121896330165473e-07, 'epochs': 130, 'loss': 'mae', 'optimizer': 'adam', 'graph_mode': 'off', 'use_snp_selection': True, 'num_snps': 58241}. Best is trial 11 with value: 0.20648818693456575.
[I 2025-12-06 12:46:19,716] Trial 19 finished with value: 0.19776749629979073 and parameters: {'model_type': 'mlp', 'hidden_dims': '[512, 256]', 'dropout': 0.23740597688310255, 'batch_norm': False, 'lr': 3.5020621568431274e-05, 'weight_decay': 1.1354159408743119e-07, 'epochs': 204, 'loss': 'mae', 'optimizer': 'adam', 'graph_mode': 'off', 'use_snp_selection': False}. Best is trial 11 with value: 0.20648818693456575.
[I 2025-12-06 12:46:47,687] Trial 20 finished with value: 0.20362447219791222 and parameters: {'model_type': 'mlp', 'hidden_dims': '[512, 256]', 'dropout': 0.33869787501572735, 'batch_norm': False, 'lr': 2.4947247648563088e-05, 'weight_decay': 3.8395750409020846e-05, 'epochs': 74, 'loss': 'mae', 'optimizer': 'adam', 'graph_mode': 'off', 'use_snp_selection': False}. Best is trial 11 with value: 0.20648818693456575.
[I 2025-12-06 12:47:15,152] Trial 21 finished with value: 0.20446361389579493 and parameters: {'model_type': 'mlp', 'hidden_dims': '[512, 256]', 'dropout': 0.3426036956588672, 'batch_norm': False, 'lr': 2.2690554206364033e-05, 'weight_decay': 4.297056457959928e-05, 'epochs': 72, 'loss': 'mae', 'optimizer': 'adam', 'graph_mode': 'off', 'use_snp_selection': False}. Best is trial 11 with value: 0.20648818693456575.
[I 2025-12-06 12:47:57,761] Trial 22 finished with value: 0.20754549077978232 and parameters: {'model_type': 'mlp', 'hidden_dims': '[512, 256]', 'dropout': 0.28634521810890545, 'batch_norm': False, 'lr': 6.182278737097053e-06, 'weight_decay': 0.00012506009376990192, 'epochs': 125, 'loss': 'mae', 'optimizer': 'adam', 'graph_mode': 'off', 'use_snp_selection': False}. Best is trial 22 with value: 0.20754549077978232.
[I 2025-12-06 12:48:40,462] Trial 23 finished with value: 0.20490234814799418 and parameters: {'model_type': 'mlp', 'hidden_dims': '[512, 256]', 'dropout': 0.35506040873743966, 'batch_norm': False, 'lr': 8.888908708226417e-06, 'weight_decay': 0.00013507241102866957, 'epochs': 125, 'loss': 'mae', 'optimizer': 'adam', 'graph_mode': 'off', 'use_snp_selection': False}. Best is trial 22 with value: 0.20754549077978232.
[I 2025-12-06 12:49:22,336] Trial 24 finished with value: 0.19316315026346859 and parameters: {'model_type': 'mlp', 'hidden_dims': '[512, 256]', 'dropout': 0.530722821412248, 'batch_norm': False, 'lr': 2.892560036841383e-06, 'weight_decay': 0.0001228083001192782, 'epochs': 122, 'loss': 'mae', 'optimizer': 'adam', 'graph_mode': 'off', 'use_snp_selection': False}. Best is trial 22 with value: 0.20754549077978232.
[I 2025-12-06 12:49:53,703] Trial 25 finished with value: 0.20538623015318377 and parameters: {'model_type': 'mlp', 'hidden_dims': '[256, 128, 64]', 'dropout': 0.24117201883992928, 'batch_norm': False, 'lr': 8.458330531253786e-06, 'weight_decay': 0.0001487954267399686, 'epochs': 173, 'loss': 'mae', 'optimizer': 'adam', 'graph_mode': 'off', 'use_snp_selection': False}. Best is trial 22 with value: 0.20754549077978232.
[I 2025-12-06 12:50:25,919] Trial 26 finished with value: 0.17597688330647135 and parameters: {'model_type': 'mlp', 'hidden_dims': '[256, 128, 64]', 'dropout': 0.2342847256891211, 'batch_norm': False, 'lr': 7.5727269535084664e-06, 'weight_decay': 0.0009996035148657446, 'epochs': 170, 'loss': 'mae', 'optimizer': 'adam', 'graph_mode': 'off', 'use_snp_selection': True, 'num_snps': 3842}. Best is trial 22 with value: 0.20754549077978232.
[I 2025-12-06 12:51:05,780] Trial 27 finished with value: 0.21287086712338196 and parameters: {'model_type': 'mlp', 'hidden_dims': '[256, 128, 64]', 'dropout': 0.19468589330748443, 'batch_norm': False, 'lr': 2.9300999334349207e-06, 'weight_decay': 0.00038962858535251704, 'epochs': 235, 'loss': 'mse', 'optimizer': 'adam', 'graph_mode': 'off', 'use_snp_selection': False}. Best is trial 27 with value: 0.21287086712338196.
[I 2025-12-06 12:51:45,545] Trial 28 finished with value: 0.1847684188607222 and parameters: {'model_type': 'mlp', 'hidden_dims': '[256, 128, 64]', 'dropout': 0.18777628018095774, 'batch_norm': False, 'lr': 1.0377152936631524e-06, 'weight_decay': 0.0004401145782559395, 'epochs': 233, 'loss': 'mse', 'optimizer': 'adam', 'graph_mode': 'off', 'use_snp_selection': False}. Best is trial 27 with value: 0.21287086712338196.
[I 2025-12-06 12:52:26,275] Trial 29 finished with value: 0.19531881928246259 and parameters: {'model_type': 'mlp', 'hidden_dims': '[128, 64]', 'dropout': 0.18542973595300155, 'batch_norm': False, 'lr': 2.320440320155318e-06, 'weight_decay': 7.556740997596572e-05, 'epochs': 226, 'loss': 'mse', 'optimizer': 'adam', 'graph_mode': 'off', 'use_snp_selection': True, 'num_snps': 19468}. Best is trial 27 with value: 0.21287086712338196.
[I 2025-12-06 12:53:10,368] Trial 30 finished with value: 0.20019067170279378 and parameters: {'model_type': 'mlp', 'hidden_dims': '[256, 128]', 'dropout': 0.2774277328807753, 'batch_norm': False, 'lr': 4.078672767054688e-06, 'weight_decay': 0.0006349852629122236, 'epochs': 267, 'loss': 'mse', 'optimizer': 'adam', 'graph_mode': 'off', 'use_snp_selection': False}. Best is trial 27 with value: 0.21287086712338196.
[I 2025-12-06 12:53:40,982] Trial 31 finished with value: 0.20327423748405238 and parameters: {'model_type': 'mlp', 'hidden_dims': '[256, 128, 64]', 'dropout': 0.21380730295076197, 'batch_norm': False, 'lr': 1.0591084544714353e-05, 'weight_decay': 0.00020728731508006806, 'epochs': 170, 'loss': 'mse', 'optimizer': 'adam', 'graph_mode': 'off', 'use_snp_selection': False}. Best is trial 27 with value: 0.21287086712338196.
[I 2025-12-06 12:54:14,145] Trial 32 finished with value: 0.21525622059083407 and parameters: {'model_type': 'mlp', 'hidden_dims': '[256, 128, 64]', 'dropout': 0.2504888588744967, 'batch_norm': False, 'lr': 4.7331278378731916e-06, 'weight_decay': 0.0001526912418478671, 'epochs': 187, 'loss': 'mse', 'optimizer': 'adam', 'graph_mode': 'off', 'use_snp_selection': False}. Best is trial 32 with value: 0.21525622059083407.
[I 2025-12-06 12:54:56,973] Trial 33 finished with value: 0.20667951051196054 and parameters: {'model_type': 'mlp', 'hidden_dims': '[256, 128, 64]', 'dropout': 0.26874974291015846, 'batch_norm': False, 'lr': 5.2184155394945965e-06, 'weight_decay': 9.93665231750474e-06, 'epochs': 254, 'loss': 'mse', 'optimizer': 'adam', 'graph_mode': 'off', 'use_snp_selection': False}. Best is trial 32 with value: 0.21525622059083407.
[I 2025-12-06 12:55:44,205] Trial 34 finished with value: 0.20308624714844922 and parameters: {'model_type': 'mlp', 'hidden_dims': '[256, 128, 64]', 'dropout': 0.2665711666781697, 'batch_norm': False, 'lr': 4.7878652876466795e-06, 'weight_decay': 1.4422554525006234e-05, 'epochs': 284, 'loss': 'mse', 'optimizer': 'adam', 'graph_mode': 'off', 'use_snp_selection': False}. Best is trial 32 with value: 0.21525622059083407.
[I 2025-12-06 12:56:26,897] Trial 35 finished with value: 0.1380026356196697 and parameters: {'model_type': 'mlp', 'hidden_dims': '[256, 128, 64]', 'dropout': 0.2054249395648881, 'batch_norm': True, 'lr': 2.1362044614284203e-06, 'weight_decay': 2.6180132204124774e-05, 'epochs': 250, 'loss': 'mse', 'optimizer': 'adam', 'graph_mode': 'off', 'use_snp_selection': False}. Best is trial 32 with value: 0.21525622059083407.
[I 2025-12-06 12:57:44,431] Trial 36 finished with value: 0.19528406009903532 and parameters: {'model_type': 'mlp', 'hidden_dims': '[256, 128, 64]', 'dropout': 0.1576031158143561, 'batch_norm': False, 'lr': 1.66640085392878e-06, 'weight_decay': 0.00036880653882540536, 'epochs': 215, 'loss': 'mse', 'optimizer': 'adam', 'graph_mode': 'off', 'use_snp_selection': True, 'num_snps': 58661}. Best is trial 32 with value: 0.21525622059083407.
[I 2025-12-06 12:58:26,919] Trial 37 finished with value: 0.20957312036971348 and parameters: {'model_type': 'mlp', 'hidden_dims': '[256, 128, 64]', 'dropout': 0.3128949890181601, 'batch_norm': False, 'lr': 3.1014232367136347e-06, 'weight_decay': 1.0138337959448167e-05, 'epochs': 255, 'loss': 'mse', 'optimizer': 'adam', 'graph_mode': 'off', 'use_snp_selection': False}. Best is trial 32 with value: 0.21525622059083407.
[I 2025-12-06 12:59:28,855] Trial 38 finished with value: 0.18070898449196376 and parameters: {'model_type': 'mlp', 'hidden_dims': '[512, 128]', 'dropout': 0.32458517441985946, 'batch_norm': True, 'lr': 2.8482507347880753e-06, 'weight_decay': 0.00022818172517950815, 'epochs': 297, 'loss': 'mse', 'optimizer': 'adam', 'graph_mode': 'off', 'use_snp_selection': True, 'num_snps': 19911}. Best is trial 32 with value: 0.21525622059083407.
[I 2025-12-06 13:00:02,210] Trial 39 finished with value: 0.1593904266294431 and parameters: {'model_type': 'mlp', 'hidden_dims': '[256, 128]', 'dropout': 0.4246116819735686, 'batch_norm': False, 'lr': 1.0287916967398462e-06, 'weight_decay': 7.76748441454136e-05, 'epochs': 192, 'loss': 'mse', 'optimizer': 'adam', 'graph_mode': 'off', 'use_snp_selection': False}. Best is trial 32 with value: 0.21525622059083407.
[I 2025-12-06 13:00:58,988] Trial 40 finished with value: 0.18409222967982433 and parameters: {'model_type': 'mlp', 'hidden_dims': '[256, 128, 64]', 'dropout': 0.3872482326007196, 'batch_norm': True, 'lr': 0.00010299837783030175, 'weight_decay': 0.0006529322237970504, 'epochs': 350, 'loss': 'mse', 'optimizer': 'adam', 'graph_mode': 'off', 'use_snp_selection': False}. Best is trial 32 with value: 0.21525622059083407.
[I 2025-12-06 13:01:40,906] Trial 41 finished with value: 0.20784740454277867 and parameters: {'model_type': 'mlp', 'hidden_dims': '[256, 128, 64]', 'dropout': 0.26994030525005996, 'batch_norm': False, 'lr': 5.50071247907347e-06, 'weight_decay': 7.545336741935823e-06, 'epochs': 248, 'loss': 'mse', 'optimizer': 'adam', 'graph_mode': 'off', 'use_snp_selection': False}. Best is trial 32 with value: 0.21525622059083407.
[I 2025-12-06 13:02:25,519] Trial 42 finished with value: 0.20548685021596405 and parameters: {'model_type': 'mlp', 'hidden_dims': '[256, 128, 64]', 'dropout': 0.3668203050891774, 'batch_norm': False, 'lr': 6.029922412900906e-06, 'weight_decay': 6.146302139218917e-06, 'epochs': 267, 'loss': 'mse', 'optimizer': 'adam', 'graph_mode': 'off', 'use_snp_selection': False}. Best is trial 32 with value: 0.21525622059083407.
[I 2025-12-06 13:03:06,075] Trial 43 finished with value: 0.21221811386535844 and parameters: {'model_type': 'mlp', 'hidden_dims': '[256, 128, 64]', 'dropout': 0.2934101600623826, 'batch_norm': False, 'lr': 3.5430078816181226e-06, 'weight_decay': 2.7656528729506413e-05, 'epochs': 238, 'loss': 'mse', 'optimizer': 'adam', 'graph_mode': 'off', 'use_snp_selection': False}. Best is trial 32 with value: 0.21525622059083407.
[I 2025-12-06 13:03:47,106] Trial 44 finished with value: 0.20200138972415313 and parameters: {'model_type': 'mlp', 'hidden_dims': '[256, 128, 64]', 'dropout': 0.2514255564715513, 'batch_norm': False, 'lr': 1.4932750438633417e-06, 'weight_decay': 2.1952211598165146e-05, 'epochs': 241, 'loss': 'mse', 'optimizer': 'adam', 'graph_mode': 'off', 'use_snp_selection': False}. Best is trial 32 with value: 0.21525622059083407.
[I 2025-12-06 13:04:24,435] Trial 45 finished with value: 0.2092029763405499 and parameters: {'model_type': 'mlp', 'hidden_dims': '[256, 128, 64]', 'dropout': 0.10054061027632255, 'batch_norm': False, 'lr': 2.3515042073976544e-06, 'weight_decay': 9.553496731466921e-06, 'epochs': 215, 'loss': 'mse', 'optimizer': 'adam', 'graph_mode': 'off', 'use_snp_selection': False}. Best is trial 32 with value: 0.21525622059083407.
[I 2025-12-06 13:05:02,115] Trial 46 finished with value: 0.12429540123273249 and parameters: {'model_type': 'mlp', 'hidden_dims': '[256, 128, 64]', 'dropout': 0.11618964128901656, 'batch_norm': True, 'lr': 2.3225235634435304e-06, 'weight_decay': 1.2194879773026234e-05, 'epochs': 216, 'loss': 'mse', 'optimizer': 'adam', 'graph_mode': 'off', 'use_snp_selection': False}. Best is trial 32 with value: 0.21525622059083407.
[I 2025-12-06 13:06:03,256] Trial 47 finished with value: 0.20007396295457638 and parameters: {'model_type': 'mlp', 'hidden_dims': '[512, 128]', 'dropout': 0.12446847795569987, 'batch_norm': False, 'lr': 3.5706877761305867e-06, 'weight_decay': 3.184998275725864e-05, 'epochs': 191, 'loss': 'mse', 'optimizer': 'adam', 'graph_mode': 'off', 'use_snp_selection': False}. Best is trial 32 with value: 0.21525622059083407.
