[I 2025-12-06 13:44:34,991] Trial 100 finished with value: 0.15964369361483613 and parameters: {'model_type': 'mlp', 'hidden_dims': '[512, 64]', 'dropout': 0.22566151671023943, 'batch_norm': True, 'lr': 1.1641627582380277e-06, 'weight_decay': 1.6439351217247527e-07, 'epochs': 238, 'loss': 'mse', 'optimizer': 'adam', 'graph_mode': 'off', 'use_snp_selection': False}. Best is trial 32 with value: 0.21525622059083407.
[I 2025-12-06 13:45:20,025] Trial 101 finished with value: 0.20943742357986223 and parameters: {'model_type': 'mlp', 'hidden_dims': '[256, 128, 64]', 'dropout': 0.24696649745466442, 'batch_norm': False, 'lr': 4.352530177742198e-06, 'weight_decay': 0.0005617971295496318, 'epochs': 269, 'loss': 'mse', 'optimizer': 'adam', 'graph_mode': 'off', 'use_snp_selection': False}. Best is trial 32 with value: 0.21525622059083407.
[I 2025-12-06 13:46:06,334] Trial 102 finished with value: 0.21048992842946554 and parameters: {'model_type': 'mlp', 'hidden_dims': '[256, 128, 64]', 'dropout': 0.29145834799869036, 'batch_norm': False, 'lr': 2.8419569874040707e-06, 'weight_decay': 0.00018599650496365722, 'epochs': 278, 'loss': 'mse', 'optimizer': 'adam', 'graph_mode': 'off', 'use_snp_selection': False}. Best is trial 32 with value: 0.21525622059083407.
[I 2025-12-06 13:46:50,461] Trial 103 finished with value: 0.20907260451407805 and parameters: {'model_type': 'mlp', 'hidden_dims': '[256, 128, 64]', 'dropout': 0.2875867263162785, 'batch_norm': False, 'lr': 3.130493873484419e-06, 'weight_decay': 0.0001755975210488363, 'epochs': 263, 'loss': 'mse', 'optimizer': 'adam', 'graph_mode': 'off', 'use_snp_selection': False}. Best is trial 32 with value: 0.21525622059083407.
[I 2025-12-06 13:47:37,023] Trial 104 finished with value: 0.2095225485119824 and parameters: {'model_type': 'mlp', 'hidden_dims': '[256, 128, 64]', 'dropout': 0.33310007097437455, 'batch_norm': False, 'lr': 2.696688524382007e-06, 'weight_decay': 3.725108222115212e-05, 'epochs': 280, 'loss': 'mse', 'optimizer': 'adam', 'graph_mode': 'off', 'use_snp_selection': False}. Best is trial 32 with value: 0.21525622059083407.
[I 2025-12-06 13:48:49,335] Trial 105 finished with value: 0.21200360577470492 and parameters: {'model_type': 'mlp', 'hidden_dims': '[512, 128]', 'dropout': 0.21896968117604904, 'batch_norm': False, 'lr': 2.0806454074816036e-06, 'weight_decay': 7.089035372144277e-05, 'epochs': 231, 'loss': 'mse', 'optimizer': 'adam', 'graph_mode': 'off', 'use_snp_selection': False}. Best is trial 32 with value: 0.21525622059083407.
[I 2025-12-06 13:50:01,428] Trial 106 finished with value: 0.20513281145489648 and parameters: {'model_type': 'mlp', 'hidden_dims': '[512, 128]', 'dropout': 0.2012637576862745, 'batch_norm': False, 'lr': 2.0677616613147016e-06, 'weight_decay': 6.641302448054897e-05, 'epochs': 230, 'loss': 'mse', 'optimizer': 'adam', 'graph_mode': 'off', 'use_snp_selection': False}. Best is trial 32 with value: 0.21525622059083407.
[I 2025-12-06 13:51:17,447] Trial 107 finished with value: 0.2089003677087927 and parameters: {'model_type': 'mlp', 'hidden_dims': '[512, 128]', 'dropout': 0.3165921550428179, 'batch_norm': False, 'lr': 3.657830954108832e-06, 'weight_decay': 7.876282657808392e-05, 'epochs': 244, 'loss': 'mse', 'optimizer': 'adam', 'graph_mode': 'off', 'use_snp_selection': False}. Best is trial 32 with value: 0.21525622059083407.
[I 2025-12-06 13:52:56,272] Trial 108 finished with value: 0.2081111545318171 and parameters: {'model_type': 'mlp', 'hidden_dims': '[512, 128]', 'dropout': 0.34254370519432326, 'batch_norm': False, 'lr': 1.6319074427899473e-06, 'weight_decay': 1.994068501899835e-06, 'epochs': 325, 'loss': 'mse', 'optimizer': 'adam', 'graph_mode': 'off', 'use_snp_selection': False}. Best is trial 32 with value: 0.21525622059083407.
[I 2025-12-06 13:54:05,336] Trial 109 finished with value: 0.19565537783992168 and parameters: {'model_type': 'mlp', 'hidden_dims': '[512, 128]', 'dropout': 0.2202363872283854, 'batch_norm': False, 'lr': 5.507133192640034e-06, 'weight_decay': 1.9886247709300868e-05, 'epochs': 253, 'loss': 'mae', 'optimizer': 'adam', 'graph_mode': 'off', 'use_snp_selection': True, 'num_snps': 28308}. Best is trial 32 with value: 0.21525622059083407.
[I 2025-12-06 13:54:38,380] Trial 110 finished with value: 0.2056577545130557 and parameters: {'model_type': 'mlp', 'hidden_dims': '[256, 128, 64]', 'dropout': 0.1838143485254146, 'batch_norm': False, 'lr': 6.787730790369732e-06, 'weight_decay': 4.7533795744872685e-05, 'epochs': 188, 'loss': 'mse', 'optimizer': 'adam', 'graph_mode': 'off', 'use_snp_selection': False}. Best is trial 32 with value: 0.21525622059083407.
[I 2025-12-06 13:55:14,814] Trial 111 finished with value: 0.2137315111948804 and parameters: {'model_type': 'mlp', 'hidden_dims': '[256, 128, 64]', 'dropout': 0.2651584774322429, 'batch_norm': False, 'lr': 2.8575173368566764e-06, 'weight_decay': 0.00012106335680898995, 'epochs': 211, 'loss': 'mse', 'optimizer': 'adam', 'graph_mode': 'off', 'use_snp_selection': False}. Best is trial 32 with value: 0.21525622059083407.
[I 2025-12-06 13:55:52,400] Trial 112 finished with value: 0.21500064129779703 and parameters: {'model_type': 'mlp', 'hidden_dims': '[256, 128, 64]', 'dropout': 0.21496740255520191, 'batch_norm': False, 'lr': 2.270040538329504e-06, 'weight_decay': 0.00019481231452078847, 'epochs': 218, 'loss': 'mse', 'optimizer': 'adam', 'graph_mode': 'off', 'use_snp_selection': False}. Best is trial 32 with value: 0.21525622059083407.
[I 2025-12-06 13:56:30,033] Trial 113 finished with value: 0.21462205955095875 and parameters: {'model_type': 'mlp', 'hidden_dims': '[256, 128, 64]', 'dropout': 0.16791096664788616, 'batch_norm': False, 'lr': 2.1535513657224023e-06, 'weight_decay': 0.00020455713180694263, 'epochs': 218, 'loss': 'mse', 'optimizer': 'adam', 'graph_mode': 'off', 'use_snp_selection': False}. Best is trial 32 with value: 0.21525622059083407.
[I 2025-12-06 13:57:06,848] Trial 114 finished with value: 0.21697580777109762 and parameters: {'model_type': 'mlp', 'hidden_dims': '[256, 128, 64]', 'dropout': 0.16920786184321315, 'batch_norm': False, 'lr': 2.082024467415086e-06, 'weight_decay': 0.00011742050525080613, 'epochs': 212, 'loss': 'mse', 'optimizer': 'adam', 'graph_mode': 'off', 'use_snp_selection': False}. Best is trial 114 with value: 0.21697580777109762.
[I 2025-12-06 13:57:44,384] Trial 115 finished with value: 0.21318742717900352 and parameters: {'model_type': 'mlp', 'hidden_dims': '[256, 128, 64]', 'dropout': 0.1629128895968631, 'batch_norm': False, 'lr': 2.120790469332077e-06, 'weight_decay': 0.0001460483750001825, 'epochs': 217, 'loss': 'mse', 'optimizer': 'adam', 'graph_mode': 'off', 'use_snp_selection': False}. Best is trial 114 with value: 0.21697580777109762.
[I 2025-12-06 13:58:22,091] Trial 116 finished with value: 0.2138955491636895 and parameters: {'model_type': 'mlp', 'hidden_dims': '[256, 128, 64]', 'dropout': 0.14586845542113092, 'batch_norm': False, 'lr': 1.7480115751719473e-06, 'weight_decay': 0.00011214056585325285, 'epochs': 218, 'loss': 'mse', 'optimizer': 'adam', 'graph_mode': 'off', 'use_snp_selection': False}. Best is trial 114 with value: 0.21697580777109762.
[I 2025-12-06 13:58:59,209] Trial 117 finished with value: 0.18627841823432198 and parameters: {'model_type': 'mlp', 'hidden_dims': '[256, 128, 64]', 'dropout': 0.13380393889254732, 'batch_norm': False, 'lr': 1.4650020495311766e-06, 'weight_decay': 0.00012886966970159202, 'epochs': 214, 'loss': 'mse', 'optimizer': 'adam', 'graph_mode': 'off', 'use_snp_selection': False}. Best is trial 114 with value: 0.21697580777109762.
[I 2025-12-06 13:59:35,483] Trial 118 finished with value: 0.1915817091926901 and parameters: {'model_type': 'mlp', 'hidden_dims': '[256, 128, 64]', 'dropout': 0.16580431219700165, 'batch_norm': False, 'lr': 1.2505729274759566e-06, 'weight_decay': 0.00015582236561002087, 'epochs': 208, 'loss': 'mse', 'optimizer': 'adam', 'graph_mode': 'off', 'use_snp_selection': False}. Best is trial 114 with value: 0.21697580777109762.
[I 2025-12-06 14:00:13,192] Trial 119 finished with value: 0.20755220725973245 and parameters: {'model_type': 'mlp', 'hidden_dims': '[256, 128, 64]', 'dropout': 0.14704201280844104, 'batch_norm': False, 'lr': 1.751395540916887e-06, 'weight_decay': 0.00022168862282909157, 'epochs': 218, 'loss': 'mse', 'optimizer': 'adam', 'graph_mode': 'off', 'use_snp_selection': False}. Best is trial 114 with value: 0.21697580777109762.
[I 2025-12-06 14:00:48,117] Trial 120 finished with value: 0.2042868089617765 and parameters: {'model_type': 'mlp', 'hidden_dims': '[256, 128, 64]', 'dropout': 0.15923283769997973, 'batch_norm': False, 'lr': 2.2847168596499692e-06, 'weight_decay': 0.00010936584244545027, 'epochs': 199, 'loss': 'mse', 'optimizer': 'adam', 'graph_mode': 'off', 'use_snp_selection': False}. Best is trial 114 with value: 0.21697580777109762.
[I 2025-12-06 14:01:26,594] Trial 121 finished with value: 0.20592692063344967 and parameters: {'model_type': 'mlp', 'hidden_dims': '[256, 128, 64]', 'dropout': 0.16979363806364345, 'batch_norm': False, 'lr': 1.897223990503054e-06, 'weight_decay': 8.39765546170187e-05, 'epochs': 224, 'loss': 'mse', 'optimizer': 'adam', 'graph_mode': 'off', 'use_snp_selection': False}. Best is trial 114 with value: 0.21697580777109762.
[I 2025-12-06 14:02:02,180] Trial 122 finished with value: 0.2104918241934696 and parameters: {'model_type': 'mlp', 'hidden_dims': '[256, 128, 64]', 'dropout': 0.19104899227452857, 'batch_norm': False, 'lr': 3.406159310955216e-06, 'weight_decay': 0.00015589121918966519, 'epochs': 204, 'loss': 'mse', 'optimizer': 'adam', 'graph_mode': 'off', 'use_snp_selection': False}. Best is trial 114 with value: 0.21697580777109762.
[I 2025-12-06 14:02:38,906] Trial 123 finished with value: 0.21234293492316508 and parameters: {'model_type': 'mlp', 'hidden_dims': '[256, 128, 64]', 'dropout': 0.14041558838811521, 'batch_norm': False, 'lr': 2.2043084984891966e-06, 'weight_decay': 0.0001992696346478736, 'epochs': 212, 'loss': 'mse', 'optimizer': 'adam', 'graph_mode': 'off', 'use_snp_selection': False}. Best is trial 114 with value: 0.21697580777109762.
[I 2025-12-06 14:03:15,350] Trial 124 finished with value: 0.2125024537527674 and parameters: {'model_type': 'mlp', 'hidden_dims': '[256, 128, 64]', 'dropout': 0.1124867084250468, 'batch_norm': False, 'lr': 2.3115791421384462e-06, 'weight_decay': 0.00030256002847396337, 'epochs': 210, 'loss': 'mse', 'optimizer': 'adam', 'graph_mode': 'off', 'use_snp_selection': False}. Best is trial 114 with value: 0.21697580777109762.
[I 2025-12-06 14:03:48,345] Trial 125 finished with value: 0.1843738214680272 and parameters: {'model_type': 'mlp', 'hidden_dims': '[256, 128]', 'dropout': 0.11746171802008315, 'batch_norm': False, 'lr': 1.0432616005038638e-06, 'weight_decay': 0.0003071794383509058, 'epochs': 187, 'loss': 'mse', 'optimizer': 'adam', 'graph_mode': 'off', 'use_snp_selection': False}. Best is trial 114 with value: 0.21697580777109762.
[I 2025-12-06 14:04:10,298] Trial 126 finished with value: 0.10209772606082224 and parameters: {'model_type': 'mlp', 'hidden_dims': '[128, 64]', 'dropout': 0.150525905689414, 'batch_norm': True, 'lr': 1.6282428516269808e-06, 'weight_decay': 0.0002628550388426252, 'epochs': 221, 'loss': 'mse', 'optimizer': 'adam', 'graph_mode': 'off', 'use_snp_selection': False}. Best is trial 114 with value: 0.21697580777109762.
[I 2025-12-06 14:04:44,399] Trial 127 finished with value: 0.20161034181290752 and parameters: {'model_type': 'mlp', 'hidden_dims': '[256, 128, 64]', 'dropout': 0.12862293501652772, 'batch_norm': False, 'lr': 1.384179496165949e-06, 'weight_decay': 0.00011871094040445756, 'epochs': 194, 'loss': 'mse', 'optimizer': 'adam', 'graph_mode': 'off', 'use_snp_selection': False}. Best is trial 114 with value: 0.21697580777109762.
[I 2025-12-06 14:05:20,788] Trial 128 finished with value: 0.21782175387328012 and parameters: {'model_type': 'mlp', 'hidden_dims': '[256, 128, 64]', 'dropout': 0.10092455051244442, 'batch_norm': False, 'lr': 2.3648544752916404e-06, 'weight_decay': 0.00022636027432460217, 'epochs': 210, 'loss': 'mse', 'optimizer': 'adam', 'graph_mode': 'off', 'use_snp_selection': False}. Best is trial 128 with value: 0.21782175387328012.
[I 2025-12-06 14:05:57,645] Trial 129 finished with value: 0.1308256225828953 and parameters: {'model_type': 'mlp', 'hidden_dims': '[256, 128, 64]', 'dropout': 0.1022558838030184, 'batch_norm': False, 'lr': 0.0002639070962950361, 'weight_decay': 9.843189286541595e-05, 'epochs': 202, 'loss': 'mse', 'optimizer': 'adam', 'graph_mode': 'off', 'use_snp_selection': True, 'num_snps': 9760}. Best is trial 128 with value: 0.21782175387328012.
[I 2025-12-06 14:07:07,870] Trial 130 finished with value: 0.2032370633594367 and parameters: {'model_type': 'mlp', 'hidden_dims': '[512, 256]', 'dropout': 0.18178921726829855, 'batch_norm': False, 'lr': 1.864901068924354e-06, 'weight_decay': 0.0004134365406485609, 'epochs': 226, 'loss': 'mae', 'optimizer': 'adam', 'graph_mode': 'off', 'use_snp_selection': False}. Best is trial 128 with value: 0.21782175387328012.
[I 2025-12-06 14:07:44,308] Trial 131 finished with value: 0.21124756349056395 and parameters: {'model_type': 'mlp', 'hidden_dims': '[256, 128, 64]', 'dropout': 0.11667570027514479, 'batch_norm': False, 'lr': 2.4547677472190544e-06, 'weight_decay': 0.00022423161168567244, 'epochs': 211, 'loss': 'mse', 'optimizer': 'adam', 'graph_mode': 'off', 'use_snp_selection': False}. Best is trial 128 with value: 0.21782175387328012.
[I 2025-12-06 14:08:21,853] Trial 132 finished with value: 0.20482376222873255 and parameters: {'model_type': 'mlp', 'hidden_dims': '[256, 128, 64]', 'dropout': 0.11285342466375972, 'batch_norm': False, 'lr': 2.4624531911506396e-06, 'weight_decay': 0.00016897346789910967, 'epochs': 218, 'loss': 'mse', 'optimizer': 'adam', 'graph_mode': 'off', 'use_snp_selection': False}. Best is trial 128 with value: 0.21782175387328012.
[I 2025-12-06 14:08:57,980] Trial 133 finished with value: 0.2105586835421735 and parameters: {'model_type': 'mlp', 'hidden_dims': '[256, 128, 64]', 'dropout': 0.17133332652796343, 'batch_norm': False, 'lr': 1.994020255960806e-06, 'weight_decay': 0.00034225139820655325, 'epochs': 208, 'loss': 'mse', 'optimizer': 'adam', 'graph_mode': 'off', 'use_snp_selection': False}. Best is trial 128 with value: 0.21782175387328012.
[I 2025-12-06 14:09:32,592] Trial 134 finished with value: 0.21651238638805975 and parameters: {'model_type': 'mlp', 'hidden_dims': '[256, 128, 64]', 'dropout': 0.12314003829615991, 'batch_norm': False, 'lr': 3.183478297471266e-06, 'weight_decay': 0.0001294812759038499, 'epochs': 197, 'loss': 'mse', 'optimizer': 'adam', 'graph_mode': 'off', 'use_snp_selection': False}. Best is trial 128 with value: 0.21782175387328012.
[I 2025-12-06 14:10:07,449] Trial 135 finished with value: 0.21138244053906283 and parameters: {'model_type': 'mlp', 'hidden_dims': '[256, 128, 64]', 'dropout': 0.1411903355350189, 'batch_norm': False, 'lr': 3.785140025534992e-06, 'weight_decay': 0.00014720542351504242, 'epochs': 198, 'loss': 'mse', 'optimizer': 'adam', 'graph_mode': 'off', 'use_snp_selection': False}. Best is trial 128 with value: 0.21782175387328012.
[I 2025-12-06 14:10:39,064] Trial 136 finished with value: 0.1928104731480798 and parameters: {'model_type': 'mlp', 'hidden_dims': '[256, 128, 64]', 'dropout': 0.15643689414416867, 'batch_norm': False, 'lr': 2.5975622875355255e-05, 'weight_decay': 0.00012448687093402625, 'epochs': 176, 'loss': 'mse', 'optimizer': 'adam', 'graph_mode': 'off', 'use_snp_selection': False}. Best is trial 128 with value: 0.21782175387328012.
[I 2025-12-06 14:11:12,909] Trial 137 finished with value: 0.19707175314126538 and parameters: {'model_type': 'mlp', 'hidden_dims': '[256, 128]', 'dropout': 0.12238421238801372, 'batch_norm': False, 'lr': 3.1460955413464666e-06, 'weight_decay': 0.00020023907902830528, 'epochs': 191, 'loss': 'mse', 'optimizer': 'adam', 'graph_mode': 'off', 'use_snp_selection': False}. Best is trial 128 with value: 0.21782175387328012.
[I 2025-12-06 14:11:49,656] Trial 138 finished with value: 0.1876091811636664 and parameters: {'model_type': 'mlp', 'hidden_dims': '[256, 128, 64]', 'dropout': 0.20563478744972935, 'batch_norm': False, 'lr': 0.00038621018060795514, 'weight_decay': 9.207701139103016e-05, 'epochs': 216, 'loss': 'mse', 'optimizer': 'adam', 'graph_mode': 'off', 'use_snp_selection': False}. Best is trial 128 with value: 0.21782175387328012.
[I 2025-12-06 14:12:11,947] Trial 139 finished with value: 0.19589252512550812 and parameters: {'model_type': 'mlp', 'hidden_dims': '[128, 64]', 'dropout': 0.1911043692093904, 'batch_norm': False, 'lr': 1.5452817676328087e-06, 'weight_decay': 0.00024466728201513353, 'epochs': 226, 'loss': 'mse', 'optimizer': 'adam', 'graph_mode': 'off', 'use_snp_selection': False}. Best is trial 128 with value: 0.21782175387328012.
[I 2025-12-06 14:12:47,207] Trial 140 finished with value: 0.21507807307516077 and parameters: {'model_type': 'mlp', 'hidden_dims': '[256, 128, 64]', 'dropout': 0.12890089765700669, 'batch_norm': False, 'lr': 2.684200577958757e-06, 'weight_decay': 0.00013736539646284454, 'epochs': 200, 'loss': 'mse', 'optimizer': 'adam', 'graph_mode': 'off', 'use_snp_selection': False}. Best is trial 128 with value: 0.21782175387328012.
[I 2025-12-06 14:13:22,887] Trial 141 finished with value: 0.21788235796102784 and parameters: {'model_type': 'mlp', 'hidden_dims': '[256, 128, 64]', 'dropout': 0.12781058210481908, 'batch_norm': False, 'lr': 2.6249899486964536e-06, 'weight_decay': 6.048084977980174e-05, 'epochs': 203, 'loss': 'mse', 'optimizer': 'adam', 'graph_mode': 'off', 'use_snp_selection': False}. Best is trial 141 with value: 0.21788235796102784.
[I 2025-12-06 14:13:55,663] Trial 142 finished with value: 0.20920540834650034 and parameters: {'model_type': 'mlp', 'hidden_dims': '[256, 128, 64]', 'dropout': 0.1049562747177857, 'batch_norm': False, 'lr': 2.629975726019459e-06, 'weight_decay': 5.5805571750132074e-05, 'epochs': 183, 'loss': 'mse', 'optimizer': 'adam', 'graph_mode': 'off', 'use_snp_selection': False}. Best is trial 141 with value: 0.21788235796102784.
[I 2025-12-06 14:14:31,029] Trial 143 finished with value: 0.21547697665257046 and parameters: {'model_type': 'mlp', 'hidden_dims': '[256, 128, 64]', 'dropout': 0.1262350562650593, 'batch_norm': False, 'lr': 1.9981972059999598e-06, 'weight_decay': 0.00013585353947243262, 'epochs': 201, 'loss': 'mse', 'optimizer': 'adam', 'graph_mode': 'off', 'use_snp_selection': False}. Best is trial 141 with value: 0.21788235796102784.
[I 2025-12-06 14:15:06,100] Trial 144 finished with value: 0.21127259872879858 and parameters: {'model_type': 'mlp', 'hidden_dims': '[256, 128, 64]', 'dropout': 0.12827347103659775, 'batch_norm': False, 'lr': 3.0772366007418464e-06, 'weight_decay': 6.164560831944401e-05, 'epochs': 199, 'loss': 'mse', 'optimizer': 'adam', 'graph_mode': 'off', 'use_snp_selection': False}. Best is trial 141 with value: 0.21788235796102784.
[I 2025-12-06 14:15:39,869] Trial 145 finished with value: 0.20635861648247422 and parameters: {'model_type': 'mlp', 'hidden_dims': '[256, 128, 64]', 'dropout': 0.1287170897450528, 'batch_norm': False, 'lr': 1.690884775247285e-06, 'weight_decay': 0.00010626828256036135, 'epochs': 190, 'loss': 'mse', 'optimizer': 'adam', 'graph_mode': 'off', 'use_snp_selection': False}. Best is trial 141 with value: 0.21788235796102784.
[I 2025-12-06 14:16:15,380] Trial 146 finished with value: 0.2051820386660137 and parameters: {'model_type': 'mlp', 'hidden_dims': '[256, 128, 64]', 'dropout': 0.14339610914492398, 'batch_norm': False, 'lr': 4.833814486335016e-06, 'weight_decay': 0.00013375563971791975, 'epochs': 202, 'loss': 'mse', 'optimizer': 'adam', 'graph_mode': 'off', 'use_snp_selection': False}. Best is trial 141 with value: 0.21788235796102784.
[I 2025-12-06 14:16:51,332] Trial 147 finished with value: 0.20518979691492478 and parameters: {'model_type': 'mlp', 'hidden_dims': '[256, 128, 64]', 'dropout': 0.13754065778834912, 'batch_norm': False, 'lr': 4.0797896885545145e-06, 'weight_decay': 7.620299430575923e-05, 'epochs': 205, 'loss': 'mse', 'optimizer': 'adam', 'graph_mode': 'off', 'use_snp_selection': False}. Best is trial 141 with value: 0.21788235796102784.
[I 2025-12-06 14:17:21,880] Trial 148 finished with value: 0.09329716307829775 and parameters: {'model_type': 'mlp', 'hidden_dims': '[256, 128, 64]', 'dropout': 0.10076848911227379, 'batch_norm': True, 'lr': 2.589494432229017e-06, 'weight_decay': 0.00017445380014076184, 'epochs': 166, 'loss': 'mse', 'optimizer': 'adam', 'graph_mode': 'off', 'use_snp_selection': False}. Best is trial 141 with value: 0.21788235796102784.
[I 2025-12-06 14:17:54,039] Trial 149 finished with value: 0.20412730750407135 and parameters: {'model_type': 'mlp', 'hidden_dims': '[256, 128, 64]', 'dropout': 0.40314085623309853, 'batch_norm': False, 'lr': 1.9487366294726544e-06, 'weight_decay': 4.05807348673519e-05, 'epochs': 179, 'loss': 'mse', 'optimizer': 'adam', 'graph_mode': 'off', 'use_snp_selection': False}. Best is trial 141 with value: 0.21788235796102784.
