[I 2025-12-05 22:13:52,646] Trial 71 finished with value: 0.29534460846807625 and parameters: {'model_type': 'mlp', 'hidden_dims': '[512, 128]', 'dropout': 0.5898225736001144, 'batch_norm': False, 'lr': 3.834267576926693e-06, 'weight_decay': 0.0004040362197839665, 'epochs': 208, 'loss': 'mse', 'optimizer': 'adam', 'graph_mode': 'off', 'use_snp_selection': False}. Best is trial 71 with value: 0.29534460846807625.
[I 2025-12-05 22:14:34,727] Trial 72 finished with value: 0.2925605019140155 and parameters: {'model_type': 'mlp', 'hidden_dims': '[512, 128]', 'dropout': 0.591673896739201, 'batch_norm': False, 'lr': 4.139642005077238e-06, 'weight_decay': 0.00041562393834482697, 'epochs': 211, 'loss': 'mse', 'optimizer': 'adam', 'graph_mode': 'off', 'use_snp_selection': False}. Best is trial 71 with value: 0.29534460846807625.
[I 2025-12-05 22:15:14,379] Trial 73 finished with value: 0.28866792528525187 and parameters: {'model_type': 'mlp', 'hidden_dims': '[512, 128]', 'dropout': 0.5502627167969261, 'batch_norm': False, 'lr': 2.8067864367481786e-06, 'weight_decay': 0.00015876436044732893, 'epochs': 197, 'loss': 'mse', 'optimizer': 'adam', 'graph_mode': 'off', 'use_snp_selection': False}. Best is trial 71 with value: 0.29534460846807625.
[I 2025-12-05 22:15:59,437] Trial 74 finished with value: 0.28290186909303033 and parameters: {'model_type': 'mlp', 'hidden_dims': '[512, 128]', 'dropout': 0.5685982861303157, 'batch_norm': False, 'lr': 1.978129862169679e-06, 'weight_decay': 0.0006706181517125967, 'epochs': 228, 'loss': 'mse', 'optimizer': 'adam', 'graph_mode': 'off', 'use_snp_selection': False}. Best is trial 71 with value: 0.29534460846807625.
[I 2025-12-05 22:16:51,089] Trial 75 finished with value: 0.29031371714313836 and parameters: {'model_type': 'mlp', 'hidden_dims': '[512, 128]', 'dropout': 0.3189555922746666, 'batch_norm': False, 'lr': 3.594993233365746e-06, 'weight_decay': 0.0003089458933607635, 'epochs': 265, 'loss': 'mse', 'optimizer': 'adam', 'graph_mode': 'off', 'use_snp_selection': False}. Best is trial 71 with value: 0.29534460846807625.
[I 2025-12-05 22:17:49,395] Trial 76 finished with value: 0.2750612864685951 and parameters: {'model_type': 'mlp', 'hidden_dims': '[512, 64]', 'dropout': 0.10124962183369429, 'batch_norm': False, 'lr': 5.557973306823228e-06, 'weight_decay': 9.67001295424092e-05, 'epochs': 303, 'loss': 'mse', 'optimizer': 'adam', 'graph_mode': 'off', 'use_snp_selection': False}. Best is trial 71 with value: 0.29534460846807625.
[I 2025-12-05 22:18:39,342] Trial 77 finished with value: 0.27931711754848537 and parameters: {'model_type': 'mlp', 'hidden_dims': '[512, 128]', 'dropout': 0.5989808531679571, 'batch_norm': True, 'lr': 2.5058803879550624e-06, 'weight_decay': 0.00013561324847304222, 'epochs': 254, 'loss': 'mse', 'optimizer': 'adam', 'graph_mode': 'off', 'use_snp_selection': False}. Best is trial 71 with value: 0.29534460846807625.
[I 2025-12-05 22:19:20,582] Trial 78 finished with value: 0.2942926713991172 and parameters: {'model_type': 'mlp', 'hidden_dims': '[512, 128]', 'dropout': 0.4876150632434522, 'batch_norm': False, 'lr': 3.075547553007159e-06, 'weight_decay': 0.00023925050248426477, 'epochs': 206, 'loss': 'mse', 'optimizer': 'adam', 'graph_mode': 'off', 'use_snp_selection': False}. Best is trial 71 with value: 0.29534460846807625.
[I 2025-12-05 22:19:34,787] Trial 79 finished with value: 0.28047207317611483 and parameters: {'model_type': 'mlp', 'hidden_dims': '[128, 64]', 'dropout': 0.5300633236151789, 'batch_norm': False, 'lr': 4.430129389022989e-06, 'weight_decay': 0.00022414992438606792, 'epochs': 191, 'loss': 'mse', 'optimizer': 'adam', 'graph_mode': 'off', 'use_snp_selection': False}. Best is trial 71 with value: 0.29534460846807625.
[I 2025-12-05 22:20:15,714] Trial 80 finished with value: 0.26400614859851845 and parameters: {'model_type': 'mlp', 'hidden_dims': '[512, 128]', 'dropout': 0.4880879203415622, 'batch_norm': False, 'lr': 2.089415730764286e-06, 'weight_decay': 0.0004184466655835981, 'epochs': 204, 'loss': 'mae', 'optimizer': 'adam', 'graph_mode': 'off', 'use_snp_selection': False}. Best is trial 71 with value: 0.29534460846807625.
[I 2025-12-05 22:21:03,236] Trial 81 finished with value: 0.29321974257928224 and parameters: {'model_type': 'mlp', 'hidden_dims': '[512, 128]', 'dropout': 0.5883082227576948, 'batch_norm': False, 'lr': 3.3167894380293664e-06, 'weight_decay': 0.000237516676808285, 'epochs': 242, 'loss': 'mse', 'optimizer': 'adam', 'graph_mode': 'off', 'use_snp_selection': False}. Best is trial 71 with value: 0.29534460846807625.
[I 2025-12-05 22:21:46,383] Trial 82 finished with value: 0.2908949428459288 and parameters: {'model_type': 'mlp', 'hidden_dims': '[512, 128]', 'dropout': 0.5567319873534481, 'batch_norm': False, 'lr': 6.319856093393183e-06, 'weight_decay': 0.0006135660314894961, 'epochs': 217, 'loss': 'mse', 'optimizer': 'adam', 'graph_mode': 'off', 'use_snp_selection': False}. Best is trial 71 with value: 0.29534460846807625.
[I 2025-12-05 22:22:31,810] Trial 83 finished with value: 0.29296614003034893 and parameters: {'model_type': 'mlp', 'hidden_dims': '[512, 128]', 'dropout': 0.5699672324301711, 'batch_norm': False, 'lr': 2.920264382322165e-06, 'weight_decay': 9.36630968996816e-05, 'epochs': 230, 'loss': 'mse', 'optimizer': 'adam', 'graph_mode': 'off', 'use_snp_selection': False}. Best is trial 71 with value: 0.29534460846807625.
[I 2025-12-05 22:23:26,370] Trial 84 finished with value: 0.29251952380926255 and parameters: {'model_type': 'mlp', 'hidden_dims': '[512, 128]', 'dropout': 0.539904557519811, 'batch_norm': False, 'lr': 4.766106229297498e-06, 'weight_decay': 0.0009720391894793785, 'epochs': 282, 'loss': 'mse', 'optimizer': 'adam', 'graph_mode': 'off', 'use_snp_selection': False}. Best is trial 71 with value: 0.29534460846807625.
[I 2025-12-05 22:24:18,959] Trial 85 finished with value: 0.28357086618612154 and parameters: {'model_type': 'mlp', 'hidden_dims': '[512, 128]', 'dropout': 0.5874370610012377, 'batch_norm': False, 'lr': 1.8304583670661007e-06, 'weight_decay': 5.910531187212226e-05, 'epochs': 271, 'loss': 'mse', 'optimizer': 'adam', 'graph_mode': 'off', 'use_snp_selection': False}. Best is trial 71 with value: 0.29534460846807625.
[I 2025-12-05 22:25:15,568] Trial 86 finished with value: 0.28433300426182984 and parameters: {'model_type': 'mlp', 'hidden_dims': '[512, 128]', 'dropout': 0.5599375348172263, 'batch_norm': False, 'lr': 7.554041414622111e-06, 'weight_decay': 0.00013605747012666435, 'epochs': 294, 'loss': 'mse', 'optimizer': 'adam', 'graph_mode': 'off', 'use_snp_selection': False}. Best is trial 71 with value: 0.29534460846807625.
[I 2025-12-05 22:25:56,802] Trial 87 finished with value: 0.2921386179130193 and parameters: {'model_type': 'mlp', 'hidden_dims': '[512, 256]', 'dropout': 0.5181536717005174, 'batch_norm': False, 'lr': 3.7683797630891284e-06, 'weight_decay': 0.0002655654888168956, 'epochs': 205, 'loss': 'mse', 'optimizer': 'adam', 'graph_mode': 'off', 'use_snp_selection': False}. Best is trial 71 with value: 0.29534460846807625.
[I 2025-12-05 22:26:47,130] Trial 88 finished with value: 0.268622352471293 and parameters: {'model_type': 'mlp', 'hidden_dims': '[512, 128]', 'dropout': 0.5741985485075095, 'batch_norm': False, 'lr': 0.00010537790745737344, 'weight_decay': 7.666786496477472e-05, 'epochs': 260, 'loss': 'mse', 'optimizer': 'adam', 'graph_mode': 'off', 'use_snp_selection': False}. Best is trial 71 with value: 0.29534460846807625.
[I 2025-12-05 22:27:23,294] Trial 89 finished with value: 0.22108350980231486 and parameters: {'model_type': 'mlp', 'hidden_dims': '[512, 64]', 'dropout': 0.5476122760250023, 'batch_norm': True, 'lr': 1.302810307786642e-06, 'weight_decay': 1.164664515578734e-05, 'epochs': 222, 'loss': 'mse', 'optimizer': 'adam', 'graph_mode': 'off', 'use_snp_selection': True, 'num_snps': 17094}. Best is trial 71 with value: 0.29534460846807625.
[I 2025-12-05 22:28:11,700] Trial 90 finished with value: 0.29220509548946466 and parameters: {'model_type': 'mlp', 'hidden_dims': '[512, 128]', 'dropout': 0.5884156301300314, 'batch_norm': False, 'lr': 5.292548447611297e-06, 'weight_decay': 0.0004467278026411604, 'epochs': 248, 'loss': 'mse', 'optimizer': 'adam', 'graph_mode': 'off', 'use_snp_selection': False}. Best is trial 71 with value: 0.29534460846807625.
[I 2025-12-05 22:28:31,841] Trial 91 finished with value: 0.2766633643923219 and parameters: {'model_type': 'mlp', 'hidden_dims': '[256, 128]', 'dropout': 0.5075375143142191, 'batch_norm': False, 'lr': 2.5368380065804564e-06, 'weight_decay': 3.227553618080317e-05, 'epochs': 170, 'loss': 'mse', 'optimizer': 'adam', 'graph_mode': 'off', 'use_snp_selection': False}. Best is trial 71 with value: 0.29534460846807625.
[I 2025-12-05 22:29:18,139] Trial 92 finished with value: 0.29543700582341237 and parameters: {'model_type': 'mlp', 'hidden_dims': '[512, 128]', 'dropout': 0.531861645158243, 'batch_norm': False, 'lr': 4.091115158928412e-06, 'weight_decay': 6.709931930977733e-06, 'epochs': 235, 'loss': 'mse', 'optimizer': 'adam', 'graph_mode': 'off', 'use_snp_selection': False}. Best is trial 92 with value: 0.29543700582341237.
[I 2025-12-05 22:30:05,946] Trial 93 finished with value: 0.29033718208935155 and parameters: {'model_type': 'mlp', 'hidden_dims': '[512, 128]', 'dropout': 0.5323195997443233, 'batch_norm': False, 'lr': 3.287734799209228e-06, 'weight_decay': 5.413082427467467e-06, 'epochs': 243, 'loss': 'mse', 'optimizer': 'adam', 'graph_mode': 'off', 'use_snp_selection': False}. Best is trial 92 with value: 0.29543700582341237.
[I 2025-12-05 22:30:59,161] Trial 94 finished with value: 0.2919110949331341 and parameters: {'model_type': 'mlp', 'hidden_dims': '[512, 128]', 'dropout': 0.5609796138677627, 'batch_norm': False, 'lr': 4.077241909840838e-06, 'weight_decay': 1.7914697994505173e-05, 'epochs': 274, 'loss': 'mse', 'optimizer': 'adam', 'graph_mode': 'off', 'use_snp_selection': False}. Best is trial 92 with value: 0.29543700582341237.
[I 2025-12-05 22:31:45,330] Trial 95 finished with value: 0.29143928038110567 and parameters: {'model_type': 'mlp', 'hidden_dims': '[512, 128]', 'dropout': 0.5762184864499412, 'batch_norm': False, 'lr': 2.2475049706743883e-06, 'weight_decay': 8.518521842465023e-06, 'epochs': 234, 'loss': 'mse', 'optimizer': 'adam', 'graph_mode': 'off', 'use_snp_selection': False}. Best is trial 92 with value: 0.29543700582341237.
[I 2025-12-05 22:32:34,796] Trial 96 finished with value: 0.2846481039138488 and parameters: {'model_type': 'mlp', 'hidden_dims': '[512, 128]', 'dropout': 0.27591317764907164, 'batch_norm': False, 'lr': 6.088715227950759e-06, 'weight_decay': 0.00018548173848180143, 'epochs': 252, 'loss': 'mse', 'optimizer': 'adam', 'graph_mode': 'off', 'use_snp_selection': False}. Best is trial 92 with value: 0.29543700582341237.
[I 2025-12-05 22:33:12,532] Trial 97 finished with value: 0.2785804024185617 and parameters: {'model_type': 'mlp', 'hidden_dims': '[512, 128]', 'dropout': 0.5436856794791962, 'batch_norm': False, 'lr': 1.5323507222038439e-06, 'weight_decay': 6.720657336332689e-06, 'epochs': 186, 'loss': 'mse', 'optimizer': 'adam', 'graph_mode': 'off', 'use_snp_selection': False}. Best is trial 92 with value: 0.29543700582341237.
[I 2025-12-05 22:34:07,462] Trial 98 finished with value: 0.27688546905033606 and parameters: {'model_type': 'mlp', 'hidden_dims': '[512, 128]', 'dropout': 0.49102857440782993, 'batch_norm': False, 'lr': 1.0911277120501208e-05, 'weight_decay': 5.0861491844181275e-05, 'epochs': 284, 'loss': 'mse', 'optimizer': 'adam', 'graph_mode': 'off', 'use_snp_selection': False}. Best is trial 92 with value: 0.29543700582341237.
[I 2025-12-05 22:34:51,377] Trial 99 finished with value: 0.2888552041583523 and parameters: {'model_type': 'mlp', 'hidden_dims': '[512, 128]', 'dropout': 0.40775153496474137, 'batch_norm': False, 'lr': 4.9008186581947205e-06, 'weight_decay': 9.820086301120307e-06, 'epochs': 221, 'loss': 'mae', 'optimizer': 'adam', 'graph_mode': 'off', 'use_snp_selection': False}. Best is trial 92 with value: 0.29543700582341237.
[I 2025-12-05 22:35:15,188] Trial 100 finished with value: 0.19879897452797027 and parameters: {'model_type': 'mlp', 'hidden_dims': '[128, 64]', 'dropout': 0.5566643479705419, 'batch_norm': False, 'lr': 2.805197059554859e-06, 'weight_decay': 0.00028921226844044653, 'epochs': 212, 'loss': 'mse', 'optimizer': 'adam', 'graph_mode': 'off', 'use_snp_selection': True, 'num_snps': 6413}. Best is trial 92 with value: 0.29543700582341237.
[I 2025-12-05 22:35:43,684] Trial 101 finished with value: 0.2928160648441313 and parameters: {'model_type': 'mlp', 'hidden_dims': '[256, 128]', 'dropout': 0.5067268421177842, 'batch_norm': False, 'lr': 8.101725080262381e-06, 'weight_decay': 1.723580860377998e-05, 'epochs': 262, 'loss': 'mse', 'optimizer': 'adam', 'graph_mode': 'off', 'use_snp_selection': False}. Best is trial 92 with value: 0.29543700582341237.
[I 2025-12-05 22:36:09,627] Trial 102 finished with value: 0.2772462157175202 and parameters: {'model_type': 'mlp', 'hidden_dims': '[256, 128, 64]', 'dropout': 0.5195882119228032, 'batch_norm': False, 'lr': 3.6524216938073336e-06, 'weight_decay': 0.0003583835796223063, 'epochs': 233, 'loss': 'mse', 'optimizer': 'adam', 'graph_mode': 'off', 'use_snp_selection': False}. Best is trial 92 with value: 0.29543700582341237.
[I 2025-12-05 22:37:01,714] Trial 103 finished with value: 0.29606370060269394 and parameters: {'model_type': 'mlp', 'hidden_dims': '[512, 128]', 'dropout': 0.5805803244936568, 'batch_norm': False, 'lr': 4.327375437625842e-06, 'weight_decay': 2.3119548282154145e-05, 'epochs': 268, 'loss': 'mse', 'optimizer': 'adam', 'graph_mode': 'off', 'use_snp_selection': False}. Best is trial 103 with value: 0.29606370060269394.
[I 2025-12-05 22:37:51,582] Trial 104 finished with value: 0.29133966980258325 and parameters: {'model_type': 'mlp', 'hidden_dims': '[512, 128]', 'dropout': 0.5793225828066785, 'batch_norm': False, 'lr': 4.426947188819422e-06, 'weight_decay': 3.513964206360052e-05, 'epochs': 255, 'loss': 'mse', 'optimizer': 'adam', 'graph_mode': 'off', 'use_snp_selection': False}. Best is trial 103 with value: 0.29606370060269394.
[I 2025-12-05 22:38:50,557] Trial 105 finished with value: 0.2918521263129009 and parameters: {'model_type': 'mlp', 'hidden_dims': '[512, 128]', 'dropout': 0.5891047796955138, 'batch_norm': False, 'lr': 3.2705011855281045e-06, 'weight_decay': 2.1567051725554906e-05, 'epochs': 307, 'loss': 'mse', 'optimizer': 'adam', 'graph_mode': 'off', 'use_snp_selection': False}. Best is trial 103 with value: 0.29606370060269394.
[I 2025-12-05 22:39:42,698] Trial 106 finished with value: 0.28991825877955124 and parameters: {'model_type': 'mlp', 'hidden_dims': '[512, 128]', 'dropout': 0.5651460185912313, 'batch_norm': False, 'lr': 2.134886493213384e-06, 'weight_decay': 1.2207075045388102e-05, 'epochs': 268, 'loss': 'mse', 'optimizer': 'adam', 'graph_mode': 'off', 'use_snp_selection': False}. Best is trial 103 with value: 0.29606370060269394.
[I 2025-12-05 22:40:39,433] Trial 107 finished with value: 0.27275881811190106 and parameters: {'model_type': 'mlp', 'hidden_dims': '[512, 128]', 'dropout': 0.5528013163300116, 'batch_norm': True, 'lr': 2.731747899224288e-06, 'weight_decay': 1.3958380410076707e-05, 'epochs': 292, 'loss': 'mse', 'optimizer': 'adam', 'graph_mode': 'off', 'use_snp_selection': False}. Best is trial 103 with value: 0.29606370060269394.
[I 2025-12-05 22:41:27,725] Trial 108 finished with value: 0.29654801718972074 and parameters: {'model_type': 'mlp', 'hidden_dims': '[512, 128]', 'dropout': 0.5925981587038593, 'batch_norm': False, 'lr': 4.006605957088467e-06, 'weight_decay': 0.0005556950516550309, 'epochs': 246, 'loss': 'mse', 'optimizer': 'adam', 'graph_mode': 'off', 'use_snp_selection': False}. Best is trial 108 with value: 0.29654801718972074.
[I 2025-12-05 22:42:21,019] Trial 109 finished with value: 0.281636492352456 and parameters: {'model_type': 'mlp', 'hidden_dims': '[512, 128]', 'dropout': 0.5946854642442997, 'batch_norm': False, 'lr': 0.00042897017711344607, 'weight_decay': 0.0006385641996693911, 'epochs': 277, 'loss': 'mse', 'optimizer': 'adam', 'graph_mode': 'off', 'use_snp_selection': False}. Best is trial 108 with value: 0.29654801718972074.
[I 2025-12-05 22:43:09,476] Trial 110 finished with value: 0.2885974674786385 and parameters: {'model_type': 'mlp', 'hidden_dims': '[512, 256]', 'dropout': 0.5398839620849757, 'batch_norm': False, 'lr': 5.533112273173805e-06, 'weight_decay': 0.000823484292463416, 'epochs': 246, 'loss': 'mse', 'optimizer': 'adam', 'graph_mode': 'off', 'use_snp_selection': False}. Best is trial 108 with value: 0.29654801718972074.
[I 2025-12-05 22:43:56,410] Trial 111 finished with value: 0.2931149753379207 and parameters: {'model_type': 'mlp', 'hidden_dims': '[512, 128]', 'dropout': 0.5722786895054263, 'batch_norm': False, 'lr': 3.754251254607262e-06, 'weight_decay': 0.00020102378540820336, 'epochs': 238, 'loss': 'mse', 'optimizer': 'adam', 'graph_mode': 'off', 'use_snp_selection': False}. Best is trial 108 with value: 0.29654801718972074.
[I 2025-12-05 22:44:46,666] Trial 112 finished with value: 0.29033723734494743 and parameters: {'model_type': 'mlp', 'hidden_dims': '[512, 128]', 'dropout': 0.5763169419994861, 'batch_norm': False, 'lr': 3.1273468652468434e-06, 'weight_decay': 1.2694313958729885e-07, 'epochs': 257, 'loss': 'mse', 'optimizer': 'adam', 'graph_mode': 'off', 'use_snp_selection': False}. Best is trial 108 with value: 0.29654801718972074.
[I 2025-12-05 22:45:31,274] Trial 113 finished with value: 0.2932123151858296 and parameters: {'model_type': 'mlp', 'hidden_dims': '[512, 128]', 'dropout': 0.5991504739767001, 'batch_norm': False, 'lr': 4.249516990764207e-06, 'weight_decay': 0.0005294568851293819, 'epochs': 225, 'loss': 'mse', 'optimizer': 'adam', 'graph_mode': 'off', 'use_snp_selection': False}. Best is trial 108 with value: 0.29654801718972074.
[I 2025-12-05 22:46:26,447] Trial 114 finished with value: 0.2920980009979557 and parameters: {'model_type': 'mlp', 'hidden_dims': '[512, 128]', 'dropout': 0.5828888696418307, 'batch_norm': False, 'lr': 2.3487080106393533e-06, 'weight_decay': 0.00037973971571152827, 'epochs': 285, 'loss': 'mse', 'optimizer': 'adam', 'graph_mode': 'off', 'use_snp_selection': False}. Best is trial 108 with value: 0.29654801718972074.
[I 2025-12-05 22:46:39,250] Trial 115 finished with value: 0.23971112737151318 and parameters: {'model_type': 'mlp', 'hidden_dims': '[512, 128]', 'dropout': 0.1230070204909047, 'batch_norm': False, 'lr': 1.8609333519022053e-06, 'weight_decay': 0.0002481425319522617, 'epochs': 43, 'loss': 'mse', 'optimizer': 'adam', 'graph_mode': 'off', 'use_snp_selection': False}. Best is trial 108 with value: 0.29654801718972074.
[I 2025-12-05 22:47:36,411] Trial 116 finished with value: 0.2869488320549717 and parameters: {'model_type': 'mlp', 'hidden_dims': '[512, 128]', 'dropout': 0.5626150430823604, 'batch_norm': False, 'lr': 7.037217346688147e-06, 'weight_decay': 0.00015889432766369896, 'epochs': 297, 'loss': 'mse', 'optimizer': 'adam', 'graph_mode': 'off', 'use_snp_selection': False}. Best is trial 108 with value: 0.29654801718972074.
[I 2025-12-05 22:48:16,591] Trial 117 finished with value: 0.29578700179871553 and parameters: {'model_type': 'mlp', 'hidden_dims': '[512, 64]', 'dropout': 0.5472158314165552, 'batch_norm': False, 'lr': 5.064454092583746e-06, 'weight_decay': 0.0003110066842366645, 'epochs': 200, 'loss': 'mse', 'optimizer': 'adam', 'graph_mode': 'off', 'use_snp_selection': False}. Best is trial 108 with value: 0.29654801718972074.
[I 2025-12-05 22:49:08,647] Trial 118 finished with value: 0.2878896018831424 and parameters: {'model_type': 'mlp', 'hidden_dims': '[512, 64]', 'dropout': 0.5288126611460351, 'batch_norm': False, 'lr': 5.018107512519558e-06, 'weight_decay': 0.000306513027367885, 'epochs': 268, 'loss': 'mae', 'optimizer': 'adam', 'graph_mode': 'off', 'use_snp_selection': False}. Best is trial 108 with value: 0.29654801718972074.
[I 2025-12-05 22:49:48,458] Trial 119 finished with value: 0.28769865801512157 and parameters: {'model_type': 'mlp', 'hidden_dims': '[512, 64]', 'dropout': 0.5453019230936048, 'batch_norm': False, 'lr': 6.164122592523178e-06, 'weight_decay': 0.0004976819910363397, 'epochs': 206, 'loss': 'mse', 'optimizer': 'adam', 'graph_mode': 'off', 'use_snp_selection': True, 'num_snps': 22310}. Best is trial 108 with value: 0.29654801718972074.
[I 2025-12-05 22:50:26,040] Trial 120 finished with value: 0.29489337734335574 and parameters: {'model_type': 'mlp', 'hidden_dims': '[512, 64]', 'dropout': 0.5539226037157992, 'batch_norm': False, 'lr': 4.0914878096929245e-06, 'weight_decay': 0.0007791470218144439, 'epochs': 186, 'loss': 'mse', 'optimizer': 'adam', 'graph_mode': 'off', 'use_snp_selection': False}. Best is trial 108 with value: 0.29654801718972074.
[I 2025-12-05 22:51:05,638] Trial 121 finished with value: 0.29042449615143157 and parameters: {'model_type': 'mlp', 'hidden_dims': '[512, 64]', 'dropout': 0.588373918928441, 'batch_norm': False, 'lr': 4.128238343926222e-06, 'weight_decay': 0.0007383948171534187, 'epochs': 197, 'loss': 'mse', 'optimizer': 'adam', 'graph_mode': 'off', 'use_snp_selection': False}. Best is trial 108 with value: 0.29654801718972074.
[I 2025-12-05 22:51:42,306] Trial 122 finished with value: 0.2936133704160929 and parameters: {'model_type': 'mlp', 'hidden_dims': '[512, 64]', 'dropout': 0.5651103631640042, 'batch_norm': False, 'lr': 4.415103294192056e-06, 'weight_decay': 0.0006257168078586648, 'epochs': 180, 'loss': 'mse', 'optimizer': 'adam', 'graph_mode': 'off', 'use_snp_selection': False}. Best is trial 108 with value: 0.29654801718972074.
