[I 2025-12-05 14:32:34,347] Trial 9 finished with value: 0.0496100830006737 and parameters: {'model_type': 'mlp', 'hidden_dims': '[512, 64]', 'dropout': 0.14505336736221927, 'batch_norm': True, 'lr': 5.8619638388111826e-05, 'weight_decay': 6.200156172669308e-07, 'epochs': 175, 'loss': 'mse', 'optimizer': 'adam', 'graph_mode': 'off', 'use_snp_selection': False}. Best is trial 6 with value: 0.08727741910549842.
[I 2025-12-05 14:32:35,115] Trial 10 finished with value: 0.014636927168845638 and parameters: {'model_type': 'mlp', 'hidden_dims': '[256, 128]', 'dropout': 0.5267360651501256, 'batch_norm': False, 'lr': 0.00032393778075602147, 'weight_decay': 1.936962886850364e-06, 'epochs': 46, 'loss': 'mse', 'optimizer': 'adam', 'graph_mode': 'off', 'use_snp_selection': False}. Best is trial 6 with value: 0.08727741910549842.
[I 2025-12-05 14:32:38,077] Trial 11 finished with value: 0.07060616919621127 and parameters: {'model_type': 'mlp', 'hidden_dims': '[128, 64]', 'dropout': 0.26208346984866365, 'batch_norm': False, 'lr': 1.2467800292900095e-05, 'weight_decay': 2.805519019095577e-06, 'epochs': 226, 'loss': 'mae', 'optimizer': 'adam', 'graph_mode': 'off', 'use_snp_selection': True, 'num_snps': 59915}. Best is trial 6 with value: 0.08727741910549842.
[I 2025-12-05 14:32:41,076] Trial 12 finished with value: 0.08947167568352171 and parameters: {'model_type': 'mlp', 'hidden_dims': '[128, 64]', 'dropout': 0.3131971633261129, 'batch_norm': False, 'lr': 1.6491753181045373e-05, 'weight_decay': 1.046668821935964e-07, 'epochs': 348, 'loss': 'mae', 'optimizer': 'adam', 'graph_mode': 'off', 'use_snp_selection': True, 'num_snps': 53668}. Best is trial 12 with value: 0.08947167568352171.
[I 2025-12-05 14:32:44,618] Trial 13 finished with value: 0.07282966358720758 and parameters: {'model_type': 'mlp', 'hidden_dims': '[256, 128]', 'dropout': 0.3140549764884506, 'batch_norm': False, 'lr': 1.6820437163047442e-05, 'weight_decay': 1.890011465346134e-07, 'epochs': 258, 'loss': 'mse', 'optimizer': 'adam', 'graph_mode': 'off', 'use_snp_selection': True, 'num_snps': 59978}. Best is trial 12 with value: 0.08947167568352171.
[I 2025-12-05 14:32:46,088] Trial 14 finished with value: 0.049033771772843716 and parameters: {'model_type': 'mlp', 'hidden_dims': '[128, 64]', 'dropout': 0.4552029103675417, 'batch_norm': False, 'lr': 0.0009993019377623152, 'weight_decay': 1.65769833089033e-06, 'epochs': 213, 'loss': 'mae', 'optimizer': 'adam', 'graph_mode': 'off', 'use_snp_selection': True, 'num_snps': 14412}. Best is trial 12 with value: 0.08947167568352171.
[I 2025-12-05 14:32:47,755] Trial 15 finished with value: 0.07524784578797229 and parameters: {'model_type': 'mlp', 'hidden_dims': '[256, 128, 64]', 'dropout': 0.3338410071716704, 'batch_norm': False, 'lr': 2.2121367524351637e-05, 'weight_decay': 1.5116576307593153e-07, 'epochs': 288, 'loss': 'mse', 'optimizer': 'adam', 'graph_mode': 'off', 'use_snp_selection': False}. Best is trial 12 with value: 0.08947167568352171.
[I 2025-12-05 14:32:49,226] Trial 16 finished with value: 0.07701284727361503 and parameters: {'model_type': 'mlp', 'hidden_dims': '[512, 256]', 'dropout': 0.48375609137820696, 'batch_norm': False, 'lr': 0.00015462883114640514, 'weight_decay': 1.1294919714829993e-07, 'epochs': 101, 'loss': 'mae', 'optimizer': 'adam', 'graph_mode': 'off', 'use_snp_selection': False}. Best is trial 12 with value: 0.08947167568352171.
[I 2025-12-05 14:32:51,691] Trial 17 finished with value: 0.05368850857329993 and parameters: {'model_type': 'mlp', 'hidden_dims': '[128, 64]', 'dropout': 0.3616584899410866, 'batch_norm': False, 'lr': 7.582536169177732e-06, 'weight_decay': 6.863395614786869e-07, 'epochs': 189, 'loss': 'mse', 'optimizer': 'adam', 'graph_mode': 'off', 'use_snp_selection': True, 'num_snps': 47155}. Best is trial 12 with value: 0.08947167568352171.
[I 2025-12-05 14:32:53,606] Trial 18 finished with value: 0.09785866128100205 and parameters: {'model_type': 'mlp', 'hidden_dims': '[256, 128]', 'dropout': 0.3157881099799493, 'batch_norm': False, 'lr': 3.214394962202686e-05, 'weight_decay': 4.346707834496116e-06, 'epochs': 341, 'loss': 'mse', 'optimizer': 'adam', 'graph_mode': 'off', 'use_snp_selection': True, 'num_snps': 20445}. Best is trial 18 with value: 0.09785866128100205.
[I 2025-12-05 14:32:55,448] Trial 19 finished with value: 0.09540305208063074 and parameters: {'model_type': 'mlp', 'hidden_dims': '[256, 128]', 'dropout': 0.2851700770648415, 'batch_norm': False, 'lr': 3.132363367728318e-05, 'weight_decay': 4.963779375779694e-06, 'epochs': 350, 'loss': 'mae', 'optimizer': 'adam', 'graph_mode': 'off', 'use_snp_selection': True, 'num_snps': 20492}. Best is trial 18 with value: 0.09785866128100205.
[I 2025-12-05 14:32:57,209] Trial 20 finished with value: 0.09863004759600812 and parameters: {'model_type': 'mlp', 'hidden_dims': '[256, 128]', 'dropout': 0.2571571756447585, 'batch_norm': False, 'lr': 0.00012203030450118801, 'weight_decay': 5.094607380695369e-06, 'epochs': 296, 'loss': 'mae', 'optimizer': 'adam', 'graph_mode': 'off', 'use_snp_selection': True, 'num_snps': 20402}. Best is trial 20 with value: 0.09863004759600812.
[I 2025-12-05 14:32:59,074] Trial 21 finished with value: 0.08313978909981723 and parameters: {'model_type': 'mlp', 'hidden_dims': '[256, 128]', 'dropout': 0.24559905997941678, 'batch_norm': False, 'lr': 9.736213015990956e-05, 'weight_decay': 4.809904888938428e-06, 'epochs': 298, 'loss': 'mae', 'optimizer': 'adam', 'graph_mode': 'off', 'use_snp_selection': True, 'num_snps': 22315}. Best is trial 20 with value: 0.09863004759600812.
[I 2025-12-05 14:33:01,017] Trial 22 finished with value: 0.08105579341445138 and parameters: {'model_type': 'mlp', 'hidden_dims': '[256, 128]', 'dropout': 0.21591162613390172, 'batch_norm': False, 'lr': 3.2059968944691706e-05, 'weight_decay': 6.263007526110402e-06, 'epochs': 346, 'loss': 'mae', 'optimizer': 'adam', 'graph_mode': 'off', 'use_snp_selection': True, 'num_snps': 22015}. Best is trial 20 with value: 0.09863004759600812.
[I 2025-12-05 14:33:02,255] Trial 23 finished with value: 0.02939083078445471 and parameters: {'model_type': 'mlp', 'hidden_dims': '[256, 128]', 'dropout': 0.2938348125049218, 'batch_norm': False, 'lr': 0.00013124730724619498, 'weight_decay': 2.6483694328181803e-05, 'epochs': 270, 'loss': 'mae', 'optimizer': 'adam', 'graph_mode': 'off', 'use_snp_selection': True, 'num_snps': 3817}. Best is trial 20 with value: 0.09863004759600812.
[I 2025-12-05 14:33:04,211] Trial 24 finished with value: 0.09743080282711158 and parameters: {'model_type': 'mlp', 'hidden_dims': '[256, 128]', 'dropout': 0.1963159408762038, 'batch_norm': False, 'lr': 0.00047158353690839164, 'weight_decay': 5.1119307766949515e-06, 'epochs': 318, 'loss': 'mae', 'optimizer': 'adam', 'graph_mode': 'off', 'use_snp_selection': True, 'num_snps': 23208}. Best is trial 20 with value: 0.09863004759600812.
[I 2025-12-05 14:33:06,349] Trial 25 finished with value: 0.08533004103959349 and parameters: {'model_type': 'mlp', 'hidden_dims': '[256, 128]', 'dropout': 0.19748264616240918, 'batch_norm': False, 'lr': 0.0006445394767672424, 'weight_decay': 4.2791502453712274e-05, 'epochs': 311, 'loss': 'mae', 'optimizer': 'adam', 'graph_mode': 'off', 'use_snp_selection': True, 'num_snps': 27778}. Best is trial 20 with value: 0.09863004759600812.
[I 2025-12-05 14:33:07,799] Trial 26 finished with value: 0.0717527052336539 and parameters: {'model_type': 'mlp', 'hidden_dims': '[256, 128]', 'dropout': 0.16240008264684969, 'batch_norm': False, 'lr': 0.0003281005161252966, 'weight_decay': 9.506698562247944e-06, 'epochs': 253, 'loss': 'mse', 'optimizer': 'adam', 'graph_mode': 'off', 'use_snp_selection': True, 'num_snps': 12197}. Best is trial 20 with value: 0.09863004759600812.
[I 2025-12-05 14:33:09,991] Trial 27 finished with value: 0.09079400719073699 and parameters: {'model_type': 'mlp', 'hidden_dims': '[256, 128]', 'dropout': 0.2245819868141113, 'batch_norm': False, 'lr': 0.0004682320335862315, 'weight_decay': 8.632397549207155e-07, 'epochs': 322, 'loss': 'mae', 'optimizer': 'adam', 'graph_mode': 'off', 'use_snp_selection': True, 'num_snps': 28133}. Best is trial 20 with value: 0.09863004759600812.
[I 2025-12-05 14:33:11,923] Trial 28 finished with value: 0.093589272549624 and parameters: {'model_type': 'mlp', 'hidden_dims': '[512, 256]', 'dropout': 0.10897585956605516, 'batch_norm': False, 'lr': 0.0001752498070583041, 'weight_decay': 8.680650884488789e-05, 'epochs': 299, 'loss': 'mse', 'optimizer': 'adam', 'graph_mode': 'off', 'use_snp_selection': True, 'num_snps': 16915}. Best is trial 20 with value: 0.09863004759600812.
[I 2025-12-05 14:33:13,348] Trial 29 finished with value: 0.044507059412482695 and parameters: {'model_type': 'mlp', 'hidden_dims': '[512, 128]', 'dropout': 0.18694291692709636, 'batch_norm': False, 'lr': 0.0006189836984008038, 'weight_decay': 8.534069173488027e-05, 'epochs': 330, 'loss': 'mae', 'optimizer': 'adam', 'graph_mode': 'off', 'use_snp_selection': True, 'num_snps': 7928}. Best is trial 20 with value: 0.09863004759600812.
[I 2025-12-05 14:33:15,751] Trial 30 finished with value: 0.0900682214046071 and parameters: {'model_type': 'mlp', 'hidden_dims': '[256, 128, 64]', 'dropout': 0.35012065793340374, 'batch_norm': False, 'lr': 0.00010146209899313414, 'weight_decay': 3.3571839884007967e-06, 'epochs': 282, 'loss': 'mae', 'optimizer': 'adam', 'graph_mode': 'off', 'use_snp_selection': True, 'num_snps': 34171}. Best is trial 20 with value: 0.09863004759600812.
[I 2025-12-05 14:33:17,660] Trial 31 finished with value: 0.09689666584394106 and parameters: {'model_type': 'mlp', 'hidden_dims': '[256, 128]', 'dropout': 0.29657803527072746, 'batch_norm': False, 'lr': 4.377443304164068e-05, 'weight_decay': 6.699624812058481e-06, 'epochs': 350, 'loss': 'mae', 'optimizer': 'adam', 'graph_mode': 'off', 'use_snp_selection': True, 'num_snps': 21277}. Best is trial 20 with value: 0.09863004759600812.
[I 2025-12-05 14:33:19,582] Trial 32 finished with value: 0.07207598531455026 and parameters: {'model_type': 'mlp', 'hidden_dims': '[256, 128]', 'dropout': 0.28099625383530513, 'batch_norm': False, 'lr': 4.32495823541558e-05, 'weight_decay': 9.768773107571094e-06, 'epochs': 326, 'loss': 'mae', 'optimizer': 'adam', 'graph_mode': 'off', 'use_snp_selection': True, 'num_snps': 22689}. Best is trial 20 with value: 0.09863004759600812.
[I 2025-12-05 14:33:21,718] Trial 33 finished with value: 0.0878942098602378 and parameters: {'model_type': 'mlp', 'hidden_dims': '[256, 128]', 'dropout': 0.24846498873033626, 'batch_norm': False, 'lr': 8.999637926260832e-05, 'weight_decay': 1.705016015795365e-05, 'epochs': 335, 'loss': 'mae', 'optimizer': 'adam', 'graph_mode': 'off', 'use_snp_selection': True, 'num_snps': 26045}. Best is trial 20 with value: 0.09863004759600812.
[I 2025-12-05 14:33:23,394] Trial 34 finished with value: 0.0923448392319957 and parameters: {'model_type': 'mlp', 'hidden_dims': '[256, 128]', 'dropout': 0.3237313236681196, 'batch_norm': False, 'lr': 3.361406365485756e-05, 'weight_decay': 5.969019632470784e-06, 'epochs': 298, 'loss': 'mae', 'optimizer': 'adam', 'graph_mode': 'off', 'use_snp_selection': True, 'num_snps': 17795}. Best is trial 20 with value: 0.09863004759600812.
[I 2025-12-05 14:33:25,494] Trial 35 finished with value: -0.011843237164954674 and parameters: {'model_type': 'mlp', 'hidden_dims': '[256, 128]', 'dropout': 0.2266300758666688, 'batch_norm': True, 'lr': 2.9827889704064785e-06, 'weight_decay': 2.8699693498130336e-06, 'epochs': 331, 'loss': 'mae', 'optimizer': 'adam', 'graph_mode': 'off', 'use_snp_selection': True, 'num_snps': 25188}. Best is trial 20 with value: 0.09863004759600812.
[I 2025-12-05 14:33:27,180] Trial 36 finished with value: 0.057242521404838986 and parameters: {'model_type': 'mlp', 'hidden_dims': '[256, 128, 64]', 'dropout': 0.1798054942547517, 'batch_norm': False, 'lr': 9.93906818221487e-06, 'weight_decay': 1.0577497796287626e-06, 'epochs': 246, 'loss': 'mae', 'optimizer': 'adam', 'graph_mode': 'off', 'use_snp_selection': True, 'num_snps': 18325}. Best is trial 20 with value: 0.09863004759600812.
[I 2025-12-05 14:33:30,418] Trial 37 finished with value: 0.08723834720767476 and parameters: {'model_type': 'mlp', 'hidden_dims': '[512, 64]', 'dropout': 0.3709839603566887, 'batch_norm': False, 'lr': 0.00023726144871483247, 'weight_decay': 1.0647118004928162e-05, 'epochs': 309, 'loss': 'mse', 'optimizer': 'adam', 'graph_mode': 'off', 'use_snp_selection': True, 'num_snps': 36530}. Best is trial 20 with value: 0.09863004759600812.
[I 2025-12-05 14:33:32,612] Trial 38 finished with value: 0.06033987506528983 and parameters: {'model_type': 'mlp', 'hidden_dims': '[256, 128]', 'dropout': 0.2725264668150107, 'batch_norm': True, 'lr': 7.686915968430416e-05, 'weight_decay': 2.642970312548793e-05, 'epochs': 266, 'loss': 'mae', 'optimizer': 'adam', 'graph_mode': 'off', 'use_snp_selection': True, 'num_snps': 28896}. Best is trial 20 with value: 0.09863004759600812.
[I 2025-12-05 14:33:33,962] Trial 39 finished with value: 0.014939709872822837 and parameters: {'model_type': 'mlp', 'hidden_dims': '[512, 128]', 'dropout': 0.4252290817295233, 'batch_norm': False, 'lr': 2.1051139918152347e-05, 'weight_decay': 3.852588394048954e-06, 'epochs': 282, 'loss': 'mse', 'optimizer': 'adam', 'graph_mode': 'off', 'use_snp_selection': True, 'num_snps': 7126}. Best is trial 20 with value: 0.09863004759600812.
[I 2025-12-05 14:33:36,806] Trial 40 finished with value: 0.07025769944297482 and parameters: {'model_type': 'mlp', 'hidden_dims': '[256, 128]', 'dropout': 0.4019293648315353, 'batch_norm': True, 'lr': 4.186369849804649e-05, 'weight_decay': 4.6530113670161733e-05, 'epochs': 320, 'loss': 'mae', 'optimizer': 'adam', 'graph_mode': 'off', 'use_snp_selection': True, 'num_snps': 42063}. Best is trial 20 with value: 0.09863004759600812.
[I 2025-12-05 14:33:38,698] Trial 41 finished with value: 0.09112610847263423 and parameters: {'model_type': 'mlp', 'hidden_dims': '[256, 128]', 'dropout': 0.3094608029546452, 'batch_norm': False, 'lr': 2.5279557383432842e-05, 'weight_decay': 6.500479255939279e-06, 'epochs': 347, 'loss': 'mae', 'optimizer': 'adam', 'graph_mode': 'off', 'use_snp_selection': True, 'num_snps': 20253}. Best is trial 20 with value: 0.09863004759600812.
[I 2025-12-05 14:33:40,319] Trial 42 finished with value: 0.07212728589474299 and parameters: {'model_type': 'mlp', 'hidden_dims': '[256, 128]', 'dropout': 0.28673212805884474, 'batch_norm': False, 'lr': 5.7012851624558324e-05, 'weight_decay': 1.6066250332749804e-05, 'epochs': 350, 'loss': 'mae', 'optimizer': 'adam', 'graph_mode': 'off', 'use_snp_selection': True, 'num_snps': 14522}. Best is trial 20 with value: 0.09863004759600812.
[I 2025-12-05 14:33:42,312] Trial 43 finished with value: 0.0853222069581738 and parameters: {'model_type': 'mlp', 'hidden_dims': '[256, 128]', 'dropout': 0.24715585118295977, 'batch_norm': False, 'lr': 3.204847174857619e-05, 'weight_decay': 2.2306560528435185e-06, 'epochs': 337, 'loss': 'mae', 'optimizer': 'adam', 'graph_mode': 'off', 'use_snp_selection': True, 'num_snps': 24160}. Best is trial 20 with value: 0.09863004759600812.
[I 2025-12-05 14:33:44,484] Trial 44 finished with value: 0.09674261651936272 and parameters: {'model_type': 'mlp', 'hidden_dims': '[512, 64]', 'dropout': 0.3404592511423057, 'batch_norm': False, 'lr': 0.00020527402033088167, 'weight_decay': 1.1495515634941916e-06, 'epochs': 307, 'loss': 'mae', 'optimizer': 'adam', 'graph_mode': 'off', 'use_snp_selection': True, 'num_snps': 20215}. Best is trial 20 with value: 0.09863004759600812.
[I 2025-12-05 14:33:46,903] Trial 45 finished with value: 0.1041517699556937 and parameters: {'model_type': 'mlp', 'hidden_dims': '[512, 64]', 'dropout': 0.33356883174518714, 'batch_norm': False, 'lr': 0.00025791092225721247, 'weight_decay': 4.6738484389722763e-07, 'epochs': 227, 'loss': 'mae', 'optimizer': 'adam', 'graph_mode': 'off', 'use_snp_selection': False}. Best is trial 45 with value: 0.1041517699556937.
[I 2025-12-05 14:33:49,352] Trial 46 finished with value: 0.0512795727989847 and parameters: {'model_type': 'mlp', 'hidden_dims': '[512, 64]', 'dropout': 0.13552629427307267, 'batch_norm': True, 'lr': 0.00032577835318459245, 'weight_decay': 3.704744951113837e-07, 'epochs': 227, 'loss': 'mse', 'optimizer': 'adam', 'graph_mode': 'off', 'use_snp_selection': False}. Best is trial 45 with value: 0.1041517699556937.
[I 2025-12-05 14:33:51,300] Trial 47 finished with value: 0.08328983775729452 and parameters: {'model_type': 'mlp', 'hidden_dims': '[512, 64]', 'dropout': 0.3824192563866719, 'batch_norm': False, 'lr': 0.00012467100887815537, 'weight_decay': 3.9771990881278494e-07, 'epochs': 166, 'loss': 'mae', 'optimizer': 'adam', 'graph_mode': 'off', 'use_snp_selection': False}. Best is trial 45 with value: 0.1041517699556937.
[I 2025-12-05 14:33:52,882] Trial 48 finished with value: 0.0670134192459888 and parameters: {'model_type': 'mlp', 'hidden_dims': '[512, 64]', 'dropout': 0.5752262887394397, 'batch_norm': False, 'lr': 0.00039444284095260064, 'weight_decay': 0.0009709528483568237, 'epochs': 117, 'loss': 'mse', 'optimizer': 'adam', 'graph_mode': 'off', 'use_snp_selection': False}. Best is trial 45 with value: 0.1041517699556937.
[I 2025-12-05 14:33:53,978] Trial 49 finished with value: 0.01764771639154782 and parameters: {'model_type': 'mlp', 'hidden_dims': '[512, 256]', 'dropout': 0.3017654842578774, 'batch_norm': False, 'lr': 0.0008595183547950666, 'weight_decay': 0.00021751145655489408, 'epochs': 54, 'loss': 'mae', 'optimizer': 'adam', 'graph_mode': 'off', 'use_snp_selection': False}. Best is trial 45 with value: 0.1041517699556937.
[I 2025-12-05 14:33:56,421] Trial 50 finished with value: 0.07677488548153773 and parameters: {'model_type': 'mlp', 'hidden_dims': '[512, 128]', 'dropout': 0.26345142138372013, 'batch_norm': False, 'lr': 0.00048046105620403346, 'weight_decay': 2.6019636993060357e-07, 'epochs': 231, 'loss': 'mse', 'optimizer': 'adam', 'graph_mode': 'off', 'use_snp_selection': False}. Best is trial 45 with value: 0.1041517699556937.
[I 2025-12-05 14:33:59,427] Trial 51 finished with value: 0.09677271389941795 and parameters: {'model_type': 'mlp', 'hidden_dims': '[512, 64]', 'dropout': 0.3498682395709386, 'batch_norm': False, 'lr': 0.00021114566476299518, 'weight_decay': 1.3322078181813831e-06, 'epochs': 304, 'loss': 'mae', 'optimizer': 'adam', 'graph_mode': 'off', 'use_snp_selection': False}. Best is trial 45 with value: 0.1041517699556937.
[I 2025-12-05 14:34:02,360] Trial 52 finished with value: 0.0790122246609594 and parameters: {'model_type': 'mlp', 'hidden_dims': '[512, 64]', 'dropout': 0.353836065459679, 'batch_norm': False, 'lr': 1.057970555978962e-06, 'weight_decay': 1.8010779882475936e-06, 'epochs': 292, 'loss': 'mae', 'optimizer': 'adam', 'graph_mode': 'off', 'use_snp_selection': False}. Best is trial 45 with value: 0.1041517699556937.
[I 2025-12-05 14:34:05,485] Trial 53 finished with value: 0.09357536942805501 and parameters: {'model_type': 'mlp', 'hidden_dims': '[512, 64]', 'dropout': 0.3336597510659313, 'batch_norm': False, 'lr': 0.00025320387653796176, 'weight_decay': 5.382643531205314e-07, 'epochs': 320, 'loss': 'mae', 'optimizer': 'adam', 'graph_mode': 'off', 'use_snp_selection': False}. Best is trial 45 with value: 0.1041517699556937.
[I 2025-12-05 14:34:07,721] Trial 54 finished with value: 0.10289237333093333 and parameters: {'model_type': 'mlp', 'hidden_dims': '[512, 64]', 'dropout': 0.21120864202137124, 'batch_norm': False, 'lr': 0.00015570368428259018, 'weight_decay': 1.297720876776082e-06, 'epochs': 203, 'loss': 'mae', 'optimizer': 'adam', 'graph_mode': 'off', 'use_snp_selection': False}. Best is trial 45 with value: 0.1041517699556937.
[I 2025-12-05 14:34:08,634] Trial 55 finished with value: 0.07925767830710338 and parameters: {'model_type': 'mlp', 'hidden_dims': '[128, 64]', 'dropout': 0.2066017943920933, 'batch_norm': False, 'lr': 0.0001248220078106408, 'weight_decay': 2.242323390217105e-06, 'epochs': 203, 'loss': 'mae', 'optimizer': 'adam', 'graph_mode': 'off', 'use_snp_selection': False}. Best is trial 45 with value: 0.1041517699556937.
[I 2025-12-05 14:34:10,964] Trial 56 finished with value: 0.08449206242221535 and parameters: {'model_type': 'mlp', 'hidden_dims': '[512, 64]', 'dropout': 0.23630783278938927, 'batch_norm': False, 'lr': 7.087140554865382e-05, 'weight_decay': 8.00457325914803e-06, 'epochs': 215, 'loss': 'mae', 'optimizer': 'adam', 'graph_mode': 'off', 'use_snp_selection': False}. Best is trial 45 with value: 0.1041517699556937.
[I 2025-12-05 14:34:12,251] Trial 57 finished with value: 0.07173044483761815 and parameters: {'model_type': 'mlp', 'hidden_dims': '[256, 128, 64]', 'dropout': 0.2633213891109814, 'batch_norm': True, 'lr': 0.00015592784235084477, 'weight_decay': 4.10977904608175e-06, 'epochs': 183, 'loss': 'mae', 'optimizer': 'adam', 'graph_mode': 'off', 'use_snp_selection': False}. Best is trial 45 with value: 0.1041517699556937.
[I 2025-12-05 14:34:15,036] Trial 58 finished with value: 0.09722811620736095 and parameters: {'model_type': 'mlp', 'hidden_dims': '[512, 256]', 'dropout': 0.16908896250481467, 'batch_norm': False, 'lr': 5.462693984691383e-05, 'weight_decay': 1.4254995990499291e-05, 'epochs': 270, 'loss': 'mse', 'optimizer': 'adam', 'graph_mode': 'off', 'use_snp_selection': False}. Best is trial 45 with value: 0.1041517699556937.
[I 2025-12-05 14:34:17,553] Trial 59 finished with value: 0.088727475164392 and parameters: {'model_type': 'mlp', 'hidden_dims': '[512, 256]', 'dropout': 0.17714402299764453, 'batch_norm': False, 'lr': 0.0002675639032253857, 'weight_decay': 1.3974960054732474e-05, 'epochs': 239, 'loss': 'mse', 'optimizer': 'adam', 'graph_mode': 'off', 'use_snp_selection': False}. Best is trial 45 with value: 0.1041517699556937.
