[I 2025-12-05 15:45:21,583] Trial 138 finished with value: 0.078122343528278 and parameters: {'model_type': 'mlp', 'hidden_dims': '[512, 128]', 'dropout': 0.13959912120218285, 'batch_norm': False, 'lr': 0.00014568234335138715, 'weight_decay': 3.2205751297724936e-06, 'epochs': 294, 'loss': 'mae', 'optimizer': 'adam', 'graph_mode': 'off', 'use_snp_selection': False}. Best is trial 46 with value: 0.1006960060302028.
[I 2025-12-05 15:45:23,120] Trial 139 finished with value: 0.047864230414607446 and parameters: {'model_type': 'mlp', 'hidden_dims': '[512, 256]', 'dropout': 0.18217522999202412, 'batch_norm': False, 'lr': 1.5013374340823576e-05, 'weight_decay': 0.00048665616218069544, 'epochs': 207, 'loss': 'mae', 'optimizer': 'adam', 'graph_mode': 'off', 'use_snp_selection': False}. Best is trial 46 with value: 0.1006960060302028.
[I 2025-12-05 15:45:24,839] Trial 140 finished with value: 0.07608995593732386 and parameters: {'model_type': 'mlp', 'hidden_dims': '[512, 128]', 'dropout': 0.15605756584670183, 'batch_norm': False, 'lr': 0.00017864858413914567, 'weight_decay': 0.00029190668202712486, 'epochs': 260, 'loss': 'mae', 'optimizer': 'adam', 'graph_mode': 'off', 'use_snp_selection': False}. Best is trial 46 with value: 0.1006960060302028.
[I 2025-12-05 15:45:26,399] Trial 141 finished with value: 0.05901364081666663 and parameters: {'model_type': 'mlp', 'hidden_dims': '[512, 256]', 'dropout': 0.541377276776862, 'batch_norm': False, 'lr': 3.554586123841545e-05, 'weight_decay': 0.00014997525645337506, 'epochs': 229, 'loss': 'mae', 'optimizer': 'adam', 'graph_mode': 'off', 'use_snp_selection': False}. Best is trial 46 with value: 0.1006960060302028.
[I 2025-12-05 15:45:27,743] Trial 142 finished with value: 0.05645127013075784 and parameters: {'model_type': 'mlp', 'hidden_dims': '[512, 256]', 'dropout': 0.5615980336617834, 'batch_norm': False, 'lr': 5.660418398468493e-05, 'weight_decay': 0.00012232816087479862, 'epochs': 169, 'loss': 'mae', 'optimizer': 'adam', 'graph_mode': 'off', 'use_snp_selection': False}. Best is trial 46 with value: 0.1006960060302028.
[I 2025-12-05 15:45:29,151] Trial 143 finished with value: 0.033462137309492976 and parameters: {'model_type': 'mlp', 'hidden_dims': '[512, 256]', 'dropout': 0.48439446836927724, 'batch_norm': False, 'lr': 2.3532092145270236e-05, 'weight_decay': 0.00019763493607482545, 'epochs': 187, 'loss': 'mae', 'optimizer': 'adam', 'graph_mode': 'off', 'use_snp_selection': False}. Best is trial 46 with value: 0.1006960060302028.
[I 2025-12-05 15:45:30,496] Trial 144 finished with value: 0.07776857819204916 and parameters: {'model_type': 'mlp', 'hidden_dims': '[512, 256]', 'dropout': 0.1920511980928902, 'batch_norm': False, 'lr': 4.306194047738221e-05, 'weight_decay': 9.187530183314867e-05, 'epochs': 153, 'loss': 'mae', 'optimizer': 'adam', 'graph_mode': 'off', 'use_snp_selection': False}. Best is trial 46 with value: 0.1006960060302028.
[I 2025-12-05 15:45:31,927] Trial 145 finished with value: 0.06291554814793475 and parameters: {'model_type': 'mlp', 'hidden_dims': '[512, 256]', 'dropout': 0.17447241812359626, 'batch_norm': False, 'lr': 1.1141255586278355e-05, 'weight_decay': 0.00042283214148366993, 'epochs': 174, 'loss': 'mae', 'optimizer': 'adam', 'graph_mode': 'off', 'use_snp_selection': False}. Best is trial 46 with value: 0.1006960060302028.
[I 2025-12-05 15:45:33,416] Trial 146 finished with value: 0.05179774367359159 and parameters: {'model_type': 'mlp', 'hidden_dims': '[512, 128]', 'dropout': 0.5106657572853904, 'batch_norm': False, 'lr': 8.566253902208256e-06, 'weight_decay': 0.00011350992385244835, 'epochs': 198, 'loss': 'mae', 'optimizer': 'adam', 'graph_mode': 'off', 'use_snp_selection': False}. Best is trial 46 with value: 0.1006960060302028.
[I 2025-12-05 15:45:34,837] Trial 147 finished with value: 0.06185808979944743 and parameters: {'model_type': 'mlp', 'hidden_dims': '[512, 128]', 'dropout': 0.3875567268350047, 'batch_norm': False, 'lr': 3.3213841329975836e-05, 'weight_decay': 0.00022175046652221018, 'epochs': 181, 'loss': 'mae', 'optimizer': 'adam', 'graph_mode': 'off', 'use_snp_selection': False}. Best is trial 46 with value: 0.1006960060302028.
[I 2025-12-05 15:45:36,258] Trial 148 finished with value: 0.05940724367596295 and parameters: {'model_type': 'mlp', 'hidden_dims': '[512, 256]', 'dropout': 0.4139048332558239, 'batch_norm': False, 'lr': 2.736507645057905e-05, 'weight_decay': 0.00016502369024560734, 'epochs': 189, 'loss': 'mse', 'optimizer': 'adam', 'graph_mode': 'off', 'use_snp_selection': False}. Best is trial 46 with value: 0.1006960060302028.
[I 2025-12-05 15:45:37,526] Trial 149 finished with value: 0.07416817660007488 and parameters: {'model_type': 'mlp', 'hidden_dims': '[256, 128]', 'dropout': 0.21806154311913153, 'batch_norm': False, 'lr': 5.182210913102638e-05, 'weight_decay': 9.832809864798624e-07, 'epochs': 162, 'loss': 'mae', 'optimizer': 'adam', 'graph_mode': 'off', 'use_snp_selection': True, 'num_snps': 20008}. Best is trial 46 with value: 0.1006960060302028.
[I 2025-12-05 15:45:39,782] Trial 0 finished with value: -0.003099618532574117 and parameters: {'model_type': 'mlp', 'hidden_dims': '[128, 64]', 'dropout': 0.199031432379812, 'batch_norm': True, 'lr': 1.8408544111075837e-06, 'weight_decay': 5.5136510071208614e-05, 'epochs': 336, 'loss': 'mae', 'optimizer': 'adam', 'graph_mode': 'off', 'use_snp_selection': True, 'num_snps': 43862}. Best is trial 0 with value: -0.003099618532574117.
[I 2025-12-05 15:45:40,933] Trial 1 finished with value: 0.05940830325948321 and parameters: {'model_type': 'mlp', 'hidden_dims': '[256, 128]', 'dropout': 0.4370668075331726, 'batch_norm': True, 'lr': 7.133471581159139e-05, 'weight_decay': 1.128633586803549e-05, 'epochs': 242, 'loss': 'mae', 'optimizer': 'adam', 'graph_mode': 'off', 'use_snp_selection': False}. Best is trial 1 with value: 0.05940830325948321.
[I 2025-12-05 15:45:42,045] Trial 2 finished with value: -0.0028514468080639735 and parameters: {'model_type': 'mlp', 'hidden_dims': '[256, 128, 64]', 'dropout': 0.41314357415569625, 'batch_norm': False, 'lr': 3.952233718592101e-06, 'weight_decay': 0.00026754769258252603, 'epochs': 149, 'loss': 'mse', 'optimizer': 'adam', 'graph_mode': 'off', 'use_snp_selection': True, 'num_snps': 11571}. Best is trial 1 with value: 0.05940830325948321.
[I 2025-12-05 15:45:43,947] Trial 3 finished with value: 0.016103833475921193 and parameters: {'model_type': 'mlp', 'hidden_dims': '[512, 64]', 'dropout': 0.5938127374509361, 'batch_norm': False, 'lr': 5.67704586114731e-06, 'weight_decay': 2.4518087630137052e-05, 'epochs': 320, 'loss': 'mae', 'optimizer': 'adam', 'graph_mode': 'off', 'use_snp_selection': False}. Best is trial 1 with value: 0.05940830325948321.
[I 2025-12-05 15:45:46,222] Trial 4 finished with value: -0.00913616008789277 and parameters: {'model_type': 'mlp', 'hidden_dims': '[512, 128]', 'dropout': 0.25746343592134413, 'batch_norm': True, 'lr': 1.3467657668402788e-06, 'weight_decay': 0.00033087251918647806, 'epochs': 277, 'loss': 'mse', 'optimizer': 'adam', 'graph_mode': 'off', 'use_snp_selection': True, 'num_snps': 36675}. Best is trial 1 with value: 0.05940830325948321.
[I 2025-12-05 15:45:47,961] Trial 5 finished with value: -0.015011706572604203 and parameters: {'model_type': 'mlp', 'hidden_dims': '[512, 64]', 'dropout': 0.38275350994408375, 'batch_norm': True, 'lr': 1.5586664309232824e-06, 'weight_decay': 0.0008227664668621182, 'epochs': 145, 'loss': 'mae', 'optimizer': 'adam', 'graph_mode': 'off', 'use_snp_selection': True, 'num_snps': 32148}. Best is trial 1 with value: 0.05940830325948321.
[I 2025-12-05 15:45:48,958] Trial 6 finished with value: 0.01445465460612926 and parameters: {'model_type': 'mlp', 'hidden_dims': '[256, 128]', 'dropout': 0.3930109900265879, 'batch_norm': False, 'lr': 4.892964372128395e-05, 'weight_decay': 1.5809549317992182e-06, 'epochs': 199, 'loss': 'mse', 'optimizer': 'adam', 'graph_mode': 'off', 'use_snp_selection': False}. Best is trial 1 with value: 0.05940830325948321.
[I 2025-12-05 15:45:50,045] Trial 7 finished with value: 0.026425479394653544 and parameters: {'model_type': 'mlp', 'hidden_dims': '[512, 256]', 'dropout': 0.15343979219678458, 'batch_norm': True, 'lr': 6.234003099047341e-05, 'weight_decay': 3.894760610535477e-07, 'epochs': 97, 'loss': 'mse', 'optimizer': 'adam', 'graph_mode': 'off', 'use_snp_selection': False}. Best is trial 1 with value: 0.05940830325948321.
[I 2025-12-05 15:45:51,936] Trial 8 finished with value: 0.036188123628696535 and parameters: {'model_type': 'mlp', 'hidden_dims': '[512, 128]', 'dropout': 0.10743001231661406, 'batch_norm': True, 'lr': 0.00023728538449271062, 'weight_decay': 1.7629071578048637e-05, 'epochs': 312, 'loss': 'mae', 'optimizer': 'adam', 'graph_mode': 'off', 'use_snp_selection': False}. Best is trial 1 with value: 0.05940830325948321.
[I 2025-12-05 15:45:53,340] Trial 9 finished with value: 0.043720400815100556 and parameters: {'model_type': 'mlp', 'hidden_dims': '[512, 64]', 'dropout': 0.14505336736221927, 'batch_norm': True, 'lr': 5.8619638388111826e-05, 'weight_decay': 6.200156172669308e-07, 'epochs': 175, 'loss': 'mse', 'optimizer': 'adam', 'graph_mode': 'off', 'use_snp_selection': False}. Best is trial 1 with value: 0.05940830325948321.
[I 2025-12-05 15:45:54,452] Trial 10 finished with value: 0.046825400787800814 and parameters: {'model_type': 'mlp', 'hidden_dims': '[256, 128]', 'dropout': 0.5365714961141473, 'batch_norm': False, 'lr': 0.00032955828969150785, 'weight_decay': 3.381683344261174e-06, 'epochs': 236, 'loss': 'mae', 'optimizer': 'adam', 'graph_mode': 'off', 'use_snp_selection': False}. Best is trial 1 with value: 0.05940830325948321.
[I 2025-12-05 15:45:55,576] Trial 11 finished with value: 0.018208641679978536 and parameters: {'model_type': 'mlp', 'hidden_dims': '[256, 128]', 'dropout': 0.5245918176739586, 'batch_norm': False, 'lr': 0.0008032461098320499, 'weight_decay': 3.590337640024813e-06, 'epochs': 239, 'loss': 'mae', 'optimizer': 'adam', 'graph_mode': 'off', 'use_snp_selection': False}. Best is trial 1 with value: 0.05940830325948321.
[I 2025-12-05 15:45:56,699] Trial 12 finished with value: 0.03637358645695468 and parameters: {'model_type': 'mlp', 'hidden_dims': '[256, 128]', 'dropout': 0.4813940450675722, 'batch_norm': False, 'lr': 0.00026576228959612443, 'weight_decay': 1.3081036432574914e-07, 'epochs': 234, 'loss': 'mae', 'optimizer': 'adam', 'graph_mode': 'off', 'use_snp_selection': False}. Best is trial 1 with value: 0.05940830325948321.
[I 2025-12-05 15:45:57,839] Trial 13 finished with value: 0.0429172565624283 and parameters: {'model_type': 'mlp', 'hidden_dims': '[256, 128]', 'dropout': 0.4972381959269697, 'batch_norm': False, 'lr': 1.8184704710575438e-05, 'weight_decay': 6.641543531184558e-06, 'epochs': 256, 'loss': 'mae', 'optimizer': 'adam', 'graph_mode': 'off', 'use_snp_selection': False}. Best is trial 1 with value: 0.05940830325948321.
[I 2025-12-05 15:45:58,567] Trial 14 finished with value: 0.06284337974884514 and parameters: {'model_type': 'mlp', 'hidden_dims': '[256, 128]', 'dropout': 0.3012984444538551, 'batch_norm': True, 'lr': 0.0002108574938852793, 'weight_decay': 6.9442169885097e-05, 'epochs': 42, 'loss': 'mae', 'optimizer': 'adam', 'graph_mode': 'off', 'use_snp_selection': False}. Best is trial 14 with value: 0.06284337974884514.
[I 2025-12-05 15:45:59,252] Trial 15 finished with value: 0.026197117880199308 and parameters: {'model_type': 'mlp', 'hidden_dims': '[128, 64]', 'dropout': 0.29552716538910623, 'batch_norm': True, 'lr': 0.00011153864802659692, 'weight_decay': 6.682546297843178e-05, 'epochs': 41, 'loss': 'mae', 'optimizer': 'adam', 'graph_mode': 'off', 'use_snp_selection': False}. Best is trial 14 with value: 0.06284337974884514.
[I 2025-12-05 15:46:00,003] Trial 16 finished with value: -0.020030073319447162 and parameters: {'model_type': 'mlp', 'hidden_dims': '[256, 128, 64]', 'dropout': 0.3182667578105709, 'batch_norm': True, 'lr': 1.5819268129322878e-05, 'weight_decay': 0.00011431726695115916, 'epochs': 45, 'loss': 'mae', 'optimizer': 'adam', 'graph_mode': 'off', 'use_snp_selection': False}. Best is trial 14 with value: 0.06284337974884514.
[I 2025-12-05 15:46:01,082] Trial 17 finished with value: 0.05449887147975942 and parameters: {'model_type': 'mlp', 'hidden_dims': '[512, 256]', 'dropout': 0.4599163501058064, 'batch_norm': True, 'lr': 0.000906375209920231, 'weight_decay': 2.0204960671781686e-05, 'epochs': 90, 'loss': 'mae', 'optimizer': 'adam', 'graph_mode': 'off', 'use_snp_selection': False}. Best is trial 14 with value: 0.06284337974884514.
[I 2025-12-05 15:46:03,677] Trial 18 finished with value: 0.0544567996968217 and parameters: {'model_type': 'mlp', 'hidden_dims': '[256, 128]', 'dropout': 0.2312628506238401, 'batch_norm': True, 'lr': 0.00011314282718172297, 'weight_decay': 9.86464848985257e-06, 'epochs': 200, 'loss': 'mae', 'optimizer': 'adam', 'graph_mode': 'off', 'use_snp_selection': True, 'num_snps': 58241}. Best is trial 14 with value: 0.06284337974884514.
[I 2025-12-05 15:46:04,876] Trial 19 finished with value: 0.0074565639923097025 and parameters: {'model_type': 'mlp', 'hidden_dims': '[256, 128]', 'dropout': 0.33794681415577893, 'batch_norm': True, 'lr': 2.013330969464146e-05, 'weight_decay': 0.00017554947736104132, 'epochs': 289, 'loss': 'mae', 'optimizer': 'adam', 'graph_mode': 'off', 'use_snp_selection': False}. Best is trial 14 with value: 0.06284337974884514.
[I 2025-12-05 15:46:05,722] Trial 20 finished with value: 0.028525106141342387 and parameters: {'model_type': 'mlp', 'hidden_dims': '[256, 128]', 'dropout': 0.29174091611568514, 'batch_norm': True, 'lr': 0.0001201732315401276, 'weight_decay': 4.634888016660633e-05, 'epochs': 99, 'loss': 'mae', 'optimizer': 'adam', 'graph_mode': 'off', 'use_snp_selection': False}. Best is trial 14 with value: 0.06284337974884514.
[I 2025-12-05 15:46:06,794] Trial 21 finished with value: 0.046634792392822304 and parameters: {'model_type': 'mlp', 'hidden_dims': '[512, 256]', 'dropout': 0.42555204521442136, 'batch_norm': True, 'lr': 0.0005062005192960107, 'weight_decay': 2.3186628955905954e-05, 'epochs': 84, 'loss': 'mae', 'optimizer': 'adam', 'graph_mode': 'off', 'use_snp_selection': False}. Best is trial 14 with value: 0.06284337974884514.
[I 2025-12-05 15:46:07,858] Trial 22 finished with value: 0.03593534505225379 and parameters: {'model_type': 'mlp', 'hidden_dims': '[512, 256]', 'dropout': 0.45110227476731135, 'batch_norm': True, 'lr': 0.0007732708235758618, 'weight_decay': 1.4925864000704632e-05, 'epochs': 79, 'loss': 'mae', 'optimizer': 'adam', 'graph_mode': 'off', 'use_snp_selection': False}. Best is trial 14 with value: 0.06284337974884514.
[I 2025-12-05 15:46:09,102] Trial 23 finished with value: 0.06733095362574276 and parameters: {'model_type': 'mlp', 'hidden_dims': '[512, 256]', 'dropout': 0.45700288156596985, 'batch_norm': True, 'lr': 0.00021958600405271606, 'weight_decay': 5.0120379461963505e-06, 'epochs': 126, 'loss': 'mae', 'optimizer': 'adam', 'graph_mode': 'off', 'use_snp_selection': False}. Best is trial 23 with value: 0.06733095362574276.
[I 2025-12-05 15:46:10,354] Trial 24 finished with value: 0.0006796488996254207 and parameters: {'model_type': 'mlp', 'hidden_dims': '[512, 256]', 'dropout': 0.36665683831765294, 'batch_norm': True, 'lr': 0.00016760280194266832, 'weight_decay': 4.393117280687866e-06, 'epochs': 133, 'loss': 'mae', 'optimizer': 'adam', 'graph_mode': 'off', 'use_snp_selection': False}. Best is trial 23 with value: 0.06733095362574276.
[I 2025-12-05 15:46:11,270] Trial 25 finished with value: 0.019864191989439114 and parameters: {'model_type': 'mlp', 'hidden_dims': '[256, 128, 64]', 'dropout': 0.5749585712243749, 'batch_norm': True, 'lr': 3.861721235063541e-05, 'weight_decay': 1.0349132082173324e-06, 'epochs': 124, 'loss': 'mae', 'optimizer': 'adam', 'graph_mode': 'off', 'use_snp_selection': False}. Best is trial 23 with value: 0.06733095362574276.
[I 2025-12-05 15:46:12,148] Trial 26 finished with value: 0.03157909968388443 and parameters: {'model_type': 'mlp', 'hidden_dims': '[512, 128]', 'dropout': 0.433949951471305, 'batch_norm': True, 'lr': 0.00033066913168218416, 'weight_decay': 2.443643243280606e-06, 'epochs': 178, 'loss': 'mse', 'optimizer': 'adam', 'graph_mode': 'off', 'use_snp_selection': True, 'num_snps': 3842}. Best is trial 23 with value: 0.06733095362574276.
[I 2025-12-05 15:46:13,076] Trial 27 finished with value: 0.0374857207551311 and parameters: {'model_type': 'mlp', 'hidden_dims': '[128, 64]', 'dropout': 0.33774866411070986, 'batch_norm': True, 'lr': 9.296343508519132e-05, 'weight_decay': 8.355253243783488e-06, 'epochs': 217, 'loss': 'mae', 'optimizer': 'adam', 'graph_mode': 'off', 'use_snp_selection': False}. Best is trial 23 with value: 0.06733095362574276.
[I 2025-12-05 15:46:14,459] Trial 28 finished with value: 0.07285477084026545 and parameters: {'model_type': 'mlp', 'hidden_dims': '[512, 256]', 'dropout': 0.5446517125861267, 'batch_norm': True, 'lr': 0.00017436255186096872, 'weight_decay': 3.603185957887507e-05, 'epochs': 167, 'loss': 'mae', 'optimizer': 'adam', 'graph_mode': 'off', 'use_snp_selection': False}. Best is trial 28 with value: 0.07285477084026545.
[I 2025-12-05 15:46:15,649] Trial 29 finished with value: 0.02421625754338729 and parameters: {'model_type': 'mlp', 'hidden_dims': '[512, 256]', 'dropout': 0.5534061204239772, 'batch_norm': True, 'lr': 0.0004592397191347085, 'weight_decay': 5.5227103357724904e-05, 'epochs': 63, 'loss': 'mae', 'optimizer': 'adam', 'graph_mode': 'off', 'use_snp_selection': True, 'num_snps': 19468}. Best is trial 28 with value: 0.07285477084026545.
[I 2025-12-05 15:46:16,813] Trial 30 finished with value: 0.05947219765942074 and parameters: {'model_type': 'mlp', 'hidden_dims': '[512, 256]', 'dropout': 0.5000006126334586, 'batch_norm': True, 'lr': 0.0001787155823809422, 'weight_decay': 3.5031039816745736e-05, 'epochs': 116, 'loss': 'mae', 'optimizer': 'adam', 'graph_mode': 'off', 'use_snp_selection': False}. Best is trial 28 with value: 0.07285477084026545.
[I 2025-12-05 15:46:17,974] Trial 31 finished with value: 0.030420054370865923 and parameters: {'model_type': 'mlp', 'hidden_dims': '[512, 256]', 'dropout': 0.5079896012542083, 'batch_norm': True, 'lr': 0.00016385674249658604, 'weight_decay': 3.974074120759931e-05, 'epochs': 115, 'loss': 'mae', 'optimizer': 'adam', 'graph_mode': 'off', 'use_snp_selection': False}. Best is trial 28 with value: 0.07285477084026545.
[I 2025-12-05 15:46:19,304] Trial 32 finished with value: 0.061352370819886724 and parameters: {'model_type': 'mlp', 'hidden_dims': '[512, 256]', 'dropout': 0.4752416157818978, 'batch_norm': True, 'lr': 0.00019489404087720443, 'weight_decay': 8.413507089398611e-05, 'epochs': 163, 'loss': 'mae', 'optimizer': 'adam', 'graph_mode': 'off', 'use_snp_selection': False}. Best is trial 28 with value: 0.07285477084026545.
[I 2025-12-05 15:46:20,660] Trial 33 finished with value: 0.04665410342678273 and parameters: {'model_type': 'mlp', 'hidden_dims': '[512, 256]', 'dropout': 0.5584088262943323, 'batch_norm': True, 'lr': 0.0005490989996509929, 'weight_decay': 0.00011018818707864539, 'epochs': 167, 'loss': 'mae', 'optimizer': 'adam', 'graph_mode': 'off', 'use_snp_selection': False}. Best is trial 28 with value: 0.07285477084026545.
[I 2025-12-05 15:46:21,947] Trial 34 finished with value: 0.02720148760513509 and parameters: {'model_type': 'mlp', 'hidden_dims': '[512, 256]', 'dropout': 0.47240554031031046, 'batch_norm': True, 'lr': 0.0002452125501500933, 'weight_decay': 0.000523339875991667, 'epochs': 150, 'loss': 'mae', 'optimizer': 'adam', 'graph_mode': 'off', 'use_snp_selection': False}. Best is trial 28 with value: 0.07285477084026545.
[I 2025-12-05 15:46:23,281] Trial 35 finished with value: 0.019670923612665956 and parameters: {'model_type': 'mlp', 'hidden_dims': '[512, 256]', 'dropout': 0.5969542793307423, 'batch_norm': True, 'lr': 8.890136058914893e-05, 'weight_decay': 9.859324682986377e-05, 'epochs': 164, 'loss': 'mae', 'optimizer': 'adam', 'graph_mode': 'off', 'use_snp_selection': False}. Best is trial 28 with value: 0.07285477084026545.
[I 2025-12-05 15:46:25,854] Trial 36 finished with value: 0.019547267359269486 and parameters: {'model_type': 'mlp', 'hidden_dims': '[128, 64]', 'dropout': 0.3901847398912125, 'batch_norm': True, 'lr': 2.8050869020116803e-05, 'weight_decay': 0.00025657704674569495, 'epochs': 186, 'loss': 'mse', 'optimizer': 'adam', 'graph_mode': 'off', 'use_snp_selection': True, 'num_snps': 58661}. Best is trial 28 with value: 0.07285477084026545.
[I 2025-12-05 15:46:26,904] Trial 37 finished with value: -0.016030318218768505 and parameters: {'model_type': 'mlp', 'hidden_dims': '[512, 64]', 'dropout': 0.2612604744121134, 'batch_norm': True, 'lr': 4.446294938689996e-06, 'weight_decay': 0.0001806464321915583, 'epochs': 64, 'loss': 'mae', 'optimizer': 'adam', 'graph_mode': 'off', 'use_snp_selection': False}. Best is trial 28 with value: 0.07285477084026545.
[I 2025-12-05 15:46:28,395] Trial 38 finished with value: 0.029357374381302752 and parameters: {'model_type': 'mlp', 'hidden_dims': '[256, 128, 64]', 'dropout': 0.21410076092363722, 'batch_norm': False, 'lr': 1.1665792017271946e-05, 'weight_decay': 3.2201319095073185e-05, 'epochs': 214, 'loss': 'mse', 'optimizer': 'adam', 'graph_mode': 'off', 'use_snp_selection': True, 'num_snps': 19911}. Best is trial 28 with value: 0.07285477084026545.
[I 2025-12-05 15:46:29,719] Trial 39 finished with value: 0.06599450153363785 and parameters: {'model_type': 'mlp', 'hidden_dims': '[512, 256]', 'dropout': 0.40491549826838436, 'batch_norm': True, 'lr': 0.00038110204155232595, 'weight_decay': 0.000494866061743946, 'epochs': 152, 'loss': 'mae', 'optimizer': 'adam', 'graph_mode': 'off', 'use_snp_selection': False}. Best is trial 28 with value: 0.07285477084026545.
