[I 2025-12-05 16:31:27,268] Trial 144 finished with value: 0.056184030812415596 and parameters: {'model_type': 'mlp', 'hidden_dims': '[512, 64]', 'dropout': 0.2538006021139505, 'batch_norm': True, 'lr': 0.0005508651011668001, 'weight_decay': 3.103091672657845e-05, 'epochs': 124, 'loss': 'mae', 'optimizer': 'adam', 'graph_mode': 'off', 'use_snp_selection': False}. Best is trial 42 with value: 0.08000357482808548.
[I 2025-12-05 16:31:28,237] Trial 145 finished with value: 0.045149502654003575 and parameters: {'model_type': 'mlp', 'hidden_dims': '[512, 64]', 'dropout': 0.2791465693785148, 'batch_norm': True, 'lr': 0.0003450705739847835, 'weight_decay': 1.9531975281210487e-05, 'epochs': 52, 'loss': 'mae', 'optimizer': 'adam', 'graph_mode': 'off', 'use_snp_selection': False}. Best is trial 42 with value: 0.08000357482808548.
[I 2025-12-05 16:31:29,508] Trial 146 finished with value: 0.04492747788164204 and parameters: {'model_type': 'mlp', 'hidden_dims': '[256, 128, 64]', 'dropout': 0.2737621526347774, 'batch_norm': True, 'lr': 0.0002054348342827847, 'weight_decay': 4.469462481943863e-05, 'epochs': 301, 'loss': 'mse', 'optimizer': 'adam', 'graph_mode': 'off', 'use_snp_selection': False}. Best is trial 42 with value: 0.08000357482808548.
[I 2025-12-05 16:31:30,810] Trial 147 finished with value: 0.05584731948714228 and parameters: {'model_type': 'mlp', 'hidden_dims': '[256, 128]', 'dropout': 0.21878818968208794, 'batch_norm': True, 'lr': 0.0007891391687903214, 'weight_decay': 1.1011215626212383e-05, 'epochs': 334, 'loss': 'mae', 'optimizer': 'adam', 'graph_mode': 'off', 'use_snp_selection': False}. Best is trial 42 with value: 0.08000357482808548.
[I 2025-12-05 16:31:32,312] Trial 148 finished with value: 0.05646218954309687 and parameters: {'model_type': 'mlp', 'hidden_dims': '[512, 64]', 'dropout': 0.17691407635310336, 'batch_norm': True, 'lr': 0.0006714504910797128, 'weight_decay': 2.1670663741140082e-07, 'epochs': 207, 'loss': 'mae', 'optimizer': 'adam', 'graph_mode': 'off', 'use_snp_selection': False}. Best is trial 42 with value: 0.08000357482808548.
[I 2025-12-05 16:31:33,368] Trial 149 finished with value: 0.031126856172323962 and parameters: {'model_type': 'mlp', 'hidden_dims': '[512, 64]', 'dropout': 0.10600722667892462, 'batch_norm': True, 'lr': 0.0005070202601841179, 'weight_decay': 3.2895831462145495e-05, 'epochs': 83, 'loss': 'mae', 'optimizer': 'adam', 'graph_mode': 'off', 'use_snp_selection': False}. Best is trial 42 with value: 0.08000357482808548.
[I 2025-12-05 16:31:46,835] Trial 0 finished with value: 0.03976936346969457 and parameters: {'model_type': 'mlp', 'hidden_dims': '[128, 64]', 'dropout': 0.199031432379812, 'batch_norm': True, 'lr': 1.8408544111075837e-06, 'weight_decay': 5.5136510071208614e-05, 'epochs': 336, 'loss': 'mae', 'optimizer': 'adam', 'graph_mode': 'off', 'use_snp_selection': True, 'num_snps': 43862}. Best is trial 0 with value: 0.03976936346969457.
[I 2025-12-05 16:31:47,897] Trial 1 finished with value: 0.0607125427618806 and parameters: {'model_type': 'mlp', 'hidden_dims': '[256, 128]', 'dropout': 0.4370668075331726, 'batch_norm': True, 'lr': 7.133471581159139e-05, 'weight_decay': 1.128633586803549e-05, 'epochs': 242, 'loss': 'mae', 'optimizer': 'adam', 'graph_mode': 'off', 'use_snp_selection': False}. Best is trial 1 with value: 0.0607125427618806.
[I 2025-12-05 16:31:48,871] Trial 2 finished with value: -0.006287398028137984 and parameters: {'model_type': 'mlp', 'hidden_dims': '[256, 128, 64]', 'dropout': 0.41314357415569625, 'batch_norm': False, 'lr': 3.952233718592101e-06, 'weight_decay': 0.00026754769258252603, 'epochs': 149, 'loss': 'mse', 'optimizer': 'adam', 'graph_mode': 'off', 'use_snp_selection': True, 'num_snps': 11571}. Best is trial 1 with value: 0.0607125427618806.
[I 2025-12-05 16:31:50,598] Trial 3 finished with value: 0.0076786697363474665 and parameters: {'model_type': 'mlp', 'hidden_dims': '[512, 64]', 'dropout': 0.5938127374509361, 'batch_norm': False, 'lr': 5.67704586114731e-06, 'weight_decay': 2.4518087630137052e-05, 'epochs': 320, 'loss': 'mae', 'optimizer': 'adam', 'graph_mode': 'off', 'use_snp_selection': False}. Best is trial 1 with value: 0.0607125427618806.
[I 2025-12-05 16:31:52,647] Trial 4 finished with value: 0.0341789197257255 and parameters: {'model_type': 'mlp', 'hidden_dims': '[512, 128]', 'dropout': 0.25746343592134413, 'batch_norm': True, 'lr': 1.3467657668402788e-06, 'weight_decay': 0.00033087251918647806, 'epochs': 277, 'loss': 'mse', 'optimizer': 'adam', 'graph_mode': 'off', 'use_snp_selection': True, 'num_snps': 36675}. Best is trial 1 with value: 0.0607125427618806.
[I 2025-12-05 16:31:54,405] Trial 5 finished with value: 0.04766520840930293 and parameters: {'model_type': 'mlp', 'hidden_dims': '[512, 64]', 'dropout': 0.38275350994408375, 'batch_norm': True, 'lr': 1.5586664309232824e-06, 'weight_decay': 0.0008227664668621182, 'epochs': 145, 'loss': 'mae', 'optimizer': 'adam', 'graph_mode': 'off', 'use_snp_selection': True, 'num_snps': 32148}. Best is trial 1 with value: 0.0607125427618806.
[I 2025-12-05 16:31:55,393] Trial 6 finished with value: 0.002255462231600324 and parameters: {'model_type': 'mlp', 'hidden_dims': '[256, 128]', 'dropout': 0.3930109900265879, 'batch_norm': False, 'lr': 4.892964372128395e-05, 'weight_decay': 1.5809549317992182e-06, 'epochs': 199, 'loss': 'mse', 'optimizer': 'adam', 'graph_mode': 'off', 'use_snp_selection': False}. Best is trial 1 with value: 0.0607125427618806.
[I 2025-12-05 16:31:56,479] Trial 7 finished with value: 0.055202312123933374 and parameters: {'model_type': 'mlp', 'hidden_dims': '[512, 256]', 'dropout': 0.15343979219678458, 'batch_norm': True, 'lr': 6.234003099047341e-05, 'weight_decay': 3.894760610535477e-07, 'epochs': 97, 'loss': 'mse', 'optimizer': 'adam', 'graph_mode': 'off', 'use_snp_selection': False}. Best is trial 1 with value: 0.0607125427618806.
[I 2025-12-05 16:31:58,233] Trial 8 finished with value: 0.07835946730758146 and parameters: {'model_type': 'mlp', 'hidden_dims': '[512, 128]', 'dropout': 0.10743001231661406, 'batch_norm': True, 'lr': 0.00023728538449271062, 'weight_decay': 1.7629071578048637e-05, 'epochs': 312, 'loss': 'mae', 'optimizer': 'adam', 'graph_mode': 'off', 'use_snp_selection': False}. Best is trial 8 with value: 0.07835946730758146.
[I 2025-12-05 16:31:59,554] Trial 9 finished with value: 0.06182031087003575 and parameters: {'model_type': 'mlp', 'hidden_dims': '[512, 64]', 'dropout': 0.14505336736221927, 'batch_norm': True, 'lr': 5.8619638388111826e-05, 'weight_decay': 6.200156172669308e-07, 'epochs': 175, 'loss': 'mse', 'optimizer': 'adam', 'graph_mode': 'off', 'use_snp_selection': False}. Best is trial 8 with value: 0.07835946730758146.
[I 2025-12-05 16:32:00,515] Trial 10 finished with value: 0.022340974472039817 and parameters: {'model_type': 'mlp', 'hidden_dims': '[512, 128]', 'dropout': 0.2800030442581858, 'batch_norm': False, 'lr': 0.0004919806695968258, 'weight_decay': 2.9953888095455486e-06, 'epochs': 55, 'loss': 'mae', 'optimizer': 'adam', 'graph_mode': 'off', 'use_snp_selection': False}. Best is trial 8 with value: 0.07835946730758146.
[I 2025-12-05 16:32:01,991] Trial 11 finished with value: 0.08517650213682348 and parameters: {'model_type': 'mlp', 'hidden_dims': '[512, 128]', 'dropout': 0.10095648685224448, 'batch_norm': True, 'lr': 0.0003411435764085616, 'weight_decay': 1.2045055692919657e-07, 'epochs': 216, 'loss': 'mse', 'optimizer': 'adam', 'graph_mode': 'off', 'use_snp_selection': False}. Best is trial 11 with value: 0.08517650213682348.
[I 2025-12-05 16:32:03,578] Trial 12 finished with value: 0.05821422776388552 and parameters: {'model_type': 'mlp', 'hidden_dims': '[512, 128]', 'dropout': 0.10344600881777158, 'batch_norm': True, 'lr': 0.0006674532614549997, 'weight_decay': 1.3081036432574914e-07, 'epochs': 255, 'loss': 'mae', 'optimizer': 'adam', 'graph_mode': 'off', 'use_snp_selection': False}. Best is trial 11 with value: 0.08517650213682348.
[I 2025-12-05 16:32:05,280] Trial 13 finished with value: 0.09477898860485588 and parameters: {'model_type': 'mlp', 'hidden_dims': '[512, 128]', 'dropout': 0.23699951708513148, 'batch_norm': True, 'lr': 0.00023284399572303963, 'weight_decay': 5.125175759678148e-06, 'epochs': 292, 'loss': 'mse', 'optimizer': 'adam', 'graph_mode': 'off', 'use_snp_selection': False}. Best is trial 13 with value: 0.09477898860485588.
[I 2025-12-05 16:32:06,740] Trial 14 finished with value: 0.07018062450735837 and parameters: {'model_type': 'mlp', 'hidden_dims': '[512, 128]', 'dropout': 0.28397504683850705, 'batch_norm': True, 'lr': 0.0002108574938852793, 'weight_decay': 1.1414924884997386e-07, 'epochs': 217, 'loss': 'mse', 'optimizer': 'adam', 'graph_mode': 'off', 'use_snp_selection': False}. Best is trial 13 with value: 0.09477898860485588.
[I 2025-12-05 16:32:07,747] Trial 15 finished with value: 0.06298254871813966 and parameters: {'model_type': 'mlp', 'hidden_dims': '[128, 64]', 'dropout': 0.2198889615042905, 'batch_norm': True, 'lr': 0.00018429018027102804, 'weight_decay': 2.957159153819679e-06, 'epochs': 284, 'loss': 'mse', 'optimizer': 'adam', 'graph_mode': 'off', 'use_snp_selection': False}. Best is trial 13 with value: 0.09477898860485588.
[I 2025-12-05 16:32:08,845] Trial 16 finished with value: 0.009929054106721909 and parameters: {'model_type': 'mlp', 'hidden_dims': '[256, 128, 64]', 'dropout': 0.3152871206117805, 'batch_norm': True, 'lr': 1.2586985041154999e-05, 'weight_decay': 6.465711270628297e-05, 'epochs': 238, 'loss': 'mse', 'optimizer': 'adam', 'graph_mode': 'off', 'use_snp_selection': False}. Best is trial 13 with value: 0.09477898860485588.
[I 2025-12-05 16:32:10,743] Trial 17 finished with value: 0.08361005036989749 and parameters: {'model_type': 'mlp', 'hidden_dims': '[512, 256]', 'dropout': 0.48577579229626666, 'batch_norm': True, 'lr': 0.000906375209920231, 'weight_decay': 5.569577404893511e-07, 'epochs': 350, 'loss': 'mse', 'optimizer': 'adam', 'graph_mode': 'off', 'use_snp_selection': False}. Best is trial 13 with value: 0.09477898860485588.
[I 2025-12-05 16:32:13,864] Trial 18 finished with value: 0.02884682231410069 and parameters: {'model_type': 'mlp', 'hidden_dims': '[512, 128]', 'dropout': 0.194267750639614, 'batch_norm': False, 'lr': 0.00013249554669876067, 'weight_decay': 4.109412643182284e-06, 'epochs': 283, 'loss': 'mse', 'optimizer': 'adam', 'graph_mode': 'off', 'use_snp_selection': True, 'num_snps': 58241}. Best is trial 13 with value: 0.09477898860485588.
[I 2025-12-05 16:32:15,175] Trial 19 finished with value: 0.011966881343617303 and parameters: {'model_type': 'mlp', 'hidden_dims': '[512, 128]', 'dropout': 0.33359689163241685, 'batch_norm': True, 'lr': 1.4790483400794447e-05, 'weight_decay': 2.714195880240099e-07, 'epochs': 181, 'loss': 'mse', 'optimizer': 'adam', 'graph_mode': 'off', 'use_snp_selection': False}. Best is trial 13 with value: 0.09477898860485588.
[I 2025-12-05 16:32:16,287] Trial 20 finished with value: 0.057329216935789726 and parameters: {'model_type': 'mlp', 'hidden_dims': '[512, 128]', 'dropout': 0.15568506439164756, 'batch_norm': True, 'lr': 0.00043263269645793897, 'weight_decay': 1.3023252005972856e-06, 'epochs': 118, 'loss': 'mse', 'optimizer': 'adam', 'graph_mode': 'off', 'use_snp_selection': False}. Best is trial 13 with value: 0.09477898860485588.
[I 2025-12-05 16:32:18,070] Trial 21 finished with value: 0.07107526918544951 and parameters: {'model_type': 'mlp', 'hidden_dims': '[512, 256]', 'dropout': 0.47805381899104793, 'batch_norm': True, 'lr': 0.0003717843491361044, 'weight_decay': 7.338870219570899e-07, 'epochs': 314, 'loss': 'mse', 'optimizer': 'adam', 'graph_mode': 'off', 'use_snp_selection': False}. Best is trial 13 with value: 0.09477898860485588.
[I 2025-12-05 16:32:19,960] Trial 22 finished with value: 0.06513111327921203 and parameters: {'model_type': 'mlp', 'hidden_dims': '[512, 256]', 'dropout': 0.5447308805905811, 'batch_norm': True, 'lr': 0.0009294652516846262, 'weight_decay': 3.095186295458535e-07, 'epochs': 343, 'loss': 'mse', 'optimizer': 'adam', 'graph_mode': 'off', 'use_snp_selection': False}. Best is trial 13 with value: 0.09477898860485588.
[I 2025-12-05 16:32:21,863] Trial 23 finished with value: 0.06378560146337522 and parameters: {'model_type': 'mlp', 'hidden_dims': '[512, 256]', 'dropout': 0.5031116233492967, 'batch_norm': True, 'lr': 0.0009554102349408972, 'weight_decay': 1.0113189271317992e-07, 'epochs': 346, 'loss': 'mse', 'optimizer': 'adam', 'graph_mode': 'off', 'use_snp_selection': False}. Best is trial 13 with value: 0.09477898860485588.
[I 2025-12-05 16:32:23,603] Trial 24 finished with value: 0.07906261318077754 and parameters: {'model_type': 'mlp', 'hidden_dims': '[512, 256]', 'dropout': 0.25214096613855946, 'batch_norm': True, 'lr': 0.00012933696064794652, 'weight_decay': 5.429128164278196e-06, 'epochs': 295, 'loss': 'mse', 'optimizer': 'adam', 'graph_mode': 'off', 'use_snp_selection': False}. Best is trial 13 with value: 0.09477898860485588.
[I 2025-12-05 16:32:24,723] Trial 25 finished with value: 0.07450732376516546 and parameters: {'model_type': 'mlp', 'hidden_dims': '[256, 128, 64]', 'dropout': 0.463367112822308, 'batch_norm': True, 'lr': 0.0003955868792168715, 'weight_decay': 1.1973764210180612e-06, 'epochs': 261, 'loss': 'mse', 'optimizer': 'adam', 'graph_mode': 'off', 'use_snp_selection': False}. Best is trial 13 with value: 0.09477898860485588.
[I 2025-12-05 16:32:25,591] Trial 26 finished with value: 0.05238823845205456 and parameters: {'model_type': 'mlp', 'hidden_dims': '[256, 128]', 'dropout': 0.35967300847892314, 'batch_norm': True, 'lr': 0.00011003001292517832, 'weight_decay': 2.161313607495405e-07, 'epochs': 221, 'loss': 'mse', 'optimizer': 'adam', 'graph_mode': 'off', 'use_snp_selection': True, 'num_snps': 3842}. Best is trial 13 with value: 0.09477898860485588.
[I 2025-12-05 16:32:26,529] Trial 27 finished with value: 0.016543244126529185 and parameters: {'model_type': 'mlp', 'hidden_dims': '[128, 64]', 'dropout': 0.5333951312208663, 'batch_norm': False, 'lr': 2.2257886900829637e-05, 'weight_decay': 5.75309007984972e-07, 'epochs': 316, 'loss': 'mse', 'optimizer': 'adam', 'graph_mode': 'off', 'use_snp_selection': False}. Best is trial 13 with value: 0.09477898860485588.
[I 2025-12-05 16:32:28,210] Trial 28 finished with value: 0.06678351883575577 and parameters: {'model_type': 'mlp', 'hidden_dims': '[512, 256]', 'dropout': 0.5961172503200656, 'batch_norm': True, 'lr': 0.00026272017285891916, 'weight_decay': 7.6064196335486225e-06, 'epochs': 294, 'loss': 'mse', 'optimizer': 'adam', 'graph_mode': 'off', 'use_snp_selection': False}. Best is trial 13 with value: 0.09477898860485588.
[I 2025-12-05 16:32:29,612] Trial 29 finished with value: 0.06704954137828753 and parameters: {'model_type': 'mlp', 'hidden_dims': '[128, 64]', 'dropout': 0.21406990239098672, 'batch_norm': True, 'lr': 0.0007173968367143692, 'weight_decay': 5.5227103357724904e-05, 'epochs': 335, 'loss': 'mse', 'optimizer': 'adam', 'graph_mode': 'off', 'use_snp_selection': True, 'num_snps': 19468}. Best is trial 13 with value: 0.09477898860485588.
[I 2025-12-05 16:32:31,199] Trial 30 finished with value: 0.04834680957317 and parameters: {'model_type': 'mlp', 'hidden_dims': '[512, 128]', 'dropout': 0.30612075078229306, 'batch_norm': True, 'lr': 3.860604868924948e-05, 'weight_decay': 1.8389374517915446e-06, 'epochs': 263, 'loss': 'mse', 'optimizer': 'adam', 'graph_mode': 'off', 'use_snp_selection': False}. Best is trial 13 with value: 0.09477898860485588.
[I 2025-12-05 16:32:32,933] Trial 31 finished with value: 0.06361407681248406 and parameters: {'model_type': 'mlp', 'hidden_dims': '[512, 256]', 'dropout': 0.24579127033690124, 'batch_norm': True, 'lr': 0.00011778138047851415, 'weight_decay': 6.395702138416962e-06, 'epochs': 298, 'loss': 'mse', 'optimizer': 'adam', 'graph_mode': 'off', 'use_snp_selection': False}. Best is trial 13 with value: 0.09477898860485588.
[I 2025-12-05 16:32:34,797] Trial 32 finished with value: 0.07438626372051689 and parameters: {'model_type': 'mlp', 'hidden_dims': '[512, 256]', 'dropout': 0.18396710602289038, 'batch_norm': True, 'lr': 9.372699670667886e-05, 'weight_decay': 2.2324921796799805e-05, 'epochs': 330, 'loss': 'mse', 'optimizer': 'adam', 'graph_mode': 'off', 'use_snp_selection': False}. Best is trial 13 with value: 0.09477898860485588.
[I 2025-12-05 16:32:36,386] Trial 33 finished with value: 0.060332799780175174 and parameters: {'model_type': 'mlp', 'hidden_dims': '[512, 256]', 'dropout': 0.3613899791583047, 'batch_norm': True, 'lr': 0.0001682632844723404, 'weight_decay': 1.1585801347584625e-05, 'epochs': 242, 'loss': 'mse', 'optimizer': 'adam', 'graph_mode': 'off', 'use_snp_selection': False}. Best is trial 13 with value: 0.09477898860485588.
[I 2025-12-05 16:32:38,147] Trial 34 finished with value: 0.08466859260729141 and parameters: {'model_type': 'mlp', 'hidden_dims': '[512, 256]', 'dropout': 0.42770445088472464, 'batch_norm': True, 'lr': 0.0003085543559377588, 'weight_decay': 2.12373663160474e-07, 'epochs': 301, 'loss': 'mae', 'optimizer': 'adam', 'graph_mode': 'off', 'use_snp_selection': False}. Best is trial 13 with value: 0.09477898860485588.
[I 2025-12-05 16:32:39,335] Trial 35 finished with value: 0.043502404585293586 and parameters: {'model_type': 'mlp', 'hidden_dims': '[256, 128]', 'dropout': 0.43024169205778806, 'batch_norm': False, 'lr': 0.0003209436030906405, 'weight_decay': 1.457195330514564e-07, 'epochs': 306, 'loss': 'mae', 'optimizer': 'adam', 'graph_mode': 'off', 'use_snp_selection': False}. Best is trial 13 with value: 0.09477898860485588.
[I 2025-12-05 16:32:42,556] Trial 36 finished with value: 0.06859951931833425 and parameters: {'model_type': 'mlp', 'hidden_dims': '[512, 64]', 'dropout': 0.4549182249193019, 'batch_norm': True, 'lr': 0.000594238867456555, 'weight_decay': 2.3148354678659186e-07, 'epochs': 326, 'loss': 'mae', 'optimizer': 'adam', 'graph_mode': 'off', 'use_snp_selection': True, 'num_snps': 58661}. Best is trial 13 with value: 0.09477898860485588.
[I 2025-12-05 16:32:43,574] Trial 37 finished with value: 0.012743947069467822 and parameters: {'model_type': 'mlp', 'hidden_dims': '[256, 128, 64]', 'dropout': 0.39955732298467284, 'batch_norm': True, 'lr': 4.446294938689996e-06, 'weight_decay': 4.884919948392611e-07, 'epochs': 221, 'loss': 'mae', 'optimizer': 'adam', 'graph_mode': 'off', 'use_snp_selection': False}. Best is trial 13 with value: 0.09477898860485588.
[I 2025-12-05 16:32:44,890] Trial 38 finished with value: 0.038794949346365744 and parameters: {'model_type': 'mlp', 'hidden_dims': '[512, 128]', 'dropout': 0.4983988810394268, 'batch_norm': False, 'lr': 0.0002997566140092869, 'weight_decay': 8.772533922545007e-07, 'epochs': 267, 'loss': 'mae', 'optimizer': 'adam', 'graph_mode': 'off', 'use_snp_selection': True, 'num_snps': 19911}. Best is trial 13 with value: 0.09477898860485588.
[I 2025-12-05 16:32:46,782] Trial 39 finished with value: 0.07702213900450638 and parameters: {'model_type': 'mlp', 'hidden_dims': '[512, 256]', 'dropout': 0.4246116819735686, 'batch_norm': True, 'lr': 0.0005657452540150926, 'weight_decay': 0.00010412398872024411, 'epochs': 348, 'loss': 'mae', 'optimizer': 'adam', 'graph_mode': 'off', 'use_snp_selection': False}. Best is trial 13 with value: 0.09477898860485588.
[I 2025-12-05 16:32:47,792] Trial 40 finished with value: 0.07597824438525205 and parameters: {'model_type': 'mlp', 'hidden_dims': '[256, 128]', 'dropout': 0.5590047648559484, 'batch_norm': True, 'lr': 0.000876811001129743, 'weight_decay': 1.8285624603315292e-07, 'epochs': 196, 'loss': 'mae', 'optimizer': 'adam', 'graph_mode': 'off', 'use_snp_selection': False}. Best is trial 13 with value: 0.09477898860485588.
[I 2025-12-05 16:32:49,513] Trial 41 finished with value: 0.054778455589865126 and parameters: {'model_type': 'mlp', 'hidden_dims': '[512, 256]', 'dropout': 0.24665600110804806, 'batch_norm': True, 'lr': 8.810957841071554e-05, 'weight_decay': 4.186010005023668e-06, 'epochs': 295, 'loss': 'mse', 'optimizer': 'adam', 'graph_mode': 'off', 'use_snp_selection': False}. Best is trial 13 with value: 0.09477898860485588.
[I 2025-12-05 16:32:51,178] Trial 42 finished with value: 0.06729216026652275 and parameters: {'model_type': 'mlp', 'hidden_dims': '[512, 256]', 'dropout': 0.16894464637774498, 'batch_norm': True, 'lr': 0.00015387058533903182, 'weight_decay': 2.2614006833040655e-06, 'epochs': 277, 'loss': 'mse', 'optimizer': 'adam', 'graph_mode': 'off', 'use_snp_selection': False}. Best is trial 13 with value: 0.09477898860485588.
[I 2025-12-05 16:32:52,424] Trial 43 finished with value: -0.04076378962447528 and parameters: {'model_type': 'mlp', 'hidden_dims': '[512, 256]', 'dropout': 0.3755248611110361, 'batch_norm': True, 'lr': 2.1409924724993155e-06, 'weight_decay': 3.537526507771669e-07, 'epochs': 141, 'loss': 'mae', 'optimizer': 'adam', 'graph_mode': 'off', 'use_snp_selection': False}. Best is trial 13 with value: 0.09477898860485588.
[I 2025-12-05 16:32:54,242] Trial 44 finished with value: 0.06729569409742087 and parameters: {'model_type': 'mlp', 'hidden_dims': '[512, 64]', 'dropout': 0.12046249262252318, 'batch_norm': True, 'lr': 0.00026266922681025053, 'weight_decay': 3.425711032314659e-05, 'epochs': 325, 'loss': 'mse', 'optimizer': 'adam', 'graph_mode': 'off', 'use_snp_selection': False}. Best is trial 13 with value: 0.09477898860485588.
[I 2025-12-05 16:32:55,792] Trial 45 finished with value: 0.09782401419539313 and parameters: {'model_type': 'mlp', 'hidden_dims': '[512, 128]', 'dropout': 0.13095936391447843, 'batch_norm': True, 'lr': 0.00045840442167398743, 'weight_decay': 1.0858270774551508e-05, 'epochs': 245, 'loss': 'mse', 'optimizer': 'adam', 'graph_mode': 'off', 'use_snp_selection': False}. Best is trial 45 with value: 0.09782401419539313.
