[I 2025-12-05 16:30:28,801] Trial 20 finished with value: 0.017748334472116975 and parameters: {'model_type': 'mlp', 'hidden_dims': '[512, 128]', 'dropout': 0.15270612757501414, 'batch_norm': True, 'lr': 9.069170483771495e-06, 'weight_decay': 2.1466441926588312e-06, 'epochs': 179, 'loss': 'mse', 'optimizer': 'adam', 'graph_mode': 'off', 'use_snp_selection': False}. Best is trial 9 with value: 0.07418170351669094.
[I 2025-12-05 16:30:29,844] Trial 21 finished with value: 0.04049437420487919 and parameters: {'model_type': 'mlp', 'hidden_dims': '[512, 256]', 'dropout': 0.152725720410351, 'batch_norm': True, 'lr': 5.402874722904477e-05, 'weight_decay': 3.523440401503165e-07, 'epochs': 106, 'loss': 'mse', 'optimizer': 'adam', 'graph_mode': 'off', 'use_snp_selection': False}. Best is trial 9 with value: 0.07418170351669094.
[I 2025-12-05 16:30:30,974] Trial 22 finished with value: 0.05435698856278743 and parameters: {'model_type': 'mlp', 'hidden_dims': '[512, 256]', 'dropout': 0.1498878370546235, 'batch_norm': True, 'lr': 9.048227932287809e-05, 'weight_decay': 6.619032055613514e-07, 'epochs': 125, 'loss': 'mse', 'optimizer': 'adam', 'graph_mode': 'off', 'use_snp_selection': False}. Best is trial 9 with value: 0.07418170351669094.
[I 2025-12-05 16:30:31,914] Trial 23 finished with value: 0.04624607078974075 and parameters: {'model_type': 'mlp', 'hidden_dims': '[512, 256]', 'dropout': 0.22971583480261082, 'batch_norm': True, 'lr': 3.535809849538806e-05, 'weight_decay': 2.1519549173637828e-07, 'epochs': 74, 'loss': 'mse', 'optimizer': 'adam', 'graph_mode': 'off', 'use_snp_selection': False}. Best is trial 9 with value: 0.07418170351669094.
[I 2025-12-05 16:30:33,338] Trial 24 finished with value: 0.05563413594106295 and parameters: {'model_type': 'mlp', 'hidden_dims': '[512, 256]', 'dropout': 0.12932822753058773, 'batch_norm': True, 'lr': 2.966849132589597e-05, 'weight_decay': 1.1416400434382796e-07, 'epochs': 214, 'loss': 'mse', 'optimizer': 'adam', 'graph_mode': 'off', 'use_snp_selection': False}. Best is trial 9 with value: 0.07418170351669094.
[I 2025-12-05 16:30:34,060] Trial 25 finished with value: 0.04866759944507502 and parameters: {'model_type': 'mlp', 'hidden_dims': '[256, 128, 64]', 'dropout': 0.1859606717259252, 'batch_norm': True, 'lr': 0.00028185427887484124, 'weight_decay': 6.033803895062856e-06, 'epochs': 81, 'loss': 'mse', 'optimizer': 'adam', 'graph_mode': 'off', 'use_snp_selection': False}. Best is trial 9 with value: 0.07418170351669094.
[I 2025-12-05 16:30:34,798] Trial 26 finished with value: 0.027263363403934277 and parameters: {'model_type': 'mlp', 'hidden_dims': '[256, 128]', 'dropout': 0.3017666430086059, 'batch_norm': True, 'lr': 0.00016406330853156232, 'weight_decay': 9.557592640238658e-07, 'epochs': 131, 'loss': 'mae', 'optimizer': 'adam', 'graph_mode': 'off', 'use_snp_selection': True, 'num_snps': 3842}. Best is trial 9 with value: 0.07418170351669094.
[I 2025-12-05 16:30:35,589] Trial 27 finished with value: 0.06274378108376245 and parameters: {'model_type': 'mlp', 'hidden_dims': '[128, 64]', 'dropout': 0.2326186528873453, 'batch_norm': False, 'lr': 0.0006268690554118141, 'weight_decay': 4.4950234781058325e-07, 'epochs': 269, 'loss': 'mse', 'optimizer': 'adam', 'graph_mode': 'off', 'use_snp_selection': False}. Best is trial 9 with value: 0.07418170351669094.
[I 2025-12-05 16:30:36,391] Trial 28 finished with value: 0.029263358497804735 and parameters: {'model_type': 'mlp', 'hidden_dims': '[128, 64]', 'dropout': 0.219196935871986, 'batch_norm': False, 'lr': 0.0009845086509735743, 'weight_decay': 1.8219834248060387e-07, 'epochs': 278, 'loss': 'mse', 'optimizer': 'adam', 'graph_mode': 'off', 'use_snp_selection': False}. Best is trial 9 with value: 0.07418170351669094.
[I 2025-12-05 16:30:37,658] Trial 29 finished with value: 0.019351191275495623 and parameters: {'model_type': 'mlp', 'hidden_dims': '[128, 64]', 'dropout': 0.18394223147659045, 'batch_norm': False, 'lr': 2.8966762461994946e-06, 'weight_decay': 5.522710335772481e-05, 'epochs': 266, 'loss': 'mae', 'optimizer': 'adam', 'graph_mode': 'off', 'use_snp_selection': True, 'num_snps': 19468}. Best is trial 9 with value: 0.07418170351669094.
[I 2025-12-05 16:30:38,356] Trial 30 finished with value: 0.04610384717535941 and parameters: {'model_type': 'mlp', 'hidden_dims': '[128, 64]', 'dropout': 0.34835855819634287, 'batch_norm': False, 'lr': 0.0005112618397277398, 'weight_decay': 4.662571160596537e-07, 'epochs': 182, 'loss': 'mse', 'optimizer': 'adam', 'graph_mode': 'off', 'use_snp_selection': False}. Best is trial 9 with value: 0.07418170351669094.
[I 2025-12-05 16:30:39,236] Trial 31 finished with value: 0.031437680959020366 and parameters: {'model_type': 'mlp', 'hidden_dims': '[128, 64]', 'dropout': 0.16944200304357263, 'batch_norm': False, 'lr': 1.1995153703898004e-05, 'weight_decay': 3.951710204540491e-07, 'epochs': 349, 'loss': 'mse', 'optimizer': 'adam', 'graph_mode': 'off', 'use_snp_selection': False}. Best is trial 9 with value: 0.07418170351669094.
[I 2025-12-05 16:30:40,689] Trial 32 finished with value: 0.04448096051017813 and parameters: {'model_type': 'mlp', 'hidden_dims': '[512, 64]', 'dropout': 0.12623386952239138, 'batch_norm': False, 'lr': 7.598587547688249e-05, 'weight_decay': 8.857747562078037e-07, 'epochs': 227, 'loss': 'mse', 'optimizer': 'adam', 'graph_mode': 'off', 'use_snp_selection': False}. Best is trial 9 with value: 0.07418170351669094.
[I 2025-12-05 16:30:41,593] Trial 33 finished with value: 0.035084202199634734 and parameters: {'model_type': 'mlp', 'hidden_dims': '[128, 64]', 'dropout': 0.25924619842006286, 'batch_norm': True, 'lr': 4.4468241207743945e-05, 'weight_decay': 1.7291626118433436e-07, 'epochs': 302, 'loss': 'mse', 'optimizer': 'adam', 'graph_mode': 'off', 'use_snp_selection': False}. Best is trial 9 with value: 0.07418170351669094.
[I 2025-12-05 16:30:42,872] Trial 34 finished with value: 0.028209406042601956 and parameters: {'model_type': 'mlp', 'hidden_dims': '[512, 256]', 'dropout': 0.4776495763450488, 'batch_norm': False, 'lr': 2.0904920117380333e-05, 'weight_decay': 2.1542072306300763e-06, 'epochs': 163, 'loss': 'mae', 'optimizer': 'adam', 'graph_mode': 'off', 'use_snp_selection': False}. Best is trial 9 with value: 0.07418170351669094.
[I 2025-12-05 16:30:43,812] Trial 35 finished with value: 0.04627736214873204 and parameters: {'model_type': 'mlp', 'hidden_dims': '[256, 128]', 'dropout': 0.24117210141286102, 'batch_norm': True, 'lr': 7.919806599901368e-05, 'weight_decay': 3.8747930855427285e-07, 'epochs': 184, 'loss': 'mse', 'optimizer': 'adam', 'graph_mode': 'off', 'use_snp_selection': False}. Best is trial 9 with value: 0.07418170351669094.
[I 2025-12-05 16:30:46,505] Trial 36 finished with value: 0.005744000595949404 and parameters: {'model_type': 'mlp', 'hidden_dims': '[256, 128, 64]', 'dropout': 0.12405040791100821, 'batch_norm': True, 'lr': 2.2595649246158207e-06, 'weight_decay': 6.886876803351276e-05, 'epochs': 258, 'loss': 'mse', 'optimizer': 'adam', 'graph_mode': 'off', 'use_snp_selection': True, 'num_snps': 58661}. Best is trial 9 with value: 0.07418170351669094.
[I 2025-12-05 16:30:47,746] Trial 37 finished with value: 0.024528251806152132 and parameters: {'model_type': 'mlp', 'hidden_dims': '[512, 64]', 'dropout': 0.20756871511263536, 'batch_norm': False, 'lr': 4.446294938689996e-06, 'weight_decay': 9.121526760895848e-06, 'epochs': 135, 'loss': 'mae', 'optimizer': 'adam', 'graph_mode': 'off', 'use_snp_selection': False}. Best is trial 9 with value: 0.07418170351669094.
[I 2025-12-05 16:30:49,305] Trial 38 finished with value: 0.04797680020005253 and parameters: {'model_type': 'mlp', 'hidden_dims': '[512, 256]', 'dropout': 0.5749822693823109, 'batch_norm': True, 'lr': 0.00044199373344257686, 'weight_decay': 1.501878566249866e-06, 'epochs': 295, 'loss': 'mse', 'optimizer': 'adam', 'graph_mode': 'off', 'use_snp_selection': True, 'num_snps': 19911}. Best is trial 9 with value: 0.07418170351669094.
[I 2025-12-05 16:30:50,753] Trial 39 finished with value: 0.0617211748956154 and parameters: {'model_type': 'mlp', 'hidden_dims': '[512, 128]', 'dropout': 0.17843422004069917, 'batch_norm': False, 'lr': 5.6812175478661256e-05, 'weight_decay': 0.00010412398872024411, 'epochs': 223, 'loss': 'mse', 'optimizer': 'adam', 'graph_mode': 'off', 'use_snp_selection': False}. Best is trial 9 with value: 0.07418170351669094.
[I 2025-12-05 16:30:52,195] Trial 40 finished with value: 0.0048388511380228726 and parameters: {'model_type': 'mlp', 'hidden_dims': '[512, 128]', 'dropout': 0.2807533208687125, 'batch_norm': False, 'lr': 0.0001995986386688078, 'weight_decay': 0.0001260174517689518, 'epochs': 214, 'loss': 'mae', 'optimizer': 'adam', 'graph_mode': 'off', 'use_snp_selection': False}. Best is trial 9 with value: 0.07418170351669094.
[I 2025-12-05 16:30:53,786] Trial 41 finished with value: 0.03471692231495445 and parameters: {'model_type': 'mlp', 'hidden_dims': '[512, 128]', 'dropout': 0.17145123549856806, 'batch_norm': False, 'lr': 0.00010438545147719444, 'weight_decay': 0.00039779076329190974, 'epochs': 252, 'loss': 'mse', 'optimizer': 'adam', 'graph_mode': 'off', 'use_snp_selection': False}. Best is trial 9 with value: 0.07418170351669094.
[I 2025-12-05 16:30:55,284] Trial 42 finished with value: 0.055551126240042596 and parameters: {'model_type': 'mlp', 'hidden_dims': '[512, 128]', 'dropout': 0.13063262847304724, 'batch_norm': False, 'lr': 5.157494597642637e-05, 'weight_decay': 2.565575024039955e-05, 'epochs': 230, 'loss': 'mse', 'optimizer': 'adam', 'graph_mode': 'off', 'use_snp_selection': False}. Best is trial 9 with value: 0.07418170351669094.
[I 2025-12-05 16:30:56,658] Trial 43 finished with value: 0.05343196238728259 and parameters: {'model_type': 'mlp', 'hidden_dims': '[512, 128]', 'dropout': 0.10415603547139413, 'batch_norm': False, 'lr': 3.626568632140031e-05, 'weight_decay': 0.0008505623995775654, 'epochs': 203, 'loss': 'mse', 'optimizer': 'adam', 'graph_mode': 'off', 'use_snp_selection': False}. Best is trial 9 with value: 0.07418170351669094.
[I 2025-12-05 16:30:58,033] Trial 44 finished with value: 0.05856669044039168 and parameters: {'model_type': 'mlp', 'hidden_dims': '[512, 64]', 'dropout': 0.20002886237536643, 'batch_norm': False, 'lr': 5.93475884682826e-05, 'weight_decay': 0.00010040081007592979, 'epochs': 193, 'loss': 'mse', 'optimizer': 'adam', 'graph_mode': 'off', 'use_snp_selection': False}. Best is trial 9 with value: 0.07418170351669094.
[I 2025-12-05 16:30:58,717] Trial 45 finished with value: 0.008739181124120528 and parameters: {'model_type': 'mlp', 'hidden_dims': '[256, 128]', 'dropout': 0.17332032025191754, 'batch_norm': True, 'lr': 1.2812420948802254e-05, 'weight_decay': 3.037874932813549e-05, 'epochs': 45, 'loss': 'mse', 'optimizer': 'adam', 'graph_mode': 'off', 'use_snp_selection': False}. Best is trial 9 with value: 0.07418170351669094.
[I 2025-12-05 16:31:00,358] Trial 46 finished with value: 0.026840318772992294 and parameters: {'model_type': 'mlp', 'hidden_dims': '[512, 128]', 'dropout': 0.25600512764949646, 'batch_norm': False, 'lr': 2.3004712472628565e-05, 'weight_decay': 1.3235714012461967e-07, 'epochs': 273, 'loss': 'mse', 'optimizer': 'adam', 'graph_mode': 'off', 'use_snp_selection': False}. Best is trial 9 with value: 0.07418170351669094.
[I 2025-12-05 16:31:01,161] Trial 47 finished with value: 0.05531292878573472 and parameters: {'model_type': 'mlp', 'hidden_dims': '[128, 64]', 'dropout': 0.14353362668924358, 'batch_norm': True, 'lr': 0.00012764920230631116, 'weight_decay': 0.0001803456264880134, 'epochs': 220, 'loss': 'mse', 'optimizer': 'adam', 'graph_mode': 'off', 'use_snp_selection': False}. Best is trial 9 with value: 0.07418170351669094.
[I 2025-12-05 16:31:02,393] Trial 48 finished with value: 0.030933176960168656 and parameters: {'model_type': 'mlp', 'hidden_dims': '[512, 256]', 'dropout': 0.21713180639761714, 'batch_norm': True, 'lr': 1.1170552432785515e-06, 'weight_decay': 1.1443906973879577e-05, 'epochs': 148, 'loss': 'mse', 'optimizer': 'adam', 'graph_mode': 'off', 'use_snp_selection': False}. Best is trial 9 with value: 0.07418170351669094.
[I 2025-12-05 16:31:04,972] Trial 49 finished with value: 0.030698982524951155 and parameters: {'model_type': 'mlp', 'hidden_dims': '[512, 64]', 'dropout': 0.10027034165493756, 'batch_norm': False, 'lr': 6.589189429693429e-06, 'weight_decay': 0.0005066159281116349, 'epochs': 248, 'loss': 'mse', 'optimizer': 'adam', 'graph_mode': 'off', 'use_snp_selection': True, 'num_snps': 46888}. Best is trial 9 with value: 0.07418170351669094.
[I 2025-12-05 16:31:06,202] Trial 50 finished with value: 0.041462914930029696 and parameters: {'model_type': 'mlp', 'hidden_dims': '[256, 128, 64]', 'dropout': 0.3842414862624449, 'batch_norm': True, 'lr': 1.2383351249004025e-05, 'weight_decay': 2.809820531136569e-07, 'epochs': 289, 'loss': 'mse', 'optimizer': 'adam', 'graph_mode': 'off', 'use_snp_selection': False}. Best is trial 9 with value: 0.07418170351669094.
[I 2025-12-05 16:31:08,066] Trial 51 finished with value: 0.05490524452253641 and parameters: {'model_type': 'mlp', 'hidden_dims': '[512, 64]', 'dropout': 0.5344867165758579, 'batch_norm': False, 'lr': 4.781320959831205e-06, 'weight_decay': 3.228843637506799e-05, 'epochs': 329, 'loss': 'mae', 'optimizer': 'adam', 'graph_mode': 'off', 'use_snp_selection': False}. Best is trial 9 with value: 0.07418170351669094.
[I 2025-12-05 16:31:09,817] Trial 52 finished with value: 0.0243244475386816 and parameters: {'model_type': 'mlp', 'hidden_dims': '[512, 64]', 'dropout': 0.41413428829650034, 'batch_norm': False, 'lr': 2.5207722980040284e-05, 'weight_decay': 0.00024275616768090205, 'epochs': 308, 'loss': 'mae', 'optimizer': 'adam', 'graph_mode': 'off', 'use_snp_selection': False}. Best is trial 9 with value: 0.07418170351669094.
[I 2025-12-05 16:31:11,635] Trial 53 finished with value: 0.04604829661423141 and parameters: {'model_type': 'mlp', 'hidden_dims': '[512, 64]', 'dropout': 0.4454880621491306, 'batch_norm': False, 'lr': 3.914725641482018e-05, 'weight_decay': 1.7683715991829383e-05, 'epochs': 317, 'loss': 'mae', 'optimizer': 'adam', 'graph_mode': 'off', 'use_snp_selection': False}. Best is trial 9 with value: 0.07418170351669094.
[I 2025-12-05 16:31:12,666] Trial 54 finished with value: 0.05958189644671938 and parameters: {'model_type': 'mlp', 'hidden_dims': '[512, 256]', 'dropout': 0.5919874779407193, 'batch_norm': False, 'lr': 6.220264348113385e-05, 'weight_decay': 5.899326220224825e-07, 'epochs': 90, 'loss': 'mae', 'optimizer': 'adam', 'graph_mode': 'off', 'use_snp_selection': False}. Best is trial 9 with value: 0.07418170351669094.
[I 2025-12-05 16:31:13,681] Trial 55 finished with value: 0.032853531142376796 and parameters: {'model_type': 'mlp', 'hidden_dims': '[512, 256]', 'dropout': 0.18691196435558294, 'batch_norm': False, 'lr': 7.038336274558253e-05, 'weight_decay': 9.620211854377923e-07, 'epochs': 86, 'loss': 'mae', 'optimizer': 'adam', 'graph_mode': 'off', 'use_snp_selection': False}. Best is trial 9 with value: 0.07418170351669094.
[I 2025-12-05 16:31:14,698] Trial 56 finished with value: 0.03521430681026336 and parameters: {'model_type': 'mlp', 'hidden_dims': '[512, 256]', 'dropout': 0.32809099024142446, 'batch_norm': True, 'lr': 0.00017581563916942673, 'weight_decay': 1.562940175181822e-07, 'epochs': 93, 'loss': 'mae', 'optimizer': 'adam', 'graph_mode': 'off', 'use_snp_selection': False}. Best is trial 9 with value: 0.07418170351669094.
[I 2025-12-05 16:31:15,596] Trial 57 finished with value: 0.05635552871932259 and parameters: {'model_type': 'mlp', 'hidden_dims': '[512, 256]', 'dropout': 0.1620532465730459, 'batch_norm': True, 'lr': 0.00010191552857256761, 'weight_decay': 5.658648741104265e-07, 'epochs': 59, 'loss': 'mse', 'optimizer': 'adam', 'graph_mode': 'off', 'use_snp_selection': False}. Best is trial 9 with value: 0.07418170351669094.
[I 2025-12-05 16:31:16,917] Trial 58 finished with value: 0.04198976025315447 and parameters: {'model_type': 'mlp', 'hidden_dims': '[512, 256]', 'dropout': 0.1398466291831429, 'batch_norm': False, 'lr': 1.7628935033315245e-05, 'weight_decay': 2.4506644434304583e-06, 'epochs': 171, 'loss': 'mse', 'optimizer': 'adam', 'graph_mode': 'off', 'use_snp_selection': False}. Best is trial 9 with value: 0.07418170351669094.
[I 2025-12-05 16:31:18,014] Trial 59 finished with value: 0.06609880068953507 and parameters: {'model_type': 'mlp', 'hidden_dims': '[512, 256]', 'dropout': 0.5690483175998374, 'batch_norm': True, 'lr': 6.106460241421564e-05, 'weight_decay': 2.4010197278424117e-07, 'epochs': 104, 'loss': 'mse', 'optimizer': 'adam', 'graph_mode': 'off', 'use_snp_selection': False}. Best is trial 9 with value: 0.07418170351669094.
[I 2025-12-05 16:31:19,412] Trial 60 finished with value: 0.05737635831315922 and parameters: {'model_type': 'mlp', 'hidden_dims': '[512, 128]', 'dropout': 0.1167778825748069, 'batch_norm': True, 'lr': 0.0002714061072194858, 'weight_decay': 2.849205322018039e-07, 'epochs': 117, 'loss': 'mse', 'optimizer': 'adam', 'graph_mode': 'off', 'use_snp_selection': True, 'num_snps': 24139}. Best is trial 9 with value: 0.07418170351669094.
[I 2025-12-05 16:31:20,439] Trial 61 finished with value: 0.020985623132269076 and parameters: {'model_type': 'mlp', 'hidden_dims': '[512, 256]', 'dropout': 0.5919435255483749, 'batch_norm': True, 'lr': 6.330557437409186e-05, 'weight_decay': 4.883508107513644e-07, 'epochs': 98, 'loss': 'mse', 'optimizer': 'adam', 'graph_mode': 'off', 'use_snp_selection': False}. Best is trial 9 with value: 0.07418170351669094.
[I 2025-12-05 16:31:21,382] Trial 62 finished with value: 0.04723990718604047 and parameters: {'model_type': 'mlp', 'hidden_dims': '[512, 256]', 'dropout': 0.5468827552944615, 'batch_norm': True, 'lr': 4.5487451724558265e-05, 'weight_decay': 1.0046383943039858e-07, 'epochs': 60, 'loss': 'mse', 'optimizer': 'adam', 'graph_mode': 'off', 'use_snp_selection': False}. Best is trial 9 with value: 0.07418170351669094.
[I 2025-12-05 16:31:22,535] Trial 63 finished with value: 0.02237307246041133 and parameters: {'model_type': 'mlp', 'hidden_dims': '[512, 256]', 'dropout': 0.5520018735937736, 'batch_norm': True, 'lr': 3.398045391198838e-05, 'weight_decay': 2.153814363270086e-07, 'epochs': 119, 'loss': 'mse', 'optimizer': 'adam', 'graph_mode': 'off', 'use_snp_selection': False}. Best is trial 9 with value: 0.07418170351669094.
[I 2025-12-05 16:31:23,741] Trial 64 finished with value: 0.04545239789368154 and parameters: {'model_type': 'mlp', 'hidden_dims': '[512, 256]', 'dropout': 0.5943778679944084, 'batch_norm': True, 'lr': 8.871757072906606e-05, 'weight_decay': 8.671482896323576e-07, 'epochs': 138, 'loss': 'mse', 'optimizer': 'adam', 'graph_mode': 'off', 'use_snp_selection': False}. Best is trial 9 with value: 0.07418170351669094.
[I 2025-12-05 16:31:24,478] Trial 65 finished with value: 0.019611941969806805 and parameters: {'model_type': 'mlp', 'hidden_dims': '[128, 64]', 'dropout': 0.5683818603725496, 'batch_norm': True, 'lr': 2.7191719345986573e-05, 'weight_decay': 3.2813949569402094e-07, 'epochs': 158, 'loss': 'mse', 'optimizer': 'adam', 'graph_mode': 'off', 'use_snp_selection': False}. Best is trial 9 with value: 0.07418170351669094.
[I 2025-12-05 16:31:25,426] Trial 66 finished with value: 0.05540196569296316 and parameters: {'model_type': 'mlp', 'hidden_dims': '[512, 256]', 'dropout': 0.5118617098203878, 'batch_norm': True, 'lr': 0.0008681069598433844, 'weight_decay': 6.971815814396144e-07, 'epochs': 74, 'loss': 'mae', 'optimizer': 'adam', 'graph_mode': 'off', 'use_snp_selection': False}. Best is trial 9 with value: 0.07418170351669094.
[I 2025-12-05 16:31:26,395] Trial 67 finished with value: 0.038590355507099966 and parameters: {'model_type': 'mlp', 'hidden_dims': '[256, 128]', 'dropout': 0.22832200861068574, 'batch_norm': False, 'lr': 0.0003901099113895223, 'weight_decay': 1.3384409540564629e-06, 'epochs': 193, 'loss': 'mse', 'optimizer': 'adam', 'graph_mode': 'off', 'use_snp_selection': False}. Best is trial 9 with value: 0.07418170351669094.
[I 2025-12-05 16:31:27,483] Trial 68 finished with value: 0.05282140084062857 and parameters: {'model_type': 'mlp', 'hidden_dims': '[512, 256]', 'dropout': 0.18643223432297998, 'batch_norm': True, 'lr': 0.00011990352729736973, 'weight_decay': 2.1405676564518573e-07, 'epochs': 100, 'loss': 'mse', 'optimizer': 'adam', 'graph_mode': 'off', 'use_snp_selection': False}. Best is trial 9 with value: 0.07418170351669094.
[I 2025-12-05 16:31:28,164] Trial 69 finished with value: -0.008142167326651165 and parameters: {'model_type': 'mlp', 'hidden_dims': '[128, 64]', 'dropout': 0.4911513666427484, 'batch_norm': False, 'lr': 5.789670529594146e-05, 'weight_decay': 4.48857715142188e-07, 'epochs': 112, 'loss': 'mse', 'optimizer': 'adam', 'graph_mode': 'off', 'use_snp_selection': False}. Best is trial 9 with value: 0.07418170351669094.
[I 2025-12-05 16:31:29,020] Trial 70 finished with value: 0.013505270055320463 and parameters: {'model_type': 'mlp', 'hidden_dims': '[256, 128, 64]', 'dropout': 0.5228705031184968, 'batch_norm': True, 'lr': 9.14788362255285e-06, 'weight_decay': 1.567184751243546e-07, 'epochs': 126, 'loss': 'mse', 'optimizer': 'adam', 'graph_mode': 'off', 'use_snp_selection': False}. Best is trial 9 with value: 0.07418170351669094.
[I 2025-12-05 16:31:30,299] Trial 71 finished with value: 0.0008937391537699754 and parameters: {'model_type': 'mlp', 'hidden_dims': '[512, 64]', 'dropout': 0.5775349457647849, 'batch_norm': False, 'lr': 3.095324456341232e-06, 'weight_decay': 3.754556397784551e-06, 'epochs': 171, 'loss': 'mae', 'optimizer': 'adam', 'graph_mode': 'off', 'use_snp_selection': False}. Best is trial 9 with value: 0.07418170351669094.
