[I 2025-12-06 08:20:58,235] Trial 87 finished with value: 0.16643166875602947 and parameters: {'model_type': 'mlp', 'hidden_dims': '[256, 128]', 'dropout': 0.25176010427004325, 'batch_norm': True, 'lr': 1.3965694856502506e-05, 'weight_decay': 3.701068977221889e-05, 'epochs': 44, 'loss': 'mae', 'optimizer': 'adam', 'graph_mode': 'off', 'use_snp_selection': True, 'num_snps': 32255}. Best is trial 28 with value: 0.2663812453467505.
[I 2025-12-06 08:21:53,363] Trial 88 finished with value: 0.24986710109648042 and parameters: {'model_type': 'mlp', 'hidden_dims': '[256, 128, 64]', 'dropout': 0.26565595005614706, 'batch_norm': False, 'lr': 5.796892051663898e-06, 'weight_decay': 6.816456409409258e-05, 'epochs': 117, 'loss': 'mae', 'optimizer': 'adam', 'graph_mode': 'off', 'use_snp_selection': True, 'num_snps': 41963}. Best is trial 28 with value: 0.2663812453467505.
[I 2025-12-06 08:22:59,415] Trial 89 finished with value: 0.23634615845536433 and parameters: {'model_type': 'mlp', 'hidden_dims': '[512, 64]', 'dropout': 0.2674759278328761, 'batch_norm': False, 'lr': 9.779056345095365e-06, 'weight_decay': 0.00012810394769476654, 'epochs': 114, 'loss': 'mae', 'optimizer': 'adam', 'graph_mode': 'off', 'use_snp_selection': True, 'num_snps': 44014}. Best is trial 28 with value: 0.2663812453467505.
[I 2025-12-06 08:23:25,163] Trial 90 finished with value: 0.2271617166029972 and parameters: {'model_type': 'mlp', 'hidden_dims': '[256, 128, 64]', 'dropout': 0.28106096282562304, 'batch_norm': False, 'lr': 2.198903664298393e-05, 'weight_decay': 5.9406044472239646e-05, 'epochs': 138, 'loss': 'mae', 'optimizer': 'adam', 'graph_mode': 'off', 'use_snp_selection': False}. Best is trial 28 with value: 0.2663812453467505.
[I 2025-12-06 08:24:15,595] Trial 91 finished with value: 0.23475885617120595 and parameters: {'model_type': 'mlp', 'hidden_dims': '[256, 128, 64]', 'dropout': 0.24154075741075132, 'batch_norm': False, 'lr': 5.781099392660004e-06, 'weight_decay': 7.098800054674427e-05, 'epochs': 69, 'loss': 'mae', 'optimizer': 'adam', 'graph_mode': 'off', 'use_snp_selection': True, 'num_snps': 41628}. Best is trial 28 with value: 0.2663812453467505.
[I 2025-12-06 08:25:11,115] Trial 92 finished with value: 0.2408661743709502 and parameters: {'model_type': 'mlp', 'hidden_dims': '[256, 128, 64]', 'dropout': 0.31236886979315504, 'batch_norm': False, 'lr': 4.120612133854865e-06, 'weight_decay': 3.452892944457674e-05, 'epochs': 106, 'loss': 'mae', 'optimizer': 'adam', 'graph_mode': 'off', 'use_snp_selection': True, 'num_snps': 44925}. Best is trial 28 with value: 0.2663812453467505.
[I 2025-12-06 08:26:02,008] Trial 93 finished with value: 0.19028056313542102 and parameters: {'model_type': 'mlp', 'hidden_dims': '[256, 128, 64]', 'dropout': 0.29786978156558874, 'batch_norm': False, 'lr': 2.0175213481500804e-06, 'weight_decay': 1.4206840789156894e-05, 'epochs': 90, 'loss': 'mae', 'optimizer': 'adam', 'graph_mode': 'off', 'use_snp_selection': True, 'num_snps': 38763}. Best is trial 28 with value: 0.2663812453467505.
[I 2025-12-06 08:26:51,831] Trial 94 finished with value: 0.2480165315735659 and parameters: {'model_type': 'mlp', 'hidden_dims': '[256, 128, 64]', 'dropout': 0.2657057427454618, 'batch_norm': False, 'lr': 6.147329466185103e-06, 'weight_decay': 4.9027442139513786e-05, 'epochs': 120, 'loss': 'mae', 'optimizer': 'adam', 'graph_mode': 'off', 'use_snp_selection': True, 'num_snps': 33407}. Best is trial 28 with value: 0.2663812453467505.
[I 2025-12-06 08:27:46,320] Trial 95 finished with value: 0.2515828745390597 and parameters: {'model_type': 'mlp', 'hidden_dims': '[256, 128, 64]', 'dropout': 0.3495698681158701, 'batch_norm': False, 'lr': 4.93894871892477e-06, 'weight_decay': 1.684640233103453e-05, 'epochs': 152, 'loss': 'mae', 'optimizer': 'adam', 'graph_mode': 'off', 'use_snp_selection': True, 'num_snps': 37308}. Best is trial 28 with value: 0.2663812453467505.
[I 2025-12-06 08:28:40,459] Trial 96 finished with value: 0.2541633345279287 and parameters: {'model_type': 'mlp', 'hidden_dims': '[256, 128, 64]', 'dropout': 0.3466209540770215, 'batch_norm': False, 'lr': 1.0646152707053245e-05, 'weight_decay': 9.276258365721298e-06, 'epochs': 150, 'loss': 'mae', 'optimizer': 'adam', 'graph_mode': 'off', 'use_snp_selection': True, 'num_snps': 36839}. Best is trial 28 with value: 0.2663812453467505.
[I 2025-12-06 08:29:39,351] Trial 97 finished with value: 0.22078020564569503 and parameters: {'model_type': 'mlp', 'hidden_dims': '[512, 128]', 'dropout': 0.3761590232360545, 'batch_norm': False, 'lr': 1.0379065078193609e-05, 'weight_decay': 9.760379585091193e-06, 'epochs': 151, 'loss': 'mse', 'optimizer': 'adam', 'graph_mode': 'off', 'use_snp_selection': True, 'num_snps': 30677}. Best is trial 28 with value: 0.2663812453467505.
[I 2025-12-06 08:30:31,431] Trial 98 finished with value: 0.2589048149146475 and parameters: {'model_type': 'mlp', 'hidden_dims': '[256, 128, 64]', 'dropout': 0.36733678595566294, 'batch_norm': False, 'lr': 1.5742240157241464e-05, 'weight_decay': 4.108844180603437e-06, 'epochs': 87, 'loss': 'mae', 'optimizer': 'adam', 'graph_mode': 'off', 'use_snp_selection': True, 'num_snps': 42134}. Best is trial 28 with value: 0.2663812453467505.
[I 2025-12-06 08:31:20,346] Trial 99 finished with value: 0.25773972003954226 and parameters: {'model_type': 'mlp', 'hidden_dims': '[256, 128, 64]', 'dropout': 0.34852974872083253, 'batch_norm': False, 'lr': 1.6347284250197356e-05, 'weight_decay': 3.7672255217523087e-06, 'epochs': 85, 'loss': 'mae', 'optimizer': 'adam', 'graph_mode': 'off', 'use_snp_selection': True, 'num_snps': 36827}. Best is trial 28 with value: 0.2663812453467505.
[I 2025-12-06 08:32:09,494] Trial 100 finished with value: 0.24871451818278545 and parameters: {'model_type': 'mlp', 'hidden_dims': '[256, 128, 64]', 'dropout': 0.3465591774357073, 'batch_norm': False, 'lr': 2.3419123204625942e-05, 'weight_decay': 1.6210919175012805e-06, 'epochs': 87, 'loss': 'mae', 'optimizer': 'adam', 'graph_mode': 'off', 'use_snp_selection': True, 'num_snps': 36724}. Best is trial 28 with value: 0.2663812453467505.
[I 2025-12-06 08:32:58,267] Trial 101 finished with value: 0.26428392028494296 and parameters: {'model_type': 'mlp', 'hidden_dims': '[256, 128, 64]', 'dropout': 0.39721649977938817, 'batch_norm': False, 'lr': 1.620522831302426e-05, 'weight_decay': 1.950345934417147e-06, 'epochs': 107, 'loss': 'mae', 'optimizer': 'adam', 'graph_mode': 'off', 'use_snp_selection': True, 'num_snps': 34038}. Best is trial 28 with value: 0.2663812453467505.
[I 2025-12-06 08:33:46,848] Trial 102 finished with value: 0.2552218285253292 and parameters: {'model_type': 'mlp', 'hidden_dims': '[256, 128, 64]', 'dropout': 0.4213966154033533, 'batch_norm': False, 'lr': 1.2487108139355085e-05, 'weight_decay': 2.2983192940004214e-06, 'epochs': 106, 'loss': 'mae', 'optimizer': 'adam', 'graph_mode': 'off', 'use_snp_selection': True, 'num_snps': 34020}. Best is trial 28 with value: 0.2663812453467505.
[I 2025-12-06 08:34:32,992] Trial 103 finished with value: 0.24389209095617392 and parameters: {'model_type': 'mlp', 'hidden_dims': '[256, 128, 64]', 'dropout': 0.43058676721890726, 'batch_norm': False, 'lr': 1.628530720167582e-05, 'weight_decay': 2.1097897925171313e-06, 'epochs': 73, 'loss': 'mae', 'optimizer': 'adam', 'graph_mode': 'off', 'use_snp_selection': True, 'num_snps': 34131}. Best is trial 28 with value: 0.2663812453467505.
[I 2025-12-06 08:35:23,324] Trial 104 finished with value: 0.2443815372757913 and parameters: {'model_type': 'mlp', 'hidden_dims': '[256, 128, 64]', 'dropout': 0.39509601177410203, 'batch_norm': False, 'lr': 3.2446650831084745e-05, 'weight_decay': 7.379749474075421e-07, 'epochs': 108, 'loss': 'mae', 'optimizer': 'adam', 'graph_mode': 'off', 'use_snp_selection': True, 'num_snps': 36741}. Best is trial 28 with value: 0.2663812453467505.
[I 2025-12-06 08:36:10,761] Trial 105 finished with value: 0.23518581275937356 and parameters: {'model_type': 'mlp', 'hidden_dims': '[256, 128, 64]', 'dropout': 0.3657551750923567, 'batch_norm': False, 'lr': 1.3498717628632078e-05, 'weight_decay': 3.7096847315753124e-06, 'epochs': 133, 'loss': 'mae', 'optimizer': 'adam', 'graph_mode': 'off', 'use_snp_selection': True, 'num_snps': 28476}. Best is trial 28 with value: 0.2663812453467505.
[I 2025-12-06 08:37:00,857] Trial 106 finished with value: 0.18874026625921675 and parameters: {'model_type': 'mlp', 'hidden_dims': '[256, 128, 64]', 'dropout': 0.4198358391952755, 'batch_norm': True, 'lr': 1.818796963635034e-05, 'weight_decay': 9.125055238848095e-07, 'epochs': 123, 'loss': 'mae', 'optimizer': 'adam', 'graph_mode': 'off', 'use_snp_selection': True, 'num_snps': 33914}. Best is trial 28 with value: 0.2663812453467505.
[I 2025-12-06 08:37:47,630] Trial 107 finished with value: 0.2501389166167847 and parameters: {'model_type': 'mlp', 'hidden_dims': '[256, 128, 64]', 'dropout': 0.3872098503338689, 'batch_norm': False, 'lr': 3.0567436492441604e-05, 'weight_decay': 1.897183931058751e-06, 'epochs': 93, 'loss': 'mae', 'optimizer': 'adam', 'graph_mode': 'off', 'use_snp_selection': True, 'num_snps': 32111}. Best is trial 28 with value: 0.2663812453467505.
[I 2025-12-06 08:38:32,194] Trial 108 finished with value: 0.2525626582882628 and parameters: {'model_type': 'mlp', 'hidden_dims': '[128, 64]', 'dropout': 0.40231562195537, 'batch_norm': False, 'lr': 2.146653469673702e-05, 'weight_decay': 2.549494836413031e-06, 'epochs': 86, 'loss': 'mae', 'optimizer': 'adam', 'graph_mode': 'off', 'use_snp_selection': True, 'num_snps': 35459}. Best is trial 28 with value: 0.2663812453467505.
[I 2025-12-06 08:39:16,869] Trial 109 finished with value: 0.2446123391560074 and parameters: {'model_type': 'mlp', 'hidden_dims': '[128, 64]', 'dropout': 0.4449498807096713, 'batch_norm': False, 'lr': 1.5536107246959955e-05, 'weight_decay': 1.1724948213992375e-06, 'epochs': 86, 'loss': 'mae', 'optimizer': 'adam', 'graph_mode': 'off', 'use_snp_selection': True, 'num_snps': 35840}. Best is trial 28 with value: 0.2663812453467505.
[I 2025-12-06 08:40:01,386] Trial 110 finished with value: 0.24065905003429053 and parameters: {'model_type': 'mlp', 'hidden_dims': '[128, 64]', 'dropout': 0.4020903422965426, 'batch_norm': False, 'lr': 2.3474996970667e-05, 'weight_decay': 2.616003059434368e-06, 'epochs': 67, 'loss': 'mae', 'optimizer': 'adam', 'graph_mode': 'off', 'use_snp_selection': True, 'num_snps': 37612}. Best is trial 28 with value: 0.2663812453467505.
[I 2025-12-06 08:40:46,185] Trial 111 finished with value: 0.23268988200305163 and parameters: {'model_type': 'mlp', 'hidden_dims': '[128, 64]', 'dropout': 0.3685087055391061, 'batch_norm': False, 'lr': 1.1999442560857288e-05, 'weight_decay': 4.255014773464499e-06, 'epochs': 98, 'loss': 'mae', 'optimizer': 'adam', 'graph_mode': 'off', 'use_snp_selection': True, 'num_snps': 34886}. Best is trial 28 with value: 0.2663812453467505.
[I 2025-12-06 08:41:32,975] Trial 112 finished with value: 0.2321616749863479 and parameters: {'model_type': 'mlp', 'hidden_dims': '[128, 64]', 'dropout': 0.4240712822311469, 'batch_norm': False, 'lr': 1.8710858146518986e-05, 'weight_decay': 6.646368015642056e-06, 'epochs': 107, 'loss': 'mae', 'optimizer': 'adam', 'graph_mode': 'off', 'use_snp_selection': True, 'num_snps': 38832}. Best is trial 28 with value: 0.2663812453467505.
[I 2025-12-06 08:42:18,128] Trial 113 finished with value: 0.2430825655821632 and parameters: {'model_type': 'mlp', 'hidden_dims': '[256, 128, 64]', 'dropout': 0.38206213678867235, 'batch_norm': False, 'lr': 2.1289410237751463e-05, 'weight_decay': 2.474307580494999e-06, 'epochs': 84, 'loss': 'mae', 'optimizer': 'adam', 'graph_mode': 'off', 'use_snp_selection': True, 'num_snps': 30597}. Best is trial 28 with value: 0.2663812453467505.
[I 2025-12-06 08:43:05,980] Trial 114 finished with value: 0.24458730342912993 and parameters: {'model_type': 'mlp', 'hidden_dims': '[256, 128, 64]', 'dropout': 0.34304912522993875, 'batch_norm': False, 'lr': 1.4466168071172195e-05, 'weight_decay': 5.729041919312162e-06, 'epochs': 72, 'loss': 'mae', 'optimizer': 'adam', 'graph_mode': 'off', 'use_snp_selection': True, 'num_snps': 36929}. Best is trial 28 with value: 0.2663812453467505.
[I 2025-12-06 08:43:54,123] Trial 115 finished with value: 0.2510849291443814 and parameters: {'model_type': 'mlp', 'hidden_dims': '[256, 128, 64]', 'dropout': 0.41142665176527227, 'batch_norm': False, 'lr': 1.131358915668816e-05, 'weight_decay': 3.1829845236275935e-06, 'epochs': 102, 'loss': 'mae', 'optimizer': 'adam', 'graph_mode': 'off', 'use_snp_selection': True, 'num_snps': 33094}. Best is trial 28 with value: 0.2663812453467505.
[I 2025-12-06 08:44:43,903] Trial 116 finished with value: 0.221662062440323 and parameters: {'model_type': 'mlp', 'hidden_dims': '[512, 256]', 'dropout': 0.40881765040002893, 'batch_norm': False, 'lr': 1.14743300961543e-05, 'weight_decay': 3.365035561705282e-06, 'epochs': 101, 'loss': 'mae', 'optimizer': 'adam', 'graph_mode': 'off', 'use_snp_selection': True, 'num_snps': 26352}. Best is trial 28 with value: 0.2663812453467505.
[I 2025-12-06 08:45:30,193] Trial 117 finished with value: 0.2436188740331729 and parameters: {'model_type': 'mlp', 'hidden_dims': '[256, 128, 64]', 'dropout': 0.39947034266419373, 'batch_norm': False, 'lr': 2.6514368287007652e-05, 'weight_decay': 1.1437733220036869e-06, 'epochs': 80, 'loss': 'mse', 'optimizer': 'adam', 'graph_mode': 'off', 'use_snp_selection': True, 'num_snps': 33013}. Best is trial 28 with value: 0.2663812453467505.
[I 2025-12-06 08:46:16,063] Trial 118 finished with value: 0.2534016952600978 and parameters: {'model_type': 'mlp', 'hidden_dims': '[256, 128, 64]', 'dropout': 0.43771472613022966, 'batch_norm': False, 'lr': 1.6949159318645607e-05, 'weight_decay': 2.2647594750013285e-06, 'epochs': 61, 'loss': 'mae', 'optimizer': 'adam', 'graph_mode': 'off', 'use_snp_selection': True, 'num_snps': 34682}. Best is trial 28 with value: 0.2663812453467505.
[I 2025-12-06 08:47:03,059] Trial 119 finished with value: 0.23978412877988817 and parameters: {'model_type': 'mlp', 'hidden_dims': '[256, 128]', 'dropout': 0.46555837162304964, 'batch_norm': False, 'lr': 1.679288022494891e-05, 'weight_decay': 4.1206178712655585e-06, 'epochs': 75, 'loss': 'mae', 'optimizer': 'adam', 'graph_mode': 'off', 'use_snp_selection': True, 'num_snps': 34954}. Best is trial 28 with value: 0.2663812453467505.
[I 2025-12-06 08:47:48,312] Trial 120 finished with value: 0.2404339324083386 and parameters: {'model_type': 'mlp', 'hidden_dims': '[128, 64]', 'dropout': 0.44384443441644894, 'batch_norm': False, 'lr': 3.76933560175557e-05, 'weight_decay': 2.2757207092914053e-06, 'epochs': 55, 'loss': 'mae', 'optimizer': 'adam', 'graph_mode': 'off', 'use_snp_selection': True, 'num_snps': 40812}. Best is trial 28 with value: 0.2663812453467505.
[I 2025-12-06 08:48:35,250] Trial 121 finished with value: 0.25107141059112575 and parameters: {'model_type': 'mlp', 'hidden_dims': '[256, 128, 64]', 'dropout': 0.3852651790039199, 'batch_norm': False, 'lr': 1.3411763079198295e-05, 'weight_decay': 2.903525666806306e-06, 'epochs': 91, 'loss': 'mae', 'optimizer': 'adam', 'graph_mode': 'off', 'use_snp_selection': True, 'num_snps': 31658}. Best is trial 28 with value: 0.2663812453467505.
[I 2025-12-06 08:49:18,767] Trial 122 finished with value: 0.23335947735651788 and parameters: {'model_type': 'mlp', 'hidden_dims': '[256, 128, 64]', 'dropout': 0.4321208159896686, 'batch_norm': False, 'lr': 1.1074532401617236e-05, 'weight_decay': 1.4668206469344014e-06, 'epochs': 42, 'loss': 'mae', 'optimizer': 'adam', 'graph_mode': 'off', 'use_snp_selection': True, 'num_snps': 33217}. Best is trial 28 with value: 0.2663812453467505.
[I 2025-12-06 08:50:02,309] Trial 123 finished with value: 0.23998357788021854 and parameters: {'model_type': 'mlp', 'hidden_dims': '[256, 128, 64]', 'dropout': 0.4185520588236237, 'batch_norm': False, 'lr': 1.9552384652699522e-05, 'weight_decay': 3.0495015321579075e-06, 'epochs': 60, 'loss': 'mae', 'optimizer': 'adam', 'graph_mode': 'off', 'use_snp_selection': True, 'num_snps': 29615}. Best is trial 28 with value: 0.2663812453467505.
[I 2025-12-06 08:50:54,087] Trial 124 finished with value: 0.2361115233923286 and parameters: {'model_type': 'mlp', 'hidden_dims': '[256, 128, 64]', 'dropout': 0.4516700976517064, 'batch_norm': False, 'lr': 5.6178876440265235e-05, 'weight_decay': 1.8412313918345027e-06, 'epochs': 130, 'loss': 'mae', 'optimizer': 'adam', 'graph_mode': 'off', 'use_snp_selection': True, 'num_snps': 36059}. Best is trial 28 with value: 0.2663812453467505.
[I 2025-12-06 08:51:40,889] Trial 125 finished with value: 0.22087169573530527 and parameters: {'model_type': 'mlp', 'hidden_dims': '[256, 128, 64]', 'dropout': 0.41057645281338023, 'batch_norm': False, 'lr': 8.725513237958452e-06, 'weight_decay': 5.0167211712130555e-06, 'epochs': 50, 'loss': 'mae', 'optimizer': 'adam', 'graph_mode': 'off', 'use_snp_selection': True, 'num_snps': 38933}. Best is trial 28 with value: 0.2663812453467505.
[I 2025-12-06 08:52:12,255] Trial 126 finished with value: 0.13376223339438917 and parameters: {'model_type': 'mlp', 'hidden_dims': '[512, 64]', 'dropout': 0.3546151630167278, 'batch_norm': True, 'lr': 3.0263716653091422e-05, 'weight_decay': 7.873377201656354e-06, 'epochs': 95, 'loss': 'mae', 'optimizer': 'adam', 'graph_mode': 'off', 'use_snp_selection': True, 'num_snps': 2866}. Best is trial 28 with value: 0.2663812453467505.
[I 2025-12-06 08:53:02,616] Trial 127 finished with value: 0.24064994332979633 and parameters: {'model_type': 'mlp', 'hidden_dims': '[256, 128, 64]', 'dropout': 0.3736183176221625, 'batch_norm': False, 'lr': 0.00038621018060795514, 'weight_decay': 1.3411195407077453e-06, 'epochs': 106, 'loss': 'mae', 'optimizer': 'adam', 'graph_mode': 'off', 'use_snp_selection': True, 'num_snps': 37370}. Best is trial 28 with value: 0.2663812453467505.
[I 2025-12-06 08:53:55,616] Trial 128 finished with value: 0.2508101513895701 and parameters: {'model_type': 'mlp', 'hidden_dims': '[256, 128, 64]', 'dropout': 0.4702001888337517, 'batch_norm': False, 'lr': 1.612998921190175e-05, 'weight_decay': 3.703716626348499e-06, 'epochs': 163, 'loss': 'mae', 'optimizer': 'adam', 'graph_mode': 'off', 'use_snp_selection': True, 'num_snps': 34314}. Best is trial 28 with value: 0.2663812453467505.
[I 2025-12-06 08:54:45,740] Trial 129 finished with value: 0.2536169945782124 and parameters: {'model_type': 'mlp', 'hidden_dims': '[256, 128, 64]', 'dropout': 0.39483259957195116, 'batch_norm': False, 'lr': 1.2648945567365631e-05, 'weight_decay': 2.151989201634672e-06, 'epochs': 145, 'loss': 'mae', 'optimizer': 'adam', 'graph_mode': 'off', 'use_snp_selection': True, 'num_snps': 31361}. Best is trial 28 with value: 0.2663812453467505.
[I 2025-12-06 08:55:38,094] Trial 130 finished with value: 0.24045882521329115 and parameters: {'model_type': 'mlp', 'hidden_dims': '[256, 128, 64]', 'dropout': 0.39158231034865704, 'batch_norm': False, 'lr': 1.3362035450811928e-05, 'weight_decay': 9.087885580741987e-07, 'epochs': 140, 'loss': 'mae', 'optimizer': 'adam', 'graph_mode': 'off', 'use_snp_selection': True, 'num_snps': 35308}. Best is trial 28 with value: 0.2663812453467505.
[I 2025-12-06 08:56:42,610] Trial 131 finished with value: 0.2319373842071549 and parameters: {'model_type': 'mlp', 'hidden_dims': '[256, 128, 64]', 'dropout': 0.3628471635032249, 'batch_norm': False, 'lr': 1.0007842699812362e-05, 'weight_decay': 2.429943326031174e-06, 'epochs': 340, 'loss': 'mae', 'optimizer': 'adam', 'graph_mode': 'off', 'use_snp_selection': True, 'num_snps': 31671}. Best is trial 28 with value: 0.2663812453467505.
[I 2025-12-06 08:57:32,877] Trial 132 finished with value: 0.24856823030452344 and parameters: {'model_type': 'mlp', 'hidden_dims': '[256, 128, 64]', 'dropout': 0.4152863679248982, 'batch_norm': False, 'lr': 1.827541778959291e-05, 'weight_decay': 1.967648340504946e-06, 'epochs': 146, 'loss': 'mae', 'optimizer': 'adam', 'graph_mode': 'off', 'use_snp_selection': True, 'num_snps': 31153}. Best is trial 28 with value: 0.2663812453467505.
[I 2025-12-06 08:58:22,451] Trial 133 finished with value: 0.2518398906424258 and parameters: {'model_type': 'mlp', 'hidden_dims': '[256, 128, 64]', 'dropout': 0.4281106673116253, 'batch_norm': False, 'lr': 1.5023754493484206e-05, 'weight_decay': 3.4622749775707647e-06, 'epochs': 121, 'loss': 'mae', 'optimizer': 'adam', 'graph_mode': 'off', 'use_snp_selection': True, 'num_snps': 33312}. Best is trial 28 with value: 0.2663812453467505.
[I 2025-12-06 08:59:09,715] Trial 134 finished with value: 0.23297203099763716 and parameters: {'model_type': 'mlp', 'hidden_dims': '[256, 128, 64]', 'dropout': 0.43101145899125753, 'batch_norm': False, 'lr': 2.5641454643099614e-05, 'weight_decay': 4.797052712766262e-07, 'epochs': 122, 'loss': 'mae', 'optimizer': 'adam', 'graph_mode': 'off', 'use_snp_selection': True, 'num_snps': 28293}. Best is trial 28 with value: 0.2663812453467505.
[I 2025-12-06 09:00:05,014] Trial 135 finished with value: 0.24111548421994677 and parameters: {'model_type': 'mlp', 'hidden_dims': '[256, 128, 64]', 'dropout': 0.35025330659351406, 'batch_norm': False, 'lr': 2.1553413225700685e-05, 'weight_decay': 5.875664953764939e-06, 'epochs': 149, 'loss': 'mae', 'optimizer': 'adam', 'graph_mode': 'off', 'use_snp_selection': True, 'num_snps': 38061}. Best is trial 28 with value: 0.2663812453467505.
[I 2025-12-06 09:00:57,874] Trial 136 finished with value: 0.2414919392168115 and parameters: {'model_type': 'mlp', 'hidden_dims': '[256, 128, 64]', 'dropout': 0.3794671123108079, 'batch_norm': False, 'lr': 1.455912863386131e-05, 'weight_decay': 1.702705504537051e-06, 'epochs': 137, 'loss': 'mae', 'optimizer': 'adam', 'graph_mode': 'off', 'use_snp_selection': True, 'num_snps': 36524}. Best is trial 28 with value: 0.2663812453467505.
