[I 2025-12-05 21:12:24,548] Trial 115 finished with value: 0.22212208889416268 and parameters: {'model_type': 'mlp', 'hidden_dims': '[512, 128]', 'dropout': 0.22376463920518272, 'batch_norm': False, 'lr': 4.480144491634685e-05, 'weight_decay': 5.170358671748148e-05, 'epochs': 40, 'loss': 'mse', 'optimizer': 'adam', 'graph_mode': 'off', 'use_snp_selection': False}. Best is trial 102 with value: 0.23243310564913916.
[I 2025-12-05 21:13:12,434] Trial 116 finished with value: 0.18763274517488354 and parameters: {'model_type': 'mlp', 'hidden_dims': '[512, 128]', 'dropout': 0.20943603941624753, 'batch_norm': False, 'lr': 3.049442008767267e-05, 'weight_decay': 2.7341237887355046e-05, 'epochs': 91, 'loss': 'mse', 'optimizer': 'adam', 'graph_mode': 'off', 'use_snp_selection': True, 'num_snps': 27031}. Best is trial 102 with value: 0.23243310564913916.
[I 2025-12-05 21:13:40,726] Trial 117 finished with value: 0.22343846184709665 and parameters: {'model_type': 'mlp', 'hidden_dims': '[512, 128]', 'dropout': 0.204703990922201, 'batch_norm': False, 'lr': 6.473184544950352e-05, 'weight_decay': 3.754950780277136e-05, 'epochs': 80, 'loss': 'mse', 'optimizer': 'adam', 'graph_mode': 'off', 'use_snp_selection': False}. Best is trial 102 with value: 0.23243310564913916.
[I 2025-12-05 21:14:02,925] Trial 118 finished with value: 0.21830279123068053 and parameters: {'model_type': 'mlp', 'hidden_dims': '[512, 128]', 'dropout': 0.2386599099562231, 'batch_norm': False, 'lr': 2.5881097131277375e-05, 'weight_decay': 0.00015516656469365193, 'epochs': 56, 'loss': 'mse', 'optimizer': 'adam', 'graph_mode': 'off', 'use_snp_selection': False}. Best is trial 102 with value: 0.23243310564913916.
[I 2025-12-05 21:14:24,317] Trial 119 finished with value: 0.22859576851953647 and parameters: {'model_type': 'mlp', 'hidden_dims': '[512, 128]', 'dropout': 0.16435267532647135, 'batch_norm': False, 'lr': 3.699508421240446e-05, 'weight_decay': 1.8265040779206315e-05, 'epochs': 53, 'loss': 'mse', 'optimizer': 'adam', 'graph_mode': 'off', 'use_snp_selection': False}. Best is trial 102 with value: 0.23243310564913916.
[I 2025-12-05 21:14:44,357] Trial 120 finished with value: 0.21744607939129196 and parameters: {'model_type': 'mlp', 'hidden_dims': '[512, 128]', 'dropout': 0.1632684306979283, 'batch_norm': False, 'lr': 5.019126231357412e-05, 'weight_decay': 1.6856487660382734e-05, 'epochs': 48, 'loss': 'mse', 'optimizer': 'adam', 'graph_mode': 'off', 'use_snp_selection': False}. Best is trial 102 with value: 0.23243310564913916.
[I 2025-12-05 21:15:09,969] Trial 121 finished with value: 0.21778016637377867 and parameters: {'model_type': 'mlp', 'hidden_dims': '[512, 128]', 'dropout': 0.1422840665875367, 'batch_norm': False, 'lr': 3.8572065196256294e-05, 'weight_decay': 9.290808281898302e-06, 'epochs': 69, 'loss': 'mse', 'optimizer': 'adam', 'graph_mode': 'off', 'use_snp_selection': False}. Best is trial 102 with value: 0.23243310564913916.
[I 2025-12-05 21:15:31,126] Trial 122 finished with value: 0.2331571217408679 and parameters: {'model_type': 'mlp', 'hidden_dims': '[512, 128]', 'dropout': 0.19318190807276772, 'batch_norm': False, 'lr': 2.9223875438393487e-05, 'weight_decay': 1.083587277626603e-05, 'epochs': 52, 'loss': 'mse', 'optimizer': 'adam', 'graph_mode': 'off', 'use_snp_selection': False}. Best is trial 122 with value: 0.2331571217408679.
[I 2025-12-05 21:15:51,860] Trial 123 finished with value: 0.22018165306722182 and parameters: {'model_type': 'mlp', 'hidden_dims': '[512, 128]', 'dropout': 0.1914595650321283, 'batch_norm': False, 'lr': 1.7242472824516572e-05, 'weight_decay': 1.2192758141783723e-05, 'epochs': 50, 'loss': 'mse', 'optimizer': 'adam', 'graph_mode': 'off', 'use_snp_selection': False}. Best is trial 122 with value: 0.2331571217408679.
[I 2025-12-05 21:16:15,893] Trial 124 finished with value: 0.2265654175583979 and parameters: {'model_type': 'mlp', 'hidden_dims': '[512, 128]', 'dropout': 0.17560066412559405, 'batch_norm': False, 'lr': 3.0539730573642015e-05, 'weight_decay': 3.557847302741132e-05, 'epochs': 63, 'loss': 'mse', 'optimizer': 'adam', 'graph_mode': 'off', 'use_snp_selection': False}. Best is trial 122 with value: 0.2331571217408679.
[I 2025-12-05 21:16:40,295] Trial 125 finished with value: 0.22620776836714307 and parameters: {'model_type': 'mlp', 'hidden_dims': '[512, 128]', 'dropout': 0.17540810306600751, 'batch_norm': False, 'lr': 3.032350031441771e-05, 'weight_decay': 2.3067626090956048e-05, 'epochs': 64, 'loss': 'mse', 'optimizer': 'adam', 'graph_mode': 'off', 'use_snp_selection': False}. Best is trial 122 with value: 0.2331571217408679.
[I 2025-12-05 21:16:57,220] Trial 126 finished with value: 0.22754521021996812 and parameters: {'model_type': 'mlp', 'hidden_dims': '[256, 128, 64]', 'dropout': 0.21992797336621406, 'batch_norm': False, 'lr': 2.1217049941896075e-05, 'weight_decay': 3.797227989375015e-05, 'epochs': 76, 'loss': 'mse', 'optimizer': 'adam', 'graph_mode': 'off', 'use_snp_selection': False}. Best is trial 122 with value: 0.2331571217408679.
[I 2025-12-05 21:17:14,006] Trial 127 finished with value: 0.21196470335199297 and parameters: {'model_type': 'mlp', 'hidden_dims': '[256, 128, 64]', 'dropout': 0.2176586497679407, 'batch_norm': False, 'lr': 2.215171492179625e-05, 'weight_decay': 2.218569017942623e-05, 'epochs': 75, 'loss': 'mae', 'optimizer': 'adam', 'graph_mode': 'off', 'use_snp_selection': False}. Best is trial 122 with value: 0.2331571217408679.
[I 2025-12-05 21:17:48,912] Trial 128 finished with value: 0.22034994352625076 and parameters: {'model_type': 'mlp', 'hidden_dims': '[256, 128, 64]', 'dropout': 0.19483149401997046, 'batch_norm': False, 'lr': 8.583664290956167e-06, 'weight_decay': 1.7968571161223892e-05, 'epochs': 205, 'loss': 'mse', 'optimizer': 'adam', 'graph_mode': 'off', 'use_snp_selection': False}. Best is trial 122 with value: 0.2331571217408679.
[I 2025-12-05 21:18:06,771] Trial 129 finished with value: 0.21949650392572648 and parameters: {'model_type': 'mlp', 'hidden_dims': '[256, 128, 64]', 'dropout': 0.2276138777099889, 'batch_norm': False, 'lr': 2.6509967670052513e-05, 'weight_decay': 6.110547198239806e-05, 'epochs': 83, 'loss': 'mse', 'optimizer': 'adam', 'graph_mode': 'off', 'use_snp_selection': False}. Best is trial 122 with value: 0.2331571217408679.
[I 2025-12-05 21:18:25,410] Trial 130 finished with value: 0.21578021809995507 and parameters: {'model_type': 'mlp', 'hidden_dims': '[256, 128, 64]', 'dropout': 0.2597705407992634, 'batch_norm': False, 'lr': 7.904306131752218e-05, 'weight_decay': 1.9912858908968154e-05, 'epochs': 89, 'loss': 'mse', 'optimizer': 'adam', 'graph_mode': 'off', 'use_snp_selection': False}. Best is trial 122 with value: 0.2331571217408679.
[I 2025-12-05 21:18:48,727] Trial 131 finished with value: 0.22750613651685772 and parameters: {'model_type': 'mlp', 'hidden_dims': '[512, 128]', 'dropout': 0.17973721361703007, 'batch_norm': False, 'lr': 3.1811165560283565e-05, 'weight_decay': 4.669364370927067e-05, 'epochs': 60, 'loss': 'mse', 'optimizer': 'adam', 'graph_mode': 'off', 'use_snp_selection': False}. Best is trial 122 with value: 0.2331571217408679.
[I 2025-12-05 21:19:15,118] Trial 132 finished with value: 0.22602394221005104 and parameters: {'model_type': 'mlp', 'hidden_dims': '[512, 128]', 'dropout': 0.21485991684637545, 'batch_norm': False, 'lr': 4.289224364796762e-05, 'weight_decay': 4.549565970452592e-05, 'epochs': 72, 'loss': 'mse', 'optimizer': 'adam', 'graph_mode': 'off', 'use_snp_selection': False}. Best is trial 122 with value: 0.2331571217408679.
[I 2025-12-05 21:19:37,801] Trial 133 finished with value: 0.2214152548096256 and parameters: {'model_type': 'mlp', 'hidden_dims': '[512, 64]', 'dropout': 0.16385252305548836, 'batch_norm': False, 'lr': 5.646328115170072e-05, 'weight_decay': 1.091254133136907e-05, 'epochs': 58, 'loss': 'mse', 'optimizer': 'adam', 'graph_mode': 'off', 'use_snp_selection': False}. Best is trial 122 with value: 0.2331571217408679.
[I 2025-12-05 21:19:59,325] Trial 134 finished with value: 0.22139222865881542 and parameters: {'model_type': 'mlp', 'hidden_dims': '[512, 128]', 'dropout': 0.18837512767401346, 'batch_norm': False, 'lr': 1.7061883676560225e-05, 'weight_decay': 0.00010057697426329942, 'epochs': 53, 'loss': 'mse', 'optimizer': 'adam', 'graph_mode': 'off', 'use_snp_selection': False}. Best is trial 122 with value: 0.2331571217408679.
[I 2025-12-05 21:20:27,642] Trial 135 finished with value: 0.2231567762619419 and parameters: {'model_type': 'mlp', 'hidden_dims': '[512, 128]', 'dropout': 0.2843058528826896, 'batch_norm': False, 'lr': 3.4767934923883795e-05, 'weight_decay': 3.4221093452705145e-05, 'epochs': 79, 'loss': 'mse', 'optimizer': 'adam', 'graph_mode': 'off', 'use_snp_selection': False}. Best is trial 122 with value: 0.2331571217408679.
[I 2025-12-05 21:20:39,580] Trial 136 finished with value: 0.22506973709126865 and parameters: {'model_type': 'mlp', 'hidden_dims': '[256, 128]', 'dropout': 0.23219613294314165, 'batch_norm': False, 'lr': 2.168684358189517e-05, 'weight_decay': 4.5989329389837484e-05, 'epochs': 40, 'loss': 'mse', 'optimizer': 'adam', 'graph_mode': 'off', 'use_snp_selection': False}. Best is trial 122 with value: 0.2331571217408679.
[I 2025-12-05 21:20:55,494] Trial 137 finished with value: 0.21733372021396447 and parameters: {'model_type': 'mlp', 'hidden_dims': '[256, 128, 64]', 'dropout': 0.1986486150186085, 'batch_norm': False, 'lr': 4.589656025544233e-05, 'weight_decay': 1.3896168654904853e-05, 'epochs': 69, 'loss': 'mse', 'optimizer': 'adam', 'graph_mode': 'off', 'use_snp_selection': False}. Best is trial 122 with value: 0.2331571217408679.
[I 2025-12-05 21:21:32,138] Trial 138 finished with value: 0.17529267847427144 and parameters: {'model_type': 'mlp', 'hidden_dims': '[512, 128]', 'dropout': 0.24582122454877714, 'batch_norm': False, 'lr': 2.660810581156476e-05, 'weight_decay': 6.382591704720615e-05, 'epochs': 62, 'loss': 'mse', 'optimizer': 'adam', 'graph_mode': 'off', 'use_snp_selection': True, 'num_snps': 13643}. Best is trial 122 with value: 0.2331571217408679.
[I 2025-12-05 21:21:41,723] Trial 139 finished with value: 0.2155648428163451 and parameters: {'model_type': 'mlp', 'hidden_dims': '[128, 64]', 'dropout': 0.21153219711481422, 'batch_norm': False, 'lr': 6.78522090275403e-05, 'weight_decay': 3.0178616425682662e-05, 'epochs': 55, 'loss': 'mse', 'optimizer': 'adam', 'graph_mode': 'off', 'use_snp_selection': False}. Best is trial 122 with value: 0.2331571217408679.
[I 2025-12-05 21:22:08,888] Trial 140 finished with value: 0.22395102313143295 and parameters: {'model_type': 'mlp', 'hidden_dims': '[512, 128]', 'dropout': 0.1845552574176162, 'batch_norm': False, 'lr': 3.23938401974803e-05, 'weight_decay': 0.0006318259627381298, 'epochs': 75, 'loss': 'mse', 'optimizer': 'adam', 'graph_mode': 'off', 'use_snp_selection': False}. Best is trial 122 with value: 0.2331571217408679.
[I 2025-12-05 21:23:33,694] Trial 141 finished with value: 0.19813308019231693 and parameters: {'model_type': 'mlp', 'hidden_dims': '[512, 128]', 'dropout': 0.15108406583531891, 'batch_norm': False, 'lr': 3.014213325256506e-05, 'weight_decay': 3.941635975308132e-05, 'epochs': 291, 'loss': 'mse', 'optimizer': 'adam', 'graph_mode': 'off', 'use_snp_selection': False}. Best is trial 122 with value: 0.2331571217408679.
[I 2025-12-05 21:24:17,977] Trial 142 finished with value: 0.21517396896246277 and parameters: {'model_type': 'mlp', 'hidden_dims': '[512, 128]', 'dropout': 0.1759075691825181, 'batch_norm': False, 'lr': 4.956040719519777e-05, 'weight_decay': 6.909018696004237e-05, 'epochs': 138, 'loss': 'mse', 'optimizer': 'adam', 'graph_mode': 'off', 'use_snp_selection': False}. Best is trial 122 with value: 0.2331571217408679.
[I 2025-12-05 21:24:42,688] Trial 143 finished with value: 0.23167238278990113 and parameters: {'model_type': 'mlp', 'hidden_dims': '[512, 128]', 'dropout': 0.2224253964665194, 'batch_norm': False, 'lr': 1.921824295422648e-05, 'weight_decay': 0.00012864002691426995, 'epochs': 64, 'loss': 'mse', 'optimizer': 'adam', 'graph_mode': 'off', 'use_snp_selection': False}. Best is trial 122 with value: 0.2331571217408679.
[I 2025-12-05 21:25:08,219] Trial 144 finished with value: 0.2220390262075785 and parameters: {'model_type': 'mlp', 'hidden_dims': '[512, 128]', 'dropout': 0.20995229408873567, 'batch_norm': False, 'lr': 1.4652413792800578e-05, 'weight_decay': 0.00013626030722858562, 'epochs': 67, 'loss': 'mse', 'optimizer': 'adam', 'graph_mode': 'off', 'use_snp_selection': False}. Best is trial 122 with value: 0.2331571217408679.
[I 2025-12-05 21:25:31,255] Trial 145 finished with value: 0.21473044844487826 and parameters: {'model_type': 'mlp', 'hidden_dims': '[512, 128]', 'dropout': 0.22189363107565704, 'batch_norm': False, 'lr': 1.8876098817676115e-05, 'weight_decay': 0.00017993915754383326, 'epochs': 58, 'loss': 'mse', 'optimizer': 'adam', 'graph_mode': 'off', 'use_snp_selection': False}. Best is trial 122 with value: 0.2331571217408679.
[I 2025-12-05 21:25:51,009] Trial 146 finished with value: 0.22719730550779688 and parameters: {'model_type': 'mlp', 'hidden_dims': '[512, 128]', 'dropout': 0.2355905267332212, 'batch_norm': False, 'lr': 2.2882804641690668e-05, 'weight_decay': 0.0009851692763728408, 'epochs': 46, 'loss': 'mse', 'optimizer': 'adam', 'graph_mode': 'off', 'use_snp_selection': False}. Best is trial 122 with value: 0.2331571217408679.
[I 2025-12-05 21:26:20,599] Trial 147 finished with value: 0.22131692061708427 and parameters: {'model_type': 'mlp', 'hidden_dims': '[512, 128]', 'dropout': 0.2030641906515699, 'batch_norm': False, 'lr': 1.3062599386269407e-05, 'weight_decay': 0.00031217093957905883, 'epochs': 82, 'loss': 'mse', 'optimizer': 'adam', 'graph_mode': 'off', 'use_snp_selection': False}. Best is trial 122 with value: 0.2331571217408679.
[I 2025-12-05 21:26:34,250] Trial 148 finished with value: 0.21950324427791262 and parameters: {'model_type': 'mlp', 'hidden_dims': '[256, 128, 64]', 'dropout': 0.19225947226372503, 'batch_norm': False, 'lr': 1.1385372786907346e-05, 'weight_decay': 8.061232078975867e-05, 'epochs': 52, 'loss': 'mse', 'optimizer': 'adam', 'graph_mode': 'off', 'use_snp_selection': False}. Best is trial 122 with value: 0.2331571217408679.
[I 2025-12-05 21:26:59,872] Trial 149 finished with value: 0.21561489343909165 and parameters: {'model_type': 'mlp', 'hidden_dims': '[512, 64]', 'dropout': 0.2215400103200652, 'batch_norm': False, 'lr': 3.66632892380424e-05, 'weight_decay': 0.0001179868553666429, 'epochs': 69, 'loss': 'mae', 'optimizer': 'adam', 'graph_mode': 'off', 'use_snp_selection': False}. Best is trial 122 with value: 0.2331571217408679.
[I 2025-12-05 21:28:03,839] Trial 0 finished with value: 0.12179643852771924 and parameters: {'model_type': 'mlp', 'hidden_dims': '[128, 64]', 'dropout': 0.199031432379812, 'batch_norm': True, 'lr': 1.8408544111075837e-06, 'weight_decay': 5.5136510071208614e-05, 'epochs': 336, 'loss': 'mae', 'optimizer': 'adam', 'graph_mode': 'off', 'use_snp_selection': True, 'num_snps': 43862}. Best is trial 0 with value: 0.12179643852771924.
[I 2025-12-05 21:28:44,358] Trial 1 finished with value: 0.19179000706080832 and parameters: {'model_type': 'mlp', 'hidden_dims': '[256, 128]', 'dropout': 0.4370668075331726, 'batch_norm': True, 'lr': 7.133471581159139e-05, 'weight_decay': 1.128633586803549e-05, 'epochs': 242, 'loss': 'mae', 'optimizer': 'adam', 'graph_mode': 'off', 'use_snp_selection': False}. Best is trial 1 with value: 0.19179000706080832.
[I 2025-12-05 21:29:21,247] Trial 2 finished with value: 0.1756365913734476 and parameters: {'model_type': 'mlp', 'hidden_dims': '[256, 128, 64]', 'dropout': 0.41314357415569625, 'batch_norm': False, 'lr': 3.952233718592101e-06, 'weight_decay': 0.00026754769258252603, 'epochs': 149, 'loss': 'mse', 'optimizer': 'adam', 'graph_mode': 'off', 'use_snp_selection': True, 'num_snps': 11571}. Best is trial 1 with value: 0.19179000706080832.
[I 2025-12-05 21:30:56,346] Trial 3 finished with value: 0.2023674520027054 and parameters: {'model_type': 'mlp', 'hidden_dims': '[512, 64]', 'dropout': 0.5938127374509361, 'batch_norm': False, 'lr': 5.67704586114731e-06, 'weight_decay': 2.4518087630137052e-05, 'epochs': 320, 'loss': 'mae', 'optimizer': 'adam', 'graph_mode': 'off', 'use_snp_selection': False}. Best is trial 3 with value: 0.2023674520027054.
[I 2025-12-05 21:32:21,879] Trial 4 finished with value: 0.11285277724863081 and parameters: {'model_type': 'mlp', 'hidden_dims': '[512, 128]', 'dropout': 0.25746343592134413, 'batch_norm': True, 'lr': 1.3467657668402788e-06, 'weight_decay': 0.00033087251918647806, 'epochs': 277, 'loss': 'mse', 'optimizer': 'adam', 'graph_mode': 'off', 'use_snp_selection': True, 'num_snps': 36675}. Best is trial 3 with value: 0.2023674520027054.
[I 2025-12-05 21:33:21,618] Trial 5 finished with value: 0.15455696698876834 and parameters: {'model_type': 'mlp', 'hidden_dims': '[512, 64]', 'dropout': 0.38275350994408375, 'batch_norm': True, 'lr': 1.5586664309232824e-06, 'weight_decay': 0.0008227664668621182, 'epochs': 145, 'loss': 'mae', 'optimizer': 'adam', 'graph_mode': 'off', 'use_snp_selection': True, 'num_snps': 32148}. Best is trial 3 with value: 0.2023674520027054.
[I 2025-12-05 21:33:55,290] Trial 6 finished with value: 0.1970451208897955 and parameters: {'model_type': 'mlp', 'hidden_dims': '[256, 128]', 'dropout': 0.3930109900265879, 'batch_norm': False, 'lr': 4.892964372128395e-05, 'weight_decay': 1.5809549317992182e-06, 'epochs': 199, 'loss': 'mse', 'optimizer': 'adam', 'graph_mode': 'off', 'use_snp_selection': False}. Best is trial 3 with value: 0.2023674520027054.
[I 2025-12-05 21:34:29,843] Trial 7 finished with value: 0.21015320505109805 and parameters: {'model_type': 'mlp', 'hidden_dims': '[512, 256]', 'dropout': 0.15343979219678458, 'batch_norm': True, 'lr': 6.234003099047341e-05, 'weight_decay': 3.894760610535477e-07, 'epochs': 97, 'loss': 'mse', 'optimizer': 'adam', 'graph_mode': 'off', 'use_snp_selection': False}. Best is trial 7 with value: 0.21015320505109805.
[I 2025-12-05 21:36:04,982] Trial 8 finished with value: 0.2006027607363296 and parameters: {'model_type': 'mlp', 'hidden_dims': '[512, 128]', 'dropout': 0.10743001231661406, 'batch_norm': True, 'lr': 0.00023728538449271062, 'weight_decay': 1.7629071578048637e-05, 'epochs': 312, 'loss': 'mae', 'optimizer': 'adam', 'graph_mode': 'off', 'use_snp_selection': False}. Best is trial 7 with value: 0.21015320505109805.
[I 2025-12-05 21:37:01,605] Trial 9 finished with value: 0.20704310501812398 and parameters: {'model_type': 'mlp', 'hidden_dims': '[512, 64]', 'dropout': 0.14505336736221927, 'batch_norm': True, 'lr': 5.8619638388111826e-05, 'weight_decay': 6.200156172669308e-07, 'epochs': 175, 'loss': 'mse', 'optimizer': 'adam', 'graph_mode': 'off', 'use_snp_selection': False}. Best is trial 7 with value: 0.21015320505109805.
[I 2025-12-05 21:37:20,271] Trial 10 finished with value: 0.1497087102683238 and parameters: {'model_type': 'mlp', 'hidden_dims': '[512, 256]', 'dropout': 0.2736992815328032, 'batch_norm': False, 'lr': 0.00032393778075602147, 'weight_decay': 1.1511946696017092e-07, 'epochs': 41, 'loss': 'mse', 'optimizer': 'adam', 'graph_mode': 'off', 'use_snp_selection': False}. Best is trial 7 with value: 0.21015320505109805.
[I 2025-12-05 21:37:49,385] Trial 11 finished with value: 0.18214651209201926 and parameters: {'model_type': 'mlp', 'hidden_dims': '[512, 256]', 'dropout': 0.10095648685224448, 'batch_norm': True, 'lr': 1.6474108386126448e-05, 'weight_decay': 6.203180869264506e-07, 'epochs': 77, 'loss': 'mse', 'optimizer': 'adam', 'graph_mode': 'off', 'use_snp_selection': False}. Best is trial 7 with value: 0.21015320505109805.
[I 2025-12-05 21:38:26,696] Trial 12 finished with value: 0.20573701434171246 and parameters: {'model_type': 'mlp', 'hidden_dims': '[512, 256]', 'dropout': 0.1977119287227368, 'batch_norm': True, 'lr': 0.000121041789182661, 'weight_decay': 1.2192432071058163e-06, 'epochs': 106, 'loss': 'mse', 'optimizer': 'adam', 'graph_mode': 'off', 'use_snp_selection': False}. Best is trial 7 with value: 0.21015320505109805.
[I 2025-12-05 21:39:25,235] Trial 13 finished with value: 0.20529622137995185 and parameters: {'model_type': 'mlp', 'hidden_dims': '[512, 64]', 'dropout': 0.17892004217860003, 'batch_norm': True, 'lr': 1.9472380101128875e-05, 'weight_decay': 1.1026057540153843e-07, 'epochs': 182, 'loss': 'mse', 'optimizer': 'adam', 'graph_mode': 'off', 'use_snp_selection': False}. Best is trial 7 with value: 0.21015320505109805.
[I 2025-12-05 21:39:39,086] Trial 14 finished with value: 0.20260718236352174 and parameters: {'model_type': 'mlp', 'hidden_dims': '[128, 64]', 'dropout': 0.3012984444538551, 'batch_norm': True, 'lr': 0.0006681578335050954, 'weight_decay': 4.814764599662762e-07, 'epochs': 110, 'loss': 'mse', 'optimizer': 'adam', 'graph_mode': 'off', 'use_snp_selection': False}. Best is trial 7 with value: 0.21015320505109805.
[I 2025-12-05 21:40:17,087] Trial 15 finished with value: 0.19368407811718627 and parameters: {'model_type': 'mlp', 'hidden_dims': '[256, 128, 64]', 'dropout': 0.49061215024256943, 'batch_norm': True, 'lr': 2.200457974768058e-05, 'weight_decay': 3.0158133721245484e-06, 'epochs': 219, 'loss': 'mse', 'optimizer': 'adam', 'graph_mode': 'off', 'use_snp_selection': False}. Best is trial 7 with value: 0.21015320505109805.
[I 2025-12-05 21:41:11,077] Trial 16 finished with value: 0.20951707655588994 and parameters: {'model_type': 'mlp', 'hidden_dims': '[512, 64]', 'dropout': 0.16016829601914256, 'batch_norm': True, 'lr': 0.0001154043714215127, 'weight_decay': 4.411191520975561e-06, 'epochs': 166, 'loss': 'mse', 'optimizer': 'adam', 'graph_mode': 'off', 'use_snp_selection': False}. Best is trial 7 with value: 0.21015320505109805.
