[I 2025-12-05 14:29:47,365] Trial 6 finished with value: 0.07153516507497643 and parameters: {'model_type': 'mlp', 'hidden_dims': '[256, 128]', 'dropout': 0.3930109900265879, 'batch_norm': False, 'lr': 4.892964372128395e-05, 'weight_decay': 1.5809549317992182e-06, 'epochs': 199, 'loss': 'mse', 'optimizer': 'adam', 'graph_mode': 'off', 'use_snp_selection': False}. Best is trial 1 with value: 0.07331159524622775.
[I 2025-12-05 14:29:48,488] Trial 7 finished with value: 0.09958788826592237 and parameters: {'model_type': 'mlp', 'hidden_dims': '[512, 256]', 'dropout': 0.15343979219678458, 'batch_norm': True, 'lr': 6.234003099047341e-05, 'weight_decay': 3.894760610535477e-07, 'epochs': 97, 'loss': 'mse', 'optimizer': 'adam', 'graph_mode': 'off', 'use_snp_selection': False}. Best is trial 7 with value: 0.09958788826592237.
[I 2025-12-05 14:29:50,445] Trial 8 finished with value: 0.09354778677399521 and parameters: {'model_type': 'mlp', 'hidden_dims': '[512, 128]', 'dropout': 0.10743001231661406, 'batch_norm': True, 'lr': 0.00023728538449271062, 'weight_decay': 1.7629071578048637e-05, 'epochs': 312, 'loss': 'mae', 'optimizer': 'adam', 'graph_mode': 'off', 'use_snp_selection': False}. Best is trial 7 with value: 0.09958788826592237.
[I 2025-12-05 14:29:51,867] Trial 9 finished with value: 0.09210015050775426 and parameters: {'model_type': 'mlp', 'hidden_dims': '[512, 64]', 'dropout': 0.14505336736221927, 'batch_norm': True, 'lr': 5.8619638388111826e-05, 'weight_decay': 6.200156172669308e-07, 'epochs': 175, 'loss': 'mse', 'optimizer': 'adam', 'graph_mode': 'off', 'use_snp_selection': False}. Best is trial 7 with value: 0.09958788826592237.
[I 2025-12-05 14:29:52,779] Trial 10 finished with value: -0.01817532858688979 and parameters: {'model_type': 'mlp', 'hidden_dims': '[512, 256]', 'dropout': 0.2736992815328032, 'batch_norm': False, 'lr': 0.00032393778075602147, 'weight_decay': 1.1511946696017092e-07, 'epochs': 41, 'loss': 'mse', 'optimizer': 'adam', 'graph_mode': 'off', 'use_snp_selection': False}. Best is trial 7 with value: 0.09958788826592237.
[I 2025-12-05 14:29:53,804] Trial 11 finished with value: 0.09281611317764309 and parameters: {'model_type': 'mlp', 'hidden_dims': '[512, 128]', 'dropout': 0.10095648685224448, 'batch_norm': True, 'lr': 0.0007666984023899753, 'weight_decay': 2.512571353186099e-06, 'epochs': 70, 'loss': 'mae', 'optimizer': 'adam', 'graph_mode': 'off', 'use_snp_selection': False}. Best is trial 7 with value: 0.09958788826592237.
[I 2025-12-05 14:29:54,902] Trial 12 finished with value: 0.08712203438943263 and parameters: {'model_type': 'mlp', 'hidden_dims': '[512, 256]', 'dropout': 0.18206399419301494, 'batch_norm': True, 'lr': 0.00026576228959612443, 'weight_decay': 1.3081036432574914e-07, 'epochs': 88, 'loss': 'mae', 'optimizer': 'adam', 'graph_mode': 'off', 'use_snp_selection': False}. Best is trial 7 with value: 0.09958788826592237.
[I 2025-12-05 14:29:56,577] Trial 13 finished with value: 0.046607922043341035 and parameters: {'model_type': 'mlp', 'hidden_dims': '[512, 128]', 'dropout': 0.28178980110198326, 'batch_norm': True, 'lr': 1.6203139973043888e-05, 'weight_decay': 3.475237872468419e-06, 'epochs': 237, 'loss': 'mse', 'optimizer': 'adam', 'graph_mode': 'off', 'use_snp_selection': False}. Best is trial 7 with value: 0.09958788826592237.
[I 2025-12-05 14:29:57,795] Trial 14 finished with value: 0.1149502402610653 and parameters: {'model_type': 'mlp', 'hidden_dims': '[512, 256]', 'dropout': 0.12319334351899142, 'batch_norm': True, 'lr': 0.00017558188744418174, 'weight_decay': 6.0578250711704925e-05, 'epochs': 119, 'loss': 'mse', 'optimizer': 'adam', 'graph_mode': 'off', 'use_snp_selection': False}. Best is trial 14 with value: 0.1149502402610653.
[I 2025-12-05 14:29:58,977] Trial 15 finished with value: 0.08071362143562162 and parameters: {'model_type': 'mlp', 'hidden_dims': '[512, 256]', 'dropout': 0.20621131466804843, 'batch_norm': True, 'lr': 2.002944590579291e-05, 'weight_decay': 8.204492176908448e-05, 'epochs': 106, 'loss': 'mse', 'optimizer': 'adam', 'graph_mode': 'off', 'use_snp_selection': False}. Best is trial 14 with value: 0.1149502402610653.
[I 2025-12-05 14:30:00,212] Trial 16 finished with value: 0.06052213382302951 and parameters: {'model_type': 'mlp', 'hidden_dims': '[512, 256]', 'dropout': 0.3143120296249873, 'batch_norm': True, 'lr': 0.00012396403352551432, 'weight_decay': 5.111768350743726e-07, 'epochs': 123, 'loss': 'mse', 'optimizer': 'adam', 'graph_mode': 'off', 'use_snp_selection': False}. Best is trial 14 with value: 0.1149502402610653.
[I 2025-12-05 14:30:01,136] Trial 17 finished with value: 0.079228104936888 and parameters: {'model_type': 'mlp', 'hidden_dims': '[512, 256]', 'dropout': 0.5239703284243921, 'batch_norm': True, 'lr': 0.000906375209920231, 'weight_decay': 5.662931284086224e-06, 'epochs': 43, 'loss': 'mse', 'optimizer': 'adam', 'graph_mode': 'off', 'use_snp_selection': False}. Best is trial 14 with value: 0.1149502402610653.
[I 2025-12-05 14:30:03,563] Trial 18 finished with value: 0.0871795691708085 and parameters: {'model_type': 'mlp', 'hidden_dims': '[128, 64]', 'dropout': 0.1555666123318153, 'batch_norm': False, 'lr': 1.1949924189230284e-05, 'weight_decay': 7.197637349971628e-05, 'epochs': 187, 'loss': 'mse', 'optimizer': 'adam', 'graph_mode': 'off', 'use_snp_selection': True, 'num_snps': 58241}. Best is trial 14 with value: 0.1149502402610653.
[I 2025-12-05 14:30:04,460] Trial 19 finished with value: 0.0574512001091769 and parameters: {'model_type': 'mlp', 'hidden_dims': '[256, 128, 64]', 'dropout': 0.23237756474050936, 'batch_norm': True, 'lr': 0.00012498497987933264, 'weight_decay': 4.740660319699476e-07, 'epochs': 125, 'loss': 'mse', 'optimizer': 'adam', 'graph_mode': 'off', 'use_snp_selection': False}. Best is trial 14 with value: 0.1149502402610653.
[I 2025-12-05 14:30:05,530] Trial 20 finished with value: 0.1012841489100055 and parameters: {'model_type': 'mlp', 'hidden_dims': '[512, 256]', 'dropout': 0.33122300963674456, 'batch_norm': True, 'lr': 0.0004365995502006314, 'weight_decay': 0.0002062947245947731, 'epochs': 79, 'loss': 'mse', 'optimizer': 'adam', 'graph_mode': 'off', 'use_snp_selection': False}. Best is trial 14 with value: 0.1149502402610653.
[I 2025-12-05 14:30:06,591] Trial 21 finished with value: 0.07059862133899633 and parameters: {'model_type': 'mlp', 'hidden_dims': '[512, 256]', 'dropout': 0.47304030584658247, 'batch_norm': True, 'lr': 0.0004635562818788925, 'weight_decay': 0.00018587233117007526, 'epochs': 81, 'loss': 'mse', 'optimizer': 'adam', 'graph_mode': 'off', 'use_snp_selection': False}. Best is trial 14 with value: 0.1149502402610653.
[I 2025-12-05 14:30:07,610] Trial 22 finished with value: 0.10312272721301531 and parameters: {'model_type': 'mlp', 'hidden_dims': '[512, 256]', 'dropout': 0.34030515618152724, 'batch_norm': True, 'lr': 0.00013125309290784544, 'weight_decay': 4.122385958951317e-05, 'epochs': 70, 'loss': 'mse', 'optimizer': 'adam', 'graph_mode': 'off', 'use_snp_selection': False}. Best is trial 14 with value: 0.1149502402610653.
[I 2025-12-05 14:30:08,613] Trial 23 finished with value: 0.07105590564803398 and parameters: {'model_type': 'mlp', 'hidden_dims': '[512, 256]', 'dropout': 0.3338447085832189, 'batch_norm': True, 'lr': 0.0001359249964398339, 'weight_decay': 3.4710144347960625e-05, 'epochs': 65, 'loss': 'mse', 'optimizer': 'adam', 'graph_mode': 'off', 'use_snp_selection': False}. Best is trial 14 with value: 0.1149502402610653.
[I 2025-12-05 14:30:09,830] Trial 24 finished with value: 0.08545402019343645 and parameters: {'model_type': 'mlp', 'hidden_dims': '[512, 256]', 'dropout': 0.35153372350407125, 'batch_norm': True, 'lr': 0.0004490820222346801, 'weight_decay': 0.00012844515520977527, 'epochs': 121, 'loss': 'mse', 'optimizer': 'adam', 'graph_mode': 'off', 'use_snp_selection': False}. Best is trial 14 with value: 0.1149502402610653.
[I 2025-12-05 14:30:11,176] Trial 25 finished with value: 0.07735729576570485 and parameters: {'model_type': 'mlp', 'hidden_dims': '[512, 256]', 'dropout': 0.5044270209903509, 'batch_norm': True, 'lr': 0.00020040322800166452, 'weight_decay': 0.0006326262114539862, 'epochs': 154, 'loss': 'mse', 'optimizer': 'adam', 'graph_mode': 'off', 'use_snp_selection': False}. Best is trial 14 with value: 0.1149502402610653.
[I 2025-12-05 14:30:11,893] Trial 26 finished with value: 0.07285134580897296 and parameters: {'model_type': 'mlp', 'hidden_dims': '[512, 256]', 'dropout': 0.3049316614617967, 'batch_norm': True, 'lr': 0.00047365674202155117, 'weight_decay': 0.00012060770337287244, 'epochs': 62, 'loss': 'mse', 'optimizer': 'adam', 'graph_mode': 'off', 'use_snp_selection': True, 'num_snps': 3842}. Best is trial 14 with value: 0.1149502402610653.
[I 2025-12-05 14:30:12,736] Trial 27 finished with value: 0.07158830884168489 and parameters: {'model_type': 'mlp', 'hidden_dims': '[256, 128, 64]', 'dropout': 0.34718068765861226, 'batch_norm': False, 'lr': 3.149014808585109e-05, 'weight_decay': 3.7728781986273995e-05, 'epochs': 104, 'loss': 'mse', 'optimizer': 'adam', 'graph_mode': 'off', 'use_snp_selection': False}. Best is trial 14 with value: 0.1149502402610653.
[I 2025-12-05 14:30:13,386] Trial 28 finished with value: 0.05183356141410603 and parameters: {'model_type': 'mlp', 'hidden_dims': '[128, 64]', 'dropout': 0.5996301915709767, 'batch_norm': True, 'lr': 9.879903308859586e-05, 'weight_decay': 0.0005051136751238051, 'epochs': 55, 'loss': 'mse', 'optimizer': 'adam', 'graph_mode': 'off', 'use_snp_selection': False}. Best is trial 14 with value: 0.1149502402610653.
[I 2025-12-05 14:30:14,764] Trial 29 finished with value: 0.09134823463608485 and parameters: {'model_type': 'mlp', 'hidden_dims': '[256, 128]', 'dropout': 0.22234994465529942, 'batch_norm': True, 'lr': 0.0001668415436705659, 'weight_decay': 5.5227103357724904e-05, 'epochs': 215, 'loss': 'mse', 'optimizer': 'adam', 'graph_mode': 'off', 'use_snp_selection': True, 'num_snps': 19468}. Best is trial 14 with value: 0.1149502402610653.
[I 2025-12-05 14:30:15,574] Trial 30 finished with value: 0.05674513644469978 and parameters: {'model_type': 'mlp', 'hidden_dims': '[128, 64]', 'dropout': 0.4485007649909121, 'batch_norm': True, 'lr': 3.464537426443725e-05, 'weight_decay': 1.1968174407107644e-05, 'epochs': 166, 'loss': 'mse', 'optimizer': 'adam', 'graph_mode': 'off', 'use_snp_selection': False}. Best is trial 14 with value: 0.1149502402610653.
[I 2025-12-05 14:30:16,711] Trial 31 finished with value: 0.10217081451234165 and parameters: {'model_type': 'mlp', 'hidden_dims': '[512, 256]', 'dropout': 0.17415715781657504, 'batch_norm': True, 'lr': 7.446468086713937e-05, 'weight_decay': 0.00019179080845204192, 'epochs': 93, 'loss': 'mse', 'optimizer': 'adam', 'graph_mode': 'off', 'use_snp_selection': False}. Best is trial 14 with value: 0.1149502402610653.
[I 2025-12-05 14:30:17,784] Trial 32 finished with value: 0.08638671309414242 and parameters: {'model_type': 'mlp', 'hidden_dims': '[512, 256]', 'dropout': 0.12650307091296092, 'batch_norm': True, 'lr': 9.850381433305104e-05, 'weight_decay': 0.00023466897809363906, 'epochs': 82, 'loss': 'mse', 'optimizer': 'adam', 'graph_mode': 'off', 'use_snp_selection': False}. Best is trial 14 with value: 0.1149502402610653.
[I 2025-12-05 14:30:19,062] Trial 33 finished with value: 0.08791858068724591 and parameters: {'model_type': 'mlp', 'hidden_dims': '[512, 256]', 'dropout': 0.17858884870845176, 'batch_norm': True, 'lr': 0.0003115786568012848, 'weight_decay': 0.00012271883109412894, 'epochs': 134, 'loss': 'mse', 'optimizer': 'adam', 'graph_mode': 'off', 'use_snp_selection': False}. Best is trial 14 with value: 0.1149502402610653.
[I 2025-12-05 14:30:20,253] Trial 34 finished with value: 0.08291979508703268 and parameters: {'model_type': 'mlp', 'hidden_dims': '[512, 256]', 'dropout': 0.2441574106506448, 'batch_norm': True, 'lr': 7.861346987262043e-05, 'weight_decay': 0.00039402046177898536, 'epochs': 108, 'loss': 'mae', 'optimizer': 'adam', 'graph_mode': 'off', 'use_snp_selection': False}. Best is trial 14 with value: 0.1149502402610653.
[I 2025-12-05 14:30:21,046] Trial 35 finished with value: 0.013433550316716744 and parameters: {'model_type': 'mlp', 'hidden_dims': '[256, 128]', 'dropout': 0.3827034271114395, 'batch_norm': False, 'lr': 0.0005481233635235851, 'weight_decay': 2.7562427497324678e-05, 'epochs': 78, 'loss': 'mse', 'optimizer': 'adam', 'graph_mode': 'off', 'use_snp_selection': False}. Best is trial 14 with value: 0.1149502402610653.
[I 2025-12-05 14:30:23,606] Trial 36 finished with value: 0.03338319940245628 and parameters: {'model_type': 'mlp', 'hidden_dims': '[512, 256]', 'dropout': 0.4259061228636643, 'batch_norm': True, 'lr': 4.166642266617314e-05, 'weight_decay': 0.00020828935878743264, 'epochs': 55, 'loss': 'mse', 'optimizer': 'adam', 'graph_mode': 'off', 'use_snp_selection': True, 'num_snps': 58661}. Best is trial 14 with value: 0.1149502402610653.
[I 2025-12-05 14:30:24,918] Trial 37 finished with value: 0.06265321478441317 and parameters: {'model_type': 'mlp', 'hidden_dims': '[512, 64]', 'dropout': 0.1960875141758811, 'batch_norm': True, 'lr': 4.446294938689996e-06, 'weight_decay': 1.5966658149114305e-05, 'epochs': 144, 'loss': 'mae', 'optimizer': 'adam', 'graph_mode': 'off', 'use_snp_selection': False}. Best is trial 14 with value: 0.1149502402610653.
[I 2025-12-05 14:30:26,143] Trial 38 finished with value: 0.07790739265494985 and parameters: {'model_type': 'mlp', 'hidden_dims': '[256, 128, 64]', 'dropout': 0.30028974057422414, 'batch_norm': False, 'lr': 0.0002088157415488016, 'weight_decay': 0.0009628771763120778, 'epochs': 112, 'loss': 'mse', 'optimizer': 'adam', 'graph_mode': 'off', 'use_snp_selection': True, 'num_snps': 19911}. Best is trial 14 with value: 0.1149502402610653.
[I 2025-12-05 14:30:27,281] Trial 39 finished with value: 0.08807512709288652 and parameters: {'model_type': 'mlp', 'hidden_dims': '[512, 256]', 'dropout': 0.13448664137692196, 'batch_norm': True, 'lr': 2.7111745200367022e-05, 'weight_decay': 7.292174767457787e-06, 'epochs': 100, 'loss': 'mse', 'optimizer': 'adam', 'graph_mode': 'off', 'use_snp_selection': False}. Best is trial 14 with value: 0.1149502402610653.
[I 2025-12-05 14:30:28,501] Trial 40 finished with value: 0.08826850343449073 and parameters: {'model_type': 'mlp', 'hidden_dims': '[256, 128]', 'dropout': 0.37592475111484847, 'batch_norm': True, 'lr': 0.00016134001573605934, 'weight_decay': 5.5771753529145485e-05, 'epochs': 284, 'loss': 'mae', 'optimizer': 'adam', 'graph_mode': 'off', 'use_snp_selection': False}. Best is trial 14 with value: 0.1149502402610653.
[I 2025-12-05 14:30:29,626] Trial 41 finished with value: 0.08011207306643611 and parameters: {'model_type': 'mlp', 'hidden_dims': '[512, 256]', 'dropout': 0.14907733895438527, 'batch_norm': True, 'lr': 6.788097808718181e-05, 'weight_decay': 2.476439642576161e-07, 'epochs': 96, 'loss': 'mse', 'optimizer': 'adam', 'graph_mode': 'off', 'use_snp_selection': False}. Best is trial 14 with value: 0.1149502402610653.
[I 2025-12-05 14:30:31,743] Trial 42 finished with value: 0.07300927461541565 and parameters: {'model_type': 'mlp', 'hidden_dims': '[512, 256]', 'dropout': 0.16633726027407947, 'batch_norm': True, 'lr': 5.169422692604941e-05, 'weight_decay': 8.964500742216999e-05, 'epochs': 348, 'loss': 'mse', 'optimizer': 'adam', 'graph_mode': 'off', 'use_snp_selection': False}. Best is trial 14 with value: 0.1149502402610653.
[I 2025-12-05 14:30:32,844] Trial 43 finished with value: 0.08152073222926425 and parameters: {'model_type': 'mlp', 'hidden_dims': '[512, 256]', 'dropout': 0.11198554197962032, 'batch_norm': True, 'lr': 8.254905334497104e-05, 'weight_decay': 1.0876159951044676e-06, 'epochs': 91, 'loss': 'mse', 'optimizer': 'adam', 'graph_mode': 'off', 'use_snp_selection': False}. Best is trial 14 with value: 0.1149502402610653.
[I 2025-12-05 14:30:33,865] Trial 44 finished with value: 0.10000262107406276 and parameters: {'model_type': 'mlp', 'hidden_dims': '[512, 64]', 'dropout': 0.26511959874118923, 'batch_norm': True, 'lr': 0.0003007833878776222, 'weight_decay': 0.00032885288832440826, 'epochs': 71, 'loss': 'mse', 'optimizer': 'adam', 'graph_mode': 'off', 'use_snp_selection': False}. Best is trial 14 with value: 0.1149502402610653.
[I 2025-12-05 14:30:34,774] Trial 45 finished with value: 0.08110131985863767 and parameters: {'model_type': 'mlp', 'hidden_dims': '[512, 64]', 'dropout': 0.25663017185985537, 'batch_norm': True, 'lr': 0.00032805027429876874, 'weight_decay': 0.0003741439618108598, 'epochs': 41, 'loss': 'mse', 'optimizer': 'adam', 'graph_mode': 'off', 'use_snp_selection': False}. Best is trial 14 with value: 0.1149502402610653.
[I 2025-12-05 14:30:35,788] Trial 46 finished with value: 0.08499627082413469 and parameters: {'model_type': 'mlp', 'hidden_dims': '[512, 64]', 'dropout': 0.2880612633679474, 'batch_norm': True, 'lr': 0.0005820194147320446, 'weight_decay': 0.00017521127769560502, 'epochs': 69, 'loss': 'mse', 'optimizer': 'adam', 'graph_mode': 'off', 'use_snp_selection': False}. Best is trial 14 with value: 0.1149502402610653.
[I 2025-12-05 14:30:36,819] Trial 47 finished with value: -0.004658660257112405 and parameters: {'model_type': 'mlp', 'hidden_dims': '[512, 64]', 'dropout': 0.32500055653793797, 'batch_norm': False, 'lr': 0.0003374762413234796, 'weight_decay': 0.0002789919016294348, 'epochs': 75, 'loss': 'mse', 'optimizer': 'adam', 'graph_mode': 'off', 'use_snp_selection': False}. Best is trial 14 with value: 0.1149502402610653.
[I 2025-12-05 14:30:37,781] Trial 48 finished with value: 0.10456740530390153 and parameters: {'model_type': 'mlp', 'hidden_dims': '[512, 128]', 'dropout': 0.20301714908491655, 'batch_norm': True, 'lr': 0.000780923054286439, 'weight_decay': 0.0005774862545716753, 'epochs': 54, 'loss': 'mae', 'optimizer': 'adam', 'graph_mode': 'off', 'use_snp_selection': False}. Best is trial 14 with value: 0.1149502402610653.
[I 2025-12-05 14:30:39,889] Trial 49 finished with value: 0.09158153552991967 and parameters: {'model_type': 'mlp', 'hidden_dims': '[512, 128]', 'dropout': 0.19353650128589772, 'batch_norm': True, 'lr': 0.0008910737881646495, 'weight_decay': 0.0005340346221905032, 'epochs': 50, 'loss': 'mae', 'optimizer': 'adam', 'graph_mode': 'off', 'use_snp_selection': True, 'num_snps': 46888}. Best is trial 14 with value: 0.1149502402610653.
[I 2025-12-05 14:30:41,165] Trial 50 finished with value: 0.09832062641617156 and parameters: {'model_type': 'mlp', 'hidden_dims': '[512, 128]', 'dropout': 0.22258193048928648, 'batch_norm': True, 'lr': 0.0006390582254463576, 'weight_decay': 2.0736646362371205e-05, 'epochs': 132, 'loss': 'mae', 'optimizer': 'adam', 'graph_mode': 'off', 'use_snp_selection': False}. Best is trial 14 with value: 0.1149502402610653.
[I 2025-12-05 14:30:42,254] Trial 51 finished with value: 0.047720805230031124 and parameters: {'model_type': 'mlp', 'hidden_dims': '[512, 128]', 'dropout': 0.27348099689585026, 'batch_norm': True, 'lr': 2.4714056148062314e-06, 'weight_decay': 0.0007695021910588246, 'epochs': 86, 'loss': 'mae', 'optimizer': 'adam', 'graph_mode': 'off', 'use_snp_selection': False}. Best is trial 14 with value: 0.1149502402610653.
[I 2025-12-05 14:30:43,258] Trial 52 finished with value: 0.10206098237562593 and parameters: {'model_type': 'mlp', 'hidden_dims': '[512, 128]', 'dropout': 0.20806422545507464, 'batch_norm': True, 'lr': 0.00024295518313196223, 'weight_decay': 0.00033068342479572726, 'epochs': 64, 'loss': 'mae', 'optimizer': 'adam', 'graph_mode': 'off', 'use_snp_selection': False}. Best is trial 14 with value: 0.1149502402610653.
[I 2025-12-05 14:30:44,234] Trial 53 finished with value: 0.07595559624565713 and parameters: {'model_type': 'mlp', 'hidden_dims': '[512, 128]', 'dropout': 0.2098083429373279, 'batch_norm': True, 'lr': 0.00020831479266870067, 'weight_decay': 0.00013532038943997357, 'epochs': 55, 'loss': 'mae', 'optimizer': 'adam', 'graph_mode': 'off', 'use_snp_selection': False}. Best is trial 14 with value: 0.1149502402610653.
[I 2025-12-05 14:30:45,446] Trial 54 finished with value: 0.10893912159242293 and parameters: {'model_type': 'mlp', 'hidden_dims': '[512, 128]', 'dropout': 0.17268627733565264, 'batch_norm': True, 'lr': 0.00039471068020300546, 'weight_decay': 7.56750119743378e-05, 'epochs': 117, 'loss': 'mae', 'optimizer': 'adam', 'graph_mode': 'off', 'use_snp_selection': False}. Best is trial 14 with value: 0.1149502402610653.
[I 2025-12-05 14:30:46,652] Trial 55 finished with value: 0.10782440973142672 and parameters: {'model_type': 'mlp', 'hidden_dims': '[512, 128]', 'dropout': 0.16839506887717673, 'batch_norm': True, 'lr': 0.000716150777325418, 'weight_decay': 7.051523648575165e-05, 'epochs': 116, 'loss': 'mae', 'optimizer': 'adam', 'graph_mode': 'off', 'use_snp_selection': False}. Best is trial 14 with value: 0.1149502402610653.
[I 2025-12-05 14:30:48,023] Trial 56 finished with value: 0.09772454087991586 and parameters: {'model_type': 'mlp', 'hidden_dims': '[512, 128]', 'dropout': 0.16766014509545685, 'batch_norm': True, 'lr': 0.0007171669415635536, 'weight_decay': 3.999753666629537e-05, 'epochs': 158, 'loss': 'mae', 'optimizer': 'adam', 'graph_mode': 'off', 'use_snp_selection': False}. Best is trial 14 with value: 0.1149502402610653.
[I 2025-12-05 14:30:49,318] Trial 57 finished with value: 0.08335475972758223 and parameters: {'model_type': 'mlp', 'hidden_dims': '[512, 128]', 'dropout': 0.12377929898913939, 'batch_norm': True, 'lr': 0.0009968717533771626, 'weight_decay': 7.826271472679907e-05, 'epochs': 137, 'loss': 'mae', 'optimizer': 'adam', 'graph_mode': 'off', 'use_snp_selection': False}. Best is trial 14 with value: 0.1149502402610653.
