[I 2025-12-06 02:41:22,867] Trial 26 finished with value: 0.296863883488483 and parameters: {'model_type': 'mlp', 'hidden_dims': '[512, 256]', 'dropout': 0.1038951738416515, 'batch_norm': True, 'lr': 0.0007344068513052333, 'weight_decay': 2.886935666238208e-05, 'epochs': 69, 'loss': 'mae', 'optimizer': 'adam', 'graph_mode': 'off', 'use_snp_selection': True, 'num_snps': 3842}. Best is trial 16 with value: 0.3179573060770403.
[I 2025-12-06 02:41:41,106] Trial 27 finished with value: 0.2864192210731914 and parameters: {'model_type': 'mlp', 'hidden_dims': '[512, 256]', 'dropout': 0.29934488959923056, 'batch_norm': False, 'lr': 0.00019511652672726628, 'weight_decay': 9.125340330965061e-06, 'epochs': 75, 'loss': 'mae', 'optimizer': 'adam', 'graph_mode': 'off', 'use_snp_selection': False}. Best is trial 16 with value: 0.3179573060770403.
[I 2025-12-06 02:41:51,862] Trial 28 finished with value: 0.3108383693794432 and parameters: {'model_type': 'mlp', 'hidden_dims': '[128, 64]', 'dropout': 0.23667452462314775, 'batch_norm': True, 'lr': 0.000581750305830007, 'weight_decay': 0.00015811233837296, 'epochs': 124, 'loss': 'mae', 'optimizer': 'adam', 'graph_mode': 'off', 'use_snp_selection': False}. Best is trial 16 with value: 0.3179573060770403.
[I 2025-12-06 02:42:27,774] Trial 29 finished with value: 0.3050337096010341 and parameters: {'model_type': 'mlp', 'hidden_dims': '[512, 128]', 'dropout': 0.17934047370271552, 'batch_norm': True, 'lr': 3.704096196191643e-05, 'weight_decay': 4.105570555694856e-05, 'epochs': 179, 'loss': 'mae', 'optimizer': 'adam', 'graph_mode': 'off', 'use_snp_selection': True, 'num_snps': 19468}. Best is trial 16 with value: 0.3179573060770403.
[I 2025-12-06 02:42:41,859] Trial 30 finished with value: 0.3101801288850216 and parameters: {'model_type': 'mlp', 'hidden_dims': '[256, 128, 64]', 'dropout': 0.35641601064298173, 'batch_norm': True, 'lr': 9.061051146837688e-05, 'weight_decay': 8.58970861149538e-05, 'epochs': 104, 'loss': 'mae', 'optimizer': 'adam', 'graph_mode': 'off', 'use_snp_selection': False}. Best is trial 16 with value: 0.3179573060770403.
[I 2025-12-06 02:43:24,219] Trial 31 finished with value: 0.3185639258293952 and parameters: {'model_type': 'mlp', 'hidden_dims': '[512, 256]', 'dropout': 0.22357580743877653, 'batch_norm': True, 'lr': 0.00010816961491255139, 'weight_decay': 6.707686895901849e-05, 'epochs': 212, 'loss': 'mae', 'optimizer': 'adam', 'graph_mode': 'off', 'use_snp_selection': False}. Best is trial 31 with value: 0.3185639258293952.
[I 2025-12-06 02:44:06,887] Trial 32 finished with value: 0.3136653671926523 and parameters: {'model_type': 'mlp', 'hidden_dims': '[512, 256]', 'dropout': 0.19563809922218012, 'batch_norm': True, 'lr': 0.000274436861970613, 'weight_decay': 1.684894262232937e-05, 'epochs': 213, 'loss': 'mae', 'optimizer': 'adam', 'graph_mode': 'off', 'use_snp_selection': False}. Best is trial 31 with value: 0.3185639258293952.
[I 2025-12-06 02:44:59,288] Trial 33 finished with value: 0.3119342262951834 and parameters: {'model_type': 'mlp', 'hidden_dims': '[512, 256]', 'dropout': 0.15485404613785028, 'batch_norm': True, 'lr': 0.00039411402802877016, 'weight_decay': 0.00021647226674538942, 'epochs': 268, 'loss': 'mae', 'optimizer': 'adam', 'graph_mode': 'off', 'use_snp_selection': False}. Best is trial 31 with value: 0.3185639258293952.
[I 2025-12-06 02:45:11,701] Trial 34 finished with value: 0.31112467665458454 and parameters: {'model_type': 'mlp', 'hidden_dims': '[128, 64]', 'dropout': 0.2456710672634968, 'batch_norm': True, 'lr': 0.00016681328415227, 'weight_decay': 0.000523339875991667, 'epochs': 156, 'loss': 'mae', 'optimizer': 'adam', 'graph_mode': 'off', 'use_snp_selection': False}. Best is trial 31 with value: 0.3185639258293952.
[I 2025-12-06 02:46:07,628] Trial 35 finished with value: 0.30545987098958194 and parameters: {'model_type': 'mlp', 'hidden_dims': '[512, 256]', 'dropout': 0.2829862981521979, 'batch_norm': False, 'lr': 8.950094257770925e-05, 'weight_decay': 3.592087458965548e-05, 'epochs': 292, 'loss': 'mae', 'optimizer': 'adam', 'graph_mode': 'off', 'use_snp_selection': False}. Best is trial 31 with value: 0.3185639258293952.
[I 2025-12-06 02:47:25,608] Trial 36 finished with value: 0.30685115310356376 and parameters: {'model_type': 'mlp', 'hidden_dims': '[512, 256]', 'dropout': 0.20592097745854024, 'batch_norm': True, 'lr': 1.029382153849406e-05, 'weight_decay': 1.0687295154404784e-05, 'epochs': 245, 'loss': 'mae', 'optimizer': 'adam', 'graph_mode': 'off', 'use_snp_selection': True, 'num_snps': 58661}. Best is trial 31 with value: 0.3185639258293952.
[I 2025-12-06 02:47:43,297] Trial 37 finished with value: 0.31291053600974844 and parameters: {'model_type': 'mlp', 'hidden_dims': '[256, 128, 64]', 'dropout': 0.3131650326803589, 'batch_norm': True, 'lr': 0.0005136780788526561, 'weight_decay': 0.0002212850735759864, 'epochs': 142, 'loss': 'mae', 'optimizer': 'adam', 'graph_mode': 'off', 'use_snp_selection': False}. Best is trial 31 with value: 0.3185639258293952.
[I 2025-12-06 02:48:21,576] Trial 38 finished with value: 0.30611167427862634 and parameters: {'model_type': 'mlp', 'hidden_dims': '[512, 256]', 'dropout': 0.3537167555753007, 'batch_norm': False, 'lr': 3.759730144909565e-05, 'weight_decay': 7.750578994227252e-05, 'epochs': 212, 'loss': 'mae', 'optimizer': 'adam', 'graph_mode': 'off', 'use_snp_selection': True, 'num_snps': 19911}. Best is trial 31 with value: 0.3185639258293952.
[I 2025-12-06 02:48:56,679] Trial 39 finished with value: 0.3112500099172218 and parameters: {'model_type': 'mlp', 'hidden_dims': '[512, 128]', 'dropout': 0.25855192494144075, 'batch_norm': True, 'lr': 0.0009607898136063152, 'weight_decay': 1.938974172390496e-05, 'epochs': 171, 'loss': 'mae', 'optimizer': 'adam', 'graph_mode': 'off', 'use_snp_selection': False}. Best is trial 31 with value: 0.3185639258293952.
[I 2025-12-06 02:49:14,047] Trial 40 finished with value: 0.31150215683876037 and parameters: {'model_type': 'mlp', 'hidden_dims': '[256, 128]', 'dropout': 0.13814388373924005, 'batch_norm': True, 'lr': 0.00021410127659342196, 'weight_decay': 0.00043783127199408775, 'epochs': 138, 'loss': 'mae', 'optimizer': 'adam', 'graph_mode': 'off', 'use_snp_selection': False}. Best is trial 31 with value: 0.3185639258293952.
[I 2025-12-06 02:49:53,102] Trial 41 finished with value: 0.31585032088681475 and parameters: {'model_type': 'mlp', 'hidden_dims': '[512, 256]', 'dropout': 0.19560492854165826, 'batch_norm': True, 'lr': 0.00010289290840628707, 'weight_decay': 8.777318532015634e-05, 'epochs': 192, 'loss': 'mae', 'optimizer': 'adam', 'graph_mode': 'off', 'use_snp_selection': False}. Best is trial 31 with value: 0.3185639258293952.
[I 2025-12-06 02:50:59,619] Trial 42 finished with value: 0.3170351481781565 and parameters: {'model_type': 'mlp', 'hidden_dims': '[512, 256]', 'dropout': 0.17541497647378465, 'batch_norm': True, 'lr': 6.657214791390163e-05, 'weight_decay': 9.520119318146491e-05, 'epochs': 348, 'loss': 'mae', 'optimizer': 'adam', 'graph_mode': 'off', 'use_snp_selection': False}. Best is trial 31 with value: 0.3185639258293952.
[I 2025-12-06 02:52:02,703] Trial 43 finished with value: 0.313270591448333 and parameters: {'model_type': 'mlp', 'hidden_dims': '[512, 256]', 'dropout': 0.16721649992558799, 'batch_norm': True, 'lr': 5.285947654678922e-05, 'weight_decay': 0.00020103532952284422, 'epochs': 328, 'loss': 'mae', 'optimizer': 'adam', 'graph_mode': 'off', 'use_snp_selection': False}. Best is trial 31 with value: 0.3185639258293952.
[I 2025-12-06 02:52:59,629] Trial 44 finished with value: 0.3110697876184044 and parameters: {'model_type': 'mlp', 'hidden_dims': '[512, 64]', 'dropout': 0.12939662274673727, 'batch_norm': True, 'lr': 8.175985861363257e-05, 'weight_decay': 2.7162229467303796e-05, 'epochs': 295, 'loss': 'mse', 'optimizer': 'adam', 'graph_mode': 'off', 'use_snp_selection': False}. Best is trial 31 with value: 0.3185639258293952.
[I 2025-12-06 02:54:05,944] Trial 45 finished with value: 0.3138300447779197 and parameters: {'model_type': 'mlp', 'hidden_dims': '[512, 256]', 'dropout': 0.23021919942953264, 'batch_norm': True, 'lr': 0.0002851437701450565, 'weight_decay': 0.00028068034064180996, 'epochs': 347, 'loss': 'mae', 'optimizer': 'adam', 'graph_mode': 'off', 'use_snp_selection': False}. Best is trial 31 with value: 0.3185639258293952.
[I 2025-12-06 02:54:29,564] Trial 46 finished with value: 0.3139035445804638 and parameters: {'model_type': 'mlp', 'hidden_dims': '[512, 256]', 'dropout': 0.2722925059965432, 'batch_norm': True, 'lr': 6.35650794559663e-05, 'weight_decay': 6.755148237484339e-06, 'epochs': 105, 'loss': 'mae', 'optimizer': 'adam', 'graph_mode': 'off', 'use_snp_selection': False}. Best is trial 31 with value: 0.3185639258293952.
[I 2025-12-06 02:55:17,652] Trial 47 finished with value: 0.3099826608118045 and parameters: {'model_type': 'mlp', 'hidden_dims': '[512, 128]', 'dropout': 0.39112309150454166, 'batch_norm': False, 'lr': 0.00014192641318783452, 'weight_decay': 0.0005798372991718928, 'epochs': 248, 'loss': 'mse', 'optimizer': 'adam', 'graph_mode': 'off', 'use_snp_selection': False}. Best is trial 31 with value: 0.3185639258293952.
[I 2025-12-06 02:56:02,537] Trial 48 finished with value: 0.27086380830453205 and parameters: {'model_type': 'mlp', 'hidden_dims': '[512, 64]', 'dropout': 0.12255395184563168, 'batch_norm': True, 'lr': 1.1170552432785515e-06, 'weight_decay': 4.5697134336729606e-05, 'epochs': 227, 'loss': 'mae', 'optimizer': 'adam', 'graph_mode': 'off', 'use_snp_selection': False}. Best is trial 31 with value: 0.3185639258293952.
[I 2025-12-06 02:56:56,840] Trial 49 finished with value: 0.28491431920283217 and parameters: {'model_type': 'mlp', 'hidden_dims': '[256, 128]', 'dropout': 0.18215626775765467, 'batch_norm': True, 'lr': 3.631751333767966e-06, 'weight_decay': 0.00010220574277220244, 'epochs': 307, 'loss': 'mae', 'optimizer': 'adam', 'graph_mode': 'off', 'use_snp_selection': True, 'num_snps': 46888}. Best is trial 31 with value: 0.3185639258293952.
[I 2025-12-06 02:57:14,413] Trial 50 finished with value: 0.3053561295741304 and parameters: {'model_type': 'mlp', 'hidden_dims': '[128, 64]', 'dropout': 0.1572713958552135, 'batch_norm': True, 'lr': 0.00018933516204164383, 'weight_decay': 1.673957264122608e-05, 'epochs': 256, 'loss': 'mse', 'optimizer': 'adam', 'graph_mode': 'off', 'use_snp_selection': False}. Best is trial 31 with value: 0.3185639258293952.
[I 2025-12-06 02:57:54,379] Trial 51 finished with value: 0.31503953783121386 and parameters: {'model_type': 'mlp', 'hidden_dims': '[512, 256]', 'dropout': 0.19761909173385178, 'batch_norm': True, 'lr': 0.00011401758805061766, 'weight_decay': 6.533313560526383e-05, 'epochs': 198, 'loss': 'mae', 'optimizer': 'adam', 'graph_mode': 'off', 'use_snp_selection': False}. Best is trial 31 with value: 0.3185639258293952.
[I 2025-12-06 02:58:28,742] Trial 52 finished with value: 0.3154324923590215 and parameters: {'model_type': 'mlp', 'hidden_dims': '[512, 256]', 'dropout': 0.21407944757453282, 'batch_norm': True, 'lr': 7.44390728211754e-05, 'weight_decay': 0.00015708254017785187, 'epochs': 166, 'loss': 'mae', 'optimizer': 'adam', 'graph_mode': 'off', 'use_snp_selection': False}. Best is trial 31 with value: 0.3185639258293952.
[I 2025-12-06 02:59:06,048] Trial 53 finished with value: 0.31590002587137544 and parameters: {'model_type': 'mlp', 'hidden_dims': '[512, 256]', 'dropout': 0.2566970014729088, 'batch_norm': True, 'lr': 4.390943305101222e-05, 'weight_decay': 8.170221590888354e-05, 'epochs': 183, 'loss': 'mae', 'optimizer': 'adam', 'graph_mode': 'off', 'use_snp_selection': False}. Best is trial 31 with value: 0.3185639258293952.
[I 2025-12-06 02:59:43,221] Trial 54 finished with value: 0.31379379661643825 and parameters: {'model_type': 'mlp', 'hidden_dims': '[512, 256]', 'dropout': 0.2525678686406124, 'batch_norm': True, 'lr': 3.133402657086473e-05, 'weight_decay': 5.263198020314682e-05, 'epochs': 182, 'loss': 'mae', 'optimizer': 'adam', 'graph_mode': 'off', 'use_snp_selection': False}. Best is trial 31 with value: 0.3185639258293952.
[I 2025-12-06 03:00:25,255] Trial 55 finished with value: 0.3154044262554589 and parameters: {'model_type': 'mlp', 'hidden_dims': '[512, 256]', 'dropout': 0.2907023547483612, 'batch_norm': True, 'lr': 4.973873397037061e-05, 'weight_decay': 3.053785656177711e-05, 'epochs': 209, 'loss': 'mae', 'optimizer': 'adam', 'graph_mode': 'off', 'use_snp_selection': False}. Best is trial 31 with value: 0.3185639258293952.
[I 2025-12-06 03:00:51,308] Trial 56 finished with value: 0.31168780406673735 and parameters: {'model_type': 'mlp', 'hidden_dims': '[256, 128, 64]', 'dropout': 0.5615917849015515, 'batch_norm': True, 'lr': 2.5232396841974224e-05, 'weight_decay': 0.00011354996440773407, 'epochs': 232, 'loss': 'mae', 'optimizer': 'adam', 'graph_mode': 'off', 'use_snp_selection': False}. Best is trial 31 with value: 0.3185639258293952.
[I 2025-12-06 03:01:11,628] Trial 57 finished with value: 0.31200540358749895 and parameters: {'model_type': 'mlp', 'hidden_dims': '[512, 256]', 'dropout': 0.23208766491984797, 'batch_norm': True, 'lr': 1.5039191697389e-05, 'weight_decay': 0.00033819771841549624, 'epochs': 86, 'loss': 'mae', 'optimizer': 'adam', 'graph_mode': 'off', 'use_snp_selection': False}. Best is trial 31 with value: 0.3185639258293952.
[I 2025-12-06 03:01:40,131] Trial 58 finished with value: 0.29988899641863415 and parameters: {'model_type': 'mlp', 'hidden_dims': '[512, 256]', 'dropout': 0.3190498637915933, 'batch_norm': False, 'lr': 0.0003201894206285712, 'weight_decay': 6.7308561555829e-05, 'epochs': 134, 'loss': 'mae', 'optimizer': 'adam', 'graph_mode': 'off', 'use_snp_selection': False}. Best is trial 31 with value: 0.3185639258293952.
[I 2025-12-06 03:01:57,443] Trial 59 finished with value: 0.3062961039858639 and parameters: {'model_type': 'mlp', 'hidden_dims': '[512, 256]', 'dropout': 0.3726764876777288, 'batch_norm': True, 'lr': 0.00022539805411718025, 'weight_decay': 0.00016698465483404266, 'epochs': 69, 'loss': 'mse', 'optimizer': 'adam', 'graph_mode': 'off', 'use_snp_selection': False}. Best is trial 31 with value: 0.3185639258293952.
[I 2025-12-06 03:02:51,765] Trial 60 finished with value: 0.3140720651850986 and parameters: {'model_type': 'mlp', 'hidden_dims': '[512, 256]', 'dropout': 0.26561158214842573, 'batch_norm': True, 'lr': 4.092827036321995e-05, 'weight_decay': 2.3742405953742946e-05, 'epochs': 279, 'loss': 'mae', 'optimizer': 'adam', 'graph_mode': 'off', 'use_snp_selection': False}. Best is trial 31 with value: 0.3185639258293952.
[I 2025-12-06 03:03:31,279] Trial 61 finished with value: 0.3138877425135723 and parameters: {'model_type': 'mlp', 'hidden_dims': '[512, 256]', 'dropout': 0.42417783964919636, 'batch_norm': True, 'lr': 0.00012296683898491495, 'weight_decay': 9.611430869482993e-05, 'epochs': 194, 'loss': 'mae', 'optimizer': 'adam', 'graph_mode': 'off', 'use_snp_selection': False}. Best is trial 31 with value: 0.3185639258293952.
[I 2025-12-06 03:04:09,452] Trial 62 finished with value: 0.3097979409544404 and parameters: {'model_type': 'mlp', 'hidden_dims': '[512, 256]', 'dropout': 0.1824034137328608, 'batch_norm': True, 'lr': 0.0001080093830305705, 'weight_decay': 7.721613178167608e-05, 'epochs': 187, 'loss': 'mae', 'optimizer': 'adam', 'graph_mode': 'off', 'use_snp_selection': False}. Best is trial 31 with value: 0.3185639258293952.
[I 2025-12-06 03:04:42,863] Trial 63 finished with value: 0.31265959110329117 and parameters: {'model_type': 'mlp', 'hidden_dims': '[512, 256]', 'dropout': 0.2171098526331273, 'batch_norm': True, 'lr': 7.050970399321996e-05, 'weight_decay': 0.000126865584903833, 'epochs': 160, 'loss': 'mae', 'optimizer': 'adam', 'graph_mode': 'off', 'use_snp_selection': False}. Best is trial 31 with value: 0.3185639258293952.
[I 2025-12-06 03:05:14,434] Trial 64 finished with value: 0.3145785445712294 and parameters: {'model_type': 'mlp', 'hidden_dims': '[512, 256]', 'dropout': 0.19479916404892925, 'batch_norm': True, 'lr': 0.00015287565389634908, 'weight_decay': 4.542871573439512e-05, 'epochs': 150, 'loss': 'mae', 'optimizer': 'adam', 'graph_mode': 'off', 'use_snp_selection': False}. Best is trial 31 with value: 0.3185639258293952.
[I 2025-12-06 03:05:27,952] Trial 65 finished with value: 0.3137355396438507 and parameters: {'model_type': 'mlp', 'hidden_dims': '[256, 128]', 'dropout': 0.2480777920947541, 'batch_norm': True, 'lr': 9.915288335596647e-05, 'weight_decay': 0.00027690856401420787, 'epochs': 97, 'loss': 'mae', 'optimizer': 'adam', 'graph_mode': 'off', 'use_snp_selection': False}. Best is trial 31 with value: 0.3185639258293952.
[I 2025-12-06 03:05:58,709] Trial 66 finished with value: 0.30378208952613944 and parameters: {'model_type': 'mlp', 'hidden_dims': '[512, 256]', 'dropout': 0.23679705767418646, 'batch_norm': True, 'lr': 4.5451819404879034e-05, 'weight_decay': 5.622852706560909e-05, 'epochs': 53, 'loss': 'mae', 'optimizer': 'adam', 'graph_mode': 'off', 'use_snp_selection': True, 'num_snps': 22881}. Best is trial 31 with value: 0.3185639258293952.
[I 2025-12-06 03:06:10,903] Trial 67 finished with value: 0.3135584946198048 and parameters: {'model_type': 'mlp', 'hidden_dims': '[512, 64]', 'dropout': 0.28644822360560335, 'batch_norm': True, 'lr': 6.270191208415454e-05, 'weight_decay': 2.112532858131444e-07, 'epochs': 40, 'loss': 'mae', 'optimizer': 'adam', 'graph_mode': 'off', 'use_snp_selection': False}. Best is trial 31 with value: 0.3185639258293952.
[I 2025-12-06 03:06:25,981] Trial 68 finished with value: 0.30523826375233754 and parameters: {'model_type': 'mlp', 'hidden_dims': '[128, 64]', 'dropout': 0.20987767264787932, 'batch_norm': True, 'lr': 3.023975815114416e-05, 'weight_decay': 3.545067015569806e-05, 'epochs': 206, 'loss': 'mae', 'optimizer': 'adam', 'graph_mode': 'off', 'use_snp_selection': False}. Best is trial 31 with value: 0.3185639258293952.
[I 2025-12-06 03:06:50,507] Trial 69 finished with value: 0.29386103195686075 and parameters: {'model_type': 'mlp', 'hidden_dims': '[512, 256]', 'dropout': 0.17288853779689115, 'batch_norm': False, 'lr': 0.00043104644839213395, 'weight_decay': 9.022297869138883e-05, 'epochs': 111, 'loss': 'mae', 'optimizer': 'adam', 'graph_mode': 'off', 'use_snp_selection': False}. Best is trial 31 with value: 0.3185639258293952.
[I 2025-12-06 03:07:33,945] Trial 70 finished with value: 0.30969980727725704 and parameters: {'model_type': 'mlp', 'hidden_dims': '[512, 128]', 'dropout': 0.3366273664599677, 'batch_norm': True, 'lr': 0.0007689133034468022, 'weight_decay': 0.0001964502769188362, 'epochs': 218, 'loss': 'mae', 'optimizer': 'adam', 'graph_mode': 'off', 'use_snp_selection': False}. Best is trial 31 with value: 0.3185639258293952.
[I 2025-12-06 03:08:09,093] Trial 71 finished with value: 0.3147304349427337 and parameters: {'model_type': 'mlp', 'hidden_dims': '[512, 256]', 'dropout': 0.21810268981788022, 'batch_norm': True, 'lr': 6.962425772012257e-05, 'weight_decay': 0.00014997936391354612, 'epochs': 170, 'loss': 'mae', 'optimizer': 'adam', 'graph_mode': 'off', 'use_snp_selection': False}. Best is trial 31 with value: 0.3185639258293952.
[I 2025-12-06 03:08:43,732] Trial 72 finished with value: 0.3150240611113635 and parameters: {'model_type': 'mlp', 'hidden_dims': '[512, 256]', 'dropout': 0.19472284877684906, 'batch_norm': True, 'lr': 8.411477714692235e-05, 'weight_decay': 0.0001417112937548555, 'epochs': 167, 'loss': 'mae', 'optimizer': 'adam', 'graph_mode': 'off', 'use_snp_selection': False}. Best is trial 31 with value: 0.3185639258293952.
[I 2025-12-06 03:09:24,894] Trial 73 finished with value: 0.31652875529329294 and parameters: {'model_type': 'mlp', 'hidden_dims': '[512, 256]', 'dropout': 0.26853456482256804, 'batch_norm': True, 'lr': 0.00017239815531336773, 'weight_decay': 9.826795182167802e-05, 'epochs': 204, 'loss': 'mae', 'optimizer': 'adam', 'graph_mode': 'off', 'use_snp_selection': False}. Best is trial 31 with value: 0.3185639258293952.
[I 2025-12-06 03:10:12,028] Trial 74 finished with value: 0.31402477748726826 and parameters: {'model_type': 'mlp', 'hidden_dims': '[512, 256]', 'dropout': 0.2748426059955402, 'batch_norm': True, 'lr': 0.00018287496450030232, 'weight_decay': 9.924060082879793e-05, 'epochs': 238, 'loss': 'mae', 'optimizer': 'adam', 'graph_mode': 'off', 'use_snp_selection': False}. Best is trial 31 with value: 0.3185639258293952.
[I 2025-12-06 03:10:35,095] Trial 75 finished with value: 0.30962442468057677 and parameters: {'model_type': 'mlp', 'hidden_dims': '[256, 128, 64]', 'dropout': 0.2994768529664696, 'batch_norm': True, 'lr': 0.00013550049192999437, 'weight_decay': 1.1882455793034792e-06, 'epochs': 199, 'loss': 'mae', 'optimizer': 'adam', 'graph_mode': 'off', 'use_snp_selection': False}. Best is trial 31 with value: 0.3185639258293952.
[I 2025-12-06 03:10:58,719] Trial 76 finished with value: 0.29827028012012924 and parameters: {'model_type': 'mlp', 'hidden_dims': '[512, 256]', 'dropout': 0.23712080666434077, 'batch_norm': True, 'lr': 0.00031864781943489394, 'weight_decay': 7.442933635403741e-05, 'epochs': 180, 'loss': 'mae', 'optimizer': 'adam', 'graph_mode': 'off', 'use_snp_selection': True, 'num_snps': 3325}. Best is trial 31 with value: 0.3185639258293952.
[I 2025-12-06 03:11:39,413] Trial 77 finished with value: 0.31343859620904224 and parameters: {'model_type': 'mlp', 'hidden_dims': '[512, 256]', 'dropout': 0.25580333073614797, 'batch_norm': True, 'lr': 0.000531916633900605, 'weight_decay': 2.1968909817026077e-05, 'epochs': 202, 'loss': 'mae', 'optimizer': 'adam', 'graph_mode': 'off', 'use_snp_selection': False}. Best is trial 31 with value: 0.3185639258293952.
