[I 2025-12-05 16:16:17,373] Trial 57 finished with value: -0.012801131776953821 and parameters: {'model_type': 'mlp', 'hidden_dims': '[512, 64]', 'dropout': 0.5434792194338829, 'batch_norm': True, 'lr': 0.00012847880981853153, 'weight_decay': 4.130425162408885e-06, 'epochs': 315, 'loss': 'mse', 'optimizer': 'adam', 'graph_mode': 'off', 'use_snp_selection': False}. Best is trial 38 with value: 0.050874541462131516.
[I 2025-12-05 16:16:18,346] Trial 58 finished with value: 0.00674610498842845 and parameters: {'model_type': 'mlp', 'hidden_dims': '[512, 256]', 'dropout': 0.5188733405304398, 'batch_norm': False, 'lr': 2.834150138036732e-06, 'weight_decay': 1.865312794514827e-06, 'epochs': 266, 'loss': 'mse', 'optimizer': 'adam', 'graph_mode': 'off', 'use_snp_selection': True, 'num_snps': 4534}. Best is trial 38 with value: 0.050874541462131516.
[I 2025-12-05 16:16:19,562] Trial 59 finished with value: 0.015886304107606355 and parameters: {'model_type': 'mlp', 'hidden_dims': '[128, 64]', 'dropout': 0.40361555091831014, 'batch_norm': True, 'lr': 0.0007285944192365478, 'weight_decay': 9.23668491877346e-05, 'epochs': 338, 'loss': 'mae', 'optimizer': 'adam', 'graph_mode': 'off', 'use_snp_selection': True, 'num_snps': 7412}. Best is trial 38 with value: 0.050874541462131516.
[I 2025-12-05 16:16:22,726] Trial 60 finished with value: 0.005811456340825059 and parameters: {'model_type': 'mlp', 'hidden_dims': '[512, 128]', 'dropout': 0.49355481902711185, 'batch_norm': False, 'lr': 0.00021170743634784213, 'weight_decay': 4.3510823272696606e-05, 'epochs': 292, 'loss': 'mse', 'optimizer': 'adam', 'graph_mode': 'off', 'use_snp_selection': True, 'num_snps': 50509}. Best is trial 38 with value: 0.050874541462131516.
[I 2025-12-05 16:16:23,750] Trial 61 finished with value: 0.030528330805234385 and parameters: {'model_type': 'mlp', 'hidden_dims': '[128, 64]', 'dropout': 0.5492989638365678, 'batch_norm': False, 'lr': 0.0003482781212383515, 'weight_decay': 2.598276207795195e-05, 'epochs': 328, 'loss': 'mse', 'optimizer': 'adam', 'graph_mode': 'off', 'use_snp_selection': True, 'num_snps': 4115}. Best is trial 38 with value: 0.050874541462131516.
[I 2025-12-05 16:16:24,749] Trial 62 finished with value: 0.03399201092104772 and parameters: {'model_type': 'mlp', 'hidden_dims': '[128, 64]', 'dropout': 0.47087272590013274, 'batch_norm': False, 'lr': 0.00035693815461986845, 'weight_decay': 3.2899348161268185e-05, 'epochs': 317, 'loss': 'mse', 'optimizer': 'adam', 'graph_mode': 'off', 'use_snp_selection': True, 'num_snps': 2897}. Best is trial 38 with value: 0.050874541462131516.
[I 2025-12-05 16:16:26,337] Trial 63 finished with value: 0.02281863998224141 and parameters: {'model_type': 'mlp', 'hidden_dims': '[128, 64]', 'dropout': 0.5396882097909038, 'batch_norm': False, 'lr': 0.0005511280769585186, 'weight_decay': 8.251087141779384e-06, 'epochs': 163, 'loss': 'mse', 'optimizer': 'adam', 'graph_mode': 'off', 'use_snp_selection': True, 'num_snps': 31289}. Best is trial 38 with value: 0.050874541462131516.
[I 2025-12-05 16:16:27,244] Trial 64 finished with value: 0.028826444016933746 and parameters: {'model_type': 'mlp', 'hidden_dims': '[128, 64]', 'dropout': 0.5827597472241138, 'batch_norm': False, 'lr': 0.0009381745210256207, 'weight_decay': 1.3207428944485614e-05, 'epochs': 139, 'loss': 'mse', 'optimizer': 'adam', 'graph_mode': 'off', 'use_snp_selection': True, 'num_snps': 7522}. Best is trial 38 with value: 0.050874541462131516.
[I 2025-12-05 16:16:28,302] Trial 65 finished with value: 0.029651105902745205 and parameters: {'model_type': 'mlp', 'hidden_dims': '[512, 256]', 'dropout': 0.5583159085516702, 'batch_norm': False, 'lr': 0.00037988230329169916, 'weight_decay': 5.460965351696655e-06, 'epochs': 350, 'loss': 'mse', 'optimizer': 'adam', 'graph_mode': 'off', 'use_snp_selection': True, 'num_snps': 4390}. Best is trial 38 with value: 0.050874541462131516.
[I 2025-12-05 16:16:30,164] Trial 66 finished with value: -0.01689665081104533 and parameters: {'model_type': 'mlp', 'hidden_dims': '[128, 64]', 'dropout': 0.5217531261151386, 'batch_norm': False, 'lr': 4.459442361668994e-06, 'weight_decay': 3.6694125061251493e-06, 'epochs': 331, 'loss': 'mse', 'optimizer': 'adam', 'graph_mode': 'off', 'use_snp_selection': True, 'num_snps': 35039}. Best is trial 38 with value: 0.050874541462131516.
[I 2025-12-05 16:16:33,132] Trial 67 finished with value: 0.004602851510172257 and parameters: {'model_type': 'mlp', 'hidden_dims': '[256, 128]', 'dropout': 0.32921458738447446, 'batch_norm': True, 'lr': 0.00018038296365498205, 'weight_decay': 2.212837056644384e-05, 'epochs': 302, 'loss': 'mse', 'optimizer': 'adam', 'graph_mode': 'off', 'use_snp_selection': True, 'num_snps': 59824}. Best is trial 38 with value: 0.050874541462131516.
[I 2025-12-05 16:16:34,439] Trial 68 finished with value: 0.0008390380502018816 and parameters: {'model_type': 'mlp', 'hidden_dims': '[128, 64]', 'dropout': 0.4444478534734578, 'batch_norm': False, 'lr': 0.0003032199868176378, 'weight_decay': 1.5296543650529694e-07, 'epochs': 235, 'loss': 'mse', 'optimizer': 'adam', 'graph_mode': 'off', 'use_snp_selection': True, 'num_snps': 18906}. Best is trial 38 with value: 0.050874541462131516.
[I 2025-12-05 16:16:36,689] Trial 69 finished with value: 0.018941158884546776 and parameters: {'model_type': 'mlp', 'hidden_dims': '[512, 256]', 'dropout': 0.504257175247462, 'batch_norm': False, 'lr': 7.5015392254418695e-06, 'weight_decay': 0.00020476002593669868, 'epochs': 339, 'loss': 'mae', 'optimizer': 'adam', 'graph_mode': 'off', 'use_snp_selection': False}. Best is trial 38 with value: 0.050874541462131516.
[I 2025-12-05 16:16:38,079] Trial 70 finished with value: 0.017146838435580104 and parameters: {'model_type': 'mlp', 'hidden_dims': '[512, 128]', 'dropout': 0.1846899656556063, 'batch_norm': True, 'lr': 0.00023289273778699543, 'weight_decay': 5.565373524315583e-05, 'epochs': 107, 'loss': 'mse', 'optimizer': 'adam', 'graph_mode': 'off', 'use_snp_selection': True, 'num_snps': 22237}. Best is trial 38 with value: 0.050874541462131516.
[I 2025-12-05 16:16:39,061] Trial 71 finished with value: 0.029204023859467347 and parameters: {'model_type': 'mlp', 'hidden_dims': '[128, 64]', 'dropout': 0.5759747580575366, 'batch_norm': False, 'lr': 0.00015565654868643535, 'weight_decay': 1.890229018910695e-05, 'epochs': 288, 'loss': 'mse', 'optimizer': 'adam', 'graph_mode': 'off', 'use_snp_selection': True, 'num_snps': 4074}. Best is trial 38 with value: 0.050874541462131516.
[I 2025-12-05 16:16:40,131] Trial 72 finished with value: 0.017773753120993035 and parameters: {'model_type': 'mlp', 'hidden_dims': '[128, 64]', 'dropout': 0.5851091786557262, 'batch_norm': False, 'lr': 5.1472704747032356e-05, 'weight_decay': 1.3411359311678673e-05, 'epochs': 320, 'loss': 'mse', 'optimizer': 'adam', 'graph_mode': 'off', 'use_snp_selection': True, 'num_snps': 6708}. Best is trial 38 with value: 0.050874541462131516.
[I 2025-12-05 16:16:41,294] Trial 73 finished with value: 0.012557526614807647 and parameters: {'model_type': 'mlp', 'hidden_dims': '[128, 64]', 'dropout': 0.570055132161923, 'batch_norm': False, 'lr': 0.00013551709884071847, 'weight_decay': 8.544857661292563e-06, 'epochs': 302, 'loss': 'mse', 'optimizer': 'adam', 'graph_mode': 'off', 'use_snp_selection': True, 'num_snps': 11116}. Best is trial 38 with value: 0.050874541462131516.
[I 2025-12-05 16:16:42,256] Trial 74 finished with value: 0.030523339037909863 and parameters: {'model_type': 'mlp', 'hidden_dims': '[128, 64]', 'dropout': 0.5506296702838422, 'batch_norm': False, 'lr': 7.91903186988699e-05, 'weight_decay': 3.0504231770706215e-05, 'epochs': 281, 'loss': 'mse', 'optimizer': 'adam', 'graph_mode': 'off', 'use_snp_selection': True, 'num_snps': 4110}. Best is trial 38 with value: 0.050874541462131516.
[I 2025-12-05 16:16:43,338] Trial 75 finished with value: 0.049767283898813006 and parameters: {'model_type': 'mlp', 'hidden_dims': '[256, 128, 64]', 'dropout': 0.5299436260336626, 'batch_norm': False, 'lr': 0.00011315175032553604, 'weight_decay': 3.3131509646789603e-06, 'epochs': 342, 'loss': 'mse', 'optimizer': 'adam', 'graph_mode': 'off', 'use_snp_selection': True, 'num_snps': 3299}. Best is trial 38 with value: 0.050874541462131516.
[I 2025-12-05 16:16:44,529] Trial 76 finished with value: 0.0169133190675506 and parameters: {'model_type': 'mlp', 'hidden_dims': '[256, 128, 64]', 'dropout': 0.5366969695385533, 'batch_norm': False, 'lr': 0.00011008605402203288, 'weight_decay': 3.457183721069335e-06, 'epochs': 342, 'loss': 'mse', 'optimizer': 'adam', 'graph_mode': 'off', 'use_snp_selection': True, 'num_snps': 7100}. Best is trial 38 with value: 0.050874541462131516.
[I 2025-12-05 16:16:46,228] Trial 77 finished with value: -0.01919962135429562 and parameters: {'model_type': 'mlp', 'hidden_dims': '[256, 128, 64]', 'dropout': 0.473399852587462, 'batch_norm': False, 'lr': 2.415447734680473e-06, 'weight_decay': 0.0006536149237303101, 'epochs': 323, 'loss': 'mse', 'optimizer': 'adam', 'graph_mode': 'off', 'use_snp_selection': True, 'num_snps': 26306}. Best is trial 38 with value: 0.050874541462131516.
[I 2025-12-05 16:16:47,275] Trial 78 finished with value: 0.03430750508184802 and parameters: {'model_type': 'mlp', 'hidden_dims': '[256, 128, 64]', 'dropout': 0.5107964585423839, 'batch_norm': False, 'lr': 0.0005132644310739546, 'weight_decay': 2.249686661112659e-06, 'epochs': 312, 'loss': 'mse', 'optimizer': 'adam', 'graph_mode': 'off', 'use_snp_selection': True, 'num_snps': 2987}. Best is trial 38 with value: 0.050874541462131516.
[I 2025-12-05 16:16:48,688] Trial 79 finished with value: 0.002980737616145265 and parameters: {'model_type': 'mlp', 'hidden_dims': '[256, 128, 64]', 'dropout': 0.4202146343679125, 'batch_norm': False, 'lr': 3.5758270589685075e-06, 'weight_decay': 5.781821025997074e-06, 'epochs': 343, 'loss': 'mse', 'optimizer': 'adam', 'graph_mode': 'off', 'use_snp_selection': True, 'num_snps': 15205}. Best is trial 38 with value: 0.050874541462131516.
[I 2025-12-05 16:16:49,771] Trial 80 finished with value: 0.051821822956416304 and parameters: {'model_type': 'mlp', 'hidden_dims': '[512, 256]', 'dropout': 0.3037560073781933, 'batch_norm': True, 'lr': 0.0004223202677135137, 'weight_decay': 1.188213573890122e-06, 'epochs': 331, 'loss': 'mae', 'optimizer': 'adam', 'graph_mode': 'off', 'use_snp_selection': True, 'num_snps': 2017}. Best is trial 80 with value: 0.051821822956416304.
[I 2025-12-05 16:16:50,887] Trial 81 finished with value: 0.03534847987572991 and parameters: {'model_type': 'mlp', 'hidden_dims': '[512, 256]', 'dropout': 0.36827607851505173, 'batch_norm': True, 'lr': 0.0004296789303649326, 'weight_decay': 1.291749457980307e-06, 'epochs': 337, 'loss': 'mae', 'optimizer': 'adam', 'graph_mode': 'off', 'use_snp_selection': True, 'num_snps': 2194}. Best is trial 80 with value: 0.051821822956416304.
[I 2025-12-05 16:16:52,186] Trial 82 finished with value: 0.02005872156876981 and parameters: {'model_type': 'mlp', 'hidden_dims': '[512, 256]', 'dropout': 0.2993498923543754, 'batch_norm': True, 'lr': 0.0007555116168641259, 'weight_decay': 7.86547068839227e-07, 'epochs': 332, 'loss': 'mae', 'optimizer': 'adam', 'graph_mode': 'off', 'use_snp_selection': True, 'num_snps': 9519}. Best is trial 80 with value: 0.051821822956416304.
[I 2025-12-05 16:16:53,284] Trial 83 finished with value: 0.028759317119008785 and parameters: {'model_type': 'mlp', 'hidden_dims': '[512, 256]', 'dropout': 0.26427074258660627, 'batch_norm': True, 'lr': 0.000644633818342695, 'weight_decay': 9.531619149930256e-07, 'epochs': 342, 'loss': 'mae', 'optimizer': 'adam', 'graph_mode': 'off', 'use_snp_selection': True, 'num_snps': 2031}. Best is trial 80 with value: 0.051821822956416304.
[I 2025-12-05 16:16:54,506] Trial 84 finished with value: 0.003992613775652067 and parameters: {'model_type': 'mlp', 'hidden_dims': '[512, 256]', 'dropout': 0.36493162693564263, 'batch_norm': True, 'lr': 1.2956666542932232e-06, 'weight_decay': 1.531568537569254e-06, 'epochs': 350, 'loss': 'mae', 'optimizer': 'adam', 'graph_mode': 'off', 'use_snp_selection': True, 'num_snps': 6159}. Best is trial 80 with value: 0.051821822956416304.
[I 2025-12-05 16:16:55,641] Trial 85 finished with value: 0.04263378215064132 and parameters: {'model_type': 'mlp', 'hidden_dims': '[512, 256]', 'dropout': 0.341739257082995, 'batch_norm': True, 'lr': 3.867855546956161e-05, 'weight_decay': 2.982962178374754e-07, 'epochs': 337, 'loss': 'mae', 'optimizer': 'adam', 'graph_mode': 'off', 'use_snp_selection': True, 'num_snps': 3718}. Best is trial 80 with value: 0.051821822956416304.
[I 2025-12-05 16:16:56,719] Trial 86 finished with value: 0.030451299855520017 and parameters: {'model_type': 'mlp', 'hidden_dims': '[512, 256]', 'dropout': 0.3205824143986792, 'batch_norm': True, 'lr': 2.8781434756173456e-05, 'weight_decay': 1.0668967860433429e-07, 'epochs': 113, 'loss': 'mae', 'optimizer': 'adam', 'graph_mode': 'off', 'use_snp_selection': True, 'num_snps': 12671}. Best is trial 80 with value: 0.051821822956416304.
[I 2025-12-05 16:16:58,107] Trial 87 finished with value: -0.011182439628236828 and parameters: {'model_type': 'mlp', 'hidden_dims': '[512, 256]', 'dropout': 0.3106324431649783, 'batch_norm': True, 'lr': 5.379901274936768e-05, 'weight_decay': 3.199257596121313e-07, 'epochs': 150, 'loss': 'mae', 'optimizer': 'adam', 'graph_mode': 'off', 'use_snp_selection': False}. Best is trial 80 with value: 0.051821822956416304.
[I 2025-12-05 16:16:58,984] Trial 88 finished with value: 0.03135759638810003 and parameters: {'model_type': 'mlp', 'hidden_dims': '[512, 256]', 'dropout': 0.257780975039268, 'batch_norm': True, 'lr': 4.380965674036588e-05, 'weight_decay': 0.000292566607356349, 'epochs': 132, 'loss': 'mae', 'optimizer': 'adam', 'graph_mode': 'off', 'use_snp_selection': True, 'num_snps': 4129}. Best is trial 80 with value: 0.051821822956416304.
[I 2025-12-05 16:17:00,003] Trial 89 finished with value: 0.010959868881618703 and parameters: {'model_type': 'mlp', 'hidden_dims': '[512, 64]', 'dropout': 0.28922804083298537, 'batch_norm': True, 'lr': 3.6204986876792906e-05, 'weight_decay': 3.471984093771626e-07, 'epochs': 206, 'loss': 'mae', 'optimizer': 'adam', 'graph_mode': 'off', 'use_snp_selection': True, 'num_snps': 6060}. Best is trial 80 with value: 0.051821822956416304.
[I 2025-12-05 16:17:01,238] Trial 90 finished with value: 0.0632226944528337 and parameters: {'model_type': 'mlp', 'hidden_dims': '[512, 256]', 'dropout': 0.27388143452519703, 'batch_norm': True, 'lr': 1.0490014246661059e-05, 'weight_decay': 2.8073948261816522e-06, 'epochs': 309, 'loss': 'mae', 'optimizer': 'adam', 'graph_mode': 'off', 'use_snp_selection': True, 'num_snps': 8555}. Best is trial 90 with value: 0.0632226944528337.
[I 2025-12-05 16:17:02,496] Trial 91 finished with value: 0.0184058036469151 and parameters: {'model_type': 'mlp', 'hidden_dims': '[512, 256]', 'dropout': 0.2718923114850156, 'batch_norm': True, 'lr': 1.2366914142914448e-05, 'weight_decay': 3.2350639609099686e-06, 'epochs': 321, 'loss': 'mae', 'optimizer': 'adam', 'graph_mode': 'off', 'use_snp_selection': True, 'num_snps': 8765}. Best is trial 90 with value: 0.0632226944528337.
[I 2025-12-05 16:17:03,622] Trial 92 finished with value: -0.03538838390037126 and parameters: {'model_type': 'mlp', 'hidden_dims': '[512, 256]', 'dropout': 0.215659032916113, 'batch_norm': True, 'lr': 4.980892552088795e-06, 'weight_decay': 2.6768653559917006e-06, 'epochs': 331, 'loss': 'mae', 'optimizer': 'adam', 'graph_mode': 'off', 'use_snp_selection': True, 'num_snps': 3606}. Best is trial 90 with value: 0.0632226944528337.
[I 2025-12-05 16:17:04,629] Trial 93 finished with value: 0.012367972419059117 and parameters: {'model_type': 'mlp', 'hidden_dims': '[512, 256]', 'dropout': 0.3472636369761623, 'batch_norm': True, 'lr': 2.0820803387365802e-05, 'weight_decay': 6.740057220152568e-06, 'epochs': 187, 'loss': 'mae', 'optimizer': 'adam', 'graph_mode': 'off', 'use_snp_selection': True, 'num_snps': 6438}. Best is trial 90 with value: 0.0632226944528337.
[I 2025-12-05 16:17:05,787] Trial 94 finished with value: -0.005371346620461278 and parameters: {'model_type': 'mlp', 'hidden_dims': '[512, 256]', 'dropout': 0.458585455576355, 'batch_norm': True, 'lr': 8.001311330200383e-06, 'weight_decay': 4.857097628595093e-06, 'epochs': 308, 'loss': 'mae', 'optimizer': 'adam', 'graph_mode': 'off', 'use_snp_selection': True, 'num_snps': 5211}. Best is trial 90 with value: 0.0632226944528337.
[I 2025-12-05 16:17:07,069] Trial 95 finished with value: -0.05240483338817903 and parameters: {'model_type': 'mlp', 'hidden_dims': '[512, 256]', 'dropout': 0.23201140972563544, 'batch_norm': True, 'lr': 1.0411032899298739e-05, 'weight_decay': 2.0616242811356335e-06, 'epochs': 345, 'loss': 'mae', 'optimizer': 'adam', 'graph_mode': 'off', 'use_snp_selection': True, 'num_snps': 8508}. Best is trial 90 with value: 0.0632226944528337.
[I 2025-12-05 16:17:08,084] Trial 96 finished with value: 0.002522617860882615 and parameters: {'model_type': 'mlp', 'hidden_dims': '[512, 256]', 'dropout': 0.2853163165557995, 'batch_norm': True, 'lr': 0.00011889253201442001, 'weight_decay': 4.275560536683939e-07, 'epochs': 249, 'loss': 'mae', 'optimizer': 'adam', 'graph_mode': 'off', 'use_snp_selection': True, 'num_snps': 3613}. Best is trial 90 with value: 0.0632226944528337.
[I 2025-12-05 16:17:09,387] Trial 97 finished with value: -0.015515961489324302 and parameters: {'model_type': 'mlp', 'hidden_dims': '[256, 128, 64]', 'dropout': 0.3385214619361345, 'batch_norm': True, 'lr': 6.66183958503789e-06, 'weight_decay': 2.3399495444803764e-07, 'epochs': 270, 'loss': 'mae', 'optimizer': 'adam', 'graph_mode': 'off', 'use_snp_selection': True, 'num_snps': 10469}. Best is trial 90 with value: 0.0632226944528337.
[I 2025-12-05 16:17:11,726] Trial 98 finished with value: -0.003439739307710521 and parameters: {'model_type': 'mlp', 'hidden_dims': '[256, 128]', 'dropout': 0.5261913058747589, 'batch_norm': True, 'lr': 9.622128296609152e-05, 'weight_decay': 4.927834993931727e-07, 'epochs': 335, 'loss': 'mse', 'optimizer': 'adam', 'graph_mode': 'off', 'use_snp_selection': True, 'num_snps': 43252}. Best is trial 90 with value: 0.0632226944528337.
[I 2025-12-05 16:17:12,820] Trial 99 finished with value: 0.018191174840566482 and parameters: {'model_type': 'mlp', 'hidden_dims': '[512, 256]', 'dropout': 0.31538017226688514, 'batch_norm': False, 'lr': 4.860318876198468e-06, 'weight_decay': 1.8043745384505186e-06, 'epochs': 327, 'loss': 'mse', 'optimizer': 'adam', 'graph_mode': 'off', 'use_snp_selection': True, 'num_snps': 5296}. Best is trial 90 with value: 0.0632226944528337.
[I 2025-12-05 16:17:15,168] Trial 100 finished with value: 0.0018415911068321116 and parameters: {'model_type': 'mlp', 'hidden_dims': '[512, 256]', 'dropout': 0.40414209530993395, 'batch_norm': True, 'lr': 0.00018077549929655944, 'weight_decay': 2.9507314633077684e-06, 'epochs': 350, 'loss': 'mae', 'optimizer': 'adam', 'graph_mode': 'off', 'use_snp_selection': False}. Best is trial 90 with value: 0.0632226944528337.
[I 2025-12-05 16:17:16,284] Trial 101 finished with value: 0.03440879947201663 and parameters: {'model_type': 'mlp', 'hidden_dims': '[512, 256]', 'dropout': 0.3644639462908257, 'batch_norm': True, 'lr': 0.00047804395404062546, 'weight_decay': 1.3515331288986092e-06, 'epochs': 337, 'loss': 'mae', 'optimizer': 'adam', 'graph_mode': 'off', 'use_snp_selection': True, 'num_snps': 2234}. Best is trial 90 with value: 0.0632226944528337.
[I 2025-12-05 16:17:17,393] Trial 102 finished with value: 0.029274454893010875 and parameters: {'model_type': 'mlp', 'hidden_dims': '[512, 256]', 'dropout': 0.30516470171086046, 'batch_norm': True, 'lr': 0.0002671553362015083, 'weight_decay': 0.00039325095401785304, 'epochs': 313, 'loss': 'mae', 'optimizer': 'adam', 'graph_mode': 'off', 'use_snp_selection': True, 'num_snps': 3337}. Best is trial 90 with value: 0.0632226944528337.
[I 2025-12-05 16:17:18,502] Trial 103 finished with value: 0.009306951886823199 and parameters: {'model_type': 'mlp', 'hidden_dims': '[512, 256]', 'dropout': 0.37940422372838445, 'batch_norm': True, 'lr': 6.777869302818275e-05, 'weight_decay': 6.495958028269389e-07, 'epochs': 337, 'loss': 'mae', 'optimizer': 'adam', 'graph_mode': 'off', 'use_snp_selection': True, 'num_snps': 2043}. Best is trial 90 with value: 0.0632226944528337.
[I 2025-12-05 16:17:19,733] Trial 104 finished with value: 0.018514560057122455 and parameters: {'model_type': 'mlp', 'hidden_dims': '[512, 128]', 'dropout': 0.2791553214182468, 'batch_norm': True, 'lr': 0.00030253572329060074, 'weight_decay': 0.00014531079413822887, 'epochs': 318, 'loss': 'mae', 'optimizer': 'adam', 'graph_mode': 'off', 'use_snp_selection': True, 'num_snps': 7464}. Best is trial 90 with value: 0.0632226944528337.
[I 2025-12-05 16:17:20,858] Trial 105 finished with value: 0.024526519764782886 and parameters: {'model_type': 'mlp', 'hidden_dims': '[512, 256]', 'dropout': 0.24535453843590987, 'batch_norm': False, 'lr': 3.461010744300322e-06, 'weight_decay': 8.353556115822628e-06, 'epochs': 327, 'loss': 'mae', 'optimizer': 'adam', 'graph_mode': 'off', 'use_snp_selection': True, 'num_snps': 4955}. Best is trial 90 with value: 0.0632226944528337.
[I 2025-12-05 16:17:22,052] Trial 106 finished with value: 0.029013318154070242 and parameters: {'model_type': 'mlp', 'hidden_dims': '[512, 64]', 'dropout': 0.3918298370794833, 'batch_norm': True, 'lr': 0.0005895579901573568, 'weight_decay': 1.0100986605454342e-06, 'epochs': 346, 'loss': 'mse', 'optimizer': 'adam', 'graph_mode': 'off', 'use_snp_selection': True, 'num_snps': 3405}. Best is trial 90 with value: 0.0632226944528337.
