[I 2025-12-05 15:12:56,213] Trial 2 finished with value: 0.009765374653151877 and parameters: {'model_type': 'mlp', 'hidden_dims': '[256, 128, 64]', 'dropout': 0.41314357415569625, 'batch_norm': False, 'lr': 3.952233718592101e-06, 'weight_decay': 0.00026754769258252603, 'epochs': 149, 'loss': 'mse', 'optimizer': 'adam', 'graph_mode': 'off', 'use_snp_selection': True, 'num_snps': 11571}. Best is trial 1 with value: 0.03964335404879725.
[I 2025-12-05 15:12:58,273] Trial 3 finished with value: 0.028145518275246213 and parameters: {'model_type': 'mlp', 'hidden_dims': '[512, 64]', 'dropout': 0.5938127374509361, 'batch_norm': False, 'lr': 5.67704586114731e-06, 'weight_decay': 2.4518087630137052e-05, 'epochs': 320, 'loss': 'mae', 'optimizer': 'adam', 'graph_mode': 'off', 'use_snp_selection': False}. Best is trial 1 with value: 0.03964335404879725.
[I 2025-12-05 15:13:00,708] Trial 4 finished with value: 0.01996605520078043 and parameters: {'model_type': 'mlp', 'hidden_dims': '[512, 128]', 'dropout': 0.25746343592134413, 'batch_norm': True, 'lr': 1.3467657668402788e-06, 'weight_decay': 0.00033087251918647806, 'epochs': 277, 'loss': 'mse', 'optimizer': 'adam', 'graph_mode': 'off', 'use_snp_selection': True, 'num_snps': 36675}. Best is trial 1 with value: 0.03964335404879725.
[I 2025-12-05 15:13:02,558] Trial 5 finished with value: 0.011699526657469199 and parameters: {'model_type': 'mlp', 'hidden_dims': '[512, 64]', 'dropout': 0.38275350994408375, 'batch_norm': True, 'lr': 1.5586664309232824e-06, 'weight_decay': 0.0008227664668621182, 'epochs': 145, 'loss': 'mae', 'optimizer': 'adam', 'graph_mode': 'off', 'use_snp_selection': True, 'num_snps': 32148}. Best is trial 1 with value: 0.03964335404879725.
[I 2025-12-05 15:13:03,557] Trial 6 finished with value: 0.05581165956313753 and parameters: {'model_type': 'mlp', 'hidden_dims': '[256, 128]', 'dropout': 0.3930109900265879, 'batch_norm': False, 'lr': 4.892964372128395e-05, 'weight_decay': 1.5809549317992182e-06, 'epochs': 199, 'loss': 'mse', 'optimizer': 'adam', 'graph_mode': 'off', 'use_snp_selection': False}. Best is trial 6 with value: 0.05581165956313753.
[I 2025-12-05 15:13:04,657] Trial 7 finished with value: 0.03227519595092648 and parameters: {'model_type': 'mlp', 'hidden_dims': '[512, 256]', 'dropout': 0.15343979219678458, 'batch_norm': True, 'lr': 6.234003099047341e-05, 'weight_decay': 3.894760610535477e-07, 'epochs': 97, 'loss': 'mse', 'optimizer': 'adam', 'graph_mode': 'off', 'use_snp_selection': False}. Best is trial 6 with value: 0.05581165956313753.
[I 2025-12-05 15:13:06,664] Trial 8 finished with value: 0.04269760469454993 and parameters: {'model_type': 'mlp', 'hidden_dims': '[512, 128]', 'dropout': 0.10743001231661406, 'batch_norm': True, 'lr': 0.00023728538449271062, 'weight_decay': 1.7629071578048637e-05, 'epochs': 312, 'loss': 'mae', 'optimizer': 'adam', 'graph_mode': 'off', 'use_snp_selection': False}. Best is trial 6 with value: 0.05581165956313753.
[I 2025-12-05 15:13:08,118] Trial 9 finished with value: 0.05397689420395191 and parameters: {'model_type': 'mlp', 'hidden_dims': '[512, 64]', 'dropout': 0.14505336736221927, 'batch_norm': True, 'lr': 5.8619638388111826e-05, 'weight_decay': 6.200156172669308e-07, 'epochs': 175, 'loss': 'mse', 'optimizer': 'adam', 'graph_mode': 'off', 'use_snp_selection': False}. Best is trial 6 with value: 0.05581165956313753.
[I 2025-12-05 15:13:08,856] Trial 10 finished with value: 0.019717434323621077 and parameters: {'model_type': 'mlp', 'hidden_dims': '[256, 128]', 'dropout': 0.5267360651501256, 'batch_norm': False, 'lr': 0.00032393778075602147, 'weight_decay': 1.936962886850364e-06, 'epochs': 46, 'loss': 'mse', 'optimizer': 'adam', 'graph_mode': 'off', 'use_snp_selection': False}. Best is trial 6 with value: 0.05581165956313753.
[I 2025-12-05 15:13:09,875] Trial 11 finished with value: 0.005564892180857073 and parameters: {'model_type': 'mlp', 'hidden_dims': '[256, 128]', 'dropout': 0.30438831352760154, 'batch_norm': False, 'lr': 1.6474108386126448e-05, 'weight_decay': 1.1958586605608392e-07, 'epochs': 185, 'loss': 'mse', 'optimizer': 'adam', 'graph_mode': 'off', 'use_snp_selection': False}. Best is trial 6 with value: 0.05581165956313753.
[I 2025-12-05 15:13:11,507] Trial 12 finished with value: 0.012634174894202968 and parameters: {'model_type': 'mlp', 'hidden_dims': '[512, 64]', 'dropout': 0.2566297617165757, 'batch_norm': False, 'lr': 2.1956038299947918e-05, 'weight_decay': 1.255784110448998e-06, 'epochs': 218, 'loss': 'mse', 'optimizer': 'adam', 'graph_mode': 'off', 'use_snp_selection': False}. Best is trial 6 with value: 0.05581165956313753.
[I 2025-12-05 15:13:12,270] Trial 13 finished with value: -0.0033488292250807602 and parameters: {'model_type': 'mlp', 'hidden_dims': '[128, 64]', 'dropout': 0.4741937675090661, 'batch_norm': False, 'lr': 8.582121287988678e-05, 'weight_decay': 2.269687923320985e-06, 'epochs': 174, 'loss': 'mse', 'optimizer': 'adam', 'graph_mode': 'off', 'use_snp_selection': False}. Best is trial 6 with value: 0.05581165956313753.
[I 2025-12-05 15:13:13,429] Trial 14 finished with value: 0.049326827241011124 and parameters: {'model_type': 'mlp', 'hidden_dims': '[256, 128, 64]', 'dropout': 0.3012984444538551, 'batch_norm': True, 'lr': 0.0006681578335050954, 'weight_decay': 4.808456429945621e-07, 'epochs': 246, 'loss': 'mse', 'optimizer': 'adam', 'graph_mode': 'off', 'use_snp_selection': False}. Best is trial 6 with value: 0.05581165956313753.
[I 2025-12-05 15:13:14,564] Trial 15 finished with value: 0.02474842912045167 and parameters: {'model_type': 'mlp', 'hidden_dims': '[512, 256]', 'dropout': 0.36434762352660965, 'batch_norm': False, 'lr': 1.0876311506248302e-05, 'weight_decay': 4.415185978856655e-06, 'epochs': 106, 'loss': 'mse', 'optimizer': 'adam', 'graph_mode': 'off', 'use_snp_selection': False}. Best is trial 6 with value: 0.05581165956313753.
[I 2025-12-05 15:13:15,602] Trial 16 finished with value: 0.04675640021614487 and parameters: {'model_type': 'mlp', 'hidden_dims': '[256, 128]', 'dropout': 0.20644272177110315, 'batch_norm': True, 'lr': 0.00015782481728265424, 'weight_decay': 1.1118475831208264e-07, 'epochs': 206, 'loss': 'mse', 'optimizer': 'adam', 'graph_mode': 'off', 'use_snp_selection': False}. Best is trial 6 with value: 0.05581165956313753.
[I 2025-12-05 15:13:16,726] Trial 17 finished with value: 0.031346647639881736 and parameters: {'model_type': 'mlp', 'hidden_dims': '[512, 64]', 'dropout': 0.4828821377080481, 'batch_norm': False, 'lr': 4.163115072759242e-05, 'weight_decay': 4.902698136136312e-07, 'epochs': 104, 'loss': 'mse', 'optimizer': 'adam', 'graph_mode': 'off', 'use_snp_selection': False}. Best is trial 6 with value: 0.05581165956313753.
[I 2025-12-05 15:13:19,448] Trial 18 finished with value: -0.0039775504835525 and parameters: {'model_type': 'mlp', 'hidden_dims': '[256, 128]', 'dropout': 0.32173537768276167, 'batch_norm': False, 'lr': 0.0009620630595655681, 'weight_decay': 4.734370589280122e-06, 'epochs': 149, 'loss': 'mse', 'optimizer': 'adam', 'graph_mode': 'off', 'use_snp_selection': True, 'num_snps': 58241}. Best is trial 6 with value: 0.05581165956313753.
[I 2025-12-05 15:13:21,391] Trial 19 finished with value: 0.03268290892354172 and parameters: {'model_type': 'mlp', 'hidden_dims': '[512, 64]', 'dropout': 0.12092024350718522, 'batch_norm': True, 'lr': 0.00014334793979738487, 'weight_decay': 8.622142158470991e-07, 'epochs': 275, 'loss': 'mse', 'optimizer': 'adam', 'graph_mode': 'off', 'use_snp_selection': False}. Best is trial 6 with value: 0.05581165956313753.
[I 2025-12-05 15:13:22,281] Trial 20 finished with value: 0.012459997433218798 and parameters: {'model_type': 'mlp', 'hidden_dims': '[512, 128]', 'dropout': 0.24280079961225087, 'batch_norm': False, 'lr': 3.4618347735679545e-05, 'weight_decay': 2.628343027799026e-07, 'epochs': 43, 'loss': 'mse', 'optimizer': 'adam', 'graph_mode': 'off', 'use_snp_selection': False}. Best is trial 6 with value: 0.05581165956313753.
[I 2025-12-05 15:13:23,435] Trial 21 finished with value: 0.0522229571091274 and parameters: {'model_type': 'mlp', 'hidden_dims': '[256, 128, 64]', 'dropout': 0.3196434816371064, 'batch_norm': True, 'lr': 0.000304778179195582, 'weight_decay': 7.416953667801132e-07, 'epochs': 243, 'loss': 'mse', 'optimizer': 'adam', 'graph_mode': 'off', 'use_snp_selection': False}. Best is trial 6 with value: 0.05581165956313753.
[I 2025-12-05 15:13:24,545] Trial 22 finished with value: 0.02931564485963438 and parameters: {'model_type': 'mlp', 'hidden_dims': '[256, 128, 64]', 'dropout': 0.352367735746185, 'batch_norm': True, 'lr': 0.0004899858632182564, 'weight_decay': 3.914206003894572e-06, 'epochs': 233, 'loss': 'mse', 'optimizer': 'adam', 'graph_mode': 'off', 'use_snp_selection': False}. Best is trial 6 with value: 0.05581165956313753.
[I 2025-12-05 15:13:25,534] Trial 23 finished with value: 0.018231863196507762 and parameters: {'model_type': 'mlp', 'hidden_dims': '[256, 128, 64]', 'dropout': 0.1676807116433632, 'batch_norm': True, 'lr': 0.00018936793887604984, 'weight_decay': 8.731581411613647e-07, 'epochs': 180, 'loss': 'mse', 'optimizer': 'adam', 'graph_mode': 'off', 'use_snp_selection': False}. Best is trial 6 with value: 0.05581165956313753.
[I 2025-12-05 15:13:26,729] Trial 24 finished with value: 0.023161750552042035 and parameters: {'model_type': 'mlp', 'hidden_dims': '[256, 128, 64]', 'dropout': 0.4217294025469774, 'batch_norm': True, 'lr': 0.00010168606130087123, 'weight_decay': 2.1336866979613932e-07, 'epochs': 271, 'loss': 'mse', 'optimizer': 'adam', 'graph_mode': 'off', 'use_snp_selection': False}. Best is trial 6 with value: 0.05581165956313753.
[I 2025-12-05 15:13:28,288] Trial 25 finished with value: 0.03831689138492872 and parameters: {'model_type': 'mlp', 'hidden_dims': '[512, 256]', 'dropout': 0.5335323239954017, 'batch_norm': True, 'lr': 0.00036353141934514574, 'weight_decay': 1.7839119180125808e-06, 'epochs': 206, 'loss': 'mse', 'optimizer': 'adam', 'graph_mode': 'off', 'use_snp_selection': False}. Best is trial 6 with value: 0.05581165956313753.
[I 2025-12-05 15:13:29,145] Trial 26 finished with value: 0.008654052825546413 and parameters: {'model_type': 'mlp', 'hidden_dims': '[128, 64]', 'dropout': 0.281643742113024, 'batch_norm': True, 'lr': 1.2550693142833744e-05, 'weight_decay': 7.830367085139929e-07, 'epochs': 162, 'loss': 'mae', 'optimizer': 'adam', 'graph_mode': 'off', 'use_snp_selection': True, 'num_snps': 3842}. Best is trial 6 with value: 0.05581165956313753.
[I 2025-12-05 15:13:30,970] Trial 27 finished with value: 0.0477635878765412 and parameters: {'model_type': 'mlp', 'hidden_dims': '[512, 64]', 'dropout': 0.387279492508151, 'batch_norm': True, 'lr': 4.788977485245994e-05, 'weight_decay': 3.3498117115569647e-06, 'epochs': 258, 'loss': 'mse', 'optimizer': 'adam', 'graph_mode': 'off', 'use_snp_selection': False}. Best is trial 6 with value: 0.05581165956313753.
[I 2025-12-05 15:13:31,859] Trial 28 finished with value: 0.0392882170370642 and parameters: {'model_type': 'mlp', 'hidden_dims': '[256, 128]', 'dropout': 0.3254314863734792, 'batch_norm': False, 'lr': 0.00010981332220598534, 'weight_decay': 2.168834641974451e-07, 'epochs': 126, 'loss': 'mse', 'optimizer': 'adam', 'graph_mode': 'off', 'use_snp_selection': False}. Best is trial 6 with value: 0.05581165956313753.
[I 2025-12-05 15:13:33,410] Trial 29 finished with value: -0.012241508521766746 and parameters: {'model_type': 'mlp', 'hidden_dims': '[128, 64]', 'dropout': 0.18688556311718407, 'batch_norm': True, 'lr': 7.81377873400801e-06, 'weight_decay': 5.5227103357724904e-05, 'epochs': 291, 'loss': 'mae', 'optimizer': 'adam', 'graph_mode': 'off', 'use_snp_selection': True, 'num_snps': 19468}. Best is trial 6 with value: 0.05581165956313753.
[I 2025-12-05 15:13:34,551] Trial 30 finished with value: 0.05390494027528395 and parameters: {'model_type': 'mlp', 'hidden_dims': '[256, 128, 64]', 'dropout': 0.21970250857477489, 'batch_norm': True, 'lr': 3.361328999693786e-05, 'weight_decay': 6.9133849938507225e-06, 'epochs': 220, 'loss': 'mse', 'optimizer': 'adam', 'graph_mode': 'off', 'use_snp_selection': False}. Best is trial 6 with value: 0.05581165956313753.
[I 2025-12-05 15:13:35,646] Trial 31 finished with value: 0.02262179169046 and parameters: {'model_type': 'mlp', 'hidden_dims': '[256, 128, 64]', 'dropout': 0.22101253394048387, 'batch_norm': True, 'lr': 2.471446301079915e-05, 'weight_decay': 7.816000199555653e-06, 'epochs': 224, 'loss': 'mse', 'optimizer': 'adam', 'graph_mode': 'off', 'use_snp_selection': False}. Best is trial 6 with value: 0.05581165956313753.
[I 2025-12-05 15:13:36,667] Trial 32 finished with value: 0.033413174918501154 and parameters: {'model_type': 'mlp', 'hidden_dims': '[256, 128, 64]', 'dropout': 0.16373177370088735, 'batch_norm': True, 'lr': 5.475532178807485e-05, 'weight_decay': 4.413851575565222e-05, 'epochs': 194, 'loss': 'mse', 'optimizer': 'adam', 'graph_mode': 'off', 'use_snp_selection': False}. Best is trial 6 with value: 0.05581165956313753.
[I 2025-12-05 15:13:37,807] Trial 33 finished with value: -0.007347761058518456 and parameters: {'model_type': 'mlp', 'hidden_dims': '[256, 128, 64]', 'dropout': 0.45418790033477996, 'batch_norm': True, 'lr': 3.4395322320422584e-06, 'weight_decay': 7.602380067126248e-06, 'epochs': 244, 'loss': 'mse', 'optimizer': 'adam', 'graph_mode': 'off', 'use_snp_selection': False}. Best is trial 6 with value: 0.05581165956313753.
[I 2025-12-05 15:13:38,861] Trial 34 finished with value: 0.02608895373534607 and parameters: {'model_type': 'mlp', 'hidden_dims': '[256, 128, 64]', 'dropout': 0.14413551044688203, 'batch_norm': True, 'lr': 2.7680901419351257e-05, 'weight_decay': 1.0423535627789235e-06, 'epochs': 207, 'loss': 'mae', 'optimizer': 'adam', 'graph_mode': 'off', 'use_snp_selection': False}. Best is trial 6 with value: 0.05581165956313753.
[I 2025-12-05 15:13:39,941] Trial 35 finished with value: 0.021370002318640502 and parameters: {'model_type': 'mlp', 'hidden_dims': '[256, 128]', 'dropout': 0.2373006715639584, 'batch_norm': True, 'lr': 7.131748998580542e-05, 'weight_decay': 1.7479081285587815e-05, 'epochs': 227, 'loss': 'mse', 'optimizer': 'adam', 'graph_mode': 'off', 'use_snp_selection': False}. Best is trial 6 with value: 0.05581165956313753.
[I 2025-12-05 15:13:43,149] Trial 36 finished with value: 0.038056798289659736 and parameters: {'model_type': 'mlp', 'hidden_dims': '[512, 64]', 'dropout': 0.19860532406801262, 'batch_norm': True, 'lr': 1.912351856310804e-05, 'weight_decay': 2.1733902710035167e-06, 'epochs': 172, 'loss': 'mse', 'optimizer': 'adam', 'graph_mode': 'off', 'use_snp_selection': True, 'num_snps': 58661}. Best is trial 6 with value: 0.05581165956313753.
[I 2025-12-05 15:13:44,078] Trial 37 finished with value: 0.03277050065335398 and parameters: {'model_type': 'mlp', 'hidden_dims': '[256, 128, 64]', 'dropout': 0.27609300155595146, 'batch_norm': False, 'lr': 2.8529634323531924e-06, 'weight_decay': 5.66869481210647e-07, 'epochs': 127, 'loss': 'mae', 'optimizer': 'adam', 'graph_mode': 'off', 'use_snp_selection': False}. Best is trial 6 with value: 0.05581165956313753.
[I 2025-12-05 15:13:45,593] Trial 38 finished with value: 0.05657093776911673 and parameters: {'model_type': 'mlp', 'hidden_dims': '[512, 128]', 'dropout': 0.12267838365095048, 'batch_norm': True, 'lr': 0.00025125532901802873, 'weight_decay': 1.3491643769738432e-05, 'epochs': 259, 'loss': 'mse', 'optimizer': 'adam', 'graph_mode': 'off', 'use_snp_selection': True, 'num_snps': 19911}. Best is trial 38 with value: 0.05657093776911673.
[I 2025-12-05 15:13:47,212] Trial 39 finished with value: 0.0628407588979989 and parameters: {'model_type': 'mlp', 'hidden_dims': '[512, 128]', 'dropout': 0.101087252051936, 'batch_norm': True, 'lr': 3.5159034904189456e-05, 'weight_decay': 0.00010059642429239423, 'epochs': 298, 'loss': 'mse', 'optimizer': 'adam', 'graph_mode': 'off', 'use_snp_selection': True, 'num_snps': 21018}. Best is trial 39 with value: 0.0628407588979989.
[I 2025-12-05 15:13:48,878] Trial 40 finished with value: 0.050848157934999916 and parameters: {'model_type': 'mlp', 'hidden_dims': '[512, 128]', 'dropout': 0.10642228368511826, 'batch_norm': False, 'lr': 0.00012105375780857583, 'weight_decay': 0.00013884369875704708, 'epochs': 336, 'loss': 'mae', 'optimizer': 'adam', 'graph_mode': 'off', 'use_snp_selection': True, 'num_snps': 20854}. Best is trial 39 with value: 0.0628407588979989.
[I 2025-12-05 15:13:50,536] Trial 41 finished with value: 0.049025602395309786 and parameters: {'model_type': 'mlp', 'hidden_dims': '[512, 128]', 'dropout': 0.1300131638887262, 'batch_norm': True, 'lr': 3.64671917396002e-05, 'weight_decay': 9.133879265724599e-05, 'epochs': 298, 'loss': 'mse', 'optimizer': 'adam', 'graph_mode': 'off', 'use_snp_selection': True, 'num_snps': 21719}. Best is trial 39 with value: 0.0628407588979989.
[I 2025-12-05 15:13:51,999] Trial 42 finished with value: 0.034241234681840226 and parameters: {'model_type': 'mlp', 'hidden_dims': '[512, 128]', 'dropout': 0.14176781391274826, 'batch_norm': True, 'lr': 6.588722983061458e-05, 'weight_decay': 0.0009097417778025095, 'epochs': 342, 'loss': 'mse', 'optimizer': 'adam', 'graph_mode': 'off', 'use_snp_selection': True, 'num_snps': 12442}. Best is trial 39 with value: 0.0628407588979989.
[I 2025-12-05 15:13:53,912] Trial 43 finished with value: 0.022484149639356625 and parameters: {'model_type': 'mlp', 'hidden_dims': '[512, 128]', 'dropout': 0.1797255266766254, 'batch_norm': True, 'lr': 1.7249145460301824e-05, 'weight_decay': 0.00036599743922822943, 'epochs': 258, 'loss': 'mse', 'optimizer': 'adam', 'graph_mode': 'off', 'use_snp_selection': True, 'num_snps': 25713}. Best is trial 39 with value: 0.0628407588979989.
[I 2025-12-05 15:13:56,668] Trial 44 finished with value: 0.030348323423760357 and parameters: {'model_type': 'mlp', 'hidden_dims': '[512, 128]', 'dropout': 0.12477847490797797, 'batch_norm': True, 'lr': 5.601411001648721e-06, 'weight_decay': 2.7076544772679234e-05, 'epochs': 306, 'loss': 'mse', 'optimizer': 'adam', 'graph_mode': 'off', 'use_snp_selection': True, 'num_snps': 41739}. Best is trial 39 with value: 0.0628407588979989.
[I 2025-12-05 15:13:57,997] Trial 45 finished with value: 0.04397841067364205 and parameters: {'model_type': 'mlp', 'hidden_dims': '[512, 128]', 'dropout': 0.10133718195868233, 'batch_norm': True, 'lr': 3.0378694208879183e-05, 'weight_decay': 1.2135054945155472e-05, 'epochs': 327, 'loss': 'mse', 'optimizer': 'adam', 'graph_mode': 'off', 'use_snp_selection': True, 'num_snps': 10837}. Best is trial 39 with value: 0.0628407588979989.
[I 2025-12-05 15:13:59,916] Trial 46 finished with value: 0.018313183397537996 and parameters: {'model_type': 'mlp', 'hidden_dims': '[512, 128]', 'dropout': 0.15371540638977219, 'batch_norm': False, 'lr': 1.2578673314720231e-05, 'weight_decay': 0.00023436853656734843, 'epochs': 264, 'loss': 'mse', 'optimizer': 'adam', 'graph_mode': 'off', 'use_snp_selection': True, 'num_snps': 28564}. Best is trial 39 with value: 0.0628407588979989.
[I 2025-12-05 15:14:00,917] Trial 47 finished with value: 0.053838518466103887 and parameters: {'model_type': 'mlp', 'hidden_dims': '[512, 256]', 'dropout': 0.222130465551289, 'batch_norm': True, 'lr': 8.446219278525685e-05, 'weight_decay': 3.360352351982499e-05, 'epochs': 193, 'loss': 'mse', 'optimizer': 'adam', 'graph_mode': 'off', 'use_snp_selection': True, 'num_snps': 4717}. Best is trial 39 with value: 0.0628407588979989.
[I 2025-12-05 15:14:02,308] Trial 48 finished with value: 0.05396706337640416 and parameters: {'model_type': 'mlp', 'hidden_dims': '[256, 128]', 'dropout': 0.17884453992193639, 'batch_norm': True, 'lr': 0.00020188813371998203, 'weight_decay': 1.6069606546882905e-05, 'epochs': 215, 'loss': 'mse', 'optimizer': 'adam', 'graph_mode': 'off', 'use_snp_selection': True, 'num_snps': 16163}. Best is trial 39 with value: 0.0628407588979989.
[I 2025-12-05 15:14:03,481] Trial 49 finished with value: 0.026200966007232804 and parameters: {'model_type': 'mlp', 'hidden_dims': '[256, 128]', 'dropout': 0.3923350974403609, 'batch_norm': False, 'lr': 0.00025447121621861537, 'weight_decay': 1.6208974476709657e-05, 'epochs': 166, 'loss': 'mse', 'optimizer': 'adam', 'graph_mode': 'off', 'use_snp_selection': True, 'num_snps': 14782}. Best is trial 39 with value: 0.0628407588979989.
[I 2025-12-05 15:14:04,947] Trial 50 finished with value: 0.05273983986032369 and parameters: {'model_type': 'mlp', 'hidden_dims': '[256, 128]', 'dropout': 0.17639054347142155, 'batch_norm': True, 'lr': 0.000554520231843585, 'weight_decay': 7.18220408123769e-05, 'epochs': 282, 'loss': 'mse', 'optimizer': 'adam', 'graph_mode': 'off', 'use_snp_selection': True, 'num_snps': 18449}. Best is trial 39 with value: 0.0628407588979989.
[I 2025-12-05 15:14:06,597] Trial 51 finished with value: 0.04723744774730963 and parameters: {'model_type': 'mlp', 'hidden_dims': '[256, 128]', 'dropout': 0.13991663594146095, 'batch_norm': True, 'lr': 0.00018658044234898393, 'weight_decay': 7.315965777005812e-06, 'epochs': 214, 'loss': 'mse', 'optimizer': 'adam', 'graph_mode': 'off', 'use_snp_selection': True, 'num_snps': 27472}. Best is trial 39 with value: 0.0628407588979989.
[I 2025-12-05 15:14:07,678] Trial 52 finished with value: 0.05624598299549542 and parameters: {'model_type': 'mlp', 'hidden_dims': '[512, 64]', 'dropout': 0.11681247574207163, 'batch_norm': True, 'lr': 5.045768008336024e-05, 'weight_decay': 1.188042987829888e-05, 'epochs': 232, 'loss': 'mse', 'optimizer': 'adam', 'graph_mode': 'off', 'use_snp_selection': True, 'num_snps': 7193}. Best is trial 39 with value: 0.0628407588979989.
