[I 2025-12-05 16:28:44,498] Trial 40 finished with value: 0.047032920637200576 and parameters: {'model_type': 'mlp', 'hidden_dims': '[256, 128]', 'dropout': 0.5648800916603616, 'batch_norm': False, 'lr': 0.00036111150037595205, 'weight_decay': 0.00020950855317578338, 'epochs': 260, 'loss': 'mae', 'optimizer': 'adam', 'graph_mode': 'off', 'use_snp_selection': True, 'num_snps': 11558}. Best is trial 32 with value: 0.07082068485710658.
[I 2025-12-05 16:28:45,435] Trial 41 finished with value: 0.056715683331579565 and parameters: {'model_type': 'mlp', 'hidden_dims': '[256, 128]', 'dropout': 0.17373140673839715, 'batch_norm': True, 'lr': 0.0006091301050618954, 'weight_decay': 2.4826395231028182e-05, 'epochs': 158, 'loss': 'mse', 'optimizer': 'adam', 'graph_mode': 'off', 'use_snp_selection': False}. Best is trial 32 with value: 0.07082068485710658.
[I 2025-12-05 16:28:46,352] Trial 42 finished with value: 0.08000357482808548 and parameters: {'model_type': 'mlp', 'hidden_dims': '[256, 128]', 'dropout': 0.1023198454291514, 'batch_norm': True, 'lr': 0.0006701648121183019, 'weight_decay': 4.147024281537772e-05, 'epochs': 162, 'loss': 'mse', 'optimizer': 'adam', 'graph_mode': 'off', 'use_snp_selection': False}. Best is trial 42 with value: 0.08000357482808548.
[I 2025-12-05 16:28:47,271] Trial 43 finished with value: 0.06155362365467919 and parameters: {'model_type': 'mlp', 'hidden_dims': '[256, 128]', 'dropout': 0.17426565973727587, 'batch_norm': True, 'lr': 0.0007307213167498992, 'weight_decay': 1.3171848079652042e-05, 'epochs': 163, 'loss': 'mse', 'optimizer': 'adam', 'graph_mode': 'off', 'use_snp_selection': False}. Best is trial 42 with value: 0.08000357482808548.
[I 2025-12-05 16:28:48,228] Trial 44 finished with value: 0.043268274005281916 and parameters: {'model_type': 'mlp', 'hidden_dims': '[256, 128]', 'dropout': 0.1739009726752906, 'batch_norm': True, 'lr': 0.0008136939849421139, 'weight_decay': 1.1191475397500068e-05, 'epochs': 184, 'loss': 'mse', 'optimizer': 'adam', 'graph_mode': 'off', 'use_snp_selection': False}. Best is trial 42 with value: 0.08000357482808548.
[I 2025-12-05 16:28:49,139] Trial 45 finished with value: 0.0442901301943484 and parameters: {'model_type': 'mlp', 'hidden_dims': '[256, 128]', 'dropout': 0.13055326909624346, 'batch_norm': True, 'lr': 0.0004486984405944036, 'weight_decay': 2.7295945873319517e-05, 'epochs': 155, 'loss': 'mse', 'optimizer': 'adam', 'graph_mode': 'off', 'use_snp_selection': False}. Best is trial 42 with value: 0.08000357482808548.
[I 2025-12-05 16:28:50,103] Trial 46 finished with value: 0.030045267539584513 and parameters: {'model_type': 'mlp', 'hidden_dims': '[256, 128]', 'dropout': 0.21824531381227633, 'batch_norm': True, 'lr': 0.00023776532181678811, 'weight_decay': 1.8660617235988656e-05, 'epochs': 167, 'loss': 'mse', 'optimizer': 'adam', 'graph_mode': 'off', 'use_snp_selection': False}. Best is trial 42 with value: 0.08000357482808548.
[I 2025-12-05 16:28:51,157] Trial 47 finished with value: 0.04945078144888656 and parameters: {'model_type': 'mlp', 'hidden_dims': '[256, 128]', 'dropout': 0.10070714334568684, 'batch_norm': True, 'lr': 0.000982459303602546, 'weight_decay': 4.544681311449926e-06, 'epochs': 203, 'loss': 'mse', 'optimizer': 'adam', 'graph_mode': 'off', 'use_snp_selection': False}. Best is trial 42 with value: 0.08000357482808548.
[I 2025-12-05 16:28:52,122] Trial 48 finished with value: 0.054550246419134044 and parameters: {'model_type': 'mlp', 'hidden_dims': '[256, 128]', 'dropout': 0.17694569504208194, 'batch_norm': True, 'lr': 0.0004307038922802391, 'weight_decay': 3.756813418762209e-05, 'epochs': 156, 'loss': 'mae', 'optimizer': 'adam', 'graph_mode': 'off', 'use_snp_selection': False}. Best is trial 42 with value: 0.08000357482808548.
[I 2025-12-05 16:28:53,028] Trial 49 finished with value: 0.05148547942365003 and parameters: {'model_type': 'mlp', 'hidden_dims': '[256, 128]', 'dropout': 0.14156396168268365, 'batch_norm': True, 'lr': 0.00019832108889327292, 'weight_decay': 0.00010385311467012088, 'epochs': 125, 'loss': 'mse', 'optimizer': 'adam', 'graph_mode': 'off', 'use_snp_selection': False}. Best is trial 42 with value: 0.08000357482808548.
[I 2025-12-05 16:28:54,619] Trial 50 finished with value: 0.06261639334767476 and parameters: {'model_type': 'mlp', 'hidden_dims': '[512, 64]', 'dropout': 0.129296904341712, 'batch_norm': True, 'lr': 0.00027002043370540465, 'weight_decay': 2.2427430994216177e-05, 'epochs': 232, 'loss': 'mae', 'optimizer': 'adam', 'graph_mode': 'off', 'use_snp_selection': False}. Best is trial 42 with value: 0.08000357482808548.
[I 2025-12-05 16:28:56,217] Trial 51 finished with value: 0.051795113401093246 and parameters: {'model_type': 'mlp', 'hidden_dims': '[512, 64]', 'dropout': 0.12993080926781386, 'batch_norm': True, 'lr': 0.0006570664685293415, 'weight_decay': 2.0746664160178312e-05, 'epochs': 237, 'loss': 'mae', 'optimizer': 'adam', 'graph_mode': 'off', 'use_snp_selection': False}. Best is trial 42 with value: 0.08000357482808548.
[I 2025-12-05 16:28:57,623] Trial 52 finished with value: 0.035267037740792075 and parameters: {'model_type': 'mlp', 'hidden_dims': '[512, 64]', 'dropout': 0.16025201188120358, 'batch_norm': True, 'lr': 0.0004932242757339397, 'weight_decay': 1.176406785145457e-05, 'epochs': 193, 'loss': 'mae', 'optimizer': 'adam', 'graph_mode': 'off', 'use_snp_selection': False}. Best is trial 42 with value: 0.08000357482808548.
[I 2025-12-05 16:28:59,427] Trial 53 finished with value: 0.05493820314259988 and parameters: {'model_type': 'mlp', 'hidden_dims': '[512, 64]', 'dropout': 0.20532820225277515, 'batch_norm': True, 'lr': 0.0002555265613586503, 'weight_decay': 5.005983137545721e-05, 'epochs': 294, 'loss': 'mae', 'optimizer': 'adam', 'graph_mode': 'off', 'use_snp_selection': False}. Best is trial 42 with value: 0.08000357482808548.
[I 2025-12-05 16:29:01,354] Trial 54 finished with value: 0.039947499137924086 and parameters: {'model_type': 'mlp', 'hidden_dims': '[512, 64]', 'dropout': 0.2701272637619375, 'batch_norm': True, 'lr': 0.0007672192954753952, 'weight_decay': 2.7793383172973554e-05, 'epochs': 331, 'loss': 'mae', 'optimizer': 'adam', 'graph_mode': 'off', 'use_snp_selection': False}. Best is trial 42 with value: 0.08000357482808548.
[I 2025-12-05 16:29:03,017] Trial 55 finished with value: 0.029324513288693017 and parameters: {'model_type': 'mlp', 'hidden_dims': '[512, 128]', 'dropout': 0.1242807705410467, 'batch_norm': True, 'lr': 0.00027882194267162566, 'weight_decay': 1.6185264382401898e-05, 'epochs': 262, 'loss': 'mae', 'optimizer': 'adam', 'graph_mode': 'off', 'use_snp_selection': False}. Best is trial 42 with value: 0.08000357482808548.
[I 2025-12-05 16:29:04,532] Trial 56 finished with value: 0.014950715678326624 and parameters: {'model_type': 'mlp', 'hidden_dims': '[512, 64]', 'dropout': 0.100006014811654, 'batch_norm': True, 'lr': 0.00018186067634717783, 'weight_decay': 8.34844224967642e-06, 'epochs': 226, 'loss': 'mse', 'optimizer': 'adam', 'graph_mode': 'off', 'use_snp_selection': False}. Best is trial 42 with value: 0.08000357482808548.
[I 2025-12-05 16:29:05,772] Trial 57 finished with value: 0.04633031176434405 and parameters: {'model_type': 'mlp', 'hidden_dims': '[256, 128]', 'dropout': 0.1669163414033477, 'batch_norm': True, 'lr': 0.0009852519164038286, 'weight_decay': 9.795629921357756e-05, 'epochs': 308, 'loss': 'mae', 'optimizer': 'adam', 'graph_mode': 'off', 'use_snp_selection': False}. Best is trial 42 with value: 0.08000357482808548.
[I 2025-12-05 16:29:06,614] Trial 58 finished with value: 0.027248072339794285 and parameters: {'model_type': 'mlp', 'hidden_dims': '[128, 64]', 'dropout': 0.15011500810058964, 'batch_norm': True, 'lr': 0.0003047437481360536, 'weight_decay': 3.035647493788434e-06, 'epochs': 164, 'loss': 'mse', 'optimizer': 'adam', 'graph_mode': 'off', 'use_snp_selection': False}. Best is trial 42 with value: 0.08000357482808548.
[I 2025-12-05 16:29:07,548] Trial 59 finished with value: 0.05602167037711789 and parameters: {'model_type': 'mlp', 'hidden_dims': '[256, 128]', 'dropout': 0.46289320779611204, 'batch_norm': True, 'lr': 0.0004315852234746944, 'weight_decay': 2.2931170572250553e-05, 'epochs': 141, 'loss': 'mse', 'optimizer': 'adam', 'graph_mode': 'off', 'use_snp_selection': False}. Best is trial 42 with value: 0.08000357482808548.
[I 2025-12-05 16:29:09,518] Trial 60 finished with value: 0.042930164992153796 and parameters: {'model_type': 'mlp', 'hidden_dims': '[512, 64]', 'dropout': 0.5171376896265161, 'batch_norm': True, 'lr': 0.0005852091488268796, 'weight_decay': 3.921233616781895e-05, 'epochs': 339, 'loss': 'mae', 'optimizer': 'adam', 'graph_mode': 'off', 'use_snp_selection': False}. Best is trial 42 with value: 0.08000357482808548.
[I 2025-12-05 16:29:10,425] Trial 61 finished with value: 0.018700798526511637 and parameters: {'model_type': 'mlp', 'hidden_dims': '[256, 128]', 'dropout': 0.45956656797985673, 'batch_norm': True, 'lr': 0.0004247339033981373, 'weight_decay': 2.430985597035415e-05, 'epochs': 137, 'loss': 'mse', 'optimizer': 'adam', 'graph_mode': 'off', 'use_snp_selection': False}. Best is trial 42 with value: 0.08000357482808548.
[I 2025-12-05 16:29:11,416] Trial 62 finished with value: 0.0434638858628468 and parameters: {'model_type': 'mlp', 'hidden_dims': '[256, 128]', 'dropout': 0.3622878864148455, 'batch_norm': True, 'lr': 0.0007764533070197636, 'weight_decay': 1.263702329901218e-05, 'epochs': 184, 'loss': 'mse', 'optimizer': 'adam', 'graph_mode': 'off', 'use_snp_selection': False}. Best is trial 42 with value: 0.08000357482808548.
[I 2025-12-05 16:29:12,342] Trial 63 finished with value: 0.016037029906802842 and parameters: {'model_type': 'mlp', 'hidden_dims': '[256, 128]', 'dropout': 0.5962821946899065, 'batch_norm': True, 'lr': 0.0005051354797142058, 'weight_decay': 1.4418664137187231e-05, 'epochs': 137, 'loss': 'mse', 'optimizer': 'adam', 'graph_mode': 'off', 'use_snp_selection': False}. Best is trial 42 with value: 0.08000357482808548.
[I 2025-12-05 16:29:13,303] Trial 64 finished with value: 6.53514264780548e-05 and parameters: {'model_type': 'mlp', 'hidden_dims': '[256, 128]', 'dropout': 0.5729454458822876, 'batch_norm': False, 'lr': 0.00013587994078488328, 'weight_decay': 3.3591731835876775e-05, 'epochs': 158, 'loss': 'mse', 'optimizer': 'adam', 'graph_mode': 'off', 'use_snp_selection': False}. Best is trial 42 with value: 0.08000357482808548.
[I 2025-12-05 16:29:14,477] Trial 65 finished with value: 0.036154363096672214 and parameters: {'model_type': 'mlp', 'hidden_dims': '[512, 128]', 'dropout': 0.4695765633180818, 'batch_norm': True, 'lr': 0.0003607619465814275, 'weight_decay': 9.249018810561213e-06, 'epochs': 117, 'loss': 'mse', 'optimizer': 'adam', 'graph_mode': 'off', 'use_snp_selection': False}. Best is trial 42 with value: 0.08000357482808548.
[I 2025-12-05 16:29:15,468] Trial 66 finished with value: 0.049084686795860616 and parameters: {'model_type': 'mlp', 'hidden_dims': '[256, 128]', 'dropout': 0.18414163876648965, 'batch_norm': True, 'lr': 0.0007769640967710162, 'weight_decay': 6.073585666552224e-06, 'epochs': 179, 'loss': 'mse', 'optimizer': 'adam', 'graph_mode': 'off', 'use_snp_selection': False}. Best is trial 42 with value: 0.08000357482808548.
[I 2025-12-05 16:29:16,393] Trial 67 finished with value: 0.015648801175445065 and parameters: {'model_type': 'mlp', 'hidden_dims': '[256, 128, 64]', 'dropout': 0.40482081966856204, 'batch_norm': False, 'lr': 5.460625538232114e-06, 'weight_decay': 6.305435215512656e-05, 'epochs': 149, 'loss': 'mse', 'optimizer': 'adam', 'graph_mode': 'off', 'use_snp_selection': False}. Best is trial 42 with value: 0.08000357482808548.
[I 2025-12-05 16:29:18,140] Trial 68 finished with value: 0.06266447359671533 and parameters: {'model_type': 'mlp', 'hidden_dims': '[512, 64]', 'dropout': 0.13971597774899666, 'batch_norm': True, 'lr': 0.0006455376347716197, 'weight_decay': 4.8250565679312515e-05, 'epochs': 291, 'loss': 'mae', 'optimizer': 'adam', 'graph_mode': 'off', 'use_snp_selection': False}. Best is trial 42 with value: 0.08000357482808548.
[I 2025-12-05 16:29:20,025] Trial 69 finished with value: 0.06322662226254988 and parameters: {'model_type': 'mlp', 'hidden_dims': '[512, 64]', 'dropout': 0.14722170727660222, 'batch_norm': True, 'lr': 0.0006524653550631741, 'weight_decay': 8.712853330208981e-05, 'epochs': 317, 'loss': 'mae', 'optimizer': 'adam', 'graph_mode': 'off', 'use_snp_selection': False}. Best is trial 42 with value: 0.08000357482808548.
[I 2025-12-05 16:29:21,884] Trial 70 finished with value: 0.016519715490150296 and parameters: {'model_type': 'mlp', 'hidden_dims': '[512, 64]', 'dropout': 0.2022597882486376, 'batch_norm': False, 'lr': 4.595946425780552e-05, 'weight_decay': 8.758846588550569e-05, 'epochs': 316, 'loss': 'mae', 'optimizer': 'adam', 'graph_mode': 'off', 'use_snp_selection': False}. Best is trial 42 with value: 0.08000357482808548.
[I 2025-12-05 16:29:23,703] Trial 71 finished with value: 0.053837929716435654 and parameters: {'model_type': 'mlp', 'hidden_dims': '[512, 64]', 'dropout': 0.142136572022287, 'batch_norm': True, 'lr': 0.0007118443323527395, 'weight_decay': 5.113482819765447e-05, 'epochs': 296, 'loss': 'mae', 'optimizer': 'adam', 'graph_mode': 'off', 'use_snp_selection': False}. Best is trial 42 with value: 0.08000357482808548.
[I 2025-12-05 16:29:25,461] Trial 72 finished with value: 0.04194628157285536 and parameters: {'model_type': 'mlp', 'hidden_dims': '[512, 64]', 'dropout': 0.12407597400067559, 'batch_norm': True, 'lr': 0.0009147915595483, 'weight_decay': 0.00015595069465891407, 'epochs': 284, 'loss': 'mae', 'optimizer': 'adam', 'graph_mode': 'off', 'use_snp_selection': False}. Best is trial 42 with value: 0.08000357482808548.
[I 2025-12-05 16:29:27,191] Trial 73 finished with value: 0.04895876375947877 and parameters: {'model_type': 'mlp', 'hidden_dims': '[512, 64]', 'dropout': 0.14841122474162316, 'batch_norm': True, 'lr': 0.0005952153982736417, 'weight_decay': 3.923527754506679e-05, 'epochs': 270, 'loss': 'mae', 'optimizer': 'adam', 'graph_mode': 'off', 'use_snp_selection': False}. Best is trial 42 with value: 0.08000357482808548.
[I 2025-12-05 16:29:29,163] Trial 74 finished with value: 0.03746182141955634 and parameters: {'model_type': 'mlp', 'hidden_dims': '[512, 64]', 'dropout': 0.11189230686895807, 'batch_norm': True, 'lr': 0.0006506864936269151, 'weight_decay': 3.243548362142879e-05, 'epochs': 339, 'loss': 'mae', 'optimizer': 'adam', 'graph_mode': 'off', 'use_snp_selection': False}. Best is trial 42 with value: 0.08000357482808548.
[I 2025-12-05 16:29:30,993] Trial 75 finished with value: 0.0706774350081093 and parameters: {'model_type': 'mlp', 'hidden_dims': '[512, 64]', 'dropout': 0.16853713052756425, 'batch_norm': True, 'lr': 0.0002971583803434087, 'weight_decay': 7.80122101630507e-05, 'epochs': 305, 'loss': 'mae', 'optimizer': 'adam', 'graph_mode': 'off', 'use_snp_selection': False}. Best is trial 42 with value: 0.08000357482808548.
[I 2025-12-05 16:29:32,863] Trial 76 finished with value: 0.04031178954897523 and parameters: {'model_type': 'mlp', 'hidden_dims': '[512, 64]', 'dropout': 0.11841990581553026, 'batch_norm': True, 'lr': 0.00020774308254059784, 'weight_decay': 7.563510378142856e-05, 'epochs': 324, 'loss': 'mae', 'optimizer': 'adam', 'graph_mode': 'off', 'use_snp_selection': False}. Best is trial 42 with value: 0.08000357482808548.
[I 2025-12-05 16:29:34,682] Trial 77 finished with value: 0.06521291100608494 and parameters: {'model_type': 'mlp', 'hidden_dims': '[512, 64]', 'dropout': 0.23463054929586105, 'batch_norm': True, 'lr': 0.00033299565421213037, 'weight_decay': 0.00018833636984308836, 'epochs': 312, 'loss': 'mae', 'optimizer': 'adam', 'graph_mode': 'off', 'use_snp_selection': False}. Best is trial 42 with value: 0.08000357482808548.
[I 2025-12-05 16:29:37,882] Trial 78 finished with value: 0.046464455123768095 and parameters: {'model_type': 'mlp', 'hidden_dims': '[512, 64]', 'dropout': 0.3232943391280382, 'batch_norm': False, 'lr': 0.0003129764849716872, 'weight_decay': 0.00018702363194673079, 'epochs': 300, 'loss': 'mae', 'optimizer': 'adam', 'graph_mode': 'off', 'use_snp_selection': True, 'num_snps': 58308}. Best is trial 42 with value: 0.08000357482808548.
[I 2025-12-05 16:29:39,789] Trial 79 finished with value: 0.060103873946883574 and parameters: {'model_type': 'mlp', 'hidden_dims': '[512, 64]', 'dropout': 0.13677278247080027, 'batch_norm': True, 'lr': 8.767584475601409e-05, 'weight_decay': 0.0002991565731228322, 'epochs': 316, 'loss': 'mae', 'optimizer': 'adam', 'graph_mode': 'off', 'use_snp_selection': False}. Best is trial 42 with value: 0.08000357482808548.
[I 2025-12-05 16:29:41,665] Trial 80 finished with value: 0.04711692729184496 and parameters: {'model_type': 'mlp', 'hidden_dims': '[512, 64]', 'dropout': 0.15480845429647325, 'batch_norm': True, 'lr': 0.0001616082382755638, 'weight_decay': 0.00013497835827240982, 'epochs': 306, 'loss': 'mae', 'optimizer': 'adam', 'graph_mode': 'off', 'use_snp_selection': False}. Best is trial 42 with value: 0.08000357482808548.
[I 2025-12-05 16:29:43,482] Trial 81 finished with value: 0.06455876233326124 and parameters: {'model_type': 'mlp', 'hidden_dims': '[512, 64]', 'dropout': 0.24024389239994637, 'batch_norm': True, 'lr': 0.00040180460007415347, 'weight_decay': 6.052339568301085e-05, 'epochs': 291, 'loss': 'mae', 'optimizer': 'adam', 'graph_mode': 'off', 'use_snp_selection': False}. Best is trial 42 with value: 0.08000357482808548.
[I 2025-12-05 16:29:45,274] Trial 82 finished with value: 0.051608505875268766 and parameters: {'model_type': 'mlp', 'hidden_dims': '[512, 64]', 'dropout': 0.28794132542601636, 'batch_norm': True, 'lr': 0.00038960130351757555, 'weight_decay': 0.0002261088429185901, 'epochs': 290, 'loss': 'mae', 'optimizer': 'adam', 'graph_mode': 'off', 'use_snp_selection': False}. Best is trial 42 with value: 0.08000357482808548.
[I 2025-12-05 16:29:46,959] Trial 83 finished with value: 0.04124560013866791 and parameters: {'model_type': 'mlp', 'hidden_dims': '[512, 64]', 'dropout': 0.24272075691775769, 'batch_norm': True, 'lr': 0.0005014090825279004, 'weight_decay': 0.00010770252253100851, 'epochs': 269, 'loss': 'mae', 'optimizer': 'adam', 'graph_mode': 'off', 'use_snp_selection': False}. Best is trial 42 with value: 0.08000357482808548.
[I 2025-12-05 16:29:48,686] Trial 84 finished with value: -0.021528601949327753 and parameters: {'model_type': 'mlp', 'hidden_dims': '[512, 64]', 'dropout': 0.21410990488002696, 'batch_norm': True, 'lr': 7.497021407990154e-06, 'weight_decay': 4.5521609907767e-05, 'epochs': 282, 'loss': 'mae', 'optimizer': 'adam', 'graph_mode': 'off', 'use_snp_selection': False}. Best is trial 42 with value: 0.08000357482808548.
[I 2025-12-05 16:29:50,627] Trial 85 finished with value: 0.046898058862880725 and parameters: {'model_type': 'mlp', 'hidden_dims': '[512, 64]', 'dropout': 0.2795117738028272, 'batch_norm': True, 'lr': 0.0002741637972574741, 'weight_decay': 5.97198539887929e-05, 'epochs': 330, 'loss': 'mae', 'optimizer': 'adam', 'graph_mode': 'off', 'use_snp_selection': False}. Best is trial 42 with value: 0.08000357482808548.
[I 2025-12-05 16:29:52,279] Trial 86 finished with value: 0.035490987347270894 and parameters: {'model_type': 'mlp', 'hidden_dims': '[512, 64]', 'dropout': 0.23409355069984844, 'batch_norm': True, 'lr': 0.00022927485669080265, 'weight_decay': 0.0004904802476637524, 'epochs': 246, 'loss': 'mae', 'optimizer': 'adam', 'graph_mode': 'off', 'use_snp_selection': False}. Best is trial 42 with value: 0.08000357482808548.
[I 2025-12-05 16:29:53,222] Trial 87 finished with value: 0.001344605676653122 and parameters: {'model_type': 'mlp', 'hidden_dims': '[128, 64]', 'dropout': 0.132575128332249, 'batch_norm': False, 'lr': 0.00032150490372483885, 'weight_decay': 8.017455003274413e-05, 'epochs': 301, 'loss': 'mae', 'optimizer': 'adam', 'graph_mode': 'off', 'use_snp_selection': False}. Best is trial 42 with value: 0.08000357482808548.
[I 2025-12-05 16:29:55,116] Trial 88 finished with value: 0.04704794112621477 and parameters: {'model_type': 'mlp', 'hidden_dims': '[512, 128]', 'dropout': 0.18783264335810684, 'batch_norm': True, 'lr': 0.00044078826649796227, 'weight_decay': 0.00014862246433030663, 'epochs': 319, 'loss': 'mae', 'optimizer': 'adam', 'graph_mode': 'off', 'use_snp_selection': False}. Best is trial 42 with value: 0.08000357482808548.
[I 2025-12-05 16:29:58,150] Trial 89 finished with value: 0.05101210211735632 and parameters: {'model_type': 'mlp', 'hidden_dims': '[512, 64]', 'dropout': 0.2640838968503789, 'batch_norm': True, 'lr': 0.0005386196715880726, 'weight_decay': 6.681978332546605e-05, 'epochs': 311, 'loss': 'mae', 'optimizer': 'adam', 'graph_mode': 'off', 'use_snp_selection': True, 'num_snps': 50027}. Best is trial 42 with value: 0.08000357482808548.
[I 2025-12-05 16:29:59,947] Trial 90 finished with value: 0.03636421484275565 and parameters: {'model_type': 'mlp', 'hidden_dims': '[512, 256]', 'dropout': 0.10505872785520527, 'batch_norm': True, 'lr': 3.0139076719111286e-05, 'weight_decay': 0.00011225622749667948, 'epochs': 289, 'loss': 'mae', 'optimizer': 'adam', 'graph_mode': 'off', 'use_snp_selection': False}. Best is trial 42 with value: 0.08000357482808548.
[I 2025-12-05 16:30:01,955] Trial 91 finished with value: 0.03144709233016946 and parameters: {'model_type': 'mlp', 'hidden_dims': '[512, 64]', 'dropout': 0.1671922352793619, 'batch_norm': True, 'lr': 0.0008331731053522718, 'weight_decay': 2.0581345585405695e-05, 'epochs': 345, 'loss': 'mae', 'optimizer': 'adam', 'graph_mode': 'off', 'use_snp_selection': False}. Best is trial 42 with value: 0.08000357482808548.
