[I 2025-12-05 15:21:55,509] Trial 112 finished with value: 0.08823661754421011 and parameters: {'model_type': 'mlp', 'hidden_dims': '[128, 64]', 'dropout': 0.1835483223849163, 'batch_norm': False, 'lr': 4.368688821277279e-05, 'weight_decay': 3.609926010650869e-05, 'epochs': 272, 'loss': 'mae', 'optimizer': 'adam', 'graph_mode': 'off', 'use_snp_selection': False}. Best is trial 76 with value: 0.13137043957553401.
[I 2025-12-05 15:21:56,559] Trial 113 finished with value: 0.09127692463724116 and parameters: {'model_type': 'mlp', 'hidden_dims': '[128, 64]', 'dropout': 0.1330434605499293, 'batch_norm': False, 'lr': 2.1109072555114322e-05, 'weight_decay': 1.2960798264384071e-05, 'epochs': 261, 'loss': 'mae', 'optimizer': 'adam', 'graph_mode': 'off', 'use_snp_selection': False}. Best is trial 76 with value: 0.13137043957553401.
[I 2025-12-05 15:21:57,602] Trial 114 finished with value: 0.07431952216752542 and parameters: {'model_type': 'mlp', 'hidden_dims': '[128, 64]', 'dropout': 0.16696293935345335, 'batch_norm': False, 'lr': 3.429132153097914e-05, 'weight_decay': 6.671018026926886e-06, 'epochs': 251, 'loss': 'mae', 'optimizer': 'adam', 'graph_mode': 'off', 'use_snp_selection': False}. Best is trial 76 with value: 0.13137043957553401.
[I 2025-12-05 15:21:58,704] Trial 115 finished with value: 0.09279695448373393 and parameters: {'model_type': 'mlp', 'hidden_dims': '[128, 64]', 'dropout': 0.15257793779181877, 'batch_norm': False, 'lr': 3.7289245360852155e-05, 'weight_decay': 1.4411448284247694e-05, 'epochs': 265, 'loss': 'mae', 'optimizer': 'adam', 'graph_mode': 'off', 'use_snp_selection': False}. Best is trial 76 with value: 0.13137043957553401.
[I 2025-12-05 15:21:59,936] Trial 116 finished with value: 0.09277643644094315 and parameters: {'model_type': 'mlp', 'hidden_dims': '[128, 64]', 'dropout': 0.14363705483891767, 'batch_norm': False, 'lr': 2.7311174348646936e-05, 'weight_decay': 1.936440350674538e-05, 'epochs': 336, 'loss': 'mae', 'optimizer': 'adam', 'graph_mode': 'off', 'use_snp_selection': False}. Best is trial 76 with value: 0.13137043957553401.
[I 2025-12-05 15:22:00,984] Trial 117 finished with value: 0.10443533560695982 and parameters: {'model_type': 'mlp', 'hidden_dims': '[128, 64]', 'dropout': 0.204215316021438, 'batch_norm': False, 'lr': 5.068901589258678e-05, 'weight_decay': 5.159439474837599e-06, 'epochs': 246, 'loss': 'mae', 'optimizer': 'adam', 'graph_mode': 'off', 'use_snp_selection': False}. Best is trial 76 with value: 0.13137043957553401.
[I 2025-12-05 15:22:02,128] Trial 118 finished with value: 0.09590119924874065 and parameters: {'model_type': 'mlp', 'hidden_dims': '[128, 64]', 'dropout': 0.18820408234025357, 'batch_norm': False, 'lr': 2.978180605979622e-06, 'weight_decay': 4.261121886890258e-06, 'epochs': 292, 'loss': 'mae', 'optimizer': 'adam', 'graph_mode': 'off', 'use_snp_selection': False}. Best is trial 76 with value: 0.13137043957553401.
[I 2025-12-05 15:22:03,177] Trial 119 finished with value: 0.07777506701535584 and parameters: {'model_type': 'mlp', 'hidden_dims': '[128, 64]', 'dropout': 0.20408533931552186, 'batch_norm': False, 'lr': 5.073827690695263e-05, 'weight_decay': 2.5584967141983847e-06, 'epochs': 243, 'loss': 'mae', 'optimizer': 'adam', 'graph_mode': 'off', 'use_snp_selection': False}. Best is trial 76 with value: 0.13137043957553401.
[I 2025-12-05 15:22:04,287] Trial 120 finished with value: 0.12683778561337572 and parameters: {'model_type': 'mlp', 'hidden_dims': '[128, 64]', 'dropout': 0.17480539135306006, 'batch_norm': False, 'lr': 5.8835812187857084e-05, 'weight_decay': 4.8875348089383425e-06, 'epochs': 275, 'loss': 'mae', 'optimizer': 'adam', 'graph_mode': 'off', 'use_snp_selection': False}. Best is trial 76 with value: 0.13137043957553401.
[I 2025-12-05 15:22:05,378] Trial 121 finished with value: 0.09821979750249878 and parameters: {'model_type': 'mlp', 'hidden_dims': '[128, 64]', 'dropout': 0.17447383498379607, 'batch_norm': False, 'lr': 5.9558106143972255e-05, 'weight_decay': 5.125912771072353e-06, 'epochs': 282, 'loss': 'mae', 'optimizer': 'adam', 'graph_mode': 'off', 'use_snp_selection': False}. Best is trial 76 with value: 0.13137043957553401.
[I 2025-12-05 15:22:06,449] Trial 122 finished with value: 0.08953897020434022 and parameters: {'model_type': 'mlp', 'hidden_dims': '[128, 64]', 'dropout': 0.12526156891651, 'batch_norm': False, 'lr': 8.380689138387148e-05, 'weight_decay': 3.5178608088378286e-06, 'epochs': 272, 'loss': 'mae', 'optimizer': 'adam', 'graph_mode': 'off', 'use_snp_selection': False}. Best is trial 76 with value: 0.13137043957553401.
[I 2025-12-05 15:22:07,469] Trial 123 finished with value: 0.09841422187263346 and parameters: {'model_type': 'mlp', 'hidden_dims': '[128, 64]', 'dropout': 0.23055670857434105, 'batch_norm': False, 'lr': 4.519218661316135e-05, 'weight_decay': 9.20292374532072e-06, 'epochs': 244, 'loss': 'mae', 'optimizer': 'adam', 'graph_mode': 'off', 'use_snp_selection': False}. Best is trial 76 with value: 0.13137043957553401.
[I 2025-12-05 15:22:09,994] Trial 124 finished with value: 0.08046411312155971 and parameters: {'model_type': 'mlp', 'hidden_dims': '[512, 64]', 'dropout': 0.21370689576261898, 'batch_norm': False, 'lr': 5.468283292332842e-05, 'weight_decay': 5.82981496962147e-06, 'epochs': 238, 'loss': 'mae', 'optimizer': 'adam', 'graph_mode': 'off', 'use_snp_selection': False}. Best is trial 76 with value: 0.13137043957553401.
[I 2025-12-05 15:22:11,048] Trial 125 finished with value: 0.10254139342145518 and parameters: {'model_type': 'mlp', 'hidden_dims': '[128, 64]', 'dropout': 0.2500312053266128, 'batch_norm': False, 'lr': 3.219881240231584e-05, 'weight_decay': 7.054867196163568e-06, 'epochs': 264, 'loss': 'mae', 'optimizer': 'adam', 'graph_mode': 'off', 'use_snp_selection': False}. Best is trial 76 with value: 0.13137043957553401.
[I 2025-12-05 15:22:12,209] Trial 126 finished with value: 0.09513187033328141 and parameters: {'model_type': 'mlp', 'hidden_dims': '[128, 64]', 'dropout': 0.15759026376960691, 'batch_norm': False, 'lr': 1.7582758320114167e-05, 'weight_decay': 3.0203775976444865e-06, 'epochs': 302, 'loss': 'mae', 'optimizer': 'adam', 'graph_mode': 'off', 'use_snp_selection': False}. Best is trial 76 with value: 0.13137043957553401.
[I 2025-12-05 15:22:13,289] Trial 127 finished with value: 0.10382883968235426 and parameters: {'model_type': 'mlp', 'hidden_dims': '[128, 64]', 'dropout': 0.1920024374710837, 'batch_norm': False, 'lr': 4.172490364618496e-05, 'weight_decay': 4.2821148682138066e-06, 'epochs': 252, 'loss': 'mae', 'optimizer': 'adam', 'graph_mode': 'off', 'use_snp_selection': False}. Best is trial 76 with value: 0.13137043957553401.
[I 2025-12-05 15:22:14,416] Trial 128 finished with value: 0.09264037838245645 and parameters: {'model_type': 'mlp', 'hidden_dims': '[128, 64]', 'dropout': 0.18284567518588107, 'batch_norm': False, 'lr': 2.2301168399533954e-05, 'weight_decay': 8.672884152947976e-06, 'epochs': 278, 'loss': 'mae', 'optimizer': 'adam', 'graph_mode': 'off', 'use_snp_selection': False}. Best is trial 76 with value: 0.13137043957553401.
[I 2025-12-05 15:22:16,105] Trial 129 finished with value: 0.08885740536706249 and parameters: {'model_type': 'mlp', 'hidden_dims': '[256, 128]', 'dropout': 0.17533567441223463, 'batch_norm': False, 'lr': 7.89376006881638e-05, 'weight_decay': 1.0907869339638554e-05, 'epochs': 291, 'loss': 'mae', 'optimizer': 'adam', 'graph_mode': 'off', 'use_snp_selection': False}. Best is trial 76 with value: 0.13137043957553401.
[I 2025-12-05 15:22:18,562] Trial 130 finished with value: 0.12495756795748715 and parameters: {'model_type': 'mlp', 'hidden_dims': '[512, 256]', 'dropout': 0.1633774696189807, 'batch_norm': False, 'lr': 2.662438047956356e-05, 'weight_decay': 5.797753631491677e-06, 'epochs': 231, 'loss': 'mae', 'optimizer': 'adam', 'graph_mode': 'off', 'use_snp_selection': False}. Best is trial 76 with value: 0.13137043957553401.
[I 2025-12-05 15:22:21,016] Trial 131 finished with value: 0.10040421739124818 and parameters: {'model_type': 'mlp', 'hidden_dims': '[512, 256]', 'dropout': 0.14035145746948846, 'batch_norm': False, 'lr': 3.100404256269477e-05, 'weight_decay': 5.2106415195011835e-06, 'epochs': 227, 'loss': 'mae', 'optimizer': 'adam', 'graph_mode': 'off', 'use_snp_selection': False}. Best is trial 76 with value: 0.13137043957553401.
[I 2025-12-05 15:22:23,749] Trial 132 finished with value: 0.09483699086094549 and parameters: {'model_type': 'mlp', 'hidden_dims': '[512, 256]', 'dropout': 0.16614548819691985, 'batch_norm': False, 'lr': 2.655306494084863e-05, 'weight_decay': 7.580525464519066e-06, 'epochs': 269, 'loss': 'mae', 'optimizer': 'adam', 'graph_mode': 'off', 'use_snp_selection': False}. Best is trial 76 with value: 0.13137043957553401.
[I 2025-12-05 15:22:26,251] Trial 133 finished with value: 0.11451182587631387 and parameters: {'model_type': 'mlp', 'hidden_dims': '[512, 256]', 'dropout': 0.14935402053872962, 'batch_norm': False, 'lr': 4.898997714580627e-05, 'weight_decay': 3.909484743067681e-06, 'epochs': 232, 'loss': 'mae', 'optimizer': 'adam', 'graph_mode': 'off', 'use_snp_selection': False}. Best is trial 76 with value: 0.13137043957553401.
[I 2025-12-05 15:22:28,744] Trial 134 finished with value: 0.10847150417127785 and parameters: {'model_type': 'mlp', 'hidden_dims': '[512, 256]', 'dropout': 0.14809168670429773, 'batch_norm': False, 'lr': 3.9943571673571505e-05, 'weight_decay': 2.46107846137467e-06, 'epochs': 232, 'loss': 'mae', 'optimizer': 'adam', 'graph_mode': 'off', 'use_snp_selection': False}. Best is trial 76 with value: 0.13137043957553401.
[I 2025-12-05 15:22:31,076] Trial 135 finished with value: 0.09973796074235834 and parameters: {'model_type': 'mlp', 'hidden_dims': '[512, 256]', 'dropout': 0.14401393960249045, 'batch_norm': False, 'lr': 1.4464294346216711e-05, 'weight_decay': 2.274086906598192e-06, 'epochs': 211, 'loss': 'mae', 'optimizer': 'adam', 'graph_mode': 'off', 'use_snp_selection': False}. Best is trial 76 with value: 0.13137043957553401.
[I 2025-12-05 15:22:34,036] Trial 136 finished with value: 0.08725321172792166 and parameters: {'model_type': 'mlp', 'hidden_dims': '[512, 256]', 'dropout': 0.12470970647933335, 'batch_norm': False, 'lr': 5.9221867783564897e-05, 'weight_decay': 1.2189068477979563e-06, 'epochs': 221, 'loss': 'mae', 'optimizer': 'adam', 'graph_mode': 'off', 'use_snp_selection': True, 'num_snps': 38577}. Best is trial 76 with value: 0.13137043957553401.
[I 2025-12-05 15:22:36,530] Trial 137 finished with value: 0.10594885949329637 and parameters: {'model_type': 'mlp', 'hidden_dims': '[512, 256]', 'dropout': 0.11337911640753434, 'batch_norm': False, 'lr': 4.767885042788531e-05, 'weight_decay': 1.933864475611497e-06, 'epochs': 236, 'loss': 'mae', 'optimizer': 'adam', 'graph_mode': 'off', 'use_snp_selection': False}. Best is trial 76 with value: 0.13137043957553401.
[I 2025-12-05 15:22:38,972] Trial 138 finished with value: 0.10655285420961536 and parameters: {'model_type': 'mlp', 'hidden_dims': '[512, 256]', 'dropout': 0.15252707396194698, 'batch_norm': False, 'lr': 4.5207061923302446e-05, 'weight_decay': 2.048713010190061e-06, 'epochs': 229, 'loss': 'mae', 'optimizer': 'adam', 'graph_mode': 'off', 'use_snp_selection': False}. Best is trial 76 with value: 0.13137043957553401.
[I 2025-12-05 15:22:41,482] Trial 139 finished with value: 0.10527114508829999 and parameters: {'model_type': 'mlp', 'hidden_dims': '[512, 256]', 'dropout': 0.15075624689052694, 'batch_norm': False, 'lr': 4.0253863134177984e-05, 'weight_decay': 2.5669867638178536e-06, 'epochs': 231, 'loss': 'mae', 'optimizer': 'adam', 'graph_mode': 'off', 'use_snp_selection': False}. Best is trial 76 with value: 0.13137043957553401.
[I 2025-12-05 15:22:43,781] Trial 140 finished with value: 0.10846537314213858 and parameters: {'model_type': 'mlp', 'hidden_dims': '[512, 256]', 'dropout': 0.1343730713578456, 'batch_norm': False, 'lr': 6.994638844404907e-05, 'weight_decay': 3.8618807091379466e-06, 'epochs': 201, 'loss': 'mae', 'optimizer': 'adam', 'graph_mode': 'off', 'use_snp_selection': False}. Best is trial 76 with value: 0.13137043957553401.
[I 2025-12-05 15:22:46,219] Trial 141 finished with value: 0.10533160823651529 and parameters: {'model_type': 'mlp', 'hidden_dims': '[512, 256]', 'dropout': 0.1327196371000386, 'batch_norm': False, 'lr': 6.163186166838926e-05, 'weight_decay': 4.045055164254365e-06, 'epochs': 223, 'loss': 'mae', 'optimizer': 'adam', 'graph_mode': 'off', 'use_snp_selection': False}. Best is trial 76 with value: 0.13137043957553401.
[I 2025-12-05 15:22:48,477] Trial 142 finished with value: 0.09209767194009384 and parameters: {'model_type': 'mlp', 'hidden_dims': '[512, 256]', 'dropout': 0.1638809719236744, 'batch_norm': False, 'lr': 9.240087674336492e-05, 'weight_decay': 3.127224384349981e-06, 'epochs': 203, 'loss': 'mae', 'optimizer': 'adam', 'graph_mode': 'off', 'use_snp_selection': False}. Best is trial 76 with value: 0.13137043957553401.
[I 2025-12-05 15:22:50,655] Trial 143 finished with value: 0.10146235339169947 and parameters: {'model_type': 'mlp', 'hidden_dims': '[512, 256]', 'dropout': 0.15018312250625118, 'batch_norm': False, 'lr': 7.14985725464891e-05, 'weight_decay': 4.110669809011688e-06, 'epochs': 193, 'loss': 'mae', 'optimizer': 'adam', 'graph_mode': 'off', 'use_snp_selection': False}. Best is trial 76 with value: 0.13137043957553401.
[I 2025-12-05 15:22:52,972] Trial 144 finished with value: 0.08978315274270465 and parameters: {'model_type': 'mlp', 'hidden_dims': '[512, 256]', 'dropout': 0.17811814474453344, 'batch_norm': False, 'lr': 4.5914843694023256e-05, 'weight_decay': 3.4697906208153222e-06, 'epochs': 212, 'loss': 'mae', 'optimizer': 'adam', 'graph_mode': 'off', 'use_snp_selection': False}. Best is trial 76 with value: 0.13137043957553401.
[I 2025-12-05 15:22:55,471] Trial 145 finished with value: 0.10024792825955126 and parameters: {'model_type': 'mlp', 'hidden_dims': '[512, 256]', 'dropout': 0.27822444471456154, 'batch_norm': False, 'lr': 0.00016257240284400781, 'weight_decay': 1.5894496264421243e-06, 'epochs': 231, 'loss': 'mae', 'optimizer': 'adam', 'graph_mode': 'off', 'use_snp_selection': False}. Best is trial 76 with value: 0.13137043957553401.
[I 2025-12-05 15:22:56,857] Trial 146 finished with value: 0.05440799769070748 and parameters: {'model_type': 'mlp', 'hidden_dims': '[512, 256]', 'dropout': 0.5733845678050178, 'batch_norm': False, 'lr': 5.527953919305077e-05, 'weight_decay': 2.011238725975325e-06, 'epochs': 85, 'loss': 'mae', 'optimizer': 'adam', 'graph_mode': 'off', 'use_snp_selection': False}. Best is trial 76 with value: 0.13137043957553401.
[I 2025-12-05 15:22:59,104] Trial 147 finished with value: 0.10264315775547656 and parameters: {'model_type': 'mlp', 'hidden_dims': '[512, 256]', 'dropout': 0.13991406645793036, 'batch_norm': False, 'lr': 3.8199005561993145e-05, 'weight_decay': 1.4298798495177552e-06, 'epochs': 195, 'loss': 'mae', 'optimizer': 'adam', 'graph_mode': 'off', 'use_snp_selection': False}. Best is trial 76 with value: 0.13137043957553401.
[I 2025-12-05 15:23:01,536] Trial 148 finished with value: 0.09664480179375703 and parameters: {'model_type': 'mlp', 'hidden_dims': '[512, 256]', 'dropout': 0.11397053439441764, 'batch_norm': False, 'lr': 6.7401530600492e-05, 'weight_decay': 6.058181734898227e-06, 'epochs': 219, 'loss': 'mae', 'optimizer': 'adam', 'graph_mode': 'off', 'use_snp_selection': False}. Best is trial 76 with value: 0.13137043957553401.
[I 2025-12-05 15:23:04,070] Trial 149 finished with value: 0.09701177952998458 and parameters: {'model_type': 'mlp', 'hidden_dims': '[512, 256]', 'dropout': 0.12887080515867494, 'batch_norm': False, 'lr': 0.0003972087233338289, 'weight_decay': 2.7621997984350436e-06, 'epochs': 237, 'loss': 'mae', 'optimizer': 'adam', 'graph_mode': 'off', 'use_snp_selection': False}. Best is trial 76 with value: 0.13137043957553401.
[I 2025-12-05 15:23:07,269] Trial 0 finished with value: 0.07160780992592092 and parameters: {'model_type': 'mlp', 'hidden_dims': '[128, 64]', 'dropout': 0.199031432379812, 'batch_norm': True, 'lr': 1.8408544111075837e-06, 'weight_decay': 5.5136510071208614e-05, 'epochs': 336, 'loss': 'mae', 'optimizer': 'adam', 'graph_mode': 'off', 'use_snp_selection': True, 'num_snps': 43862}. Best is trial 0 with value: 0.07160780992592092.
[I 2025-12-05 15:23:09,445] Trial 1 finished with value: 0.11950954260420521 and parameters: {'model_type': 'mlp', 'hidden_dims': '[256, 128]', 'dropout': 0.4370668075331726, 'batch_norm': True, 'lr': 7.133471581159139e-05, 'weight_decay': 1.128633586803549e-05, 'epochs': 242, 'loss': 'mae', 'optimizer': 'adam', 'graph_mode': 'off', 'use_snp_selection': False}. Best is trial 1 with value: 0.11950954260420521.
[I 2025-12-05 15:23:11,213] Trial 2 finished with value: 0.046286663600779904 and parameters: {'model_type': 'mlp', 'hidden_dims': '[256, 128, 64]', 'dropout': 0.41314357415569625, 'batch_norm': False, 'lr': 3.952233718592101e-06, 'weight_decay': 0.00026754769258252603, 'epochs': 149, 'loss': 'mse', 'optimizer': 'adam', 'graph_mode': 'off', 'use_snp_selection': True, 'num_snps': 11571}. Best is trial 1 with value: 0.11950954260420521.
[I 2025-12-05 15:23:15,722] Trial 3 finished with value: 0.07411999694066068 and parameters: {'model_type': 'mlp', 'hidden_dims': '[512, 64]', 'dropout': 0.5938127374509361, 'batch_norm': False, 'lr': 5.67704586114731e-06, 'weight_decay': 2.4518087630137052e-05, 'epochs': 320, 'loss': 'mae', 'optimizer': 'adam', 'graph_mode': 'off', 'use_snp_selection': False}. Best is trial 1 with value: 0.11950954260420521.
[I 2025-12-05 15:23:20,081] Trial 4 finished with value: 0.04474943504814396 and parameters: {'model_type': 'mlp', 'hidden_dims': '[512, 128]', 'dropout': 0.25746343592134413, 'batch_norm': True, 'lr': 1.3467657668402788e-06, 'weight_decay': 0.00033087251918647806, 'epochs': 277, 'loss': 'mse', 'optimizer': 'adam', 'graph_mode': 'off', 'use_snp_selection': True, 'num_snps': 36675}. Best is trial 1 with value: 0.11950954260420521.
[I 2025-12-05 15:23:23,148] Trial 5 finished with value: 0.07656974098273107 and parameters: {'model_type': 'mlp', 'hidden_dims': '[512, 64]', 'dropout': 0.38275350994408375, 'batch_norm': True, 'lr': 1.5586664309232824e-06, 'weight_decay': 0.0008227664668621182, 'epochs': 145, 'loss': 'mae', 'optimizer': 'adam', 'graph_mode': 'off', 'use_snp_selection': True, 'num_snps': 32148}. Best is trial 1 with value: 0.11950954260420521.
[I 2025-12-05 15:23:25,019] Trial 6 finished with value: 0.11756665745151897 and parameters: {'model_type': 'mlp', 'hidden_dims': '[256, 128]', 'dropout': 0.3930109900265879, 'batch_norm': False, 'lr': 4.892964372128395e-05, 'weight_decay': 1.5809549317992182e-06, 'epochs': 199, 'loss': 'mse', 'optimizer': 'adam', 'graph_mode': 'off', 'use_snp_selection': False}. Best is trial 1 with value: 0.11950954260420521.
[I 2025-12-05 15:23:26,900] Trial 7 finished with value: 0.09697374390490181 and parameters: {'model_type': 'mlp', 'hidden_dims': '[512, 256]', 'dropout': 0.15343979219678458, 'batch_norm': True, 'lr': 6.234003099047341e-05, 'weight_decay': 3.894760610535477e-07, 'epochs': 97, 'loss': 'mse', 'optimizer': 'adam', 'graph_mode': 'off', 'use_snp_selection': False}. Best is trial 1 with value: 0.11950954260420521.
[I 2025-12-05 15:23:31,356] Trial 8 finished with value: 0.11707976024985717 and parameters: {'model_type': 'mlp', 'hidden_dims': '[512, 128]', 'dropout': 0.10743001231661406, 'batch_norm': True, 'lr': 0.00023728538449271062, 'weight_decay': 1.7629071578048637e-05, 'epochs': 312, 'loss': 'mae', 'optimizer': 'adam', 'graph_mode': 'off', 'use_snp_selection': False}. Best is trial 1 with value: 0.11950954260420521.
[I 2025-12-05 15:23:34,194] Trial 9 finished with value: 0.13572837038988797 and parameters: {'model_type': 'mlp', 'hidden_dims': '[512, 64]', 'dropout': 0.14505336736221927, 'batch_norm': True, 'lr': 5.8619638388111826e-05, 'weight_decay': 6.200156172669308e-07, 'epochs': 175, 'loss': 'mse', 'optimizer': 'adam', 'graph_mode': 'off', 'use_snp_selection': False}. Best is trial 9 with value: 0.13572837038988797.
[I 2025-12-05 15:23:35,494] Trial 10 finished with value: -0.013395090446857398 and parameters: {'model_type': 'mlp', 'hidden_dims': '[512, 64]', 'dropout': 0.27531666245262887, 'batch_norm': False, 'lr': 0.00032393778075602147, 'weight_decay': 1.1714031539166647e-07, 'epochs': 44, 'loss': 'mse', 'optimizer': 'adam', 'graph_mode': 'off', 'use_snp_selection': False}. Best is trial 9 with value: 0.13572837038988797.
[I 2025-12-05 15:23:37,691] Trial 11 finished with value: 0.05966618342198599 and parameters: {'model_type': 'mlp', 'hidden_dims': '[256, 128]', 'dropout': 0.5011246104824927, 'batch_norm': True, 'lr': 1.6474108386126448e-05, 'weight_decay': 2.8129958937311506e-06, 'epochs': 239, 'loss': 'mae', 'optimizer': 'adam', 'graph_mode': 'off', 'use_snp_selection': False}. Best is trial 9 with value: 0.13572837038988797.
[I 2025-12-05 15:23:39,724] Trial 12 finished with value: 0.10321940601019537 and parameters: {'model_type': 'mlp', 'hidden_dims': '[256, 128]', 'dropout': 0.4779690972965961, 'batch_norm': True, 'lr': 0.000121041789182661, 'weight_decay': 4.19780668911197e-06, 'epochs': 219, 'loss': 'mae', 'optimizer': 'adam', 'graph_mode': 'off', 'use_snp_selection': False}. Best is trial 9 with value: 0.13572837038988797.
[I 2025-12-05 15:23:40,787] Trial 13 finished with value: 0.06883666653510284 and parameters: {'model_type': 'mlp', 'hidden_dims': '[128, 64]', 'dropout': 0.3037065148378758, 'batch_norm': True, 'lr': 1.8184704710575438e-05, 'weight_decay': 6.97716041744421e-07, 'epochs': 157, 'loss': 'mse', 'optimizer': 'adam', 'graph_mode': 'off', 'use_snp_selection': False}. Best is trial 9 with value: 0.13572837038988797.
