[I 2025-12-05 19:08:36,935] Trial 7 finished with value: 0.2234429742842897 and parameters: {'model_type': 'mlp', 'hidden_dims': '[512, 256]', 'dropout': 0.15343979219678458, 'batch_norm': True, 'lr': 6.234003099047341e-05, 'weight_decay': 3.894760610535477e-07, 'epochs': 97, 'loss': 'mse', 'optimizer': 'adam', 'graph_mode': 'off', 'use_snp_selection': False}. Best is trial 3 with value: 0.25649640621267433.
[I 2025-12-05 19:10:08,619] Trial 8 finished with value: 0.24865874882421254 and parameters: {'model_type': 'mlp', 'hidden_dims': '[512, 128]', 'dropout': 0.10743001231661406, 'batch_norm': True, 'lr': 0.00023728538449271062, 'weight_decay': 1.7629071578048637e-05, 'epochs': 312, 'loss': 'mae', 'optimizer': 'adam', 'graph_mode': 'off', 'use_snp_selection': False}. Best is trial 3 with value: 0.25649640621267433.
[I 2025-12-05 19:11:03,422] Trial 9 finished with value: 0.24117758258923785 and parameters: {'model_type': 'mlp', 'hidden_dims': '[512, 64]', 'dropout': 0.14505336736221927, 'batch_norm': True, 'lr': 5.8619638388111826e-05, 'weight_decay': 6.200156172669308e-07, 'epochs': 175, 'loss': 'mse', 'optimizer': 'adam', 'graph_mode': 'off', 'use_snp_selection': False}. Best is trial 3 with value: 0.25649640621267433.
[I 2025-12-05 19:11:25,613] Trial 10 finished with value: 0.24100480679817196 and parameters: {'model_type': 'mlp', 'hidden_dims': '[512, 64]', 'dropout': 0.5885461262002587, 'batch_norm': False, 'lr': 8.769366258768696e-06, 'weight_decay': 2.78273193871783e-06, 'epochs': 55, 'loss': 'mae', 'optimizer': 'adam', 'graph_mode': 'off', 'use_snp_selection': False}. Best is trial 3 with value: 0.25649640621267433.
[I 2025-12-05 19:13:02,909] Trial 11 finished with value: 0.18489252729022682 and parameters: {'model_type': 'mlp', 'hidden_dims': '[512, 128]', 'dropout': 0.583942291816117, 'batch_norm': False, 'lr': 0.0007607980626791682, 'weight_decay': 2.11387030344014e-05, 'epochs': 346, 'loss': 'mae', 'optimizer': 'adam', 'graph_mode': 'off', 'use_snp_selection': False}. Best is trial 3 with value: 0.25649640621267433.
[I 2025-12-05 19:14:27,294] Trial 12 finished with value: 0.23862662652006206 and parameters: {'model_type': 'mlp', 'hidden_dims': '[512, 128]', 'dropout': 0.2637316882220091, 'batch_norm': False, 'lr': 0.000384886887018818, 'weight_decay': 6.23587291883057e-05, 'epochs': 294, 'loss': 'mae', 'optimizer': 'adam', 'graph_mode': 'off', 'use_snp_selection': False}. Best is trial 3 with value: 0.25649640621267433.
[I 2025-12-05 19:14:53,360] Trial 13 finished with value: 0.2582964180082353 and parameters: {'model_type': 'mlp', 'hidden_dims': '[128, 64]', 'dropout': 0.5255276925359322, 'batch_norm': False, 'lr': 1.3373175420781734e-05, 'weight_decay': 2.875929917712265e-06, 'epochs': 285, 'loss': 'mae', 'optimizer': 'adam', 'graph_mode': 'off', 'use_snp_selection': False}. Best is trial 13 with value: 0.2582964180082353.
[I 2025-12-05 19:15:16,320] Trial 14 finished with value: 0.2410441713594642 and parameters: {'model_type': 'mlp', 'hidden_dims': '[128, 64]', 'dropout': 0.4841249530929294, 'batch_norm': False, 'lr': 1.3128901291408973e-05, 'weight_decay': 1.1414924884997386e-07, 'epochs': 241, 'loss': 'mae', 'optimizer': 'adam', 'graph_mode': 'off', 'use_snp_selection': False}. Best is trial 13 with value: 0.2582964180082353.
[I 2025-12-05 19:15:40,379] Trial 15 finished with value: 0.2538110161385707 and parameters: {'model_type': 'mlp', 'hidden_dims': '[128, 64]', 'dropout': 0.5175762982265439, 'batch_norm': False, 'lr': 1.8411764708572348e-05, 'weight_decay': 4.61164678661027e-06, 'epochs': 258, 'loss': 'mae', 'optimizer': 'adam', 'graph_mode': 'off', 'use_snp_selection': False}. Best is trial 13 with value: 0.2582964180082353.
[I 2025-12-05 19:16:17,493] Trial 16 finished with value: 0.2603132632397104 and parameters: {'model_type': 'mlp', 'hidden_dims': '[256, 128, 64]', 'dropout': 0.5185364264420361, 'batch_norm': False, 'lr': 6.013316929814413e-06, 'weight_decay': 6.714274798411626e-05, 'epochs': 220, 'loss': 'mae', 'optimizer': 'adam', 'graph_mode': 'off', 'use_snp_selection': False}. Best is trial 16 with value: 0.2603132632397104.
[I 2025-12-05 19:16:51,763] Trial 17 finished with value: 0.2571040339069036 and parameters: {'model_type': 'mlp', 'hidden_dims': '[256, 128, 64]', 'dropout': 0.5189226808191895, 'batch_norm': False, 'lr': 2.349300150160787e-05, 'weight_decay': 9.609301284462715e-05, 'epochs': 202, 'loss': 'mae', 'optimizer': 'adam', 'graph_mode': 'off', 'use_snp_selection': False}. Best is trial 16 with value: 0.2603132632397104.
[I 2025-12-05 19:18:07,706] Trial 18 finished with value: 0.2526241099885735 and parameters: {'model_type': 'mlp', 'hidden_dims': '[256, 128, 64]', 'dropout': 0.47474810046240096, 'batch_norm': False, 'lr': 3.645735276507377e-06, 'weight_decay': 5.418588958759079e-06, 'epochs': 221, 'loss': 'mae', 'optimizer': 'adam', 'graph_mode': 'off', 'use_snp_selection': True, 'num_snps': 58241}. Best is trial 16 with value: 0.2603132632397104.
[I 2025-12-05 19:19:27,198] Trial 19 finished with value: 0.24642394498970951 and parameters: {'model_type': 'mlp', 'hidden_dims': '[512, 256]', 'dropout': 0.34187208976107564, 'batch_norm': False, 'lr': 0.00014334793979738487, 'weight_decay': 1.0784611336767877e-06, 'epochs': 277, 'loss': 'mae', 'optimizer': 'adam', 'graph_mode': 'off', 'use_snp_selection': False}. Best is trial 16 with value: 0.2603132632397104.
[I 2025-12-05 19:19:44,492] Trial 20 finished with value: 0.24117682833701512 and parameters: {'model_type': 'mlp', 'hidden_dims': '[128, 64]', 'dropout': 0.5373915352030224, 'batch_norm': False, 'lr': 7.951283186534742e-06, 'weight_decay': 0.0001312475651743923, 'epochs': 162, 'loss': 'mae', 'optimizer': 'adam', 'graph_mode': 'off', 'use_snp_selection': False}. Best is trial 16 with value: 0.2603132632397104.
[I 2025-12-05 19:20:20,417] Trial 21 finished with value: 0.2558715327898937 and parameters: {'model_type': 'mlp', 'hidden_dims': '[256, 128, 64]', 'dropout': 0.5290851098969152, 'batch_norm': False, 'lr': 2.3115257685523084e-05, 'weight_decay': 5.4726956481471185e-05, 'epochs': 216, 'loss': 'mae', 'optimizer': 'adam', 'graph_mode': 'off', 'use_snp_selection': False}. Best is trial 16 with value: 0.2603132632397104.
[I 2025-12-05 19:20:53,590] Trial 22 finished with value: 0.24419222715501573 and parameters: {'model_type': 'mlp', 'hidden_dims': '[256, 128, 64]', 'dropout': 0.4637705560374512, 'batch_norm': False, 'lr': 2.8814953538600434e-05, 'weight_decay': 0.00012506009376990192, 'epochs': 195, 'loss': 'mae', 'optimizer': 'adam', 'graph_mode': 'off', 'use_snp_selection': False}. Best is trial 16 with value: 0.2603132632397104.
[I 2025-12-05 19:21:15,848] Trial 23 finished with value: 0.26077888660993276 and parameters: {'model_type': 'mlp', 'hidden_dims': '[256, 128, 64]', 'dropout': 0.3394329679631819, 'batch_norm': False, 'lr': 1.2979180847114501e-05, 'weight_decay': 0.00043098921648807465, 'epochs': 114, 'loss': 'mae', 'optimizer': 'adam', 'graph_mode': 'off', 'use_snp_selection': False}. Best is trial 23 with value: 0.26077888660993276.
[I 2025-12-05 19:21:39,303] Trial 24 finished with value: 0.25790905909981343 and parameters: {'model_type': 'mlp', 'hidden_dims': '[256, 128, 64]', 'dropout': 0.30695872906246807, 'batch_norm': False, 'lr': 2.746401414556531e-06, 'weight_decay': 0.00037385832317161346, 'epochs': 122, 'loss': 'mae', 'optimizer': 'adam', 'graph_mode': 'off', 'use_snp_selection': False}. Best is trial 23 with value: 0.26077888660993276.
[I 2025-12-05 19:22:02,962] Trial 25 finished with value: 0.2525830533030973 and parameters: {'model_type': 'mlp', 'hidden_dims': '[256, 128, 64]', 'dropout': 0.3689543839574715, 'batch_norm': False, 'lr': 1.2563560151224028e-05, 'weight_decay': 0.00090624061150386, 'epochs': 124, 'loss': 'mae', 'optimizer': 'adam', 'graph_mode': 'off', 'use_snp_selection': False}. Best is trial 23 with value: 0.26077888660993276.
[I 2025-12-05 19:22:32,765] Trial 26 finished with value: 0.08794856845492241 and parameters: {'model_type': 'mlp', 'hidden_dims': '[128, 64]', 'dropout': 0.31397230827329137, 'batch_norm': False, 'lr': 5.574521828207366e-06, 'weight_decay': 0.00022123062859658268, 'epochs': 82, 'loss': 'mae', 'optimizer': 'adam', 'graph_mode': 'off', 'use_snp_selection': True, 'num_snps': 3842}. Best is trial 23 with value: 0.26077888660993276.
[I 2025-12-05 19:22:45,247] Trial 27 finished with value: 0.23267518088826597 and parameters: {'model_type': 'mlp', 'hidden_dims': '[256, 128, 64]', 'dropout': 0.42145362411998366, 'batch_norm': False, 'lr': 1.2100325080355392e-05, 'weight_decay': 3.7728781986273995e-05, 'epochs': 44, 'loss': 'mse', 'optimizer': 'adam', 'graph_mode': 'off', 'use_snp_selection': False}. Best is trial 23 with value: 0.26077888660993276.
[I 2025-12-05 19:23:24,242] Trial 28 finished with value: 0.24696972413973262 and parameters: {'model_type': 'mlp', 'hidden_dims': '[256, 128]', 'dropout': 0.25688331032250383, 'batch_norm': False, 'lr': 3.690706671919175e-05, 'weight_decay': 8.272863239104759e-06, 'epochs': 243, 'loss': 'mae', 'optimizer': 'adam', 'graph_mode': 'off', 'use_snp_selection': False}. Best is trial 23 with value: 0.26077888660993276.
[I 2025-12-05 19:24:03,043] Trial 29 finished with value: 0.22988856233315516 and parameters: {'model_type': 'mlp', 'hidden_dims': '[128, 64]', 'dropout': 0.5617801082091401, 'batch_norm': False, 'lr': 2.320440320155318e-06, 'weight_decay': 0.0005485134997471856, 'epochs': 179, 'loss': 'mae', 'optimizer': 'adam', 'graph_mode': 'off', 'use_snp_selection': True, 'num_snps': 19468}. Best is trial 23 with value: 0.26077888660993276.
[I 2025-12-05 19:25:21,244] Trial 30 finished with value: 0.24812004584411973 and parameters: {'model_type': 'mlp', 'hidden_dims': '[512, 256]', 'dropout': 0.4485007649909121, 'batch_norm': False, 'lr': 9.889554104062969e-05, 'weight_decay': 0.00018034968979754363, 'epochs': 273, 'loss': 'mae', 'optimizer': 'adam', 'graph_mode': 'off', 'use_snp_selection': False}. Best is trial 23 with value: 0.26077888660993276.
[I 2025-12-05 19:25:44,632] Trial 31 finished with value: 0.24948916133354077 and parameters: {'model_type': 'mlp', 'hidden_dims': '[256, 128, 64]', 'dropout': 0.3056608161685943, 'batch_norm': False, 'lr': 2.3929157166810304e-06, 'weight_decay': 0.00037591582811467844, 'epochs': 122, 'loss': 'mae', 'optimizer': 'adam', 'graph_mode': 'off', 'use_snp_selection': False}. Best is trial 23 with value: 0.26077888660993276.
[I 2025-12-05 19:26:04,246] Trial 32 finished with value: 0.15083736482919635 and parameters: {'model_type': 'mlp', 'hidden_dims': '[256, 128, 64]', 'dropout': 0.33825584624251975, 'batch_norm': False, 'lr': 1.0072042178400174e-06, 'weight_decay': 0.0004485451132940286, 'epochs': 95, 'loss': 'mae', 'optimizer': 'adam', 'graph_mode': 'off', 'use_snp_selection': False}. Best is trial 23 with value: 0.26077888660993276.
[I 2025-12-05 19:26:27,451] Trial 33 finished with value: 0.25029715146669396 and parameters: {'model_type': 'mlp', 'hidden_dims': '[256, 128, 64]', 'dropout': 0.22106153945104828, 'batch_norm': False, 'lr': 3.5397643710208565e-06, 'weight_decay': 8.822340236655884e-05, 'epochs': 121, 'loss': 'mae', 'optimizer': 'adam', 'graph_mode': 'off', 'use_snp_selection': False}. Best is trial 23 with value: 0.26077888660993276.
[I 2025-12-05 19:26:43,640] Trial 34 finished with value: 0.24638623881403138 and parameters: {'model_type': 'mlp', 'hidden_dims': '[256, 128, 64]', 'dropout': 0.2997730775995851, 'batch_norm': False, 'lr': 6.003623229413168e-06, 'weight_decay': 1.1844046941978347e-05, 'epochs': 71, 'loss': 'mae', 'optimizer': 'adam', 'graph_mode': 'off', 'use_snp_selection': False}. Best is trial 23 with value: 0.26077888660993276.
[I 2025-12-05 19:27:11,501] Trial 35 finished with value: 0.13912095682798956 and parameters: {'model_type': 'mlp', 'hidden_dims': '[256, 128, 64]', 'dropout': 0.490594975563593, 'batch_norm': True, 'lr': 2.7719064650377456e-06, 'weight_decay': 3.3701226583312884e-05, 'epochs': 153, 'loss': 'mae', 'optimizer': 'adam', 'graph_mode': 'off', 'use_snp_selection': False}. Best is trial 23 with value: 0.26077888660993276.
[I 2025-12-05 19:28:38,882] Trial 36 finished with value: 0.23972982666632917 and parameters: {'model_type': 'mlp', 'hidden_dims': '[256, 128]', 'dropout': 0.40842502537832637, 'batch_norm': False, 'lr': 4.953479198372411e-06, 'weight_decay': 0.00022721556772383492, 'epochs': 319, 'loss': 'mse', 'optimizer': 'adam', 'graph_mode': 'off', 'use_snp_selection': True, 'num_snps': 58661}. Best is trial 23 with value: 0.26077888660993276.
[I 2025-12-05 19:28:51,714] Trial 37 finished with value: 0.2581250211777363 and parameters: {'model_type': 'mlp', 'hidden_dims': '[128, 64]', 'dropout': 0.36555439480590507, 'batch_norm': False, 'lr': 1.6439100281204306e-05, 'weight_decay': 0.0006220530274311467, 'epochs': 101, 'loss': 'mae', 'optimizer': 'adam', 'graph_mode': 'off', 'use_snp_selection': False}. Best is trial 23 with value: 0.26077888660993276.
[I 2025-12-05 19:29:28,894] Trial 38 finished with value: 0.1807848122146606 and parameters: {'model_type': 'mlp', 'hidden_dims': '[128, 64]', 'dropout': 0.36328440843452386, 'batch_norm': True, 'lr': 8.589605001699045e-06, 'weight_decay': 0.000983848745767738, 'epochs': 103, 'loss': 'mse', 'optimizer': 'adam', 'graph_mode': 'off', 'use_snp_selection': True, 'num_snps': 19911}. Best is trial 23 with value: 0.26077888660993276.
[I 2025-12-05 19:29:55,149] Trial 39 finished with value: 0.24386127031578658 and parameters: {'model_type': 'mlp', 'hidden_dims': '[128, 64]', 'dropout': 0.4382488216281599, 'batch_norm': False, 'lr': 3.704500064343362e-05, 'weight_decay': 2.329934720253146e-06, 'epochs': 299, 'loss': 'mae', 'optimizer': 'adam', 'graph_mode': 'off', 'use_snp_selection': False}. Best is trial 23 with value: 0.26077888660993276.
[I 2025-12-05 19:30:10,536] Trial 40 finished with value: 0.23544751761353985 and parameters: {'model_type': 'mlp', 'hidden_dims': '[128, 64]', 'dropout': 0.55115759889504, 'batch_norm': True, 'lr': 1.7346931638219596e-05, 'weight_decay': 0.0005743070048649094, 'epochs': 134, 'loss': 'mae', 'optimizer': 'adam', 'graph_mode': 'off', 'use_snp_selection': False}. Best is trial 23 with value: 0.26077888660993276.
[I 2025-12-05 19:30:24,179] Trial 41 finished with value: 0.2435062694273744 and parameters: {'model_type': 'mlp', 'hidden_dims': '[128, 64]', 'dropout': 0.21802230559316066, 'batch_norm': False, 'lr': 9.925604323032789e-06, 'weight_decay': 0.0005580282007381108, 'epochs': 111, 'loss': 'mae', 'optimizer': 'adam', 'graph_mode': 'off', 'use_snp_selection': False}. Best is trial 23 with value: 0.26077888660993276.
[I 2025-12-05 19:30:41,481] Trial 42 finished with value: 0.22449174069035216 and parameters: {'model_type': 'mlp', 'hidden_dims': '[256, 128, 64]', 'dropout': 0.2811017859721857, 'batch_norm': False, 'lr': 1.688131966946664e-06, 'weight_decay': 0.0002895900824545275, 'epochs': 79, 'loss': 'mae', 'optimizer': 'adam', 'graph_mode': 'off', 'use_snp_selection': False}. Best is trial 23 with value: 0.26077888660993276.
[I 2025-12-05 19:31:05,006] Trial 43 finished with value: 0.24425172697604966 and parameters: {'model_type': 'mlp', 'hidden_dims': '[512, 64]', 'dropout': 0.4041935079006561, 'batch_norm': False, 'lr': 6.514765186284655e-06, 'weight_decay': 0.0003091414789301106, 'epochs': 61, 'loss': 'mae', 'optimizer': 'adam', 'graph_mode': 'off', 'use_snp_selection': False}. Best is trial 23 with value: 0.26077888660993276.
[I 2025-12-05 19:31:49,125] Trial 44 finished with value: 0.2516922034775434 and parameters: {'model_type': 'mlp', 'hidden_dims': '[512, 256]', 'dropout': 0.3747762117911848, 'batch_norm': False, 'lr': 1.812525310770448e-05, 'weight_decay': 0.00015908228842512241, 'epochs': 139, 'loss': 'mae', 'optimizer': 'adam', 'graph_mode': 'off', 'use_snp_selection': False}. Best is trial 23 with value: 0.26077888660993276.
[I 2025-12-05 19:32:20,569] Trial 45 finished with value: 0.24434160857202541 and parameters: {'model_type': 'mlp', 'hidden_dims': '[512, 128]', 'dropout': 0.3419579793695533, 'batch_norm': False, 'lr': 4.520167970287897e-06, 'weight_decay': 0.0006359108224054226, 'epochs': 90, 'loss': 'mse', 'optimizer': 'adam', 'graph_mode': 'off', 'use_snp_selection': False}. Best is trial 23 with value: 0.26077888660993276.
[I 2025-12-05 19:32:50,665] Trial 46 finished with value: 0.17786074102873123 and parameters: {'model_type': 'mlp', 'hidden_dims': '[256, 128]', 'dropout': 0.3215249981782221, 'batch_norm': True, 'lr': 3.133047575566844e-06, 'weight_decay': 6.929507706799418e-05, 'epochs': 170, 'loss': 'mae', 'optimizer': 'adam', 'graph_mode': 'off', 'use_snp_selection': False}. Best is trial 23 with value: 0.26077888660993276.
[I 2025-12-05 19:33:09,243] Trial 47 finished with value: 0.27473222670638264 and parameters: {'model_type': 'mlp', 'hidden_dims': '[128, 64]', 'dropout': 0.5068749576653713, 'batch_norm': False, 'lr': 1.4301919600137588e-05, 'weight_decay': 3.19368371263702e-07, 'epochs': 182, 'loss': 'mae', 'optimizer': 'adam', 'graph_mode': 'off', 'use_snp_selection': False}. Best is trial 47 with value: 0.27473222670638264.
[I 2025-12-05 19:33:30,562] Trial 48 finished with value: 0.2638847704675272 and parameters: {'model_type': 'mlp', 'hidden_dims': '[128, 64]', 'dropout': 0.5076024794375156, 'batch_norm': False, 'lr': 1.4570923513989761e-05, 'weight_decay': 1.3526550076392152e-07, 'epochs': 221, 'loss': 'mae', 'optimizer': 'adam', 'graph_mode': 'off', 'use_snp_selection': False}. Best is trial 47 with value: 0.27473222670638264.
[I 2025-12-05 19:34:25,953] Trial 49 finished with value: 0.24076057661365463 and parameters: {'model_type': 'mlp', 'hidden_dims': '[128, 64]', 'dropout': 0.4973082331093477, 'batch_norm': False, 'lr': 1.140640992844052e-05, 'weight_decay': 1.7009079364163254e-07, 'epochs': 223, 'loss': 'mse', 'optimizer': 'adam', 'graph_mode': 'off', 'use_snp_selection': True, 'num_snps': 46888}. Best is trial 47 with value: 0.27473222670638264.
[I 2025-12-05 19:34:48,106] Trial 50 finished with value: 0.24514163047970886 and parameters: {'model_type': 'mlp', 'hidden_dims': '[128, 64]', 'dropout': 0.5644362266039621, 'batch_norm': False, 'lr': 3.0180950676579294e-05, 'weight_decay': 4.830936308591571e-07, 'epochs': 237, 'loss': 'mae', 'optimizer': 'adam', 'graph_mode': 'off', 'use_snp_selection': False}. Best is trial 47 with value: 0.27473222670638264.
[I 2025-12-05 19:35:08,632] Trial 51 finished with value: 0.2525214880454697 and parameters: {'model_type': 'mlp', 'hidden_dims': '[128, 64]', 'dropout': 0.5058801531256759, 'batch_norm': False, 'lr': 1.5861522062680425e-05, 'weight_decay': 1.6646573936867176e-07, 'epochs': 212, 'loss': 'mae', 'optimizer': 'adam', 'graph_mode': 'off', 'use_snp_selection': False}. Best is trial 47 with value: 0.27473222670638264.
[I 2025-12-05 19:35:31,901] Trial 52 finished with value: 0.25467950828496144 and parameters: {'model_type': 'mlp', 'hidden_dims': '[128, 64]', 'dropout': 0.5902850377326865, 'batch_norm': False, 'lr': 4.7255335537995094e-05, 'weight_decay': 3.2230439553352623e-07, 'epochs': 254, 'loss': 'mae', 'optimizer': 'adam', 'graph_mode': 'off', 'use_snp_selection': False}. Best is trial 47 with value: 0.27473222670638264.
[I 2025-12-05 19:35:50,648] Trial 53 finished with value: 0.2615077000750087 and parameters: {'model_type': 'mlp', 'hidden_dims': '[128, 64]', 'dropout': 0.46320997346511694, 'batch_norm': False, 'lr': 2.2840744262946183e-05, 'weight_decay': 1.0916404940754206e-07, 'epochs': 185, 'loss': 'mae', 'optimizer': 'adam', 'graph_mode': 'off', 'use_snp_selection': False}. Best is trial 47 with value: 0.27473222670638264.
[I 2025-12-05 19:36:09,184] Trial 54 finished with value: 0.2661280850262985 and parameters: {'model_type': 'mlp', 'hidden_dims': '[128, 64]', 'dropout': 0.4711664549104899, 'batch_norm': False, 'lr': 2.1703670797182448e-05, 'weight_decay': 1.0908549098519927e-07, 'epochs': 183, 'loss': 'mae', 'optimizer': 'adam', 'graph_mode': 'off', 'use_snp_selection': False}. Best is trial 47 with value: 0.27473222670638264.
[I 2025-12-05 19:37:03,635] Trial 55 finished with value: 0.24523219910353192 and parameters: {'model_type': 'mlp', 'hidden_dims': '[512, 64]', 'dropout': 0.4627630537248427, 'batch_norm': False, 'lr': 2.3323673393849942e-05, 'weight_decay': 1.0926241788645485e-07, 'epochs': 179, 'loss': 'mae', 'optimizer': 'adam', 'graph_mode': 'off', 'use_snp_selection': False}. Best is trial 47 with value: 0.27473222670638264.
[I 2025-12-05 19:37:22,959] Trial 56 finished with value: 0.2628394273432605 and parameters: {'model_type': 'mlp', 'hidden_dims': '[128, 64]', 'dropout': 0.5446312597665017, 'batch_norm': False, 'lr': 7.926795048482048e-06, 'weight_decay': 2.4670080301326777e-07, 'epochs': 192, 'loss': 'mae', 'optimizer': 'adam', 'graph_mode': 'off', 'use_snp_selection': False}. Best is trial 47 with value: 0.27473222670638264.
[I 2025-12-05 19:37:41,990] Trial 57 finished with value: 0.1960394952427022 and parameters: {'model_type': 'mlp', 'hidden_dims': '[128, 64]', 'dropout': 0.47504160507818627, 'batch_norm': True, 'lr': 7.498699441666454e-06, 'weight_decay': 2.634506358813205e-07, 'epochs': 185, 'loss': 'mae', 'optimizer': 'adam', 'graph_mode': 'off', 'use_snp_selection': False}. Best is trial 47 with value: 0.27473222670638264.
[I 2025-12-05 19:38:01,939] Trial 58 finished with value: 0.261160803296091 and parameters: {'model_type': 'mlp', 'hidden_dims': '[128, 64]', 'dropout': 0.5412463930925185, 'batch_norm': False, 'lr': 4.713263094603128e-05, 'weight_decay': 1.8699866274450134e-07, 'epochs': 204, 'loss': 'mae', 'optimizer': 'adam', 'graph_mode': 'off', 'use_snp_selection': False}. Best is trial 47 with value: 0.27473222670638264.
