[I 2025-12-05 15:30:41,323] Trial 20 finished with value: 0.08556423502824492 and parameters: {'model_type': 'mlp', 'hidden_dims': '[512, 256]', 'dropout': 0.23887975920589624, 'batch_norm': True, 'lr': 0.00010790565258321806, 'weight_decay': 9.109499921670077e-07, 'epochs': 80, 'loss': 'mse', 'optimizer': 'adam', 'graph_mode': 'off', 'use_snp_selection': False}. Best is trial 7 with value: 0.10406888958612082.
[I 2025-12-05 15:30:43,779] Trial 21 finished with value: 0.08541113487220814 and parameters: {'model_type': 'mlp', 'hidden_dims': '[512, 128]', 'dropout': 0.10121645467411723, 'batch_norm': True, 'lr': 0.0002653433610323151, 'weight_decay': 1.34513657290565e-05, 'epochs': 294, 'loss': 'mae', 'optimizer': 'adam', 'graph_mode': 'off', 'use_snp_selection': False}. Best is trial 7 with value: 0.10406888958612082.
[I 2025-12-05 15:30:45,900] Trial 22 finished with value: 0.07679419158500046 and parameters: {'model_type': 'mlp', 'hidden_dims': '[512, 128]', 'dropout': 0.13644617752800978, 'batch_norm': True, 'lr': 0.00020644919107319656, 'weight_decay': 5.0124536119779676e-06, 'epochs': 242, 'loss': 'mae', 'optimizer': 'adam', 'graph_mode': 'off', 'use_snp_selection': False}. Best is trial 7 with value: 0.10406888958612082.
[I 2025-12-05 15:30:47,639] Trial 23 finished with value: 0.09252985581562825 and parameters: {'model_type': 'mlp', 'hidden_dims': '[512, 128]', 'dropout': 0.13205985202331463, 'batch_norm': True, 'lr': 0.00046865978646132327, 'weight_decay': 3.0420125656420216e-05, 'epochs': 170, 'loss': 'mae', 'optimizer': 'adam', 'graph_mode': 'off', 'use_snp_selection': False}. Best is trial 7 with value: 0.10406888958612082.
[I 2025-12-05 15:30:49,195] Trial 24 finished with value: 0.07800638365028648 and parameters: {'model_type': 'mlp', 'hidden_dims': '[512, 128]', 'dropout': 0.22459578976396127, 'batch_norm': True, 'lr': 0.00044210944670899254, 'weight_decay': 3.6735228386169826e-05, 'epochs': 142, 'loss': 'mae', 'optimizer': 'adam', 'graph_mode': 'off', 'use_snp_selection': False}. Best is trial 7 with value: 0.10406888958612082.
[I 2025-12-05 15:30:50,328] Trial 25 finished with value: 0.08489501481174302 and parameters: {'model_type': 'mlp', 'hidden_dims': '[256, 128, 64]', 'dropout': 0.17978254789845777, 'batch_norm': True, 'lr': 0.0009827537936933236, 'weight_decay': 2.1288177027617687e-07, 'epochs': 180, 'loss': 'mae', 'optimizer': 'adam', 'graph_mode': 'off', 'use_snp_selection': False}. Best is trial 7 with value: 0.10406888958612082.
[I 2025-12-05 15:30:51,253] Trial 26 finished with value: 0.0578626270919992 and parameters: {'model_type': 'mlp', 'hidden_dims': '[256, 128]', 'dropout': 0.14558277778073722, 'batch_norm': True, 'lr': 2.9665564995556198e-05, 'weight_decay': 0.0001033843972786578, 'epochs': 123, 'loss': 'mae', 'optimizer': 'adam', 'graph_mode': 'off', 'use_snp_selection': True, 'num_snps': 3842}. Best is trial 7 with value: 0.10406888958612082.
[I 2025-12-05 15:30:52,102] Trial 27 finished with value: 0.03891205450457459 and parameters: {'model_type': 'mlp', 'hidden_dims': '[128, 64]', 'dropout': 0.3242674909682829, 'batch_norm': False, 'lr': 0.000504124811370254, 'weight_decay': 6.018361027435221e-06, 'epochs': 165, 'loss': 'mae', 'optimizer': 'adam', 'graph_mode': 'off', 'use_snp_selection': False}. Best is trial 7 with value: 0.10406888958612082.
[I 2025-12-05 15:30:54,146] Trial 28 finished with value: 0.08288102750137527 and parameters: {'model_type': 'mlp', 'hidden_dims': '[512, 256]', 'dropout': 0.1602895116201787, 'batch_norm': True, 'lr': 0.00010331204748607437, 'weight_decay': 1.6821593150518936e-06, 'epochs': 228, 'loss': 'mse', 'optimizer': 'adam', 'graph_mode': 'off', 'use_snp_selection': False}. Best is trial 7 with value: 0.10406888958612082.
[I 2025-12-05 15:30:55,511] Trial 29 finished with value: 0.008505023755248444 and parameters: {'model_type': 'mlp', 'hidden_dims': '[128, 64]', 'dropout': 0.1924933592480323, 'batch_norm': True, 'lr': 3.1868653642222323e-06, 'weight_decay': 0.00010774073487650296, 'epochs': 118, 'loss': 'mae', 'optimizer': 'adam', 'graph_mode': 'off', 'use_snp_selection': True, 'num_snps': 19468}. Best is trial 7 with value: 0.10406888958612082.
[I 2025-12-05 15:30:56,791] Trial 30 finished with value: 0.0803974908175567 and parameters: {'model_type': 'mlp', 'hidden_dims': '[512, 128]', 'dropout': 0.2777793349512525, 'batch_norm': True, 'lr': 0.0003786371594138019, 'weight_decay': 8.462715538144753e-06, 'epochs': 81, 'loss': 'mae', 'optimizer': 'adam', 'graph_mode': 'off', 'use_snp_selection': False}. Best is trial 7 with value: 0.10406888958612082.
[I 2025-12-05 15:30:59,515] Trial 31 finished with value: 0.09209189595687774 and parameters: {'model_type': 'mlp', 'hidden_dims': '[512, 128]', 'dropout': 0.11418153890289515, 'batch_norm': True, 'lr': 0.00020875117106924852, 'weight_decay': 1.8330281378583254e-05, 'epochs': 340, 'loss': 'mae', 'optimizer': 'adam', 'graph_mode': 'off', 'use_snp_selection': False}. Best is trial 7 with value: 0.10406888958612082.
[I 2025-12-05 15:31:02,210] Trial 32 finished with value: 0.07969187115940085 and parameters: {'model_type': 'mlp', 'hidden_dims': '[512, 128]', 'dropout': 0.12499521617750978, 'batch_norm': True, 'lr': 0.00018647795156043147, 'weight_decay': 3.6474709168791125e-05, 'epochs': 335, 'loss': 'mae', 'optimizer': 'adam', 'graph_mode': 'off', 'use_snp_selection': False}. Best is trial 7 with value: 0.10406888958612082.
[I 2025-12-05 15:31:04,573] Trial 33 finished with value: 0.08365767616940895 and parameters: {'model_type': 'mlp', 'hidden_dims': '[512, 128]', 'dropout': 0.21436843685522564, 'batch_norm': True, 'lr': 0.0005733847044647208, 'weight_decay': 9.380503079132878e-06, 'epochs': 282, 'loss': 'mae', 'optimizer': 'adam', 'graph_mode': 'off', 'use_snp_selection': False}. Best is trial 7 with value: 0.10406888958612082.
[I 2025-12-05 15:31:05,404] Trial 34 finished with value: 0.08397836185345144 and parameters: {'model_type': 'mlp', 'hidden_dims': '[256, 128]', 'dropout': 0.16997035187346096, 'batch_norm': True, 'lr': 7.550100369351051e-05, 'weight_decay': 2.6213764752666e-05, 'epochs': 59, 'loss': 'mae', 'optimizer': 'adam', 'graph_mode': 'off', 'use_snp_selection': False}. Best is trial 7 with value: 0.10406888958612082.
[I 2025-12-05 15:31:07,622] Trial 35 finished with value: 0.08269961463626559 and parameters: {'model_type': 'mlp', 'hidden_dims': '[512, 128]', 'dropout': 0.12459613338205364, 'batch_norm': False, 'lr': 0.00031693119087185934, 'weight_decay': 0.0001042278725033183, 'epochs': 262, 'loss': 'mae', 'optimizer': 'adam', 'graph_mode': 'off', 'use_snp_selection': False}. Best is trial 7 with value: 0.10406888958612082.
[I 2025-12-05 15:31:10,948] Trial 36 finished with value: 0.08799474818706125 and parameters: {'model_type': 'mlp', 'hidden_dims': '[512, 64]', 'dropout': 0.24189447635482061, 'batch_norm': True, 'lr': 0.0007247584491906048, 'weight_decay': 3.2194546382598488e-06, 'epochs': 161, 'loss': 'mae', 'optimizer': 'adam', 'graph_mode': 'off', 'use_snp_selection': True, 'num_snps': 58661}. Best is trial 7 with value: 0.10406888958612082.
[I 2025-12-05 15:31:11,964] Trial 37 finished with value: 0.04367439184364523 and parameters: {'model_type': 'mlp', 'hidden_dims': '[256, 128, 64]', 'dropout': 0.4444623823363072, 'batch_norm': True, 'lr': 4.350549331735279e-05, 'weight_decay': 0.00027176669497101704, 'epochs': 138, 'loss': 'mse', 'optimizer': 'adam', 'graph_mode': 'off', 'use_snp_selection': False}. Best is trial 7 with value: 0.10406888958612082.
[I 2025-12-05 15:31:13,616] Trial 38 finished with value: 0.058381151525283254 and parameters: {'model_type': 'mlp', 'hidden_dims': '[512, 128]', 'dropout': 0.1001108532167958, 'batch_norm': False, 'lr': 0.0001755851676003777, 'weight_decay': 1.5871251109311412e-05, 'epochs': 212, 'loss': 'mae', 'optimizer': 'adam', 'graph_mode': 'off', 'use_snp_selection': True, 'num_snps': 19911}. Best is trial 7 with value: 0.10406888958612082.
[I 2025-12-05 15:31:15,854] Trial 39 finished with value: 0.06503319661319212 and parameters: {'model_type': 'mlp', 'hidden_dims': '[512, 128]', 'dropout': 0.12813772341830718, 'batch_norm': True, 'lr': 8.284685030862025e-05, 'weight_decay': 0.000494866061743946, 'epochs': 253, 'loss': 'mse', 'optimizer': 'adam', 'graph_mode': 'off', 'use_snp_selection': False}. Best is trial 7 with value: 0.10406888958612082.
[I 2025-12-05 15:31:17,729] Trial 40 finished with value: 0.06428965772164676 and parameters: {'model_type': 'mlp', 'hidden_dims': '[512, 64]', 'dropout': 0.3546029222890764, 'batch_norm': True, 'lr': 0.0002839202290571815, 'weight_decay': 5.6336229369932455e-05, 'epochs': 188, 'loss': 'mae', 'optimizer': 'adam', 'graph_mode': 'off', 'use_snp_selection': False}. Best is trial 7 with value: 0.10406888958612082.
[I 2025-12-05 15:31:20,385] Trial 41 finished with value: 0.08388042630767567 and parameters: {'model_type': 'mlp', 'hidden_dims': '[512, 128]', 'dropout': 0.12249700361871607, 'batch_norm': True, 'lr': 0.00023716283452844517, 'weight_decay': 1.9183463977258184e-05, 'epochs': 328, 'loss': 'mae', 'optimizer': 'adam', 'graph_mode': 'off', 'use_snp_selection': False}. Best is trial 7 with value: 0.10406888958612082.
[I 2025-12-05 15:31:23,120] Trial 42 finished with value: 0.08678219560694743 and parameters: {'model_type': 'mlp', 'hidden_dims': '[512, 128]', 'dropout': 0.15634921522143094, 'batch_norm': True, 'lr': 0.00015640596195672817, 'weight_decay': 8.314572000224298e-06, 'epochs': 349, 'loss': 'mae', 'optimizer': 'adam', 'graph_mode': 'off', 'use_snp_selection': False}. Best is trial 7 with value: 0.10406888958612082.
[I 2025-12-05 15:31:25,679] Trial 43 finished with value: 0.07813312390107366 and parameters: {'model_type': 'mlp', 'hidden_dims': '[512, 256]', 'dropout': 0.19580697257307522, 'batch_norm': True, 'lr': 0.000783998807187494, 'weight_decay': 2.7656528729506413e-05, 'epochs': 310, 'loss': 'mae', 'optimizer': 'adam', 'graph_mode': 'off', 'use_snp_selection': False}. Best is trial 7 with value: 0.10406888958612082.
[I 2025-12-05 15:31:28,108] Trial 44 finished with value: 0.09248533194802228 and parameters: {'model_type': 'mlp', 'hidden_dims': '[512, 128]', 'dropout': 0.1015917001247799, 'batch_norm': True, 'lr': 0.00036556030363601744, 'weight_decay': 2.1318396431818635e-06, 'epochs': 295, 'loss': 'mae', 'optimizer': 'adam', 'graph_mode': 'off', 'use_snp_selection': False}. Best is trial 7 with value: 0.10406888958612082.
[I 2025-12-05 15:31:29,715] Trial 45 finished with value: 0.089636959950517 and parameters: {'model_type': 'mlp', 'hidden_dims': '[256, 128]', 'dropout': 0.14255100495297224, 'batch_norm': True, 'lr': 0.0003743643270370114, 'weight_decay': 2.235262280740127e-06, 'epochs': 350, 'loss': 'mae', 'optimizer': 'adam', 'graph_mode': 'off', 'use_snp_selection': False}. Best is trial 7 with value: 0.10406888958612082.
[I 2025-12-05 15:31:32,203] Trial 46 finished with value: 0.0037426747839512655 and parameters: {'model_type': 'mlp', 'hidden_dims': '[512, 128]', 'dropout': 0.17116028537750197, 'batch_norm': False, 'lr': 0.0006296762965071455, 'weight_decay': 9.901623870409959e-07, 'epochs': 300, 'loss': 'mse', 'optimizer': 'adam', 'graph_mode': 'off', 'use_snp_selection': False}. Best is trial 7 with value: 0.10406888958612082.
[I 2025-12-05 15:31:33,570] Trial 47 finished with value: 0.07593032735993693 and parameters: {'model_type': 'mlp', 'hidden_dims': '[512, 128]', 'dropout': 0.11877662198018715, 'batch_norm': True, 'lr': 4.172105175596497e-05, 'weight_decay': 1.1185186811485385e-07, 'epochs': 99, 'loss': 'mae', 'optimizer': 'adam', 'graph_mode': 'off', 'use_snp_selection': False}. Best is trial 7 with value: 0.10406888958612082.
[I 2025-12-05 15:31:34,848] Trial 48 finished with value: 0.08071244640991788 and parameters: {'model_type': 'mlp', 'hidden_dims': '[512, 256]', 'dropout': 0.1403460462586178, 'batch_norm': True, 'lr': 0.00013962855599555294, 'weight_decay': 3.387377871384544e-07, 'epochs': 85, 'loss': 'mse', 'optimizer': 'adam', 'graph_mode': 'off', 'use_snp_selection': False}. Best is trial 7 with value: 0.10406888958612082.
[I 2025-12-05 15:31:37,434] Trial 49 finished with value: 0.08639780287691472 and parameters: {'model_type': 'mlp', 'hidden_dims': '[128, 64]', 'dropout': 0.10005903300882421, 'batch_norm': True, 'lr': 6.249426964891206e-05, 'weight_decay': 5.949651297233653e-07, 'epochs': 323, 'loss': 'mae', 'optimizer': 'adam', 'graph_mode': 'off', 'use_snp_selection': True, 'num_snps': 46888}. Best is trial 7 with value: 0.10406888958612082.
[I 2025-12-05 15:31:38,474] Trial 50 finished with value: 0.06299298842517224 and parameters: {'model_type': 'mlp', 'hidden_dims': '[512, 128]', 'dropout': 0.207679657434423, 'batch_norm': True, 'lr': 0.00039226973264603335, 'weight_decay': 1.414131081539922e-06, 'epochs': 50, 'loss': 'mse', 'optimizer': 'adam', 'graph_mode': 'off', 'use_snp_selection': False}. Best is trial 7 with value: 0.10406888958612082.
[I 2025-12-05 15:31:41,059] Trial 51 finished with value: 0.07566981038344564 and parameters: {'model_type': 'mlp', 'hidden_dims': '[512, 128]', 'dropout': 0.11642629919609453, 'batch_norm': True, 'lr': 0.000553580576649921, 'weight_decay': 1.280043884280989e-05, 'epochs': 314, 'loss': 'mae', 'optimizer': 'adam', 'graph_mode': 'off', 'use_snp_selection': False}. Best is trial 7 with value: 0.10406888958612082.
[I 2025-12-05 15:31:43,418] Trial 52 finished with value: -0.011862763895454298 and parameters: {'model_type': 'mlp', 'hidden_dims': '[512, 128]', 'dropout': 0.15796251830865193, 'batch_norm': True, 'lr': 1.0921708743861942e-06, 'weight_decay': 4.469082721329354e-06, 'epochs': 274, 'loss': 'mae', 'optimizer': 'adam', 'graph_mode': 'off', 'use_snp_selection': False}. Best is trial 7 with value: 0.10406888958612082.
[I 2025-12-05 15:31:45,934] Trial 53 finished with value: 0.06774997841325164 and parameters: {'model_type': 'mlp', 'hidden_dims': '[512, 128]', 'dropout': 0.10036307920949133, 'batch_norm': True, 'lr': 0.0002792835996790022, 'weight_decay': 1.7683715991829383e-05, 'epochs': 300, 'loss': 'mae', 'optimizer': 'adam', 'graph_mode': 'off', 'use_snp_selection': False}. Best is trial 7 with value: 0.10406888958612082.
[I 2025-12-05 15:31:48,675] Trial 54 finished with value: 0.11315491601227236 and parameters: {'model_type': 'mlp', 'hidden_dims': '[512, 256]', 'dropout': 0.17590454306462755, 'batch_norm': True, 'lr': 1.5996427798033232e-05, 'weight_decay': 3.4661422994102106e-05, 'epochs': 339, 'loss': 'mae', 'optimizer': 'adam', 'graph_mode': 'off', 'use_snp_selection': False}. Best is trial 54 with value: 0.11315491601227236.
[I 2025-12-05 15:31:51,419] Trial 55 finished with value: 0.0568852329059991 and parameters: {'model_type': 'mlp', 'hidden_dims': '[512, 256]', 'dropout': 0.18873332321731096, 'batch_norm': True, 'lr': 1.089603941468743e-05, 'weight_decay': 0.000150820927128802, 'epochs': 338, 'loss': 'mae', 'optimizer': 'adam', 'graph_mode': 'off', 'use_snp_selection': False}. Best is trial 54 with value: 0.11315491601227236.
[I 2025-12-05 15:31:54,087] Trial 56 finished with value: 0.09034631835021384 and parameters: {'model_type': 'mlp', 'hidden_dims': '[512, 256]', 'dropout': 0.13405683015528155, 'batch_norm': True, 'lr': 1.9292936517771344e-05, 'weight_decay': 3.979771311392654e-05, 'epochs': 329, 'loss': 'mae', 'optimizer': 'adam', 'graph_mode': 'off', 'use_snp_selection': False}. Best is trial 54 with value: 0.11315491601227236.
[I 2025-12-05 15:31:56,493] Trial 57 finished with value: 0.053332330095236066 and parameters: {'model_type': 'mlp', 'hidden_dims': '[512, 256]', 'dropout': 0.1774634475874117, 'batch_norm': False, 'lr': 5.643566590770766e-06, 'weight_decay': 7.436424676023944e-07, 'epochs': 285, 'loss': 'mae', 'optimizer': 'adam', 'graph_mode': 'off', 'use_snp_selection': False}. Best is trial 54 with value: 0.11315491601227236.
[I 2025-12-05 15:31:57,814] Trial 58 finished with value: 0.046780632676558964 and parameters: {'model_type': 'mlp', 'hidden_dims': '[256, 128, 64]', 'dropout': 0.23017922257820883, 'batch_norm': True, 'lr': 1.0795446007347502e-05, 'weight_decay': 2.0276671169287056e-07, 'epochs': 229, 'loss': 'mse', 'optimizer': 'adam', 'graph_mode': 'off', 'use_snp_selection': False}. Best is trial 54 with value: 0.11315491601227236.
[I 2025-12-05 15:31:59,011] Trial 59 finished with value: 0.06532213284242616 and parameters: {'model_type': 'mlp', 'hidden_dims': '[512, 256]', 'dropout': 0.1541384173208961, 'batch_norm': True, 'lr': 2.1941231505295435e-05, 'weight_decay': 2.0425555162365515e-06, 'epochs': 67, 'loss': 'mae', 'optimizer': 'adam', 'graph_mode': 'off', 'use_snp_selection': False}. Best is trial 54 with value: 0.11315491601227236.
[I 2025-12-05 15:32:00,835] Trial 60 finished with value: 0.011456271965722329 and parameters: {'model_type': 'mlp', 'hidden_dims': '[512, 64]', 'dropout': 0.25117111054947694, 'batch_norm': True, 'lr': 3.2098836632773365e-05, 'weight_decay': 6.536247063408431e-06, 'epochs': 134, 'loss': 'mae', 'optimizer': 'adam', 'graph_mode': 'off', 'use_snp_selection': True, 'num_snps': 24139}. Best is trial 54 with value: 0.11315491601227236.
[I 2025-12-05 15:32:03,541] Trial 61 finished with value: 0.03170567499219796 and parameters: {'model_type': 'mlp', 'hidden_dims': '[512, 256]', 'dropout': 0.1425861365913274, 'batch_norm': True, 'lr': 1.62847623987875e-05, 'weight_decay': 4.474855791390329e-05, 'epochs': 335, 'loss': 'mae', 'optimizer': 'adam', 'graph_mode': 'off', 'use_snp_selection': False}. Best is trial 54 with value: 0.11315491601227236.
[I 2025-12-05 15:32:06,107] Trial 62 finished with value: 0.047451952501313364 and parameters: {'model_type': 'mlp', 'hidden_dims': '[512, 256]', 'dropout': 0.13303633265463408, 'batch_norm': True, 'lr': 7.0302245585753365e-06, 'weight_decay': 6.823172912103178e-05, 'epochs': 314, 'loss': 'mae', 'optimizer': 'adam', 'graph_mode': 'off', 'use_snp_selection': False}. Best is trial 54 with value: 0.11315491601227236.
[I 2025-12-05 15:32:08,801] Trial 63 finished with value: 0.07406062095751682 and parameters: {'model_type': 'mlp', 'hidden_dims': '[512, 256]', 'dropout': 0.17298892883878061, 'batch_norm': True, 'lr': 2.077068368215516e-05, 'weight_decay': 2.2672772640717647e-05, 'epochs': 340, 'loss': 'mae', 'optimizer': 'adam', 'graph_mode': 'off', 'use_snp_selection': False}. Best is trial 54 with value: 0.11315491601227236.
[I 2025-12-05 15:32:11,381] Trial 64 finished with value: 0.09256664283344072 and parameters: {'model_type': 'mlp', 'hidden_dims': '[512, 256]', 'dropout': 0.11454074870031122, 'batch_norm': True, 'lr': 3.127252671546183e-05, 'weight_decay': 1.177910050543055e-05, 'epochs': 323, 'loss': 'mae', 'optimizer': 'adam', 'graph_mode': 'off', 'use_snp_selection': False}. Best is trial 54 with value: 0.11315491601227236.
[I 2025-12-05 15:32:13,878] Trial 65 finished with value: 0.08506821844708651 and parameters: {'model_type': 'mlp', 'hidden_dims': '[512, 256]', 'dropout': 0.11471289889467495, 'batch_norm': True, 'lr': 2.7467388374325995e-05, 'weight_decay': 3.821131500582998e-06, 'epochs': 308, 'loss': 'mae', 'optimizer': 'adam', 'graph_mode': 'off', 'use_snp_selection': False}. Best is trial 54 with value: 0.11315491601227236.
[I 2025-12-05 15:32:15,435] Trial 66 finished with value: 0.06894537722634012 and parameters: {'model_type': 'mlp', 'hidden_dims': '[256, 128]', 'dropout': 0.5668976103846965, 'batch_norm': True, 'lr': 0.0008681069598433844, 'weight_decay': 1.0228355131032145e-05, 'epochs': 343, 'loss': 'mae', 'optimizer': 'adam', 'graph_mode': 'off', 'use_snp_selection': False}. Best is trial 54 with value: 0.11315491601227236.
[I 2025-12-05 15:32:16,280] Trial 67 finished with value: 0.05356852136240727 and parameters: {'model_type': 'mlp', 'hidden_dims': '[128, 64]', 'dropout': 0.11274511359548323, 'batch_norm': True, 'lr': 3.4186906626420397e-05, 'weight_decay': 3.0159920983978934e-05, 'epochs': 159, 'loss': 'mse', 'optimizer': 'adam', 'graph_mode': 'off', 'use_snp_selection': False}. Best is trial 54 with value: 0.11315491601227236.
[I 2025-12-05 15:32:17,670] Trial 68 finished with value: 0.08111254946727006 and parameters: {'model_type': 'mlp', 'hidden_dims': '[512, 256]', 'dropout': 0.4467877880262663, 'batch_norm': False, 'lr': 5.299176576163535e-05, 'weight_decay': 7.3515885814418344e-06, 'epochs': 107, 'loss': 'mae', 'optimizer': 'adam', 'graph_mode': 'off', 'use_snp_selection': False}. Best is trial 54 with value: 0.11315491601227236.
[I 2025-12-05 15:32:18,556] Trial 69 finished with value: 0.09387602166825494 and parameters: {'model_type': 'mlp', 'hidden_dims': '[256, 128, 64]', 'dropout': 0.1526310919635266, 'batch_norm': True, 'lr': 0.00013398370399547266, 'weight_decay': 1.1898110300230983e-05, 'epochs': 74, 'loss': 'mae', 'optimizer': 'adam', 'graph_mode': 'off', 'use_snp_selection': False}. Best is trial 54 with value: 0.11315491601227236.
[I 2025-12-05 15:32:19,447] Trial 70 finished with value: 0.046272623274039595 and parameters: {'model_type': 'mlp', 'hidden_dims': '[256, 128, 64]', 'dropout': 0.21690436047423522, 'batch_norm': True, 'lr': 8.486815907138683e-05, 'weight_decay': 7.52533629081234e-05, 'epochs': 73, 'loss': 'mae', 'optimizer': 'adam', 'graph_mode': 'off', 'use_snp_selection': False}. Best is trial 54 with value: 0.11315491601227236.
[I 2025-12-05 15:32:20,299] Trial 71 finished with value: 0.09401969563861114 and parameters: {'model_type': 'mlp', 'hidden_dims': '[256, 128, 64]', 'dropout': 0.15176320615055178, 'batch_norm': True, 'lr': 0.0001182722243874839, 'weight_decay': 1.1982014875456212e-05, 'epochs': 61, 'loss': 'mae', 'optimizer': 'adam', 'graph_mode': 'off', 'use_snp_selection': False}. Best is trial 54 with value: 0.11315491601227236.
