[I 2025-12-05 14:28:15,730] Trial 105 finished with value: 0.09460118091888553 and parameters: {'model_type': 'mlp', 'hidden_dims': '[128, 64]', 'dropout': 0.18859731356117454, 'batch_norm': False, 'lr': 4.936371661780476e-06, 'weight_decay': 0.0004139504838752587, 'epochs': 209, 'loss': 'mse', 'optimizer': 'adam', 'graph_mode': 'off', 'use_snp_selection': False}. Best is trial 32 with value: 0.13515378067215644.
[I 2025-12-05 14:28:17,566] Trial 106 finished with value: 0.12470228901191607 and parameters: {'model_type': 'mlp', 'hidden_dims': '[512, 128]', 'dropout': 0.15228180213640896, 'batch_norm': False, 'lr': 0.00019988901800090277, 'weight_decay': 0.0002616538782184123, 'epochs': 243, 'loss': 'mse', 'optimizer': 'adam', 'graph_mode': 'off', 'use_snp_selection': False}. Best is trial 32 with value: 0.13515378067215644.
[I 2025-12-05 14:28:19,481] Trial 107 finished with value: 0.10734141678095484 and parameters: {'model_type': 'mlp', 'hidden_dims': '[512, 128]', 'dropout': 0.15532813052146283, 'batch_norm': False, 'lr': 0.00036717459761156685, 'weight_decay': 0.00023025455412962667, 'epochs': 261, 'loss': 'mse', 'optimizer': 'adam', 'graph_mode': 'off', 'use_snp_selection': False}. Best is trial 32 with value: 0.13515378067215644.
[I 2025-12-05 14:28:20,682] Trial 108 finished with value: 0.12373600953717329 and parameters: {'model_type': 'mlp', 'hidden_dims': '[512, 128]', 'dropout': 0.13496407166444324, 'batch_norm': False, 'lr': 0.00026957312041728395, 'weight_decay': 0.0003872748710123207, 'epochs': 235, 'loss': 'mse', 'optimizer': 'adam', 'graph_mode': 'off', 'use_snp_selection': True, 'num_snps': 11322}. Best is trial 32 with value: 0.13515378067215644.
[I 2025-12-05 14:28:22,009] Trial 109 finished with value: 0.12028537364199184 and parameters: {'model_type': 'mlp', 'hidden_dims': '[512, 128]', 'dropout': 0.13733902098814993, 'batch_norm': False, 'lr': 0.000273409173787422, 'weight_decay': 0.0001839645599120764, 'epochs': 252, 'loss': 'mse', 'optimizer': 'adam', 'graph_mode': 'off', 'use_snp_selection': True, 'num_snps': 14568}. Best is trial 32 with value: 0.13515378067215644.
[I 2025-12-05 14:28:23,880] Trial 110 finished with value: 0.10405108933817424 and parameters: {'model_type': 'mlp', 'hidden_dims': '[512, 128]', 'dropout': 0.11122370102286769, 'batch_norm': False, 'lr': 0.0002203485053198804, 'weight_decay': 0.0003406633489998094, 'epochs': 241, 'loss': 'mse', 'optimizer': 'adam', 'graph_mode': 'off', 'use_snp_selection': True, 'num_snps': 26467}. Best is trial 32 with value: 0.13515378067215644.
[I 2025-12-05 14:28:25,604] Trial 111 finished with value: 0.04141144647836473 and parameters: {'model_type': 'mlp', 'hidden_dims': '[512, 128]', 'dropout': 0.14881927726174224, 'batch_norm': False, 'lr': 0.0005294109538115258, 'weight_decay': 0.0006387667073120999, 'epochs': 217, 'loss': 'mse', 'optimizer': 'adam', 'graph_mode': 'off', 'use_snp_selection': False}. Best is trial 32 with value: 0.13515378067215644.
[I 2025-12-05 14:28:26,753] Trial 112 finished with value: 0.12074275871057792 and parameters: {'model_type': 'mlp', 'hidden_dims': '[512, 128]', 'dropout': 0.17940050678735198, 'batch_norm': False, 'lr': 0.00018551904205653134, 'weight_decay': 0.0002938956120859524, 'epochs': 232, 'loss': 'mse', 'optimizer': 'adam', 'graph_mode': 'off', 'use_snp_selection': True, 'num_snps': 9689}. Best is trial 32 with value: 0.13515378067215644.
[I 2025-12-05 14:28:28,861] Trial 113 finished with value: 0.12589030778065732 and parameters: {'model_type': 'mlp', 'hidden_dims': '[512, 128]', 'dropout': 0.1367350565713854, 'batch_norm': False, 'lr': 0.00010924137471335817, 'weight_decay': 0.0009548317215985565, 'epochs': 246, 'loss': 'mse', 'optimizer': 'adam', 'graph_mode': 'off', 'use_snp_selection': True, 'num_snps': 31230}. Best is trial 32 with value: 0.13515378067215644.
[I 2025-12-05 14:28:31,246] Trial 114 finished with value: 0.13368031286666718 and parameters: {'model_type': 'mlp', 'hidden_dims': '[512, 128]', 'dropout': 0.1353422196279095, 'batch_norm': False, 'lr': 0.00016476329166011482, 'weight_decay': 0.0009326309136311524, 'epochs': 260, 'loss': 'mse', 'optimizer': 'adam', 'graph_mode': 'off', 'use_snp_selection': True, 'num_snps': 36383}. Best is trial 32 with value: 0.13515378067215644.
[I 2025-12-05 14:28:33,643] Trial 115 finished with value: 0.1000165700271028 and parameters: {'model_type': 'mlp', 'hidden_dims': '[512, 128]', 'dropout': 0.13323129979816423, 'batch_norm': False, 'lr': 0.0002213918721111955, 'weight_decay': 0.0009392229104843167, 'epochs': 268, 'loss': 'mse', 'optimizer': 'adam', 'graph_mode': 'off', 'use_snp_selection': True, 'num_snps': 36504}. Best is trial 32 with value: 0.13515378067215644.
[I 2025-12-05 14:28:35,755] Trial 116 finished with value: 0.11268877405767874 and parameters: {'model_type': 'mlp', 'hidden_dims': '[512, 128]', 'dropout': 0.12569908964190993, 'batch_norm': False, 'lr': 0.00016781693062574877, 'weight_decay': 0.0003938730874004402, 'epochs': 286, 'loss': 'mse', 'optimizer': 'adam', 'graph_mode': 'off', 'use_snp_selection': True, 'num_snps': 29504}. Best is trial 32 with value: 0.13515378067215644.
[I 2025-12-05 14:28:38,148] Trial 117 finished with value: 0.10816750917930544 and parameters: {'model_type': 'mlp', 'hidden_dims': '[512, 128]', 'dropout': 0.16425778081300413, 'batch_norm': False, 'lr': 0.00035363057393799323, 'weight_decay': 0.0005396768335005442, 'epochs': 238, 'loss': 'mse', 'optimizer': 'adam', 'graph_mode': 'off', 'use_snp_selection': True, 'num_snps': 37653}. Best is trial 32 with value: 0.13515378067215644.
[I 2025-12-05 14:28:40,271] Trial 118 finished with value: 0.09979294255191591 and parameters: {'model_type': 'mlp', 'hidden_dims': '[512, 128]', 'dropout': 0.5990127129355303, 'batch_norm': False, 'lr': 0.00026928173464431143, 'weight_decay': 0.0006343175738374366, 'epochs': 244, 'loss': 'mse', 'optimizer': 'adam', 'graph_mode': 'off', 'use_snp_selection': True, 'num_snps': 32001}. Best is trial 32 with value: 0.13515378067215644.
[I 2025-12-05 14:28:42,808] Trial 119 finished with value: 0.09925064383969134 and parameters: {'model_type': 'mlp', 'hidden_dims': '[512, 128]', 'dropout': 0.14449589531292134, 'batch_norm': True, 'lr': 0.00011290640629878625, 'weight_decay': 0.0009025685717473068, 'epochs': 246, 'loss': 'mse', 'optimizer': 'adam', 'graph_mode': 'off', 'use_snp_selection': True, 'num_snps': 39970}. Best is trial 32 with value: 0.13515378067215644.
[I 2025-12-05 14:28:44,717] Trial 120 finished with value: 0.12413212657612993 and parameters: {'model_type': 'mlp', 'hidden_dims': '[512, 128]', 'dropout': 0.10705599318533585, 'batch_norm': False, 'lr': 0.00042321471869751994, 'weight_decay': 0.0002498036391475599, 'epochs': 257, 'loss': 'mse', 'optimizer': 'adam', 'graph_mode': 'off', 'use_snp_selection': True, 'num_snps': 27007}. Best is trial 32 with value: 0.13515378067215644.
[I 2025-12-05 14:28:46,567] Trial 121 finished with value: 0.11216309303655708 and parameters: {'model_type': 'mlp', 'hidden_dims': '[512, 128]', 'dropout': 0.10001592310683684, 'batch_norm': False, 'lr': 0.00045861869166743437, 'weight_decay': 0.00025535337571150373, 'epochs': 260, 'loss': 'mse', 'optimizer': 'adam', 'graph_mode': 'off', 'use_snp_selection': True, 'num_snps': 25659}. Best is trial 32 with value: 0.13515378067215644.
[I 2025-12-05 14:28:49,641] Trial 122 finished with value: 0.12487801525497207 and parameters: {'model_type': 'mlp', 'hidden_dims': '[512, 128]', 'dropout': 0.1110213423078119, 'batch_norm': False, 'lr': 0.000664685273255838, 'weight_decay': 0.0007309297038818919, 'epochs': 272, 'loss': 'mse', 'optimizer': 'adam', 'graph_mode': 'off', 'use_snp_selection': True, 'num_snps': 49145}. Best is trial 32 with value: 0.13515378067215644.
[I 2025-12-05 14:28:52,941] Trial 123 finished with value: 0.037962139253477425 and parameters: {'model_type': 'mlp', 'hidden_dims': '[512, 128]', 'dropout': 0.4859714770707927, 'batch_norm': False, 'lr': 0.0005493428733513858, 'weight_decay': 0.0007558188216203851, 'epochs': 299, 'loss': 'mse', 'optimizer': 'adam', 'graph_mode': 'off', 'use_snp_selection': True, 'num_snps': 52234}. Best is trial 32 with value: 0.13515378067215644.
[I 2025-12-05 14:28:56,076] Trial 124 finished with value: 0.07204843385321766 and parameters: {'model_type': 'mlp', 'hidden_dims': '[512, 128]', 'dropout': 0.10990589865459924, 'batch_norm': False, 'lr': 0.000975087906288131, 'weight_decay': 0.0003820128334460579, 'epochs': 275, 'loss': 'mse', 'optimizer': 'adam', 'graph_mode': 'off', 'use_snp_selection': True, 'num_snps': 50436}. Best is trial 32 with value: 0.13515378067215644.
[I 2025-12-05 14:28:58,290] Trial 125 finished with value: 0.12099704248927814 and parameters: {'model_type': 'mlp', 'hidden_dims': '[512, 128]', 'dropout': 0.11898053694487556, 'batch_norm': False, 'lr': 0.0006341325542232385, 'weight_decay': 0.00018765694466468778, 'epochs': 266, 'loss': 'mse', 'optimizer': 'adam', 'graph_mode': 'off', 'use_snp_selection': True, 'num_snps': 32650}. Best is trial 32 with value: 0.13515378067215644.
[I 2025-12-05 14:29:01,027] Trial 126 finished with value: 0.07798076949752772 and parameters: {'model_type': 'mlp', 'hidden_dims': '[512, 128]', 'dropout': 0.13511101641946696, 'batch_norm': False, 'lr': 0.0006841679421545867, 'weight_decay': 0.0004654805433492879, 'epochs': 281, 'loss': 'mse', 'optimizer': 'adam', 'graph_mode': 'off', 'use_snp_selection': True, 'num_snps': 41674}. Best is trial 32 with value: 0.13515378067215644.
[I 2025-12-05 14:29:04,213] Trial 127 finished with value: 0.11921232817158121 and parameters: {'model_type': 'mlp', 'hidden_dims': '[512, 128]', 'dropout': 0.11005260740177555, 'batch_norm': False, 'lr': 0.0004180473738626534, 'weight_decay': 0.0005202958652455421, 'epochs': 254, 'loss': 'mae', 'optimizer': 'adam', 'graph_mode': 'off', 'use_snp_selection': True, 'num_snps': 52886}. Best is trial 32 with value: 0.13515378067215644.
[I 2025-12-05 14:29:06,135] Trial 128 finished with value: 0.11772084549922475 and parameters: {'model_type': 'mlp', 'hidden_dims': '[512, 128]', 'dropout': 0.13016434314514225, 'batch_norm': False, 'lr': 0.0003427440335645091, 'weight_decay': 0.0007382836979908134, 'epochs': 223, 'loss': 'mse', 'optimizer': 'adam', 'graph_mode': 'off', 'use_snp_selection': True, 'num_snps': 27901}. Best is trial 32 with value: 0.13515378067215644.
[I 2025-12-05 14:29:07,628] Trial 129 finished with value: 0.11660130011661164 and parameters: {'model_type': 'mlp', 'hidden_dims': '[512, 128]', 'dropout': 0.15179549508633677, 'batch_norm': False, 'lr': 0.00020676074257428974, 'weight_decay': 0.0006108812654633381, 'epochs': 262, 'loss': 'mse', 'optimizer': 'adam', 'graph_mode': 'off', 'use_snp_selection': True, 'num_snps': 17824}. Best is trial 32 with value: 0.13515378067215644.
[I 2025-12-05 14:29:08,817] Trial 130 finished with value: 0.11404840432918552 and parameters: {'model_type': 'mlp', 'hidden_dims': '[512, 128]', 'dropout': 0.14120992147173714, 'batch_norm': False, 'lr': 0.00024019047331957894, 'weight_decay': 0.00024033210921659863, 'epochs': 235, 'loss': 'mse', 'optimizer': 'adam', 'graph_mode': 'off', 'use_snp_selection': True, 'num_snps': 10022}. Best is trial 32 with value: 0.13515378067215644.
[I 2025-12-05 14:29:11,150] Trial 131 finished with value: 0.11574500992276548 and parameters: {'model_type': 'mlp', 'hidden_dims': '[512, 128]', 'dropout': 0.12114687668303756, 'batch_norm': False, 'lr': 0.0002975260956647417, 'weight_decay': 0.0001387338285969848, 'epochs': 248, 'loss': 'mse', 'optimizer': 'adam', 'graph_mode': 'off', 'use_snp_selection': True, 'num_snps': 35774}. Best is trial 32 with value: 0.13515378067215644.
[I 2025-12-05 14:29:12,498] Trial 132 finished with value: 0.09503710033729587 and parameters: {'model_type': 'mlp', 'hidden_dims': '[256, 128]', 'dropout': 0.16442032788949681, 'batch_norm': False, 'lr': 0.00012889297135439698, 'weight_decay': 0.0009005533360908027, 'epochs': 54, 'loss': 'mse', 'optimizer': 'adam', 'graph_mode': 'off', 'use_snp_selection': True, 'num_snps': 23344}. Best is trial 32 with value: 0.13515378067215644.
[I 2025-12-05 14:29:14,611] Trial 133 finished with value: 0.11921144413650255 and parameters: {'model_type': 'mlp', 'hidden_dims': '[128, 64]', 'dropout': 0.10656381179706262, 'batch_norm': False, 'lr': 0.0001669098525483155, 'weight_decay': 0.00036115148548856237, 'epochs': 237, 'loss': 'mse', 'optimizer': 'adam', 'graph_mode': 'off', 'use_snp_selection': True, 'num_snps': 42939}. Best is trial 32 with value: 0.13515378067215644.
[I 2025-12-05 14:29:16,846] Trial 134 finished with value: 0.09714361131707744 and parameters: {'model_type': 'mlp', 'hidden_dims': '[512, 256]', 'dropout': 0.12677353451439635, 'batch_norm': False, 'lr': 0.0007688409224553739, 'weight_decay': 0.00046333981581256594, 'epochs': 270, 'loss': 'mse', 'optimizer': 'adam', 'graph_mode': 'off', 'use_snp_selection': True, 'num_snps': 32764}. Best is trial 32 with value: 0.13515378067215644.
[I 2025-12-05 14:29:19,784] Trial 135 finished with value: 0.11429241061388201 and parameters: {'model_type': 'mlp', 'hidden_dims': '[512, 128]', 'dropout': 0.15584295245726265, 'batch_norm': False, 'lr': 0.0002628929759598578, 'weight_decay': 0.00027758739327570035, 'epochs': 259, 'loss': 'mse', 'optimizer': 'adam', 'graph_mode': 'off', 'use_snp_selection': True, 'num_snps': 47570}. Best is trial 32 with value: 0.13515378067215644.
[I 2025-12-05 14:29:21,120] Trial 136 finished with value: 0.08268373559451087 and parameters: {'model_type': 'mlp', 'hidden_dims': '[128, 64]', 'dropout': 0.13953088894553795, 'batch_norm': False, 'lr': 7.5892451342264675e-06, 'weight_decay': 0.0006873252048126586, 'epochs': 279, 'loss': 'mse', 'optimizer': 'adam', 'graph_mode': 'off', 'use_snp_selection': True, 'num_snps': 15410}. Best is trial 32 with value: 0.13515378067215644.
[I 2025-12-05 14:29:23,614] Trial 137 finished with value: 0.106230007117804 and parameters: {'model_type': 'mlp', 'hidden_dims': '[128, 64]', 'dropout': 0.11166626240910463, 'batch_norm': False, 'lr': 7.19244327964513e-05, 'weight_decay': 0.0005492712275299054, 'epochs': 254, 'loss': 'mse', 'optimizer': 'adam', 'graph_mode': 'off', 'use_snp_selection': True, 'num_snps': 54593}. Best is trial 32 with value: 0.13515378067215644.
[I 2025-12-05 14:29:24,632] Trial 138 finished with value: 0.08695158915863233 and parameters: {'model_type': 'mlp', 'hidden_dims': '[512, 128]', 'dropout': 0.17424951476560976, 'batch_norm': False, 'lr': 0.00018747165135811142, 'weight_decay': 0.0008270506685272552, 'epochs': 243, 'loss': 'mse', 'optimizer': 'adam', 'graph_mode': 'off', 'use_snp_selection': True, 'num_snps': 5596}. Best is trial 32 with value: 0.13515378067215644.
[I 2025-12-05 14:29:25,618] Trial 139 finished with value: 0.0946838612323929 and parameters: {'model_type': 'mlp', 'hidden_dims': '[128, 64]', 'dropout': 0.11924658691791859, 'batch_norm': False, 'lr': 2.0169990561834726e-05, 'weight_decay': 0.0009692313753301833, 'epochs': 300, 'loss': 'mse', 'optimizer': 'adam', 'graph_mode': 'off', 'use_snp_selection': False}. Best is trial 32 with value: 0.13515378067215644.
[I 2025-12-05 14:29:26,517] Trial 140 finished with value: 0.10068364485841408 and parameters: {'model_type': 'mlp', 'hidden_dims': '[128, 64]', 'dropout': 0.14570655827059098, 'batch_norm': True, 'lr': 1.526341352159201e-05, 'weight_decay': 4.0700590559968115e-05, 'epochs': 227, 'loss': 'mse', 'optimizer': 'adam', 'graph_mode': 'off', 'use_snp_selection': False}. Best is trial 32 with value: 0.13515378067215644.
[I 2025-12-05 14:29:28,014] Trial 141 finished with value: 0.0992081391477968 and parameters: {'model_type': 'mlp', 'hidden_dims': '[512, 128]', 'dropout': 0.18351762547424716, 'batch_norm': False, 'lr': 0.00012696766665977027, 'weight_decay': 0.0002052453682060531, 'epochs': 166, 'loss': 'mse', 'optimizer': 'adam', 'graph_mode': 'off', 'use_snp_selection': False}. Best is trial 32 with value: 0.13515378067215644.
[I 2025-12-05 14:29:28,818] Trial 142 finished with value: 0.08605163157191574 and parameters: {'model_type': 'mlp', 'hidden_dims': '[128, 64]', 'dropout': 0.20020140605107328, 'batch_norm': False, 'lr': 0.0001524574573350273, 'weight_decay': 1.5002758491793316e-05, 'epochs': 160, 'loss': 'mse', 'optimizer': 'adam', 'graph_mode': 'off', 'use_snp_selection': False}. Best is trial 32 with value: 0.13515378067215644.
[I 2025-12-05 14:29:29,823] Trial 143 finished with value: 0.10318348250239921 and parameters: {'model_type': 'mlp', 'hidden_dims': '[256, 128, 64]', 'dropout': 0.10030353822777116, 'batch_norm': False, 'lr': 8.176854665752058e-05, 'weight_decay': 0.0004459844224197001, 'epochs': 150, 'loss': 'mse', 'optimizer': 'adam', 'graph_mode': 'off', 'use_snp_selection': False}. Best is trial 32 with value: 0.13515378067215644.
[I 2025-12-05 14:29:30,779] Trial 144 finished with value: 0.11210578169785733 and parameters: {'model_type': 'mlp', 'hidden_dims': '[256, 128]', 'dropout': 0.16560451455353103, 'batch_norm': False, 'lr': 0.00010044579216643713, 'weight_decay': 0.0005743726609211513, 'epochs': 133, 'loss': 'mse', 'optimizer': 'adam', 'graph_mode': 'off', 'use_snp_selection': False}. Best is trial 32 with value: 0.13515378067215644.
[I 2025-12-05 14:29:32,321] Trial 145 finished with value: 0.10670414879448943 and parameters: {'model_type': 'mlp', 'hidden_dims': '[512, 128]', 'dropout': 0.1329685004122276, 'batch_norm': False, 'lr': 2.7292017004972682e-05, 'weight_decay': 0.00010630348351529679, 'epochs': 177, 'loss': 'mse', 'optimizer': 'adam', 'graph_mode': 'off', 'use_snp_selection': False}. Best is trial 32 with value: 0.13515378067215644.
[I 2025-12-05 14:29:33,029] Trial 146 finished with value: 0.11577483982036527 and parameters: {'model_type': 'mlp', 'hidden_dims': '[128, 64]', 'dropout': 0.15276306602114517, 'batch_norm': False, 'lr': 0.00015235312141526116, 'weight_decay': 2.729633514589879e-05, 'epochs': 101, 'loss': 'mse', 'optimizer': 'adam', 'graph_mode': 'off', 'use_snp_selection': False}. Best is trial 32 with value: 0.13515378067215644.
[I 2025-12-05 14:29:34,010] Trial 147 finished with value: 0.12477534290821733 and parameters: {'model_type': 'mlp', 'hidden_dims': '[128, 64]', 'dropout': 0.1264748508899166, 'batch_norm': False, 'lr': 0.00019726121992382463, 'weight_decay': 2.054341495217473e-05, 'epochs': 294, 'loss': 'mse', 'optimizer': 'adam', 'graph_mode': 'off', 'use_snp_selection': False}. Best is trial 32 with value: 0.13515378067215644.
[I 2025-12-05 14:29:35,005] Trial 148 finished with value: 0.1322185404603649 and parameters: {'model_type': 'mlp', 'hidden_dims': '[128, 64]', 'dropout': 0.12635045545511914, 'batch_norm': False, 'lr': 0.00018840476062583335, 'weight_decay': 1.817804277860866e-05, 'epochs': 308, 'loss': 'mae', 'optimizer': 'adam', 'graph_mode': 'off', 'use_snp_selection': False}. Best is trial 32 with value: 0.13515378067215644.
[I 2025-12-05 14:29:35,995] Trial 149 finished with value: 0.1124491663543801 and parameters: {'model_type': 'mlp', 'hidden_dims': '[128, 64]', 'dropout': 0.12038880233240937, 'batch_norm': False, 'lr': 0.00019550673476027283, 'weight_decay': 1.8018728656570153e-05, 'epochs': 301, 'loss': 'mse', 'optimizer': 'adam', 'graph_mode': 'off', 'use_snp_selection': False}. Best is trial 32 with value: 0.13515378067215644.
[I 2025-12-05 14:29:38,228] Trial 0 finished with value: 0.04436415675312953 and parameters: {'model_type': 'mlp', 'hidden_dims': '[128, 64]', 'dropout': 0.199031432379812, 'batch_norm': True, 'lr': 1.8408544111075837e-06, 'weight_decay': 5.5136510071208614e-05, 'epochs': 336, 'loss': 'mae', 'optimizer': 'adam', 'graph_mode': 'off', 'use_snp_selection': True, 'num_snps': 43862}. Best is trial 0 with value: 0.04436415675312953.
[I 2025-12-05 14:29:39,355] Trial 1 finished with value: 0.07331159524622775 and parameters: {'model_type': 'mlp', 'hidden_dims': '[256, 128]', 'dropout': 0.4370668075331726, 'batch_norm': True, 'lr': 7.133471581159139e-05, 'weight_decay': 1.128633586803549e-05, 'epochs': 242, 'loss': 'mae', 'optimizer': 'adam', 'graph_mode': 'off', 'use_snp_selection': False}. Best is trial 1 with value: 0.07331159524622775.
[I 2025-12-05 14:29:40,373] Trial 2 finished with value: 0.034060569245151766 and parameters: {'model_type': 'mlp', 'hidden_dims': '[256, 128, 64]', 'dropout': 0.41314357415569625, 'batch_norm': False, 'lr': 3.952233718592101e-06, 'weight_decay': 0.00026754769258252603, 'epochs': 149, 'loss': 'mse', 'optimizer': 'adam', 'graph_mode': 'off', 'use_snp_selection': True, 'num_snps': 11571}. Best is trial 1 with value: 0.07331159524622775.
[I 2025-12-05 14:29:42,331] Trial 3 finished with value: 0.060220702788645566 and parameters: {'model_type': 'mlp', 'hidden_dims': '[512, 64]', 'dropout': 0.5938127374509361, 'batch_norm': False, 'lr': 5.67704586114731e-06, 'weight_decay': 2.4518087630137052e-05, 'epochs': 320, 'loss': 'mae', 'optimizer': 'adam', 'graph_mode': 'off', 'use_snp_selection': False}. Best is trial 1 with value: 0.07331159524622775.
[I 2025-12-05 14:29:44,555] Trial 4 finished with value: 0.023757545706595717 and parameters: {'model_type': 'mlp', 'hidden_dims': '[512, 128]', 'dropout': 0.25746343592134413, 'batch_norm': True, 'lr': 1.3467657668402788e-06, 'weight_decay': 0.00033087251918647806, 'epochs': 277, 'loss': 'mse', 'optimizer': 'adam', 'graph_mode': 'off', 'use_snp_selection': True, 'num_snps': 36675}. Best is trial 1 with value: 0.07331159524622775.
[I 2025-12-05 14:29:46,343] Trial 5 finished with value: 0.04854319736905761 and parameters: {'model_type': 'mlp', 'hidden_dims': '[512, 64]', 'dropout': 0.38275350994408375, 'batch_norm': True, 'lr': 1.5586664309232824e-06, 'weight_decay': 0.0008227664668621182, 'epochs': 145, 'loss': 'mae', 'optimizer': 'adam', 'graph_mode': 'off', 'use_snp_selection': True, 'num_snps': 32148}. Best is trial 1 with value: 0.07331159524622775.
