[I 2025-12-05 16:19:22,777] Trial 59 finished with value: 0.1134181597787072 and parameters: {'model_type': 'mlp', 'hidden_dims': '[512, 256]', 'dropout': 0.287230589791427, 'batch_norm': True, 'lr': 6.577642536256512e-05, 'weight_decay': 2.084699850825113e-06, 'epochs': 99, 'loss': 'mae', 'optimizer': 'adam', 'graph_mode': 'off', 'use_snp_selection': True, 'num_snps': 28180}. Best is trial 7 with value: 0.134119187901134.
[I 2025-12-05 16:19:23,835] Trial 60 finished with value: 0.11488728921526487 and parameters: {'model_type': 'mlp', 'hidden_dims': '[512, 64]', 'dropout': 0.10082045520301008, 'batch_norm': True, 'lr': 9.984755822915463e-05, 'weight_decay': 7.852622686956536e-06, 'epochs': 120, 'loss': 'mse', 'optimizer': 'adam', 'graph_mode': 'off', 'use_snp_selection': True, 'num_snps': 14315}. Best is trial 7 with value: 0.134119187901134.
[I 2025-12-05 16:19:25,277] Trial 61 finished with value: 0.12101074470422063 and parameters: {'model_type': 'mlp', 'hidden_dims': '[512, 128]', 'dropout': 0.13831429383077368, 'batch_norm': True, 'lr': 0.00027566440031779373, 'weight_decay': 2.9596690111412885e-07, 'epochs': 187, 'loss': 'mse', 'optimizer': 'adam', 'graph_mode': 'off', 'use_snp_selection': False}. Best is trial 7 with value: 0.134119187901134.
[I 2025-12-05 16:19:26,002] Trial 62 finished with value: 0.11729964640841789 and parameters: {'model_type': 'mlp', 'hidden_dims': '[128, 64]', 'dropout': 0.15925276088567536, 'batch_norm': True, 'lr': 0.00016526573352741817, 'weight_decay': 2.049328812442616e-07, 'epochs': 142, 'loss': 'mse', 'optimizer': 'adam', 'graph_mode': 'off', 'use_snp_selection': False}. Best is trial 7 with value: 0.134119187901134.
[I 2025-12-05 16:19:27,112] Trial 63 finished with value: 0.13460179510085787 and parameters: {'model_type': 'mlp', 'hidden_dims': '[512, 256]', 'dropout': 0.12111969401138631, 'batch_norm': True, 'lr': 0.00013436773355341024, 'weight_decay': 2.6034826319604665e-07, 'epochs': 112, 'loss': 'mse', 'optimizer': 'adam', 'graph_mode': 'off', 'use_snp_selection': False}. Best is trial 63 with value: 0.13460179510085787.
[I 2025-12-05 16:19:28,185] Trial 64 finished with value: 0.12248143157246943 and parameters: {'model_type': 'mlp', 'hidden_dims': '[512, 256]', 'dropout': 0.2241333966235172, 'batch_norm': True, 'lr': 0.00022512057978058036, 'weight_decay': 3.6624524946835015e-07, 'epochs': 109, 'loss': 'mse', 'optimizer': 'adam', 'graph_mode': 'off', 'use_snp_selection': False}. Best is trial 63 with value: 0.13460179510085787.
[I 2025-12-05 16:19:29,132] Trial 65 finished with value: 0.12528246119639538 and parameters: {'model_type': 'mlp', 'hidden_dims': '[512, 256]', 'dropout': 0.11502691445744233, 'batch_norm': True, 'lr': 0.0003561872277410906, 'weight_decay': 2.2508025336043972e-07, 'epochs': 76, 'loss': 'mse', 'optimizer': 'adam', 'graph_mode': 'off', 'use_snp_selection': False}. Best is trial 63 with value: 0.13460179510085787.
[I 2025-12-05 16:19:31,628] Trial 66 finished with value: 0.12612615869450966 and parameters: {'model_type': 'mlp', 'hidden_dims': '[512, 256]', 'dropout': 0.1817645693308708, 'batch_norm': True, 'lr': 0.00012277807333552847, 'weight_decay': 1.398113911635108e-07, 'epochs': 88, 'loss': 'mse', 'optimizer': 'adam', 'graph_mode': 'off', 'use_snp_selection': True, 'num_snps': 53272}. Best is trial 63 with value: 0.13460179510085787.
[I 2025-12-05 16:19:32,872] Trial 67 finished with value: 0.07551547429684186 and parameters: {'model_type': 'mlp', 'hidden_dims': '[512, 256]', 'dropout': 0.20228922772767843, 'batch_norm': True, 'lr': 3.608071076629891e-05, 'weight_decay': 6.781022521649117e-07, 'epochs': 131, 'loss': 'mse', 'optimizer': 'adam', 'graph_mode': 'off', 'use_snp_selection': False}. Best is trial 63 with value: 0.13460179510085787.
[I 2025-12-05 16:19:33,776] Trial 68 finished with value: 0.02604538060205631 and parameters: {'model_type': 'mlp', 'hidden_dims': '[512, 128]', 'dropout': 0.5227194869665266, 'batch_norm': False, 'lr': 0.0009897487037099598, 'weight_decay': 9.589603419507435e-05, 'epochs': 66, 'loss': 'mae', 'optimizer': 'adam', 'graph_mode': 'off', 'use_snp_selection': False}. Best is trial 63 with value: 0.13460179510085787.
[I 2025-12-05 16:19:34,812] Trial 69 finished with value: 0.135331097196207 and parameters: {'model_type': 'mlp', 'hidden_dims': '[512, 256]', 'dropout': 0.14019906486546319, 'batch_norm': True, 'lr': 8.944936632895098e-05, 'weight_decay': 9.770832444557979e-07, 'epochs': 100, 'loss': 'mse', 'optimizer': 'adam', 'graph_mode': 'off', 'use_snp_selection': False}. Best is trial 69 with value: 0.135331097196207.
[I 2025-12-05 16:19:35,875] Trial 70 finished with value: 0.11119224683003408 and parameters: {'model_type': 'mlp', 'hidden_dims': '[512, 256]', 'dropout': 0.13553596388297456, 'batch_norm': True, 'lr': 9.58624317544247e-05, 'weight_decay': 9.59018698861419e-07, 'epochs': 96, 'loss': 'mse', 'optimizer': 'adam', 'graph_mode': 'off', 'use_snp_selection': False}. Best is trial 69 with value: 0.135331097196207.
[I 2025-12-05 16:19:37,011] Trial 71 finished with value: 0.11704304142641196 and parameters: {'model_type': 'mlp', 'hidden_dims': '[512, 256]', 'dropout': 0.11493332329112368, 'batch_norm': True, 'lr': 7.066756699981128e-05, 'weight_decay': 1.526218212563814e-06, 'epochs': 115, 'loss': 'mse', 'optimizer': 'adam', 'graph_mode': 'off', 'use_snp_selection': False}. Best is trial 69 with value: 0.135331097196207.
[I 2025-12-05 16:19:37,890] Trial 72 finished with value: 0.09309225664207464 and parameters: {'model_type': 'mlp', 'hidden_dims': '[512, 256]', 'dropout': 0.5984760164748781, 'batch_norm': True, 'lr': 0.00018663320321264106, 'weight_decay': 4.851020735792906e-07, 'epochs': 50, 'loss': 'mse', 'optimizer': 'adam', 'graph_mode': 'off', 'use_snp_selection': False}. Best is trial 69 with value: 0.135331097196207.
[I 2025-12-05 16:19:38,667] Trial 73 finished with value: 0.1229654055761418 and parameters: {'model_type': 'mlp', 'hidden_dims': '[256, 128]', 'dropout': 0.1628251009756376, 'batch_norm': True, 'lr': 5.1268299280170265e-05, 'weight_decay': 3.539624464572762e-07, 'epochs': 99, 'loss': 'mse', 'optimizer': 'adam', 'graph_mode': 'off', 'use_snp_selection': False}. Best is trial 69 with value: 0.135331097196207.
[I 2025-12-05 16:19:39,644] Trial 74 finished with value: 0.1303947519305379 and parameters: {'model_type': 'mlp', 'hidden_dims': '[512, 256]', 'dropout': 0.13352766375293773, 'batch_norm': True, 'lr': 0.00013222830521567987, 'weight_decay': 5.507600837718461e-07, 'epochs': 84, 'loss': 'mse', 'optimizer': 'adam', 'graph_mode': 'off', 'use_snp_selection': False}. Best is trial 69 with value: 0.135331097196207.
[I 2025-12-05 16:19:40,642] Trial 75 finished with value: 0.12615184628870718 and parameters: {'model_type': 'mlp', 'hidden_dims': '[512, 256]', 'dropout': 0.14707586887628374, 'batch_norm': True, 'lr': 0.00012962410041978962, 'weight_decay': 9.845141041554214e-07, 'epochs': 79, 'loss': 'mse', 'optimizer': 'adam', 'graph_mode': 'off', 'use_snp_selection': False}. Best is trial 69 with value: 0.135331097196207.
[I 2025-12-05 16:19:41,668] Trial 76 finished with value: 0.10734483933694985 and parameters: {'model_type': 'mlp', 'hidden_dims': '[512, 256]', 'dropout': 0.12979831208171924, 'batch_norm': True, 'lr': 7.98081114510446e-05, 'weight_decay': 5.359529043049358e-07, 'epochs': 87, 'loss': 'mse', 'optimizer': 'adam', 'graph_mode': 'off', 'use_snp_selection': False}. Best is trial 69 with value: 0.135331097196207.
[I 2025-12-05 16:19:42,593] Trial 77 finished with value: 0.10165062614211773 and parameters: {'model_type': 'mlp', 'hidden_dims': '[512, 256]', 'dropout': 0.10024609356610953, 'batch_norm': True, 'lr': 9.228830573801179e-05, 'weight_decay': 2.4926746995702345e-06, 'epochs': 62, 'loss': 'mae', 'optimizer': 'adam', 'graph_mode': 'off', 'use_snp_selection': False}. Best is trial 69 with value: 0.135331097196207.
[I 2025-12-05 16:19:43,409] Trial 78 finished with value: 0.10129753650336237 and parameters: {'model_type': 'mlp', 'hidden_dims': '[256, 128, 64]', 'dropout': 0.11503005115378899, 'batch_norm': True, 'lr': 0.00011516163681616419, 'weight_decay': 7.133951289418381e-07, 'epochs': 117, 'loss': 'mse', 'optimizer': 'adam', 'graph_mode': 'off', 'use_snp_selection': False}. Best is trial 69 with value: 0.135331097196207.
[I 2025-12-05 16:19:44,333] Trial 79 finished with value: 0.0928735022326683 and parameters: {'model_type': 'mlp', 'hidden_dims': '[512, 256]', 'dropout': 0.14473701170810205, 'batch_norm': True, 'lr': 4.199731590896213e-05, 'weight_decay': 2.3316184365384606e-07, 'epochs': 70, 'loss': 'mse', 'optimizer': 'adam', 'graph_mode': 'off', 'use_snp_selection': False}. Best is trial 69 with value: 0.135331097196207.
[I 2025-12-05 16:19:45,497] Trial 80 finished with value: 0.09563981684390065 and parameters: {'model_type': 'mlp', 'hidden_dims': '[512, 64]', 'dropout': 0.16363265273683292, 'batch_norm': False, 'lr': 2.645856908967763e-05, 'weight_decay': 1.8706354240587063e-05, 'epochs': 126, 'loss': 'mse', 'optimizer': 'adam', 'graph_mode': 'off', 'use_snp_selection': False}. Best is trial 69 with value: 0.135331097196207.
[I 2025-12-05 16:19:46,579] Trial 81 finished with value: 0.12636420210569552 and parameters: {'model_type': 'mlp', 'hidden_dims': '[512, 128]', 'dropout': 0.17772809877123572, 'batch_norm': True, 'lr': 0.00016310343588436606, 'weight_decay': 1.632509307616264e-07, 'epochs': 103, 'loss': 'mse', 'optimizer': 'adam', 'graph_mode': 'off', 'use_snp_selection': False}. Best is trial 69 with value: 0.135331097196207.
[I 2025-12-05 16:19:47,682] Trial 82 finished with value: 0.1154139006714144 and parameters: {'model_type': 'mlp', 'hidden_dims': '[512, 256]', 'dropout': 0.19078444500933173, 'batch_norm': True, 'lr': 0.0002545334736355893, 'weight_decay': 4.408149119280394e-07, 'epochs': 109, 'loss': 'mse', 'optimizer': 'adam', 'graph_mode': 'off', 'use_snp_selection': False}. Best is trial 69 with value: 0.135331097196207.
[I 2025-12-05 16:19:49,178] Trial 83 finished with value: 0.12060387731383648 and parameters: {'model_type': 'mlp', 'hidden_dims': '[128, 64]', 'dropout': 0.133651949859222, 'batch_norm': True, 'lr': 5.6990957897998845e-05, 'weight_decay': 1.2765795411457587e-06, 'epochs': 89, 'loss': 'mse', 'optimizer': 'adam', 'graph_mode': 'off', 'use_snp_selection': True, 'num_snps': 31695}. Best is trial 69 with value: 0.135331097196207.
[I 2025-12-05 16:19:50,209] Trial 84 finished with value: 0.1083514546004576 and parameters: {'model_type': 'mlp', 'hidden_dims': '[512, 128]', 'dropout': 0.2128280986444447, 'batch_norm': True, 'lr': 0.0004681480898977216, 'weight_decay': 2.5736189964232057e-07, 'epochs': 80, 'loss': 'mse', 'optimizer': 'adam', 'graph_mode': 'off', 'use_snp_selection': False}. Best is trial 69 with value: 0.135331097196207.
[I 2025-12-05 16:19:51,444] Trial 85 finished with value: 0.130197557166534 and parameters: {'model_type': 'mlp', 'hidden_dims': '[512, 256]', 'dropout': 0.11255239988429669, 'batch_norm': True, 'lr': 0.0001358023007578822, 'weight_decay': 5.551297770855423e-07, 'epochs': 136, 'loss': 'mse', 'optimizer': 'adam', 'graph_mode': 'off', 'use_snp_selection': False}. Best is trial 69 with value: 0.135331097196207.
[I 2025-12-05 16:19:52,651] Trial 86 finished with value: 0.11733696573525794 and parameters: {'model_type': 'mlp', 'hidden_dims': '[512, 256]', 'dropout': 0.11396674715473173, 'batch_norm': True, 'lr': 0.00013720193293952676, 'weight_decay': 1.0030160158569442e-07, 'epochs': 131, 'loss': 'mae', 'optimizer': 'adam', 'graph_mode': 'off', 'use_snp_selection': False}. Best is trial 69 with value: 0.135331097196207.
[I 2025-12-05 16:19:53,876] Trial 87 finished with value: 0.12058121473212981 and parameters: {'model_type': 'mlp', 'hidden_dims': '[512, 256]', 'dropout': 0.12383594798337735, 'batch_norm': True, 'lr': 6.595662464182544e-05, 'weight_decay': 7.971785128585501e-07, 'epochs': 137, 'loss': 'mse', 'optimizer': 'adam', 'graph_mode': 'off', 'use_snp_selection': False}. Best is trial 69 with value: 0.135331097196207.
[I 2025-12-05 16:19:54,894] Trial 88 finished with value: 0.11869760720572842 and parameters: {'model_type': 'mlp', 'hidden_dims': '[512, 256]', 'dropout': 0.1506219122764771, 'batch_norm': True, 'lr': 0.000194550195387482, 'weight_decay': 3.6603267837532344e-06, 'epochs': 92, 'loss': 'mse', 'optimizer': 'adam', 'graph_mode': 'off', 'use_snp_selection': False}. Best is trial 69 with value: 0.135331097196207.
[I 2025-12-05 16:19:55,810] Trial 89 finished with value: 0.09723305116297455 and parameters: {'model_type': 'mlp', 'hidden_dims': '[256, 128]', 'dropout': 0.13837077437662348, 'batch_norm': True, 'lr': 0.00011186211037827036, 'weight_decay': 6.001796588487164e-07, 'epochs': 167, 'loss': 'mse', 'optimizer': 'adam', 'graph_mode': 'off', 'use_snp_selection': False}. Best is trial 69 with value: 0.135331097196207.
[I 2025-12-05 16:19:57,113] Trial 90 finished with value: 0.09539081832164353 and parameters: {'model_type': 'mlp', 'hidden_dims': '[512, 256]', 'dropout': 0.1711003304476606, 'batch_norm': True, 'lr': 9.008472259274096e-05, 'weight_decay': 1.511481872008987e-06, 'epochs': 153, 'loss': 'mae', 'optimizer': 'adam', 'graph_mode': 'off', 'use_snp_selection': False}. Best is trial 69 with value: 0.135331097196207.
[I 2025-12-05 16:19:59,014] Trial 91 finished with value: 0.1284902936167706 and parameters: {'model_type': 'mlp', 'hidden_dims': '[128, 64]', 'dropout': 0.10812932167770523, 'batch_norm': True, 'lr': 0.0005416811330756561, 'weight_decay': 4.4625162521414055e-07, 'epochs': 111, 'loss': 'mse', 'optimizer': 'adam', 'graph_mode': 'off', 'use_snp_selection': True, 'num_snps': 41538}. Best is trial 69 with value: 0.135331097196207.
[I 2025-12-05 16:19:59,719] Trial 92 finished with value: 0.12205399103510445 and parameters: {'model_type': 'mlp', 'hidden_dims': '[128, 64]', 'dropout': 0.10974800690257076, 'batch_norm': True, 'lr': 0.0005464014004266808, 'weight_decay': 3.0432455841900934e-07, 'epochs': 115, 'loss': 'mse', 'optimizer': 'adam', 'graph_mode': 'off', 'use_snp_selection': False}. Best is trial 69 with value: 0.135331097196207.
[I 2025-12-05 16:20:00,395] Trial 93 finished with value: 0.11921204765049204 and parameters: {'model_type': 'mlp', 'hidden_dims': '[128, 64]', 'dropout': 0.12691612749109032, 'batch_norm': True, 'lr': 0.000813373783359016, 'weight_decay': 4.891719715447721e-07, 'epochs': 125, 'loss': 'mse', 'optimizer': 'adam', 'graph_mode': 'off', 'use_snp_selection': False}. Best is trial 69 with value: 0.135331097196207.
[I 2025-12-05 16:20:01,765] Trial 94 finished with value: 0.13012551862716817 and parameters: {'model_type': 'mlp', 'hidden_dims': '[128, 64]', 'dropout': 0.110908905385995, 'batch_norm': True, 'lr': 0.000426334707628807, 'weight_decay': 6.030086594497749e-07, 'epochs': 111, 'loss': 'mse', 'optimizer': 'adam', 'graph_mode': 'off', 'use_snp_selection': True, 'num_snps': 25118}. Best is trial 69 with value: 0.135331097196207.
[I 2025-12-05 16:20:02,535] Trial 95 finished with value: 0.1324890028979825 and parameters: {'model_type': 'mlp', 'hidden_dims': '[128, 64]', 'dropout': 0.15324066527803934, 'batch_norm': True, 'lr': 0.0006654505273380343, 'weight_decay': 8.397851365529945e-07, 'epochs': 138, 'loss': 'mse', 'optimizer': 'adam', 'graph_mode': 'off', 'use_snp_selection': False}. Best is trial 69 with value: 0.135331097196207.
[I 2025-12-05 16:20:03,291] Trial 96 finished with value: 0.02025075836564416 and parameters: {'model_type': 'mlp', 'hidden_dims': '[128, 64]', 'dropout': 0.15576238813289953, 'batch_norm': True, 'lr': 1.127747253329817e-06, 'weight_decay': 1.0935617169030166e-06, 'epochs': 147, 'loss': 'mse', 'optimizer': 'adam', 'graph_mode': 'off', 'use_snp_selection': False}. Best is trial 69 with value: 0.135331097196207.
[I 2025-12-05 16:20:04,023] Trial 97 finished with value: 0.11251360944926854 and parameters: {'model_type': 'mlp', 'hidden_dims': '[128, 64]', 'dropout': 0.1413641884016228, 'batch_norm': True, 'lr': 0.00015008819294695682, 'weight_decay': 8.793903469217301e-07, 'epochs': 137, 'loss': 'mse', 'optimizer': 'adam', 'graph_mode': 'off', 'use_snp_selection': False}. Best is trial 69 with value: 0.135331097196207.
[I 2025-12-05 16:20:04,742] Trial 98 finished with value: 0.11014163051640738 and parameters: {'model_type': 'mlp', 'hidden_dims': '[128, 64]', 'dropout': 0.12665096040729587, 'batch_norm': False, 'lr': 8.126450324762104e-05, 'weight_decay': 5.931261033916557e-07, 'epochs': 162, 'loss': 'mse', 'optimizer': 'adam', 'graph_mode': 'off', 'use_snp_selection': False}. Best is trial 69 with value: 0.135331097196207.
[I 2025-12-05 16:20:05,501] Trial 99 finished with value: 0.11085769235656287 and parameters: {'model_type': 'mlp', 'hidden_dims': '[128, 64]', 'dropout': 0.34439830232355517, 'batch_norm': True, 'lr': 0.0007270977002325083, 'weight_decay': 1.8233723545206733e-06, 'epochs': 177, 'loss': 'mse', 'optimizer': 'adam', 'graph_mode': 'off', 'use_snp_selection': False}. Best is trial 69 with value: 0.135331097196207.
[I 2025-12-05 16:20:06,209] Trial 100 finished with value: 0.1080876871018534 and parameters: {'model_type': 'mlp', 'hidden_dims': '[128, 64]', 'dropout': 0.17111599705235025, 'batch_norm': True, 'lr': 0.0006547757654975858, 'weight_decay': 7.106776677216389e-07, 'epochs': 141, 'loss': 'mae', 'optimizer': 'adam', 'graph_mode': 'off', 'use_snp_selection': False}. Best is trial 69 with value: 0.135331097196207.
[I 2025-12-05 16:20:07,611] Trial 101 finished with value: 0.09919934137629303 and parameters: {'model_type': 'mlp', 'hidden_dims': '[256, 128, 64]', 'dropout': 0.12015847979102692, 'batch_norm': True, 'lr': 0.00022312910329869636, 'weight_decay': 3.286294318999772e-07, 'epochs': 96, 'loss': 'mse', 'optimizer': 'adam', 'graph_mode': 'off', 'use_snp_selection': True, 'num_snps': 24332}. Best is trial 69 with value: 0.135331097196207.
[I 2025-12-05 16:20:08,847] Trial 102 finished with value: 0.12867125016544023 and parameters: {'model_type': 'mlp', 'hidden_dims': '[512, 256]', 'dropout': 0.15406981225860325, 'batch_norm': True, 'lr': 0.00045297870609912105, 'weight_decay': 8.45780560814022e-07, 'epochs': 121, 'loss': 'mse', 'optimizer': 'adam', 'graph_mode': 'off', 'use_snp_selection': False}. Best is trial 69 with value: 0.135331097196207.
[I 2025-12-05 16:20:10,028] Trial 103 finished with value: 0.13227228663255353 and parameters: {'model_type': 'mlp', 'hidden_dims': '[512, 256]', 'dropout': 0.15251832955874792, 'batch_norm': True, 'lr': 0.0008722488964707448, 'weight_decay': 1.1485366825701099e-06, 'epochs': 125, 'loss': 'mse', 'optimizer': 'adam', 'graph_mode': 'off', 'use_snp_selection': False}. Best is trial 69 with value: 0.135331097196207.
[I 2025-12-05 16:20:11,199] Trial 104 finished with value: 0.11994451894086272 and parameters: {'model_type': 'mlp', 'hidden_dims': '[512, 256]', 'dropout': 0.19530116560619204, 'batch_norm': True, 'lr': 0.0009276394603526259, 'weight_decay': 1.3588590306925365e-06, 'epochs': 129, 'loss': 'mse', 'optimizer': 'adam', 'graph_mode': 'off', 'use_snp_selection': False}. Best is trial 69 with value: 0.135331097196207.
[I 2025-12-05 16:20:12,269] Trial 105 finished with value: 0.08138568795783827 and parameters: {'model_type': 'mlp', 'hidden_dims': '[512, 256]', 'dropout': 0.1340959804939345, 'batch_norm': True, 'lr': 0.00010623682594430234, 'weight_decay': 2.3034353972147887e-06, 'epochs': 106, 'loss': 'mse', 'optimizer': 'adam', 'graph_mode': 'off', 'use_snp_selection': False}. Best is trial 69 with value: 0.135331097196207.
[I 2025-12-05 16:20:13,511] Trial 106 finished with value: 0.11408407408962146 and parameters: {'model_type': 'mlp', 'hidden_dims': '[512, 256]', 'dropout': 0.4590464551297192, 'batch_norm': True, 'lr': 0.0006249474934483162, 'weight_decay': 1.0221519103860655e-06, 'epochs': 148, 'loss': 'mse', 'optimizer': 'adam', 'graph_mode': 'off', 'use_snp_selection': False}. Best is trial 69 with value: 0.135331097196207.
[I 2025-12-05 16:20:14,197] Trial 107 finished with value: 0.11266368595296594 and parameters: {'model_type': 'mlp', 'hidden_dims': '[128, 64]', 'dropout': 0.18060284087907164, 'batch_norm': True, 'lr': 0.0008721386199667841, 'weight_decay': 3.0613710528710947e-06, 'epochs': 134, 'loss': 'mse', 'optimizer': 'adam', 'graph_mode': 'off', 'use_snp_selection': False}. Best is trial 69 with value: 0.135331097196207.
[I 2025-12-05 16:20:15,244] Trial 108 finished with value: 0.1314660522762675 and parameters: {'model_type': 'mlp', 'hidden_dims': '[512, 256]', 'dropout': 0.1649457507052535, 'batch_norm': True, 'lr': 0.0007430192985556366, 'weight_decay': 5.189844540047752e-07, 'epochs': 100, 'loss': 'mse', 'optimizer': 'adam', 'graph_mode': 'off', 'use_snp_selection': False}. Best is trial 69 with value: 0.135331097196207.
[I 2025-12-05 16:20:16,294] Trial 109 finished with value: 0.1246666420013513 and parameters: {'model_type': 'mlp', 'hidden_dims': '[512, 256]', 'dropout': 0.16444876148523205, 'batch_norm': True, 'lr': 0.0007136066848377166, 'weight_decay': 5.221682195680992e-07, 'epochs': 100, 'loss': 'mse', 'optimizer': 'adam', 'graph_mode': 'off', 'use_snp_selection': False}. Best is trial 69 with value: 0.135331097196207.
[I 2025-12-05 16:20:17,876] Trial 110 finished with value: 0.10627032817006125 and parameters: {'model_type': 'mlp', 'hidden_dims': '[512, 256]', 'dropout': 0.14877494597082713, 'batch_norm': True, 'lr': 5.885547576509635e-05, 'weight_decay': 1.8142262351995922e-06, 'epochs': 241, 'loss': 'mse', 'optimizer': 'adam', 'graph_mode': 'off', 'use_snp_selection': False}. Best is trial 69 with value: 0.135331097196207.
