[I 2025-12-05 16:47:24,192] Trial 57 finished with value: 0.29003135780872863 and parameters: {'model_type': 'mlp', 'hidden_dims': '[512, 64]', 'dropout': 0.5017025832071087, 'batch_norm': True, 'lr': 3.294536485389809e-06, 'weight_decay': 3.139120547580375e-07, 'epochs': 221, 'loss': 'mse', 'optimizer': 'adam', 'graph_mode': 'off', 'use_snp_selection': True, 'num_snps': 44539}. Best is trial 53 with value: 0.3063562177890325.
[I 2025-12-05 16:48:18,408] Trial 58 finished with value: 0.2857780757256818 and parameters: {'model_type': 'mlp', 'hidden_dims': '[512, 128]', 'dropout': 0.21540378330965498, 'batch_norm': False, 'lr': 2.7035291119835694e-05, 'weight_decay': 1.4888829356128287e-07, 'epochs': 296, 'loss': 'mae', 'optimizer': 'adam', 'graph_mode': 'off', 'use_snp_selection': True, 'num_snps': 29446}. Best is trial 53 with value: 0.3063562177890325.
[I 2025-12-05 16:49:20,123] Trial 59 finished with value: 0.2844600803032732 and parameters: {'model_type': 'mlp', 'hidden_dims': '[512, 128]', 'dropout': 0.4596441032962983, 'batch_norm': False, 'lr': 1.7774008233246644e-05, 'weight_decay': 4.130425162408885e-06, 'epochs': 246, 'loss': 'mse', 'optimizer': 'adam', 'graph_mode': 'off', 'use_snp_selection': True, 'num_snps': 41707}. Best is trial 53 with value: 0.3063562177890325.
[I 2025-12-05 16:50:24,506] Trial 60 finished with value: 0.30271064054981234 and parameters: {'model_type': 'mlp', 'hidden_dims': '[512, 128]', 'dropout': 0.5371446613860558, 'batch_norm': False, 'lr': 4.364816722606964e-06, 'weight_decay': 1.7361070761697482e-06, 'epochs': 321, 'loss': 'mse', 'optimizer': 'adam', 'graph_mode': 'off', 'use_snp_selection': True, 'num_snps': 36576}. Best is trial 53 with value: 0.3063562177890325.
[I 2025-12-05 16:51:28,604] Trial 61 finished with value: 0.29892325634129197 and parameters: {'model_type': 'mlp', 'hidden_dims': '[512, 128]', 'dropout': 0.5333561354594931, 'batch_norm': False, 'lr': 4.724701403324365e-06, 'weight_decay': 7.339960679602385e-06, 'epochs': 336, 'loss': 'mse', 'optimizer': 'adam', 'graph_mode': 'off', 'use_snp_selection': True, 'num_snps': 35668}. Best is trial 53 with value: 0.3063562177890325.
[I 2025-12-05 16:52:45,899] Trial 62 finished with value: 0.2921516374335241 and parameters: {'model_type': 'mlp', 'hidden_dims': '[512, 128]', 'dropout': 0.5742916855528141, 'batch_norm': False, 'lr': 1.3889257584259646e-06, 'weight_decay': 1.8463895382034721e-06, 'epochs': 319, 'loss': 'mse', 'optimizer': 'adam', 'graph_mode': 'off', 'use_snp_selection': True, 'num_snps': 48067}. Best is trial 53 with value: 0.3063562177890325.
[I 2025-12-05 16:53:37,415] Trial 63 finished with value: 0.3005220377124312 and parameters: {'model_type': 'mlp', 'hidden_dims': '[512, 128]', 'dropout': 0.5195292776269329, 'batch_norm': False, 'lr': 6.232938694565795e-06, 'weight_decay': 3.840995812089784e-06, 'epochs': 182, 'loss': 'mse', 'optimizer': 'adam', 'graph_mode': 'off', 'use_snp_selection': True, 'num_snps': 38573}. Best is trial 53 with value: 0.3063562177890325.
[I 2025-12-05 16:54:13,135] Trial 64 finished with value: 0.30032267407769525 and parameters: {'model_type': 'mlp', 'hidden_dims': '[256, 128]', 'dropout': 0.5534917441305444, 'batch_norm': False, 'lr': 1.2020328406168465e-05, 'weight_decay': 0.0009446634395666504, 'epochs': 163, 'loss': 'mse', 'optimizer': 'adam', 'graph_mode': 'off', 'use_snp_selection': True, 'num_snps': 28374}. Best is trial 53 with value: 0.3063562177890325.
[I 2025-12-05 16:55:03,884] Trial 65 finished with value: 0.29822277148229037 and parameters: {'model_type': 'mlp', 'hidden_dims': '[256, 128, 64]', 'dropout': 0.4956095869082331, 'batch_norm': False, 'lr': 9.265721861614348e-06, 'weight_decay': 4.1202671378523115e-07, 'epochs': 281, 'loss': 'mse', 'optimizer': 'adam', 'graph_mode': 'off', 'use_snp_selection': True, 'num_snps': 43810}. Best is trial 53 with value: 0.3063562177890325.
[I 2025-12-05 16:56:26,943] Trial 66 finished with value: 0.302288897263537 and parameters: {'model_type': 'mlp', 'hidden_dims': '[512, 256]', 'dropout': 0.5805785781676865, 'batch_norm': False, 'lr': 3.7824293131564304e-06, 'weight_decay': 1.406625428944768e-06, 'epochs': 304, 'loss': 'mse', 'optimizer': 'adam', 'graph_mode': 'off', 'use_snp_selection': True, 'num_snps': 55114}. Best is trial 53 with value: 0.3063562177890325.
[I 2025-12-05 16:57:25,586] Trial 67 finished with value: 0.30436401211547265 and parameters: {'model_type': 'mlp', 'hidden_dims': '[512, 256]', 'dropout': 0.5793155461731182, 'batch_norm': False, 'lr': 3.906825179940325e-06, 'weight_decay': 1.2599795596440204e-06, 'epochs': 306, 'loss': 'mse', 'optimizer': 'adam', 'graph_mode': 'off', 'use_snp_selection': False}. Best is trial 53 with value: 0.3063562177890325.
[I 2025-12-05 16:58:25,635] Trial 68 finished with value: 0.3006464556167433 and parameters: {'model_type': 'mlp', 'hidden_dims': '[512, 256]', 'dropout': 0.5998913342456783, 'batch_norm': False, 'lr': 2.689947060842423e-06, 'weight_decay': 1.392145524939361e-06, 'epochs': 313, 'loss': 'mse', 'optimizer': 'adam', 'graph_mode': 'off', 'use_snp_selection': False}. Best is trial 53 with value: 0.3063562177890325.
[I 2025-12-05 16:59:29,079] Trial 69 finished with value: 0.3013208306519197 and parameters: {'model_type': 'mlp', 'hidden_dims': '[512, 256]', 'dropout': 0.5794715257215537, 'batch_norm': False, 'lr': 4.181697017148043e-06, 'weight_decay': 2.8601258961315966e-06, 'epochs': 332, 'loss': 'mse', 'optimizer': 'adam', 'graph_mode': 'off', 'use_snp_selection': False}. Best is trial 53 with value: 0.3063562177890325.
[I 2025-12-05 17:00:27,654] Trial 70 finished with value: 0.29909002726308154 and parameters: {'model_type': 'mlp', 'hidden_dims': '[512, 256]', 'dropout': 0.5440651241526536, 'batch_norm': False, 'lr': 1.9569551713360313e-06, 'weight_decay': 2.1997817996056906e-07, 'epochs': 304, 'loss': 'mse', 'optimizer': 'adam', 'graph_mode': 'off', 'use_snp_selection': False}. Best is trial 53 with value: 0.3063562177890325.
[I 2025-12-05 17:01:23,919] Trial 71 finished with value: 0.3006902007522641 and parameters: {'model_type': 'mlp', 'hidden_dims': '[512, 256]', 'dropout': 0.5557773590144751, 'batch_norm': False, 'lr': 3.912146107501224e-06, 'weight_decay': 6.98194671277416e-07, 'epochs': 291, 'loss': 'mse', 'optimizer': 'adam', 'graph_mode': 'off', 'use_snp_selection': False}. Best is trial 53 with value: 0.3063562177890325.
[I 2025-12-05 17:02:15,473] Trial 72 finished with value: 0.299960687846874 and parameters: {'model_type': 'mlp', 'hidden_dims': '[512, 256]', 'dropout': 0.5854430732259438, 'batch_norm': False, 'lr': 3.2439722796874554e-06, 'weight_decay': 1.0193766752338037e-06, 'epochs': 264, 'loss': 'mse', 'optimizer': 'adam', 'graph_mode': 'off', 'use_snp_selection': False}. Best is trial 53 with value: 0.3063562177890325.
[I 2025-12-05 17:03:17,879] Trial 73 finished with value: 0.29395456008976995 and parameters: {'model_type': 'mlp', 'hidden_dims': '[512, 256]', 'dropout': 0.5119470135740408, 'batch_norm': False, 'lr': 5.758714462270743e-06, 'weight_decay': 2.8841113192474864e-07, 'epochs': 326, 'loss': 'mse', 'optimizer': 'adam', 'graph_mode': 'off', 'use_snp_selection': False}. Best is trial 53 with value: 0.3063562177890325.
[I 2025-12-05 17:04:23,737] Trial 74 finished with value: 0.2940670177752725 and parameters: {'model_type': 'mlp', 'hidden_dims': '[512, 256]', 'dropout': 0.56860455554161, 'batch_norm': False, 'lr': 8.45434406301013e-06, 'weight_decay': 1.3916990261913997e-05, 'epochs': 347, 'loss': 'mse', 'optimizer': 'adam', 'graph_mode': 'off', 'use_snp_selection': False}. Best is trial 53 with value: 0.3063562177890325.
[I 2025-12-05 17:05:49,156] Trial 75 finished with value: 0.2886531154795898 and parameters: {'model_type': 'mlp', 'hidden_dims': '[512, 64]', 'dropout': 0.5294578843869179, 'batch_norm': False, 'lr': 1.594165140706678e-05, 'weight_decay': 1.2661481484081365e-06, 'epochs': 313, 'loss': 'mse', 'optimizer': 'adam', 'graph_mode': 'off', 'use_snp_selection': True, 'num_snps': 55852}. Best is trial 53 with value: 0.3063562177890325.
[I 2025-12-05 17:06:07,897] Trial 76 finished with value: 0.27063974648696315 and parameters: {'model_type': 'mlp', 'hidden_dims': '[128, 64]', 'dropout': 0.341463104089671, 'batch_norm': True, 'lr': 4.5677432465135195e-06, 'weight_decay': 0.00014511127512463506, 'epochs': 276, 'loss': 'mse', 'optimizer': 'adam', 'graph_mode': 'off', 'use_snp_selection': False}. Best is trial 53 with value: 0.3063562177890325.
[I 2025-12-05 17:07:11,835] Trial 77 finished with value: 0.29552894716152917 and parameters: {'model_type': 'mlp', 'hidden_dims': '[512, 256]', 'dropout': 0.2995291596282037, 'batch_norm': False, 'lr': 2.300073695272549e-06, 'weight_decay': 2.8929874152777172e-05, 'epochs': 308, 'loss': 'mae', 'optimizer': 'adam', 'graph_mode': 'off', 'use_snp_selection': True, 'num_snps': 36795}. Best is trial 53 with value: 0.3063562177890325.
[I 2025-12-05 17:07:29,949] Trial 78 finished with value: 0.29482249125067406 and parameters: {'model_type': 'mlp', 'hidden_dims': '[128, 64]', 'dropout': 0.5469427270165234, 'batch_norm': False, 'lr': 3.064837918660975e-06, 'weight_decay': 5.217420176459425e-07, 'epochs': 266, 'loss': 'mse', 'optimizer': 'adam', 'graph_mode': 'off', 'use_snp_selection': False}. Best is trial 53 with value: 0.3063562177890325.
[I 2025-12-05 17:08:11,015] Trial 79 finished with value: 0.2310793057316401 and parameters: {'model_type': 'mlp', 'hidden_dims': '[256, 128, 64]', 'dropout': 0.5352420106058913, 'batch_norm': False, 'lr': 1.002545376861233e-06, 'weight_decay': 3.609366160895581e-07, 'epochs': 236, 'loss': 'mse', 'optimizer': 'adam', 'graph_mode': 'off', 'use_snp_selection': True, 'num_snps': 32263}. Best is trial 53 with value: 0.3063562177890325.
[I 2025-12-05 17:08:30,352] Trial 80 finished with value: 0.3015988477680672 and parameters: {'model_type': 'mlp', 'hidden_dims': '[128, 64]', 'dropout': 0.5664512788389633, 'batch_norm': False, 'lr': 1.2156837112884076e-05, 'weight_decay': 1.224513995541301e-07, 'epochs': 290, 'loss': 'mse', 'optimizer': 'adam', 'graph_mode': 'off', 'use_snp_selection': False}. Best is trial 53 with value: 0.3063562177890325.
[I 2025-12-05 17:08:49,781] Trial 81 finished with value: 0.2983008326748847 and parameters: {'model_type': 'mlp', 'hidden_dims': '[128, 64]', 'dropout': 0.5615035326703577, 'batch_norm': False, 'lr': 1.2754184941715246e-05, 'weight_decay': 1.2484234948502326e-07, 'epochs': 291, 'loss': 'mse', 'optimizer': 'adam', 'graph_mode': 'off', 'use_snp_selection': False}. Best is trial 53 with value: 0.3063562177890325.
[I 2025-12-05 17:09:09,582] Trial 82 finished with value: 0.30315866324039026 and parameters: {'model_type': 'mlp', 'hidden_dims': '[128, 64]', 'dropout': 0.5115833196780872, 'batch_norm': False, 'lr': 7.82958109512524e-06, 'weight_decay': 2.3393289028594785e-07, 'epochs': 298, 'loss': 'mse', 'optimizer': 'adam', 'graph_mode': 'off', 'use_snp_selection': False}. Best is trial 53 with value: 0.3063562177890325.
[I 2025-12-05 17:09:30,687] Trial 83 finished with value: 0.297349532561108 and parameters: {'model_type': 'mlp', 'hidden_dims': '[128, 64]', 'dropout': 0.5881287638084347, 'batch_norm': False, 'lr': 2.6633682738586455e-05, 'weight_decay': 2.1814087158240922e-07, 'epochs': 323, 'loss': 'mse', 'optimizer': 'adam', 'graph_mode': 'off', 'use_snp_selection': False}. Best is trial 53 with value: 0.3063562177890325.
[I 2025-12-05 17:09:52,763] Trial 84 finished with value: 0.30318235624864565 and parameters: {'model_type': 'mlp', 'hidden_dims': '[128, 64]', 'dropout': 0.5696045947371099, 'batch_norm': False, 'lr': 1.0157724788180246e-05, 'weight_decay': 0.0005673108134189399, 'epochs': 343, 'loss': 'mse', 'optimizer': 'adam', 'graph_mode': 'off', 'use_snp_selection': False}. Best is trial 53 with value: 0.3063562177890325.
[I 2025-12-05 17:10:14,650] Trial 85 finished with value: 0.29811860607973173 and parameters: {'model_type': 'mlp', 'hidden_dims': '[128, 64]', 'dropout': 0.43712492838605044, 'batch_norm': False, 'lr': 7.4469674721103665e-06, 'weight_decay': 0.00044889526599612063, 'epochs': 339, 'loss': 'mse', 'optimizer': 'adam', 'graph_mode': 'off', 'use_snp_selection': False}. Best is trial 53 with value: 0.3063562177890325.
[I 2025-12-05 17:10:36,061] Trial 86 finished with value: 0.3014838696863945 and parameters: {'model_type': 'mlp', 'hidden_dims': '[128, 64]', 'dropout': 0.5133173351697191, 'batch_norm': False, 'lr': 9.386068159706945e-06, 'weight_decay': 7.433478285947792e-05, 'epochs': 329, 'loss': 'mse', 'optimizer': 'adam', 'graph_mode': 'off', 'use_snp_selection': False}. Best is trial 53 with value: 0.3063562177890325.
[I 2025-12-05 17:10:55,887] Trial 87 finished with value: 0.30182390416993793 and parameters: {'model_type': 'mlp', 'hidden_dims': '[128, 64]', 'dropout': 0.5484606871460436, 'batch_norm': False, 'lr': 5.528337838785945e-06, 'weight_decay': 8.741874593197156e-07, 'epochs': 299, 'loss': 'mse', 'optimizer': 'adam', 'graph_mode': 'off', 'use_snp_selection': False}. Best is trial 53 with value: 0.3063562177890325.
[I 2025-12-05 17:11:16,948] Trial 88 finished with value: 0.2901404246813996 and parameters: {'model_type': 'mlp', 'hidden_dims': '[128, 64]', 'dropout': 0.5846789083071715, 'batch_norm': True, 'lr': 1.488016421484172e-05, 'weight_decay': 0.00010011049411981347, 'epochs': 320, 'loss': 'mae', 'optimizer': 'adam', 'graph_mode': 'off', 'use_snp_selection': False}. Best is trial 53 with value: 0.3063562177890325.
[I 2025-12-05 17:11:38,900] Trial 89 finished with value: 0.30626938300586604 and parameters: {'model_type': 'mlp', 'hidden_dims': '[128, 64]', 'dropout': 0.5728249131588077, 'batch_norm': False, 'lr': 1.0096574046732027e-05, 'weight_decay': 5.030048943932001e-05, 'epochs': 340, 'loss': 'mse', 'optimizer': 'adam', 'graph_mode': 'off', 'use_snp_selection': False}. Best is trial 53 with value: 0.3063562177890325.
[I 2025-12-05 17:12:01,113] Trial 90 finished with value: 0.2853685790807683 and parameters: {'model_type': 'mlp', 'hidden_dims': '[128, 64]', 'dropout': 0.131458047810138, 'batch_norm': False, 'lr': 1.0150748198737447e-05, 'weight_decay': 0.0003748699448313505, 'epochs': 345, 'loss': 'mse', 'optimizer': 'adam', 'graph_mode': 'off', 'use_snp_selection': False}. Best is trial 53 with value: 0.3063562177890325.
[I 2025-12-05 17:12:23,070] Trial 91 finished with value: 0.2924119734631379 and parameters: {'model_type': 'mlp', 'hidden_dims': '[128, 64]', 'dropout': 0.5709463431506204, 'batch_norm': False, 'lr': 2.205094341590003e-05, 'weight_decay': 5.816682809827263e-05, 'epochs': 340, 'loss': 'mse', 'optimizer': 'adam', 'graph_mode': 'off', 'use_snp_selection': False}. Best is trial 53 with value: 0.3063562177890325.
[I 2025-12-05 17:12:43,188] Trial 92 finished with value: 0.3024430370838265 and parameters: {'model_type': 'mlp', 'hidden_dims': '[128, 64]', 'dropout': 0.53930970521868, 'batch_norm': False, 'lr': 8.237898628246611e-06, 'weight_decay': 0.0005795891232511704, 'epochs': 305, 'loss': 'mse', 'optimizer': 'adam', 'graph_mode': 'off', 'use_snp_selection': False}. Best is trial 53 with value: 0.3063562177890325.
[I 2025-12-05 17:13:04,664] Trial 93 finished with value: 0.30275092287386035 and parameters: {'model_type': 'mlp', 'hidden_dims': '[128, 64]', 'dropout': 0.5383203457344024, 'batch_norm': False, 'lr': 7.587837729328323e-06, 'weight_decay': 0.0002131069580628917, 'epochs': 331, 'loss': 'mse', 'optimizer': 'adam', 'graph_mode': 'off', 'use_snp_selection': False}. Best is trial 53 with value: 0.3063562177890325.
[I 2025-12-05 17:13:26,249] Trial 94 finished with value: 0.3020432325522161 and parameters: {'model_type': 'mlp', 'hidden_dims': '[128, 64]', 'dropout': 0.5369647180295838, 'batch_norm': False, 'lr': 6.774105076894834e-06, 'weight_decay': 0.0006042550670570902, 'epochs': 333, 'loss': 'mse', 'optimizer': 'adam', 'graph_mode': 'off', 'use_snp_selection': False}. Best is trial 53 with value: 0.3063562177890325.
[I 2025-12-05 17:13:48,762] Trial 95 finished with value: 0.2996001545531112 and parameters: {'model_type': 'mlp', 'hidden_dims': '[128, 64]', 'dropout': 0.5054676450845844, 'batch_norm': False, 'lr': 8.745912040566822e-06, 'weight_decay': 0.0006444957752412511, 'epochs': 350, 'loss': 'mse', 'optimizer': 'adam', 'graph_mode': 'off', 'use_snp_selection': False}. Best is trial 53 with value: 0.3063562177890325.
[I 2025-12-05 17:14:09,657] Trial 96 finished with value: 0.2942819756171103 and parameters: {'model_type': 'mlp', 'hidden_dims': '[128, 64]', 'dropout': 0.5176635866953899, 'batch_norm': False, 'lr': 8.034886493162142e-06, 'weight_decay': 0.00028523957907805635, 'epochs': 319, 'loss': 'mse', 'optimizer': 'adam', 'graph_mode': 'off', 'use_snp_selection': False}. Best is trial 53 with value: 0.3063562177890325.
[I 2025-12-05 17:14:30,253] Trial 97 finished with value: 0.30244352931005336 and parameters: {'model_type': 'mlp', 'hidden_dims': '[128, 64]', 'dropout': 0.38011762161982976, 'batch_norm': False, 'lr': 5.56570363312852e-06, 'weight_decay': 0.0006834056734605268, 'epochs': 314, 'loss': 'mse', 'optimizer': 'adam', 'graph_mode': 'off', 'use_snp_selection': False}. Best is trial 53 with value: 0.3063562177890325.
[I 2025-12-05 17:14:51,568] Trial 98 finished with value: 0.2996609270850668 and parameters: {'model_type': 'mlp', 'hidden_dims': '[128, 64]', 'dropout': 0.268343651217385, 'batch_norm': False, 'lr': 5.802157693721733e-06, 'weight_decay': 0.00020246094481524184, 'epochs': 328, 'loss': 'mse', 'optimizer': 'adam', 'graph_mode': 'off', 'use_snp_selection': False}. Best is trial 53 with value: 0.3063562177890325.
[I 2025-12-05 17:15:13,662] Trial 99 finished with value: 0.30170928557517296 and parameters: {'model_type': 'mlp', 'hidden_dims': '[128, 64]', 'dropout': 0.35149793845942806, 'batch_norm': False, 'lr': 4.921382863896206e-06, 'weight_decay': 0.00012055360431508252, 'epochs': 343, 'loss': 'mse', 'optimizer': 'adam', 'graph_mode': 'off', 'use_snp_selection': False}. Best is trial 53 with value: 0.3063562177890325.
[I 2025-12-05 17:15:46,769] Trial 100 finished with value: 0.2940783261031089 and parameters: {'model_type': 'mlp', 'hidden_dims': '[256, 128]', 'dropout': 0.4703270298994152, 'batch_norm': False, 'lr': 1.0499071864007269e-05, 'weight_decay': 0.00041931925791723214, 'epochs': 313, 'loss': 'mse', 'optimizer': 'adam', 'graph_mode': 'off', 'use_snp_selection': False}. Best is trial 53 with value: 0.3063562177890325.
[I 2025-12-05 17:16:08,553] Trial 101 finished with value: 0.2966623873779956 and parameters: {'model_type': 'mlp', 'hidden_dims': '[128, 64]', 'dropout': 0.3876918466668225, 'batch_norm': False, 'lr': 7.362875039679635e-06, 'weight_decay': 0.0006945721539556513, 'epochs': 337, 'loss': 'mse', 'optimizer': 'adam', 'graph_mode': 'off', 'use_snp_selection': False}. Best is trial 53 with value: 0.3063562177890325.
[I 2025-12-05 17:16:28,795] Trial 102 finished with value: 0.29939743270095515 and parameters: {'model_type': 'mlp', 'hidden_dims': '[128, 64]', 'dropout': 0.3722532941448371, 'batch_norm': False, 'lr': 6.188504985833959e-06, 'weight_decay': 0.00021112434965504863, 'epochs': 307, 'loss': 'mse', 'optimizer': 'adam', 'graph_mode': 'off', 'use_snp_selection': False}. Best is trial 53 with value: 0.3063562177890325.
[I 2025-12-05 17:16:49,515] Trial 103 finished with value: 0.30317442580085785 and parameters: {'model_type': 'mlp', 'hidden_dims': '[128, 64]', 'dropout': 0.5378514444035782, 'batch_norm': False, 'lr': 1.768387217587542e-05, 'weight_decay': 0.0005333609482180869, 'epochs': 316, 'loss': 'mse', 'optimizer': 'adam', 'graph_mode': 'off', 'use_snp_selection': False}. Best is trial 53 with value: 0.3063562177890325.
[I 2025-12-05 17:17:10,321] Trial 104 finished with value: 0.2939849410057445 and parameters: {'model_type': 'mlp', 'hidden_dims': '[128, 64]', 'dropout': 0.5508584111931468, 'batch_norm': False, 'lr': 1.8377617864408996e-05, 'weight_decay': 0.0009980630498472158, 'epochs': 318, 'loss': 'mse', 'optimizer': 'adam', 'graph_mode': 'off', 'use_snp_selection': False}. Best is trial 53 with value: 0.3063562177890325.
[I 2025-12-05 17:18:04,721] Trial 105 finished with value: 0.29089116626851996 and parameters: {'model_type': 'mlp', 'hidden_dims': '[512, 64]', 'dropout': 0.49109574916689785, 'batch_norm': False, 'lr': 1.683961981346087e-05, 'weight_decay': 0.0005200769424555649, 'epochs': 284, 'loss': 'mse', 'optimizer': 'adam', 'graph_mode': 'off', 'use_snp_selection': False}. Best is trial 53 with value: 0.3063562177890325.
[I 2025-12-05 17:18:24,442] Trial 106 finished with value: 0.2945219027857119 and parameters: {'model_type': 'mlp', 'hidden_dims': '[128, 64]', 'dropout': 0.5296573482927436, 'batch_norm': False, 'lr': 1.3650366017613533e-05, 'weight_decay': 0.0007441374558839773, 'epochs': 297, 'loss': 'mse', 'optimizer': 'adam', 'graph_mode': 'off', 'use_snp_selection': False}. Best is trial 53 with value: 0.3063562177890325.
[I 2025-12-05 17:18:46,005] Trial 107 finished with value: 0.2765063938721547 and parameters: {'model_type': 'mlp', 'hidden_dims': '[128, 64]', 'dropout': 0.5624925537849528, 'batch_norm': True, 'lr': 1.0855623848945832e-05, 'weight_decay': 0.0003258763292365931, 'epochs': 330, 'loss': 'mse', 'optimizer': 'adam', 'graph_mode': 'off', 'use_snp_selection': False}. Best is trial 53 with value: 0.3063562177890325.
[I 2025-12-05 17:19:24,357] Trial 108 finished with value: 0.2803882569784456 and parameters: {'model_type': 'mlp', 'hidden_dims': '[512, 128]', 'dropout': 0.5902086119979543, 'batch_norm': False, 'lr': 4.346276945802903e-06, 'weight_decay': 3.9197810784196574e-05, 'epochs': 191, 'loss': 'mae', 'optimizer': 'adam', 'graph_mode': 'off', 'use_snp_selection': False}. Best is trial 53 with value: 0.3063562177890325.
