[I 2025-12-05 15:08:30,581] Trial 146 finished with value: 0.0461102026532647 and parameters: {'model_type': 'mlp', 'hidden_dims': '[512, 128]', 'dropout': 0.14339610914492398, 'batch_norm': True, 'lr': 7.313099081315083e-05, 'weight_decay': 1.15155883893078e-07, 'epochs': 42, 'loss': 'mse', 'optimizer': 'adam', 'graph_mode': 'off', 'use_snp_selection': False}. Best is trial 19 with value: 0.06757389302384245.
[I 2025-12-05 15:08:31,792] Trial 147 finished with value: 0.04602090854827658 and parameters: {'model_type': 'mlp', 'hidden_dims': '[512, 128]', 'dropout': 0.49058386218414696, 'batch_norm': False, 'lr': 1.657602843211438e-05, 'weight_decay': 1.5994144111854975e-07, 'epochs': 204, 'loss': 'mse', 'optimizer': 'adam', 'graph_mode': 'off', 'use_snp_selection': True, 'num_snps': 14336}. Best is trial 19 with value: 0.06757389302384245.
[I 2025-12-05 15:08:32,728] Trial 148 finished with value: 0.03905211619913442 and parameters: {'model_type': 'mlp', 'hidden_dims': '[512, 128]', 'dropout': 0.12569215196139055, 'batch_norm': False, 'lr': 3.532979880504959e-05, 'weight_decay': 1.2437208970589916e-05, 'epochs': 64, 'loss': 'mse', 'optimizer': 'adam', 'graph_mode': 'off', 'use_snp_selection': False}. Best is trial 19 with value: 0.06757389302384245.
[I 2025-12-05 15:08:33,840] Trial 149 finished with value: 0.017152352040231984 and parameters: {'model_type': 'mlp', 'hidden_dims': '[512, 128]', 'dropout': 0.15516789282599225, 'batch_norm': True, 'lr': 9.871688843124798e-06, 'weight_decay': 1.9620736809699238e-07, 'epochs': 116, 'loss': 'mse', 'optimizer': 'adam', 'graph_mode': 'off', 'use_snp_selection': False}. Best is trial 19 with value: 0.06757389302384245.
[I 2025-12-05 15:08:36,196] Trial 0 finished with value: -0.025635086671257773 and parameters: {'model_type': 'mlp', 'hidden_dims': '[128, 64]', 'dropout': 0.199031432379812, 'batch_norm': True, 'lr': 1.8408544111075837e-06, 'weight_decay': 5.5136510071208614e-05, 'epochs': 336, 'loss': 'mae', 'optimizer': 'adam', 'graph_mode': 'off', 'use_snp_selection': True, 'num_snps': 43862}. Best is trial 0 with value: -0.025635086671257773.
[I 2025-12-05 15:08:37,415] Trial 1 finished with value: 0.024489749618174614 and parameters: {'model_type': 'mlp', 'hidden_dims': '[256, 128]', 'dropout': 0.4370668075331726, 'batch_norm': True, 'lr': 7.133471581159139e-05, 'weight_decay': 1.128633586803549e-05, 'epochs': 242, 'loss': 'mae', 'optimizer': 'adam', 'graph_mode': 'off', 'use_snp_selection': False}. Best is trial 1 with value: 0.024489749618174614.
[I 2025-12-05 15:08:38,556] Trial 2 finished with value: 0.0005261963097495597 and parameters: {'model_type': 'mlp', 'hidden_dims': '[256, 128, 64]', 'dropout': 0.41314357415569625, 'batch_norm': False, 'lr': 3.952233718592101e-06, 'weight_decay': 0.00026754769258252603, 'epochs': 149, 'loss': 'mse', 'optimizer': 'adam', 'graph_mode': 'off', 'use_snp_selection': True, 'num_snps': 11571}. Best is trial 1 with value: 0.024489749618174614.
[I 2025-12-05 15:08:41,081] Trial 3 finished with value: 0.049410520356849945 and parameters: {'model_type': 'mlp', 'hidden_dims': '[512, 64]', 'dropout': 0.5938127374509361, 'batch_norm': False, 'lr': 5.67704586114731e-06, 'weight_decay': 2.4518087630137052e-05, 'epochs': 320, 'loss': 'mae', 'optimizer': 'adam', 'graph_mode': 'off', 'use_snp_selection': False}. Best is trial 3 with value: 0.049410520356849945.
[I 2025-12-05 15:08:43,689] Trial 4 finished with value: 0.010267323712131272 and parameters: {'model_type': 'mlp', 'hidden_dims': '[512, 128]', 'dropout': 0.25746343592134413, 'batch_norm': True, 'lr': 1.3467657668402788e-06, 'weight_decay': 0.00033087251918647806, 'epochs': 277, 'loss': 'mse', 'optimizer': 'adam', 'graph_mode': 'off', 'use_snp_selection': True, 'num_snps': 36675}. Best is trial 3 with value: 0.049410520356849945.
[I 2025-12-05 15:08:45,642] Trial 5 finished with value: 0.003133940993588363 and parameters: {'model_type': 'mlp', 'hidden_dims': '[512, 64]', 'dropout': 0.38275350994408375, 'batch_norm': True, 'lr': 1.5586664309232824e-06, 'weight_decay': 0.0008227664668621182, 'epochs': 145, 'loss': 'mae', 'optimizer': 'adam', 'graph_mode': 'off', 'use_snp_selection': True, 'num_snps': 32148}. Best is trial 3 with value: 0.049410520356849945.
[I 2025-12-05 15:08:46,733] Trial 6 finished with value: 0.04939909195818483 and parameters: {'model_type': 'mlp', 'hidden_dims': '[256, 128]', 'dropout': 0.3930109900265879, 'batch_norm': False, 'lr': 4.892964372128395e-05, 'weight_decay': 1.5809549317992182e-06, 'epochs': 199, 'loss': 'mse', 'optimizer': 'adam', 'graph_mode': 'off', 'use_snp_selection': False}. Best is trial 3 with value: 0.049410520356849945.
[I 2025-12-05 15:08:47,979] Trial 7 finished with value: 0.02093673454983491 and parameters: {'model_type': 'mlp', 'hidden_dims': '[512, 256]', 'dropout': 0.15343979219678458, 'batch_norm': True, 'lr': 6.234003099047341e-05, 'weight_decay': 3.894760610535477e-07, 'epochs': 97, 'loss': 'mse', 'optimizer': 'adam', 'graph_mode': 'off', 'use_snp_selection': False}. Best is trial 3 with value: 0.049410520356849945.
[I 2025-12-05 15:08:50,492] Trial 8 finished with value: 0.02154890490325703 and parameters: {'model_type': 'mlp', 'hidden_dims': '[512, 128]', 'dropout': 0.10743001231661406, 'batch_norm': True, 'lr': 0.00023728538449271062, 'weight_decay': 1.7629071578048637e-05, 'epochs': 312, 'loss': 'mae', 'optimizer': 'adam', 'graph_mode': 'off', 'use_snp_selection': False}. Best is trial 3 with value: 0.049410520356849945.
[I 2025-12-05 15:08:52,201] Trial 9 finished with value: 0.04489859404278932 and parameters: {'model_type': 'mlp', 'hidden_dims': '[512, 64]', 'dropout': 0.14505336736221927, 'batch_norm': True, 'lr': 5.8619638388111826e-05, 'weight_decay': 6.200156172669308e-07, 'epochs': 175, 'loss': 'mse', 'optimizer': 'adam', 'graph_mode': 'off', 'use_snp_selection': False}. Best is trial 3 with value: 0.049410520356849945.
[I 2025-12-05 15:08:53,236] Trial 10 finished with value: 0.007573626940573115 and parameters: {'model_type': 'mlp', 'hidden_dims': '[512, 64]', 'dropout': 0.5885461262002587, 'batch_norm': False, 'lr': 8.769366258768696e-06, 'weight_decay': 2.78273193871783e-06, 'epochs': 55, 'loss': 'mae', 'optimizer': 'adam', 'graph_mode': 'off', 'use_snp_selection': False}. Best is trial 3 with value: 0.049410520356849945.
[I 2025-12-05 15:08:54,422] Trial 11 finished with value: 0.030478273313562725 and parameters: {'model_type': 'mlp', 'hidden_dims': '[256, 128]', 'dropout': 0.583942291816117, 'batch_norm': False, 'lr': 1.422933652790185e-05, 'weight_decay': 2.805519019095577e-06, 'epochs': 231, 'loss': 'mse', 'optimizer': 'adam', 'graph_mode': 'off', 'use_snp_selection': False}. Best is trial 3 with value: 0.049410520356849945.
[I 2025-12-05 15:08:55,630] Trial 12 finished with value: 0.039381577105208086 and parameters: {'model_type': 'mlp', 'hidden_dims': '[256, 128]', 'dropout': 0.4779690972965961, 'batch_norm': False, 'lr': 0.0006753264773209732, 'weight_decay': 1.3081036432574914e-07, 'epochs': 240, 'loss': 'mae', 'optimizer': 'adam', 'graph_mode': 'off', 'use_snp_selection': False}. Best is trial 3 with value: 0.049410520356849945.
[I 2025-12-05 15:08:56,583] Trial 13 finished with value: 0.03810114652584426 and parameters: {'model_type': 'mlp', 'hidden_dims': '[128, 64]', 'dropout': 0.3041365173646664, 'batch_norm': False, 'lr': 2.0021225389711998e-05, 'weight_decay': 4.373608364627903e-05, 'epochs': 293, 'loss': 'mse', 'optimizer': 'adam', 'graph_mode': 'off', 'use_snp_selection': False}. Best is trial 3 with value: 0.049410520356849945.
[I 2025-12-05 15:08:59,274] Trial 14 finished with value: 0.03253943232699156 and parameters: {'model_type': 'mlp', 'hidden_dims': '[512, 256]', 'dropout': 0.5143108008659758, 'batch_norm': False, 'lr': 5.932455544499841e-06, 'weight_decay': 2.3625593107335962e-06, 'epochs': 344, 'loss': 'mse', 'optimizer': 'adam', 'graph_mode': 'off', 'use_snp_selection': False}. Best is trial 3 with value: 0.049410520356849945.
[I 2025-12-05 15:09:00,395] Trial 15 finished with value: 0.029853755980313947 and parameters: {'model_type': 'mlp', 'hidden_dims': '[256, 128, 64]', 'dropout': 0.32864867985638985, 'batch_norm': False, 'lr': 0.00018429018027102804, 'weight_decay': 5.343087596659364e-05, 'epochs': 190, 'loss': 'mae', 'optimizer': 'adam', 'graph_mode': 'off', 'use_snp_selection': False}. Best is trial 3 with value: 0.049410520356849945.
[I 2025-12-05 15:09:01,268] Trial 16 finished with value: 0.05454590387896272 and parameters: {'model_type': 'mlp', 'hidden_dims': '[256, 128]', 'dropout': 0.5053372842363391, 'batch_norm': False, 'lr': 3.243454594745554e-05, 'weight_decay': 1.2294468020462874e-06, 'epochs': 98, 'loss': 'mse', 'optimizer': 'adam', 'graph_mode': 'off', 'use_snp_selection': False}. Best is trial 16 with value: 0.05454590387896272.
[I 2025-12-05 15:09:02,206] Trial 17 finished with value: -0.004827147748260562 and parameters: {'model_type': 'mlp', 'hidden_dims': '[512, 64]', 'dropout': 0.543474321376226, 'batch_norm': False, 'lr': 3.378196935792496e-06, 'weight_decay': 6.503919561253859e-06, 'epochs': 43, 'loss': 'mae', 'optimizer': 'adam', 'graph_mode': 'off', 'use_snp_selection': False}. Best is trial 16 with value: 0.05454590387896272.
[I 2025-12-05 15:09:04,808] Trial 18 finished with value: 0.026379609726263076 and parameters: {'model_type': 'mlp', 'hidden_dims': '[256, 128]', 'dropout': 0.49511833116234694, 'batch_norm': False, 'lr': 2.797772152750264e-05, 'weight_decay': 4.5859171107988616e-07, 'epochs': 103, 'loss': 'mse', 'optimizer': 'adam', 'graph_mode': 'off', 'use_snp_selection': True, 'num_snps': 58241}. Best is trial 16 with value: 0.05454590387896272.
[I 2025-12-05 15:09:06,215] Trial 19 finished with value: 0.03206546516399863 and parameters: {'model_type': 'mlp', 'hidden_dims': '[512, 64]', 'dropout': 0.5463690211280188, 'batch_norm': False, 'lr': 1.1022354237589176e-05, 'weight_decay': 1.1354159408743119e-07, 'epochs': 112, 'loss': 'mae', 'optimizer': 'adam', 'graph_mode': 'off', 'use_snp_selection': False}. Best is trial 16 with value: 0.05454590387896272.
[I 2025-12-05 15:09:07,359] Trial 20 finished with value: 0.05024384905566523 and parameters: {'model_type': 'mlp', 'hidden_dims': '[512, 128]', 'dropout': 0.45536213267728864, 'batch_norm': False, 'lr': 3.324514570871408e-06, 'weight_decay': 2.417613357794622e-05, 'epochs': 74, 'loss': 'mae', 'optimizer': 'adam', 'graph_mode': 'off', 'use_snp_selection': False}. Best is trial 16 with value: 0.05454590387896272.
[I 2025-12-05 15:09:08,557] Trial 21 finished with value: 0.06591004260642183 and parameters: {'model_type': 'mlp', 'hidden_dims': '[512, 128]', 'dropout': 0.4673170028718926, 'batch_norm': False, 'lr': 3.184392811999443e-06, 'weight_decay': 2.2375150401922e-05, 'epochs': 86, 'loss': 'mae', 'optimizer': 'adam', 'graph_mode': 'off', 'use_snp_selection': False}. Best is trial 21 with value: 0.06591004260642183.
[I 2025-12-05 15:09:09,682] Trial 22 finished with value: 0.030885969922160465 and parameters: {'model_type': 'mlp', 'hidden_dims': '[512, 128]', 'dropout': 0.45701469790471544, 'batch_norm': False, 'lr': 2.5688570019491464e-06, 'weight_decay': 0.00012506009376990192, 'epochs': 75, 'loss': 'mae', 'optimizer': 'adam', 'graph_mode': 'off', 'use_snp_selection': False}. Best is trial 21 with value: 0.06591004260642183.
[I 2025-12-05 15:09:10,803] Trial 23 finished with value: 0.03691995504149046 and parameters: {'model_type': 'mlp', 'hidden_dims': '[512, 128]', 'dropout': 0.3611131834127589, 'batch_norm': False, 'lr': 2.2628076171232937e-05, 'weight_decay': 7.1902429178679165e-06, 'epochs': 77, 'loss': 'mae', 'optimizer': 'adam', 'graph_mode': 'off', 'use_snp_selection': False}. Best is trial 21 with value: 0.06591004260642183.
[I 2025-12-05 15:09:12,236] Trial 24 finished with value: 0.05649982401224545 and parameters: {'model_type': 'mlp', 'hidden_dims': '[512, 128]', 'dropout': 0.43478094126843064, 'batch_norm': False, 'lr': 0.00012933696064794652, 'weight_decay': 9.668399582115472e-07, 'epochs': 132, 'loss': 'mae', 'optimizer': 'adam', 'graph_mode': 'off', 'use_snp_selection': False}. Best is trial 21 with value: 0.06591004260642183.
[I 2025-12-05 15:09:13,699] Trial 25 finished with value: 0.05737109780167874 and parameters: {'model_type': 'mlp', 'hidden_dims': '[512, 128]', 'dropout': 0.5335323239954017, 'batch_norm': False, 'lr': 0.0001985646265746985, 'weight_decay': 1.015548676608676e-06, 'epochs': 132, 'loss': 'mae', 'optimizer': 'adam', 'graph_mode': 'off', 'use_snp_selection': False}. Best is trial 21 with value: 0.06591004260642183.
[I 2025-12-05 15:09:14,624] Trial 26 finished with value: 0.042780752977828386 and parameters: {'model_type': 'mlp', 'hidden_dims': '[512, 128]', 'dropout': 0.5426049301682374, 'batch_norm': False, 'lr': 0.0001446333565857672, 'weight_decay': 2.2164588663027487e-07, 'epochs': 135, 'loss': 'mae', 'optimizer': 'adam', 'graph_mode': 'off', 'use_snp_selection': True, 'num_snps': 3842}. Best is trial 21 with value: 0.06591004260642183.
[I 2025-12-05 15:09:16,066] Trial 27 finished with value: 0.02261183014094637 and parameters: {'model_type': 'mlp', 'hidden_dims': '[512, 128]', 'dropout': 0.4241555396483052, 'batch_norm': False, 'lr': 0.00036978347024258743, 'weight_decay': 8.195015460294196e-07, 'epochs': 129, 'loss': 'mae', 'optimizer': 'adam', 'graph_mode': 'off', 'use_snp_selection': False}. Best is trial 21 with value: 0.06591004260642183.
[I 2025-12-05 15:09:17,665] Trial 28 finished with value: 0.033169872638578714 and parameters: {'model_type': 'mlp', 'hidden_dims': '[512, 128]', 'dropout': 0.28808077824177764, 'batch_norm': False, 'lr': 0.00011609941087798184, 'weight_decay': 2.6314795458500194e-07, 'epochs': 161, 'loss': 'mae', 'optimizer': 'adam', 'graph_mode': 'off', 'use_snp_selection': False}. Best is trial 21 with value: 0.06591004260642183.
[I 2025-12-05 15:09:19,064] Trial 29 finished with value: 0.042392870924382285 and parameters: {'model_type': 'mlp', 'hidden_dims': '[128, 64]', 'dropout': 0.4642946575819261, 'batch_norm': False, 'lr': 0.0006329042680269672, 'weight_decay': 4.118132666897288e-06, 'epochs': 215, 'loss': 'mae', 'optimizer': 'adam', 'graph_mode': 'off', 'use_snp_selection': True, 'num_snps': 19468}. Best is trial 21 with value: 0.06591004260642183.
[I 2025-12-05 15:09:20,448] Trial 30 finished with value: 0.043831204463975794 and parameters: {'model_type': 'mlp', 'hidden_dims': '[512, 128]', 'dropout': 0.5277970401268024, 'batch_norm': False, 'lr': 0.0003328319365814689, 'weight_decay': 0.00010803940086829997, 'epochs': 121, 'loss': 'mae', 'optimizer': 'adam', 'graph_mode': 'off', 'use_snp_selection': False}. Best is trial 21 with value: 0.06591004260642183.
[I 2025-12-05 15:09:21,700] Trial 31 finished with value: 0.04868632015765462 and parameters: {'model_type': 'mlp', 'hidden_dims': '[512, 128]', 'dropout': 0.5007441125087013, 'batch_norm': False, 'lr': 9.33244752400534e-05, 'weight_decay': 1.3347355656251354e-06, 'epochs': 93, 'loss': 'mae', 'optimizer': 'adam', 'graph_mode': 'off', 'use_snp_selection': False}. Best is trial 21 with value: 0.06591004260642183.
[I 2025-12-05 15:09:22,482] Trial 32 finished with value: 0.04937973650008228 and parameters: {'model_type': 'mlp', 'hidden_dims': '[256, 128]', 'dropout': 0.4307675683321309, 'batch_norm': False, 'lr': 3.451262444919569e-05, 'weight_decay': 1.106216356678896e-06, 'epochs': 65, 'loss': 'mse', 'optimizer': 'adam', 'graph_mode': 'off', 'use_snp_selection': False}. Best is trial 21 with value: 0.06591004260642183.
[I 2025-12-05 15:09:23,509] Trial 33 finished with value: 0.04300629303919839 and parameters: {'model_type': 'mlp', 'hidden_dims': '[256, 128, 64]', 'dropout': 0.4872383372234649, 'batch_norm': False, 'lr': 8.613404321373549e-05, 'weight_decay': 5.0547123779693745e-06, 'epochs': 160, 'loss': 'mae', 'optimizer': 'adam', 'graph_mode': 'off', 'use_snp_selection': False}. Best is trial 21 with value: 0.06591004260642183.
[I 2025-12-05 15:09:24,704] Trial 34 finished with value: 0.040844810060854296 and parameters: {'model_type': 'mlp', 'hidden_dims': '[512, 256]', 'dropout': 0.5641052452557024, 'batch_norm': False, 'lr': 4.3970456998351245e-05, 'weight_decay': 1.1745288102506079e-05, 'epochs': 89, 'loss': 'mae', 'optimizer': 'adam', 'graph_mode': 'off', 'use_snp_selection': False}. Best is trial 21 with value: 0.06591004260642183.
[I 2025-12-05 15:09:26,055] Trial 35 finished with value: 0.020903156956091278 and parameters: {'model_type': 'mlp', 'hidden_dims': '[512, 128]', 'dropout': 0.3943577915254203, 'batch_norm': True, 'lr': 0.0003775368996458793, 'weight_decay': 1.8649467141177418e-06, 'epochs': 117, 'loss': 'mse', 'optimizer': 'adam', 'graph_mode': 'off', 'use_snp_selection': False}. Best is trial 21 with value: 0.06591004260642183.
[I 2025-12-05 15:09:28,739] Trial 36 finished with value: 0.04018400972094096 and parameters: {'model_type': 'mlp', 'hidden_dims': '[128, 64]', 'dropout': 0.5128228820960642, 'batch_norm': False, 'lr': 1.1272167810115164e-06, 'weight_decay': 1.1338742361037652e-05, 'epochs': 139, 'loss': 'mae', 'optimizer': 'adam', 'graph_mode': 'off', 'use_snp_selection': True, 'num_snps': 58661}. Best is trial 21 with value: 0.06591004260642183.
[I 2025-12-05 15:09:29,754] Trial 37 finished with value: 0.0008750368009049383 and parameters: {'model_type': 'mlp', 'hidden_dims': '[512, 128]', 'dropout': 0.4363285042944745, 'batch_norm': False, 'lr': 0.00024355203289482325, 'weight_decay': 8.480660210021371e-07, 'epochs': 43, 'loss': 'mse', 'optimizer': 'adam', 'graph_mode': 'off', 'use_snp_selection': False}. Best is trial 21 with value: 0.06591004260642183.
[I 2025-12-05 15:09:31,233] Trial 38 finished with value: 0.030504726329662113 and parameters: {'model_type': 'mlp', 'hidden_dims': '[256, 128]', 'dropout': 0.36502460559849664, 'batch_norm': True, 'lr': 0.0008650987412690025, 'weight_decay': 2.4341742114112586e-07, 'epochs': 157, 'loss': 'mae', 'optimizer': 'adam', 'graph_mode': 'off', 'use_snp_selection': True, 'num_snps': 19911}. Best is trial 21 with value: 0.06591004260642183.
[I 2025-12-05 15:09:32,299] Trial 39 finished with value: 0.03608222207224702 and parameters: {'model_type': 'mlp', 'hidden_dims': '[256, 128, 64]', 'dropout': 0.40491549826838436, 'batch_norm': False, 'lr': 0.0001335495748766691, 'weight_decay': 4.4377345193703034e-07, 'epochs': 181, 'loss': 'mse', 'optimizer': 'adam', 'graph_mode': 'off', 'use_snp_selection': False}. Best is trial 21 with value: 0.06591004260642183.
[I 2025-12-05 15:09:33,598] Trial 40 finished with value: 0.07016881205196591 and parameters: {'model_type': 'mlp', 'hidden_dims': '[512, 128]', 'dropout': 0.20927599194134755, 'batch_norm': True, 'lr': 5.7489274108267205e-06, 'weight_decay': 4.144236509996759e-06, 'epochs': 107, 'loss': 'mae', 'optimizer': 'adam', 'graph_mode': 'off', 'use_snp_selection': False}. Best is trial 40 with value: 0.07016881205196591.
[I 2025-12-05 15:09:34,911] Trial 41 finished with value: 0.0466922116158082 and parameters: {'model_type': 'mlp', 'hidden_dims': '[512, 128]', 'dropout': 0.21336033502673643, 'batch_norm': True, 'lr': 2.320370617557869e-06, 'weight_decay': 3.6227585909139365e-06, 'epochs': 106, 'loss': 'mae', 'optimizer': 'adam', 'graph_mode': 'off', 'use_snp_selection': False}. Best is trial 40 with value: 0.07016881205196591.
[I 2025-12-05 15:09:36,123] Trial 42 finished with value: -0.006116874414126848 and parameters: {'model_type': 'mlp', 'hidden_dims': '[512, 128]', 'dropout': 0.22666207271939548, 'batch_norm': True, 'lr': 5.355472542118224e-06, 'weight_decay': 1.5312671842389321e-06, 'epochs': 84, 'loss': 'mae', 'optimizer': 'adam', 'graph_mode': 'off', 'use_snp_selection': False}. Best is trial 40 with value: 0.07016881205196591.
[I 2025-12-05 15:09:37,612] Trial 43 finished with value: 0.05170742839222209 and parameters: {'model_type': 'mlp', 'hidden_dims': '[512, 128]', 'dropout': 0.16721649992558799, 'batch_norm': True, 'lr': 7.3852251901922554e-06, 'weight_decay': 6.394604859015842e-07, 'epochs': 134, 'loss': 'mae', 'optimizer': 'adam', 'graph_mode': 'off', 'use_snp_selection': False}. Best is trial 40 with value: 0.07016881205196591.
[I 2025-12-05 15:09:38,681] Trial 44 finished with value: 0.011063063769249336 and parameters: {'model_type': 'mlp', 'hidden_dims': '[512, 128]', 'dropout': 0.2553970346472956, 'batch_norm': True, 'lr': 1.9860524167975494e-06, 'weight_decay': 1.7627337617343976e-05, 'epochs': 62, 'loss': 'mae', 'optimizer': 'adam', 'graph_mode': 'off', 'use_snp_selection': False}. Best is trial 40 with value: 0.07016881205196591.
[I 2025-12-05 15:09:39,548] Trial 45 finished with value: 0.01958542286202397 and parameters: {'model_type': 'mlp', 'hidden_dims': '[256, 128]', 'dropout': 0.5754880177444281, 'batch_norm': True, 'lr': 1.2973243018093234e-05, 'weight_decay': 2.1423042532458846e-06, 'epochs': 101, 'loss': 'mae', 'optimizer': 'adam', 'graph_mode': 'off', 'use_snp_selection': False}. Best is trial 40 with value: 0.07016881205196591.
[I 2025-12-05 15:09:41,732] Trial 46 finished with value: 0.030978831837602458 and parameters: {'model_type': 'mlp', 'hidden_dims': '[512, 256]', 'dropout': 0.46491591492856854, 'batch_norm': True, 'lr': 4.51612484245479e-06, 'weight_decay': 9.18085967372721e-07, 'epochs': 262, 'loss': 'mse', 'optimizer': 'adam', 'graph_mode': 'off', 'use_snp_selection': False}. Best is trial 40 with value: 0.07016881205196591.
[I 2025-12-05 15:09:43,295] Trial 47 finished with value: 0.02979628556195592 and parameters: {'model_type': 'mlp', 'hidden_dims': '[512, 128]', 'dropout': 0.11329323208923722, 'batch_norm': False, 'lr': 1.7179989601242734e-05, 'weight_decay': 3.184998275725864e-05, 'epochs': 148, 'loss': 'mae', 'optimizer': 'adam', 'graph_mode': 'off', 'use_snp_selection': False}. Best is trial 40 with value: 0.07016881205196591.
