[I 2025-12-05 14:26:15,553] Trial 1 finished with value: 0.08378728177876453 and parameters: {'model_type': 'mlp', 'hidden_dims': '[256, 128]', 'dropout': 0.4370668075331726, 'batch_norm': True, 'lr': 7.133471581159139e-05, 'weight_decay': 1.128633586803549e-05, 'epochs': 242, 'loss': 'mae', 'optimizer': 'adam', 'graph_mode': 'off', 'use_snp_selection': False}. Best is trial 1 with value: 0.08378728177876453.
[I 2025-12-05 14:26:16,653] Trial 2 finished with value: 0.006468259007486339 and parameters: {'model_type': 'mlp', 'hidden_dims': '[256, 128, 64]', 'dropout': 0.41314357415569625, 'batch_norm': False, 'lr': 3.952233718592101e-06, 'weight_decay': 0.00026754769258252603, 'epochs': 149, 'loss': 'mse', 'optimizer': 'adam', 'graph_mode': 'off', 'use_snp_selection': True, 'num_snps': 11571}. Best is trial 1 with value: 0.08378728177876453.
[I 2025-12-05 14:26:18,806] Trial 3 finished with value: 0.08512180675666478 and parameters: {'model_type': 'mlp', 'hidden_dims': '[512, 64]', 'dropout': 0.5938127374509361, 'batch_norm': False, 'lr': 5.67704586114731e-06, 'weight_decay': 2.4518087630137052e-05, 'epochs': 320, 'loss': 'mae', 'optimizer': 'adam', 'graph_mode': 'off', 'use_snp_selection': False}. Best is trial 3 with value: 0.08512180675666478.
[I 2025-12-05 14:26:21,249] Trial 4 finished with value: 0.017898186242492235 and parameters: {'model_type': 'mlp', 'hidden_dims': '[512, 128]', 'dropout': 0.25746343592134413, 'batch_norm': True, 'lr': 1.3467657668402788e-06, 'weight_decay': 0.00033087251918647806, 'epochs': 277, 'loss': 'mse', 'optimizer': 'adam', 'graph_mode': 'off', 'use_snp_selection': True, 'num_snps': 36675}. Best is trial 3 with value: 0.08512180675666478.
[I 2025-12-05 14:26:23,169] Trial 5 finished with value: 0.048602492127105504 and parameters: {'model_type': 'mlp', 'hidden_dims': '[512, 64]', 'dropout': 0.38275350994408375, 'batch_norm': True, 'lr': 1.5586664309232824e-06, 'weight_decay': 0.0008227664668621182, 'epochs': 145, 'loss': 'mae', 'optimizer': 'adam', 'graph_mode': 'off', 'use_snp_selection': True, 'num_snps': 32148}. Best is trial 3 with value: 0.08512180675666478.
[I 2025-12-05 14:26:24,279] Trial 6 finished with value: 0.10440475081999229 and parameters: {'model_type': 'mlp', 'hidden_dims': '[256, 128]', 'dropout': 0.3930109900265879, 'batch_norm': False, 'lr': 4.892964372128395e-05, 'weight_decay': 1.5809549317992182e-06, 'epochs': 199, 'loss': 'mse', 'optimizer': 'adam', 'graph_mode': 'off', 'use_snp_selection': False}. Best is trial 6 with value: 0.10440475081999229.
[I 2025-12-05 14:26:25,461] Trial 7 finished with value: 0.07944761534402225 and parameters: {'model_type': 'mlp', 'hidden_dims': '[512, 256]', 'dropout': 0.15343979219678458, 'batch_norm': True, 'lr': 6.234003099047341e-05, 'weight_decay': 3.894760610535477e-07, 'epochs': 97, 'loss': 'mse', 'optimizer': 'adam', 'graph_mode': 'off', 'use_snp_selection': False}. Best is trial 6 with value: 0.10440475081999229.
[I 2025-12-05 14:26:27,610] Trial 8 finished with value: 0.10325052845540256 and parameters: {'model_type': 'mlp', 'hidden_dims': '[512, 128]', 'dropout': 0.10743001231661406, 'batch_norm': True, 'lr': 0.00023728538449271062, 'weight_decay': 1.7629071578048637e-05, 'epochs': 312, 'loss': 'mae', 'optimizer': 'adam', 'graph_mode': 'off', 'use_snp_selection': False}. Best is trial 6 with value: 0.10440475081999229.
[I 2025-12-05 14:26:29,146] Trial 9 finished with value: 0.09086968649219969 and parameters: {'model_type': 'mlp', 'hidden_dims': '[512, 64]', 'dropout': 0.14505336736221927, 'batch_norm': True, 'lr': 5.8619638388111826e-05, 'weight_decay': 6.200156172669308e-07, 'epochs': 175, 'loss': 'mse', 'optimizer': 'adam', 'graph_mode': 'off', 'use_snp_selection': False}. Best is trial 6 with value: 0.10440475081999229.
[I 2025-12-05 14:26:29,896] Trial 10 finished with value: 0.04074715749503896 and parameters: {'model_type': 'mlp', 'hidden_dims': '[256, 128]', 'dropout': 0.5267360651501256, 'batch_norm': False, 'lr': 0.00032393778075602147, 'weight_decay': 1.936962886850364e-06, 'epochs': 46, 'loss': 'mse', 'optimizer': 'adam', 'graph_mode': 'off', 'use_snp_selection': False}. Best is trial 6 with value: 0.10440475081999229.
[I 2025-12-05 14:26:31,719] Trial 11 finished with value: 0.08365108029449746 and parameters: {'model_type': 'mlp', 'hidden_dims': '[512, 128]', 'dropout': 0.30438831352760154, 'batch_norm': False, 'lr': 0.0007666984023899753, 'weight_decay': 2.512571353186099e-06, 'epochs': 239, 'loss': 'mae', 'optimizer': 'adam', 'graph_mode': 'off', 'use_snp_selection': False}. Best is trial 6 with value: 0.10440475081999229.
[I 2025-12-05 14:26:33,516] Trial 12 finished with value: 0.08161402355089464 and parameters: {'model_type': 'mlp', 'hidden_dims': '[512, 128]', 'dropout': 0.4779690972965961, 'batch_norm': False, 'lr': 0.00026576228959612443, 'weight_decay': 1.3081036432574914e-07, 'epochs': 235, 'loss': 'mae', 'optimizer': 'adam', 'graph_mode': 'off', 'use_snp_selection': False}. Best is trial 6 with value: 0.10440475081999229.
[I 2025-12-05 14:26:34,847] Trial 13 finished with value: 0.1153860221274694 and parameters: {'model_type': 'mlp', 'hidden_dims': '[256, 128]', 'dropout': 0.3136384318677555, 'batch_norm': False, 'lr': 1.581618310073141e-05, 'weight_decay': 4.380057356309532e-06, 'epochs': 285, 'loss': 'mse', 'optimizer': 'adam', 'graph_mode': 'off', 'use_snp_selection': False}. Best is trial 13 with value: 0.1153860221274694.
[I 2025-12-05 14:26:35,979] Trial 14 finished with value: 0.10202894966636745 and parameters: {'model_type': 'mlp', 'hidden_dims': '[256, 128]', 'dropout': 0.3021083801832578, 'batch_norm': False, 'lr': 1.3867229617671939e-05, 'weight_decay': 2.6283458832588736e-06, 'epochs': 203, 'loss': 'mse', 'optimizer': 'adam', 'graph_mode': 'off', 'use_snp_selection': False}. Best is trial 13 with value: 0.1153860221274694.
[I 2025-12-05 14:26:37,298] Trial 15 finished with value: 0.09210971230818238 and parameters: {'model_type': 'mlp', 'hidden_dims': '[256, 128]', 'dropout': 0.33620663679493723, 'batch_norm': False, 'lr': 1.6267534889505977e-05, 'weight_decay': 4.647398975110266e-06, 'epochs': 277, 'loss': 'mse', 'optimizer': 'adam', 'graph_mode': 'off', 'use_snp_selection': False}. Best is trial 13 with value: 0.1153860221274694.
[I 2025-12-05 14:26:38,433] Trial 16 finished with value: 0.11200935395077256 and parameters: {'model_type': 'mlp', 'hidden_dims': '[256, 128]', 'dropout': 0.2497414295091347, 'batch_norm': False, 'lr': 2.1517090787442848e-05, 'weight_decay': 7.781155070114133e-07, 'epochs': 205, 'loss': 'mse', 'optimizer': 'adam', 'graph_mode': 'off', 'use_snp_selection': False}. Best is trial 13 with value: 0.1153860221274694.
[I 2025-12-05 14:26:39,410] Trial 17 finished with value: 0.09809162872030408 and parameters: {'model_type': 'mlp', 'hidden_dims': '[128, 64]', 'dropout': 0.22127314953398597, 'batch_norm': False, 'lr': 1.5847726974072885e-05, 'weight_decay': 5.506717756601258e-07, 'epochs': 287, 'loss': 'mse', 'optimizer': 'adam', 'graph_mode': 'off', 'use_snp_selection': False}. Best is trial 13 with value: 0.1153860221274694.
[I 2025-12-05 14:26:42,333] Trial 18 finished with value: 0.1079044400871877 and parameters: {'model_type': 'mlp', 'hidden_dims': '[512, 256]', 'dropout': 0.2312628506238401, 'batch_norm': False, 'lr': 5.895320539592683e-06, 'weight_decay': 2.427593612355222e-07, 'epochs': 127, 'loss': 'mse', 'optimizer': 'adam', 'graph_mode': 'off', 'use_snp_selection': True, 'num_snps': 58241}. Best is trial 13 with value: 0.1153860221274694.
[I 2025-12-05 14:26:43,519] Trial 19 finished with value: 0.10187721560293354 and parameters: {'model_type': 'mlp', 'hidden_dims': '[256, 128, 64]', 'dropout': 0.2889047567547643, 'batch_norm': False, 'lr': 2.2667527159931726e-05, 'weight_decay': 6.512390233758319e-06, 'epochs': 220, 'loss': 'mse', 'optimizer': 'adam', 'graph_mode': 'off', 'use_snp_selection': False}. Best is trial 13 with value: 0.1153860221274694.
[I 2025-12-05 14:26:44,811] Trial 20 finished with value: 0.10908349762348685 and parameters: {'model_type': 'mlp', 'hidden_dims': '[256, 128]', 'dropout': 0.3523283052083226, 'batch_norm': False, 'lr': 0.00012060839476420381, 'weight_decay': 4.679666515308887e-05, 'epochs': 272, 'loss': 'mse', 'optimizer': 'adam', 'graph_mode': 'off', 'use_snp_selection': False}. Best is trial 13 with value: 0.1153860221274694.
[I 2025-12-05 14:26:46,068] Trial 21 finished with value: 0.10157190939536455 and parameters: {'model_type': 'mlp', 'hidden_dims': '[256, 128]', 'dropout': 0.3426036956588672, 'batch_norm': False, 'lr': 0.00011467620668229786, 'weight_decay': 6.331291676273367e-05, 'epochs': 256, 'loss': 'mse', 'optimizer': 'adam', 'graph_mode': 'off', 'use_snp_selection': False}. Best is trial 13 with value: 0.1153860221274694.
[I 2025-12-05 14:26:47,423] Trial 22 finished with value: 0.10549586032974147 and parameters: {'model_type': 'mlp', 'hidden_dims': '[256, 128]', 'dropout': 0.2628592254695387, 'batch_norm': False, 'lr': 3.511276726977528e-05, 'weight_decay': 4.6881323524619394e-05, 'epochs': 299, 'loss': 'mse', 'optimizer': 'adam', 'graph_mode': 'off', 'use_snp_selection': False}. Best is trial 13 with value: 0.1153860221274694.
[I 2025-12-05 14:26:48,896] Trial 23 finished with value: 0.09629231682433602 and parameters: {'model_type': 'mlp', 'hidden_dims': '[256, 128]', 'dropout': 0.3537767545138193, 'batch_norm': False, 'lr': 0.00011008403899721022, 'weight_decay': 0.00014061128063276327, 'epochs': 346, 'loss': 'mse', 'optimizer': 'adam', 'graph_mode': 'off', 'use_snp_selection': False}. Best is trial 13 with value: 0.1153860221274694.
[I 2025-12-05 14:26:50,179] Trial 24 finished with value: 0.072167811884151 and parameters: {'model_type': 'mlp', 'hidden_dims': '[256, 128]', 'dropout': 0.45667649267326893, 'batch_norm': False, 'lr': 8.700545488043742e-06, 'weight_decay': 1.0142456955169876e-06, 'epochs': 269, 'loss': 'mse', 'optimizer': 'adam', 'graph_mode': 'off', 'use_snp_selection': False}. Best is trial 13 with value: 0.1153860221274694.
[I 2025-12-05 14:26:51,333] Trial 25 finished with value: 0.11124200983678047 and parameters: {'model_type': 'mlp', 'hidden_dims': '[256, 128]', 'dropout': 0.1859606717259252, 'batch_norm': False, 'lr': 3.265787863435542e-05, 'weight_decay': 4.290515925582516e-06, 'epochs': 213, 'loss': 'mse', 'optimizer': 'adam', 'graph_mode': 'off', 'use_snp_selection': False}. Best is trial 13 with value: 0.1153860221274694.
[I 2025-12-05 14:26:52,233] Trial 26 finished with value: 0.06699227998824371 and parameters: {'model_type': 'mlp', 'hidden_dims': '[256, 128]', 'dropout': 0.19050734863233265, 'batch_norm': False, 'lr': 2.7589468334235264e-05, 'weight_decay': 6.59203671805988e-06, 'epochs': 187, 'loss': 'mse', 'optimizer': 'adam', 'graph_mode': 'off', 'use_snp_selection': True, 'num_snps': 3842}. Best is trial 13 with value: 0.1153860221274694.
[I 2025-12-05 14:26:53,406] Trial 27 finished with value: 0.10340722168996701 and parameters: {'model_type': 'mlp', 'hidden_dims': '[256, 128, 64]', 'dropout': 0.16232010945202782, 'batch_norm': False, 'lr': 8.955006726520658e-06, 'weight_decay': 9.75891770057729e-07, 'epochs': 218, 'loss': 'mse', 'optimizer': 'adam', 'graph_mode': 'off', 'use_snp_selection': False}. Best is trial 13 with value: 0.1153860221274694.
[I 2025-12-05 14:26:54,203] Trial 28 finished with value: 0.12620961881475917 and parameters: {'model_type': 'mlp', 'hidden_dims': '[128, 64]', 'dropout': 0.11009434626391049, 'batch_norm': False, 'lr': 3.5954612123657794e-05, 'weight_decay': 1.0021012443713701e-07, 'epochs': 170, 'loss': 'mse', 'optimizer': 'adam', 'graph_mode': 'off', 'use_snp_selection': False}. Best is trial 28 with value: 0.12620961881475917.
[I 2025-12-05 14:26:55,482] Trial 29 finished with value: 0.07531903780030226 and parameters: {'model_type': 'mlp', 'hidden_dims': '[128, 64]', 'dropout': 0.10566343169673023, 'batch_norm': False, 'lr': 2.8966762461994946e-06, 'weight_decay': 1.2367616041279703e-07, 'epochs': 115, 'loss': 'mse', 'optimizer': 'adam', 'graph_mode': 'off', 'use_snp_selection': True, 'num_snps': 19468}. Best is trial 28 with value: 0.12620961881475917.
[I 2025-12-05 14:26:56,284] Trial 30 finished with value: 0.09302682961050723 and parameters: {'model_type': 'mlp', 'hidden_dims': '[128, 64]', 'dropout': 0.23210888433826693, 'batch_norm': False, 'lr': 1.0565120790859443e-05, 'weight_decay': 2.405740960306226e-07, 'epochs': 168, 'loss': 'mse', 'optimizer': 'adam', 'graph_mode': 'off', 'use_snp_selection': False}. Best is trial 28 with value: 0.12620961881475917.
[I 2025-12-05 14:26:57,062] Trial 31 finished with value: 0.12200353371698941 and parameters: {'model_type': 'mlp', 'hidden_dims': '[128, 64]', 'dropout': 0.17591621662015788, 'batch_norm': False, 'lr': 3.412241017763277e-05, 'weight_decay': 4.015011949067936e-06, 'epochs': 156, 'loss': 'mse', 'optimizer': 'adam', 'graph_mode': 'off', 'use_snp_selection': False}. Best is trial 28 with value: 0.12620961881475917.
[I 2025-12-05 14:26:57,758] Trial 32 finished with value: 0.13515378067215644 and parameters: {'model_type': 'mlp', 'hidden_dims': '[128, 64]', 'dropout': 0.13129721623477364, 'batch_norm': False, 'lr': 2.0454342219863346e-05, 'weight_decay': 1.0243544503017875e-05, 'epochs': 87, 'loss': 'mse', 'optimizer': 'adam', 'graph_mode': 'off', 'use_snp_selection': False}. Best is trial 32 with value: 0.13515378067215644.
[I 2025-12-05 14:26:58,547] Trial 33 finished with value: 0.13018625788416116 and parameters: {'model_type': 'mlp', 'hidden_dims': '[128, 64]', 'dropout': 0.1203752009537421, 'batch_norm': False, 'lr': 4.158840837605535e-05, 'weight_decay': 1.2899822494251961e-05, 'epochs': 154, 'loss': 'mse', 'optimizer': 'adam', 'graph_mode': 'off', 'use_snp_selection': False}. Best is trial 32 with value: 0.13515378067215644.
[I 2025-12-05 14:26:59,229] Trial 34 finished with value: 0.09202736579750681 and parameters: {'model_type': 'mlp', 'hidden_dims': '[128, 64]', 'dropout': 0.13347707885614424, 'batch_norm': False, 'lr': 4.111953768407196e-05, 'weight_decay': 1.3119519928055209e-05, 'epochs': 75, 'loss': 'mae', 'optimizer': 'adam', 'graph_mode': 'off', 'use_snp_selection': False}. Best is trial 32 with value: 0.13515378067215644.
[I 2025-12-05 14:26:59,991] Trial 35 finished with value: 0.06793613747345337 and parameters: {'model_type': 'mlp', 'hidden_dims': '[128, 64]', 'dropout': 0.12409636082539559, 'batch_norm': True, 'lr': 7.653389859369558e-05, 'weight_decay': 3.384902986350159e-05, 'epochs': 135, 'loss': 'mse', 'optimizer': 'adam', 'graph_mode': 'off', 'use_snp_selection': False}. Best is trial 32 with value: 0.13515378067215644.
[I 2025-12-05 14:27:02,490] Trial 36 finished with value: 0.10761118641273852 and parameters: {'model_type': 'mlp', 'hidden_dims': '[128, 64]', 'dropout': 0.17521200946810195, 'batch_norm': False, 'lr': 7.786858975214307e-05, 'weight_decay': 1.0687295154404784e-05, 'epochs': 163, 'loss': 'mse', 'optimizer': 'adam', 'graph_mode': 'off', 'use_snp_selection': True, 'num_snps': 58661}. Best is trial 32 with value: 0.13515378067215644.
[I 2025-12-05 14:27:03,173] Trial 37 finished with value: 0.10474474650873325 and parameters: {'model_type': 'mlp', 'hidden_dims': '[128, 64]', 'dropout': 0.20756871511263542, 'batch_norm': False, 'lr': 0.00017294594235990753, 'weight_decay': 9.096918760018813e-05, 'epochs': 83, 'loss': 'mae', 'optimizer': 'adam', 'graph_mode': 'off', 'use_snp_selection': False}. Best is trial 32 with value: 0.13515378067215644.
[I 2025-12-05 14:27:04,481] Trial 38 finished with value: 0.06002224476698159 and parameters: {'model_type': 'mlp', 'hidden_dims': '[128, 64]', 'dropout': 0.10011832243332633, 'batch_norm': True, 'lr': 4.07135534070799e-05, 'weight_decay': 2.4979284025475955e-05, 'epochs': 114, 'loss': 'mse', 'optimizer': 'adam', 'graph_mode': 'off', 'use_snp_selection': True, 'num_snps': 19911}. Best is trial 32 with value: 0.13515378067215644.
[I 2025-12-05 14:27:05,116] Trial 39 finished with value: 0.05616321620301082 and parameters: {'model_type': 'mlp', 'hidden_dims': '[128, 64]', 'dropout': 0.13487896575644365, 'batch_norm': False, 'lr': 2.584967450918537e-06, 'weight_decay': 0.0002209964840538803, 'epochs': 48, 'loss': 'mse', 'optimizer': 'adam', 'graph_mode': 'off', 'use_snp_selection': False}. Best is trial 32 with value: 0.13515378067215644.
[I 2025-12-05 14:27:05,900] Trial 40 finished with value: -0.030754492305260943 and parameters: {'model_type': 'mlp', 'hidden_dims': '[128, 64]', 'dropout': 0.15999598571556417, 'batch_norm': True, 'lr': 5.7489274108267205e-06, 'weight_decay': 2.213403518188057e-05, 'epochs': 147, 'loss': 'mae', 'optimizer': 'adam', 'graph_mode': 'off', 'use_snp_selection': False}. Best is trial 32 with value: 0.13515378067215644.
[I 2025-12-05 14:27:06,714] Trial 41 finished with value: 0.11957033766218157 and parameters: {'model_type': 'mlp', 'hidden_dims': '[128, 64]', 'dropout': 0.12308769766239272, 'batch_norm': False, 'lr': 2.2572817695576678e-05, 'weight_decay': 7.1596880971865045e-06, 'epochs': 184, 'loss': 'mse', 'optimizer': 'adam', 'graph_mode': 'off', 'use_snp_selection': False}. Best is trial 32 with value: 0.13515378067215644.
[I 2025-12-05 14:27:07,537] Trial 42 finished with value: 0.12060174711488932 and parameters: {'model_type': 'mlp', 'hidden_dims': '[128, 64]', 'dropout': 0.1241019729365039, 'batch_norm': False, 'lr': 2.4124005163973522e-05, 'weight_decay': 7.804596755060369e-06, 'epochs': 188, 'loss': 'mse', 'optimizer': 'adam', 'graph_mode': 'off', 'use_snp_selection': False}. Best is trial 32 with value: 0.13515378067215644.
[I 2025-12-05 14:27:08,310] Trial 43 finished with value: 0.10273850552367768 and parameters: {'model_type': 'mlp', 'hidden_dims': '[128, 64]', 'dropout': 0.15294114907740458, 'batch_norm': False, 'lr': 5.456264535839795e-05, 'weight_decay': 1.1760560024174401e-05, 'epochs': 154, 'loss': 'mse', 'optimizer': 'adam', 'graph_mode': 'off', 'use_snp_selection': False}. Best is trial 32 with value: 0.13515378067215644.
[I 2025-12-05 14:27:09,834] Trial 44 finished with value: 0.09846141582516037 and parameters: {'model_type': 'mlp', 'hidden_dims': '[512, 64]', 'dropout': 0.17411522923261935, 'batch_norm': False, 'lr': 2.9775931587527753e-05, 'weight_decay': 1.4956631475287801e-05, 'epochs': 176, 'loss': 'mse', 'optimizer': 'adam', 'graph_mode': 'off', 'use_snp_selection': False}. Best is trial 32 with value: 0.13515378067215644.
[I 2025-12-05 14:27:10,556] Trial 45 finished with value: 0.09711117125812235 and parameters: {'model_type': 'mlp', 'hidden_dims': '[128, 64]', 'dropout': 0.10013967953449086, 'batch_norm': False, 'lr': 4.8140638090041075e-05, 'weight_decay': 0.00048787932251375543, 'epochs': 106, 'loss': 'mse', 'optimizer': 'adam', 'graph_mode': 'off', 'use_snp_selection': False}. Best is trial 32 with value: 0.13515378067215644.
[I 2025-12-05 14:27:11,927] Trial 46 finished with value: 0.043776780786998065 and parameters: {'model_type': 'mlp', 'hidden_dims': '[512, 256]', 'dropout': 0.12762021917131747, 'batch_norm': True, 'lr': 1.1284505262551122e-05, 'weight_decay': 2.9349508049494686e-06, 'epochs': 134, 'loss': 'mse', 'optimizer': 'adam', 'graph_mode': 'off', 'use_snp_selection': False}. Best is trial 32 with value: 0.13515378067215644.
[I 2025-12-05 14:27:12,615] Trial 47 finished with value: 0.11132002876907958 and parameters: {'model_type': 'mlp', 'hidden_dims': '[128, 64]', 'dropout': 0.20321510097911252, 'batch_norm': False, 'lr': 2.082717571347774e-05, 'weight_decay': 8.015416156154549e-06, 'epochs': 87, 'loss': 'mse', 'optimizer': 'adam', 'graph_mode': 'off', 'use_snp_selection': False}. Best is trial 32 with value: 0.13515378067215644.
[I 2025-12-05 14:27:13,269] Trial 48 finished with value: 0.028657163415712093 and parameters: {'model_type': 'mlp', 'hidden_dims': '[128, 64]', 'dropout': 0.15081920170551497, 'batch_norm': False, 'lr': 1.1170552432785515e-06, 'weight_decay': 1.6160258608912388e-06, 'epochs': 63, 'loss': 'mae', 'optimizer': 'adam', 'graph_mode': 'off', 'use_snp_selection': False}. Best is trial 32 with value: 0.13515378067215644.
[I 2025-12-05 14:27:15,819] Trial 49 finished with value: 0.09441849971417904 and parameters: {'model_type': 'mlp', 'hidden_dims': '[512, 64]', 'dropout': 0.12332633079112346, 'batch_norm': False, 'lr': 7.174473302478434e-05, 'weight_decay': 3.1009744215797414e-05, 'epochs': 155, 'loss': 'mse', 'optimizer': 'adam', 'graph_mode': 'off', 'use_snp_selection': True, 'num_snps': 46888}. Best is trial 32 with value: 0.13515378067215644.
[I 2025-12-05 14:27:17,416] Trial 50 finished with value: 0.09423606931457323 and parameters: {'model_type': 'mlp', 'hidden_dims': '[512, 128]', 'dropout': 0.17238255127853408, 'batch_norm': False, 'lr': 7.223438058720625e-06, 'weight_decay': 1.8366967006656116e-05, 'epochs': 190, 'loss': 'mse', 'optimizer': 'adam', 'graph_mode': 'off', 'use_snp_selection': False}. Best is trial 32 with value: 0.13515378067215644.
[I 2025-12-05 14:27:18,237] Trial 51 finished with value: 0.11129106394121559 and parameters: {'model_type': 'mlp', 'hidden_dims': '[128, 64]', 'dropout': 0.12158428853131821, 'batch_norm': False, 'lr': 2.19099259587817e-05, 'weight_decay': 8.060954551469612e-06, 'epochs': 177, 'loss': 'mse', 'optimizer': 'adam', 'graph_mode': 'off', 'use_snp_selection': False}. Best is trial 32 with value: 0.13515378067215644.
[I 2025-12-05 14:27:19,078] Trial 52 finished with value: 0.10892516763673495 and parameters: {'model_type': 'mlp', 'hidden_dims': '[128, 64]', 'dropout': 0.14270258137741898, 'batch_norm': False, 'lr': 2.802084955673939e-05, 'weight_decay': 4.603686903494146e-06, 'epochs': 195, 'loss': 'mse', 'optimizer': 'adam', 'graph_mode': 'off', 'use_snp_selection': False}. Best is trial 32 with value: 0.13515378067215644.
