[I 2025-12-05 15:42:50,261] Trial 34 finished with value: 0.04238499696531872 and parameters: {'model_type': 'mlp', 'hidden_dims': '[512, 256]', 'dropout': 0.4263319862272358, 'batch_norm': False, 'lr': 1.1506663514979091e-05, 'weight_decay': 0.0004715811226204324, 'epochs': 233, 'loss': 'mae', 'optimizer': 'adam', 'graph_mode': 'off', 'use_snp_selection': False}. Best is trial 24 with value: 0.09185736455113036.
[I 2025-12-05 15:42:51,316] Trial 35 finished with value: 0.04198607194087351 and parameters: {'model_type': 'mlp', 'hidden_dims': '[256, 128, 64]', 'dropout': 0.32859919715744057, 'batch_norm': False, 'lr': 2.1563522918414133e-05, 'weight_decay': 0.00019850962167072058, 'epochs': 189, 'loss': 'mae', 'optimizer': 'adam', 'graph_mode': 'off', 'use_snp_selection': False}. Best is trial 24 with value: 0.09185736455113036.
[I 2025-12-05 15:42:52,682] Trial 36 finished with value: 0.05366022987321427 and parameters: {'model_type': 'mlp', 'hidden_dims': '[512, 256]', 'dropout': 0.3864240623375499, 'batch_norm': False, 'lr': 6.986122556737192e-05, 'weight_decay': 0.0005386510572867984, 'epochs': 166, 'loss': 'mae', 'optimizer': 'adam', 'graph_mode': 'off', 'use_snp_selection': False}. Best is trial 24 with value: 0.09185736455113036.
[I 2025-12-05 15:42:53,648] Trial 37 finished with value: 0.040237394028563994 and parameters: {'model_type': 'mlp', 'hidden_dims': '[256, 128]', 'dropout': 0.4062951675989717, 'batch_norm': False, 'lr': 9.843672571378387e-05, 'weight_decay': 1.7932900725500178e-05, 'epochs': 153, 'loss': 'mae', 'optimizer': 'adam', 'graph_mode': 'off', 'use_snp_selection': False}. Best is trial 24 with value: 0.09185736455113036.
[I 2025-12-05 15:42:54,819] Trial 38 finished with value: 0.050864308707788713 and parameters: {'model_type': 'mlp', 'hidden_dims': '[512, 256]', 'dropout': 0.2935377090790994, 'batch_norm': False, 'lr': 4.9919292081996374e-05, 'weight_decay': 0.00032790320396999307, 'epochs': 108, 'loss': 'mae', 'optimizer': 'adam', 'graph_mode': 'off', 'use_snp_selection': False}. Best is trial 24 with value: 0.09185736455113036.
[I 2025-12-05 15:42:55,631] Trial 39 finished with value: -0.002935079230345728 and parameters: {'model_type': 'mlp', 'hidden_dims': '[128, 64]', 'dropout': 0.520919702303111, 'batch_norm': False, 'lr': 0.00030536688345922966, 'weight_decay': 3.7504541983940596e-05, 'epochs': 203, 'loss': 'mae', 'optimizer': 'adam', 'graph_mode': 'off', 'use_snp_selection': False}. Best is trial 24 with value: 0.09185736455113036.
[I 2025-12-05 15:42:56,372] Trial 40 finished with value: 0.04264992490323918 and parameters: {'model_type': 'mlp', 'hidden_dims': '[256, 128, 64]', 'dropout': 0.4492565260971921, 'batch_norm': False, 'lr': 2.9995219860471344e-05, 'weight_decay': 8.338873875759347e-05, 'epochs': 51, 'loss': 'mae', 'optimizer': 'adam', 'graph_mode': 'off', 'use_snp_selection': False}. Best is trial 24 with value: 0.09185736455113036.
[I 2025-12-05 15:42:57,605] Trial 41 finished with value: 0.03915984259849569 and parameters: {'model_type': 'mlp', 'hidden_dims': '[512, 256]', 'dropout': 0.4611778983325829, 'batch_norm': False, 'lr': 4.021741459500472e-05, 'weight_decay': 8.336472980757346e-06, 'epochs': 136, 'loss': 'mae', 'optimizer': 'adam', 'graph_mode': 'off', 'use_snp_selection': False}. Best is trial 24 with value: 0.09185736455113036.
[I 2025-12-05 15:42:58,637] Trial 42 finished with value: 0.05173996366511764 and parameters: {'model_type': 'mlp', 'hidden_dims': '[512, 256]', 'dropout': 0.3749794619912453, 'batch_norm': False, 'lr': 5.5811186475581875e-05, 'weight_decay': 1.644650239762966e-05, 'epochs': 79, 'loss': 'mae', 'optimizer': 'adam', 'graph_mode': 'off', 'use_snp_selection': False}. Best is trial 24 with value: 0.09185736455113036.
[I 2025-12-05 15:42:59,916] Trial 43 finished with value: 0.05089193064776239 and parameters: {'model_type': 'mlp', 'hidden_dims': '[512, 256]', 'dropout': 0.437878064536859, 'batch_norm': False, 'lr': 1.4604357550246119e-05, 'weight_decay': 2.1703286407861307e-07, 'epochs': 139, 'loss': 'mae', 'optimizer': 'adam', 'graph_mode': 'off', 'use_snp_selection': False}. Best is trial 24 with value: 0.09185736455113036.
[I 2025-12-05 15:43:01,216] Trial 44 finished with value: 0.04645935749848379 and parameters: {'model_type': 'mlp', 'hidden_dims': '[512, 256]', 'dropout': 0.40412173933891554, 'batch_norm': False, 'lr': 0.00017836223785577294, 'weight_decay': 1.3181803412453508e-06, 'epochs': 157, 'loss': 'mae', 'optimizer': 'adam', 'graph_mode': 'off', 'use_snp_selection': False}. Best is trial 24 with value: 0.09185736455113036.
[I 2025-12-05 15:43:02,380] Trial 45 finished with value: 0.04358362743964957 and parameters: {'model_type': 'mlp', 'hidden_dims': '[256, 128]', 'dropout': 0.3410692021301287, 'batch_norm': False, 'lr': 2.0211295520217384e-05, 'weight_decay': 0.0001619133755179058, 'epochs': 252, 'loss': 'mae', 'optimizer': 'adam', 'graph_mode': 'off', 'use_snp_selection': False}. Best is trial 24 with value: 0.09185736455113036.
[I 2025-12-05 15:43:03,966] Trial 46 finished with value: 0.1006960060302028 and parameters: {'model_type': 'mlp', 'hidden_dims': '[512, 256]', 'dropout': 0.5145015687423715, 'batch_norm': False, 'lr': 9.95204341695252e-06, 'weight_decay': 4.2307418217278955e-07, 'epochs': 222, 'loss': 'mae', 'optimizer': 'adam', 'graph_mode': 'off', 'use_snp_selection': False}. Best is trial 46 with value: 0.1006960060302028.
[I 2025-12-05 15:43:05,085] Trial 47 finished with value: 0.03519385823438893 and parameters: {'model_type': 'mlp', 'hidden_dims': '[256, 128]', 'dropout': 0.5774793336797921, 'batch_norm': False, 'lr': 1.032029922509148e-05, 'weight_decay': 4.531360047636553e-07, 'epochs': 225, 'loss': 'mae', 'optimizer': 'adam', 'graph_mode': 'off', 'use_snp_selection': False}. Best is trial 46 with value: 0.1006960060302028.
[I 2025-12-05 15:43:05,893] Trial 48 finished with value: 0.03895347727027873 and parameters: {'model_type': 'mlp', 'hidden_dims': '[512, 256]', 'dropout': 0.5201616711022289, 'batch_norm': False, 'lr': 2.675421250294172e-05, 'weight_decay': 2.825761016679828e-07, 'epochs': 182, 'loss': 'mse', 'optimizer': 'adam', 'graph_mode': 'off', 'use_snp_selection': True, 'num_snps': 2035}. Best is trial 46 with value: 0.1006960060302028.
[I 2025-12-05 15:43:07,385] Trial 49 finished with value: 0.043175893283685485 and parameters: {'model_type': 'mlp', 'hidden_dims': '[512, 256]', 'dropout': 0.5645525640646419, 'batch_norm': True, 'lr': 9.764969220619084e-05, 'weight_decay': 2.319894102306265e-06, 'epochs': 198, 'loss': 'mae', 'optimizer': 'adam', 'graph_mode': 'off', 'use_snp_selection': False}. Best is trial 46 with value: 0.1006960060302028.
[I 2025-12-05 15:43:08,277] Trial 50 finished with value: 0.025914191416261504 and parameters: {'model_type': 'mlp', 'hidden_dims': '[128, 64]', 'dropout': 0.5973467953691757, 'batch_norm': False, 'lr': 1.3340148652233847e-05, 'weight_decay': 1.3701432989367974e-06, 'epochs': 244, 'loss': 'mse', 'optimizer': 'adam', 'graph_mode': 'off', 'use_snp_selection': False}. Best is trial 46 with value: 0.1006960060302028.
[I 2025-12-05 15:43:10,052] Trial 51 finished with value: 0.06479629498042538 and parameters: {'model_type': 'mlp', 'hidden_dims': '[512, 256]', 'dropout': 0.5008509390194622, 'batch_norm': False, 'lr': 5.301798256098548e-05, 'weight_decay': 1.0864103372644088e-05, 'epochs': 293, 'loss': 'mae', 'optimizer': 'adam', 'graph_mode': 'off', 'use_snp_selection': False}. Best is trial 46 with value: 0.1006960060302028.
[I 2025-12-05 15:43:11,241] Trial 52 finished with value: 0.07325604495439067 and parameters: {'model_type': 'mlp', 'hidden_dims': '[512, 256]', 'dropout': 0.47374137388974047, 'batch_norm': False, 'lr': 4.574679782281945e-05, 'weight_decay': 4.483177988951278e-06, 'epochs': 125, 'loss': 'mae', 'optimizer': 'adam', 'graph_mode': 'off', 'use_snp_selection': False}. Best is trial 46 with value: 0.1006960060302028.
[I 2025-12-05 15:43:13,147] Trial 53 finished with value: 0.06641999406217985 and parameters: {'model_type': 'mlp', 'hidden_dims': '[512, 256]', 'dropout': 0.5332132702099306, 'batch_norm': False, 'lr': 7.223128417000988e-05, 'weight_decay': 0.0007839869577456285, 'epochs': 333, 'loss': 'mae', 'optimizer': 'adam', 'graph_mode': 'off', 'use_snp_selection': False}. Best is trial 46 with value: 0.1006960060302028.
[I 2025-12-05 15:43:15,659] Trial 54 finished with value: 0.058849182644450555 and parameters: {'model_type': 'mlp', 'hidden_dims': '[256, 128]', 'dropout': 0.46482820737595326, 'batch_norm': False, 'lr': 4.155999356474414e-06, 'weight_decay': 7.840508802061133e-07, 'epochs': 173, 'loss': 'mae', 'optimizer': 'adam', 'graph_mode': 'off', 'use_snp_selection': True, 'num_snps': 56459}. Best is trial 46 with value: 0.1006960060302028.
[I 2025-12-05 15:43:17,235] Trial 55 finished with value: 0.022893327463345138 and parameters: {'model_type': 'mlp', 'hidden_dims': '[512, 256]', 'dropout': 0.4418221838156646, 'batch_norm': True, 'lr': 2.995883194580542e-05, 'weight_decay': 4.7049759379565303e-07, 'epochs': 222, 'loss': 'mse', 'optimizer': 'adam', 'graph_mode': 'off', 'use_snp_selection': False}. Best is trial 46 with value: 0.1006960060302028.
[I 2025-12-05 15:43:18,207] Trial 56 finished with value: 0.05199555597389805 and parameters: {'model_type': 'mlp', 'hidden_dims': '[256, 128, 64]', 'dropout': 0.3652039863002489, 'batch_norm': False, 'lr': 2.106542790303714e-05, 'weight_decay': 1.864491787224837e-07, 'epochs': 148, 'loss': 'mae', 'optimizer': 'adam', 'graph_mode': 'off', 'use_snp_selection': False}. Best is trial 46 with value: 0.1006960060302028.
[I 2025-12-05 15:43:19,667] Trial 57 finished with value: 0.09118129822865566 and parameters: {'model_type': 'mlp', 'hidden_dims': '[512, 128]', 'dropout': 0.3857617010825364, 'batch_norm': False, 'lr': 0.00013111875216653587, 'weight_decay': 0.000255626545803386, 'epochs': 193, 'loss': 'mae', 'optimizer': 'adam', 'graph_mode': 'off', 'use_snp_selection': False}. Best is trial 46 with value: 0.1006960060302028.
[I 2025-12-05 15:43:21,090] Trial 58 finished with value: 0.05189049349520908 and parameters: {'model_type': 'mlp', 'hidden_dims': '[512, 128]', 'dropout': 0.3047861630152809, 'batch_norm': False, 'lr': 0.0005477351197276321, 'weight_decay': 0.0002868199383745814, 'epochs': 261, 'loss': 'mse', 'optimizer': 'adam', 'graph_mode': 'off', 'use_snp_selection': True, 'num_snps': 19397}. Best is trial 46 with value: 0.1006960060302028.
[I 2025-12-05 15:43:22,589] Trial 59 finished with value: 0.07735766385499167 and parameters: {'model_type': 'mlp', 'hidden_dims': '[512, 128]', 'dropout': 0.27943402605574275, 'batch_norm': False, 'lr': 0.00015043858739287018, 'weight_decay': 0.0006936864077656562, 'epochs': 205, 'loss': 'mae', 'optimizer': 'adam', 'graph_mode': 'off', 'use_snp_selection': False}. Best is trial 46 with value: 0.1006960060302028.
[I 2025-12-05 15:43:24,076] Trial 60 finished with value: 0.05893311706411675 and parameters: {'model_type': 'mlp', 'hidden_dims': '[512, 128]', 'dropout': 0.22910831688169148, 'batch_norm': False, 'lr': 0.000448125977238236, 'weight_decay': 0.0006346395938495312, 'epochs': 212, 'loss': 'mae', 'optimizer': 'adam', 'graph_mode': 'off', 'use_snp_selection': False}. Best is trial 46 with value: 0.1006960060302028.
[I 2025-12-05 15:43:25,492] Trial 61 finished with value: 0.054667048294154565 and parameters: {'model_type': 'mlp', 'hidden_dims': '[512, 128]', 'dropout': 0.3870403161268064, 'batch_norm': False, 'lr': 0.00012833480952420998, 'weight_decay': 0.0004037987576499971, 'epochs': 191, 'loss': 'mae', 'optimizer': 'adam', 'graph_mode': 'off', 'use_snp_selection': False}. Best is trial 46 with value: 0.1006960060302028.
[I 2025-12-05 15:43:26,867] Trial 62 finished with value: 0.08882570243511433 and parameters: {'model_type': 'mlp', 'hidden_dims': '[512, 128]', 'dropout': 0.1528020248746829, 'batch_norm': False, 'lr': 0.00013536166520132864, 'weight_decay': 0.00024561440169956457, 'epochs': 181, 'loss': 'mae', 'optimizer': 'adam', 'graph_mode': 'off', 'use_snp_selection': False}. Best is trial 46 with value: 0.1006960060302028.
[I 2025-12-05 15:43:28,273] Trial 63 finished with value: 0.07777535360188434 and parameters: {'model_type': 'mlp', 'hidden_dims': '[512, 128]', 'dropout': 0.1717285473508281, 'batch_norm': False, 'lr': 0.00021411414065151442, 'weight_decay': 0.0002276045602976745, 'epochs': 179, 'loss': 'mae', 'optimizer': 'adam', 'graph_mode': 'off', 'use_snp_selection': False}. Best is trial 46 with value: 0.1006960060302028.
[I 2025-12-05 15:43:29,683] Trial 64 finished with value: 0.05804963961984014 and parameters: {'model_type': 'mlp', 'hidden_dims': '[512, 128]', 'dropout': 0.1723088874399883, 'batch_norm': False, 'lr': 0.00019414361351977811, 'weight_decay': 0.0001317571457493318, 'epochs': 178, 'loss': 'mae', 'optimizer': 'adam', 'graph_mode': 'off', 'use_snp_selection': False}. Best is trial 46 with value: 0.1006960060302028.
[I 2025-12-05 15:43:31,045] Trial 65 finished with value: 0.07475259657861048 and parameters: {'model_type': 'mlp', 'hidden_dims': '[512, 128]', 'dropout': 0.16165202358081993, 'batch_norm': True, 'lr': 0.00025776632250329993, 'weight_decay': 0.00023494773499283745, 'epochs': 163, 'loss': 'mae', 'optimizer': 'adam', 'graph_mode': 'off', 'use_snp_selection': False}. Best is trial 46 with value: 0.1006960060302028.
[I 2025-12-05 15:43:32,494] Trial 66 finished with value: 0.06549270677653948 and parameters: {'model_type': 'mlp', 'hidden_dims': '[512, 128]', 'dropout': 0.1329614143751844, 'batch_norm': False, 'lr': 0.0003965930754778855, 'weight_decay': 0.0003887198716541362, 'epochs': 191, 'loss': 'mae', 'optimizer': 'adam', 'graph_mode': 'off', 'use_snp_selection': False}. Best is trial 46 with value: 0.1006960060302028.
[I 2025-12-05 15:43:33,878] Trial 67 finished with value: 0.07822852854579593 and parameters: {'model_type': 'mlp', 'hidden_dims': '[512, 128]', 'dropout': 0.10151060462372566, 'batch_norm': False, 'lr': 0.0002359981144660859, 'weight_decay': 0.00019651131574218662, 'epochs': 174, 'loss': 'mae', 'optimizer': 'adam', 'graph_mode': 'off', 'use_snp_selection': False}. Best is trial 46 with value: 0.1006960060302028.
[I 2025-12-05 15:43:35,472] Trial 68 finished with value: 0.06310294646067746 and parameters: {'model_type': 'mlp', 'hidden_dims': '[512, 128]', 'dropout': 0.10808793389179949, 'batch_norm': False, 'lr': 0.0006960482132805147, 'weight_decay': 0.00010130672128415057, 'epochs': 230, 'loss': 'mae', 'optimizer': 'adam', 'graph_mode': 'off', 'use_snp_selection': False}. Best is trial 46 with value: 0.1006960060302028.
[I 2025-12-05 15:43:36,755] Trial 69 finished with value: 0.060567377135925936 and parameters: {'model_type': 'mlp', 'hidden_dims': '[512, 64]', 'dropout': 0.11762170638463705, 'batch_norm': False, 'lr': 0.00011241366426874958, 'weight_decay': 6.81394093001169e-05, 'epochs': 153, 'loss': 'mae', 'optimizer': 'adam', 'graph_mode': 'off', 'use_snp_selection': False}. Best is trial 46 with value: 0.1006960060302028.
[I 2025-12-05 15:43:39,786] Trial 70 finished with value: 0.04778094713381706 and parameters: {'model_type': 'mlp', 'hidden_dims': '[512, 128]', 'dropout': 0.100663570778564, 'batch_norm': False, 'lr': 2.081412116168848e-06, 'weight_decay': 0.00016124369512722492, 'epochs': 302, 'loss': 'mae', 'optimizer': 'adam', 'graph_mode': 'off', 'use_snp_selection': True, 'num_snps': 52353}. Best is trial 46 with value: 0.1006960060302028.
[I 2025-12-05 15:43:41,147] Trial 71 finished with value: 0.06867494483553821 and parameters: {'model_type': 'mlp', 'hidden_dims': '[512, 128]', 'dropout': 0.14321968642140193, 'batch_norm': False, 'lr': 0.00021616494707456428, 'weight_decay': 0.0002034518080186866, 'epochs': 175, 'loss': 'mae', 'optimizer': 'adam', 'graph_mode': 'off', 'use_snp_selection': False}. Best is trial 46 with value: 0.1006960060302028.
[I 2025-12-05 15:43:42,601] Trial 72 finished with value: 0.0603336729990083 and parameters: {'model_type': 'mlp', 'hidden_dims': '[512, 128]', 'dropout': 0.19282481066480212, 'batch_norm': False, 'lr': 0.0002794360455151114, 'weight_decay': 0.000978298726763896, 'epochs': 184, 'loss': 'mae', 'optimizer': 'adam', 'graph_mode': 'off', 'use_snp_selection': False}. Best is trial 46 with value: 0.1006960060302028.
[I 2025-12-05 15:43:43,984] Trial 73 finished with value: 0.07184047196929952 and parameters: {'model_type': 'mlp', 'hidden_dims': '[512, 128]', 'dropout': 0.1768689430912815, 'batch_norm': False, 'lr': 0.0004074035490828307, 'weight_decay': 0.0002212094685129489, 'epochs': 170, 'loss': 'mae', 'optimizer': 'adam', 'graph_mode': 'off', 'use_snp_selection': False}. Best is trial 46 with value: 0.1006960060302028.
[I 2025-12-05 15:43:45,480] Trial 74 finished with value: 0.07157706985148841 and parameters: {'model_type': 'mlp', 'hidden_dims': '[512, 128]', 'dropout': 0.12234570202060989, 'batch_norm': False, 'lr': 0.00021917245018860597, 'weight_decay': 0.0002952087528071775, 'epochs': 198, 'loss': 'mae', 'optimizer': 'adam', 'graph_mode': 'off', 'use_snp_selection': False}. Best is trial 46 with value: 0.1006960060302028.
[I 2025-12-05 15:43:47,020] Trial 75 finished with value: 0.06534183911364796 and parameters: {'model_type': 'mlp', 'hidden_dims': '[512, 128]', 'dropout': 0.20382203941105057, 'batch_norm': False, 'lr': 8.567366141353301e-05, 'weight_decay': 0.00012333059339731737, 'epochs': 216, 'loss': 'mae', 'optimizer': 'adam', 'graph_mode': 'off', 'use_snp_selection': False}. Best is trial 46 with value: 0.1006960060302028.
[I 2025-12-05 15:43:48,384] Trial 76 finished with value: 0.057841049736292005 and parameters: {'model_type': 'mlp', 'hidden_dims': '[512, 128]', 'dropout': 0.349042889053144, 'batch_norm': False, 'lr': 0.0003471455648529708, 'weight_decay': 6.647383206368882e-05, 'epochs': 161, 'loss': 'mae', 'optimizer': 'adam', 'graph_mode': 'off', 'use_snp_selection': False}. Best is trial 46 with value: 0.1006960060302028.
[I 2025-12-05 15:43:49,232] Trial 77 finished with value: 0.0656876970197162 and parameters: {'model_type': 'mlp', 'hidden_dims': '[128, 64]', 'dropout': 0.4205869185871265, 'batch_norm': True, 'lr': 0.00012547688545798134, 'weight_decay': 0.00037716643244223357, 'epochs': 184, 'loss': 'mae', 'optimizer': 'adam', 'graph_mode': 'off', 'use_snp_selection': False}. Best is trial 46 with value: 0.1006960060302028.
[I 2025-12-05 15:43:50,492] Trial 78 finished with value: 0.04944531791853831 and parameters: {'model_type': 'mlp', 'hidden_dims': '[512, 64]', 'dropout': 0.14892917517767187, 'batch_norm': False, 'lr': 0.00016063197052954014, 'weight_decay': 0.0005170090502657145, 'epochs': 146, 'loss': 'mae', 'optimizer': 'adam', 'graph_mode': 'off', 'use_snp_selection': False}. Best is trial 46 with value: 0.1006960060302028.
[I 2025-12-05 15:43:51,966] Trial 79 finished with value: 0.04759510460887806 and parameters: {'model_type': 'mlp', 'hidden_dims': '[512, 256]', 'dropout': 0.22949656266158067, 'batch_norm': False, 'lr': 8.857928417453083e-06, 'weight_decay': 4.685237775664298e-05, 'epochs': 206, 'loss': 'mae', 'optimizer': 'adam', 'graph_mode': 'off', 'use_snp_selection': False}. Best is trial 46 with value: 0.1006960060302028.
[I 2025-12-05 15:43:52,852] Trial 80 finished with value: 0.06049772871453121 and parameters: {'model_type': 'mlp', 'hidden_dims': '[256, 128, 64]', 'dropout': 0.3257478065383248, 'batch_norm': False, 'lr': 1.6880421494331944e-05, 'weight_decay': 0.00017649826548304465, 'epochs': 128, 'loss': 'mae', 'optimizer': 'adam', 'graph_mode': 'off', 'use_snp_selection': False}. Best is trial 46 with value: 0.1006960060302028.
[I 2025-12-05 15:43:54,369] Trial 81 finished with value: 0.06898228961957563 and parameters: {'model_type': 'mlp', 'hidden_dims': '[512, 128]', 'dropout': 0.2596126651857832, 'batch_norm': False, 'lr': 0.00015988998177784156, 'weight_decay': 0.0006815465609157663, 'epochs': 203, 'loss': 'mae', 'optimizer': 'adam', 'graph_mode': 'off', 'use_snp_selection': False}. Best is trial 46 with value: 0.1006960060302028.
[I 2025-12-05 15:43:55,859] Trial 82 finished with value: 0.08994364871138519 and parameters: {'model_type': 'mlp', 'hidden_dims': '[512, 128]', 'dropout': 0.27686800209021895, 'batch_norm': False, 'lr': 6.502116315874663e-05, 'weight_decay': 0.00030308966146528357, 'epochs': 195, 'loss': 'mae', 'optimizer': 'adam', 'graph_mode': 'off', 'use_snp_selection': False}. Best is trial 46 with value: 0.1006960060302028.
[I 2025-12-05 15:43:57,347] Trial 83 finished with value: 0.07961354683502715 and parameters: {'model_type': 'mlp', 'hidden_dims': '[512, 128]', 'dropout': 0.18904654505994573, 'batch_norm': False, 'lr': 6.0358576482011e-05, 'weight_decay': 0.0002563857907137728, 'epochs': 192, 'loss': 'mae', 'optimizer': 'adam', 'graph_mode': 'off', 'use_snp_selection': False}. Best is trial 46 with value: 0.1006960060302028.
[I 2025-12-05 15:43:58,837] Trial 84 finished with value: 0.07573500847450346 and parameters: {'model_type': 'mlp', 'hidden_dims': '[512, 128]', 'dropout': 0.2378889591052769, 'batch_norm': False, 'lr': 6.160994023896637e-05, 'weight_decay': 0.00033660832092643334, 'epochs': 192, 'loss': 'mae', 'optimizer': 'adam', 'graph_mode': 'off', 'use_snp_selection': False}. Best is trial 46 with value: 0.1006960060302028.
[I 2025-12-05 15:44:00,256] Trial 85 finished with value: 0.07633662412037012 and parameters: {'model_type': 'mlp', 'hidden_dims': '[512, 256]', 'dropout': 0.21775702514663242, 'batch_norm': False, 'lr': 3.632056672968031e-05, 'weight_decay': 0.0001325597866910662, 'epochs': 171, 'loss': 'mae', 'optimizer': 'adam', 'graph_mode': 'off', 'use_snp_selection': False}. Best is trial 46 with value: 0.1006960060302028.
