[I 2025-12-05 14:30:50,517] Trial 58 finished with value: 0.07237491108163502 and parameters: {'model_type': 'mlp', 'hidden_dims': '[512, 128]', 'dropout': 0.1412488125601021, 'batch_norm': False, 'lr': 0.00040022335030326963, 'weight_decay': 5.401265492473973e-05, 'epochs': 116, 'loss': 'mae', 'optimizer': 'adam', 'graph_mode': 'off', 'use_snp_selection': False}. Best is trial 14 with value: 0.1149502402610653.
[I 2025-12-05 14:30:51,986] Trial 59 finished with value: 0.10618293598444858 and parameters: {'model_type': 'mlp', 'hidden_dims': '[512, 128]', 'dropout': 0.5631379366831802, 'batch_norm': True, 'lr': 0.0007318328922960996, 'weight_decay': 2.7128413109981175e-05, 'epochs': 183, 'loss': 'mae', 'optimizer': 'adam', 'graph_mode': 'off', 'use_snp_selection': False}. Best is trial 14 with value: 0.1149502402610653.
[I 2025-12-05 14:30:53,472] Trial 60 finished with value: 0.09466740238052106 and parameters: {'model_type': 'mlp', 'hidden_dims': '[512, 128]', 'dropout': 0.5593165809880162, 'batch_norm': True, 'lr': 0.0007421352389030202, 'weight_decay': 1.4444072666113868e-05, 'epochs': 188, 'loss': 'mae', 'optimizer': 'adam', 'graph_mode': 'off', 'use_snp_selection': False}. Best is trial 14 with value: 0.1149502402610653.
[I 2025-12-05 14:30:55,002] Trial 61 finished with value: 0.11195106766409982 and parameters: {'model_type': 'mlp', 'hidden_dims': '[512, 128]', 'dropout': 0.18183489299488506, 'batch_norm': True, 'lr': 0.0006144359696115856, 'weight_decay': 2.695527696952224e-05, 'epochs': 199, 'loss': 'mae', 'optimizer': 'adam', 'graph_mode': 'off', 'use_snp_selection': False}. Best is trial 14 with value: 0.1149502402610653.
[I 2025-12-05 14:30:56,581] Trial 62 finished with value: 0.10611632322201749 and parameters: {'model_type': 'mlp', 'hidden_dims': '[512, 128]', 'dropout': 0.11373994122410279, 'batch_norm': True, 'lr': 0.0005751355042055294, 'weight_decay': 2.8541746842008166e-05, 'epochs': 212, 'loss': 'mae', 'optimizer': 'adam', 'graph_mode': 'off', 'use_snp_selection': False}. Best is trial 14 with value: 0.1149502402610653.
[I 2025-12-05 14:30:58,197] Trial 63 finished with value: 0.10912507305010707 and parameters: {'model_type': 'mlp', 'hidden_dims': '[512, 128]', 'dropout': 0.10036997674927352, 'batch_norm': True, 'lr': 0.000596357086059952, 'weight_decay': 2.705472615073652e-05, 'epochs': 221, 'loss': 'mae', 'optimizer': 'adam', 'graph_mode': 'off', 'use_snp_selection': False}. Best is trial 14 with value: 0.1149502402610653.
[I 2025-12-05 14:30:59,843] Trial 64 finished with value: 0.09233529209359825 and parameters: {'model_type': 'mlp', 'hidden_dims': '[512, 128]', 'dropout': 0.1106616901830922, 'batch_norm': True, 'lr': 0.0005778702386781523, 'weight_decay': 2.7951073615991684e-05, 'epochs': 229, 'loss': 'mae', 'optimizer': 'adam', 'graph_mode': 'off', 'use_snp_selection': False}. Best is trial 14 with value: 0.1149502402610653.
[I 2025-12-05 14:31:01,395] Trial 65 finished with value: 0.11887558178889224 and parameters: {'model_type': 'mlp', 'hidden_dims': '[512, 128]', 'dropout': 0.12176184945335877, 'batch_norm': True, 'lr': 0.0005090129015743217, 'weight_decay': 2.1593919092695605e-05, 'epochs': 204, 'loss': 'mae', 'optimizer': 'adam', 'graph_mode': 'off', 'use_snp_selection': False}. Best is trial 65 with value: 0.11887558178889224.
[I 2025-12-05 14:31:03,179] Trial 66 finished with value: 0.10953580786478573 and parameters: {'model_type': 'mlp', 'hidden_dims': '[512, 128]', 'dropout': 0.10082698033544368, 'batch_norm': True, 'lr': 0.00039845043182444345, 'weight_decay': 2.186230755474159e-05, 'epochs': 264, 'loss': 'mae', 'optimizer': 'adam', 'graph_mode': 'off', 'use_snp_selection': False}. Best is trial 65 with value: 0.11887558178889224.
[I 2025-12-05 14:31:04,827] Trial 67 finished with value: 0.10505205344120538 and parameters: {'model_type': 'mlp', 'hidden_dims': '[512, 128]', 'dropout': 0.1540238464134912, 'batch_norm': True, 'lr': 0.00038516364267061735, 'weight_decay': 7.910929670752948e-06, 'epochs': 278, 'loss': 'mae', 'optimizer': 'adam', 'graph_mode': 'off', 'use_snp_selection': True, 'num_snps': 22951}. Best is trial 65 with value: 0.11887558178889224.
[I 2025-12-05 14:31:06,595] Trial 68 finished with value: 0.1021925194761136 and parameters: {'model_type': 'mlp', 'hidden_dims': '[512, 128]', 'dropout': 0.12819170363963794, 'batch_norm': True, 'lr': 0.0004712468990991453, 'weight_decay': 3.6851282729662297e-06, 'epochs': 260, 'loss': 'mae', 'optimizer': 'adam', 'graph_mode': 'off', 'use_snp_selection': False}. Best is trial 65 with value: 0.11887558178889224.
[I 2025-12-05 14:31:08,146] Trial 69 finished with value: 0.10510091929721924 and parameters: {'model_type': 'mlp', 'hidden_dims': '[512, 128]', 'dropout': 0.10581166303183745, 'batch_norm': True, 'lr': 0.00025952407156321474, 'weight_decay': 1.1898110300230983e-05, 'epochs': 204, 'loss': 'mae', 'optimizer': 'adam', 'graph_mode': 'off', 'use_snp_selection': False}. Best is trial 65 with value: 0.11887558178889224.
[I 2025-12-05 14:31:09,014] Trial 70 finished with value: 0.07500445344547807 and parameters: {'model_type': 'mlp', 'hidden_dims': '[128, 64]', 'dropout': 0.1606734863350423, 'batch_norm': False, 'lr': 0.0003822585889589598, 'weight_decay': 1.9516660214209502e-05, 'epochs': 257, 'loss': 'mae', 'optimizer': 'adam', 'graph_mode': 'off', 'use_snp_selection': False}. Best is trial 65 with value: 0.11887558178889224.
[I 2025-12-05 14:31:10,463] Trial 71 finished with value: 0.08957919221901467 and parameters: {'model_type': 'mlp', 'hidden_dims': '[512, 128]', 'dropout': 0.13996625218811748, 'batch_norm': True, 'lr': 0.0008452086378004805, 'weight_decay': 5.102127133254359e-05, 'epochs': 176, 'loss': 'mae', 'optimizer': 'adam', 'graph_mode': 'off', 'use_snp_selection': False}. Best is trial 65 with value: 0.11887558178889224.
[I 2025-12-05 14:31:12,080] Trial 72 finished with value: 0.08103476677995193 and parameters: {'model_type': 'mlp', 'hidden_dims': '[512, 128]', 'dropout': 0.10181760707478375, 'batch_norm': True, 'lr': 1.0216900625971807e-05, 'weight_decay': 2.447925592300917e-05, 'epochs': 221, 'loss': 'mae', 'optimizer': 'adam', 'graph_mode': 'off', 'use_snp_selection': False}. Best is trial 65 with value: 0.11887558178889224.
[I 2025-12-05 14:31:13,783] Trial 73 finished with value: 0.11295751462765052 and parameters: {'model_type': 'mlp', 'hidden_dims': '[512, 128]', 'dropout': 0.18280209740026662, 'batch_norm': True, 'lr': 0.0006658950598269136, 'weight_decay': 8.970874017417658e-05, 'epochs': 243, 'loss': 'mae', 'optimizer': 'adam', 'graph_mode': 'off', 'use_snp_selection': False}. Best is trial 65 with value: 0.11887558178889224.
[I 2025-12-05 14:31:15,509] Trial 74 finished with value: 0.11990022119148258 and parameters: {'model_type': 'mlp', 'hidden_dims': '[512, 128]', 'dropout': 0.18483639493866866, 'batch_norm': True, 'lr': 0.0005026971132329323, 'weight_decay': 9.075187015682786e-05, 'epochs': 249, 'loss': 'mae', 'optimizer': 'adam', 'graph_mode': 'off', 'use_snp_selection': False}. Best is trial 74 with value: 0.11990022119148258.
[I 2025-12-05 14:31:16,698] Trial 75 finished with value: 0.07510261136899328 and parameters: {'model_type': 'mlp', 'hidden_dims': '[256, 128, 64]', 'dropout': 0.1857516366584283, 'batch_norm': True, 'lr': 0.0005034719628464727, 'weight_decay': 9.310803700295761e-05, 'epochs': 249, 'loss': 'mae', 'optimizer': 'adam', 'graph_mode': 'off', 'use_snp_selection': False}. Best is trial 74 with value: 0.11990022119148258.
[I 2025-12-05 14:31:18,364] Trial 76 finished with value: 0.09255700865312498 and parameters: {'model_type': 'mlp', 'hidden_dims': '[512, 128]', 'dropout': 0.12425757103252486, 'batch_norm': True, 'lr': 0.0009928176777252318, 'weight_decay': 4.402704346224945e-05, 'epochs': 232, 'loss': 'mae', 'optimizer': 'adam', 'graph_mode': 'off', 'use_snp_selection': False}. Best is trial 74 with value: 0.11990022119148258.
[I 2025-12-05 14:31:19,899] Trial 77 finished with value: 0.09824797731198004 and parameters: {'model_type': 'mlp', 'hidden_dims': '[512, 128]', 'dropout': 0.14933803030571183, 'batch_norm': True, 'lr': 0.00016687824866622753, 'weight_decay': 6.708474379796946e-05, 'epochs': 199, 'loss': 'mae', 'optimizer': 'adam', 'graph_mode': 'off', 'use_snp_selection': False}. Best is trial 74 with value: 0.11990022119148258.
[I 2025-12-05 14:31:20,859] Trial 78 finished with value: 0.07583991758518199 and parameters: {'model_type': 'mlp', 'hidden_dims': '[512, 128]', 'dropout': 0.2333206137220582, 'batch_norm': True, 'lr': 1.0087771566710253e-06, 'weight_decay': 9.290866930160027e-06, 'epochs': 265, 'loss': 'mae', 'optimizer': 'adam', 'graph_mode': 'off', 'use_snp_selection': True, 'num_snps': 2246}. Best is trial 74 with value: 0.11990022119148258.
[I 2025-12-05 14:31:21,994] Trial 79 finished with value: 0.09052308522680719 and parameters: {'model_type': 'mlp', 'hidden_dims': '[256, 128]', 'dropout': 0.18175484105453993, 'batch_norm': True, 'lr': 0.00028843338532564145, 'weight_decay': 3.5440696586496e-05, 'epochs': 237, 'loss': 'mae', 'optimizer': 'adam', 'graph_mode': 'off', 'use_snp_selection': False}. Best is trial 74 with value: 0.11990022119148258.
[I 2025-12-05 14:31:23,947] Trial 80 finished with value: 0.10036835149548395 and parameters: {'model_type': 'mlp', 'hidden_dims': '[512, 128]', 'dropout': 0.11907010671400665, 'batch_norm': True, 'lr': 0.00038408850250069176, 'weight_decay': 0.00010754363072905691, 'epochs': 307, 'loss': 'mae', 'optimizer': 'adam', 'graph_mode': 'off', 'use_snp_selection': False}. Best is trial 74 with value: 0.11990022119148258.
[I 2025-12-05 14:31:25,674] Trial 81 finished with value: 0.11025957099634844 and parameters: {'model_type': 'mlp', 'hidden_dims': '[512, 128]', 'dropout': 0.136003087763301, 'batch_norm': True, 'lr': 0.000644599114020738, 'weight_decay': 6.868845074188622e-05, 'epochs': 249, 'loss': 'mae', 'optimizer': 'adam', 'graph_mode': 'off', 'use_snp_selection': False}. Best is trial 74 with value: 0.11990022119148258.
[I 2025-12-05 14:31:27,387] Trial 82 finished with value: 0.11800122646160344 and parameters: {'model_type': 'mlp', 'hidden_dims': '[512, 128]', 'dropout': 0.13225363156661946, 'batch_norm': True, 'lr': 0.0005020327452186177, 'weight_decay': 0.00015110864043547432, 'epochs': 245, 'loss': 'mae', 'optimizer': 'adam', 'graph_mode': 'off', 'use_snp_selection': False}. Best is trial 74 with value: 0.11990022119148258.
[I 2025-12-05 14:31:29,097] Trial 83 finished with value: 0.12218661542207429 and parameters: {'model_type': 'mlp', 'hidden_dims': '[512, 128]', 'dropout': 0.13523314518324198, 'batch_norm': True, 'lr': 0.0005117148186300621, 'weight_decay': 1.9906890041718985e-05, 'epochs': 243, 'loss': 'mae', 'optimizer': 'adam', 'graph_mode': 'off', 'use_snp_selection': False}. Best is trial 83 with value: 0.12218661542207429.
[I 2025-12-05 14:31:30,029] Trial 84 finished with value: 0.1018168809603155 and parameters: {'model_type': 'mlp', 'hidden_dims': '[128, 64]', 'dropout': 0.14569868970098057, 'batch_norm': True, 'lr': 0.00044885083891176925, 'weight_decay': 0.0001577674911435871, 'epochs': 247, 'loss': 'mae', 'optimizer': 'adam', 'graph_mode': 'off', 'use_snp_selection': False}. Best is trial 83 with value: 0.12218661542207429.
[I 2025-12-05 14:31:31,933] Trial 85 finished with value: 0.1058632754987028 and parameters: {'model_type': 'mlp', 'hidden_dims': '[512, 128]', 'dropout': 0.1347250492713474, 'batch_norm': True, 'lr': 0.0004956264180282634, 'weight_decay': 1.5952254044435305e-05, 'epochs': 295, 'loss': 'mae', 'optimizer': 'adam', 'graph_mode': 'off', 'use_snp_selection': False}. Best is trial 83 with value: 0.12218661542207429.
[I 2025-12-05 14:31:33,741] Trial 86 finished with value: 0.09189261750338935 and parameters: {'model_type': 'mlp', 'hidden_dims': '[512, 128]', 'dropout': 0.16085043408065944, 'batch_norm': True, 'lr': 0.0006508044888179391, 'weight_decay': 4.65724456083278e-05, 'epochs': 270, 'loss': 'mae', 'optimizer': 'adam', 'graph_mode': 'off', 'use_snp_selection': False}. Best is trial 83 with value: 0.12218661542207429.
[I 2025-12-05 14:31:34,897] Trial 87 finished with value: 0.08641248177793047 and parameters: {'model_type': 'mlp', 'hidden_dims': '[256, 128, 64]', 'dropout': 0.13350785914553615, 'batch_norm': False, 'lr': 0.0005242635106920553, 'weight_decay': 0.00010263871294419237, 'epochs': 252, 'loss': 'mae', 'optimizer': 'adam', 'graph_mode': 'off', 'use_snp_selection': False}. Best is trial 83 with value: 0.12218661542207429.
[I 2025-12-05 14:31:36,599] Trial 88 finished with value: 0.11177643150299356 and parameters: {'model_type': 'mlp', 'hidden_dims': '[512, 128]', 'dropout': 0.11724667006893903, 'batch_norm': True, 'lr': 0.0003240434491239117, 'weight_decay': 2.1145933059478376e-05, 'epochs': 241, 'loss': 'mae', 'optimizer': 'adam', 'graph_mode': 'off', 'use_snp_selection': False}. Best is trial 83 with value: 0.12218661542207429.
[I 2025-12-05 14:31:38,290] Trial 89 finished with value: 0.09448110045359835 and parameters: {'model_type': 'mlp', 'hidden_dims': '[512, 128]', 'dropout': 0.1891172737225459, 'batch_norm': True, 'lr': 0.00032801206037344174, 'weight_decay': 6.055886534416182e-05, 'epochs': 240, 'loss': 'mae', 'optimizer': 'adam', 'graph_mode': 'off', 'use_snp_selection': False}. Best is trial 83 with value: 0.12218661542207429.
[I 2025-12-05 14:31:40,929] Trial 90 finished with value: 0.09759255568504521 and parameters: {'model_type': 'mlp', 'hidden_dims': '[512, 128]', 'dropout': 0.1232717271636597, 'batch_norm': True, 'lr': 0.00025115050554656675, 'weight_decay': 3.5759893573176676e-05, 'epochs': 207, 'loss': 'mae', 'optimizer': 'adam', 'graph_mode': 'off', 'use_snp_selection': True, 'num_snps': 48165}. Best is trial 83 with value: 0.12218661542207429.
[I 2025-12-05 14:31:42,641] Trial 91 finished with value: 0.10457884094741068 and parameters: {'model_type': 'mlp', 'hidden_dims': '[512, 128]', 'dropout': 0.14928139927186443, 'batch_norm': True, 'lr': 0.0006442845143224366, 'weight_decay': 2.159766816103705e-05, 'epochs': 245, 'loss': 'mae', 'optimizer': 'adam', 'graph_mode': 'off', 'use_snp_selection': False}. Best is trial 83 with value: 0.12218661542207429.
[I 2025-12-05 14:31:44,287] Trial 92 finished with value: 0.09971022099071258 and parameters: {'model_type': 'mlp', 'hidden_dims': '[512, 128]', 'dropout': 0.11130050409021675, 'batch_norm': True, 'lr': 0.0008545196859816363, 'weight_decay': 1.3609417604215796e-05, 'epochs': 228, 'loss': 'mae', 'optimizer': 'adam', 'graph_mode': 'off', 'use_snp_selection': False}. Best is trial 83 with value: 0.12218661542207429.
[I 2025-12-05 14:31:46,092] Trial 93 finished with value: 0.10599506542322255 and parameters: {'model_type': 'mlp', 'hidden_dims': '[512, 128]', 'dropout': 0.13920532260413745, 'batch_norm': True, 'lr': 0.0003539458879176531, 'weight_decay': 1.7501607826882173e-05, 'epochs': 269, 'loss': 'mae', 'optimizer': 'adam', 'graph_mode': 'off', 'use_snp_selection': False}. Best is trial 83 with value: 0.12218661542207429.
[I 2025-12-05 14:31:47,958] Trial 94 finished with value: 0.11147618955451241 and parameters: {'model_type': 'mlp', 'hidden_dims': '[512, 128]', 'dropout': 0.15700266648593322, 'batch_norm': True, 'lr': 0.0004550941011662518, 'weight_decay': 3.288927063352214e-05, 'epochs': 285, 'loss': 'mae', 'optimizer': 'adam', 'graph_mode': 'off', 'use_snp_selection': False}. Best is trial 83 with value: 0.12218661542207429.
[I 2025-12-05 14:31:49,222] Trial 95 finished with value: 0.09671374806732373 and parameters: {'model_type': 'mlp', 'hidden_dims': '[256, 128]', 'dropout': 0.15741427920103132, 'batch_norm': True, 'lr': 0.0004618619040591859, 'weight_decay': 0.0001441064893703026, 'epochs': 296, 'loss': 'mae', 'optimizer': 'adam', 'graph_mode': 'off', 'use_snp_selection': False}. Best is trial 83 with value: 0.12218661542207429.
[I 2025-12-05 14:31:50,964] Trial 96 finished with value: 0.10528679790471154 and parameters: {'model_type': 'mlp', 'hidden_dims': '[512, 128]', 'dropout': 0.17677511401640875, 'batch_norm': True, 'lr': 0.00028982626768828357, 'weight_decay': 3.248502637283857e-05, 'epochs': 253, 'loss': 'mae', 'optimizer': 'adam', 'graph_mode': 'off', 'use_snp_selection': False}. Best is trial 83 with value: 0.12218661542207429.
[I 2025-12-05 14:31:52,578] Trial 97 finished with value: 0.09501199135604034 and parameters: {'model_type': 'mlp', 'hidden_dims': '[512, 128]', 'dropout': 0.22136479722058738, 'batch_norm': True, 'lr': 0.0001852509108629894, 'weight_decay': 5.692961936278079e-06, 'epochs': 220, 'loss': 'mae', 'optimizer': 'adam', 'graph_mode': 'off', 'use_snp_selection': False}. Best is trial 83 with value: 0.12218661542207429.
[I 2025-12-05 14:31:54,573] Trial 98 finished with value: 0.08535382323835827 and parameters: {'model_type': 'mlp', 'hidden_dims': '[512, 128]', 'dropout': 0.13478432478526975, 'batch_norm': True, 'lr': 0.0006707142507370225, 'weight_decay': 0.00023429513651384526, 'epochs': 318, 'loss': 'mae', 'optimizer': 'adam', 'graph_mode': 'off', 'use_snp_selection': False}. Best is trial 83 with value: 0.12218661542207429.
[I 2025-12-05 14:31:56,094] Trial 99 finished with value: 0.10087369841127364 and parameters: {'model_type': 'mlp', 'hidden_dims': '[512, 128]', 'dropout': 0.11747218782742075, 'batch_norm': True, 'lr': 0.0005401281751884153, 'weight_decay': 6.354495375046168e-05, 'epochs': 194, 'loss': 'mae', 'optimizer': 'adam', 'graph_mode': 'off', 'use_snp_selection': False}. Best is trial 83 with value: 0.12218661542207429.
[I 2025-12-05 14:31:57,002] Trial 100 finished with value: 0.08526508293866501 and parameters: {'model_type': 'mlp', 'hidden_dims': '[128, 64]', 'dropout': 0.1980689678471798, 'batch_norm': False, 'lr': 0.0004454659144440049, 'weight_decay': 8.58415175117262e-05, 'epochs': 284, 'loss': 'mae', 'optimizer': 'adam', 'graph_mode': 'off', 'use_snp_selection': False}. Best is trial 83 with value: 0.12218661542207429.
[I 2025-12-05 14:31:58,791] Trial 101 finished with value: 0.11798899839545775 and parameters: {'model_type': 'mlp', 'hidden_dims': '[512, 128]', 'dropout': 0.12903318184583928, 'batch_norm': True, 'lr': 0.00022670456629048262, 'weight_decay': 2.1558612754095113e-05, 'epochs': 264, 'loss': 'mae', 'optimizer': 'adam', 'graph_mode': 'off', 'use_snp_selection': False}. Best is trial 83 with value: 0.12218661542207429.
[I 2025-12-05 14:32:00,632] Trial 102 finished with value: 0.08028991790194309 and parameters: {'model_type': 'mlp', 'hidden_dims': '[512, 128]', 'dropout': 0.16311401758003047, 'batch_norm': True, 'lr': 0.00021753387564303492, 'weight_decay': 9.517552633195816e-06, 'epochs': 278, 'loss': 'mae', 'optimizer': 'adam', 'graph_mode': 'off', 'use_snp_selection': False}. Best is trial 83 with value: 0.12218661542207429.
[I 2025-12-05 14:32:02,320] Trial 103 finished with value: 0.08958684101707559 and parameters: {'model_type': 'mlp', 'hidden_dims': '[512, 128]', 'dropout': 0.15022462667336212, 'batch_norm': True, 'lr': 0.00014151864712311956, 'weight_decay': 3.213751353076501e-05, 'epochs': 239, 'loss': 'mae', 'optimizer': 'adam', 'graph_mode': 'off', 'use_snp_selection': False}. Best is trial 83 with value: 0.12218661542207429.
[I 2025-12-05 14:32:04,078] Trial 104 finished with value: 0.10356391539355189 and parameters: {'model_type': 'mlp', 'hidden_dims': '[512, 128]', 'dropout': 0.12946010123114948, 'batch_norm': True, 'lr': 0.00029389813884268416, 'weight_decay': 4.3971862395538e-05, 'epochs': 257, 'loss': 'mae', 'optimizer': 'adam', 'graph_mode': 'off', 'use_snp_selection': False}. Best is trial 83 with value: 0.12218661542207429.
[I 2025-12-05 14:32:05,735] Trial 105 finished with value: 0.0819344648309221 and parameters: {'model_type': 'mlp', 'hidden_dims': '[512, 128]', 'dropout': 0.1720963802053384, 'batch_norm': True, 'lr': 0.0008208567829906701, 'weight_decay': 0.00011705844770459116, 'epochs': 231, 'loss': 'mae', 'optimizer': 'adam', 'graph_mode': 'off', 'use_snp_selection': False}. Best is trial 83 with value: 0.12218661542207429.
[I 2025-12-05 14:32:07,001] Trial 106 finished with value: 0.10195761979019097 and parameters: {'model_type': 'mlp', 'hidden_dims': '[256, 128, 64]', 'dropout': 0.14230662791703724, 'batch_norm': True, 'lr': 0.0003468673858393717, 'weight_decay': 1.8148684375388283e-05, 'epochs': 292, 'loss': 'mae', 'optimizer': 'adam', 'graph_mode': 'off', 'use_snp_selection': False}. Best is trial 83 with value: 0.12218661542207429.
[I 2025-12-05 14:32:08,821] Trial 107 finished with value: 0.11034512619511026 and parameters: {'model_type': 'mlp', 'hidden_dims': '[512, 128]', 'dropout': 0.11754811320192207, 'batch_norm': True, 'lr': 0.0002318026035158627, 'weight_decay': 1.3546367098862788e-05, 'epochs': 272, 'loss': 'mae', 'optimizer': 'adam', 'graph_mode': 'off', 'use_snp_selection': False}. Best is trial 83 with value: 0.12218661542207429.
[I 2025-12-05 14:32:10,651] Trial 108 finished with value: 0.10581574904731847 and parameters: {'model_type': 'mlp', 'hidden_dims': '[512, 128]', 'dropout': 0.11800564089111915, 'batch_norm': True, 'lr': 0.0002385065548081226, 'weight_decay': 1.2802297649780232e-05, 'epochs': 275, 'loss': 'mae', 'optimizer': 'adam', 'graph_mode': 'off', 'use_snp_selection': False}. Best is trial 83 with value: 0.12218661542207429.
[I 2025-12-05 14:32:12,434] Trial 109 finished with value: 0.08867739505180532 and parameters: {'model_type': 'mlp', 'hidden_dims': '[512, 64]', 'dropout': 0.15737053920827482, 'batch_norm': True, 'lr': 0.00011349485241754628, 'weight_decay': 1.0222510256083865e-05, 'epochs': 264, 'loss': 'mae', 'optimizer': 'adam', 'graph_mode': 'off', 'use_snp_selection': False}. Best is trial 83 with value: 0.12218661542207429.
