[I 2025-12-06 01:49:25,954] Trial 83 finished with value: 0.2865043836242348 and parameters: {'model_type': 'mlp', 'hidden_dims': '[512, 256]', 'dropout': 0.5843169286102603, 'batch_norm': False, 'lr': 1.6006219674688056e-05, 'weight_decay': 1.6355469527326613e-07, 'epochs': 49, 'loss': 'mse', 'optimizer': 'adam', 'graph_mode': 'off', 'use_snp_selection': False}. Best is trial 31 with value: 0.3027435084983816.
[I 2025-12-06 01:50:11,669] Trial 84 finished with value: 0.2904012563081662 and parameters: {'model_type': 'mlp', 'hidden_dims': '[512, 256]', 'dropout': 0.5692238644366128, 'batch_norm': False, 'lr': 6.871521207643256e-06, 'weight_decay': 0.0003007272775327626, 'epochs': 232, 'loss': 'mse', 'optimizer': 'adam', 'graph_mode': 'off', 'use_snp_selection': False}. Best is trial 31 with value: 0.3027435084983816.
[I 2025-12-06 01:51:09,664] Trial 85 finished with value: 0.2893205105011502 and parameters: {'model_type': 'mlp', 'hidden_dims': '[512, 128]', 'dropout': 0.35176917584621836, 'batch_norm': False, 'lr': 3.035932531055708e-06, 'weight_decay': 4.011090717644506e-05, 'epochs': 301, 'loss': 'mse', 'optimizer': 'adam', 'graph_mode': 'off', 'use_snp_selection': False}. Best is trial 31 with value: 0.3027435084983816.
[I 2025-12-06 01:51:20,806] Trial 86 finished with value: 0.2878430080370696 and parameters: {'model_type': 'mlp', 'hidden_dims': '[128, 64]', 'dropout': 0.5503813066625017, 'batch_norm': False, 'lr': 9.853461116110821e-05, 'weight_decay': 1.6808520379277187e-07, 'epochs': 131, 'loss': 'mse', 'optimizer': 'adam', 'graph_mode': 'off', 'use_snp_selection': False}. Best is trial 31 with value: 0.3027435084983816.
[I 2025-12-06 01:52:09,559] Trial 87 finished with value: 0.3002687334053124 and parameters: {'model_type': 'mlp', 'hidden_dims': '[512, 256]', 'dropout': 0.5873763326785318, 'batch_norm': False, 'lr': 3.904008274603989e-06, 'weight_decay': 1.204013342388503e-06, 'epochs': 248, 'loss': 'mse', 'optimizer': 'adam', 'graph_mode': 'off', 'use_snp_selection': False}. Best is trial 31 with value: 0.3027435084983816.
[I 2025-12-06 01:52:58,268] Trial 88 finished with value: 0.29938263072231713 and parameters: {'model_type': 'mlp', 'hidden_dims': '[512, 64]', 'dropout': 0.5879845516956151, 'batch_norm': False, 'lr': 3.839104591504781e-06, 'weight_decay': 2.8082961626756176e-07, 'epochs': 249, 'loss': 'mse', 'optimizer': 'adam', 'graph_mode': 'off', 'use_snp_selection': False}. Best is trial 31 with value: 0.3027435084983816.
[I 2025-12-06 01:53:46,681] Trial 89 finished with value: 0.3028311590851349 and parameters: {'model_type': 'mlp', 'hidden_dims': '[512, 64]', 'dropout': 0.5885237559814891, 'batch_norm': False, 'lr': 3.653589771135979e-06, 'weight_decay': 2.4903377695704605e-07, 'epochs': 247, 'loss': 'mse', 'optimizer': 'adam', 'graph_mode': 'off', 'use_snp_selection': False}. Best is trial 89 with value: 0.3028311590851349.
[I 2025-12-06 01:54:34,846] Trial 90 finished with value: 0.2899463697539036 and parameters: {'model_type': 'mlp', 'hidden_dims': '[512, 64]', 'dropout': 0.5836206802011188, 'batch_norm': False, 'lr': 9.635434406183717e-06, 'weight_decay': 2.2032342105935356e-07, 'epochs': 247, 'loss': 'mse', 'optimizer': 'adam', 'graph_mode': 'off', 'use_snp_selection': False}. Best is trial 89 with value: 0.3028311590851349.
[I 2025-12-06 01:55:25,856] Trial 91 finished with value: 0.29802597887569393 and parameters: {'model_type': 'mlp', 'hidden_dims': '[512, 64]', 'dropout': 0.5937885192663601, 'batch_norm': False, 'lr': 3.78664298452575e-06, 'weight_decay': 3.1437689563400654e-07, 'epochs': 262, 'loss': 'mse', 'optimizer': 'adam', 'graph_mode': 'off', 'use_snp_selection': False}. Best is trial 89 with value: 0.3028311590851349.
[I 2025-12-06 01:56:17,571] Trial 92 finished with value: 0.2999638924796499 and parameters: {'model_type': 'mlp', 'hidden_dims': '[512, 64]', 'dropout': 0.5704277937018896, 'batch_norm': False, 'lr': 4.128293068322471e-06, 'weight_decay': 3.0484039490349306e-07, 'epochs': 266, 'loss': 'mse', 'optimizer': 'adam', 'graph_mode': 'off', 'use_snp_selection': False}. Best is trial 89 with value: 0.3028311590851349.
[I 2025-12-06 01:57:08,713] Trial 93 finished with value: 0.30100925968446074 and parameters: {'model_type': 'mlp', 'hidden_dims': '[512, 64]', 'dropout': 0.5994157018934562, 'batch_norm': False, 'lr': 4.133234287500507e-06, 'weight_decay': 3.244587092206597e-07, 'epochs': 263, 'loss': 'mse', 'optimizer': 'adam', 'graph_mode': 'off', 'use_snp_selection': False}. Best is trial 89 with value: 0.3028311590851349.
[I 2025-12-06 01:57:55,735] Trial 94 finished with value: 0.298372493668656 and parameters: {'model_type': 'mlp', 'hidden_dims': '[512, 64]', 'dropout': 0.5681353628034608, 'batch_norm': False, 'lr': 4.399718468785744e-06, 'weight_decay': 8.027595465659668e-07, 'epochs': 239, 'loss': 'mse', 'optimizer': 'adam', 'graph_mode': 'off', 'use_snp_selection': False}. Best is trial 89 with value: 0.3028311590851349.
[I 2025-12-06 01:58:47,182] Trial 95 finished with value: 0.298939447228536 and parameters: {'model_type': 'mlp', 'hidden_dims': '[512, 64]', 'dropout': 0.5997518700704954, 'batch_norm': False, 'lr': 5.251169796338572e-06, 'weight_decay': 3.258008571854698e-07, 'epochs': 264, 'loss': 'mse', 'optimizer': 'adam', 'graph_mode': 'off', 'use_snp_selection': False}. Best is trial 89 with value: 0.3028311590851349.
[I 2025-12-06 01:59:36,621] Trial 96 finished with value: 0.2939185772087362 and parameters: {'model_type': 'mlp', 'hidden_dims': '[512, 64]', 'dropout': 0.5787166762732916, 'batch_norm': False, 'lr': 5.214703103324537e-06, 'weight_decay': 3.4171853875963943e-07, 'epochs': 253, 'loss': 'mse', 'optimizer': 'adam', 'graph_mode': 'off', 'use_snp_selection': False}. Best is trial 89 with value: 0.3028311590851349.
[I 2025-12-06 02:00:23,047] Trial 97 finished with value: 0.2963898579388776 and parameters: {'model_type': 'mlp', 'hidden_dims': '[512, 64]', 'dropout': 0.5965556424133738, 'batch_norm': False, 'lr': 6.987736086296393e-06, 'weight_decay': 1.0219502244275119e-07, 'epochs': 236, 'loss': 'mse', 'optimizer': 'adam', 'graph_mode': 'off', 'use_snp_selection': False}. Best is trial 89 with value: 0.3028311590851349.
[I 2025-12-06 02:01:14,245] Trial 98 finished with value: 0.29888640146035866 and parameters: {'model_type': 'mlp', 'hidden_dims': '[512, 64]', 'dropout': 0.5580727293508999, 'batch_norm': False, 'lr': 3.5534544190166187e-06, 'weight_decay': 4.439980255787747e-07, 'epochs': 263, 'loss': 'mse', 'optimizer': 'adam', 'graph_mode': 'off', 'use_snp_selection': False}. Best is trial 89 with value: 0.3028311590851349.
[I 2025-12-06 02:02:09,289] Trial 99 finished with value: 0.29240850662228984 and parameters: {'model_type': 'mlp', 'hidden_dims': '[512, 64]', 'dropout': 0.5770948372688761, 'batch_norm': False, 'lr': 4.3363516293678515e-06, 'weight_decay': 2.5976981503161214e-07, 'epochs': 285, 'loss': 'mse', 'optimizer': 'adam', 'graph_mode': 'off', 'use_snp_selection': False}. Best is trial 89 with value: 0.3028311590851349.
[I 2025-12-06 02:02:58,364] Trial 100 finished with value: 0.2814084418549153 and parameters: {'model_type': 'mlp', 'hidden_dims': '[512, 64]', 'dropout': 0.599982390542531, 'batch_norm': True, 'lr': 3.2704075344150445e-06, 'weight_decay': 1.1099809859647067e-06, 'epochs': 249, 'loss': 'mse', 'optimizer': 'adam', 'graph_mode': 'off', 'use_snp_selection': False}. Best is trial 89 with value: 0.3028311590851349.
[I 2025-12-06 02:03:50,399] Trial 101 finished with value: 0.2975157750436294 and parameters: {'model_type': 'mlp', 'hidden_dims': '[512, 64]', 'dropout': 0.5602640250909852, 'batch_norm': False, 'lr': 5.725888246404193e-06, 'weight_decay': 6.521433282995367e-07, 'epochs': 268, 'loss': 'mse', 'optimizer': 'adam', 'graph_mode': 'off', 'use_snp_selection': False}. Best is trial 89 with value: 0.3028311590851349.
[I 2025-12-06 02:04:40,573] Trial 102 finished with value: 0.29665748033281847 and parameters: {'model_type': 'mlp', 'hidden_dims': '[512, 64]', 'dropout': 0.5390553629478934, 'batch_norm': False, 'lr': 3.5228557567510126e-06, 'weight_decay': 5.33736951769345e-07, 'epochs': 257, 'loss': 'mse', 'optimizer': 'adam', 'graph_mode': 'off', 'use_snp_selection': False}. Best is trial 89 with value: 0.3028311590851349.
[I 2025-12-06 02:05:34,186] Trial 103 finished with value: 0.29547897481989194 and parameters: {'model_type': 'mlp', 'hidden_dims': '[512, 64]', 'dropout': 0.5873977774177999, 'batch_norm': False, 'lr': 2.414017167184413e-06, 'weight_decay': 4.4258365682010853e-07, 'epochs': 277, 'loss': 'mse', 'optimizer': 'adam', 'graph_mode': 'off', 'use_snp_selection': False}. Best is trial 89 with value: 0.3028311590851349.
[I 2025-12-06 02:06:18,741] Trial 104 finished with value: 0.30224083644851396 and parameters: {'model_type': 'mlp', 'hidden_dims': '[512, 64]', 'dropout': 0.5545741973205764, 'batch_norm': False, 'lr': 3.9508003080195345e-06, 'weight_decay': 2.0320877852338083e-07, 'epochs': 225, 'loss': 'mse', 'optimizer': 'adam', 'graph_mode': 'off', 'use_snp_selection': False}. Best is trial 89 with value: 0.3028311590851349.
[I 2025-12-06 02:07:00,486] Trial 105 finished with value: 0.29952962330799093 and parameters: {'model_type': 'mlp', 'hidden_dims': '[512, 64]', 'dropout': 0.5695856269130137, 'batch_norm': False, 'lr': 4.853391371864828e-06, 'weight_decay': 2.1384340855692818e-07, 'epochs': 209, 'loss': 'mse', 'optimizer': 'adam', 'graph_mode': 'off', 'use_snp_selection': False}. Best is trial 89 with value: 0.3028311590851349.
[I 2025-12-06 02:07:45,048] Trial 106 finished with value: 0.30222371146422045 and parameters: {'model_type': 'mlp', 'hidden_dims': '[512, 64]', 'dropout': 0.5250516448415791, 'batch_norm': False, 'lr': 2.828391102073644e-06, 'weight_decay': 2.2141943728581962e-07, 'epochs': 225, 'loss': 'mse', 'optimizer': 'adam', 'graph_mode': 'off', 'use_snp_selection': False}. Best is trial 89 with value: 0.3028311590851349.
[I 2025-12-06 02:08:28,924] Trial 107 finished with value: 0.30348553717700794 and parameters: {'model_type': 'mlp', 'hidden_dims': '[512, 64]', 'dropout': 0.5691304423192273, 'batch_norm': False, 'lr': 3.028892642897111e-06, 'weight_decay': 1.9035031815319967e-07, 'epochs': 221, 'loss': 'mse', 'optimizer': 'adam', 'graph_mode': 'off', 'use_snp_selection': False}. Best is trial 107 with value: 0.30348553717700794.
[I 2025-12-06 02:09:13,602] Trial 108 finished with value: 0.2973170684120299 and parameters: {'model_type': 'mlp', 'hidden_dims': '[512, 64]', 'dropout': 0.5513613718465795, 'batch_norm': False, 'lr': 2.8905037356523032e-06, 'weight_decay': 1.5679163767746905e-07, 'epochs': 225, 'loss': 'mse', 'optimizer': 'adam', 'graph_mode': 'off', 'use_snp_selection': False}. Best is trial 107 with value: 0.30348553717700794.
[I 2025-12-06 02:09:56,896] Trial 109 finished with value: 0.2931052867729417 and parameters: {'model_type': 'mlp', 'hidden_dims': '[512, 64]', 'dropout': 0.5197889157537914, 'batch_norm': False, 'lr': 2.244529219753355e-06, 'weight_decay': 2.1007493909052918e-07, 'epochs': 217, 'loss': 'mse', 'optimizer': 'adam', 'graph_mode': 'off', 'use_snp_selection': False}. Best is trial 107 with value: 0.30348553717700794.
[I 2025-12-06 02:10:22,054] Trial 110 finished with value: 0.29549965155820096 and parameters: {'model_type': 'mlp', 'hidden_dims': '[256, 128, 64]', 'dropout': 0.5065953959160403, 'batch_norm': False, 'lr': 2.745070108263767e-06, 'weight_decay': 1.2923809138684825e-07, 'epochs': 223, 'loss': 'mse', 'optimizer': 'adam', 'graph_mode': 'off', 'use_snp_selection': False}. Best is trial 107 with value: 0.30348553717700794.
[I 2025-12-06 02:11:03,096] Trial 111 finished with value: 0.29532777561365553 and parameters: {'model_type': 'mlp', 'hidden_dims': '[512, 64]', 'dropout': 0.5713408939752508, 'batch_norm': False, 'lr': 4.677236918881956e-06, 'weight_decay': 2.254924370806867e-07, 'epochs': 205, 'loss': 'mse', 'optimizer': 'adam', 'graph_mode': 'off', 'use_snp_selection': False}. Best is trial 107 with value: 0.30348553717700794.
[I 2025-12-06 02:11:45,188] Trial 112 finished with value: 0.2937188350073174 and parameters: {'model_type': 'mlp', 'hidden_dims': '[512, 64]', 'dropout': 0.5660426452709683, 'batch_norm': False, 'lr': 6.2352966875230375e-06, 'weight_decay': 1.8351137991805481e-07, 'epochs': 211, 'loss': 'mse', 'optimizer': 'adam', 'graph_mode': 'off', 'use_snp_selection': False}. Best is trial 107 with value: 0.30348553717700794.
[I 2025-12-06 02:12:21,368] Trial 113 finished with value: 0.30212319829608897 and parameters: {'model_type': 'mlp', 'hidden_dims': '[512, 64]', 'dropout': 0.5438329584419939, 'batch_norm': False, 'lr': 3.210858355591094e-06, 'weight_decay': 3.9512483028010565e-07, 'epochs': 177, 'loss': 'mse', 'optimizer': 'adam', 'graph_mode': 'off', 'use_snp_selection': False}. Best is trial 107 with value: 0.30348553717700794.
[I 2025-12-06 02:13:00,339] Trial 114 finished with value: 0.29141935313715345 and parameters: {'model_type': 'mlp', 'hidden_dims': '[512, 64]', 'dropout': 0.5393277844348032, 'batch_norm': False, 'lr': 2.060829759821637e-06, 'weight_decay': 4.1965734183114936e-07, 'epochs': 193, 'loss': 'mse', 'optimizer': 'adam', 'graph_mode': 'off', 'use_snp_selection': False}. Best is trial 107 with value: 0.30348553717700794.
[I 2025-12-06 02:13:47,060] Trial 115 finished with value: 0.2994399124945087 and parameters: {'model_type': 'mlp', 'hidden_dims': '[512, 128]', 'dropout': 0.5266302615695908, 'batch_norm': False, 'lr': 3.2560411594984198e-06, 'weight_decay': 1.0606951452740794e-07, 'epochs': 234, 'loss': 'mse', 'optimizer': 'adam', 'graph_mode': 'off', 'use_snp_selection': False}. Best is trial 107 with value: 0.30348553717700794.
[I 2025-12-06 02:14:34,965] Trial 116 finished with value: 0.3027403070083784 and parameters: {'model_type': 'mlp', 'hidden_dims': '[512, 64]', 'dropout': 0.5505998730381539, 'batch_norm': False, 'lr': 2.3040524281891055e-06, 'weight_decay': 2.6546810643915203e-07, 'epochs': 244, 'loss': 'mse', 'optimizer': 'adam', 'graph_mode': 'off', 'use_snp_selection': False}. Best is trial 107 with value: 0.30348553717700794.
[I 2025-12-06 02:15:08,493] Trial 117 finished with value: 0.29226504085815697 and parameters: {'model_type': 'mlp', 'hidden_dims': '[512, 64]', 'dropout': 0.5430601894422349, 'batch_norm': False, 'lr': 2.356509629330643e-06, 'weight_decay': 8.430457051185146e-07, 'epochs': 161, 'loss': 'mse', 'optimizer': 'adam', 'graph_mode': 'off', 'use_snp_selection': False}. Best is trial 107 with value: 0.30348553717700794.
[I 2025-12-06 02:15:46,096] Trial 118 finished with value: 0.29807432219915075 and parameters: {'model_type': 'mlp', 'hidden_dims': '[512, 64]', 'dropout': 0.5542040348194487, 'batch_norm': False, 'lr': 2.7540319712648526e-06, 'weight_decay': 2.5051706598742685e-07, 'epochs': 185, 'loss': 'mse', 'optimizer': 'adam', 'graph_mode': 'off', 'use_snp_selection': False}. Best is trial 107 with value: 0.30348553717700794.
[I 2025-12-06 02:16:29,953] Trial 119 finished with value: 0.28393605733348215 and parameters: {'model_type': 'mlp', 'hidden_dims': '[512, 128]', 'dropout': 0.523439282132703, 'batch_norm': True, 'lr': 1.9177577310413815e-06, 'weight_decay': 1.35823318133462e-07, 'epochs': 219, 'loss': 'mse', 'optimizer': 'adam', 'graph_mode': 'off', 'use_snp_selection': False}. Best is trial 107 with value: 0.30348553717700794.
[I 2025-12-06 02:16:50,468] Trial 120 finished with value: 0.26714023168457846 and parameters: {'model_type': 'mlp', 'hidden_dims': '[256, 128]', 'dropout': 0.5809646346134267, 'batch_norm': False, 'lr': 1.593008800410539e-06, 'weight_decay': 3.5709639537326687e-07, 'epochs': 173, 'loss': 'mse', 'optimizer': 'adam', 'graph_mode': 'off', 'use_snp_selection': False}. Best is trial 107 with value: 0.30348553717700794.
[I 2025-12-06 02:17:37,807] Trial 121 finished with value: 0.29895371766909806 and parameters: {'model_type': 'mlp', 'hidden_dims': '[512, 64]', 'dropout': 0.577065141314238, 'batch_norm': False, 'lr': 4.057914875632696e-06, 'weight_decay': 2.858389632133569e-07, 'epochs': 241, 'loss': 'mse', 'optimizer': 'adam', 'graph_mode': 'off', 'use_snp_selection': False}. Best is trial 107 with value: 0.30348553717700794.
[I 2025-12-06 02:18:23,216] Trial 122 finished with value: 0.2909305827262744 and parameters: {'model_type': 'mlp', 'hidden_dims': '[512, 64]', 'dropout': 0.12023820248953951, 'batch_norm': False, 'lr': 2.4544365542666036e-06, 'weight_decay': 3.7449907311417485e-07, 'epochs': 229, 'loss': 'mse', 'optimizer': 'adam', 'graph_mode': 'off', 'use_snp_selection': False}. Best is trial 107 with value: 0.30348553717700794.
[I 2025-12-06 02:19:10,992] Trial 123 finished with value: 0.3004794639925269 and parameters: {'model_type': 'mlp', 'hidden_dims': '[512, 64]', 'dropout': 0.5569548043403814, 'batch_norm': False, 'lr': 3.118091633309518e-06, 'weight_decay': 1.9162459643588097e-07, 'epochs': 243, 'loss': 'mse', 'optimizer': 'adam', 'graph_mode': 'off', 'use_snp_selection': False}. Best is trial 107 with value: 0.30348553717700794.
[I 2025-12-06 02:19:58,505] Trial 124 finished with value: 0.30054876856715956 and parameters: {'model_type': 'mlp', 'hidden_dims': '[512, 64]', 'dropout': 0.552609169248368, 'batch_norm': False, 'lr': 3.164618992765762e-06, 'weight_decay': 1.916841123429224e-07, 'epochs': 242, 'loss': 'mse', 'optimizer': 'adam', 'graph_mode': 'off', 'use_snp_selection': False}. Best is trial 107 with value: 0.30348553717700794.
[I 2025-12-06 02:20:45,510] Trial 125 finished with value: 0.29933659327398165 and parameters: {'model_type': 'mlp', 'hidden_dims': '[512, 64]', 'dropout': 0.5502904869847585, 'batch_norm': False, 'lr': 3.034124686377783e-06, 'weight_decay': 1.8360267724318011e-07, 'epochs': 239, 'loss': 'mse', 'optimizer': 'adam', 'graph_mode': 'off', 'use_snp_selection': False}. Best is trial 107 with value: 0.30348553717700794.
[I 2025-12-06 02:21:25,185] Trial 126 finished with value: 0.2923820842860415 and parameters: {'model_type': 'mlp', 'hidden_dims': '[512, 64]', 'dropout': 0.5322396617794178, 'batch_norm': False, 'lr': 2.1010763627442405e-06, 'weight_decay': 1.54981799850326e-07, 'epochs': 197, 'loss': 'mse', 'optimizer': 'adam', 'graph_mode': 'off', 'use_snp_selection': False}. Best is trial 107 with value: 0.30348553717700794.
[I 2025-12-06 02:22:10,459] Trial 127 finished with value: 0.2980400474249545 and parameters: {'model_type': 'mlp', 'hidden_dims': '[512, 64]', 'dropout': 0.47648619145978155, 'batch_norm': False, 'lr': 3.4320757641625764e-06, 'weight_decay': 1.208652996631564e-07, 'epochs': 229, 'loss': 'mse', 'optimizer': 'adam', 'graph_mode': 'off', 'use_snp_selection': False}. Best is trial 107 with value: 0.30348553717700794.
[I 2025-12-06 02:22:57,982] Trial 128 finished with value: 0.29283476614635606 and parameters: {'model_type': 'mlp', 'hidden_dims': '[512, 64]', 'dropout': 0.5054315147882121, 'batch_norm': False, 'lr': 1.7111125722380485e-06, 'weight_decay': 1.8897938862716767e-07, 'epochs': 242, 'loss': 'mse', 'optimizer': 'adam', 'graph_mode': 'off', 'use_snp_selection': False}. Best is trial 107 with value: 0.30348553717700794.
[I 2025-12-06 02:23:15,555] Trial 129 finished with value: 0.28381623209071394 and parameters: {'model_type': 'mlp', 'hidden_dims': '[128, 64]', 'dropout': 0.5580337832664118, 'batch_norm': False, 'lr': 3.094748258556286e-06, 'weight_decay': 2.3348204162358654e-07, 'epochs': 255, 'loss': 'mse', 'optimizer': 'adam', 'graph_mode': 'off', 'use_snp_selection': False}. Best is trial 107 with value: 0.30348553717700794.
[I 2025-12-06 02:24:01,163] Trial 130 finished with value: 0.2797972045432423 and parameters: {'model_type': 'mlp', 'hidden_dims': '[512, 64]', 'dropout': 0.5457873502436985, 'batch_norm': False, 'lr': 0.0002664820815126203, 'weight_decay': 1.4802006921738223e-07, 'epochs': 233, 'loss': 'mse', 'optimizer': 'adam', 'graph_mode': 'off', 'use_snp_selection': False}. Best is trial 107 with value: 0.30348553717700794.
[I 2025-12-06 02:24:44,939] Trial 131 finished with value: 0.3017609876007915 and parameters: {'model_type': 'mlp', 'hidden_dims': '[512, 64]', 'dropout': 0.5883541967121234, 'batch_norm': False, 'lr': 3.8226214518987515e-06, 'weight_decay': 2.261438134272834e-06, 'epochs': 221, 'loss': 'mse', 'optimizer': 'adam', 'graph_mode': 'off', 'use_snp_selection': False}. Best is trial 107 with value: 0.30348553717700794.
[I 2025-12-06 02:25:28,033] Trial 132 finished with value: 0.2961602291630689 and parameters: {'model_type': 'mlp', 'hidden_dims': '[512, 64]', 'dropout': 0.5598910931434802, 'batch_norm': False, 'lr': 2.627685268954112e-06, 'weight_decay': 2.3958612208000384e-06, 'epochs': 217, 'loss': 'mse', 'optimizer': 'adam', 'graph_mode': 'off', 'use_snp_selection': False}. Best is trial 107 with value: 0.30348553717700794.
[I 2025-12-06 02:26:12,174] Trial 133 finished with value: 0.2942307363030966 and parameters: {'model_type': 'mlp', 'hidden_dims': '[512, 64]', 'dropout': 0.5893027000740536, 'batch_norm': False, 'lr': 2.3125541407171135e-06, 'weight_decay': 4.813564581764343e-07, 'epochs': 223, 'loss': 'mse', 'optimizer': 'adam', 'graph_mode': 'off', 'use_snp_selection': False}. Best is trial 107 with value: 0.30348553717700794.
[I 2025-12-06 02:26:48,477] Trial 134 finished with value: 0.29842074464627616 and parameters: {'model_type': 'mlp', 'hidden_dims': '[512, 64]', 'dropout': 0.5359428373638131, 'batch_norm': False, 'lr': 2.9194026710631277e-06, 'weight_decay': 2.691906443852602e-07, 'epochs': 178, 'loss': 'mse', 'optimizer': 'adam', 'graph_mode': 'off', 'use_snp_selection': False}. Best is trial 107 with value: 0.30348553717700794.
