[I 2025-12-05 14:31:12,731] Trial 7 finished with value: 0.11021845071930386 and parameters: {'model_type': 'mlp', 'hidden_dims': '[512, 256]', 'dropout': 0.15343979219678458, 'batch_norm': True, 'lr': 6.234003099047341e-05, 'weight_decay': 3.894760610535477e-07, 'epochs': 97, 'loss': 'mse', 'optimizer': 'adam', 'graph_mode': 'off', 'use_snp_selection': False}. Best is trial 7 with value: 0.11021845071930386.
[I 2025-12-05 14:31:14,711] Trial 8 finished with value: 0.11969808973502838 and parameters: {'model_type': 'mlp', 'hidden_dims': '[512, 128]', 'dropout': 0.10743001231661406, 'batch_norm': True, 'lr': 0.00023728538449271062, 'weight_decay': 1.7629071578048637e-05, 'epochs': 312, 'loss': 'mae', 'optimizer': 'adam', 'graph_mode': 'off', 'use_snp_selection': False}. Best is trial 8 with value: 0.11969808973502838.
[I 2025-12-05 14:31:16,171] Trial 9 finished with value: 0.11557775846265105 and parameters: {'model_type': 'mlp', 'hidden_dims': '[512, 64]', 'dropout': 0.14505336736221927, 'batch_norm': True, 'lr': 5.8619638388111826e-05, 'weight_decay': 6.200156172669308e-07, 'epochs': 175, 'loss': 'mse', 'optimizer': 'adam', 'graph_mode': 'off', 'use_snp_selection': False}. Best is trial 8 with value: 0.11969808973502838.
[I 2025-12-05 14:31:17,144] Trial 10 finished with value: 0.05592246062479224 and parameters: {'model_type': 'mlp', 'hidden_dims': '[512, 128]', 'dropout': 0.2800030442581858, 'batch_norm': False, 'lr': 0.0004919806695968258, 'weight_decay': 2.9953888095455486e-06, 'epochs': 55, 'loss': 'mae', 'optimizer': 'adam', 'graph_mode': 'off', 'use_snp_selection': False}. Best is trial 8 with value: 0.11969808973502838.
[I 2025-12-05 14:31:18,753] Trial 11 finished with value: 0.1013731828469351 and parameters: {'model_type': 'mlp', 'hidden_dims': '[512, 128]', 'dropout': 0.10095648685224448, 'batch_norm': True, 'lr': 0.0003411435764085616, 'weight_decay': 1.2045055692919657e-07, 'epochs': 216, 'loss': 'mse', 'optimizer': 'adam', 'graph_mode': 'off', 'use_snp_selection': False}. Best is trial 8 with value: 0.11969808973502838.
[I 2025-12-05 14:31:20,652] Trial 12 finished with value: 0.11201198120847379 and parameters: {'model_type': 'mlp', 'hidden_dims': '[512, 64]', 'dropout': 0.10344600881777158, 'batch_norm': True, 'lr': 0.00018400807026440393, 'weight_decay': 2.071258764988014e-06, 'epochs': 281, 'loss': 'mae', 'optimizer': 'adam', 'graph_mode': 'off', 'use_snp_selection': False}. Best is trial 8 with value: 0.11969808973502838.
[I 2025-12-05 14:31:21,453] Trial 13 finished with value: 0.04521032946290768 and parameters: {'model_type': 'mlp', 'hidden_dims': '[128, 64]', 'dropout': 0.21435803488913518, 'batch_norm': True, 'lr': 1.343038855084232e-05, 'weight_decay': 5.9577988329204815e-05, 'epochs': 156, 'loss': 'mse', 'optimizer': 'adam', 'graph_mode': 'off', 'use_snp_selection': False}. Best is trial 8 with value: 0.11969808973502838.
[I 2025-12-05 14:31:22,676] Trial 14 finished with value: 0.1048471110177914 and parameters: {'model_type': 'mlp', 'hidden_dims': '[256, 128, 64]', 'dropout': 0.3012984444538551, 'batch_norm': True, 'lr': 0.0001457690241539883, 'weight_decay': 5.543728086118145e-07, 'epochs': 262, 'loss': 'mse', 'optimizer': 'adam', 'graph_mode': 'off', 'use_snp_selection': False}. Best is trial 8 with value: 0.11969808973502838.
[I 2025-12-05 14:31:23,856] Trial 15 finished with value: 0.11085698308335395 and parameters: {'model_type': 'mlp', 'hidden_dims': '[512, 256]', 'dropout': 0.1723492905468449, 'batch_norm': True, 'lr': 0.000789806924142399, 'weight_decay': 7.236536090132001e-06, 'epochs': 106, 'loss': 'mae', 'optimizer': 'adam', 'graph_mode': 'off', 'use_snp_selection': False}. Best is trial 8 with value: 0.11969808973502838.
[I 2025-12-05 14:31:26,020] Trial 16 finished with value: 0.07188024897812502 and parameters: {'model_type': 'mlp', 'hidden_dims': '[512, 128]', 'dropout': 0.558513902174278, 'batch_norm': True, 'lr': 2.1517090787442848e-05, 'weight_decay': 1.3515208983181626e-07, 'epochs': 350, 'loss': 'mse', 'optimizer': 'adam', 'graph_mode': 'off', 'use_snp_selection': False}. Best is trial 8 with value: 0.11969808973502838.
[I 2025-12-05 14:31:27,668] Trial 17 finished with value: 0.11861796505080408 and parameters: {'model_type': 'mlp', 'hidden_dims': '[512, 64]', 'dropout': 0.4828821377080479, 'batch_norm': True, 'lr': 0.00013980529748764629, 'weight_decay': 7.208825532007247e-07, 'epochs': 225, 'loss': 'mae', 'optimizer': 'adam', 'graph_mode': 'off', 'use_snp_selection': False}. Best is trial 8 with value: 0.11969808973502838.
[I 2025-12-05 14:31:31,109] Trial 18 finished with value: 0.10254040550417184 and parameters: {'model_type': 'mlp', 'hidden_dims': '[512, 128]', 'dropout': 0.49156208953280517, 'batch_norm': False, 'lr': 0.00019754070693579637, 'weight_decay': 5.409591144113358e-06, 'epochs': 308, 'loss': 'mae', 'optimizer': 'adam', 'graph_mode': 'off', 'use_snp_selection': True, 'num_snps': 58241}. Best is trial 8 with value: 0.11969808973502838.
[I 2025-12-05 14:31:32,812] Trial 19 finished with value: 0.10145834353664744 and parameters: {'model_type': 'mlp', 'hidden_dims': '[512, 64]', 'dropout': 0.4888253413204368, 'batch_norm': True, 'lr': 0.00086785817604629, 'weight_decay': 2.1516134287486765e-05, 'epochs': 226, 'loss': 'mae', 'optimizer': 'adam', 'graph_mode': 'off', 'use_snp_selection': False}. Best is trial 8 with value: 0.11969808973502838.
[I 2025-12-05 14:31:33,802] Trial 20 finished with value: 0.09605820846718266 and parameters: {'model_type': 'mlp', 'hidden_dims': '[128, 64]', 'dropout': 0.3226270793684554, 'batch_norm': True, 'lr': 0.0002995209451731648, 'weight_decay': 0.0001247981980720522, 'epochs': 292, 'loss': 'mae', 'optimizer': 'adam', 'graph_mode': 'off', 'use_snp_selection': False}. Best is trial 8 with value: 0.11969808973502838.
[I 2025-12-05 14:31:35,287] Trial 21 finished with value: 0.11783707669855686 and parameters: {'model_type': 'mlp', 'hidden_dims': '[512, 64]', 'dropout': 0.1572758142894234, 'batch_norm': True, 'lr': 0.00010176063557969185, 'weight_decay': 8.338137870551552e-07, 'epochs': 179, 'loss': 'mae', 'optimizer': 'adam', 'graph_mode': 'off', 'use_snp_selection': False}. Best is trial 8 with value: 0.11969808973502838.
[I 2025-12-05 14:31:37,022] Trial 22 finished with value: 0.1034513309434351 and parameters: {'model_type': 'mlp', 'hidden_dims': '[512, 64]', 'dropout': 0.23974929911161064, 'batch_norm': True, 'lr': 0.00010763288368970431, 'weight_decay': 9.96007463676426e-07, 'epochs': 249, 'loss': 'mae', 'optimizer': 'adam', 'graph_mode': 'off', 'use_snp_selection': False}. Best is trial 8 with value: 0.11969808973502838.
[I 2025-12-05 14:31:38,585] Trial 23 finished with value: 0.09955010215975219 and parameters: {'model_type': 'mlp', 'hidden_dims': '[512, 64]', 'dropout': 0.34556585179736776, 'batch_norm': True, 'lr': 2.714572702815677e-05, 'weight_decay': 3.0392658731692056e-07, 'epochs': 205, 'loss': 'mae', 'optimizer': 'adam', 'graph_mode': 'off', 'use_snp_selection': False}. Best is trial 8 with value: 0.11969808973502838.
[I 2025-12-05 14:31:39,794] Trial 24 finished with value: 0.10662289187168819 and parameters: {'model_type': 'mlp', 'hidden_dims': '[512, 64]', 'dropout': 0.46987033741278, 'batch_norm': True, 'lr': 0.00010186932911646434, 'weight_decay': 3.6656615358579082e-06, 'epochs': 117, 'loss': 'mae', 'optimizer': 'adam', 'graph_mode': 'off', 'use_snp_selection': False}. Best is trial 8 with value: 0.11969808973502838.
[I 2025-12-05 14:31:41,450] Trial 25 finished with value: 0.09443702914590024 and parameters: {'model_type': 'mlp', 'hidden_dims': '[512, 256]', 'dropout': 0.5335323239954017, 'batch_norm': True, 'lr': 0.00032581567218656425, 'weight_decay': 1.1967267865190276e-06, 'epochs': 229, 'loss': 'mae', 'optimizer': 'adam', 'graph_mode': 'off', 'use_snp_selection': False}. Best is trial 8 with value: 0.11969808973502838.
[I 2025-12-05 14:31:42,326] Trial 26 finished with value: 0.07105646821358563 and parameters: {'model_type': 'mlp', 'hidden_dims': '[256, 128]', 'dropout': 0.12748440783717374, 'batch_norm': True, 'lr': 1.395458800053491e-05, 'weight_decay': 2.44695737317125e-07, 'epochs': 175, 'loss': 'mae', 'optimizer': 'adam', 'graph_mode': 'off', 'use_snp_selection': True, 'num_snps': 3842}. Best is trial 8 with value: 0.11969808973502838.
[I 2025-12-05 14:31:43,324] Trial 27 finished with value: 0.09571011192460332 and parameters: {'model_type': 'mlp', 'hidden_dims': '[256, 128, 64]', 'dropout': 0.19704616949852904, 'batch_norm': False, 'lr': 3.708794373669967e-05, 'weight_decay': 2.6086871179536294e-05, 'epochs': 171, 'loss': 'mae', 'optimizer': 'adam', 'graph_mode': 'off', 'use_snp_selection': False}. Best is trial 8 with value: 0.11969808973502838.
[I 2025-12-05 14:31:44,569] Trial 28 finished with value: 0.10192562157942392 and parameters: {'model_type': 'mlp', 'hidden_dims': '[512, 128]', 'dropout': 0.16736852190076568, 'batch_norm': True, 'lr': 0.00010512008241052931, 'weight_decay': 1.0937668004484908e-05, 'epochs': 123, 'loss': 'mae', 'optimizer': 'adam', 'graph_mode': 'off', 'use_snp_selection': False}. Best is trial 8 with value: 0.11969808973502838.
[I 2025-12-05 14:31:45,759] Trial 29 finished with value: 0.0990584440111423 and parameters: {'model_type': 'mlp', 'hidden_dims': '[128, 64]', 'dropout': 0.19689104069611743, 'batch_norm': True, 'lr': 0.0005388560200940643, 'weight_decay': 5.5227103357724904e-05, 'epochs': 78, 'loss': 'mae', 'optimizer': 'adam', 'graph_mode': 'off', 'use_snp_selection': True, 'num_snps': 19468}. Best is trial 8 with value: 0.11969808973502838.
[I 2025-12-05 14:31:47,867] Trial 30 finished with value: 0.10745654481909987 and parameters: {'model_type': 'mlp', 'hidden_dims': '[512, 64]', 'dropout': 0.2523135802350327, 'batch_norm': True, 'lr': 0.0002026393563698559, 'weight_decay': 7.037741765346293e-07, 'epochs': 322, 'loss': 'mae', 'optimizer': 'adam', 'graph_mode': 'off', 'use_snp_selection': False}. Best is trial 8 with value: 0.11969808973502838.
[I 2025-12-05 14:31:49,353] Trial 31 finished with value: 0.11067493200585593 and parameters: {'model_type': 'mlp', 'hidden_dims': '[512, 64]', 'dropout': 0.1204107143800032, 'batch_norm': True, 'lr': 7.182121600346975e-05, 'weight_decay': 2.3067680642911222e-07, 'epochs': 187, 'loss': 'mse', 'optimizer': 'adam', 'graph_mode': 'off', 'use_snp_selection': False}. Best is trial 8 with value: 0.11969808973502838.
[I 2025-12-05 14:31:50,824] Trial 32 finished with value: 0.1062908393417917 and parameters: {'model_type': 'mlp', 'hidden_dims': '[512, 64]', 'dropout': 0.14964456258738418, 'batch_norm': True, 'lr': 5.475532178807485e-05, 'weight_decay': 5.895747643470183e-07, 'epochs': 184, 'loss': 'mse', 'optimizer': 'adam', 'graph_mode': 'off', 'use_snp_selection': False}. Best is trial 8 with value: 0.11969808973502838.
[I 2025-12-05 14:31:52,527] Trial 33 finished with value: 0.11350052674860055 and parameters: {'model_type': 'mlp', 'hidden_dims': '[512, 64]', 'dropout': 0.1435061974722923, 'batch_norm': True, 'lr': 0.0001381687238446406, 'weight_decay': 2.0227308636711724e-06, 'epochs': 242, 'loss': 'mae', 'optimizer': 'adam', 'graph_mode': 'off', 'use_snp_selection': False}. Best is trial 8 with value: 0.11969808973502838.
[I 2025-12-05 14:31:53,850] Trial 34 finished with value: 0.10662124692370495 and parameters: {'model_type': 'mlp', 'hidden_dims': '[512, 64]', 'dropout': 0.2224676896667308, 'batch_norm': True, 'lr': 8.828403853386392e-05, 'weight_decay': 4.305425396752208e-06, 'epochs': 138, 'loss': 'mae', 'optimizer': 'adam', 'graph_mode': 'off', 'use_snp_selection': False}. Best is trial 8 with value: 0.11969808973502838.
[I 2025-12-05 14:31:54,819] Trial 35 finished with value: 0.10161801460818745 and parameters: {'model_type': 'mlp', 'hidden_dims': '[256, 128]', 'dropout': 0.43024169205778806, 'batch_norm': False, 'lr': 0.0002507591862271002, 'weight_decay': 1.7479081285587815e-05, 'epochs': 161, 'loss': 'mse', 'optimizer': 'adam', 'graph_mode': 'off', 'use_snp_selection': False}. Best is trial 8 with value: 0.11969808973502838.
[I 2025-12-05 14:31:57,630] Trial 36 finished with value: 0.10001250637101394 and parameters: {'model_type': 'mlp', 'hidden_dims': '[256, 128, 64]', 'dropout': 0.17521200946810195, 'batch_norm': True, 'lr': 3.8728252032879503e-05, 'weight_decay': 9.377695349440651e-07, 'epochs': 262, 'loss': 'mae', 'optimizer': 'adam', 'graph_mode': 'off', 'use_snp_selection': True, 'num_snps': 58661}. Best is trial 8 with value: 0.11969808973502838.
[I 2025-12-05 14:31:59,235] Trial 37 finished with value: 0.05739085523104378 and parameters: {'model_type': 'mlp', 'hidden_dims': '[512, 64]', 'dropout': 0.35221315408510456, 'batch_norm': True, 'lr': 4.446294938689996e-06, 'weight_decay': 7.973050524781971e-06, 'epochs': 204, 'loss': 'mse', 'optimizer': 'adam', 'graph_mode': 'off', 'use_snp_selection': False}. Best is trial 8 with value: 0.11969808973502838.
[I 2025-12-05 14:32:00,509] Trial 38 finished with value: 0.11957226965271556 and parameters: {'model_type': 'mlp', 'hidden_dims': '[512, 128]', 'dropout': 0.12267838365095048, 'batch_norm': False, 'lr': 0.0004755143541038705, 'weight_decay': 4.985936266997705e-07, 'epochs': 131, 'loss': 'mae', 'optimizer': 'adam', 'graph_mode': 'off', 'use_snp_selection': True, 'num_snps': 19911}. Best is trial 8 with value: 0.11969808973502838.
[I 2025-12-05 14:32:01,803] Trial 39 finished with value: 0.10740175496799925 and parameters: {'model_type': 'mlp', 'hidden_dims': '[512, 128]', 'dropout': 0.5953897123629954, 'batch_norm': False, 'lr': 0.00046927646699456257, 'weight_decay': 1.699531119317841e-07, 'epochs': 71, 'loss': 'mae', 'optimizer': 'adam', 'graph_mode': 'off', 'use_snp_selection': True, 'num_snps': 21018}. Best is trial 8 with value: 0.11969808973502838.
[I 2025-12-05 14:32:03,277] Trial 40 finished with value: 0.12012300035419853 and parameters: {'model_type': 'mlp', 'hidden_dims': '[512, 128]', 'dropout': 0.12035009645589044, 'batch_norm': False, 'lr': 0.0005847497436045349, 'weight_decay': 3.743064327147944e-07, 'epochs': 133, 'loss': 'mae', 'optimizer': 'adam', 'graph_mode': 'off', 'use_snp_selection': True, 'num_snps': 24090}. Best is trial 40 with value: 0.12012300035419853.
[I 2025-12-05 14:32:04,677] Trial 41 finished with value: 0.10431523735071369 and parameters: {'model_type': 'mlp', 'hidden_dims': '[512, 128]', 'dropout': 0.12310245724832695, 'batch_norm': False, 'lr': 0.0006651121631014497, 'weight_decay': 4.584440723463353e-07, 'epochs': 134, 'loss': 'mae', 'optimizer': 'adam', 'graph_mode': 'off', 'use_snp_selection': True, 'num_snps': 22414}. Best is trial 40 with value: 0.12012300035419853.
[I 2025-12-05 14:32:05,680] Trial 42 finished with value: 0.10578780683603736 and parameters: {'model_type': 'mlp', 'hidden_dims': '[512, 128]', 'dropout': 0.10541595151400607, 'batch_norm': False, 'lr': 0.0004552524158449038, 'weight_decay': 3.5682825671733735e-07, 'epochs': 87, 'loss': 'mae', 'optimizer': 'adam', 'graph_mode': 'off', 'use_snp_selection': True, 'num_snps': 12442}. Best is trial 40 with value: 0.12012300035419853.
[I 2025-12-05 14:32:07,300] Trial 43 finished with value: 0.11544613567534391 and parameters: {'model_type': 'mlp', 'hidden_dims': '[512, 128]', 'dropout': 0.1325857368231114, 'batch_norm': False, 'lr': 0.00035321586223281784, 'weight_decay': 1.007091406369152e-07, 'epochs': 147, 'loss': 'mae', 'optimizer': 'adam', 'graph_mode': 'off', 'use_snp_selection': True, 'num_snps': 26662}. Best is trial 40 with value: 0.12012300035419853.
[I 2025-12-05 14:32:09,489] Trial 44 finished with value: 0.1160780468039498 and parameters: {'model_type': 'mlp', 'hidden_dims': '[512, 128]', 'dropout': 0.1654951536136051, 'batch_norm': False, 'lr': 0.0009501033354359457, 'weight_decay': 1.6565268622488248e-06, 'epochs': 122, 'loss': 'mae', 'optimizer': 'adam', 'graph_mode': 'off', 'use_snp_selection': True, 'num_snps': 41739}. Best is trial 40 with value: 0.12012300035419853.
[I 2025-12-05 14:32:10,592] Trial 45 finished with value: 0.1200871125677947 and parameters: {'model_type': 'mlp', 'hidden_dims': '[512, 128]', 'dropout': 0.39522721631378455, 'batch_norm': False, 'lr': 0.00025711146600566914, 'weight_decay': 2.679719894859676e-06, 'epochs': 159, 'loss': 'mae', 'optimizer': 'adam', 'graph_mode': 'off', 'use_snp_selection': True, 'num_snps': 13001}. Best is trial 40 with value: 0.12012300035419853.
[I 2025-12-05 14:32:11,532] Trial 46 finished with value: 0.09703768873245117 and parameters: {'model_type': 'mlp', 'hidden_dims': '[512, 128]', 'dropout': 0.40384452710599167, 'batch_norm': False, 'lr': 0.0006657345588789857, 'weight_decay': 2.5080187495758076e-06, 'epochs': 44, 'loss': 'mae', 'optimizer': 'adam', 'graph_mode': 'off', 'use_snp_selection': True, 'num_snps': 11417}. Best is trial 40 with value: 0.12012300035419853.
[I 2025-12-05 14:32:12,318] Trial 47 finished with value: 0.09545553472433921 and parameters: {'model_type': 'mlp', 'hidden_dims': '[512, 128]', 'dropout': 0.4540134117237326, 'batch_norm': False, 'lr': 0.00023397158232708635, 'weight_decay': 0.0006963874766430621, 'epochs': 106, 'loss': 'mae', 'optimizer': 'adam', 'graph_mode': 'off', 'use_snp_selection': True, 'num_snps': 4617}. Best is trial 40 with value: 0.12012300035419853.
[I 2025-12-05 14:32:13,569] Trial 48 finished with value: 0.10518685959753635 and parameters: {'model_type': 'mlp', 'hidden_dims': '[512, 128]', 'dropout': 0.37683592174286523, 'batch_norm': False, 'lr': 0.0003923093172014858, 'weight_decay': 1.476331257410939e-05, 'epochs': 146, 'loss': 'mae', 'optimizer': 'adam', 'graph_mode': 'off', 'use_snp_selection': True, 'num_snps': 16016}. Best is trial 40 with value: 0.12012300035419853.
[I 2025-12-05 14:32:15,486] Trial 49 finished with value: 0.1064519758915904 and parameters: {'model_type': 'mlp', 'hidden_dims': '[512, 128]', 'dropout': 0.27681013928420456, 'batch_norm': False, 'lr': 0.00016955469126734513, 'weight_decay': 1.3037347896047373e-06, 'epochs': 306, 'loss': 'mae', 'optimizer': 'adam', 'graph_mode': 'off', 'use_snp_selection': True, 'num_snps': 27761}. Best is trial 40 with value: 0.12012300035419853.
[I 2025-12-05 14:32:17,055] Trial 50 finished with value: 0.0924375393362129 and parameters: {'model_type': 'mlp', 'hidden_dims': '[512, 128]', 'dropout': 0.5259523242185432, 'batch_norm': False, 'lr': 0.00062526308156907, 'weight_decay': 4.167883468210884e-05, 'epochs': 158, 'loss': 'mae', 'optimizer': 'adam', 'graph_mode': 'off', 'use_snp_selection': True, 'num_snps': 25527}. Best is trial 40 with value: 0.12012300035419853.
[I 2025-12-05 14:32:18,334] Trial 51 finished with value: 0.11401294876177184 and parameters: {'model_type': 'mlp', 'hidden_dims': '[512, 256]', 'dropout': 0.10219938144454697, 'batch_norm': False, 'lr': 0.0002759840489652783, 'weight_decay': 7.177428929085491e-07, 'epochs': 191, 'loss': 'mae', 'optimizer': 'adam', 'graph_mode': 'off', 'use_snp_selection': True, 'num_snps': 16446}. Best is trial 40 with value: 0.12012300035419853.
[I 2025-12-05 14:32:20,187] Trial 52 finished with value: 0.10661761295187946 and parameters: {'model_type': 'mlp', 'hidden_dims': '[512, 128]', 'dropout': 0.1817543991751352, 'batch_norm': False, 'lr': 0.00017394246187381812, 'weight_decay': 2.3792125229983576e-07, 'epochs': 166, 'loss': 'mae', 'optimizer': 'adam', 'graph_mode': 'off', 'use_snp_selection': True, 'num_snps': 32412}. Best is trial 40 with value: 0.12012300035419853.
[I 2025-12-05 14:32:21,206] Trial 53 finished with value: 0.09700904064741846 and parameters: {'model_type': 'mlp', 'hidden_dims': '[256, 128]', 'dropout': 0.15165381049621446, 'batch_norm': False, 'lr': 0.00013676305965061258, 'weight_decay': 4.272648389010799e-07, 'epochs': 216, 'loss': 'mae', 'optimizer': 'adam', 'graph_mode': 'off', 'use_snp_selection': True, 'num_snps': 8397}. Best is trial 40 with value: 0.12012300035419853.
[I 2025-12-05 14:32:22,373] Trial 54 finished with value: 0.08905338222947583 and parameters: {'model_type': 'mlp', 'hidden_dims': '[128, 64]', 'dropout': 0.41979026741287156, 'batch_norm': False, 'lr': 7.455752645969784e-05, 'weight_decay': 8.013600723278315e-07, 'epochs': 135, 'loss': 'mae', 'optimizer': 'adam', 'graph_mode': 'off', 'use_snp_selection': True, 'num_snps': 17474}. Best is trial 40 with value: 0.12012300035419853.
[I 2025-12-05 14:32:23,889] Trial 55 finished with value: 0.09540509471503046 and parameters: {'model_type': 'mlp', 'hidden_dims': '[512, 128]', 'dropout': 0.3692219608411224, 'batch_norm': False, 'lr': 0.00023909549047797352, 'weight_decay': 6.351227066872319e-06, 'epochs': 108, 'loss': 'mae', 'optimizer': 'adam', 'graph_mode': 'off', 'use_snp_selection': True, 'num_snps': 23490}. Best is trial 40 with value: 0.12012300035419853.
[I 2025-12-05 14:32:25,118] Trial 56 finished with value: 0.11126374779624529 and parameters: {'model_type': 'mlp', 'hidden_dims': '[256, 128, 64]', 'dropout': 0.12108933559748634, 'batch_norm': False, 'lr': 0.00036298642972725957, 'weight_decay': 2.8357168385282382e-06, 'epochs': 274, 'loss': 'mae', 'optimizer': 'adam', 'graph_mode': 'off', 'use_snp_selection': False}. Best is trial 40 with value: 0.12012300035419853.
[I 2025-12-05 14:32:26,343] Trial 57 finished with value: 0.09332405177443058 and parameters: {'model_type': 'mlp', 'hidden_dims': '[512, 128]', 'dropout': 0.3193090203393122, 'batch_norm': True, 'lr': 0.00012796495664074234, 'weight_decay': 1.6139406775110432e-07, 'epochs': 340, 'loss': 'mae', 'optimizer': 'adam', 'graph_mode': 'off', 'use_snp_selection': True, 'num_snps': 7499}. Best is trial 40 with value: 0.12012300035419853.
