[I 2025-12-05 16:09:27,700] Trial 7 finished with value: 0.06383064526137665 and parameters: {'model_type': 'mlp', 'hidden_dims': '[512, 256]', 'dropout': 0.15343979219678458, 'batch_norm': True, 'lr': 6.234003099047341e-05, 'weight_decay': 3.894760610535477e-07, 'epochs': 97, 'loss': 'mse', 'optimizer': 'adam', 'graph_mode': 'off', 'use_snp_selection': False}. Best is trial 1 with value: 0.06518428255743186.
[I 2025-12-05 16:09:30,275] Trial 8 finished with value: 0.08720852766285206 and parameters: {'model_type': 'mlp', 'hidden_dims': '[512, 128]', 'dropout': 0.10743001231661406, 'batch_norm': True, 'lr': 0.00023728538449271062, 'weight_decay': 1.7629071578048637e-05, 'epochs': 312, 'loss': 'mae', 'optimizer': 'adam', 'graph_mode': 'off', 'use_snp_selection': False}. Best is trial 8 with value: 0.08720852766285206.
[I 2025-12-05 16:09:32,083] Trial 9 finished with value: 0.060593907447731334 and parameters: {'model_type': 'mlp', 'hidden_dims': '[512, 64]', 'dropout': 0.14505336736221927, 'batch_norm': True, 'lr': 5.8619638388111826e-05, 'weight_decay': 6.200156172669308e-07, 'epochs': 175, 'loss': 'mse', 'optimizer': 'adam', 'graph_mode': 'off', 'use_snp_selection': False}. Best is trial 8 with value: 0.08720852766285206.
[I 2025-12-05 16:09:33,176] Trial 10 finished with value: 0.07331522437086155 and parameters: {'model_type': 'mlp', 'hidden_dims': '[512, 128]', 'dropout': 0.2800030442581858, 'batch_norm': False, 'lr': 0.0004919806695968258, 'weight_decay': 2.9953888095455486e-06, 'epochs': 55, 'loss': 'mae', 'optimizer': 'adam', 'graph_mode': 'off', 'use_snp_selection': False}. Best is trial 8 with value: 0.08720852766285206.
[I 2025-12-05 16:09:34,385] Trial 11 finished with value: 0.03863443037368961 and parameters: {'model_type': 'mlp', 'hidden_dims': '[512, 128]', 'dropout': 0.2431723102499158, 'batch_norm': False, 'lr': 0.0007312141697563474, 'weight_decay': 3.062975539845402e-06, 'epochs': 77, 'loss': 'mae', 'optimizer': 'adam', 'graph_mode': 'off', 'use_snp_selection': False}. Best is trial 8 with value: 0.08720852766285206.
[I 2025-12-05 16:09:35,351] Trial 12 finished with value: 0.001661996524641525 and parameters: {'model_type': 'mlp', 'hidden_dims': '[512, 128]', 'dropout': 0.10344600881777158, 'batch_norm': False, 'lr': 0.0006159006513942946, 'weight_decay': 1.3081036432574914e-07, 'epochs': 40, 'loss': 'mae', 'optimizer': 'adam', 'graph_mode': 'off', 'use_snp_selection': False}. Best is trial 8 with value: 0.08720852766285206.
[I 2025-12-05 16:09:37,535] Trial 13 finished with value: 0.06793124372304837 and parameters: {'model_type': 'mlp', 'hidden_dims': '[512, 128]', 'dropout': 0.3039588759638207, 'batch_norm': False, 'lr': 0.00023284399572303963, 'weight_decay': 6.001658082910393e-06, 'epochs': 247, 'loss': 'mae', 'optimizer': 'adam', 'graph_mode': 'off', 'use_snp_selection': False}. Best is trial 8 with value: 0.08720852766285206.
[I 2025-12-05 16:09:40,042] Trial 14 finished with value: 0.09480159113044817 and parameters: {'model_type': 'mlp', 'hidden_dims': '[512, 128]', 'dropout': 0.5050584905097204, 'batch_norm': True, 'lr': 0.00021863835391135544, 'weight_decay': 5.724103314313124e-05, 'epochs': 291, 'loss': 'mae', 'optimizer': 'adam', 'graph_mode': 'off', 'use_snp_selection': False}. Best is trial 14 with value: 0.09480159113044817.
[I 2025-12-05 16:09:41,121] Trial 15 finished with value: 0.09296537311581732 and parameters: {'model_type': 'mlp', 'hidden_dims': '[128, 64]', 'dropout': 0.5131741956805737, 'batch_norm': True, 'lr': 0.00018478936662210077, 'weight_decay': 6.682546297843178e-05, 'epochs': 296, 'loss': 'mae', 'optimizer': 'adam', 'graph_mode': 'off', 'use_snp_selection': False}. Best is trial 14 with value: 0.09480159113044817.
[I 2025-12-05 16:09:42,173] Trial 16 finished with value: 0.0825482740245834 and parameters: {'model_type': 'mlp', 'hidden_dims': '[128, 64]', 'dropout': 0.5148506272315372, 'batch_norm': True, 'lr': 2.1517090787442848e-05, 'weight_decay': 0.00011431726695115916, 'epochs': 283, 'loss': 'mae', 'optimizer': 'adam', 'graph_mode': 'off', 'use_snp_selection': False}. Best is trial 14 with value: 0.09480159113044817.
[I 2025-12-05 16:09:43,290] Trial 17 finished with value: 0.08271207806544324 and parameters: {'model_type': 'mlp', 'hidden_dims': '[128, 64]', 'dropout': 0.4988266529410152, 'batch_norm': True, 'lr': 0.00016327822653278406, 'weight_decay': 4.279596648260934e-05, 'epochs': 350, 'loss': 'mae', 'optimizer': 'adam', 'graph_mode': 'off', 'use_snp_selection': False}. Best is trial 14 with value: 0.09480159113044817.
[I 2025-12-05 16:09:46,867] Trial 18 finished with value: 0.023019782052196756 and parameters: {'model_type': 'mlp', 'hidden_dims': '[512, 256]', 'dropout': 0.5855696804968278, 'batch_norm': True, 'lr': 1.558942088672544e-05, 'weight_decay': 0.00010312401360366706, 'epochs': 222, 'loss': 'mae', 'optimizer': 'adam', 'graph_mode': 'off', 'use_snp_selection': True, 'num_snps': 58241}. Best is trial 14 with value: 0.09480159113044817.
[I 2025-12-05 16:09:48,430] Trial 19 finished with value: 0.06648936658754007 and parameters: {'model_type': 'mlp', 'hidden_dims': '[256, 128, 64]', 'dropout': 0.4928474198728684, 'batch_norm': True, 'lr': 0.00013231516260168424, 'weight_decay': 0.00023472361224431218, 'epochs': 281, 'loss': 'mae', 'optimizer': 'adam', 'graph_mode': 'off', 'use_snp_selection': False}. Best is trial 14 with value: 0.09480159113044817.
[I 2025-12-05 16:09:49,518] Trial 20 finished with value: 0.08066129262416387 and parameters: {'model_type': 'mlp', 'hidden_dims': '[128, 64]', 'dropout': 0.5468129818797937, 'batch_norm': True, 'lr': 0.0003596114079763995, 'weight_decay': 4.679666515308887e-05, 'epochs': 302, 'loss': 'mae', 'optimizer': 'adam', 'graph_mode': 'off', 'use_snp_selection': False}. Best is trial 14 with value: 0.09480159113044817.
[I 2025-12-05 16:09:52,099] Trial 21 finished with value: 0.0757430090369278 and parameters: {'model_type': 'mlp', 'hidden_dims': '[512, 128]', 'dropout': 0.4549478501604056, 'batch_norm': True, 'lr': 0.0002516810026022163, 'weight_decay': 1.7245534476657453e-05, 'epochs': 310, 'loss': 'mae', 'optimizer': 'adam', 'graph_mode': 'off', 'use_snp_selection': False}. Best is trial 14 with value: 0.09480159113044817.
[I 2025-12-05 16:09:54,330] Trial 22 finished with value: 0.08577643777711572 and parameters: {'model_type': 'mlp', 'hidden_dims': '[512, 128]', 'dropout': 0.32097758943774246, 'batch_norm': True, 'lr': 0.00013125309290784544, 'weight_decay': 2.4443877762130412e-05, 'epochs': 252, 'loss': 'mae', 'optimizer': 'adam', 'graph_mode': 'off', 'use_snp_selection': False}. Best is trial 14 with value: 0.09480159113044817.
[I 2025-12-05 16:09:55,404] Trial 23 finished with value: 0.06352476710921084 and parameters: {'model_type': 'mlp', 'hidden_dims': '[128, 64]', 'dropout': 0.3452207663776038, 'batch_norm': True, 'lr': 0.0008701779331686658, 'weight_decay': 7.670945906752878e-06, 'epochs': 324, 'loss': 'mae', 'optimizer': 'adam', 'graph_mode': 'off', 'use_snp_selection': False}. Best is trial 14 with value: 0.09480159113044817.
[I 2025-12-05 16:09:57,775] Trial 24 finished with value: 0.07629085504683987 and parameters: {'model_type': 'mlp', 'hidden_dims': '[512, 128]', 'dropout': 0.5501604450438411, 'batch_norm': True, 'lr': 0.00010186932911646434, 'weight_decay': 7.231662168064224e-05, 'epochs': 269, 'loss': 'mae', 'optimizer': 'adam', 'graph_mode': 'off', 'use_snp_selection': False}. Best is trial 14 with value: 0.09480159113044817.
[I 2025-12-05 16:10:00,312] Trial 25 finished with value: 0.07291520903139531 and parameters: {'model_type': 'mlp', 'hidden_dims': '[512, 256]', 'dropout': 0.4737161463743071, 'batch_norm': True, 'lr': 0.00031870456137544803, 'weight_decay': 0.0008835998501523608, 'epochs': 299, 'loss': 'mae', 'optimizer': 'adam', 'graph_mode': 'off', 'use_snp_selection': False}. Best is trial 14 with value: 0.09480159113044817.
[I 2025-12-05 16:10:01,551] Trial 26 finished with value: 0.07536616453599984 and parameters: {'model_type': 'mlp', 'hidden_dims': '[256, 128]', 'dropout': 0.5341611803869735, 'batch_norm': True, 'lr': 0.00021146580847362367, 'weight_decay': 0.00015265805543382736, 'epochs': 345, 'loss': 'mae', 'optimizer': 'adam', 'graph_mode': 'off', 'use_snp_selection': True, 'num_snps': 3842}. Best is trial 14 with value: 0.09480159113044817.
[I 2025-12-05 16:10:02,825] Trial 27 finished with value: 0.07201419000814395 and parameters: {'model_type': 'mlp', 'hidden_dims': '[256, 128, 64]', 'dropout': 0.4315322019606014, 'batch_norm': True, 'lr': 2.8134339556558464e-05, 'weight_decay': 3.1040335553503977e-05, 'epochs': 213, 'loss': 'mse', 'optimizer': 'adam', 'graph_mode': 'off', 'use_snp_selection': False}. Best is trial 14 with value: 0.09480159113044817.
[I 2025-12-05 16:10:03,800] Trial 28 finished with value: 0.07264710963628357 and parameters: {'model_type': 'mlp', 'hidden_dims': '[128, 64]', 'dropout': 0.3679800372466332, 'batch_norm': True, 'lr': 0.0004276177028889052, 'weight_decay': 1.3325541635287555e-05, 'epochs': 258, 'loss': 'mae', 'optimizer': 'adam', 'graph_mode': 'off', 'use_snp_selection': False}. Best is trial 14 with value: 0.09480159113044817.
[I 2025-12-05 16:10:05,507] Trial 29 finished with value: 0.0606114278701844 and parameters: {'model_type': 'mlp', 'hidden_dims': '[128, 64]', 'dropout': 0.195060435693097, 'batch_norm': True, 'lr': 9.339472369199104e-05, 'weight_decay': 7.110403822353937e-05, 'epochs': 334, 'loss': 'mae', 'optimizer': 'adam', 'graph_mode': 'off', 'use_snp_selection': True, 'num_snps': 19468}. Best is trial 14 with value: 0.09480159113044817.
[I 2025-12-05 16:10:08,036] Trial 30 finished with value: 0.018091710184829825 and parameters: {'model_type': 'mlp', 'hidden_dims': '[512, 128]', 'dropout': 0.5660583514020362, 'batch_norm': True, 'lr': 8.668888692922407e-06, 'weight_decay': 0.0005215493514697012, 'epochs': 295, 'loss': 'mae', 'optimizer': 'adam', 'graph_mode': 'off', 'use_snp_selection': False}. Best is trial 14 with value: 0.09480159113044817.
[I 2025-12-05 16:10:10,199] Trial 31 finished with value: 0.0836086768166264 and parameters: {'model_type': 'mlp', 'hidden_dims': '[512, 128]', 'dropout': 0.3116648036264129, 'batch_norm': True, 'lr': 0.0001554789529084045, 'weight_decay': 2.8125812252233713e-05, 'epochs': 237, 'loss': 'mae', 'optimizer': 'adam', 'graph_mode': 'off', 'use_snp_selection': False}. Best is trial 14 with value: 0.09480159113044817.
[I 2025-12-05 16:10:12,469] Trial 32 finished with value: 0.07062300804021186 and parameters: {'model_type': 'mlp', 'hidden_dims': '[512, 128]', 'dropout': 0.20726513962755527, 'batch_norm': True, 'lr': 4.02605705817297e-05, 'weight_decay': 1.736316204396136e-05, 'epochs': 257, 'loss': 'mae', 'optimizer': 'adam', 'graph_mode': 'off', 'use_snp_selection': False}. Best is trial 14 with value: 0.09480159113044817.
[I 2025-12-05 16:10:14,591] Trial 33 finished with value: 0.0674382794189104 and parameters: {'model_type': 'mlp', 'hidden_dims': '[512, 128]', 'dropout': 0.45661907565155424, 'batch_norm': True, 'lr': 0.00011087929563457912, 'weight_decay': 6.3635268729497164e-06, 'epochs': 227, 'loss': 'mae', 'optimizer': 'adam', 'graph_mode': 'off', 'use_snp_selection': False}. Best is trial 14 with value: 0.09480159113044817.
[I 2025-12-05 16:10:16,179] Trial 34 finished with value: 0.07205870813795984 and parameters: {'model_type': 'mlp', 'hidden_dims': '[256, 128]', 'dropout': 0.34432613083548413, 'batch_norm': True, 'lr': 0.00018215365237129991, 'weight_decay': 0.00016807200094475346, 'epochs': 317, 'loss': 'mae', 'optimizer': 'adam', 'graph_mode': 'off', 'use_snp_selection': False}. Best is trial 14 with value: 0.09480159113044817.
[I 2025-12-05 16:10:18,638] Trial 35 finished with value: 0.06536045486129329 and parameters: {'model_type': 'mlp', 'hidden_dims': '[512, 128]', 'dropout': 0.4035215835351506, 'batch_norm': True, 'lr': 8.372924357829527e-05, 'weight_decay': 6.288960672317628e-05, 'epochs': 289, 'loss': 'mae', 'optimizer': 'adam', 'graph_mode': 'off', 'use_snp_selection': False}. Best is trial 14 with value: 0.09480159113044817.
[I 2025-12-05 16:10:22,432] Trial 36 finished with value: 0.07431743882733026 and parameters: {'model_type': 'mlp', 'hidden_dims': '[512, 64]', 'dropout': 0.10223964551782355, 'batch_norm': True, 'lr': 0.0003053896510736462, 'weight_decay': 1.0687295154404784e-05, 'epochs': 265, 'loss': 'mse', 'optimizer': 'adam', 'graph_mode': 'off', 'use_snp_selection': True, 'num_snps': 58661}. Best is trial 14 with value: 0.09480159113044817.
[I 2025-12-05 16:10:23,695] Trial 37 finished with value: 0.08734629165882753 and parameters: {'model_type': 'mlp', 'hidden_dims': '[256, 128, 64]', 'dropout': 0.4176622426243223, 'batch_norm': True, 'lr': 0.0004994452184512124, 'weight_decay': 2.457184714830766e-05, 'epochs': 177, 'loss': 'mae', 'optimizer': 'adam', 'graph_mode': 'off', 'use_snp_selection': False}. Best is trial 14 with value: 0.09480159113044817.
[I 2025-12-05 16:10:25,219] Trial 38 finished with value: 0.037427409113000326 and parameters: {'model_type': 'mlp', 'hidden_dims': '[256, 128, 64]', 'dropout': 0.5176293310064373, 'batch_norm': False, 'lr': 0.000946385057019074, 'weight_decay': 3.7046132794282227e-06, 'epochs': 163, 'loss': 'mse', 'optimizer': 'adam', 'graph_mode': 'off', 'use_snp_selection': True, 'num_snps': 19911}. Best is trial 14 with value: 0.09480159113044817.
[I 2025-12-05 16:10:26,291] Trial 39 finished with value: 0.09628022092225558 and parameters: {'model_type': 'mlp', 'hidden_dims': '[256, 128, 64]', 'dropout': 0.4246116819735686, 'batch_norm': True, 'lr': 0.0005550572457316109, 'weight_decay': 0.00037763785949489166, 'epochs': 139, 'loss': 'mae', 'optimizer': 'adam', 'graph_mode': 'off', 'use_snp_selection': False}. Best is trial 39 with value: 0.09628022092225558.
[I 2025-12-05 16:10:27,300] Trial 40 finished with value: 0.08256718935376833 and parameters: {'model_type': 'mlp', 'hidden_dims': '[256, 128, 64]', 'dropout': 0.4372518006451054, 'batch_norm': True, 'lr': 0.0005355631332513197, 'weight_decay': 0.0004692484919226046, 'epochs': 125, 'loss': 'mae', 'optimizer': 'adam', 'graph_mode': 'off', 'use_snp_selection': False}. Best is trial 39 with value: 0.09628022092225558.
[I 2025-12-05 16:10:28,471] Trial 41 finished with value: 0.03525893564696549 and parameters: {'model_type': 'mlp', 'hidden_dims': '[256, 128, 64]', 'dropout': 0.41093125020629806, 'batch_norm': True, 'lr': 2.320370617557869e-06, 'weight_decay': 0.0002804464685448657, 'epochs': 185, 'loss': 'mae', 'optimizer': 'adam', 'graph_mode': 'off', 'use_snp_selection': False}. Best is trial 39 with value: 0.09628022092225558.
[I 2025-12-05 16:10:29,519] Trial 42 finished with value: 0.07421853389099975 and parameters: {'model_type': 'mlp', 'hidden_dims': '[256, 128, 64]', 'dropout': 0.4733082369382199, 'batch_norm': True, 'lr': 0.00044061112400354223, 'weight_decay': 4.1841171448567225e-05, 'epochs': 131, 'loss': 'mae', 'optimizer': 'adam', 'graph_mode': 'off', 'use_snp_selection': False}. Best is trial 39 with value: 0.09628022092225558.
[I 2025-12-05 16:10:30,650] Trial 43 finished with value: 0.0908660357550124 and parameters: {'model_type': 'mlp', 'hidden_dims': '[256, 128, 64]', 'dropout': 0.42033088503096816, 'batch_norm': True, 'lr': 0.0006578368745923834, 'weight_decay': 1.9733317666993004e-05, 'epochs': 152, 'loss': 'mae', 'optimizer': 'adam', 'graph_mode': 'off', 'use_snp_selection': False}. Best is trial 39 with value: 0.09628022092225558.
[I 2025-12-05 16:10:31,635] Trial 44 finished with value: 0.08059203266408595 and parameters: {'model_type': 'mlp', 'hidden_dims': '[256, 128, 64]', 'dropout': 0.3747762117911848, 'batch_norm': True, 'lr': 0.0006569542343897293, 'weight_decay': 0.00010040081007592979, 'epochs': 105, 'loss': 'mae', 'optimizer': 'adam', 'graph_mode': 'off', 'use_snp_selection': False}. Best is trial 39 with value: 0.09628022092225558.
[I 2025-12-05 16:10:32,734] Trial 45 finished with value: 0.08855797109197333 and parameters: {'model_type': 'mlp', 'hidden_dims': '[256, 128, 64]', 'dropout': 0.4416913110484575, 'batch_norm': False, 'lr': 0.0007398969865006984, 'weight_decay': 0.0005379344251618916, 'epochs': 157, 'loss': 'mse', 'optimizer': 'adam', 'graph_mode': 'off', 'use_snp_selection': False}. Best is trial 39 with value: 0.09628022092225558.
[I 2025-12-05 16:10:33,795] Trial 46 finished with value: 0.050020378285614876 and parameters: {'model_type': 'mlp', 'hidden_dims': '[256, 128, 64]', 'dropout': 0.48494102631517094, 'batch_norm': False, 'lr': 0.000963558835598496, 'weight_decay': 0.00047774818347137384, 'epochs': 154, 'loss': 'mse', 'optimizer': 'adam', 'graph_mode': 'off', 'use_snp_selection': False}. Best is trial 39 with value: 0.09628022092225558.
[I 2025-12-05 16:10:34,807] Trial 47 finished with value: 0.06393544446847835 and parameters: {'model_type': 'mlp', 'hidden_dims': '[256, 128, 64]', 'dropout': 0.45463683056445936, 'batch_norm': False, 'lr': 0.0007389646663483804, 'weight_decay': 0.00019645062277492888, 'epochs': 139, 'loss': 'mse', 'optimizer': 'adam', 'graph_mode': 'off', 'use_snp_selection': False}. Best is trial 39 with value: 0.09628022092225558.
[I 2025-12-05 16:10:36,235] Trial 48 finished with value: 0.0015382266964235614 and parameters: {'model_type': 'mlp', 'hidden_dims': '[512, 64]', 'dropout': 0.510957114133197, 'batch_norm': False, 'lr': 0.00034515239825795726, 'weight_decay': 0.00036257803249427047, 'epochs': 110, 'loss': 'mse', 'optimizer': 'adam', 'graph_mode': 'off', 'use_snp_selection': False}. Best is trial 39 with value: 0.09628022092225558.
[I 2025-12-05 16:10:38,730] Trial 49 finished with value: 0.08033919379233433 and parameters: {'model_type': 'mlp', 'hidden_dims': '[256, 128, 64]', 'dropout': 0.38643546038451543, 'batch_norm': False, 'lr': 0.0006423867916677473, 'weight_decay': 0.0007538201116783223, 'epochs': 206, 'loss': 'mse', 'optimizer': 'adam', 'graph_mode': 'off', 'use_snp_selection': True, 'num_snps': 46888}. Best is trial 39 with value: 0.09628022092225558.
[I 2025-12-05 16:10:39,990] Trial 50 finished with value: 0.09310071343213609 and parameters: {'model_type': 'mlp', 'hidden_dims': '[512, 256]', 'dropout': 0.43052719796799394, 'batch_norm': False, 'lr': 0.0002810274516319134, 'weight_decay': 9.881649189053995e-05, 'epochs': 88, 'loss': 'mse', 'optimizer': 'adam', 'graph_mode': 'off', 'use_snp_selection': False}. Best is trial 39 with value: 0.09628022092225558.
[I 2025-12-05 16:10:41,215] Trial 51 finished with value: 0.05640490122921322 and parameters: {'model_type': 'mlp', 'hidden_dims': '[512, 256]', 'dropout': 0.45304150125675263, 'batch_norm': False, 'lr': 0.0002566902446199141, 'weight_decay': 0.00010551937866207563, 'epochs': 83, 'loss': 'mse', 'optimizer': 'adam', 'graph_mode': 'off', 'use_snp_selection': False}. Best is trial 39 with value: 0.09628022092225558.
[I 2025-12-05 16:10:42,691] Trial 52 finished with value: 0.07307177193966127 and parameters: {'model_type': 'mlp', 'hidden_dims': '[512, 256]', 'dropout': 0.42608546775210615, 'batch_norm': False, 'lr': 0.0004301116520042154, 'weight_decay': 0.00015708254017785187, 'epochs': 117, 'loss': 'mse', 'optimizer': 'adam', 'graph_mode': 'off', 'use_snp_selection': False}. Best is trial 39 with value: 0.09628022092225558.
[I 2025-12-05 16:10:44,006] Trial 53 finished with value: 0.06726084027302365 and parameters: {'model_type': 'mlp', 'hidden_dims': '[512, 256]', 'dropout': 0.4796199201976906, 'batch_norm': False, 'lr': 0.00029376380587157856, 'weight_decay': 0.00032986822719650107, 'epochs': 91, 'loss': 'mse', 'optimizer': 'adam', 'graph_mode': 'off', 'use_snp_selection': False}. Best is trial 39 with value: 0.09628022092225558.
[I 2025-12-05 16:10:45,161] Trial 54 finished with value: 0.09419613032375371 and parameters: {'model_type': 'mlp', 'hidden_dims': '[512, 256]', 'dropout': 0.43743617279638136, 'batch_norm': False, 'lr': 0.00019414842761440932, 'weight_decay': 4.19897898497238e-05, 'epochs': 64, 'loss': 'mse', 'optimizer': 'adam', 'graph_mode': 'off', 'use_snp_selection': False}. Best is trial 39 with value: 0.09628022092225558.
[I 2025-12-05 16:10:46,346] Trial 55 finished with value: 0.0719113395112628 and parameters: {'model_type': 'mlp', 'hidden_dims': '[512, 256]', 'dropout': 0.401385025627125, 'batch_norm': False, 'lr': 0.0001977931723837099, 'weight_decay': 3.441057719425579e-05, 'epochs': 70, 'loss': 'mse', 'optimizer': 'adam', 'graph_mode': 'off', 'use_snp_selection': False}. Best is trial 39 with value: 0.09628022092225558.
[I 2025-12-05 16:10:47,409] Trial 56 finished with value: 0.02702272384177083 and parameters: {'model_type': 'mlp', 'hidden_dims': '[512, 256]', 'dropout': 0.526342501908057, 'batch_norm': False, 'lr': 0.00014401349844110205, 'weight_decay': 5.2149075874302634e-05, 'epochs': 55, 'loss': 'mse', 'optimizer': 'adam', 'graph_mode': 'off', 'use_snp_selection': False}. Best is trial 39 with value: 0.09628022092225558.
[I 2025-12-05 16:10:48,443] Trial 57 finished with value: 0.07196309747763727 and parameters: {'model_type': 'mlp', 'hidden_dims': '[512, 256]', 'dropout': 0.3599816178718449, 'batch_norm': False, 'lr': 6.73096191798135e-05, 'weight_decay': 6.615376303648419e-05, 'epochs': 42, 'loss': 'mse', 'optimizer': 'adam', 'graph_mode': 'off', 'use_snp_selection': False}. Best is trial 39 with value: 0.09628022092225558.
[I 2025-12-05 16:10:49,152] Trial 58 finished with value: 0.07876432288730989 and parameters: {'model_type': 'mlp', 'hidden_dims': '[128, 64]', 'dropout': 0.5053948349614856, 'batch_norm': False, 'lr': 4.713263094603128e-05, 'weight_decay': 0.00010011050784603092, 'epochs': 67, 'loss': 'mae', 'optimizer': 'adam', 'graph_mode': 'off', 'use_snp_selection': False}. Best is trial 39 with value: 0.09628022092225558.
