[I 2025-12-05 16:36:05,011] Trial 149 finished with value: 0.07368556113862171 and parameters: {'model_type': 'mlp', 'hidden_dims': '[512, 128]', 'dropout': 0.1287448370932227, 'batch_norm': True, 'lr': 0.00047742125530029827, 'weight_decay': 1.0811792763370348e-07, 'epochs': 304, 'loss': 'mae', 'optimizer': 'adam', 'graph_mode': 'off', 'use_snp_selection': False}. Best is trial 132 with value: 0.10842070088520533.
[I 2025-12-05 16:36:07,399] Trial 0 finished with value: 0.02573452403064893 and parameters: {'model_type': 'mlp', 'hidden_dims': '[128, 64]', 'dropout': 0.199031432379812, 'batch_norm': True, 'lr': 1.8408544111075837e-06, 'weight_decay': 5.5136510071208614e-05, 'epochs': 336, 'loss': 'mae', 'optimizer': 'adam', 'graph_mode': 'off', 'use_snp_selection': True, 'num_snps': 43862}. Best is trial 0 with value: 0.02573452403064893.
[I 2025-12-05 16:36:08,440] Trial 1 finished with value: 0.05735528037052489 and parameters: {'model_type': 'mlp', 'hidden_dims': '[256, 128]', 'dropout': 0.4370668075331726, 'batch_norm': True, 'lr': 7.133471581159139e-05, 'weight_decay': 1.128633586803549e-05, 'epochs': 242, 'loss': 'mae', 'optimizer': 'adam', 'graph_mode': 'off', 'use_snp_selection': False}. Best is trial 1 with value: 0.05735528037052489.
[I 2025-12-05 16:36:09,406] Trial 2 finished with value: -0.02421895166995764 and parameters: {'model_type': 'mlp', 'hidden_dims': '[256, 128, 64]', 'dropout': 0.41314357415569625, 'batch_norm': False, 'lr': 3.952233718592101e-06, 'weight_decay': 0.00026754769258252603, 'epochs': 149, 'loss': 'mse', 'optimizer': 'adam', 'graph_mode': 'off', 'use_snp_selection': True, 'num_snps': 11571}. Best is trial 1 with value: 0.05735528037052489.
[I 2025-12-05 16:36:11,058] Trial 3 finished with value: 0.03913052513237334 and parameters: {'model_type': 'mlp', 'hidden_dims': '[512, 64]', 'dropout': 0.5938127374509361, 'batch_norm': False, 'lr': 5.67704586114731e-06, 'weight_decay': 2.4518087630137052e-05, 'epochs': 320, 'loss': 'mae', 'optimizer': 'adam', 'graph_mode': 'off', 'use_snp_selection': False}. Best is trial 1 with value: 0.05735528037052489.
[I 2025-12-05 16:36:13,180] Trial 4 finished with value: -0.013150412380209368 and parameters: {'model_type': 'mlp', 'hidden_dims': '[512, 128]', 'dropout': 0.25746343592134413, 'batch_norm': True, 'lr': 1.3467657668402788e-06, 'weight_decay': 0.00033087251918647806, 'epochs': 277, 'loss': 'mse', 'optimizer': 'adam', 'graph_mode': 'off', 'use_snp_selection': True, 'num_snps': 36675}. Best is trial 1 with value: 0.05735528037052489.
[I 2025-12-05 16:36:14,929] Trial 5 finished with value: 0.04187960535727972 and parameters: {'model_type': 'mlp', 'hidden_dims': '[512, 64]', 'dropout': 0.38275350994408375, 'batch_norm': True, 'lr': 1.5586664309232824e-06, 'weight_decay': 0.0008227664668621182, 'epochs': 145, 'loss': 'mae', 'optimizer': 'adam', 'graph_mode': 'off', 'use_snp_selection': True, 'num_snps': 32148}. Best is trial 1 with value: 0.05735528037052489.
[I 2025-12-05 16:36:15,877] Trial 6 finished with value: 0.06236460947835863 and parameters: {'model_type': 'mlp', 'hidden_dims': '[256, 128]', 'dropout': 0.3930109900265879, 'batch_norm': False, 'lr': 4.892964372128395e-05, 'weight_decay': 1.5809549317992182e-06, 'epochs': 199, 'loss': 'mse', 'optimizer': 'adam', 'graph_mode': 'off', 'use_snp_selection': False}. Best is trial 6 with value: 0.06236460947835863.
[I 2025-12-05 16:36:16,911] Trial 7 finished with value: 0.061766981348628645 and parameters: {'model_type': 'mlp', 'hidden_dims': '[512, 256]', 'dropout': 0.15343979219678458, 'batch_norm': True, 'lr': 6.234003099047341e-05, 'weight_decay': 3.894760610535477e-07, 'epochs': 97, 'loss': 'mse', 'optimizer': 'adam', 'graph_mode': 'off', 'use_snp_selection': False}. Best is trial 6 with value: 0.06236460947835863.
[I 2025-12-05 16:36:18,566] Trial 8 finished with value: 0.07736702974852278 and parameters: {'model_type': 'mlp', 'hidden_dims': '[512, 128]', 'dropout': 0.10743001231661406, 'batch_norm': True, 'lr': 0.00023728538449271062, 'weight_decay': 1.7629071578048637e-05, 'epochs': 312, 'loss': 'mae', 'optimizer': 'adam', 'graph_mode': 'off', 'use_snp_selection': False}. Best is trial 8 with value: 0.07736702974852278.
[I 2025-12-05 16:36:19,788] Trial 9 finished with value: 0.08586667854670875 and parameters: {'model_type': 'mlp', 'hidden_dims': '[512, 64]', 'dropout': 0.14505336736221927, 'batch_norm': True, 'lr': 5.8619638388111826e-05, 'weight_decay': 6.200156172669308e-07, 'epochs': 175, 'loss': 'mse', 'optimizer': 'adam', 'graph_mode': 'off', 'use_snp_selection': False}. Best is trial 9 with value: 0.08586667854670875.
[I 2025-12-05 16:36:20,642] Trial 10 finished with value: -0.017485457729210042 and parameters: {'model_type': 'mlp', 'hidden_dims': '[512, 64]', 'dropout': 0.27531666245262887, 'batch_norm': False, 'lr': 0.00032393778075602147, 'weight_decay': 1.1714031539166647e-07, 'epochs': 44, 'loss': 'mse', 'optimizer': 'adam', 'graph_mode': 'off', 'use_snp_selection': False}. Best is trial 9 with value: 0.08586667854670875.
[I 2025-12-05 16:36:22,032] Trial 11 finished with value: 0.08168147188691714 and parameters: {'model_type': 'mlp', 'hidden_dims': '[512, 128]', 'dropout': 0.10095648685224448, 'batch_norm': True, 'lr': 0.0007381466848241802, 'weight_decay': 1.969664044175748e-06, 'epochs': 216, 'loss': 'mae', 'optimizer': 'adam', 'graph_mode': 'off', 'use_snp_selection': False}. Best is trial 9 with value: 0.08586667854670875.
[I 2025-12-05 16:36:23,415] Trial 12 finished with value: 0.0875012835686444 and parameters: {'model_type': 'mlp', 'hidden_dims': '[512, 128]', 'dropout': 0.10344600881777158, 'batch_norm': True, 'lr': 0.0006753264773209732, 'weight_decay': 2.0975627484345868e-06, 'epochs': 208, 'loss': 'mae', 'optimizer': 'adam', 'graph_mode': 'off', 'use_snp_selection': False}. Best is trial 12 with value: 0.0875012835686444.
[I 2025-12-05 16:36:24,254] Trial 13 finished with value: 0.03142882962832695 and parameters: {'model_type': 'mlp', 'hidden_dims': '[128, 64]', 'dropout': 0.21612815944527586, 'batch_norm': True, 'lr': 1.3373175420781734e-05, 'weight_decay': 2.1978369390547452e-06, 'epochs': 157, 'loss': 'mse', 'optimizer': 'adam', 'graph_mode': 'off', 'use_snp_selection': False}. Best is trial 12 with value: 0.0875012835686444.
[I 2025-12-05 16:36:25,380] Trial 14 finished with value: 0.0557448511287077 and parameters: {'model_type': 'mlp', 'hidden_dims': '[256, 128, 64]', 'dropout': 0.3012984444538551, 'batch_norm': True, 'lr': 0.00017558188744418174, 'weight_decay': 5.850950730213006e-07, 'epochs': 254, 'loss': 'mse', 'optimizer': 'adam', 'graph_mode': 'off', 'use_snp_selection': False}. Best is trial 12 with value: 0.0875012835686444.
[I 2025-12-05 16:36:26,672] Trial 15 finished with value: 0.0728782596971213 and parameters: {'model_type': 'mlp', 'hidden_dims': '[512, 256]', 'dropout': 0.1723492905468449, 'batch_norm': True, 'lr': 0.0006324642596480108, 'weight_decay': 4.647398975110266e-06, 'epochs': 175, 'loss': 'mae', 'optimizer': 'adam', 'graph_mode': 'off', 'use_snp_selection': False}. Best is trial 12 with value: 0.0875012835686444.
[I 2025-12-05 16:36:27,764] Trial 16 finished with value: -0.013595441806898983 and parameters: {'model_type': 'mlp', 'hidden_dims': '[512, 128]', 'dropout': 0.558513902174278, 'batch_norm': True, 'lr': 2.1517090787442848e-05, 'weight_decay': 1.0661008213867922e-07, 'epochs': 109, 'loss': 'mae', 'optimizer': 'adam', 'graph_mode': 'off', 'use_snp_selection': False}. Best is trial 12 with value: 0.0875012835686444.
[I 2025-12-05 16:36:29,171] Trial 17 finished with value: 0.08098981988446546 and parameters: {'model_type': 'mlp', 'hidden_dims': '[512, 64]', 'dropout': 0.32888830259108426, 'batch_norm': True, 'lr': 0.00011245215271835875, 'weight_decay': 4.4639962184346194e-07, 'epochs': 223, 'loss': 'mse', 'optimizer': 'adam', 'graph_mode': 'off', 'use_snp_selection': False}. Best is trial 12 with value: 0.0875012835686444.
[I 2025-12-05 16:36:32,091] Trial 18 finished with value: 0.029625570311757696 and parameters: {'model_type': 'mlp', 'hidden_dims': '[512, 128]', 'dropout': 0.5053317114683149, 'batch_norm': False, 'lr': 0.000979498413216184, 'weight_decay': 5.399175074092964e-06, 'epochs': 282, 'loss': 'mae', 'optimizer': 'adam', 'graph_mode': 'off', 'use_snp_selection': True, 'num_snps': 58241}. Best is trial 12 with value: 0.0875012835686444.
[I 2025-12-05 16:36:33,143] Trial 19 finished with value: 0.057699768190663324 and parameters: {'model_type': 'mlp', 'hidden_dims': '[512, 64]', 'dropout': 0.14601246093479409, 'batch_norm': True, 'lr': 1.352570837276448e-05, 'weight_decay': 9.224522637322544e-07, 'epochs': 112, 'loss': 'mse', 'optimizer': 'adam', 'graph_mode': 'off', 'use_snp_selection': False}. Best is trial 12 with value: 0.0875012835686444.
[I 2025-12-05 16:36:33,956] Trial 20 finished with value: 0.07460240636552418 and parameters: {'model_type': 'mlp', 'hidden_dims': '[128, 64]', 'dropout': 0.22713525795094816, 'batch_norm': True, 'lr': 0.00038182963044335776, 'weight_decay': 1.9828202531875164e-07, 'epochs': 187, 'loss': 'mse', 'optimizer': 'adam', 'graph_mode': 'off', 'use_snp_selection': False}. Best is trial 12 with value: 0.0875012835686444.
[I 2025-12-05 16:36:35,343] Trial 21 finished with value: 0.05334437328153373 and parameters: {'model_type': 'mlp', 'hidden_dims': '[512, 128]', 'dropout': 0.10124091625799034, 'batch_norm': True, 'lr': 0.0006266426202927439, 'weight_decay': 2.7102426450438144e-06, 'epochs': 212, 'loss': 'mae', 'optimizer': 'adam', 'graph_mode': 'off', 'use_snp_selection': False}. Best is trial 12 with value: 0.0875012835686444.
[I 2025-12-05 16:36:36,798] Trial 22 finished with value: 0.07183516271438083 and parameters: {'model_type': 'mlp', 'hidden_dims': '[512, 128]', 'dropout': 0.13096596943730135, 'batch_norm': True, 'lr': 0.00014625246732138274, 'weight_decay': 1.1065191859010336e-06, 'epochs': 235, 'loss': 'mae', 'optimizer': 'adam', 'graph_mode': 'off', 'use_snp_selection': False}. Best is trial 12 with value: 0.0875012835686444.
[I 2025-12-05 16:36:38,075] Trial 23 finished with value: 0.09258339313754083 and parameters: {'model_type': 'mlp', 'hidden_dims': '[512, 128]', 'dropout': 0.1816004657177207, 'batch_norm': True, 'lr': 0.0009173434759538043, 'weight_decay': 4.934373325409827e-06, 'epochs': 178, 'loss': 'mae', 'optimizer': 'adam', 'graph_mode': 'off', 'use_snp_selection': False}. Best is trial 23 with value: 0.09258339313754083.
[I 2025-12-05 16:36:39,343] Trial 24 finished with value: 0.0764520072249612 and parameters: {'model_type': 'mlp', 'hidden_dims': '[512, 128]', 'dropout': 0.17227445917333037, 'batch_norm': True, 'lr': 0.00034314418376488724, 'weight_decay': 6.150201994093408e-06, 'epochs': 169, 'loss': 'mae', 'optimizer': 'adam', 'graph_mode': 'off', 'use_snp_selection': False}. Best is trial 23 with value: 0.09258339313754083.
[I 2025-12-05 16:36:40,514] Trial 25 finished with value: 0.015954372648802825 and parameters: {'model_type': 'mlp', 'hidden_dims': '[512, 256]', 'dropout': 0.1924853955416102, 'batch_norm': True, 'lr': 2.6900694868715888e-05, 'weight_decay': 4.173847065108397e-05, 'epochs': 132, 'loss': 'mae', 'optimizer': 'adam', 'graph_mode': 'off', 'use_snp_selection': False}. Best is trial 23 with value: 0.09258339313754083.
[I 2025-12-05 16:36:41,199] Trial 26 finished with value: 0.04158828870668648 and parameters: {'model_type': 'mlp', 'hidden_dims': '[256, 128]', 'dropout': 0.2577925061423039, 'batch_norm': True, 'lr': 0.00011084678243603999, 'weight_decay': 3.253094810152716e-07, 'epochs': 73, 'loss': 'mae', 'optimizer': 'adam', 'graph_mode': 'off', 'use_snp_selection': True, 'num_snps': 3842}. Best is trial 23 with value: 0.09258339313754083.
[I 2025-12-05 16:36:42,159] Trial 27 finished with value: 0.07238358022799786 and parameters: {'model_type': 'mlp', 'hidden_dims': '[256, 128, 64]', 'dropout': 0.23251914941224716, 'batch_norm': False, 'lr': 0.000389234960860307, 'weight_decay': 8.136990509227875e-07, 'epochs': 192, 'loss': 'mae', 'optimizer': 'adam', 'graph_mode': 'off', 'use_snp_selection': False}. Best is trial 23 with value: 0.09258339313754083.
[I 2025-12-05 16:36:43,673] Trial 28 finished with value: 0.08609317108740189 and parameters: {'model_type': 'mlp', 'hidden_dims': '[512, 64]', 'dropout': 0.13498724060077172, 'batch_norm': True, 'lr': 0.000984909058509182, 'weight_decay': 3.778334576527838e-06, 'epochs': 262, 'loss': 'mse', 'optimizer': 'adam', 'graph_mode': 'off', 'use_snp_selection': False}. Best is trial 23 with value: 0.09258339313754083.
[I 2025-12-05 16:36:45,042] Trial 29 finished with value: 0.09086915393073859 and parameters: {'model_type': 'mlp', 'hidden_dims': '[128, 64]', 'dropout': 0.19748024291351302, 'batch_norm': True, 'lr': 0.0008798076000130954, 'weight_decay': 7.556740997596572e-05, 'epochs': 264, 'loss': 'mae', 'optimizer': 'adam', 'graph_mode': 'off', 'use_snp_selection': True, 'num_snps': 19468}. Best is trial 23 with value: 0.09258339313754083.
[I 2025-12-05 16:36:46,434] Trial 30 finished with value: 0.08054664043128647 and parameters: {'model_type': 'mlp', 'hidden_dims': '[128, 64]', 'dropout': 0.1972284555936633, 'batch_norm': True, 'lr': 0.0004309067297889135, 'weight_decay': 9.754004440528344e-05, 'epochs': 284, 'loss': 'mae', 'optimizer': 'adam', 'graph_mode': 'off', 'use_snp_selection': True, 'num_snps': 18365}. Best is trial 23 with value: 0.09258339313754083.
[I 2025-12-05 16:36:47,904] Trial 31 finished with value: 0.08633799447112984 and parameters: {'model_type': 'mlp', 'hidden_dims': '[128, 64]', 'dropout': 0.1916936283070984, 'batch_norm': True, 'lr': 0.0009179380268035871, 'weight_decay': 1.0185518131310568e-05, 'epochs': 258, 'loss': 'mae', 'optimizer': 'adam', 'graph_mode': 'off', 'use_snp_selection': True, 'num_snps': 20689}. Best is trial 23 with value: 0.09258339313754083.
[I 2025-12-05 16:36:49,422] Trial 32 finished with value: 0.08044101320639513 and parameters: {'model_type': 'mlp', 'hidden_dims': '[128, 64]', 'dropout': 0.18605737853139984, 'batch_norm': True, 'lr': 0.0005837954664036436, 'weight_decay': 1.4009698324895506e-05, 'epochs': 349, 'loss': 'mae', 'optimizer': 'adam', 'graph_mode': 'off', 'use_snp_selection': True, 'num_snps': 19001}. Best is trial 23 with value: 0.09258339313754083.
[I 2025-12-05 16:36:50,859] Trial 33 finished with value: 0.09495280931084094 and parameters: {'model_type': 'mlp', 'hidden_dims': '[128, 64]', 'dropout': 0.30205961853068064, 'batch_norm': True, 'lr': 0.00022878929373070365, 'weight_decay': 6.535221719074814e-05, 'epochs': 241, 'loss': 'mae', 'optimizer': 'adam', 'graph_mode': 'off', 'use_snp_selection': True, 'num_snps': 22388}. Best is trial 33 with value: 0.09495280931084094.
[I 2025-12-05 16:36:52,408] Trial 34 finished with value: 0.08685784091205935 and parameters: {'model_type': 'mlp', 'hidden_dims': '[128, 64]', 'dropout': 0.34349496646904476, 'batch_norm': True, 'lr': 0.000218559410980386, 'weight_decay': 0.0001319717728224751, 'epochs': 238, 'loss': 'mae', 'optimizer': 'adam', 'graph_mode': 'off', 'use_snp_selection': True, 'num_snps': 26347}. Best is trial 33 with value: 0.09495280931084094.
[I 2025-12-05 16:36:53,400] Trial 35 finished with value: 0.07984946306890839 and parameters: {'model_type': 'mlp', 'hidden_dims': '[128, 64]', 'dropout': 0.45738746371910954, 'batch_norm': False, 'lr': 0.0005166842023009964, 'weight_decay': 3.874869672892432e-05, 'epochs': 295, 'loss': 'mae', 'optimizer': 'adam', 'graph_mode': 'off', 'use_snp_selection': True, 'num_snps': 8577}. Best is trial 33 with value: 0.09495280931084094.
[I 2025-12-05 16:36:55,215] Trial 36 finished with value: 0.09460476769889463 and parameters: {'model_type': 'mlp', 'hidden_dims': '[128, 64]', 'dropout': 0.30694336611734363, 'batch_norm': True, 'lr': 0.0002726005540882103, 'weight_decay': 8.11873315363511e-05, 'epochs': 205, 'loss': 'mae', 'optimizer': 'adam', 'graph_mode': 'off', 'use_snp_selection': True, 'num_snps': 38703}. Best is trial 33 with value: 0.09495280931084094.
[I 2025-12-05 16:36:57,496] Trial 37 finished with value: 0.09068662166519086 and parameters: {'model_type': 'mlp', 'hidden_dims': '[128, 64]', 'dropout': 0.2960758377861159, 'batch_norm': True, 'lr': 9.395961079778121e-05, 'weight_decay': 8.722022420943208e-05, 'epochs': 307, 'loss': 'mae', 'optimizer': 'adam', 'graph_mode': 'off', 'use_snp_selection': True, 'num_snps': 42726}. Best is trial 33 with value: 0.09495280931084094.
[I 2025-12-05 16:36:59,153] Trial 38 finished with value: 0.04242439748882608 and parameters: {'model_type': 'mlp', 'hidden_dims': '[128, 64]', 'dropout': 0.37744382993999204, 'batch_norm': False, 'lr': 3.224003144856851e-06, 'weight_decay': 0.0003426351922233466, 'epochs': 227, 'loss': 'mae', 'optimizer': 'adam', 'graph_mode': 'off', 'use_snp_selection': True, 'num_snps': 27839}. Best is trial 33 with value: 0.09495280931084094.
[I 2025-12-05 16:37:01,180] Trial 39 finished with value: 0.08821299993397469 and parameters: {'model_type': 'mlp', 'hidden_dims': '[128, 64]', 'dropout': 0.3013455178047433, 'batch_norm': True, 'lr': 0.0002513362062977805, 'weight_decay': 0.00018114081750513178, 'epochs': 243, 'loss': 'mae', 'optimizer': 'adam', 'graph_mode': 'off', 'use_snp_selection': True, 'num_snps': 38427}. Best is trial 33 with value: 0.09495280931084094.
[I 2025-12-05 16:37:03,336] Trial 40 finished with value: 0.006106532851292989 and parameters: {'model_type': 'mlp', 'hidden_dims': '[256, 128]', 'dropout': 0.4194137202657779, 'batch_norm': True, 'lr': 4.0916501438357524e-05, 'weight_decay': 0.0005774751930762951, 'epochs': 134, 'loss': 'mae', 'optimizer': 'adam', 'graph_mode': 'off', 'use_snp_selection': True, 'num_snps': 49994}. Best is trial 33 with value: 0.09495280931084094.
[I 2025-12-05 16:37:05,543] Trial 41 finished with value: 0.06423783567835899 and parameters: {'model_type': 'mlp', 'hidden_dims': '[128, 64]', 'dropout': 0.2779533421886583, 'batch_norm': True, 'lr': 7.78191931414658e-05, 'weight_decay': 6.486137878148551e-05, 'epochs': 303, 'loss': 'mae', 'optimizer': 'adam', 'graph_mode': 'off', 'use_snp_selection': True, 'num_snps': 47065}. Best is trial 33 with value: 0.09495280931084094.
[I 2025-12-05 16:37:07,530] Trial 42 finished with value: 0.05876408868884934 and parameters: {'model_type': 'mlp', 'hidden_dims': '[128, 64]', 'dropout': 0.3151657253078794, 'batch_norm': True, 'lr': 9.056387776772426e-05, 'weight_decay': 2.4768397665557412e-05, 'epochs': 319, 'loss': 'mae', 'optimizer': 'adam', 'graph_mode': 'off', 'use_snp_selection': True, 'num_snps': 39245}. Best is trial 33 with value: 0.09495280931084094.
[I 2025-12-05 16:37:09,059] Trial 43 finished with value: 0.063487087684434 and parameters: {'model_type': 'mlp', 'hidden_dims': '[128, 64]', 'dropout': 0.3598484233886391, 'batch_norm': True, 'lr': 0.0001611058394336868, 'weight_decay': 7.360346096382941e-05, 'epochs': 277, 'loss': 'mae', 'optimizer': 'adam', 'graph_mode': 'off', 'use_snp_selection': True, 'num_snps': 23962}. Best is trial 33 with value: 0.09495280931084094.
[I 2025-12-05 16:37:11,088] Trial 44 finished with value: 0.06575470840813528 and parameters: {'model_type': 'mlp', 'hidden_dims': '[128, 64]', 'dropout': 0.24957766105045598, 'batch_norm': True, 'lr': 0.0002573406870786634, 'weight_decay': 0.0001921228948569777, 'epochs': 331, 'loss': 'mae', 'optimizer': 'adam', 'graph_mode': 'off', 'use_snp_selection': True, 'num_snps': 33420}. Best is trial 33 with value: 0.09495280931084094.
[I 2025-12-05 16:37:13,382] Trial 45 finished with value: 0.08184246909104391 and parameters: {'model_type': 'mlp', 'hidden_dims': '[128, 64]', 'dropout': 0.28199153771234853, 'batch_norm': True, 'lr': 0.0002800858657605284, 'weight_decay': 2.8517211226841222e-05, 'epochs': 269, 'loss': 'mae', 'optimizer': 'adam', 'graph_mode': 'off', 'use_snp_selection': True, 'num_snps': 42930}. Best is trial 33 with value: 0.09495280931084094.
[I 2025-12-05 16:37:14,681] Trial 46 finished with value: 0.05610994914116721 and parameters: {'model_type': 'mlp', 'hidden_dims': '[256, 128, 64]', 'dropout': 0.3556387761558247, 'batch_norm': True, 'lr': 0.00047349262014977685, 'weight_decay': 0.00010831191488252706, 'epochs': 201, 'loss': 'mae', 'optimizer': 'adam', 'graph_mode': 'off', 'use_snp_selection': True, 'num_snps': 14955}. Best is trial 33 with value: 0.09495280931084094.
[I 2025-12-05 16:37:17,014] Trial 47 finished with value: 0.07818018060461279 and parameters: {'model_type': 'mlp', 'hidden_dims': '[128, 64]', 'dropout': 0.2485728052015887, 'batch_norm': False, 'lr': 0.00018573266058111957, 'weight_decay': 4.545853522920288e-05, 'epochs': 301, 'loss': 'mae', 'optimizer': 'adam', 'graph_mode': 'off', 'use_snp_selection': True, 'num_snps': 50720}. Best is trial 33 with value: 0.09495280931084094.
[I 2025-12-05 16:37:18,740] Trial 48 finished with value: 0.032090318345954605 and parameters: {'model_type': 'mlp', 'hidden_dims': '[512, 256]', 'dropout': 0.2178671280000172, 'batch_norm': True, 'lr': 5.9146187736823726e-05, 'weight_decay': 1.684213406527645e-05, 'epochs': 246, 'loss': 'mae', 'optimizer': 'adam', 'graph_mode': 'off', 'use_snp_selection': True, 'num_snps': 30889}. Best is trial 33 with value: 0.09495280931084094.
[I 2025-12-05 16:37:20,018] Trial 49 finished with value: 0.0571245611646713 and parameters: {'model_type': 'mlp', 'hidden_dims': '[256, 128]', 'dropout': 0.3287993431475715, 'batch_norm': True, 'lr': 0.00010571259286442024, 'weight_decay': 0.0004359283256572386, 'epochs': 163, 'loss': 'mae', 'optimizer': 'adam', 'graph_mode': 'off', 'use_snp_selection': True, 'num_snps': 22173}. Best is trial 33 with value: 0.09495280931084094.
