[I 2025-12-05 15:04:52,797] Trial 142 finished with value: 0.028734735065680805 and parameters: {'model_type': 'mlp', 'hidden_dims': '[128, 64]', 'dropout': 0.11212955976837743, 'batch_norm': False, 'lr': 5.6024652191920794e-05, 'weight_decay': 1.9311645285566892e-07, 'epochs': 174, 'loss': 'mse', 'optimizer': 'adam', 'graph_mode': 'off', 'use_snp_selection': False}. Best is trial 34 with value: 0.08422594760083942.
[I 2025-12-05 15:04:53,617] Trial 143 finished with value: 0.037005347941459155 and parameters: {'model_type': 'mlp', 'hidden_dims': '[128, 64]', 'dropout': 0.14468404478578212, 'batch_norm': False, 'lr': 8.088620066753364e-05, 'weight_decay': 1.6862260850240144e-07, 'epochs': 202, 'loss': 'mse', 'optimizer': 'adam', 'graph_mode': 'off', 'use_snp_selection': False}. Best is trial 34 with value: 0.08422594760083942.
[I 2025-12-05 15:04:55,148] Trial 144 finished with value: 0.018890362204807568 and parameters: {'model_type': 'mlp', 'hidden_dims': '[128, 64]', 'dropout': 0.31288922461775653, 'batch_norm': False, 'lr': 0.00012402830231358162, 'weight_decay': 1.452773235701586e-07, 'epochs': 165, 'loss': 'mse', 'optimizer': 'adam', 'graph_mode': 'off', 'use_snp_selection': True, 'num_snps': 29727}. Best is trial 34 with value: 0.08422594760083942.
[I 2025-12-05 15:04:56,260] Trial 145 finished with value: 0.039959804179415095 and parameters: {'model_type': 'mlp', 'hidden_dims': '[256, 128]', 'dropout': 0.12696841090555003, 'batch_norm': False, 'lr': 5.099923281382091e-05, 'weight_decay': 3.0123871306326156e-07, 'epochs': 181, 'loss': 'mse', 'optimizer': 'adam', 'graph_mode': 'off', 'use_snp_selection': False}. Best is trial 34 with value: 0.08422594760083942.
[I 2025-12-05 15:04:57,143] Trial 146 finished with value: 0.04992943867090016 and parameters: {'model_type': 'mlp', 'hidden_dims': '[128, 64]', 'dropout': 0.16095933183364586, 'batch_norm': False, 'lr': 9.617833614333444e-05, 'weight_decay': 1.5413479204595682e-05, 'epochs': 255, 'loss': 'mse', 'optimizer': 'adam', 'graph_mode': 'off', 'use_snp_selection': False}. Best is trial 34 with value: 0.08422594760083942.
[I 2025-12-05 15:04:58,053] Trial 147 finished with value: 0.03916405426847565 and parameters: {'model_type': 'mlp', 'hidden_dims': '[128, 64]', 'dropout': 0.13763753184052388, 'batch_norm': True, 'lr': 7.19436916119308e-05, 'weight_decay': 2.0989956986998835e-07, 'epochs': 233, 'loss': 'mse', 'optimizer': 'adam', 'graph_mode': 'off', 'use_snp_selection': False}. Best is trial 34 with value: 0.08422594760083942.
[I 2025-12-05 15:04:58,890] Trial 148 finished with value: -0.016630353538093886 and parameters: {'model_type': 'mlp', 'hidden_dims': '[128, 64]', 'dropout': 0.27948857512836034, 'batch_norm': False, 'lr': 1.4176969928712874e-06, 'weight_decay': 5.944513524298058e-07, 'epochs': 217, 'loss': 'mse', 'optimizer': 'adam', 'graph_mode': 'off', 'use_snp_selection': False}. Best is trial 34 with value: 0.08422594760083942.
[I 2025-12-05 15:05:00,234] Trial 149 finished with value: 0.04743861676194606 and parameters: {'model_type': 'mlp', 'hidden_dims': '[512, 256]', 'dropout': 0.2512408596330085, 'batch_norm': False, 'lr': 4.07947245490495e-05, 'weight_decay': 4.934537595273626e-07, 'epochs': 143, 'loss': 'mse', 'optimizer': 'adam', 'graph_mode': 'off', 'use_snp_selection': False}. Best is trial 34 with value: 0.08422594760083942.
[I 2025-12-05 15:05:11,567] Trial 0 finished with value: 0.060712734896453596 and parameters: {'model_type': 'mlp', 'hidden_dims': '[128, 64]', 'dropout': 0.199031432379812, 'batch_norm': True, 'lr': 1.8408544111075837e-06, 'weight_decay': 5.5136510071208614e-05, 'epochs': 336, 'loss': 'mae', 'optimizer': 'adam', 'graph_mode': 'off', 'use_snp_selection': True, 'num_snps': 43862}. Best is trial 0 with value: 0.060712734896453596.
[I 2025-12-05 15:05:12,708] Trial 1 finished with value: 0.017777846840468348 and parameters: {'model_type': 'mlp', 'hidden_dims': '[256, 128]', 'dropout': 0.4370668075331726, 'batch_norm': True, 'lr': 7.133471581159139e-05, 'weight_decay': 1.128633586803549e-05, 'epochs': 242, 'loss': 'mae', 'optimizer': 'adam', 'graph_mode': 'off', 'use_snp_selection': False}. Best is trial 0 with value: 0.060712734896453596.
[I 2025-12-05 15:05:13,678] Trial 2 finished with value: 0.025149944924934997 and parameters: {'model_type': 'mlp', 'hidden_dims': '[256, 128, 64]', 'dropout': 0.41314357415569625, 'batch_norm': False, 'lr': 3.952233718592101e-06, 'weight_decay': 0.00026754769258252603, 'epochs': 149, 'loss': 'mse', 'optimizer': 'adam', 'graph_mode': 'off', 'use_snp_selection': True, 'num_snps': 11571}. Best is trial 0 with value: 0.060712734896453596.
[I 2025-12-05 15:05:15,523] Trial 3 finished with value: 0.04058868485439068 and parameters: {'model_type': 'mlp', 'hidden_dims': '[512, 64]', 'dropout': 0.5938127374509361, 'batch_norm': False, 'lr': 5.67704586114731e-06, 'weight_decay': 2.4518087630137052e-05, 'epochs': 320, 'loss': 'mae', 'optimizer': 'adam', 'graph_mode': 'off', 'use_snp_selection': False}. Best is trial 0 with value: 0.060712734896453596.
[I 2025-12-05 15:05:17,652] Trial 4 finished with value: -0.00485369107127367 and parameters: {'model_type': 'mlp', 'hidden_dims': '[512, 128]', 'dropout': 0.25746343592134413, 'batch_norm': True, 'lr': 1.3467657668402788e-06, 'weight_decay': 0.00033087251918647806, 'epochs': 277, 'loss': 'mse', 'optimizer': 'adam', 'graph_mode': 'off', 'use_snp_selection': True, 'num_snps': 36675}. Best is trial 0 with value: 0.060712734896453596.
[I 2025-12-05 15:05:19,346] Trial 5 finished with value: 0.02509165515809976 and parameters: {'model_type': 'mlp', 'hidden_dims': '[512, 64]', 'dropout': 0.38275350994408375, 'batch_norm': True, 'lr': 1.5586664309232824e-06, 'weight_decay': 0.0008227664668621182, 'epochs': 145, 'loss': 'mae', 'optimizer': 'adam', 'graph_mode': 'off', 'use_snp_selection': True, 'num_snps': 32148}. Best is trial 0 with value: 0.060712734896453596.
[I 2025-12-05 15:05:20,342] Trial 6 finished with value: 0.05820893543619891 and parameters: {'model_type': 'mlp', 'hidden_dims': '[256, 128]', 'dropout': 0.3930109900265879, 'batch_norm': False, 'lr': 4.892964372128395e-05, 'weight_decay': 1.5809549317992182e-06, 'epochs': 199, 'loss': 'mse', 'optimizer': 'adam', 'graph_mode': 'off', 'use_snp_selection': False}. Best is trial 0 with value: 0.060712734896453596.
[I 2025-12-05 15:05:21,413] Trial 7 finished with value: 0.0029628155019536806 and parameters: {'model_type': 'mlp', 'hidden_dims': '[512, 256]', 'dropout': 0.15343979219678458, 'batch_norm': True, 'lr': 6.234003099047341e-05, 'weight_decay': 3.894760610535477e-07, 'epochs': 97, 'loss': 'mse', 'optimizer': 'adam', 'graph_mode': 'off', 'use_snp_selection': False}. Best is trial 0 with value: 0.060712734896453596.
[I 2025-12-05 15:05:23,274] Trial 8 finished with value: 0.013670450133862696 and parameters: {'model_type': 'mlp', 'hidden_dims': '[512, 128]', 'dropout': 0.10743001231661406, 'batch_norm': True, 'lr': 0.00023728538449271062, 'weight_decay': 1.7629071578048637e-05, 'epochs': 312, 'loss': 'mae', 'optimizer': 'adam', 'graph_mode': 'off', 'use_snp_selection': False}. Best is trial 0 with value: 0.060712734896453596.
[I 2025-12-05 15:05:24,615] Trial 9 finished with value: 0.028716356650862758 and parameters: {'model_type': 'mlp', 'hidden_dims': '[512, 64]', 'dropout': 0.14505336736221927, 'batch_norm': True, 'lr': 5.8619638388111826e-05, 'weight_decay': 6.200156172669308e-07, 'epochs': 175, 'loss': 'mse', 'optimizer': 'adam', 'graph_mode': 'off', 'use_snp_selection': False}. Best is trial 0 with value: 0.060712734896453596.
[I 2025-12-05 15:05:26,858] Trial 10 finished with value: 0.010657792817593466 and parameters: {'model_type': 'mlp', 'hidden_dims': '[128, 64]', 'dropout': 0.26042626041863687, 'batch_norm': False, 'lr': 1.080428984628536e-05, 'weight_decay': 0.00011308342650768637, 'epochs': 54, 'loss': 'mae', 'optimizer': 'adam', 'graph_mode': 'off', 'use_snp_selection': True, 'num_snps': 57847}. Best is trial 0 with value: 0.060712734896453596.
[I 2025-12-05 15:05:29,222] Trial 11 finished with value: 0.027434200952277374 and parameters: {'model_type': 'mlp', 'hidden_dims': '[128, 64]', 'dropout': 0.2837290841141706, 'batch_norm': False, 'lr': 0.0007612007694070342, 'weight_decay': 1.870902088619276e-06, 'epochs': 226, 'loss': 'mse', 'optimizer': 'adam', 'graph_mode': 'off', 'use_snp_selection': True, 'num_snps': 55155}. Best is trial 0 with value: 0.060712734896453596.
[I 2025-12-05 15:05:30,524] Trial 12 finished with value: 0.044349096981663234 and parameters: {'model_type': 'mlp', 'hidden_dims': '[256, 128]', 'dropout': 0.5040822261097736, 'batch_norm': False, 'lr': 1.8174345617074418e-05, 'weight_decay': 2.540289733915756e-06, 'epochs': 340, 'loss': 'mse', 'optimizer': 'adam', 'graph_mode': 'off', 'use_snp_selection': False}. Best is trial 0 with value: 0.060712734896453596.
[I 2025-12-05 15:05:31,614] Trial 13 finished with value: 0.03982761353890272 and parameters: {'model_type': 'mlp', 'hidden_dims': '[256, 128]', 'dropout': 0.3267387471174588, 'batch_norm': False, 'lr': 0.00020171219022334619, 'weight_decay': 5.786827611016974e-05, 'epochs': 265, 'loss': 'mae', 'optimizer': 'adam', 'graph_mode': 'off', 'use_snp_selection': True, 'num_snps': 10373}. Best is trial 0 with value: 0.060712734896453596.
[I 2025-12-05 15:05:32,459] Trial 14 finished with value: 0.046524842176031325 and parameters: {'model_type': 'mlp', 'hidden_dims': '[128, 64]', 'dropout': 0.20365033665203916, 'batch_norm': True, 'lr': 2.5920425278148356e-05, 'weight_decay': 2.9196532205641e-06, 'epochs': 191, 'loss': 'mae', 'optimizer': 'adam', 'graph_mode': 'off', 'use_snp_selection': False}. Best is trial 0 with value: 0.060712734896453596.
[I 2025-12-05 15:05:34,303] Trial 15 finished with value: -0.01930555157063209 and parameters: {'model_type': 'mlp', 'hidden_dims': '[256, 128, 64]', 'dropout': 0.48177467097578114, 'batch_norm': False, 'lr': 3.944259942380222e-06, 'weight_decay': 5.9845460759550004e-06, 'epochs': 89, 'loss': 'mse', 'optimizer': 'adam', 'graph_mode': 'off', 'use_snp_selection': True, 'num_snps': 41817}. Best is trial 0 with value: 0.060712734896453596.
[I 2025-12-05 15:05:36,048] Trial 16 finished with value: 0.006445451715424231 and parameters: {'model_type': 'mlp', 'hidden_dims': '[512, 256]', 'dropout': 0.33587209601766577, 'batch_norm': False, 'lr': 0.00016298882735125004, 'weight_decay': 1.4032658993109676e-07, 'epochs': 288, 'loss': 'mae', 'optimizer': 'adam', 'graph_mode': 'off', 'use_snp_selection': False}. Best is trial 0 with value: 0.060712734896453596.
[I 2025-12-05 15:05:38,181] Trial 17 finished with value: 0.019895743322791846 and parameters: {'model_type': 'mlp', 'hidden_dims': '[128, 64]', 'dropout': 0.22765755698213494, 'batch_norm': True, 'lr': 1.0882535063659564e-05, 'weight_decay': 3.9049357454211614e-05, 'epochs': 235, 'loss': 'mse', 'optimizer': 'adam', 'graph_mode': 'off', 'use_snp_selection': True, 'num_snps': 45694}. Best is trial 0 with value: 0.060712734896453596.
[I 2025-12-05 15:05:39,423] Trial 18 finished with value: 0.02437307613903873 and parameters: {'model_type': 'mlp', 'hidden_dims': '[256, 128]', 'dropout': 0.546895385299865, 'batch_norm': False, 'lr': 0.0005849877207204186, 'weight_decay': 8.967760054985205e-07, 'epochs': 125, 'loss': 'mae', 'optimizer': 'adam', 'graph_mode': 'off', 'use_snp_selection': True, 'num_snps': 20445}. Best is trial 0 with value: 0.060712734896453596.
[I 2025-12-05 15:05:40,733] Trial 19 finished with value: -0.024628077518686994 and parameters: {'model_type': 'mlp', 'hidden_dims': '[256, 128]', 'dropout': 0.36410939493084327, 'batch_norm': True, 'lr': 2.343388704248642e-06, 'weight_decay': 8.091817355816726e-06, 'epochs': 349, 'loss': 'mse', 'optimizer': 'adam', 'graph_mode': 'off', 'use_snp_selection': False}. Best is trial 0 with value: 0.060712734896453596.
[I 2025-12-05 15:05:41,615] Trial 20 finished with value: -0.022509847174504258 and parameters: {'model_type': 'mlp', 'hidden_dims': '[128, 64]', 'dropout': 0.3174386509019364, 'batch_norm': True, 'lr': 3.795563918744353e-05, 'weight_decay': 1.1030836033708912e-07, 'epochs': 213, 'loss': 'mse', 'optimizer': 'adam', 'graph_mode': 'off', 'use_snp_selection': False}. Best is trial 0 with value: 0.060712734896453596.
[I 2025-12-05 15:05:42,456] Trial 21 finished with value: 0.04544023574990214 and parameters: {'model_type': 'mlp', 'hidden_dims': '[128, 64]', 'dropout': 0.19074524441792948, 'batch_norm': True, 'lr': 2.2762681761080912e-05, 'weight_decay': 3.228175476866678e-06, 'epochs': 186, 'loss': 'mae', 'optimizer': 'adam', 'graph_mode': 'off', 'use_snp_selection': False}. Best is trial 0 with value: 0.060712734896453596.
[I 2025-12-05 15:05:43,338] Trial 22 finished with value: 0.01895857817862416 and parameters: {'model_type': 'mlp', 'hidden_dims': '[128, 64]', 'dropout': 0.20414110439525662, 'batch_norm': True, 'lr': 1.0319883268569415e-05, 'weight_decay': 1.2507343912322726e-06, 'epochs': 199, 'loss': 'mae', 'optimizer': 'adam', 'graph_mode': 'off', 'use_snp_selection': False}. Best is trial 0 with value: 0.060712734896453596.
[I 2025-12-05 15:05:44,149] Trial 23 finished with value: 0.025725672287409716 and parameters: {'model_type': 'mlp', 'hidden_dims': '[128, 64]', 'dropout': 0.16247785616879526, 'batch_norm': True, 'lr': 0.00010717940121080684, 'weight_decay': 4.456025969083041e-07, 'epochs': 166, 'loss': 'mae', 'optimizer': 'adam', 'graph_mode': 'off', 'use_snp_selection': False}. Best is trial 0 with value: 0.060712734896453596.
[I 2025-12-05 15:05:45,108] Trial 24 finished with value: 0.005462250098241627 and parameters: {'model_type': 'mlp', 'hidden_dims': '[128, 64]', 'dropout': 0.44459788838581227, 'batch_norm': True, 'lr': 0.0003567100716099584, 'weight_decay': 4.601761158101547e-06, 'epochs': 252, 'loss': 'mae', 'optimizer': 'adam', 'graph_mode': 'off', 'use_snp_selection': False}. Best is trial 0 with value: 0.060712734896453596.
[I 2025-12-05 15:05:45,959] Trial 25 finished with value: 0.013366083723794529 and parameters: {'model_type': 'mlp', 'hidden_dims': '[256, 128, 64]', 'dropout': 0.11225126660548033, 'batch_norm': True, 'lr': 3.8837439488269115e-05, 'weight_decay': 9.867052499640516e-05, 'epochs': 114, 'loss': 'mae', 'optimizer': 'adam', 'graph_mode': 'off', 'use_snp_selection': False}. Best is trial 0 with value: 0.060712734896453596.
[I 2025-12-05 15:05:47,234] Trial 26 finished with value: 0.035788373306265685 and parameters: {'model_type': 'mlp', 'hidden_dims': '[512, 256]', 'dropout': 0.28554627379108033, 'batch_norm': False, 'lr': 2.1784256751744818e-05, 'weight_decay': 2.1293152791398986e-07, 'epochs': 50, 'loss': 'mae', 'optimizer': 'adam', 'graph_mode': 'off', 'use_snp_selection': True, 'num_snps': 23425}. Best is trial 0 with value: 0.060712734896453596.
[I 2025-12-05 15:05:48,771] Trial 27 finished with value: 0.009623386753870342 and parameters: {'model_type': 'mlp', 'hidden_dims': '[512, 128]', 'dropout': 0.2151078111721278, 'batch_norm': True, 'lr': 0.0001036648143569766, 'weight_decay': 1.5079570724765953e-06, 'epochs': 209, 'loss': 'mae', 'optimizer': 'adam', 'graph_mode': 'off', 'use_snp_selection': False}. Best is trial 0 with value: 0.060712734896453596.
[I 2025-12-05 15:05:51,089] Trial 28 finished with value: 0.040758205152998384 and parameters: {'model_type': 'mlp', 'hidden_dims': '[256, 128]', 'dropout': 0.3890486996402944, 'batch_norm': False, 'lr': 2.5978776669477454e-06, 'weight_decay': 1.2600516676194765e-05, 'epochs': 301, 'loss': 'mse', 'optimizer': 'adam', 'graph_mode': 'off', 'use_snp_selection': True, 'num_snps': 48356}. Best is trial 0 with value: 0.060712734896453596.
[I 2025-12-05 15:05:52,236] Trial 29 finished with value: -0.0023317231969610724 and parameters: {'model_type': 'mlp', 'hidden_dims': '[256, 128]', 'dropout': 0.4470070771290425, 'batch_norm': True, 'lr': 6.1049506282730614e-06, 'weight_decay': 8.738076922127046e-06, 'epochs': 255, 'loss': 'mae', 'optimizer': 'adam', 'graph_mode': 'off', 'use_snp_selection': False}. Best is trial 0 with value: 0.060712734896453596.
[I 2025-12-05 15:05:53,044] Trial 30 finished with value: 0.02909429264354727 and parameters: {'model_type': 'mlp', 'hidden_dims': '[128, 64]', 'dropout': 0.24663076477295015, 'batch_norm': True, 'lr': 9.916089961764666e-05, 'weight_decay': 2.606488820246715e-05, 'epochs': 156, 'loss': 'mae', 'optimizer': 'adam', 'graph_mode': 'off', 'use_snp_selection': False}. Best is trial 0 with value: 0.060712734896453596.
[I 2025-12-05 15:05:53,896] Trial 31 finished with value: 0.0137985250526242 and parameters: {'model_type': 'mlp', 'hidden_dims': '[128, 64]', 'dropout': 0.18192235178035326, 'batch_norm': True, 'lr': 2.0960105201024896e-05, 'weight_decay': 3.019150241978045e-06, 'epochs': 192, 'loss': 'mae', 'optimizer': 'adam', 'graph_mode': 'off', 'use_snp_selection': False}. Best is trial 0 with value: 0.060712734896453596.
[I 2025-12-05 15:05:54,773] Trial 32 finished with value: 0.01592019463994952 and parameters: {'model_type': 'mlp', 'hidden_dims': '[128, 64]', 'dropout': 0.1839767228298621, 'batch_norm': True, 'lr': 3.090283022275511e-05, 'weight_decay': 3.034425902508657e-06, 'epochs': 193, 'loss': 'mae', 'optimizer': 'adam', 'graph_mode': 'off', 'use_snp_selection': False}. Best is trial 0 with value: 0.060712734896453596.
[I 2025-12-05 15:05:55,605] Trial 33 finished with value: 0.007957849390768388 and parameters: {'model_type': 'mlp', 'hidden_dims': '[128, 64]', 'dropout': 0.2906617142768349, 'batch_norm': True, 'lr': 1.040857102001064e-06, 'weight_decay': 4.404164521994682e-06, 'epochs': 174, 'loss': 'mae', 'optimizer': 'adam', 'graph_mode': 'off', 'use_snp_selection': False}. Best is trial 0 with value: 0.060712734896453596.
[I 2025-12-05 15:05:56,562] Trial 34 finished with value: 0.029824687321589487 and parameters: {'model_type': 'mlp', 'hidden_dims': '[256, 128, 64]', 'dropout': 0.1316992114018778, 'batch_norm': True, 'lr': 6.762746678990301e-06, 'weight_decay': 9.525297200977452e-07, 'epochs': 143, 'loss': 'mae', 'optimizer': 'adam', 'graph_mode': 'off', 'use_snp_selection': False}. Best is trial 0 with value: 0.060712734896453596.
[I 2025-12-05 15:05:57,482] Trial 35 finished with value: 0.02365062555799645 and parameters: {'model_type': 'mlp', 'hidden_dims': '[128, 64]', 'dropout': 0.4037606338269905, 'batch_norm': True, 'lr': 1.554499671120712e-05, 'weight_decay': 0.0002007164914124834, 'epochs': 224, 'loss': 'mae', 'optimizer': 'adam', 'graph_mode': 'off', 'use_snp_selection': False}. Best is trial 0 with value: 0.060712734896453596.
[I 2025-12-05 15:05:58,194] Trial 36 finished with value: 0.02302659415390582 and parameters: {'model_type': 'mlp', 'hidden_dims': '[512, 64]', 'dropout': 0.18558516999548005, 'batch_norm': False, 'lr': 4.8029020780424436e-05, 'weight_decay': 0.0006410314954536251, 'epochs': 132, 'loss': 'mse', 'optimizer': 'adam', 'graph_mode': 'off', 'use_snp_selection': True, 'num_snps': 3546}. Best is trial 0 with value: 0.060712734896453596.
[I 2025-12-05 15:06:00,105] Trial 37 finished with value: 0.04333692289252388 and parameters: {'model_type': 'mlp', 'hidden_dims': '[512, 128]', 'dropout': 0.2423217305561959, 'batch_norm': True, 'lr': 3.1039298700589706e-05, 'weight_decay': 1.386699998677418e-05, 'epochs': 329, 'loss': 'mae', 'optimizer': 'adam', 'graph_mode': 'off', 'use_snp_selection': False}. Best is trial 0 with value: 0.060712734896453596.
[I 2025-12-05 15:06:01,822] Trial 38 finished with value: 0.023797876865706502 and parameters: {'model_type': 'mlp', 'hidden_dims': '[128, 64]', 'dropout': 0.3582983994934269, 'batch_norm': True, 'lr': 6.804035527269423e-05, 'weight_decay': 2.963505046380221e-07, 'epochs': 278, 'loss': 'mse', 'optimizer': 'adam', 'graph_mode': 'off', 'use_snp_selection': True, 'num_snps': 29011}. Best is trial 0 with value: 0.060712734896453596.
[I 2025-12-05 15:06:03,213] Trial 39 finished with value: 0.01606338204691841 and parameters: {'model_type': 'mlp', 'hidden_dims': '[512, 64]', 'dropout': 0.13393066893465577, 'batch_norm': False, 'lr': 3.0655160363039945e-06, 'weight_decay': 2.2609747512202944e-05, 'epochs': 182, 'loss': 'mae', 'optimizer': 'adam', 'graph_mode': 'off', 'use_snp_selection': False}. Best is trial 0 with value: 0.060712734896453596.
[I 2025-12-05 15:06:04,245] Trial 40 finished with value: 0.021463313475586013 and parameters: {'model_type': 'mlp', 'hidden_dims': '[512, 256]', 'dropout': 0.3067156464389227, 'batch_norm': True, 'lr': 1.958018737383098e-06, 'weight_decay': 2.0483993877081434e-06, 'epochs': 82, 'loss': 'mae', 'optimizer': 'adam', 'graph_mode': 'off', 'use_snp_selection': False}. Best is trial 0 with value: 0.060712734896453596.
[I 2025-12-05 15:06:05,519] Trial 41 finished with value: -0.00022950139362115727 and parameters: {'model_type': 'mlp', 'hidden_dims': '[256, 128]', 'dropout': 0.522114808829168, 'batch_norm': False, 'lr': 1.8601983397963535e-05, 'weight_decay': 2.6910803308156325e-06, 'epochs': 338, 'loss': 'mse', 'optimizer': 'adam', 'graph_mode': 'off', 'use_snp_selection': False}. Best is trial 0 with value: 0.060712734896453596.
[I 2025-12-05 15:06:06,721] Trial 42 finished with value: 0.01907840655170663 and parameters: {'model_type': 'mlp', 'hidden_dims': '[256, 128]', 'dropout': 0.5770371870667529, 'batch_norm': False, 'lr': 1.4145871585067671e-05, 'weight_decay': 6.820179700853157e-07, 'epochs': 311, 'loss': 'mse', 'optimizer': 'adam', 'graph_mode': 'off', 'use_snp_selection': False}. Best is trial 0 with value: 0.060712734896453596.
[I 2025-12-05 15:06:08,016] Trial 43 finished with value: 0.0033599853028618903 and parameters: {'model_type': 'mlp', 'hidden_dims': '[256, 128]', 'dropout': 0.495779704601946, 'batch_norm': False, 'lr': 2.86516991631654e-05, 'weight_decay': 4.677084125152134e-06, 'epochs': 348, 'loss': 'mse', 'optimizer': 'adam', 'graph_mode': 'off', 'use_snp_selection': False}. Best is trial 0 with value: 0.060712734896453596.
