Running from this directory: /cluster/work/simennes/Project_thesis/Project_thesis
Name of job: mlp_w_within
ID of job: 23690637
The job was run on these nodes: idun-07-08
[I 2025-12-05 14:53:15,226] Trial 0 finished with value: 0.2650728515719797 and parameters: {'model_type': 'mlp', 'hidden_dims': '[128, 64]', 'dropout': 0.199031432379812, 'batch_norm': True, 'lr': 1.8408544111075837e-06, 'weight_decay': 5.5136510071208614e-05, 'epochs': 336, 'loss': 'mae', 'optimizer': 'adam', 'graph_mode': 'off', 'use_snp_selection': True, 'num_snps': 43862}. Best is trial 0 with value: 0.2650728515719797.
[I 2025-12-05 14:53:41,904] Trial 1 finished with value: 0.30487621858099034 and parameters: {'model_type': 'mlp', 'hidden_dims': '[256, 128]', 'dropout': 0.4370668075331726, 'batch_norm': True, 'lr': 7.133471581159139e-05, 'weight_decay': 1.128633586803549e-05, 'epochs': 242, 'loss': 'mae', 'optimizer': 'adam', 'graph_mode': 'off', 'use_snp_selection': False}. Best is trial 1 with value: 0.30487621858099034.
[I 2025-12-05 14:54:08,603] Trial 2 finished with value: 0.26756265151153863 and parameters: {'model_type': 'mlp', 'hidden_dims': '[256, 128, 64]', 'dropout': 0.41314357415569625, 'batch_norm': False, 'lr': 3.952233718592101e-06, 'weight_decay': 0.00026754769258252603, 'epochs': 149, 'loss': 'mse', 'optimizer': 'adam', 'graph_mode': 'off', 'use_snp_selection': True, 'num_snps': 11571}. Best is trial 1 with value: 0.30487621858099034.
[I 2025-12-05 14:55:09,274] Trial 3 finished with value: 0.31054302663025074 and parameters: {'model_type': 'mlp', 'hidden_dims': '[512, 64]', 'dropout': 0.5938127374509361, 'batch_norm': False, 'lr': 5.67704586114731e-06, 'weight_decay': 2.4518087630137052e-05, 'epochs': 320, 'loss': 'mae', 'optimizer': 'adam', 'graph_mode': 'off', 'use_snp_selection': False}. Best is trial 3 with value: 0.31054302663025074.
[I 2025-12-05 14:56:09,982] Trial 4 finished with value: 0.26160486128178756 and parameters: {'model_type': 'mlp', 'hidden_dims': '[512, 128]', 'dropout': 0.25746343592134413, 'batch_norm': True, 'lr': 1.3467657668402788e-06, 'weight_decay': 0.00033087251918647806, 'epochs': 277, 'loss': 'mse', 'optimizer': 'adam', 'graph_mode': 'off', 'use_snp_selection': True, 'num_snps': 36675}. Best is trial 3 with value: 0.31054302663025074.
[I 2025-12-05 14:56:53,122] Trial 5 finished with value: 0.25957027994619486 and parameters: {'model_type': 'mlp', 'hidden_dims': '[512, 64]', 'dropout': 0.38275350994408375, 'batch_norm': True, 'lr': 1.5586664309232824e-06, 'weight_decay': 0.0008227664668621182, 'epochs': 145, 'loss': 'mae', 'optimizer': 'adam', 'graph_mode': 'off', 'use_snp_selection': True, 'num_snps': 32148}. Best is trial 3 with value: 0.31054302663025074.
[I 2025-12-05 14:57:15,818] Trial 6 finished with value: 0.3002145878163093 and parameters: {'model_type': 'mlp', 'hidden_dims': '[256, 128]', 'dropout': 0.3930109900265879, 'batch_norm': False, 'lr': 4.892964372128395e-05, 'weight_decay': 1.5809549317992182e-06, 'epochs': 199, 'loss': 'mse', 'optimizer': 'adam', 'graph_mode': 'off', 'use_snp_selection': False}. Best is trial 3 with value: 0.31054302663025074.
[I 2025-12-05 14:57:38,059] Trial 7 finished with value: 0.3043382332337329 and parameters: {'model_type': 'mlp', 'hidden_dims': '[512, 256]', 'dropout': 0.15343979219678458, 'batch_norm': True, 'lr': 6.234003099047341e-05, 'weight_decay': 3.894760610535477e-07, 'epochs': 97, 'loss': 'mse', 'optimizer': 'adam', 'graph_mode': 'off', 'use_snp_selection': False}. Best is trial 3 with value: 0.31054302663025074.
[I 2025-12-05 14:58:37,913] Trial 8 finished with value: 0.30434934309914213 and parameters: {'model_type': 'mlp', 'hidden_dims': '[512, 128]', 'dropout': 0.10743001231661406, 'batch_norm': True, 'lr': 0.00023728538449271062, 'weight_decay': 1.7629071578048637e-05, 'epochs': 312, 'loss': 'mae', 'optimizer': 'adam', 'graph_mode': 'off', 'use_snp_selection': False}. Best is trial 3 with value: 0.31054302663025074.
[I 2025-12-05 14:59:13,713] Trial 9 finished with value: 0.3041155795029405 and parameters: {'model_type': 'mlp', 'hidden_dims': '[512, 64]', 'dropout': 0.14505336736221927, 'batch_norm': True, 'lr': 5.8619638388111826e-05, 'weight_decay': 6.200156172669308e-07, 'epochs': 175, 'loss': 'mse', 'optimizer': 'adam', 'graph_mode': 'off', 'use_snp_selection': False}. Best is trial 3 with value: 0.31054302663025074.
[I 2025-12-05 14:59:28,478] Trial 10 finished with value: 0.2764527187192905 and parameters: {'model_type': 'mlp', 'hidden_dims': '[512, 64]', 'dropout': 0.5885461262002587, 'batch_norm': False, 'lr': 8.769366258768696e-06, 'weight_decay': 2.78273193871783e-06, 'epochs': 55, 'loss': 'mae', 'optimizer': 'adam', 'graph_mode': 'off', 'use_snp_selection': False}. Best is trial 3 with value: 0.31054302663025074.
[I 2025-12-05 14:59:55,083] Trial 11 finished with value: 0.30743066980113987 and parameters: {'model_type': 'mlp', 'hidden_dims': '[256, 128]', 'dropout': 0.5874224943486895, 'batch_norm': False, 'lr': 1.579181036140435e-05, 'weight_decay': 2.2706826306130984e-05, 'epochs': 243, 'loss': 'mae', 'optimizer': 'adam', 'graph_mode': 'off', 'use_snp_selection': False}. Best is trial 3 with value: 0.31054302663025074.
[I 2025-12-05 15:00:21,866] Trial 12 finished with value: 0.3075305834797205 and parameters: {'model_type': 'mlp', 'hidden_dims': '[256, 128]', 'dropout': 0.593097749012682, 'batch_norm': False, 'lr': 1.237037822532362e-05, 'weight_decay': 5.805294946475999e-05, 'epochs': 245, 'loss': 'mae', 'optimizer': 'adam', 'graph_mode': 'off', 'use_snp_selection': False}. Best is trial 3 with value: 0.31054302663025074.
[I 2025-12-05 15:00:40,922] Trial 13 finished with value: 0.30398727737410614 and parameters: {'model_type': 'mlp', 'hidden_dims': '[128, 64]', 'dropout': 0.5043641748401543, 'batch_norm': False, 'lr': 8.558964707493568e-06, 'weight_decay': 8.916840184157698e-05, 'epochs': 285, 'loss': 'mae', 'optimizer': 'adam', 'graph_mode': 'off', 'use_snp_selection': False}. Best is trial 3 with value: 0.31054302663025074.
[I 2025-12-05 15:01:46,207] Trial 14 finished with value: 0.22205571515489592 and parameters: {'model_type': 'mlp', 'hidden_dims': '[512, 256]', 'dropout': 0.5300180653494536, 'batch_norm': False, 'lr': 0.0005290576304499545, 'weight_decay': 1.1414924884997386e-07, 'epochs': 346, 'loss': 'mae', 'optimizer': 'adam', 'graph_mode': 'off', 'use_snp_selection': False}. Best is trial 3 with value: 0.31054302663025074.
[I 2025-12-05 15:02:11,811] Trial 15 finished with value: 0.30042591506875915 and parameters: {'model_type': 'mlp', 'hidden_dims': '[256, 128, 64]', 'dropout': 0.29817671914947536, 'batch_norm': False, 'lr': 1.8411764708572348e-05, 'weight_decay': 4.61164678661027e-06, 'epochs': 231, 'loss': 'mae', 'optimizer': 'adam', 'graph_mode': 'off', 'use_snp_selection': False}. Best is trial 3 with value: 0.31054302663025074.
[I 2025-12-05 15:02:43,878] Trial 16 finished with value: 0.30725372775198034 and parameters: {'model_type': 'mlp', 'hidden_dims': '[256, 128]', 'dropout': 0.4985027776477374, 'batch_norm': False, 'lr': 6.013316929814413e-06, 'weight_decay': 0.00010917846190718121, 'epochs': 303, 'loss': 'mae', 'optimizer': 'adam', 'graph_mode': 'off', 'use_snp_selection': False}. Best is trial 3 with value: 0.31054302663025074.
[I 2025-12-05 15:03:33,039] Trial 17 finished with value: 0.3061682025129363 and parameters: {'model_type': 'mlp', 'hidden_dims': '[512, 64]', 'dropout': 0.46956397995943144, 'batch_norm': False, 'lr': 3.378196935792496e-06, 'weight_decay': 4.110698177929946e-05, 'epochs': 253, 'loss': 'mae', 'optimizer': 'adam', 'graph_mode': 'off', 'use_snp_selection': False}. Best is trial 3 with value: 0.31054302663025074.
[I 2025-12-05 15:04:26,230] Trial 18 finished with value: 0.3090804544529318 and parameters: {'model_type': 'mlp', 'hidden_dims': '[256, 128]', 'dropout': 0.5468831937008775, 'batch_norm': False, 'lr': 1.8654109488775334e-05, 'weight_decay': 6.927999924594858e-06, 'epochs': 196, 'loss': 'mae', 'optimizer': 'adam', 'graph_mode': 'off', 'use_snp_selection': True, 'num_snps': 58241}. Best is trial 3 with value: 0.31054302663025074.
[I 2025-12-05 15:05:21,551] Trial 19 finished with value: 0.2967616723165783 and parameters: {'model_type': 'mlp', 'hidden_dims': '[512, 64]', 'dropout': 0.5441884957330794, 'batch_norm': False, 'lr': 0.00015983041030594416, 'weight_decay': 6.219443740138099e-06, 'epochs': 119, 'loss': 'mae', 'optimizer': 'adam', 'graph_mode': 'off', 'use_snp_selection': True, 'num_snps': 55667}. Best is trial 3 with value: 0.31054302663025074.
[I 2025-12-05 15:06:31,658] Trial 20 finished with value: 0.30590032213855595 and parameters: {'model_type': 'mlp', 'hidden_dims': '[512, 256]', 'dropout': 0.31780992369872374, 'batch_norm': False, 'lr': 2.3720931888712826e-05, 'weight_decay': 1.292869911986818e-06, 'epochs': 204, 'loss': 'mae', 'optimizer': 'adam', 'graph_mode': 'off', 'use_snp_selection': True, 'num_snps': 57703}. Best is trial 3 with value: 0.31054302663025074.
[I 2025-12-05 15:06:59,435] Trial 21 finished with value: 0.2956890959836772 and parameters: {'model_type': 'mlp', 'hidden_dims': '[256, 128]', 'dropout': 0.5695584562908814, 'batch_norm': False, 'lr': 1.3908136915636131e-05, 'weight_decay': 2.808037636623656e-05, 'epochs': 209, 'loss': 'mae', 'optimizer': 'adam', 'graph_mode': 'off', 'use_snp_selection': True, 'num_snps': 11878}. Best is trial 3 with value: 0.31054302663025074.
[I 2025-12-05 15:07:35,201] Trial 22 finished with value: 0.2928793901308785 and parameters: {'model_type': 'mlp', 'hidden_dims': '[256, 128]', 'dropout': 0.4606876289530824, 'batch_norm': False, 'lr': 3.429607124467236e-06, 'weight_decay': 9.782405024389535e-06, 'epochs': 270, 'loss': 'mae', 'optimizer': 'adam', 'graph_mode': 'off', 'use_snp_selection': True, 'num_snps': 22259}. Best is trial 3 with value: 0.31054302663025074.
[I 2025-12-05 15:08:20,879] Trial 23 finished with value: 0.30668527059040784 and parameters: {'model_type': 'mlp', 'hidden_dims': '[256, 128]', 'dropout': 0.5457724774320233, 'batch_norm': False, 'lr': 2.738534126101666e-05, 'weight_decay': 0.00016423519809277608, 'epochs': 175, 'loss': 'mae', 'optimizer': 'adam', 'graph_mode': 'off', 'use_snp_selection': True, 'num_snps': 46925}. Best is trial 3 with value: 0.31054302663025074.
[I 2025-12-05 15:08:53,913] Trial 24 finished with value: 0.3105955745929186 and parameters: {'model_type': 'mlp', 'hidden_dims': '[256, 128]', 'dropout': 0.5998080494797379, 'batch_norm': False, 'lr': 9.696494485786598e-06, 'weight_decay': 4.363448990355076e-05, 'epochs': 314, 'loss': 'mae', 'optimizer': 'adam', 'graph_mode': 'off', 'use_snp_selection': False}. Best is trial 24 with value: 0.3105955745929186.
[I 2025-12-05 15:09:27,648] Trial 25 finished with value: 0.29839038739234236 and parameters: {'model_type': 'mlp', 'hidden_dims': '[256, 128, 64]', 'dropout': 0.4954040765144709, 'batch_norm': False, 'lr': 6.2247472121347134e-06, 'weight_decay': 9.569296187893369e-06, 'epochs': 320, 'loss': 'mae', 'optimizer': 'adam', 'graph_mode': 'off', 'use_snp_selection': False}. Best is trial 24 with value: 0.3105955745929186.
[I 2025-12-05 15:09:50,469] Trial 26 finished with value: 0.1705519861613815 and parameters: {'model_type': 'mlp', 'hidden_dims': '[128, 64]', 'dropout': 0.5448620979544911, 'batch_norm': False, 'lr': 2.5937693374368463e-06, 'weight_decay': 3.2006738616178805e-06, 'epochs': 292, 'loss': 'mse', 'optimizer': 'adam', 'graph_mode': 'off', 'use_snp_selection': True, 'num_snps': 2344}. Best is trial 24 with value: 0.3105955745929186.
[I 2025-12-05 15:10:51,508] Trial 27 finished with value: 0.3036269408527207 and parameters: {'model_type': 'mlp', 'hidden_dims': '[512, 128]', 'dropout': 0.5990675158768749, 'batch_norm': False, 'lr': 4.168144990919302e-05, 'weight_decay': 1.874805555465386e-05, 'epochs': 322, 'loss': 'mae', 'optimizer': 'adam', 'graph_mode': 'off', 'use_snp_selection': False}. Best is trial 24 with value: 0.3105955745929186.
[I 2025-12-05 15:12:13,168] Trial 28 finished with value: 0.31187273236613056 and parameters: {'model_type': 'mlp', 'hidden_dims': '[512, 64]', 'dropout': 0.5224833421901343, 'batch_norm': False, 'lr': 7.669448189706311e-06, 'weight_decay': 3.988061195661038e-05, 'epochs': 344, 'loss': 'mae', 'optimizer': 'adam', 'graph_mode': 'off', 'use_snp_selection': True, 'num_snps': 48700}. Best is trial 28 with value: 0.31187273236613056.
[I 2025-12-05 15:13:31,825] Trial 29 finished with value: 0.31158206711160175 and parameters: {'model_type': 'mlp', 'hidden_dims': '[512, 64]', 'dropout': 0.23090703697841608, 'batch_norm': False, 'lr': 4.819471063163574e-06, 'weight_decay': 6.13770654147157e-05, 'epochs': 348, 'loss': 'mae', 'optimizer': 'adam', 'graph_mode': 'off', 'use_snp_selection': True, 'num_snps': 46019}. Best is trial 28 with value: 0.31187273236613056.
[I 2025-12-05 15:14:50,406] Trial 30 finished with value: 0.3104090677655245 and parameters: {'model_type': 'mlp', 'hidden_dims': '[512, 64]', 'dropout': 0.23010681885037992, 'batch_norm': False, 'lr': 2.255807898308003e-06, 'weight_decay': 6.403892977106263e-05, 'epochs': 339, 'loss': 'mae', 'optimizer': 'adam', 'graph_mode': 'off', 'use_snp_selection': True, 'num_snps': 46956}. Best is trial 28 with value: 0.31187273236613056.
[I 2025-12-05 15:16:00,536] Trial 31 finished with value: 0.30891208357105854 and parameters: {'model_type': 'mlp', 'hidden_dims': '[512, 64]', 'dropout': 0.32898378528996663, 'batch_norm': False, 'lr': 6.804159701360347e-06, 'weight_decay': 3.9714908429837233e-05, 'epochs': 350, 'loss': 'mae', 'optimizer': 'adam', 'graph_mode': 'off', 'use_snp_selection': True, 'num_snps': 39545}. Best is trial 28 with value: 0.31187273236613056.
[I 2025-12-05 15:17:21,827] Trial 32 finished with value: 0.3129934650752792 and parameters: {'model_type': 'mlp', 'hidden_dims': '[512, 64]', 'dropout': 0.26874974291015846, 'batch_norm': False, 'lr': 5.319377520655094e-06, 'weight_decay': 0.00016860089703091204, 'epochs': 325, 'loss': 'mae', 'optimizer': 'adam', 'graph_mode': 'off', 'use_snp_selection': True, 'num_snps': 50791}. Best is trial 32 with value: 0.3129934650752792.
[I 2025-12-05 15:18:44,305] Trial 33 finished with value: 0.30805224215424165 and parameters: {'model_type': 'mlp', 'hidden_dims': '[512, 64]', 'dropout': 0.27870569144012713, 'batch_norm': False, 'lr': 1.025527168492423e-05, 'weight_decay': 0.0005096944491665476, 'epochs': 332, 'loss': 'mae', 'optimizer': 'adam', 'graph_mode': 'off', 'use_snp_selection': True, 'num_snps': 50951}. Best is trial 32 with value: 0.3129934650752792.
[I 2025-12-05 15:20:01,033] Trial 34 finished with value: 0.3109726536312335 and parameters: {'model_type': 'mlp', 'hidden_dims': '[512, 64]', 'dropout': 0.20612225138814355, 'batch_norm': False, 'lr': 4.176959069801895e-06, 'weight_decay': 0.0001686035934181346, 'epochs': 294, 'loss': 'mae', 'optimizer': 'adam', 'graph_mode': 'off', 'use_snp_selection': True, 'num_snps': 50205}. Best is trial 32 with value: 0.3129934650752792.
[I 2025-12-05 15:21:19,435] Trial 35 finished with value: 0.3062789785472141 and parameters: {'model_type': 'mlp', 'hidden_dims': '[512, 64]', 'dropout': 0.20424997411697732, 'batch_norm': True, 'lr': 4.497297969321305e-06, 'weight_decay': 0.00016957711356570927, 'epochs': 300, 'loss': 'mae', 'optimizer': 'adam', 'graph_mode': 'off', 'use_snp_selection': True, 'num_snps': 50948}. Best is trial 32 with value: 0.3129934650752792.
[I 2025-12-05 15:22:24,134] Trial 36 finished with value: 0.29998536958724153 and parameters: {'model_type': 'mlp', 'hidden_dims': '[512, 64]', 'dropout': 0.25580057567373504, 'batch_norm': False, 'lr': 1.2333086159825465e-06, 'weight_decay': 0.0003528106736598735, 'epochs': 266, 'loss': 'mse', 'optimizer': 'adam', 'graph_mode': 'off', 'use_snp_selection': True, 'num_snps': 42835}. Best is trial 32 with value: 0.3129934650752792.
[I 2025-12-05 15:23:46,935] Trial 37 finished with value: 0.3128360548142071 and parameters: {'model_type': 'mlp', 'hidden_dims': '[512, 64]', 'dropout': 0.20145752386070762, 'batch_norm': False, 'lr': 2.480070014376756e-06, 'weight_decay': 0.0001823954298321565, 'epochs': 331, 'loss': 'mae', 'optimizer': 'adam', 'graph_mode': 'off', 'use_snp_selection': True, 'num_snps': 51518}. Best is trial 32 with value: 0.3129934650752792.
[I 2025-12-05 15:25:13,619] Trial 38 finished with value: 0.28365305701111615 and parameters: {'model_type': 'mlp', 'hidden_dims': '[512, 64]', 'dropout': 0.3605436612189137, 'batch_norm': True, 'lr': 1.998071690387406e-06, 'weight_decay': 0.0009245495283529302, 'epochs': 332, 'loss': 'mse', 'optimizer': 'adam', 'graph_mode': 'off', 'use_snp_selection': True, 'num_snps': 54415}. Best is trial 32 with value: 0.3129934650752792.
[I 2025-12-05 15:26:18,852] Trial 39 finished with value: 0.2950200579769045 and parameters: {'model_type': 'mlp', 'hidden_dims': '[512, 64]', 'dropout': 0.16862819914174276, 'batch_norm': False, 'lr': 1.1804148964285127e-06, 'weight_decay': 0.0005002953448630703, 'epochs': 328, 'loss': 'mae', 'optimizer': 'adam', 'graph_mode': 'off', 'use_snp_selection': True, 'num_snps': 37356}. Best is trial 32 with value: 0.3129934650752792.
[I 2025-12-05 15:27:05,078] Trial 40 finished with value: 0.27236561264739384 and parameters: {'model_type': 'mlp', 'hidden_dims': '[128, 64]', 'dropout': 0.23406459157152706, 'batch_norm': True, 'lr': 2.789377133708248e-06, 'weight_decay': 9.979580169581312e-05, 'epochs': 348, 'loss': 'mae', 'optimizer': 'adam', 'graph_mode': 'off', 'use_snp_selection': True, 'num_snps': 45396}. Best is trial 32 with value: 0.3129934650752792.
[I 2025-12-05 15:28:24,180] Trial 41 finished with value: 0.3109419395750233 and parameters: {'model_type': 'mlp', 'hidden_dims': '[512, 64]', 'dropout': 0.20342319985785287, 'batch_norm': False, 'lr': 4.653423582248802e-06, 'weight_decay': 0.00018097581524047161, 'epochs': 307, 'loss': 'mae', 'optimizer': 'adam', 'graph_mode': 'off', 'use_snp_selection': True, 'num_snps': 51100}. Best is trial 32 with value: 0.3129934650752792.
[I 2025-12-05 15:29:40,681] Trial 42 finished with value: 0.3082446979063215 and parameters: {'model_type': 'mlp', 'hidden_dims': '[512, 64]', 'dropout': 0.17093816551235222, 'batch_norm': False, 'lr': 1.8284633210048014e-06, 'weight_decay': 0.0002880725257310963, 'epochs': 288, 'loss': 'mae', 'optimizer': 'adam', 'graph_mode': 'off', 'use_snp_selection': True, 'num_snps': 51128}. Best is trial 32 with value: 0.3129934650752792.
[I 2025-12-05 15:31:14,198] Trial 43 finished with value: 0.30895831449618705 and parameters: {'model_type': 'mlp', 'hidden_dims': '[512, 64]', 'dropout': 0.12377985595513522, 'batch_norm': False, 'lr': 3.3847576526469446e-06, 'weight_decay': 0.00021322914271738866, 'epochs': 333, 'loss': 'mae', 'optimizer': 'adam', 'graph_mode': 'off', 'use_snp_selection': True, 'num_snps': 59613}. Best is trial 32 with value: 0.3129934650752792.
[I 2025-12-05 15:32:33,279] Trial 44 finished with value: 0.3101360313514497 and parameters: {'model_type': 'mlp', 'hidden_dims': '[512, 64]', 'dropout': 0.22810744250384557, 'batch_norm': False, 'lr': 4.7600131507692565e-06, 'weight_decay': 0.00010986193916925084, 'epochs': 315, 'loss': 'mae', 'optimizer': 'adam', 'graph_mode': 'off', 'use_snp_selection': True, 'num_snps': 49950}. Best is trial 32 with value: 0.3129934650752792.
[I 2025-12-05 15:33:39,478] Trial 45 finished with value: 0.3063276449456909 and parameters: {'model_type': 'mlp', 'hidden_dims': '[512, 64]', 'dropout': 0.2745522770006391, 'batch_norm': False, 'lr': 1.7750955008993723e-06, 'weight_decay': 0.00048508318619093184, 'epochs': 278, 'loss': 'mse', 'optimizer': 'adam', 'graph_mode': 'off', 'use_snp_selection': True, 'num_snps': 42582}. Best is trial 32 with value: 0.3129934650752792.
[I 2025-12-05 15:35:00,942] Trial 46 finished with value: 0.2965399718505601 and parameters: {'model_type': 'mlp', 'hidden_dims': '[512, 128]', 'dropout': 0.18416204386599475, 'batch_norm': True, 'lr': 7.707320116686544e-06, 'weight_decay': 7.037454387701092e-05, 'epochs': 300, 'loss': 'mae', 'optimizer': 'adam', 'graph_mode': 'off', 'use_snp_selection': True, 'num_snps': 53824}. Best is trial 32 with value: 0.3129934650752792.
[I 2025-12-05 15:35:59,181] Trial 47 finished with value: 0.27343386234429923 and parameters: {'model_type': 'mlp', 'hidden_dims': '[256, 128, 64]', 'dropout': 0.40729991813593075, 'batch_norm': False, 'lr': 1.0402179937920986e-06, 'weight_decay': 0.00013162574336282582, 'epochs': 350, 'loss': 'mae', 'optimizer': 'adam', 'graph_mode': 'off', 'use_snp_selection': True, 'num_snps': 47745}. Best is trial 32 with value: 0.3129934650752792.
[I 2025-12-05 15:36:37,810] Trial 48 finished with value: 0.2609213254058059 and parameters: {'model_type': 'mlp', 'hidden_dims': '[512, 64]', 'dropout': 0.13479084268338015, 'batch_norm': False, 'lr': 2.7192844615141734e-06, 'weight_decay': 0.00025603287411222916, 'epochs': 51, 'loss': 'mae', 'optimizer': 'adam', 'graph_mode': 'off', 'use_snp_selection': True, 'num_snps': 40093}. Best is trial 32 with value: 0.3129934650752792.
[I 2025-12-05 15:37:31,520] Trial 49 finished with value: 0.29225240639051253 and parameters: {'model_type': 'mlp', 'hidden_dims': '[512, 256]', 'dropout': 0.25086337228526523, 'batch_norm': False, 'lr': 9.951366359646242e-05, 'weight_decay': 2.9106503462777137e-05, 'epochs': 263, 'loss': 'mse', 'optimizer': 'adam', 'graph_mode': 'off', 'use_snp_selection': True, 'num_snps': 32451}. Best is trial 32 with value: 0.3129934650752792.
[I 2025-12-05 15:38:46,136] Trial 50 finished with value: 0.30922839914840555 and parameters: {'model_type': 'mlp', 'hidden_dims': '[512, 64]', 'dropout': 0.2945601756827607, 'batch_norm': False, 'lr': 1.135325907395577e-05, 'weight_decay': 8.378943746184124e-05, 'epochs': 339, 'loss': 'mae', 'optimizer': 'adam', 'graph_mode': 'off', 'use_snp_selection': True, 'num_snps': 43502}. Best is trial 32 with value: 0.3129934650752792.
