[I 2025-12-06 08:39:28,165] Trial 37 finished with value: 0.16446578704321607 and parameters: {'model_type': 'mlp', 'hidden_dims': '[256, 128]', 'dropout': 0.3016553536645932, 'batch_norm': True, 'lr': 4.446294938689996e-06, 'weight_decay': 0.0005110418693500527, 'epochs': 246, 'loss': 'mae', 'optimizer': 'adam', 'graph_mode': 'off', 'use_snp_selection': False}. Best is trial 21 with value: 0.19403468051277564.
[I 2025-12-06 08:40:17,572] Trial 38 finished with value: 0.15353632549144222 and parameters: {'model_type': 'mlp', 'hidden_dims': '[512, 64]', 'dropout': 0.5749822693823109, 'batch_norm': False, 'lr': 0.0002132963501226098, 'weight_decay': 4.34768191311549e-05, 'epochs': 159, 'loss': 'mse', 'optimizer': 'adam', 'graph_mode': 'off', 'use_snp_selection': True, 'num_snps': 19911}. Best is trial 21 with value: 0.19403468051277564.
[I 2025-12-06 08:40:42,915] Trial 39 finished with value: 0.18950611564419664 and parameters: {'model_type': 'mlp', 'hidden_dims': '[256, 128]', 'dropout': 0.3710975223091849, 'batch_norm': True, 'lr': 7.454772428153244e-05, 'weight_decay': 0.00010059642429239423, 'epochs': 133, 'loss': 'mae', 'optimizer': 'adam', 'graph_mode': 'off', 'use_snp_selection': False}. Best is trial 21 with value: 0.19403468051277564.
[I 2025-12-06 08:41:18,333] Trial 40 finished with value: 0.18418375472211573 and parameters: {'model_type': 'mlp', 'hidden_dims': '[256, 128]', 'dropout': 0.19758529018162463, 'batch_norm': True, 'lr': 1.8886189123368274e-05, 'weight_decay': 0.0002000904270601235, 'epochs': 203, 'loss': 'mae', 'optimizer': 'adam', 'graph_mode': 'off', 'use_snp_selection': False}. Best is trial 21 with value: 0.19403468051277564.
[I 2025-12-06 08:42:29,763] Trial 41 finished with value: 0.19087495085411277 and parameters: {'model_type': 'mlp', 'hidden_dims': '[512, 128]', 'dropout': 0.16394378936064408, 'batch_norm': True, 'lr': 0.0002519154321886403, 'weight_decay': 1.7627727575972668e-05, 'epochs': 227, 'loss': 'mae', 'optimizer': 'adam', 'graph_mode': 'off', 'use_snp_selection': False}. Best is trial 21 with value: 0.19403468051277564.
[I 2025-12-06 08:43:17,180] Trial 42 finished with value: 0.18689559376166126 and parameters: {'model_type': 'mlp', 'hidden_dims': '[256, 128, 64]', 'dropout': 0.12977541200805534, 'batch_norm': True, 'lr': 0.0001203338407326112, 'weight_decay': 5.595572995180732e-06, 'epochs': 282, 'loss': 'mae', 'optimizer': 'adam', 'graph_mode': 'off', 'use_snp_selection': False}. Best is trial 21 with value: 0.19403468051277564.
[I 2025-12-06 08:44:54,117] Trial 43 finished with value: 0.2003803663756437 and parameters: {'model_type': 'mlp', 'hidden_dims': '[512, 64]', 'dropout': 0.10225704830748708, 'batch_norm': True, 'lr': 5.019216626353325e-05, 'weight_decay': 7.761761803569497e-05, 'epochs': 315, 'loss': 'mae', 'optimizer': 'adam', 'graph_mode': 'off', 'use_snp_selection': False}. Best is trial 43 with value: 0.2003803663756437.
[I 2025-12-06 08:46:32,936] Trial 44 finished with value: 0.1946585814393888 and parameters: {'model_type': 'mlp', 'hidden_dims': '[512, 64]', 'dropout': 0.17053460358839806, 'batch_norm': True, 'lr': 5.906064118998325e-05, 'weight_decay': 7.210732729367639e-05, 'epochs': 322, 'loss': 'mse', 'optimizer': 'adam', 'graph_mode': 'off', 'use_snp_selection': False}. Best is trial 43 with value: 0.2003803663756437.
[I 2025-12-06 08:48:09,481] Trial 45 finished with value: 0.18232386191809494 and parameters: {'model_type': 'mlp', 'hidden_dims': '[512, 64]', 'dropout': 0.27232135384807477, 'batch_norm': False, 'lr': 4.267182203010102e-05, 'weight_decay': 0.00018909588883651686, 'epochs': 323, 'loss': 'mse', 'optimizer': 'adam', 'graph_mode': 'off', 'use_snp_selection': False}. Best is trial 43 with value: 0.2003803663756437.
[I 2025-12-06 08:49:42,098] Trial 46 finished with value: 0.18687189243165853 and parameters: {'model_type': 'mlp', 'hidden_dims': '[512, 64]', 'dropout': 0.17114603739568582, 'batch_norm': True, 'lr': 5.879634607130776e-05, 'weight_decay': 4.086261573601263e-05, 'epochs': 300, 'loss': 'mse', 'optimizer': 'adam', 'graph_mode': 'off', 'use_snp_selection': False}. Best is trial 43 with value: 0.2003803663756437.
[I 2025-12-06 08:51:19,669] Trial 47 finished with value: 0.18318713303773557 and parameters: {'model_type': 'mlp', 'hidden_dims': '[512, 64]', 'dropout': 0.23653575043625968, 'batch_norm': True, 'lr': 9.624424517775163e-06, 'weight_decay': 0.0009393004103397124, 'epochs': 318, 'loss': 'mse', 'optimizer': 'adam', 'graph_mode': 'off', 'use_snp_selection': False}. Best is trial 43 with value: 0.2003803663756437.
[I 2025-12-06 08:51:58,066] Trial 48 finished with value: 0.18094817733832824 and parameters: {'model_type': 'mlp', 'hidden_dims': '[512, 64]', 'dropout': 0.19861921269879035, 'batch_norm': False, 'lr': 1.1170552432785515e-06, 'weight_decay': 0.00032562354353563104, 'epochs': 110, 'loss': 'mse', 'optimizer': 'adam', 'graph_mode': 'off', 'use_snp_selection': False}. Best is trial 43 with value: 0.2003803663756437.
[I 2025-12-06 08:52:54,122] Trial 49 finished with value: 0.1819031466977465 and parameters: {'model_type': 'mlp', 'hidden_dims': '[512, 64]', 'dropout': 0.10005130022213554, 'batch_norm': True, 'lr': 0.0006423867916677473, 'weight_decay': 0.00014556993733382044, 'epochs': 48, 'loss': 'mse', 'optimizer': 'adam', 'graph_mode': 'off', 'use_snp_selection': True, 'num_snps': 46888}. Best is trial 43 with value: 0.2003803663756437.
[I 2025-12-06 08:54:36,948] Trial 50 finished with value: 0.11596037255879206 and parameters: {'model_type': 'mlp', 'hidden_dims': '[512, 64]', 'dropout': 0.15448465441490844, 'batch_norm': True, 'lr': 2.6693831717472616e-06, 'weight_decay': 7.946898571903429e-05, 'epochs': 340, 'loss': 'mse', 'optimizer': 'adam', 'graph_mode': 'off', 'use_snp_selection': False}. Best is trial 43 with value: 0.2003803663756437.
[I 2025-12-06 08:56:02,934] Trial 51 finished with value: 0.18847447594108 and parameters: {'model_type': 'mlp', 'hidden_dims': '[512, 64]', 'dropout': 0.1290878366411049, 'batch_norm': True, 'lr': 6.597830319230591e-05, 'weight_decay': 7.419516573170285e-05, 'epochs': 278, 'loss': 'mae', 'optimizer': 'adam', 'graph_mode': 'off', 'use_snp_selection': False}. Best is trial 43 with value: 0.2003803663756437.
[I 2025-12-06 08:57:22,459] Trial 52 finished with value: 0.19260740292406908 and parameters: {'model_type': 'mlp', 'hidden_dims': '[512, 256]', 'dropout': 0.12280845875397649, 'batch_norm': True, 'lr': 4.360551556227248e-05, 'weight_decay': 4.2036089330242275e-05, 'epochs': 253, 'loss': 'mae', 'optimizer': 'adam', 'graph_mode': 'off', 'use_snp_selection': False}. Best is trial 43 with value: 0.2003803663756437.
[I 2025-12-06 08:58:38,181] Trial 53 finished with value: 0.19416395740002848 and parameters: {'model_type': 'mlp', 'hidden_dims': '[512, 64]', 'dropout': 0.14440414068449847, 'batch_norm': True, 'lr': 0.00019417583900172225, 'weight_decay': 1.7683715991829383e-05, 'epochs': 240, 'loss': 'mae', 'optimizer': 'adam', 'graph_mode': 'off', 'use_snp_selection': False}. Best is trial 43 with value: 0.2003803663756437.
[I 2025-12-06 08:59:52,993] Trial 54 finished with value: 0.18459541447400668 and parameters: {'model_type': 'mlp', 'hidden_dims': '[512, 64]', 'dropout': 0.1825901526061142, 'batch_norm': True, 'lr': 0.00018084690578418653, 'weight_decay': 1.799283630458604e-05, 'epochs': 237, 'loss': 'mae', 'optimizer': 'adam', 'graph_mode': 'off', 'use_snp_selection': False}. Best is trial 43 with value: 0.2003803663756437.
[I 2025-12-06 09:01:24,182] Trial 55 finished with value: 0.1902141872987463 and parameters: {'model_type': 'mlp', 'hidden_dims': '[512, 64]', 'dropout': 0.210908755950278, 'batch_norm': True, 'lr': 0.00037008479317442156, 'weight_decay': 1.771942699438141e-05, 'epochs': 295, 'loss': 'mse', 'optimizer': 'adam', 'graph_mode': 'off', 'use_snp_selection': False}. Best is trial 43 with value: 0.2003803663756437.
[I 2025-12-06 09:02:33,527] Trial 56 finished with value: 0.19319404831102588 and parameters: {'model_type': 'mlp', 'hidden_dims': '[512, 64]', 'dropout': 0.14807313520077228, 'batch_norm': True, 'lr': 0.00013786044372584723, 'weight_decay': 0.00010453126883148709, 'epochs': 218, 'loss': 'mae', 'optimizer': 'adam', 'graph_mode': 'off', 'use_snp_selection': False}. Best is trial 43 with value: 0.2003803663756437.
[I 2025-12-06 09:03:33,862] Trial 57 finished with value: 0.17673720201154178 and parameters: {'model_type': 'mlp', 'hidden_dims': '[512, 64]', 'dropout': 0.23060623171140718, 'batch_norm': False, 'lr': 2.2481990566895125e-05, 'weight_decay': 3.612329121631193e-05, 'epochs': 190, 'loss': 'mae', 'optimizer': 'adam', 'graph_mode': 'off', 'use_snp_selection': False}. Best is trial 43 with value: 0.2003803663756437.
[I 2025-12-06 09:04:25,448] Trial 58 finished with value: 0.1830497082881226 and parameters: {'model_type': 'mlp', 'hidden_dims': '[256, 128, 64]', 'dropout': 0.29198946595662134, 'batch_norm': True, 'lr': 0.0001971204508646473, 'weight_decay': 8.986468895899686e-06, 'epochs': 309, 'loss': 'mae', 'optimizer': 'adam', 'graph_mode': 'off', 'use_snp_selection': False}. Best is trial 43 with value: 0.2003803663756437.
[I 2025-12-06 09:04:49,830] Trial 59 finished with value: 0.18710220739554517 and parameters: {'model_type': 'mlp', 'hidden_dims': '[128, 64]', 'dropout': 0.1771825505223273, 'batch_norm': True, 'lr': 0.0002602789956598842, 'weight_decay': 7.880215732164159e-07, 'epochs': 251, 'loss': 'mae', 'optimizer': 'adam', 'graph_mode': 'off', 'use_snp_selection': False}. Best is trial 43 with value: 0.2003803663756437.
[I 2025-12-06 09:05:30,549] Trial 60 finished with value: 0.18723721206010047 and parameters: {'model_type': 'mlp', 'hidden_dims': '[256, 128]', 'dropout': 0.34904860787339514, 'batch_norm': True, 'lr': 0.0005623412045208924, 'weight_decay': 5.282603662032794e-05, 'epochs': 237, 'loss': 'mse', 'optimizer': 'adam', 'graph_mode': 'off', 'use_snp_selection': False}. Best is trial 43 with value: 0.2003803663756437.
[I 2025-12-06 09:06:55,672] Trial 61 finished with value: 0.18921374563124382 and parameters: {'model_type': 'mlp', 'hidden_dims': '[512, 128]', 'dropout': 0.13957995974731605, 'batch_norm': True, 'lr': 8.329225933604204e-05, 'weight_decay': 7.334186193630254e-05, 'epochs': 273, 'loss': 'mae', 'optimizer': 'adam', 'graph_mode': 'off', 'use_snp_selection': False}. Best is trial 43 with value: 0.2003803663756437.
[I 2025-12-06 09:08:01,248] Trial 62 finished with value: 0.19194924794245968 and parameters: {'model_type': 'mlp', 'hidden_dims': '[512, 128]', 'dropout': 0.11445314635549439, 'batch_norm': True, 'lr': 0.0001062432484091503, 'weight_decay': 5.8855037500148506e-05, 'epochs': 204, 'loss': 'mae', 'optimizer': 'adam', 'graph_mode': 'off', 'use_snp_selection': False}. Best is trial 43 with value: 0.2003803663756437.
[I 2025-12-06 09:09:23,924] Trial 63 finished with value: 0.19226833591533726 and parameters: {'model_type': 'mlp', 'hidden_dims': '[512, 128]', 'dropout': 0.416023875715105, 'batch_norm': True, 'lr': 5.456701678453775e-05, 'weight_decay': 2.2718203352984745e-05, 'epochs': 264, 'loss': 'mae', 'optimizer': 'adam', 'graph_mode': 'off', 'use_snp_selection': False}. Best is trial 43 with value: 0.2003803663756437.
[I 2025-12-06 09:10:59,039] Trial 64 finished with value: 0.19046454476541258 and parameters: {'model_type': 'mlp', 'hidden_dims': '[512, 256]', 'dropout': 0.15774060209762542, 'batch_norm': True, 'lr': 0.00015444508309102277, 'weight_decay': 0.0001485226796642409, 'epochs': 307, 'loss': 'mae', 'optimizer': 'adam', 'graph_mode': 'off', 'use_snp_selection': False}. Best is trial 43 with value: 0.2003803663756437.
[I 2025-12-06 09:12:27,886] Trial 65 finished with value: 0.1892881325427998 and parameters: {'model_type': 'mlp', 'hidden_dims': '[512, 64]', 'dropout': 0.11664874178116405, 'batch_norm': True, 'lr': 3.752933999617941e-05, 'weight_decay': 0.00011052035613665233, 'epochs': 287, 'loss': 'mae', 'optimizer': 'adam', 'graph_mode': 'off', 'use_snp_selection': False}. Best is trial 43 with value: 0.2003803663756437.
[I 2025-12-06 09:13:27,816] Trial 66 finished with value: 0.16258481747124026 and parameters: {'model_type': 'mlp', 'hidden_dims': '[512, 128]', 'dropout': 0.138672863550457, 'batch_norm': True, 'lr': 0.00031708424407858626, 'weight_decay': 0.00023750377244708976, 'epochs': 224, 'loss': 'mae', 'optimizer': 'adam', 'graph_mode': 'off', 'use_snp_selection': True, 'num_snps': 22881}. Best is trial 43 with value: 0.2003803663756437.
[I 2025-12-06 09:14:58,150] Trial 67 finished with value: 0.1894054315870505 and parameters: {'model_type': 'mlp', 'hidden_dims': '[512, 128]', 'dropout': 0.19283812446537768, 'batch_norm': True, 'lr': 0.0001138240852405801, 'weight_decay': 0.0004530234538809202, 'epochs': 293, 'loss': 'mae', 'optimizer': 'adam', 'graph_mode': 'off', 'use_snp_selection': False}. Best is trial 43 with value: 0.2003803663756437.
[I 2025-12-06 09:15:27,697] Trial 68 finished with value: 0.1882176884440251 and parameters: {'model_type': 'mlp', 'hidden_dims': '[128, 64]', 'dropout': 0.25680622297458405, 'batch_norm': True, 'lr': 7.432116984385524e-05, 'weight_decay': 1.3164585285879645e-05, 'epochs': 320, 'loss': 'mae', 'optimizer': 'adam', 'graph_mode': 'off', 'use_snp_selection': False}. Best is trial 43 with value: 0.2003803663756437.
[I 2025-12-06 09:16:20,482] Trial 69 finished with value: 0.18380769327633997 and parameters: {'model_type': 'mlp', 'hidden_dims': '[256, 128]', 'dropout': 0.17010455026664517, 'batch_norm': False, 'lr': 3.2589673763140246e-05, 'weight_decay': 3.933613271600148e-06, 'epochs': 328, 'loss': 'mae', 'optimizer': 'adam', 'graph_mode': 'off', 'use_snp_selection': False}. Best is trial 43 with value: 0.2003803663756437.
[I 2025-12-06 09:17:41,485] Trial 70 finished with value: 0.19250062769733045 and parameters: {'model_type': 'mlp', 'hidden_dims': '[512, 64]', 'dropout': 0.2143323105703393, 'batch_norm': True, 'lr': 0.0001462083659443039, 'weight_decay': 2.855489820081868e-05, 'epochs': 259, 'loss': 'mae', 'optimizer': 'adam', 'graph_mode': 'off', 'use_snp_selection': False}. Best is trial 43 with value: 0.2003803663756437.
[I 2025-12-06 09:18:49,934] Trial 71 finished with value: 0.19644662833956444 and parameters: {'model_type': 'mlp', 'hidden_dims': '[512, 64]', 'dropout': 0.14185612804578832, 'batch_norm': True, 'lr': 0.00013861446037663754, 'weight_decay': 9.049376551264491e-05, 'epochs': 215, 'loss': 'mae', 'optimizer': 'adam', 'graph_mode': 'off', 'use_snp_selection': False}. Best is trial 43 with value: 0.2003803663756437.
[I 2025-12-06 09:19:49,005] Trial 72 finished with value: 0.18546863376497225 and parameters: {'model_type': 'mlp', 'hidden_dims': '[512, 64]', 'dropout': 0.10393951768859835, 'batch_norm': True, 'lr': 0.0001732300977435251, 'weight_decay': 5.912421278675885e-05, 'epochs': 182, 'loss': 'mae', 'optimizer': 'adam', 'graph_mode': 'off', 'use_snp_selection': False}. Best is trial 43 with value: 0.2003803663756437.
[I 2025-12-06 09:20:56,851] Trial 73 finished with value: 0.19510149290581164 and parameters: {'model_type': 'mlp', 'hidden_dims': '[512, 64]', 'dropout': 0.14054857443194282, 'batch_norm': True, 'lr': 9.396551819934379e-05, 'weight_decay': 0.0001454025449621315, 'epochs': 213, 'loss': 'mae', 'optimizer': 'adam', 'graph_mode': 'off', 'use_snp_selection': False}. Best is trial 43 with value: 0.2003803663756437.
[I 2025-12-06 09:22:00,267] Trial 74 finished with value: 0.18721392469643608 and parameters: {'model_type': 'mlp', 'hidden_dims': '[512, 64]', 'dropout': 0.15601655895523187, 'batch_norm': True, 'lr': 0.00025954872264914724, 'weight_decay': 0.00014931074615108985, 'epochs': 197, 'loss': 'mae', 'optimizer': 'adam', 'graph_mode': 'off', 'use_snp_selection': False}. Best is trial 43 with value: 0.2003803663756437.
[I 2025-12-06 09:23:08,208] Trial 75 finished with value: 0.191168223444595 and parameters: {'model_type': 'mlp', 'hidden_dims': '[512, 64]', 'dropout': 0.11769156603892088, 'batch_norm': True, 'lr': 0.00023060951854804925, 'weight_decay': 0.00017677867630547069, 'epochs': 213, 'loss': 'mae', 'optimizer': 'adam', 'graph_mode': 'off', 'use_snp_selection': False}. Best is trial 43 with value: 0.2003803663756437.
[I 2025-12-06 09:24:03,906] Trial 76 finished with value: 0.1905857821226878 and parameters: {'model_type': 'mlp', 'hidden_dims': '[512, 64]', 'dropout': 0.13916489168989066, 'batch_norm': True, 'lr': 9.831065393210726e-05, 'weight_decay': 0.00027245477873386737, 'epochs': 170, 'loss': 'mae', 'optimizer': 'adam', 'graph_mode': 'off', 'use_snp_selection': False}. Best is trial 43 with value: 0.2003803663756437.
[I 2025-12-06 09:25:17,960] Trial 77 finished with value: 0.19177322280098424 and parameters: {'model_type': 'mlp', 'hidden_dims': '[512, 64]', 'dropout': 0.16689942453655443, 'batch_norm': True, 'lr': 4.867471413917783e-05, 'weight_decay': 9.788142999071154e-05, 'epochs': 235, 'loss': 'mae', 'optimizer': 'adam', 'graph_mode': 'off', 'use_snp_selection': False}. Best is trial 43 with value: 0.2003803663756437.
[I 2025-12-06 09:25:50,547] Trial 78 finished with value: 0.0978875763870888 and parameters: {'model_type': 'mlp', 'hidden_dims': '[256, 128, 64]', 'dropout': 0.10081877914633963, 'batch_norm': True, 'lr': 0.0001299726098295114, 'weight_decay': 0.0001270947776288994, 'epochs': 209, 'loss': 'mae', 'optimizer': 'adam', 'graph_mode': 'off', 'use_snp_selection': True, 'num_snps': 2246}. Best is trial 43 with value: 0.2003803663756437.
[I 2025-12-06 09:27:05,669] Trial 79 finished with value: 0.1803140666074797 and parameters: {'model_type': 'mlp', 'hidden_dims': '[512, 64]', 'dropout': 0.18317733399657876, 'batch_norm': True, 'lr': 0.00043769335560485704, 'weight_decay': 0.0007042807090118147, 'epochs': 242, 'loss': 'mse', 'optimizer': 'adam', 'graph_mode': 'off', 'use_snp_selection': False}. Best is trial 43 with value: 0.2003803663756437.
[I 2025-12-06 09:28:01,473] Trial 80 finished with value: 0.189314092461841 and parameters: {'model_type': 'mlp', 'hidden_dims': '[256, 128]', 'dropout': 0.11953986923865134, 'batch_norm': True, 'lr': 0.00020787502988963276, 'weight_decay': 4.6710488347031174e-05, 'epochs': 342, 'loss': 'mae', 'optimizer': 'adam', 'graph_mode': 'off', 'use_snp_selection': False}. Best is trial 43 with value: 0.2003803663756437.
[I 2025-12-06 09:29:11,004] Trial 81 finished with value: 0.1861773391326182 and parameters: {'model_type': 'mlp', 'hidden_dims': '[512, 128]', 'dropout': 0.1396769633519258, 'batch_norm': True, 'lr': 7.98164038032802e-05, 'weight_decay': 8.620090124895254e-05, 'epochs': 219, 'loss': 'mae', 'optimizer': 'adam', 'graph_mode': 'off', 'use_snp_selection': False}. Best is trial 43 with value: 0.2003803663756437.
[I 2025-12-06 09:30:22,750] Trial 82 finished with value: 0.18969067327330894 and parameters: {'model_type': 'mlp', 'hidden_dims': '[512, 128]', 'dropout': 0.13047954525315023, 'batch_norm': True, 'lr': 6.0141709541943076e-05, 'weight_decay': 3.402376237921595e-05, 'epochs': 227, 'loss': 'mae', 'optimizer': 'adam', 'graph_mode': 'off', 'use_snp_selection': False}. Best is trial 43 with value: 0.2003803663756437.
[I 2025-12-06 09:31:39,717] Trial 83 finished with value: 0.18490948925958034 and parameters: {'model_type': 'mlp', 'hidden_dims': '[512, 64]', 'dropout': 0.1544906294953229, 'batch_norm': True, 'lr': 9.044898197786897e-05, 'weight_decay': 6.656336082581033e-05, 'epochs': 246, 'loss': 'mae', 'optimizer': 'adam', 'graph_mode': 'off', 'use_snp_selection': False}. Best is trial 43 with value: 0.2003803663756437.
[I 2025-12-06 09:33:04,110] Trial 84 finished with value: 0.18744627564404143 and parameters: {'model_type': 'mlp', 'hidden_dims': '[512, 256]', 'dropout': 0.2072662933781897, 'batch_norm': True, 'lr': 6.766233897294245e-05, 'weight_decay': 2.122608735795204e-05, 'epochs': 270, 'loss': 'mae', 'optimizer': 'adam', 'graph_mode': 'off', 'use_snp_selection': False}. Best is trial 43 with value: 0.2003803663756437.
[I 2025-12-06 09:34:37,702] Trial 85 finished with value: 0.1956533263371118 and parameters: {'model_type': 'mlp', 'hidden_dims': '[512, 64]', 'dropout': 0.14572885466730984, 'batch_norm': True, 'lr': 0.00011480102739574018, 'weight_decay': 0.000339475402928187, 'epochs': 303, 'loss': 'mae', 'optimizer': 'adam', 'graph_mode': 'off', 'use_snp_selection': False}. Best is trial 43 with value: 0.2003803663756437.
[I 2025-12-06 09:36:12,081] Trial 86 finished with value: 0.18419226001713349 and parameters: {'model_type': 'mlp', 'hidden_dims': '[512, 64]', 'dropout': 0.1893233214059106, 'batch_norm': False, 'lr': 0.00015946600475831614, 'weight_decay': 0.0002735593754054135, 'epochs': 316, 'loss': 'mae', 'optimizer': 'adam', 'graph_mode': 'off', 'use_snp_selection': False}. Best is trial 43 with value: 0.2003803663756437.
[I 2025-12-06 09:37:52,530] Trial 87 finished with value: 0.1907984243698188 and parameters: {'model_type': 'mlp', 'hidden_dims': '[512, 64]', 'dropout': 0.31325840603174315, 'batch_norm': True, 'lr': 0.00012137821909080025, 'weight_decay': 0.00017577246183157497, 'epochs': 328, 'loss': 'mse', 'optimizer': 'adam', 'graph_mode': 'off', 'use_snp_selection': False}. Best is trial 43 with value: 0.2003803663756437.
[I 2025-12-06 09:39:25,086] Trial 88 finished with value: 0.1905676049514376 and parameters: {'model_type': 'mlp', 'hidden_dims': '[512, 64]', 'dropout': 0.2285085191837592, 'batch_norm': True, 'lr': 0.00018491455670132325, 'weight_decay': 0.0004118711032906895, 'epochs': 300, 'loss': 'mae', 'optimizer': 'adam', 'graph_mode': 'off', 'use_snp_selection': False}. Best is trial 43 with value: 0.2003803663756437.
