[I 2025-12-06 14:15:04,625] Trial 93 finished with value: 0.25145820098467303 and parameters: {'model_type': 'mlp', 'hidden_dims': '[512, 256]', 'dropout': 0.35795296616744, 'batch_norm': False, 'lr': 6.071051574387363e-06, 'weight_decay': 0.00011879102920295738, 'epochs': 327, 'loss': 'mae', 'optimizer': 'adam', 'graph_mode': 'off', 'use_snp_selection': True, 'num_snps': 28831}. Best is trial 88 with value: 0.2792669062575092.
[I 2025-12-06 14:15:32,328] Trial 94 finished with value: 0.2704549514493028 and parameters: {'model_type': 'mlp', 'hidden_dims': '[128, 64]', 'dropout': 0.48355871814042023, 'batch_norm': False, 'lr': 1.1652256545691603e-05, 'weight_decay': 1.2882112108861998e-07, 'epochs': 307, 'loss': 'mae', 'optimizer': 'adam', 'graph_mode': 'off', 'use_snp_selection': False}. Best is trial 88 with value: 0.2792669062575092.
[I 2025-12-06 14:16:19,910] Trial 95 finished with value: 0.2687321199322744 and parameters: {'model_type': 'mlp', 'hidden_dims': '[512, 64]', 'dropout': 0.41018379134348454, 'batch_norm': False, 'lr': 2.4032531860087747e-05, 'weight_decay': 1.1183280886911135e-05, 'epochs': 147, 'loss': 'mae', 'optimizer': 'adam', 'graph_mode': 'off', 'use_snp_selection': False}. Best is trial 88 with value: 0.2792669062575092.
[I 2025-12-06 14:16:33,272] Trial 96 finished with value: 0.2628192803917996 and parameters: {'model_type': 'mlp', 'hidden_dims': '[128, 64]', 'dropout': 0.32021553574583517, 'batch_norm': False, 'lr': 1.84061338110815e-05, 'weight_decay': 0.0006821496100116235, 'epochs': 104, 'loss': 'mae', 'optimizer': 'adam', 'graph_mode': 'off', 'use_snp_selection': False}. Best is trial 88 with value: 0.2792669062575092.
[I 2025-12-06 14:17:05,902] Trial 97 finished with value: 0.27232598145920106 and parameters: {'model_type': 'mlp', 'hidden_dims': '[512, 128]', 'dropout': 0.2464073298138222, 'batch_norm': False, 'lr': 3.4097526930376173e-06, 'weight_decay': 1.443590946765967e-07, 'epochs': 90, 'loss': 'mae', 'optimizer': 'adam', 'graph_mode': 'off', 'use_snp_selection': False}. Best is trial 88 with value: 0.2792669062575092.
[I 2025-12-06 14:18:13,730] Trial 98 finished with value: 0.2655700245912278 and parameters: {'model_type': 'mlp', 'hidden_dims': '[512, 128]', 'dropout': 0.24591980057191604, 'batch_norm': False, 'lr': 3.7828391766969186e-06, 'weight_decay': 1.521863730048783e-07, 'epochs': 91, 'loss': 'mae', 'optimizer': 'adam', 'graph_mode': 'off', 'use_snp_selection': True, 'num_snps': 51258}. Best is trial 88 with value: 0.2792669062575092.
[I 2025-12-06 14:18:37,311] Trial 99 finished with value: 0.2599799732535123 and parameters: {'model_type': 'mlp', 'hidden_dims': '[512, 128]', 'dropout': 0.2694002445651884, 'batch_norm': False, 'lr': 3.3897654323238183e-06, 'weight_decay': 3.017399263349491e-07, 'epochs': 58, 'loss': 'mae', 'optimizer': 'adam', 'graph_mode': 'off', 'use_snp_selection': False}. Best is trial 88 with value: 0.2792669062575092.
[I 2025-12-06 14:19:16,676] Trial 100 finished with value: 0.17187879430861921 and parameters: {'model_type': 'mlp', 'hidden_dims': '[512, 128]', 'dropout': 0.3044945235700032, 'batch_norm': True, 'lr': 1.4155329398942895e-06, 'weight_decay': 2.155011706730131e-07, 'epochs': 114, 'loss': 'mae', 'optimizer': 'adam', 'graph_mode': 'off', 'use_snp_selection': False}. Best is trial 88 with value: 0.2792669062575092.
[I 2025-12-06 14:20:34,204] Trial 101 finished with value: 0.2614747315210504 and parameters: {'model_type': 'mlp', 'hidden_dims': '[512, 128]', 'dropout': 0.2146107144621438, 'batch_norm': False, 'lr': 2.5891935707323242e-06, 'weight_decay': 1.3264140497568797e-07, 'epochs': 250, 'loss': 'mae', 'optimizer': 'adam', 'graph_mode': 'off', 'use_snp_selection': False}. Best is trial 88 with value: 0.2792669062575092.
[I 2025-12-06 14:21:25,444] Trial 102 finished with value: 0.2629433714489539 and parameters: {'model_type': 'mlp', 'hidden_dims': '[256, 128, 64]', 'dropout': 0.2280158439081343, 'batch_norm': False, 'lr': 4.334486866890642e-06, 'weight_decay': 6.464992397506952e-06, 'epochs': 312, 'loss': 'mae', 'optimizer': 'adam', 'graph_mode': 'off', 'use_snp_selection': False}. Best is trial 88 with value: 0.2792669062575092.
[I 2025-12-06 14:21:58,717] Trial 103 finished with value: 0.2555167157701711 and parameters: {'model_type': 'mlp', 'hidden_dims': '[512, 256]', 'dropout': 0.4395819639160554, 'batch_norm': False, 'lr': 1.0369103337432273e-05, 'weight_decay': 4.85187939582049e-05, 'epochs': 92, 'loss': 'mae', 'optimizer': 'adam', 'graph_mode': 'off', 'use_snp_selection': False}. Best is trial 88 with value: 0.2792669062575092.
[I 2025-12-06 14:22:28,873] Trial 104 finished with value: 0.2556196017884196 and parameters: {'model_type': 'mlp', 'hidden_dims': '[128, 64]', 'dropout': 0.25437729300858586, 'batch_norm': False, 'lr': 1.328492103765257e-05, 'weight_decay': 1.4374879251689563e-06, 'epochs': 336, 'loss': 'mae', 'optimizer': 'adam', 'graph_mode': 'off', 'use_snp_selection': False}. Best is trial 88 with value: 0.2792669062575092.
[I 2025-12-06 14:24:06,732] Trial 105 finished with value: 0.2627522198584508 and parameters: {'model_type': 'mlp', 'hidden_dims': '[512, 256]', 'dropout': 0.2795418082761483, 'batch_norm': False, 'lr': 1.759328601579215e-06, 'weight_decay': 1.0141628621082227e-07, 'epochs': 321, 'loss': 'mae', 'optimizer': 'adam', 'graph_mode': 'off', 'use_snp_selection': False}. Best is trial 88 with value: 0.2792669062575092.
[I 2025-12-06 14:24:33,590] Trial 106 finished with value: 0.27128191315162137 and parameters: {'model_type': 'mlp', 'hidden_dims': '[512, 128]', 'dropout': 0.4628646296819221, 'batch_norm': False, 'lr': 3.808881569881667e-05, 'weight_decay': 2.3638986113703013e-06, 'epochs': 68, 'loss': 'mae', 'optimizer': 'adam', 'graph_mode': 'off', 'use_snp_selection': False}. Best is trial 88 with value: 0.2792669062575092.
[I 2025-12-06 14:24:55,520] Trial 107 finished with value: 0.24783502092847515 and parameters: {'model_type': 'mlp', 'hidden_dims': '[128, 64]', 'dropout': 0.5292134890789921, 'batch_norm': False, 'lr': 5.557489053003046e-06, 'weight_decay': 1.8686954829379352e-07, 'epochs': 222, 'loss': 'mae', 'optimizer': 'adam', 'graph_mode': 'off', 'use_snp_selection': False}. Best is trial 88 with value: 0.2792669062575092.
[I 2025-12-06 14:25:40,199] Trial 108 finished with value: 0.2768432519714502 and parameters: {'model_type': 'mlp', 'hidden_dims': '[512, 256]', 'dropout': 0.3367002483700471, 'batch_norm': False, 'lr': 2.9191720193139726e-05, 'weight_decay': 4.6989023774094175e-07, 'epochs': 135, 'loss': 'mae', 'optimizer': 'adam', 'graph_mode': 'off', 'use_snp_selection': False}. Best is trial 88 with value: 0.2792669062575092.
[I 2025-12-06 14:26:05,340] Trial 109 finished with value: 0.26684250587215286 and parameters: {'model_type': 'mlp', 'hidden_dims': '[256, 128]', 'dropout': 0.3258869526725634, 'batch_norm': False, 'lr': 2.8500699449563482e-05, 'weight_decay': 2.479980450048824e-07, 'epochs': 134, 'loss': 'mae', 'optimizer': 'adam', 'graph_mode': 'off', 'use_snp_selection': False}. Best is trial 88 with value: 0.2792669062575092.
[I 2025-12-06 14:26:45,523] Trial 110 finished with value: 0.2572084216041671 and parameters: {'model_type': 'mlp', 'hidden_dims': '[512, 256]', 'dropout': 0.34322473267002357, 'batch_norm': False, 'lr': 3.3455946100020115e-05, 'weight_decay': 8.395459180131409e-07, 'epochs': 119, 'loss': 'mse', 'optimizer': 'adam', 'graph_mode': 'off', 'use_snp_selection': False}. Best is trial 88 with value: 0.2792669062575092.
[I 2025-12-06 14:27:21,616] Trial 111 finished with value: 0.2658538814515752 and parameters: {'model_type': 'mlp', 'hidden_dims': '[512, 256]', 'dropout': 0.35175346415676273, 'batch_norm': False, 'lr': 2.2535507615630475e-05, 'weight_decay': 4.896421150208204e-07, 'epochs': 103, 'loss': 'mae', 'optimizer': 'adam', 'graph_mode': 'off', 'use_snp_selection': False}. Best is trial 88 with value: 0.2792669062575092.
[I 2025-12-06 14:28:08,457] Trial 112 finished with value: 0.2565728698462311 and parameters: {'model_type': 'mlp', 'hidden_dims': '[512, 256]', 'dropout': 0.3976455443836791, 'batch_norm': False, 'lr': 6.945391622434757e-06, 'weight_decay': 1.659961535408217e-07, 'epochs': 140, 'loss': 'mae', 'optimizer': 'adam', 'graph_mode': 'off', 'use_snp_selection': False}. Best is trial 88 with value: 0.2792669062575092.
[I 2025-12-06 14:29:02,375] Trial 113 finished with value: 0.26701935227602347 and parameters: {'model_type': 'mlp', 'hidden_dims': '[512, 256]', 'dropout': 0.29366821022179596, 'batch_norm': False, 'lr': 1.6408427735364265e-05, 'weight_decay': 4.196080000908036e-06, 'epochs': 167, 'loss': 'mae', 'optimizer': 'adam', 'graph_mode': 'off', 'use_snp_selection': False}. Best is trial 88 with value: 0.2792669062575092.
[I 2025-12-06 14:30:01,251] Trial 114 finished with value: 0.26128471619354987 and parameters: {'model_type': 'mlp', 'hidden_dims': '[512, 256]', 'dropout': 0.37166926348264584, 'batch_norm': False, 'lr': 5.83809273797557e-05, 'weight_decay': 3.4880177077551506e-07, 'epochs': 188, 'loss': 'mae', 'optimizer': 'adam', 'graph_mode': 'off', 'use_snp_selection': False}. Best is trial 88 with value: 0.2792669062575092.
[I 2025-12-06 14:30:17,961] Trial 115 finished with value: 0.2642996453722141 and parameters: {'model_type': 'mlp', 'hidden_dims': '[128, 64]', 'dropout': 0.38559308931782255, 'batch_norm': False, 'lr': 1.961774703997942e-05, 'weight_decay': 6.523300967416227e-07, 'epochs': 151, 'loss': 'mae', 'optimizer': 'adam', 'graph_mode': 'off', 'use_snp_selection': False}. Best is trial 88 with value: 0.2792669062575092.
[I 2025-12-06 14:30:48,995] Trial 116 finished with value: 0.2684045511724002 and parameters: {'model_type': 'mlp', 'hidden_dims': '[512, 256]', 'dropout': 0.33527526026515536, 'batch_norm': False, 'lr': 8.881804733808372e-06, 'weight_decay': 2.5359501416709604e-05, 'epochs': 84, 'loss': 'mae', 'optimizer': 'adam', 'graph_mode': 'off', 'use_snp_selection': False}. Best is trial 88 with value: 0.2792669062575092.
[I 2025-12-06 14:31:28,364] Trial 117 finished with value: 0.2210424095144977 and parameters: {'model_type': 'mlp', 'hidden_dims': '[128, 64]', 'dropout': 0.3099849008465192, 'batch_norm': False, 'lr': 1.4178114390460122e-05, 'weight_decay': 3.1203337937021e-06, 'epochs': 284, 'loss': 'mae', 'optimizer': 'adam', 'graph_mode': 'off', 'use_snp_selection': True, 'num_snps': 14041}. Best is trial 88 with value: 0.2792669062575092.
[I 2025-12-06 14:33:06,281] Trial 118 finished with value: 0.27521059344558585 and parameters: {'model_type': 'mlp', 'hidden_dims': '[512, 256]', 'dropout': 0.5067535045729721, 'batch_norm': False, 'lr': 1.126872882333348e-05, 'weight_decay': 4.2798161870599343e-07, 'epochs': 326, 'loss': 'mae', 'optimizer': 'adam', 'graph_mode': 'off', 'use_snp_selection': False}. Best is trial 88 with value: 0.2792669062575092.
[I 2025-12-06 14:33:29,702] Trial 119 finished with value: 0.26189930231484027 and parameters: {'model_type': 'mlp', 'hidden_dims': '[256, 128, 64]', 'dropout': 0.5078705768766998, 'batch_norm': False, 'lr': 1.099749890567017e-05, 'weight_decay': 4.0351343173000094e-07, 'epochs': 120, 'loss': 'mae', 'optimizer': 'adam', 'graph_mode': 'off', 'use_snp_selection': False}. Best is trial 88 with value: 0.2792669062575092.
[I 2025-12-06 14:34:08,876] Trial 120 finished with value: 0.2476399914709356 and parameters: {'model_type': 'mlp', 'hidden_dims': '[512, 256]', 'dropout': 0.49861998563915144, 'batch_norm': True, 'lr': 2.5469220998661635e-05, 'weight_decay': 4.4760652518189436e-07, 'epochs': 112, 'loss': 'mae', 'optimizer': 'adam', 'graph_mode': 'off', 'use_snp_selection': False}. Best is trial 88 with value: 0.2792669062575092.
[I 2025-12-06 14:35:51,735] Trial 121 finished with value: 0.2786631458306208 and parameters: {'model_type': 'mlp', 'hidden_dims': '[512, 256]', 'dropout': 0.5404271503072773, 'batch_norm': False, 'lr': 1.2699228039577862e-05, 'weight_decay': 1.0497368845561555e-06, 'epochs': 343, 'loss': 'mae', 'optimizer': 'adam', 'graph_mode': 'off', 'use_snp_selection': False}. Best is trial 88 with value: 0.2792669062575092.
[I 2025-12-06 14:37:32,995] Trial 122 finished with value: 0.2690847815604877 and parameters: {'model_type': 'mlp', 'hidden_dims': '[512, 256]', 'dropout': 0.5805150272241911, 'batch_norm': False, 'lr': 1.3335149248535348e-05, 'weight_decay': 6.465769822206294e-07, 'epochs': 338, 'loss': 'mae', 'optimizer': 'adam', 'graph_mode': 'off', 'use_snp_selection': False}. Best is trial 88 with value: 0.2792669062575092.
[I 2025-12-06 14:39:12,203] Trial 123 finished with value: 0.2686112952631802 and parameters: {'model_type': 'mlp', 'hidden_dims': '[512, 256]', 'dropout': 0.5450397037167067, 'batch_norm': False, 'lr': 1.61122800872475e-05, 'weight_decay': 1.1528898975688302e-06, 'epochs': 332, 'loss': 'mae', 'optimizer': 'adam', 'graph_mode': 'off', 'use_snp_selection': False}. Best is trial 88 with value: 0.2792669062575092.
[I 2025-12-06 14:40:56,077] Trial 124 finished with value: 0.2682435009261982 and parameters: {'model_type': 'mlp', 'hidden_dims': '[512, 256]', 'dropout': 0.5598536535591355, 'batch_norm': False, 'lr': 1.1503468988758978e-05, 'weight_decay': 1.916129353599275e-06, 'epochs': 347, 'loss': 'mae', 'optimizer': 'adam', 'graph_mode': 'off', 'use_snp_selection': False}. Best is trial 88 with value: 0.2792669062575092.
[I 2025-12-06 14:41:25,196] Trial 125 finished with value: 0.2642897941877802 and parameters: {'model_type': 'mlp', 'hidden_dims': '[128, 64]', 'dropout': 0.5245330722664471, 'batch_norm': False, 'lr': 2.07373868917727e-05, 'weight_decay': 3.042598019543547e-07, 'epochs': 326, 'loss': 'mae', 'optimizer': 'adam', 'graph_mode': 'off', 'use_snp_selection': False}. Best is trial 88 with value: 0.2792669062575092.
[I 2025-12-06 14:42:59,916] Trial 126 finished with value: 0.2714681984989098 and parameters: {'model_type': 'mlp', 'hidden_dims': '[512, 256]', 'dropout': 0.5400158614326799, 'batch_norm': False, 'lr': 9.733624577951148e-06, 'weight_decay': 9.43837043145229e-07, 'epochs': 313, 'loss': 'mae', 'optimizer': 'adam', 'graph_mode': 'off', 'use_snp_selection': False}. Best is trial 88 with value: 0.2792669062575092.
[I 2025-12-06 14:44:42,744] Trial 127 finished with value: 0.264701248858461 and parameters: {'model_type': 'mlp', 'hidden_dims': '[512, 64]', 'dropout': 0.5100002699843585, 'batch_norm': False, 'lr': 3.5509109621535306e-06, 'weight_decay': 5.612468768343061e-07, 'epochs': 342, 'loss': 'mae', 'optimizer': 'adam', 'graph_mode': 'off', 'use_snp_selection': False}. Best is trial 88 with value: 0.2792669062575092.
[I 2025-12-06 14:45:11,947] Trial 128 finished with value: 0.2626098357958045 and parameters: {'model_type': 'mlp', 'hidden_dims': '[128, 64]', 'dropout': 0.48558900686208295, 'batch_norm': False, 'lr': 1.8118913705355227e-05, 'weight_decay': 7.553367933730264e-07, 'epochs': 325, 'loss': 'mae', 'optimizer': 'adam', 'graph_mode': 'off', 'use_snp_selection': False}. Best is trial 88 with value: 0.2792669062575092.
[I 2025-12-06 14:46:00,591] Trial 129 finished with value: 0.24662360354105872 and parameters: {'model_type': 'mlp', 'hidden_dims': '[512, 256]', 'dropout': 0.4742723200585494, 'batch_norm': False, 'lr': 7.68883373323724e-06, 'weight_decay': 1.4940657596157616e-07, 'epochs': 77, 'loss': 'mse', 'optimizer': 'adam', 'graph_mode': 'off', 'use_snp_selection': True, 'num_snps': 28529}. Best is trial 88 with value: 0.2792669062575092.
[I 2025-12-06 14:46:34,419] Trial 130 finished with value: 0.2549782153007275 and parameters: {'model_type': 'mlp', 'hidden_dims': '[512, 128]', 'dropout': 0.23938575693306752, 'batch_norm': False, 'lr': 4.662946612724859e-06, 'weight_decay': 2.2778611104983386e-07, 'epochs': 95, 'loss': 'mae', 'optimizer': 'adam', 'graph_mode': 'off', 'use_snp_selection': False}. Best is trial 88 with value: 0.2792669062575092.
[I 2025-12-06 14:48:08,633] Trial 131 finished with value: 0.2674015922433323 and parameters: {'model_type': 'mlp', 'hidden_dims': '[512, 256]', 'dropout': 0.5369120594643059, 'batch_norm': False, 'lr': 9.453098589701708e-06, 'weight_decay': 1.5106421847335652e-06, 'epochs': 311, 'loss': 'mae', 'optimizer': 'adam', 'graph_mode': 'off', 'use_snp_selection': False}. Best is trial 88 with value: 0.2792669062575092.
[I 2025-12-06 14:49:43,501] Trial 132 finished with value: 0.26523894773612094 and parameters: {'model_type': 'mlp', 'hidden_dims': '[512, 256]', 'dropout': 0.5774286702312946, 'batch_norm': False, 'lr': 1.4374193347320505e-05, 'weight_decay': 1.0058756840962832e-06, 'epochs': 315, 'loss': 'mae', 'optimizer': 'adam', 'graph_mode': 'off', 'use_snp_selection': False}. Best is trial 88 with value: 0.2792669062575092.
[I 2025-12-06 14:51:22,443] Trial 133 finished with value: 0.2640655058443902 and parameters: {'model_type': 'mlp', 'hidden_dims': '[512, 256]', 'dropout': 0.5536041686489739, 'batch_norm': False, 'lr': 1.2125730348716314e-05, 'weight_decay': 4.1946150886731673e-07, 'epochs': 329, 'loss': 'mae', 'optimizer': 'adam', 'graph_mode': 'off', 'use_snp_selection': False}. Best is trial 88 with value: 0.2792669062575092.
[I 2025-12-06 14:52:51,982] Trial 134 finished with value: 0.27896892035660087 and parameters: {'model_type': 'mlp', 'hidden_dims': '[512, 256]', 'dropout': 0.4961869955671481, 'batch_norm': False, 'lr': 1.0380327460410662e-05, 'weight_decay': 1.2501111220613972e-06, 'epochs': 294, 'loss': 'mae', 'optimizer': 'adam', 'graph_mode': 'off', 'use_snp_selection': False}. Best is trial 88 with value: 0.2792669062575092.
[I 2025-12-06 14:54:19,541] Trial 135 finished with value: 0.25775820839023583 and parameters: {'model_type': 'mlp', 'hidden_dims': '[512, 256]', 'dropout': 0.514952506168902, 'batch_norm': False, 'lr': 0.00020992593737404763, 'weight_decay': 1.351819309797972e-06, 'epochs': 295, 'loss': 'mae', 'optimizer': 'adam', 'graph_mode': 'off', 'use_snp_selection': False}. Best is trial 88 with value: 0.2792669062575092.
[I 2025-12-06 14:54:44,814] Trial 136 finished with value: 0.2643875014116145 and parameters: {'model_type': 'mlp', 'hidden_dims': '[128, 64]', 'dropout': 0.4956597501916096, 'batch_norm': False, 'lr': 1.6470314382916303e-05, 'weight_decay': 1.2364139753533954e-07, 'epochs': 270, 'loss': 'mae', 'optimizer': 'adam', 'graph_mode': 'off', 'use_snp_selection': False}. Best is trial 88 with value: 0.2792669062575092.
[I 2025-12-06 14:55:27,876] Trial 137 finished with value: 0.2661654358927439 and parameters: {'model_type': 'mlp', 'hidden_dims': '[512, 256]', 'dropout': 0.454759235304046, 'batch_norm': False, 'lr': 2.289503360474768e-05, 'weight_decay': 2.3276767648505504e-06, 'epochs': 129, 'loss': 'mae', 'optimizer': 'adam', 'graph_mode': 'off', 'use_snp_selection': False}. Best is trial 88 with value: 0.2792669062575092.
[I 2025-12-06 14:56:24,193] Trial 138 finished with value: 0.25442232098437934 and parameters: {'model_type': 'mlp', 'hidden_dims': '[256, 128]', 'dropout': 0.4816020893267559, 'batch_norm': False, 'lr': 2.701777926284993e-06, 'weight_decay': 1.1536773187303099e-06, 'epochs': 350, 'loss': 'mae', 'optimizer': 'adam', 'graph_mode': 'off', 'use_snp_selection': False}. Best is trial 88 with value: 0.2792669062575092.
[I 2025-12-06 14:56:51,000] Trial 139 finished with value: 0.2684634182942748 and parameters: {'model_type': 'mlp', 'hidden_dims': '[128, 64]', 'dropout': 0.2848496595807561, 'batch_norm': False, 'lr': 6.303703250924959e-06, 'weight_decay': 0.00014494851704906307, 'epochs': 288, 'loss': 'mae', 'optimizer': 'adam', 'graph_mode': 'off', 'use_snp_selection': False}. Best is trial 88 with value: 0.2792669062575092.
[I 2025-12-06 14:58:16,766] Trial 140 finished with value: 0.1984075805768595 and parameters: {'model_type': 'mlp', 'hidden_dims': '[512, 256]', 'dropout': 0.22306723021647643, 'batch_norm': True, 'lr': 8.169358879754049e-06, 'weight_decay': 3.172822347300879e-07, 'epochs': 300, 'loss': 'mae', 'optimizer': 'adam', 'graph_mode': 'off', 'use_snp_selection': True, 'num_snps': 34531}. Best is trial 88 with value: 0.2792669062575092.
[I 2025-12-06 14:59:52,304] Trial 141 finished with value: 0.27753048783879297 and parameters: {'model_type': 'mlp', 'hidden_dims': '[512, 256]', 'dropout': 0.5404104906760556, 'batch_norm': False, 'lr': 1.0008684880621118e-05, 'weight_decay': 8.405516207721482e-07, 'epochs': 316, 'loss': 'mae', 'optimizer': 'adam', 'graph_mode': 'off', 'use_snp_selection': False}. Best is trial 88 with value: 0.2792669062575092.
[I 2025-12-06 15:01:32,775] Trial 142 finished with value: 0.26629323649258996 and parameters: {'model_type': 'mlp', 'hidden_dims': '[512, 256]', 'dropout': 0.5644159785110944, 'batch_norm': False, 'lr': 1.1096077629934905e-05, 'weight_decay': 7.474959139681332e-07, 'epochs': 334, 'loss': 'mae', 'optimizer': 'adam', 'graph_mode': 'off', 'use_snp_selection': False}. Best is trial 88 with value: 0.2792669062575092.
[I 2025-12-06 15:03:09,395] Trial 143 finished with value: 0.26062337646082245 and parameters: {'model_type': 'mlp', 'hidden_dims': '[512, 256]', 'dropout': 0.5267202292404332, 'batch_norm': False, 'lr': 1.297171738804471e-05, 'weight_decay': 1.8442558804547651e-06, 'epochs': 321, 'loss': 'mae', 'optimizer': 'adam', 'graph_mode': 'off', 'use_snp_selection': False}. Best is trial 88 with value: 0.2792669062575092.
[I 2025-12-06 15:04:43,172] Trial 144 finished with value: 0.2676384484165061 and parameters: {'model_type': 'mlp', 'hidden_dims': '[512, 256]', 'dropout': 0.19586819366042518, 'batch_norm': False, 'lr': 2.1483037826249797e-06, 'weight_decay': 8.574766038314204e-07, 'epochs': 307, 'loss': 'mae', 'optimizer': 'adam', 'graph_mode': 'off', 'use_snp_selection': False}. Best is trial 88 with value: 0.2792669062575092.
