[I 2025-12-05 16:18:24,153] Trial 70 finished with value: 0.09527443031798971 and parameters: {'model_type': 'mlp', 'hidden_dims': '[128, 64]', 'dropout': 0.4709992045194187, 'batch_norm': True, 'lr': 0.00016012182626533433, 'weight_decay': 3.835501564096833e-06, 'epochs': 260, 'loss': 'mse', 'optimizer': 'adam', 'graph_mode': 'off', 'use_snp_selection': False}. Best is trial 61 with value: 0.11843847109566615.
[I 2025-12-05 16:18:25,020] Trial 71 finished with value: 0.08906306261174779 and parameters: {'model_type': 'mlp', 'hidden_dims': '[128, 64]', 'dropout': 0.1112583965214088, 'batch_norm': False, 'lr': 0.0003896306235914891, 'weight_decay': 9.021604961168011e-05, 'epochs': 271, 'loss': 'mse', 'optimizer': 'adam', 'graph_mode': 'off', 'use_snp_selection': False}. Best is trial 61 with value: 0.11843847109566615.
[I 2025-12-05 16:18:25,938] Trial 72 finished with value: 0.0921463530601378 and parameters: {'model_type': 'mlp', 'hidden_dims': '[128, 64]', 'dropout': 0.1182342390845029, 'batch_norm': False, 'lr': 0.0005129633591650255, 'weight_decay': 0.0001539299055165752, 'epochs': 274, 'loss': 'mse', 'optimizer': 'adam', 'graph_mode': 'off', 'use_snp_selection': False}. Best is trial 61 with value: 0.11843847109566615.
[I 2025-12-05 16:18:26,867] Trial 73 finished with value: 0.11044896079982965 and parameters: {'model_type': 'mlp', 'hidden_dims': '[128, 64]', 'dropout': 0.15307130558161006, 'batch_norm': False, 'lr': 0.0008603914896633026, 'weight_decay': 0.00010507810987846913, 'epochs': 283, 'loss': 'mse', 'optimizer': 'adam', 'graph_mode': 'off', 'use_snp_selection': False}. Best is trial 61 with value: 0.11843847109566615.
[I 2025-12-05 16:18:27,755] Trial 74 finished with value: 0.0924333354745767 and parameters: {'model_type': 'mlp', 'hidden_dims': '[128, 64]', 'dropout': 0.13466064435296032, 'batch_norm': False, 'lr': 1.0087771566710253e-06, 'weight_decay': 6.449785536805415e-06, 'epochs': 256, 'loss': 'mse', 'optimizer': 'adam', 'graph_mode': 'off', 'use_snp_selection': False}. Best is trial 61 with value: 0.11843847109566615.
[I 2025-12-05 16:18:28,654] Trial 75 finished with value: 0.08629688732550168 and parameters: {'model_type': 'mlp', 'hidden_dims': '[128, 64]', 'dropout': 0.19502577569473964, 'batch_norm': False, 'lr': 0.0006506064090990097, 'weight_decay': 6.452796078061437e-05, 'epochs': 267, 'loss': 'mse', 'optimizer': 'adam', 'graph_mode': 'off', 'use_snp_selection': False}. Best is trial 61 with value: 0.11843847109566615.
[I 2025-12-05 16:18:30,300] Trial 76 finished with value: 0.10526395053833652 and parameters: {'model_type': 'mlp', 'hidden_dims': '[128, 64]', 'dropout': 0.12440019346030735, 'batch_norm': False, 'lr': 0.00042252243566547824, 'weight_decay': 5.188277873442092e-05, 'epochs': 309, 'loss': 'mae', 'optimizer': 'adam', 'graph_mode': 'off', 'use_snp_selection': True, 'num_snps': 27131}. Best is trial 61 with value: 0.11843847109566615.
[I 2025-12-05 16:18:32,842] Trial 77 finished with value: 0.10014235677023987 and parameters: {'model_type': 'mlp', 'hidden_dims': '[256, 128, 64]', 'dropout': 0.16133339067362215, 'batch_norm': True, 'lr': 0.0001144091591097966, 'weight_decay': 1.1267981562086686e-05, 'epochs': 212, 'loss': 'mae', 'optimizer': 'adam', 'graph_mode': 'off', 'use_snp_selection': True, 'num_snps': 53336}. Best is trial 61 with value: 0.11843847109566615.
[I 2025-12-05 16:18:35,607] Trial 78 finished with value: 0.10166807030232013 and parameters: {'model_type': 'mlp', 'hidden_dims': '[512, 64]', 'dropout': 0.14053277289091737, 'batch_norm': True, 'lr': 7.827839963216007e-05, 'weight_decay': 8.414423757697948e-05, 'epochs': 325, 'loss': 'mae', 'optimizer': 'adam', 'graph_mode': 'off', 'use_snp_selection': True, 'num_snps': 41642}. Best is trial 61 with value: 0.11843847109566615.
[I 2025-12-05 16:18:36,639] Trial 79 finished with value: 0.1082135880082053 and parameters: {'model_type': 'mlp', 'hidden_dims': '[128, 64]', 'dropout': 0.2354010756714381, 'batch_norm': True, 'lr': 0.000338054536878725, 'weight_decay': 0.00020718742079961556, 'epochs': 294, 'loss': 'mse', 'optimizer': 'adam', 'graph_mode': 'off', 'use_snp_selection': False}. Best is trial 61 with value: 0.11843847109566615.
[I 2025-12-05 16:18:39,846] Trial 80 finished with value: 0.09314927072356236 and parameters: {'model_type': 'mlp', 'hidden_dims': '[512, 256]', 'dropout': 0.10136861727967621, 'batch_norm': False, 'lr': 0.0002120795998908794, 'weight_decay': 6.755877355370343e-06, 'epochs': 247, 'loss': 'mae', 'optimizer': 'adam', 'graph_mode': 'off', 'use_snp_selection': True, 'num_snps': 57655}. Best is trial 61 with value: 0.11843847109566615.
[I 2025-12-05 16:18:40,860] Trial 81 finished with value: 0.10602368075027366 and parameters: {'model_type': 'mlp', 'hidden_dims': '[128, 64]', 'dropout': 0.2135009065177108, 'batch_norm': True, 'lr': 0.0008413669919312003, 'weight_decay': 1.64984644738177e-05, 'epochs': 286, 'loss': 'mae', 'optimizer': 'adam', 'graph_mode': 'off', 'use_snp_selection': False}. Best is trial 61 with value: 0.11843847109566615.
[I 2025-12-05 16:18:41,824] Trial 82 finished with value: 0.10227814023012553 and parameters: {'model_type': 'mlp', 'hidden_dims': '[128, 64]', 'dropout': 0.18051412175549258, 'batch_norm': True, 'lr': 0.0006233787678016213, 'weight_decay': 2.4429484464235875e-05, 'epochs': 273, 'loss': 'mae', 'optimizer': 'adam', 'graph_mode': 'off', 'use_snp_selection': False}. Best is trial 61 with value: 0.11843847109566615.
[I 2025-12-05 16:18:42,803] Trial 83 finished with value: 0.09235668465978653 and parameters: {'model_type': 'mlp', 'hidden_dims': '[128, 64]', 'dropout': 0.19867798942072223, 'batch_norm': True, 'lr': 0.0009690277988109818, 'weight_decay': 8.644924944453957e-06, 'epochs': 265, 'loss': 'mae', 'optimizer': 'adam', 'graph_mode': 'off', 'use_snp_selection': False}. Best is trial 61 with value: 0.11843847109566615.
[I 2025-12-05 16:18:43,787] Trial 84 finished with value: 0.10873473779538681 and parameters: {'model_type': 'mlp', 'hidden_dims': '[128, 64]', 'dropout': 0.1658787518252239, 'batch_norm': True, 'lr': 0.00047552999812849737, 'weight_decay': 1.1828697246847768e-05, 'epochs': 256, 'loss': 'mae', 'optimizer': 'adam', 'graph_mode': 'off', 'use_snp_selection': False}. Best is trial 61 with value: 0.11843847109566615.
[I 2025-12-05 16:18:46,295] Trial 85 finished with value: 0.09602816699825968 and parameters: {'model_type': 'mlp', 'hidden_dims': '[128, 64]', 'dropout': 0.12231196832874607, 'batch_norm': True, 'lr': 0.000664539057323851, 'weight_decay': 1.6453837341911313e-05, 'epochs': 305, 'loss': 'mae', 'optimizer': 'adam', 'graph_mode': 'off', 'use_snp_selection': True, 'num_snps': 52318}. Best is trial 61 with value: 0.11843847109566615.
[I 2025-12-05 16:18:47,328] Trial 86 finished with value: 0.10682298979666455 and parameters: {'model_type': 'mlp', 'hidden_dims': '[128, 64]', 'dropout': 0.15748339870929615, 'batch_norm': True, 'lr': 0.0008019936821008513, 'weight_decay': 0.0002904025962540192, 'epochs': 289, 'loss': 'mae', 'optimizer': 'adam', 'graph_mode': 'off', 'use_snp_selection': False}. Best is trial 61 with value: 0.11843847109566615.
[I 2025-12-05 16:18:48,547] Trial 87 finished with value: 0.11341431806219537 and parameters: {'model_type': 'mlp', 'hidden_dims': '[128, 64]', 'dropout': 0.21905224245692642, 'batch_norm': True, 'lr': 0.0005502895890607953, 'weight_decay': 4.066581969732536e-05, 'epochs': 279, 'loss': 'mae', 'optimizer': 'adam', 'graph_mode': 'off', 'use_snp_selection': True, 'num_snps': 9537}. Best is trial 61 with value: 0.11843847109566615.
[I 2025-12-05 16:18:49,603] Trial 88 finished with value: 0.0955703425941433 and parameters: {'model_type': 'mlp', 'hidden_dims': '[256, 128]', 'dropout': 0.22210738998476792, 'batch_norm': True, 'lr': 0.0003057484744189104, 'weight_decay': 4.7042850165296657e-05, 'epochs': 276, 'loss': 'mae', 'optimizer': 'adam', 'graph_mode': 'off', 'use_snp_selection': True, 'num_snps': 4646}. Best is trial 61 with value: 0.11843847109566615.
[I 2025-12-05 16:18:50,790] Trial 89 finished with value: 0.10235699861525009 and parameters: {'model_type': 'mlp', 'hidden_dims': '[128, 64]', 'dropout': 0.23873835743385946, 'batch_norm': True, 'lr': 0.0004932495384341155, 'weight_decay': 3.549062130789201e-05, 'epochs': 228, 'loss': 'mae', 'optimizer': 'adam', 'graph_mode': 'off', 'use_snp_selection': True, 'num_snps': 12657}. Best is trial 61 with value: 0.11843847109566615.
[I 2025-12-05 16:18:52,074] Trial 90 finished with value: 0.10842046660938075 and parameters: {'model_type': 'mlp', 'hidden_dims': '[128, 64]', 'dropout': 0.25668224599528067, 'batch_norm': True, 'lr': 0.00037858828333474907, 'weight_decay': 0.00013534676494230102, 'epochs': 253, 'loss': 'mae', 'optimizer': 'adam', 'graph_mode': 'off', 'use_snp_selection': True, 'num_snps': 15589}. Best is trial 61 with value: 0.11843847109566615.
[I 2025-12-05 16:18:53,540] Trial 91 finished with value: 0.10001265022947889 and parameters: {'model_type': 'mlp', 'hidden_dims': '[128, 64]', 'dropout': 0.21614372745343616, 'batch_norm': True, 'lr': 0.000577718888189421, 'weight_decay': 2.4869384155155896e-05, 'epochs': 300, 'loss': 'mae', 'optimizer': 'adam', 'graph_mode': 'off', 'use_snp_selection': True, 'num_snps': 21106}. Best is trial 61 with value: 0.11843847109566615.
[I 2025-12-05 16:18:54,611] Trial 92 finished with value: 0.1056797754998239 and parameters: {'model_type': 'mlp', 'hidden_dims': '[128, 64]', 'dropout': 0.18763977120117803, 'batch_norm': True, 'lr': 0.0008692130995777093, 'weight_decay': 1.3657683173434709e-05, 'epochs': 284, 'loss': 'mae', 'optimizer': 'adam', 'graph_mode': 'off', 'use_snp_selection': True, 'num_snps': 6199}. Best is trial 61 with value: 0.11843847109566615.
[I 2025-12-05 16:18:56,869] Trial 93 finished with value: 0.09832057378232942 and parameters: {'model_type': 'mlp', 'hidden_dims': '[128, 64]', 'dropout': 0.26886857179108364, 'batch_norm': True, 'lr': 0.0007007973915736709, 'weight_decay': 9.243431513948908e-06, 'epochs': 263, 'loss': 'mae', 'optimizer': 'adam', 'graph_mode': 'off', 'use_snp_selection': True, 'num_snps': 50666}. Best is trial 61 with value: 0.11843847109566615.
[I 2025-12-05 16:18:59,733] Trial 94 finished with value: 0.10325015682408359 and parameters: {'model_type': 'mlp', 'hidden_dims': '[512, 128]', 'dropout': 0.1510228267718272, 'batch_norm': True, 'lr': 0.00028559089869398377, 'weight_decay': 1.822245989549841e-05, 'epochs': 278, 'loss': 'mae', 'optimizer': 'adam', 'graph_mode': 'off', 'use_snp_selection': True, 'num_snps': 47202}. Best is trial 61 with value: 0.11843847109566615.
[I 2025-12-05 16:19:00,537] Trial 95 finished with value: 0.09622599450711584 and parameters: {'model_type': 'mlp', 'hidden_dims': '[128, 64]', 'dropout': 0.20316308249366263, 'batch_norm': True, 'lr': 0.0004463762277720381, 'weight_decay': 6.123182876824911e-05, 'epochs': 137, 'loss': 'mae', 'optimizer': 'adam', 'graph_mode': 'off', 'use_snp_selection': False}. Best is trial 61 with value: 0.11843847109566615.
[I 2025-12-05 16:19:02,203] Trial 96 finished with value: 0.043272233430074664 and parameters: {'model_type': 'mlp', 'hidden_dims': '[128, 64]', 'dropout': 0.13332133733496238, 'batch_norm': True, 'lr': 2.6376220330873792e-06, 'weight_decay': 0.00017173171180496336, 'epochs': 241, 'loss': 'mse', 'optimizer': 'adam', 'graph_mode': 'off', 'use_snp_selection': True, 'num_snps': 28698}. Best is trial 61 with value: 0.11843847109566615.
[I 2025-12-05 16:19:03,462] Trial 97 finished with value: 0.1195407668947421 and parameters: {'model_type': 'mlp', 'hidden_dims': '[256, 128, 64]', 'dropout': 0.24361749911042288, 'batch_norm': False, 'lr': 0.0009935214407714046, 'weight_decay': 4.0131632917908275e-05, 'epochs': 294, 'loss': 'mae', 'optimizer': 'adam', 'graph_mode': 'off', 'use_snp_selection': False}. Best is trial 97 with value: 0.1195407668947421.
[I 2025-12-05 16:19:06,075] Trial 98 finished with value: 0.07149875916992765 and parameters: {'model_type': 'mlp', 'hidden_dims': '[256, 128, 64]', 'dropout': 0.2806116665874247, 'batch_norm': False, 'lr': 0.0005549235715978948, 'weight_decay': 4.15688210273904e-05, 'epochs': 270, 'loss': 'mae', 'optimizer': 'adam', 'graph_mode': 'off', 'use_snp_selection': True, 'num_snps': 58337}. Best is trial 97 with value: 0.1195407668947421.
[I 2025-12-05 16:19:07,328] Trial 99 finished with value: 0.08106884360804194 and parameters: {'model_type': 'mlp', 'hidden_dims': '[256, 128, 64]', 'dropout': 0.23852187873224645, 'batch_norm': False, 'lr': 0.0007082439729945838, 'weight_decay': 2.9068990438120574e-05, 'epochs': 293, 'loss': 'mae', 'optimizer': 'adam', 'graph_mode': 'off', 'use_snp_selection': False}. Best is trial 97 with value: 0.1195407668947421.
[I 2025-12-05 16:19:09,987] Trial 100 finished with value: 0.11214288925609885 and parameters: {'model_type': 'mlp', 'hidden_dims': '[256, 128, 64]', 'dropout': 0.11027210845007969, 'batch_norm': False, 'lr': 2.205561371757452e-05, 'weight_decay': 0.0003987172145191702, 'epochs': 261, 'loss': 'mae', 'optimizer': 'adam', 'graph_mode': 'off', 'use_snp_selection': True, 'num_snps': 55069}. Best is trial 97 with value: 0.1195407668947421.
[I 2025-12-05 16:19:12,646] Trial 101 finished with value: 0.09229631963073473 and parameters: {'model_type': 'mlp', 'hidden_dims': '[256, 128, 64]', 'dropout': 0.11124867450663545, 'batch_norm': False, 'lr': 2.324200937597784e-05, 'weight_decay': 0.00034390642147936145, 'epochs': 262, 'loss': 'mae', 'optimizer': 'adam', 'graph_mode': 'off', 'use_snp_selection': True, 'num_snps': 54760}. Best is trial 97 with value: 0.1195407668947421.
[I 2025-12-05 16:19:15,311] Trial 102 finished with value: 0.0926795092120854 and parameters: {'model_type': 'mlp', 'hidden_dims': '[256, 128, 64]', 'dropout': 0.1018326839786386, 'batch_norm': False, 'lr': 5.104026103713298e-05, 'weight_decay': 0.00023045060293609687, 'epochs': 280, 'loss': 'mae', 'optimizer': 'adam', 'graph_mode': 'off', 'use_snp_selection': True, 'num_snps': 57758}. Best is trial 97 with value: 0.1195407668947421.
[I 2025-12-05 16:19:17,575] Trial 103 finished with value: 0.07270076779625713 and parameters: {'model_type': 'mlp', 'hidden_dims': '[256, 128, 64]', 'dropout': 0.13001786762223444, 'batch_norm': False, 'lr': 2.1400638946907727e-05, 'weight_decay': 0.0001136969251296583, 'epochs': 113, 'loss': 'mae', 'optimizer': 'adam', 'graph_mode': 'off', 'use_snp_selection': True, 'num_snps': 54946}. Best is trial 97 with value: 0.1195407668947421.
[I 2025-12-05 16:19:20,176] Trial 104 finished with value: 0.09011388568383391 and parameters: {'model_type': 'mlp', 'hidden_dims': '[256, 128, 64]', 'dropout': 0.17414607440896898, 'batch_norm': False, 'lr': 0.000977692571358214, 'weight_decay': 0.0003847072573317312, 'epochs': 250, 'loss': 'mae', 'optimizer': 'adam', 'graph_mode': 'off', 'use_snp_selection': True, 'num_snps': 52733}. Best is trial 97 with value: 0.1195407668947421.
[I 2025-12-05 16:19:22,205] Trial 105 finished with value: 0.12294717254433538 and parameters: {'model_type': 'mlp', 'hidden_dims': '[256, 128, 64]', 'dropout': 0.29785179471440254, 'batch_norm': False, 'lr': 3.398332133600163e-05, 'weight_decay': 0.0005750227735546242, 'epochs': 270, 'loss': 'mse', 'optimizer': 'adam', 'graph_mode': 'off', 'use_snp_selection': True, 'num_snps': 38595}. Best is trial 105 with value: 0.12294717254433538.
[I 2025-12-05 16:19:23,976] Trial 106 finished with value: 0.03680127251802588 and parameters: {'model_type': 'mlp', 'hidden_dims': '[512, 64]', 'dropout': 0.32760677717429054, 'batch_norm': False, 'lr': 0.0008352551085490799, 'weight_decay': 8.848632227060974e-05, 'epochs': 271, 'loss': 'mse', 'optimizer': 'adam', 'graph_mode': 'off', 'use_snp_selection': False}. Best is trial 105 with value: 0.12294717254433538.
[I 2025-12-05 16:19:25,870] Trial 107 finished with value: 0.09057966897882844 and parameters: {'model_type': 'mlp', 'hidden_dims': '[256, 128, 64]', 'dropout': 0.29203073021576503, 'batch_norm': False, 'lr': 0.0005218700907840796, 'weight_decay': 0.0006453742470814286, 'epochs': 314, 'loss': 'mse', 'optimizer': 'adam', 'graph_mode': 'off', 'use_snp_selection': True, 'num_snps': 35699}. Best is trial 105 with value: 0.12294717254433538.
[I 2025-12-05 16:19:28,282] Trial 108 finished with value: 0.09327060905973762 and parameters: {'model_type': 'mlp', 'hidden_dims': '[512, 256]', 'dropout': 0.2575676270617203, 'batch_norm': False, 'lr': 0.00036251603740260153, 'weight_decay': 0.000701660553512515, 'epochs': 298, 'loss': 'mse', 'optimizer': 'adam', 'graph_mode': 'off', 'use_snp_selection': True, 'num_snps': 39589}. Best is trial 105 with value: 0.12294717254433538.
[I 2025-12-05 16:19:29,212] Trial 109 finished with value: 0.10773052784133938 and parameters: {'model_type': 'mlp', 'hidden_dims': '[128, 64]', 'dropout': 0.24826085259177177, 'batch_norm': False, 'lr': 0.0002616324257146177, 'weight_decay': 3.326447124732164e-05, 'epochs': 287, 'loss': 'mse', 'optimizer': 'adam', 'graph_mode': 'off', 'use_snp_selection': False}. Best is trial 105 with value: 0.12294717254433538.
[I 2025-12-05 16:19:30,552] Trial 110 finished with value: 0.07602821746957034 and parameters: {'model_type': 'mlp', 'hidden_dims': '[256, 128]', 'dropout': 0.372777782243057, 'batch_norm': False, 'lr': 9.164969183816546e-06, 'weight_decay': 7.471624339126605e-05, 'epochs': 237, 'loss': 'mse', 'optimizer': 'adam', 'graph_mode': 'off', 'use_snp_selection': True, 'num_snps': 19071}. Best is trial 105 with value: 0.12294717254433538.
[I 2025-12-05 16:19:33,166] Trial 111 finished with value: 0.08663276117616431 and parameters: {'model_type': 'mlp', 'hidden_dims': '[256, 128, 64]', 'dropout': 0.11707298477266886, 'batch_norm': False, 'lr': 3.846099866692183e-05, 'weight_decay': 4.5875681308974024e-05, 'epochs': 257, 'loss': 'mae', 'optimizer': 'adam', 'graph_mode': 'off', 'use_snp_selection': True, 'num_snps': 57907}. Best is trial 105 with value: 0.12294717254433538.
[I 2025-12-05 16:19:35,700] Trial 112 finished with value: 0.07827973017911477 and parameters: {'model_type': 'mlp', 'hidden_dims': '[256, 128, 64]', 'dropout': 0.3018712064460098, 'batch_norm': False, 'lr': 5.697860367568428e-06, 'weight_decay': 0.0009624524977257788, 'epochs': 245, 'loss': 'mse', 'optimizer': 'adam', 'graph_mode': 'off', 'use_snp_selection': True, 'num_snps': 55285}. Best is trial 105 with value: 0.12294717254433538.
[I 2025-12-05 16:19:38,334] Trial 113 finished with value: 0.10517023031752731 and parameters: {'model_type': 'mlp', 'hidden_dims': '[256, 128, 64]', 'dropout': 0.14120095620483245, 'batch_norm': False, 'lr': 1.6680547243446802e-05, 'weight_decay': 0.0005065972968478834, 'epochs': 268, 'loss': 'mae', 'optimizer': 'adam', 'graph_mode': 'off', 'use_snp_selection': True, 'num_snps': 51254}. Best is trial 105 with value: 0.12294717254433538.
[I 2025-12-05 16:19:41,046] Trial 114 finished with value: 0.08822546715766301 and parameters: {'model_type': 'mlp', 'hidden_dims': '[256, 128, 64]', 'dropout': 0.2263583523758396, 'batch_norm': False, 'lr': 3.235079195202397e-05, 'weight_decay': 0.0004461077843600235, 'epochs': 279, 'loss': 'mae', 'optimizer': 'adam', 'graph_mode': 'off', 'use_snp_selection': True, 'num_snps': 56081}. Best is trial 105 with value: 0.12294717254433538.
[I 2025-12-05 16:19:43,715] Trial 115 finished with value: 0.08756262525808436 and parameters: {'model_type': 'mlp', 'hidden_dims': '[256, 128, 64]', 'dropout': 0.2047600637353571, 'batch_norm': False, 'lr': 1.1293938253207199e-05, 'weight_decay': 5.597116966708958e-05, 'epochs': 263, 'loss': 'mae', 'optimizer': 'adam', 'graph_mode': 'off', 'use_snp_selection': True, 'num_snps': 58785}. Best is trial 105 with value: 0.12294717254433538.
[I 2025-12-05 16:19:44,663] Trial 116 finished with value: 0.09371025511710072 and parameters: {'model_type': 'mlp', 'hidden_dims': '[128, 64]', 'dropout': 0.11056612190803052, 'batch_norm': False, 'lr': 0.0006344115580103217, 'weight_decay': 2.366828924964398e-05, 'epochs': 291, 'loss': 'mse', 'optimizer': 'adam', 'graph_mode': 'off', 'use_snp_selection': False}. Best is trial 105 with value: 0.12294717254433538.
[I 2025-12-05 16:19:47,021] Trial 117 finished with value: 0.10531979590097583 and parameters: {'model_type': 'mlp', 'hidden_dims': '[128, 64]', 'dropout': 0.19099599584501542, 'batch_norm': True, 'lr': 0.0007758052579862417, 'weight_decay': 8.65444314117945e-07, 'epochs': 277, 'loss': 'mae', 'optimizer': 'adam', 'graph_mode': 'off', 'use_snp_selection': True, 'num_snps': 49424}. Best is trial 105 with value: 0.12294717254433538.
[I 2025-12-05 16:19:49,788] Trial 118 finished with value: 0.10636876629510948 and parameters: {'model_type': 'mlp', 'hidden_dims': '[512, 128]', 'dropout': 0.12474815629784511, 'batch_norm': True, 'lr': 0.0004218724706541532, 'weight_decay': 4.556962112504701e-06, 'epochs': 253, 'loss': 'mae', 'optimizer': 'adam', 'graph_mode': 'off', 'use_snp_selection': True, 'num_snps': 47406}. Best is trial 105 with value: 0.12294717254433538.
[I 2025-12-05 16:19:50,740] Trial 119 finished with value: 0.09733062381860662 and parameters: {'model_type': 'mlp', 'hidden_dims': '[128, 64]', 'dropout': 0.14145061463119316, 'batch_norm': False, 'lr': 0.000998904254535085, 'weight_decay': 0.0007410544349126495, 'epochs': 303, 'loss': 'mse', 'optimizer': 'adam', 'graph_mode': 'off', 'use_snp_selection': False}. Best is trial 105 with value: 0.12294717254433538.
[I 2025-12-05 16:19:51,869] Trial 120 finished with value: 0.10849068898494058 and parameters: {'model_type': 'mlp', 'hidden_dims': '[128, 64]', 'dropout': 0.15623230357081883, 'batch_norm': True, 'lr': 0.0005634485260311756, 'weight_decay': 1.8755553926785665e-05, 'epochs': 272, 'loss': 'mae', 'optimizer': 'adam', 'graph_mode': 'off', 'use_snp_selection': True, 'num_snps': 9256}. Best is trial 105 with value: 0.12294717254433538.
