[I 2025-12-05 15:55:11,164] Trial 93 finished with value: 0.03003693340018697 and parameters: {'model_type': 'mlp', 'hidden_dims': '[256, 128]', 'dropout': 0.17214806882120842, 'batch_norm': True, 'lr': 4.7089852481082425e-05, 'weight_decay': 4.903657968484852e-05, 'epochs': 105, 'loss': 'mae', 'optimizer': 'adam', 'graph_mode': 'off', 'use_snp_selection': False}. Best is trial 71 with value: 0.07073722804276542.
[I 2025-12-05 15:55:12,417] Trial 94 finished with value: 0.02374914320443221 and parameters: {'model_type': 'mlp', 'hidden_dims': '[512, 256]', 'dropout': 0.3400310235294237, 'batch_norm': True, 'lr': 0.0005803623174202574, 'weight_decay': 0.00017978129556459535, 'epochs': 137, 'loss': 'mae', 'optimizer': 'adam', 'graph_mode': 'off', 'use_snp_selection': False}. Best is trial 71 with value: 0.07073722804276542.
[I 2025-12-05 15:55:13,659] Trial 95 finished with value: 0.03719924040811614 and parameters: {'model_type': 'mlp', 'hidden_dims': '[256, 128]', 'dropout': 0.11331151987935634, 'batch_norm': True, 'lr': 2.4647451268119545e-05, 'weight_decay': 0.00010198047079356858, 'epochs': 305, 'loss': 'mae', 'optimizer': 'adam', 'graph_mode': 'off', 'use_snp_selection': False}. Best is trial 71 with value: 0.07073722804276542.
[I 2025-12-05 15:55:14,493] Trial 96 finished with value: 0.02089813280979783 and parameters: {'model_type': 'mlp', 'hidden_dims': '[256, 128]', 'dropout': 0.2300521662515418, 'batch_norm': True, 'lr': 4.006081998711325e-05, 'weight_decay': 1.7295321100025136e-07, 'epochs': 122, 'loss': 'mae', 'optimizer': 'adam', 'graph_mode': 'off', 'use_snp_selection': False}. Best is trial 71 with value: 0.07073722804276542.
[I 2025-12-05 15:55:15,997] Trial 97 finished with value: 0.0596664291894207 and parameters: {'model_type': 'mlp', 'hidden_dims': '[256, 128, 64]', 'dropout': 0.12853397200198405, 'batch_norm': True, 'lr': 5.462765911278612e-05, 'weight_decay': 3.247188499802057e-05, 'epochs': 261, 'loss': 'mae', 'optimizer': 'adam', 'graph_mode': 'off', 'use_snp_selection': True, 'num_snps': 18195}. Best is trial 71 with value: 0.07073722804276542.
[I 2025-12-05 15:55:17,440] Trial 98 finished with value: 0.02583002298821309 and parameters: {'model_type': 'mlp', 'hidden_dims': '[256, 128, 64]', 'dropout': 0.18998989157228452, 'batch_norm': True, 'lr': 1.4442788105097304e-05, 'weight_decay': 3.7057661641452104e-05, 'epochs': 236, 'loss': 'mae', 'optimizer': 'adam', 'graph_mode': 'off', 'use_snp_selection': True, 'num_snps': 18234}. Best is trial 71 with value: 0.07073722804276542.
[I 2025-12-05 15:55:18,982] Trial 99 finished with value: 0.028760203664813813 and parameters: {'model_type': 'mlp', 'hidden_dims': '[256, 128, 64]', 'dropout': 0.2624841226513296, 'batch_norm': True, 'lr': 9.356603840782937e-05, 'weight_decay': 2.5926641570941944e-05, 'epochs': 265, 'loss': 'mae', 'optimizer': 'adam', 'graph_mode': 'off', 'use_snp_selection': True, 'num_snps': 19990}. Best is trial 71 with value: 0.07073722804276542.
[I 2025-12-05 15:55:20,434] Trial 100 finished with value: 0.04769389627180861 and parameters: {'model_type': 'mlp', 'hidden_dims': '[256, 128, 64]', 'dropout': 0.1320532581291234, 'batch_norm': True, 'lr': 1.82767016336997e-05, 'weight_decay': 5.0701195127474306e-05, 'epochs': 291, 'loss': 'mae', 'optimizer': 'adam', 'graph_mode': 'off', 'use_snp_selection': True, 'num_snps': 15105}. Best is trial 71 with value: 0.07073722804276542.
[I 2025-12-05 15:55:22,837] Trial 101 finished with value: 0.012256934947553408 and parameters: {'model_type': 'mlp', 'hidden_dims': '[256, 128, 64]', 'dropout': 0.1473369648636397, 'batch_norm': True, 'lr': 5.726251510696189e-05, 'weight_decay': 6.574618229921119e-05, 'epochs': 281, 'loss': 'mae', 'optimizer': 'adam', 'graph_mode': 'off', 'use_snp_selection': True, 'num_snps': 48268}. Best is trial 71 with value: 0.07073722804276542.
[I 2025-12-05 15:55:24,412] Trial 102 finished with value: 0.026446896769086372 and parameters: {'model_type': 'mlp', 'hidden_dims': '[512, 64]', 'dropout': 0.10006719551789614, 'batch_norm': True, 'lr': 3.427566742132218e-05, 'weight_decay': 0.0001450140944280534, 'epochs': 258, 'loss': 'mae', 'optimizer': 'adam', 'graph_mode': 'off', 'use_snp_selection': True, 'num_snps': 21105}. Best is trial 71 with value: 0.07073722804276542.
[I 2025-12-05 15:55:26,797] Trial 103 finished with value: 0.03595458126531606 and parameters: {'model_type': 'mlp', 'hidden_dims': '[256, 128]', 'dropout': 0.1629343082992562, 'batch_norm': True, 'lr': 4.489590522550135e-05, 'weight_decay': 0.00011350483497802047, 'epochs': 249, 'loss': 'mae', 'optimizer': 'adam', 'graph_mode': 'off', 'use_snp_selection': True, 'num_snps': 50951}. Best is trial 71 with value: 0.07073722804276542.
[I 2025-12-05 15:55:28,051] Trial 104 finished with value: 0.05175044302119103 and parameters: {'model_type': 'mlp', 'hidden_dims': '[512, 128]', 'dropout': 0.17685014261572415, 'batch_norm': True, 'lr': 2.8928922193834973e-05, 'weight_decay': 3.3215414559941964e-05, 'epochs': 133, 'loss': 'mae', 'optimizer': 'adam', 'graph_mode': 'off', 'use_snp_selection': False}. Best is trial 71 with value: 0.07073722804276542.
[I 2025-12-05 15:55:30,148] Trial 105 finished with value: 0.033381893402242444 and parameters: {'model_type': 'mlp', 'hidden_dims': '[512, 128]', 'dropout': 0.17906602121556703, 'batch_norm': True, 'lr': 0.00043655012076229964, 'weight_decay': 1.063197139082167e-07, 'epochs': 134, 'loss': 'mae', 'optimizer': 'adam', 'graph_mode': 'off', 'use_snp_selection': True, 'num_snps': 40897}. Best is trial 71 with value: 0.07073722804276542.
[I 2025-12-05 15:55:31,411] Trial 106 finished with value: 0.044317029457449426 and parameters: {'model_type': 'mlp', 'hidden_dims': '[512, 128]', 'dropout': 0.22287177893990448, 'batch_norm': True, 'lr': 5.2447685762940467e-05, 'weight_decay': 3.4147892257382376e-05, 'epochs': 151, 'loss': 'mae', 'optimizer': 'adam', 'graph_mode': 'off', 'use_snp_selection': True, 'num_snps': 17789}. Best is trial 71 with value: 0.07073722804276542.
[I 2025-12-05 15:55:33,461] Trial 107 finished with value: 0.03788167273179101 and parameters: {'model_type': 'mlp', 'hidden_dims': '[512, 128]', 'dropout': 0.19425771279059323, 'batch_norm': True, 'lr': 2.7170622609113007e-05, 'weight_decay': 2.3162093124559326e-05, 'epochs': 321, 'loss': 'mse', 'optimizer': 'adam', 'graph_mode': 'off', 'use_snp_selection': False}. Best is trial 71 with value: 0.07073722804276542.
[I 2025-12-05 15:55:35,112] Trial 108 finished with value: 0.05457427284465796 and parameters: {'model_type': 'mlp', 'hidden_dims': '[256, 128, 64]', 'dropout': 0.3124549388744758, 'batch_norm': True, 'lr': 9.505611684278378e-06, 'weight_decay': 0.0004409561569030129, 'epochs': 208, 'loss': 'mae', 'optimizer': 'adam', 'graph_mode': 'off', 'use_snp_selection': True, 'num_snps': 27405}. Best is trial 71 with value: 0.07073722804276542.
[I 2025-12-05 15:55:36,913] Trial 109 finished with value: -0.008809217936533057 and parameters: {'model_type': 'mlp', 'hidden_dims': '[256, 128, 64]', 'dropout': 0.3090441352329854, 'batch_norm': True, 'lr': 8.89005892561006e-06, 'weight_decay': 0.000842271259795121, 'epochs': 300, 'loss': 'mae', 'optimizer': 'adam', 'graph_mode': 'off', 'use_snp_selection': True, 'num_snps': 27386}. Best is trial 71 with value: 0.07073722804276542.
[I 2025-12-05 15:55:38,504] Trial 110 finished with value: 0.010471365182568679 and parameters: {'model_type': 'mlp', 'hidden_dims': '[256, 128, 64]', 'dropout': 0.32526439861607, 'batch_norm': True, 'lr': 1.2948429096812245e-05, 'weight_decay': 0.0005799057662498231, 'epochs': 204, 'loss': 'mae', 'optimizer': 'adam', 'graph_mode': 'off', 'use_snp_selection': True, 'num_snps': 24677}. Best is trial 71 with value: 0.07073722804276542.
[I 2025-12-05 15:55:40,423] Trial 111 finished with value: 0.04445563027226665 and parameters: {'model_type': 'mlp', 'hidden_dims': '[256, 128, 64]', 'dropout': 0.2712146052283877, 'batch_norm': True, 'lr': 1.033265111212172e-05, 'weight_decay': 0.0004346671601492416, 'epochs': 309, 'loss': 'mae', 'optimizer': 'adam', 'graph_mode': 'off', 'use_snp_selection': True, 'num_snps': 30683}. Best is trial 71 with value: 0.07073722804276542.
[I 2025-12-05 15:55:42,197] Trial 112 finished with value: 0.022552534182480617 and parameters: {'model_type': 'mlp', 'hidden_dims': '[512, 128]', 'dropout': 0.2359874040014881, 'batch_norm': True, 'lr': 1.5768158180140033e-05, 'weight_decay': 0.0007294636972836725, 'epochs': 341, 'loss': 'mae', 'optimizer': 'adam', 'graph_mode': 'off', 'use_snp_selection': True, 'num_snps': 23796}. Best is trial 71 with value: 0.07073722804276542.
[I 2025-12-05 15:55:44,075] Trial 113 finished with value: 0.03969681351069284 and parameters: {'model_type': 'mlp', 'hidden_dims': '[256, 128, 64]', 'dropout': 0.3700809346098356, 'batch_norm': True, 'lr': 2.1405145802968375e-05, 'weight_decay': 0.0009767928924687874, 'epochs': 331, 'loss': 'mae', 'optimizer': 'adam', 'graph_mode': 'off', 'use_snp_selection': True, 'num_snps': 28145}. Best is trial 71 with value: 0.07073722804276542.
[I 2025-12-05 15:55:45,547] Trial 114 finished with value: 0.0373990635931233 and parameters: {'model_type': 'mlp', 'hidden_dims': '[512, 64]', 'dropout': 0.21805640808546714, 'batch_norm': True, 'lr': 6.695078407139909e-05, 'weight_decay': 0.00021885439766691566, 'epochs': 252, 'loss': 'mae', 'optimizer': 'adam', 'graph_mode': 'off', 'use_snp_selection': True, 'num_snps': 20640}. Best is trial 71 with value: 0.07073722804276542.
[I 2025-12-05 15:55:47,473] Trial 115 finished with value: 0.03403223405802393 and parameters: {'model_type': 'mlp', 'hidden_dims': '[512, 256]', 'dropout': 0.34043657175254605, 'batch_norm': True, 'lr': 0.00021115681938170015, 'weight_decay': 0.0003875612113695225, 'epochs': 216, 'loss': 'mae', 'optimizer': 'adam', 'graph_mode': 'off', 'use_snp_selection': True, 'num_snps': 32750}. Best is trial 71 with value: 0.07073722804276542.
[I 2025-12-05 15:55:48,338] Trial 116 finished with value: 0.03420221999994155 and parameters: {'model_type': 'mlp', 'hidden_dims': '[256, 128, 64]', 'dropout': 0.2987011043348261, 'batch_norm': True, 'lr': 8.4090571338136e-05, 'weight_decay': 8.287734256932414e-05, 'epochs': 130, 'loss': 'mae', 'optimizer': 'adam', 'graph_mode': 'off', 'use_snp_selection': False}. Best is trial 71 with value: 0.07073722804276542.
[I 2025-12-05 15:55:49,617] Trial 117 finished with value: 0.020661287775666188 and parameters: {'model_type': 'mlp', 'hidden_dims': '[512, 128]', 'dropout': 0.20601924788411366, 'batch_norm': True, 'lr': 2.4668835226687923e-05, 'weight_decay': 1.5489339013713742e-05, 'epochs': 144, 'loss': 'mae', 'optimizer': 'adam', 'graph_mode': 'off', 'use_snp_selection': True, 'num_snps': 18607}. Best is trial 71 with value: 0.07073722804276542.
[I 2025-12-05 15:55:50,764] Trial 118 finished with value: 0.04339655549542368 and parameters: {'model_type': 'mlp', 'hidden_dims': '[256, 128, 64]', 'dropout': 0.24804013399080804, 'batch_norm': True, 'lr': 5.134033814830191e-06, 'weight_decay': 0.0005354189754545435, 'epochs': 165, 'loss': 'mae', 'optimizer': 'adam', 'graph_mode': 'off', 'use_snp_selection': True, 'num_snps': 11972}. Best is trial 71 with value: 0.07073722804276542.
[I 2025-12-05 15:55:51,942] Trial 119 finished with value: 0.016117851917716603 and parameters: {'model_type': 'mlp', 'hidden_dims': '[512, 64]', 'dropout': 0.3193415074388958, 'batch_norm': True, 'lr': 1.847840974131742e-05, 'weight_decay': 3.083127342610085e-05, 'epochs': 108, 'loss': 'mae', 'optimizer': 'adam', 'graph_mode': 'off', 'use_snp_selection': False}. Best is trial 71 with value: 0.07073722804276542.
[I 2025-12-05 15:55:53,556] Trial 120 finished with value: -0.008045924057619246 and parameters: {'model_type': 'mlp', 'hidden_dims': '[256, 128]', 'dropout': 0.18258733334003938, 'batch_norm': True, 'lr': 1.269384060559497e-05, 'weight_decay': 0.00013165389676626053, 'epochs': 275, 'loss': 'mae', 'optimizer': 'adam', 'graph_mode': 'off', 'use_snp_selection': True, 'num_snps': 25392}. Best is trial 71 with value: 0.07073722804276542.
[I 2025-12-05 15:55:54,537] Trial 121 finished with value: 0.016708267983067047 and parameters: {'model_type': 'mlp', 'hidden_dims': '[256, 128]', 'dropout': 0.1685714083674086, 'batch_norm': True, 'lr': 2.9227653443764982e-05, 'weight_decay': 6.384532366150429e-05, 'epochs': 188, 'loss': 'mae', 'optimizer': 'adam', 'graph_mode': 'off', 'use_snp_selection': False}. Best is trial 71 with value: 0.07073722804276542.
[I 2025-12-05 15:55:55,315] Trial 122 finished with value: 0.024982443026890767 and parameters: {'model_type': 'mlp', 'hidden_dims': '[256, 128]', 'dropout': 0.13384014877946127, 'batch_norm': True, 'lr': 4.069813893310157e-05, 'weight_decay': 9.768863993028032e-05, 'epochs': 96, 'loss': 'mae', 'optimizer': 'adam', 'graph_mode': 'off', 'use_snp_selection': False}. Best is trial 71 with value: 0.07073722804276542.
[I 2025-12-05 15:55:56,402] Trial 123 finished with value: 0.033226602064338445 and parameters: {'model_type': 'mlp', 'hidden_dims': '[256, 128]', 'dropout': 0.3858674073261154, 'batch_norm': True, 'lr': 3.550478548636345e-05, 'weight_decay': 0.0002884389560141846, 'epochs': 234, 'loss': 'mae', 'optimizer': 'adam', 'graph_mode': 'off', 'use_snp_selection': False}. Best is trial 71 with value: 0.07073722804276542.
[I 2025-12-05 15:55:57,233] Trial 124 finished with value: 0.03662475408913482 and parameters: {'model_type': 'mlp', 'hidden_dims': '[256, 128]', 'dropout': 0.12321575736530765, 'batch_norm': True, 'lr': 2.9641567797173736e-05, 'weight_decay': 1.1228542209512034e-06, 'epochs': 121, 'loss': 'mae', 'optimizer': 'adam', 'graph_mode': 'off', 'use_snp_selection': False}. Best is trial 71 with value: 0.07073722804276542.
[I 2025-12-05 15:55:58,527] Trial 125 finished with value: 0.03474895708386941 and parameters: {'model_type': 'mlp', 'hidden_dims': '[256, 128]', 'dropout': 0.15556477423298695, 'batch_norm': True, 'lr': 6.998583151145786e-06, 'weight_decay': 4.7392080644863545e-05, 'epochs': 326, 'loss': 'mae', 'optimizer': 'adam', 'graph_mode': 'off', 'use_snp_selection': False}. Best is trial 71 with value: 0.07073722804276542.
[I 2025-12-05 15:55:59,454] Trial 126 finished with value: 0.04650179644205394 and parameters: {'model_type': 'mlp', 'hidden_dims': '[256, 128, 64]', 'dropout': 0.19938094596289116, 'batch_norm': True, 'lr': 1.6365027772663797e-05, 'weight_decay': 0.00015563630881866916, 'epochs': 157, 'loss': 'mse', 'optimizer': 'adam', 'graph_mode': 'off', 'use_snp_selection': False}. Best is trial 71 with value: 0.07073722804276542.
[I 2025-12-05 15:56:00,731] Trial 127 finished with value: 0.014287961568169891 and parameters: {'model_type': 'mlp', 'hidden_dims': '[256, 128]', 'dropout': 0.18939040734519497, 'batch_norm': True, 'lr': 2.226440963602113e-05, 'weight_decay': 5.9827922445912354e-05, 'epochs': 76, 'loss': 'mae', 'optimizer': 'adam', 'graph_mode': 'off', 'use_snp_selection': True, 'num_snps': 23293}. Best is trial 71 with value: 0.07073722804276542.
[I 2025-12-05 15:56:01,868] Trial 128 finished with value: 0.033171412597124285 and parameters: {'model_type': 'mlp', 'hidden_dims': '[512, 128]', 'dropout': 0.17457552973416224, 'batch_norm': True, 'lr': 5.1798239084100155e-05, 'weight_decay': 7.485508915858756e-05, 'epochs': 142, 'loss': 'mae', 'optimizer': 'adam', 'graph_mode': 'off', 'use_snp_selection': True, 'num_snps': 14123}. Best is trial 71 with value: 0.07073722804276542.
[I 2025-12-05 15:56:03,021] Trial 129 finished with value: 0.02787887250637893 and parameters: {'model_type': 'mlp', 'hidden_dims': '[256, 128]', 'dropout': 0.11038115257634515, 'batch_norm': True, 'lr': 3.3069173387206256e-05, 'weight_decay': 0.00011519015837041956, 'epochs': 263, 'loss': 'mae', 'optimizer': 'adam', 'graph_mode': 'off', 'use_snp_selection': False}. Best is trial 71 with value: 0.07073722804276542.
[I 2025-12-05 15:56:04,186] Trial 130 finished with value: 0.049896021353624365 and parameters: {'model_type': 'mlp', 'hidden_dims': '[128, 64]', 'dropout': 0.14081562059549288, 'batch_norm': True, 'lr': 0.00013808583535098045, 'weight_decay': 3.980266445494061e-05, 'epochs': 118, 'loss': 'mae', 'optimizer': 'adam', 'graph_mode': 'off', 'use_snp_selection': True, 'num_snps': 16010}. Best is trial 71 with value: 0.07073722804276542.
[I 2025-12-05 15:56:05,665] Trial 131 finished with value: 0.008200067699174035 and parameters: {'model_type': 'mlp', 'hidden_dims': '[128, 64]', 'dropout': 0.21798184063351367, 'batch_norm': True, 'lr': 2.537359390348995e-05, 'weight_decay': 8.851628165581945e-05, 'epochs': 342, 'loss': 'mae', 'optimizer': 'adam', 'graph_mode': 'off', 'use_snp_selection': True, 'num_snps': 17436}. Best is trial 71 with value: 0.07073722804276542.
[I 2025-12-05 15:56:07,249] Trial 132 finished with value: 0.040136444865346364 and parameters: {'model_type': 'mlp', 'hidden_dims': '[128, 64]', 'dropout': 0.2050790229070426, 'batch_norm': True, 'lr': 4.3372854216808823e-05, 'weight_decay': 4.364726921914732e-05, 'epochs': 333, 'loss': 'mae', 'optimizer': 'adam', 'graph_mode': 'off', 'use_snp_selection': True, 'num_snps': 22042}. Best is trial 71 with value: 0.07073722804276542.
[I 2025-12-05 15:56:09,549] Trial 133 finished with value: 0.01508231636698019 and parameters: {'model_type': 'mlp', 'hidden_dims': '[128, 64]', 'dropout': 0.2119005678679426, 'batch_norm': True, 'lr': 1.670092165609395e-06, 'weight_decay': 2.0491719669344555e-05, 'epochs': 350, 'loss': 'mae', 'optimizer': 'adam', 'graph_mode': 'off', 'use_snp_selection': True, 'num_snps': 45928}. Best is trial 71 with value: 0.07073722804276542.
[I 2025-12-05 15:56:11,581] Trial 134 finished with value: -0.0065398334450407405 and parameters: {'model_type': 'mlp', 'hidden_dims': '[128, 64]', 'dropout': 0.23180435593352527, 'batch_norm': True, 'lr': 9.763489203935719e-06, 'weight_decay': 5.089319850259413e-05, 'epochs': 345, 'loss': 'mae', 'optimizer': 'adam', 'graph_mode': 'off', 'use_snp_selection': True, 'num_snps': 36372}. Best is trial 71 with value: 0.07073722804276542.
[I 2025-12-05 15:56:12,886] Trial 135 finished with value: 0.04821297218606429 and parameters: {'model_type': 'mlp', 'hidden_dims': '[512, 256]', 'dropout': 0.253956854963947, 'batch_norm': True, 'lr': 0.00025571868548662736, 'weight_decay': 2.8964769583586615e-05, 'epochs': 129, 'loss': 'mae', 'optimizer': 'adam', 'graph_mode': 'off', 'use_snp_selection': True, 'num_snps': 19292}. Best is trial 71 with value: 0.07073722804276542.
[I 2025-12-05 15:56:14,743] Trial 136 finished with value: 0.010766360257039927 and parameters: {'model_type': 'mlp', 'hidden_dims': '[512, 64]', 'dropout': 0.16072651599639587, 'batch_norm': False, 'lr': 0.0007347338503661602, 'weight_decay': 0.00018081056928901128, 'epochs': 316, 'loss': 'mae', 'optimizer': 'adam', 'graph_mode': 'off', 'use_snp_selection': True, 'num_snps': 26263}. Best is trial 71 with value: 0.07073722804276542.
[I 2025-12-05 15:56:16,061] Trial 137 finished with value: 0.03677591939629622 and parameters: {'model_type': 'mlp', 'hidden_dims': '[256, 128]', 'dropout': 0.2822803156924325, 'batch_norm': True, 'lr': 1.2366110366521776e-06, 'weight_decay': 1.8555539879676156e-06, 'epochs': 338, 'loss': 'mae', 'optimizer': 'adam', 'graph_mode': 'off', 'use_snp_selection': True, 'num_snps': 10419}. Best is trial 71 with value: 0.07073722804276542.
[I 2025-12-05 15:56:17,372] Trial 138 finished with value: 0.062182791000073796 and parameters: {'model_type': 'mlp', 'hidden_dims': '[256, 128, 64]', 'dropout': 0.1854474279869771, 'batch_norm': True, 'lr': 1.4605570810293204e-05, 'weight_decay': 7.953898303637158e-05, 'epochs': 322, 'loss': 'mae', 'optimizer': 'adam', 'graph_mode': 'off', 'use_snp_selection': False}. Best is trial 71 with value: 0.07073722804276542.
[I 2025-12-05 15:56:18,682] Trial 139 finished with value: 0.006931027604566568 and parameters: {'model_type': 'mlp', 'hidden_dims': '[256, 128, 64]', 'dropout': 0.18620111104689033, 'batch_norm': True, 'lr': 1.1722335879515819e-05, 'weight_decay': 7.66158363520676e-05, 'epochs': 320, 'loss': 'mae', 'optimizer': 'adam', 'graph_mode': 'off', 'use_snp_selection': False}. Best is trial 71 with value: 0.07073722804276542.
[I 2025-12-05 15:56:19,964] Trial 140 finished with value: 0.03616347537559755 and parameters: {'model_type': 'mlp', 'hidden_dims': '[256, 128, 64]', 'dropout': 0.14703475383700176, 'batch_norm': True, 'lr': 1.9995210490699256e-05, 'weight_decay': 5.7998559177728504e-05, 'epochs': 310, 'loss': 'mae', 'optimizer': 'adam', 'graph_mode': 'off', 'use_snp_selection': False}. Best is trial 71 with value: 0.07073722804276542.
[I 2025-12-05 15:56:21,284] Trial 141 finished with value: 0.011271050013742363 and parameters: {'model_type': 'mlp', 'hidden_dims': '[256, 128, 64]', 'dropout': 0.19348099702756225, 'batch_norm': True, 'lr': 1.4190342883450328e-05, 'weight_decay': 3.577727178348467e-05, 'epochs': 324, 'loss': 'mae', 'optimizer': 'adam', 'graph_mode': 'off', 'use_snp_selection': False}. Best is trial 71 with value: 0.07073722804276542.
[I 2025-12-05 15:56:22,638] Trial 142 finished with value: 0.00017882386363675742 and parameters: {'model_type': 'mlp', 'hidden_dims': '[256, 128, 64]', 'dropout': 0.3636499240107071, 'batch_norm': True, 'lr': 1.0001169628039354e-06, 'weight_decay': 9.676555867972192e-05, 'epochs': 330, 'loss': 'mae', 'optimizer': 'adam', 'graph_mode': 'off', 'use_snp_selection': False}. Best is trial 71 with value: 0.07073722804276542.
[I 2025-12-05 15:56:23,830] Trial 143 finished with value: 0.024472928060223022 and parameters: {'model_type': 'mlp', 'hidden_dims': '[256, 128, 64]', 'dropout': 0.16707112589147138, 'batch_norm': True, 'lr': 1.6453335870782446e-05, 'weight_decay': 0.00012888503462383697, 'epochs': 269, 'loss': 'mae', 'optimizer': 'adam', 'graph_mode': 'off', 'use_snp_selection': False}. Best is trial 71 with value: 0.07073722804276542.
