[I 2025-12-06 03:30:37,870] Trial 130 finished with value: 0.3113492491299404 and parameters: {'model_type': 'mlp', 'hidden_dims': '[512, 256]', 'dropout': 0.14590405623765745, 'batch_norm': True, 'lr': 0.0008268362986202074, 'weight_decay': 3.9855889590216985e-05, 'epochs': 83, 'loss': 'mae', 'optimizer': 'adam', 'graph_mode': 'off', 'use_snp_selection': False}. Best is trial 114 with value: 0.3230563431000552.
[I 2025-12-06 03:31:36,270] Trial 131 finished with value: 0.3094938513979075 and parameters: {'model_type': 'mlp', 'hidden_dims': '[512, 256]', 'dropout': 0.2789785434684871, 'batch_norm': True, 'lr': 0.0009969003855962236, 'weight_decay': 0.0001109580439536762, 'epochs': 302, 'loss': 'mae', 'optimizer': 'adam', 'graph_mode': 'off', 'use_snp_selection': False}. Best is trial 114 with value: 0.3230563431000552.
[I 2025-12-06 03:32:21,918] Trial 132 finished with value: 0.3137513921294304 and parameters: {'model_type': 'mlp', 'hidden_dims': '[512, 256]', 'dropout': 0.22796558821389373, 'batch_norm': True, 'lr': 0.0001831306347596282, 'weight_decay': 8.108894701362927e-05, 'epochs': 229, 'loss': 'mae', 'optimizer': 'adam', 'graph_mode': 'off', 'use_snp_selection': False}. Best is trial 114 with value: 0.3230563431000552.
[I 2025-12-06 03:32:44,385] Trial 133 finished with value: 0.30955171076625965 and parameters: {'model_type': 'mlp', 'hidden_dims': '[512, 256]', 'dropout': 0.24646311571068938, 'batch_norm': True, 'lr': 0.0001657758672665028, 'weight_decay': 0.00013194176985276986, 'epochs': 98, 'loss': 'mae', 'optimizer': 'adam', 'graph_mode': 'off', 'use_snp_selection': False}. Best is trial 114 with value: 0.3230563431000552.
[I 2025-12-06 03:33:09,157] Trial 134 finished with value: 0.3147134282085489 and parameters: {'model_type': 'mlp', 'hidden_dims': '[512, 256]', 'dropout': 0.2030645062015781, 'batch_norm': True, 'lr': 0.00024241414262765658, 'weight_decay': 0.00021378417907675165, 'epochs': 111, 'loss': 'mae', 'optimizer': 'adam', 'graph_mode': 'off', 'use_snp_selection': False}. Best is trial 114 with value: 0.3230563431000552.
[I 2025-12-06 03:33:23,905] Trial 135 finished with value: 0.3056880352674691 and parameters: {'model_type': 'mlp', 'hidden_dims': '[512, 256]', 'dropout': 0.26327104619807234, 'batch_norm': True, 'lr': 0.0001498998315921515, 'weight_decay': 0.00010132211277515379, 'epochs': 53, 'loss': 'mae', 'optimizer': 'adam', 'graph_mode': 'off', 'use_snp_selection': False}. Best is trial 114 with value: 0.3230563431000552.
[I 2025-12-06 03:33:36,713] Trial 136 finished with value: 0.3162026312607481 and parameters: {'model_type': 'mlp', 'hidden_dims': '[256, 128, 64]', 'dropout': 0.5894314121987226, 'batch_norm': True, 'lr': 0.00047461781965498, 'weight_decay': 6.365576645275256e-05, 'epochs': 88, 'loss': 'mae', 'optimizer': 'adam', 'graph_mode': 'off', 'use_snp_selection': False}. Best is trial 114 with value: 0.3230563431000552.
[I 2025-12-06 03:33:54,275] Trial 137 finished with value: 0.3156975864533704 and parameters: {'model_type': 'mlp', 'hidden_dims': '[512, 256]', 'dropout': 0.5997864050158006, 'batch_norm': True, 'lr': 0.0003267936567778965, 'weight_decay': 3.356650655169432e-05, 'epochs': 70, 'loss': 'mae', 'optimizer': 'adam', 'graph_mode': 'off', 'use_snp_selection': False}. Best is trial 114 with value: 0.3230563431000552.
[I 2025-12-06 03:34:36,884] Trial 138 finished with value: 0.3034297891090853 and parameters: {'model_type': 'mlp', 'hidden_dims': '[512, 256]', 'dropout': 0.5798911470055834, 'batch_norm': False, 'lr': 0.00010638745443251596, 'weight_decay': 7.868780104208085e-05, 'epochs': 215, 'loss': 'mae', 'optimizer': 'adam', 'graph_mode': 'off', 'use_snp_selection': False}. Best is trial 114 with value: 0.3230563431000552.
[I 2025-12-06 03:34:48,657] Trial 139 finished with value: 0.3138515156264353 and parameters: {'model_type': 'mlp', 'hidden_dims': '[256, 128, 64]', 'dropout': 0.31626351368534206, 'batch_norm': True, 'lr': 0.0006811359353968543, 'weight_decay': 0.000308015226121017, 'epochs': 77, 'loss': 'mae', 'optimizer': 'adam', 'graph_mode': 'off', 'use_snp_selection': False}. Best is trial 114 with value: 0.3230563431000552.
[I 2025-12-06 03:35:38,117] Trial 140 finished with value: 0.31182906362883395 and parameters: {'model_type': 'mlp', 'hidden_dims': '[512, 256]', 'dropout': 0.18811906373581844, 'batch_norm': True, 'lr': 0.00021802339251171773, 'weight_decay': 0.000160387073629166, 'epochs': 251, 'loss': 'mae', 'optimizer': 'adam', 'graph_mode': 'off', 'use_snp_selection': False}. Best is trial 114 with value: 0.3230563431000552.
[I 2025-12-06 03:36:06,875] Trial 141 finished with value: 0.3172893525220343 and parameters: {'model_type': 'mlp', 'hidden_dims': '[512, 128]', 'dropout': 0.5651299151405245, 'batch_norm': True, 'lr': 0.0003482898512279286, 'weight_decay': 4.279704672121238e-05, 'epochs': 134, 'loss': 'mae', 'optimizer': 'adam', 'graph_mode': 'off', 'use_snp_selection': False}. Best is trial 114 with value: 0.3230563431000552.
[I 2025-12-06 03:36:32,980] Trial 142 finished with value: 0.3100562226521256 and parameters: {'model_type': 'mlp', 'hidden_dims': '[512, 128]', 'dropout': 0.5511164344769263, 'batch_norm': True, 'lr': 0.000272554925951366, 'weight_decay': 5.3369115014865636e-05, 'epochs': 119, 'loss': 'mae', 'optimizer': 'adam', 'graph_mode': 'off', 'use_snp_selection': False}. Best is trial 114 with value: 0.3230563431000552.
[I 2025-12-06 03:37:03,843] Trial 143 finished with value: 0.3127997335181263 and parameters: {'model_type': 'mlp', 'hidden_dims': '[512, 128]', 'dropout': 0.5639036780867455, 'batch_norm': True, 'lr': 5.5677993049768294e-05, 'weight_decay': 4.3601645280308785e-05, 'epochs': 146, 'loss': 'mae', 'optimizer': 'adam', 'graph_mode': 'off', 'use_snp_selection': False}. Best is trial 114 with value: 0.3230563431000552.
[I 2025-12-06 03:37:21,122] Trial 144 finished with value: 0.3128424036924121 and parameters: {'model_type': 'mlp', 'hidden_dims': '[256, 128]', 'dropout': 0.5752576279415067, 'batch_norm': True, 'lr': 0.0001876852129186501, 'weight_decay': 2.5014749659296098e-05, 'epochs': 137, 'loss': 'mae', 'optimizer': 'adam', 'graph_mode': 'off', 'use_snp_selection': False}. Best is trial 114 with value: 0.3230563431000552.
[I 2025-12-06 03:37:45,281] Trial 145 finished with value: 0.3126568222855478 and parameters: {'model_type': 'mlp', 'hidden_dims': '[512, 64]', 'dropout': 0.5117619511860062, 'batch_norm': True, 'lr': 0.000413120886052647, 'weight_decay': 6.563210358824124e-05, 'epochs': 108, 'loss': 'mae', 'optimizer': 'adam', 'graph_mode': 'off', 'use_snp_selection': False}. Best is trial 114 with value: 0.3230563431000552.
[I 2025-12-06 03:37:56,494] Trial 146 finished with value: 0.307481494262681 and parameters: {'model_type': 'mlp', 'hidden_dims': '[128, 64]', 'dropout': 0.1656929611646254, 'batch_norm': True, 'lr': 0.0002912976318411107, 'weight_decay': 9.761842573927464e-05, 'epochs': 131, 'loss': 'mae', 'optimizer': 'adam', 'graph_mode': 'off', 'use_snp_selection': False}. Best is trial 114 with value: 0.3230563431000552.
[I 2025-12-06 03:38:12,537] Trial 147 finished with value: 0.31598586238812665 and parameters: {'model_type': 'mlp', 'hidden_dims': '[256, 128, 64]', 'dropout': 0.5839594488934831, 'batch_norm': True, 'lr': 0.0003418268754604806, 'weight_decay': 1.9726481249768745e-05, 'epochs': 123, 'loss': 'mae', 'optimizer': 'adam', 'graph_mode': 'off', 'use_snp_selection': False}. Best is trial 114 with value: 0.3230563431000552.
[I 2025-12-06 03:38:56,042] Trial 148 finished with value: 0.3124081782513465 and parameters: {'model_type': 'mlp', 'hidden_dims': '[512, 256]', 'dropout': 0.5310296593942476, 'batch_norm': True, 'lr': 8.790150204913054e-05, 'weight_decay': 3.0094750159222914e-05, 'epochs': 102, 'loss': 'mse', 'optimizer': 'adam', 'graph_mode': 'off', 'use_snp_selection': True, 'num_snps': 39476}. Best is trial 114 with value: 0.3230563431000552.
[I 2025-12-06 03:39:29,219] Trial 149 finished with value: 0.31258381924581513 and parameters: {'model_type': 'mlp', 'hidden_dims': '[512, 256]', 'dropout': 0.2935574371372126, 'batch_norm': True, 'lr': 0.00023850087992619386, 'weight_decay': 0.0001215070425111289, 'epochs': 159, 'loss': 'mae', 'optimizer': 'adam', 'graph_mode': 'off', 'use_snp_selection': False}. Best is trial 114 with value: 0.3230563431000552.
[I 2025-12-06 03:40:17,902] Trial 0 finished with value: 0.2757067079588912 and parameters: {'model_type': 'mlp', 'hidden_dims': '[128, 64]', 'dropout': 0.199031432379812, 'batch_norm': True, 'lr': 1.8408544111075837e-06, 'weight_decay': 5.5136510071208614e-05, 'epochs': 336, 'loss': 'mae', 'optimizer': 'adam', 'graph_mode': 'off', 'use_snp_selection': True, 'num_snps': 43862}. Best is trial 0 with value: 0.2757067079588912.
[I 2025-12-06 03:40:44,718] Trial 1 finished with value: 0.31039812134586675 and parameters: {'model_type': 'mlp', 'hidden_dims': '[256, 128]', 'dropout': 0.4370668075331726, 'batch_norm': True, 'lr': 7.133471581159139e-05, 'weight_decay': 1.128633586803549e-05, 'epochs': 242, 'loss': 'mae', 'optimizer': 'adam', 'graph_mode': 'off', 'use_snp_selection': False}. Best is trial 1 with value: 0.31039812134586675.
[I 2025-12-06 03:41:11,585] Trial 2 finished with value: 0.26017685164281634 and parameters: {'model_type': 'mlp', 'hidden_dims': '[256, 128, 64]', 'dropout': 0.41314357415569625, 'batch_norm': False, 'lr': 3.952233718592101e-06, 'weight_decay': 0.00026754769258252603, 'epochs': 149, 'loss': 'mse', 'optimizer': 'adam', 'graph_mode': 'off', 'use_snp_selection': True, 'num_snps': 11571}. Best is trial 1 with value: 0.31039812134586675.
[I 2025-12-06 03:42:12,246] Trial 3 finished with value: 0.30613363225913676 and parameters: {'model_type': 'mlp', 'hidden_dims': '[512, 64]', 'dropout': 0.5938127374509361, 'batch_norm': False, 'lr': 5.67704586114731e-06, 'weight_decay': 2.4518087630137052e-05, 'epochs': 320, 'loss': 'mae', 'optimizer': 'adam', 'graph_mode': 'off', 'use_snp_selection': False}. Best is trial 1 with value: 0.31039812134586675.
[I 2025-12-06 03:43:12,943] Trial 4 finished with value: 0.28662127137003834 and parameters: {'model_type': 'mlp', 'hidden_dims': '[512, 128]', 'dropout': 0.25746343592134413, 'batch_norm': True, 'lr': 1.3467657668402788e-06, 'weight_decay': 0.00033087251918647806, 'epochs': 277, 'loss': 'mse', 'optimizer': 'adam', 'graph_mode': 'off', 'use_snp_selection': True, 'num_snps': 36675}. Best is trial 1 with value: 0.31039812134586675.
[I 2025-12-06 03:43:56,352] Trial 5 finished with value: 0.24745492109255446 and parameters: {'model_type': 'mlp', 'hidden_dims': '[512, 64]', 'dropout': 0.38275350994408375, 'batch_norm': True, 'lr': 1.5586664309232824e-06, 'weight_decay': 0.0008227664668621182, 'epochs': 145, 'loss': 'mae', 'optimizer': 'adam', 'graph_mode': 'off', 'use_snp_selection': True, 'num_snps': 32148}. Best is trial 1 with value: 0.31039812134586675.
[I 2025-12-06 03:44:19,066] Trial 6 finished with value: 0.3070359434562785 and parameters: {'model_type': 'mlp', 'hidden_dims': '[256, 128]', 'dropout': 0.3930109900265879, 'batch_norm': False, 'lr': 4.892964372128395e-05, 'weight_decay': 1.5809549317992182e-06, 'epochs': 199, 'loss': 'mse', 'optimizer': 'adam', 'graph_mode': 'off', 'use_snp_selection': False}. Best is trial 1 with value: 0.31039812134586675.
[I 2025-12-06 03:44:41,430] Trial 7 finished with value: 0.3111553428821702 and parameters: {'model_type': 'mlp', 'hidden_dims': '[512, 256]', 'dropout': 0.15343979219678458, 'batch_norm': True, 'lr': 6.234003099047341e-05, 'weight_decay': 3.894760610535477e-07, 'epochs': 97, 'loss': 'mse', 'optimizer': 'adam', 'graph_mode': 'off', 'use_snp_selection': False}. Best is trial 7 with value: 0.3111553428821702.
[I 2025-12-06 03:45:41,469] Trial 8 finished with value: 0.31142799857025 and parameters: {'model_type': 'mlp', 'hidden_dims': '[512, 128]', 'dropout': 0.10743001231661406, 'batch_norm': True, 'lr': 0.00023728538449271062, 'weight_decay': 1.7629071578048637e-05, 'epochs': 312, 'loss': 'mae', 'optimizer': 'adam', 'graph_mode': 'off', 'use_snp_selection': False}. Best is trial 8 with value: 0.31142799857025.
[I 2025-12-06 03:46:17,479] Trial 9 finished with value: 0.3135710794036915 and parameters: {'model_type': 'mlp', 'hidden_dims': '[512, 64]', 'dropout': 0.14505336736221927, 'batch_norm': True, 'lr': 5.8619638388111826e-05, 'weight_decay': 6.200156172669308e-07, 'epochs': 175, 'loss': 'mse', 'optimizer': 'adam', 'graph_mode': 'off', 'use_snp_selection': False}. Best is trial 9 with value: 0.3135710794036915.
[I 2025-12-06 03:46:30,431] Trial 10 finished with value: 0.049223280805735445 and parameters: {'model_type': 'mlp', 'hidden_dims': '[512, 64]', 'dropout': 0.27531666245262887, 'batch_norm': False, 'lr': 0.00032393778075602147, 'weight_decay': 1.1714031539166647e-07, 'epochs': 44, 'loss': 'mse', 'optimizer': 'adam', 'graph_mode': 'off', 'use_snp_selection': False}. Best is trial 9 with value: 0.3135710794036915.
[I 2025-12-06 03:47:13,651] Trial 11 finished with value: 0.31110919909994006 and parameters: {'model_type': 'mlp', 'hidden_dims': '[512, 128]', 'dropout': 0.10095648685224448, 'batch_norm': True, 'lr': 0.0007381466848241802, 'weight_decay': 1.969664044175748e-06, 'epochs': 216, 'loss': 'mae', 'optimizer': 'adam', 'graph_mode': 'off', 'use_snp_selection': False}. Best is trial 9 with value: 0.3135710794036915.
[I 2025-12-06 03:48:08,226] Trial 12 finished with value: 0.31270975980359655 and parameters: {'model_type': 'mlp', 'hidden_dims': '[512, 128]', 'dropout': 0.10344600881777158, 'batch_norm': True, 'lr': 0.00018400807026440393, 'weight_decay': 2.652725854953085e-06, 'epochs': 281, 'loss': 'mae', 'optimizer': 'adam', 'graph_mode': 'off', 'use_snp_selection': False}. Best is trial 9 with value: 0.3135710794036915.
[I 2025-12-06 03:48:25,976] Trial 13 finished with value: 0.2997007482232528 and parameters: {'model_type': 'mlp', 'hidden_dims': '[128, 64]', 'dropout': 0.21612815944527586, 'batch_norm': True, 'lr': 1.537109700844877e-05, 'weight_decay': 2.1978369390547452e-06, 'epochs': 258, 'loss': 'mse', 'optimizer': 'adam', 'graph_mode': 'off', 'use_snp_selection': False}. Best is trial 9 with value: 0.3135710794036915.
[I 2025-12-06 03:48:45,967] Trial 14 finished with value: 0.3085579756474652 and parameters: {'model_type': 'mlp', 'hidden_dims': '[256, 128, 64]', 'dropout': 0.3012984444538551, 'batch_norm': True, 'lr': 0.00017558188744418174, 'weight_decay': 6.0566029709182e-07, 'epochs': 166, 'loss': 'mse', 'optimizer': 'adam', 'graph_mode': 'off', 'use_snp_selection': False}. Best is trial 9 with value: 0.3135710794036915.
[I 2025-12-06 03:49:09,915] Trial 15 finished with value: 0.30380459792607556 and parameters: {'model_type': 'mlp', 'hidden_dims': '[512, 256]', 'dropout': 0.1723492905468449, 'batch_norm': True, 'lr': 1.89989485263331e-05, 'weight_decay': 4.647398975110266e-06, 'epochs': 106, 'loss': 'mae', 'optimizer': 'adam', 'graph_mode': 'off', 'use_snp_selection': False}. Best is trial 9 with value: 0.3135710794036915.
[I 2025-12-06 03:49:54,276] Trial 16 finished with value: 0.3137064454672103 and parameters: {'model_type': 'mlp', 'hidden_dims': '[512, 128]', 'dropout': 0.558513902174278, 'batch_norm': True, 'lr': 0.0001280047128166989, 'weight_decay': 1.0661008213867922e-07, 'epochs': 223, 'loss': 'mae', 'optimizer': 'adam', 'graph_mode': 'off', 'use_snp_selection': False}. Best is trial 16 with value: 0.3137064454672103.
[I 2025-12-06 03:50:39,886] Trial 17 finished with value: 0.30980370330341744 and parameters: {'model_type': 'mlp', 'hidden_dims': '[512, 64]', 'dropout': 0.5283891659645135, 'batch_norm': True, 'lr': 0.000906375209920231, 'weight_decay': 1.198958635100191e-07, 'epochs': 230, 'loss': 'mse', 'optimizer': 'adam', 'graph_mode': 'off', 'use_snp_selection': False}. Best is trial 16 with value: 0.3137064454672103.
[I 2025-12-06 03:51:46,666] Trial 18 finished with value: 0.3015664589854 and parameters: {'model_type': 'mlp', 'hidden_dims': '[512, 128]', 'dropout': 0.4947634265218281, 'batch_norm': False, 'lr': 9.690041249492638e-05, 'weight_decay': 4.29648726200683e-07, 'epochs': 180, 'loss': 'mae', 'optimizer': 'adam', 'graph_mode': 'off', 'use_snp_selection': True, 'num_snps': 58241}. Best is trial 16 with value: 0.3137064454672103.
[I 2025-12-06 03:52:12,729] Trial 19 finished with value: 0.30565701839641063 and parameters: {'model_type': 'mlp', 'hidden_dims': '[512, 64]', 'dropout': 0.32851889164980685, 'batch_norm': True, 'lr': 1.4935446420825526e-05, 'weight_decay': 2.437766456464841e-07, 'epochs': 119, 'loss': 'mse', 'optimizer': 'adam', 'graph_mode': 'off', 'use_snp_selection': False}. Best is trial 16 with value: 0.3137064454672103.
[I 2025-12-06 03:52:19,374] Trial 20 finished with value: 0.29755476053789387 and parameters: {'model_type': 'mlp', 'hidden_dims': '[128, 64]', 'dropout': 0.4808589004780058, 'batch_norm': True, 'lr': 3.421768433287319e-05, 'weight_decay': 1.050160098740219e-06, 'epochs': 43, 'loss': 'mse', 'optimizer': 'adam', 'graph_mode': 'off', 'use_snp_selection': False}. Best is trial 16 with value: 0.3137064454672103.
[I 2025-12-06 03:53:13,681] Trial 21 finished with value: 0.31209469262532435 and parameters: {'model_type': 'mlp', 'hidden_dims': '[512, 128]', 'dropout': 0.1439060887486503, 'batch_norm': True, 'lr': 0.00014517890472940596, 'weight_decay': 4.187801933117563e-06, 'epochs': 280, 'loss': 'mae', 'optimizer': 'adam', 'graph_mode': 'off', 'use_snp_selection': False}. Best is trial 16 with value: 0.3137064454672103.
[I 2025-12-06 03:53:54,340] Trial 22 finished with value: 0.31065218556162133 and parameters: {'model_type': 'mlp', 'hidden_dims': '[512, 128]', 'dropout': 0.5702831628429704, 'batch_norm': True, 'lr': 0.0004249728164389178, 'weight_decay': 2.4532545220295074e-07, 'epochs': 202, 'loss': 'mae', 'optimizer': 'adam', 'graph_mode': 'off', 'use_snp_selection': False}. Best is trial 16 with value: 0.3137064454672103.
[I 2025-12-06 03:54:49,451] Trial 23 finished with value: 0.3088802374928525 and parameters: {'model_type': 'mlp', 'hidden_dims': '[512, 128]', 'dropout': 0.23070381072043317, 'batch_norm': True, 'lr': 0.00011570524303282373, 'weight_decay': 7.087127902008196e-07, 'epochs': 284, 'loss': 'mae', 'optimizer': 'adam', 'graph_mode': 'off', 'use_snp_selection': False}. Best is trial 16 with value: 0.3137064454672103.
[I 2025-12-06 03:55:39,242] Trial 24 finished with value: 0.3110392031793221 and parameters: {'model_type': 'mlp', 'hidden_dims': '[512, 128]', 'dropout': 0.12932822753058773, 'batch_norm': True, 'lr': 0.00043860359835687303, 'weight_decay': 2.3456863125399286e-07, 'epochs': 254, 'loss': 'mae', 'optimizer': 'adam', 'graph_mode': 'off', 'use_snp_selection': False}. Best is trial 16 with value: 0.3137064454672103.
[I 2025-12-06 03:56:37,369] Trial 25 finished with value: 0.31232166321478566 and parameters: {'model_type': 'mlp', 'hidden_dims': '[512, 256]', 'dropout': 0.18525461778732777, 'batch_norm': True, 'lr': 3.775256329745003e-05, 'weight_decay': 5.470041242711598e-06, 'epochs': 300, 'loss': 'mae', 'optimizer': 'adam', 'graph_mode': 'off', 'use_snp_selection': False}. Best is trial 16 with value: 0.3137064454672103.
[I 2025-12-06 03:57:00,850] Trial 26 finished with value: 0.2808183511211218 and parameters: {'model_type': 'mlp', 'hidden_dims': '[256, 128]', 'dropout': 0.32031033288173405, 'batch_norm': True, 'lr': 0.00020974826712789795, 'weight_decay': 1.0010054656330368e-07, 'epochs': 225, 'loss': 'mae', 'optimizer': 'adam', 'graph_mode': 'off', 'use_snp_selection': True, 'num_snps': 3842}. Best is trial 16 with value: 0.3137064454672103.
[I 2025-12-06 03:57:21,446] Trial 27 finished with value: 0.3029073242407757 and parameters: {'model_type': 'mlp', 'hidden_dims': '[256, 128, 64]', 'dropout': 0.3532063163211805, 'batch_norm': False, 'lr': 2.3091343161233495e-05, 'weight_decay': 9.830800292945214e-07, 'epochs': 176, 'loss': 'mae', 'optimizer': 'adam', 'graph_mode': 'off', 'use_snp_selection': False}. Best is trial 16 with value: 0.3137064454672103.
[I 2025-12-06 03:58:11,067] Trial 28 finished with value: 0.30725313474866656 and parameters: {'model_type': 'mlp', 'hidden_dims': '[512, 64]', 'dropout': 0.2431107788192312, 'batch_norm': True, 'lr': 9.568559894915624e-05, 'weight_decay': 5.849334932829311e-05, 'epochs': 254, 'loss': 'mse', 'optimizer': 'adam', 'graph_mode': 'off', 'use_snp_selection': False}. Best is trial 16 with value: 0.3137064454672103.
[I 2025-12-06 03:58:43,248] Trial 29 finished with value: 0.2843678091095434 and parameters: {'model_type': 'mlp', 'hidden_dims': '[128, 64]', 'dropout': 0.192785698866823, 'batch_norm': True, 'lr': 1.0117459057942805e-05, 'weight_decay': 5.5227103357724904e-05, 'epochs': 333, 'loss': 'mae', 'optimizer': 'adam', 'graph_mode': 'off', 'use_snp_selection': True, 'num_snps': 19468}. Best is trial 16 with value: 0.3137064454672103.
[I 2025-12-06 03:59:12,316] Trial 30 finished with value: 0.3140119736694639 and parameters: {'model_type': 'mlp', 'hidden_dims': '[512, 128]', 'dropout': 0.4485007649909121, 'batch_norm': True, 'lr': 6.371797711530363e-05, 'weight_decay': 1.8761058442647585e-07, 'epochs': 136, 'loss': 'mae', 'optimizer': 'adam', 'graph_mode': 'off', 'use_snp_selection': False}. Best is trial 30 with value: 0.3140119736694639.
[I 2025-12-06 03:59:31,231] Trial 31 finished with value: 0.3055326276816285 and parameters: {'model_type': 'mlp', 'hidden_dims': '[512, 128]', 'dropout': 0.46433940527395196, 'batch_norm': True, 'lr': 6.61989479590398e-05, 'weight_decay': 2.1189337310228913e-07, 'epochs': 78, 'loss': 'mae', 'optimizer': 'adam', 'graph_mode': 'off', 'use_snp_selection': False}. Best is trial 30 with value: 0.3140119736694639.
