[I 2025-12-05 16:21:15,748] Trial 13 finished with value: 0.08298593470136283 and parameters: {'model_type': 'mlp', 'hidden_dims': '[512, 128]', 'dropout': 0.5982500509908173, 'batch_norm': True, 'lr': 0.00020263148232071683, 'weight_decay': 1.3270569831995856e-07, 'epochs': 285, 'loss': 'mae', 'optimizer': 'adam', 'graph_mode': 'off', 'use_snp_selection': False}. Best is trial 8 with value: 0.11272539229308953.
[I 2025-12-05 16:21:17,500] Trial 14 finished with value: 0.09564013036546602 and parameters: {'model_type': 'mlp', 'hidden_dims': '[512, 128]', 'dropout': 0.3012984444538551, 'batch_norm': True, 'lr': 0.000922330603992367, 'weight_decay': 5.724103314313124e-05, 'epochs': 284, 'loss': 'mae', 'optimizer': 'adam', 'graph_mode': 'off', 'use_snp_selection': False}. Best is trial 8 with value: 0.11272539229308953.
[I 2025-12-05 16:21:19,046] Trial 15 finished with value: 0.07735145256104119 and parameters: {'model_type': 'mlp', 'hidden_dims': '[512, 128]', 'dropout': 0.5007053064244442, 'batch_norm': True, 'lr': 0.00018429018027102804, 'weight_decay': 3.4756887075882723e-06, 'epochs': 231, 'loss': 'mae', 'optimizer': 'adam', 'graph_mode': 'off', 'use_snp_selection': False}. Best is trial 8 with value: 0.11272539229308953.
[I 2025-12-05 16:21:20,354] Trial 16 finished with value: 0.038771438899717396 and parameters: {'model_type': 'mlp', 'hidden_dims': '[256, 128, 64]', 'dropout': 0.5018277706612104, 'batch_norm': True, 'lr': 1.2586985041154999e-05, 'weight_decay': 2.1685692407459168e-05, 'epochs': 350, 'loss': 'mae', 'optimizer': 'adam', 'graph_mode': 'off', 'use_snp_selection': False}. Best is trial 8 with value: 0.11272539229308953.
[I 2025-12-05 16:21:21,309] Trial 17 finished with value: 0.08616546200847369 and parameters: {'model_type': 'mlp', 'hidden_dims': '[128, 64]', 'dropout': 0.10230308008198463, 'batch_norm': True, 'lr': 0.0001700155970829766, 'weight_decay': 8.239060085464661e-05, 'epochs': 306, 'loss': 'mae', 'optimizer': 'adam', 'graph_mode': 'off', 'use_snp_selection': False}. Best is trial 8 with value: 0.11272539229308953.
[I 2025-12-05 16:21:24,409] Trial 18 finished with value: 0.07737021427012346 and parameters: {'model_type': 'mlp', 'hidden_dims': '[512, 256]', 'dropout': 0.33126133605940894, 'batch_norm': False, 'lr': 0.0009897362511876527, 'weight_decay': 9.994312378900002e-07, 'epochs': 263, 'loss': 'mae', 'optimizer': 'adam', 'graph_mode': 'off', 'use_snp_selection': True, 'num_snps': 58241}. Best is trial 8 with value: 0.11272539229308953.
[I 2025-12-05 16:21:25,924] Trial 19 finished with value: 0.07808871041963733 and parameters: {'model_type': 'mlp', 'hidden_dims': '[512, 128]', 'dropout': 0.23740597688310255, 'batch_norm': True, 'lr': 2.2789757615406074e-05, 'weight_decay': 7.0039813804930875e-06, 'epochs': 209, 'loss': 'mae', 'optimizer': 'adam', 'graph_mode': 'off', 'use_snp_selection': False}. Best is trial 8 with value: 0.11272539229308953.
[I 2025-12-05 16:21:27,768] Trial 20 finished with value: 0.09296850582985744 and parameters: {'model_type': 'mlp', 'hidden_dims': '[512, 128]', 'dropout': 0.5413334066271338, 'batch_norm': True, 'lr': 0.0003516836857329344, 'weight_decay': 2.571313541430049e-07, 'epochs': 311, 'loss': 'mae', 'optimizer': 'adam', 'graph_mode': 'off', 'use_snp_selection': False}. Best is trial 8 with value: 0.11272539229308953.
[I 2025-12-05 16:21:28,844] Trial 21 finished with value: 0.09482259337887194 and parameters: {'model_type': 'mlp', 'hidden_dims': '[256, 128]', 'dropout': 0.4740555416491643, 'batch_norm': True, 'lr': 0.00040788576747199934, 'weight_decay': 6.578868625366523e-06, 'epochs': 243, 'loss': 'mae', 'optimizer': 'adam', 'graph_mode': 'off', 'use_snp_selection': False}. Best is trial 8 with value: 0.11272539229308953.
[I 2025-12-05 16:21:29,929] Trial 22 finished with value: 0.06238716647178152 and parameters: {'model_type': 'mlp', 'hidden_dims': '[256, 128]', 'dropout': 0.5447308805905808, 'batch_norm': True, 'lr': 0.00013125309290784544, 'weight_decay': 1.8626571855937e-05, 'epochs': 259, 'loss': 'mae', 'optimizer': 'adam', 'graph_mode': 'off', 'use_snp_selection': False}. Best is trial 8 with value: 0.11272539229308953.
[I 2025-12-05 16:21:31,079] Trial 23 finished with value: 0.10114147816852442 and parameters: {'model_type': 'mlp', 'hidden_dims': '[256, 128]', 'dropout': 0.45283025644932395, 'batch_norm': True, 'lr': 0.0004478392744756941, 'weight_decay': 2.8870339088415813e-06, 'epochs': 291, 'loss': 'mae', 'optimizer': 'adam', 'graph_mode': 'off', 'use_snp_selection': False}. Best is trial 8 with value: 0.11272539229308953.
[I 2025-12-05 16:21:32,899] Trial 24 finished with value: 0.08961167763653277 and parameters: {'model_type': 'mlp', 'hidden_dims': '[512, 128]', 'dropout': 0.3461314615152318, 'batch_norm': True, 'lr': 0.0006786862090715042, 'weight_decay': 2.188050206409727e-06, 'epochs': 304, 'loss': 'mae', 'optimizer': 'adam', 'graph_mode': 'off', 'use_snp_selection': False}. Best is trial 8 with value: 0.11272539229308953.
[I 2025-12-05 16:21:34,824] Trial 25 finished with value: 0.09454566772701159 and parameters: {'model_type': 'mlp', 'hidden_dims': '[512, 256]', 'dropout': 0.4624930722306132, 'batch_norm': True, 'lr': 0.0002763369915810005, 'weight_decay': 1.0077734665942408e-06, 'epochs': 330, 'loss': 'mae', 'optimizer': 'adam', 'graph_mode': 'off', 'use_snp_selection': False}. Best is trial 8 with value: 0.11272539229308953.
[I 2025-12-05 16:21:35,905] Trial 26 finished with value: 0.010136236394237842 and parameters: {'model_type': 'mlp', 'hidden_dims': '[256, 128, 64]', 'dropout': 0.552979371332105, 'batch_norm': True, 'lr': 0.00014032165783338225, 'weight_decay': 3.999435921299007e-06, 'epochs': 295, 'loss': 'mae', 'optimizer': 'adam', 'graph_mode': 'off', 'use_snp_selection': True, 'num_snps': 3842}. Best is trial 8 with value: 0.11272539229308953.
[I 2025-12-05 16:21:36,652] Trial 27 finished with value: 0.07307274914672857 and parameters: {'model_type': 'mlp', 'hidden_dims': '[128, 64]', 'dropout': 0.43063949746996977, 'batch_norm': False, 'lr': 9.0111761328112e-05, 'weight_decay': 1.2599298020215047e-05, 'epochs': 213, 'loss': 'mse', 'optimizer': 'adam', 'graph_mode': 'off', 'use_snp_selection': False}. Best is trial 8 with value: 0.11272539229308953.
[I 2025-12-05 16:21:37,925] Trial 28 finished with value: 0.09945548758614577 and parameters: {'model_type': 'mlp', 'hidden_dims': '[256, 128]', 'dropout': 0.36996611101945165, 'batch_norm': True, 'lr': 0.0006429127789572331, 'weight_decay': 3.393752840534379e-05, 'epochs': 350, 'loss': 'mae', 'optimizer': 'adam', 'graph_mode': 'off', 'use_snp_selection': False}. Best is trial 8 with value: 0.11272539229308953.
[I 2025-12-05 16:21:39,273] Trial 29 finished with value: 0.0587923611914501 and parameters: {'model_type': 'mlp', 'hidden_dims': '[128, 64]', 'dropout': 0.195060435693097, 'batch_norm': True, 'lr': 2.901200083872717e-05, 'weight_decay': 0.00010774073487650296, 'epochs': 263, 'loss': 'mae', 'optimizer': 'adam', 'graph_mode': 'off', 'use_snp_selection': True, 'num_snps': 19468}. Best is trial 8 with value: 0.11272539229308953.
[I 2025-12-05 16:21:41,182] Trial 30 finished with value: 0.07954865286311054 and parameters: {'model_type': 'mlp', 'hidden_dims': '[512, 128]', 'dropout': 0.4763013634894435, 'batch_norm': True, 'lr': 0.0003220026703678642, 'weight_decay': 1.6086554048019763e-06, 'epochs': 327, 'loss': 'mae', 'optimizer': 'adam', 'graph_mode': 'off', 'use_snp_selection': False}. Best is trial 8 with value: 0.11272539229308953.
[I 2025-12-05 16:21:42,204] Trial 31 finished with value: 0.07859888731474085 and parameters: {'model_type': 'mlp', 'hidden_dims': '[256, 128]', 'dropout': 0.5099193564628004, 'batch_norm': True, 'lr': 0.000663861514319615, 'weight_decay': 6.95275926978121e-06, 'epochs': 229, 'loss': 'mae', 'optimizer': 'adam', 'graph_mode': 'off', 'use_snp_selection': False}. Best is trial 8 with value: 0.11272539229308953.
[I 2025-12-05 16:21:43,262] Trial 32 finished with value: 0.10180991166041162 and parameters: {'model_type': 'mlp', 'hidden_dims': '[256, 128]', 'dropout': 0.4462879085036503, 'batch_norm': True, 'lr': 0.00024863784307749704, 'weight_decay': 1.1777263686279508e-05, 'epochs': 247, 'loss': 'mae', 'optimizer': 'adam', 'graph_mode': 'off', 'use_snp_selection': False}. Best is trial 8 with value: 0.11272539229308953.
[I 2025-12-05 16:21:44,366] Trial 33 finished with value: 0.11481403501753586 and parameters: {'model_type': 'mlp', 'hidden_dims': '[256, 128]', 'dropout': 0.4044646824517565, 'batch_norm': True, 'lr': 0.0002556032902583251, 'weight_decay': 1.28707172412522e-05, 'epochs': 263, 'loss': 'mae', 'optimizer': 'adam', 'graph_mode': 'off', 'use_snp_selection': False}. Best is trial 33 with value: 0.11481403501753586.
[I 2025-12-05 16:21:45,459] Trial 34 finished with value: 0.07726881934324156 and parameters: {'model_type': 'mlp', 'hidden_dims': '[256, 128]', 'dropout': 0.4191253991323798, 'batch_norm': True, 'lr': 9.71964911018051e-05, 'weight_decay': 3.738641035212237e-05, 'epochs': 262, 'loss': 'mae', 'optimizer': 'adam', 'graph_mode': 'off', 'use_snp_selection': False}. Best is trial 33 with value: 0.11481403501753586.
[I 2025-12-05 16:21:46,356] Trial 35 finished with value: 0.07264668285075657 and parameters: {'model_type': 'mlp', 'hidden_dims': '[256, 128]', 'dropout': 0.3103611647551972, 'batch_norm': False, 'lr': 0.00022143043217420102, 'weight_decay': 1.7479081285587815e-05, 'epochs': 174, 'loss': 'mae', 'optimizer': 'adam', 'graph_mode': 'off', 'use_snp_selection': False}. Best is trial 33 with value: 0.11481403501753586.
[I 2025-12-05 16:21:49,420] Trial 36 finished with value: 0.05710666772289689 and parameters: {'model_type': 'mlp', 'hidden_dims': '[512, 64]', 'dropout': 0.40554621351178893, 'batch_norm': True, 'lr': 1.029382153849406e-05, 'weight_decay': 1.0790418145538028e-05, 'epochs': 250, 'loss': 'mse', 'optimizer': 'adam', 'graph_mode': 'off', 'use_snp_selection': True, 'num_snps': 58661}. Best is trial 33 with value: 0.11481403501753586.
[I 2025-12-05 16:21:50,625] Trial 37 finished with value: -0.02488294326148624 and parameters: {'model_type': 'mlp', 'hidden_dims': '[256, 128, 64]', 'dropout': 0.570894109802024, 'batch_norm': True, 'lr': 2.814873948011466e-06, 'weight_decay': 0.00019778176545949143, 'epochs': 272, 'loss': 'mae', 'optimizer': 'adam', 'graph_mode': 'off', 'use_snp_selection': False}. Best is trial 33 with value: 0.11481403501753586.
[I 2025-12-05 16:21:51,947] Trial 38 finished with value: 0.0740980026236624 and parameters: {'model_type': 'mlp', 'hidden_dims': '[512, 128]', 'dropout': 0.22738947122183073, 'batch_norm': False, 'lr': 0.00010802697839274871, 'weight_decay': 3.810994050147065e-05, 'epochs': 222, 'loss': 'mse', 'optimizer': 'adam', 'graph_mode': 'off', 'use_snp_selection': True, 'num_snps': 19911}. Best is trial 33 with value: 0.11481403501753586.
[I 2025-12-05 16:21:52,865] Trial 39 finished with value: 0.08822997630350143 and parameters: {'model_type': 'mlp', 'hidden_dims': '[256, 128]', 'dropout': 0.3746739602154777, 'batch_norm': True, 'lr': 0.0002732923000283222, 'weight_decay': 4.469898817785351e-06, 'epochs': 179, 'loss': 'mae', 'optimizer': 'adam', 'graph_mode': 'off', 'use_snp_selection': False}. Best is trial 33 with value: 0.11481403501753586.
[I 2025-12-05 16:21:54,574] Trial 40 finished with value: 0.0987057465550611 and parameters: {'model_type': 'mlp', 'hidden_dims': '[512, 64]', 'dropout': 0.4510346469780614, 'batch_norm': True, 'lr': 0.0006451629167997905, 'weight_decay': 1.373845848704248e-05, 'epochs': 276, 'loss': 'mse', 'optimizer': 'adam', 'graph_mode': 'off', 'use_snp_selection': False}. Best is trial 33 with value: 0.11481403501753586.
[I 2025-12-05 16:21:55,737] Trial 41 finished with value: 0.09228061778018165 and parameters: {'model_type': 'mlp', 'hidden_dims': '[256, 128]', 'dropout': 0.4350363943894364, 'batch_norm': True, 'lr': 0.0004881712429332527, 'weight_decay': 4.845201662739513e-06, 'epochs': 295, 'loss': 'mae', 'optimizer': 'adam', 'graph_mode': 'off', 'use_snp_selection': False}. Best is trial 33 with value: 0.11481403501753586.
[I 2025-12-05 16:21:56,955] Trial 42 finished with value: 0.09532016333916692 and parameters: {'model_type': 'mlp', 'hidden_dims': '[256, 128]', 'dropout': 0.3996414961699289, 'batch_norm': True, 'lr': 0.00025470189134531133, 'weight_decay': 2.222408212491668e-06, 'epochs': 323, 'loss': 'mae', 'optimizer': 'adam', 'graph_mode': 'off', 'use_snp_selection': False}. Best is trial 33 with value: 0.11481403501753586.
[I 2025-12-05 16:21:58,143] Trial 43 finished with value: 0.08776939958306475 and parameters: {'model_type': 'mlp', 'hidden_dims': '[256, 128]', 'dropout': 0.5146822109366193, 'batch_norm': True, 'lr': 0.0004912241843567039, 'weight_decay': 1.0561168277331617e-05, 'epochs': 297, 'loss': 'mae', 'optimizer': 'adam', 'graph_mode': 'off', 'use_snp_selection': False}. Best is trial 33 with value: 0.11481403501753586.
[I 2025-12-05 16:21:59,346] Trial 44 finished with value: 0.07841220001897697 and parameters: {'model_type': 'mlp', 'hidden_dims': '[256, 128]', 'dropout': 0.4645425274504781, 'batch_norm': True, 'lr': 4.533868514823557e-05, 'weight_decay': 3.111920540676732e-05, 'epochs': 316, 'loss': 'mae', 'optimizer': 'adam', 'graph_mode': 'off', 'use_snp_selection': False}. Best is trial 33 with value: 0.11481403501753586.
[I 2025-12-05 16:22:00,487] Trial 45 finished with value: 0.09624204971020445 and parameters: {'model_type': 'mlp', 'hidden_dims': '[512, 256]', 'dropout': 0.4839571471105453, 'batch_norm': True, 'lr': 0.0001470947639793484, 'weight_decay': 2.7452341733258377e-06, 'epochs': 127, 'loss': 'mae', 'optimizer': 'adam', 'graph_mode': 'off', 'use_snp_selection': False}. Best is trial 33 with value: 0.11481403501753586.
[I 2025-12-05 16:22:02,074] Trial 46 finished with value: 0.06472235170187927 and parameters: {'model_type': 'mlp', 'hidden_dims': '[512, 128]', 'dropout': 0.5267579555646982, 'batch_norm': False, 'lr': 0.0008482170257649862, 'weight_decay': 5.7159923293913654e-05, 'epochs': 248, 'loss': 'mae', 'optimizer': 'adam', 'graph_mode': 'off', 'use_snp_selection': False}. Best is trial 33 with value: 0.11481403501753586.
[I 2025-12-05 16:22:03,199] Trial 47 finished with value: 0.07091646419955708 and parameters: {'model_type': 'mlp', 'hidden_dims': '[256, 128]', 'dropout': 0.4434033873922702, 'batch_norm': True, 'lr': 7.639727437279267e-05, 'weight_decay': 1.0964994531315277e-06, 'epochs': 279, 'loss': 'mae', 'optimizer': 'adam', 'graph_mode': 'off', 'use_snp_selection': False}. Best is trial 33 with value: 0.11481403501753586.
[I 2025-12-05 16:22:04,952] Trial 48 finished with value: 0.08688213028204436 and parameters: {'model_type': 'mlp', 'hidden_dims': '[512, 128]', 'dropout': 0.5643343787527948, 'batch_norm': True, 'lr': 0.0003635758037329379, 'weight_decay': 0.0006963874766430621, 'epochs': 286, 'loss': 'mae', 'optimizer': 'adam', 'graph_mode': 'off', 'use_snp_selection': False}. Best is trial 33 with value: 0.11481403501753586.
[I 2025-12-05 16:22:06,783] Trial 49 finished with value: 0.10605482691229157 and parameters: {'model_type': 'mlp', 'hidden_dims': '[128, 64]', 'dropout': 0.36066800357857753, 'batch_norm': True, 'lr': 0.00021071553006155627, 'weight_decay': 6.308336234489913e-07, 'epochs': 48, 'loss': 'mse', 'optimizer': 'adam', 'graph_mode': 'off', 'use_snp_selection': True, 'num_snps': 46888}. Best is trial 33 with value: 0.11481403501753586.
[I 2025-12-05 16:22:08,639] Trial 50 finished with value: 0.09727411658610882 and parameters: {'model_type': 'mlp', 'hidden_dims': '[128, 64]', 'dropout': 0.3593142662913703, 'batch_norm': True, 'lr': 0.0001698331028450751, 'weight_decay': 4.830936308591571e-07, 'epochs': 74, 'loss': 'mse', 'optimizer': 'adam', 'graph_mode': 'off', 'use_snp_selection': True, 'num_snps': 46345}. Best is trial 33 with value: 0.11481403501753586.
[I 2025-12-05 16:22:10,468] Trial 51 finished with value: 0.08049289135545339 and parameters: {'model_type': 'mlp', 'hidden_dims': '[128, 64]', 'dropout': 0.3322732371813225, 'batch_norm': True, 'lr': 0.00026124991627912085, 'weight_decay': 1.4249471514761842e-07, 'epochs': 42, 'loss': 'mse', 'optimizer': 'adam', 'graph_mode': 'off', 'use_snp_selection': True, 'num_snps': 47105}. Best is trial 33 with value: 0.11481403501753586.
[I 2025-12-05 16:22:11,712] Trial 52 finished with value: 0.07881743586952844 and parameters: {'model_type': 'mlp', 'hidden_dims': '[128, 64]', 'dropout': 0.388558264337891, 'batch_norm': True, 'lr': 0.00020270285170411346, 'weight_decay': 6.965916990415438e-07, 'epochs': 103, 'loss': 'mse', 'optimizer': 'adam', 'graph_mode': 'off', 'use_snp_selection': True, 'num_snps': 22057}. Best is trial 33 with value: 0.11481403501753586.
[I 2025-12-05 16:22:13,424] Trial 53 finished with value: 0.10558947150747754 and parameters: {'model_type': 'mlp', 'hidden_dims': '[128, 64]', 'dropout': 0.4146158423591071, 'batch_norm': True, 'lr': 0.0005199893628045386, 'weight_decay': 2.52730672041443e-07, 'epochs': 155, 'loss': 'mse', 'optimizer': 'adam', 'graph_mode': 'off', 'use_snp_selection': True, 'num_snps': 37397}. Best is trial 33 with value: 0.11481403501753586.
[I 2025-12-05 16:22:15,097] Trial 54 finished with value: 0.08862721844585188 and parameters: {'model_type': 'mlp', 'hidden_dims': '[128, 64]', 'dropout': 0.29458966337312353, 'batch_norm': True, 'lr': 0.000594293178062338, 'weight_decay': 2.827719793130673e-07, 'epochs': 147, 'loss': 'mse', 'optimizer': 'adam', 'graph_mode': 'off', 'use_snp_selection': True, 'num_snps': 36098}. Best is trial 33 with value: 0.11481403501753586.
[I 2025-12-05 16:22:16,992] Trial 55 finished with value: 0.0826406791194691 and parameters: {'model_type': 'mlp', 'hidden_dims': '[128, 64]', 'dropout': 0.41913648719928187, 'batch_norm': True, 'lr': 0.0003321171170771539, 'weight_decay': 2.0939816028920823e-07, 'epochs': 190, 'loss': 'mse', 'optimizer': 'adam', 'graph_mode': 'off', 'use_snp_selection': True, 'num_snps': 41296}. Best is trial 33 with value: 0.11481403501753586.
[I 2025-12-05 16:22:19,181] Trial 56 finished with value: 0.08996419345508927 and parameters: {'model_type': 'mlp', 'hidden_dims': '[128, 64]', 'dropout': 0.27129113097093904, 'batch_norm': True, 'lr': 0.00011796301315675911, 'weight_decay': 3.3964418550249825e-07, 'epochs': 162, 'loss': 'mse', 'optimizer': 'adam', 'graph_mode': 'off', 'use_snp_selection': True, 'num_snps': 53221}. Best is trial 33 with value: 0.11481403501753586.
[I 2025-12-05 16:22:20,646] Trial 57 finished with value: 0.009390151959551543 and parameters: {'model_type': 'mlp', 'hidden_dims': '[512, 128]', 'dropout': 0.12940797213705535, 'batch_norm': False, 'lr': 0.0008593655363406374, 'weight_decay': 2.3930843339293727e-05, 'epochs': 122, 'loss': 'mse', 'optimizer': 'adam', 'graph_mode': 'off', 'use_snp_selection': True, 'num_snps': 25744}. Best is trial 33 with value: 0.11481403501753586.
[I 2025-12-05 16:22:22,758] Trial 58 finished with value: 0.06728400382113581 and parameters: {'model_type': 'mlp', 'hidden_dims': '[256, 128, 64]', 'dropout': 0.34811347260462144, 'batch_norm': True, 'lr': 0.00040438191183145945, 'weight_decay': 1.6139406775110432e-07, 'epochs': 66, 'loss': 'mse', 'optimizer': 'adam', 'graph_mode': 'off', 'use_snp_selection': True, 'num_snps': 53275}. Best is trial 33 with value: 0.11481403501753586.
[I 2025-12-05 16:22:24,280] Trial 59 finished with value: 0.08652316986947774 and parameters: {'model_type': 'mlp', 'hidden_dims': '[128, 64]', 'dropout': 0.32315843495698393, 'batch_norm': True, 'lr': 5.866767293316692e-05, 'weight_decay': 5.882945394392747e-07, 'epochs': 202, 'loss': 'mse', 'optimizer': 'adam', 'graph_mode': 'off', 'use_snp_selection': True, 'num_snps': 28180}. Best is trial 33 with value: 0.11481403501753586.
[I 2025-12-05 16:22:26,473] Trial 60 finished with value: 0.10368647243701933 and parameters: {'model_type': 'mlp', 'hidden_dims': '[512, 64]', 'dropout': 0.19756186704423856, 'batch_norm': True, 'lr': 0.0002023611963813779, 'weight_decay': 1.1202915656472512e-07, 'epochs': 228, 'loss': 'mse', 'optimizer': 'adam', 'graph_mode': 'off', 'use_snp_selection': True, 'num_snps': 39541}. Best is trial 33 with value: 0.11481403501753586.
[I 2025-12-05 16:22:28,621] Trial 61 finished with value: 0.10674686729703314 and parameters: {'model_type': 'mlp', 'hidden_dims': '[512, 64]', 'dropout': 0.1707057651200313, 'batch_norm': True, 'lr': 0.00020246322121593918, 'weight_decay': 1.1513350011646275e-07, 'epochs': 234, 'loss': 'mse', 'optimizer': 'adam', 'graph_mode': 'off', 'use_snp_selection': True, 'num_snps': 38449}. Best is trial 33 with value: 0.11481403501753586.
[I 2025-12-05 16:22:30,742] Trial 62 finished with value: 0.11215052539715341 and parameters: {'model_type': 'mlp', 'hidden_dims': '[512, 64]', 'dropout': 0.17926886097357314, 'batch_norm': True, 'lr': 0.00017326381755275227, 'weight_decay': 1.1000387465976085e-07, 'epochs': 237, 'loss': 'mse', 'optimizer': 'adam', 'graph_mode': 'off', 'use_snp_selection': True, 'num_snps': 37681}. Best is trial 33 with value: 0.11481403501753586.
[I 2025-12-05 16:22:32,877] Trial 63 finished with value: 0.10500451952205044 and parameters: {'model_type': 'mlp', 'hidden_dims': '[512, 64]', 'dropout': 0.17914235923855826, 'batch_norm': True, 'lr': 0.00016124377250687015, 'weight_decay': 1.1052721708520041e-07, 'epochs': 221, 'loss': 'mse', 'optimizer': 'adam', 'graph_mode': 'off', 'use_snp_selection': True, 'num_snps': 38351}. Best is trial 33 with value: 0.11481403501753586.
[I 2025-12-05 16:22:34,779] Trial 64 finished with value: 0.09247768365281867 and parameters: {'model_type': 'mlp', 'hidden_dims': '[512, 64]', 'dropout': 0.1699646633218295, 'batch_norm': True, 'lr': 0.0001601639940491024, 'weight_decay': 1.0401182190973646e-07, 'epochs': 213, 'loss': 'mse', 'optimizer': 'adam', 'graph_mode': 'off', 'use_snp_selection': True, 'num_snps': 33357}. Best is trial 33 with value: 0.11481403501753586.
