[I 2025-12-05 23:35:07,376] Trial 58 finished with value: 0.3693902956344244 and parameters: {'model_type': 'mlp', 'hidden_dims': '[256, 128]', 'dropout': 0.534907463886648, 'batch_norm': False, 'lr': 5.478741936084216e-06, 'weight_decay': 3.9872652989750556e-07, 'epochs': 254, 'loss': 'mse', 'optimizer': 'adam', 'graph_mode': 'off', 'use_snp_selection': True, 'num_snps': 53794}. Best is trial 55 with value: 0.3769868518917667.
[I 2025-12-05 23:35:39,321] Trial 59 finished with value: 0.20594145030004732 and parameters: {'model_type': 'mlp', 'hidden_dims': '[256, 128]', 'dropout': 0.51589734467549, 'batch_norm': False, 'lr': 0.0007370054935123828, 'weight_decay': 3.4091275135186093e-06, 'epochs': 289, 'loss': 'mse', 'optimizer': 'adam', 'graph_mode': 'off', 'use_snp_selection': False}. Best is trial 55 with value: 0.3769868518917667.
[I 2025-12-05 23:36:07,390] Trial 60 finished with value: 0.3706566296284545 and parameters: {'model_type': 'mlp', 'hidden_dims': '[256, 128]', 'dropout': 0.537162152079885, 'batch_norm': False, 'lr': 4.050772734015695e-06, 'weight_decay': 9.421442438978231e-07, 'epochs': 237, 'loss': 'mse', 'optimizer': 'adam', 'graph_mode': 'off', 'use_snp_selection': False}. Best is trial 55 with value: 0.3769868518917667.
[I 2025-12-05 23:36:27,129] Trial 61 finished with value: 0.37482950801463416 and parameters: {'model_type': 'mlp', 'hidden_dims': '[128, 64]', 'dropout': 0.546249355269661, 'batch_norm': False, 'lr': 2.718983327159791e-06, 'weight_decay': 2.4554302312062355e-06, 'epochs': 270, 'loss': 'mse', 'optimizer': 'adam', 'graph_mode': 'off', 'use_snp_selection': False}. Best is trial 55 with value: 0.3769868518917667.
[I 2025-12-05 23:36:46,061] Trial 62 finished with value: 0.3656395412538252 and parameters: {'model_type': 'mlp', 'hidden_dims': '[128, 64]', 'dropout': 0.5475418034572533, 'batch_norm': False, 'lr': 2.822150632149557e-06, 'weight_decay': 2.4112934583632233e-06, 'epochs': 269, 'loss': 'mse', 'optimizer': 'adam', 'graph_mode': 'off', 'use_snp_selection': False}. Best is trial 55 with value: 0.3769868518917667.
[I 2025-12-05 23:37:04,022] Trial 63 finished with value: 0.3778882646178849 and parameters: {'model_type': 'mlp', 'hidden_dims': '[128, 64]', 'dropout': 0.5715671283280843, 'batch_norm': False, 'lr': 4.19466003847667e-06, 'weight_decay': 5.646544352707568e-06, 'epochs': 251, 'loss': 'mse', 'optimizer': 'adam', 'graph_mode': 'off', 'use_snp_selection': False}. Best is trial 63 with value: 0.3778882646178849.
[I 2025-12-05 23:37:24,126] Trial 64 finished with value: 0.36633012333251475 and parameters: {'model_type': 'mlp', 'hidden_dims': '[128, 64]', 'dropout': 0.5813515309180476, 'batch_norm': False, 'lr': 2.5030653664856376e-06, 'weight_decay': 5.325276477212487e-06, 'epochs': 289, 'loss': 'mse', 'optimizer': 'adam', 'graph_mode': 'off', 'use_snp_selection': False}. Best is trial 63 with value: 0.3778882646178849.
[I 2025-12-05 23:37:44,719] Trial 65 finished with value: 0.3636278144173226 and parameters: {'model_type': 'mlp', 'hidden_dims': '[128, 64]', 'dropout': 0.5633329092400303, 'batch_norm': False, 'lr': 1.478858164264097e-05, 'weight_decay': 1.8464856044315825e-06, 'epochs': 301, 'loss': 'mse', 'optimizer': 'adam', 'graph_mode': 'off', 'use_snp_selection': False}. Best is trial 63 with value: 0.3778882646178849.
[I 2025-12-05 23:38:07,583] Trial 66 finished with value: 0.3689392805180195 and parameters: {'model_type': 'mlp', 'hidden_dims': '[128, 64]', 'dropout': 0.5298586525673815, 'batch_norm': False, 'lr': 6.797633037449976e-06, 'weight_decay': 2.7958624065993135e-06, 'epochs': 339, 'loss': 'mse', 'optimizer': 'adam', 'graph_mode': 'off', 'use_snp_selection': False}. Best is trial 63 with value: 0.3778882646178849.
[I 2025-12-05 23:38:25,644] Trial 67 finished with value: 0.28098189023110093 and parameters: {'model_type': 'mlp', 'hidden_dims': '[128, 64]', 'dropout': 0.5907511412775138, 'batch_norm': False, 'lr': 1.0073504487803949e-06, 'weight_decay': 7.4292156808234855e-06, 'epochs': 253, 'loss': 'mse', 'optimizer': 'adam', 'graph_mode': 'off', 'use_snp_selection': False}. Best is trial 63 with value: 0.3778882646178849.
[I 2025-12-05 23:38:32,921] Trial 68 finished with value: 0.20082243687239668 and parameters: {'model_type': 'mlp', 'hidden_dims': '[128, 64]', 'dropout': 0.5186094435695878, 'batch_norm': False, 'lr': 2.0453682092570136e-06, 'weight_decay': 1.0701937069242959e-06, 'epochs': 60, 'loss': 'mse', 'optimizer': 'adam', 'graph_mode': 'off', 'use_snp_selection': False}. Best is trial 63 with value: 0.3778882646178849.
[I 2025-12-05 23:39:15,725] Trial 69 finished with value: 0.3546592166913166 and parameters: {'model_type': 'mlp', 'hidden_dims': '[128, 64]', 'dropout': 0.5743318695879543, 'batch_norm': False, 'lr': 2.9624369140260917e-06, 'weight_decay': 3.252503907791008e-06, 'epochs': 160, 'loss': 'mse', 'optimizer': 'adam', 'graph_mode': 'off', 'use_snp_selection': True, 'num_snps': 52827}. Best is trial 63 with value: 0.3778882646178849.
[I 2025-12-05 23:39:46,668] Trial 70 finished with value: 0.366107548241717 and parameters: {'model_type': 'mlp', 'hidden_dims': '[256, 128, 64]', 'dropout': 0.5989596452008831, 'batch_norm': False, 'lr': 4.596727702039087e-06, 'weight_decay': 4.619893555647871e-06, 'epochs': 271, 'loss': 'mse', 'optimizer': 'adam', 'graph_mode': 'off', 'use_snp_selection': False}. Best is trial 63 with value: 0.3778882646178849.
[I 2025-12-05 23:40:34,297] Trial 71 finished with value: 0.3714521520580937 and parameters: {'model_type': 'mlp', 'hidden_dims': '[512, 128]', 'dropout': 0.5419374228304656, 'batch_norm': False, 'lr': 3.52087147764544e-06, 'weight_decay': 9.792912648599926e-06, 'epochs': 225, 'loss': 'mse', 'optimizer': 'adam', 'graph_mode': 'off', 'use_snp_selection': False}. Best is trial 63 with value: 0.3778882646178849.
[I 2025-12-05 23:40:52,076] Trial 72 finished with value: 0.3689798744272824 and parameters: {'model_type': 'mlp', 'hidden_dims': '[128, 64]', 'dropout': 0.4987698862207016, 'batch_norm': False, 'lr': 1.02105445737948e-05, 'weight_decay': 6.093127449819245e-06, 'epochs': 249, 'loss': 'mse', 'optimizer': 'adam', 'graph_mode': 'off', 'use_snp_selection': False}. Best is trial 63 with value: 0.3778882646178849.
[I 2025-12-05 23:41:24,502] Trial 73 finished with value: 0.3686051568456395 and parameters: {'model_type': 'mlp', 'hidden_dims': '[256, 128]', 'dropout': 0.5496795943726444, 'batch_norm': False, 'lr': 6.276216533025112e-06, 'weight_decay': 8.415285579604816e-06, 'epochs': 282, 'loss': 'mse', 'optimizer': 'adam', 'graph_mode': 'off', 'use_snp_selection': False}. Best is trial 63 with value: 0.3778882646178849.
[I 2025-12-05 23:42:20,310] Trial 74 finished with value: 0.3690785930079151 and parameters: {'model_type': 'mlp', 'hidden_dims': '[512, 64]', 'dropout': 0.5236094023052486, 'batch_norm': False, 'lr': 4.369951773642886e-06, 'weight_decay': 4.310537551181543e-06, 'epochs': 267, 'loss': 'mse', 'optimizer': 'adam', 'graph_mode': 'off', 'use_snp_selection': False}. Best is trial 63 with value: 0.3778882646178849.
[I 2025-12-05 23:43:21,701] Trial 75 finished with value: 0.37014880433486375 and parameters: {'model_type': 'mlp', 'hidden_dims': '[512, 128]', 'dropout': 0.2881395568210141, 'batch_norm': False, 'lr': 1.9557806107211017e-06, 'weight_decay': 1.1921619790739136e-05, 'epochs': 294, 'loss': 'mse', 'optimizer': 'adam', 'graph_mode': 'off', 'use_snp_selection': False}. Best is trial 63 with value: 0.3778882646178849.
[I 2025-12-05 23:43:37,133] Trial 76 finished with value: 0.3134638436417845 and parameters: {'model_type': 'mlp', 'hidden_dims': '[128, 64]', 'dropout': 0.4715484745496289, 'batch_norm': True, 'lr': 3.360561332805161e-06, 'weight_decay': 5.300254832610591e-07, 'epochs': 204, 'loss': 'mse', 'optimizer': 'adam', 'graph_mode': 'off', 'use_snp_selection': False}. Best is trial 63 with value: 0.3778882646178849.
[I 2025-12-05 23:44:07,571] Trial 77 finished with value: 0.31062435493579843 and parameters: {'model_type': 'mlp', 'hidden_dims': '[256, 128, 64]', 'dropout': 0.5671493072040412, 'batch_norm': False, 'lr': 1.1970020570705027e-06, 'weight_decay': 1.7492081006313871e-06, 'epochs': 262, 'loss': 'mse', 'optimizer': 'adam', 'graph_mode': 'off', 'use_snp_selection': False}. Best is trial 63 with value: 0.3778882646178849.
[I 2025-12-05 23:45:05,456] Trial 78 finished with value: 0.3736207663302772 and parameters: {'model_type': 'mlp', 'hidden_dims': '[512, 128]', 'dropout': 0.5011052045314873, 'batch_norm': False, 'lr': 2.469439975656488e-06, 'weight_decay': 2.9846048327911948e-06, 'epochs': 278, 'loss': 'mae', 'optimizer': 'adam', 'graph_mode': 'off', 'use_snp_selection': False}. Best is trial 63 with value: 0.3778882646178849.
[I 2025-12-05 23:46:09,218] Trial 79 finished with value: 0.356115504688544 and parameters: {'model_type': 'mlp', 'hidden_dims': '[512, 128]', 'dropout': 0.18060836292393753, 'batch_norm': False, 'lr': 2.5408888557502857e-06, 'weight_decay': 1.7477501243743004e-07, 'epochs': 307, 'loss': 'mse', 'optimizer': 'adam', 'graph_mode': 'off', 'use_snp_selection': False}. Best is trial 63 with value: 0.3778882646178849.
[I 2025-12-05 23:47:12,630] Trial 80 finished with value: 0.3698472869618277 and parameters: {'model_type': 'mlp', 'hidden_dims': '[512, 128]', 'dropout': 0.5078257109815293, 'batch_norm': False, 'lr': 1.6503908808848e-06, 'weight_decay': 3.0338047070728587e-06, 'epochs': 320, 'loss': 'mae', 'optimizer': 'adam', 'graph_mode': 'off', 'use_snp_selection': True, 'num_snps': 33735}. Best is trial 63 with value: 0.3778882646178849.
[I 2025-12-05 23:48:09,994] Trial 81 finished with value: 0.3678081293418086 and parameters: {'model_type': 'mlp', 'hidden_dims': '[512, 128]', 'dropout': 0.49441006528329595, 'batch_norm': False, 'lr': 2.2931291428616876e-06, 'weight_decay': 5.81637619371325e-06, 'epochs': 277, 'loss': 'mae', 'optimizer': 'adam', 'graph_mode': 'off', 'use_snp_selection': False}. Best is trial 63 with value: 0.3778882646178849.
[I 2025-12-05 23:49:09,552] Trial 82 finished with value: 0.3714299664153238 and parameters: {'model_type': 'mlp', 'hidden_dims': '[512, 256]', 'dropout': 0.5505563233041786, 'batch_norm': False, 'lr': 2.869488380745844e-06, 'weight_decay': 1.4286391148833596e-06, 'epochs': 287, 'loss': 'mae', 'optimizer': 'adam', 'graph_mode': 'off', 'use_snp_selection': False}. Best is trial 63 with value: 0.3778882646178849.
[I 2025-12-05 23:50:00,326] Trial 83 finished with value: 0.3691397177000324 and parameters: {'model_type': 'mlp', 'hidden_dims': '[512, 128]', 'dropout': 0.473045492437617, 'batch_norm': False, 'lr': 5.639753877730859e-06, 'weight_decay': 3.815922937957757e-06, 'epochs': 237, 'loss': 'mae', 'optimizer': 'adam', 'graph_mode': 'off', 'use_snp_selection': False}. Best is trial 63 with value: 0.3778882646178849.
[I 2025-12-05 23:50:55,709] Trial 84 finished with value: 0.37347877616724173 and parameters: {'model_type': 'mlp', 'hidden_dims': '[512, 256]', 'dropout': 0.5273600342231557, 'batch_norm': False, 'lr': 3.7792315001621116e-06, 'weight_decay': 7.403757486160266e-06, 'epochs': 264, 'loss': 'mae', 'optimizer': 'adam', 'graph_mode': 'off', 'use_snp_selection': False}. Best is trial 63 with value: 0.3778882646178849.
[I 2025-12-05 23:51:29,952] Trial 85 finished with value: 0.36615171377274514 and parameters: {'model_type': 'mlp', 'hidden_dims': '[256, 128]', 'dropout': 0.5329509015348711, 'batch_norm': False, 'lr': 8.051219142844988e-06, 'weight_decay': 2.5875688560697164e-06, 'epochs': 297, 'loss': 'mae', 'optimizer': 'adam', 'graph_mode': 'off', 'use_snp_selection': False}. Best is trial 63 with value: 0.3778882646178849.
[I 2025-12-05 23:52:25,631] Trial 86 finished with value: 0.365392976599815 and parameters: {'model_type': 'mlp', 'hidden_dims': '[512, 128]', 'dropout': 0.5802891557690111, 'batch_norm': False, 'lr': 1.7945100612845748e-06, 'weight_decay': 6.886634301936881e-06, 'epochs': 262, 'loss': 'mae', 'optimizer': 'adam', 'graph_mode': 'off', 'use_snp_selection': False}. Best is trial 63 with value: 0.3778882646178849.
[I 2025-12-05 23:53:32,966] Trial 87 finished with value: 0.3653335451180978 and parameters: {'model_type': 'mlp', 'hidden_dims': '[512, 256]', 'dropout': 0.5611575768716117, 'batch_norm': False, 'lr': 1.4267214979832185e-06, 'weight_decay': 4.850415177004332e-06, 'epochs': 319, 'loss': 'mae', 'optimizer': 'adam', 'graph_mode': 'off', 'use_snp_selection': False}. Best is trial 63 with value: 0.3778882646178849.
[I 2025-12-05 23:54:30,558] Trial 88 finished with value: 0.3082023630112093 and parameters: {'model_type': 'mlp', 'hidden_dims': '[512, 64]', 'dropout': 0.11114724262981618, 'batch_norm': True, 'lr': 4.552488293615727e-06, 'weight_decay': 1.2628585502754392e-06, 'epochs': 272, 'loss': 'mse', 'optimizer': 'adam', 'graph_mode': 'off', 'use_snp_selection': False}. Best is trial 63 with value: 0.3778882646178849.
[I 2025-12-05 23:55:29,119] Trial 89 finished with value: 0.3718875353256405 and parameters: {'model_type': 'mlp', 'hidden_dims': '[512, 256]', 'dropout': 0.418239965702429, 'batch_norm': False, 'lr': 3.3386078986433293e-06, 'weight_decay': 1.8926693583385367e-06, 'epochs': 280, 'loss': 'mae', 'optimizer': 'adam', 'graph_mode': 'off', 'use_snp_selection': False}. Best is trial 63 with value: 0.3778882646178849.
[I 2025-12-05 23:56:25,849] Trial 90 finished with value: 0.3668190701065037 and parameters: {'model_type': 'mlp', 'hidden_dims': '[512, 128]', 'dropout': 0.5109287215707262, 'batch_norm': False, 'lr': 2.1272913571414518e-06, 'weight_decay': 7.571763183670189e-06, 'epochs': 291, 'loss': 'mae', 'optimizer': 'adam', 'graph_mode': 'off', 'use_snp_selection': True, 'num_snps': 29888}. Best is trial 63 with value: 0.3778882646178849.
[I 2025-12-05 23:57:30,340] Trial 91 finished with value: 0.37372867413130145 and parameters: {'model_type': 'mlp', 'hidden_dims': '[512, 256]', 'dropout': 0.522357092409513, 'batch_norm': False, 'lr': 4.113210663535395e-06, 'weight_decay': 1.3620368815398598e-05, 'epochs': 306, 'loss': 'mae', 'optimizer': 'adam', 'graph_mode': 'off', 'use_snp_selection': False}. Best is trial 63 with value: 0.3778882646178849.
[I 2025-12-05 23:58:34,153] Trial 92 finished with value: 0.3739645721560814 and parameters: {'model_type': 'mlp', 'hidden_dims': '[512, 256]', 'dropout': 0.5426468360872946, 'batch_norm': False, 'lr': 4.002055457504323e-06, 'weight_decay': 1.2727512776067743e-05, 'epochs': 307, 'loss': 'mae', 'optimizer': 'adam', 'graph_mode': 'off', 'use_snp_selection': False}. Best is trial 63 with value: 0.3778882646178849.
[I 2025-12-05 23:59:38,048] Trial 93 finished with value: 0.3691187315527217 and parameters: {'model_type': 'mlp', 'hidden_dims': '[512, 256]', 'dropout': 0.5273688930634046, 'batch_norm': False, 'lr': 4.003399723610796e-06, 'weight_decay': 1.3636902803255796e-05, 'epochs': 308, 'loss': 'mae', 'optimizer': 'adam', 'graph_mode': 'off', 'use_snp_selection': False}. Best is trial 63 with value: 0.3778882646178849.
[I 2025-12-06 00:00:47,752] Trial 94 finished with value: 0.3686702839240827 and parameters: {'model_type': 'mlp', 'hidden_dims': '[512, 256]', 'dropout': 0.5477206554922449, 'batch_norm': False, 'lr': 5.985429366713417e-06, 'weight_decay': 1.0564067637375582e-05, 'epochs': 339, 'loss': 'mae', 'optimizer': 'adam', 'graph_mode': 'off', 'use_snp_selection': False}. Best is trial 63 with value: 0.3778882646178849.
[I 2025-12-06 00:01:50,222] Trial 95 finished with value: 0.371310238792348 and parameters: {'model_type': 'mlp', 'hidden_dims': '[512, 256]', 'dropout': 0.5150717219887107, 'batch_norm': False, 'lr': 4.9441857849290835e-06, 'weight_decay': 2.2251164767796802e-05, 'epochs': 301, 'loss': 'mae', 'optimizer': 'adam', 'graph_mode': 'off', 'use_snp_selection': False}. Best is trial 63 with value: 0.3778882646178849.
[I 2025-12-06 00:02:55,752] Trial 96 finished with value: 0.36384071796803086 and parameters: {'model_type': 'mlp', 'hidden_dims': '[512, 256]', 'dropout': 0.5430179700231631, 'batch_norm': False, 'lr': 7.104976997228031e-06, 'weight_decay': 3.311589277449693e-05, 'epochs': 318, 'loss': 'mae', 'optimizer': 'adam', 'graph_mode': 'off', 'use_snp_selection': False}. Best is trial 63 with value: 0.3778882646178849.
[I 2025-12-06 00:04:03,126] Trial 97 finished with value: 0.3733853086270062 and parameters: {'model_type': 'mlp', 'hidden_dims': '[512, 256]', 'dropout': 0.5247926234003368, 'batch_norm': False, 'lr': 3.1315962291645023e-06, 'weight_decay': 1.883747484110558e-05, 'epochs': 327, 'loss': 'mae', 'optimizer': 'adam', 'graph_mode': 'off', 'use_snp_selection': False}. Best is trial 63 with value: 0.3778882646178849.
[I 2025-12-06 00:05:07,743] Trial 98 finished with value: 0.3740961947434741 and parameters: {'model_type': 'mlp', 'hidden_dims': '[512, 256]', 'dropout': 0.48023378382486803, 'batch_norm': False, 'lr': 3.859587202569253e-06, 'weight_decay': 9.5949996788066e-06, 'epochs': 312, 'loss': 'mae', 'optimizer': 'adam', 'graph_mode': 'off', 'use_snp_selection': False}. Best is trial 63 with value: 0.3778882646178849.
[I 2025-12-06 00:05:33,245] Trial 99 finished with value: 0.33149034278218953 and parameters: {'model_type': 'mlp', 'hidden_dims': '[512, 256]', 'dropout': 0.3490144130601259, 'batch_norm': False, 'lr': 2.4183225190364815e-06, 'weight_decay': 8.59014939979037e-06, 'epochs': 310, 'loss': 'mae', 'optimizer': 'adam', 'graph_mode': 'off', 'use_snp_selection': True, 'num_snps': 2833}. Best is trial 63 with value: 0.3778882646178849.
[I 2025-12-06 00:05:55,150] Trial 100 finished with value: 0.34347622116413185 and parameters: {'model_type': 'mlp', 'hidden_dims': '[128, 64]', 'dropout': 0.47687310101451597, 'batch_norm': False, 'lr': 8.661132850815155e-05, 'weight_decay': 1.199912718730443e-05, 'epochs': 336, 'loss': 'mae', 'optimizer': 'adam', 'graph_mode': 'off', 'use_snp_selection': False}. Best is trial 63 with value: 0.3778882646178849.
[I 2025-12-06 00:06:57,201] Trial 101 finished with value: 0.37148381813166703 and parameters: {'model_type': 'mlp', 'hidden_dims': '[512, 256]', 'dropout': 0.45296537584161234, 'batch_norm': False, 'lr': 3.60945086143563e-06, 'weight_decay': 9.100883745638841e-06, 'epochs': 299, 'loss': 'mae', 'optimizer': 'adam', 'graph_mode': 'off', 'use_snp_selection': False}. Best is trial 63 with value: 0.3778882646178849.
[I 2025-12-06 00:08:04,577] Trial 102 finished with value: 0.3688884128441379 and parameters: {'model_type': 'mlp', 'hidden_dims': '[512, 256]', 'dropout': 0.49246842645176353, 'batch_norm': False, 'lr': 5.304688004024419e-06, 'weight_decay': 6.230964115334433e-06, 'epochs': 326, 'loss': 'mae', 'optimizer': 'adam', 'graph_mode': 'off', 'use_snp_selection': False}. Best is trial 63 with value: 0.3778882646178849.
[I 2025-12-06 00:09:05,364] Trial 103 finished with value: 0.3732847542406172 and parameters: {'model_type': 'mlp', 'hidden_dims': '[512, 256]', 'dropout': 0.5047845620390774, 'batch_norm': False, 'lr': 4.162507074786687e-06, 'weight_decay': 3.7657829154195633e-06, 'epochs': 292, 'loss': 'mae', 'optimizer': 'adam', 'graph_mode': 'off', 'use_snp_selection': False}. Best is trial 63 with value: 0.3778882646178849.
[I 2025-12-06 00:10:08,749] Trial 104 finished with value: 0.358596167956334 and parameters: {'model_type': 'mlp', 'hidden_dims': '[512, 256]', 'dropout': 0.5361338095510838, 'batch_norm': False, 'lr': 1.1753828543478077e-06, 'weight_decay': 2.590687213720169e-05, 'epochs': 306, 'loss': 'mae', 'optimizer': 'adam', 'graph_mode': 'off', 'use_snp_selection': False}. Best is trial 63 with value: 0.3778882646178849.
[I 2025-12-06 00:11:02,362] Trial 105 finished with value: 0.36936727780211087 and parameters: {'model_type': 'mlp', 'hidden_dims': '[512, 256]', 'dropout': 0.5589603113592561, 'batch_norm': False, 'lr': 1.8919291545960752e-06, 'weight_decay': 1.3263533180180221e-05, 'epochs': 255, 'loss': 'mae', 'optimizer': 'adam', 'graph_mode': 'off', 'use_snp_selection': False}. Best is trial 63 with value: 0.3778882646178849.
[I 2025-12-06 00:12:08,470] Trial 106 finished with value: 0.32580791078638244 and parameters: {'model_type': 'mlp', 'hidden_dims': '[512, 256]', 'dropout': 0.4619148006255853, 'batch_norm': True, 'lr': 2.7948217274360217e-06, 'weight_decay': 5.015989406816239e-06, 'epochs': 316, 'loss': 'mae', 'optimizer': 'adam', 'graph_mode': 'off', 'use_snp_selection': False}. Best is trial 63 with value: 0.3778882646178849.
[I 2025-12-06 00:12:36,086] Trial 107 finished with value: 0.3457800313873058 and parameters: {'model_type': 'mlp', 'hidden_dims': '[512, 128]', 'dropout': 0.5884844948912982, 'batch_norm': False, 'lr': 2.244255230132148e-06, 'weight_decay': 1.695437592742015e-05, 'epochs': 120, 'loss': 'mae', 'optimizer': 'adam', 'graph_mode': 'off', 'use_snp_selection': False}. Best is trial 63 with value: 0.3778882646178849.
[I 2025-12-06 00:12:55,279] Trial 108 finished with value: 0.3689353104571088 and parameters: {'model_type': 'mlp', 'hidden_dims': '[128, 64]', 'dropout': 0.44100756375064065, 'batch_norm': False, 'lr': 3.1144779516350208e-06, 'weight_decay': 7.690815421012446e-06, 'epochs': 275, 'loss': 'mae', 'optimizer': 'adam', 'graph_mode': 'off', 'use_snp_selection': False}. Best is trial 63 with value: 0.3778882646178849.
[I 2025-12-06 00:13:35,763] Trial 109 finished with value: 0.3312006943038531 and parameters: {'model_type': 'mlp', 'hidden_dims': '[256, 128, 64]', 'dropout': 0.5190698991368233, 'batch_norm': False, 'lr': 1.52964677814528e-06, 'weight_decay': 1.0079286356100944e-05, 'epochs': 284, 'loss': 'mae', 'optimizer': 'adam', 'graph_mode': 'off', 'use_snp_selection': True, 'num_snps': 26994}. Best is trial 63 with value: 0.3778882646178849.
