[I 2025-12-05 15:42:08,820] Trial 128 finished with value: 0.05494616256062058 and parameters: {'model_type': 'mlp', 'hidden_dims': '[512, 64]', 'dropout': 0.10136024751942972, 'batch_norm': False, 'lr': 0.0004034115567437679, 'weight_decay': 2.2705335782890906e-05, 'epochs': 115, 'loss': 'mae', 'optimizer': 'adam', 'graph_mode': 'off', 'use_snp_selection': True, 'num_snps': 50623}. Best is trial 52 with value: 0.10875387441577535.
[I 2025-12-05 15:42:10,073] Trial 129 finished with value: 0.08811284395825132 and parameters: {'model_type': 'mlp', 'hidden_dims': '[512, 64]', 'dropout': 0.12176449878956104, 'batch_norm': True, 'lr': 0.0003442624320149879, 'weight_decay': 1.6139643139306845e-05, 'epochs': 129, 'loss': 'mse', 'optimizer': 'adam', 'graph_mode': 'off', 'use_snp_selection': False}. Best is trial 52 with value: 0.10875387441577535.
[I 2025-12-05 15:42:11,292] Trial 130 finished with value: 0.05035745589115006 and parameters: {'model_type': 'mlp', 'hidden_dims': '[512, 64]', 'dropout': 0.14384585712085238, 'batch_norm': True, 'lr': 6.364854696940725e-06, 'weight_decay': 1.1570906323430614e-05, 'epochs': 139, 'loss': 'mse', 'optimizer': 'adam', 'graph_mode': 'off', 'use_snp_selection': False}. Best is trial 52 with value: 0.10875387441577535.
[I 2025-12-05 15:42:12,439] Trial 131 finished with value: 0.0823664593810931 and parameters: {'model_type': 'mlp', 'hidden_dims': '[512, 64]', 'dropout': 0.1291898733556344, 'batch_norm': True, 'lr': 0.0004510877265625505, 'weight_decay': 4.6694491143443377e-05, 'epochs': 119, 'loss': 'mse', 'optimizer': 'adam', 'graph_mode': 'off', 'use_snp_selection': False}. Best is trial 52 with value: 0.10875387441577535.
[I 2025-12-05 15:42:13,556] Trial 132 finished with value: 0.0707793294288768 and parameters: {'model_type': 'mlp', 'hidden_dims': '[512, 64]', 'dropout': 0.15729344433097617, 'batch_norm': True, 'lr': 0.000272061915247022, 'weight_decay': 6.458063562486615e-06, 'epochs': 112, 'loss': 'mse', 'optimizer': 'adam', 'graph_mode': 'off', 'use_snp_selection': False}. Best is trial 52 with value: 0.10875387441577535.
[I 2025-12-05 15:42:14,721] Trial 133 finished with value: 0.08850142586793747 and parameters: {'model_type': 'mlp', 'hidden_dims': '[512, 64]', 'dropout': 0.14276001161362065, 'batch_norm': True, 'lr': 0.0003036973062095725, 'weight_decay': 1.378408271608482e-05, 'epochs': 125, 'loss': 'mse', 'optimizer': 'adam', 'graph_mode': 'off', 'use_snp_selection': False}. Best is trial 52 with value: 0.10875387441577535.
[I 2025-12-05 15:42:15,756] Trial 134 finished with value: 0.08861275390756515 and parameters: {'model_type': 'mlp', 'hidden_dims': '[512, 64]', 'dropout': 0.10055821094713382, 'batch_norm': True, 'lr': 0.0005135778963640044, 'weight_decay': 9.487296331593216e-06, 'epochs': 86, 'loss': 'mse', 'optimizer': 'adam', 'graph_mode': 'off', 'use_snp_selection': False}. Best is trial 52 with value: 0.10875387441577535.
[I 2025-12-05 15:42:16,833] Trial 135 finished with value: 0.07335995198478305 and parameters: {'model_type': 'mlp', 'hidden_dims': '[256, 128, 64]', 'dropout': 0.4602163105774435, 'batch_norm': True, 'lr': 0.0006438311804040236, 'weight_decay': 6.858468772362876e-05, 'epochs': 231, 'loss': 'mse', 'optimizer': 'adam', 'graph_mode': 'off', 'use_snp_selection': False}. Best is trial 52 with value: 0.10875387441577535.
[I 2025-12-05 15:42:18,536] Trial 136 finished with value: 0.08898651606549204 and parameters: {'model_type': 'mlp', 'hidden_dims': '[512, 64]', 'dropout': 0.17254360320600534, 'batch_norm': True, 'lr': 0.00017043813768628015, 'weight_decay': 1.0879805149320336e-05, 'epochs': 265, 'loss': 'mse', 'optimizer': 'adam', 'graph_mode': 'off', 'use_snp_selection': False}. Best is trial 52 with value: 0.10875387441577535.
[I 2025-12-05 15:42:20,295] Trial 137 finished with value: 0.08260574163786273 and parameters: {'model_type': 'mlp', 'hidden_dims': '[512, 128]', 'dropout': 0.18420258282061797, 'batch_norm': True, 'lr': 0.0008532648946456067, 'weight_decay': 2.3716580071616132e-05, 'epochs': 278, 'loss': 'mae', 'optimizer': 'adam', 'graph_mode': 'off', 'use_snp_selection': False}. Best is trial 52 with value: 0.10875387441577535.
[I 2025-12-05 15:42:21,176] Trial 138 finished with value: 0.07658465443718315 and parameters: {'model_type': 'mlp', 'hidden_dims': '[256, 128]', 'dropout': 0.4135864460352567, 'batch_norm': True, 'lr': 0.0003711639606230923, 'weight_decay': 1.7715769033772948e-05, 'epochs': 145, 'loss': 'mse', 'optimizer': 'adam', 'graph_mode': 'off', 'use_snp_selection': False}. Best is trial 52 with value: 0.10875387441577535.
[I 2025-12-05 15:42:22,342] Trial 139 finished with value: 0.05377313610355567 and parameters: {'model_type': 'mlp', 'hidden_dims': '[512, 256]', 'dropout': 0.5298086929996255, 'batch_norm': False, 'lr': 0.00010923425886455359, 'weight_decay': 7.686734301008188e-06, 'epochs': 119, 'loss': 'mse', 'optimizer': 'adam', 'graph_mode': 'off', 'use_snp_selection': False}. Best is trial 52 with value: 0.10875387441577535.
[I 2025-12-05 15:42:23,450] Trial 140 finished with value: 0.08970876873633796 and parameters: {'model_type': 'mlp', 'hidden_dims': '[512, 64]', 'dropout': 0.12624898927465908, 'batch_norm': True, 'lr': 0.0009981901639654301, 'weight_decay': 1.7352001430667728e-06, 'epochs': 107, 'loss': 'mse', 'optimizer': 'adam', 'graph_mode': 'off', 'use_snp_selection': False}. Best is trial 52 with value: 0.10875387441577535.
[I 2025-12-05 15:42:24,552] Trial 141 finished with value: 0.08188581846749347 and parameters: {'model_type': 'mlp', 'hidden_dims': '[512, 64]', 'dropout': 0.11366274636804626, 'batch_norm': True, 'lr': 0.0007705141808258291, 'weight_decay': 1.796681819191708e-06, 'epochs': 108, 'loss': 'mse', 'optimizer': 'adam', 'graph_mode': 'off', 'use_snp_selection': False}. Best is trial 52 with value: 0.10875387441577535.
[I 2025-12-05 15:42:25,619] Trial 142 finished with value: 0.0823387058956912 and parameters: {'model_type': 'mlp', 'hidden_dims': '[512, 64]', 'dropout': 0.15225754733324254, 'batch_norm': True, 'lr': 0.0009813214278508561, 'weight_decay': 1.3680681073106024e-06, 'epochs': 98, 'loss': 'mse', 'optimizer': 'adam', 'graph_mode': 'off', 'use_snp_selection': False}. Best is trial 52 with value: 0.10875387441577535.
[I 2025-12-05 15:42:26,750] Trial 143 finished with value: 0.08043020277081256 and parameters: {'model_type': 'mlp', 'hidden_dims': '[512, 64]', 'dropout': 0.13688424900106758, 'batch_norm': True, 'lr': 0.0006424454534018515, 'weight_decay': 2.0357528627341145e-05, 'epochs': 115, 'loss': 'mse', 'optimizer': 'adam', 'graph_mode': 'off', 'use_snp_selection': False}. Best is trial 52 with value: 0.10875387441577535.
[I 2025-12-05 15:42:28,380] Trial 144 finished with value: 0.07349386009878335 and parameters: {'model_type': 'mlp', 'hidden_dims': '[512, 64]', 'dropout': 0.16050518285794296, 'batch_norm': True, 'lr': 0.0005734322125672341, 'weight_decay': 8.961434537176606e-07, 'epochs': 246, 'loss': 'mse', 'optimizer': 'adam', 'graph_mode': 'off', 'use_snp_selection': False}. Best is trial 52 with value: 0.10875387441577535.
[I 2025-12-05 15:42:29,356] Trial 145 finished with value: 0.08657070694880918 and parameters: {'model_type': 'mlp', 'hidden_dims': '[512, 64]', 'dropout': 0.12331349990108098, 'batch_norm': True, 'lr': 0.0008153713186455072, 'weight_decay': 1.1412125402178403e-06, 'epochs': 66, 'loss': 'mse', 'optimizer': 'adam', 'graph_mode': 'off', 'use_snp_selection': False}. Best is trial 52 with value: 0.10875387441577535.
[I 2025-12-05 15:42:30,552] Trial 146 finished with value: 0.09858679567400615 and parameters: {'model_type': 'mlp', 'hidden_dims': '[512, 64]', 'dropout': 0.12587992270975523, 'batch_norm': True, 'lr': 0.0004448466097338512, 'weight_decay': 1.298641785278578e-05, 'epochs': 132, 'loss': 'mse', 'optimizer': 'adam', 'graph_mode': 'off', 'use_snp_selection': False}. Best is trial 52 with value: 0.10875387441577535.
[I 2025-12-05 15:42:31,754] Trial 147 finished with value: 0.06313037516717615 and parameters: {'model_type': 'mlp', 'hidden_dims': '[512, 64]', 'dropout': 0.14857580778911145, 'batch_norm': True, 'lr': 0.000432647226499252, 'weight_decay': 1.4455932877051863e-05, 'epochs': 133, 'loss': 'mae', 'optimizer': 'adam', 'graph_mode': 'off', 'use_snp_selection': False}. Best is trial 52 with value: 0.10875387441577535.
[I 2025-12-05 15:42:32,983] Trial 148 finished with value: 0.08879900034993499 and parameters: {'model_type': 'mlp', 'hidden_dims': '[256, 128, 64]', 'dropout': 0.13144209161798837, 'batch_norm': True, 'lr': 0.0003361550145530727, 'weight_decay': 3.0013097599817445e-05, 'epochs': 302, 'loss': 'mse', 'optimizer': 'adam', 'graph_mode': 'off', 'use_snp_selection': False}. Best is trial 52 with value: 0.10875387441577535.
[I 2025-12-05 15:42:34,503] Trial 149 finished with value: 0.084304698861636 and parameters: {'model_type': 'mlp', 'hidden_dims': '[128, 64]', 'dropout': 0.17659919719809408, 'batch_norm': True, 'lr': 0.0004844391298133874, 'weight_decay': 2.3408773085878656e-05, 'epochs': 129, 'loss': 'mse', 'optimizer': 'adam', 'graph_mode': 'off', 'use_snp_selection': True, 'num_snps': 29744}. Best is trial 52 with value: 0.10875387441577535.
[I 2025-12-05 15:42:36,774] Trial 0 finished with value: 0.0006102605169211934 and parameters: {'model_type': 'mlp', 'hidden_dims': '[128, 64]', 'dropout': 0.199031432379812, 'batch_norm': True, 'lr': 1.8408544111075837e-06, 'weight_decay': 5.5136510071208614e-05, 'epochs': 336, 'loss': 'mae', 'optimizer': 'adam', 'graph_mode': 'off', 'use_snp_selection': True, 'num_snps': 43862}. Best is trial 0 with value: 0.0006102605169211934.
[I 2025-12-05 15:42:37,908] Trial 1 finished with value: 0.040038327251189804 and parameters: {'model_type': 'mlp', 'hidden_dims': '[256, 128]', 'dropout': 0.4370668075331726, 'batch_norm': True, 'lr': 7.133471581159139e-05, 'weight_decay': 1.128633586803549e-05, 'epochs': 242, 'loss': 'mae', 'optimizer': 'adam', 'graph_mode': 'off', 'use_snp_selection': False}. Best is trial 1 with value: 0.040038327251189804.
[I 2025-12-05 15:42:38,922] Trial 2 finished with value: 0.008840749133801323 and parameters: {'model_type': 'mlp', 'hidden_dims': '[256, 128, 64]', 'dropout': 0.41314357415569625, 'batch_norm': False, 'lr': 3.952233718592101e-06, 'weight_decay': 0.00026754769258252603, 'epochs': 149, 'loss': 'mse', 'optimizer': 'adam', 'graph_mode': 'off', 'use_snp_selection': True, 'num_snps': 11571}. Best is trial 1 with value: 0.040038327251189804.
[I 2025-12-05 15:42:40,802] Trial 3 finished with value: 0.0021476885948691704 and parameters: {'model_type': 'mlp', 'hidden_dims': '[512, 64]', 'dropout': 0.5938127374509361, 'batch_norm': False, 'lr': 5.67704586114731e-06, 'weight_decay': 2.4518087630137052e-05, 'epochs': 320, 'loss': 'mae', 'optimizer': 'adam', 'graph_mode': 'off', 'use_snp_selection': False}. Best is trial 1 with value: 0.040038327251189804.
[I 2025-12-05 15:42:43,018] Trial 4 finished with value: -0.05321407779691778 and parameters: {'model_type': 'mlp', 'hidden_dims': '[512, 128]', 'dropout': 0.25746343592134413, 'batch_norm': True, 'lr': 1.3467657668402788e-06, 'weight_decay': 0.00033087251918647806, 'epochs': 277, 'loss': 'mse', 'optimizer': 'adam', 'graph_mode': 'off', 'use_snp_selection': True, 'num_snps': 36675}. Best is trial 1 with value: 0.040038327251189804.
[I 2025-12-05 15:42:44,784] Trial 5 finished with value: 0.056440586886236925 and parameters: {'model_type': 'mlp', 'hidden_dims': '[512, 64]', 'dropout': 0.38275350994408375, 'batch_norm': True, 'lr': 1.5586664309232824e-06, 'weight_decay': 0.0008227664668621182, 'epochs': 145, 'loss': 'mae', 'optimizer': 'adam', 'graph_mode': 'off', 'use_snp_selection': True, 'num_snps': 32148}. Best is trial 5 with value: 0.056440586886236925.
[I 2025-12-05 15:42:45,744] Trial 6 finished with value: 0.030748777260898023 and parameters: {'model_type': 'mlp', 'hidden_dims': '[256, 128]', 'dropout': 0.3930109900265879, 'batch_norm': False, 'lr': 4.892964372128395e-05, 'weight_decay': 1.5809549317992182e-06, 'epochs': 199, 'loss': 'mse', 'optimizer': 'adam', 'graph_mode': 'off', 'use_snp_selection': False}. Best is trial 5 with value: 0.056440586886236925.
[I 2025-12-05 15:42:46,790] Trial 7 finished with value: 0.03141197592664358 and parameters: {'model_type': 'mlp', 'hidden_dims': '[512, 256]', 'dropout': 0.15343979219678458, 'batch_norm': True, 'lr': 6.234003099047341e-05, 'weight_decay': 3.894760610535477e-07, 'epochs': 97, 'loss': 'mse', 'optimizer': 'adam', 'graph_mode': 'off', 'use_snp_selection': False}. Best is trial 5 with value: 0.056440586886236925.
[I 2025-12-05 15:42:48,661] Trial 8 finished with value: 0.03261259112902598 and parameters: {'model_type': 'mlp', 'hidden_dims': '[512, 128]', 'dropout': 0.10743001231661406, 'batch_norm': True, 'lr': 0.00023728538449271062, 'weight_decay': 1.7629071578048637e-05, 'epochs': 312, 'loss': 'mae', 'optimizer': 'adam', 'graph_mode': 'off', 'use_snp_selection': False}. Best is trial 5 with value: 0.056440586886236925.
[I 2025-12-05 15:42:50,004] Trial 9 finished with value: 0.035427326209647406 and parameters: {'model_type': 'mlp', 'hidden_dims': '[512, 64]', 'dropout': 0.14505336736221927, 'batch_norm': True, 'lr': 5.8619638388111826e-05, 'weight_decay': 6.200156172669308e-07, 'epochs': 175, 'loss': 'mse', 'optimizer': 'adam', 'graph_mode': 'off', 'use_snp_selection': False}. Best is trial 5 with value: 0.056440586886236925.
[I 2025-12-05 15:42:51,032] Trial 10 finished with value: 0.022000951623102373 and parameters: {'model_type': 'mlp', 'hidden_dims': '[512, 64]', 'dropout': 0.5224835849021415, 'batch_norm': False, 'lr': 1.080428984628536e-05, 'weight_decay': 0.0005512938102173812, 'epochs': 43, 'loss': 'mae', 'optimizer': 'adam', 'graph_mode': 'off', 'use_snp_selection': True, 'num_snps': 16574}. Best is trial 5 with value: 0.056440586886236925.
[I 2025-12-05 15:42:53,577] Trial 11 finished with value: 0.03463999905609258 and parameters: {'model_type': 'mlp', 'hidden_dims': '[256, 128]', 'dropout': 0.4556279307248699, 'batch_norm': True, 'lr': 0.0006579145291493049, 'weight_decay': 3.074394582448942e-06, 'epochs': 240, 'loss': 'mae', 'optimizer': 'adam', 'graph_mode': 'off', 'use_snp_selection': True, 'num_snps': 55705}. Best is trial 5 with value: 0.056440586886236925.
[I 2025-12-05 15:42:54,441] Trial 12 finished with value: 0.010189287888522688 and parameters: {'model_type': 'mlp', 'hidden_dims': '[256, 128]', 'dropout': 0.30778189624818614, 'batch_norm': True, 'lr': 1.5635974602051994e-05, 'weight_decay': 0.0001085766299699674, 'epochs': 118, 'loss': 'mae', 'optimizer': 'adam', 'graph_mode': 'off', 'use_snp_selection': False}. Best is trial 5 with value: 0.056440586886236925.
[I 2025-12-05 15:42:56,176] Trial 13 finished with value: 0.05441284821458475 and parameters: {'model_type': 'mlp', 'hidden_dims': '[256, 128, 64]', 'dropout': 0.3338364117131635, 'batch_norm': True, 'lr': 0.0002060765636313313, 'weight_decay': 4.227275181115406e-06, 'epochs': 241, 'loss': 'mae', 'optimizer': 'adam', 'graph_mode': 'off', 'use_snp_selection': True, 'num_snps': 28162}. Best is trial 5 with value: 0.056440586886236925.
[I 2025-12-05 15:42:57,809] Trial 14 finished with value: 0.041657794967702756 and parameters: {'model_type': 'mlp', 'hidden_dims': '[256, 128, 64]', 'dropout': 0.33519443374855123, 'batch_norm': True, 'lr': 0.0002827159987807377, 'weight_decay': 2.311691165143405e-06, 'epochs': 211, 'loss': 'mae', 'optimizer': 'adam', 'graph_mode': 'off', 'use_snp_selection': True, 'num_snps': 26325}. Best is trial 5 with value: 0.056440586886236925.
[I 2025-12-05 15:42:59,385] Trial 15 finished with value: 0.01876888116175316 and parameters: {'model_type': 'mlp', 'hidden_dims': '[256, 128, 64]', 'dropout': 0.2758494894776458, 'batch_norm': True, 'lr': 0.00014626888081117106, 'weight_decay': 1.8431992240252364e-07, 'epochs': 143, 'loss': 'mae', 'optimizer': 'adam', 'graph_mode': 'off', 'use_snp_selection': True, 'num_snps': 27030}. Best is trial 5 with value: 0.056440586886236925.
[I 2025-12-05 15:43:00,059] Trial 16 finished with value: 0.041273202641147325 and parameters: {'model_type': 'mlp', 'hidden_dims': '[512, 256]', 'dropout': 0.3520054808740737, 'batch_norm': True, 'lr': 0.0007159004826979951, 'weight_decay': 4.989953502572012e-06, 'epochs': 49, 'loss': 'mae', 'optimizer': 'adam', 'graph_mode': 'off', 'use_snp_selection': True, 'num_snps': 2609}. Best is trial 5 with value: 0.056440586886236925.
[I 2025-12-05 15:43:02,089] Trial 17 finished with value: 0.023214147839421315 and parameters: {'model_type': 'mlp', 'hidden_dims': '[128, 64]', 'dropout': 0.49739623586584436, 'batch_norm': True, 'lr': 2.2065259661057582e-05, 'weight_decay': 0.0009038765422009597, 'epochs': 264, 'loss': 'mae', 'optimizer': 'adam', 'graph_mode': 'off', 'use_snp_selection': True, 'num_snps': 40630}. Best is trial 5 with value: 0.056440586886236925.
[I 2025-12-05 15:43:03,339] Trial 18 finished with value: -0.00871659525199082 and parameters: {'model_type': 'mlp', 'hidden_dims': '[256, 128, 64]', 'dropout': 0.24025829399313284, 'batch_norm': False, 'lr': 3.3364768446352023e-06, 'weight_decay': 6.657136343584885e-05, 'epochs': 86, 'loss': 'mae', 'optimizer': 'adam', 'graph_mode': 'off', 'use_snp_selection': True, 'num_snps': 20957}. Best is trial 5 with value: 0.056440586886236925.
[I 2025-12-05 15:43:05,917] Trial 19 finished with value: -0.0006233896942365169 and parameters: {'model_type': 'mlp', 'hidden_dims': '[512, 64]', 'dropout': 0.37418260234806416, 'batch_norm': True, 'lr': 8.754505136295285e-06, 'weight_decay': 9.583145987010475e-07, 'epochs': 166, 'loss': 'mae', 'optimizer': 'adam', 'graph_mode': 'off', 'use_snp_selection': True, 'num_snps': 49225}. Best is trial 5 with value: 0.056440586886236925.
[I 2025-12-05 15:43:07,927] Trial 20 finished with value: 0.03913504792914192 and parameters: {'model_type': 'mlp', 'hidden_dims': '[256, 128, 64]', 'dropout': 0.3052008271289095, 'batch_norm': True, 'lr': 0.00012183313979096642, 'weight_decay': 6.118442514153086e-06, 'epochs': 288, 'loss': 'mae', 'optimizer': 'adam', 'graph_mode': 'off', 'use_snp_selection': True, 'num_snps': 33612}. Best is trial 5 with value: 0.056440586886236925.
[I 2025-12-05 15:43:09,584] Trial 21 finished with value: 0.041734028656254814 and parameters: {'model_type': 'mlp', 'hidden_dims': '[256, 128, 64]', 'dropout': 0.33026576117398077, 'batch_norm': True, 'lr': 0.0003856887291906934, 'weight_decay': 2.094669729880164e-06, 'epochs': 209, 'loss': 'mae', 'optimizer': 'adam', 'graph_mode': 'off', 'use_snp_selection': True, 'num_snps': 27354}. Best is trial 5 with value: 0.056440586886236925.
[I 2025-12-05 15:43:11,341] Trial 22 finished with value: 0.0469346247135821 and parameters: {'model_type': 'mlp', 'hidden_dims': '[256, 128, 64]', 'dropout': 0.3331540302692072, 'batch_norm': True, 'lr': 0.00039289352670407777, 'weight_decay': 1.680130915097149e-07, 'epochs': 223, 'loss': 'mae', 'optimizer': 'adam', 'graph_mode': 'off', 'use_snp_selection': True, 'num_snps': 29818}. Best is trial 5 with value: 0.056440586886236925.
[I 2025-12-05 15:43:13,134] Trial 23 finished with value: 0.02245052538084292 and parameters: {'model_type': 'mlp', 'hidden_dims': '[256, 128, 64]', 'dropout': 0.23067324304766434, 'batch_norm': True, 'lr': 0.000992297876944906, 'weight_decay': 2.393073035256211e-07, 'epochs': 224, 'loss': 'mae', 'optimizer': 'adam', 'graph_mode': 'off', 'use_snp_selection': True, 'num_snps': 31127}. Best is trial 5 with value: 0.056440586886236925.
[I 2025-12-05 15:43:14,507] Trial 24 finished with value: 0.007235540458606695 and parameters: {'model_type': 'mlp', 'hidden_dims': '[512, 64]', 'dropout': 0.46947086760730145, 'batch_norm': True, 'lr': 0.00014342189233056374, 'weight_decay': 1.172367489837607e-07, 'epochs': 176, 'loss': 'mae', 'optimizer': 'adam', 'graph_mode': 'off', 'use_snp_selection': True, 'num_snps': 19713}. Best is trial 5 with value: 0.056440586886236925.
[I 2025-12-05 15:43:16,532] Trial 25 finished with value: 0.013684918259461836 and parameters: {'model_type': 'mlp', 'hidden_dims': '[256, 128, 64]', 'dropout': 0.4051724107747153, 'batch_norm': True, 'lr': 2.865487793193804e-05, 'weight_decay': 7.966447818594051e-07, 'epochs': 245, 'loss': 'mae', 'optimizer': 'adam', 'graph_mode': 'off', 'use_snp_selection': True, 'num_snps': 37038}. Best is trial 5 with value: 0.056440586886236925.
[I 2025-12-05 15:43:18,744] Trial 26 finished with value: 0.04404104412946404 and parameters: {'model_type': 'mlp', 'hidden_dims': '[512, 256]', 'dropout': 0.2924068225066207, 'batch_norm': True, 'lr': 0.00035637630610129274, 'weight_decay': 0.00016600056134858052, 'epochs': 130, 'loss': 'mae', 'optimizer': 'adam', 'graph_mode': 'off', 'use_snp_selection': True, 'num_snps': 43326}. Best is trial 5 with value: 0.056440586886236925.
[I 2025-12-05 15:43:20,232] Trial 27 finished with value: -0.0013814411247008182 and parameters: {'model_type': 'mlp', 'hidden_dims': '[512, 128]', 'dropout': 0.364274651815532, 'batch_norm': False, 'lr': 0.0004932640287487242, 'weight_decay': 4.038059882321688e-05, 'epochs': 186, 'loss': 'mse', 'optimizer': 'adam', 'graph_mode': 'off', 'use_snp_selection': True, 'num_snps': 23620}. Best is trial 5 with value: 0.056440586886236925.
[I 2025-12-05 15:43:21,566] Trial 28 finished with value: 0.04187215619173069 and parameters: {'model_type': 'mlp', 'hidden_dims': '[128, 64]', 'dropout': 0.2090621336573497, 'batch_norm': True, 'lr': 0.0002192861099354375, 'weight_decay': 1.0539484161167875e-07, 'epochs': 288, 'loss': 'mae', 'optimizer': 'adam', 'graph_mode': 'off', 'use_snp_selection': True, 'num_snps': 14638}. Best is trial 5 with value: 0.056440586886236925.
