[I 2025-12-06 03:12:23,530] Trial 78 finished with value: 0.31073735410709535 and parameters: {'model_type': 'mlp', 'hidden_dims': '[512, 256]', 'dropout': 0.15887178551619696, 'batch_norm': True, 'lr': 0.00023632574321233373, 'weight_decay': 3.808399802253184e-05, 'epochs': 221, 'loss': 'mse', 'optimizer': 'adam', 'graph_mode': 'off', 'use_snp_selection': False}. Best is trial 31 with value: 0.3185639258293952.
[I 2025-12-06 03:12:51,297] Trial 79 finished with value: 0.3178386729572414 and parameters: {'model_type': 'mlp', 'hidden_dims': '[512, 256]', 'dropout': 0.4826803268544565, 'batch_norm': True, 'lr': 0.00015747984415615527, 'weight_decay': 0.000244411121710134, 'epochs': 128, 'loss': 'mae', 'optimizer': 'adam', 'graph_mode': 'off', 'use_snp_selection': False}. Best is trial 31 with value: 0.3185639258293952.
[I 2025-12-06 03:13:18,907] Trial 80 finished with value: 0.2984097461074312 and parameters: {'model_type': 'mlp', 'hidden_dims': '[512, 256]', 'dropout': 0.4557212337415374, 'batch_norm': False, 'lr': 0.00016629598787734992, 'weight_decay': 0.0006197394596065548, 'epochs': 129, 'loss': 'mae', 'optimizer': 'adam', 'graph_mode': 'off', 'use_snp_selection': False}. Best is trial 31 with value: 0.3185639258293952.
[I 2025-12-06 03:13:38,273] Trial 81 finished with value: 0.3127018634063434 and parameters: {'model_type': 'mlp', 'hidden_dims': '[512, 256]', 'dropout': 0.2670414316813216, 'batch_norm': True, 'lr': 0.0001207753473208305, 'weight_decay': 0.00022848465942752015, 'epochs': 80, 'loss': 'mae', 'optimizer': 'adam', 'graph_mode': 'off', 'use_snp_selection': False}. Best is trial 31 with value: 0.3185639258293952.
[I 2025-12-06 03:14:16,504] Trial 82 finished with value: 0.31252445558757314 and parameters: {'model_type': 'mlp', 'hidden_dims': '[512, 256]', 'dropout': 0.4794803598994682, 'batch_norm': True, 'lr': 9.804543119631372e-05, 'weight_decay': 1.3246237637344193e-05, 'epochs': 187, 'loss': 'mae', 'optimizer': 'adam', 'graph_mode': 'off', 'use_snp_selection': False}. Best is trial 31 with value: 0.3185639258293952.
[I 2025-12-06 03:14:39,402] Trial 83 finished with value: 0.3161188519931607 and parameters: {'model_type': 'mlp', 'hidden_dims': '[512, 256]', 'dropout': 0.22359868147787093, 'batch_norm': True, 'lr': 0.00019670608387883711, 'weight_decay': 5.6731384426050064e-05, 'epochs': 100, 'loss': 'mae', 'optimizer': 'adam', 'graph_mode': 'off', 'use_snp_selection': False}. Best is trial 31 with value: 0.3185639258293952.
[I 2025-12-06 03:15:01,397] Trial 84 finished with value: 0.31557198160494093 and parameters: {'model_type': 'mlp', 'hidden_dims': '[512, 256]', 'dropout': 0.4923757848293242, 'batch_norm': True, 'lr': 0.00037886898535792365, 'weight_decay': 0.00011503116861133742, 'epochs': 95, 'loss': 'mae', 'optimizer': 'adam', 'graph_mode': 'off', 'use_snp_selection': False}. Best is trial 31 with value: 0.3185639258293952.
[I 2025-12-06 03:15:27,486] Trial 85 finished with value: 0.31853122736241346 and parameters: {'model_type': 'mlp', 'hidden_dims': '[512, 256]', 'dropout': 0.5769389072362742, 'batch_norm': True, 'lr': 0.00026494357092522297, 'weight_decay': 5.4573795721936456e-05, 'epochs': 118, 'loss': 'mae', 'optimizer': 'adam', 'graph_mode': 'off', 'use_snp_selection': False}. Best is trial 31 with value: 0.3185639258293952.
[I 2025-12-06 03:15:51,159] Trial 86 finished with value: 0.3147377756465813 and parameters: {'model_type': 'mlp', 'hidden_dims': '[512, 64]', 'dropout': 0.5833939486222796, 'batch_norm': True, 'lr': 0.0002579898734286233, 'weight_decay': 5.757962715762488e-05, 'epochs': 105, 'loss': 'mae', 'optimizer': 'adam', 'graph_mode': 'off', 'use_snp_selection': False}. Best is trial 31 with value: 0.3185639258293952.
[I 2025-12-06 03:16:16,517] Trial 87 finished with value: 0.3157474842957082 and parameters: {'model_type': 'mlp', 'hidden_dims': '[512, 256]', 'dropout': 0.5489599270086342, 'batch_norm': True, 'lr': 0.00020495139321962034, 'weight_decay': 0.0001871709343716809, 'epochs': 114, 'loss': 'mae', 'optimizer': 'adam', 'graph_mode': 'off', 'use_snp_selection': False}. Best is trial 31 with value: 0.3185639258293952.
[I 2025-12-06 03:16:56,620] Trial 88 finished with value: 0.3111822525255546 and parameters: {'model_type': 'mlp', 'hidden_dims': '[256, 128]', 'dropout': 0.4915214681671604, 'batch_norm': True, 'lr': 0.00028792777006853996, 'weight_decay': 0.00026323828567109046, 'epochs': 73, 'loss': 'mae', 'optimizer': 'adam', 'graph_mode': 'off', 'use_snp_selection': True, 'num_snps': 48766}. Best is trial 31 with value: 0.3185639258293952.
[I 2025-12-06 03:17:06,007] Trial 89 finished with value: 0.3146329049438764 and parameters: {'model_type': 'mlp', 'hidden_dims': '[128, 64]', 'dropout': 0.5178501005217553, 'batch_norm': True, 'lr': 0.00017555819228252178, 'weight_decay': 3.123608196407066e-05, 'epochs': 95, 'loss': 'mse', 'optimizer': 'adam', 'graph_mode': 'off', 'use_snp_selection': False}. Best is trial 31 with value: 0.3185639258293952.
[I 2025-12-06 03:17:21,750] Trial 90 finished with value: 0.3175560550991964 and parameters: {'model_type': 'mlp', 'hidden_dims': '[512, 256]', 'dropout': 0.5278824297680677, 'batch_norm': True, 'lr': 0.0006355390473976127, 'weight_decay': 4.7646671724069425e-05, 'epochs': 60, 'loss': 'mae', 'optimizer': 'adam', 'graph_mode': 'off', 'use_snp_selection': False}. Best is trial 31 with value: 0.3185639258293952.
[I 2025-12-06 03:17:38,569] Trial 91 finished with value: 0.3156569909486683 and parameters: {'model_type': 'mlp', 'hidden_dims': '[512, 256]', 'dropout': 0.5842318353108445, 'batch_norm': True, 'lr': 0.0005950315400654231, 'weight_decay': 4.833927165814039e-05, 'epochs': 66, 'loss': 'mae', 'optimizer': 'adam', 'graph_mode': 'off', 'use_snp_selection': False}. Best is trial 31 with value: 0.3185639258293952.
[I 2025-12-06 03:17:57,798] Trial 92 finished with value: 0.31482954725176615 and parameters: {'model_type': 'mlp', 'hidden_dims': '[512, 256]', 'dropout': 0.5205639015858107, 'batch_norm': True, 'lr': 0.0004775029973506031, 'weight_decay': 6.799440136567751e-05, 'epochs': 80, 'loss': 'mae', 'optimizer': 'adam', 'graph_mode': 'off', 'use_snp_selection': False}. Best is trial 31 with value: 0.3185639258293952.
[I 2025-12-06 03:18:13,393] Trial 93 finished with value: 0.3142361799536973 and parameters: {'model_type': 'mlp', 'hidden_dims': '[512, 256]', 'dropout': 0.528923942907284, 'batch_norm': True, 'lr': 0.0007303338937893405, 'weight_decay': 0.00038671080798422907, 'epochs': 59, 'loss': 'mae', 'optimizer': 'adam', 'graph_mode': 'off', 'use_snp_selection': False}. Best is trial 31 with value: 0.3185639258293952.
[I 2025-12-06 03:18:40,391] Trial 94 finished with value: 0.3164625857532897 and parameters: {'model_type': 'mlp', 'hidden_dims': '[512, 128]', 'dropout': 0.5699988741092105, 'batch_norm': True, 'lr': 0.00036087942974727166, 'weight_decay': 3.884061069905594e-05, 'epochs': 124, 'loss': 'mae', 'optimizer': 'adam', 'graph_mode': 'off', 'use_snp_selection': False}. Best is trial 31 with value: 0.3185639258293952.
[I 2025-12-06 03:19:07,009] Trial 95 finished with value: 0.3126920750989445 and parameters: {'model_type': 'mlp', 'hidden_dims': '[512, 128]', 'dropout': 0.5641906352193236, 'batch_norm': True, 'lr': 0.00036309957391918483, 'weight_decay': 0.0001247716618759613, 'epochs': 122, 'loss': 'mae', 'optimizer': 'adam', 'graph_mode': 'off', 'use_snp_selection': False}. Best is trial 31 with value: 0.3185639258293952.
[I 2025-12-06 03:19:38,517] Trial 96 finished with value: 0.3147584099740811 and parameters: {'model_type': 'mlp', 'hidden_dims': '[512, 128]', 'dropout': 0.5687221859786836, 'batch_norm': True, 'lr': 0.00034842865827970935, 'weight_decay': 1.4588117300124488e-05, 'epochs': 150, 'loss': 'mae', 'optimizer': 'adam', 'graph_mode': 'off', 'use_snp_selection': False}. Best is trial 31 with value: 0.3185639258293952.
[I 2025-12-06 03:20:06,368] Trial 97 finished with value: 0.31484415351299555 and parameters: {'model_type': 'mlp', 'hidden_dims': '[512, 128]', 'dropout': 0.5979396765425304, 'batch_norm': True, 'lr': 0.0006174679854752345, 'weight_decay': 8.486248418272926e-06, 'epochs': 129, 'loss': 'mae', 'optimizer': 'adam', 'graph_mode': 'off', 'use_snp_selection': False}. Best is trial 31 with value: 0.3185639258293952.
[I 2025-12-06 03:20:19,907] Trial 98 finished with value: 0.21405810453793128 and parameters: {'model_type': 'mlp', 'hidden_dims': '[512, 128]', 'dropout': 0.5490109193353544, 'batch_norm': False, 'lr': 0.0004632114993266646, 'weight_decay': 4.262030722831133e-05, 'epochs': 48, 'loss': 'mae', 'optimizer': 'adam', 'graph_mode': 'off', 'use_snp_selection': False}. Best is trial 31 with value: 0.3185639258293952.
[I 2025-12-06 03:20:34,864] Trial 99 finished with value: 0.32018584610369066 and parameters: {'model_type': 'mlp', 'hidden_dims': '[256, 128, 64]', 'dropout': 0.5468465056814708, 'batch_norm': True, 'lr': 0.00023535330692876641, 'weight_decay': 2.5260753559686095e-05, 'epochs': 112, 'loss': 'mae', 'optimizer': 'adam', 'graph_mode': 'off', 'use_snp_selection': False}. Best is trial 99 with value: 0.32018584610369066.
[I 2025-12-06 03:20:49,682] Trial 100 finished with value: 0.3135650564863339 and parameters: {'model_type': 'mlp', 'hidden_dims': '[256, 128, 64]', 'dropout': 0.5028640574945117, 'batch_norm': True, 'lr': 0.0001420617635677831, 'weight_decay': 1.933370569195795e-05, 'epochs': 110, 'loss': 'mae', 'optimizer': 'adam', 'graph_mode': 'off', 'use_snp_selection': False}. Best is trial 99 with value: 0.32018584610369066.
[I 2025-12-06 03:21:07,241] Trial 101 finished with value: 0.3135648248849618 and parameters: {'model_type': 'mlp', 'hidden_dims': '[256, 128, 64]', 'dropout': 0.5417921142537152, 'batch_norm': True, 'lr': 0.00023876377301200355, 'weight_decay': 2.6753442096127738e-05, 'epochs': 140, 'loss': 'mae', 'optimizer': 'adam', 'graph_mode': 'off', 'use_snp_selection': False}. Best is trial 99 with value: 0.32018584610369066.
[I 2025-12-06 03:21:19,461] Trial 102 finished with value: 0.31662168553289416 and parameters: {'model_type': 'mlp', 'hidden_dims': '[256, 128, 64]', 'dropout': 0.5721553770421213, 'batch_norm': True, 'lr': 0.00030044516260503663, 'weight_decay': 3.6698445972288694e-05, 'epochs': 82, 'loss': 'mae', 'optimizer': 'adam', 'graph_mode': 'off', 'use_snp_selection': False}. Best is trial 99 with value: 0.32018584610369066.
[I 2025-12-06 03:21:32,307] Trial 103 finished with value: 0.31598658392170315 and parameters: {'model_type': 'mlp', 'hidden_dims': '[256, 128, 64]', 'dropout': 0.5819902850407852, 'batch_norm': True, 'lr': 0.0002713109726198246, 'weight_decay': 3.217729645649914e-05, 'epochs': 89, 'loss': 'mae', 'optimizer': 'adam', 'graph_mode': 'off', 'use_snp_selection': False}. Best is trial 99 with value: 0.32018584610369066.
[I 2025-12-06 03:21:45,277] Trial 104 finished with value: 0.3181117301450137 and parameters: {'model_type': 'mlp', 'hidden_dims': '[256, 128, 64]', 'dropout': 0.5527019540758917, 'batch_norm': True, 'lr': 0.0008465359369422363, 'weight_decay': 0.00010092239549376685, 'epochs': 90, 'loss': 'mae', 'optimizer': 'adam', 'graph_mode': 'off', 'use_snp_selection': False}. Best is trial 99 with value: 0.32018584610369066.
[I 2025-12-06 03:21:55,484] Trial 105 finished with value: 0.3158892850250581 and parameters: {'model_type': 'mlp', 'hidden_dims': '[256, 128, 64]', 'dropout': 0.5328136508169654, 'batch_norm': True, 'lr': 0.0005350930432633835, 'weight_decay': 4.9381365276693116e-05, 'epochs': 60, 'loss': 'mae', 'optimizer': 'adam', 'graph_mode': 'off', 'use_snp_selection': False}. Best is trial 99 with value: 0.32018584610369066.
[I 2025-12-06 03:22:07,592] Trial 106 finished with value: 0.31247604161264303 and parameters: {'model_type': 'mlp', 'hidden_dims': '[256, 128, 64]', 'dropout': 0.5552189332554183, 'batch_norm': True, 'lr': 0.0008380300877239371, 'weight_decay': 2.2986731761328144e-05, 'epochs': 81, 'loss': 'mae', 'optimizer': 'adam', 'graph_mode': 'off', 'use_snp_selection': False}. Best is trial 99 with value: 0.32018584610369066.
[I 2025-12-06 03:22:38,745] Trial 107 finished with value: 0.3063411538069321 and parameters: {'model_type': 'mlp', 'hidden_dims': '[256, 128, 64]', 'dropout': 0.5240255885613712, 'batch_norm': True, 'lr': 0.0008990335433787947, 'weight_decay': 6.637806229377801e-05, 'epochs': 74, 'loss': 'mse', 'optimizer': 'adam', 'graph_mode': 'off', 'use_snp_selection': True, 'num_snps': 26771}. Best is trial 99 with value: 0.32018584610369066.
[I 2025-12-06 03:22:51,384] Trial 108 finished with value: 0.31205532527633795 and parameters: {'model_type': 'mlp', 'hidden_dims': '[256, 128, 64]', 'dropout': 0.5738664066697245, 'batch_norm': True, 'lr': 0.0006948204464086409, 'weight_decay': 4.660130587329763e-06, 'epochs': 87, 'loss': 'mae', 'optimizer': 'adam', 'graph_mode': 'off', 'use_snp_selection': False}. Best is trial 99 with value: 0.32018584610369066.
[I 2025-12-06 03:23:06,816] Trial 109 finished with value: 0.31102380044773165 and parameters: {'model_type': 'mlp', 'hidden_dims': '[256, 128, 64]', 'dropout': 0.5080212165420823, 'batch_norm': True, 'lr': 0.0003145687136784808, 'weight_decay': 0.00017360177056887686, 'epochs': 117, 'loss': 'mae', 'optimizer': 'adam', 'graph_mode': 'off', 'use_snp_selection': False}. Best is trial 99 with value: 0.32018584610369066.
[I 2025-12-06 03:23:17,405] Trial 110 finished with value: 0.32169662104776464 and parameters: {'model_type': 'mlp', 'hidden_dims': '[256, 128, 64]', 'dropout': 0.5914526644591808, 'batch_norm': True, 'lr': 0.00043129620027266934, 'weight_decay': 8.395690333448803e-05, 'epochs': 64, 'loss': 'mae', 'optimizer': 'adam', 'graph_mode': 'off', 'use_snp_selection': False}. Best is trial 110 with value: 0.32169662104776464.
[I 2025-12-06 03:23:30,649] Trial 111 finished with value: 0.3144308866274238 and parameters: {'model_type': 'mlp', 'hidden_dims': '[256, 128, 64]', 'dropout': 0.5906088240701992, 'batch_norm': True, 'lr': 0.0004157762430429053, 'weight_decay': 0.00014336367465625586, 'epochs': 93, 'loss': 'mae', 'optimizer': 'adam', 'graph_mode': 'off', 'use_snp_selection': False}. Best is trial 110 with value: 0.32169662104776464.
[I 2025-12-06 03:23:41,392] Trial 112 finished with value: 0.31558183261570416 and parameters: {'model_type': 'mlp', 'hidden_dims': '[256, 128, 64]', 'dropout': 0.5387889453907543, 'batch_norm': True, 'lr': 0.00022035902499692995, 'weight_decay': 0.00010861381276710885, 'epochs': 66, 'loss': 'mae', 'optimizer': 'adam', 'graph_mode': 'off', 'use_snp_selection': False}. Best is trial 110 with value: 0.32169662104776464.
[I 2025-12-06 03:24:18,169] Trial 113 finished with value: 0.30506477363888296 and parameters: {'model_type': 'mlp', 'hidden_dims': '[256, 128, 64]', 'dropout': 0.5761152051478233, 'batch_norm': True, 'lr': 0.0006111642587208792, 'weight_decay': 8.921255459072047e-05, 'epochs': 349, 'loss': 'mae', 'optimizer': 'adam', 'graph_mode': 'off', 'use_snp_selection': False}. Best is trial 110 with value: 0.32169662104776464.
[I 2025-12-06 03:24:32,244] Trial 114 finished with value: 0.3230563431000552 and parameters: {'model_type': 'mlp', 'hidden_dims': '[256, 128, 64]', 'dropout': 0.5991731133317604, 'batch_norm': True, 'lr': 0.0009854595031805235, 'weight_decay': 6.837949750666113e-05, 'epochs': 102, 'loss': 'mae', 'optimizer': 'adam', 'graph_mode': 'off', 'use_snp_selection': False}. Best is trial 114 with value: 0.3230563431000552.
[I 2025-12-06 03:24:46,733] Trial 115 finished with value: 0.31537449480892193 and parameters: {'model_type': 'mlp', 'hidden_dims': '[256, 128, 64]', 'dropout': 0.59319037815645, 'batch_norm': True, 'lr': 0.0007725395152245138, 'weight_decay': 8.510154040179574e-05, 'epochs': 107, 'loss': 'mae', 'optimizer': 'adam', 'graph_mode': 'off', 'use_snp_selection': False}. Best is trial 114 with value: 0.3230563431000552.
[I 2025-12-06 03:25:00,893] Trial 116 finished with value: 0.30926292185266757 and parameters: {'model_type': 'mlp', 'hidden_dims': '[256, 128, 64]', 'dropout': 0.5552634381110853, 'batch_norm': True, 'lr': 0.000515824764904629, 'weight_decay': 7.278261713733842e-05, 'epochs': 103, 'loss': 'mae', 'optimizer': 'adam', 'graph_mode': 'off', 'use_snp_selection': False}. Best is trial 114 with value: 0.3230563431000552.
[I 2025-12-06 03:25:10,474] Trial 117 finished with value: -0.005855828422033693 and parameters: {'model_type': 'mlp', 'hidden_dims': '[256, 128, 64]', 'dropout': 0.5481055786320652, 'batch_norm': False, 'lr': 0.0008637893659373362, 'weight_decay': 5.8126975005052375e-05, 'epochs': 54, 'loss': 'mae', 'optimizer': 'adam', 'graph_mode': 'off', 'use_snp_selection': False}. Best is trial 114 with value: 0.3230563431000552.
[I 2025-12-06 03:26:11,462] Trial 118 finished with value: 0.3035309689817208 and parameters: {'model_type': 'mlp', 'hidden_dims': '[512, 256]', 'dropout': 0.5894538230766594, 'batch_norm': True, 'lr': 2.978180605979622e-06, 'weight_decay': 0.00013304100354868072, 'epochs': 317, 'loss': 'mae', 'optimizer': 'adam', 'graph_mode': 'off', 'use_snp_selection': False}. Best is trial 114 with value: 0.3230563431000552.
[I 2025-12-06 03:26:42,251] Trial 119 finished with value: 0.3096433606714698 and parameters: {'model_type': 'mlp', 'hidden_dims': '[256, 128]', 'dropout': 0.5990127129355303, 'batch_norm': True, 'lr': 0.0009616483462419929, 'weight_decay': 0.0001086218807539257, 'epochs': 284, 'loss': 'mae', 'optimizer': 'adam', 'graph_mode': 'off', 'use_snp_selection': False}. Best is trial 114 with value: 0.3230563431000552.
[I 2025-12-06 03:26:53,379] Trial 120 finished with value: 0.30988188037897807 and parameters: {'model_type': 'mlp', 'hidden_dims': '[128, 64]', 'dropout': 0.5592553271565586, 'batch_norm': True, 'lr': 0.00012338113199483823, 'weight_decay': 0.0002586023280282042, 'epochs': 130, 'loss': 'mae', 'optimizer': 'adam', 'graph_mode': 'off', 'use_snp_selection': False}. Best is trial 114 with value: 0.3230563431000552.
[I 2025-12-06 03:27:05,511] Trial 121 finished with value: 0.30985428211606597 and parameters: {'model_type': 'mlp', 'hidden_dims': '[256, 128, 64]', 'dropout': 0.5702161868807869, 'batch_norm': True, 'lr': 0.0003001869876394202, 'weight_decay': 4.4441838289126046e-05, 'epochs': 81, 'loss': 'mae', 'optimizer': 'adam', 'graph_mode': 'off', 'use_snp_selection': False}. Best is trial 114 with value: 0.3230563431000552.
[I 2025-12-06 03:27:18,646] Trial 122 finished with value: 0.31209281388409194 and parameters: {'model_type': 'mlp', 'hidden_dims': '[256, 128, 64]', 'dropout': 0.43795091384728385, 'batch_norm': True, 'lr': 0.0004351484262109809, 'weight_decay': 6.379702006914882e-05, 'epochs': 92, 'loss': 'mae', 'optimizer': 'adam', 'graph_mode': 'off', 'use_snp_selection': False}. Best is trial 114 with value: 0.3230563431000552.
[I 2025-12-06 03:27:53,664] Trial 123 finished with value: 0.30609466106909594 and parameters: {'model_type': 'mlp', 'hidden_dims': '[256, 128, 64]', 'dropout': 0.11330340998488808, 'batch_norm': True, 'lr': 0.00015686533863912112, 'weight_decay': 3.588042536643478e-05, 'epochs': 330, 'loss': 'mae', 'optimizer': 'adam', 'graph_mode': 'off', 'use_snp_selection': False}. Best is trial 114 with value: 0.3230563431000552.
[I 2025-12-06 03:28:16,348] Trial 124 finished with value: 0.31154407603813694 and parameters: {'model_type': 'mlp', 'hidden_dims': '[512, 64]', 'dropout': 0.5787870447124576, 'batch_norm': True, 'lr': 0.0002579237109255927, 'weight_decay': 5.5144519094602026e-05, 'epochs': 100, 'loss': 'mae', 'optimizer': 'adam', 'graph_mode': 'off', 'use_snp_selection': False}. Best is trial 114 with value: 0.3230563431000552.
[I 2025-12-06 03:28:26,923] Trial 125 finished with value: 0.3094339216888901 and parameters: {'model_type': 'mlp', 'hidden_dims': '[256, 128, 64]', 'dropout': 0.40468774369803495, 'batch_norm': True, 'lr': 0.0006561547234711399, 'weight_decay': 7.686885149499059e-05, 'epochs': 64, 'loss': 'mae', 'optimizer': 'adam', 'graph_mode': 'off', 'use_snp_selection': False}. Best is trial 114 with value: 0.3230563431000552.
[I 2025-12-06 03:28:45,166] Trial 126 finished with value: 0.30834188059561196 and parameters: {'model_type': 'mlp', 'hidden_dims': '[512, 256]', 'dropout': 0.24027109834004723, 'batch_norm': True, 'lr': 0.00020520651959076935, 'weight_decay': 2.800965808694135e-05, 'epochs': 74, 'loss': 'mae', 'optimizer': 'adam', 'graph_mode': 'off', 'use_snp_selection': False}. Best is trial 114 with value: 0.3230563431000552.
[I 2025-12-06 03:29:00,515] Trial 127 finished with value: 0.31094088351719856 and parameters: {'model_type': 'mlp', 'hidden_dims': '[256, 128, 64]', 'dropout': 0.5414150795368148, 'batch_norm': True, 'lr': 0.0005603576743629133, 'weight_decay': 0.0001719459076191747, 'epochs': 116, 'loss': 'mse', 'optimizer': 'adam', 'graph_mode': 'off', 'use_snp_selection': False}. Best is trial 114 with value: 0.3230563431000552.
[I 2025-12-06 03:29:26,547] Trial 128 finished with value: 0.3052695635779943 and parameters: {'model_type': 'mlp', 'hidden_dims': '[512, 256]', 'dropout': 0.5620648444855638, 'batch_norm': True, 'lr': 0.00013456727369045015, 'weight_decay': 9.25969748327268e-05, 'epochs': 46, 'loss': 'mae', 'optimizer': 'adam', 'graph_mode': 'off', 'use_snp_selection': True, 'num_snps': 12722}. Best is trial 114 with value: 0.3230563431000552.
[I 2025-12-06 03:30:18,035] Trial 129 finished with value: 0.3140828198969231 and parameters: {'model_type': 'mlp', 'hidden_dims': '[512, 256]', 'dropout': 0.36788317250434943, 'batch_norm': True, 'lr': 0.0003852991958813588, 'weight_decay': 4.976516242821694e-05, 'epochs': 263, 'loss': 'mae', 'optimizer': 'adam', 'graph_mode': 'off', 'use_snp_selection': False}. Best is trial 114 with value: 0.3230563431000552.
