[I 2025-12-05 14:34:19,989] Trial 108 finished with value: 0.11889451771928972 and parameters: {'model_type': 'mlp', 'hidden_dims': '[512, 64]', 'dropout': 0.15376318928640978, 'batch_norm': True, 'lr': 0.0004320318057958569, 'weight_decay': 1.8086635027374254e-07, 'epochs': 132, 'loss': 'mae', 'optimizer': 'adam', 'graph_mode': 'off', 'use_snp_selection': True, 'num_snps': 38309}. Best is trial 100 with value: 0.13027580647726633.
[I 2025-12-05 14:34:22,399] Trial 109 finished with value: 0.10198285797954958 and parameters: {'model_type': 'mlp', 'hidden_dims': '[256, 128, 64]', 'dropout': 0.18156950534798405, 'batch_norm': True, 'lr': 0.0005390537351637015, 'weight_decay': 2.7907730367127223e-07, 'epochs': 184, 'loss': 'mae', 'optimizer': 'adam', 'graph_mode': 'off', 'use_snp_selection': True, 'num_snps': 48299}. Best is trial 100 with value: 0.13027580647726633.
[I 2025-12-05 14:34:24,463] Trial 110 finished with value: 0.11307397986459372 and parameters: {'model_type': 'mlp', 'hidden_dims': '[512, 64]', 'dropout': 0.19716852799825818, 'batch_norm': True, 'lr': 0.0006729164357431908, 'weight_decay': 1.461015979977975e-07, 'epochs': 147, 'loss': 'mae', 'optimizer': 'adam', 'graph_mode': 'off', 'use_snp_selection': True, 'num_snps': 35643}. Best is trial 100 with value: 0.13027580647726633.
[I 2025-12-05 14:34:26,932] Trial 111 finished with value: 0.1192858200304444 and parameters: {'model_type': 'mlp', 'hidden_dims': '[512, 64]', 'dropout': 0.1122802068869505, 'batch_norm': True, 'lr': 0.0004380056634981128, 'weight_decay': 2.2344405645115512e-07, 'epochs': 166, 'loss': 'mae', 'optimizer': 'adam', 'graph_mode': 'off', 'use_snp_selection': True, 'num_snps': 44672}. Best is trial 100 with value: 0.13027580647726633.
[I 2025-12-05 14:34:29,431] Trial 112 finished with value: 0.11529151668097744 and parameters: {'model_type': 'mlp', 'hidden_dims': '[512, 64]', 'dropout': 0.11694849964858374, 'batch_norm': True, 'lr': 0.0004624029806121032, 'weight_decay': 2.0855601347623472e-07, 'epochs': 158, 'loss': 'mae', 'optimizer': 'adam', 'graph_mode': 'off', 'use_snp_selection': True, 'num_snps': 45485}. Best is trial 100 with value: 0.13027580647726633.
[I 2025-12-05 14:34:31,745] Trial 113 finished with value: 0.12071768993674271 and parameters: {'model_type': 'mlp', 'hidden_dims': '[512, 64]', 'dropout': 0.13010882266856538, 'batch_norm': True, 'lr': 0.00021850118555277818, 'weight_decay': 1.6577254720888095e-07, 'epochs': 168, 'loss': 'mae', 'optimizer': 'adam', 'graph_mode': 'off', 'use_snp_selection': True, 'num_snps': 40719}. Best is trial 100 with value: 0.13027580647726633.
[I 2025-12-05 14:34:34,367] Trial 114 finished with value: 0.11088744200050138 and parameters: {'model_type': 'mlp', 'hidden_dims': '[512, 64]', 'dropout': 0.10001729037181778, 'batch_norm': True, 'lr': 0.0006043289562373022, 'weight_decay': 1.1890875106604773e-07, 'epochs': 172, 'loss': 'mae', 'optimizer': 'adam', 'graph_mode': 'off', 'use_snp_selection': True, 'num_snps': 46460}. Best is trial 100 with value: 0.13027580647726633.
[I 2025-12-05 14:34:36,732] Trial 115 finished with value: 0.12138471712195997 and parameters: {'model_type': 'mlp', 'hidden_dims': '[512, 64]', 'dropout': 0.1662721267022997, 'batch_norm': True, 'lr': 0.0008782116722246873, 'weight_decay': 2.499564698000656e-07, 'epochs': 137, 'loss': 'mae', 'optimizer': 'adam', 'graph_mode': 'off', 'use_snp_selection': True, 'num_snps': 43767}. Best is trial 100 with value: 0.13027580647726633.
[I 2025-12-05 14:34:38,608] Trial 116 finished with value: 0.11067533021667826 and parameters: {'model_type': 'mlp', 'hidden_dims': '[512, 256]', 'dropout': 0.15420549927045693, 'batch_norm': True, 'lr': 0.0003716970719533771, 'weight_decay': 1.4193166014810886e-07, 'epochs': 127, 'loss': 'mae', 'optimizer': 'adam', 'graph_mode': 'off', 'use_snp_selection': True, 'num_snps': 32312}. Best is trial 100 with value: 0.13027580647726633.
[I 2025-12-05 14:34:40,874] Trial 117 finished with value: 0.1171886667264759 and parameters: {'model_type': 'mlp', 'hidden_dims': '[512, 64]', 'dropout': 0.14167431508119943, 'batch_norm': True, 'lr': 0.0007429075149820007, 'weight_decay': 1.0250096737003299e-07, 'epochs': 66, 'loss': 'mae', 'optimizer': 'adam', 'graph_mode': 'off', 'use_snp_selection': True, 'num_snps': 48204}. Best is trial 100 with value: 0.13027580647726633.
[I 2025-12-05 14:34:43,095] Trial 118 finished with value: 0.11130649380411084 and parameters: {'model_type': 'mlp', 'hidden_dims': '[512, 64]', 'dropout': 0.12269330993031853, 'batch_norm': True, 'lr': 0.00054369014358419, 'weight_decay': 3.160561221461433e-07, 'epochs': 180, 'loss': 'mse', 'optimizer': 'adam', 'graph_mode': 'off', 'use_snp_selection': True, 'num_snps': 37701}. Best is trial 100 with value: 0.13027580647726633.
[I 2025-12-05 14:34:45,323] Trial 119 finished with value: 0.12235855292191705 and parameters: {'model_type': 'mlp', 'hidden_dims': '[512, 64]', 'dropout': 0.21232769390705286, 'batch_norm': True, 'lr': 0.00030361931186618184, 'weight_decay': 1.895530830261368e-07, 'epochs': 144, 'loss': 'mae', 'optimizer': 'adam', 'graph_mode': 'off', 'use_snp_selection': True, 'num_snps': 41072}. Best is trial 100 with value: 0.13027580647726633.
[I 2025-12-05 14:34:47,219] Trial 120 finished with value: 0.12131431733510456 and parameters: {'model_type': 'mlp', 'hidden_dims': '[128, 64]', 'dropout': 0.2120187994354876, 'batch_norm': True, 'lr': 0.00029703046923083696, 'weight_decay': 1.7790326373367427e-07, 'epochs': 110, 'loss': 'mae', 'optimizer': 'adam', 'graph_mode': 'off', 'use_snp_selection': True, 'num_snps': 41244}. Best is trial 100 with value: 0.13027580647726633.
[I 2025-12-05 14:34:49,707] Trial 121 finished with value: 0.10942474838820081 and parameters: {'model_type': 'mlp', 'hidden_dims': '[512, 64]', 'dropout': 0.17904599816477673, 'batch_norm': True, 'lr': 0.0002694606823472242, 'weight_decay': 2.0842645565795566e-07, 'epochs': 145, 'loss': 'mae', 'optimizer': 'adam', 'graph_mode': 'off', 'use_snp_selection': True, 'num_snps': 44695}. Best is trial 100 with value: 0.13027580647726633.
[I 2025-12-05 14:34:51,652] Trial 122 finished with value: 0.11925866414600844 and parameters: {'model_type': 'mlp', 'hidden_dims': '[512, 64]', 'dropout': 0.25537405028048416, 'batch_norm': True, 'lr': 0.00041325466900822653, 'weight_decay': 1.313104602149252e-07, 'epochs': 155, 'loss': 'mae', 'optimizer': 'adam', 'graph_mode': 'off', 'use_snp_selection': True, 'num_snps': 33206}. Best is trial 100 with value: 0.13027580647726633.
[I 2025-12-05 14:34:53,892] Trial 123 finished with value: 0.12164335167002914 and parameters: {'model_type': 'mlp', 'hidden_dims': '[512, 64]', 'dropout': 0.1901536925568681, 'batch_norm': True, 'lr': 0.0007068744476407033, 'weight_decay': 2.4247323193491346e-07, 'epochs': 117, 'loss': 'mae', 'optimizer': 'adam', 'graph_mode': 'off', 'use_snp_selection': True, 'num_snps': 42521}. Best is trial 100 with value: 0.13027580647726633.
[I 2025-12-05 14:34:56,489] Trial 124 finished with value: 0.11293007158063012 and parameters: {'model_type': 'mlp', 'hidden_dims': '[512, 64]', 'dropout': 0.1698158059316877, 'batch_norm': True, 'lr': 0.0008838982610055848, 'weight_decay': 1.5852507211663887e-07, 'epochs': 164, 'loss': 'mae', 'optimizer': 'adam', 'graph_mode': 'off', 'use_snp_selection': True, 'num_snps': 46711}. Best is trial 100 with value: 0.13027580647726633.
[I 2025-12-05 14:34:58,535] Trial 125 finished with value: 0.12004658133323837 and parameters: {'model_type': 'mlp', 'hidden_dims': '[512, 64]', 'dropout': 0.20231423943026286, 'batch_norm': True, 'lr': 0.0005070495257073795, 'weight_decay': 1.0224235881578722e-07, 'epochs': 140, 'loss': 'mae', 'optimizer': 'adam', 'graph_mode': 'off', 'use_snp_selection': True, 'num_snps': 35713}. Best is trial 100 with value: 0.13027580647726633.
[I 2025-12-05 14:35:00,456] Trial 126 finished with value: 0.1141083686776277 and parameters: {'model_type': 'mlp', 'hidden_dims': '[256, 128]', 'dropout': 0.1567946497959654, 'batch_norm': True, 'lr': 0.00035049875247301676, 'weight_decay': 1.940966140836167e-07, 'epochs': 151, 'loss': 'mae', 'optimizer': 'adam', 'graph_mode': 'off', 'use_snp_selection': True, 'num_snps': 39313}. Best is trial 100 with value: 0.13027580647726633.
[I 2025-12-05 14:35:02,823] Trial 127 finished with value: 0.11596496923532158 and parameters: {'model_type': 'mlp', 'hidden_dims': '[512, 64]', 'dropout': 0.22919222333814415, 'batch_norm': True, 'lr': 0.000587111424661077, 'weight_decay': 2.9222359092831116e-07, 'epochs': 131, 'loss': 'mae', 'optimizer': 'adam', 'graph_mode': 'off', 'use_snp_selection': True, 'num_snps': 44385}. Best is trial 100 with value: 0.13027580647726633.
[I 2025-12-05 14:35:04,397] Trial 128 finished with value: 0.11943399007247264 and parameters: {'model_type': 'mlp', 'hidden_dims': '[512, 64]', 'dropout': 0.10973472489396284, 'batch_norm': True, 'lr': 0.00045039083573812823, 'weight_decay': 1.298684819460582e-07, 'epochs': 97, 'loss': 'mae', 'optimizer': 'adam', 'graph_mode': 'off', 'use_snp_selection': True, 'num_snps': 26634}. Best is trial 100 with value: 0.13027580647726633.
[I 2025-12-05 14:35:06,857] Trial 129 finished with value: 0.10317659224575981 and parameters: {'model_type': 'mlp', 'hidden_dims': '[256, 128, 64]', 'dropout': 0.24482155116044363, 'batch_norm': True, 'lr': 0.0007540246605373082, 'weight_decay': 3.8143983645293583e-07, 'epochs': 188, 'loss': 'mae', 'optimizer': 'adam', 'graph_mode': 'off', 'use_snp_selection': True, 'num_snps': 51460}. Best is trial 100 with value: 0.13027580647726633.
[I 2025-12-05 14:35:09,179] Trial 130 finished with value: 0.11688600666382959 and parameters: {'model_type': 'mlp', 'hidden_dims': '[512, 64]', 'dropout': 0.14621285214544255, 'batch_norm': True, 'lr': 0.0006382100274617686, 'weight_decay': 1.8301894021671412e-07, 'epochs': 122, 'loss': 'mae', 'optimizer': 'adam', 'graph_mode': 'off', 'use_snp_selection': True, 'num_snps': 43311}. Best is trial 100 with value: 0.13027580647726633.
[I 2025-12-05 14:35:11,510] Trial 131 finished with value: 0.11901655495881057 and parameters: {'model_type': 'mlp', 'hidden_dims': '[512, 64]', 'dropout': 0.1611098482881771, 'batch_norm': True, 'lr': 0.0009355237328367975, 'weight_decay': 1.2093656143535489e-07, 'epochs': 145, 'loss': 'mae', 'optimizer': 'adam', 'graph_mode': 'off', 'use_snp_selection': True, 'num_snps': 42658}. Best is trial 100 with value: 0.13027580647726633.
[I 2025-12-05 14:35:13,736] Trial 132 finished with value: 0.1206595633987215 and parameters: {'model_type': 'mlp', 'hidden_dims': '[512, 64]', 'dropout': 0.19119711401925438, 'batch_norm': True, 'lr': 0.0009848868103524003, 'weight_decay': 1.3745568994046015e-07, 'epochs': 140, 'loss': 'mae', 'optimizer': 'adam', 'graph_mode': 'off', 'use_snp_selection': True, 'num_snps': 41455}. Best is trial 100 with value: 0.13027580647726633.
[I 2025-12-05 14:35:16,408] Trial 133 finished with value: 0.1109343557378853 and parameters: {'model_type': 'mlp', 'hidden_dims': '[512, 64]', 'dropout': 0.1740610661092688, 'batch_norm': True, 'lr': 0.000809057753654373, 'weight_decay': 2.1922922336894632e-07, 'epochs': 157, 'loss': 'mae', 'optimizer': 'adam', 'graph_mode': 'off', 'use_snp_selection': True, 'num_snps': 49714}. Best is trial 100 with value: 0.13027580647726633.
[I 2025-12-05 14:35:18,941] Trial 134 finished with value: 0.10970531667139737 and parameters: {'model_type': 'mlp', 'hidden_dims': '[512, 64]', 'dropout': 0.2088420358199786, 'batch_norm': True, 'lr': 0.0007036027308348654, 'weight_decay': 1.5113626355850524e-07, 'epochs': 175, 'loss': 'mae', 'optimizer': 'adam', 'graph_mode': 'off', 'use_snp_selection': True, 'num_snps': 45624}. Best is trial 100 with value: 0.13027580647726633.
[I 2025-12-05 14:35:21,188] Trial 135 finished with value: 0.11171623701694683 and parameters: {'model_type': 'mlp', 'hidden_dims': '[512, 64]', 'dropout': 0.1346358169172808, 'batch_norm': True, 'lr': 0.0004853332838965057, 'weight_decay': 1.0084001713750188e-07, 'epochs': 147, 'loss': 'mae', 'optimizer': 'adam', 'graph_mode': 'off', 'use_snp_selection': True, 'num_snps': 40421}. Best is trial 100 with value: 0.13027580647726633.
[I 2025-12-05 14:35:22,989] Trial 136 finished with value: 0.10235488264247167 and parameters: {'model_type': 'mlp', 'hidden_dims': '[512, 64]', 'dropout': 0.16418425762610991, 'batch_norm': True, 'lr': 0.0006060958663562687, 'weight_decay': 2.644099593359778e-07, 'epochs': 163, 'loss': 'mae', 'optimizer': 'adam', 'graph_mode': 'off', 'use_snp_selection': True, 'num_snps': 30896}. Best is trial 100 with value: 0.13027580647726633.
[I 2025-12-05 14:35:25,067] Trial 137 finished with value: 0.12461116871004535 and parameters: {'model_type': 'mlp', 'hidden_dims': '[512, 64]', 'dropout': 0.18257876195293, 'batch_norm': True, 'lr': 0.0008523988238691394, 'weight_decay': 1.202872174605575e-07, 'epochs': 129, 'loss': 'mae', 'optimizer': 'adam', 'graph_mode': 'off', 'use_snp_selection': True, 'num_snps': 37860}. Best is trial 100 with value: 0.13027580647726633.
[I 2025-12-05 14:35:27,059] Trial 138 finished with value: 0.10863237935427184 and parameters: {'model_type': 'mlp', 'hidden_dims': '[512, 64]', 'dropout': 0.18156667784952274, 'batch_norm': True, 'lr': 0.0003752935525223675, 'weight_decay': 1.6714765247731325e-07, 'epochs': 107, 'loss': 'mse', 'optimizer': 'adam', 'graph_mode': 'off', 'use_snp_selection': True, 'num_snps': 37481}. Best is trial 100 with value: 0.13027580647726633.
[I 2025-12-05 14:35:28,969] Trial 139 finished with value: 0.11491378344523019 and parameters: {'model_type': 'mlp', 'hidden_dims': '[512, 256]', 'dropout': 0.22251278820086895, 'batch_norm': True, 'lr': 0.0005205408474483648, 'weight_decay': 8.911482116827924e-05, 'epochs': 121, 'loss': 'mae', 'optimizer': 'adam', 'graph_mode': 'off', 'use_snp_selection': True, 'num_snps': 35619}. Best is trial 100 with value: 0.13027580647726633.
[I 2025-12-05 14:35:30,935] Trial 140 finished with value: 0.12909910074533062 and parameters: {'model_type': 'mlp', 'hidden_dims': '[512, 64]', 'dropout': 0.12515306339179166, 'batch_norm': True, 'lr': 0.0008054521338869358, 'weight_decay': 1.234012071496523e-07, 'epochs': 90, 'loss': 'mae', 'optimizer': 'adam', 'graph_mode': 'off', 'use_snp_selection': True, 'num_snps': 39095}. Best is trial 100 with value: 0.13027580647726633.
[I 2025-12-05 14:35:32,958] Trial 141 finished with value: 0.12287848546559212 and parameters: {'model_type': 'mlp', 'hidden_dims': '[512, 64]', 'dropout': 0.11864564142157942, 'batch_norm': True, 'lr': 0.0008228945303337153, 'weight_decay': 1.2064937248837022e-07, 'epochs': 92, 'loss': 'mae', 'optimizer': 'adam', 'graph_mode': 'off', 'use_snp_selection': True, 'num_snps': 38700}. Best is trial 100 with value: 0.13027580647726633.
[I 2025-12-05 14:35:34,909] Trial 142 finished with value: 0.12269331584613186 and parameters: {'model_type': 'mlp', 'hidden_dims': '[512, 64]', 'dropout': 0.14808622152199127, 'batch_norm': True, 'lr': 0.0008215049559790258, 'weight_decay': 1.2207362530183995e-07, 'epochs': 81, 'loss': 'mae', 'optimizer': 'adam', 'graph_mode': 'off', 'use_snp_selection': True, 'num_snps': 39085}. Best is trial 100 with value: 0.13027580647726633.
[I 2025-12-05 14:35:36,885] Trial 143 finished with value: 0.12148707042065038 and parameters: {'model_type': 'mlp', 'hidden_dims': '[512, 64]', 'dropout': 0.12554224271012027, 'batch_norm': True, 'lr': 0.0008422060938654735, 'weight_decay': 1.1808194147934145e-07, 'epochs': 99, 'loss': 'mae', 'optimizer': 'adam', 'graph_mode': 'off', 'use_snp_selection': True, 'num_snps': 38483}. Best is trial 100 with value: 0.13027580647726633.
[I 2025-12-05 14:35:38,800] Trial 144 finished with value: 0.11512623975767783 and parameters: {'model_type': 'mlp', 'hidden_dims': '[512, 64]', 'dropout': 0.14005283171301441, 'batch_norm': True, 'lr': 0.0007112204796533208, 'weight_decay': 1.0087615623297961e-07, 'epochs': 88, 'loss': 'mae', 'optimizer': 'adam', 'graph_mode': 'off', 'use_snp_selection': True, 'num_snps': 36439}. Best is trial 100 with value: 0.13027580647726633.
[I 2025-12-05 14:35:40,611] Trial 145 finished with value: 0.11012257177010566 and parameters: {'model_type': 'mlp', 'hidden_dims': '[512, 64]', 'dropout': 0.15079617265218798, 'batch_norm': True, 'lr': 0.0006490382894301025, 'weight_decay': 1.3427772166399688e-07, 'epochs': 90, 'loss': 'mae', 'optimizer': 'adam', 'graph_mode': 'off', 'use_snp_selection': True, 'num_snps': 34294}. Best is trial 100 with value: 0.13027580647726633.
[I 2025-12-05 14:35:42,602] Trial 146 finished with value: 0.1127382644714313 and parameters: {'model_type': 'mlp', 'hidden_dims': '[512, 64]', 'dropout': 0.12419168335519927, 'batch_norm': True, 'lr': 0.0008605073374160302, 'weight_decay': 1.5716868878525908e-07, 'epochs': 78, 'loss': 'mae', 'optimizer': 'adam', 'graph_mode': 'off', 'use_snp_selection': True, 'num_snps': 39347}. Best is trial 100 with value: 0.13027580647726633.
[I 2025-12-05 14:35:44,557] Trial 147 finished with value: 0.057742930402537085 and parameters: {'model_type': 'mlp', 'hidden_dims': '[512, 64]', 'dropout': 0.1338754855299254, 'batch_norm': True, 'lr': 2.298355449315918e-06, 'weight_decay': 1.2226132157972792e-07, 'epochs': 66, 'loss': 'mae', 'optimizer': 'adam', 'graph_mode': 'off', 'use_snp_selection': True, 'num_snps': 39786}. Best is trial 100 with value: 0.13027580647726633.
[I 2025-12-05 14:35:46,362] Trial 148 finished with value: 0.1232988509084669 and parameters: {'model_type': 'mlp', 'hidden_dims': '[512, 128]', 'dropout': 0.15306520616062302, 'batch_norm': True, 'lr': 0.0005641186402166851, 'weight_decay': 0.00030486744930560987, 'epochs': 79, 'loss': 'mae', 'optimizer': 'adam', 'graph_mode': 'off', 'use_snp_selection': True, 'num_snps': 33123}. Best is trial 100 with value: 0.13027580647726633.
[I 2025-12-05 14:35:48,058] Trial 149 finished with value: 0.11891153356555195 and parameters: {'model_type': 'mlp', 'hidden_dims': '[512, 128]', 'dropout': 0.14809828593082244, 'batch_norm': True, 'lr': 0.0005902690088652572, 'weight_decay': 2.7711179435571995e-05, 'epochs': 57, 'loss': 'mae', 'optimizer': 'adam', 'graph_mode': 'off', 'use_snp_selection': True, 'num_snps': 33550}. Best is trial 100 with value: 0.13027580647726633.
[I 2025-12-05 14:35:50,735] Trial 0 finished with value: 0.019130149377638864 and parameters: {'model_type': 'mlp', 'hidden_dims': '[128, 64]', 'dropout': 0.199031432379812, 'batch_norm': True, 'lr': 1.8408544111075837e-06, 'weight_decay': 5.5136510071208614e-05, 'epochs': 336, 'loss': 'mae', 'optimizer': 'adam', 'graph_mode': 'off', 'use_snp_selection': True, 'num_snps': 43862}. Best is trial 0 with value: 0.019130149377638864.
[I 2025-12-05 14:35:52,291] Trial 1 finished with value: 0.05416516186134415 and parameters: {'model_type': 'mlp', 'hidden_dims': '[256, 128]', 'dropout': 0.4370668075331726, 'batch_norm': True, 'lr': 7.133471581159139e-05, 'weight_decay': 1.128633586803549e-05, 'epochs': 242, 'loss': 'mae', 'optimizer': 'adam', 'graph_mode': 'off', 'use_snp_selection': False}. Best is trial 1 with value: 0.05416516186134415.
[I 2025-12-05 14:35:53,634] Trial 2 finished with value: 0.0004350905293596 and parameters: {'model_type': 'mlp', 'hidden_dims': '[256, 128, 64]', 'dropout': 0.41314357415569625, 'batch_norm': False, 'lr': 3.952233718592101e-06, 'weight_decay': 0.00026754769258252603, 'epochs': 149, 'loss': 'mse', 'optimizer': 'adam', 'graph_mode': 'off', 'use_snp_selection': True, 'num_snps': 11571}. Best is trial 1 with value: 0.05416516186134415.
[I 2025-12-05 14:35:56,863] Trial 3 finished with value: 0.04333811936074472 and parameters: {'model_type': 'mlp', 'hidden_dims': '[512, 64]', 'dropout': 0.5938127374509361, 'batch_norm': False, 'lr': 5.67704586114731e-06, 'weight_decay': 2.4518087630137052e-05, 'epochs': 320, 'loss': 'mae', 'optimizer': 'adam', 'graph_mode': 'off', 'use_snp_selection': False}. Best is trial 1 with value: 0.05416516186134415.
[I 2025-12-05 14:36:00,049] Trial 4 finished with value: 0.0032985565408114362 and parameters: {'model_type': 'mlp', 'hidden_dims': '[512, 128]', 'dropout': 0.25746343592134413, 'batch_norm': True, 'lr': 1.3467657668402788e-06, 'weight_decay': 0.00033087251918647806, 'epochs': 277, 'loss': 'mse', 'optimizer': 'adam', 'graph_mode': 'off', 'use_snp_selection': True, 'num_snps': 36675}. Best is trial 1 with value: 0.05416516186134415.
[I 2025-12-05 14:36:02,483] Trial 5 finished with value: 0.03736376597375847 and parameters: {'model_type': 'mlp', 'hidden_dims': '[512, 64]', 'dropout': 0.38275350994408375, 'batch_norm': True, 'lr': 1.5586664309232824e-06, 'weight_decay': 0.0008227664668621182, 'epochs': 145, 'loss': 'mae', 'optimizer': 'adam', 'graph_mode': 'off', 'use_snp_selection': True, 'num_snps': 32148}. Best is trial 1 with value: 0.05416516186134415.
[I 2025-12-05 14:36:03,859] Trial 6 finished with value: 0.04039898442590234 and parameters: {'model_type': 'mlp', 'hidden_dims': '[256, 128]', 'dropout': 0.3930109900265879, 'batch_norm': False, 'lr': 4.892964372128395e-05, 'weight_decay': 1.5809549317992182e-06, 'epochs': 199, 'loss': 'mse', 'optimizer': 'adam', 'graph_mode': 'off', 'use_snp_selection': False}. Best is trial 1 with value: 0.05416516186134415.
[I 2025-12-05 14:36:05,364] Trial 7 finished with value: 0.051090019762463156 and parameters: {'model_type': 'mlp', 'hidden_dims': '[512, 256]', 'dropout': 0.15343979219678458, 'batch_norm': True, 'lr': 6.234003099047341e-05, 'weight_decay': 3.894760610535477e-07, 'epochs': 97, 'loss': 'mse', 'optimizer': 'adam', 'graph_mode': 'off', 'use_snp_selection': False}. Best is trial 1 with value: 0.05416516186134415.
