[I 2025-12-05 23:11:03,524] Trial 19 finished with value: 0.24867348968829533 and parameters: {'model_type': 'mlp', 'hidden_dims': '[512, 256]', 'dropout': 0.32729126266381303, 'batch_norm': False, 'lr': 4.238115837317623e-06, 'weight_decay': 2.5635509903476817e-07, 'epochs': 220, 'loss': 'mae', 'optimizer': 'adam', 'graph_mode': 'off', 'use_snp_selection': True, 'num_snps': 55667}. Best is trial 19 with value: 0.24867348968829533.
[I 2025-12-05 23:12:35,498] Trial 20 finished with value: 0.23832230025897094 and parameters: {'model_type': 'mlp', 'hidden_dims': '[512, 256]', 'dropout': 0.2950863089800593, 'batch_norm': False, 'lr': 3.646764443744247e-06, 'weight_decay': 1.109968730726807e-07, 'epochs': 214, 'loss': 'mae', 'optimizer': 'adam', 'graph_mode': 'off', 'use_snp_selection': True, 'num_snps': 57703}. Best is trial 19 with value: 0.24867348968829533.
[I 2025-12-05 23:14:18,685] Trial 21 finished with value: 0.2342530294109384 and parameters: {'model_type': 'mlp', 'hidden_dims': '[512, 256]', 'dropout': 0.35081303647488693, 'batch_norm': False, 'lr': 6.827729839017662e-06, 'weight_decay': 4.5398936313124164e-07, 'epochs': 251, 'loss': 'mae', 'optimizer': 'adam', 'graph_mode': 'off', 'use_snp_selection': True, 'num_snps': 59811}. Best is trial 19 with value: 0.24867348968829533.
[I 2025-12-05 23:15:21,350] Trial 22 finished with value: 0.2419136854884075 and parameters: {'model_type': 'mlp', 'hidden_dims': '[256, 128, 64]', 'dropout': 0.4495210615626951, 'batch_norm': False, 'lr': 2.576018607404523e-05, 'weight_decay': 2.6266379725091965e-07, 'epochs': 223, 'loss': 'mae', 'optimizer': 'adam', 'graph_mode': 'off', 'use_snp_selection': True, 'num_snps': 48956}. Best is trial 19 with value: 0.24867348968829533.
[I 2025-12-05 23:16:12,526] Trial 23 finished with value: 0.26245140985759446 and parameters: {'model_type': 'mlp', 'hidden_dims': '[512, 256]', 'dropout': 0.327406031566129, 'batch_norm': False, 'lr': 2.736044140735948e-06, 'weight_decay': 4.9310159040174616e-06, 'epochs': 270, 'loss': 'mae', 'optimizer': 'adam', 'graph_mode': 'off', 'use_snp_selection': True, 'num_snps': 18234}. Best is trial 23 with value: 0.26245140985759446.
[I 2025-12-05 23:17:03,506] Trial 24 finished with value: 0.2379349044418427 and parameters: {'model_type': 'mlp', 'hidden_dims': '[512, 256]', 'dropout': 0.3315180853605929, 'batch_norm': False, 'lr': 2.781678850467839e-06, 'weight_decay': 6.184139836076789e-06, 'epochs': 268, 'loss': 'mae', 'optimizer': 'adam', 'graph_mode': 'off', 'use_snp_selection': True, 'num_snps': 17821}. Best is trial 23 with value: 0.26245140985759446.
[I 2025-12-05 23:17:50,498] Trial 25 finished with value: 0.22765984234847414 and parameters: {'model_type': 'mlp', 'hidden_dims': '[512, 256]', 'dropout': 0.2231006457861766, 'batch_norm': False, 'lr': 1.0177617032510194e-06, 'weight_decay': 1.390124824554561e-06, 'epochs': 171, 'loss': 'mae', 'optimizer': 'adam', 'graph_mode': 'off', 'use_snp_selection': True, 'num_snps': 20857}. Best is trial 23 with value: 0.26245140985759446.
[I 2025-12-05 23:18:23,740] Trial 26 finished with value: 0.2249698720785996 and parameters: {'model_type': 'mlp', 'hidden_dims': '[512, 256]', 'dropout': 0.3324674531803668, 'batch_norm': False, 'lr': 6.4104803356211566e-06, 'weight_decay': 4.385524670080357e-05, 'epochs': 301, 'loss': 'mae', 'optimizer': 'adam', 'graph_mode': 'off', 'use_snp_selection': True, 'num_snps': 4103}. Best is trial 23 with value: 0.26245140985759446.
[I 2025-12-05 23:19:50,136] Trial 27 finished with value: 0.2306284684033863 and parameters: {'model_type': 'mlp', 'hidden_dims': '[512, 256]', 'dropout': 0.35858030441066546, 'batch_norm': False, 'lr': 2.9198245870054374e-06, 'weight_decay': 2.3898762769840844e-07, 'epochs': 228, 'loss': 'mse', 'optimizer': 'adam', 'graph_mode': 'off', 'use_snp_selection': True, 'num_snps': 50120}. Best is trial 23 with value: 0.26245140985759446.
[I 2025-12-05 23:20:38,543] Trial 28 finished with value: 0.2464852449853236 and parameters: {'model_type': 'mlp', 'hidden_dims': '[512, 256]', 'dropout': 0.3098974207435964, 'batch_norm': False, 'lr': 2.292960539139597e-06, 'weight_decay': 8.998479561642212e-06, 'epochs': 179, 'loss': 'mae', 'optimizer': 'adam', 'graph_mode': 'off', 'use_snp_selection': True, 'num_snps': 22089}. Best is trial 23 with value: 0.26245140985759446.
[I 2025-12-05 23:21:49,119] Trial 29 finished with value: 0.23614961662424352 and parameters: {'model_type': 'mlp', 'hidden_dims': '[256, 128, 64]', 'dropout': 0.2523135802350327, 'batch_norm': False, 'lr': 7.6088254603734275e-06, 'weight_decay': 8.58970861149538e-05, 'epochs': 271, 'loss': 'mae', 'optimizer': 'adam', 'graph_mode': 'off', 'use_snp_selection': True, 'num_snps': 52575}. Best is trial 23 with value: 0.26245140985759446.
[I 2025-12-05 23:22:53,696] Trial 30 finished with value: 0.2332615913180319 and parameters: {'model_type': 'mlp', 'hidden_dims': '[256, 128]', 'dropout': 0.20087426308961134, 'batch_norm': False, 'lr': 2.9157463478577585e-05, 'weight_decay': 6.767187193485538e-07, 'epochs': 334, 'loss': 'mae', 'optimizer': 'adam', 'graph_mode': 'off', 'use_snp_selection': True, 'num_snps': 39775}. Best is trial 23 with value: 0.26245140985759446.
[I 2025-12-05 23:23:43,102] Trial 31 finished with value: 0.24695776140860684 and parameters: {'model_type': 'mlp', 'hidden_dims': '[512, 256]', 'dropout': 0.30194986337168783, 'batch_norm': False, 'lr': 2.2966191728949804e-06, 'weight_decay': 8.975212662973199e-06, 'epochs': 173, 'loss': 'mae', 'optimizer': 'adam', 'graph_mode': 'off', 'use_snp_selection': True, 'num_snps': 23543}. Best is trial 23 with value: 0.26245140985759446.
[I 2025-12-05 23:24:31,365] Trial 32 finished with value: 0.24222016620036418 and parameters: {'model_type': 'mlp', 'hidden_dims': '[512, 256]', 'dropout': 0.30763159500125453, 'batch_norm': False, 'lr': 1.8089802144036823e-06, 'weight_decay': 1.0856072014186834e-05, 'epochs': 130, 'loss': 'mae', 'optimizer': 'adam', 'graph_mode': 'off', 'use_snp_selection': True, 'num_snps': 27130}. Best is trial 23 with value: 0.26245140985759446.
[I 2025-12-05 23:25:07,771] Trial 33 finished with value: 0.20476155951569183 and parameters: {'model_type': 'mlp', 'hidden_dims': '[512, 256]', 'dropout': 0.3761918306718901, 'batch_norm': False, 'lr': 4.138100076828834e-06, 'weight_decay': 1.997345859805169e-06, 'epochs': 116, 'loss': 'mae', 'optimizer': 'adam', 'graph_mode': 'off', 'use_snp_selection': True, 'num_snps': 13682}. Best is trial 23 with value: 0.26245140985759446.
[I 2025-12-05 23:26:08,926] Trial 34 finished with value: 0.24354816728325462 and parameters: {'model_type': 'mlp', 'hidden_dims': '[512, 256]', 'dropout': 0.42608800900474164, 'batch_norm': False, 'lr': 4.5329451624262265e-06, 'weight_decay': 7.112499599357963e-06, 'epochs': 224, 'loss': 'mae', 'optimizer': 'adam', 'graph_mode': 'off', 'use_snp_selection': True, 'num_snps': 29870}. Best is trial 23 with value: 0.26245140985759446.
[I 2025-12-05 23:26:46,844] Trial 35 finished with value: 0.17623139885896927 and parameters: {'model_type': 'mlp', 'hidden_dims': '[128, 64]', 'dropout': 0.2634882774096845, 'batch_norm': False, 'lr': 1.0044663887654551e-06, 'weight_decay': 0.0001238183091710742, 'epochs': 155, 'loss': 'mae', 'optimizer': 'adam', 'graph_mode': 'off', 'use_snp_selection': True, 'num_snps': 25654}. Best is trial 23 with value: 0.26245140985759446.
[I 2025-12-05 23:27:48,982] Trial 36 finished with value: 0.233595147385156 and parameters: {'model_type': 'mlp', 'hidden_dims': '[256, 128]', 'dropout': 0.44673127563492987, 'batch_norm': False, 'lr': 2.3361303188127066e-06, 'weight_decay': 9.976164041698341e-07, 'epochs': 184, 'loss': 'mse', 'optimizer': 'adam', 'graph_mode': 'off', 'use_snp_selection': True, 'num_snps': 54865}. Best is trial 23 with value: 0.26245140985759446.
[I 2025-12-05 23:28:24,450] Trial 37 finished with value: 0.21617000915487167 and parameters: {'model_type': 'mlp', 'hidden_dims': '[256, 128, 64]', 'dropout': 0.4054610954358261, 'batch_norm': False, 'lr': 1.6546521014079554e-06, 'weight_decay': 1.4971565761013807e-05, 'epochs': 206, 'loss': 'mae', 'optimizer': 'adam', 'graph_mode': 'off', 'use_snp_selection': True, 'num_snps': 12583}. Best is trial 23 with value: 0.26245140985759446.
[I 2025-12-05 23:29:47,652] Trial 38 finished with value: 0.19663499893947559 and parameters: {'model_type': 'mlp', 'hidden_dims': '[512, 256]', 'dropout': 0.22795604218289922, 'batch_norm': True, 'lr': 9.549399318083516e-06, 'weight_decay': 3.9733798840397125e-05, 'epochs': 237, 'loss': 'mse', 'optimizer': 'adam', 'graph_mode': 'off', 'use_snp_selection': True, 'num_snps': 46205}. Best is trial 23 with value: 0.26245140985759446.
[I 2025-12-05 23:30:22,137] Trial 39 finished with value: 0.24242247243528023 and parameters: {'model_type': 'mlp', 'hidden_dims': '[512, 256]', 'dropout': 0.3287432935183085, 'batch_norm': False, 'lr': 4.85837906972625e-06, 'weight_decay': 4.186010005023668e-06, 'epochs': 263, 'loss': 'mae', 'optimizer': 'adam', 'graph_mode': 'off', 'use_snp_selection': True, 'num_snps': 5787}. Best is trial 23 with value: 0.26245140985759446.
[I 2025-12-05 23:31:16,625] Trial 40 finished with value: 0.19233983545869876 and parameters: {'model_type': 'mlp', 'hidden_dims': '[512, 64]', 'dropout': 0.38405612400959394, 'batch_norm': True, 'lr': 2.9772177417196014e-06, 'weight_decay': 0.00020729385849940768, 'epochs': 322, 'loss': 'mae', 'optimizer': 'adam', 'graph_mode': 'off', 'use_snp_selection': True, 'num_snps': 18115}. Best is trial 23 with value: 0.26245140985759446.
[I 2025-12-05 23:32:03,523] Trial 41 finished with value: 0.2523965147202604 and parameters: {'model_type': 'mlp', 'hidden_dims': '[512, 256]', 'dropout': 0.30491160333531714, 'batch_norm': False, 'lr': 2.123518995311684e-06, 'weight_decay': 8.99598397075042e-06, 'epochs': 165, 'loss': 'mae', 'optimizer': 'adam', 'graph_mode': 'off', 'use_snp_selection': True, 'num_snps': 22062}. Best is trial 23 with value: 0.26245140985759446.
[I 2025-12-05 23:32:52,341] Trial 42 finished with value: 0.21840647587767853 and parameters: {'model_type': 'mlp', 'hidden_dims': '[512, 256]', 'dropout': 0.28799283910013534, 'batch_norm': False, 'lr': 1.7914464489410712e-06, 'weight_decay': 2.814169673945359e-05, 'epochs': 160, 'loss': 'mae', 'optimizer': 'adam', 'graph_mode': 'off', 'use_snp_selection': True, 'num_snps': 24277}. Best is trial 23 with value: 0.26245140985759446.
[I 2025-12-05 23:33:33,376] Trial 43 finished with value: 0.23180607117310173 and parameters: {'model_type': 'mlp', 'hidden_dims': '[512, 256]', 'dropout': 0.2479435986650239, 'batch_norm': False, 'lr': 1.3834260413828721e-06, 'weight_decay': 1.2815943483785995e-05, 'epochs': 134, 'loss': 'mae', 'optimizer': 'adam', 'graph_mode': 'off', 'use_snp_selection': True, 'num_snps': 17715}. Best is trial 23 with value: 0.26245140985759446.
[I 2025-12-05 23:34:35,477] Trial 44 finished with value: 0.2441459415279954 and parameters: {'model_type': 'mlp', 'hidden_dims': '[512, 256]', 'dropout': 0.36123623636331076, 'batch_norm': False, 'lr': 3.379552921555741e-06, 'weight_decay': 2.3592572560600482e-06, 'epochs': 194, 'loss': 'mae', 'optimizer': 'adam', 'graph_mode': 'off', 'use_snp_selection': True, 'num_snps': 33423}. Best is trial 23 with value: 0.26245140985759446.
[I 2025-12-05 23:35:32,729] Trial 45 finished with value: 0.24497930578590052 and parameters: {'model_type': 'mlp', 'hidden_dims': '[512, 128]', 'dropout': 0.2739559252109647, 'batch_norm': False, 'lr': 5.650435272005448e-06, 'weight_decay': 0.0009669331628569803, 'epochs': 62, 'loss': 'mse', 'optimizer': 'adam', 'graph_mode': 'off', 'use_snp_selection': True, 'num_snps': 55791}. Best is trial 23 with value: 0.26245140985759446.
[I 2025-12-05 23:36:11,804] Trial 46 finished with value: 0.16277361805559482 and parameters: {'model_type': 'mlp', 'hidden_dims': '[256, 128]', 'dropout': 0.3142076397928555, 'batch_norm': True, 'lr': 8.636215282376276e-06, 'weight_decay': 7.626288882392864e-06, 'epochs': 86, 'loss': 'mae', 'optimizer': 'adam', 'graph_mode': 'off', 'use_snp_selection': True, 'num_snps': 27370}. Best is trial 23 with value: 0.26245140985759446.
[I 2025-12-05 23:36:43,552] Trial 47 finished with value: 0.2408939975253647 and parameters: {'model_type': 'mlp', 'hidden_dims': '[128, 64]', 'dropout': 0.5614755584693105, 'batch_norm': False, 'lr': 1.9675454759302227e-05, 'weight_decay': 2.4203912810702054e-05, 'epochs': 287, 'loss': 'mae', 'optimizer': 'adam', 'graph_mode': 'off', 'use_snp_selection': True, 'num_snps': 8500}. Best is trial 23 with value: 0.26245140985759446.
[I 2025-12-05 23:37:49,723] Trial 48 finished with value: 0.23087461795040554 and parameters: {'model_type': 'mlp', 'hidden_dims': '[512, 256]', 'dropout': 0.17808971499853038, 'batch_norm': False, 'lr': 4.032266304827706e-05, 'weight_decay': 4.346420520390077e-06, 'epochs': 165, 'loss': 'mae', 'optimizer': 'adam', 'graph_mode': 'off', 'use_snp_selection': True, 'num_snps': 42467}. Best is trial 23 with value: 0.26245140985759446.
[I 2025-12-05 23:38:52,581] Trial 49 finished with value: 0.2158088777264182 and parameters: {'model_type': 'mlp', 'hidden_dims': '[512, 64]', 'dropout': 0.4157824458930708, 'batch_norm': False, 'lr': 0.00013282022866337715, 'weight_decay': 1.887491255592637e-06, 'epochs': 190, 'loss': 'mse', 'optimizer': 'adam', 'graph_mode': 'off', 'use_snp_selection': True, 'num_snps': 35994}. Best is trial 23 with value: 0.26245140985759446.
[I 2025-12-05 23:39:26,707] Trial 50 finished with value: 0.11668023808452703 and parameters: {'model_type': 'mlp', 'hidden_dims': '[128, 64]', 'dropout': 0.23516645661484914, 'batch_norm': True, 'lr': 2.081913383552324e-06, 'weight_decay': 1.640470939490165e-05, 'epochs': 142, 'loss': 'mae', 'optimizer': 'adam', 'graph_mode': 'off', 'use_snp_selection': True, 'num_snps': 16934}. Best is trial 23 with value: 0.26245140985759446.
[I 2025-12-05 23:40:16,336] Trial 51 finished with value: 0.24690686497941342 and parameters: {'model_type': 'mlp', 'hidden_dims': '[512, 256]', 'dropout': 0.3042464921769245, 'batch_norm': False, 'lr': 2.4746179231000815e-06, 'weight_decay': 9.48448985082846e-06, 'epochs': 180, 'loss': 'mae', 'optimizer': 'adam', 'graph_mode': 'off', 'use_snp_selection': True, 'num_snps': 23148}. Best is trial 23 with value: 0.26245140985759446.
[I 2025-12-05 23:41:06,596] Trial 52 finished with value: 0.2461658081042263 and parameters: {'model_type': 'mlp', 'hidden_dims': '[512, 256]', 'dropout': 0.28945164633169884, 'batch_norm': False, 'lr': 1.2141977579978507e-06, 'weight_decay': 9.672380622348345e-06, 'epochs': 211, 'loss': 'mae', 'optimizer': 'adam', 'graph_mode': 'off', 'use_snp_selection': True, 'num_snps': 21183}. Best is trial 23 with value: 0.26245140985759446.
[I 2025-12-05 23:42:18,089] Trial 53 finished with value: 0.24723156761469153 and parameters: {'model_type': 'mlp', 'hidden_dims': '[512, 256]', 'dropout': 0.33416079452212394, 'batch_norm': False, 'lr': 2.4597635092436857e-06, 'weight_decay': 5.35241674683957e-06, 'epochs': 115, 'loss': 'mae', 'optimizer': 'adam', 'graph_mode': 'off', 'use_snp_selection': True, 'num_snps': 59934}. Best is trial 23 with value: 0.26245140985759446.
[I 2025-12-05 23:43:28,005] Trial 54 finished with value: 0.24054454243651313 and parameters: {'model_type': 'mlp', 'hidden_dims': '[512, 128]', 'dropout': 0.33841205807828667, 'batch_norm': False, 'lr': 3.954970060589459e-06, 'weight_decay': 3.1254824686094973e-06, 'epochs': 110, 'loss': 'mae', 'optimizer': 'adam', 'graph_mode': 'off', 'use_snp_selection': True, 'num_snps': 59047}. Best is trial 23 with value: 0.26245140985759446.
[I 2025-12-05 23:44:32,824] Trial 55 finished with value: 0.26059111271732405 and parameters: {'model_type': 'mlp', 'hidden_dims': '[512, 256]', 'dropout': 0.375536025076755, 'batch_norm': False, 'lr': 5.570652177242194e-06, 'weight_decay': 6.336811712651374e-06, 'epochs': 99, 'loss': 'mae', 'optimizer': 'adam', 'graph_mode': 'off', 'use_snp_selection': True, 'num_snps': 55313}. Best is trial 23 with value: 0.26245140985759446.
[I 2025-12-05 23:45:34,198] Trial 56 finished with value: 0.2482117281156543 and parameters: {'model_type': 'mlp', 'hidden_dims': '[512, 256]', 'dropout': 0.3718301168871725, 'batch_norm': False, 'lr': 5.335097965479047e-06, 'weight_decay': 8.379734647289669e-07, 'epochs': 81, 'loss': 'mae', 'optimizer': 'adam', 'graph_mode': 'off', 'use_snp_selection': True, 'num_snps': 56395}. Best is trial 23 with value: 0.26245140985759446.
[I 2025-12-05 23:46:18,316] Trial 57 finished with value: 0.12351368403401668 and parameters: {'model_type': 'mlp', 'hidden_dims': '[128, 64]', 'dropout': 0.4709769891008384, 'batch_norm': False, 'lr': 0.0008615739501028876, 'weight_decay': 1.8255085963064803e-07, 'epochs': 43, 'loss': 'mae', 'optimizer': 'adam', 'graph_mode': 'off', 'use_snp_selection': True, 'num_snps': 53544}. Best is trial 23 with value: 0.26245140985759446.
[I 2025-12-05 23:46:35,751] Trial 58 finished with value: 0.2472105994255389 and parameters: {'model_type': 'mlp', 'hidden_dims': '[256, 128, 64]', 'dropout': 0.5451213270526725, 'batch_norm': False, 'lr': 1.037929960904721e-05, 'weight_decay': 7.502141272930246e-07, 'epochs': 91, 'loss': 'mae', 'optimizer': 'adam', 'graph_mode': 'off', 'use_snp_selection': False}. Best is trial 23 with value: 0.26245140985759446.
[I 2025-12-05 23:47:32,567] Trial 59 finished with value: 0.2541355496536327 and parameters: {'model_type': 'mlp', 'hidden_dims': '[512, 256]', 'dropout': 0.3687942591425638, 'batch_norm': False, 'lr': 5.651600494239819e-06, 'weight_decay': 3.9031669073217684e-07, 'epochs': 76, 'loss': 'mae', 'optimizer': 'adam', 'graph_mode': 'off', 'use_snp_selection': True, 'num_snps': 50402}. Best is trial 23 with value: 0.26245140985759446.
[I 2025-12-05 23:48:27,099] Trial 60 finished with value: 0.2411629063645083 and parameters: {'model_type': 'mlp', 'hidden_dims': '[512, 256]', 'dropout': 0.3707936775599129, 'batch_norm': False, 'lr': 5.285987400469684e-06, 'weight_decay': 3.9109674872560094e-07, 'epochs': 65, 'loss': 'mae', 'optimizer': 'adam', 'graph_mode': 'off', 'use_snp_selection': True, 'num_snps': 50071}. Best is trial 23 with value: 0.26245140985759446.
[I 2025-12-05 23:49:27,163] Trial 61 finished with value: 0.23603723725223866 and parameters: {'model_type': 'mlp', 'hidden_dims': '[512, 256]', 'dropout': 0.39488723493883393, 'batch_norm': False, 'lr': 5.9126558973523265e-06, 'weight_decay': 4.834936162483895e-07, 'epochs': 75, 'loss': 'mae', 'optimizer': 'adam', 'graph_mode': 'off', 'use_snp_selection': True, 'num_snps': 56440}. Best is trial 23 with value: 0.26245140985759446.
[I 2025-12-05 23:50:25,298] Trial 62 finished with value: 0.2540646297495461 and parameters: {'model_type': 'mlp', 'hidden_dims': '[512, 256]', 'dropout': 0.34787200990044775, 'batch_norm': False, 'lr': 7.511506602516148e-06, 'weight_decay': 1.6231720268917512e-07, 'epochs': 78, 'loss': 'mae', 'optimizer': 'adam', 'graph_mode': 'off', 'use_snp_selection': True, 'num_snps': 52243}. Best is trial 23 with value: 0.26245140985759446.
[I 2025-12-05 23:51:20,091] Trial 63 finished with value: 0.2525084532101626 and parameters: {'model_type': 'mlp', 'hidden_dims': '[512, 256]', 'dropout': 0.35733723459967826, 'batch_norm': False, 'lr': 7.537300004841317e-06, 'weight_decay': 1.7399293709707654e-07, 'epochs': 77, 'loss': 'mae', 'optimizer': 'adam', 'graph_mode': 'off', 'use_snp_selection': True, 'num_snps': 46811}. Best is trial 23 with value: 0.26245140985759446.
[I 2025-12-05 23:52:20,253] Trial 64 finished with value: 0.2366438707087129 and parameters: {'model_type': 'mlp', 'hidden_dims': '[512, 256]', 'dropout': 0.3470923616183016, 'batch_norm': False, 'lr': 7.818075317778829e-06, 'weight_decay': 1.433358348345279e-07, 'epochs': 106, 'loss': 'mae', 'optimizer': 'adam', 'graph_mode': 'off', 'use_snp_selection': True, 'num_snps': 47163}. Best is trial 23 with value: 0.26245140985759446.
[I 2025-12-05 23:53:22,220] Trial 65 finished with value: 0.24146909870151792 and parameters: {'model_type': 'mlp', 'hidden_dims': '[512, 256]', 'dropout': 0.40114554989858753, 'batch_norm': False, 'lr': 2.1153905760734596e-05, 'weight_decay': 2.464165720440789e-07, 'epochs': 97, 'loss': 'mae', 'optimizer': 'adam', 'graph_mode': 'off', 'use_snp_selection': True, 'num_snps': 51985}. Best is trial 23 with value: 0.26245140985759446.
[I 2025-12-05 23:53:39,186] Trial 66 finished with value: 0.24434196379114453 and parameters: {'model_type': 'mlp', 'hidden_dims': '[512, 256]', 'dropout': 0.31778772779598485, 'batch_norm': False, 'lr': 1.3390672705288986e-05, 'weight_decay': 3.0934270217333576e-07, 'epochs': 40, 'loss': 'mae', 'optimizer': 'adam', 'graph_mode': 'off', 'use_snp_selection': False}. Best is trial 23 with value: 0.26245140985759446.
[I 2025-12-05 23:54:33,266] Trial 67 finished with value: 0.17112553553054846 and parameters: {'model_type': 'mlp', 'hidden_dims': '[512, 256]', 'dropout': 0.3560941882001275, 'batch_norm': True, 'lr': 3.5889098483161747e-06, 'weight_decay': 1.7306653108623178e-07, 'epochs': 74, 'loss': 'mae', 'optimizer': 'adam', 'graph_mode': 'off', 'use_snp_selection': True, 'num_snps': 46128}. Best is trial 23 with value: 0.26245140985759446.
[I 2025-12-05 23:55:21,696] Trial 68 finished with value: 0.24451819329663577 and parameters: {'model_type': 'mlp', 'hidden_dims': '[512, 256]', 'dropout': 0.3877778208373069, 'batch_norm': False, 'lr': 7.155711588824153e-06, 'weight_decay': 1.2905609249350083e-07, 'epochs': 53, 'loss': 'mse', 'optimizer': 'adam', 'graph_mode': 'off', 'use_snp_selection': True, 'num_snps': 42855}. Best is trial 23 with value: 0.26245140985759446.
