[I 2025-12-05 14:51:08,779] Trial 29 finished with value: 0.029686129373246852 and parameters: {'model_type': 'mlp', 'hidden_dims': '[128, 64]', 'dropout': 0.3724581964139236, 'batch_norm': True, 'lr': 0.0005388560200940643, 'weight_decay': 5.5227103357724904e-05, 'epochs': 60, 'loss': 'mae', 'optimizer': 'adam', 'graph_mode': 'off', 'use_snp_selection': True, 'num_snps': 19468}. Best is trial 23 with value: 0.06317597915090485.
[I 2025-12-05 14:51:09,951] Trial 30 finished with value: 0.021310183063394106 and parameters: {'model_type': 'mlp', 'hidden_dims': '[512, 256]', 'dropout': 0.5798844848833702, 'batch_norm': True, 'lr': 3.9597188218570416e-05, 'weight_decay': 6.3175895207505055e-06, 'epochs': 95, 'loss': 'mse', 'optimizer': 'adam', 'graph_mode': 'off', 'use_snp_selection': False}. Best is trial 23 with value: 0.06317597915090485.
[I 2025-12-05 14:51:10,698] Trial 31 finished with value: 0.04178371891553659 and parameters: {'model_type': 'mlp', 'hidden_dims': '[128, 64]', 'dropout': 0.2931646052831268, 'batch_norm': True, 'lr': 0.0001590468066339004, 'weight_decay': 5.160248188726435e-07, 'epochs': 119, 'loss': 'mse', 'optimizer': 'adam', 'graph_mode': 'off', 'use_snp_selection': False}. Best is trial 23 with value: 0.06317597915090485.
[I 2025-12-05 14:51:11,453] Trial 32 finished with value: 0.05208382916757696 and parameters: {'model_type': 'mlp', 'hidden_dims': '[128, 64]', 'dropout': 0.3202871551505825, 'batch_norm': True, 'lr': 0.0003202528604061287, 'weight_decay': 1.5948177194280032e-06, 'epochs': 129, 'loss': 'mse', 'optimizer': 'adam', 'graph_mode': 'off', 'use_snp_selection': False}. Best is trial 23 with value: 0.06317597915090485.
[I 2025-12-05 14:51:12,251] Trial 33 finished with value: 0.061218995604692385 and parameters: {'model_type': 'mlp', 'hidden_dims': '[128, 64]', 'dropout': 0.21302742992307389, 'batch_norm': True, 'lr': 7.977678866201718e-05, 'weight_decay': 1.1356108277669038e-06, 'epochs': 160, 'loss': 'mse', 'optimizer': 'adam', 'graph_mode': 'off', 'use_snp_selection': False}. Best is trial 23 with value: 0.06317597915090485.
[I 2025-12-05 14:51:13,059] Trial 34 finished with value: 0.03186145388469632 and parameters: {'model_type': 'mlp', 'hidden_dims': '[128, 64]', 'dropout': 0.21659551450252174, 'batch_norm': True, 'lr': 7.257325458706367e-05, 'weight_decay': 9.049362460584294e-07, 'epochs': 164, 'loss': 'mae', 'optimizer': 'adam', 'graph_mode': 'off', 'use_snp_selection': False}. Best is trial 23 with value: 0.06317597915090485.
[I 2025-12-05 14:51:13,915] Trial 35 finished with value: 0.02982365029168959 and parameters: {'model_type': 'mlp', 'hidden_dims': '[128, 64]', 'dropout': 0.16318256492122105, 'batch_norm': False, 'lr': 2.0463570704610496e-05, 'weight_decay': 1.9876171605951303e-07, 'epochs': 207, 'loss': 'mse', 'optimizer': 'adam', 'graph_mode': 'off', 'use_snp_selection': False}. Best is trial 23 with value: 0.06317597915090485.
[I 2025-12-05 14:51:16,817] Trial 36 finished with value: 0.03595545614312025 and parameters: {'model_type': 'mlp', 'hidden_dims': '[256, 128]', 'dropout': 0.4259061228636643, 'batch_norm': True, 'lr': 5.1833194758892825e-06, 'weight_decay': 6.886876803351276e-05, 'epochs': 262, 'loss': 'mse', 'optimizer': 'adam', 'graph_mode': 'off', 'use_snp_selection': True, 'num_snps': 58661}. Best is trial 23 with value: 0.06317597915090485.
[I 2025-12-05 14:51:17,682] Trial 37 finished with value: 0.05122802043740016 and parameters: {'model_type': 'mlp', 'hidden_dims': '[256, 128, 64]', 'dropout': 0.1284650401766863, 'batch_norm': True, 'lr': 7.449642930106745e-05, 'weight_decay': 4.23506812316141e-07, 'epochs': 91, 'loss': 'mae', 'optimizer': 'adam', 'graph_mode': 'off', 'use_snp_selection': False}. Best is trial 23 with value: 0.06317597915090485.
[I 2025-12-05 14:51:18,969] Trial 38 finished with value: 0.038349653113096446 and parameters: {'model_type': 'mlp', 'hidden_dims': '[128, 64]', 'dropout': 0.1973362039102453, 'batch_norm': False, 'lr': 1.118683273664473e-05, 'weight_decay': 1.99639041322149e-07, 'epochs': 159, 'loss': 'mse', 'optimizer': 'adam', 'graph_mode': 'off', 'use_snp_selection': True, 'num_snps': 19911}. Best is trial 23 with value: 0.06317597915090485.
[I 2025-12-05 14:51:20,507] Trial 39 finished with value: -0.0052688643113488485 and parameters: {'model_type': 'mlp', 'hidden_dims': '[512, 128]', 'dropout': 0.27140264746910064, 'batch_norm': True, 'lr': 2.2341391966433395e-06, 'weight_decay': 1.2293857203860004e-05, 'epochs': 177, 'loss': 'mse', 'optimizer': 'adam', 'graph_mode': 'off', 'use_snp_selection': False}. Best is trial 23 with value: 0.06317597915090485.
[I 2025-12-05 14:51:21,544] Trial 40 finished with value: 0.0739077423401802 and parameters: {'model_type': 'mlp', 'hidden_dims': '[512, 64]', 'dropout': 0.23110960063837654, 'batch_norm': True, 'lr': 0.0002686377104774928, 'weight_decay': 8.725540961951843e-07, 'epochs': 63, 'loss': 'mae', 'optimizer': 'adam', 'graph_mode': 'off', 'use_snp_selection': False}. Best is trial 40 with value: 0.0739077423401802.
[I 2025-12-05 14:51:22,577] Trial 41 finished with value: 0.052237824297256284 and parameters: {'model_type': 'mlp', 'hidden_dims': '[512, 64]', 'dropout': 0.23909572146851324, 'batch_norm': True, 'lr': 0.0002827204709907124, 'weight_decay': 7.868980274306829e-07, 'epochs': 63, 'loss': 'mae', 'optimizer': 'adam', 'graph_mode': 'off', 'use_snp_selection': False}. Best is trial 40 with value: 0.0739077423401802.
[I 2025-12-05 14:51:24,870] Trial 42 finished with value: 0.05623011974802583 and parameters: {'model_type': 'mlp', 'hidden_dims': '[512, 64]', 'dropout': 0.21820775381976457, 'batch_norm': True, 'lr': 0.00039037331028445656, 'weight_decay': 4.783813819599391e-07, 'epochs': 348, 'loss': 'mae', 'optimizer': 'adam', 'graph_mode': 'off', 'use_snp_selection': False}. Best is trial 40 with value: 0.0739077423401802.
[I 2025-12-05 14:51:25,885] Trial 43 finished with value: 0.03948309538846167 and parameters: {'model_type': 'mlp', 'hidden_dims': '[512, 64]', 'dropout': 0.17950548490909352, 'batch_norm': True, 'lr': 5.3112232294742045e-05, 'weight_decay': 2.1665165891421205e-06, 'epochs': 59, 'loss': 'mae', 'optimizer': 'adam', 'graph_mode': 'off', 'use_snp_selection': False}. Best is trial 40 with value: 0.0739077423401802.
[I 2025-12-05 14:51:27,068] Trial 44 finished with value: 0.04002561748248198 and parameters: {'model_type': 'mlp', 'hidden_dims': '[512, 64]', 'dropout': 0.25336294930672193, 'batch_norm': True, 'lr': 0.00013114996243367602, 'weight_decay': 1.2345854576727907e-06, 'epochs': 97, 'loss': 'mae', 'optimizer': 'adam', 'graph_mode': 'off', 'use_snp_selection': False}. Best is trial 40 with value: 0.0739077423401802.
[I 2025-12-05 14:51:28,444] Trial 45 finished with value: 0.04116546647991322 and parameters: {'model_type': 'mlp', 'hidden_dims': '[512, 256]', 'dropout': 0.1223940263767354, 'batch_norm': True, 'lr': 0.0002300226355390722, 'weight_decay': 1.5685393768013698e-07, 'epochs': 140, 'loss': 'mae', 'optimizer': 'adam', 'graph_mode': 'off', 'use_snp_selection': False}. Best is trial 40 with value: 0.0739077423401802.
[I 2025-12-05 14:51:29,587] Trial 46 finished with value: 0.016054961066149717 and parameters: {'model_type': 'mlp', 'hidden_dims': '[512, 64]', 'dropout': 0.40720539357151614, 'batch_norm': False, 'lr': 0.0006163726211177808, 'weight_decay': 4.257611767115709e-07, 'epochs': 88, 'loss': 'mse', 'optimizer': 'adam', 'graph_mode': 'off', 'use_snp_selection': False}. Best is trial 40 with value: 0.0739077423401802.
[I 2025-12-05 14:51:30,491] Trial 47 finished with value: 0.054430249160507205 and parameters: {'model_type': 'mlp', 'hidden_dims': '[256, 128]', 'dropout': 0.17849974912031896, 'batch_norm': True, 'lr': 0.00010360738959588007, 'weight_decay': 3.184998275725864e-05, 'epochs': 108, 'loss': 'mse', 'optimizer': 'adam', 'graph_mode': 'off', 'use_snp_selection': False}. Best is trial 40 with value: 0.0739077423401802.
[I 2025-12-05 14:51:31,486] Trial 48 finished with value: 0.021206842939992195 and parameters: {'model_type': 'mlp', 'hidden_dims': '[512, 256]', 'dropout': 0.2803534165248738, 'batch_norm': True, 'lr': 3.6381832397640754e-05, 'weight_decay': 4.166925759502429e-06, 'epochs': 54, 'loss': 'mae', 'optimizer': 'adam', 'graph_mode': 'off', 'use_snp_selection': False}. Best is trial 40 with value: 0.0739077423401802.
[I 2025-12-05 14:51:34,156] Trial 49 finished with value: 0.051899771546066197 and parameters: {'model_type': 'mlp', 'hidden_dims': '[512, 128]', 'dropout': 0.36167318450128966, 'batch_norm': True, 'lr': 0.0004490453815077928, 'weight_decay': 1.286226075017553e-06, 'epochs': 190, 'loss': 'mse', 'optimizer': 'adam', 'graph_mode': 'off', 'use_snp_selection': True, 'num_snps': 46888}. Best is trial 40 with value: 0.0739077423401802.
[I 2025-12-05 14:51:34,840] Trial 50 finished with value: 0.05041274916534117 and parameters: {'model_type': 'mlp', 'hidden_dims': '[128, 64]', 'dropout': 0.3446934676116708, 'batch_norm': True, 'lr': 0.0002618434245120111, 'weight_decay': 7.936259417195982e-07, 'epochs': 71, 'loss': 'mse', 'optimizer': 'adam', 'graph_mode': 'off', 'use_snp_selection': False}. Best is trial 40 with value: 0.0739077423401802.
[I 2025-12-05 14:51:37,044] Trial 51 finished with value: 0.06524639041510087 and parameters: {'model_type': 'mlp', 'hidden_dims': '[512, 64]', 'dropout': 0.21191613797876607, 'batch_norm': True, 'lr': 0.0003699951786297958, 'weight_decay': 4.796078206924672e-07, 'epochs': 329, 'loss': 'mae', 'optimizer': 'adam', 'graph_mode': 'off', 'use_snp_selection': False}. Best is trial 40 with value: 0.0739077423401802.
[I 2025-12-05 14:51:39,107] Trial 52 finished with value: 0.05577923898967854 and parameters: {'model_type': 'mlp', 'hidden_dims': '[512, 64]', 'dropout': 0.20455448702861614, 'batch_norm': True, 'lr': 0.0007394867069971785, 'weight_decay': 3.393249851115166e-07, 'epochs': 293, 'loss': 'mae', 'optimizer': 'adam', 'graph_mode': 'off', 'use_snp_selection': False}. Best is trial 40 with value: 0.0739077423401802.
[I 2025-12-05 14:51:41,257] Trial 53 finished with value: 0.04396512753181441 and parameters: {'model_type': 'mlp', 'hidden_dims': '[512, 64]', 'dropout': 0.26327250120884854, 'batch_norm': True, 'lr': 0.00018970183979830072, 'weight_decay': 6.520238563955576e-07, 'epochs': 317, 'loss': 'mae', 'optimizer': 'adam', 'graph_mode': 'off', 'use_snp_selection': False}. Best is trial 40 with value: 0.0739077423401802.
[I 2025-12-05 14:51:43,069] Trial 54 finished with value: 0.05108920370165607 and parameters: {'model_type': 'mlp', 'hidden_dims': '[512, 64]', 'dropout': 0.1593818116138589, 'batch_norm': True, 'lr': 0.00038129331035922237, 'weight_decay': 1.5185063113230706e-07, 'epochs': 240, 'loss': 'mae', 'optimizer': 'adam', 'graph_mode': 'off', 'use_snp_selection': False}. Best is trial 40 with value: 0.0739077423401802.
[I 2025-12-05 14:51:44,014] Trial 55 finished with value: 0.04304354832347766 and parameters: {'model_type': 'mlp', 'hidden_dims': '[512, 256]', 'dropout': 0.18806959889704566, 'batch_norm': True, 'lr': 0.0009757515340220825, 'weight_decay': 2.4133318414944347e-07, 'epochs': 42, 'loss': 'mae', 'optimizer': 'adam', 'graph_mode': 'off', 'use_snp_selection': False}. Best is trial 40 with value: 0.0739077423401802.
[I 2025-12-05 14:51:45,209] Trial 56 finished with value: 0.030091087800694798 and parameters: {'model_type': 'mlp', 'hidden_dims': '[256, 128, 64]', 'dropout': 0.22989794217073697, 'batch_norm': True, 'lr': 2.5232396841974224e-05, 'weight_decay': 3.8002683997941416e-07, 'epochs': 217, 'loss': 'mse', 'optimizer': 'adam', 'graph_mode': 'off', 'use_snp_selection': False}. Best is trial 40 with value: 0.0739077423401802.
[I 2025-12-05 14:51:46,140] Trial 57 finished with value: 0.038852499279073784 and parameters: {'model_type': 'mlp', 'hidden_dims': '[128, 64]', 'dropout': 0.12338814484076811, 'batch_norm': False, 'lr': 0.0005303947808620772, 'weight_decay': 9.81658905059197e-07, 'epochs': 267, 'loss': 'mse', 'optimizer': 'adam', 'graph_mode': 'off', 'use_snp_selection': False}. Best is trial 40 with value: 0.0739077423401802.
[I 2025-12-05 14:51:47,493] Trial 58 finished with value: 0.05627959222473902 and parameters: {'model_type': 'mlp', 'hidden_dims': '[512, 64]', 'dropout': 0.13937512845562006, 'batch_norm': True, 'lr': 0.00013978750639105894, 'weight_decay': 2.8689988494603966e-06, 'epochs': 135, 'loss': 'mae', 'optimizer': 'adam', 'graph_mode': 'off', 'use_snp_selection': False}. Best is trial 40 with value: 0.0739077423401802.
[I 2025-12-05 14:51:48,487] Trial 59 finished with value: 0.03211781954362669 and parameters: {'model_type': 'mlp', 'hidden_dims': '[128, 64]', 'dropout': 0.3158609350435605, 'batch_norm': True, 'lr': 8.528552710287489e-05, 'weight_decay': 0.00014144043448895884, 'epochs': 299, 'loss': 'mse', 'optimizer': 'adam', 'graph_mode': 'off', 'use_snp_selection': False}. Best is trial 40 with value: 0.0739077423401802.
[I 2025-12-05 14:51:49,952] Trial 60 finished with value: 0.0499513743077132 and parameters: {'model_type': 'mlp', 'hidden_dims': '[512, 256]', 'dropout': 0.2116330431060989, 'batch_norm': True, 'lr': 5.920189997029874e-05, 'weight_decay': 5.930245701944728e-07, 'epochs': 83, 'loss': 'mse', 'optimizer': 'adam', 'graph_mode': 'off', 'use_snp_selection': True, 'num_snps': 24139}. Best is trial 40 with value: 0.0739077423401802.
[I 2025-12-05 14:51:51,310] Trial 61 finished with value: 0.051206465257107404 and parameters: {'model_type': 'mlp', 'hidden_dims': '[512, 64]', 'dropout': 0.16727001432657476, 'batch_norm': True, 'lr': 0.00014686742100799603, 'weight_decay': 2.7903107355899905e-06, 'epochs': 132, 'loss': 'mae', 'optimizer': 'adam', 'graph_mode': 'off', 'use_snp_selection': False}. Best is trial 40 with value: 0.0739077423401802.
[I 2025-12-05 14:51:52,715] Trial 62 finished with value: 0.04629820674177028 and parameters: {'model_type': 'mlp', 'hidden_dims': '[512, 64]', 'dropout': 0.1352416345024886, 'batch_norm': True, 'lr': 0.00020604621621260927, 'weight_decay': 1.5977219643916007e-06, 'epochs': 147, 'loss': 'mae', 'optimizer': 'adam', 'graph_mode': 'off', 'use_snp_selection': False}. Best is trial 40 with value: 0.0739077423401802.
[I 2025-12-05 14:51:54,220] Trial 63 finished with value: 0.04070435958989176 and parameters: {'model_type': 'mlp', 'hidden_dims': '[512, 64]', 'dropout': 0.14369405807802005, 'batch_norm': True, 'lr': 0.00033203471283311137, 'weight_decay': 7.455615280128182e-06, 'epochs': 169, 'loss': 'mae', 'optimizer': 'adam', 'graph_mode': 'off', 'use_snp_selection': False}. Best is trial 40 with value: 0.0739077423401802.
[I 2025-12-05 14:51:55,468] Trial 64 finished with value: 0.04895684881607287 and parameters: {'model_type': 'mlp', 'hidden_dims': '[512, 64]', 'dropout': 0.2851553652366583, 'batch_norm': True, 'lr': 0.00011229593661694505, 'weight_decay': 1.2021679942192624e-06, 'epochs': 111, 'loss': 'mae', 'optimizer': 'adam', 'graph_mode': 'off', 'use_snp_selection': False}. Best is trial 40 with value: 0.0739077423401802.
[I 2025-12-05 14:51:56,223] Trial 65 finished with value: 0.04788182016046524 and parameters: {'model_type': 'mlp', 'hidden_dims': '[128, 64]', 'dropout': 0.11262036743831874, 'batch_norm': True, 'lr': 4.8593111526576264e-05, 'weight_decay': 2.5266690604992026e-07, 'epochs': 114, 'loss': 'mae', 'optimizer': 'adam', 'graph_mode': 'off', 'use_snp_selection': False}. Best is trial 40 with value: 0.0739077423401802.
[I 2025-12-05 14:51:57,417] Trial 66 finished with value: 0.03800446482313949 and parameters: {'model_type': 'mlp', 'hidden_dims': '[512, 64]', 'dropout': 0.2392382410048835, 'batch_norm': True, 'lr': 0.00028058496002703715, 'weight_decay': 2.1035739735995164e-06, 'epochs': 96, 'loss': 'mse', 'optimizer': 'adam', 'graph_mode': 'off', 'use_snp_selection': False}. Best is trial 40 with value: 0.0739077423401802.
[I 2025-12-05 14:51:58,245] Trial 67 finished with value: 0.02680419517472629 and parameters: {'model_type': 'mlp', 'hidden_dims': '[256, 128]', 'dropout': 0.19498243991112293, 'batch_norm': True, 'lr': 1.038788092140181e-06, 'weight_decay': 0.0009446634395666513, 'epochs': 68, 'loss': 'mae', 'optimizer': 'adam', 'graph_mode': 'off', 'use_snp_selection': False}. Best is trial 40 with value: 0.0739077423401802.
[I 2025-12-05 14:51:58,978] Trial 68 finished with value: 0.029174547965053397 and parameters: {'model_type': 'mlp', 'hidden_dims': '[128, 64]', 'dropout': 0.16917549801497228, 'batch_norm': False, 'lr': 0.00016464903226872418, 'weight_decay': 4.1369009178796335e-06, 'epochs': 101, 'loss': 'mse', 'optimizer': 'adam', 'graph_mode': 'off', 'use_snp_selection': False}. Best is trial 40 with value: 0.0739077423401802.
[I 2025-12-05 14:52:01,219] Trial 69 finished with value: 0.04506434328194838 and parameters: {'model_type': 'mlp', 'hidden_dims': '[512, 128]', 'dropout': 0.5045836366283617, 'batch_norm': True, 'lr': 0.0004439532390476097, 'weight_decay': 7.526166593704761e-07, 'epochs': 332, 'loss': 'mse', 'optimizer': 'adam', 'graph_mode': 'off', 'use_snp_selection': False}. Best is trial 40 with value: 0.0739077423401802.
[I 2025-12-05 14:52:02,268] Trial 70 finished with value: 0.028940226109583515 and parameters: {'model_type': 'mlp', 'hidden_dims': '[256, 128, 64]', 'dropout': 0.3925468128467613, 'batch_norm': True, 'lr': 0.0006969101230628289, 'weight_decay': 0.0006413552654466291, 'epochs': 152, 'loss': 'mae', 'optimizer': 'adam', 'graph_mode': 'off', 'use_snp_selection': False}. Best is trial 40 with value: 0.0739077423401802.
[I 2025-12-05 14:52:04,489] Trial 71 finished with value: 0.0345165792194916 and parameters: {'model_type': 'mlp', 'hidden_dims': '[512, 64]', 'dropout': 0.22076989001881317, 'batch_norm': True, 'lr': 0.00037127564005504603, 'weight_decay': 4.860035526131618e-07, 'epochs': 326, 'loss': 'mae', 'optimizer': 'adam', 'graph_mode': 'off', 'use_snp_selection': False}. Best is trial 40 with value: 0.0739077423401802.
[I 2025-12-05 14:52:06,802] Trial 72 finished with value: 0.05471803229813071 and parameters: {'model_type': 'mlp', 'hidden_dims': '[512, 64]', 'dropout': 0.25961642076271585, 'batch_norm': True, 'lr': 0.0005576840315340908, 'weight_decay': 5.048698338274276e-07, 'epochs': 348, 'loss': 'mae', 'optimizer': 'adam', 'graph_mode': 'off', 'use_snp_selection': False}. Best is trial 40 with value: 0.0739077423401802.
[I 2025-12-05 14:52:08,911] Trial 73 finished with value: 0.052970008293529096 and parameters: {'model_type': 'mlp', 'hidden_dims': '[512, 64]', 'dropout': 0.22440655507444435, 'batch_norm': True, 'lr': 0.00024160908464470352, 'weight_decay': 3.0602892895944907e-07, 'epochs': 301, 'loss': 'mae', 'optimizer': 'adam', 'graph_mode': 'off', 'use_snp_selection': False}. Best is trial 40 with value: 0.0739077423401802.
[I 2025-12-05 14:52:11,239] Trial 74 finished with value: 0.06636588144228434 and parameters: {'model_type': 'mlp', 'hidden_dims': '[512, 64]', 'dropout': 0.10054777464761207, 'batch_norm': True, 'lr': 0.00013332439657073202, 'weight_decay': 1.1395709807996265e-06, 'epochs': 350, 'loss': 'mae', 'optimizer': 'adam', 'graph_mode': 'off', 'use_snp_selection': False}. Best is trial 40 with value: 0.0739077423401802.
[I 2025-12-05 14:52:11,964] Trial 75 finished with value: 0.06040246027052117 and parameters: {'model_type': 'mlp', 'hidden_dims': '[128, 64]', 'dropout': 0.10841163245936383, 'batch_norm': True, 'lr': 8.906029620515789e-05, 'weight_decay': 1.1882455793034792e-06, 'epochs': 77, 'loss': 'mae', 'optimizer': 'adam', 'graph_mode': 'off', 'use_snp_selection': False}. Best is trial 40 with value: 0.0739077423401802.
[I 2025-12-05 14:52:12,772] Trial 76 finished with value: 0.04263565084077388 and parameters: {'model_type': 'mlp', 'hidden_dims': '[128, 64]', 'dropout': 0.10271810451951469, 'batch_norm': True, 'lr': 6.280414054406226e-05, 'weight_decay': 1.2429651525510724e-07, 'epochs': 82, 'loss': 'mse', 'optimizer': 'adam', 'graph_mode': 'off', 'use_snp_selection': True, 'num_snps': 3325}. Best is trial 40 with value: 0.0739077423401802.
[I 2025-12-05 14:52:13,462] Trial 77 finished with value: 0.04618014398328121 and parameters: {'model_type': 'mlp', 'hidden_dims': '[128, 64]', 'dropout': 0.15277559060593077, 'batch_norm': True, 'lr': 9.52052330192034e-05, 'weight_decay': 1.0273466789871028e-06, 'epochs': 52, 'loss': 'mae', 'optimizer': 'adam', 'graph_mode': 'off', 'use_snp_selection': False}. Best is trial 40 with value: 0.0739077423401802.
[I 2025-12-05 14:52:14,162] Trial 78 finished with value: -0.0035353104657302025 and parameters: {'model_type': 'mlp', 'hidden_dims': '[128, 64]', 'dropout': 0.10725816481065728, 'batch_norm': True, 'lr': 4.183753506454991e-05, 'weight_decay': 1.4413223585524642e-06, 'epochs': 64, 'loss': 'mse', 'optimizer': 'adam', 'graph_mode': 'off', 'use_snp_selection': False}. Best is trial 40 with value: 0.0739077423401802.
[I 2025-12-05 14:52:15,274] Trial 79 finished with value: 0.04422013716123626 and parameters: {'model_type': 'mlp', 'hidden_dims': '[128, 64]', 'dropout': 0.11907044296807826, 'batch_norm': True, 'lr': 7.79663614538667e-05, 'weight_decay': 2.015496351719689e-06, 'epochs': 335, 'loss': 'mae', 'optimizer': 'adam', 'graph_mode': 'off', 'use_snp_selection': False}. Best is trial 40 with value: 0.0739077423401802.
[I 2025-12-05 14:52:16,416] Trial 80 finished with value: 0.03971797650791023 and parameters: {'model_type': 'mlp', 'hidden_dims': '[512, 256]', 'dropout': 0.4496723740342413, 'batch_norm': False, 'lr': 0.00011440627530769648, 'weight_decay': 6.193279259894062e-07, 'epochs': 74, 'loss': 'mse', 'optimizer': 'adam', 'graph_mode': 'off', 'use_snp_selection': False}. Best is trial 40 with value: 0.0739077423401802.
