[I 2025-12-05 15:01:58,171] Trial 135 finished with value: 0.08121650643018692 and parameters: {'model_type': 'mlp', 'hidden_dims': '[512, 128]', 'dropout': 0.17165089401365274, 'batch_norm': True, 'lr': 0.000686981102637592, 'weight_decay': 0.0001500088383263761, 'epochs': 247, 'loss': 'mse', 'optimizer': 'adam', 'graph_mode': 'off', 'use_snp_selection': True, 'num_snps': 35550}. Best is trial 62 with value: 0.0986576692760171.
[I 2025-12-05 15:02:00,442] Trial 136 finished with value: 0.07881841555343183 and parameters: {'model_type': 'mlp', 'hidden_dims': '[512, 128]', 'dropout': 0.1561885036354423, 'batch_norm': True, 'lr': 0.0008406038415395296, 'weight_decay': 5.490159130385087e-07, 'epochs': 214, 'loss': 'mse', 'optimizer': 'adam', 'graph_mode': 'off', 'use_snp_selection': True, 'num_snps': 40388}. Best is trial 62 with value: 0.0986576692760171.
[I 2025-12-05 15:02:02,907] Trial 137 finished with value: 0.08179223820175384 and parameters: {'model_type': 'mlp', 'hidden_dims': '[512, 64]', 'dropout': 0.13808903931920521, 'batch_norm': True, 'lr': 0.0009077151901507511, 'weight_decay': 0.00011345652491870519, 'epochs': 200, 'loss': 'mse', 'optimizer': 'adam', 'graph_mode': 'off', 'use_snp_selection': True, 'num_snps': 45329}. Best is trial 62 with value: 0.0986576692760171.
[I 2025-12-05 15:02:04,697] Trial 138 finished with value: 0.07933578820471615 and parameters: {'model_type': 'mlp', 'hidden_dims': '[256, 128]', 'dropout': 0.20209495272846517, 'batch_norm': True, 'lr': 0.0005028173833699938, 'weight_decay': 6.179636262543896e-05, 'epochs': 162, 'loss': 'mse', 'optimizer': 'adam', 'graph_mode': 'off', 'use_snp_selection': True, 'num_snps': 33585}. Best is trial 62 with value: 0.0986576692760171.
[I 2025-12-05 15:02:06,849] Trial 139 finished with value: 0.06512799331232848 and parameters: {'model_type': 'mlp', 'hidden_dims': '[512, 128]', 'dropout': 0.2478782303657499, 'batch_norm': False, 'lr': 8.710304982009012e-06, 'weight_decay': 0.00023532902061523697, 'epochs': 144, 'loss': 'mae', 'optimizer': 'adam', 'graph_mode': 'off', 'use_snp_selection': True, 'num_snps': 38878}. Best is trial 62 with value: 0.0986576692760171.
[I 2025-12-05 15:02:08,525] Trial 140 finished with value: 0.07530385118315402 and parameters: {'model_type': 'mlp', 'hidden_dims': '[512, 128]', 'dropout': 0.21662283345264155, 'batch_norm': True, 'lr': 0.0006418732126995655, 'weight_decay': 8.298477498225055e-05, 'epochs': 121, 'loss': 'mse', 'optimizer': 'adam', 'graph_mode': 'off', 'use_snp_selection': True, 'num_snps': 29130}. Best is trial 62 with value: 0.0986576692760171.
[I 2025-12-05 15:02:10,124] Trial 141 finished with value: 0.08157350893153564 and parameters: {'model_type': 'mlp', 'hidden_dims': '[512, 128]', 'dropout': 0.3847568222762729, 'batch_norm': True, 'lr': 0.000608004337644735, 'weight_decay': 6.705032085762986e-07, 'epochs': 225, 'loss': 'mse', 'optimizer': 'adam', 'graph_mode': 'off', 'use_snp_selection': True, 'num_snps': 24321}. Best is trial 62 with value: 0.0986576692760171.
[I 2025-12-05 15:02:11,403] Trial 142 finished with value: 0.08005088344953208 and parameters: {'model_type': 'mlp', 'hidden_dims': '[512, 128]', 'dropout': 0.19091016425646543, 'batch_norm': True, 'lr': 0.0004315250624671306, 'weight_decay': 0.0004776885407201816, 'epochs': 154, 'loss': 'mse', 'optimizer': 'adam', 'graph_mode': 'off', 'use_snp_selection': False}. Best is trial 62 with value: 0.0986576692760171.
[I 2025-12-05 15:02:13,478] Trial 143 finished with value: 0.09268446302225122 and parameters: {'model_type': 'mlp', 'hidden_dims': '[512, 128]', 'dropout': 0.39687282950263586, 'batch_norm': True, 'lr': 0.0005624448957579965, 'weight_decay': 0.0002334487321934064, 'epochs': 101, 'loss': 'mse', 'optimizer': 'adam', 'graph_mode': 'off', 'use_snp_selection': True, 'num_snps': 42440}. Best is trial 62 with value: 0.0986576692760171.
[I 2025-12-05 15:02:15,643] Trial 144 finished with value: 0.08222743052455296 and parameters: {'model_type': 'mlp', 'hidden_dims': '[512, 128]', 'dropout': 0.3991075625420314, 'batch_norm': True, 'lr': 0.0007584869969527122, 'weight_decay': 0.00023194532887062382, 'epochs': 105, 'loss': 'mse', 'optimizer': 'adam', 'graph_mode': 'off', 'use_snp_selection': True, 'num_snps': 43499}. Best is trial 62 with value: 0.0986576692760171.
[I 2025-12-05 15:02:17,972] Trial 145 finished with value: 0.08793084548136795 and parameters: {'model_type': 'mlp', 'hidden_dims': '[512, 128]', 'dropout': 0.42044212657843344, 'batch_norm': True, 'lr': 0.0005196560183636823, 'weight_decay': 0.0001339170978093746, 'epochs': 268, 'loss': 'mse', 'optimizer': 'adam', 'graph_mode': 'off', 'use_snp_selection': True, 'num_snps': 34431}. Best is trial 62 with value: 0.0986576692760171.
[I 2025-12-05 15:02:19,662] Trial 146 finished with value: 0.06750187970845976 and parameters: {'model_type': 'mlp', 'hidden_dims': '[256, 128]', 'dropout': 0.38189617839435736, 'batch_norm': True, 'lr': 0.00031050485876243103, 'weight_decay': 0.0001889594099779411, 'epochs': 133, 'loss': 'mse', 'optimizer': 'adam', 'graph_mode': 'off', 'use_snp_selection': True, 'num_snps': 31801}. Best is trial 62 with value: 0.0986576692760171.
[I 2025-12-05 15:02:21,620] Trial 147 finished with value: 0.09027257938767054 and parameters: {'model_type': 'mlp', 'hidden_dims': '[512, 128]', 'dropout': 0.23738315185147113, 'batch_norm': True, 'lr': 0.0003869712331858668, 'weight_decay': 0.00029396472231720753, 'epochs': 111, 'loss': 'mse', 'optimizer': 'adam', 'graph_mode': 'off', 'use_snp_selection': True, 'num_snps': 38369}. Best is trial 62 with value: 0.0986576692760171.
[I 2025-12-05 15:02:23,558] Trial 148 finished with value: 0.08442158083848204 and parameters: {'model_type': 'mlp', 'hidden_dims': '[512, 128]', 'dropout': 0.1580970172533609, 'batch_norm': True, 'lr': 0.00042113000122994196, 'weight_decay': 0.00023810256290143813, 'epochs': 110, 'loss': 'mse', 'optimizer': 'adam', 'graph_mode': 'off', 'use_snp_selection': True, 'num_snps': 38532}. Best is trial 62 with value: 0.0986576692760171.
[I 2025-12-05 15:02:25,795] Trial 149 finished with value: 0.07988871074755677 and parameters: {'model_type': 'mlp', 'hidden_dims': '[512, 128]', 'dropout': 0.23673878829887515, 'batch_norm': True, 'lr': 0.0003759582582143498, 'weight_decay': 0.0003059336533317506, 'epochs': 100, 'loss': 'mse', 'optimizer': 'adam', 'graph_mode': 'off', 'use_snp_selection': True, 'num_snps': 46182}. Best is trial 62 with value: 0.0986576692760171.
[I 2025-12-05 15:02:28,090] Trial 0 finished with value: 0.01790772421430994 and parameters: {'model_type': 'mlp', 'hidden_dims': '[128, 64]', 'dropout': 0.199031432379812, 'batch_norm': True, 'lr': 1.8408544111075837e-06, 'weight_decay': 5.5136510071208614e-05, 'epochs': 336, 'loss': 'mae', 'optimizer': 'adam', 'graph_mode': 'off', 'use_snp_selection': True, 'num_snps': 43862}. Best is trial 0 with value: 0.01790772421430994.
[I 2025-12-05 15:02:29,239] Trial 1 finished with value: 0.039317062357637204 and parameters: {'model_type': 'mlp', 'hidden_dims': '[256, 128]', 'dropout': 0.4370668075331726, 'batch_norm': True, 'lr': 7.133471581159139e-05, 'weight_decay': 1.128633586803549e-05, 'epochs': 242, 'loss': 'mae', 'optimizer': 'adam', 'graph_mode': 'off', 'use_snp_selection': False}. Best is trial 1 with value: 0.039317062357637204.
[I 2025-12-05 15:02:30,317] Trial 2 finished with value: -0.024726073194315537 and parameters: {'model_type': 'mlp', 'hidden_dims': '[256, 128, 64]', 'dropout': 0.41314357415569625, 'batch_norm': False, 'lr': 3.952233718592101e-06, 'weight_decay': 0.00026754769258252603, 'epochs': 149, 'loss': 'mse', 'optimizer': 'adam', 'graph_mode': 'off', 'use_snp_selection': True, 'num_snps': 11571}. Best is trial 1 with value: 0.039317062357637204.
[I 2025-12-05 15:02:32,209] Trial 3 finished with value: 0.020873758324721332 and parameters: {'model_type': 'mlp', 'hidden_dims': '[512, 64]', 'dropout': 0.5938127374509361, 'batch_norm': False, 'lr': 5.67704586114731e-06, 'weight_decay': 2.4518087630137052e-05, 'epochs': 320, 'loss': 'mae', 'optimizer': 'adam', 'graph_mode': 'off', 'use_snp_selection': False}. Best is trial 1 with value: 0.039317062357637204.
[I 2025-12-05 15:02:34,437] Trial 4 finished with value: 0.030176922366572687 and parameters: {'model_type': 'mlp', 'hidden_dims': '[512, 128]', 'dropout': 0.25746343592134413, 'batch_norm': True, 'lr': 1.3467657668402788e-06, 'weight_decay': 0.00033087251918647806, 'epochs': 277, 'loss': 'mse', 'optimizer': 'adam', 'graph_mode': 'off', 'use_snp_selection': True, 'num_snps': 36675}. Best is trial 1 with value: 0.039317062357637204.
[I 2025-12-05 15:02:36,185] Trial 5 finished with value: 0.018385581326328566 and parameters: {'model_type': 'mlp', 'hidden_dims': '[512, 64]', 'dropout': 0.38275350994408375, 'batch_norm': True, 'lr': 1.5586664309232824e-06, 'weight_decay': 0.0008227664668621182, 'epochs': 145, 'loss': 'mae', 'optimizer': 'adam', 'graph_mode': 'off', 'use_snp_selection': True, 'num_snps': 32148}. Best is trial 1 with value: 0.039317062357637204.
[I 2025-12-05 15:02:37,191] Trial 6 finished with value: 0.06202695774875441 and parameters: {'model_type': 'mlp', 'hidden_dims': '[256, 128]', 'dropout': 0.3930109900265879, 'batch_norm': False, 'lr': 4.892964372128395e-05, 'weight_decay': 1.5809549317992182e-06, 'epochs': 199, 'loss': 'mse', 'optimizer': 'adam', 'graph_mode': 'off', 'use_snp_selection': False}. Best is trial 6 with value: 0.06202695774875441.
[I 2025-12-05 15:02:38,287] Trial 7 finished with value: 0.0538095002642784 and parameters: {'model_type': 'mlp', 'hidden_dims': '[512, 256]', 'dropout': 0.15343979219678458, 'batch_norm': True, 'lr': 6.234003099047341e-05, 'weight_decay': 3.894760610535477e-07, 'epochs': 97, 'loss': 'mse', 'optimizer': 'adam', 'graph_mode': 'off', 'use_snp_selection': False}. Best is trial 6 with value: 0.06202695774875441.
[I 2025-12-05 15:02:40,192] Trial 8 finished with value: 0.03753708365824235 and parameters: {'model_type': 'mlp', 'hidden_dims': '[512, 128]', 'dropout': 0.10743001231661406, 'batch_norm': True, 'lr': 0.00023728538449271062, 'weight_decay': 1.7629071578048637e-05, 'epochs': 312, 'loss': 'mae', 'optimizer': 'adam', 'graph_mode': 'off', 'use_snp_selection': False}. Best is trial 6 with value: 0.06202695774875441.
[I 2025-12-05 15:02:41,539] Trial 9 finished with value: 0.06315260136507819 and parameters: {'model_type': 'mlp', 'hidden_dims': '[512, 64]', 'dropout': 0.14505336736221927, 'batch_norm': True, 'lr': 5.8619638388111826e-05, 'weight_decay': 6.200156172669308e-07, 'epochs': 175, 'loss': 'mse', 'optimizer': 'adam', 'graph_mode': 'off', 'use_snp_selection': False}. Best is trial 9 with value: 0.06315260136507819.
[I 2025-12-05 15:02:42,388] Trial 10 finished with value: -0.011550313870567161 and parameters: {'model_type': 'mlp', 'hidden_dims': '[512, 64]', 'dropout': 0.27531666245262887, 'batch_norm': False, 'lr': 0.00032393778075602147, 'weight_decay': 1.1714031539166647e-07, 'epochs': 44, 'loss': 'mse', 'optimizer': 'adam', 'graph_mode': 'off', 'use_snp_selection': False}. Best is trial 9 with value: 0.06315260136507819.
[I 2025-12-05 15:02:43,340] Trial 11 finished with value: 0.0011242785301149429 and parameters: {'model_type': 'mlp', 'hidden_dims': '[256, 128]', 'dropout': 0.4976577565047725, 'batch_norm': False, 'lr': 1.6474108386126448e-05, 'weight_decay': 1.4494794384169763e-06, 'epochs': 185, 'loss': 'mse', 'optimizer': 'adam', 'graph_mode': 'off', 'use_snp_selection': False}. Best is trial 9 with value: 0.06315260136507819.
[I 2025-12-05 15:02:44,353] Trial 12 finished with value: 0.0414601654544897 and parameters: {'model_type': 'mlp', 'hidden_dims': '[256, 128]', 'dropout': 0.33506312640228997, 'batch_norm': False, 'lr': 2.1956038299947918e-05, 'weight_decay': 1.255784110448998e-06, 'epochs': 218, 'loss': 'mse', 'optimizer': 'adam', 'graph_mode': 'off', 'use_snp_selection': False}. Best is trial 9 with value: 0.06315260136507819.
[I 2025-12-05 15:02:45,065] Trial 13 finished with value: 0.019598415706810455 and parameters: {'model_type': 'mlp', 'hidden_dims': '[128, 64]', 'dropout': 0.3041365173646664, 'batch_norm': False, 'lr': 8.582121287988678e-05, 'weight_decay': 2.349010587167957e-06, 'epochs': 174, 'loss': 'mse', 'optimizer': 'adam', 'graph_mode': 'off', 'use_snp_selection': False}. Best is trial 9 with value: 0.06315260136507819.
[I 2025-12-05 15:02:45,906] Trial 14 finished with value: 0.033856516707338115 and parameters: {'model_type': 'mlp', 'hidden_dims': '[256, 128, 64]', 'dropout': 0.49440769466847734, 'batch_norm': True, 'lr': 0.0006681578335050954, 'weight_decay': 3.563076152334783e-06, 'epochs': 105, 'loss': 'mse', 'optimizer': 'adam', 'graph_mode': 'off', 'use_snp_selection': False}. Best is trial 9 with value: 0.06315260136507819.
[I 2025-12-05 15:02:47,541] Trial 15 finished with value: 0.05171268873110854 and parameters: {'model_type': 'mlp', 'hidden_dims': '[512, 256]', 'dropout': 0.2097289363457977, 'batch_norm': False, 'lr': 1.0876311506248302e-05, 'weight_decay': 3.6646467493535765e-07, 'epochs': 241, 'loss': 'mse', 'optimizer': 'adam', 'graph_mode': 'off', 'use_snp_selection': False}. Best is trial 9 with value: 0.06315260136507819.
[I 2025-12-05 15:02:48,589] Trial 16 finished with value: 0.041861275987282315 and parameters: {'model_type': 'mlp', 'hidden_dims': '[256, 128]', 'dropout': 0.37024128557448766, 'batch_norm': True, 'lr': 0.00015782481728265424, 'weight_decay': 3.719559505513867e-07, 'epochs': 206, 'loss': 'mse', 'optimizer': 'adam', 'graph_mode': 'off', 'use_snp_selection': False}. Best is trial 9 with value: 0.06315260136507819.
[I 2025-12-05 15:02:49,696] Trial 17 finished with value: 0.004742840017242305 and parameters: {'model_type': 'mlp', 'hidden_dims': '[512, 64]', 'dropout': 0.4828821377080481, 'batch_norm': False, 'lr': 4.163115072759242e-05, 'weight_decay': 5.006881582379502e-06, 'epochs': 104, 'loss': 'mse', 'optimizer': 'adam', 'graph_mode': 'off', 'use_snp_selection': False}. Best is trial 9 with value: 0.06315260136507819.
[I 2025-12-05 15:02:52,388] Trial 18 finished with value: 0.03846998288801257 and parameters: {'model_type': 'mlp', 'hidden_dims': '[256, 128]', 'dropout': 0.5855696804968278, 'batch_norm': False, 'lr': 0.0009620630595655681, 'weight_decay': 7.898334062172957e-07, 'epochs': 270, 'loss': 'mse', 'optimizer': 'adam', 'graph_mode': 'off', 'use_snp_selection': True, 'num_snps': 58241}. Best is trial 9 with value: 0.06315260136507819.
[I 2025-12-05 15:02:53,704] Trial 19 finished with value: 0.05351063963405486 and parameters: {'model_type': 'mlp', 'hidden_dims': '[512, 64]', 'dropout': 0.22039029283971212, 'batch_norm': True, 'lr': 0.00014334793979738487, 'weight_decay': 1.1354159408743119e-07, 'epochs': 154, 'loss': 'mse', 'optimizer': 'adam', 'graph_mode': 'off', 'use_snp_selection': False}. Best is trial 9 with value: 0.06315260136507819.
[I 2025-12-05 15:02:54,541] Trial 20 finished with value: 0.023286240919547153 and parameters: {'model_type': 'mlp', 'hidden_dims': '[512, 128]', 'dropout': 0.14114479152057646, 'batch_norm': False, 'lr': 3.4618347735679545e-05, 'weight_decay': 7.185108211693241e-06, 'epochs': 43, 'loss': 'mse', 'optimizer': 'adam', 'graph_mode': 'off', 'use_snp_selection': False}. Best is trial 9 with value: 0.06315260136507819.
[I 2025-12-05 15:02:55,614] Trial 21 finished with value: 0.037375977917506124 and parameters: {'model_type': 'mlp', 'hidden_dims': '[512, 256]', 'dropout': 0.1688434512378943, 'batch_norm': True, 'lr': 5.721741449780154e-05, 'weight_decay': 3.8297446720140506e-07, 'epochs': 91, 'loss': 'mse', 'optimizer': 'adam', 'graph_mode': 'off', 'use_snp_selection': False}. Best is trial 9 with value: 0.06315260136507819.
[I 2025-12-05 15:02:56,782] Trial 22 finished with value: 0.06241110360543229 and parameters: {'model_type': 'mlp', 'hidden_dims': '[512, 256]', 'dropout': 0.10623420294296748, 'batch_norm': True, 'lr': 0.00010415885440682474, 'weight_decay': 6.64240867970077e-07, 'epochs': 115, 'loss': 'mse', 'optimizer': 'adam', 'graph_mode': 'off', 'use_snp_selection': False}. Best is trial 9 with value: 0.06315260136507819.
[I 2025-12-05 15:02:57,978] Trial 23 finished with value: 0.041032081021265404 and parameters: {'model_type': 'mlp', 'hidden_dims': '[512, 256]', 'dropout': 0.125070012607352, 'batch_norm': True, 'lr': 0.00014493101225506775, 'weight_decay': 8.731581411613647e-07, 'epochs': 126, 'loss': 'mse', 'optimizer': 'adam', 'graph_mode': 'off', 'use_snp_selection': False}. Best is trial 9 with value: 0.06315260136507819.
[I 2025-12-05 15:02:59,340] Trial 24 finished with value: 0.048075602241962806 and parameters: {'model_type': 'mlp', 'hidden_dims': '[512, 256]', 'dropout': 0.25472976008685, 'batch_norm': True, 'lr': 0.0003884681941817077, 'weight_decay': 2.1336866979613932e-07, 'epochs': 175, 'loss': 'mse', 'optimizer': 'adam', 'graph_mode': 'off', 'use_snp_selection': False}. Best is trial 9 with value: 0.06315260136507819.
[I 2025-12-05 15:03:00,354] Trial 25 finished with value: 0.03823941063077615 and parameters: {'model_type': 'mlp', 'hidden_dims': '[256, 128, 64]', 'dropout': 0.32809541011731974, 'batch_norm': True, 'lr': 1.980751383203452e-05, 'weight_decay': 2.4457524680742576e-06, 'epochs': 206, 'loss': 'mse', 'optimizer': 'adam', 'graph_mode': 'off', 'use_snp_selection': False}. Best is trial 9 with value: 0.06315260136507819.
[I 2025-12-05 15:03:01,140] Trial 26 finished with value: 0.003242387466692546 and parameters: {'model_type': 'mlp', 'hidden_dims': '[128, 64]', 'dropout': 0.10067317099886967, 'batch_norm': True, 'lr': 1.1932110430065754e-05, 'weight_decay': 7.830367085139929e-07, 'epochs': 127, 'loss': 'mae', 'optimizer': 'adam', 'graph_mode': 'off', 'use_snp_selection': True, 'num_snps': 3842}. Best is trial 9 with value: 0.06315260136507819.
[I 2025-12-05 15:03:02,759] Trial 27 finished with value: 0.04176912601753941 and parameters: {'model_type': 'mlp', 'hidden_dims': '[512, 64]', 'dropout': 0.19267114791084833, 'batch_norm': True, 'lr': 9.911283524093763e-05, 'weight_decay': 2.324309034034573e-06, 'epochs': 245, 'loss': 'mse', 'optimizer': 'adam', 'graph_mode': 'off', 'use_snp_selection': False}. Best is trial 9 with value: 0.06315260136507819.
[I 2025-12-05 15:03:03,517] Trial 28 finished with value: 0.012596129928601317 and parameters: {'model_type': 'mlp', 'hidden_dims': '[256, 128]', 'dropout': 0.4473541736991937, 'batch_norm': False, 'lr': 4.460924914234359e-05, 'weight_decay': 2.168834641974451e-07, 'epochs': 84, 'loss': 'mse', 'optimizer': 'adam', 'graph_mode': 'off', 'use_snp_selection': False}. Best is trial 9 with value: 0.06315260136507819.
[I 2025-12-05 15:03:04,751] Trial 29 finished with value: 0.0500754285865693 and parameters: {'model_type': 'mlp', 'hidden_dims': '[128, 64]', 'dropout': 0.16450315385283126, 'batch_norm': True, 'lr': 3.099760732506207e-05, 'weight_decay': 5.5227103357724904e-05, 'epochs': 65, 'loss': 'mae', 'optimizer': 'adam', 'graph_mode': 'off', 'use_snp_selection': True, 'num_snps': 19468}. Best is trial 9 with value: 0.06315260136507819.
[I 2025-12-05 15:03:06,005] Trial 30 finished with value: 0.04402626260656856 and parameters: {'model_type': 'mlp', 'hidden_dims': '[512, 256]', 'dropout': 0.296119437767396, 'batch_norm': True, 'lr': 6.66844549266093e-06, 'weight_decay': 1.2658669367756793e-06, 'epochs': 127, 'loss': 'mse', 'optimizer': 'adam', 'graph_mode': 'off', 'use_snp_selection': False}. Best is trial 9 with value: 0.06315260136507819.
[I 2025-12-05 15:03:07,328] Trial 31 finished with value: 0.05482549176822636 and parameters: {'model_type': 'mlp', 'hidden_dims': '[512, 256]', 'dropout': 0.15081063416881288, 'batch_norm': True, 'lr': 9.891108035313515e-05, 'weight_decay': 5.454090085152267e-07, 'epochs': 163, 'loss': 'mse', 'optimizer': 'adam', 'graph_mode': 'off', 'use_snp_selection': False}. Best is trial 9 with value: 0.06315260136507819.
[I 2025-12-05 15:03:08,650] Trial 32 finished with value: 0.0461653723866442 and parameters: {'model_type': 'mlp', 'hidden_dims': '[512, 256]', 'dropout': 0.17986057484829576, 'batch_norm': True, 'lr': 0.00010753141500626153, 'weight_decay': 5.558037729299187e-07, 'epochs': 164, 'loss': 'mse', 'optimizer': 'adam', 'graph_mode': 'off', 'use_snp_selection': False}. Best is trial 9 with value: 0.06315260136507819.
[I 2025-12-05 15:03:10,078] Trial 33 finished with value: 0.05382496412207652 and parameters: {'model_type': 'mlp', 'hidden_dims': '[512, 256]', 'dropout': 0.23566639489422117, 'batch_norm': True, 'lr': 0.0002213167856693411, 'weight_decay': 1.581409498550624e-07, 'epochs': 195, 'loss': 'mse', 'optimizer': 'adam', 'graph_mode': 'off', 'use_snp_selection': False}. Best is trial 9 with value: 0.06315260136507819.
[I 2025-12-05 15:03:11,665] Trial 34 finished with value: 0.056865266513511946 and parameters: {'model_type': 'mlp', 'hidden_dims': '[512, 256]', 'dropout': 0.14413551044688203, 'batch_norm': True, 'lr': 7.617544649993905e-05, 'weight_decay': 2.5155909491441697e-07, 'epochs': 226, 'loss': 'mae', 'optimizer': 'adam', 'graph_mode': 'off', 'use_snp_selection': False}. Best is trial 9 with value: 0.06315260136507819.
[I 2025-12-05 15:03:12,743] Trial 35 finished with value: 0.06441747970138538 and parameters: {'model_type': 'mlp', 'hidden_dims': '[256, 128]', 'dropout': 0.12081289455778108, 'batch_norm': True, 'lr': 6.068848268228851e-05, 'weight_decay': 2.8501994614377877e-07, 'epochs': 223, 'loss': 'mae', 'optimizer': 'adam', 'graph_mode': 'off', 'use_snp_selection': False}. Best is trial 35 with value: 0.06441747970138538.
