[I 2025-12-05 15:20:47,390] Trial 60 finished with value: 0.09312642104728691 and parameters: {'model_type': 'mlp', 'hidden_dims': '[128, 64]', 'dropout': 0.36595899794578557, 'batch_norm': False, 'lr': 2.488354525641653e-05, 'weight_decay': 8.54599740757386e-06, 'epochs': 217, 'loss': 'mae', 'optimizer': 'adam', 'graph_mode': 'off', 'use_snp_selection': False}. Best is trial 46 with value: 0.11623434863361608.
[I 2025-12-05 15:20:48,421] Trial 61 finished with value: 0.09916425809907808 and parameters: {'model_type': 'mlp', 'hidden_dims': '[128, 64]', 'dropout': 0.24378905943272844, 'batch_norm': False, 'lr': 6.699405440089976e-05, 'weight_decay': 4.149949295183817e-06, 'epochs': 224, 'loss': 'mae', 'optimizer': 'adam', 'graph_mode': 'off', 'use_snp_selection': False}. Best is trial 46 with value: 0.11623434863361608.
[I 2025-12-05 15:20:49,519] Trial 62 finished with value: 0.09520893401571771 and parameters: {'model_type': 'mlp', 'hidden_dims': '[128, 64]', 'dropout': 0.2377240067107237, 'batch_norm': False, 'lr': 7.448730334049144e-05, 'weight_decay': 3.2720507982960905e-06, 'epochs': 259, 'loss': 'mae', 'optimizer': 'adam', 'graph_mode': 'off', 'use_snp_selection': False}. Best is trial 46 with value: 0.11623434863361608.
[I 2025-12-05 15:20:50,495] Trial 63 finished with value: 0.10039330035122011 and parameters: {'model_type': 'mlp', 'hidden_dims': '[128, 64]', 'dropout': 0.2988875470485191, 'batch_norm': False, 'lr': 0.0001010083937087094, 'weight_decay': 1.7528815420828027e-06, 'epochs': 186, 'loss': 'mae', 'optimizer': 'adam', 'graph_mode': 'off', 'use_snp_selection': False}. Best is trial 46 with value: 0.11623434863361608.
[I 2025-12-05 15:20:51,465] Trial 64 finished with value: 0.08409097925494634 and parameters: {'model_type': 'mlp', 'hidden_dims': '[128, 64]', 'dropout': 0.30168942558105155, 'batch_norm': False, 'lr': 0.00011133848481758813, 'weight_decay': 2.252587681490781e-06, 'epochs': 185, 'loss': 'mae', 'optimizer': 'adam', 'graph_mode': 'off', 'use_snp_selection': False}. Best is trial 46 with value: 0.11623434863361608.
[I 2025-12-05 15:20:52,471] Trial 65 finished with value: 0.06479713923320693 and parameters: {'model_type': 'mlp', 'hidden_dims': '[128, 64]', 'dropout': 0.276564206869354, 'batch_norm': False, 'lr': 4.643707360139204e-05, 'weight_decay': 4.334169358459645e-06, 'epochs': 216, 'loss': 'mae', 'optimizer': 'adam', 'graph_mode': 'off', 'use_snp_selection': False}. Best is trial 46 with value: 0.11623434863361608.
[I 2025-12-05 15:20:53,515] Trial 66 finished with value: 0.1103545131639811 and parameters: {'model_type': 'mlp', 'hidden_dims': '[128, 64]', 'dropout': 0.3042525387178539, 'batch_norm': False, 'lr': 3.424967839416249e-05, 'weight_decay': 7.872000154822419e-06, 'epochs': 228, 'loss': 'mae', 'optimizer': 'adam', 'graph_mode': 'off', 'use_snp_selection': False}. Best is trial 46 with value: 0.11623434863361608.
[I 2025-12-05 15:20:55,310] Trial 67 finished with value: 0.06197869678299239 and parameters: {'model_type': 'mlp', 'hidden_dims': '[128, 64]', 'dropout': 0.30518336074105745, 'batch_norm': False, 'lr': 3.27862963518881e-05, 'weight_decay': 1.6927153362961188e-05, 'epochs': 241, 'loss': 'mae', 'optimizer': 'adam', 'graph_mode': 'off', 'use_snp_selection': True, 'num_snps': 22951}. Best is trial 46 with value: 0.11623434863361608.
[I 2025-12-05 15:20:56,220] Trial 68 finished with value: 0.0644973867074308 and parameters: {'model_type': 'mlp', 'hidden_dims': '[128, 64]', 'dropout': 0.3326798987697642, 'batch_norm': False, 'lr': 1.5815410505739007e-05, 'weight_decay': 3.870479020579235e-05, 'epochs': 184, 'loss': 'mae', 'optimizer': 'adam', 'graph_mode': 'off', 'use_snp_selection': False}. Best is trial 46 with value: 0.11623434863361608.
[I 2025-12-05 15:20:57,176] Trial 69 finished with value: 0.0939035617464929 and parameters: {'model_type': 'mlp', 'hidden_dims': '[128, 64]', 'dropout': 0.28942708549152474, 'batch_norm': False, 'lr': 2.0141808646000952e-05, 'weight_decay': 8.223835678459208e-06, 'epochs': 206, 'loss': 'mae', 'optimizer': 'adam', 'graph_mode': 'off', 'use_snp_selection': False}. Best is trial 46 with value: 0.11623434863361608.
[I 2025-12-05 15:20:58,240] Trial 70 finished with value: 0.0814730103253647 and parameters: {'model_type': 'mlp', 'hidden_dims': '[128, 64]', 'dropout': 0.26873211496228117, 'batch_norm': False, 'lr': 9.040588929657132e-05, 'weight_decay': 2.5809089088164386e-05, 'epochs': 268, 'loss': 'mae', 'optimizer': 'adam', 'graph_mode': 'off', 'use_snp_selection': False}. Best is trial 46 with value: 0.11623434863361608.
[I 2025-12-05 15:20:59,243] Trial 71 finished with value: 0.09333821748230181 and parameters: {'model_type': 'mlp', 'hidden_dims': '[128, 64]', 'dropout': 0.23954227374388046, 'batch_norm': False, 'lr': 6.884292323628158e-05, 'weight_decay': 9.786857185686195e-06, 'epochs': 233, 'loss': 'mae', 'optimizer': 'adam', 'graph_mode': 'off', 'use_snp_selection': False}. Best is trial 46 with value: 0.11623434863361608.
[I 2025-12-05 15:21:00,240] Trial 72 finished with value: 0.09163945590873263 and parameters: {'model_type': 'mlp', 'hidden_dims': '[128, 64]', 'dropout': 0.339487180804213, 'batch_norm': False, 'lr': 5.49131084923519e-05, 'weight_decay': 6.285716554654473e-06, 'epochs': 230, 'loss': 'mae', 'optimizer': 'adam', 'graph_mode': 'off', 'use_snp_selection': False}. Best is trial 46 with value: 0.11623434863361608.
[I 2025-12-05 15:21:01,192] Trial 73 finished with value: 0.06120072235448345 and parameters: {'model_type': 'mlp', 'hidden_dims': '[128, 64]', 'dropout': 0.30464717644688194, 'batch_norm': False, 'lr': 3.2729323907290974e-05, 'weight_decay': 2.156445213987403e-06, 'epochs': 205, 'loss': 'mae', 'optimizer': 'adam', 'graph_mode': 'off', 'use_snp_selection': False}. Best is trial 46 with value: 0.11623434863361608.
[I 2025-12-05 15:21:02,114] Trial 74 finished with value: 0.09908160867665418 and parameters: {'model_type': 'mlp', 'hidden_dims': '[128, 64]', 'dropout': 0.3654032898729861, 'batch_norm': False, 'lr': 0.00010255154166096038, 'weight_decay': 3.6952266370571084e-06, 'epochs': 189, 'loss': 'mae', 'optimizer': 'adam', 'graph_mode': 'off', 'use_snp_selection': False}. Best is trial 46 with value: 0.11623434863361608.
[I 2025-12-05 15:21:03,635] Trial 75 finished with value: 0.0894101707512074 and parameters: {'model_type': 'mlp', 'hidden_dims': '[256, 128, 64]', 'dropout': 0.26507755962787305, 'batch_norm': False, 'lr': 4.872623378156766e-05, 'weight_decay': 1.2351863412342552e-06, 'epochs': 249, 'loss': 'mae', 'optimizer': 'adam', 'graph_mode': 'off', 'use_snp_selection': False}. Best is trial 46 with value: 0.11623434863361608.
[I 2025-12-05 15:21:04,674] Trial 76 finished with value: 0.13137043957553401 and parameters: {'model_type': 'mlp', 'hidden_dims': '[128, 64]', 'dropout': 0.20598951352167338, 'batch_norm': False, 'lr': 7.35946958038396e-05, 'weight_decay': 1.6795318320799537e-05, 'epochs': 222, 'loss': 'mae', 'optimizer': 'adam', 'graph_mode': 'off', 'use_snp_selection': False}. Best is trial 76 with value: 0.13137043957553401.
[I 2025-12-05 15:21:05,703] Trial 77 finished with value: 0.08329558909970375 and parameters: {'model_type': 'mlp', 'hidden_dims': '[128, 64]', 'dropout': 0.2094715041447171, 'batch_norm': False, 'lr': 0.00013155961991010256, 'weight_decay': 1.982556528743041e-05, 'epochs': 215, 'loss': 'mae', 'optimizer': 'adam', 'graph_mode': 'off', 'use_snp_selection': False}. Best is trial 76 with value: 0.13137043957553401.
[I 2025-12-05 15:21:08,013] Trial 78 finished with value: 0.05749075576833332 and parameters: {'model_type': 'mlp', 'hidden_dims': '[512, 64]', 'dropout': 0.28375144891556126, 'batch_norm': False, 'lr': 1.0087771566710253e-06, 'weight_decay': 1.4524062835615853e-05, 'epochs': 207, 'loss': 'mae', 'optimizer': 'adam', 'graph_mode': 'off', 'use_snp_selection': False}. Best is trial 76 with value: 0.13137043957553401.
[I 2025-12-05 15:21:09,289] Trial 79 finished with value: 0.07651180942550032 and parameters: {'model_type': 'mlp', 'hidden_dims': '[128, 64]', 'dropout': 0.19841781292215943, 'batch_norm': False, 'lr': 0.000192308749894991, 'weight_decay': 5.481797973025319e-05, 'epochs': 286, 'loss': 'mae', 'optimizer': 'adam', 'graph_mode': 'off', 'use_snp_selection': True, 'num_snps': 3769}. Best is trial 76 with value: 0.13137043957553401.
[I 2025-12-05 15:21:10,179] Trial 80 finished with value: 0.03725745048243875 and parameters: {'model_type': 'mlp', 'hidden_dims': '[128, 64]', 'dropout': 0.3163416148499823, 'batch_norm': False, 'lr': 1.3312140434994905e-05, 'weight_decay': 7.744052708632783e-06, 'epochs': 144, 'loss': 'mae', 'optimizer': 'adam', 'graph_mode': 'off', 'use_snp_selection': False}. Best is trial 76 with value: 0.13137043957553401.
[I 2025-12-05 15:21:11,175] Trial 81 finished with value: 0.09528136292507658 and parameters: {'model_type': 'mlp', 'hidden_dims': '[128, 64]', 'dropout': 0.23798321156766702, 'batch_norm': False, 'lr': 7.121016216920958e-05, 'weight_decay': 1.0219502770804957e-05, 'epochs': 225, 'loss': 'mae', 'optimizer': 'adam', 'graph_mode': 'off', 'use_snp_selection': False}. Best is trial 76 with value: 0.13137043957553401.
[I 2025-12-05 15:21:12,221] Trial 82 finished with value: 0.10967194638449215 and parameters: {'model_type': 'mlp', 'hidden_dims': '[128, 64]', 'dropout': 0.22350179760283437, 'batch_norm': False, 'lr': 3.726335058685197e-05, 'weight_decay': 1.228807492398481e-05, 'epochs': 256, 'loss': 'mae', 'optimizer': 'adam', 'graph_mode': 'off', 'use_snp_selection': False}. Best is trial 76 with value: 0.13137043957553401.
[I 2025-12-05 15:21:13,268] Trial 83 finished with value: 0.10412041967716763 and parameters: {'model_type': 'mlp', 'hidden_dims': '[128, 64]', 'dropout': 0.2204876453942141, 'batch_norm': False, 'lr': 3.801264675983155e-05, 'weight_decay': 2.7169294665494547e-05, 'epochs': 257, 'loss': 'mae', 'optimizer': 'adam', 'graph_mode': 'off', 'use_snp_selection': False}. Best is trial 76 with value: 0.13137043957553401.
[I 2025-12-05 15:21:16,005] Trial 84 finished with value: 0.100158650993886 and parameters: {'model_type': 'mlp', 'hidden_dims': '[512, 128]', 'dropout': 0.2232140027202475, 'batch_norm': False, 'lr': 3.593457807215392e-05, 'weight_decay': 2.9325326356580183e-05, 'epochs': 271, 'loss': 'mae', 'optimizer': 'adam', 'graph_mode': 'off', 'use_snp_selection': False}. Best is trial 76 with value: 0.13137043957553401.
[I 2025-12-05 15:21:17,138] Trial 85 finished with value: 0.0901971780927463 and parameters: {'model_type': 'mlp', 'hidden_dims': '[128, 64]', 'dropout': 0.20719654434727405, 'batch_norm': False, 'lr': 2.602397455109134e-05, 'weight_decay': 1.9458097374543164e-05, 'epochs': 308, 'loss': 'mae', 'optimizer': 'adam', 'graph_mode': 'off', 'use_snp_selection': False}. Best is trial 76 with value: 0.13137043957553401.
[I 2025-12-05 15:21:18,176] Trial 86 finished with value: 0.09448804536937853 and parameters: {'model_type': 'mlp', 'hidden_dims': '[128, 64]', 'dropout': 0.1807099955664675, 'batch_norm': False, 'lr': 3.926131719608261e-05, 'weight_decay': 4.7332473463476704e-05, 'epochs': 256, 'loss': 'mae', 'optimizer': 'adam', 'graph_mode': 'off', 'use_snp_selection': False}. Best is trial 76 with value: 0.13137043957553401.
[I 2025-12-05 15:21:19,777] Trial 87 finished with value: 0.1011789630459001 and parameters: {'model_type': 'mlp', 'hidden_dims': '[256, 128, 64]', 'dropout': 0.29565567026784206, 'batch_norm': False, 'lr': 2.305533175707797e-05, 'weight_decay': 1.2180893131441002e-05, 'epochs': 260, 'loss': 'mae', 'optimizer': 'adam', 'graph_mode': 'off', 'use_snp_selection': False}. Best is trial 76 with value: 0.13137043957553401.
[I 2025-12-05 15:21:21,453] Trial 88 finished with value: 0.09122304588650632 and parameters: {'model_type': 'mlp', 'hidden_dims': '[256, 128, 64]', 'dropout': 0.22592558030349252, 'batch_norm': False, 'lr': 2.282393816462449e-05, 'weight_decay': 1.1780142002003137e-05, 'epochs': 278, 'loss': 'mae', 'optimizer': 'adam', 'graph_mode': 'off', 'use_snp_selection': False}. Best is trial 76 with value: 0.13137043957553401.
[I 2025-12-05 15:21:23,027] Trial 89 finished with value: 0.07478345127558118 and parameters: {'model_type': 'mlp', 'hidden_dims': '[256, 128, 64]', 'dropout': 0.2626866276514452, 'batch_norm': False, 'lr': 8.010822458831495e-06, 'weight_decay': 1.5051172625640337e-05, 'epochs': 255, 'loss': 'mae', 'optimizer': 'adam', 'graph_mode': 'off', 'use_snp_selection': False}. Best is trial 76 with value: 0.13137043957553401.
[I 2025-12-05 15:21:24,579] Trial 90 finished with value: 0.09698509666944732 and parameters: {'model_type': 'mlp', 'hidden_dims': '[256, 128, 64]', 'dropout': 0.17244844185117023, 'batch_norm': False, 'lr': 3.0018634537599307e-05, 'weight_decay': 2.697333313437091e-05, 'epochs': 248, 'loss': 'mae', 'optimizer': 'adam', 'graph_mode': 'off', 'use_snp_selection': False}. Best is trial 76 with value: 0.13137043957553401.
[I 2025-12-05 15:21:26,072] Trial 91 finished with value: 0.09935822581786627 and parameters: {'model_type': 'mlp', 'hidden_dims': '[256, 128, 64]', 'dropout': 0.32620145674241824, 'batch_norm': False, 'lr': 4.6358485176335406e-05, 'weight_decay': 1.988538365052181e-05, 'epochs': 235, 'loss': 'mae', 'optimizer': 'adam', 'graph_mode': 'off', 'use_snp_selection': False}. Best is trial 76 with value: 0.13137043957553401.
[I 2025-12-05 15:21:28,028] Trial 92 finished with value: 0.07128867496523192 and parameters: {'model_type': 'mlp', 'hidden_dims': '[512, 64]', 'dropout': 0.2921567369170144, 'batch_norm': False, 'lr': 1.9419165376295864e-05, 'weight_decay': 3.960582955709466e-05, 'epochs': 164, 'loss': 'mae', 'optimizer': 'adam', 'graph_mode': 'off', 'use_snp_selection': False}. Best is trial 76 with value: 0.13137043957553401.
[I 2025-12-05 15:21:29,079] Trial 93 finished with value: 0.11137974106698577 and parameters: {'model_type': 'mlp', 'hidden_dims': '[128, 64]', 'dropout': 0.1914585557844728, 'batch_norm': False, 'lr': 5.248006680228229e-05, 'weight_decay': 5.391833593734344e-06, 'epochs': 262, 'loss': 'mae', 'optimizer': 'adam', 'graph_mode': 'off', 'use_snp_selection': False}. Best is trial 76 with value: 0.13137043957553401.
[I 2025-12-05 15:21:30,659] Trial 94 finished with value: 0.09202831546710291 and parameters: {'model_type': 'mlp', 'hidden_dims': '[256, 128, 64]', 'dropout': 0.1924899757719155, 'batch_norm': False, 'lr': 1.607584244240257e-05, 'weight_decay': 5.7952316355753654e-06, 'epochs': 265, 'loss': 'mae', 'optimizer': 'adam', 'graph_mode': 'off', 'use_snp_selection': False}. Best is trial 76 with value: 0.13137043957553401.
[I 2025-12-05 15:21:31,763] Trial 95 finished with value: 0.10589738764613887 and parameters: {'model_type': 'mlp', 'hidden_dims': '[128, 64]', 'dropout': 0.2039873234254063, 'batch_norm': False, 'lr': 2.9677682418507988e-05, 'weight_decay': 1.2019364261752722e-05, 'epochs': 278, 'loss': 'mae', 'optimizer': 'adam', 'graph_mode': 'off', 'use_snp_selection': False}. Best is trial 76 with value: 0.13137043957553401.
[I 2025-12-05 15:21:35,906] Trial 96 finished with value: 0.07029287392644683 and parameters: {'model_type': 'mlp', 'hidden_dims': '[512, 256]', 'dropout': 0.2131783633075488, 'batch_norm': False, 'lr': 2.8505494687316588e-05, 'weight_decay': 1.230708846393055e-05, 'epochs': 295, 'loss': 'mae', 'optimizer': 'adam', 'graph_mode': 'off', 'use_snp_selection': True, 'num_snps': 48962}. Best is trial 76 with value: 0.13137043957553401.
[I 2025-12-05 15:21:37,027] Trial 97 finished with value: 0.10769368346875993 and parameters: {'model_type': 'mlp', 'hidden_dims': '[128, 64]', 'dropout': 0.15999288413528265, 'batch_norm': False, 'lr': 2.220294284429849e-05, 'weight_decay': 1.6706374798005273e-05, 'epochs': 278, 'loss': 'mae', 'optimizer': 'adam', 'graph_mode': 'off', 'use_snp_selection': False}. Best is trial 76 with value: 0.13137043957553401.
[I 2025-12-05 15:21:38,167] Trial 98 finished with value: 0.11079091174116361 and parameters: {'model_type': 'mlp', 'hidden_dims': '[128, 64]', 'dropout': 0.1547873446737144, 'batch_norm': False, 'lr': 3.5645957135453124e-05, 'weight_decay': 7.074501432621622e-06, 'epochs': 285, 'loss': 'mae', 'optimizer': 'adam', 'graph_mode': 'off', 'use_snp_selection': False}. Best is trial 76 with value: 0.13137043957553401.
[I 2025-12-05 15:21:39,262] Trial 99 finished with value: 0.1056936020917192 and parameters: {'model_type': 'mlp', 'hidden_dims': '[128, 64]', 'dropout': 0.159283473657438, 'batch_norm': False, 'lr': 3.5965143150863456e-05, 'weight_decay': 6.948903349489383e-06, 'epochs': 279, 'loss': 'mae', 'optimizer': 'adam', 'graph_mode': 'off', 'use_snp_selection': False}. Best is trial 76 with value: 0.13137043957553401.
[I 2025-12-05 15:21:40,425] Trial 100 finished with value: 0.09318264219657758 and parameters: {'model_type': 'mlp', 'hidden_dims': '[128, 64]', 'dropout': 0.16211746923372017, 'batch_norm': False, 'lr': 3.4187226903813484e-05, 'weight_decay': 5.170759676084392e-06, 'epochs': 322, 'loss': 'mae', 'optimizer': 'adam', 'graph_mode': 'off', 'use_snp_selection': False}. Best is trial 76 with value: 0.13137043957553401.
[I 2025-12-05 15:21:41,526] Trial 101 finished with value: 0.09171454319708114 and parameters: {'model_type': 'mlp', 'hidden_dims': '[128, 64]', 'dropout': 0.1340900425721221, 'batch_norm': False, 'lr': 4.083628442904987e-05, 'weight_decay': 7.159640897179727e-06, 'epochs': 286, 'loss': 'mae', 'optimizer': 'adam', 'graph_mode': 'off', 'use_snp_selection': False}. Best is trial 76 with value: 0.13137043957553401.
[I 2025-12-05 15:21:42,611] Trial 102 finished with value: 0.10183571090468126 and parameters: {'model_type': 'mlp', 'hidden_dims': '[128, 64]', 'dropout': 0.16659035351273074, 'batch_norm': False, 'lr': 5.288227231769951e-05, 'weight_decay': 2.3039920318642086e-05, 'epochs': 278, 'loss': 'mae', 'optimizer': 'adam', 'graph_mode': 'off', 'use_snp_selection': False}. Best is trial 76 with value: 0.13137043957553401.
[I 2025-12-05 15:21:43,751] Trial 103 finished with value: 0.11242593586662336 and parameters: {'model_type': 'mlp', 'hidden_dims': '[128, 64]', 'dropout': 0.15941976578918507, 'batch_norm': False, 'lr': 1.3879129701420326e-05, 'weight_decay': 6.609059710718415e-06, 'epochs': 308, 'loss': 'mae', 'optimizer': 'adam', 'graph_mode': 'off', 'use_snp_selection': False}. Best is trial 76 with value: 0.13137043957553401.
[I 2025-12-05 15:21:44,938] Trial 104 finished with value: 0.0810826144872201 and parameters: {'model_type': 'mlp', 'hidden_dims': '[128, 64]', 'dropout': 0.1532296214650287, 'batch_norm': False, 'lr': 1.34423819974314e-05, 'weight_decay': 6.025281731860439e-06, 'epochs': 309, 'loss': 'mae', 'optimizer': 'adam', 'graph_mode': 'off', 'use_snp_selection': False}. Best is trial 76 with value: 0.13137043957553401.
[I 2025-12-05 15:21:46,119] Trial 105 finished with value: 0.06968746077020274 and parameters: {'model_type': 'mlp', 'hidden_dims': '[128, 64]', 'dropout': 0.13952902637578357, 'batch_norm': False, 'lr': 9.876452464711382e-06, 'weight_decay': 7.417470688150721e-06, 'epochs': 299, 'loss': 'mae', 'optimizer': 'adam', 'graph_mode': 'off', 'use_snp_selection': False}. Best is trial 76 with value: 0.13137043957553401.
[I 2025-12-05 15:21:47,346] Trial 106 finished with value: 0.10404952426114691 and parameters: {'model_type': 'mlp', 'hidden_dims': '[128, 64]', 'dropout': 0.15722073701533115, 'batch_norm': False, 'lr': 1.2966559680472904e-05, 'weight_decay': 1.0977323258110685e-05, 'epochs': 325, 'loss': 'mae', 'optimizer': 'adam', 'graph_mode': 'off', 'use_snp_selection': False}. Best is trial 76 with value: 0.13137043957553401.
[I 2025-12-05 15:21:48,504] Trial 107 finished with value: 0.10403620198585375 and parameters: {'model_type': 'mlp', 'hidden_dims': '[128, 64]', 'dropout': 0.18526324936077498, 'batch_norm': False, 'lr': 3.806683444452683e-06, 'weight_decay': 3.417261675455139e-06, 'epochs': 285, 'loss': 'mae', 'optimizer': 'adam', 'graph_mode': 'off', 'use_snp_selection': False}. Best is trial 76 with value: 0.13137043957553401.
[I 2025-12-05 15:21:49,674] Trial 108 finished with value: 0.06701129843231997 and parameters: {'model_type': 'mlp', 'hidden_dims': '[128, 64]', 'dropout': 0.19955839485140858, 'batch_norm': False, 'lr': 6.05192966605555e-06, 'weight_decay': 4.726703370936392e-06, 'epochs': 303, 'loss': 'mae', 'optimizer': 'adam', 'graph_mode': 'off', 'use_snp_selection': False}. Best is trial 76 with value: 0.13137043957553401.
[I 2025-12-05 15:21:50,793] Trial 109 finished with value: 0.07108832481412136 and parameters: {'model_type': 'mlp', 'hidden_dims': '[128, 64]', 'dropout': 0.1732881215267813, 'batch_norm': False, 'lr': 1.7961104246482075e-05, 'weight_decay': 1.7181844948821092e-05, 'epochs': 276, 'loss': 'mae', 'optimizer': 'adam', 'graph_mode': 'off', 'use_snp_selection': False}. Best is trial 76 with value: 0.13137043957553401.
[I 2025-12-05 15:21:53,288] Trial 110 finished with value: 0.09126879289872086 and parameters: {'model_type': 'mlp', 'hidden_dims': '[512, 128]', 'dropout': 0.11744256412503473, 'batch_norm': False, 'lr': 2.4569630694936687e-05, 'weight_decay': 1.0331080888018504e-05, 'epochs': 288, 'loss': 'mae', 'optimizer': 'adam', 'graph_mode': 'off', 'use_snp_selection': True, 'num_snps': 26398}. Best is trial 76 with value: 0.13137043957553401.
[I 2025-12-05 15:21:54,437] Trial 111 finished with value: 0.0753222351627238 and parameters: {'model_type': 'mlp', 'hidden_dims': '[128, 64]', 'dropout': 0.19729198264071007, 'batch_norm': False, 'lr': 2.957448173866997e-05, 'weight_decay': 8.00651765607334e-06, 'epochs': 315, 'loss': 'mae', 'optimizer': 'adam', 'graph_mode': 'off', 'use_snp_selection': False}. Best is trial 76 with value: 0.13137043957553401.
