[I 2025-12-05 15:01:28,723] Trial 141 finished with value: 0.05887864075858932 and parameters: {'model_type': 'mlp', 'hidden_dims': '[512, 128]', 'dropout': 0.5544711784509118, 'batch_norm': False, 'lr': 2.1792723714052422e-05, 'weight_decay': 0.0001612128089861548, 'epochs': 139, 'loss': 'mae', 'optimizer': 'adam', 'graph_mode': 'off', 'use_snp_selection': False}. Best is trial 3 with value: 0.08939730523412698.
[I 2025-12-05 15:01:29,928] Trial 142 finished with value: 0.06693343053883591 and parameters: {'model_type': 'mlp', 'hidden_dims': '[512, 128]', 'dropout': 0.5666907224656755, 'batch_norm': False, 'lr': 2.8758763355137037e-05, 'weight_decay': 0.00012467549640637546, 'epochs': 127, 'loss': 'mae', 'optimizer': 'adam', 'graph_mode': 'off', 'use_snp_selection': False}. Best is trial 3 with value: 0.08939730523412698.
[I 2025-12-05 15:01:31,112] Trial 143 finished with value: 0.03406019773177354 and parameters: {'model_type': 'mlp', 'hidden_dims': '[512, 128]', 'dropout': 0.5222506947089602, 'batch_norm': False, 'lr': 3.836143240237984e-05, 'weight_decay': 0.00012389507835100706, 'epochs': 120, 'loss': 'mae', 'optimizer': 'adam', 'graph_mode': 'off', 'use_snp_selection': False}. Best is trial 3 with value: 0.08939730523412698.
[I 2025-12-05 15:01:32,311] Trial 144 finished with value: 0.023794168681460663 and parameters: {'model_type': 'mlp', 'hidden_dims': '[512, 128]', 'dropout': 0.5694018211466666, 'batch_norm': False, 'lr': 6.660652498692982e-05, 'weight_decay': 0.00027878105928612524, 'epochs': 127, 'loss': 'mae', 'optimizer': 'adam', 'graph_mode': 'off', 'use_snp_selection': False}. Best is trial 3 with value: 0.08939730523412698.
[I 2025-12-05 15:01:33,654] Trial 145 finished with value: 0.049553143136939495 and parameters: {'model_type': 'mlp', 'hidden_dims': '[256, 128, 64]', 'dropout': 0.5889210990983651, 'batch_norm': False, 'lr': 2.919136993047641e-05, 'weight_decay': 0.00020699317169403148, 'epochs': 348, 'loss': 'mae', 'optimizer': 'adam', 'graph_mode': 'off', 'use_snp_selection': False}. Best is trial 3 with value: 0.08939730523412698.
[I 2025-12-05 15:01:35,514] Trial 146 finished with value: 0.06417579634660338 and parameters: {'model_type': 'mlp', 'hidden_dims': '[512, 64]', 'dropout': 0.5468922440189139, 'batch_norm': False, 'lr': 4.4739474296915775e-05, 'weight_decay': 0.00044901997002645564, 'epochs': 319, 'loss': 'mae', 'optimizer': 'adam', 'graph_mode': 'off', 'use_snp_selection': False}. Best is trial 3 with value: 0.08939730523412698.
[I 2025-12-05 15:01:36,727] Trial 147 finished with value: 0.03290170363463396 and parameters: {'model_type': 'mlp', 'hidden_dims': '[512, 64]', 'dropout': 0.5439915456896782, 'batch_norm': False, 'lr': 4.459675849650726e-05, 'weight_decay': 0.0004384058744658281, 'epochs': 131, 'loss': 'mae', 'optimizer': 'adam', 'graph_mode': 'off', 'use_snp_selection': False}. Best is trial 3 with value: 0.08939730523412698.
[I 2025-12-05 15:01:38,598] Trial 148 finished with value: 0.03832878325673674 and parameters: {'model_type': 'mlp', 'hidden_dims': '[512, 64]', 'dropout': 0.5310475710164456, 'batch_norm': False, 'lr': 5.420808559674729e-05, 'weight_decay': 0.0007394694890933786, 'epochs': 317, 'loss': 'mse', 'optimizer': 'adam', 'graph_mode': 'off', 'use_snp_selection': True, 'num_snps': 27235}. Best is trial 3 with value: 0.08939730523412698.
[I 2025-12-05 15:01:40,441] Trial 149 finished with value: 0.05023063394219826 and parameters: {'model_type': 'mlp', 'hidden_dims': '[512, 64]', 'dropout': 0.23142024449923512, 'batch_norm': True, 'lr': 5.894351971032415e-05, 'weight_decay': 0.0001088177399841061, 'epochs': 309, 'loss': 'mae', 'optimizer': 'adam', 'graph_mode': 'off', 'use_snp_selection': False}. Best is trial 3 with value: 0.08939730523412698.
[I 2025-12-05 15:01:42,671] Trial 0 finished with value: -0.019163366269731714 and parameters: {'model_type': 'mlp', 'hidden_dims': '[128, 64]', 'dropout': 0.199031432379812, 'batch_norm': True, 'lr': 1.8408544111075837e-06, 'weight_decay': 5.5136510071208614e-05, 'epochs': 336, 'loss': 'mae', 'optimizer': 'adam', 'graph_mode': 'off', 'use_snp_selection': True, 'num_snps': 43862}. Best is trial 0 with value: -0.019163366269731714.
[I 2025-12-05 15:01:43,795] Trial 1 finished with value: 0.07242251062322767 and parameters: {'model_type': 'mlp', 'hidden_dims': '[256, 128]', 'dropout': 0.4370668075331726, 'batch_norm': True, 'lr': 7.133471581159139e-05, 'weight_decay': 1.128633586803549e-05, 'epochs': 242, 'loss': 'mae', 'optimizer': 'adam', 'graph_mode': 'off', 'use_snp_selection': False}. Best is trial 1 with value: 0.07242251062322767.
[I 2025-12-05 15:01:44,811] Trial 2 finished with value: 0.03311517793785153 and parameters: {'model_type': 'mlp', 'hidden_dims': '[256, 128, 64]', 'dropout': 0.41314357415569625, 'batch_norm': False, 'lr': 3.952233718592101e-06, 'weight_decay': 0.00026754769258252603, 'epochs': 149, 'loss': 'mse', 'optimizer': 'adam', 'graph_mode': 'off', 'use_snp_selection': True, 'num_snps': 11571}. Best is trial 1 with value: 0.07242251062322767.
[I 2025-12-05 15:01:46,700] Trial 3 finished with value: 0.03570119606871507 and parameters: {'model_type': 'mlp', 'hidden_dims': '[512, 64]', 'dropout': 0.5938127374509361, 'batch_norm': False, 'lr': 5.67704586114731e-06, 'weight_decay': 2.4518087630137052e-05, 'epochs': 320, 'loss': 'mae', 'optimizer': 'adam', 'graph_mode': 'off', 'use_snp_selection': False}. Best is trial 1 with value: 0.07242251062322767.
[I 2025-12-05 15:01:48,963] Trial 4 finished with value: 0.022838666460831346 and parameters: {'model_type': 'mlp', 'hidden_dims': '[512, 128]', 'dropout': 0.25746343592134413, 'batch_norm': True, 'lr': 1.3467657668402788e-06, 'weight_decay': 0.00033087251918647806, 'epochs': 277, 'loss': 'mse', 'optimizer': 'adam', 'graph_mode': 'off', 'use_snp_selection': True, 'num_snps': 36675}. Best is trial 1 with value: 0.07242251062322767.
[I 2025-12-05 15:01:50,709] Trial 5 finished with value: 0.008380425670485728 and parameters: {'model_type': 'mlp', 'hidden_dims': '[512, 64]', 'dropout': 0.38275350994408375, 'batch_norm': True, 'lr': 1.5586664309232824e-06, 'weight_decay': 0.0008227664668621182, 'epochs': 145, 'loss': 'mae', 'optimizer': 'adam', 'graph_mode': 'off', 'use_snp_selection': True, 'num_snps': 32148}. Best is trial 1 with value: 0.07242251062322767.
[I 2025-12-05 15:01:51,746] Trial 6 finished with value: 0.023768324926357356 and parameters: {'model_type': 'mlp', 'hidden_dims': '[256, 128]', 'dropout': 0.3930109900265879, 'batch_norm': False, 'lr': 4.892964372128395e-05, 'weight_decay': 1.5809549317992182e-06, 'epochs': 199, 'loss': 'mse', 'optimizer': 'adam', 'graph_mode': 'off', 'use_snp_selection': False}. Best is trial 1 with value: 0.07242251062322767.
[I 2025-12-05 15:01:52,841] Trial 7 finished with value: 0.03312192782648837 and parameters: {'model_type': 'mlp', 'hidden_dims': '[512, 256]', 'dropout': 0.15343979219678458, 'batch_norm': True, 'lr': 6.234003099047341e-05, 'weight_decay': 3.894760610535477e-07, 'epochs': 97, 'loss': 'mse', 'optimizer': 'adam', 'graph_mode': 'off', 'use_snp_selection': False}. Best is trial 1 with value: 0.07242251062322767.
[I 2025-12-05 15:01:54,706] Trial 8 finished with value: 0.07763700930478508 and parameters: {'model_type': 'mlp', 'hidden_dims': '[512, 128]', 'dropout': 0.10743001231661406, 'batch_norm': True, 'lr': 0.00023728538449271062, 'weight_decay': 1.7629071578048637e-05, 'epochs': 312, 'loss': 'mae', 'optimizer': 'adam', 'graph_mode': 'off', 'use_snp_selection': False}. Best is trial 8 with value: 0.07763700930478508.
[I 2025-12-05 15:01:56,068] Trial 9 finished with value: 0.07481354665614998 and parameters: {'model_type': 'mlp', 'hidden_dims': '[512, 64]', 'dropout': 0.14505336736221927, 'batch_norm': True, 'lr': 5.8619638388111826e-05, 'weight_decay': 6.200156172669308e-07, 'epochs': 175, 'loss': 'mse', 'optimizer': 'adam', 'graph_mode': 'off', 'use_snp_selection': False}. Best is trial 8 with value: 0.07763700930478508.
[I 2025-12-05 15:01:57,051] Trial 10 finished with value: -0.007787606601430127 and parameters: {'model_type': 'mlp', 'hidden_dims': '[512, 128]', 'dropout': 0.2800030442581858, 'batch_norm': False, 'lr': 0.0004919806695968258, 'weight_decay': 2.9953888095455486e-06, 'epochs': 55, 'loss': 'mae', 'optimizer': 'adam', 'graph_mode': 'off', 'use_snp_selection': False}. Best is trial 8 with value: 0.07763700930478508.
[I 2025-12-05 15:01:58,571] Trial 11 finished with value: 0.051418377788785045 and parameters: {'model_type': 'mlp', 'hidden_dims': '[512, 128]', 'dropout': 0.10095648685224448, 'batch_norm': True, 'lr': 0.0003411435764085616, 'weight_decay': 1.2045055692919657e-07, 'epochs': 216, 'loss': 'mse', 'optimizer': 'adam', 'graph_mode': 'off', 'use_snp_selection': False}. Best is trial 8 with value: 0.07763700930478508.
[I 2025-12-05 15:02:00,318] Trial 12 finished with value: 0.07999888725645898 and parameters: {'model_type': 'mlp', 'hidden_dims': '[512, 64]', 'dropout': 0.10344600881777158, 'batch_norm': True, 'lr': 0.00018400807026440393, 'weight_decay': 2.071258764988014e-06, 'epochs': 281, 'loss': 'mae', 'optimizer': 'adam', 'graph_mode': 'off', 'use_snp_selection': False}. Best is trial 12 with value: 0.07999888725645898.
[I 2025-12-05 15:02:01,300] Trial 13 finished with value: 0.056476357233588424 and parameters: {'model_type': 'mlp', 'hidden_dims': '[128, 64]', 'dropout': 0.24294613148916022, 'batch_norm': True, 'lr': 0.00020209017454184854, 'weight_decay': 4.439089487662099e-06, 'epochs': 285, 'loss': 'mae', 'optimizer': 'adam', 'graph_mode': 'off', 'use_snp_selection': False}. Best is trial 12 with value: 0.07999888725645898.
[I 2025-12-05 15:02:02,521] Trial 14 finished with value: 0.05768678354736355 and parameters: {'model_type': 'mlp', 'hidden_dims': '[256, 128, 64]', 'dropout': 0.3221595656802847, 'batch_norm': True, 'lr': 0.0008417026281429627, 'weight_decay': 5.724103314313124e-05, 'epochs': 282, 'loss': 'mae', 'optimizer': 'adam', 'graph_mode': 'off', 'use_snp_selection': False}. Best is trial 12 with value: 0.07999888725645898.
[I 2025-12-05 15:02:04,187] Trial 15 finished with value: 0.07804233542924328 and parameters: {'model_type': 'mlp', 'hidden_dims': '[512, 256]', 'dropout': 0.10515697852451877, 'batch_norm': True, 'lr': 0.0001572871022003765, 'weight_decay': 1.2913386141637801e-05, 'epochs': 254, 'loss': 'mae', 'optimizer': 'adam', 'graph_mode': 'off', 'use_snp_selection': False}. Best is trial 12 with value: 0.07999888725645898.
[I 2025-12-05 15:02:05,799] Trial 16 finished with value: 0.028574671317624152 and parameters: {'model_type': 'mlp', 'hidden_dims': '[512, 256]', 'dropout': 0.18972624182538195, 'batch_norm': True, 'lr': 2.1517090787442848e-05, 'weight_decay': 1.291781474749766e-06, 'epochs': 240, 'loss': 'mae', 'optimizer': 'adam', 'graph_mode': 'off', 'use_snp_selection': False}. Best is trial 12 with value: 0.07999888725645898.
[I 2025-12-05 15:02:07,471] Trial 17 finished with value: 0.08117213985597922 and parameters: {'model_type': 'mlp', 'hidden_dims': '[512, 256]', 'dropout': 0.5019861492125737, 'batch_norm': True, 'lr': 0.00014908853371523303, 'weight_decay': 5.643450860599343e-06, 'epochs': 252, 'loss': 'mae', 'optimizer': 'adam', 'graph_mode': 'off', 'use_snp_selection': False}. Best is trial 17 with value: 0.08117213985597922.
[I 2025-12-05 15:02:10,891] Trial 18 finished with value: -0.003264591162582297 and parameters: {'model_type': 'mlp', 'hidden_dims': '[512, 256]', 'dropout': 0.4966812893570765, 'batch_norm': False, 'lr': 1.3819381973050777e-05, 'weight_decay': 4.109412643182284e-06, 'epochs': 343, 'loss': 'mae', 'optimizer': 'adam', 'graph_mode': 'off', 'use_snp_selection': True, 'num_snps': 58241}. Best is trial 17 with value: 0.08117213985597922.
[I 2025-12-05 15:02:12,447] Trial 19 finished with value: 0.05145695088847113 and parameters: {'model_type': 'mlp', 'hidden_dims': '[512, 64]', 'dropout': 0.5463690211280188, 'batch_norm': True, 'lr': 0.00011777558698136922, 'weight_decay': 2.0795392602494044e-07, 'epochs': 220, 'loss': 'mae', 'optimizer': 'adam', 'graph_mode': 'off', 'use_snp_selection': False}. Best is trial 17 with value: 0.08117213985597922.
[I 2025-12-05 15:02:14,246] Trial 20 finished with value: 0.07571668814096005 and parameters: {'model_type': 'mlp', 'hidden_dims': '[512, 64]', 'dropout': 0.47146663126798083, 'batch_norm': True, 'lr': 0.0006552719114981011, 'weight_decay': 8.788053050119242e-07, 'epochs': 298, 'loss': 'mae', 'optimizer': 'adam', 'graph_mode': 'off', 'use_snp_selection': False}. Best is trial 17 with value: 0.08117213985597922.
[I 2025-12-05 15:02:15,900] Trial 21 finished with value: 0.06968704629863791 and parameters: {'model_type': 'mlp', 'hidden_dims': '[512, 256]', 'dropout': 0.3426036956588672, 'batch_norm': True, 'lr': 0.00012838860602286875, 'weight_decay': 6.896050881708145e-06, 'epochs': 256, 'loss': 'mae', 'optimizer': 'adam', 'graph_mode': 'off', 'use_snp_selection': False}. Best is trial 17 with value: 0.08117213985597922.
[I 2025-12-05 15:02:17,602] Trial 22 finished with value: 0.08024949416222185 and parameters: {'model_type': 'mlp', 'hidden_dims': '[512, 256]', 'dropout': 0.1869298847366285, 'batch_norm': True, 'lr': 0.00013553895795848813, 'weight_decay': 4.122385958951317e-05, 'epochs': 269, 'loss': 'mae', 'optimizer': 'adam', 'graph_mode': 'off', 'use_snp_selection': False}. Best is trial 17 with value: 0.08117213985597922.
[I 2025-12-05 15:02:19,272] Trial 23 finished with value: 0.04846810495211919 and parameters: {'model_type': 'mlp', 'hidden_dims': '[512, 256]', 'dropout': 0.20178315288945675, 'batch_norm': True, 'lr': 3.219305566062863e-05, 'weight_decay': 4.8301163797542794e-05, 'epochs': 258, 'loss': 'mae', 'optimizer': 'adam', 'graph_mode': 'off', 'use_snp_selection': False}. Best is trial 17 with value: 0.08117213985597922.
[I 2025-12-05 15:02:20,825] Trial 24 finished with value: 0.06537199778733577 and parameters: {'model_type': 'mlp', 'hidden_dims': '[512, 256]', 'dropout': 0.15605201618261322, 'batch_norm': True, 'lr': 0.00043042916393976267, 'weight_decay': 2.5242581772410553e-06, 'epochs': 227, 'loss': 'mae', 'optimizer': 'adam', 'graph_mode': 'off', 'use_snp_selection': False}. Best is trial 17 with value: 0.08117213985597922.
[I 2025-12-05 15:02:22,667] Trial 25 finished with value: 0.060764836530759626 and parameters: {'model_type': 'mlp', 'hidden_dims': '[512, 256]', 'dropout': 0.3068216995365007, 'batch_norm': True, 'lr': 0.00010395129602108585, 'weight_decay': 3.010993237745408e-05, 'epochs': 309, 'loss': 'mae', 'optimizer': 'adam', 'graph_mode': 'off', 'use_snp_selection': False}. Best is trial 17 with value: 0.08117213985597922.
[I 2025-12-05 15:02:23,540] Trial 26 finished with value: 0.045046485645103156 and parameters: {'model_type': 'mlp', 'hidden_dims': '[256, 128]', 'dropout': 0.5337359261270802, 'batch_norm': True, 'lr': 0.00026429326471899404, 'weight_decay': 0.00013242121339662318, 'epochs': 195, 'loss': 'mae', 'optimizer': 'adam', 'graph_mode': 'off', 'use_snp_selection': True, 'num_snps': 3842}. Best is trial 17 with value: 0.08117213985597922.
[I 2025-12-05 15:02:24,414] Trial 27 finished with value: 0.035248950607519015 and parameters: {'model_type': 'mlp', 'hidden_dims': '[128, 64]', 'dropout': 0.2323982055238744, 'batch_norm': False, 'lr': 3.123756326597067e-05, 'weight_decay': 8.000668165172962e-06, 'epochs': 273, 'loss': 'mae', 'optimizer': 'adam', 'graph_mode': 'off', 'use_snp_selection': False}. Best is trial 17 with value: 0.08117213985597922.
[I 2025-12-05 15:02:25,435] Trial 28 finished with value: 0.05193467486505444 and parameters: {'model_type': 'mlp', 'hidden_dims': '[256, 128, 64]', 'dropout': 0.5998615648250125, 'batch_norm': True, 'lr': 0.0009900957955119728, 'weight_decay': 0.00011804624858073122, 'epochs': 175, 'loss': 'mae', 'optimizer': 'adam', 'graph_mode': 'off', 'use_snp_selection': False}. Best is trial 17 with value: 0.08117213985597922.
[I 2025-12-05 15:02:26,921] Trial 29 finished with value: 0.05692839492732203 and parameters: {'model_type': 'mlp', 'hidden_dims': '[128, 64]', 'dropout': 0.19721082284940797, 'batch_norm': True, 'lr': 8.834822579330174e-05, 'weight_decay': 4.729621949564363e-05, 'epochs': 329, 'loss': 'mae', 'optimizer': 'adam', 'graph_mode': 'off', 'use_snp_selection': True, 'num_snps': 19468}. Best is trial 17 with value: 0.08117213985597922.
[I 2025-12-05 15:02:28,716] Trial 30 finished with value: 0.04111330645295901 and parameters: {'model_type': 'mlp', 'hidden_dims': '[512, 64]', 'dropout': 0.13361442106668825, 'batch_norm': True, 'lr': 1.3737984570799112e-05, 'weight_decay': 1.6086554048019735e-06, 'epochs': 288, 'loss': 'mae', 'optimizer': 'adam', 'graph_mode': 'off', 'use_snp_selection': False}. Best is trial 17 with value: 0.08117213985597922.
[I 2025-12-05 15:02:30,393] Trial 31 finished with value: 0.09732593083060198 and parameters: {'model_type': 'mlp', 'hidden_dims': '[512, 256]', 'dropout': 0.10128508942021473, 'batch_norm': True, 'lr': 0.00017255606405936098, 'weight_decay': 1.5570181689695158e-05, 'epochs': 261, 'loss': 'mae', 'optimizer': 'adam', 'graph_mode': 'off', 'use_snp_selection': False}. Best is trial 31 with value: 0.09732593083060198.
[I 2025-12-05 15:02:31,997] Trial 32 finished with value: 0.05710725728811261 and parameters: {'model_type': 'mlp', 'hidden_dims': '[512, 256]', 'dropout': 0.18122747172254428, 'batch_norm': True, 'lr': 0.00017458345929771118, 'weight_decay': 9.406549830763307e-06, 'epochs': 237, 'loss': 'mae', 'optimizer': 'adam', 'graph_mode': 'off', 'use_snp_selection': False}. Best is trial 31 with value: 0.09732593083060198.
[I 2025-12-05 15:02:33,696] Trial 33 finished with value: 0.06843024184018175 and parameters: {'model_type': 'mlp', 'hidden_dims': '[512, 256]', 'dropout': 0.12594184966483057, 'batch_norm': True, 'lr': 0.00023352232642441712, 'weight_decay': 5.177188679409244e-06, 'epochs': 268, 'loss': 'mae', 'optimizer': 'adam', 'graph_mode': 'off', 'use_snp_selection': False}. Best is trial 31 with value: 0.09732593083060198.
[I 2025-12-05 15:02:35,508] Trial 34 finished with value: 0.06874389603269021 and parameters: {'model_type': 'mlp', 'hidden_dims': '[512, 256]', 'dropout': 0.4518011894579461, 'batch_norm': True, 'lr': 0.0004134799679716175, 'weight_decay': 1.881700887286583e-05, 'epochs': 300, 'loss': 'mae', 'optimizer': 'adam', 'graph_mode': 'off', 'use_snp_selection': False}. Best is trial 31 with value: 0.09732593083060198.
[I 2025-12-05 15:02:36,610] Trial 35 finished with value: 0.06932461461708292 and parameters: {'model_type': 'mlp', 'hidden_dims': '[256, 128]', 'dropout': 0.17311857837616063, 'batch_norm': False, 'lr': 8.490245030124427e-05, 'weight_decay': 8.925462526947416e-05, 'epochs': 251, 'loss': 'mae', 'optimizer': 'adam', 'graph_mode': 'off', 'use_snp_selection': False}. Best is trial 31 with value: 0.09732593083060198.
[I 2025-12-05 15:02:40,002] Trial 36 finished with value: 0.03490733250096027 and parameters: {'model_type': 'mlp', 'hidden_dims': '[512, 256]', 'dropout': 0.28311777564200846, 'batch_norm': True, 'lr': 4.693006861100837e-05, 'weight_decay': 3.653969706445809e-05, 'epochs': 326, 'loss': 'mse', 'optimizer': 'adam', 'graph_mode': 'off', 'use_snp_selection': True, 'num_snps': 58661}. Best is trial 31 with value: 0.09732593083060198.
[I 2025-12-05 15:02:41,494] Trial 37 finished with value: 0.03461117143611506 and parameters: {'model_type': 'mlp', 'hidden_dims': '[512, 64]', 'dropout': 0.3710132091373177, 'batch_norm': True, 'lr': 4.446294938689996e-06, 'weight_decay': 0.00027176669497101704, 'epochs': 209, 'loss': 'mae', 'optimizer': 'adam', 'graph_mode': 'off', 'use_snp_selection': False}. Best is trial 31 with value: 0.09732593083060198.
[I 2025-12-05 15:02:42,844] Trial 38 finished with value: 0.026016013872321317 and parameters: {'model_type': 'mlp', 'hidden_dims': '[256, 128, 64]', 'dropout': 0.22416846482486558, 'batch_norm': False, 'lr': 0.0006254919380551999, 'weight_decay': 1.4718740952094895e-05, 'epochs': 234, 'loss': 'mse', 'optimizer': 'adam', 'graph_mode': 'off', 'use_snp_selection': True, 'num_snps': 19911}. Best is trial 31 with value: 0.09732593083060198.
[I 2025-12-05 15:02:44,262] Trial 39 finished with value: 0.06796833062718013 and parameters: {'model_type': 'mlp', 'hidden_dims': '[512, 256]', 'dropout': 0.4246116819735687, 'batch_norm': True, 'lr': 0.0003067789628424656, 'weight_decay': 0.000494866061743946, 'epochs': 177, 'loss': 'mae', 'optimizer': 'adam', 'graph_mode': 'off', 'use_snp_selection': False}. Best is trial 31 with value: 0.09732593083060198.
[I 2025-12-05 15:02:46,248] Trial 40 finished with value: 0.07306558532083685 and parameters: {'model_type': 'mlp', 'hidden_dims': '[512, 64]', 'dropout': 0.13474275963271784, 'batch_norm': True, 'lr': 0.00015917174763067641, 'weight_decay': 2.785379801368871e-06, 'epochs': 350, 'loss': 'mae', 'optimizer': 'adam', 'graph_mode': 'off', 'use_snp_selection': False}. Best is trial 31 with value: 0.09732593083060198.
[I 2025-12-05 15:02:47,930] Trial 41 finished with value: 0.07087209806753145 and parameters: {'model_type': 'mlp', 'hidden_dims': '[512, 256]', 'dropout': 0.10302945515820162, 'batch_norm': True, 'lr': 0.00014937260336239026, 'weight_decay': 1.1092937818150653e-05, 'epochs': 263, 'loss': 'mae', 'optimizer': 'adam', 'graph_mode': 'off', 'use_snp_selection': False}. Best is trial 31 with value: 0.09732593083060198.
[I 2025-12-05 15:02:49,569] Trial 42 finished with value: 0.06040343227790902 and parameters: {'model_type': 'mlp', 'hidden_dims': '[512, 256]', 'dropout': 0.16325716403547877, 'batch_norm': True, 'lr': 7.136489188506776e-05, 'weight_decay': 1.8795876912934423e-05, 'epochs': 251, 'loss': 'mae', 'optimizer': 'adam', 'graph_mode': 'off', 'use_snp_selection': False}. Best is trial 31 with value: 0.09732593083060198.
