[I 2025-12-05 16:11:57,656] Trial 111 finished with value: 0.07058065578903154 and parameters: {'model_type': 'mlp', 'hidden_dims': '[256, 128, 64]', 'dropout': 0.420095952237269, 'batch_norm': True, 'lr': 0.000494532835560564, 'weight_decay': 4.742922406395541e-05, 'epochs': 179, 'loss': 'mae', 'optimizer': 'adam', 'graph_mode': 'off', 'use_snp_selection': False}. Best is trial 65 with value: 0.10536764442322526.
[I 2025-12-05 16:11:58,807] Trial 112 finished with value: 0.07112906886884886 and parameters: {'model_type': 'mlp', 'hidden_dims': '[256, 128, 64]', 'dropout': 0.4397120545891361, 'batch_norm': True, 'lr': 0.0007371027341609434, 'weight_decay': 2.927316334560476e-05, 'epochs': 168, 'loss': 'mae', 'optimizer': 'adam', 'graph_mode': 'off', 'use_snp_selection': False}. Best is trial 65 with value: 0.10536764442322526.
[I 2025-12-05 16:12:00,049] Trial 113 finished with value: 0.09258236638586438 and parameters: {'model_type': 'mlp', 'hidden_dims': '[256, 128, 64]', 'dropout': 0.37912028365236344, 'batch_norm': True, 'lr': 0.00041582910184835353, 'weight_decay': 2.314215470172289e-05, 'epochs': 205, 'loss': 'mae', 'optimizer': 'adam', 'graph_mode': 'off', 'use_snp_selection': False}. Best is trial 65 with value: 0.10536764442322526.
[I 2025-12-05 16:12:00,960] Trial 114 finished with value: 0.07096873000960821 and parameters: {'model_type': 'mlp', 'hidden_dims': '[256, 128, 64]', 'dropout': 0.4092030110692394, 'batch_norm': True, 'lr': 0.0003996747318690565, 'weight_decay': 1.0109390543369208e-05, 'epochs': 97, 'loss': 'mae', 'optimizer': 'adam', 'graph_mode': 'off', 'use_snp_selection': False}. Best is trial 65 with value: 0.10536764442322526.
[I 2025-12-05 16:12:02,472] Trial 115 finished with value: 0.08395819623960209 and parameters: {'model_type': 'mlp', 'hidden_dims': '[256, 128]', 'dropout': 0.4471489413957864, 'batch_norm': True, 'lr': 0.00024870016269172926, 'weight_decay': 5.564067813107728e-05, 'epochs': 294, 'loss': 'mae', 'optimizer': 'adam', 'graph_mode': 'off', 'use_snp_selection': False}. Best is trial 65 with value: 0.10536764442322526.
[I 2025-12-05 16:12:04,876] Trial 116 finished with value: 0.08273585966403905 and parameters: {'model_type': 'mlp', 'hidden_dims': '[512, 256]', 'dropout': 0.37847113936143617, 'batch_norm': True, 'lr': 0.0005901362923865114, 'weight_decay': 6.778250277436555e-06, 'epochs': 279, 'loss': 'mae', 'optimizer': 'adam', 'graph_mode': 'off', 'use_snp_selection': False}. Best is trial 65 with value: 0.10536764442322526.
[I 2025-12-05 16:12:05,731] Trial 117 finished with value: 0.06554342810572106 and parameters: {'model_type': 'mlp', 'hidden_dims': '[256, 128, 64]', 'dropout': 0.42753491762823975, 'batch_norm': False, 'lr': 0.0003032847004962872, 'weight_decay': 2.1964211290829524e-05, 'epochs': 78, 'loss': 'mae', 'optimizer': 'adam', 'graph_mode': 'off', 'use_snp_selection': False}. Best is trial 65 with value: 0.10536764442322526.
[I 2025-12-05 16:12:07,242] Trial 118 finished with value: 0.049366125160125805 and parameters: {'model_type': 'mlp', 'hidden_dims': '[512, 64]', 'dropout': 0.5566055220998498, 'batch_norm': True, 'lr': 0.0003628115324318571, 'weight_decay': 1.5010757728602238e-05, 'epochs': 129, 'loss': 'mse', 'optimizer': 'adam', 'graph_mode': 'off', 'use_snp_selection': False}. Best is trial 65 with value: 0.10536764442322526.
[I 2025-12-05 16:12:08,467] Trial 119 finished with value: 0.06453416188297233 and parameters: {'model_type': 'mlp', 'hidden_dims': '[256, 128, 64]', 'dropout': 0.47439235649947226, 'batch_norm': False, 'lr': 0.00022989818598798107, 'weight_decay': 3.575590002126418e-05, 'epochs': 212, 'loss': 'mae', 'optimizer': 'adam', 'graph_mode': 'off', 'use_snp_selection': False}. Best is trial 65 with value: 0.10536764442322526.
[I 2025-12-05 16:12:10,096] Trial 120 finished with value: 0.06949633805415738 and parameters: {'model_type': 'mlp', 'hidden_dims': '[512, 128]', 'dropout': 0.35246943427591226, 'batch_norm': True, 'lr': 0.0001698790296283395, 'weight_decay': 0.0008821067854535121, 'epochs': 146, 'loss': 'mae', 'optimizer': 'adam', 'graph_mode': 'off', 'use_snp_selection': False}. Best is trial 65 with value: 0.10536764442322526.
[I 2025-12-05 16:12:11,181] Trial 121 finished with value: 0.06413599011728281 and parameters: {'model_type': 'mlp', 'hidden_dims': '[256, 128, 64]', 'dropout': 0.41658014201359617, 'batch_norm': True, 'lr': 0.0005585053100392361, 'weight_decay': 2.5674750547683423e-05, 'epochs': 155, 'loss': 'mae', 'optimizer': 'adam', 'graph_mode': 'off', 'use_snp_selection': False}. Best is trial 65 with value: 0.10536764442322526.
[I 2025-12-05 16:12:12,339] Trial 122 finished with value: 0.08299871607621968 and parameters: {'model_type': 'mlp', 'hidden_dims': '[256, 128, 64]', 'dropout': 0.3846009288201141, 'batch_norm': True, 'lr': 0.00043992387472958157, 'weight_decay': 6.058589394536745e-05, 'epochs': 181, 'loss': 'mae', 'optimizer': 'adam', 'graph_mode': 'off', 'use_snp_selection': False}. Best is trial 65 with value: 0.10536764442322526.
[I 2025-12-05 16:12:13,563] Trial 123 finished with value: 0.09146829130810226 and parameters: {'model_type': 'mlp', 'hidden_dims': '[256, 128, 64]', 'dropout': 0.40076210156666053, 'batch_norm': True, 'lr': 0.0004927904671672657, 'weight_decay': 4.192303381455931e-05, 'epochs': 191, 'loss': 'mae', 'optimizer': 'adam', 'graph_mode': 'off', 'use_snp_selection': False}. Best is trial 65 with value: 0.10536764442322526.
[I 2025-12-05 16:12:14,756] Trial 124 finished with value: 0.08168975472541382 and parameters: {'model_type': 'mlp', 'hidden_dims': '[256, 128, 64]', 'dropout': 0.39904060865119506, 'batch_norm': True, 'lr': 0.0006828611707457593, 'weight_decay': 7.267846137530347e-05, 'epochs': 191, 'loss': 'mae', 'optimizer': 'adam', 'graph_mode': 'off', 'use_snp_selection': False}. Best is trial 65 with value: 0.10536764442322526.
[I 2025-12-05 16:12:16,146] Trial 125 finished with value: 0.06905925970737622 and parameters: {'model_type': 'mlp', 'hidden_dims': '[256, 128, 64]', 'dropout': 0.43038316302957697, 'batch_norm': True, 'lr': 0.0008296771297968487, 'weight_decay': 1.880062949766036e-05, 'epochs': 248, 'loss': 'mae', 'optimizer': 'adam', 'graph_mode': 'off', 'use_snp_selection': False}. Best is trial 65 with value: 0.10536764442322526.
[I 2025-12-05 16:12:17,127] Trial 126 finished with value: 0.08416372973112134 and parameters: {'model_type': 'mlp', 'hidden_dims': '[128, 64]', 'dropout': 0.3680883446606336, 'batch_norm': True, 'lr': 0.00033101969084919317, 'weight_decay': 0.00012713028978357762, 'epochs': 262, 'loss': 'mae', 'optimizer': 'adam', 'graph_mode': 'off', 'use_snp_selection': False}. Best is trial 65 with value: 0.10536764442322526.
[I 2025-12-05 16:12:18,710] Trial 127 finished with value: 0.07371728374260411 and parameters: {'model_type': 'mlp', 'hidden_dims': '[512, 256]', 'dropout': 0.4604684976222055, 'batch_norm': True, 'lr': 0.0002812556460642274, 'weight_decay': 3.884523225815563e-05, 'epochs': 142, 'loss': 'mse', 'optimizer': 'adam', 'graph_mode': 'off', 'use_snp_selection': False}. Best is trial 65 with value: 0.10536764442322526.
[I 2025-12-05 16:12:19,933] Trial 128 finished with value: 0.07468717142510284 and parameters: {'model_type': 'mlp', 'hidden_dims': '[256, 128, 64]', 'dropout': 0.3902400244742325, 'batch_norm': False, 'lr': 0.0004008181747282702, 'weight_decay': 4.7926157610910795e-05, 'epochs': 151, 'loss': 'mae', 'optimizer': 'adam', 'graph_mode': 'off', 'use_snp_selection': True, 'num_snps': 12722}. Best is trial 65 with value: 0.10536764442322526.
[I 2025-12-05 16:12:21,563] Trial 129 finished with value: 0.080038136791724 and parameters: {'model_type': 'mlp', 'hidden_dims': '[256, 128, 64]', 'dropout': 0.5173417555369735, 'batch_norm': True, 'lr': 0.000502922899781253, 'weight_decay': 0.00010912911974794613, 'epochs': 337, 'loss': 'mse', 'optimizer': 'adam', 'graph_mode': 'off', 'use_snp_selection': False}. Best is trial 65 with value: 0.10536764442322526.
[I 2025-12-05 16:12:23,297] Trial 130 finished with value: 0.09749313444968694 and parameters: {'model_type': 'mlp', 'hidden_dims': '[512, 64]', 'dropout': 0.40497702005140157, 'batch_norm': False, 'lr': 0.00020383604624097876, 'weight_decay': 0.0007422781072116361, 'epochs': 165, 'loss': 'mae', 'optimizer': 'adam', 'graph_mode': 'off', 'use_snp_selection': False}. Best is trial 65 with value: 0.10536764442322526.
[I 2025-12-05 16:12:24,995] Trial 131 finished with value: 0.07011433309617311 and parameters: {'model_type': 'mlp', 'hidden_dims': '[512, 64]', 'dropout': 0.1291898733556344, 'batch_norm': False, 'lr': 0.00018894228028840877, 'weight_decay': 0.0007221354466873669, 'epochs': 163, 'loss': 'mae', 'optimizer': 'adam', 'graph_mode': 'off', 'use_snp_selection': False}. Best is trial 65 with value: 0.10536764442322526.
[I 2025-12-05 16:12:27,096] Trial 132 finished with value: 0.0700819388306425 and parameters: {'model_type': 'mlp', 'hidden_dims': '[512, 64]', 'dropout': 0.4061012939536436, 'batch_norm': False, 'lr': 0.00014679213137456875, 'weight_decay': 0.0004593507060446723, 'epochs': 225, 'loss': 'mae', 'optimizer': 'adam', 'graph_mode': 'off', 'use_snp_selection': False}. Best is trial 65 with value: 0.10536764442322526.
[I 2025-12-05 16:12:29,692] Trial 133 finished with value: 0.058434553876431004 and parameters: {'model_type': 'mlp', 'hidden_dims': '[512, 64]', 'dropout': 0.4176511735330065, 'batch_norm': False, 'lr': 0.0002112024831064033, 'weight_decay': 0.0005794095052083671, 'epochs': 317, 'loss': 'mae', 'optimizer': 'adam', 'graph_mode': 'off', 'use_snp_selection': False}. Best is trial 65 with value: 0.10536764442322526.
[I 2025-12-05 16:12:31,608] Trial 134 finished with value: 0.0326590950769957 and parameters: {'model_type': 'mlp', 'hidden_dims': '[512, 64]', 'dropout': 0.4351297057518959, 'batch_norm': False, 'lr': 0.0006021058582703697, 'weight_decay': 0.0008387434228362343, 'epochs': 201, 'loss': 'mae', 'optimizer': 'adam', 'graph_mode': 'off', 'use_snp_selection': False}. Best is trial 65 with value: 0.10536764442322526.
[I 2025-12-05 16:12:33,159] Trial 135 finished with value: 0.06412061244757271 and parameters: {'model_type': 'mlp', 'hidden_dims': '[512, 256]', 'dropout': 0.37718571346048324, 'batch_norm': False, 'lr': 0.00010531976837872279, 'weight_decay': 0.0009964420645250857, 'epochs': 136, 'loss': 'mae', 'optimizer': 'adam', 'graph_mode': 'off', 'use_snp_selection': False}. Best is trial 65 with value: 0.10536764442322526.
[I 2025-12-05 16:12:34,294] Trial 136 finished with value: 0.06158309220369856 and parameters: {'model_type': 'mlp', 'hidden_dims': '[256, 128, 64]', 'dropout': 0.4492213331802935, 'batch_norm': False, 'lr': 0.000450417254717149, 'weight_decay': 0.00032487240998858516, 'epochs': 169, 'loss': 'mse', 'optimizer': 'adam', 'graph_mode': 'off', 'use_snp_selection': False}. Best is trial 65 with value: 0.10536764442322526.
[I 2025-12-05 16:12:36,312] Trial 137 finished with value: 0.01594182890171653 and parameters: {'model_type': 'mlp', 'hidden_dims': '[512, 128]', 'dropout': 0.4022576232176832, 'batch_norm': True, 'lr': 2.2975734365990353e-06, 'weight_decay': 3.008994890054099e-05, 'epochs': 215, 'loss': 'mae', 'optimizer': 'adam', 'graph_mode': 'off', 'use_snp_selection': False}. Best is trial 65 with value: 0.10536764442322526.
[I 2025-12-05 16:12:37,891] Trial 138 finished with value: 0.07920376721215357 and parameters: {'model_type': 'mlp', 'hidden_dims': '[512, 64]', 'dropout': 0.4233036200962289, 'batch_norm': True, 'lr': 0.0007419928455506335, 'weight_decay': 0.00039572025320923235, 'epochs': 142, 'loss': 'mae', 'optimizer': 'adam', 'graph_mode': 'off', 'use_snp_selection': False}. Best is trial 65 with value: 0.10536764442322526.
[I 2025-12-05 16:12:38,705] Trial 139 finished with value: 0.038082601003631165 and parameters: {'model_type': 'mlp', 'hidden_dims': '[128, 64]', 'dropout': 0.3912616911836502, 'batch_norm': False, 'lr': 0.0002706940751361397, 'weight_decay': 6.831646480256963e-05, 'epochs': 161, 'loss': 'mse', 'optimizer': 'adam', 'graph_mode': 'off', 'use_snp_selection': False}. Best is trial 65 with value: 0.10536764442322526.
[I 2025-12-05 16:12:39,696] Trial 140 finished with value: 0.06115488210004797 and parameters: {'model_type': 'mlp', 'hidden_dims': '[256, 128, 64]', 'dropout': 0.4107136234589377, 'batch_norm': True, 'lr': 0.00011470676019050657, 'weight_decay': 0.0006681359272232386, 'epochs': 120, 'loss': 'mae', 'optimizer': 'adam', 'graph_mode': 'off', 'use_snp_selection': False}. Best is trial 65 with value: 0.10536764442322526.
[I 2025-12-05 16:12:40,841] Trial 141 finished with value: 0.08524825980918226 and parameters: {'model_type': 'mlp', 'hidden_dims': '[256, 128, 64]', 'dropout': 0.44041636273688056, 'batch_norm': True, 'lr': 0.0005074326128239534, 'weight_decay': 1.2051608283672791e-05, 'epochs': 175, 'loss': 'mae', 'optimizer': 'adam', 'graph_mode': 'off', 'use_snp_selection': False}. Best is trial 65 with value: 0.10536764442322526.
[I 2025-12-05 16:12:41,923] Trial 142 finished with value: 0.10171874466564183 and parameters: {'model_type': 'mlp', 'hidden_dims': '[256, 128, 64]', 'dropout': 0.4287227736104077, 'batch_norm': True, 'lr': 0.0006059730254962801, 'weight_decay': 2.4360448672246576e-05, 'epochs': 154, 'loss': 'mae', 'optimizer': 'adam', 'graph_mode': 'off', 'use_snp_selection': False}. Best is trial 65 with value: 0.10536764442322526.
[I 2025-12-05 16:12:43,011] Trial 143 finished with value: 0.06635155473078454 and parameters: {'model_type': 'mlp', 'hidden_dims': '[256, 128, 64]', 'dropout': 0.42854068002171974, 'batch_norm': True, 'lr': 0.0006064886829170532, 'weight_decay': 2.276220607773203e-05, 'epochs': 157, 'loss': 'mae', 'optimizer': 'adam', 'graph_mode': 'off', 'use_snp_selection': False}. Best is trial 65 with value: 0.10536764442322526.
[I 2025-12-05 16:12:44,114] Trial 144 finished with value: 0.07417919489218672 and parameters: {'model_type': 'mlp', 'hidden_dims': '[256, 128, 64]', 'dropout': 0.4537607002774227, 'batch_norm': True, 'lr': 0.000833447638204754, 'weight_decay': 4.367185734137274e-05, 'epochs': 151, 'loss': 'mae', 'optimizer': 'adam', 'graph_mode': 'off', 'use_snp_selection': False}. Best is trial 65 with value: 0.10536764442322526.
[I 2025-12-05 16:12:45,232] Trial 145 finished with value: 0.0815988925014542 and parameters: {'model_type': 'mlp', 'hidden_dims': '[256, 128, 64]', 'dropout': 0.41427171429558973, 'batch_norm': True, 'lr': 0.0003732069659993091, 'weight_decay': 1.8469058366488657e-05, 'epochs': 165, 'loss': 'mae', 'optimizer': 'adam', 'graph_mode': 'off', 'use_snp_selection': False}. Best is trial 65 with value: 0.10536764442322526.
[I 2025-12-05 16:12:46,255] Trial 146 finished with value: 0.025337245251077313 and parameters: {'model_type': 'mlp', 'hidden_dims': '[256, 128]', 'dropout': 0.4441054542245485, 'batch_norm': False, 'lr': 0.000701707360186309, 'weight_decay': 0.00025337839408719426, 'epochs': 132, 'loss': 'mse', 'optimizer': 'adam', 'graph_mode': 'off', 'use_snp_selection': False}. Best is trial 65 with value: 0.10536764442322526.
[I 2025-12-05 16:12:47,063] Trial 147 finished with value: 0.08251814385532198 and parameters: {'model_type': 'mlp', 'hidden_dims': '[256, 128, 64]', 'dropout': 0.33854945354563337, 'batch_norm': True, 'lr': 0.0002144823612922471, 'weight_decay': 3.30943121969557e-05, 'epochs': 61, 'loss': 'mae', 'optimizer': 'adam', 'graph_mode': 'off', 'use_snp_selection': False}. Best is trial 65 with value: 0.10536764442322526.
[I 2025-12-05 16:12:49,875] Trial 148 finished with value: 0.077951433535202 and parameters: {'model_type': 'mlp', 'hidden_dims': '[512, 256]', 'dropout': 0.43393483255049065, 'batch_norm': True, 'lr': 0.0005543073378465242, 'weight_decay': 1.6186744172979692e-06, 'epochs': 146, 'loss': 'mae', 'optimizer': 'adam', 'graph_mode': 'off', 'use_snp_selection': True, 'num_snps': 50488}. Best is trial 65 with value: 0.10536764442322526.
[I 2025-12-05 16:12:50,797] Trial 149 finished with value: 0.08609456224444785 and parameters: {'model_type': 'mlp', 'hidden_dims': '[256, 128, 64]', 'dropout': 0.3614395541594647, 'batch_norm': False, 'lr': 0.00015397611189867566, 'weight_decay': 0.0004864712575713878, 'epochs': 105, 'loss': 'mse', 'optimizer': 'adam', 'graph_mode': 'off', 'use_snp_selection': False}. Best is trial 65 with value: 0.10536764442322526.
[I 2025-12-05 16:12:53,048] Trial 0 finished with value: 0.038593267645271566 and parameters: {'model_type': 'mlp', 'hidden_dims': '[128, 64]', 'dropout': 0.199031432379812, 'batch_norm': True, 'lr': 1.8408544111075837e-06, 'weight_decay': 5.5136510071208614e-05, 'epochs': 336, 'loss': 'mae', 'optimizer': 'adam', 'graph_mode': 'off', 'use_snp_selection': True, 'num_snps': 43862}. Best is trial 0 with value: 0.038593267645271566.
[I 2025-12-05 16:12:54,275] Trial 1 finished with value: 0.10004971948298103 and parameters: {'model_type': 'mlp', 'hidden_dims': '[256, 128]', 'dropout': 0.4370668075331726, 'batch_norm': True, 'lr': 7.133471581159139e-05, 'weight_decay': 1.128633586803549e-05, 'epochs': 242, 'loss': 'mae', 'optimizer': 'adam', 'graph_mode': 'off', 'use_snp_selection': False}. Best is trial 1 with value: 0.10004971948298103.
[I 2025-12-05 16:12:55,333] Trial 2 finished with value: 0.03801814209130788 and parameters: {'model_type': 'mlp', 'hidden_dims': '[256, 128, 64]', 'dropout': 0.41314357415569625, 'batch_norm': False, 'lr': 3.952233718592101e-06, 'weight_decay': 0.00026754769258252603, 'epochs': 149, 'loss': 'mse', 'optimizer': 'adam', 'graph_mode': 'off', 'use_snp_selection': True, 'num_snps': 11571}. Best is trial 1 with value: 0.10004971948298103.
[I 2025-12-05 16:12:57,551] Trial 3 finished with value: 0.10557247841092393 and parameters: {'model_type': 'mlp', 'hidden_dims': '[512, 64]', 'dropout': 0.5938127374509361, 'batch_norm': False, 'lr': 5.67704586114731e-06, 'weight_decay': 2.4518087630137052e-05, 'epochs': 320, 'loss': 'mae', 'optimizer': 'adam', 'graph_mode': 'off', 'use_snp_selection': False}. Best is trial 3 with value: 0.10557247841092393.
[I 2025-12-05 16:12:59,923] Trial 4 finished with value: 0.0671273497770168 and parameters: {'model_type': 'mlp', 'hidden_dims': '[512, 128]', 'dropout': 0.25746343592134413, 'batch_norm': True, 'lr': 1.3467657668402788e-06, 'weight_decay': 0.00033087251918647806, 'epochs': 277, 'loss': 'mse', 'optimizer': 'adam', 'graph_mode': 'off', 'use_snp_selection': True, 'num_snps': 36675}. Best is trial 3 with value: 0.10557247841092393.
[I 2025-12-05 16:13:01,741] Trial 5 finished with value: 0.07050831799252887 and parameters: {'model_type': 'mlp', 'hidden_dims': '[512, 64]', 'dropout': 0.38275350994408375, 'batch_norm': True, 'lr': 1.5586664309232824e-06, 'weight_decay': 0.0008227664668621182, 'epochs': 145, 'loss': 'mae', 'optimizer': 'adam', 'graph_mode': 'off', 'use_snp_selection': True, 'num_snps': 32148}. Best is trial 3 with value: 0.10557247841092393.
[I 2025-12-05 16:13:02,818] Trial 6 finished with value: 0.09984915751861227 and parameters: {'model_type': 'mlp', 'hidden_dims': '[256, 128]', 'dropout': 0.3930109900265879, 'batch_norm': False, 'lr': 4.892964372128395e-05, 'weight_decay': 1.5809549317992182e-06, 'epochs': 199, 'loss': 'mse', 'optimizer': 'adam', 'graph_mode': 'off', 'use_snp_selection': False}. Best is trial 3 with value: 0.10557247841092393.
[I 2025-12-05 16:13:04,018] Trial 7 finished with value: 0.11424070990472684 and parameters: {'model_type': 'mlp', 'hidden_dims': '[512, 256]', 'dropout': 0.15343979219678458, 'batch_norm': True, 'lr': 6.234003099047341e-05, 'weight_decay': 3.894760610535477e-07, 'epochs': 97, 'loss': 'mse', 'optimizer': 'adam', 'graph_mode': 'off', 'use_snp_selection': False}. Best is trial 7 with value: 0.11424070990472684.
[I 2025-12-05 16:13:06,193] Trial 8 finished with value: 0.12370959377654393 and parameters: {'model_type': 'mlp', 'hidden_dims': '[512, 128]', 'dropout': 0.10743001231661406, 'batch_norm': True, 'lr': 0.00023728538449271062, 'weight_decay': 1.7629071578048637e-05, 'epochs': 312, 'loss': 'mae', 'optimizer': 'adam', 'graph_mode': 'off', 'use_snp_selection': False}. Best is trial 8 with value: 0.12370959377654393.
[I 2025-12-05 16:13:07,730] Trial 9 finished with value: 0.13656639352650343 and parameters: {'model_type': 'mlp', 'hidden_dims': '[512, 64]', 'dropout': 0.14505336736221927, 'batch_norm': True, 'lr': 5.8619638388111826e-05, 'weight_decay': 6.200156172669308e-07, 'epochs': 175, 'loss': 'mse', 'optimizer': 'adam', 'graph_mode': 'off', 'use_snp_selection': False}. Best is trial 9 with value: 0.13656639352650343.
[I 2025-12-05 16:13:08,658] Trial 10 finished with value: -0.028215983616555893 and parameters: {'model_type': 'mlp', 'hidden_dims': '[512, 64]', 'dropout': 0.27531666245262887, 'batch_norm': False, 'lr': 0.00032393778075602147, 'weight_decay': 1.1714031539166647e-07, 'epochs': 44, 'loss': 'mse', 'optimizer': 'adam', 'graph_mode': 'off', 'use_snp_selection': False}. Best is trial 9 with value: 0.13656639352650343.
[I 2025-12-05 16:13:10,400] Trial 11 finished with value: 0.12405229090189514 and parameters: {'model_type': 'mlp', 'hidden_dims': '[512, 128]', 'dropout': 0.10095648685224448, 'batch_norm': True, 'lr': 0.0007381466848241802, 'weight_decay': 1.969664044175748e-06, 'epochs': 216, 'loss': 'mae', 'optimizer': 'adam', 'graph_mode': 'off', 'use_snp_selection': False}. Best is trial 9 with value: 0.13656639352650343.
[I 2025-12-05 16:13:12,098] Trial 12 finished with value: 0.11568286114487566 and parameters: {'model_type': 'mlp', 'hidden_dims': '[512, 128]', 'dropout': 0.10344600881777158, 'batch_norm': True, 'lr': 0.0006753264773209732, 'weight_decay': 2.0975627484345868e-06, 'epochs': 208, 'loss': 'mae', 'optimizer': 'adam', 'graph_mode': 'off', 'use_snp_selection': False}. Best is trial 9 with value: 0.13656639352650343.
