[I 2025-12-05 20:06:21,232] Trial 58 finished with value: 0.2109384443063568 and parameters: {'model_type': 'mlp', 'hidden_dims': '[512, 64]', 'dropout': 0.5790188197512276, 'batch_norm': True, 'lr': 5.389243061593862e-05, 'weight_decay': 7.663494433930236e-06, 'epochs': 297, 'loss': 'mae', 'optimizer': 'adam', 'graph_mode': 'off', 'use_snp_selection': True, 'num_snps': 8979}. Best is trial 57 with value: 0.23764430199362083.
[I 2025-12-05 20:07:06,834] Trial 59 finished with value: 0.22476053307093657 and parameters: {'model_type': 'mlp', 'hidden_dims': '[512, 64]', 'dropout': 0.48935054417477747, 'batch_norm': True, 'lr': 9.329554101355227e-05, 'weight_decay': 2.2640745937389483e-06, 'epochs': 234, 'loss': 'mae', 'optimizer': 'adam', 'graph_mode': 'off', 'use_snp_selection': True, 'num_snps': 13283}. Best is trial 57 with value: 0.23764430199362083.
[I 2025-12-05 20:07:47,181] Trial 60 finished with value: 0.201130145354399 and parameters: {'model_type': 'mlp', 'hidden_dims': '[512, 64]', 'dropout': 0.504267892178526, 'batch_norm': True, 'lr': 0.00042455896301338796, 'weight_decay': 8.901749998950171e-07, 'epochs': 337, 'loss': 'mae', 'optimizer': 'adam', 'graph_mode': 'off', 'use_snp_selection': True, 'num_snps': 6649}. Best is trial 57 with value: 0.23764430199362083.
[I 2025-12-05 20:08:32,749] Trial 61 finished with value: 0.21063815804363895 and parameters: {'model_type': 'mlp', 'hidden_dims': '[512, 64]', 'dropout': 0.48847196734419457, 'batch_norm': True, 'lr': 8.58670128484985e-05, 'weight_decay': 2.3617332524840464e-06, 'epochs': 241, 'loss': 'mae', 'optimizer': 'adam', 'graph_mode': 'off', 'use_snp_selection': True, 'num_snps': 12661}. Best is trial 57 with value: 0.23764430199362083.
[I 2025-12-05 20:09:22,434] Trial 62 finished with value: 0.22988739119581242 and parameters: {'model_type': 'mlp', 'hidden_dims': '[512, 64]', 'dropout': 0.478382667437317, 'batch_norm': True, 'lr': 0.0001646070395768085, 'weight_decay': 4.3243432568551726e-06, 'epochs': 232, 'loss': 'mae', 'optimizer': 'adam', 'graph_mode': 'off', 'use_snp_selection': True, 'num_snps': 16274}. Best is trial 57 with value: 0.23764430199362083.
[I 2025-12-05 20:10:09,533] Trial 63 finished with value: 0.22623341030659289 and parameters: {'model_type': 'mlp', 'hidden_dims': '[512, 64]', 'dropout': 0.5270733418093029, 'batch_norm': True, 'lr': 0.0002108019099343107, 'weight_decay': 4.8826672722952746e-06, 'epochs': 191, 'loss': 'mae', 'optimizer': 'adam', 'graph_mode': 'off', 'use_snp_selection': True, 'num_snps': 16692}. Best is trial 57 with value: 0.23764430199362083.
[I 2025-12-05 20:10:56,421] Trial 64 finished with value: 0.23037498192770042 and parameters: {'model_type': 'mlp', 'hidden_dims': '[512, 64]', 'dropout': 0.52965809985516, 'batch_norm': True, 'lr': 0.00029744044298539164, 'weight_decay': 5.198981576722487e-06, 'epochs': 183, 'loss': 'mae', 'optimizer': 'adam', 'graph_mode': 'off', 'use_snp_selection': True, 'num_snps': 17064}. Best is trial 57 with value: 0.23764430199362083.
[I 2025-12-05 20:11:47,707] Trial 65 finished with value: 0.22160152781838321 and parameters: {'model_type': 'mlp', 'hidden_dims': '[512, 64]', 'dropout': 0.2039118983489196, 'batch_norm': True, 'lr': 0.0003166441325183788, 'weight_decay': 5.398391791139461e-06, 'epochs': 161, 'loss': 'mae', 'optimizer': 'adam', 'graph_mode': 'off', 'use_snp_selection': True, 'num_snps': 22533}. Best is trial 57 with value: 0.23764430199362083.
[I 2025-12-05 20:12:36,925] Trial 66 finished with value: 0.23053645072036918 and parameters: {'model_type': 'mlp', 'hidden_dims': '[512, 64]', 'dropout': 0.553700845427774, 'batch_norm': True, 'lr': 0.00015869377834644896, 'weight_decay': 1.4490196830197906e-05, 'epochs': 199, 'loss': 'mae', 'optimizer': 'adam', 'graph_mode': 'off', 'use_snp_selection': True, 'num_snps': 17880}. Best is trial 57 with value: 0.23764430199362083.
[I 2025-12-05 20:13:22,212] Trial 67 finished with value: 0.22848861207562093 and parameters: {'model_type': 'mlp', 'hidden_dims': '[512, 64]', 'dropout': 0.5791072845518959, 'batch_norm': True, 'lr': 0.0001370740829614287, 'weight_decay': 1.4154756562118315e-05, 'epochs': 141, 'loss': 'mae', 'optimizer': 'adam', 'graph_mode': 'off', 'use_snp_selection': True, 'num_snps': 18650}. Best is trial 57 with value: 0.23764430199362083.
[I 2025-12-05 20:14:04,625] Trial 68 finished with value: 0.21507793962594132 and parameters: {'model_type': 'mlp', 'hidden_dims': '[512, 64]', 'dropout': 0.5836932090603495, 'batch_norm': True, 'lr': 0.0001498509392873416, 'weight_decay': 1.4232712814189387e-05, 'epochs': 103, 'loss': 'mse', 'optimizer': 'adam', 'graph_mode': 'off', 'use_snp_selection': True, 'num_snps': 18501}. Best is trial 57 with value: 0.23764430199362083.
[I 2025-12-05 20:14:51,402] Trial 69 finished with value: 0.21442225478249224 and parameters: {'model_type': 'mlp', 'hidden_dims': '[512, 64]', 'dropout': 0.5443350940875056, 'batch_norm': True, 'lr': 0.00011658539256825501, 'weight_decay': 6.890899118275731e-06, 'epochs': 141, 'loss': 'mae', 'optimizer': 'adam', 'graph_mode': 'off', 'use_snp_selection': True, 'num_snps': 20586}. Best is trial 57 with value: 0.23764430199362083.
[I 2025-12-05 20:15:40,260] Trial 70 finished with value: 0.21720810060148432 and parameters: {'model_type': 'mlp', 'hidden_dims': '[512, 64]', 'dropout': 0.5297930753083664, 'batch_norm': True, 'lr': 0.00029135612358552267, 'weight_decay': 3.6070446877165703e-06, 'epochs': 198, 'loss': 'mae', 'optimizer': 'adam', 'graph_mode': 'off', 'use_snp_selection': True, 'num_snps': 17748}. Best is trial 57 with value: 0.23764430199362083.
[I 2025-12-05 20:16:19,143] Trial 71 finished with value: 0.21619524714682842 and parameters: {'model_type': 'mlp', 'hidden_dims': '[512, 64]', 'dropout': 0.5582787963785776, 'batch_norm': True, 'lr': 0.00022286464582342412, 'weight_decay': 1.4963338582446328e-06, 'epochs': 186, 'loss': 'mae', 'optimizer': 'adam', 'graph_mode': 'off', 'use_snp_selection': True, 'num_snps': 9822}. Best is trial 57 with value: 0.23764430199362083.
[I 2025-12-05 20:17:05,095] Trial 72 finished with value: 0.22472696124870223 and parameters: {'model_type': 'mlp', 'hidden_dims': '[512, 64]', 'dropout': 0.5776411829644809, 'batch_norm': True, 'lr': 0.00014975388842195073, 'weight_decay': 8.78282961332435e-06, 'epochs': 211, 'loss': 'mae', 'optimizer': 'adam', 'graph_mode': 'off', 'use_snp_selection': True, 'num_snps': 14858}. Best is trial 57 with value: 0.23764430199362083.
[I 2025-12-05 20:17:48,605] Trial 73 finished with value: 0.21819945286707765 and parameters: {'model_type': 'mlp', 'hidden_dims': '[256, 128, 64]', 'dropout': 0.5985494149294406, 'batch_norm': True, 'lr': 0.0002880569818808276, 'weight_decay': 1.3888657330137363e-05, 'epochs': 177, 'loss': 'mae', 'optimizer': 'adam', 'graph_mode': 'off', 'use_snp_selection': True, 'num_snps': 21196}. Best is trial 57 with value: 0.23764430199362083.
[I 2025-12-05 20:18:33,029] Trial 74 finished with value: 0.21971103356444882 and parameters: {'model_type': 'mlp', 'hidden_dims': '[512, 64]', 'dropout': 0.5612104387745521, 'batch_norm': True, 'lr': 0.0003666706851193404, 'weight_decay': 4.662688249915283e-06, 'epochs': 136, 'loss': 'mae', 'optimizer': 'adam', 'graph_mode': 'off', 'use_snp_selection': True, 'num_snps': 18299}. Best is trial 57 with value: 0.23764430199362083.
[I 2025-12-05 20:19:14,981] Trial 75 finished with value: 0.219132641173238 and parameters: {'model_type': 'mlp', 'hidden_dims': '[512, 64]', 'dropout': 0.5381983202653783, 'batch_norm': True, 'lr': 0.000539253765557673, 'weight_decay': 2.132749786815461e-05, 'epochs': 153, 'loss': 'mae', 'optimizer': 'adam', 'graph_mode': 'off', 'use_snp_selection': True, 'num_snps': 14080}. Best is trial 57 with value: 0.23764430199362083.
[I 2025-12-05 20:19:50,887] Trial 76 finished with value: 0.20184652997089275 and parameters: {'model_type': 'mlp', 'hidden_dims': '[512, 64]', 'dropout': 0.517069505317049, 'batch_norm': True, 'lr': 0.0001660895737709629, 'weight_decay': 1.2051559194781985e-05, 'epochs': 211, 'loss': 'mae', 'optimizer': 'adam', 'graph_mode': 'off', 'use_snp_selection': True, 'num_snps': 6181}. Best is trial 57 with value: 0.23764430199362083.
[I 2025-12-05 20:20:27,154] Trial 77 finished with value: 0.22211956703637065 and parameters: {'model_type': 'mlp', 'hidden_dims': '[512, 64]', 'dropout': 0.5743547442671797, 'batch_norm': True, 'lr': 0.0008758834825604558, 'weight_decay': 9.720974330187921e-06, 'epochs': 89, 'loss': 'mae', 'optimizer': 'adam', 'graph_mode': 'off', 'use_snp_selection': True, 'num_snps': 11324}. Best is trial 57 with value: 0.23764430199362083.
[I 2025-12-05 20:21:16,766] Trial 78 finished with value: 0.2276872540042938 and parameters: {'model_type': 'mlp', 'hidden_dims': '[512, 64]', 'dropout': 0.555493014408706, 'batch_norm': True, 'lr': 0.0001271891749036362, 'weight_decay': 1.730601441369368e-06, 'epochs': 228, 'loss': 'mae', 'optimizer': 'adam', 'graph_mode': 'off', 'use_snp_selection': True, 'num_snps': 16914}. Best is trial 57 with value: 0.23764430199362083.
[I 2025-12-05 20:22:14,303] Trial 79 finished with value: 0.22184627848971156 and parameters: {'model_type': 'mlp', 'hidden_dims': '[512, 64]', 'dropout': 0.46836367616259, 'batch_norm': True, 'lr': 0.00011200115125902825, 'weight_decay': 8.89985467681481e-07, 'epochs': 227, 'loss': 'mae', 'optimizer': 'adam', 'graph_mode': 'off', 'use_snp_selection': True, 'num_snps': 22904}. Best is trial 57 with value: 0.23764430199362083.
[I 2025-12-05 20:23:05,180] Trial 80 finished with value: 0.2219530681875166 and parameters: {'model_type': 'mlp', 'hidden_dims': '[512, 64]', 'dropout': 0.5539630560602596, 'batch_norm': True, 'lr': 0.0002470829211328008, 'weight_decay': 1.3772454395532748e-06, 'epochs': 203, 'loss': 'mae', 'optimizer': 'adam', 'graph_mode': 'off', 'use_snp_selection': True, 'num_snps': 19152}. Best is trial 57 with value: 0.23764430199362083.
[I 2025-12-05 20:23:51,245] Trial 81 finished with value: 0.2253146933031461 and parameters: {'model_type': 'mlp', 'hidden_dims': '[512, 64]', 'dropout': 0.5321110405958994, 'batch_norm': True, 'lr': 0.0001833503703345767, 'weight_decay': 4.0518059513727885e-06, 'epochs': 183, 'loss': 'mae', 'optimizer': 'adam', 'graph_mode': 'off', 'use_snp_selection': True, 'num_snps': 16621}. Best is trial 57 with value: 0.23764430199362083.
[I 2025-12-05 20:24:29,248] Trial 82 finished with value: 0.2190324315751692 and parameters: {'model_type': 'mlp', 'hidden_dims': '[256, 128, 64]', 'dropout': 0.5066642822328962, 'batch_norm': True, 'lr': 6.896401123754006e-05, 'weight_decay': 1.6706069836375007e-05, 'epochs': 128, 'loss': 'mae', 'optimizer': 'adam', 'graph_mode': 'off', 'use_snp_selection': True, 'num_snps': 16316}. Best is trial 57 with value: 0.23764430199362083.
[I 2025-12-05 20:25:08,880] Trial 83 finished with value: 0.21047798286706904 and parameters: {'model_type': 'mlp', 'hidden_dims': '[512, 64]', 'dropout': 0.5511665437150403, 'batch_norm': True, 'lr': 9.197500684044295e-05, 'weight_decay': 2.4086978646813444e-07, 'epochs': 165, 'loss': 'mae', 'optimizer': 'adam', 'graph_mode': 'off', 'use_snp_selection': True, 'num_snps': 11443}. Best is trial 57 with value: 0.23764430199362083.
[I 2025-12-05 20:26:02,553] Trial 84 finished with value: 0.22278917238991353 and parameters: {'model_type': 'mlp', 'hidden_dims': '[512, 64]', 'dropout': 0.5856361940017053, 'batch_norm': True, 'lr': 4.4862650680888475e-05, 'weight_decay': 5.937338368023822e-06, 'epochs': 231, 'loss': 'mae', 'optimizer': 'adam', 'graph_mode': 'off', 'use_snp_selection': True, 'num_snps': 20004}. Best is trial 57 with value: 0.23764430199362083.
[I 2025-12-05 20:26:46,884] Trial 85 finished with value: 0.20755122428947842 and parameters: {'model_type': 'mlp', 'hidden_dims': '[512, 64]', 'dropout': 0.5242163679869097, 'batch_norm': True, 'lr': 2.9282704780457307e-05, 'weight_decay': 2.17948170898328e-06, 'epochs': 340, 'loss': 'mse', 'optimizer': 'adam', 'graph_mode': 'off', 'use_snp_selection': True, 'num_snps': 8927}. Best is trial 57 with value: 0.23764430199362083.
[I 2025-12-05 20:27:32,652] Trial 86 finished with value: 0.23275807786804242 and parameters: {'model_type': 'mlp', 'hidden_dims': '[512, 64]', 'dropout': 0.5662611853119811, 'batch_norm': True, 'lr': 0.0001324610896444161, 'weight_decay': 4.15726798390814e-05, 'epochs': 218, 'loss': 'mae', 'optimizer': 'adam', 'graph_mode': 'off', 'use_snp_selection': True, 'num_snps': 13998}. Best is trial 57 with value: 0.23764430199362083.
[I 2025-12-05 20:28:18,623] Trial 87 finished with value: 0.221249337796938 and parameters: {'model_type': 'mlp', 'hidden_dims': '[512, 64]', 'dropout': 0.5421491886062012, 'batch_norm': True, 'lr': 0.00012920107990955847, 'weight_decay': 3.269235115826504e-05, 'epochs': 219, 'loss': 'mae', 'optimizer': 'adam', 'graph_mode': 'off', 'use_snp_selection': True, 'num_snps': 14123}. Best is trial 57 with value: 0.23764430199362083.
[I 2025-12-05 20:29:24,560] Trial 88 finished with value: 0.2164453942273294 and parameters: {'model_type': 'mlp', 'hidden_dims': '[512, 64]', 'dropout': 0.5919291804984462, 'batch_norm': True, 'lr': 0.00019743622747304019, 'weight_decay': 4.455696787022613e-05, 'epochs': 247, 'loss': 'mae', 'optimizer': 'adam', 'graph_mode': 'off', 'use_snp_selection': True, 'num_snps': 27842}. Best is trial 57 with value: 0.23764430199362083.
[I 2025-12-05 20:30:14,503] Trial 89 finished with value: 0.2217751455088383 and parameters: {'model_type': 'mlp', 'hidden_dims': '[512, 64]', 'dropout': 0.4392462236010001, 'batch_norm': True, 'lr': 0.00010605109013360624, 'weight_decay': 2.115855029735505e-05, 'epochs': 216, 'loss': 'mae', 'optimizer': 'adam', 'graph_mode': 'off', 'use_snp_selection': True, 'num_snps': 17569}. Best is trial 57 with value: 0.23764430199362083.
[I 2025-12-05 20:31:15,247] Trial 90 finished with value: 0.2254021230563965 and parameters: {'model_type': 'mlp', 'hidden_dims': '[512, 64]', 'dropout': 0.4939307638808428, 'batch_norm': True, 'lr': 8.003399928442151e-05, 'weight_decay': 1.1806853444665125e-05, 'epochs': 262, 'loss': 'mae', 'optimizer': 'adam', 'graph_mode': 'off', 'use_snp_selection': True, 'num_snps': 22824}. Best is trial 57 with value: 0.23764430199362083.
[I 2025-12-05 20:33:13,441] Trial 91 finished with value: 0.20457842693539968 and parameters: {'model_type': 'mlp', 'hidden_dims': '[512, 128]', 'dropout': 0.5728499133735263, 'batch_norm': True, 'lr': 0.00013985318418847345, 'weight_decay': 9.161929278648998e-06, 'epochs': 286, 'loss': 'mae', 'optimizer': 'adam', 'graph_mode': 'off', 'use_snp_selection': True, 'num_snps': 59456}. Best is trial 57 with value: 0.23764430199362083.
[I 2025-12-05 20:34:02,382] Trial 92 finished with value: 0.21824782443929586 and parameters: {'model_type': 'mlp', 'hidden_dims': '[512, 64]', 'dropout': 0.5647206158426381, 'batch_norm': True, 'lr': 0.0002575638326367256, 'weight_decay': 0.0007142678434498287, 'epochs': 303, 'loss': 'mae', 'optimizer': 'adam', 'graph_mode': 'off', 'use_snp_selection': True, 'num_snps': 12938}. Best is trial 57 with value: 0.23764430199362083.
[I 2025-12-05 20:34:49,073] Trial 93 finished with value: 0.21973910690145618 and parameters: {'model_type': 'mlp', 'hidden_dims': '[512, 128]', 'dropout': 0.5123478763828198, 'batch_norm': True, 'lr': 6.004584871185899e-05, 'weight_decay': 3.010190658304253e-06, 'epochs': 194, 'loss': 'mae', 'optimizer': 'adam', 'graph_mode': 'off', 'use_snp_selection': True, 'num_snps': 15909}. Best is trial 57 with value: 0.23764430199362083.
[I 2025-12-05 20:35:26,095] Trial 94 finished with value: 0.20981049702943375 and parameters: {'model_type': 'mlp', 'hidden_dims': '[256, 128, 64]', 'dropout': 0.5364440800135487, 'batch_norm': True, 'lr': 0.00016801029534247195, 'weight_decay': 1.7426941731194974e-05, 'epochs': 204, 'loss': 'mae', 'optimizer': 'adam', 'graph_mode': 'off', 'use_snp_selection': True, 'num_snps': 10459}. Best is trial 57 with value: 0.23764430199362083.
[I 2025-12-05 20:36:06,097] Trial 95 finished with value: 0.22991334126822588 and parameters: {'model_type': 'mlp', 'hidden_dims': '[512, 64]', 'dropout': 0.5526490657263313, 'batch_norm': True, 'lr': 0.00040327817290392075, 'weight_decay': 6.402150231725979e-06, 'epochs': 111, 'loss': 'mae', 'optimizer': 'adam', 'graph_mode': 'off', 'use_snp_selection': True, 'num_snps': 14789}. Best is trial 57 with value: 0.23764430199362083.
[I 2025-12-05 20:36:46,586] Trial 96 finished with value: 0.22304011112651362 and parameters: {'model_type': 'mlp', 'hidden_dims': '[512, 64]', 'dropout': 0.5554233056017092, 'batch_norm': True, 'lr': 0.0004119653380305287, 'weight_decay': 7.398948787600779e-06, 'epochs': 118, 'loss': 'mae', 'optimizer': 'adam', 'graph_mode': 'off', 'use_snp_selection': True, 'num_snps': 14957}. Best is trial 57 with value: 0.23764430199362083.
[I 2025-12-05 20:37:30,057] Trial 97 finished with value: 0.2200962124515978 and parameters: {'model_type': 'mlp', 'hidden_dims': '[512, 64]', 'dropout': 0.47900991384225156, 'batch_norm': True, 'lr': 0.00047266288975203734, 'weight_decay': 0.0001077140438666615, 'epochs': 114, 'loss': 'mae', 'optimizer': 'adam', 'graph_mode': 'off', 'use_snp_selection': True, 'num_snps': 18955}. Best is trial 57 with value: 0.23764430199362083.
[I 2025-12-05 20:38:03,246] Trial 98 finished with value: 0.19283693907676763 and parameters: {'model_type': 'mlp', 'hidden_dims': '[512, 64]', 'dropout': 0.5243084516158103, 'batch_norm': True, 'lr': 0.0003289029345064987, 'weight_decay': 3.985088172821076e-06, 'epochs': 74, 'loss': 'mse', 'optimizer': 'adam', 'graph_mode': 'off', 'use_snp_selection': True, 'num_snps': 7941}. Best is trial 57 with value: 0.23764430199362083.
[I 2025-12-05 20:38:40,208] Trial 99 finished with value: 0.21624067378574777 and parameters: {'model_type': 'mlp', 'hidden_dims': '[512, 256]', 'dropout': 0.5495481467398008, 'batch_norm': True, 'lr': 0.00020611586466917742, 'weight_decay': 4.0492675067741085e-05, 'epochs': 76, 'loss': 'mae', 'optimizer': 'adam', 'graph_mode': 'off', 'use_snp_selection': True, 'num_snps': 13404}. Best is trial 57 with value: 0.23764430199362083.
[I 2025-12-05 20:39:14,130] Trial 100 finished with value: 0.174769748875847 and parameters: {'model_type': 'mlp', 'hidden_dims': '[512, 64]', 'dropout': 0.5878014162505013, 'batch_norm': True, 'lr': 0.0008140007880718957, 'weight_decay': 5.85173356394779e-06, 'epochs': 269, 'loss': 'mae', 'optimizer': 'adam', 'graph_mode': 'off', 'use_snp_selection': True, 'num_snps': 3432}. Best is trial 57 with value: 0.23764430199362083.
[I 2025-12-05 20:39:55,719] Trial 101 finished with value: 0.22879082108780296 and parameters: {'model_type': 'mlp', 'hidden_dims': '[512, 128]', 'dropout': 0.5701041822085032, 'batch_norm': True, 'lr': 0.00010580712305390788, 'weight_decay': 3.0409272080157493e-05, 'epochs': 105, 'loss': 'mae', 'optimizer': 'adam', 'graph_mode': 'off', 'use_snp_selection': True, 'num_snps': 17053}. Best is trial 57 with value: 0.23764430199362083.
[I 2025-12-05 20:40:36,971] Trial 102 finished with value: 0.20835106259830205 and parameters: {'model_type': 'mlp', 'hidden_dims': '[512, 64]', 'dropout': 0.5736154217294945, 'batch_norm': True, 'lr': 0.00010126010056503059, 'weight_decay': 3.610763531087393e-05, 'epochs': 103, 'loss': 'mae', 'optimizer': 'adam', 'graph_mode': 'off', 'use_snp_selection': True, 'num_snps': 17155}. Best is trial 57 with value: 0.23764430199362083.
[I 2025-12-05 20:41:26,206] Trial 103 finished with value: 0.21953065296600252 and parameters: {'model_type': 'mlp', 'hidden_dims': '[512, 64]', 'dropout': 0.5078475151101857, 'batch_norm': True, 'lr': 0.00012463255991644335, 'weight_decay': 2.942149996296234e-05, 'epochs': 153, 'loss': 'mae', 'optimizer': 'adam', 'graph_mode': 'off', 'use_snp_selection': True, 'num_snps': 21256}. Best is trial 57 with value: 0.23764430199362083.
[I 2025-12-05 20:42:04,529] Trial 104 finished with value: 0.22001976595554465 and parameters: {'model_type': 'mlp', 'hidden_dims': '[256, 128]', 'dropout': 0.5197144950302421, 'batch_norm': True, 'lr': 0.00016741592261811233, 'weight_decay': 2.3530760131906722e-05, 'epochs': 87, 'loss': 'mae', 'optimizer': 'adam', 'graph_mode': 'off', 'use_snp_selection': True, 'num_snps': 19761}. Best is trial 57 with value: 0.23764430199362083.
[I 2025-12-05 20:42:45,001] Trial 105 finished with value: 0.22601423595733414 and parameters: {'model_type': 'mlp', 'hidden_dims': '[512, 128]', 'dropout': 0.5384929359225585, 'batch_norm': True, 'lr': 0.00013816161935862603, 'weight_decay': 6.451736025656943e-06, 'epochs': 114, 'loss': 'mae', 'optimizer': 'adam', 'graph_mode': 'off', 'use_snp_selection': True, 'num_snps': 15415}. Best is trial 57 with value: 0.23764430199362083.
[I 2025-12-05 20:43:23,826] Trial 106 finished with value: 0.23184647427775779 and parameters: {'model_type': 'mlp', 'hidden_dims': '[512, 64]', 'dropout': 0.46466749348982644, 'batch_norm': True, 'lr': 7.181309570543208e-05, 'weight_decay': 7.302362653372069e-05, 'epochs': 133, 'loss': 'mae', 'optimizer': 'adam', 'graph_mode': 'off', 'use_snp_selection': True, 'num_snps': 11789}. Best is trial 57 with value: 0.23764430199362083.
[I 2025-12-05 20:44:02,387] Trial 107 finished with value: 0.23061246303118516 and parameters: {'model_type': 'mlp', 'hidden_dims': '[512, 64]', 'dropout': 0.4945564091380747, 'batch_norm': True, 'lr': 6.751736562170733e-05, 'weight_decay': 7.029429537427803e-05, 'epochs': 129, 'loss': 'mae', 'optimizer': 'adam', 'graph_mode': 'off', 'use_snp_selection': True, 'num_snps': 11672}. Best is trial 57 with value: 0.23764430199362083.
