[I 2025-12-06 02:43:16,136] Trial 115 finished with value: 0.3636543562527236 and parameters: {'model_type': 'mlp', 'hidden_dims': '[256, 128]', 'dropout': 0.4740663944476341, 'batch_norm': False, 'lr': 1.6252636793609112e-06, 'weight_decay': 0.0002761801168364022, 'epochs': 293, 'loss': 'mae', 'optimizer': 'adam', 'graph_mode': 'off', 'use_snp_selection': False}. Best is trial 82 with value: 0.3844016530527869.
[I 2025-12-06 02:44:16,074] Trial 116 finished with value: 0.36684475435199565 and parameters: {'model_type': 'mlp', 'hidden_dims': '[512, 256]', 'dropout': 0.5379387544013411, 'batch_norm': False, 'lr': 1.422333041937998e-06, 'weight_decay': 6.804313210325952e-05, 'epochs': 288, 'loss': 'mae', 'optimizer': 'adam', 'graph_mode': 'off', 'use_snp_selection': False}. Best is trial 82 with value: 0.3844016530527869.
[I 2025-12-06 02:44:37,143] Trial 117 finished with value: 0.38055670629613414 and parameters: {'model_type': 'mlp', 'hidden_dims': '[128, 64]', 'dropout': 0.5011049577892313, 'batch_norm': False, 'lr': 4.1280387394519e-06, 'weight_decay': 4.041260039251643e-05, 'epochs': 310, 'loss': 'mae', 'optimizer': 'adam', 'graph_mode': 'off', 'use_snp_selection': False}. Best is trial 82 with value: 0.3844016530527869.
[I 2025-12-06 02:45:47,410] Trial 118 finished with value: 0.3813359975775469 and parameters: {'model_type': 'mlp', 'hidden_dims': '[512, 128]', 'dropout': 0.43996110395661486, 'batch_norm': False, 'lr': 3.121446108233113e-06, 'weight_decay': 0.00020255952184464868, 'epochs': 343, 'loss': 'mae', 'optimizer': 'adam', 'graph_mode': 'off', 'use_snp_selection': False}. Best is trial 82 with value: 0.3844016530527869.
[I 2025-12-06 02:46:55,467] Trial 119 finished with value: 0.355708705844692 and parameters: {'model_type': 'mlp', 'hidden_dims': '[512, 256]', 'dropout': 0.529009345141137, 'batch_norm': True, 'lr': 5.698558990946929e-06, 'weight_decay': 9.393245875373472e-05, 'epochs': 327, 'loss': 'mae', 'optimizer': 'adam', 'graph_mode': 'off', 'use_snp_selection': False}. Best is trial 82 with value: 0.3844016530527869.
[I 2025-12-06 02:48:01,195] Trial 120 finished with value: 0.36824507164112524 and parameters: {'model_type': 'mlp', 'hidden_dims': '[512, 256]', 'dropout': 0.4626513499544408, 'batch_norm': False, 'lr': 1.1595707733879714e-06, 'weight_decay': 0.0003266349082327294, 'epochs': 318, 'loss': 'mae', 'optimizer': 'adam', 'graph_mode': 'off', 'use_snp_selection': False}. Best is trial 82 with value: 0.3844016530527869.
[I 2025-12-06 02:49:08,570] Trial 121 finished with value: 0.37705000281114925 and parameters: {'model_type': 'mlp', 'hidden_dims': '[512, 256]', 'dropout': 0.5355581687098072, 'batch_norm': False, 'lr': 5.289563089493146e-06, 'weight_decay': 6.049382651261408e-05, 'epochs': 327, 'loss': 'mae', 'optimizer': 'adam', 'graph_mode': 'off', 'use_snp_selection': False}. Best is trial 82 with value: 0.3844016530527869.
[I 2025-12-06 02:50:17,330] Trial 122 finished with value: 0.38588593985696173 and parameters: {'model_type': 'mlp', 'hidden_dims': '[512, 256]', 'dropout': 0.5188573522125702, 'batch_norm': False, 'lr': 2.2125384675859137e-06, 'weight_decay': 4.467687575642701e-05, 'epochs': 334, 'loss': 'mae', 'optimizer': 'adam', 'graph_mode': 'off', 'use_snp_selection': False}. Best is trial 122 with value: 0.38588593985696173.
[I 2025-12-06 02:51:26,413] Trial 123 finished with value: 0.37897728818956 and parameters: {'model_type': 'mlp', 'hidden_dims': '[512, 256]', 'dropout': 0.5146470453717833, 'batch_norm': False, 'lr': 2.285986925086154e-06, 'weight_decay': 0.0001518896702869049, 'epochs': 336, 'loss': 'mae', 'optimizer': 'adam', 'graph_mode': 'off', 'use_snp_selection': False}. Best is trial 122 with value: 0.38588593985696173.
[I 2025-12-06 02:52:29,528] Trial 124 finished with value: 0.3812541092007212 and parameters: {'model_type': 'mlp', 'hidden_dims': '[512, 256]', 'dropout': 0.4910713118893415, 'batch_norm': False, 'lr': 2.0426482487525547e-06, 'weight_decay': 0.00012031196047650585, 'epochs': 305, 'loss': 'mae', 'optimizer': 'adam', 'graph_mode': 'off', 'use_snp_selection': False}. Best is trial 122 with value: 0.38588593985696173.
[I 2025-12-06 02:53:31,273] Trial 125 finished with value: 0.38308676760905414 and parameters: {'model_type': 'mlp', 'hidden_dims': '[512, 256]', 'dropout': 0.5479894737467937, 'batch_norm': False, 'lr': 2.8709015892049465e-06, 'weight_decay': 2.8166760123734132e-05, 'epochs': 298, 'loss': 'mae', 'optimizer': 'adam', 'graph_mode': 'off', 'use_snp_selection': False}. Best is trial 122 with value: 0.38588593985696173.
[I 2025-12-06 02:54:33,227] Trial 126 finished with value: 0.3786215298701942 and parameters: {'model_type': 'mlp', 'hidden_dims': '[512, 256]', 'dropout': 0.5500261298702835, 'batch_norm': False, 'lr': 3.5254596648902974e-06, 'weight_decay': 2.8477249428125542e-05, 'epochs': 299, 'loss': 'mae', 'optimizer': 'adam', 'graph_mode': 'off', 'use_snp_selection': False}. Best is trial 122 with value: 0.38588593985696173.
[I 2025-12-06 02:55:38,320] Trial 127 finished with value: 0.37561774833859995 and parameters: {'model_type': 'mlp', 'hidden_dims': '[512, 256]', 'dropout': 0.5256271607803353, 'batch_norm': False, 'lr': 2.8672056219670874e-06, 'weight_decay': 4.509906417457173e-05, 'epochs': 315, 'loss': 'mse', 'optimizer': 'adam', 'graph_mode': 'off', 'use_snp_selection': False}. Best is trial 122 with value: 0.38588593985696173.
[I 2025-12-06 02:56:41,234] Trial 128 finished with value: 0.34650271859667325 and parameters: {'model_type': 'mlp', 'hidden_dims': '[256, 128, 64]', 'dropout': 0.560132698551023, 'batch_norm': False, 'lr': 1.8048539876546598e-06, 'weight_decay': 7.823162848509542e-05, 'epochs': 344, 'loss': 'mae', 'optimizer': 'adam', 'graph_mode': 'off', 'use_snp_selection': True, 'num_snps': 51726}. Best is trial 122 with value: 0.38588593985696173.
[I 2025-12-06 02:57:49,417] Trial 129 finished with value: 0.38159787902704895 and parameters: {'model_type': 'mlp', 'hidden_dims': '[512, 256]', 'dropout': 0.5455311078243965, 'batch_norm': False, 'lr': 3.0431940776778237e-06, 'weight_decay': 1.947915141949363e-05, 'epochs': 332, 'loss': 'mae', 'optimizer': 'adam', 'graph_mode': 'off', 'use_snp_selection': False}. Best is trial 122 with value: 0.38588593985696173.
[I 2025-12-06 02:58:55,985] Trial 130 finished with value: 0.37988981135500144 and parameters: {'model_type': 'mlp', 'hidden_dims': '[512, 256]', 'dropout': 0.5427490217319191, 'batch_norm': False, 'lr': 2.9747143155237328e-06, 'weight_decay': 1.3104055863718448e-05, 'epochs': 322, 'loss': 'mae', 'optimizer': 'adam', 'graph_mode': 'off', 'use_snp_selection': False}. Best is trial 122 with value: 0.38588593985696173.
[I 2025-12-06 03:00:03,976] Trial 131 finished with value: 0.38012520521469256 and parameters: {'model_type': 'mlp', 'hidden_dims': '[512, 256]', 'dropout': 0.5702752386520634, 'batch_norm': False, 'lr': 3.6902919900590416e-06, 'weight_decay': 2.379526011732156e-05, 'epochs': 330, 'loss': 'mae', 'optimizer': 'adam', 'graph_mode': 'off', 'use_snp_selection': False}. Best is trial 122 with value: 0.38588593985696173.
[I 2025-12-06 03:01:12,901] Trial 132 finished with value: 0.3811166765951919 and parameters: {'model_type': 'mlp', 'hidden_dims': '[512, 256]', 'dropout': 0.5101648972517451, 'batch_norm': False, 'lr': 2.2757652887330195e-06, 'weight_decay': 1.743845657819678e-05, 'epochs': 335, 'loss': 'mae', 'optimizer': 'adam', 'graph_mode': 'off', 'use_snp_selection': False}. Best is trial 122 with value: 0.38588593985696173.
[I 2025-12-06 03:02:24,766] Trial 133 finished with value: 0.3807100891792363 and parameters: {'model_type': 'mlp', 'hidden_dims': '[512, 256]', 'dropout': 0.5005286756291119, 'batch_norm': False, 'lr': 2.4529917840111494e-06, 'weight_decay': 3.003886661060189e-05, 'epochs': 350, 'loss': 'mae', 'optimizer': 'adam', 'graph_mode': 'off', 'use_snp_selection': False}. Best is trial 122 with value: 0.38588593985696173.
[I 2025-12-06 03:03:29,322] Trial 134 finished with value: 0.3826137342980879 and parameters: {'model_type': 'mlp', 'hidden_dims': '[512, 256]', 'dropout': 0.5467963564047267, 'batch_norm': False, 'lr': 4.145110816796289e-06, 'weight_decay': 3.7508886152552115e-05, 'epochs': 310, 'loss': 'mae', 'optimizer': 'adam', 'graph_mode': 'off', 'use_snp_selection': False}. Best is trial 122 with value: 0.38588593985696173.
[I 2025-12-06 03:04:34,333] Trial 135 finished with value: 0.38653302499630326 and parameters: {'model_type': 'mlp', 'hidden_dims': '[512, 256]', 'dropout': 0.5666711133206395, 'batch_norm': False, 'lr': 4.231114188993113e-06, 'weight_decay': 1.9845236544080493e-05, 'epochs': 310, 'loss': 'mae', 'optimizer': 'adam', 'graph_mode': 'off', 'use_snp_selection': False}. Best is trial 135 with value: 0.38653302499630326.
[I 2025-12-06 03:05:38,944] Trial 136 finished with value: 0.38332441300221365 and parameters: {'model_type': 'mlp', 'hidden_dims': '[512, 256]', 'dropout': 0.5828350570071591, 'batch_norm': False, 'lr': 4.384009008621281e-06, 'weight_decay': 3.684695548572875e-05, 'epochs': 309, 'loss': 'mae', 'optimizer': 'adam', 'graph_mode': 'off', 'use_snp_selection': False}. Best is trial 135 with value: 0.38653302499630326.
[I 2025-12-06 03:06:43,077] Trial 137 finished with value: 0.3795671461608995 and parameters: {'model_type': 'mlp', 'hidden_dims': '[512, 256]', 'dropout': 0.5996564099715306, 'batch_norm': False, 'lr': 4.769347819916441e-06, 'weight_decay': 3.226858448233493e-05, 'epochs': 310, 'loss': 'mae', 'optimizer': 'adam', 'graph_mode': 'off', 'use_snp_selection': False}. Best is trial 135 with value: 0.38653302499630326.
[I 2025-12-06 03:07:46,106] Trial 138 finished with value: 0.37672533116403123 and parameters: {'model_type': 'mlp', 'hidden_dims': '[512, 256]', 'dropout': 0.5821255053004557, 'batch_norm': False, 'lr': 7.173226022270218e-06, 'weight_decay': 5.2814592384939556e-05, 'epochs': 305, 'loss': 'mae', 'optimizer': 'adam', 'graph_mode': 'off', 'use_snp_selection': False}. Best is trial 135 with value: 0.38653302499630326.
[I 2025-12-06 03:08:47,708] Trial 139 finished with value: 0.38132108128874975 and parameters: {'model_type': 'mlp', 'hidden_dims': '[512, 256]', 'dropout': 0.5669635198851369, 'batch_norm': False, 'lr': 4.025091756508561e-06, 'weight_decay': 2.0866160017354808e-05, 'epochs': 297, 'loss': 'mae', 'optimizer': 'adam', 'graph_mode': 'off', 'use_snp_selection': False}. Best is trial 135 with value: 0.38653302499630326.
[I 2025-12-06 03:09:53,591] Trial 140 finished with value: 0.37583676720182035 and parameters: {'model_type': 'mlp', 'hidden_dims': '[512, 64]', 'dropout': 0.11136234177636778, 'batch_norm': False, 'lr': 1.9730972906485243e-06, 'weight_decay': 3.580493078706782e-05, 'epochs': 319, 'loss': 'mae', 'optimizer': 'adam', 'graph_mode': 'off', 'use_snp_selection': False}. Best is trial 135 with value: 0.38653302499630326.
[I 2025-12-06 03:10:58,430] Trial 141 finished with value: 0.3812060635466434 and parameters: {'model_type': 'mlp', 'hidden_dims': '[512, 256]', 'dropout': 0.5897105796692492, 'batch_norm': False, 'lr': 3.251000109073315e-06, 'weight_decay': 1.965176613902121e-05, 'epochs': 314, 'loss': 'mae', 'optimizer': 'adam', 'graph_mode': 'off', 'use_snp_selection': False}. Best is trial 135 with value: 0.38653302499630326.
[I 2025-12-06 03:12:01,917] Trial 142 finished with value: 0.38129159932397244 and parameters: {'model_type': 'mlp', 'hidden_dims': '[512, 256]', 'dropout': 0.5588677828665386, 'batch_norm': False, 'lr': 4.49442399482369e-06, 'weight_decay': 2.6886366361103106e-05, 'epochs': 307, 'loss': 'mae', 'optimizer': 'adam', 'graph_mode': 'off', 'use_snp_selection': False}. Best is trial 135 with value: 0.38653302499630326.
[I 2025-12-06 03:13:04,450] Trial 143 finished with value: 0.385092781578071 and parameters: {'model_type': 'mlp', 'hidden_dims': '[512, 256]', 'dropout': 0.5480759120924253, 'batch_norm': False, 'lr': 2.9953093801332583e-06, 'weight_decay': 1.2654159797768465e-05, 'epochs': 302, 'loss': 'mae', 'optimizer': 'adam', 'graph_mode': 'off', 'use_snp_selection': False}. Best is trial 135 with value: 0.38653302499630326.
[I 2025-12-06 03:14:06,366] Trial 144 finished with value: 0.3818832945016143 and parameters: {'model_type': 'mlp', 'hidden_dims': '[512, 256]', 'dropout': 0.5828009559248237, 'batch_norm': False, 'lr': 4.089922740083158e-06, 'weight_decay': 3.936537534075007e-05, 'epochs': 299, 'loss': 'mae', 'optimizer': 'adam', 'graph_mode': 'off', 'use_snp_selection': False}. Best is trial 135 with value: 0.38653302499630326.
[I 2025-12-06 03:15:04,611] Trial 145 finished with value: 0.3774149627929176 and parameters: {'model_type': 'mlp', 'hidden_dims': '[512, 256]', 'dropout': 0.5663787495553064, 'batch_norm': False, 'lr': 5.857682151649743e-06, 'weight_decay': 6.3929957114855505e-06, 'epochs': 280, 'loss': 'mae', 'optimizer': 'adam', 'graph_mode': 'off', 'use_snp_selection': False}. Best is trial 135 with value: 0.38653302499630326.
[I 2025-12-06 03:15:38,161] Trial 146 finished with value: 0.37824911495093133 and parameters: {'model_type': 'mlp', 'hidden_dims': '[256, 128]', 'dropout': 0.5786397652668114, 'batch_norm': False, 'lr': 3.8356425967894145e-06, 'weight_decay': 1.298641785278578e-05, 'epochs': 295, 'loss': 'mae', 'optimizer': 'adam', 'graph_mode': 'off', 'use_snp_selection': False}. Best is trial 135 with value: 0.38653302499630326.
[I 2025-12-06 03:16:41,503] Trial 147 finished with value: 0.353857728861115 and parameters: {'model_type': 'mlp', 'hidden_dims': '[512, 256]', 'dropout': 0.5884810065241829, 'batch_norm': True, 'lr': 4.354437549123082e-06, 'weight_decay': 8.919007697184103e-06, 'epochs': 303, 'loss': 'mae', 'optimizer': 'adam', 'graph_mode': 'off', 'use_snp_selection': False}. Best is trial 135 with value: 0.38653302499630326.
[I 2025-12-06 03:17:47,873] Trial 148 finished with value: 0.37825453703086065 and parameters: {'model_type': 'mlp', 'hidden_dims': '[512, 256]', 'dropout': 0.5493911185533801, 'batch_norm': False, 'lr': 3.600196027762519e-06, 'weight_decay': 3.905755404695108e-05, 'epochs': 322, 'loss': 'mae', 'optimizer': 'adam', 'graph_mode': 'off', 'use_snp_selection': False}. Best is trial 135 with value: 0.38653302499630326.
[I 2025-12-06 03:18:08,985] Trial 149 finished with value: 0.3786026318039137 and parameters: {'model_type': 'mlp', 'hidden_dims': '[128, 64]', 'dropout': 0.573530165239922, 'batch_norm': False, 'lr': 2.2369581200826065e-06, 'weight_decay': 4.8795131795953386e-05, 'epochs': 311, 'loss': 'mse', 'optimizer': 'adam', 'graph_mode': 'off', 'use_snp_selection': False}. Best is trial 135 with value: 0.38653302499630326.
[I 2025-12-06 03:19:11,517] Trial 0 finished with value: 0.31467828063496145 and parameters: {'model_type': 'mlp', 'hidden_dims': '[128, 64]', 'dropout': 0.199031432379812, 'batch_norm': True, 'lr': 1.8408544111075837e-06, 'weight_decay': 5.5136510071208614e-05, 'epochs': 336, 'loss': 'mae', 'optimizer': 'adam', 'graph_mode': 'off', 'use_snp_selection': True, 'num_snps': 43862}. Best is trial 0 with value: 0.31467828063496145.
[I 2025-12-06 03:19:39,887] Trial 1 finished with value: 0.3505877512205837 and parameters: {'model_type': 'mlp', 'hidden_dims': '[256, 128]', 'dropout': 0.4370668075331726, 'batch_norm': True, 'lr': 7.133471581159139e-05, 'weight_decay': 1.128633586803549e-05, 'epochs': 242, 'loss': 'mae', 'optimizer': 'adam', 'graph_mode': 'off', 'use_snp_selection': False}. Best is trial 1 with value: 0.3505877512205837.
[I 2025-12-06 03:20:07,106] Trial 2 finished with value: 0.3470052635300623 and parameters: {'model_type': 'mlp', 'hidden_dims': '[256, 128, 64]', 'dropout': 0.41314357415569625, 'batch_norm': False, 'lr': 3.952233718592101e-06, 'weight_decay': 0.00026754769258252603, 'epochs': 149, 'loss': 'mse', 'optimizer': 'adam', 'graph_mode': 'off', 'use_snp_selection': True, 'num_snps': 11571}. Best is trial 1 with value: 0.3505877512205837.
[I 2025-12-06 03:21:12,072] Trial 3 finished with value: 0.3767574292201618 and parameters: {'model_type': 'mlp', 'hidden_dims': '[512, 64]', 'dropout': 0.5938127374509361, 'batch_norm': False, 'lr': 5.67704586114731e-06, 'weight_decay': 2.4518087630137052e-05, 'epochs': 320, 'loss': 'mae', 'optimizer': 'adam', 'graph_mode': 'off', 'use_snp_selection': False}. Best is trial 3 with value: 0.3767574292201618.
[I 2025-12-06 03:22:15,678] Trial 4 finished with value: 0.31713628570928876 and parameters: {'model_type': 'mlp', 'hidden_dims': '[512, 128]', 'dropout': 0.25746343592134413, 'batch_norm': True, 'lr': 1.3467657668402788e-06, 'weight_decay': 0.00033087251918647806, 'epochs': 277, 'loss': 'mse', 'optimizer': 'adam', 'graph_mode': 'off', 'use_snp_selection': True, 'num_snps': 36675}. Best is trial 3 with value: 0.3767574292201618.
[I 2025-12-06 03:22:59,976] Trial 5 finished with value: 0.3055901933648727 and parameters: {'model_type': 'mlp', 'hidden_dims': '[512, 64]', 'dropout': 0.38275350994408375, 'batch_norm': True, 'lr': 1.5586664309232824e-06, 'weight_decay': 0.0008227664668621182, 'epochs': 145, 'loss': 'mae', 'optimizer': 'adam', 'graph_mode': 'off', 'use_snp_selection': True, 'num_snps': 32148}. Best is trial 3 with value: 0.3767574292201618.
[I 2025-12-06 03:23:23,182] Trial 6 finished with value: 0.35837024208526624 and parameters: {'model_type': 'mlp', 'hidden_dims': '[256, 128]', 'dropout': 0.3930109900265879, 'batch_norm': False, 'lr': 4.892964372128395e-05, 'weight_decay': 1.5809549317992182e-06, 'epochs': 199, 'loss': 'mse', 'optimizer': 'adam', 'graph_mode': 'off', 'use_snp_selection': False}. Best is trial 3 with value: 0.3767574292201618.
[I 2025-12-06 03:23:46,423] Trial 7 finished with value: 0.3548330087862473 and parameters: {'model_type': 'mlp', 'hidden_dims': '[512, 256]', 'dropout': 0.15343979219678458, 'batch_norm': True, 'lr': 6.234003099047341e-05, 'weight_decay': 3.894760610535477e-07, 'epochs': 97, 'loss': 'mse', 'optimizer': 'adam', 'graph_mode': 'off', 'use_snp_selection': False}. Best is trial 3 with value: 0.3767574292201618.
[I 2025-12-06 03:24:51,351] Trial 8 finished with value: 0.3566618172933772 and parameters: {'model_type': 'mlp', 'hidden_dims': '[512, 128]', 'dropout': 0.10743001231661406, 'batch_norm': True, 'lr': 0.00023728538449271062, 'weight_decay': 1.7629071578048637e-05, 'epochs': 312, 'loss': 'mae', 'optimizer': 'adam', 'graph_mode': 'off', 'use_snp_selection': False}. Best is trial 3 with value: 0.3767574292201618.
[I 2025-12-06 03:25:29,772] Trial 9 finished with value: 0.35465731585472554 and parameters: {'model_type': 'mlp', 'hidden_dims': '[512, 64]', 'dropout': 0.14505336736221927, 'batch_norm': True, 'lr': 5.8619638388111826e-05, 'weight_decay': 6.200156172669308e-07, 'epochs': 175, 'loss': 'mse', 'optimizer': 'adam', 'graph_mode': 'off', 'use_snp_selection': False}. Best is trial 3 with value: 0.3767574292201618.
[I 2025-12-06 03:25:44,797] Trial 10 finished with value: 0.358361118600491 and parameters: {'model_type': 'mlp', 'hidden_dims': '[512, 64]', 'dropout': 0.5885461262002587, 'batch_norm': False, 'lr': 8.769366258768696e-06, 'weight_decay': 2.78273193871783e-06, 'epochs': 55, 'loss': 'mae', 'optimizer': 'adam', 'graph_mode': 'off', 'use_snp_selection': False}. Best is trial 3 with value: 0.3767574292201618.
[I 2025-12-06 03:26:11,700] Trial 11 finished with value: 0.36600216801107743 and parameters: {'model_type': 'mlp', 'hidden_dims': '[256, 128]', 'dropout': 0.583942291816117, 'batch_norm': False, 'lr': 1.422933652790185e-05, 'weight_decay': 2.805519019095577e-06, 'epochs': 231, 'loss': 'mse', 'optimizer': 'adam', 'graph_mode': 'off', 'use_snp_selection': False}. Best is trial 3 with value: 0.3767574292201618.
[I 2025-12-06 03:26:38,845] Trial 12 finished with value: 0.37792280014389473 and parameters: {'model_type': 'mlp', 'hidden_dims': '[256, 128]', 'dropout': 0.593097749012682, 'batch_norm': False, 'lr': 1.1374686318732863e-05, 'weight_decay': 1.3081036432574914e-07, 'epochs': 233, 'loss': 'mae', 'optimizer': 'adam', 'graph_mode': 'off', 'use_snp_selection': False}. Best is trial 12 with value: 0.37792280014389473.
[I 2025-12-06 03:26:58,375] Trial 13 finished with value: 0.3683428689615336 and parameters: {'model_type': 'mlp', 'hidden_dims': '[128, 64]', 'dropout': 0.5043641748401543, 'batch_norm': False, 'lr': 1.262035332095525e-05, 'weight_decay': 1.0885943577911259e-07, 'epochs': 285, 'loss': 'mae', 'optimizer': 'adam', 'graph_mode': 'off', 'use_snp_selection': False}. Best is trial 12 with value: 0.37792280014389473.
[I 2025-12-06 03:28:09,281] Trial 14 finished with value: 0.37700543256891217 and parameters: {'model_type': 'mlp', 'hidden_dims': '[512, 256]', 'dropout': 0.5300180653494536, 'batch_norm': False, 'lr': 5.096356034191146e-06, 'weight_decay': 4.7581885634242365e-05, 'epochs': 345, 'loss': 'mae', 'optimizer': 'adam', 'graph_mode': 'off', 'use_snp_selection': False}. Best is trial 12 with value: 0.37792280014389473.
[I 2025-12-06 03:28:59,878] Trial 15 finished with value: 0.3615783920196254 and parameters: {'model_type': 'mlp', 'hidden_dims': '[512, 256]', 'dropout': 0.50071393962227, 'batch_norm': False, 'lr': 2.2256887240255933e-05, 'weight_decay': 6.91081660772694e-05, 'epochs': 244, 'loss': 'mae', 'optimizer': 'adam', 'graph_mode': 'off', 'use_snp_selection': False}. Best is trial 12 with value: 0.37792280014389473.
[I 2025-12-06 03:30:09,429] Trial 16 finished with value: 0.34452821989048654 and parameters: {'model_type': 'mlp', 'hidden_dims': '[512, 256]', 'dropout': 0.29858025320781567, 'batch_norm': False, 'lr': 0.00026660340143421223, 'weight_decay': 1.0590314199196095e-07, 'epochs': 349, 'loss': 'mae', 'optimizer': 'adam', 'graph_mode': 'off', 'use_snp_selection': False}. Best is trial 12 with value: 0.37792280014389473.
