[I 2025-12-06 10:34:50,792] Trial 79 finished with value: 0.3766494697582947 and parameters: {'model_type': 'mlp', 'hidden_dims': '[512, 128]', 'dropout': 0.5165580562801484, 'batch_norm': False, 'lr': 2.3434428064954918e-06, 'weight_decay': 7.486426742660532e-07, 'epochs': 265, 'loss': 'mae', 'optimizer': 'adam', 'graph_mode': 'off', 'use_snp_selection': False}. Best is trial 21 with value: 0.38161588475176045.
[I 2025-12-06 10:35:11,705] Trial 80 finished with value: 0.3741761356438102 and parameters: {'model_type': 'mlp', 'hidden_dims': '[128, 64]', 'dropout': 0.5384506038346775, 'batch_norm': False, 'lr': 7.211663565109933e-06, 'weight_decay': 1.0802600672843093e-06, 'epochs': 296, 'loss': 'mae', 'optimizer': 'adam', 'graph_mode': 'off', 'use_snp_selection': False}. Best is trial 21 with value: 0.38161588475176045.
[I 2025-12-06 10:35:47,825] Trial 81 finished with value: 0.34693070258621 and parameters: {'model_type': 'mlp', 'hidden_dims': '[256, 128, 64]', 'dropout': 0.5650942810522364, 'batch_norm': False, 'lr': 1.7329756199275065e-06, 'weight_decay': 4.116808389118147e-06, 'epochs': 311, 'loss': 'mae', 'optimizer': 'adam', 'graph_mode': 'off', 'use_snp_selection': False}. Best is trial 21 with value: 0.38161588475176045.
[I 2025-12-06 10:36:57,141] Trial 82 finished with value: 0.3798803072831817 and parameters: {'model_type': 'mlp', 'hidden_dims': '[512, 64]', 'dropout': 0.5705734082112125, 'batch_norm': False, 'lr': 1.4444351241214421e-06, 'weight_decay': 1.1518851588434012e-05, 'epochs': 334, 'loss': 'mae', 'optimizer': 'adam', 'graph_mode': 'off', 'use_snp_selection': False}. Best is trial 21 with value: 0.38161588475176045.
[I 2025-12-06 10:38:07,945] Trial 83 finished with value: 0.3801062519429645 and parameters: {'model_type': 'mlp', 'hidden_dims': '[512, 64]', 'dropout': 0.5881607723505056, 'batch_norm': False, 'lr': 3.0543059135708476e-06, 'weight_decay': 1.222047192493048e-05, 'epochs': 343, 'loss': 'mae', 'optimizer': 'adam', 'graph_mode': 'off', 'use_snp_selection': False}. Best is trial 21 with value: 0.38161588475176045.
[I 2025-12-06 10:39:18,915] Trial 84 finished with value: 0.36983093036835935 and parameters: {'model_type': 'mlp', 'hidden_dims': '[512, 64]', 'dropout': 0.5867261149322675, 'batch_norm': False, 'lr': 1.4560709714507593e-06, 'weight_decay': 1.799177554556523e-05, 'epochs': 344, 'loss': 'mae', 'optimizer': 'adam', 'graph_mode': 'off', 'use_snp_selection': False}. Best is trial 21 with value: 0.38161588475176045.
[I 2025-12-06 10:40:27,870] Trial 85 finished with value: 0.37809536602847676 and parameters: {'model_type': 'mlp', 'hidden_dims': '[512, 64]', 'dropout': 0.5705026356896594, 'batch_norm': False, 'lr': 3.1749272828278514e-06, 'weight_decay': 2.3624217738020644e-05, 'epochs': 334, 'loss': 'mae', 'optimizer': 'adam', 'graph_mode': 'off', 'use_snp_selection': False}. Best is trial 21 with value: 0.38161588475176045.
[I 2025-12-06 10:41:35,283] Trial 86 finished with value: 0.367242770121836 and parameters: {'model_type': 'mlp', 'hidden_dims': '[512, 64]', 'dropout': 0.5918903398527746, 'batch_norm': False, 'lr': 1.0080225788355257e-06, 'weight_decay': 6.351010339125333e-05, 'epochs': 326, 'loss': 'mse', 'optimizer': 'adam', 'graph_mode': 'off', 'use_snp_selection': False}. Best is trial 21 with value: 0.38161588475176045.
[I 2025-12-06 10:42:47,369] Trial 87 finished with value: 0.3759411100925755 and parameters: {'model_type': 'mlp', 'hidden_dims': '[512, 64]', 'dropout': 0.5566480957742241, 'batch_norm': False, 'lr': 1.9704935246040787e-06, 'weight_decay': 1.0427302149059833e-05, 'epochs': 350, 'loss': 'mae', 'optimizer': 'adam', 'graph_mode': 'off', 'use_snp_selection': False}. Best is trial 21 with value: 0.38161588475176045.
[I 2025-12-06 10:43:11,026] Trial 88 finished with value: 0.34516740393376694 and parameters: {'model_type': 'mlp', 'hidden_dims': '[128, 64]', 'dropout': 0.5739356352762142, 'batch_norm': True, 'lr': 5.590403774738509e-06, 'weight_decay': 7.574503118923523e-06, 'epochs': 341, 'loss': 'mae', 'optimizer': 'adam', 'graph_mode': 'off', 'use_snp_selection': False}. Best is trial 21 with value: 0.38161588475176045.
[I 2025-12-06 10:44:30,701] Trial 89 finished with value: 0.37415395073416285 and parameters: {'model_type': 'mlp', 'hidden_dims': '[512, 128]', 'dropout': 0.49983347605749917, 'batch_norm': False, 'lr': 1.292305898483222e-06, 'weight_decay': 5.508852956014305e-06, 'epochs': 321, 'loss': 'mae', 'optimizer': 'adam', 'graph_mode': 'off', 'use_snp_selection': True, 'num_snps': 45058}. Best is trial 21 with value: 0.38161588475176045.
[I 2025-12-06 10:45:08,502] Trial 90 finished with value: 0.3728954961130226 and parameters: {'model_type': 'mlp', 'hidden_dims': '[256, 128]', 'dropout': 0.5212744642094825, 'batch_norm': False, 'lr': 4.16725091082172e-06, 'weight_decay': 1.5115620600240377e-05, 'epochs': 332, 'loss': 'mae', 'optimizer': 'adam', 'graph_mode': 'off', 'use_snp_selection': False}. Best is trial 21 with value: 0.38161588475176045.
[I 2025-12-06 10:46:17,642] Trial 91 finished with value: 0.3779350787314513 and parameters: {'model_type': 'mlp', 'hidden_dims': '[512, 64]', 'dropout': 0.5690593352757669, 'batch_norm': False, 'lr': 2.8514443504132632e-06, 'weight_decay': 2.864036222800221e-05, 'epochs': 334, 'loss': 'mae', 'optimizer': 'adam', 'graph_mode': 'off', 'use_snp_selection': False}. Best is trial 21 with value: 0.38161588475176045.
[I 2025-12-06 10:47:28,118] Trial 92 finished with value: 0.3775647939650123 and parameters: {'model_type': 'mlp', 'hidden_dims': '[512, 64]', 'dropout': 0.548588088466659, 'batch_norm': False, 'lr': 3.312897208686847e-06, 'weight_decay': 2.0850890222731904e-05, 'epochs': 341, 'loss': 'mae', 'optimizer': 'adam', 'graph_mode': 'off', 'use_snp_selection': False}. Best is trial 21 with value: 0.38161588475176045.
[I 2025-12-06 10:48:35,795] Trial 93 finished with value: 0.37621369176688185 and parameters: {'model_type': 'mlp', 'hidden_dims': '[512, 64]', 'dropout': 0.5911049392915048, 'batch_norm': False, 'lr': 2.1813528021064874e-06, 'weight_decay': 4.609629244413333e-05, 'epochs': 327, 'loss': 'mae', 'optimizer': 'adam', 'graph_mode': 'off', 'use_snp_selection': False}. Best is trial 21 with value: 0.38161588475176045.
[I 2025-12-06 10:49:40,996] Trial 94 finished with value: 0.3743968003796363 and parameters: {'model_type': 'mlp', 'hidden_dims': '[512, 64]', 'dropout': 0.5772975457383956, 'batch_norm': False, 'lr': 3.0165088309715336e-06, 'weight_decay': 2.5472814754464643e-05, 'epochs': 314, 'loss': 'mae', 'optimizer': 'adam', 'graph_mode': 'off', 'use_snp_selection': False}. Best is trial 21 with value: 0.38161588475176045.
[I 2025-12-06 10:50:53,505] Trial 95 finished with value: 0.37044430818123397 and parameters: {'model_type': 'mlp', 'hidden_dims': '[512, 64]', 'dropout': 0.10796406843787018, 'batch_norm': False, 'lr': 3.6343383131921685e-06, 'weight_decay': 1.3573141333864163e-05, 'epochs': 350, 'loss': 'mae', 'optimizer': 'adam', 'graph_mode': 'off', 'use_snp_selection': False}. Best is trial 21 with value: 0.38161588475176045.
[I 2025-12-06 10:51:14,702] Trial 96 finished with value: 0.37800290909217094 and parameters: {'model_type': 'mlp', 'hidden_dims': '[128, 64]', 'dropout': 0.5319950356689478, 'batch_norm': False, 'lr': 4.395643211381482e-06, 'weight_decay': 8.429501430942324e-05, 'epochs': 302, 'loss': 'mse', 'optimizer': 'adam', 'graph_mode': 'off', 'use_snp_selection': False}. Best is trial 21 with value: 0.38161588475176045.
[I 2025-12-06 10:52:23,395] Trial 97 finished with value: 0.3695657077914982 and parameters: {'model_type': 'mlp', 'hidden_dims': '[512, 64]', 'dropout': 0.5996285487334307, 'batch_norm': False, 'lr': 1.7386942774475155e-06, 'weight_decay': 3.7002428761138783e-06, 'epochs': 333, 'loss': 'mae', 'optimizer': 'adam', 'graph_mode': 'off', 'use_snp_selection': False}. Best is trial 21 with value: 0.38161588475176045.
[I 2025-12-06 10:53:29,867] Trial 98 finished with value: 0.3771272630022387 and parameters: {'model_type': 'mlp', 'hidden_dims': '[512, 256]', 'dropout': 0.5547284152308584, 'batch_norm': False, 'lr': 2.593740287762894e-06, 'weight_decay': 8.715195791868802e-06, 'epochs': 319, 'loss': 'mae', 'optimizer': 'adam', 'graph_mode': 'off', 'use_snp_selection': False}. Best is trial 21 with value: 0.38161588475176045.
[I 2025-12-06 10:54:07,967] Trial 99 finished with value: 0.3523454343735479 and parameters: {'model_type': 'mlp', 'hidden_dims': '[256, 128, 64]', 'dropout': 0.564840849119874, 'batch_norm': False, 'lr': 3.8697074376630254e-05, 'weight_decay': 2.7876758262414834e-06, 'epochs': 340, 'loss': 'mae', 'optimizer': 'adam', 'graph_mode': 'off', 'use_snp_selection': False}. Best is trial 21 with value: 0.38161588475176045.
[I 2025-12-06 10:54:31,004] Trial 100 finished with value: 0.37973960747108226 and parameters: {'model_type': 'mlp', 'hidden_dims': '[128, 64]', 'dropout': 0.5041637912531632, 'batch_norm': False, 'lr': 5.179506052816062e-06, 'weight_decay': 1.0930145623125678e-05, 'epochs': 335, 'loss': 'mse', 'optimizer': 'adam', 'graph_mode': 'off', 'use_snp_selection': False}. Best is trial 21 with value: 0.38161588475176045.
[I 2025-12-06 10:54:53,593] Trial 101 finished with value: 0.38236370223270033 and parameters: {'model_type': 'mlp', 'hidden_dims': '[128, 64]', 'dropout': 0.4834623316982646, 'batch_norm': False, 'lr': 3.1566885319204485e-06, 'weight_decay': 1.0628071137609894e-05, 'epochs': 327, 'loss': 'mse', 'optimizer': 'adam', 'graph_mode': 'off', 'use_snp_selection': False}. Best is trial 101 with value: 0.38236370223270033.
[I 2025-12-06 10:55:16,249] Trial 102 finished with value: 0.38294817444008694 and parameters: {'model_type': 'mlp', 'hidden_dims': '[128, 64]', 'dropout': 0.48977133922285354, 'batch_norm': False, 'lr': 5.146659239916094e-06, 'weight_decay': 5.008312924925831e-06, 'epochs': 328, 'loss': 'mse', 'optimizer': 'adam', 'graph_mode': 'off', 'use_snp_selection': False}. Best is trial 102 with value: 0.38294817444008694.
[I 2025-12-06 10:55:39,918] Trial 103 finished with value: 0.37139713580343153 and parameters: {'model_type': 'mlp', 'hidden_dims': '[128, 64]', 'dropout': 0.48591697716928955, 'batch_norm': False, 'lr': 5.0394218253411775e-06, 'weight_decay': 4.9965636503805836e-06, 'epochs': 344, 'loss': 'mse', 'optimizer': 'adam', 'graph_mode': 'off', 'use_snp_selection': False}. Best is trial 102 with value: 0.38294817444008694.
[I 2025-12-06 10:56:02,360] Trial 104 finished with value: 0.36901115547523744 and parameters: {'model_type': 'mlp', 'hidden_dims': '[128, 64]', 'dropout': 0.5087642817419264, 'batch_norm': False, 'lr': 9.747153409306864e-06, 'weight_decay': 6.375019789015778e-06, 'epochs': 325, 'loss': 'mse', 'optimizer': 'adam', 'graph_mode': 'off', 'use_snp_selection': False}. Best is trial 102 with value: 0.38294817444008694.
[I 2025-12-06 10:56:23,350] Trial 105 finished with value: 0.2628197385867745 and parameters: {'model_type': 'mlp', 'hidden_dims': '[128, 64]', 'dropout': 0.5251687187797571, 'batch_norm': False, 'lr': 9.795074288772368e-05, 'weight_decay': 1.109230092245859e-05, 'epochs': 306, 'loss': 'mse', 'optimizer': 'adam', 'graph_mode': 'off', 'use_snp_selection': False}. Best is trial 102 with value: 0.38294817444008694.
[I 2025-12-06 10:56:45,677] Trial 106 finished with value: 0.3352621633260111 and parameters: {'model_type': 'mlp', 'hidden_dims': '[128, 64]', 'dropout': 0.46478290858066973, 'batch_norm': True, 'lr': 7.907691994255492e-06, 'weight_decay': 7.471100355177916e-06, 'epochs': 317, 'loss': 'mse', 'optimizer': 'adam', 'graph_mode': 'off', 'use_snp_selection': False}. Best is trial 102 with value: 0.38294817444008694.
[I 2025-12-06 10:57:08,291] Trial 107 finished with value: 0.3718208538528863 and parameters: {'model_type': 'mlp', 'hidden_dims': '[128, 64]', 'dropout': 0.44274498430357156, 'batch_norm': False, 'lr': 5.702120645796809e-06, 'weight_decay': 0.0005376547504358452, 'epochs': 326, 'loss': 'mse', 'optimizer': 'adam', 'graph_mode': 'off', 'use_snp_selection': False}. Best is trial 102 with value: 0.38294817444008694.
[I 2025-12-06 10:57:36,248] Trial 108 finished with value: 0.36959823525913327 and parameters: {'model_type': 'mlp', 'hidden_dims': '[128, 64]', 'dropout': 0.4782477819011449, 'batch_norm': False, 'lr': 6.5145588470065134e-06, 'weight_decay': 9.062980896428346e-06, 'epochs': 293, 'loss': 'mse', 'optimizer': 'adam', 'graph_mode': 'off', 'use_snp_selection': True, 'num_snps': 11322}. Best is trial 102 with value: 0.38294817444008694.
[I 2025-12-06 10:57:52,742] Trial 109 finished with value: 0.3817919343375516 and parameters: {'model_type': 'mlp', 'hidden_dims': '[128, 64]', 'dropout': 0.4219760636243896, 'batch_norm': False, 'lr': 3.909715817320653e-06, 'weight_decay': 3.659794905867989e-06, 'epochs': 220, 'loss': 'mse', 'optimizer': 'adam', 'graph_mode': 'off', 'use_snp_selection': False}. Best is trial 102 with value: 0.38294817444008694.
[I 2025-12-06 10:58:08,913] Trial 110 finished with value: 0.37907882194620646 and parameters: {'model_type': 'mlp', 'hidden_dims': '[128, 64]', 'dropout': 0.4277030202812725, 'batch_norm': False, 'lr': 4.0236735309350435e-06, 'weight_decay': 1.745076704343832e-06, 'epochs': 213, 'loss': 'mse', 'optimizer': 'adam', 'graph_mode': 'off', 'use_snp_selection': False}. Best is trial 102 with value: 0.38294817444008694.
[I 2025-12-06 10:58:26,786] Trial 111 finished with value: 0.37826232445297314 and parameters: {'model_type': 'mlp', 'hidden_dims': '[128, 64]', 'dropout': 0.3761425516056113, 'batch_norm': False, 'lr': 3.656660040569268e-06, 'weight_decay': 2.7001769531732662e-06, 'epochs': 243, 'loss': 'mse', 'optimizer': 'adam', 'graph_mode': 'off', 'use_snp_selection': False}. Best is trial 102 with value: 0.38294817444008694.
[I 2025-12-06 10:58:48,556] Trial 112 finished with value: 0.37223006623572247 and parameters: {'model_type': 'mlp', 'hidden_dims': '[128, 64]', 'dropout': 0.5166319329072635, 'batch_norm': False, 'lr': 2.188862829801929e-06, 'weight_decay': 3.8479557727683465e-06, 'epochs': 313, 'loss': 'mse', 'optimizer': 'adam', 'graph_mode': 'off', 'use_snp_selection': False}. Best is trial 102 with value: 0.38294817444008694.
[I 2025-12-06 10:59:01,550] Trial 113 finished with value: 0.3758551567190691 and parameters: {'model_type': 'mlp', 'hidden_dims': '[128, 64]', 'dropout': 0.2790616588036308, 'batch_norm': False, 'lr': 4.568326748856249e-06, 'weight_decay': 4.7790149274156864e-06, 'epochs': 154, 'loss': 'mse', 'optimizer': 'adam', 'graph_mode': 'off', 'use_snp_selection': False}. Best is trial 102 with value: 0.38294817444008694.
[I 2025-12-06 10:59:13,569] Trial 114 finished with value: 0.3610035348250543 and parameters: {'model_type': 'mlp', 'hidden_dims': '[128, 64]', 'dropout': 0.49723076365581703, 'batch_norm': False, 'lr': 2.732964558022016e-06, 'weight_decay': 1.5524735361999364e-05, 'epochs': 137, 'loss': 'mse', 'optimizer': 'adam', 'graph_mode': 'off', 'use_snp_selection': False}. Best is trial 102 with value: 0.38294817444008694.
[I 2025-12-06 10:59:36,808] Trial 115 finished with value: 0.3782678215051001 and parameters: {'model_type': 'mlp', 'hidden_dims': '[128, 64]', 'dropout': 0.5077543758259943, 'batch_norm': False, 'lr': 5.389015236494054e-06, 'weight_decay': 2.3681894385237608e-06, 'epochs': 338, 'loss': 'mse', 'optimizer': 'adam', 'graph_mode': 'off', 'use_snp_selection': False}. Best is trial 102 with value: 0.38294817444008694.
[I 2025-12-06 10:59:51,798] Trial 116 finished with value: 0.36631264992660256 and parameters: {'model_type': 'mlp', 'hidden_dims': '[128, 64]', 'dropout': 0.46877098494091196, 'batch_norm': False, 'lr': 2.46947461813297e-06, 'weight_decay': 6.5752430551959655e-06, 'epochs': 189, 'loss': 'mse', 'optimizer': 'adam', 'graph_mode': 'off', 'use_snp_selection': False}. Best is trial 102 with value: 0.38294817444008694.
[I 2025-12-06 11:00:15,473] Trial 117 finished with value: 0.3769005871820994 and parameters: {'model_type': 'mlp', 'hidden_dims': '[128, 64]', 'dropout': 0.5436058216880278, 'batch_norm': False, 'lr': 3.4482840418639775e-06, 'weight_decay': 1.5531449343085172e-07, 'epochs': 345, 'loss': 'mse', 'optimizer': 'adam', 'graph_mode': 'off', 'use_snp_selection': False}. Best is trial 102 with value: 0.38294817444008694.
[I 2025-12-06 11:01:22,268] Trial 118 finished with value: 0.3832441092397473 and parameters: {'model_type': 'mlp', 'hidden_dims': '[512, 128]', 'dropout': 0.4837087165914742, 'batch_norm': False, 'lr': 1.9162742743168075e-06, 'weight_decay': 3.1213801948968773e-06, 'epochs': 320, 'loss': 'mse', 'optimizer': 'adam', 'graph_mode': 'off', 'use_snp_selection': False}. Best is trial 118 with value: 0.3832441092397473.
[I 2025-12-06 11:01:59,968] Trial 119 finished with value: 0.36779629314583556 and parameters: {'model_type': 'mlp', 'hidden_dims': '[512, 128]', 'dropout': 0.48347437728887777, 'batch_norm': False, 'lr': 1.4599442066714352e-06, 'weight_decay': 3.22931760057153e-06, 'epochs': 169, 'loss': 'mse', 'optimizer': 'adam', 'graph_mode': 'off', 'use_snp_selection': False}. Best is trial 118 with value: 0.3832441092397473.
[I 2025-12-06 11:03:02,844] Trial 120 finished with value: 0.3792092290880194 and parameters: {'model_type': 'mlp', 'hidden_dims': '[512, 128]', 'dropout': 0.5373516288000706, 'batch_norm': False, 'lr': 1.8884941448826068e-06, 'weight_decay': 1.4372940080317015e-06, 'epochs': 301, 'loss': 'mse', 'optimizer': 'adam', 'graph_mode': 'off', 'use_snp_selection': False}. Best is trial 118 with value: 0.3832441092397473.
[I 2025-12-06 11:04:10,771] Trial 121 finished with value: 0.3775533485502164 and parameters: {'model_type': 'mlp', 'hidden_dims': '[512, 128]', 'dropout': 0.45246398722436876, 'batch_norm': False, 'lr': 2.120354456476366e-06, 'weight_decay': 1.2185880139759455e-05, 'epochs': 327, 'loss': 'mse', 'optimizer': 'adam', 'graph_mode': 'off', 'use_snp_selection': False}. Best is trial 118 with value: 0.3832441092397473.
[I 2025-12-06 11:05:14,922] Trial 122 finished with value: 0.35090533603520774 and parameters: {'model_type': 'mlp', 'hidden_dims': '[512, 128]', 'dropout': 0.4982482703490354, 'batch_norm': False, 'lr': 0.00035898653041630717, 'weight_decay': 5.027535699909772e-06, 'epochs': 317, 'loss': 'mse', 'optimizer': 'adam', 'graph_mode': 'off', 'use_snp_selection': False}. Best is trial 118 with value: 0.3832441092397473.
[I 2025-12-06 11:05:36,502] Trial 123 finished with value: 0.35989707896307344 and parameters: {'model_type': 'mlp', 'hidden_dims': '[128, 64]', 'dropout': 0.40017410247155144, 'batch_norm': False, 'lr': 1.1925000707838244e-06, 'weight_decay': 3.557236235837218e-06, 'epochs': 308, 'loss': 'mse', 'optimizer': 'adam', 'graph_mode': 'off', 'use_snp_selection': False}. Best is trial 118 with value: 0.3832441092397473.
[I 2025-12-06 11:06:09,695] Trial 124 finished with value: 0.3807329324503807 and parameters: {'model_type': 'mlp', 'hidden_dims': '[256, 128]', 'dropout': 0.5174551746468974, 'batch_norm': False, 'lr': 2.851222553565985e-06, 'weight_decay': 2.1142077476392798e-06, 'epochs': 285, 'loss': 'mse', 'optimizer': 'adam', 'graph_mode': 'off', 'use_snp_selection': False}. Best is trial 118 with value: 0.3832441092397473.
[I 2025-12-06 11:06:42,905] Trial 125 finished with value: 0.38160294326067706 and parameters: {'model_type': 'mlp', 'hidden_dims': '[256, 128]', 'dropout': 0.5316178639233999, 'batch_norm': False, 'lr': 3.914516190892226e-06, 'weight_decay': 2.0543323105672652e-06, 'epochs': 285, 'loss': 'mse', 'optimizer': 'adam', 'graph_mode': 'off', 'use_snp_selection': False}. Best is trial 118 with value: 0.3832441092397473.
[I 2025-12-06 11:07:15,038] Trial 126 finished with value: 0.3341241173065644 and parameters: {'model_type': 'mlp', 'hidden_dims': '[256, 128]', 'dropout': 0.525505560530353, 'batch_norm': True, 'lr': 4.152284176947765e-06, 'weight_decay': 2.0472368890022903e-06, 'epochs': 272, 'loss': 'mse', 'optimizer': 'adam', 'graph_mode': 'off', 'use_snp_selection': False}. Best is trial 118 with value: 0.3832441092397473.
[I 2025-12-06 11:07:48,290] Trial 127 finished with value: 0.3816499181661796 and parameters: {'model_type': 'mlp', 'hidden_dims': '[256, 128]', 'dropout': 0.5091088539049954, 'batch_norm': False, 'lr': 2.9307155441277065e-06, 'weight_decay': 2.5384344321143415e-06, 'epochs': 285, 'loss': 'mse', 'optimizer': 'adam', 'graph_mode': 'off', 'use_snp_selection': False}. Best is trial 118 with value: 0.3832441092397473.
[I 2025-12-06 11:08:21,413] Trial 128 finished with value: 0.37645167532930435 and parameters: {'model_type': 'mlp', 'hidden_dims': '[256, 128]', 'dropout': 0.5156721153124403, 'batch_norm': False, 'lr': 2.9561174411627955e-06, 'weight_decay': 1.0959082931059027e-06, 'epochs': 283, 'loss': 'mse', 'optimizer': 'adam', 'graph_mode': 'off', 'use_snp_selection': False}. Best is trial 118 with value: 0.3832441092397473.
[I 2025-12-06 11:09:19,845] Trial 129 finished with value: 0.3721761233370381 and parameters: {'model_type': 'mlp', 'hidden_dims': '[256, 128]', 'dropout': 0.5345363654888412, 'batch_norm': False, 'lr': 1.636529059324413e-06, 'weight_decay': 2.6086761372932024e-06, 'epochs': 277, 'loss': 'mse', 'optimizer': 'adam', 'graph_mode': 'off', 'use_snp_selection': True, 'num_snps': 51837}. Best is trial 118 with value: 0.3832441092397473.
[I 2025-12-06 11:09:49,674] Trial 130 finished with value: 0.3780707995853193 and parameters: {'model_type': 'mlp', 'hidden_dims': '[256, 128]', 'dropout': 0.4198436018134722, 'batch_norm': False, 'lr': 3.2382345003190345e-06, 'weight_decay': 1.7620528240842124e-06, 'epochs': 253, 'loss': 'mse', 'optimizer': 'adam', 'graph_mode': 'off', 'use_snp_selection': False}. Best is trial 118 with value: 0.3832441092397473.
