[I 2025-12-05 15:05:39,416] Trial 147 finished with value: 0.07088796391701549 and parameters: {'model_type': 'mlp', 'hidden_dims': '[256, 128]', 'dropout': 0.13528505296677526, 'batch_norm': True, 'lr': 0.00020715436166082182, 'weight_decay': 2.1425679211912995e-06, 'epochs': 301, 'loss': 'mse', 'optimizer': 'adam', 'graph_mode': 'off', 'use_snp_selection': False}. Best is trial 31 with value: 0.09732593083060198.
[I 2025-12-05 15:05:40,631] Trial 148 finished with value: 0.0739124909236866 and parameters: {'model_type': 'mlp', 'hidden_dims': '[256, 128]', 'dropout': 0.16814965160300557, 'batch_norm': True, 'lr': 0.00014888236152687647, 'weight_decay': 1.5385632459057047e-06, 'epochs': 280, 'loss': 'mse', 'optimizer': 'adam', 'graph_mode': 'off', 'use_snp_selection': False}. Best is trial 31 with value: 0.09732593083060198.
[I 2025-12-05 15:05:41,812] Trial 149 finished with value: 0.06983268647834948 and parameters: {'model_type': 'mlp', 'hidden_dims': '[256, 128]', 'dropout': 0.1287610994894497, 'batch_norm': True, 'lr': 0.0002493183357833518, 'weight_decay': 4.472201661175132e-06, 'epochs': 264, 'loss': 'mse', 'optimizer': 'adam', 'graph_mode': 'off', 'use_snp_selection': False}. Best is trial 31 with value: 0.09732593083060198.
[I 2025-12-05 15:05:56,753] Trial 0 finished with value: -0.033175829212116204 and parameters: {'model_type': 'mlp', 'hidden_dims': '[128, 64]', 'dropout': 0.199031432379812, 'batch_norm': True, 'lr': 1.8408544111075837e-06, 'weight_decay': 5.5136510071208614e-05, 'epochs': 336, 'loss': 'mae', 'optimizer': 'adam', 'graph_mode': 'off', 'use_snp_selection': True, 'num_snps': 43862}. Best is trial 0 with value: -0.033175829212116204.
[I 2025-12-05 15:05:57,782] Trial 1 finished with value: 0.045573853923043944 and parameters: {'model_type': 'mlp', 'hidden_dims': '[256, 128]', 'dropout': 0.4370668075331726, 'batch_norm': True, 'lr': 7.133471581159139e-05, 'weight_decay': 1.128633586803549e-05, 'epochs': 242, 'loss': 'mae', 'optimizer': 'adam', 'graph_mode': 'off', 'use_snp_selection': False}. Best is trial 1 with value: 0.045573853923043944.
[I 2025-12-05 15:05:58,726] Trial 2 finished with value: -0.009424848011186268 and parameters: {'model_type': 'mlp', 'hidden_dims': '[256, 128, 64]', 'dropout': 0.41314357415569625, 'batch_norm': False, 'lr': 3.952233718592101e-06, 'weight_decay': 0.00026754769258252603, 'epochs': 149, 'loss': 'mse', 'optimizer': 'adam', 'graph_mode': 'off', 'use_snp_selection': True, 'num_snps': 11571}. Best is trial 1 with value: 0.045573853923043944.
[I 2025-12-05 15:06:00,454] Trial 3 finished with value: 0.017781580560666786 and parameters: {'model_type': 'mlp', 'hidden_dims': '[512, 64]', 'dropout': 0.5938127374509361, 'batch_norm': False, 'lr': 5.67704586114731e-06, 'weight_decay': 2.4518087630137052e-05, 'epochs': 320, 'loss': 'mae', 'optimizer': 'adam', 'graph_mode': 'off', 'use_snp_selection': False}. Best is trial 1 with value: 0.045573853923043944.
[I 2025-12-05 15:06:02,528] Trial 4 finished with value: 0.010683750194371403 and parameters: {'model_type': 'mlp', 'hidden_dims': '[512, 128]', 'dropout': 0.25746343592134413, 'batch_norm': True, 'lr': 1.3467657668402788e-06, 'weight_decay': 0.00033087251918647806, 'epochs': 277, 'loss': 'mse', 'optimizer': 'adam', 'graph_mode': 'off', 'use_snp_selection': True, 'num_snps': 36675}. Best is trial 1 with value: 0.045573853923043944.
[I 2025-12-05 15:06:04,339] Trial 5 finished with value: 0.017224206873168717 and parameters: {'model_type': 'mlp', 'hidden_dims': '[512, 64]', 'dropout': 0.38275350994408375, 'batch_norm': True, 'lr': 1.5586664309232824e-06, 'weight_decay': 0.0008227664668621182, 'epochs': 145, 'loss': 'mae', 'optimizer': 'adam', 'graph_mode': 'off', 'use_snp_selection': True, 'num_snps': 32148}. Best is trial 1 with value: 0.045573853923043944.
[I 2025-12-05 15:06:05,339] Trial 6 finished with value: 0.025809128938987125 and parameters: {'model_type': 'mlp', 'hidden_dims': '[256, 128]', 'dropout': 0.3930109900265879, 'batch_norm': False, 'lr': 4.892964372128395e-05, 'weight_decay': 1.5809549317992182e-06, 'epochs': 199, 'loss': 'mse', 'optimizer': 'adam', 'graph_mode': 'off', 'use_snp_selection': False}. Best is trial 1 with value: 0.045573853923043944.
[I 2025-12-05 15:06:06,431] Trial 7 finished with value: 0.06849006976606355 and parameters: {'model_type': 'mlp', 'hidden_dims': '[512, 256]', 'dropout': 0.15343979219678458, 'batch_norm': True, 'lr': 6.234003099047341e-05, 'weight_decay': 3.894760610535477e-07, 'epochs': 97, 'loss': 'mse', 'optimizer': 'adam', 'graph_mode': 'off', 'use_snp_selection': False}. Best is trial 7 with value: 0.06849006976606355.
[I 2025-12-05 15:06:08,206] Trial 8 finished with value: 0.07187096242970704 and parameters: {'model_type': 'mlp', 'hidden_dims': '[512, 128]', 'dropout': 0.10743001231661406, 'batch_norm': True, 'lr': 0.00023728538449271062, 'weight_decay': 1.7629071578048637e-05, 'epochs': 312, 'loss': 'mae', 'optimizer': 'adam', 'graph_mode': 'off', 'use_snp_selection': False}. Best is trial 8 with value: 0.07187096242970704.
[I 2025-12-05 15:06:09,537] Trial 9 finished with value: 0.03479492297172253 and parameters: {'model_type': 'mlp', 'hidden_dims': '[512, 64]', 'dropout': 0.14505336736221927, 'batch_norm': True, 'lr': 5.8619638388111826e-05, 'weight_decay': 6.200156172669308e-07, 'epochs': 175, 'loss': 'mse', 'optimizer': 'adam', 'graph_mode': 'off', 'use_snp_selection': False}. Best is trial 8 with value: 0.07187096242970704.
[I 2025-12-05 15:06:10,499] Trial 10 finished with value: 0.010795939613169988 and parameters: {'model_type': 'mlp', 'hidden_dims': '[512, 128]', 'dropout': 0.2800030442581858, 'batch_norm': False, 'lr': 0.0004919806695968258, 'weight_decay': 2.9953888095455486e-06, 'epochs': 55, 'loss': 'mae', 'optimizer': 'adam', 'graph_mode': 'off', 'use_snp_selection': False}. Best is trial 8 with value: 0.07187096242970704.
[I 2025-12-05 15:06:11,477] Trial 11 finished with value: 0.05888251245760986 and parameters: {'model_type': 'mlp', 'hidden_dims': '[512, 256]', 'dropout': 0.10095648685224448, 'batch_norm': True, 'lr': 0.0003926892266729099, 'weight_decay': 3.172181990533228e-07, 'epochs': 70, 'loss': 'mse', 'optimizer': 'adam', 'graph_mode': 'off', 'use_snp_selection': False}. Best is trial 8 with value: 0.07187096242970704.
[I 2025-12-05 15:06:12,579] Trial 12 finished with value: 0.07559804601462491 and parameters: {'model_type': 'mlp', 'hidden_dims': '[512, 256]', 'dropout': 0.18206399419301494, 'batch_norm': True, 'lr': 0.00026576228959612443, 'weight_decay': 1.3081036432574914e-07, 'epochs': 115, 'loss': 'mae', 'optimizer': 'adam', 'graph_mode': 'off', 'use_snp_selection': False}. Best is trial 12 with value: 0.07559804601462491.
[I 2025-12-05 15:06:14,070] Trial 13 finished with value: 0.04856652974048546 and parameters: {'model_type': 'mlp', 'hidden_dims': '[512, 128]', 'dropout': 0.24979042359621412, 'batch_norm': True, 'lr': 0.00020263148232071683, 'weight_decay': 1.0885943577911259e-07, 'epochs': 237, 'loss': 'mae', 'optimizer': 'adam', 'graph_mode': 'off', 'use_snp_selection': False}. Best is trial 12 with value: 0.07559804601462491.
[I 2025-12-05 15:06:15,180] Trial 14 finished with value: 0.05980989777742993 and parameters: {'model_type': 'mlp', 'hidden_dims': '[512, 256]', 'dropout': 0.20199016384833104, 'batch_norm': True, 'lr': 0.0008727274377671657, 'weight_decay': 4.57067734295802e-06, 'epochs': 117, 'loss': 'mae', 'optimizer': 'adam', 'graph_mode': 'off', 'use_snp_selection': False}. Best is trial 12 with value: 0.07559804601462491.
[I 2025-12-05 15:06:16,149] Trial 15 finished with value: 0.054235993507049746 and parameters: {'model_type': 'mlp', 'hidden_dims': '[128, 64]', 'dropout': 0.10283653531299912, 'batch_norm': True, 'lr': 0.0001637201916360417, 'weight_decay': 6.682546297843178e-05, 'epochs': 279, 'loss': 'mae', 'optimizer': 'adam', 'graph_mode': 'off', 'use_snp_selection': False}. Best is trial 12 with value: 0.07559804601462491.
[I 2025-12-05 15:06:17,143] Trial 16 finished with value: 0.00261014801922957 and parameters: {'model_type': 'mlp', 'hidden_dims': '[256, 128, 64]', 'dropout': 0.3274562584588828, 'batch_norm': True, 'lr': 1.2586985041154999e-05, 'weight_decay': 1.110237718300656e-05, 'epochs': 206, 'loss': 'mae', 'optimizer': 'adam', 'graph_mode': 'off', 'use_snp_selection': False}. Best is trial 12 with value: 0.07559804601462491.
[I 2025-12-05 15:06:19,048] Trial 17 finished with value: 0.03803191735897529 and parameters: {'model_type': 'mlp', 'hidden_dims': '[512, 256]', 'dropout': 0.49623865198086836, 'batch_norm': True, 'lr': 2.0796451568787424e-05, 'weight_decay': 1.3398043894594233e-06, 'epochs': 349, 'loss': 'mae', 'optimizer': 'adam', 'graph_mode': 'off', 'use_snp_selection': False}. Best is trial 12 with value: 0.07559804601462491.
[I 2025-12-05 15:06:21,876] Trial 18 finished with value: 0.045873131827704416 and parameters: {'model_type': 'mlp', 'hidden_dims': '[512, 128]', 'dropout': 0.1891689819028744, 'batch_norm': False, 'lr': 0.00017553303054964982, 'weight_decay': 5.1284909832915915e-05, 'epochs': 108, 'loss': 'mae', 'optimizer': 'adam', 'graph_mode': 'off', 'use_snp_selection': True, 'num_snps': 58241}. Best is trial 12 with value: 0.07559804601462491.
[I 2025-12-05 15:06:23,598] Trial 19 finished with value: 0.0574856354019396 and parameters: {'model_type': 'mlp', 'hidden_dims': '[512, 128]', 'dropout': 0.32512689397564026, 'batch_norm': True, 'lr': 0.0008651287964196489, 'weight_decay': 1.1354159408743119e-07, 'epochs': 299, 'loss': 'mae', 'optimizer': 'adam', 'graph_mode': 'off', 'use_snp_selection': False}. Best is trial 12 with value: 0.07559804601462491.
[I 2025-12-05 15:06:25,111] Trial 20 finished with value: 0.07219870172277854 and parameters: {'model_type': 'mlp', 'hidden_dims': '[512, 256]', 'dropout': 0.15290873965094975, 'batch_norm': True, 'lr': 0.00034316141989935886, 'weight_decay': 6.421600743942308e-06, 'epochs': 234, 'loss': 'mae', 'optimizer': 'adam', 'graph_mode': 'off', 'use_snp_selection': False}. Best is trial 12 with value: 0.07559804601462491.
[I 2025-12-05 15:06:26,623] Trial 21 finished with value: 0.05754006399202145 and parameters: {'model_type': 'mlp', 'hidden_dims': '[512, 256]', 'dropout': 0.1572758142894234, 'batch_norm': True, 'lr': 0.0003220302703634065, 'weight_decay': 4.516396654407151e-06, 'epochs': 242, 'loss': 'mae', 'optimizer': 'adam', 'graph_mode': 'off', 'use_snp_selection': False}. Best is trial 12 with value: 0.07559804601462491.
[I 2025-12-05 15:06:28,232] Trial 22 finished with value: 0.06430644172256927 and parameters: {'model_type': 'mlp', 'hidden_dims': '[512, 256]', 'dropout': 0.22501703798719674, 'batch_norm': True, 'lr': 0.00012468048418240614, 'weight_decay': 2.6460189439986722e-05, 'epochs': 272, 'loss': 'mae', 'optimizer': 'adam', 'graph_mode': 'off', 'use_snp_selection': False}. Best is trial 12 with value: 0.07559804601462491.
[I 2025-12-05 15:06:29,514] Trial 23 finished with value: 0.04921333620350801 and parameters: {'model_type': 'mlp', 'hidden_dims': '[512, 256]', 'dropout': 0.1342291012775216, 'batch_norm': True, 'lr': 0.0003016140254855497, 'weight_decay': 0.00014061128063276327, 'epochs': 170, 'loss': 'mae', 'optimizer': 'adam', 'graph_mode': 'off', 'use_snp_selection': False}. Best is trial 12 with value: 0.07559804601462491.
[I 2025-12-05 15:06:31,265] Trial 24 finished with value: 0.054383375131722034 and parameters: {'model_type': 'mlp', 'hidden_dims': '[512, 256]', 'dropout': 0.2888791825656241, 'batch_norm': True, 'lr': 0.0006318776897745238, 'weight_decay': 2.452926438785395e-05, 'epochs': 317, 'loss': 'mae', 'optimizer': 'adam', 'graph_mode': 'off', 'use_snp_selection': False}. Best is trial 12 with value: 0.07559804601462491.
[I 2025-12-05 15:06:32,317] Trial 25 finished with value: 0.03765173536558026 and parameters: {'model_type': 'mlp', 'hidden_dims': '[256, 128, 64]', 'dropout': 0.17498899805187623, 'batch_norm': True, 'lr': 0.0001134889437129769, 'weight_decay': 1.0077734665942408e-06, 'epochs': 205, 'loss': 'mae', 'optimizer': 'adam', 'graph_mode': 'off', 'use_snp_selection': False}. Best is trial 12 with value: 0.07559804601462491.
[I 2025-12-05 15:06:33,257] Trial 26 finished with value: 0.01756278178046663 and parameters: {'model_type': 'mlp', 'hidden_dims': '[256, 128]', 'dropout': 0.10103049226235053, 'batch_norm': True, 'lr': 3.429396224740179e-05, 'weight_decay': 6.794743982446368e-06, 'epochs': 229, 'loss': 'mae', 'optimizer': 'adam', 'graph_mode': 'off', 'use_snp_selection': True, 'num_snps': 3842}. Best is trial 12 with value: 0.07559804601462491.
[I 2025-12-05 15:06:34,171] Trial 27 finished with value: 0.04412598235590157 and parameters: {'model_type': 'mlp', 'hidden_dims': '[128, 64]', 'dropout': 0.22162739631377104, 'batch_norm': False, 'lr': 0.00023987185146267975, 'weight_decay': 2.0714338284224234e-07, 'epochs': 258, 'loss': 'mae', 'optimizer': 'adam', 'graph_mode': 'off', 'use_snp_selection': False}. Best is trial 12 with value: 0.07559804601462491.
[I 2025-12-05 15:06:35,886] Trial 28 finished with value: 0.06620640659028935 and parameters: {'model_type': 'mlp', 'hidden_dims': '[512, 128]', 'dropout': 0.1332379625574864, 'batch_norm': True, 'lr': 0.00011955193262015558, 'weight_decay': 2.514709491070378e-06, 'epochs': 295, 'loss': 'mae', 'optimizer': 'adam', 'graph_mode': 'off', 'use_snp_selection': False}. Best is trial 12 with value: 0.07559804601462491.
[I 2025-12-05 15:06:37,015] Trial 29 finished with value: 0.06037978722345905 and parameters: {'model_type': 'mlp', 'hidden_dims': '[128, 64]', 'dropout': 0.19749843321430682, 'batch_norm': True, 'lr': 0.0005388560200940643, 'weight_decay': 7.556740997596572e-05, 'epochs': 82, 'loss': 'mae', 'optimizer': 'adam', 'graph_mode': 'off', 'use_snp_selection': True, 'num_snps': 19468}. Best is trial 12 with value: 0.07559804601462491.
[I 2025-12-05 15:06:38,281] Trial 30 finished with value: 0.06686946162393531 and parameters: {'model_type': 'mlp', 'hidden_dims': '[512, 256]', 'dropout': 0.23221586268208888, 'batch_norm': True, 'lr': 2.297385530080997e-05, 'weight_decay': 1.1590042917723792e-05, 'epochs': 152, 'loss': 'mae', 'optimizer': 'adam', 'graph_mode': 'off', 'use_snp_selection': False}. Best is trial 12 with value: 0.07559804601462491.
[I 2025-12-05 15:06:39,366] Trial 31 finished with value: 0.049670242717421896 and parameters: {'model_type': 'mlp', 'hidden_dims': '[512, 256]', 'dropout': 0.1669482112513782, 'batch_norm': True, 'lr': 8.22514709690265e-05, 'weight_decay': 3.908691211658035e-07, 'epochs': 93, 'loss': 'mse', 'optimizer': 'adam', 'graph_mode': 'off', 'use_snp_selection': False}. Best is trial 12 with value: 0.07559804601462491.
[I 2025-12-05 15:06:40,552] Trial 32 finished with value: 0.06885249558335359 and parameters: {'model_type': 'mlp', 'hidden_dims': '[512, 256]', 'dropout': 0.13315376929807857, 'batch_norm': True, 'lr': 7.908504796345224e-05, 'weight_decay': 2.3734130698417656e-07, 'epochs': 124, 'loss': 'mse', 'optimizer': 'adam', 'graph_mode': 'off', 'use_snp_selection': False}. Best is trial 12 with value: 0.07559804601462491.
[I 2025-12-05 15:06:41,772] Trial 33 finished with value: 0.05391688143855442 and parameters: {'model_type': 'mlp', 'hidden_dims': '[512, 256]', 'dropout': 0.12675256597286702, 'batch_norm': True, 'lr': 0.00029319426055322097, 'weight_decay': 2.382493489308081e-07, 'epochs': 139, 'loss': 'mse', 'optimizer': 'adam', 'graph_mode': 'off', 'use_snp_selection': False}. Best is trial 12 with value: 0.07559804601462491.
[I 2025-12-05 15:06:42,474] Trial 34 finished with value: 0.032891194436088594 and parameters: {'model_type': 'mlp', 'hidden_dims': '[256, 128]', 'dropout': 0.4776495763450488, 'batch_norm': True, 'lr': 8.828403853386392e-05, 'weight_decay': 6.655216179361728e-07, 'epochs': 42, 'loss': 'mse', 'optimizer': 'adam', 'graph_mode': 'off', 'use_snp_selection': False}. Best is trial 12 with value: 0.07559804601462491.
[I 2025-12-05 15:06:43,803] Trial 35 finished with value: 0.033508275838604724 and parameters: {'model_type': 'mlp', 'hidden_dims': '[512, 256]', 'dropout': 0.18900709457237921, 'batch_norm': False, 'lr': 0.00017791311354867724, 'weight_decay': 1.775960718978503e-07, 'epochs': 177, 'loss': 'mse', 'optimizer': 'adam', 'graph_mode': 'off', 'use_snp_selection': False}. Best is trial 12 with value: 0.07559804601462491.
[I 2025-12-05 15:06:46,716] Trial 36 finished with value: 0.07683981704169063 and parameters: {'model_type': 'mlp', 'hidden_dims': '[512, 64]', 'dropout': 0.12060536200485662, 'batch_norm': True, 'lr': 0.00042216903857515285, 'weight_decay': 6.174208486365945e-07, 'epochs': 126, 'loss': 'mse', 'optimizer': 'adam', 'graph_mode': 'off', 'use_snp_selection': True, 'num_snps': 58661}. Best is trial 36 with value: 0.07683981704169063.
[I 2025-12-05 15:06:49,780] Trial 37 finished with value: 0.032686683008051734 and parameters: {'model_type': 'mlp', 'hidden_dims': '[512, 64]', 'dropout': 0.5577166321087161, 'batch_norm': True, 'lr': 2.814873948011466e-06, 'weight_decay': 1.6954746920911857e-05, 'epochs': 221, 'loss': 'mse', 'optimizer': 'adam', 'graph_mode': 'off', 'use_snp_selection': True, 'num_snps': 57733}. Best is trial 36 with value: 0.07683981704169063.
[I 2025-12-05 15:06:52,220] Trial 38 finished with value: 0.004641194270876671 and parameters: {'model_type': 'mlp', 'hidden_dims': '[512, 64]', 'dropout': 0.26827308516327136, 'batch_norm': False, 'lr': 0.0009810951612943938, 'weight_decay': 6.481271149094209e-07, 'epochs': 162, 'loss': 'mae', 'optimizer': 'adam', 'graph_mode': 'off', 'use_snp_selection': True, 'num_snps': 46312}. Best is trial 36 with value: 0.07683981704169063.
[I 2025-12-05 15:06:53,484] Trial 39 finished with value: 0.06683064173810979 and parameters: {'model_type': 'mlp', 'hidden_dims': '[512, 64]', 'dropout': 0.166687062457023, 'batch_norm': True, 'lr': 0.0005900186682258454, 'weight_decay': 3.812605343750628e-05, 'epochs': 129, 'loss': 'mse', 'optimizer': 'adam', 'graph_mode': 'off', 'use_snp_selection': True, 'num_snps': 19621}. Best is trial 36 with value: 0.07683981704169063.
[I 2025-12-05 15:06:56,414] Trial 40 finished with value: 0.07556012190686057 and parameters: {'model_type': 'mlp', 'hidden_dims': '[512, 64]', 'dropout': 0.11928493872319151, 'batch_norm': True, 'lr': 0.0004471348429475609, 'weight_decay': 1.91850971273646e-06, 'epochs': 324, 'loss': 'mae', 'optimizer': 'adam', 'graph_mode': 'off', 'use_snp_selection': True, 'num_snps': 46840}. Best is trial 36 with value: 0.07683981704169063.
[I 2025-12-05 15:06:59,212] Trial 41 finished with value: 0.07328137392929233 and parameters: {'model_type': 'mlp', 'hidden_dims': '[512, 64]', 'dropout': 0.12137873053262083, 'batch_norm': True, 'lr': 0.0004179044835268601, 'weight_decay': 1.78602495684712e-06, 'epochs': 331, 'loss': 'mae', 'optimizer': 'adam', 'graph_mode': 'off', 'use_snp_selection': True, 'num_snps': 47385}. Best is trial 36 with value: 0.07683981704169063.
[I 2025-12-05 15:07:02,279] Trial 42 finished with value: 0.061786638568029795 and parameters: {'model_type': 'mlp', 'hidden_dims': '[512, 64]', 'dropout': 0.12611294300561585, 'batch_norm': True, 'lr': 0.0004511673344004976, 'weight_decay': 2.1078450406491015e-06, 'epochs': 344, 'loss': 'mae', 'optimizer': 'adam', 'graph_mode': 'off', 'use_snp_selection': True, 'num_snps': 50300}. Best is trial 36 with value: 0.07683981704169063.
[I 2025-12-05 15:07:05,337] Trial 43 finished with value: 0.05492355595785801 and parameters: {'model_type': 'mlp', 'hidden_dims': '[512, 64]', 'dropout': 0.1492069330284975, 'batch_norm': True, 'lr': 0.0003826572588090816, 'weight_decay': 1.1948033992055733e-06, 'epochs': 321, 'loss': 'mae', 'optimizer': 'adam', 'graph_mode': 'off', 'use_snp_selection': True, 'num_snps': 53398}. Best is trial 36 with value: 0.07683981704169063.
[I 2025-12-05 15:07:07,826] Trial 44 finished with value: 0.058036109082748935 and parameters: {'model_type': 'mlp', 'hidden_dims': '[512, 64]', 'dropout': 0.2043955099503303, 'batch_norm': True, 'lr': 0.0007127350335053921, 'weight_decay': 3.936162098534061e-06, 'epochs': 337, 'loss': 'mae', 'optimizer': 'adam', 'graph_mode': 'off', 'use_snp_selection': True, 'num_snps': 40021}. Best is trial 36 with value: 0.07683981704169063.
[I 2025-12-05 15:07:10,704] Trial 45 finished with value: 0.07013973195907569 and parameters: {'model_type': 'mlp', 'hidden_dims': '[512, 64]', 'dropout': 0.17411882824422822, 'batch_norm': True, 'lr': 0.0002453353157356347, 'weight_decay': 6.776646320355274e-06, 'epochs': 258, 'loss': 'mae', 'optimizer': 'adam', 'graph_mode': 'off', 'use_snp_selection': True, 'num_snps': 50482}. Best is trial 36 with value: 0.07683981704169063.
[I 2025-12-05 15:07:13,996] Trial 46 finished with value: 0.0579532979624893 and parameters: {'model_type': 'mlp', 'hidden_dims': '[512, 64]', 'dropout': 0.11793454412433486, 'batch_norm': True, 'lr': 0.00039099214608622786, 'weight_decay': 8.354211366551791e-07, 'epochs': 307, 'loss': 'mse', 'optimizer': 'adam', 'graph_mode': 'off', 'use_snp_selection': True, 'num_snps': 59867}. Best is trial 36 with value: 0.07683981704169063.
[I 2025-12-05 15:07:16,818] Trial 47 finished with value: 0.0009106232768166954 and parameters: {'model_type': 'mlp', 'hidden_dims': '[512, 64]', 'dropout': 0.1521697886939366, 'batch_norm': False, 'lr': 5.70810507599828e-06, 'weight_decay': 4.1555755707823374e-07, 'epochs': 330, 'loss': 'mae', 'optimizer': 'adam', 'graph_mode': 'off', 'use_snp_selection': True, 'num_snps': 45299}. Best is trial 36 with value: 0.07683981704169063.
