[I 2025-12-05 15:33:46,274] Trial 124 finished with value: 0.0919002565415047 and parameters: {'model_type': 'mlp', 'hidden_dims': '[512, 128]', 'dropout': 0.1283366319680987, 'batch_norm': True, 'lr': 0.00023197309352797373, 'weight_decay': 2.7635839089962306e-05, 'epochs': 116, 'loss': 'mae', 'optimizer': 'adam', 'graph_mode': 'off', 'use_snp_selection': False}. Best is trial 54 with value: 0.11315491601227236.
[I 2025-12-05 15:33:47,888] Trial 125 finished with value: 0.0720667074197859 and parameters: {'model_type': 'mlp', 'hidden_dims': '[256, 128, 64]', 'dropout': 0.1691166113478688, 'batch_norm': True, 'lr': 0.00013100350824467278, 'weight_decay': 1.1228135363329705e-05, 'epochs': 317, 'loss': 'mae', 'optimizer': 'adam', 'graph_mode': 'off', 'use_snp_selection': True, 'num_snps': 12134}. Best is trial 54 with value: 0.11315491601227236.
[I 2025-12-05 15:33:49,519] Trial 126 finished with value: 0.06376606544941583 and parameters: {'model_type': 'mlp', 'hidden_dims': '[512, 64]', 'dropout': 0.11620260785018088, 'batch_norm': True, 'lr': 0.00016831834659616736, 'weight_decay': 7.96207631362845e-05, 'epochs': 154, 'loss': 'mae', 'optimizer': 'adam', 'graph_mode': 'off', 'use_snp_selection': False}. Best is trial 54 with value: 0.11315491601227236.
[I 2025-12-05 15:33:50,748] Trial 127 finished with value: 0.0762824481267162 and parameters: {'model_type': 'mlp', 'hidden_dims': '[512, 256]', 'dropout': 0.15211413791676726, 'batch_norm': True, 'lr': 2.4748256143653608e-05, 'weight_decay': 1.8099637215045426e-05, 'epochs': 80, 'loss': 'mae', 'optimizer': 'adam', 'graph_mode': 'off', 'use_snp_selection': False}. Best is trial 54 with value: 0.11315491601227236.
[I 2025-12-05 15:33:51,859] Trial 128 finished with value: 0.10271190191466542 and parameters: {'model_type': 'mlp', 'hidden_dims': '[512, 128]', 'dropout': 0.13929635187318176, 'batch_norm': True, 'lr': 0.0003059360823895319, 'weight_decay': 3.624933136644522e-05, 'epochs': 62, 'loss': 'mae', 'optimizer': 'adam', 'graph_mode': 'off', 'use_snp_selection': False}. Best is trial 54 with value: 0.11315491601227236.
[I 2025-12-05 15:33:53,044] Trial 129 finished with value: 0.09240226195976192 and parameters: {'model_type': 'mlp', 'hidden_dims': '[512, 128]', 'dropout': 0.1596379493076605, 'batch_norm': True, 'lr': 0.00029703046923083696, 'weight_decay': 3.675274641817976e-05, 'epochs': 70, 'loss': 'mae', 'optimizer': 'adam', 'graph_mode': 'off', 'use_snp_selection': False}. Best is trial 54 with value: 0.11315491601227236.
[I 2025-12-05 15:33:54,109] Trial 130 finished with value: 0.07054905661350257 and parameters: {'model_type': 'mlp', 'hidden_dims': '[512, 128]', 'dropout': 0.18676283030576657, 'batch_norm': True, 'lr': 0.00033600258907876636, 'weight_decay': 6.016394590310722e-05, 'epochs': 53, 'loss': 'mse', 'optimizer': 'adam', 'graph_mode': 'off', 'use_snp_selection': False}. Best is trial 54 with value: 0.11315491601227236.
[I 2025-12-05 15:33:55,246] Trial 131 finished with value: 0.08173703937871807 and parameters: {'model_type': 'mlp', 'hidden_dims': '[512, 128]', 'dropout': 0.1633138873676372, 'batch_norm': True, 'lr': 0.00026683917622643584, 'weight_decay': 4.88414707622062e-05, 'epochs': 60, 'loss': 'mae', 'optimizer': 'adam', 'graph_mode': 'off', 'use_snp_selection': False}. Best is trial 54 with value: 0.11315491601227236.
[I 2025-12-05 15:33:56,456] Trial 132 finished with value: 0.08656842580064726 and parameters: {'model_type': 'mlp', 'hidden_dims': '[512, 128]', 'dropout': 0.13478302513236037, 'batch_norm': True, 'lr': 0.00030302098034363785, 'weight_decay': 3.5011261299195525e-05, 'epochs': 69, 'loss': 'mae', 'optimizer': 'adam', 'graph_mode': 'off', 'use_snp_selection': False}. Best is trial 54 with value: 0.11315491601227236.
[I 2025-12-05 15:33:57,681] Trial 133 finished with value: 0.09304115478928941 and parameters: {'model_type': 'mlp', 'hidden_dims': '[512, 128]', 'dropout': 0.17556187128549303, 'batch_norm': True, 'lr': 0.00019844606445506343, 'weight_decay': 2.9907857023202802e-05, 'epochs': 71, 'loss': 'mae', 'optimizer': 'adam', 'graph_mode': 'off', 'use_snp_selection': False}. Best is trial 54 with value: 0.11315491601227236.
[I 2025-12-05 15:33:58,991] Trial 134 finished with value: 0.08683875104654473 and parameters: {'model_type': 'mlp', 'hidden_dims': '[512, 128]', 'dropout': 0.17538531303361796, 'batch_norm': True, 'lr': 0.00020007142899678654, 'weight_decay': 2.349731860297364e-05, 'epochs': 86, 'loss': 'mae', 'optimizer': 'adam', 'graph_mode': 'off', 'use_snp_selection': False}. Best is trial 54 with value: 0.11315491601227236.
[I 2025-12-05 15:33:59,855] Trial 135 finished with value: 0.07856180692498521 and parameters: {'model_type': 'mlp', 'hidden_dims': '[256, 128, 64]', 'dropout': 0.14532318227292124, 'batch_norm': True, 'lr': 0.00022047198815055853, 'weight_decay': 1.7270737279254627e-07, 'epochs': 61, 'loss': 'mae', 'optimizer': 'adam', 'graph_mode': 'off', 'use_snp_selection': False}. Best is trial 54 with value: 0.11315491601227236.
[I 2025-12-05 15:34:01,106] Trial 136 finished with value: 0.061560698749246426 and parameters: {'model_type': 'mlp', 'hidden_dims': '[512, 256]', 'dropout': 0.12577093956969773, 'batch_norm': True, 'lr': 1.795992533130186e-05, 'weight_decay': 3.141611475492287e-05, 'epochs': 77, 'loss': 'mae', 'optimizer': 'adam', 'graph_mode': 'off', 'use_snp_selection': False}. Best is trial 54 with value: 0.11315491601227236.
[I 2025-12-05 15:34:02,160] Trial 137 finished with value: 0.03964228328341045 and parameters: {'model_type': 'mlp', 'hidden_dims': '[512, 128]', 'dropout': 0.11153419008765622, 'batch_norm': False, 'lr': 0.00046907281235368195, 'weight_decay': 1.768795254373795e-06, 'epochs': 44, 'loss': 'mae', 'optimizer': 'adam', 'graph_mode': 'off', 'use_snp_selection': False}. Best is trial 54 with value: 0.11315491601227236.
[I 2025-12-05 15:34:03,091] Trial 138 finished with value: 0.08470427718952009 and parameters: {'model_type': 'mlp', 'hidden_dims': '[256, 128]', 'dropout': 0.19152295076618825, 'batch_norm': True, 'lr': 0.00038621018060795514, 'weight_decay': 1.254103097700681e-05, 'epochs': 96, 'loss': 'mae', 'optimizer': 'adam', 'graph_mode': 'off', 'use_snp_selection': False}. Best is trial 54 with value: 0.11315491601227236.
[I 2025-12-05 15:34:03,813] Trial 139 finished with value: 0.09247333686897181 and parameters: {'model_type': 'mlp', 'hidden_dims': '[128, 64]', 'dropout': 0.13580390052076202, 'batch_norm': True, 'lr': 7.090850315620147e-05, 'weight_decay': 3.3511169425946985e-07, 'epochs': 64, 'loss': 'mae', 'optimizer': 'adam', 'graph_mode': 'off', 'use_snp_selection': False}. Best is trial 54 with value: 0.11315491601227236.
[I 2025-12-05 15:34:05,547] Trial 140 finished with value: 0.07480303255467019 and parameters: {'model_type': 'mlp', 'hidden_dims': '[512, 128]', 'dropout': 0.32794947975911215, 'batch_norm': True, 'lr': 0.00014403976893005024, 'weight_decay': 4.432941570551588e-05, 'epochs': 171, 'loss': 'mae', 'optimizer': 'adam', 'graph_mode': 'off', 'use_snp_selection': False}. Best is trial 54 with value: 0.11315491601227236.
[I 2025-12-05 15:34:06,254] Trial 141 finished with value: 0.05468188114213743 and parameters: {'model_type': 'mlp', 'hidden_dims': '[128, 64]', 'dropout': 0.13621763373823734, 'batch_norm': True, 'lr': 4.424345327617732e-05, 'weight_decay': 5.121767177165211e-07, 'epochs': 64, 'loss': 'mae', 'optimizer': 'adam', 'graph_mode': 'off', 'use_snp_selection': False}. Best is trial 54 with value: 0.11315491601227236.
[I 2025-12-05 15:34:06,948] Trial 142 finished with value: 0.07685915670217547 and parameters: {'model_type': 'mlp', 'hidden_dims': '[128, 64]', 'dropout': 0.1509466336571703, 'batch_norm': True, 'lr': 8.643321600502221e-05, 'weight_decay': 3.551476006247746e-07, 'epochs': 50, 'loss': 'mae', 'optimizer': 'adam', 'graph_mode': 'off', 'use_snp_selection': False}. Best is trial 54 with value: 0.11315491601227236.
[I 2025-12-05 15:34:07,665] Trial 143 finished with value: 0.07971126526425312 and parameters: {'model_type': 'mlp', 'hidden_dims': '[128, 64]', 'dropout': 0.1002738516585813, 'batch_norm': True, 'lr': 6.759372758883855e-05, 'weight_decay': 2.415323652293712e-07, 'epochs': 85, 'loss': 'mae', 'optimizer': 'adam', 'graph_mode': 'off', 'use_snp_selection': False}. Best is trial 54 with value: 0.11315491601227236.
[I 2025-12-05 15:34:08,356] Trial 144 finished with value: 0.08241524061347089 and parameters: {'model_type': 'mlp', 'hidden_dims': '[128, 64]', 'dropout': 0.11847460269938792, 'batch_norm': True, 'lr': 0.00012007598301399184, 'weight_decay': 1.2681213915143193e-07, 'epochs': 68, 'loss': 'mae', 'optimizer': 'adam', 'graph_mode': 'off', 'use_snp_selection': False}. Best is trial 54 with value: 0.11315491601227236.
[I 2025-12-05 15:34:09,579] Trial 145 finished with value: 0.0722155472840304 and parameters: {'model_type': 'mlp', 'hidden_dims': '[512, 256]', 'dropout': 0.13195673955979453, 'batch_norm': True, 'lr': 5.428901889545596e-05, 'weight_decay': 1.864470556056694e-07, 'epochs': 75, 'loss': 'mae', 'optimizer': 'adam', 'graph_mode': 'off', 'use_snp_selection': False}. Best is trial 54 with value: 0.11315491601227236.
[I 2025-12-05 15:34:10,937] Trial 146 finished with value: 0.08813015599392825 and parameters: {'model_type': 'mlp', 'hidden_dims': '[512, 128]', 'dropout': 0.14339610914492398, 'batch_norm': True, 'lr': 7.430265385745784e-05, 'weight_decay': 2.7323981839967337e-05, 'epochs': 105, 'loss': 'mae', 'optimizer': 'adam', 'graph_mode': 'off', 'use_snp_selection': False}. Best is trial 54 with value: 0.11315491601227236.
[I 2025-12-05 15:34:12,719] Trial 147 finished with value: 0.10553130342503522 and parameters: {'model_type': 'mlp', 'hidden_dims': '[256, 128, 64]', 'dropout': 0.12253790937711381, 'batch_norm': True, 'lr': 0.0002489661024269984, 'weight_decay': 3.13913946704258e-07, 'epochs': 139, 'loss': 'mse', 'optimizer': 'adam', 'graph_mode': 'off', 'use_snp_selection': True, 'num_snps': 26371}. Best is trial 54 with value: 0.11315491601227236.
[I 2025-12-05 15:34:14,559] Trial 148 finished with value: 0.08165096528511029 and parameters: {'model_type': 'mlp', 'hidden_dims': '[256, 128, 64]', 'dropout': 0.12047621489814986, 'batch_norm': True, 'lr': 0.000183952150889573, 'weight_decay': 2.1051756597098055e-05, 'epochs': 138, 'loss': 'mse', 'optimizer': 'adam', 'graph_mode': 'off', 'use_snp_selection': True, 'num_snps': 26424}. Best is trial 54 with value: 0.11315491601227236.
[I 2025-12-05 15:34:15,882] Trial 149 finished with value: 0.033255362486520224 and parameters: {'model_type': 'mlp', 'hidden_dims': '[256, 128, 64]', 'dropout': 0.10931920965274837, 'batch_norm': True, 'lr': 0.00023466652274510574, 'weight_decay': 9.609480488493642e-06, 'epochs': 119, 'loss': 'mse', 'optimizer': 'adam', 'graph_mode': 'off', 'use_snp_selection': True, 'num_snps': 12338}. Best is trial 54 with value: 0.11315491601227236.
[I 2025-12-05 15:34:18,345] Trial 0 finished with value: 0.07830712685738 and parameters: {'model_type': 'mlp', 'hidden_dims': '[128, 64]', 'dropout': 0.199031432379812, 'batch_norm': True, 'lr': 1.8408544111075837e-06, 'weight_decay': 5.5136510071208614e-05, 'epochs': 336, 'loss': 'mae', 'optimizer': 'adam', 'graph_mode': 'off', 'use_snp_selection': True, 'num_snps': 43862}. Best is trial 0 with value: 0.07830712685738.
[I 2025-12-05 15:34:19,586] Trial 1 finished with value: 0.05206648869313825 and parameters: {'model_type': 'mlp', 'hidden_dims': '[256, 128]', 'dropout': 0.4370668075331726, 'batch_norm': True, 'lr': 7.133471581159139e-05, 'weight_decay': 1.128633586803549e-05, 'epochs': 242, 'loss': 'mae', 'optimizer': 'adam', 'graph_mode': 'off', 'use_snp_selection': False}. Best is trial 0 with value: 0.07830712685738.
[I 2025-12-05 15:34:20,674] Trial 2 finished with value: 0.014731122099553752 and parameters: {'model_type': 'mlp', 'hidden_dims': '[256, 128, 64]', 'dropout': 0.41314357415569625, 'batch_norm': False, 'lr': 3.952233718592101e-06, 'weight_decay': 0.00026754769258252603, 'epochs': 149, 'loss': 'mse', 'optimizer': 'adam', 'graph_mode': 'off', 'use_snp_selection': True, 'num_snps': 11571}. Best is trial 0 with value: 0.07830712685738.
[I 2025-12-05 15:34:22,806] Trial 3 finished with value: 0.02610886541369402 and parameters: {'model_type': 'mlp', 'hidden_dims': '[512, 64]', 'dropout': 0.5938127374509361, 'batch_norm': False, 'lr': 5.67704586114731e-06, 'weight_decay': 2.4518087630137052e-05, 'epochs': 320, 'loss': 'mae', 'optimizer': 'adam', 'graph_mode': 'off', 'use_snp_selection': False}. Best is trial 0 with value: 0.07830712685738.
[I 2025-12-05 15:34:25,225] Trial 4 finished with value: 0.0014150519080117574 and parameters: {'model_type': 'mlp', 'hidden_dims': '[512, 128]', 'dropout': 0.25746343592134413, 'batch_norm': True, 'lr': 1.3467657668402788e-06, 'weight_decay': 0.00033087251918647806, 'epochs': 277, 'loss': 'mse', 'optimizer': 'adam', 'graph_mode': 'off', 'use_snp_selection': True, 'num_snps': 36675}. Best is trial 0 with value: 0.07830712685738.
[I 2025-12-05 15:34:27,165] Trial 5 finished with value: -0.027608298405264624 and parameters: {'model_type': 'mlp', 'hidden_dims': '[512, 64]', 'dropout': 0.38275350994408375, 'batch_norm': True, 'lr': 1.5586664309232824e-06, 'weight_decay': 0.0008227664668621182, 'epochs': 145, 'loss': 'mae', 'optimizer': 'adam', 'graph_mode': 'off', 'use_snp_selection': True, 'num_snps': 32148}. Best is trial 0 with value: 0.07830712685738.
[I 2025-12-05 15:34:28,275] Trial 6 finished with value: 0.03762039212805299 and parameters: {'model_type': 'mlp', 'hidden_dims': '[256, 128]', 'dropout': 0.3930109900265879, 'batch_norm': False, 'lr': 4.892964372128395e-05, 'weight_decay': 1.5809549317992182e-06, 'epochs': 199, 'loss': 'mse', 'optimizer': 'adam', 'graph_mode': 'off', 'use_snp_selection': False}. Best is trial 0 with value: 0.07830712685738.
[I 2025-12-05 15:34:29,499] Trial 7 finished with value: 0.03408039552109673 and parameters: {'model_type': 'mlp', 'hidden_dims': '[512, 256]', 'dropout': 0.15343979219678458, 'batch_norm': True, 'lr': 6.234003099047341e-05, 'weight_decay': 3.894760610535477e-07, 'epochs': 97, 'loss': 'mse', 'optimizer': 'adam', 'graph_mode': 'off', 'use_snp_selection': False}. Best is trial 0 with value: 0.07830712685738.
[I 2025-12-05 15:34:31,681] Trial 8 finished with value: 0.03722977515400169 and parameters: {'model_type': 'mlp', 'hidden_dims': '[512, 128]', 'dropout': 0.10743001231661406, 'batch_norm': True, 'lr': 0.00023728538449271062, 'weight_decay': 1.7629071578048637e-05, 'epochs': 312, 'loss': 'mae', 'optimizer': 'adam', 'graph_mode': 'off', 'use_snp_selection': False}. Best is trial 0 with value: 0.07830712685738.
[I 2025-12-05 15:34:33,242] Trial 9 finished with value: 0.044580531628922074 and parameters: {'model_type': 'mlp', 'hidden_dims': '[512, 64]', 'dropout': 0.14505336736221927, 'batch_norm': True, 'lr': 5.8619638388111826e-05, 'weight_decay': 6.200156172669308e-07, 'epochs': 175, 'loss': 'mse', 'optimizer': 'adam', 'graph_mode': 'off', 'use_snp_selection': False}. Best is trial 0 with value: 0.07830712685738.
[I 2025-12-05 15:34:35,756] Trial 10 finished with value: 0.0208843112541339 and parameters: {'model_type': 'mlp', 'hidden_dims': '[128, 64]', 'dropout': 0.26042626041863687, 'batch_norm': False, 'lr': 1.080428984628536e-05, 'weight_decay': 0.00011308342650768637, 'epochs': 54, 'loss': 'mae', 'optimizer': 'adam', 'graph_mode': 'off', 'use_snp_selection': True, 'num_snps': 57847}. Best is trial 0 with value: 0.07830712685738.
[I 2025-12-05 15:34:38,360] Trial 11 finished with value: 0.03460427108612035 and parameters: {'model_type': 'mlp', 'hidden_dims': '[128, 64]', 'dropout': 0.5144895483744101, 'batch_norm': True, 'lr': 0.0008211727420699057, 'weight_decay': 4.790893376594963e-06, 'epochs': 240, 'loss': 'mae', 'optimizer': 'adam', 'graph_mode': 'off', 'use_snp_selection': True, 'num_snps': 55155}. Best is trial 0 with value: 0.07830712685738.
[I 2025-12-05 15:34:39,837] Trial 12 finished with value: 0.03492700705162041 and parameters: {'model_type': 'mlp', 'hidden_dims': '[256, 128]', 'dropout': 0.2856045425179123, 'batch_norm': True, 'lr': 1.8394163657406932e-05, 'weight_decay': 7.395301727524248e-05, 'epochs': 342, 'loss': 'mae', 'optimizer': 'adam', 'graph_mode': 'off', 'use_snp_selection': False}. Best is trial 0 with value: 0.07830712685738.
[I 2025-12-05 15:34:41,087] Trial 13 finished with value: 0.042935566642771816 and parameters: {'model_type': 'mlp', 'hidden_dims': '[256, 128]', 'dropout': 0.5052910462007275, 'batch_norm': True, 'lr': 0.00020171219022334619, 'weight_decay': 3.7904135004281887e-06, 'epochs': 257, 'loss': 'mae', 'optimizer': 'adam', 'graph_mode': 'off', 'use_snp_selection': True, 'num_snps': 10373}. Best is trial 0 with value: 0.07830712685738.
[I 2025-12-05 15:34:41,983] Trial 14 finished with value: 0.031200503497820872 and parameters: {'model_type': 'mlp', 'hidden_dims': '[128, 64]', 'dropout': 0.32041671017995976, 'batch_norm': True, 'lr': 0.0001681929337458471, 'weight_decay': 3.396705584723515e-05, 'epochs': 218, 'loss': 'mae', 'optimizer': 'adam', 'graph_mode': 'off', 'use_snp_selection': False}. Best is trial 0 with value: 0.07830712685738.
[I 2025-12-05 15:34:44,341] Trial 15 finished with value: 0.022091975582768188 and parameters: {'model_type': 'mlp', 'hidden_dims': '[256, 128, 64]', 'dropout': 0.20624866782415616, 'batch_norm': True, 'lr': 1.881687628296091e-05, 'weight_decay': 7.855436274862584e-06, 'epochs': 286, 'loss': 'mae', 'optimizer': 'adam', 'graph_mode': 'off', 'use_snp_selection': True, 'num_snps': 41817}. Best is trial 0 with value: 0.07830712685738.
[I 2025-12-05 15:34:46,692] Trial 16 finished with value: -0.004324006051144812 and parameters: {'model_type': 'mlp', 'hidden_dims': '[512, 256]', 'dropout': 0.4506894495718366, 'batch_norm': True, 'lr': 3.5840007484960565e-06, 'weight_decay': 6.997426951559611e-05, 'epochs': 346, 'loss': 'mae', 'optimizer': 'adam', 'graph_mode': 'off', 'use_snp_selection': False}. Best is trial 0 with value: 0.07830712685738.
[I 2025-12-05 15:34:49,219] Trial 17 finished with value: 0.03680279862425616 and parameters: {'model_type': 'mlp', 'hidden_dims': '[128, 64]', 'dropout': 0.3355120231531892, 'batch_norm': True, 'lr': 0.00094645867610948, 'weight_decay': 1.40022675967374e-07, 'epochs': 294, 'loss': 'mae', 'optimizer': 'adam', 'graph_mode': 'off', 'use_snp_selection': True, 'num_snps': 45694}. Best is trial 0 with value: 0.07830712685738.
[I 2025-12-05 15:34:50,736] Trial 18 finished with value: 0.02223324565597567 and parameters: {'model_type': 'mlp', 'hidden_dims': '[256, 128]', 'dropout': 0.20763177215968912, 'batch_norm': False, 'lr': 0.0001101013882524552, 'weight_decay': 2.2054252581825263e-06, 'epochs': 244, 'loss': 'mae', 'optimizer': 'adam', 'graph_mode': 'off', 'use_snp_selection': True, 'num_snps': 20445}. Best is trial 0 with value: 0.07830712685738.
[I 2025-12-05 15:34:51,677] Trial 19 finished with value: 0.009712347039793623 and parameters: {'model_type': 'mlp', 'hidden_dims': '[256, 128]', 'dropout': 0.45888706612159014, 'batch_norm': True, 'lr': 2.6461851433952795e-05, 'weight_decay': 1.0308497757312097e-05, 'epochs': 112, 'loss': 'mae', 'optimizer': 'adam', 'graph_mode': 'off', 'use_snp_selection': False}. Best is trial 0 with value: 0.07830712685738.
[I 2025-12-05 15:34:52,586] Trial 20 finished with value: -0.002483853362602224 and parameters: {'model_type': 'mlp', 'hidden_dims': '[128, 64]', 'dropout': 0.21047446721838045, 'batch_norm': True, 'lr': 9.41032678790709e-06, 'weight_decay': 3.889015236709189e-05, 'epochs': 213, 'loss': 'mae', 'optimizer': 'adam', 'graph_mode': 'off', 'use_snp_selection': False}. Best is trial 0 with value: 0.07830712685738.
[I 2025-12-05 15:34:54,086] Trial 21 finished with value: 0.06141802298430173 and parameters: {'model_type': 'mlp', 'hidden_dims': '[512, 64]', 'dropout': 0.1108109844621867, 'batch_norm': True, 'lr': 5.989093120610552e-05, 'weight_decay': 1.0792448545334053e-06, 'epochs': 169, 'loss': 'mse', 'optimizer': 'adam', 'graph_mode': 'off', 'use_snp_selection': False}. Best is trial 0 with value: 0.07830712685738.
[I 2025-12-05 15:34:55,611] Trial 22 finished with value: 0.05872099901271767 and parameters: {'model_type': 'mlp', 'hidden_dims': '[512, 64]', 'dropout': 0.10991621763161757, 'batch_norm': True, 'lr': 0.0004167742198511434, 'weight_decay': 9.33560093240245e-07, 'epochs': 168, 'loss': 'mse', 'optimizer': 'adam', 'graph_mode': 'off', 'use_snp_selection': False}. Best is trial 0 with value: 0.07830712685738.
[I 2025-12-05 15:34:57,172] Trial 23 finished with value: 0.06254379164657126 and parameters: {'model_type': 'mlp', 'hidden_dims': '[512, 64]', 'dropout': 0.10514591608913494, 'batch_norm': True, 'lr': 0.00041107324700870285, 'weight_decay': 7.074195449651217e-07, 'epochs': 173, 'loss': 'mse', 'optimizer': 'adam', 'graph_mode': 'off', 'use_snp_selection': False}. Best is trial 0 with value: 0.07830712685738.
[I 2025-12-05 15:34:58,530] Trial 24 finished with value: 0.05190265028361493 and parameters: {'model_type': 'mlp', 'hidden_dims': '[512, 64]', 'dropout': 0.15521074261230133, 'batch_norm': True, 'lr': 0.0005328535021659561, 'weight_decay': 1.8626576228740828e-07, 'epochs': 127, 'loss': 'mse', 'optimizer': 'adam', 'graph_mode': 'off', 'use_snp_selection': False}. Best is trial 0 with value: 0.07830712685738.
[I 2025-12-05 15:35:00,112] Trial 25 finished with value: 0.03647290268019194 and parameters: {'model_type': 'mlp', 'hidden_dims': '[512, 64]', 'dropout': 0.1724190358395002, 'batch_norm': True, 'lr': 0.0003669056369543178, 'weight_decay': 2.5832647328273004e-07, 'epochs': 182, 'loss': 'mse', 'optimizer': 'adam', 'graph_mode': 'off', 'use_snp_selection': False}. Best is trial 0 with value: 0.07830712685738.
