[I 2025-12-06 01:19:40,418] Trial 124 finished with value: 0.20727770595286796 and parameters: {'model_type': 'mlp', 'hidden_dims': '[512, 128]', 'dropout': 0.3274598708012319, 'batch_norm': False, 'lr': 2.100969590756996e-06, 'weight_decay': 4.9127610337204095e-05, 'epochs': 248, 'loss': 'mae', 'optimizer': 'adam', 'graph_mode': 'off', 'use_snp_selection': True, 'num_snps': 25890}. Best is trial 67 with value: 0.23432816000254308.
[I 2025-12-06 01:21:13,657] Trial 125 finished with value: 0.2114141164118674 and parameters: {'model_type': 'mlp', 'hidden_dims': '[512, 128]', 'dropout': 0.37249438366027277, 'batch_norm': False, 'lr': 3.379945881672405e-06, 'weight_decay': 7.513967832251834e-06, 'epochs': 264, 'loss': 'mae', 'optimizer': 'adam', 'graph_mode': 'off', 'use_snp_selection': True, 'num_snps': 49771}. Best is trial 67 with value: 0.23432816000254308.
[I 2025-12-06 01:22:25,592] Trial 126 finished with value: 0.2022696036879807 and parameters: {'model_type': 'mlp', 'hidden_dims': '[512, 128]', 'dropout': 0.4218079077179143, 'batch_norm': False, 'lr': 1.925302078016909e-06, 'weight_decay': 4.354413363398292e-06, 'epochs': 282, 'loss': 'mae', 'optimizer': 'adam', 'graph_mode': 'off', 'use_snp_selection': True, 'num_snps': 31967}. Best is trial 67 with value: 0.23432816000254308.
[I 2025-12-06 01:23:27,706] Trial 127 finished with value: 0.212264386029914 and parameters: {'model_type': 'mlp', 'hidden_dims': '[512, 128]', 'dropout': 0.31298595032360504, 'batch_norm': False, 'lr': 3.7787830986319484e-06, 'weight_decay': 1.9747971571115192e-05, 'epochs': 235, 'loss': 'mae', 'optimizer': 'adam', 'graph_mode': 'off', 'use_snp_selection': True, 'num_snps': 28565}. Best is trial 67 with value: 0.23432816000254308.
[I 2025-12-06 01:24:53,634] Trial 128 finished with value: 0.16310486218330913 and parameters: {'model_type': 'mlp', 'hidden_dims': '[512, 256]', 'dropout': 0.38714742196849483, 'batch_norm': True, 'lr': 3.0358463023837168e-06, 'weight_decay': 9.872084768119791e-06, 'epochs': 305, 'loss': 'mae', 'optimizer': 'adam', 'graph_mode': 'off', 'use_snp_selection': False}. Best is trial 67 with value: 0.23432816000254308.
[I 2025-12-06 01:25:40,776] Trial 129 finished with value: 0.21558612773845875 and parameters: {'model_type': 'mlp', 'hidden_dims': '[256, 128, 64]', 'dropout': 0.24827077089862154, 'batch_norm': False, 'lr': 1.5581586315999892e-06, 'weight_decay': 8.892302875083085e-05, 'epochs': 295, 'loss': 'mae', 'optimizer': 'adam', 'graph_mode': 'off', 'use_snp_selection': True, 'num_snps': 22442}. Best is trial 67 with value: 0.23432816000254308.
[I 2025-12-06 01:26:32,991] Trial 130 finished with value: 0.21161266646936255 and parameters: {'model_type': 'mlp', 'hidden_dims': '[512, 64]', 'dropout': 0.3065873587544098, 'batch_norm': False, 'lr': 6.595742770689357e-06, 'weight_decay': 2.7619884955698895e-05, 'epochs': 322, 'loss': 'mae', 'optimizer': 'adam', 'graph_mode': 'off', 'use_snp_selection': True, 'num_snps': 16527}. Best is trial 67 with value: 0.23432816000254308.
[I 2025-12-06 01:27:36,197] Trial 131 finished with value: 0.21134106257449087 and parameters: {'model_type': 'mlp', 'hidden_dims': '[512, 128]', 'dropout': 0.32305729458639143, 'batch_norm': False, 'lr': 2.5932454356028844e-06, 'weight_decay': 3.8007247090540285e-06, 'epochs': 269, 'loss': 'mae', 'optimizer': 'adam', 'graph_mode': 'off', 'use_snp_selection': True, 'num_snps': 27198}. Best is trial 67 with value: 0.23432816000254308.
[I 2025-12-06 01:28:38,323] Trial 132 finished with value: 0.2179663798189695 and parameters: {'model_type': 'mlp', 'hidden_dims': '[512, 128]', 'dropout': 0.33883820132419185, 'batch_norm': False, 'lr': 2.4433649318223124e-06, 'weight_decay': 1.7721089614459516e-06, 'epochs': 260, 'loss': 'mae', 'optimizer': 'adam', 'graph_mode': 'off', 'use_snp_selection': True, 'num_snps': 26562}. Best is trial 67 with value: 0.23432816000254308.
[I 2025-12-06 01:29:39,080] Trial 133 finished with value: 0.20688641557576118 and parameters: {'model_type': 'mlp', 'hidden_dims': '[512, 128]', 'dropout': 0.3330678605603039, 'batch_norm': False, 'lr': 1.8149938466696758e-06, 'weight_decay': 4.4282846006901e-06, 'epochs': 276, 'loss': 'mae', 'optimizer': 'adam', 'graph_mode': 'off', 'use_snp_selection': True, 'num_snps': 24613}. Best is trial 67 with value: 0.23432816000254308.
[I 2025-12-06 01:30:48,371] Trial 134 finished with value: 0.210577366600404 and parameters: {'model_type': 'mlp', 'hidden_dims': '[512, 128]', 'dropout': 0.3584101046927622, 'batch_norm': False, 'lr': 2.701170960441764e-06, 'weight_decay': 2.823286532542717e-06, 'epochs': 290, 'loss': 'mae', 'optimizer': 'adam', 'graph_mode': 'off', 'use_snp_selection': True, 'num_snps': 29707}. Best is trial 67 with value: 0.23432816000254308.
[I 2025-12-06 01:31:48,674] Trial 135 finished with value: 0.20472812739271937 and parameters: {'model_type': 'mlp', 'hidden_dims': '[512, 128]', 'dropout': 0.35002752875031856, 'batch_norm': False, 'lr': 5.4487875245089485e-06, 'weight_decay': 6.83185872796387e-05, 'epochs': 345, 'loss': 'mae', 'optimizer': 'adam', 'graph_mode': 'off', 'use_snp_selection': True, 'num_snps': 20611}. Best is trial 67 with value: 0.23432816000254308.
[I 2025-12-06 01:32:39,210] Trial 136 finished with value: 0.22529155937970247 and parameters: {'model_type': 'mlp', 'hidden_dims': '[512, 128]', 'dropout': 0.37958510676411356, 'batch_norm': False, 'lr': 1.166490834521186e-05, 'weight_decay': 5.782271416318138e-06, 'epochs': 253, 'loss': 'mae', 'optimizer': 'adam', 'graph_mode': 'off', 'use_snp_selection': True, 'num_snps': 18577}. Best is trial 67 with value: 0.23432816000254308.
[I 2025-12-06 01:33:28,785] Trial 137 finished with value: 0.2147919962564276 and parameters: {'model_type': 'mlp', 'hidden_dims': '[512, 128]', 'dropout': 0.43093769231291207, 'batch_norm': False, 'lr': 1.1508444203979833e-05, 'weight_decay': 5.486513641074584e-06, 'epochs': 243, 'loss': 'mae', 'optimizer': 'adam', 'graph_mode': 'off', 'use_snp_selection': True, 'num_snps': 18395}. Best is trial 67 with value: 0.23432816000254308.
[I 2025-12-06 01:34:25,821] Trial 138 finished with value: 0.19803327967101403 and parameters: {'model_type': 'mlp', 'hidden_dims': '[512, 128]', 'dropout': 0.4105398069823315, 'batch_norm': False, 'lr': 3.922103526300729e-05, 'weight_decay': 7.26422778087225e-06, 'epochs': 254, 'loss': 'mse', 'optimizer': 'adam', 'graph_mode': 'off', 'use_snp_selection': True, 'num_snps': 23793}. Best is trial 67 with value: 0.23432816000254308.
[I 2025-12-06 01:35:18,523] Trial 139 finished with value: 0.2095234078016202 and parameters: {'model_type': 'mlp', 'hidden_dims': '[512, 256]', 'dropout': 0.3965845692116693, 'batch_norm': False, 'lr': 7.793597662288866e-06, 'weight_decay': 3.6040270263210703e-05, 'epochs': 336, 'loss': 'mae', 'optimizer': 'adam', 'graph_mode': 'off', 'use_snp_selection': True, 'num_snps': 15619}. Best is trial 67 with value: 0.23432816000254308.
[I 2025-12-06 01:36:45,719] Trial 140 finished with value: 0.2012688729176944 and parameters: {'model_type': 'mlp', 'hidden_dims': '[512, 128]', 'dropout': 0.3793253776590816, 'batch_norm': False, 'lr': 1.056102169012822e-05, 'weight_decay': 5.584959664985526e-05, 'epochs': 315, 'loss': 'mae', 'optimizer': 'adam', 'graph_mode': 'off', 'use_snp_selection': False}. Best is trial 67 with value: 0.23432816000254308.
[I 2025-12-06 01:37:40,519] Trial 141 finished with value: 0.21871243021751874 and parameters: {'model_type': 'mlp', 'hidden_dims': '[512, 128]', 'dropout': 0.371467727808736, 'batch_norm': False, 'lr': 2.1947606127776063e-06, 'weight_decay': 3.7288301863341187e-06, 'epochs': 276, 'loss': 'mae', 'optimizer': 'adam', 'graph_mode': 'off', 'use_snp_selection': True, 'num_snps': 20375}. Best is trial 67 with value: 0.23432816000254308.
[I 2025-12-06 01:38:40,956] Trial 142 finished with value: 0.223915127754673 and parameters: {'model_type': 'mlp', 'hidden_dims': '[512, 128]', 'dropout': 0.43933128157657847, 'batch_norm': False, 'lr': 3.105191266196838e-06, 'weight_decay': 1.1310440303838088e-05, 'epochs': 262, 'loss': 'mae', 'optimizer': 'adam', 'graph_mode': 'off', 'use_snp_selection': True, 'num_snps': 25631}. Best is trial 67 with value: 0.23432816000254308.
[I 2025-12-06 01:39:36,879] Trial 143 finished with value: 0.2241244429254201 and parameters: {'model_type': 'mlp', 'hidden_dims': '[512, 128]', 'dropout': 0.4113355745192908, 'batch_norm': False, 'lr': 3.93636342836202e-06, 'weight_decay': 1.0790723293532688e-05, 'epochs': 250, 'loss': 'mae', 'optimizer': 'adam', 'graph_mode': 'off', 'use_snp_selection': True, 'num_snps': 22493}. Best is trial 67 with value: 0.23432816000254308.
[I 2025-12-06 01:40:36,033] Trial 144 finished with value: 0.22483853405334492 and parameters: {'model_type': 'mlp', 'hidden_dims': '[512, 128]', 'dropout': 0.4416493720004781, 'batch_norm': False, 'lr': 4.059201365490197e-06, 'weight_decay': 1.5837828956346557e-05, 'epochs': 254, 'loss': 'mae', 'optimizer': 'adam', 'graph_mode': 'off', 'use_snp_selection': True, 'num_snps': 25197}. Best is trial 67 with value: 0.23432816000254308.
[I 2025-12-06 01:41:32,282] Trial 145 finished with value: 0.22464070113984208 and parameters: {'model_type': 'mlp', 'hidden_dims': '[512, 128]', 'dropout': 0.44565146473677913, 'batch_norm': False, 'lr': 3.9618604191685475e-06, 'weight_decay': 1.3640498015507547e-05, 'epochs': 249, 'loss': 'mae', 'optimizer': 'adam', 'graph_mode': 'off', 'use_snp_selection': True, 'num_snps': 23337}. Best is trial 67 with value: 0.23432816000254308.
[I 2025-12-06 01:42:27,198] Trial 146 finished with value: 0.20901157767246006 and parameters: {'model_type': 'mlp', 'hidden_dims': '[512, 128]', 'dropout': 0.44172987094517346, 'batch_norm': False, 'lr': 4.273170316256549e-06, 'weight_decay': 1.636185842890203e-05, 'epochs': 239, 'loss': 'mae', 'optimizer': 'adam', 'graph_mode': 'off', 'use_snp_selection': True, 'num_snps': 22599}. Best is trial 67 with value: 0.23432816000254308.
[I 2025-12-06 01:43:25,856] Trial 147 finished with value: 0.2158034905876355 and parameters: {'model_type': 'mlp', 'hidden_dims': '[512, 128]', 'dropout': 0.4565871647726123, 'batch_norm': False, 'lr': 3.2586868647987957e-06, 'weight_decay': 1.3093324553815475e-05, 'epochs': 249, 'loss': 'mae', 'optimizer': 'adam', 'graph_mode': 'off', 'use_snp_selection': True, 'num_snps': 25183}. Best is trial 67 with value: 0.23432816000254308.
[I 2025-12-06 01:44:20,228] Trial 148 finished with value: 0.21978346102192708 and parameters: {'model_type': 'mlp', 'hidden_dims': '[512, 128]', 'dropout': 0.4454093858418012, 'batch_norm': False, 'lr': 6.041996396881539e-06, 'weight_decay': 9.636619230743051e-06, 'epochs': 223, 'loss': 'mae', 'optimizer': 'adam', 'graph_mode': 'off', 'use_snp_selection': True, 'num_snps': 23779}. Best is trial 67 with value: 0.23432816000254308.
[I 2025-12-06 01:45:08,740] Trial 149 finished with value: 0.22854199644570752 and parameters: {'model_type': 'mlp', 'hidden_dims': '[512, 128]', 'dropout': 0.46627531730849603, 'batch_norm': False, 'lr': 4.213274446594905e-06, 'weight_decay': 1.4415324904128118e-05, 'epochs': 207, 'loss': 'mae', 'optimizer': 'adam', 'graph_mode': 'off', 'use_snp_selection': True, 'num_snps': 19697}. Best is trial 67 with value: 0.23432816000254308.
[I 2025-12-06 01:46:03,281] Trial 0 finished with value: 0.13217130415438713 and parameters: {'model_type': 'mlp', 'hidden_dims': '[128, 64]', 'dropout': 0.199031432379812, 'batch_norm': True, 'lr': 1.8408544111075837e-06, 'weight_decay': 5.5136510071208614e-05, 'epochs': 336, 'loss': 'mae', 'optimizer': 'adam', 'graph_mode': 'off', 'use_snp_selection': True, 'num_snps': 43862}. Best is trial 0 with value: 0.13217130415438713.
[I 2025-12-06 01:46:34,851] Trial 1 finished with value: 0.17297170814053656 and parameters: {'model_type': 'mlp', 'hidden_dims': '[256, 128]', 'dropout': 0.4370668075331726, 'batch_norm': True, 'lr': 7.133471581159139e-05, 'weight_decay': 1.128633586803549e-05, 'epochs': 242, 'loss': 'mae', 'optimizer': 'adam', 'graph_mode': 'off', 'use_snp_selection': False}. Best is trial 1 with value: 0.17297170814053656.
[I 2025-12-06 01:47:02,579] Trial 2 finished with value: 0.16651713780339386 and parameters: {'model_type': 'mlp', 'hidden_dims': '[256, 128, 64]', 'dropout': 0.41314357415569625, 'batch_norm': False, 'lr': 3.952233718592101e-06, 'weight_decay': 0.00026754769258252603, 'epochs': 149, 'loss': 'mse', 'optimizer': 'adam', 'graph_mode': 'off', 'use_snp_selection': True, 'num_snps': 11571}. Best is trial 1 with value: 0.17297170814053656.
[I 2025-12-06 01:48:15,153] Trial 3 finished with value: 0.17189759847390296 and parameters: {'model_type': 'mlp', 'hidden_dims': '[512, 64]', 'dropout': 0.5938127374509361, 'batch_norm': False, 'lr': 5.67704586114731e-06, 'weight_decay': 2.4518087630137052e-05, 'epochs': 320, 'loss': 'mae', 'optimizer': 'adam', 'graph_mode': 'off', 'use_snp_selection': False}. Best is trial 1 with value: 0.17297170814053656.
[I 2025-12-06 01:49:19,960] Trial 4 finished with value: 0.12643802964734288 and parameters: {'model_type': 'mlp', 'hidden_dims': '[512, 128]', 'dropout': 0.25746343592134413, 'batch_norm': True, 'lr': 1.3467657668402788e-06, 'weight_decay': 0.00033087251918647806, 'epochs': 277, 'loss': 'mse', 'optimizer': 'adam', 'graph_mode': 'off', 'use_snp_selection': True, 'num_snps': 36675}. Best is trial 1 with value: 0.17297170814053656.
[I 2025-12-06 01:50:05,230] Trial 5 finished with value: 0.13266624141387187 and parameters: {'model_type': 'mlp', 'hidden_dims': '[512, 64]', 'dropout': 0.38275350994408375, 'batch_norm': True, 'lr': 1.5586664309232824e-06, 'weight_decay': 0.0008227664668621182, 'epochs': 145, 'loss': 'mae', 'optimizer': 'adam', 'graph_mode': 'off', 'use_snp_selection': True, 'num_snps': 32148}. Best is trial 1 with value: 0.17297170814053656.
[I 2025-12-06 01:50:31,537] Trial 6 finished with value: 0.17234856470276996 and parameters: {'model_type': 'mlp', 'hidden_dims': '[256, 128]', 'dropout': 0.3930109900265879, 'batch_norm': False, 'lr': 4.892964372128395e-05, 'weight_decay': 1.5809549317992182e-06, 'epochs': 199, 'loss': 'mse', 'optimizer': 'adam', 'graph_mode': 'off', 'use_snp_selection': False}. Best is trial 1 with value: 0.17297170814053656.
[I 2025-12-06 01:50:58,236] Trial 7 finished with value: 0.18750552785700386 and parameters: {'model_type': 'mlp', 'hidden_dims': '[512, 256]', 'dropout': 0.15343979219678458, 'batch_norm': True, 'lr': 6.234003099047341e-05, 'weight_decay': 3.894760610535477e-07, 'epochs': 97, 'loss': 'mse', 'optimizer': 'adam', 'graph_mode': 'off', 'use_snp_selection': False}. Best is trial 7 with value: 0.18750552785700386.
[I 2025-12-06 01:52:10,459] Trial 8 finished with value: 0.1676043489229429 and parameters: {'model_type': 'mlp', 'hidden_dims': '[512, 128]', 'dropout': 0.10743001231661406, 'batch_norm': True, 'lr': 0.00023728538449271062, 'weight_decay': 1.7629071578048637e-05, 'epochs': 312, 'loss': 'mae', 'optimizer': 'adam', 'graph_mode': 'off', 'use_snp_selection': False}. Best is trial 7 with value: 0.18750552785700386.
[I 2025-12-06 01:52:53,757] Trial 9 finished with value: 0.1737394144040742 and parameters: {'model_type': 'mlp', 'hidden_dims': '[512, 64]', 'dropout': 0.14505336736221927, 'batch_norm': True, 'lr': 5.8619638388111826e-05, 'weight_decay': 6.200156172669308e-07, 'epochs': 175, 'loss': 'mse', 'optimizer': 'adam', 'graph_mode': 'off', 'use_snp_selection': False}. Best is trial 7 with value: 0.18750552785700386.
[I 2025-12-06 01:53:08,508] Trial 10 finished with value: 0.12115260447788216 and parameters: {'model_type': 'mlp', 'hidden_dims': '[512, 256]', 'dropout': 0.2736992815328032, 'batch_norm': False, 'lr': 0.00032393778075602147, 'weight_decay': 1.1511946696017092e-07, 'epochs': 41, 'loss': 'mse', 'optimizer': 'adam', 'graph_mode': 'off', 'use_snp_selection': False}. Best is trial 7 with value: 0.18750552785700386.
[I 2025-12-06 01:53:31,122] Trial 11 finished with value: 0.13166769635617298 and parameters: {'model_type': 'mlp', 'hidden_dims': '[512, 256]', 'dropout': 0.10095648685224448, 'batch_norm': True, 'lr': 1.6474108386126448e-05, 'weight_decay': 6.203180869264506e-07, 'epochs': 77, 'loss': 'mse', 'optimizer': 'adam', 'graph_mode': 'off', 'use_snp_selection': False}. Best is trial 7 with value: 0.18750552785700386.
[I 2025-12-06 01:53:59,903] Trial 12 finished with value: 0.17787222517865242 and parameters: {'model_type': 'mlp', 'hidden_dims': '[512, 256]', 'dropout': 0.1977119287227368, 'batch_norm': True, 'lr': 0.000121041789182661, 'weight_decay': 1.2192432071058163e-06, 'epochs': 106, 'loss': 'mse', 'optimizer': 'adam', 'graph_mode': 'off', 'use_snp_selection': False}. Best is trial 7 with value: 0.18750552785700386.
[I 2025-12-06 01:54:29,806] Trial 13 finished with value: 0.17693818960585223 and parameters: {'model_type': 'mlp', 'hidden_dims': '[512, 256]', 'dropout': 0.22096278001553593, 'batch_norm': True, 'lr': 0.00013100665335591914, 'weight_decay': 2.215502086408347e-06, 'epochs': 111, 'loss': 'mse', 'optimizer': 'adam', 'graph_mode': 'off', 'use_snp_selection': False}. Best is trial 7 with value: 0.18750552785700386.
[I 2025-12-06 01:54:55,973] Trial 14 finished with value: 0.17314838014885994 and parameters: {'model_type': 'mlp', 'hidden_dims': '[512, 256]', 'dropout': 0.30473884411503666, 'batch_norm': True, 'lr': 0.0007929572531082917, 'weight_decay': 1.1356099766169029e-07, 'epochs': 93, 'loss': 'mse', 'optimizer': 'adam', 'graph_mode': 'off', 'use_snp_selection': False}. Best is trial 7 with value: 0.18750552785700386.
[I 2025-12-06 01:55:11,017] Trial 15 finished with value: 0.1340105361707601 and parameters: {'model_type': 'mlp', 'hidden_dims': '[512, 256]', 'dropout': 0.1723492905468449, 'batch_norm': True, 'lr': 2.002944590579291e-05, 'weight_decay': 3.4048277422464684e-06, 'epochs': 41, 'loss': 'mse', 'optimizer': 'adam', 'graph_mode': 'off', 'use_snp_selection': False}. Best is trial 7 with value: 0.18750552785700386.
[I 2025-12-06 01:55:29,658] Trial 16 finished with value: 0.1691088255473066 and parameters: {'model_type': 'mlp', 'hidden_dims': '[256, 128, 64]', 'dropout': 0.32268977954706873, 'batch_norm': True, 'lr': 0.0006753634252778753, 'weight_decay': 3.749525779502734e-07, 'epochs': 120, 'loss': 'mse', 'optimizer': 'adam', 'graph_mode': 'off', 'use_snp_selection': False}. Best is trial 7 with value: 0.18750552785700386.
[I 2025-12-06 01:55:44,614] Trial 17 finished with value: 0.15814130384710035 and parameters: {'model_type': 'mlp', 'hidden_dims': '[128, 64]', 'dropout': 0.48338811786911595, 'batch_norm': True, 'lr': 0.00012416277637352917, 'weight_decay': 3.784040923164914e-06, 'epochs': 202, 'loss': 'mse', 'optimizer': 'adam', 'graph_mode': 'off', 'use_snp_selection': False}. Best is trial 7 with value: 0.18750552785700386.
[I 2025-12-06 01:56:35,316] Trial 18 finished with value: 0.18898171713724352 and parameters: {'model_type': 'mlp', 'hidden_dims': '[512, 256]', 'dropout': 0.2312628506238401, 'batch_norm': False, 'lr': 2.1195618916856746e-05, 'weight_decay': 2.990440080143429e-07, 'epochs': 71, 'loss': 'mse', 'optimizer': 'adam', 'graph_mode': 'off', 'use_snp_selection': True, 'num_snps': 58241}. Best is trial 18 with value: 0.18898171713724352.
[I 2025-12-06 01:57:23,637] Trial 19 finished with value: 0.18017874711655918 and parameters: {'model_type': 'mlp', 'hidden_dims': '[512, 256]', 'dropout': 0.24870230512852845, 'batch_norm': False, 'lr': 1.0436614786391874e-05, 'weight_decay': 2.714195880240099e-07, 'epochs': 65, 'loss': 'mse', 'optimizer': 'adam', 'graph_mode': 'off', 'use_snp_selection': True, 'num_snps': 55667}. Best is trial 18 with value: 0.18898171713724352.
[I 2025-12-06 01:58:27,752] Trial 20 finished with value: 0.1778087508721816 and parameters: {'model_type': 'mlp', 'hidden_dims': '[512, 256]', 'dropout': 0.15389330126836562, 'batch_norm': False, 'lr': 2.890476148189694e-05, 'weight_decay': 2.3152467602368685e-07, 'epochs': 146, 'loss': 'mse', 'optimizer': 'adam', 'graph_mode': 'off', 'use_snp_selection': True, 'num_snps': 57703}. Best is trial 18 with value: 0.18898171713724352.
[I 2025-12-06 01:59:20,168] Trial 21 finished with value: 0.18568006886126975 and parameters: {'model_type': 'mlp', 'hidden_dims': '[512, 256]', 'dropout': 0.2397993303337753, 'batch_norm': False, 'lr': 8.603322027911135e-06, 'weight_decay': 2.5462244724640514e-07, 'epochs': 76, 'loss': 'mse', 'optimizer': 'adam', 'graph_mode': 'off', 'use_snp_selection': True, 'num_snps': 59811}. Best is trial 18 with value: 0.18898171713724352.
[I 2025-12-06 02:00:11,557] Trial 22 finished with value: 0.19261999869299412 and parameters: {'model_type': 'mlp', 'hidden_dims': '[512, 256]', 'dropout': 0.3113371128519856, 'batch_norm': False, 'lr': 8.783714303100093e-06, 'weight_decay': 9.269334786458674e-07, 'epochs': 73, 'loss': 'mse', 'optimizer': 'adam', 'graph_mode': 'off', 'use_snp_selection': True, 'num_snps': 58828}. Best is trial 22 with value: 0.19261999869299412.
[I 2025-12-06 02:00:41,268] Trial 23 finished with value: 0.1780492009384519 and parameters: {'model_type': 'mlp', 'hidden_dims': '[512, 256]', 'dropout': 0.3322948646607066, 'batch_norm': False, 'lr': 3.504651739966726e-06, 'weight_decay': 8.933564618960163e-07, 'epochs': 58, 'loss': 'mse', 'optimizer': 'adam', 'graph_mode': 'off', 'use_snp_selection': True, 'num_snps': 17926}. Best is trial 22 with value: 0.19261999869299412.
[I 2025-12-06 02:01:33,580] Trial 24 finished with value: 0.17576449591515192 and parameters: {'model_type': 'mlp', 'hidden_dims': '[512, 256]', 'dropout': 0.2948423197135238, 'batch_norm': False, 'lr': 3.4681171880450074e-05, 'weight_decay': 4.871754262475473e-07, 'epochs': 131, 'loss': 'mse', 'optimizer': 'adam', 'graph_mode': 'off', 'use_snp_selection': True, 'num_snps': 44859}. Best is trial 22 with value: 0.19261999869299412.
