[I 2025-12-05 14:57:47,089] Trial 135 finished with value: 0.12953730954699058 and parameters: {'model_type': 'mlp', 'hidden_dims': '[512, 256]', 'dropout': 0.14163652729184373, 'batch_norm': True, 'lr': 0.0007424985482989657, 'weight_decay': 1.0913608407310139e-06, 'epochs': 227, 'loss': 'mae', 'optimizer': 'adam', 'graph_mode': 'off', 'use_snp_selection': False}. Best is trial 14 with value: 0.14489011797967669.
[I 2025-12-05 14:57:48,689] Trial 136 finished with value: 0.13110643788104628 and parameters: {'model_type': 'mlp', 'hidden_dims': '[512, 256]', 'dropout': 0.13469790973384266, 'batch_norm': True, 'lr': 0.0007668206805753162, 'weight_decay': 8.347594190516652e-07, 'epochs': 212, 'loss': 'mae', 'optimizer': 'adam', 'graph_mode': 'off', 'use_snp_selection': False}. Best is trial 14 with value: 0.14489011797967669.
[I 2025-12-05 14:57:49,748] Trial 137 finished with value: 0.08967028074883217 and parameters: {'model_type': 'mlp', 'hidden_dims': '[512, 256]', 'dropout': 0.11289595015142462, 'batch_norm': False, 'lr': 3.052098457174133e-06, 'weight_decay': 7.450618988461475e-05, 'epochs': 227, 'loss': 'mae', 'optimizer': 'adam', 'graph_mode': 'off', 'use_snp_selection': True, 'num_snps': 7713}. Best is trial 14 with value: 0.14489011797967669.
[I 2025-12-05 14:57:51,541] Trial 138 finished with value: 0.12659119732643725 and parameters: {'model_type': 'mlp', 'hidden_dims': '[512, 256]', 'dropout': 0.13488267895834505, 'batch_norm': True, 'lr': 0.0005895160887628294, 'weight_decay': 1.0374625343094898e-06, 'epochs': 264, 'loss': 'mae', 'optimizer': 'adam', 'graph_mode': 'off', 'use_snp_selection': False}. Best is trial 14 with value: 0.14489011797967669.
[I 2025-12-05 14:57:53,127] Trial 139 finished with value: 0.12994412109252063 and parameters: {'model_type': 'mlp', 'hidden_dims': '[512, 256]', 'dropout': 0.16190618808255686, 'batch_norm': True, 'lr': 0.0009274022453508309, 'weight_decay': 7.165741963648251e-07, 'epochs': 210, 'loss': 'mae', 'optimizer': 'adam', 'graph_mode': 'off', 'use_snp_selection': False}. Best is trial 14 with value: 0.14489011797967669.
[I 2025-12-05 14:57:54,684] Trial 140 finished with value: 0.12203817320664845 and parameters: {'model_type': 'mlp', 'hidden_dims': '[512, 256]', 'dropout': 0.10456796745515787, 'batch_norm': True, 'lr': 0.0009258560323691992, 'weight_decay': 2.143903406043519e-07, 'epochs': 210, 'loss': 'mae', 'optimizer': 'adam', 'graph_mode': 'off', 'use_snp_selection': False}. Best is trial 14 with value: 0.14489011797967669.
[I 2025-12-05 14:57:56,221] Trial 141 finished with value: 0.1272451382667532 and parameters: {'model_type': 'mlp', 'hidden_dims': '[512, 256]', 'dropout': 0.16240091021425332, 'batch_norm': True, 'lr': 0.0007726073946740028, 'weight_decay': 6.986567754937406e-07, 'epochs': 196, 'loss': 'mae', 'optimizer': 'adam', 'graph_mode': 'off', 'use_snp_selection': False}. Best is trial 14 with value: 0.14489011797967669.
[I 2025-12-05 14:57:57,811] Trial 142 finished with value: 0.1312014446566544 and parameters: {'model_type': 'mlp', 'hidden_dims': '[512, 256]', 'dropout': 0.16208921331717754, 'batch_norm': True, 'lr': 0.0007416223306376914, 'weight_decay': 5.509335210364651e-07, 'epochs': 207, 'loss': 'mae', 'optimizer': 'adam', 'graph_mode': 'off', 'use_snp_selection': False}. Best is trial 14 with value: 0.14489011797967669.
[I 2025-12-05 14:57:59,863] Trial 143 finished with value: 0.1192286368395363 and parameters: {'model_type': 'mlp', 'hidden_dims': '[512, 256]', 'dropout': 0.15564853776287102, 'batch_norm': True, 'lr': 0.0009455019279971483, 'weight_decay': 5.633100958651856e-07, 'epochs': 332, 'loss': 'mae', 'optimizer': 'adam', 'graph_mode': 'off', 'use_snp_selection': False}. Best is trial 14 with value: 0.14489011797967669.
[I 2025-12-05 14:58:01,424] Trial 144 finished with value: 0.13617672502516787 and parameters: {'model_type': 'mlp', 'hidden_dims': '[512, 256]', 'dropout': 0.13696917113770668, 'batch_norm': True, 'lr': 0.0007548042529938241, 'weight_decay': 4.984237890427356e-07, 'epochs': 204, 'loss': 'mae', 'optimizer': 'adam', 'graph_mode': 'off', 'use_snp_selection': False}. Best is trial 14 with value: 0.14489011797967669.
[I 2025-12-05 14:58:03,008] Trial 145 finished with value: 0.11608096261373516 and parameters: {'model_type': 'mlp', 'hidden_dims': '[512, 256]', 'dropout': 0.14285526922963088, 'batch_norm': True, 'lr': 0.0007222646222095804, 'weight_decay': 4.134021325706339e-07, 'epochs': 213, 'loss': 'mae', 'optimizer': 'adam', 'graph_mode': 'off', 'use_snp_selection': False}. Best is trial 14 with value: 0.14489011797967669.
[I 2025-12-05 14:58:04,586] Trial 146 finished with value: 0.12594083272658738 and parameters: {'model_type': 'mlp', 'hidden_dims': '[512, 256]', 'dropout': 0.1262203376820737, 'batch_norm': True, 'lr': 0.0006594449566621142, 'weight_decay': 4.94714917203842e-07, 'epochs': 204, 'loss': 'mae', 'optimizer': 'adam', 'graph_mode': 'off', 'use_snp_selection': False}. Best is trial 14 with value: 0.14489011797967669.
[I 2025-12-05 14:58:06,106] Trial 147 finished with value: 0.1251939300760953 and parameters: {'model_type': 'mlp', 'hidden_dims': '[512, 256]', 'dropout': 0.12396907144372898, 'batch_norm': True, 'lr': 0.0007925725328168935, 'weight_decay': 2.8506415475092125e-07, 'epochs': 191, 'loss': 'mae', 'optimizer': 'adam', 'graph_mode': 'off', 'use_snp_selection': False}. Best is trial 14 with value: 0.14489011797967669.
[I 2025-12-05 14:58:07,656] Trial 148 finished with value: 0.13769613196553396 and parameters: {'model_type': 'mlp', 'hidden_dims': '[512, 256]', 'dropout': 0.14734926423717673, 'batch_norm': True, 'lr': 0.0009793664592066844, 'weight_decay': 7.97532674539052e-07, 'epochs': 200, 'loss': 'mae', 'optimizer': 'adam', 'graph_mode': 'off', 'use_snp_selection': False}. Best is trial 14 with value: 0.14489011797967669.
[I 2025-12-05 14:58:09,150] Trial 149 finished with value: 0.11582368021231708 and parameters: {'model_type': 'mlp', 'hidden_dims': '[512, 256]', 'dropout': 0.1317204246699721, 'batch_norm': True, 'lr': 0.000989424596938255, 'weight_decay': 3.7535324545660767e-07, 'epochs': 186, 'loss': 'mae', 'optimizer': 'adam', 'graph_mode': 'off', 'use_snp_selection': False}. Best is trial 14 with value: 0.14489011797967669.
[I 2025-12-05 14:58:11,507] Trial 0 finished with value: 0.04278794288704779 and parameters: {'model_type': 'mlp', 'hidden_dims': '[128, 64]', 'dropout': 0.199031432379812, 'batch_norm': True, 'lr': 1.8408544111075837e-06, 'weight_decay': 5.5136510071208614e-05, 'epochs': 336, 'loss': 'mae', 'optimizer': 'adam', 'graph_mode': 'off', 'use_snp_selection': True, 'num_snps': 43862}. Best is trial 0 with value: 0.04278794288704779.
[I 2025-12-05 14:58:12,730] Trial 1 finished with value: 0.04584555531529384 and parameters: {'model_type': 'mlp', 'hidden_dims': '[256, 128]', 'dropout': 0.4370668075331726, 'batch_norm': True, 'lr': 7.133471581159139e-05, 'weight_decay': 1.128633586803549e-05, 'epochs': 242, 'loss': 'mae', 'optimizer': 'adam', 'graph_mode': 'off', 'use_snp_selection': False}. Best is trial 1 with value: 0.04584555531529384.
[I 2025-12-05 14:58:13,792] Trial 2 finished with value: 0.021748289527879702 and parameters: {'model_type': 'mlp', 'hidden_dims': '[256, 128, 64]', 'dropout': 0.41314357415569625, 'batch_norm': False, 'lr': 3.952233718592101e-06, 'weight_decay': 0.00026754769258252603, 'epochs': 149, 'loss': 'mse', 'optimizer': 'adam', 'graph_mode': 'off', 'use_snp_selection': True, 'num_snps': 11571}. Best is trial 1 with value: 0.04584555531529384.
[I 2025-12-05 14:58:15,766] Trial 3 finished with value: 0.061423879295218295 and parameters: {'model_type': 'mlp', 'hidden_dims': '[512, 64]', 'dropout': 0.5938127374509361, 'batch_norm': False, 'lr': 5.67704586114731e-06, 'weight_decay': 2.4518087630137052e-05, 'epochs': 320, 'loss': 'mae', 'optimizer': 'adam', 'graph_mode': 'off', 'use_snp_selection': False}. Best is trial 3 with value: 0.061423879295218295.
[I 2025-12-05 14:58:18,089] Trial 4 finished with value: 0.045237487389324454 and parameters: {'model_type': 'mlp', 'hidden_dims': '[512, 128]', 'dropout': 0.25746343592134413, 'batch_norm': True, 'lr': 1.3467657668402788e-06, 'weight_decay': 0.00033087251918647806, 'epochs': 277, 'loss': 'mse', 'optimizer': 'adam', 'graph_mode': 'off', 'use_snp_selection': True, 'num_snps': 36675}. Best is trial 3 with value: 0.061423879295218295.
[I 2025-12-05 14:58:19,974] Trial 5 finished with value: -0.017930238426775897 and parameters: {'model_type': 'mlp', 'hidden_dims': '[512, 64]', 'dropout': 0.38275350994408375, 'batch_norm': True, 'lr': 1.5586664309232824e-06, 'weight_decay': 0.0008227664668621182, 'epochs': 145, 'loss': 'mae', 'optimizer': 'adam', 'graph_mode': 'off', 'use_snp_selection': True, 'num_snps': 32148}. Best is trial 3 with value: 0.061423879295218295.
[I 2025-12-05 14:58:21,042] Trial 6 finished with value: 0.0666302191264483 and parameters: {'model_type': 'mlp', 'hidden_dims': '[256, 128]', 'dropout': 0.3930109900265879, 'batch_norm': False, 'lr': 4.892964372128395e-05, 'weight_decay': 1.5809549317992182e-06, 'epochs': 199, 'loss': 'mse', 'optimizer': 'adam', 'graph_mode': 'off', 'use_snp_selection': False}. Best is trial 6 with value: 0.0666302191264483.
[I 2025-12-05 14:58:22,167] Trial 7 finished with value: 0.047528327811085874 and parameters: {'model_type': 'mlp', 'hidden_dims': '[512, 256]', 'dropout': 0.15343979219678458, 'batch_norm': True, 'lr': 6.234003099047341e-05, 'weight_decay': 3.894760610535477e-07, 'epochs': 97, 'loss': 'mse', 'optimizer': 'adam', 'graph_mode': 'off', 'use_snp_selection': False}. Best is trial 6 with value: 0.0666302191264483.
[I 2025-12-05 14:58:24,150] Trial 8 finished with value: 0.08384875510056991 and parameters: {'model_type': 'mlp', 'hidden_dims': '[512, 128]', 'dropout': 0.10743001231661406, 'batch_norm': True, 'lr': 0.00023728538449271062, 'weight_decay': 1.7629071578048637e-05, 'epochs': 312, 'loss': 'mae', 'optimizer': 'adam', 'graph_mode': 'off', 'use_snp_selection': False}. Best is trial 8 with value: 0.08384875510056991.
[I 2025-12-05 14:58:25,612] Trial 9 finished with value: 0.0749958604323529 and parameters: {'model_type': 'mlp', 'hidden_dims': '[512, 64]', 'dropout': 0.14505336736221927, 'batch_norm': True, 'lr': 5.8619638388111826e-05, 'weight_decay': 6.200156172669308e-07, 'epochs': 175, 'loss': 'mse', 'optimizer': 'adam', 'graph_mode': 'off', 'use_snp_selection': False}. Best is trial 8 with value: 0.08384875510056991.
[I 2025-12-05 14:58:26,627] Trial 10 finished with value: -0.010650178106781493 and parameters: {'model_type': 'mlp', 'hidden_dims': '[512, 128]', 'dropout': 0.2800030442581858, 'batch_norm': False, 'lr': 0.0004919806695968258, 'weight_decay': 2.9953888095455486e-06, 'epochs': 55, 'loss': 'mae', 'optimizer': 'adam', 'graph_mode': 'off', 'use_snp_selection': False}. Best is trial 8 with value: 0.08384875510056991.
[I 2025-12-05 14:58:28,237] Trial 11 finished with value: 0.07420396056030747 and parameters: {'model_type': 'mlp', 'hidden_dims': '[512, 128]', 'dropout': 0.10095648685224448, 'batch_norm': True, 'lr': 0.0003411435764085616, 'weight_decay': 1.2045055692919657e-07, 'epochs': 216, 'loss': 'mse', 'optimizer': 'adam', 'graph_mode': 'off', 'use_snp_selection': False}. Best is trial 8 with value: 0.08384875510056991.
[I 2025-12-05 14:58:30,071] Trial 12 finished with value: 0.08709136421975923 and parameters: {'model_type': 'mlp', 'hidden_dims': '[512, 64]', 'dropout': 0.10344600881777158, 'batch_norm': True, 'lr': 0.00018400807026440393, 'weight_decay': 2.071258764988014e-06, 'epochs': 281, 'loss': 'mae', 'optimizer': 'adam', 'graph_mode': 'off', 'use_snp_selection': False}. Best is trial 12 with value: 0.08709136421975923.
[I 2025-12-05 14:58:31,108] Trial 13 finished with value: 0.05907507807657754 and parameters: {'model_type': 'mlp', 'hidden_dims': '[128, 64]', 'dropout': 0.24294613148916022, 'batch_norm': True, 'lr': 0.00020209017454184854, 'weight_decay': 4.439089487662099e-06, 'epochs': 285, 'loss': 'mae', 'optimizer': 'adam', 'graph_mode': 'off', 'use_snp_selection': False}. Best is trial 12 with value: 0.08709136421975923.
[I 2025-12-05 14:58:32,409] Trial 14 finished with value: 0.0820497242422016 and parameters: {'model_type': 'mlp', 'hidden_dims': '[256, 128, 64]', 'dropout': 0.3221595656802847, 'batch_norm': True, 'lr': 0.0008417026281429627, 'weight_decay': 5.724103314313124e-05, 'epochs': 282, 'loss': 'mae', 'optimizer': 'adam', 'graph_mode': 'off', 'use_snp_selection': False}. Best is trial 12 with value: 0.08709136421975923.
[I 2025-12-05 14:58:34,178] Trial 15 finished with value: 0.09198169331108737 and parameters: {'model_type': 'mlp', 'hidden_dims': '[512, 256]', 'dropout': 0.10515697852451877, 'batch_norm': True, 'lr': 0.0001572871022003765, 'weight_decay': 1.2913386141637801e-05, 'epochs': 254, 'loss': 'mae', 'optimizer': 'adam', 'graph_mode': 'off', 'use_snp_selection': False}. Best is trial 15 with value: 0.09198169331108737.
[I 2025-12-05 14:58:35,863] Trial 16 finished with value: 0.080012241127426 and parameters: {'model_type': 'mlp', 'hidden_dims': '[512, 256]', 'dropout': 0.18972624182538195, 'batch_norm': True, 'lr': 2.1517090787442848e-05, 'weight_decay': 1.291781474749766e-06, 'epochs': 240, 'loss': 'mae', 'optimizer': 'adam', 'graph_mode': 'off', 'use_snp_selection': False}. Best is trial 15 with value: 0.09198169331108737.
[I 2025-12-05 14:58:37,606] Trial 17 finished with value: 0.08680836053989961 and parameters: {'model_type': 'mlp', 'hidden_dims': '[512, 256]', 'dropout': 0.5019861492125737, 'batch_norm': True, 'lr': 0.00014908853371523303, 'weight_decay': 5.643450860599343e-06, 'epochs': 252, 'loss': 'mae', 'optimizer': 'adam', 'graph_mode': 'off', 'use_snp_selection': False}. Best is trial 15 with value: 0.09198169331108737.
[I 2025-12-05 14:58:41,264] Trial 18 finished with value: 0.081285594120526 and parameters: {'model_type': 'mlp', 'hidden_dims': '[512, 256]', 'dropout': 0.2046842361032689, 'batch_norm': False, 'lr': 1.4446747133286335e-05, 'weight_decay': 5.1284909832915915e-05, 'epochs': 343, 'loss': 'mae', 'optimizer': 'adam', 'graph_mode': 'off', 'use_snp_selection': True, 'num_snps': 58241}. Best is trial 15 with value: 0.09198169331108737.
[I 2025-12-05 14:58:42,929] Trial 19 finished with value: 0.07501258812298309 and parameters: {'model_type': 'mlp', 'hidden_dims': '[512, 64]', 'dropout': 0.3129747392024046, 'batch_norm': True, 'lr': 0.00011777558698136922, 'weight_decay': 1.1354159408743119e-07, 'epochs': 220, 'loss': 'mae', 'optimizer': 'adam', 'graph_mode': 'off', 'use_snp_selection': False}. Best is trial 15 with value: 0.09198169331108737.
[I 2025-12-05 14:58:44,812] Trial 20 finished with value: 0.08803385820649796 and parameters: {'model_type': 'mlp', 'hidden_dims': '[512, 64]', 'dropout': 0.15184468352870642, 'batch_norm': True, 'lr': 0.0006552719114981011, 'weight_decay': 4.970998433397315e-07, 'epochs': 298, 'loss': 'mae', 'optimizer': 'adam', 'graph_mode': 'off', 'use_snp_selection': False}. Best is trial 15 with value: 0.09198169331108737.
[I 2025-12-05 14:58:46,764] Trial 21 finished with value: 0.08121542018624281 and parameters: {'model_type': 'mlp', 'hidden_dims': '[512, 64]', 'dropout': 0.1443819344673735, 'batch_norm': True, 'lr': 0.0004506393917075762, 'weight_decay': 3.41342633393977e-07, 'epochs': 301, 'loss': 'mae', 'optimizer': 'adam', 'graph_mode': 'off', 'use_snp_selection': False}. Best is trial 15 with value: 0.09198169331108737.
[I 2025-12-05 14:58:48,559] Trial 22 finished with value: 0.07292267688332449 and parameters: {'model_type': 'mlp', 'hidden_dims': '[512, 64]', 'dropout': 0.10896828896508379, 'batch_norm': True, 'lr': 0.0008817940804478294, 'weight_decay': 1.5239177099132598e-06, 'epochs': 263, 'loss': 'mae', 'optimizer': 'adam', 'graph_mode': 'off', 'use_snp_selection': False}. Best is trial 15 with value: 0.09198169331108737.
[I 2025-12-05 14:58:50,481] Trial 23 finished with value: 0.07968695496262576 and parameters: {'model_type': 'mlp', 'hidden_dims': '[512, 64]', 'dropout': 0.16885400472458717, 'batch_norm': True, 'lr': 0.00010910689376697023, 'weight_decay': 7.603457471485823e-07, 'epochs': 302, 'loss': 'mae', 'optimizer': 'adam', 'graph_mode': 'off', 'use_snp_selection': False}. Best is trial 15 with value: 0.09198169331108737.
[I 2025-12-05 14:58:52,592] Trial 24 finished with value: 0.08482407454701614 and parameters: {'model_type': 'mlp', 'hidden_dims': '[512, 256]', 'dropout': 0.2206413826040532, 'batch_norm': True, 'lr': 0.0002947875402742632, 'weight_decay': 2.8351135552102902e-06, 'epochs': 349, 'loss': 'mae', 'optimizer': 'adam', 'graph_mode': 'off', 'use_snp_selection': False}. Best is trial 15 with value: 0.09198169331108737.
[I 2025-12-05 14:58:54,416] Trial 25 finished with value: 0.08589733411867943 and parameters: {'model_type': 'mlp', 'hidden_dims': '[512, 64]', 'dropout': 0.1376313905671763, 'batch_norm': True, 'lr': 0.0005777815880203878, 'weight_decay': 2.798260703974572e-07, 'epochs': 269, 'loss': 'mae', 'optimizer': 'adam', 'graph_mode': 'off', 'use_snp_selection': False}. Best is trial 15 with value: 0.09198169331108737.
[I 2025-12-05 14:58:55,388] Trial 26 finished with value: 0.08618820331571682 and parameters: {'model_type': 'mlp', 'hidden_dims': '[256, 128]', 'dropout': 0.18055132958177922, 'batch_norm': True, 'lr': 0.00017707976674322207, 'weight_decay': 8.797311458602284e-06, 'epochs': 224, 'loss': 'mae', 'optimizer': 'adam', 'graph_mode': 'off', 'use_snp_selection': True, 'num_snps': 3842}. Best is trial 15 with value: 0.09198169331108737.
[I 2025-12-05 14:58:56,223] Trial 27 finished with value: 0.08123893455777031 and parameters: {'model_type': 'mlp', 'hidden_dims': '[128, 64]', 'dropout': 0.23469470089187444, 'batch_norm': False, 'lr': 3.708794373669967e-05, 'weight_decay': 2.6086871179536294e-05, 'epochs': 188, 'loss': 'mae', 'optimizer': 'adam', 'graph_mode': 'off', 'use_snp_selection': False}. Best is trial 15 with value: 0.09198169331108737.
[I 2025-12-05 14:58:57,570] Trial 28 finished with value: 0.07767471711970503 and parameters: {'model_type': 'mlp', 'hidden_dims': '[256, 128, 64]', 'dropout': 0.10060105929832897, 'batch_norm': True, 'lr': 0.0009900957955119728, 'weight_decay': 8.74418883788382e-07, 'epochs': 319, 'loss': 'mae', 'optimizer': 'adam', 'graph_mode': 'off', 'use_snp_selection': False}. Best is trial 15 with value: 0.09198169331108737.
[I 2025-12-05 14:58:59,043] Trial 29 finished with value: 0.09068883802461067 and parameters: {'model_type': 'mlp', 'hidden_dims': '[128, 64]', 'dropout': 0.28674370345005284, 'batch_norm': True, 'lr': 0.00010144078784243204, 'weight_decay': 7.556740997596572e-05, 'epochs': 285, 'loss': 'mae', 'optimizer': 'adam', 'graph_mode': 'off', 'use_snp_selection': True, 'num_snps': 19468}. Best is trial 15 with value: 0.09198169331108737.
[I 2025-12-05 14:59:00,546] Trial 30 finished with value: 0.07794017718466822 and parameters: {'model_type': 'mlp', 'hidden_dims': '[128, 64]', 'dropout': 0.27466204540772166, 'batch_norm': True, 'lr': 2.242341516241654e-05, 'weight_decay': 0.00010803940086829997, 'epochs': 333, 'loss': 'mae', 'optimizer': 'adam', 'graph_mode': 'off', 'use_snp_selection': True, 'num_snps': 18365}. Best is trial 15 with value: 0.09198169331108737.
[I 2025-12-05 14:59:02,048] Trial 31 finished with value: 0.0943595051378619 and parameters: {'model_type': 'mlp', 'hidden_dims': '[128, 64]', 'dropout': 0.1916936283070984, 'batch_norm': True, 'lr': 0.00010982548789206364, 'weight_decay': 0.00011956715929206919, 'epochs': 294, 'loss': 'mae', 'optimizer': 'adam', 'graph_mode': 'off', 'use_snp_selection': True, 'num_snps': 20689}. Best is trial 31 with value: 0.0943595051378619.
[I 2025-12-05 14:59:03,462] Trial 32 finished with value: 0.09575816792794001 and parameters: {'model_type': 'mlp', 'hidden_dims': '[128, 64]', 'dropout': 0.20028309380577816, 'batch_norm': True, 'lr': 9.726280405199632e-05, 'weight_decay': 0.0001200421576942237, 'epochs': 250, 'loss': 'mae', 'optimizer': 'adam', 'graph_mode': 'off', 'use_snp_selection': True, 'num_snps': 19001}. Best is trial 32 with value: 0.09575816792794001.
[I 2025-12-05 14:59:04,910] Trial 33 finished with value: 0.07036413949157042 and parameters: {'model_type': 'mlp', 'hidden_dims': '[128, 64]', 'dropout': 0.30404955427283037, 'batch_norm': True, 'lr': 9.182144966572902e-05, 'weight_decay': 0.0001539455046596871, 'epochs': 245, 'loss': 'mae', 'optimizer': 'adam', 'graph_mode': 'off', 'use_snp_selection': True, 'num_snps': 20481}. Best is trial 32 with value: 0.09575816792794001.
[I 2025-12-05 14:59:06,386] Trial 34 finished with value: 0.08676039812997043 and parameters: {'model_type': 'mlp', 'hidden_dims': '[128, 64]', 'dropout': 0.20745329243096164, 'batch_norm': True, 'lr': 7.71853828697709e-05, 'weight_decay': 0.00039889224974556215, 'epochs': 259, 'loss': 'mae', 'optimizer': 'adam', 'graph_mode': 'off', 'use_snp_selection': True, 'num_snps': 20536}. Best is trial 32 with value: 0.09575816792794001.
[I 2025-12-05 14:59:07,851] Trial 35 finished with value: 0.09758881551140278 and parameters: {'model_type': 'mlp', 'hidden_dims': '[128, 64]', 'dropout': 0.3346431042175363, 'batch_norm': False, 'lr': 1.0846998149684478e-05, 'weight_decay': 6.0237500127986706e-05, 'epochs': 237, 'loss': 'mae', 'optimizer': 'adam', 'graph_mode': 'off', 'use_snp_selection': True, 'num_snps': 24542}. Best is trial 35 with value: 0.09758881551140278.
[I 2025-12-05 14:59:09,454] Trial 36 finished with value: 0.0696077298441318 and parameters: {'model_type': 'mlp', 'hidden_dims': '[128, 64]', 'dropout': 0.47665069595857895, 'batch_norm': False, 'lr': 8.925670401097137e-06, 'weight_decay': 0.00018516377497336206, 'epochs': 232, 'loss': 'mse', 'optimizer': 'adam', 'graph_mode': 'off', 'use_snp_selection': True, 'num_snps': 27903}. Best is trial 35 with value: 0.09758881551140278.
