[I 2025-12-05 16:02:56,329] Trial 99 finished with value: 0.01526090116599713 and parameters: {'model_type': 'mlp', 'hidden_dims': '[256, 128, 64]', 'dropout': 0.14610860985719573, 'batch_norm': True, 'lr': 1.1180094412261698e-06, 'weight_decay': 0.00020263337763507975, 'epochs': 106, 'loss': 'mae', 'optimizer': 'adam', 'graph_mode': 'off', 'use_snp_selection': False}. Best is trial 84 with value: 0.08996978047822614.
[I 2025-12-05 16:02:57,510] Trial 100 finished with value: 0.06006349160091488 and parameters: {'model_type': 'mlp', 'hidden_dims': '[512, 256]', 'dropout': 0.1198489401879308, 'batch_norm': True, 'lr': 0.00022925507611162992, 'weight_decay': 0.00014983317318139903, 'epochs': 126, 'loss': 'mae', 'optimizer': 'adam', 'graph_mode': 'off', 'use_snp_selection': True, 'num_snps': 6413}. Best is trial 84 with value: 0.08996978047822614.
[I 2025-12-05 16:02:59,552] Trial 101 finished with value: 0.08596551888024316 and parameters: {'model_type': 'mlp', 'hidden_dims': '[512, 128]', 'dropout': 0.16432155415961003, 'batch_norm': True, 'lr': 0.0007060436244864275, 'weight_decay': 0.0003914163465514382, 'epochs': 160, 'loss': 'mae', 'optimizer': 'adam', 'graph_mode': 'off', 'use_snp_selection': False}. Best is trial 84 with value: 0.08996978047822614.
[I 2025-12-05 16:03:01,575] Trial 102 finished with value: 0.0705318067443277 and parameters: {'model_type': 'mlp', 'hidden_dims': '[512, 128]', 'dropout': 0.19218107890252945, 'batch_norm': True, 'lr': 0.0003085640462822845, 'weight_decay': 0.00044148851692813867, 'epochs': 162, 'loss': 'mae', 'optimizer': 'adam', 'graph_mode': 'off', 'use_snp_selection': False}. Best is trial 84 with value: 0.08996978047822614.
[I 2025-12-05 16:03:03,746] Trial 103 finished with value: 0.06555203057444874 and parameters: {'model_type': 'mlp', 'hidden_dims': '[512, 128]', 'dropout': 0.16393061203803502, 'batch_norm': True, 'lr': 0.00045619496024834117, 'weight_decay': 0.0002565913556784235, 'epochs': 176, 'loss': 'mae', 'optimizer': 'adam', 'graph_mode': 'off', 'use_snp_selection': False}. Best is trial 84 with value: 0.08996978047822614.
[I 2025-12-05 16:03:04,640] Trial 104 finished with value: 0.06502752993975809 and parameters: {'model_type': 'mlp', 'hidden_dims': '[128, 64]', 'dropout': 0.17961308823114547, 'batch_norm': True, 'lr': 0.0005305612572168103, 'weight_decay': 0.0003851301352538046, 'epochs': 144, 'loss': 'mae', 'optimizer': 'adam', 'graph_mode': 'off', 'use_snp_selection': False}. Best is trial 84 with value: 0.08996978047822614.
[I 2025-12-05 16:03:06,467] Trial 105 finished with value: 0.08919366345932896 and parameters: {'model_type': 'mlp', 'hidden_dims': '[512, 128]', 'dropout': 0.13771301211603104, 'batch_norm': True, 'lr': 0.0008691127394404737, 'weight_decay': 0.0006702917280922024, 'epochs': 134, 'loss': 'mae', 'optimizer': 'adam', 'graph_mode': 'off', 'use_snp_selection': False}. Best is trial 84 with value: 0.08996978047822614.
[I 2025-12-05 16:03:08,297] Trial 106 finished with value: 0.062330265596833155 and parameters: {'model_type': 'mlp', 'hidden_dims': '[512, 64]', 'dropout': 0.11514433467683309, 'batch_norm': True, 'lr': 0.0008029336541219364, 'weight_decay': 0.0005662283389018551, 'epochs': 134, 'loss': 'mae', 'optimizer': 'adam', 'graph_mode': 'off', 'use_snp_selection': False}. Best is trial 84 with value: 0.08996978047822614.
[I 2025-12-05 16:03:10,330] Trial 107 finished with value: 0.07457005538400963 and parameters: {'model_type': 'mlp', 'hidden_dims': '[512, 128]', 'dropout': 0.14168719538785723, 'batch_norm': True, 'lr': 0.0008888102468896697, 'weight_decay': 0.0007853016365416879, 'epochs': 158, 'loss': 'mae', 'optimizer': 'adam', 'graph_mode': 'off', 'use_snp_selection': False}. Best is trial 84 with value: 0.08996978047822614.
[I 2025-12-05 16:03:11,830] Trial 108 finished with value: 0.06511784316224624 and parameters: {'model_type': 'mlp', 'hidden_dims': '[512, 128]', 'dropout': 0.1765260789697106, 'batch_norm': True, 'lr': 0.0007477750161584236, 'weight_decay': 3.020930048626635e-05, 'epochs': 93, 'loss': 'mae', 'optimizer': 'adam', 'graph_mode': 'off', 'use_snp_selection': False}. Best is trial 84 with value: 0.08996978047822614.
[I 2025-12-05 16:03:13,878] Trial 109 finished with value: 0.06278731283588056 and parameters: {'model_type': 'mlp', 'hidden_dims': '[512, 128]', 'dropout': 0.263194376129926, 'batch_norm': True, 'lr': 0.0007074364942798271, 'weight_decay': 0.0006745643886921233, 'epochs': 166, 'loss': 'mae', 'optimizer': 'adam', 'graph_mode': 'off', 'use_snp_selection': False}. Best is trial 84 with value: 0.08996978047822614.
[I 2025-12-05 16:03:14,710] Trial 110 finished with value: 0.07639365099050946 and parameters: {'model_type': 'mlp', 'hidden_dims': '[128, 64]', 'dropout': 0.224504153852548, 'batch_norm': True, 'lr': 0.00012739417138956234, 'weight_decay': 8.136742905622578e-05, 'epochs': 120, 'loss': 'mse', 'optimizer': 'adam', 'graph_mode': 'off', 'use_snp_selection': False}. Best is trial 84 with value: 0.08996978047822614.
[I 2025-12-05 16:03:15,540] Trial 111 finished with value: 0.0813308518953962 and parameters: {'model_type': 'mlp', 'hidden_dims': '[128, 64]', 'dropout': 0.12297799884811807, 'batch_norm': True, 'lr': 0.00013337359070046058, 'weight_decay': 9.314539075841646e-05, 'epochs': 102, 'loss': 'mae', 'optimizer': 'adam', 'graph_mode': 'off', 'use_snp_selection': False}. Best is trial 84 with value: 0.08996978047822614.
[I 2025-12-05 16:03:16,316] Trial 112 finished with value: 0.05902251159550721 and parameters: {'model_type': 'mlp', 'hidden_dims': '[128, 64]', 'dropout': 0.12418004445911987, 'batch_norm': True, 'lr': 0.0002561624146744777, 'weight_decay': 0.00010882705464563392, 'epochs': 79, 'loss': 'mae', 'optimizer': 'adam', 'graph_mode': 'off', 'use_snp_selection': False}. Best is trial 84 with value: 0.08996978047822614.
[I 2025-12-05 16:03:17,141] Trial 113 finished with value: 0.05842849277366603 and parameters: {'model_type': 'mlp', 'hidden_dims': '[128, 64]', 'dropout': 0.15077503434938322, 'batch_norm': True, 'lr': 0.0008707734497550733, 'weight_decay': 0.0009109112838257912, 'epochs': 110, 'loss': 'mae', 'optimizer': 'adam', 'graph_mode': 'off', 'use_snp_selection': False}. Best is trial 84 with value: 0.08996978047822614.
[I 2025-12-05 16:03:17,935] Trial 114 finished with value: 0.06278427630585713 and parameters: {'model_type': 'mlp', 'hidden_dims': '[128, 64]', 'dropout': 0.13693904339409438, 'batch_norm': True, 'lr': 8.740711869790335e-05, 'weight_decay': 5.764279010856397e-05, 'epochs': 99, 'loss': 'mae', 'optimizer': 'adam', 'graph_mode': 'off', 'use_snp_selection': False}. Best is trial 84 with value: 0.08996978047822614.
[I 2025-12-05 16:03:19,211] Trial 115 finished with value: 0.07248377877734122 and parameters: {'model_type': 'mlp', 'hidden_dims': '[512, 128]', 'dropout': 0.11355988464230075, 'batch_norm': True, 'lr': 0.0001636914765128497, 'weight_decay': 4.753891669225716e-05, 'epochs': 67, 'loss': 'mae', 'optimizer': 'adam', 'graph_mode': 'off', 'use_snp_selection': False}. Best is trial 84 with value: 0.08996978047822614.
[I 2025-12-05 16:03:21,029] Trial 116 finished with value: 0.06791554746364598 and parameters: {'model_type': 'mlp', 'hidden_dims': '[512, 256]', 'dropout': 0.16300469412408902, 'batch_norm': True, 'lr': 0.0005602006718379059, 'weight_decay': 8.401885607881876e-06, 'epochs': 132, 'loss': 'mae', 'optimizer': 'adam', 'graph_mode': 'off', 'use_snp_selection': False}. Best is trial 84 with value: 0.08996978047822614.
[I 2025-12-05 16:03:23,148] Trial 117 finished with value: 0.04359354593967593 and parameters: {'model_type': 'mlp', 'hidden_dims': '[512, 128]', 'dropout': 0.12390149806663875, 'batch_norm': False, 'lr': 0.000373242691456197, 'weight_decay': 1.8737712833597336e-05, 'epochs': 173, 'loss': 'mae', 'optimizer': 'adam', 'graph_mode': 'off', 'use_snp_selection': False}. Best is trial 84 with value: 0.08996978047822614.
[I 2025-12-05 16:03:24,896] Trial 118 finished with value: 0.061436882368949855 and parameters: {'model_type': 'mlp', 'hidden_dims': '[512, 128]', 'dropout': 0.150513421249185, 'batch_norm': True, 'lr': 0.00045259561636042713, 'weight_decay': 0.0002956140817772143, 'epochs': 124, 'loss': 'mae', 'optimizer': 'adam', 'graph_mode': 'off', 'use_snp_selection': False}. Best is trial 84 with value: 0.08996978047822614.
[I 2025-12-05 16:03:26,591] Trial 119 finished with value: 0.06973179867390729 and parameters: {'model_type': 'mlp', 'hidden_dims': '[128, 64]', 'dropout': 0.10178051455271898, 'batch_norm': True, 'lr': 0.0001301214783940431, 'weight_decay': 0.00016342613220497908, 'epochs': 138, 'loss': 'mae', 'optimizer': 'adam', 'graph_mode': 'off', 'use_snp_selection': True, 'num_snps': 25061}. Best is trial 84 with value: 0.08996978047822614.
[I 2025-12-05 16:03:27,990] Trial 120 finished with value: 0.06592796117619622 and parameters: {'model_type': 'mlp', 'hidden_dims': '[256, 128, 64]', 'dropout': 0.19547168134976312, 'batch_norm': True, 'lr': 0.00023009868984281726, 'weight_decay': 0.00043524778318647443, 'epochs': 184, 'loss': 'mae', 'optimizer': 'adam', 'graph_mode': 'off', 'use_snp_selection': False}. Best is trial 84 with value: 0.08996978047822614.
[I 2025-12-05 16:03:28,852] Trial 121 finished with value: 0.07021763549283683 and parameters: {'model_type': 'mlp', 'hidden_dims': '[128, 64]', 'dropout': 0.228593630859201, 'batch_norm': True, 'lr': 0.00011797451995834668, 'weight_decay': 8.65528928406802e-05, 'epochs': 120, 'loss': 'mse', 'optimizer': 'adam', 'graph_mode': 'off', 'use_snp_selection': False}. Best is trial 84 with value: 0.08996978047822614.
[I 2025-12-05 16:03:29,661] Trial 122 finished with value: 0.0738174046686342 and parameters: {'model_type': 'mlp', 'hidden_dims': '[128, 64]', 'dropout': 0.22088153076376668, 'batch_norm': True, 'lr': 8.704667427697734e-05, 'weight_decay': 0.0002183118582755182, 'epochs': 102, 'loss': 'mse', 'optimizer': 'adam', 'graph_mode': 'off', 'use_snp_selection': False}. Best is trial 84 with value: 0.08996978047822614.
[I 2025-12-05 16:03:30,490] Trial 123 finished with value: 0.054219324910360155 and parameters: {'model_type': 'mlp', 'hidden_dims': '[128, 64]', 'dropout': 0.5670618477607076, 'batch_norm': True, 'lr': 0.0006560585001585551, 'weight_decay': 7.686734176883876e-05, 'epochs': 117, 'loss': 'mse', 'optimizer': 'adam', 'graph_mode': 'off', 'use_snp_selection': False}. Best is trial 84 with value: 0.08996978047822614.
[I 2025-12-05 16:03:31,375] Trial 124 finished with value: 0.036449936791794174 and parameters: {'model_type': 'mlp', 'hidden_dims': '[128, 64]', 'dropout': 0.24391491894748873, 'batch_norm': True, 'lr': 0.00014356187510229966, 'weight_decay': 0.0006145899315668548, 'epochs': 154, 'loss': 'mse', 'optimizer': 'adam', 'graph_mode': 'off', 'use_snp_selection': False}. Best is trial 84 with value: 0.08996978047822614.
[I 2025-12-05 16:03:32,803] Trial 125 finished with value: 0.06642717741016166 and parameters: {'model_type': 'mlp', 'hidden_dims': '[512, 128]', 'dropout': 0.11207414448402246, 'batch_norm': True, 'lr': 0.0009881000860153947, 'weight_decay': 0.0009999136878340287, 'epochs': 89, 'loss': 'mse', 'optimizer': 'adam', 'graph_mode': 'off', 'use_snp_selection': False}. Best is trial 84 with value: 0.08996978047822614.
[I 2025-12-05 16:03:34,655] Trial 126 finished with value: 0.06393028563698375 and parameters: {'model_type': 'mlp', 'hidden_dims': '[512, 128]', 'dropout': 0.13625956653991134, 'batch_norm': True, 'lr': 0.0005144123020462528, 'weight_decay': 3.0034691463011946e-06, 'epochs': 142, 'loss': 'mse', 'optimizer': 'adam', 'graph_mode': 'off', 'use_snp_selection': False}. Best is trial 84 with value: 0.08996978047822614.
[I 2025-12-05 16:03:35,475] Trial 127 finished with value: 0.07809136614614574 and parameters: {'model_type': 'mlp', 'hidden_dims': '[128, 64]', 'dropout': 0.1870834163827367, 'batch_norm': True, 'lr': 0.0001893713377237226, 'weight_decay': 0.00012713705997332702, 'epochs': 108, 'loss': 'mae', 'optimizer': 'adam', 'graph_mode': 'off', 'use_snp_selection': False}. Best is trial 84 with value: 0.08996978047822614.
[I 2025-12-05 16:03:37,072] Trial 128 finished with value: 0.0731677038693364 and parameters: {'model_type': 'mlp', 'hidden_dims': '[512, 128]', 'dropout': 0.1834727976505851, 'batch_norm': True, 'lr': 0.0003349674788928798, 'weight_decay': 0.0001225919412640407, 'epochs': 108, 'loss': 'mae', 'optimizer': 'adam', 'graph_mode': 'off', 'use_snp_selection': False}. Best is trial 84 with value: 0.08996978047822614.
[I 2025-12-05 16:03:38,330] Trial 129 finished with value: 0.05514230696199214 and parameters: {'model_type': 'mlp', 'hidden_dims': '[512, 64]', 'dropout': 0.16117364214631724, 'batch_norm': True, 'lr': 0.0007429458397648677, 'weight_decay': 3.949038782497876e-06, 'epochs': 66, 'loss': 'mae', 'optimizer': 'adam', 'graph_mode': 'off', 'use_snp_selection': False}. Best is trial 84 with value: 0.08996978047822614.
[I 2025-12-05 16:03:39,745] Trial 130 finished with value: 0.03966181177353984 and parameters: {'model_type': 'mlp', 'hidden_dims': '[512, 256]', 'dropout': 0.1721378002849306, 'batch_norm': True, 'lr': 2.482918876985895e-06, 'weight_decay': 0.00032239203493776515, 'epochs': 84, 'loss': 'mae', 'optimizer': 'adam', 'graph_mode': 'off', 'use_snp_selection': False}. Best is trial 84 with value: 0.08996978047822614.
[I 2025-12-05 16:03:40,568] Trial 131 finished with value: 0.056711606009970016 and parameters: {'model_type': 'mlp', 'hidden_dims': '[128, 64]', 'dropout': 0.2044352586512709, 'batch_norm': True, 'lr': 0.00018252811864329224, 'weight_decay': 8.795732141936955e-05, 'epochs': 124, 'loss': 'mae', 'optimizer': 'adam', 'graph_mode': 'off', 'use_snp_selection': False}. Best is trial 84 with value: 0.08996978047822614.
[I 2025-12-05 16:03:41,362] Trial 132 finished with value: 0.06637651494624809 and parameters: {'model_type': 'mlp', 'hidden_dims': '[128, 64]', 'dropout': 0.2239127173559606, 'batch_norm': True, 'lr': 0.00015605371416711815, 'weight_decay': 6.354902587892332e-05, 'epochs': 115, 'loss': 'mae', 'optimizer': 'adam', 'graph_mode': 'off', 'use_snp_selection': False}. Best is trial 84 with value: 0.08996978047822614.
[I 2025-12-05 16:03:42,152] Trial 133 finished with value: 0.07115196314363709 and parameters: {'model_type': 'mlp', 'hidden_dims': '[128, 64]', 'dropout': 0.2139540671106838, 'batch_norm': True, 'lr': 0.00020601316109917448, 'weight_decay': 0.00012389887993864937, 'epochs': 98, 'loss': 'mae', 'optimizer': 'adam', 'graph_mode': 'off', 'use_snp_selection': False}. Best is trial 84 with value: 0.08996978047822614.
[I 2025-12-05 16:03:43,009] Trial 134 finished with value: 0.06892466980259992 and parameters: {'model_type': 'mlp', 'hidden_dims': '[128, 64]', 'dropout': 0.19032465936127424, 'batch_norm': True, 'lr': 0.0002743586396296475, 'weight_decay': 4.3671959645806195e-05, 'epochs': 146, 'loss': 'mae', 'optimizer': 'adam', 'graph_mode': 'off', 'use_snp_selection': False}. Best is trial 84 with value: 0.08996978047822614.
[I 2025-12-05 16:03:43,884] Trial 135 finished with value: 0.05624676867757017 and parameters: {'model_type': 'mlp', 'hidden_dims': '[128, 64]', 'dropout': 0.12575237867183273, 'batch_norm': True, 'lr': 9.451992795808478e-05, 'weight_decay': 0.0007894492573133151, 'epochs': 136, 'loss': 'mae', 'optimizer': 'adam', 'graph_mode': 'off', 'use_snp_selection': False}. Best is trial 84 with value: 0.08996978047822614.
[I 2025-12-05 16:03:45,908] Trial 136 finished with value: 0.06859900746792373 and parameters: {'model_type': 'mlp', 'hidden_dims': '[512, 128]', 'dropout': 0.10043274011342769, 'batch_norm': True, 'lr': 0.0006011148788598016, 'weight_decay': 1.6334238127408992e-06, 'epochs': 161, 'loss': 'mae', 'optimizer': 'adam', 'graph_mode': 'off', 'use_snp_selection': False}. Best is trial 84 with value: 0.08996978047822614.
[I 2025-12-05 16:03:47,632] Trial 137 finished with value: 0.05164423252666231 and parameters: {'model_type': 'mlp', 'hidden_dims': '[512, 128]', 'dropout': 0.1428774655866839, 'batch_norm': False, 'lr': 0.0002277836836421299, 'weight_decay': 0.00018149566932896638, 'epochs': 129, 'loss': 'mae', 'optimizer': 'adam', 'graph_mode': 'off', 'use_snp_selection': False}. Best is trial 84 with value: 0.08996978047822614.
[I 2025-12-05 16:03:48,536] Trial 138 finished with value: 0.06351791695169763 and parameters: {'model_type': 'mlp', 'hidden_dims': '[128, 64]', 'dropout': 0.24848503897211177, 'batch_norm': True, 'lr': 0.0008442897830183108, 'weight_decay': 0.0005143820770639496, 'epochs': 154, 'loss': 'mae', 'optimizer': 'adam', 'graph_mode': 'off', 'use_snp_selection': False}. Best is trial 84 with value: 0.08996978047822614.
[I 2025-12-05 16:03:50,225] Trial 139 finished with value: 0.05662097410854624 and parameters: {'model_type': 'mlp', 'hidden_dims': '[512, 128]', 'dropout': 0.2605342463332755, 'batch_norm': True, 'lr': 0.00013184879593757185, 'weight_decay': 0.0006562780733851193, 'epochs': 121, 'loss': 'mae', 'optimizer': 'adam', 'graph_mode': 'off', 'use_snp_selection': False}. Best is trial 84 with value: 0.08996978047822614.
[I 2025-12-05 16:03:51,753] Trial 140 finished with value: 0.02935148726042197 and parameters: {'model_type': 'mlp', 'hidden_dims': '[256, 128]', 'dropout': 0.1138704059245438, 'batch_norm': True, 'lr': 6.22702372751995e-05, 'weight_decay': 5.219364121649096e-07, 'epochs': 112, 'loss': 'mse', 'optimizer': 'adam', 'graph_mode': 'off', 'use_snp_selection': True, 'num_snps': 19015}. Best is trial 84 with value: 0.08996978047822614.
[I 2025-12-05 16:03:53,663] Trial 141 finished with value: 0.0469171019719291 and parameters: {'model_type': 'mlp', 'hidden_dims': '[512, 128]', 'dropout': 0.1282097606313004, 'batch_norm': True, 'lr': 0.00027187233836978406, 'weight_decay': 0.0002511186016430278, 'epochs': 148, 'loss': 'mae', 'optimizer': 'adam', 'graph_mode': 'off', 'use_snp_selection': False}. Best is trial 84 with value: 0.08996978047822614.
[I 2025-12-05 16:03:55,732] Trial 142 finished with value: 0.05879138598448197 and parameters: {'model_type': 'mlp', 'hidden_dims': '[512, 128]', 'dropout': 0.13206464699750967, 'batch_norm': True, 'lr': 0.0003307706094681119, 'weight_decay': 9.952564962497794e-05, 'epochs': 169, 'loss': 'mae', 'optimizer': 'adam', 'graph_mode': 'off', 'use_snp_selection': False}. Best is trial 84 with value: 0.08996978047822614.
[I 2025-12-05 16:03:57,636] Trial 143 finished with value: 0.05304940992059676 and parameters: {'model_type': 'mlp', 'hidden_dims': '[512, 128]', 'dropout': 0.15244583809367648, 'batch_norm': True, 'lr': 0.00018384773492263986, 'weight_decay': 0.00037569455836339636, 'epochs': 148, 'loss': 'mae', 'optimizer': 'adam', 'graph_mode': 'off', 'use_snp_selection': False}. Best is trial 84 with value: 0.08996978047822614.
[I 2025-12-05 16:04:00,430] Trial 144 finished with value: 0.07289253729283626 and parameters: {'model_type': 'mlp', 'hidden_dims': '[512, 128]', 'dropout': 0.11943838152759627, 'batch_norm': True, 'lr': 0.000385570315051713, 'weight_decay': 0.00033198975825123197, 'epochs': 260, 'loss': 'mae', 'optimizer': 'adam', 'graph_mode': 'off', 'use_snp_selection': False}. Best is trial 84 with value: 0.08996978047822614.
[I 2025-12-05 16:04:02,218] Trial 145 finished with value: 0.049803982361280384 and parameters: {'model_type': 'mlp', 'hidden_dims': '[512, 128]', 'dropout': 0.23515061157506054, 'batch_norm': True, 'lr': 0.0003014399369272338, 'weight_decay': 0.00047412180924148695, 'epochs': 130, 'loss': 'mae', 'optimizer': 'adam', 'graph_mode': 'off', 'use_snp_selection': False}. Best is trial 84 with value: 0.08996978047822614.
[I 2025-12-05 16:04:05,674] Trial 146 finished with value: 0.07241193680565694 and parameters: {'model_type': 'mlp', 'hidden_dims': '[512, 256]', 'dropout': 0.13907724495604587, 'batch_norm': True, 'lr': 0.0002470162785186629, 'weight_decay': 0.00014572455883538228, 'epochs': 343, 'loss': 'mae', 'optimizer': 'adam', 'graph_mode': 'off', 'use_snp_selection': False}. Best is trial 84 with value: 0.08996978047822614.
[I 2025-12-05 16:04:07,675] Trial 147 finished with value: 0.06657527835621638 and parameters: {'model_type': 'mlp', 'hidden_dims': '[512, 128]', 'dropout': 0.11060966039630127, 'batch_norm': True, 'lr': 0.000443030680641555, 'weight_decay': 1.1046615456716253e-06, 'epochs': 158, 'loss': 'mae', 'optimizer': 'adam', 'graph_mode': 'off', 'use_snp_selection': False}. Best is trial 84 with value: 0.08996978047822614.
[I 2025-12-05 16:04:08,551] Trial 148 finished with value: 0.06780097796707137 and parameters: {'model_type': 'mlp', 'hidden_dims': '[128, 64]', 'dropout': 0.2015414418551362, 'batch_norm': True, 'lr': 0.0006762286028223913, 'weight_decay': 7.921509251350519e-05, 'epochs': 142, 'loss': 'mae', 'optimizer': 'adam', 'graph_mode': 'off', 'use_snp_selection': False}. Best is trial 84 with value: 0.08996978047822614.
[I 2025-12-05 16:04:10,138] Trial 149 finished with value: 0.06301180627709944 and parameters: {'model_type': 'mlp', 'hidden_dims': '[512, 128]', 'dropout': 0.1701080690501659, 'batch_norm': True, 'lr': 0.0005549570651491739, 'weight_decay': 0.00022061646386179024, 'epochs': 105, 'loss': 'mae', 'optimizer': 'adam', 'graph_mode': 'off', 'use_snp_selection': False}. Best is trial 84 with value: 0.08996978047822614.
[I 2025-12-05 16:04:13,340] Trial 0 finished with value: 0.05491761360626092 and parameters: {'model_type': 'mlp', 'hidden_dims': '[128, 64]', 'dropout': 0.199031432379812, 'batch_norm': True, 'lr': 1.8408544111075837e-06, 'weight_decay': 5.5136510071208614e-05, 'epochs': 336, 'loss': 'mae', 'optimizer': 'adam', 'graph_mode': 'off', 'use_snp_selection': True, 'num_snps': 43862}. Best is trial 0 with value: 0.05491761360626092.
