[I 2025-12-06 07:32:10,951] Trial 37 finished with value: 0.20936261870484224 and parameters: {'model_type': 'mlp', 'hidden_dims': '[256, 128]', 'dropout': 0.3830258924563234, 'batch_norm': False, 'lr': 0.00011369591206173368, 'weight_decay': 1.4089006700519878e-05, 'epochs': 183, 'loss': 'mae', 'optimizer': 'adam', 'graph_mode': 'off', 'use_snp_selection': True, 'num_snps': 26324}. Best is trial 28 with value: 0.2663812453467505.
[I 2025-12-06 07:33:10,589] Trial 38 finished with value: 0.12963313775263613 and parameters: {'model_type': 'mlp', 'hidden_dims': '[256, 128, 64]', 'dropout': 0.26313365190447197, 'batch_norm': True, 'lr': 1.6449266836877506e-06, 'weight_decay': 0.00027547726099452546, 'epochs': 157, 'loss': 'mse', 'optimizer': 'adam', 'graph_mode': 'off', 'use_snp_selection': True, 'num_snps': 43229}. Best is trial 28 with value: 0.2663812453467505.
[I 2025-12-06 07:34:05,732] Trial 39 finished with value: 0.2300341078483969 and parameters: {'model_type': 'mlp', 'hidden_dims': '[256, 128, 64]', 'dropout': 0.35315749468844054, 'batch_norm': False, 'lr': 3.7482791649692107e-06, 'weight_decay': 2.6706649986383867e-05, 'epochs': 77, 'loss': 'mae', 'optimizer': 'adam', 'graph_mode': 'off', 'use_snp_selection': True, 'num_snps': 49994}. Best is trial 28 with value: 0.2663812453467505.
[I 2025-12-06 07:35:07,376] Trial 40 finished with value: 0.13977574707191615 and parameters: {'model_type': 'mlp', 'hidden_dims': '[512, 256]', 'dropout': 0.4091573933288741, 'batch_norm': True, 'lr': 1.9174489473979236e-06, 'weight_decay': 0.00021899029383528427, 'epochs': 195, 'loss': 'mae', 'optimizer': 'adam', 'graph_mode': 'off', 'use_snp_selection': False}. Best is trial 28 with value: 0.2663812453467505.
[I 2025-12-06 07:36:20,765] Trial 41 finished with value: 0.2376275098018797 and parameters: {'model_type': 'mlp', 'hidden_dims': '[256, 128, 64]', 'dropout': 0.30302654403588514, 'batch_norm': False, 'lr': 4.621643387691326e-06, 'weight_decay': 9.2583780456999e-05, 'epochs': 218, 'loss': 'mae', 'optimizer': 'adam', 'graph_mode': 'off', 'use_snp_selection': True, 'num_snps': 53328}. Best is trial 28 with value: 0.2663812453467505.
[I 2025-12-06 07:37:25,029] Trial 42 finished with value: 0.21139808040727628 and parameters: {'model_type': 'mlp', 'hidden_dims': '[256, 128, 64]', 'dropout': 0.28924765576967376, 'batch_norm': False, 'lr': 3.885359781979565e-05, 'weight_decay': 4.48925640327905e-05, 'epochs': 239, 'loss': 'mae', 'optimizer': 'adam', 'graph_mode': 'off', 'use_snp_selection': True, 'num_snps': 39992}. Best is trial 28 with value: 0.2663812453467505.
[I 2025-12-06 07:39:05,873] Trial 43 finished with value: 0.21430260329239198 and parameters: {'model_type': 'mlp', 'hidden_dims': '[512, 64]', 'dropout': 0.2503277240636044, 'batch_norm': False, 'lr': 1.0058850316659855e-05, 'weight_decay': 2.119203741667526e-05, 'epochs': 195, 'loss': 'mae', 'optimizer': 'adam', 'graph_mode': 'off', 'use_snp_selection': True, 'num_snps': 59589}. Best is trial 28 with value: 0.2663812453467505.
[I 2025-12-06 07:40:07,071] Trial 44 finished with value: 0.23947791084373607 and parameters: {'model_type': 'mlp', 'hidden_dims': '[256, 128, 64]', 'dropout': 0.2687158225661593, 'batch_norm': False, 'lr': 5.960855366708651e-06, 'weight_decay': 0.00044035175292927645, 'epochs': 270, 'loss': 'mae', 'optimizer': 'adam', 'graph_mode': 'off', 'use_snp_selection': True, 'num_snps': 33726}. Best is trial 28 with value: 0.2663812453467505.
[I 2025-12-06 07:41:23,870] Trial 45 finished with value: 0.21739629360650606 and parameters: {'model_type': 'mlp', 'hidden_dims': '[256, 128]', 'dropout': 0.17592033354474204, 'batch_norm': False, 'lr': 3.1971478853322324e-06, 'weight_decay': 0.00021846468075087727, 'epochs': 306, 'loss': 'mse', 'optimizer': 'adam', 'graph_mode': 'off', 'use_snp_selection': True, 'num_snps': 45430}. Best is trial 28 with value: 0.2663812453467505.
[I 2025-12-06 07:42:23,798] Trial 46 finished with value: 0.1697269066674668 and parameters: {'model_type': 'mlp', 'hidden_dims': '[512, 128]', 'dropout': 0.34146775070866187, 'batch_norm': True, 'lr': 1.5125904623320387e-06, 'weight_decay': 1.2128654489416474e-05, 'epochs': 188, 'loss': 'mae', 'optimizer': 'adam', 'graph_mode': 'off', 'use_snp_selection': False}. Best is trial 28 with value: 0.2663812453467505.
[I 2025-12-06 07:43:00,370] Trial 47 finished with value: 0.23191000015883137 and parameters: {'model_type': 'mlp', 'hidden_dims': '[256, 128, 64]', 'dropout': 0.5569580765494934, 'batch_norm': False, 'lr': 1.6940060266998925e-05, 'weight_decay': 8.02507643499629e-05, 'epochs': 214, 'loss': 'mae', 'optimizer': 'adam', 'graph_mode': 'off', 'use_snp_selection': False}. Best is trial 28 with value: 0.2663812453467505.
[I 2025-12-06 07:43:51,069] Trial 48 finished with value: 0.2421516398272742 and parameters: {'model_type': 'mlp', 'hidden_dims': '[128, 64]', 'dropout': 0.24351875419458455, 'batch_norm': False, 'lr': 2.1917472564998524e-06, 'weight_decay': 2.1026512342361805e-05, 'epochs': 160, 'loss': 'mae', 'optimizer': 'adam', 'graph_mode': 'off', 'use_snp_selection': True, 'num_snps': 41263}. Best is trial 28 with value: 0.2663812453467505.
[I 2025-12-06 07:45:07,557] Trial 49 finished with value: 0.2059027927964046 and parameters: {'model_type': 'mlp', 'hidden_dims': '[512, 64]', 'dropout': 0.27648923849291995, 'batch_norm': False, 'lr': 5.215707973168494e-06, 'weight_decay': 4.7808601714614583e-05, 'epochs': 249, 'loss': 'mse', 'optimizer': 'adam', 'graph_mode': 'off', 'use_snp_selection': False}. Best is trial 28 with value: 0.2663812453467505.
[I 2025-12-06 07:46:01,319] Trial 50 finished with value: 0.23001716255966737 and parameters: {'model_type': 'mlp', 'hidden_dims': '[256, 128, 64]', 'dropout': 0.22851507226728546, 'batch_norm': False, 'lr': 9.336811741405452e-06, 'weight_decay': 5.3475771209334086e-06, 'epochs': 230, 'loss': 'mae', 'optimizer': 'adam', 'graph_mode': 'off', 'use_snp_selection': True, 'num_snps': 27835}. Best is trial 28 with value: 0.2663812453467505.
[I 2025-12-06 07:46:43,170] Trial 51 finished with value: 0.2228888064211234 and parameters: {'model_type': 'mlp', 'hidden_dims': '[256, 128, 64]', 'dropout': 0.30735840358322025, 'batch_norm': False, 'lr': 5.8550550833821515e-06, 'weight_decay': 6.448135252496349e-05, 'epochs': 210, 'loss': 'mae', 'optimizer': 'adam', 'graph_mode': 'off', 'use_snp_selection': True, 'num_snps': 15094}. Best is trial 28 with value: 0.2663812453467505.
[I 2025-12-06 07:47:40,028] Trial 52 finished with value: 0.24639589073967533 and parameters: {'model_type': 'mlp', 'hidden_dims': '[256, 128, 64]', 'dropout': 0.333204950171284, 'batch_norm': False, 'lr': 7.157190313595966e-06, 'weight_decay': 2.9921924375706818e-05, 'epochs': 194, 'loss': 'mae', 'optimizer': 'adam', 'graph_mode': 'off', 'use_snp_selection': True, 'num_snps': 34741}. Best is trial 28 with value: 0.2663812453467505.
[I 2025-12-06 07:48:36,528] Trial 53 finished with value: 0.2006238447113135 and parameters: {'model_type': 'mlp', 'hidden_dims': '[256, 128, 64]', 'dropout': 0.37488572568331313, 'batch_norm': False, 'lr': 1.3044364509505766e-06, 'weight_decay': 2.947438596942611e-05, 'epochs': 190, 'loss': 'mae', 'optimizer': 'adam', 'graph_mode': 'off', 'use_snp_selection': True, 'num_snps': 34826}. Best is trial 28 with value: 0.2663812453467505.
[I 2025-12-06 07:49:56,248] Trial 54 finished with value: 0.24958586465434576 and parameters: {'model_type': 'mlp', 'hidden_dims': '[512, 128]', 'dropout': 0.3318005090622306, 'batch_norm': False, 'lr': 4.072719251688154e-06, 'weight_decay': 1.7380037431608234e-05, 'epochs': 169, 'loss': 'mae', 'optimizer': 'adam', 'graph_mode': 'off', 'use_snp_selection': True, 'num_snps': 46483}. Best is trial 28 with value: 0.2663812453467505.
[I 2025-12-06 07:50:49,106] Trial 55 finished with value: 0.22591947976695237 and parameters: {'model_type': 'mlp', 'hidden_dims': '[512, 128]', 'dropout': 0.30836129917705823, 'batch_norm': False, 'lr': 2.632238751905179e-06, 'weight_decay': 3.3585721618629233e-06, 'epochs': 164, 'loss': 'mae', 'optimizer': 'adam', 'graph_mode': 'off', 'use_snp_selection': False}. Best is trial 28 with value: 0.2663812453467505.
[I 2025-12-06 07:52:06,798] Trial 56 finished with value: 0.23735470921954285 and parameters: {'model_type': 'mlp', 'hidden_dims': '[512, 128]', 'dropout': 0.3719200343078596, 'batch_norm': False, 'lr': 3.785856117404063e-06, 'weight_decay': 1.5716993305982503e-06, 'epochs': 128, 'loss': 'mae', 'optimizer': 'adam', 'graph_mode': 'off', 'use_snp_selection': True, 'num_snps': 52940}. Best is trial 28 with value: 0.2663812453467505.
[I 2025-12-06 07:53:21,579] Trial 57 finished with value: 0.1658247117098725 and parameters: {'model_type': 'mlp', 'hidden_dims': '[512, 128]', 'dropout': 0.2930690664547703, 'batch_norm': True, 'lr': 4.42545789884585e-06, 'weight_decay': 1.5728035447233506e-05, 'epochs': 143, 'loss': 'mae', 'optimizer': 'adam', 'graph_mode': 'off', 'use_snp_selection': True, 'num_snps': 46131}. Best is trial 28 with value: 0.2663812453467505.
[I 2025-12-06 07:54:16,190] Trial 58 finished with value: 0.2258542419466695 and parameters: {'model_type': 'mlp', 'hidden_dims': '[512, 128]', 'dropout': 0.10616638328830486, 'batch_norm': False, 'lr': 2.1406627521550728e-06, 'weight_decay': 0.00018534149548590366, 'epochs': 170, 'loss': 'mae', 'optimizer': 'adam', 'graph_mode': 'off', 'use_snp_selection': False}. Best is trial 28 with value: 0.2663812453467505.
[I 2025-12-06 07:55:10,175] Trial 59 finished with value: 0.06683829203155527 and parameters: {'model_type': 'mlp', 'hidden_dims': '[128, 64]', 'dropout': 0.45434145091971023, 'batch_norm': False, 'lr': 0.0009546296535099733, 'weight_decay': 8.969104545670754e-06, 'epochs': 249, 'loss': 'mae', 'optimizer': 'adam', 'graph_mode': 'off', 'use_snp_selection': True, 'num_snps': 39798}. Best is trial 28 with value: 0.2663812453467505.
[I 2025-12-06 07:56:48,252] Trial 60 finished with value: 0.22298250159907748 and parameters: {'model_type': 'mlp', 'hidden_dims': '[512, 128]', 'dropout': 0.3928156593062452, 'batch_norm': False, 'lr': 1.528684232654763e-05, 'weight_decay': 4.428904218485602e-05, 'epochs': 204, 'loss': 'mae', 'optimizer': 'adam', 'graph_mode': 'off', 'use_snp_selection': True, 'num_snps': 55480}. Best is trial 28 with value: 0.2663812453467505.
[I 2025-12-06 07:57:44,678] Trial 61 finished with value: 0.24743860151297875 and parameters: {'model_type': 'mlp', 'hidden_dims': '[256, 128, 64]', 'dropout': 0.32887936825423275, 'batch_norm': False, 'lr': 7.501873671939814e-06, 'weight_decay': 2.091223845740291e-05, 'epochs': 179, 'loss': 'mae', 'optimizer': 'adam', 'graph_mode': 'off', 'use_snp_selection': True, 'num_snps': 35603}. Best is trial 28 with value: 0.2663812453467505.
[I 2025-12-06 07:58:42,059] Trial 62 finished with value: 0.24276356143767802 and parameters: {'model_type': 'mlp', 'hidden_dims': '[256, 128, 64]', 'dropout': 0.3359025939113502, 'batch_norm': False, 'lr': 3.2391007035961496e-06, 'weight_decay': 1.892183071933901e-05, 'epochs': 175, 'loss': 'mae', 'optimizer': 'adam', 'graph_mode': 'off', 'use_snp_selection': True, 'num_snps': 37976}. Best is trial 28 with value: 0.2663812453467505.
[I 2025-12-06 07:59:48,336] Trial 63 finished with value: 0.24082168860182382 and parameters: {'model_type': 'mlp', 'hidden_dims': '[256, 128, 64]', 'dropout': 0.27834512412464857, 'batch_norm': False, 'lr': 8.704974368082048e-06, 'weight_decay': 0.00010987658543273884, 'epochs': 227, 'loss': 'mae', 'optimizer': 'adam', 'graph_mode': 'off', 'use_snp_selection': True, 'num_snps': 42506}. Best is trial 28 with value: 0.2663812453467505.
[I 2025-12-06 08:00:54,406] Trial 64 finished with value: 0.23355693568236444 and parameters: {'model_type': 'mlp', 'hidden_dims': '[256, 128, 64]', 'dropout': 0.3158685990787564, 'batch_norm': False, 'lr': 1.1560450581142463e-05, 'weight_decay': 7.052197979645113e-06, 'epochs': 181, 'loss': 'mae', 'optimizer': 'adam', 'graph_mode': 'off', 'use_snp_selection': True, 'num_snps': 48647}. Best is trial 28 with value: 0.2663812453467505.
[I 2025-12-06 08:02:04,311] Trial 65 finished with value: 0.22298205972716145 and parameters: {'model_type': 'mlp', 'hidden_dims': '[512, 256]', 'dropout': 0.36055007822535906, 'batch_norm': False, 'lr': 5.205257154663999e-06, 'weight_decay': 2.4152306634290498e-05, 'epochs': 234, 'loss': 'mae', 'optimizer': 'adam', 'graph_mode': 'off', 'use_snp_selection': True, 'num_snps': 30067}. Best is trial 28 with value: 0.2663812453467505.
[I 2025-12-06 08:02:40,276] Trial 66 finished with value: 0.23176838575109376 and parameters: {'model_type': 'mlp', 'hidden_dims': '[256, 128, 64]', 'dropout': 0.32744838100872253, 'batch_norm': False, 'lr': 6.763218727264278e-06, 'weight_decay': 0.0005716395319678188, 'epochs': 208, 'loss': 'mae', 'optimizer': 'adam', 'graph_mode': 'off', 'use_snp_selection': False}. Best is trial 28 with value: 0.2663812453467505.
[I 2025-12-06 08:03:27,015] Trial 67 finished with value: 0.16118586028703666 and parameters: {'model_type': 'mlp', 'hidden_dims': '[256, 128, 64]', 'dropout': 0.5211784420149025, 'batch_norm': False, 'lr': 2.5043928889625447e-06, 'weight_decay': 1.0494888732918716e-05, 'epochs': 144, 'loss': 'mse', 'optimizer': 'adam', 'graph_mode': 'off', 'use_snp_selection': True, 'num_snps': 25730}. Best is trial 28 with value: 0.2663812453467505.
[I 2025-12-06 08:04:49,203] Trial 68 finished with value: 0.22875130556663154 and parameters: {'model_type': 'mlp', 'hidden_dims': '[512, 64]', 'dropout': 0.25660632594044874, 'batch_norm': False, 'lr': 2.7304419570664783e-05, 'weight_decay': 4.1404476045334254e-05, 'epochs': 183, 'loss': 'mae', 'optimizer': 'adam', 'graph_mode': 'off', 'use_snp_selection': True, 'num_snps': 46505}. Best is trial 28 with value: 0.2663812453467505.
[I 2025-12-06 08:05:53,901] Trial 69 finished with value: 0.22331474806779728 and parameters: {'model_type': 'mlp', 'hidden_dims': '[256, 128]', 'dropout': 0.2321156217289343, 'batch_norm': False, 'lr': 0.0001196779166201053, 'weight_decay': 1.5296543650529694e-07, 'epochs': 284, 'loss': 'mae', 'optimizer': 'adam', 'graph_mode': 'off', 'use_snp_selection': True, 'num_snps': 36104}. Best is trial 28 with value: 0.2663812453467505.
[I 2025-12-06 08:07:06,450] Trial 70 finished with value: 0.12752943952114795 and parameters: {'model_type': 'mlp', 'hidden_dims': '[256, 128, 64]', 'dropout': 0.2969334955606055, 'batch_norm': True, 'lr': 1.2900432626412242e-06, 'weight_decay': 5.9153567169865876e-05, 'epochs': 219, 'loss': 'mae', 'optimizer': 'adam', 'graph_mode': 'off', 'use_snp_selection': True, 'num_snps': 51386}. Best is trial 28 with value: 0.2663812453467505.
[I 2025-12-06 08:08:01,960] Trial 71 finished with value: 0.24494972099151716 and parameters: {'model_type': 'mlp', 'hidden_dims': '[256, 128, 64]', 'dropout': 0.33936106648278636, 'batch_norm': False, 'lr': 8.401149235986495e-06, 'weight_decay': 3.535683857345902e-05, 'epochs': 199, 'loss': 'mae', 'optimizer': 'adam', 'graph_mode': 'off', 'use_snp_selection': True, 'num_snps': 32509}. Best is trial 28 with value: 0.2663812453467505.
[I 2025-12-06 08:08:59,082] Trial 72 finished with value: 0.24711975579830642 and parameters: {'model_type': 'mlp', 'hidden_dims': '[256, 128, 64]', 'dropout': 0.3283846961180051, 'batch_norm': False, 'lr': 6.970945256656895e-06, 'weight_decay': 2.675480686824017e-05, 'epochs': 153, 'loss': 'mae', 'optimizer': 'adam', 'graph_mode': 'off', 'use_snp_selection': True, 'num_snps': 40172}. Best is trial 28 with value: 0.2663812453467505.
[I 2025-12-06 08:09:53,571] Trial 73 finished with value: 0.18629401898892445 and parameters: {'model_type': 'mlp', 'hidden_dims': '[256, 128, 64]', 'dropout': 0.49990588903445254, 'batch_norm': False, 'lr': 3.231698657137258e-06, 'weight_decay': 1.555001369058857e-05, 'epochs': 125, 'loss': 'mae', 'optimizer': 'adam', 'graph_mode': 'off', 'use_snp_selection': True, 'num_snps': 40225}. Best is trial 28 with value: 0.2663812453467505.
[I 2025-12-06 08:10:49,266] Trial 74 finished with value: 0.2505623288296589 and parameters: {'model_type': 'mlp', 'hidden_dims': '[256, 128, 64]', 'dropout': 0.3196295010577877, 'batch_norm': False, 'lr': 4.176095114323907e-06, 'weight_decay': 1.188984410848161e-05, 'epochs': 114, 'loss': 'mae', 'optimizer': 'adam', 'graph_mode': 'off', 'use_snp_selection': True, 'num_snps': 43795}. Best is trial 28 with value: 0.2663812453467505.
[I 2025-12-06 08:11:43,932] Trial 75 finished with value: 0.21883935532327858 and parameters: {'model_type': 'mlp', 'hidden_dims': '[256, 128, 64]', 'dropout': 0.405342482327746, 'batch_norm': False, 'lr': 4.250756160723651e-06, 'weight_decay': 1.1312209075099255e-05, 'epochs': 99, 'loss': 'mae', 'optimizer': 'adam', 'graph_mode': 'off', 'use_snp_selection': True, 'num_snps': 44532}. Best is trial 28 with value: 0.2663812453467505.
[I 2025-12-06 08:12:06,095] Trial 76 finished with value: 0.23237732346018802 and parameters: {'model_type': 'mlp', 'hidden_dims': '[256, 128, 64]', 'dropout': 0.3192581472148672, 'batch_norm': False, 'lr': 3.4598626628836404e-06, 'weight_decay': 2.5782411581119905e-05, 'epochs': 112, 'loss': 'mae', 'optimizer': 'adam', 'graph_mode': 'off', 'use_snp_selection': False}. Best is trial 28 with value: 0.2663812453467505.
[I 2025-12-06 08:12:54,483] Trial 77 finished with value: 0.25665972846147617 and parameters: {'model_type': 'mlp', 'hidden_dims': '[256, 128, 64]', 'dropout': 0.34897119403130417, 'batch_norm': False, 'lr': 1.1000006626879326e-05, 'weight_decay': 1.8166744842228706e-05, 'epochs': 70, 'loss': 'mae', 'optimizer': 'adam', 'graph_mode': 'off', 'use_snp_selection': True, 'num_snps': 37930}. Best is trial 28 with value: 0.2663812453467505.
[I 2025-12-06 08:13:39,217] Trial 78 finished with value: 0.22865868676764184 and parameters: {'model_type': 'mlp', 'hidden_dims': '[128, 64]', 'dropout': 0.3595767460194623, 'batch_norm': False, 'lr': 1.1983587652570394e-05, 'weight_decay': 4.609819158826186e-06, 'epochs': 60, 'loss': 'mae', 'optimizer': 'adam', 'graph_mode': 'off', 'use_snp_selection': True, 'num_snps': 37666}. Best is trial 28 with value: 0.2663812453467505.
[I 2025-12-06 08:14:29,814] Trial 79 finished with value: 0.18386084508615502 and parameters: {'model_type': 'mlp', 'hidden_dims': '[256, 128, 64]', 'dropout': 0.34988741204973084, 'batch_norm': False, 'lr': 4.836008208042698e-06, 'weight_decay': 1.7921615621149625e-05, 'epochs': 64, 'loss': 'mse', 'optimizer': 'adam', 'graph_mode': 'off', 'use_snp_selection': True, 'num_snps': 43179}. Best is trial 28 with value: 0.2663812453467505.
[I 2025-12-06 08:15:19,745] Trial 80 finished with value: 0.14817020098278005 and parameters: {'model_type': 'mlp', 'hidden_dims': '[512, 256]', 'dropout': 0.5763696844912763, 'batch_norm': False, 'lr': 1.7032008185930663e-06, 'weight_decay': 7.602091822997206e-06, 'epochs': 51, 'loss': 'mae', 'optimizer': 'adam', 'graph_mode': 'off', 'use_snp_selection': True, 'num_snps': 35641}. Best is trial 28 with value: 0.2663812453467505.
[I 2025-12-06 08:16:10,619] Trial 81 finished with value: 0.24524603985438548 and parameters: {'model_type': 'mlp', 'hidden_dims': '[256, 128, 64]', 'dropout': 0.3038529508354744, 'batch_norm': False, 'lr': 7.669473230927976e-06, 'weight_decay': 1.2575921405139144e-05, 'epochs': 79, 'loss': 'mae', 'optimizer': 'adam', 'graph_mode': 'off', 'use_snp_selection': True, 'num_snps': 41244}. Best is trial 28 with value: 0.2663812453467505.
[I 2025-12-06 08:17:07,701] Trial 82 finished with value: 0.2495645006747082 and parameters: {'model_type': 'mlp', 'hidden_dims': '[256, 128, 64]', 'dropout': 0.2704285750286077, 'batch_norm': False, 'lr': 5.959574071444022e-06, 'weight_decay': 2.2920840691581736e-05, 'epochs': 156, 'loss': 'mae', 'optimizer': 'adam', 'graph_mode': 'off', 'use_snp_selection': True, 'num_snps': 39707}. Best is trial 28 with value: 0.2663812453467505.
[I 2025-12-06 08:17:58,854] Trial 83 finished with value: 0.21798117431545266 and parameters: {'model_type': 'mlp', 'hidden_dims': '[256, 128, 64]', 'dropout': 0.2718110421948694, 'batch_norm': False, 'lr': 2.861689902688934e-06, 'weight_decay': 2.1467513329839823e-05, 'epochs': 94, 'loss': 'mae', 'optimizer': 'adam', 'graph_mode': 'off', 'use_snp_selection': True, 'num_snps': 38776}. Best is trial 28 with value: 0.2663812453467505.
[I 2025-12-06 08:18:48,359] Trial 84 finished with value: 0.25370327810435284 and parameters: {'model_type': 'mlp', 'hidden_dims': '[256, 128, 64]', 'dropout': 0.2833987395629251, 'batch_norm': False, 'lr': 2.038618678659976e-05, 'weight_decay': 5.239926922973299e-05, 'epochs': 116, 'loss': 'mae', 'optimizer': 'adam', 'graph_mode': 'off', 'use_snp_selection': True, 'num_snps': 33190}. Best is trial 28 with value: 0.2663812453467505.
[I 2025-12-06 08:19:44,933] Trial 85 finished with value: 0.24426875181535185 and parameters: {'model_type': 'mlp', 'hidden_dims': '[256, 128, 64]', 'dropout': 0.2866387040039728, 'batch_norm': False, 'lr': 1.9755176886345076e-05, 'weight_decay': 5.127530475725009e-05, 'epochs': 102, 'loss': 'mae', 'optimizer': 'adam', 'graph_mode': 'off', 'use_snp_selection': True, 'num_snps': 47362}. Best is trial 28 with value: 0.2663812453467505.
[I 2025-12-06 08:20:14,538] Trial 86 finished with value: 0.23776970936369907 and parameters: {'model_type': 'mlp', 'hidden_dims': '[512, 128]', 'dropout': 0.21411685518135748, 'batch_norm': False, 'lr': 3.867855546956161e-05, 'weight_decay': 8.511728384015728e-05, 'epochs': 82, 'loss': 'mae', 'optimizer': 'adam', 'graph_mode': 'off', 'use_snp_selection': False}. Best is trial 28 with value: 0.2663812453467505.
