[I 2025-12-05 16:33:26,262] Trial 29 finished with value: 0.027200377715119232 and parameters: {'model_type': 'mlp', 'hidden_dims': '[128, 64]', 'dropout': 0.22514663421251588, 'batch_norm': False, 'lr': 2.2158142970964712e-06, 'weight_decay': 4.6380689875054645e-05, 'epochs': 228, 'loss': 'mae', 'optimizer': 'adam', 'graph_mode': 'off', 'use_snp_selection': True, 'num_snps': 25081}. Best is trial 16 with value: 0.03957831763965417.
[I 2025-12-05 16:33:28,941] Trial 30 finished with value: -0.0023378541336688315 and parameters: {'model_type': 'mlp', 'hidden_dims': '[128, 64]', 'dropout': 0.16565624396296894, 'batch_norm': False, 'lr': 9.18489311256511e-06, 'weight_decay': 5.406650441688127e-05, 'epochs': 65, 'loss': 'mae', 'optimizer': 'adam', 'graph_mode': 'off', 'use_snp_selection': True, 'num_snps': 59048}. Best is trial 16 with value: 0.03957831763965417.
[I 2025-12-05 16:33:30,665] Trial 31 finished with value: -0.03640068195124858 and parameters: {'model_type': 'mlp', 'hidden_dims': '[128, 64]', 'dropout': 0.21549165162586428, 'batch_norm': False, 'lr': 2.1971510231486134e-06, 'weight_decay': 5.120635458300319e-05, 'epochs': 237, 'loss': 'mae', 'optimizer': 'adam', 'graph_mode': 'off', 'use_snp_selection': True, 'num_snps': 27832}. Best is trial 16 with value: 0.03957831763965417.
[I 2025-12-05 16:33:32,296] Trial 32 finished with value: -0.007903710421430128 and parameters: {'model_type': 'mlp', 'hidden_dims': '[128, 64]', 'dropout': 0.2789539966712061, 'batch_norm': False, 'lr': 3.2190144769928607e-06, 'weight_decay': 0.00016518067338091666, 'epochs': 228, 'loss': 'mae', 'optimizer': 'adam', 'graph_mode': 'off', 'use_snp_selection': True, 'num_snps': 27346}. Best is trial 16 with value: 0.03957831763965417.
[I 2025-12-05 16:33:33,602] Trial 33 finished with value: -0.014990420620125091 and parameters: {'model_type': 'mlp', 'hidden_dims': '[128, 64]', 'dropout': 0.25518142561495766, 'batch_norm': False, 'lr': 1.9377251255721988e-06, 'weight_decay': 1.6455901397033113e-05, 'epochs': 259, 'loss': 'mae', 'optimizer': 'adam', 'graph_mode': 'off', 'use_snp_selection': True, 'num_snps': 16440}. Best is trial 16 with value: 0.03957831763965417.
[I 2025-12-05 16:33:34,793] Trial 34 finished with value: 0.027789113983743254 and parameters: {'model_type': 'mlp', 'hidden_dims': '[256, 128]', 'dropout': 0.3224101127049067, 'batch_norm': False, 'lr': 5.15507240499111e-06, 'weight_decay': 3.298147697660273e-05, 'epochs': 290, 'loss': 'mae', 'optimizer': 'adam', 'graph_mode': 'off', 'use_snp_selection': False}. Best is trial 16 with value: 0.03957831763965417.
[I 2025-12-05 16:33:36,059] Trial 35 finished with value: 0.012075241645019878 and parameters: {'model_type': 'mlp', 'hidden_dims': '[256, 128]', 'dropout': 0.41640485688984935, 'batch_norm': True, 'lr': 5.8884081387217355e-06, 'weight_decay': 3.107761185083936e-05, 'epochs': 335, 'loss': 'mae', 'optimizer': 'adam', 'graph_mode': 'off', 'use_snp_selection': False}. Best is trial 16 with value: 0.03957831763965417.
[I 2025-12-05 16:33:37,216] Trial 36 finished with value: 0.019565780380006073 and parameters: {'model_type': 'mlp', 'hidden_dims': '[256, 128]', 'dropout': 0.3180288735214317, 'batch_norm': False, 'lr': 1.8534067257028776e-05, 'weight_decay': 0.0004743783160064177, 'epochs': 277, 'loss': 'mse', 'optimizer': 'adam', 'graph_mode': 'off', 'use_snp_selection': False}. Best is trial 16 with value: 0.03957831763965417.
[I 2025-12-05 16:33:38,396] Trial 37 finished with value: -0.007014182739419012 and parameters: {'model_type': 'mlp', 'hidden_dims': '[256, 128]', 'dropout': 0.3709839603566887, 'batch_norm': False, 'lr': 4.495364238340484e-06, 'weight_decay': 0.00018469707787269193, 'epochs': 298, 'loss': 'mae', 'optimizer': 'adam', 'graph_mode': 'off', 'use_snp_selection': False}. Best is trial 16 with value: 0.03957831763965417.
[I 2025-12-05 16:33:39,637] Trial 38 finished with value: 0.0012005724160406943 and parameters: {'model_type': 'mlp', 'hidden_dims': '[512, 64]', 'dropout': 0.4038403322547221, 'batch_norm': True, 'lr': 7.0526995635552695e-06, 'weight_decay': 9.032258060855919e-06, 'epochs': 138, 'loss': 'mse', 'optimizer': 'adam', 'graph_mode': 'off', 'use_snp_selection': False}. Best is trial 16 with value: 0.03957831763965417.
[I 2025-12-05 16:33:40,609] Trial 39 finished with value: 0.017912962757772995 and parameters: {'model_type': 'mlp', 'hidden_dims': '[256, 128]', 'dropout': 0.3449926148382738, 'batch_norm': False, 'lr': 3.705900677836182e-05, 'weight_decay': 7.82081482182601e-05, 'epochs': 180, 'loss': 'mae', 'optimizer': 'adam', 'graph_mode': 'off', 'use_snp_selection': False}. Best is trial 16 with value: 0.03957831763965417.
[I 2025-12-05 16:33:41,657] Trial 40 finished with value: -0.03008551428222095 and parameters: {'model_type': 'mlp', 'hidden_dims': '[512, 128]', 'dropout': 0.5690527809674263, 'batch_norm': True, 'lr': 3.595247240521765e-06, 'weight_decay': 1.743443782976064e-05, 'epochs': 87, 'loss': 'mae', 'optimizer': 'adam', 'graph_mode': 'off', 'use_snp_selection': False}. Best is trial 16 with value: 0.03957831763965417.
[I 2025-12-05 16:33:43,393] Trial 41 finished with value: -0.024517245923155323 and parameters: {'model_type': 'mlp', 'hidden_dims': '[256, 128, 64]', 'dropout': 0.22031554519982588, 'batch_norm': False, 'lr': 1.4852455992825671e-06, 'weight_decay': 4.075024873900295e-05, 'epochs': 256, 'loss': 'mae', 'optimizer': 'adam', 'graph_mode': 'off', 'use_snp_selection': True, 'num_snps': 27223}. Best is trial 16 with value: 0.03957831763965417.
[I 2025-12-05 16:33:44,364] Trial 42 finished with value: -0.020535753312272847 and parameters: {'model_type': 'mlp', 'hidden_dims': '[128, 64]', 'dropout': 0.2779545235220093, 'batch_norm': False, 'lr': 2.503855644511509e-06, 'weight_decay': 7.382792554349267e-05, 'epochs': 293, 'loss': 'mae', 'optimizer': 'adam', 'graph_mode': 'off', 'use_snp_selection': False}. Best is trial 16 with value: 0.03957831763965417.
[I 2025-12-05 16:33:46,954] Trial 43 finished with value: -0.0009507604689720275 and parameters: {'model_type': 'mlp', 'hidden_dims': '[512, 64]', 'dropout': 0.2985420320387257, 'batch_norm': False, 'lr': 5.166891651090384e-06, 'weight_decay': 0.0004607435788723269, 'epochs': 210, 'loss': 'mae', 'optimizer': 'adam', 'graph_mode': 'off', 'use_snp_selection': True, 'num_snps': 48484}. Best is trial 16 with value: 0.03957831763965417.
[I 2025-12-05 16:33:49,350] Trial 44 finished with value: -0.005746744736476362 and parameters: {'model_type': 'mlp', 'hidden_dims': '[128, 64]', 'dropout': 0.16618276684247396, 'batch_norm': False, 'lr': 8.734814651836356e-06, 'weight_decay': 2.317769694145287e-05, 'epochs': 48, 'loss': 'mae', 'optimizer': 'adam', 'graph_mode': 'off', 'use_snp_selection': True, 'num_snps': 55478}. Best is trial 16 with value: 0.03957831763965417.
[I 2025-12-05 16:33:51,276] Trial 45 finished with value: -0.004568583519701121 and parameters: {'model_type': 'mlp', 'hidden_dims': '[512, 256]', 'dropout': 0.12407644594813116, 'batch_norm': False, 'lr': 1.1050933463848065e-06, 'weight_decay': 2.7617003824877156e-07, 'epochs': 345, 'loss': 'mse', 'optimizer': 'adam', 'graph_mode': 'off', 'use_snp_selection': False}. Best is trial 16 with value: 0.03957831763965417.
[I 2025-12-05 16:33:53,488] Trial 46 finished with value: -0.013287709996374355 and parameters: {'model_type': 'mlp', 'hidden_dims': '[256, 128]', 'dropout': 0.2584899300260402, 'batch_norm': True, 'lr': 1.3725408149759824e-05, 'weight_decay': 0.00013974175039249418, 'epochs': 154, 'loss': 'mae', 'optimizer': 'adam', 'graph_mode': 'off', 'use_snp_selection': True, 'num_snps': 46053}. Best is trial 16 with value: 0.03957831763965417.
[I 2025-12-05 16:33:55,668] Trial 47 finished with value: 0.013924365049449617 and parameters: {'model_type': 'mlp', 'hidden_dims': '[128, 64]', 'dropout': 0.24481120975243614, 'batch_norm': False, 'lr': 1.8108260149274992e-06, 'weight_decay': 1.0267708987614275e-06, 'epochs': 262, 'loss': 'mae', 'optimizer': 'adam', 'graph_mode': 'off', 'use_snp_selection': True, 'num_snps': 42486}. Best is trial 16 with value: 0.03957831763965417.
[I 2025-12-05 16:33:56,965] Trial 48 finished with value: 0.008253709977688832 and parameters: {'model_type': 'mlp', 'hidden_dims': '[256, 128, 64]', 'dropout': 0.3185356664128352, 'batch_norm': False, 'lr': 3.6856246890818518e-06, 'weight_decay': 0.0002309198161475715, 'epochs': 322, 'loss': 'mae', 'optimizer': 'adam', 'graph_mode': 'off', 'use_snp_selection': False}. Best is trial 16 with value: 0.03957831763965417.
[I 2025-12-05 16:33:58,451] Trial 49 finished with value: 0.005544111365065203 and parameters: {'model_type': 'mlp', 'hidden_dims': '[512, 128]', 'dropout': 0.37419353123569193, 'batch_norm': False, 'lr': 2.3048995791402163e-05, 'weight_decay': 3.0171208544237286e-06, 'epochs': 222, 'loss': 'mse', 'optimizer': 'adam', 'graph_mode': 'off', 'use_snp_selection': True, 'num_snps': 23123}. Best is trial 16 with value: 0.03957831763965417.
[I 2025-12-05 16:34:00,355] Trial 50 finished with value: 0.017613247676489766 and parameters: {'model_type': 'mlp', 'hidden_dims': '[128, 64]', 'dropout': 0.20538259098638234, 'batch_norm': False, 'lr': 1.6673234890087088e-05, 'weight_decay': 9.318952618071326e-06, 'epochs': 187, 'loss': 'mae', 'optimizer': 'adam', 'graph_mode': 'off', 'use_snp_selection': True, 'num_snps': 36474}. Best is trial 16 with value: 0.03957831763965417.
[I 2025-12-05 16:34:02,632] Trial 51 finished with value: -0.015540988591490263 and parameters: {'model_type': 'mlp', 'hidden_dims': '[128, 64]', 'dropout': 0.18300516103113423, 'batch_norm': True, 'lr': 1.3355233039862145e-06, 'weight_decay': 5.402773054508163e-05, 'epochs': 318, 'loss': 'mae', 'optimizer': 'adam', 'graph_mode': 'off', 'use_snp_selection': True, 'num_snps': 44281}. Best is trial 16 with value: 0.03957831763965417.
[I 2025-12-05 16:34:04,765] Trial 52 finished with value: 0.0025732912367800475 and parameters: {'model_type': 'mlp', 'hidden_dims': '[128, 64]', 'dropout': 0.2400013110369879, 'batch_norm': True, 'lr': 2.747186338393807e-06, 'weight_decay': 0.000118817794314178, 'epochs': 304, 'loss': 'mae', 'optimizer': 'adam', 'graph_mode': 'off', 'use_snp_selection': True, 'num_snps': 38997}. Best is trial 16 with value: 0.03957831763965417.
[I 2025-12-05 16:34:06,683] Trial 53 finished with value: -0.02256220950441583 and parameters: {'model_type': 'mlp', 'hidden_dims': '[128, 64]', 'dropout': 0.1368184849014792, 'batch_norm': True, 'lr': 6.427069776897304e-06, 'weight_decay': 3.802529382759765e-05, 'epochs': 274, 'loss': 'mae', 'optimizer': 'adam', 'graph_mode': 'off', 'use_snp_selection': True, 'num_snps': 31510}. Best is trial 16 with value: 0.03957831763965417.
[I 2025-12-05 16:34:08,942] Trial 54 finished with value: -0.02216823249412917 and parameters: {'model_type': 'mlp', 'hidden_dims': '[512, 64]', 'dropout': 0.29802300099176043, 'batch_norm': True, 'lr': 4.744308869588667e-06, 'weight_decay': 1.580244191579075e-05, 'epochs': 54, 'loss': 'mae', 'optimizer': 'adam', 'graph_mode': 'off', 'use_snp_selection': True, 'num_snps': 51414}. Best is trial 16 with value: 0.03957831763965417.
[I 2025-12-05 16:34:11,949] Trial 55 finished with value: 0.019292291421216492 and parameters: {'model_type': 'mlp', 'hidden_dims': '[256, 128, 64]', 'dropout': 0.2673354224598511, 'batch_norm': True, 'lr': 1.1453145858450442e-05, 'weight_decay': 6.507778172863122e-05, 'epochs': 342, 'loss': 'mae', 'optimizer': 'adam', 'graph_mode': 'off', 'use_snp_selection': True, 'num_snps': 56550}. Best is trial 16 with value: 0.03957831763965417.
[I 2025-12-05 16:34:14,296] Trial 56 finished with value: 0.015752103416423694 and parameters: {'model_type': 'mlp', 'hidden_dims': '[128, 64]', 'dropout': 0.3281527743637328, 'batch_norm': False, 'lr': 0.0007370054935123828, 'weight_decay': 9.976078414216807e-05, 'epochs': 289, 'loss': 'mae', 'optimizer': 'adam', 'graph_mode': 'off', 'use_snp_selection': True, 'num_snps': 49619}. Best is trial 16 with value: 0.03957831763965417.
[I 2025-12-05 16:34:16,479] Trial 57 finished with value: 0.013507404592385044 and parameters: {'model_type': 'mlp', 'hidden_dims': '[512, 256]', 'dropout': 0.20266088972471652, 'batch_norm': False, 'lr': 1.9552353858132197e-06, 'weight_decay': 3.088336086478988e-05, 'epochs': 331, 'loss': 'mae', 'optimizer': 'adam', 'graph_mode': 'off', 'use_snp_selection': True, 'num_snps': 33687}. Best is trial 16 with value: 0.03957831763965417.
[I 2025-12-05 16:34:17,188] Trial 58 finished with value: 0.011164355120943955 and parameters: {'model_type': 'mlp', 'hidden_dims': '[128, 64]', 'dropout': 0.23494271918440426, 'batch_norm': True, 'lr': 9.07039456754166e-06, 'weight_decay': 2.6116205645584158e-05, 'epochs': 41, 'loss': 'mae', 'optimizer': 'adam', 'graph_mode': 'off', 'use_snp_selection': False}. Best is trial 16 with value: 0.03957831763965417.
[I 2025-12-05 16:34:18,199] Trial 59 finished with value: -0.03746036618009551 and parameters: {'model_type': 'mlp', 'hidden_dims': '[256, 128]', 'dropout': 0.1010842382084882, 'batch_norm': False, 'lr': 3.2930501551496262e-06, 'weight_decay': 7.387259717382064e-06, 'epochs': 99, 'loss': 'mae', 'optimizer': 'adam', 'graph_mode': 'off', 'use_snp_selection': True, 'num_snps': 12891}. Best is trial 16 with value: 0.03957831763965417.
[I 2025-12-05 16:34:20,191] Trial 60 finished with value: 0.043065278576313655 and parameters: {'model_type': 'mlp', 'hidden_dims': '[256, 128, 64]', 'dropout': 0.3516743571113339, 'batch_norm': False, 'lr': 1.4199671932336513e-06, 'weight_decay': 1.0702184550132443e-07, 'epochs': 59, 'loss': 'mse', 'optimizer': 'adam', 'graph_mode': 'off', 'use_snp_selection': True, 'num_snps': 45067}. Best is trial 60 with value: 0.043065278576313655.
[I 2025-12-05 16:34:22,146] Trial 61 finished with value: -0.03774932024495624 and parameters: {'model_type': 'mlp', 'hidden_dims': '[256, 128, 64]', 'dropout': 0.35411784179341443, 'batch_norm': False, 'lr': 1.3538134572091846e-06, 'weight_decay': 1.4701471818490264e-07, 'epochs': 80, 'loss': 'mse', 'optimizer': 'adam', 'graph_mode': 'off', 'use_snp_selection': True, 'num_snps': 44364}. Best is trial 60 with value: 0.043065278576313655.
[I 2025-12-05 16:34:24,017] Trial 62 finished with value: -0.0163070344176424 and parameters: {'model_type': 'mlp', 'hidden_dims': '[256, 128, 64]', 'dropout': 0.3946460883959063, 'batch_norm': False, 'lr': 2.2072715775342395e-06, 'weight_decay': 3.191751398697093e-07, 'epochs': 60, 'loss': 'mse', 'optimizer': 'adam', 'graph_mode': 'off', 'use_snp_selection': True, 'num_snps': 38139}. Best is trial 60 with value: 0.043065278576313655.
[I 2025-12-05 16:34:26,414] Trial 63 finished with value: -0.0005524164685711102 and parameters: {'model_type': 'mlp', 'hidden_dims': '[256, 128, 64]', 'dropout': 0.29078878034958316, 'batch_norm': False, 'lr': 1.6820537119603353e-06, 'weight_decay': 2.110895145993253e-07, 'epochs': 55, 'loss': 'mse', 'optimizer': 'adam', 'graph_mode': 'off', 'use_snp_selection': True, 'num_snps': 57760}. Best is trial 60 with value: 0.043065278576313655.
[I 2025-12-05 16:34:27,754] Trial 64 finished with value: 0.008664901305556976 and parameters: {'model_type': 'mlp', 'hidden_dims': '[256, 128, 64]', 'dropout': 0.350397813462695, 'batch_norm': False, 'lr': 1.0064958381511507e-06, 'weight_decay': 1.1467767385709163e-07, 'epochs': 72, 'loss': 'mse', 'optimizer': 'adam', 'graph_mode': 'off', 'use_snp_selection': True, 'num_snps': 23489}. Best is trial 60 with value: 0.043065278576313655.
[I 2025-12-05 16:34:29,852] Trial 65 finished with value: -0.006291690249297242 and parameters: {'model_type': 'mlp', 'hidden_dims': '[128, 64]', 'dropout': 0.3086367200894832, 'batch_norm': False, 'lr': 8.145964313321568e-05, 'weight_decay': 1.888761765067136e-07, 'epochs': 105, 'loss': 'mse', 'optimizer': 'adam', 'graph_mode': 'off', 'use_snp_selection': True, 'num_snps': 46375}. Best is trial 60 with value: 0.043065278576313655.
[I 2025-12-05 16:34:32,249] Trial 66 finished with value: 0.024462447409253088 and parameters: {'model_type': 'mlp', 'hidden_dims': '[512, 128]', 'dropout': 0.4323582790815722, 'batch_norm': False, 'lr': 4.288337926483798e-06, 'weight_decay': 4.1446487890944554e-07, 'epochs': 86, 'loss': 'mae', 'optimizer': 'adam', 'graph_mode': 'off', 'use_snp_selection': True, 'num_snps': 50353}. Best is trial 60 with value: 0.043065278576313655.
[I 2025-12-05 16:34:34,596] Trial 67 finished with value: 0.03997527023942508 and parameters: {'model_type': 'mlp', 'hidden_dims': '[128, 64]', 'dropout': 0.1739171873434615, 'batch_norm': False, 'lr': 2.8181286058648207e-06, 'weight_decay': 1.0510216047481019e-07, 'epochs': 66, 'loss': 'mae', 'optimizer': 'adam', 'graph_mode': 'off', 'use_snp_selection': True, 'num_snps': 54637}. Best is trial 60 with value: 0.043065278576313655.
[I 2025-12-05 16:34:37,010] Trial 68 finished with value: 0.009353619531002987 and parameters: {'model_type': 'mlp', 'hidden_dims': '[128, 64]', 'dropout': 0.22488677744894991, 'batch_norm': False, 'lr': 8.006170667955628e-06, 'weight_decay': 5.665713365096716e-07, 'epochs': 51, 'loss': 'mae', 'optimizer': 'adam', 'graph_mode': 'off', 'use_snp_selection': True, 'num_snps': 56509}. Best is trial 60 with value: 0.043065278576313655.
[I 2025-12-05 16:34:39,360] Trial 69 finished with value: -0.007428826002211514 and parameters: {'model_type': 'mlp', 'hidden_dims': '[256, 128, 64]', 'dropout': 0.18114118611963592, 'batch_norm': False, 'lr': 5.660997162438018e-06, 'weight_decay': 1.3403788851134714e-07, 'epochs': 40, 'loss': 'mse', 'optimizer': 'adam', 'graph_mode': 'off', 'use_snp_selection': True, 'num_snps': 54185}. Best is trial 60 with value: 0.043065278576313655.
