[I 2025-12-06 09:22:09,492] Trial 125 finished with value: 0.34016559915233546 and parameters: {'model_type': 'mlp', 'hidden_dims': '[128, 64]', 'dropout': 0.3744315383376632, 'batch_norm': False, 'lr': 2.1328696884703105e-06, 'weight_decay': 7.535289499381581e-06, 'epochs': 120, 'loss': 'mse', 'optimizer': 'adam', 'graph_mode': 'off', 'use_snp_selection': False}. Best is trial 107 with value: 0.38424750014957565.
[I 2025-12-06 09:22:57,713] Trial 126 finished with value: 0.3244175565269968 and parameters: {'model_type': 'mlp', 'hidden_dims': '[512, 256]', 'dropout': 0.4533507007621444, 'batch_norm': True, 'lr': 5.358916718029166e-06, 'weight_decay': 1.6510666715058653e-05, 'epochs': 221, 'loss': 'mse', 'optimizer': 'adam', 'graph_mode': 'off', 'use_snp_selection': False}. Best is trial 107 with value: 0.38424750014957565.
[I 2025-12-06 09:23:20,537] Trial 127 finished with value: 0.38132004823337573 and parameters: {'model_type': 'mlp', 'hidden_dims': '[256, 128, 64]', 'dropout': 0.434515162503011, 'batch_norm': False, 'lr': 8.099763546595035e-06, 'weight_decay': 2.8008996341841508e-06, 'epochs': 180, 'loss': 'mse', 'optimizer': 'adam', 'graph_mode': 'off', 'use_snp_selection': False}. Best is trial 107 with value: 0.38424750014957565.
[I 2025-12-06 09:23:43,695] Trial 128 finished with value: 0.3783804378999446 and parameters: {'model_type': 'mlp', 'hidden_dims': '[256, 128, 64]', 'dropout': 0.4329929318105089, 'batch_norm': False, 'lr': 8.064257766766805e-06, 'weight_decay': 2.882850539217868e-06, 'epochs': 184, 'loss': 'mse', 'optimizer': 'adam', 'graph_mode': 'off', 'use_snp_selection': False}. Best is trial 107 with value: 0.38424750014957565.
[I 2025-12-06 09:24:03,076] Trial 129 finished with value: 0.37664885558988415 and parameters: {'model_type': 'mlp', 'hidden_dims': '[256, 128, 64]', 'dropout': 0.40181156067209894, 'batch_norm': False, 'lr': 1.0459635856435287e-05, 'weight_decay': 3.6091248711507126e-06, 'epochs': 147, 'loss': 'mse', 'optimizer': 'adam', 'graph_mode': 'off', 'use_snp_selection': False}. Best is trial 107 with value: 0.38424750014957565.
[I 2025-12-06 09:24:16,201] Trial 130 finished with value: 0.3662737567724803 and parameters: {'model_type': 'mlp', 'hidden_dims': '[256, 128, 64]', 'dropout': 0.24903994206602753, 'batch_norm': False, 'lr': 3.565633503086009e-06, 'weight_decay': 8.52053205786608e-07, 'epochs': 84, 'loss': 'mse', 'optimizer': 'adam', 'graph_mode': 'off', 'use_snp_selection': False}. Best is trial 107 with value: 0.38424750014957565.
[I 2025-12-06 09:24:25,694] Trial 131 finished with value: 0.3605279990815961 and parameters: {'model_type': 'mlp', 'hidden_dims': '[256, 128, 64]', 'dropout': 0.18043820289230691, 'batch_norm': False, 'lr': 4.7119327359455696e-06, 'weight_decay': 1.578790304958823e-06, 'epochs': 45, 'loss': 'mse', 'optimizer': 'adam', 'graph_mode': 'off', 'use_snp_selection': False}. Best is trial 107 with value: 0.38424750014957565.
[I 2025-12-06 09:24:50,114] Trial 132 finished with value: 0.3588868519356127 and parameters: {'model_type': 'mlp', 'hidden_dims': '[256, 128, 64]', 'dropout': 0.4383941335665014, 'batch_norm': False, 'lr': 1.4674578106107373e-05, 'weight_decay': 4.328296787028396e-06, 'epochs': 198, 'loss': 'mse', 'optimizer': 'adam', 'graph_mode': 'off', 'use_snp_selection': False}. Best is trial 107 with value: 0.38424750014957565.
[I 2025-12-06 09:25:26,064] Trial 133 finished with value: 0.3676046543837109 and parameters: {'model_type': 'mlp', 'hidden_dims': '[512, 256]', 'dropout': 0.45963137261829456, 'batch_norm': False, 'lr': 0.00030612026805933103, 'weight_decay': 9.142710657083709e-06, 'epochs': 165, 'loss': 'mse', 'optimizer': 'adam', 'graph_mode': 'off', 'use_snp_selection': False}. Best is trial 107 with value: 0.38424750014957565.
[I 2025-12-06 09:25:48,285] Trial 134 finished with value: 0.3743516213134562 and parameters: {'model_type': 'mlp', 'hidden_dims': '[256, 128, 64]', 'dropout': 0.478179777753744, 'batch_norm': False, 'lr': 6.645224207036443e-06, 'weight_decay': 2.3318485465980823e-06, 'epochs': 175, 'loss': 'mse', 'optimizer': 'adam', 'graph_mode': 'off', 'use_snp_selection': False}. Best is trial 107 with value: 0.38424750014957565.
[I 2025-12-06 09:26:02,603] Trial 135 finished with value: 0.3482188833839078 and parameters: {'model_type': 'mlp', 'hidden_dims': '[256, 128, 64]', 'dropout': 0.4186637250770689, 'batch_norm': False, 'lr': 2.9353264210726844e-06, 'weight_decay': 6.317098249185693e-06, 'epochs': 96, 'loss': 'mse', 'optimizer': 'adam', 'graph_mode': 'off', 'use_snp_selection': False}. Best is trial 107 with value: 0.38424750014957565.
[I 2025-12-06 09:26:44,296] Trial 136 finished with value: 0.3670257516761487 and parameters: {'model_type': 'mlp', 'hidden_dims': '[512, 128]', 'dropout': 0.4674568392713908, 'batch_norm': False, 'lr': 5.833048387305602e-06, 'weight_decay': 3.095272092774357e-06, 'epochs': 190, 'loss': 'mse', 'optimizer': 'adam', 'graph_mode': 'off', 'use_snp_selection': False}. Best is trial 107 with value: 0.38424750014957565.
[I 2025-12-06 09:27:06,829] Trial 137 finished with value: 0.376684577287425 and parameters: {'model_type': 'mlp', 'hidden_dims': '[256, 128, 64]', 'dropout': 0.38804014737005343, 'batch_norm': False, 'lr': 3.58503854983862e-06, 'weight_decay': 1.1665785314206953e-05, 'epochs': 177, 'loss': 'mse', 'optimizer': 'adam', 'graph_mode': 'off', 'use_snp_selection': False}. Best is trial 107 with value: 0.38424750014957565.
[I 2025-12-06 09:27:34,021] Trial 138 finished with value: 0.2903519275089602 and parameters: {'model_type': 'mlp', 'hidden_dims': '[512, 256]', 'dropout': 0.49697611685913573, 'batch_norm': False, 'lr': 1.3553432941790353e-06, 'weight_decay': 5.080809966644594e-06, 'epochs': 207, 'loss': 'mse', 'optimizer': 'adam', 'graph_mode': 'off', 'use_snp_selection': True, 'num_snps': 5807}. Best is trial 107 with value: 0.38424750014957565.
[I 2025-12-06 09:27:57,244] Trial 139 finished with value: 0.3779280829877692 and parameters: {'model_type': 'mlp', 'hidden_dims': '[256, 128, 64]', 'dropout': 0.3512435166937677, 'batch_norm': False, 'lr': 2.4146475075364994e-06, 'weight_decay': 7.810791215397368e-06, 'epochs': 186, 'loss': 'mse', 'optimizer': 'adam', 'graph_mode': 'off', 'use_snp_selection': False}. Best is trial 107 with value: 0.38424750014957565.
[I 2025-12-06 09:28:27,860] Trial 140 finished with value: 0.3661064608398803 and parameters: {'model_type': 'mlp', 'hidden_dims': '[512, 64]', 'dropout': 0.44781984415281473, 'batch_norm': False, 'lr': 3.421506716868152e-05, 'weight_decay': 1.4853693042585341e-05, 'epochs': 136, 'loss': 'mae', 'optimizer': 'adam', 'graph_mode': 'off', 'use_snp_selection': False}. Best is trial 107 with value: 0.38424750014957565.
[I 2025-12-06 09:28:46,967] Trial 141 finished with value: 0.3781728850083616 and parameters: {'model_type': 'mlp', 'hidden_dims': '[256, 128, 64]', 'dropout': 0.18802896139758576, 'batch_norm': False, 'lr': 4.1840032357826306e-06, 'weight_decay': 9.736795836785247e-06, 'epochs': 143, 'loss': 'mse', 'optimizer': 'adam', 'graph_mode': 'off', 'use_snp_selection': False}. Best is trial 107 with value: 0.38424750014957565.
[I 2025-12-06 09:29:07,571] Trial 142 finished with value: 0.38010652751373625 and parameters: {'model_type': 'mlp', 'hidden_dims': '[256, 128, 64]', 'dropout': 0.13870203712288715, 'batch_norm': False, 'lr': 1.8938431344573882e-06, 'weight_decay': 6.847417494652934e-06, 'epochs': 158, 'loss': 'mse', 'optimizer': 'adam', 'graph_mode': 'off', 'use_snp_selection': False}. Best is trial 107 with value: 0.38424750014957565.
[I 2025-12-06 09:29:32,551] Trial 143 finished with value: 0.3699353760412475 and parameters: {'model_type': 'mlp', 'hidden_dims': '[256, 128, 64]', 'dropout': 0.18546939471596274, 'batch_norm': False, 'lr': 5.1749419967746435e-06, 'weight_decay': 5.326166207142819e-06, 'epochs': 201, 'loss': 'mse', 'optimizer': 'adam', 'graph_mode': 'off', 'use_snp_selection': False}. Best is trial 107 with value: 0.38424750014957565.
[I 2025-12-06 09:29:57,020] Trial 144 finished with value: 0.3854968747574129 and parameters: {'model_type': 'mlp', 'hidden_dims': '[256, 128, 64]', 'dropout': 0.21061355147800906, 'batch_norm': False, 'lr': 3.2177633662452014e-06, 'weight_decay': 7.939795676395915e-06, 'epochs': 195, 'loss': 'mse', 'optimizer': 'adam', 'graph_mode': 'off', 'use_snp_selection': False}. Best is trial 144 with value: 0.3854968747574129.
[I 2025-12-06 09:30:21,556] Trial 145 finished with value: 0.3843863809441483 and parameters: {'model_type': 'mlp', 'hidden_dims': '[256, 128, 64]', 'dropout': 0.21755127089935736, 'batch_norm': False, 'lr': 3.3038970459392003e-06, 'weight_decay': 1.0675119190583093e-05, 'epochs': 196, 'loss': 'mse', 'optimizer': 'adam', 'graph_mode': 'off', 'use_snp_selection': False}. Best is trial 144 with value: 0.3854968747574129.
[I 2025-12-06 09:30:45,929] Trial 146 finished with value: 0.3800878562252679 and parameters: {'model_type': 'mlp', 'hidden_dims': '[256, 128, 64]', 'dropout': 0.2097202566184089, 'batch_norm': False, 'lr': 3.3562418727848264e-06, 'weight_decay': 3.9229506677821725e-06, 'epochs': 195, 'loss': 'mse', 'optimizer': 'adam', 'graph_mode': 'off', 'use_snp_selection': False}. Best is trial 144 with value: 0.3854968747574129.
[I 2025-12-06 09:31:09,018] Trial 147 finished with value: 0.3809103714446354 and parameters: {'model_type': 'mlp', 'hidden_dims': '[256, 128, 64]', 'dropout': 0.22232812336506053, 'batch_norm': False, 'lr': 2.93545598639212e-06, 'weight_decay': 9.773914451389351e-06, 'epochs': 182, 'loss': 'mse', 'optimizer': 'adam', 'graph_mode': 'off', 'use_snp_selection': False}. Best is trial 144 with value: 0.3854968747574129.
[I 2025-12-06 09:31:30,845] Trial 148 finished with value: 0.31287685747472577 and parameters: {'model_type': 'mlp', 'hidden_dims': '[256, 128, 64]', 'dropout': 0.23603453563879775, 'batch_norm': True, 'lr': 2.7457513961527034e-06, 'weight_decay': 1.1464513247732225e-06, 'epochs': 169, 'loss': 'mse', 'optimizer': 'adam', 'graph_mode': 'off', 'use_snp_selection': False}. Best is trial 144 with value: 0.3854968747574129.
[I 2025-12-06 09:31:53,781] Trial 149 finished with value: 0.3829201669409522 and parameters: {'model_type': 'mlp', 'hidden_dims': '[256, 128, 64]', 'dropout': 0.22803489659389634, 'batch_norm': False, 'lr': 3.127338705663692e-06, 'weight_decay': 1.313352675497319e-05, 'epochs': 181, 'loss': 'mse', 'optimizer': 'adam', 'graph_mode': 'off', 'use_snp_selection': False}. Best is trial 144 with value: 0.3854968747574129.
[I 2025-12-06 09:32:46,584] Trial 0 finished with value: 0.3000560534826481 and parameters: {'model_type': 'mlp', 'hidden_dims': '[128, 64]', 'dropout': 0.199031432379812, 'batch_norm': True, 'lr': 1.8408544111075837e-06, 'weight_decay': 5.5136510071208614e-05, 'epochs': 336, 'loss': 'mae', 'optimizer': 'adam', 'graph_mode': 'off', 'use_snp_selection': True, 'num_snps': 43862}. Best is trial 0 with value: 0.3000560534826481.
[I 2025-12-06 09:33:15,542] Trial 1 finished with value: 0.3524895123821336 and parameters: {'model_type': 'mlp', 'hidden_dims': '[256, 128]', 'dropout': 0.4370668075331726, 'batch_norm': True, 'lr': 7.133471581159139e-05, 'weight_decay': 1.128633586803549e-05, 'epochs': 242, 'loss': 'mae', 'optimizer': 'adam', 'graph_mode': 'off', 'use_snp_selection': False}. Best is trial 1 with value: 0.3524895123821336.
[I 2025-12-06 09:33:43,217] Trial 2 finished with value: 0.32605519170445063 and parameters: {'model_type': 'mlp', 'hidden_dims': '[256, 128, 64]', 'dropout': 0.41314357415569625, 'batch_norm': False, 'lr': 3.952233718592101e-06, 'weight_decay': 0.00026754769258252603, 'epochs': 149, 'loss': 'mse', 'optimizer': 'adam', 'graph_mode': 'off', 'use_snp_selection': True, 'num_snps': 11571}. Best is trial 1 with value: 0.3524895123821336.
[I 2025-12-06 09:34:48,772] Trial 3 finished with value: 0.3760942713935572 and parameters: {'model_type': 'mlp', 'hidden_dims': '[512, 64]', 'dropout': 0.5938127374509361, 'batch_norm': False, 'lr': 5.67704586114731e-06, 'weight_decay': 2.4518087630137052e-05, 'epochs': 320, 'loss': 'mae', 'optimizer': 'adam', 'graph_mode': 'off', 'use_snp_selection': False}. Best is trial 3 with value: 0.3760942713935572.
[I 2025-12-06 09:35:53,506] Trial 4 finished with value: 0.33412897915900563 and parameters: {'model_type': 'mlp', 'hidden_dims': '[512, 128]', 'dropout': 0.25746343592134413, 'batch_norm': True, 'lr': 1.3467657668402788e-06, 'weight_decay': 0.00033087251918647806, 'epochs': 277, 'loss': 'mse', 'optimizer': 'adam', 'graph_mode': 'off', 'use_snp_selection': True, 'num_snps': 36675}. Best is trial 3 with value: 0.3760942713935572.
[I 2025-12-06 09:36:38,735] Trial 5 finished with value: 0.29289847240963934 and parameters: {'model_type': 'mlp', 'hidden_dims': '[512, 64]', 'dropout': 0.38275350994408375, 'batch_norm': True, 'lr': 1.5586664309232824e-06, 'weight_decay': 0.0008227664668621182, 'epochs': 145, 'loss': 'mae', 'optimizer': 'adam', 'graph_mode': 'off', 'use_snp_selection': True, 'num_snps': 32148}. Best is trial 3 with value: 0.3760942713935572.
[I 2025-12-06 09:37:02,547] Trial 6 finished with value: 0.35394409888994327 and parameters: {'model_type': 'mlp', 'hidden_dims': '[256, 128]', 'dropout': 0.3930109900265879, 'batch_norm': False, 'lr': 4.892964372128395e-05, 'weight_decay': 1.5809549317992182e-06, 'epochs': 199, 'loss': 'mse', 'optimizer': 'adam', 'graph_mode': 'off', 'use_snp_selection': False}. Best is trial 3 with value: 0.3760942713935572.
[I 2025-12-06 09:37:26,447] Trial 7 finished with value: 0.3589125528971713 and parameters: {'model_type': 'mlp', 'hidden_dims': '[512, 256]', 'dropout': 0.15343979219678458, 'batch_norm': True, 'lr': 6.234003099047341e-05, 'weight_decay': 3.894760610535477e-07, 'epochs': 97, 'loss': 'mse', 'optimizer': 'adam', 'graph_mode': 'off', 'use_snp_selection': False}. Best is trial 3 with value: 0.3760942713935572.
[I 2025-12-06 09:38:31,778] Trial 8 finished with value: 0.35898373499230773 and parameters: {'model_type': 'mlp', 'hidden_dims': '[512, 128]', 'dropout': 0.10743001231661406, 'batch_norm': True, 'lr': 0.00023728538449271062, 'weight_decay': 1.7629071578048637e-05, 'epochs': 312, 'loss': 'mae', 'optimizer': 'adam', 'graph_mode': 'off', 'use_snp_selection': False}. Best is trial 3 with value: 0.3760942713935572.
[I 2025-12-06 09:39:10,855] Trial 9 finished with value: 0.36465064328914704 and parameters: {'model_type': 'mlp', 'hidden_dims': '[512, 64]', 'dropout': 0.14505336736221927, 'batch_norm': True, 'lr': 5.8619638388111826e-05, 'weight_decay': 6.200156172669308e-07, 'epochs': 175, 'loss': 'mse', 'optimizer': 'adam', 'graph_mode': 'off', 'use_snp_selection': False}. Best is trial 3 with value: 0.3760942713935572.
[I 2025-12-06 09:39:26,571] Trial 10 finished with value: 0.35456977538255197 and parameters: {'model_type': 'mlp', 'hidden_dims': '[512, 64]', 'dropout': 0.5885461262002587, 'batch_norm': False, 'lr': 8.769366258768696e-06, 'weight_decay': 2.78273193871783e-06, 'epochs': 55, 'loss': 'mae', 'optimizer': 'adam', 'graph_mode': 'off', 'use_snp_selection': False}. Best is trial 3 with value: 0.3760942713935572.
[I 2025-12-06 09:40:11,935] Trial 11 finished with value: 0.3696023605779991 and parameters: {'model_type': 'mlp', 'hidden_dims': '[512, 64]', 'dropout': 0.583942291816117, 'batch_norm': False, 'lr': 1.422933652790185e-05, 'weight_decay': 1.2045055692919657e-07, 'epochs': 213, 'loss': 'mse', 'optimizer': 'adam', 'graph_mode': 'off', 'use_snp_selection': False}. Best is trial 3 with value: 0.3760942713935572.
[I 2025-12-06 09:41:04,650] Trial 12 finished with value: 0.36621868907303673 and parameters: {'model_type': 'mlp', 'hidden_dims': '[512, 64]', 'dropout': 0.593097749012682, 'batch_norm': False, 'lr': 1.1374686318732863e-05, 'weight_decay': 1.3081036432574914e-07, 'epochs': 250, 'loss': 'mae', 'optimizer': 'adam', 'graph_mode': 'off', 'use_snp_selection': False}. Best is trial 3 with value: 0.3760942713935572.
[I 2025-12-06 09:42:04,883] Trial 13 finished with value: 0.349087131978593 and parameters: {'model_type': 'mlp', 'hidden_dims': '[512, 64]', 'dropout': 0.5043641748401543, 'batch_norm': False, 'lr': 1.4304506621636526e-05, 'weight_decay': 4.981094667007287e-05, 'epochs': 290, 'loss': 'mse', 'optimizer': 'adam', 'graph_mode': 'off', 'use_snp_selection': False}. Best is trial 3 with value: 0.3760942713935572.
[I 2025-12-06 09:42:28,454] Trial 14 finished with value: 0.3757097077413397 and parameters: {'model_type': 'mlp', 'hidden_dims': '[128, 64]', 'dropout': 0.5300180653494536, 'batch_norm': False, 'lr': 5.096356034191146e-06, 'weight_decay': 3.0607358611649674e-06, 'epochs': 344, 'loss': 'mse', 'optimizer': 'adam', 'graph_mode': 'off', 'use_snp_selection': False}. Best is trial 3 with value: 0.3760942713935572.
[I 2025-12-06 09:42:51,223] Trial 15 finished with value: 0.3801627624789742 and parameters: {'model_type': 'mlp', 'hidden_dims': '[128, 64]', 'dropout': 0.50071393962227, 'batch_norm': False, 'lr': 3.521500355955208e-06, 'weight_decay': 4.61164678661027e-06, 'epochs': 330, 'loss': 'mae', 'optimizer': 'adam', 'graph_mode': 'off', 'use_snp_selection': False}. Best is trial 15 with value: 0.3801627624789742.
[I 2025-12-06 09:43:15,067] Trial 16 finished with value: 0.373957372616296 and parameters: {'model_type': 'mlp', 'hidden_dims': '[128, 64]', 'dropout': 0.5002984888112975, 'batch_norm': False, 'lr': 2.776964597283163e-06, 'weight_decay': 2.3507698158328032e-05, 'epochs': 350, 'loss': 'mae', 'optimizer': 'adam', 'graph_mode': 'off', 'use_snp_selection': False}. Best is trial 15 with value: 0.3801627624789742.
[I 2025-12-06 09:44:16,030] Trial 17 finished with value: 0.13489271659094523 and parameters: {'model_type': 'mlp', 'hidden_dims': '[512, 256]', 'dropout': 0.30425275764399373, 'batch_norm': False, 'lr': 0.000906375209920231, 'weight_decay': 6.503919561253859e-06, 'epochs': 301, 'loss': 'mae', 'optimizer': 'adam', 'graph_mode': 'off', 'use_snp_selection': False}. Best is trial 15 with value: 0.3801627624789742.
[I 2025-12-06 09:45:17,169] Trial 18 finished with value: 0.3578704125771688 and parameters: {'model_type': 'mlp', 'hidden_dims': '[256, 128, 64]', 'dropout': 0.5308386292681988, 'batch_norm': False, 'lr': 2.6310607533978004e-05, 'weight_decay': 7.197637349971628e-05, 'epochs': 256, 'loss': 'mae', 'optimizer': 'adam', 'graph_mode': 'off', 'use_snp_selection': True, 'num_snps': 58241}. Best is trial 15 with value: 0.3801627624789742.
[I 2025-12-06 09:45:38,867] Trial 19 finished with value: 0.3748724978828638 and parameters: {'model_type': 'mlp', 'hidden_dims': '[128, 64]', 'dropout': 0.44786810823414697, 'batch_norm': False, 'lr': 5.860756852099341e-06, 'weight_decay': 6.219443740138099e-06, 'epochs': 314, 'loss': 'mae', 'optimizer': 'adam', 'graph_mode': 'off', 'use_snp_selection': False}. Best is trial 15 with value: 0.3801627624789742.
[I 2025-12-06 09:45:55,530] Trial 20 finished with value: 0.30508269820169226 and parameters: {'model_type': 'mlp', 'hidden_dims': '[128, 64]', 'dropout': 0.47179292131896244, 'batch_norm': False, 'lr': 1.0236431493580067e-06, 'weight_decay': 0.00015711537877451736, 'epochs': 222, 'loss': 'mae', 'optimizer': 'adam', 'graph_mode': 'off', 'use_snp_selection': False}. Best is trial 15 with value: 0.3801627624789742.
[I 2025-12-06 09:46:18,331] Trial 21 finished with value: 0.38161588475176045 and parameters: {'model_type': 'mlp', 'hidden_dims': '[128, 64]', 'dropout': 0.5405439478908376, 'batch_norm': False, 'lr': 3.998777046587617e-06, 'weight_decay': 3.0086153672588124e-06, 'epochs': 333, 'loss': 'mse', 'optimizer': 'adam', 'graph_mode': 'off', 'use_snp_selection': False}. Best is trial 21 with value: 0.38161588475176045.
[I 2025-12-06 09:46:40,719] Trial 22 finished with value: 0.36973374707159884 and parameters: {'model_type': 'mlp', 'hidden_dims': '[128, 64]', 'dropout': 0.5466149221009567, 'batch_norm': False, 'lr': 2.899079411954447e-06, 'weight_decay': 1.1983142789488365e-06, 'epochs': 324, 'loss': 'mae', 'optimizer': 'adam', 'graph_mode': 'off', 'use_snp_selection': False}. Best is trial 21 with value: 0.38161588475176045.
[I 2025-12-06 09:47:00,194] Trial 23 finished with value: 0.3709685471390714 and parameters: {'model_type': 'mlp', 'hidden_dims': '[128, 64]', 'dropout': 0.3470209339260282, 'batch_norm': False, 'lr': 7.264156935170009e-06, 'weight_decay': 4.185740134617791e-06, 'epochs': 271, 'loss': 'mse', 'optimizer': 'adam', 'graph_mode': 'off', 'use_snp_selection': False}. Best is trial 21 with value: 0.38161588475176045.
[I 2025-12-06 09:47:20,473] Trial 24 finished with value: 0.3659817090410408 and parameters: {'model_type': 'mlp', 'hidden_dims': '[128, 64]', 'dropout': 0.5601379073732119, 'batch_norm': False, 'lr': 2.2310576992466404e-05, 'weight_decay': 3.0924395875985554e-05, 'epochs': 291, 'loss': 'mae', 'optimizer': 'adam', 'graph_mode': 'off', 'use_snp_selection': False}. Best is trial 21 with value: 0.38161588475176045.
[I 2025-12-06 09:48:27,650] Trial 25 finished with value: 0.3766154393941848 and parameters: {'model_type': 'mlp', 'hidden_dims': '[512, 256]', 'dropout': 0.4904482797798303, 'batch_norm': False, 'lr': 2.5496739583182215e-06, 'weight_decay': 1.0255429599821256e-05, 'epochs': 321, 'loss': 'mae', 'optimizer': 'adam', 'graph_mode': 'off', 'use_snp_selection': False}. Best is trial 21 with value: 0.38161588475176045.
[I 2025-12-06 09:48:55,229] Trial 26 finished with value: 0.34063115955072726 and parameters: {'model_type': 'mlp', 'hidden_dims': '[512, 256]', 'dropout': 0.4901091742782129, 'batch_norm': False, 'lr': 2.455894381539052e-06, 'weight_decay': 1.5064625407457648e-06, 'epochs': 348, 'loss': 'mse', 'optimizer': 'adam', 'graph_mode': 'off', 'use_snp_selection': True, 'num_snps': 3842}. Best is trial 21 with value: 0.38161588475176045.
