[I 2025-12-05 15:55:14,308] Trial 140 finished with value: 0.006788650964978872 and parameters: {'model_type': 'mlp', 'hidden_dims': '[512, 256]', 'dropout': 0.43070720806370066, 'batch_norm': False, 'lr': 0.00028775221595618854, 'weight_decay': 4.484190097186551e-05, 'epochs': 266, 'loss': 'mse', 'optimizer': 'adam', 'graph_mode': 'off', 'use_snp_selection': False}. Best is trial 133 with value: 0.05280820846972677.
[I 2025-12-05 15:55:15,450] Trial 141 finished with value: 0.014806302979494713 and parameters: {'model_type': 'mlp', 'hidden_dims': '[256, 128, 64]', 'dropout': 0.47950165327057076, 'batch_norm': False, 'lr': 0.0007791901153863783, 'weight_decay': 0.00014650756146597683, 'epochs': 272, 'loss': 'mse', 'optimizer': 'adam', 'graph_mode': 'off', 'use_snp_selection': False}. Best is trial 133 with value: 0.05280820846972677.
[I 2025-12-05 15:55:17,123] Trial 142 finished with value: 0.04893392625333373 and parameters: {'model_type': 'mlp', 'hidden_dims': '[512, 256]', 'dropout': 0.5169432806335009, 'batch_norm': False, 'lr': 0.00040115816884455616, 'weight_decay': 8.797902036974631e-05, 'epochs': 282, 'loss': 'mse', 'optimizer': 'adam', 'graph_mode': 'off', 'use_snp_selection': False}. Best is trial 133 with value: 0.05280820846972677.
[I 2025-12-05 15:55:18,812] Trial 143 finished with value: 0.0012307295297178736 and parameters: {'model_type': 'mlp', 'hidden_dims': '[512, 256]', 'dropout': 0.5111616521164102, 'batch_norm': False, 'lr': 0.00043432846493307516, 'weight_decay': 8.901812524287409e-05, 'epochs': 290, 'loss': 'mse', 'optimizer': 'adam', 'graph_mode': 'off', 'use_snp_selection': False}. Best is trial 133 with value: 0.05280820846972677.
[I 2025-12-05 15:55:20,362] Trial 144 finished with value: 0.017500803112200532 and parameters: {'model_type': 'mlp', 'hidden_dims': '[512, 256]', 'dropout': 0.49465399047401265, 'batch_norm': False, 'lr': 0.0002128604219702971, 'weight_decay': 5.891706722998589e-05, 'epochs': 250, 'loss': 'mse', 'optimizer': 'adam', 'graph_mode': 'off', 'use_snp_selection': False}. Best is trial 133 with value: 0.05280820846972677.
[I 2025-12-05 15:55:21,965] Trial 145 finished with value: -0.0063231224368734155 and parameters: {'model_type': 'mlp', 'hidden_dims': '[512, 256]', 'dropout': 0.5320220857502331, 'batch_norm': False, 'lr': 0.0005713353242848939, 'weight_decay': 2.7323981839967337e-05, 'epochs': 256, 'loss': 'mse', 'optimizer': 'adam', 'graph_mode': 'off', 'use_snp_selection': False}. Best is trial 133 with value: 0.05280820846972677.
[I 2025-12-05 15:55:23,186] Trial 146 finished with value: -0.030773122896917457 and parameters: {'model_type': 'mlp', 'hidden_dims': '[512, 256]', 'dropout': 0.4625830389836629, 'batch_norm': False, 'lr': 0.00017045663969876768, 'weight_decay': 7.156210545018332e-05, 'epochs': 303, 'loss': 'mae', 'optimizer': 'adam', 'graph_mode': 'off', 'use_snp_selection': True, 'num_snps': 14336}. Best is trial 133 with value: 0.05280820846972677.
[I 2025-12-05 15:55:24,802] Trial 147 finished with value: -0.002975158771743389 and parameters: {'model_type': 'mlp', 'hidden_dims': '[512, 128]', 'dropout': 0.5213419425300503, 'batch_norm': False, 'lr': 0.00025762500655596404, 'weight_decay': 1.1332598600727313e-05, 'epochs': 281, 'loss': 'mse', 'optimizer': 'adam', 'graph_mode': 'off', 'use_snp_selection': False}. Best is trial 133 with value: 0.05280820846972677.
[I 2025-12-05 15:55:25,956] Trial 148 finished with value: -0.003696752221831199 and parameters: {'model_type': 'mlp', 'hidden_dims': '[256, 128]', 'dropout': 0.47380163493561556, 'batch_norm': False, 'lr': 0.0003110137683869559, 'weight_decay': 0.00011527843745678338, 'epochs': 285, 'loss': 'mse', 'optimizer': 'adam', 'graph_mode': 'off', 'use_snp_selection': False}. Best is trial 133 with value: 0.05280820846972677.
[I 2025-12-05 15:55:27,741] Trial 149 finished with value: -0.003953961221823408 and parameters: {'model_type': 'mlp', 'hidden_dims': '[512, 256]', 'dropout': 0.502014152679099, 'batch_norm': False, 'lr': 0.0003892718193645107, 'weight_decay': 8.840032465844624e-05, 'epochs': 319, 'loss': 'mse', 'optimizer': 'adam', 'graph_mode': 'off', 'use_snp_selection': False}. Best is trial 133 with value: 0.05280820846972677.
[I 2025-12-05 15:55:29,932] Trial 0 finished with value: 0.0344818905313531 and parameters: {'model_type': 'mlp', 'hidden_dims': '[128, 64]', 'dropout': 0.199031432379812, 'batch_norm': True, 'lr': 1.8408544111075837e-06, 'weight_decay': 5.5136510071208614e-05, 'epochs': 336, 'loss': 'mae', 'optimizer': 'adam', 'graph_mode': 'off', 'use_snp_selection': True, 'num_snps': 43862}. Best is trial 0 with value: 0.0344818905313531.
[I 2025-12-05 15:55:31,112] Trial 1 finished with value: 0.10648767047493951 and parameters: {'model_type': 'mlp', 'hidden_dims': '[256, 128]', 'dropout': 0.4370668075331726, 'batch_norm': True, 'lr': 7.133471581159139e-05, 'weight_decay': 1.128633586803549e-05, 'epochs': 242, 'loss': 'mae', 'optimizer': 'adam', 'graph_mode': 'off', 'use_snp_selection': False}. Best is trial 1 with value: 0.10648767047493951.
[I 2025-12-05 15:55:32,196] Trial 2 finished with value: 0.02009165129807203 and parameters: {'model_type': 'mlp', 'hidden_dims': '[256, 128, 64]', 'dropout': 0.41314357415569625, 'batch_norm': False, 'lr': 3.952233718592101e-06, 'weight_decay': 0.00026754769258252603, 'epochs': 149, 'loss': 'mse', 'optimizer': 'adam', 'graph_mode': 'off', 'use_snp_selection': True, 'num_snps': 11571}. Best is trial 1 with value: 0.10648767047493951.
[I 2025-12-05 15:55:34,194] Trial 3 finished with value: 0.08031409140143618 and parameters: {'model_type': 'mlp', 'hidden_dims': '[512, 64]', 'dropout': 0.5938127374509361, 'batch_norm': False, 'lr': 5.67704586114731e-06, 'weight_decay': 2.4518087630137052e-05, 'epochs': 320, 'loss': 'mae', 'optimizer': 'adam', 'graph_mode': 'off', 'use_snp_selection': False}. Best is trial 1 with value: 0.10648767047493951.
[I 2025-12-05 15:55:36,514] Trial 4 finished with value: 0.04545108549721764 and parameters: {'model_type': 'mlp', 'hidden_dims': '[512, 128]', 'dropout': 0.25746343592134413, 'batch_norm': True, 'lr': 1.3467657668402788e-06, 'weight_decay': 0.00033087251918647806, 'epochs': 277, 'loss': 'mse', 'optimizer': 'adam', 'graph_mode': 'off', 'use_snp_selection': True, 'num_snps': 36675}. Best is trial 1 with value: 0.10648767047493951.
[I 2025-12-05 15:55:38,398] Trial 5 finished with value: 0.02222110165121347 and parameters: {'model_type': 'mlp', 'hidden_dims': '[512, 64]', 'dropout': 0.38275350994408375, 'batch_norm': True, 'lr': 1.5586664309232824e-06, 'weight_decay': 0.0008227664668621182, 'epochs': 145, 'loss': 'mae', 'optimizer': 'adam', 'graph_mode': 'off', 'use_snp_selection': True, 'num_snps': 32148}. Best is trial 1 with value: 0.10648767047493951.
[I 2025-12-05 15:55:39,463] Trial 6 finished with value: 0.10611357907642993 and parameters: {'model_type': 'mlp', 'hidden_dims': '[256, 128]', 'dropout': 0.3930109900265879, 'batch_norm': False, 'lr': 4.892964372128395e-05, 'weight_decay': 1.5809549317992182e-06, 'epochs': 199, 'loss': 'mse', 'optimizer': 'adam', 'graph_mode': 'off', 'use_snp_selection': False}. Best is trial 1 with value: 0.10648767047493951.
[I 2025-12-05 15:55:40,598] Trial 7 finished with value: 0.09344778589217667 and parameters: {'model_type': 'mlp', 'hidden_dims': '[512, 256]', 'dropout': 0.15343979219678458, 'batch_norm': True, 'lr': 6.234003099047341e-05, 'weight_decay': 3.894760610535477e-07, 'epochs': 97, 'loss': 'mse', 'optimizer': 'adam', 'graph_mode': 'off', 'use_snp_selection': False}. Best is trial 1 with value: 0.10648767047493951.
[I 2025-12-05 15:55:42,602] Trial 8 finished with value: 0.10763205522352065 and parameters: {'model_type': 'mlp', 'hidden_dims': '[512, 128]', 'dropout': 0.10743001231661406, 'batch_norm': True, 'lr': 0.00023728538449271062, 'weight_decay': 1.7629071578048637e-05, 'epochs': 312, 'loss': 'mae', 'optimizer': 'adam', 'graph_mode': 'off', 'use_snp_selection': False}. Best is trial 8 with value: 0.10763205522352065.
[I 2025-12-05 15:55:44,067] Trial 9 finished with value: 0.09355027644187584 and parameters: {'model_type': 'mlp', 'hidden_dims': '[512, 64]', 'dropout': 0.14505336736221927, 'batch_norm': True, 'lr': 5.8619638388111826e-05, 'weight_decay': 6.200156172669308e-07, 'epochs': 175, 'loss': 'mse', 'optimizer': 'adam', 'graph_mode': 'off', 'use_snp_selection': False}. Best is trial 8 with value: 0.10763205522352065.
[I 2025-12-05 15:55:45,046] Trial 10 finished with value: 0.012272236781671627 and parameters: {'model_type': 'mlp', 'hidden_dims': '[512, 128]', 'dropout': 0.2800030442581858, 'batch_norm': False, 'lr': 0.0004919806695968258, 'weight_decay': 2.9953888095455486e-06, 'epochs': 55, 'loss': 'mae', 'optimizer': 'adam', 'graph_mode': 'off', 'use_snp_selection': False}. Best is trial 8 with value: 0.10763205522352065.
[I 2025-12-05 15:55:46,217] Trial 11 finished with value: 0.09855269376473147 and parameters: {'model_type': 'mlp', 'hidden_dims': '[256, 128]', 'dropout': 0.5025533409127559, 'batch_norm': True, 'lr': 0.0004219456914890788, 'weight_decay': 7.0869802591332905e-06, 'epochs': 239, 'loss': 'mae', 'optimizer': 'adam', 'graph_mode': 'off', 'use_snp_selection': False}. Best is trial 8 with value: 0.10763205522352065.
[I 2025-12-05 15:55:48,074] Trial 12 finished with value: 0.09518458929000867 and parameters: {'model_type': 'mlp', 'hidden_dims': '[512, 128]', 'dropout': 0.4779690972965961, 'batch_norm': True, 'lr': 0.00026576228959612443, 'weight_decay': 4.7436725614905826e-05, 'epochs': 271, 'loss': 'mae', 'optimizer': 'adam', 'graph_mode': 'off', 'use_snp_selection': False}. Best is trial 8 with value: 0.10763205522352065.
[I 2025-12-05 15:55:49,252] Trial 13 finished with value: 0.09659258632909576 and parameters: {'model_type': 'mlp', 'hidden_dims': '[256, 128]', 'dropout': 0.3041365173646664, 'batch_norm': True, 'lr': 0.0001448400953749671, 'weight_decay': 1.152865323241676e-05, 'epochs': 237, 'loss': 'mae', 'optimizer': 'adam', 'graph_mode': 'off', 'use_snp_selection': False}. Best is trial 8 with value: 0.10763205522352065.
[I 2025-12-05 15:55:50,282] Trial 14 finished with value: 0.07424414424381207 and parameters: {'model_type': 'mlp', 'hidden_dims': '[128, 64]', 'dropout': 0.4853142563074505, 'batch_norm': True, 'lr': 1.3794312407790804e-05, 'weight_decay': 1.1414924884997386e-07, 'epochs': 302, 'loss': 'mae', 'optimizer': 'adam', 'graph_mode': 'off', 'use_snp_selection': False}. Best is trial 8 with value: 0.10763205522352065.
[I 2025-12-05 15:55:51,448] Trial 15 finished with value: 0.08640224337008166 and parameters: {'model_type': 'mlp', 'hidden_dims': '[256, 128, 64]', 'dropout': 0.5975304352136959, 'batch_norm': True, 'lr': 0.0001484615019442469, 'weight_decay': 9.289684675552499e-05, 'epochs': 231, 'loss': 'mae', 'optimizer': 'adam', 'graph_mode': 'off', 'use_snp_selection': False}. Best is trial 8 with value: 0.10763205522352065.
[I 2025-12-05 15:55:53,615] Trial 16 finished with value: 0.09603916190382751 and parameters: {'model_type': 'mlp', 'hidden_dims': '[512, 256]', 'dropout': 0.22551024220838994, 'batch_norm': True, 'lr': 2.1517090787442848e-05, 'weight_decay': 8.672822061992432e-06, 'epochs': 349, 'loss': 'mae', 'optimizer': 'adam', 'graph_mode': 'off', 'use_snp_selection': False}. Best is trial 8 with value: 0.10763205522352065.
[I 2025-12-05 15:55:54,883] Trial 17 finished with value: 0.10562641196476043 and parameters: {'model_type': 'mlp', 'hidden_dims': '[256, 128]', 'dropout': 0.10230308008198463, 'batch_norm': True, 'lr': 0.000906375209920231, 'weight_decay': 3.3423621526664437e-06, 'epochs': 282, 'loss': 'mae', 'optimizer': 'adam', 'graph_mode': 'off', 'use_snp_selection': False}. Best is trial 8 with value: 0.10763205522352065.
[I 2025-12-05 15:55:58,016] Trial 18 finished with value: 0.09357323037779026 and parameters: {'model_type': 'mlp', 'hidden_dims': '[512, 128]', 'dropout': 0.33305875787074957, 'batch_norm': False, 'lr': 0.00011314282718172297, 'weight_decay': 2.4866407662946595e-05, 'epochs': 200, 'loss': 'mae', 'optimizer': 'adam', 'graph_mode': 'off', 'use_snp_selection': True, 'num_snps': 58241}. Best is trial 8 with value: 0.10763205522352065.
[I 2025-12-05 15:55:59,861] Trial 19 finished with value: 0.09979029215983318 and parameters: {'model_type': 'mlp', 'hidden_dims': '[512, 128]', 'dropout': 0.42887889798689083, 'batch_norm': True, 'lr': 1.352570837276448e-05, 'weight_decay': 0.00017554947736104132, 'epochs': 257, 'loss': 'mae', 'optimizer': 'adam', 'graph_mode': 'off', 'use_snp_selection': False}. Best is trial 8 with value: 0.10763205522352065.
[I 2025-12-05 15:56:01,115] Trial 20 finished with value: 0.10389998611374933 and parameters: {'model_type': 'mlp', 'hidden_dims': '[256, 128]', 'dropout': 0.5508234860183092, 'batch_norm': True, 'lr': 0.00027854139843726527, 'weight_decay': 2.0310335826017027e-05, 'epochs': 292, 'loss': 'mae', 'optimizer': 'adam', 'graph_mode': 'off', 'use_snp_selection': False}. Best is trial 8 with value: 0.10763205522352065.
[I 2025-12-05 15:56:02,200] Trial 21 finished with value: 0.11053401427286712 and parameters: {'model_type': 'mlp', 'hidden_dims': '[256, 128]', 'dropout': 0.36269774729566295, 'batch_norm': False, 'lr': 4.5587658799892015e-05, 'weight_decay': 1.6951283938243103e-06, 'epochs': 202, 'loss': 'mse', 'optimizer': 'adam', 'graph_mode': 'off', 'use_snp_selection': False}. Best is trial 21 with value: 0.11053401427286712.
[I 2025-12-05 15:56:03,310] Trial 22 finished with value: 0.06999236136661045 and parameters: {'model_type': 'mlp', 'hidden_dims': '[256, 128]', 'dropout': 0.34636868939054194, 'batch_norm': False, 'lr': 3.511276726977528e-05, 'weight_decay': 1.1548471343016498e-06, 'epochs': 212, 'loss': 'mse', 'optimizer': 'adam', 'graph_mode': 'off', 'use_snp_selection': False}. Best is trial 21 with value: 0.11053401427286712.
[I 2025-12-05 15:56:04,339] Trial 23 finished with value: 0.08739936300828206 and parameters: {'model_type': 'mlp', 'hidden_dims': '[256, 128]', 'dropout': 0.45331076579582263, 'batch_norm': False, 'lr': 9.002796660349704e-05, 'weight_decay': 3.8952932875574075e-06, 'epochs': 170, 'loss': 'mse', 'optimizer': 'adam', 'graph_mode': 'off', 'use_snp_selection': False}. Best is trial 21 with value: 0.11053401427286712.
[I 2025-12-05 15:56:05,615] Trial 24 finished with value: 0.07954318588109413 and parameters: {'model_type': 'mlp', 'hidden_dims': '[256, 128]', 'dropout': 0.3684829704530253, 'batch_norm': False, 'lr': 2.46462019738549e-05, 'weight_decay': 3.817601088247388e-07, 'epochs': 315, 'loss': 'mse', 'optimizer': 'adam', 'graph_mode': 'off', 'use_snp_selection': False}. Best is trial 21 with value: 0.11053401427286712.
[I 2025-12-05 15:56:06,879] Trial 25 finished with value: 0.08022975392549908 and parameters: {'model_type': 'mlp', 'hidden_dims': '[512, 256]', 'dropout': 0.5229852875537536, 'batch_norm': False, 'lr': 0.00020699623108736125, 'weight_decay': 1.5805345771757675e-06, 'epochs': 124, 'loss': 'mse', 'optimizer': 'adam', 'graph_mode': 'off', 'use_snp_selection': False}. Best is trial 21 with value: 0.11053401427286712.
[I 2025-12-05 15:56:07,869] Trial 26 finished with value: 0.07074062047609467 and parameters: {'model_type': 'mlp', 'hidden_dims': '[256, 128, 64]', 'dropout': 0.3231098422883773, 'batch_norm': False, 'lr': 7.566184031432185e-05, 'weight_decay': 1.183571537453928e-05, 'epochs': 246, 'loss': 'mse', 'optimizer': 'adam', 'graph_mode': 'off', 'use_snp_selection': True, 'num_snps': 3842}. Best is trial 21 with value: 0.11053401427286712.
[I 2025-12-05 15:56:08,773] Trial 27 finished with value: 0.08279585160245988 and parameters: {'model_type': 'mlp', 'hidden_dims': '[128, 64]', 'dropout': 0.4432561465310281, 'batch_norm': True, 'lr': 0.0008915147914214892, 'weight_decay': 5.565026860657747e-06, 'epochs': 214, 'loss': 'mae', 'optimizer': 'adam', 'graph_mode': 'off', 'use_snp_selection': False}. Best is trial 21 with value: 0.11053401427286712.
[I 2025-12-05 15:56:10,234] Trial 28 finished with value: 0.10940088954655397 and parameters: {'model_type': 'mlp', 'hidden_dims': '[512, 128]', 'dropout': 0.23094647187165665, 'batch_norm': False, 'lr': 3.922095210689519e-05, 'weight_decay': 1.0648941267443927e-07, 'epochs': 175, 'loss': 'mse', 'optimizer': 'adam', 'graph_mode': 'off', 'use_snp_selection': False}. Best is trial 21 with value: 0.11053401427286712.
[I 2025-12-05 15:56:11,524] Trial 29 finished with value: 0.1022558413538148 and parameters: {'model_type': 'mlp', 'hidden_dims': '[512, 128]', 'dropout': 0.2072561556500099, 'batch_norm': False, 'lr': 6.305938707476305e-06, 'weight_decay': 1.3382633419462135e-07, 'epochs': 78, 'loss': 'mse', 'optimizer': 'adam', 'graph_mode': 'off', 'use_snp_selection': True, 'num_snps': 19468}. Best is trial 21 with value: 0.11053401427286712.
[I 2025-12-05 15:56:12,936] Trial 30 finished with value: 0.09541504433747151 and parameters: {'model_type': 'mlp', 'hidden_dims': '[512, 128]', 'dropout': 0.1643682238690179, 'batch_norm': False, 'lr': 1.1469917580670532e-05, 'weight_decay': 2.5520363866549565e-07, 'epochs': 174, 'loss': 'mse', 'optimizer': 'adam', 'graph_mode': 'off', 'use_snp_selection': False}. Best is trial 21 with value: 0.11053401427286712.
[I 2025-12-05 15:56:14,292] Trial 31 finished with value: 0.10116029981017556 and parameters: {'model_type': 'mlp', 'hidden_dims': '[512, 128]', 'dropout': 0.10190196053088488, 'batch_norm': False, 'lr': 3.3887151354418794e-05, 'weight_decay': 5.064716634281678e-05, 'epochs': 148, 'loss': 'mse', 'optimizer': 'adam', 'graph_mode': 'off', 'use_snp_selection': False}. Best is trial 21 with value: 0.11053401427286712.
[I 2025-12-05 15:56:15,155] Trial 32 finished with value: 0.11474941554535856 and parameters: {'model_type': 'mlp', 'hidden_dims': '[128, 64]', 'dropout': 0.2469273929063889, 'batch_norm': False, 'lr': 3.9934489119644093e-05, 'weight_decay': 1.3910042709934253e-05, 'epochs': 224, 'loss': 'mse', 'optimizer': 'adam', 'graph_mode': 'off', 'use_snp_selection': False}. Best is trial 32 with value: 0.11474941554535856.
[I 2025-12-05 15:56:15,971] Trial 33 finished with value: 0.09370724833487795 and parameters: {'model_type': 'mlp', 'hidden_dims': '[128, 64]', 'dropout': 0.25337407375415444, 'batch_norm': False, 'lr': 4.255894120312937e-05, 'weight_decay': 8.822340236655884e-05, 'epochs': 186, 'loss': 'mse', 'optimizer': 'adam', 'graph_mode': 'off', 'use_snp_selection': False}. Best is trial 32 with value: 0.11474941554535856.
[I 2025-12-05 15:56:16,685] Trial 34 finished with value: 0.08857261729897069 and parameters: {'model_type': 'mlp', 'hidden_dims': '[128, 64]', 'dropout': 0.19958109072523694, 'batch_norm': False, 'lr': 2.05689560554885e-05, 'weight_decay': 9.049362460584294e-07, 'epochs': 123, 'loss': 'mse', 'optimizer': 'adam', 'graph_mode': 'off', 'use_snp_selection': False}. Best is trial 32 with value: 0.11474941554535856.
[I 2025-12-05 15:56:17,542] Trial 35 finished with value: 0.08994051215037985 and parameters: {'model_type': 'mlp', 'hidden_dims': '[128, 64]', 'dropout': 0.2853712078092529, 'batch_norm': False, 'lr': 2.3956586222911983e-06, 'weight_decay': 1.777090815322593e-05, 'epochs': 219, 'loss': 'mse', 'optimizer': 'adam', 'graph_mode': 'off', 'use_snp_selection': False}. Best is trial 32 with value: 0.11474941554535856.
[I 2025-12-05 15:56:21,072] Trial 36 finished with value: 0.08421036463736048 and parameters: {'model_type': 'mlp', 'hidden_dims': '[512, 128]', 'dropout': 0.24236326101474606, 'batch_norm': False, 'lr': 9.406305771683224e-06, 'weight_decay': 2.2115041181533594e-06, 'epochs': 325, 'loss': 'mse', 'optimizer': 'adam', 'graph_mode': 'off', 'use_snp_selection': True, 'num_snps': 58661}. Best is trial 32 with value: 0.11474941554535856.
[I 2025-12-05 15:56:22,554] Trial 37 finished with value: 0.08428019804846397 and parameters: {'model_type': 'mlp', 'hidden_dims': '[512, 64]', 'dropout': 0.1267491619074638, 'batch_norm': False, 'lr': 0.00010976678396249208, 'weight_decay': 3.609871833535644e-05, 'epochs': 164, 'loss': 'mse', 'optimizer': 'adam', 'graph_mode': 'off', 'use_snp_selection': False}. Best is trial 32 with value: 0.11474941554535856.
[I 2025-12-05 15:56:24,007] Trial 38 finished with value: 0.09008367433742127 and parameters: {'model_type': 'mlp', 'hidden_dims': '[128, 64]', 'dropout': 0.16912362692059213, 'batch_norm': False, 'lr': 2.526053042892501e-05, 'weight_decay': 1.4718740952094895e-05, 'epochs': 258, 'loss': 'mse', 'optimizer': 'adam', 'graph_mode': 'off', 'use_snp_selection': True, 'num_snps': 19911}. Best is trial 32 with value: 0.11474941554535856.
[I 2025-12-05 15:56:24,898] Trial 39 finished with value: 0.08064276111450631 and parameters: {'model_type': 'mlp', 'hidden_dims': '[256, 128, 64]', 'dropout': 0.40491549826838436, 'batch_norm': False, 'lr': 5.286262387346067e-05, 'weight_decay': 4.826379160629551e-06, 'epochs': 111, 'loss': 'mse', 'optimizer': 'adam', 'graph_mode': 'off', 'use_snp_selection': False}. Best is trial 32 with value: 0.11474941554535856.
[I 2025-12-05 15:56:26,436] Trial 40 finished with value: 0.06478682278631304 and parameters: {'model_type': 'mlp', 'hidden_dims': '[512, 128]', 'dropout': 0.18593367615423526, 'batch_norm': False, 'lr': 4.767147905519569e-06, 'weight_decay': 2.722213747869222e-07, 'epochs': 193, 'loss': 'mse', 'optimizer': 'adam', 'graph_mode': 'off', 'use_snp_selection': False}. Best is trial 32 with value: 0.11474941554535856.
[I 2025-12-05 15:56:27,578] Trial 41 finished with value: 0.10947986428280825 and parameters: {'model_type': 'mlp', 'hidden_dims': '[256, 128]', 'dropout': 0.3716081310069049, 'batch_norm': True, 'lr': 7.124677834077803e-05, 'weight_decay': 7.1596880971865045e-06, 'epochs': 218, 'loss': 'mae', 'optimizer': 'adam', 'graph_mode': 'off', 'use_snp_selection': False}. Best is trial 32 with value: 0.11474941554535856.
