[I 2025-12-06 10:55:52,326] Trial 23 finished with value: 0.23756329975822962 and parameters: {'model_type': 'mlp', 'hidden_dims': '[512, 64]', 'dropout': 0.5461953708418259, 'batch_norm': False, 'lr': 9.518252429818128e-05, 'weight_decay': 2.710936305979971e-07, 'epochs': 178, 'loss': 'mae', 'optimizer': 'adam', 'graph_mode': 'off', 'use_snp_selection': False}. Best is trial 17 with value: 0.24241944709749874.
[I 2025-12-06 10:56:21,691] Trial 24 finished with value: 0.23927359043666546 and parameters: {'model_type': 'mlp', 'hidden_dims': '[512, 64]', 'dropout': 0.46654996436896384, 'batch_norm': False, 'lr': 2.9661304158396456e-05, 'weight_decay': 2.2951457154662753e-07, 'epochs': 81, 'loss': 'mae', 'optimizer': 'adam', 'graph_mode': 'off', 'use_snp_selection': False}. Best is trial 17 with value: 0.24241944709749874.
[I 2025-12-06 10:56:45,700] Trial 25 finished with value: 0.23373039497210496 and parameters: {'model_type': 'mlp', 'hidden_dims': '[512, 256]', 'dropout': 0.4578541519594008, 'batch_norm': False, 'lr': 2.7997812624196e-05, 'weight_decay': 2.7135650278957826e-07, 'epochs': 61, 'loss': 'mae', 'optimizer': 'adam', 'graph_mode': 'off', 'use_snp_selection': False}. Best is trial 17 with value: 0.24241944709749874.
[I 2025-12-06 10:57:16,668] Trial 26 finished with value: 0.22269912705885506 and parameters: {'model_type': 'mlp', 'hidden_dims': '[256, 128]', 'dropout': 0.4969954939875916, 'batch_norm': False, 'lr': 3.695750742105119e-05, 'weight_decay': 1.352333858307396e-06, 'epochs': 71, 'loss': 'mae', 'optimizer': 'adam', 'graph_mode': 'off', 'use_snp_selection': True, 'num_snps': 3842}. Best is trial 17 with value: 0.24241944709749874.
[I 2025-12-06 10:57:30,974] Trial 27 finished with value: 0.16676899121272817 and parameters: {'model_type': 'mlp', 'hidden_dims': '[128, 64]', 'dropout': 0.4347457459929344, 'batch_norm': False, 'lr': 0.00041980435615181076, 'weight_decay': 1.7752812643803783e-05, 'epochs': 123, 'loss': 'mae', 'optimizer': 'adam', 'graph_mode': 'off', 'use_snp_selection': False}. Best is trial 17 with value: 0.24241944709749874.
[I 2025-12-06 10:57:48,634] Trial 28 finished with value: 0.22916601978303336 and parameters: {'model_type': 'mlp', 'hidden_dims': '[256, 128, 64]', 'dropout': 0.3634248606781937, 'batch_norm': False, 'lr': 1.617507784183976e-05, 'weight_decay': 1.8219834248060387e-07, 'epochs': 81, 'loss': 'mae', 'optimizer': 'adam', 'graph_mode': 'off', 'use_snp_selection': False}. Best is trial 17 with value: 0.24241944709749874.
[I 2025-12-06 10:58:27,696] Trial 29 finished with value: 0.14209480928737633 and parameters: {'model_type': 'mlp', 'hidden_dims': '[128, 64]', 'dropout': 0.5154708649295417, 'batch_norm': False, 'lr': 2.7351887205587773e-06, 'weight_decay': 0.00010774073487650296, 'epochs': 128, 'loss': 'mae', 'optimizer': 'adam', 'graph_mode': 'off', 'use_snp_selection': True, 'num_snps': 19468}. Best is trial 17 with value: 0.24241944709749874.
[I 2025-12-06 11:00:00,266] Trial 30 finished with value: 0.230751141742963 and parameters: {'model_type': 'mlp', 'hidden_dims': '[512, 64]', 'dropout': 0.563339612033556, 'batch_norm': False, 'lr': 8.082810658005286e-06, 'weight_decay': 6.3175895207505055e-06, 'epochs': 315, 'loss': 'mae', 'optimizer': 'adam', 'graph_mode': 'off', 'use_snp_selection': False}. Best is trial 17 with value: 0.24241944709749874.
[I 2025-12-06 11:00:56,544] Trial 31 finished with value: 0.23292720707365633 and parameters: {'model_type': 'mlp', 'hidden_dims': '[512, 64]', 'dropout': 0.5364698540947149, 'batch_norm': False, 'lr': 0.00010653505299636216, 'weight_decay': 2.3067680642911222e-07, 'epochs': 183, 'loss': 'mae', 'optimizer': 'adam', 'graph_mode': 'off', 'use_snp_selection': False}. Best is trial 17 with value: 0.24241944709749874.
[I 2025-12-06 11:02:08,730] Trial 32 finished with value: 0.22779494616503232 and parameters: {'model_type': 'mlp', 'hidden_dims': '[512, 64]', 'dropout': 0.45320544008061314, 'batch_norm': False, 'lr': 0.00011133122697453926, 'weight_decay': 9.483047867824876e-07, 'epochs': 242, 'loss': 'mae', 'optimizer': 'adam', 'graph_mode': 'off', 'use_snp_selection': False}. Best is trial 17 with value: 0.24241944709749874.
[I 2025-12-06 11:03:00,637] Trial 33 finished with value: 0.23434480165950294 and parameters: {'model_type': 'mlp', 'hidden_dims': '[512, 64]', 'dropout': 0.5609933325432565, 'batch_norm': False, 'lr': 3.4482754573430316e-05, 'weight_decay': 4.1861396736294494e-07, 'epochs': 165, 'loss': 'mae', 'optimizer': 'adam', 'graph_mode': 'off', 'use_snp_selection': False}. Best is trial 17 with value: 0.24241944709749874.
[I 2025-12-06 11:03:18,485] Trial 34 finished with value: 0.23510908238446843 and parameters: {'model_type': 'mlp', 'hidden_dims': '[256, 128]', 'dropout': 0.424992591129858, 'batch_norm': False, 'lr': 8.657918824144099e-05, 'weight_decay': 1.3469007483013366e-05, 'epochs': 83, 'loss': 'mae', 'optimizer': 'adam', 'graph_mode': 'off', 'use_snp_selection': False}. Best is trial 17 with value: 0.24241944709749874.
[I 2025-12-06 11:04:41,186] Trial 35 finished with value: 0.24690746659647095 and parameters: {'model_type': 'mlp', 'hidden_dims': '[512, 64]', 'dropout': 0.4920537373889639, 'batch_norm': False, 'lr': 0.00015754150717731306, 'weight_decay': 2.641315232899907e-06, 'epochs': 136, 'loss': 'mae', 'optimizer': 'adam', 'graph_mode': 'off', 'use_snp_selection': True, 'num_snps': 57586}. Best is trial 35 with value: 0.24690746659647095.
[I 2025-12-06 11:05:49,131] Trial 36 finished with value: 0.24160357790066977 and parameters: {'model_type': 'mlp', 'hidden_dims': '[256, 128, 64]', 'dropout': 0.4888432592976694, 'batch_norm': False, 'lr': 0.00015975900101742696, 'weight_decay': 2.53414685122822e-06, 'epochs': 139, 'loss': 'mae', 'optimizer': 'adam', 'graph_mode': 'off', 'use_snp_selection': True, 'num_snps': 59835}. Best is trial 35 with value: 0.24690746659647095.
[I 2025-12-06 11:06:57,070] Trial 37 finished with value: 0.21169007691257163 and parameters: {'model_type': 'mlp', 'hidden_dims': '[256, 128, 64]', 'dropout': 0.4064669576072178, 'batch_norm': False, 'lr': 0.0009183853666964965, 'weight_decay': 3.181363292878226e-06, 'epochs': 147, 'loss': 'mae', 'optimizer': 'adam', 'graph_mode': 'off', 'use_snp_selection': True, 'num_snps': 58699}. Best is trial 35 with value: 0.24690746659647095.
[I 2025-12-06 11:08:04,012] Trial 38 finished with value: 0.23147855500966125 and parameters: {'model_type': 'mlp', 'hidden_dims': '[256, 128, 64]', 'dropout': 0.48816390399452336, 'batch_norm': False, 'lr': 0.00020037180073992337, 'weight_decay': 8.52926005773455e-06, 'epochs': 205, 'loss': 'mae', 'optimizer': 'adam', 'graph_mode': 'off', 'use_snp_selection': True, 'num_snps': 48069}. Best is trial 35 with value: 0.24690746659647095.
[I 2025-12-06 11:09:05,814] Trial 39 finished with value: 0.23666318600548458 and parameters: {'model_type': 'mlp', 'hidden_dims': '[256, 128, 64]', 'dropout': 0.5178160376729054, 'batch_norm': True, 'lr': 0.00031554011311952016, 'weight_decay': 2.6425104490052097e-05, 'epochs': 137, 'loss': 'mae', 'optimizer': 'adam', 'graph_mode': 'off', 'use_snp_selection': True, 'num_snps': 49388}. Best is trial 35 with value: 0.24690746659647095.
[I 2025-12-06 11:10:11,055] Trial 40 finished with value: 0.24067402481160372 and parameters: {'model_type': 'mlp', 'hidden_dims': '[256, 128, 64]', 'dropout': 0.3784576290014526, 'batch_norm': False, 'lr': 0.00014318691648726253, 'weight_decay': 2.408947447084119e-06, 'epochs': 121, 'loss': 'mae', 'optimizer': 'adam', 'graph_mode': 'off', 'use_snp_selection': True, 'num_snps': 58934}. Best is trial 35 with value: 0.24690746659647095.
[I 2025-12-06 11:11:15,020] Trial 41 finished with value: 0.14887824432292476 and parameters: {'model_type': 'mlp', 'hidden_dims': '[256, 128, 64]', 'dropout': 0.3729630497790635, 'batch_norm': False, 'lr': 1.050807680032028e-06, 'weight_decay': 2.4047002122673545e-06, 'epochs': 108, 'loss': 'mae', 'optimizer': 'adam', 'graph_mode': 'off', 'use_snp_selection': True, 'num_snps': 59096}. Best is trial 35 with value: 0.24690746659647095.
[I 2025-12-06 11:12:19,407] Trial 42 finished with value: 0.23634759530607355 and parameters: {'model_type': 'mlp', 'hidden_dims': '[256, 128, 64]', 'dropout': 0.3273605244022041, 'batch_norm': False, 'lr': 0.00013785977563645954, 'weight_decay': 2.059074332648446e-06, 'epochs': 157, 'loss': 'mae', 'optimizer': 'adam', 'graph_mode': 'off', 'use_snp_selection': True, 'num_snps': 51303}. Best is trial 35 with value: 0.24690746659647095.
[I 2025-12-06 11:13:37,804] Trial 43 finished with value: 0.2344917129141733 and parameters: {'model_type': 'mlp', 'hidden_dims': '[512, 128]', 'dropout': 0.2173189370871989, 'batch_norm': False, 'lr': 5.7598218642391376e-05, 'weight_decay': 3.711155746382039e-06, 'epochs': 137, 'loss': 'mae', 'optimizer': 'adam', 'graph_mode': 'off', 'use_snp_selection': True, 'num_snps': 52645}. Best is trial 35 with value: 0.24690746659647095.
[I 2025-12-06 11:14:31,847] Trial 44 finished with value: 0.24144343688368092 and parameters: {'model_type': 'mlp', 'hidden_dims': '[256, 128, 64]', 'dropout': 0.3945475432752979, 'batch_norm': False, 'lr': 0.0002714642950869955, 'weight_decay': 9.38957320074704e-06, 'epochs': 116, 'loss': 'mae', 'optimizer': 'adam', 'graph_mode': 'off', 'use_snp_selection': True, 'num_snps': 41159}. Best is trial 35 with value: 0.24690746659647095.
[I 2025-12-06 11:15:25,217] Trial 45 finished with value: 0.24248827164268882 and parameters: {'model_type': 'mlp', 'hidden_dims': '[256, 128, 64]', 'dropout': 0.3998716531987566, 'batch_norm': False, 'lr': 0.0003291691231523726, 'weight_decay': 7.5081517827743204e-06, 'epochs': 116, 'loss': 'mae', 'optimizer': 'adam', 'graph_mode': 'off', 'use_snp_selection': True, 'num_snps': 40326}. Best is trial 35 with value: 0.24690746659647095.
[I 2025-12-06 11:16:18,658] Trial 46 finished with value: 0.2400714161250282 and parameters: {'model_type': 'mlp', 'hidden_dims': '[256, 128, 64]', 'dropout': 0.40707166072022266, 'batch_norm': True, 'lr': 0.00037953843914836064, 'weight_decay': 7.925556100096691e-06, 'epochs': 114, 'loss': 'mae', 'optimizer': 'adam', 'graph_mode': 'off', 'use_snp_selection': True, 'num_snps': 39679}. Best is trial 35 with value: 0.24690746659647095.
[I 2025-12-06 11:17:02,044] Trial 47 finished with value: 0.2383105797633432 and parameters: {'model_type': 'mlp', 'hidden_dims': '[256, 128, 64]', 'dropout': 0.3429959476655224, 'batch_norm': False, 'lr': 0.00022745207431359359, 'weight_decay': 1.2293953138989886e-05, 'epochs': 95, 'loss': 'mse', 'optimizer': 'adam', 'graph_mode': 'off', 'use_snp_selection': True, 'num_snps': 25296}. Best is trial 35 with value: 0.24690746659647095.
[I 2025-12-06 11:17:50,322] Trial 48 finished with value: 0.2329087598364928 and parameters: {'model_type': 'mlp', 'hidden_dims': '[256, 128, 64]', 'dropout': 0.44693976952933456, 'batch_norm': False, 'lr': 0.0006611753546941677, 'weight_decay': 1.4180272773544898e-06, 'epochs': 41, 'loss': 'mae', 'optimizer': 'adam', 'graph_mode': 'off', 'use_snp_selection': True, 'num_snps': 43049}. Best is trial 35 with value: 0.24690746659647095.
[I 2025-12-06 11:18:50,963] Trial 49 finished with value: 0.22778556858385093 and parameters: {'model_type': 'mlp', 'hidden_dims': '[512, 256]', 'dropout': 0.2837751305727748, 'batch_norm': True, 'lr': 0.0004514859074676051, 'weight_decay': 4.318195152675101e-06, 'epochs': 134, 'loss': 'mse', 'optimizer': 'adam', 'graph_mode': 'off', 'use_snp_selection': True, 'num_snps': 33858}. Best is trial 35 with value: 0.24690746659647095.
[I 2025-12-06 11:19:51,681] Trial 50 finished with value: 0.2272632535117857 and parameters: {'model_type': 'mlp', 'hidden_dims': '[256, 128, 64]', 'dropout': 0.4198179155812041, 'batch_norm': False, 'lr': 0.0002559567246638246, 'weight_decay': 2.44025361196314e-05, 'epochs': 165, 'loss': 'mae', 'optimizer': 'adam', 'graph_mode': 'off', 'use_snp_selection': True, 'num_snps': 44886}. Best is trial 35 with value: 0.24690746659647095.
[I 2025-12-06 11:20:53,274] Trial 51 finished with value: 0.22665253456384815 and parameters: {'model_type': 'mlp', 'hidden_dims': '[256, 128, 64]', 'dropout': 0.39466894687085297, 'batch_norm': False, 'lr': 0.000137120117238514, 'weight_decay': 6.696293530248659e-06, 'epochs': 117, 'loss': 'mae', 'optimizer': 'adam', 'graph_mode': 'off', 'use_snp_selection': True, 'num_snps': 54217}. Best is trial 35 with value: 0.24690746659647095.
[I 2025-12-06 11:21:54,857] Trial 52 finished with value: 0.23319921342821853 and parameters: {'model_type': 'mlp', 'hidden_dims': '[256, 128, 64]', 'dropout': 0.34844509906488114, 'batch_norm': False, 'lr': 0.000540235555818797, 'weight_decay': 9.979791248192338e-07, 'epochs': 89, 'loss': 'mae', 'optimizer': 'adam', 'graph_mode': 'off', 'use_snp_selection': True, 'num_snps': 59974}. Best is trial 35 with value: 0.24690746659647095.
[I 2025-12-06 11:22:59,744] Trial 53 finished with value: 0.23639500571532354 and parameters: {'model_type': 'mlp', 'hidden_dims': '[256, 128, 64]', 'dropout': 0.379893135871657, 'batch_norm': False, 'lr': 0.00027530554781870397, 'weight_decay': 2.274420788694571e-06, 'epochs': 145, 'loss': 'mae', 'optimizer': 'adam', 'graph_mode': 'off', 'use_snp_selection': True, 'num_snps': 54643}. Best is trial 35 with value: 0.24690746659647095.
[I 2025-12-06 11:23:42,227] Trial 54 finished with value: 0.2542831994125158 and parameters: {'model_type': 'mlp', 'hidden_dims': '[256, 128]', 'dropout': 0.47516984800470596, 'batch_norm': False, 'lr': 7.371424471329155e-05, 'weight_decay': 1.058346824220565e-05, 'epochs': 66, 'loss': 'mae', 'optimizer': 'adam', 'graph_mode': 'off', 'use_snp_selection': True, 'num_snps': 27041}. Best is trial 54 with value: 0.2542831994125158.
[I 2025-12-06 11:24:24,258] Trial 55 finished with value: 0.2507710095223233 and parameters: {'model_type': 'mlp', 'hidden_dims': '[256, 128]', 'dropout': 0.4938632428385226, 'batch_norm': False, 'lr': 8.059286212421767e-05, 'weight_decay': 1.2240090071686065e-05, 'epochs': 65, 'loss': 'mae', 'optimizer': 'adam', 'graph_mode': 'off', 'use_snp_selection': True, 'num_snps': 25806}. Best is trial 54 with value: 0.2542831994125158.
[I 2025-12-06 11:25:06,471] Trial 56 finished with value: 0.24295622573509248 and parameters: {'model_type': 'mlp', 'hidden_dims': '[256, 128]', 'dropout': 0.5006611727162872, 'batch_norm': False, 'lr': 7.023643990238768e-05, 'weight_decay': 0.0007610191953200542, 'epochs': 59, 'loss': 'mae', 'optimizer': 'adam', 'graph_mode': 'off', 'use_snp_selection': True, 'num_snps': 27194}. Best is trial 54 with value: 0.2542831994125158.
[I 2025-12-06 11:25:48,602] Trial 57 finished with value: 0.24745147443729984 and parameters: {'model_type': 'mlp', 'hidden_dims': '[256, 128]', 'dropout': 0.5037464059693342, 'batch_norm': False, 'lr': 4.616686991123165e-05, 'weight_decay': 7.094682252249367e-05, 'epochs': 64, 'loss': 'mse', 'optimizer': 'adam', 'graph_mode': 'off', 'use_snp_selection': True, 'num_snps': 26419}. Best is trial 54 with value: 0.2542831994125158.
[I 2025-12-06 11:26:30,790] Trial 58 finished with value: 0.24341545493955613 and parameters: {'model_type': 'mlp', 'hidden_dims': '[256, 128]', 'dropout': 0.5055623975023376, 'batch_norm': True, 'lr': 4.943353046623039e-05, 'weight_decay': 0.0008946259409421015, 'epochs': 58, 'loss': 'mse', 'optimizer': 'adam', 'graph_mode': 'off', 'use_snp_selection': True, 'num_snps': 27364}. Best is trial 54 with value: 0.2542831994125158.
[I 2025-12-06 11:27:13,752] Trial 59 finished with value: 0.2462456239638388 and parameters: {'model_type': 'mlp', 'hidden_dims': '[256, 128]', 'dropout': 0.4681678190830459, 'batch_norm': True, 'lr': 4.329400089189214e-05, 'weight_decay': 0.0007657264276555179, 'epochs': 68, 'loss': 'mse', 'optimizer': 'adam', 'graph_mode': 'off', 'use_snp_selection': True, 'num_snps': 26256}. Best is trial 54 with value: 0.2542831994125158.
[I 2025-12-06 11:27:54,497] Trial 60 finished with value: 0.21571634840796267 and parameters: {'model_type': 'mlp', 'hidden_dims': '[256, 128]', 'dropout': 0.4764010678838178, 'batch_norm': True, 'lr': 4.551757808368492e-05, 'weight_decay': 0.0004885228699651081, 'epochs': 71, 'loss': 'mse', 'optimizer': 'adam', 'graph_mode': 'off', 'use_snp_selection': True, 'num_snps': 22745}. Best is trial 54 with value: 0.2542831994125158.
[I 2025-12-06 11:28:36,329] Trial 61 finished with value: 0.24860966059956074 and parameters: {'model_type': 'mlp', 'hidden_dims': '[256, 128]', 'dropout': 0.5004698713114119, 'batch_norm': True, 'lr': 6.379638717072824e-05, 'weight_decay': 0.000949160816581723, 'epochs': 49, 'loss': 'mse', 'optimizer': 'adam', 'graph_mode': 'off', 'use_snp_selection': True, 'num_snps': 27540}. Best is trial 54 with value: 0.2542831994125158.
[I 2025-12-06 11:29:18,438] Trial 62 finished with value: 0.21378736982355032 and parameters: {'model_type': 'mlp', 'hidden_dims': '[256, 128]', 'dropout': 0.5330948517536455, 'batch_norm': True, 'lr': 4.354544647333792e-05, 'weight_decay': 0.0009911535542928398, 'epochs': 44, 'loss': 'mse', 'optimizer': 'adam', 'graph_mode': 'off', 'use_snp_selection': True, 'num_snps': 28742}. Best is trial 54 with value: 0.2542831994125158.
[I 2025-12-06 11:29:57,618] Trial 63 finished with value: 0.21985511590170384 and parameters: {'model_type': 'mlp', 'hidden_dims': '[256, 128]', 'dropout': 0.576313146883736, 'batch_norm': True, 'lr': 2.4470360585447234e-05, 'weight_decay': 0.00029397597789501586, 'epochs': 69, 'loss': 'mse', 'optimizer': 'adam', 'graph_mode': 'off', 'use_snp_selection': True, 'num_snps': 19935}. Best is trial 54 with value: 0.2542831994125158.
[I 2025-12-06 11:30:38,190] Trial 64 finished with value: 0.24021791215979288 and parameters: {'model_type': 'mlp', 'hidden_dims': '[256, 128]', 'dropout': 0.5091029387397504, 'batch_norm': True, 'lr': 8.006031118406257e-05, 'weight_decay': 0.00019803697383214162, 'epochs': 58, 'loss': 'mse', 'optimizer': 'adam', 'graph_mode': 'off', 'use_snp_selection': True, 'num_snps': 24060}. Best is trial 54 with value: 0.2542831994125158.
[I 2025-12-06 11:31:21,514] Trial 65 finished with value: 0.23777029096313304 and parameters: {'model_type': 'mlp', 'hidden_dims': '[256, 128]', 'dropout': 0.47166146542110265, 'batch_norm': True, 'lr': 5.7028279444149126e-05, 'weight_decay': 0.0004570995878092071, 'epochs': 51, 'loss': 'mse', 'optimizer': 'adam', 'graph_mode': 'off', 'use_snp_selection': True, 'num_snps': 30607}. Best is trial 54 with value: 0.2542831994125158.
[I 2025-12-06 11:31:59,777] Trial 66 finished with value: 0.221718769373043 and parameters: {'model_type': 'mlp', 'hidden_dims': '[256, 128]', 'dropout': 0.4408934460856963, 'batch_norm': True, 'lr': 1.893336486538532e-05, 'weight_decay': 9.589603419507435e-05, 'epochs': 68, 'loss': 'mse', 'optimizer': 'adam', 'graph_mode': 'off', 'use_snp_selection': True, 'num_snps': 17861}. Best is trial 54 with value: 0.2542831994125158.
[I 2025-12-06 11:32:47,793] Trial 67 finished with value: 0.23890097898747187 and parameters: {'model_type': 'mlp', 'hidden_dims': '[256, 128]', 'dropout': 0.46120958270657525, 'batch_norm': True, 'lr': 4.0989182537381555e-05, 'weight_decay': 0.0006818216970850658, 'epochs': 90, 'loss': 'mse', 'optimizer': 'adam', 'graph_mode': 'off', 'use_snp_selection': True, 'num_snps': 34474}. Best is trial 54 with value: 0.2542831994125158.
[I 2025-12-06 11:33:24,682] Trial 68 finished with value: 0.23346245950492134 and parameters: {'model_type': 'mlp', 'hidden_dims': '[256, 128]', 'dropout': 0.5374731330105983, 'batch_norm': True, 'lr': 6.969585291565087e-05, 'weight_decay': 0.0005024213173343459, 'epochs': 75, 'loss': 'mse', 'optimizer': 'adam', 'graph_mode': 'off', 'use_snp_selection': True, 'num_snps': 14660}. Best is trial 54 with value: 0.2542831994125158.
[I 2025-12-06 11:34:07,157] Trial 69 finished with value: 0.2357962374055822 and parameters: {'model_type': 'mlp', 'hidden_dims': '[256, 128]', 'dropout': 0.5007787355865629, 'batch_norm': True, 'lr': 5.7183384080780294e-05, 'weight_decay': 6.0874098356527946e-05, 'epochs': 51, 'loss': 'mse', 'optimizer': 'adam', 'graph_mode': 'off', 'use_snp_selection': True, 'num_snps': 28388}. Best is trial 54 with value: 0.2542831994125158.
[I 2025-12-06 11:34:47,412] Trial 70 finished with value: 0.2387715212002167 and parameters: {'model_type': 'mlp', 'hidden_dims': '[256, 128]', 'dropout': 0.5228649501504623, 'batch_norm': True, 'lr': 0.0001157454565122878, 'weight_decay': 0.00039646234897015804, 'epochs': 65, 'loss': 'mse', 'optimizer': 'adam', 'graph_mode': 'off', 'use_snp_selection': True, 'num_snps': 22123}. Best is trial 54 with value: 0.2542831994125158.
[I 2025-12-06 11:35:29,510] Trial 71 finished with value: 0.24577536810582545 and parameters: {'model_type': 'mlp', 'hidden_dims': '[256, 128]', 'dropout': 0.4897800922176481, 'batch_norm': True, 'lr': 7.229454787241436e-05, 'weight_decay': 0.0007049931240156628, 'epochs': 58, 'loss': 'mse', 'optimizer': 'adam', 'graph_mode': 'off', 'use_snp_selection': True, 'num_snps': 26853}. Best is trial 54 with value: 0.2542831994125158.
[I 2025-12-06 11:36:12,188] Trial 72 finished with value: 0.2327661804837716 and parameters: {'model_type': 'mlp', 'hidden_dims': '[256, 128]', 'dropout': 0.47470819286436405, 'batch_norm': True, 'lr': 8.566120823824409e-05, 'weight_decay': 0.0006460361772524733, 'epochs': 77, 'loss': 'mse', 'optimizer': 'adam', 'graph_mode': 'off', 'use_snp_selection': True, 'num_snps': 26119}. Best is trial 54 with value: 0.2542831994125158.
[I 2025-12-06 11:36:55,242] Trial 73 finished with value: 0.22272899084437198 and parameters: {'model_type': 'mlp', 'hidden_dims': '[256, 128]', 'dropout': 0.49542829548273126, 'batch_norm': True, 'lr': 3.0207058643005457e-05, 'weight_decay': 0.0002056236608198555, 'epochs': 48, 'loss': 'mse', 'optimizer': 'adam', 'graph_mode': 'off', 'use_snp_selection': True, 'num_snps': 30510}. Best is trial 54 with value: 0.2542831994125158.
