[I 2025-12-05 18:45:50,466] Trial 107 finished with value: 0.23909833569946834 and parameters: {'model_type': 'mlp', 'hidden_dims': '[512, 128]', 'dropout': 0.5721719726767248, 'batch_norm': True, 'lr': 2.629951466188874e-05, 'weight_decay': 0.00022008105285426492, 'epochs': 223, 'loss': 'mae', 'optimizer': 'adam', 'graph_mode': 'off', 'use_snp_selection': True, 'num_snps': 11181}. Best is trial 88 with value: 0.25605761547142347.
[I 2025-12-05 18:46:33,836] Trial 108 finished with value: 0.24498929186256327 and parameters: {'model_type': 'mlp', 'hidden_dims': '[512, 128]', 'dropout': 0.5816010917589908, 'batch_norm': False, 'lr': 3.6528552523986063e-05, 'weight_decay': 0.00028928297911558703, 'epochs': 231, 'loss': 'mae', 'optimizer': 'adam', 'graph_mode': 'off', 'use_snp_selection': True, 'num_snps': 10239}. Best is trial 88 with value: 0.25605761547142347.
[I 2025-12-05 18:47:16,646] Trial 109 finished with value: 0.24101270494670696 and parameters: {'model_type': 'mlp', 'hidden_dims': '[512, 128]', 'dropout': 0.5342059617300102, 'batch_norm': False, 'lr': 3.8490153537882636e-05, 'weight_decay': 0.000298839243977899, 'epochs': 220, 'loss': 'mae', 'optimizer': 'adam', 'graph_mode': 'off', 'use_snp_selection': True, 'num_snps': 10207}. Best is trial 88 with value: 0.25605761547142347.
[I 2025-12-05 18:48:06,309] Trial 110 finished with value: 0.236687476203987 and parameters: {'model_type': 'mlp', 'hidden_dims': '[512, 128]', 'dropout': 0.5505888995054927, 'batch_norm': False, 'lr': 5.355720769507347e-05, 'weight_decay': 0.00015290310801355488, 'epochs': 233, 'loss': 'mae', 'optimizer': 'adam', 'graph_mode': 'off', 'use_snp_selection': True, 'num_snps': 14896}. Best is trial 88 with value: 0.25605761547142347.
[I 2025-12-05 18:48:48,181] Trial 111 finished with value: 0.25047672154969225 and parameters: {'model_type': 'mlp', 'hidden_dims': '[512, 128]', 'dropout': 0.5830424919929651, 'batch_norm': False, 'lr': 2.3017110033037244e-05, 'weight_decay': 0.0003435188132096543, 'epochs': 197, 'loss': 'mae', 'optimizer': 'adam', 'graph_mode': 'off', 'use_snp_selection': True, 'num_snps': 10011}. Best is trial 88 with value: 0.25605761547142347.
[I 2025-12-05 18:49:32,129] Trial 112 finished with value: 0.24676435454247256 and parameters: {'model_type': 'mlp', 'hidden_dims': '[512, 128]', 'dropout': 0.5650111204752163, 'batch_norm': False, 'lr': 3.423101582218168e-05, 'weight_decay': 0.0003524157983111571, 'epochs': 216, 'loss': 'mae', 'optimizer': 'adam', 'graph_mode': 'off', 'use_snp_selection': True, 'num_snps': 10926}. Best is trial 88 with value: 0.25605761547142347.
[I 2025-12-05 18:50:08,627] Trial 113 finished with value: 0.22049023589039196 and parameters: {'model_type': 'mlp', 'hidden_dims': '[512, 128]', 'dropout': 0.5676983711623272, 'batch_norm': False, 'lr': 3.455624363210561e-05, 'weight_decay': 0.00017045026658093145, 'epochs': 215, 'loss': 'mae', 'optimizer': 'adam', 'graph_mode': 'off', 'use_snp_selection': True, 'num_snps': 4796}. Best is trial 88 with value: 0.25605761547142347.
[I 2025-12-05 18:50:56,973] Trial 114 finished with value: 0.24992366740472566 and parameters: {'model_type': 'mlp', 'hidden_dims': '[512, 128]', 'dropout': 0.561652802185558, 'batch_norm': False, 'lr': 4.46045471144838e-05, 'weight_decay': 0.0004848994487446573, 'epochs': 227, 'loss': 'mae', 'optimizer': 'adam', 'graph_mode': 'off', 'use_snp_selection': True, 'num_snps': 13848}. Best is trial 88 with value: 0.25605761547142347.
[I 2025-12-05 18:51:46,473] Trial 115 finished with value: 0.24150101352063205 and parameters: {'model_type': 'mlp', 'hidden_dims': '[512, 128]', 'dropout': 0.5608549036490347, 'batch_norm': False, 'lr': 4.794049957203412e-05, 'weight_decay': 0.0004797372120735208, 'epochs': 240, 'loss': 'mae', 'optimizer': 'adam', 'graph_mode': 'off', 'use_snp_selection': True, 'num_snps': 14191}. Best is trial 88 with value: 0.25605761547142347.
[I 2025-12-05 18:52:30,865] Trial 116 finished with value: 0.25608827643596116 and parameters: {'model_type': 'mlp', 'hidden_dims': '[512, 128]', 'dropout': 0.5150913251336483, 'batch_norm': False, 'lr': 6.417007199427898e-05, 'weight_decay': 0.0002579581236140985, 'epochs': 224, 'loss': 'mae', 'optimizer': 'adam', 'graph_mode': 'off', 'use_snp_selection': True, 'num_snps': 11042}. Best is trial 116 with value: 0.25608827643596116.
[I 2025-12-05 18:53:15,694] Trial 117 finished with value: 0.2494234799188642 and parameters: {'model_type': 'mlp', 'hidden_dims': '[512, 128]', 'dropout': 0.5507567715816288, 'batch_norm': False, 'lr': 7.134907024746745e-05, 'weight_decay': 0.0002166570871680789, 'epochs': 224, 'loss': 'mae', 'optimizer': 'adam', 'graph_mode': 'off', 'use_snp_selection': True, 'num_snps': 11503}. Best is trial 116 with value: 0.25608827643596116.
[I 2025-12-05 18:54:01,624] Trial 118 finished with value: 0.24553956892560466 and parameters: {'model_type': 'mlp', 'hidden_dims': '[512, 128]', 'dropout': 0.5499245339540225, 'batch_norm': False, 'lr': 6.998719667673201e-05, 'weight_decay': 0.00023164048434861604, 'epochs': 225, 'loss': 'mae', 'optimizer': 'adam', 'graph_mode': 'off', 'use_snp_selection': True, 'num_snps': 12192}. Best is trial 116 with value: 0.25608827643596116.
[I 2025-12-05 18:54:50,535] Trial 119 finished with value: 0.24327701127047466 and parameters: {'model_type': 'mlp', 'hidden_dims': '[512, 128]', 'dropout': 0.5167540811654221, 'batch_norm': False, 'lr': 0.00010686355152728928, 'weight_decay': 0.0006171445938469033, 'epochs': 218, 'loss': 'mae', 'optimizer': 'adam', 'graph_mode': 'off', 'use_snp_selection': True, 'num_snps': 15188}. Best is trial 116 with value: 0.25608827643596116.
[I 2025-12-05 18:55:35,705] Trial 120 finished with value: 0.2555377054451876 and parameters: {'model_type': 'mlp', 'hidden_dims': '[512, 128]', 'dropout': 0.5315664294482183, 'batch_norm': False, 'lr': 4.7650490030712574e-05, 'weight_decay': 0.00018843491196871584, 'epochs': 237, 'loss': 'mae', 'optimizer': 'adam', 'graph_mode': 'off', 'use_snp_selection': True, 'num_snps': 11265}. Best is trial 116 with value: 0.25608827643596116.
[I 2025-12-05 18:56:21,468] Trial 121 finished with value: 0.2462849501366783 and parameters: {'model_type': 'mlp', 'hidden_dims': '[512, 128]', 'dropout': 0.5635363595238314, 'batch_norm': False, 'lr': 4.6341651242687065e-05, 'weight_decay': 0.00018966227502898947, 'epochs': 241, 'loss': 'mae', 'optimizer': 'adam', 'graph_mode': 'off', 'use_snp_selection': True, 'num_snps': 11694}. Best is trial 116 with value: 0.25608827643596116.
[I 2025-12-05 18:56:59,308] Trial 122 finished with value: 0.22994249833452565 and parameters: {'model_type': 'mlp', 'hidden_dims': '[512, 128]', 'dropout': 0.5309433629251374, 'batch_norm': False, 'lr': 6.27798752070591e-05, 'weight_decay': 0.0004381161930237418, 'epochs': 231, 'loss': 'mae', 'optimizer': 'adam', 'graph_mode': 'off', 'use_snp_selection': True, 'num_snps': 5520}. Best is trial 116 with value: 0.25608827643596116.
[I 2025-12-05 18:57:43,139] Trial 123 finished with value: 0.23915300593352534 and parameters: {'model_type': 'mlp', 'hidden_dims': '[512, 128]', 'dropout': 0.5451902023552614, 'batch_norm': False, 'lr': 8.688561746571284e-05, 'weight_decay': 0.0002834608597951831, 'epochs': 225, 'loss': 'mae', 'optimizer': 'adam', 'graph_mode': 'off', 'use_snp_selection': True, 'num_snps': 10471}. Best is trial 116 with value: 0.25608827643596116.
[I 2025-12-05 18:58:29,334] Trial 124 finished with value: 0.24510794475286746 and parameters: {'model_type': 'mlp', 'hidden_dims': '[512, 128]', 'dropout': 0.5111937715624123, 'batch_norm': False, 'lr': 2.9939757126033874e-05, 'weight_decay': 0.00023446553352320898, 'epochs': 209, 'loss': 'mae', 'optimizer': 'adam', 'graph_mode': 'off', 'use_snp_selection': True, 'num_snps': 13277}. Best is trial 116 with value: 0.25608827643596116.
[I 2025-12-05 18:59:10,632] Trial 125 finished with value: 0.23826816739076356 and parameters: {'model_type': 'mlp', 'hidden_dims': '[128, 64]', 'dropout': 0.5558539905642632, 'batch_norm': False, 'lr': 5.598231270721047e-05, 'weight_decay': 0.00038004623677869456, 'epochs': 255, 'loss': 'mae', 'optimizer': 'adam', 'graph_mode': 'off', 'use_snp_selection': True, 'num_snps': 16840}. Best is trial 116 with value: 0.25608827643596116.
[I 2025-12-05 18:59:49,610] Trial 126 finished with value: 0.23772355283055097 and parameters: {'model_type': 'mlp', 'hidden_dims': '[512, 128]', 'dropout': 0.5662609204673169, 'batch_norm': False, 'lr': 2.2058190185842753e-05, 'weight_decay': 0.0004754126804299878, 'epochs': 221, 'loss': 'mae', 'optimizer': 'adam', 'graph_mode': 'off', 'use_snp_selection': True, 'num_snps': 6676}. Best is trial 116 with value: 0.25608827643596116.
[I 2025-12-05 19:00:24,196] Trial 127 finished with value: 0.1811405722592786 and parameters: {'model_type': 'mlp', 'hidden_dims': '[512, 128]', 'dropout': 0.5831043659454347, 'batch_norm': True, 'lr': 1.713545083590859e-05, 'weight_decay': 0.000622846126224595, 'epochs': 199, 'loss': 'mae', 'optimizer': 'adam', 'graph_mode': 'off', 'use_snp_selection': True, 'num_snps': 3038}. Best is trial 116 with value: 0.25608827643596116.
[I 2025-12-05 19:01:09,219] Trial 128 finished with value: 0.24049050305304612 and parameters: {'model_type': 'mlp', 'hidden_dims': '[512, 128]', 'dropout': 0.5387497944104588, 'batch_norm': False, 'lr': 0.00013972312975345938, 'weight_decay': 0.00010391233373822895, 'epochs': 237, 'loss': 'mae', 'optimizer': 'adam', 'graph_mode': 'off', 'use_snp_selection': True, 'num_snps': 10825}. Best is trial 116 with value: 0.25608827643596116.
[I 2025-12-05 19:01:58,503] Trial 129 finished with value: 0.2453453927941422 and parameters: {'model_type': 'mlp', 'hidden_dims': '[512, 256]', 'dropout': 0.5969655506997084, 'batch_norm': False, 'lr': 8.048888272964717e-05, 'weight_decay': 0.0002561228602974002, 'epochs': 249, 'loss': 'mae', 'optimizer': 'adam', 'graph_mode': 'off', 'use_snp_selection': True, 'num_snps': 13328}. Best is trial 116 with value: 0.25608827643596116.
[I 2025-12-05 19:02:37,116] Trial 130 finished with value: 0.23668529045290682 and parameters: {'model_type': 'mlp', 'hidden_dims': '[512, 128]', 'dropout': 0.5355406785408563, 'batch_norm': False, 'lr': 4.4435306241282886e-05, 'weight_decay': 0.0001469988086891402, 'epochs': 199, 'loss': 'mae', 'optimizer': 'adam', 'graph_mode': 'off', 'use_snp_selection': True, 'num_snps': 6734}. Best is trial 116 with value: 0.25608827643596116.
[I 2025-12-05 19:03:18,857] Trial 131 finished with value: 0.25207350009323787 and parameters: {'model_type': 'mlp', 'hidden_dims': '[512, 128]', 'dropout': 0.5762479703769935, 'batch_norm': False, 'lr': 3.1931565503064186e-05, 'weight_decay': 0.0003090028010043827, 'epochs': 189, 'loss': 'mae', 'optimizer': 'adam', 'graph_mode': 'off', 'use_snp_selection': True, 'num_snps': 9777}. Best is trial 116 with value: 0.25608827643596116.
[I 2025-12-05 19:04:00,528] Trial 132 finished with value: 0.2538681011699023 and parameters: {'model_type': 'mlp', 'hidden_dims': '[512, 128]', 'dropout': 0.5783292159094195, 'batch_norm': False, 'lr': 3.303341179684925e-05, 'weight_decay': 0.0003149721556988375, 'epochs': 185, 'loss': 'mae', 'optimizer': 'adam', 'graph_mode': 'off', 'use_snp_selection': True, 'num_snps': 10000}. Best is trial 116 with value: 0.25608827643596116.
[I 2025-12-05 19:04:41,976] Trial 133 finished with value: 0.24855868404562118 and parameters: {'model_type': 'mlp', 'hidden_dims': '[512, 128]', 'dropout': 0.5838622870261283, 'batch_norm': False, 'lr': 6.52748196202055e-05, 'weight_decay': 0.00018967459214358663, 'epochs': 186, 'loss': 'mae', 'optimizer': 'adam', 'graph_mode': 'off', 'use_snp_selection': True, 'num_snps': 9847}. Best is trial 116 with value: 0.25608827643596116.
[I 2025-12-05 19:05:26,066] Trial 134 finished with value: 0.2597570086091091 and parameters: {'model_type': 'mlp', 'hidden_dims': '[512, 128]', 'dropout': 0.40309960345827284, 'batch_norm': False, 'lr': 6.703217356444677e-05, 'weight_decay': 0.00019676591007665304, 'epochs': 180, 'loss': 'mae', 'optimizer': 'adam', 'graph_mode': 'off', 'use_snp_selection': True, 'num_snps': 12131}. Best is trial 134 with value: 0.2597570086091091.
[I 2025-12-05 19:06:14,963] Trial 135 finished with value: 0.240808221246876 and parameters: {'model_type': 'mlp', 'hidden_dims': '[512, 128]', 'dropout': 0.3989985679464599, 'batch_norm': False, 'lr': 6.31500872981045e-05, 'weight_decay': 0.0002965171398915714, 'epochs': 211, 'loss': 'mae', 'optimizer': 'adam', 'graph_mode': 'off', 'use_snp_selection': True, 'num_snps': 15032}. Best is trial 134 with value: 0.2597570086091091.
[I 2025-12-05 19:07:00,005] Trial 136 finished with value: 0.24554729662632044 and parameters: {'model_type': 'mlp', 'hidden_dims': '[512, 128]', 'dropout': 0.5507645899125849, 'batch_norm': False, 'lr': 7.23674237984188e-05, 'weight_decay': 0.00017389095782449374, 'epochs': 191, 'loss': 'mae', 'optimizer': 'adam', 'graph_mode': 'off', 'use_snp_selection': True, 'num_snps': 12540}. Best is trial 134 with value: 0.2597570086091091.
[I 2025-12-05 19:07:51,305] Trial 137 finished with value: 0.24827524866565884 and parameters: {'model_type': 'mlp', 'hidden_dims': '[512, 128]', 'dropout': 0.46515268066267784, 'batch_norm': False, 'lr': 5.0251004701093685e-05, 'weight_decay': 0.0001960755156632621, 'epochs': 184, 'loss': 'mae', 'optimizer': 'adam', 'graph_mode': 'off', 'use_snp_selection': True, 'num_snps': 18499}. Best is trial 134 with value: 0.2597570086091091.
[I 2025-12-05 19:08:33,397] Trial 138 finished with value: 0.24456693492677015 and parameters: {'model_type': 'mlp', 'hidden_dims': '[256, 128]', 'dropout': 0.45349047909474743, 'batch_norm': False, 'lr': 5.088600831473468e-05, 'weight_decay': 0.00011747436460946813, 'epochs': 171, 'loss': 'mae', 'optimizer': 'adam', 'graph_mode': 'off', 'use_snp_selection': True, 'num_snps': 16210}. Best is trial 134 with value: 0.2597570086091091.
[I 2025-12-05 19:09:17,683] Trial 139 finished with value: 0.24897262564874773 and parameters: {'model_type': 'mlp', 'hidden_dims': '[512, 128]', 'dropout': 0.41081338701027803, 'batch_norm': False, 'lr': 0.00011984892515490625, 'weight_decay': 8.6982144885716e-05, 'epochs': 184, 'loss': 'mae', 'optimizer': 'adam', 'graph_mode': 'off', 'use_snp_selection': True, 'num_snps': 12165}. Best is trial 134 with value: 0.2597570086091091.
[I 2025-12-05 19:10:01,230] Trial 140 finished with value: 0.2508304364035429 and parameters: {'model_type': 'mlp', 'hidden_dims': '[512, 128]', 'dropout': 0.40966385256491084, 'batch_norm': False, 'lr': 0.00010951464730355088, 'weight_decay': 0.0001368674956334081, 'epochs': 186, 'loss': 'mae', 'optimizer': 'adam', 'graph_mode': 'off', 'use_snp_selection': True, 'num_snps': 12065}. Best is trial 134 with value: 0.2597570086091091.
[I 2025-12-05 19:10:44,244] Trial 141 finished with value: 0.24717962441131505 and parameters: {'model_type': 'mlp', 'hidden_dims': '[512, 128]', 'dropout': 0.4366657088583522, 'batch_norm': False, 'lr': 0.0001229847711147114, 'weight_decay': 0.0001194625835665409, 'epochs': 179, 'loss': 'mae', 'optimizer': 'adam', 'graph_mode': 'off', 'use_snp_selection': True, 'num_snps': 11552}. Best is trial 134 with value: 0.2597570086091091.
[I 2025-12-05 19:11:29,024] Trial 142 finished with value: 0.24312821706658694 and parameters: {'model_type': 'mlp', 'hidden_dims': '[512, 128]', 'dropout': 0.4117229027749147, 'batch_norm': False, 'lr': 0.00012056864281176645, 'weight_decay': 0.0001377908999857763, 'epochs': 176, 'loss': 'mae', 'optimizer': 'adam', 'graph_mode': 'off', 'use_snp_selection': True, 'num_snps': 13633}. Best is trial 134 with value: 0.2597570086091091.
[I 2025-12-05 19:12:05,820] Trial 143 finished with value: 0.24009205664883537 and parameters: {'model_type': 'mlp', 'hidden_dims': '[512, 128]', 'dropout': 0.4100758666534766, 'batch_norm': False, 'lr': 7.395896150264908e-05, 'weight_decay': 7.836742429960145e-05, 'epochs': 41, 'loss': 'mae', 'optimizer': 'adam', 'graph_mode': 'off', 'use_snp_selection': True, 'num_snps': 12284}. Best is trial 134 with value: 0.2597570086091091.
[I 2025-12-05 19:12:44,710] Trial 144 finished with value: 0.2261320245421367 and parameters: {'model_type': 'mlp', 'hidden_dims': '[512, 128]', 'dropout': 0.35686256295200103, 'batch_norm': False, 'lr': 9.69633017971444e-05, 'weight_decay': 0.00016606163805560253, 'epochs': 187, 'loss': 'mae', 'optimizer': 'adam', 'graph_mode': 'off', 'use_snp_selection': True, 'num_snps': 7432}. Best is trial 134 with value: 0.2597570086091091.
[I 2025-12-05 19:13:25,475] Trial 145 finished with value: 0.24555261747562218 and parameters: {'model_type': 'mlp', 'hidden_dims': '[512, 128]', 'dropout': 0.3857349729797983, 'batch_norm': False, 'lr': 0.00016934030783700564, 'weight_decay': 9.4115855452533e-05, 'epochs': 164, 'loss': 'mae', 'optimizer': 'adam', 'graph_mode': 'off', 'use_snp_selection': True, 'num_snps': 10308}. Best is trial 134 with value: 0.2597570086091091.
[I 2025-12-05 19:14:05,683] Trial 146 finished with value: 0.23888750850301982 and parameters: {'model_type': 'mlp', 'hidden_dims': '[512, 128]', 'dropout': 0.42715585619645197, 'batch_norm': False, 'lr': 4.021378424889483e-05, 'weight_decay': 0.0002614544640343107, 'epochs': 205, 'loss': 'mae', 'optimizer': 'adam', 'graph_mode': 'off', 'use_snp_selection': True, 'num_snps': 8090}. Best is trial 134 with value: 0.2597570086091091.
[I 2025-12-05 19:14:39,544] Trial 147 finished with value: 0.22453965644081425 and parameters: {'model_type': 'mlp', 'hidden_dims': '[128, 64]', 'dropout': 0.3883035584572352, 'batch_norm': False, 'lr': 6.058668225834995e-05, 'weight_decay': 0.00020553877717333974, 'epochs': 188, 'loss': 'mae', 'optimizer': 'adam', 'graph_mode': 'off', 'use_snp_selection': True, 'num_snps': 5721}. Best is trial 134 with value: 0.2597570086091091.
[I 2025-12-05 19:15:23,918] Trial 148 finished with value: 0.24629614620494636 and parameters: {'model_type': 'mlp', 'hidden_dims': '[512, 128]', 'dropout': 0.44981200326549486, 'batch_norm': False, 'lr': 3.295445361613192e-05, 'weight_decay': 0.0005200102999376911, 'epochs': 159, 'loss': 'mae', 'optimizer': 'adam', 'graph_mode': 'off', 'use_snp_selection': True, 'num_snps': 13699}. Best is trial 134 with value: 0.2597570086091091.
[I 2025-12-05 19:16:05,086] Trial 149 finished with value: 0.22915556976365323 and parameters: {'model_type': 'mlp', 'hidden_dims': '[512, 128]', 'dropout': 0.3327923285593665, 'batch_norm': True, 'lr': 8.068869311809249e-05, 'weight_decay': 0.0002940860968519333, 'epochs': 177, 'loss': 'mae', 'optimizer': 'adam', 'graph_mode': 'off', 'use_snp_selection': True, 'num_snps': 9482}. Best is trial 134 with value: 0.2597570086091091.
[I 2025-12-05 19:17:09,681] Trial 0 finished with value: 0.1757277873724386 and parameters: {'model_type': 'mlp', 'hidden_dims': '[128, 64]', 'dropout': 0.199031432379812, 'batch_norm': True, 'lr': 1.8408544111075837e-06, 'weight_decay': 5.5136510071208614e-05, 'epochs': 336, 'loss': 'mae', 'optimizer': 'adam', 'graph_mode': 'off', 'use_snp_selection': True, 'num_snps': 43862}. Best is trial 0 with value: 0.1757277873724386.
[I 2025-12-05 19:17:48,354] Trial 1 finished with value: 0.20850593502122367 and parameters: {'model_type': 'mlp', 'hidden_dims': '[256, 128]', 'dropout': 0.4370668075331726, 'batch_norm': True, 'lr': 7.133471581159139e-05, 'weight_decay': 1.128633586803549e-05, 'epochs': 242, 'loss': 'mae', 'optimizer': 'adam', 'graph_mode': 'off', 'use_snp_selection': False}. Best is trial 1 with value: 0.20850593502122367.
[I 2025-12-05 19:18:24,624] Trial 2 finished with value: 0.16892151994562973 and parameters: {'model_type': 'mlp', 'hidden_dims': '[256, 128, 64]', 'dropout': 0.41314357415569625, 'batch_norm': False, 'lr': 3.952233718592101e-06, 'weight_decay': 0.00026754769258252603, 'epochs': 149, 'loss': 'mse', 'optimizer': 'adam', 'graph_mode': 'off', 'use_snp_selection': True, 'num_snps': 11571}. Best is trial 1 with value: 0.20850593502122367.
[I 2025-12-05 19:19:55,022] Trial 3 finished with value: 0.21004734724805454 and parameters: {'model_type': 'mlp', 'hidden_dims': '[512, 64]', 'dropout': 0.5938127374509361, 'batch_norm': False, 'lr': 5.67704586114731e-06, 'weight_decay': 2.4518087630137052e-05, 'epochs': 320, 'loss': 'mae', 'optimizer': 'adam', 'graph_mode': 'off', 'use_snp_selection': False}. Best is trial 3 with value: 0.21004734724805454.
[I 2025-12-05 19:21:18,077] Trial 4 finished with value: 0.17625900940477943 and parameters: {'model_type': 'mlp', 'hidden_dims': '[512, 128]', 'dropout': 0.25746343592134413, 'batch_norm': True, 'lr': 1.3467657668402788e-06, 'weight_decay': 0.00033087251918647806, 'epochs': 277, 'loss': 'mse', 'optimizer': 'adam', 'graph_mode': 'off', 'use_snp_selection': True, 'num_snps': 36675}. Best is trial 3 with value: 0.21004734724805454.
[I 2025-12-05 19:22:16,865] Trial 5 finished with value: 0.12458658386546176 and parameters: {'model_type': 'mlp', 'hidden_dims': '[512, 64]', 'dropout': 0.38275350994408375, 'batch_norm': True, 'lr': 1.5586664309232824e-06, 'weight_decay': 0.0008227664668621182, 'epochs': 145, 'loss': 'mae', 'optimizer': 'adam', 'graph_mode': 'off', 'use_snp_selection': True, 'num_snps': 32148}. Best is trial 3 with value: 0.21004734724805454.
[I 2025-12-05 19:22:49,158] Trial 6 finished with value: 0.1963980919805613 and parameters: {'model_type': 'mlp', 'hidden_dims': '[256, 128]', 'dropout': 0.3930109900265879, 'batch_norm': False, 'lr': 4.892964372128395e-05, 'weight_decay': 1.5809549317992182e-06, 'epochs': 199, 'loss': 'mse', 'optimizer': 'adam', 'graph_mode': 'off', 'use_snp_selection': False}. Best is trial 3 with value: 0.21004734724805454.
