[I 2025-12-06 00:01:36,234] Trial 121 finished with value: 0.309303490423953 and parameters: {'model_type': 'mlp', 'hidden_dims': '[512, 256]', 'dropout': 0.4495790634841414, 'batch_norm': True, 'lr': 8.411794555904162e-05, 'weight_decay': 4.249594224578796e-05, 'epochs': 170, 'loss': 'mae', 'optimizer': 'adam', 'graph_mode': 'off', 'use_snp_selection': False}. Best is trial 81 with value: 0.313795582611371.
[I 2025-12-06 00:02:07,142] Trial 122 finished with value: 0.2900892729034298 and parameters: {'model_type': 'mlp', 'hidden_dims': '[512, 256]', 'dropout': 0.4138556373109537, 'batch_norm': True, 'lr': 3.1711011022963772e-06, 'weight_decay': 2.7631186093109398e-05, 'epochs': 146, 'loss': 'mae', 'optimizer': 'adam', 'graph_mode': 'off', 'use_snp_selection': False}. Best is trial 81 with value: 0.313795582611371.
[I 2025-12-06 00:02:43,043] Trial 123 finished with value: 0.30897528108685407 and parameters: {'model_type': 'mlp', 'hidden_dims': '[512, 256]', 'dropout': 0.46205223816272256, 'batch_norm': True, 'lr': 6.105352242811314e-05, 'weight_decay': 3.5495653515373874e-05, 'epochs': 174, 'loss': 'mae', 'optimizer': 'adam', 'graph_mode': 'off', 'use_snp_selection': False}. Best is trial 81 with value: 0.313795582611371.
[I 2025-12-06 00:03:17,136] Trial 124 finished with value: 0.3100968552142877 and parameters: {'model_type': 'mlp', 'hidden_dims': '[512, 256]', 'dropout': 0.12228184803106157, 'batch_norm': True, 'lr': 0.00010174544455372523, 'weight_decay': 1.7023811489232352e-07, 'epochs': 164, 'loss': 'mae', 'optimizer': 'adam', 'graph_mode': 'off', 'use_snp_selection': False}. Best is trial 81 with value: 0.313795582611371.
[I 2025-12-06 00:03:59,006] Trial 125 finished with value: 0.309053027836867 and parameters: {'model_type': 'mlp', 'hidden_dims': '[512, 256]', 'dropout': 0.3773294457013245, 'batch_norm': True, 'lr': 0.00012417602514808865, 'weight_decay': 1.8366746841332664e-06, 'epochs': 208, 'loss': 'mae', 'optimizer': 'adam', 'graph_mode': 'off', 'use_snp_selection': False}. Best is trial 81 with value: 0.313795582611371.
[I 2025-12-06 00:04:24,455] Trial 126 finished with value: 0.3151883427078935 and parameters: {'model_type': 'mlp', 'hidden_dims': '[512, 256]', 'dropout': 0.48626052487131705, 'batch_norm': True, 'lr': 8.064074783754504e-05, 'weight_decay': 3.2017884126575275e-07, 'epochs': 115, 'loss': 'mae', 'optimizer': 'adam', 'graph_mode': 'off', 'use_snp_selection': False}. Best is trial 126 with value: 0.3151883427078935.
[I 2025-12-06 00:04:56,150] Trial 127 finished with value: 0.2985410811731769 and parameters: {'model_type': 'mlp', 'hidden_dims': '[512, 128]', 'dropout': 0.48731162396601574, 'batch_norm': True, 'lr': 6.949366199538147e-05, 'weight_decay': 3.3706328109096463e-07, 'epochs': 114, 'loss': 'mae', 'optimizer': 'adam', 'graph_mode': 'off', 'use_snp_selection': True, 'num_snps': 17932}. Best is trial 126 with value: 0.3151883427078935.
[I 2025-12-06 00:05:10,561] Trial 128 finished with value: 0.3012538795961851 and parameters: {'model_type': 'mlp', 'hidden_dims': '[256, 128, 64]', 'dropout': 0.5012152978952181, 'batch_norm': True, 'lr': 3.1707377944651886e-05, 'weight_decay': 0.00013379729872856194, 'epochs': 107, 'loss': 'mae', 'optimizer': 'adam', 'graph_mode': 'off', 'use_snp_selection': False}. Best is trial 126 with value: 0.3151883427078935.
[I 2025-12-06 00:05:31,585] Trial 129 finished with value: 0.2900921514176388 and parameters: {'model_type': 'mlp', 'hidden_dims': '[512, 256]', 'dropout': 0.4652619003681851, 'batch_norm': False, 'lr': 0.00016916192990189954, 'weight_decay': 5.551709802041334e-07, 'epochs': 91, 'loss': 'mae', 'optimizer': 'adam', 'graph_mode': 'off', 'use_snp_selection': False}. Best is trial 126 with value: 0.3151883427078935.
[I 2025-12-06 00:06:00,707] Trial 130 finished with value: 0.3047221587806764 and parameters: {'model_type': 'mlp', 'hidden_dims': '[512, 64]', 'dropout': 0.5461359947332353, 'batch_norm': True, 'lr': 0.00013236651537448048, 'weight_decay': 1.2949447255744442e-06, 'epochs': 137, 'loss': 'mae', 'optimizer': 'adam', 'graph_mode': 'off', 'use_snp_selection': False}. Best is trial 126 with value: 0.3151883427078935.
[I 2025-12-06 00:06:26,524] Trial 131 finished with value: 0.30966021811159156 and parameters: {'model_type': 'mlp', 'hidden_dims': '[512, 256]', 'dropout': 0.43854596578566407, 'batch_norm': True, 'lr': 8.71067025399383e-05, 'weight_decay': 6.757962614408039e-05, 'epochs': 117, 'loss': 'mae', 'optimizer': 'adam', 'graph_mode': 'off', 'use_snp_selection': False}. Best is trial 126 with value: 0.3151883427078935.
[I 2025-12-06 00:06:58,661] Trial 132 finished with value: 0.3100861081928063 and parameters: {'model_type': 'mlp', 'hidden_dims': '[512, 256]', 'dropout': 0.47895500437405003, 'batch_norm': True, 'lr': 5.4580557748047775e-05, 'weight_decay': 2.2222046103310365e-07, 'epochs': 153, 'loss': 'mae', 'optimizer': 'adam', 'graph_mode': 'off', 'use_snp_selection': False}. Best is trial 126 with value: 0.3151883427078935.
[I 2025-12-06 00:07:38,906] Trial 133 finished with value: 0.3082351014913868 and parameters: {'model_type': 'mlp', 'hidden_dims': '[512, 256]', 'dropout': 0.5281420653631606, 'batch_norm': True, 'lr': 0.0001010603221944496, 'weight_decay': 2.852713064333443e-07, 'epochs': 199, 'loss': 'mae', 'optimizer': 'adam', 'graph_mode': 'off', 'use_snp_selection': False}. Best is trial 126 with value: 0.3151883427078935.
[I 2025-12-06 00:08:16,010] Trial 134 finished with value: 0.3084483607801686 and parameters: {'model_type': 'mlp', 'hidden_dims': '[512, 256]', 'dropout': 0.5051290297582034, 'batch_norm': True, 'lr': 8.151752221863591e-05, 'weight_decay': 1.5181935997773187e-07, 'epochs': 181, 'loss': 'mae', 'optimizer': 'adam', 'graph_mode': 'off', 'use_snp_selection': False}. Best is trial 126 with value: 0.3151883427078935.
[I 2025-12-06 00:08:40,072] Trial 135 finished with value: 0.3096089752815371 and parameters: {'model_type': 'mlp', 'hidden_dims': '[512, 256]', 'dropout': 0.4299464022201403, 'batch_norm': True, 'lr': 4.5067570955737015e-05, 'weight_decay': 1.9514378669457097e-07, 'epochs': 107, 'loss': 'mae', 'optimizer': 'adam', 'graph_mode': 'off', 'use_snp_selection': False}. Best is trial 126 with value: 0.3151883427078935.
[I 2025-12-06 00:09:07,987] Trial 136 finished with value: 0.3077781405564125 and parameters: {'model_type': 'mlp', 'hidden_dims': '[512, 256]', 'dropout': 0.4517854319317192, 'batch_norm': True, 'lr': 6.673100204683966e-05, 'weight_decay': 1.529450033517254e-05, 'epochs': 129, 'loss': 'mae', 'optimizer': 'adam', 'graph_mode': 'off', 'use_snp_selection': False}. Best is trial 126 with value: 0.3151883427078935.
[I 2025-12-06 00:09:49,354] Trial 137 finished with value: 0.298314655863695 and parameters: {'model_type': 'mlp', 'hidden_dims': '[512, 256]', 'dropout': 0.4433535428674566, 'batch_norm': True, 'lr': 3.755076324150054e-05, 'weight_decay': 2.3777042125168807e-05, 'epochs': 189, 'loss': 'mse', 'optimizer': 'adam', 'graph_mode': 'off', 'use_snp_selection': True, 'num_snps': 25166}. Best is trial 126 with value: 0.3151883427078935.
[I 2025-12-06 00:10:26,834] Trial 138 finished with value: 0.30824115742860253 and parameters: {'model_type': 'mlp', 'hidden_dims': '[512, 256]', 'dropout': 0.4875432506439974, 'batch_norm': True, 'lr': 0.00011372313790989408, 'weight_decay': 4.3626902002602537e-07, 'epochs': 184, 'loss': 'mae', 'optimizer': 'adam', 'graph_mode': 'off', 'use_snp_selection': False}. Best is trial 126 with value: 0.3151883427078935.
[I 2025-12-06 00:11:02,087] Trial 139 finished with value: 0.3106728446927419 and parameters: {'model_type': 'mlp', 'hidden_dims': '[512, 256]', 'dropout': 0.38877300512893326, 'batch_norm': True, 'lr': 0.0001374641647614681, 'weight_decay': 1.9324691764723585e-07, 'epochs': 171, 'loss': 'mae', 'optimizer': 'adam', 'graph_mode': 'off', 'use_snp_selection': False}. Best is trial 126 with value: 0.3151883427078935.
[I 2025-12-06 00:11:40,817] Trial 140 finished with value: 0.30205908362017947 and parameters: {'model_type': 'mlp', 'hidden_dims': '[512, 64]', 'dropout': 0.46192610320070726, 'batch_norm': False, 'lr': 7.50081926172382e-05, 'weight_decay': 1.3985572436846614e-07, 'epochs': 194, 'loss': 'mae', 'optimizer': 'adam', 'graph_mode': 'off', 'use_snp_selection': False}. Best is trial 126 with value: 0.3151883427078935.
[I 2025-12-06 00:12:17,461] Trial 141 finished with value: 0.313766216785813 and parameters: {'model_type': 'mlp', 'hidden_dims': '[512, 256]', 'dropout': 0.405990709780717, 'batch_norm': True, 'lr': 9.466080096962425e-05, 'weight_decay': 1.8288552396989206e-07, 'epochs': 178, 'loss': 'mae', 'optimizer': 'adam', 'graph_mode': 'off', 'use_snp_selection': False}. Best is trial 126 with value: 0.3151883427078935.
[I 2025-12-06 00:12:54,304] Trial 142 finished with value: 0.31240983627155394 and parameters: {'model_type': 'mlp', 'hidden_dims': '[512, 256]', 'dropout': 0.42299055420810605, 'batch_norm': True, 'lr': 0.00010024565384677887, 'weight_decay': 2.9847618565110034e-07, 'epochs': 179, 'loss': 'mae', 'optimizer': 'adam', 'graph_mode': 'off', 'use_snp_selection': False}. Best is trial 126 with value: 0.3151883427078935.
[I 2025-12-06 00:13:35,492] Trial 143 finished with value: 0.30870193521712475 and parameters: {'model_type': 'mlp', 'hidden_dims': '[512, 256]', 'dropout': 0.36656464866914634, 'batch_norm': True, 'lr': 9.922097091901264e-05, 'weight_decay': 2.8690340819840903e-07, 'epochs': 204, 'loss': 'mae', 'optimizer': 'adam', 'graph_mode': 'off', 'use_snp_selection': False}. Best is trial 126 with value: 0.3151883427078935.
[I 2025-12-06 00:14:28,501] Trial 144 finished with value: 0.30935953090272916 and parameters: {'model_type': 'mlp', 'hidden_dims': '[512, 256]', 'dropout': 0.40789863073049837, 'batch_norm': True, 'lr': 0.0001172237117124876, 'weight_decay': 3.5844095219947746e-07, 'epochs': 270, 'loss': 'mae', 'optimizer': 'adam', 'graph_mode': 'off', 'use_snp_selection': False}. Best is trial 126 with value: 0.3151883427078935.
[I 2025-12-06 00:15:34,262] Trial 145 finished with value: 0.30947568576867956 and parameters: {'model_type': 'mlp', 'hidden_dims': '[512, 256]', 'dropout': 0.399261485137286, 'batch_norm': True, 'lr': 5.719358970522373e-05, 'weight_decay': 2.3110971747249739e-07, 'epochs': 343, 'loss': 'mae', 'optimizer': 'adam', 'graph_mode': 'off', 'use_snp_selection': False}. Best is trial 126 with value: 0.3151883427078935.
[I 2025-12-06 00:16:25,095] Trial 146 finished with value: 0.3086768464191669 and parameters: {'model_type': 'mlp', 'hidden_dims': '[512, 256]', 'dropout': 0.41902884276993546, 'batch_norm': True, 'lr': 0.00015428368266281168, 'weight_decay': 2.083076640588226e-05, 'epochs': 178, 'loss': 'mae', 'optimizer': 'adam', 'graph_mode': 'off', 'use_snp_selection': True, 'num_snps': 37921}. Best is trial 126 with value: 0.3151883427078935.
[I 2025-12-06 00:16:44,906] Trial 147 finished with value: 0.3031331748912168 and parameters: {'model_type': 'mlp', 'hidden_dims': '[256, 128]', 'dropout': 0.38583108558827617, 'batch_norm': True, 'lr': 0.00019199877259357573, 'weight_decay': 1.2141584884584698e-07, 'epochs': 165, 'loss': 'mae', 'optimizer': 'adam', 'graph_mode': 'off', 'use_snp_selection': False}. Best is trial 126 with value: 0.3151883427078935.
[I 2025-12-06 00:17:17,472] Trial 148 finished with value: 0.31354538318329545 and parameters: {'model_type': 'mlp', 'hidden_dims': '[512, 256]', 'dropout': 0.10599273991809043, 'batch_norm': True, 'lr': 9.613465560317568e-05, 'weight_decay': 2.4707743144102577e-07, 'epochs': 155, 'loss': 'mae', 'optimizer': 'adam', 'graph_mode': 'off', 'use_snp_selection': False}. Best is trial 126 with value: 0.3151883427078935.
[I 2025-12-06 00:17:48,464] Trial 149 finished with value: 0.31033804697737305 and parameters: {'model_type': 'mlp', 'hidden_dims': '[512, 256]', 'dropout': 0.12364823907552361, 'batch_norm': True, 'lr': 9.602340440156174e-05, 'weight_decay': 1.5231957501253712e-07, 'epochs': 146, 'loss': 'mae', 'optimizer': 'adam', 'graph_mode': 'off', 'use_snp_selection': False}. Best is trial 126 with value: 0.3151883427078935.
[I 2025-12-06 00:18:40,239] Trial 0 finished with value: 0.2766961728294951 and parameters: {'model_type': 'mlp', 'hidden_dims': '[128, 64]', 'dropout': 0.199031432379812, 'batch_norm': True, 'lr': 1.8408544111075837e-06, 'weight_decay': 5.5136510071208614e-05, 'epochs': 336, 'loss': 'mae', 'optimizer': 'adam', 'graph_mode': 'off', 'use_snp_selection': True, 'num_snps': 43862}. Best is trial 0 with value: 0.2766961728294951.
[I 2025-12-06 00:19:07,002] Trial 1 finished with value: 0.3070350270974586 and parameters: {'model_type': 'mlp', 'hidden_dims': '[256, 128]', 'dropout': 0.4370668075331726, 'batch_norm': True, 'lr': 7.133471581159139e-05, 'weight_decay': 1.128633586803549e-05, 'epochs': 242, 'loss': 'mae', 'optimizer': 'adam', 'graph_mode': 'off', 'use_snp_selection': False}. Best is trial 1 with value: 0.3070350270974586.
[I 2025-12-06 00:19:33,766] Trial 2 finished with value: 0.27684477015048997 and parameters: {'model_type': 'mlp', 'hidden_dims': '[256, 128, 64]', 'dropout': 0.41314357415569625, 'batch_norm': False, 'lr': 3.952233718592101e-06, 'weight_decay': 0.00026754769258252603, 'epochs': 149, 'loss': 'mse', 'optimizer': 'adam', 'graph_mode': 'off', 'use_snp_selection': True, 'num_snps': 11571}. Best is trial 1 with value: 0.3070350270974586.
[I 2025-12-06 00:20:34,371] Trial 3 finished with value: 0.30818709890370755 and parameters: {'model_type': 'mlp', 'hidden_dims': '[512, 64]', 'dropout': 0.5938127374509361, 'batch_norm': False, 'lr': 5.67704586114731e-06, 'weight_decay': 2.4518087630137052e-05, 'epochs': 320, 'loss': 'mae', 'optimizer': 'adam', 'graph_mode': 'off', 'use_snp_selection': False}. Best is trial 3 with value: 0.30818709890370755.
[I 2025-12-06 00:21:35,060] Trial 4 finished with value: 0.2872696677369263 and parameters: {'model_type': 'mlp', 'hidden_dims': '[512, 128]', 'dropout': 0.25746343592134413, 'batch_norm': True, 'lr': 1.3467657668402788e-06, 'weight_decay': 0.00033087251918647806, 'epochs': 277, 'loss': 'mse', 'optimizer': 'adam', 'graph_mode': 'off', 'use_snp_selection': True, 'num_snps': 36675}. Best is trial 3 with value: 0.30818709890370755.
[I 2025-12-06 00:22:18,264] Trial 5 finished with value: 0.2562928153708797 and parameters: {'model_type': 'mlp', 'hidden_dims': '[512, 64]', 'dropout': 0.38275350994408375, 'batch_norm': True, 'lr': 1.5586664309232824e-06, 'weight_decay': 0.0008227664668621182, 'epochs': 145, 'loss': 'mae', 'optimizer': 'adam', 'graph_mode': 'off', 'use_snp_selection': True, 'num_snps': 32148}. Best is trial 3 with value: 0.30818709890370755.
[I 2025-12-06 00:22:40,947] Trial 6 finished with value: 0.30441998851670227 and parameters: {'model_type': 'mlp', 'hidden_dims': '[256, 128]', 'dropout': 0.3930109900265879, 'batch_norm': False, 'lr': 4.892964372128395e-05, 'weight_decay': 1.5809549317992182e-06, 'epochs': 199, 'loss': 'mse', 'optimizer': 'adam', 'graph_mode': 'off', 'use_snp_selection': False}. Best is trial 3 with value: 0.30818709890370755.
[I 2025-12-06 00:23:03,264] Trial 7 finished with value: 0.30797211993030926 and parameters: {'model_type': 'mlp', 'hidden_dims': '[512, 256]', 'dropout': 0.15343979219678458, 'batch_norm': True, 'lr': 6.234003099047341e-05, 'weight_decay': 3.894760610535477e-07, 'epochs': 97, 'loss': 'mse', 'optimizer': 'adam', 'graph_mode': 'off', 'use_snp_selection': False}. Best is trial 3 with value: 0.30818709890370755.
[I 2025-12-06 00:24:03,279] Trial 8 finished with value: 0.30975846161680487 and parameters: {'model_type': 'mlp', 'hidden_dims': '[512, 128]', 'dropout': 0.10743001231661406, 'batch_norm': True, 'lr': 0.00023728538449271062, 'weight_decay': 1.7629071578048637e-05, 'epochs': 312, 'loss': 'mae', 'optimizer': 'adam', 'graph_mode': 'off', 'use_snp_selection': False}. Best is trial 8 with value: 0.30975846161680487.
[I 2025-12-06 00:24:39,173] Trial 9 finished with value: 0.30996916623939935 and parameters: {'model_type': 'mlp', 'hidden_dims': '[512, 64]', 'dropout': 0.14505336736221927, 'batch_norm': True, 'lr': 5.8619638388111826e-05, 'weight_decay': 6.200156172669308e-07, 'epochs': 175, 'loss': 'mse', 'optimizer': 'adam', 'graph_mode': 'off', 'use_snp_selection': False}. Best is trial 9 with value: 0.30996916623939935.
[I 2025-12-06 00:24:52,011] Trial 10 finished with value: 0.02994749918131754 and parameters: {'model_type': 'mlp', 'hidden_dims': '[512, 64]', 'dropout': 0.27531666245262887, 'batch_norm': False, 'lr': 0.00032393778075602147, 'weight_decay': 1.1714031539166647e-07, 'epochs': 44, 'loss': 'mse', 'optimizer': 'adam', 'graph_mode': 'off', 'use_snp_selection': False}. Best is trial 9 with value: 0.30996916623939935.
[I 2025-12-06 00:25:35,172] Trial 11 finished with value: 0.3070200897439653 and parameters: {'model_type': 'mlp', 'hidden_dims': '[512, 128]', 'dropout': 0.10095648685224448, 'batch_norm': True, 'lr': 0.0007381466848241802, 'weight_decay': 1.969664044175748e-06, 'epochs': 216, 'loss': 'mae', 'optimizer': 'adam', 'graph_mode': 'off', 'use_snp_selection': False}. Best is trial 9 with value: 0.30996916623939935.
[I 2025-12-06 00:26:29,741] Trial 12 finished with value: 0.30942777877872524 and parameters: {'model_type': 'mlp', 'hidden_dims': '[512, 128]', 'dropout': 0.10344600881777158, 'batch_norm': True, 'lr': 0.00018400807026440393, 'weight_decay': 2.652725854953085e-06, 'epochs': 281, 'loss': 'mae', 'optimizer': 'adam', 'graph_mode': 'off', 'use_snp_selection': False}. Best is trial 9 with value: 0.30996916623939935.
[I 2025-12-06 00:26:42,269] Trial 13 finished with value: 0.29298786815598193 and parameters: {'model_type': 'mlp', 'hidden_dims': '[128, 64]', 'dropout': 0.21562224788131257, 'batch_norm': True, 'lr': 1.343038855084232e-05, 'weight_decay': 5.9577988329204815e-05, 'epochs': 156, 'loss': 'mse', 'optimizer': 'adam', 'graph_mode': 'off', 'use_snp_selection': False}. Best is trial 9 with value: 0.30996916623939935.
[I 2025-12-06 00:27:11,146] Trial 14 finished with value: 0.3046619302388788 and parameters: {'model_type': 'mlp', 'hidden_dims': '[256, 128, 64]', 'dropout': 0.3012984444538551, 'batch_norm': True, 'lr': 0.00017558188744418174, 'weight_decay': 4.841366235436571e-06, 'epochs': 262, 'loss': 'mse', 'optimizer': 'adam', 'graph_mode': 'off', 'use_snp_selection': False}. Best is trial 9 with value: 0.30996916623939935.
[I 2025-12-06 00:27:35,116] Trial 15 finished with value: 0.3033906566005011 and parameters: {'model_type': 'mlp', 'hidden_dims': '[512, 256]', 'dropout': 0.1723492905468449, 'batch_norm': True, 'lr': 1.9101360081531482e-05, 'weight_decay': 4.5605747709891527e-07, 'epochs': 106, 'loss': 'mae', 'optimizer': 'adam', 'graph_mode': 'off', 'use_snp_selection': False}. Best is trial 9 with value: 0.30996916623939935.
[I 2025-12-06 00:28:41,837] Trial 16 finished with value: 0.30876900012668196 and parameters: {'model_type': 'mlp', 'hidden_dims': '[512, 128]', 'dropout': 0.558513902174278, 'batch_norm': True, 'lr': 0.0008608834321780825, 'weight_decay': 1.0765286122019607e-05, 'epochs': 350, 'loss': 'mse', 'optimizer': 'adam', 'graph_mode': 'off', 'use_snp_selection': False}. Best is trial 9 with value: 0.30996916623939935.
[I 2025-12-06 00:29:26,581] Trial 17 finished with value: 0.3057041988783578 and parameters: {'model_type': 'mlp', 'hidden_dims': '[512, 64]', 'dropout': 0.4828821377080479, 'batch_norm': True, 'lr': 0.00013980529748764629, 'weight_decay': 5.666950082267898e-07, 'epochs': 225, 'loss': 'mae', 'optimizer': 'adam', 'graph_mode': 'off', 'use_snp_selection': False}. Best is trial 9 with value: 0.30996916623939935.
[I 2025-12-06 00:30:32,112] Trial 18 finished with value: 0.30733410057100685 and parameters: {'model_type': 'mlp', 'hidden_dims': '[512, 128]', 'dropout': 0.3245776573111194, 'batch_norm': False, 'lr': 2.797772152750264e-05, 'weight_decay': 4.036647609793897e-05, 'epochs': 172, 'loss': 'mse', 'optimizer': 'adam', 'graph_mode': 'off', 'use_snp_selection': True, 'num_snps': 58241}. Best is trial 9 with value: 0.30996916623939935.
[I 2025-12-06 00:31:29,760] Trial 19 finished with value: 0.30762108052325915 and parameters: {'model_type': 'mlp', 'hidden_dims': '[512, 64]', 'dropout': 0.13867140329468503, 'batch_norm': True, 'lr': 0.0003251383087518385, 'weight_decay': 1.1354159408743119e-07, 'epochs': 299, 'loss': 'mae', 'optimizer': 'adam', 'graph_mode': 'off', 'use_snp_selection': False}. Best is trial 9 with value: 0.30996916623939935.
[I 2025-12-06 00:31:40,053] Trial 20 finished with value: 0.3124555792553836 and parameters: {'model_type': 'mlp', 'hidden_dims': '[128, 64]', 'dropout': 0.23662357927250263, 'batch_norm': True, 'lr': 0.0003732224191310746, 'weight_decay': 0.0001247981980720522, 'epochs': 113, 'loss': 'mae', 'optimizer': 'adam', 'graph_mode': 'off', 'use_snp_selection': False}. Best is trial 20 with value: 0.3124555792553836.
[I 2025-12-06 00:31:48,459] Trial 21 finished with value: 0.3055159506275679 and parameters: {'model_type': 'mlp', 'hidden_dims': '[128, 64]', 'dropout': 0.22694488300385413, 'batch_norm': True, 'lr': 0.00035217120007755573, 'weight_decay': 0.00012999262735072, 'epochs': 77, 'loss': 'mae', 'optimizer': 'adam', 'graph_mode': 'off', 'use_snp_selection': False}. Best is trial 20 with value: 0.3124555792553836.
[I 2025-12-06 00:31:59,115] Trial 22 finished with value: 0.31340379818889347 and parameters: {'model_type': 'mlp', 'hidden_dims': '[128, 64]', 'dropout': 0.16482687806697485, 'batch_norm': True, 'lr': 9.885732341529904e-05, 'weight_decay': 1.6181395737402307e-05, 'epochs': 120, 'loss': 'mae', 'optimizer': 'adam', 'graph_mode': 'off', 'use_snp_selection': False}. Best is trial 22 with value: 0.31340379818889347.
