[I 2025-12-05 22:49:09,328] Trial 6 finished with value: 0.3530300144411668 and parameters: {'model_type': 'mlp', 'hidden_dims': '[256, 128]', 'dropout': 0.3930109900265879, 'batch_norm': False, 'lr': 4.892964372128395e-05, 'weight_decay': 1.5809549317992182e-06, 'epochs': 199, 'loss': 'mse', 'optimizer': 'adam', 'graph_mode': 'off', 'use_snp_selection': False}. Best is trial 3 with value: 0.3666395364661136.
[I 2025-12-05 22:49:33,364] Trial 7 finished with value: 0.35125792469394035 and parameters: {'model_type': 'mlp', 'hidden_dims': '[512, 256]', 'dropout': 0.15343979219678458, 'batch_norm': True, 'lr': 6.234003099047341e-05, 'weight_decay': 3.894760610535477e-07, 'epochs': 97, 'loss': 'mse', 'optimizer': 'adam', 'graph_mode': 'off', 'use_snp_selection': False}. Best is trial 3 with value: 0.3666395364661136.
[I 2025-12-05 22:50:38,875] Trial 8 finished with value: 0.3467047683031862 and parameters: {'model_type': 'mlp', 'hidden_dims': '[512, 128]', 'dropout': 0.10743001231661406, 'batch_norm': True, 'lr': 0.00023728538449271062, 'weight_decay': 1.7629071578048637e-05, 'epochs': 312, 'loss': 'mae', 'optimizer': 'adam', 'graph_mode': 'off', 'use_snp_selection': False}. Best is trial 3 with value: 0.3666395364661136.
[I 2025-12-05 22:51:17,950] Trial 9 finished with value: 0.3461323127021775 and parameters: {'model_type': 'mlp', 'hidden_dims': '[512, 64]', 'dropout': 0.14505336736221927, 'batch_norm': True, 'lr': 5.8619638388111826e-05, 'weight_decay': 6.200156172669308e-07, 'epochs': 175, 'loss': 'mse', 'optimizer': 'adam', 'graph_mode': 'off', 'use_snp_selection': False}. Best is trial 3 with value: 0.3666395364661136.
[I 2025-12-05 22:51:33,083] Trial 10 finished with value: 0.3399509435259634 and parameters: {'model_type': 'mlp', 'hidden_dims': '[512, 64]', 'dropout': 0.5885461262002587, 'batch_norm': False, 'lr': 8.769366258768696e-06, 'weight_decay': 2.78273193871783e-06, 'epochs': 55, 'loss': 'mae', 'optimizer': 'adam', 'graph_mode': 'off', 'use_snp_selection': False}. Best is trial 3 with value: 0.3666395364661136.
[I 2025-12-05 22:52:00,125] Trial 11 finished with value: 0.3620190252103342 and parameters: {'model_type': 'mlp', 'hidden_dims': '[256, 128]', 'dropout': 0.583942291816117, 'batch_norm': False, 'lr': 1.422933652790185e-05, 'weight_decay': 2.805519019095577e-06, 'epochs': 231, 'loss': 'mse', 'optimizer': 'adam', 'graph_mode': 'off', 'use_snp_selection': False}. Best is trial 3 with value: 0.3666395364661136.
[I 2025-12-05 22:52:27,352] Trial 12 finished with value: 0.3650812168536655 and parameters: {'model_type': 'mlp', 'hidden_dims': '[256, 128]', 'dropout': 0.593097749012682, 'batch_norm': False, 'lr': 1.1374686318732863e-05, 'weight_decay': 1.3081036432574914e-07, 'epochs': 233, 'loss': 'mae', 'optimizer': 'adam', 'graph_mode': 'off', 'use_snp_selection': False}. Best is trial 3 with value: 0.3666395364661136.
[I 2025-12-05 22:52:46,924] Trial 13 finished with value: 0.3627723500436182 and parameters: {'model_type': 'mlp', 'hidden_dims': '[128, 64]', 'dropout': 0.5043641748401543, 'batch_norm': False, 'lr': 1.262035332095525e-05, 'weight_decay': 1.0885943577911259e-07, 'epochs': 285, 'loss': 'mae', 'optimizer': 'adam', 'graph_mode': 'off', 'use_snp_selection': False}. Best is trial 3 with value: 0.3666395364661136.
[I 2025-12-05 22:53:57,903] Trial 14 finished with value: 0.37025903480109457 and parameters: {'model_type': 'mlp', 'hidden_dims': '[512, 256]', 'dropout': 0.5300180653494536, 'batch_norm': False, 'lr': 5.096356034191146e-06, 'weight_decay': 4.7581885634242365e-05, 'epochs': 345, 'loss': 'mae', 'optimizer': 'adam', 'graph_mode': 'off', 'use_snp_selection': False}. Best is trial 14 with value: 0.37025903480109457.
[I 2025-12-05 22:55:06,126] Trial 15 finished with value: 0.37177029239483217 and parameters: {'model_type': 'mlp', 'hidden_dims': '[512, 256]', 'dropout': 0.50071393962227, 'batch_norm': False, 'lr': 3.521500355955208e-06, 'weight_decay': 5.343087596659364e-05, 'epochs': 330, 'loss': 'mae', 'optimizer': 'adam', 'graph_mode': 'off', 'use_snp_selection': False}. Best is trial 15 with value: 0.37177029239483217.
[I 2025-12-05 22:56:18,131] Trial 16 finished with value: 0.3707420787544023 and parameters: {'model_type': 'mlp', 'hidden_dims': '[512, 256]', 'dropout': 0.5002984888112975, 'batch_norm': False, 'lr': 2.776964597283163e-06, 'weight_decay': 0.00010327647972979406, 'epochs': 350, 'loss': 'mae', 'optimizer': 'adam', 'graph_mode': 'off', 'use_snp_selection': False}. Best is trial 15 with value: 0.37177029239483217.
[I 2025-12-05 22:57:16,125] Trial 17 finished with value: 0.27821636788205434 and parameters: {'model_type': 'mlp', 'hidden_dims': '[512, 256]', 'dropout': 0.31226206234945486, 'batch_norm': False, 'lr': 0.000906375209920231, 'weight_decay': 0.00011963152281611286, 'epochs': 287, 'loss': 'mae', 'optimizer': 'adam', 'graph_mode': 'off', 'use_snp_selection': False}. Best is trial 15 with value: 0.37177029239483217.
[I 2025-12-05 22:58:42,736] Trial 18 finished with value: 0.35587147459140134 and parameters: {'model_type': 'mlp', 'hidden_dims': '[512, 256]', 'dropout': 0.46953439188759805, 'batch_norm': False, 'lr': 2.20854053649772e-05, 'weight_decay': 0.00012013537845192107, 'epochs': 267, 'loss': 'mae', 'optimizer': 'adam', 'graph_mode': 'off', 'use_snp_selection': True, 'num_snps': 58241}. Best is trial 15 with value: 0.37177029239483217.
[I 2025-12-05 22:59:47,826] Trial 19 finished with value: 0.3663782034760664 and parameters: {'model_type': 'mlp', 'hidden_dims': '[512, 256]', 'dropout': 0.3227351640289775, 'batch_norm': False, 'lr': 2.7960991179492955e-06, 'weight_decay': 4.5755775204291734e-06, 'epochs': 312, 'loss': 'mae', 'optimizer': 'adam', 'graph_mode': 'off', 'use_snp_selection': False}. Best is trial 15 with value: 0.37177029239483217.
[I 2025-12-05 23:00:26,597] Trial 20 finished with value: 0.3148982670326572 and parameters: {'model_type': 'mlp', 'hidden_dims': '[256, 128, 64]', 'dropout': 0.5197256087787444, 'batch_norm': False, 'lr': 1.0181100442776892e-06, 'weight_decay': 4.679666515308887e-05, 'epochs': 343, 'loss': 'mae', 'optimizer': 'adam', 'graph_mode': 'off', 'use_snp_selection': False}. Best is trial 15 with value: 0.37177029239483217.
[I 2025-12-05 23:01:38,002] Trial 21 finished with value: 0.3695173412924334 and parameters: {'model_type': 'mlp', 'hidden_dims': '[512, 256]', 'dropout': 0.5219093397919055, 'batch_norm': False, 'lr': 4.856756135144904e-06, 'weight_decay': 5.716499215855274e-05, 'epochs': 347, 'loss': 'mae', 'optimizer': 'adam', 'graph_mode': 'off', 'use_snp_selection': False}. Best is trial 15 with value: 0.37177029239483217.
[I 2025-12-05 23:02:41,754] Trial 22 finished with value: 0.37005306883558226 and parameters: {'model_type': 'mlp', 'hidden_dims': '[512, 256]', 'dropout': 0.47032720242434684, 'batch_norm': False, 'lr': 2.4450017863320553e-06, 'weight_decay': 0.00020010239024445873, 'epochs': 307, 'loss': 'mae', 'optimizer': 'adam', 'graph_mode': 'off', 'use_snp_selection': False}. Best is trial 15 with value: 0.37177029239483217.
[I 2025-12-05 23:03:52,823] Trial 23 finished with value: 0.3672062749336579 and parameters: {'model_type': 'mlp', 'hidden_dims': '[512, 256]', 'dropout': 0.5345106944023057, 'batch_norm': False, 'lr': 6.450565094745109e-06, 'weight_decay': 1.9372660565137718e-05, 'epochs': 346, 'loss': 'mae', 'optimizer': 'adam', 'graph_mode': 'off', 'use_snp_selection': False}. Best is trial 15 with value: 0.37177029239483217.
[I 2025-12-05 23:04:47,509] Trial 24 finished with value: 0.37077432928583126 and parameters: {'model_type': 'mlp', 'hidden_dims': '[512, 256]', 'dropout': 0.4633744728716872, 'batch_norm': False, 'lr': 3.5199199338246596e-06, 'weight_decay': 7.155673581155691e-06, 'epochs': 260, 'loss': 'mae', 'optimizer': 'adam', 'graph_mode': 'off', 'use_snp_selection': False}. Best is trial 15 with value: 0.37177029239483217.
[I 2025-12-05 23:05:40,812] Trial 25 finished with value: 0.358302361341419 and parameters: {'model_type': 'mlp', 'hidden_dims': '[512, 256]', 'dropout': 0.45817711368911246, 'batch_norm': False, 'lr': 2.770566637124262e-05, 'weight_decay': 5.80410559966708e-06, 'epochs': 258, 'loss': 'mae', 'optimizer': 'adam', 'graph_mode': 'off', 'use_snp_selection': False}. Best is trial 15 with value: 0.37177029239483217.
[I 2025-12-05 23:06:06,202] Trial 26 finished with value: 0.33644578851094475 and parameters: {'model_type': 'mlp', 'hidden_dims': '[512, 256]', 'dropout': 0.36267039275416, 'batch_norm': False, 'lr': 3.2837821950232406e-06, 'weight_decay': 0.0009902889440223655, 'epochs': 206, 'loss': 'mae', 'optimizer': 'adam', 'graph_mode': 'off', 'use_snp_selection': True, 'num_snps': 3842}. Best is trial 15 with value: 0.37177029239483217.
[I 2025-12-05 23:07:07,316] Trial 27 finished with value: 0.3766637376909523 and parameters: {'model_type': 'mlp', 'hidden_dims': '[512, 256]', 'dropout': 0.42905010664826976, 'batch_norm': False, 'lr': 2.5440042953741185e-06, 'weight_decay': 7.107956328741523e-06, 'epochs': 296, 'loss': 'mae', 'optimizer': 'adam', 'graph_mode': 'off', 'use_snp_selection': False}. Best is trial 27 with value: 0.3766637376909523.
[I 2025-12-05 23:07:27,522] Trial 28 finished with value: 0.3268697767485387 and parameters: {'model_type': 'mlp', 'hidden_dims': '[128, 64]', 'dropout': 0.4286946233457872, 'batch_norm': False, 'lr': 1.0216906640802338e-06, 'weight_decay': 8.598867010891639e-06, 'epochs': 293, 'loss': 'mae', 'optimizer': 'adam', 'graph_mode': 'off', 'use_snp_selection': False}. Best is trial 27 with value: 0.3766637376909523.
[I 2025-12-05 23:08:09,824] Trial 29 finished with value: 0.370613189697995 and parameters: {'model_type': 'mlp', 'hidden_dims': '[512, 128]', 'dropout': 0.32709041664145455, 'batch_norm': False, 'lr': 2.2215103419584537e-06, 'weight_decay': 1.3339775495802424e-06, 'epochs': 261, 'loss': 'mae', 'optimizer': 'adam', 'graph_mode': 'off', 'use_snp_selection': True, 'num_snps': 19468}. Best is trial 27 with value: 0.3766637376909523.
[I 2025-12-05 23:08:45,239] Trial 30 finished with value: 0.3250494163611684 and parameters: {'model_type': 'mlp', 'hidden_dims': '[256, 128, 64]', 'dropout': 0.2523135802350327, 'batch_norm': False, 'lr': 0.00016079539925233002, 'weight_decay': 2.9479760487069653e-05, 'epochs': 322, 'loss': 'mae', 'optimizer': 'adam', 'graph_mode': 'off', 'use_snp_selection': False}. Best is trial 27 with value: 0.3766637376909523.
[I 2025-12-05 23:09:53,302] Trial 31 finished with value: 0.3729087170691849 and parameters: {'model_type': 'mlp', 'hidden_dims': '[512, 256]', 'dropout': 0.48607264616480245, 'batch_norm': False, 'lr': 1.8563013074468257e-06, 'weight_decay': 8.234440658725151e-05, 'epochs': 329, 'loss': 'mae', 'optimizer': 'adam', 'graph_mode': 'off', 'use_snp_selection': False}. Best is trial 27 with value: 0.3766637376909523.
[I 2025-12-05 23:10:55,968] Trial 32 finished with value: 0.3703401815807207 and parameters: {'model_type': 'mlp', 'hidden_dims': '[512, 256]', 'dropout': 0.45699442142349483, 'batch_norm': False, 'lr': 1.6473323393495745e-06, 'weight_decay': 1.1890047871149696e-05, 'epochs': 298, 'loss': 'mae', 'optimizer': 'adam', 'graph_mode': 'off', 'use_snp_selection': False}. Best is trial 27 with value: 0.3766637376909523.
[I 2025-12-05 23:12:03,256] Trial 33 finished with value: 0.37485780034244176 and parameters: {'model_type': 'mlp', 'hidden_dims': '[512, 256]', 'dropout': 0.5552775859906254, 'batch_norm': False, 'lr': 3.783037055262871e-06, 'weight_decay': 8.13632447386895e-06, 'epochs': 325, 'loss': 'mae', 'optimizer': 'adam', 'graph_mode': 'off', 'use_snp_selection': False}. Best is trial 27 with value: 0.3766637376909523.
[I 2025-12-05 23:12:25,518] Trial 34 finished with value: 0.36528064812268984 and parameters: {'model_type': 'mlp', 'hidden_dims': '[128, 64]', 'dropout': 0.545514460990332, 'batch_norm': False, 'lr': 7.839705079653209e-06, 'weight_decay': 1.1841613454426528e-05, 'epochs': 330, 'loss': 'mae', 'optimizer': 'adam', 'graph_mode': 'off', 'use_snp_selection': False}. Best is trial 27 with value: 0.3766637376909523.
[I 2025-12-05 23:13:33,512] Trial 35 finished with value: 0.315880145872607 and parameters: {'model_type': 'mlp', 'hidden_dims': '[512, 256]', 'dropout': 0.412923672052933, 'batch_norm': True, 'lr': 1.7623516780622856e-06, 'weight_decay': 3.225963370429578e-05, 'epochs': 326, 'loss': 'mae', 'optimizer': 'adam', 'graph_mode': 'off', 'use_snp_selection': False}. Best is trial 27 with value: 0.3766637376909523.
[I 2025-12-05 23:15:04,912] Trial 36 finished with value: 0.34266275569727994 and parameters: {'model_type': 'mlp', 'hidden_dims': '[512, 256]', 'dropout': 0.5584988322266436, 'batch_norm': False, 'lr': 1.912351856310804e-05, 'weight_decay': 0.000516216105979363, 'epochs': 302, 'loss': 'mse', 'optimizer': 'adam', 'graph_mode': 'off', 'use_snp_selection': True, 'num_snps': 58661}. Best is trial 27 with value: 0.3766637376909523.
[I 2025-12-05 23:15:41,467] Trial 37 finished with value: 0.36658774997261795 and parameters: {'model_type': 'mlp', 'hidden_dims': '[256, 128, 64]', 'dropout': 0.48340012140036026, 'batch_norm': False, 'lr': 4.1506555413168245e-06, 'weight_decay': 9.096918760018813e-05, 'epochs': 324, 'loss': 'mae', 'optimizer': 'adam', 'graph_mode': 'off', 'use_snp_selection': False}. Best is trial 27 with value: 0.3766637376909523.
[I 2025-12-05 23:16:21,830] Trial 38 finished with value: 0.32355603688504686 and parameters: {'model_type': 'mlp', 'hidden_dims': '[512, 256]', 'dropout': 0.5611379152044715, 'batch_norm': True, 'lr': 1.450734558400108e-06, 'weight_decay': 3.7046132794282227e-06, 'epochs': 216, 'loss': 'mse', 'optimizer': 'adam', 'graph_mode': 'off', 'use_snp_selection': True, 'num_snps': 19911}. Best is trial 27 with value: 0.3766637376909523.
[I 2025-12-05 23:17:19,683] Trial 39 finished with value: 0.3670526693906139 and parameters: {'model_type': 'mlp', 'hidden_dims': '[512, 128]', 'dropout': 0.4294024172533546, 'batch_norm': False, 'lr': 6.87454453352615e-06, 'weight_decay': 1.4787276849767253e-06, 'epochs': 279, 'loss': 'mae', 'optimizer': 'adam', 'graph_mode': 'off', 'use_snp_selection': False}. Best is trial 27 with value: 0.3766637376909523.
[I 2025-12-05 23:17:42,303] Trial 40 finished with value: 0.3192787167253246 and parameters: {'model_type': 'mlp', 'hidden_dims': '[256, 128]', 'dropout': 0.4033100446246485, 'batch_norm': True, 'lr': 2.0372444052595205e-06, 'weight_decay': 0.00021940924617098385, 'epochs': 183, 'loss': 'mae', 'optimizer': 'adam', 'graph_mode': 'off', 'use_snp_selection': False}. Best is trial 27 with value: 0.3766637376909523.
[I 2025-12-05 23:18:39,057] Trial 41 finished with value: 0.3723494616192037 and parameters: {'model_type': 'mlp', 'hidden_dims': '[512, 256]', 'dropout': 0.49918424070810424, 'batch_norm': False, 'lr': 3.7381136661654735e-06, 'weight_decay': 7.267252037125371e-06, 'epochs': 271, 'loss': 'mae', 'optimizer': 'adam', 'graph_mode': 'off', 'use_snp_selection': False}. Best is trial 27 with value: 0.3766637376909523.
[I 2025-12-05 23:19:30,995] Trial 42 finished with value: 0.3730283655739507 and parameters: {'model_type': 'mlp', 'hidden_dims': '[512, 256]', 'dropout': 0.4923868651335492, 'batch_norm': False, 'lr': 3.6961199443233692e-06, 'weight_decay': 1.5945871996818408e-05, 'epochs': 246, 'loss': 'mae', 'optimizer': 'adam', 'graph_mode': 'off', 'use_snp_selection': False}. Best is trial 27 with value: 0.3766637376909523.
[I 2025-12-05 23:20:22,349] Trial 43 finished with value: 0.3638798682204053 and parameters: {'model_type': 'mlp', 'hidden_dims': '[512, 64]', 'dropout': 0.43481921585938416, 'batch_norm': False, 'lr': 9.520043600925596e-06, 'weight_decay': 1.4247604131071272e-05, 'epochs': 245, 'loss': 'mae', 'optimizer': 'adam', 'graph_mode': 'off', 'use_snp_selection': False}. Best is trial 27 with value: 0.3766637376909523.
[I 2025-12-05 23:21:20,719] Trial 44 finished with value: 0.3504682801502298 and parameters: {'model_type': 'mlp', 'hidden_dims': '[512, 256]', 'dropout': 0.3747762117911848, 'batch_norm': False, 'lr': 5.0323089606700975e-06, 'weight_decay': 2.1260818022940815e-06, 'epochs': 276, 'loss': 'mse', 'optimizer': 'adam', 'graph_mode': 'off', 'use_snp_selection': False}. Best is trial 27 with value: 0.3766637376909523.
[I 2025-12-05 23:22:13,141] Trial 45 finished with value: 0.3564927502980745 and parameters: {'model_type': 'mlp', 'hidden_dims': '[512, 256]', 'dropout': 0.5557392168057707, 'batch_norm': False, 'lr': 1.1763515724345547e-06, 'weight_decay': 8.920296228998301e-07, 'epochs': 244, 'loss': 'mae', 'optimizer': 'adam', 'graph_mode': 'off', 'use_snp_selection': False}. Best is trial 27 with value: 0.3766637376909523.
[I 2025-12-05 23:23:01,797] Trial 46 finished with value: 0.35435954845133233 and parameters: {'model_type': 'mlp', 'hidden_dims': '[512, 256]', 'dropout': 0.48421340710541877, 'batch_norm': True, 'lr': 4.2725853327460845e-05, 'weight_decay': 5.760121200146109e-06, 'epochs': 224, 'loss': 'mae', 'optimizer': 'adam', 'graph_mode': 'off', 'use_snp_selection': False}. Best is trial 27 with value: 0.3766637376909523.
[I 2025-12-05 23:23:33,018] Trial 47 finished with value: 0.3514983105715531 and parameters: {'model_type': 'mlp', 'hidden_dims': '[512, 64]', 'dropout': 0.571201081320898, 'batch_norm': False, 'lr': 2.4296992663938177e-06, 'weight_decay': 2.5287187374226348e-05, 'epochs': 139, 'loss': 'mae', 'optimizer': 'adam', 'graph_mode': 'off', 'use_snp_selection': False}. Best is trial 27 with value: 0.3766637376909523.
[I 2025-12-05 23:24:37,367] Trial 48 finished with value: 0.3765158282923319 and parameters: {'model_type': 'mlp', 'hidden_dims': '[512, 128]', 'dropout': 0.5010044964235376, 'batch_norm': False, 'lr': 1.5235465443190415e-06, 'weight_decay': 9.190856860819211e-06, 'epochs': 312, 'loss': 'mse', 'optimizer': 'adam', 'graph_mode': 'off', 'use_snp_selection': False}. Best is trial 27 with value: 0.3766637376909523.
[I 2025-12-05 23:25:57,274] Trial 49 finished with value: 0.3728660352729416 and parameters: {'model_type': 'mlp', 'hidden_dims': '[512, 128]', 'dropout': 0.44363164041733544, 'batch_norm': False, 'lr': 1.5428311325810707e-06, 'weight_decay': 1.6629823438767174e-05, 'epochs': 313, 'loss': 'mse', 'optimizer': 'adam', 'graph_mode': 'off', 'use_snp_selection': True, 'num_snps': 46888}. Best is trial 27 with value: 0.3766637376909523.
[I 2025-12-05 23:26:57,580] Trial 50 finished with value: 0.33802395304426625 and parameters: {'model_type': 'mlp', 'hidden_dims': '[512, 128]', 'dropout': 0.5985147620210552, 'batch_norm': False, 'lr': 0.00014090397297691331, 'weight_decay': 4.205424365943825e-06, 'epochs': 296, 'loss': 'mse', 'optimizer': 'adam', 'graph_mode': 'off', 'use_snp_selection': False}. Best is trial 27 with value: 0.3766637376909523.
[I 2025-12-05 23:28:18,456] Trial 51 finished with value: 0.3724393113311513 and parameters: {'model_type': 'mlp', 'hidden_dims': '[512, 128]', 'dropout': 0.45034174040979513, 'batch_norm': False, 'lr': 1.3894711791653296e-06, 'weight_decay': 1.5495368269984474e-05, 'epochs': 313, 'loss': 'mse', 'optimizer': 'adam', 'graph_mode': 'off', 'use_snp_selection': True, 'num_snps': 46667}. Best is trial 27 with value: 0.3766637376909523.
[I 2025-12-05 23:29:38,782] Trial 52 finished with value: 0.371601926024519 and parameters: {'model_type': 'mlp', 'hidden_dims': '[512, 128]', 'dropout': 0.5094035621611347, 'batch_norm': False, 'lr': 1.7114268735189854e-06, 'weight_decay': 9.997327729943889e-06, 'epochs': 314, 'loss': 'mse', 'optimizer': 'adam', 'graph_mode': 'off', 'use_snp_selection': True, 'num_snps': 47159}. Best is trial 27 with value: 0.3766637376909523.
[I 2025-12-05 23:30:32,010] Trial 53 finished with value: 0.36918025467606286 and parameters: {'model_type': 'mlp', 'hidden_dims': '[512, 128]', 'dropout': 0.48449498653608497, 'batch_norm': False, 'lr': 2.178132692880892e-06, 'weight_decay': 4.104406026352148e-05, 'epochs': 333, 'loss': 'mse', 'optimizer': 'adam', 'graph_mode': 'off', 'use_snp_selection': True, 'num_snps': 24375}. Best is trial 27 with value: 0.3766637376909523.
[I 2025-12-05 23:31:42,645] Trial 54 finished with value: 0.3709005966845745 and parameters: {'model_type': 'mlp', 'hidden_dims': '[512, 128]', 'dropout': 0.39217471546063964, 'batch_norm': False, 'lr': 1.3044382096105674e-06, 'weight_decay': 2.0745194873371934e-05, 'epochs': 305, 'loss': 'mse', 'optimizer': 'adam', 'graph_mode': 'off', 'use_snp_selection': True, 'num_snps': 39539}. Best is trial 27 with value: 0.3766637376909523.
[I 2025-12-05 23:33:05,407] Trial 55 finished with value: 0.3769868518917667 and parameters: {'model_type': 'mlp', 'hidden_dims': '[512, 128]', 'dropout': 0.5350156629558772, 'batch_norm': False, 'lr': 1.8833080882083461e-06, 'weight_decay': 3.165903291246989e-06, 'epochs': 285, 'loss': 'mse', 'optimizer': 'adam', 'graph_mode': 'off', 'use_snp_selection': True, 'num_snps': 53316}. Best is trial 55 with value: 0.3769868518917667.
[I 2025-12-05 23:33:37,619] Trial 56 finished with value: 0.3732362737674664 and parameters: {'model_type': 'mlp', 'hidden_dims': '[256, 128]', 'dropout': 0.5700130472152163, 'batch_norm': False, 'lr': 2.675048899371382e-06, 'weight_decay': 2.457347211367554e-06, 'epochs': 282, 'loss': 'mse', 'optimizer': 'adam', 'graph_mode': 'off', 'use_snp_selection': False}. Best is trial 55 with value: 0.3769868518917667.
[I 2025-12-05 23:34:10,237] Trial 57 finished with value: 0.33258659173962424 and parameters: {'model_type': 'mlp', 'hidden_dims': '[256, 128]', 'dropout': 0.5784221632449814, 'batch_norm': True, 'lr': 2.9966569192131285e-06, 'weight_decay': 2.22792357238797e-06, 'epochs': 282, 'loss': 'mse', 'optimizer': 'adam', 'graph_mode': 'off', 'use_snp_selection': False}. Best is trial 55 with value: 0.3769868518917667.
