[I 2025-12-05 22:24:03,047] Trial 115 finished with value: 0.3061883551803376 and parameters: {'model_type': 'mlp', 'hidden_dims': '[256, 128, 64]', 'dropout': 0.400318873748331, 'batch_norm': False, 'lr': 6.7025437687508966e-06, 'weight_decay': 2.3010493851943855e-05, 'epochs': 188, 'loss': 'mse', 'optimizer': 'adam', 'graph_mode': 'off', 'use_snp_selection': False}. Best is trial 33 with value: 0.3133915102850672.
[I 2025-12-05 22:24:32,508] Trial 116 finished with value: 0.3079756918850143 and parameters: {'model_type': 'mlp', 'hidden_dims': '[512, 128]', 'dropout': 0.43838766971379733, 'batch_norm': False, 'lr': 1.2681051591446975e-05, 'weight_decay': 0.0007404487073072307, 'epochs': 140, 'loss': 'mse', 'optimizer': 'adam', 'graph_mode': 'off', 'use_snp_selection': False}. Best is trial 33 with value: 0.3133915102850672.
[I 2025-12-05 22:24:57,613] Trial 117 finished with value: 0.30589055257153636 and parameters: {'model_type': 'mlp', 'hidden_dims': '[512, 256]', 'dropout': 0.46758685634046643, 'batch_norm': False, 'lr': 4.0925341507479985e-06, 'weight_decay': 2.4094907402769068e-06, 'epochs': 114, 'loss': 'mse', 'optimizer': 'adam', 'graph_mode': 'off', 'use_snp_selection': False}. Best is trial 33 with value: 0.3133915102850672.
[I 2025-12-05 22:25:33,865] Trial 118 finished with value: 0.29429262099245684 and parameters: {'model_type': 'mlp', 'hidden_dims': '[512, 128]', 'dropout': 0.5085434721434742, 'batch_norm': True, 'lr': 2.978180605979622e-06, 'weight_decay': 6.275061845886876e-05, 'epochs': 177, 'loss': 'mse', 'optimizer': 'adam', 'graph_mode': 'off', 'use_snp_selection': False}. Best is trial 33 with value: 0.3133915102850672.
[I 2025-12-05 22:25:56,637] Trial 119 finished with value: 0.27756527760033906 and parameters: {'model_type': 'mlp', 'hidden_dims': '[512, 128]', 'dropout': 0.49467852924092487, 'batch_norm': False, 'lr': 2.0105545797981472e-06, 'weight_decay': 2.9512579275843214e-07, 'epochs': 101, 'loss': 'mse', 'optimizer': 'adam', 'graph_mode': 'off', 'use_snp_selection': False}. Best is trial 33 with value: 0.3133915102850672.
[I 2025-12-05 22:26:16,661] Trial 120 finished with value: 0.30760716463812354 and parameters: {'model_type': 'mlp', 'hidden_dims': '[512, 256]', 'dropout': 0.44696496583477885, 'batch_norm': False, 'lr': 9.35391512831096e-06, 'weight_decay': 3.856672129839369e-05, 'epochs': 85, 'loss': 'mse', 'optimizer': 'adam', 'graph_mode': 'off', 'use_snp_selection': False}. Best is trial 33 with value: 0.3133915102850672.
[I 2025-12-05 22:26:43,116] Trial 121 finished with value: 0.30769197470992643 and parameters: {'model_type': 'mlp', 'hidden_dims': '[512, 128]', 'dropout': 0.4578711906718061, 'batch_norm': False, 'lr': 7.422938270255275e-06, 'weight_decay': 1.2870580037667803e-06, 'epochs': 122, 'loss': 'mse', 'optimizer': 'adam', 'graph_mode': 'off', 'use_snp_selection': False}. Best is trial 33 with value: 0.3133915102850672.
[I 2025-12-05 22:27:08,570] Trial 122 finished with value: 0.3058114737779302 and parameters: {'model_type': 'mlp', 'hidden_dims': '[512, 128]', 'dropout': 0.4269316002207767, 'batch_norm': False, 'lr': 7.957672328264263e-06, 'weight_decay': 8.702908126847286e-07, 'epochs': 116, 'loss': 'mse', 'optimizer': 'adam', 'graph_mode': 'off', 'use_snp_selection': False}. Best is trial 33 with value: 0.3133915102850672.
[I 2025-12-05 22:27:36,273] Trial 123 finished with value: 0.28087750171827697 and parameters: {'model_type': 'mlp', 'hidden_dims': '[512, 128]', 'dropout': 0.47718325392114563, 'batch_norm': False, 'lr': 0.0004165389214175758, 'weight_decay': 1.8876297829777206e-06, 'epochs': 130, 'loss': 'mse', 'optimizer': 'adam', 'graph_mode': 'off', 'use_snp_selection': False}. Best is trial 33 with value: 0.3133915102850672.
[I 2025-12-05 22:28:11,065] Trial 124 finished with value: 0.30962792665250255 and parameters: {'model_type': 'mlp', 'hidden_dims': '[512, 128]', 'dropout': 0.5058274065103632, 'batch_norm': False, 'lr': 4.9860934494826655e-06, 'weight_decay': 1.524778089616787e-06, 'epochs': 170, 'loss': 'mse', 'optimizer': 'adam', 'graph_mode': 'off', 'use_snp_selection': False}. Best is trial 33 with value: 0.3133915102850672.
[I 2025-12-05 22:28:41,889] Trial 125 finished with value: 0.3113698955945529 and parameters: {'model_type': 'mlp', 'hidden_dims': '[512, 128]', 'dropout': 0.41750372947228664, 'batch_norm': False, 'lr': 6.46272055164451e-06, 'weight_decay': 1.1273025219291735e-06, 'epochs': 147, 'loss': 'mse', 'optimizer': 'adam', 'graph_mode': 'off', 'use_snp_selection': False}. Best is trial 33 with value: 0.3133915102850672.
[I 2025-12-05 22:28:59,934] Trial 126 finished with value: 0.3079043095610404 and parameters: {'model_type': 'mlp', 'hidden_dims': '[256, 128]', 'dropout': 0.4121621136512793, 'batch_norm': False, 'lr': 5.904706309145631e-06, 'weight_decay': 3.5944854110083756e-06, 'epochs': 147, 'loss': 'mse', 'optimizer': 'adam', 'graph_mode': 'off', 'use_snp_selection': False}. Best is trial 33 with value: 0.3133915102850672.
[I 2025-12-05 22:29:32,746] Trial 127 finished with value: 0.3097473046310685 and parameters: {'model_type': 'mlp', 'hidden_dims': '[512, 128]', 'dropout': 0.4422078293449574, 'batch_norm': False, 'lr': 1.1202888623163384e-05, 'weight_decay': 7.123575840271615e-07, 'epochs': 159, 'loss': 'mse', 'optimizer': 'adam', 'graph_mode': 'off', 'use_snp_selection': False}. Best is trial 33 with value: 0.3133915102850672.
[I 2025-12-05 22:29:58,529] Trial 128 finished with value: 0.2787322829319173 and parameters: {'model_type': 'mlp', 'hidden_dims': '[128, 64]', 'dropout': 0.3460514024258507, 'batch_norm': False, 'lr': 6.584506410963958e-06, 'weight_decay': 8.864309530488951e-07, 'epochs': 135, 'loss': 'mse', 'optimizer': 'adam', 'graph_mode': 'off', 'use_snp_selection': True, 'num_snps': 12722}. Best is trial 33 with value: 0.3133915102850672.
[I 2025-12-05 22:30:35,561] Trial 129 finished with value: 0.3124007163726058 and parameters: {'model_type': 'mlp', 'hidden_dims': '[512, 128]', 'dropout': 0.43244557634874514, 'batch_norm': False, 'lr': 3.428339785385686e-06, 'weight_decay': 5.479897855550943e-07, 'epochs': 183, 'loss': 'mse', 'optimizer': 'adam', 'graph_mode': 'off', 'use_snp_selection': False}. Best is trial 33 with value: 0.3133915102850672.
[I 2025-12-05 22:31:12,993] Trial 130 finished with value: 0.31462448978204655 and parameters: {'model_type': 'mlp', 'hidden_dims': '[512, 256]', 'dropout': 0.46195153272734774, 'batch_norm': False, 'lr': 3.5041154059562883e-06, 'weight_decay': 5.523800728326301e-07, 'epochs': 184, 'loss': 'mse', 'optimizer': 'adam', 'graph_mode': 'off', 'use_snp_selection': False}. Best is trial 130 with value: 0.31462448978204655.
[I 2025-12-05 22:31:50,429] Trial 131 finished with value: 0.30743319952375275 and parameters: {'model_type': 'mlp', 'hidden_dims': '[512, 256]', 'dropout': 0.4608812065762328, 'batch_norm': False, 'lr': 3.304492868829242e-06, 'weight_decay': 6.071454981758601e-07, 'epochs': 184, 'loss': 'mse', 'optimizer': 'adam', 'graph_mode': 'off', 'use_snp_selection': False}. Best is trial 130 with value: 0.31462448978204655.
[I 2025-12-05 22:32:30,354] Trial 132 finished with value: 0.31143678956915444 and parameters: {'model_type': 'mlp', 'hidden_dims': '[512, 256]', 'dropout': 0.44964350136405107, 'batch_norm': False, 'lr': 4.030799548640627e-06, 'weight_decay': 4.2304948621411485e-07, 'epochs': 198, 'loss': 'mse', 'optimizer': 'adam', 'graph_mode': 'off', 'use_snp_selection': False}. Best is trial 130 with value: 0.31462448978204655.
[I 2025-12-05 22:33:09,066] Trial 133 finished with value: 0.30878050247987004 and parameters: {'model_type': 'mlp', 'hidden_dims': '[512, 256]', 'dropout': 0.37488357814759954, 'batch_norm': False, 'lr': 4.4051472212524654e-06, 'weight_decay': 3.788981880132623e-07, 'epochs': 191, 'loss': 'mse', 'optimizer': 'adam', 'graph_mode': 'off', 'use_snp_selection': False}. Best is trial 130 with value: 0.31462448978204655.
[I 2025-12-05 22:33:49,153] Trial 134 finished with value: 0.3033625557945123 and parameters: {'model_type': 'mlp', 'hidden_dims': '[512, 256]', 'dropout': 0.44915747191405364, 'batch_norm': False, 'lr': 2.3445890772238514e-06, 'weight_decay': 4.7328106141624125e-07, 'epochs': 199, 'loss': 'mse', 'optimizer': 'adam', 'graph_mode': 'off', 'use_snp_selection': False}. Best is trial 130 with value: 0.31462448978204655.
[I 2025-12-05 22:34:26,326] Trial 135 finished with value: 0.3095156756529235 and parameters: {'model_type': 'mlp', 'hidden_dims': '[512, 128]', 'dropout': 0.47292050509221484, 'batch_norm': False, 'lr': 3.491101143391418e-06, 'weight_decay': 5.688103733502911e-07, 'epochs': 183, 'loss': 'mse', 'optimizer': 'adam', 'graph_mode': 'off', 'use_snp_selection': False}. Best is trial 130 with value: 0.31462448978204655.
[I 2025-12-05 22:35:07,319] Trial 136 finished with value: 0.3088435304248732 and parameters: {'model_type': 'mlp', 'hidden_dims': '[512, 256]', 'dropout': 0.41713710577675406, 'batch_norm': False, 'lr': 3.92653395125003e-06, 'weight_decay': 3.229765184925772e-07, 'epochs': 204, 'loss': 'mse', 'optimizer': 'adam', 'graph_mode': 'off', 'use_snp_selection': False}. Best is trial 130 with value: 0.31462448978204655.
[I 2025-12-05 22:35:31,472] Trial 137 finished with value: 0.29883943659032813 and parameters: {'model_type': 'mlp', 'hidden_dims': '[256, 128, 64]', 'dropout': 0.436169504664084, 'batch_norm': False, 'lr': 4.460888777963876e-06, 'weight_decay': 4.323386994666868e-07, 'epochs': 212, 'loss': 'mse', 'optimizer': 'adam', 'graph_mode': 'off', 'use_snp_selection': False}. Best is trial 130 with value: 0.31462448978204655.
[I 2025-12-05 22:36:10,944] Trial 138 finished with value: 0.31115456621235354 and parameters: {'model_type': 'mlp', 'hidden_dims': '[512, 128]', 'dropout': 0.40261537007161535, 'batch_norm': False, 'lr': 3.0297355237249266e-06, 'weight_decay': 1.9211624680034641e-07, 'epochs': 196, 'loss': 'mse', 'optimizer': 'adam', 'graph_mode': 'off', 'use_snp_selection': False}. Best is trial 130 with value: 0.31462448978204655.
[I 2025-12-05 22:36:49,896] Trial 139 finished with value: 0.29980219198641817 and parameters: {'model_type': 'mlp', 'hidden_dims': '[512, 128]', 'dropout': 0.4839482333678309, 'batch_norm': True, 'lr': 2.8389327123583645e-06, 'weight_decay': 2.9677590228562443e-07, 'epochs': 192, 'loss': 'mse', 'optimizer': 'adam', 'graph_mode': 'off', 'use_snp_selection': False}. Best is trial 130 with value: 0.31462448978204655.
[I 2025-12-05 22:37:33,571] Trial 140 finished with value: 0.3080275463795469 and parameters: {'model_type': 'mlp', 'hidden_dims': '[512, 128]', 'dropout': 0.40346170309291857, 'batch_norm': False, 'lr': 2.2115157673613583e-06, 'weight_decay': 1.7288522572978527e-07, 'epochs': 220, 'loss': 'mse', 'optimizer': 'adam', 'graph_mode': 'off', 'use_snp_selection': False}. Best is trial 130 with value: 0.31462448978204655.
[I 2025-12-05 22:38:13,601] Trial 141 finished with value: 0.310146693460278 and parameters: {'model_type': 'mlp', 'hidden_dims': '[512, 128]', 'dropout': 0.39020160749833394, 'batch_norm': False, 'lr': 3.2540978679030145e-06, 'weight_decay': 2.1028989787675886e-07, 'epochs': 199, 'loss': 'mse', 'optimizer': 'adam', 'graph_mode': 'off', 'use_snp_selection': False}. Best is trial 130 with value: 0.31462448978204655.
[I 2025-12-05 22:38:55,003] Trial 142 finished with value: 0.31068237917038355 and parameters: {'model_type': 'mlp', 'hidden_dims': '[512, 128]', 'dropout': 0.45140820123699194, 'batch_norm': False, 'lr': 3.7870898915224745e-06, 'weight_decay': 2.4757415922090957e-07, 'epochs': 207, 'loss': 'mse', 'optimizer': 'adam', 'graph_mode': 'off', 'use_snp_selection': False}. Best is trial 130 with value: 0.31462448978204655.
[I 2025-12-05 22:39:32,721] Trial 143 finished with value: 0.3092955904985655 and parameters: {'model_type': 'mlp', 'hidden_dims': '[512, 128]', 'dropout': 0.4361619618184945, 'batch_norm': False, 'lr': 2.6316441035603906e-06, 'weight_decay': 1.0653093864488865e-06, 'epochs': 186, 'loss': 'mse', 'optimizer': 'adam', 'graph_mode': 'off', 'use_snp_selection': False}. Best is trial 130 with value: 0.31462448978204655.
[I 2025-12-05 22:40:09,582] Trial 144 finished with value: 0.31086110422552676 and parameters: {'model_type': 'mlp', 'hidden_dims': '[512, 128]', 'dropout': 0.4301867865702206, 'batch_norm': False, 'lr': 4.621950886711232e-06, 'weight_decay': 1.9026735056145265e-05, 'epochs': 181, 'loss': 'mse', 'optimizer': 'adam', 'graph_mode': 'off', 'use_snp_selection': False}. Best is trial 130 with value: 0.31462448978204655.
[I 2025-12-05 22:40:44,435] Trial 145 finished with value: 0.3079487946236833 and parameters: {'model_type': 'mlp', 'hidden_dims': '[512, 256]', 'dropout': 0.41870703130888576, 'batch_norm': False, 'lr': 6.242805091576527e-06, 'weight_decay': 7.263884488091669e-07, 'epochs': 169, 'loss': 'mse', 'optimizer': 'adam', 'graph_mode': 'off', 'use_snp_selection': False}. Best is trial 130 with value: 0.31462448978204655.
[I 2025-12-05 22:41:20,716] Trial 146 finished with value: 0.3097263985728704 and parameters: {'model_type': 'mlp', 'hidden_dims': '[512, 128]', 'dropout': 0.4669653650851261, 'batch_norm': False, 'lr': 7.760884699133148e-06, 'weight_decay': 6.067600604934528e-07, 'epochs': 178, 'loss': 'mse', 'optimizer': 'adam', 'graph_mode': 'off', 'use_snp_selection': False}. Best is trial 130 with value: 0.31462448978204655.
[I 2025-12-05 22:41:52,636] Trial 147 finished with value: 0.3051067423441444 and parameters: {'model_type': 'mlp', 'hidden_dims': '[512, 128]', 'dropout': 0.4442032341251001, 'batch_norm': False, 'lr': 0.0001374108369172456, 'weight_decay': 4.0082551113672953e-07, 'epochs': 154, 'loss': 'mse', 'optimizer': 'adam', 'graph_mode': 'off', 'use_snp_selection': False}. Best is trial 130 with value: 0.31462448978204655.
[I 2025-12-05 22:42:35,963] Trial 148 finished with value: 0.2843389625557889 and parameters: {'model_type': 'mlp', 'hidden_dims': '[512, 256]', 'dropout': 0.4278061483742625, 'batch_norm': False, 'lr': 1.77719175761027e-06, 'weight_decay': 5.435163226058858e-07, 'epochs': 194, 'loss': 'mse', 'optimizer': 'adam', 'graph_mode': 'off', 'use_snp_selection': True, 'num_snps': 27235}. Best is trial 130 with value: 0.31462448978204655.
[I 2025-12-05 22:43:05,645] Trial 149 finished with value: 0.306309116760109 and parameters: {'model_type': 'mlp', 'hidden_dims': '[512, 128]', 'dropout': 0.4500613485547116, 'batch_norm': False, 'lr': 3.1694865201019943e-06, 'weight_decay': 2.7413929837918837e-05, 'epochs': 141, 'loss': 'mse', 'optimizer': 'adam', 'graph_mode': 'off', 'use_snp_selection': False}. Best is trial 130 with value: 0.31462448978204655.
[I 2025-12-05 22:44:00,469] Trial 0 finished with value: 0.2622924992603297 and parameters: {'model_type': 'mlp', 'hidden_dims': '[128, 64]', 'dropout': 0.199031432379812, 'batch_norm': True, 'lr': 1.8408544111075837e-06, 'weight_decay': 5.5136510071208614e-05, 'epochs': 336, 'loss': 'mae', 'optimizer': 'adam', 'graph_mode': 'off', 'use_snp_selection': True, 'num_snps': 43862}. Best is trial 0 with value: 0.2622924992603297.
[I 2025-12-05 22:44:27,209] Trial 1 finished with value: 0.30815483144952155 and parameters: {'model_type': 'mlp', 'hidden_dims': '[256, 128]', 'dropout': 0.4370668075331726, 'batch_norm': True, 'lr': 7.133471581159139e-05, 'weight_decay': 1.128633586803549e-05, 'epochs': 242, 'loss': 'mae', 'optimizer': 'adam', 'graph_mode': 'off', 'use_snp_selection': False}. Best is trial 1 with value: 0.30815483144952155.
[I 2025-12-05 22:44:53,879] Trial 2 finished with value: 0.26853868755612165 and parameters: {'model_type': 'mlp', 'hidden_dims': '[256, 128, 64]', 'dropout': 0.41314357415569625, 'batch_norm': False, 'lr': 3.952233718592101e-06, 'weight_decay': 0.00026754769258252603, 'epochs': 149, 'loss': 'mse', 'optimizer': 'adam', 'graph_mode': 'off', 'use_snp_selection': True, 'num_snps': 11571}. Best is trial 1 with value: 0.30815483144952155.
[I 2025-12-05 22:45:54,474] Trial 3 finished with value: 0.3109150115799696 and parameters: {'model_type': 'mlp', 'hidden_dims': '[512, 64]', 'dropout': 0.5938127374509361, 'batch_norm': False, 'lr': 5.67704586114731e-06, 'weight_decay': 2.4518087630137052e-05, 'epochs': 320, 'loss': 'mae', 'optimizer': 'adam', 'graph_mode': 'off', 'use_snp_selection': False}. Best is trial 3 with value: 0.3109150115799696.
[I 2025-12-05 22:46:55,006] Trial 4 finished with value: 0.2776807402349728 and parameters: {'model_type': 'mlp', 'hidden_dims': '[512, 128]', 'dropout': 0.25746343592134413, 'batch_norm': True, 'lr': 1.3467657668402788e-06, 'weight_decay': 0.00033087251918647806, 'epochs': 277, 'loss': 'mse', 'optimizer': 'adam', 'graph_mode': 'off', 'use_snp_selection': True, 'num_snps': 36675}. Best is trial 3 with value: 0.3109150115799696.
[I 2025-12-05 22:47:38,109] Trial 5 finished with value: 0.24025049424826433 and parameters: {'model_type': 'mlp', 'hidden_dims': '[512, 64]', 'dropout': 0.38275350994408375, 'batch_norm': True, 'lr': 1.5586664309232824e-06, 'weight_decay': 0.0008227664668621182, 'epochs': 145, 'loss': 'mae', 'optimizer': 'adam', 'graph_mode': 'off', 'use_snp_selection': True, 'num_snps': 32148}. Best is trial 3 with value: 0.3109150115799696.
[I 2025-12-05 22:48:00,769] Trial 6 finished with value: 0.3035518803786804 and parameters: {'model_type': 'mlp', 'hidden_dims': '[256, 128]', 'dropout': 0.3930109900265879, 'batch_norm': False, 'lr': 4.892964372128395e-05, 'weight_decay': 1.5809549317992182e-06, 'epochs': 199, 'loss': 'mse', 'optimizer': 'adam', 'graph_mode': 'off', 'use_snp_selection': False}. Best is trial 3 with value: 0.3109150115799696.
[I 2025-12-05 22:48:23,140] Trial 7 finished with value: 0.30944496376460306 and parameters: {'model_type': 'mlp', 'hidden_dims': '[512, 256]', 'dropout': 0.15343979219678458, 'batch_norm': True, 'lr': 6.234003099047341e-05, 'weight_decay': 3.894760610535477e-07, 'epochs': 97, 'loss': 'mse', 'optimizer': 'adam', 'graph_mode': 'off', 'use_snp_selection': False}. Best is trial 3 with value: 0.3109150115799696.
[I 2025-12-05 22:49:23,121] Trial 8 finished with value: 0.3083169672763334 and parameters: {'model_type': 'mlp', 'hidden_dims': '[512, 128]', 'dropout': 0.10743001231661406, 'batch_norm': True, 'lr': 0.00023728538449271062, 'weight_decay': 1.7629071578048637e-05, 'epochs': 312, 'loss': 'mae', 'optimizer': 'adam', 'graph_mode': 'off', 'use_snp_selection': False}. Best is trial 3 with value: 0.3109150115799696.
[I 2025-12-05 22:49:58,977] Trial 9 finished with value: 0.30715150164260596 and parameters: {'model_type': 'mlp', 'hidden_dims': '[512, 64]', 'dropout': 0.14505336736221927, 'batch_norm': True, 'lr': 5.8619638388111826e-05, 'weight_decay': 6.200156172669308e-07, 'epochs': 175, 'loss': 'mse', 'optimizer': 'adam', 'graph_mode': 'off', 'use_snp_selection': False}. Best is trial 3 with value: 0.3109150115799696.
[I 2025-12-05 22:50:13,749] Trial 10 finished with value: 0.26579909609906294 and parameters: {'model_type': 'mlp', 'hidden_dims': '[512, 64]', 'dropout': 0.5885461262002587, 'batch_norm': False, 'lr': 8.769366258768696e-06, 'weight_decay': 2.78273193871783e-06, 'epochs': 55, 'loss': 'mae', 'optimizer': 'adam', 'graph_mode': 'off', 'use_snp_selection': False}. Best is trial 3 with value: 0.3109150115799696.
[I 2025-12-05 22:50:32,376] Trial 11 finished with value: 0.3037598790812582 and parameters: {'model_type': 'mlp', 'hidden_dims': '[512, 256]', 'dropout': 0.583942291816117, 'batch_norm': False, 'lr': 1.422933652790185e-05, 'weight_decay': 1.18635098029648e-07, 'epochs': 77, 'loss': 'mse', 'optimizer': 'adam', 'graph_mode': 'off', 'use_snp_selection': False}. Best is trial 3 with value: 0.3109150115799696.
[I 2025-12-05 22:50:53,784] Trial 12 finished with value: 0.2854196377065265 and parameters: {'model_type': 'mlp', 'hidden_dims': '[512, 256]', 'dropout': 0.2637316882220091, 'batch_norm': False, 'lr': 0.0006753264773209732, 'weight_decay': 1.3081036432574914e-07, 'epochs': 93, 'loss': 'mae', 'optimizer': 'adam', 'graph_mode': 'off', 'use_snp_selection': False}. Best is trial 3 with value: 0.3109150115799696.
[I 2025-12-05 22:51:40,292] Trial 13 finished with value: 0.3026327212048308 and parameters: {'model_type': 'mlp', 'hidden_dims': '[512, 256]', 'dropout': 0.5038644356477802, 'batch_norm': False, 'lr': 1.4304506621636526e-05, 'weight_decay': 4.373608364627903e-05, 'epochs': 237, 'loss': 'mse', 'optimizer': 'adam', 'graph_mode': 'off', 'use_snp_selection': False}. Best is trial 3 with value: 0.3109150115799696.
[I 2025-12-05 22:51:50,628] Trial 14 finished with value: 0.2990644114109283 and parameters: {'model_type': 'mlp', 'hidden_dims': '[128, 64]', 'dropout': 0.3012984444538551, 'batch_norm': True, 'lr': 0.00017558188744418174, 'weight_decay': 3.0607358611649674e-06, 'epochs': 114, 'loss': 'mse', 'optimizer': 'adam', 'graph_mode': 'off', 'use_snp_selection': False}. Best is trial 3 with value: 0.3109150115799696.
[I 2025-12-05 22:51:59,032] Trial 15 finished with value: 0.2579832625316116 and parameters: {'model_type': 'mlp', 'hidden_dims': '[256, 128, 64]', 'dropout': 0.48263162073930665, 'batch_norm': False, 'lr': 2.3197922593349616e-05, 'weight_decay': 5.786483120407219e-07, 'epochs': 41, 'loss': 'mae', 'optimizer': 'adam', 'graph_mode': 'off', 'use_snp_selection': False}. Best is trial 3 with value: 0.3109150115799696.
[I 2025-12-05 22:53:05,919] Trial 16 finished with value: 0.2940198439677236 and parameters: {'model_type': 'mlp', 'hidden_dims': '[512, 256]', 'dropout': 0.31241277325344896, 'batch_norm': True, 'lr': 6.013316929814413e-06, 'weight_decay': 5.3536875449215945e-05, 'epochs': 350, 'loss': 'mse', 'optimizer': 'adam', 'graph_mode': 'off', 'use_snp_selection': False}. Best is trial 3 with value: 0.3109150115799696.
