[I 2025-12-05 16:04:15,553] Trial 1 finished with value: 0.11888254820463734 and parameters: {'model_type': 'mlp', 'hidden_dims': '[256, 128]', 'dropout': 0.4370668075331726, 'batch_norm': True, 'lr': 7.133471581159139e-05, 'weight_decay': 1.128633586803549e-05, 'epochs': 242, 'loss': 'mae', 'optimizer': 'adam', 'graph_mode': 'off', 'use_snp_selection': False}. Best is trial 1 with value: 0.11888254820463734.
[I 2025-12-05 16:04:17,333] Trial 2 finished with value: 0.0270676700335352 and parameters: {'model_type': 'mlp', 'hidden_dims': '[256, 128, 64]', 'dropout': 0.41314357415569625, 'batch_norm': False, 'lr': 3.952233718592101e-06, 'weight_decay': 0.00026754769258252603, 'epochs': 149, 'loss': 'mse', 'optimizer': 'adam', 'graph_mode': 'off', 'use_snp_selection': True, 'num_snps': 11571}. Best is trial 1 with value: 0.11888254820463734.
[I 2025-12-05 16:04:21,954] Trial 3 finished with value: 0.10653876068636452 and parameters: {'model_type': 'mlp', 'hidden_dims': '[512, 64]', 'dropout': 0.5938127374509361, 'batch_norm': False, 'lr': 5.67704586114731e-06, 'weight_decay': 2.4518087630137052e-05, 'epochs': 320, 'loss': 'mae', 'optimizer': 'adam', 'graph_mode': 'off', 'use_snp_selection': False}. Best is trial 1 with value: 0.11888254820463734.
[I 2025-12-05 16:04:26,299] Trial 4 finished with value: 0.05534269008855511 and parameters: {'model_type': 'mlp', 'hidden_dims': '[512, 128]', 'dropout': 0.25746343592134413, 'batch_norm': True, 'lr': 1.3467657668402788e-06, 'weight_decay': 0.00033087251918647806, 'epochs': 277, 'loss': 'mse', 'optimizer': 'adam', 'graph_mode': 'off', 'use_snp_selection': True, 'num_snps': 36675}. Best is trial 1 with value: 0.11888254820463734.
[I 2025-12-05 16:04:29,446] Trial 5 finished with value: 0.04100113239550159 and parameters: {'model_type': 'mlp', 'hidden_dims': '[512, 64]', 'dropout': 0.38275350994408375, 'batch_norm': True, 'lr': 1.5586664309232824e-06, 'weight_decay': 0.0008227664668621182, 'epochs': 145, 'loss': 'mae', 'optimizer': 'adam', 'graph_mode': 'off', 'use_snp_selection': True, 'num_snps': 32148}. Best is trial 1 with value: 0.11888254820463734.
[I 2025-12-05 16:04:31,345] Trial 6 finished with value: 0.12228918514859181 and parameters: {'model_type': 'mlp', 'hidden_dims': '[256, 128]', 'dropout': 0.3930109900265879, 'batch_norm': False, 'lr': 4.892964372128395e-05, 'weight_decay': 1.5809549317992182e-06, 'epochs': 199, 'loss': 'mse', 'optimizer': 'adam', 'graph_mode': 'off', 'use_snp_selection': False}. Best is trial 6 with value: 0.12228918514859181.
[I 2025-12-05 16:04:33,253] Trial 7 finished with value: 0.13298560298180045 and parameters: {'model_type': 'mlp', 'hidden_dims': '[512, 256]', 'dropout': 0.15343979219678458, 'batch_norm': True, 'lr': 6.234003099047341e-05, 'weight_decay': 3.894760610535477e-07, 'epochs': 97, 'loss': 'mse', 'optimizer': 'adam', 'graph_mode': 'off', 'use_snp_selection': False}. Best is trial 7 with value: 0.13298560298180045.
[I 2025-12-05 16:04:37,846] Trial 8 finished with value: 0.12946362262571512 and parameters: {'model_type': 'mlp', 'hidden_dims': '[512, 128]', 'dropout': 0.10743001231661406, 'batch_norm': True, 'lr': 0.00023728538449271062, 'weight_decay': 1.7629071578048637e-05, 'epochs': 312, 'loss': 'mae', 'optimizer': 'adam', 'graph_mode': 'off', 'use_snp_selection': False}. Best is trial 7 with value: 0.13298560298180045.
[I 2025-12-05 16:04:40,753] Trial 9 finished with value: 0.12459202782491187 and parameters: {'model_type': 'mlp', 'hidden_dims': '[512, 64]', 'dropout': 0.14505336736221927, 'batch_norm': True, 'lr': 5.8619638388111826e-05, 'weight_decay': 6.200156172669308e-07, 'epochs': 175, 'loss': 'mse', 'optimizer': 'adam', 'graph_mode': 'off', 'use_snp_selection': False}. Best is trial 7 with value: 0.13298560298180045.
[I 2025-12-05 16:04:41,976] Trial 10 finished with value: 0.04456984125837249 and parameters: {'model_type': 'mlp', 'hidden_dims': '[512, 256]', 'dropout': 0.2736992815328032, 'batch_norm': False, 'lr': 0.00032393778075602147, 'weight_decay': 1.1511946696017092e-07, 'epochs': 41, 'loss': 'mse', 'optimizer': 'adam', 'graph_mode': 'off', 'use_snp_selection': False}. Best is trial 7 with value: 0.13298560298180045.
[I 2025-12-05 16:04:43,585] Trial 11 finished with value: 0.14195174885505407 and parameters: {'model_type': 'mlp', 'hidden_dims': '[512, 128]', 'dropout': 0.10095648685224448, 'batch_norm': True, 'lr': 0.0007666984023899753, 'weight_decay': 2.512571353186099e-06, 'epochs': 70, 'loss': 'mae', 'optimizer': 'adam', 'graph_mode': 'off', 'use_snp_selection': False}. Best is trial 11 with value: 0.14195174885505407.
[I 2025-12-05 16:04:45,092] Trial 12 finished with value: 0.13601995523991156 and parameters: {'model_type': 'mlp', 'hidden_dims': '[512, 256]', 'dropout': 0.10344600881777158, 'batch_norm': True, 'lr': 0.0006753264773209732, 'weight_decay': 1.2006458821839938e-06, 'epochs': 63, 'loss': 'mae', 'optimizer': 'adam', 'graph_mode': 'off', 'use_snp_selection': False}. Best is trial 11 with value: 0.14195174885505407.
[I 2025-12-05 16:04:46,468] Trial 13 finished with value: 0.12981324459071733 and parameters: {'model_type': 'mlp', 'hidden_dims': '[512, 256]', 'dropout': 0.24637176605202243, 'batch_norm': True, 'lr': 0.0006925072561196448, 'weight_decay': 2.9080284089521244e-06, 'epochs': 51, 'loss': 'mae', 'optimizer': 'adam', 'graph_mode': 'off', 'use_snp_selection': False}. Best is trial 11 with value: 0.14195174885505407.
[I 2025-12-05 16:04:48,344] Trial 14 finished with value: 0.13275520926208292 and parameters: {'model_type': 'mlp', 'hidden_dims': '[512, 128]', 'dropout': 0.4974319064521827, 'batch_norm': True, 'lr': 0.0008799356667950406, 'weight_decay': 2.3625593107335962e-06, 'epochs': 93, 'loss': 'mae', 'optimizer': 'adam', 'graph_mode': 'off', 'use_snp_selection': False}. Best is trial 11 with value: 0.14195174885505407.
[I 2025-12-05 16:04:49,214] Trial 15 finished with value: 0.11778459795947005 and parameters: {'model_type': 'mlp', 'hidden_dims': '[128, 64]', 'dropout': 0.10272160099215884, 'batch_norm': True, 'lr': 0.00018429018027102804, 'weight_decay': 4.647398975110266e-06, 'epochs': 100, 'loss': 'mae', 'optimizer': 'adam', 'graph_mode': 'off', 'use_snp_selection': False}. Best is trial 11 with value: 0.14195174885505407.
[I 2025-12-05 16:04:50,301] Trial 16 finished with value: 0.037593883826023244 and parameters: {'model_type': 'mlp', 'hidden_dims': '[256, 128, 64]', 'dropout': 0.32671760981181863, 'batch_norm': True, 'lr': 1.2586985041154999e-05, 'weight_decay': 4.78963096416123e-07, 'epochs': 67, 'loss': 'mae', 'optimizer': 'adam', 'graph_mode': 'off', 'use_snp_selection': False}. Best is trial 11 with value: 0.14195174885505407.
[I 2025-12-05 16:04:52,569] Trial 17 finished with value: 0.1163199665250939 and parameters: {'model_type': 'mlp', 'hidden_dims': '[512, 256]', 'dropout': 0.17958502443247115, 'batch_norm': True, 'lr': 0.00044642725319954336, 'weight_decay': 1.6308228310188972e-07, 'epochs': 125, 'loss': 'mae', 'optimizer': 'adam', 'graph_mode': 'off', 'use_snp_selection': False}. Best is trial 11 with value: 0.14195174885505407.
[I 2025-12-05 16:04:58,068] Trial 18 finished with value: 0.1273771295602742 and parameters: {'model_type': 'mlp', 'hidden_dims': '[512, 128]', 'dropout': 0.21325004736164802, 'batch_norm': False, 'lr': 0.00015976810498759077, 'weight_decay': 1.0792267361253407e-06, 'epochs': 219, 'loss': 'mae', 'optimizer': 'adam', 'graph_mode': 'off', 'use_snp_selection': True, 'num_snps': 58241}. Best is trial 11 with value: 0.14195174885505407.
[I 2025-12-05 16:04:59,913] Trial 19 finished with value: 0.09454166645732301 and parameters: {'model_type': 'mlp', 'hidden_dims': '[512, 128]', 'dropout': 0.31341549294012583, 'batch_norm': True, 'lr': 1.8913585393810635e-05, 'weight_decay': 5.067442224368904e-06, 'epochs': 88, 'loss': 'mae', 'optimizer': 'adam', 'graph_mode': 'off', 'use_snp_selection': False}. Best is trial 11 with value: 0.14195174885505407.
[I 2025-12-05 16:05:02,202] Trial 20 finished with value: 0.13356818319874442 and parameters: {'model_type': 'mlp', 'hidden_dims': '[512, 256]', 'dropout': 0.14132231413879837, 'batch_norm': True, 'lr': 0.0005516960221520528, 'weight_decay': 4.679666515308887e-05, 'epochs': 126, 'loss': 'mae', 'optimizer': 'adam', 'graph_mode': 'off', 'use_snp_selection': False}. Best is trial 11 with value: 0.14195174885505407.
[I 2025-12-05 16:05:04,513] Trial 21 finished with value: 0.13488409864472187 and parameters: {'model_type': 'mlp', 'hidden_dims': '[512, 256]', 'dropout': 0.10289667324449528, 'batch_norm': True, 'lr': 0.0004908910784870497, 'weight_decay': 6.331291676273367e-05, 'epochs': 125, 'loss': 'mae', 'optimizer': 'adam', 'graph_mode': 'off', 'use_snp_selection': False}. Best is trial 11 with value: 0.14195174885505407.
[I 2025-12-05 16:05:06,164] Trial 22 finished with value: 0.1279077783088322 and parameters: {'model_type': 'mlp', 'hidden_dims': '[512, 256]', 'dropout': 0.1043342930201088, 'batch_norm': True, 'lr': 0.0009595623178922176, 'weight_decay': 0.00012506009376990192, 'epochs': 72, 'loss': 'mae', 'optimizer': 'adam', 'graph_mode': 'off', 'use_snp_selection': False}. Best is trial 11 with value: 0.14195174885505407.
[I 2025-12-05 16:05:08,365] Trial 23 finished with value: 0.11677699655785484 and parameters: {'model_type': 'mlp', 'hidden_dims': '[512, 256]', 'dropout': 0.17786420367350103, 'batch_norm': True, 'lr': 0.00012628503689713372, 'weight_decay': 5.664310518601129e-06, 'epochs': 119, 'loss': 'mae', 'optimizer': 'adam', 'graph_mode': 'off', 'use_snp_selection': False}. Best is trial 11 with value: 0.14195174885505407.
[I 2025-12-05 16:05:11,230] Trial 24 finished with value: 0.13149740545435615 and parameters: {'model_type': 'mlp', 'hidden_dims': '[512, 256]', 'dropout': 0.21932098468658173, 'batch_norm': True, 'lr': 0.0003340335023396422, 'weight_decay': 9.857217994069622e-07, 'epochs': 169, 'loss': 'mae', 'optimizer': 'adam', 'graph_mode': 'off', 'use_snp_selection': False}. Best is trial 11 with value: 0.14195174885505407.
[I 2025-12-05 16:05:12,343] Trial 25 finished with value: 0.10678777531978384 and parameters: {'model_type': 'mlp', 'hidden_dims': '[256, 128, 64]', 'dropout': 0.13702903276987258, 'batch_norm': True, 'lr': 0.0001132659381544752, 'weight_decay': 4.3730583809691504e-05, 'epochs': 67, 'loss': 'mae', 'optimizer': 'adam', 'graph_mode': 'off', 'use_snp_selection': False}. Best is trial 11 with value: 0.14195174885505407.
[I 2025-12-05 16:05:13,758] Trial 26 finished with value: 0.13221213039145743 and parameters: {'model_type': 'mlp', 'hidden_dims': '[256, 128]', 'dropout': 0.2918871336665922, 'batch_norm': True, 'lr': 0.00043919251664185856, 'weight_decay': 2.4465689174045293e-07, 'epochs': 40, 'loss': 'mae', 'optimizer': 'adam', 'graph_mode': 'off', 'use_snp_selection': True, 'num_snps': 3842}. Best is trial 11 with value: 0.14195174885505407.
[I 2025-12-05 16:05:14,702] Trial 27 finished with value: 0.09927638017903921 and parameters: {'model_type': 'mlp', 'hidden_dims': '[128, 64]', 'dropout': 0.1639587804520582, 'batch_norm': False, 'lr': 0.0009494358356610379, 'weight_decay': 8.823441398414306e-06, 'epochs': 107, 'loss': 'mae', 'optimizer': 'adam', 'graph_mode': 'off', 'use_snp_selection': False}. Best is trial 11 with value: 0.14195174885505407.
[I 2025-12-05 16:05:17,268] Trial 28 finished with value: 0.12041810232929301 and parameters: {'model_type': 'mlp', 'hidden_dims': '[512, 128]', 'dropout': 0.22370708789317098, 'batch_norm': True, 'lr': 0.0002984633468432287, 'weight_decay': 0.00011837572117061313, 'epochs': 146, 'loss': 'mae', 'optimizer': 'adam', 'graph_mode': 'off', 'use_snp_selection': False}. Best is trial 11 with value: 0.14195174885505407.
[I 2025-12-05 16:05:19,214] Trial 29 finished with value: 0.14327701317958927 and parameters: {'model_type': 'mlp', 'hidden_dims': '[128, 64]', 'dropout': 0.20079893670037424, 'batch_norm': True, 'lr': 0.0005388560200940643, 'weight_decay': 2.701026874743752e-05, 'epochs': 78, 'loss': 'mae', 'optimizer': 'adam', 'graph_mode': 'off', 'use_snp_selection': True, 'num_snps': 19468}. Best is trial 29 with value: 0.14327701317958927.
[I 2025-12-05 16:05:21,087] Trial 30 finished with value: 0.07058941725188474 and parameters: {'model_type': 'mlp', 'hidden_dims': '[128, 64]', 'dropout': 0.19316701133517303, 'batch_norm': True, 'lr': 1.910534239226009e-05, 'weight_decay': 2.585078947063871e-06, 'epochs': 79, 'loss': 'mae', 'optimizer': 'adam', 'graph_mode': 'off', 'use_snp_selection': True, 'num_snps': 18365}. Best is trial 29 with value: 0.14327701317958927.
[I 2025-12-05 16:05:23,090] Trial 31 finished with value: 0.12752759044455508 and parameters: {'model_type': 'mlp', 'hidden_dims': '[128, 64]', 'dropout': 0.12504804416811635, 'batch_norm': True, 'lr': 0.0005421685704764934, 'weight_decay': 2.349033921256001e-05, 'epochs': 61, 'loss': 'mae', 'optimizer': 'adam', 'graph_mode': 'off', 'use_snp_selection': True, 'num_snps': 20689}. Best is trial 29 with value: 0.14327701317958927.
[I 2025-12-05 16:05:25,168] Trial 32 finished with value: 0.1248932590149535 and parameters: {'model_type': 'mlp', 'hidden_dims': '[128, 64]', 'dropout': 0.10073391054025524, 'batch_norm': True, 'lr': 0.000626485488793997, 'weight_decay': 0.00010391045096260874, 'epochs': 115, 'loss': 'mae', 'optimizer': 'adam', 'graph_mode': 'off', 'use_snp_selection': True, 'num_snps': 20754}. Best is trial 29 with value: 0.14327701317958927.
[I 2025-12-05 16:05:28,263] Trial 33 finished with value: 0.11393417473341165 and parameters: {'model_type': 'mlp', 'hidden_dims': '[128, 64]', 'dropout': 0.18700705378041865, 'batch_norm': True, 'lr': 0.00022316662580457934, 'weight_decay': 1.2851897016806131e-05, 'epochs': 81, 'loss': 'mae', 'optimizer': 'adam', 'graph_mode': 'off', 'use_snp_selection': True, 'num_snps': 50127}. Best is trial 29 with value: 0.14327701317958927.
[I 2025-12-05 16:05:29,774] Trial 34 finished with value: 0.07995600325098394 and parameters: {'model_type': 'mlp', 'hidden_dims': '[512, 256]', 'dropout': 0.1354681780142286, 'batch_norm': True, 'lr': 0.00010306170315676186, 'weight_decay': 6.436415576414694e-05, 'epochs': 55, 'loss': 'mae', 'optimizer': 'adam', 'graph_mode': 'off', 'use_snp_selection': True, 'num_snps': 4311}. Best is trial 29 with value: 0.14327701317958927.
[I 2025-12-05 16:05:32,160] Trial 35 finished with value: 0.10322344628136694 and parameters: {'model_type': 'mlp', 'hidden_dims': '[256, 128]', 'dropout': 0.5200739532278197, 'batch_norm': False, 'lr': 4.036563047332746e-06, 'weight_decay': 8.620648588202013e-06, 'epochs': 137, 'loss': 'mae', 'optimizer': 'adam', 'graph_mode': 'off', 'use_snp_selection': True, 'num_snps': 26222}. Best is trial 29 with value: 0.14327701317958927.
[I 2025-12-05 16:05:33,923] Trial 36 finished with value: 0.1292013924245968 and parameters: {'model_type': 'mlp', 'hidden_dims': '[256, 128, 64]', 'dropout': 0.1574132891495136, 'batch_norm': True, 'lr': 0.00037795423897677945, 'weight_decay': 0.00023805525825173617, 'epochs': 165, 'loss': 'mse', 'optimizer': 'adam', 'graph_mode': 'off', 'use_snp_selection': False}. Best is trial 29 with value: 0.14327701317958927.
[I 2025-12-05 16:05:38,243] Trial 37 finished with value: 0.1216655579693699 and parameters: {'model_type': 'mlp', 'hidden_dims': '[512, 64]', 'dropout': 0.2302849043991194, 'batch_norm': True, 'lr': 0.0007116802104351754, 'weight_decay': 2.8701380668491627e-05, 'epochs': 260, 'loss': 'mae', 'optimizer': 'adam', 'graph_mode': 'off', 'use_snp_selection': True, 'num_snps': 38290}. Best is trial 29 with value: 0.14327701317958927.
[I 2025-12-05 16:05:40,281] Trial 38 finished with value: 0.1078429019387042 and parameters: {'model_type': 'mlp', 'hidden_dims': '[512, 128]', 'dropout': 0.12104324280572541, 'batch_norm': False, 'lr': 9.182004084891958e-05, 'weight_decay': 0.000978901682288905, 'epochs': 106, 'loss': 'mse', 'optimizer': 'adam', 'graph_mode': 'off', 'use_snp_selection': False}. Best is trial 29 with value: 0.14327701317958927.
[I 2025-12-05 16:05:42,201] Trial 39 finished with value: 0.06576453907491654 and parameters: {'model_type': 'mlp', 'hidden_dims': '[512, 256]', 'dropout': 0.16995524062511871, 'batch_norm': True, 'lr': 3.452086521441219e-05, 'weight_decay': 1.489127284174317e-06, 'epochs': 85, 'loss': 'mae', 'optimizer': 'adam', 'graph_mode': 'off', 'use_snp_selection': True, 'num_snps': 13361}. Best is trial 29 with value: 0.14327701317958927.
[I 2025-12-05 16:05:44,255] Trial 40 finished with value: 0.133033296103359 and parameters: {'model_type': 'mlp', 'hidden_dims': '[256, 128]', 'dropout': 0.3714858195952754, 'batch_norm': True, 'lr': 0.00024837360691914697, 'weight_decay': 0.0005084222459175783, 'epochs': 216, 'loss': 'mae', 'optimizer': 'adam', 'graph_mode': 'off', 'use_snp_selection': False}. Best is trial 29 with value: 0.14327701317958927.
[I 2025-12-05 16:05:46,639] Trial 41 finished with value: 0.11877998843715962 and parameters: {'model_type': 'mlp', 'hidden_dims': '[512, 256]', 'dropout': 0.1427321330683709, 'batch_norm': True, 'lr': 0.000554404789585536, 'weight_decay': 5.375439507101843e-05, 'epochs': 131, 'loss': 'mae', 'optimizer': 'adam', 'graph_mode': 'off', 'use_snp_selection': False}. Best is trial 29 with value: 0.14327701317958927.
[I 2025-12-05 16:05:48,849] Trial 42 finished with value: 0.11401246339959108 and parameters: {'model_type': 'mlp', 'hidden_dims': '[512, 256]', 'dropout': 0.13047200435578632, 'batch_norm': True, 'lr': 0.0004908455117711105, 'weight_decay': 7.359706305449147e-05, 'epochs': 117, 'loss': 'mae', 'optimizer': 'adam', 'graph_mode': 'off', 'use_snp_selection': False}. Best is trial 29 with value: 0.14327701317958927.
[I 2025-12-05 16:05:51,962] Trial 43 finished with value: 0.12811461714805522 and parameters: {'model_type': 'mlp', 'hidden_dims': '[512, 256]', 'dropout': 0.197406920776082, 'batch_norm': True, 'lr': 0.0007004656653996396, 'weight_decay': 3.8026960534913115e-05, 'epochs': 193, 'loss': 'mae', 'optimizer': 'adam', 'graph_mode': 'off', 'use_snp_selection': False}. Best is trial 29 with value: 0.14327701317958927.
[I 2025-12-05 16:05:56,923] Trial 44 finished with value: 0.03398621949876645 and parameters: {'model_type': 'mlp', 'hidden_dims': '[512, 64]', 'dropout': 0.44528989180556333, 'batch_norm': True, 'lr': 2.1343898282580408e-06, 'weight_decay': 0.00019289151175470826, 'epochs': 343, 'loss': 'mse', 'optimizer': 'adam', 'graph_mode': 'off', 'use_snp_selection': False}. Best is trial 29 with value: 0.14327701317958927.
[I 2025-12-05 16:05:59,624] Trial 45 finished with value: 0.125947732379467 and parameters: {'model_type': 'mlp', 'hidden_dims': '[512, 256]', 'dropout': 0.15588935432705958, 'batch_norm': True, 'lr': 0.0001794347058266544, 'weight_decay': 1.407486163099616e-05, 'epochs': 159, 'loss': 'mae', 'optimizer': 'adam', 'graph_mode': 'off', 'use_snp_selection': False}. Best is trial 29 with value: 0.14327701317958927.
[I 2025-12-05 16:06:00,991] Trial 46 finished with value: 0.14230677325220598 and parameters: {'model_type': 'mlp', 'hidden_dims': '[512, 128]', 'dropout': 0.12233306980027177, 'batch_norm': True, 'lr': 0.0002925479603868716, 'weight_decay': 2.2266512235362345e-05, 'epochs': 52, 'loss': 'mae', 'optimizer': 'adam', 'graph_mode': 'off', 'use_snp_selection': False}. Best is trial 29 with value: 0.14327701317958927.
[I 2025-12-05 16:06:02,373] Trial 47 finished with value: 0.030739487020557652 and parameters: {'model_type': 'mlp', 'hidden_dims': '[512, 128]', 'dropout': 0.25991432518296453, 'batch_norm': False, 'lr': 0.00030432521380017595, 'weight_decay': 1.897461195746441e-05, 'epochs': 55, 'loss': 'mse', 'optimizer': 'adam', 'graph_mode': 'off', 'use_snp_selection': False}. Best is trial 29 with value: 0.14327701317958927.
[I 2025-12-05 16:06:04,289] Trial 48 finished with value: 0.11672885332722445 and parameters: {'model_type': 'mlp', 'hidden_dims': '[512, 128]', 'dropout': 0.1117512561753526, 'batch_norm': True, 'lr': 0.00038988924298340887, 'weight_decay': 3.3080622294734527e-06, 'epochs': 96, 'loss': 'mae', 'optimizer': 'adam', 'graph_mode': 'off', 'use_snp_selection': False}. Best is trial 29 with value: 0.14327701317958927.
[I 2025-12-05 16:06:05,593] Trial 49 finished with value: 0.12861078050537902 and parameters: {'model_type': 'mlp', 'hidden_dims': '[512, 128]', 'dropout': 0.10125663315910784, 'batch_norm': True, 'lr': 0.00078165844378708, 'weight_decay': 7.023177300768395e-06, 'epochs': 47, 'loss': 'mae', 'optimizer': 'adam', 'graph_mode': 'off', 'use_snp_selection': False}. Best is trial 29 with value: 0.14327701317958927.
[I 2025-12-05 16:06:08,007] Trial 50 finished with value: 0.120228064074193 and parameters: {'model_type': 'mlp', 'hidden_dims': '[512, 128]', 'dropout': 0.12114464141934966, 'batch_norm': True, 'lr': 0.00024269847572083643, 'weight_decay': 8.799803022882236e-07, 'epochs': 71, 'loss': 'mae', 'optimizer': 'adam', 'graph_mode': 'off', 'use_snp_selection': True, 'num_snps': 26890}. Best is trial 29 with value: 0.14327701317958927.
[I 2025-12-05 16:06:10,991] Trial 51 finished with value: 0.1222112903153976 and parameters: {'model_type': 'mlp', 'hidden_dims': '[512, 256]', 'dropout': 0.14439889070601136, 'batch_norm': True, 'lr': 0.0005559939563406116, 'weight_decay': 3.271921403908541e-05, 'epochs': 183, 'loss': 'mae', 'optimizer': 'adam', 'graph_mode': 'off', 'use_snp_selection': False}. Best is trial 29 with value: 0.14327701317958927.
[I 2025-12-05 16:06:11,829] Trial 52 finished with value: 0.1245186524149744 and parameters: {'model_type': 'mlp', 'hidden_dims': '[128, 64]', 'dropout': 0.16372607486266444, 'batch_norm': True, 'lr': 0.0009527689953795378, 'weight_decay': 9.376044415529337e-05, 'epochs': 77, 'loss': 'mae', 'optimizer': 'adam', 'graph_mode': 'off', 'use_snp_selection': False}. Best is trial 29 with value: 0.14327701317958927.
