[I 2025-12-05 14:36:08,546] Trial 8 finished with value: 0.06608456546604054 and parameters: {'model_type': 'mlp', 'hidden_dims': '[512, 128]', 'dropout': 0.10743001231661406, 'batch_norm': True, 'lr': 0.00023728538449271062, 'weight_decay': 1.7629071578048637e-05, 'epochs': 312, 'loss': 'mae', 'optimizer': 'adam', 'graph_mode': 'off', 'use_snp_selection': False}. Best is trial 8 with value: 0.06608456546604054.
[I 2025-12-05 14:36:10,675] Trial 9 finished with value: 0.041890310116150964 and parameters: {'model_type': 'mlp', 'hidden_dims': '[512, 64]', 'dropout': 0.14505336736221927, 'batch_norm': True, 'lr': 5.8619638388111826e-05, 'weight_decay': 6.200156172669308e-07, 'epochs': 175, 'loss': 'mse', 'optimizer': 'adam', 'graph_mode': 'off', 'use_snp_selection': False}. Best is trial 8 with value: 0.06608456546604054.
[I 2025-12-05 14:36:11,855] Trial 10 finished with value: -0.009081682205071847 and parameters: {'model_type': 'mlp', 'hidden_dims': '[512, 128]', 'dropout': 0.2800030442581858, 'batch_norm': False, 'lr': 0.0004919806695968258, 'weight_decay': 2.9953888095455486e-06, 'epochs': 55, 'loss': 'mae', 'optimizer': 'adam', 'graph_mode': 'off', 'use_snp_selection': False}. Best is trial 8 with value: 0.06608456546604054.
[I 2025-12-05 14:36:13,412] Trial 11 finished with value: 0.06018441277265553 and parameters: {'model_type': 'mlp', 'hidden_dims': '[256, 128]', 'dropout': 0.5025533409127559, 'batch_norm': True, 'lr': 0.0004219456914890788, 'weight_decay': 7.0869802591332905e-06, 'epochs': 239, 'loss': 'mae', 'optimizer': 'adam', 'graph_mode': 'off', 'use_snp_selection': False}. Best is trial 8 with value: 0.06608456546604054.
[I 2025-12-05 14:36:16,260] Trial 12 finished with value: 0.06888577566908988 and parameters: {'model_type': 'mlp', 'hidden_dims': '[512, 128]', 'dropout': 0.5266996967984326, 'batch_norm': True, 'lr': 0.0006753264773209732, 'weight_decay': 4.19780668911197e-06, 'epochs': 268, 'loss': 'mae', 'optimizer': 'adam', 'graph_mode': 'off', 'use_snp_selection': False}. Best is trial 12 with value: 0.06888577566908988.
[I 2025-12-05 14:36:19,252] Trial 13 finished with value: 0.06611351281787843 and parameters: {'model_type': 'mlp', 'hidden_dims': '[512, 128]', 'dropout': 0.5982500509908173, 'batch_norm': True, 'lr': 0.00020263148232071683, 'weight_decay': 1.3270569831995856e-07, 'epochs': 285, 'loss': 'mae', 'optimizer': 'adam', 'graph_mode': 'off', 'use_snp_selection': False}. Best is trial 12 with value: 0.06888577566908988.
[I 2025-12-05 14:36:22,140] Trial 14 finished with value: 0.06340989253430968 and parameters: {'model_type': 'mlp', 'hidden_dims': '[512, 128]', 'dropout': 0.5942178628884591, 'batch_norm': True, 'lr': 0.0008506803461065948, 'weight_decay': 1.0693779105023437e-07, 'epochs': 271, 'loss': 'mae', 'optimizer': 'adam', 'graph_mode': 'off', 'use_snp_selection': False}. Best is trial 12 with value: 0.06888577566908988.
[I 2025-12-05 14:36:25,091] Trial 15 finished with value: 0.06351971855470576 and parameters: {'model_type': 'mlp', 'hidden_dims': '[512, 128]', 'dropout': 0.5144367504257366, 'batch_norm': True, 'lr': 0.00018429018027102804, 'weight_decay': 1.1898639415326074e-07, 'epochs': 280, 'loss': 'mae', 'optimizer': 'adam', 'graph_mode': 'off', 'use_snp_selection': False}. Best is trial 12 with value: 0.06888577566908988.
[I 2025-12-05 14:36:26,596] Trial 16 finished with value: 0.03333621903814298 and parameters: {'model_type': 'mlp', 'hidden_dims': '[256, 128, 64]', 'dropout': 0.5111246813448611, 'batch_norm': True, 'lr': 1.2586985041154999e-05, 'weight_decay': 5.376828182448362e-07, 'epochs': 220, 'loss': 'mae', 'optimizer': 'adam', 'graph_mode': 'off', 'use_snp_selection': False}. Best is trial 12 with value: 0.06888577566908988.
[I 2025-12-05 14:36:27,876] Trial 17 finished with value: 0.08772135417558738 and parameters: {'model_type': 'mlp', 'hidden_dims': '[128, 64]', 'dropout': 0.4599163501058064, 'batch_norm': True, 'lr': 0.00016638026344127548, 'weight_decay': 2.3701908176757326e-06, 'epochs': 350, 'loss': 'mae', 'optimizer': 'adam', 'graph_mode': 'off', 'use_snp_selection': False}. Best is trial 17 with value: 0.08772135417558738.
[I 2025-12-05 14:36:31,009] Trial 18 finished with value: 0.027090177097475392 and parameters: {'model_type': 'mlp', 'hidden_dims': '[128, 64]', 'dropout': 0.4754128740516746, 'batch_norm': False, 'lr': 0.0009945424108833958, 'weight_decay': 3.064974303311639e-06, 'epochs': 343, 'loss': 'mae', 'optimizer': 'adam', 'graph_mode': 'off', 'use_snp_selection': True, 'num_snps': 58241}. Best is trial 17 with value: 0.08772135417558738.
[I 2025-12-05 14:36:32,196] Trial 19 finished with value: 0.07796909101440112 and parameters: {'model_type': 'mlp', 'hidden_dims': '[128, 64]', 'dropout': 0.3427520541247875, 'batch_norm': True, 'lr': 0.00012041294723621694, 'weight_decay': 5.831190197918852e-05, 'epochs': 303, 'loss': 'mae', 'optimizer': 'adam', 'graph_mode': 'off', 'use_snp_selection': False}. Best is trial 17 with value: 0.08772135417558738.
[I 2025-12-05 14:36:33,423] Trial 20 finished with value: 0.04119122231413133 and parameters: {'model_type': 'mlp', 'hidden_dims': '[128, 64]', 'dropout': 0.29749533376445236, 'batch_norm': True, 'lr': 2.1781281816352762e-05, 'weight_decay': 6.926417629261016e-05, 'epochs': 304, 'loss': 'mae', 'optimizer': 'adam', 'graph_mode': 'off', 'use_snp_selection': False}. Best is trial 17 with value: 0.08772135417558738.
[I 2025-12-05 14:36:34,702] Trial 21 finished with value: 0.0649822198805617 and parameters: {'model_type': 'mlp', 'hidden_dims': '[128, 64]', 'dropout': 0.3426036956588672, 'batch_norm': True, 'lr': 0.00011467620668229786, 'weight_decay': 4.914729795317384e-05, 'epochs': 340, 'loss': 'mae', 'optimizer': 'adam', 'graph_mode': 'off', 'use_snp_selection': False}. Best is trial 17 with value: 0.08772135417558738.
[I 2025-12-05 14:36:35,813] Trial 22 finished with value: 0.07260618671623173 and parameters: {'model_type': 'mlp', 'hidden_dims': '[128, 64]', 'dropout': 0.339923934740363, 'batch_norm': True, 'lr': 0.00040986102716601946, 'weight_decay': 4.905653876075577e-06, 'epochs': 250, 'loss': 'mae', 'optimizer': 'adam', 'graph_mode': 'off', 'use_snp_selection': False}. Best is trial 17 with value: 0.08772135417558738.
[I 2025-12-05 14:36:36,922] Trial 23 finished with value: 0.038130211285222176 and parameters: {'model_type': 'mlp', 'hidden_dims': '[128, 64]', 'dropout': 0.33495264495145605, 'batch_norm': True, 'lr': 0.0003016140254855497, 'weight_decay': 1.337661036202276e-06, 'epochs': 241, 'loss': 'mae', 'optimizer': 'adam', 'graph_mode': 'off', 'use_snp_selection': False}. Best is trial 17 with value: 0.08772135417558738.
[I 2025-12-05 14:36:38,132] Trial 24 finished with value: 0.08227573200602106 and parameters: {'model_type': 'mlp', 'hidden_dims': '[128, 64]', 'dropout': 0.22781705951476033, 'batch_norm': True, 'lr': 0.00012933696064794652, 'weight_decay': 7.155673581155691e-06, 'epochs': 305, 'loss': 'mae', 'optimizer': 'adam', 'graph_mode': 'off', 'use_snp_selection': False}. Best is trial 17 with value: 0.08772135417558738.
[I 2025-12-05 14:36:39,325] Trial 25 finished with value: 0.05239695066969806 and parameters: {'model_type': 'mlp', 'hidden_dims': '[128, 64]', 'dropout': 0.20659399060640368, 'batch_norm': True, 'lr': 0.00012352064219229114, 'weight_decay': 0.00014050440775467148, 'epochs': 304, 'loss': 'mae', 'optimizer': 'adam', 'graph_mode': 'off', 'use_snp_selection': False}. Best is trial 17 with value: 0.08772135417558738.
[I 2025-12-05 14:36:40,796] Trial 26 finished with value: 0.003421823424449711 and parameters: {'model_type': 'mlp', 'hidden_dims': '[512, 256]', 'dropout': 0.23535513505962127, 'batch_norm': True, 'lr': 2.410216915457278e-05, 'weight_decay': 2.7621268693619026e-05, 'epochs': 346, 'loss': 'mae', 'optimizer': 'adam', 'graph_mode': 'off', 'use_snp_selection': True, 'num_snps': 3842}. Best is trial 17 with value: 0.08772135417558738.
[I 2025-12-05 14:36:42,021] Trial 27 finished with value: 0.03836979433803035 and parameters: {'model_type': 'mlp', 'hidden_dims': '[128, 64]', 'dropout': 0.4398230920191881, 'batch_norm': False, 'lr': 0.00011831276800468882, 'weight_decay': 1.1724904543661498e-05, 'epochs': 318, 'loss': 'mse', 'optimizer': 'adam', 'graph_mode': 'off', 'use_snp_selection': False}. Best is trial 17 with value: 0.08772135417558738.
[I 2025-12-05 14:36:43,215] Trial 28 finished with value: 0.05911961366944328 and parameters: {'model_type': 'mlp', 'hidden_dims': '[128, 64]', 'dropout': 0.3097576240923586, 'batch_norm': True, 'lr': 3.4427570204585426e-05, 'weight_decay': 0.00011837572117061313, 'epochs': 298, 'loss': 'mae', 'optimizer': 'adam', 'graph_mode': 'off', 'use_snp_selection': False}. Best is trial 17 with value: 0.08772135417558738.
[I 2025-12-05 14:36:45,091] Trial 29 finished with value: 0.03837390807770961 and parameters: {'model_type': 'mlp', 'hidden_dims': '[128, 64]', 'dropout': 0.2035778430764378, 'batch_norm': True, 'lr': 9.345238257437386e-05, 'weight_decay': 1.4150202614091664e-06, 'epochs': 325, 'loss': 'mae', 'optimizer': 'adam', 'graph_mode': 'off', 'use_snp_selection': True, 'num_snps': 19468}. Best is trial 17 with value: 0.08772135417558738.
[I 2025-12-05 14:36:46,119] Trial 30 finished with value: 0.06795575462627462 and parameters: {'model_type': 'mlp', 'hidden_dims': '[128, 64]', 'dropout': 0.3793685140055152, 'batch_norm': True, 'lr': 1.1281795970494639e-05, 'weight_decay': 4.029193824372828e-05, 'epochs': 220, 'loss': 'mae', 'optimizer': 'adam', 'graph_mode': 'off', 'use_snp_selection': False}. Best is trial 17 with value: 0.08772135417558738.
[I 2025-12-05 14:36:47,221] Trial 31 finished with value: 0.06559697948305257 and parameters: {'model_type': 'mlp', 'hidden_dims': '[128, 64]', 'dropout': 0.35462618535872276, 'batch_norm': True, 'lr': 0.000365352464946841, 'weight_decay': 8.395367828979135e-06, 'epochs': 258, 'loss': 'mae', 'optimizer': 'adam', 'graph_mode': 'off', 'use_snp_selection': False}. Best is trial 17 with value: 0.08772135417558738.
[I 2025-12-05 14:36:48,532] Trial 32 finished with value: 0.05798577934755787 and parameters: {'model_type': 'mlp', 'hidden_dims': '[128, 64]', 'dropout': 0.2532964377757325, 'batch_norm': True, 'lr': 0.00016974569843833327, 'weight_decay': 5.17283492828597e-06, 'epochs': 349, 'loss': 'mae', 'optimizer': 'adam', 'graph_mode': 'off', 'use_snp_selection': False}. Best is trial 17 with value: 0.08772135417558738.
[I 2025-12-05 14:36:49,619] Trial 33 finished with value: 0.07842706650998098 and parameters: {'model_type': 'mlp', 'hidden_dims': '[128, 64]', 'dropout': 0.44002450541205806, 'batch_norm': True, 'lr': 0.000561960363016282, 'weight_decay': 1.5216430545982026e-05, 'epochs': 255, 'loss': 'mae', 'optimizer': 'adam', 'graph_mode': 'off', 'use_snp_selection': False}. Best is trial 17 with value: 0.08772135417558738.
[I 2025-12-05 14:36:51,404] Trial 34 finished with value: 0.06555794887581273 and parameters: {'model_type': 'mlp', 'hidden_dims': '[256, 128, 64]', 'dropout': 0.44042917814623106, 'batch_norm': True, 'lr': 0.0002757335397113392, 'weight_decay': 1.544133825171339e-05, 'epochs': 293, 'loss': 'mae', 'optimizer': 'adam', 'graph_mode': 'off', 'use_snp_selection': False}. Best is trial 17 with value: 0.08772135417558738.
[I 2025-12-05 14:36:52,592] Trial 35 finished with value: 0.05479465461759324 and parameters: {'model_type': 'mlp', 'hidden_dims': '[128, 64]', 'dropout': 0.47656250797170563, 'batch_norm': False, 'lr': 0.0005481233635235851, 'weight_decay': 8.731217283902514e-05, 'epochs': 322, 'loss': 'mae', 'optimizer': 'adam', 'graph_mode': 'off', 'use_snp_selection': False}. Best is trial 17 with value: 0.08772135417558738.
[I 2025-12-05 14:36:57,520] Trial 36 finished with value: 0.0596839453597838 and parameters: {'model_type': 'mlp', 'hidden_dims': '[512, 256]', 'dropout': 0.4224802260079553, 'batch_norm': True, 'lr': 8.65867776251155e-05, 'weight_decay': 2.4865719644511114e-05, 'epochs': 328, 'loss': 'mse', 'optimizer': 'adam', 'graph_mode': 'off', 'use_snp_selection': True, 'num_snps': 58661}. Best is trial 17 with value: 0.08772135417558738.
[I 2025-12-05 14:36:59,041] Trial 37 finished with value: 0.05064650741707461 and parameters: {'model_type': 'mlp', 'hidden_dims': '[256, 128]', 'dropout': 0.5503388319480289, 'batch_norm': True, 'lr': 4.350549331735279e-05, 'weight_decay': 0.00027176669497101704, 'epochs': 220, 'loss': 'mae', 'optimizer': 'adam', 'graph_mode': 'off', 'use_snp_selection': False}. Best is trial 17 with value: 0.08772135417558738.
[I 2025-12-05 14:37:01,095] Trial 38 finished with value: 0.032851709151397485 and parameters: {'model_type': 'mlp', 'hidden_dims': '[512, 64]', 'dropout': 0.4634843905908045, 'batch_norm': False, 'lr': 0.0001310416438899666, 'weight_decay': 0.0005512864784386326, 'epochs': 267, 'loss': 'mse', 'optimizer': 'adam', 'graph_mode': 'off', 'use_snp_selection': True, 'num_snps': 19911}. Best is trial 17 with value: 0.08772135417558738.
[I 2025-12-05 14:37:02,296] Trial 39 finished with value: 0.06532086323302505 and parameters: {'model_type': 'mlp', 'hidden_dims': '[128, 64]', 'dropout': 0.40491549826838436, 'batch_norm': True, 'lr': 0.0006619623432259872, 'weight_decay': 1.9425176967128865e-06, 'epochs': 290, 'loss': 'mae', 'optimizer': 'adam', 'graph_mode': 'off', 'use_snp_selection': False}. Best is trial 17 with value: 0.08772135417558738.
[I 2025-12-05 14:37:03,285] Trial 40 finished with value: 0.004355388526552391 and parameters: {'model_type': 'mlp', 'hidden_dims': '[128, 64]', 'dropout': 0.5593997109366773, 'batch_norm': True, 'lr': 4.767147905519569e-06, 'weight_decay': 1.6205370846489715e-05, 'epochs': 200, 'loss': 'mae', 'optimizer': 'adam', 'graph_mode': 'off', 'use_snp_selection': False}. Best is trial 17 with value: 0.08772135417558738.
[I 2025-12-05 14:37:04,225] Trial 41 finished with value: 0.013878104616357936 and parameters: {'model_type': 'mlp', 'hidden_dims': '[128, 64]', 'dropout': 0.3685140766179563, 'batch_norm': True, 'lr': 2.320370617557869e-06, 'weight_decay': 5.755186574982408e-06, 'epochs': 178, 'loss': 'mae', 'optimizer': 'adam', 'graph_mode': 'off', 'use_snp_selection': False}. Best is trial 17 with value: 0.08772135417558738.
[I 2025-12-05 14:37:05,343] Trial 42 finished with value: 0.06178593197111552 and parameters: {'model_type': 'mlp', 'hidden_dims': '[128, 64]', 'dropout': 0.17436115543477543, 'batch_norm': True, 'lr': 0.0003783653910739066, 'weight_decay': 9.479065685796122e-06, 'epochs': 259, 'loss': 'mae', 'optimizer': 'adam', 'graph_mode': 'off', 'use_snp_selection': False}. Best is trial 17 with value: 0.08772135417558738.
[I 2025-12-05 14:37:06,990] Trial 43 finished with value: 0.06377133897098372 and parameters: {'model_type': 'mlp', 'hidden_dims': '[256, 128, 64]', 'dropout': 0.3168784471206296, 'batch_norm': True, 'lr': 0.0002578842625055091, 'weight_decay': 2.608867946025606e-06, 'epochs': 253, 'loss': 'mae', 'optimizer': 'adam', 'graph_mode': 'off', 'use_snp_selection': False}. Best is trial 17 with value: 0.08772135417558738.
[I 2025-12-05 14:37:08,197] Trial 44 finished with value: 0.07330470942152653 and parameters: {'model_type': 'mlp', 'hidden_dims': '[128, 64]', 'dropout': 0.2840082185488925, 'batch_norm': True, 'lr': 0.0001560377555468889, 'weight_decay': 3.944470553401005e-05, 'epochs': 310, 'loss': 'mae', 'optimizer': 'adam', 'graph_mode': 'off', 'use_snp_selection': False}. Best is trial 17 with value: 0.08772135417558738.
[I 2025-12-05 14:37:11,561] Trial 45 finished with value: 0.06105344909881891 and parameters: {'model_type': 'mlp', 'hidden_dims': '[512, 64]', 'dropout': 0.2743674406401928, 'batch_norm': True, 'lr': 8.343858072995094e-05, 'weight_decay': 3.1296201119708046e-05, 'epochs': 333, 'loss': 'mse', 'optimizer': 'adam', 'graph_mode': 'off', 'use_snp_selection': False}. Best is trial 17 with value: 0.08772135417558738.
[I 2025-12-05 14:37:12,759] Trial 46 finished with value: 0.06578114353553657 and parameters: {'model_type': 'mlp', 'hidden_dims': '[128, 64]', 'dropout': 0.23444086219685933, 'batch_norm': True, 'lr': 0.00016069026288773855, 'weight_decay': 0.0001691084616783242, 'epochs': 310, 'loss': 'mae', 'optimizer': 'adam', 'graph_mode': 'off', 'use_snp_selection': False}. Best is trial 17 with value: 0.08772135417558738.
[I 2025-12-05 14:37:14,460] Trial 47 finished with value: 0.030696561890995146 and parameters: {'model_type': 'mlp', 'hidden_dims': '[256, 128]', 'dropout': 0.29007072795092376, 'batch_norm': False, 'lr': 5.9114337691609054e-05, 'weight_decay': 5.686622540758968e-05, 'epochs': 286, 'loss': 'mae', 'optimizer': 'adam', 'graph_mode': 'off', 'use_snp_selection': False}. Best is trial 17 with value: 0.08772135417558738.
[I 2025-12-05 14:37:16,090] Trial 48 finished with value: 0.05716666964504888 and parameters: {'model_type': 'mlp', 'hidden_dims': '[512, 256]', 'dropout': 0.3973433937462469, 'batch_norm': True, 'lr': 4.263329453630007e-05, 'weight_decay': 8.154222412848483e-07, 'epochs': 110, 'loss': 'mae', 'optimizer': 'adam', 'graph_mode': 'off', 'use_snp_selection': False}. Best is trial 17 with value: 0.08772135417558738.
[I 2025-12-05 14:37:18,769] Trial 49 finished with value: 0.050363688737119515 and parameters: {'model_type': 'mlp', 'hidden_dims': '[128, 64]', 'dropout': 0.25837185247452465, 'batch_norm': True, 'lr': 0.00022001675105641204, 'weight_decay': 1.4629906771891882e-05, 'epochs': 313, 'loss': 'mse', 'optimizer': 'adam', 'graph_mode': 'off', 'use_snp_selection': True, 'num_snps': 46888}. Best is trial 17 with value: 0.08772135417558738.
[I 2025-12-05 14:37:20,015] Trial 50 finished with value: 0.06622217530212976 and parameters: {'model_type': 'mlp', 'hidden_dims': '[128, 64]', 'dropout': 0.16980553949479957, 'batch_norm': True, 'lr': 6.26155126681414e-05, 'weight_decay': 1.975453923099614e-05, 'epochs': 331, 'loss': 'mae', 'optimizer': 'adam', 'graph_mode': 'off', 'use_snp_selection': False}. Best is trial 17 with value: 0.08772135417558738.
[I 2025-12-05 14:37:21,156] Trial 51 finished with value: 0.06522537674568661 and parameters: {'model_type': 'mlp', 'hidden_dims': '[128, 64]', 'dropout': 0.3250795119862769, 'batch_norm': True, 'lr': 0.0005455456715190229, 'weight_decay': 3.7871214065484776e-06, 'epochs': 277, 'loss': 'mae', 'optimizer': 'adam', 'graph_mode': 'off', 'use_snp_selection': False}. Best is trial 17 with value: 0.08772135417558738.
[I 2025-12-05 14:37:22,211] Trial 52 finished with value: 0.06862552806465144 and parameters: {'model_type': 'mlp', 'hidden_dims': '[128, 64]', 'dropout': 0.35611946565235586, 'batch_norm': True, 'lr': 0.00035876031116694417, 'weight_decay': 7.0565772386891106e-06, 'epochs': 232, 'loss': 'mae', 'optimizer': 'adam', 'graph_mode': 'off', 'use_snp_selection': False}. Best is trial 17 with value: 0.08772135417558738.
[I 2025-12-05 14:37:23,437] Trial 53 finished with value: 0.07373226608581185 and parameters: {'model_type': 'mlp', 'hidden_dims': '[128, 64]', 'dropout': 0.4272447078194701, 'batch_norm': True, 'lr': 0.00015222281826311453, 'weight_decay': 3.8550763414421504e-05, 'epochs': 300, 'loss': 'mae', 'optimizer': 'adam', 'graph_mode': 'off', 'use_snp_selection': False}. Best is trial 17 with value: 0.08772135417558738.
[I 2025-12-05 14:37:24,626] Trial 54 finished with value: 0.06913087890584442 and parameters: {'model_type': 'mlp', 'hidden_dims': '[128, 64]', 'dropout': 0.4617008336235243, 'batch_norm': True, 'lr': 0.00014382010895917197, 'weight_decay': 3.792523005748169e-05, 'epochs': 301, 'loss': 'mae', 'optimizer': 'adam', 'graph_mode': 'off', 'use_snp_selection': False}. Best is trial 17 with value: 0.08772135417558738.
[I 2025-12-05 14:37:25,712] Trial 55 finished with value: 0.05977859791717001 and parameters: {'model_type': 'mlp', 'hidden_dims': '[512, 64]', 'dropout': 0.4187590919679571, 'batch_norm': True, 'lr': 0.00018612125958238955, 'weight_decay': 8.200316864431122e-05, 'epochs': 42, 'loss': 'mae', 'optimizer': 'adam', 'graph_mode': 'off', 'use_snp_selection': False}. Best is trial 17 with value: 0.08772135417558738.
[I 2025-12-05 14:37:27,614] Trial 56 finished with value: 0.04813525882880153 and parameters: {'model_type': 'mlp', 'hidden_dims': '[256, 128, 64]', 'dropout': 0.48730503729305286, 'batch_norm': True, 'lr': 8.033811687766755e-05, 'weight_decay': 5.307628608400122e-05, 'epochs': 311, 'loss': 'mae', 'optimizer': 'adam', 'graph_mode': 'off', 'use_snp_selection': False}. Best is trial 17 with value: 0.08772135417558738.
[I 2025-12-05 14:37:28,885] Trial 57 finished with value: 0.06280954480130346 and parameters: {'model_type': 'mlp', 'hidden_dims': '[128, 64]', 'dropout': 0.37797899576868105, 'batch_norm': True, 'lr': 0.00010848778462144672, 'weight_decay': 0.00010558184946015055, 'epochs': 336, 'loss': 'mae', 'optimizer': 'adam', 'graph_mode': 'off', 'use_snp_selection': False}. Best is trial 17 with value: 0.08772135417558738.
[I 2025-12-05 14:37:30,567] Trial 58 finished with value: 0.05119006886679671 and parameters: {'model_type': 'mlp', 'hidden_dims': '[256, 128]', 'dropout': 0.43524333675846805, 'batch_norm': False, 'lr': 0.00021643673008251788, 'weight_decay': 0.0001884565641708786, 'epochs': 277, 'loss': 'mae', 'optimizer': 'adam', 'graph_mode': 'off', 'use_snp_selection': False}. Best is trial 17 with value: 0.08772135417558738.
[I 2025-12-05 14:37:31,726] Trial 59 finished with value: 0.06266913970068894 and parameters: {'model_type': 'mlp', 'hidden_dims': '[128, 64]', 'dropout': 0.45033327677454105, 'batch_norm': True, 'lr': 0.0008124203504309938, 'weight_decay': 2.0185389668636742e-07, 'epochs': 291, 'loss': 'mae', 'optimizer': 'adam', 'graph_mode': 'off', 'use_snp_selection': False}. Best is trial 17 with value: 0.08772135417558738.
