[I 2025-12-05 15:46:31,738] Trial 40 finished with value: 0.05358387844789544 and parameters: {'model_type': 'mlp', 'hidden_dims': '[512, 128]', 'dropout': 0.41858878995830845, 'batch_norm': True, 'lr': 0.0004038105135386828, 'weight_decay': 0.0004792874504662855, 'epochs': 347, 'loss': 'mae', 'optimizer': 'adam', 'graph_mode': 'off', 'use_snp_selection': False}. Best is trial 28 with value: 0.07285477084026545.
[I 2025-12-05 15:46:33,026] Trial 41 finished with value: 0.06284968666159141 and parameters: {'model_type': 'mlp', 'hidden_dims': '[512, 256]', 'dropout': 0.4031790738440594, 'batch_norm': True, 'lr': 0.00019785898422677815, 'weight_decay': 0.0006543436293899061, 'epochs': 149, 'loss': 'mae', 'optimizer': 'adam', 'graph_mode': 'off', 'use_snp_selection': False}. Best is trial 28 with value: 0.07285477084026545.
[I 2025-12-05 15:46:34,303] Trial 42 finished with value: 0.058627072091579135 and parameters: {'model_type': 'mlp', 'hidden_dims': '[512, 256]', 'dropout': 0.3668203050891774, 'batch_norm': True, 'lr': 0.0006437777260131975, 'weight_decay': 0.0008973162838293528, 'epochs': 141, 'loss': 'mae', 'optimizer': 'adam', 'graph_mode': 'off', 'use_snp_selection': False}. Best is trial 28 with value: 0.07285477084026545.
[I 2025-12-05 15:46:35,594] Trial 43 finished with value: 0.06484047664003395 and parameters: {'model_type': 'mlp', 'hidden_dims': '[512, 256]', 'dropout': 0.4003948640098791, 'batch_norm': True, 'lr': 2.1409924724993155e-06, 'weight_decay': 0.0005830497803832184, 'epochs': 152, 'loss': 'mae', 'optimizer': 'adam', 'graph_mode': 'off', 'use_snp_selection': False}. Best is trial 28 with value: 0.07285477084026545.
[I 2025-12-05 15:46:36,718] Trial 44 finished with value: -0.03385591803658774 and parameters: {'model_type': 'mlp', 'hidden_dims': '[512, 256]', 'dropout': 0.40976114755964765, 'batch_norm': True, 'lr': 3.354277716160162e-06, 'weight_decay': 0.0005867564801162543, 'epochs': 105, 'loss': 'mae', 'optimizer': 'adam', 'graph_mode': 'off', 'use_snp_selection': False}. Best is trial 28 with value: 0.07285477084026545.
[I 2025-12-05 15:46:37,991] Trial 45 finished with value: -0.03094479298805209 and parameters: {'model_type': 'mlp', 'hidden_dims': '[512, 256]', 'dropout': 0.403307919712122, 'batch_norm': False, 'lr': 0.00034070382817265164, 'weight_decay': 0.00034504258039140886, 'epochs': 150, 'loss': 'mse', 'optimizer': 'adam', 'graph_mode': 'off', 'use_snp_selection': False}. Best is trial 28 with value: 0.07285477084026545.
[I 2025-12-05 15:46:39,197] Trial 46 finished with value: 0.019404837784625765 and parameters: {'model_type': 'mlp', 'hidden_dims': '[512, 256]', 'dropout': 0.44900399532934754, 'batch_norm': True, 'lr': 1.7264456665933285e-06, 'weight_decay': 0.0007468062933825737, 'epochs': 128, 'loss': 'mae', 'optimizer': 'adam', 'graph_mode': 'off', 'use_snp_selection': False}. Best is trial 28 with value: 0.07285477084026545.
[I 2025-12-05 15:46:40,662] Trial 47 finished with value: 0.0017794197357909587 and parameters: {'model_type': 'mlp', 'hidden_dims': '[512, 64]', 'dropout': 0.5237604760113482, 'batch_norm': True, 'lr': 6.176987947745968e-06, 'weight_decay': 0.0002099062970579514, 'epochs': 191, 'loss': 'mae', 'optimizer': 'adam', 'graph_mode': 'off', 'use_snp_selection': False}. Best is trial 28 with value: 0.07285477084026545.
[I 2025-12-05 15:46:41,898] Trial 48 finished with value: 0.016391291063175776 and parameters: {'model_type': 'mlp', 'hidden_dims': '[512, 256]', 'dropout': 0.3682019171380903, 'batch_norm': False, 'lr': 1.1170552432785515e-06, 'weight_decay': 0.00036681457399593236, 'epochs': 138, 'loss': 'mae', 'optimizer': 'adam', 'graph_mode': 'off', 'use_snp_selection': False}. Best is trial 28 with value: 0.07285477084026545.
[I 2025-12-05 15:46:44,460] Trial 49 finished with value: 0.04224962857525706 and parameters: {'model_type': 'mlp', 'hidden_dims': '[512, 256]', 'dropout': 0.3896704646289101, 'batch_norm': True, 'lr': 7.64009467139208e-05, 'weight_decay': 1.4848215713003218e-06, 'epochs': 158, 'loss': 'mse', 'optimizer': 'adam', 'graph_mode': 'off', 'use_snp_selection': True, 'num_snps': 46888}. Best is trial 28 with value: 0.07285477084026545.
[I 2025-12-05 15:46:46,009] Trial 50 finished with value: 0.03539879465781786 and parameters: {'model_type': 'mlp', 'hidden_dims': '[512, 256]', 'dropout': 0.44315907190943915, 'batch_norm': True, 'lr': 2.6693831717472616e-06, 'weight_decay': 5.664403579929205e-06, 'epochs': 207, 'loss': 'mae', 'optimizer': 'adam', 'graph_mode': 'off', 'use_snp_selection': False}. Best is trial 28 with value: 0.07285477084026545.
[I 2025-12-05 15:46:47,039] Trial 51 finished with value: 0.0446385121312456 and parameters: {'model_type': 'mlp', 'hidden_dims': '[256, 128]', 'dropout': 0.30662751579742326, 'batch_norm': True, 'lr': 0.00013579419084949984, 'weight_decay': 0.00041758941754815236, 'epochs': 178, 'loss': 'mae', 'optimizer': 'adam', 'graph_mode': 'off', 'use_snp_selection': False}. Best is trial 28 with value: 0.07285477084026545.
[I 2025-12-05 15:46:48,246] Trial 52 finished with value: 0.05118281901630564 and parameters: {'model_type': 'mlp', 'hidden_dims': '[512, 128]', 'dropout': 0.35151338171985624, 'batch_norm': True, 'lr': 0.0002465805447438235, 'weight_decay': 0.00015708254017785187, 'epochs': 113, 'loss': 'mae', 'optimizer': 'adam', 'graph_mode': 'off', 'use_snp_selection': False}. Best is trial 28 with value: 0.07285477084026545.
[I 2025-12-05 15:46:49,595] Trial 53 finished with value: 0.05973311508804465 and parameters: {'model_type': 'mlp', 'hidden_dims': '[512, 256]', 'dropout': 0.2616997670323544, 'batch_norm': True, 'lr': 4.697191761851523e-05, 'weight_decay': 0.0009420802583440264, 'epochs': 154, 'loss': 'mae', 'optimizer': 'adam', 'graph_mode': 'off', 'use_snp_selection': False}. Best is trial 28 with value: 0.07285477084026545.
[I 2025-12-05 15:46:50,391] Trial 54 finished with value: 0.038455613160751995 and parameters: {'model_type': 'mlp', 'hidden_dims': '[256, 128]', 'dropout': 0.33168320079354086, 'batch_norm': True, 'lr': 0.00028507457524769585, 'weight_decay': 1.5256043513854728e-05, 'epochs': 68, 'loss': 'mae', 'optimizer': 'adam', 'graph_mode': 'off', 'use_snp_selection': False}. Best is trial 28 with value: 0.07285477084026545.
[I 2025-12-05 15:46:51,219] Trial 55 finished with value: 0.0016084007578298226 and parameters: {'model_type': 'mlp', 'hidden_dims': '[128, 64]', 'dropout': 0.3727435102221396, 'batch_norm': True, 'lr': 1.059463410055633e-05, 'weight_decay': 0.0006771377942765462, 'epochs': 174, 'loss': 'mae', 'optimizer': 'adam', 'graph_mode': 'off', 'use_snp_selection': False}. Best is trial 28 with value: 0.07285477084026545.
[I 2025-12-05 15:46:52,120] Trial 56 finished with value: 0.018153834465431926 and parameters: {'model_type': 'mlp', 'hidden_dims': '[256, 128, 64]', 'dropout': 0.4307107589961463, 'batch_norm': True, 'lr': 5.96520772872591e-05, 'weight_decay': 0.0002340764611343676, 'epochs': 128, 'loss': 'mae', 'optimizer': 'adam', 'graph_mode': 'off', 'use_snp_selection': False}. Best is trial 28 with value: 0.07285477084026545.
[I 2025-12-05 15:46:53,652] Trial 57 finished with value: 0.009542819784524037 and parameters: {'model_type': 'mlp', 'hidden_dims': '[512, 64]', 'dropout': 0.28786682119576257, 'batch_norm': False, 'lr': 0.0009886658250254767, 'weight_decay': 7.135610042440607e-05, 'epochs': 224, 'loss': 'mae', 'optimizer': 'adam', 'graph_mode': 'off', 'use_snp_selection': False}. Best is trial 28 with value: 0.07285477084026545.
[I 2025-12-05 15:46:55,132] Trial 58 finished with value: 0.06817093150110867 and parameters: {'model_type': 'mlp', 'hidden_dims': '[512, 256]', 'dropout': 0.35293091530827425, 'batch_norm': True, 'lr': 0.00020278016661742706, 'weight_decay': 0.0001306236667586311, 'epochs': 198, 'loss': 'mae', 'optimizer': 'adam', 'graph_mode': 'off', 'use_snp_selection': False}. Best is trial 28 with value: 0.07285477084026545.
[I 2025-12-05 15:46:56,558] Trial 59 finished with value: 0.04794861689320287 and parameters: {'model_type': 'mlp', 'hidden_dims': '[512, 256]', 'dropout': 0.4066213962309633, 'batch_norm': True, 'lr': 0.00014494519078651932, 'weight_decay': 0.00014144043448895884, 'epochs': 189, 'loss': 'mae', 'optimizer': 'adam', 'graph_mode': 'off', 'use_snp_selection': False}. Best is trial 28 with value: 0.07285477084026545.
[I 2025-12-05 15:46:58,224] Trial 60 finished with value: 0.04379558878308809 and parameters: {'model_type': 'mlp', 'hidden_dims': '[512, 256]', 'dropout': 0.35417427450133243, 'batch_norm': True, 'lr': 0.00037775337910346475, 'weight_decay': 2.7700247415711025e-07, 'epochs': 257, 'loss': 'mae', 'optimizer': 'adam', 'graph_mode': 'off', 'use_snp_selection': False}. Best is trial 28 with value: 0.07285477084026545.
[I 2025-12-05 15:46:59,684] Trial 61 finished with value: 0.03633569674199953 and parameters: {'model_type': 'mlp', 'hidden_dims': '[512, 256]', 'dropout': 0.38372696988808724, 'batch_norm': True, 'lr': 0.0002122374410809072, 'weight_decay': 5.7957277118313046e-05, 'epochs': 199, 'loss': 'mae', 'optimizer': 'adam', 'graph_mode': 'off', 'use_snp_selection': False}. Best is trial 28 with value: 0.07285477084026545.
[I 2025-12-05 15:47:01,012] Trial 62 finished with value: 0.031188775478552533 and parameters: {'model_type': 'mlp', 'hidden_dims': '[512, 256]', 'dropout': 0.3244698052156828, 'batch_norm': True, 'lr': 0.0006360904600910955, 'weight_decay': 0.00028150529279662937, 'epochs': 145, 'loss': 'mae', 'optimizer': 'adam', 'graph_mode': 'off', 'use_snp_selection': False}. Best is trial 28 with value: 0.07285477084026545.
[I 2025-12-05 15:47:02,053] Trial 63 finished with value: 0.0660322774702805 and parameters: {'model_type': 'mlp', 'hidden_dims': '[256, 128]', 'dropout': 0.4674531834741066, 'batch_norm': True, 'lr': 0.00029794352981305227, 'weight_decay': 2.705472615073652e-05, 'epochs': 173, 'loss': 'mae', 'optimizer': 'adam', 'graph_mode': 'off', 'use_snp_selection': False}. Best is trial 28 with value: 0.07285477084026545.
[I 2025-12-05 15:47:03,515] Trial 64 finished with value: 0.05184757131821857 and parameters: {'model_type': 'mlp', 'hidden_dims': '[512, 256]', 'dropout': 0.46216972334707285, 'batch_norm': True, 'lr': 0.0003037073853535807, 'weight_decay': 2.7951073615991684e-05, 'epochs': 182, 'loss': 'mae', 'optimizer': 'adam', 'graph_mode': 'off', 'use_snp_selection': False}. Best is trial 28 with value: 0.07285477084026545.
[I 2025-12-05 15:47:04,531] Trial 65 finished with value: 0.04111041592307011 and parameters: {'model_type': 'mlp', 'hidden_dims': '[256, 128]', 'dropout': 0.485631844996017, 'batch_norm': True, 'lr': 0.0004573426263270882, 'weight_decay': 2.52434010511629e-06, 'epochs': 170, 'loss': 'mae', 'optimizer': 'adam', 'graph_mode': 'off', 'use_snp_selection': False}. Best is trial 28 with value: 0.07285477084026545.
[I 2025-12-05 15:47:05,813] Trial 66 finished with value: 0.03452326768194696 and parameters: {'model_type': 'mlp', 'hidden_dims': '[512, 256]', 'dropout': 0.4214959485406591, 'batch_norm': True, 'lr': 0.0001043598518340379, 'weight_decay': 1.273869802624982e-05, 'epochs': 137, 'loss': 'mae', 'optimizer': 'adam', 'graph_mode': 'off', 'use_snp_selection': False}. Best is trial 28 with value: 0.07285477084026545.
[I 2025-12-05 15:47:07,320] Trial 67 finished with value: 0.010792336307266386 and parameters: {'model_type': 'mlp', 'hidden_dims': '[512, 256]', 'dropout': 0.5446822256008149, 'batch_norm': True, 'lr': 0.0001321586100045837, 'weight_decay': 8.135584609528155e-06, 'epochs': 160, 'loss': 'mae', 'optimizer': 'adam', 'graph_mode': 'off', 'use_snp_selection': True, 'num_snps': 22951}. Best is trial 28 with value: 0.07285477084026545.
[I 2025-12-05 15:47:08,795] Trial 68 finished with value: 0.03557498192786865 and parameters: {'model_type': 'mlp', 'hidden_dims': '[512, 128]', 'dropout': 0.5134808491546651, 'batch_norm': True, 'lr': 0.0002047016930549844, 'weight_decay': 0.0003157179261608883, 'epochs': 199, 'loss': 'mse', 'optimizer': 'adam', 'graph_mode': 'off', 'use_snp_selection': False}. Best is trial 28 with value: 0.07285477084026545.
[I 2025-12-05 15:47:09,963] Trial 69 finished with value: 0.0036832742685093244 and parameters: {'model_type': 'mlp', 'hidden_dims': '[512, 256]', 'dropout': 0.5761421287871068, 'batch_norm': False, 'lr': 0.00016101880618088872, 'weight_decay': 0.000572625661096167, 'epochs': 119, 'loss': 'mae', 'optimizer': 'adam', 'graph_mode': 'off', 'use_snp_selection': False}. Best is trial 28 with value: 0.07285477084026545.
[I 2025-12-05 15:47:10,854] Trial 70 finished with value: 0.061528652165664846 and parameters: {'model_type': 'mlp', 'hidden_dims': '[128, 64]', 'dropout': 0.4654756618466549, 'batch_norm': True, 'lr': 0.0005507412870409575, 'weight_decay': 2.2925865430406624e-05, 'epochs': 226, 'loss': 'mae', 'optimizer': 'adam', 'graph_mode': 'off', 'use_snp_selection': False}. Best is trial 28 with value: 0.07285477084026545.
[I 2025-12-05 15:47:11,819] Trial 71 finished with value: 0.06712600841227138 and parameters: {'model_type': 'mlp', 'hidden_dims': '[256, 128]', 'dropout': 0.2783823842349635, 'batch_norm': True, 'lr': 0.000254980922960764, 'weight_decay': 4.483447096310773e-05, 'epochs': 169, 'loss': 'mae', 'optimizer': 'adam', 'graph_mode': 'off', 'use_snp_selection': False}. Best is trial 28 with value: 0.07285477084026545.
[I 2025-12-05 15:47:12,787] Trial 72 finished with value: 0.0508016382831066 and parameters: {'model_type': 'mlp', 'hidden_dims': '[256, 128]', 'dropout': 0.18294931676124537, 'batch_norm': True, 'lr': 0.0002531512367983587, 'weight_decay': 4.394489525796142e-05, 'epochs': 171, 'loss': 'mae', 'optimizer': 'adam', 'graph_mode': 'off', 'use_snp_selection': False}. Best is trial 28 with value: 0.07285477084026545.
[I 2025-12-05 15:47:13,710] Trial 73 finished with value: 0.05017185068781826 and parameters: {'model_type': 'mlp', 'hidden_dims': '[256, 128]', 'dropout': 0.4898127318744972, 'batch_norm': True, 'lr': 0.00032517564105867866, 'weight_decay': 0.0001407487066329979, 'epochs': 147, 'loss': 'mae', 'optimizer': 'adam', 'graph_mode': 'off', 'use_snp_selection': False}. Best is trial 28 with value: 0.07285477084026545.
[I 2025-12-05 15:47:14,778] Trial 74 finished with value: 0.06947213102885114 and parameters: {'model_type': 'mlp', 'hidden_dims': '[256, 128]', 'dropout': 0.2758918193184572, 'batch_norm': True, 'lr': 0.00039582595946228256, 'weight_decay': 5.254309778320812e-06, 'epochs': 208, 'loss': 'mae', 'optimizer': 'adam', 'graph_mode': 'off', 'use_snp_selection': False}. Best is trial 28 with value: 0.07285477084026545.
[I 2025-12-05 15:47:15,904] Trial 75 finished with value: 0.052402943850738085 and parameters: {'model_type': 'mlp', 'hidden_dims': '[256, 128]', 'dropout': 0.2749892222156173, 'batch_norm': True, 'lr': 0.0004085924705030096, 'weight_decay': 5.769264355726539e-06, 'epochs': 249, 'loss': 'mae', 'optimizer': 'adam', 'graph_mode': 'off', 'use_snp_selection': False}. Best is trial 28 with value: 0.07285477084026545.
[I 2025-12-05 15:47:16,942] Trial 76 finished with value: 0.08344585181759384 and parameters: {'model_type': 'mlp', 'hidden_dims': '[256, 128]', 'dropout': 0.24301170820556472, 'batch_norm': True, 'lr': 0.000752516601294161, 'weight_decay': 3.839652209307762e-06, 'epochs': 207, 'loss': 'mae', 'optimizer': 'adam', 'graph_mode': 'off', 'use_snp_selection': False}. Best is trial 76 with value: 0.08344585181759384.
[I 2025-12-05 15:47:18,022] Trial 77 finished with value: 0.04811976023532685 and parameters: {'model_type': 'mlp', 'hidden_dims': '[256, 128]', 'dropout': 0.24607341721594012, 'batch_norm': True, 'lr': 0.0007652938415739099, 'weight_decay': 3.160775576416013e-06, 'epochs': 210, 'loss': 'mae', 'optimizer': 'adam', 'graph_mode': 'off', 'use_snp_selection': False}. Best is trial 76 with value: 0.08344585181759384.
[I 2025-12-05 15:47:18,913] Trial 78 finished with value: 0.08363337388283676 and parameters: {'model_type': 'mlp', 'hidden_dims': '[256, 128]', 'dropout': 0.2204999068908705, 'batch_norm': True, 'lr': 0.0006595732082157841, 'weight_decay': 4.371131478784431e-06, 'epochs': 205, 'loss': 'mae', 'optimizer': 'adam', 'graph_mode': 'off', 'use_snp_selection': True, 'num_snps': 2246}. Best is trial 78 with value: 0.08363337388283676.
[I 2025-12-05 15:47:19,912] Trial 79 finished with value: 0.03637394229056918 and parameters: {'model_type': 'mlp', 'hidden_dims': '[256, 128]', 'dropout': 0.21717600340845844, 'batch_norm': True, 'lr': 0.0005117787597668101, 'weight_decay': 4.156851776092477e-06, 'epochs': 232, 'loss': 'mae', 'optimizer': 'adam', 'graph_mode': 'off', 'use_snp_selection': True, 'num_snps': 4279}. Best is trial 78 with value: 0.08363337388283676.
[I 2025-12-05 15:47:21,120] Trial 80 finished with value: 0.03557966012384929 and parameters: {'model_type': 'mlp', 'hidden_dims': '[256, 128]', 'dropout': 0.2348025897506219, 'batch_norm': True, 'lr': 0.0006661969818062273, 'weight_decay': 1.4953416766004971e-06, 'epochs': 207, 'loss': 'mse', 'optimizer': 'adam', 'graph_mode': 'off', 'use_snp_selection': True, 'num_snps': 11938}. Best is trial 78 with value: 0.08363337388283676.
[I 2025-12-05 15:47:22,778] Trial 81 finished with value: 0.03719813919527267 and parameters: {'model_type': 'mlp', 'hidden_dims': '[256, 128]', 'dropout': 0.18872806567111958, 'batch_norm': True, 'lr': 0.00039044812680205806, 'weight_decay': 8.762815592156293e-06, 'epochs': 193, 'loss': 'mae', 'optimizer': 'adam', 'graph_mode': 'off', 'use_snp_selection': True, 'num_snps': 27329}. Best is trial 78 with value: 0.08363337388283676.
[I 2025-12-05 15:47:23,972] Trial 82 finished with value: 0.03478363882852912 and parameters: {'model_type': 'mlp', 'hidden_dims': '[256, 128]', 'dropout': 0.16960584818472607, 'batch_norm': True, 'lr': 0.000836443969758296, 'weight_decay': 2.1642942337874843e-06, 'epochs': 184, 'loss': 'mae', 'optimizer': 'adam', 'graph_mode': 'off', 'use_snp_selection': True, 'num_snps': 13039}. Best is trial 78 with value: 0.08363337388283676.
[I 2025-12-05 15:47:26,003] Trial 83 finished with value: 0.06614730332924773 and parameters: {'model_type': 'mlp', 'hidden_dims': '[256, 128]', 'dropout': 0.2793346832250232, 'batch_norm': True, 'lr': 0.0006890614200535893, 'weight_decay': 1.9409449522920765e-05, 'epochs': 222, 'loss': 'mae', 'optimizer': 'adam', 'graph_mode': 'off', 'use_snp_selection': True, 'num_snps': 40833}. Best is trial 78 with value: 0.08363337388283676.
[I 2025-12-05 15:47:28,059] Trial 84 finished with value: 0.06178260115038095 and parameters: {'model_type': 'mlp', 'hidden_dims': '[256, 128]', 'dropout': 0.2806707341604112, 'batch_norm': True, 'lr': 0.000661444061639646, 'weight_decay': 1.6657928246520755e-05, 'epochs': 219, 'loss': 'mae', 'optimizer': 'adam', 'graph_mode': 'off', 'use_snp_selection': True, 'num_snps': 42080}. Best is trial 78 with value: 0.08363337388283676.
[I 2025-12-05 15:47:30,524] Trial 85 finished with value: 0.06518625865162693 and parameters: {'model_type': 'mlp', 'hidden_dims': '[256, 128]', 'dropout': 0.24682898118931082, 'batch_norm': True, 'lr': 0.0005689148837185983, 'weight_decay': 4.844341115915357e-06, 'epochs': 245, 'loss': 'mae', 'optimizer': 'adam', 'graph_mode': 'off', 'use_snp_selection': True, 'num_snps': 51948}. Best is trial 78 with value: 0.08363337388283676.
[I 2025-12-05 15:47:32,495] Trial 86 finished with value: 0.061182073389802055 and parameters: {'model_type': 'mlp', 'hidden_dims': '[256, 128]', 'dropout': 0.3099626074964165, 'batch_norm': True, 'lr': 0.00046069196597734813, 'weight_decay': 1.0583862087497065e-05, 'epochs': 268, 'loss': 'mae', 'optimizer': 'adam', 'graph_mode': 'off', 'use_snp_selection': True, 'num_snps': 36838}. Best is trial 78 with value: 0.08363337388283676.
[I 2025-12-05 15:47:34,151] Trial 87 finished with value: 0.04743084129402843 and parameters: {'model_type': 'mlp', 'hidden_dims': '[256, 128]', 'dropout': 0.2154734720537522, 'batch_norm': False, 'lr': 0.0007650580166542242, 'weight_decay': 2.061753545991064e-05, 'epochs': 202, 'loss': 'mae', 'optimizer': 'adam', 'graph_mode': 'off', 'use_snp_selection': True, 'num_snps': 31585}. Best is trial 78 with value: 0.08363337388283676.
[I 2025-12-05 15:47:36,642] Trial 88 finished with value: 0.033580084932509885 and parameters: {'model_type': 'mlp', 'hidden_dims': '[256, 128]', 'dropout': 0.2734006560081181, 'batch_norm': True, 'lr': 0.0009752608130212502, 'weight_decay': 1.0687334300227568e-06, 'epochs': 235, 'loss': 'mae', 'optimizer': 'adam', 'graph_mode': 'off', 'use_snp_selection': True, 'num_snps': 49029}. Best is trial 78 with value: 0.08363337388283676.
[I 2025-12-05 15:47:38,754] Trial 89 finished with value: 0.05155405871956466 and parameters: {'model_type': 'mlp', 'hidden_dims': '[256, 128]', 'dropout': 0.2034889158480391, 'batch_norm': True, 'lr': 0.00030393224733877113, 'weight_decay': 6.632246151455578e-06, 'epochs': 213, 'loss': 'mae', 'optimizer': 'adam', 'graph_mode': 'off', 'use_snp_selection': True, 'num_snps': 38438}. Best is trial 78 with value: 0.08363337388283676.
[I 2025-12-05 15:47:40,328] Trial 90 finished with value: 0.029080375789357436 and parameters: {'model_type': 'mlp', 'hidden_dims': '[256, 128]', 'dropout': 0.11632442676025975, 'batch_norm': True, 'lr': 0.0002336985352304267, 'weight_decay': 3.031553527321235e-05, 'epochs': 221, 'loss': 'mae', 'optimizer': 'adam', 'graph_mode': 'off', 'use_snp_selection': True, 'num_snps': 23607}. Best is trial 78 with value: 0.08363337388283676.
[I 2025-12-05 15:47:41,369] Trial 91 finished with value: 0.04401037704046814 and parameters: {'model_type': 'mlp', 'hidden_dims': '[256, 128, 64]', 'dropout': 0.2311141058873612, 'batch_norm': True, 'lr': 0.00036001761426712075, 'weight_decay': 1.1765946152794121e-05, 'epochs': 179, 'loss': 'mae', 'optimizer': 'adam', 'graph_mode': 'off', 'use_snp_selection': False}. Best is trial 78 with value: 0.08363337388283676.
