Running from this directory: /cluster/work/simennes/Project_thesis/Project_thesis
Name of job: mlp_m_within
ID of job: 23690636
The job was run on these nodes: idun-07-08
[I 2025-12-05 14:53:02,414] Trial 0 finished with value: 0.23752536758962126 and parameters: {'model_type': 'mlp', 'hidden_dims': '[128, 64]', 'dropout': 0.199031432379812, 'batch_norm': True, 'lr': 1.8408544111075837e-06, 'weight_decay': 5.5136510071208614e-05, 'epochs': 336, 'loss': 'mae', 'optimizer': 'adam', 'graph_mode': 'off', 'use_snp_selection': True, 'num_snps': 43862}. Best is trial 0 with value: 0.23752536758962126.
[I 2025-12-05 14:53:29,192] Trial 1 finished with value: 0.2693685419349009 and parameters: {'model_type': 'mlp', 'hidden_dims': '[256, 128]', 'dropout': 0.4370668075331726, 'batch_norm': True, 'lr': 7.133471581159139e-05, 'weight_decay': 1.128633586803549e-05, 'epochs': 242, 'loss': 'mae', 'optimizer': 'adam', 'graph_mode': 'off', 'use_snp_selection': False}. Best is trial 1 with value: 0.2693685419349009.
[I 2025-12-05 14:53:56,080] Trial 2 finished with value: 0.2544161708980056 and parameters: {'model_type': 'mlp', 'hidden_dims': '[256, 128, 64]', 'dropout': 0.41314357415569625, 'batch_norm': False, 'lr': 3.952233718592101e-06, 'weight_decay': 0.00026754769258252603, 'epochs': 149, 'loss': 'mse', 'optimizer': 'adam', 'graph_mode': 'off', 'use_snp_selection': True, 'num_snps': 11571}. Best is trial 1 with value: 0.2693685419349009.
[I 2025-12-05 14:54:56,820] Trial 3 finished with value: 0.28014110294380407 and parameters: {'model_type': 'mlp', 'hidden_dims': '[512, 64]', 'dropout': 0.5938127374509361, 'batch_norm': False, 'lr': 5.67704586114731e-06, 'weight_decay': 2.4518087630137052e-05, 'epochs': 320, 'loss': 'mae', 'optimizer': 'adam', 'graph_mode': 'off', 'use_snp_selection': False}. Best is trial 3 with value: 0.28014110294380407.
[I 2025-12-05 14:55:57,711] Trial 4 finished with value: 0.2526407260133071 and parameters: {'model_type': 'mlp', 'hidden_dims': '[512, 128]', 'dropout': 0.25746343592134413, 'batch_norm': True, 'lr': 1.3467657668402788e-06, 'weight_decay': 0.00033087251918647806, 'epochs': 277, 'loss': 'mse', 'optimizer': 'adam', 'graph_mode': 'off', 'use_snp_selection': True, 'num_snps': 36675}. Best is trial 3 with value: 0.28014110294380407.
[I 2025-12-05 14:56:41,198] Trial 5 finished with value: 0.23272372110992529 and parameters: {'model_type': 'mlp', 'hidden_dims': '[512, 64]', 'dropout': 0.38275350994408375, 'batch_norm': True, 'lr': 1.5586664309232824e-06, 'weight_decay': 0.0008227664668621182, 'epochs': 145, 'loss': 'mae', 'optimizer': 'adam', 'graph_mode': 'off', 'use_snp_selection': True, 'num_snps': 32148}. Best is trial 3 with value: 0.28014110294380407.
[I 2025-12-05 14:57:03,919] Trial 6 finished with value: 0.2760658702828522 and parameters: {'model_type': 'mlp', 'hidden_dims': '[256, 128]', 'dropout': 0.3930109900265879, 'batch_norm': False, 'lr': 4.892964372128395e-05, 'weight_decay': 1.5809549317992182e-06, 'epochs': 199, 'loss': 'mse', 'optimizer': 'adam', 'graph_mode': 'off', 'use_snp_selection': False}. Best is trial 3 with value: 0.28014110294380407.
[I 2025-12-05 14:57:26,221] Trial 7 finished with value: 0.27550348131618185 and parameters: {'model_type': 'mlp', 'hidden_dims': '[512, 256]', 'dropout': 0.15343979219678458, 'batch_norm': True, 'lr': 6.234003099047341e-05, 'weight_decay': 3.894760610535477e-07, 'epochs': 97, 'loss': 'mse', 'optimizer': 'adam', 'graph_mode': 'off', 'use_snp_selection': False}. Best is trial 3 with value: 0.28014110294380407.
[I 2025-12-05 14:58:26,329] Trial 8 finished with value: 0.27747754536822694 and parameters: {'model_type': 'mlp', 'hidden_dims': '[512, 128]', 'dropout': 0.10743001231661406, 'batch_norm': True, 'lr': 0.00023728538449271062, 'weight_decay': 1.7629071578048637e-05, 'epochs': 312, 'loss': 'mae', 'optimizer': 'adam', 'graph_mode': 'off', 'use_snp_selection': False}. Best is trial 3 with value: 0.28014110294380407.
[I 2025-12-05 14:59:02,237] Trial 9 finished with value: 0.2746865883723747 and parameters: {'model_type': 'mlp', 'hidden_dims': '[512, 64]', 'dropout': 0.14505336736221927, 'batch_norm': True, 'lr': 5.8619638388111826e-05, 'weight_decay': 6.200156172669308e-07, 'epochs': 175, 'loss': 'mse', 'optimizer': 'adam', 'graph_mode': 'off', 'use_snp_selection': False}. Best is trial 3 with value: 0.28014110294380407.
[I 2025-12-05 14:59:17,034] Trial 10 finished with value: 0.22815221225918156 and parameters: {'model_type': 'mlp', 'hidden_dims': '[512, 64]', 'dropout': 0.5885461262002587, 'batch_norm': False, 'lr': 8.769366258768696e-06, 'weight_decay': 2.78273193871783e-06, 'epochs': 55, 'loss': 'mae', 'optimizer': 'adam', 'graph_mode': 'off', 'use_snp_selection': False}. Best is trial 3 with value: 0.28014110294380407.
[I 2025-12-05 15:00:22,252] Trial 11 finished with value: 0.18680431812228754 and parameters: {'model_type': 'mlp', 'hidden_dims': '[512, 128]', 'dropout': 0.583942291816117, 'batch_norm': False, 'lr': 0.0007607980626791682, 'weight_decay': 2.11387030344014e-05, 'epochs': 346, 'loss': 'mae', 'optimizer': 'adam', 'graph_mode': 'off', 'use_snp_selection': False}. Best is trial 3 with value: 0.28014110294380407.
[I 2025-12-05 15:01:18,517] Trial 12 finished with value: 0.2647978683627348 and parameters: {'model_type': 'mlp', 'hidden_dims': '[512, 128]', 'dropout': 0.2637316882220091, 'batch_norm': False, 'lr': 0.000384886887018818, 'weight_decay': 6.23587291883057e-05, 'epochs': 294, 'loss': 'mae', 'optimizer': 'adam', 'graph_mode': 'off', 'use_snp_selection': False}. Best is trial 3 with value: 0.28014110294380407.
[I 2025-12-05 15:01:37,637] Trial 13 finished with value: 0.27242596311866235 and parameters: {'model_type': 'mlp', 'hidden_dims': '[128, 64]', 'dropout': 0.5255276925359322, 'batch_norm': False, 'lr': 1.3373175420781734e-05, 'weight_decay': 2.875929917712265e-06, 'epochs': 285, 'loss': 'mae', 'optimizer': 'adam', 'graph_mode': 'off', 'use_snp_selection': False}. Best is trial 3 with value: 0.28014110294380407.
[I 2025-12-05 15:02:04,182] Trial 14 finished with value: 0.2691984124842008 and parameters: {'model_type': 'mlp', 'hidden_dims': '[256, 128, 64]', 'dropout': 0.3012984444538551, 'batch_norm': True, 'lr': 0.0002108574938852793, 'weight_decay': 1.1414924884997386e-07, 'epochs': 237, 'loss': 'mae', 'optimizer': 'adam', 'graph_mode': 'off', 'use_snp_selection': False}. Best is trial 3 with value: 0.28014110294380407.
[I 2025-12-05 15:03:04,071] Trial 15 finished with value: 0.27177534891318633 and parameters: {'model_type': 'mlp', 'hidden_dims': '[512, 256]', 'dropout': 0.48263162073930665, 'batch_norm': False, 'lr': 1.8411764708572348e-05, 'weight_decay': 4.4084956876871386e-05, 'epochs': 314, 'loss': 'mae', 'optimizer': 'adam', 'graph_mode': 'off', 'use_snp_selection': False}. Best is trial 3 with value: 0.28014110294380407.
[I 2025-12-05 15:03:52,272] Trial 16 finished with value: 0.2741318193148216 and parameters: {'model_type': 'mlp', 'hidden_dims': '[512, 128]', 'dropout': 0.32560328266296623, 'batch_norm': True, 'lr': 0.00017549215405955411, 'weight_decay': 6.80662468241148e-06, 'epochs': 244, 'loss': 'mae', 'optimizer': 'adam', 'graph_mode': 'off', 'use_snp_selection': False}. Best is trial 3 with value: 0.28014110294380407.
[I 2025-12-05 15:04:58,800] Trial 17 finished with value: 0.27213101156967157 and parameters: {'model_type': 'mlp', 'hidden_dims': '[512, 64]', 'dropout': 0.10230308008198463, 'batch_norm': False, 'lr': 7.28449232493469e-06, 'weight_decay': 0.00010542713361476925, 'epochs': 350, 'loss': 'mae', 'optimizer': 'adam', 'graph_mode': 'off', 'use_snp_selection': False}. Best is trial 3 with value: 0.28014110294380407.
[I 2025-12-05 15:06:19,872] Trial 18 finished with value: 0.27295073550083737 and parameters: {'model_type': 'mlp', 'hidden_dims': '[512, 128]', 'dropout': 0.5098431992326697, 'batch_norm': False, 'lr': 2.568379894723034e-05, 'weight_decay': 1.4785860713169379e-05, 'epochs': 268, 'loss': 'mae', 'optimizer': 'adam', 'graph_mode': 'off', 'use_snp_selection': True, 'num_snps': 58241}. Best is trial 3 with value: 0.28014110294380407.
[I 2025-12-05 15:07:20,210] Trial 19 finished with value: 0.2680720278883941 and parameters: {'model_type': 'mlp', 'hidden_dims': '[512, 64]', 'dropout': 0.22426752700825467, 'batch_norm': True, 'lr': 4.238115837317623e-06, 'weight_decay': 5.539609312143884e-06, 'epochs': 314, 'loss': 'mae', 'optimizer': 'adam', 'graph_mode': 'off', 'use_snp_selection': False}. Best is trial 3 with value: 0.28014110294380407.
[I 2025-12-05 15:07:35,456] Trial 20 finished with value: 0.25194423745229866 and parameters: {'model_type': 'mlp', 'hidden_dims': '[128, 64]', 'dropout': 0.35590240931164197, 'batch_norm': False, 'lr': 0.00027854139843726527, 'weight_decay': 2.417613357794622e-05, 'epochs': 209, 'loss': 'mae', 'optimizer': 'adam', 'graph_mode': 'off', 'use_snp_selection': False}. Best is trial 3 with value: 0.28014110294380407.
[I 2025-12-05 15:07:58,510] Trial 21 finished with value: 0.26993316054159483 and parameters: {'model_type': 'mlp', 'hidden_dims': '[256, 128]', 'dropout': 0.44750114726935364, 'batch_norm': False, 'lr': 0.00011439260176440473, 'weight_decay': 1.3648862565284844e-06, 'epochs': 202, 'loss': 'mse', 'optimizer': 'adam', 'graph_mode': 'off', 'use_snp_selection': False}. Best is trial 3 with value: 0.28014110294380407.
[I 2025-12-05 15:08:31,484] Trial 22 finished with value: 0.26329357046527535 and parameters: {'model_type': 'mlp', 'hidden_dims': '[256, 128]', 'dropout': 0.5447308805905808, 'batch_norm': False, 'lr': 3.511276726977522e-05, 'weight_decay': 1.5239177099132598e-06, 'epochs': 312, 'loss': 'mse', 'optimizer': 'adam', 'graph_mode': 'off', 'use_snp_selection': False}. Best is trial 3 with value: 0.28014110294380407.
[I 2025-12-05 15:08:45,259] Trial 23 finished with value: 0.196038610131747 and parameters: {'model_type': 'mlp', 'hidden_dims': '[256, 128]', 'dropout': 0.36669702275469684, 'batch_norm': False, 'lr': 0.0008885863418736856, 'weight_decay': 4.819620129078006e-06, 'epochs': 100, 'loss': 'mse', 'optimizer': 'adam', 'graph_mode': 'off', 'use_snp_selection': False}. Best is trial 3 with value: 0.28014110294380407.
[I 2025-12-05 15:09:13,088] Trial 24 finished with value: 0.26616934736926967 and parameters: {'model_type': 'mlp', 'hidden_dims': '[256, 128]', 'dropout': 0.46987033741278, 'batch_norm': False, 'lr': 3.978049943836133e-05, 'weight_decay': 4.750949727905119e-07, 'epochs': 256, 'loss': 'mse', 'optimizer': 'adam', 'graph_mode': 'off', 'use_snp_selection': False}. Best is trial 3 with value: 0.28014110294380407.
[I 2025-12-05 15:09:54,948] Trial 25 finished with value: 0.26384666384224587 and parameters: {'model_type': 'mlp', 'hidden_dims': '[512, 256]', 'dropout': 0.3076853305357773, 'batch_norm': False, 'lr': 0.0004808833726608116, 'weight_decay': 0.00013367099287007743, 'epochs': 210, 'loss': 'mse', 'optimizer': 'adam', 'graph_mode': 'off', 'use_snp_selection': False}. Best is trial 3 with value: 0.28014110294380407.
[I 2025-12-05 15:10:18,178] Trial 26 finished with value: 0.25036798129152754 and parameters: {'model_type': 'mlp', 'hidden_dims': '[256, 128, 64]', 'dropout': 0.399271307902458, 'batch_norm': True, 'lr': 0.00011357571677523057, 'weight_decay': 3.363001981901425e-05, 'epochs': 171, 'loss': 'mse', 'optimizer': 'adam', 'graph_mode': 'off', 'use_snp_selection': True, 'num_snps': 3842}. Best is trial 3 with value: 0.28014110294380407.
[I 2025-12-05 15:11:16,168] Trial 27 finished with value: 0.2792273649185998 and parameters: {'model_type': 'mlp', 'hidden_dims': '[512, 64]', 'dropout': 0.17952001383897476, 'batch_norm': False, 'lr': 3.15967447054845e-06, 'weight_decay': 1.7324982408186623e-07, 'epochs': 303, 'loss': 'mae', 'optimizer': 'adam', 'graph_mode': 'off', 'use_snp_selection': False}. Best is trial 3 with value: 0.28014110294380407.
[I 2025-12-05 15:12:18,430] Trial 28 finished with value: 0.26322950674456574 and parameters: {'model_type': 'mlp', 'hidden_dims': '[512, 64]', 'dropout': 0.10989447437287174, 'batch_norm': True, 'lr': 2.961616157151216e-06, 'weight_decay': 1.0648941267443927e-07, 'epochs': 325, 'loss': 'mae', 'optimizer': 'adam', 'graph_mode': 'off', 'use_snp_selection': False}. Best is trial 3 with value: 0.28014110294380407.
[I 2025-12-05 15:13:01,184] Trial 29 finished with value: 0.25382258700285804 and parameters: {'model_type': 'mlp', 'hidden_dims': '[512, 64]', 'dropout': 0.1815141490739191, 'batch_norm': True, 'lr': 2.4512961744916967e-06, 'weight_decay': 7.556740997596572e-05, 'epochs': 295, 'loss': 'mae', 'optimizer': 'adam', 'graph_mode': 'off', 'use_snp_selection': True, 'num_snps': 19468}. Best is trial 3 with value: 0.28014110294380407.
[I 2025-12-05 15:14:03,590] Trial 30 finished with value: 0.2763809309534822 and parameters: {'model_type': 'mlp', 'hidden_dims': '[512, 64]', 'dropout': 0.208015452503256, 'batch_norm': False, 'lr': 6.668352127158324e-06, 'weight_decay': 2.6534762368974463e-07, 'epochs': 329, 'loss': 'mae', 'optimizer': 'adam', 'graph_mode': 'off', 'use_snp_selection': False}. Best is trial 3 with value: 0.28014110294380407.
[I 2025-12-05 15:15:06,785] Trial 31 finished with value: 0.27292396079441217 and parameters: {'model_type': 'mlp', 'hidden_dims': '[512, 64]', 'dropout': 0.21425745509741229, 'batch_norm': False, 'lr': 5.50313179909406e-06, 'weight_decay': 2.3067680642911222e-07, 'epochs': 332, 'loss': 'mae', 'optimizer': 'adam', 'graph_mode': 'off', 'use_snp_selection': False}. Best is trial 3 with value: 0.28014110294380407.
[I 2025-12-05 15:16:04,969] Trial 32 finished with value: 0.2604332071765835 and parameters: {'model_type': 'mlp', 'hidden_dims': '[512, 64]', 'dropout': 0.16242198447739178, 'batch_norm': False, 'lr': 1.0152863757455777e-06, 'weight_decay': 2.637713805973523e-07, 'epochs': 303, 'loss': 'mae', 'optimizer': 'adam', 'graph_mode': 'off', 'use_snp_selection': False}. Best is trial 3 with value: 0.28014110294380407.
[I 2025-12-05 15:17:07,720] Trial 33 finished with value: 0.266845467565488 and parameters: {'model_type': 'mlp', 'hidden_dims': '[512, 64]', 'dropout': 0.24774198803198083, 'batch_norm': False, 'lr': 1.2745124406828327e-05, 'weight_decay': 1.1361284684547886e-05, 'epochs': 331, 'loss': 'mae', 'optimizer': 'adam', 'graph_mode': 'off', 'use_snp_selection': False}. Best is trial 3 with value: 0.28014110294380407.
[I 2025-12-05 15:18:01,011] Trial 34 finished with value: 0.27258297592341196 and parameters: {'model_type': 'mlp', 'hidden_dims': '[512, 64]', 'dropout': 0.13227392720529274, 'batch_norm': False, 'lr': 2.80076215415351e-06, 'weight_decay': 8.868813529637633e-07, 'epochs': 275, 'loss': 'mae', 'optimizer': 'adam', 'graph_mode': 'off', 'use_snp_selection': False}. Best is trial 3 with value: 0.28014110294380407.
[I 2025-12-05 15:19:16,447] Trial 35 finished with value: 0.2744124441654411 and parameters: {'model_type': 'mlp', 'hidden_dims': '[512, 128]', 'dropout': 0.18318104471725788, 'batch_norm': False, 'lr': 8.099654027461717e-06, 'weight_decay': 1.916083391730086e-07, 'epochs': 235, 'loss': 'mae', 'optimizer': 'adam', 'graph_mode': 'off', 'use_snp_selection': True, 'num_snps': 57586}. Best is trial 3 with value: 0.28014110294380407.
[I 2025-12-05 15:19:34,560] Trial 36 finished with value: 0.2235958062531313 and parameters: {'model_type': 'mlp', 'hidden_dims': '[128, 64]', 'dropout': 0.20799687872199385, 'batch_norm': True, 'lr': 1.7014751417069327e-06, 'weight_decay': 0.00019009559896090284, 'epochs': 263, 'loss': 'mae', 'optimizer': 'adam', 'graph_mode': 'off', 'use_snp_selection': False}. Best is trial 3 with value: 0.28014110294380407.
[I 2025-12-05 15:20:21,615] Trial 37 finished with value: 0.2662703660454036 and parameters: {'model_type': 'mlp', 'hidden_dims': '[512, 64]', 'dropout': 0.12916515386917032, 'batch_norm': False, 'lr': 4.7798348368596445e-06, 'weight_decay': 2.9200288314891082e-06, 'epochs': 322, 'loss': 'mae', 'optimizer': 'adam', 'graph_mode': 'off', 'use_snp_selection': True, 'num_snps': 22282}. Best is trial 3 with value: 0.28014110294380407.
[I 2025-12-05 15:20:52,683] Trial 38 finished with value: 0.2753285002768861 and parameters: {'model_type': 'mlp', 'hidden_dims': '[256, 128, 64]', 'dropout': 0.17288695016144764, 'batch_norm': True, 'lr': 2.3129354145876834e-05, 'weight_decay': 0.00046644832351108945, 'epochs': 287, 'loss': 'mae', 'optimizer': 'adam', 'graph_mode': 'off', 'use_snp_selection': False}. Best is trial 3 with value: 0.28014110294380407.
[I 2025-12-05 15:21:57,572] Trial 39 finished with value: 0.2712813876101432 and parameters: {'model_type': 'mlp', 'hidden_dims': '[512, 64]', 'dropout': 0.27691863359503827, 'batch_norm': False, 'lr': 1.5445972223857344e-05, 'weight_decay': 1.9003420611579885e-05, 'epochs': 344, 'loss': 'mae', 'optimizer': 'adam', 'graph_mode': 'off', 'use_snp_selection': False}. Best is trial 3 with value: 0.28014110294380407.
[I 2025-12-05 15:22:54,976] Trial 40 finished with value: 0.2749247325772488 and parameters: {'model_type': 'mlp', 'hidden_dims': '[512, 128]', 'dropout': 0.22865878996324707, 'batch_norm': True, 'lr': 1.0050710098074443e-05, 'weight_decay': 8.556172823432175e-06, 'epochs': 297, 'loss': 'mae', 'optimizer': 'adam', 'graph_mode': 'off', 'use_snp_selection': False}. Best is trial 3 with value: 0.28014110294380407.
[I 2025-12-05 15:23:25,464] Trial 41 finished with value: 0.27595908216579434 and parameters: {'model_type': 'mlp', 'hidden_dims': '[512, 256]', 'dropout': 0.41093125020629806, 'batch_norm': False, 'lr': 9.308779345736803e-05, 'weight_decay': 8.409207789206748e-07, 'epochs': 145, 'loss': 'mse', 'optimizer': 'adam', 'graph_mode': 'off', 'use_snp_selection': False}. Best is trial 3 with value: 0.28014110294380407.
[I 2025-12-05 15:23:40,012] Trial 42 finished with value: 0.28439639703244574 and parameters: {'model_type': 'mlp', 'hidden_dims': '[256, 128]', 'dropout': 0.14640924848814507, 'batch_norm': False, 'lr': 4.778596639277745e-05, 'weight_decay': 3.8029173191248647e-07, 'epochs': 109, 'loss': 'mse', 'optimizer': 'adam', 'graph_mode': 'off', 'use_snp_selection': False}. Best is trial 42 with value: 0.28439639703244574.
[I 2025-12-05 15:23:55,350] Trial 43 finished with value: 0.2759321404922638 and parameters: {'model_type': 'mlp', 'hidden_dims': '[256, 128]', 'dropout': 0.14303400208996203, 'batch_norm': False, 'lr': 2.1409924724993155e-06, 'weight_decay': 3.411748325755113e-07, 'epochs': 117, 'loss': 'mse', 'optimizer': 'adam', 'graph_mode': 'off', 'use_snp_selection': False}. Best is trial 42 with value: 0.28439639703244574.
[I 2025-12-05 15:24:04,470] Trial 44 finished with value: 0.21870003029338694 and parameters: {'model_type': 'mlp', 'hidden_dims': '[256, 128]', 'dropout': 0.12024874031257227, 'batch_norm': False, 'lr': 3.234210024325629e-06, 'weight_decay': 1.6716942789137048e-07, 'epochs': 49, 'loss': 'mae', 'optimizer': 'adam', 'graph_mode': 'off', 'use_snp_selection': False}. Best is trial 42 with value: 0.28439639703244574.
[I 2025-12-05 15:24:22,414] Trial 45 finished with value: 0.25928013241545633 and parameters: {'model_type': 'mlp', 'hidden_dims': '[512, 64]', 'dropout': 0.19088096786962705, 'batch_norm': False, 'lr': 6.612281832148127e-06, 'weight_decay': 5.540394729656138e-07, 'epochs': 73, 'loss': 'mae', 'optimizer': 'adam', 'graph_mode': 'off', 'use_snp_selection': False}. Best is trial 42 with value: 0.28439639703244574.
[I 2025-12-05 15:25:06,593] Trial 46 finished with value: 0.2690035648708408 and parameters: {'model_type': 'mlp', 'hidden_dims': '[512, 128]', 'dropout': 0.15726874931743987, 'batch_norm': False, 'lr': 1.0406601875621577e-05, 'weight_decay': 1.4848235504577838e-07, 'epochs': 224, 'loss': 'mse', 'optimizer': 'adam', 'graph_mode': 'off', 'use_snp_selection': False}. Best is trial 42 with value: 0.28439639703244574.
[I 2025-12-05 15:25:41,854] Trial 47 finished with value: 0.2620748488804381 and parameters: {'model_type': 'mlp', 'hidden_dims': '[512, 64]', 'dropout': 0.10038415219427164, 'batch_norm': False, 'lr': 1.357737585467047e-06, 'weight_decay': 3.228048164631805e-07, 'epochs': 172, 'loss': 'mae', 'optimizer': 'adam', 'graph_mode': 'off', 'use_snp_selection': False}. Best is trial 42 with value: 0.28439639703244574.
[I 2025-12-05 15:26:25,803] Trial 48 finished with value: 0.2686170646190486 and parameters: {'model_type': 'mlp', 'hidden_dims': '[128, 64]', 'dropout': 0.25265542838589905, 'batch_norm': True, 'lr': 0.0006157291192152533, 'weight_decay': 3.379819033365431e-05, 'epochs': 306, 'loss': 'mae', 'optimizer': 'adam', 'graph_mode': 'off', 'use_snp_selection': True, 'num_snps': 43224}. Best is trial 42 with value: 0.28439639703244574.
[I 2025-12-05 15:27:20,181] Trial 49 finished with value: 0.26237332505318034 and parameters: {'model_type': 'mlp', 'hidden_dims': '[512, 128]', 'dropout': 0.20022602050800858, 'batch_norm': False, 'lr': 0.00016912979742127152, 'weight_decay': 7.608905157914053e-07, 'epochs': 283, 'loss': 'mse', 'optimizer': 'adam', 'graph_mode': 'off', 'use_snp_selection': False}. Best is trial 42 with value: 0.28439639703244574.
[I 2025-12-05 15:27:37,049] Trial 50 finished with value: 0.27465427419689137 and parameters: {'model_type': 'mlp', 'hidden_dims': '[256, 128, 64]', 'dropout': 0.2834266126587874, 'batch_norm': True, 'lr': 5.757858050180289e-05, 'weight_decay': 4.70198164421106e-06, 'epochs': 132, 'loss': 'mae', 'optimizer': 'adam', 'graph_mode': 'off', 'use_snp_selection': False}. Best is trial 42 with value: 0.28439639703244574.
[I 2025-12-05 15:27:49,148] Trial 51 finished with value: 0.27562631832670104 and parameters: {'model_type': 'mlp', 'hidden_dims': '[256, 128]', 'dropout': 0.3287993431475715, 'batch_norm': False, 'lr': 5.3403173693533986e-05, 'weight_decay': 1.4970064864304965e-06, 'epochs': 82, 'loss': 'mse', 'optimizer': 'adam', 'graph_mode': 'off', 'use_snp_selection': False}. Best is trial 42 with value: 0.28439639703244574.
