[I 2025-12-05 16:16:43,280] Trial 19 finished with value: 0.11808010295076901 and parameters: {'model_type': 'mlp', 'hidden_dims': '[128, 64]', 'dropout': 0.22775188048843958, 'batch_norm': True, 'lr': 0.0008834799994944109, 'weight_decay': 7.83650550197051e-06, 'epochs': 275, 'loss': 'mae', 'optimizer': 'adam', 'graph_mode': 'off', 'use_snp_selection': True, 'num_snps': 55667}. Best is trial 19 with value: 0.11808010295076901.
[I 2025-12-05 16:16:45,667] Trial 20 finished with value: 0.080952018166893 and parameters: {'model_type': 'mlp', 'hidden_dims': '[128, 64]', 'dropout': 0.2234072291344338, 'batch_norm': True, 'lr': 1.4683498980974108e-05, 'weight_decay': 6.029375438969263e-06, 'epochs': 202, 'loss': 'mae', 'optimizer': 'adam', 'graph_mode': 'off', 'use_snp_selection': True, 'num_snps': 57703}. Best is trial 19 with value: 0.11808010295076901.
[I 2025-12-05 16:16:48,391] Trial 21 finished with value: 0.11701431444538318 and parameters: {'model_type': 'mlp', 'hidden_dims': '[128, 64]', 'dropout': 0.20278735556345437, 'batch_norm': True, 'lr': 0.0009216220547178549, 'weight_decay': 1.5213850592581041e-05, 'epochs': 272, 'loss': 'mae', 'optimizer': 'adam', 'graph_mode': 'off', 'use_snp_selection': True, 'num_snps': 59811}. Best is trial 19 with value: 0.11808010295076901.
[I 2025-12-05 16:16:50,949] Trial 22 finished with value: 0.10567837239798242 and parameters: {'model_type': 'mlp', 'hidden_dims': '[128, 64]', 'dropout': 0.18227924024981768, 'batch_norm': True, 'lr': 0.0009581784405422628, 'weight_decay': 3.0272068568357332e-05, 'epochs': 257, 'loss': 'mae', 'optimizer': 'adam', 'graph_mode': 'off', 'use_snp_selection': True, 'num_snps': 59634}. Best is trial 19 with value: 0.11808010295076901.
[I 2025-12-05 16:16:53,328] Trial 23 finished with value: 0.10141777899982209 and parameters: {'model_type': 'mlp', 'hidden_dims': '[128, 64]', 'dropout': 0.24620508247140652, 'batch_norm': True, 'lr': 0.0004669725281840025, 'weight_decay': 5.615764048513333e-06, 'epochs': 217, 'loss': 'mae', 'optimizer': 'adam', 'graph_mode': 'off', 'use_snp_selection': True, 'num_snps': 51866}. Best is trial 19 with value: 0.11808010295076901.
[I 2025-12-05 16:16:55,650] Trial 24 finished with value: 0.09798344606245318 and parameters: {'model_type': 'mlp', 'hidden_dims': '[128, 64]', 'dropout': 0.3066703032057868, 'batch_norm': True, 'lr': 0.0001264371857352964, 'weight_decay': 1.1152293217052346e-06, 'epochs': 276, 'loss': 'mae', 'optimizer': 'adam', 'graph_mode': 'off', 'use_snp_selection': True, 'num_snps': 51470}. Best is trial 19 with value: 0.11808010295076901.
[I 2025-12-05 16:16:58,343] Trial 25 finished with value: 0.11494553612592541 and parameters: {'model_type': 'mlp', 'hidden_dims': '[128, 64]', 'dropout': 0.17557191192980073, 'batch_norm': True, 'lr': 0.00041059327867952727, 'weight_decay': 0.00014664794348837626, 'epochs': 252, 'loss': 'mae', 'optimizer': 'adam', 'graph_mode': 'off', 'use_snp_selection': True, 'num_snps': 59048}. Best is trial 19 with value: 0.11808010295076901.
[I 2025-12-05 16:16:59,833] Trial 26 finished with value: 0.1113272529241215 and parameters: {'model_type': 'mlp', 'hidden_dims': '[256, 128, 64]', 'dropout': 0.349190518097241, 'batch_norm': True, 'lr': 0.0008905821782288408, 'weight_decay': 2.8773758807550848e-05, 'epochs': 324, 'loss': 'mae', 'optimizer': 'adam', 'graph_mode': 'off', 'use_snp_selection': True, 'num_snps': 15352}. Best is trial 19 with value: 0.11808010295076901.
[I 2025-12-05 16:17:01,947] Trial 27 finished with value: 0.08073908688942093 and parameters: {'model_type': 'mlp', 'hidden_dims': '[128, 64]', 'dropout': 0.26313520388453654, 'batch_norm': True, 'lr': 0.00010772042050520536, 'weight_decay': 8.156600336676005e-06, 'epochs': 175, 'loss': 'mae', 'optimizer': 'adam', 'graph_mode': 'off', 'use_snp_selection': True, 'num_snps': 46742}. Best is trial 19 with value: 0.11808010295076901.
[I 2025-12-05 16:17:03,526] Trial 28 finished with value: 0.083047065400283 and parameters: {'model_type': 'mlp', 'hidden_dims': '[128, 64]', 'dropout': 0.22820860460859466, 'batch_norm': True, 'lr': 2.8726718072258653e-05, 'weight_decay': 3.2535805805898373e-06, 'epochs': 290, 'loss': 'mae', 'optimizer': 'adam', 'graph_mode': 'off', 'use_snp_selection': True, 'num_snps': 20572}. Best is trial 19 with value: 0.11808010295076901.
[I 2025-12-05 16:17:05,676] Trial 29 finished with value: 0.10570670926665196 and parameters: {'model_type': 'mlp', 'hidden_dims': '[128, 64]', 'dropout': 0.19494761419041431, 'batch_norm': True, 'lr': 0.0006300383972712251, 'weight_decay': 3.213908804012536e-05, 'epochs': 332, 'loss': 'mae', 'optimizer': 'adam', 'graph_mode': 'off', 'use_snp_selection': True, 'num_snps': 43099}. Best is trial 19 with value: 0.11808010295076901.
[I 2025-12-05 16:17:08,015] Trial 30 finished with value: 0.09173878580498197 and parameters: {'model_type': 'mlp', 'hidden_dims': '[128, 64]', 'dropout': 0.3466737478346964, 'batch_norm': True, 'lr': 0.0002767016798429635, 'weight_decay': 9.756606323260228e-05, 'epochs': 218, 'loss': 'mae', 'optimizer': 'adam', 'graph_mode': 'off', 'use_snp_selection': True, 'num_snps': 51991}. Best is trial 19 with value: 0.11808010295076901.
[I 2025-12-05 16:17:10,683] Trial 31 finished with value: 0.11055555643745536 and parameters: {'model_type': 'mlp', 'hidden_dims': '[128, 64]', 'dropout': 0.16522525074159514, 'batch_norm': True, 'lr': 0.00040559012182214867, 'weight_decay': 0.0001846465777739665, 'epochs': 250, 'loss': 'mae', 'optimizer': 'adam', 'graph_mode': 'off', 'use_snp_selection': True, 'num_snps': 59356}. Best is trial 19 with value: 0.11808010295076901.
[I 2025-12-05 16:17:13,165] Trial 32 finished with value: 0.11557652403278053 and parameters: {'model_type': 'mlp', 'hidden_dims': '[128, 64]', 'dropout': 0.13634991811748795, 'batch_norm': True, 'lr': 0.0005696624026093663, 'weight_decay': 9.91210207332804e-06, 'epochs': 259, 'loss': 'mae', 'optimizer': 'adam', 'graph_mode': 'off', 'use_snp_selection': True, 'num_snps': 55197}. Best is trial 19 with value: 0.11808010295076901.
[I 2025-12-05 16:17:15,614] Trial 33 finished with value: 0.10568211365992214 and parameters: {'model_type': 'mlp', 'hidden_dims': '[128, 64]', 'dropout': 0.13301873603389158, 'batch_norm': True, 'lr': 0.0006395154471867473, 'weight_decay': 1.0222210981455366e-05, 'epochs': 262, 'loss': 'mae', 'optimizer': 'adam', 'graph_mode': 'off', 'use_snp_selection': True, 'num_snps': 51855}. Best is trial 19 with value: 0.11808010295076901.
[I 2025-12-05 16:17:18,229] Trial 34 finished with value: 0.08859742538974508 and parameters: {'model_type': 'mlp', 'hidden_dims': '[256, 128, 64]', 'dropout': 0.20951831695927572, 'batch_norm': True, 'lr': 0.0009410377603819584, 'weight_decay': 1.5008661139930016e-05, 'epochs': 296, 'loss': 'mae', 'optimizer': 'adam', 'graph_mode': 'off', 'use_snp_selection': True, 'num_snps': 53849}. Best is trial 19 with value: 0.11808010295076901.
[I 2025-12-05 16:17:20,479] Trial 35 finished with value: 0.10877785801929087 and parameters: {'model_type': 'mlp', 'hidden_dims': '[128, 64]', 'dropout': 0.2858120087564315, 'batch_norm': True, 'lr': 0.0005652036930239462, 'weight_decay': 4.3246894928116624e-05, 'epochs': 235, 'loss': 'mae', 'optimizer': 'adam', 'graph_mode': 'off', 'use_snp_selection': True, 'num_snps': 45944}. Best is trial 19 with value: 0.11808010295076901.
[I 2025-12-05 16:17:22,454] Trial 36 finished with value: 0.10598949035549926 and parameters: {'model_type': 'mlp', 'hidden_dims': '[128, 64]', 'dropout': 0.10043202409196925, 'batch_norm': True, 'lr': 0.000358234985802436, 'weight_decay': 1.0027244627890184e-05, 'epochs': 281, 'loss': 'mae', 'optimizer': 'adam', 'graph_mode': 'off', 'use_snp_selection': True, 'num_snps': 38331}. Best is trial 19 with value: 0.11808010295076901.
[I 2025-12-05 16:17:25,752] Trial 37 finished with value: 0.0989629760363338 and parameters: {'model_type': 'mlp', 'hidden_dims': '[512, 64]', 'dropout': 0.2466147998172976, 'batch_norm': True, 'lr': 0.00015025235324925246, 'weight_decay': 2.150538077592145e-05, 'epochs': 346, 'loss': 'mae', 'optimizer': 'adam', 'graph_mode': 'off', 'use_snp_selection': True, 'num_snps': 55022}. Best is trial 19 with value: 0.11808010295076901.
[I 2025-12-05 16:17:27,350] Trial 38 finished with value: 0.105288151836386 and parameters: {'model_type': 'mlp', 'hidden_dims': '[256, 128, 64]', 'dropout': 0.1329505617199671, 'batch_norm': False, 'lr': 3.2211467597109637e-06, 'weight_decay': 0.0004349248592375836, 'epochs': 319, 'loss': 'mae', 'optimizer': 'adam', 'graph_mode': 'off', 'use_snp_selection': True, 'num_snps': 24866}. Best is trial 19 with value: 0.11808010295076901.
[I 2025-12-05 16:17:29,440] Trial 39 finished with value: 0.10966151077809963 and parameters: {'model_type': 'mlp', 'hidden_dims': '[128, 64]', 'dropout': 0.19206568969744067, 'batch_norm': True, 'lr': 0.0007059470951288849, 'weight_decay': 1.7194809035682398e-06, 'epochs': 178, 'loss': 'mae', 'optimizer': 'adam', 'graph_mode': 'off', 'use_snp_selection': True, 'num_snps': 48890}. Best is trial 19 with value: 0.11808010295076901.
[I 2025-12-05 16:17:31,629] Trial 40 finished with value: 0.11068373175538758 and parameters: {'model_type': 'mlp', 'hidden_dims': '[128, 64]', 'dropout': 0.157784218193534, 'batch_norm': True, 'lr': 8.917114624463671e-05, 'weight_decay': 5.126154710715455e-06, 'epochs': 136, 'loss': 'mae', 'optimizer': 'adam', 'graph_mode': 'off', 'use_snp_selection': True, 'num_snps': 55039}. Best is trial 19 with value: 0.11808010295076901.
[I 2025-12-05 16:17:34,168] Trial 41 finished with value: 0.09746167435082483 and parameters: {'model_type': 'mlp', 'hidden_dims': '[128, 64]', 'dropout': 0.18123023314613967, 'batch_norm': True, 'lr': 0.0003372757261853532, 'weight_decay': 0.00014469255613979755, 'epochs': 250, 'loss': 'mae', 'optimizer': 'adam', 'graph_mode': 'off', 'use_snp_selection': True, 'num_snps': 59564}. Best is trial 19 with value: 0.11808010295076901.
[I 2025-12-05 16:17:36,661] Trial 42 finished with value: 0.11155747853200437 and parameters: {'model_type': 'mlp', 'hidden_dims': '[128, 64]', 'dropout': 0.23657840659812415, 'batch_norm': True, 'lr': 0.00042893478412889415, 'weight_decay': 0.0005537860828505762, 'epochs': 267, 'loss': 'mae', 'optimizer': 'adam', 'graph_mode': 'off', 'use_snp_selection': True, 'num_snps': 55920}. Best is trial 19 with value: 0.11808010295076901.
[I 2025-12-05 16:17:39,112] Trial 43 finished with value: 0.09813643597344231 and parameters: {'model_type': 'mlp', 'hidden_dims': '[128, 64]', 'dropout': 0.16501788204988188, 'batch_norm': True, 'lr': 0.0005375362249681739, 'weight_decay': 0.00020826110831303403, 'epochs': 225, 'loss': 'mae', 'optimizer': 'adam', 'graph_mode': 'off', 'use_snp_selection': True, 'num_snps': 56466}. Best is trial 19 with value: 0.11808010295076901.
[I 2025-12-05 16:17:41,930] Trial 44 finished with value: 0.1057037031062315 and parameters: {'model_type': 'mlp', 'hidden_dims': '[512, 64]', 'dropout': 0.13268816869472994, 'batch_norm': True, 'lr': 0.0007303902978927541, 'weight_decay': 4.6125533519728704e-05, 'epochs': 274, 'loss': 'mae', 'optimizer': 'adam', 'graph_mode': 'off', 'use_snp_selection': True, 'num_snps': 48639}. Best is trial 19 with value: 0.11808010295076901.
[I 2025-12-05 16:17:43,967] Trial 45 finished with value: 0.10154057581647452 and parameters: {'model_type': 'mlp', 'hidden_dims': '[256, 128]', 'dropout': 0.27363142631239745, 'batch_norm': False, 'lr': 0.000987975119234227, 'weight_decay': 0.0009669331628569803, 'epochs': 246, 'loss': 'mae', 'optimizer': 'adam', 'graph_mode': 'off', 'use_snp_selection': True, 'num_snps': 41181}. Best is trial 19 with value: 0.11808010295076901.
[I 2025-12-05 16:17:47,247] Trial 46 finished with value: 0.10868285629191667 and parameters: {'model_type': 'mlp', 'hidden_dims': '[512, 128]', 'dropout': 0.20902483152630552, 'batch_norm': True, 'lr': 0.00019470076717846533, 'weight_decay': 1.4428625892543922e-05, 'epochs': 310, 'loss': 'mae', 'optimizer': 'adam', 'graph_mode': 'off', 'use_snp_selection': True, 'num_snps': 56531}. Best is trial 19 with value: 0.11808010295076901.
[I 2025-12-05 16:17:48,078] Trial 47 finished with value: 0.0640084286088663 and parameters: {'model_type': 'mlp', 'hidden_dims': '[128, 64]', 'dropout': 0.4164404415910767, 'batch_norm': True, 'lr': 3.7198007574291304e-05, 'weight_decay': 7.332143988912684e-05, 'epochs': 207, 'loss': 'mse', 'optimizer': 'adam', 'graph_mode': 'off', 'use_snp_selection': True, 'num_snps': 2313}. Best is trial 19 with value: 0.11808010295076901.
[I 2025-12-05 16:17:50,579] Trial 48 finished with value: 0.09589801460775255 and parameters: {'model_type': 'mlp', 'hidden_dims': '[128, 64]', 'dropout': 0.17808971499853038, 'batch_norm': True, 'lr': 0.00030775640715235286, 'weight_decay': 7.836397804351335e-06, 'epochs': 239, 'loss': 'mae', 'optimizer': 'adam', 'graph_mode': 'off', 'use_snp_selection': True, 'num_snps': 59569}. Best is trial 19 with value: 0.11808010295076901.
[I 2025-12-05 16:17:52,914] Trial 49 finished with value: 0.07635287233696403 and parameters: {'model_type': 'mlp', 'hidden_dims': '[256, 128]', 'dropout': 0.14764864569007555, 'batch_norm': False, 'lr': 0.0004802018419477515, 'weight_decay': 3.1688664647222817e-06, 'epochs': 287, 'loss': 'mse', 'optimizer': 'adam', 'graph_mode': 'off', 'use_snp_selection': True, 'num_snps': 48632}. Best is trial 19 with value: 0.11808010295076901.
[I 2025-12-05 16:17:54,848] Trial 50 finished with value: 0.1095075811770511 and parameters: {'model_type': 'mlp', 'hidden_dims': '[512, 256]', 'dropout': 0.2931521425219423, 'batch_norm': True, 'lr': 0.0007250271365438141, 'weight_decay': 2.1120484182042734e-05, 'epochs': 260, 'loss': 'mae', 'optimizer': 'adam', 'graph_mode': 'off', 'use_snp_selection': True, 'num_snps': 31339}. Best is trial 19 with value: 0.11808010295076901.
[I 2025-12-05 16:17:55,854] Trial 51 finished with value: 0.10403863289179148 and parameters: {'model_type': 'mlp', 'hidden_dims': '[128, 64]', 'dropout': 0.2188737277615268, 'batch_norm': True, 'lr': 0.0009971658521246891, 'weight_decay': 1.4310927583189227e-05, 'epochs': 290, 'loss': 'mae', 'optimizer': 'adam', 'graph_mode': 'off', 'use_snp_selection': False}. Best is trial 19 with value: 0.11808010295076901.
[I 2025-12-05 16:17:56,875] Trial 52 finished with value: 0.10999082694169761 and parameters: {'model_type': 'mlp', 'hidden_dims': '[128, 64]', 'dropout': 0.2032032274927183, 'batch_norm': True, 'lr': 0.0007622072841009951, 'weight_decay': 4.492821475593543e-06, 'epochs': 305, 'loss': 'mae', 'optimizer': 'adam', 'graph_mode': 'off', 'use_snp_selection': False}. Best is trial 19 with value: 0.11808010295076901.
[I 2025-12-05 16:17:57,834] Trial 53 finished with value: 0.10351593683038894 and parameters: {'model_type': 'mlp', 'hidden_dims': '[128, 64]', 'dropout': 0.2512598150423708, 'batch_norm': True, 'lr': 0.0005298671319328323, 'weight_decay': 3.906862440656367e-05, 'epochs': 279, 'loss': 'mae', 'optimizer': 'adam', 'graph_mode': 'off', 'use_snp_selection': False}. Best is trial 19 with value: 0.11808010295076901.
[I 2025-12-05 16:17:58,788] Trial 54 finished with value: 0.09658636345025802 and parameters: {'model_type': 'mlp', 'hidden_dims': '[512, 128]', 'dropout': 0.33192206632527693, 'batch_norm': True, 'lr': 0.0002745308654157332, 'weight_decay': 1.2291801045217332e-05, 'epochs': 58, 'loss': 'mae', 'optimizer': 'adam', 'graph_mode': 'off', 'use_snp_selection': False}. Best is trial 19 with value: 0.11808010295076901.
[I 2025-12-05 16:17:59,731] Trial 55 finished with value: 0.11843053744323442 and parameters: {'model_type': 'mlp', 'hidden_dims': '[128, 64]', 'dropout': 0.11773617982794649, 'batch_norm': True, 'lr': 0.0004152374988267345, 'weight_decay': 2.0683555345171316e-05, 'epochs': 270, 'loss': 'mae', 'optimizer': 'adam', 'graph_mode': 'off', 'use_snp_selection': False}. Best is trial 55 with value: 0.11843053744323442.
[I 2025-12-05 16:18:02,603] Trial 56 finished with value: 0.10933493987154018 and parameters: {'model_type': 'mlp', 'hidden_dims': '[512, 64]', 'dropout': 0.1259859459526025, 'batch_norm': True, 'lr': 0.00018251801123424626, 'weight_decay': 2.1533154121325306e-05, 'epochs': 255, 'loss': 'mae', 'optimizer': 'adam', 'graph_mode': 'off', 'use_snp_selection': True, 'num_snps': 53574}. Best is trial 55 with value: 0.11843053744323442.
[I 2025-12-05 16:18:03,514] Trial 57 finished with value: 0.11278056758882153 and parameters: {'model_type': 'mlp', 'hidden_dims': '[128, 64]', 'dropout': 0.11587980497446569, 'batch_norm': False, 'lr': 0.0003686048695617982, 'weight_decay': 8.551896366908441e-05, 'epochs': 271, 'loss': 'mse', 'optimizer': 'adam', 'graph_mode': 'off', 'use_snp_selection': False}. Best is trial 55 with value: 0.11843053744323442.
[I 2025-12-05 16:18:06,001] Trial 58 finished with value: 0.05000795139602445 and parameters: {'model_type': 'mlp', 'hidden_dims': '[128, 64]', 'dropout': 0.5742201080938646, 'batch_norm': True, 'lr': 0.00024037296326888407, 'weight_decay': 8.18877895984895e-06, 'epochs': 193, 'loss': 'mae', 'optimizer': 'adam', 'graph_mode': 'off', 'use_snp_selection': True, 'num_snps': 56900}. Best is trial 55 with value: 0.11843053744323442.
[I 2025-12-05 16:18:08,951] Trial 59 finished with value: 0.10503056078787926 and parameters: {'model_type': 'mlp', 'hidden_dims': '[256, 128, 64]', 'dropout': 0.16876357146587515, 'batch_norm': True, 'lr': 0.00045127320593947253, 'weight_decay': 1.946457671524108e-06, 'epochs': 299, 'loss': 'mae', 'optimizer': 'adam', 'graph_mode': 'off', 'use_snp_selection': True, 'num_snps': 60000}. Best is trial 55 with value: 0.11843053744323442.
[I 2025-12-05 16:18:10,678] Trial 60 finished with value: 0.09578279112766183 and parameters: {'model_type': 'mlp', 'hidden_dims': '[512, 256]', 'dropout': 0.14433189630534438, 'batch_norm': True, 'lr': 1.651797452058301e-05, 'weight_decay': 2.092415855482002e-07, 'epochs': 232, 'loss': 'mae', 'optimizer': 'adam', 'graph_mode': 'off', 'use_snp_selection': False}. Best is trial 55 with value: 0.11843053744323442.
[I 2025-12-05 16:18:11,588] Trial 61 finished with value: 0.11843847109566615 and parameters: {'model_type': 'mlp', 'hidden_dims': '[128, 64]', 'dropout': 0.11484563636484853, 'batch_norm': False, 'lr': 0.0003898460064052675, 'weight_decay': 7.255546248267082e-05, 'epochs': 270, 'loss': 'mse', 'optimizer': 'adam', 'graph_mode': 'off', 'use_snp_selection': False}. Best is trial 61 with value: 0.11843847109566615.
[I 2025-12-05 16:18:12,483] Trial 62 finished with value: 0.07068349694964957 and parameters: {'model_type': 'mlp', 'hidden_dims': '[128, 64]', 'dropout': 0.14582861655785648, 'batch_norm': False, 'lr': 0.000760945539877529, 'weight_decay': 5.3775066000117493e-05, 'epochs': 266, 'loss': 'mse', 'optimizer': 'adam', 'graph_mode': 'off', 'use_snp_selection': False}. Best is trial 61 with value: 0.11843847109566615.
[I 2025-12-05 16:18:13,353] Trial 63 finished with value: 0.09744289172808224 and parameters: {'model_type': 'mlp', 'hidden_dims': '[128, 64]', 'dropout': 0.11778840882689755, 'batch_norm': False, 'lr': 0.0005786958864279815, 'weight_decay': 0.00012492826871664725, 'epochs': 247, 'loss': 'mse', 'optimizer': 'adam', 'graph_mode': 'off', 'use_snp_selection': False}. Best is trial 61 with value: 0.11843847109566615.
[I 2025-12-05 16:18:14,308] Trial 64 finished with value: 0.07749420775242355 and parameters: {'model_type': 'mlp', 'hidden_dims': '[128, 64]', 'dropout': 0.3813243281820749, 'batch_norm': False, 'lr': 8.662340307745001e-06, 'weight_decay': 0.0002743595702038052, 'epochs': 316, 'loss': 'mse', 'optimizer': 'adam', 'graph_mode': 'off', 'use_snp_selection': False}. Best is trial 61 with value: 0.11843847109566615.
[I 2025-12-05 16:18:15,235] Trial 65 finished with value: 0.10522317540182066 and parameters: {'model_type': 'mlp', 'hidden_dims': '[128, 64]', 'dropout': 0.10601621768963207, 'batch_norm': False, 'lr': 0.00039044645381090966, 'weight_decay': 3.002859770597183e-05, 'epochs': 281, 'loss': 'mse', 'optimizer': 'adam', 'graph_mode': 'off', 'use_snp_selection': False}. Best is trial 61 with value: 0.11843847109566615.
[I 2025-12-05 16:18:17,540] Trial 66 finished with value: 0.11100676096257604 and parameters: {'model_type': 'mlp', 'hidden_dims': '[128, 64]', 'dropout': 0.1873757188809198, 'batch_norm': False, 'lr': 0.0002507696243169707, 'weight_decay': 1.9175534418013815e-05, 'epochs': 333, 'loss': 'mse', 'optimizer': 'adam', 'graph_mode': 'off', 'use_snp_selection': True, 'num_snps': 50145}. Best is trial 61 with value: 0.11843847109566615.
[I 2025-12-05 16:18:18,859] Trial 67 finished with value: 0.09453717490640857 and parameters: {'model_type': 'mlp', 'hidden_dims': '[256, 128]', 'dropout': 0.22874194361546007, 'batch_norm': True, 'lr': 0.0007826686264816872, 'weight_decay': 3.574934874613906e-05, 'epochs': 295, 'loss': 'mae', 'optimizer': 'adam', 'graph_mode': 'off', 'use_snp_selection': False}. Best is trial 61 with value: 0.11843847109566615.
[I 2025-12-05 16:18:20,998] Trial 68 finished with value: 0.10604699227996278 and parameters: {'model_type': 'mlp', 'hidden_dims': '[128, 64]', 'dropout': 0.17390276755876136, 'batch_norm': True, 'lr': 0.0005921388936469054, 'weight_decay': 7.207883147083361e-05, 'epochs': 222, 'loss': 'mae', 'optimizer': 'adam', 'graph_mode': 'off', 'use_snp_selection': True, 'num_snps': 44871}. Best is trial 61 with value: 0.11843847109566615.
[I 2025-12-05 16:18:23,186] Trial 69 finished with value: 0.09945537806469225 and parameters: {'model_type': 'mlp', 'hidden_dims': '[512, 128]', 'dropout': 0.2646935531241579, 'batch_norm': True, 'lr': 0.00032093835861305635, 'weight_decay': 2.6287626902814993e-05, 'epochs': 239, 'loss': 'mae', 'optimizer': 'adam', 'graph_mode': 'off', 'use_snp_selection': True, 'num_snps': 34343}. Best is trial 61 with value: 0.11843847109566615.
