[I 2025-12-05 15:00:56,058] Trial 83 finished with value: 0.08189086973254406 and parameters: {'model_type': 'mlp', 'hidden_dims': '[512, 128]', 'dropout': 0.42330361679984796, 'batch_norm': True, 'lr': 0.0009999604914503906, 'weight_decay': 0.0001937438046595744, 'epochs': 70, 'loss': 'mse', 'optimizer': 'adam', 'graph_mode': 'off', 'use_snp_selection': False}. Best is trial 62 with value: 0.0986576692760171.
[I 2025-12-05 15:00:57,091] Trial 84 finished with value: 0.06850046581135055 and parameters: {'model_type': 'mlp', 'hidden_dims': '[512, 128]', 'dropout': 0.36359347328677716, 'batch_norm': True, 'lr': 0.00044680369739916783, 'weight_decay': 0.00038687048212351775, 'epochs': 89, 'loss': 'mse', 'optimizer': 'adam', 'graph_mode': 'off', 'use_snp_selection': False}. Best is trial 62 with value: 0.0986576692760171.
[I 2025-12-05 15:00:58,279] Trial 85 finished with value: 0.06771701555078558 and parameters: {'model_type': 'mlp', 'hidden_dims': '[512, 128]', 'dropout': 0.3886930795895148, 'batch_norm': True, 'lr': 0.0008323650007548212, 'weight_decay': 0.00026173116022251236, 'epochs': 119, 'loss': 'mse', 'optimizer': 'adam', 'graph_mode': 'off', 'use_snp_selection': False}. Best is trial 62 with value: 0.0986576692760171.
[I 2025-12-05 15:00:59,410] Trial 86 finished with value: 0.061739977338092084 and parameters: {'model_type': 'mlp', 'hidden_dims': '[512, 128]', 'dropout': 0.40978616824859254, 'batch_norm': True, 'lr': 0.0006156107259218796, 'weight_decay': 0.00010073148673499052, 'epochs': 102, 'loss': 'mse', 'optimizer': 'adam', 'graph_mode': 'off', 'use_snp_selection': False}. Best is trial 62 with value: 0.0986576692760171.
[I 2025-12-05 15:01:00,653] Trial 87 finished with value: 0.06757674003711472 and parameters: {'model_type': 'mlp', 'hidden_dims': '[512, 128]', 'dropout': 0.5190408303663516, 'batch_norm': True, 'lr': 0.00039606520260967965, 'weight_decay': 3.41293296563291e-05, 'epochs': 136, 'loss': 'mse', 'optimizer': 'adam', 'graph_mode': 'off', 'use_snp_selection': False}. Best is trial 62 with value: 0.0986576692760171.
[I 2025-12-05 15:01:01,506] Trial 88 finished with value: 0.08492304631642739 and parameters: {'model_type': 'mlp', 'hidden_dims': '[256, 128, 64]', 'dropout': 0.45010186363107574, 'batch_norm': True, 'lr': 0.0006769006067607169, 'weight_decay': 0.0007690643697885425, 'epochs': 113, 'loss': 'mse', 'optimizer': 'adam', 'graph_mode': 'off', 'use_snp_selection': False}. Best is trial 62 with value: 0.0986576692760171.
[I 2025-12-05 15:01:02,773] Trial 89 finished with value: 0.0739251082606425 and parameters: {'model_type': 'mlp', 'hidden_dims': '[512, 128]', 'dropout': 0.47122552113837035, 'batch_norm': True, 'lr': 0.0004928165656324777, 'weight_decay': 7.26789680998496e-05, 'epochs': 144, 'loss': 'mse', 'optimizer': 'adam', 'graph_mode': 'off', 'use_snp_selection': False}. Best is trial 62 with value: 0.0986576692760171.
[I 2025-12-05 15:01:03,778] Trial 90 finished with value: 0.07660988936080967 and parameters: {'model_type': 'mlp', 'hidden_dims': '[512, 64]', 'dropout': 0.3515636591049661, 'batch_norm': True, 'lr': 0.00016682397805451918, 'weight_decay': 0.0002644134723260628, 'epochs': 83, 'loss': 'mse', 'optimizer': 'adam', 'graph_mode': 'off', 'use_snp_selection': False}. Best is trial 62 with value: 0.0986576692760171.
[I 2025-12-05 15:01:04,606] Trial 91 finished with value: 0.07867791432977368 and parameters: {'model_type': 'mlp', 'hidden_dims': '[256, 128]', 'dropout': 0.39446605583639266, 'batch_norm': True, 'lr': 0.0005275473069151979, 'weight_decay': 1.033825778028681e-06, 'epochs': 123, 'loss': 'mse', 'optimizer': 'adam', 'graph_mode': 'off', 'use_snp_selection': False}. Best is trial 62 with value: 0.0986576692760171.
[I 2025-12-05 15:01:05,681] Trial 92 finished with value: 0.05262829835055909 and parameters: {'model_type': 'mlp', 'hidden_dims': '[512, 128]', 'dropout': 0.4191852159066726, 'batch_norm': True, 'lr': 0.00032911279730139467, 'weight_decay': 0.0005824117908645372, 'epochs': 101, 'loss': 'mse', 'optimizer': 'adam', 'graph_mode': 'off', 'use_snp_selection': False}. Best is trial 62 with value: 0.0986576692760171.
[I 2025-12-05 15:01:06,514] Trial 93 finished with value: 0.06729983434504144 and parameters: {'model_type': 'mlp', 'hidden_dims': '[256, 128]', 'dropout': 0.3975321367075062, 'batch_norm': True, 'lr': 0.0007895344527918605, 'weight_decay': 1.7522096989865903e-06, 'epochs': 125, 'loss': 'mse', 'optimizer': 'adam', 'graph_mode': 'off', 'use_snp_selection': False}. Best is trial 62 with value: 0.0986576692760171.
[I 2025-12-05 15:01:07,629] Trial 94 finished with value: 0.070357178882613 and parameters: {'model_type': 'mlp', 'hidden_dims': '[512, 128]', 'dropout': 0.37664118141120406, 'batch_norm': True, 'lr': 0.0006372380465597209, 'weight_decay': 0.0009142942127777707, 'epochs': 112, 'loss': 'mse', 'optimizer': 'adam', 'graph_mode': 'off', 'use_snp_selection': False}. Best is trial 62 with value: 0.0986576692760171.
[I 2025-12-05 15:01:08,479] Trial 95 finished with value: 0.0814525456163827 and parameters: {'model_type': 'mlp', 'hidden_dims': '[256, 128]', 'dropout': 0.4442381484104546, 'batch_norm': True, 'lr': 0.00043855364552643835, 'weight_decay': 1.1493722779983008e-05, 'epochs': 133, 'loss': 'mse', 'optimizer': 'adam', 'graph_mode': 'off', 'use_snp_selection': False}. Best is trial 62 with value: 0.0986576692760171.
[I 2025-12-05 15:01:09,761] Trial 96 finished with value: 0.09505289118083658 and parameters: {'model_type': 'mlp', 'hidden_dims': '[512, 128]', 'dropout': 0.3705300102149913, 'batch_norm': True, 'lr': 0.0005427558172684807, 'weight_decay': 3.960001971894395e-06, 'epochs': 144, 'loss': 'mse', 'optimizer': 'adam', 'graph_mode': 'off', 'use_snp_selection': False}. Best is trial 62 with value: 0.0986576692760171.
[I 2025-12-05 15:01:10,859] Trial 97 finished with value: 0.07758541354467886 and parameters: {'model_type': 'mlp', 'hidden_dims': '[512, 128]', 'dropout': 0.36948624673356173, 'batch_norm': True, 'lr': 0.0008071471743475094, 'weight_decay': 8.464283837097655e-06, 'epochs': 93, 'loss': 'mse', 'optimizer': 'adam', 'graph_mode': 'off', 'use_snp_selection': False}. Best is trial 62 with value: 0.0986576692760171.
[I 2025-12-05 15:01:12,035] Trial 98 finished with value: 0.06597438172835592 and parameters: {'model_type': 'mlp', 'hidden_dims': '[512, 128]', 'dropout': 0.3490144130601259, 'batch_norm': True, 'lr': 0.00021837187810843812, 'weight_decay': 3.193046556615991e-06, 'epochs': 119, 'loss': 'mse', 'optimizer': 'adam', 'graph_mode': 'off', 'use_snp_selection': False}. Best is trial 62 with value: 0.0986576692760171.
[I 2025-12-05 15:01:13,286] Trial 99 finished with value: 0.08749768562375629 and parameters: {'model_type': 'mlp', 'hidden_dims': '[512, 128]', 'dropout': 0.31091549081195824, 'batch_norm': True, 'lr': 0.0002855443232241305, 'weight_decay': 5.550808423651165e-06, 'epochs': 139, 'loss': 'mse', 'optimizer': 'adam', 'graph_mode': 'off', 'use_snp_selection': False}. Best is trial 62 with value: 0.0986576692760171.
[I 2025-12-05 15:01:14,320] Trial 100 finished with value: 0.0816797648766627 and parameters: {'model_type': 'mlp', 'hidden_dims': '[512, 128]', 'dropout': 0.3857809308668118, 'batch_norm': True, 'lr': 0.000647297854291225, 'weight_decay': 4.609349880399202e-05, 'epochs': 87, 'loss': 'mse', 'optimizer': 'adam', 'graph_mode': 'off', 'use_snp_selection': False}. Best is trial 62 with value: 0.0986576692760171.
[I 2025-12-05 15:01:15,221] Trial 101 finished with value: 0.08571482338168637 and parameters: {'model_type': 'mlp', 'hidden_dims': '[256, 128]', 'dropout': 0.39747206735444984, 'batch_norm': True, 'lr': 0.0005233699470416095, 'weight_decay': 3.508534110274036e-06, 'epochs': 157, 'loss': 'mse', 'optimizer': 'adam', 'graph_mode': 'off', 'use_snp_selection': False}. Best is trial 62 with value: 0.0986576692760171.
[I 2025-12-05 15:01:16,482] Trial 102 finished with value: 0.07024396350977118 and parameters: {'model_type': 'mlp', 'hidden_dims': '[512, 128]', 'dropout': 0.4325609705348037, 'batch_norm': True, 'lr': 0.0003913441496230015, 'weight_decay': 1.1309971599628586e-06, 'epochs': 150, 'loss': 'mse', 'optimizer': 'adam', 'graph_mode': 'off', 'use_snp_selection': False}. Best is trial 62 with value: 0.0986576692760171.
[I 2025-12-05 15:01:17,574] Trial 103 finished with value: 0.0833199993664601 and parameters: {'model_type': 'mlp', 'hidden_dims': '[512, 128]', 'dropout': 0.415440818345415, 'batch_norm': True, 'lr': 0.0005731896683257429, 'weight_decay': 1.9624805642187823e-06, 'epochs': 105, 'loss': 'mse', 'optimizer': 'adam', 'graph_mode': 'off', 'use_snp_selection': False}. Best is trial 62 with value: 0.0986576692760171.
[I 2025-12-05 15:01:18,292] Trial 104 finished with value: 0.08866113197020012 and parameters: {'model_type': 'mlp', 'hidden_dims': '[128, 64]', 'dropout': 0.33302718060136033, 'batch_norm': True, 'lr': 0.00036405328568491586, 'weight_decay': 4.21325852938508e-06, 'epochs': 141, 'loss': 'mse', 'optimizer': 'adam', 'graph_mode': 'off', 'use_snp_selection': False}. Best is trial 62 with value: 0.0986576692760171.
[I 2025-12-05 15:01:19,144] Trial 105 finished with value: 0.07181819319380885 and parameters: {'model_type': 'mlp', 'hidden_dims': '[256, 128]', 'dropout': 0.40248078082880906, 'batch_norm': True, 'lr': 0.0007201553371852246, 'weight_decay': 6.881270312093703e-07, 'epochs': 133, 'loss': 'mse', 'optimizer': 'adam', 'graph_mode': 'off', 'use_snp_selection': False}. Best is trial 62 with value: 0.0986576692760171.
[I 2025-12-05 15:01:19,982] Trial 106 finished with value: 0.07502042476039711 and parameters: {'model_type': 'mlp', 'hidden_dims': '[256, 128, 64]', 'dropout': 0.36142167629046845, 'batch_norm': True, 'lr': 0.000464809076024105, 'weight_decay': 1.914040433442094e-05, 'epochs': 110, 'loss': 'mse', 'optimizer': 'adam', 'graph_mode': 'off', 'use_snp_selection': False}. Best is trial 62 with value: 0.0986576692760171.
[I 2025-12-05 15:01:20,895] Trial 107 finished with value: 0.07664396096068388 and parameters: {'model_type': 'mlp', 'hidden_dims': '[512, 128]', 'dropout': 0.4131490464233481, 'batch_norm': True, 'lr': 0.0008466193800376046, 'weight_decay': 2.699776317882095e-06, 'epochs': 121, 'loss': 'mse', 'optimizer': 'adam', 'graph_mode': 'off', 'use_snp_selection': True, 'num_snps': 5865}. Best is trial 62 with value: 0.0986576692760171.
[I 2025-12-05 15:01:21,850] Trial 108 finished with value: 0.060822432700826844 and parameters: {'model_type': 'mlp', 'hidden_dims': '[256, 128]', 'dropout': 0.38705143637631056, 'batch_norm': True, 'lr': 6.403508123824314e-05, 'weight_decay': 3.116944570792645e-05, 'epochs': 161, 'loss': 'mse', 'optimizer': 'adam', 'graph_mode': 'off', 'use_snp_selection': False}. Best is trial 62 with value: 0.0986576692760171.
[I 2025-12-05 15:01:22,947] Trial 109 finished with value: 0.07265499984086456 and parameters: {'model_type': 'mlp', 'hidden_dims': '[512, 128]', 'dropout': 0.3736742045063166, 'batch_norm': True, 'lr': 0.0005564851677869048, 'weight_decay': 1.2784825406709165e-06, 'epochs': 97, 'loss': 'mse', 'optimizer': 'adam', 'graph_mode': 'off', 'use_snp_selection': False}. Best is trial 62 with value: 0.0986576692760171.
[I 2025-12-05 15:01:24,224] Trial 110 finished with value: 0.08308885081392042 and parameters: {'model_type': 'mlp', 'hidden_dims': '[512, 64]', 'dropout': 0.3528146896474806, 'batch_norm': True, 'lr': 0.0009963932611541794, 'weight_decay': 0.0006215799573182153, 'epochs': 148, 'loss': 'mse', 'optimizer': 'adam', 'graph_mode': 'off', 'use_snp_selection': False}. Best is trial 62 with value: 0.0986576692760171.
[I 2025-12-05 15:01:26,062] Trial 111 finished with value: 0.06761020735212228 and parameters: {'model_type': 'mlp', 'hidden_dims': '[512, 128]', 'dropout': 0.17258832653890555, 'batch_norm': True, 'lr': 0.00019999181389210817, 'weight_decay': 5.022469481374084e-06, 'epochs': 301, 'loss': 'mse', 'optimizer': 'adam', 'graph_mode': 'off', 'use_snp_selection': False}. Best is trial 62 with value: 0.0986576692760171.
[I 2025-12-05 15:01:27,818] Trial 112 finished with value: 0.08148007768807233 and parameters: {'model_type': 'mlp', 'hidden_dims': '[512, 128]', 'dropout': 0.46722436926211225, 'batch_norm': True, 'lr': 0.00034399629780884123, 'weight_decay': 4.367340180671067e-06, 'epochs': 279, 'loss': 'mse', 'optimizer': 'adam', 'graph_mode': 'off', 'use_snp_selection': False}. Best is trial 62 with value: 0.0986576692760171.
[I 2025-12-05 15:01:28,996] Trial 113 finished with value: 0.06548079878138172 and parameters: {'model_type': 'mlp', 'hidden_dims': '[512, 128]', 'dropout': 0.2925617522425614, 'batch_norm': True, 'lr': 0.0004191235631893753, 'weight_decay': 1.3265425286572309e-05, 'epochs': 129, 'loss': 'mse', 'optimizer': 'adam', 'graph_mode': 'off', 'use_snp_selection': False}. Best is trial 62 with value: 0.0986576692760171.
[I 2025-12-05 15:01:30,717] Trial 114 finished with value: 0.08627564997051222 and parameters: {'model_type': 'mlp', 'hidden_dims': '[512, 128]', 'dropout': 0.22230042313845835, 'batch_norm': True, 'lr': 0.00027473929613879987, 'weight_decay': 2.3854321156098864e-06, 'epochs': 258, 'loss': 'mse', 'optimizer': 'adam', 'graph_mode': 'off', 'use_snp_selection': False}. Best is trial 62 with value: 0.0986576692760171.
[I 2025-12-05 15:01:32,020] Trial 115 finished with value: 0.08662686574729925 and parameters: {'model_type': 'mlp', 'hidden_dims': '[256, 128]', 'dropout': 0.2603551681723477, 'batch_norm': True, 'lr': 0.0006654390230483618, 'weight_decay': 0.000968980949673781, 'epochs': 115, 'loss': 'mse', 'optimizer': 'adam', 'graph_mode': 'off', 'use_snp_selection': True, 'num_snps': 18738}. Best is trial 62 with value: 0.0986576692760171.
[I 2025-12-05 15:01:33,120] Trial 116 finished with value: 0.07160120869359224 and parameters: {'model_type': 'mlp', 'hidden_dims': '[512, 128]', 'dropout': 0.4322908694355649, 'batch_norm': True, 'lr': 0.00048321153602401217, 'weight_decay': 6.594369221297077e-06, 'epochs': 99, 'loss': 'mse', 'optimizer': 'adam', 'graph_mode': 'off', 'use_snp_selection': False}. Best is trial 62 with value: 0.0986576692760171.
[I 2025-12-05 15:01:34,075] Trial 117 finished with value: 0.06823018960679685 and parameters: {'model_type': 'mlp', 'hidden_dims': '[256, 128]', 'dropout': 0.40638477793471023, 'batch_norm': True, 'lr': 0.00024558682081128597, 'weight_decay': 2.050424165969715e-06, 'epochs': 169, 'loss': 'mse', 'optimizer': 'adam', 'graph_mode': 'off', 'use_snp_selection': False}. Best is trial 62 with value: 0.0986576692760171.
[I 2025-12-05 15:01:35,176] Trial 118 finished with value: 0.06365100286527207 and parameters: {'model_type': 'mlp', 'hidden_dims': '[512, 128]', 'dropout': 0.19562154942396356, 'batch_norm': True, 'lr': 2.317829498873686e-06, 'weight_decay': 8.735807890531104e-06, 'epochs': 107, 'loss': 'mae', 'optimizer': 'adam', 'graph_mode': 'off', 'use_snp_selection': False}. Best is trial 62 with value: 0.0986576692760171.
[I 2025-12-05 15:01:37,158] Trial 119 finished with value: 0.04542008091374184 and parameters: {'model_type': 'mlp', 'hidden_dims': '[512, 128]', 'dropout': 0.340912248609777, 'batch_norm': False, 'lr': 5.011008041918234e-05, 'weight_decay': 3.3138591084133542e-06, 'epochs': 345, 'loss': 'mse', 'optimizer': 'adam', 'graph_mode': 'off', 'use_snp_selection': False}. Best is trial 62 with value: 0.0986576692760171.
[I 2025-12-05 15:01:38,009] Trial 120 finished with value: 0.08481581368940933 and parameters: {'model_type': 'mlp', 'hidden_dims': '[128, 64]', 'dropout': 0.11248223184139222, 'batch_norm': True, 'lr': 0.00015506899353445906, 'weight_decay': 1.4534834754669826e-06, 'epochs': 237, 'loss': 'mse', 'optimizer': 'adam', 'graph_mode': 'off', 'use_snp_selection': False}. Best is trial 62 with value: 0.0986576692760171.
[I 2025-12-05 15:01:39,020] Trial 121 finished with value: 0.07938318789835239 and parameters: {'model_type': 'mlp', 'hidden_dims': '[512, 128]', 'dropout': 0.406910158101029, 'batch_norm': True, 'lr': 0.0005959319376684092, 'weight_decay': 0.0004853904469241864, 'epochs': 85, 'loss': 'mse', 'optimizer': 'adam', 'graph_mode': 'off', 'use_snp_selection': False}. Best is trial 62 with value: 0.0986576692760171.
[I 2025-12-05 15:01:39,994] Trial 122 finished with value: 0.08223461034264772 and parameters: {'model_type': 'mlp', 'hidden_dims': '[512, 128]', 'dropout': 0.3913846863651763, 'batch_norm': True, 'lr': 0.000751094360423354, 'weight_decay': 0.0006870387883171516, 'epochs': 75, 'loss': 'mse', 'optimizer': 'adam', 'graph_mode': 'off', 'use_snp_selection': False}. Best is trial 62 with value: 0.0986576692760171.
[I 2025-12-05 15:01:41,206] Trial 123 finished with value: 0.06704646248264727 and parameters: {'model_type': 'mlp', 'hidden_dims': '[512, 128]', 'dropout': 0.42458833812194524, 'batch_norm': True, 'lr': 0.000538607416506397, 'weight_decay': 0.0003609012930584717, 'epochs': 126, 'loss': 'mse', 'optimizer': 'adam', 'graph_mode': 'off', 'use_snp_selection': False}. Best is trial 62 with value: 0.0986576692760171.
[I 2025-12-05 15:01:42,177] Trial 124 finished with value: 0.07975604212083327 and parameters: {'model_type': 'mlp', 'hidden_dims': '[512, 128]', 'dropout': 0.1491889015604989, 'batch_norm': True, 'lr': 0.0006299190697289361, 'weight_decay': 0.000577844706435822, 'epochs': 59, 'loss': 'mse', 'optimizer': 'adam', 'graph_mode': 'off', 'use_snp_selection': False}. Best is trial 62 with value: 0.0986576692760171.
[I 2025-12-05 15:01:43,148] Trial 125 finished with value: 0.08593023095586849 and parameters: {'model_type': 'mlp', 'hidden_dims': '[256, 128]', 'dropout': 0.3761118488753042, 'batch_norm': True, 'lr': 0.00032134686228718645, 'weight_decay': 0.0003306710092177294, 'epochs': 94, 'loss': 'mse', 'optimizer': 'adam', 'graph_mode': 'off', 'use_snp_selection': True, 'num_snps': 9098}. Best is trial 62 with value: 0.0986576692760171.
[I 2025-12-05 15:01:44,219] Trial 126 finished with value: 0.07012285398654144 and parameters: {'model_type': 'mlp', 'hidden_dims': '[512, 128]', 'dropout': 0.4576139477801789, 'batch_norm': True, 'lr': 0.00043186473912630927, 'weight_decay': 0.0001723969726354581, 'epochs': 89, 'loss': 'mse', 'optimizer': 'adam', 'graph_mode': 'off', 'use_snp_selection': False}. Best is trial 62 with value: 0.0986576692760171.
[I 2025-12-05 15:01:45,710] Trial 127 finished with value: 0.08806420335800513 and parameters: {'model_type': 'mlp', 'hidden_dims': '[512, 128]', 'dropout': 0.48201791520246945, 'batch_norm': True, 'lr': 0.0008566415863322527, 'weight_decay': 2.6517249609196583e-05, 'epochs': 207, 'loss': 'mse', 'optimizer': 'adam', 'graph_mode': 'off', 'use_snp_selection': False}. Best is trial 62 with value: 0.0986576692760171.
[I 2025-12-05 15:01:46,532] Trial 128 finished with value: 0.07423495136190411 and parameters: {'model_type': 'mlp', 'hidden_dims': '[256, 128, 64]', 'dropout': 0.44316236455813285, 'batch_norm': True, 'lr': 0.0003784077412201484, 'weight_decay': 0.0007985510733239785, 'epochs': 114, 'loss': 'mae', 'optimizer': 'adam', 'graph_mode': 'off', 'use_snp_selection': False}. Best is trial 62 with value: 0.0986576692760171.
[I 2025-12-05 15:01:47,779] Trial 129 finished with value: 0.08741027296911946 and parameters: {'model_type': 'mlp', 'hidden_dims': '[256, 128]', 'dropout': 0.27880200574624514, 'batch_norm': True, 'lr': 0.0004877740911074044, 'weight_decay': 9.532687199399128e-07, 'epochs': 324, 'loss': 'mse', 'optimizer': 'adam', 'graph_mode': 'off', 'use_snp_selection': False}. Best is trial 62 with value: 0.0986576692760171.
[I 2025-12-05 15:01:48,772] Trial 130 finished with value: 0.06613945293449891 and parameters: {'model_type': 'mlp', 'hidden_dims': '[512, 256]', 'dropout': 0.36570948865362096, 'batch_norm': True, 'lr': 0.00010757946592387673, 'weight_decay': 0.0009972800945721567, 'epochs': 79, 'loss': 'mse', 'optimizer': 'adam', 'graph_mode': 'off', 'use_snp_selection': False}. Best is trial 62 with value: 0.0986576692760171.
[I 2025-12-05 15:01:50,739] Trial 131 finished with value: 0.09218933125990983 and parameters: {'model_type': 'mlp', 'hidden_dims': '[512, 128]', 'dropout': 0.2042830085448057, 'batch_norm': True, 'lr': 0.000716075413132412, 'weight_decay': 5.440788663210822e-07, 'epochs': 166, 'loss': 'mse', 'optimizer': 'adam', 'graph_mode': 'off', 'use_snp_selection': True, 'num_snps': 35953}. Best is trial 62 with value: 0.0986576692760171.
[I 2025-12-05 15:01:51,982] Trial 132 finished with value: 0.08700544577911117 and parameters: {'model_type': 'mlp', 'hidden_dims': '[512, 128]', 'dropout': 0.21079633308756832, 'batch_norm': True, 'lr': 0.000731678728987546, 'weight_decay': 4.2818536776717717e-07, 'epochs': 176, 'loss': 'mse', 'optimizer': 'adam', 'graph_mode': 'off', 'use_snp_selection': True, 'num_snps': 16027}. Best is trial 62 with value: 0.0986576692760171.
[I 2025-12-05 15:01:53,849] Trial 133 finished with value: 0.08620211306107615 and parameters: {'model_type': 'mlp', 'hidden_dims': '[512, 128]', 'dropout': 0.17940746107911712, 'batch_norm': True, 'lr': 0.0005584567438733111, 'weight_decay': 3.5183297819130435e-07, 'epochs': 188, 'loss': 'mse', 'optimizer': 'adam', 'graph_mode': 'off', 'use_snp_selection': True, 'num_snps': 28815}. Best is trial 62 with value: 0.0986576692760171.
[I 2025-12-05 15:01:56,013] Trial 134 finished with value: 0.0915676417485017 and parameters: {'model_type': 'mlp', 'hidden_dims': '[512, 128]', 'dropout': 0.16229097644970292, 'batch_norm': True, 'lr': 0.0006397700632038339, 'weight_decay': 0.00023356317275607984, 'epochs': 221, 'loss': 'mse', 'optimizer': 'adam', 'graph_mode': 'off', 'use_snp_selection': True, 'num_snps': 35294}. Best is trial 62 with value: 0.0986576692760171.
