[I 2025-12-05 16:17:23,950] Trial 107 finished with value: 0.008062383588674428 and parameters: {'model_type': 'mlp', 'hidden_dims': '[512, 256]', 'dropout': 0.32782813471869854, 'batch_norm': False, 'lr': 0.00040373684922939663, 'weight_decay': 4.207537572191835e-06, 'epochs': 166, 'loss': 'mse', 'optimizer': 'adam', 'graph_mode': 'off', 'use_snp_selection': True, 'num_snps': 29228}. Best is trial 90 with value: 0.0632226944528337.
[I 2025-12-05 16:17:25,018] Trial 108 finished with value: -0.01014886039761305 and parameters: {'model_type': 'mlp', 'hidden_dims': '[512, 256]', 'dropout': 0.4953489771764456, 'batch_norm': True, 'lr': 9.469843410818628e-06, 'weight_decay': 1.4542758270500695e-06, 'epochs': 228, 'loss': 'mse', 'optimizer': 'adam', 'graph_mode': 'off', 'use_snp_selection': True, 'num_snps': 6811}. Best is trial 90 with value: 0.0632226944528337.
[I 2025-12-05 16:17:26,154] Trial 109 finished with value: 0.018926334566179093 and parameters: {'model_type': 'mlp', 'hidden_dims': '[256, 128, 64]', 'dropout': 0.35872340994845775, 'batch_norm': False, 'lr': 0.0004623769374000844, 'weight_decay': 9.559335525929368e-06, 'epochs': 334, 'loss': 'mae', 'optimizer': 'adam', 'graph_mode': 'off', 'use_snp_selection': True, 'num_snps': 5249}. Best is trial 90 with value: 0.0632226944528337.
[I 2025-12-05 16:17:27,527] Trial 110 finished with value: 0.015147198756700989 and parameters: {'model_type': 'mlp', 'hidden_dims': '[512, 256]', 'dropout': 0.37664822028070155, 'batch_norm': False, 'lr': 8.93073828926676e-05, 'weight_decay': 6.412816754700809e-06, 'epochs': 342, 'loss': 'mse', 'optimizer': 'adam', 'graph_mode': 'off', 'use_snp_selection': True, 'num_snps': 12218}. Best is trial 90 with value: 0.0632226944528337.
[I 2025-12-05 16:17:28,565] Trial 111 finished with value: 0.057525146997842246 and parameters: {'model_type': 'mlp', 'hidden_dims': '[128, 64]', 'dropout': 0.5602537147585095, 'batch_norm': False, 'lr': 0.00032105887157838476, 'weight_decay': 0.00010399394720449589, 'epochs': 326, 'loss': 'mse', 'optimizer': 'adam', 'graph_mode': 'off', 'use_snp_selection': True, 'num_snps': 3066}. Best is trial 90 with value: 0.0632226944528337.
[I 2025-12-05 16:17:29,559] Trial 112 finished with value: 0.04512395724007526 and parameters: {'model_type': 'mlp', 'hidden_dims': '[128, 64]', 'dropout': 0.34197623081311407, 'batch_norm': False, 'lr': 0.0008784103814241524, 'weight_decay': 3.5506038545049686e-06, 'epochs': 300, 'loss': 'mse', 'optimizer': 'adam', 'graph_mode': 'off', 'use_snp_selection': True, 'num_snps': 3322}. Best is trial 90 with value: 0.0632226944528337.
[I 2025-12-05 16:17:30,550] Trial 113 finished with value: 0.026473011109427475 and parameters: {'model_type': 'mlp', 'hidden_dims': '[128, 64]', 'dropout': 0.5611783116410395, 'batch_norm': False, 'lr': 0.000885365777854115, 'weight_decay': 2.4283621094349218e-06, 'epochs': 309, 'loss': 'mse', 'optimizer': 'adam', 'graph_mode': 'off', 'use_snp_selection': True, 'num_snps': 3512}. Best is trial 90 with value: 0.0632226944528337.
[I 2025-12-05 16:17:31,633] Trial 114 finished with value: 0.006450044013954244 and parameters: {'model_type': 'mlp', 'hidden_dims': '[128, 64]', 'dropout': 0.3474846660566404, 'batch_norm': False, 'lr': 0.00020145506148585494, 'weight_decay': 7.34551750712081e-05, 'epochs': 298, 'loss': 'mse', 'optimizer': 'adam', 'graph_mode': 'off', 'use_snp_selection': True, 'num_snps': 7914}. Best is trial 90 with value: 0.0632226944528337.
[I 2025-12-05 16:17:32,696] Trial 115 finished with value: 0.026033668070330133 and parameters: {'model_type': 'mlp', 'hidden_dims': '[128, 64]', 'dropout': 0.535286502023654, 'batch_norm': False, 'lr': 0.00032459729703597707, 'weight_decay': 5.446751453416918e-06, 'epochs': 320, 'loss': 'mse', 'optimizer': 'adam', 'graph_mode': 'off', 'use_snp_selection': True, 'num_snps': 4684}. Best is trial 90 with value: 0.0632226944528337.
[I 2025-12-05 16:17:33,824] Trial 116 finished with value: 0.0070120124783797245 and parameters: {'model_type': 'mlp', 'hidden_dims': '[128, 64]', 'dropout': 0.48352287203466254, 'batch_norm': False, 'lr': 0.0008366401701509476, 'weight_decay': 3.5796273573017335e-06, 'epochs': 326, 'loss': 'mse', 'optimizer': 'adam', 'graph_mode': 'off', 'use_snp_selection': True, 'num_snps': 6076}. Best is trial 90 with value: 0.0632226944528337.
[I 2025-12-05 16:17:35,030] Trial 117 finished with value: -0.0037464518032415484 and parameters: {'model_type': 'mlp', 'hidden_dims': '[128, 64]', 'dropout': 0.5704079408711068, 'batch_norm': False, 'lr': 0.0002321853165559724, 'weight_decay': 0.00010757488147889446, 'epochs': 302, 'loss': 'mse', 'optimizer': 'adam', 'graph_mode': 'off', 'use_snp_selection': True, 'num_snps': 10131}. Best is trial 90 with value: 0.0632226944528337.
[I 2025-12-05 16:17:35,863] Trial 118 finished with value: 0.0596782416625213 and parameters: {'model_type': 'mlp', 'hidden_dims': '[128, 64]', 'dropout': 0.5465376762529927, 'batch_norm': False, 'lr': 0.0006946669131903302, 'weight_decay': 1.1483710053178032e-05, 'epochs': 133, 'loss': 'mse', 'optimizer': 'adam', 'graph_mode': 'off', 'use_snp_selection': True, 'num_snps': 3614}. Best is trial 90 with value: 0.0632226944528337.
[I 2025-12-05 16:17:36,679] Trial 119 finished with value: 0.033456040671092056 and parameters: {'model_type': 'mlp', 'hidden_dims': '[128, 64]', 'dropout': 0.5492220300439155, 'batch_norm': False, 'lr': 0.0006754193460342328, 'weight_decay': 7.242019722920642e-05, 'epochs': 140, 'loss': 'mse', 'optimizer': 'adam', 'graph_mode': 'off', 'use_snp_selection': True, 'num_snps': 3732}. Best is trial 90 with value: 0.0632226944528337.
[I 2025-12-05 16:17:37,667] Trial 120 finished with value: 0.011860285623645307 and parameters: {'model_type': 'mlp', 'hidden_dims': '[128, 64]', 'dropout': 0.1136238709712456, 'batch_norm': False, 'lr': 0.0007601443214543483, 'weight_decay': 1.2417937611392091e-05, 'epochs': 314, 'loss': 'mse', 'optimizer': 'adam', 'graph_mode': 'off', 'use_snp_selection': False}. Best is trial 90 with value: 0.0632226944528337.
[I 2025-12-05 16:17:38,512] Trial 121 finished with value: 0.0053902571501003105 and parameters: {'model_type': 'mlp', 'hidden_dims': '[128, 64]', 'dropout': 0.5165189005791548, 'batch_norm': False, 'lr': 0.0005162581272705609, 'weight_decay': 4.422727805437809e-06, 'epochs': 118, 'loss': 'mse', 'optimizer': 'adam', 'graph_mode': 'off', 'use_snp_selection': True, 'num_snps': 4763}. Best is trial 90 with value: 0.0632226944528337.
[I 2025-12-05 16:17:39,347] Trial 122 finished with value: 0.0368411834096945 and parameters: {'model_type': 'mlp', 'hidden_dims': '[128, 64]', 'dropout': 0.5953905101903602, 'batch_norm': False, 'lr': 0.0009914893796010536, 'weight_decay': 7.849937875170823e-06, 'epochs': 132, 'loss': 'mse', 'optimizer': 'adam', 'graph_mode': 'off', 'use_snp_selection': True, 'num_snps': 3040}. Best is trial 90 with value: 0.0632226944528337.
[I 2025-12-05 16:17:40,200] Trial 123 finished with value: 0.039652256024077404 and parameters: {'model_type': 'mlp', 'hidden_dims': '[128, 64]', 'dropout': 0.5975967046135358, 'batch_norm': False, 'lr': 0.000817670928354249, 'weight_decay': 1.555961112964328e-05, 'epochs': 147, 'loss': 'mse', 'optimizer': 'adam', 'graph_mode': 'off', 'use_snp_selection': True, 'num_snps': 3050}. Best is trial 90 with value: 0.0632226944528337.
[I 2025-12-05 16:17:41,372] Trial 124 finished with value: 0.03304783379391037 and parameters: {'model_type': 'mlp', 'hidden_dims': '[128, 64]', 'dropout': 0.5890029828409135, 'batch_norm': False, 'lr': 0.000553432188984135, 'weight_decay': 1.4985423839518772e-05, 'epochs': 178, 'loss': 'mse', 'optimizer': 'adam', 'graph_mode': 'off', 'use_snp_selection': True, 'num_snps': 14146}. Best is trial 90 with value: 0.0632226944528337.
[I 2025-12-05 16:17:42,286] Trial 125 finished with value: 0.031117128240197998 and parameters: {'model_type': 'mlp', 'hidden_dims': '[128, 64]', 'dropout': 0.565758846294284, 'batch_norm': False, 'lr': 0.0008045759310414958, 'weight_decay': 1.0340972110818925e-05, 'epochs': 151, 'loss': 'mse', 'optimizer': 'adam', 'graph_mode': 'off', 'use_snp_selection': True, 'num_snps': 6969}. Best is trial 90 with value: 0.0632226944528337.
[I 2025-12-05 16:17:43,572] Trial 126 finished with value: -0.018377175313893216 and parameters: {'model_type': 'mlp', 'hidden_dims': '[128, 64]', 'dropout': 0.5560475663222075, 'batch_norm': False, 'lr': 1.5072256649622923e-05, 'weight_decay': 5.94600311228656e-06, 'epochs': 262, 'loss': 'mse', 'optimizer': 'adam', 'graph_mode': 'off', 'use_snp_selection': True, 'num_snps': 16829}. Best is trial 90 with value: 0.0632226944528337.
[I 2025-12-05 16:17:44,505] Trial 127 finished with value: 0.015943926569362995 and parameters: {'model_type': 'mlp', 'hidden_dims': '[128, 64]', 'dropout': 0.5757190948662096, 'batch_norm': False, 'lr': 0.0006796011926567146, 'weight_decay': 2.1369575068501846e-05, 'epochs': 161, 'loss': 'mse', 'optimizer': 'adam', 'graph_mode': 'off', 'use_snp_selection': True, 'num_snps': 5720}. Best is trial 90 with value: 0.0632226944528337.
[I 2025-12-05 16:17:45,711] Trial 128 finished with value: -0.0012120407099949061 and parameters: {'model_type': 'mlp', 'hidden_dims': '[128, 64]', 'dropout': 0.5424711179499462, 'batch_norm': False, 'lr': 2.624370249744327e-06, 'weight_decay': 1.1838698530249772e-05, 'epochs': 330, 'loss': 'mse', 'optimizer': 'adam', 'graph_mode': 'off', 'use_snp_selection': True, 'num_snps': 8581}. Best is trial 90 with value: 0.0632226944528337.
[I 2025-12-05 16:17:46,751] Trial 129 finished with value: 0.05587652267678716 and parameters: {'model_type': 'mlp', 'hidden_dims': '[128, 64]', 'dropout': 0.5222339496637626, 'batch_norm': False, 'lr': 0.00013802952187063413, 'weight_decay': 1.674003883945981e-05, 'epochs': 350, 'loss': 'mse', 'optimizer': 'adam', 'graph_mode': 'off', 'use_snp_selection': True, 'num_snps': 2814}. Best is trial 90 with value: 0.0632226944528337.
[I 2025-12-05 16:17:47,536] Trial 130 finished with value: 0.03484922256582 and parameters: {'model_type': 'mlp', 'hidden_dims': '[256, 128]', 'dropout': 0.528786367610711, 'batch_norm': False, 'lr': 0.00038485098674708915, 'weight_decay': 4.930629146256672e-05, 'epochs': 124, 'loss': 'mse', 'optimizer': 'adam', 'graph_mode': 'off', 'use_snp_selection': True, 'num_snps': 3012}. Best is trial 90 with value: 0.0632226944528337.
[I 2025-12-05 16:17:48,584] Trial 131 finished with value: 0.024610827609269286 and parameters: {'model_type': 'mlp', 'hidden_dims': '[128, 64]', 'dropout': 0.5436394946794236, 'batch_norm': False, 'lr': 0.00014520822884872398, 'weight_decay': 1.7203795632252452e-05, 'epochs': 349, 'loss': 'mse', 'optimizer': 'adam', 'graph_mode': 'off', 'use_snp_selection': True, 'num_snps': 4464}. Best is trial 90 with value: 0.0632226944528337.
[I 2025-12-05 16:17:49,644] Trial 132 finished with value: 0.047754328487915894 and parameters: {'model_type': 'mlp', 'hidden_dims': '[128, 64]', 'dropout': 0.5092712238020499, 'batch_norm': False, 'lr': 0.000121627589255772, 'weight_decay': 1.3693488304967573e-05, 'epochs': 344, 'loss': 'mse', 'optimizer': 'adam', 'graph_mode': 'off', 'use_snp_selection': True, 'num_snps': 3076}. Best is trial 90 with value: 0.0632226944528337.
[I 2025-12-05 16:17:50,699] Trial 133 finished with value: 0.04375443436928696 and parameters: {'model_type': 'mlp', 'hidden_dims': '[128, 64]', 'dropout': 0.49986252879953247, 'batch_norm': False, 'lr': 0.000166548632383167, 'weight_decay': 1.4200587591252677e-05, 'epochs': 342, 'loss': 'mse', 'optimizer': 'adam', 'graph_mode': 'off', 'use_snp_selection': True, 'num_snps': 3097}. Best is trial 90 with value: 0.0632226944528337.
[I 2025-12-05 16:17:51,834] Trial 134 finished with value: 0.05905032265015169 and parameters: {'model_type': 'mlp', 'hidden_dims': '[128, 64]', 'dropout': 0.518126357961151, 'batch_norm': False, 'lr': 0.00011164460786900425, 'weight_decay': 2.549388175825778e-05, 'epochs': 342, 'loss': 'mse', 'optimizer': 'adam', 'graph_mode': 'off', 'use_snp_selection': True, 'num_snps': 6380}. Best is trial 90 with value: 0.0632226944528337.
[I 2025-12-05 16:17:52,945] Trial 135 finished with value: 0.0016512635034160851 and parameters: {'model_type': 'mlp', 'hidden_dims': '[128, 64]', 'dropout': 0.5017886158172431, 'batch_norm': False, 'lr': 8.356007767907646e-05, 'weight_decay': 3.8166653265816537e-05, 'epochs': 341, 'loss': 'mse', 'optimizer': 'adam', 'graph_mode': 'off', 'use_snp_selection': True, 'num_snps': 6351}. Best is trial 90 with value: 0.0632226944528337.
[I 2025-12-05 16:17:54,136] Trial 136 finished with value: 0.025157335300564854 and parameters: {'model_type': 'mlp', 'hidden_dims': '[256, 128, 64]', 'dropout': 0.5155469313899823, 'batch_norm': False, 'lr': 0.00012573831029843085, 'weight_decay': 2.3548417301670943e-05, 'epochs': 333, 'loss': 'mse', 'optimizer': 'adam', 'graph_mode': 'off', 'use_snp_selection': True, 'num_snps': 7558}. Best is trial 90 with value: 0.0632226944528337.
[I 2025-12-05 16:17:55,256] Trial 137 finished with value: 0.03715817123791097 and parameters: {'model_type': 'mlp', 'hidden_dims': '[512, 128]', 'dropout': 0.5076436885153643, 'batch_norm': False, 'lr': 9.928199405270083e-05, 'weight_decay': 9.76689904378439e-06, 'epochs': 340, 'loss': 'mse', 'optimizer': 'adam', 'graph_mode': 'off', 'use_snp_selection': True, 'num_snps': 5220}. Best is trial 90 with value: 0.0632226944528337.
[I 2025-12-05 16:17:57,761] Trial 138 finished with value: -0.01576578617861397 and parameters: {'model_type': 'mlp', 'hidden_dims': '[128, 64]', 'dropout': 0.525670208377751, 'batch_norm': False, 'lr': 0.00011174422853198138, 'weight_decay': 1.8766735395215975e-05, 'epochs': 325, 'loss': 'mse', 'optimizer': 'adam', 'graph_mode': 'off', 'use_snp_selection': True, 'num_snps': 50963}. Best is trial 90 with value: 0.0632226944528337.
[I 2025-12-05 16:17:58,796] Trial 139 finished with value: 0.02354450737570042 and parameters: {'model_type': 'mlp', 'hidden_dims': '[128, 64]', 'dropout': 0.48784691365790117, 'batch_norm': False, 'lr': 0.0001869570566183213, 'weight_decay': 0.0001387769076506039, 'epochs': 320, 'loss': 'mse', 'optimizer': 'adam', 'graph_mode': 'off', 'use_snp_selection': True, 'num_snps': 3911}. Best is trial 90 with value: 0.0632226944528337.
[I 2025-12-05 16:18:00,591] Trial 140 finished with value: -0.007106362088456559 and parameters: {'model_type': 'mlp', 'hidden_dims': '[512, 64]', 'dropout': 0.33927271783189444, 'batch_norm': False, 'lr': 0.00015872394413918075, 'weight_decay': 2.9638673606218203e-06, 'epochs': 345, 'loss': 'mse', 'optimizer': 'adam', 'graph_mode': 'off', 'use_snp_selection': True, 'num_snps': 21452}. Best is trial 90 with value: 0.0632226944528337.
[I 2025-12-05 16:18:01,651] Trial 141 finished with value: 0.02703633985513206 and parameters: {'model_type': 'mlp', 'hidden_dims': '[128, 64]', 'dropout': 0.5322509132979518, 'batch_norm': False, 'lr': 5.768665825949815e-05, 'weight_decay': 2.515369223545385e-05, 'epochs': 350, 'loss': 'mse', 'optimizer': 'adam', 'graph_mode': 'off', 'use_snp_selection': True, 'num_snps': 2212}. Best is trial 90 with value: 0.0632226944528337.
[I 2025-12-05 16:18:02,753] Trial 142 finished with value: 0.017719856560141085 and parameters: {'model_type': 'mlp', 'hidden_dims': '[128, 64]', 'dropout': 0.5211347220193163, 'batch_norm': False, 'lr': 0.00016579366003472275, 'weight_decay': 3.003674679479096e-05, 'epochs': 338, 'loss': 'mse', 'optimizer': 'adam', 'graph_mode': 'off', 'use_snp_selection': True, 'num_snps': 4431}. Best is trial 90 with value: 0.0632226944528337.
[I 2025-12-05 16:18:03,898] Trial 143 finished with value: 0.016648182427689076 and parameters: {'model_type': 'mlp', 'hidden_dims': '[128, 64]', 'dropout': 0.49401333649997897, 'batch_norm': False, 'lr': 0.00013896409244579266, 'weight_decay': 1.3734758122168398e-05, 'epochs': 333, 'loss': 'mse', 'optimizer': 'adam', 'graph_mode': 'off', 'use_snp_selection': True, 'num_snps': 6080}. Best is trial 90 with value: 0.0632226944528337.
[I 2025-12-05 16:18:04,935] Trial 144 finished with value: 0.030551321451645137 and parameters: {'model_type': 'mlp', 'hidden_dims': '[128, 64]', 'dropout': 0.5112593271853966, 'batch_norm': False, 'lr': 7.192927146214804e-05, 'weight_decay': 7.283474909350358e-06, 'epochs': 342, 'loss': 'mse', 'optimizer': 'adam', 'graph_mode': 'off', 'use_snp_selection': True, 'num_snps': 3380}. Best is trial 90 with value: 0.0632226944528337.
[I 2025-12-05 16:18:05,934] Trial 145 finished with value: 0.05380060591736927 and parameters: {'model_type': 'mlp', 'hidden_dims': '[128, 64]', 'dropout': 0.5365004185184562, 'batch_norm': False, 'lr': 0.00010967571006742082, 'weight_decay': 3.500875187372877e-05, 'epochs': 344, 'loss': 'mse', 'optimizer': 'adam', 'graph_mode': 'off', 'use_snp_selection': True, 'num_snps': 2016}. Best is trial 90 with value: 0.0632226944528337.
[I 2025-12-05 16:18:06,937] Trial 146 finished with value: 0.03493924722382131 and parameters: {'model_type': 'mlp', 'hidden_dims': '[128, 64]', 'dropout': 0.29688322824390667, 'batch_norm': False, 'lr': 9.150692792270604e-05, 'weight_decay': 6.667517862824756e-05, 'epochs': 325, 'loss': 'mse', 'optimizer': 'adam', 'graph_mode': 'off', 'use_snp_selection': True, 'num_snps': 2159}. Best is trial 90 with value: 0.0632226944528337.
[I 2025-12-05 16:18:08,013] Trial 147 finished with value: -0.028780020517805507 and parameters: {'model_type': 'mlp', 'hidden_dims': '[128, 64]', 'dropout': 0.4760498011430025, 'batch_norm': False, 'lr': 0.0001148632644354449, 'weight_decay': 3.591433829350955e-05, 'epochs': 331, 'loss': 'mse', 'optimizer': 'adam', 'graph_mode': 'off', 'use_snp_selection': False}. Best is trial 90 with value: 0.0632226944528337.
[I 2025-12-05 16:18:09,097] Trial 148 finished with value: 0.03147353233024479 and parameters: {'model_type': 'mlp', 'hidden_dims': '[128, 64]', 'dropout': 0.3235143608439591, 'batch_norm': False, 'lr': 0.00010542330854683889, 'weight_decay': 9.572086734870525e-05, 'epochs': 288, 'loss': 'mse', 'optimizer': 'adam', 'graph_mode': 'off', 'use_snp_selection': True, 'num_snps': 5427}. Best is trial 90 with value: 0.0632226944528337.
[I 2025-12-05 16:18:10,531] Trial 149 finished with value: -0.03037421963622034 and parameters: {'model_type': 'mlp', 'hidden_dims': '[256, 128, 64]', 'dropout': 0.5380106731854609, 'batch_norm': True, 'lr': 5.649187805092434e-06, 'weight_decay': 0.00024085317211840044, 'epochs': 342, 'loss': 'mse', 'optimizer': 'adam', 'graph_mode': 'off', 'use_snp_selection': True, 'num_snps': 9065}. Best is trial 90 with value: 0.0632226944528337.
[I 2025-12-05 16:18:12,671] Trial 0 finished with value: 0.020044320702955434 and parameters: {'model_type': 'mlp', 'hidden_dims': '[128, 64]', 'dropout': 0.199031432379812, 'batch_norm': True, 'lr': 1.8408544111075837e-06, 'weight_decay': 5.5136510071208614e-05, 'epochs': 336, 'loss': 'mae', 'optimizer': 'adam', 'graph_mode': 'off', 'use_snp_selection': True, 'num_snps': 43862}. Best is trial 0 with value: 0.020044320702955434.
[I 2025-12-05 16:18:13,753] Trial 1 finished with value: 0.10325331381383869 and parameters: {'model_type': 'mlp', 'hidden_dims': '[256, 128]', 'dropout': 0.4370668075331726, 'batch_norm': True, 'lr': 7.133471581159139e-05, 'weight_decay': 1.128633586803549e-05, 'epochs': 242, 'loss': 'mae', 'optimizer': 'adam', 'graph_mode': 'off', 'use_snp_selection': False}. Best is trial 1 with value: 0.10325331381383869.
[I 2025-12-05 16:18:14,799] Trial 2 finished with value: 0.042772917277115435 and parameters: {'model_type': 'mlp', 'hidden_dims': '[256, 128, 64]', 'dropout': 0.41314357415569625, 'batch_norm': False, 'lr': 3.952233718592101e-06, 'weight_decay': 0.00026754769258252603, 'epochs': 149, 'loss': 'mse', 'optimizer': 'adam', 'graph_mode': 'off', 'use_snp_selection': True, 'num_snps': 11571}. Best is trial 1 with value: 0.10325331381383869.
[I 2025-12-05 16:18:16,664] Trial 3 finished with value: 0.0516897550840217 and parameters: {'model_type': 'mlp', 'hidden_dims': '[512, 64]', 'dropout': 0.5938127374509361, 'batch_norm': False, 'lr': 5.67704586114731e-06, 'weight_decay': 2.4518087630137052e-05, 'epochs': 320, 'loss': 'mae', 'optimizer': 'adam', 'graph_mode': 'off', 'use_snp_selection': False}. Best is trial 1 with value: 0.10325331381383869.
[I 2025-12-05 16:18:18,811] Trial 4 finished with value: 0.022991365119055276 and parameters: {'model_type': 'mlp', 'hidden_dims': '[512, 128]', 'dropout': 0.25746343592134413, 'batch_norm': True, 'lr': 1.3467657668402788e-06, 'weight_decay': 0.00033087251918647806, 'epochs': 277, 'loss': 'mse', 'optimizer': 'adam', 'graph_mode': 'off', 'use_snp_selection': True, 'num_snps': 36675}. Best is trial 1 with value: 0.10325331381383869.
[I 2025-12-05 16:18:20,507] Trial 5 finished with value: 0.0572885439377767 and parameters: {'model_type': 'mlp', 'hidden_dims': '[512, 64]', 'dropout': 0.38275350994408375, 'batch_norm': True, 'lr': 1.5586664309232824e-06, 'weight_decay': 0.0008227664668621182, 'epochs': 145, 'loss': 'mae', 'optimizer': 'adam', 'graph_mode': 'off', 'use_snp_selection': True, 'num_snps': 32148}. Best is trial 1 with value: 0.10325331381383869.
[I 2025-12-05 16:18:21,442] Trial 6 finished with value: 0.0938817254577167 and parameters: {'model_type': 'mlp', 'hidden_dims': '[256, 128]', 'dropout': 0.3930109900265879, 'batch_norm': False, 'lr': 4.892964372128395e-05, 'weight_decay': 1.5809549317992182e-06, 'epochs': 199, 'loss': 'mse', 'optimizer': 'adam', 'graph_mode': 'off', 'use_snp_selection': False}. Best is trial 1 with value: 0.10325331381383869.
