[I 2025-12-05 15:18:23,936] Trial 106 finished with value: 0.09330425361069442 and parameters: {'model_type': 'mlp', 'hidden_dims': '[256, 128, 64]', 'dropout': 0.1795469541523385, 'batch_norm': True, 'lr': 0.00018627711693919595, 'weight_decay': 5.314721840283344e-07, 'epochs': 57, 'loss': 'mse', 'optimizer': 'adam', 'graph_mode': 'off', 'use_snp_selection': False}. Best is trial 85 with value: 0.10366893036924316.
[I 2025-12-05 15:18:24,794] Trial 107 finished with value: 0.06377532155741233 and parameters: {'model_type': 'mlp', 'hidden_dims': '[256, 128, 64]', 'dropout': 0.31653446120188733, 'batch_norm': True, 'lr': 0.0001929984346904295, 'weight_decay': 4.882642548093134e-07, 'epochs': 103, 'loss': 'mse', 'optimizer': 'adam', 'graph_mode': 'off', 'use_snp_selection': False}. Best is trial 85 with value: 0.10366893036924316.
[I 2025-12-05 15:18:25,754] Trial 108 finished with value: 0.08171299308331735 and parameters: {'model_type': 'mlp', 'hidden_dims': '[256, 128, 64]', 'dropout': 0.18969703934612242, 'batch_norm': True, 'lr': 9.431166939596529e-05, 'weight_decay': 2.8901234800006693e-07, 'epochs': 151, 'loss': 'mae', 'optimizer': 'adam', 'graph_mode': 'off', 'use_snp_selection': False}. Best is trial 85 with value: 0.10366893036924316.
[I 2025-12-05 15:18:26,577] Trial 109 finished with value: 0.04370960697345862 and parameters: {'model_type': 'mlp', 'hidden_dims': '[256, 128, 64]', 'dropout': 0.1764348124314812, 'batch_norm': False, 'lr': 1.1221908914200985e-05, 'weight_decay': 9.464285210953014e-06, 'epochs': 91, 'loss': 'mse', 'optimizer': 'adam', 'graph_mode': 'off', 'use_snp_selection': False}. Best is trial 85 with value: 0.10366893036924316.
[I 2025-12-05 15:18:27,338] Trial 110 finished with value: 0.07478945171971751 and parameters: {'model_type': 'mlp', 'hidden_dims': '[256, 128, 64]', 'dropout': 0.21139663668512187, 'batch_norm': True, 'lr': 0.00024989723340604835, 'weight_decay': 1.8637294689301962e-07, 'epochs': 58, 'loss': 'mae', 'optimizer': 'adam', 'graph_mode': 'off', 'use_snp_selection': False}. Best is trial 85 with value: 0.10366893036924316.
[I 2025-12-05 15:18:28,324] Trial 111 finished with value: 0.06655584274574436 and parameters: {'model_type': 'mlp', 'hidden_dims': '[512, 128]', 'dropout': 0.11490807109029329, 'batch_norm': True, 'lr': 0.00016814783944470033, 'weight_decay': 8.079445332914702e-07, 'epochs': 47, 'loss': 'mse', 'optimizer': 'adam', 'graph_mode': 'off', 'use_snp_selection': False}. Best is trial 85 with value: 0.10366893036924316.
[I 2025-12-05 15:18:29,316] Trial 112 finished with value: 0.06205063266253574 and parameters: {'model_type': 'mlp', 'hidden_dims': '[512, 64]', 'dropout': 0.4085241148111345, 'batch_norm': True, 'lr': 0.00033841444841069886, 'weight_decay': 3.3254324327069035e-06, 'epochs': 48, 'loss': 'mse', 'optimizer': 'adam', 'graph_mode': 'off', 'use_snp_selection': False}. Best is trial 85 with value: 0.10366893036924316.
[I 2025-12-05 15:18:30,145] Trial 113 finished with value: 0.08708933684322377 and parameters: {'model_type': 'mlp', 'hidden_dims': '[256, 128]', 'dropout': 0.45859492276200275, 'batch_norm': True, 'lr': 0.0005665263801815259, 'weight_decay': 5.748889736568604e-07, 'epochs': 67, 'loss': 'mse', 'optimizer': 'adam', 'graph_mode': 'off', 'use_snp_selection': False}. Best is trial 85 with value: 0.10366893036924316.
[I 2025-12-05 15:18:30,972] Trial 114 finished with value: 0.07133420845503088 and parameters: {'model_type': 'mlp', 'hidden_dims': '[256, 128]', 'dropout': 0.5573893748881287, 'batch_norm': True, 'lr': 0.0005900306301065421, 'weight_decay': 5.322574781807527e-07, 'epochs': 67, 'loss': 'mse', 'optimizer': 'adam', 'graph_mode': 'off', 'use_snp_selection': False}. Best is trial 85 with value: 0.10366893036924316.
[I 2025-12-05 15:18:32,299] Trial 115 finished with value: 0.06124935492305131 and parameters: {'model_type': 'mlp', 'hidden_dims': '[256, 128]', 'dropout': 0.34691145257729794, 'batch_norm': True, 'lr': 0.00011584476535363962, 'weight_decay': 7.173071396498924e-07, 'epochs': 309, 'loss': 'mse', 'optimizer': 'adam', 'graph_mode': 'off', 'use_snp_selection': False}. Best is trial 85 with value: 0.10366893036924316.
[I 2025-12-05 15:18:33,159] Trial 116 finished with value: 0.035229100025487195 and parameters: {'model_type': 'mlp', 'hidden_dims': '[256, 128]', 'dropout': 0.5299386041795892, 'batch_norm': True, 'lr': 0.0001458436332076502, 'weight_decay': 3.478673781552466e-07, 'epochs': 78, 'loss': 'mse', 'optimizer': 'adam', 'graph_mode': 'off', 'use_snp_selection': False}. Best is trial 85 with value: 0.10366893036924316.
[I 2025-12-05 15:18:33,968] Trial 117 finished with value: 0.09039437920484267 and parameters: {'model_type': 'mlp', 'hidden_dims': '[256, 128]', 'dropout': 0.15544003191528336, 'batch_norm': True, 'lr': 0.00044863102331003935, 'weight_decay': 1.5015494292416126e-07, 'epochs': 56, 'loss': 'mae', 'optimizer': 'adam', 'graph_mode': 'off', 'use_snp_selection': False}. Best is trial 85 with value: 0.10366893036924316.
[I 2025-12-05 15:18:34,773] Trial 118 finished with value: 0.07868422590566441 and parameters: {'model_type': 'mlp', 'hidden_dims': '[256, 128]', 'dropout': 0.42983471028045345, 'batch_norm': True, 'lr': 0.0005177702239979751, 'weight_decay': 1.5879153761973607e-07, 'epochs': 57, 'loss': 'mse', 'optimizer': 'adam', 'graph_mode': 'off', 'use_snp_selection': False}. Best is trial 85 with value: 0.10366893036924316.
[I 2025-12-05 15:18:35,620] Trial 119 finished with value: 0.0923346466233956 and parameters: {'model_type': 'mlp', 'hidden_dims': '[256, 128]', 'dropout': 0.18212934064347672, 'batch_norm': True, 'lr': 0.0009830911336486774, 'weight_decay': 1.00503881379691e-07, 'epochs': 84, 'loss': 'mae', 'optimizer': 'adam', 'graph_mode': 'off', 'use_snp_selection': False}. Best is trial 85 with value: 0.10366893036924316.
[I 2025-12-05 15:18:36,519] Trial 120 finished with value: 0.05600536463214148 and parameters: {'model_type': 'mlp', 'hidden_dims': '[256, 128]', 'dropout': 0.45604937033871623, 'batch_norm': True, 'lr': 0.0009125228482148767, 'weight_decay': 1.0040697751328769e-07, 'epochs': 111, 'loss': 'mse', 'optimizer': 'adam', 'graph_mode': 'off', 'use_snp_selection': False}. Best is trial 85 with value: 0.10366893036924316.
[I 2025-12-05 15:18:37,358] Trial 121 finished with value: 0.07705605539649445 and parameters: {'model_type': 'mlp', 'hidden_dims': '[256, 128]', 'dropout': 0.18092781146813347, 'batch_norm': True, 'lr': 0.0006455979852900944, 'weight_decay': 2.5505484958089997e-07, 'epochs': 81, 'loss': 'mae', 'optimizer': 'adam', 'graph_mode': 'off', 'use_snp_selection': False}. Best is trial 85 with value: 0.10366893036924316.
[I 2025-12-05 15:18:38,187] Trial 122 finished with value: 0.05989066589735967 and parameters: {'model_type': 'mlp', 'hidden_dims': '[256, 128]', 'dropout': 0.5774277575786047, 'batch_norm': True, 'lr': 0.0008550310196323516, 'weight_decay': 1.2719734761012422e-07, 'epochs': 73, 'loss': 'mae', 'optimizer': 'adam', 'graph_mode': 'off', 'use_snp_selection': False}. Best is trial 85 with value: 0.10366893036924316.
[I 2025-12-05 15:18:38,958] Trial 123 finished with value: 0.06174547095996227 and parameters: {'model_type': 'mlp', 'hidden_dims': '[256, 128]', 'dropout': 0.16578923668327414, 'batch_norm': True, 'lr': 0.0004165389214175758, 'weight_decay': 1.5347822789076637e-07, 'epochs': 60, 'loss': 'mae', 'optimizer': 'adam', 'graph_mode': 'off', 'use_snp_selection': False}. Best is trial 85 with value: 0.10366893036924316.
[I 2025-12-05 15:18:39,795] Trial 124 finished with value: 0.05463734091912649 and parameters: {'model_type': 'mlp', 'hidden_dims': '[256, 128]', 'dropout': 0.20144203986666775, 'batch_norm': True, 'lr': 0.0006973761195551207, 'weight_decay': 1.2541492666667852e-07, 'epochs': 97, 'loss': 'mae', 'optimizer': 'adam', 'graph_mode': 'off', 'use_snp_selection': False}. Best is trial 85 with value: 0.10366893036924316.
[I 2025-12-05 15:18:41,967] Trial 125 finished with value: 0.06610515788640486 and parameters: {'model_type': 'mlp', 'hidden_dims': '[256, 128]', 'dropout': 0.15093465977633858, 'batch_norm': True, 'lr': 0.00048449771196961956, 'weight_decay': 2.0574433210371644e-07, 'epochs': 88, 'loss': 'mae', 'optimizer': 'adam', 'graph_mode': 'off', 'use_snp_selection': True, 'num_snps': 51006}. Best is trial 85 with value: 0.10366893036924316.
[I 2025-12-05 15:18:42,879] Trial 126 finished with value: 0.0862696974173281 and parameters: {'model_type': 'mlp', 'hidden_dims': '[512, 64]', 'dropout': 0.26945268193094246, 'batch_norm': False, 'lr': 3.3837310557285056e-05, 'weight_decay': 9.289032754463118e-07, 'epochs': 40, 'loss': 'mae', 'optimizer': 'adam', 'graph_mode': 'off', 'use_snp_selection': False}. Best is trial 85 with value: 0.10366893036924316.
[I 2025-12-05 15:18:43,659] Trial 127 finished with value: 0.06835846106818666 and parameters: {'model_type': 'mlp', 'hidden_dims': '[256, 128]', 'dropout': 0.22746111085254123, 'batch_norm': True, 'lr': 0.0007717237641954235, 'weight_decay': 4.2695192568929613e-07, 'epochs': 65, 'loss': 'mae', 'optimizer': 'adam', 'graph_mode': 'off', 'use_snp_selection': False}. Best is trial 85 with value: 0.10366893036924316.
[I 2025-12-05 15:18:44,539] Trial 128 finished with value: 0.07303689542759212 and parameters: {'model_type': 'mlp', 'hidden_dims': '[128, 64]', 'dropout': 0.1584725989323347, 'batch_norm': True, 'lr': 0.0009650035663728308, 'weight_decay': 5.722204753671047e-07, 'epochs': 186, 'loss': 'mse', 'optimizer': 'adam', 'graph_mode': 'off', 'use_snp_selection': False}. Best is trial 85 with value: 0.10366893036924316.
[I 2025-12-05 15:18:45,759] Trial 129 finished with value: 0.0872907316468013 and parameters: {'model_type': 'mlp', 'hidden_dims': '[512, 64]', 'dropout': 0.183518108376436, 'batch_norm': True, 'lr': 0.00029703046923083696, 'weight_decay': 2.6882754093549927e-07, 'epochs': 104, 'loss': 'mae', 'optimizer': 'adam', 'graph_mode': 'off', 'use_snp_selection': False}. Best is trial 85 with value: 0.10366893036924316.
[I 2025-12-05 15:18:46,986] Trial 130 finished with value: 0.009995068509231141 and parameters: {'model_type': 'mlp', 'hidden_dims': '[512, 64]', 'dropout': 0.1849724956349954, 'batch_norm': True, 'lr': 1.3496285245583422e-06, 'weight_decay': 2.914212684047537e-07, 'epochs': 102, 'loss': 'mse', 'optimizer': 'adam', 'graph_mode': 'off', 'use_snp_selection': False}. Best is trial 85 with value: 0.10366893036924316.
[I 2025-12-05 15:18:48,137] Trial 131 finished with value: 0.054746656709747286 and parameters: {'model_type': 'mlp', 'hidden_dims': '[512, 64]', 'dropout': 0.17567314360636402, 'batch_norm': True, 'lr': 0.00030601716276510967, 'weight_decay': 1.8044592424783577e-07, 'epochs': 82, 'loss': 'mae', 'optimizer': 'adam', 'graph_mode': 'off', 'use_snp_selection': False}. Best is trial 85 with value: 0.10366893036924316.
[I 2025-12-05 15:18:49,458] Trial 132 finished with value: 0.10893033276676165 and parameters: {'model_type': 'mlp', 'hidden_dims': '[512, 64]', 'dropout': 0.1703671571620513, 'batch_norm': True, 'lr': 0.00020765922871876608, 'weight_decay': 2.3418365162712504e-07, 'epochs': 126, 'loss': 'mae', 'optimizer': 'adam', 'graph_mode': 'off', 'use_snp_selection': False}. Best is trial 132 with value: 0.10893033276676165.
[I 2025-12-05 15:18:50,790] Trial 133 finished with value: 0.04480372790017724 and parameters: {'model_type': 'mlp', 'hidden_dims': '[512, 64]', 'dropout': 0.19260477344009633, 'batch_norm': True, 'lr': 2.2523649301331246e-05, 'weight_decay': 1.4798760526898562e-07, 'epochs': 131, 'loss': 'mae', 'optimizer': 'adam', 'graph_mode': 'off', 'use_snp_selection': False}. Best is trial 132 with value: 0.10893033276676165.
[I 2025-12-05 15:18:52,074] Trial 134 finished with value: 0.0848908465520035 and parameters: {'model_type': 'mlp', 'hidden_dims': '[512, 64]', 'dropout': 0.1358335629985518, 'batch_norm': True, 'lr': 0.00019021008756826417, 'weight_decay': 2.2016821197629686e-07, 'epochs': 124, 'loss': 'mae', 'optimizer': 'adam', 'graph_mode': 'off', 'use_snp_selection': False}. Best is trial 132 with value: 0.10893033276676165.
[I 2025-12-05 15:18:53,298] Trial 135 finished with value: 0.025328780361222988 and parameters: {'model_type': 'mlp', 'hidden_dims': '[512, 64]', 'dropout': 0.5106652274062442, 'batch_norm': True, 'lr': 0.00028314658786086536, 'weight_decay': 1.1280751927660919e-07, 'epochs': 106, 'loss': 'mae', 'optimizer': 'adam', 'graph_mode': 'off', 'use_snp_selection': False}. Best is trial 132 with value: 0.10893033276676165.
[I 2025-12-05 15:18:54,505] Trial 136 finished with value: 0.048688834332713454 and parameters: {'model_type': 'mlp', 'hidden_dims': '[512, 64]', 'dropout': 0.14805613903647316, 'batch_norm': True, 'lr': 0.0004210370627877447, 'weight_decay': 2.584950959485304e-07, 'epochs': 114, 'loss': 'mae', 'optimizer': 'adam', 'graph_mode': 'off', 'use_snp_selection': False}. Best is trial 132 with value: 0.10893033276676165.
[I 2025-12-05 15:18:55,618] Trial 137 finished with value: 0.030045638490208495 and parameters: {'model_type': 'mlp', 'hidden_dims': '[512, 64]', 'dropout': 0.25028275171117076, 'batch_norm': False, 'lr': 0.0007853251155453791, 'weight_decay': 3.2902541839223484e-07, 'epochs': 92, 'loss': 'mae', 'optimizer': 'adam', 'graph_mode': 'off', 'use_snp_selection': False}. Best is trial 132 with value: 0.10893033276676165.
[I 2025-12-05 15:18:56,589] Trial 138 finished with value: 0.059253919576610005 and parameters: {'model_type': 'mlp', 'hidden_dims': '[512, 64]', 'dropout': 0.21179851612657952, 'batch_norm': True, 'lr': 0.0005679549285552387, 'weight_decay': 4.427222875405351e-07, 'epochs': 54, 'loss': 'mse', 'optimizer': 'adam', 'graph_mode': 'off', 'use_snp_selection': False}. Best is trial 132 with value: 0.10893033276676165.
[I 2025-12-05 15:18:57,388] Trial 139 finished with value: 0.05243372536955722 and parameters: {'model_type': 'mlp', 'hidden_dims': '[256, 128, 64]', 'dropout': 0.36857868257260323, 'batch_norm': True, 'lr': 0.00021246750437698856, 'weight_decay': 1.8144710704895725e-07, 'epochs': 70, 'loss': 'mae', 'optimizer': 'adam', 'graph_mode': 'off', 'use_snp_selection': False}. Best is trial 132 with value: 0.10893033276676165.
[I 2025-12-05 15:18:58,444] Trial 140 finished with value: 0.09209527958550641 and parameters: {'model_type': 'mlp', 'hidden_dims': '[512, 256]', 'dropout': 0.16763771708884911, 'batch_norm': True, 'lr': 0.00013034908652483673, 'weight_decay': 0.0005455942917717663, 'epochs': 75, 'loss': 'mse', 'optimizer': 'adam', 'graph_mode': 'off', 'use_snp_selection': False}. Best is trial 132 with value: 0.10893033276676165.
[I 2025-12-05 15:18:59,508] Trial 141 finished with value: 0.06968767685412776 and parameters: {'model_type': 'mlp', 'hidden_dims': '[512, 256]', 'dropout': 0.16649124746297844, 'batch_norm': True, 'lr': 0.00012483855671567494, 'weight_decay': 1.3504262615101872e-07, 'epochs': 77, 'loss': 'mse', 'optimizer': 'adam', 'graph_mode': 'off', 'use_snp_selection': False}. Best is trial 132 with value: 0.10893033276676165.
[I 2025-12-05 15:19:00,967] Trial 142 finished with value: 0.088176182117782 and parameters: {'model_type': 'mlp', 'hidden_dims': '[512, 256]', 'dropout': 0.19724405475059711, 'batch_norm': True, 'lr': 9.991087144017563e-05, 'weight_decay': 0.0005869459583212775, 'epochs': 165, 'loss': 'mse', 'optimizer': 'adam', 'graph_mode': 'off', 'use_snp_selection': False}. Best is trial 132 with value: 0.10893033276676165.
[I 2025-12-05 15:19:02,441] Trial 143 finished with value: 0.050055085475715286 and parameters: {'model_type': 'mlp', 'hidden_dims': '[512, 256]', 'dropout': 0.2013760689825853, 'batch_norm': True, 'lr': 8.659242897184868e-05, 'weight_decay': 0.0006391052571311855, 'epochs': 166, 'loss': 'mse', 'optimizer': 'adam', 'graph_mode': 'off', 'use_snp_selection': False}. Best is trial 132 with value: 0.10893033276676165.
[I 2025-12-05 15:19:03,654] Trial 144 finished with value: 0.06361022442084902 and parameters: {'model_type': 'mlp', 'hidden_dims': '[512, 256]', 'dropout': 0.17431374210281284, 'batch_norm': True, 'lr': 0.0001586424120286304, 'weight_decay': 0.000733617509401057, 'epochs': 97, 'loss': 'mse', 'optimizer': 'adam', 'graph_mode': 'off', 'use_snp_selection': False}. Best is trial 132 with value: 0.10893033276676165.
[I 2025-12-05 15:19:04,897] Trial 145 finished with value: 0.03207770495583642 and parameters: {'model_type': 'mlp', 'hidden_dims': '[512, 256]', 'dropout': 0.19049871133253862, 'batch_norm': True, 'lr': 0.00010141379033843379, 'weight_decay': 0.00040835645829994386, 'epochs': 108, 'loss': 'mse', 'optimizer': 'adam', 'graph_mode': 'off', 'use_snp_selection': False}. Best is trial 132 with value: 0.10893033276676165.
[I 2025-12-05 15:19:06,824] Trial 146 finished with value: 0.049533144768768814 and parameters: {'model_type': 'mlp', 'hidden_dims': '[512, 256]', 'dropout': 0.15628724817471373, 'batch_norm': True, 'lr': 0.00012977557214692518, 'weight_decay': 0.00035588033045227274, 'epochs': 85, 'loss': 'mse', 'optimizer': 'adam', 'graph_mode': 'off', 'use_snp_selection': True, 'num_snps': 35062}. Best is trial 132 with value: 0.10893033276676165.
[I 2025-12-05 15:19:08,103] Trial 147 finished with value: 0.08534654858846782 and parameters: {'model_type': 'mlp', 'hidden_dims': '[512, 256]', 'dropout': 0.1834313442114891, 'batch_norm': True, 'lr': 0.0001743985909735645, 'weight_decay': 0.000235292481747173, 'epochs': 120, 'loss': 'mae', 'optimizer': 'adam', 'graph_mode': 'off', 'use_snp_selection': False}. Best is trial 132 with value: 0.10893033276676165.
[I 2025-12-05 15:19:09,067] Trial 148 finished with value: 0.05673718665909244 and parameters: {'model_type': 'mlp', 'hidden_dims': '[512, 256]', 'dropout': 0.12908569193718514, 'batch_norm': True, 'lr': 0.00010502680902694233, 'weight_decay': 0.0006800050877246589, 'epochs': 48, 'loss': 'mse', 'optimizer': 'adam', 'graph_mode': 'off', 'use_snp_selection': False}. Best is trial 132 with value: 0.10893033276676165.
[I 2025-12-05 15:19:10,619] Trial 149 finished with value: 0.0592203081972328 and parameters: {'model_type': 'mlp', 'hidden_dims': '[512, 64]', 'dropout': 0.21712954764053075, 'batch_norm': False, 'lr': 0.000269858384587236, 'weight_decay': 0.0009620858665715175, 'epochs': 206, 'loss': 'mae', 'optimizer': 'adam', 'graph_mode': 'off', 'use_snp_selection': False}. Best is trial 132 with value: 0.10893033276676165.
[I 2025-12-05 15:19:13,175] Trial 0 finished with value: 0.017532000391360613 and parameters: {'model_type': 'mlp', 'hidden_dims': '[128, 64]', 'dropout': 0.199031432379812, 'batch_norm': True, 'lr': 1.8408544111075837e-06, 'weight_decay': 5.5136510071208614e-05, 'epochs': 336, 'loss': 'mae', 'optimizer': 'adam', 'graph_mode': 'off', 'use_snp_selection': True, 'num_snps': 43862}. Best is trial 0 with value: 0.017532000391360613.
[I 2025-12-05 15:19:14,667] Trial 1 finished with value: 0.08775337191903419 and parameters: {'model_type': 'mlp', 'hidden_dims': '[256, 128]', 'dropout': 0.4370668075331726, 'batch_norm': True, 'lr': 7.133471581159139e-05, 'weight_decay': 1.128633586803549e-05, 'epochs': 242, 'loss': 'mae', 'optimizer': 'adam', 'graph_mode': 'off', 'use_snp_selection': False}. Best is trial 1 with value: 0.08775337191903419.
[I 2025-12-05 15:19:16,092] Trial 2 finished with value: 0.014705873806456524 and parameters: {'model_type': 'mlp', 'hidden_dims': '[256, 128, 64]', 'dropout': 0.41314357415569625, 'batch_norm': False, 'lr': 3.952233718592101e-06, 'weight_decay': 0.00026754769258252603, 'epochs': 149, 'loss': 'mse', 'optimizer': 'adam', 'graph_mode': 'off', 'use_snp_selection': True, 'num_snps': 11571}. Best is trial 1 with value: 0.08775337191903419.
[I 2025-12-05 15:19:19,230] Trial 3 finished with value: 0.06697705398645654 and parameters: {'model_type': 'mlp', 'hidden_dims': '[512, 64]', 'dropout': 0.5938127374509361, 'batch_norm': False, 'lr': 5.67704586114731e-06, 'weight_decay': 2.4518087630137052e-05, 'epochs': 320, 'loss': 'mae', 'optimizer': 'adam', 'graph_mode': 'off', 'use_snp_selection': False}. Best is trial 1 with value: 0.08775337191903419.
[I 2025-12-05 15:19:22,360] Trial 4 finished with value: 0.04940430077773174 and parameters: {'model_type': 'mlp', 'hidden_dims': '[512, 128]', 'dropout': 0.25746343592134413, 'batch_norm': True, 'lr': 1.3467657668402788e-06, 'weight_decay': 0.00033087251918647806, 'epochs': 277, 'loss': 'mse', 'optimizer': 'adam', 'graph_mode': 'off', 'use_snp_selection': True, 'num_snps': 36675}. Best is trial 1 with value: 0.08775337191903419.
[I 2025-12-05 15:19:24,719] Trial 5 finished with value: 0.014415056683817897 and parameters: {'model_type': 'mlp', 'hidden_dims': '[512, 64]', 'dropout': 0.38275350994408375, 'batch_norm': True, 'lr': 1.5586664309232824e-06, 'weight_decay': 0.0008227664668621182, 'epochs': 145, 'loss': 'mae', 'optimizer': 'adam', 'graph_mode': 'off', 'use_snp_selection': True, 'num_snps': 32148}. Best is trial 1 with value: 0.08775337191903419.
[I 2025-12-05 15:19:26,044] Trial 6 finished with value: 0.07908679605580583 and parameters: {'model_type': 'mlp', 'hidden_dims': '[256, 128]', 'dropout': 0.3930109900265879, 'batch_norm': False, 'lr': 4.892964372128395e-05, 'weight_decay': 1.5809549317992182e-06, 'epochs': 199, 'loss': 'mse', 'optimizer': 'adam', 'graph_mode': 'off', 'use_snp_selection': False}. Best is trial 1 with value: 0.08775337191903419.
[I 2025-12-05 15:19:27,545] Trial 7 finished with value: 0.0940919207294577 and parameters: {'model_type': 'mlp', 'hidden_dims': '[512, 256]', 'dropout': 0.15343979219678458, 'batch_norm': True, 'lr': 6.234003099047341e-05, 'weight_decay': 3.894760610535477e-07, 'epochs': 97, 'loss': 'mse', 'optimizer': 'adam', 'graph_mode': 'off', 'use_snp_selection': False}. Best is trial 7 with value: 0.0940919207294577.
