[I 2025-12-05 15:04:27,890] Trial 95 finished with value: 0.0843752209971663 and parameters: {'model_type': 'mlp', 'hidden_dims': '[256, 128]', 'dropout': 0.19721756080612862, 'batch_norm': True, 'lr': 0.000685676369071758, 'weight_decay': 5.451421291227686e-06, 'epochs': 321, 'loss': 'mse', 'optimizer': 'adam', 'graph_mode': 'off', 'use_snp_selection': False}. Best is trial 31 with value: 0.09732593083060198.
[I 2025-12-05 15:04:29,199] Trial 96 finished with value: 0.07348211407337812 and parameters: {'model_type': 'mlp', 'hidden_dims': '[256, 128]', 'dropout': 0.24391098220798882, 'batch_norm': True, 'lr': 0.0007240323324139241, 'weight_decay': 8.849590994496691e-06, 'epochs': 324, 'loss': 'mse', 'optimizer': 'adam', 'graph_mode': 'off', 'use_snp_selection': False}. Best is trial 31 with value: 0.09732593083060198.
[I 2025-12-05 15:04:30,491] Trial 97 finished with value: 0.0823663397399736 and parameters: {'model_type': 'mlp', 'hidden_dims': '[256, 128]', 'dropout': 0.20975859240506817, 'batch_norm': True, 'lr': 0.0007724713612707379, 'weight_decay': 5.958215548429135e-06, 'epochs': 319, 'loss': 'mse', 'optimizer': 'adam', 'graph_mode': 'off', 'use_snp_selection': False}. Best is trial 31 with value: 0.09732593083060198.
[I 2025-12-05 15:04:31,741] Trial 98 finished with value: 0.08952517603816022 and parameters: {'model_type': 'mlp', 'hidden_dims': '[256, 128]', 'dropout': 0.1900012358153219, 'batch_norm': True, 'lr': 0.0009573028632189978, 'weight_decay': 5.059088181580134e-06, 'epochs': 301, 'loss': 'mse', 'optimizer': 'adam', 'graph_mode': 'off', 'use_snp_selection': False}. Best is trial 31 with value: 0.09732593083060198.
[I 2025-12-05 15:04:33,013] Trial 99 finished with value: 0.07743545018037687 and parameters: {'model_type': 'mlp', 'hidden_dims': '[256, 128]', 'dropout': 0.28849124317616504, 'batch_norm': True, 'lr': 0.0009664741568365411, 'weight_decay': 1.3301399804056818e-05, 'epochs': 301, 'loss': 'mse', 'optimizer': 'adam', 'graph_mode': 'off', 'use_snp_selection': False}. Best is trial 31 with value: 0.09732593083060198.
[I 2025-12-05 15:04:34,267] Trial 100 finished with value: 0.012278951095279232 and parameters: {'model_type': 'mlp', 'hidden_dims': '[256, 128]', 'dropout': 0.2642728736847254, 'batch_norm': False, 'lr': 0.0005841644340857037, 'weight_decay': 2.4800806591097105e-05, 'epochs': 332, 'loss': 'mse', 'optimizer': 'adam', 'graph_mode': 'off', 'use_snp_selection': False}. Best is trial 31 with value: 0.09732593083060198.
[I 2025-12-05 15:04:35,567] Trial 101 finished with value: 0.08217109231451948 and parameters: {'model_type': 'mlp', 'hidden_dims': '[256, 128]', 'dropout': 0.23380276930397656, 'batch_norm': True, 'lr': 0.00048268157300212204, 'weight_decay': 8.277252941019731e-06, 'epochs': 344, 'loss': 'mse', 'optimizer': 'adam', 'graph_mode': 'off', 'use_snp_selection': False}. Best is trial 31 with value: 0.09732593083060198.
[I 2025-12-05 15:04:36,729] Trial 102 finished with value: 0.0711068538443981 and parameters: {'model_type': 'mlp', 'hidden_dims': '[256, 128]', 'dropout': 0.19080570713797612, 'batch_norm': True, 'lr': 0.0006590640538972683, 'weight_decay': 4.9723728940947925e-06, 'epochs': 273, 'loss': 'mse', 'optimizer': 'adam', 'graph_mode': 'off', 'use_snp_selection': False}. Best is trial 31 with value: 0.09732593083060198.
[I 2025-12-05 15:04:38,049] Trial 103 finished with value: 0.07754162154495185 and parameters: {'model_type': 'mlp', 'hidden_dims': '[256, 128]', 'dropout': 0.21698533900214717, 'batch_norm': True, 'lr': 0.0005407320746085608, 'weight_decay': 9.909637464997742e-06, 'epochs': 328, 'loss': 'mse', 'optimizer': 'adam', 'graph_mode': 'off', 'use_snp_selection': False}. Best is trial 31 with value: 0.09732593083060198.
[I 2025-12-05 15:04:39,352] Trial 104 finished with value: 0.08311100828161576 and parameters: {'model_type': 'mlp', 'hidden_dims': '[256, 128]', 'dropout': 0.17840605255942144, 'batch_norm': True, 'lr': 0.00030135743288545327, 'weight_decay': 2.447210640111328e-06, 'epochs': 317, 'loss': 'mse', 'optimizer': 'adam', 'graph_mode': 'off', 'use_snp_selection': False}. Best is trial 31 with value: 0.09732593083060198.
[I 2025-12-05 15:04:40,630] Trial 105 finished with value: 0.08296761235759344 and parameters: {'model_type': 'mlp', 'hidden_dims': '[256, 128]', 'dropout': 0.16820104595368446, 'batch_norm': True, 'lr': 0.0008240755852212977, 'weight_decay': 6.176130283681933e-06, 'epochs': 304, 'loss': 'mse', 'optimizer': 'adam', 'graph_mode': 'off', 'use_snp_selection': False}. Best is trial 31 with value: 0.09732593083060198.
[I 2025-12-05 15:04:41,865] Trial 106 finished with value: 0.06673399802950035 and parameters: {'model_type': 'mlp', 'hidden_dims': '[256, 128]', 'dropout': 0.1957149043654246, 'batch_norm': True, 'lr': 0.00016525677145944103, 'weight_decay': 1.7093259216754653e-05, 'epochs': 292, 'loss': 'mse', 'optimizer': 'adam', 'graph_mode': 'off', 'use_snp_selection': False}. Best is trial 31 with value: 0.09732593083060198.
[I 2025-12-05 15:04:43,186] Trial 107 finished with value: 0.07667197002150955 and parameters: {'model_type': 'mlp', 'hidden_dims': '[256, 128]', 'dropout': 0.15702772430855766, 'batch_norm': True, 'lr': 0.0009532560617416996, 'weight_decay': 7.172270074085184e-06, 'epochs': 337, 'loss': 'mse', 'optimizer': 'adam', 'graph_mode': 'off', 'use_snp_selection': False}. Best is trial 31 with value: 0.09732593083060198.
[I 2025-12-05 15:04:44,367] Trial 108 finished with value: 0.07019637978112225 and parameters: {'model_type': 'mlp', 'hidden_dims': '[256, 128]', 'dropout': 0.22703753979895613, 'batch_norm': True, 'lr': 0.0005938528671878899, 'weight_decay': 4.282889650994669e-06, 'epochs': 266, 'loss': 'mse', 'optimizer': 'adam', 'graph_mode': 'off', 'use_snp_selection': False}. Best is trial 31 with value: 0.09732593083060198.
[I 2025-12-05 15:04:45,319] Trial 109 finished with value: 0.06611245507489737 and parameters: {'model_type': 'mlp', 'hidden_dims': '[128, 64]', 'dropout': 0.24279743143798044, 'batch_norm': True, 'lr': 0.00022003788841625993, 'weight_decay': 1.2427996318042734e-05, 'epochs': 276, 'loss': 'mse', 'optimizer': 'adam', 'graph_mode': 'off', 'use_snp_selection': False}. Best is trial 31 with value: 0.09732593083060198.
[I 2025-12-05 15:04:46,596] Trial 110 finished with value: 0.0650428397164746 and parameters: {'model_type': 'mlp', 'hidden_dims': '[256, 128]', 'dropout': 0.20498396808569982, 'batch_norm': True, 'lr': 0.00048335580362404696, 'weight_decay': 2.1701988871972837e-05, 'epochs': 326, 'loss': 'mse', 'optimizer': 'adam', 'graph_mode': 'off', 'use_snp_selection': False}. Best is trial 31 with value: 0.09732593083060198.
[I 2025-12-05 15:04:47,835] Trial 111 finished with value: 0.08005761488842919 and parameters: {'model_type': 'mlp', 'hidden_dims': '[256, 128]', 'dropout': 0.14947106313519254, 'batch_norm': True, 'lr': 0.00032476165611448833, 'weight_decay': 3.2404824643539836e-06, 'epochs': 313, 'loss': 'mse', 'optimizer': 'adam', 'graph_mode': 'off', 'use_snp_selection': False}. Best is trial 31 with value: 0.09732593083060198.
[I 2025-12-05 15:04:49,681] Trial 112 finished with value: 0.06495361530773452 and parameters: {'model_type': 'mlp', 'hidden_dims': '[512, 64]', 'dropout': 0.11281537211794204, 'batch_norm': True, 'lr': 0.00039471915593855225, 'weight_decay': 5.341126947666773e-06, 'epochs': 297, 'loss': 'mse', 'optimizer': 'adam', 'graph_mode': 'off', 'use_snp_selection': False}. Best is trial 31 with value: 0.09732593083060198.
[I 2025-12-05 15:04:50,952] Trial 113 finished with value: 0.052290954009705494 and parameters: {'model_type': 'mlp', 'hidden_dims': '[256, 128]', 'dropout': 0.13484217764346965, 'batch_norm': True, 'lr': 0.0006717452240099482, 'weight_decay': 2.4407848644284713e-06, 'epochs': 309, 'loss': 'mse', 'optimizer': 'adam', 'graph_mode': 'off', 'use_snp_selection': False}. Best is trial 31 with value: 0.09732593083060198.
[I 2025-12-05 15:04:52,261] Trial 114 finished with value: 0.07774500515755904 and parameters: {'model_type': 'mlp', 'hidden_dims': '[256, 128, 64]', 'dropout': 0.18985417884033343, 'batch_norm': True, 'lr': 0.000284900849384422, 'weight_decay': 1.5152356612611926e-06, 'epochs': 316, 'loss': 'mse', 'optimizer': 'adam', 'graph_mode': 'off', 'use_snp_selection': False}. Best is trial 31 with value: 0.09732593083060198.
[I 2025-12-05 15:04:54,050] Trial 115 finished with value: 0.06429668428654176 and parameters: {'model_type': 'mlp', 'hidden_dims': '[512, 64]', 'dropout': 0.11009495896593445, 'batch_norm': True, 'lr': 0.0004582352715877424, 'weight_decay': 3.6118068714707863e-06, 'epochs': 285, 'loss': 'mse', 'optimizer': 'adam', 'graph_mode': 'off', 'use_snp_selection': False}. Best is trial 31 with value: 0.09732593083060198.
[I 2025-12-05 15:04:55,343] Trial 116 finished with value: 0.0753291254662556 and parameters: {'model_type': 'mlp', 'hidden_dims': '[256, 128]', 'dropout': 0.17829320520562839, 'batch_norm': True, 'lr': 0.00011859007078160944, 'weight_decay': 1.4256817154794553e-07, 'epochs': 322, 'loss': 'mse', 'optimizer': 'adam', 'graph_mode': 'off', 'use_snp_selection': False}. Best is trial 31 with value: 0.09732593083060198.
[I 2025-12-05 15:04:57,327] Trial 117 finished with value: 0.06125481642747155 and parameters: {'model_type': 'mlp', 'hidden_dims': '[512, 64]', 'dropout': 0.13890689282896665, 'batch_norm': True, 'lr': 7.52833221869187e-05, 'weight_decay': 2.0439707776067725e-06, 'epochs': 350, 'loss': 'mse', 'optimizer': 'adam', 'graph_mode': 'off', 'use_snp_selection': False}. Best is trial 31 with value: 0.09732593083060198.
[I 2025-12-05 15:04:58,549] Trial 118 finished with value: 0.06421086600750485 and parameters: {'model_type': 'mlp', 'hidden_dims': '[256, 128]', 'dropout': 0.15746561373564327, 'batch_norm': True, 'lr': 0.0007654995342234875, 'weight_decay': 9.904520899637765e-06, 'epochs': 303, 'loss': 'mae', 'optimizer': 'adam', 'graph_mode': 'off', 'use_snp_selection': False}. Best is trial 31 with value: 0.09732593083060198.
[I 2025-12-05 15:05:00,396] Trial 119 finished with value: 0.04142087346490858 and parameters: {'model_type': 'mlp', 'hidden_dims': '[512, 256]', 'dropout': 0.12709554573210452, 'batch_norm': True, 'lr': 2.2717080749693952e-05, 'weight_decay': 7.572769516972768e-06, 'epochs': 293, 'loss': 'mse', 'optimizer': 'adam', 'graph_mode': 'off', 'use_snp_selection': False}. Best is trial 31 with value: 0.09732593083060198.
[I 2025-12-05 15:05:02,096] Trial 120 finished with value: 0.039164412424403314 and parameters: {'model_type': 'mlp', 'hidden_dims': '[512, 64]', 'dropout': 0.2164859411735966, 'batch_norm': False, 'lr': 0.0005577754815197719, 'weight_decay': 1.5498317756838233e-05, 'epochs': 256, 'loss': 'mse', 'optimizer': 'adam', 'graph_mode': 'off', 'use_snp_selection': False}. Best is trial 31 with value: 0.09732593083060198.
[I 2025-12-05 15:05:03,402] Trial 121 finished with value: 0.07909422745117006 and parameters: {'model_type': 'mlp', 'hidden_dims': '[256, 128]', 'dropout': 0.17343413692999088, 'batch_norm': True, 'lr': 0.00033658223789233445, 'weight_decay': 2.9350923298895257e-06, 'epochs': 318, 'loss': 'mse', 'optimizer': 'adam', 'graph_mode': 'off', 'use_snp_selection': False}. Best is trial 31 with value: 0.09732593083060198.
[I 2025-12-05 15:05:04,736] Trial 122 finished with value: 0.05156420707897972 and parameters: {'model_type': 'mlp', 'hidden_dims': '[256, 128]', 'dropout': 0.17839610522958557, 'batch_norm': True, 'lr': 0.00025655353238772556, 'weight_decay': 2.383960897642074e-06, 'epochs': 335, 'loss': 'mse', 'optimizer': 'adam', 'graph_mode': 'off', 'use_snp_selection': False}. Best is trial 31 with value: 0.09732593083060198.
[I 2025-12-05 15:05:06,030] Trial 123 finished with value: 0.07485906073827513 and parameters: {'model_type': 'mlp', 'hidden_dims': '[256, 128]', 'dropout': 0.1970591439243947, 'batch_norm': True, 'lr': 0.00030679021735267013, 'weight_decay': 1.0131481871381766e-06, 'epochs': 312, 'loss': 'mse', 'optimizer': 'adam', 'graph_mode': 'off', 'use_snp_selection': False}. Best is trial 31 with value: 0.09732593083060198.
[I 2025-12-05 15:05:07,301] Trial 124 finished with value: 0.07459552306029835 and parameters: {'model_type': 'mlp', 'hidden_dims': '[256, 128]', 'dropout': 0.14468206645074547, 'batch_norm': True, 'lr': 0.000386457020079628, 'weight_decay': 5.110597788269012e-06, 'epochs': 327, 'loss': 'mse', 'optimizer': 'adam', 'graph_mode': 'off', 'use_snp_selection': False}. Best is trial 31 with value: 0.09732593083060198.
[I 2025-12-05 15:05:08,293] Trial 125 finished with value: 0.07671497144999356 and parameters: {'model_type': 'mlp', 'hidden_dims': '[128, 64]', 'dropout': 0.1840611994301974, 'batch_norm': True, 'lr': 0.00017688186268207187, 'weight_decay': 3.70589406530443e-06, 'epochs': 307, 'loss': 'mse', 'optimizer': 'adam', 'graph_mode': 'off', 'use_snp_selection': False}. Best is trial 31 with value: 0.09732593083060198.
[I 2025-12-05 15:05:10,106] Trial 126 finished with value: 0.0807778099976317 and parameters: {'model_type': 'mlp', 'hidden_dims': '[512, 256]', 'dropout': 0.16009112415450164, 'batch_norm': True, 'lr': 0.0006200598575630072, 'weight_decay': 6.297919953706537e-06, 'epochs': 300, 'loss': 'mse', 'optimizer': 'adam', 'graph_mode': 'off', 'use_snp_selection': False}. Best is trial 31 with value: 0.09732593083060198.
[I 2025-12-05 15:05:11,402] Trial 127 finished with value: 0.08319304706498866 and parameters: {'model_type': 'mlp', 'hidden_dims': '[256, 128]', 'dropout': 0.12153448949502099, 'batch_norm': True, 'lr': 0.000882223020725953, 'weight_decay': 2.6091510234597752e-06, 'epochs': 317, 'loss': 'mse', 'optimizer': 'adam', 'graph_mode': 'off', 'use_snp_selection': False}. Best is trial 31 with value: 0.09732593083060198.
[I 2025-12-05 15:05:12,644] Trial 128 finished with value: 0.07661181254772192 and parameters: {'model_type': 'mlp', 'hidden_dims': '[256, 128]', 'dropout': 0.11274196854454784, 'batch_norm': True, 'lr': 0.0009030444020584548, 'weight_decay': 1.7537986873555735e-06, 'epochs': 285, 'loss': 'mae', 'optimizer': 'adam', 'graph_mode': 'off', 'use_snp_selection': False}. Best is trial 31 with value: 0.09732593083060198.
[I 2025-12-05 15:05:14,638] Trial 129 finished with value: 0.06569239741036444 and parameters: {'model_type': 'mlp', 'hidden_dims': '[512, 64]', 'dropout': 0.3093993060112119, 'batch_norm': True, 'lr': 0.0007200220233541767, 'weight_decay': 4.3605909935175025e-06, 'epochs': 341, 'loss': 'mse', 'optimizer': 'adam', 'graph_mode': 'off', 'use_snp_selection': False}. Best is trial 31 with value: 0.09732593083060198.
[I 2025-12-05 15:05:16,440] Trial 130 finished with value: 0.07692638456886638 and parameters: {'model_type': 'mlp', 'hidden_dims': '[512, 256]', 'dropout': 0.1261710375542938, 'batch_norm': True, 'lr': 0.0005013558978623703, 'weight_decay': 8.54729157994298e-06, 'epochs': 277, 'loss': 'mse', 'optimizer': 'adam', 'graph_mode': 'off', 'use_snp_selection': False}. Best is trial 31 with value: 0.09732593083060198.
[I 2025-12-05 15:05:17,744] Trial 131 finished with value: 0.043632140626465914 and parameters: {'model_type': 'mlp', 'hidden_dims': '[256, 128]', 'dropout': 0.13507918133806893, 'batch_norm': True, 'lr': 0.0004271051534175428, 'weight_decay': 2.818764909990607e-06, 'epochs': 317, 'loss': 'mse', 'optimizer': 'adam', 'graph_mode': 'off', 'use_snp_selection': False}. Best is trial 31 with value: 0.09732593083060198.
[I 2025-12-05 15:05:19,044] Trial 132 finished with value: 0.09038383243926376 and parameters: {'model_type': 'mlp', 'hidden_dims': '[256, 128]', 'dropout': 0.11829594247346642, 'batch_norm': True, 'lr': 0.0007769665641979978, 'weight_decay': 2.1775290707850163e-06, 'epochs': 322, 'loss': 'mse', 'optimizer': 'adam', 'graph_mode': 'off', 'use_snp_selection': False}. Best is trial 31 with value: 0.09732593083060198.
[I 2025-12-05 15:05:20,311] Trial 133 finished with value: 0.07739745527610417 and parameters: {'model_type': 'mlp', 'hidden_dims': '[256, 128]', 'dropout': 0.10650157552215805, 'batch_norm': True, 'lr': 0.000995736154109025, 'weight_decay': 3.343339490112358e-06, 'epochs': 308, 'loss': 'mse', 'optimizer': 'adam', 'graph_mode': 'off', 'use_snp_selection': False}. Best is trial 31 with value: 0.09732593083060198.
[I 2025-12-05 15:05:21,619] Trial 134 finished with value: 0.08261726972782002 and parameters: {'model_type': 'mlp', 'hidden_dims': '[256, 128]', 'dropout': 0.11946617142723134, 'batch_norm': True, 'lr': 0.0007310856752692125, 'weight_decay': 1.345360796727241e-06, 'epochs': 324, 'loss': 'mse', 'optimizer': 'adam', 'graph_mode': 'off', 'use_snp_selection': False}. Best is trial 31 with value: 0.09732593083060198.
[I 2025-12-05 15:05:22,945] Trial 135 finished with value: 0.0009227488449208211 and parameters: {'model_type': 'mlp', 'hidden_dims': '[256, 128]', 'dropout': 0.15083690642554842, 'batch_norm': True, 'lr': 1.0641329189400756e-06, 'weight_decay': 2.213454273084875e-06, 'epochs': 329, 'loss': 'mse', 'optimizer': 'adam', 'graph_mode': 'off', 'use_snp_selection': False}. Best is trial 31 with value: 0.09732593083060198.
[I 2025-12-05 15:05:24,165] Trial 136 finished with value: 0.07935716981380717 and parameters: {'model_type': 'mlp', 'hidden_dims': '[256, 128, 64]', 'dropout': 0.1286368355712113, 'batch_norm': True, 'lr': 0.0008582426142077042, 'weight_decay': 5.263314489038863e-06, 'epochs': 269, 'loss': 'mse', 'optimizer': 'adam', 'graph_mode': 'off', 'use_snp_selection': False}. Best is trial 31 with value: 0.09732593083060198.
[I 2025-12-05 15:05:25,418] Trial 137 finished with value: 0.000760603007685883 and parameters: {'model_type': 'mlp', 'hidden_dims': '[256, 128]', 'dropout': 0.11867406992694582, 'batch_norm': True, 'lr': 7.755764712953633e-06, 'weight_decay': 1.1358982439235086e-05, 'epochs': 296, 'loss': 'mse', 'optimizer': 'adam', 'graph_mode': 'off', 'use_snp_selection': False}. Best is trial 31 with value: 0.09732593083060198.
[I 2025-12-05 15:05:27,390] Trial 138 finished with value: 0.06548730279497215 and parameters: {'model_type': 'mlp', 'hidden_dims': '[512, 256]', 'dropout': 0.10034521653757572, 'batch_norm': True, 'lr': 0.0006259340229776263, 'weight_decay': 4.1773509562701065e-06, 'epochs': 335, 'loss': 'mse', 'optimizer': 'adam', 'graph_mode': 'off', 'use_snp_selection': False}. Best is trial 31 with value: 0.09732593083060198.
[I 2025-12-05 15:05:29,359] Trial 139 finished with value: 0.07247360358765179 and parameters: {'model_type': 'mlp', 'hidden_dims': '[512, 64]', 'dropout': 0.1435357770520344, 'batch_norm': True, 'lr': 0.0005395693544318442, 'weight_decay': 1.8008662844623287e-06, 'epochs': 343, 'loss': 'mae', 'optimizer': 'adam', 'graph_mode': 'off', 'use_snp_selection': False}. Best is trial 31 with value: 0.09732593083060198.
[I 2025-12-05 15:05:30,461] Trial 140 finished with value: 0.011695159720983169 and parameters: {'model_type': 'mlp', 'hidden_dims': '[256, 128]', 'dropout': 0.164245355190907, 'batch_norm': False, 'lr': 0.0008327355873715014, 'weight_decay': 0.0007408875349300954, 'epochs': 249, 'loss': 'mse', 'optimizer': 'adam', 'graph_mode': 'off', 'use_snp_selection': False}. Best is trial 31 with value: 0.09732593083060198.
[I 2025-12-05 15:05:31,761] Trial 141 finished with value: 0.08457622989440479 and parameters: {'model_type': 'mlp', 'hidden_dims': '[256, 128]', 'dropout': 0.11200340137825478, 'batch_norm': True, 'lr': 0.0002163859265296647, 'weight_decay': 2.2754015354879892e-06, 'epochs': 319, 'loss': 'mse', 'optimizer': 'adam', 'graph_mode': 'off', 'use_snp_selection': False}. Best is trial 31 with value: 0.09732593083060198.
[I 2025-12-05 15:05:33,074] Trial 142 finished with value: 0.07859130459727366 and parameters: {'model_type': 'mlp', 'hidden_dims': '[256, 128]', 'dropout': 0.11023520628186186, 'batch_norm': True, 'lr': 0.00014732180147480285, 'weight_decay': 7.098780223036846e-06, 'epochs': 321, 'loss': 'mse', 'optimizer': 'adam', 'graph_mode': 'off', 'use_snp_selection': False}. Best is trial 31 with value: 0.09732593083060198.
[I 2025-12-05 15:05:34,344] Trial 143 finished with value: 0.09039822822928731 and parameters: {'model_type': 'mlp', 'hidden_dims': '[256, 128]', 'dropout': 0.13522753034688917, 'batch_norm': True, 'lr': 0.0002083867770907699, 'weight_decay': 2.750474285928024e-06, 'epochs': 304, 'loss': 'mse', 'optimizer': 'adam', 'graph_mode': 'off', 'use_snp_selection': False}. Best is trial 31 with value: 0.09732593083060198.
[I 2025-12-05 15:05:35,613] Trial 144 finished with value: 0.09613245589808866 and parameters: {'model_type': 'mlp', 'hidden_dims': '[256, 128]', 'dropout': 0.13700807632666334, 'batch_norm': True, 'lr': 0.00026633300931077855, 'weight_decay': 3.0477641115087185e-06, 'epochs': 301, 'loss': 'mse', 'optimizer': 'adam', 'graph_mode': 'off', 'use_snp_selection': False}. Best is trial 31 with value: 0.09732593083060198.
[I 2025-12-05 15:05:36,871] Trial 145 finished with value: 0.08063005756565465 and parameters: {'model_type': 'mlp', 'hidden_dims': '[256, 128]', 'dropout': 0.13822613186127367, 'batch_norm': True, 'lr': 0.00020291262301224184, 'weight_decay': 1.03132923760419e-06, 'epochs': 290, 'loss': 'mse', 'optimizer': 'adam', 'graph_mode': 'off', 'use_snp_selection': False}. Best is trial 31 with value: 0.09732593083060198.
[I 2025-12-05 15:05:38,154] Trial 146 finished with value: 0.07783860307702098 and parameters: {'model_type': 'mlp', 'hidden_dims': '[256, 128]', 'dropout': 0.14987507561965654, 'batch_norm': True, 'lr': 0.00024103191444173414, 'weight_decay': 6.108005367643481e-06, 'epochs': 305, 'loss': 'mse', 'optimizer': 'adam', 'graph_mode': 'off', 'use_snp_selection': False}. Best is trial 31 with value: 0.09732593083060198.
