[I 2025-12-05 20:44:47,403] Trial 108 finished with value: 0.20253732657984264 and parameters: {'model_type': 'mlp', 'hidden_dims': '[512, 64]', 'dropout': 0.46347502772756843, 'batch_norm': True, 'lr': 7.994925014870758e-05, 'weight_decay': 9.544267725671532e-05, 'epochs': 144, 'loss': 'mae', 'optimizer': 'adam', 'graph_mode': 'off', 'use_snp_selection': False}. Best is trial 57 with value: 0.23764430199362083.
[I 2025-12-05 20:45:26,317] Trial 109 finished with value: 0.21916174626308882 and parameters: {'model_type': 'mlp', 'hidden_dims': '[512, 64]', 'dropout': 0.4836400123597607, 'batch_norm': True, 'lr': 5.430926751037049e-05, 'weight_decay': 8.535884745720789e-06, 'epochs': 132, 'loss': 'mae', 'optimizer': 'adam', 'graph_mode': 'off', 'use_snp_selection': True, 'num_snps': 11878}. Best is trial 57 with value: 0.23764430199362083.
[I 2025-12-05 20:46:05,106] Trial 110 finished with value: 0.2231547036666955 and parameters: {'model_type': 'mlp', 'hidden_dims': '[512, 64]', 'dropout': 0.42736838876726313, 'batch_norm': True, 'lr': 6.820465603577208e-05, 'weight_decay': 5.099609087126806e-05, 'epochs': 108, 'loss': 'mae', 'optimizer': 'adam', 'graph_mode': 'off', 'use_snp_selection': True, 'num_snps': 13467}. Best is trial 57 with value: 0.23764430199362083.
[I 2025-12-05 20:46:37,811] Trial 111 finished with value: 0.19447321461887307 and parameters: {'model_type': 'mlp', 'hidden_dims': '[512, 64]', 'dropout': 0.4951849223956271, 'batch_norm': True, 'lr': 0.00010328752057100239, 'weight_decay': 8.010972674299178e-05, 'epochs': 120, 'loss': 'mae', 'optimizer': 'adam', 'graph_mode': 'off', 'use_snp_selection': True, 'num_snps': 5222}. Best is trial 57 with value: 0.23764430199362083.
[I 2025-12-05 20:47:13,573] Trial 112 finished with value: 0.18271299889648535 and parameters: {'model_type': 'mlp', 'hidden_dims': '[512, 128]', 'dropout': 0.4732405339100998, 'batch_norm': True, 'lr': 3.6120905526768945e-05, 'weight_decay': 4.448688207182258e-05, 'epochs': 90, 'loss': 'mae', 'optimizer': 'adam', 'graph_mode': 'off', 'use_snp_selection': True, 'num_snps': 10431}. Best is trial 57 with value: 0.23764430199362083.
[I 2025-12-05 20:47:54,383] Trial 113 finished with value: 0.21773094193783046 and parameters: {'model_type': 'mlp', 'hidden_dims': '[512, 64]', 'dropout': 0.5021929293622649, 'batch_norm': True, 'lr': 4.878589077475486e-05, 'weight_decay': 6.535595976660304e-05, 'epochs': 127, 'loss': 'mae', 'optimizer': 'adam', 'graph_mode': 'off', 'use_snp_selection': True, 'num_snps': 14508}. Best is trial 57 with value: 0.23764430199362083.
[I 2025-12-05 20:48:30,691] Trial 114 finished with value: 0.1667529232134983 and parameters: {'model_type': 'mlp', 'hidden_dims': '[256, 128]', 'dropout': 0.5696119915740173, 'batch_norm': True, 'lr': 9.988391812166035e-06, 'weight_decay': 1.4962292442777814e-05, 'epochs': 154, 'loss': 'mae', 'optimizer': 'adam', 'graph_mode': 'off', 'use_snp_selection': True, 'num_snps': 11933}. Best is trial 57 with value: 0.23764430199362083.
[I 2025-12-05 20:49:05,634] Trial 115 finished with value: 0.21475033830615717 and parameters: {'model_type': 'mlp', 'hidden_dims': '[512, 64]', 'dropout': 0.4471696054648467, 'batch_norm': True, 'lr': 0.00024041972569137924, 'weight_decay': 1.0575885076475016e-05, 'epochs': 96, 'loss': 'mae', 'optimizer': 'adam', 'graph_mode': 'off', 'use_snp_selection': True, 'num_snps': 9055}. Best is trial 57 with value: 0.23764430199362083.
[I 2025-12-05 20:50:21,166] Trial 116 finished with value: 0.2049127240491476 and parameters: {'model_type': 'mlp', 'hidden_dims': '[512, 256]', 'dropout': 0.533415585005823, 'batch_norm': True, 'lr': 8.999640828874051e-05, 'weight_decay': 0.00016786334882752963, 'epochs': 140, 'loss': 'mae', 'optimizer': 'adam', 'graph_mode': 'off', 'use_snp_selection': True, 'num_snps': 50914}. Best is trial 57 with value: 0.23764430199362083.
[I 2025-12-05 20:50:59,048] Trial 117 finished with value: 0.21646839134980583 and parameters: {'model_type': 'mlp', 'hidden_dims': '[128, 64]', 'dropout': 0.5999646695066674, 'batch_norm': True, 'lr': 0.00015607382381820916, 'weight_decay': 0.00012535054579283057, 'epochs': 165, 'loss': 'mse', 'optimizer': 'adam', 'graph_mode': 'off', 'use_snp_selection': True, 'num_snps': 17925}. Best is trial 57 with value: 0.23764430199362083.
[I 2025-12-05 20:51:41,910] Trial 118 finished with value: 0.20577025285844522 and parameters: {'model_type': 'mlp', 'hidden_dims': '[512, 64]', 'dropout': 0.34866826821367286, 'batch_norm': True, 'lr': 7.686204743848363e-06, 'weight_decay': 7.762559788639906e-05, 'epochs': 134, 'loss': 'mae', 'optimizer': 'adam', 'graph_mode': 'off', 'use_snp_selection': True, 'num_snps': 16077}. Best is trial 57 with value: 0.23764430199362083.
[I 2025-12-05 20:52:26,391] Trial 119 finished with value: 0.23040048111493916 and parameters: {'model_type': 'mlp', 'hidden_dims': '[512, 128]', 'dropout': 0.5115289744164017, 'batch_norm': True, 'lr': 6.571679253234625e-05, 'weight_decay': 5.588569288752412e-05, 'epochs': 188, 'loss': 'mae', 'optimizer': 'adam', 'graph_mode': 'off', 'use_snp_selection': True, 'num_snps': 14033}. Best is trial 57 with value: 0.23764430199362083.
[I 2025-12-05 20:53:17,808] Trial 120 finished with value: 0.21762802942235995 and parameters: {'model_type': 'mlp', 'hidden_dims': '[512, 64]', 'dropout': 0.46192148807364913, 'batch_norm': True, 'lr': 3.9630301783485685e-05, 'weight_decay': 3.0178703118759624e-05, 'epochs': 177, 'loss': 'mae', 'optimizer': 'adam', 'graph_mode': 'off', 'use_snp_selection': True, 'num_snps': 21755}. Best is trial 57 with value: 0.23764430199362083.
[I 2025-12-05 20:54:02,013] Trial 121 finished with value: 0.22515062134871427 and parameters: {'model_type': 'mlp', 'hidden_dims': '[512, 128]', 'dropout': 0.4860021696321355, 'batch_norm': True, 'lr': 7.524150055701356e-05, 'weight_decay': 9.830096188755408e-05, 'epochs': 187, 'loss': 'mae', 'optimizer': 'adam', 'graph_mode': 'off', 'use_snp_selection': True, 'num_snps': 14073}. Best is trial 57 with value: 0.23764430199362083.
[I 2025-12-05 20:54:43,191] Trial 122 finished with value: 0.20643818684984874 and parameters: {'model_type': 'mlp', 'hidden_dims': '[512, 128]', 'dropout': 0.5132896920193337, 'batch_norm': True, 'lr': 6.48525993103723e-05, 'weight_decay': 5.4644080191973064e-05, 'epochs': 172, 'loss': 'mae', 'optimizer': 'adam', 'graph_mode': 'off', 'use_snp_selection': True, 'num_snps': 12164}. Best is trial 57 with value: 0.23764430199362083.
[I 2025-12-05 20:55:29,677] Trial 123 finished with value: 0.20613024183703627 and parameters: {'model_type': 'mlp', 'hidden_dims': '[512, 128]', 'dropout': 0.5009201235425979, 'batch_norm': True, 'lr': 1.8670072526975947e-05, 'weight_decay': 1.8897890852191517e-05, 'epochs': 209, 'loss': 'mae', 'optimizer': 'adam', 'graph_mode': 'off', 'use_snp_selection': True, 'num_snps': 15431}. Best is trial 57 with value: 0.23764430199362083.
[I 2025-12-05 20:56:10,580] Trial 124 finished with value: 0.21776741655757648 and parameters: {'model_type': 'mlp', 'hidden_dims': '[512, 128]', 'dropout': 0.5200236554473465, 'batch_norm': True, 'lr': 0.00011601475849924036, 'weight_decay': 4.476968739145545e-06, 'epochs': 199, 'loss': 'mae', 'optimizer': 'adam', 'graph_mode': 'off', 'use_snp_selection': True, 'num_snps': 10784}. Best is trial 57 with value: 0.23764430199362083.
[I 2025-12-05 20:56:49,621] Trial 125 finished with value: 0.21795006722467622 and parameters: {'model_type': 'mlp', 'hidden_dims': '[256, 128, 64]', 'dropout': 0.5459171489321741, 'batch_norm': True, 'lr': 9.588999713222736e-05, 'weight_decay': 7.070433856942118e-05, 'epochs': 113, 'loss': 'mae', 'optimizer': 'adam', 'graph_mode': 'off', 'use_snp_selection': True, 'num_snps': 18686}. Best is trial 57 with value: 0.23764430199362083.
[I 2025-12-05 20:57:28,029] Trial 126 finished with value: 0.20408997108318644 and parameters: {'model_type': 'mlp', 'hidden_dims': '[512, 128]', 'dropout': 0.5819479575646836, 'batch_norm': True, 'lr': 7.971891910469872e-05, 'weight_decay': 4.319699852939354e-05, 'epochs': 105, 'loss': 'mae', 'optimizer': 'adam', 'graph_mode': 'off', 'use_snp_selection': True, 'num_snps': 13284}. Best is trial 57 with value: 0.23764430199362083.
[I 2025-12-05 20:58:08,458] Trial 127 finished with value: 0.19857755195118526 and parameters: {'model_type': 'mlp', 'hidden_dims': '[512, 64]', 'dropout': 0.4736521773566829, 'batch_norm': True, 'lr': 0.0002705513932930545, 'weight_decay': 3.4438818043423485e-05, 'epochs': 127, 'loss': 'mae', 'optimizer': 'adam', 'graph_mode': 'off', 'use_snp_selection': False}. Best is trial 57 with value: 0.23764430199362083.
[I 2025-12-05 20:58:47,493] Trial 128 finished with value: 0.22286347164843648 and parameters: {'model_type': 'mlp', 'hidden_dims': '[256, 128]', 'dropout': 0.18850616930058134, 'batch_norm': True, 'lr': 0.00018293520349702125, 'weight_decay': 1.2693129334965845e-05, 'epochs': 148, 'loss': 'mae', 'optimizer': 'adam', 'graph_mode': 'off', 'use_snp_selection': True, 'num_snps': 17206}. Best is trial 57 with value: 0.23764430199362083.
[I 2025-12-05 20:59:25,717] Trial 129 finished with value: 0.21331012552503767 and parameters: {'model_type': 'mlp', 'hidden_dims': '[512, 64]', 'dropout': 0.11136234177636778, 'batch_norm': False, 'lr': 0.00034017483935954747, 'weight_decay': 2.3076122746173195e-05, 'epochs': 214, 'loss': 'mae', 'optimizer': 'adam', 'graph_mode': 'off', 'use_snp_selection': True, 'num_snps': 8559}. Best is trial 57 with value: 0.23764430199362083.
[I 2025-12-05 21:00:24,276] Trial 130 finished with value: 0.21733082526217856 and parameters: {'model_type': 'mlp', 'hidden_dims': '[512, 64]', 'dropout': 0.5283493175506373, 'batch_norm': True, 'lr': 5.9437124315374835e-05, 'weight_decay': 3.4079627909647016e-06, 'epochs': 291, 'loss': 'mae', 'optimizer': 'adam', 'graph_mode': 'off', 'use_snp_selection': True, 'num_snps': 19665}. Best is trial 57 with value: 0.23764430199362083.
[I 2025-12-05 21:01:12,846] Trial 131 finished with value: 0.2225831671816406 and parameters: {'model_type': 'mlp', 'hidden_dims': '[512, 64]', 'dropout': 0.556484794388697, 'batch_norm': True, 'lr': 0.00012507453088193062, 'weight_decay': 4.2583347830265944e-07, 'epochs': 221, 'loss': 'mae', 'optimizer': 'adam', 'graph_mode': 'off', 'use_snp_selection': True, 'num_snps': 16591}. Best is trial 57 with value: 0.23764430199362083.
[I 2025-12-05 21:02:00,067] Trial 132 finished with value: 0.22064901603501474 and parameters: {'model_type': 'mlp', 'hidden_dims': '[512, 64]', 'dropout': 0.56397230793041, 'batch_norm': True, 'lr': 0.00014311618809238145, 'weight_decay': 2.6181986099648287e-06, 'epochs': 225, 'loss': 'mae', 'optimizer': 'adam', 'graph_mode': 'off', 'use_snp_selection': True, 'num_snps': 15359}. Best is trial 57 with value: 0.23764430199362083.
[I 2025-12-05 21:02:51,290] Trial 133 finished with value: 0.22916269464982464 and parameters: {'model_type': 'mlp', 'hidden_dims': '[512, 64]', 'dropout': 0.5415586817113163, 'batch_norm': True, 'lr': 0.00011160092107742756, 'weight_decay': 1.818423806248047e-06, 'epochs': 231, 'loss': 'mae', 'optimizer': 'adam', 'graph_mode': 'off', 'use_snp_selection': True, 'num_snps': 17827}. Best is trial 57 with value: 0.23764430199362083.
[I 2025-12-05 21:03:35,626] Trial 134 finished with value: 0.22858984316285116 and parameters: {'model_type': 'mlp', 'hidden_dims': '[512, 64]', 'dropout': 0.5088092457866868, 'batch_norm': True, 'lr': 0.00010174091576087455, 'weight_decay': 6.16051329722176e-05, 'epochs': 193, 'loss': 'mae', 'optimizer': 'adam', 'graph_mode': 'off', 'use_snp_selection': True, 'num_snps': 14061}. Best is trial 57 with value: 0.23764430199362083.
[I 2025-12-05 21:04:18,441] Trial 135 finished with value: 0.23942806610570228 and parameters: {'model_type': 'mlp', 'hidden_dims': '[512, 64]', 'dropout': 0.5356073926748062, 'batch_norm': True, 'lr': 0.00011041595000097999, 'weight_decay': 5.930798729674237e-05, 'epochs': 192, 'loss': 'mae', 'optimizer': 'adam', 'graph_mode': 'off', 'use_snp_selection': True, 'num_snps': 12860}. Best is trial 135 with value: 0.23942806610570228.
[I 2025-12-05 21:05:01,106] Trial 136 finished with value: 0.2291421412835722 and parameters: {'model_type': 'mlp', 'hidden_dims': '[512, 64]', 'dropout': 0.540552753343868, 'batch_norm': True, 'lr': 9.040461456589258e-05, 'weight_decay': 5.627442177951598e-05, 'epochs': 193, 'loss': 'mae', 'optimizer': 'adam', 'graph_mode': 'off', 'use_snp_selection': True, 'num_snps': 12828}. Best is trial 135 with value: 0.23942806610570228.
[I 2025-12-05 21:05:42,783] Trial 137 finished with value: 0.22195008256652007 and parameters: {'model_type': 'mlp', 'hidden_dims': '[512, 64]', 'dropout': 0.5395974764122102, 'batch_norm': True, 'lr': 5.1123197235049383e-05, 'weight_decay': 4.7749316198820036e-05, 'epochs': 180, 'loss': 'mae', 'optimizer': 'adam', 'graph_mode': 'off', 'use_snp_selection': True, 'num_snps': 12530}. Best is trial 135 with value: 0.23942806610570228.
[I 2025-12-05 21:06:22,937] Trial 138 finished with value: 0.2097203584420139 and parameters: {'model_type': 'mlp', 'hidden_dims': '[512, 64]', 'dropout': 0.5252703586406652, 'batch_norm': True, 'lr': 8.811076108182413e-05, 'weight_decay': 3.6165644914696994e-05, 'epochs': 207, 'loss': 'mae', 'optimizer': 'adam', 'graph_mode': 'off', 'use_snp_selection': True, 'num_snps': 10103}. Best is trial 135 with value: 0.23942806610570228.
[I 2025-12-05 21:06:59,968] Trial 139 finished with value: 0.20298448433196112 and parameters: {'model_type': 'mlp', 'hidden_dims': '[512, 64]', 'dropout': 0.5481471149051119, 'batch_norm': True, 'lr': 6.979998857010121e-05, 'weight_decay': 1.0335759534145714e-06, 'epochs': 237, 'loss': 'mse', 'optimizer': 'adam', 'graph_mode': 'off', 'use_snp_selection': True, 'num_snps': 6770}. Best is trial 135 with value: 0.23942806610570228.
[I 2025-12-05 21:07:40,417] Trial 140 finished with value: 0.22449950690967047 and parameters: {'model_type': 'mlp', 'hidden_dims': '[512, 64]', 'dropout': 0.49087756687191514, 'batch_norm': True, 'lr': 8.827991148895208e-05, 'weight_decay': 1.8736060863916638e-06, 'epochs': 187, 'loss': 'mae', 'optimizer': 'adam', 'graph_mode': 'off', 'use_snp_selection': True, 'num_snps': 11326}. Best is trial 135 with value: 0.23942806610570228.
[I 2025-12-05 21:08:24,773] Trial 141 finished with value: 0.2344023212141361 and parameters: {'model_type': 'mlp', 'hidden_dims': '[512, 64]', 'dropout': 0.51192411577853, 'batch_norm': True, 'lr': 0.00010900008958888666, 'weight_decay': 6.697733078420007e-05, 'epochs': 194, 'loss': 'mae', 'optimizer': 'adam', 'graph_mode': 'off', 'use_snp_selection': True, 'num_snps': 14036}. Best is trial 135 with value: 0.23942806610570228.
[I 2025-12-05 21:09:09,750] Trial 142 finished with value: 0.23649265508463566 and parameters: {'model_type': 'mlp', 'hidden_dims': '[512, 64]', 'dropout': 0.5378697082268691, 'batch_norm': True, 'lr': 0.00011203216232350563, 'weight_decay': 5.6590506924627016e-05, 'epochs': 199, 'loss': 'mae', 'optimizer': 'adam', 'graph_mode': 'off', 'use_snp_selection': True, 'num_snps': 14626}. Best is trial 135 with value: 0.23942806610570228.
[I 2025-12-05 21:09:54,472] Trial 143 finished with value: 0.22198087192483068 and parameters: {'model_type': 'mlp', 'hidden_dims': '[512, 64]', 'dropout': 0.5147301231723652, 'batch_norm': True, 'lr': 6.295119797633433e-05, 'weight_decay': 5.9615929985750265e-05, 'epochs': 197, 'loss': 'mae', 'optimizer': 'adam', 'graph_mode': 'off', 'use_snp_selection': True, 'num_snps': 14648}. Best is trial 135 with value: 0.23942806610570228.
[I 2025-12-05 21:10:37,694] Trial 144 finished with value: 0.21437610330574608 and parameters: {'model_type': 'mlp', 'hidden_dims': '[512, 64]', 'dropout': 0.5355109077021253, 'batch_norm': True, 'lr': 0.000116957458176423, 'weight_decay': 8.828409172507245e-05, 'epochs': 202, 'loss': 'mae', 'optimizer': 'adam', 'graph_mode': 'off', 'use_snp_selection': True, 'num_snps': 12784}. Best is trial 135 with value: 0.23942806610570228.
[I 2025-12-05 21:11:16,543] Trial 145 finished with value: 0.2245247877024247 and parameters: {'model_type': 'mlp', 'hidden_dims': '[512, 64]', 'dropout': 0.5238207809522765, 'batch_norm': True, 'lr': 0.00020645043900625477, 'weight_decay': 7.591991514613754e-05, 'epochs': 188, 'loss': 'mae', 'optimizer': 'adam', 'graph_mode': 'off', 'use_snp_selection': True, 'num_snps': 9553}. Best is trial 135 with value: 0.23942806610570228.
[I 2025-12-05 21:12:02,699] Trial 146 finished with value: 0.22269627370173387 and parameters: {'model_type': 'mlp', 'hidden_dims': '[512, 64]', 'dropout': 0.4969830702439426, 'batch_norm': True, 'lr': 7.925984568735049e-05, 'weight_decay': 0.00012196068005142096, 'epochs': 193, 'loss': 'mae', 'optimizer': 'adam', 'graph_mode': 'off', 'use_snp_selection': True, 'num_snps': 15878}. Best is trial 135 with value: 0.23942806610570228.
[I 2025-12-05 21:12:44,454] Trial 147 finished with value: 0.21856144326012808 and parameters: {'model_type': 'mlp', 'hidden_dims': '[512, 64]', 'dropout': 0.5455674949210353, 'batch_norm': True, 'lr': 0.0001537397426727817, 'weight_decay': 5.593304220156344e-05, 'epochs': 168, 'loss': 'mae', 'optimizer': 'adam', 'graph_mode': 'off', 'use_snp_selection': True, 'num_snps': 13595}. Best is trial 135 with value: 0.23942806610570228.
[I 2025-12-05 21:13:48,431] Trial 148 finished with value: 0.20000567352563073 and parameters: {'model_type': 'mlp', 'hidden_dims': '[512, 64]', 'dropout': 0.2901364699294252, 'batch_norm': True, 'lr': 0.0006642535179950868, 'weight_decay': 5.304097054783165e-06, 'epochs': 217, 'loss': 'mae', 'optimizer': 'adam', 'graph_mode': 'off', 'use_snp_selection': False}. Best is trial 135 with value: 0.23942806610570228.
[I 2025-12-05 21:14:32,234] Trial 149 finished with value: 0.22766554436964279 and parameters: {'model_type': 'mlp', 'hidden_dims': '[512, 64]', 'dropout': 0.5101502969727911, 'batch_norm': True, 'lr': 0.00011095422135293424, 'weight_decay': 6.651710446294886e-05, 'epochs': 248, 'loss': 'mae', 'optimizer': 'adam', 'graph_mode': 'off', 'use_snp_selection': True, 'num_snps': 11360}. Best is trial 135 with value: 0.23942806610570228.
[I 2025-12-05 21:15:37,491] Trial 0 finished with value: 0.14526302339304903 and parameters: {'model_type': 'mlp', 'hidden_dims': '[128, 64]', 'dropout': 0.199031432379812, 'batch_norm': True, 'lr': 1.8408544111075837e-06, 'weight_decay': 5.5136510071208614e-05, 'epochs': 336, 'loss': 'mae', 'optimizer': 'adam', 'graph_mode': 'off', 'use_snp_selection': True, 'num_snps': 43862}. Best is trial 0 with value: 0.14526302339304903.
[I 2025-12-05 21:16:17,449] Trial 1 finished with value: 0.19732290266230085 and parameters: {'model_type': 'mlp', 'hidden_dims': '[256, 128]', 'dropout': 0.4370668075331726, 'batch_norm': True, 'lr': 7.133471581159139e-05, 'weight_decay': 1.128633586803549e-05, 'epochs': 242, 'loss': 'mae', 'optimizer': 'adam', 'graph_mode': 'off', 'use_snp_selection': False}. Best is trial 1 with value: 0.19732290266230085.
[I 2025-12-05 21:16:54,135] Trial 2 finished with value: 0.17085085472229833 and parameters: {'model_type': 'mlp', 'hidden_dims': '[256, 128, 64]', 'dropout': 0.41314357415569625, 'batch_norm': False, 'lr': 3.952233718592101e-06, 'weight_decay': 0.00026754769258252603, 'epochs': 149, 'loss': 'mse', 'optimizer': 'adam', 'graph_mode': 'off', 'use_snp_selection': True, 'num_snps': 11571}. Best is trial 1 with value: 0.19732290266230085.
[I 2025-12-05 21:18:27,031] Trial 3 finished with value: 0.20264644177675972 and parameters: {'model_type': 'mlp', 'hidden_dims': '[512, 64]', 'dropout': 0.5938127374509361, 'batch_norm': False, 'lr': 5.67704586114731e-06, 'weight_decay': 2.4518087630137052e-05, 'epochs': 320, 'loss': 'mae', 'optimizer': 'adam', 'graph_mode': 'off', 'use_snp_selection': False}. Best is trial 3 with value: 0.20264644177675972.
[I 2025-12-05 21:19:51,382] Trial 4 finished with value: 0.16295230988035345 and parameters: {'model_type': 'mlp', 'hidden_dims': '[512, 128]', 'dropout': 0.25746343592134413, 'batch_norm': True, 'lr': 1.3467657668402788e-06, 'weight_decay': 0.00033087251918647806, 'epochs': 277, 'loss': 'mse', 'optimizer': 'adam', 'graph_mode': 'off', 'use_snp_selection': True, 'num_snps': 36675}. Best is trial 3 with value: 0.20264644177675972.
[I 2025-12-05 21:20:50,654] Trial 5 finished with value: 0.13908029271827974 and parameters: {'model_type': 'mlp', 'hidden_dims': '[512, 64]', 'dropout': 0.38275350994408375, 'batch_norm': True, 'lr': 1.5586664309232824e-06, 'weight_decay': 0.0008227664668621182, 'epochs': 145, 'loss': 'mae', 'optimizer': 'adam', 'graph_mode': 'off', 'use_snp_selection': True, 'num_snps': 32148}. Best is trial 3 with value: 0.20264644177675972.
[I 2025-12-05 21:21:23,918] Trial 6 finished with value: 0.19348825835281175 and parameters: {'model_type': 'mlp', 'hidden_dims': '[256, 128]', 'dropout': 0.3930109900265879, 'batch_norm': False, 'lr': 4.892964372128395e-05, 'weight_decay': 1.5809549317992182e-06, 'epochs': 199, 'loss': 'mse', 'optimizer': 'adam', 'graph_mode': 'off', 'use_snp_selection': False}. Best is trial 3 with value: 0.20264644177675972.
[I 2025-12-05 21:21:57,750] Trial 7 finished with value: 0.2060338907838885 and parameters: {'model_type': 'mlp', 'hidden_dims': '[512, 256]', 'dropout': 0.15343979219678458, 'batch_norm': True, 'lr': 6.234003099047341e-05, 'weight_decay': 3.894760610535477e-07, 'epochs': 97, 'loss': 'mse', 'optimizer': 'adam', 'graph_mode': 'off', 'use_snp_selection': False}. Best is trial 7 with value: 0.2060338907838885.
[I 2025-12-05 21:23:30,394] Trial 8 finished with value: 0.19648673930984914 and parameters: {'model_type': 'mlp', 'hidden_dims': '[512, 128]', 'dropout': 0.10743001231661406, 'batch_norm': True, 'lr': 0.00023728538449271062, 'weight_decay': 1.7629071578048637e-05, 'epochs': 312, 'loss': 'mae', 'optimizer': 'adam', 'graph_mode': 'off', 'use_snp_selection': False}. Best is trial 7 with value: 0.2060338907838885.
