[I 2025-12-06 01:06:18,471] Trial 75 finished with value: 0.30355881813180596 and parameters: {'model_type': 'mlp', 'hidden_dims': '[256, 128, 64]', 'dropout': 0.2574097396591849, 'batch_norm': True, 'lr': 6.566151609967613e-05, 'weight_decay': 6.175611169415963e-07, 'epochs': 306, 'loss': 'mse', 'optimizer': 'adam', 'graph_mode': 'off', 'use_snp_selection': False}. Best is trial 22 with value: 0.31340379818889347.
[I 2025-12-06 01:06:48,138] Trial 76 finished with value: 0.3074880851833014 and parameters: {'model_type': 'mlp', 'hidden_dims': '[256, 128, 64]', 'dropout': 0.22415274277803254, 'batch_norm': True, 'lr': 8.676951741559253e-05, 'weight_decay': 4.416424937098069e-07, 'epochs': 270, 'loss': 'mse', 'optimizer': 'adam', 'graph_mode': 'off', 'use_snp_selection': False}. Best is trial 22 with value: 0.31340379818889347.
[I 2025-12-06 01:07:08,876] Trial 77 finished with value: 0.2923792602077878 and parameters: {'model_type': 'mlp', 'hidden_dims': '[256, 128, 64]', 'dropout': 0.20480809841133396, 'batch_norm': True, 'lr': 1.0270361410604057e-05, 'weight_decay': 0.00012973730889041354, 'epochs': 174, 'loss': 'mse', 'optimizer': 'adam', 'graph_mode': 'off', 'use_snp_selection': False}. Best is trial 22 with value: 0.31340379818889347.
[I 2025-12-06 01:07:19,019] Trial 78 finished with value: 0.30227687585474594 and parameters: {'model_type': 'mlp', 'hidden_dims': '[256, 128, 64]', 'dropout': 0.16824688718840125, 'batch_norm': True, 'lr': 0.00010588640598742578, 'weight_decay': 1.4209000964774442e-07, 'epochs': 59, 'loss': 'mse', 'optimizer': 'adam', 'graph_mode': 'off', 'use_snp_selection': False}. Best is trial 22 with value: 0.31340379818889347.
[I 2025-12-06 01:08:28,721] Trial 79 finished with value: 0.3135874364862798 and parameters: {'model_type': 'mlp', 'hidden_dims': '[512, 64]', 'dropout': 0.14824714674475517, 'batch_norm': True, 'lr': 4.7296760166544494e-05, 'weight_decay': 0.0009989780032167454, 'epochs': 323, 'loss': 'mse', 'optimizer': 'adam', 'graph_mode': 'off', 'use_snp_selection': True, 'num_snps': 40993}. Best is trial 79 with value: 0.3135874364862798.
[I 2025-12-06 01:09:34,608] Trial 80 finished with value: 0.29803657429556474 and parameters: {'model_type': 'mlp', 'hidden_dims': '[512, 64]', 'dropout': 0.15319715627437933, 'batch_norm': False, 'lr': 4.381701720215401e-05, 'weight_decay': 0.0008491669302129529, 'epochs': 292, 'loss': 'mse', 'optimizer': 'adam', 'graph_mode': 'off', 'use_snp_selection': True, 'num_snps': 41048}. Best is trial 79 with value: 0.3135874364862798.
[I 2025-12-06 01:10:33,847] Trial 81 finished with value: 0.30826155712880954 and parameters: {'model_type': 'mlp', 'hidden_dims': '[512, 64]', 'dropout': 0.14510081297463145, 'batch_norm': True, 'lr': 6.321372655156039e-05, 'weight_decay': 0.0003623540452868981, 'epochs': 327, 'loss': 'mse', 'optimizer': 'adam', 'graph_mode': 'off', 'use_snp_selection': True, 'num_snps': 31690}. Best is trial 79 with value: 0.3135874364862798.
[I 2025-12-06 01:11:56,921] Trial 82 finished with value: 0.3126297747180124 and parameters: {'model_type': 'mlp', 'hidden_dims': '[512, 64]', 'dropout': 0.11480183036295373, 'batch_norm': True, 'lr': 2.98228700588047e-05, 'weight_decay': 0.00025628134317723665, 'epochs': 318, 'loss': 'mse', 'optimizer': 'adam', 'graph_mode': 'off', 'use_snp_selection': True, 'num_snps': 52509}. Best is trial 79 with value: 0.3135874364862798.
[I 2025-12-06 01:13:24,415] Trial 83 finished with value: 0.31255594535452 and parameters: {'model_type': 'mlp', 'hidden_dims': '[512, 64]', 'dropout': 0.11829605058864005, 'batch_norm': True, 'lr': 3.281285439781897e-05, 'weight_decay': 0.0006309396572502692, 'epochs': 350, 'loss': 'mse', 'optimizer': 'adam', 'graph_mode': 'off', 'use_snp_selection': True, 'num_snps': 52220}. Best is trial 79 with value: 0.3135874364862798.
[I 2025-12-06 01:14:50,057] Trial 84 finished with value: 0.30930643343014047 and parameters: {'model_type': 'mlp', 'hidden_dims': '[512, 64]', 'dropout': 0.11203737959758761, 'batch_norm': True, 'lr': 1.929074963307332e-05, 'weight_decay': 0.0005935973559258514, 'epochs': 344, 'loss': 'mse', 'optimizer': 'adam', 'graph_mode': 'off', 'use_snp_selection': True, 'num_snps': 51778}. Best is trial 79 with value: 0.3135874364862798.
[I 2025-12-06 01:16:13,286] Trial 85 finished with value: 0.3106436025835285 and parameters: {'model_type': 'mlp', 'hidden_dims': '[512, 64]', 'dropout': 0.13147055528744064, 'batch_norm': True, 'lr': 2.766824416601927e-05, 'weight_decay': 0.0009913617141741814, 'epochs': 340, 'loss': 'mse', 'optimizer': 'adam', 'graph_mode': 'off', 'use_snp_selection': True, 'num_snps': 50183}. Best is trial 79 with value: 0.3135874364862798.
[I 2025-12-06 01:17:33,020] Trial 86 finished with value: 0.3116625643143354 and parameters: {'model_type': 'mlp', 'hidden_dims': '[512, 64]', 'dropout': 0.16222264846404896, 'batch_norm': True, 'lr': 2.1731760090904967e-05, 'weight_decay': 0.0009120467529919163, 'epochs': 320, 'loss': 'mse', 'optimizer': 'adam', 'graph_mode': 'off', 'use_snp_selection': True, 'num_snps': 49876}. Best is trial 79 with value: 0.3135874364862798.
[I 2025-12-06 01:18:59,945] Trial 87 finished with value: 0.3034016104864369 and parameters: {'model_type': 'mlp', 'hidden_dims': '[512, 64]', 'dropout': 0.18568594820086315, 'batch_norm': True, 'lr': 8.143539946225385e-06, 'weight_decay': 0.0002560870679648483, 'epochs': 318, 'loss': 'mse', 'optimizer': 'adam', 'graph_mode': 'off', 'use_snp_selection': True, 'num_snps': 55939}. Best is trial 79 with value: 0.3135874364862798.
[I 2025-12-06 01:19:44,434] Trial 88 finished with value: 0.3011573716164473 and parameters: {'model_type': 'mlp', 'hidden_dims': '[128, 64]', 'dropout': 0.15749637709117095, 'batch_norm': True, 'lr': 3.17303928374794e-05, 'weight_decay': 0.00029929349869185984, 'epochs': 338, 'loss': 'mse', 'optimizer': 'adam', 'graph_mode': 'off', 'use_snp_selection': True, 'num_snps': 42202}. Best is trial 79 with value: 0.3135874364862798.
[I 2025-12-06 01:21:03,591] Trial 89 finished with value: 0.31639482456999446 and parameters: {'model_type': 'mlp', 'hidden_dims': '[512, 64]', 'dropout': 0.17517471855715255, 'batch_norm': True, 'lr': 2.1146750778118135e-05, 'weight_decay': 0.000522901466986489, 'epochs': 322, 'loss': 'mse', 'optimizer': 'adam', 'graph_mode': 'off', 'use_snp_selection': True, 'num_snps': 48919}. Best is trial 89 with value: 0.31639482456999446.
[I 2025-12-06 01:22:21,202] Trial 90 finished with value: 0.30544274084208 and parameters: {'model_type': 'mlp', 'hidden_dims': '[512, 256]', 'dropout': 0.14558572079339618, 'batch_norm': True, 'lr': 2.328062737333909e-05, 'weight_decay': 0.0007493845783527236, 'epochs': 324, 'loss': 'mse', 'optimizer': 'adam', 'graph_mode': 'off', 'use_snp_selection': True, 'num_snps': 47031}. Best is trial 89 with value: 0.31639482456999446.
[I 2025-12-06 01:23:44,559] Trial 91 finished with value: 0.3096042767083909 and parameters: {'model_type': 'mlp', 'hidden_dims': '[512, 64]', 'dropout': 0.1630694835214802, 'batch_norm': True, 'lr': 2.2155496272794303e-05, 'weight_decay': 0.0005548485123642181, 'epochs': 314, 'loss': 'mse', 'optimizer': 'adam', 'graph_mode': 'off', 'use_snp_selection': True, 'num_snps': 53573}. Best is trial 89 with value: 0.31639482456999446.
[I 2025-12-06 01:25:06,269] Trial 92 finished with value: 0.3091123761190039 and parameters: {'model_type': 'mlp', 'hidden_dims': '[512, 64]', 'dropout': 0.17732484552464955, 'batch_norm': True, 'lr': 1.4254960216058391e-05, 'weight_decay': 0.00043385288454711804, 'epochs': 350, 'loss': 'mse', 'optimizer': 'adam', 'graph_mode': 'off', 'use_snp_selection': True, 'num_snps': 48120}. Best is trial 89 with value: 0.31639482456999446.
[I 2025-12-06 01:26:29,315] Trial 93 finished with value: 0.31231465224017974 and parameters: {'model_type': 'mlp', 'hidden_dims': '[512, 64]', 'dropout': 0.19286928514995233, 'batch_norm': True, 'lr': 1.5834644265842432e-05, 'weight_decay': 0.0003626013950687094, 'epochs': 302, 'loss': 'mse', 'optimizer': 'adam', 'graph_mode': 'off', 'use_snp_selection': True, 'num_snps': 55162}. Best is trial 89 with value: 0.31639482456999446.
[I 2025-12-06 01:27:56,187] Trial 94 finished with value: 0.3039567447675262 and parameters: {'model_type': 'mlp', 'hidden_dims': '[512, 64]', 'dropout': 0.19111660004587916, 'batch_norm': True, 'lr': 1.5877344787400993e-05, 'weight_decay': 0.00034325885670274855, 'epochs': 328, 'loss': 'mse', 'optimizer': 'adam', 'graph_mode': 'off', 'use_snp_selection': True, 'num_snps': 54731}. Best is trial 89 with value: 0.31639482456999446.
[I 2025-12-06 01:29:06,219] Trial 95 finished with value: 0.3034104348008731 and parameters: {'model_type': 'mlp', 'hidden_dims': '[512, 64]', 'dropout': 0.12875186159597923, 'batch_norm': True, 'lr': 9.29871309417453e-06, 'weight_decay': 0.0008809881335349195, 'epochs': 300, 'loss': 'mse', 'optimizer': 'adam', 'graph_mode': 'off', 'use_snp_selection': True, 'num_snps': 43357}. Best is trial 89 with value: 0.31639482456999446.
[I 2025-12-06 01:29:54,278] Trial 96 finished with value: 0.30384118280469724 and parameters: {'model_type': 'mlp', 'hidden_dims': '[128, 64]', 'dropout': 0.595302324756317, 'batch_norm': True, 'lr': 3.7386207626055784e-05, 'weight_decay': 0.0002107153797807771, 'epochs': 337, 'loss': 'mse', 'optimizer': 'adam', 'graph_mode': 'off', 'use_snp_selection': True, 'num_snps': 49685}. Best is trial 89 with value: 0.31639482456999446.
[I 2025-12-06 01:31:21,368] Trial 97 finished with value: 0.3084898292899596 and parameters: {'model_type': 'mlp', 'hidden_dims': '[512, 256]', 'dropout': 0.20536290309752953, 'batch_norm': True, 'lr': 3.072801861405374e-05, 'weight_decay': 0.0006579168034422379, 'epochs': 323, 'loss': 'mae', 'optimizer': 'adam', 'graph_mode': 'off', 'use_snp_selection': True, 'num_snps': 55416}. Best is trial 89 with value: 0.31639482456999446.
[I 2025-12-06 01:32:34,829] Trial 98 finished with value: 0.3036848493467813 and parameters: {'model_type': 'mlp', 'hidden_dims': '[512, 64]', 'dropout': 0.5404180617065732, 'batch_norm': True, 'lr': 5.164882678136697e-05, 'weight_decay': 0.0004954803387786745, 'epochs': 315, 'loss': 'mse', 'optimizer': 'adam', 'graph_mode': 'off', 'use_snp_selection': True, 'num_snps': 44969}. Best is trial 89 with value: 0.31639482456999446.
[I 2025-12-06 01:33:32,790] Trial 99 finished with value: 0.3022708399518372 and parameters: {'model_type': 'mlp', 'hidden_dims': '[256, 128]', 'dropout': 0.1086178743865199, 'batch_norm': False, 'lr': 1.640872427701215e-05, 'weight_decay': 0.0003383581678115623, 'epochs': 332, 'loss': 'mse', 'optimizer': 'adam', 'graph_mode': 'off', 'use_snp_selection': True, 'num_snps': 49691}. Best is trial 89 with value: 0.31639482456999446.
[I 2025-12-06 01:34:41,361] Trial 100 finished with value: 0.30902979349929655 and parameters: {'model_type': 'mlp', 'hidden_dims': '[512, 64]', 'dropout': 0.2279731296336048, 'batch_norm': True, 'lr': 1.2178165153988188e-05, 'weight_decay': 0.0001597671509161208, 'epochs': 342, 'loss': 'mae', 'optimizer': 'adam', 'graph_mode': 'off', 'use_snp_selection': True, 'num_snps': 38597}. Best is trial 89 with value: 0.31639482456999446.
[I 2025-12-06 01:36:09,199] Trial 101 finished with value: 0.3099089851292184 and parameters: {'model_type': 'mlp', 'hidden_dims': '[512, 64]', 'dropout': 0.1685799025457665, 'batch_norm': True, 'lr': 4.3814489796261686e-05, 'weight_decay': 9.183798719158688e-05, 'epochs': 300, 'loss': 'mse', 'optimizer': 'adam', 'graph_mode': 'off', 'use_snp_selection': True, 'num_snps': 59134}. Best is trial 89 with value: 0.31639482456999446.
[I 2025-12-06 01:37:30,770] Trial 102 finished with value: 0.30966493059356826 and parameters: {'model_type': 'mlp', 'hidden_dims': '[512, 64]', 'dropout': 0.14540604062835372, 'batch_norm': True, 'lr': 1.9391886958713304e-05, 'weight_decay': 0.0005776059385795731, 'epochs': 281, 'loss': 'mse', 'optimizer': 'adam', 'graph_mode': 'off', 'use_snp_selection': True, 'num_snps': 56466}. Best is trial 89 with value: 0.31639482456999446.
[I 2025-12-06 01:38:51,939] Trial 103 finished with value: 0.3120734082044901 and parameters: {'model_type': 'mlp', 'hidden_dims': '[512, 64]', 'dropout': 0.1762593061351614, 'batch_norm': True, 'lr': 3.3121647017924735e-05, 'weight_decay': 4.9704125987538385e-05, 'epochs': 309, 'loss': 'mse', 'optimizer': 'adam', 'graph_mode': 'off', 'use_snp_selection': True, 'num_snps': 52314}. Best is trial 89 with value: 0.31639482456999446.
[I 2025-12-06 01:40:13,700] Trial 104 finished with value: 0.3062916563630388 and parameters: {'model_type': 'mlp', 'hidden_dims': '[512, 64]', 'dropout': 0.3606290670680668, 'batch_norm': True, 'lr': 3.0604182550903674e-05, 'weight_decay': 5.1664381671567776e-05, 'epochs': 309, 'loss': 'mse', 'optimizer': 'adam', 'graph_mode': 'off', 'use_snp_selection': True, 'num_snps': 52686}. Best is trial 89 with value: 0.31639482456999446.
[I 2025-12-06 01:41:00,770] Trial 105 finished with value: 0.3030275890367355 and parameters: {'model_type': 'mlp', 'hidden_dims': '[128, 64]', 'dropout': 0.17701026294505684, 'batch_norm': True, 'lr': 2.1269691762298847e-05, 'weight_decay': 3.112591216059692e-05, 'epochs': 321, 'loss': 'mse', 'optimizer': 'adam', 'graph_mode': 'off', 'use_snp_selection': True, 'num_snps': 49402}. Best is trial 89 with value: 0.31639482456999446.
[I 2025-12-06 01:42:00,911] Trial 106 finished with value: 0.30488977246781224 and parameters: {'model_type': 'mlp', 'hidden_dims': '[512, 256]', 'dropout': 0.12720736485587222, 'batch_norm': True, 'lr': 3.400486232086861e-05, 'weight_decay': 0.0002376220368045483, 'epochs': 206, 'loss': 'mse', 'optimizer': 'adam', 'graph_mode': 'off', 'use_snp_selection': True, 'num_snps': 45122}. Best is trial 89 with value: 0.31639482456999446.
[I 2025-12-06 01:43:28,263] Trial 107 finished with value: 0.3005224634816919 and parameters: {'model_type': 'mlp', 'hidden_dims': '[512, 64]', 'dropout': 0.19217739452497984, 'batch_norm': True, 'lr': 6.6636976514868715e-06, 'weight_decay': 6.75661326410344e-05, 'epochs': 318, 'loss': 'mse', 'optimizer': 'adam', 'graph_mode': 'off', 'use_snp_selection': True, 'num_snps': 56404}. Best is trial 89 with value: 0.31639482456999446.
[I 2025-12-06 01:44:48,127] Trial 108 finished with value: 0.30658056405122364 and parameters: {'model_type': 'mlp', 'hidden_dims': '[512, 64]', 'dropout': 0.42357355341394726, 'batch_norm': True, 'lr': 2.5704604014699165e-05, 'weight_decay': 1.3063318121146415e-05, 'epochs': 302, 'loss': 'mae', 'optimizer': 'adam', 'graph_mode': 'off', 'use_snp_selection': True, 'num_snps': 51878}. Best is trial 89 with value: 0.31639482456999446.
[I 2025-12-06 01:45:40,753] Trial 109 finished with value: 0.29677333324084315 and parameters: {'model_type': 'mlp', 'hidden_dims': '[128, 64]', 'dropout': 0.10044778042545084, 'batch_norm': True, 'lr': 1.5768732556798935e-05, 'weight_decay': 0.0007963651412627655, 'epochs': 334, 'loss': 'mse', 'optimizer': 'adam', 'graph_mode': 'off', 'use_snp_selection': True, 'num_snps': 59858}. Best is trial 89 with value: 0.31639482456999446.
[I 2025-12-06 01:46:47,922] Trial 110 finished with value: 0.31567328967149494 and parameters: {'model_type': 'mlp', 'hidden_dims': '[512, 256]', 'dropout': 0.20984704546730673, 'batch_norm': True, 'lr': 4.2232712144227226e-05, 'weight_decay': 0.00041934420261790026, 'epochs': 254, 'loss': 'mse', 'optimizer': 'adam', 'graph_mode': 'off', 'use_snp_selection': True, 'num_snps': 46553}. Best is trial 89 with value: 0.31639482456999446.
[I 2025-12-06 01:47:58,703] Trial 111 finished with value: 0.31003378881461263 and parameters: {'model_type': 'mlp', 'hidden_dims': '[512, 256]', 'dropout': 0.22176157642110914, 'batch_norm': True, 'lr': 3.946488612932949e-05, 'weight_decay': 0.0003914307085600378, 'epochs': 268, 'loss': 'mse', 'optimizer': 'adam', 'graph_mode': 'off', 'use_snp_selection': True, 'num_snps': 47869}. Best is trial 89 with value: 0.31639482456999446.
[I 2025-12-06 01:49:00,469] Trial 112 finished with value: 0.30815535610958145 and parameters: {'model_type': 'mlp', 'hidden_dims': '[512, 256]', 'dropout': 0.21079590456050032, 'batch_norm': True, 'lr': 0.0001531367617126294, 'weight_decay': 1.5910411166352005e-05, 'epochs': 256, 'loss': 'mse', 'optimizer': 'adam', 'graph_mode': 'off', 'use_snp_selection': True, 'num_snps': 39979}. Best is trial 89 with value: 0.31639482456999446.
[I 2025-12-06 01:49:53,706] Trial 113 finished with value: 0.3113829413111534 and parameters: {'model_type': 'mlp', 'hidden_dims': '[512, 256]', 'dropout': 0.15354800962558146, 'batch_norm': True, 'lr': 4.480619545187385e-05, 'weight_decay': 0.0004646229795635462, 'epochs': 222, 'loss': 'mse', 'optimizer': 'adam', 'graph_mode': 'off', 'use_snp_selection': True, 'num_snps': 35495}. Best is trial 89 with value: 0.31639482456999446.
[I 2025-12-06 01:50:55,050] Trial 114 finished with value: 0.308634333430929 and parameters: {'model_type': 'mlp', 'hidden_dims': '[512, 256]', 'dropout': 0.15437053482446475, 'batch_norm': True, 'lr': 4.6855311200649896e-05, 'weight_decay': 0.00029199054651602043, 'epochs': 228, 'loss': 'mse', 'optimizer': 'adam', 'graph_mode': 'off', 'use_snp_selection': True, 'num_snps': 43728}. Best is trial 89 with value: 0.31639482456999446.
[I 2025-12-06 01:51:40,125] Trial 115 finished with value: 0.3046585788564958 and parameters: {'model_type': 'mlp', 'hidden_dims': '[512, 64]', 'dropout': 0.1790302583685818, 'batch_norm': True, 'lr': 3.866952484391442e-05, 'weight_decay': 0.0004706816116120894, 'epochs': 219, 'loss': 'mse', 'optimizer': 'adam', 'graph_mode': 'off', 'use_snp_selection': True, 'num_snps': 27354}. Best is trial 89 with value: 0.31639482456999446.
[I 2025-12-06 01:52:37,542] Trial 116 finished with value: 0.30965934414812 and parameters: {'model_type': 'mlp', 'hidden_dims': '[512, 256]', 'dropout': 0.11802700969184304, 'batch_norm': True, 'lr': 5.840345439442498e-05, 'weight_decay': 0.0006624149841381332, 'epochs': 246, 'loss': 'mse', 'optimizer': 'adam', 'graph_mode': 'off', 'use_snp_selection': True, 'num_snps': 36731}. Best is trial 89 with value: 0.31639482456999446.
[I 2025-12-06 01:53:37,757] Trial 117 finished with value: 0.306589892164276 and parameters: {'model_type': 'mlp', 'hidden_dims': '[512, 64]', 'dropout': 0.19592889468429617, 'batch_norm': True, 'lr': 5.195624862796655e-05, 'weight_decay': 0.0009123963149250768, 'epochs': 310, 'loss': 'mae', 'optimizer': 'adam', 'graph_mode': 'off', 'use_snp_selection': True, 'num_snps': 34322}. Best is trial 89 with value: 0.31639482456999446.
[I 2025-12-06 01:54:01,638] Trial 118 finished with value: 0.2754013180877111 and parameters: {'model_type': 'mlp', 'hidden_dims': '[128, 64]', 'dropout': 0.13928442964345678, 'batch_norm': True, 'lr': 2.7997014581431643e-05, 'weight_decay': 0.0005283066754265778, 'epochs': 119, 'loss': 'mse', 'optimizer': 'adam', 'graph_mode': 'off', 'use_snp_selection': True, 'num_snps': 7578}. Best is trial 89 with value: 0.31639482456999446.
[I 2025-12-06 01:55:04,648] Trial 119 finished with value: 0.29590559734095534 and parameters: {'model_type': 'mlp', 'hidden_dims': '[512, 64]', 'dropout': 0.2349544515222456, 'batch_norm': False, 'lr': 1.772043610670584e-05, 'weight_decay': 0.0001626169474467017, 'epochs': 344, 'loss': 'mse', 'optimizer': 'adam', 'graph_mode': 'off', 'use_snp_selection': True, 'num_snps': 33639}. Best is trial 89 with value: 0.31639482456999446.
[I 2025-12-06 01:55:57,192] Trial 120 finished with value: 0.31379976933325515 and parameters: {'model_type': 'mlp', 'hidden_dims': '[256, 128]', 'dropout': 0.16119578942567486, 'batch_norm': True, 'lr': 7.821855981679102e-05, 'weight_decay': 0.0007344300027660513, 'epochs': 236, 'loss': 'mse', 'optimizer': 'adam', 'graph_mode': 'off', 'use_snp_selection': True, 'num_snps': 51249}. Best is trial 89 with value: 0.31639482456999446.
[I 2025-12-06 01:56:50,067] Trial 121 finished with value: 0.307889940748743 and parameters: {'model_type': 'mlp', 'hidden_dims': '[256, 128]', 'dropout': 0.1505320624284878, 'batch_norm': True, 'lr': 7.772721179099319e-05, 'weight_decay': 0.0003792774277736317, 'epochs': 223, 'loss': 'mse', 'optimizer': 'adam', 'graph_mode': 'off', 'use_snp_selection': True, 'num_snps': 53555}. Best is trial 89 with value: 0.31639482456999446.
[I 2025-12-06 01:57:42,872] Trial 122 finished with value: 0.3088522471169993 and parameters: {'model_type': 'mlp', 'hidden_dims': '[256, 128]', 'dropout': 0.1602032888070988, 'batch_norm': True, 'lr': 9.107366770458344e-05, 'weight_decay': 0.0007575951044125803, 'epochs': 236, 'loss': 'mse', 'optimizer': 'adam', 'graph_mode': 'off', 'use_snp_selection': True, 'num_snps': 51617}. Best is trial 89 with value: 0.31639482456999446.
[I 2025-12-06 01:58:32,187] Trial 123 finished with value: 0.29848509222817693 and parameters: {'model_type': 'mlp', 'hidden_dims': '[256, 128]', 'dropout': 0.1865140786969978, 'batch_norm': True, 'lr': 2.3071609470423182e-05, 'weight_decay': 0.0004505913337379889, 'epochs': 196, 'loss': 'mse', 'optimizer': 'adam', 'graph_mode': 'off', 'use_snp_selection': True, 'num_snps': 50545}. Best is trial 89 with value: 0.31639482456999446.
[I 2025-12-06 01:59:28,384] Trial 124 finished with value: 0.3021737947872364 and parameters: {'model_type': 'mlp', 'hidden_dims': '[256, 128]', 'dropout': 0.12595537902013387, 'batch_norm': True, 'lr': 3.513408254861846e-05, 'weight_decay': 0.0009961103291683663, 'epochs': 233, 'loss': 'mse', 'optimizer': 'adam', 'graph_mode': 'off', 'use_snp_selection': True, 'num_snps': 57310}. Best is trial 89 with value: 0.31639482456999446.
