Running from this directory: /cluster/work/simennes/Project_thesis/Project_thesis
Name of job: mlp_t_within
ID of job: 23690638
The job was run on these nodes: idun-07-05
[I 2025-12-05 14:53:32,036] Trial 0 finished with value: 0.29967427608447456 and parameters: {'model_type': 'mlp', 'hidden_dims': '[128, 64]', 'dropout': 0.199031432379812, 'batch_norm': True, 'lr': 1.8408544111075837e-06, 'weight_decay': 5.5136510071208614e-05, 'epochs': 336, 'loss': 'mae', 'optimizer': 'adam', 'graph_mode': 'off', 'use_snp_selection': True, 'num_snps': 43862}. Best is trial 0 with value: 0.29967427608447456.
[I 2025-12-05 14:54:00,703] Trial 1 finished with value: 0.32745784711326903 and parameters: {'model_type': 'mlp', 'hidden_dims': '[256, 128]', 'dropout': 0.4370668075331726, 'batch_norm': True, 'lr': 7.133471581159139e-05, 'weight_decay': 1.128633586803549e-05, 'epochs': 242, 'loss': 'mae', 'optimizer': 'adam', 'graph_mode': 'off', 'use_snp_selection': False}. Best is trial 1 with value: 0.32745784711326903.
[I 2025-12-05 14:54:28,432] Trial 2 finished with value: 0.3232413485735592 and parameters: {'model_type': 'mlp', 'hidden_dims': '[256, 128, 64]', 'dropout': 0.41314357415569625, 'batch_norm': False, 'lr': 3.952233718592101e-06, 'weight_decay': 0.00026754769258252603, 'epochs': 149, 'loss': 'mse', 'optimizer': 'adam', 'graph_mode': 'off', 'use_snp_selection': True, 'num_snps': 11571}. Best is trial 1 with value: 0.32745784711326903.
[I 2025-12-05 14:55:34,639] Trial 3 finished with value: 0.35641038245627704 and parameters: {'model_type': 'mlp', 'hidden_dims': '[512, 64]', 'dropout': 0.5938127374509361, 'batch_norm': False, 'lr': 5.67704586114731e-06, 'weight_decay': 2.4518087630137052e-05, 'epochs': 320, 'loss': 'mae', 'optimizer': 'adam', 'graph_mode': 'off', 'use_snp_selection': False}. Best is trial 3 with value: 0.35641038245627704.
[I 2025-12-05 14:56:39,492] Trial 4 finished with value: 0.29192475615000346 and parameters: {'model_type': 'mlp', 'hidden_dims': '[512, 128]', 'dropout': 0.25746343592134413, 'batch_norm': True, 'lr': 1.3467657668402788e-06, 'weight_decay': 0.00033087251918647806, 'epochs': 277, 'loss': 'mse', 'optimizer': 'adam', 'graph_mode': 'off', 'use_snp_selection': True, 'num_snps': 36675}. Best is trial 3 with value: 0.35641038245627704.
[I 2025-12-05 14:57:24,859] Trial 5 finished with value: 0.2953589073041915 and parameters: {'model_type': 'mlp', 'hidden_dims': '[512, 64]', 'dropout': 0.38275350994408375, 'batch_norm': True, 'lr': 1.5586664309232824e-06, 'weight_decay': 0.0008227664668621182, 'epochs': 145, 'loss': 'mae', 'optimizer': 'adam', 'graph_mode': 'off', 'use_snp_selection': True, 'num_snps': 32148}. Best is trial 3 with value: 0.35641038245627704.
[I 2025-12-05 14:57:48,672] Trial 6 finished with value: 0.33557196045657156 and parameters: {'model_type': 'mlp', 'hidden_dims': '[256, 128]', 'dropout': 0.3930109900265879, 'batch_norm': False, 'lr': 4.892964372128395e-05, 'weight_decay': 1.5809549317992182e-06, 'epochs': 199, 'loss': 'mse', 'optimizer': 'adam', 'graph_mode': 'off', 'use_snp_selection': False}. Best is trial 3 with value: 0.35641038245627704.
[I 2025-12-05 14:58:12,548] Trial 7 finished with value: 0.3334245124478297 and parameters: {'model_type': 'mlp', 'hidden_dims': '[512, 256]', 'dropout': 0.15343979219678458, 'batch_norm': True, 'lr': 6.234003099047341e-05, 'weight_decay': 3.894760610535477e-07, 'epochs': 97, 'loss': 'mse', 'optimizer': 'adam', 'graph_mode': 'off', 'use_snp_selection': False}. Best is trial 3 with value: 0.35641038245627704.
[I 2025-12-05 14:59:18,125] Trial 8 finished with value: 0.33479099810077695 and parameters: {'model_type': 'mlp', 'hidden_dims': '[512, 128]', 'dropout': 0.10743001231661406, 'batch_norm': True, 'lr': 0.00023728538449271062, 'weight_decay': 1.7629071578048637e-05, 'epochs': 312, 'loss': 'mae', 'optimizer': 'adam', 'graph_mode': 'off', 'use_snp_selection': False}. Best is trial 3 with value: 0.35641038245627704.
[I 2025-12-05 14:59:57,361] Trial 9 finished with value: 0.3359450618070928 and parameters: {'model_type': 'mlp', 'hidden_dims': '[512, 64]', 'dropout': 0.14505336736221927, 'batch_norm': True, 'lr': 5.8619638388111826e-05, 'weight_decay': 6.200156172669308e-07, 'epochs': 175, 'loss': 'mse', 'optimizer': 'adam', 'graph_mode': 'off', 'use_snp_selection': False}. Best is trial 3 with value: 0.35641038245627704.
[I 2025-12-05 15:00:13,250] Trial 10 finished with value: 0.34178473927526987 and parameters: {'model_type': 'mlp', 'hidden_dims': '[512, 64]', 'dropout': 0.5885461262002587, 'batch_norm': False, 'lr': 8.769366258768696e-06, 'weight_decay': 2.78273193871783e-06, 'epochs': 55, 'loss': 'mae', 'optimizer': 'adam', 'graph_mode': 'off', 'use_snp_selection': False}. Best is trial 3 with value: 0.35641038245627704.
[I 2025-12-05 15:00:33,297] Trial 11 finished with value: 0.3526179188806232 and parameters: {'model_type': 'mlp', 'hidden_dims': '[512, 64]', 'dropout': 0.583942291816117, 'batch_norm': False, 'lr': 1.1821335968986158e-05, 'weight_decay': 4.061640528568547e-06, 'epochs': 77, 'loss': 'mae', 'optimizer': 'adam', 'graph_mode': 'off', 'use_snp_selection': False}. Best is trial 3 with value: 0.35641038245627704.
[I 2025-12-05 15:00:46,209] Trial 12 finished with value: 0.3206397138928296 and parameters: {'model_type': 'mlp', 'hidden_dims': '[512, 64]', 'dropout': 0.593097749012682, 'batch_norm': False, 'lr': 1.2808693622626188e-05, 'weight_decay': 1.3081036432574914e-07, 'epochs': 40, 'loss': 'mae', 'optimizer': 'adam', 'graph_mode': 'off', 'use_snp_selection': False}. Best is trial 3 with value: 0.35641038245627704.
[I 2025-12-05 15:01:36,149] Trial 13 finished with value: 0.35103173441271257 and parameters: {'model_type': 'mlp', 'hidden_dims': '[512, 64]', 'dropout': 0.5043641748401543, 'batch_norm': False, 'lr': 1.3373175420781734e-05, 'weight_decay': 4.373608364627903e-05, 'epochs': 235, 'loss': 'mae', 'optimizer': 'adam', 'graph_mode': 'off', 'use_snp_selection': False}. Best is trial 3 with value: 0.35641038245627704.
[I 2025-12-05 15:01:45,865] Trial 14 finished with value: 0.324185177186464 and parameters: {'model_type': 'mlp', 'hidden_dims': '[128, 64]', 'dropout': 0.5300180653494536, 'batch_norm': False, 'lr': 5.096356034191146e-06, 'weight_decay': 4.57067734295802e-06, 'epochs': 93, 'loss': 'mae', 'optimizer': 'adam', 'graph_mode': 'off', 'use_snp_selection': False}. Best is trial 3 with value: 0.35641038245627704.
[I 2025-12-05 15:02:44,131] Trial 15 finished with value: 0.3390368223098095 and parameters: {'model_type': 'mlp', 'hidden_dims': '[512, 256]', 'dropout': 0.29817671914947536, 'batch_norm': False, 'lr': 1.8411764708572348e-05, 'weight_decay': 4.4084956876871386e-05, 'epochs': 278, 'loss': 'mae', 'optimizer': 'adam', 'graph_mode': 'off', 'use_snp_selection': False}. Best is trial 3 with value: 0.35641038245627704.
[I 2025-12-05 15:03:23,278] Trial 16 finished with value: 0.3071967698835894 and parameters: {'model_type': 'mlp', 'hidden_dims': '[256, 128, 64]', 'dropout': 0.4992385332513618, 'batch_norm': False, 'lr': 0.00017549215405955411, 'weight_decay': 6.80662468241148e-06, 'epochs': 350, 'loss': 'mae', 'optimizer': 'adam', 'graph_mode': 'off', 'use_snp_selection': False}. Best is trial 3 with value: 0.35641038245627704.
[I 2025-12-05 15:03:49,741] Trial 17 finished with value: 0.05680493407701541 and parameters: {'model_type': 'mlp', 'hidden_dims': '[512, 64]', 'dropout': 0.543474321376226, 'batch_norm': False, 'lr': 0.000906375209920231, 'weight_decay': 1.3398043894594233e-06, 'epochs': 113, 'loss': 'mae', 'optimizer': 'adam', 'graph_mode': 'off', 'use_snp_selection': False}. Best is trial 3 with value: 0.35641038245627704.
[I 2025-12-05 15:05:06,688] Trial 18 finished with value: 0.35651601411128386 and parameters: {'model_type': 'mlp', 'hidden_dims': '[512, 64]', 'dropout': 0.4928065509878574, 'batch_norm': False, 'lr': 3.4071412855829388e-06, 'weight_decay': 0.00012275232383599145, 'epochs': 214, 'loss': 'mae', 'optimizer': 'adam', 'graph_mode': 'off', 'use_snp_selection': True, 'num_snps': 58241}. Best is trial 18 with value: 0.35651601411128386.
[I 2025-12-05 15:06:22,521] Trial 19 finished with value: 0.36107742617328265 and parameters: {'model_type': 'mlp', 'hidden_dims': '[512, 64]', 'dropout': 0.47355279224247543, 'batch_norm': False, 'lr': 3.558104577254903e-06, 'weight_decay': 0.00015299712892081902, 'epochs': 220, 'loss': 'mae', 'optimizer': 'adam', 'graph_mode': 'off', 'use_snp_selection': True, 'num_snps': 55667}. Best is trial 19 with value: 0.36107742617328265.
[I 2025-12-05 15:07:39,069] Trial 20 finished with value: 0.3627475757172986 and parameters: {'model_type': 'mlp', 'hidden_dims': '[512, 256]', 'dropout': 0.46391462058771593, 'batch_norm': False, 'lr': 3.1049631454950547e-06, 'weight_decay': 0.00011680988616781171, 'epochs': 214, 'loss': 'mae', 'optimizer': 'adam', 'graph_mode': 'off', 'use_snp_selection': True, 'num_snps': 57703}. Best is trial 20 with value: 0.3627475757172986.
[I 2025-12-05 15:08:56,657] Trial 21 finished with value: 0.3557599561608554 and parameters: {'model_type': 'mlp', 'hidden_dims': '[512, 256]', 'dropout': 0.45728803408735136, 'batch_norm': False, 'lr': 2.816920219307211e-06, 'weight_decay': 0.00011727750911803841, 'epochs': 207, 'loss': 'mae', 'optimizer': 'adam', 'graph_mode': 'off', 'use_snp_selection': True, 'num_snps': 59845}. Best is trial 20 with value: 0.3627475757172986.
[I 2025-12-05 15:10:19,798] Trial 22 finished with value: 0.3555911500675648 and parameters: {'model_type': 'mlp', 'hidden_dims': '[512, 256]', 'dropout': 0.47274978918395516, 'batch_norm': False, 'lr': 2.6889069409509283e-06, 'weight_decay': 0.00014101501337988537, 'epochs': 238, 'loss': 'mae', 'optimizer': 'adam', 'graph_mode': 'off', 'use_snp_selection': True, 'num_snps': 59575}. Best is trial 20 with value: 0.3627475757172986.
[I 2025-12-05 15:11:23,157] Trial 23 finished with value: 0.3512060117898107 and parameters: {'model_type': 'mlp', 'hidden_dims': '[512, 256]', 'dropout': 0.3298626235508495, 'batch_norm': False, 'lr': 1.1296015804813762e-06, 'weight_decay': 0.0007343691646711491, 'epochs': 163, 'loss': 'mae', 'optimizer': 'adam', 'graph_mode': 'off', 'use_snp_selection': True, 'num_snps': 51866}. Best is trial 20 with value: 0.3627475757172986.
[I 2025-12-05 15:12:17,148] Trial 24 finished with value: 0.36004077808206497 and parameters: {'model_type': 'mlp', 'hidden_dims': '[256, 128, 64]', 'dropout': 0.36580162833925, 'batch_norm': False, 'lr': 5.336969841297362e-06, 'weight_decay': 0.0001277363850102306, 'epochs': 220, 'loss': 'mae', 'optimizer': 'adam', 'graph_mode': 'off', 'use_snp_selection': True, 'num_snps': 51470}. Best is trial 20 with value: 0.3627475757172986.
[I 2025-12-05 15:13:12,808] Trial 25 finished with value: 0.33528224995201844 and parameters: {'model_type': 'mlp', 'hidden_dims': '[256, 128, 64]', 'dropout': 0.3499866106328588, 'batch_norm': False, 'lr': 2.4666823722440993e-05, 'weight_decay': 0.00040298260349232927, 'epochs': 266, 'loss': 'mae', 'optimizer': 'adam', 'graph_mode': 'off', 'use_snp_selection': True, 'num_snps': 48648}. Best is trial 20 with value: 0.3627475757172986.
[I 2025-12-05 15:13:45,420] Trial 26 finished with value: 0.3576911509813428 and parameters: {'model_type': 'mlp', 'hidden_dims': '[256, 128, 64]', 'dropout': 0.42467953626996324, 'batch_norm': False, 'lr': 6.479391048926181e-06, 'weight_decay': 9.010563435702839e-05, 'epochs': 184, 'loss': 'mae', 'optimizer': 'adam', 'graph_mode': 'off', 'use_snp_selection': True, 'num_snps': 18869}. Best is trial 20 with value: 0.3627475757172986.
[I 2025-12-05 15:14:34,625] Trial 27 finished with value: 0.3511051637089957 and parameters: {'model_type': 'mlp', 'hidden_dims': '[256, 128, 64]', 'dropout': 0.28696054945166094, 'batch_norm': False, 'lr': 7.439579449679153e-06, 'weight_decay': 0.000226171576260825, 'epochs': 222, 'loss': 'mse', 'optimizer': 'adam', 'graph_mode': 'off', 'use_snp_selection': True, 'num_snps': 43718}. Best is trial 20 with value: 0.3627475757172986.
[I 2025-12-05 15:15:22,686] Trial 28 finished with value: 0.35116241295216094 and parameters: {'model_type': 'mlp', 'hidden_dims': '[128, 64]', 'dropout': 0.37930106552011633, 'batch_norm': False, 'lr': 2.1282520157821237e-06, 'weight_decay': 2.275381775627875e-05, 'epochs': 263, 'loss': 'mae', 'optimizer': 'adam', 'graph_mode': 'off', 'use_snp_selection': True, 'num_snps': 53686}. Best is trial 20 with value: 0.3627475757172986.
[I 2025-12-05 15:16:36,065] Trial 29 finished with value: 0.35524222715092846 and parameters: {'model_type': 'mlp', 'hidden_dims': '[512, 128]', 'dropout': 0.2523135802350327, 'batch_norm': False, 'lr': 1.9806618388108716e-06, 'weight_decay': 6.608254868700244e-05, 'epochs': 298, 'loss': 'mae', 'optimizer': 'adam', 'graph_mode': 'off', 'use_snp_selection': True, 'num_snps': 43099}. Best is trial 20 with value: 0.3627475757172986.
[I 2025-12-05 15:17:11,014] Trial 30 finished with value: 0.30254716839686907 and parameters: {'model_type': 'mlp', 'hidden_dims': '[256, 128]', 'dropout': 0.4618750105267364, 'batch_norm': False, 'lr': 1.0088774274333405e-06, 'weight_decay': 0.000544402093854219, 'epochs': 191, 'loss': 'mae', 'optimizer': 'adam', 'graph_mode': 'off', 'use_snp_selection': True, 'num_snps': 22865}. Best is trial 20 with value: 0.3627475757172986.
[I 2025-12-05 15:17:45,036] Trial 31 finished with value: 0.3483162153890522 and parameters: {'model_type': 'mlp', 'hidden_dims': '[256, 128, 64]', 'dropout': 0.43340501854500346, 'batch_norm': False, 'lr': 4.653557055015886e-06, 'weight_decay': 8.341356769285964e-05, 'epochs': 178, 'loss': 'mae', 'optimizer': 'adam', 'graph_mode': 'off', 'use_snp_selection': True, 'num_snps': 21568}. Best is trial 20 with value: 0.3627475757172986.
[I 2025-12-05 15:18:11,064] Trial 32 finished with value: 0.32357089226711533 and parameters: {'model_type': 'mlp', 'hidden_dims': '[256, 128, 64]', 'dropout': 0.4243475464268128, 'batch_norm': False, 'lr': 7.328900489452013e-06, 'weight_decay': 0.000190311214326113, 'epochs': 130, 'loss': 'mae', 'optimizer': 'adam', 'graph_mode': 'off', 'use_snp_selection': True, 'num_snps': 8206}. Best is trial 20 with value: 0.3627475757172986.
[I 2025-12-05 15:18:45,270] Trial 33 finished with value: 0.3263424880627853 and parameters: {'model_type': 'mlp', 'hidden_dims': '[256, 128, 64]', 'dropout': 0.3603644621111452, 'batch_norm': False, 'lr': 3.3649242933410295e-05, 'weight_decay': 4.1444268645087084e-05, 'epochs': 245, 'loss': 'mae', 'optimizer': 'adam', 'graph_mode': 'off', 'use_snp_selection': True, 'num_snps': 18434}. Best is trial 20 with value: 0.3627475757172986.
[I 2025-12-05 15:19:37,631] Trial 34 finished with value: 0.35027925599444976 and parameters: {'model_type': 'mlp', 'hidden_dims': '[256, 128, 64]', 'dropout': 0.4085596320887507, 'batch_norm': False, 'lr': 3.8547338100654114e-06, 'weight_decay': 1.2138736005205209e-05, 'epochs': 189, 'loss': 'mae', 'optimizer': 'adam', 'graph_mode': 'off', 'use_snp_selection': True, 'num_snps': 52138}. Best is trial 20 with value: 0.3627475757172986.
[I 2025-12-05 15:20:10,994] Trial 35 finished with value: 0.3152580079079249 and parameters: {'model_type': 'mlp', 'hidden_dims': '[128, 64]', 'dropout': 0.537686477144288, 'batch_norm': True, 'lr': 6.235183681014386e-06, 'weight_decay': 9.236857740827374e-05, 'epochs': 149, 'loss': 'mae', 'optimizer': 'adam', 'graph_mode': 'off', 'use_snp_selection': True, 'num_snps': 27903}. Best is trial 20 with value: 0.3627475757172986.
[I 2025-12-05 15:20:35,211] Trial 36 finished with value: 0.19454636364500427 and parameters: {'model_type': 'mlp', 'hidden_dims': '[256, 128, 64]', 'dropout': 0.4512985611277336, 'batch_norm': False, 'lr': 1.8730141269409476e-06, 'weight_decay': 0.0002130263691572677, 'epochs': 250, 'loss': 'mse', 'optimizer': 'adam', 'graph_mode': 'off', 'use_snp_selection': True, 'num_snps': 3180}. Best is trial 20 with value: 0.3627475757172986.
[I 2025-12-05 15:21:26,629] Trial 37 finished with value: 0.345350152999873 and parameters: {'model_type': 'mlp', 'hidden_dims': '[256, 128]', 'dropout': 0.32252797385172, 'batch_norm': False, 'lr': 1.8937049655872352e-05, 'weight_decay': 0.00040050397894363327, 'epochs': 220, 'loss': 'mae', 'optimizer': 'adam', 'graph_mode': 'off', 'use_snp_selection': True, 'num_snps': 48285}. Best is trial 20 with value: 0.3627475757172986.
[I 2025-12-05 15:22:18,066] Trial 38 finished with value: 0.3311091777119792 and parameters: {'model_type': 'mlp', 'hidden_dims': '[512, 256]', 'dropout': 0.42234201142828337, 'batch_norm': True, 'lr': 9.719867364863216e-06, 'weight_decay': 3.177131989640226e-05, 'epochs': 167, 'loss': 'mse', 'optimizer': 'adam', 'graph_mode': 'off', 'use_snp_selection': True, 'num_snps': 37183}. Best is trial 20 with value: 0.3627475757172986.
[I 2025-12-05 15:23:29,181] Trial 39 finished with value: 0.35863614365814406 and parameters: {'model_type': 'mlp', 'hidden_dims': '[512, 128]', 'dropout': 0.39692358679586837, 'batch_norm': False, 'lr': 2.9276055419242953e-06, 'weight_decay': 0.0008988558187686705, 'epochs': 202, 'loss': 'mae', 'optimizer': 'adam', 'graph_mode': 'off', 'use_snp_selection': True, 'num_snps': 54666}. Best is trial 20 with value: 0.3627475757172986.
[I 2025-12-05 15:24:44,770] Trial 40 finished with value: 0.31063259335630683 and parameters: {'model_type': 'mlp', 'hidden_dims': '[512, 128]', 'dropout': 0.3851869172951012, 'batch_norm': True, 'lr': 1.5865842133081923e-06, 'weight_decay': 0.0009320472547048893, 'epochs': 230, 'loss': 'mae', 'optimizer': 'adam', 'graph_mode': 'off', 'use_snp_selection': True, 'num_snps': 54096}. Best is trial 20 with value: 0.3627475757172986.
[I 2025-12-05 15:25:59,276] Trial 41 finished with value: 0.36126770227169425 and parameters: {'model_type': 'mlp', 'hidden_dims': '[512, 128]', 'dropout': 0.3590010265407755, 'batch_norm': False, 'lr': 2.903036387614536e-06, 'weight_decay': 0.00028447975620015444, 'epochs': 207, 'loss': 'mae', 'optimizer': 'adam', 'graph_mode': 'off', 'use_snp_selection': True, 'num_snps': 56979}. Best is trial 20 with value: 0.3627475757172986.
[I 2025-12-05 15:27:11,931] Trial 42 finished with value: 0.36431438077416745 and parameters: {'model_type': 'mlp', 'hidden_dims': '[512, 128]', 'dropout': 0.3501526130345813, 'batch_norm': False, 'lr': 2.471558655518794e-06, 'weight_decay': 0.00033792818324245987, 'epochs': 202, 'loss': 'mae', 'optimizer': 'adam', 'graph_mode': 'off', 'use_snp_selection': True, 'num_snps': 55692}. Best is trial 42 with value: 0.36431438077416745.
[I 2025-12-05 15:28:19,290] Trial 43 finished with value: 0.3542511509213454 and parameters: {'model_type': 'mlp', 'hidden_dims': '[512, 128]', 'dropout': 0.223384221753086, 'batch_norm': False, 'lr': 4.142834174925683e-06, 'weight_decay': 0.0003369300897904128, 'epochs': 207, 'loss': 'mae', 'optimizer': 'adam', 'graph_mode': 'off', 'use_snp_selection': True, 'num_snps': 48750}. Best is trial 42 with value: 0.36431438077416745.
[I 2025-12-05 15:29:41,626] Trial 44 finished with value: 0.3618020474425346 and parameters: {'model_type': 'mlp', 'hidden_dims': '[512, 128]', 'dropout': 0.35857363734392605, 'batch_norm': False, 'lr': 2.3804881196576827e-06, 'weight_decay': 0.00017640061823650198, 'epochs': 253, 'loss': 'mae', 'optimizer': 'adam', 'graph_mode': 'off', 'use_snp_selection': True, 'num_snps': 56571}. Best is trial 42 with value: 0.36431438077416745.
[I 2025-12-05 15:31:10,394] Trial 45 finished with value: 0.35635423974569924 and parameters: {'model_type': 'mlp', 'hidden_dims': '[512, 128]', 'dropout': 0.3357743389420439, 'batch_norm': False, 'lr': 2.2723993684212954e-06, 'weight_decay': 0.0005908784658215426, 'epochs': 291, 'loss': 'mse', 'optimizer': 'adam', 'graph_mode': 'off', 'use_snp_selection': True, 'num_snps': 56141}. Best is trial 42 with value: 0.36431438077416745.
[I 2025-12-05 15:32:34,118] Trial 46 finished with value: 0.28871041593912455 and parameters: {'model_type': 'mlp', 'hidden_dims': '[512, 128]', 'dropout': 0.2977547168905944, 'batch_norm': True, 'lr': 1.3376304574590658e-06, 'weight_decay': 0.00028246836796387434, 'epochs': 255, 'loss': 'mae', 'optimizer': 'adam', 'graph_mode': 'off', 'use_snp_selection': True, 'num_snps': 57306}. Best is trial 42 with value: 0.36431438077416745.
[I 2025-12-05 15:33:50,063] Trial 47 finished with value: 0.34963320977211204 and parameters: {'model_type': 'mlp', 'hidden_dims': '[512, 128]', 'dropout': 0.5614755584693105, 'batch_norm': False, 'lr': 1.5059319823934155e-06, 'weight_decay': 0.00018705518232458148, 'epochs': 279, 'loss': 'mae', 'optimizer': 'adam', 'graph_mode': 'off', 'use_snp_selection': True, 'num_snps': 47175}. Best is trial 42 with value: 0.36431438077416745.
[I 2025-12-05 15:34:42,172] Trial 48 finished with value: 0.34252011384276637 and parameters: {'model_type': 'mlp', 'hidden_dims': '[512, 128]', 'dropout': 0.2818979448018076, 'batch_norm': False, 'lr': 0.0001179663501340046, 'weight_decay': 0.00048350463375791263, 'epochs': 153, 'loss': 'mae', 'optimizer': 'adam', 'graph_mode': 'off', 'use_snp_selection': True, 'num_snps': 40596}. Best is trial 42 with value: 0.36431438077416745.
[I 2025-12-05 15:35:54,424] Trial 49 finished with value: 0.36013478466587123 and parameters: {'model_type': 'mlp', 'hidden_dims': '[512, 128]', 'dropout': 0.4814746756171844, 'batch_norm': False, 'lr': 3.755610181848751e-06, 'weight_decay': 5.656681447774059e-05, 'epochs': 197, 'loss': 'mse', 'optimizer': 'adam', 'graph_mode': 'off', 'use_snp_selection': True, 'num_snps': 56143}. Best is trial 42 with value: 0.36431438077416745.
