[I 2025-12-06 14:09:11,515] Trial 77 finished with value: 0.21624848607068592 and parameters: {'model_type': 'mlp', 'hidden_dims': '[512, 64]', 'dropout': 0.3264873702537921, 'batch_norm': True, 'lr': 1.2631476752611598e-05, 'weight_decay': 3.10953080170935e-07, 'epochs': 170, 'loss': 'mse', 'optimizer': 'adam', 'graph_mode': 'off', 'use_snp_selection': True, 'num_snps': 14892}. Best is trial 71 with value: 0.2596386798200256.
[I 2025-12-06 14:09:54,138] Trial 78 finished with value: 0.2518364885329504 and parameters: {'model_type': 'mlp', 'hidden_dims': '[128, 64]', 'dropout': 0.3546858893310117, 'batch_norm': False, 'lr': 4.405340651325044e-05, 'weight_decay': 1.50001944738463e-07, 'epochs': 128, 'loss': 'mse', 'optimizer': 'adam', 'graph_mode': 'off', 'use_snp_selection': True, 'num_snps': 27897}. Best is trial 71 with value: 0.2596386798200256.
[I 2025-12-06 14:10:36,257] Trial 79 finished with value: 0.2420941174538261 and parameters: {'model_type': 'mlp', 'hidden_dims': '[128, 64]', 'dropout': 0.25520686830372225, 'batch_norm': False, 'lr': 4.950410705452676e-05, 'weight_decay': 1.5230310062505523e-07, 'epochs': 133, 'loss': 'mse', 'optimizer': 'adam', 'graph_mode': 'off', 'use_snp_selection': True, 'num_snps': 26693}. Best is trial 71 with value: 0.2596386798200256.
[I 2025-12-06 14:11:22,203] Trial 80 finished with value: 0.23472032527201128 and parameters: {'model_type': 'mlp', 'hidden_dims': '[128, 64]', 'dropout': 0.23750365043359872, 'batch_norm': False, 'lr': 7.872052909369967e-05, 'weight_decay': 3.902279695494201e-07, 'epochs': 197, 'loss': 'mse', 'optimizer': 'adam', 'graph_mode': 'off', 'use_snp_selection': True, 'num_snps': 29929}. Best is trial 71 with value: 0.2596386798200256.
[I 2025-12-06 14:12:02,419] Trial 81 finished with value: 0.22073331589846443 and parameters: {'model_type': 'mlp', 'hidden_dims': '[128, 64]', 'dropout': 0.3564339014132928, 'batch_norm': False, 'lr': 9.027417863350218e-06, 'weight_decay': 2.0669886641683037e-07, 'epochs': 134, 'loss': 'mse', 'optimizer': 'adam', 'graph_mode': 'off', 'use_snp_selection': True, 'num_snps': 21805}. Best is trial 71 with value: 0.2596386798200256.
[I 2025-12-06 14:12:40,415] Trial 82 finished with value: 0.23577078072548785 and parameters: {'model_type': 'mlp', 'hidden_dims': '[128, 64]', 'dropout': 0.30482835309440665, 'batch_norm': False, 'lr': 2.577999869034329e-05, 'weight_decay': 1.0165747253857514e-07, 'epochs': 184, 'loss': 'mse', 'optimizer': 'adam', 'graph_mode': 'off', 'use_snp_selection': True, 'num_snps': 15002}. Best is trial 71 with value: 0.2596386798200256.
[I 2025-12-06 14:13:37,294] Trial 83 finished with value: 0.2429502812684079 and parameters: {'model_type': 'mlp', 'hidden_dims': '[512, 128]', 'dropout': 0.2859113137721294, 'batch_norm': False, 'lr': 3.2726805677289584e-05, 'weight_decay': 1.365446763710599e-07, 'epochs': 205, 'loss': 'mse', 'optimizer': 'adam', 'graph_mode': 'off', 'use_snp_selection': True, 'num_snps': 22711}. Best is trial 71 with value: 0.2596386798200256.
[I 2025-12-06 14:14:34,860] Trial 84 finished with value: 0.2444069797341896 and parameters: {'model_type': 'mlp', 'hidden_dims': '[512, 64]', 'dropout': 0.3408931194150149, 'batch_norm': False, 'lr': 8.17158756376982e-06, 'weight_decay': 2.6205071893481833e-07, 'epochs': 169, 'loss': 'mse', 'optimizer': 'adam', 'graph_mode': 'off', 'use_snp_selection': True, 'num_snps': 27416}. Best is trial 71 with value: 0.2596386798200256.
[I 2025-12-06 14:15:19,277] Trial 85 finished with value: 0.2353037638342252 and parameters: {'model_type': 'mlp', 'hidden_dims': '[256, 128, 64]', 'dropout': 0.3879583387661853, 'batch_norm': False, 'lr': 4.0660611741378637e-05, 'weight_decay': 1.6133072777246717e-07, 'epochs': 219, 'loss': 'mse', 'optimizer': 'adam', 'graph_mode': 'off', 'use_snp_selection': True, 'num_snps': 18220}. Best is trial 71 with value: 0.2596386798200256.
[I 2025-12-06 14:16:14,779] Trial 86 finished with value: 0.24827263670150698 and parameters: {'model_type': 'mlp', 'hidden_dims': '[512, 64]', 'dropout': 0.31805215567309897, 'batch_norm': False, 'lr': 1.3466529215160892e-05, 'weight_decay': 4.860359695325071e-07, 'epochs': 191, 'loss': 'mse', 'optimizer': 'adam', 'graph_mode': 'off', 'use_snp_selection': True, 'num_snps': 23125}. Best is trial 71 with value: 0.2596386798200256.
[I 2025-12-06 14:17:07,572] Trial 87 finished with value: 0.23469036521543404 and parameters: {'model_type': 'mlp', 'hidden_dims': '[512, 64]', 'dropout': 0.3699699549926953, 'batch_norm': False, 'lr': 1.0566967116746967e-05, 'weight_decay': 3.631784470741836e-07, 'epochs': 95, 'loss': 'mse', 'optimizer': 'adam', 'graph_mode': 'off', 'use_snp_selection': True, 'num_snps': 31839}. Best is trial 71 with value: 0.2596386798200256.
[I 2025-12-06 14:17:53,275] Trial 88 finished with value: 0.2101664163014422 and parameters: {'model_type': 'mlp', 'hidden_dims': '[512, 64]', 'dropout': 0.14463643572612367, 'batch_norm': True, 'lr': 1.8008917592073075e-05, 'weight_decay': 2.565237467492318e-07, 'epochs': 177, 'loss': 'mse', 'optimizer': 'adam', 'graph_mode': 'off', 'use_snp_selection': True, 'num_snps': 15052}. Best is trial 71 with value: 0.2596386798200256.
[I 2025-12-06 14:18:36,264] Trial 89 finished with value: 0.24501219899461318 and parameters: {'model_type': 'mlp', 'hidden_dims': '[128, 64]', 'dropout': 0.410222198371866, 'batch_norm': False, 'lr': 0.000776848624444474, 'weight_decay': 1.8604725929669186e-07, 'epochs': 155, 'loss': 'mse', 'optimizer': 'adam', 'graph_mode': 'off', 'use_snp_selection': True, 'num_snps': 27170}. Best is trial 71 with value: 0.2596386798200256.
[I 2025-12-06 14:19:30,465] Trial 90 finished with value: 0.2385622300278485 and parameters: {'model_type': 'mlp', 'hidden_dims': '[512, 64]', 'dropout': 0.3322943751141632, 'batch_norm': False, 'lr': 2.3594897387432882e-05, 'weight_decay': 1.165853747837954e-07, 'epochs': 214, 'loss': 'mse', 'optimizer': 'adam', 'graph_mode': 'off', 'use_snp_selection': True, 'num_snps': 20718}. Best is trial 71 with value: 0.2596386798200256.
[I 2025-12-06 14:20:28,430] Trial 91 finished with value: 0.24084021908454306 and parameters: {'model_type': 'mlp', 'hidden_dims': '[512, 64]', 'dropout': 0.35016030421571026, 'batch_norm': False, 'lr': 1.808462837899563e-05, 'weight_decay': 1.9035778930829865e-07, 'epochs': 191, 'loss': 'mse', 'optimizer': 'adam', 'graph_mode': 'off', 'use_snp_selection': True, 'num_snps': 25540}. Best is trial 71 with value: 0.2596386798200256.
[I 2025-12-06 14:21:31,726] Trial 92 finished with value: 0.24011845704786836 and parameters: {'model_type': 'mlp', 'hidden_dims': '[512, 64]', 'dropout': 0.31463621044175766, 'batch_norm': False, 'lr': 1.972518411491164e-05, 'weight_decay': 2.37665478358573e-07, 'epochs': 199, 'loss': 'mse', 'optimizer': 'adam', 'graph_mode': 'off', 'use_snp_selection': True, 'num_snps': 29537}. Best is trial 71 with value: 0.2596386798200256.
[I 2025-12-06 14:22:25,155] Trial 93 finished with value: 0.24715359953268004 and parameters: {'model_type': 'mlp', 'hidden_dims': '[512, 64]', 'dropout': 0.29336385692936234, 'batch_norm': False, 'lr': 1.1952865613938182e-05, 'weight_decay': 1.3527742247145787e-07, 'epochs': 167, 'loss': 'mse', 'optimizer': 'adam', 'graph_mode': 'off', 'use_snp_selection': True, 'num_snps': 24014}. Best is trial 71 with value: 0.2596386798200256.
[I 2025-12-06 14:23:14,015] Trial 94 finished with value: 0.24254724399578861 and parameters: {'model_type': 'mlp', 'hidden_dims': '[512, 64]', 'dropout': 0.34174236699296334, 'batch_norm': False, 'lr': 1.5472661032985613e-05, 'weight_decay': 3.3921322222920957e-07, 'epochs': 182, 'loss': 'mse', 'optimizer': 'adam', 'graph_mode': 'off', 'use_snp_selection': True, 'num_snps': 18409}. Best is trial 71 with value: 0.2596386798200256.
[I 2025-12-06 14:24:28,666] Trial 95 finished with value: 0.245912692658246 and parameters: {'model_type': 'mlp', 'hidden_dims': '[512, 64]', 'dropout': 0.3630907746416569, 'batch_norm': False, 'lr': 6.734589323335715e-06, 'weight_decay': 1.8060605456613634e-07, 'epochs': 231, 'loss': 'mse', 'optimizer': 'adam', 'graph_mode': 'off', 'use_snp_selection': True, 'num_snps': 35711}. Best is trial 71 with value: 0.2596386798200256.
[I 2025-12-06 14:25:27,733] Trial 96 finished with value: 0.24783941103183377 and parameters: {'model_type': 'mlp', 'hidden_dims': '[512, 64]', 'dropout': 0.39869489781733874, 'batch_norm': False, 'lr': 8.449795134396061e-06, 'weight_decay': 5.272094547113656e-07, 'epochs': 192, 'loss': 'mse', 'optimizer': 'adam', 'graph_mode': 'off', 'use_snp_selection': True, 'num_snps': 26187}. Best is trial 71 with value: 0.2596386798200256.
[I 2025-12-06 14:26:05,652] Trial 97 finished with value: 0.23919804399133177 and parameters: {'model_type': 'mlp', 'hidden_dims': '[512, 128]', 'dropout': 0.4242546372445765, 'batch_norm': False, 'lr': 1.412592091698854e-05, 'weight_decay': 2.6418369816653017e-07, 'epochs': 131, 'loss': 'mse', 'optimizer': 'adam', 'graph_mode': 'off', 'use_snp_selection': True, 'num_snps': 10220}. Best is trial 71 with value: 0.2596386798200256.
[I 2025-12-06 14:26:59,834] Trial 98 finished with value: 0.24250960380606168 and parameters: {'model_type': 'mlp', 'hidden_dims': '[512, 64]', 'dropout': 0.2690457196488185, 'batch_norm': False, 'lr': 1.1300891126905123e-05, 'weight_decay': 7.47096054113224e-07, 'epochs': 207, 'loss': 'mse', 'optimizer': 'adam', 'graph_mode': 'off', 'use_snp_selection': True, 'num_snps': 20974}. Best is trial 71 with value: 0.2596386798200256.
[I 2025-12-06 14:27:40,702] Trial 99 finished with value: 0.22832172004910797 and parameters: {'model_type': 'mlp', 'hidden_dims': '[256, 128, 64]', 'dropout': 0.3501470593394888, 'batch_norm': False, 'lr': 9.230898138482453e-06, 'weight_decay': 1.2471867743092368e-07, 'epochs': 174, 'loss': 'mse', 'optimizer': 'adam', 'graph_mode': 'off', 'use_snp_selection': True, 'num_snps': 16518}. Best is trial 71 with value: 0.2596386798200256.
[I 2025-12-06 14:28:36,991] Trial 100 finished with value: 0.23553456952355584 and parameters: {'model_type': 'mlp', 'hidden_dims': '[512, 64]', 'dropout': 0.3775685496544088, 'batch_norm': False, 'lr': 5.818070719670547e-06, 'weight_decay': 3.982143342081673e-07, 'epochs': 147, 'loss': 'mse', 'optimizer': 'adam', 'graph_mode': 'off', 'use_snp_selection': True, 'num_snps': 28739}. Best is trial 71 with value: 0.2596386798200256.
[I 2025-12-06 14:29:41,169] Trial 101 finished with value: 0.23443844651574683 and parameters: {'model_type': 'mlp', 'hidden_dims': '[512, 64]', 'dropout': 0.3085819717019791, 'batch_norm': False, 'lr': 7.492454582036062e-06, 'weight_decay': 2.0923047032612226e-07, 'epochs': 164, 'loss': 'mse', 'optimizer': 'adam', 'graph_mode': 'off', 'use_snp_selection': True, 'num_snps': 34664}. Best is trial 71 with value: 0.2596386798200256.
[I 2025-12-06 14:30:34,601] Trial 102 finished with value: 0.2420848018353936 and parameters: {'model_type': 'mlp', 'hidden_dims': '[512, 64]', 'dropout': 0.3307684428950189, 'batch_norm': False, 'lr': 4.545990198311148e-06, 'weight_decay': 1.5761291291186167e-07, 'epochs': 199, 'loss': 'mse', 'optimizer': 'adam', 'graph_mode': 'off', 'use_snp_selection': True, 'num_snps': 21012}. Best is trial 71 with value: 0.2596386798200256.
[I 2025-12-06 14:31:17,795] Trial 103 finished with value: 0.22629728534568513 and parameters: {'model_type': 'mlp', 'hidden_dims': '[512, 64]', 'dropout': 0.34296416300046473, 'batch_norm': False, 'lr': 5.8616063010130116e-05, 'weight_decay': 2.9908801929517767e-07, 'epochs': 187, 'loss': 'mse', 'optimizer': 'adam', 'graph_mode': 'off', 'use_snp_selection': True, 'num_snps': 12539}. Best is trial 71 with value: 0.2596386798200256.
[I 2025-12-06 14:32:06,471] Trial 104 finished with value: 0.24469285904031673 and parameters: {'model_type': 'mlp', 'hidden_dims': '[512, 64]', 'dropout': 0.3524806513378069, 'batch_norm': False, 'lr': 2.1240187769320298e-05, 'weight_decay': 1.7084346101804585e-07, 'epochs': 109, 'loss': 'mse', 'optimizer': 'adam', 'graph_mode': 'off', 'use_snp_selection': True, 'num_snps': 25018}. Best is trial 71 with value: 0.2596386798200256.
[I 2025-12-06 14:33:03,407] Trial 105 finished with value: 0.24154084752305596 and parameters: {'model_type': 'mlp', 'hidden_dims': '[512, 64]', 'dropout': 0.29809524858914044, 'batch_norm': False, 'lr': 1.3179550563245825e-05, 'weight_decay': 2.4317215043781854e-06, 'epochs': 209, 'loss': 'mse', 'optimizer': 'adam', 'graph_mode': 'off', 'use_snp_selection': True, 'num_snps': 23221}. Best is trial 71 with value: 0.2596386798200256.
[I 2025-12-06 14:34:16,098] Trial 106 finished with value: 0.24216010243128946 and parameters: {'model_type': 'mlp', 'hidden_dims': '[512, 64]', 'dropout': 0.3231230762396323, 'batch_norm': False, 'lr': 8.017459412168541e-06, 'weight_decay': 2.2400911801128172e-07, 'epochs': 179, 'loss': 'mse', 'optimizer': 'adam', 'graph_mode': 'off', 'use_snp_selection': True, 'num_snps': 40651}. Best is trial 71 with value: 0.2596386798200256.
[I 2025-12-06 14:34:56,373] Trial 107 finished with value: 0.20309557447919818 and parameters: {'model_type': 'mlp', 'hidden_dims': '[128, 64]', 'dropout': 0.3833286952087692, 'batch_norm': True, 'lr': 6.820028464876893e-06, 'weight_decay': 1.1678810252474947e-06, 'epochs': 217, 'loss': 'mse', 'optimizer': 'adam', 'graph_mode': 'off', 'use_snp_selection': True, 'num_snps': 19448}. Best is trial 71 with value: 0.2596386798200256.
[I 2025-12-06 14:36:02,179] Trial 108 finished with value: 0.24281681192647414 and parameters: {'model_type': 'mlp', 'hidden_dims': '[512, 64]', 'dropout': 0.20046920928742246, 'batch_norm': False, 'lr': 5.217745797338892e-06, 'weight_decay': 1.0126486733930206e-07, 'epochs': 195, 'loss': 'mse', 'optimizer': 'adam', 'graph_mode': 'off', 'use_snp_selection': True, 'num_snps': 32564}. Best is trial 71 with value: 0.2596386798200256.
[I 2025-12-06 14:36:55,167] Trial 109 finished with value: 0.24581102895219745 and parameters: {'model_type': 'mlp', 'hidden_dims': '[512, 64]', 'dropout': 0.3663583118689467, 'batch_norm': False, 'lr': 1.0411046447638772e-05, 'weight_decay': 4.257740718681175e-07, 'epochs': 153, 'loss': 'mse', 'optimizer': 'adam', 'graph_mode': 'off', 'use_snp_selection': True, 'num_snps': 24892}. Best is trial 71 with value: 0.2596386798200256.
[I 2025-12-06 14:37:41,484] Trial 110 finished with value: 0.23926188396255013 and parameters: {'model_type': 'mlp', 'hidden_dims': '[512, 64]', 'dropout': 0.33797946770717996, 'batch_norm': False, 'lr': 1.5957651251398207e-05, 'weight_decay': 1.3398035867754058e-07, 'epochs': 173, 'loss': 'mse', 'optimizer': 'adam', 'graph_mode': 'off', 'use_snp_selection': True, 'num_snps': 16763}. Best is trial 71 with value: 0.2596386798200256.
[I 2025-12-06 14:38:35,873] Trial 111 finished with value: 0.24837614982224315 and parameters: {'model_type': 'mlp', 'hidden_dims': '[512, 64]', 'dropout': 0.31270039219181334, 'batch_norm': False, 'lr': 9.490912967320606e-06, 'weight_decay': 2.8280302776677556e-07, 'epochs': 190, 'loss': 'mse', 'optimizer': 'adam', 'graph_mode': 'off', 'use_snp_selection': True, 'num_snps': 22496}. Best is trial 71 with value: 0.2596386798200256.
[I 2025-12-06 14:39:29,864] Trial 112 finished with value: 0.2493344610338987 and parameters: {'model_type': 'mlp', 'hidden_dims': '[512, 64]', 'dropout': 0.3062782932120838, 'batch_norm': False, 'lr': 9.128420843553126e-06, 'weight_decay': 2.708338346203952e-07, 'epochs': 203, 'loss': 'mse', 'optimizer': 'adam', 'graph_mode': 'off', 'use_snp_selection': True, 'num_snps': 21548}. Best is trial 71 with value: 0.2596386798200256.
[I 2025-12-06 14:40:22,072] Trial 113 finished with value: 0.25486642852023367 and parameters: {'model_type': 'mlp', 'hidden_dims': '[512, 64]', 'dropout': 0.2787683535684818, 'batch_norm': False, 'lr': 1.1616259313902884e-05, 'weight_decay': 2.24042318878278e-07, 'epochs': 203, 'loss': 'mse', 'optimizer': 'adam', 'graph_mode': 'off', 'use_snp_selection': True, 'num_snps': 20012}. Best is trial 71 with value: 0.2596386798200256.
[I 2025-12-06 14:41:14,007] Trial 114 finished with value: 0.2457267033908897 and parameters: {'model_type': 'mlp', 'hidden_dims': '[512, 64]', 'dropout': 0.2794042797914183, 'batch_norm': False, 'lr': 1.1830908045098064e-05, 'weight_decay': 2.270114469712628e-07, 'epochs': 201, 'loss': 'mse', 'optimizer': 'adam', 'graph_mode': 'off', 'use_snp_selection': True, 'num_snps': 19645}. Best is trial 71 with value: 0.2596386798200256.
[I 2025-12-06 14:41:57,898] Trial 115 finished with value: 0.23007767818034042 and parameters: {'model_type': 'mlp', 'hidden_dims': '[512, 64]', 'dropout': 0.30027171503931915, 'batch_norm': False, 'lr': 6.4426569227639115e-06, 'weight_decay': 3.4942751740993347e-07, 'epochs': 87, 'loss': 'mse', 'optimizer': 'adam', 'graph_mode': 'off', 'use_snp_selection': True, 'num_snps': 21398}. Best is trial 71 with value: 0.2596386798200256.
[I 2025-12-06 14:43:36,746] Trial 116 finished with value: 0.23640777013842165 and parameters: {'model_type': 'mlp', 'hidden_dims': '[512, 64]', 'dropout': 0.26853637016143383, 'batch_norm': False, 'lr': 8.413247842563174e-06, 'weight_decay': 1.8282213004849006e-07, 'epochs': 227, 'loss': 'mse', 'optimizer': 'adam', 'graph_mode': 'off', 'use_snp_selection': True, 'num_snps': 53573}. Best is trial 71 with value: 0.2596386798200256.
[I 2025-12-06 14:44:19,573] Trial 117 finished with value: 0.25164878430891896 and parameters: {'model_type': 'mlp', 'hidden_dims': '[128, 64]', 'dropout': 0.32889224900976494, 'batch_norm': False, 'lr': 3.4378399461328424e-05, 'weight_decay': 1.2737760541438902e-07, 'epochs': 141, 'loss': 'mse', 'optimizer': 'adam', 'graph_mode': 'off', 'use_snp_selection': True, 'num_snps': 28234}. Best is trial 71 with value: 0.2596386798200256.
[I 2025-12-06 14:44:57,402] Trial 118 finished with value: 0.23506510206482725 and parameters: {'model_type': 'mlp', 'hidden_dims': '[128, 64]', 'dropout': 0.3302875480985968, 'batch_norm': False, 'lr': 3.5259263652649784e-05, 'weight_decay': 1.241018945455905e-07, 'epochs': 138, 'loss': 'mse', 'optimizer': 'adam', 'graph_mode': 'off', 'use_snp_selection': True, 'num_snps': 17995}. Best is trial 71 with value: 0.2596386798200256.
[I 2025-12-06 14:45:40,155] Trial 119 finished with value: 0.2400798306285506 and parameters: {'model_type': 'mlp', 'hidden_dims': '[128, 64]', 'dropout': 0.2423754588073354, 'batch_norm': False, 'lr': 4.492490004709278e-05, 'weight_decay': 1.614153453814509e-07, 'epochs': 125, 'loss': 'mse', 'optimizer': 'adam', 'graph_mode': 'off', 'use_snp_selection': True, 'num_snps': 28394}. Best is trial 71 with value: 0.2596386798200256.
[I 2025-12-06 14:46:21,541] Trial 120 finished with value: 0.25483273296005843 and parameters: {'model_type': 'mlp', 'hidden_dims': '[128, 64]', 'dropout': 0.3076225262973685, 'batch_norm': False, 'lr': 2.632225295222179e-05, 'weight_decay': 2.5742815047090035e-07, 'epochs': 163, 'loss': 'mse', 'optimizer': 'adam', 'graph_mode': 'off', 'use_snp_selection': True, 'num_snps': 23850}. Best is trial 71 with value: 0.2596386798200256.
[I 2025-12-06 14:47:01,596] Trial 121 finished with value: 0.24557324176371914 and parameters: {'model_type': 'mlp', 'hidden_dims': '[128, 64]', 'dropout': 0.28762508660308983, 'batch_norm': False, 'lr': 2.799014984461551e-05, 'weight_decay': 2.5872458305041983e-07, 'epochs': 121, 'loss': 'mse', 'optimizer': 'adam', 'graph_mode': 'off', 'use_snp_selection': True, 'num_snps': 23877}. Best is trial 71 with value: 0.2596386798200256.
[I 2025-12-06 14:47:41,866] Trial 122 finished with value: 0.24803433914790446 and parameters: {'model_type': 'mlp', 'hidden_dims': '[128, 64]', 'dropout': 0.321706059311696, 'batch_norm': False, 'lr': 7.57970892391902e-05, 'weight_decay': 1.494362138462406e-07, 'epochs': 162, 'loss': 'mse', 'optimizer': 'adam', 'graph_mode': 'off', 'use_snp_selection': True, 'num_snps': 21685}. Best is trial 71 with value: 0.2596386798200256.
[I 2025-12-06 14:48:23,507] Trial 123 finished with value: 0.25748523657847067 and parameters: {'model_type': 'mlp', 'hidden_dims': '[128, 64]', 'dropout': 0.30594957653190125, 'batch_norm': False, 'lr': 5.8925182088586555e-05, 'weight_decay': 5.487580323832873e-07, 'epochs': 143, 'loss': 'mse', 'optimizer': 'adam', 'graph_mode': 'off', 'use_snp_selection': True, 'num_snps': 26096}. Best is trial 71 with value: 0.2596386798200256.
[I 2025-12-06 14:49:05,380] Trial 124 finished with value: 0.24191144412339546 and parameters: {'model_type': 'mlp', 'hidden_dims': '[128, 64]', 'dropout': 0.33299802137310036, 'batch_norm': False, 'lr': 9.322822775209828e-05, 'weight_decay': 5.171911300897848e-07, 'epochs': 139, 'loss': 'mse', 'optimizer': 'adam', 'graph_mode': 'off', 'use_snp_selection': True, 'num_snps': 26692}. Best is trial 71 with value: 0.2596386798200256.
[I 2025-12-06 14:49:48,174] Trial 125 finished with value: 0.2415593948431855 and parameters: {'model_type': 'mlp', 'hidden_dims': '[128, 64]', 'dropout': 0.3556178849372881, 'batch_norm': False, 'lr': 4.850589062679384e-05, 'weight_decay': 1.1514216029615208e-07, 'epochs': 114, 'loss': 'mse', 'optimizer': 'adam', 'graph_mode': 'off', 'use_snp_selection': True, 'num_snps': 30306}. Best is trial 71 with value: 0.2596386798200256.
[I 2025-12-06 14:50:30,015] Trial 126 finished with value: 0.24541523499591414 and parameters: {'model_type': 'mlp', 'hidden_dims': '[128, 64]', 'dropout': 0.2907384815831423, 'batch_norm': False, 'lr': 5.457091473467783e-05, 'weight_decay': 2.200565031046423e-07, 'epochs': 182, 'loss': 'mse', 'optimizer': 'adam', 'graph_mode': 'off', 'use_snp_selection': True, 'num_snps': 24197}. Best is trial 71 with value: 0.2596386798200256.
