[I 2025-12-05 20:59:06,621] Trial 53 finished with value: 0.3716489559205088 and parameters: {'model_type': 'mlp', 'hidden_dims': '[512, 64]', 'dropout': 0.5148152305607524, 'batch_norm': False, 'lr': 8.98402181454944e-06, 'weight_decay': 1.7008816671531535e-05, 'epochs': 319, 'loss': 'mae', 'optimizer': 'adam', 'graph_mode': 'off', 'use_snp_selection': True, 'num_snps': 57660}. Best is trial 39 with value: 0.3779156619737201.
[I 2025-12-05 21:00:23,751] Trial 54 finished with value: 0.37588229240593507 and parameters: {'model_type': 'mlp', 'hidden_dims': '[512, 64]', 'dropout': 0.3406849137191566, 'batch_norm': False, 'lr': 2.6990240481482675e-06, 'weight_decay': 4.336827564541161e-07, 'epochs': 273, 'loss': 'mae', 'optimizer': 'adam', 'graph_mode': 'off', 'use_snp_selection': True, 'num_snps': 48941}. Best is trial 39 with value: 0.3779156619737201.
[I 2025-12-05 21:01:31,425] Trial 55 finished with value: 0.36436137826170273 and parameters: {'model_type': 'mlp', 'hidden_dims': '[512, 64]', 'dropout': 0.31384627510933605, 'batch_norm': False, 'lr': 4.889210743834247e-06, 'weight_decay': 1.400042051224115e-06, 'epochs': 243, 'loss': 'mse', 'optimizer': 'adam', 'graph_mode': 'off', 'use_snp_selection': True, 'num_snps': 44470}. Best is trial 39 with value: 0.3779156619737201.
[I 2025-12-05 21:02:39,365] Trial 56 finished with value: 0.3641758575063143 and parameters: {'model_type': 'mlp', 'hidden_dims': '[256, 128, 64]', 'dropout': 0.5995599500026879, 'batch_norm': False, 'lr': 3.434698052572019e-06, 'weight_decay': 1.1449955127831656e-07, 'epochs': 336, 'loss': 'mae', 'optimizer': 'adam', 'graph_mode': 'off', 'use_snp_selection': True, 'num_snps': 56844}. Best is trial 39 with value: 0.3779156619737201.
[I 2025-12-05 21:04:07,215] Trial 57 finished with value: 0.34908385330761876 and parameters: {'model_type': 'mlp', 'hidden_dims': '[512, 64]', 'dropout': 0.2780908702660049, 'batch_norm': True, 'lr': 0.0008615739501028876, 'weight_decay': 7.591797012306788e-07, 'epochs': 311, 'loss': 'mae', 'optimizer': 'adam', 'graph_mode': 'off', 'use_snp_selection': True, 'num_snps': 52886}. Best is trial 39 with value: 0.3779156619737201.
[I 2025-12-05 21:05:07,060] Trial 58 finished with value: 0.3724520953746232 and parameters: {'model_type': 'mlp', 'hidden_dims': '[512, 256]', 'dropout': 0.5715658669032773, 'batch_norm': False, 'lr': 1.140289284419074e-05, 'weight_decay': 1.4676671757809897e-05, 'epochs': 288, 'loss': 'mae', 'optimizer': 'adam', 'graph_mode': 'off', 'use_snp_selection': False}. Best is trial 39 with value: 0.3779156619737201.
[I 2025-12-05 21:06:14,169] Trial 59 finished with value: 0.34902583092903217 and parameters: {'model_type': 'mlp', 'hidden_dims': '[512, 64]', 'dropout': 0.5027236209783712, 'batch_norm': False, 'lr': 1.6633101228316683e-06, 'weight_decay': 8.78737467662921e-06, 'epochs': 159, 'loss': 'mae', 'optimizer': 'adam', 'graph_mode': 'off', 'use_snp_selection': True, 'num_snps': 58584}. Best is trial 39 with value: 0.3779156619737201.
[I 2025-12-05 21:07:27,516] Trial 60 finished with value: 0.357750210565834 and parameters: {'model_type': 'mlp', 'hidden_dims': '[512, 128]', 'dropout': 0.5307400760915005, 'batch_norm': False, 'lr': 1.161645746723459e-06, 'weight_decay': 4.1544596514346465e-06, 'epochs': 223, 'loss': 'mse', 'optimizer': 'adam', 'graph_mode': 'off', 'use_snp_selection': True, 'num_snps': 53079}. Best is trial 39 with value: 0.3779156619737201.
[I 2025-12-05 21:08:59,953] Trial 61 finished with value: 0.37978999163824223 and parameters: {'model_type': 'mlp', 'hidden_dims': '[512, 64]', 'dropout': 0.5453258461154773, 'batch_norm': False, 'lr': 3.3948071513963097e-06, 'weight_decay': 2.9347015169166665e-05, 'epochs': 317, 'loss': 'mae', 'optimizer': 'adam', 'graph_mode': 'off', 'use_snp_selection': True, 'num_snps': 56236}. Best is trial 61 with value: 0.37978999163824223.
[I 2025-12-05 21:10:41,738] Trial 62 finished with value: 0.37863583586709854 and parameters: {'model_type': 'mlp', 'hidden_dims': '[512, 64]', 'dropout': 0.45372129430828767, 'batch_norm': False, 'lr': 3.1066215490195984e-06, 'weight_decay': 3.3118338242888915e-05, 'epochs': 341, 'loss': 'mae', 'optimizer': 'adam', 'graph_mode': 'off', 'use_snp_selection': True, 'num_snps': 59916}. Best is trial 61 with value: 0.37978999163824223.
[I 2025-12-05 21:12:11,153] Trial 63 finished with value: 0.37702014258946226 and parameters: {'model_type': 'mlp', 'hidden_dims': '[512, 64]', 'dropout': 0.4485064312649586, 'batch_norm': False, 'lr': 3.3115671756035705e-06, 'weight_decay': 5.150554148440872e-05, 'epochs': 296, 'loss': 'mae', 'optimizer': 'adam', 'graph_mode': 'off', 'use_snp_selection': True, 'num_snps': 56411}. Best is trial 61 with value: 0.37978999163824223.
[I 2025-12-05 21:13:33,325] Trial 64 finished with value: 0.3788214365594289 and parameters: {'model_type': 'mlp', 'hidden_dims': '[512, 64]', 'dropout': 0.48584086650348524, 'batch_norm': False, 'lr': 4.546356194232904e-06, 'weight_decay': 5.683949651340605e-05, 'epochs': 307, 'loss': 'mae', 'optimizer': 'adam', 'graph_mode': 'off', 'use_snp_selection': True, 'num_snps': 48997}. Best is trial 61 with value: 0.37978999163824223.
[I 2025-12-05 21:14:52,226] Trial 65 finished with value: 0.37606381494633967 and parameters: {'model_type': 'mlp', 'hidden_dims': '[512, 64]', 'dropout': 0.4822534345079457, 'batch_norm': False, 'lr': 5.4968014166999504e-06, 'weight_decay': 2.910585675548885e-05, 'epochs': 280, 'loss': 'mae', 'optimizer': 'adam', 'graph_mode': 'off', 'use_snp_selection': True, 'num_snps': 49699}. Best is trial 61 with value: 0.37978999163824223.
[I 2025-12-05 21:15:56,579] Trial 66 finished with value: 0.374085242980175 and parameters: {'model_type': 'mlp', 'hidden_dims': '[512, 64]', 'dropout': 0.4622521356430963, 'batch_norm': False, 'lr': 7.026974483622305e-06, 'weight_decay': 7.210892023636266e-05, 'epochs': 311, 'loss': 'mae', 'optimizer': 'adam', 'graph_mode': 'off', 'use_snp_selection': False}. Best is trial 61 with value: 0.37978999163824223.
[I 2025-12-05 21:17:16,878] Trial 67 finished with value: 0.3747862627724003 and parameters: {'model_type': 'mlp', 'hidden_dims': '[512, 64]', 'dropout': 0.49795680603406334, 'batch_norm': False, 'lr': 4.3527107844848976e-06, 'weight_decay': 0.00015085165383458472, 'epochs': 336, 'loss': 'mae', 'optimizer': 'adam', 'graph_mode': 'off', 'use_snp_selection': True, 'num_snps': 44507}. Best is trial 61 with value: 0.37978999163824223.
[I 2025-12-05 21:18:34,053] Trial 68 finished with value: 0.37278712890716253 and parameters: {'model_type': 'mlp', 'hidden_dims': '[512, 64]', 'dropout': 0.4295451931939006, 'batch_norm': False, 'lr': 1.869460509269056e-06, 'weight_decay': 6.275559961674321e-05, 'epochs': 249, 'loss': 'mae', 'optimizer': 'adam', 'graph_mode': 'off', 'use_snp_selection': True, 'num_snps': 52591}. Best is trial 61 with value: 0.37978999163824223.
[I 2025-12-05 21:19:54,289] Trial 69 finished with value: 0.3806926113310267 and parameters: {'model_type': 'mlp', 'hidden_dims': '[512, 64]', 'dropout': 0.5273579241745686, 'batch_norm': False, 'lr': 2.5335039040927083e-06, 'weight_decay': 2.3203553371859564e-05, 'epochs': 325, 'loss': 'mae', 'optimizer': 'adam', 'graph_mode': 'off', 'use_snp_selection': True, 'num_snps': 45503}. Best is trial 69 with value: 0.3806926113310267.
[I 2025-12-05 21:20:43,545] Trial 70 finished with value: 0.38114770701530937 and parameters: {'model_type': 'mlp', 'hidden_dims': '[256, 128]', 'dropout': 0.5640949869065729, 'batch_norm': False, 'lr': 9.108395796837175e-06, 'weight_decay': 2.442099114013123e-05, 'epochs': 200, 'loss': 'mae', 'optimizer': 'adam', 'graph_mode': 'off', 'use_snp_selection': True, 'num_snps': 45823}. Best is trial 70 with value: 0.38114770701530937.
[I 2025-12-05 21:21:29,604] Trial 71 finished with value: 0.37432601562775236 and parameters: {'model_type': 'mlp', 'hidden_dims': '[256, 128]', 'dropout': 0.5627849067580319, 'batch_norm': False, 'lr': 8.062496013019466e-06, 'weight_decay': 1.3002334773545091e-05, 'epochs': 203, 'loss': 'mae', 'optimizer': 'adam', 'graph_mode': 'off', 'use_snp_selection': True, 'num_snps': 41161}. Best is trial 70 with value: 0.38114770701530937.
[I 2025-12-05 21:22:17,829] Trial 72 finished with value: 0.372379860803218 and parameters: {'model_type': 'mlp', 'hidden_dims': '[256, 128]', 'dropout': 0.5309142566390114, 'batch_norm': False, 'lr': 1.5875749779647622e-05, 'weight_decay': 2.2083524500019224e-05, 'epochs': 192, 'loss': 'mae', 'optimizer': 'adam', 'graph_mode': 'off', 'use_snp_selection': True, 'num_snps': 45361}. Best is trial 70 with value: 0.38114770701530937.
[I 2025-12-05 21:23:02,057] Trial 73 finished with value: 0.36906197370246563 and parameters: {'model_type': 'mlp', 'hidden_dims': '[256, 128]', 'dropout': 0.5825415312168537, 'batch_norm': False, 'lr': 5.666871046203869e-06, 'weight_decay': 3.566540780847771e-05, 'epochs': 215, 'loss': 'mae', 'optimizer': 'adam', 'graph_mode': 'off', 'use_snp_selection': True, 'num_snps': 37000}. Best is trial 70 with value: 0.38114770701530937.
[I 2025-12-05 21:23:54,458] Trial 74 finished with value: 0.37511854955721147 and parameters: {'model_type': 'mlp', 'hidden_dims': '[256, 128]', 'dropout': 0.5147061576228428, 'batch_norm': False, 'lr': 1.0128170376903993e-05, 'weight_decay': 8.026034652160651e-06, 'epochs': 229, 'loss': 'mae', 'optimizer': 'adam', 'graph_mode': 'off', 'use_snp_selection': True, 'num_snps': 48513}. Best is trial 70 with value: 0.38114770701530937.
[I 2025-12-05 21:25:14,639] Trial 75 finished with value: 0.3750701226361782 and parameters: {'model_type': 'mlp', 'hidden_dims': '[512, 64]', 'dropout': 0.5384667617285255, 'batch_norm': False, 'lr': 4.518767512129867e-06, 'weight_decay': 2.509993953519008e-05, 'epochs': 324, 'loss': 'mae', 'optimizer': 'adam', 'graph_mode': 'off', 'use_snp_selection': True, 'num_snps': 46049}. Best is trial 70 with value: 0.38114770701530937.
[I 2025-12-05 21:26:00,025] Trial 76 finished with value: 0.322889064564396 and parameters: {'model_type': 'mlp', 'hidden_dims': '[128, 64]', 'dropout': 0.5591503507040778, 'batch_norm': True, 'lr': 2.2685397741243025e-06, 'weight_decay': 0.00010423534953372009, 'epochs': 341, 'loss': 'mae', 'optimizer': 'adam', 'graph_mode': 'off', 'use_snp_selection': True, 'num_snps': 41405}. Best is trial 70 with value: 0.38114770701530937.
[I 2025-12-05 21:26:34,063] Trial 77 finished with value: 0.3639133705242532 and parameters: {'model_type': 'mlp', 'hidden_dims': '[256, 128, 64]', 'dropout': 0.5043987380460813, 'batch_norm': False, 'lr': 3.22742684188955e-06, 'weight_decay': 5.0271402979413734e-05, 'epochs': 296, 'loss': 'mae', 'optimizer': 'adam', 'graph_mode': 'off', 'use_snp_selection': False}. Best is trial 70 with value: 0.38114770701530937.
[I 2025-12-05 21:27:43,786] Trial 78 finished with value: 0.3752049777634904 and parameters: {'model_type': 'mlp', 'hidden_dims': '[512, 64]', 'dropout': 0.5899016361438302, 'batch_norm': False, 'lr': 3.871613365518069e-06, 'weight_decay': 1.791560614460639e-05, 'epochs': 310, 'loss': 'mae', 'optimizer': 'adam', 'graph_mode': 'off', 'use_snp_selection': True, 'num_snps': 39075}. Best is trial 70 with value: 0.38114770701530937.
[I 2025-12-05 21:28:45,445] Trial 79 finished with value: 0.3726150146622399 and parameters: {'model_type': 'mlp', 'hidden_dims': '[512, 128]', 'dropout': 0.4719912084443327, 'batch_norm': False, 'lr': 6.509830049436876e-06, 'weight_decay': 3.141000970156045e-05, 'epochs': 208, 'loss': 'mae', 'optimizer': 'adam', 'graph_mode': 'off', 'use_snp_selection': True, 'num_snps': 43095}. Best is trial 70 with value: 0.38114770701530937.
[I 2025-12-05 21:29:34,315] Trial 80 finished with value: 0.3540546281031315 and parameters: {'model_type': 'mlp', 'hidden_dims': '[256, 128]', 'dropout': 0.5238650365693983, 'batch_norm': False, 'lr': 2.2907816220321e-06, 'weight_decay': 0.00043203909118432295, 'epochs': 187, 'loss': 'mae', 'optimizer': 'adam', 'graph_mode': 'off', 'use_snp_selection': True, 'num_snps': 47687}. Best is trial 70 with value: 0.38114770701530937.
[I 2025-12-05 21:31:01,954] Trial 81 finished with value: 0.3825091800297298 and parameters: {'model_type': 'mlp', 'hidden_dims': '[512, 64]', 'dropout': 0.4847512830523342, 'batch_norm': False, 'lr': 3.0243739624316645e-06, 'weight_decay': 3.972823802032788e-05, 'epochs': 330, 'loss': 'mae', 'optimizer': 'adam', 'graph_mode': 'off', 'use_snp_selection': True, 'num_snps': 51005}. Best is trial 81 with value: 0.3825091800297298.
[I 2025-12-05 21:32:32,422] Trial 82 finished with value: 0.3817255047363418 and parameters: {'model_type': 'mlp', 'hidden_dims': '[512, 64]', 'dropout': 0.4910701098959402, 'batch_norm': False, 'lr': 2.7841004806278642e-06, 'weight_decay': 4.152639440452951e-05, 'epochs': 320, 'loss': 'mae', 'optimizer': 'adam', 'graph_mode': 'off', 'use_snp_selection': True, 'num_snps': 54780}. Best is trial 81 with value: 0.3825091800297298.
[I 2025-12-05 21:34:04,619] Trial 83 finished with value: 0.3740858202957063 and parameters: {'model_type': 'mlp', 'hidden_dims': '[512, 64]', 'dropout': 0.4507515903287343, 'batch_norm': False, 'lr': 2.900644426118629e-06, 'weight_decay': 4.197211161070723e-05, 'epochs': 319, 'loss': 'mae', 'optimizer': 'adam', 'graph_mode': 'off', 'use_snp_selection': True, 'num_snps': 55431}. Best is trial 81 with value: 0.3825091800297298.
[I 2025-12-05 21:35:36,135] Trial 84 finished with value: 0.3663538095201521 and parameters: {'model_type': 'mlp', 'hidden_dims': '[512, 64]', 'dropout': 0.5394493754949834, 'batch_norm': False, 'lr': 1.4248384326774036e-06, 'weight_decay': 7.121554933824979e-05, 'epochs': 349, 'loss': 'mae', 'optimizer': 'adam', 'graph_mode': 'off', 'use_snp_selection': True, 'num_snps': 51507}. Best is trial 81 with value: 0.3825091800297298.
[I 2025-12-05 21:37:15,155] Trial 85 finished with value: 0.3765346853511686 and parameters: {'model_type': 'mlp', 'hidden_dims': '[512, 64]', 'dropout': 0.48775836437559966, 'batch_norm': False, 'lr': 1.7566747029809162e-06, 'weight_decay': 1.942513685794101e-05, 'epochs': 329, 'loss': 'mae', 'optimizer': 'adam', 'graph_mode': 'off', 'use_snp_selection': True, 'num_snps': 59277}. Best is trial 81 with value: 0.3825091800297298.
[I 2025-12-05 21:38:43,018] Trial 86 finished with value: 0.37628942202235444 and parameters: {'model_type': 'mlp', 'hidden_dims': '[512, 64]', 'dropout': 0.5071268635250205, 'batch_norm': False, 'lr': 4.225940698784847e-06, 'weight_decay': 2.5981158423252717e-05, 'epochs': 304, 'loss': 'mae', 'optimizer': 'adam', 'graph_mode': 'off', 'use_snp_selection': True, 'num_snps': 54543}. Best is trial 81 with value: 0.3825091800297298.
[I 2025-12-05 21:39:30,622] Trial 87 finished with value: 0.3436700856703786 and parameters: {'model_type': 'mlp', 'hidden_dims': '[512, 64]', 'dropout': 0.46141112946261054, 'batch_norm': False, 'lr': 3.0748056462306756e-06, 'weight_decay': 5.7184973061557186e-05, 'epochs': 73, 'loss': 'mae', 'optimizer': 'adam', 'graph_mode': 'off', 'use_snp_selection': True, 'num_snps': 49797}. Best is trial 81 with value: 0.3825091800297298.
[I 2025-12-05 21:40:31,991] Trial 88 finished with value: 0.36520300904553454 and parameters: {'model_type': 'mlp', 'hidden_dims': '[512, 64]', 'dropout': 0.1683857012688203, 'batch_norm': False, 'lr': 2.045780813604745e-06, 'weight_decay': 1.2458432036676188e-05, 'epochs': 134, 'loss': 'mae', 'optimizer': 'adam', 'graph_mode': 'off', 'use_snp_selection': True, 'num_snps': 56267}. Best is trial 81 with value: 0.3825091800297298.
[I 2025-12-05 21:42:03,282] Trial 89 finished with value: 0.35269864848855936 and parameters: {'model_type': 'mlp', 'hidden_dims': '[512, 64]', 'dropout': 0.4780677299250616, 'batch_norm': True, 'lr': 3.6181391086370777e-06, 'weight_decay': 8.866180778120232e-05, 'epochs': 343, 'loss': 'mae', 'optimizer': 'adam', 'graph_mode': 'off', 'use_snp_selection': True, 'num_snps': 51823}. Best is trial 81 with value: 0.3825091800297298.
[I 2025-12-05 21:43:09,663] Trial 90 finished with value: 0.37833663317427757 and parameters: {'model_type': 'mlp', 'hidden_dims': '[512, 64]', 'dropout': 0.5477166971869033, 'batch_norm': False, 'lr': 2.6476192813700274e-06, 'weight_decay': 4.6078132949302604e-05, 'epochs': 322, 'loss': 'mae', 'optimizer': 'adam', 'graph_mode': 'off', 'use_snp_selection': False}. Best is trial 81 with value: 0.3825091800297298.
[I 2025-12-05 21:44:16,662] Trial 91 finished with value: 0.3744860067153595 and parameters: {'model_type': 'mlp', 'hidden_dims': '[512, 64]', 'dropout': 0.5773897357119206, 'batch_norm': False, 'lr': 2.398032039925914e-06, 'weight_decay': 4.282225966842425e-05, 'epochs': 323, 'loss': 'mae', 'optimizer': 'adam', 'graph_mode': 'off', 'use_snp_selection': False}. Best is trial 81 with value: 0.3825091800297298.
[I 2025-12-05 21:45:22,551] Trial 92 finished with value: 0.3798366470902843 and parameters: {'model_type': 'mlp', 'hidden_dims': '[512, 64]', 'dropout': 0.5478724635215217, 'batch_norm': False, 'lr': 2.725581649287165e-06, 'weight_decay': 3.278679806730061e-05, 'epochs': 317, 'loss': 'mae', 'optimizer': 'adam', 'graph_mode': 'off', 'use_snp_selection': False}. Best is trial 81 with value: 0.3825091800297298.
[I 2025-12-05 21:46:32,400] Trial 93 finished with value: 0.37595186763913296 and parameters: {'model_type': 'mlp', 'hidden_dims': '[512, 64]', 'dropout': 0.5451025492868691, 'batch_norm': False, 'lr': 2.733753243981365e-06, 'weight_decay': 3.4627034700713554e-05, 'epochs': 338, 'loss': 'mae', 'optimizer': 'adam', 'graph_mode': 'off', 'use_snp_selection': False}. Best is trial 81 with value: 0.3825091800297298.
[I 2025-12-05 21:47:40,520] Trial 94 finished with value: 0.37299313722433036 and parameters: {'model_type': 'mlp', 'hidden_dims': '[512, 64]', 'dropout': 0.531631031650298, 'batch_norm': False, 'lr': 4.7426222255392125e-06, 'weight_decay': 0.00014661638605256296, 'epochs': 329, 'loss': 'mae', 'optimizer': 'adam', 'graph_mode': 'off', 'use_snp_selection': False}. Best is trial 81 with value: 0.3825091800297298.
[I 2025-12-05 21:48:44,403] Trial 95 finished with value: 0.3759008571873599 and parameters: {'model_type': 'mlp', 'hidden_dims': '[512, 128]', 'dropout': 0.49384919579382497, 'batch_norm': False, 'lr': 1.846511300587558e-06, 'weight_decay': 4.470046136087573e-05, 'epochs': 306, 'loss': 'mae', 'optimizer': 'adam', 'graph_mode': 'off', 'use_snp_selection': False}. Best is trial 81 with value: 0.3825091800297298.
[I 2025-12-05 21:49:44,354] Trial 96 finished with value: 0.37070347097251477 and parameters: {'model_type': 'mlp', 'hidden_dims': '[512, 64]', 'dropout': 0.5543667844350607, 'batch_norm': False, 'lr': 2.5137871580211565e-06, 'weight_decay': 6.289274274255232e-05, 'epochs': 286, 'loss': 'mae', 'optimizer': 'adam', 'graph_mode': 'off', 'use_snp_selection': False}. Best is trial 81 with value: 0.3825091800297298.
[I 2025-12-05 21:50:05,887] Trial 97 finished with value: 0.32550074300499854 and parameters: {'model_type': 'mlp', 'hidden_dims': '[128, 64]', 'dropout': 0.5204383965624967, 'batch_norm': False, 'lr': 1.236608696820991e-06, 'weight_decay': 2.5800433648494707e-05, 'epochs': 317, 'loss': 'mae', 'optimizer': 'adam', 'graph_mode': 'off', 'use_snp_selection': False}. Best is trial 81 with value: 0.3825091800297298.
[I 2025-12-05 21:51:05,610] Trial 98 finished with value: 0.3528747524646063 and parameters: {'model_type': 'mlp', 'hidden_dims': '[512, 64]', 'dropout': 0.5099745148571422, 'batch_norm': False, 'lr': 8.886023699908931e-05, 'weight_decay': 3.3406534479400135e-05, 'epochs': 296, 'loss': 'mae', 'optimizer': 'adam', 'graph_mode': 'off', 'use_snp_selection': False}. Best is trial 81 with value: 0.3825091800297298.
[I 2025-12-05 21:52:11,879] Trial 99 finished with value: 0.3753766552199088 and parameters: {'model_type': 'mlp', 'hidden_dims': '[512, 64]', 'dropout': 0.5475799530978003, 'batch_norm': False, 'lr': 3.882751551675275e-06, 'weight_decay': 1.4262723277012955e-05, 'epochs': 322, 'loss': 'mae', 'optimizer': 'adam', 'graph_mode': 'off', 'use_snp_selection': False}. Best is trial 81 with value: 0.3825091800297298.
[I 2025-12-05 21:52:50,363] Trial 100 finished with value: 0.36972459424681514 and parameters: {'model_type': 'mlp', 'hidden_dims': '[256, 128, 64]', 'dropout': 0.5639957389622435, 'batch_norm': False, 'lr': 5.506121527130713e-06, 'weight_decay': 9.219892477443517e-05, 'epochs': 342, 'loss': 'mae', 'optimizer': 'adam', 'graph_mode': 'off', 'use_snp_selection': False}. Best is trial 81 with value: 0.3825091800297298.
[I 2025-12-05 21:53:39,959] Trial 101 finished with value: 0.37216147652256554 and parameters: {'model_type': 'mlp', 'hidden_dims': '[512, 64]', 'dropout': 0.5949862088811885, 'batch_norm': False, 'lr': 3.4392187594269715e-06, 'weight_decay': 1.5131778188325027e-05, 'epochs': 315, 'loss': 'mae', 'optimizer': 'adam', 'graph_mode': 'off', 'use_snp_selection': True, 'num_snps': 22301}. Best is trial 81 with value: 0.3825091800297298.
[I 2025-12-05 21:55:17,352] Trial 102 finished with value: 0.37719725783354546 and parameters: {'model_type': 'mlp', 'hidden_dims': '[512, 64]', 'dropout': 0.5704439781192612, 'batch_norm': False, 'lr': 2.947861073919075e-06, 'weight_decay': 1.044212933673195e-05, 'epochs': 326, 'loss': 'mae', 'optimizer': 'adam', 'graph_mode': 'off', 'use_snp_selection': True, 'num_snps': 57559}. Best is trial 81 with value: 0.3825091800297298.
[I 2025-12-05 21:56:21,569] Trial 103 finished with value: 0.3769122280306081 and parameters: {'model_type': 'mlp', 'hidden_dims': '[512, 64]', 'dropout': 0.52108664120894, 'batch_norm': False, 'lr': 2.0518320389190434e-06, 'weight_decay': 2.1724505648876466e-05, 'epochs': 307, 'loss': 'mae', 'optimizer': 'adam', 'graph_mode': 'off', 'use_snp_selection': False}. Best is trial 81 with value: 0.3825091800297298.
