[I 2025-12-06 03:30:40,618] Trial 17 finished with value: 0.19270454909755724 and parameters: {'model_type': 'mlp', 'hidden_dims': '[256, 128, 64]', 'dropout': 0.4973360034827234, 'batch_norm': False, 'lr': 0.000906375209920231, 'weight_decay': 7.64402049066398e-05, 'epochs': 278, 'loss': 'mae', 'optimizer': 'adam', 'graph_mode': 'off', 'use_snp_selection': False}. Best is trial 12 with value: 0.37792280014389473.
[I 2025-12-06 03:31:35,241] Trial 18 finished with value: 0.37079347125534 and parameters: {'model_type': 'mlp', 'hidden_dims': '[256, 128]', 'dropout': 0.5306024267342098, 'batch_norm': False, 'lr': 3.3005598272130625e-06, 'weight_decay': 5.409591144113358e-06, 'epochs': 193, 'loss': 'mae', 'optimizer': 'adam', 'graph_mode': 'off', 'use_snp_selection': True, 'num_snps': 58241}. Best is trial 12 with value: 0.37792280014389473.
[I 2025-12-06 03:32:02,054] Trial 19 finished with value: 0.3742047791400914 and parameters: {'model_type': 'mlp', 'hidden_dims': '[512, 256]', 'dropout': 0.4474829529456146, 'batch_norm': False, 'lr': 7.403367766965606e-06, 'weight_decay': 4.876628193594786e-07, 'epochs': 117, 'loss': 'mae', 'optimizer': 'adam', 'graph_mode': 'off', 'use_snp_selection': False}. Best is trial 12 with value: 0.37792280014389473.
[I 2025-12-06 03:32:48,249] Trial 20 finished with value: 0.36197746195277236 and parameters: {'model_type': 'mlp', 'hidden_dims': '[512, 256]', 'dropout': 0.33818288615525227, 'batch_norm': False, 'lr': 2.5757907733081407e-05, 'weight_decay': 0.0002062947245947731, 'epochs': 222, 'loss': 'mae', 'optimizer': 'adam', 'graph_mode': 'off', 'use_snp_selection': False}. Best is trial 12 with value: 0.37792280014389473.
[I 2025-12-06 03:33:53,142] Trial 21 finished with value: 0.3767366867772489 and parameters: {'model_type': 'mlp', 'hidden_dims': '[512, 64]', 'dropout': 0.5551594855246745, 'batch_norm': False, 'lr': 4.519831160634648e-06, 'weight_decay': 3.0177633609776977e-05, 'epochs': 315, 'loss': 'mae', 'optimizer': 'adam', 'graph_mode': 'off', 'use_snp_selection': False}. Best is trial 12 with value: 0.37792280014389473.
[I 2025-12-06 03:34:57,218] Trial 22 finished with value: 0.37183226967976946 and parameters: {'model_type': 'mlp', 'hidden_dims': '[512, 64]', 'dropout': 0.5954392114625428, 'batch_norm': False, 'lr': 6.964091851030654e-06, 'weight_decay': 2.234736040373779e-05, 'epochs': 312, 'loss': 'mae', 'optimizer': 'adam', 'graph_mode': 'off', 'use_snp_selection': False}. Best is trial 12 with value: 0.37792280014389473.
[I 2025-12-06 03:35:27,781] Trial 23 finished with value: 0.37831616130107265 and parameters: {'model_type': 'mlp', 'hidden_dims': '[256, 128]', 'dropout': 0.4687115068950107, 'batch_norm': False, 'lr': 3.1975085903370386e-06, 'weight_decay': 6.458127438044589e-06, 'epochs': 264, 'loss': 'mae', 'optimizer': 'adam', 'graph_mode': 'off', 'use_snp_selection': False}. Best is trial 23 with value: 0.37831616130107265.
[I 2025-12-06 03:35:58,801] Trial 24 finished with value: 0.37212514082977916 and parameters: {'model_type': 'mlp', 'hidden_dims': '[256, 128]', 'dropout': 0.46654996436896384, 'batch_norm': False, 'lr': 2.4629438610487043e-06, 'weight_decay': 6.3267936746880625e-06, 'epochs': 269, 'loss': 'mae', 'optimizer': 'adam', 'graph_mode': 'off', 'use_snp_selection': False}. Best is trial 23 with value: 0.37831616130107265.
[I 2025-12-06 03:36:24,074] Trial 25 finished with value: 0.3184120197303853 and parameters: {'model_type': 'mlp', 'hidden_dims': '[256, 128]', 'dropout': 0.5427931960582176, 'batch_norm': False, 'lr': 1.0459530900202556e-06, 'weight_decay': 2.522141218909002e-07, 'epochs': 212, 'loss': 'mae', 'optimizer': 'adam', 'graph_mode': 'off', 'use_snp_selection': False}. Best is trial 23 with value: 0.37831616130107265.
[I 2025-12-06 03:36:48,021] Trial 26 finished with value: 0.3580860529954351 and parameters: {'model_type': 'mlp', 'hidden_dims': '[256, 128]', 'dropout': 0.4697262009249123, 'batch_norm': False, 'lr': 1.3201000444066322e-05, 'weight_decay': 0.00015265805543382736, 'epochs': 254, 'loss': 'mae', 'optimizer': 'adam', 'graph_mode': 'off', 'use_snp_selection': True, 'num_snps': 3842}. Best is trial 23 with value: 0.37831616130107265.
[I 2025-12-06 03:37:21,369] Trial 27 finished with value: 0.3780913033248424 and parameters: {'model_type': 'mlp', 'hidden_dims': '[256, 128]', 'dropout': 0.5527137600228591, 'batch_norm': False, 'lr': 2.8719164399320746e-06, 'weight_decay': 7.481116540352853e-07, 'epochs': 296, 'loss': 'mae', 'optimizer': 'adam', 'graph_mode': 'off', 'use_snp_selection': False}. Best is trial 23 with value: 0.37831616130107265.
[I 2025-12-06 03:37:54,708] Trial 28 finished with value: 0.36955685903930735 and parameters: {'model_type': 'mlp', 'hidden_dims': '[256, 128]', 'dropout': 0.5603380350447117, 'batch_norm': False, 'lr': 2.8163257964294665e-06, 'weight_decay': 8.74418883788382e-07, 'epochs': 293, 'loss': 'mae', 'optimizer': 'adam', 'graph_mode': 'off', 'use_snp_selection': False}. Best is trial 23 with value: 0.37831616130107265.
[I 2025-12-06 03:38:25,483] Trial 29 finished with value: 0.35374724970918336 and parameters: {'model_type': 'mlp', 'hidden_dims': '[128, 64]', 'dropout': 0.3490505856826013, 'batch_norm': False, 'lr': 2.320440320155318e-06, 'weight_decay': 2.041497649889889e-07, 'epochs': 263, 'loss': 'mae', 'optimizer': 'adam', 'graph_mode': 'off', 'use_snp_selection': True, 'num_snps': 19468}. Best is trial 23 with value: 0.37831616130107265.
[I 2025-12-06 03:38:46,839] Trial 30 finished with value: 0.35103945377143314 and parameters: {'model_type': 'mlp', 'hidden_dims': '[256, 128]', 'dropout': 0.48673702411673736, 'batch_norm': False, 'lr': 1.7933089546484763e-06, 'weight_decay': 1.30719701537713e-06, 'epochs': 174, 'loss': 'mae', 'optimizer': 'adam', 'graph_mode': 'off', 'use_snp_selection': False}. Best is trial 23 with value: 0.37831616130107265.
[I 2025-12-06 03:39:24,383] Trial 31 finished with value: 0.3807914074474919 and parameters: {'model_type': 'mlp', 'hidden_dims': '[256, 128]', 'dropout': 0.5272754845820935, 'batch_norm': False, 'lr': 4.553089029254984e-06, 'weight_decay': 2.3067680642911222e-07, 'epochs': 335, 'loss': 'mae', 'optimizer': 'adam', 'graph_mode': 'off', 'use_snp_selection': False}. Best is trial 31 with value: 0.3807914074474919.
[I 2025-12-06 03:39:58,218] Trial 32 finished with value: 0.37454938816602323 and parameters: {'model_type': 'mlp', 'hidden_dims': '[256, 128]', 'dropout': 0.5212650934803831, 'batch_norm': False, 'lr': 8.629585196818524e-06, 'weight_decay': 1.8047293287110543e-07, 'epochs': 298, 'loss': 'mae', 'optimizer': 'adam', 'graph_mode': 'off', 'use_snp_selection': False}. Best is trial 31 with value: 0.3807914074474919.
[I 2025-12-06 03:40:35,730] Trial 33 finished with value: 0.3745268571209392 and parameters: {'model_type': 'mlp', 'hidden_dims': '[256, 128]', 'dropout': 0.4284764247594541, 'batch_norm': False, 'lr': 3.594804341147378e-06, 'weight_decay': 4.1975269430260015e-07, 'epochs': 332, 'loss': 'mae', 'optimizer': 'adam', 'graph_mode': 'off', 'use_snp_selection': False}. Best is trial 31 with value: 0.3807914074474919.
[I 2025-12-06 03:41:04,413] Trial 34 finished with value: 0.3674301977738078 and parameters: {'model_type': 'mlp', 'hidden_dims': '[256, 128]', 'dropout': 0.5617393157665047, 'batch_norm': False, 'lr': 2.05689560554885e-05, 'weight_decay': 9.119066699639817e-07, 'epochs': 249, 'loss': 'mae', 'optimizer': 'adam', 'graph_mode': 'off', 'use_snp_selection': False}. Best is trial 31 with value: 0.3807914074474919.
[I 2025-12-06 03:41:42,090] Trial 35 finished with value: 0.3400082170781066 and parameters: {'model_type': 'mlp', 'hidden_dims': '[256, 128, 64]', 'dropout': 0.45447594589168644, 'batch_norm': True, 'lr': 4.773598433381825e-06, 'weight_decay': 2.7409798576400434e-07, 'epochs': 329, 'loss': 'mae', 'optimizer': 'adam', 'graph_mode': 'off', 'use_snp_selection': False}. Best is trial 31 with value: 0.3807914074474919.
[I 2025-12-06 03:43:13,912] Trial 36 finished with value: 0.36700135144805185 and parameters: {'model_type': 'mlp', 'hidden_dims': '[512, 128]', 'dropout': 0.5672587025794391, 'batch_norm': False, 'lr': 1.1103755964332694e-06, 'weight_decay': 1.953903089863186e-06, 'epochs': 301, 'loss': 'mse', 'optimizer': 'adam', 'graph_mode': 'off', 'use_snp_selection': True, 'num_snps': 58661}. Best is trial 31 with value: 0.3807914074474919.
[I 2025-12-06 03:43:41,499] Trial 37 finished with value: 0.3697187936575996 and parameters: {'model_type': 'mlp', 'hidden_dims': '[256, 128]', 'dropout': 0.4151741957317869, 'batch_norm': False, 'lr': 1.1219296591572198e-05, 'weight_decay': 1.6786526798139783e-07, 'epochs': 236, 'loss': 'mae', 'optimizer': 'adam', 'graph_mode': 'off', 'use_snp_selection': False}. Best is trial 31 with value: 0.3807914074474919.
[I 2025-12-06 03:44:16,670] Trial 38 finished with value: 0.35286307908430403 and parameters: {'model_type': 'mlp', 'hidden_dims': '[256, 128]', 'dropout': 0.262570120236866, 'batch_norm': True, 'lr': 3.6580387219772745e-05, 'weight_decay': 6.688867640277432e-06, 'epochs': 266, 'loss': 'mse', 'optimizer': 'adam', 'graph_mode': 'off', 'use_snp_selection': True, 'num_snps': 19911}. Best is trial 31 with value: 0.3807914074474919.
[I 2025-12-06 03:44:36,203] Trial 39 finished with value: 0.3621877930628539 and parameters: {'model_type': 'mlp', 'hidden_dims': '[128, 64]', 'dropout': 0.3849764650828824, 'batch_norm': False, 'lr': 1.6603753638076759e-06, 'weight_decay': 8.530985554473756e-07, 'epochs': 285, 'loss': 'mae', 'optimizer': 'adam', 'graph_mode': 'off', 'use_snp_selection': False}. Best is trial 31 with value: 0.3807914074474919.
[I 2025-12-06 03:45:01,387] Trial 40 finished with value: 0.3485843466649506 and parameters: {'model_type': 'mlp', 'hidden_dims': '[256, 128]', 'dropout': 0.5191950820094192, 'batch_norm': True, 'lr': 0.00010299837783030175, 'weight_decay': 2.8388323581658355e-07, 'epochs': 209, 'loss': 'mae', 'optimizer': 'adam', 'graph_mode': 'off', 'use_snp_selection': False}. Best is trial 31 with value: 0.3807914074474919.
[I 2025-12-06 03:45:39,708] Trial 41 finished with value: 0.37463940013793073 and parameters: {'model_type': 'mlp', 'hidden_dims': '[256, 128, 64]', 'dropout': 0.5461161813724228, 'batch_norm': False, 'lr': 5.583233275361738e-06, 'weight_decay': 1.1092937818150672e-05, 'epochs': 342, 'loss': 'mae', 'optimizer': 'adam', 'graph_mode': 'off', 'use_snp_selection': False}. Best is trial 31 with value: 0.3807914074474919.
[I 2025-12-06 03:46:51,437] Trial 42 finished with value: 0.3812965317605793 and parameters: {'model_type': 'mlp', 'hidden_dims': '[512, 256]', 'dropout': 0.5985010571073133, 'batch_norm': False, 'lr': 3.9102011245341946e-06, 'weight_decay': 4.5131488439093965e-05, 'epochs': 350, 'loss': 'mae', 'optimizer': 'adam', 'graph_mode': 'off', 'use_snp_selection': False}. Best is trial 42 with value: 0.3812965317605793.
[I 2025-12-06 03:47:57,664] Trial 43 finished with value: 0.3781695807987632 and parameters: {'model_type': 'mlp', 'hidden_dims': '[512, 128]', 'dropout': 0.5822413148903726, 'batch_norm': False, 'lr': 2.1409924724993155e-06, 'weight_decay': 0.0006209168262732828, 'epochs': 322, 'loss': 'mae', 'optimizer': 'adam', 'graph_mode': 'off', 'use_snp_selection': False}. Best is trial 42 with value: 0.3812965317605793.
[I 2025-12-06 03:49:04,212] Trial 44 finished with value: 0.379956177867944 and parameters: {'model_type': 'mlp', 'hidden_dims': '[512, 128]', 'dropout': 0.5800457535408896, 'batch_norm': False, 'lr': 1.8955531656721164e-06, 'weight_decay': 0.0008103862493807889, 'epochs': 324, 'loss': 'mse', 'optimizer': 'adam', 'graph_mode': 'off', 'use_snp_selection': False}. Best is trial 42 with value: 0.3812965317605793.
[I 2025-12-06 03:50:10,812] Trial 45 finished with value: 0.37897825551900216 and parameters: {'model_type': 'mlp', 'hidden_dims': '[512, 128]', 'dropout': 0.5754880177444281, 'batch_norm': False, 'lr': 1.3911335012946455e-06, 'weight_decay': 0.0008299736543529963, 'epochs': 324, 'loss': 'mse', 'optimizer': 'adam', 'graph_mode': 'off', 'use_snp_selection': False}. Best is trial 42 with value: 0.3812965317605793.
[I 2025-12-06 03:51:19,591] Trial 46 finished with value: 0.3368147740679127 and parameters: {'model_type': 'mlp', 'hidden_dims': '[512, 128]', 'dropout': 0.5979414434786744, 'batch_norm': True, 'lr': 1.2366991803591396e-06, 'weight_decay': 0.0007899099553935574, 'epochs': 332, 'loss': 'mse', 'optimizer': 'adam', 'graph_mode': 'off', 'use_snp_selection': False}. Best is trial 42 with value: 0.3812965317605793.
[I 2025-12-06 03:52:23,349] Trial 47 finished with value: 0.37184655473587247 and parameters: {'model_type': 'mlp', 'hidden_dims': '[512, 128]', 'dropout': 0.47981792189754, 'batch_norm': False, 'lr': 3.8086546915492413e-06, 'weight_decay': 0.000484903929765236, 'epochs': 309, 'loss': 'mse', 'optimizer': 'adam', 'graph_mode': 'off', 'use_snp_selection': False}. Best is trial 42 with value: 0.3812965317605793.
[I 2025-12-06 03:53:33,935] Trial 48 finished with value: 0.38237390120361675 and parameters: {'model_type': 'mlp', 'hidden_dims': '[512, 128]', 'dropout': 0.575063479974382, 'batch_norm': False, 'lr': 1.480167628441852e-06, 'weight_decay': 0.000140157869439144, 'epochs': 345, 'loss': 'mse', 'optimizer': 'adam', 'graph_mode': 'off', 'use_snp_selection': False}. Best is trial 48 with value: 0.38237390120361675.
[I 2025-12-06 03:54:58,681] Trial 49 finished with value: 0.38025040986070685 and parameters: {'model_type': 'mlp', 'hidden_dims': '[512, 128]', 'dropout': 0.5726961738350907, 'batch_norm': False, 'lr': 1.6976537532073836e-06, 'weight_decay': 0.00029778332329383016, 'epochs': 350, 'loss': 'mse', 'optimizer': 'adam', 'graph_mode': 'off', 'use_snp_selection': True, 'num_snps': 46888}. Best is trial 48 with value: 0.38237390120361675.
[I 2025-12-06 03:56:22,112] Trial 50 finished with value: 0.3769842252668072 and parameters: {'model_type': 'mlp', 'hidden_dims': '[512, 128]', 'dropout': 0.5107868927692811, 'batch_norm': False, 'lr': 1.6056364646132123e-06, 'weight_decay': 0.00011742015837872966, 'epochs': 346, 'loss': 'mse', 'optimizer': 'adam', 'graph_mode': 'off', 'use_snp_selection': True, 'num_snps': 46345}. Best is trial 48 with value: 0.38237390120361675.
[I 2025-12-06 03:57:47,381] Trial 51 finished with value: 0.37982994994249186 and parameters: {'model_type': 'mlp', 'hidden_dims': '[512, 128]', 'dropout': 0.5748842161662149, 'batch_norm': False, 'lr': 1.4326875173721168e-06, 'weight_decay': 0.00030529780728433763, 'epochs': 350, 'loss': 'mse', 'optimizer': 'adam', 'graph_mode': 'off', 'use_snp_selection': True, 'num_snps': 47105}. Best is trial 48 with value: 0.38237390120361675.
[I 2025-12-06 03:59:13,296] Trial 52 finished with value: 0.38377765493411103 and parameters: {'model_type': 'mlp', 'hidden_dims': '[512, 128]', 'dropout': 0.5727620495620388, 'batch_norm': False, 'lr': 1.9841376164070182e-06, 'weight_decay': 0.00033045204239733484, 'epochs': 350, 'loss': 'mse', 'optimizer': 'adam', 'graph_mode': 'off', 'use_snp_selection': True, 'num_snps': 47821}. Best is trial 52 with value: 0.38377765493411103.
[I 2025-12-06 04:00:43,029] Trial 53 finished with value: 0.3836051637340162 and parameters: {'model_type': 'mlp', 'hidden_dims': '[512, 128]', 'dropout': 0.5367907751765139, 'batch_norm': False, 'lr': 1.9270120444129324e-06, 'weight_decay': 0.00021042138649318706, 'epochs': 336, 'loss': 'mse', 'optimizer': 'adam', 'graph_mode': 'off', 'use_snp_selection': True, 'num_snps': 51847}. Best is trial 52 with value: 0.38377765493411103.
[I 2025-12-06 04:02:10,976] Trial 54 finished with value: 0.3808786385708892 and parameters: {'model_type': 'mlp', 'hidden_dims': '[512, 128]', 'dropout': 0.5416864066587943, 'batch_norm': False, 'lr': 2.207839870561214e-06, 'weight_decay': 0.00011663528930737276, 'epochs': 337, 'loss': 'mse', 'optimizer': 'adam', 'graph_mode': 'off', 'use_snp_selection': True, 'num_snps': 50992}. Best is trial 52 with value: 0.38377765493411103.
[I 2025-12-06 04:02:54,780] Trial 55 finished with value: 0.28204969244468014 and parameters: {'model_type': 'mlp', 'hidden_dims': '[512, 128]', 'dropout': 0.5324865244775572, 'batch_norm': False, 'lr': 2.2020751869467237e-06, 'weight_decay': 9.369975531599866e-05, 'epochs': 46, 'loss': 'mse', 'optimizer': 'adam', 'graph_mode': 'off', 'use_snp_selection': True, 'num_snps': 53698}. Best is trial 52 with value: 0.38377765493411103.
[I 2025-12-06 04:04:05,064] Trial 56 finished with value: 0.3624879189639711 and parameters: {'model_type': 'mlp', 'hidden_dims': '[512, 256]', 'dropout': 0.5375536067870582, 'batch_norm': False, 'lr': 6.087906877678181e-06, 'weight_decay': 4.4382891062158476e-05, 'epochs': 337, 'loss': 'mse', 'optimizer': 'adam', 'graph_mode': 'off', 'use_snp_selection': True, 'num_snps': 37346}. Best is trial 52 with value: 0.38377765493411103.
[I 2025-12-06 04:05:32,529] Trial 57 finished with value: 0.3435491038273937 and parameters: {'model_type': 'mlp', 'hidden_dims': '[512, 128]', 'dropout': 0.5038716205672205, 'batch_norm': True, 'lr': 2.7297239947066596e-06, 'weight_decay': 0.00017944094011101644, 'epochs': 310, 'loss': 'mse', 'optimizer': 'adam', 'graph_mode': 'off', 'use_snp_selection': True, 'num_snps': 52781}. Best is trial 52 with value: 0.38377765493411103.
[I 2025-12-06 04:06:45,384] Trial 58 finished with value: 0.3516525554731366 and parameters: {'model_type': 'mlp', 'hidden_dims': '[512, 128]', 'dropout': 0.19553274374383128, 'batch_norm': False, 'lr': 4.0964359395379865e-06, 'weight_decay': 0.0004363618885479025, 'epochs': 336, 'loss': 'mse', 'optimizer': 'adam', 'graph_mode': 'off', 'use_snp_selection': True, 'num_snps': 39323}. Best is trial 52 with value: 0.38377765493411103.
[I 2025-12-06 04:08:12,772] Trial 59 finished with value: 0.36693522792467465 and parameters: {'model_type': 'mlp', 'hidden_dims': '[512, 256]', 'dropout': 0.5969778911545439, 'batch_norm': False, 'lr': 1.1099068900936585e-06, 'weight_decay': 3.587952894062993e-05, 'epochs': 318, 'loss': 'mse', 'optimizer': 'adam', 'graph_mode': 'off', 'use_snp_selection': True, 'num_snps': 52027}. Best is trial 52 with value: 0.38377765493411103.
[I 2025-12-06 04:08:56,748] Trial 60 finished with value: 0.3662377064243308 and parameters: {'model_type': 'mlp', 'hidden_dims': '[512, 128]', 'dropout': 0.490824272631388, 'batch_norm': False, 'lr': 3.505325295175498e-06, 'weight_decay': 6.759590985661486e-05, 'epochs': 83, 'loss': 'mse', 'optimizer': 'adam', 'graph_mode': 'off', 'use_snp_selection': True, 'num_snps': 42171}. Best is trial 52 with value: 0.38377765493411103.
[I 2025-12-06 04:10:24,203] Trial 61 finished with value: 0.3803823636357094 and parameters: {'model_type': 'mlp', 'hidden_dims': '[512, 128]', 'dropout': 0.5509382083182323, 'batch_norm': False, 'lr': 1.9886469727870863e-06, 'weight_decay': 0.00023816276600630072, 'epochs': 349, 'loss': 'mse', 'optimizer': 'adam', 'graph_mode': 'off', 'use_snp_selection': True, 'num_snps': 48690}. Best is trial 52 with value: 0.38377765493411103.
[I 2025-12-06 04:11:52,933] Trial 62 finished with value: 0.3800236539354543 and parameters: {'model_type': 'mlp', 'hidden_dims': '[512, 128]', 'dropout': 0.5477915183176015, 'batch_norm': False, 'lr': 2.1538144809197673e-06, 'weight_decay': 0.00023051330715538184, 'epochs': 338, 'loss': 'mse', 'optimizer': 'adam', 'graph_mode': 'off', 'use_snp_selection': True, 'num_snps': 51029}. Best is trial 52 with value: 0.38377765493411103.
[I 2025-12-06 04:13:23,075] Trial 63 finished with value: 0.38051731295917274 and parameters: {'model_type': 'mlp', 'hidden_dims': '[512, 128]', 'dropout': 0.5223892552687571, 'batch_norm': False, 'lr': 1.3923901907685107e-06, 'weight_decay': 0.00013613683160019227, 'epochs': 306, 'loss': 'mse', 'optimizer': 'adam', 'graph_mode': 'off', 'use_snp_selection': True, 'num_snps': 56222}. Best is trial 52 with value: 0.38377765493411103.
[I 2025-12-06 04:14:57,312] Trial 64 finished with value: 0.37013139737597384 and parameters: {'model_type': 'mlp', 'hidden_dims': '[512, 128]', 'dropout': 0.5176496465426764, 'batch_norm': False, 'lr': 1.0119366351289508e-06, 'weight_decay': 0.00012238723848367324, 'epochs': 304, 'loss': 'mse', 'optimizer': 'adam', 'graph_mode': 'off', 'use_snp_selection': True, 'num_snps': 59824}. Best is trial 52 with value: 0.38377765493411103.
[I 2025-12-06 04:16:30,522] Trial 65 finished with value: 0.37615733738796614 and parameters: {'model_type': 'mlp', 'hidden_dims': '[512, 256]', 'dropout': 0.5311511708770714, 'batch_norm': False, 'lr': 1.373489870505174e-06, 'weight_decay': 0.00014041518785724952, 'epochs': 327, 'loss': 'mse', 'optimizer': 'adam', 'graph_mode': 'off', 'use_snp_selection': True, 'num_snps': 55309}. Best is trial 52 with value: 0.38377765493411103.
[I 2025-12-06 04:18:04,361] Trial 66 finished with value: 0.36809797610666456 and parameters: {'model_type': 'mlp', 'hidden_dims': '[512, 64]', 'dropout': 0.3152612961561141, 'batch_norm': False, 'lr': 2.5075771134829805e-06, 'weight_decay': 9.843532565597994e-05, 'epochs': 319, 'loss': 'mse', 'optimizer': 'adam', 'graph_mode': 'off', 'use_snp_selection': True, 'num_snps': 55786}. Best is trial 52 with value: 0.38377765493411103.
[I 2025-12-06 04:18:51,025] Trial 67 finished with value: 0.0 and parameters: {'model_type': 'mlp', 'hidden_dims': '[128, 64]', 'dropout': 0.5614711718709352, 'batch_norm': False, 'lr': 0.0008925222241173445, 'weight_decay': 1.9166632235581406e-05, 'epochs': 286, 'loss': 'mse', 'optimizer': 'adam', 'graph_mode': 'off', 'use_snp_selection': True, 'num_snps': 50003}. Best is trial 52 with value: 0.38377765493411103.
