[I 2025-12-05 15:11:11,814] Trial 100 finished with value: 0.04815462878289928 and parameters: {'model_type': 'mlp', 'hidden_dims': '[512, 256]', 'dropout': 0.2319472605297582, 'batch_norm': True, 'lr': 1.9647323018058756e-05, 'weight_decay': 5.177369813615312e-05, 'epochs': 253, 'loss': 'mae', 'optimizer': 'adam', 'graph_mode': 'off', 'use_snp_selection': False}. Best is trial 40 with value: 0.07016881205196591.
[I 2025-12-05 15:11:13,141] Trial 101 finished with value: 0.044625173834161216 and parameters: {'model_type': 'mlp', 'hidden_dims': '[512, 128]', 'dropout': 0.45371362394410397, 'batch_norm': False, 'lr': 0.00021740757892708498, 'weight_decay': 2.6382448539955882e-05, 'epochs': 111, 'loss': 'mae', 'optimizer': 'adam', 'graph_mode': 'off', 'use_snp_selection': False}. Best is trial 40 with value: 0.07016881205196591.
[I 2025-12-05 15:11:14,550] Trial 102 finished with value: 0.012385139077700263 and parameters: {'model_type': 'mlp', 'hidden_dims': '[512, 128]', 'dropout': 0.40595519617494275, 'batch_norm': False, 'lr': 2.93417743084399e-06, 'weight_decay': 1.7780309737828182e-05, 'epochs': 126, 'loss': 'mae', 'optimizer': 'adam', 'graph_mode': 'off', 'use_snp_selection': False}. Best is trial 40 with value: 0.07016881205196591.
[I 2025-12-05 15:11:15,991] Trial 103 finished with value: 0.028631623316823604 and parameters: {'model_type': 'mlp', 'hidden_dims': '[512, 128]', 'dropout': 0.4697147700623318, 'batch_norm': False, 'lr': 2.127145886744375e-06, 'weight_decay': 9.20090542111611e-07, 'epochs': 131, 'loss': 'mae', 'optimizer': 'adam', 'graph_mode': 'off', 'use_snp_selection': False}. Best is trial 40 with value: 0.07016881205196591.
[I 2025-12-05 15:11:17,259] Trial 104 finished with value: 0.04526827174524018 and parameters: {'model_type': 'mlp', 'hidden_dims': '[512, 128]', 'dropout': 0.49588795236456323, 'batch_norm': False, 'lr': 1.2833499726189409e-05, 'weight_decay': 8.05369512101842e-06, 'epochs': 99, 'loss': 'mae', 'optimizer': 'adam', 'graph_mode': 'off', 'use_snp_selection': False}. Best is trial 40 with value: 0.07016881205196591.
[I 2025-12-05 15:11:19,440] Trial 105 finished with value: 0.021114172333648495 and parameters: {'model_type': 'mlp', 'hidden_dims': '[512, 128]', 'dropout': 0.45607762901217325, 'batch_norm': False, 'lr': 1.712197451467136e-06, 'weight_decay': 3.300799149211151e-07, 'epochs': 74, 'loss': 'mae', 'optimizer': 'adam', 'graph_mode': 'off', 'use_snp_selection': True, 'num_snps': 37669}. Best is trial 40 with value: 0.07016881205196591.
[I 2025-12-05 15:11:22,054] Trial 106 finished with value: 0.014483225997433553 and parameters: {'model_type': 'mlp', 'hidden_dims': '[512, 128]', 'dropout': 0.48855496671039933, 'batch_norm': False, 'lr': 2.5411975477209518e-05, 'weight_decay': 1.9509225575494115e-05, 'epochs': 332, 'loss': 'mae', 'optimizer': 'adam', 'graph_mode': 'off', 'use_snp_selection': False}. Best is trial 40 with value: 0.07016881205196591.
[I 2025-12-05 15:11:23,024] Trial 107 finished with value: 0.025651473128451258 and parameters: {'model_type': 'mlp', 'hidden_dims': '[256, 128]', 'dropout': 0.4329417739386353, 'batch_norm': True, 'lr': 9.263198015595773e-06, 'weight_decay': 7.047417671702547e-05, 'epochs': 141, 'loss': 'mae', 'optimizer': 'adam', 'graph_mode': 'off', 'use_snp_selection': False}. Best is trial 40 with value: 0.07016881205196591.
[I 2025-12-05 15:11:24,220] Trial 108 finished with value: 0.0022433665126666397 and parameters: {'model_type': 'mlp', 'hidden_dims': '[512, 64]', 'dropout': 0.5527385648901851, 'batch_norm': False, 'lr': 3.7782308265536e-06, 'weight_decay': 6.635337627882761e-07, 'epochs': 88, 'loss': 'mae', 'optimizer': 'adam', 'graph_mode': 'off', 'use_snp_selection': False}. Best is trial 40 with value: 0.07016881205196591.
[I 2025-12-05 15:11:26,454] Trial 109 finished with value: 0.039030751762686694 and parameters: {'model_type': 'mlp', 'hidden_dims': '[512, 128]', 'dropout': 0.5051684480646482, 'batch_norm': False, 'lr': 2.7153479921334535e-06, 'weight_decay': 1.4931964116403018e-05, 'epochs': 271, 'loss': 'mse', 'optimizer': 'adam', 'graph_mode': 'off', 'use_snp_selection': False}. Best is trial 40 with value: 0.07016881205196591.
[I 2025-12-05 15:11:27,152] Trial 110 finished with value: 0.03751492131495122 and parameters: {'model_type': 'mlp', 'hidden_dims': '[128, 64]', 'dropout': 0.34567008597641063, 'batch_norm': False, 'lr': 4.834436732562293e-06, 'weight_decay': 5.704463577126177e-06, 'epochs': 116, 'loss': 'mae', 'optimizer': 'adam', 'graph_mode': 'off', 'use_snp_selection': False}. Best is trial 40 with value: 0.07016881205196591.
[I 2025-12-05 15:11:29,675] Trial 111 finished with value: 0.057242006774077425 and parameters: {'model_type': 'mlp', 'hidden_dims': '[512, 64]', 'dropout': 0.5982955963884715, 'batch_norm': False, 'lr': 7.855262692548683e-06, 'weight_decay': 3.985351136471872e-05, 'epochs': 318, 'loss': 'mae', 'optimizer': 'adam', 'graph_mode': 'off', 'use_snp_selection': False}. Best is trial 40 with value: 0.07016881205196591.
[I 2025-12-05 15:11:32,167] Trial 112 finished with value: 0.05107860218399347 and parameters: {'model_type': 'mlp', 'hidden_dims': '[512, 64]', 'dropout': 0.5712034467432279, 'batch_norm': False, 'lr': 6.116017002969665e-06, 'weight_decay': 3.802557832277255e-05, 'epochs': 311, 'loss': 'mae', 'optimizer': 'adam', 'graph_mode': 'off', 'use_snp_selection': False}. Best is trial 40 with value: 0.07016881205196591.
[I 2025-12-05 15:11:34,638] Trial 113 finished with value: 0.041026672453520464 and parameters: {'model_type': 'mlp', 'hidden_dims': '[512, 64]', 'dropout': 0.5701893481664668, 'batch_norm': False, 'lr': 6.024127910815178e-06, 'weight_decay': 4.161521545983574e-05, 'epochs': 309, 'loss': 'mae', 'optimizer': 'adam', 'graph_mode': 'off', 'use_snp_selection': False}. Best is trial 40 with value: 0.07016881205196591.
[I 2025-12-05 15:11:37,107] Trial 114 finished with value: 0.04027147442891549 and parameters: {'model_type': 'mlp', 'hidden_dims': '[512, 64]', 'dropout': 0.5827113258303834, 'batch_norm': False, 'lr': 7.489751801142616e-06, 'weight_decay': 0.00011233095063477244, 'epochs': 314, 'loss': 'mae', 'optimizer': 'adam', 'graph_mode': 'off', 'use_snp_selection': False}. Best is trial 40 with value: 0.07016881205196591.
[I 2025-12-05 15:11:39,700] Trial 115 finished with value: 0.0738742669983921 and parameters: {'model_type': 'mlp', 'hidden_dims': '[512, 64]', 'dropout': 0.5889407323663963, 'batch_norm': False, 'lr': 9.110465329519643e-06, 'weight_decay': 4.8468091577554226e-05, 'epochs': 336, 'loss': 'mae', 'optimizer': 'adam', 'graph_mode': 'off', 'use_snp_selection': False}. Best is trial 115 with value: 0.0738742669983921.
[I 2025-12-05 15:11:42,274] Trial 116 finished with value: 0.006642175164144609 and parameters: {'model_type': 'mlp', 'hidden_dims': '[512, 64]', 'dropout': 0.5872064434261683, 'batch_norm': False, 'lr': 1.1292310400030248e-05, 'weight_decay': 8.911493283993945e-05, 'epochs': 322, 'loss': 'mae', 'optimizer': 'adam', 'graph_mode': 'off', 'use_snp_selection': False}. Best is trial 115 with value: 0.0738742669983921.
[I 2025-12-05 15:11:44,926] Trial 117 finished with value: 0.062459438974626184 and parameters: {'model_type': 'mlp', 'hidden_dims': '[512, 64]', 'dropout': 0.5830361097596142, 'batch_norm': False, 'lr': 1.5573747029899787e-05, 'weight_decay': 4.8033861054045955e-05, 'epochs': 339, 'loss': 'mae', 'optimizer': 'adam', 'graph_mode': 'off', 'use_snp_selection': False}. Best is trial 115 with value: 0.0738742669983921.
[I 2025-12-05 15:11:47,529] Trial 118 finished with value: 0.02260198611711575 and parameters: {'model_type': 'mlp', 'hidden_dims': '[512, 64]', 'dropout': 0.55861783908371, 'batch_norm': False, 'lr': 1.016791437525538e-05, 'weight_decay': 4.728449089864046e-05, 'epochs': 336, 'loss': 'mae', 'optimizer': 'adam', 'graph_mode': 'off', 'use_snp_selection': False}. Best is trial 115 with value: 0.0738742669983921.
[I 2025-12-05 15:11:50,202] Trial 119 finished with value: 0.012901859763884407 and parameters: {'model_type': 'mlp', 'hidden_dims': '[512, 64]', 'dropout': 0.5990127129355303, 'batch_norm': False, 'lr': 1.575294466979492e-05, 'weight_decay': 2.440066567304489e-05, 'epochs': 350, 'loss': 'mae', 'optimizer': 'adam', 'graph_mode': 'off', 'use_snp_selection': False}. Best is trial 115 with value: 0.0738742669983921.
[I 2025-12-05 15:11:52,783] Trial 120 finished with value: 0.012612888185501943 and parameters: {'model_type': 'mlp', 'hidden_dims': '[512, 64]', 'dropout': 0.5875994584570404, 'batch_norm': False, 'lr': 1.997073675131812e-05, 'weight_decay': 3.007152197427411e-05, 'epochs': 334, 'loss': 'mae', 'optimizer': 'adam', 'graph_mode': 'off', 'use_snp_selection': False}. Best is trial 115 with value: 0.0738742669983921.
[I 2025-12-05 15:11:55,459] Trial 121 finished with value: 0.055002663181590604 and parameters: {'model_type': 'mlp', 'hidden_dims': '[512, 64]', 'dropout': 0.5810454301801724, 'batch_norm': False, 'lr': 1.3858411741161592e-05, 'weight_decay': 6.587972906421037e-05, 'epochs': 342, 'loss': 'mae', 'optimizer': 'adam', 'graph_mode': 'off', 'use_snp_selection': False}. Best is trial 115 with value: 0.0738742669983921.
[I 2025-12-05 15:11:58,120] Trial 122 finished with value: 0.03713005627413493 and parameters: {'model_type': 'mlp', 'hidden_dims': '[512, 64]', 'dropout': 0.5803351911048218, 'batch_norm': False, 'lr': 8.734435684717829e-06, 'weight_decay': 0.00017096776247103965, 'epochs': 342, 'loss': 'mae', 'optimizer': 'adam', 'graph_mode': 'off', 'use_snp_selection': False}. Best is trial 115 with value: 0.0738742669983921.
[I 2025-12-05 15:12:00,638] Trial 123 finished with value: 0.04208619305923236 and parameters: {'model_type': 'mlp', 'hidden_dims': '[512, 64]', 'dropout': 0.5275142199105253, 'batch_norm': False, 'lr': 1.478062109264403e-05, 'weight_decay': 7.41289784039526e-05, 'epochs': 322, 'loss': 'mae', 'optimizer': 'adam', 'graph_mode': 'off', 'use_snp_selection': False}. Best is trial 115 with value: 0.0738742669983921.
[I 2025-12-05 15:12:03,182] Trial 124 finished with value: 0.021753238227023512 and parameters: {'model_type': 'mlp', 'hidden_dims': '[512, 64]', 'dropout': 0.5624003683315748, 'batch_norm': False, 'lr': 1.2495487664141854e-05, 'weight_decay': 5.987584179147873e-05, 'epochs': 327, 'loss': 'mae', 'optimizer': 'adam', 'graph_mode': 'off', 'use_snp_selection': False}. Best is trial 115 with value: 0.0738742669983921.
[I 2025-12-05 15:12:04,571] Trial 125 finished with value: 0.045966251849849565 and parameters: {'model_type': 'mlp', 'hidden_dims': '[512, 64]', 'dropout': 0.5514396390656578, 'batch_norm': False, 'lr': 1.376029016287372e-05, 'weight_decay': 5.221542536940869e-05, 'epochs': 343, 'loss': 'mae', 'optimizer': 'adam', 'graph_mode': 'off', 'use_snp_selection': True, 'num_snps': 12134}. Best is trial 115 with value: 0.0738742669983921.
[I 2025-12-05 15:12:07,212] Trial 126 finished with value: 0.02877759714623714 and parameters: {'model_type': 'mlp', 'hidden_dims': '[512, 64]', 'dropout': 0.5910938783882944, 'batch_norm': False, 'lr': 2.3848366773296223e-05, 'weight_decay': 3.254261183346894e-05, 'epochs': 336, 'loss': 'mse', 'optimizer': 'adam', 'graph_mode': 'off', 'use_snp_selection': False}. Best is trial 115 with value: 0.0738742669983921.
[I 2025-12-05 15:12:09,744] Trial 127 finished with value: 0.04721094491157954 and parameters: {'model_type': 'mlp', 'hidden_dims': '[512, 64]', 'dropout': 0.5371495462838516, 'batch_norm': False, 'lr': 8.514155532127757e-06, 'weight_decay': 0.0001553165449847447, 'epochs': 317, 'loss': 'mae', 'optimizer': 'adam', 'graph_mode': 'off', 'use_snp_selection': False}. Best is trial 115 with value: 0.0738742669983921.
[I 2025-12-05 15:12:12,421] Trial 128 finished with value: 0.04880671125089853 and parameters: {'model_type': 'mlp', 'hidden_dims': '[512, 64]', 'dropout': 0.5674504371338801, 'batch_norm': False, 'lr': 2.9516852556705006e-05, 'weight_decay': 3.409751974774062e-06, 'epochs': 349, 'loss': 'mae', 'optimizer': 'adam', 'graph_mode': 'off', 'use_snp_selection': False}. Best is trial 115 with value: 0.0738742669983921.
[I 2025-12-05 15:12:13,785] Trial 129 finished with value: 0.05994177209026504 and parameters: {'model_type': 'mlp', 'hidden_dims': '[256, 128]', 'dropout': 0.5447707451359286, 'batch_norm': False, 'lr': 1.868347552173854e-05, 'weight_decay': 8.696117629905306e-05, 'epochs': 292, 'loss': 'mae', 'optimizer': 'adam', 'graph_mode': 'off', 'use_snp_selection': False}. Best is trial 115 with value: 0.0738742669983921.
[I 2025-12-05 15:12:15,155] Trial 130 finished with value: 0.04667721012964851 and parameters: {'model_type': 'mlp', 'hidden_dims': '[256, 128]', 'dropout': 0.5276137368641928, 'batch_norm': False, 'lr': 1.0714374568090374e-05, 'weight_decay': 7.924545379637894e-05, 'epochs': 296, 'loss': 'mae', 'optimizer': 'adam', 'graph_mode': 'off', 'use_snp_selection': False}. Best is trial 115 with value: 0.0738742669983921.
[I 2025-12-05 15:12:16,541] Trial 131 finished with value: 0.020815569252968652 and parameters: {'model_type': 'mlp', 'hidden_dims': '[256, 128]', 'dropout': 0.5434984651691264, 'batch_norm': False, 'lr': 1.7003285324235375e-05, 'weight_decay': 6.423210877108822e-05, 'epochs': 304, 'loss': 'mae', 'optimizer': 'adam', 'graph_mode': 'off', 'use_snp_selection': False}. Best is trial 115 with value: 0.0738742669983921.
[I 2025-12-05 15:12:18,015] Trial 132 finished with value: 0.03512508333407702 and parameters: {'model_type': 'mlp', 'hidden_dims': '[256, 128]', 'dropout': 0.5135292794755305, 'batch_norm': False, 'lr': 3.77076037780029e-05, 'weight_decay': 4.398441755363553e-05, 'epochs': 323, 'loss': 'mae', 'optimizer': 'adam', 'graph_mode': 'off', 'use_snp_selection': False}. Best is trial 115 with value: 0.0738742669983921.
[I 2025-12-05 15:12:19,286] Trial 133 finished with value: 0.027647439754203293 and parameters: {'model_type': 'mlp', 'hidden_dims': '[256, 128]', 'dropout': 0.5973446015472939, 'batch_norm': False, 'lr': 1.9995477743397852e-05, 'weight_decay': 8.749369358860407e-05, 'epochs': 239, 'loss': 'mae', 'optimizer': 'adam', 'graph_mode': 'off', 'use_snp_selection': False}. Best is trial 115 with value: 0.0738742669983921.
[I 2025-12-05 15:12:21,888] Trial 134 finished with value: 0.038476447438503154 and parameters: {'model_type': 'mlp', 'hidden_dims': '[512, 64]', 'dropout': 0.5766329041898962, 'batch_norm': False, 'lr': 1.464648388711221e-05, 'weight_decay': 0.00011751219776566742, 'epochs': 331, 'loss': 'mae', 'optimizer': 'adam', 'graph_mode': 'off', 'use_snp_selection': False}. Best is trial 115 with value: 0.0738742669983921.
[I 2025-12-05 15:12:23,390] Trial 135 finished with value: 0.02862463725532039 and parameters: {'model_type': 'mlp', 'hidden_dims': '[256, 128, 64]', 'dropout': 0.500761504688955, 'batch_norm': False, 'lr': 0.00016203649192979142, 'weight_decay': 3.384284527799671e-05, 'epochs': 342, 'loss': 'mae', 'optimizer': 'adam', 'graph_mode': 'off', 'use_snp_selection': False}. Best is trial 115 with value: 0.0738742669983921.
[I 2025-12-05 15:12:24,803] Trial 136 finished with value: 0.03771143748257407 and parameters: {'model_type': 'mlp', 'hidden_dims': '[256, 128]', 'dropout': 0.5618241454609165, 'batch_norm': False, 'lr': 1.3054206580822854e-05, 'weight_decay': 5.375031229182395e-05, 'epochs': 315, 'loss': 'mae', 'optimizer': 'adam', 'graph_mode': 'off', 'use_snp_selection': False}. Best is trial 115 with value: 0.0738742669983921.
[I 2025-12-05 15:12:27,414] Trial 137 finished with value: 0.01680220851393402 and parameters: {'model_type': 'mlp', 'hidden_dims': '[512, 64]', 'dropout': 0.516976298462105, 'batch_norm': False, 'lr': 0.00019914752535826207, 'weight_decay': 9.73758002567311e-05, 'epochs': 339, 'loss': 'mse', 'optimizer': 'adam', 'graph_mode': 'off', 'use_snp_selection': False}. Best is trial 115 with value: 0.0738742669983921.
[I 2025-12-05 15:12:29,814] Trial 138 finished with value: 0.04299615318594866 and parameters: {'model_type': 'mlp', 'hidden_dims': '[512, 256]', 'dropout': 0.5463198254586304, 'batch_norm': False, 'lr': 9.65524160603337e-06, 'weight_decay': 2.5143165524947023e-05, 'epochs': 291, 'loss': 'mae', 'optimizer': 'adam', 'graph_mode': 'off', 'use_snp_selection': False}. Best is trial 115 with value: 0.0738742669983921.
[I 2025-12-05 15:12:32,140] Trial 139 finished with value: 0.026007064747067977 and parameters: {'model_type': 'mlp', 'hidden_dims': '[512, 64]', 'dropout': 0.48191132903251693, 'batch_norm': False, 'lr': 1.822127855536983e-05, 'weight_decay': 4.277775953068733e-06, 'epochs': 282, 'loss': 'mae', 'optimizer': 'adam', 'graph_mode': 'off', 'use_snp_selection': False}. Best is trial 115 with value: 0.0738742669983921.
[I 2025-12-05 15:12:33,187] Trial 140 finished with value: 0.0467235814809823 and parameters: {'model_type': 'mlp', 'hidden_dims': '[256, 128]', 'dropout': 0.24358680554805828, 'batch_norm': False, 'lr': 2.223571887116464e-05, 'weight_decay': 1.953044818701837e-06, 'epochs': 166, 'loss': 'mae', 'optimizer': 'adam', 'graph_mode': 'off', 'use_snp_selection': False}. Best is trial 115 with value: 0.0738742669983921.
[I 2025-12-05 15:12:35,765] Trial 141 finished with value: 0.039930778268808434 and parameters: {'model_type': 'mlp', 'hidden_dims': '[512, 128]', 'dropout': 0.11345206828189808, 'batch_norm': True, 'lr': 7.411577719004318e-06, 'weight_decay': 1.2616864463851722e-06, 'epochs': 328, 'loss': 'mae', 'optimizer': 'adam', 'graph_mode': 'off', 'use_snp_selection': False}. Best is trial 115 with value: 0.0738742669983921.
[I 2025-12-05 15:12:37,303] Trial 142 finished with value: 0.020697657191634796 and parameters: {'model_type': 'mlp', 'hidden_dims': '[512, 64]', 'dropout': 0.5837190360064908, 'batch_norm': True, 'lr': 1.2160790387671017e-05, 'weight_decay': 9.585312496200124e-07, 'epochs': 147, 'loss': 'mae', 'optimizer': 'adam', 'graph_mode': 'off', 'use_snp_selection': False}. Best is trial 115 with value: 0.0738742669983921.
[I 2025-12-05 15:12:39,028] Trial 143 finished with value: 0.0017581725830117722 and parameters: {'model_type': 'mlp', 'hidden_dims': '[512, 128]', 'dropout': 0.5285281009994506, 'batch_norm': True, 'lr': 8.530526470097651e-06, 'weight_decay': 5.915405020368178e-07, 'epochs': 180, 'loss': 'mae', 'optimizer': 'adam', 'graph_mode': 'off', 'use_snp_selection': False}. Best is trial 115 with value: 0.0738742669983921.
[I 2025-12-05 15:12:41,463] Trial 144 finished with value: 0.05833258602037112 and parameters: {'model_type': 'mlp', 'hidden_dims': '[512, 64]', 'dropout': 0.5079216710949859, 'batch_norm': False, 'lr': 0.0002692822638471901, 'weight_decay': 7.977992137370373e-07, 'epochs': 302, 'loss': 'mae', 'optimizer': 'adam', 'graph_mode': 'off', 'use_snp_selection': False}. Best is trial 115 with value: 0.0738742669983921.
[I 2025-12-05 15:12:43,906] Trial 145 finished with value: 0.03635880660712306 and parameters: {'model_type': 'mlp', 'hidden_dims': '[512, 64]', 'dropout': 0.4934480044345051, 'batch_norm': False, 'lr': 0.0002831683051629651, 'weight_decay': 1.5891758223904048e-06, 'epochs': 306, 'loss': 'mae', 'optimizer': 'adam', 'graph_mode': 'off', 'use_snp_selection': False}. Best is trial 115 with value: 0.0738742669983921.
[I 2025-12-05 15:12:46,296] Trial 146 finished with value: 0.04566962471759235 and parameters: {'model_type': 'mlp', 'hidden_dims': '[512, 64]', 'dropout': 0.5071758889752651, 'batch_norm': False, 'lr': 0.00038188251469890963, 'weight_decay': 7.313802449459989e-07, 'epochs': 300, 'loss': 'mae', 'optimizer': 'adam', 'graph_mode': 'off', 'use_snp_selection': False}. Best is trial 115 with value: 0.0738742669983921.
[I 2025-12-05 15:12:48,386] Trial 147 finished with value: 0.02652723770393907 and parameters: {'model_type': 'mlp', 'hidden_dims': '[512, 64]', 'dropout': 0.4708737488454775, 'batch_norm': False, 'lr': 0.00025033368868926245, 'weight_decay': 4.475775328788917e-07, 'epochs': 319, 'loss': 'mae', 'optimizer': 'adam', 'graph_mode': 'off', 'use_snp_selection': True, 'num_snps': 26371}. Best is trial 115 with value: 0.0738742669983921.
[I 2025-12-05 15:12:50,875] Trial 148 finished with value: 0.028205243098360644 and parameters: {'model_type': 'mlp', 'hidden_dims': '[512, 64]', 'dropout': 0.4905930996034219, 'batch_norm': False, 'lr': 0.0005427401607723307, 'weight_decay': 3.9192077954568114e-05, 'epochs': 311, 'loss': 'mae', 'optimizer': 'adam', 'graph_mode': 'off', 'use_snp_selection': False}. Best is trial 115 with value: 0.0738742669983921.
[I 2025-12-05 15:12:51,714] Trial 149 finished with value: 0.06916364609934111 and parameters: {'model_type': 'mlp', 'hidden_dims': '[256, 128]', 'dropout': 0.5199326990879432, 'batch_norm': False, 'lr': 0.00031619853353860724, 'weight_decay': 1.0346576216528338e-06, 'epochs': 83, 'loss': 'mse', 'optimizer': 'adam', 'graph_mode': 'off', 'use_snp_selection': False}. Best is trial 115 with value: 0.0738742669983921.
[I 2025-12-05 15:12:54,042] Trial 0 finished with value: 0.02359372552777386 and parameters: {'model_type': 'mlp', 'hidden_dims': '[128, 64]', 'dropout': 0.199031432379812, 'batch_norm': True, 'lr': 1.8408544111075837e-06, 'weight_decay': 5.5136510071208614e-05, 'epochs': 336, 'loss': 'mae', 'optimizer': 'adam', 'graph_mode': 'off', 'use_snp_selection': True, 'num_snps': 43862}. Best is trial 0 with value: 0.02359372552777386.
[I 2025-12-05 15:12:55,156] Trial 1 finished with value: 0.03964335404879725 and parameters: {'model_type': 'mlp', 'hidden_dims': '[256, 128]', 'dropout': 0.4370668075331726, 'batch_norm': True, 'lr': 7.133471581159139e-05, 'weight_decay': 1.128633586803549e-05, 'epochs': 242, 'loss': 'mae', 'optimizer': 'adam', 'graph_mode': 'off', 'use_snp_selection': False}. Best is trial 1 with value: 0.03964335404879725.
