[I 2025-12-05 16:25:06,645] Trial 100 finished with value: 0.33603205620565574 and parameters: {'model_type': 'mlp', 'hidden_dims': '[256, 128]', 'dropout': 0.49293846622404336, 'batch_norm': False, 'lr': 7.82236275874717e-05, 'weight_decay': 0.000258111613516625, 'epochs': 171, 'loss': 'mse', 'optimizer': 'adam', 'graph_mode': 'off', 'use_snp_selection': True, 'num_snps': 51925}. Best is trial 62 with value: 0.3673121891396239.
[I 2025-12-05 16:26:09,934] Trial 101 finished with value: 0.35673986315557465 and parameters: {'model_type': 'mlp', 'hidden_dims': '[512, 128]', 'dropout': 0.3097617756654987, 'batch_norm': False, 'lr': 2.933490725795357e-06, 'weight_decay': 0.0002996717102071019, 'epochs': 155, 'loss': 'mse', 'optimizer': 'adam', 'graph_mode': 'off', 'use_snp_selection': True, 'num_snps': 54413}. Best is trial 62 with value: 0.3673121891396239.
[I 2025-12-05 16:26:56,924] Trial 102 finished with value: 0.35296192803743726 and parameters: {'model_type': 'mlp', 'hidden_dims': '[128, 64]', 'dropout': 0.32968173803658285, 'batch_norm': False, 'lr': 2.2716406867527167e-06, 'weight_decay': 2.546674698715356e-07, 'epochs': 211, 'loss': 'mae', 'optimizer': 'adam', 'graph_mode': 'off', 'use_snp_selection': True, 'num_snps': 56634}. Best is trial 62 with value: 0.3673121891396239.
[I 2025-12-05 16:28:16,366] Trial 103 finished with value: 0.354021181994768 and parameters: {'model_type': 'mlp', 'hidden_dims': '[512, 256]', 'dropout': 0.4631271741033215, 'batch_norm': False, 'lr': 3.887353150522295e-06, 'weight_decay': 0.00016175747601822183, 'epochs': 226, 'loss': 'mse', 'optimizer': 'adam', 'graph_mode': 'off', 'use_snp_selection': True, 'num_snps': 58566}. Best is trial 62 with value: 0.3673121891396239.
[I 2025-12-05 16:29:29,656] Trial 104 finished with value: 0.3551423637015182 and parameters: {'model_type': 'mlp', 'hidden_dims': '[512, 128]', 'dropout': 0.36668718305804854, 'batch_norm': False, 'lr': 1.7925025813542024e-06, 'weight_decay': 0.0006938113215198139, 'epochs': 184, 'loss': 'mae', 'optimizer': 'adam', 'graph_mode': 'off', 'use_snp_selection': True, 'num_snps': 59915}. Best is trial 62 with value: 0.3673121891396239.
[I 2025-12-05 16:30:40,403] Trial 105 finished with value: 0.3569151697613687 and parameters: {'model_type': 'mlp', 'hidden_dims': '[512, 64]', 'dropout': 0.30502712766071716, 'batch_norm': False, 'lr': 2.612374767298116e-06, 'weight_decay': 0.0005208124046052386, 'epochs': 196, 'loss': 'mae', 'optimizer': 'adam', 'graph_mode': 'off', 'use_snp_selection': True, 'num_snps': 55292}. Best is trial 62 with value: 0.3673121891396239.
[I 2025-12-05 16:32:02,853] Trial 106 finished with value: 0.32626296713989017 and parameters: {'model_type': 'mlp', 'hidden_dims': '[512, 128]', 'dropout': 0.32060219350569286, 'batch_norm': True, 'lr': 5.183064099506571e-06, 'weight_decay': 0.0001141465278531867, 'epochs': 274, 'loss': 'mse', 'optimizer': 'adam', 'graph_mode': 'off', 'use_snp_selection': True, 'num_snps': 53336}. Best is trial 62 with value: 0.3673121891396239.
[I 2025-12-05 16:32:54,791] Trial 107 finished with value: 0.3550425050830109 and parameters: {'model_type': 'mlp', 'hidden_dims': '[256, 128]', 'dropout': 0.3394889876917371, 'batch_norm': False, 'lr': 3.594612186042698e-06, 'weight_decay': 0.00036042506859991887, 'epochs': 164, 'loss': 'mae', 'optimizer': 'adam', 'graph_mode': 'off', 'use_snp_selection': True, 'num_snps': 57933}. Best is trial 62 with value: 0.3673121891396239.
[I 2025-12-05 16:33:32,558] Trial 108 finished with value: 0.352434265048211 and parameters: {'model_type': 'mlp', 'hidden_dims': '[512, 128]', 'dropout': 0.544892633569679, 'batch_norm': False, 'lr': 2.106178045945187e-06, 'weight_decay': 0.00019240416122260628, 'epochs': 176, 'loss': 'mae', 'optimizer': 'adam', 'graph_mode': 'off', 'use_snp_selection': False}. Best is trial 62 with value: 0.3673121891396239.
[I 2025-12-05 16:34:18,534] Trial 109 finished with value: 0.35465595145056394 and parameters: {'model_type': 'mlp', 'hidden_dims': '[512, 64]', 'dropout': 0.5607013424509598, 'batch_norm': False, 'lr': 3.0762486634141897e-06, 'weight_decay': 0.00014805258960691657, 'epochs': 149, 'loss': 'mse', 'optimizer': 'adam', 'graph_mode': 'off', 'use_snp_selection': True, 'num_snps': 33342}. Best is trial 62 with value: 0.3673121891396239.
[I 2025-12-05 16:35:31,823] Trial 110 finished with value: 0.3499393425105747 and parameters: {'model_type': 'mlp', 'hidden_dims': '[512, 128]', 'dropout': 0.48015232380269635, 'batch_norm': False, 'lr': 1.5414713559739233e-06, 'weight_decay': 0.00023481112424332513, 'epochs': 208, 'loss': 'mae', 'optimizer': 'adam', 'graph_mode': 'off', 'use_snp_selection': True, 'num_snps': 56698}. Best is trial 62 with value: 0.3673121891396239.
[I 2025-12-05 16:36:38,839] Trial 111 finished with value: 0.3602945549321678 and parameters: {'model_type': 'mlp', 'hidden_dims': '[512, 128]', 'dropout': 0.4967974087133868, 'batch_norm': False, 'lr': 3.5997857259032107e-06, 'weight_decay': 1.3757312629293983e-06, 'epochs': 177, 'loss': 'mae', 'optimizer': 'adam', 'graph_mode': 'off', 'use_snp_selection': True, 'num_snps': 55373}. Best is trial 62 with value: 0.3673121891396239.
[I 2025-12-05 16:37:35,433] Trial 112 finished with value: 0.35818179384386933 and parameters: {'model_type': 'mlp', 'hidden_dims': '[512, 128]', 'dropout': 0.23594625771851335, 'batch_norm': False, 'lr': 4.465065223519093e-06, 'weight_decay': 1.9297336392578344e-06, 'epochs': 126, 'loss': 'mae', 'optimizer': 'adam', 'graph_mode': 'off', 'use_snp_selection': True, 'num_snps': 52523}. Best is trial 62 with value: 0.3673121891396239.
[I 2025-12-05 16:38:41,125] Trial 113 finished with value: 0.3645237468802697 and parameters: {'model_type': 'mlp', 'hidden_dims': '[512, 128]', 'dropout': 0.5252606014634299, 'batch_norm': False, 'lr': 5.7709895642166475e-06, 'weight_decay': 0.000282400152541649, 'epochs': 171, 'loss': 'mae', 'optimizer': 'adam', 'graph_mode': 'off', 'use_snp_selection': True, 'num_snps': 54219}. Best is trial 62 with value: 0.3673121891396239.
[I 2025-12-05 16:39:49,514] Trial 114 finished with value: 0.35548224895493574 and parameters: {'model_type': 'mlp', 'hidden_dims': '[512, 128]', 'dropout': 0.528281047960005, 'batch_norm': False, 'lr': 8.118293014056521e-06, 'weight_decay': 0.0003039222715833184, 'epochs': 187, 'loss': 'mae', 'optimizer': 'adam', 'graph_mode': 'off', 'use_snp_selection': True, 'num_snps': 54109}. Best is trial 62 with value: 0.3673121891396239.
[I 2025-12-05 16:40:47,253] Trial 115 finished with value: 0.35244218020297474 and parameters: {'model_type': 'mlp', 'hidden_dims': '[512, 256]', 'dropout': 0.10306553708832947, 'batch_norm': False, 'lr': 6.294768151635751e-06, 'weight_decay': 1.0151960240225266e-07, 'epochs': 136, 'loss': 'mae', 'optimizer': 'adam', 'graph_mode': 'off', 'use_snp_selection': True, 'num_snps': 49516}. Best is trial 62 with value: 0.3673121891396239.
[I 2025-12-05 16:42:00,775] Trial 116 finished with value: 0.35263289525209107 and parameters: {'model_type': 'mlp', 'hidden_dims': '[512, 128]', 'dropout': 0.35489930622159127, 'batch_norm': False, 'lr': 5.490663391251549e-06, 'weight_decay': 0.0004134103604781101, 'epochs': 199, 'loss': 'mae', 'optimizer': 'adam', 'graph_mode': 'off', 'use_snp_selection': True, 'num_snps': 58475}. Best is trial 62 with value: 0.3673121891396239.
[I 2025-12-05 16:43:25,187] Trial 117 finished with value: 0.367353616193014 and parameters: {'model_type': 'mlp', 'hidden_dims': '[512, 64]', 'dropout': 0.5166553554319648, 'batch_norm': False, 'lr': 2.359109955057408e-06, 'weight_decay': 0.00012563809823143584, 'epochs': 334, 'loss': 'mae', 'optimizer': 'adam', 'graph_mode': 'off', 'use_snp_selection': True, 'num_snps': 47813}. Best is trial 117 with value: 0.367353616193014.
[I 2025-12-05 16:44:49,265] Trial 118 finished with value: 0.3625911660333565 and parameters: {'model_type': 'mlp', 'hidden_dims': '[512, 64]', 'dropout': 0.5410274014523372, 'batch_norm': False, 'lr': 2.3910656049264622e-06, 'weight_decay': 0.00010006029774881646, 'epochs': 299, 'loss': 'mse', 'optimizer': 'adam', 'graph_mode': 'off', 'use_snp_selection': True, 'num_snps': 51619}. Best is trial 117 with value: 0.367353616193014.
[I 2025-12-05 16:46:18,733] Trial 119 finished with value: 0.36205788596374056 and parameters: {'model_type': 'mlp', 'hidden_dims': '[512, 64]', 'dropout': 0.5374701261553628, 'batch_norm': False, 'lr': 1.9776276729001897e-06, 'weight_decay': 5.0971711615685585e-05, 'epochs': 337, 'loss': 'mse', 'optimizer': 'adam', 'graph_mode': 'off', 'use_snp_selection': True, 'num_snps': 51124}. Best is trial 117 with value: 0.367353616193014.
[I 2025-12-05 16:47:44,372] Trial 120 finished with value: 0.36153948690465887 and parameters: {'model_type': 'mlp', 'hidden_dims': '[512, 64]', 'dropout': 0.5685222933539991, 'batch_norm': False, 'lr': 1.8926801937517173e-06, 'weight_decay': 0.00010306674304665087, 'epochs': 340, 'loss': 'mse', 'optimizer': 'adam', 'graph_mode': 'off', 'use_snp_selection': True, 'num_snps': 47943}. Best is trial 117 with value: 0.367353616193014.
[I 2025-12-05 16:49:13,012] Trial 121 finished with value: 0.35668571012061057 and parameters: {'model_type': 'mlp', 'hidden_dims': '[512, 64]', 'dropout': 0.536240910309476, 'batch_norm': False, 'lr': 2.4130430348347387e-06, 'weight_decay': 8.970551203625077e-05, 'epochs': 329, 'loss': 'mse', 'optimizer': 'adam', 'graph_mode': 'off', 'use_snp_selection': True, 'num_snps': 51252}. Best is trial 117 with value: 0.367353616193014.
[I 2025-12-05 16:50:36,706] Trial 122 finished with value: 0.36351183923813923 and parameters: {'model_type': 'mlp', 'hidden_dims': '[512, 64]', 'dropout': 0.54855862524688, 'batch_norm': False, 'lr': 2.0473203487964015e-06, 'weight_decay': 0.00012611851410434933, 'epochs': 307, 'loss': 'mse', 'optimizer': 'adam', 'graph_mode': 'off', 'use_snp_selection': True, 'num_snps': 50083}. Best is trial 117 with value: 0.367353616193014.
[I 2025-12-05 16:51:58,920] Trial 123 finished with value: 0.37167049698084037 and parameters: {'model_type': 'mlp', 'hidden_dims': '[512, 64]', 'dropout': 0.5179571818705924, 'batch_norm': False, 'lr': 1.2990621858524958e-06, 'weight_decay': 5.121533957315459e-05, 'epochs': 299, 'loss': 'mse', 'optimizer': 'adam', 'graph_mode': 'off', 'use_snp_selection': True, 'num_snps': 49863}. Best is trial 123 with value: 0.37167049698084037.
[I 2025-12-05 16:53:15,692] Trial 124 finished with value: 0.3561037223594403 and parameters: {'model_type': 'mlp', 'hidden_dims': '[512, 64]', 'dropout': 0.5141102285648621, 'batch_norm': False, 'lr': 1.012719769720913e-06, 'weight_decay': 6.203723465180637e-05, 'epochs': 304, 'loss': 'mse', 'optimizer': 'adam', 'graph_mode': 'off', 'use_snp_selection': True, 'num_snps': 45393}. Best is trial 123 with value: 0.37167049698084037.
[I 2025-12-05 16:54:36,291] Trial 125 finished with value: 0.3633594110132353 and parameters: {'model_type': 'mlp', 'hidden_dims': '[512, 64]', 'dropout': 0.5913593666987544, 'batch_norm': False, 'lr': 2.6399140714121165e-06, 'weight_decay': 0.0001385158219193872, 'epochs': 291, 'loss': 'mse', 'optimizer': 'adam', 'graph_mode': 'off', 'use_snp_selection': True, 'num_snps': 49871}. Best is trial 123 with value: 0.37167049698084037.
[I 2025-12-05 16:56:00,702] Trial 126 finished with value: 0.35746595967362865 and parameters: {'model_type': 'mlp', 'hidden_dims': '[512, 64]', 'dropout': 0.5996437615033562, 'batch_norm': False, 'lr': 1.376301204965982e-06, 'weight_decay': 0.00012755215758616744, 'epochs': 319, 'loss': 'mse', 'optimizer': 'adam', 'graph_mode': 'off', 'use_snp_selection': True, 'num_snps': 49891}. Best is trial 123 with value: 0.37167049698084037.
[I 2025-12-05 16:57:17,328] Trial 127 finished with value: 0.3031382683036821 and parameters: {'model_type': 'mlp', 'hidden_dims': '[512, 64]', 'dropout': 0.5515897627369769, 'batch_norm': True, 'lr': 1.232226833334254e-06, 'weight_decay': 0.0001318727480587715, 'epochs': 285, 'loss': 'mse', 'optimizer': 'adam', 'graph_mode': 'off', 'use_snp_selection': True, 'num_snps': 47412}. Best is trial 123 with value: 0.37167049698084037.
[I 2025-12-05 16:58:36,760] Trial 128 finished with value: 0.36355125058089943 and parameters: {'model_type': 'mlp', 'hidden_dims': '[512, 64]', 'dropout': 0.5890911475947249, 'batch_norm': False, 'lr': 1.6774159509349436e-06, 'weight_decay': 0.00016791842263498357, 'epochs': 345, 'loss': 'mse', 'optimizer': 'adam', 'graph_mode': 'off', 'use_snp_selection': True, 'num_snps': 43552}. Best is trial 123 with value: 0.37167049698084037.
[I 2025-12-05 16:59:40,539] Trial 129 finished with value: 0.3626503212313227 and parameters: {'model_type': 'mlp', 'hidden_dims': '[512, 64]', 'dropout': 0.5904818058005317, 'batch_norm': False, 'lr': 1.5887670722074313e-06, 'weight_decay': 0.0002039983885562718, 'epochs': 310, 'loss': 'mse', 'optimizer': 'adam', 'graph_mode': 'off', 'use_snp_selection': False}. Best is trial 123 with value: 0.37167049698084037.
[I 2025-12-05 17:00:57,662] Trial 130 finished with value: 0.3531345186581358 and parameters: {'model_type': 'mlp', 'hidden_dims': '[512, 64]', 'dropout': 0.5766177287878316, 'batch_norm': False, 'lr': 1.0652348097421774e-06, 'weight_decay': 0.0001582151559775782, 'epochs': 343, 'loss': 'mse', 'optimizer': 'adam', 'graph_mode': 'off', 'use_snp_selection': True, 'num_snps': 41482}. Best is trial 123 with value: 0.37167049698084037.
[I 2025-12-05 17:02:22,283] Trial 131 finished with value: 0.3597106354793039 and parameters: {'model_type': 'mlp', 'hidden_dims': '[512, 64]', 'dropout': 0.5838035751502807, 'batch_norm': False, 'lr': 2.7527168676198848e-06, 'weight_decay': 0.00017861380615894542, 'epochs': 330, 'loss': 'mse', 'optimizer': 'adam', 'graph_mode': 'off', 'use_snp_selection': True, 'num_snps': 48236}. Best is trial 123 with value: 0.37167049698084037.
[I 2025-12-05 17:03:41,949] Trial 132 finished with value: 0.359091847548114 and parameters: {'model_type': 'mlp', 'hidden_dims': '[512, 64]', 'dropout': 0.5633966809926871, 'batch_norm': False, 'lr': 3.1598529484197735e-06, 'weight_decay': 8.010766664143194e-05, 'epochs': 313, 'loss': 'mse', 'optimizer': 'adam', 'graph_mode': 'off', 'use_snp_selection': True, 'num_snps': 46183}. Best is trial 123 with value: 0.37167049698084037.
[I 2025-12-05 17:04:56,619] Trial 133 finished with value: 0.362552295197272 and parameters: {'model_type': 'mlp', 'hidden_dims': '[512, 64]', 'dropout': 0.5267019753809182, 'batch_norm': False, 'lr': 1.765283485913738e-06, 'weight_decay': 0.00012518242883892576, 'epochs': 347, 'loss': 'mse', 'optimizer': 'adam', 'graph_mode': 'off', 'use_snp_selection': True, 'num_snps': 39226}. Best is trial 123 with value: 0.37167049698084037.
[I 2025-12-05 17:06:14,489] Trial 134 finished with value: 0.34898011283276575 and parameters: {'model_type': 'mlp', 'hidden_dims': '[512, 64]', 'dropout': 0.5066203839094399, 'batch_norm': False, 'lr': 3.861708712893394e-06, 'weight_decay': 0.00025759528942316296, 'epochs': 325, 'loss': 'mse', 'optimizer': 'adam', 'graph_mode': 'off', 'use_snp_selection': True, 'num_snps': 43335}. Best is trial 123 with value: 0.37167049698084037.
[I 2025-12-05 17:07:33,101] Trial 135 finished with value: 0.362007911997104 and parameters: {'model_type': 'mlp', 'hidden_dims': '[512, 64]', 'dropout': 0.5867386482529963, 'batch_norm': False, 'lr': 2.1232844438745065e-06, 'weight_decay': 0.00021293084172809847, 'epochs': 289, 'loss': 'mse', 'optimizer': 'adam', 'graph_mode': 'off', 'use_snp_selection': True, 'num_snps': 48655}. Best is trial 123 with value: 0.37167049698084037.
[I 2025-12-05 17:08:52,180] Trial 136 finished with value: 0.3695245606984484 and parameters: {'model_type': 'mlp', 'hidden_dims': '[512, 64]', 'dropout': 0.5572154591050351, 'batch_norm': False, 'lr': 1.3161100346301675e-06, 'weight_decay': 0.00011097842364371365, 'epochs': 333, 'loss': 'mse', 'optimizer': 'adam', 'graph_mode': 'off', 'use_snp_selection': True, 'num_snps': 44087}. Best is trial 123 with value: 0.37167049698084037.
[I 2025-12-05 17:10:10,888] Trial 137 finished with value: 0.36513926121951445 and parameters: {'model_type': 'mlp', 'hidden_dims': '[512, 64]', 'dropout': 0.5559677568736544, 'batch_norm': False, 'lr': 1.3450555057037557e-06, 'weight_decay': 7.289323730937316e-05, 'epochs': 333, 'loss': 'mse', 'optimizer': 'adam', 'graph_mode': 'off', 'use_snp_selection': True, 'num_snps': 44348}. Best is trial 123 with value: 0.37167049698084037.
[I 2025-12-05 17:11:33,528] Trial 138 finished with value: 0.36517217041585426 and parameters: {'model_type': 'mlp', 'hidden_dims': '[512, 64]', 'dropout': 0.5540518228629362, 'batch_norm': False, 'lr': 1.2503044103727024e-06, 'weight_decay': 7.223748667888592e-05, 'epochs': 328, 'loss': 'mse', 'optimizer': 'adam', 'graph_mode': 'off', 'use_snp_selection': True, 'num_snps': 46893}. Best is trial 123 with value: 0.37167049698084037.
[I 2025-12-05 17:12:56,527] Trial 139 finished with value: 0.36023372814135507 and parameters: {'model_type': 'mlp', 'hidden_dims': '[512, 64]', 'dropout': 0.5616858791057037, 'batch_norm': False, 'lr': 1.2067577464581718e-06, 'weight_decay': 3.8556640368887875e-05, 'epochs': 330, 'loss': 'mse', 'optimizer': 'adam', 'graph_mode': 'off', 'use_snp_selection': True, 'num_snps': 46867}. Best is trial 123 with value: 0.37167049698084037.
[I 2025-12-05 17:14:14,235] Trial 140 finished with value: 0.3619466128983032 and parameters: {'model_type': 'mlp', 'hidden_dims': '[512, 64]', 'dropout': 0.5516153870276146, 'batch_norm': False, 'lr': 1.3883123160577868e-06, 'weight_decay': 5.544827345728375e-05, 'epochs': 314, 'loss': 'mse', 'optimizer': 'adam', 'graph_mode': 'off', 'use_snp_selection': True, 'num_snps': 44621}. Best is trial 123 with value: 0.37167049698084037.
[I 2025-12-05 17:15:33,464] Trial 141 finished with value: 0.3634546579896343 and parameters: {'model_type': 'mlp', 'hidden_dims': '[512, 64]', 'dropout': 0.5730836120974883, 'batch_norm': False, 'lr': 1.3417706302661149e-06, 'weight_decay': 6.823805911218176e-05, 'epochs': 335, 'loss': 'mse', 'optimizer': 'adam', 'graph_mode': 'off', 'use_snp_selection': True, 'num_snps': 44275}. Best is trial 123 with value: 0.37167049698084037.
[I 2025-12-05 17:16:51,561] Trial 142 finished with value: 0.3591241641272692 and parameters: {'model_type': 'mlp', 'hidden_dims': '[512, 64]', 'dropout': 0.5907183410750452, 'batch_norm': False, 'lr': 1.2818151603202478e-06, 'weight_decay': 6.747569146351111e-05, 'epochs': 337, 'loss': 'mse', 'optimizer': 'adam', 'graph_mode': 'off', 'use_snp_selection': True, 'num_snps': 42368}. Best is trial 123 with value: 0.37167049698084037.
[I 2025-12-05 17:18:09,623] Trial 143 finished with value: 0.36865112785094806 and parameters: {'model_type': 'mlp', 'hidden_dims': '[512, 64]', 'dropout': 0.5743714117419629, 'batch_norm': False, 'lr': 1.5844131857607939e-06, 'weight_decay': 7.085441194127068e-05, 'epochs': 323, 'loss': 'mse', 'optimizer': 'adam', 'graph_mode': 'off', 'use_snp_selection': True, 'num_snps': 43935}. Best is trial 123 with value: 0.37167049698084037.
[I 2025-12-05 17:19:28,742] Trial 144 finished with value: 0.36203712507743485 and parameters: {'model_type': 'mlp', 'hidden_dims': '[512, 64]', 'dropout': 0.574974572130241, 'batch_norm': False, 'lr': 1.0985366753158096e-06, 'weight_decay': 7.760268859587582e-05, 'epochs': 325, 'loss': 'mse', 'optimizer': 'adam', 'graph_mode': 'off', 'use_snp_selection': True, 'num_snps': 44577}. Best is trial 123 with value: 0.37167049698084037.
[I 2025-12-05 17:20:49,133] Trial 145 finished with value: 0.36186740860001654 and parameters: {'model_type': 'mlp', 'hidden_dims': '[512, 64]', 'dropout': 0.5700363035423512, 'batch_norm': False, 'lr': 1.5672004429268808e-06, 'weight_decay': 3.609308060324861e-05, 'epochs': 349, 'loss': 'mse', 'optimizer': 'adam', 'graph_mode': 'off', 'use_snp_selection': True, 'num_snps': 43209}. Best is trial 123 with value: 0.37167049698084037.
[I 2025-12-05 17:22:06,891] Trial 146 finished with value: 0.3626794795107637 and parameters: {'model_type': 'mlp', 'hidden_dims': '[512, 64]', 'dropout': 0.5578249701796838, 'batch_norm': False, 'lr': 1.456862008793078e-06, 'weight_decay': 2.2797583334159356e-05, 'epochs': 301, 'loss': 'mse', 'optimizer': 'adam', 'graph_mode': 'off', 'use_snp_selection': True, 'num_snps': 45477}. Best is trial 123 with value: 0.37167049698084037.
[I 2025-12-05 17:23:19,305] Trial 147 finished with value: 0.3638352347435435 and parameters: {'model_type': 'mlp', 'hidden_dims': '[512, 64]', 'dropout': 0.58266073150164, 'batch_norm': False, 'lr': 1.7264300000924273e-06, 'weight_decay': 5.36096256188334e-05, 'epochs': 309, 'loss': 'mse', 'optimizer': 'adam', 'graph_mode': 'off', 'use_snp_selection': True, 'num_snps': 40292}. Best is trial 123 with value: 0.37167049698084037.
[I 2025-12-05 17:24:30,678] Trial 148 finished with value: 0.3638594189696197 and parameters: {'model_type': 'mlp', 'hidden_dims': '[512, 64]', 'dropout': 0.5788794285780337, 'batch_norm': False, 'lr': 1.7120384075611339e-06, 'weight_decay': 5.1081290509839405e-05, 'epochs': 308, 'loss': 'mse', 'optimizer': 'adam', 'graph_mode': 'off', 'use_snp_selection': True, 'num_snps': 39559}. Best is trial 123 with value: 0.37167049698084037.
[I 2025-12-05 17:25:53,813] Trial 149 finished with value: 0.3663475961379071 and parameters: {'model_type': 'mlp', 'hidden_dims': '[512, 64]', 'dropout': 0.5508274152871929, 'batch_norm': False, 'lr': 1.715980903255737e-06, 'weight_decay': 2.808474822578461e-05, 'epochs': 322, 'loss': 'mse', 'optimizer': 'adam', 'graph_mode': 'off', 'use_snp_selection': True, 'num_snps': 46881}. Best is trial 123 with value: 0.37167049698084037.
