[I 2025-12-05 15:13:45,533] Trial 102 finished with value: 0.14576123436374933 and parameters: {'model_type': 'mlp', 'hidden_dims': '[512, 256]', 'dropout': 0.17371888223928242, 'batch_norm': False, 'lr': 0.0004084795311164759, 'weight_decay': 0.0003865601827237175, 'epochs': 202, 'loss': 'mae', 'optimizer': 'adam', 'graph_mode': 'off', 'use_snp_selection': True, 'num_snps': 58035}. Best is trial 37 with value: 0.15090821081568856.
[I 2025-12-05 15:13:48,995] Trial 103 finished with value: 0.14362733207322698 and parameters: {'model_type': 'mlp', 'hidden_dims': '[512, 256]', 'dropout': 0.16865516019480198, 'batch_norm': False, 'lr': 0.0003536212284006755, 'weight_decay': 0.0003941091836721065, 'epochs': 225, 'loss': 'mae', 'optimizer': 'adam', 'graph_mode': 'off', 'use_snp_selection': True, 'num_snps': 57791}. Best is trial 37 with value: 0.15090821081568856.
[I 2025-12-05 15:13:52,599] Trial 104 finished with value: 0.13267445827325475 and parameters: {'model_type': 'mlp', 'hidden_dims': '[512, 256]', 'dropout': 0.1738294952510521, 'batch_norm': False, 'lr': 0.000399151328984661, 'weight_decay': 0.0003840099983010599, 'epochs': 224, 'loss': 'mae', 'optimizer': 'adam', 'graph_mode': 'off', 'use_snp_selection': True, 'num_snps': 59934}. Best is trial 37 with value: 0.15090821081568856.
[I 2025-12-05 15:13:55,837] Trial 105 finished with value: 0.10939226754366083 and parameters: {'model_type': 'mlp', 'hidden_dims': '[512, 256]', 'dropout': 0.19293487983831017, 'batch_norm': False, 'lr': 0.0003375137033405828, 'weight_decay': 0.0006596885691471259, 'epochs': 202, 'loss': 'mae', 'optimizer': 'adam', 'graph_mode': 'off', 'use_snp_selection': True, 'num_snps': 57674}. Best is trial 37 with value: 0.15090821081568856.
[I 2025-12-05 15:13:59,132] Trial 106 finished with value: 0.13128122473339338 and parameters: {'model_type': 'mlp', 'hidden_dims': '[512, 256]', 'dropout': 0.21893035074468548, 'batch_norm': False, 'lr': 0.0005699282381610102, 'weight_decay': 0.0005815370211615409, 'epochs': 212, 'loss': 'mae', 'optimizer': 'adam', 'graph_mode': 'off', 'use_snp_selection': True, 'num_snps': 58708}. Best is trial 37 with value: 0.15090821081568856.
[I 2025-12-05 15:14:00,758] Trial 107 finished with value: 0.13660582161721713 and parameters: {'model_type': 'mlp', 'hidden_dims': '[512, 256]', 'dropout': 0.16064719968303998, 'batch_norm': False, 'lr': 0.0007982174806732631, 'weight_decay': 0.00035300539013624957, 'epochs': 196, 'loss': 'mae', 'optimizer': 'adam', 'graph_mode': 'off', 'use_snp_selection': False}. Best is trial 37 with value: 0.15090821081568856.
[I 2025-12-05 15:14:03,921] Trial 108 finished with value: 0.07384545826089359 and parameters: {'model_type': 'mlp', 'hidden_dims': '[512, 256]', 'dropout': 0.20651687729998996, 'batch_norm': False, 'lr': 0.0004716433507609951, 'weight_decay': 0.0007842161118593295, 'epochs': 173, 'loss': 'mse', 'optimizer': 'adam', 'graph_mode': 'off', 'use_snp_selection': True, 'num_snps': 56390}. Best is trial 37 with value: 0.15090821081568856.
[I 2025-12-05 15:14:07,406] Trial 109 finished with value: 0.08839782404429428 and parameters: {'model_type': 'mlp', 'hidden_dims': '[512, 256]', 'dropout': 0.23799548272038093, 'batch_norm': True, 'lr': 5.305939257955137e-05, 'weight_decay': 0.000485335467423133, 'epochs': 216, 'loss': 'mae', 'optimizer': 'adam', 'graph_mode': 'off', 'use_snp_selection': True, 'num_snps': 57898}. Best is trial 37 with value: 0.15090821081568856.
[I 2025-12-05 15:14:10,392] Trial 110 finished with value: 0.1394238228774624 and parameters: {'model_type': 'mlp', 'hidden_dims': '[512, 256]', 'dropout': 0.1831563084805797, 'batch_norm': False, 'lr': 7.556668350963172e-05, 'weight_decay': 0.00025413500334344765, 'epochs': 202, 'loss': 'mae', 'optimizer': 'adam', 'graph_mode': 'off', 'use_snp_selection': True, 'num_snps': 51140}. Best is trial 37 with value: 0.15090821081568856.
[I 2025-12-05 15:14:13,640] Trial 111 finished with value: 0.13533292061253252 and parameters: {'model_type': 'mlp', 'hidden_dims': '[512, 256]', 'dropout': 0.14241841127310756, 'batch_norm': False, 'lr': 0.00021703833713720443, 'weight_decay': 0.0003093976434680113, 'epochs': 226, 'loss': 'mae', 'optimizer': 'adam', 'graph_mode': 'off', 'use_snp_selection': True, 'num_snps': 56460}. Best is trial 37 with value: 0.15090821081568856.
[I 2025-12-05 15:14:16,701] Trial 112 finished with value: 0.12309909850550249 and parameters: {'model_type': 'mlp', 'hidden_dims': '[512, 256]', 'dropout': 0.17153641862753263, 'batch_norm': False, 'lr': 0.0004016728097139518, 'weight_decay': 0.0005512819198358918, 'epochs': 185, 'loss': 'mae', 'optimizer': 'adam', 'graph_mode': 'off', 'use_snp_selection': True, 'num_snps': 54326}. Best is trial 37 with value: 0.15090821081568856.
[I 2025-12-05 15:14:20,308] Trial 113 finished with value: 0.1277685114882935 and parameters: {'model_type': 'mlp', 'hidden_dims': '[512, 256]', 'dropout': 0.15820154938730896, 'batch_norm': False, 'lr': 0.00016882152898875256, 'weight_decay': 0.0009296226314068119, 'epochs': 238, 'loss': 'mae', 'optimizer': 'adam', 'graph_mode': 'off', 'use_snp_selection': True, 'num_snps': 59788}. Best is trial 37 with value: 0.15090821081568856.
[I 2025-12-05 15:14:23,895] Trial 114 finished with value: 0.1254334626031742 and parameters: {'model_type': 'mlp', 'hidden_dims': '[512, 256]', 'dropout': 0.19228649678350782, 'batch_norm': False, 'lr': 0.00018518512563458955, 'weight_decay': 0.00044835500353338886, 'epochs': 249, 'loss': 'mae', 'optimizer': 'adam', 'graph_mode': 'off', 'use_snp_selection': True, 'num_snps': 58178}. Best is trial 37 with value: 0.15090821081568856.
[I 2025-12-05 15:14:27,163] Trial 115 finished with value: 0.15297711158133734 and parameters: {'model_type': 'mlp', 'hidden_dims': '[512, 256]', 'dropout': 0.15008920655275684, 'batch_norm': False, 'lr': 0.00034719272247566167, 'weight_decay': 0.00022401679299457043, 'epochs': 269, 'loss': 'mae', 'optimizer': 'adam', 'graph_mode': 'off', 'use_snp_selection': True, 'num_snps': 53084}. Best is trial 115 with value: 0.15297711158133734.
[I 2025-12-05 15:14:30,449] Trial 116 finished with value: 0.13089138883062343 and parameters: {'model_type': 'mlp', 'hidden_dims': '[512, 256]', 'dropout': 0.16704033404007892, 'batch_norm': False, 'lr': 0.0003409280113407749, 'weight_decay': 0.0002362254976176138, 'epochs': 268, 'loss': 'mae', 'optimizer': 'adam', 'graph_mode': 'off', 'use_snp_selection': True, 'num_snps': 53133}. Best is trial 115 with value: 0.15297711158133734.
[I 2025-12-05 15:14:33,102] Trial 117 finished with value: 0.1319074926784472 and parameters: {'model_type': 'mlp', 'hidden_dims': '[512, 256]', 'dropout': 0.14925734190138032, 'batch_norm': False, 'lr': 0.0007005090075580219, 'weight_decay': 0.0003979092654000658, 'epochs': 151, 'loss': 'mae', 'optimizer': 'adam', 'graph_mode': 'off', 'use_snp_selection': True, 'num_snps': 48880}. Best is trial 115 with value: 0.15297711158133734.
[I 2025-12-05 15:14:36,758] Trial 118 finished with value: 0.13411624279818393 and parameters: {'model_type': 'mlp', 'hidden_dims': '[512, 256]', 'dropout': 0.1827148344219077, 'batch_norm': False, 'lr': 0.0001241794657637527, 'weight_decay': 0.00030481658959388924, 'epochs': 279, 'loss': 'mae', 'optimizer': 'adam', 'graph_mode': 'off', 'use_snp_selection': True, 'num_snps': 55893}. Best is trial 115 with value: 0.15297711158133734.
[I 2025-12-05 15:14:39,593] Trial 119 finished with value: 0.12535445849631327 and parameters: {'model_type': 'mlp', 'hidden_dims': '[512, 256]', 'dropout': 0.23124434729941892, 'batch_norm': False, 'lr': 6.188526362006657e-05, 'weight_decay': 0.0001800616605838971, 'epochs': 210, 'loss': 'mae', 'optimizer': 'adam', 'graph_mode': 'off', 'use_snp_selection': True, 'num_snps': 46146}. Best is trial 115 with value: 0.15297711158133734.
[I 2025-12-05 15:14:42,466] Trial 120 finished with value: 0.12970920492336643 and parameters: {'model_type': 'mlp', 'hidden_dims': '[256, 128, 64]', 'dropout': 0.20298350715882732, 'batch_norm': False, 'lr': 0.00048700344141073637, 'weight_decay': 0.00021468175922245404, 'epochs': 310, 'loss': 'mae', 'optimizer': 'adam', 'graph_mode': 'off', 'use_snp_selection': True, 'num_snps': 51902}. Best is trial 115 with value: 0.15297711158133734.
[I 2025-12-05 15:14:45,078] Trial 121 finished with value: 0.12326946290156157 and parameters: {'model_type': 'mlp', 'hidden_dims': '[128, 64]', 'dropout': 0.13612015524604437, 'batch_norm': False, 'lr': 0.00024814730119336815, 'weight_decay': 4.374616744056582e-06, 'epochs': 258, 'loss': 'mae', 'optimizer': 'adam', 'graph_mode': 'off', 'use_snp_selection': True, 'num_snps': 58046}. Best is trial 115 with value: 0.15297711158133734.
[I 2025-12-05 15:14:48,372] Trial 122 finished with value: 0.13378422897513484 and parameters: {'model_type': 'mlp', 'hidden_dims': '[512, 256]', 'dropout': 0.14536250695952274, 'batch_norm': False, 'lr': 0.00030013135795451057, 'weight_decay': 0.00034445404072011744, 'epochs': 275, 'loss': 'mae', 'optimizer': 'adam', 'graph_mode': 'off', 'use_snp_selection': True, 'num_snps': 53630}. Best is trial 115 with value: 0.15297711158133734.
[I 2025-12-05 15:14:51,184] Trial 123 finished with value: 0.1236498154424134 and parameters: {'model_type': 'mlp', 'hidden_dims': '[512, 64]', 'dropout': 0.17430730613875464, 'batch_norm': False, 'lr': 0.00014783877938579458, 'weight_decay': 9.636705132513853e-06, 'epochs': 162, 'loss': 'mae', 'optimizer': 'adam', 'graph_mode': 'off', 'use_snp_selection': True, 'num_snps': 48837}. Best is trial 115 with value: 0.15297711158133734.
[I 2025-12-05 15:14:54,822] Trial 124 finished with value: 0.14093313775366476 and parameters: {'model_type': 'mlp', 'hidden_dims': '[512, 256]', 'dropout': 0.1572406712545718, 'batch_norm': False, 'lr': 0.0003855096255089015, 'weight_decay': 1.7270737279254627e-07, 'epochs': 269, 'loss': 'mae', 'optimizer': 'adam', 'graph_mode': 'off', 'use_snp_selection': True, 'num_snps': 56725}. Best is trial 115 with value: 0.15297711158133734.
[I 2025-12-05 15:14:58,235] Trial 125 finished with value: 0.13079510082134266 and parameters: {'model_type': 'mlp', 'hidden_dims': '[512, 256]', 'dropout': 0.190500486756692, 'batch_norm': False, 'lr': 0.0005826228389454156, 'weight_decay': 0.00026368483658314204, 'epochs': 251, 'loss': 'mae', 'optimizer': 'adam', 'graph_mode': 'off', 'use_snp_selection': True, 'num_snps': 57035}. Best is trial 115 with value: 0.15297711158133734.
[I 2025-12-05 15:15:00,750] Trial 126 finished with value: 0.010515720153382606 and parameters: {'model_type': 'mlp', 'hidden_dims': '[512, 256]', 'dropout': 0.15443164451581523, 'batch_norm': False, 'lr': 0.0009477950368860853, 'weight_decay': 1.5137180828539737e-06, 'epochs': 44, 'loss': 'mae', 'optimizer': 'adam', 'graph_mode': 'off', 'use_snp_selection': True, 'num_snps': 54917}. Best is trial 115 with value: 0.15297711158133734.
[I 2025-12-05 15:15:02,692] Trial 127 finished with value: 0.11195975843225908 and parameters: {'model_type': 'mlp', 'hidden_dims': '[512, 256]', 'dropout': 0.22166798397749543, 'batch_norm': False, 'lr': 0.0003790659063858684, 'weight_decay': 0.0001227591116556134, 'epochs': 265, 'loss': 'mae', 'optimizer': 'adam', 'graph_mode': 'off', 'use_snp_selection': False}. Best is trial 115 with value: 0.15297711158133734.
[I 2025-12-05 15:15:06,036] Trial 128 finished with value: 0.11058325968090472 and parameters: {'model_type': 'mlp', 'hidden_dims': '[512, 256]', 'dropout': 0.1671981996986756, 'batch_norm': False, 'lr': 0.00044260821712911616, 'weight_decay': 4.1820461110265867e-07, 'epochs': 180, 'loss': 'mse', 'optimizer': 'adam', 'graph_mode': 'off', 'use_snp_selection': True, 'num_snps': 58714}. Best is trial 115 with value: 0.15297711158133734.
[I 2025-12-05 15:15:09,395] Trial 129 finished with value: 0.1226469619086843 and parameters: {'model_type': 'mlp', 'hidden_dims': '[512, 256]', 'dropout': 0.24947499799800432, 'batch_norm': False, 'lr': 0.0005214810711543135, 'weight_decay': 2.6078107937029054e-07, 'epochs': 221, 'loss': 'mae', 'optimizer': 'adam', 'graph_mode': 'off', 'use_snp_selection': True, 'num_snps': 55815}. Best is trial 115 with value: 0.15297711158133734.
[I 2025-12-05 15:15:12,481] Trial 130 finished with value: 0.0985341927543549 and parameters: {'model_type': 'mlp', 'hidden_dims': '[512, 128]', 'dropout': 0.2087095781698781, 'batch_norm': True, 'lr': 1.2189814811696452e-05, 'weight_decay': 2.3537216145263796e-06, 'epochs': 242, 'loss': 'mae', 'optimizer': 'adam', 'graph_mode': 'off', 'use_snp_selection': True, 'num_snps': 51313}. Best is trial 115 with value: 0.15297711158133734.
[I 2025-12-05 15:15:14,881] Trial 131 finished with value: 0.14810480400360493 and parameters: {'model_type': 'mlp', 'hidden_dims': '[512, 256]', 'dropout': 0.11104284538949277, 'batch_norm': False, 'lr': 0.0003356470050380723, 'weight_decay': 7.220319051324037e-07, 'epochs': 262, 'loss': 'mae', 'optimizer': 'adam', 'graph_mode': 'off', 'use_snp_selection': True, 'num_snps': 36668}. Best is trial 115 with value: 0.15297711158133734.
[I 2025-12-05 15:15:17,214] Trial 132 finished with value: 0.1430103343451035 and parameters: {'model_type': 'mlp', 'hidden_dims': '[512, 256]', 'dropout': 0.11355874220836731, 'batch_norm': False, 'lr': 0.00033854471468467237, 'weight_decay': 1.109125055956456e-07, 'epochs': 229, 'loss': 'mae', 'optimizer': 'adam', 'graph_mode': 'off', 'use_snp_selection': True, 'num_snps': 36896}. Best is trial 115 with value: 0.15297711158133734.
[I 2025-12-05 15:15:19,843] Trial 133 finished with value: 0.15031692501439378 and parameters: {'model_type': 'mlp', 'hidden_dims': '[512, 256]', 'dropout': 0.11467459925029103, 'batch_norm': False, 'lr': 0.00022652871666203086, 'weight_decay': 4.975873231932491e-07, 'epochs': 196, 'loss': 'mae', 'optimizer': 'adam', 'graph_mode': 'off', 'use_snp_selection': True, 'num_snps': 40865}. Best is trial 115 with value: 0.15297711158133734.
[I 2025-12-05 15:15:22,380] Trial 134 finished with value: 0.14062682172100688 and parameters: {'model_type': 'mlp', 'hidden_dims': '[512, 256]', 'dropout': 0.1145011306869149, 'batch_norm': False, 'lr': 0.00020610854383530298, 'weight_decay': 1.4711346103785015e-07, 'epochs': 233, 'loss': 'mae', 'optimizer': 'adam', 'graph_mode': 'off', 'use_snp_selection': True, 'num_snps': 38028}. Best is trial 115 with value: 0.15297711158133734.
[I 2025-12-05 15:15:25,049] Trial 135 finished with value: 0.14599110674779248 and parameters: {'model_type': 'mlp', 'hidden_dims': '[512, 256]', 'dropout': 0.10662174583197927, 'batch_norm': False, 'lr': 0.00024351822681139762, 'weight_decay': 1.0648192315970802e-06, 'epochs': 229, 'loss': 'mae', 'optimizer': 'adam', 'graph_mode': 'off', 'use_snp_selection': True, 'num_snps': 41643}. Best is trial 115 with value: 0.15297711158133734.
[I 2025-12-05 15:15:27,383] Trial 136 finished with value: 0.14146384356689815 and parameters: {'model_type': 'mlp', 'hidden_dims': '[512, 256]', 'dropout': 0.1004381282577273, 'batch_norm': False, 'lr': 0.00023665613338893148, 'weight_decay': 1.1077746786388573e-06, 'epochs': 229, 'loss': 'mae', 'optimizer': 'adam', 'graph_mode': 'off', 'use_snp_selection': True, 'num_snps': 36857}. Best is trial 115 with value: 0.15297711158133734.
[I 2025-12-05 15:15:29,834] Trial 137 finished with value: 0.12687811327973308 and parameters: {'model_type': 'mlp', 'hidden_dims': '[512, 256]', 'dropout': 0.12731790000436816, 'batch_norm': False, 'lr': 0.00027142217710118073, 'weight_decay': 3.651645864961477e-07, 'epochs': 194, 'loss': 'mae', 'optimizer': 'adam', 'graph_mode': 'off', 'use_snp_selection': True, 'num_snps': 40777}. Best is trial 115 with value: 0.15297711158133734.
[I 2025-12-05 15:15:32,472] Trial 138 finished with value: 0.14606971284678683 and parameters: {'model_type': 'mlp', 'hidden_dims': '[512, 256]', 'dropout': 0.11441265067220399, 'batch_norm': False, 'lr': 0.00032295652674333894, 'weight_decay': 6.541072227865873e-07, 'epochs': 243, 'loss': 'mae', 'optimizer': 'adam', 'graph_mode': 'off', 'use_snp_selection': True, 'num_snps': 41247}. Best is trial 115 with value: 0.15297711158133734.
[I 2025-12-05 15:15:35,291] Trial 139 finished with value: 0.13515723107808011 and parameters: {'model_type': 'mlp', 'hidden_dims': '[512, 256]', 'dropout': 0.13030307014801268, 'batch_norm': False, 'lr': 0.00018954333804701808, 'weight_decay': 7.490239441885864e-07, 'epochs': 243, 'loss': 'mae', 'optimizer': 'adam', 'graph_mode': 'off', 'use_snp_selection': True, 'num_snps': 41744}. Best is trial 115 with value: 0.15297711158133734.
[I 2025-12-05 15:15:38,160] Trial 140 finished with value: 0.1382712445420835 and parameters: {'model_type': 'mlp', 'hidden_dims': '[512, 256]', 'dropout': 0.10534235077435766, 'batch_norm': False, 'lr': 0.00013637862492765673, 'weight_decay': 5.148854076051393e-07, 'epochs': 254, 'loss': 'mae', 'optimizer': 'adam', 'graph_mode': 'off', 'use_snp_selection': True, 'num_snps': 43409}. Best is trial 115 with value: 0.15297711158133734.
[I 2025-12-05 15:15:40,627] Trial 141 finished with value: 0.14556870155886892 and parameters: {'model_type': 'mlp', 'hidden_dims': '[512, 256]', 'dropout': 0.116081673589348, 'batch_norm': False, 'lr': 0.0003253941936217996, 'weight_decay': 1.110195361793352e-06, 'epochs': 235, 'loss': 'mae', 'optimizer': 'adam', 'graph_mode': 'off', 'use_snp_selection': True, 'num_snps': 39032}. Best is trial 115 with value: 0.15297711158133734.
[I 2025-12-05 15:15:43,206] Trial 142 finished with value: 0.14020559427214485 and parameters: {'model_type': 'mlp', 'hidden_dims': '[512, 256]', 'dropout': 0.11353278269810482, 'batch_norm': False, 'lr': 0.000289371754675564, 'weight_decay': 7.568231823583147e-07, 'epochs': 264, 'loss': 'mae', 'optimizer': 'adam', 'graph_mode': 'off', 'use_snp_selection': True, 'num_snps': 39215}. Best is trial 115 with value: 0.15297711158133734.
[I 2025-12-05 15:15:45,736] Trial 143 finished with value: 0.14890459033631662 and parameters: {'model_type': 'mlp', 'hidden_dims': '[512, 256]', 'dropout': 0.1272562785382282, 'batch_norm': False, 'lr': 0.000327042642767193, 'weight_decay': 1.0635845515316322e-06, 'epochs': 219, 'loss': 'mae', 'optimizer': 'adam', 'graph_mode': 'off', 'use_snp_selection': True, 'num_snps': 40673}. Best is trial 115 with value: 0.15297711158133734.
[I 2025-12-05 15:15:48,590] Trial 144 finished with value: 0.12754072788613632 and parameters: {'model_type': 'mlp', 'hidden_dims': '[512, 256]', 'dropout': 0.11769817023730188, 'batch_norm': False, 'lr': 9.997303707912197e-05, 'weight_decay': 9.419233485055953e-07, 'epochs': 205, 'loss': 'mae', 'optimizer': 'adam', 'graph_mode': 'off', 'use_snp_selection': True, 'num_snps': 44789}. Best is trial 115 with value: 0.15297711158133734.
[I 2025-12-05 15:15:50,816] Trial 145 finished with value: 0.13770809371659704 and parameters: {'model_type': 'mlp', 'hidden_dims': '[128, 64]', 'dropout': 0.12301888297303706, 'batch_norm': False, 'lr': 0.0002151698580359072, 'weight_decay': 1.190704791256654e-06, 'epochs': 220, 'loss': 'mae', 'optimizer': 'adam', 'graph_mode': 'off', 'use_snp_selection': True, 'num_snps': 41580}. Best is trial 115 with value: 0.15297711158133734.
[I 2025-12-05 15:15:53,728] Trial 146 finished with value: 0.14809891250503274 and parameters: {'model_type': 'mlp', 'hidden_dims': '[512, 256]', 'dropout': 0.1389335454183614, 'batch_norm': False, 'lr': 0.00030946546082041615, 'weight_decay': 5.793228708811068e-07, 'epochs': 278, 'loss': 'mae', 'optimizer': 'adam', 'graph_mode': 'off', 'use_snp_selection': True, 'num_snps': 42809}. Best is trial 115 with value: 0.15297711158133734.
[I 2025-12-05 15:15:56,557] Trial 147 finished with value: 0.1523169448939196 and parameters: {'model_type': 'mlp', 'hidden_dims': '[512, 256]', 'dropout': 0.10644084941446963, 'batch_norm': False, 'lr': 0.00031115042550581613, 'weight_decay': 5.907138027635689e-07, 'epochs': 278, 'loss': 'mae', 'optimizer': 'adam', 'graph_mode': 'off', 'use_snp_selection': True, 'num_snps': 43102}. Best is trial 115 with value: 0.15297711158133734.
[I 2025-12-05 15:15:59,368] Trial 148 finished with value: 0.14178773535186862 and parameters: {'model_type': 'mlp', 'hidden_dims': '[512, 256]', 'dropout': 0.10042003900819335, 'batch_norm': False, 'lr': 0.000256341941742015, 'weight_decay': 5.949622971556878e-07, 'epochs': 286, 'loss': 'mae', 'optimizer': 'adam', 'graph_mode': 'off', 'use_snp_selection': True, 'num_snps': 42715}. Best is trial 115 with value: 0.15297711158133734.
[I 2025-12-05 15:16:02,055] Trial 149 finished with value: 0.1441270291281734 and parameters: {'model_type': 'mlp', 'hidden_dims': '[512, 256]', 'dropout': 0.13953919117346938, 'batch_norm': False, 'lr': 0.0003344792003468001, 'weight_decay': 5.134653654434844e-07, 'epochs': 239, 'loss': 'mae', 'optimizer': 'adam', 'graph_mode': 'off', 'use_snp_selection': True, 'num_snps': 40307}. Best is trial 115 with value: 0.15297711158133734.
[I 2025-12-05 15:16:04,488] Trial 0 finished with value: -0.0007228886798966894 and parameters: {'model_type': 'mlp', 'hidden_dims': '[128, 64]', 'dropout': 0.199031432379812, 'batch_norm': True, 'lr': 1.8408544111075837e-06, 'weight_decay': 5.5136510071208614e-05, 'epochs': 336, 'loss': 'mae', 'optimizer': 'adam', 'graph_mode': 'off', 'use_snp_selection': True, 'num_snps': 43862}. Best is trial 0 with value: -0.0007228886798966894.
[I 2025-12-05 15:16:05,658] Trial 1 finished with value: 0.03550675306439405 and parameters: {'model_type': 'mlp', 'hidden_dims': '[256, 128]', 'dropout': 0.4370668075331726, 'batch_norm': True, 'lr': 7.133471581159139e-05, 'weight_decay': 1.128633586803549e-05, 'epochs': 242, 'loss': 'mae', 'optimizer': 'adam', 'graph_mode': 'off', 'use_snp_selection': False}. Best is trial 1 with value: 0.03550675306439405.
