[I 2025-12-05 15:14:08,810] Trial 53 finished with value: 0.07554030931412221 and parameters: {'model_type': 'mlp', 'hidden_dims': '[512, 64]', 'dropout': 0.11730824133972366, 'batch_norm': True, 'lr': 4.90886705081322e-05, 'weight_decay': 1.254844471397534e-05, 'epochs': 188, 'loss': 'mse', 'optimizer': 'adam', 'graph_mode': 'off', 'use_snp_selection': True, 'num_snps': 8762}. Best is trial 53 with value: 0.07554030931412221.
[I 2025-12-05 15:14:09,727] Trial 54 finished with value: 0.023831030998936215 and parameters: {'model_type': 'mlp', 'hidden_dims': '[512, 64]', 'dropout': 0.11503537524615777, 'batch_norm': True, 'lr': 4.537742508012653e-05, 'weight_decay': 1.5643685208135482e-06, 'epochs': 185, 'loss': 'mse', 'optimizer': 'adam', 'graph_mode': 'off', 'use_snp_selection': True, 'num_snps': 2001}. Best is trial 53 with value: 0.07554030931412221.
[I 2025-12-05 15:14:10,714] Trial 55 finished with value: 0.043169340510923866 and parameters: {'model_type': 'mlp', 'hidden_dims': '[512, 64]', 'dropout': 0.10298758071674233, 'batch_norm': False, 'lr': 5.960527793013619e-05, 'weight_decay': 3.117320021017763e-06, 'epochs': 151, 'loss': 'mse', 'optimizer': 'adam', 'graph_mode': 'off', 'use_snp_selection': True, 'num_snps': 7621}. Best is trial 53 with value: 0.07554030931412221.
[I 2025-12-05 15:14:11,833] Trial 56 finished with value: 0.04528775403290117 and parameters: {'model_type': 'mlp', 'hidden_dims': '[512, 64]', 'dropout': 0.12655402988948508, 'batch_norm': True, 'lr': 9.374534449074605e-05, 'weight_decay': 0.0006097473097618185, 'epochs': 235, 'loss': 'mse', 'optimizer': 'adam', 'graph_mode': 'off', 'use_snp_selection': True, 'num_snps': 7005}. Best is trial 53 with value: 0.07554030931412221.
[I 2025-12-05 15:14:13,316] Trial 57 finished with value: 0.010393691505956957 and parameters: {'model_type': 'mlp', 'hidden_dims': '[512, 64]', 'dropout': 0.1572927287205253, 'batch_norm': True, 'lr': 2.1939687747905122e-05, 'weight_decay': 1.0101936328323034e-05, 'epochs': 135, 'loss': 'mse', 'optimizer': 'adam', 'graph_mode': 'off', 'use_snp_selection': True, 'num_snps': 23146}. Best is trial 53 with value: 0.07554030931412221.
[I 2025-12-05 15:14:14,204] Trial 58 finished with value: 0.03195191519435931 and parameters: {'model_type': 'mlp', 'hidden_dims': '[512, 64]', 'dropout': 0.12448404442082553, 'batch_norm': False, 'lr': 4.880423908190696e-05, 'weight_decay': 3.1998337405360977e-07, 'epochs': 58, 'loss': 'mae', 'optimizer': 'adam', 'graph_mode': 'off', 'use_snp_selection': True, 'num_snps': 8929}. Best is trial 53 with value: 0.07554030931412221.
[I 2025-12-05 15:14:15,447] Trial 59 finished with value: -0.04315121841885991 and parameters: {'model_type': 'mlp', 'hidden_dims': '[512, 64]', 'dropout': 0.5892154265815926, 'batch_norm': True, 'lr': 1.0889258301622254e-06, 'weight_decay': 5.587244785554895e-06, 'epochs': 158, 'loss': 'mse', 'optimizer': 'adam', 'graph_mode': 'off', 'use_snp_selection': True, 'num_snps': 15197}. Best is trial 53 with value: 0.07554030931412221.
[I 2025-12-05 15:14:17,644] Trial 60 finished with value: 0.035243732828929966 and parameters: {'model_type': 'mlp', 'hidden_dims': '[512, 64]', 'dropout': 0.19779530025382347, 'batch_norm': True, 'lr': 0.0001306887994178626, 'weight_decay': 3.216477656440282e-05, 'epochs': 253, 'loss': 'mse', 'optimizer': 'adam', 'graph_mode': 'off', 'use_snp_selection': True, 'num_snps': 32644}. Best is trial 53 with value: 0.07554030931412221.
[I 2025-12-05 15:14:19,020] Trial 61 finished with value: 0.06738509448672318 and parameters: {'model_type': 'mlp', 'hidden_dims': '[256, 128]', 'dropout': 0.14037890808096246, 'batch_norm': True, 'lr': 0.00019676439361200943, 'weight_decay': 1.351899632033255e-05, 'epochs': 197, 'loss': 'mse', 'optimizer': 'adam', 'graph_mode': 'off', 'use_snp_selection': True, 'num_snps': 16098}. Best is trial 53 with value: 0.07554030931412221.
[I 2025-12-05 15:14:20,304] Trial 62 finished with value: 0.04801505335164031 and parameters: {'model_type': 'mlp', 'hidden_dims': '[128, 64]', 'dropout': 0.1397837677226732, 'batch_norm': True, 'lr': 0.00039679766745445976, 'weight_decay': 2.164460057232874e-05, 'epochs': 199, 'loss': 'mse', 'optimizer': 'adam', 'graph_mode': 'off', 'use_snp_selection': True, 'num_snps': 14731}. Best is trial 53 with value: 0.07554030931412221.
[I 2025-12-05 15:14:21,450] Trial 63 finished with value: 0.05305979026687774 and parameters: {'model_type': 'mlp', 'hidden_dims': '[256, 128]', 'dropout': 0.15902511510498774, 'batch_norm': True, 'lr': 4.0647199424857926e-05, 'weight_decay': 1.1322688535115143e-05, 'epochs': 180, 'loss': 'mse', 'optimizer': 'adam', 'graph_mode': 'off', 'use_snp_selection': True, 'num_snps': 11828}. Best is trial 53 with value: 0.07554030931412221.
[I 2025-12-05 15:14:23,151] Trial 64 finished with value: 0.02060345728902657 and parameters: {'model_type': 'mlp', 'hidden_dims': '[512, 64]', 'dropout': 0.41431425285208384, 'batch_norm': True, 'lr': 8.101461582715273e-05, 'weight_decay': 4.4175572837269335e-05, 'epochs': 233, 'loss': 'mse', 'optimizer': 'adam', 'graph_mode': 'off', 'use_snp_selection': True, 'num_snps': 24491}. Best is trial 53 with value: 0.07554030931412221.
[I 2025-12-05 15:14:24,520] Trial 65 finished with value: 0.05543225395010756 and parameters: {'model_type': 'mlp', 'hidden_dims': '[512, 256]', 'dropout': 0.11413190183963039, 'batch_norm': True, 'lr': 0.00016223903288712732, 'weight_decay': 2.701496745663281e-06, 'epochs': 189, 'loss': 'mse', 'optimizer': 'adam', 'graph_mode': 'off', 'use_snp_selection': True, 'num_snps': 17417}. Best is trial 53 with value: 0.07554030931412221.
[I 2025-12-05 15:14:25,987] Trial 66 finished with value: 0.05452160883464172 and parameters: {'model_type': 'mlp', 'hidden_dims': '[512, 256]', 'dropout': 0.1156341319539901, 'batch_norm': True, 'lr': 0.0008212918997753866, 'weight_decay': 3.048732233201505e-06, 'epochs': 190, 'loss': 'mse', 'optimizer': 'adam', 'graph_mode': 'off', 'use_snp_selection': True, 'num_snps': 17780}. Best is trial 53 with value: 0.07554030931412221.
[I 2025-12-05 15:14:27,164] Trial 67 finished with value: 0.04018869656551942 and parameters: {'model_type': 'mlp', 'hidden_dims': '[512, 256]', 'dropout': 0.3721572092642402, 'batch_norm': True, 'lr': 0.00025599549424651206, 'weight_decay': 1.3108589274922598e-05, 'epochs': 201, 'loss': 'mse', 'optimizer': 'adam', 'graph_mode': 'off', 'use_snp_selection': True, 'num_snps': 10022}. Best is trial 53 with value: 0.07554030931412221.
[I 2025-12-05 15:14:28,456] Trial 68 finished with value: 0.037189625072347715 and parameters: {'model_type': 'mlp', 'hidden_dims': '[512, 256]', 'dropout': 0.10430590800953905, 'batch_norm': False, 'lr': 0.00014929424161868525, 'weight_decay': 0.00012056220023152736, 'epochs': 281, 'loss': 'mse', 'optimizer': 'adam', 'graph_mode': 'off', 'use_snp_selection': True, 'num_snps': 13400}. Best is trial 53 with value: 0.07554030931412221.
[I 2025-12-05 15:14:31,882] Trial 69 finished with value: 0.03067568298180661 and parameters: {'model_type': 'mlp', 'hidden_dims': '[512, 128]', 'dropout': 0.43719986144529516, 'batch_norm': True, 'lr': 0.00029521217917517783, 'weight_decay': 5.140934520587354e-06, 'epochs': 317, 'loss': 'mse', 'optimizer': 'adam', 'graph_mode': 'off', 'use_snp_selection': True, 'num_snps': 53512}. Best is trial 53 with value: 0.07554030931412221.
[I 2025-12-05 15:14:32,936] Trial 70 finished with value: 0.03731732177770011 and parameters: {'model_type': 'mlp', 'hidden_dims': '[512, 256]', 'dropout': 0.1346376024457042, 'batch_norm': True, 'lr': 0.0004342925359177963, 'weight_decay': 2.7282296066470595e-06, 'epochs': 214, 'loss': 'mse', 'optimizer': 'adam', 'graph_mode': 'off', 'use_snp_selection': True, 'num_snps': 5425}. Best is trial 53 with value: 0.07554030931412221.
[I 2025-12-05 15:14:34,336] Trial 71 finished with value: 0.05984874454392589 and parameters: {'model_type': 'mlp', 'hidden_dims': '[512, 256]', 'dropout': 0.11723289691268825, 'batch_norm': True, 'lr': 0.0008816684693204306, 'weight_decay': 4.315079290745498e-06, 'epochs': 187, 'loss': 'mse', 'optimizer': 'adam', 'graph_mode': 'off', 'use_snp_selection': True, 'num_snps': 17648}. Best is trial 53 with value: 0.07554030931412221.
[I 2025-12-05 15:14:35,727] Trial 72 finished with value: 0.04830515680931537 and parameters: {'model_type': 'mlp', 'hidden_dims': '[512, 256]', 'dropout': 0.11685413524663789, 'batch_norm': True, 'lr': 0.0006070053177668511, 'weight_decay': 5.638210681965282e-06, 'epochs': 171, 'loss': 'mse', 'optimizer': 'adam', 'graph_mode': 'off', 'use_snp_selection': True, 'num_snps': 18888}. Best is trial 53 with value: 0.07554030931412221.
[I 2025-12-05 15:14:37,218] Trial 73 finished with value: 0.05205965965954584 and parameters: {'model_type': 'mlp', 'hidden_dims': '[512, 256]', 'dropout': 0.34186454215275874, 'batch_norm': True, 'lr': 0.0009288874317547371, 'weight_decay': 1.3621190667920056e-06, 'epochs': 184, 'loss': 'mse', 'optimizer': 'adam', 'graph_mode': 'off', 'use_snp_selection': True, 'num_snps': 21690}. Best is trial 53 with value: 0.07554030931412221.
[I 2025-12-05 15:14:38,571] Trial 74 finished with value: 0.042833027343716995 and parameters: {'model_type': 'mlp', 'hidden_dims': '[256, 128]', 'dropout': 0.1473451599352589, 'batch_norm': True, 'lr': 0.00020804112397085822, 'weight_decay': 4.042017531575832e-06, 'epochs': 208, 'loss': 'mse', 'optimizer': 'adam', 'graph_mode': 'off', 'use_snp_selection': True, 'num_snps': 17458}. Best is trial 53 with value: 0.07554030931412221.
[I 2025-12-05 15:14:40,188] Trial 75 finished with value: 0.04873079854422545 and parameters: {'model_type': 'mlp', 'hidden_dims': '[512, 256]', 'dropout': 0.1632827480767348, 'batch_norm': True, 'lr': 0.0001639606386009982, 'weight_decay': 9.06708575173674e-06, 'epochs': 226, 'loss': 'mae', 'optimizer': 'adam', 'graph_mode': 'off', 'use_snp_selection': True, 'num_snps': 21326}. Best is trial 53 with value: 0.07554030931412221.
[I 2025-12-05 15:14:41,546] Trial 76 finished with value: 0.047228447470614936 and parameters: {'model_type': 'mlp', 'hidden_dims': '[512, 128]', 'dropout': 0.10111436867712048, 'batch_norm': True, 'lr': 7.639514468431863e-05, 'weight_decay': 1.909649169857361e-05, 'epochs': 249, 'loss': 'mse', 'optimizer': 'adam', 'graph_mode': 'off', 'use_snp_selection': True, 'num_snps': 12628}. Best is trial 53 with value: 0.07554030931412221.
[I 2025-12-05 15:14:43,034] Trial 77 finished with value: 0.056080759607413926 and parameters: {'model_type': 'mlp', 'hidden_dims': '[256, 128]', 'dropout': 0.11808729674502931, 'batch_norm': False, 'lr': 0.00011848833633001548, 'weight_decay': 2.0841912864149185e-06, 'epochs': 270, 'loss': 'mse', 'optimizer': 'adam', 'graph_mode': 'off', 'use_snp_selection': True, 'num_snps': 19698}. Best is trial 53 with value: 0.07554030931412221.
[I 2025-12-05 15:14:44,656] Trial 78 finished with value: 0.02062127521535461 and parameters: {'model_type': 'mlp', 'hidden_dims': '[256, 128]', 'dropout': 0.13247390084555716, 'batch_norm': False, 'lr': 0.0007149153651547587, 'weight_decay': 1.047617518456182e-06, 'epochs': 269, 'loss': 'mse', 'optimizer': 'adam', 'graph_mode': 'off', 'use_snp_selection': True, 'num_snps': 25460}. Best is trial 53 with value: 0.07554030931412221.
[I 2025-12-05 15:14:46,544] Trial 79 finished with value: 0.019536505465357082 and parameters: {'model_type': 'mlp', 'hidden_dims': '[256, 128]', 'dropout': 0.40053898487365214, 'batch_norm': False, 'lr': 2.456408576179356e-05, 'weight_decay': 2.292488299050471e-06, 'epochs': 291, 'loss': 'mse', 'optimizer': 'adam', 'graph_mode': 'off', 'use_snp_selection': True, 'num_snps': 34083}. Best is trial 53 with value: 0.07554030931412221.
[I 2025-12-05 15:14:47,614] Trial 80 finished with value: 0.02789906471562922 and parameters: {'model_type': 'mlp', 'hidden_dims': '[256, 128]', 'dropout': 0.1905249205695949, 'batch_norm': False, 'lr': 6.0100244474176137e-05, 'weight_decay': 6.434120816551698e-06, 'epochs': 239, 'loss': 'mse', 'optimizer': 'adam', 'graph_mode': 'off', 'use_snp_selection': True, 'num_snps': 8975}. Best is trial 53 with value: 0.07554030931412221.
[I 2025-12-05 15:14:49,010] Trial 81 finished with value: 0.03929795215086512 and parameters: {'model_type': 'mlp', 'hidden_dims': '[128, 64]', 'dropout': 0.11888780074840988, 'batch_norm': False, 'lr': 0.00010545666631531712, 'weight_decay': 1.8079708310200807e-06, 'epochs': 200, 'loss': 'mse', 'optimizer': 'adam', 'graph_mode': 'off', 'use_snp_selection': True, 'num_snps': 18953}. Best is trial 53 with value: 0.07554030931412221.
[I 2025-12-05 15:14:50,869] Trial 82 finished with value: 0.03631138306820958 and parameters: {'model_type': 'mlp', 'hidden_dims': '[256, 128]', 'dropout': 0.14945440022997147, 'batch_norm': False, 'lr': 0.00012677450927787146, 'weight_decay': 3.5621368895198708e-06, 'epochs': 309, 'loss': 'mse', 'optimizer': 'adam', 'graph_mode': 'off', 'use_snp_selection': True, 'num_snps': 29092}. Best is trial 53 with value: 0.07554030931412221.
[I 2025-12-05 15:14:52,350] Trial 83 finished with value: 0.08294699249778348 and parameters: {'model_type': 'mlp', 'hidden_dims': '[512, 128]', 'dropout': 0.11306226734364272, 'batch_norm': True, 'lr': 0.00016532096749601115, 'weight_decay': 1.3702956332049982e-05, 'epochs': 288, 'loss': 'mse', 'optimizer': 'adam', 'graph_mode': 'off', 'use_snp_selection': True, 'num_snps': 16366}. Best is trial 83 with value: 0.08294699249778348.
[I 2025-12-05 15:14:53,918] Trial 84 finished with value: 0.05698480668552194 and parameters: {'model_type': 'mlp', 'hidden_dims': '[512, 128]', 'dropout': 0.1289735005369842, 'batch_norm': True, 'lr': 0.0003422749762114569, 'weight_decay': 1.4743700069764069e-05, 'epochs': 291, 'loss': 'mse', 'optimizer': 'adam', 'graph_mode': 'off', 'use_snp_selection': True, 'num_snps': 20594}. Best is trial 83 with value: 0.08294699249778348.
[I 2025-12-05 15:14:55,470] Trial 85 finished with value: 0.05638950130680239 and parameters: {'model_type': 'mlp', 'hidden_dims': '[512, 128]', 'dropout': 0.1679286187649264, 'batch_norm': True, 'lr': 0.0003254379221639787, 'weight_decay': 1.3372018338927141e-05, 'epochs': 299, 'loss': 'mse', 'optimizer': 'adam', 'graph_mode': 'off', 'use_snp_selection': True, 'num_snps': 20141}. Best is trial 83 with value: 0.08294699249778348.
[I 2025-12-05 15:14:57,275] Trial 86 finished with value: 0.04674704428477745 and parameters: {'model_type': 'mlp', 'hidden_dims': '[512, 128]', 'dropout': 0.17266469145639965, 'batch_norm': True, 'lr': 0.0003572086316531437, 'weight_decay': 1.3738640019289488e-05, 'epochs': 294, 'loss': 'mse', 'optimizer': 'adam', 'graph_mode': 'off', 'use_snp_selection': True, 'num_snps': 23215}. Best is trial 83 with value: 0.08294699249778348.
[I 2025-12-05 15:14:58,799] Trial 87 finished with value: 0.061208611446646605 and parameters: {'model_type': 'mlp', 'hidden_dims': '[512, 128]', 'dropout': 0.13149057166127198, 'batch_norm': True, 'lr': 0.00048807966196252883, 'weight_decay': 2.7026910247529076e-05, 'epochs': 302, 'loss': 'mae', 'optimizer': 'adam', 'graph_mode': 'off', 'use_snp_selection': True, 'num_snps': 14331}. Best is trial 83 with value: 0.08294699249778348.
[I 2025-12-05 15:15:00,290] Trial 88 finished with value: 0.045963121614861095 and parameters: {'model_type': 'mlp', 'hidden_dims': '[512, 128]', 'dropout': 0.2095193182799645, 'batch_norm': True, 'lr': 0.0004830730577714977, 'weight_decay': 2.2866232592035222e-05, 'epochs': 303, 'loss': 'mae', 'optimizer': 'adam', 'graph_mode': 'off', 'use_snp_selection': True, 'num_snps': 15113}. Best is trial 83 with value: 0.08294699249778348.
[I 2025-12-05 15:15:01,820] Trial 89 finished with value: 0.0476698753995137 and parameters: {'model_type': 'mlp', 'hidden_dims': '[512, 128]', 'dropout': 0.1333162891789745, 'batch_norm': True, 'lr': 0.00029411040946197007, 'weight_decay': 2.9601117413180513e-05, 'epochs': 328, 'loss': 'mae', 'optimizer': 'adam', 'graph_mode': 'off', 'use_snp_selection': True, 'num_snps': 16359}. Best is trial 83 with value: 0.08294699249778348.
[I 2025-12-05 15:15:03,441] Trial 90 finished with value: 0.052949367145679126 and parameters: {'model_type': 'mlp', 'hidden_dims': '[512, 128]', 'dropout': 0.16732657839497947, 'batch_norm': True, 'lr': 0.0006970932370508493, 'weight_decay': 5.4945482275455137e-05, 'epochs': 315, 'loss': 'mae', 'optimizer': 'adam', 'graph_mode': 'off', 'use_snp_selection': True, 'num_snps': 20099}. Best is trial 83 with value: 0.08294699249778348.
[I 2025-12-05 15:15:04,816] Trial 91 finished with value: 0.053835429635596295 and parameters: {'model_type': 'mlp', 'hidden_dims': '[512, 128]', 'dropout': 0.14302621991516098, 'batch_norm': True, 'lr': 0.00034082909180518613, 'weight_decay': 8.696754491046204e-06, 'epochs': 278, 'loss': 'mae', 'optimizer': 'adam', 'graph_mode': 'off', 'use_snp_selection': True, 'num_snps': 13906}. Best is trial 83 with value: 0.08294699249778348.
[I 2025-12-05 15:15:06,209] Trial 92 finished with value: 0.04421368950475906 and parameters: {'model_type': 'mlp', 'hidden_dims': '[512, 128]', 'dropout': 0.15066372423929555, 'batch_norm': True, 'lr': 0.00047873569170841417, 'weight_decay': 1.483446724709024e-05, 'epochs': 289, 'loss': 'mae', 'optimizer': 'adam', 'graph_mode': 'off', 'use_snp_selection': True, 'num_snps': 11343}. Best is trial 83 with value: 0.08294699249778348.
[I 2025-12-05 15:15:07,967] Trial 93 finished with value: 0.058904008411637294 and parameters: {'model_type': 'mlp', 'hidden_dims': '[512, 128]', 'dropout': 0.1336123255223839, 'batch_norm': True, 'lr': 0.00021780381063105732, 'weight_decay': 1.0300237889136132e-05, 'epochs': 285, 'loss': 'mse', 'optimizer': 'adam', 'graph_mode': 'off', 'use_snp_selection': True, 'num_snps': 22217}. Best is trial 83 with value: 0.08294699249778348.
[I 2025-12-05 15:15:09,731] Trial 94 finished with value: 0.053151934093657344 and parameters: {'model_type': 'mlp', 'hidden_dims': '[512, 128]', 'dropout': 0.12876532041749117, 'batch_norm': True, 'lr': 0.00022431421739696215, 'weight_decay': 2.1625999708097745e-05, 'epochs': 298, 'loss': 'mse', 'optimizer': 'adam', 'graph_mode': 'off', 'use_snp_selection': True, 'num_snps': 23013}. Best is trial 83 with value: 0.08294699249778348.
[I 2025-12-05 15:15:11,687] Trial 95 finished with value: 0.04525804225333791 and parameters: {'model_type': 'mlp', 'hidden_dims': '[512, 128]', 'dropout': 0.10115003098157625, 'batch_norm': True, 'lr': 0.0002678107627643963, 'weight_decay': 1.0149895833127287e-05, 'epochs': 323, 'loss': 'mse', 'optimizer': 'adam', 'graph_mode': 'off', 'use_snp_selection': True, 'num_snps': 26753}. Best is trial 83 with value: 0.08294699249778348.
[I 2025-12-05 15:15:13,122] Trial 96 finished with value: 0.04911686273588195 and parameters: {'model_type': 'mlp', 'hidden_dims': '[512, 128]', 'dropout': 0.15648401673468051, 'batch_norm': True, 'lr': 0.0005416135975855454, 'weight_decay': 1.77693896235127e-05, 'epochs': 261, 'loss': 'mae', 'optimizer': 'adam', 'graph_mode': 'off', 'use_snp_selection': True, 'num_snps': 16661}. Best is trial 83 with value: 0.08294699249778348.
[I 2025-12-05 15:15:14,975] Trial 97 finished with value: 0.052211734528072956 and parameters: {'model_type': 'mlp', 'hidden_dims': '[512, 128]', 'dropout': 0.18913365984632932, 'batch_norm': True, 'lr': 0.0004025718042800632, 'weight_decay': 6.637334108386258e-06, 'epochs': 334, 'loss': 'mse', 'optimizer': 'adam', 'graph_mode': 'off', 'use_snp_selection': True, 'num_snps': 21906}. Best is trial 83 with value: 0.08294699249778348.
[I 2025-12-05 15:15:16,676] Trial 98 finished with value: 0.049424716333943096 and parameters: {'model_type': 'mlp', 'hidden_dims': '[512, 128]', 'dropout': 0.13566559240826545, 'batch_norm': True, 'lr': 0.00018243794011474828, 'weight_decay': 4.5151998628583115e-05, 'epochs': 300, 'loss': 'mse', 'optimizer': 'adam', 'graph_mode': 'off', 'use_snp_selection': True, 'num_snps': 20954}. Best is trial 83 with value: 0.08294699249778348.
[I 2025-12-05 15:15:18,478] Trial 99 finished with value: 0.04680076564914535 and parameters: {'model_type': 'mlp', 'hidden_dims': '[512, 128]', 'dropout': 0.11120170312071716, 'batch_norm': True, 'lr': 0.00030904705399942544, 'weight_decay': 3.416683105998676e-05, 'epochs': 286, 'loss': 'mse', 'optimizer': 'adam', 'graph_mode': 'off', 'use_snp_selection': True, 'num_snps': 23959}. Best is trial 83 with value: 0.08294699249778348.
[I 2025-12-05 15:15:20,055] Trial 100 finished with value: 0.049371125780945185 and parameters: {'model_type': 'mlp', 'hidden_dims': '[512, 128]', 'dropout': 0.12568714247880927, 'batch_norm': True, 'lr': 0.00023499267078889538, 'weight_decay': 2.5838750650189264e-05, 'epochs': 309, 'loss': 'mse', 'optimizer': 'adam', 'graph_mode': 'off', 'use_snp_selection': True, 'num_snps': 19477}. Best is trial 83 with value: 0.08294699249778348.
[I 2025-12-05 15:15:21,402] Trial 101 finished with value: 0.05775786163119171 and parameters: {'model_type': 'mlp', 'hidden_dims': '[512, 128]', 'dropout': 0.11209222307350547, 'batch_norm': True, 'lr': 0.0008271083512480113, 'weight_decay': 1.064706904417455e-05, 'epochs': 275, 'loss': 'mse', 'optimizer': 'adam', 'graph_mode': 'off', 'use_snp_selection': True, 'num_snps': 13725}. Best is trial 83 with value: 0.08294699249778348.
[I 2025-12-05 15:15:22,757] Trial 102 finished with value: 0.05970558888011601 and parameters: {'model_type': 'mlp', 'hidden_dims': '[512, 128]', 'dropout': 0.110797183900854, 'batch_norm': True, 'lr': 0.000824524086615056, 'weight_decay': 9.13582168555724e-06, 'epochs': 274, 'loss': 'mse', 'optimizer': 'adam', 'graph_mode': 'off', 'use_snp_selection': True, 'num_snps': 13982}. Best is trial 83 with value: 0.08294699249778348.
