[I 2025-12-05 15:34:16,770] Trial 71 finished with value: 0.11341187000118103 and parameters: {'model_type': 'mlp', 'hidden_dims': '[512, 256]', 'dropout': 0.22287665330151327, 'batch_norm': True, 'lr': 0.0005208465645099954, 'weight_decay': 1.3911673369784793e-06, 'epochs': 150, 'loss': 'mse', 'optimizer': 'adam', 'graph_mode': 'off', 'use_snp_selection': True, 'num_snps': 23562}. Best is trial 41 with value: 0.1318840164883516.
[I 2025-12-05 15:34:18,111] Trial 72 finished with value: 0.1214626260040838 and parameters: {'model_type': 'mlp', 'hidden_dims': '[512, 256]', 'dropout': 0.23853675490649248, 'batch_norm': True, 'lr': 0.0005986212300735284, 'weight_decay': 7.097621155437904e-07, 'epochs': 90, 'loss': 'mse', 'optimizer': 'adam', 'graph_mode': 'off', 'use_snp_selection': True, 'num_snps': 20353}. Best is trial 41 with value: 0.1318840164883516.
[I 2025-12-05 15:34:19,812] Trial 73 finished with value: 0.11857347697455685 and parameters: {'model_type': 'mlp', 'hidden_dims': '[512, 256]', 'dropout': 0.26353127147368693, 'batch_norm': True, 'lr': 0.0002511239444302668, 'weight_decay': 4.5925943432273926e-07, 'epochs': 176, 'loss': 'mse', 'optimizer': 'adam', 'graph_mode': 'off', 'use_snp_selection': True, 'num_snps': 25732}. Best is trial 41 with value: 0.1318840164883516.
[I 2025-12-05 15:34:20,960] Trial 74 finished with value: 0.10927884870062948 and parameters: {'model_type': 'mlp', 'hidden_dims': '[512, 256]', 'dropout': 0.19790755081899958, 'batch_norm': True, 'lr': 0.0004336137249615761, 'weight_decay': 5.232702440795476e-07, 'epochs': 137, 'loss': 'mse', 'optimizer': 'adam', 'graph_mode': 'off', 'use_snp_selection': True, 'num_snps': 13022}. Best is trial 41 with value: 0.1318840164883516.
[I 2025-12-05 15:34:22,289] Trial 75 finished with value: 0.11644004637893672 and parameters: {'model_type': 'mlp', 'hidden_dims': '[512, 256]', 'dropout': 0.21878243167131906, 'batch_norm': True, 'lr': 0.0003307307527646083, 'weight_decay': 3.3119953077540386e-07, 'epochs': 156, 'loss': 'mse', 'optimizer': 'adam', 'graph_mode': 'off', 'use_snp_selection': True, 'num_snps': 17847}. Best is trial 41 with value: 0.1318840164883516.
[I 2025-12-05 15:34:23,713] Trial 76 finished with value: 0.10175555428992603 and parameters: {'model_type': 'mlp', 'hidden_dims': '[128, 64]', 'dropout': 0.28499820439644935, 'batch_norm': True, 'lr': 0.00037546208490315316, 'weight_decay': 9.110043417164269e-07, 'epochs': 141, 'loss': 'mse', 'optimizer': 'adam', 'graph_mode': 'off', 'use_snp_selection': True, 'num_snps': 21783}. Best is trial 41 with value: 0.1318840164883516.
[I 2025-12-05 15:34:25,642] Trial 77 finished with value: 0.11490000547742198 and parameters: {'model_type': 'mlp', 'hidden_dims': '[512, 256]', 'dropout': 0.4067220130551103, 'batch_norm': True, 'lr': 0.00046910391335310513, 'weight_decay': 7.690388773796494e-07, 'epochs': 191, 'loss': 'mse', 'optimizer': 'adam', 'graph_mode': 'off', 'use_snp_selection': True, 'num_snps': 28690}. Best is trial 41 with value: 0.1318840164883516.
[I 2025-12-05 15:34:27,293] Trial 78 finished with value: 0.11958924909178435 and parameters: {'model_type': 'mlp', 'hidden_dims': '[256, 128, 64]', 'dropout': 0.24991060110232707, 'batch_norm': True, 'lr': 0.00016861497310280077, 'weight_decay': 1.860851388950023e-06, 'epochs': 214, 'loss': 'mse', 'optimizer': 'adam', 'graph_mode': 'off', 'use_snp_selection': True, 'num_snps': 23966}. Best is trial 41 with value: 0.1318840164883516.
[I 2025-12-05 15:34:29,437] Trial 79 finished with value: 0.1365037755180677 and parameters: {'model_type': 'mlp', 'hidden_dims': '[512, 256]', 'dropout': 0.16844392143167608, 'batch_norm': True, 'lr': 0.00022524544588704902, 'weight_decay': 2.628996023886644e-07, 'epochs': 222, 'loss': 'mse', 'optimizer': 'adam', 'graph_mode': 'off', 'use_snp_selection': True, 'num_snps': 33192}. Best is trial 79 with value: 0.1365037755180677.
[I 2025-12-05 15:34:31,546] Trial 80 finished with value: 0.11960399722786993 and parameters: {'model_type': 'mlp', 'hidden_dims': '[512, 256]', 'dropout': 0.1696669486522095, 'batch_norm': True, 'lr': 0.00022020007782606212, 'weight_decay': 2.036141846962867e-07, 'epochs': 202, 'loss': 'mse', 'optimizer': 'adam', 'graph_mode': 'off', 'use_snp_selection': True, 'num_snps': 33730}. Best is trial 79 with value: 0.1365037755180677.
[I 2025-12-05 15:34:33,257] Trial 81 finished with value: 0.12198762691057806 and parameters: {'model_type': 'mlp', 'hidden_dims': '[512, 256]', 'dropout': 0.23304682896061554, 'batch_norm': True, 'lr': 0.00027352751546793827, 'weight_decay': 2.567887259829922e-07, 'epochs': 223, 'loss': 'mse', 'optimizer': 'adam', 'graph_mode': 'off', 'use_snp_selection': True, 'num_snps': 21234}. Best is trial 79 with value: 0.1365037755180677.
[I 2025-12-05 15:34:35,308] Trial 82 finished with value: 0.12353082271424703 and parameters: {'model_type': 'mlp', 'hidden_dims': '[512, 256]', 'dropout': 0.2006069610893549, 'batch_norm': True, 'lr': 0.0006267242525482218, 'weight_decay': 1.605042087341115e-07, 'epochs': 211, 'loss': 'mse', 'optimizer': 'adam', 'graph_mode': 'off', 'use_snp_selection': True, 'num_snps': 29579}. Best is trial 79 with value: 0.1365037755180677.
[I 2025-12-05 15:34:37,276] Trial 83 finished with value: 0.11588064276094816 and parameters: {'model_type': 'mlp', 'hidden_dims': '[512, 256]', 'dropout': 0.1843824882585973, 'batch_norm': True, 'lr': 0.00032481572527631063, 'weight_decay': 3.5977182198474657e-07, 'epochs': 235, 'loss': 'mse', 'optimizer': 'adam', 'graph_mode': 'off', 'use_snp_selection': True, 'num_snps': 26119}. Best is trial 79 with value: 0.1365037755180677.
[I 2025-12-05 15:34:39,384] Trial 84 finished with value: 0.1259701116960992 and parameters: {'model_type': 'mlp', 'hidden_dims': '[512, 256]', 'dropout': 0.2180377428996275, 'batch_norm': True, 'lr': 0.000427927819827379, 'weight_decay': 5.014585470455732e-07, 'epochs': 181, 'loss': 'mse', 'optimizer': 'adam', 'graph_mode': 'off', 'use_snp_selection': True, 'num_snps': 32723}. Best is trial 79 with value: 0.1365037755180677.
[I 2025-12-05 15:34:40,825] Trial 85 finished with value: 0.1300276549581578 and parameters: {'model_type': 'mlp', 'hidden_dims': '[512, 256]', 'dropout': 0.164392512921528, 'batch_norm': True, 'lr': 0.000512130501877625, 'weight_decay': 2.0165637827760918e-07, 'epochs': 123, 'loss': 'mse', 'optimizer': 'adam', 'graph_mode': 'off', 'use_snp_selection': True, 'num_snps': 18943}. Best is trial 79 with value: 0.1365037755180677.
[I 2025-12-05 15:34:42,098] Trial 86 finished with value: 0.12621751989239746 and parameters: {'model_type': 'mlp', 'hidden_dims': '[512, 64]', 'dropout': 0.1667571151628038, 'batch_norm': True, 'lr': 0.0007907139039130301, 'weight_decay': 6.889298980065986e-07, 'epochs': 92, 'loss': 'mse', 'optimizer': 'adam', 'graph_mode': 'off', 'use_snp_selection': True, 'num_snps': 14926}. Best is trial 79 with value: 0.1365037755180677.
[I 2025-12-05 15:34:43,460] Trial 87 finished with value: 0.09291105664834189 and parameters: {'model_type': 'mlp', 'hidden_dims': '[512, 256]', 'dropout': 0.14222011134829649, 'batch_norm': False, 'lr': 0.00015808679239796627, 'weight_decay': 2.2361668279016635e-07, 'epochs': 107, 'loss': 'mse', 'optimizer': 'adam', 'graph_mode': 'off', 'use_snp_selection': True, 'num_snps': 18958}. Best is trial 79 with value: 0.1365037755180677.
[I 2025-12-05 15:34:45,773] Trial 88 finished with value: 0.12115273816711228 and parameters: {'model_type': 'mlp', 'hidden_dims': '[512, 256]', 'dropout': 0.15725154560345808, 'batch_norm': True, 'lr': 0.00011875127686563223, 'weight_decay': 1.2586196430338122e-06, 'epochs': 169, 'loss': 'mse', 'optimizer': 'adam', 'graph_mode': 'off', 'use_snp_selection': True, 'num_snps': 36714}. Best is trial 79 with value: 0.1365037755180677.
[I 2025-12-05 15:34:47,209] Trial 89 finished with value: 0.09133481628059606 and parameters: {'model_type': 'mlp', 'hidden_dims': '[256, 128]', 'dropout': 0.11507867481202956, 'batch_norm': True, 'lr': 1.7075302247112434e-05, 'weight_decay': 2.4713029031408662e-06, 'epochs': 127, 'loss': 'mse', 'optimizer': 'adam', 'graph_mode': 'off', 'use_snp_selection': True, 'num_snps': 20586}. Best is trial 79 with value: 0.1365037755180677.
[I 2025-12-05 15:34:48,375] Trial 90 finished with value: 0.08962077638981882 and parameters: {'model_type': 'mlp', 'hidden_dims': '[512, 256]', 'dropout': 0.18027049977919726, 'batch_norm': True, 'lr': 8.412831100096083e-05, 'weight_decay': 9.638464507651388e-07, 'epochs': 158, 'loss': 'mse', 'optimizer': 'adam', 'graph_mode': 'off', 'use_snp_selection': True, 'num_snps': 9868}. Best is trial 79 with value: 0.1365037755180677.
[I 2025-12-05 15:34:50,272] Trial 91 finished with value: 0.13416075158300633 and parameters: {'model_type': 'mlp', 'hidden_dims': '[512, 256]', 'dropout': 0.2070683191774457, 'batch_norm': True, 'lr': 0.0005326140150367066, 'weight_decay': 1.8053539291663863e-07, 'epochs': 250, 'loss': 'mse', 'optimizer': 'adam', 'graph_mode': 'off', 'use_snp_selection': True, 'num_snps': 24281}. Best is trial 79 with value: 0.1365037755180677.
[I 2025-12-05 15:34:52,401] Trial 92 finished with value: 0.12468794479521504 and parameters: {'model_type': 'mlp', 'hidden_dims': '[512, 256]', 'dropout': 0.20877191102913095, 'batch_norm': True, 'lr': 0.0004856226252537737, 'weight_decay': 2.9423047502168593e-07, 'epochs': 265, 'loss': 'mse', 'optimizer': 'adam', 'graph_mode': 'off', 'use_snp_selection': True, 'num_snps': 27809}. Best is trial 79 with value: 0.1365037755180677.
[I 2025-12-05 15:34:54,555] Trial 93 finished with value: 0.13754056954986763 and parameters: {'model_type': 'mlp', 'hidden_dims': '[512, 256]', 'dropout': 0.201059593340614, 'batch_norm': True, 'lr': 0.00036962375581630486, 'weight_decay': 1.9140206468669695e-07, 'epochs': 250, 'loss': 'mse', 'optimizer': 'adam', 'graph_mode': 'off', 'use_snp_selection': True, 'num_snps': 30986}. Best is trial 93 with value: 0.13754056954986763.
[I 2025-12-05 15:34:56,756] Trial 94 finished with value: 0.1172997566678949 and parameters: {'model_type': 'mlp', 'hidden_dims': '[512, 256]', 'dropout': 0.20069643143736698, 'batch_norm': True, 'lr': 0.00026861098911300045, 'weight_decay': 1.8380969426709594e-07, 'epochs': 245, 'loss': 'mse', 'optimizer': 'adam', 'graph_mode': 'off', 'use_snp_selection': True, 'num_snps': 30711}. Best is trial 93 with value: 0.13754056954986763.
[I 2025-12-05 15:34:58,535] Trial 95 finished with value: 0.12733984904286466 and parameters: {'model_type': 'mlp', 'hidden_dims': '[128, 64]', 'dropout': 0.1941768973878935, 'batch_norm': True, 'lr': 0.00037804078040097887, 'weight_decay': 3.695806106371873e-07, 'epochs': 258, 'loss': 'mse', 'optimizer': 'adam', 'graph_mode': 'off', 'use_snp_selection': True, 'num_snps': 26490}. Best is trial 93 with value: 0.13754056954986763.
[I 2025-12-05 15:35:00,865] Trial 96 finished with value: 0.12748046483720257 and parameters: {'model_type': 'mlp', 'hidden_dims': '[512, 256]', 'dropout': 0.4430308387177639, 'batch_norm': True, 'lr': 0.0005266671615790746, 'weight_decay': 7.015773452832015e-05, 'epochs': 273, 'loss': 'mse', 'optimizer': 'adam', 'graph_mode': 'off', 'use_snp_selection': True, 'num_snps': 31936}. Best is trial 93 with value: 0.13754056954986763.
[I 2025-12-05 15:35:03,202] Trial 97 finished with value: 0.12941991067174663 and parameters: {'model_type': 'mlp', 'hidden_dims': '[512, 256]', 'dropout': 0.1623781206992353, 'batch_norm': True, 'lr': 0.0002065026272733103, 'weight_decay': 1.5003340181482622e-07, 'epochs': 249, 'loss': 'mse', 'optimizer': 'adam', 'graph_mode': 'off', 'use_snp_selection': True, 'num_snps': 34471}. Best is trial 93 with value: 0.13754056954986763.
[I 2025-12-05 15:35:05,946] Trial 98 finished with value: 0.13330621111370927 and parameters: {'model_type': 'mlp', 'hidden_dims': '[512, 256]', 'dropout': 0.16257688495044703, 'batch_norm': True, 'lr': 0.00021731623101756782, 'weight_decay': 1.4489182145533655e-07, 'epochs': 255, 'loss': 'mse', 'optimizer': 'adam', 'graph_mode': 'off', 'use_snp_selection': True, 'num_snps': 40152}. Best is trial 93 with value: 0.13754056954986763.
[I 2025-12-05 15:35:08,113] Trial 99 finished with value: 0.06290303387464749 and parameters: {'model_type': 'mlp', 'hidden_dims': '[256, 128, 64]', 'dropout': 0.14615081162124666, 'batch_norm': True, 'lr': 3.391347869396835e-05, 'weight_decay': 1.0122409146238973e-07, 'epochs': 115, 'loss': 'mse', 'optimizer': 'adam', 'graph_mode': 'off', 'use_snp_selection': True, 'num_snps': 41612}. Best is trial 93 with value: 0.13754056954986763.
[I 2025-12-05 15:35:11,449] Trial 100 finished with value: 0.12281563352993669 and parameters: {'model_type': 'mlp', 'hidden_dims': '[512, 256]', 'dropout': 0.12362152557778489, 'batch_norm': True, 'lr': 0.0007237028877973771, 'weight_decay': 2.0095653626888608e-07, 'epochs': 261, 'loss': 'mse', 'optimizer': 'adam', 'graph_mode': 'off', 'use_snp_selection': True, 'num_snps': 51019}. Best is trial 93 with value: 0.13754056954986763.
[I 2025-12-05 15:35:13,843] Trial 101 finished with value: 0.11307173962795342 and parameters: {'model_type': 'mlp', 'hidden_dims': '[512, 256]', 'dropout': 0.16370615099976615, 'batch_norm': True, 'lr': 0.00020587813497107134, 'weight_decay': 1.6207612684772263e-07, 'epochs': 252, 'loss': 'mse', 'optimizer': 'adam', 'graph_mode': 'off', 'use_snp_selection': True, 'num_snps': 35138}. Best is trial 93 with value: 0.13754056954986763.
[I 2025-12-05 15:35:16,342] Trial 102 finished with value: 0.12375438408841832 and parameters: {'model_type': 'mlp', 'hidden_dims': '[512, 256]', 'dropout': 0.17902659948081723, 'batch_norm': True, 'lr': 0.00029366841120500236, 'weight_decay': 1.422791047611104e-07, 'epochs': 247, 'loss': 'mse', 'optimizer': 'adam', 'graph_mode': 'off', 'use_snp_selection': True, 'num_snps': 38454}. Best is trial 93 with value: 0.13754056954986763.
[I 2025-12-05 15:35:19,201] Trial 103 finished with value: 0.1292208655022338 and parameters: {'model_type': 'mlp', 'hidden_dims': '[512, 256]', 'dropout': 0.17404589390832695, 'batch_norm': True, 'lr': 0.00023682914637713126, 'weight_decay': 1.13053348807067e-07, 'epochs': 239, 'loss': 'mse', 'optimizer': 'adam', 'graph_mode': 'off', 'use_snp_selection': True, 'num_snps': 44770}. Best is trial 93 with value: 0.13754056954986763.
[I 2025-12-05 15:35:21,515] Trial 104 finished with value: 0.12447677928704902 and parameters: {'model_type': 'mlp', 'hidden_dims': '[512, 256]', 'dropout': 0.1527981962227237, 'batch_norm': True, 'lr': 0.00019073923738864107, 'weight_decay': 9.216421379177075e-06, 'epochs': 233, 'loss': 'mse', 'optimizer': 'adam', 'graph_mode': 'off', 'use_snp_selection': True, 'num_snps': 34584}. Best is trial 93 with value: 0.13754056954986763.
[I 2025-12-05 15:35:23,488] Trial 105 finished with value: 0.1204700662584482 and parameters: {'model_type': 'mlp', 'hidden_dims': '[512, 256]', 'dropout': 0.1910386211092012, 'batch_norm': True, 'lr': 0.0004133413027079391, 'weight_decay': 2.3259491513314808e-07, 'epochs': 79, 'loss': 'mse', 'optimizer': 'adam', 'graph_mode': 'off', 'use_snp_selection': True, 'num_snps': 37324}. Best is trial 93 with value: 0.13754056954986763.
[I 2025-12-05 15:35:25,548] Trial 106 finished with value: 0.11794551903034749 and parameters: {'model_type': 'mlp', 'hidden_dims': '[512, 64]', 'dropout': 0.13574629272531513, 'batch_norm': False, 'lr': 0.0005640553741059105, 'weight_decay': 1.7579672152033423e-07, 'epochs': 251, 'loss': 'mse', 'optimizer': 'adam', 'graph_mode': 'off', 'use_snp_selection': True, 'num_snps': 30051}. Best is trial 93 with value: 0.13754056954986763.
[I 2025-12-05 15:35:27,419] Trial 107 finished with value: 0.12620021805514636 and parameters: {'model_type': 'mlp', 'hidden_dims': '[512, 256]', 'dropout': 0.2114994489774333, 'batch_norm': True, 'lr': 0.0001778368446390818, 'weight_decay': 1.3445939364178728e-07, 'epochs': 269, 'loss': 'mse', 'optimizer': 'adam', 'graph_mode': 'off', 'use_snp_selection': True, 'num_snps': 25068}. Best is trial 93 with value: 0.13754056954986763.
[I 2025-12-05 15:35:28,941] Trial 108 finished with value: 0.12159660945769825 and parameters: {'model_type': 'mlp', 'hidden_dims': '[512, 128]', 'dropout': 0.1596301877560098, 'batch_norm': True, 'lr': 0.00024229133250136257, 'weight_decay': 2.5419612812904226e-07, 'epochs': 276, 'loss': 'mse', 'optimizer': 'adam', 'graph_mode': 'off', 'use_snp_selection': True, 'num_snps': 17949}. Best is trial 93 with value: 0.13754056954986763.
[I 2025-12-05 15:35:31,297] Trial 109 finished with value: 0.12211035076807103 and parameters: {'model_type': 'mlp', 'hidden_dims': '[512, 256]', 'dropout': 0.24453907219321078, 'batch_norm': True, 'lr': 0.00036387708251626696, 'weight_decay': 4.0353628241195996e-07, 'epochs': 145, 'loss': 'mse', 'optimizer': 'adam', 'graph_mode': 'off', 'use_snp_selection': True, 'num_snps': 41684}. Best is trial 93 with value: 0.13754056954986763.
[I 2025-12-05 15:35:34,246] Trial 110 finished with value: 0.1291246831331151 and parameters: {'model_type': 'mlp', 'hidden_dims': '[512, 256]', 'dropout': 0.18659382613975484, 'batch_norm': True, 'lr': 0.0009010219898039082, 'weight_decay': 3.231803948335775e-07, 'epochs': 232, 'loss': 'mse', 'optimizer': 'adam', 'graph_mode': 'off', 'use_snp_selection': True, 'num_snps': 48084}. Best is trial 93 with value: 0.13754056954986763.
[I 2025-12-05 15:35:36,116] Trial 111 finished with value: 0.12253800792036763 and parameters: {'model_type': 'mlp', 'hidden_dims': '[512, 256]', 'dropout': 0.21597719387159897, 'batch_norm': True, 'lr': 0.0003073845327950826, 'weight_decay': 6.092445277181047e-07, 'epochs': 290, 'loss': 'mse', 'optimizer': 'adam', 'graph_mode': 'off', 'use_snp_selection': True, 'num_snps': 23074}. Best is trial 93 with value: 0.13754056954986763.
[I 2025-12-05 15:35:38,015] Trial 112 finished with value: 0.12740794493883195 and parameters: {'model_type': 'mlp', 'hidden_dims': '[512, 256]', 'dropout': 0.17534980375423928, 'batch_norm': True, 'lr': 0.0004687088249479179, 'weight_decay': 2.0249368061301873e-07, 'epochs': 216, 'loss': 'mse', 'optimizer': 'adam', 'graph_mode': 'off', 'use_snp_selection': True, 'num_snps': 27434}. Best is trial 93 with value: 0.13754056954986763.
[I 2025-12-05 15:35:40,142] Trial 113 finished with value: 0.12160467231239519 and parameters: {'model_type': 'mlp', 'hidden_dims': '[512, 256]', 'dropout': 0.2366888305524604, 'batch_norm': True, 'lr': 0.00036649579575248956, 'weight_decay': 4.960982968019288e-07, 'epochs': 227, 'loss': 'mse', 'optimizer': 'adam', 'graph_mode': 'off', 'use_snp_selection': True, 'num_snps': 32192}. Best is trial 93 with value: 0.13754056954986763.
[I 2025-12-05 15:35:41,512] Trial 114 finished with value: 0.10834321953125521 and parameters: {'model_type': 'mlp', 'hidden_dims': '[512, 256]', 'dropout': 0.2622162666840493, 'batch_norm': True, 'lr': 0.0001225171575525007, 'weight_decay': 1.1744608026428421e-07, 'epochs': 195, 'loss': 'mse', 'optimizer': 'adam', 'graph_mode': 'off', 'use_snp_selection': True, 'num_snps': 15838}. Best is trial 93 with value: 0.13754056954986763.
[I 2025-12-05 15:35:42,877] Trial 115 finished with value: 0.1208630459766413 and parameters: {'model_type': 'mlp', 'hidden_dims': '[512, 256]', 'dropout': 0.20263737704208504, 'batch_norm': True, 'lr': 0.00027029184228823843, 'weight_decay': 1.5269054953551618e-07, 'epochs': 129, 'loss': 'mse', 'optimizer': 'adam', 'graph_mode': 'off', 'use_snp_selection': True, 'num_snps': 19415}. Best is trial 93 with value: 0.13754056954986763.
[I 2025-12-05 15:35:44,569] Trial 116 finished with value: 0.12527634781822364 and parameters: {'model_type': 'mlp', 'hidden_dims': '[256, 128]', 'dropout': 0.22730748169181225, 'batch_norm': True, 'lr': 0.000422126844590597, 'weight_decay': 2.682561133163581e-07, 'epochs': 258, 'loss': 'mse', 'optimizer': 'adam', 'graph_mode': 'off', 'use_snp_selection': True, 'num_snps': 24305}. Best is trial 93 with value: 0.13754056954986763.
[I 2025-12-05 15:35:46,143] Trial 117 finished with value: 0.1290213651205514 and parameters: {'model_type': 'mlp', 'hidden_dims': '[512, 256]', 'dropout': 0.19311317308114745, 'batch_norm': True, 'lr': 0.000682737491082917, 'weight_decay': 4.2770390161301623e-07, 'epochs': 221, 'loss': 'mse', 'optimizer': 'adam', 'graph_mode': 'off', 'use_snp_selection': True, 'num_snps': 20794}. Best is trial 93 with value: 0.13754056954986763.
[I 2025-12-05 15:35:47,726] Trial 118 finished with value: 0.1247321760682142 and parameters: {'model_type': 'mlp', 'hidden_dims': '[512, 256]', 'dropout': 0.5209506144250644, 'batch_norm': True, 'lr': 0.0005315086941287704, 'weight_decay': 7.722125452698241e-07, 'epochs': 187, 'loss': 'mse', 'optimizer': 'adam', 'graph_mode': 'off', 'use_snp_selection': True, 'num_snps': 22245}. Best is trial 93 with value: 0.13754056954986763.
[I 2025-12-05 15:35:49,594] Trial 119 finished with value: 0.1098719568134699 and parameters: {'model_type': 'mlp', 'hidden_dims': '[128, 64]', 'dropout': 0.1445180482908843, 'batch_norm': True, 'lr': 0.00021476605870533304, 'weight_decay': 3.3306525448030447e-07, 'epochs': 246, 'loss': 'mse', 'optimizer': 'adam', 'graph_mode': 'off', 'use_snp_selection': True, 'num_snps': 29797}. Best is trial 93 with value: 0.13754056954986763.
[I 2025-12-05 15:35:51,185] Trial 120 finished with value: 0.10875404346677417 and parameters: {'model_type': 'mlp', 'hidden_dims': '[512, 256]', 'dropout': 0.36899574680505287, 'batch_norm': False, 'lr': 0.00034264051107107913, 'weight_decay': 1.7613717009279804e-07, 'epochs': 119, 'loss': 'mse', 'optimizer': 'adam', 'graph_mode': 'off', 'use_snp_selection': True, 'num_snps': 25133}. Best is trial 93 with value: 0.13754056954986763.
