[I 2025-12-05 14:58:03,609] Trial 136 finished with value: 0.15820823983030843 and parameters: {'model_type': 'mlp', 'hidden_dims': '[512, 128]', 'dropout': 0.11116907239040122, 'batch_norm': True, 'lr': 0.0007430494928629338, 'weight_decay': 1.5784260433083888e-07, 'epochs': 207, 'loss': 'mae', 'optimizer': 'adam', 'graph_mode': 'off', 'use_snp_selection': True, 'num_snps': 39299}. Best is trial 59 with value: 0.17338871024337962.
[I 2025-12-05 14:58:05,631] Trial 137 finished with value: 0.16739355293489563 and parameters: {'model_type': 'mlp', 'hidden_dims': '[512, 128]', 'dropout': 0.12785780368459, 'batch_norm': True, 'lr': 0.0006470928944147252, 'weight_decay': 4.7508806670175126e-07, 'epochs': 194, 'loss': 'mae', 'optimizer': 'adam', 'graph_mode': 'off', 'use_snp_selection': True, 'num_snps': 37116}. Best is trial 59 with value: 0.17338871024337962.
[I 2025-12-05 14:58:07,732] Trial 138 finished with value: 0.12383878433499995 and parameters: {'model_type': 'mlp', 'hidden_dims': '[512, 128]', 'dropout': 0.1330256767489284, 'batch_norm': False, 'lr': 0.0006695989376494212, 'weight_decay': 4.3647561564346587e-07, 'epochs': 195, 'loss': 'mae', 'optimizer': 'adam', 'graph_mode': 'off', 'use_snp_selection': True, 'num_snps': 39256}. Best is trial 59 with value: 0.17338871024337962.
[I 2025-12-05 14:58:09,712] Trial 139 finished with value: 0.16075781617246895 and parameters: {'model_type': 'mlp', 'hidden_dims': '[512, 128]', 'dropout': 0.13110990458291522, 'batch_norm': True, 'lr': 0.0005471935736973961, 'weight_decay': 8.237239291228111e-07, 'epochs': 184, 'loss': 'mae', 'optimizer': 'adam', 'graph_mode': 'off', 'use_snp_selection': True, 'num_snps': 36770}. Best is trial 59 with value: 0.17338871024337962.
[I 2025-12-05 14:58:12,098] Trial 140 finished with value: 0.15560761186986025 and parameters: {'model_type': 'mlp', 'hidden_dims': '[512, 128]', 'dropout': 0.11110331420818687, 'batch_norm': True, 'lr': 0.0008955226893503437, 'weight_decay': 2.677530624224402e-07, 'epochs': 232, 'loss': 'mae', 'optimizer': 'adam', 'graph_mode': 'off', 'use_snp_selection': True, 'num_snps': 42963}. Best is trial 59 with value: 0.17338871024337962.
[I 2025-12-05 14:58:14,111] Trial 141 finished with value: 0.1558345047349804 and parameters: {'model_type': 'mlp', 'hidden_dims': '[512, 128]', 'dropout': 0.12102786293475314, 'batch_norm': True, 'lr': 0.0007726549039370762, 'weight_decay': 4.509880757940497e-07, 'epochs': 161, 'loss': 'mae', 'optimizer': 'adam', 'graph_mode': 'off', 'use_snp_selection': True, 'num_snps': 37466}. Best is trial 59 with value: 0.17338871024337962.
[I 2025-12-05 14:58:16,032] Trial 142 finished with value: 0.17241679580165487 and parameters: {'model_type': 'mlp', 'hidden_dims': '[512, 128]', 'dropout': 0.1084464234760522, 'batch_norm': True, 'lr': 0.0006439368321283428, 'weight_decay': 2.081410926733945e-07, 'epochs': 195, 'loss': 'mae', 'optimizer': 'adam', 'graph_mode': 'off', 'use_snp_selection': True, 'num_snps': 33574}. Best is trial 59 with value: 0.17338871024337962.
[I 2025-12-05 14:58:17,904] Trial 143 finished with value: 0.17215194051898747 and parameters: {'model_type': 'mlp', 'hidden_dims': '[512, 128]', 'dropout': 0.10054746156627416, 'batch_norm': True, 'lr': 0.0006209218966710241, 'weight_decay': 1.4406070389835964e-07, 'epochs': 195, 'loss': 'mae', 'optimizer': 'adam', 'graph_mode': 'off', 'use_snp_selection': True, 'num_snps': 33459}. Best is trial 59 with value: 0.17338871024337962.
[I 2025-12-05 14:58:19,795] Trial 144 finished with value: 0.1685433269100215 and parameters: {'model_type': 'mlp', 'hidden_dims': '[512, 128]', 'dropout': 0.10079360223331844, 'batch_norm': True, 'lr': 0.0004755888086901479, 'weight_decay': 1.9886320911288656e-07, 'epochs': 191, 'loss': 'mae', 'optimizer': 'adam', 'graph_mode': 'off', 'use_snp_selection': True, 'num_snps': 34192}. Best is trial 59 with value: 0.17338871024337962.
[I 2025-12-05 14:58:21,645] Trial 145 finished with value: 0.16975200739562762 and parameters: {'model_type': 'mlp', 'hidden_dims': '[512, 128]', 'dropout': 0.10031854675937485, 'batch_norm': True, 'lr': 0.000510690567451537, 'weight_decay': 2.229919884610772e-07, 'epochs': 191, 'loss': 'mae', 'optimizer': 'adam', 'graph_mode': 'off', 'use_snp_selection': True, 'num_snps': 33120}. Best is trial 59 with value: 0.17338871024337962.
[I 2025-12-05 14:58:23,531] Trial 146 finished with value: 0.16108343528499672 and parameters: {'model_type': 'mlp', 'hidden_dims': '[512, 128]', 'dropout': 0.10358881064612464, 'batch_norm': True, 'lr': 0.0005128035784392255, 'weight_decay': 2.0812212539073648e-07, 'epochs': 193, 'loss': 'mae', 'optimizer': 'adam', 'graph_mode': 'off', 'use_snp_selection': True, 'num_snps': 33961}. Best is trial 59 with value: 0.17338871024337962.
[I 2025-12-05 14:58:25,279] Trial 147 finished with value: 0.1532173466867223 and parameters: {'model_type': 'mlp', 'hidden_dims': '[512, 128]', 'dropout': 0.10102413988304812, 'batch_norm': True, 'lr': 0.0005809913509410105, 'weight_decay': 1.3906257699011323e-07, 'epochs': 205, 'loss': 'mae', 'optimizer': 'adam', 'graph_mode': 'off', 'use_snp_selection': True, 'num_snps': 30188}. Best is trial 59 with value: 0.17338871024337962.
[I 2025-12-05 14:58:27,242] Trial 148 finished with value: 0.15615285303400794 and parameters: {'model_type': 'mlp', 'hidden_dims': '[512, 128]', 'dropout': 0.11111999418600255, 'batch_norm': True, 'lr': 0.000898950888160733, 'weight_decay': 3.1276729678042524e-07, 'epochs': 221, 'loss': 'mae', 'optimizer': 'adam', 'graph_mode': 'off', 'use_snp_selection': True, 'num_snps': 32263}. Best is trial 59 with value: 0.17338871024337962.
[I 2025-12-05 14:58:29,104] Trial 149 finished with value: 0.164030158730513 and parameters: {'model_type': 'mlp', 'hidden_dims': '[512, 128]', 'dropout': 0.10100981020104755, 'batch_norm': True, 'lr': 0.0006826833485181601, 'weight_decay': 1.2067256068451152e-06, 'epochs': 177, 'loss': 'mae', 'optimizer': 'adam', 'graph_mode': 'off', 'use_snp_selection': True, 'num_snps': 34126}. Best is trial 59 with value: 0.17338871024337962.
[I 2025-12-05 14:58:31,296] Trial 0 finished with value: 0.012134508996893278 and parameters: {'model_type': 'mlp', 'hidden_dims': '[128, 64]', 'dropout': 0.199031432379812, 'batch_norm': True, 'lr': 1.8408544111075837e-06, 'weight_decay': 5.5136510071208614e-05, 'epochs': 336, 'loss': 'mae', 'optimizer': 'adam', 'graph_mode': 'off', 'use_snp_selection': True, 'num_snps': 43862}. Best is trial 0 with value: 0.012134508996893278.
[I 2025-12-05 14:58:32,386] Trial 1 finished with value: 0.04091225080971059 and parameters: {'model_type': 'mlp', 'hidden_dims': '[256, 128]', 'dropout': 0.4370668075331726, 'batch_norm': True, 'lr': 7.133471581159139e-05, 'weight_decay': 1.128633586803549e-05, 'epochs': 242, 'loss': 'mae', 'optimizer': 'adam', 'graph_mode': 'off', 'use_snp_selection': False}. Best is trial 1 with value: 0.04091225080971059.
[I 2025-12-05 14:58:33,388] Trial 2 finished with value: 0.05252320060244751 and parameters: {'model_type': 'mlp', 'hidden_dims': '[256, 128, 64]', 'dropout': 0.41314357415569625, 'batch_norm': False, 'lr': 3.952233718592101e-06, 'weight_decay': 0.00026754769258252603, 'epochs': 149, 'loss': 'mse', 'optimizer': 'adam', 'graph_mode': 'off', 'use_snp_selection': True, 'num_snps': 11571}. Best is trial 2 with value: 0.05252320060244751.
[I 2025-12-05 14:58:35,235] Trial 3 finished with value: 0.08939730523412698 and parameters: {'model_type': 'mlp', 'hidden_dims': '[512, 64]', 'dropout': 0.5938127374509361, 'batch_norm': False, 'lr': 5.67704586114731e-06, 'weight_decay': 2.4518087630137052e-05, 'epochs': 320, 'loss': 'mae', 'optimizer': 'adam', 'graph_mode': 'off', 'use_snp_selection': False}. Best is trial 3 with value: 0.08939730523412698.
[I 2025-12-05 14:58:37,425] Trial 4 finished with value: 0.020204371500376992 and parameters: {'model_type': 'mlp', 'hidden_dims': '[512, 128]', 'dropout': 0.25746343592134413, 'batch_norm': True, 'lr': 1.3467657668402788e-06, 'weight_decay': 0.00033087251918647806, 'epochs': 277, 'loss': 'mse', 'optimizer': 'adam', 'graph_mode': 'off', 'use_snp_selection': True, 'num_snps': 36675}. Best is trial 3 with value: 0.08939730523412698.
[I 2025-12-05 14:58:39,201] Trial 5 finished with value: 0.01679211353785229 and parameters: {'model_type': 'mlp', 'hidden_dims': '[512, 64]', 'dropout': 0.38275350994408375, 'batch_norm': True, 'lr': 1.5586664309232824e-06, 'weight_decay': 0.0008227664668621182, 'epochs': 145, 'loss': 'mae', 'optimizer': 'adam', 'graph_mode': 'off', 'use_snp_selection': True, 'num_snps': 32148}. Best is trial 3 with value: 0.08939730523412698.
[I 2025-12-05 14:58:40,197] Trial 6 finished with value: 0.032534651400717624 and parameters: {'model_type': 'mlp', 'hidden_dims': '[256, 128]', 'dropout': 0.3930109900265879, 'batch_norm': False, 'lr': 4.892964372128395e-05, 'weight_decay': 1.5809549317992182e-06, 'epochs': 199, 'loss': 'mse', 'optimizer': 'adam', 'graph_mode': 'off', 'use_snp_selection': False}. Best is trial 3 with value: 0.08939730523412698.
[I 2025-12-05 14:58:41,314] Trial 7 finished with value: 0.052784477273497034 and parameters: {'model_type': 'mlp', 'hidden_dims': '[512, 256]', 'dropout': 0.15343979219678458, 'batch_norm': True, 'lr': 6.234003099047341e-05, 'weight_decay': 3.894760610535477e-07, 'epochs': 97, 'loss': 'mse', 'optimizer': 'adam', 'graph_mode': 'off', 'use_snp_selection': False}. Best is trial 3 with value: 0.08939730523412698.
[I 2025-12-05 14:58:43,152] Trial 8 finished with value: 0.04564087880060694 and parameters: {'model_type': 'mlp', 'hidden_dims': '[512, 128]', 'dropout': 0.10743001231661406, 'batch_norm': True, 'lr': 0.00023728538449271062, 'weight_decay': 1.7629071578048637e-05, 'epochs': 312, 'loss': 'mae', 'optimizer': 'adam', 'graph_mode': 'off', 'use_snp_selection': False}. Best is trial 3 with value: 0.08939730523412698.
[I 2025-12-05 14:58:44,511] Trial 9 finished with value: 0.03640693988717838 and parameters: {'model_type': 'mlp', 'hidden_dims': '[512, 64]', 'dropout': 0.14505336736221927, 'batch_norm': True, 'lr': 5.8619638388111826e-05, 'weight_decay': 6.200156172669308e-07, 'epochs': 175, 'loss': 'mse', 'optimizer': 'adam', 'graph_mode': 'off', 'use_snp_selection': False}. Best is trial 3 with value: 0.08939730523412698.
[I 2025-12-05 14:58:45,495] Trial 10 finished with value: 0.05911730625548658 and parameters: {'model_type': 'mlp', 'hidden_dims': '[512, 64]', 'dropout': 0.5885461262002587, 'batch_norm': False, 'lr': 8.769366258768696e-06, 'weight_decay': 2.78273193871783e-06, 'epochs': 55, 'loss': 'mae', 'optimizer': 'adam', 'graph_mode': 'off', 'use_snp_selection': False}. Best is trial 3 with value: 0.08939730523412698.
[I 2025-12-05 14:58:46,518] Trial 11 finished with value: 0.015975777543404877 and parameters: {'model_type': 'mlp', 'hidden_dims': '[512, 64]', 'dropout': 0.583942291816117, 'batch_norm': False, 'lr': 1.1821335968986158e-05, 'weight_decay': 4.061640528568547e-06, 'epochs': 77, 'loss': 'mae', 'optimizer': 'adam', 'graph_mode': 'off', 'use_snp_selection': False}. Best is trial 3 with value: 0.08939730523412698.
[I 2025-12-05 14:58:47,407] Trial 12 finished with value: 0.05430817350924332 and parameters: {'model_type': 'mlp', 'hidden_dims': '[512, 64]', 'dropout': 0.593097749012682, 'batch_norm': False, 'lr': 9.73724436814812e-06, 'weight_decay': 1.3081036432574914e-07, 'epochs': 40, 'loss': 'mae', 'optimizer': 'adam', 'graph_mode': 'off', 'use_snp_selection': False}. Best is trial 3 with value: 0.08939730523412698.
[I 2025-12-05 14:58:48,984] Trial 13 finished with value: 0.03751195951519491 and parameters: {'model_type': 'mlp', 'hidden_dims': '[512, 64]', 'dropout': 0.5043641748401543, 'batch_norm': False, 'lr': 1.139383629587953e-05, 'weight_decay': 4.373608364627903e-05, 'epochs': 237, 'loss': 'mae', 'optimizer': 'adam', 'graph_mode': 'off', 'use_snp_selection': False}. Best is trial 3 with value: 0.08939730523412698.
[I 2025-12-05 14:58:49,882] Trial 14 finished with value: 0.009089716797354937 and parameters: {'model_type': 'mlp', 'hidden_dims': '[128, 64]', 'dropout': 0.5300180653494536, 'batch_norm': False, 'lr': 5.096356034191146e-06, 'weight_decay': 3.5346420493229508e-06, 'epochs': 287, 'loss': 'mae', 'optimizer': 'adam', 'graph_mode': 'off', 'use_snp_selection': False}. Best is trial 3 with value: 0.08939730523412698.
[I 2025-12-05 14:58:51,016] Trial 15 finished with value: 0.055712277266598026 and parameters: {'model_type': 'mlp', 'hidden_dims': '[512, 256]', 'dropout': 0.29817671914947536, 'batch_norm': False, 'lr': 2.112268730609403e-05, 'weight_decay': 5.343087596659364e-05, 'epochs': 110, 'loss': 'mae', 'optimizer': 'adam', 'graph_mode': 'off', 'use_snp_selection': False}. Best is trial 3 with value: 0.08939730523412698.
[I 2025-12-05 14:58:52,338] Trial 16 finished with value: 0.04001001455608186 and parameters: {'model_type': 'mlp', 'hidden_dims': '[256, 128, 64]', 'dropout': 0.49887409780975667, 'batch_norm': False, 'lr': 0.00017549215405955411, 'weight_decay': 2.66242976641068e-06, 'epochs': 350, 'loss': 'mae', 'optimizer': 'adam', 'graph_mode': 'off', 'use_snp_selection': False}. Best is trial 3 with value: 0.08939730523412698.
[I 2025-12-05 14:58:53,850] Trial 17 finished with value: -0.0004628411349258904 and parameters: {'model_type': 'mlp', 'hidden_dims': '[512, 64]', 'dropout': 0.46956397995943144, 'batch_norm': False, 'lr': 0.000906375209920231, 'weight_decay': 2.0204960671781686e-05, 'epochs': 219, 'loss': 'mae', 'optimizer': 'adam', 'graph_mode': 'off', 'use_snp_selection': False}. Best is trial 3 with value: 0.08939730523412698.
[I 2025-12-05 14:58:57,037] Trial 18 finished with value: 0.036004754431068035 and parameters: {'model_type': 'mlp', 'hidden_dims': '[512, 64]', 'dropout': 0.5468831937008775, 'batch_norm': False, 'lr': 5.4850663591507836e-06, 'weight_decay': 7.489058431436532e-07, 'epochs': 261, 'loss': 'mae', 'optimizer': 'adam', 'graph_mode': 'off', 'use_snp_selection': True, 'num_snps': 58241}. Best is trial 3 with value: 0.08939730523412698.
[I 2025-12-05 14:58:57,949] Trial 19 finished with value: 0.03259428197368394 and parameters: {'model_type': 'mlp', 'hidden_dims': '[512, 64]', 'dropout': 0.3166616674880815, 'batch_norm': False, 'lr': 2.7960991179492955e-06, 'weight_decay': 7.0921580813814515e-06, 'epochs': 48, 'loss': 'mae', 'optimizer': 'adam', 'graph_mode': 'off', 'use_snp_selection': False}. Best is trial 3 with value: 0.08939730523412698.
[I 2025-12-05 14:58:59,160] Trial 20 finished with value: 0.06284138437677095 and parameters: {'model_type': 'mlp', 'hidden_dims': '[512, 128]', 'dropout': 0.5575420017847416, 'batch_norm': False, 'lr': 2.3361432915417936e-05, 'weight_decay': 0.00015711537877451736, 'epochs': 135, 'loss': 'mae', 'optimizer': 'adam', 'graph_mode': 'off', 'use_snp_selection': False}. Best is trial 3 with value: 0.08939730523412698.
[I 2025-12-05 14:59:00,375] Trial 21 finished with value: 0.04909967199042747 and parameters: {'model_type': 'mlp', 'hidden_dims': '[512, 128]', 'dropout': 0.5551594855246745, 'batch_norm': False, 'lr': 2.602628671800808e-05, 'weight_decay': 0.00015625067638737195, 'epochs': 130, 'loss': 'mae', 'optimizer': 'adam', 'graph_mode': 'off', 'use_snp_selection': False}. Best is trial 3 with value: 0.08939730523412698.
[I 2025-12-05 14:59:01,725] Trial 22 finished with value: 0.0447839879332029 and parameters: {'model_type': 'mlp', 'hidden_dims': '[512, 128]', 'dropout': 0.5954392114625428, 'batch_norm': False, 'lr': 1.6652821605867334e-05, 'weight_decay': 0.0001196538411982376, 'epochs': 176, 'loss': 'mae', 'optimizer': 'adam', 'graph_mode': 'off', 'use_snp_selection': False}. Best is trial 3 with value: 0.08939730523412698.
[I 2025-12-05 14:59:02,765] Trial 23 finished with value: 0.024439311126305145 and parameters: {'model_type': 'mlp', 'hidden_dims': '[512, 128]', 'dropout': 0.4661242614137625, 'batch_norm': False, 'lr': 6.822943256482581e-06, 'weight_decay': 3.2201061262144025e-05, 'epochs': 74, 'loss': 'mae', 'optimizer': 'adam', 'graph_mode': 'off', 'use_snp_selection': False}. Best is trial 3 with value: 0.08939730523412698.
[I 2025-12-05 14:59:03,600] Trial 24 finished with value: 0.0872370544202477 and parameters: {'model_type': 'mlp', 'hidden_dims': '[256, 128]', 'dropout': 0.5409875280429816, 'batch_norm': False, 'lr': 3.5283254707838955e-05, 'weight_decay': 7.155673581155691e-06, 'epochs': 106, 'loss': 'mae', 'optimizer': 'adam', 'graph_mode': 'off', 'use_snp_selection': False}. Best is trial 3 with value: 0.08939730523412698.
[I 2025-12-05 14:59:04,462] Trial 25 finished with value: 0.029612179388528153 and parameters: {'model_type': 'mlp', 'hidden_dims': '[256, 128]', 'dropout': 0.5271332145674228, 'batch_norm': False, 'lr': 0.00013072586018674312, 'weight_decay': 0.00010634844855968108, 'epochs': 124, 'loss': 'mae', 'optimizer': 'adam', 'graph_mode': 'off', 'use_snp_selection': False}. Best is trial 3 with value: 0.08939730523412698.
[I 2025-12-05 14:59:05,252] Trial 26 finished with value: 0.035806674516921655 and parameters: {'model_type': 'mlp', 'hidden_dims': '[256, 128]', 'dropout': 0.4772868204747028, 'batch_norm': False, 'lr': 3.43104243442769e-05, 'weight_decay': 0.0009902889440223655, 'epochs': 167, 'loss': 'mse', 'optimizer': 'adam', 'graph_mode': 'off', 'use_snp_selection': True, 'num_snps': 3842}. Best is trial 3 with value: 0.08939730523412698.
[I 2025-12-05 14:59:06,089] Trial 27 finished with value: 0.03678237413977839 and parameters: {'model_type': 'mlp', 'hidden_dims': '[256, 128]', 'dropout': 0.5529246727371858, 'batch_norm': False, 'lr': 0.0003550973071330334, 'weight_decay': 6.856550391484043e-06, 'epochs': 95, 'loss': 'mae', 'optimizer': 'adam', 'graph_mode': 'off', 'use_snp_selection': False}. Best is trial 3 with value: 0.08939730523412698.
[I 2025-12-05 14:59:06,915] Trial 28 finished with value: 0.04705307720196602 and parameters: {'model_type': 'mlp', 'hidden_dims': '[128, 64]', 'dropout': 0.42922722360170795, 'batch_norm': False, 'lr': 3.397337378950503e-05, 'weight_decay': 1.830081738030792e-05, 'epochs': 194, 'loss': 'mae', 'optimizer': 'adam', 'graph_mode': 'off', 'use_snp_selection': False}. Best is trial 3 with value: 0.08939730523412698.
[I 2025-12-05 14:59:08,185] Trial 29 finished with value: 0.0537512438219051 and parameters: {'model_type': 'mlp', 'hidden_dims': '[512, 256]', 'dropout': 0.3493892103633449, 'batch_norm': False, 'lr': 2.7087623657194706e-06, 'weight_decay': 7.556740997596572e-05, 'epochs': 146, 'loss': 'mae', 'optimizer': 'adam', 'graph_mode': 'off', 'use_snp_selection': True, 'num_snps': 19468}. Best is trial 3 with value: 0.08939730523412698.
[I 2025-12-05 14:59:09,424] Trial 30 finished with value: 0.06643467702478525 and parameters: {'model_type': 'mlp', 'hidden_dims': '[256, 128, 64]', 'dropout': 0.5043564262779172, 'batch_norm': False, 'lr': 1.599085055118919e-05, 'weight_decay': 0.000329890907140121, 'epochs': 315, 'loss': 'mae', 'optimizer': 'adam', 'graph_mode': 'off', 'use_snp_selection': False}. Best is trial 3 with value: 0.08939730523412698.
[I 2025-12-05 14:59:10,654] Trial 31 finished with value: 0.040107556958778795 and parameters: {'model_type': 'mlp', 'hidden_dims': '[256, 128, 64]', 'dropout': 0.5551446483760523, 'batch_norm': False, 'lr': 1.5947221029949516e-05, 'weight_decay': 0.00031335966434564906, 'epochs': 315, 'loss': 'mae', 'optimizer': 'adam', 'graph_mode': 'off', 'use_snp_selection': False}. Best is trial 3 with value: 0.08939730523412698.
[I 2025-12-05 14:59:11,914] Trial 32 finished with value: 0.06656656546928393 and parameters: {'model_type': 'mlp', 'hidden_dims': '[256, 128, 64]', 'dropout': 0.5129908038914119, 'batch_norm': False, 'lr': 8.998447731934564e-05, 'weight_decay': 0.00020134757308447072, 'epochs': 318, 'loss': 'mae', 'optimizer': 'adam', 'graph_mode': 'off', 'use_snp_selection': False}. Best is trial 3 with value: 0.08939730523412698.
[I 2025-12-05 14:59:13,157] Trial 33 finished with value: -0.0011941998009680503 and parameters: {'model_type': 'mlp', 'hidden_dims': '[256, 128, 64]', 'dropout': 0.5027576918164378, 'batch_norm': False, 'lr': 9.357409894768869e-05, 'weight_decay': 0.0005120466885982286, 'epochs': 322, 'loss': 'mae', 'optimizer': 'adam', 'graph_mode': 'off', 'use_snp_selection': False}. Best is trial 3 with value: 0.08939730523412698.
[I 2025-12-05 14:59:14,422] Trial 34 finished with value: 0.04165705822306916 and parameters: {'model_type': 'mlp', 'hidden_dims': '[256, 128, 64]', 'dropout': 0.4506161129779441, 'batch_norm': True, 'lr': 8.695977942401013e-05, 'weight_decay': 1.0288761589296541e-05, 'epochs': 289, 'loss': 'mae', 'optimizer': 'adam', 'graph_mode': 'off', 'use_snp_selection': False}. Best is trial 3 with value: 0.08939730523412698.
[I 2025-12-05 14:59:17,272] Trial 35 finished with value: 0.04453533164573315 and parameters: {'model_type': 'mlp', 'hidden_dims': '[256, 128, 64]', 'dropout': 0.5181599568244695, 'batch_norm': False, 'lr': 4.298112462622027e-05, 'weight_decay': 0.0005384515517513884, 'epochs': 331, 'loss': 'mse', 'optimizer': 'adam', 'graph_mode': 'off', 'use_snp_selection': True, 'num_snps': 57586}. Best is trial 3 with value: 0.08939730523412698.
[I 2025-12-05 14:59:18,480] Trial 36 finished with value: 0.0563722718368551 and parameters: {'model_type': 'mlp', 'hidden_dims': '[256, 128, 64]', 'dropout': 0.43010484353311706, 'batch_norm': False, 'lr': 3.7565367101064262e-06, 'weight_decay': 3.1500703171463236e-05, 'epochs': 297, 'loss': 'mae', 'optimizer': 'adam', 'graph_mode': 'off', 'use_snp_selection': False}. Best is trial 3 with value: 0.08939730523412698.
