[I 2025-12-05 19:47:10,804] Trial 5 finished with value: 0.2517223765712847 and parameters: {'model_type': 'mlp', 'hidden_dims': '[512, 64]', 'dropout': 0.38275350994408375, 'batch_norm': True, 'lr': 1.5586664309232824e-06, 'weight_decay': 0.0008227664668621182, 'epochs': 145, 'loss': 'mae', 'optimizer': 'adam', 'graph_mode': 'off', 'use_snp_selection': True, 'num_snps': 32148}. Best is trial 3 with value: 0.30145251910879245.
[I 2025-12-05 19:47:33,467] Trial 6 finished with value: 0.2942710025139027 and parameters: {'model_type': 'mlp', 'hidden_dims': '[256, 128]', 'dropout': 0.3930109900265879, 'batch_norm': False, 'lr': 4.892964372128395e-05, 'weight_decay': 1.5809549317992182e-06, 'epochs': 199, 'loss': 'mse', 'optimizer': 'adam', 'graph_mode': 'off', 'use_snp_selection': False}. Best is trial 3 with value: 0.30145251910879245.
[I 2025-12-05 19:47:55,737] Trial 7 finished with value: 0.2955218299338954 and parameters: {'model_type': 'mlp', 'hidden_dims': '[512, 256]', 'dropout': 0.15343979219678458, 'batch_norm': True, 'lr': 6.234003099047341e-05, 'weight_decay': 3.894760610535477e-07, 'epochs': 97, 'loss': 'mse', 'optimizer': 'adam', 'graph_mode': 'off', 'use_snp_selection': False}. Best is trial 3 with value: 0.30145251910879245.
[I 2025-12-05 19:48:55,607] Trial 8 finished with value: 0.2947929106323799 and parameters: {'model_type': 'mlp', 'hidden_dims': '[512, 128]', 'dropout': 0.10743001231661406, 'batch_norm': True, 'lr': 0.00023728538449271062, 'weight_decay': 1.7629071578048637e-05, 'epochs': 312, 'loss': 'mae', 'optimizer': 'adam', 'graph_mode': 'off', 'use_snp_selection': False}. Best is trial 3 with value: 0.30145251910879245.
[I 2025-12-05 19:49:31,492] Trial 9 finished with value: 0.29731284902384003 and parameters: {'model_type': 'mlp', 'hidden_dims': '[512, 64]', 'dropout': 0.14505336736221927, 'batch_norm': True, 'lr': 5.8619638388111826e-05, 'weight_decay': 6.200156172669308e-07, 'epochs': 175, 'loss': 'mse', 'optimizer': 'adam', 'graph_mode': 'off', 'use_snp_selection': False}. Best is trial 3 with value: 0.30145251910879245.
[I 2025-12-05 19:49:46,301] Trial 10 finished with value: 0.2728039390776379 and parameters: {'model_type': 'mlp', 'hidden_dims': '[512, 64]', 'dropout': 0.5885461262002587, 'batch_norm': False, 'lr': 8.769366258768696e-06, 'weight_decay': 2.78273193871783e-06, 'epochs': 55, 'loss': 'mae', 'optimizer': 'adam', 'graph_mode': 'off', 'use_snp_selection': False}. Best is trial 3 with value: 0.30145251910879245.
[I 2025-12-05 19:50:28,443] Trial 11 finished with value: 0.30217432569873515 and parameters: {'model_type': 'mlp', 'hidden_dims': '[512, 64]', 'dropout': 0.583942291816117, 'batch_norm': False, 'lr': 1.422933652790185e-05, 'weight_decay': 1.2045055692919657e-07, 'epochs': 213, 'loss': 'mse', 'optimizer': 'adam', 'graph_mode': 'off', 'use_snp_selection': False}. Best is trial 11 with value: 0.30217432569873515.
[I 2025-12-05 19:51:17,005] Trial 12 finished with value: 0.2962864698004117 and parameters: {'model_type': 'mlp', 'hidden_dims': '[512, 64]', 'dropout': 0.593097749012682, 'batch_norm': False, 'lr': 1.1374686318732863e-05, 'weight_decay': 1.3081036432574914e-07, 'epochs': 250, 'loss': 'mae', 'optimizer': 'adam', 'graph_mode': 'off', 'use_snp_selection': False}. Best is trial 11 with value: 0.30217432569873515.
[I 2025-12-05 19:52:12,467] Trial 13 finished with value: 0.29353659139738963 and parameters: {'model_type': 'mlp', 'hidden_dims': '[512, 64]', 'dropout': 0.5043641748401543, 'batch_norm': False, 'lr': 1.4304506621636526e-05, 'weight_decay': 4.981094667007287e-05, 'epochs': 290, 'loss': 'mse', 'optimizer': 'adam', 'graph_mode': 'off', 'use_snp_selection': False}. Best is trial 11 with value: 0.30217432569873515.
[I 2025-12-05 19:52:34,601] Trial 14 finished with value: 0.2994552095632379 and parameters: {'model_type': 'mlp', 'hidden_dims': '[128, 64]', 'dropout': 0.5300180653494536, 'batch_norm': False, 'lr': 5.096356034191146e-06, 'weight_decay': 3.0607358611649674e-06, 'epochs': 344, 'loss': 'mse', 'optimizer': 'adam', 'graph_mode': 'off', 'use_snp_selection': False}. Best is trial 11 with value: 0.30217432569873515.
[I 2025-12-05 19:53:19,559] Trial 15 finished with value: 0.29677602383329404 and parameters: {'model_type': 'mlp', 'hidden_dims': '[512, 256]', 'dropout': 0.29817671914947536, 'batch_norm': False, 'lr': 1.8411764708572348e-05, 'weight_decay': 4.4084956876871386e-05, 'epochs': 228, 'loss': 'mae', 'optimizer': 'adam', 'graph_mode': 'off', 'use_snp_selection': False}. Best is trial 11 with value: 0.30217432569873515.
[I 2025-12-05 19:53:42,952] Trial 16 finished with value: 0.2895569734125956 and parameters: {'model_type': 'mlp', 'hidden_dims': '[256, 128, 64]', 'dropout': 0.4992385332513618, 'batch_norm': False, 'lr': 0.00017549215405955411, 'weight_decay': 1.3069867997062413e-07, 'epochs': 206, 'loss': 'mse', 'optimizer': 'adam', 'graph_mode': 'off', 'use_snp_selection': False}. Best is trial 11 with value: 0.30217432569873515.
[I 2025-12-05 19:54:36,658] Trial 17 finished with value: 0.07655393548313975 and parameters: {'model_type': 'mlp', 'hidden_dims': '[512, 64]', 'dropout': 0.543474321376226, 'batch_norm': False, 'lr': 0.000906375209920231, 'weight_decay': 6.503919561253859e-06, 'epochs': 280, 'loss': 'mae', 'optimizer': 'adam', 'graph_mode': 'off', 'use_snp_selection': False}. Best is trial 11 with value: 0.30217432569873515.
[I 2025-12-05 19:55:33,391] Trial 18 finished with value: 0.2993320705763275 and parameters: {'model_type': 'mlp', 'hidden_dims': '[512, 64]', 'dropout': 0.4928065509878574, 'batch_norm': False, 'lr': 3.8282888633697165e-06, 'weight_decay': 0.00015337734816807855, 'epochs': 116, 'loss': 'mse', 'optimizer': 'adam', 'graph_mode': 'off', 'use_snp_selection': True, 'num_snps': 58241}. Best is trial 11 with value: 0.30217432569873515.
[I 2025-12-05 19:56:32,972] Trial 19 finished with value: 0.2948999460587144 and parameters: {'model_type': 'mlp', 'hidden_dims': '[512, 64]', 'dropout': 0.44786810823414697, 'batch_norm': False, 'lr': 2.7694571046960796e-05, 'weight_decay': 5.718031395470055e-07, 'epochs': 314, 'loss': 'mae', 'optimizer': 'adam', 'graph_mode': 'off', 'use_snp_selection': False}. Best is trial 11 with value: 0.30217432569873515.
[I 2025-12-05 19:56:45,710] Trial 20 finished with value: 0.267592436804392 and parameters: {'model_type': 'mlp', 'hidden_dims': '[512, 128]', 'dropout': 0.31622655364259217, 'batch_norm': False, 'lr': 6.91107062941075e-06, 'weight_decay': 2.417613357794622e-05, 'epochs': 43, 'loss': 'mae', 'optimizer': 'adam', 'graph_mode': 'off', 'use_snp_selection': False}. Best is trial 11 with value: 0.30217432569873515.
[I 2025-12-05 19:57:07,792] Trial 21 finished with value: 0.30204173481402447 and parameters: {'model_type': 'mlp', 'hidden_dims': '[128, 64]', 'dropout': 0.5473408321276898, 'batch_norm': False, 'lr': 3.7718843793352087e-06, 'weight_decay': 4.544018613049603e-06, 'epochs': 343, 'loss': 'mse', 'optimizer': 'adam', 'graph_mode': 'off', 'use_snp_selection': False}. Best is trial 11 with value: 0.30217432569873515.
[I 2025-12-05 19:57:28,282] Trial 22 finished with value: 0.2915936471534847 and parameters: {'model_type': 'mlp', 'hidden_dims': '[128, 64]', 'dropout': 0.5700187870517055, 'batch_norm': False, 'lr': 2.8066171579169486e-06, 'weight_decay': 4.905653876075577e-06, 'epochs': 312, 'loss': 'mse', 'optimizer': 'adam', 'graph_mode': 'off', 'use_snp_selection': False}. Best is trial 11 with value: 0.30217432569873515.
[I 2025-12-05 19:57:50,489] Trial 23 finished with value: 0.2998989143382074 and parameters: {'model_type': 'mlp', 'hidden_dims': '[128, 64]', 'dropout': 0.5575646581781077, 'batch_norm': False, 'lr': 2.0679569859215747e-05, 'weight_decay': 1.337661036202276e-06, 'epochs': 346, 'loss': 'mse', 'optimizer': 'adam', 'graph_mode': 'off', 'use_snp_selection': False}. Best is trial 11 with value: 0.30217432569873515.
[I 2025-12-05 19:58:08,414] Trial 24 finished with value: 0.30280964505223384 and parameters: {'model_type': 'mlp', 'hidden_dims': '[128, 64]', 'dropout': 0.46654996436896384, 'batch_norm': False, 'lr': 7.190978635498186e-06, 'weight_decay': 2.608955063867925e-07, 'epochs': 263, 'loss': 'mse', 'optimizer': 'adam', 'graph_mode': 'off', 'use_snp_selection': False}. Best is trial 24 with value: 0.30280964505223384.
[I 2025-12-05 19:58:24,119] Trial 25 finished with value: 0.290992167905303 and parameters: {'model_type': 'mlp', 'hidden_dims': '[128, 64]', 'dropout': 0.4759182178120904, 'batch_norm': False, 'lr': 2.642177605584259e-06, 'weight_decay': 2.0106512349870373e-07, 'epochs': 219, 'loss': 'mse', 'optimizer': 'adam', 'graph_mode': 'off', 'use_snp_selection': False}. Best is trial 24 with value: 0.30280964505223384.
[I 2025-12-05 19:58:47,341] Trial 26 finished with value: 0.26993790785874183 and parameters: {'model_type': 'mlp', 'hidden_dims': '[128, 64]', 'dropout': 0.5213023642350566, 'batch_norm': False, 'lr': 9.747540291563217e-06, 'weight_decay': 3.253094810152716e-07, 'epochs': 254, 'loss': 'mse', 'optimizer': 'adam', 'graph_mode': 'off', 'use_snp_selection': True, 'num_snps': 3842}. Best is trial 24 with value: 0.30280964505223384.
[I 2025-12-05 19:59:01,029] Trial 27 finished with value: 0.30245917138125417 and parameters: {'model_type': 'mlp', 'hidden_dims': '[128, 64]', 'dropout': 0.44006328686203366, 'batch_norm': False, 'lr': 3.7023515729588275e-05, 'weight_decay': 1.255139967809221e-06, 'epochs': 180, 'loss': 'mse', 'optimizer': 'adam', 'graph_mode': 'off', 'use_snp_selection': False}. Best is trial 24 with value: 0.30280964505223384.
[I 2025-12-05 19:59:14,415] Trial 28 finished with value: 0.29680663055419154 and parameters: {'model_type': 'mlp', 'hidden_dims': '[128, 64]', 'dropout': 0.35885545288108356, 'batch_norm': False, 'lr': 3.5572152037659065e-05, 'weight_decay': 9.502701928707743e-07, 'epochs': 174, 'loss': 'mse', 'optimizer': 'adam', 'graph_mode': 'off', 'use_snp_selection': False}. Best is trial 24 with value: 0.30280964505223384.
[I 2025-12-05 19:59:43,735] Trial 29 finished with value: 0.2866237594922744 and parameters: {'model_type': 'mlp', 'hidden_dims': '[128, 64]', 'dropout': 0.4540184348968538, 'batch_norm': False, 'lr': 0.0001668415436705659, 'weight_decay': 2.519545585531269e-07, 'epochs': 179, 'loss': 'mse', 'optimizer': 'adam', 'graph_mode': 'off', 'use_snp_selection': True, 'num_snps': 19468}. Best is trial 24 with value: 0.30280964505223384.
[I 2025-12-05 20:00:12,335] Trial 30 finished with value: 0.2879012009021106 and parameters: {'model_type': 'mlp', 'hidden_dims': '[256, 128]', 'dropout': 0.2523135802350327, 'batch_norm': False, 'lr': 0.0001031788529480076, 'weight_decay': 1.1006517660213689e-07, 'epochs': 265, 'loss': 'mse', 'optimizer': 'adam', 'graph_mode': 'off', 'use_snp_selection': False}. Best is trial 24 with value: 0.30280964505223384.
[I 2025-12-05 20:00:28,252] Trial 31 finished with value: 0.30282375517124044 and parameters: {'model_type': 'mlp', 'hidden_dims': '[128, 64]', 'dropout': 0.47911840955489304, 'batch_norm': False, 'lr': 2.9359648256094944e-05, 'weight_decay': 2.355135045230383e-06, 'epochs': 224, 'loss': 'mse', 'optimizer': 'adam', 'graph_mode': 'off', 'use_snp_selection': False}. Best is trial 31 with value: 0.30282375517124044.
[I 2025-12-05 20:00:44,556] Trial 32 finished with value: 0.29917602072669447 and parameters: {'model_type': 'mlp', 'hidden_dims': '[128, 64]', 'dropout': 0.4171291672899072, 'batch_norm': False, 'lr': 3.035088004027062e-05, 'weight_decay': 7.822818058939512e-07, 'epochs': 231, 'loss': 'mse', 'optimizer': 'adam', 'graph_mode': 'off', 'use_snp_selection': False}. Best is trial 31 with value: 0.30282375517124044.
[I 2025-12-05 20:01:03,237] Trial 33 finished with value: 0.29599992741277015 and parameters: {'model_type': 'mlp', 'hidden_dims': '[256, 128, 64]', 'dropout': 0.4674550326086543, 'batch_norm': False, 'lr': 1.5376859893852724e-05, 'weight_decay': 2.515317136803993e-06, 'epochs': 154, 'loss': 'mse', 'optimizer': 'adam', 'graph_mode': 'off', 'use_snp_selection': False}. Best is trial 31 with value: 0.30282375517124044.
[I 2025-12-05 20:01:18,454] Trial 34 finished with value: 0.30009692110749686 and parameters: {'model_type': 'mlp', 'hidden_dims': '[128, 64]', 'dropout': 0.41741532689237876, 'batch_norm': False, 'lr': 3.45873859787635e-05, 'weight_decay': 2.12373663160474e-07, 'epochs': 210, 'loss': 'mse', 'optimizer': 'adam', 'graph_mode': 'off', 'use_snp_selection': False}. Best is trial 31 with value: 0.30282375517124044.
[I 2025-12-05 20:01:55,795] Trial 35 finished with value: 0.2936190050245802 and parameters: {'model_type': 'mlp', 'hidden_dims': '[512, 256]', 'dropout': 0.35297452005401275, 'batch_norm': True, 'lr': 9.896269492692444e-05, 'weight_decay': 4.137592152672773e-07, 'epochs': 183, 'loss': 'mse', 'optimizer': 'adam', 'graph_mode': 'off', 'use_snp_selection': False}. Best is trial 31 with value: 0.30282375517124044.
[I 2025-12-05 20:02:44,565] Trial 36 finished with value: 0.2999900036389014 and parameters: {'model_type': 'mlp', 'hidden_dims': '[128, 64]', 'dropout': 0.4259061228636643, 'batch_norm': False, 'lr': 2.2818015716501753e-05, 'weight_decay': 1.506387099314948e-06, 'epochs': 241, 'loss': 'mse', 'optimizer': 'adam', 'graph_mode': 'off', 'use_snp_selection': True, 'num_snps': 58661}. Best is trial 31 with value: 0.30282375517124044.
[I 2025-12-05 20:03:03,148] Trial 37 finished with value: 0.3011230473603911 and parameters: {'model_type': 'mlp', 'hidden_dims': '[256, 128]', 'dropout': 0.3883817233676315, 'batch_norm': False, 'lr': 4.350549331735279e-05, 'weight_decay': 7.717248381241336e-06, 'epochs': 154, 'loss': 'mse', 'optimizer': 'adam', 'graph_mode': 'off', 'use_snp_selection': False}. Best is trial 31 with value: 0.30282375517124044.
[I 2025-12-05 20:03:37,650] Trial 38 finished with value: 0.2934817805147203 and parameters: {'model_type': 'mlp', 'hidden_dims': '[256, 128, 64]', 'dropout': 0.5194258862049055, 'batch_norm': True, 'lr': 1.1665792017271946e-05, 'weight_decay': 1.1690776204021993e-06, 'epochs': 267, 'loss': 'mse', 'optimizer': 'adam', 'graph_mode': 'off', 'use_snp_selection': True, 'num_snps': 19911}. Best is trial 31 with value: 0.30282375517124044.
[I 2025-12-05 20:03:51,919] Trial 39 finished with value: 0.3029162308212334 and parameters: {'model_type': 'mlp', 'hidden_dims': '[128, 64]', 'dropout': 0.4653737608806632, 'batch_norm': False, 'lr': 7.059039843291241e-06, 'weight_decay': 1.1290187562497194e-05, 'epochs': 192, 'loss': 'mse', 'optimizer': 'adam', 'graph_mode': 'off', 'use_snp_selection': False}. Best is trial 39 with value: 0.3029162308212334.
[I 2025-12-05 20:04:03,299] Trial 40 finished with value: 0.21931913305311265 and parameters: {'model_type': 'mlp', 'hidden_dims': '[128, 64]', 'dropout': 0.47380664709786935, 'batch_norm': True, 'lr': 1.2678501299284135e-06, 'weight_decay': 1.2070262514674827e-05, 'epochs': 133, 'loss': 'mse', 'optimizer': 'adam', 'graph_mode': 'off', 'use_snp_selection': False}. Best is trial 39 with value: 0.3029162308212334.
[I 2025-12-05 20:04:17,713] Trial 41 finished with value: 0.3002269463878979 and parameters: {'model_type': 'mlp', 'hidden_dims': '[128, 64]', 'dropout': 0.44071866347782074, 'batch_norm': False, 'lr': 6.776825926987522e-06, 'weight_decay': 1.1092937818150653e-05, 'epochs': 193, 'loss': 'mse', 'optimizer': 'adam', 'graph_mode': 'off', 'use_snp_selection': False}. Best is trial 39 with value: 0.3029162308212334.
[I 2025-12-05 20:05:01,003] Trial 42 finished with value: 0.29791701188807246 and parameters: {'model_type': 'mlp', 'hidden_dims': '[512, 128]', 'dropout': 0.3996414961699289, 'batch_norm': False, 'lr': 8.460527962199703e-06, 'weight_decay': 2.2504674649955835e-06, 'epochs': 219, 'loss': 'mse', 'optimizer': 'adam', 'graph_mode': 'off', 'use_snp_selection': False}. Best is trial 39 with value: 0.3029162308212334.
[I 2025-12-05 20:05:15,486] Trial 43 finished with value: 0.28796590841213526 and parameters: {'model_type': 'mlp', 'hidden_dims': '[128, 64]', 'dropout': 0.3766723769959497, 'batch_norm': False, 'lr': 2.1409924724993155e-06, 'weight_decay': 5.356100268492764e-07, 'epochs': 195, 'loss': 'mse', 'optimizer': 'adam', 'graph_mode': 'off', 'use_snp_selection': False}. Best is trial 39 with value: 0.3029162308212334.
[I 2025-12-05 20:05:28,375] Trial 44 finished with value: 0.2986812800373259 and parameters: {'model_type': 'mlp', 'hidden_dims': '[128, 64]', 'dropout': 0.32818658335893813, 'batch_norm': False, 'lr': 5.177473138393584e-06, 'weight_decay': 1.7774900171757539e-07, 'epochs': 164, 'loss': 'mse', 'optimizer': 'adam', 'graph_mode': 'off', 'use_snp_selection': False}. Best is trial 39 with value: 0.3029162308212334.
[I 2025-12-05 20:06:15,050] Trial 45 finished with value: 0.29497082684326353 and parameters: {'model_type': 'mlp', 'hidden_dims': '[512, 256]', 'dropout': 0.48746755053067403, 'batch_norm': False, 'lr': 1.363647510205748e-05, 'weight_decay': 9.1693146789852e-05, 'epochs': 238, 'loss': 'mse', 'optimizer': 'adam', 'graph_mode': 'off', 'use_snp_selection': False}. Best is trial 39 with value: 0.3029162308212334.
[I 2025-12-05 20:06:34,940] Trial 46 finished with value: 0.29215734126550197 and parameters: {'model_type': 'mlp', 'hidden_dims': '[128, 64]', 'dropout': 0.5695895819840039, 'batch_norm': True, 'lr': 8.284438870161764e-05, 'weight_decay': 4.3730126245138554e-06, 'epochs': 298, 'loss': 'mse', 'optimizer': 'adam', 'graph_mode': 'off', 'use_snp_selection': False}. Best is trial 39 with value: 0.3029162308212334.
[I 2025-12-05 20:07:02,704] Trial 47 finished with value: 0.29216217609422585 and parameters: {'model_type': 'mlp', 'hidden_dims': '[256, 128]', 'dropout': 0.4607696985914529, 'batch_norm': False, 'lr': 4.494723212448167e-05, 'weight_decay': 1.6510902420423662e-05, 'epochs': 255, 'loss': 'mse', 'optimizer': 'adam', 'graph_mode': 'off', 'use_snp_selection': False}. Best is trial 39 with value: 0.3029162308212334.
[I 2025-12-05 20:07:31,013] Trial 48 finished with value: 0.30240266764432616 and parameters: {'model_type': 'mlp', 'hidden_dims': '[512, 128]', 'dropout': 0.5174226543081228, 'batch_norm': False, 'lr': 1.7255724468036505e-05, 'weight_decay': 3.272904114686304e-07, 'epochs': 133, 'loss': 'mse', 'optimizer': 'adam', 'graph_mode': 'off', 'use_snp_selection': False}. Best is trial 39 with value: 0.3029162308212334.
[I 2025-12-05 20:08:17,075] Trial 49 finished with value: 0.29763999223778825 and parameters: {'model_type': 'mlp', 'hidden_dims': '[512, 128]', 'dropout': 0.5094338159075412, 'batch_norm': False, 'lr': 5.810857346068096e-05, 'weight_decay': 2.052534023060751e-06, 'epochs': 86, 'loss': 'mse', 'optimizer': 'adam', 'graph_mode': 'off', 'use_snp_selection': True, 'num_snps': 46888}. Best is trial 39 with value: 0.3029162308212334.
[I 2025-12-05 20:08:45,236] Trial 50 finished with value: 0.3041391581639435 and parameters: {'model_type': 'mlp', 'hidden_dims': '[512, 128]', 'dropout': 0.5316884206018595, 'batch_norm': False, 'lr': 2.064491995363261e-05, 'weight_decay': 7.534475362812748e-07, 'epochs': 132, 'loss': 'mse', 'optimizer': 'adam', 'graph_mode': 'off', 'use_snp_selection': False}. Best is trial 50 with value: 0.3041391581639435.
[I 2025-12-05 20:09:12,335] Trial 51 finished with value: 0.300547644270475 and parameters: {'model_type': 'mlp', 'hidden_dims': '[512, 128]', 'dropout': 0.5324146578162009, 'batch_norm': False, 'lr': 2.3587563740274266e-05, 'weight_decay': 8.210261186621991e-07, 'epochs': 126, 'loss': 'mse', 'optimizer': 'adam', 'graph_mode': 'off', 'use_snp_selection': False}. Best is trial 50 with value: 0.3041391581639435.
[I 2025-12-05 20:09:33,821] Trial 52 finished with value: 0.29955033517454455 and parameters: {'model_type': 'mlp', 'hidden_dims': '[512, 128]', 'dropout': 0.48669584666168453, 'batch_norm': False, 'lr': 1.7087162527609532e-05, 'weight_decay': 3.8129782668815615e-07, 'epochs': 94, 'loss': 'mse', 'optimizer': 'adam', 'graph_mode': 'off', 'use_snp_selection': False}. Best is trial 50 with value: 0.3041391581639435.
[I 2025-12-05 20:10:02,648] Trial 53 finished with value: 0.3030998941855675 and parameters: {'model_type': 'mlp', 'hidden_dims': '[512, 128]', 'dropout': 0.5044787147874038, 'batch_norm': False, 'lr': 7.308533940040983e-06, 'weight_decay': 0.0007871230623739149, 'epochs': 136, 'loss': 'mse', 'optimizer': 'adam', 'graph_mode': 'off', 'use_snp_selection': False}. Best is trial 50 with value: 0.3041391581639435.
[I 2025-12-05 20:10:26,017] Trial 54 finished with value: 0.29220588886280474 and parameters: {'model_type': 'mlp', 'hidden_dims': '[512, 128]', 'dropout': 0.43743617279638136, 'batch_norm': False, 'lr': 8.007086260481915e-06, 'weight_decay': 0.0007399944296042594, 'epochs': 104, 'loss': 'mae', 'optimizer': 'adam', 'graph_mode': 'off', 'use_snp_selection': False}. Best is trial 50 with value: 0.3041391581639435.
[I 2025-12-05 20:10:44,316] Trial 55 finished with value: 0.2926527419720891 and parameters: {'model_type': 'mlp', 'hidden_dims': '[512, 128]', 'dropout': 0.502310853322967, 'batch_norm': False, 'lr': 4.466460636784737e-06, 'weight_decay': 0.0003603233378848977, 'epochs': 75, 'loss': 'mse', 'optimizer': 'adam', 'graph_mode': 'off', 'use_snp_selection': False}. Best is trial 50 with value: 0.3041391581639435.
[I 2025-12-05 20:11:17,838] Trial 56 finished with value: 0.30298342257833133 and parameters: {'model_type': 'mlp', 'hidden_dims': '[512, 128]', 'dropout': 0.5468233155565247, 'batch_norm': False, 'lr': 1.1086318294629567e-05, 'weight_decay': 7.945201526117196e-05, 'epochs': 163, 'loss': 'mse', 'optimizer': 'adam', 'graph_mode': 'off', 'use_snp_selection': False}. Best is trial 50 with value: 0.3041391581639435.
