[I 2025-12-05 15:47:58,196] Trial 134 finished with value: 0.07772783677049445 and parameters: {'model_type': 'mlp', 'hidden_dims': '[128, 64]', 'dropout': 0.10062997899633928, 'batch_norm': True, 'lr': 6.263896902357444e-05, 'weight_decay': 0.00031623899777404334, 'epochs': 259, 'loss': 'mse', 'optimizer': 'adam', 'graph_mode': 'off', 'use_snp_selection': False}. Best is trial 25 with value: 0.0824597717905614.
[I 2025-12-05 15:47:59,272] Trial 135 finished with value: 0.067141117008113 and parameters: {'model_type': 'mlp', 'hidden_dims': '[128, 64]', 'dropout': 0.12855280017866955, 'batch_norm': True, 'lr': 3.7542449969804765e-05, 'weight_decay': 1.0215216035121522e-07, 'epochs': 318, 'loss': 'mse', 'optimizer': 'adam', 'graph_mode': 'off', 'use_snp_selection': False}. Best is trial 25 with value: 0.0824597717905614.
[I 2025-12-05 15:48:00,259] Trial 136 finished with value: 0.06295129118579174 and parameters: {'model_type': 'mlp', 'hidden_dims': '[128, 64]', 'dropout': 0.11140549160440574, 'batch_norm': True, 'lr': 6.197098358692413e-05, 'weight_decay': 0.00016815714446625425, 'epochs': 260, 'loss': 'mse', 'optimizer': 'adam', 'graph_mode': 'off', 'use_snp_selection': False}. Best is trial 25 with value: 0.0824597717905614.
[I 2025-12-05 15:48:01,145] Trial 137 finished with value: 0.04456148462632804 and parameters: {'model_type': 'mlp', 'hidden_dims': '[128, 64]', 'dropout': 0.15818932515667333, 'batch_norm': False, 'lr': 0.00010905909274719805, 'weight_decay': 0.00041743524977463014, 'epochs': 256, 'loss': 'mse', 'optimizer': 'adam', 'graph_mode': 'off', 'use_snp_selection': False}. Best is trial 25 with value: 0.0824597717905614.
[I 2025-12-05 15:48:01,951] Trial 138 finished with value: 0.03218242791209663 and parameters: {'model_type': 'mlp', 'hidden_dims': '[128, 64]', 'dropout': 0.3602293682180353, 'batch_norm': True, 'lr': 8.555368958067784e-05, 'weight_decay': 3.223585865449734e-07, 'epochs': 155, 'loss': 'mse', 'optimizer': 'adam', 'graph_mode': 'off', 'use_snp_selection': False}. Best is trial 25 with value: 0.0824597717905614.
[I 2025-12-05 15:48:03,722] Trial 139 finished with value: 0.03378309829394355 and parameters: {'model_type': 'mlp', 'hidden_dims': '[512, 256]', 'dropout': 0.14462356654779052, 'batch_norm': False, 'lr': 8.071517933822147e-06, 'weight_decay': 1.3254041732655762e-07, 'epochs': 249, 'loss': 'mse', 'optimizer': 'adam', 'graph_mode': 'off', 'use_snp_selection': False}. Best is trial 25 with value: 0.0824597717905614.
[I 2025-12-05 15:48:05,452] Trial 140 finished with value: 0.007053630131142029 and parameters: {'model_type': 'mlp', 'hidden_dims': '[512, 64]', 'dropout': 0.5990006466165797, 'batch_norm': False, 'lr': 2.8159488876825655e-05, 'weight_decay': 1.5415094303981592e-07, 'epochs': 237, 'loss': 'mse', 'optimizer': 'adam', 'graph_mode': 'off', 'use_snp_selection': False}. Best is trial 25 with value: 0.0824597717905614.
[I 2025-12-05 15:48:06,550] Trial 141 finished with value: 0.04415895477036174 and parameters: {'model_type': 'mlp', 'hidden_dims': '[128, 64]', 'dropout': 0.12753837673752527, 'batch_norm': True, 'lr': 3.915197800434907e-05, 'weight_decay': 1.1022587878701148e-07, 'epochs': 322, 'loss': 'mse', 'optimizer': 'adam', 'graph_mode': 'off', 'use_snp_selection': False}. Best is trial 25 with value: 0.0824597717905614.
[I 2025-12-05 15:48:07,613] Trial 142 finished with value: 0.052475205670771324 and parameters: {'model_type': 'mlp', 'hidden_dims': '[128, 64]', 'dropout': 0.13197277170432026, 'batch_norm': True, 'lr': 3.581059270434051e-05, 'weight_decay': 1.2371182617154846e-07, 'epochs': 315, 'loss': 'mse', 'optimizer': 'adam', 'graph_mode': 'off', 'use_snp_selection': False}. Best is trial 25 with value: 0.0824597717905614.
[I 2025-12-05 15:48:08,639] Trial 143 finished with value: 0.04121858378330696 and parameters: {'model_type': 'mlp', 'hidden_dims': '[128, 64]', 'dropout': 0.1202562534839696, 'batch_norm': True, 'lr': 5.315431262345065e-05, 'weight_decay': 0.00022788118010642788, 'epochs': 310, 'loss': 'mse', 'optimizer': 'adam', 'graph_mode': 'off', 'use_snp_selection': False}. Best is trial 25 with value: 0.0824597717905614.
[I 2025-12-05 15:48:09,699] Trial 144 finished with value: 0.03956765893136226 and parameters: {'model_type': 'mlp', 'hidden_dims': '[128, 64]', 'dropout': 0.13044248434203476, 'batch_norm': True, 'lr': 3.18770028801711e-05, 'weight_decay': 1.0581756547892934e-07, 'epochs': 297, 'loss': 'mse', 'optimizer': 'adam', 'graph_mode': 'off', 'use_snp_selection': False}. Best is trial 25 with value: 0.0824597717905614.
[I 2025-12-05 15:48:10,431] Trial 145 finished with value: 0.06447447614194025 and parameters: {'model_type': 'mlp', 'hidden_dims': '[128, 64]', 'dropout': 0.1077782472990771, 'batch_norm': True, 'lr': 1.9989944569904804e-05, 'weight_decay': 2.435274053587788e-07, 'epochs': 66, 'loss': 'mse', 'optimizer': 'adam', 'graph_mode': 'off', 'use_snp_selection': False}. Best is trial 25 with value: 0.0824597717905614.
[I 2025-12-05 15:48:12,538] Trial 146 finished with value: 0.04536026675813906 and parameters: {'model_type': 'mlp', 'hidden_dims': '[512, 64]', 'dropout': 0.5733845678050178, 'batch_norm': True, 'lr': 4.505824498650136e-05, 'weight_decay': 1.298641785278578e-05, 'epochs': 334, 'loss': 'mse', 'optimizer': 'adam', 'graph_mode': 'off', 'use_snp_selection': False}. Best is trial 25 with value: 0.0824597717905614.
[I 2025-12-05 15:48:13,552] Trial 147 finished with value: 0.06456540516747349 and parameters: {'model_type': 'mlp', 'hidden_dims': '[128, 64]', 'dropout': 0.14166865237654203, 'batch_norm': True, 'lr': 6.591227784559466e-05, 'weight_decay': 0.00044293305462544415, 'epochs': 306, 'loss': 'mse', 'optimizer': 'adam', 'graph_mode': 'off', 'use_snp_selection': False}. Best is trial 25 with value: 0.0824597717905614.
[I 2025-12-05 15:48:15,617] Trial 148 finished with value: 0.06487001835738924 and parameters: {'model_type': 'mlp', 'hidden_dims': '[512, 64]', 'dropout': 0.10054161960551858, 'batch_norm': False, 'lr': 5.9120067118815724e-05, 'weight_decay': 1.0053146203435017e-07, 'epochs': 327, 'loss': 'mse', 'optimizer': 'adam', 'graph_mode': 'off', 'use_snp_selection': False}. Best is trial 25 with value: 0.0824597717905614.
[I 2025-12-05 15:48:16,971] Trial 149 finished with value: 0.03120916602641978 and parameters: {'model_type': 'mlp', 'hidden_dims': '[512, 64]', 'dropout': 0.40914021271610346, 'batch_norm': False, 'lr': 4.147747176577114e-05, 'weight_decay': 1.6892179955708496e-07, 'epochs': 140, 'loss': 'mse', 'optimizer': 'adam', 'graph_mode': 'off', 'use_snp_selection': False}. Best is trial 25 with value: 0.0824597717905614.
[I 2025-12-05 15:48:30,655] Trial 0 finished with value: -0.013292083166114303 and parameters: {'model_type': 'mlp', 'hidden_dims': '[128, 64]', 'dropout': 0.199031432379812, 'batch_norm': True, 'lr': 1.8408544111075837e-06, 'weight_decay': 5.5136510071208614e-05, 'epochs': 336, 'loss': 'mae', 'optimizer': 'adam', 'graph_mode': 'off', 'use_snp_selection': True, 'num_snps': 43862}. Best is trial 0 with value: -0.013292083166114303.
[I 2025-12-05 15:48:31,783] Trial 1 finished with value: 0.029670969812375707 and parameters: {'model_type': 'mlp', 'hidden_dims': '[256, 128]', 'dropout': 0.4370668075331726, 'batch_norm': True, 'lr': 7.133471581159139e-05, 'weight_decay': 1.128633586803549e-05, 'epochs': 242, 'loss': 'mae', 'optimizer': 'adam', 'graph_mode': 'off', 'use_snp_selection': False}. Best is trial 1 with value: 0.029670969812375707.
[I 2025-12-05 15:48:32,794] Trial 2 finished with value: -0.001260013902402771 and parameters: {'model_type': 'mlp', 'hidden_dims': '[256, 128, 64]', 'dropout': 0.41314357415569625, 'batch_norm': False, 'lr': 3.952233718592101e-06, 'weight_decay': 0.00026754769258252603, 'epochs': 149, 'loss': 'mse', 'optimizer': 'adam', 'graph_mode': 'off', 'use_snp_selection': True, 'num_snps': 11571}. Best is trial 1 with value: 0.029670969812375707.
[I 2025-12-05 15:48:34,673] Trial 3 finished with value: -0.008249914968350754 and parameters: {'model_type': 'mlp', 'hidden_dims': '[512, 64]', 'dropout': 0.5938127374509361, 'batch_norm': False, 'lr': 5.67704586114731e-06, 'weight_decay': 2.4518087630137052e-05, 'epochs': 320, 'loss': 'mae', 'optimizer': 'adam', 'graph_mode': 'off', 'use_snp_selection': False}. Best is trial 1 with value: 0.029670969812375707.
[I 2025-12-05 15:48:36,770] Trial 4 finished with value: 0.03381431713098625 and parameters: {'model_type': 'mlp', 'hidden_dims': '[512, 128]', 'dropout': 0.25746343592134413, 'batch_norm': True, 'lr': 1.3467657668402788e-06, 'weight_decay': 0.00033087251918647806, 'epochs': 277, 'loss': 'mse', 'optimizer': 'adam', 'graph_mode': 'off', 'use_snp_selection': True, 'num_snps': 36675}. Best is trial 4 with value: 0.03381431713098625.
[I 2025-12-05 15:48:38,487] Trial 5 finished with value: 0.007546215084643941 and parameters: {'model_type': 'mlp', 'hidden_dims': '[512, 64]', 'dropout': 0.38275350994408375, 'batch_norm': True, 'lr': 1.5586664309232824e-06, 'weight_decay': 0.0008227664668621182, 'epochs': 145, 'loss': 'mae', 'optimizer': 'adam', 'graph_mode': 'off', 'use_snp_selection': True, 'num_snps': 32148}. Best is trial 4 with value: 0.03381431713098625.
[I 2025-12-05 15:48:39,513] Trial 6 finished with value: 0.01226499481115577 and parameters: {'model_type': 'mlp', 'hidden_dims': '[256, 128]', 'dropout': 0.3930109900265879, 'batch_norm': False, 'lr': 4.892964372128395e-05, 'weight_decay': 1.5809549317992182e-06, 'epochs': 199, 'loss': 'mse', 'optimizer': 'adam', 'graph_mode': 'off', 'use_snp_selection': False}. Best is trial 4 with value: 0.03381431713098625.
[I 2025-12-05 15:48:40,626] Trial 7 finished with value: 0.0162929823192009 and parameters: {'model_type': 'mlp', 'hidden_dims': '[512, 256]', 'dropout': 0.15343979219678458, 'batch_norm': True, 'lr': 6.234003099047341e-05, 'weight_decay': 3.894760610535477e-07, 'epochs': 97, 'loss': 'mse', 'optimizer': 'adam', 'graph_mode': 'off', 'use_snp_selection': False}. Best is trial 4 with value: 0.03381431713098625.
[I 2025-12-05 15:48:42,481] Trial 8 finished with value: 0.0032728271287802988 and parameters: {'model_type': 'mlp', 'hidden_dims': '[512, 128]', 'dropout': 0.10743001231661406, 'batch_norm': True, 'lr': 0.00023728538449271062, 'weight_decay': 1.7629071578048637e-05, 'epochs': 312, 'loss': 'mae', 'optimizer': 'adam', 'graph_mode': 'off', 'use_snp_selection': False}. Best is trial 4 with value: 0.03381431713098625.
[I 2025-12-05 15:48:43,822] Trial 9 finished with value: 0.00420836735596988 and parameters: {'model_type': 'mlp', 'hidden_dims': '[512, 64]', 'dropout': 0.14505336736221927, 'batch_norm': True, 'lr': 5.8619638388111826e-05, 'weight_decay': 6.200156172669308e-07, 'epochs': 175, 'loss': 'mse', 'optimizer': 'adam', 'graph_mode': 'off', 'use_snp_selection': False}. Best is trial 4 with value: 0.03381431713098625.
[I 2025-12-05 15:48:46,960] Trial 10 finished with value: 0.021106748561918638 and parameters: {'model_type': 'mlp', 'hidden_dims': '[512, 128]', 'dropout': 0.2549147281275221, 'batch_norm': False, 'lr': 1.080428984628536e-05, 'weight_decay': 0.0001397766261378007, 'epochs': 256, 'loss': 'mse', 'optimizer': 'adam', 'graph_mode': 'off', 'use_snp_selection': True, 'num_snps': 57847}. Best is trial 4 with value: 0.03381431713098625.
[I 2025-12-05 15:48:47,988] Trial 11 finished with value: 0.04764306132451757 and parameters: {'model_type': 'mlp', 'hidden_dims': '[256, 128]', 'dropout': 0.5115468690972484, 'batch_norm': True, 'lr': 0.0006579145291493049, 'weight_decay': 4.376241560421196e-06, 'epochs': 242, 'loss': 'mae', 'optimizer': 'adam', 'graph_mode': 'off', 'use_snp_selection': True, 'num_snps': 7093}. Best is trial 11 with value: 0.04764306132451757.
[I 2025-12-05 15:48:49,106] Trial 12 finished with value: 0.03516286733166655 and parameters: {'model_type': 'mlp', 'hidden_dims': '[512, 128]', 'dropout': 0.5330584614084067, 'batch_norm': True, 'lr': 0.0007234317510692916, 'weight_decay': 2.8038717616089895e-06, 'epochs': 260, 'loss': 'mae', 'optimizer': 'adam', 'graph_mode': 'off', 'use_snp_selection': True, 'num_snps': 10357}. Best is trial 11 with value: 0.04764306132451757.
[I 2025-12-05 15:48:49,936] Trial 13 finished with value: 0.018342502922130185 and parameters: {'model_type': 'mlp', 'hidden_dims': '[256, 128]', 'dropout': 0.5368528830856696, 'batch_norm': True, 'lr': 0.0008947399836822109, 'weight_decay': 2.5298549210362187e-06, 'epochs': 222, 'loss': 'mae', 'optimizer': 'adam', 'graph_mode': 'off', 'use_snp_selection': True, 'num_snps': 2773}. Best is trial 11 with value: 0.04764306132451757.
[I 2025-12-05 15:48:51,050] Trial 14 finished with value: 0.016397809837422967 and parameters: {'model_type': 'mlp', 'hidden_dims': '[512, 256]', 'dropout': 0.4983076861628707, 'batch_norm': True, 'lr': 0.0009954291351895368, 'weight_decay': 3.0801097786673646e-06, 'epochs': 52, 'loss': 'mae', 'optimizer': 'adam', 'graph_mode': 'off', 'use_snp_selection': True, 'num_snps': 17567}. Best is trial 11 with value: 0.04764306132451757.
[I 2025-12-05 15:48:52,586] Trial 15 finished with value: 0.018063559142946904 and parameters: {'model_type': 'mlp', 'hidden_dims': '[256, 128, 64]', 'dropout': 0.491124579381878, 'batch_norm': True, 'lr': 0.00026598734892529515, 'weight_decay': 1.7716929046392845e-07, 'epochs': 283, 'loss': 'mae', 'optimizer': 'adam', 'graph_mode': 'off', 'use_snp_selection': True, 'num_snps': 17700}. Best is trial 11 with value: 0.04764306132451757.
[I 2025-12-05 15:48:53,447] Trial 16 finished with value: 0.010937872792584956 and parameters: {'model_type': 'mlp', 'hidden_dims': '[128, 64]', 'dropout': 0.5957018955094693, 'batch_norm': True, 'lr': 0.00024475615843128735, 'weight_decay': 5.466365783456473e-06, 'epochs': 222, 'loss': 'mae', 'optimizer': 'adam', 'graph_mode': 'off', 'use_snp_selection': True, 'num_snps': 2088}. Best is trial 11 with value: 0.04764306132451757.
[I 2025-12-05 15:48:54,865] Trial 17 finished with value: 0.006988401553309945 and parameters: {'model_type': 'mlp', 'hidden_dims': '[256, 128]', 'dropout': 0.4718150094630361, 'batch_norm': True, 'lr': 0.0005421759279047556, 'weight_decay': 1.0649843633863145e-06, 'epochs': 274, 'loss': 'mae', 'optimizer': 'adam', 'graph_mode': 'off', 'use_snp_selection': True, 'num_snps': 19705}. Best is trial 11 with value: 0.04764306132451757.
[I 2025-12-05 15:48:55,831] Trial 18 finished with value: 0.04221778517673992 and parameters: {'model_type': 'mlp', 'hidden_dims': '[512, 128]', 'dropout': 0.5415431027488958, 'batch_norm': False, 'lr': 0.00013351902216327365, 'weight_decay': 7.042990887305064e-06, 'epochs': 189, 'loss': 'mae', 'optimizer': 'adam', 'graph_mode': 'off', 'use_snp_selection': True, 'num_snps': 10598}. Best is trial 11 with value: 0.04764306132451757.
[I 2025-12-05 15:48:57,193] Trial 19 finished with value: 0.0011996302157585331 and parameters: {'model_type': 'mlp', 'hidden_dims': '[512, 128]', 'dropout': 0.29174091611568514, 'batch_norm': False, 'lr': 1.64655195956836e-05, 'weight_decay': 4.679666515308887e-05, 'epochs': 123, 'loss': 'mae', 'optimizer': 'adam', 'graph_mode': 'off', 'use_snp_selection': True, 'num_snps': 24134}. Best is trial 11 with value: 0.04764306132451757.
[I 2025-12-05 15:48:58,132] Trial 20 finished with value: 0.03224312986760405 and parameters: {'model_type': 'mlp', 'hidden_dims': '[256, 128]', 'dropout': 0.32956373139602224, 'batch_norm': False, 'lr': 0.00012222749837011507, 'weight_decay': 6.932380178753735e-06, 'epochs': 193, 'loss': 'mae', 'optimizer': 'adam', 'graph_mode': 'off', 'use_snp_selection': True, 'num_snps': 9520}. Best is trial 11 with value: 0.04764306132451757.
[I 2025-12-05 15:48:59,234] Trial 21 finished with value: 0.03383396699572719 and parameters: {'model_type': 'mlp', 'hidden_dims': '[512, 128]', 'dropout': 0.5447482902151292, 'batch_norm': False, 'lr': 0.00042787521514329953, 'weight_decay': 4.326649971619831e-06, 'epochs': 233, 'loss': 'mae', 'optimizer': 'adam', 'graph_mode': 'off', 'use_snp_selection': True, 'num_snps': 10958}. Best is trial 11 with value: 0.04764306132451757.
[I 2025-12-05 15:49:00,214] Trial 22 finished with value: 0.04193630681044799 and parameters: {'model_type': 'mlp', 'hidden_dims': '[512, 128]', 'dropout': 0.5404912507077648, 'batch_norm': False, 'lr': 0.00011316693754321049, 'weight_decay': 1.3281280673212327e-06, 'epochs': 194, 'loss': 'mae', 'optimizer': 'adam', 'graph_mode': 'off', 'use_snp_selection': True, 'num_snps': 8344}. Best is trial 11 with value: 0.04764306132451757.
[I 2025-12-05 15:49:01,057] Trial 23 finished with value: 0.04983097283347141 and parameters: {'model_type': 'mlp', 'hidden_dims': '[512, 128]', 'dropout': 0.45577754569579987, 'batch_norm': False, 'lr': 0.00013154891449348744, 'weight_decay': 1.0972479825368451e-07, 'epochs': 174, 'loss': 'mae', 'optimizer': 'adam', 'graph_mode': 'off', 'use_snp_selection': True, 'num_snps': 5711}. Best is trial 23 with value: 0.04983097283347141.
[I 2025-12-05 15:49:01,769] Trial 24 finished with value: 0.020152543448927404 and parameters: {'model_type': 'mlp', 'hidden_dims': '[512, 128]', 'dropout': 0.45119914990275256, 'batch_norm': False, 'lr': 2.524418450601324e-05, 'weight_decay': 1.0240454007849029e-07, 'epochs': 165, 'loss': 'mae', 'optimizer': 'adam', 'graph_mode': 'off', 'use_snp_selection': True, 'num_snps': 2076}. Best is trial 23 with value: 0.04983097283347141.
[I 2025-12-05 15:49:03,016] Trial 25 finished with value: 0.04136683759516137 and parameters: {'model_type': 'mlp', 'hidden_dims': '[256, 128, 64]', 'dropout': 0.4949532965452869, 'batch_norm': False, 'lr': 0.0001388189177015217, 'weight_decay': 3.353227185678397e-07, 'epochs': 114, 'loss': 'mae', 'optimizer': 'adam', 'graph_mode': 'off', 'use_snp_selection': True, 'num_snps': 22869}. Best is trial 23 with value: 0.04983097283347141.
[I 2025-12-05 15:49:03,944] Trial 26 finished with value: 0.024881958250168715 and parameters: {'model_type': 'mlp', 'hidden_dims': '[128, 64]', 'dropout': 0.3592616140493563, 'batch_norm': False, 'lr': 0.0004654899141828642, 'weight_decay': 4.272173754709633e-05, 'epochs': 83, 'loss': 'mae', 'optimizer': 'adam', 'graph_mode': 'off', 'use_snp_selection': True, 'num_snps': 15053}. Best is trial 23 with value: 0.04983097283347141.
[I 2025-12-05 15:49:04,801] Trial 27 finished with value: 0.02823309815425934 and parameters: {'model_type': 'mlp', 'hidden_dims': '[512, 256]', 'dropout': 0.43216153867443446, 'batch_norm': False, 'lr': 3.276792878865727e-05, 'weight_decay': 1.3720020426829955e-05, 'epochs': 212, 'loss': 'mae', 'optimizer': 'adam', 'graph_mode': 'off', 'use_snp_selection': True, 'num_snps': 6204}. Best is trial 23 with value: 0.04983097283347141.
[I 2025-12-05 15:49:06,365] Trial 28 finished with value: -0.008087819778948766 and parameters: {'model_type': 'mlp', 'hidden_dims': '[256, 128]', 'dropout': 0.568539381947251, 'batch_norm': False, 'lr': 0.0001911716672166446, 'weight_decay': 6.396471811232068e-07, 'epochs': 171, 'loss': 'mae', 'optimizer': 'adam', 'graph_mode': 'off', 'use_snp_selection': True, 'num_snps': 28470}. Best is trial 23 with value: 0.04983097283347141.
[I 2025-12-05 15:49:08,530] Trial 29 finished with value: 0.03331029293063855 and parameters: {'model_type': 'mlp', 'hidden_dims': '[128, 64]', 'dropout': 0.5057647557749401, 'batch_norm': False, 'lr': 0.00040996163161393707, 'weight_decay': 0.00010161927172912759, 'epochs': 349, 'loss': 'mae', 'optimizer': 'adam', 'graph_mode': 'off', 'use_snp_selection': True, 'num_snps': 44499}. Best is trial 23 with value: 0.04983097283347141.
[I 2025-12-05 15:49:09,577] Trial 30 finished with value: 0.012543767143077974 and parameters: {'model_type': 'mlp', 'hidden_dims': '[512, 128]', 'dropout': 0.46784033215968435, 'batch_norm': False, 'lr': 9.629711891685452e-05, 'weight_decay': 2.415408742682803e-05, 'epochs': 137, 'loss': 'mae', 'optimizer': 'adam', 'graph_mode': 'off', 'use_snp_selection': True, 'num_snps': 13921}. Best is trial 23 with value: 0.04983097283347141.
[I 2025-12-05 15:49:10,439] Trial 31 finished with value: 0.05841416553166555 and parameters: {'model_type': 'mlp', 'hidden_dims': '[512, 128]', 'dropout': 0.54841259147889, 'batch_norm': False, 'lr': 0.00011255555437708117, 'weight_decay': 1.358965885930142e-06, 'epochs': 191, 'loss': 'mae', 'optimizer': 'adam', 'graph_mode': 'off', 'use_snp_selection': True, 'num_snps': 7056}. Best is trial 31 with value: 0.05841416553166555.
[I 2025-12-05 15:49:11,266] Trial 32 finished with value: 0.04670007894874721 and parameters: {'model_type': 'mlp', 'hidden_dims': '[512, 128]', 'dropout': 0.5688757223492578, 'batch_norm': False, 'lr': 3.4603354251792235e-05, 'weight_decay': 8.510618742657699e-06, 'epochs': 182, 'loss': 'mae', 'optimizer': 'adam', 'graph_mode': 'off', 'use_snp_selection': True, 'num_snps': 6255}. Best is trial 31 with value: 0.05841416553166555.
[I 2025-12-05 15:49:12,077] Trial 33 finished with value: 0.027963025851302534 and parameters: {'model_type': 'mlp', 'hidden_dims': '[512, 128]', 'dropout': 0.574442827502656, 'batch_norm': False, 'lr': 2.9700963702406735e-05, 'weight_decay': 1.9576396557316505e-07, 'epochs': 159, 'loss': 'mae', 'optimizer': 'adam', 'graph_mode': 'off', 'use_snp_selection': True, 'num_snps': 6818}. Best is trial 31 with value: 0.05841416553166555.
[I 2025-12-05 15:49:13,715] Trial 34 finished with value: -0.010053182617779087 and parameters: {'model_type': 'mlp', 'hidden_dims': '[512, 128]', 'dropout': 0.42942255299971577, 'batch_norm': False, 'lr': 1.079936787636777e-05, 'weight_decay': 9.869713450526916e-06, 'epochs': 242, 'loss': 'mae', 'optimizer': 'adam', 'graph_mode': 'off', 'use_snp_selection': False}. Best is trial 31 with value: 0.05841416553166555.
