[I 2025-12-06 11:16:17,806] Trial 89 finished with value: 0.2654958460584024 and parameters: {'model_type': 'mlp', 'hidden_dims': '[512, 256]', 'dropout': 0.5207796631773904, 'batch_norm': False, 'lr': 2.8563713472883607e-06, 'weight_decay': 1.8410754766596946e-07, 'epochs': 285, 'loss': 'mae', 'optimizer': 'adam', 'graph_mode': 'off', 'use_snp_selection': True, 'num_snps': 46333}. Best is trial 83 with value: 0.2775974438816244.
[I 2025-12-06 11:18:14,871] Trial 90 finished with value: 0.26697311083515396 and parameters: {'model_type': 'mlp', 'hidden_dims': '[512, 256]', 'dropout': 0.40261155675313265, 'batch_norm': False, 'lr': 1.1612547221306024e-06, 'weight_decay': 3.1116190487659007e-07, 'epochs': 267, 'loss': 'mae', 'optimizer': 'adam', 'graph_mode': 'off', 'use_snp_selection': True, 'num_snps': 58289}. Best is trial 83 with value: 0.2775974438816244.
[I 2025-12-06 11:20:04,829] Trial 91 finished with value: 0.2751583214160974 and parameters: {'model_type': 'mlp', 'hidden_dims': '[512, 256]', 'dropout': 0.45895843296340366, 'batch_norm': False, 'lr': 2.2671468253615626e-06, 'weight_decay': 9.29441413072736e-06, 'epochs': 291, 'loss': 'mae', 'optimizer': 'adam', 'graph_mode': 'off', 'use_snp_selection': True, 'num_snps': 49789}. Best is trial 83 with value: 0.2775974438816244.
[I 2025-12-06 11:21:56,613] Trial 92 finished with value: 0.28033467507728466 and parameters: {'model_type': 'mlp', 'hidden_dims': '[512, 256]', 'dropout': 0.4574457741436814, 'batch_norm': False, 'lr': 2.1862767472847184e-06, 'weight_decay': 8.111610874261895e-06, 'epochs': 298, 'loss': 'mae', 'optimizer': 'adam', 'graph_mode': 'off', 'use_snp_selection': True, 'num_snps': 49980}. Best is trial 92 with value: 0.28033467507728466.
[I 2025-12-06 11:23:48,240] Trial 93 finished with value: 0.2717651907600199 and parameters: {'model_type': 'mlp', 'hidden_dims': '[512, 256]', 'dropout': 0.4519302708330921, 'batch_norm': False, 'lr': 2.1850471868186287e-06, 'weight_decay': 7.887372971791977e-07, 'epochs': 291, 'loss': 'mae', 'optimizer': 'adam', 'graph_mode': 'off', 'use_snp_selection': True, 'num_snps': 50714}. Best is trial 92 with value: 0.28033467507728466.
[I 2025-12-06 11:24:52,504] Trial 94 finished with value: 0.23633165684810953 and parameters: {'model_type': 'mlp', 'hidden_dims': '[128, 64]', 'dropout': 0.5541672813721739, 'batch_norm': False, 'lr': 2.6069051165018885e-06, 'weight_decay': 2.5016437960814772e-05, 'epochs': 277, 'loss': 'mae', 'optimizer': 'adam', 'graph_mode': 'off', 'use_snp_selection': True, 'num_snps': 52816}. Best is trial 92 with value: 0.28033467507728466.
[I 2025-12-06 11:27:00,880] Trial 95 finished with value: 0.25346166103998 and parameters: {'model_type': 'mlp', 'hidden_dims': '[512, 256]', 'dropout': 0.47710995122397987, 'batch_norm': False, 'lr': 1.5999962559889442e-06, 'weight_decay': 1.723580860377998e-05, 'epochs': 297, 'loss': 'mae', 'optimizer': 'adam', 'graph_mode': 'off', 'use_snp_selection': True, 'num_snps': 59720}. Best is trial 92 with value: 0.28033467507728466.
[I 2025-12-06 11:28:28,011] Trial 96 finished with value: 0.26646971282358545 and parameters: {'model_type': 'mlp', 'hidden_dims': '[512, 256]', 'dropout': 0.5015895347379862, 'batch_norm': False, 'lr': 3.2321917043657447e-06, 'weight_decay': 1.4660798371349445e-07, 'epochs': 183, 'loss': 'mae', 'optimizer': 'adam', 'graph_mode': 'off', 'use_snp_selection': True, 'num_snps': 49451}. Best is trial 92 with value: 0.28033467507728466.
[I 2025-12-06 11:30:16,910] Trial 97 finished with value: 0.25851946234062234 and parameters: {'model_type': 'mlp', 'hidden_dims': '[512, 256]', 'dropout': 0.43063536050235696, 'batch_norm': False, 'lr': 2.3966059599995948e-06, 'weight_decay': 0.00010476276084095277, 'epochs': 257, 'loss': 'mse', 'optimizer': 'adam', 'graph_mode': 'off', 'use_snp_selection': True, 'num_snps': 54030}. Best is trial 92 with value: 0.28033467507728466.
[I 2025-12-06 11:32:19,745] Trial 98 finished with value: 0.26145808088671607 and parameters: {'model_type': 'mlp', 'hidden_dims': '[512, 128]', 'dropout': 0.46234566983866826, 'batch_norm': False, 'lr': 4.085876715178684e-06, 'weight_decay': 8.588169464939272e-06, 'epochs': 304, 'loss': 'mae', 'optimizer': 'adam', 'graph_mode': 'off', 'use_snp_selection': True, 'num_snps': 55768}. Best is trial 92 with value: 0.28033467507728466.
[I 2025-12-06 11:33:58,013] Trial 99 finished with value: 0.2691854051880811 and parameters: {'model_type': 'mlp', 'hidden_dims': '[512, 256]', 'dropout': 0.15228180213640896, 'batch_norm': False, 'lr': 1.355109528522866e-06, 'weight_decay': 1.1863710302139778e-05, 'epochs': 294, 'loss': 'mae', 'optimizer': 'adam', 'graph_mode': 'off', 'use_snp_selection': True, 'num_snps': 42909}. Best is trial 92 with value: 0.28033467507728466.
[I 2025-12-06 11:35:10,959] Trial 100 finished with value: 0.2208633230964868 and parameters: {'model_type': 'mlp', 'hidden_dims': '[256, 128, 64]', 'dropout': 0.4942627965415134, 'batch_norm': True, 'lr': 5.682762881756991e-06, 'weight_decay': 9.528787032023992e-07, 'epochs': 246, 'loss': 'mae', 'optimizer': 'adam', 'graph_mode': 'off', 'use_snp_selection': True, 'num_snps': 48166}. Best is trial 92 with value: 0.28033467507728466.
[I 2025-12-06 11:36:57,010] Trial 101 finished with value: 0.2739747328565111 and parameters: {'model_type': 'mlp', 'hidden_dims': '[512, 256]', 'dropout': 0.44453588065721744, 'batch_norm': False, 'lr': 1.9361380178940028e-06, 'weight_decay': 1.4660338796989873e-05, 'epochs': 314, 'loss': 'mae', 'optimizer': 'adam', 'graph_mode': 'off', 'use_snp_selection': True, 'num_snps': 45662}. Best is trial 92 with value: 0.28033467507728466.
[I 2025-12-06 11:38:38,775] Trial 102 finished with value: 0.2868643764237585 and parameters: {'model_type': 'mlp', 'hidden_dims': '[512, 256]', 'dropout': 0.445895075005358, 'batch_norm': False, 'lr': 2.0870684626887865e-06, 'weight_decay': 2.2685117516342754e-05, 'epochs': 236, 'loss': 'mae', 'optimizer': 'adam', 'graph_mode': 'off', 'use_snp_selection': True, 'num_snps': 52111}. Best is trial 102 with value: 0.2868643764237585.
[I 2025-12-06 11:40:19,482] Trial 103 finished with value: 0.2680579271884366 and parameters: {'model_type': 'mlp', 'hidden_dims': '[512, 256]', 'dropout': 0.45480505366289126, 'batch_norm': False, 'lr': 1.8596721192456092e-06, 'weight_decay': 3.0371206769395467e-05, 'epochs': 236, 'loss': 'mae', 'optimizer': 'adam', 'graph_mode': 'off', 'use_snp_selection': True, 'num_snps': 51786}. Best is trial 102 with value: 0.2868643764237585.
[I 2025-12-06 11:42:28,538] Trial 104 finished with value: 0.2613806331687796 and parameters: {'model_type': 'mlp', 'hidden_dims': '[512, 256]', 'dropout': 0.437578671679444, 'batch_norm': False, 'lr': 1.4916229568673388e-06, 'weight_decay': 4.115487788335524e-05, 'epochs': 316, 'loss': 'mae', 'optimizer': 'adam', 'graph_mode': 'off', 'use_snp_selection': True, 'num_snps': 57759}. Best is trial 102 with value: 0.2868643764237585.
[I 2025-12-06 11:44:04,775] Trial 105 finished with value: 0.2517832813510926 and parameters: {'model_type': 'mlp', 'hidden_dims': '[512, 256]', 'dropout': 0.11748952809181795, 'batch_norm': False, 'lr': 1.1615916368430106e-06, 'weight_decay': 1.590051168917934e-05, 'epochs': 222, 'loss': 'mae', 'optimizer': 'adam', 'graph_mode': 'off', 'use_snp_selection': True, 'num_snps': 50121}. Best is trial 102 with value: 0.2868643764237585.
[I 2025-12-06 11:45:53,240] Trial 106 finished with value: 0.2693781447254042 and parameters: {'model_type': 'mlp', 'hidden_dims': '[512, 256]', 'dropout': 0.44274789798579295, 'batch_norm': False, 'lr': 3.181999503950553e-06, 'weight_decay': 2.072469099920211e-05, 'epochs': 252, 'loss': 'mae', 'optimizer': 'adam', 'graph_mode': 'off', 'use_snp_selection': True, 'num_snps': 54863}. Best is trial 102 with value: 0.2868643764237585.
[I 2025-12-06 11:47:41,559] Trial 107 finished with value: 0.2737994388499788 and parameters: {'model_type': 'mlp', 'hidden_dims': '[512, 256]', 'dropout': 0.47562757721465077, 'batch_norm': False, 'lr': 2.14741758086047e-06, 'weight_decay': 1.2082719111380337e-05, 'epochs': 263, 'loss': 'mae', 'optimizer': 'adam', 'graph_mode': 'off', 'use_snp_selection': True, 'num_snps': 52547}. Best is trial 102 with value: 0.2868643764237585.
[I 2025-12-06 11:49:15,666] Trial 108 finished with value: 0.26355681744718945 and parameters: {'model_type': 'mlp', 'hidden_dims': '[512, 256]', 'dropout': 0.42981363387378785, 'batch_norm': False, 'lr': 3.6115852212661216e-06, 'weight_decay': 2.223377287952173e-05, 'epochs': 236, 'loss': 'mae', 'optimizer': 'adam', 'graph_mode': 'off', 'use_snp_selection': True, 'num_snps': 46994}. Best is trial 102 with value: 0.2868643764237585.
[I 2025-12-06 11:51:02,981] Trial 109 finished with value: 0.27214669635353644 and parameters: {'model_type': 'mlp', 'hidden_dims': '[512, 256]', 'dropout': 0.4624105409579749, 'batch_norm': False, 'lr': 1.666069748455267e-06, 'weight_decay': 6.400640762114976e-07, 'epochs': 282, 'loss': 'mae', 'optimizer': 'adam', 'graph_mode': 'off', 'use_snp_selection': True, 'num_snps': 49080}. Best is trial 102 with value: 0.2868643764237585.
[I 2025-12-06 11:52:27,697] Trial 110 finished with value: 0.2727131324275416 and parameters: {'model_type': 'mlp', 'hidden_dims': '[256, 128]', 'dropout': 0.4079971596360123, 'batch_norm': False, 'lr': 2.9788247918234935e-06, 'weight_decay': 0.00021199720160976535, 'epochs': 271, 'loss': 'mae', 'optimizer': 'adam', 'graph_mode': 'off', 'use_snp_selection': True, 'num_snps': 58380}. Best is trial 102 with value: 0.2868643764237585.
[I 2025-12-06 11:54:15,700] Trial 111 finished with value: 0.26817871194376425 and parameters: {'model_type': 'mlp', 'hidden_dims': '[512, 256]', 'dropout': 0.47691417677232256, 'batch_norm': False, 'lr': 2.169284564331176e-06, 'weight_decay': 1.238131968608286e-05, 'epochs': 265, 'loss': 'mae', 'optimizer': 'adam', 'graph_mode': 'off', 'use_snp_selection': True, 'num_snps': 52143}. Best is trial 102 with value: 0.2868643764237585.
[I 2025-12-06 11:56:15,365] Trial 112 finished with value: 0.26642281002105184 and parameters: {'model_type': 'mlp', 'hidden_dims': '[512, 256]', 'dropout': 0.4710655040725191, 'batch_norm': False, 'lr': 2.4729124015994076e-06, 'weight_decay': 4.926121740458238e-05, 'epochs': 306, 'loss': 'mae', 'optimizer': 'adam', 'graph_mode': 'off', 'use_snp_selection': True, 'num_snps': 53557}. Best is trial 102 with value: 0.2868643764237585.
[I 2025-12-06 11:58:11,686] Trial 113 finished with value: 0.2741836906087583 and parameters: {'model_type': 'mlp', 'hidden_dims': '[512, 256]', 'dropout': 0.4895617530996918, 'batch_norm': False, 'lr': 2.056981972512653e-06, 'weight_decay': 1.0030946225820973e-05, 'epochs': 275, 'loss': 'mae', 'optimizer': 'adam', 'graph_mode': 'off', 'use_snp_selection': True, 'num_snps': 55879}. Best is trial 102 with value: 0.2868643764237585.
[I 2025-12-06 12:00:11,487] Trial 114 finished with value: 0.27144182463614713 and parameters: {'model_type': 'mlp', 'hidden_dims': '[512, 256]', 'dropout': 0.4872400210493906, 'batch_norm': False, 'lr': 1.8791942253209567e-06, 'weight_decay': 9.783868089464674e-06, 'epochs': 289, 'loss': 'mae', 'optimizer': 'adam', 'graph_mode': 'off', 'use_snp_selection': True, 'num_snps': 56007}. Best is trial 102 with value: 0.2868643764237585.
[I 2025-12-06 12:02:05,570] Trial 115 finished with value: 0.2594569239551337 and parameters: {'model_type': 'mlp', 'hidden_dims': '[512, 256]', 'dropout': 0.45083177713089206, 'batch_norm': False, 'lr': 1.2831100020160705e-06, 'weight_decay': 1.4813927945127946e-05, 'epochs': 276, 'loss': 'mae', 'optimizer': 'adam', 'graph_mode': 'off', 'use_snp_selection': True, 'num_snps': 54930}. Best is trial 102 with value: 0.2868643764237585.
[I 2025-12-06 12:02:38,190] Trial 116 finished with value: 0.12538021303289507 and parameters: {'model_type': 'mlp', 'hidden_dims': '[128, 64]', 'dropout': 0.39127345242127487, 'batch_norm': False, 'lr': 1.6491752623220284e-06, 'weight_decay': 7.988036794425248e-06, 'epochs': 248, 'loss': 'mse', 'optimizer': 'adam', 'graph_mode': 'off', 'use_snp_selection': True, 'num_snps': 4487}. Best is trial 102 with value: 0.2868643764237585.
[I 2025-12-06 12:04:30,426] Trial 117 finished with value: 0.2657677562212304 and parameters: {'model_type': 'mlp', 'hidden_dims': '[512, 64]', 'dropout': 0.49251105855072613, 'batch_norm': False, 'lr': 2.6396391750780634e-06, 'weight_decay': 4.714474836458463e-06, 'epochs': 297, 'loss': 'mae', 'optimizer': 'adam', 'graph_mode': 'off', 'use_snp_selection': True, 'num_snps': 50785}. Best is trial 102 with value: 0.2868643764237585.
[I 2025-12-06 12:06:31,089] Trial 118 finished with value: 0.2568934022543932 and parameters: {'model_type': 'mlp', 'hidden_dims': '[512, 256]', 'dropout': 0.5072945443050894, 'batch_norm': False, 'lr': 1.4631838559538665e-06, 'weight_decay': 1.0477668580139222e-05, 'epochs': 280, 'loss': 'mae', 'optimizer': 'adam', 'graph_mode': 'off', 'use_snp_selection': True, 'num_snps': 58603}. Best is trial 102 with value: 0.2868643764237585.
[I 2025-12-06 12:08:10,969] Trial 119 finished with value: 0.24262653263145656 and parameters: {'model_type': 'mlp', 'hidden_dims': '[512, 256]', 'dropout': 0.44373700764761786, 'batch_norm': False, 'lr': 1.0261610385516441e-06, 'weight_decay': 2.5893264116386315e-05, 'epochs': 207, 'loss': 'mae', 'optimizer': 'adam', 'graph_mode': 'off', 'use_snp_selection': True, 'num_snps': 56171}. Best is trial 102 with value: 0.2868643764237585.
[I 2025-12-06 12:09:43,941] Trial 120 finished with value: 0.2767325233623702 and parameters: {'model_type': 'mlp', 'hidden_dims': '[512, 256]', 'dropout': 0.42343399421455163, 'batch_norm': False, 'lr': 2.0226398534570543e-06, 'weight_decay': 1.680824944865306e-06, 'epochs': 259, 'loss': 'mae', 'optimizer': 'adam', 'graph_mode': 'off', 'use_snp_selection': True, 'num_snps': 44222}. Best is trial 102 with value: 0.2868643764237585.
[I 2025-12-06 12:11:17,596] Trial 121 finished with value: 0.2725106719519538 and parameters: {'model_type': 'mlp', 'hidden_dims': '[512, 256]', 'dropout': 0.42511359601294574, 'batch_norm': False, 'lr': 1.98421322030303e-06, 'weight_decay': 1.520392610784671e-06, 'epochs': 258, 'loss': 'mae', 'optimizer': 'adam', 'graph_mode': 'off', 'use_snp_selection': True, 'num_snps': 44873}. Best is trial 102 with value: 0.2868643764237585.
[I 2025-12-06 12:13:00,048] Trial 122 finished with value: 0.2685454720002416 and parameters: {'model_type': 'mlp', 'hidden_dims': '[512, 256]', 'dropout': 0.4567610172142194, 'batch_norm': False, 'lr': 2.4382566723979157e-06, 'weight_decay': 1.2229585947451359e-06, 'epochs': 271, 'loss': 'mae', 'optimizer': 'adam', 'graph_mode': 'off', 'use_snp_selection': True, 'num_snps': 48031}. Best is trial 102 with value: 0.2868643764237585.
[I 2025-12-06 12:14:44,295] Trial 123 finished with value: 0.27378635940001705 and parameters: {'model_type': 'mlp', 'hidden_dims': '[512, 256]', 'dropout': 0.47086756929856177, 'batch_norm': False, 'lr': 1.7066231637059528e-06, 'weight_decay': 8.314104937464313e-07, 'epochs': 287, 'loss': 'mae', 'optimizer': 'adam', 'graph_mode': 'off', 'use_snp_selection': True, 'num_snps': 46155}. Best is trial 102 with value: 0.2868643764237585.
[I 2025-12-06 12:16:13,477] Trial 124 finished with value: 0.27105268419649126 and parameters: {'model_type': 'mlp', 'hidden_dims': '[512, 256]', 'dropout': 0.43358438434810587, 'batch_norm': False, 'lr': 2.9480052360376446e-06, 'weight_decay': 5.8199360171810055e-06, 'epochs': 239, 'loss': 'mae', 'optimizer': 'adam', 'graph_mode': 'off', 'use_snp_selection': True, 'num_snps': 43756}. Best is trial 102 with value: 0.2868643764237585.
[I 2025-12-06 12:18:07,456] Trial 125 finished with value: 0.27443776382390456 and parameters: {'model_type': 'mlp', 'hidden_dims': '[512, 256]', 'dropout': 0.4811120981082694, 'batch_norm': False, 'lr': 2.1579461397151155e-06, 'weight_decay': 5.05625903382792e-07, 'epochs': 311, 'loss': 'mae', 'optimizer': 'adam', 'graph_mode': 'off', 'use_snp_selection': True, 'num_snps': 49643}. Best is trial 102 with value: 0.2868643764237585.
[I 2025-12-06 12:19:52,295] Trial 126 finished with value: 0.1972088377341597 and parameters: {'model_type': 'mlp', 'hidden_dims': '[512, 128]', 'dropout': 0.4598863914630043, 'batch_norm': True, 'lr': 2.2669655364501404e-06, 'weight_decay': 5.267172206967261e-07, 'epochs': 254, 'loss': 'mae', 'optimizer': 'adam', 'graph_mode': 'off', 'use_snp_selection': True, 'num_snps': 51425}. Best is trial 102 with value: 0.2868643764237585.
[I 2025-12-06 12:21:43,900] Trial 127 finished with value: 0.26669087178012774 and parameters: {'model_type': 'mlp', 'hidden_dims': '[512, 256]', 'dropout': 0.33702013229195943, 'batch_norm': False, 'lr': 1.3767018797071703e-06, 'weight_decay': 4.213443245354315e-07, 'epochs': 297, 'loss': 'mae', 'optimizer': 'adam', 'graph_mode': 'off', 'use_snp_selection': True, 'num_snps': 49873}. Best is trial 102 with value: 0.2868643764237585.
[I 2025-12-06 12:22:34,164] Trial 128 finished with value: 0.2765226014428444 and parameters: {'model_type': 'mlp', 'hidden_dims': '[256, 128, 64]', 'dropout': 0.4800379117959882, 'batch_norm': False, 'lr': 1.1965342518481717e-06, 'weight_decay': 2.9813568709542966e-07, 'epochs': 307, 'loss': 'mae', 'optimizer': 'adam', 'graph_mode': 'off', 'use_snp_selection': False}. Best is trial 102 with value: 0.2868643764237585.
[I 2025-12-06 12:23:27,743] Trial 129 finished with value: 0.22868454141168404 and parameters: {'model_type': 'mlp', 'hidden_dims': '[256, 128, 64]', 'dropout': 0.48354383834148057, 'batch_norm': False, 'lr': 1.233735978950901e-06, 'weight_decay': 2.6571431246461476e-07, 'epochs': 329, 'loss': 'mae', 'optimizer': 'adam', 'graph_mode': 'off', 'use_snp_selection': False}. Best is trial 102 with value: 0.2868643764237585.
[I 2025-12-06 12:24:18,033] Trial 130 finished with value: 0.27738731152184537 and parameters: {'model_type': 'mlp', 'hidden_dims': '[256, 128, 64]', 'dropout': 0.3595427697147559, 'batch_norm': False, 'lr': 1.7333554303172194e-06, 'weight_decay': 3.3836046965437687e-07, 'epochs': 305, 'loss': 'mae', 'optimizer': 'adam', 'graph_mode': 'off', 'use_snp_selection': False}. Best is trial 102 with value: 0.2868643764237585.
[I 2025-12-06 12:25:08,380] Trial 131 finished with value: 0.24214231377331333 and parameters: {'model_type': 'mlp', 'hidden_dims': '[256, 128, 64]', 'dropout': 0.4695857148424372, 'batch_norm': False, 'lr': 1.6708155785701478e-06, 'weight_decay': 4.585798956117172e-07, 'epochs': 306, 'loss': 'mae', 'optimizer': 'adam', 'graph_mode': 'off', 'use_snp_selection': False}. Best is trial 102 with value: 0.2868643764237585.
[I 2025-12-06 12:25:57,823] Trial 132 finished with value: 0.24585233517574118 and parameters: {'model_type': 'mlp', 'hidden_dims': '[256, 128, 64]', 'dropout': 0.3558562251303323, 'batch_norm': False, 'lr': 0.00037091004273441037, 'weight_decay': 3.4291558546591966e-07, 'epochs': 309, 'loss': 'mae', 'optimizer': 'adam', 'graph_mode': 'off', 'use_snp_selection': False}. Best is trial 102 with value: 0.2868643764237585.
[I 2025-12-06 12:26:47,496] Trial 133 finished with value: 0.2253456413425381 and parameters: {'model_type': 'mlp', 'hidden_dims': '[256, 128, 64]', 'dropout': 0.4173110925999041, 'batch_norm': False, 'lr': 1.1319073551015904e-06, 'weight_decay': 1.7575056289348537e-07, 'epochs': 301, 'loss': 'mae', 'optimizer': 'adam', 'graph_mode': 'off', 'use_snp_selection': False}. Best is trial 102 with value: 0.2868643764237585.
[I 2025-12-06 12:27:35,898] Trial 134 finished with value: 0.26917391721785283 and parameters: {'model_type': 'mlp', 'hidden_dims': '[256, 128, 64]', 'dropout': 0.3235573236324442, 'batch_norm': False, 'lr': 1.4507794668219595e-06, 'weight_decay': 2.3706829347720343e-07, 'epochs': 292, 'loss': 'mae', 'optimizer': 'adam', 'graph_mode': 'off', 'use_snp_selection': False}. Best is trial 102 with value: 0.2868643764237585.
[I 2025-12-06 12:28:28,059] Trial 135 finished with value: 0.2723875595505967 and parameters: {'model_type': 'mlp', 'hidden_dims': '[256, 128, 64]', 'dropout': 0.4800538104991663, 'batch_norm': False, 'lr': 2.5964851972505176e-06, 'weight_decay': 6.673074197676962e-07, 'epochs': 319, 'loss': 'mae', 'optimizer': 'adam', 'graph_mode': 'off', 'use_snp_selection': False}. Best is trial 102 with value: 0.2868643764237585.
[I 2025-12-06 12:29:20,782] Trial 136 finished with value: 0.2662208144652675 and parameters: {'model_type': 'mlp', 'hidden_dims': '[256, 128, 64]', 'dropout': 0.4541984753986771, 'batch_norm': False, 'lr': 1.7581490333873457e-06, 'weight_decay': 5.290129494354915e-07, 'epochs': 323, 'loss': 'mae', 'optimizer': 'adam', 'graph_mode': 'off', 'use_snp_selection': False}. Best is trial 102 with value: 0.2868643764237585.
[I 2025-12-06 12:29:55,135] Trial 137 finished with value: 0.2564400489634281 and parameters: {'model_type': 'mlp', 'hidden_dims': '[256, 128, 64]', 'dropout': 0.49884775245589763, 'batch_norm': False, 'lr': 3.4775319589356604e-06, 'weight_decay': 9.226946851021209e-07, 'epochs': 195, 'loss': 'mse', 'optimizer': 'adam', 'graph_mode': 'off', 'use_snp_selection': False}. Best is trial 102 with value: 0.2868643764237585.
[I 2025-12-06 12:31:29,955] Trial 138 finished with value: 0.26738516514826954 and parameters: {'model_type': 'mlp', 'hidden_dims': '[512, 256]', 'dropout': 0.31943440450040395, 'batch_norm': False, 'lr': 2.3204665459107325e-06, 'weight_decay': 3.538639075643658e-07, 'epochs': 311, 'loss': 'mae', 'optimizer': 'adam', 'graph_mode': 'off', 'use_snp_selection': False}. Best is trial 102 with value: 0.2868643764237585.
