[I 2025-12-05 14:52:52,716] Trial 74 finished with value: -0.006470226559165301 and parameters: {'model_type': 'mlp', 'hidden_dims': '[512, 128]', 'dropout': 0.31512253865294104, 'batch_norm': True, 'lr': 5.393629022700732e-06, 'weight_decay': 1.4879363285979185e-06, 'epochs': 148, 'loss': 'mse', 'optimizer': 'adam', 'graph_mode': 'off', 'use_snp_selection': True, 'num_snps': 56723}. Best is trial 61 with value: 0.06672729345569342.
[I 2025-12-05 14:52:53,571] Trial 75 finished with value: 0.032109790410310216 and parameters: {'model_type': 'mlp', 'hidden_dims': '[256, 128]', 'dropout': 0.2451194584835456, 'batch_norm': True, 'lr': 0.0002257497181689116, 'weight_decay': 3.0109592752385633e-06, 'epochs': 78, 'loss': 'mae', 'optimizer': 'adam', 'graph_mode': 'off', 'use_snp_selection': False}. Best is trial 61 with value: 0.06672729345569342.
[I 2025-12-05 14:52:54,838] Trial 76 finished with value: 0.03959088181078777 and parameters: {'model_type': 'mlp', 'hidden_dims': '[512, 128]', 'dropout': 0.10135319941614171, 'batch_norm': True, 'lr': 0.0006378829526787602, 'weight_decay': 1.213422313278172e-06, 'epochs': 122, 'loss': 'mse', 'optimizer': 'adam', 'graph_mode': 'off', 'use_snp_selection': False}. Best is trial 61 with value: 0.06672729345569342.
[I 2025-12-05 14:52:56,390] Trial 77 finished with value: 0.04987004256695027 and parameters: {'model_type': 'mlp', 'hidden_dims': '[512, 256]', 'dropout': 0.12278982405755956, 'batch_norm': True, 'lr': 0.0007541259115756032, 'weight_decay': 1.2500354353567508e-06, 'epochs': 181, 'loss': 'mse', 'optimizer': 'adam', 'graph_mode': 'off', 'use_snp_selection': False}. Best is trial 61 with value: 0.06672729345569342.
[I 2025-12-05 14:52:58,751] Trial 78 finished with value: 0.04623009379466794 and parameters: {'model_type': 'mlp', 'hidden_dims': '[512, 256]', 'dropout': 0.10179716777533306, 'batch_norm': True, 'lr': 0.0007331704423969884, 'weight_decay': 1.244553990166446e-06, 'epochs': 157, 'loss': 'mse', 'optimizer': 'adam', 'graph_mode': 'off', 'use_snp_selection': True, 'num_snps': 41664}. Best is trial 61 with value: 0.06672729345569342.
[I 2025-12-05 14:53:01,230] Trial 79 finished with value: 0.037793708037035106 and parameters: {'model_type': 'mlp', 'hidden_dims': '[512, 256]', 'dropout': 0.12415264983603799, 'batch_norm': True, 'lr': 0.000778201563702365, 'weight_decay': 9.442823952865625e-05, 'epochs': 181, 'loss': 'mae', 'optimizer': 'adam', 'graph_mode': 'off', 'use_snp_selection': True, 'num_snps': 41869}. Best is trial 61 with value: 0.06672729345569342.
[I 2025-12-05 14:53:03,980] Trial 80 finished with value: 0.04780388645807433 and parameters: {'model_type': 'mlp', 'hidden_dims': '[512, 256]', 'dropout': 0.11877109576211134, 'batch_norm': True, 'lr': 0.0009605257965484346, 'weight_decay': 8.154720201872507e-06, 'epochs': 162, 'loss': 'mse', 'optimizer': 'adam', 'graph_mode': 'off', 'use_snp_selection': True, 'num_snps': 47008}. Best is trial 61 with value: 0.06672729345569342.
[I 2025-12-05 14:53:06,733] Trial 81 finished with value: 0.0352478919042774 and parameters: {'model_type': 'mlp', 'hidden_dims': '[512, 256]', 'dropout': 0.15287715930104875, 'batch_norm': True, 'lr': 0.0009839189460670514, 'weight_decay': 2.141109450158066e-06, 'epochs': 156, 'loss': 'mse', 'optimizer': 'adam', 'graph_mode': 'off', 'use_snp_selection': True, 'num_snps': 46619}. Best is trial 61 with value: 0.06672729345569342.
[I 2025-12-05 14:53:08,873] Trial 82 finished with value: 0.04280999725072427 and parameters: {'model_type': 'mlp', 'hidden_dims': '[512, 256]', 'dropout': 0.1312759507671632, 'batch_norm': True, 'lr': 0.0006969223090769701, 'weight_decay': 8.191383661177926e-06, 'epochs': 166, 'loss': 'mse', 'optimizer': 'adam', 'graph_mode': 'off', 'use_snp_selection': True, 'num_snps': 34369}. Best is trial 61 with value: 0.06672729345569342.
[I 2025-12-05 14:53:10,951] Trial 83 finished with value: 0.04198774181996778 and parameters: {'model_type': 'mlp', 'hidden_dims': '[512, 256]', 'dropout': 0.12273473374601454, 'batch_norm': True, 'lr': 0.0007575816716564074, 'weight_decay': 1.4695287618547581e-05, 'epochs': 166, 'loss': 'mse', 'optimizer': 'adam', 'graph_mode': 'off', 'use_snp_selection': True, 'num_snps': 34844}. Best is trial 61 with value: 0.06672729345569342.
[I 2025-12-05 14:53:13,259] Trial 84 finished with value: 0.03319064777443109 and parameters: {'model_type': 'mlp', 'hidden_dims': '[512, 256]', 'dropout': 0.11311715172945405, 'batch_norm': True, 'lr': 0.0004758182762354873, 'weight_decay': 7.3612232108880955e-06, 'epochs': 163, 'loss': 'mse', 'optimizer': 'adam', 'graph_mode': 'off', 'use_snp_selection': True, 'num_snps': 40507}. Best is trial 61 with value: 0.06672729345569342.
[I 2025-12-05 14:53:16,506] Trial 85 finished with value: 0.028806369268924617 and parameters: {'model_type': 'mlp', 'hidden_dims': '[512, 256]', 'dropout': 0.1364254830235783, 'batch_norm': True, 'lr': 0.0006245979823770889, 'weight_decay': 4.113629912397517e-06, 'epochs': 178, 'loss': 'mse', 'optimizer': 'adam', 'graph_mode': 'off', 'use_snp_selection': True, 'num_snps': 55561}. Best is trial 61 with value: 0.06672729345569342.
[I 2025-12-05 14:53:19,481] Trial 86 finished with value: 0.02459813707214105 and parameters: {'model_type': 'mlp', 'hidden_dims': '[512, 256]', 'dropout': 0.1477227909539822, 'batch_norm': False, 'lr': 0.0003914037478342408, 'weight_decay': 2.570014405180708e-05, 'epochs': 198, 'loss': 'mse', 'optimizer': 'adam', 'graph_mode': 'off', 'use_snp_selection': True, 'num_snps': 49047}. Best is trial 61 with value: 0.06672729345569342.
[I 2025-12-05 14:53:21,653] Trial 87 finished with value: 0.04578913502919562 and parameters: {'model_type': 'mlp', 'hidden_dims': '[512, 256]', 'dropout': 0.10000014389798909, 'batch_norm': True, 'lr': 0.0008556826751994602, 'weight_decay': 7.773426804659562e-06, 'epochs': 185, 'loss': 'mse', 'optimizer': 'adam', 'graph_mode': 'off', 'use_snp_selection': True, 'num_snps': 33729}. Best is trial 61 with value: 0.06672729345569342.
[I 2025-12-05 14:53:23,808] Trial 88 finished with value: 0.04130876860725435 and parameters: {'model_type': 'mlp', 'hidden_dims': '[512, 256]', 'dropout': 0.11126920469024607, 'batch_norm': True, 'lr': 0.000541180433600471, 'weight_decay': 7.542616347518782e-06, 'epochs': 184, 'loss': 'mse', 'optimizer': 'adam', 'graph_mode': 'off', 'use_snp_selection': True, 'num_snps': 35501}. Best is trial 61 with value: 0.06672729345569342.
[I 2025-12-05 14:53:26,013] Trial 89 finished with value: 0.03848019115696861 and parameters: {'model_type': 'mlp', 'hidden_dims': '[512, 256]', 'dropout': 0.12649334896960898, 'batch_norm': True, 'lr': 0.0007375336163339961, 'weight_decay': 6.20178615066164e-06, 'epochs': 219, 'loss': 'mae', 'optimizer': 'adam', 'graph_mode': 'off', 'use_snp_selection': True, 'num_snps': 33222}. Best is trial 61 with value: 0.06672729345569342.
[I 2025-12-05 14:53:27,995] Trial 90 finished with value: 0.03482558495528358 and parameters: {'model_type': 'mlp', 'hidden_dims': '[512, 256]', 'dropout': 0.17267319206144724, 'batch_norm': True, 'lr': 0.0008609395302093318, 'weight_decay': 1.4521324007235056e-05, 'epochs': 147, 'loss': 'mse', 'optimizer': 'adam', 'graph_mode': 'off', 'use_snp_selection': True, 'num_snps': 29951}. Best is trial 61 with value: 0.06672729345569342.
[I 2025-12-05 14:53:30,255] Trial 91 finished with value: 0.045288479671077714 and parameters: {'model_type': 'mlp', 'hidden_dims': '[512, 256]', 'dropout': 0.1556253151899687, 'batch_norm': True, 'lr': 0.0007020156779824508, 'weight_decay': 8.808577318290988e-06, 'epochs': 142, 'loss': 'mse', 'optimizer': 'adam', 'graph_mode': 'off', 'use_snp_selection': True, 'num_snps': 38903}. Best is trial 61 with value: 0.06672729345569342.
[I 2025-12-05 14:53:32,842] Trial 92 finished with value: 0.03964430719167709 and parameters: {'model_type': 'mlp', 'hidden_dims': '[512, 256]', 'dropout': 0.13479843719069703, 'batch_norm': True, 'lr': 0.0006633367567705165, 'weight_decay': 8.738390106490558e-06, 'epochs': 191, 'loss': 'mse', 'optimizer': 'adam', 'graph_mode': 'off', 'use_snp_selection': True, 'num_snps': 42403}. Best is trial 61 with value: 0.06672729345569342.
[I 2025-12-05 14:53:35,011] Trial 93 finished with value: 0.036377302070023446 and parameters: {'model_type': 'mlp', 'hidden_dims': '[512, 256]', 'dropout': 0.10040260632500761, 'batch_norm': True, 'lr': 0.0004267269442200762, 'weight_decay': 1.3174353111216937e-05, 'epochs': 142, 'loss': 'mse', 'optimizer': 'adam', 'graph_mode': 'off', 'use_snp_selection': True, 'num_snps': 37509}. Best is trial 61 with value: 0.06672729345569342.
[I 2025-12-05 14:53:37,558] Trial 94 finished with value: 0.038246309219817316 and parameters: {'model_type': 'mlp', 'hidden_dims': '[512, 256]', 'dropout': 0.15058101901425158, 'batch_norm': True, 'lr': 0.0009846515557320463, 'weight_decay': 1.9578661780802163e-05, 'epochs': 152, 'loss': 'mse', 'optimizer': 'adam', 'graph_mode': 'off', 'use_snp_selection': True, 'num_snps': 44077}. Best is trial 61 with value: 0.06672729345569342.
[I 2025-12-05 14:53:39,532] Trial 95 finished with value: 0.05464128424638327 and parameters: {'model_type': 'mlp', 'hidden_dims': '[512, 256]', 'dropout': 0.12866489034501746, 'batch_norm': True, 'lr': 0.0005421652964335545, 'weight_decay': 4.997355818142689e-06, 'epochs': 163, 'loss': 'mse', 'optimizer': 'adam', 'graph_mode': 'off', 'use_snp_selection': True, 'num_snps': 28730}. Best is trial 61 with value: 0.06672729345569342.
[I 2025-12-05 14:53:41,372] Trial 96 finished with value: 0.04625706946874692 and parameters: {'model_type': 'mlp', 'hidden_dims': '[512, 256]', 'dropout': 0.114245112121815, 'batch_norm': True, 'lr': 0.0005420728373830177, 'weight_decay': 4.928496321159478e-06, 'epochs': 158, 'loss': 'mse', 'optimizer': 'adam', 'graph_mode': 'off', 'use_snp_selection': True, 'num_snps': 28095}. Best is trial 61 with value: 0.06672729345569342.
[I 2025-12-05 14:53:43,118] Trial 97 finished with value: 0.03674333904977619 and parameters: {'model_type': 'mlp', 'hidden_dims': '[512, 256]', 'dropout': 0.11609568328353244, 'batch_norm': True, 'lr': 0.0005382382717134903, 'weight_decay': 5.12059600966435e-06, 'epochs': 162, 'loss': 'mse', 'optimizer': 'adam', 'graph_mode': 'off', 'use_snp_selection': True, 'num_snps': 27226}. Best is trial 61 with value: 0.06672729345569342.
[I 2025-12-05 14:53:44,965] Trial 98 finished with value: 0.0400450343269828 and parameters: {'model_type': 'mlp', 'hidden_dims': '[512, 256]', 'dropout': 0.16007089659291668, 'batch_norm': True, 'lr': 0.0005416135975855454, 'weight_decay': 3.367827192172535e-06, 'epochs': 175, 'loss': 'mse', 'optimizer': 'adam', 'graph_mode': 'off', 'use_snp_selection': True, 'num_snps': 28951}. Best is trial 61 with value: 0.06672729345569342.
[I 2025-12-05 14:53:46,909] Trial 99 finished with value: 0.035272081337409354 and parameters: {'model_type': 'mlp', 'hidden_dims': '[512, 256]', 'dropout': 0.10987206121061004, 'batch_norm': True, 'lr': 0.0008847560365619092, 'weight_decay': 6.390160055229016e-06, 'epochs': 154, 'loss': 'mae', 'optimizer': 'adam', 'graph_mode': 'off', 'use_snp_selection': True, 'num_snps': 32396}. Best is trial 61 with value: 0.06672729345569342.
[I 2025-12-05 14:53:49,345] Trial 100 finished with value: 0.05238279890796313 and parameters: {'model_type': 'mlp', 'hidden_dims': '[512, 256]', 'dropout': 0.14130292328095256, 'batch_norm': True, 'lr': 0.0003478817957493696, 'weight_decay': 4.6176279387742186e-06, 'epochs': 184, 'loss': 'mse', 'optimizer': 'adam', 'graph_mode': 'off', 'use_snp_selection': True, 'num_snps': 38934}. Best is trial 61 with value: 0.06672729345569342.
[I 2025-12-05 14:53:51,801] Trial 101 finished with value: 0.03638891177511574 and parameters: {'model_type': 'mlp', 'hidden_dims': '[512, 256]', 'dropout': 0.14513665364262487, 'batch_norm': True, 'lr': 0.0003358137384960524, 'weight_decay': 4.016274494590346e-06, 'epochs': 202, 'loss': 'mse', 'optimizer': 'adam', 'graph_mode': 'off', 'use_snp_selection': True, 'num_snps': 39092}. Best is trial 61 with value: 0.06672729345569342.
[I 2025-12-05 14:53:54,084] Trial 102 finished with value: 0.035982270041794884 and parameters: {'model_type': 'mlp', 'hidden_dims': '[512, 256]', 'dropout': 0.10206242621446471, 'batch_norm': True, 'lr': 0.0004131539018313474, 'weight_decay': 1.1758297062723643e-05, 'epochs': 195, 'loss': 'mse', 'optimizer': 'adam', 'graph_mode': 'off', 'use_snp_selection': True, 'num_snps': 37467}. Best is trial 61 with value: 0.06672729345569342.
[I 2025-12-05 14:53:56,719] Trial 103 finished with value: 0.04743662246593127 and parameters: {'model_type': 'mlp', 'hidden_dims': '[512, 256]', 'dropout': 0.11772938183588322, 'batch_norm': True, 'lr': 0.000490090224733304, 'weight_decay': 4.403268623320372e-06, 'epochs': 186, 'loss': 'mse', 'optimizer': 'adam', 'graph_mode': 'off', 'use_snp_selection': True, 'num_snps': 41829}. Best is trial 61 with value: 0.06672729345569342.
[I 2025-12-05 14:53:59,495] Trial 104 finished with value: 0.04519140370883168 and parameters: {'model_type': 'mlp', 'hidden_dims': '[512, 256]', 'dropout': 0.17620071110237673, 'batch_norm': True, 'lr': 0.0008322725316839893, 'weight_decay': 4.671402302788218e-06, 'epochs': 183, 'loss': 'mse', 'optimizer': 'adam', 'graph_mode': 'off', 'use_snp_selection': True, 'num_snps': 45003}. Best is trial 61 with value: 0.06672729345569342.
[I 2025-12-05 14:54:01,992] Trial 105 finished with value: 0.04751335408430765 and parameters: {'model_type': 'mlp', 'hidden_dims': '[512, 256]', 'dropout': 0.11897422969103291, 'batch_norm': True, 'lr': 0.0004794449038021352, 'weight_decay': 5.731408703621419e-06, 'epochs': 172, 'loss': 'mse', 'optimizer': 'adam', 'graph_mode': 'off', 'use_snp_selection': True, 'num_snps': 41509}. Best is trial 61 with value: 0.06672729345569342.
[I 2025-12-05 14:54:04,444] Trial 106 finished with value: 0.03159812929614839 and parameters: {'model_type': 'mlp', 'hidden_dims': '[512, 256]', 'dropout': 0.11869964481833124, 'batch_norm': False, 'lr': 0.00047331510200056504, 'weight_decay': 5.41555759364998e-06, 'epochs': 172, 'loss': 'mse', 'optimizer': 'adam', 'graph_mode': 'off', 'use_snp_selection': True, 'num_snps': 41940}. Best is trial 61 with value: 0.06672729345569342.
[I 2025-12-05 14:54:07,269] Trial 107 finished with value: 0.036644045657304974 and parameters: {'model_type': 'mlp', 'hidden_dims': '[512, 64]', 'dropout': 0.13041929677465589, 'batch_norm': True, 'lr': 0.0005538391712124999, 'weight_decay': 4.216692681205232e-06, 'epochs': 189, 'loss': 'mse', 'optimizer': 'adam', 'graph_mode': 'off', 'use_snp_selection': True, 'num_snps': 46234}. Best is trial 61 with value: 0.06672729345569342.
[I 2025-12-05 14:54:09,144] Trial 108 finished with value: 0.026336897968959178 and parameters: {'model_type': 'mlp', 'hidden_dims': '[512, 256]', 'dropout': 0.14335498042816663, 'batch_norm': True, 'lr': 0.00036461425287776146, 'weight_decay': 6.55828407487433e-06, 'epochs': 177, 'loss': 'mse', 'optimizer': 'adam', 'graph_mode': 'off', 'use_snp_selection': True, 'num_snps': 25492}. Best is trial 61 with value: 0.06672729345569342.
[I 2025-12-05 14:54:11,298] Trial 109 finished with value: 0.03409985165683932 and parameters: {'model_type': 'mlp', 'hidden_dims': '[256, 128]', 'dropout': 0.11199626509184518, 'batch_norm': True, 'lr': 0.0004768246949593616, 'weight_decay': 1.0861358519489919e-05, 'epochs': 168, 'loss': 'mae', 'optimizer': 'adam', 'graph_mode': 'off', 'use_snp_selection': True, 'num_snps': 41102}. Best is trial 61 with value: 0.06672729345569342.
[I 2025-12-05 14:54:13,487] Trial 110 finished with value: 0.04594219800007539 and parameters: {'model_type': 'mlp', 'hidden_dims': '[512, 256]', 'dropout': 0.19117059672015563, 'batch_norm': True, 'lr': 0.0006154209544695505, 'weight_decay': 3.1359742114952905e-06, 'epochs': 159, 'loss': 'mse', 'optimizer': 'adam', 'graph_mode': 'off', 'use_snp_selection': True, 'num_snps': 36375}. Best is trial 61 with value: 0.06672729345569342.
[I 2025-12-05 14:54:15,392] Trial 111 finished with value: 0.0457131830351861 and parameters: {'model_type': 'mlp', 'hidden_dims': '[512, 256]', 'dropout': 0.18724052972753671, 'batch_norm': True, 'lr': 0.0006254368940556472, 'weight_decay': 3.4035497853383174e-06, 'epochs': 159, 'loss': 'mse', 'optimizer': 'adam', 'graph_mode': 'off', 'use_snp_selection': True, 'num_snps': 31308}. Best is trial 61 with value: 0.06672729345569342.
[I 2025-12-05 14:54:17,582] Trial 112 finished with value: 0.04091306023063207 and parameters: {'model_type': 'mlp', 'hidden_dims': '[512, 256]', 'dropout': 0.12536574990415292, 'batch_norm': True, 'lr': 0.0007621928932027585, 'weight_decay': 1.6736473077813582e-06, 'epochs': 184, 'loss': 'mse', 'optimizer': 'adam', 'graph_mode': 'off', 'use_snp_selection': True, 'num_snps': 36405}. Best is trial 61 with value: 0.06672729345569342.
[I 2025-12-05 14:54:20,243] Trial 113 finished with value: 0.04110487158989397 and parameters: {'model_type': 'mlp', 'hidden_dims': '[512, 256]', 'dropout': 0.19689089071220528, 'batch_norm': True, 'lr': 0.0008696329915479401, 'weight_decay': 3.009563601611956e-06, 'epochs': 147, 'loss': 'mse', 'optimizer': 'adam', 'graph_mode': 'off', 'use_snp_selection': True, 'num_snps': 43751}. Best is trial 61 with value: 0.06672729345569342.
[I 2025-12-05 14:54:23,085] Trial 114 finished with value: 0.04126392802474321 and parameters: {'model_type': 'mlp', 'hidden_dims': '[512, 256]', 'dropout': 0.1433356884272987, 'batch_norm': True, 'lr': 0.0006143448840895934, 'weight_decay': 4.353157605729131e-06, 'epochs': 193, 'loss': 'mse', 'optimizer': 'adam', 'graph_mode': 'off', 'use_snp_selection': True, 'num_snps': 47768}. Best is trial 61 with value: 0.06672729345569342.
[I 2025-12-05 14:54:24,861] Trial 115 finished with value: -0.016729506538970096 and parameters: {'model_type': 'mlp', 'hidden_dims': '[128, 64]', 'dropout': 0.1106084731342977, 'batch_norm': True, 'lr': 1.5511907848478318e-06, 'weight_decay': 5.388942049183178e-06, 'epochs': 173, 'loss': 'mse', 'optimizer': 'adam', 'graph_mode': 'off', 'use_snp_selection': True, 'num_snps': 33334}. Best is trial 61 with value: 0.06672729345569342.
[I 2025-12-05 14:54:26,529] Trial 116 finished with value: 0.038206210549939716 and parameters: {'model_type': 'mlp', 'hidden_dims': '[512, 256]', 'dropout': 0.13619249193166222, 'batch_norm': True, 'lr': 0.00041624322149256935, 'weight_decay': 6.730615360364603e-06, 'epochs': 207, 'loss': 'mse', 'optimizer': 'adam', 'graph_mode': 'off', 'use_snp_selection': True, 'num_snps': 23433}. Best is trial 61 with value: 0.06672729345569342.
[I 2025-12-05 14:54:28,242] Trial 117 finished with value: 0.04808354869123044 and parameters: {'model_type': 'mlp', 'hidden_dims': '[512, 256]', 'dropout': 0.16512315896211166, 'batch_norm': True, 'lr': 0.0005076636955263563, 'weight_decay': 3.537369292480159e-06, 'epochs': 133, 'loss': 'mse', 'optimizer': 'adam', 'graph_mode': 'off', 'use_snp_selection': True, 'num_snps': 27968}. Best is trial 61 with value: 0.06672729345569342.
[I 2025-12-05 14:54:29,919] Trial 118 finished with value: 0.022105849410992653 and parameters: {'model_type': 'mlp', 'hidden_dims': '[256, 128]', 'dropout': 0.2093385615103899, 'batch_norm': True, 'lr': 1.0432616005038638e-06, 'weight_decay': 2.189131436392102e-06, 'epochs': 118, 'loss': 'mse', 'optimizer': 'adam', 'graph_mode': 'off', 'use_snp_selection': True, 'num_snps': 27690}. Best is trial 61 with value: 0.06672729345569342.
[I 2025-12-05 14:54:31,721] Trial 119 finished with value: 0.028817294123180553 and parameters: {'model_type': 'mlp', 'hidden_dims': '[256, 128, 64]', 'dropout': 0.15623555730801714, 'batch_norm': True, 'lr': 0.00027219889636796653, 'weight_decay': 0.0005725712275417277, 'epochs': 131, 'loss': 'mse', 'optimizer': 'adam', 'graph_mode': 'off', 'use_snp_selection': True, 'num_snps': 29804}. Best is trial 61 with value: 0.06672729345569342.
[I 2025-12-05 14:54:34,102] Trial 120 finished with value: 0.012948286516794047 and parameters: {'model_type': 'mlp', 'hidden_dims': '[512, 256]', 'dropout': 0.16607163429512217, 'batch_norm': False, 'lr': 0.0005098035797526829, 'weight_decay': 3.982793493293495e-06, 'epochs': 135, 'loss': 'mae', 'optimizer': 'adam', 'graph_mode': 'off', 'use_snp_selection': True, 'num_snps': 42699}. Best is trial 61 with value: 0.06672729345569342.
[I 2025-12-05 14:54:36,437] Trial 121 finished with value: 0.044498718264453015 and parameters: {'model_type': 'mlp', 'hidden_dims': '[512, 256]', 'dropout': 0.11945775288682371, 'batch_norm': True, 'lr': 0.0006941113991187067, 'weight_decay': 3.426403703536847e-06, 'epochs': 157, 'loss': 'mse', 'optimizer': 'adam', 'graph_mode': 'off', 'use_snp_selection': True, 'num_snps': 39960}. Best is trial 61 with value: 0.06672729345569342.
[I 2025-12-05 14:54:38,558] Trial 122 finished with value: 0.04486806431424929 and parameters: {'model_type': 'mlp', 'hidden_dims': '[512, 256]', 'dropout': 0.12820429277564235, 'batch_norm': True, 'lr': 0.000367502001166203, 'weight_decay': 2.813886827998064e-06, 'epochs': 164, 'loss': 'mse', 'optimizer': 'adam', 'graph_mode': 'off', 'use_snp_selection': True, 'num_snps': 36134}. Best is trial 61 with value: 0.06672729345569342.
[I 2025-12-05 14:54:40,631] Trial 123 finished with value: 0.041157259297805275 and parameters: {'model_type': 'mlp', 'hidden_dims': '[512, 256]', 'dropout': 0.10113405327802992, 'batch_norm': True, 'lr': 0.0009767523906013746, 'weight_decay': 5.3781004727301376e-06, 'epochs': 153, 'loss': 'mse', 'optimizer': 'adam', 'graph_mode': 'off', 'use_snp_selection': True, 'num_snps': 33661}. Best is trial 61 with value: 0.06672729345569342.
