[I 2025-12-06 00:20:01,382] Trial 74 finished with value: 0.20525674159538748 and parameters: {'model_type': 'mlp', 'hidden_dims': '[512, 256]', 'dropout': 0.3476543851704644, 'batch_norm': False, 'lr': 3.6841808950139596e-06, 'weight_decay': 0.0001527327855165715, 'epochs': 345, 'loss': 'mae', 'optimizer': 'adam', 'graph_mode': 'off', 'use_snp_selection': True, 'num_snps': 29248}. Best is trial 67 with value: 0.23432816000254308.
[I 2025-12-06 00:21:47,834] Trial 75 finished with value: 0.2119923335902229 and parameters: {'model_type': 'mlp', 'hidden_dims': '[512, 256]', 'dropout': 0.39638473812913805, 'batch_norm': False, 'lr': 1.137151655605806e-06, 'weight_decay': 4.7458264874369405e-05, 'epochs': 305, 'loss': 'mae', 'optimizer': 'adam', 'graph_mode': 'off', 'use_snp_selection': True, 'num_snps': 53379}. Best is trial 67 with value: 0.23432816000254308.
[I 2025-12-06 00:22:46,113] Trial 76 finished with value: 0.20114575917990388 and parameters: {'model_type': 'mlp', 'hidden_dims': '[256, 128]', 'dropout': 0.43793586464480416, 'batch_norm': False, 'lr': 2.838676202978267e-06, 'weight_decay': 0.00012350355060043798, 'epochs': 331, 'loss': 'mae', 'optimizer': 'adam', 'graph_mode': 'off', 'use_snp_selection': True, 'num_snps': 33055}. Best is trial 67 with value: 0.23432816000254308.
[I 2025-12-06 00:23:51,920] Trial 77 finished with value: 0.21610443786863015 and parameters: {'model_type': 'mlp', 'hidden_dims': '[512, 256]', 'dropout': 0.41659526185920803, 'batch_norm': True, 'lr': 1.4983888197805145e-06, 'weight_decay': 8.996586833454606e-06, 'epochs': 320, 'loss': 'mae', 'optimizer': 'adam', 'graph_mode': 'off', 'use_snp_selection': True, 'num_snps': 24765}. Best is trial 67 with value: 0.23432816000254308.
[I 2025-12-06 00:24:32,729] Trial 78 finished with value: 0.20862260182871 and parameters: {'model_type': 'mlp', 'hidden_dims': '[128, 64]', 'dropout': 0.38249899760562456, 'batch_norm': False, 'lr': 2.151474464072776e-06, 'weight_decay': 2.8251679531118523e-05, 'epochs': 298, 'loss': 'mae', 'optimizer': 'adam', 'graph_mode': 'off', 'use_snp_selection': True, 'num_snps': 21945}. Best is trial 67 with value: 0.23432816000254308.
[I 2025-12-06 00:25:39,550] Trial 79 finished with value: 0.21588442977382116 and parameters: {'model_type': 'mlp', 'hidden_dims': '[512, 128]', 'dropout': 0.36611141913536227, 'batch_norm': False, 'lr': 4.106052187009886e-06, 'weight_decay': 3.068028856582949e-05, 'epochs': 311, 'loss': 'mae', 'optimizer': 'adam', 'graph_mode': 'off', 'use_snp_selection': True, 'num_snps': 25996}. Best is trial 67 with value: 0.23432816000254308.
[I 2025-12-06 00:26:37,330] Trial 80 finished with value: 0.21528443703519007 and parameters: {'model_type': 'mlp', 'hidden_dims': '[512, 256]', 'dropout': 0.31494611821147944, 'batch_norm': False, 'lr': 1.3058793506920053e-06, 'weight_decay': 6.584881129591868e-05, 'epochs': 345, 'loss': 'mse', 'optimizer': 'adam', 'graph_mode': 'off', 'use_snp_selection': True, 'num_snps': 18693}. Best is trial 67 with value: 0.23432816000254308.
[I 2025-12-06 00:27:24,746] Trial 81 finished with value: 0.2105912463618939 and parameters: {'model_type': 'mlp', 'hidden_dims': '[512, 128]', 'dropout': 0.18343483152805126, 'batch_norm': False, 'lr': 3.2141531659673048e-06, 'weight_decay': 3.6864708914489894e-05, 'epochs': 252, 'loss': 'mae', 'optimizer': 'adam', 'graph_mode': 'off', 'use_snp_selection': True, 'num_snps': 15620}. Best is trial 67 with value: 0.23432816000254308.
[I 2025-12-06 00:28:23,503] Trial 82 finished with value: 0.20673901209772794 and parameters: {'model_type': 'mlp', 'hidden_dims': '[512, 128]', 'dropout': 0.4060630224790227, 'batch_norm': False, 'lr': 6.403520221057021e-06, 'weight_decay': 2.237641076473037e-05, 'epochs': 332, 'loss': 'mae', 'optimizer': 'adam', 'graph_mode': 'off', 'use_snp_selection': True, 'num_snps': 20124}. Best is trial 67 with value: 0.23432816000254308.
[I 2025-12-06 00:29:01,487] Trial 83 finished with value: 0.19918344717807304 and parameters: {'model_type': 'mlp', 'hidden_dims': '[256, 128, 64]', 'dropout': 0.45889037608379973, 'batch_norm': False, 'lr': 1.8746691312517259e-06, 'weight_decay': 4.5044527255336435e-05, 'epochs': 294, 'loss': 'mae', 'optimizer': 'adam', 'graph_mode': 'off', 'use_snp_selection': True, 'num_snps': 12065}. Best is trial 67 with value: 0.23432816000254308.
[I 2025-12-06 00:30:06,144] Trial 84 finished with value: 0.2214433399226409 and parameters: {'model_type': 'mlp', 'hidden_dims': '[512, 128]', 'dropout': 0.4824037703681712, 'batch_norm': False, 'lr': 4.755463424369881e-06, 'weight_decay': 1.5144057136644236e-05, 'epochs': 265, 'loss': 'mae', 'optimizer': 'adam', 'graph_mode': 'off', 'use_snp_selection': True, 'num_snps': 28450}. Best is trial 67 with value: 0.23432816000254308.
[I 2025-12-06 00:31:02,665] Trial 85 finished with value: 0.21333839248726197 and parameters: {'model_type': 'mlp', 'hidden_dims': '[512, 128]', 'dropout': 0.4898241741105892, 'batch_norm': False, 'lr': 0.0003254379221639787, 'weight_decay': 1.4314559900925591e-05, 'epochs': 193, 'loss': 'mae', 'optimizer': 'adam', 'graph_mode': 'off', 'use_snp_selection': True, 'num_snps': 28786}. Best is trial 67 with value: 0.23432816000254308.
[I 2025-12-06 00:32:00,099] Trial 86 finished with value: 0.2118586708682802 and parameters: {'model_type': 'mlp', 'hidden_dims': '[512, 128]', 'dropout': 0.3996366495792379, 'batch_norm': False, 'lr': 8.649821924748231e-06, 'weight_decay': 6.074501393869586e-06, 'epochs': 260, 'loss': 'mae', 'optimizer': 'adam', 'graph_mode': 'off', 'use_snp_selection': True, 'num_snps': 23513}. Best is trial 67 with value: 0.23432816000254308.
[I 2025-12-06 00:33:12,662] Trial 87 finished with value: 0.22370015694358364 and parameters: {'model_type': 'mlp', 'hidden_dims': '[512, 128]', 'dropout': 0.33956075766098703, 'batch_norm': False, 'lr': 2.5635697756039896e-06, 'weight_decay': 5.8799167734683176e-05, 'epochs': 269, 'loss': 'mae', 'optimizer': 'adam', 'graph_mode': 'off', 'use_snp_selection': True, 'num_snps': 33420}. Best is trial 67 with value: 0.23432816000254308.
[I 2025-12-06 00:34:25,559] Trial 88 finished with value: 0.2207067262859063 and parameters: {'model_type': 'mlp', 'hidden_dims': '[512, 128]', 'dropout': 0.431946721357496, 'batch_norm': False, 'lr': 4.8148719187719065e-06, 'weight_decay': 1.0998280107133874e-05, 'epochs': 275, 'loss': 'mae', 'optimizer': 'adam', 'graph_mode': 'off', 'use_snp_selection': True, 'num_snps': 33000}. Best is trial 67 with value: 0.23432816000254308.
[I 2025-12-06 00:35:28,162] Trial 89 finished with value: 0.220099429739086 and parameters: {'model_type': 'mlp', 'hidden_dims': '[512, 128]', 'dropout': 0.33122391035932647, 'batch_norm': False, 'lr': 2.5720444976816443e-06, 'weight_decay': 4.041403322490592e-06, 'epochs': 266, 'loss': 'mae', 'optimizer': 'adam', 'graph_mode': 'off', 'use_snp_selection': True, 'num_snps': 26759}. Best is trial 67 with value: 0.23432816000254308.
[I 2025-12-06 00:36:48,414] Trial 90 finished with value: 0.1839685967045959 and parameters: {'model_type': 'mlp', 'hidden_dims': '[512, 128]', 'dropout': 0.3830983081841337, 'batch_norm': True, 'lr': 3.715894596423451e-06, 'weight_decay': 0.00019180076079353242, 'epochs': 285, 'loss': 'mae', 'optimizer': 'adam', 'graph_mode': 'off', 'use_snp_selection': False}. Best is trial 67 with value: 0.23432816000254308.
[I 2025-12-06 00:37:53,644] Trial 91 finished with value: 0.20466084674952997 and parameters: {'model_type': 'mlp', 'hidden_dims': '[512, 128]', 'dropout': 0.3490929602403323, 'batch_norm': False, 'lr': 1.6441490967071002e-06, 'weight_decay': 1.7592054537691465e-05, 'epochs': 343, 'loss': 'mae', 'optimizer': 'adam', 'graph_mode': 'off', 'use_snp_selection': True, 'num_snps': 23029}. Best is trial 67 with value: 0.23432816000254308.
[I 2025-12-06 00:39:29,327] Trial 92 finished with value: 0.20171289942403597 and parameters: {'model_type': 'mlp', 'hidden_dims': '[512, 128]', 'dropout': 0.424855095295727, 'batch_norm': False, 'lr': 2.2798666989215956e-06, 'weight_decay': 8.918341404875655e-05, 'epochs': 306, 'loss': 'mae', 'optimizer': 'adam', 'graph_mode': 'off', 'use_snp_selection': True, 'num_snps': 45920}. Best is trial 67 with value: 0.23432816000254308.
[I 2025-12-06 00:40:23,945] Trial 93 finished with value: 0.21395819571953956 and parameters: {'model_type': 'mlp', 'hidden_dims': '[256, 128]', 'dropout': 0.2939549178802723, 'batch_norm': False, 'lr': 3.1261092528380164e-06, 'weight_decay': 6.066322300515481e-05, 'epochs': 322, 'loss': 'mae', 'optimizer': 'adam', 'graph_mode': 'off', 'use_snp_selection': True, 'num_snps': 28908}. Best is trial 67 with value: 0.23432816000254308.
[I 2025-12-06 00:41:31,195] Trial 94 finished with value: 0.21775579309096296 and parameters: {'model_type': 'mlp', 'hidden_dims': '[512, 64]', 'dropout': 0.5300432171185954, 'batch_norm': False, 'lr': 2.061840314398385e-06, 'weight_decay': 7.528383798849717e-06, 'epochs': 334, 'loss': 'mae', 'optimizer': 'adam', 'graph_mode': 'off', 'use_snp_selection': True, 'num_snps': 25500}. Best is trial 67 with value: 0.23432816000254308.
[I 2025-12-06 00:43:29,260] Trial 95 finished with value: 0.22576841850826807 and parameters: {'model_type': 'mlp', 'hidden_dims': '[512, 128]', 'dropout': 0.36066408137617656, 'batch_norm': False, 'lr': 1.1899689805956488e-06, 'weight_decay': 7.180858423270957e-05, 'epochs': 350, 'loss': 'mae', 'optimizer': 'adam', 'graph_mode': 'off', 'use_snp_selection': True, 'num_snps': 55288}. Best is trial 67 with value: 0.23432816000254308.
[I 2025-12-06 00:44:29,994] Trial 96 finished with value: 0.21910689144614043 and parameters: {'model_type': 'mlp', 'hidden_dims': '[512, 128]', 'dropout': 0.3893553345988015, 'batch_norm': False, 'lr': 1.1054929394706288e-06, 'weight_decay': 0.00011428451253471346, 'epochs': 325, 'loss': 'mae', 'optimizer': 'adam', 'graph_mode': 'off', 'use_snp_selection': True, 'num_snps': 21305}. Best is trial 67 with value: 0.23432816000254308.
[I 2025-12-06 00:45:37,361] Trial 97 finished with value: 0.2169910405237851 and parameters: {'model_type': 'mlp', 'hidden_dims': '[512, 128]', 'dropout': 0.3643251379446342, 'batch_norm': False, 'lr': 1.2767430156846079e-06, 'weight_decay': 2.335448751915272e-05, 'epochs': 245, 'loss': 'mae', 'optimizer': 'adam', 'graph_mode': 'off', 'use_snp_selection': True, 'num_snps': 32225}. Best is trial 67 with value: 0.23432816000254308.
[I 2025-12-06 00:46:52,300] Trial 98 finished with value: 0.2145373071396902 and parameters: {'model_type': 'mlp', 'hidden_dims': '[512, 128]', 'dropout': 0.45209171066248577, 'batch_norm': False, 'lr': 1.5644730782627329e-06, 'weight_decay': 3.1710971906548785e-05, 'epochs': 266, 'loss': 'mae', 'optimizer': 'adam', 'graph_mode': 'off', 'use_snp_selection': False}. Best is trial 67 with value: 0.23432816000254308.
[I 2025-12-06 00:48:33,459] Trial 99 finished with value: 0.2156248217689484 and parameters: {'model_type': 'mlp', 'hidden_dims': '[512, 128]', 'dropout': 0.3740924442148422, 'batch_norm': False, 'lr': 2.749332259086627e-06, 'weight_decay': 7.317598015836279e-05, 'epochs': 256, 'loss': 'mse', 'optimizer': 'adam', 'graph_mode': 'off', 'use_snp_selection': True, 'num_snps': 56595}. Best is trial 67 with value: 0.23432816000254308.
[I 2025-12-06 00:50:32,487] Trial 100 finished with value: 0.20082238116890733 and parameters: {'model_type': 'mlp', 'hidden_dims': '[512, 128]', 'dropout': 0.41722410294869333, 'batch_norm': False, 'lr': 1.734484911079423e-05, 'weight_decay': 1.2904635858830846e-05, 'epochs': 316, 'loss': 'mae', 'optimizer': 'adam', 'graph_mode': 'off', 'use_snp_selection': True, 'num_snps': 59947}. Best is trial 67 with value: 0.23432816000254308.
[I 2025-12-06 00:51:33,520] Trial 101 finished with value: 0.19345242143173785 and parameters: {'model_type': 'mlp', 'hidden_dims': '[128, 64]', 'dropout': 0.34254370519432326, 'batch_norm': False, 'lr': 1.8519881903847445e-06, 'weight_decay': 5.659782426817279e-05, 'epochs': 342, 'loss': 'mae', 'optimizer': 'adam', 'graph_mode': 'off', 'use_snp_selection': True, 'num_snps': 51412}. Best is trial 67 with value: 0.23432816000254308.
[I 2025-12-06 00:53:27,206] Trial 102 finished with value: 0.20424890611600163 and parameters: {'model_type': 'mlp', 'hidden_dims': '[512, 128]', 'dropout': 0.3572277939458878, 'batch_norm': False, 'lr': 2.4846840737918902e-05, 'weight_decay': 4.216038859034684e-05, 'epochs': 350, 'loss': 'mae', 'optimizer': 'adam', 'graph_mode': 'off', 'use_snp_selection': True, 'num_snps': 52645}. Best is trial 67 with value: 0.23432816000254308.
[I 2025-12-06 00:55:25,793] Trial 103 finished with value: 0.20758101540897544 and parameters: {'model_type': 'mlp', 'hidden_dims': '[512, 128]', 'dropout': 0.33066836838165214, 'batch_norm': False, 'lr': 2.315361891030099e-06, 'weight_decay': 7.856431374714381e-05, 'epochs': 337, 'loss': 'mae', 'optimizer': 'adam', 'graph_mode': 'off', 'use_snp_selection': True, 'num_snps': 56371}. Best is trial 67 with value: 0.23432816000254308.
[I 2025-12-06 00:56:25,085] Trial 104 finished with value: 0.2194809111957531 and parameters: {'model_type': 'mlp', 'hidden_dims': '[512, 64]', 'dropout': 0.31794218026411847, 'batch_norm': False, 'lr': 1.4056404706747094e-06, 'weight_decay': 5.49257156664899e-05, 'epochs': 231, 'loss': 'mae', 'optimizer': 'adam', 'graph_mode': 'off', 'use_snp_selection': True, 'num_snps': 27472}. Best is trial 67 with value: 0.23432816000254308.
[I 2025-12-06 00:57:37,948] Trial 105 finished with value: 0.210415151869014 and parameters: {'model_type': 'mlp', 'hidden_dims': '[256, 128, 64]', 'dropout': 0.39973390242377177, 'batch_norm': False, 'lr': 3.2954687216318836e-06, 'weight_decay': 1.6891327009608873e-05, 'epochs': 326, 'loss': 'mae', 'optimizer': 'adam', 'graph_mode': 'off', 'use_snp_selection': True, 'num_snps': 48295}. Best is trial 67 with value: 0.23432816000254308.
[I 2025-12-06 00:58:53,722] Trial 106 finished with value: 0.2105956801916089 and parameters: {'model_type': 'mlp', 'hidden_dims': '[512, 256]', 'dropout': 0.37791076539489254, 'batch_norm': False, 'lr': 4.22057265864199e-06, 'weight_decay': 2.5467549026631123e-05, 'epochs': 344, 'loss': 'mae', 'optimizer': 'adam', 'graph_mode': 'off', 'use_snp_selection': True, 'num_snps': 29749}. Best is trial 67 with value: 0.23432816000254308.
[I 2025-12-06 01:00:12,053] Trial 107 finished with value: 0.19390944129320142 and parameters: {'model_type': 'mlp', 'hidden_dims': '[512, 128]', 'dropout': 0.4348888849254647, 'batch_norm': False, 'lr': 1.123903937790048e-06, 'weight_decay': 0.0001010721489191446, 'epochs': 280, 'loss': 'mae', 'optimizer': 'adam', 'graph_mode': 'off', 'use_snp_selection': False}. Best is trial 67 with value: 0.23432816000254308.
[I 2025-12-06 01:01:37,201] Trial 108 finished with value: 0.21431326184588356 and parameters: {'model_type': 'mlp', 'hidden_dims': '[512, 128]', 'dropout': 0.4835176245558933, 'batch_norm': False, 'lr': 2.028037686346311e-06, 'weight_decay': 2.0948841836346778e-07, 'epochs': 310, 'loss': 'mae', 'optimizer': 'adam', 'graph_mode': 'off', 'use_snp_selection': True, 'num_snps': 38619}. Best is trial 67 with value: 0.23432816000254308.
[I 2025-12-06 01:02:34,084] Trial 109 finished with value: 0.1856084206195717 and parameters: {'model_type': 'mlp', 'hidden_dims': '[512, 256]', 'dropout': 0.501724782917576, 'batch_norm': True, 'lr': 2.417810915277587e-06, 'weight_decay': 0.0001323137374142605, 'epochs': 332, 'loss': 'mae', 'optimizer': 'adam', 'graph_mode': 'off', 'use_snp_selection': True, 'num_snps': 18910}. Best is trial 67 with value: 0.23432816000254308.
[I 2025-12-06 01:03:34,747] Trial 110 finished with value: 0.20148086992907 and parameters: {'model_type': 'mlp', 'hidden_dims': '[512, 128]', 'dropout': 0.5844467644116246, 'batch_norm': False, 'lr': 1.6612731671694168e-06, 'weight_decay': 3.395045057594481e-05, 'epochs': 298, 'loss': 'mae', 'optimizer': 'adam', 'graph_mode': 'off', 'use_snp_selection': True, 'num_snps': 23723}. Best is trial 67 with value: 0.23432816000254308.
[I 2025-12-06 01:04:46,958] Trial 111 finished with value: 0.21280217725441292 and parameters: {'model_type': 'mlp', 'hidden_dims': '[512, 128]', 'dropout': 0.4281988582636317, 'batch_norm': False, 'lr': 4.415436245230892e-06, 'weight_decay': 1.1310520803700015e-05, 'epochs': 273, 'loss': 'mae', 'optimizer': 'adam', 'graph_mode': 'off', 'use_snp_selection': True, 'num_snps': 33858}. Best is trial 67 with value: 0.23432816000254308.
[I 2025-12-06 01:06:13,259] Trial 112 finished with value: 0.2101493308783086 and parameters: {'model_type': 'mlp', 'hidden_dims': '[512, 128]', 'dropout': 0.4103583412052881, 'batch_norm': False, 'lr': 4.761472550894094e-06, 'weight_decay': 8.604625881850156e-06, 'epochs': 350, 'loss': 'mae', 'optimizer': 'adam', 'graph_mode': 'off', 'use_snp_selection': True, 'num_snps': 36221}. Best is trial 67 with value: 0.23432816000254308.
[I 2025-12-06 01:07:24,368] Trial 113 finished with value: 0.2185675054748147 and parameters: {'model_type': 'mlp', 'hidden_dims': '[512, 128]', 'dropout': 0.4443648693346682, 'batch_norm': False, 'lr': 5.248217452141752e-06, 'weight_decay': 5.3833334174781e-06, 'epochs': 289, 'loss': 'mae', 'optimizer': 'adam', 'graph_mode': 'off', 'use_snp_selection': True, 'num_snps': 31411}. Best is trial 67 with value: 0.23432816000254308.
[I 2025-12-06 01:09:04,193] Trial 114 finished with value: 0.2102905407958163 and parameters: {'model_type': 'mlp', 'hidden_dims': '[512, 128]', 'dropout': 0.4721621696136548, 'batch_norm': False, 'lr': 7.537566181628233e-06, 'weight_decay': 1.1388689859260938e-05, 'epochs': 271, 'loss': 'mae', 'optimizer': 'adam', 'graph_mode': 'off', 'use_snp_selection': True, 'num_snps': 54866}. Best is trial 67 with value: 0.23432816000254308.
[I 2025-12-06 01:10:29,053] Trial 115 finished with value: 0.21074991369332324 and parameters: {'model_type': 'mlp', 'hidden_dims': '[512, 64]', 'dropout': 0.3619603379932916, 'batch_norm': False, 'lr': 2.7655548914155927e-06, 'weight_decay': 2.4425840368544485e-06, 'epochs': 279, 'loss': 'mae', 'optimizer': 'adam', 'graph_mode': 'off', 'use_snp_selection': True, 'num_snps': 41726}. Best is trial 67 with value: 0.23432816000254308.
[I 2025-12-06 01:11:38,472] Trial 116 finished with value: 0.20820340821776284 and parameters: {'model_type': 'mlp', 'hidden_dims': '[512, 128]', 'dropout': 0.38945778538016507, 'batch_norm': False, 'lr': 1.0091340228456762e-06, 'weight_decay': 4.3534830350519124e-05, 'epochs': 318, 'loss': 'mae', 'optimizer': 'adam', 'graph_mode': 'off', 'use_snp_selection': True, 'num_snps': 27973}. Best is trial 67 with value: 0.23432816000254308.
[I 2025-12-06 01:12:28,586] Trial 117 finished with value: 0.1986740340335983 and parameters: {'model_type': 'mlp', 'hidden_dims': '[256, 128]', 'dropout': 0.33667055464078866, 'batch_norm': False, 'lr': 3.63239232269428e-06, 'weight_decay': 2.1180284245838093e-05, 'epochs': 337, 'loss': 'mse', 'optimizer': 'adam', 'graph_mode': 'off', 'use_snp_selection': False}. Best is trial 67 with value: 0.23432816000254308.
[I 2025-12-06 01:13:48,503] Trial 118 finished with value: 0.21167487471419086 and parameters: {'model_type': 'mlp', 'hidden_dims': '[512, 256]', 'dropout': 0.3514582802446586, 'batch_norm': False, 'lr': 1.781053651391578e-06, 'weight_decay': 6.620068000433765e-05, 'epochs': 328, 'loss': 'mae', 'optimizer': 'adam', 'graph_mode': 'off', 'use_snp_selection': True, 'num_snps': 33861}. Best is trial 67 with value: 0.23432816000254308.
[I 2025-12-06 01:14:50,960] Trial 119 finished with value: 0.19954248889468712 and parameters: {'model_type': 'mlp', 'hidden_dims': '[512, 128]', 'dropout': 0.4023996109753541, 'batch_norm': False, 'lr': 1.4419369940975687e-06, 'weight_decay': 1.5145052403832572e-05, 'epochs': 301, 'loss': 'mae', 'optimizer': 'adam', 'graph_mode': 'off', 'use_snp_selection': True, 'num_snps': 24595}. Best is trial 67 with value: 0.23432816000254308.
[I 2025-12-06 01:15:31,743] Trial 120 finished with value: 0.18930704512950144 and parameters: {'model_type': 'mlp', 'hidden_dims': '[128, 64]', 'dropout': 0.45512746915310853, 'batch_norm': False, 'lr': 1.23909495130666e-06, 'weight_decay': 6.378913431592364e-06, 'epochs': 340, 'loss': 'mae', 'optimizer': 'adam', 'graph_mode': 'off', 'use_snp_selection': True, 'num_snps': 21594}. Best is trial 67 with value: 0.23432816000254308.
[I 2025-12-06 01:16:33,405] Trial 121 finished with value: 0.22479097856367658 and parameters: {'model_type': 'mlp', 'hidden_dims': '[512, 128]', 'dropout': 0.32591878196710977, 'batch_norm': False, 'lr': 2.8510930492673374e-06, 'weight_decay': 8.247407148387458e-06, 'epochs': 267, 'loss': 'mae', 'optimizer': 'adam', 'graph_mode': 'off', 'use_snp_selection': True, 'num_snps': 26792}. Best is trial 67 with value: 0.23432816000254308.
[I 2025-12-06 01:17:38,819] Trial 122 finished with value: 0.21758406006449293 and parameters: {'model_type': 'mlp', 'hidden_dims': '[512, 128]', 'dropout': 0.29741000923982025, 'batch_norm': False, 'lr': 2.857976620607703e-06, 'weight_decay': 8.89683252449762e-06, 'epochs': 257, 'loss': 'mae', 'optimizer': 'adam', 'graph_mode': 'off', 'use_snp_selection': True, 'num_snps': 30391}. Best is trial 67 with value: 0.23432816000254308.
[I 2025-12-06 01:18:41,493] Trial 123 finished with value: 0.2182567494625472 and parameters: {'model_type': 'mlp', 'hidden_dims': '[512, 128]', 'dropout': 0.27868277256914065, 'batch_norm': False, 'lr': 2.4037106791987133e-06, 'weight_decay': 1.2978817491609467e-05, 'epochs': 270, 'loss': 'mae', 'optimizer': 'adam', 'graph_mode': 'off', 'use_snp_selection': True, 'num_snps': 26971}. Best is trial 67 with value: 0.23432816000254308.
