[I 2025-12-06 06:15:32,934] Trial 85 finished with value: 0.2835689861371232 and parameters: {'model_type': 'mlp', 'hidden_dims': '[256, 128, 64]', 'dropout': 0.3233148833074714, 'batch_norm': False, 'lr': 3.0340435883237186e-05, 'weight_decay': 3.805903364443743e-07, 'epochs': 85, 'loss': 'mae', 'optimizer': 'adam', 'graph_mode': 'off', 'use_snp_selection': False}. Best is trial 61 with value: 0.2973721170442463.
[I 2025-12-06 06:15:56,489] Trial 86 finished with value: 0.27727165843347246 and parameters: {'model_type': 'mlp', 'hidden_dims': '[512, 256]', 'dropout': 0.5095698709730294, 'batch_norm': False, 'lr': 0.00012611394996569998, 'weight_decay': 5.5340799770063796e-05, 'epochs': 62, 'loss': 'mae', 'optimizer': 'adam', 'graph_mode': 'off', 'use_snp_selection': False}. Best is trial 61 with value: 0.2973721170442463.
[I 2025-12-06 06:16:30,016] Trial 87 finished with value: 0.27011161381035453 and parameters: {'model_type': 'mlp', 'hidden_dims': '[512, 256]', 'dropout': 0.5403506133092121, 'batch_norm': False, 'lr': 0.0002950617425115899, 'weight_decay': 0.00037452402222684503, 'epochs': 75, 'loss': 'mae', 'optimizer': 'adam', 'graph_mode': 'off', 'use_snp_selection': True, 'num_snps': 7809}. Best is trial 61 with value: 0.2973721170442463.
[I 2025-12-06 06:17:03,244] Trial 88 finished with value: 0.286447776964725 and parameters: {'model_type': 'mlp', 'hidden_dims': '[512, 256]', 'dropout': 0.4725913793197085, 'batch_norm': True, 'lr': 0.0008487178683513991, 'weight_decay': 7.945574244301354e-05, 'epochs': 96, 'loss': 'mae', 'optimizer': 'adam', 'graph_mode': 'off', 'use_snp_selection': False}. Best is trial 61 with value: 0.2973721170442463.
[I 2025-12-06 06:17:51,029] Trial 89 finished with value: 0.24016611336289834 and parameters: {'model_type': 'mlp', 'hidden_dims': '[512, 64]', 'dropout': 0.4527188275367235, 'batch_norm': False, 'lr': 0.00026807934612920685, 'weight_decay': 0.0002501975081201264, 'epochs': 320, 'loss': 'mae', 'optimizer': 'adam', 'graph_mode': 'off', 'use_snp_selection': True, 'num_snps': 11841}. Best is trial 61 with value: 0.2973721170442463.
[I 2025-12-06 06:18:31,797] Trial 90 finished with value: 0.2637230761466892 and parameters: {'model_type': 'mlp', 'hidden_dims': '[256, 128]', 'dropout': 0.12281632894034583, 'batch_norm': False, 'lr': 8.056046129822769e-05, 'weight_decay': 3.041349219736239e-05, 'epochs': 107, 'loss': 'mae', 'optimizer': 'adam', 'graph_mode': 'off', 'use_snp_selection': True, 'num_snps': 22382}. Best is trial 61 with value: 0.2973721170442463.
[I 2025-12-06 06:18:59,326] Trial 91 finished with value: 0.2782794588406408 and parameters: {'model_type': 'mlp', 'hidden_dims': '[256, 128]', 'dropout': 0.45155252709681715, 'batch_norm': False, 'lr': 7.114211637749324e-05, 'weight_decay': 4.025288940208002e-05, 'epochs': 160, 'loss': 'mae', 'optimizer': 'adam', 'graph_mode': 'off', 'use_snp_selection': False}. Best is trial 61 with value: 0.2973721170442463.
[I 2025-12-06 06:19:32,922] Trial 92 finished with value: 0.2727625913707122 and parameters: {'model_type': 'mlp', 'hidden_dims': '[256, 128]', 'dropout': 0.4367467107569058, 'batch_norm': False, 'lr': 6.271347888821251e-05, 'weight_decay': 3.9962475702254675e-05, 'epochs': 204, 'loss': 'mae', 'optimizer': 'adam', 'graph_mode': 'off', 'use_snp_selection': False}. Best is trial 61 with value: 0.2973721170442463.
[I 2025-12-06 06:19:59,130] Trial 93 finished with value: 0.28932387054777087 and parameters: {'model_type': 'mlp', 'hidden_dims': '[256, 128]', 'dropout': 0.4820688241595985, 'batch_norm': False, 'lr': 5.304779092058593e-05, 'weight_decay': 1.7430421165582126e-05, 'epochs': 148, 'loss': 'mae', 'optimizer': 'adam', 'graph_mode': 'off', 'use_snp_selection': False}. Best is trial 61 with value: 0.2973721170442463.
[I 2025-12-06 06:20:24,407] Trial 94 finished with value: 0.27557919870674347 and parameters: {'model_type': 'mlp', 'hidden_dims': '[256, 128]', 'dropout': 0.4929211579643859, 'batch_norm': False, 'lr': 5.517034339362381e-05, 'weight_decay': 3.6735030869939754e-06, 'epochs': 141, 'loss': 'mae', 'optimizer': 'adam', 'graph_mode': 'off', 'use_snp_selection': False}. Best is trial 61 with value: 0.2973721170442463.
[I 2025-12-06 06:21:01,992] Trial 95 finished with value: 0.2892183922627742 and parameters: {'model_type': 'mlp', 'hidden_dims': '[512, 256]', 'dropout': 0.5280706154689299, 'batch_norm': False, 'lr': 4.224991436313356e-05, 'weight_decay': 1.9738845974178056e-05, 'epochs': 115, 'loss': 'mae', 'optimizer': 'adam', 'graph_mode': 'off', 'use_snp_selection': False}. Best is trial 61 with value: 0.2973721170442463.
[I 2025-12-06 06:21:42,981] Trial 96 finished with value: 0.2831587915178722 and parameters: {'model_type': 'mlp', 'hidden_dims': '[512, 256]', 'dropout': 0.5035882668513204, 'batch_norm': False, 'lr': 4.172717190670689e-05, 'weight_decay': 1.9605895194505878e-05, 'epochs': 128, 'loss': 'mae', 'optimizer': 'adam', 'graph_mode': 'off', 'use_snp_selection': False}. Best is trial 61 with value: 0.2973721170442463.
[I 2025-12-06 06:22:37,249] Trial 97 finished with value: 0.2748856279149335 and parameters: {'model_type': 'mlp', 'hidden_dims': '[512, 256]', 'dropout': 0.5218227945204027, 'batch_norm': False, 'lr': 2.7429076201837227e-05, 'weight_decay': 1.2414842026336358e-05, 'epochs': 119, 'loss': 'mae', 'optimizer': 'adam', 'graph_mode': 'off', 'use_snp_selection': True, 'num_snps': 31118}. Best is trial 61 with value: 0.2973721170442463.
[I 2025-12-06 06:22:58,938] Trial 98 finished with value: 0.2875147901316105 and parameters: {'model_type': 'mlp', 'hidden_dims': '[512, 256]', 'dropout': 0.4797956189744326, 'batch_norm': False, 'lr': 4.7568969917828e-05, 'weight_decay': 9.968050573535238e-06, 'epochs': 55, 'loss': 'mse', 'optimizer': 'adam', 'graph_mode': 'off', 'use_snp_selection': False}. Best is trial 61 with value: 0.2973721170442463.
[I 2025-12-06 06:23:39,157] Trial 99 finished with value: 0.28609885336769114 and parameters: {'model_type': 'mlp', 'hidden_dims': '[512, 256]', 'dropout': 0.4636072933831611, 'batch_norm': False, 'lr': 2.14123531489622e-05, 'weight_decay': 8.379345217182456e-06, 'epochs': 67, 'loss': 'mae', 'optimizer': 'adam', 'graph_mode': 'off', 'use_snp_selection': True, 'num_snps': 18547}. Best is trial 61 with value: 0.2973721170442463.
[I 2025-12-06 06:23:58,505] Trial 100 finished with value: 0.27961842262475906 and parameters: {'model_type': 'mlp', 'hidden_dims': '[512, 256]', 'dropout': 0.37407017027293954, 'batch_norm': False, 'lr': 3.2943734021002156e-05, 'weight_decay': 2.2981160690179854e-05, 'epochs': 46, 'loss': 'mae', 'optimizer': 'adam', 'graph_mode': 'off', 'use_snp_selection': False}. Best is trial 61 with value: 0.2973721170442463.
[I 2025-12-06 06:24:19,524] Trial 101 finished with value: 0.13464517069227483 and parameters: {'model_type': 'mlp', 'hidden_dims': '[256, 128]', 'dropout': 0.532212271888753, 'batch_norm': False, 'lr': 0.0004241976007427461, 'weight_decay': 1.5388399034119348e-05, 'epochs': 111, 'loss': 'mae', 'optimizer': 'adam', 'graph_mode': 'off', 'use_snp_selection': False}. Best is trial 61 with value: 0.2973721170442463.
[I 2025-12-06 06:24:33,980] Trial 102 finished with value: 0.06023561269857856 and parameters: {'model_type': 'mlp', 'hidden_dims': '[128, 64]', 'dropout': 0.5140551199671946, 'batch_norm': False, 'lr': 0.0005317177304033944, 'weight_decay': 5.809522009639922e-05, 'epochs': 129, 'loss': 'mae', 'optimizer': 'adam', 'graph_mode': 'off', 'use_snp_selection': False}. Best is trial 61 with value: 0.2973721170442463.
[I 2025-12-06 06:25:11,739] Trial 103 finished with value: 0.2626168827484031 and parameters: {'model_type': 'mlp', 'hidden_dims': '[512, 256]', 'dropout': 0.551952735482626, 'batch_norm': False, 'lr': 0.00021903014509301453, 'weight_decay': 5.889874613297482e-06, 'epochs': 117, 'loss': 'mae', 'optimizer': 'adam', 'graph_mode': 'off', 'use_snp_selection': False}. Best is trial 61 with value: 0.2973721170442463.
[I 2025-12-06 06:25:45,870] Trial 104 finished with value: 0.2655720573562675 and parameters: {'model_type': 'mlp', 'hidden_dims': '[512, 64]', 'dropout': 0.39992003770502005, 'batch_norm': False, 'lr': 0.0001777932886327445, 'weight_decay': 2.8419760321040763e-05, 'epochs': 102, 'loss': 'mae', 'optimizer': 'adam', 'graph_mode': 'off', 'use_snp_selection': False}. Best is trial 61 with value: 0.2973721170442463.
[I 2025-12-06 06:26:35,325] Trial 105 finished with value: 0.2668979694707196 and parameters: {'model_type': 'mlp', 'hidden_dims': '[256, 128]', 'dropout': 0.5740199338998021, 'batch_norm': False, 'lr': 0.0003324487104559346, 'weight_decay': 0.00011814059024741806, 'epochs': 92, 'loss': 'mae', 'optimizer': 'adam', 'graph_mode': 'off', 'use_snp_selection': True, 'num_snps': 40221}. Best is trial 61 with value: 0.2973721170442463.
[I 2025-12-06 06:26:52,880] Trial 106 finished with value: 0.27602664579104946 and parameters: {'model_type': 'mlp', 'hidden_dims': '[256, 128, 64]', 'dropout': 0.4262705235000183, 'batch_norm': True, 'lr': 5.2114185803997096e-05, 'weight_decay': 4.766771723655836e-05, 'epochs': 81, 'loss': 'mae', 'optimizer': 'adam', 'graph_mode': 'off', 'use_snp_selection': False}. Best is trial 61 with value: 0.2973721170442463.
[I 2025-12-06 06:27:54,677] Trial 107 finished with value: 0.2767593381503117 and parameters: {'model_type': 'mlp', 'hidden_dims': '[512, 256]', 'dropout': 0.49480638858715265, 'batch_norm': False, 'lr': 2.3735113577573635e-05, 'weight_decay': 1.925280763967247e-05, 'epochs': 86, 'loss': 'mae', 'optimizer': 'adam', 'graph_mode': 'off', 'use_snp_selection': True, 'num_snps': 47820}. Best is trial 61 with value: 0.2973721170442463.
[I 2025-12-06 06:28:39,572] Trial 108 finished with value: 0.2858334430579279 and parameters: {'model_type': 'mlp', 'hidden_dims': '[512, 128]', 'dropout': 0.5287427802147376, 'batch_norm': False, 'lr': 8.640834354234797e-05, 'weight_decay': 0.0001662261926123249, 'epochs': 145, 'loss': 'mae', 'optimizer': 'adam', 'graph_mode': 'off', 'use_snp_selection': False}. Best is trial 61 with value: 0.2973721170442463.
[I 2025-12-06 06:29:16,826] Trial 109 finished with value: 0.2533207061654106 and parameters: {'model_type': 'mlp', 'hidden_dims': '[256, 128]', 'dropout': 0.19223106982900193, 'batch_norm': False, 'lr': 1.8735578256204838e-05, 'weight_decay': 7.630975217492142e-05, 'epochs': 133, 'loss': 'mae', 'optimizer': 'adam', 'graph_mode': 'off', 'use_snp_selection': True, 'num_snps': 13975}. Best is trial 61 with value: 0.2973721170442463.
[I 2025-12-06 06:30:10,695] Trial 110 finished with value: 0.275710946829329 and parameters: {'model_type': 'mlp', 'hidden_dims': '[512, 256]', 'dropout': 0.558963506026642, 'batch_norm': False, 'lr': 1.3189922707450165e-05, 'weight_decay': 0.0001075672228259573, 'epochs': 176, 'loss': 'mae', 'optimizer': 'adam', 'graph_mode': 'off', 'use_snp_selection': False}. Best is trial 61 with value: 0.2973721170442463.
[I 2025-12-06 06:30:41,953] Trial 111 finished with value: 0.2868426099067057 and parameters: {'model_type': 'mlp', 'hidden_dims': '[256, 128]', 'dropout': 0.4474622132449503, 'batch_norm': False, 'lr': 7.168353659982401e-05, 'weight_decay': 2.4566547134530233e-05, 'epochs': 185, 'loss': 'mae', 'optimizer': 'adam', 'graph_mode': 'off', 'use_snp_selection': False}. Best is trial 61 with value: 0.2973721170442463.
[I 2025-12-06 06:31:09,421] Trial 112 finished with value: 0.2725794916108082 and parameters: {'model_type': 'mlp', 'hidden_dims': '[256, 128]', 'dropout': 0.46635870165801935, 'batch_norm': False, 'lr': 6.276052690631222e-05, 'weight_decay': 3.629261182437955e-05, 'epochs': 156, 'loss': 'mae', 'optimizer': 'adam', 'graph_mode': 'off', 'use_snp_selection': False}. Best is trial 61 with value: 0.2973721170442463.
[I 2025-12-06 06:31:29,193] Trial 113 finished with value: 0.2887205800758267 and parameters: {'model_type': 'mlp', 'hidden_dims': '[256, 128]', 'dropout': 0.4408252572632569, 'batch_norm': False, 'lr': 4.1374146889273525e-05, 'weight_decay': 6.107033363893909e-05, 'epochs': 98, 'loss': 'mae', 'optimizer': 'adam', 'graph_mode': 'off', 'use_snp_selection': False}. Best is trial 61 with value: 0.2973721170442463.
[I 2025-12-06 06:31:49,994] Trial 114 finished with value: 0.2826860129255505 and parameters: {'model_type': 'mlp', 'hidden_dims': '[256, 128]', 'dropout': 0.4819110951360415, 'batch_norm': False, 'lr': 3.9911871111078546e-05, 'weight_decay': 6.374305298737668e-05, 'epochs': 106, 'loss': 'mae', 'optimizer': 'adam', 'graph_mode': 'off', 'use_snp_selection': False}. Best is trial 61 with value: 0.2973721170442463.
[I 2025-12-06 06:32:09,613] Trial 115 finished with value: 0.284207689567092 and parameters: {'model_type': 'mlp', 'hidden_dims': '[256, 128]', 'dropout': 0.41268728213263217, 'batch_norm': False, 'lr': 2.8512250077273428e-05, 'weight_decay': 8.795474431020779e-05, 'epochs': 97, 'loss': 'mae', 'optimizer': 'adam', 'graph_mode': 'off', 'use_snp_selection': False}. Best is trial 61 with value: 0.2973721170442463.
[I 2025-12-06 06:32:37,430] Trial 116 finished with value: 0.2827062575121906 and parameters: {'model_type': 'mlp', 'hidden_dims': '[512, 256]', 'dropout': 0.5042127133320741, 'batch_norm': False, 'lr': 3.637292592798773e-05, 'weight_decay': 1.2246774068329028e-05, 'epochs': 77, 'loss': 'mse', 'optimizer': 'adam', 'graph_mode': 'off', 'use_snp_selection': False}. Best is trial 61 with value: 0.2973721170442463.
[I 2025-12-06 06:33:26,593] Trial 117 finished with value: 0.29617321204645985 and parameters: {'model_type': 'mlp', 'hidden_dims': '[512, 64]', 'dropout': 0.5168240413522271, 'batch_norm': False, 'lr': 4.334871904357962e-05, 'weight_decay': 5.327588196190061e-05, 'epochs': 61, 'loss': 'mae', 'optimizer': 'adam', 'graph_mode': 'off', 'use_snp_selection': True, 'num_snps': 34491}. Best is trial 61 with value: 0.2973721170442463.
[I 2025-12-06 06:34:10,923] Trial 118 finished with value: 0.30017865200954125 and parameters: {'model_type': 'mlp', 'hidden_dims': '[256, 128]', 'dropout': 0.5404184455304645, 'batch_norm': False, 'lr': 4.238017447224778e-05, 'weight_decay': 4.883112984897494e-05, 'epochs': 61, 'loss': 'mae', 'optimizer': 'adam', 'graph_mode': 'off', 'use_snp_selection': True, 'num_snps': 33925}. Best is trial 118 with value: 0.30017865200954125.
[I 2025-12-06 06:35:00,151] Trial 119 finished with value: 0.27982611156060533 and parameters: {'model_type': 'mlp', 'hidden_dims': '[512, 64]', 'dropout': 0.5415160576346099, 'batch_norm': False, 'lr': 5.0260755796577345e-05, 'weight_decay': 4.7800178231652815e-05, 'epochs': 62, 'loss': 'mae', 'optimizer': 'adam', 'graph_mode': 'off', 'use_snp_selection': True, 'num_snps': 34505}. Best is trial 118 with value: 0.30017865200954125.
[I 2025-12-06 06:35:50,516] Trial 120 finished with value: 0.24505286703214835 and parameters: {'model_type': 'mlp', 'hidden_dims': '[512, 256]', 'dropout': 0.5191267852456438, 'batch_norm': False, 'lr': 5.0457920335775005e-06, 'weight_decay': 3.099961337591595e-05, 'epochs': 56, 'loss': 'mae', 'optimizer': 'adam', 'graph_mode': 'off', 'use_snp_selection': True, 'num_snps': 37835}. Best is trial 118 with value: 0.30017865200954125.
[I 2025-12-06 06:36:33,388] Trial 121 finished with value: 0.2980194443585535 and parameters: {'model_type': 'mlp', 'hidden_dims': '[256, 128]', 'dropout': 0.4292986326374216, 'batch_norm': False, 'lr': 3.384822127925713e-05, 'weight_decay': 7.502316065505072e-05, 'epochs': 44, 'loss': 'mae', 'optimizer': 'adam', 'graph_mode': 'off', 'use_snp_selection': True, 'num_snps': 33544}. Best is trial 118 with value: 0.30017865200954125.
[I 2025-12-06 06:37:16,190] Trial 122 finished with value: 0.27665364585827745 and parameters: {'model_type': 'mlp', 'hidden_dims': '[256, 128]', 'dropout': 0.5324237856542198, 'batch_norm': False, 'lr': 2.962115268204476e-05, 'weight_decay': 7.331368956852809e-05, 'epochs': 43, 'loss': 'mae', 'optimizer': 'adam', 'graph_mode': 'off', 'use_snp_selection': True, 'num_snps': 33700}. Best is trial 118 with value: 0.30017865200954125.
[I 2025-12-06 06:37:57,870] Trial 123 finished with value: 0.2966232267921282 and parameters: {'model_type': 'mlp', 'hidden_dims': '[256, 128]', 'dropout': 0.4260474953157171, 'batch_norm': False, 'lr': 4.59273546559943e-05, 'weight_decay': 9.977116103153662e-05, 'epochs': 55, 'loss': 'mae', 'optimizer': 'adam', 'graph_mode': 'off', 'use_snp_selection': True, 'num_snps': 29074}. Best is trial 118 with value: 0.30017865200954125.
[I 2025-12-06 06:38:39,581] Trial 124 finished with value: 0.2958932890780056 and parameters: {'model_type': 'mlp', 'hidden_dims': '[256, 128]', 'dropout': 0.4253809451599194, 'batch_norm': False, 'lr': 6.102621759210848e-05, 'weight_decay': 0.0001413600901770739, 'epochs': 55, 'loss': 'mae', 'optimizer': 'adam', 'graph_mode': 'off', 'use_snp_selection': True, 'num_snps': 29495}. Best is trial 118 with value: 0.30017865200954125.
[I 2025-12-06 06:39:22,551] Trial 125 finished with value: 0.30599796733831386 and parameters: {'model_type': 'mlp', 'hidden_dims': '[256, 128]', 'dropout': 0.42567936867260525, 'batch_norm': False, 'lr': 6.009258628042148e-05, 'weight_decay': 0.000143874480291961, 'epochs': 51, 'loss': 'mae', 'optimizer': 'adam', 'graph_mode': 'off', 'use_snp_selection': True, 'num_snps': 32682}. Best is trial 125 with value: 0.30599796733831386.
[I 2025-12-06 06:40:05,581] Trial 126 finished with value: 0.1413499752312321 and parameters: {'model_type': 'mlp', 'hidden_dims': '[256, 128]', 'dropout': 0.4084623227593297, 'batch_norm': False, 'lr': 1.827211707827089e-06, 'weight_decay': 0.000138164144880816, 'epochs': 55, 'loss': 'mae', 'optimizer': 'adam', 'graph_mode': 'off', 'use_snp_selection': True, 'num_snps': 32084}. Best is trial 125 with value: 0.30599796733831386.
[I 2025-12-06 06:40:50,181] Trial 127 finished with value: 0.2504064900050121 and parameters: {'model_type': 'mlp', 'hidden_dims': '[256, 128]', 'dropout': 0.3910442523544032, 'batch_norm': True, 'lr': 6.253872717513235e-05, 'weight_decay': 9.500900565045786e-05, 'epochs': 40, 'loss': 'mae', 'optimizer': 'adam', 'graph_mode': 'off', 'use_snp_selection': True, 'num_snps': 38138}. Best is trial 125 with value: 0.30599796733831386.
[I 2025-12-06 06:41:31,641] Trial 128 finished with value: 0.29690965079688897 and parameters: {'model_type': 'mlp', 'hidden_dims': '[256, 128]', 'dropout': 0.42645575874729197, 'batch_norm': False, 'lr': 3.418445279033153e-05, 'weight_decay': 0.00020028752837391358, 'epochs': 51, 'loss': 'mae', 'optimizer': 'adam', 'graph_mode': 'off', 'use_snp_selection': True, 'num_snps': 29502}. Best is trial 125 with value: 0.30599796733831386.
[I 2025-12-06 06:42:13,347] Trial 129 finished with value: 0.2902233405343878 and parameters: {'model_type': 'mlp', 'hidden_dims': '[256, 128]', 'dropout': 0.427001384183841, 'batch_norm': False, 'lr': 3.4723124538856515e-05, 'weight_decay': 0.00019691356616882637, 'epochs': 51, 'loss': 'mae', 'optimizer': 'adam', 'graph_mode': 'off', 'use_snp_selection': True, 'num_snps': 29625}. Best is trial 125 with value: 0.30599796733831386.
[I 2025-12-06 06:42:56,390] Trial 130 finished with value: 0.2709592002976066 and parameters: {'model_type': 'mlp', 'hidden_dims': '[256, 128]', 'dropout': 0.4184384923675589, 'batch_norm': False, 'lr': 2.472365768803795e-05, 'weight_decay': 0.0001529354730182532, 'epochs': 46, 'loss': 'mae', 'optimizer': 'adam', 'graph_mode': 'off', 'use_snp_selection': True, 'num_snps': 33025}. Best is trial 125 with value: 0.30599796733831386.
[I 2025-12-06 06:43:40,232] Trial 131 finished with value: 0.29443748417990834 and parameters: {'model_type': 'mlp', 'hidden_dims': '[256, 128]', 'dropout': 0.40305664540821046, 'batch_norm': False, 'lr': 4.585568608937248e-05, 'weight_decay': 0.00023540387808292925, 'epochs': 65, 'loss': 'mae', 'optimizer': 'adam', 'graph_mode': 'off', 'use_snp_selection': True, 'num_snps': 32254}. Best is trial 125 with value: 0.30599796733831386.
[I 2025-12-06 06:44:22,675] Trial 132 finished with value: 0.2870132550588798 and parameters: {'model_type': 'mlp', 'hidden_dims': '[256, 128]', 'dropout': 0.39605803937831835, 'batch_norm': False, 'lr': 4.5848826027620814e-05, 'weight_decay': 0.00037843792869661323, 'epochs': 59, 'loss': 'mae', 'optimizer': 'adam', 'graph_mode': 'off', 'use_snp_selection': True, 'num_snps': 30115}. Best is trial 125 with value: 0.30599796733831386.
[I 2025-12-06 06:45:07,975] Trial 133 finished with value: 0.2912746742346792 and parameters: {'model_type': 'mlp', 'hidden_dims': '[256, 128]', 'dropout': 0.43041291321362063, 'batch_norm': False, 'lr': 3.130739092203681e-05, 'weight_decay': 0.00021996721944845897, 'epochs': 71, 'loss': 'mae', 'optimizer': 'adam', 'graph_mode': 'off', 'use_snp_selection': True, 'num_snps': 34436}. Best is trial 125 with value: 0.30599796733831386.
[I 2025-12-06 06:45:49,550] Trial 134 finished with value: 0.27568007625582563 and parameters: {'model_type': 'mlp', 'hidden_dims': '[256, 128]', 'dropout': 0.3757588310751675, 'batch_norm': False, 'lr': 5.823825853975298e-05, 'weight_decay': 0.00026050711926309906, 'epochs': 51, 'loss': 'mae', 'optimizer': 'adam', 'graph_mode': 'off', 'use_snp_selection': True, 'num_snps': 29111}. Best is trial 125 with value: 0.30599796733831386.
[I 2025-12-06 06:46:33,339] Trial 135 finished with value: 0.2875601384403737 and parameters: {'model_type': 'mlp', 'hidden_dims': '[256, 128]', 'dropout': 0.40388783983688803, 'batch_norm': False, 'lr': 4.5756318161079656e-05, 'weight_decay': 0.00017041047790918363, 'epochs': 65, 'loss': 'mae', 'optimizer': 'adam', 'graph_mode': 'off', 'use_snp_selection': True, 'num_snps': 32285}. Best is trial 125 with value: 0.30599796733831386.
