[I 2025-12-06 00:27:11,999] Trial 121 finished with value: 0.26165474174088216 and parameters: {'model_type': 'mlp', 'hidden_dims': '[512, 64]', 'dropout': 0.15061494076790363, 'batch_norm': False, 'lr': 9.106698617285403e-05, 'weight_decay': 9.185573910822969e-07, 'epochs': 55, 'loss': 'mae', 'optimizer': 'adam', 'graph_mode': 'off', 'use_snp_selection': False}. Best is trial 100 with value: 0.2713285310457074.
[I 2025-12-06 00:27:32,894] Trial 122 finished with value: 0.2677278046468626 and parameters: {'model_type': 'mlp', 'hidden_dims': '[512, 64]', 'dropout': 0.12794742109697424, 'batch_norm': False, 'lr': 8.798972360616059e-05, 'weight_decay': 1.5959374779949814e-06, 'epochs': 56, 'loss': 'mae', 'optimizer': 'adam', 'graph_mode': 'off', 'use_snp_selection': False}. Best is trial 100 with value: 0.2713285310457074.
[I 2025-12-06 00:27:57,160] Trial 123 finished with value: 0.25955439159938193 and parameters: {'model_type': 'mlp', 'hidden_dims': '[512, 64]', 'dropout': 0.20805917039129423, 'batch_norm': False, 'lr': 0.00014961409141714456, 'weight_decay': 1.2599646866944463e-06, 'epochs': 70, 'loss': 'mae', 'optimizer': 'adam', 'graph_mode': 'off', 'use_snp_selection': False}. Best is trial 100 with value: 0.2713285310457074.
[I 2025-12-06 00:28:19,687] Trial 124 finished with value: 0.22528357173125055 and parameters: {'model_type': 'mlp', 'hidden_dims': '[512, 64]', 'dropout': 0.125293339374766, 'batch_norm': False, 'lr': 0.00024814730119336815, 'weight_decay': 1.5079148773934255e-06, 'epochs': 63, 'loss': 'mae', 'optimizer': 'adam', 'graph_mode': 'off', 'use_snp_selection': False}. Best is trial 100 with value: 0.2713285310457074.
[I 2025-12-06 00:28:41,062] Trial 125 finished with value: 0.2604405855468844 and parameters: {'model_type': 'mlp', 'hidden_dims': '[512, 64]', 'dropout': 0.10335752048476905, 'batch_norm': False, 'lr': 9.859243857777763e-05, 'weight_decay': 1.9249663587154154e-06, 'epochs': 58, 'loss': 'mae', 'optimizer': 'adam', 'graph_mode': 'off', 'use_snp_selection': False}. Best is trial 100 with value: 0.2713285310457074.
[I 2025-12-06 00:30:11,175] Trial 126 finished with value: 0.2287473631185882 and parameters: {'model_type': 'mlp', 'hidden_dims': '[512, 64]', 'dropout': 0.13682877646854957, 'batch_norm': False, 'lr': 0.00012382253767021745, 'weight_decay': 2.144202170116015e-06, 'epochs': 337, 'loss': 'mae', 'optimizer': 'adam', 'graph_mode': 'off', 'use_snp_selection': False}. Best is trial 100 with value: 0.2713285310457074.
[I 2025-12-06 00:31:21,914] Trial 127 finished with value: 0.22609131212976488 and parameters: {'model_type': 'mlp', 'hidden_dims': '[512, 64]', 'dropout': 0.11418743128315788, 'batch_norm': False, 'lr': 8.080814675690578e-05, 'weight_decay': 1.7488343329513932e-06, 'epochs': 258, 'loss': 'mae', 'optimizer': 'adam', 'graph_mode': 'off', 'use_snp_selection': False}. Best is trial 100 with value: 0.2713285310457074.
[I 2025-12-06 00:31:38,957] Trial 128 finished with value: 0.24319997158376952 and parameters: {'model_type': 'mlp', 'hidden_dims': '[512, 64]', 'dropout': 0.12740825809095468, 'batch_norm': False, 'lr': 4.9602972473484156e-05, 'weight_decay': 2.8938000790506853e-06, 'epochs': 40, 'loss': 'mae', 'optimizer': 'adam', 'graph_mode': 'off', 'use_snp_selection': False}. Best is trial 100 with value: 0.2713285310457074.
[I 2025-12-06 00:32:02,866] Trial 129 finished with value: 0.25106999288287984 and parameters: {'model_type': 'mlp', 'hidden_dims': '[512, 64]', 'dropout': 0.15269015875939415, 'batch_norm': False, 'lr': 3.7280705730115835e-05, 'weight_decay': 5.552420050084405e-06, 'epochs': 68, 'loss': 'mae', 'optimizer': 'adam', 'graph_mode': 'off', 'use_snp_selection': False}. Best is trial 100 with value: 0.2713285310457074.
[I 2025-12-06 00:32:23,784] Trial 130 finished with value: 0.2543934118105177 and parameters: {'model_type': 'mlp', 'hidden_dims': '[512, 64]', 'dropout': 0.11854446101590482, 'batch_norm': False, 'lr': 5.8773893026698727e-05, 'weight_decay': 3.481189690255303e-06, 'epochs': 56, 'loss': 'mae', 'optimizer': 'adam', 'graph_mode': 'off', 'use_snp_selection': False}. Best is trial 100 with value: 0.2713285310457074.
[I 2025-12-06 00:32:43,707] Trial 131 finished with value: 0.25273716911333033 and parameters: {'model_type': 'mlp', 'hidden_dims': '[512, 64]', 'dropout': 0.17212400867466887, 'batch_norm': False, 'lr': 9.406944216250321e-05, 'weight_decay': 8.701677122105485e-07, 'epochs': 52, 'loss': 'mae', 'optimizer': 'adam', 'graph_mode': 'off', 'use_snp_selection': False}. Best is trial 100 with value: 0.2713285310457074.
[I 2025-12-06 00:33:02,368] Trial 132 finished with value: 0.24017651443945084 and parameters: {'model_type': 'mlp', 'hidden_dims': '[512, 64]', 'dropout': 0.1486182249263145, 'batch_norm': False, 'lr': 0.00019054971899998925, 'weight_decay': 9.861796917775044e-07, 'epochs': 47, 'loss': 'mae', 'optimizer': 'adam', 'graph_mode': 'off', 'use_snp_selection': False}. Best is trial 100 with value: 0.2713285310457074.
[I 2025-12-06 00:33:23,301] Trial 133 finished with value: 0.2604136397645381 and parameters: {'model_type': 'mlp', 'hidden_dims': '[512, 64]', 'dropout': 0.1007206920381849, 'batch_norm': False, 'lr': 8.192809366167064e-05, 'weight_decay': 1.3338572404434213e-06, 'epochs': 56, 'loss': 'mae', 'optimizer': 'adam', 'graph_mode': 'off', 'use_snp_selection': False}. Best is trial 100 with value: 0.2713285310457074.
[I 2025-12-06 00:33:45,726] Trial 134 finished with value: 0.26140473493664174 and parameters: {'model_type': 'mlp', 'hidden_dims': '[512, 64]', 'dropout': 0.14241047435891435, 'batch_norm': False, 'lr': 3.3067361501389025e-05, 'weight_decay': 2.196511288949288e-06, 'epochs': 62, 'loss': 'mae', 'optimizer': 'adam', 'graph_mode': 'off', 'use_snp_selection': False}. Best is trial 100 with value: 0.2713285310457074.
[I 2025-12-06 00:34:10,592] Trial 135 finished with value: 0.2574889204811998 and parameters: {'model_type': 'mlp', 'hidden_dims': '[512, 64]', 'dropout': 0.1148238504507754, 'batch_norm': False, 'lr': 0.00010556000744797043, 'weight_decay': 1.6485178850415986e-06, 'epochs': 72, 'loss': 'mae', 'optimizer': 'adam', 'graph_mode': 'off', 'use_snp_selection': False}. Best is trial 100 with value: 0.2713285310457074.
[I 2025-12-06 00:34:29,080] Trial 136 finished with value: 0.2510988204609951 and parameters: {'model_type': 'mlp', 'hidden_dims': '[512, 64]', 'dropout': 0.15164499332551268, 'batch_norm': False, 'lr': 0.00013400895924326863, 'weight_decay': 3.904179158739879e-06, 'epochs': 46, 'loss': 'mae', 'optimizer': 'adam', 'graph_mode': 'off', 'use_snp_selection': False}. Best is trial 100 with value: 0.2713285310457074.
[I 2025-12-06 00:35:44,925] Trial 137 finished with value: 0.22420744415274005 and parameters: {'model_type': 'mlp', 'hidden_dims': '[512, 64]', 'dropout': 0.13239974280526678, 'batch_norm': False, 'lr': 6.8856091805804e-05, 'weight_decay': 2.754250529073643e-06, 'epochs': 279, 'loss': 'mae', 'optimizer': 'adam', 'graph_mode': 'off', 'use_snp_selection': False}. Best is trial 100 with value: 0.2713285310457074.
[I 2025-12-06 00:36:08,113] Trial 138 finished with value: 0.2580718159834973 and parameters: {'model_type': 'mlp', 'hidden_dims': '[512, 64]', 'dropout': 0.12294280767734249, 'batch_norm': False, 'lr': 8.945503198270811e-05, 'weight_decay': 1.0018115547606134e-06, 'epochs': 65, 'loss': 'mae', 'optimizer': 'adam', 'graph_mode': 'off', 'use_snp_selection': False}. Best is trial 100 with value: 0.2713285310457074.
[I 2025-12-06 00:36:28,683] Trial 139 finished with value: 0.21998503037812284 and parameters: {'model_type': 'mlp', 'hidden_dims': '[512, 64]', 'dropout': 0.10875329943563572, 'batch_norm': True, 'lr': 4.622516092427611e-05, 'weight_decay': 3.2754860441842072e-06, 'epochs': 53, 'loss': 'mae', 'optimizer': 'adam', 'graph_mode': 'off', 'use_snp_selection': False}. Best is trial 100 with value: 0.2713285310457074.
[I 2025-12-06 00:36:50,026] Trial 140 finished with value: 0.22687580028810306 and parameters: {'model_type': 'mlp', 'hidden_dims': '[512, 64]', 'dropout': 0.13844968633624027, 'batch_norm': False, 'lr': 0.00015491227172421813, 'weight_decay': 1.523283366963738e-06, 'epochs': 58, 'loss': 'mse', 'optimizer': 'adam', 'graph_mode': 'off', 'use_snp_selection': False}. Best is trial 100 with value: 0.2713285310457074.
[I 2025-12-06 00:37:13,188] Trial 141 finished with value: 0.262522136920641 and parameters: {'model_type': 'mlp', 'hidden_dims': '[512, 64]', 'dropout': 0.14628387827431535, 'batch_norm': False, 'lr': 3.224931666795405e-05, 'weight_decay': 2.2763332653076364e-06, 'epochs': 65, 'loss': 'mae', 'optimizer': 'adam', 'graph_mode': 'off', 'use_snp_selection': False}. Best is trial 100 with value: 0.2713285310457074.
[I 2025-12-06 00:37:30,148] Trial 142 finished with value: 0.2583683564787912 and parameters: {'model_type': 'mlp', 'hidden_dims': '[512, 64]', 'dropout': 0.1699946843021807, 'batch_norm': False, 'lr': 6.179250567923169e-05, 'weight_decay': 2.1031854533648147e-06, 'epochs': 40, 'loss': 'mae', 'optimizer': 'adam', 'graph_mode': 'off', 'use_snp_selection': False}. Best is trial 100 with value: 0.2713285310457074.
[I 2025-12-06 00:37:49,305] Trial 143 finished with value: 0.25955006853439055 and parameters: {'model_type': 'mlp', 'hidden_dims': '[512, 64]', 'dropout': 0.1823006601423575, 'batch_norm': False, 'lr': 7.393797614905106e-05, 'weight_decay': 2.537486320015753e-06, 'epochs': 49, 'loss': 'mae', 'optimizer': 'adam', 'graph_mode': 'off', 'use_snp_selection': False}. Best is trial 100 with value: 0.2713285310457074.
[I 2025-12-06 00:38:05,891] Trial 144 finished with value: 0.24951861132658926 and parameters: {'model_type': 'mlp', 'hidden_dims': '[256, 128, 64]', 'dropout': 0.15787774014019013, 'batch_norm': False, 'lr': 0.00022067025777096973, 'weight_decay': 5.218908839800313e-06, 'epochs': 83, 'loss': 'mae', 'optimizer': 'adam', 'graph_mode': 'off', 'use_snp_selection': False}. Best is trial 100 with value: 0.2713285310457074.
[I 2025-12-06 00:38:28,804] Trial 145 finished with value: 0.2650961067761727 and parameters: {'model_type': 'mlp', 'hidden_dims': '[512, 64]', 'dropout': 0.14940511790404143, 'batch_norm': False, 'lr': 2.3542770260316436e-05, 'weight_decay': 1.1856096537761125e-06, 'epochs': 64, 'loss': 'mae', 'optimizer': 'adam', 'graph_mode': 'off', 'use_snp_selection': False}. Best is trial 100 with value: 0.2713285310457074.
[I 2025-12-06 00:38:51,893] Trial 146 finished with value: 0.25512677315475507 and parameters: {'model_type': 'mlp', 'hidden_dims': '[512, 64]', 'dropout': 0.1294031689963278, 'batch_norm': False, 'lr': 5.3471730603275344e-05, 'weight_decay': 1.1486375407499622e-06, 'epochs': 65, 'loss': 'mae', 'optimizer': 'adam', 'graph_mode': 'off', 'use_snp_selection': False}. Best is trial 100 with value: 0.2713285310457074.
[I 2025-12-06 00:39:16,542] Trial 147 finished with value: 0.25813716282617494 and parameters: {'model_type': 'mlp', 'hidden_dims': '[512, 64]', 'dropout': 0.10632308903418813, 'batch_norm': False, 'lr': 2.5257410500388946e-05, 'weight_decay': 7.718730540545724e-06, 'epochs': 71, 'loss': 'mae', 'optimizer': 'adam', 'graph_mode': 'off', 'use_snp_selection': False}. Best is trial 100 with value: 0.2713285310457074.
[I 2025-12-06 00:39:38,632] Trial 148 finished with value: 0.25682579626337715 and parameters: {'model_type': 'mlp', 'hidden_dims': '[512, 64]', 'dropout': 0.11997909591607978, 'batch_norm': False, 'lr': 0.00011229495622224832, 'weight_decay': 1.7604582766772593e-06, 'epochs': 61, 'loss': 'mae', 'optimizer': 'adam', 'graph_mode': 'off', 'use_snp_selection': False}. Best is trial 100 with value: 0.2713285310457074.
[I 2025-12-06 00:39:47,239] Trial 149 finished with value: 0.26098273557450385 and parameters: {'model_type': 'mlp', 'hidden_dims': '[128, 64]', 'dropout': 0.14338154354065802, 'batch_norm': False, 'lr': 7.848133891643398e-05, 'weight_decay': 4.034979573162465e-06, 'epochs': 47, 'loss': 'mae', 'optimizer': 'adam', 'graph_mode': 'off', 'use_snp_selection': False}. Best is trial 100 with value: 0.2713285310457074.
[I 2025-12-06 00:40:35,719] Trial 0 finished with value: 0.18350458625228008 and parameters: {'model_type': 'mlp', 'hidden_dims': '[128, 64]', 'dropout': 0.199031432379812, 'batch_norm': True, 'lr': 1.8408544111075837e-06, 'weight_decay': 5.5136510071208614e-05, 'epochs': 336, 'loss': 'mae', 'optimizer': 'adam', 'graph_mode': 'off', 'use_snp_selection': True, 'num_snps': 43862}. Best is trial 0 with value: 0.18350458625228008.
[I 2025-12-06 00:41:07,603] Trial 1 finished with value: 0.22241960488621845 and parameters: {'model_type': 'mlp', 'hidden_dims': '[256, 128]', 'dropout': 0.4370668075331726, 'batch_norm': True, 'lr': 7.133471581159139e-05, 'weight_decay': 1.128633586803549e-05, 'epochs': 242, 'loss': 'mae', 'optimizer': 'adam', 'graph_mode': 'off', 'use_snp_selection': False}. Best is trial 1 with value: 0.22241960488621845.
[I 2025-12-06 00:41:35,710] Trial 2 finished with value: 0.21061301260586082 and parameters: {'model_type': 'mlp', 'hidden_dims': '[256, 128, 64]', 'dropout': 0.41314357415569625, 'batch_norm': False, 'lr': 3.952233718592101e-06, 'weight_decay': 0.00026754769258252603, 'epochs': 149, 'loss': 'mse', 'optimizer': 'adam', 'graph_mode': 'off', 'use_snp_selection': True, 'num_snps': 11571}. Best is trial 1 with value: 0.22241960488621845.
[I 2025-12-06 00:42:48,426] Trial 3 finished with value: 0.23993724770836827 and parameters: {'model_type': 'mlp', 'hidden_dims': '[512, 64]', 'dropout': 0.5938127374509361, 'batch_norm': False, 'lr': 5.67704586114731e-06, 'weight_decay': 2.4518087630137052e-05, 'epochs': 320, 'loss': 'mae', 'optimizer': 'adam', 'graph_mode': 'off', 'use_snp_selection': False}. Best is trial 3 with value: 0.23993724770836827.
[I 2025-12-06 00:43:53,775] Trial 4 finished with value: 0.16890548540045686 and parameters: {'model_type': 'mlp', 'hidden_dims': '[512, 128]', 'dropout': 0.25746343592134413, 'batch_norm': True, 'lr': 1.3467657668402788e-06, 'weight_decay': 0.00033087251918647806, 'epochs': 277, 'loss': 'mse', 'optimizer': 'adam', 'graph_mode': 'off', 'use_snp_selection': True, 'num_snps': 36675}. Best is trial 3 with value: 0.23993724770836827.
[I 2025-12-06 00:44:39,480] Trial 5 finished with value: 0.17467707383662212 and parameters: {'model_type': 'mlp', 'hidden_dims': '[512, 64]', 'dropout': 0.38275350994408375, 'batch_norm': True, 'lr': 1.5586664309232824e-06, 'weight_decay': 0.0008227664668621182, 'epochs': 145, 'loss': 'mae', 'optimizer': 'adam', 'graph_mode': 'off', 'use_snp_selection': True, 'num_snps': 32148}. Best is trial 3 with value: 0.23993724770836827.
[I 2025-12-06 00:45:05,967] Trial 6 finished with value: 0.20539052011859252 and parameters: {'model_type': 'mlp', 'hidden_dims': '[256, 128]', 'dropout': 0.3930109900265879, 'batch_norm': False, 'lr': 4.892964372128395e-05, 'weight_decay': 1.5809549317992182e-06, 'epochs': 199, 'loss': 'mse', 'optimizer': 'adam', 'graph_mode': 'off', 'use_snp_selection': False}. Best is trial 3 with value: 0.23993724770836827.
[I 2025-12-06 00:45:32,865] Trial 7 finished with value: 0.21189290191192423 and parameters: {'model_type': 'mlp', 'hidden_dims': '[512, 256]', 'dropout': 0.15343979219678458, 'batch_norm': True, 'lr': 6.234003099047341e-05, 'weight_decay': 3.894760610535477e-07, 'epochs': 97, 'loss': 'mse', 'optimizer': 'adam', 'graph_mode': 'off', 'use_snp_selection': False}. Best is trial 3 with value: 0.23993724770836827.
[I 2025-12-06 00:46:45,223] Trial 8 finished with value: 0.22535476456015585 and parameters: {'model_type': 'mlp', 'hidden_dims': '[512, 128]', 'dropout': 0.10743001231661406, 'batch_norm': True, 'lr': 0.00023728538449271062, 'weight_decay': 1.7629071578048637e-05, 'epochs': 312, 'loss': 'mae', 'optimizer': 'adam', 'graph_mode': 'off', 'use_snp_selection': False}. Best is trial 3 with value: 0.23993724770836827.
[I 2025-12-06 00:47:28,632] Trial 9 finished with value: 0.22491876007854725 and parameters: {'model_type': 'mlp', 'hidden_dims': '[512, 64]', 'dropout': 0.14505336736221927, 'batch_norm': True, 'lr': 5.8619638388111826e-05, 'weight_decay': 6.200156172669308e-07, 'epochs': 175, 'loss': 'mse', 'optimizer': 'adam', 'graph_mode': 'off', 'use_snp_selection': False}. Best is trial 3 with value: 0.23993724770836827.
[I 2025-12-06 00:47:46,493] Trial 10 finished with value: 0.2344785555854821 and parameters: {'model_type': 'mlp', 'hidden_dims': '[512, 64]', 'dropout': 0.5885461262002587, 'batch_norm': False, 'lr': 8.769366258768696e-06, 'weight_decay': 2.78273193871783e-06, 'epochs': 55, 'loss': 'mae', 'optimizer': 'adam', 'graph_mode': 'off', 'use_snp_selection': False}. Best is trial 3 with value: 0.23993724770836827.
[I 2025-12-06 00:48:08,878] Trial 11 finished with value: 0.24482938842625424 and parameters: {'model_type': 'mlp', 'hidden_dims': '[512, 64]', 'dropout': 0.583942291816117, 'batch_norm': False, 'lr': 1.1821335968986158e-05, 'weight_decay': 4.061640528568547e-06, 'epochs': 77, 'loss': 'mae', 'optimizer': 'adam', 'graph_mode': 'off', 'use_snp_selection': False}. Best is trial 11 with value: 0.24482938842625424.
[I 2025-12-06 00:48:23,589] Trial 12 finished with value: 0.21467124584668604 and parameters: {'model_type': 'mlp', 'hidden_dims': '[512, 64]', 'dropout': 0.593097749012682, 'batch_norm': False, 'lr': 1.2808693622626188e-05, 'weight_decay': 1.3081036432574914e-07, 'epochs': 40, 'loss': 'mae', 'optimizer': 'adam', 'graph_mode': 'off', 'use_snp_selection': False}. Best is trial 11 with value: 0.24482938842625424.
[I 2025-12-06 00:49:18,642] Trial 13 finished with value: 0.24220789842748425 and parameters: {'model_type': 'mlp', 'hidden_dims': '[512, 64]', 'dropout': 0.5043641748401543, 'batch_norm': False, 'lr': 1.3373175420781734e-05, 'weight_decay': 4.373608364627903e-05, 'epochs': 235, 'loss': 'mae', 'optimizer': 'adam', 'graph_mode': 'off', 'use_snp_selection': False}. Best is trial 11 with value: 0.24482938842625424.
[I 2025-12-06 00:49:34,774] Trial 14 finished with value: 0.2372285900613928 and parameters: {'model_type': 'mlp', 'hidden_dims': '[128, 64]', 'dropout': 0.48369972861071203, 'batch_norm': False, 'lr': 2.342198014841721e-05, 'weight_decay': 6.9442169885097e-05, 'epochs': 229, 'loss': 'mae', 'optimizer': 'adam', 'graph_mode': 'off', 'use_snp_selection': False}. Best is trial 11 with value: 0.24482938842625424.
[I 2025-12-06 00:50:01,618] Trial 15 finished with value: 0.22712992699399584 and parameters: {'model_type': 'mlp', 'hidden_dims': '[512, 256]', 'dropout': 0.49962106881650387, 'batch_norm': False, 'lr': 0.0001959252181605648, 'weight_decay': 3.683608585652567e-06, 'epochs': 100, 'loss': 'mae', 'optimizer': 'adam', 'graph_mode': 'off', 'use_snp_selection': False}. Best is trial 11 with value: 0.24482938842625424.
[I 2025-12-06 00:50:35,110] Trial 16 finished with value: 0.22931533648898225 and parameters: {'model_type': 'mlp', 'hidden_dims': '[256, 128, 64]', 'dropout': 0.3113370581957565, 'batch_norm': False, 'lr': 1.7965777002290123e-05, 'weight_decay': 5.098763140321504e-06, 'epochs': 258, 'loss': 'mae', 'optimizer': 'adam', 'graph_mode': 'off', 'use_snp_selection': False}. Best is trial 11 with value: 0.24482938842625424.
[I 2025-12-06 00:51:22,723] Trial 17 finished with value: 0.11671423864675023 and parameters: {'model_type': 'mlp', 'hidden_dims': '[512, 64]', 'dropout': 0.49329768653247374, 'batch_norm': False, 'lr': 0.000906375209920231, 'weight_decay': 6.701500258213284e-05, 'epochs': 202, 'loss': 'mae', 'optimizer': 'adam', 'graph_mode': 'off', 'use_snp_selection': False}. Best is trial 11 with value: 0.24482938842625424.
[I 2025-12-06 00:52:18,994] Trial 18 finished with value: 0.22706833495648313 and parameters: {'model_type': 'mlp', 'hidden_dims': '[512, 64]', 'dropout': 0.536866299480327, 'batch_norm': False, 'lr': 3.6784923557895083e-06, 'weight_decay': 8.681334578509495e-07, 'epochs': 98, 'loss': 'mae', 'optimizer': 'adam', 'graph_mode': 'off', 'use_snp_selection': True, 'num_snps': 58241}. Best is trial 11 with value: 0.24482938842625424.
[I 2025-12-06 00:53:25,584] Trial 19 finished with value: 0.24355036558045642 and parameters: {'model_type': 'mlp', 'hidden_dims': '[512, 64]', 'dropout': 0.5413181760524932, 'batch_norm': False, 'lr': 8.522297577505818e-06, 'weight_decay': 7.564255826747432e-06, 'epochs': 290, 'loss': 'mae', 'optimizer': 'adam', 'graph_mode': 'off', 'use_snp_selection': False}. Best is trial 11 with value: 0.24482938842625424.
[I 2025-12-06 00:54:33,388] Trial 20 finished with value: 0.23916310610751088 and parameters: {'model_type': 'mlp', 'hidden_dims': '[512, 128]', 'dropout': 0.3333201802389236, 'batch_norm': False, 'lr': 6.91107062941075e-06, 'weight_decay': 7.418943169499522e-06, 'epochs': 292, 'loss': 'mae', 'optimizer': 'adam', 'graph_mode': 'off', 'use_snp_selection': False}. Best is trial 11 with value: 0.24482938842625424.
[I 2025-12-06 00:55:37,984] Trial 21 finished with value: 0.23757286845907793 and parameters: {'model_type': 'mlp', 'hidden_dims': '[512, 64]', 'dropout': 0.5405439478908376, 'batch_norm': False, 'lr': 1.3395991288733834e-05, 'weight_decay': 3.0223991161466014e-05, 'epochs': 280, 'loss': 'mae', 'optimizer': 'adam', 'graph_mode': 'off', 'use_snp_selection': False}. Best is trial 11 with value: 0.24482938842625424.
[I 2025-12-06 00:56:31,262] Trial 22 finished with value: 0.2311791660519186 and parameters: {'model_type': 'mlp', 'hidden_dims': '[512, 64]', 'dropout': 0.537858621710719, 'batch_norm': False, 'lr': 3.104101681172084e-05, 'weight_decay': 0.00012506009376990192, 'epochs': 228, 'loss': 'mae', 'optimizer': 'adam', 'graph_mode': 'off', 'use_snp_selection': False}. Best is trial 11 with value: 0.24482938842625424.
