[I 2025-12-05 15:44:47,840] Trial 80 finished with value: 0.0364160948112673 and parameters: {'model_type': 'mlp', 'hidden_dims': '[512, 256]', 'dropout': 0.43130739308607613, 'batch_norm': False, 'lr': 0.0005863608195220444, 'weight_decay': 4.023733672004279e-06, 'epochs': 235, 'loss': 'mae', 'optimizer': 'adam', 'graph_mode': 'off', 'use_snp_selection': False}. Best is trial 5 with value: 0.056440586886236925.
[I 2025-12-05 15:44:49,346] Trial 81 finished with value: 0.039347209106221456 and parameters: {'model_type': 'mlp', 'hidden_dims': '[512, 256]', 'dropout': 0.39496582220530796, 'batch_norm': True, 'lr': 0.0009989636162517895, 'weight_decay': 6.311863530636418e-06, 'epochs': 206, 'loss': 'mae', 'optimizer': 'adam', 'graph_mode': 'off', 'use_snp_selection': False}. Best is trial 5 with value: 0.056440586886236925.
[I 2025-12-05 15:44:50,887] Trial 82 finished with value: 0.037189332863633795 and parameters: {'model_type': 'mlp', 'hidden_dims': '[512, 256]', 'dropout': 0.3616142680812351, 'batch_norm': True, 'lr': 0.0007639625581033878, 'weight_decay': 1.1014582030839907e-05, 'epochs': 221, 'loss': 'mae', 'optimizer': 'adam', 'graph_mode': 'off', 'use_snp_selection': False}. Best is trial 5 with value: 0.056440586886236925.
[I 2025-12-05 15:44:52,044] Trial 83 finished with value: -0.03060188543314526 and parameters: {'model_type': 'mlp', 'hidden_dims': '[256, 128, 64]', 'dropout': 0.4148795033686956, 'batch_norm': True, 'lr': 4.166715342123826e-06, 'weight_decay': 1.5579890565316966e-07, 'epochs': 266, 'loss': 'mae', 'optimizer': 'adam', 'graph_mode': 'off', 'use_snp_selection': False}. Best is trial 5 with value: 0.056440586886236925.
[I 2025-12-05 15:44:54,471] Trial 84 finished with value: 0.019052493097128545 and parameters: {'model_type': 'mlp', 'hidden_dims': '[512, 64]', 'dropout': 0.3427390372956957, 'batch_norm': True, 'lr': 2.9696529099209644e-05, 'weight_decay': 6.455080631890134e-07, 'epochs': 248, 'loss': 'mae', 'optimizer': 'adam', 'graph_mode': 'off', 'use_snp_selection': True, 'num_snps': 40984}. Best is trial 5 with value: 0.056440586886236925.
[I 2025-12-05 15:44:56,316] Trial 85 finished with value: 0.04077324176721578 and parameters: {'model_type': 'mlp', 'hidden_dims': '[512, 128]', 'dropout': 0.3896239777505387, 'batch_norm': True, 'lr': 0.0005124422483180564, 'weight_decay': 0.0007603174036275854, 'epochs': 299, 'loss': 'mae', 'optimizer': 'adam', 'graph_mode': 'off', 'use_snp_selection': False}. Best is trial 5 with value: 0.056440586886236925.
[I 2025-12-05 15:44:59,153] Trial 86 finished with value: 0.025326562815543113 and parameters: {'model_type': 'mlp', 'hidden_dims': '[512, 256]', 'dropout': 0.3236201029093809, 'batch_norm': True, 'lr': 0.00034507735025408203, 'weight_decay': 3.847917405732357e-06, 'epochs': 227, 'loss': 'mae', 'optimizer': 'adam', 'graph_mode': 'off', 'use_snp_selection': True, 'num_snps': 51670}. Best is trial 5 with value: 0.056440586886236925.
[I 2025-12-05 15:45:00,068] Trial 87 finished with value: -0.02090841547504503 and parameters: {'model_type': 'mlp', 'hidden_dims': '[256, 128]', 'dropout': 0.28171791499715915, 'batch_norm': True, 'lr': 1.2529869868420515e-06, 'weight_decay': 0.0009994488584086968, 'epochs': 149, 'loss': 'mae', 'optimizer': 'adam', 'graph_mode': 'off', 'use_snp_selection': False}. Best is trial 5 with value: 0.056440586886236925.
[I 2025-12-05 15:45:01,679] Trial 88 finished with value: 0.04525577506615297 and parameters: {'model_type': 'mlp', 'hidden_dims': '[256, 128, 64]', 'dropout': 0.29665008246370395, 'batch_norm': True, 'lr': 0.0006419360702446911, 'weight_decay': 0.0005140250150493544, 'epochs': 158, 'loss': 'mae', 'optimizer': 'adam', 'graph_mode': 'off', 'use_snp_selection': True, 'num_snps': 28308}. Best is trial 5 with value: 0.056440586886236925.
[I 2025-12-05 15:45:03,694] Trial 89 finished with value: 0.03405811854739165 and parameters: {'model_type': 'mlp', 'hidden_dims': '[512, 128]', 'dropout': 0.4713801739786514, 'batch_norm': True, 'lr': 0.0008734391011104591, 'weight_decay': 0.0003699852942925984, 'epochs': 346, 'loss': 'mse', 'optimizer': 'adam', 'graph_mode': 'off', 'use_snp_selection': False}. Best is trial 5 with value: 0.056440586886236925.
[I 2025-12-05 15:45:05,686] Trial 90 finished with value: 0.01669604974248033 and parameters: {'model_type': 'mlp', 'hidden_dims': '[512, 128]', 'dropout': 0.3745320339049683, 'batch_norm': True, 'lr': 0.0004525245493558599, 'weight_decay': 5.483902893944389e-05, 'epochs': 186, 'loss': 'mae', 'optimizer': 'adam', 'graph_mode': 'off', 'use_snp_selection': True, 'num_snps': 35788}. Best is trial 5 with value: 0.056440586886236925.
[I 2025-12-05 15:45:07,188] Trial 91 finished with value: 0.03882322292111792 and parameters: {'model_type': 'mlp', 'hidden_dims': '[512, 128]', 'dropout': 0.3495532078531451, 'batch_norm': True, 'lr': 0.0007927706685485675, 'weight_decay': 0.00020607300526699745, 'epochs': 203, 'loss': 'mae', 'optimizer': 'adam', 'graph_mode': 'off', 'use_snp_selection': False}. Best is trial 5 with value: 0.056440586886236925.
[I 2025-12-05 15:45:08,710] Trial 92 finished with value: 0.03950534356320682 and parameters: {'model_type': 'mlp', 'hidden_dims': '[512, 128]', 'dropout': 0.3552699527302168, 'batch_norm': True, 'lr': 0.0002699455089114314, 'weight_decay': 0.000122757379452163, 'epochs': 215, 'loss': 'mae', 'optimizer': 'adam', 'graph_mode': 'off', 'use_snp_selection': False}. Best is trial 5 with value: 0.056440586886236925.
[I 2025-12-05 15:45:10,186] Trial 93 finished with value: 0.04036638920033434 and parameters: {'model_type': 'mlp', 'hidden_dims': '[512, 128]', 'dropout': 0.3330083321522282, 'batch_norm': True, 'lr': 0.0008910218591510614, 'weight_decay': 0.00025774301537342384, 'epochs': 203, 'loss': 'mae', 'optimizer': 'adam', 'graph_mode': 'off', 'use_snp_selection': False}. Best is trial 5 with value: 0.056440586886236925.
[I 2025-12-05 15:45:10,883] Trial 94 finished with value: 0.03365355809097363 and parameters: {'model_type': 'mlp', 'hidden_dims': '[128, 64]', 'dropout': 0.10057321925494159, 'batch_norm': True, 'lr': 0.0005257186103144631, 'weight_decay': 0.00015096408707287873, 'epochs': 120, 'loss': 'mae', 'optimizer': 'adam', 'graph_mode': 'off', 'use_snp_selection': False}. Best is trial 5 with value: 0.056440586886236925.
[I 2025-12-05 15:45:12,263] Trial 95 finished with value: 0.05497531240896905 and parameters: {'model_type': 'mlp', 'hidden_dims': '[512, 128]', 'dropout': 0.4469283818990158, 'batch_norm': True, 'lr': 0.00015876198169655767, 'weight_decay': 1.5743519515728398e-05, 'epochs': 177, 'loss': 'mae', 'optimizer': 'adam', 'graph_mode': 'off', 'use_snp_selection': False}. Best is trial 5 with value: 0.056440586886236925.
[I 2025-12-05 15:45:13,225] Trial 96 finished with value: 0.049044672161329315 and parameters: {'model_type': 'mlp', 'hidden_dims': '[256, 128, 64]', 'dropout': 0.48166655796785496, 'batch_norm': True, 'lr': 0.0001559678213877121, 'weight_decay': 1.8521066886480906e-05, 'epochs': 172, 'loss': 'mae', 'optimizer': 'adam', 'graph_mode': 'off', 'use_snp_selection': False}. Best is trial 5 with value: 0.056440586886236925.
[I 2025-12-05 15:45:14,611] Trial 97 finished with value: 0.04076270054289766 and parameters: {'model_type': 'mlp', 'hidden_dims': '[512, 64]', 'dropout': 0.48290236796004793, 'batch_norm': True, 'lr': 0.00019617094776928025, 'weight_decay': 1.2968327804118194e-05, 'epochs': 177, 'loss': 'mae', 'optimizer': 'adam', 'graph_mode': 'off', 'use_snp_selection': False}. Best is trial 5 with value: 0.056440586886236925.
[I 2025-12-05 15:45:15,826] Trial 98 finished with value: 0.029005309346902534 and parameters: {'model_type': 'mlp', 'hidden_dims': '[512, 128]', 'dropout': 0.4378376751266996, 'batch_norm': False, 'lr': 0.00014003795756109894, 'weight_decay': 2.4187413778033722e-05, 'epochs': 134, 'loss': 'mae', 'optimizer': 'adam', 'graph_mode': 'off', 'use_snp_selection': False}. Best is trial 5 with value: 0.056440586886236925.
[I 2025-12-05 15:45:16,768] Trial 99 finished with value: 0.044157381428274994 and parameters: {'model_type': 'mlp', 'hidden_dims': '[256, 128, 64]', 'dropout': 0.5024318993823059, 'batch_norm': True, 'lr': 0.0001753194884795544, 'weight_decay': 8.726170242137622e-06, 'epochs': 162, 'loss': 'mae', 'optimizer': 'adam', 'graph_mode': 'off', 'use_snp_selection': False}. Best is trial 5 with value: 0.056440586886236925.
[I 2025-12-05 15:45:18,124] Trial 100 finished with value: 0.04383790513663271 and parameters: {'model_type': 'mlp', 'hidden_dims': '[512, 128]', 'dropout': 0.4494985354931852, 'batch_norm': True, 'lr': 8.091241850563413e-05, 'weight_decay': 3.092397531577898e-05, 'epochs': 170, 'loss': 'mae', 'optimizer': 'adam', 'graph_mode': 'off', 'use_snp_selection': False}. Best is trial 5 with value: 0.056440586886236925.
[I 2025-12-05 15:45:19,039] Trial 101 finished with value: 0.0158695108735342 and parameters: {'model_type': 'mlp', 'hidden_dims': '[256, 128, 64]', 'dropout': 0.4052692115315499, 'batch_norm': True, 'lr': 0.0001121716153592432, 'weight_decay': 1.8183829545443505e-05, 'epochs': 151, 'loss': 'mae', 'optimizer': 'adam', 'graph_mode': 'off', 'use_snp_selection': False}. Best is trial 5 with value: 0.056440586886236925.
[I 2025-12-05 15:45:20,263] Trial 102 finished with value: -0.008929619200786939 and parameters: {'model_type': 'mlp', 'hidden_dims': '[256, 128, 64]', 'dropout': 0.5126149065560602, 'batch_norm': True, 'lr': 7.576738934662707e-06, 'weight_decay': 1.5408947925127324e-05, 'epochs': 189, 'loss': 'mae', 'optimizer': 'adam', 'graph_mode': 'off', 'use_snp_selection': True, 'num_snps': 11719}. Best is trial 5 with value: 0.056440586886236925.
[I 2025-12-05 15:45:21,175] Trial 103 finished with value: 0.04245680495969286 and parameters: {'model_type': 'mlp', 'hidden_dims': '[256, 128, 64]', 'dropout': 0.42004399340124854, 'batch_norm': True, 'lr': 0.000246964594213996, 'weight_decay': 7.88316493341883e-06, 'epochs': 143, 'loss': 'mae', 'optimizer': 'adam', 'graph_mode': 'off', 'use_snp_selection': False}. Best is trial 5 with value: 0.056440586886236925.
[I 2025-12-05 15:45:22,839] Trial 104 finished with value: 0.03348787034241744 and parameters: {'model_type': 'mlp', 'hidden_dims': '[256, 128, 64]', 'dropout': 0.4513124013790745, 'batch_norm': True, 'lr': 0.00012664286548566818, 'weight_decay': 1.983833065488109e-05, 'epochs': 287, 'loss': 'mae', 'optimizer': 'adam', 'graph_mode': 'off', 'use_snp_selection': True, 'num_snps': 21613}. Best is trial 5 with value: 0.056440586886236925.
[I 2025-12-05 15:45:23,805] Trial 105 finished with value: 0.01953011221816218 and parameters: {'model_type': 'mlp', 'hidden_dims': '[256, 128, 64]', 'dropout': 0.39882793439296477, 'batch_norm': True, 'lr': 0.0001545338888189848, 'weight_decay': 3.634407528582713e-05, 'epochs': 173, 'loss': 'mae', 'optimizer': 'adam', 'graph_mode': 'off', 'use_snp_selection': False}. Best is trial 5 with value: 0.056440586886236925.
[I 2025-12-05 15:45:25,680] Trial 106 finished with value: 0.022848897093726065 and parameters: {'model_type': 'mlp', 'hidden_dims': '[512, 128]', 'dropout': 0.3740003964510187, 'batch_norm': True, 'lr': 0.0006750876652956974, 'weight_decay': 4.800979732252501e-06, 'epochs': 183, 'loss': 'mae', 'optimizer': 'adam', 'graph_mode': 'off', 'use_snp_selection': True, 'num_snps': 32302}. Best is trial 5 with value: 0.056440586886236925.
[I 2025-12-05 15:45:27,147] Trial 107 finished with value: 0.03632977316877852 and parameters: {'model_type': 'mlp', 'hidden_dims': '[512, 256]', 'dropout': 0.5539654871427189, 'batch_norm': True, 'lr': 0.00030789371949342133, 'weight_decay': 2.971112605401704e-06, 'epochs': 197, 'loss': 'mae', 'optimizer': 'adam', 'graph_mode': 'off', 'use_snp_selection': False}. Best is trial 5 with value: 0.056440586886236925.
[I 2025-12-05 15:45:29,111] Trial 108 finished with value: 0.0510431459883843 and parameters: {'model_type': 'mlp', 'hidden_dims': '[512, 64]', 'dropout': 0.47869870150562593, 'batch_norm': True, 'lr': 0.000161028253522472, 'weight_decay': 1.7746059170351507e-06, 'epochs': 330, 'loss': 'mse', 'optimizer': 'adam', 'graph_mode': 'off', 'use_snp_selection': False}. Best is trial 5 with value: 0.056440586886236925.
[I 2025-12-05 15:45:31,070] Trial 109 finished with value: 0.03915823232547783 and parameters: {'model_type': 'mlp', 'hidden_dims': '[512, 64]', 'dropout': 0.4790847474946218, 'batch_norm': True, 'lr': 6.820129833655595e-05, 'weight_decay': 2.290799585410086e-06, 'epochs': 329, 'loss': 'mse', 'optimizer': 'adam', 'graph_mode': 'off', 'use_snp_selection': False}. Best is trial 5 with value: 0.056440586886236925.
[I 2025-12-05 15:45:33,059] Trial 110 finished with value: 0.050413460390605756 and parameters: {'model_type': 'mlp', 'hidden_dims': '[512, 64]', 'dropout': 0.4969889295004334, 'batch_norm': True, 'lr': 9.763358846796356e-05, 'weight_decay': 1.4659647730722757e-06, 'epochs': 337, 'loss': 'mse', 'optimizer': 'adam', 'graph_mode': 'off', 'use_snp_selection': False}. Best is trial 5 with value: 0.056440586886236925.
[I 2025-12-05 15:45:34,967] Trial 111 finished with value: 0.04878924908501974 and parameters: {'model_type': 'mlp', 'hidden_dims': '[512, 64]', 'dropout': 0.4937544159665722, 'batch_norm': True, 'lr': 0.00014950241270221827, 'weight_decay': 5.278125540542339e-06, 'epochs': 315, 'loss': 'mse', 'optimizer': 'adam', 'graph_mode': 'off', 'use_snp_selection': False}. Best is trial 5 with value: 0.056440586886236925.
[I 2025-12-05 15:45:36,949] Trial 112 finished with value: 0.056979649035466894 and parameters: {'model_type': 'mlp', 'hidden_dims': '[512, 64]', 'dropout': 0.5427816656223672, 'batch_norm': True, 'lr': 0.00021787476013212313, 'weight_decay': 1.6038687649514048e-06, 'epochs': 335, 'loss': 'mse', 'optimizer': 'adam', 'graph_mode': 'off', 'use_snp_selection': False}. Best is trial 112 with value: 0.056979649035466894.
[I 2025-12-05 15:45:38,931] Trial 113 finished with value: 0.033484188233069395 and parameters: {'model_type': 'mlp', 'hidden_dims': '[512, 64]', 'dropout': 0.5347632099046269, 'batch_norm': True, 'lr': 5.438297995543989e-05, 'weight_decay': 1.1330417556987195e-06, 'epochs': 333, 'loss': 'mse', 'optimizer': 'adam', 'graph_mode': 'off', 'use_snp_selection': False}. Best is trial 112 with value: 0.056979649035466894.
[I 2025-12-05 15:45:40,938] Trial 114 finished with value: 0.04160704402578947 and parameters: {'model_type': 'mlp', 'hidden_dims': '[512, 64]', 'dropout': 0.5803441491716996, 'batch_norm': True, 'lr': 9.624683277957501e-05, 'weight_decay': 2.0847298146129207e-06, 'epochs': 341, 'loss': 'mse', 'optimizer': 'adam', 'graph_mode': 'off', 'use_snp_selection': False}. Best is trial 112 with value: 0.056979649035466894.
[I 2025-12-05 15:45:42,848] Trial 115 finished with value: 0.03857206817424685 and parameters: {'model_type': 'mlp', 'hidden_dims': '[512, 64]', 'dropout': 0.49744654581258074, 'batch_norm': True, 'lr': 0.00015646569478351994, 'weight_decay': 1.6861547558725057e-06, 'epochs': 316, 'loss': 'mse', 'optimizer': 'adam', 'graph_mode': 'off', 'use_snp_selection': False}. Best is trial 112 with value: 0.056979649035466894.
[I 2025-12-05 15:45:44,817] Trial 116 finished with value: 0.05625581646495116 and parameters: {'model_type': 'mlp', 'hidden_dims': '[512, 64]', 'dropout': 0.5437661225172883, 'batch_norm': True, 'lr': 0.00021483505504801137, 'weight_decay': 1.3274690698506704e-06, 'epochs': 326, 'loss': 'mse', 'optimizer': 'adam', 'graph_mode': 'off', 'use_snp_selection': False}. Best is trial 112 with value: 0.056979649035466894.
[I 2025-12-05 15:45:46,767] Trial 117 finished with value: 0.03332632326574194 and parameters: {'model_type': 'mlp', 'hidden_dims': '[512, 64]', 'dropout': 0.5376729544953135, 'batch_norm': True, 'lr': 0.00021175992671793338, 'weight_decay': 9.718133896872191e-07, 'epochs': 325, 'loss': 'mse', 'optimizer': 'adam', 'graph_mode': 'off', 'use_snp_selection': False}. Best is trial 112 with value: 0.056979649035466894.
[I 2025-12-05 15:45:48,742] Trial 118 finished with value: 0.015362693511448965 and parameters: {'model_type': 'mlp', 'hidden_dims': '[512, 64]', 'dropout': 0.5620033081413864, 'batch_norm': False, 'lr': 3.534627068247756e-05, 'weight_decay': 1.437213318893028e-06, 'epochs': 340, 'loss': 'mse', 'optimizer': 'adam', 'graph_mode': 'off', 'use_snp_selection': False}. Best is trial 112 with value: 0.056979649035466894.
[I 2025-12-05 15:45:50,775] Trial 119 finished with value: 0.04700878992140922 and parameters: {'model_type': 'mlp', 'hidden_dims': '[512, 64]', 'dropout': 0.5094545284828277, 'batch_norm': True, 'lr': 0.00011513361658909566, 'weight_decay': 1.9025671426456437e-06, 'epochs': 348, 'loss': 'mse', 'optimizer': 'adam', 'graph_mode': 'off', 'use_snp_selection': False}. Best is trial 112 with value: 0.056979649035466894.
[I 2025-12-05 15:45:52,761] Trial 120 finished with value: 0.053675335309767175 and parameters: {'model_type': 'mlp', 'hidden_dims': '[512, 64]', 'dropout': 0.5314534712216309, 'batch_norm': True, 'lr': 9.504056123276484e-05, 'weight_decay': 7.441029395324911e-07, 'epochs': 336, 'loss': 'mse', 'optimizer': 'adam', 'graph_mode': 'off', 'use_snp_selection': False}. Best is trial 112 with value: 0.056979649035466894.
[I 2025-12-05 15:45:54,749] Trial 121 finished with value: 0.01776259892687043 and parameters: {'model_type': 'mlp', 'hidden_dims': '[512, 64]', 'dropout': 0.5247249128635344, 'batch_norm': True, 'lr': 7.590737283560252e-05, 'weight_decay': 7.682885967408343e-07, 'epochs': 336, 'loss': 'mse', 'optimizer': 'adam', 'graph_mode': 'off', 'use_snp_selection': False}. Best is trial 112 with value: 0.056979649035466894.
[I 2025-12-05 15:45:56,696] Trial 122 finished with value: 0.04637702899496604 and parameters: {'model_type': 'mlp', 'hidden_dims': '[512, 64]', 'dropout': 0.5697286900455262, 'batch_norm': True, 'lr': 9.365336910528558e-05, 'weight_decay': 1.1056156829592987e-06, 'epochs': 325, 'loss': 'mse', 'optimizer': 'adam', 'graph_mode': 'off', 'use_snp_selection': False}. Best is trial 112 with value: 0.056979649035466894.
[I 2025-12-05 15:45:58,603] Trial 123 finished with value: 0.05568628133248881 and parameters: {'model_type': 'mlp', 'hidden_dims': '[512, 64]', 'dropout': 0.4667526966573303, 'batch_norm': True, 'lr': 0.00023311875276629972, 'weight_decay': 5.25269434304694e-07, 'epochs': 309, 'loss': 'mse', 'optimizer': 'adam', 'graph_mode': 'off', 'use_snp_selection': False}. Best is trial 112 with value: 0.056979649035466894.
[I 2025-12-05 15:46:00,625] Trial 124 finished with value: 0.0362798603252123 and parameters: {'model_type': 'mlp', 'hidden_dims': '[512, 64]', 'dropout': 0.4655755085225344, 'batch_norm': True, 'lr': 0.00020750865736610596, 'weight_decay': 5.186336111484848e-07, 'epochs': 344, 'loss': 'mse', 'optimizer': 'adam', 'graph_mode': 'off', 'use_snp_selection': False}. Best is trial 112 with value: 0.056979649035466894.
[I 2025-12-05 15:46:02,547] Trial 125 finished with value: 0.03183068590108024 and parameters: {'model_type': 'mlp', 'hidden_dims': '[512, 64]', 'dropout': 0.5227929344931523, 'batch_norm': True, 'lr': 0.00012544464384389256, 'weight_decay': 5.665022988027715e-07, 'epochs': 319, 'loss': 'mse', 'optimizer': 'adam', 'graph_mode': 'off', 'use_snp_selection': False}. Best is trial 112 with value: 0.056979649035466894.
[I 2025-12-05 15:46:04,424] Trial 126 finished with value: 0.045811440832644504 and parameters: {'model_type': 'mlp', 'hidden_dims': '[512, 64]', 'dropout': 0.5475140225056017, 'batch_norm': True, 'lr': 0.0002403486154349057, 'weight_decay': 3.38576484606452e-07, 'epochs': 307, 'loss': 'mse', 'optimizer': 'adam', 'graph_mode': 'off', 'use_snp_selection': False}. Best is trial 112 with value: 0.056979649035466894.
[I 2025-12-05 15:46:06,400] Trial 127 finished with value: 0.052520906623446745 and parameters: {'model_type': 'mlp', 'hidden_dims': '[512, 64]', 'dropout': 0.5121598068857726, 'batch_norm': True, 'lr': 0.0002802693843358083, 'weight_decay': 7.628098335495324e-07, 'epochs': 333, 'loss': 'mse', 'optimizer': 'adam', 'graph_mode': 'off', 'use_snp_selection': False}. Best is trial 112 with value: 0.056979649035466894.
[I 2025-12-05 15:46:08,377] Trial 128 finished with value: 0.027934845636130523 and parameters: {'model_type': 'mlp', 'hidden_dims': '[512, 64]', 'dropout': 0.5107749665765801, 'batch_norm': True, 'lr': 0.0002768396374861951, 'weight_decay': 7.582540173385703e-07, 'epochs': 333, 'loss': 'mse', 'optimizer': 'adam', 'graph_mode': 'off', 'use_snp_selection': False}. Best is trial 112 with value: 0.056979649035466894.
[I 2025-12-05 15:46:10,417] Trial 129 finished with value: 0.04891362708451811 and parameters: {'model_type': 'mlp', 'hidden_dims': '[512, 64]', 'dropout': 0.5347612908655989, 'batch_norm': True, 'lr': 0.00018118833842717448, 'weight_decay': 3.340613212879715e-07, 'epochs': 349, 'loss': 'mse', 'optimizer': 'adam', 'graph_mode': 'off', 'use_snp_selection': False}. Best is trial 112 with value: 0.056979649035466894.
[I 2025-12-05 15:46:12,363] Trial 130 finished with value: 0.00046729225742717117 and parameters: {'model_type': 'mlp', 'hidden_dims': '[512, 64]', 'dropout': 0.5444435916005734, 'batch_norm': True, 'lr': 2.1443575924852616e-05, 'weight_decay': 9.50874511166434e-07, 'epochs': 326, 'loss': 'mse', 'optimizer': 'adam', 'graph_mode': 'off', 'use_snp_selection': False}. Best is trial 112 with value: 0.056979649035466894.
[I 2025-12-05 15:46:14,358] Trial 131 finished with value: 0.04548920928877768 and parameters: {'model_type': 'mlp', 'hidden_dims': '[512, 64]', 'dropout': 0.4635478053422526, 'batch_norm': True, 'lr': 0.00020877486873892154, 'weight_decay': 1.3345911669579242e-06, 'epochs': 337, 'loss': 'mse', 'optimizer': 'adam', 'graph_mode': 'off', 'use_snp_selection': False}. Best is trial 112 with value: 0.056979649035466894.
