[I 2025-12-05 20:11:43,792] Trial 57 finished with value: 0.2870331165089998 and parameters: {'model_type': 'mlp', 'hidden_dims': '[512, 128]', 'dropout': 0.5676919046564104, 'batch_norm': True, 'lr': 6.0829714153060374e-06, 'weight_decay': 7.587133606225582e-05, 'epochs': 118, 'loss': 'mae', 'optimizer': 'adam', 'graph_mode': 'off', 'use_snp_selection': False}. Best is trial 50 with value: 0.3041391581639435.
[I 2025-12-05 20:12:14,237] Trial 58 finished with value: 0.30249463588661796 and parameters: {'model_type': 'mlp', 'hidden_dims': '[512, 128]', 'dropout': 0.5393177123185705, 'batch_norm': False, 'lr': 1.0795446007347502e-05, 'weight_decay': 0.00021962089348938427, 'epochs': 145, 'loss': 'mse', 'optimizer': 'adam', 'graph_mode': 'off', 'use_snp_selection': False}. Best is trial 50 with value: 0.3041391581639435.
[I 2025-12-05 20:12:48,466] Trial 59 finished with value: 0.2217752780903272 and parameters: {'model_type': 'mlp', 'hidden_dims': '[512, 128]', 'dropout': 0.5831502687515666, 'batch_norm': False, 'lr': 0.0008124203504309952, 'weight_decay': 2.6341270946546287e-05, 'epochs': 167, 'loss': 'mse', 'optimizer': 'adam', 'graph_mode': 'off', 'use_snp_selection': False}. Best is trial 50 with value: 0.3041391581639435.
[I 2025-12-05 20:13:18,759] Trial 60 finished with value: 0.29415924732650045 and parameters: {'model_type': 'mlp', 'hidden_dims': '[512, 128]', 'dropout': 0.5965273799637562, 'batch_norm': False, 'lr': 3.066725054825816e-06, 'weight_decay': 0.0005231732212662091, 'epochs': 144, 'loss': 'mse', 'optimizer': 'adam', 'graph_mode': 'off', 'use_snp_selection': False}. Best is trial 50 with value: 0.3041391581639435.
[I 2025-12-05 20:13:52,109] Trial 61 finished with value: 0.30186877028677916 and parameters: {'model_type': 'mlp', 'hidden_dims': '[512, 128]', 'dropout': 0.5431846623144266, 'batch_norm': False, 'lr': 1.080513229413703e-05, 'weight_decay': 0.00017317091359611892, 'epochs': 162, 'loss': 'mse', 'optimizer': 'adam', 'graph_mode': 'off', 'use_snp_selection': False}. Best is trial 50 with value: 0.3041391581639435.
[I 2025-12-05 20:14:21,727] Trial 62 finished with value: 0.30579314035625027 and parameters: {'model_type': 'mlp', 'hidden_dims': '[512, 128]', 'dropout': 0.4847638626769793, 'batch_norm': False, 'lr': 7.826213388278956e-06, 'weight_decay': 0.00024245251878306063, 'epochs': 140, 'loss': 'mse', 'optimizer': 'adam', 'graph_mode': 'off', 'use_snp_selection': False}. Best is trial 62 with value: 0.30579314035625027.
[I 2025-12-05 20:14:47,179] Trial 63 finished with value: 0.30242272375020557 and parameters: {'model_type': 'mlp', 'hidden_dims': '[512, 128]', 'dropout': 0.47907947537380924, 'batch_norm': False, 'lr': 6.599428622359535e-06, 'weight_decay': 0.000907395046451605, 'epochs': 116, 'loss': 'mse', 'optimizer': 'adam', 'graph_mode': 'off', 'use_snp_selection': False}. Best is trial 62 with value: 0.30579314035625027.
[I 2025-12-05 20:15:25,200] Trial 64 finished with value: 0.3040991007352513 and parameters: {'model_type': 'mlp', 'hidden_dims': '[512, 128]', 'dropout': 0.5574824466410444, 'batch_norm': False, 'lr': 8.336690985821925e-06, 'weight_decay': 0.00036170495710565034, 'epochs': 189, 'loss': 'mse', 'optimizer': 'adam', 'graph_mode': 'off', 'use_snp_selection': False}. Best is trial 62 with value: 0.30579314035625027.
[I 2025-12-05 20:16:05,467] Trial 65 finished with value: 0.30655789467660843 and parameters: {'model_type': 'mlp', 'hidden_dims': '[512, 128]', 'dropout': 0.5549917517493318, 'batch_norm': False, 'lr': 4.613340149048312e-06, 'weight_decay': 0.0003871270684338801, 'epochs': 201, 'loss': 'mse', 'optimizer': 'adam', 'graph_mode': 'off', 'use_snp_selection': False}. Best is trial 65 with value: 0.30655789467660843.
[I 2025-12-05 20:16:44,100] Trial 66 finished with value: 0.28844126905213485 and parameters: {'model_type': 'mlp', 'hidden_dims': '[512, 128]', 'dropout': 0.5550094612079103, 'batch_norm': False, 'lr': 3.4964985427322806e-06, 'weight_decay': 0.0003965004751158426, 'epochs': 192, 'loss': 'mae', 'optimizer': 'adam', 'graph_mode': 'off', 'use_snp_selection': False}. Best is trial 65 with value: 0.30655789467660843.
[I 2025-12-05 20:17:20,162] Trial 67 finished with value: 0.29252901114151053 and parameters: {'model_type': 'mlp', 'hidden_dims': '[512, 128]', 'dropout': 0.5539461579667251, 'batch_norm': False, 'lr': 5.069625323627236e-06, 'weight_decay': 0.000626728600743668, 'epochs': 136, 'loss': 'mse', 'optimizer': 'adam', 'graph_mode': 'off', 'use_snp_selection': True, 'num_snps': 22951}. Best is trial 65 with value: 0.30655789467660843.
[I 2025-12-05 20:18:00,749] Trial 68 finished with value: 0.2924390954574516 and parameters: {'model_type': 'mlp', 'hidden_dims': '[512, 128]', 'dropout': 0.5297900142307244, 'batch_norm': False, 'lr': 1.9716470396206807e-06, 'weight_decay': 0.000265077905686596, 'epochs': 204, 'loss': 'mse', 'optimizer': 'adam', 'graph_mode': 'off', 'use_snp_selection': False}. Best is trial 65 with value: 0.30655789467660843.
[I 2025-12-05 20:18:38,068] Trial 69 finished with value: 0.30044197863389865 and parameters: {'model_type': 'mlp', 'hidden_dims': '[512, 128]', 'dropout': 0.5797051514342851, 'batch_norm': False, 'lr': 1.249779759237379e-05, 'weight_decay': 0.00012936899641313577, 'epochs': 185, 'loss': 'mse', 'optimizer': 'adam', 'graph_mode': 'off', 'use_snp_selection': False}. Best is trial 65 with value: 0.30655789467660843.
[I 2025-12-05 20:19:13,087] Trial 70 finished with value: 0.30156291047280126 and parameters: {'model_type': 'mlp', 'hidden_dims': '[512, 128]', 'dropout': 0.5999396719955822, 'batch_norm': False, 'lr': 9.43314693416314e-06, 'weight_decay': 0.00048133506404463917, 'epochs': 172, 'loss': 'mse', 'optimizer': 'adam', 'graph_mode': 'off', 'use_snp_selection': False}. Best is trial 65 with value: 0.30655789467660843.
[I 2025-12-05 20:19:56,759] Trial 71 finished with value: 0.295586767133618 and parameters: {'model_type': 'mlp', 'hidden_dims': '[512, 128]', 'dropout': 0.5014106480250451, 'batch_norm': False, 'lr': 2.6092858725408737e-05, 'weight_decay': 0.00026969653855166956, 'epochs': 222, 'loss': 'mse', 'optimizer': 'adam', 'graph_mode': 'off', 'use_snp_selection': False}. Best is trial 65 with value: 0.30655789467660843.
[I 2025-12-05 20:20:15,204] Trial 72 finished with value: 0.29939451652048693 and parameters: {'model_type': 'mlp', 'hidden_dims': '[256, 128, 64]', 'dropout': 0.5144068243253362, 'batch_norm': False, 'lr': 1.9017785210922532e-05, 'weight_decay': 3.631852357420032e-05, 'epochs': 152, 'loss': 'mse', 'optimizer': 'adam', 'graph_mode': 'off', 'use_snp_selection': False}. Best is trial 65 with value: 0.30655789467660843.
[I 2025-12-05 20:20:55,895] Trial 73 finished with value: 0.30116775523952816 and parameters: {'model_type': 'mlp', 'hidden_dims': '[512, 256]', 'dropout': 0.5611687520574122, 'batch_norm': False, 'lr': 8.279957264160167e-06, 'weight_decay': 0.00011545931517575642, 'epochs': 204, 'loss': 'mse', 'optimizer': 'adam', 'graph_mode': 'off', 'use_snp_selection': False}. Best is trial 65 with value: 0.30655789467660843.
[I 2025-12-05 20:21:29,197] Trial 74 finished with value: 0.3005155385098085 and parameters: {'model_type': 'mlp', 'hidden_dims': '[512, 128]', 'dropout': 0.215913171562718, 'batch_norm': False, 'lr': 4.462384294352341e-06, 'weight_decay': 0.00020553109978224804, 'epochs': 161, 'loss': 'mse', 'optimizer': 'adam', 'graph_mode': 'off', 'use_snp_selection': False}. Best is trial 65 with value: 0.30655789467660843.
[I 2025-12-05 20:22:07,182] Trial 75 finished with value: 0.3021617063140087 and parameters: {'model_type': 'mlp', 'hidden_dims': '[512, 128]', 'dropout': 0.5426525278434441, 'batch_norm': False, 'lr': 5.703095362875236e-06, 'weight_decay': 0.00046751286752373737, 'epochs': 188, 'loss': 'mse', 'optimizer': 'adam', 'graph_mode': 'off', 'use_snp_selection': False}. Best is trial 65 with value: 0.30655789467660843.
[I 2025-12-05 20:22:21,739] Trial 76 finished with value: 0.2889192163443395 and parameters: {'model_type': 'mlp', 'hidden_dims': '[256, 128]', 'dropout': 0.5281260514919309, 'batch_norm': True, 'lr': 1.4482500636046414e-05, 'weight_decay': 0.0006577053784721721, 'epochs': 108, 'loss': 'mse', 'optimizer': 'adam', 'graph_mode': 'off', 'use_snp_selection': False}. Best is trial 65 with value: 0.30655789467660843.
[I 2025-12-05 20:22:51,346] Trial 77 finished with value: 0.2930102187247311 and parameters: {'model_type': 'mlp', 'hidden_dims': '[512, 128]', 'dropout': 0.4926957813124015, 'batch_norm': False, 'lr': 2.4622541470736744e-06, 'weight_decay': 0.0009407429425508723, 'epochs': 140, 'loss': 'mse', 'optimizer': 'adam', 'graph_mode': 'off', 'use_snp_selection': False}. Best is trial 65 with value: 0.30655789467660843.
[I 2025-12-05 20:23:13,851] Trial 78 finished with value: 0.054370902792294305 and parameters: {'model_type': 'mlp', 'hidden_dims': '[512, 64]', 'dropout': 0.4508107627406531, 'batch_norm': False, 'lr': 1.0087771566710253e-06, 'weight_decay': 0.00029355637001299165, 'epochs': 125, 'loss': 'mae', 'optimizer': 'adam', 'graph_mode': 'off', 'use_snp_selection': True, 'num_snps': 2246}. Best is trial 65 with value: 0.30655789467660843.
[I 2025-12-05 20:23:39,242] Trial 79 finished with value: 0.2981022273948247 and parameters: {'model_type': 'mlp', 'hidden_dims': '[256, 128, 64]', 'dropout': 0.5757428228433951, 'batch_norm': False, 'lr': 7.48158669216063e-06, 'weight_decay': 7.646565596209129e-05, 'epochs': 228, 'loss': 'mse', 'optimizer': 'adam', 'graph_mode': 'off', 'use_snp_selection': False}. Best is trial 65 with value: 0.30655789467660843.
[I 2025-12-05 20:24:14,148] Trial 80 finished with value: 0.3029470526237582 and parameters: {'model_type': 'mlp', 'hidden_dims': '[512, 128]', 'dropout': 0.48152598780050687, 'batch_norm': False, 'lr': 4.33685543822441e-06, 'weight_decay': 0.00037073965947771005, 'epochs': 171, 'loss': 'mse', 'optimizer': 'adam', 'graph_mode': 'off', 'use_snp_selection': False}. Best is trial 65 with value: 0.30655789467660843.
[I 2025-12-05 20:24:49,681] Trial 81 finished with value: 0.3023988098127585 and parameters: {'model_type': 'mlp', 'hidden_dims': '[512, 128]', 'dropout': 0.4786188079550166, 'batch_norm': False, 'lr': 3.3662221588172083e-06, 'weight_decay': 0.00036771293438685453, 'epochs': 174, 'loss': 'mse', 'optimizer': 'adam', 'graph_mode': 'off', 'use_snp_selection': False}. Best is trial 65 with value: 0.30655789467660843.
[I 2025-12-05 20:25:31,991] Trial 82 finished with value: 0.30616941716565493 and parameters: {'model_type': 'mlp', 'hidden_dims': '[512, 128]', 'dropout': 0.5095953144588823, 'batch_norm': False, 'lr': 4.337357913716431e-06, 'weight_decay': 3.512968058569766e-06, 'epochs': 213, 'loss': 'mse', 'optimizer': 'adam', 'graph_mode': 'off', 'use_snp_selection': False}. Best is trial 65 with value: 0.30655789467660843.
[I 2025-12-05 20:26:13,843] Trial 83 finished with value: 0.30505251384648735 and parameters: {'model_type': 'mlp', 'hidden_dims': '[512, 128]', 'dropout': 0.5118455803924762, 'batch_norm': False, 'lr': 4.28868355595451e-06, 'weight_decay': 0.0002112425588261912, 'epochs': 210, 'loss': 'mse', 'optimizer': 'adam', 'graph_mode': 'off', 'use_snp_selection': False}. Best is trial 65 with value: 0.30655789467660843.
[I 2025-12-05 20:26:53,931] Trial 84 finished with value: 0.3057127870708368 and parameters: {'model_type': 'mlp', 'hidden_dims': '[512, 128]', 'dropout': 0.5077984388835185, 'batch_norm': False, 'lr': 4.2163897714405844e-06, 'weight_decay': 0.0001577674911435871, 'epochs': 200, 'loss': 'mse', 'optimizer': 'adam', 'graph_mode': 'off', 'use_snp_selection': False}. Best is trial 65 with value: 0.30655789467660843.
[I 2025-12-05 20:27:36,681] Trial 85 finished with value: 0.304322658240746 and parameters: {'model_type': 'mlp', 'hidden_dims': '[512, 128]', 'dropout': 0.5153586216785643, 'batch_norm': False, 'lr': 3.813579784871332e-06, 'weight_decay': 0.000155377261544787, 'epochs': 215, 'loss': 'mse', 'optimizer': 'adam', 'graph_mode': 'off', 'use_snp_selection': False}. Best is trial 65 with value: 0.30655789467660843.
[I 2025-12-05 20:28:22,767] Trial 86 finished with value: 0.3041097388281152 and parameters: {'model_type': 'mlp', 'hidden_dims': '[512, 128]', 'dropout': 0.5088195449793914, 'batch_norm': False, 'lr': 4.069705987733852e-06, 'weight_decay': 0.00016567898734098699, 'epochs': 234, 'loss': 'mse', 'optimizer': 'adam', 'graph_mode': 'off', 'use_snp_selection': False}. Best is trial 65 with value: 0.30655789467660843.
[I 2025-12-05 20:29:05,508] Trial 87 finished with value: 0.2957472060413993 and parameters: {'model_type': 'mlp', 'hidden_dims': '[512, 128]', 'dropout': 0.5236653430045554, 'batch_norm': False, 'lr': 1.4882475492693173e-06, 'weight_decay': 0.00015086709631265103, 'epochs': 215, 'loss': 'mse', 'optimizer': 'adam', 'graph_mode': 'off', 'use_snp_selection': False}. Best is trial 65 with value: 0.30655789467660843.
[I 2025-12-05 20:29:51,784] Trial 88 finished with value: 0.3028895640943071 and parameters: {'model_type': 'mlp', 'hidden_dims': '[512, 128]', 'dropout': 0.5163049434166143, 'batch_norm': False, 'lr': 2.830971265882373e-06, 'weight_decay': 5.905892074291195e-05, 'epochs': 235, 'loss': 'mse', 'optimizer': 'adam', 'graph_mode': 'off', 'use_snp_selection': False}. Best is trial 65 with value: 0.30655789467660843.
[I 2025-12-05 20:30:31,851] Trial 89 finished with value: 0.3013300216023461 and parameters: {'model_type': 'mlp', 'hidden_dims': '[512, 128]', 'dropout': 0.5629145775110831, 'batch_norm': False, 'lr': 2.4665586645484896e-06, 'weight_decay': 0.00020054587749020636, 'epochs': 200, 'loss': 'mse', 'optimizer': 'adam', 'graph_mode': 'off', 'use_snp_selection': False}. Best is trial 65 with value: 0.30655789467660843.
[I 2025-12-05 20:31:20,234] Trial 90 finished with value: 0.2817227558406703 and parameters: {'model_type': 'mlp', 'hidden_dims': '[512, 128]', 'dropout': 0.49581113826784706, 'batch_norm': True, 'lr': 3.836368904404727e-06, 'weight_decay': 0.00011317128470097175, 'epochs': 246, 'loss': 'mse', 'optimizer': 'adam', 'graph_mode': 'off', 'use_snp_selection': False}. Best is trial 65 with value: 0.30655789467660843.
[I 2025-12-05 20:32:02,380] Trial 91 finished with value: 0.29749505867287007 and parameters: {'model_type': 'mlp', 'hidden_dims': '[512, 128]', 'dropout': 0.10905343694424474, 'batch_norm': False, 'lr': 5.203129913692519e-06, 'weight_decay': 3.405306442024129e-06, 'epochs': 211, 'loss': 'mse', 'optimizer': 'adam', 'graph_mode': 'off', 'use_snp_selection': False}. Best is trial 65 with value: 0.30655789467660843.
[I 2025-12-05 20:32:44,749] Trial 92 finished with value: 0.30584164276951015 and parameters: {'model_type': 'mlp', 'hidden_dims': '[512, 128]', 'dropout': 0.5340297014385028, 'batch_norm': False, 'lr': 4.46571202868799e-06, 'weight_decay': 0.00025512321061925327, 'epochs': 213, 'loss': 'mse', 'optimizer': 'adam', 'graph_mode': 'off', 'use_snp_selection': False}. Best is trial 65 with value: 0.30655789467660843.
[I 2025-12-05 20:33:27,458] Trial 93 finished with value: 0.3045918850421536 and parameters: {'model_type': 'mlp', 'hidden_dims': '[512, 128]', 'dropout': 0.50974254983789, 'batch_norm': False, 'lr': 4.163424461493714e-06, 'weight_decay': 0.00023361604381231445, 'epochs': 215, 'loss': 'mse', 'optimizer': 'adam', 'graph_mode': 'off', 'use_snp_selection': False}. Best is trial 65 with value: 0.30655789467660843.
[I 2025-12-05 20:34:09,838] Trial 94 finished with value: 0.2956458306732434 and parameters: {'model_type': 'mlp', 'hidden_dims': '[512, 128]', 'dropout': 0.5129444267582348, 'batch_norm': False, 'lr': 1.7721653243865729e-06, 'weight_decay': 0.00023607672882989725, 'epochs': 213, 'loss': 'mse', 'optimizer': 'adam', 'graph_mode': 'off', 'use_snp_selection': False}. Best is trial 65 with value: 0.30655789467660843.
[I 2025-12-05 20:34:56,235] Trial 95 finished with value: 0.30445335510835425 and parameters: {'model_type': 'mlp', 'hidden_dims': '[512, 128]', 'dropout': 0.5291355958078306, 'batch_norm': False, 'lr': 3.1504445592661686e-06, 'weight_decay': 0.00016577777479095192, 'epochs': 236, 'loss': 'mse', 'optimizer': 'adam', 'graph_mode': 'off', 'use_snp_selection': False}. Best is trial 65 with value: 0.30655789467660843.
[I 2025-12-05 20:36:02,450] Trial 96 finished with value: 0.3009118866414669 and parameters: {'model_type': 'mlp', 'hidden_dims': '[512, 128]', 'dropout': 0.5352850993185896, 'batch_norm': False, 'lr': 3.135737856448294e-06, 'weight_decay': 0.00013496181486216747, 'epochs': 226, 'loss': 'mse', 'optimizer': 'adam', 'graph_mode': 'off', 'use_snp_selection': True, 'num_snps': 48962}. Best is trial 65 with value: 0.30655789467660843.
[I 2025-12-05 20:36:42,675] Trial 97 finished with value: 0.30128075057815756 and parameters: {'model_type': 'mlp', 'hidden_dims': '[512, 256]', 'dropout': 0.5324152868277545, 'batch_norm': False, 'lr': 2.35605344065427e-06, 'weight_decay': 0.00010672092080392524, 'epochs': 201, 'loss': 'mse', 'optimizer': 'adam', 'graph_mode': 'off', 'use_snp_selection': False}. Best is trial 65 with value: 0.30655789467660843.
[I 2025-12-05 20:37:30,168] Trial 98 finished with value: 0.29760159832808186 and parameters: {'model_type': 'mlp', 'hidden_dims': '[512, 128]', 'dropout': 0.492911583276046, 'batch_norm': False, 'lr': 4.8039019032265835e-06, 'weight_decay': 0.00018006694121310555, 'epochs': 243, 'loss': 'mae', 'optimizer': 'adam', 'graph_mode': 'off', 'use_snp_selection': False}. Best is trial 65 with value: 0.30655789467660843.
[I 2025-12-05 20:38:11,485] Trial 99 finished with value: 0.30181468548114554 and parameters: {'model_type': 'mlp', 'hidden_dims': '[512, 128]', 'dropout': 0.5249040487302642, 'batch_norm': False, 'lr': 6.094277429213737e-06, 'weight_decay': 0.00029952388892790367, 'epochs': 207, 'loss': 'mse', 'optimizer': 'adam', 'graph_mode': 'off', 'use_snp_selection': False}. Best is trial 65 with value: 0.30655789467660843.
[I 2025-12-05 20:38:54,564] Trial 100 finished with value: 0.30729579380385197 and parameters: {'model_type': 'mlp', 'hidden_dims': '[512, 64]', 'dropout': 0.46045325811551335, 'batch_norm': False, 'lr': 3.692536470418927e-06, 'weight_decay': 5.912649014536677e-06, 'epochs': 217, 'loss': 'mse', 'optimizer': 'adam', 'graph_mode': 'off', 'use_snp_selection': False}. Best is trial 100 with value: 0.30729579380385197.
[I 2025-12-05 20:39:37,585] Trial 101 finished with value: 0.3040033808021679 and parameters: {'model_type': 'mlp', 'hidden_dims': '[512, 64]', 'dropout': 0.46499756715453133, 'batch_norm': False, 'lr': 4.110840696500307e-06, 'weight_decay': 4.8789100178391016e-06, 'epochs': 217, 'loss': 'mse', 'optimizer': 'adam', 'graph_mode': 'off', 'use_snp_selection': False}. Best is trial 100 with value: 0.30729579380385197.
[I 2025-12-05 20:40:17,263] Trial 102 finished with value: 0.29748829819050604 and parameters: {'model_type': 'mlp', 'hidden_dims': '[512, 64]', 'dropout': 0.5501041720406761, 'batch_norm': False, 'lr': 3.512054616408315e-06, 'weight_decay': 7.222866456070046e-06, 'epochs': 198, 'loss': 'mse', 'optimizer': 'adam', 'graph_mode': 'off', 'use_snp_selection': False}. Best is trial 100 with value: 0.30729579380385197.
[I 2025-12-05 20:41:06,598] Trial 103 finished with value: 0.3054028685121028 and parameters: {'model_type': 'mlp', 'hidden_dims': '[512, 64]', 'dropout': 0.5008517155493906, 'batch_norm': False, 'lr': 2.9551704818716067e-06, 'weight_decay': 3.735487693771635e-06, 'epochs': 253, 'loss': 'mse', 'optimizer': 'adam', 'graph_mode': 'off', 'use_snp_selection': False}. Best is trial 100 with value: 0.30729579380385197.
[I 2025-12-05 20:41:56,355] Trial 104 finished with value: 0.30673346676083774 and parameters: {'model_type': 'mlp', 'hidden_dims': '[512, 64]', 'dropout': 0.5008455573812258, 'batch_norm': False, 'lr': 2.921573298104565e-06, 'weight_decay': 1.859810134718219e-06, 'epochs': 255, 'loss': 'mse', 'optimizer': 'adam', 'graph_mode': 'off', 'use_snp_selection': False}. Best is trial 100 with value: 0.30729579380385197.
[I 2025-12-05 20:42:46,354] Trial 105 finished with value: 0.30751839937923303 and parameters: {'model_type': 'mlp', 'hidden_dims': '[512, 64]', 'dropout': 0.45650944886917827, 'batch_norm': False, 'lr': 2.8400777967904842e-06, 'weight_decay': 6.000366749657411e-06, 'epochs': 257, 'loss': 'mse', 'optimizer': 'adam', 'graph_mode': 'off', 'use_snp_selection': False}. Best is trial 105 with value: 0.30751839937923303.
[I 2025-12-05 20:43:40,201] Trial 106 finished with value: 0.29880405998407544 and parameters: {'model_type': 'mlp', 'hidden_dims': '[512, 64]', 'dropout': 0.46038430891636467, 'batch_norm': False, 'lr': 1.7022782017176364e-06, 'weight_decay': 3.475658444391863e-06, 'epochs': 279, 'loss': 'mse', 'optimizer': 'adam', 'graph_mode': 'off', 'use_snp_selection': False}. Best is trial 105 with value: 0.30751839937923303.
[I 2025-12-05 20:44:32,483] Trial 107 finished with value: 0.300584666277986 and parameters: {'model_type': 'mlp', 'hidden_dims': '[512, 64]', 'dropout': 0.4268654114321005, 'batch_norm': False, 'lr': 2.106187676950797e-06, 'weight_decay': 5.720693763387522e-06, 'epochs': 270, 'loss': 'mse', 'optimizer': 'adam', 'graph_mode': 'off', 'use_snp_selection': False}. Best is trial 105 with value: 0.30751839937923303.
[I 2025-12-05 20:45:30,529] Trial 108 finished with value: 0.28758942112353886 and parameters: {'model_type': 'mlp', 'hidden_dims': '[512, 64]', 'dropout': 0.49144004995570667, 'batch_norm': True, 'lr': 2.5545563922221444e-06, 'weight_decay': 1.8169821621002756e-06, 'epochs': 302, 'loss': 'mse', 'optimizer': 'adam', 'graph_mode': 'off', 'use_snp_selection': False}. Best is trial 105 with value: 0.30751839937923303.
