[I 2025-12-06 03:23:06,264] Trial 13 finished with value: 0.21138165038784532 and parameters: {'model_type': 'mlp', 'hidden_dims': '[512, 256]', 'dropout': 0.5038644356477802, 'batch_norm': False, 'lr': 1.4304506621636526e-05, 'weight_decay': 4.373608364627903e-05, 'epochs': 237, 'loss': 'mse', 'optimizer': 'adam', 'graph_mode': 'off', 'use_snp_selection': False}. Best is trial 3 with value: 0.21939035779692345.
[I 2025-12-06 03:23:19,920] Trial 14 finished with value: 0.20591702861878716 and parameters: {'model_type': 'mlp', 'hidden_dims': '[128, 64]', 'dropout': 0.3012984444538551, 'batch_norm': True, 'lr': 0.00017558188744418174, 'weight_decay': 3.0607358611649674e-06, 'epochs': 114, 'loss': 'mse', 'optimizer': 'adam', 'graph_mode': 'off', 'use_snp_selection': False}. Best is trial 3 with value: 0.21939035779692345.
[I 2025-12-06 03:23:31,617] Trial 15 finished with value: 0.18534043108122664 and parameters: {'model_type': 'mlp', 'hidden_dims': '[256, 128, 64]', 'dropout': 0.48263162073930665, 'batch_norm': False, 'lr': 2.3197922593349616e-05, 'weight_decay': 5.786483120407219e-07, 'epochs': 41, 'loss': 'mae', 'optimizer': 'adam', 'graph_mode': 'off', 'use_snp_selection': False}. Best is trial 3 with value: 0.21939035779692345.
[I 2025-12-06 03:25:11,228] Trial 16 finished with value: 0.1971405791163938 and parameters: {'model_type': 'mlp', 'hidden_dims': '[512, 256]', 'dropout': 0.31241277325344896, 'batch_norm': True, 'lr': 6.013316929814413e-06, 'weight_decay': 5.3536875449215945e-05, 'epochs': 350, 'loss': 'mse', 'optimizer': 'adam', 'graph_mode': 'off', 'use_snp_selection': False}. Best is trial 3 with value: 0.21939035779692345.
[I 2025-12-06 03:26:31,846] Trial 17 finished with value: 0.209634864897849 and parameters: {'model_type': 'mlp', 'hidden_dims': '[512, 64]', 'dropout': 0.17958502443247115, 'batch_norm': False, 'lr': 0.00015757341301155474, 'weight_decay': 6.503919561253859e-06, 'epochs': 287, 'loss': 'mae', 'optimizer': 'adam', 'graph_mode': 'off', 'use_snp_selection': False}. Best is trial 3 with value: 0.21939035779692345.
[I 2025-12-06 03:28:07,196] Trial 18 finished with value: 0.2015308783721989 and parameters: {'model_type': 'mlp', 'hidden_dims': '[512, 256]', 'dropout': 0.5139576333133464, 'batch_norm': False, 'lr': 0.0006372689902154905, 'weight_decay': 3.5038679530849885e-07, 'epochs': 214, 'loss': 'mse', 'optimizer': 'adam', 'graph_mode': 'off', 'use_snp_selection': True, 'num_snps': 58241}. Best is trial 3 with value: 0.21939035779692345.
[I 2025-12-06 03:28:46,933] Trial 19 finished with value: 0.17213901322522368 and parameters: {'model_type': 'mlp', 'hidden_dims': '[512, 64]', 'dropout': 0.21972527923816063, 'batch_norm': True, 'lr': 3.502882181800776e-06, 'weight_decay': 2.8130326038007742e-05, 'epochs': 125, 'loss': 'mae', 'optimizer': 'adam', 'graph_mode': 'off', 'use_snp_selection': False}. Best is trial 3 with value: 0.21939035779692345.
[I 2025-12-06 03:30:02,379] Trial 20 finished with value: 0.21263023890965363 and parameters: {'model_type': 'mlp', 'hidden_dims': '[512, 128]', 'dropout': 0.3400065648259248, 'batch_norm': False, 'lr': 2.3361432915417936e-05, 'weight_decay': 0.00015711537877451736, 'epochs': 266, 'loss': 'mae', 'optimizer': 'adam', 'graph_mode': 'off', 'use_snp_selection': False}. Best is trial 3 with value: 0.21939035779692345.
[I 2025-12-06 03:31:33,072] Trial 21 finished with value: 0.20749957405748623 and parameters: {'model_type': 'mlp', 'hidden_dims': '[512, 128]', 'dropout': 0.10128168781903274, 'batch_norm': True, 'lr': 0.00023076784501907524, 'weight_decay': 1.281711767721596e-05, 'epochs': 319, 'loss': 'mae', 'optimizer': 'adam', 'graph_mode': 'off', 'use_snp_selection': False}. Best is trial 3 with value: 0.21939035779692345.
[I 2025-12-06 03:32:59,914] Trial 22 finished with value: 0.21212686153012697 and parameters: {'model_type': 'mlp', 'hidden_dims': '[512, 128]', 'dropout': 0.10449324692222597, 'batch_norm': True, 'lr': 0.00031823610895294867, 'weight_decay': 1.9270192035675102e-05, 'epochs': 304, 'loss': 'mae', 'optimizer': 'adam', 'graph_mode': 'off', 'use_snp_selection': False}. Best is trial 3 with value: 0.21939035779692345.
[I 2025-12-06 03:34:30,243] Trial 23 finished with value: 0.2165297135921834 and parameters: {'model_type': 'mlp', 'hidden_dims': '[512, 128]', 'dropout': 0.16005014567332465, 'batch_norm': True, 'lr': 8.342787146249289e-05, 'weight_decay': 6.041903558187218e-06, 'epochs': 317, 'loss': 'mae', 'optimizer': 'adam', 'graph_mode': 'off', 'use_snp_selection': False}. Best is trial 3 with value: 0.21939035779692345.
[I 2025-12-06 03:34:59,189] Trial 24 finished with value: 0.21739377916863228 and parameters: {'model_type': 'mlp', 'hidden_dims': '[256, 128, 64]', 'dropout': 0.1843085419929386, 'batch_norm': True, 'lr': 8.420844170654155e-05, 'weight_decay': 5.016324652695507e-06, 'epochs': 169, 'loss': 'mae', 'optimizer': 'adam', 'graph_mode': 'off', 'use_snp_selection': False}. Best is trial 3 with value: 0.21939035779692345.
[I 2025-12-06 03:35:29,723] Trial 25 finished with value: 0.22305900281606855 and parameters: {'model_type': 'mlp', 'hidden_dims': '[256, 128, 64]', 'dropout': 0.2334891011540549, 'batch_norm': True, 'lr': 2.6895990136111202e-05, 'weight_decay': 1.0077734665942408e-06, 'epochs': 181, 'loss': 'mae', 'optimizer': 'adam', 'graph_mode': 'off', 'use_snp_selection': False}. Best is trial 25 with value: 0.22305900281606855.
[I 2025-12-06 03:36:01,714] Trial 26 finished with value: 0.1329807832724974 and parameters: {'model_type': 'mlp', 'hidden_dims': '[256, 128, 64]', 'dropout': 0.2567799298923021, 'batch_norm': True, 'lr': 1.2550693142833744e-05, 'weight_decay': 9.948658980562194e-07, 'epochs': 241, 'loss': 'mse', 'optimizer': 'adam', 'graph_mode': 'off', 'use_snp_selection': True, 'num_snps': 3842}. Best is trial 25 with value: 0.22305900281606855.
[I 2025-12-06 03:36:20,594] Trial 27 finished with value: 0.18886786394530408 and parameters: {'model_type': 'mlp', 'hidden_dims': '[256, 128, 64]', 'dropout': 0.23382600505651402, 'batch_norm': True, 'lr': 3.708794373669967e-05, 'weight_decay': 2.8979365355406375e-07, 'epochs': 95, 'loss': 'mae', 'optimizer': 'adam', 'graph_mode': 'off', 'use_snp_selection': False}. Best is trial 25 with value: 0.22305900281606855.
[I 2025-12-06 03:36:40,387] Trial 28 finished with value: 0.20225565102095802 and parameters: {'model_type': 'mlp', 'hidden_dims': '[128, 64]', 'dropout': 0.5446517125861267, 'batch_norm': False, 'lr': 2.6291369188051193e-05, 'weight_decay': 1.9146621082186716e-06, 'epochs': 212, 'loss': 'mse', 'optimizer': 'adam', 'graph_mode': 'off', 'use_snp_selection': False}. Best is trial 25 with value: 0.22305900281606855.
[I 2025-12-06 03:37:21,300] Trial 29 finished with value: 0.14126060148896816 and parameters: {'model_type': 'mlp', 'hidden_dims': '[256, 128]', 'dropout': 0.14075769946552563, 'batch_norm': True, 'lr': 2.7181502302141237e-06, 'weight_decay': 0.00010774073487650296, 'epochs': 179, 'loss': 'mae', 'optimizer': 'adam', 'graph_mode': 'off', 'use_snp_selection': True, 'num_snps': 19468}. Best is trial 25 with value: 0.22305900281606855.
[I 2025-12-06 03:37:36,727] Trial 30 finished with value: 0.15453915946256555 and parameters: {'model_type': 'mlp', 'hidden_dims': '[128, 64]', 'dropout': 0.20969278550285456, 'batch_norm': True, 'lr': 6.097081430981486e-06, 'weight_decay': 2.3524189553084126e-07, 'epochs': 143, 'loss': 'mae', 'optimizer': 'adam', 'graph_mode': 'off', 'use_snp_selection': False}. Best is trial 25 with value: 0.22305900281606855.
[I 2025-12-06 03:38:06,351] Trial 31 finished with value: 0.21103281387733727 and parameters: {'model_type': 'mlp', 'hidden_dims': '[256, 128, 64]', 'dropout': 0.19057153400282983, 'batch_norm': True, 'lr': 9.496835659613369e-05, 'weight_decay': 5.220512687116622e-06, 'epochs': 176, 'loss': 'mae', 'optimizer': 'adam', 'graph_mode': 'off', 'use_snp_selection': False}. Best is trial 25 with value: 0.22305900281606855.
[I 2025-12-06 03:38:33,635] Trial 32 finished with value: 0.2075877361720718 and parameters: {'model_type': 'mlp', 'hidden_dims': '[256, 128, 64]', 'dropout': 0.17104285414025308, 'batch_norm': True, 'lr': 0.00011405956356513221, 'weight_decay': 9.986464602867525e-07, 'epochs': 158, 'loss': 'mae', 'optimizer': 'adam', 'graph_mode': 'off', 'use_snp_selection': False}. Best is trial 25 with value: 0.22305900281606855.
[I 2025-12-06 03:38:55,208] Trial 33 finished with value: 0.21559901396784165 and parameters: {'model_type': 'mlp', 'hidden_dims': '[256, 128, 64]', 'dropout': 0.28525956711764544, 'batch_norm': True, 'lr': 4.319555784304994e-05, 'weight_decay': 4.135013656806006e-06, 'epochs': 115, 'loss': 'mae', 'optimizer': 'adam', 'graph_mode': 'off', 'use_snp_selection': False}. Best is trial 25 with value: 0.22305900281606855.
[I 2025-12-06 03:39:31,245] Trial 34 finished with value: 0.2143653676424237 and parameters: {'model_type': 'mlp', 'hidden_dims': '[256, 128, 64]', 'dropout': 0.34894612109171835, 'batch_norm': True, 'lr': 7.71009901833702e-05, 'weight_decay': 1.3702734129724111e-06, 'epochs': 223, 'loss': 'mae', 'optimizer': 'adam', 'graph_mode': 'off', 'use_snp_selection': False}. Best is trial 25 with value: 0.22305900281606855.
[I 2025-12-06 03:40:48,313] Trial 35 finished with value: 0.21041324787805066 and parameters: {'model_type': 'mlp', 'hidden_dims': '[256, 128, 64]', 'dropout': 0.4544759458916865, 'batch_norm': True, 'lr': 0.0003775368996458793, 'weight_decay': 5.73846214341993e-07, 'epochs': 260, 'loss': 'mae', 'optimizer': 'adam', 'graph_mode': 'off', 'use_snp_selection': True, 'num_snps': 57586}. Best is trial 25 with value: 0.22305900281606855.
[I 2025-12-06 03:41:36,778] Trial 36 finished with value: 0.15326013651886852 and parameters: {'model_type': 'mlp', 'hidden_dims': '[512, 64]', 'dropout': 0.1337207826120511, 'batch_norm': True, 'lr': 2.506021548604049e-06, 'weight_decay': 2.4945119441829482e-06, 'epochs': 159, 'loss': 'mse', 'optimizer': 'adam', 'graph_mode': 'off', 'use_snp_selection': False}. Best is trial 25 with value: 0.22305900281606855.
[I 2025-12-06 03:42:20,558] Trial 37 finished with value: 0.11127780299352141 and parameters: {'model_type': 'mlp', 'hidden_dims': '[256, 128]', 'dropout': 0.23259229944772103, 'batch_norm': True, 'lr': 1.0889337760683574e-06, 'weight_decay': 9.096918760018813e-05, 'epochs': 195, 'loss': 'mae', 'optimizer': 'adam', 'graph_mode': 'off', 'use_snp_selection': True, 'num_snps': 22282}. Best is trial 25 with value: 0.22305900281606855.
[I 2025-12-06 03:43:02,134] Trial 38 finished with value: 0.20578598742103682 and parameters: {'model_type': 'mlp', 'hidden_dims': '[512, 256]', 'dropout': 0.38103892936675915, 'batch_norm': False, 'lr': 0.00013189654845430164, 'weight_decay': 1.1967607470285524e-05, 'epochs': 136, 'loss': 'mse', 'optimizer': 'adam', 'graph_mode': 'off', 'use_snp_selection': False}. Best is trial 25 with value: 0.22305900281606855.
[I 2025-12-06 03:44:00,848] Trial 39 finished with value: 0.2150884683265457 and parameters: {'model_type': 'mlp', 'hidden_dims': '[512, 64]', 'dropout': 0.4246116819735686, 'batch_norm': True, 'lr': 5.8032423746735654e-05, 'weight_decay': 7.899882269635577e-06, 'epochs': 198, 'loss': 'mae', 'optimizer': 'adam', 'graph_mode': 'off', 'use_snp_selection': False}. Best is trial 25 with value: 0.22305900281606855.
[I 2025-12-06 03:44:16,310] Trial 40 finished with value: 0.20054793873072935 and parameters: {'model_type': 'mlp', 'hidden_dims': '[256, 128, 64]', 'dropout': 0.20927599194134755, 'batch_norm': False, 'lr': 1.8886189123368274e-05, 'weight_decay': 1.0309317989085327e-06, 'epochs': 70, 'loss': 'mae', 'optimizer': 'adam', 'graph_mode': 'off', 'use_snp_selection': False}. Best is trial 25 with value: 0.22305900281606855.
[I 2025-12-06 03:45:50,374] Trial 41 finished with value: 0.2172117934202486 and parameters: {'model_type': 'mlp', 'hidden_dims': '[512, 128]', 'dropout': 0.16491503269155222, 'batch_norm': True, 'lr': 7.957998865588193e-05, 'weight_decay': 2.279516919910638e-05, 'epochs': 332, 'loss': 'mae', 'optimizer': 'adam', 'graph_mode': 'off', 'use_snp_selection': False}. Best is trial 25 with value: 0.22305900281606855.
[I 2025-12-06 03:47:24,419] Trial 42 finished with value: 0.21649339264386272 and parameters: {'model_type': 'mlp', 'hidden_dims': '[512, 128]', 'dropout': 0.13291748490633004, 'batch_norm': True, 'lr': 3.51444881997663e-05, 'weight_decay': 2.9149463505906414e-05, 'epochs': 331, 'loss': 'mae', 'optimizer': 'adam', 'graph_mode': 'off', 'use_snp_selection': False}. Best is trial 25 with value: 0.22305900281606855.
[I 2025-12-06 03:48:50,214] Trial 43 finished with value: 0.21492413451386558 and parameters: {'model_type': 'mlp', 'hidden_dims': '[512, 256]', 'dropout': 0.16721649992558799, 'batch_norm': True, 'lr': 5.4096734821067904e-05, 'weight_decay': 1.9878715883905854e-05, 'epochs': 298, 'loss': 'mae', 'optimizer': 'adam', 'graph_mode': 'off', 'use_snp_selection': False}. Best is trial 25 with value: 0.22305900281606855.
[I 2025-12-06 03:49:41,305] Trial 44 finished with value: 0.21725021101864023 and parameters: {'model_type': 'mlp', 'hidden_dims': '[256, 128]', 'dropout': 0.2505184396367674, 'batch_norm': True, 'lr': 7.231328157850358e-05, 'weight_decay': 1.0184235706113057e-05, 'epochs': 334, 'loss': 'mae', 'optimizer': 'adam', 'graph_mode': 'off', 'use_snp_selection': False}. Best is trial 25 with value: 0.22305900281606855.
[I 2025-12-06 03:50:22,666] Trial 45 finished with value: 0.1945280558082856 and parameters: {'model_type': 'mlp', 'hidden_dims': '[256, 128]', 'dropout': 0.27052360876246134, 'batch_norm': True, 'lr': 8.50304472963938e-06, 'weight_decay': 0.0004920745458667022, 'epochs': 262, 'loss': 'mse', 'optimizer': 'adam', 'graph_mode': 'off', 'use_snp_selection': False}. Best is trial 25 with value: 0.22305900281606855.
[I 2025-12-06 03:51:15,804] Trial 46 finished with value: 0.20998259779863795 and parameters: {'model_type': 'mlp', 'hidden_dims': '[256, 128]', 'dropout': 0.32327858092427975, 'batch_norm': True, 'lr': 2.979455196243364e-05, 'weight_decay': 1.0787189358038839e-05, 'epochs': 350, 'loss': 'mae', 'optimizer': 'adam', 'graph_mode': 'off', 'use_snp_selection': False}. Best is trial 25 with value: 0.22305900281606855.
[I 2025-12-06 03:51:46,603] Trial 47 finished with value: 0.19621283485830926 and parameters: {'model_type': 'mlp', 'hidden_dims': '[256, 128]', 'dropout': 0.24980217140884342, 'batch_norm': False, 'lr': 6.211546407591212e-05, 'weight_decay': 3.7804678113212706e-06, 'epochs': 189, 'loss': 'mse', 'optimizer': 'adam', 'graph_mode': 'off', 'use_snp_selection': False}. Best is trial 25 with value: 0.22305900281606855.
[I 2025-12-06 03:52:46,820] Trial 48 finished with value: 0.19443521309233805 and parameters: {'model_type': 'mlp', 'hidden_dims': '[512, 64]', 'dropout': 0.1950866816146985, 'batch_norm': True, 'lr': 1.7581572698168304e-05, 'weight_decay': 4.4220186124698443e-07, 'epochs': 102, 'loss': 'mae', 'optimizer': 'adam', 'graph_mode': 'off', 'use_snp_selection': True, 'num_snps': 43224}. Best is trial 25 with value: 0.22305900281606855.
[I 2025-12-06 03:53:35,691] Trial 49 finished with value: 0.2121931336601222 and parameters: {'model_type': 'mlp', 'hidden_dims': '[512, 256]', 'dropout': 0.28821268572903896, 'batch_norm': False, 'lr': 0.00019010046712438037, 'weight_decay': 1.73585700759828e-07, 'epochs': 164, 'loss': 'mae', 'optimizer': 'adam', 'graph_mode': 'off', 'use_snp_selection': False}. Best is trial 25 with value: 0.22305900281606855.
[I 2025-12-06 03:54:19,658] Trial 50 finished with value: 0.2029749939460122 and parameters: {'model_type': 'mlp', 'hidden_dims': '[256, 128]', 'dropout': 0.3642476024162514, 'batch_norm': True, 'lr': 0.00010889233744484542, 'weight_decay': 2.0310282755456136e-06, 'epochs': 282, 'loss': 'mse', 'optimizer': 'adam', 'graph_mode': 'off', 'use_snp_selection': False}. Best is trial 25 with value: 0.22305900281606855.
[I 2025-12-06 03:55:53,177] Trial 51 finished with value: 0.22087370396675174 and parameters: {'model_type': 'mlp', 'hidden_dims': '[512, 128]', 'dropout': 0.15479377200206682, 'batch_norm': True, 'lr': 8.0720058825478e-05, 'weight_decay': 3.7246427465483334e-05, 'epochs': 329, 'loss': 'mae', 'optimizer': 'adam', 'graph_mode': 'off', 'use_snp_selection': False}. Best is trial 25 with value: 0.22305900281606855.
[I 2025-12-06 03:57:25,695] Trial 52 finished with value: 0.2216023836430308 and parameters: {'model_type': 'mlp', 'hidden_dims': '[512, 64]', 'dropout': 0.233211220751374, 'batch_norm': True, 'lr': 4.372367054487213e-05, 'weight_decay': 3.2286436540774275e-05, 'epochs': 325, 'loss': 'mae', 'optimizer': 'adam', 'graph_mode': 'off', 'use_snp_selection': False}. Best is trial 25 with value: 0.22305900281606855.
[I 2025-12-06 03:58:51,715] Trial 53 finished with value: 0.21905101113779812 and parameters: {'model_type': 'mlp', 'hidden_dims': '[512, 64]', 'dropout': 0.18837313845600626, 'batch_norm': True, 'lr': 4.8257106622199184e-05, 'weight_decay': 7.106763910115927e-05, 'epochs': 300, 'loss': 'mae', 'optimizer': 'adam', 'graph_mode': 'off', 'use_snp_selection': False}. Best is trial 25 with value: 0.22305900281606855.
[I 2025-12-06 04:00:19,063] Trial 54 finished with value: 0.21630543242556088 and parameters: {'model_type': 'mlp', 'hidden_dims': '[512, 64]', 'dropout': 0.15259706595506997, 'batch_norm': True, 'lr': 4.478350397278905e-05, 'weight_decay': 7.54511853709438e-05, 'epochs': 305, 'loss': 'mae', 'optimizer': 'adam', 'graph_mode': 'off', 'use_snp_selection': False}. Best is trial 25 with value: 0.22305900281606855.
[I 2025-12-06 04:01:41,416] Trial 55 finished with value: 0.20650317303134402 and parameters: {'model_type': 'mlp', 'hidden_dims': '[512, 64]', 'dropout': 0.12016822219286208, 'batch_norm': False, 'lr': 1.2112591490117289e-05, 'weight_decay': 0.00018895400733675167, 'epochs': 289, 'loss': 'mae', 'optimizer': 'adam', 'graph_mode': 'off', 'use_snp_selection': False}. Best is trial 25 with value: 0.22305900281606855.
[I 2025-12-06 04:03:12,838] Trial 56 finished with value: 0.20837742137803503 and parameters: {'model_type': 'mlp', 'hidden_dims': '[512, 64]', 'dropout': 0.2253695106266243, 'batch_norm': True, 'lr': 1.9553348791795705e-05, 'weight_decay': 4.030293995621662e-05, 'epochs': 321, 'loss': 'mae', 'optimizer': 'adam', 'graph_mode': 'off', 'use_snp_selection': False}. Best is trial 25 with value: 0.22305900281606855.
[I 2025-12-06 04:04:50,317] Trial 57 finished with value: 0.2229033151601451 and parameters: {'model_type': 'mlp', 'hidden_dims': '[512, 64]', 'dropout': 0.11981837308049424, 'batch_norm': True, 'lr': 3.2597336100617986e-05, 'weight_decay': 6.121189869565623e-05, 'epochs': 344, 'loss': 'mae', 'optimizer': 'adam', 'graph_mode': 'off', 'use_snp_selection': False}. Best is trial 25 with value: 0.22305900281606855.
[I 2025-12-06 04:06:27,998] Trial 58 finished with value: 0.22311590048578916 and parameters: {'model_type': 'mlp', 'hidden_dims': '[512, 64]', 'dropout': 0.5659183372321085, 'batch_norm': True, 'lr': 3.194177524035504e-05, 'weight_decay': 6.624905509642193e-05, 'epochs': 345, 'loss': 'mae', 'optimizer': 'adam', 'graph_mode': 'off', 'use_snp_selection': False}. Best is trial 58 with value: 0.22311590048578916.
[I 2025-12-06 04:08:03,007] Trial 59 finished with value: 0.21223092441680155 and parameters: {'model_type': 'mlp', 'hidden_dims': '[512, 64]', 'dropout': 0.5666760590033735, 'batch_norm': False, 'lr': 9.706005285084151e-06, 'weight_decay': 4.378152538488634e-05, 'epochs': 339, 'loss': 'mae', 'optimizer': 'adam', 'graph_mode': 'off', 'use_snp_selection': False}. Best is trial 58 with value: 0.22311590048578916.
[I 2025-12-06 04:09:39,407] Trial 60 finished with value: 0.21809290644719384 and parameters: {'model_type': 'mlp', 'hidden_dims': '[512, 64]', 'dropout': 0.5997922157574546, 'batch_norm': True, 'lr': 2.9777422530723927e-05, 'weight_decay': 0.00015285667556568097, 'epochs': 340, 'loss': 'mae', 'optimizer': 'adam', 'graph_mode': 'off', 'use_snp_selection': False}. Best is trial 58 with value: 0.22311590048578916.
[I 2025-12-06 04:11:08,440] Trial 61 finished with value: 0.21189451832809447 and parameters: {'model_type': 'mlp', 'hidden_dims': '[512, 64]', 'dropout': 0.5531664167271754, 'batch_norm': True, 'lr': 4.4138693203835774e-05, 'weight_decay': 6.241636037300937e-05, 'epochs': 312, 'loss': 'mae', 'optimizer': 'adam', 'graph_mode': 'off', 'use_snp_selection': False}. Best is trial 58 with value: 0.22311590048578916.
[I 2025-12-06 04:12:40,462] Trial 62 finished with value: 0.21371463477457436 and parameters: {'model_type': 'mlp', 'hidden_dims': '[512, 64]', 'dropout': 0.5235712863281484, 'batch_norm': True, 'lr': 3.602573503665244e-05, 'weight_decay': 2.7668781128950907e-05, 'epochs': 323, 'loss': 'mae', 'optimizer': 'adam', 'graph_mode': 'off', 'use_snp_selection': False}. Best is trial 58 with value: 0.22311590048578916.
[I 2025-12-06 04:14:19,512] Trial 63 finished with value: 0.20940080742103384 and parameters: {'model_type': 'mlp', 'hidden_dims': '[512, 64]', 'dropout': 0.5803826471674324, 'batch_norm': True, 'lr': 2.2327561509230712e-05, 'weight_decay': 0.00012018246171032886, 'epochs': 350, 'loss': 'mae', 'optimizer': 'adam', 'graph_mode': 'off', 'use_snp_selection': False}. Best is trial 58 with value: 0.22311590048578916.
[I 2025-12-06 04:15:43,778] Trial 64 finished with value: 0.18767386227202093 and parameters: {'model_type': 'mlp', 'hidden_dims': '[512, 64]', 'dropout': 0.20578557602754263, 'batch_norm': True, 'lr': 4.2687564873331016e-06, 'weight_decay': 0.00024822823217122124, 'epochs': 294, 'loss': 'mae', 'optimizer': 'adam', 'graph_mode': 'off', 'use_snp_selection': False}. Best is trial 58 with value: 0.22311590048578916.
