[I 2025-12-05 14:35:48,074] Trial 63 finished with value: 0.038661101812227004 and parameters: {'model_type': 'mlp', 'hidden_dims': '[128, 64]', 'dropout': 0.45145937044510875, 'batch_norm': False, 'lr': 6.739371186818808e-05, 'weight_decay': 2.589929797801668e-06, 'epochs': 185, 'loss': 'mae', 'optimizer': 'adam', 'graph_mode': 'off', 'use_snp_selection': False}. Best is trial 44 with value: 0.11896642691647082.
[I 2025-12-05 14:35:49,120] Trial 64 finished with value: 0.09227891889041068 and parameters: {'model_type': 'mlp', 'hidden_dims': '[128, 64]', 'dropout': 0.4094303985158467, 'batch_norm': False, 'lr': 0.0006046934891596735, 'weight_decay': 1.3488793997866863e-06, 'epochs': 244, 'loss': 'mae', 'optimizer': 'adam', 'graph_mode': 'off', 'use_snp_selection': False}. Best is trial 44 with value: 0.11896642691647082.
[I 2025-12-05 14:35:50,150] Trial 65 finished with value: 0.032720150485820006 and parameters: {'model_type': 'mlp', 'hidden_dims': '[128, 64]', 'dropout': 0.48103000526249806, 'batch_norm': False, 'lr': 0.0004983327017758039, 'weight_decay': 1.2603846911316699e-06, 'epochs': 248, 'loss': 'mae', 'optimizer': 'adam', 'graph_mode': 'off', 'use_snp_selection': False}. Best is trial 44 with value: 0.11896642691647082.
[I 2025-12-05 14:35:51,160] Trial 66 finished with value: 0.0753805098421983 and parameters: {'model_type': 'mlp', 'hidden_dims': '[128, 64]', 'dropout': 0.41818901116106627, 'batch_norm': False, 'lr': 0.000531581213921887, 'weight_decay': 4.338608040576776e-07, 'epochs': 235, 'loss': 'mae', 'optimizer': 'adam', 'graph_mode': 'off', 'use_snp_selection': False}. Best is trial 44 with value: 0.11896642691647082.
[I 2025-12-05 14:35:52,522] Trial 67 finished with value: 0.05195139540828556 and parameters: {'model_type': 'mlp', 'hidden_dims': '[128, 64]', 'dropout': 0.4063940477442982, 'batch_norm': False, 'lr': 0.0008010388009888006, 'weight_decay': 7.030068268730803e-07, 'epochs': 205, 'loss': 'mae', 'optimizer': 'adam', 'graph_mode': 'off', 'use_snp_selection': True, 'num_snps': 10936}. Best is trial 44 with value: 0.11896642691647082.
[I 2025-12-05 14:35:53,588] Trial 68 finished with value: 0.047288473099868104 and parameters: {'model_type': 'mlp', 'hidden_dims': '[128, 64]', 'dropout': 0.3718868535494825, 'batch_norm': False, 'lr': 1.083602449748085e-06, 'weight_decay': 1.622637855163162e-06, 'epochs': 270, 'loss': 'mse', 'optimizer': 'adam', 'graph_mode': 'off', 'use_snp_selection': False}. Best is trial 44 with value: 0.11896642691647082.
[I 2025-12-05 14:35:54,465] Trial 69 finished with value: 0.047656472771160606 and parameters: {'model_type': 'mlp', 'hidden_dims': '[128, 64]', 'dropout': 0.5191028788010755, 'batch_norm': False, 'lr': 0.0005715781335643987, 'weight_decay': 8.280468243938158e-07, 'epochs': 163, 'loss': 'mae', 'optimizer': 'adam', 'graph_mode': 'off', 'use_snp_selection': False}. Best is trial 44 with value: 0.11896642691647082.
[I 2025-12-05 14:35:57,275] Trial 70 finished with value: 0.05629212519186143 and parameters: {'model_type': 'mlp', 'hidden_dims': '[256, 128, 64]', 'dropout': 0.44162009613791686, 'batch_norm': False, 'lr': 0.000251672876825404, 'weight_decay': 1.0342128938454546e-06, 'epochs': 210, 'loss': 'mae', 'optimizer': 'adam', 'graph_mode': 'off', 'use_snp_selection': True, 'num_snps': 47497}. Best is trial 44 with value: 0.11896642691647082.
[I 2025-12-05 14:35:59,712] Trial 71 finished with value: 0.043996001342688655 and parameters: {'model_type': 'mlp', 'hidden_dims': '[512, 128]', 'dropout': 0.39355763766387114, 'batch_norm': False, 'lr': 0.0006663793390624316, 'weight_decay': 1.7880178969310643e-06, 'epochs': 230, 'loss': 'mae', 'optimizer': 'adam', 'graph_mode': 'off', 'use_snp_selection': False}. Best is trial 44 with value: 0.11896642691647082.
[I 2025-12-05 14:36:00,663] Trial 72 finished with value: 0.06806461404832957 and parameters: {'model_type': 'mlp', 'hidden_dims': '[128, 64]', 'dropout': 0.4243180868515552, 'batch_norm': False, 'lr': 3.869205471099909e-05, 'weight_decay': 2.3924831455202926e-05, 'epochs': 194, 'loss': 'mae', 'optimizer': 'adam', 'graph_mode': 'off', 'use_snp_selection': False}. Best is trial 44 with value: 0.11896642691647082.
[I 2025-12-05 14:36:02,078] Trial 73 finished with value: 0.08903039194449272 and parameters: {'model_type': 'mlp', 'hidden_dims': '[256, 128]', 'dropout': 0.3754091722447857, 'batch_norm': False, 'lr': 2.5346771078464277e-05, 'weight_decay': 2.2946629527471187e-06, 'epochs': 218, 'loss': 'mae', 'optimizer': 'adam', 'graph_mode': 'off', 'use_snp_selection': False}. Best is trial 44 with value: 0.11896642691647082.
[I 2025-12-05 14:36:04,119] Trial 74 finished with value: 0.09675460036090028 and parameters: {'model_type': 'mlp', 'hidden_dims': '[512, 128]', 'dropout': 0.3322530584471498, 'batch_norm': False, 'lr': 0.0009623891392349109, 'weight_decay': 1.0347172608772256e-05, 'epochs': 176, 'loss': 'mae', 'optimizer': 'adam', 'graph_mode': 'off', 'use_snp_selection': False}. Best is trial 44 with value: 0.11896642691647082.
[I 2025-12-05 14:36:06,161] Trial 75 finished with value: 0.07776839821906922 and parameters: {'model_type': 'mlp', 'hidden_dims': '[512, 128]', 'dropout': 0.34273472084626405, 'batch_norm': False, 'lr': 0.00041919956251818734, 'weight_decay': 1.1117894458708276e-05, 'epochs': 176, 'loss': 'mae', 'optimizer': 'adam', 'graph_mode': 'off', 'use_snp_selection': False}. Best is trial 44 with value: 0.11896642691647082.
[I 2025-12-05 14:36:08,380] Trial 76 finished with value: 0.08897554109121762 and parameters: {'model_type': 'mlp', 'hidden_dims': '[512, 128]', 'dropout': 0.3176329188205761, 'batch_norm': False, 'lr': 0.0008460847361244589, 'weight_decay': 6.842085521668146e-06, 'epochs': 199, 'loss': 'mae', 'optimizer': 'adam', 'graph_mode': 'off', 'use_snp_selection': False}. Best is trial 44 with value: 0.11896642691647082.
[I 2025-12-05 14:36:10,256] Trial 77 finished with value: 0.004631402613061343 and parameters: {'model_type': 'mlp', 'hidden_dims': '[512, 128]', 'dropout': 0.3582062240601663, 'batch_norm': False, 'lr': 0.0006407845070369013, 'weight_decay': 1.244402864259968e-06, 'epochs': 153, 'loss': 'mse', 'optimizer': 'adam', 'graph_mode': 'off', 'use_snp_selection': False}. Best is trial 44 with value: 0.11896642691647082.
[I 2025-12-05 14:36:12,349] Trial 78 finished with value: 0.07817233488510823 and parameters: {'model_type': 'mlp', 'hidden_dims': '[512, 128]', 'dropout': 0.32853443050100767, 'batch_norm': True, 'lr': 0.00046769499667397924, 'weight_decay': 3.7438054420494046e-06, 'epochs': 172, 'loss': 'mae', 'optimizer': 'adam', 'graph_mode': 'off', 'use_snp_selection': True, 'num_snps': 25397}. Best is trial 44 with value: 0.11896642691647082.
[I 2025-12-05 14:36:13,269] Trial 79 finished with value: 0.03805784608938433 and parameters: {'model_type': 'mlp', 'hidden_dims': '[128, 64]', 'dropout': 0.36387407130105126, 'batch_norm': False, 'lr': 0.0009132237657834898, 'weight_decay': 2.397773668131143e-07, 'epochs': 185, 'loss': 'mae', 'optimizer': 'adam', 'graph_mode': 'off', 'use_snp_selection': False}. Best is trial 44 with value: 0.11896642691647082.
[I 2025-12-05 14:36:16,399] Trial 80 finished with value: 0.07800541006096931 and parameters: {'model_type': 'mlp', 'hidden_dims': '[512, 128]', 'dropout': 0.47894078047969857, 'batch_norm': False, 'lr': 0.00031037874384174844, 'weight_decay': 5.347331919275216e-07, 'epochs': 324, 'loss': 'mae', 'optimizer': 'adam', 'graph_mode': 'off', 'use_snp_selection': False}. Best is trial 44 with value: 0.11896642691647082.
[I 2025-12-05 14:36:17,902] Trial 81 finished with value: 0.08117818576458008 and parameters: {'model_type': 'mlp', 'hidden_dims': '[256, 128]', 'dropout': 0.38812288657805516, 'batch_norm': False, 'lr': 2.979847095180417e-05, 'weight_decay': 1.3526985396514217e-05, 'epochs': 245, 'loss': 'mae', 'optimizer': 'adam', 'graph_mode': 'off', 'use_snp_selection': False}. Best is trial 44 with value: 0.11896642691647082.
[I 2025-12-05 14:36:19,382] Trial 82 finished with value: 0.09549452573404602 and parameters: {'model_type': 'mlp', 'hidden_dims': '[256, 128]', 'dropout': 0.40268656727047847, 'batch_norm': False, 'lr': 0.0009854632205622273, 'weight_decay': 9.463157808475476e-06, 'epochs': 236, 'loss': 'mae', 'optimizer': 'adam', 'graph_mode': 'off', 'use_snp_selection': False}. Best is trial 44 with value: 0.11896642691647082.
[I 2025-12-05 14:36:21,870] Trial 83 finished with value: 0.0805526346708987 and parameters: {'model_type': 'mlp', 'hidden_dims': '[512, 128]', 'dropout': 0.413003358043457, 'batch_norm': False, 'lr': 0.0009711436947308996, 'weight_decay': 9.71451124630431e-06, 'epochs': 237, 'loss': 'mae', 'optimizer': 'adam', 'graph_mode': 'off', 'use_snp_selection': False}. Best is trial 44 with value: 0.11896642691647082.
[I 2025-12-05 14:36:23,411] Trial 84 finished with value: 0.08702987512982832 and parameters: {'model_type': 'mlp', 'hidden_dims': '[256, 128, 64]', 'dropout': 0.45123142624961055, 'batch_norm': False, 'lr': 0.0006101350292759783, 'weight_decay': 2.406022017434339e-06, 'epochs': 254, 'loss': 'mae', 'optimizer': 'adam', 'graph_mode': 'off', 'use_snp_selection': False}. Best is trial 44 with value: 0.11896642691647082.
[I 2025-12-05 14:36:25,724] Trial 85 finished with value: 0.02584317604656477 and parameters: {'model_type': 'mlp', 'hidden_dims': '[512, 64]', 'dropout': 0.40041122434415444, 'batch_norm': False, 'lr': 0.0007173765138679406, 'weight_decay': 0.0004262928681812018, 'epochs': 211, 'loss': 'mae', 'optimizer': 'adam', 'graph_mode': 'off', 'use_snp_selection': False}. Best is trial 44 with value: 0.11896642691647082.
[I 2025-12-05 14:36:26,657] Trial 86 finished with value: 0.06066683090618424 and parameters: {'model_type': 'mlp', 'hidden_dims': '[128, 64]', 'dropout': 0.4292076417222063, 'batch_norm': False, 'lr': 0.0002317380221335328, 'weight_decay': 1.3712466395875054e-06, 'epochs': 196, 'loss': 'mse', 'optimizer': 'adam', 'graph_mode': 'off', 'use_snp_selection': False}. Best is trial 44 with value: 0.11896642691647082.
[I 2025-12-05 14:36:29,792] Trial 87 finished with value: 0.08781519863738413 and parameters: {'model_type': 'mlp', 'hidden_dims': '[256, 128]', 'dropout': 0.40584614471139413, 'batch_norm': False, 'lr': 0.00013653982182543797, 'weight_decay': 3.2989300026596194e-06, 'epochs': 230, 'loss': 'mae', 'optimizer': 'adam', 'graph_mode': 'off', 'use_snp_selection': True, 'num_snps': 55786}. Best is trial 44 with value: 0.11896642691647082.
[I 2025-12-05 14:36:31,592] Trial 88 finished with value: 0.07774818939818585 and parameters: {'model_type': 'mlp', 'hidden_dims': '[512, 128]', 'dropout': 0.5443395747131885, 'batch_norm': True, 'lr': 0.00043805559302061435, 'weight_decay': 6.509838585452848e-05, 'epochs': 142, 'loss': 'mae', 'optimizer': 'adam', 'graph_mode': 'off', 'use_snp_selection': False}. Best is trial 44 with value: 0.11896642691647082.
[I 2025-12-05 14:36:32,833] Trial 89 finished with value: 0.0583239151027481 and parameters: {'model_type': 'mlp', 'hidden_dims': '[512, 256]', 'dropout': 0.3532175062676989, 'batch_norm': False, 'lr': 9.19578659840292e-05, 'weight_decay': 2.0304013267526357e-05, 'epochs': 67, 'loss': 'mae', 'optimizer': 'adam', 'graph_mode': 'off', 'use_snp_selection': False}. Best is trial 44 with value: 0.11896642691647082.
[I 2025-12-05 14:36:35,110] Trial 90 finished with value: 0.041624570001772554 and parameters: {'model_type': 'mlp', 'hidden_dims': '[512, 128]', 'dropout': 0.10905343694424474, 'batch_norm': False, 'lr': 0.0009914969888066966, 'weight_decay': 1.0148414790878579e-06, 'epochs': 208, 'loss': 'mse', 'optimizer': 'adam', 'graph_mode': 'off', 'use_snp_selection': False}. Best is trial 44 with value: 0.11896642691647082.
[I 2025-12-05 14:36:36,523] Trial 91 finished with value: 0.08734699994854472 and parameters: {'model_type': 'mlp', 'hidden_dims': '[256, 128]', 'dropout': 0.3787443790211789, 'batch_norm': False, 'lr': 4.651078323228047e-05, 'weight_decay': 3.052314122990734e-05, 'epochs': 221, 'loss': 'mae', 'optimizer': 'adam', 'graph_mode': 'off', 'use_snp_selection': False}. Best is trial 44 with value: 0.11896642691647082.
[I 2025-12-05 14:36:37,921] Trial 92 finished with value: 0.10133822190002716 and parameters: {'model_type': 'mlp', 'hidden_dims': '[256, 128]', 'dropout': 0.30303020977287254, 'batch_norm': False, 'lr': 5.9953157902259254e-05, 'weight_decay': 1.9658926664257136e-06, 'epochs': 216, 'loss': 'mae', 'optimizer': 'adam', 'graph_mode': 'off', 'use_snp_selection': False}. Best is trial 44 with value: 0.11896642691647082.
[I 2025-12-05 14:36:39,182] Trial 93 finished with value: 0.07021992433418302 and parameters: {'model_type': 'mlp', 'hidden_dims': '[256, 128]', 'dropout': 0.30286038792976444, 'batch_norm': False, 'lr': 5.9559261157228496e-05, 'weight_decay': 4.680644664645592e-06, 'epochs': 179, 'loss': 'mae', 'optimizer': 'adam', 'graph_mode': 'off', 'use_snp_selection': False}. Best is trial 44 with value: 0.11896642691647082.
[I 2025-12-05 14:36:40,473] Trial 94 finished with value: 0.08997401536835115 and parameters: {'model_type': 'mlp', 'hidden_dims': '[256, 128]', 'dropout': 0.5685608222128969, 'batch_norm': False, 'lr': 2.2621287922121833e-05, 'weight_decay': 2.935347916802196e-06, 'epochs': 188, 'loss': 'mae', 'optimizer': 'adam', 'graph_mode': 'off', 'use_snp_selection': False}. Best is trial 44 with value: 0.11896642691647082.
[I 2025-12-05 14:36:41,882] Trial 95 finished with value: 0.09270058358801256 and parameters: {'model_type': 'mlp', 'hidden_dims': '[256, 128]', 'dropout': 0.26930021877647636, 'batch_norm': False, 'lr': 1.5053673815846404e-05, 'weight_decay': 1.0152988468299742e-06, 'epochs': 217, 'loss': 'mae', 'optimizer': 'adam', 'graph_mode': 'off', 'use_snp_selection': False}. Best is trial 44 with value: 0.11896642691647082.
[I 2025-12-05 14:36:43,284] Trial 96 finished with value: 0.01794655868617586 and parameters: {'model_type': 'mlp', 'hidden_dims': '[256, 128]', 'dropout': 0.2572528380119882, 'batch_norm': True, 'lr': 1.546377464803806e-05, 'weight_decay': 2.0399867939948646e-06, 'epochs': 215, 'loss': 'mae', 'optimizer': 'adam', 'graph_mode': 'off', 'use_snp_selection': False}. Best is trial 44 with value: 0.11896642691647082.
[I 2025-12-05 14:36:45,443] Trial 97 finished with value: 0.06464968370965951 and parameters: {'model_type': 'mlp', 'hidden_dims': '[256, 128]', 'dropout': 0.27162130541361995, 'batch_norm': False, 'lr': 1.4659977434782699e-05, 'weight_decay': 9.594925182131392e-07, 'epochs': 166, 'loss': 'mae', 'optimizer': 'adam', 'graph_mode': 'off', 'use_snp_selection': True, 'num_snps': 34851}. Best is trial 44 with value: 0.11896642691647082.
[I 2025-12-05 14:36:46,788] Trial 98 finished with value: 0.10193626783745685 and parameters: {'model_type': 'mlp', 'hidden_dims': '[256, 128]', 'dropout': 0.2685602441086815, 'batch_norm': False, 'lr': 3.5610648965383845e-05, 'weight_decay': 3.3083629861110085e-07, 'epochs': 203, 'loss': 'mae', 'optimizer': 'adam', 'graph_mode': 'off', 'use_snp_selection': False}. Best is trial 44 with value: 0.11896642691647082.
[I 2025-12-05 14:36:48,102] Trial 99 finished with value: 0.06862512955696205 and parameters: {'model_type': 'mlp', 'hidden_dims': '[256, 128]', 'dropout': 0.33029842297036005, 'batch_norm': False, 'lr': 3.659392986219286e-05, 'weight_decay': 1.7109037470722295e-07, 'epochs': 194, 'loss': 'mae', 'optimizer': 'adam', 'graph_mode': 'off', 'use_snp_selection': False}. Best is trial 44 with value: 0.11896642691647082.
[I 2025-12-05 14:36:49,457] Trial 100 finished with value: 0.053122907257600896 and parameters: {'model_type': 'mlp', 'hidden_dims': '[256, 128]', 'dropout': 0.5987742026777311, 'batch_norm': False, 'lr': 5.0278646522136075e-05, 'weight_decay': 3.265941437495668e-07, 'epochs': 205, 'loss': 'mse', 'optimizer': 'adam', 'graph_mode': 'off', 'use_snp_selection': False}. Best is trial 44 with value: 0.11896642691647082.
[I 2025-12-05 14:36:50,888] Trial 101 finished with value: 0.07594826421960577 and parameters: {'model_type': 'mlp', 'hidden_dims': '[256, 128]', 'dropout': 0.27793410460841667, 'batch_norm': False, 'lr': 2.1541671700180556e-05, 'weight_decay': 4.392979784535001e-07, 'epochs': 226, 'loss': 'mae', 'optimizer': 'adam', 'graph_mode': 'off', 'use_snp_selection': False}. Best is trial 44 with value: 0.11896642691647082.
[I 2025-12-05 14:36:52,244] Trial 102 finished with value: 0.08035873662767407 and parameters: {'model_type': 'mlp', 'hidden_dims': '[256, 128]', 'dropout': 0.2993711485867891, 'batch_norm': False, 'lr': 2.8705901566780013e-05, 'weight_decay': 6.349156671124577e-07, 'epochs': 204, 'loss': 'mae', 'optimizer': 'adam', 'graph_mode': 'off', 'use_snp_selection': False}. Best is trial 44 with value: 0.11896642691647082.
[I 2025-12-05 14:36:53,705] Trial 103 finished with value: 0.06549063039652134 and parameters: {'model_type': 'mlp', 'hidden_dims': '[256, 128]', 'dropout': 0.31020210102312573, 'batch_norm': False, 'lr': 3.251340517584025e-05, 'weight_decay': 5.121678315175706e-07, 'epochs': 233, 'loss': 'mae', 'optimizer': 'adam', 'graph_mode': 'off', 'use_snp_selection': False}. Best is trial 44 with value: 0.11896642691647082.
[I 2025-12-05 14:36:55,034] Trial 104 finished with value: 0.09631992440789944 and parameters: {'model_type': 'mlp', 'hidden_dims': '[256, 128]', 'dropout': 0.22584417140579907, 'batch_norm': False, 'lr': 6.007016595520483e-05, 'weight_decay': 7.228053996848163e-07, 'epochs': 198, 'loss': 'mae', 'optimizer': 'adam', 'graph_mode': 'off', 'use_snp_selection': False}. Best is trial 44 with value: 0.11896642691647082.
[I 2025-12-05 14:36:57,183] Trial 105 finished with value: 0.09348596937649999 and parameters: {'model_type': 'mlp', 'hidden_dims': '[512, 256]', 'dropout': 0.20620686381067185, 'batch_norm': False, 'lr': 6.99936272561646e-05, 'weight_decay': 1.4097258851081845e-07, 'epochs': 189, 'loss': 'mae', 'optimizer': 'adam', 'graph_mode': 'off', 'use_snp_selection': False}. Best is trial 44 with value: 0.11896642691647082.
[I 2025-12-05 14:36:59,412] Trial 106 finished with value: 0.070306309344844 and parameters: {'model_type': 'mlp', 'hidden_dims': '[512, 128]', 'dropout': 0.22197492920886333, 'batch_norm': True, 'lr': 6.2671690224538e-05, 'weight_decay': 3.056008581562429e-07, 'epochs': 200, 'loss': 'mae', 'optimizer': 'adam', 'graph_mode': 'off', 'use_snp_selection': False}. Best is trial 44 with value: 0.11896642691647082.
[I 2025-12-05 14:37:01,824] Trial 107 finished with value: 0.07832896031177097 and parameters: {'model_type': 'mlp', 'hidden_dims': '[256, 128]', 'dropout': 0.2348024204016404, 'batch_norm': False, 'lr': 9.215020795734156e-05, 'weight_decay': 2.4011738143559695e-07, 'epochs': 171, 'loss': 'mae', 'optimizer': 'adam', 'graph_mode': 'off', 'use_snp_selection': True, 'num_snps': 41381}. Best is trial 44 with value: 0.11896642691647082.
[I 2025-12-05 14:37:03,913] Trial 108 finished with value: 0.0949610192276769 and parameters: {'model_type': 'mlp', 'hidden_dims': '[512, 128]', 'dropout': 0.29175459608417625, 'batch_norm': False, 'lr': 4.260754325768717e-05, 'weight_decay': 6.652025112517577e-07, 'epochs': 182, 'loss': 'mae', 'optimizer': 'adam', 'graph_mode': 'off', 'use_snp_selection': False}. Best is trial 44 with value: 0.11896642691647082.
[I 2025-12-05 14:37:06,250] Trial 109 finished with value: 0.09503718702127531 and parameters: {'model_type': 'mlp', 'hidden_dims': '[512, 64]', 'dropout': 0.1868825630530962, 'batch_norm': False, 'lr': 5.335672957816322e-05, 'weight_decay': 3.470070209453015e-07, 'epochs': 214, 'loss': 'mae', 'optimizer': 'adam', 'graph_mode': 'off', 'use_snp_selection': False}. Best is trial 44 with value: 0.11896642691647082.
[I 2025-12-05 14:37:07,571] Trial 110 finished with value: 0.08830448507028854 and parameters: {'model_type': 'mlp', 'hidden_dims': '[256, 128]', 'dropout': 0.24271108521182502, 'batch_norm': False, 'lr': 7.966707270072559e-05, 'weight_decay': 1.909600348594003e-06, 'epochs': 193, 'loss': 'mae', 'optimizer': 'adam', 'graph_mode': 'off', 'use_snp_selection': False}. Best is trial 44 with value: 0.11896642691647082.
[I 2025-12-05 14:37:09,872] Trial 111 finished with value: 0.08846768176692277 and parameters: {'model_type': 'mlp', 'hidden_dims': '[512, 64]', 'dropout': 0.22511188315731678, 'batch_norm': False, 'lr': 5.4715339994574995e-05, 'weight_decay': 3.4468079756727667e-07, 'epochs': 210, 'loss': 'mae', 'optimizer': 'adam', 'graph_mode': 'off', 'use_snp_selection': False}. Best is trial 44 with value: 0.11896642691647082.
[I 2025-12-05 14:37:12,226] Trial 112 finished with value: 0.09392025012644152 and parameters: {'model_type': 'mlp', 'hidden_dims': '[512, 256]', 'dropout': 0.19786371217600085, 'batch_norm': False, 'lr': 3.5659672088922146e-05, 'weight_decay': 3.8812702044752653e-07, 'epochs': 216, 'loss': 'mae', 'optimizer': 'adam', 'graph_mode': 'off', 'use_snp_selection': False}. Best is trial 44 with value: 0.11896642691647082.
[I 2025-12-05 14:37:14,628] Trial 113 finished with value: 0.08927953433175055 and parameters: {'model_type': 'mlp', 'hidden_dims': '[512, 64]', 'dropout': 0.18505829298982324, 'batch_norm': False, 'lr': 4.6852718280808134e-05, 'weight_decay': 2.53181037667914e-07, 'epochs': 225, 'loss': 'mae', 'optimizer': 'adam', 'graph_mode': 'off', 'use_snp_selection': False}. Best is trial 44 with value: 0.11896642691647082.
[I 2025-12-05 14:37:16,841] Trial 114 finished with value: 0.09219335580760425 and parameters: {'model_type': 'mlp', 'hidden_dims': '[512, 64]', 'dropout': 0.31815184502940086, 'batch_norm': False, 'lr': 0.00011113525305518856, 'weight_decay': 8.118832849709993e-07, 'epochs': 198, 'loss': 'mae', 'optimizer': 'adam', 'graph_mode': 'off', 'use_snp_selection': False}. Best is trial 44 with value: 0.11896642691647082.
