[I 2025-12-05 15:57:50,371] Trial 94 finished with value: 0.08882064896958224 and parameters: {'model_type': 'mlp', 'hidden_dims': '[512, 64]', 'dropout': 0.35778892653593247, 'batch_norm': True, 'lr': 4.04680623891339e-05, 'weight_decay': 7.79769537248667e-06, 'epochs': 232, 'loss': 'mae', 'optimizer': 'adam', 'graph_mode': 'off', 'use_snp_selection': False}. Best is trial 71 with value: 0.12288803506235363.
[I 2025-12-05 15:57:51,775] Trial 95 finished with value: 0.09369704261561178 and parameters: {'model_type': 'mlp', 'hidden_dims': '[512, 64]', 'dropout': 0.3981558531301749, 'batch_norm': True, 'lr': 9.820230288437866e-05, 'weight_decay': 4.87609864828084e-06, 'epochs': 168, 'loss': 'mae', 'optimizer': 'adam', 'graph_mode': 'off', 'use_snp_selection': False}. Best is trial 71 with value: 0.12288803506235363.
[I 2025-12-05 15:57:53,320] Trial 96 finished with value: 0.09342921430244505 and parameters: {'model_type': 'mlp', 'hidden_dims': '[512, 64]', 'dropout': 0.4581710547904458, 'batch_norm': False, 'lr': 6.266649121735209e-05, 'weight_decay': 5.887942051545646e-06, 'epochs': 198, 'loss': 'mae', 'optimizer': 'adam', 'graph_mode': 'off', 'use_snp_selection': False}. Best is trial 71 with value: 0.12288803506235363.
[I 2025-12-05 15:57:54,995] Trial 97 finished with value: 0.0828937831982905 and parameters: {'model_type': 'mlp', 'hidden_dims': '[512, 64]', 'dropout': 0.2375753860082286, 'batch_norm': True, 'lr': 7.692770163802106e-06, 'weight_decay': 1.181932930719559e-06, 'epochs': 224, 'loss': 'mae', 'optimizer': 'adam', 'graph_mode': 'off', 'use_snp_selection': False}. Best is trial 71 with value: 0.12288803506235363.
[I 2025-12-05 15:57:56,587] Trial 98 finished with value: 0.08334262206294102 and parameters: {'model_type': 'mlp', 'hidden_dims': '[512, 64]', 'dropout': 0.4149294740707889, 'batch_norm': True, 'lr': 3.25451512152859e-05, 'weight_decay': 9.324411657266708e-06, 'epochs': 208, 'loss': 'mse', 'optimizer': 'adam', 'graph_mode': 'off', 'use_snp_selection': False}. Best is trial 71 with value: 0.12288803506235363.
[I 2025-12-05 15:57:57,637] Trial 99 finished with value: 0.05157737329564042 and parameters: {'model_type': 'mlp', 'hidden_dims': '[256, 128, 64]', 'dropout': 0.3486119644922276, 'batch_norm': True, 'lr': 4.970287413059646e-06, 'weight_decay': 1.955889287988042e-05, 'epochs': 191, 'loss': 'mae', 'optimizer': 'adam', 'graph_mode': 'off', 'use_snp_selection': False}. Best is trial 71 with value: 0.12288803506235363.
[I 2025-12-05 15:57:58,472] Trial 100 finished with value: 0.08013427700406342 and parameters: {'model_type': 'mlp', 'hidden_dims': '[128, 64]', 'dropout': 0.44509753164968097, 'batch_norm': False, 'lr': 0.00011508066178024848, 'weight_decay': 2.339577126523389e-05, 'epochs': 237, 'loss': 'mae', 'optimizer': 'adam', 'graph_mode': 'off', 'use_snp_selection': False}. Best is trial 71 with value: 0.12288803506235363.
[I 2025-12-05 15:57:59,587] Trial 101 finished with value: 0.09498167433551591 and parameters: {'model_type': 'mlp', 'hidden_dims': '[256, 128]', 'dropout': 0.32304529757458045, 'batch_norm': False, 'lr': 4.6136227075192254e-05, 'weight_decay': 1.5892085879557783e-06, 'epochs': 216, 'loss': 'mse', 'optimizer': 'adam', 'graph_mode': 'off', 'use_snp_selection': False}. Best is trial 71 with value: 0.12288803506235363.
[I 2025-12-05 15:58:00,664] Trial 102 finished with value: 0.07583941598171318 and parameters: {'model_type': 'mlp', 'hidden_dims': '[256, 128]', 'dropout': 0.36589586833075005, 'batch_norm': False, 'lr': 2.6717050127295955e-05, 'weight_decay': 5.233665594057064e-07, 'epochs': 202, 'loss': 'mse', 'optimizer': 'adam', 'graph_mode': 'off', 'use_snp_selection': False}. Best is trial 71 with value: 0.12288803506235363.
[I 2025-12-05 15:58:01,830] Trial 103 finished with value: 0.08312736964497805 and parameters: {'model_type': 'mlp', 'hidden_dims': '[256, 128]', 'dropout': 0.21540638515825486, 'batch_norm': False, 'lr': 7.152022344490836e-05, 'weight_decay': 3.0027083230840298e-06, 'epochs': 244, 'loss': 'mse', 'optimizer': 'adam', 'graph_mode': 'off', 'use_snp_selection': False}. Best is trial 71 with value: 0.12288803506235363.
[I 2025-12-05 15:58:02,888] Trial 104 finished with value: 0.08210096619517536 and parameters: {'model_type': 'mlp', 'hidden_dims': '[256, 128]', 'dropout': 0.37428716003874707, 'batch_norm': False, 'lr': 4.1260568554077646e-05, 'weight_decay': 0.0005081805662106268, 'epochs': 194, 'loss': 'mse', 'optimizer': 'adam', 'graph_mode': 'off', 'use_snp_selection': False}. Best is trial 71 with value: 0.12288803506235363.
[I 2025-12-05 15:58:04,301] Trial 105 finished with value: 0.09310571691704748 and parameters: {'model_type': 'mlp', 'hidden_dims': '[512, 64]', 'dropout': 0.36190915790880934, 'batch_norm': False, 'lr': 3.615210206554649e-05, 'weight_decay': 1.0448107117670882e-06, 'epochs': 175, 'loss': 'mse', 'optimizer': 'adam', 'graph_mode': 'off', 'use_snp_selection': False}. Best is trial 71 with value: 0.12288803506235363.
[I 2025-12-05 15:58:05,933] Trial 106 finished with value: 0.08457246638839262 and parameters: {'model_type': 'mlp', 'hidden_dims': '[512, 256]', 'dropout': 0.4103077210827016, 'batch_norm': True, 'lr': 2.305567400519349e-05, 'weight_decay': 6.472955789128369e-06, 'epochs': 215, 'loss': 'mse', 'optimizer': 'adam', 'graph_mode': 'off', 'use_snp_selection': False}. Best is trial 71 with value: 0.12288803506235363.
[I 2025-12-05 15:58:07,524] Trial 107 finished with value: 0.09444890425538664 and parameters: {'model_type': 'mlp', 'hidden_dims': '[512, 64]', 'dropout': 0.30482637720398603, 'batch_norm': True, 'lr': 3.035013765135066e-05, 'weight_decay': 2.2525386265609643e-06, 'epochs': 205, 'loss': 'mae', 'optimizer': 'adam', 'graph_mode': 'off', 'use_snp_selection': False}. Best is trial 71 with value: 0.12288803506235363.
[I 2025-12-05 15:58:09,210] Trial 108 finished with value: 0.11415611997821366 and parameters: {'model_type': 'mlp', 'hidden_dims': '[512, 64]', 'dropout': 0.34254370519432326, 'batch_norm': True, 'lr': 5.6777405749099496e-05, 'weight_decay': 1.0461329406272166e-05, 'epochs': 230, 'loss': 'mae', 'optimizer': 'adam', 'graph_mode': 'off', 'use_snp_selection': True, 'num_snps': 24773}. Best is trial 71 with value: 0.12288803506235363.
[I 2025-12-05 15:58:10,835] Trial 109 finished with value: 0.12967053490485272 and parameters: {'model_type': 'mlp', 'hidden_dims': '[512, 64]', 'dropout': 0.34215339523761906, 'batch_norm': True, 'lr': 5.211928664964906e-05, 'weight_decay': 1.243795966992451e-05, 'epochs': 230, 'loss': 'mae', 'optimizer': 'adam', 'graph_mode': 'off', 'use_snp_selection': True, 'num_snps': 24718}. Best is trial 109 with value: 0.12967053490485272.
[I 2025-12-05 15:58:12,553] Trial 110 finished with value: 0.12313658711221066 and parameters: {'model_type': 'mlp', 'hidden_dims': '[512, 64]', 'dropout': 0.26449731790377623, 'batch_norm': True, 'lr': 5.342804242510634e-05, 'weight_decay': 1.4487248675166519e-05, 'epochs': 229, 'loss': 'mae', 'optimizer': 'adam', 'graph_mode': 'off', 'use_snp_selection': True, 'num_snps': 25860}. Best is trial 109 with value: 0.12967053490485272.
[I 2025-12-05 15:58:14,363] Trial 111 finished with value: 0.12583334001031019 and parameters: {'model_type': 'mlp', 'hidden_dims': '[512, 64]', 'dropout': 0.26858550458924246, 'batch_norm': True, 'lr': 5.505065133157496e-05, 'weight_decay': 1.3055700935837419e-05, 'epochs': 222, 'loss': 'mae', 'optimizer': 'adam', 'graph_mode': 'off', 'use_snp_selection': True, 'num_snps': 26453}. Best is trial 109 with value: 0.12967053490485272.
[I 2025-12-05 15:58:16,278] Trial 112 finished with value: 0.09939861973235696 and parameters: {'model_type': 'mlp', 'hidden_dims': '[512, 64]', 'dropout': 0.25398127157413114, 'batch_norm': True, 'lr': 5.234851570934894e-05, 'weight_decay': 1.6266032684602915e-05, 'epochs': 237, 'loss': 'mae', 'optimizer': 'adam', 'graph_mode': 'off', 'use_snp_selection': True, 'num_snps': 29966}. Best is trial 109 with value: 0.12967053490485272.
[I 2025-12-05 15:58:17,607] Trial 113 finished with value: 0.08507527017338656 and parameters: {'model_type': 'mlp', 'hidden_dims': '[512, 64]', 'dropout': 0.26705412507049897, 'batch_norm': True, 'lr': 8.155619260612527e-05, 'weight_decay': 8.31460823041873e-06, 'epochs': 224, 'loss': 'mae', 'optimizer': 'adam', 'graph_mode': 'off', 'use_snp_selection': True, 'num_snps': 16601}. Best is trial 109 with value: 0.12967053490485272.
[I 2025-12-05 15:58:19,620] Trial 114 finished with value: 0.10334424351515284 and parameters: {'model_type': 'mlp', 'hidden_dims': '[512, 64]', 'dropout': 0.2838602991658994, 'batch_norm': True, 'lr': 0.0001251435722486991, 'weight_decay': 1.3217218136515984e-05, 'epochs': 262, 'loss': 'mae', 'optimizer': 'adam', 'graph_mode': 'off', 'use_snp_selection': True, 'num_snps': 30134}. Best is trial 109 with value: 0.12967053490485272.
[I 2025-12-05 15:58:20,935] Trial 115 finished with value: 0.10416126760839792 and parameters: {'model_type': 'mlp', 'hidden_dims': '[512, 64]', 'dropout': 0.2976573941846669, 'batch_norm': True, 'lr': 6.815591927841603e-05, 'weight_decay': 1.2842292968034056e-05, 'epochs': 249, 'loss': 'mae', 'optimizer': 'adam', 'graph_mode': 'off', 'use_snp_selection': True, 'num_snps': 12173}. Best is trial 109 with value: 0.12967053490485272.
[I 2025-12-05 15:58:23,280] Trial 116 finished with value: 0.1142360260972213 and parameters: {'model_type': 'mlp', 'hidden_dims': '[512, 64]', 'dropout': 0.24981126897656775, 'batch_norm': True, 'lr': 9.735086161693028e-05, 'weight_decay': 1.7802575215445713e-05, 'epochs': 220, 'loss': 'mae', 'optimizer': 'adam', 'graph_mode': 'off', 'use_snp_selection': True, 'num_snps': 40339}. Best is trial 109 with value: 0.12967053490485272.
[I 2025-12-05 15:58:25,021] Trial 117 finished with value: 0.10124412192262014 and parameters: {'model_type': 'mlp', 'hidden_dims': '[512, 64]', 'dropout': 0.3190526813466197, 'batch_norm': True, 'lr': 5.267877243946157e-05, 'weight_decay': 1.0870193147983683e-05, 'epochs': 228, 'loss': 'mae', 'optimizer': 'adam', 'graph_mode': 'off', 'use_snp_selection': True, 'num_snps': 27091}. Best is trial 109 with value: 0.12967053490485272.
[I 2025-12-05 15:58:27,285] Trial 118 finished with value: 0.10791405830725459 and parameters: {'model_type': 'mlp', 'hidden_dims': '[512, 256]', 'dropout': 0.2746948350269483, 'batch_norm': True, 'lr': 3.758948329181729e-05, 'weight_decay': 2.7442060698962975e-05, 'epochs': 272, 'loss': 'mae', 'optimizer': 'adam', 'graph_mode': 'off', 'use_snp_selection': True, 'num_snps': 34739}. Best is trial 109 with value: 0.12967053490485272.
[I 2025-12-05 15:58:28,617] Trial 119 finished with value: 0.10414778997258999 and parameters: {'model_type': 'mlp', 'hidden_dims': '[512, 64]', 'dropout': 0.3307775397159149, 'batch_norm': True, 'lr': 0.00015678339686590913, 'weight_decay': 3.269891123936116e-05, 'epochs': 209, 'loss': 'mae', 'optimizer': 'adam', 'graph_mode': 'off', 'use_snp_selection': True, 'num_snps': 15774}. Best is trial 109 with value: 0.12967053490485272.
[I 2025-12-05 15:58:30,175] Trial 120 finished with value: 0.08895413338345803 and parameters: {'model_type': 'mlp', 'hidden_dims': '[128, 64]', 'dropout': 0.2322119515281457, 'batch_norm': True, 'lr': 4.685283020405206e-05, 'weight_decay': 7.674336102015216e-06, 'epochs': 244, 'loss': 'mae', 'optimizer': 'adam', 'graph_mode': 'off', 'use_snp_selection': True, 'num_snps': 24906}. Best is trial 109 with value: 0.12967053490485272.
[I 2025-12-05 15:58:32,541] Trial 121 finished with value: 0.1258010918946244 and parameters: {'model_type': 'mlp', 'hidden_dims': '[512, 64]', 'dropout': 0.26176905550551127, 'batch_norm': True, 'lr': 9.843450639607179e-05, 'weight_decay': 1.642392182837924e-05, 'epochs': 218, 'loss': 'mae', 'optimizer': 'adam', 'graph_mode': 'off', 'use_snp_selection': True, 'num_snps': 39738}. Best is trial 109 with value: 0.12967053490485272.
[I 2025-12-05 15:58:34,890] Trial 122 finished with value: 0.1082559723461744 and parameters: {'model_type': 'mlp', 'hidden_dims': '[512, 64]', 'dropout': 0.26492988917311, 'batch_norm': True, 'lr': 8.672307086127112e-05, 'weight_decay': 1.604733322504149e-05, 'epochs': 232, 'loss': 'mae', 'optimizer': 'adam', 'graph_mode': 'off', 'use_snp_selection': True, 'num_snps': 38226}. Best is trial 109 with value: 0.12967053490485272.
[I 2025-12-05 15:58:36,624] Trial 123 finished with value: 0.10884404994642513 and parameters: {'model_type': 'mlp', 'hidden_dims': '[512, 64]', 'dropout': 0.246620339754351, 'batch_norm': True, 'lr': 6.133285868217396e-05, 'weight_decay': 2.1517672890435565e-05, 'epochs': 215, 'loss': 'mae', 'optimizer': 'adam', 'graph_mode': 'off', 'use_snp_selection': True, 'num_snps': 28046}. Best is trial 109 with value: 0.12967053490485272.
[I 2025-12-05 15:58:38,734] Trial 124 finished with value: 0.010830829143141957 and parameters: {'model_type': 'mlp', 'hidden_dims': '[512, 64]', 'dropout': 0.2866550077731943, 'batch_norm': True, 'lr': 1.7243680744825633e-06, 'weight_decay': 1.3570211433024569e-05, 'epochs': 222, 'loss': 'mae', 'optimizer': 'adam', 'graph_mode': 'off', 'use_snp_selection': True, 'num_snps': 32958}. Best is trial 109 with value: 0.12967053490485272.
[I 2025-12-05 15:58:41,245] Trial 125 finished with value: 0.10697717474160706 and parameters: {'model_type': 'mlp', 'hidden_dims': '[512, 128]', 'dropout': 0.3048002205331965, 'batch_norm': True, 'lr': 7.673994126244705e-05, 'weight_decay': 0.0002331336243630608, 'epochs': 237, 'loss': 'mae', 'optimizer': 'adam', 'graph_mode': 'off', 'use_snp_selection': True, 'num_snps': 41979}. Best is trial 109 with value: 0.12967053490485272.
[I 2025-12-05 15:58:44,073] Trial 126 finished with value: 0.0955494062489487 and parameters: {'model_type': 'mlp', 'hidden_dims': '[512, 64]', 'dropout': 0.25787425727243984, 'batch_norm': True, 'lr': 0.00018783787100230687, 'weight_decay': 9.442787399305572e-06, 'epochs': 211, 'loss': 'mae', 'optimizer': 'adam', 'graph_mode': 'off', 'use_snp_selection': True, 'num_snps': 51126}. Best is trial 109 with value: 0.12967053490485272.
[I 2025-12-05 15:58:45,771] Trial 127 finished with value: 0.08931965779081888 and parameters: {'model_type': 'mlp', 'hidden_dims': '[512, 64]', 'dropout': 0.241063528311716, 'batch_norm': True, 'lr': 0.0001421081429794954, 'weight_decay': 1.156927881548179e-05, 'epochs': 253, 'loss': 'mae', 'optimizer': 'adam', 'graph_mode': 'off', 'use_snp_selection': True, 'num_snps': 21529}. Best is trial 109 with value: 0.12967053490485272.
[I 2025-12-05 15:58:47,930] Trial 128 finished with value: 0.11809932780430368 and parameters: {'model_type': 'mlp', 'hidden_dims': '[512, 256]', 'dropout': 0.19333321241915885, 'batch_norm': True, 'lr': 4.1477705386517795e-05, 'weight_decay': 6.236646770760862e-06, 'epochs': 199, 'loss': 'mae', 'optimizer': 'adam', 'graph_mode': 'off', 'use_snp_selection': True, 'num_snps': 36896}. Best is trial 109 with value: 0.12967053490485272.
[I 2025-12-05 15:58:49,922] Trial 129 finished with value: 0.10451903034521078 and parameters: {'model_type': 'mlp', 'hidden_dims': '[512, 256]', 'dropout': 0.17141000799455997, 'batch_norm': True, 'lr': 0.00011296792437631312, 'weight_decay': 7.319561015749743e-06, 'epochs': 200, 'loss': 'mae', 'optimizer': 'adam', 'graph_mode': 'off', 'use_snp_selection': True, 'num_snps': 34887}. Best is trial 109 with value: 0.12967053490485272.
[I 2025-12-05 15:58:52,224] Trial 130 finished with value: 0.09519453604887597 and parameters: {'model_type': 'mlp', 'hidden_dims': '[512, 256]', 'dropout': 0.20318630642022167, 'batch_norm': True, 'lr': 4.568018445565365e-05, 'weight_decay': 0.00012235830833902725, 'epochs': 206, 'loss': 'mae', 'optimizer': 'adam', 'graph_mode': 'off', 'use_snp_selection': True, 'num_snps': 38677}. Best is trial 109 with value: 0.12967053490485272.
[I 2025-12-05 15:58:54,873] Trial 131 finished with value: 0.11165169989573626 and parameters: {'model_type': 'mlp', 'hidden_dims': '[512, 256]', 'dropout': 0.15127674971632327, 'batch_norm': True, 'lr': 2.8380996158210092e-05, 'weight_decay': 6.181062622772774e-06, 'epochs': 227, 'loss': 'mae', 'optimizer': 'adam', 'graph_mode': 'off', 'use_snp_selection': True, 'num_snps': 44284}. Best is trial 109 with value: 0.12967053490485272.
[I 2025-12-05 15:58:56,642] Trial 132 finished with value: 0.11413126457827971 and parameters: {'model_type': 'mlp', 'hidden_dims': '[512, 256]', 'dropout': 0.1339945611015528, 'batch_norm': True, 'lr': 3.365695795187512e-05, 'weight_decay': 8.638443163019149e-06, 'epochs': 216, 'loss': 'mae', 'optimizer': 'adam', 'graph_mode': 'off', 'use_snp_selection': True, 'num_snps': 27692}. Best is trial 109 with value: 0.12967053490485272.
[I 2025-12-05 15:58:58,580] Trial 133 finished with value: 0.11645786432217581 and parameters: {'model_type': 'mlp', 'hidden_dims': '[512, 64]', 'dropout': 0.3394645370541899, 'batch_norm': True, 'lr': 4.109604605227275e-05, 'weight_decay': 5.501690898656288e-06, 'epochs': 186, 'loss': 'mae', 'optimizer': 'adam', 'graph_mode': 'off', 'use_snp_selection': True, 'num_snps': 32027}. Best is trial 109 with value: 0.12967053490485272.
[I 2025-12-05 15:59:00,527] Trial 134 finished with value: 0.0872664213163385 and parameters: {'model_type': 'mlp', 'hidden_dims': '[512, 64]', 'dropout': 0.3382903400586391, 'batch_norm': True, 'lr': 6.091214780248316e-05, 'weight_decay': 4.873650236577605e-06, 'epochs': 183, 'loss': 'mae', 'optimizer': 'adam', 'graph_mode': 'off', 'use_snp_selection': True, 'num_snps': 32237}. Best is trial 109 with value: 0.12967053490485272.
[I 2025-12-05 15:59:02,567] Trial 135 finished with value: 0.114741695394774 and parameters: {'model_type': 'mlp', 'hidden_dims': '[512, 64]', 'dropout': 0.18470874038357674, 'batch_norm': True, 'lr': 4.0210710130778226e-05, 'weight_decay': 5.5100076965787155e-06, 'epochs': 188, 'loss': 'mae', 'optimizer': 'adam', 'graph_mode': 'off', 'use_snp_selection': True, 'num_snps': 36158}. Best is trial 109 with value: 0.12967053490485272.
[I 2025-12-05 15:59:04,215] Trial 136 finished with value: 0.09461407191844891 and parameters: {'model_type': 'mlp', 'hidden_dims': '[512, 64]', 'dropout': 0.3516780863210741, 'batch_norm': True, 'lr': 5.272954186355593e-05, 'weight_decay': 6.768780393714365e-06, 'epochs': 197, 'loss': 'mae', 'optimizer': 'adam', 'graph_mode': 'off', 'use_snp_selection': True, 'num_snps': 25991}. Best is trial 109 with value: 0.12967053490485272.
[I 2025-12-05 15:59:06,163] Trial 137 finished with value: 0.0922339766432701 and parameters: {'model_type': 'mlp', 'hidden_dims': '[512, 64]', 'dropout': 0.3173001259244635, 'batch_norm': True, 'lr': 3.334579567725993e-05, 'weight_decay': 4.130973838564821e-06, 'epochs': 202, 'loss': 'mae', 'optimizer': 'adam', 'graph_mode': 'off', 'use_snp_selection': True, 'num_snps': 30569}. Best is trial 109 with value: 0.12967053490485272.
[I 2025-12-05 15:59:07,540] Trial 138 finished with value: 0.09535256877080858 and parameters: {'model_type': 'mlp', 'hidden_dims': '[512, 64]', 'dropout': 0.2956827608087018, 'batch_norm': True, 'lr': 7.537902582054775e-05, 'weight_decay': 9.955751337987579e-06, 'epochs': 178, 'loss': 'mae', 'optimizer': 'adam', 'graph_mode': 'off', 'use_snp_selection': True, 'num_snps': 18229}. Best is trial 109 with value: 0.12967053490485272.
[I 2025-12-05 15:59:09,222] Trial 139 finished with value: 0.09956014928254783 and parameters: {'model_type': 'mlp', 'hidden_dims': '[256, 128, 64]', 'dropout': 0.3522878906948694, 'batch_norm': True, 'lr': 0.0002332164747904031, 'weight_decay': 3.1382304233907793e-06, 'epochs': 280, 'loss': 'mae', 'optimizer': 'adam', 'graph_mode': 'off', 'use_snp_selection': True, 'num_snps': 22717}. Best is trial 109 with value: 0.12967053490485272.
[I 2025-12-05 15:59:11,168] Trial 140 finished with value: 0.07605748336171891 and parameters: {'model_type': 'mlp', 'hidden_dims': '[512, 256]', 'dropout': 0.3924448605009957, 'batch_norm': True, 'lr': 2.6030774161560852e-05, 'weight_decay': 8.075582307867328e-06, 'epochs': 211, 'loss': 'mae', 'optimizer': 'adam', 'graph_mode': 'off', 'use_snp_selection': True, 'num_snps': 33527}. Best is trial 109 with value: 0.12967053490485272.
[I 2025-12-05 15:59:13,299] Trial 141 finished with value: 0.07687484018096943 and parameters: {'model_type': 'mlp', 'hidden_dims': '[128, 64]', 'dropout': 0.21909223649298928, 'batch_norm': True, 'lr': 5.071626419814031e-05, 'weight_decay': 1.3879845059316544e-05, 'epochs': 220, 'loss': 'mae', 'optimizer': 'adam', 'graph_mode': 'off', 'use_snp_selection': True, 'num_snps': 43023}. Best is trial 109 with value: 0.12967053490485272.
[I 2025-12-05 15:59:15,033] Trial 142 finished with value: 0.06364708684710678 and parameters: {'model_type': 'mlp', 'hidden_dims': '[512, 64]', 'dropout': 0.5733845678050178, 'batch_norm': True, 'lr': 4.255000368837341e-05, 'weight_decay': 1.6839425763461816e-05, 'epochs': 232, 'loss': 'mae', 'optimizer': 'adam', 'graph_mode': 'off', 'use_snp_selection': False}. Best is trial 109 with value: 0.12967053490485272.
[I 2025-12-05 15:59:16,689] Trial 143 finished with value: 0.092777852807046 and parameters: {'model_type': 'mlp', 'hidden_dims': '[512, 64]', 'dropout': 0.2780639687887987, 'batch_norm': True, 'lr': 3.821478691051535e-05, 'weight_decay': 1.0765685987389088e-05, 'epochs': 223, 'loss': 'mae', 'optimizer': 'adam', 'graph_mode': 'off', 'use_snp_selection': False}. Best is trial 109 with value: 0.12967053490485272.
[I 2025-12-05 15:59:18,815] Trial 144 finished with value: 0.11428227508077818 and parameters: {'model_type': 'mlp', 'hidden_dims': '[512, 64]', 'dropout': 0.3270781535926106, 'batch_norm': True, 'lr': 3.1286965085412815e-05, 'weight_decay': 4.675995731589043e-06, 'epochs': 209, 'loss': 'mae', 'optimizer': 'adam', 'graph_mode': 'off', 'use_snp_selection': True, 'num_snps': 37828}. Best is trial 109 with value: 0.12967053490485272.
