[I 2025-12-05 15:37:39,214] Trial 70 finished with value: 0.09996672918351293 and parameters: {'model_type': 'mlp', 'hidden_dims': '[256, 128, 64]', 'dropout': 0.31936207357837687, 'batch_norm': True, 'lr': 0.00031212112015696294, 'weight_decay': 1.5851148113260254e-06, 'epochs': 221, 'loss': 'mse', 'optimizer': 'adam', 'graph_mode': 'off', 'use_snp_selection': False}. Best is trial 40 with value: 0.12606267566660975.
[I 2025-12-05 15:37:40,151] Trial 71 finished with value: 0.09026718731826638 and parameters: {'model_type': 'mlp', 'hidden_dims': '[128, 64]', 'dropout': 0.13938586262514208, 'batch_norm': True, 'lr': 0.00010221378866827964, 'weight_decay': 1.1827633921770825e-06, 'epochs': 301, 'loss': 'mse', 'optimizer': 'adam', 'graph_mode': 'off', 'use_snp_selection': False}. Best is trial 40 with value: 0.12606267566660975.
[I 2025-12-05 15:37:41,042] Trial 72 finished with value: 0.1055798230266398 and parameters: {'model_type': 'mlp', 'hidden_dims': '[128, 64]', 'dropout': 0.1124480808926672, 'batch_norm': True, 'lr': 0.0001071882573552904, 'weight_decay': 7.92644142365838e-07, 'epochs': 270, 'loss': 'mse', 'optimizer': 'adam', 'graph_mode': 'off', 'use_snp_selection': False}. Best is trial 40 with value: 0.12606267566660975.
[I 2025-12-05 15:37:41,937] Trial 73 finished with value: 0.10796960519861029 and parameters: {'model_type': 'mlp', 'hidden_dims': '[128, 64]', 'dropout': 0.14054857443194282, 'batch_norm': True, 'lr': 8.23605226379908e-05, 'weight_decay': 8.73508167306991e-06, 'epochs': 273, 'loss': 'mse', 'optimizer': 'adam', 'graph_mode': 'off', 'use_snp_selection': False}. Best is trial 40 with value: 0.12606267566660975.
[I 2025-12-05 15:37:42,810] Trial 74 finished with value: 0.1025747002684699 and parameters: {'model_type': 'mlp', 'hidden_dims': '[128, 64]', 'dropout': 0.1872329997217207, 'batch_norm': True, 'lr': 4.418794453805814e-05, 'weight_decay': 1.5036009354406323e-06, 'epochs': 255, 'loss': 'mse', 'optimizer': 'adam', 'graph_mode': 'off', 'use_snp_selection': False}. Best is trial 40 with value: 0.12606267566660975.
[I 2025-12-05 15:37:43,872] Trial 75 finished with value: 0.10091181975074576 and parameters: {'model_type': 'mlp', 'hidden_dims': '[512, 256]', 'dropout': 0.2078845817565511, 'batch_norm': True, 'lr': 5.2897350231809366e-05, 'weight_decay': 3.2970081056808824e-06, 'epochs': 90, 'loss': 'mse', 'optimizer': 'adam', 'graph_mode': 'off', 'use_snp_selection': False}. Best is trial 40 with value: 0.12606267566660975.
[I 2025-12-05 15:37:44,763] Trial 76 finished with value: 0.09141845276626065 and parameters: {'model_type': 'mlp', 'hidden_dims': '[256, 128]', 'dropout': 0.1791083767901085, 'batch_norm': True, 'lr': 0.00044186960324269327, 'weight_decay': 5.646440690667601e-06, 'epochs': 209, 'loss': 'mse', 'optimizer': 'adam', 'graph_mode': 'off', 'use_snp_selection': True, 'num_snps': 3325}. Best is trial 40 with value: 0.12606267566660975.
[I 2025-12-05 15:37:45,481] Trial 77 finished with value: 0.11049974858656515 and parameters: {'model_type': 'mlp', 'hidden_dims': '[128, 64]', 'dropout': 0.13643552724320854, 'batch_norm': True, 'lr': 0.00012180269288388827, 'weight_decay': 5.33007592296117e-07, 'epochs': 135, 'loss': 'mae', 'optimizer': 'adam', 'graph_mode': 'off', 'use_snp_selection': False}. Best is trial 40 with value: 0.12606267566660975.
[I 2025-12-05 15:37:47,112] Trial 78 finished with value: 0.10502678315008958 and parameters: {'model_type': 'mlp', 'hidden_dims': '[512, 256]', 'dropout': 0.2612446193135567, 'batch_norm': True, 'lr': 0.00022392418376886736, 'weight_decay': 2.596251633284465e-07, 'epochs': 247, 'loss': 'mse', 'optimizer': 'adam', 'graph_mode': 'off', 'use_snp_selection': False}. Best is trial 40 with value: 0.12606267566660975.
[I 2025-12-05 15:37:48,678] Trial 79 finished with value: 0.1030418292102444 and parameters: {'model_type': 'mlp', 'hidden_dims': '[512, 64]', 'dropout': 0.16949861309721131, 'batch_norm': True, 'lr': 0.00016460683082438862, 'weight_decay': 1.0212007908363872e-06, 'epochs': 232, 'loss': 'mse', 'optimizer': 'adam', 'graph_mode': 'off', 'use_snp_selection': False}. Best is trial 40 with value: 0.12606267566660975.
[I 2025-12-05 15:37:50,383] Trial 80 finished with value: 0.08471425462093617 and parameters: {'model_type': 'mlp', 'hidden_dims': '[512, 128]', 'dropout': 0.11298225889195575, 'batch_norm': False, 'lr': 0.0006007227503680762, 'weight_decay': 4.056334006565793e-07, 'epochs': 267, 'loss': 'mse', 'optimizer': 'adam', 'graph_mode': 'off', 'use_snp_selection': False}. Best is trial 40 with value: 0.12606267566660975.
[I 2025-12-05 15:37:51,434] Trial 81 finished with value: 0.11601673873458745 and parameters: {'model_type': 'mlp', 'hidden_dims': '[512, 256]', 'dropout': 0.10733966533908255, 'batch_norm': True, 'lr': 0.00025108521019412335, 'weight_decay': 1.5428417240391165e-07, 'epochs': 95, 'loss': 'mse', 'optimizer': 'adam', 'graph_mode': 'off', 'use_snp_selection': False}. Best is trial 40 with value: 0.12606267566660975.
[I 2025-12-05 15:37:52,522] Trial 82 finished with value: 0.12095964838221199 and parameters: {'model_type': 'mlp', 'hidden_dims': '[512, 256]', 'dropout': 0.12769619345106148, 'batch_norm': True, 'lr': 0.00026188221210251444, 'weight_decay': 1.840725264830267e-06, 'epochs': 105, 'loss': 'mse', 'optimizer': 'adam', 'graph_mode': 'off', 'use_snp_selection': False}. Best is trial 40 with value: 0.12606267566660975.
[I 2025-12-05 15:37:53,598] Trial 83 finished with value: 0.1182925612395319 and parameters: {'model_type': 'mlp', 'hidden_dims': '[512, 256]', 'dropout': 0.1292667646570286, 'batch_norm': True, 'lr': 0.00034656316415878046, 'weight_decay': 1.94391008708623e-06, 'epochs': 102, 'loss': 'mse', 'optimizer': 'adam', 'graph_mode': 'off', 'use_snp_selection': False}. Best is trial 40 with value: 0.12606267566660975.
[I 2025-12-05 15:37:55,407] Trial 84 finished with value: 0.1002792610510515 and parameters: {'model_type': 'mlp', 'hidden_dims': '[512, 256]', 'dropout': 0.15055007433267656, 'batch_norm': True, 'lr': 8.875680625348039e-05, 'weight_decay': 2.7515449279670777e-06, 'epochs': 288, 'loss': 'mse', 'optimizer': 'adam', 'graph_mode': 'off', 'use_snp_selection': False}. Best is trial 40 with value: 0.12606267566660975.
[I 2025-12-05 15:37:56,226] Trial 85 finished with value: 0.09834610916059962 and parameters: {'model_type': 'mlp', 'hidden_dims': '[256, 128]', 'dropout': 0.15987289776398747, 'batch_norm': True, 'lr': 0.0008454708174631074, 'weight_decay': 1.3221957698701182e-06, 'epochs': 112, 'loss': 'mae', 'optimizer': 'adam', 'graph_mode': 'off', 'use_snp_selection': False}. Best is trial 40 with value: 0.12606267566660975.
[I 2025-12-05 15:37:57,376] Trial 86 finished with value: 0.11652843845958305 and parameters: {'model_type': 'mlp', 'hidden_dims': '[512, 256]', 'dropout': 0.21572266399985407, 'batch_norm': True, 'lr': 0.00015190023364021615, 'weight_decay': 8.15596024448233e-07, 'epochs': 121, 'loss': 'mse', 'optimizer': 'adam', 'graph_mode': 'off', 'use_snp_selection': False}. Best is trial 40 with value: 0.12606267566660975.
[I 2025-12-05 15:37:58,032] Trial 87 finished with value: 0.10546565119444924 and parameters: {'model_type': 'mlp', 'hidden_dims': '[128, 64]', 'dropout': 0.17756566441948562, 'batch_norm': True, 'lr': 0.0002728954564172347, 'weight_decay': 4.879719364309915e-07, 'epochs': 91, 'loss': 'mse', 'optimizer': 'adam', 'graph_mode': 'off', 'use_snp_selection': False}. Best is trial 40 with value: 0.12606267566660975.
[I 2025-12-05 15:38:00,217] Trial 88 finished with value: 0.11016969392120944 and parameters: {'model_type': 'mlp', 'hidden_dims': '[512, 256]', 'dropout': 0.14445059531573926, 'batch_norm': True, 'lr': 0.00020233284562309328, 'weight_decay': 4.1360841742843994e-06, 'epochs': 62, 'loss': 'mse', 'optimizer': 'adam', 'graph_mode': 'off', 'use_snp_selection': True, 'num_snps': 48766}. Best is trial 40 with value: 0.12606267566660975.
[I 2025-12-05 15:38:01,031] Trial 89 finished with value: 0.10134709172885253 and parameters: {'model_type': 'mlp', 'hidden_dims': '[256, 128, 64]', 'dropout': 0.1272174161146489, 'batch_norm': True, 'lr': 0.00011884625714829836, 'weight_decay': 6.263710661436762e-07, 'epochs': 105, 'loss': 'mae', 'optimizer': 'adam', 'graph_mode': 'off', 'use_snp_selection': False}. Best is trial 40 with value: 0.12606267566660975.
[I 2025-12-05 15:38:02,354] Trial 90 finished with value: 0.09838446195128671 and parameters: {'model_type': 'mlp', 'hidden_dims': '[512, 128]', 'dropout': 0.19343431307715236, 'batch_norm': True, 'lr': 9.206237494153339e-05, 'weight_decay': 1.866371862822141e-06, 'epochs': 158, 'loss': 'mse', 'optimizer': 'adam', 'graph_mode': 'off', 'use_snp_selection': False}. Best is trial 40 with value: 0.12606267566660975.
[I 2025-12-05 15:38:03,431] Trial 91 finished with value: 0.11529532954574763 and parameters: {'model_type': 'mlp', 'hidden_dims': '[512, 256]', 'dropout': 0.12801664983237634, 'batch_norm': True, 'lr': 0.0003820014287468285, 'weight_decay': 2.356766953061735e-06, 'epochs': 101, 'loss': 'mse', 'optimizer': 'adam', 'graph_mode': 'off', 'use_snp_selection': False}. Best is trial 40 with value: 0.12606267566660975.
[I 2025-12-05 15:38:04,643] Trial 92 finished with value: 0.1202259200653977 and parameters: {'model_type': 'mlp', 'hidden_dims': '[512, 256]', 'dropout': 0.1128274148417077, 'batch_norm': True, 'lr': 0.0003153256996477648, 'weight_decay': 1.2676782063071887e-06, 'epochs': 138, 'loss': 'mse', 'optimizer': 'adam', 'graph_mode': 'off', 'use_snp_selection': False}. Best is trial 40 with value: 0.12606267566660975.
[I 2025-12-05 15:38:05,826] Trial 93 finished with value: 0.11402584310913468 and parameters: {'model_type': 'mlp', 'hidden_dims': '[512, 256]', 'dropout': 0.11261114025579774, 'batch_norm': True, 'lr': 0.0005912766159791634, 'weight_decay': 9.586785564996651e-07, 'epochs': 126, 'loss': 'mse', 'optimizer': 'adam', 'graph_mode': 'off', 'use_snp_selection': False}. Best is trial 40 with value: 0.12606267566660975.
[I 2025-12-05 15:38:07,038] Trial 94 finished with value: 0.10255941440493863 and parameters: {'model_type': 'mlp', 'hidden_dims': '[512, 256]', 'dropout': 0.13931520075623066, 'batch_norm': True, 'lr': 0.0004421605412106678, 'weight_decay': 1.3674451301669515e-06, 'epochs': 138, 'loss': 'mse', 'optimizer': 'adam', 'graph_mode': 'off', 'use_snp_selection': False}. Best is trial 40 with value: 0.12606267566660975.
[I 2025-12-05 15:38:08,418] Trial 95 finished with value: 0.10249831306121139 and parameters: {'model_type': 'mlp', 'hidden_dims': '[512, 256]', 'dropout': 0.10242580290905708, 'batch_norm': True, 'lr': 0.00018494544104302998, 'weight_decay': 1.132435840006636e-06, 'epochs': 182, 'loss': 'mse', 'optimizer': 'adam', 'graph_mode': 'off', 'use_snp_selection': False}. Best is trial 40 with value: 0.12606267566660975.
[I 2025-12-05 15:38:09,269] Trial 96 finished with value: 0.11746173832815396 and parameters: {'model_type': 'mlp', 'hidden_dims': '[128, 64]', 'dropout': 0.11845958958232862, 'batch_norm': True, 'lr': 7.460296548089627e-05, 'weight_decay': 7.184322323919615e-07, 'epochs': 215, 'loss': 'mse', 'optimizer': 'adam', 'graph_mode': 'off', 'use_snp_selection': False}. Best is trial 40 with value: 0.12606267566660975.
[I 2025-12-05 15:38:10,154] Trial 97 finished with value: 0.1287956241726471 and parameters: {'model_type': 'mlp', 'hidden_dims': '[256, 128]', 'dropout': 0.15999288413528265, 'batch_norm': True, 'lr': 0.00031679666229136085, 'weight_decay': 4.999126279482303e-06, 'epochs': 152, 'loss': 'mse', 'optimizer': 'adam', 'graph_mode': 'off', 'use_snp_selection': False}. Best is trial 97 with value: 0.1287956241726471.
[I 2025-12-05 15:38:10,988] Trial 98 finished with value: 0.07711378427376345 and parameters: {'model_type': 'mlp', 'hidden_dims': '[256, 128]', 'dropout': 0.24124366752283483, 'batch_norm': False, 'lr': 0.0002920595530507874, 'weight_decay': 1.300626290882916e-05, 'epochs': 130, 'loss': 'mse', 'optimizer': 'adam', 'graph_mode': 'off', 'use_snp_selection': False}. Best is trial 97 with value: 0.1287956241726471.
[I 2025-12-05 15:38:11,870] Trial 99 finished with value: 0.09585289986403313 and parameters: {'model_type': 'mlp', 'hidden_dims': '[256, 128]', 'dropout': 0.16206807065263693, 'batch_norm': True, 'lr': 0.00023420327146711161, 'weight_decay': 6.910304386070166e-06, 'epochs': 150, 'loss': 'mae', 'optimizer': 'adam', 'graph_mode': 'off', 'use_snp_selection': False}. Best is trial 97 with value: 0.1287956241726471.
[I 2025-12-05 15:38:12,688] Trial 100 finished with value: 0.1035991699046801 and parameters: {'model_type': 'mlp', 'hidden_dims': '[256, 128]', 'dropout': 0.2234037793935302, 'batch_norm': True, 'lr': 0.00033873364307272476, 'weight_decay': 4.799070995610906e-06, 'epochs': 116, 'loss': 'mse', 'optimizer': 'adam', 'graph_mode': 'off', 'use_snp_selection': False}. Best is trial 97 with value: 0.1287956241726471.
[I 2025-12-05 15:38:13,574] Trial 101 finished with value: 0.12046046537407601 and parameters: {'model_type': 'mlp', 'hidden_dims': '[256, 128]', 'dropout': 0.14843606722848393, 'batch_norm': True, 'lr': 0.0007967752696538664, 'weight_decay': 3.2537528007235237e-06, 'epochs': 151, 'loss': 'mse', 'optimizer': 'adam', 'graph_mode': 'off', 'use_snp_selection': False}. Best is trial 97 with value: 0.1287956241726471.
[I 2025-12-05 15:38:14,490] Trial 102 finished with value: 0.1209157869719429 and parameters: {'model_type': 'mlp', 'hidden_dims': '[256, 128]', 'dropout': 0.20478644305839896, 'batch_norm': True, 'lr': 0.0009583789917057357, 'weight_decay': 2.915244905221173e-06, 'epochs': 166, 'loss': 'mse', 'optimizer': 'adam', 'graph_mode': 'off', 'use_snp_selection': False}. Best is trial 97 with value: 0.1287956241726471.
[I 2025-12-05 15:38:15,444] Trial 103 finished with value: 0.0894789712639455 and parameters: {'model_type': 'mlp', 'hidden_dims': '[256, 128]', 'dropout': 0.19889416818946487, 'batch_norm': True, 'lr': 0.0009963993896061451, 'weight_decay': 3.2784818626113665e-06, 'epochs': 160, 'loss': 'mse', 'optimizer': 'adam', 'graph_mode': 'off', 'use_snp_selection': False}. Best is trial 97 with value: 0.1287956241726471.
[I 2025-12-05 15:38:16,374] Trial 104 finished with value: 0.11532464568476453 and parameters: {'model_type': 'mlp', 'hidden_dims': '[256, 128]', 'dropout': 0.21189419671887383, 'batch_norm': True, 'lr': 0.0008480628289474407, 'weight_decay': 3.469635095700065e-06, 'epochs': 167, 'loss': 'mse', 'optimizer': 'adam', 'graph_mode': 'off', 'use_snp_selection': False}. Best is trial 97 with value: 0.1287956241726471.
[I 2025-12-05 15:38:17,248] Trial 105 finished with value: 0.106678358079417 and parameters: {'model_type': 'mlp', 'hidden_dims': '[256, 128]', 'dropout': 0.17178195492940102, 'batch_norm': True, 'lr': 0.0006080415095050886, 'weight_decay': 5.073291406311525e-06, 'epochs': 147, 'loss': 'mse', 'optimizer': 'adam', 'graph_mode': 'off', 'use_snp_selection': False}. Best is trial 97 with value: 0.1287956241726471.
[I 2025-12-05 15:38:18,145] Trial 106 finished with value: 0.1013902226166007 and parameters: {'model_type': 'mlp', 'hidden_dims': '[256, 128]', 'dropout': 0.14981217909617367, 'batch_norm': True, 'lr': 0.0007467436442164447, 'weight_decay': 7.471100355177916e-06, 'epochs': 154, 'loss': 'mse', 'optimizer': 'adam', 'graph_mode': 'off', 'use_snp_selection': False}. Best is trial 97 with value: 0.1287956241726471.
[I 2025-12-05 15:38:20,009] Trial 107 finished with value: 0.1108000926791379 and parameters: {'model_type': 'mlp', 'hidden_dims': '[256, 128]', 'dropout': 0.18971848824318294, 'batch_norm': True, 'lr': 0.0006757108909686884, 'weight_decay': 2.321680948835595e-06, 'epochs': 182, 'loss': 'mse', 'optimizer': 'adam', 'graph_mode': 'off', 'use_snp_selection': True, 'num_snps': 37972}. Best is trial 97 with value: 0.1287956241726471.
[I 2025-12-05 15:38:20,923] Trial 108 finished with value: 0.10263947829357312 and parameters: {'model_type': 'mlp', 'hidden_dims': '[256, 128]', 'dropout': 0.24957832642106603, 'batch_norm': True, 'lr': 0.0005047742246339952, 'weight_decay': 3.105953609449085e-07, 'epochs': 166, 'loss': 'mse', 'optimizer': 'adam', 'graph_mode': 'off', 'use_snp_selection': False}. Best is trial 97 with value: 0.1287956241726471.
[I 2025-12-05 15:38:21,681] Trial 109 finished with value: 0.10248799346896088 and parameters: {'model_type': 'mlp', 'hidden_dims': '[256, 128]', 'dropout': 0.23596782881469502, 'batch_norm': True, 'lr': 0.0009350983390998654, 'weight_decay': 1.5566044903672132e-06, 'epochs': 85, 'loss': 'mae', 'optimizer': 'adam', 'graph_mode': 'off', 'use_snp_selection': False}. Best is trial 97 with value: 0.1287956241726471.
[I 2025-12-05 15:38:22,582] Trial 110 finished with value: 0.11889255275426756 and parameters: {'model_type': 'mlp', 'hidden_dims': '[256, 128]', 'dropout': 0.20497144155300565, 'batch_norm': True, 'lr': 0.0008035518562559534, 'weight_decay': 3.0242522338895754e-06, 'epochs': 142, 'loss': 'mse', 'optimizer': 'adam', 'graph_mode': 'off', 'use_snp_selection': False}. Best is trial 97 with value: 0.1287956241726471.
[I 2025-12-05 15:38:23,797] Trial 111 finished with value: 0.10949392439022773 and parameters: {'model_type': 'mlp', 'hidden_dims': '[512, 256]', 'dropout': 0.11874079775316518, 'batch_norm': True, 'lr': 0.0005351193214410564, 'weight_decay': 1.7542253344489817e-06, 'epochs': 138, 'loss': 'mse', 'optimizer': 'adam', 'graph_mode': 'off', 'use_snp_selection': False}. Best is trial 97 with value: 0.1287956241726471.
[I 2025-12-05 15:38:24,959] Trial 112 finished with value: 0.1324077695104809 and parameters: {'model_type': 'mlp', 'hidden_dims': '[512, 256]', 'dropout': 0.13217139510517628, 'batch_norm': True, 'lr': 0.0003923956518980233, 'weight_decay': 2.571486646000211e-06, 'epochs': 124, 'loss': 'mse', 'optimizer': 'adam', 'graph_mode': 'off', 'use_snp_selection': False}. Best is trial 112 with value: 0.1324077695104809.
[I 2025-12-05 15:38:26,115] Trial 113 finished with value: 0.11972292496316807 and parameters: {'model_type': 'mlp', 'hidden_dims': '[512, 128]', 'dropout': 0.13200723632823685, 'batch_norm': True, 'lr': 0.00042014420805318173, 'weight_decay': 4.3686261461524504e-06, 'epochs': 124, 'loss': 'mse', 'optimizer': 'adam', 'graph_mode': 'off', 'use_snp_selection': False}. Best is trial 112 with value: 0.1324077695104809.
[I 2025-12-05 15:38:27,213] Trial 114 finished with value: 0.10037685731577389 and parameters: {'model_type': 'mlp', 'hidden_dims': '[512, 64]', 'dropout': 0.15716439755433642, 'batch_norm': True, 'lr': 0.0006834516667093137, 'weight_decay': 2.8016231705650425e-06, 'epochs': 109, 'loss': 'mse', 'optimizer': 'adam', 'graph_mode': 'off', 'use_snp_selection': False}. Best is trial 112 with value: 0.1324077695104809.
[I 2025-12-05 15:38:28,056] Trial 115 finished with value: 0.10687905757269817 and parameters: {'model_type': 'mlp', 'hidden_dims': '[256, 128]', 'dropout': 0.1766588422672031, 'batch_norm': True, 'lr': 0.00015190766049862274, 'weight_decay': 9.383990427527166e-07, 'epochs': 131, 'loss': 'mse', 'optimizer': 'adam', 'graph_mode': 'off', 'use_snp_selection': False}. Best is trial 112 with value: 0.1324077695104809.
[I 2025-12-05 15:38:29,652] Trial 116 finished with value: 0.11856353638361404 and parameters: {'model_type': 'mlp', 'hidden_dims': '[512, 256]', 'dropout': 0.14842530005691285, 'batch_norm': True, 'lr': 0.00047613059887520665, 'weight_decay': 6.187083107483286e-06, 'epochs': 232, 'loss': 'mse', 'optimizer': 'adam', 'graph_mode': 'off', 'use_snp_selection': False}. Best is trial 112 with value: 0.1324077695104809.
[I 2025-12-05 15:38:30,634] Trial 117 finished with value: 0.0897613695996387 and parameters: {'model_type': 'mlp', 'hidden_dims': '[256, 128]', 'dropout': 0.22847493938474273, 'batch_norm': False, 'lr': 0.00018221854808442365, 'weight_decay': 1.0561899745944915e-05, 'epochs': 204, 'loss': 'mse', 'optimizer': 'adam', 'graph_mode': 'off', 'use_snp_selection': False}. Best is trial 112 with value: 0.1324077695104809.
[I 2025-12-05 15:38:31,987] Trial 118 finished with value: 0.11220107046039599 and parameters: {'model_type': 'mlp', 'hidden_dims': '[512, 256]', 'dropout': 0.10057601455642742, 'batch_norm': True, 'lr': 0.0002598328433662917, 'weight_decay': 2.50730152466356e-06, 'epochs': 175, 'loss': 'mse', 'optimizer': 'adam', 'graph_mode': 'off', 'use_snp_selection': False}. Best is trial 112 with value: 0.1324077695104809.
[I 2025-12-05 15:38:33,045] Trial 119 finished with value: 0.09003658685412673 and parameters: {'model_type': 'mlp', 'hidden_dims': '[256, 128, 64]', 'dropout': 0.16985809704799476, 'batch_norm': True, 'lr': 0.00013275424270460612, 'weight_decay': 1.958920662352112e-06, 'epochs': 227, 'loss': 'mse', 'optimizer': 'adam', 'graph_mode': 'off', 'use_snp_selection': False}. Best is trial 112 with value: 0.1324077695104809.
[I 2025-12-05 15:38:34,183] Trial 120 finished with value: 0.09774029367828309 and parameters: {'model_type': 'mlp', 'hidden_dims': '[512, 128]', 'dropout': 0.2663383463489864, 'batch_norm': True, 'lr': 0.00037734449630539527, 'weight_decay': 3.547053663821081e-06, 'epochs': 118, 'loss': 'mae', 'optimizer': 'adam', 'graph_mode': 'off', 'use_snp_selection': False}. Best is trial 112 with value: 0.1324077695104809.
[I 2025-12-05 15:38:35,408] Trial 121 finished with value: 0.125164971698345 and parameters: {'model_type': 'mlp', 'hidden_dims': '[512, 256]', 'dropout': 0.12415325788145355, 'batch_norm': True, 'lr': 0.0003101170642148829, 'weight_decay': 5.647839008091823e-07, 'epochs': 141, 'loss': 'mse', 'optimizer': 'adam', 'graph_mode': 'off', 'use_snp_selection': False}. Best is trial 112 with value: 0.1324077695104809.
