[I 2025-12-06 03:48:19,179] Trial 87 finished with value: 0.30070220184585683 and parameters: {'model_type': 'mlp', 'hidden_dims': '[512, 128]', 'dropout': 0.13632479405704573, 'batch_norm': False, 'lr': 2.29715746517616e-06, 'weight_decay': 4.946743691662962e-06, 'epochs': 172, 'loss': 'mse', 'optimizer': 'adam', 'graph_mode': 'off', 'use_snp_selection': True, 'num_snps': 42661}. Best is trial 86 with value: 0.30219272602284764.
[I 2025-12-06 03:49:09,573] Trial 88 finished with value: 0.2730422664675304 and parameters: {'model_type': 'mlp', 'hidden_dims': '[512, 128]', 'dropout': 0.1350138959417006, 'batch_norm': True, 'lr': 2.1580530612528466e-06, 'weight_decay': 5.575717636869254e-06, 'epochs': 177, 'loss': 'mse', 'optimizer': 'adam', 'graph_mode': 'off', 'use_snp_selection': True, 'num_snps': 37443}. Best is trial 86 with value: 0.30219272602284764.
[I 2025-12-06 03:50:06,445] Trial 89 finished with value: 0.30351852889597175 and parameters: {'model_type': 'mlp', 'hidden_dims': '[512, 128]', 'dropout': 0.11190475574196804, 'batch_norm': False, 'lr': 1.716649281650205e-06, 'weight_decay': 1.2314532415318948e-05, 'epochs': 195, 'loss': 'mse', 'optimizer': 'adam', 'graph_mode': 'off', 'use_snp_selection': True, 'num_snps': 42937}. Best is trial 89 with value: 0.30351852889597175.
[I 2025-12-06 03:51:01,645] Trial 90 finished with value: 0.2977971642903843 and parameters: {'model_type': 'mlp', 'hidden_dims': '[512, 128]', 'dropout': 0.11716088081301854, 'batch_norm': False, 'lr': 1.6717674505906425e-06, 'weight_decay': 1.1457748011893117e-05, 'epochs': 197, 'loss': 'mse', 'optimizer': 'adam', 'graph_mode': 'off', 'use_snp_selection': True, 'num_snps': 39860}. Best is trial 89 with value: 0.30351852889597175.
[I 2025-12-06 03:51:57,027] Trial 91 finished with value: 0.2977766983602194 and parameters: {'model_type': 'mlp', 'hidden_dims': '[512, 128]', 'dropout': 0.11516593969059444, 'batch_norm': False, 'lr': 2.3461495654453534e-06, 'weight_decay': 8.83854086972894e-06, 'epochs': 186, 'loss': 'mse', 'optimizer': 'adam', 'graph_mode': 'off', 'use_snp_selection': True, 'num_snps': 42557}. Best is trial 89 with value: 0.30351852889597175.
[I 2025-12-06 03:52:57,490] Trial 92 finished with value: 0.29794562251960044 and parameters: {'model_type': 'mlp', 'hidden_dims': '[512, 128]', 'dropout': 0.13784230162101424, 'batch_norm': False, 'lr': 1.2420288793242626e-06, 'weight_decay': 4.280464040683832e-06, 'epochs': 229, 'loss': 'mse', 'optimizer': 'adam', 'graph_mode': 'off', 'use_snp_selection': True, 'num_snps': 42411}. Best is trial 89 with value: 0.30351852889597175.
[I 2025-12-06 03:53:56,456] Trial 93 finished with value: 0.29493123804007226 and parameters: {'model_type': 'mlp', 'hidden_dims': '[512, 128]', 'dropout': 0.10423417830774855, 'batch_norm': False, 'lr': 2.9938862528724286e-06, 'weight_decay': 1.100501632020284e-05, 'epochs': 204, 'loss': 'mse', 'optimizer': 'adam', 'graph_mode': 'off', 'use_snp_selection': True, 'num_snps': 44240}. Best is trial 89 with value: 0.30351852889597175.
[I 2025-12-06 03:54:45,277] Trial 94 finished with value: 0.2889464037028775 and parameters: {'model_type': 'mlp', 'hidden_dims': '[512, 128]', 'dropout': 0.14449772337081188, 'batch_norm': False, 'lr': 1.4638557196714725e-06, 'weight_decay': 2.603230561744927e-06, 'epochs': 137, 'loss': 'mse', 'optimizer': 'adam', 'graph_mode': 'off', 'use_snp_selection': True, 'num_snps': 41431}. Best is trial 89 with value: 0.30351852889597175.
[I 2025-12-06 03:55:30,819] Trial 95 finished with value: 0.2954364188359637 and parameters: {'model_type': 'mlp', 'hidden_dims': '[512, 128]', 'dropout': 0.16426568580280487, 'batch_norm': False, 'lr': 0.0002001359895246345, 'weight_decay': 7.110396448749094e-06, 'epochs': 124, 'loss': 'mse', 'optimizer': 'adam', 'graph_mode': 'off', 'use_snp_selection': True, 'num_snps': 39119}. Best is trial 89 with value: 0.30351852889597175.
[I 2025-12-06 03:56:15,729] Trial 96 finished with value: 0.2771779697061304 and parameters: {'model_type': 'mlp', 'hidden_dims': '[256, 128, 64]', 'dropout': 0.11660285196391806, 'batch_norm': False, 'lr': 1.816205998377487e-06, 'weight_decay': 5.430161896613672e-06, 'epochs': 143, 'loss': 'mse', 'optimizer': 'adam', 'graph_mode': 'off', 'use_snp_selection': True, 'num_snps': 48539}. Best is trial 89 with value: 0.30351852889597175.
[I 2025-12-06 03:56:56,279] Trial 97 finished with value: 0.28023298453464174 and parameters: {'model_type': 'mlp', 'hidden_dims': '[128, 64]', 'dropout': 0.15644313515323288, 'batch_norm': False, 'lr': 2.039389467147086e-06, 'weight_decay': 2.0482440704192697e-05, 'epochs': 172, 'loss': 'mse', 'optimizer': 'adam', 'graph_mode': 'off', 'use_snp_selection': True, 'num_snps': 45868}. Best is trial 89 with value: 0.30351852889597175.
[I 2025-12-06 03:57:42,153] Trial 98 finished with value: 0.2992860154467437 and parameters: {'model_type': 'mlp', 'hidden_dims': '[512, 128]', 'dropout': 0.2149827959714969, 'batch_norm': False, 'lr': 2.5326906073329422e-06, 'weight_decay': 1.4576071496216395e-05, 'epochs': 155, 'loss': 'mse', 'optimizer': 'adam', 'graph_mode': 'off', 'use_snp_selection': True, 'num_snps': 34489}. Best is trial 89 with value: 0.30351852889597175.
[I 2025-12-06 03:58:38,671] Trial 99 finished with value: 0.2831579831593506 and parameters: {'model_type': 'mlp', 'hidden_dims': '[512, 128]', 'dropout': 0.1673799074595748, 'batch_norm': False, 'lr': 1.091850990251274e-06, 'weight_decay': 3.7024231495426694e-06, 'epochs': 191, 'loss': 'mse', 'optimizer': 'adam', 'graph_mode': 'off', 'use_snp_selection': True, 'num_snps': 42809}. Best is trial 89 with value: 0.30351852889597175.
[I 2025-12-06 03:59:28,414] Trial 100 finished with value: 0.2982971222337035 and parameters: {'model_type': 'mlp', 'hidden_dims': '[512, 128]', 'dropout': 0.1288135105524713, 'batch_norm': False, 'lr': 3.0578704799466306e-06, 'weight_decay': 9.552952356786674e-06, 'epochs': 171, 'loss': 'mse', 'optimizer': 'adam', 'graph_mode': 'off', 'use_snp_selection': True, 'num_snps': 37566}. Best is trial 89 with value: 0.30351852889597175.
[I 2025-12-06 04:00:14,716] Trial 101 finished with value: 0.29866119766981364 and parameters: {'model_type': 'mlp', 'hidden_dims': '[512, 128]', 'dropout': 0.21626863132136667, 'batch_norm': False, 'lr': 2.5271846343901676e-06, 'weight_decay': 1.4945985441506374e-05, 'epochs': 153, 'loss': 'mse', 'optimizer': 'adam', 'graph_mode': 'off', 'use_snp_selection': True, 'num_snps': 35281}. Best is trial 89 with value: 0.30351852889597175.
[I 2025-12-06 04:01:02,306] Trial 102 finished with value: 0.30027209932027954 and parameters: {'model_type': 'mlp', 'hidden_dims': '[512, 128]', 'dropout': 0.4277030202812725, 'batch_norm': False, 'lr': 4.252041023391271e-06, 'weight_decay': 1.9873756620033602e-05, 'epochs': 180, 'loss': 'mse', 'optimizer': 'adam', 'graph_mode': 'off', 'use_snp_selection': True, 'num_snps': 33909}. Best is trial 89 with value: 0.30351852889597175.
[I 2025-12-06 04:01:57,944] Trial 103 finished with value: 0.30006106161175233 and parameters: {'model_type': 'mlp', 'hidden_dims': '[512, 128]', 'dropout': 0.48149517698889993, 'batch_norm': False, 'lr': 4.2672877810613364e-06, 'weight_decay': 0.00042827615712278197, 'epochs': 180, 'loss': 'mse', 'optimizer': 'adam', 'graph_mode': 'off', 'use_snp_selection': True, 'num_snps': 43685}. Best is trial 89 with value: 0.30351852889597175.
[I 2025-12-06 04:02:41,634] Trial 104 finished with value: 0.2952693043221813 and parameters: {'model_type': 'mlp', 'hidden_dims': '[512, 128]', 'dropout': 0.4736620996482146, 'batch_norm': False, 'lr': 3.2399199340354223e-06, 'weight_decay': 1.9894273557276376e-05, 'epochs': 182, 'loss': 'mse', 'optimizer': 'adam', 'graph_mode': 'off', 'use_snp_selection': True, 'num_snps': 28360}. Best is trial 89 with value: 0.30351852889597175.
[I 2025-12-06 04:03:32,383] Trial 105 finished with value: 0.2978689201995463 and parameters: {'model_type': 'mlp', 'hidden_dims': '[512, 128]', 'dropout': 0.4329071252987978, 'batch_norm': False, 'lr': 5.442235073619915e-06, 'weight_decay': 5.113827591191048e-06, 'epochs': 213, 'loss': 'mse', 'optimizer': 'adam', 'graph_mode': 'off', 'use_snp_selection': True, 'num_snps': 33340}. Best is trial 89 with value: 0.30351852889597175.
[I 2025-12-06 04:04:22,307] Trial 106 finished with value: 0.2748252273066294 and parameters: {'model_type': 'mlp', 'hidden_dims': '[256, 128]', 'dropout': 0.5645851649527572, 'batch_norm': False, 'lr': 1.8011254005069158e-06, 'weight_decay': 0.0006825167826236082, 'epochs': 197, 'loss': 'mse', 'optimizer': 'adam', 'graph_mode': 'off', 'use_snp_selection': True, 'num_snps': 51199}. Best is trial 89 with value: 0.30351852889597175.
[I 2025-12-06 04:05:19,555] Trial 107 finished with value: 0.2797567119895123 and parameters: {'model_type': 'mlp', 'hidden_dims': '[512, 128]', 'dropout': 0.46212532387590183, 'batch_norm': True, 'lr': 4.002535993673753e-06, 'weight_decay': 0.00047321420725173055, 'epochs': 179, 'loss': 'mse', 'optimizer': 'adam', 'graph_mode': 'off', 'use_snp_selection': True, 'num_snps': 45657}. Best is trial 89 with value: 0.30351852889597175.
[I 2025-12-06 04:05:58,130] Trial 108 finished with value: 0.29436955996075076 and parameters: {'model_type': 'mlp', 'hidden_dims': '[512, 128]', 'dropout': 0.36969997895735557, 'batch_norm': False, 'lr': 2.308487373557554e-06, 'weight_decay': 8.538925320799888e-05, 'epochs': 191, 'loss': 'mse', 'optimizer': 'adam', 'graph_mode': 'off', 'use_snp_selection': False}. Best is trial 89 with value: 0.30351852889597175.
[I 2025-12-06 04:06:49,513] Trial 109 finished with value: 0.3009262726916805 and parameters: {'model_type': 'mlp', 'hidden_dims': '[512, 128]', 'dropout': 0.5124739633490601, 'batch_norm': False, 'lr': 6.211475769925804e-06, 'weight_decay': 3.11620719802447e-06, 'epochs': 163, 'loss': 'mse', 'optimizer': 'adam', 'graph_mode': 'off', 'use_snp_selection': True, 'num_snps': 40933}. Best is trial 89 with value: 0.30351852889597175.
[I 2025-12-06 04:07:40,792] Trial 110 finished with value: 0.2967571159865835 and parameters: {'model_type': 'mlp', 'hidden_dims': '[512, 128]', 'dropout': 0.5341247415174849, 'batch_norm': False, 'lr': 9.384322762134738e-06, 'weight_decay': 0.00017700264181364354, 'epochs': 161, 'loss': 'mse', 'optimizer': 'adam', 'graph_mode': 'off', 'use_snp_selection': True, 'num_snps': 41099}. Best is trial 89 with value: 0.30351852889597175.
[I 2025-12-06 04:08:35,034] Trial 111 finished with value: 0.3028955340022946 and parameters: {'model_type': 'mlp', 'hidden_dims': '[512, 128]', 'dropout': 0.5005010533494727, 'batch_norm': False, 'lr': 4.664172525259415e-06, 'weight_decay': 2.9782894352182218e-06, 'epochs': 168, 'loss': 'mse', 'optimizer': 'adam', 'graph_mode': 'off', 'use_snp_selection': True, 'num_snps': 43849}. Best is trial 89 with value: 0.30351852889597175.
[I 2025-12-06 04:09:25,794] Trial 112 finished with value: 0.30138869754924424 and parameters: {'model_type': 'mlp', 'hidden_dims': '[512, 128]', 'dropout': 0.49306264863964233, 'batch_norm': False, 'lr': 6.696887678219889e-06, 'weight_decay': 2.8044821634896424e-06, 'epochs': 174, 'loss': 'mse', 'optimizer': 'adam', 'graph_mode': 'off', 'use_snp_selection': True, 'num_snps': 38553}. Best is trial 89 with value: 0.30351852889597175.
[I 2025-12-06 04:10:17,200] Trial 113 finished with value: 0.3025487306105294 and parameters: {'model_type': 'mlp', 'hidden_dims': '[512, 128]', 'dropout': 0.520611854155345, 'batch_norm': False, 'lr': 6.418968429801122e-06, 'weight_decay': 3.155402352185222e-06, 'epochs': 181, 'loss': 'mse', 'optimizer': 'adam', 'graph_mode': 'off', 'use_snp_selection': True, 'num_snps': 38386}. Best is trial 89 with value: 0.30351852889597175.
[I 2025-12-06 04:11:07,689] Trial 114 finished with value: 0.30321021457035624 and parameters: {'model_type': 'mlp', 'hidden_dims': '[512, 128]', 'dropout': 0.5023358227283725, 'batch_norm': False, 'lr': 6.136578548304262e-06, 'weight_decay': 2.741098122148427e-06, 'epochs': 171, 'loss': 'mse', 'optimizer': 'adam', 'graph_mode': 'off', 'use_snp_selection': True, 'num_snps': 38616}. Best is trial 89 with value: 0.30351852889597175.
[I 2025-12-06 04:11:58,368] Trial 115 finished with value: 0.29851076525843145 and parameters: {'model_type': 'mlp', 'hidden_dims': '[512, 128]', 'dropout': 0.5057836095614748, 'batch_norm': False, 'lr': 6.140557186684115e-06, 'weight_decay': 2.9651300814940772e-06, 'epochs': 171, 'loss': 'mse', 'optimizer': 'adam', 'graph_mode': 'off', 'use_snp_selection': True, 'num_snps': 38655}. Best is trial 89 with value: 0.30351852889597175.
[I 2025-12-06 04:12:51,483] Trial 116 finished with value: 0.29031470069495463 and parameters: {'model_type': 'mlp', 'hidden_dims': '[512, 128]', 'dropout': 0.501893338777769, 'batch_norm': False, 'lr': 1.2167043218778112e-05, 'weight_decay': 2.0577766155263865e-06, 'epochs': 204, 'loss': 'mse', 'optimizer': 'adam', 'graph_mode': 'off', 'use_snp_selection': True, 'num_snps': 37885}. Best is trial 89 with value: 0.30351852889597175.
[I 2025-12-06 04:13:39,521] Trial 117 finished with value: 0.30504323694695823 and parameters: {'model_type': 'mlp', 'hidden_dims': '[512, 128]', 'dropout': 0.5399226860103415, 'batch_norm': False, 'lr': 7.264675761033936e-06, 'weight_decay': 3.3934162648842182e-06, 'epochs': 187, 'loss': 'mse', 'optimizer': 'adam', 'graph_mode': 'off', 'use_snp_selection': True, 'num_snps': 33071}. Best is trial 117 with value: 0.30504323694695823.
[I 2025-12-06 04:14:24,611] Trial 118 finished with value: 0.3034896326440275 and parameters: {'model_type': 'mlp', 'hidden_dims': '[512, 128]', 'dropout': 0.5329348769468087, 'batch_norm': False, 'lr': 7.057939616237627e-06, 'weight_decay': 2.7091475714808575e-05, 'epochs': 186, 'loss': 'mse', 'optimizer': 'adam', 'graph_mode': 'off', 'use_snp_selection': True, 'num_snps': 30263}. Best is trial 117 with value: 0.30504323694695823.
[I 2025-12-06 04:15:11,186] Trial 119 finished with value: 0.29851655669774385 and parameters: {'model_type': 'mlp', 'hidden_dims': '[512, 128]', 'dropout': 0.5419592255410267, 'batch_norm': False, 'lr': 7.153990386888236e-06, 'weight_decay': 4.030581896872091e-06, 'epochs': 218, 'loss': 'mse', 'optimizer': 'adam', 'graph_mode': 'off', 'use_snp_selection': True, 'num_snps': 28913}. Best is trial 117 with value: 0.30504323694695823.
[I 2025-12-06 04:15:52,713] Trial 120 finished with value: 0.30304952618905395 and parameters: {'model_type': 'mlp', 'hidden_dims': '[512, 128]', 'dropout': 0.5576414451463618, 'batch_norm': False, 'lr': 9.516729571918224e-06, 'weight_decay': 3.2585333848326357e-06, 'epochs': 189, 'loss': 'mse', 'optimizer': 'adam', 'graph_mode': 'off', 'use_snp_selection': True, 'num_snps': 25554}. Best is trial 117 with value: 0.30504323694695823.
[I 2025-12-06 04:16:32,685] Trial 121 finished with value: 0.30259152824535607 and parameters: {'model_type': 'mlp', 'hidden_dims': '[512, 128]', 'dropout': 0.5500952040223097, 'batch_norm': False, 'lr': 8.551192284738587e-06, 'weight_decay': 3.0871705829255005e-06, 'epochs': 189, 'loss': 'mse', 'optimizer': 'adam', 'graph_mode': 'off', 'use_snp_selection': True, 'num_snps': 23540}. Best is trial 117 with value: 0.30504323694695823.
[I 2025-12-06 04:17:15,392] Trial 122 finished with value: 0.29947454115609756 and parameters: {'model_type': 'mlp', 'hidden_dims': '[512, 128]', 'dropout': 0.5682544267362841, 'batch_norm': False, 'lr': 1.3898020992992172e-05, 'weight_decay': 3.0557936237831407e-06, 'epochs': 187, 'loss': 'mse', 'optimizer': 'adam', 'graph_mode': 'off', 'use_snp_selection': True, 'num_snps': 26971}. Best is trial 117 with value: 0.30504323694695823.
[I 2025-12-06 04:17:55,054] Trial 123 finished with value: 0.2923825777613205 and parameters: {'model_type': 'mlp', 'hidden_dims': '[512, 128]', 'dropout': 0.5536634452641421, 'batch_norm': False, 'lr': 1.9432410758099253e-05, 'weight_decay': 2.5481015385309144e-06, 'epochs': 202, 'loss': 'mse', 'optimizer': 'adam', 'graph_mode': 'off', 'use_snp_selection': True, 'num_snps': 22182}. Best is trial 117 with value: 0.30504323694695823.
[I 2025-12-06 04:18:36,968] Trial 124 finished with value: 0.2975548744731959 and parameters: {'model_type': 'mlp', 'hidden_dims': '[512, 128]', 'dropout': 0.514591946407587, 'batch_norm': False, 'lr': 9.056002478932437e-06, 'weight_decay': 1.9969026236205446e-06, 'epochs': 194, 'loss': 'mse', 'optimizer': 'adam', 'graph_mode': 'off', 'use_snp_selection': True, 'num_snps': 25374}. Best is trial 117 with value: 0.30504323694695823.
[I 2025-12-06 04:19:13,444] Trial 125 finished with value: 0.295824550139283 and parameters: {'model_type': 'mlp', 'hidden_dims': '[512, 128]', 'dropout': 0.5989607610458295, 'batch_norm': False, 'lr': 6.685218851839174e-06, 'weight_decay': 3.3191148546751374e-06, 'epochs': 174, 'loss': 'mse', 'optimizer': 'adam', 'graph_mode': 'off', 'use_snp_selection': True, 'num_snps': 20174}. Best is trial 117 with value: 0.30504323694695823.
[I 2025-12-06 04:19:55,124] Trial 126 finished with value: 0.29260573103597776 and parameters: {'model_type': 'mlp', 'hidden_dims': '[512, 128]', 'dropout': 0.4972143000108183, 'batch_norm': False, 'lr': 1.0531920109658447e-05, 'weight_decay': 1.4456509272614727e-06, 'epochs': 210, 'loss': 'mse', 'optimizer': 'adam', 'graph_mode': 'off', 'use_snp_selection': False}. Best is trial 117 with value: 0.30504323694695823.
[I 2025-12-06 04:20:29,113] Trial 127 finished with value: 0.283874831218772 and parameters: {'model_type': 'mlp', 'hidden_dims': '[256, 128, 64]', 'dropout': 0.5258117277745948, 'batch_norm': False, 'lr': 7.90815727683417e-06, 'weight_decay': 4.9808843091222385e-06, 'epochs': 188, 'loss': 'mse', 'optimizer': 'adam', 'graph_mode': 'off', 'use_snp_selection': True, 'num_snps': 23679}. Best is trial 117 with value: 0.30504323694695823.
[I 2025-12-06 04:21:04,331] Trial 128 finished with value: 0.2870287194589417 and parameters: {'model_type': 'mlp', 'hidden_dims': '[128, 64]', 'dropout': 0.5447360111689241, 'batch_norm': True, 'lr': 8.131974044568915e-06, 'weight_decay': 2.5662805096176635e-05, 'epochs': 197, 'loss': 'mse', 'optimizer': 'adam', 'graph_mode': 'off', 'use_snp_selection': True, 'num_snps': 32290}. Best is trial 117 with value: 0.30504323694695823.
[I 2025-12-06 04:21:54,264] Trial 129 finished with value: 0.3029964796220132 and parameters: {'model_type': 'mlp', 'hidden_dims': '[512, 128]', 'dropout': 0.5763193371469858, 'batch_norm': False, 'lr': 6.0758025665709245e-06, 'weight_decay': 2.6826278948637594e-06, 'epochs': 184, 'loss': 'mse', 'optimizer': 'adam', 'graph_mode': 'off', 'use_snp_selection': True, 'num_snps': 36347}. Best is trial 117 with value: 0.30504323694695823.
[I 2025-12-06 04:22:43,227] Trial 130 finished with value: 0.30022634869246617 and parameters: {'model_type': 'mlp', 'hidden_dims': '[512, 128]', 'dropout': 0.566659711891416, 'batch_norm': False, 'lr': 5.972238669136511e-06, 'weight_decay': 6.2052533826772395e-06, 'epochs': 183, 'loss': 'mse', 'optimizer': 'adam', 'graph_mode': 'off', 'use_snp_selection': True, 'num_snps': 35645}. Best is trial 117 with value: 0.30504323694695823.
[I 2025-12-06 04:23:30,728] Trial 131 finished with value: 0.30267177643332155 and parameters: {'model_type': 'mlp', 'hidden_dims': '[512, 128]', 'dropout': 0.5882275444972539, 'batch_norm': False, 'lr': 6.863396488567565e-06, 'weight_decay': 2.402227853011955e-06, 'epochs': 164, 'loss': 'mse', 'optimizer': 'adam', 'graph_mode': 'off', 'use_snp_selection': True, 'num_snps': 36190}. Best is trial 117 with value: 0.30504323694695823.
[I 2025-12-06 04:24:14,789] Trial 132 finished with value: 0.30270885763931793 and parameters: {'model_type': 'mlp', 'hidden_dims': '[512, 128]', 'dropout': 0.5545261844635394, 'batch_norm': False, 'lr': 9.019553533605146e-06, 'weight_decay': 3.0949000670337896e-06, 'epochs': 169, 'loss': 'mse', 'optimizer': 'adam', 'graph_mode': 'off', 'use_snp_selection': True, 'num_snps': 30080}. Best is trial 117 with value: 0.30504323694695823.
[I 2025-12-06 04:24:57,980] Trial 133 finished with value: 0.3037363781139609 and parameters: {'model_type': 'mlp', 'hidden_dims': '[512, 128]', 'dropout': 0.5833435862134251, 'batch_norm': False, 'lr': 1.2212286646255962e-05, 'weight_decay': 2.726852036539922e-06, 'epochs': 163, 'loss': 'mse', 'optimizer': 'adam', 'graph_mode': 'off', 'use_snp_selection': True, 'num_snps': 30557}. Best is trial 117 with value: 0.30504323694695823.
[I 2025-12-06 04:25:42,751] Trial 134 finished with value: 0.30146308738372174 and parameters: {'model_type': 'mlp', 'hidden_dims': '[512, 256]', 'dropout': 0.5798488126409551, 'batch_norm': False, 'lr': 9.274776086158385e-06, 'weight_decay': 1.8273909507114148e-06, 'epochs': 177, 'loss': 'mse', 'optimizer': 'adam', 'graph_mode': 'off', 'use_snp_selection': True, 'num_snps': 31085}. Best is trial 117 with value: 0.30504323694695823.
[I 2025-12-06 04:26:27,702] Trial 135 finished with value: 0.29565662967546535 and parameters: {'model_type': 'mlp', 'hidden_dims': '[512, 256]', 'dropout': 0.5842421088517983, 'batch_norm': False, 'lr': 1.3042767672673371e-05, 'weight_decay': 2.4665474360144793e-06, 'epochs': 190, 'loss': 'mse', 'optimizer': 'adam', 'graph_mode': 'off', 'use_snp_selection': True, 'num_snps': 29403}. Best is trial 117 with value: 0.30504323694695823.
[I 2025-12-06 04:27:12,289] Trial 136 finished with value: 0.3043793024090041 and parameters: {'model_type': 'mlp', 'hidden_dims': '[512, 256]', 'dropout': 0.5731800860987734, 'batch_norm': False, 'lr': 9.612230365398273e-06, 'weight_decay': 1.7339219144533667e-06, 'epochs': 182, 'loss': 'mse', 'optimizer': 'adam', 'graph_mode': 'off', 'use_snp_selection': True, 'num_snps': 30209}. Best is trial 117 with value: 0.30504323694695823.
