[I 2025-12-05 15:39:45,712] Trial 24 finished with value: 0.07738520251177924 and parameters: {'model_type': 'mlp', 'hidden_dims': '[256, 128]', 'dropout': 0.2396674319803947, 'batch_norm': True, 'lr': 8.566979223530043e-05, 'weight_decay': 9.077648866573408e-06, 'epochs': 316, 'loss': 'mae', 'optimizer': 'adam', 'graph_mode': 'off', 'use_snp_selection': False}. Best is trial 3 with value: 0.09232537096264276.
[I 2025-12-05 15:39:47,512] Trial 25 finished with value: 0.07292767344328804 and parameters: {'model_type': 'mlp', 'hidden_dims': '[512, 256]', 'dropout': 0.1337666292612962, 'batch_norm': True, 'lr': 0.000377510212273367, 'weight_decay': 9.937771316832018e-07, 'epochs': 285, 'loss': 'mae', 'optimizer': 'adam', 'graph_mode': 'off', 'use_snp_selection': False}. Best is trial 3 with value: 0.09232537096264276.
[I 2025-12-05 15:39:48,435] Trial 26 finished with value: 0.0362397694386414 and parameters: {'model_type': 'mlp', 'hidden_dims': '[128, 64]', 'dropout': 0.17348528108784098, 'batch_norm': True, 'lr': 0.00010468432845632438, 'weight_decay': 7.229794675382694e-06, 'epochs': 240, 'loss': 'mse', 'optimizer': 'adam', 'graph_mode': 'off', 'use_snp_selection': True, 'num_snps': 3842}. Best is trial 3 with value: 0.09232537096264276.
[I 2025-12-05 15:39:49,479] Trial 27 finished with value: 0.03638738697346884 and parameters: {'model_type': 'mlp', 'hidden_dims': '[256, 128, 64]', 'dropout': 0.22858352329656204, 'batch_norm': True, 'lr': 3.708794373669967e-05, 'weight_decay': 2.4749864708859688e-05, 'epochs': 219, 'loss': 'mae', 'optimizer': 'adam', 'graph_mode': 'off', 'use_snp_selection': False}. Best is trial 3 with value: 0.09232537096264276.
[I 2025-12-05 15:39:50,551] Trial 28 finished with value: 0.05370968878925261 and parameters: {'model_type': 'mlp', 'hidden_dims': '[512, 128]', 'dropout': 0.5446517125861265, 'batch_norm': False, 'lr': 1.597687963134124e-05, 'weight_decay': 2.7636258120272585e-06, 'epochs': 104, 'loss': 'mse', 'optimizer': 'adam', 'graph_mode': 'off', 'use_snp_selection': False}. Best is trial 3 with value: 0.09232537096264276.
[I 2025-12-05 15:39:52,067] Trial 29 finished with value: -0.020217614337476503 and parameters: {'model_type': 'mlp', 'hidden_dims': '[128, 64]', 'dropout': 0.4540184348968538, 'batch_norm': True, 'lr': 2.5087654566083747e-06, 'weight_decay': 7.815603438753506e-05, 'epochs': 335, 'loss': 'mae', 'optimizer': 'adam', 'graph_mode': 'off', 'use_snp_selection': True, 'num_snps': 19468}. Best is trial 3 with value: 0.09232537096264276.
[I 2025-12-05 15:39:54,004] Trial 30 finished with value: 0.04154785564448522 and parameters: {'model_type': 'mlp', 'hidden_dims': '[512, 64]', 'dropout': 0.2862570092683302, 'batch_norm': True, 'lr': 7.6088254603734275e-06, 'weight_decay': 1.3681530648782092e-05, 'epochs': 329, 'loss': 'mae', 'optimizer': 'adam', 'graph_mode': 'off', 'use_snp_selection': False}. Best is trial 3 with value: 0.09232537096264276.
[I 2025-12-05 15:39:55,860] Trial 31 finished with value: 0.07912680150383282 and parameters: {'model_type': 'mlp', 'hidden_dims': '[512, 128]', 'dropout': 0.10131407579169126, 'batch_norm': True, 'lr': 0.0002743812046604449, 'weight_decay': 2.1861951461389466e-05, 'epochs': 307, 'loss': 'mae', 'optimizer': 'adam', 'graph_mode': 'off', 'use_snp_selection': False}. Best is trial 3 with value: 0.09232537096264276.
[I 2025-12-05 15:39:57,879] Trial 32 finished with value: 0.07453609132896406 and parameters: {'model_type': 'mlp', 'hidden_dims': '[512, 128]', 'dropout': 0.12104564566635978, 'batch_norm': True, 'lr': 0.00016992466767930272, 'weight_decay': 1.4938374201254877e-05, 'epochs': 347, 'loss': 'mae', 'optimizer': 'adam', 'graph_mode': 'off', 'use_snp_selection': False}. Best is trial 3 with value: 0.09232537096264276.
[I 2025-12-05 15:39:59,711] Trial 33 finished with value: 0.06980506187446352 and parameters: {'model_type': 'mlp', 'hidden_dims': '[512, 128]', 'dropout': 0.16745231117324713, 'batch_norm': True, 'lr': 0.0004455109728495609, 'weight_decay': 5.79263108851667e-05, 'epochs': 301, 'loss': 'mae', 'optimizer': 'adam', 'graph_mode': 'off', 'use_snp_selection': False}. Best is trial 3 with value: 0.09232537096264276.
[I 2025-12-05 15:40:01,408] Trial 34 finished with value: 0.09593287891374981 and parameters: {'model_type': 'mlp', 'hidden_dims': '[512, 128]', 'dropout': 0.19976918759413487, 'batch_norm': True, 'lr': 0.0001080511562916436, 'weight_decay': 4.287582222483842e-06, 'epochs': 263, 'loss': 'mae', 'optimizer': 'adam', 'graph_mode': 'off', 'use_snp_selection': False}. Best is trial 34 with value: 0.09593287891374981.
[I 2025-12-05 15:40:04,066] Trial 35 finished with value: 0.06795611018837698 and parameters: {'model_type': 'mlp', 'hidden_dims': '[256, 128]', 'dropout': 0.1999539733374936, 'batch_norm': True, 'lr': 0.00011590542418240868, 'weight_decay': 3.417240136310757e-06, 'epochs': 268, 'loss': 'mae', 'optimizer': 'adam', 'graph_mode': 'off', 'use_snp_selection': True, 'num_snps': 57586}. Best is trial 34 with value: 0.09593287891374981.
[I 2025-12-05 15:40:05,757] Trial 36 finished with value: 0.05959510466712026 and parameters: {'model_type': 'mlp', 'hidden_dims': '[512, 128]', 'dropout': 0.3593044929650513, 'batch_norm': True, 'lr': 4.540258121947925e-05, 'weight_decay': 8.552606956987923e-07, 'epochs': 250, 'loss': 'mse', 'optimizer': 'adam', 'graph_mode': 'off', 'use_snp_selection': False}. Best is trial 34 with value: 0.09593287891374981.
[I 2025-12-05 15:40:07,390] Trial 37 finished with value: 0.022201042254498763 and parameters: {'model_type': 'mlp', 'hidden_dims': '[256, 128, 64]', 'dropout': 0.1517826839636935, 'batch_norm': True, 'lr': 1.08570214541948e-06, 'weight_decay': 1.8442616421672508e-07, 'epochs': 280, 'loss': 'mae', 'optimizer': 'adam', 'graph_mode': 'off', 'use_snp_selection': True, 'num_snps': 22282}. Best is trial 34 with value: 0.09593287891374981.
[I 2025-12-05 15:40:09,302] Trial 38 finished with value: 0.051366583023758204 and parameters: {'model_type': 'mlp', 'hidden_dims': '[512, 64]', 'dropout': 0.43830859068955674, 'batch_norm': False, 'lr': 5.772025520732985e-05, 'weight_decay': 1.5495529996055432e-06, 'epochs': 328, 'loss': 'mse', 'optimizer': 'adam', 'graph_mode': 'off', 'use_snp_selection': False}. Best is trial 34 with value: 0.09593287891374981.
[I 2025-12-05 15:40:10,497] Trial 39 finished with value: 0.07231431191591237 and parameters: {'model_type': 'mlp', 'hidden_dims': '[512, 256]', 'dropout': 0.40491549826838436, 'batch_norm': True, 'lr': 7.495297760282188e-05, 'weight_decay': 0.000494866061743946, 'epochs': 133, 'loss': 'mae', 'optimizer': 'adam', 'graph_mode': 'off', 'use_snp_selection': False}. Best is trial 34 with value: 0.09593287891374981.
[I 2025-12-05 15:40:11,470] Trial 40 finished with value: 0.06728686804877365 and parameters: {'model_type': 'mlp', 'hidden_dims': '[256, 128]', 'dropout': 0.22109827906856022, 'batch_norm': False, 'lr': 2.8208934112801126e-05, 'weight_decay': 8.869788026886721e-06, 'epochs': 198, 'loss': 'mae', 'optimizer': 'adam', 'graph_mode': 'off', 'use_snp_selection': False}. Best is trial 34 with value: 0.09593287891374981.
[I 2025-12-05 15:40:13,290] Trial 41 finished with value: 0.07254211066160086 and parameters: {'model_type': 'mlp', 'hidden_dims': '[512, 128]', 'dropout': 0.12249700361871607, 'batch_norm': True, 'lr': 0.00023310517743698188, 'weight_decay': 3.507085579453878e-05, 'epochs': 295, 'loss': 'mae', 'optimizer': 'adam', 'graph_mode': 'off', 'use_snp_selection': False}. Best is trial 34 with value: 0.09593287891374981.
[I 2025-12-05 15:40:15,208] Trial 42 finished with value: 0.07066919153821813 and parameters: {'model_type': 'mlp', 'hidden_dims': '[512, 128]', 'dropout': 0.17867056917806715, 'batch_norm': True, 'lr': 0.00012403437140894093, 'weight_decay': 0.00013269513698562676, 'epochs': 315, 'loss': 'mae', 'optimizer': 'adam', 'graph_mode': 'off', 'use_snp_selection': False}. Best is trial 34 with value: 0.09593287891374981.
[I 2025-12-05 15:40:16,936] Trial 43 finished with value: 0.07980003606208358 and parameters: {'model_type': 'mlp', 'hidden_dims': '[512, 128]', 'dropout': 0.15244288637144, 'batch_norm': True, 'lr': 0.0005280207749412183, 'weight_decay': 1.5547529088718643e-05, 'epochs': 272, 'loss': 'mae', 'optimizer': 'adam', 'graph_mode': 'off', 'use_snp_selection': False}. Best is trial 34 with value: 0.09593287891374981.
[I 2025-12-05 15:40:18,657] Trial 44 finished with value: 0.06996459740809655 and parameters: {'model_type': 'mlp', 'hidden_dims': '[512, 128]', 'dropout': 0.2505184396367674, 'batch_norm': True, 'lr': 0.0005144364155604736, 'weight_decay': 5.615344037429207e-06, 'epochs': 270, 'loss': 'mae', 'optimizer': 'adam', 'graph_mode': 'off', 'use_snp_selection': False}. Best is trial 34 with value: 0.09593287891374981.
[I 2025-12-05 15:40:20,208] Trial 45 finished with value: 0.09580588743127823 and parameters: {'model_type': 'mlp', 'hidden_dims': '[512, 64]', 'dropout': 0.15487895709141983, 'batch_norm': True, 'lr': 0.0008508645406653507, 'weight_decay': 1.2449055564487435e-05, 'epochs': 227, 'loss': 'mse', 'optimizer': 'adam', 'graph_mode': 'off', 'use_snp_selection': False}. Best is trial 34 with value: 0.09593287891374981.
[I 2025-12-05 15:40:21,749] Trial 46 finished with value: 0.08730175499005291 and parameters: {'model_type': 'mlp', 'hidden_dims': '[512, 64]', 'dropout': 0.19449137343536227, 'batch_norm': True, 'lr': 0.0008369130101905696, 'weight_decay': 2.3347155149538838e-07, 'epochs': 224, 'loss': 'mse', 'optimizer': 'adam', 'graph_mode': 'off', 'use_snp_selection': False}. Best is trial 34 with value: 0.09593287891374981.
[I 2025-12-05 15:40:23,255] Trial 47 finished with value: 0.03099345050464685 and parameters: {'model_type': 'mlp', 'hidden_dims': '[512, 64]', 'dropout': 0.1943029975323748, 'batch_norm': False, 'lr': 0.0008855346809722965, 'weight_decay': 4.91227783218422e-07, 'epochs': 213, 'loss': 'mse', 'optimizer': 'adam', 'graph_mode': 'off', 'use_snp_selection': False}. Best is trial 34 with value: 0.09593287891374981.
[I 2025-12-05 15:40:25,566] Trial 48 finished with value: 0.035231964037552084 and parameters: {'model_type': 'mlp', 'hidden_dims': '[512, 64]', 'dropout': 0.286606519186659, 'batch_norm': True, 'lr': 4.417794726697793e-06, 'weight_decay': 2.364590375927107e-07, 'epochs': 177, 'loss': 'mse', 'optimizer': 'adam', 'graph_mode': 'off', 'use_snp_selection': True, 'num_snps': 43224}. Best is trial 34 with value: 0.09593287891374981.
[I 2025-12-05 15:40:27,147] Trial 49 finished with value: 0.07472941193933644 and parameters: {'model_type': 'mlp', 'hidden_dims': '[512, 64]', 'dropout': 0.263738533718499, 'batch_norm': False, 'lr': 9.008164207430076e-06, 'weight_decay': 2.5058941896697787e-07, 'epochs': 239, 'loss': 'mse', 'optimizer': 'adam', 'graph_mode': 'off', 'use_snp_selection': False}. Best is trial 34 with value: 0.09593287891374981.
[I 2025-12-05 15:40:28,686] Trial 50 finished with value: 0.07982322695638974 and parameters: {'model_type': 'mlp', 'hidden_dims': '[512, 64]', 'dropout': 0.20942200558635868, 'batch_norm': True, 'lr': 2.0024062321654754e-05, 'weight_decay': 1.8330875011753703e-06, 'epochs': 224, 'loss': 'mse', 'optimizer': 'adam', 'graph_mode': 'off', 'use_snp_selection': False}. Best is trial 34 with value: 0.09593287891374981.
[I 2025-12-05 15:40:29,982] Trial 51 finished with value: 0.08838237530847179 and parameters: {'model_type': 'mlp', 'hidden_dims': '[512, 64]', 'dropout': 0.12621097418599958, 'batch_norm': True, 'lr': 0.00071016249461313, 'weight_decay': 7.757526869723788e-07, 'epochs': 160, 'loss': 'mse', 'optimizer': 'adam', 'graph_mode': 'off', 'use_snp_selection': False}. Best is trial 34 with value: 0.09593287891374981.
[I 2025-12-05 15:40:31,320] Trial 52 finished with value: 0.10875387441577535 and parameters: {'model_type': 'mlp', 'hidden_dims': '[512, 64]', 'dropout': 0.16035311883223513, 'batch_norm': True, 'lr': 0.0008705957706504356, 'weight_decay': 7.09461406061986e-07, 'epochs': 164, 'loss': 'mse', 'optimizer': 'adam', 'graph_mode': 'off', 'use_snp_selection': False}. Best is trial 52 with value: 0.10875387441577535.
[I 2025-12-05 15:40:32,631] Trial 53 finished with value: 0.08893671139840015 and parameters: {'model_type': 'mlp', 'hidden_dims': '[512, 64]', 'dropout': 0.16727523061308355, 'batch_norm': True, 'lr': 0.0007340506645245385, 'weight_decay': 2.7893297078748404e-07, 'epochs': 163, 'loss': 'mse', 'optimizer': 'adam', 'graph_mode': 'off', 'use_snp_selection': False}. Best is trial 52 with value: 0.10875387441577535.
[I 2025-12-05 15:40:33,917] Trial 54 finished with value: 0.10102108813027778 and parameters: {'model_type': 'mlp', 'hidden_dims': '[512, 64]', 'dropout': 0.16723411800343355, 'batch_norm': True, 'lr': 0.00037979074184680693, 'weight_decay': 1.0182989024976417e-06, 'epochs': 157, 'loss': 'mse', 'optimizer': 'adam', 'graph_mode': 'off', 'use_snp_selection': False}. Best is trial 52 with value: 0.10875387441577535.
[I 2025-12-05 15:40:35,084] Trial 55 finished with value: 0.08215435097501284 and parameters: {'model_type': 'mlp', 'hidden_dims': '[512, 64]', 'dropout': 0.16469684447426738, 'batch_norm': True, 'lr': 0.00034365681791759185, 'weight_decay': 3.569818874058206e-07, 'epochs': 126, 'loss': 'mse', 'optimizer': 'adam', 'graph_mode': 'off', 'use_snp_selection': False}. Best is trial 52 with value: 0.10875387441577535.
[I 2025-12-05 15:40:36,377] Trial 56 finished with value: 0.02614840086382122 and parameters: {'model_type': 'mlp', 'hidden_dims': '[512, 64]', 'dropout': 0.5615917849015515, 'batch_norm': False, 'lr': 0.00021122309392201485, 'weight_decay': 1.2372107531246904e-06, 'epochs': 162, 'loss': 'mse', 'optimizer': 'adam', 'graph_mode': 'off', 'use_snp_selection': False}. Best is trial 52 with value: 0.10875387441577535.
[I 2025-12-05 15:40:37,793] Trial 57 finished with value: 0.0752144159701195 and parameters: {'model_type': 'mlp', 'hidden_dims': '[512, 64]', 'dropout': 0.1397872213410843, 'batch_norm': True, 'lr': 0.0009986050501766255, 'weight_decay': 2.6313761973344906e-06, 'epochs': 191, 'loss': 'mse', 'optimizer': 'adam', 'graph_mode': 'off', 'use_snp_selection': False}. Best is trial 52 with value: 0.10875387441577535.
[I 2025-12-05 15:40:39,024] Trial 58 finished with value: 0.0918203884963417 and parameters: {'model_type': 'mlp', 'hidden_dims': '[512, 64]', 'dropout': 0.3741858622390406, 'batch_norm': True, 'lr': 0.0004138030159857986, 'weight_decay': 3.704622501762142e-07, 'epochs': 144, 'loss': 'mse', 'optimizer': 'adam', 'graph_mode': 'off', 'use_snp_selection': False}. Best is trial 52 with value: 0.10875387441577535.
[I 2025-12-05 15:40:40,269] Trial 59 finished with value: 0.06642518964104889 and parameters: {'model_type': 'mlp', 'hidden_dims': '[512, 64]', 'dropout': 0.5093833972683453, 'batch_norm': True, 'lr': 0.0003899068953727176, 'weight_decay': 1.6139406775110432e-07, 'epochs': 144, 'loss': 'mse', 'optimizer': 'adam', 'graph_mode': 'off', 'use_snp_selection': False}. Best is trial 52 with value: 0.10875387441577535.
[I 2025-12-05 15:40:41,506] Trial 60 finished with value: -0.02787197530879098 and parameters: {'model_type': 'mlp', 'hidden_dims': '[512, 64]', 'dropout': 0.36476731821910524, 'batch_norm': False, 'lr': 0.0006031665478955662, 'weight_decay': 3.4811561806249164e-06, 'epochs': 146, 'loss': 'mse', 'optimizer': 'adam', 'graph_mode': 'off', 'use_snp_selection': False}. Best is trial 52 with value: 0.10875387441577535.
[I 2025-12-05 15:40:42,990] Trial 61 finished with value: 0.08627117455654411 and parameters: {'model_type': 'mlp', 'hidden_dims': '[512, 64]', 'dropout': 0.185522073419997, 'batch_norm': True, 'lr': 0.000704371377163673, 'weight_decay': 3.395357324637725e-07, 'epochs': 209, 'loss': 'mse', 'optimizer': 'adam', 'graph_mode': 'off', 'use_snp_selection': False}. Best is trial 52 with value: 0.10875387441577535.
[I 2025-12-05 15:40:44,179] Trial 62 finished with value: 0.08310241001171956 and parameters: {'model_type': 'mlp', 'hidden_dims': '[512, 64]', 'dropout': 0.3258383727782174, 'batch_norm': True, 'lr': 0.0004430524054452216, 'weight_decay': 6.28762079952315e-07, 'epochs': 131, 'loss': 'mse', 'optimizer': 'adam', 'graph_mode': 'off', 'use_snp_selection': False}. Best is trial 52 with value: 0.10875387441577535.
[I 2025-12-05 15:40:44,934] Trial 63 finished with value: 0.08178158442004187 and parameters: {'model_type': 'mlp', 'hidden_dims': '[128, 64]', 'dropout': 0.16358556914559394, 'batch_norm': True, 'lr': 0.0003133921674956393, 'weight_decay': 1.1945154543185108e-06, 'epochs': 170, 'loss': 'mse', 'optimizer': 'adam', 'graph_mode': 'off', 'use_snp_selection': False}. Best is trial 52 with value: 0.10875387441577535.
[I 2025-12-05 15:40:45,917] Trial 64 finished with value: 0.07627116251161056 and parameters: {'model_type': 'mlp', 'hidden_dims': '[512, 64]', 'dropout': 0.22741595621940924, 'batch_norm': True, 'lr': 0.0007402246490681747, 'weight_decay': 4.491964770550466e-07, 'epochs': 75, 'loss': 'mse', 'optimizer': 'adam', 'graph_mode': 'off', 'use_snp_selection': False}. Best is trial 52 with value: 0.10875387441577535.
[I 2025-12-05 15:40:47,301] Trial 65 finished with value: 0.07995563490225781 and parameters: {'model_type': 'mlp', 'hidden_dims': '[512, 64]', 'dropout': 0.4758306611251375, 'batch_norm': True, 'lr': 0.0005590509950618423, 'weight_decay': 1.0392340699652893e-07, 'epochs': 183, 'loss': 'mse', 'optimizer': 'adam', 'graph_mode': 'off', 'use_snp_selection': False}. Best is trial 52 with value: 0.10875387441577535.
[I 2025-12-05 15:40:48,136] Trial 66 finished with value: 0.03845547853128463 and parameters: {'model_type': 'mlp', 'hidden_dims': '[256, 128, 64]', 'dropout': 0.5966225131734725, 'batch_norm': True, 'lr': 0.00026769412160208486, 'weight_decay': 2.876268555417112e-05, 'epochs': 116, 'loss': 'mse', 'optimizer': 'adam', 'graph_mode': 'off', 'use_snp_selection': True, 'num_snps': 3487}. Best is trial 52 with value: 0.10875387441577535.
[I 2025-12-05 15:40:49,405] Trial 67 finished with value: 0.08589277596023343 and parameters: {'model_type': 'mlp', 'hidden_dims': '[512, 256]', 'dropout': 0.3925019486548138, 'batch_norm': True, 'lr': 0.00037251572735875815, 'weight_decay': 2.0507123166310267e-06, 'epochs': 151, 'loss': 'mse', 'optimizer': 'adam', 'graph_mode': 'off', 'use_snp_selection': False}. Best is trial 52 with value: 0.10875387441577535.
[I 2025-12-05 15:40:50,606] Trial 68 finished with value: 0.06856283995442608 and parameters: {'model_type': 'mlp', 'hidden_dims': '[512, 64]', 'dropout': 0.20676131639151085, 'batch_norm': False, 'lr': 0.0004690283444868515, 'weight_decay': 6.253161558452302e-07, 'epochs': 137, 'loss': 'mse', 'optimizer': 'adam', 'graph_mode': 'off', 'use_snp_selection': False}. Best is trial 52 with value: 0.10875387441577535.
[I 2025-12-05 15:40:52,066] Trial 69 finished with value: 0.07953869836052282 and parameters: {'model_type': 'mlp', 'hidden_dims': '[512, 64]', 'dropout': 0.42532402450125834, 'batch_norm': True, 'lr': 0.0008073295921256243, 'weight_decay': 1.1898110300230983e-05, 'epochs': 202, 'loss': 'mse', 'optimizer': 'adam', 'graph_mode': 'off', 'use_snp_selection': False}. Best is trial 52 with value: 0.10875387441577535.
[I 2025-12-05 15:40:52,848] Trial 70 finished with value: 0.062466836260072385 and parameters: {'model_type': 'mlp', 'hidden_dims': '[256, 128]', 'dropout': 0.13533802267881004, 'batch_norm': True, 'lr': 0.0001961298488783565, 'weight_decay': 7.724881042338304e-06, 'epochs': 91, 'loss': 'mse', 'optimizer': 'adam', 'graph_mode': 'off', 'use_snp_selection': False}. Best is trial 52 with value: 0.10875387441577535.
[I 2025-12-05 15:40:54,166] Trial 71 finished with value: 0.09922527028430149 and parameters: {'model_type': 'mlp', 'hidden_dims': '[512, 64]', 'dropout': 0.13283835118668721, 'batch_norm': True, 'lr': 0.0006919843683577916, 'weight_decay': 3.0104292567107246e-07, 'epochs': 162, 'loss': 'mse', 'optimizer': 'adam', 'graph_mode': 'off', 'use_snp_selection': False}. Best is trial 52 with value: 0.10875387441577535.
[I 2025-12-05 15:40:55,475] Trial 72 finished with value: 0.0762378341803412 and parameters: {'model_type': 'mlp', 'hidden_dims': '[512, 64]', 'dropout': 0.10935777484145029, 'batch_norm': True, 'lr': 0.00014544292589624633, 'weight_decay': 1.4601071095380235e-07, 'epochs': 164, 'loss': 'mse', 'optimizer': 'adam', 'graph_mode': 'off', 'use_snp_selection': False}. Best is trial 52 with value: 0.10875387441577535.
[I 2025-12-05 15:40:56,860] Trial 73 finished with value: 0.08090096765475292 and parameters: {'model_type': 'mlp', 'hidden_dims': '[512, 64]', 'dropout': 0.15919183244539298, 'batch_norm': True, 'lr': 0.0006785089672655901, 'weight_decay': 7.877540883303854e-07, 'epochs': 182, 'loss': 'mse', 'optimizer': 'adam', 'graph_mode': 'off', 'use_snp_selection': False}. Best is trial 52 with value: 0.10875387441577535.
[I 2025-12-05 15:40:58,140] Trial 74 finished with value: 0.0754457321954492 and parameters: {'model_type': 'mlp', 'hidden_dims': '[512, 64]', 'dropout': 0.1456022997713839, 'batch_norm': True, 'lr': 0.000941477576966299, 'weight_decay': 2.919037600640238e-07, 'epochs': 156, 'loss': 'mse', 'optimizer': 'adam', 'graph_mode': 'off', 'use_snp_selection': False}. Best is trial 52 with value: 0.10875387441577535.
[I 2025-12-05 15:40:58,897] Trial 75 finished with value: 0.07628327088655551 and parameters: {'model_type': 'mlp', 'hidden_dims': '[128, 64]', 'dropout': 0.12102945933662687, 'batch_norm': True, 'lr': 0.0005866999641243914, 'weight_decay': 4.819362779425786e-07, 'epochs': 170, 'loss': 'mse', 'optimizer': 'adam', 'graph_mode': 'off', 'use_snp_selection': False}. Best is trial 52 with value: 0.10875387441577535.
