[I 2025-12-06 01:10:19,988] Trial 11 finished with value: 0.36837075726528135 and parameters: {'model_type': 'mlp', 'hidden_dims': '[256, 128]', 'dropout': 0.583942291816117, 'batch_norm': False, 'lr': 1.422933652790185e-05, 'weight_decay': 2.805519019095577e-06, 'epochs': 231, 'loss': 'mse', 'optimizer': 'adam', 'graph_mode': 'off', 'use_snp_selection': False}. Best is trial 3 with value: 0.38052509421805986.
[I 2025-12-06 01:10:47,160] Trial 12 finished with value: 0.37882072630808283 and parameters: {'model_type': 'mlp', 'hidden_dims': '[256, 128]', 'dropout': 0.593097749012682, 'batch_norm': False, 'lr': 1.1374686318732863e-05, 'weight_decay': 1.3081036432574914e-07, 'epochs': 233, 'loss': 'mae', 'optimizer': 'adam', 'graph_mode': 'off', 'use_snp_selection': False}. Best is trial 3 with value: 0.38052509421805986.
[I 2025-12-06 01:11:06,693] Trial 13 finished with value: 0.3711693886778445 and parameters: {'model_type': 'mlp', 'hidden_dims': '[128, 64]', 'dropout': 0.5043641748401543, 'batch_norm': False, 'lr': 1.262035332095525e-05, 'weight_decay': 1.0885943577911259e-07, 'epochs': 285, 'loss': 'mae', 'optimizer': 'adam', 'graph_mode': 'off', 'use_snp_selection': False}. Best is trial 3 with value: 0.38052509421805986.
[I 2025-12-06 01:12:17,523] Trial 14 finished with value: 0.38093325253909305 and parameters: {'model_type': 'mlp', 'hidden_dims': '[512, 256]', 'dropout': 0.5300180653494536, 'batch_norm': False, 'lr': 5.096356034191146e-06, 'weight_decay': 4.7581885634242365e-05, 'epochs': 345, 'loss': 'mae', 'optimizer': 'adam', 'graph_mode': 'off', 'use_snp_selection': False}. Best is trial 14 with value: 0.38093325253909305.
[I 2025-12-06 01:13:25,565] Trial 15 finished with value: 0.38151508524426697 and parameters: {'model_type': 'mlp', 'hidden_dims': '[512, 256]', 'dropout': 0.50071393962227, 'batch_norm': False, 'lr': 3.521500355955208e-06, 'weight_decay': 5.343087596659364e-05, 'epochs': 330, 'loss': 'mae', 'optimizer': 'adam', 'graph_mode': 'off', 'use_snp_selection': False}. Best is trial 15 with value: 0.38151508524426697.
[I 2025-12-06 01:14:37,387] Trial 16 finished with value: 0.3813042625246936 and parameters: {'model_type': 'mlp', 'hidden_dims': '[512, 256]', 'dropout': 0.5002984888112975, 'batch_norm': False, 'lr': 2.776964597283163e-06, 'weight_decay': 0.00010327647972979406, 'epochs': 350, 'loss': 'mae', 'optimizer': 'adam', 'graph_mode': 'off', 'use_snp_selection': False}. Best is trial 15 with value: 0.38151508524426697.
[I 2025-12-06 01:15:35,256] Trial 17 finished with value: 0.1373333983244885 and parameters: {'model_type': 'mlp', 'hidden_dims': '[512, 256]', 'dropout': 0.31226206234945486, 'batch_norm': False, 'lr': 0.000906375209920231, 'weight_decay': 0.00011963152281611286, 'epochs': 287, 'loss': 'mae', 'optimizer': 'adam', 'graph_mode': 'off', 'use_snp_selection': False}. Best is trial 15 with value: 0.38151508524426697.
[I 2025-12-06 01:16:59,253] Trial 18 finished with value: 0.3691040648933736 and parameters: {'model_type': 'mlp', 'hidden_dims': '[512, 256]', 'dropout': 0.46953439188759805, 'batch_norm': False, 'lr': 2.20854053649772e-05, 'weight_decay': 0.00012013537845192107, 'epochs': 267, 'loss': 'mae', 'optimizer': 'adam', 'graph_mode': 'off', 'use_snp_selection': True, 'num_snps': 58241}. Best is trial 15 with value: 0.38151508524426697.
[I 2025-12-06 01:18:03,715] Trial 19 finished with value: 0.3762971113521497 and parameters: {'model_type': 'mlp', 'hidden_dims': '[512, 256]', 'dropout': 0.3227351640289775, 'batch_norm': False, 'lr': 2.7960991179492955e-06, 'weight_decay': 4.5755775204291734e-06, 'epochs': 312, 'loss': 'mae', 'optimizer': 'adam', 'graph_mode': 'off', 'use_snp_selection': False}. Best is trial 15 with value: 0.38151508524426697.
[I 2025-12-06 01:18:42,318] Trial 20 finished with value: 0.3244673936728879 and parameters: {'model_type': 'mlp', 'hidden_dims': '[256, 128, 64]', 'dropout': 0.5197256087787444, 'batch_norm': False, 'lr': 1.0181100442776892e-06, 'weight_decay': 4.679666515308887e-05, 'epochs': 343, 'loss': 'mae', 'optimizer': 'adam', 'graph_mode': 'off', 'use_snp_selection': False}. Best is trial 15 with value: 0.38151508524426697.
[I 2025-12-06 01:19:53,604] Trial 21 finished with value: 0.37465988088221147 and parameters: {'model_type': 'mlp', 'hidden_dims': '[512, 256]', 'dropout': 0.5219093397919055, 'batch_norm': False, 'lr': 4.856756135144904e-06, 'weight_decay': 5.716499215855274e-05, 'epochs': 347, 'loss': 'mae', 'optimizer': 'adam', 'graph_mode': 'off', 'use_snp_selection': False}. Best is trial 15 with value: 0.38151508524426697.
[I 2025-12-06 01:20:57,232] Trial 22 finished with value: 0.3812602550207574 and parameters: {'model_type': 'mlp', 'hidden_dims': '[512, 256]', 'dropout': 0.47032720242434684, 'batch_norm': False, 'lr': 2.4450017863320553e-06, 'weight_decay': 0.00020010239024445873, 'epochs': 307, 'loss': 'mae', 'optimizer': 'adam', 'graph_mode': 'off', 'use_snp_selection': False}. Best is trial 15 with value: 0.38151508524426697.
[I 2025-12-06 01:22:01,570] Trial 23 finished with value: 0.3805772431662433 and parameters: {'model_type': 'mlp', 'hidden_dims': '[512, 256]', 'dropout': 0.469254184647988, 'batch_norm': False, 'lr': 2.872649551832985e-06, 'weight_decay': 0.000511965889495718, 'epochs': 311, 'loss': 'mae', 'optimizer': 'adam', 'graph_mode': 'off', 'use_snp_selection': False}. Best is trial 15 with value: 0.38151508524426697.
[I 2025-12-06 01:23:03,034] Trial 24 finished with value: 0.3812853555598734 and parameters: {'model_type': 'mlp', 'hidden_dims': '[512, 256]', 'dropout': 0.4622583064956846, 'batch_norm': False, 'lr': 2.4762319563412873e-06, 'weight_decay': 0.00014967993100832645, 'epochs': 296, 'loss': 'mae', 'optimizer': 'adam', 'graph_mode': 'off', 'use_snp_selection': False}. Best is trial 15 with value: 0.38151508524426697.
[I 2025-12-06 01:23:58,979] Trial 25 finished with value: 0.3716208441636034 and parameters: {'model_type': 'mlp', 'hidden_dims': '[512, 256]', 'dropout': 0.36155715690859813, 'batch_norm': False, 'lr': 7.45007659112879e-06, 'weight_decay': 0.00015394395781056548, 'epochs': 267, 'loss': 'mae', 'optimizer': 'adam', 'graph_mode': 'off', 'use_snp_selection': False}. Best is trial 15 with value: 0.38151508524426697.
[I 2025-12-06 01:24:24,943] Trial 26 finished with value: 0.3541125197484509 and parameters: {'model_type': 'mlp', 'hidden_dims': '[512, 256]', 'dropout': 0.43814384843604687, 'batch_norm': False, 'lr': 2.6431125565714224e-05, 'weight_decay': 0.000999605179501063, 'epochs': 250, 'loss': 'mae', 'optimizer': 'adam', 'graph_mode': 'off', 'use_snp_selection': True, 'num_snps': 3842}. Best is trial 15 with value: 0.38151508524426697.
[I 2025-12-06 01:25:07,432] Trial 27 finished with value: 0.3797330524712629 and parameters: {'model_type': 'mlp', 'hidden_dims': '[512, 256]', 'dropout': 0.5627475224868568, 'batch_norm': False, 'lr': 2.8864110848008345e-06, 'weight_decay': 2.488589414092257e-05, 'epochs': 199, 'loss': 'mae', 'optimizer': 'adam', 'graph_mode': 'off', 'use_snp_selection': False}. Best is trial 15 with value: 0.38151508524426697.
[I 2025-12-06 01:25:29,258] Trial 28 finished with value: 0.33300777066664294 and parameters: {'model_type': 'mlp', 'hidden_dims': '[128, 64]', 'dropout': 0.5446517125861267, 'batch_norm': False, 'lr': 1.0177150327607918e-06, 'weight_decay': 8.98800970967838e-05, 'epochs': 323, 'loss': 'mae', 'optimizer': 'adam', 'graph_mode': 'off', 'use_snp_selection': False}. Best is trial 15 with value: 0.38151508524426697.
[I 2025-12-06 01:26:13,534] Trial 29 finished with value: 0.343229235275652 and parameters: {'model_type': 'mlp', 'hidden_dims': '[512, 128]', 'dropout': 0.24739921129721487, 'batch_norm': False, 'lr': 0.0001668415436705659, 'weight_decay': 8.998479561642212e-06, 'epochs': 294, 'loss': 'mae', 'optimizer': 'adam', 'graph_mode': 'off', 'use_snp_selection': True, 'num_snps': 19468}. Best is trial 15 with value: 0.38151508524426697.
[I 2025-12-06 01:26:51,985] Trial 30 finished with value: 0.36311951465304226 and parameters: {'model_type': 'mlp', 'hidden_dims': '[256, 128, 64]', 'dropout': 0.49681217134154854, 'batch_norm': False, 'lr': 2.0329049348964696e-06, 'weight_decay': 0.0004804621414577894, 'epochs': 331, 'loss': 'mae', 'optimizer': 'adam', 'graph_mode': 'off', 'use_snp_selection': False}. Best is trial 15 with value: 0.38151508524426697.
[I 2025-12-06 01:27:54,588] Trial 31 finished with value: 0.383678318854603 and parameters: {'model_type': 'mlp', 'hidden_dims': '[512, 256]', 'dropout': 0.47397715899428805, 'batch_norm': False, 'lr': 2.107402323007154e-06, 'weight_decay': 0.00022371430203225985, 'epochs': 297, 'loss': 'mae', 'optimizer': 'adam', 'graph_mode': 'off', 'use_snp_selection': False}. Best is trial 31 with value: 0.383678318854603.
[I 2025-12-06 01:29:06,805] Trial 32 finished with value: 0.3760315820269362 and parameters: {'model_type': 'mlp', 'hidden_dims': '[512, 256]', 'dropout': 0.4452591767498204, 'batch_norm': False, 'lr': 1.6473323393495745e-06, 'weight_decay': 8.126633928759653e-05, 'epochs': 348, 'loss': 'mae', 'optimizer': 'adam', 'graph_mode': 'off', 'use_snp_selection': False}. Best is trial 31 with value: 0.383678318854603.
[I 2025-12-06 01:29:59,508] Trial 33 finished with value: 0.383185701277334 and parameters: {'model_type': 'mlp', 'hidden_dims': '[512, 256]', 'dropout': 0.4107718104225771, 'batch_norm': False, 'lr': 3.679728334979066e-06, 'weight_decay': 0.0002678676236756944, 'epochs': 250, 'loss': 'mae', 'optimizer': 'adam', 'graph_mode': 'off', 'use_snp_selection': False}. Best is trial 31 with value: 0.383678318854603.
[I 2025-12-06 01:30:17,644] Trial 34 finished with value: 0.37090296454111915 and parameters: {'model_type': 'mlp', 'hidden_dims': '[128, 64]', 'dropout': 0.4140028135926605, 'batch_norm': False, 'lr': 3.8190281669228594e-06, 'weight_decay': 0.000262756100478477, 'epochs': 256, 'loss': 'mae', 'optimizer': 'adam', 'graph_mode': 'off', 'use_snp_selection': False}. Best is trial 31 with value: 0.383678318854603.
[I 2025-12-06 01:31:06,627] Trial 35 finished with value: 0.3451394873812762 and parameters: {'model_type': 'mlp', 'hidden_dims': '[512, 256]', 'dropout': 0.41241238159668936, 'batch_norm': True, 'lr': 6.548969383748307e-06, 'weight_decay': 0.0003839055383730514, 'epochs': 229, 'loss': 'mae', 'optimizer': 'adam', 'graph_mode': 'off', 'use_snp_selection': False}. Best is trial 31 with value: 0.383678318854603.
[I 2025-12-06 01:32:42,844] Trial 36 finished with value: 0.3680102308838594 and parameters: {'model_type': 'mlp', 'hidden_dims': '[512, 256]', 'dropout': 0.48871369958504157, 'batch_norm': False, 'lr': 4.251482608572194e-06, 'weight_decay': 4.1331157708374864e-05, 'epochs': 329, 'loss': 'mse', 'optimizer': 'adam', 'graph_mode': 'off', 'use_snp_selection': True, 'num_snps': 58661}. Best is trial 31 with value: 0.383678318854603.
[I 2025-12-06 01:33:08,189] Trial 37 finished with value: 0.3008265430532845 and parameters: {'model_type': 'mlp', 'hidden_dims': '[256, 128, 64]', 'dropout': 0.5607664352400115, 'batch_norm': False, 'lr': 1.5443622359966047e-06, 'weight_decay': 0.0005790023390974224, 'epochs': 213, 'loss': 'mae', 'optimizer': 'adam', 'graph_mode': 'off', 'use_snp_selection': False}. Best is trial 31 with value: 0.383678318854603.
[I 2025-12-06 01:33:51,665] Trial 38 finished with value: 0.3531693210284045 and parameters: {'model_type': 'mlp', 'hidden_dims': '[512, 256]', 'dropout': 0.37156712755584176, 'batch_norm': True, 'lr': 1.884401548266845e-05, 'weight_decay': 0.0002745552743858176, 'epochs': 274, 'loss': 'mse', 'optimizer': 'adam', 'graph_mode': 'off', 'use_snp_selection': True, 'num_snps': 19911}. Best is trial 31 with value: 0.383678318854603.
[I 2025-12-06 01:34:28,246] Trial 39 finished with value: 0.36608946864837905 and parameters: {'model_type': 'mlp', 'hidden_dims': '[512, 128]', 'dropout': 0.4119242310942778, 'batch_norm': False, 'lr': 3.727575966998827e-05, 'weight_decay': 2.4538590652103414e-05, 'epochs': 173, 'loss': 'mae', 'optimizer': 'adam', 'graph_mode': 'off', 'use_snp_selection': False}. Best is trial 31 with value: 0.383678318854603.
[I 2025-12-06 01:35:02,350] Trial 40 finished with value: 0.3498568857399259 and parameters: {'model_type': 'mlp', 'hidden_dims': '[256, 128]', 'dropout': 0.3420548990157589, 'batch_norm': True, 'lr': 0.00010299837783030175, 'weight_decay': 1.0117952734797071e-05, 'epochs': 298, 'loss': 'mae', 'optimizer': 'adam', 'graph_mode': 'off', 'use_snp_selection': False}. Best is trial 31 with value: 0.383678318854603.
[I 2025-12-06 01:36:09,968] Trial 41 finished with value: 0.37369806691166657 and parameters: {'model_type': 'mlp', 'hidden_dims': '[512, 256]', 'dropout': 0.4560631998399456, 'batch_norm': False, 'lr': 3.5138277572637228e-06, 'weight_decay': 0.00016807320533150001, 'epochs': 328, 'loss': 'mae', 'optimizer': 'adam', 'graph_mode': 'off', 'use_snp_selection': False}. Best is trial 31 with value: 0.383678318854603.
[I 2025-12-06 01:37:12,003] Trial 42 finished with value: 0.3798242079478463 and parameters: {'model_type': 'mlp', 'hidden_dims': '[512, 256]', 'dropout': 0.48836266105522896, 'batch_norm': False, 'lr': 1.953096819695274e-06, 'weight_decay': 7.755706991391682e-05, 'epochs': 299, 'loss': 'mae', 'optimizer': 'adam', 'graph_mode': 'off', 'use_snp_selection': False}. Best is trial 31 with value: 0.383678318854603.
[I 2025-12-06 01:38:16,825] Trial 43 finished with value: 0.3755347161996312 and parameters: {'model_type': 'mlp', 'hidden_dims': '[512, 64]', 'dropout': 0.4003232654841779, 'batch_norm': False, 'lr': 8.83508973121508e-06, 'weight_decay': 0.00025908976391161577, 'epochs': 316, 'loss': 'mae', 'optimizer': 'adam', 'graph_mode': 'off', 'use_snp_selection': False}. Best is trial 31 with value: 0.383678318854603.
[I 2025-12-06 01:39:10,566] Trial 44 finished with value: 0.3806289948277601 and parameters: {'model_type': 'mlp', 'hidden_dims': '[512, 256]', 'dropout': 0.43014237664537897, 'batch_norm': False, 'lr': 1.3135136238989196e-06, 'weight_decay': 0.0006832719117036215, 'epochs': 256, 'loss': 'mse', 'optimizer': 'adam', 'graph_mode': 'off', 'use_snp_selection': False}. Best is trial 31 with value: 0.383678318854603.
[I 2025-12-06 01:39:39,529] Trial 45 finished with value: 0.36202680154205186 and parameters: {'model_type': 'mlp', 'hidden_dims': '[512, 256]', 'dropout': 0.5055039421988848, 'batch_norm': False, 'lr': 2.2092278175757892e-06, 'weight_decay': 0.00012523827137182937, 'epochs': 127, 'loss': 'mae', 'optimizer': 'adam', 'graph_mode': 'off', 'use_snp_selection': False}. Best is trial 31 with value: 0.383678318854603.
[I 2025-12-06 01:40:38,152] Trial 46 finished with value: 0.338798995074702 and parameters: {'model_type': 'mlp', 'hidden_dims': '[512, 256]', 'dropout': 0.5460277062132018, 'batch_norm': True, 'lr': 6.3530682430031614e-06, 'weight_decay': 3.5620315932903985e-05, 'epochs': 279, 'loss': 'mae', 'optimizer': 'adam', 'graph_mode': 'off', 'use_snp_selection': False}. Best is trial 31 with value: 0.383678318854603.
[I 2025-12-06 01:41:46,289] Trial 47 finished with value: 0.3771380024714074 and parameters: {'model_type': 'mlp', 'hidden_dims': '[512, 64]', 'dropout': 0.3866323486775243, 'batch_norm': False, 'lr': 3.6558496900600502e-06, 'weight_decay': 7.261304838248138e-05, 'epochs': 332, 'loss': 'mae', 'optimizer': 'adam', 'graph_mode': 'off', 'use_snp_selection': False}. Best is trial 31 with value: 0.383678318854603.
[I 2025-12-06 01:42:47,905] Trial 48 finished with value: 0.35126076922541705 and parameters: {'model_type': 'mlp', 'hidden_dims': '[512, 128]', 'dropout': 0.4540134117237326, 'batch_norm': False, 'lr': 1.0951282627153073e-05, 'weight_decay': 1.6129486177594427e-05, 'epochs': 299, 'loss': 'mse', 'optimizer': 'adam', 'graph_mode': 'off', 'use_snp_selection': False}. Best is trial 31 with value: 0.383678318854603.
[I 2025-12-06 01:43:25,794] Trial 49 finished with value: 0.1854271436353557 and parameters: {'model_type': 'mlp', 'hidden_dims': '[256, 128]', 'dropout': 0.4784642362608973, 'batch_norm': False, 'lr': 1.433764479739018e-06, 'weight_decay': 0.00038123665125373764, 'epochs': 48, 'loss': 'mae', 'optimizer': 'adam', 'graph_mode': 'off', 'use_snp_selection': True, 'num_snps': 46888}. Best is trial 31 with value: 0.383678318854603.
[I 2025-12-06 01:43:42,797] Trial 50 finished with value: 0.37635656366447445 and parameters: {'model_type': 'mlp', 'hidden_dims': '[128, 64]', 'dropout': 0.4267388604449772, 'batch_norm': False, 'lr': 5.3069611214489944e-06, 'weight_decay': 0.00019234038443535862, 'epochs': 240, 'loss': 'mae', 'optimizer': 'adam', 'graph_mode': 'off', 'use_snp_selection': False}. Best is trial 31 with value: 0.383678318854603.
[I 2025-12-06 01:44:46,744] Trial 51 finished with value: 0.3842203610377356 and parameters: {'model_type': 'mlp', 'hidden_dims': '[512, 256]', 'dropout': 0.5142367120744132, 'batch_norm': False, 'lr': 2.437574570235295e-06, 'weight_decay': 0.00021651083824765526, 'epochs': 310, 'loss': 'mae', 'optimizer': 'adam', 'graph_mode': 'off', 'use_snp_selection': False}. Best is trial 51 with value: 0.3842203610377356.
[I 2025-12-06 01:45:46,191] Trial 52 finished with value: 0.3829930838941017 and parameters: {'model_type': 'mlp', 'hidden_dims': '[512, 256]', 'dropout': 0.5109000732205154, 'batch_norm': False, 'lr': 3.019408991297664e-06, 'weight_decay': 0.00011586262579371776, 'epochs': 285, 'loss': 'mae', 'optimizer': 'adam', 'graph_mode': 'off', 'use_snp_selection': False}. Best is trial 51 with value: 0.3842203610377356.
[I 2025-12-06 01:46:51,772] Trial 53 finished with value: 0.37839606306483636 and parameters: {'model_type': 'mlp', 'hidden_dims': '[512, 256]', 'dropout': 0.5150601261390604, 'batch_norm': False, 'lr': 3.4314935765209414e-06, 'weight_decay': 0.00010882827020040397, 'epochs': 317, 'loss': 'mae', 'optimizer': 'adam', 'graph_mode': 'off', 'use_snp_selection': False}. Best is trial 51 with value: 0.3842203610377356.
[I 2025-12-06 01:47:51,152] Trial 54 finished with value: 0.37992279386553335 and parameters: {'model_type': 'mlp', 'hidden_dims': '[512, 256]', 'dropout': 0.5399149454693669, 'batch_norm': False, 'lr': 1.973833134765919e-06, 'weight_decay': 0.0002222098578939247, 'epochs': 285, 'loss': 'mae', 'optimizer': 'adam', 'graph_mode': 'off', 'use_snp_selection': False}. Best is trial 51 with value: 0.3842203610377356.
[I 2025-12-06 01:49:00,851] Trial 55 finished with value: 0.370065911474971 and parameters: {'model_type': 'mlp', 'hidden_dims': '[512, 256]', 'dropout': 0.5621712388531734, 'batch_norm': False, 'lr': 1.2471416584025715e-06, 'weight_decay': 0.0003608777302466485, 'epochs': 339, 'loss': 'mae', 'optimizer': 'adam', 'graph_mode': 'off', 'use_snp_selection': False}. Best is trial 51 with value: 0.3842203610377356.
[I 2025-12-06 01:49:55,442] Trial 56 finished with value: 0.13748841118014424 and parameters: {'model_type': 'mlp', 'hidden_dims': '[512, 256]', 'dropout': 0.5049615768723547, 'batch_norm': False, 'lr': 0.0007171669415635536, 'weight_decay': 6.342285025130212e-05, 'epochs': 270, 'loss': 'mae', 'optimizer': 'adam', 'graph_mode': 'off', 'use_snp_selection': False}. Best is trial 51 with value: 0.3842203610377356.
[I 2025-12-06 01:50:42,405] Trial 57 finished with value: 0.3468731167235869 and parameters: {'model_type': 'mlp', 'hidden_dims': '[512, 256]', 'dropout': 0.5258194955309446, 'batch_norm': True, 'lr': 4.682212019426497e-06, 'weight_decay': 3.731896636222375e-05, 'epochs': 219, 'loss': 'mae', 'optimizer': 'adam', 'graph_mode': 'off', 'use_snp_selection': False}. Best is trial 51 with value: 0.3842203610377356.
[I 2025-12-06 01:51:18,640] Trial 58 finished with value: 0.37655313379107863 and parameters: {'model_type': 'mlp', 'hidden_dims': '[256, 128, 64]', 'dropout': 0.4907207423326371, 'batch_norm': False, 'lr': 2.9122902316296126e-06, 'weight_decay': 0.0007534244777483365, 'epochs': 320, 'loss': 'mse', 'optimizer': 'adam', 'graph_mode': 'off', 'use_snp_selection': False}. Best is trial 51 with value: 0.3842203610377356.
[I 2025-12-06 01:52:21,757] Trial 59 finished with value: 0.37045211148314267 and parameters: {'model_type': 'mlp', 'hidden_dims': '[512, 256]', 'dropout': 0.5699027611858012, 'batch_norm': False, 'lr': 8.876772632452532e-06, 'weight_decay': 7.880215732164159e-07, 'epochs': 307, 'loss': 'mae', 'optimizer': 'adam', 'graph_mode': 'off', 'use_snp_selection': False}. Best is trial 51 with value: 0.3842203610377356.
[I 2025-12-06 01:53:31,369] Trial 60 finished with value: 0.3800397805356832 and parameters: {'model_type': 'mlp', 'hidden_dims': '[512, 256]', 'dropout': 0.5987421949437162, 'batch_norm': False, 'lr': 2.4667650353299767e-06, 'weight_decay': 0.00010228987486377746, 'epochs': 339, 'loss': 'mae', 'optimizer': 'adam', 'graph_mode': 'off', 'use_snp_selection': False}. Best is trial 51 with value: 0.3842203610377356.
[I 2025-12-06 01:54:30,688] Trial 61 finished with value: 0.3814851091743655 and parameters: {'model_type': 'mlp', 'hidden_dims': '[512, 256]', 'dropout': 0.463242136742791, 'batch_norm': False, 'lr': 2.491138652321247e-06, 'weight_decay': 0.00014803707697597465, 'epochs': 285, 'loss': 'mae', 'optimizer': 'adam', 'graph_mode': 'off', 'use_snp_selection': False}. Best is trial 51 with value: 0.3842203610377356.
[I 2025-12-06 01:55:30,470] Trial 62 finished with value: 0.3756407926143729 and parameters: {'model_type': 'mlp', 'hidden_dims': '[512, 256]', 'dropout': 0.47632348332575064, 'batch_norm': False, 'lr': 1.7865449988974678e-06, 'weight_decay': 0.00015004299504949118, 'epochs': 287, 'loss': 'mae', 'optimizer': 'adam', 'graph_mode': 'off', 'use_snp_selection': False}. Best is trial 51 with value: 0.3842203610377356.
