[I 2025-12-06 10:13:58,835] Trial 122 finished with value: 0.2269603062488715 and parameters: {'model_type': 'mlp', 'hidden_dims': '[128, 64]', 'dropout': 0.34162496041906865, 'batch_norm': False, 'lr': 2.123795601515819e-05, 'weight_decay': 0.0002941368286820893, 'epochs': 162, 'loss': 'mae', 'optimizer': 'adam', 'graph_mode': 'off', 'use_snp_selection': True, 'num_snps': 20537}. Best is trial 112 with value: 0.24855246542575732.
[I 2025-12-06 10:14:37,891] Trial 123 finished with value: 0.23380655450828552 and parameters: {'model_type': 'mlp', 'hidden_dims': '[128, 64]', 'dropout': 0.31978593082387374, 'batch_norm': False, 'lr': 3.391493402720996e-05, 'weight_decay': 0.0008562484897392008, 'epochs': 166, 'loss': 'mae', 'optimizer': 'adam', 'graph_mode': 'off', 'use_snp_selection': True, 'num_snps': 17304}. Best is trial 112 with value: 0.24855246542575732.
[I 2025-12-06 10:15:17,484] Trial 124 finished with value: 0.23167049076246723 and parameters: {'model_type': 'mlp', 'hidden_dims': '[256, 128, 64]', 'dropout': 0.3635527499161443, 'batch_norm': False, 'lr': 1.8103947823053417e-05, 'weight_decay': 0.000622191672269932, 'epochs': 148, 'loss': 'mae', 'optimizer': 'adam', 'graph_mode': 'off', 'use_snp_selection': True, 'num_snps': 14554}. Best is trial 112 with value: 0.24855246542575732.
[I 2025-12-06 10:15:58,949] Trial 125 finished with value: 0.24165853551376132 and parameters: {'model_type': 'mlp', 'hidden_dims': '[128, 64]', 'dropout': 0.31222344697739673, 'batch_norm': False, 'lr': 1.4160224850658998e-05, 'weight_decay': 0.0004374379067753093, 'epochs': 170, 'loss': 'mae', 'optimizer': 'adam', 'graph_mode': 'off', 'use_snp_selection': True, 'num_snps': 21847}. Best is trial 112 with value: 0.24855246542575732.
[I 2025-12-06 10:16:58,290] Trial 126 finished with value: 0.23582548269806108 and parameters: {'model_type': 'mlp', 'hidden_dims': '[512, 256]', 'dropout': 0.3126811131477574, 'batch_norm': False, 'lr': 1.1219917526121461e-05, 'weight_decay': 0.000483218071351598, 'epochs': 182, 'loss': 'mae', 'optimizer': 'adam', 'graph_mode': 'off', 'use_snp_selection': True, 'num_snps': 26199}. Best is trial 112 with value: 0.24855246542575732.
[I 2025-12-06 10:17:51,845] Trial 127 finished with value: 0.24199645902212708 and parameters: {'model_type': 'mlp', 'hidden_dims': '[512, 256]', 'dropout': 0.28389942679593494, 'batch_norm': False, 'lr': 8.193930385404446e-06, 'weight_decay': 0.0004110437025920845, 'epochs': 173, 'loss': 'mae', 'optimizer': 'adam', 'graph_mode': 'off', 'use_snp_selection': True, 'num_snps': 22279}. Best is trial 112 with value: 0.24855246542575732.
[I 2025-12-06 10:18:42,257] Trial 128 finished with value: 0.23440751261484669 and parameters: {'model_type': 'mlp', 'hidden_dims': '[512, 256]', 'dropout': 0.280735968517059, 'batch_norm': False, 'lr': 1.4436740864136463e-05, 'weight_decay': 0.0004244559657684378, 'epochs': 145, 'loss': 'mae', 'optimizer': 'adam', 'graph_mode': 'off', 'use_snp_selection': True, 'num_snps': 21905}. Best is trial 112 with value: 0.24855246542575732.
[I 2025-12-06 10:19:24,948] Trial 129 finished with value: 0.22678867727172786 and parameters: {'model_type': 'mlp', 'hidden_dims': '[128, 64]', 'dropout': 0.2461147142593859, 'batch_norm': False, 'lr': 9.539990289036252e-06, 'weight_decay': 0.0009931452775187406, 'epochs': 173, 'loss': 'mae', 'optimizer': 'adam', 'graph_mode': 'off', 'use_snp_selection': True, 'num_snps': 24832}. Best is trial 112 with value: 0.24855246542575732.
[I 2025-12-06 10:20:21,780] Trial 130 finished with value: 0.22971012003444166 and parameters: {'model_type': 'mlp', 'hidden_dims': '[512, 256]', 'dropout': 0.28856563566639454, 'batch_norm': False, 'lr': 8.653041009973664e-06, 'weight_decay': 0.0005751944012060197, 'epochs': 157, 'loss': 'mae', 'optimizer': 'adam', 'graph_mode': 'off', 'use_snp_selection': True, 'num_snps': 27508}. Best is trial 112 with value: 0.24855246542575732.
[I 2025-12-06 10:21:17,801] Trial 131 finished with value: 0.23589384184082748 and parameters: {'model_type': 'mlp', 'hidden_dims': '[512, 256]', 'dropout': 0.3343398779597652, 'batch_norm': False, 'lr': 6.689772460140242e-06, 'weight_decay': 0.0003777836270468178, 'epochs': 184, 'loss': 'mae', 'optimizer': 'adam', 'graph_mode': 'off', 'use_snp_selection': True, 'num_snps': 23746}. Best is trial 112 with value: 0.24855246542575732.
[I 2025-12-06 10:22:06,709] Trial 132 finished with value: 0.23603108185881436 and parameters: {'model_type': 'mlp', 'hidden_dims': '[512, 256]', 'dropout': 0.3551202510138466, 'batch_norm': False, 'lr': 1.2638078806357714e-05, 'weight_decay': 0.00016932451986263725, 'epochs': 194, 'loss': 'mae', 'optimizer': 'adam', 'graph_mode': 'off', 'use_snp_selection': True, 'num_snps': 16708}. Best is trial 112 with value: 0.24855246542575732.
[I 2025-12-06 10:22:56,807] Trial 133 finished with value: 0.2291996486726527 and parameters: {'model_type': 'mlp', 'hidden_dims': '[512, 256]', 'dropout': 0.32084391502831244, 'batch_norm': False, 'lr': 4.770758753310471e-06, 'weight_decay': 0.0008000960018623975, 'epochs': 164, 'loss': 'mae', 'optimizer': 'adam', 'graph_mode': 'off', 'use_snp_selection': True, 'num_snps': 19629}. Best is trial 112 with value: 0.24855246542575732.
[I 2025-12-06 10:23:36,727] Trial 134 finished with value: 0.22830581204979533 and parameters: {'model_type': 'mlp', 'hidden_dims': '[512, 256]', 'dropout': 0.2278434431599305, 'batch_norm': False, 'lr': 7.371477555633409e-05, 'weight_decay': 0.0006343876414710925, 'epochs': 174, 'loss': 'mae', 'optimizer': 'adam', 'graph_mode': 'off', 'use_snp_selection': True, 'num_snps': 9519}. Best is trial 112 with value: 0.24855246542575732.
[I 2025-12-06 10:24:20,474] Trial 135 finished with value: 0.23322125033153154 and parameters: {'model_type': 'mlp', 'hidden_dims': '[256, 128]', 'dropout': 0.30603850711794556, 'batch_norm': False, 'lr': 1.0737884584942638e-05, 'weight_decay': 0.00024389480064229574, 'epochs': 179, 'loss': 'mae', 'optimizer': 'adam', 'graph_mode': 'off', 'use_snp_selection': True, 'num_snps': 19618}. Best is trial 112 with value: 0.24855246542575732.
[I 2025-12-06 10:25:05,411] Trial 136 finished with value: 0.2387002586206049 and parameters: {'model_type': 'mlp', 'hidden_dims': '[512, 256]', 'dropout': 0.27592742567942596, 'batch_norm': False, 'lr': 3.02714815118963e-05, 'weight_decay': 0.0003390519043430879, 'epochs': 168, 'loss': 'mae', 'optimizer': 'adam', 'graph_mode': 'off', 'use_snp_selection': True, 'num_snps': 14555}. Best is trial 112 with value: 0.24855246542575732.
[I 2025-12-06 10:26:12,581] Trial 137 finished with value: 0.23203694777907247 and parameters: {'model_type': 'mlp', 'hidden_dims': '[512, 256]', 'dropout': 0.25803836349105896, 'batch_norm': False, 'lr': 5.439845290257526e-05, 'weight_decay': 0.0004887727240091542, 'epochs': 153, 'loss': 'mae', 'optimizer': 'adam', 'graph_mode': 'off', 'use_snp_selection': True, 'num_snps': 38687}. Best is trial 112 with value: 0.24855246542575732.
[I 2025-12-06 10:26:55,934] Trial 138 finished with value: 0.23475502060936354 and parameters: {'model_type': 'mlp', 'hidden_dims': '[512, 256]', 'dropout': 0.3410260215888584, 'batch_norm': False, 'lr': 3.8306481841704606e-05, 'weight_decay': 0.0008372231709826443, 'epochs': 204, 'loss': 'mae', 'optimizer': 'adam', 'graph_mode': 'off', 'use_snp_selection': True, 'num_snps': 11510}. Best is trial 112 with value: 0.24855246542575732.
[I 2025-12-06 10:27:47,505] Trial 139 finished with value: 0.23897395198165908 and parameters: {'model_type': 'mlp', 'hidden_dims': '[512, 256]', 'dropout': 0.36208543131538395, 'batch_norm': False, 'lr': 6.148971489348327e-05, 'weight_decay': 0.00041310927211683107, 'epochs': 160, 'loss': 'mae', 'optimizer': 'adam', 'graph_mode': 'off', 'use_snp_selection': True, 'num_snps': 21900}. Best is trial 112 with value: 0.24855246542575732.
[I 2025-12-06 10:28:37,297] Trial 140 finished with value: 0.23532886682933785 and parameters: {'model_type': 'mlp', 'hidden_dims': '[512, 256]', 'dropout': 0.31270383498424764, 'batch_norm': False, 'lr': 1.5750995991429627e-05, 'weight_decay': 0.00053467764112099, 'epochs': 185, 'loss': 'mae', 'optimizer': 'adam', 'graph_mode': 'off', 'use_snp_selection': True, 'num_snps': 17623}. Best is trial 112 with value: 0.24855246542575732.
[I 2025-12-06 10:29:18,293] Trial 141 finished with value: 0.2433863771470587 and parameters: {'model_type': 'mlp', 'hidden_dims': '[128, 64]', 'dropout': 0.3442480019005749, 'batch_norm': False, 'lr': 2.0720954961092284e-05, 'weight_decay': 0.0002886876192014412, 'epochs': 169, 'loss': 'mae', 'optimizer': 'adam', 'graph_mode': 'off', 'use_snp_selection': True, 'num_snps': 20975}. Best is trial 112 with value: 0.24855246542575732.
[I 2025-12-06 10:30:00,623] Trial 142 finished with value: 0.21662517334651726 and parameters: {'model_type': 'mlp', 'hidden_dims': '[128, 64]', 'dropout': 0.32705052636094845, 'batch_norm': False, 'lr': 8.142319336364475e-06, 'weight_decay': 0.00031910165616878664, 'epochs': 176, 'loss': 'mae', 'optimizer': 'adam', 'graph_mode': 'off', 'use_snp_selection': True, 'num_snps': 23231}. Best is trial 112 with value: 0.24855246542575732.
[I 2025-12-06 10:30:39,084] Trial 143 finished with value: 0.23912548611382384 and parameters: {'model_type': 'mlp', 'hidden_dims': '[128, 64]', 'dropout': 0.36876477704101773, 'batch_norm': False, 'lr': 1.9378189403965568e-05, 'weight_decay': 0.000190223350897775, 'epochs': 167, 'loss': 'mae', 'optimizer': 'adam', 'graph_mode': 'off', 'use_snp_selection': True, 'num_snps': 16026}. Best is trial 112 with value: 0.24855246542575732.
[I 2025-12-06 10:31:19,372] Trial 144 finished with value: 0.23892617909580544 and parameters: {'model_type': 'mlp', 'hidden_dims': '[128, 64]', 'dropout': 0.2926144048767004, 'batch_norm': False, 'lr': 2.89227060623538e-05, 'weight_decay': 0.0002487505303353908, 'epochs': 183, 'loss': 'mae', 'optimizer': 'adam', 'graph_mode': 'off', 'use_snp_selection': True, 'num_snps': 19211}. Best is trial 112 with value: 0.24855246542575732.
[I 2025-12-06 10:31:57,427] Trial 145 finished with value: 0.24399556533320893 and parameters: {'model_type': 'mlp', 'hidden_dims': '[128, 64]', 'dropout': 0.34825009613937413, 'batch_norm': False, 'lr': 4.280386836402755e-05, 'weight_decay': 0.0006619108884774619, 'epochs': 192, 'loss': 'mae', 'optimizer': 'adam', 'graph_mode': 'off', 'use_snp_selection': True, 'num_snps': 14343}. Best is trial 112 with value: 0.24855246542575732.
[I 2025-12-06 10:32:34,789] Trial 146 finished with value: 0.2491329558334666 and parameters: {'model_type': 'mlp', 'hidden_dims': '[128, 64]', 'dropout': 0.353205255183063, 'batch_norm': False, 'lr': 4.4637365512915405e-05, 'weight_decay': 0.0006941816980375197, 'epochs': 194, 'loss': 'mae', 'optimizer': 'adam', 'graph_mode': 'off', 'use_snp_selection': True, 'num_snps': 13649}. Best is trial 146 with value: 0.2491329558334666.
[I 2025-12-06 10:33:12,202] Trial 147 finished with value: 0.2423810916860381 and parameters: {'model_type': 'mlp', 'hidden_dims': '[128, 64]', 'dropout': 0.35046753238136413, 'batch_norm': False, 'lr': 4.37564521749756e-05, 'weight_decay': 0.0007114133075135216, 'epochs': 193, 'loss': 'mae', 'optimizer': 'adam', 'graph_mode': 'off', 'use_snp_selection': True, 'num_snps': 13628}. Best is trial 146 with value: 0.2491329558334666.
[I 2025-12-06 10:33:49,398] Trial 148 finished with value: 0.23522559612158048 and parameters: {'model_type': 'mlp', 'hidden_dims': '[128, 64]', 'dropout': 0.32277659884986093, 'batch_norm': False, 'lr': 6.936769721927417e-05, 'weight_decay': 0.0007327246668727749, 'epochs': 193, 'loss': 'mae', 'optimizer': 'adam', 'graph_mode': 'off', 'use_snp_selection': True, 'num_snps': 13342}. Best is trial 146 with value: 0.2491329558334666.
[I 2025-12-06 10:34:26,755] Trial 149 finished with value: 0.2399547285314231 and parameters: {'model_type': 'mlp', 'hidden_dims': '[128, 64]', 'dropout': 0.3485302647464509, 'batch_norm': False, 'lr': 4.114084462417736e-05, 'weight_decay': 0.0006472857922520614, 'epochs': 197, 'loss': 'mae', 'optimizer': 'adam', 'graph_mode': 'off', 'use_snp_selection': True, 'num_snps': 13618}. Best is trial 146 with value: 0.2491329558334666.
[I 2025-12-06 10:35:32,423] Trial 0 finished with value: 0.1746050320511104 and parameters: {'model_type': 'mlp', 'hidden_dims': '[128, 64]', 'dropout': 0.199031432379812, 'batch_norm': True, 'lr': 1.8408544111075837e-06, 'weight_decay': 5.5136510071208614e-05, 'epochs': 336, 'loss': 'mae', 'optimizer': 'adam', 'graph_mode': 'off', 'use_snp_selection': True, 'num_snps': 43862}. Best is trial 0 with value: 0.1746050320511104.
[I 2025-12-06 10:36:12,525] Trial 1 finished with value: 0.22846550230641535 and parameters: {'model_type': 'mlp', 'hidden_dims': '[256, 128]', 'dropout': 0.4370668075331726, 'batch_norm': True, 'lr': 7.133471581159139e-05, 'weight_decay': 1.128633586803549e-05, 'epochs': 242, 'loss': 'mae', 'optimizer': 'adam', 'graph_mode': 'off', 'use_snp_selection': False}. Best is trial 1 with value: 0.22846550230641535.
[I 2025-12-06 10:36:50,000] Trial 2 finished with value: 0.1914232167855976 and parameters: {'model_type': 'mlp', 'hidden_dims': '[256, 128, 64]', 'dropout': 0.41314357415569625, 'batch_norm': False, 'lr': 3.952233718592101e-06, 'weight_decay': 0.00026754769258252603, 'epochs': 149, 'loss': 'mse', 'optimizer': 'adam', 'graph_mode': 'off', 'use_snp_selection': True, 'num_snps': 11571}. Best is trial 1 with value: 0.22846550230641535.
[I 2025-12-06 10:38:23,836] Trial 3 finished with value: 0.23988913450378235 and parameters: {'model_type': 'mlp', 'hidden_dims': '[512, 64]', 'dropout': 0.5938127374509361, 'batch_norm': False, 'lr': 5.67704586114731e-06, 'weight_decay': 2.4518087630137052e-05, 'epochs': 320, 'loss': 'mae', 'optimizer': 'adam', 'graph_mode': 'off', 'use_snp_selection': False}. Best is trial 3 with value: 0.23988913450378235.
[I 2025-12-06 10:39:49,121] Trial 4 finished with value: 0.19524900171477047 and parameters: {'model_type': 'mlp', 'hidden_dims': '[512, 128]', 'dropout': 0.25746343592134413, 'batch_norm': True, 'lr': 1.3467657668402788e-06, 'weight_decay': 0.00033087251918647806, 'epochs': 277, 'loss': 'mse', 'optimizer': 'adam', 'graph_mode': 'off', 'use_snp_selection': True, 'num_snps': 36675}. Best is trial 3 with value: 0.23988913450378235.
[I 2025-12-06 10:40:49,411] Trial 5 finished with value: 0.17870190016109064 and parameters: {'model_type': 'mlp', 'hidden_dims': '[512, 64]', 'dropout': 0.38275350994408375, 'batch_norm': True, 'lr': 1.5586664309232824e-06, 'weight_decay': 0.0008227664668621182, 'epochs': 145, 'loss': 'mae', 'optimizer': 'adam', 'graph_mode': 'off', 'use_snp_selection': True, 'num_snps': 32148}. Best is trial 3 with value: 0.23988913450378235.
[I 2025-12-06 10:41:22,909] Trial 6 finished with value: 0.23257154920687878 and parameters: {'model_type': 'mlp', 'hidden_dims': '[256, 128]', 'dropout': 0.3930109900265879, 'batch_norm': False, 'lr': 4.892964372128395e-05, 'weight_decay': 1.5809549317992182e-06, 'epochs': 199, 'loss': 'mse', 'optimizer': 'adam', 'graph_mode': 'off', 'use_snp_selection': False}. Best is trial 3 with value: 0.23988913450378235.
[I 2025-12-06 10:41:57,118] Trial 7 finished with value: 0.2299755726992876 and parameters: {'model_type': 'mlp', 'hidden_dims': '[512, 256]', 'dropout': 0.15343979219678458, 'batch_norm': True, 'lr': 6.234003099047341e-05, 'weight_decay': 3.894760610535477e-07, 'epochs': 97, 'loss': 'mse', 'optimizer': 'adam', 'graph_mode': 'off', 'use_snp_selection': False}. Best is trial 3 with value: 0.23988913450378235.
[I 2025-12-06 10:43:30,493] Trial 8 finished with value: 0.22774615006125573 and parameters: {'model_type': 'mlp', 'hidden_dims': '[512, 128]', 'dropout': 0.10743001231661406, 'batch_norm': True, 'lr': 0.00023728538449271062, 'weight_decay': 1.7629071578048637e-05, 'epochs': 312, 'loss': 'mae', 'optimizer': 'adam', 'graph_mode': 'off', 'use_snp_selection': False}. Best is trial 3 with value: 0.23988913450378235.
[I 2025-12-06 10:44:26,344] Trial 9 finished with value: 0.2358910112922073 and parameters: {'model_type': 'mlp', 'hidden_dims': '[512, 64]', 'dropout': 0.14505336736221927, 'batch_norm': True, 'lr': 5.8619638388111826e-05, 'weight_decay': 6.200156172669308e-07, 'epochs': 175, 'loss': 'mse', 'optimizer': 'adam', 'graph_mode': 'off', 'use_snp_selection': False}. Best is trial 3 with value: 0.23988913450378235.
[I 2025-12-06 10:44:48,975] Trial 10 finished with value: 0.21524719986877966 and parameters: {'model_type': 'mlp', 'hidden_dims': '[512, 64]', 'dropout': 0.5885461262002587, 'batch_norm': False, 'lr': 8.769366258768696e-06, 'weight_decay': 2.78273193871783e-06, 'epochs': 55, 'loss': 'mae', 'optimizer': 'adam', 'graph_mode': 'off', 'use_snp_selection': False}. Best is trial 3 with value: 0.23988913450378235.
[I 2025-12-06 10:45:54,358] Trial 11 finished with value: 0.22997008227061538 and parameters: {'model_type': 'mlp', 'hidden_dims': '[512, 64]', 'dropout': 0.583942291816117, 'batch_norm': False, 'lr': 1.422933652790185e-05, 'weight_decay': 1.2045055692919657e-07, 'epochs': 213, 'loss': 'mse', 'optimizer': 'adam', 'graph_mode': 'off', 'use_snp_selection': False}. Best is trial 3 with value: 0.23988913450378235.
[I 2025-12-06 10:46:43,167] Trial 12 finished with value: 0.15331504949541502 and parameters: {'model_type': 'mlp', 'hidden_dims': '[512, 64]', 'dropout': 0.2637316882220091, 'batch_norm': False, 'lr': 0.0006753264773209732, 'weight_decay': 1.6488595357534196e-06, 'epochs': 154, 'loss': 'mae', 'optimizer': 'adam', 'graph_mode': 'off', 'use_snp_selection': False}. Best is trial 3 with value: 0.23988913450378235.
[I 2025-12-06 10:48:01,604] Trial 13 finished with value: 0.23190974505756068 and parameters: {'model_type': 'mlp', 'hidden_dims': '[512, 64]', 'dropout': 0.5086194929129976, 'batch_norm': False, 'lr': 1.4304506621636526e-05, 'weight_decay': 4.373608364627903e-05, 'epochs': 261, 'loss': 'mse', 'optimizer': 'adam', 'graph_mode': 'off', 'use_snp_selection': False}. Best is trial 3 with value: 0.23988913450378235.
[I 2025-12-06 10:48:28,659] Trial 14 finished with value: 0.2192321063138371 and parameters: {'model_type': 'mlp', 'hidden_dims': '[128, 64]', 'dropout': 0.3012984444538551, 'batch_norm': True, 'lr': 0.00017558188744418174, 'weight_decay': 4.57067734295802e-06, 'epochs': 293, 'loss': 'mse', 'optimizer': 'adam', 'graph_mode': 'off', 'use_snp_selection': False}. Best is trial 3 with value: 0.23988913450378235.
[I 2025-12-06 10:49:39,052] Trial 15 finished with value: 0.2330521651846253 and parameters: {'model_type': 'mlp', 'hidden_dims': '[512, 256]', 'dropout': 0.48263162073930665, 'batch_norm': False, 'lr': 2.200457974768058e-05, 'weight_decay': 4.081624813577402e-07, 'epochs': 231, 'loss': 'mae', 'optimizer': 'adam', 'graph_mode': 'off', 'use_snp_selection': False}. Best is trial 3 with value: 0.23988913450378235.
[I 2025-12-06 10:50:35,212] Trial 16 finished with value: 0.20920775726556823 and parameters: {'model_type': 'mlp', 'hidden_dims': '[256, 128, 64]', 'dropout': 0.3148124780833136, 'batch_norm': True, 'lr': 6.013316929814413e-06, 'weight_decay': 3.895033692555648e-05, 'epochs': 350, 'loss': 'mse', 'optimizer': 'adam', 'graph_mode': 'off', 'use_snp_selection': False}. Best is trial 3 with value: 0.23988913450378235.
[I 2025-12-06 10:51:13,021] Trial 17 finished with value: 0.24241944709749874 and parameters: {'model_type': 'mlp', 'hidden_dims': '[512, 64]', 'dropout': 0.5199905774474576, 'batch_norm': False, 'lr': 0.00015757341301155474, 'weight_decay': 5.666950082267898e-07, 'epochs': 113, 'loss': 'mae', 'optimizer': 'adam', 'graph_mode': 'off', 'use_snp_selection': False}. Best is trial 17 with value: 0.24241944709749874.
[I 2025-12-06 10:52:27,882] Trial 18 finished with value: 0.06196160413254712 and parameters: {'model_type': 'mlp', 'hidden_dims': '[512, 64]', 'dropout': 0.5272377108188301, 'batch_norm': False, 'lr': 0.0006372689902154905, 'weight_decay': 5.409591144113358e-06, 'epochs': 103, 'loss': 'mae', 'optimizer': 'adam', 'graph_mode': 'off', 'use_snp_selection': True, 'num_snps': 58241}. Best is trial 17 with value: 0.24241944709749874.
[I 2025-12-06 10:52:48,401] Trial 19 finished with value: 0.16911185177423194 and parameters: {'model_type': 'mlp', 'hidden_dims': '[512, 64]', 'dropout': 0.5463690211280188, 'batch_norm': False, 'lr': 0.00015983041030594416, 'weight_decay': 1.1354159408743119e-07, 'epochs': 49, 'loss': 'mae', 'optimizer': 'adam', 'graph_mode': 'off', 'use_snp_selection': False}. Best is trial 17 with value: 0.24241944709749874.
[I 2025-12-06 10:53:23,048] Trial 20 finished with value: 0.22350107213300335 and parameters: {'model_type': 'mlp', 'hidden_dims': '[512, 128]', 'dropout': 0.4702777660605099, 'batch_norm': False, 'lr': 3.324514570871408e-06, 'weight_decay': 0.00015711537877451736, 'epochs': 100, 'loss': 'mae', 'optimizer': 'adam', 'graph_mode': 'off', 'use_snp_selection': False}. Best is trial 17 with value: 0.24241944709749874.
[I 2025-12-06 10:54:18,085] Trial 21 finished with value: 0.2365549360923461 and parameters: {'model_type': 'mlp', 'hidden_dims': '[512, 64]', 'dropout': 0.5551594855246745, 'batch_norm': False, 'lr': 0.00010176063557969185, 'weight_decay': 6.29796848715097e-07, 'epochs': 179, 'loss': 'mae', 'optimizer': 'adam', 'graph_mode': 'off', 'use_snp_selection': False}. Best is trial 17 with value: 0.24241944709749874.
[I 2025-12-06 10:54:57,315] Trial 22 finished with value: 0.23459602367217766 and parameters: {'model_type': 'mlp', 'hidden_dims': '[512, 64]', 'dropout': 0.5954392114625428, 'batch_norm': False, 'lr': 0.00031823610895294867, 'weight_decay': 8.432201023626014e-07, 'epochs': 119, 'loss': 'mae', 'optimizer': 'adam', 'graph_mode': 'off', 'use_snp_selection': False}. Best is trial 17 with value: 0.24241944709749874.
