[I 2025-12-05 15:26:56,336] Trial 114 finished with value: 0.11140127343438927 and parameters: {'model_type': 'mlp', 'hidden_dims': '[256, 128, 64]', 'dropout': 0.23067258363195178, 'batch_norm': False, 'lr': 4.62680423599784e-05, 'weight_decay': 0.0005456289784872107, 'epochs': 264, 'loss': 'mae', 'optimizer': 'adam', 'graph_mode': 'off', 'use_snp_selection': True, 'num_snps': 36507}. Best is trial 68 with value: 0.13746207369756264.
[I 2025-12-05 15:26:58,859] Trial 115 finished with value: 0.13495850219614577 and parameters: {'model_type': 'mlp', 'hidden_dims': '[512, 256]', 'dropout': 0.5441050094588508, 'batch_norm': False, 'lr': 5.6133844645522394e-05, 'weight_decay': 0.0004296629684287789, 'epochs': 306, 'loss': 'mae', 'optimizer': 'adam', 'graph_mode': 'off', 'use_snp_selection': True, 'num_snps': 12793}. Best is trial 68 with value: 0.13746207369756264.
[I 2025-12-05 15:27:01,298] Trial 116 finished with value: 0.10861142123237255 and parameters: {'model_type': 'mlp', 'hidden_dims': '[512, 256]', 'dropout': 0.5843670754929946, 'batch_norm': False, 'lr': 0.00010543208536378104, 'weight_decay': 0.000432365400447412, 'epochs': 302, 'loss': 'mae', 'optimizer': 'adam', 'graph_mode': 'off', 'use_snp_selection': True, 'num_snps': 12603}. Best is trial 68 with value: 0.13746207369756264.
[I 2025-12-05 15:27:03,863] Trial 117 finished with value: 0.12205074057957883 and parameters: {'model_type': 'mlp', 'hidden_dims': '[512, 256]', 'dropout': 0.5212094319357289, 'batch_norm': False, 'lr': 5.7384714861931245e-05, 'weight_decay': 0.0007578345623062853, 'epochs': 287, 'loss': 'mae', 'optimizer': 'adam', 'graph_mode': 'off', 'use_snp_selection': True, 'num_snps': 15156}. Best is trial 68 with value: 0.13746207369756264.
[I 2025-12-05 15:27:06,183] Trial 118 finished with value: 0.11826129742387373 and parameters: {'model_type': 'mlp', 'hidden_dims': '[512, 256]', 'dropout': 0.16846475098791433, 'batch_norm': False, 'lr': 3.894602966223876e-05, 'weight_decay': 0.00016470752666325014, 'epochs': 319, 'loss': 'mse', 'optimizer': 'adam', 'graph_mode': 'off', 'use_snp_selection': True, 'num_snps': 11211}. Best is trial 68 with value: 0.13746207369756264.
[I 2025-12-05 15:27:08,189] Trial 119 finished with value: 0.06966671202237168 and parameters: {'model_type': 'mlp', 'hidden_dims': '[512, 256]', 'dropout': 0.21711186785046924, 'batch_norm': True, 'lr': 4.059526129946736e-06, 'weight_decay': 0.00024823231199337095, 'epochs': 277, 'loss': 'mse', 'optimizer': 'adam', 'graph_mode': 'off', 'use_snp_selection': True, 'num_snps': 8162}. Best is trial 68 with value: 0.13746207369756264.
[I 2025-12-05 15:27:10,370] Trial 120 finished with value: 0.11396713845202527 and parameters: {'model_type': 'mlp', 'hidden_dims': '[512, 128]', 'dropout': 0.24267395946606496, 'batch_norm': False, 'lr': 6.507044579747027e-05, 'weight_decay': 0.0003110301989142744, 'epochs': 314, 'loss': 'mae', 'optimizer': 'adam', 'graph_mode': 'off', 'use_snp_selection': True, 'num_snps': 10039}. Best is trial 68 with value: 0.13746207369756264.
[I 2025-12-05 15:27:12,425] Trial 121 finished with value: 0.11785806638910395 and parameters: {'model_type': 'mlp', 'hidden_dims': '[256, 128, 64]', 'dropout': 0.28291034886800986, 'batch_norm': False, 'lr': 3.2897122058547914e-05, 'weight_decay': 0.0006219671733003819, 'epochs': 295, 'loss': 'mae', 'optimizer': 'adam', 'graph_mode': 'off', 'use_snp_selection': True, 'num_snps': 12985}. Best is trial 68 with value: 0.13746207369756264.
[I 2025-12-05 15:27:14,491] Trial 122 finished with value: 0.12611147285439328 and parameters: {'model_type': 'mlp', 'hidden_dims': '[128, 64]', 'dropout': 0.5621190130625473, 'batch_norm': False, 'lr': 8.816932286911952e-05, 'weight_decay': 0.0004679732022309498, 'epochs': 228, 'loss': 'mae', 'optimizer': 'adam', 'graph_mode': 'off', 'use_snp_selection': True, 'num_snps': 18246}. Best is trial 68 with value: 0.13746207369756264.
[I 2025-12-05 15:27:16,553] Trial 123 finished with value: 0.10888298928580606 and parameters: {'model_type': 'mlp', 'hidden_dims': '[128, 64]', 'dropout': 0.5704356354268174, 'batch_norm': False, 'lr': 0.00012759045008560165, 'weight_decay': 0.0003799281755122252, 'epochs': 228, 'loss': 'mae', 'optimizer': 'adam', 'graph_mode': 'off', 'use_snp_selection': True, 'num_snps': 18787}. Best is trial 68 with value: 0.13746207369756264.
[I 2025-12-05 15:27:19,329] Trial 124 finished with value: 0.09734217648070743 and parameters: {'model_type': 'mlp', 'hidden_dims': '[128, 64]', 'dropout': 0.5775748536727207, 'batch_norm': False, 'lr': 8.524158416239508e-05, 'weight_decay': 0.0004715687971604726, 'epochs': 283, 'loss': 'mae', 'optimizer': 'adam', 'graph_mode': 'off', 'use_snp_selection': True, 'num_snps': 33177}. Best is trial 68 with value: 0.13746207369756264.
[I 2025-12-05 15:27:22,091] Trial 125 finished with value: 0.10404020572541176 and parameters: {'model_type': 'mlp', 'hidden_dims': '[512, 256]', 'dropout': 0.5402878456479522, 'batch_norm': False, 'lr': 5.3499957931138814e-05, 'weight_decay': 0.0003218114613819377, 'epochs': 309, 'loss': 'mae', 'optimizer': 'adam', 'graph_mode': 'off', 'use_snp_selection': True, 'num_snps': 14507}. Best is trial 68 with value: 0.13746207369756264.
[I 2025-12-05 15:27:24,135] Trial 126 finished with value: 0.13276522405814395 and parameters: {'model_type': 'mlp', 'hidden_dims': '[128, 64]', 'dropout': 0.5527842711180768, 'batch_norm': False, 'lr': 9.1046675437789e-05, 'weight_decay': 0.0004233349702753394, 'epochs': 193, 'loss': 'mae', 'optimizer': 'adam', 'graph_mode': 'off', 'use_snp_selection': True, 'num_snps': 17718}. Best is trial 68 with value: 0.13746207369756264.
[I 2025-12-05 15:27:26,138] Trial 127 finished with value: 0.10342288528552307 and parameters: {'model_type': 'mlp', 'hidden_dims': '[128, 64]', 'dropout': 0.5637197855669018, 'batch_norm': False, 'lr': 6.636761867600803e-05, 'weight_decay': 0.00022275369376987584, 'epochs': 211, 'loss': 'mae', 'optimizer': 'adam', 'graph_mode': 'off', 'use_snp_selection': True, 'num_snps': 16161}. Best is trial 68 with value: 0.13746207369756264.
[I 2025-12-05 15:27:28,167] Trial 128 finished with value: 0.0951453902663735 and parameters: {'model_type': 'mlp', 'hidden_dims': '[128, 64]', 'dropout': 0.5394277669034165, 'batch_norm': False, 'lr': 5.012972308823496e-05, 'weight_decay': 0.0004104547212144259, 'epochs': 196, 'loss': 'mae', 'optimizer': 'adam', 'graph_mode': 'off', 'use_snp_selection': True, 'num_snps': 17691}. Best is trial 68 with value: 0.13746207369756264.
[I 2025-12-05 15:27:29,459] Trial 129 finished with value: 0.09689859075844226 and parameters: {'model_type': 'mlp', 'hidden_dims': '[128, 64]', 'dropout': 0.5626138956699389, 'batch_norm': False, 'lr': 3.960241219071786e-05, 'weight_decay': 0.000267922763111029, 'epochs': 232, 'loss': 'mae', 'optimizer': 'adam', 'graph_mode': 'off', 'use_snp_selection': False}. Best is trial 68 with value: 0.13746207369756264.
[I 2025-12-05 15:27:32,032] Trial 130 finished with value: 0.13945202102683524 and parameters: {'model_type': 'mlp', 'hidden_dims': '[128, 64]', 'dropout': 0.18633753724048321, 'batch_norm': True, 'lr': 5.876353332821251e-05, 'weight_decay': 1.0089429045364788e-07, 'epochs': 204, 'loss': 'mae', 'optimizer': 'adam', 'graph_mode': 'off', 'use_snp_selection': True, 'num_snps': 31122}. Best is trial 130 with value: 0.13945202102683524.
[I 2025-12-05 15:27:34,168] Trial 131 finished with value: 0.09303782470185112 and parameters: {'model_type': 'mlp', 'hidden_dims': '[128, 64]', 'dropout': 0.5253303832177442, 'batch_norm': True, 'lr': 7.388052245754078e-05, 'weight_decay': 0.00033982249524420327, 'epochs': 192, 'loss': 'mae', 'optimizer': 'adam', 'graph_mode': 'off', 'use_snp_selection': True, 'num_snps': 19171}. Best is trial 130 with value: 0.13945202102683524.
[I 2025-12-05 15:27:36,749] Trial 132 finished with value: 0.12610349927921483 and parameters: {'model_type': 'mlp', 'hidden_dims': '[128, 64]', 'dropout': 0.5457959329232499, 'batch_norm': True, 'lr': 4.487109400861456e-05, 'weight_decay': 1.3068550325933013e-06, 'epochs': 204, 'loss': 'mae', 'optimizer': 'adam', 'graph_mode': 'off', 'use_snp_selection': True, 'num_snps': 31992}. Best is trial 130 with value: 0.13945202102683524.
[I 2025-12-05 15:27:39,196] Trial 133 finished with value: 0.1221413662899437 and parameters: {'model_type': 'mlp', 'hidden_dims': '[128, 64]', 'dropout': 0.1871496897668631, 'batch_norm': True, 'lr': 5.990386727497678e-05, 'weight_decay': 2.2241745812886904e-07, 'epochs': 220, 'loss': 'mae', 'optimizer': 'adam', 'graph_mode': 'off', 'use_snp_selection': True, 'num_snps': 27238}. Best is trial 130 with value: 0.13945202102683524.
[I 2025-12-05 15:27:41,753] Trial 134 finished with value: 0.09794357317841748 and parameters: {'model_type': 'mlp', 'hidden_dims': '[128, 64]', 'dropout': 0.1559943818003289, 'batch_norm': True, 'lr': 8.764259970185813e-05, 'weight_decay': 1.0327545085320208e-07, 'epochs': 214, 'loss': 'mae', 'optimizer': 'adam', 'graph_mode': 'off', 'use_snp_selection': True, 'num_snps': 30748}. Best is trial 130 with value: 0.13945202102683524.
[I 2025-12-05 15:27:44,321] Trial 135 finished with value: 0.07730113731173628 and parameters: {'model_type': 'mlp', 'hidden_dims': '[128, 64]', 'dropout': 0.5027992309456235, 'batch_norm': True, 'lr': 0.0001078764345940647, 'weight_decay': 9.102577812981518e-06, 'epochs': 226, 'loss': 'mae', 'optimizer': 'adam', 'graph_mode': 'off', 'use_snp_selection': True, 'num_snps': 28557}. Best is trial 130 with value: 0.13945202102683524.
[I 2025-12-05 15:27:46,453] Trial 136 finished with value: 0.048445395376480224 and parameters: {'model_type': 'mlp', 'hidden_dims': '[128, 64]', 'dropout': 0.5968435501950228, 'batch_norm': False, 'lr': 2.806532650135094e-06, 'weight_decay': 7.609374548228973e-07, 'epochs': 259, 'loss': 'mae', 'optimizer': 'adam', 'graph_mode': 'off', 'use_snp_selection': True, 'num_snps': 17893}. Best is trial 130 with value: 0.13945202102683524.
[I 2025-12-05 15:27:49,511] Trial 137 finished with value: 0.12020042478662767 and parameters: {'model_type': 'mlp', 'hidden_dims': '[512, 128]', 'dropout': 0.4207369649995957, 'batch_norm': False, 'lr': 5.6670376906324074e-05, 'weight_decay': 2.6768889653008566e-06, 'epochs': 201, 'loss': 'mae', 'optimizer': 'adam', 'graph_mode': 'off', 'use_snp_selection': True, 'num_snps': 25072}. Best is trial 130 with value: 0.13945202102683524.
[I 2025-12-05 15:27:51,698] Trial 138 finished with value: 0.10237668116713623 and parameters: {'model_type': 'mlp', 'hidden_dims': '[256, 128]', 'dropout': 0.5524190558522257, 'batch_norm': True, 'lr': 0.00014224618285778697, 'weight_decay': 4.942421178481651e-06, 'epochs': 247, 'loss': 'mae', 'optimizer': 'adam', 'graph_mode': 'off', 'use_snp_selection': True, 'num_snps': 13737}. Best is trial 130 with value: 0.13945202102683524.
[I 2025-12-05 15:27:54,234] Trial 139 finished with value: 0.09426574799889209 and parameters: {'model_type': 'mlp', 'hidden_dims': '[512, 64]', 'dropout': 0.1960526180146935, 'batch_norm': False, 'lr': 1.4487007436449256e-06, 'weight_decay': 5.712019162693774e-07, 'epochs': 270, 'loss': 'mae', 'optimizer': 'adam', 'graph_mode': 'off', 'use_snp_selection': True, 'num_snps': 15273}. Best is trial 130 with value: 0.13945202102683524.
[I 2025-12-05 15:27:56,400] Trial 140 finished with value: 0.12176688665918707 and parameters: {'model_type': 'mlp', 'hidden_dims': '[128, 64]', 'dropout': 0.21350472680053847, 'batch_norm': False, 'lr': 0.0005175236071647568, 'weight_decay': 0.0005158645502602716, 'epochs': 220, 'loss': 'mae', 'optimizer': 'adam', 'graph_mode': 'off', 'use_snp_selection': True, 'num_snps': 22618}. Best is trial 130 with value: 0.13945202102683524.
[I 2025-12-05 15:27:59,034] Trial 141 finished with value: 0.06779047807234112 and parameters: {'model_type': 'mlp', 'hidden_dims': '[128, 64]', 'dropout': 0.5558292950957975, 'batch_norm': True, 'lr': 4.3466077985602487e-05, 'weight_decay': 1.3740285144023713e-06, 'epochs': 204, 'loss': 'mae', 'optimizer': 'adam', 'graph_mode': 'off', 'use_snp_selection': True, 'num_snps': 32040}. Best is trial 130 with value: 0.13945202102683524.
[I 2025-12-05 15:28:01,717] Trial 142 finished with value: 0.06560301975767312 and parameters: {'model_type': 'mlp', 'hidden_dims': '[128, 64]', 'dropout': 0.5397398963787269, 'batch_norm': True, 'lr': 4.669302250283573e-05, 'weight_decay': 3.1276729678042524e-07, 'epochs': 188, 'loss': 'mae', 'optimizer': 'adam', 'graph_mode': 'off', 'use_snp_selection': True, 'num_snps': 34262}. Best is trial 130 with value: 0.13945202102683524.
[I 2025-12-05 15:28:04,264] Trial 143 finished with value: 0.014406245190342485 and parameters: {'model_type': 'mlp', 'hidden_dims': '[128, 64]', 'dropout': 0.5495558634315767, 'batch_norm': True, 'lr': 2.2085709677726975e-06, 'weight_decay': 0.00046164235437891056, 'epochs': 208, 'loss': 'mae', 'optimizer': 'adam', 'graph_mode': 'off', 'use_snp_selection': True, 'num_snps': 31168}. Best is trial 130 with value: 0.13945202102683524.
[I 2025-12-05 15:28:07,002] Trial 144 finished with value: 0.07412767011114298 and parameters: {'model_type': 'mlp', 'hidden_dims': '[128, 64]', 'dropout': 0.517419908582616, 'batch_norm': True, 'lr': 3.550875354787684e-05, 'weight_decay': 1.8343976729929995e-05, 'epochs': 194, 'loss': 'mae', 'optimizer': 'adam', 'graph_mode': 'off', 'use_snp_selection': True, 'num_snps': 35524}. Best is trial 130 with value: 0.13945202102683524.
[I 2025-12-05 15:28:10,010] Trial 145 finished with value: 0.08819958275465617 and parameters: {'model_type': 'mlp', 'hidden_dims': '[256, 128]', 'dropout': 0.4645814223573502, 'batch_norm': True, 'lr': 2.782445487936751e-05, 'weight_decay': 1.947710334994244e-06, 'epochs': 200, 'loss': 'mae', 'optimizer': 'adam', 'graph_mode': 'off', 'use_snp_selection': True, 'num_snps': 32861}. Best is trial 130 with value: 0.13945202102683524.
[I 2025-12-05 15:28:13,264] Trial 146 finished with value: 0.13321418795603238 and parameters: {'model_type': 'mlp', 'hidden_dims': '[512, 128]', 'dropout': 0.14827657092306795, 'batch_norm': False, 'lr': 6.914797432060119e-05, 'weight_decay': 0.0001907667513144428, 'epochs': 339, 'loss': 'mae', 'optimizer': 'adam', 'graph_mode': 'off', 'use_snp_selection': True, 'num_snps': 19821}. Best is trial 130 with value: 0.13945202102683524.
[I 2025-12-05 15:28:16,554] Trial 147 finished with value: 0.12029307303459467 and parameters: {'model_type': 'mlp', 'hidden_dims': '[512, 128]', 'dropout': 0.14070525808102363, 'batch_norm': False, 'lr': 6.67860055570529e-05, 'weight_decay': 0.00017733101609708718, 'epochs': 343, 'loss': 'mae', 'optimizer': 'adam', 'graph_mode': 'off', 'use_snp_selection': True, 'num_snps': 20279}. Best is trial 130 with value: 0.13945202102683524.
[I 2025-12-05 15:28:19,391] Trial 148 finished with value: 0.13167458078141137 and parameters: {'model_type': 'mlp', 'hidden_dims': '[512, 128]', 'dropout': 0.16812769588042129, 'batch_norm': False, 'lr': 9.865589794061383e-05, 'weight_decay': 0.00022568154529728151, 'epochs': 255, 'loss': 'mae', 'optimizer': 'adam', 'graph_mode': 'off', 'use_snp_selection': True, 'num_snps': 18814}. Best is trial 130 with value: 0.13945202102683524.
[I 2025-12-05 15:28:22,095] Trial 149 finished with value: 0.12369364170403843 and parameters: {'model_type': 'mlp', 'hidden_dims': '[512, 128]', 'dropout': 0.16805417456960411, 'batch_norm': False, 'lr': 5.2443927637929185e-05, 'weight_decay': 0.00022037631941238577, 'epochs': 263, 'loss': 'mse', 'optimizer': 'adam', 'graph_mode': 'off', 'use_snp_selection': True, 'num_snps': 16877}. Best is trial 130 with value: 0.13945202102683524.
[I 2025-12-05 15:28:24,540] Trial 0 finished with value: 0.05000237052681163 and parameters: {'model_type': 'mlp', 'hidden_dims': '[128, 64]', 'dropout': 0.199031432379812, 'batch_norm': True, 'lr': 1.8408544111075837e-06, 'weight_decay': 5.5136510071208614e-05, 'epochs': 336, 'loss': 'mae', 'optimizer': 'adam', 'graph_mode': 'off', 'use_snp_selection': True, 'num_snps': 43862}. Best is trial 0 with value: 0.05000237052681163.
[I 2025-12-05 15:28:27,261] Trial 1 finished with value: 0.07586401109833399 and parameters: {'model_type': 'mlp', 'hidden_dims': '[256, 128]', 'dropout': 0.4370668075331726, 'batch_norm': True, 'lr': 7.133471581159139e-05, 'weight_decay': 1.128633586803549e-05, 'epochs': 242, 'loss': 'mae', 'optimizer': 'adam', 'graph_mode': 'off', 'use_snp_selection': False}. Best is trial 1 with value: 0.07586401109833399.
[I 2025-12-05 15:28:29,138] Trial 2 finished with value: 0.016637856153391622 and parameters: {'model_type': 'mlp', 'hidden_dims': '[256, 128, 64]', 'dropout': 0.41314357415569625, 'batch_norm': False, 'lr': 3.952233718592101e-06, 'weight_decay': 0.00026754769258252603, 'epochs': 149, 'loss': 'mse', 'optimizer': 'adam', 'graph_mode': 'off', 'use_snp_selection': True, 'num_snps': 11571}. Best is trial 1 with value: 0.07586401109833399.
[I 2025-12-05 15:28:32,181] Trial 3 finished with value: 0.016725492882028816 and parameters: {'model_type': 'mlp', 'hidden_dims': '[512, 64]', 'dropout': 0.5938127374509361, 'batch_norm': False, 'lr': 5.67704586114731e-06, 'weight_decay': 2.4518087630137052e-05, 'epochs': 320, 'loss': 'mae', 'optimizer': 'adam', 'graph_mode': 'off', 'use_snp_selection': False}. Best is trial 1 with value: 0.07586401109833399.
[I 2025-12-05 15:28:35,162] Trial 4 finished with value: 0.019084896010830514 and parameters: {'model_type': 'mlp', 'hidden_dims': '[512, 128]', 'dropout': 0.25746343592134413, 'batch_norm': True, 'lr': 1.3467657668402788e-06, 'weight_decay': 0.00033087251918647806, 'epochs': 277, 'loss': 'mse', 'optimizer': 'adam', 'graph_mode': 'off', 'use_snp_selection': True, 'num_snps': 36675}. Best is trial 1 with value: 0.07586401109833399.
[I 2025-12-05 15:28:37,280] Trial 5 finished with value: -0.012051791880011835 and parameters: {'model_type': 'mlp', 'hidden_dims': '[512, 64]', 'dropout': 0.38275350994408375, 'batch_norm': True, 'lr': 1.5586664309232824e-06, 'weight_decay': 0.0008227664668621182, 'epochs': 145, 'loss': 'mae', 'optimizer': 'adam', 'graph_mode': 'off', 'use_snp_selection': True, 'num_snps': 32148}. Best is trial 1 with value: 0.07586401109833399.
[I 2025-12-05 15:28:38,477] Trial 6 finished with value: 0.07965795525940288 and parameters: {'model_type': 'mlp', 'hidden_dims': '[256, 128]', 'dropout': 0.3930109900265879, 'batch_norm': False, 'lr': 4.892964372128395e-05, 'weight_decay': 1.5809549317992182e-06, 'epochs': 199, 'loss': 'mse', 'optimizer': 'adam', 'graph_mode': 'off', 'use_snp_selection': False}. Best is trial 6 with value: 0.07965795525940288.
[I 2025-12-05 15:28:39,814] Trial 7 finished with value: 0.07924413191456431 and parameters: {'model_type': 'mlp', 'hidden_dims': '[512, 256]', 'dropout': 0.15343979219678458, 'batch_norm': True, 'lr': 6.234003099047341e-05, 'weight_decay': 3.894760610535477e-07, 'epochs': 97, 'loss': 'mse', 'optimizer': 'adam', 'graph_mode': 'off', 'use_snp_selection': False}. Best is trial 6 with value: 0.07965795525940288.
[I 2025-12-05 15:28:42,449] Trial 8 finished with value: 0.064828197958458 and parameters: {'model_type': 'mlp', 'hidden_dims': '[512, 128]', 'dropout': 0.10743001231661406, 'batch_norm': True, 'lr': 0.00023728538449271062, 'weight_decay': 1.7629071578048637e-05, 'epochs': 312, 'loss': 'mae', 'optimizer': 'adam', 'graph_mode': 'off', 'use_snp_selection': False}. Best is trial 6 with value: 0.07965795525940288.
[I 2025-12-05 15:28:44,251] Trial 9 finished with value: 0.07774204777821511 and parameters: {'model_type': 'mlp', 'hidden_dims': '[512, 64]', 'dropout': 0.14505336736221927, 'batch_norm': True, 'lr': 5.8619638388111826e-05, 'weight_decay': 6.200156172669308e-07, 'epochs': 175, 'loss': 'mse', 'optimizer': 'adam', 'graph_mode': 'off', 'use_snp_selection': False}. Best is trial 6 with value: 0.07965795525940288.
[I 2025-12-05 15:28:45,045] Trial 10 finished with value: 0.008546185863236883 and parameters: {'model_type': 'mlp', 'hidden_dims': '[256, 128]', 'dropout': 0.5267360651501256, 'batch_norm': False, 'lr': 0.00032393778075602147, 'weight_decay': 1.936962886850364e-06, 'epochs': 46, 'loss': 'mse', 'optimizer': 'adam', 'graph_mode': 'off', 'use_snp_selection': False}. Best is trial 6 with value: 0.07965795525940288.
[I 2025-12-05 15:28:46,294] Trial 11 finished with value: 0.0672953234136692 and parameters: {'model_type': 'mlp', 'hidden_dims': '[512, 256]', 'dropout': 0.30438831352760154, 'batch_norm': False, 'lr': 1.6474108386126448e-05, 'weight_decay': 1.1557995186088584e-07, 'epochs': 77, 'loss': 'mse', 'optimizer': 'adam', 'graph_mode': 'off', 'use_snp_selection': False}. Best is trial 6 with value: 0.07965795525940288.
[I 2025-12-05 15:28:48,342] Trial 12 finished with value: 0.059229473343684697 and parameters: {'model_type': 'mlp', 'hidden_dims': '[512, 256]', 'dropout': 0.2566297617165757, 'batch_norm': False, 'lr': 2.1908156534290234e-05, 'weight_decay': 1.255784110448998e-06, 'epochs': 218, 'loss': 'mse', 'optimizer': 'adam', 'graph_mode': 'off', 'use_snp_selection': False}. Best is trial 6 with value: 0.07965795525940288.
[I 2025-12-05 15:28:49,770] Trial 13 finished with value: 0.07653246266154494 and parameters: {'model_type': 'mlp', 'hidden_dims': '[512, 256]', 'dropout': 0.4741937675090661, 'batch_norm': False, 'lr': 8.582121287988678e-05, 'weight_decay': 1.8943103370730294e-07, 'epochs': 110, 'loss': 'mse', 'optimizer': 'adam', 'graph_mode': 'off', 'use_snp_selection': False}. Best is trial 6 with value: 0.07965795525940288.
[I 2025-12-05 15:28:50,994] Trial 14 finished with value: 0.08212302822445298 and parameters: {'model_type': 'mlp', 'hidden_dims': '[256, 128]', 'dropout': 0.3012984444538551, 'batch_norm': True, 'lr': 0.0006809598175709456, 'weight_decay': 3.563076152334783e-06, 'epochs': 203, 'loss': 'mse', 'optimizer': 'adam', 'graph_mode': 'off', 'use_snp_selection': False}. Best is trial 14 with value: 0.08212302822445298.
