[I 2025-12-06 01:36:13,174] Trial 11 finished with value: 0.21186727493058113 and parameters: {'model_type': 'mlp', 'hidden_dims': '[512, 64]', 'dropout': 0.583942291816117, 'batch_norm': False, 'lr': 1.422933652790185e-05, 'weight_decay': 1.2045055692919657e-07, 'epochs': 213, 'loss': 'mse', 'optimizer': 'adam', 'graph_mode': 'off', 'use_snp_selection': False}. Best is trial 3 with value: 0.21638559535495677.
[I 2025-12-06 01:36:50,649] Trial 12 finished with value: 0.10280539307083654 and parameters: {'model_type': 'mlp', 'hidden_dims': '[512, 64]', 'dropout': 0.2637316882220091, 'batch_norm': False, 'lr': 0.0006753264773209732, 'weight_decay': 1.6488595357534196e-06, 'epochs': 154, 'loss': 'mae', 'optimizer': 'adam', 'graph_mode': 'off', 'use_snp_selection': False}. Best is trial 3 with value: 0.21638559535495677.
[I 2025-12-06 01:37:50,603] Trial 13 finished with value: 0.20588810029321705 and parameters: {'model_type': 'mlp', 'hidden_dims': '[512, 64]', 'dropout': 0.5086194929129976, 'batch_norm': False, 'lr': 1.4304506621636526e-05, 'weight_decay': 4.373608364627903e-05, 'epochs': 261, 'loss': 'mse', 'optimizer': 'adam', 'graph_mode': 'off', 'use_snp_selection': False}. Best is trial 3 with value: 0.21638559535495677.
[I 2025-12-06 01:38:10,019] Trial 14 finished with value: 0.19919862582555942 and parameters: {'model_type': 'mlp', 'hidden_dims': '[128, 64]', 'dropout': 0.3012984444538551, 'batch_norm': True, 'lr': 0.00017558188744418174, 'weight_decay': 4.57067734295802e-06, 'epochs': 293, 'loss': 'mse', 'optimizer': 'adam', 'graph_mode': 'off', 'use_snp_selection': False}. Best is trial 3 with value: 0.21638559535495677.
[I 2025-12-06 01:39:03,739] Trial 15 finished with value: 0.22253701109702234 and parameters: {'model_type': 'mlp', 'hidden_dims': '[512, 256]', 'dropout': 0.48263162073930665, 'batch_norm': False, 'lr': 2.200457974768058e-05, 'weight_decay': 4.081624813577402e-07, 'epochs': 231, 'loss': 'mae', 'optimizer': 'adam', 'graph_mode': 'off', 'use_snp_selection': False}. Best is trial 15 with value: 0.22253701109702234.
[I 2025-12-06 01:40:22,411] Trial 16 finished with value: 0.22033455189006673 and parameters: {'model_type': 'mlp', 'hidden_dims': '[512, 256]', 'dropout': 0.5019167232535396, 'batch_norm': False, 'lr': 6.013316929814413e-06, 'weight_decay': 1.3229530044707064e-07, 'epochs': 350, 'loss': 'mae', 'optimizer': 'adam', 'graph_mode': 'off', 'use_snp_selection': False}. Best is trial 15 with value: 0.22253701109702234.
[I 2025-12-06 01:41:40,390] Trial 17 finished with value: 0.22513292142532199 and parameters: {'model_type': 'mlp', 'hidden_dims': '[512, 256]', 'dropout': 0.4950713425380164, 'batch_norm': False, 'lr': 2.349300150160787e-05, 'weight_decay': 1.215662949192116e-07, 'epochs': 350, 'loss': 'mae', 'optimizer': 'adam', 'graph_mode': 'off', 'use_snp_selection': False}. Best is trial 17 with value: 0.22513292142532199.
[I 2025-12-06 01:42:59,408] Trial 18 finished with value: 0.21326441056953235 and parameters: {'model_type': 'mlp', 'hidden_dims': '[512, 256]', 'dropout': 0.4896368687956769, 'batch_norm': False, 'lr': 2.0388046718544274e-05, 'weight_decay': 4.508787233101714e-07, 'epochs': 225, 'loss': 'mae', 'optimizer': 'adam', 'graph_mode': 'off', 'use_snp_selection': True, 'num_snps': 58241}. Best is trial 17 with value: 0.22513292142532199.
[I 2025-12-06 01:43:28,381] Trial 19 finished with value: 0.22601398156321872 and parameters: {'model_type': 'mlp', 'hidden_dims': '[512, 256]', 'dropout': 0.3358432223619431, 'batch_norm': False, 'lr': 0.00014334793979738487, 'weight_decay': 2.521057553445816e-07, 'epochs': 112, 'loss': 'mae', 'optimizer': 'adam', 'graph_mode': 'off', 'use_snp_selection': False}. Best is trial 19 with value: 0.22601398156321872.
[I 2025-12-06 01:43:55,797] Trial 20 finished with value: 0.2273511924546526 and parameters: {'model_type': 'mlp', 'hidden_dims': '[512, 256]', 'dropout': 0.3560483015693501, 'batch_norm': False, 'lr': 0.00016679086146317298, 'weight_decay': 2.0246455072247709e-07, 'epochs': 104, 'loss': 'mae', 'optimizer': 'adam', 'graph_mode': 'off', 'use_snp_selection': False}. Best is trial 20 with value: 0.2273511924546526.
[I 2025-12-06 01:44:20,169] Trial 21 finished with value: 0.2257955332409737 and parameters: {'model_type': 'mlp', 'hidden_dims': '[512, 256]', 'dropout': 0.33856317019540505, 'batch_norm': False, 'lr': 0.00017228730194886107, 'weight_decay': 1.052259034566869e-07, 'epochs': 89, 'loss': 'mae', 'optimizer': 'adam', 'graph_mode': 'off', 'use_snp_selection': False}. Best is trial 20 with value: 0.2273511924546526.
[I 2025-12-06 01:44:46,783] Trial 22 finished with value: 0.22857634798187315 and parameters: {'model_type': 'mlp', 'hidden_dims': '[512, 256]', 'dropout': 0.32331945031162235, 'batch_norm': False, 'lr': 0.00017485145431439352, 'weight_decay': 2.5976660102865413e-07, 'epochs': 100, 'loss': 'mae', 'optimizer': 'adam', 'graph_mode': 'off', 'use_snp_selection': False}. Best is trial 22 with value: 0.22857634798187315.
[I 2025-12-06 01:45:15,173] Trial 23 finished with value: 0.22411102564223917 and parameters: {'model_type': 'mlp', 'hidden_dims': '[512, 256]', 'dropout': 0.3366410204465517, 'batch_norm': False, 'lr': 0.0007873333276919838, 'weight_decay': 9.409464227363451e-07, 'epochs': 109, 'loss': 'mae', 'optimizer': 'adam', 'graph_mode': 'off', 'use_snp_selection': False}. Best is trial 22 with value: 0.22857634798187315.
[I 2025-12-06 01:45:24,872] Trial 24 finished with value: 0.1965516465822594 and parameters: {'model_type': 'mlp', 'hidden_dims': '[256, 128, 64]', 'dropout': 0.2917555715740715, 'batch_norm': False, 'lr': 0.0004861095634140296, 'weight_decay': 2.6745960809738586e-07, 'epochs': 42, 'loss': 'mae', 'optimizer': 'adam', 'graph_mode': 'off', 'use_snp_selection': False}. Best is trial 22 with value: 0.22857634798187315.
[I 2025-12-06 01:45:56,188] Trial 25 finished with value: 0.22773315020292434 and parameters: {'model_type': 'mlp', 'hidden_dims': '[512, 256]', 'dropout': 0.2185359628497348, 'batch_norm': False, 'lr': 0.0003213162255624315, 'weight_decay': 2.3536076593291016e-07, 'epochs': 123, 'loss': 'mae', 'optimizer': 'adam', 'graph_mode': 'off', 'use_snp_selection': False}. Best is trial 22 with value: 0.22857634798187315.
[I 2025-12-06 01:46:19,999] Trial 26 finished with value: 0.20384905989522673 and parameters: {'model_type': 'mlp', 'hidden_dims': '[512, 256]', 'dropout': 0.21724036928116555, 'batch_norm': False, 'lr': 0.00035524856104019137, 'weight_decay': 1.004861332369944e-06, 'epochs': 68, 'loss': 'mae', 'optimizer': 'adam', 'graph_mode': 'off', 'use_snp_selection': True, 'num_snps': 3842}. Best is trial 22 with value: 0.22857634798187315.
[I 2025-12-06 01:46:52,674] Trial 27 finished with value: 0.222283867844376 and parameters: {'model_type': 'mlp', 'hidden_dims': '[512, 256]', 'dropout': 0.21936957127473128, 'batch_norm': False, 'lr': 0.0003085833385918693, 'weight_decay': 4.881339110858778e-06, 'epochs': 130, 'loss': 'mae', 'optimizer': 'adam', 'graph_mode': 'off', 'use_snp_selection': False}. Best is trial 22 with value: 0.22857634798187315.
[I 2025-12-06 01:47:13,295] Trial 28 finished with value: 0.22895110447976147 and parameters: {'model_type': 'mlp', 'hidden_dims': '[512, 256]', 'dropout': 0.2986207995373175, 'batch_norm': False, 'lr': 0.00011529347997059836, 'weight_decay': 2.2386313268376668e-07, 'epochs': 70, 'loss': 'mae', 'optimizer': 'adam', 'graph_mode': 'off', 'use_snp_selection': False}. Best is trial 28 with value: 0.22895110447976147.
[I 2025-12-06 01:47:41,434] Trial 29 finished with value: 0.22761336099955964 and parameters: {'model_type': 'mlp', 'hidden_dims': '[128, 64]', 'dropout': 0.1952988408672255, 'batch_norm': False, 'lr': 9.733181752156754e-05, 'weight_decay': 8.603240275144894e-07, 'epochs': 75, 'loss': 'mae', 'optimizer': 'adam', 'graph_mode': 'off', 'use_snp_selection': True, 'num_snps': 19468}. Best is trial 28 with value: 0.22895110447976147.
[I 2025-12-06 01:48:04,675] Trial 30 finished with value: 0.22207220284727516 and parameters: {'model_type': 'mlp', 'hidden_dims': '[256, 128]', 'dropout': 0.2603231848064781, 'batch_norm': False, 'lr': 0.0005188852333641421, 'weight_decay': 2.7210982099276064e-06, 'epochs': 174, 'loss': 'mae', 'optimizer': 'adam', 'graph_mode': 'off', 'use_snp_selection': False}. Best is trial 28 with value: 0.22895110447976147.
[I 2025-12-06 01:48:32,751] Trial 31 finished with value: 0.21919046005237056 and parameters: {'model_type': 'mlp', 'hidden_dims': '[128, 64]', 'dropout': 0.18107504913716937, 'batch_norm': False, 'lr': 0.00010259189197724705, 'weight_decay': 6.662516888466048e-07, 'epochs': 64, 'loss': 'mae', 'optimizer': 'adam', 'graph_mode': 'off', 'use_snp_selection': True, 'num_snps': 20297}. Best is trial 28 with value: 0.22895110447976147.
[I 2025-12-06 01:49:01,662] Trial 32 finished with value: 0.22932730289939834 and parameters: {'model_type': 'mlp', 'hidden_dims': '[128, 64]', 'dropout': 0.19038780302608788, 'batch_norm': False, 'lr': 9.629711891685452e-05, 'weight_decay': 2.3360377135339458e-07, 'epochs': 80, 'loss': 'mae', 'optimizer': 'adam', 'graph_mode': 'off', 'use_snp_selection': True, 'num_snps': 21575}. Best is trial 32 with value: 0.22932730289939834.
[I 2025-12-06 01:49:41,467] Trial 33 finished with value: 0.22847435896615803 and parameters: {'model_type': 'mlp', 'hidden_dims': '[128, 64]', 'dropout': 0.29750582021798394, 'batch_norm': False, 'lr': 3.633705373712018e-05, 'weight_decay': 2.2533757778405973e-07, 'epochs': 128, 'loss': 'mae', 'optimizer': 'adam', 'graph_mode': 'off', 'use_snp_selection': True, 'num_snps': 49677}. Best is trial 32 with value: 0.22932730289939834.
[I 2025-12-06 01:50:18,089] Trial 34 finished with value: 0.21057029967583127 and parameters: {'model_type': 'mlp', 'hidden_dims': '[128, 64]', 'dropout': 0.30290579765007414, 'batch_norm': False, 'lr': 3.9376994678011795e-05, 'weight_decay': 1.836682645702284e-07, 'epochs': 40, 'loss': 'mae', 'optimizer': 'adam', 'graph_mode': 'off', 'use_snp_selection': True, 'num_snps': 51822}. Best is trial 32 with value: 0.22932730289939834.
[I 2025-12-06 01:50:48,422] Trial 35 finished with value: 0.22523083612290867 and parameters: {'model_type': 'mlp', 'hidden_dims': '[128, 64]', 'dropout': 0.25117734753169074, 'batch_norm': False, 'lr': 9.372931028268363e-05, 'weight_decay': 4.626827864452179e-07, 'epochs': 86, 'loss': 'mae', 'optimizer': 'adam', 'graph_mode': 'off', 'use_snp_selection': True, 'num_snps': 25348}. Best is trial 32 with value: 0.22932730289939834.
[I 2025-12-06 01:51:26,168] Trial 36 finished with value: 0.22474278543820647 and parameters: {'model_type': 'mlp', 'hidden_dims': '[128, 64]', 'dropout': 0.4408804731015432, 'batch_norm': False, 'lr': 3.743860006589983e-05, 'weight_decay': 8.999855826310148e-06, 'epochs': 137, 'loss': 'mae', 'optimizer': 'adam', 'graph_mode': 'off', 'use_snp_selection': True, 'num_snps': 43044}. Best is trial 32 with value: 0.22932730289939834.
[I 2025-12-06 01:52:09,689] Trial 37 finished with value: 0.18809376592236554 and parameters: {'model_type': 'mlp', 'hidden_dims': '[256, 128, 64]', 'dropout': 0.31355895779637943, 'batch_norm': False, 'lr': 2.6246285399617145e-06, 'weight_decay': 8.08863288469288e-05, 'epochs': 166, 'loss': 'mae', 'optimizer': 'adam', 'graph_mode': 'off', 'use_snp_selection': True, 'num_snps': 40200}. Best is trial 32 with value: 0.22932730289939834.
[I 2025-12-06 01:52:58,998] Trial 38 finished with value: 0.21434996717761626 and parameters: {'model_type': 'mlp', 'hidden_dims': '[512, 128]', 'dropout': 0.3747822351341761, 'batch_norm': True, 'lr': 9.182004084891958e-05, 'weight_decay': 1.8464541375690518e-06, 'epochs': 83, 'loss': 'mae', 'optimizer': 'adam', 'graph_mode': 'off', 'use_snp_selection': True, 'num_snps': 50742}. Best is trial 32 with value: 0.22932730289939834.
[I 2025-12-06 01:53:30,516] Trial 39 finished with value: 0.2251633658294943 and parameters: {'model_type': 'mlp', 'hidden_dims': '[128, 64]', 'dropout': 0.4331461915894642, 'batch_norm': False, 'lr': 7.028745181959458e-05, 'weight_decay': 3.244527069697861e-07, 'epochs': 118, 'loss': 'mae', 'optimizer': 'adam', 'graph_mode': 'off', 'use_snp_selection': True, 'num_snps': 27058}. Best is trial 32 with value: 0.22932730289939834.
[I 2025-12-06 01:53:56,241] Trial 40 finished with value: 0.199175560769636 and parameters: {'model_type': 'mlp', 'hidden_dims': '[256, 128]', 'dropout': 0.11200578025149113, 'batch_norm': True, 'lr': 0.00022090853770740342, 'weight_decay': 1.7057997273188127e-07, 'epochs': 56, 'loss': 'mae', 'optimizer': 'adam', 'graph_mode': 'off', 'use_snp_selection': True, 'num_snps': 10357}. Best is trial 32 with value: 0.22932730289939834.
[I 2025-12-06 01:54:30,284] Trial 41 finished with value: 0.23139331883823724 and parameters: {'model_type': 'mlp', 'hidden_dims': '[128, 64]', 'dropout': 0.2373065325735803, 'batch_norm': False, 'lr': 0.00029354732111018826, 'weight_decay': 2.852341837316169e-07, 'epochs': 124, 'loss': 'mae', 'optimizer': 'adam', 'graph_mode': 'off', 'use_snp_selection': True, 'num_snps': 33428}. Best is trial 41 with value: 0.23139331883823724.
[I 2025-12-06 01:55:03,563] Trial 42 finished with value: 0.22889759327967601 and parameters: {'model_type': 'mlp', 'hidden_dims': '[128, 64]', 'dropout': 0.2728750215323353, 'batch_norm': False, 'lr': 0.00012999512881177425, 'weight_decay': 6.245642226148995e-07, 'epochs': 96, 'loss': 'mae', 'optimizer': 'adam', 'graph_mode': 'off', 'use_snp_selection': True, 'num_snps': 33874}. Best is trial 41 with value: 0.23139331883823724.
[I 2025-12-06 01:55:36,346] Trial 43 finished with value: 0.22636556448516418 and parameters: {'model_type': 'mlp', 'hidden_dims': '[128, 64]', 'dropout': 0.24203131970180014, 'batch_norm': False, 'lr': 0.0001241540353650722, 'weight_decay': 6.077949804903083e-07, 'epochs': 94, 'loss': 'mae', 'optimizer': 'adam', 'graph_mode': 'off', 'use_snp_selection': True, 'num_snps': 32651}. Best is trial 41 with value: 0.23139331883823724.
[I 2025-12-06 01:56:06,220] Trial 44 finished with value: 0.20535628717439125 and parameters: {'model_type': 'mlp', 'hidden_dims': '[128, 64]', 'dropout': 0.28014665896611746, 'batch_norm': False, 'lr': 0.0002825013951010187, 'weight_decay': 1.1949370257972182e-06, 'epochs': 75, 'loss': 'mse', 'optimizer': 'adam', 'graph_mode': 'off', 'use_snp_selection': True, 'num_snps': 24774}. Best is trial 41 with value: 0.23139331883823724.
[I 2025-12-06 01:56:42,686] Trial 45 finished with value: 0.21310199213239583 and parameters: {'model_type': 'mlp', 'hidden_dims': '[512, 128]', 'dropout': 0.18090991938843223, 'batch_norm': False, 'lr': 0.00044184246506556404, 'weight_decay': 3.6992685594732467e-07, 'epochs': 147, 'loss': 'mae', 'optimizer': 'adam', 'graph_mode': 'off', 'use_snp_selection': True, 'num_snps': 19781}. Best is trial 41 with value: 0.23139331883823724.
[I 2025-12-06 01:57:16,985] Trial 46 finished with value: 0.20791247487730669 and parameters: {'model_type': 'mlp', 'hidden_dims': '[128, 64]', 'dropout': 0.13460649506960978, 'batch_norm': True, 'lr': 0.0009860270233709248, 'weight_decay': 5.591358347702912e-07, 'epochs': 99, 'loss': 'mae', 'optimizer': 'adam', 'graph_mode': 'off', 'use_snp_selection': True, 'num_snps': 36127}. Best is trial 41 with value: 0.23139331883823724.
[I 2025-12-06 01:57:49,185] Trial 47 finished with value: 0.2131618910052202 and parameters: {'model_type': 'mlp', 'hidden_dims': '[256, 128, 64]', 'dropout': 0.22820912840010196, 'batch_norm': False, 'lr': 0.00020273554949798574, 'weight_decay': 1.5685950419254538e-07, 'epochs': 56, 'loss': 'mse', 'optimizer': 'adam', 'graph_mode': 'off', 'use_snp_selection': True, 'num_snps': 29194}. Best is trial 41 with value: 0.23139331883823724.
[I 2025-12-06 01:58:17,741] Trial 48 finished with value: 0.21319043052449377 and parameters: {'model_type': 'mlp', 'hidden_dims': '[128, 64]', 'dropout': 0.27816711307701486, 'batch_norm': False, 'lr': 5.4049650532795496e-05, 'weight_decay': 3.2544295218251664e-07, 'epochs': 195, 'loss': 'mae', 'optimizer': 'adam', 'graph_mode': 'off', 'use_snp_selection': True, 'num_snps': 14320}. Best is trial 41 with value: 0.23139331883823724.
[I 2025-12-06 01:58:51,679] Trial 49 finished with value: 0.22089112627428947 and parameters: {'model_type': 'mlp', 'hidden_dims': '[256, 128]', 'dropout': 0.17045649631548118, 'batch_norm': False, 'lr': 0.00013100770411587331, 'weight_decay': 0.000633592911644899, 'epochs': 162, 'loss': 'mae', 'optimizer': 'adam', 'graph_mode': 'off', 'use_snp_selection': True, 'num_snps': 22841}. Best is trial 41 with value: 0.23139331883823724.
[I 2025-12-06 01:59:27,845] Trial 50 finished with value: 0.15107900252922135 and parameters: {'model_type': 'mlp', 'hidden_dims': '[128, 64]', 'dropout': 0.20165725112161081, 'batch_norm': True, 'lr': 1.0921708743861942e-06, 'weight_decay': 0.00015708254017785187, 'epochs': 139, 'loss': 'mse', 'optimizer': 'adam', 'graph_mode': 'off', 'use_snp_selection': True, 'num_snps': 38835}. Best is trial 41 with value: 0.23139331883823724.
[I 2025-12-06 02:00:07,216] Trial 51 finished with value: 0.2231003714559264 and parameters: {'model_type': 'mlp', 'hidden_dims': '[128, 64]', 'dropout': 0.3197478981660402, 'batch_norm': False, 'lr': 4.84931223896522e-05, 'weight_decay': 1.016602478237517e-07, 'epochs': 124, 'loss': 'mae', 'optimizer': 'adam', 'graph_mode': 'off', 'use_snp_selection': True, 'num_snps': 49723}. Best is trial 41 with value: 0.23139331883823724.
[I 2025-12-06 02:00:48,454] Trial 52 finished with value: 0.21712621054660333 and parameters: {'model_type': 'mlp', 'hidden_dims': '[128, 64]', 'dropout': 0.3629866222737951, 'batch_norm': False, 'lr': 6.655410051272853e-05, 'weight_decay': 2.4139301528400475e-07, 'epochs': 105, 'loss': 'mae', 'optimizer': 'adam', 'graph_mode': 'off', 'use_snp_selection': True, 'num_snps': 57801}. Best is trial 41 with value: 0.23139331883823724.
[I 2025-12-06 02:01:24,028] Trial 53 finished with value: 0.22747219404278468 and parameters: {'model_type': 'mlp', 'hidden_dims': '[128, 64]', 'dropout': 0.2779323740899105, 'batch_norm': False, 'lr': 2.8738443766356224e-05, 'weight_decay': 1.5984742063641834e-07, 'epochs': 77, 'loss': 'mae', 'optimizer': 'adam', 'graph_mode': 'off', 'use_snp_selection': True, 'num_snps': 44930}. Best is trial 41 with value: 0.23139331883823724.
[I 2025-12-06 02:02:11,223] Trial 54 finished with value: 0.21748851124553284 and parameters: {'model_type': 'mlp', 'hidden_dims': '[512, 128]', 'dropout': 0.2390949400976794, 'batch_norm': False, 'lr': 7.815036833059923e-05, 'weight_decay': 7.389207413750515e-07, 'epochs': 94, 'loss': 'mae', 'optimizer': 'adam', 'graph_mode': 'off', 'use_snp_selection': True, 'num_snps': 45834}. Best is trial 41 with value: 0.23139331883823724.
[I 2025-12-06 02:02:24,724] Trial 55 finished with value: 0.21479384961509904 and parameters: {'model_type': 'mlp', 'hidden_dims': '[128, 64]', 'dropout': 0.4047059860673202, 'batch_norm': False, 'lr': 0.00012519399548615708, 'weight_decay': 4.567583500030247e-07, 'epochs': 187, 'loss': 'mae', 'optimizer': 'adam', 'graph_mode': 'off', 'use_snp_selection': False}. Best is trial 41 with value: 0.23139331883823724.
[I 2025-12-06 02:03:07,118] Trial 56 finished with value: 0.23101664061367141 and parameters: {'model_type': 'mlp', 'hidden_dims': '[512, 64]', 'dropout': 0.311981820549756, 'batch_norm': False, 'lr': 1.4380624878714458e-05, 'weight_decay': 3.0678293030855196e-07, 'epochs': 132, 'loss': 'mae', 'optimizer': 'adam', 'graph_mode': 'off', 'use_snp_selection': True, 'num_snps': 30996}. Best is trial 41 with value: 0.23139331883823724.
[I 2025-12-06 02:03:36,307] Trial 57 finished with value: 0.22541599962707126 and parameters: {'model_type': 'mlp', 'hidden_dims': '[512, 64]', 'dropout': 0.3202928435715793, 'batch_norm': False, 'lr': 1.4645734503266517e-05, 'weight_decay': 1.4904778811365983e-06, 'epochs': 113, 'loss': 'mae', 'optimizer': 'adam', 'graph_mode': 'off', 'use_snp_selection': False}. Best is trial 41 with value: 0.23139331883823724.
[I 2025-12-06 02:03:53,479] Trial 58 finished with value: 0.2073542019083161 and parameters: {'model_type': 'mlp', 'hidden_dims': '[512, 64]', 'dropout': 0.2650948255476745, 'batch_norm': False, 'lr': 7.3312217272925185e-06, 'weight_decay': 3.221137644714533e-07, 'epochs': 53, 'loss': 'mae', 'optimizer': 'adam', 'graph_mode': 'off', 'use_snp_selection': False}. Best is trial 41 with value: 0.23139331883823724.
[I 2025-12-06 02:04:31,460] Trial 59 finished with value: 0.21284214410618688 and parameters: {'model_type': 'mlp', 'hidden_dims': '[512, 256]', 'dropout': 0.34473118658409013, 'batch_norm': False, 'lr': 0.00022641853488069945, 'weight_decay': 2.4554302312062355e-06, 'epochs': 85, 'loss': 'mse', 'optimizer': 'adam', 'graph_mode': 'off', 'use_snp_selection': True, 'num_snps': 31077}. Best is trial 41 with value: 0.23139331883823724.
[I 2025-12-06 02:05:08,742] Trial 60 finished with value: 0.22454448886679343 and parameters: {'model_type': 'mlp', 'hidden_dims': '[512, 64]', 'dropout': 0.15258339926996947, 'batch_norm': False, 'lr': 4.6957170406725134e-06, 'weight_decay': 1.411523844245077e-07, 'epochs': 152, 'loss': 'mae', 'optimizer': 'adam', 'graph_mode': 'off', 'use_snp_selection': False}. Best is trial 41 with value: 0.23139331883823724.
[I 2025-12-06 02:05:53,382] Trial 61 finished with value: 0.23904441398023235 and parameters: {'model_type': 'mlp', 'hidden_dims': '[512, 64]', 'dropout': 0.2974839628384431, 'batch_norm': False, 'lr': 1.1606518242030074e-05, 'weight_decay': 2.2815921289163678e-07, 'epochs': 131, 'loss': 'mae', 'optimizer': 'adam', 'graph_mode': 'off', 'use_snp_selection': True, 'num_snps': 34009}. Best is trial 61 with value: 0.23904441398023235.
