[I 2025-12-05 15:08:45,514] Trial 99 finished with value: 0.017098268103939288 and parameters: {'model_type': 'mlp', 'hidden_dims': '[512, 256]', 'dropout': 0.12268541004271308, 'batch_norm': False, 'lr': 7.422383034225086e-05, 'weight_decay': 2.8738714461548746e-05, 'epochs': 94, 'loss': 'mae', 'optimizer': 'adam', 'graph_mode': 'off', 'use_snp_selection': True, 'num_snps': 55934}. Best is trial 36 with value: 0.07683981704169063.
[I 2025-12-05 15:08:46,568] Trial 100 finished with value: 0.010844462537348477 and parameters: {'model_type': 'mlp', 'hidden_dims': '[256, 128, 64]', 'dropout': 0.20169419812637765, 'batch_norm': True, 'lr': 1.816205998377487e-06, 'weight_decay': 5.500296304266506e-06, 'epochs': 236, 'loss': 'mse', 'optimizer': 'adam', 'graph_mode': 'off', 'use_snp_selection': False}. Best is trial 36 with value: 0.07683981704169063.
[I 2025-12-05 15:08:48,177] Trial 101 finished with value: 0.08461498917025148 and parameters: {'model_type': 'mlp', 'hidden_dims': '[512, 128]', 'dropout': 0.10719911945344487, 'batch_norm': True, 'lr': 0.00020296123390076585, 'weight_decay': 0.00013895602308423833, 'epochs': 265, 'loss': 'mae', 'optimizer': 'adam', 'graph_mode': 'off', 'use_snp_selection': False}. Best is trial 101 with value: 0.08461498917025148.
[I 2025-12-05 15:08:49,781] Trial 102 finished with value: 0.06294682298961163 and parameters: {'model_type': 'mlp', 'hidden_dims': '[512, 64]', 'dropout': 0.11019761995848301, 'batch_norm': True, 'lr': 0.000554176284180244, 'weight_decay': 0.0003976507329600174, 'epochs': 269, 'loss': 'mae', 'optimizer': 'adam', 'graph_mode': 'off', 'use_snp_selection': False}. Best is trial 101 with value: 0.08461498917025148.
[I 2025-12-05 15:08:51,396] Trial 103 finished with value: 0.07951022441126016 and parameters: {'model_type': 'mlp', 'hidden_dims': '[512, 128]', 'dropout': 0.14071313347630868, 'batch_norm': True, 'lr': 0.00021027663349020695, 'weight_decay': 0.000232517319877752, 'epochs': 264, 'loss': 'mae', 'optimizer': 'adam', 'graph_mode': 'off', 'use_snp_selection': False}. Best is trial 101 with value: 0.08461498917025148.
[I 2025-12-05 15:08:53,036] Trial 104 finished with value: 0.07755055797741404 and parameters: {'model_type': 'mlp', 'hidden_dims': '[512, 128]', 'dropout': 0.139990880128302, 'batch_norm': True, 'lr': 0.0002494582418224205, 'weight_decay': 0.0009889047393505533, 'epochs': 280, 'loss': 'mae', 'optimizer': 'adam', 'graph_mode': 'off', 'use_snp_selection': False}. Best is trial 101 with value: 0.08461498917025148.
[I 2025-12-05 15:08:54,701] Trial 105 finished with value: 0.061144129024482456 and parameters: {'model_type': 'mlp', 'hidden_dims': '[512, 128]', 'dropout': 0.1352396154444594, 'batch_norm': True, 'lr': 0.000254595562667992, 'weight_decay': 0.0009928278557978783, 'epochs': 280, 'loss': 'mae', 'optimizer': 'adam', 'graph_mode': 'off', 'use_snp_selection': False}. Best is trial 101 with value: 0.08461498917025148.
[I 2025-12-05 15:08:56,338] Trial 106 finished with value: 0.061777642817745365 and parameters: {'model_type': 'mlp', 'hidden_dims': '[512, 128]', 'dropout': 0.10858032929097104, 'batch_norm': True, 'lr': 0.00021548641990123832, 'weight_decay': 0.00044873839735090734, 'epochs': 277, 'loss': 'mae', 'optimizer': 'adam', 'graph_mode': 'off', 'use_snp_selection': False}. Best is trial 101 with value: 0.08461498917025148.
[I 2025-12-05 15:08:58,056] Trial 107 finished with value: 0.06862301983108432 and parameters: {'model_type': 'mlp', 'hidden_dims': '[512, 128]', 'dropout': 0.13823445929032152, 'batch_norm': True, 'lr': 9.178805924384065e-05, 'weight_decay': 0.0002291291767656971, 'epochs': 301, 'loss': 'mae', 'optimizer': 'adam', 'graph_mode': 'off', 'use_snp_selection': False}. Best is trial 101 with value: 0.08461498917025148.
[I 2025-12-05 15:08:59,302] Trial 108 finished with value: 0.06029984471055451 and parameters: {'model_type': 'mlp', 'hidden_dims': '[512, 128]', 'dropout': 0.1567264266430345, 'batch_norm': True, 'lr': 0.00017165467727488958, 'weight_decay': 0.0005489120389131856, 'epochs': 261, 'loss': 'mae', 'optimizer': 'adam', 'graph_mode': 'off', 'use_snp_selection': True, 'num_snps': 13790}. Best is trial 101 with value: 0.08461498917025148.
[I 2025-12-05 15:09:00,929] Trial 109 finished with value: 0.06727287047137914 and parameters: {'model_type': 'mlp', 'hidden_dims': '[512, 128]', 'dropout': 0.12173860095827652, 'batch_norm': True, 'lr': 0.00012862736523387388, 'weight_decay': 0.0001791997635436865, 'epochs': 265, 'loss': 'mae', 'optimizer': 'adam', 'graph_mode': 'off', 'use_snp_selection': False}. Best is trial 101 with value: 0.08461498917025148.
[I 2025-12-05 15:09:01,891] Trial 110 finished with value: 0.03268875521336687 and parameters: {'model_type': 'mlp', 'hidden_dims': '[512, 128]', 'dropout': 0.45167673302902345, 'batch_norm': True, 'lr': 0.00032740430976286737, 'weight_decay': 0.0007978512163591966, 'epochs': 289, 'loss': 'mae', 'optimizer': 'adam', 'graph_mode': 'off', 'use_snp_selection': True, 'num_snps': 2894}. Best is trial 101 with value: 0.08461498917025148.
[I 2025-12-05 15:09:03,436] Trial 111 finished with value: 0.059384768252444126 and parameters: {'model_type': 'mlp', 'hidden_dims': '[512, 128]', 'dropout': 0.14417860824879739, 'batch_norm': True, 'lr': 0.00028024962597385705, 'weight_decay': 0.0005805700157833383, 'epochs': 250, 'loss': 'mae', 'optimizer': 'adam', 'graph_mode': 'off', 'use_snp_selection': False}. Best is trial 101 with value: 0.08461498917025148.
[I 2025-12-05 15:09:04,958] Trial 112 finished with value: 0.061638670711716435 and parameters: {'model_type': 'mlp', 'hidden_dims': '[512, 128]', 'dropout': 0.13165396808965443, 'batch_norm': True, 'lr': 0.0003715208117587979, 'weight_decay': 0.0005120289752148443, 'epochs': 243, 'loss': 'mae', 'optimizer': 'adam', 'graph_mode': 'off', 'use_snp_selection': False}. Best is trial 101 with value: 0.08461498917025148.
[I 2025-12-05 15:09:06,585] Trial 113 finished with value: 0.06804017177700133 and parameters: {'model_type': 'mlp', 'hidden_dims': '[512, 128]', 'dropout': 0.17056654362363555, 'batch_norm': True, 'lr': 0.0004127227213719897, 'weight_decay': 0.0002419047790401685, 'epochs': 276, 'loss': 'mae', 'optimizer': 'adam', 'graph_mode': 'off', 'use_snp_selection': False}. Best is trial 101 with value: 0.08461498917025148.
[I 2025-12-05 15:09:07,800] Trial 114 finished with value: 0.06623609052440624 and parameters: {'model_type': 'mlp', 'hidden_dims': '[512, 256]', 'dropout': 0.16125152073400342, 'batch_norm': True, 'lr': 0.0002476618861083054, 'weight_decay': 0.00015012428429674572, 'epochs': 132, 'loss': 'mae', 'optimizer': 'adam', 'graph_mode': 'off', 'use_snp_selection': False}. Best is trial 101 with value: 0.08461498917025148.
[I 2025-12-05 15:09:09,364] Trial 115 finished with value: 0.0504405997507003 and parameters: {'model_type': 'mlp', 'hidden_dims': '[512, 128]', 'dropout': 0.10975630193133026, 'batch_norm': True, 'lr': 0.0004607084509900569, 'weight_decay': 0.0001078480580269452, 'epochs': 255, 'loss': 'mae', 'optimizer': 'adam', 'graph_mode': 'off', 'use_snp_selection': False}. Best is trial 101 with value: 0.08461498917025148.
[I 2025-12-05 15:09:10,461] Trial 116 finished with value: 0.036540627079265794 and parameters: {'model_type': 'mlp', 'hidden_dims': '[512, 64]', 'dropout': 0.1538010064999263, 'batch_norm': True, 'lr': 0.0001522892193287712, 'weight_decay': 7.429955628041957e-05, 'epochs': 111, 'loss': 'mse', 'optimizer': 'adam', 'graph_mode': 'off', 'use_snp_selection': False}. Best is trial 101 with value: 0.08461498917025148.
[I 2025-12-05 15:09:12,976] Trial 117 finished with value: 0.060074496056984304 and parameters: {'model_type': 'mlp', 'hidden_dims': '[512, 256]', 'dropout': 0.11966409908022003, 'batch_norm': True, 'lr': 0.0008618152154713542, 'weight_decay': 0.00010424543315800584, 'epochs': 263, 'loss': 'mae', 'optimizer': 'adam', 'graph_mode': 'off', 'use_snp_selection': True, 'num_snps': 45697}. Best is trial 101 with value: 0.08461498917025148.
[I 2025-12-05 15:09:14,019] Trial 118 finished with value: 0.02193349553460564 and parameters: {'model_type': 'mlp', 'hidden_dims': '[256, 128]', 'dropout': 0.1467278229388631, 'batch_norm': False, 'lr': 0.000328127221320696, 'weight_decay': 0.00094643506742562, 'epochs': 237, 'loss': 'mae', 'optimizer': 'adam', 'graph_mode': 'off', 'use_snp_selection': False}. Best is trial 101 with value: 0.08461498917025148.
[I 2025-12-05 15:09:16,344] Trial 119 finished with value: 0.0718342697116215 and parameters: {'model_type': 'mlp', 'hidden_dims': '[512, 256]', 'dropout': 0.17657475123470937, 'batch_norm': True, 'lr': 0.0005314616247318266, 'weight_decay': 0.0002970336043744645, 'epochs': 344, 'loss': 'mae', 'optimizer': 'adam', 'graph_mode': 'off', 'use_snp_selection': True, 'num_snps': 38548}. Best is trial 101 with value: 0.08461498917025148.
[I 2025-12-05 15:09:17,535] Trial 120 finished with value: 0.03234687675261505 and parameters: {'model_type': 'mlp', 'hidden_dims': '[256, 128, 64]', 'dropout': 0.10122623633925192, 'batch_norm': True, 'lr': 2.1872569856122573e-05, 'weight_decay': 0.0007160286883710753, 'epochs': 311, 'loss': 'mae', 'optimizer': 'adam', 'graph_mode': 'off', 'use_snp_selection': False}. Best is trial 101 with value: 0.08461498917025148.
[I 2025-12-05 15:09:19,193] Trial 121 finished with value: 0.05236829477825836 and parameters: {'model_type': 'mlp', 'hidden_dims': '[512, 128]', 'dropout': 0.1267679088234055, 'batch_norm': True, 'lr': 0.00020512466685849122, 'weight_decay': 2.6801835849873926e-06, 'epochs': 284, 'loss': 'mae', 'optimizer': 'adam', 'graph_mode': 'off', 'use_snp_selection': False}. Best is trial 101 with value: 0.08461498917025148.
[I 2025-12-05 15:09:19,871] Trial 122 finished with value: 0.08423897717923896 and parameters: {'model_type': 'mlp', 'hidden_dims': '[128, 64]', 'dropout': 0.1863713557675353, 'batch_norm': True, 'lr': 0.0001825206695987436, 'weight_decay': 1.8388565350741506e-06, 'epochs': 61, 'loss': 'mae', 'optimizer': 'adam', 'graph_mode': 'off', 'use_snp_selection': False}. Best is trial 101 with value: 0.08461498917025148.
[I 2025-12-05 15:09:20,839] Trial 123 finished with value: 0.08333121438011876 and parameters: {'model_type': 'mlp', 'hidden_dims': '[128, 64]', 'dropout': 0.19243635660435388, 'batch_norm': True, 'lr': 0.00018675938082269195, 'weight_decay': 1.8756815603630634e-06, 'epochs': 269, 'loss': 'mae', 'optimizer': 'adam', 'graph_mode': 'off', 'use_snp_selection': False}. Best is trial 101 with value: 0.08461498917025148.
[I 2025-12-05 15:09:21,895] Trial 124 finished with value: 0.08769191953262387 and parameters: {'model_type': 'mlp', 'hidden_dims': '[128, 64]', 'dropout': 0.19282315491976937, 'batch_norm': True, 'lr': 0.00018367468224287845, 'weight_decay': 1.7458254937292015e-06, 'epochs': 294, 'loss': 'mae', 'optimizer': 'adam', 'graph_mode': 'off', 'use_snp_selection': False}. Best is trial 124 with value: 0.08769191953262387.
[I 2025-12-05 15:09:22,899] Trial 125 finished with value: 0.0670449122254511 and parameters: {'model_type': 'mlp', 'hidden_dims': '[128, 64]', 'dropout': 0.19824118050078282, 'batch_norm': True, 'lr': 0.00018369253363473807, 'weight_decay': 1.931157045408459e-06, 'epochs': 298, 'loss': 'mae', 'optimizer': 'adam', 'graph_mode': 'off', 'use_snp_selection': False}. Best is trial 124 with value: 0.08769191953262387.
[I 2025-12-05 15:09:23,890] Trial 126 finished with value: 0.051863766323623814 and parameters: {'model_type': 'mlp', 'hidden_dims': '[128, 64]', 'dropout': 0.23125242546978136, 'batch_norm': True, 'lr': 0.0001312076446094583, 'weight_decay': 1.0606680997763731e-06, 'epochs': 292, 'loss': 'mae', 'optimizer': 'adam', 'graph_mode': 'off', 'use_snp_selection': False}. Best is trial 124 with value: 0.08769191953262387.
[I 2025-12-05 15:09:24,620] Trial 127 finished with value: 0.06315297950345913 and parameters: {'model_type': 'mlp', 'hidden_dims': '[128, 64]', 'dropout': 0.21359323867294877, 'batch_norm': True, 'lr': 0.00010881959347420545, 'weight_decay': 1.6944083786227415e-06, 'epochs': 99, 'loss': 'mae', 'optimizer': 'adam', 'graph_mode': 'off', 'use_snp_selection': False}. Best is trial 124 with value: 0.08769191953262387.
[I 2025-12-05 15:09:26,626] Trial 128 finished with value: 0.04579294014849115 and parameters: {'model_type': 'mlp', 'hidden_dims': '[128, 64]', 'dropout': 0.18900316295614142, 'batch_norm': True, 'lr': 0.00023836363859977956, 'weight_decay': 1.2608508940953372e-06, 'epochs': 58, 'loss': 'mse', 'optimizer': 'adam', 'graph_mode': 'off', 'use_snp_selection': True, 'num_snps': 49729}. Best is trial 124 with value: 0.08769191953262387.
[I 2025-12-05 15:09:27,431] Trial 129 finished with value: 0.05973325646535069 and parameters: {'model_type': 'mlp', 'hidden_dims': '[128, 64]', 'dropout': 0.18756716148769467, 'batch_norm': True, 'lr': 0.0002908497791607258, 'weight_decay': 2.633709831669791e-06, 'epochs': 155, 'loss': 'mae', 'optimizer': 'adam', 'graph_mode': 'off', 'use_snp_selection': False}. Best is trial 124 with value: 0.08769191953262387.
[I 2025-12-05 15:09:28,456] Trial 130 finished with value: 0.05038218077880005 and parameters: {'model_type': 'mlp', 'hidden_dims': '[128, 64]', 'dropout': 0.17027175133959166, 'batch_norm': True, 'lr': 0.00017009346949385735, 'weight_decay': 8.868678869355907e-07, 'epochs': 272, 'loss': 'mae', 'optimizer': 'adam', 'graph_mode': 'off', 'use_snp_selection': False}. Best is trial 124 with value: 0.08769191953262387.
[I 2025-12-05 15:09:29,493] Trial 131 finished with value: 0.06931825499796444 and parameters: {'model_type': 'mlp', 'hidden_dims': '[128, 64]', 'dropout': 0.13873052742618144, 'batch_norm': True, 'lr': 0.00020041616611052456, 'weight_decay': 0.0006399760404511, 'epochs': 277, 'loss': 'mae', 'optimizer': 'adam', 'graph_mode': 'off', 'use_snp_selection': False}. Best is trial 124 with value: 0.08769191953262387.
[I 2025-12-05 15:09:30,573] Trial 132 finished with value: 0.0626825444250278 and parameters: {'model_type': 'mlp', 'hidden_dims': '[512, 64]', 'dropout': 0.1468179244806453, 'batch_norm': True, 'lr': 0.00014641630541989675, 'weight_decay': 2.1996463474695508e-06, 'epochs': 87, 'loss': 'mae', 'optimizer': 'adam', 'graph_mode': 'off', 'use_snp_selection': False}. Best is trial 124 with value: 0.08769191953262387.
[I 2025-12-05 15:09:32,247] Trial 133 finished with value: 0.04744947173829737 and parameters: {'model_type': 'mlp', 'hidden_dims': '[512, 64]', 'dropout': 0.17847515459404906, 'batch_norm': True, 'lr': 1.0596870920599834e-05, 'weight_decay': 5.678144946478112e-07, 'epochs': 286, 'loss': 'mae', 'optimizer': 'adam', 'graph_mode': 'off', 'use_snp_selection': False}. Best is trial 124 with value: 0.08769191953262387.
[I 2025-12-05 15:09:33,259] Trial 134 finished with value: 0.06592052427366636 and parameters: {'model_type': 'mlp', 'hidden_dims': '[128, 64]', 'dropout': 0.11584244207532636, 'batch_norm': True, 'lr': 0.00022830661581548306, 'weight_decay': 7.136314873096027e-07, 'epochs': 267, 'loss': 'mae', 'optimizer': 'adam', 'graph_mode': 'off', 'use_snp_selection': False}. Best is trial 124 with value: 0.08769191953262387.
[I 2025-12-05 15:09:34,377] Trial 135 finished with value: 0.07857725080830985 and parameters: {'model_type': 'mlp', 'hidden_dims': '[128, 64]', 'dropout': 0.16401067467593455, 'batch_norm': True, 'lr': 0.00026769896991433626, 'weight_decay': 1.4029369795132265e-07, 'epochs': 335, 'loss': 'mae', 'optimizer': 'adam', 'graph_mode': 'off', 'use_snp_selection': False}. Best is trial 124 with value: 0.08769191953262387.
[I 2025-12-05 15:09:36,249] Trial 136 finished with value: 0.04499958367825913 and parameters: {'model_type': 'mlp', 'hidden_dims': '[128, 64]', 'dropout': 0.16235884201943718, 'batch_norm': True, 'lr': 0.0002614135113353319, 'weight_decay': 1.6131654741490274e-07, 'epochs': 323, 'loss': 'mae', 'optimizer': 'adam', 'graph_mode': 'off', 'use_snp_selection': True, 'num_snps': 28642}. Best is trial 124 with value: 0.08769191953262387.
[I 2025-12-05 15:09:37,377] Trial 137 finished with value: 0.022913380087969754 and parameters: {'model_type': 'mlp', 'hidden_dims': '[128, 64]', 'dropout': 0.19500787459146313, 'batch_norm': True, 'lr': 4.73789068344961e-06, 'weight_decay': 1.314819288519654e-07, 'epochs': 342, 'loss': 'mae', 'optimizer': 'adam', 'graph_mode': 'off', 'use_snp_selection': False}. Best is trial 124 with value: 0.08769191953262387.
[I 2025-12-05 15:09:38,504] Trial 138 finished with value: 0.06697961075869002 and parameters: {'model_type': 'mlp', 'hidden_dims': '[128, 64]', 'dropout': 0.1666903713649308, 'batch_norm': True, 'lr': 0.0002992704711675784, 'weight_decay': 1.1254136826576017e-07, 'epochs': 333, 'loss': 'mae', 'optimizer': 'adam', 'graph_mode': 'off', 'use_snp_selection': False}. Best is trial 124 with value: 0.08769191953262387.
[I 2025-12-05 15:09:41,116] Trial 139 finished with value: 0.05397369474350974 and parameters: {'model_type': 'mlp', 'hidden_dims': '[128, 64]', 'dropout': 0.17777492814183896, 'batch_norm': True, 'lr': 0.000665166380121011, 'weight_decay': 4.011720321503329e-05, 'epochs': 317, 'loss': 'mse', 'optimizer': 'adam', 'graph_mode': 'off', 'use_snp_selection': True, 'num_snps': 52772}. Best is trial 124 with value: 0.08769191953262387.
[I 2025-12-05 15:09:42,348] Trial 140 finished with value: 0.03838023521274741 and parameters: {'model_type': 'mlp', 'hidden_dims': '[256, 128, 64]', 'dropout': 0.22022786143637288, 'batch_norm': False, 'lr': 0.00016580364773499705, 'weight_decay': 1.9769921583068666e-07, 'epochs': 327, 'loss': 'mae', 'optimizer': 'adam', 'graph_mode': 'off', 'use_snp_selection': False}. Best is trial 124 with value: 0.08769191953262387.
[I 2025-12-05 15:09:43,702] Trial 141 finished with value: 0.055468287117996305 and parameters: {'model_type': 'mlp', 'hidden_dims': '[512, 128]', 'dropout': 0.13058498200193377, 'batch_norm': True, 'lr': 0.00019319472917494565, 'weight_decay': 2.3432398616646146e-07, 'epochs': 175, 'loss': 'mae', 'optimizer': 'adam', 'graph_mode': 'off', 'use_snp_selection': False}. Best is trial 124 with value: 0.08769191953262387.
[I 2025-12-05 15:09:45,314] Trial 142 finished with value: 0.058333761677543595 and parameters: {'model_type': 'mlp', 'hidden_dims': '[512, 64]', 'dropout': 0.20432487916373634, 'batch_norm': True, 'lr': 0.00035216356670713663, 'weight_decay': 4.831178384895361e-07, 'epochs': 260, 'loss': 'mae', 'optimizer': 'adam', 'graph_mode': 'off', 'use_snp_selection': False}. Best is trial 124 with value: 0.08769191953262387.
[I 2025-12-05 15:09:46,376] Trial 143 finished with value: 0.061456974390053314 and parameters: {'model_type': 'mlp', 'hidden_dims': '[128, 64]', 'dropout': 0.15590083469250207, 'batch_norm': True, 'lr': 0.0002292288463594988, 'weight_decay': 3.812377822082034e-07, 'epochs': 303, 'loss': 'mae', 'optimizer': 'adam', 'graph_mode': 'off', 'use_snp_selection': False}. Best is trial 124 with value: 0.08769191953262387.
[I 2025-12-05 15:09:48,062] Trial 144 finished with value: 0.05413325358847297 and parameters: {'model_type': 'mlp', 'hidden_dims': '[512, 128]', 'dropout': 0.12728809371170888, 'batch_norm': True, 'lr': 0.0002679540843120521, 'weight_decay': 1.6095549485818075e-06, 'epochs': 279, 'loss': 'mae', 'optimizer': 'adam', 'graph_mode': 'off', 'use_snp_selection': False}. Best is trial 124 with value: 0.08769191953262387.
[I 2025-12-05 15:09:49,965] Trial 145 finished with value: 0.06172081582665007 and parameters: {'model_type': 'mlp', 'hidden_dims': '[512, 256]', 'dropout': 0.1452226636297905, 'batch_norm': True, 'lr': 0.00013445801856123448, 'weight_decay': 1.3832087927635518e-06, 'epochs': 349, 'loss': 'mae', 'optimizer': 'adam', 'graph_mode': 'off', 'use_snp_selection': False}. Best is trial 124 with value: 0.08769191953262387.
[I 2025-12-05 15:09:51,522] Trial 146 finished with value: 0.06301415204040148 and parameters: {'model_type': 'mlp', 'hidden_dims': '[512, 64]', 'dropout': 0.10775715887621762, 'batch_norm': True, 'lr': 0.00043469904121932557, 'weight_decay': 8.353688094125124e-07, 'epochs': 251, 'loss': 'mae', 'optimizer': 'adam', 'graph_mode': 'off', 'use_snp_selection': False}. Best is trial 124 with value: 0.08769191953262387.
[I 2025-12-05 15:09:53,542] Trial 147 finished with value: 0.04035711216074443 and parameters: {'model_type': 'mlp', 'hidden_dims': '[256, 128]', 'dropout': 0.13872092007453848, 'batch_norm': True, 'lr': 0.00017708060937969068, 'weight_decay': 0.00038104551892870474, 'epochs': 123, 'loss': 'mae', 'optimizer': 'adam', 'graph_mode': 'off', 'use_snp_selection': True, 'num_snps': 46141}. Best is trial 124 with value: 0.08769191953262387.
[I 2025-12-05 15:09:54,247] Trial 148 finished with value: 0.07289161019488039 and parameters: {'model_type': 'mlp', 'hidden_dims': '[128, 64]', 'dropout': 0.12120037137310992, 'batch_norm': True, 'lr': 0.00031118042989652846, 'weight_decay': 2.778353410754113e-07, 'epochs': 78, 'loss': 'mae', 'optimizer': 'adam', 'graph_mode': 'off', 'use_snp_selection': False}. Best is trial 124 with value: 0.08769191953262387.
[I 2025-12-05 15:09:54,911] Trial 149 finished with value: 0.06870032214530974 and parameters: {'model_type': 'mlp', 'hidden_dims': '[128, 64]', 'dropout': 0.15479509607803005, 'batch_norm': True, 'lr': 0.000376225513552085, 'weight_decay': 2.584826034474272e-07, 'epochs': 47, 'loss': 'mae', 'optimizer': 'adam', 'graph_mode': 'off', 'use_snp_selection': False}. Best is trial 124 with value: 0.08769191953262387.
[I 2025-12-05 15:09:57,458] Trial 0 finished with value: 0.03537073300979265 and parameters: {'model_type': 'mlp', 'hidden_dims': '[128, 64]', 'dropout': 0.199031432379812, 'batch_norm': True, 'lr': 1.8408544111075837e-06, 'weight_decay': 5.5136510071208614e-05, 'epochs': 336, 'loss': 'mae', 'optimizer': 'adam', 'graph_mode': 'off', 'use_snp_selection': True, 'num_snps': 43862}. Best is trial 0 with value: 0.03537073300979265.
