[I 2025-12-06 02:44:22,498] Trial 112 finished with value: 0.22703299603584176 and parameters: {'model_type': 'mlp', 'hidden_dims': '[512, 64]', 'dropout': 0.5043151454653277, 'batch_norm': False, 'lr': 9.28149074342581e-06, 'weight_decay': 2.782984529819788e-07, 'epochs': 135, 'loss': 'mae', 'optimizer': 'adam', 'graph_mode': 'off', 'use_snp_selection': True, 'num_snps': 34780}. Best is trial 61 with value: 0.23904441398023235.
[I 2025-12-06 02:45:03,294] Trial 113 finished with value: 0.21865694059620183 and parameters: {'model_type': 'mlp', 'hidden_dims': '[512, 64]', 'dropout': 0.513612432402026, 'batch_norm': False, 'lr': 1.9830182744698827e-05, 'weight_decay': 8.412386612392985e-07, 'epochs': 126, 'loss': 'mae', 'optimizer': 'adam', 'graph_mode': 'off', 'use_snp_selection': True, 'num_snps': 29341}. Best is trial 61 with value: 0.23904441398023235.
[I 2025-12-06 02:46:06,258] Trial 114 finished with value: 0.21763928811038627 and parameters: {'model_type': 'mlp', 'hidden_dims': '[512, 64]', 'dropout': 0.28578582911437916, 'batch_norm': False, 'lr': 1.1968309730593532e-05, 'weight_decay': 3.768924609741314e-06, 'epochs': 330, 'loss': 'mae', 'optimizer': 'adam', 'graph_mode': 'off', 'use_snp_selection': True, 'num_snps': 31843}. Best is trial 61 with value: 0.23904441398023235.
[I 2025-12-06 02:46:50,212] Trial 115 finished with value: 0.2309419958470389 and parameters: {'model_type': 'mlp', 'hidden_dims': '[512, 64]', 'dropout': 0.5402065404145855, 'batch_norm': False, 'lr': 1.3634488232994878e-05, 'weight_decay': 5.026425611479078e-07, 'epochs': 175, 'loss': 'mae', 'optimizer': 'adam', 'graph_mode': 'off', 'use_snp_selection': True, 'num_snps': 27582}. Best is trial 61 with value: 0.23904441398023235.
[I 2025-12-06 02:47:34,751] Trial 116 finished with value: 0.22146154581660737 and parameters: {'model_type': 'mlp', 'hidden_dims': '[512, 64]', 'dropout': 0.5375733062527915, 'batch_norm': False, 'lr': 1.6372876009486974e-05, 'weight_decay': 6.574498965935023e-07, 'epochs': 175, 'loss': 'mae', 'optimizer': 'adam', 'graph_mode': 'off', 'use_snp_selection': True, 'num_snps': 27809}. Best is trial 61 with value: 0.23904441398023235.
[I 2025-12-06 02:48:13,292] Trial 117 finished with value: 0.18485352969784644 and parameters: {'model_type': 'mlp', 'hidden_dims': '[512, 64]', 'dropout': 0.5697677675246916, 'batch_norm': True, 'lr': 2.239342152675646e-05, 'weight_decay': 4.866737728449442e-07, 'epochs': 162, 'loss': 'mae', 'optimizer': 'adam', 'graph_mode': 'off', 'use_snp_selection': True, 'num_snps': 21235}. Best is trial 61 with value: 0.23904441398023235.
[I 2025-12-06 02:48:47,883] Trial 118 finished with value: 0.22893127475483238 and parameters: {'model_type': 'mlp', 'hidden_dims': '[256, 128]', 'dropout': 0.30966675843671293, 'batch_norm': False, 'lr': 1.051403922240509e-05, 'weight_decay': 1.4979742978552768e-07, 'epochs': 155, 'loss': 'mae', 'optimizer': 'adam', 'graph_mode': 'off', 'use_snp_selection': True, 'num_snps': 24972}. Best is trial 61 with value: 0.23904441398023235.
[I 2025-12-06 02:49:44,525] Trial 119 finished with value: 0.22981379756642267 and parameters: {'model_type': 'mlp', 'hidden_dims': '[512, 64]', 'dropout': 0.5868346632024364, 'batch_norm': False, 'lr': 1.3466539811189807e-05, 'weight_decay': 2.8320782630686713e-07, 'epochs': 168, 'loss': 'mae', 'optimizer': 'adam', 'graph_mode': 'off', 'use_snp_selection': True, 'num_snps': 44084}. Best is trial 61 with value: 0.23904441398023235.
[I 2025-12-06 02:50:36,472] Trial 120 finished with value: 0.21787021762749514 and parameters: {'model_type': 'mlp', 'hidden_dims': '[512, 64]', 'dropout': 0.5546180524699779, 'batch_norm': False, 'lr': 5.381249919692184e-06, 'weight_decay': 2.15055650568852e-07, 'epochs': 179, 'loss': 'mae', 'optimizer': 'adam', 'graph_mode': 'off', 'use_snp_selection': True, 'num_snps': 36792}. Best is trial 61 with value: 0.23904441398023235.
[I 2025-12-06 02:51:00,746] Trial 121 finished with value: 0.18108673187483598 and parameters: {'model_type': 'mlp', 'hidden_dims': '[512, 64]', 'dropout': 0.4859878245096965, 'batch_norm': False, 'lr': 1.9442305635582037e-05, 'weight_decay': 3.789991800559872e-07, 'epochs': 142, 'loss': 'mae', 'optimizer': 'adam', 'graph_mode': 'off', 'use_snp_selection': True, 'num_snps': 3339}. Best is trial 61 with value: 0.23904441398023235.
[I 2025-12-06 02:51:43,093] Trial 122 finished with value: 0.22197499287572048 and parameters: {'model_type': 'mlp', 'hidden_dims': '[512, 64]', 'dropout': 0.5328533993765184, 'batch_norm': False, 'lr': 8.522155187519625e-06, 'weight_decay': 3.1728738726793373e-07, 'epochs': 132, 'loss': 'mae', 'optimizer': 'adam', 'graph_mode': 'off', 'use_snp_selection': True, 'num_snps': 30363}. Best is trial 61 with value: 0.23904441398023235.
[I 2025-12-06 02:52:29,754] Trial 123 finished with value: 0.22258460478594352 and parameters: {'model_type': 'mlp', 'hidden_dims': '[512, 64]', 'dropout': 0.4495308884941167, 'batch_norm': False, 'lr': 1.130085011052744e-05, 'weight_decay': 4.946434230928704e-07, 'epochs': 150, 'loss': 'mae', 'optimizer': 'adam', 'graph_mode': 'off', 'use_snp_selection': True, 'num_snps': 33495}. Best is trial 61 with value: 0.23904441398023235.
[I 2025-12-06 02:53:10,574] Trial 124 finished with value: 0.244896984085243 and parameters: {'model_type': 'mlp', 'hidden_dims': '[512, 64]', 'dropout': 0.4019073241443804, 'batch_norm': False, 'lr': 1.3282202107469884e-05, 'weight_decay': 1.875889080092657e-07, 'epochs': 120, 'loss': 'mae', 'optimizer': 'adam', 'graph_mode': 'off', 'use_snp_selection': True, 'num_snps': 29596}. Best is trial 124 with value: 0.244896984085243.
[I 2025-12-06 02:53:44,896] Trial 125 finished with value: 0.21244741631956807 and parameters: {'model_type': 'mlp', 'hidden_dims': '[256, 128, 64]', 'dropout': 0.40444918337976055, 'batch_norm': False, 'lr': 1.4511427872274018e-05, 'weight_decay': 1.687539450350979e-07, 'epochs': 109, 'loss': 'mae', 'optimizer': 'adam', 'graph_mode': 'off', 'use_snp_selection': True, 'num_snps': 29281}. Best is trial 124 with value: 0.244896984085243.
[I 2025-12-06 02:54:29,074] Trial 126 finished with value: 0.22810998256380072 and parameters: {'model_type': 'mlp', 'hidden_dims': '[512, 64]', 'dropout': 0.37022009554015844, 'batch_norm': False, 'lr': 1.7660291567509337e-05, 'weight_decay': 2.411552563821532e-07, 'epochs': 100, 'loss': 'mae', 'optimizer': 'adam', 'graph_mode': 'off', 'use_snp_selection': True, 'num_snps': 39373}. Best is trial 124 with value: 0.244896984085243.
[I 2025-12-06 02:55:12,901] Trial 127 finished with value: 0.23063811014975646 and parameters: {'model_type': 'mlp', 'hidden_dims': '[512, 64]', 'dropout': 0.41769260549947623, 'batch_norm': False, 'lr': 9.606180397457053e-06, 'weight_decay': 1.3177385190744708e-07, 'epochs': 116, 'loss': 'mae', 'optimizer': 'adam', 'graph_mode': 'off', 'use_snp_selection': True, 'num_snps': 35514}. Best is trial 124 with value: 0.244896984085243.
[I 2025-12-06 02:55:55,091] Trial 128 finished with value: 0.23188393441285143 and parameters: {'model_type': 'mlp', 'hidden_dims': '[512, 64]', 'dropout': 0.42568773867560006, 'batch_norm': False, 'lr': 2.553339147455996e-05, 'weight_decay': 1.977950049352021e-07, 'epochs': 120, 'loss': 'mae', 'optimizer': 'adam', 'graph_mode': 'off', 'use_snp_selection': True, 'num_snps': 32466}. Best is trial 124 with value: 0.244896984085243.
[I 2025-12-06 02:56:35,127] Trial 129 finished with value: 0.22083897558492188 and parameters: {'model_type': 'mlp', 'hidden_dims': '[256, 128]', 'dropout': 0.4367381033570467, 'batch_norm': False, 'lr': 2.611266153633496e-05, 'weight_decay': 1.952173517293733e-07, 'epochs': 121, 'loss': 'mse', 'optimizer': 'adam', 'graph_mode': 'off', 'use_snp_selection': True, 'num_snps': 41167}. Best is trial 124 with value: 0.244896984085243.
[I 2025-12-06 02:57:19,257] Trial 130 finished with value: 0.22155900319514416 and parameters: {'model_type': 'mlp', 'hidden_dims': '[512, 64]', 'dropout': 0.42510638767751024, 'batch_norm': False, 'lr': 3.1388577447457314e-05, 'weight_decay': 2.264585418797936e-07, 'epochs': 138, 'loss': 'mae', 'optimizer': 'adam', 'graph_mode': 'off', 'use_snp_selection': True, 'num_snps': 32402}. Best is trial 124 with value: 0.244896984085243.
[I 2025-12-06 02:57:58,555] Trial 131 finished with value: 0.22814216621654654 and parameters: {'model_type': 'mlp', 'hidden_dims': '[512, 64]', 'dropout': 0.3870432377167061, 'batch_norm': False, 'lr': 1.3718138194769101e-05, 'weight_decay': 2.981104511062305e-07, 'epochs': 124, 'loss': 'mae', 'optimizer': 'adam', 'graph_mode': 'off', 'use_snp_selection': True, 'num_snps': 27215}. Best is trial 124 with value: 0.244896984085243.
[I 2025-12-06 02:58:44,903] Trial 132 finished with value: 0.22609475733705317 and parameters: {'model_type': 'mlp', 'hidden_dims': '[512, 64]', 'dropout': 0.4589003992234064, 'batch_norm': False, 'lr': 2.0042699203274668e-05, 'weight_decay': 1.7841069637309997e-07, 'epochs': 148, 'loss': 'mae', 'optimizer': 'adam', 'graph_mode': 'off', 'use_snp_selection': True, 'num_snps': 34218}. Best is trial 124 with value: 0.244896984085243.
[I 2025-12-06 02:59:28,070] Trial 133 finished with value: 0.2306219062918254 and parameters: {'model_type': 'mlp', 'hidden_dims': '[512, 64]', 'dropout': 0.34712706181957126, 'batch_norm': False, 'lr': 1.6195900987337414e-05, 'weight_decay': 1.205755394258639e-07, 'epochs': 133, 'loss': 'mae', 'optimizer': 'adam', 'graph_mode': 'off', 'use_snp_selection': True, 'num_snps': 31507}. Best is trial 124 with value: 0.244896984085243.
[I 2025-12-06 03:00:07,987] Trial 134 finished with value: 0.2111007064043692 and parameters: {'model_type': 'mlp', 'hidden_dims': '[512, 64]', 'dropout': 0.5979418717901704, 'batch_norm': False, 'lr': 1.1117085078049134e-05, 'weight_decay': 2.5413287447581833e-07, 'epochs': 114, 'loss': 'mae', 'optimizer': 'adam', 'graph_mode': 'off', 'use_snp_selection': True, 'num_snps': 29569}. Best is trial 124 with value: 0.244896984085243.
[I 2025-12-06 03:00:58,407] Trial 135 finished with value: 0.2319490231709449 and parameters: {'model_type': 'mlp', 'hidden_dims': '[512, 64]', 'dropout': 0.40197304820418117, 'batch_norm': False, 'lr': 6.874780331231073e-06, 'weight_decay': 5.587424102310959e-07, 'epochs': 160, 'loss': 'mae', 'optimizer': 'adam', 'graph_mode': 'off', 'use_snp_selection': True, 'num_snps': 37936}. Best is trial 124 with value: 0.244896984085243.
[I 2025-12-06 03:01:48,525] Trial 136 finished with value: 0.22176813902869177 and parameters: {'model_type': 'mlp', 'hidden_dims': '[512, 64]', 'dropout': 0.4016128490827935, 'batch_norm': False, 'lr': 7.691730706268018e-06, 'weight_decay': 4.0774516513220053e-07, 'epochs': 159, 'loss': 'mae', 'optimizer': 'adam', 'graph_mode': 'off', 'use_snp_selection': True, 'num_snps': 37572}. Best is trial 124 with value: 0.244896984085243.
[I 2025-12-06 03:02:15,142] Trial 137 finished with value: 0.17937514186526765 and parameters: {'model_type': 'mlp', 'hidden_dims': '[512, 128]', 'dropout': 0.39571655334300526, 'batch_norm': False, 'lr': 7.256164076214608e-06, 'weight_decay': 6.051337308420446e-07, 'epochs': 140, 'loss': 'mae', 'optimizer': 'adam', 'graph_mode': 'off', 'use_snp_selection': True, 'num_snps': 6870}. Best is trial 124 with value: 0.244896984085243.
[I 2025-12-06 03:03:01,414] Trial 138 finished with value: 0.20406549837338517 and parameters: {'model_type': 'mlp', 'hidden_dims': '[512, 64]', 'dropout': 0.37793008825387125, 'batch_norm': True, 'lr': 9.254330768874289e-06, 'weight_decay': 3.296459469490266e-07, 'epochs': 128, 'loss': 'mae', 'optimizer': 'adam', 'graph_mode': 'off', 'use_snp_selection': True, 'num_snps': 36302}. Best is trial 124 with value: 0.244896984085243.
[I 2025-12-06 03:03:41,613] Trial 139 finished with value: 0.17537075966714652 and parameters: {'model_type': 'mlp', 'hidden_dims': '[512, 256]', 'dropout': 0.4454719539155501, 'batch_norm': False, 'lr': 2.8627013693457253e-06, 'weight_decay': 1.4767529668612836e-07, 'epochs': 89, 'loss': 'mae', 'optimizer': 'adam', 'graph_mode': 'off', 'use_snp_selection': True, 'num_snps': 33569}. Best is trial 124 with value: 0.244896984085243.
[I 2025-12-06 03:04:25,902] Trial 140 finished with value: 0.22632065574541 and parameters: {'model_type': 'mlp', 'hidden_dims': '[512, 64]', 'dropout': 0.43090757901005083, 'batch_norm': False, 'lr': 4.656950710053098e-06, 'weight_decay': 1.9893249847387642e-07, 'epochs': 119, 'loss': 'mae', 'optimizer': 'adam', 'graph_mode': 'off', 'use_snp_selection': True, 'num_snps': 35336}. Best is trial 124 with value: 0.244896984085243.
[I 2025-12-06 03:05:12,962] Trial 141 finished with value: 0.2327286149536222 and parameters: {'model_type': 'mlp', 'hidden_dims': '[512, 64]', 'dropout': 0.4167139507009695, 'batch_norm': False, 'lr': 1.3174294911972177e-05, 'weight_decay': 7.219372960068368e-07, 'epochs': 163, 'loss': 'mae', 'optimizer': 'adam', 'graph_mode': 'off', 'use_snp_selection': True, 'num_snps': 32477}. Best is trial 124 with value: 0.244896984085243.
[I 2025-12-06 03:05:59,213] Trial 142 finished with value: 0.22261643226351485 and parameters: {'model_type': 'mlp', 'hidden_dims': '[512, 64]', 'dropout': 0.4166715087219335, 'batch_norm': False, 'lr': 6.5118273855830295e-06, 'weight_decay': 9.064674888316582e-07, 'epochs': 155, 'loss': 'mae', 'optimizer': 'adam', 'graph_mode': 'off', 'use_snp_selection': True, 'num_snps': 32305}. Best is trial 124 with value: 0.244896984085243.
[I 2025-12-06 03:06:35,070] Trial 143 finished with value: 0.2167166353116634 and parameters: {'model_type': 'mlp', 'hidden_dims': '[512, 64]', 'dropout': 0.4098832935684324, 'batch_norm': False, 'lr': 1.0319413473273048e-05, 'weight_decay': 7.292057174181358e-07, 'epochs': 165, 'loss': 'mae', 'optimizer': 'adam', 'graph_mode': 'off', 'use_snp_selection': True, 'num_snps': 17393}. Best is trial 124 with value: 0.244896984085243.
[I 2025-12-06 03:07:24,983] Trial 144 finished with value: 0.2290661627715914 and parameters: {'model_type': 'mlp', 'hidden_dims': '[512, 64]', 'dropout': 0.4257400709005429, 'batch_norm': False, 'lr': 1.2092916940916757e-05, 'weight_decay': 1.3416644287207633e-06, 'epochs': 144, 'loss': 'mae', 'optimizer': 'adam', 'graph_mode': 'off', 'use_snp_selection': True, 'num_snps': 38795}. Best is trial 124 with value: 0.244896984085243.
[I 2025-12-06 03:08:11,438] Trial 145 finished with value: 0.2303921333541668 and parameters: {'model_type': 'mlp', 'hidden_dims': '[512, 64]', 'dropout': 0.470279198221126, 'batch_norm': False, 'lr': 2.4587198946115807e-05, 'weight_decay': 3.5485632732635455e-07, 'epochs': 136, 'loss': 'mae', 'optimizer': 'adam', 'graph_mode': 'off', 'use_snp_selection': True, 'num_snps': 35018}. Best is trial 124 with value: 0.244896984085243.
[I 2025-12-06 03:08:50,120] Trial 146 finished with value: 0.2230010030189729 and parameters: {'model_type': 'mlp', 'hidden_dims': '[256, 128]', 'dropout': 0.38272681035051676, 'batch_norm': False, 'lr': 4.4052032778716615e-05, 'weight_decay': 2.630975056313616e-07, 'epochs': 149, 'loss': 'mae', 'optimizer': 'adam', 'graph_mode': 'off', 'use_snp_selection': True, 'num_snps': 33114}. Best is trial 124 with value: 0.244896984085243.
[I 2025-12-06 03:09:48,076] Trial 147 finished with value: 0.22142346331503077 and parameters: {'model_type': 'mlp', 'hidden_dims': '[512, 64]', 'dropout': 0.29264487839388154, 'batch_norm': False, 'lr': 1.7945536686491328e-05, 'weight_decay': 5.648900881107659e-07, 'epochs': 219, 'loss': 'mae', 'optimizer': 'adam', 'graph_mode': 'off', 'use_snp_selection': True, 'num_snps': 37803}. Best is trial 124 with value: 0.244896984085243.
[I 2025-12-06 03:10:20,726] Trial 148 finished with value: 0.2124700053455617 and parameters: {'model_type': 'mlp', 'hidden_dims': '[128, 64]', 'dropout': 0.33432111693886507, 'batch_norm': False, 'lr': 8.310931484406327e-06, 'weight_decay': 4.1785497299868285e-07, 'epochs': 103, 'loss': 'mae', 'optimizer': 'adam', 'graph_mode': 'off', 'use_snp_selection': True, 'num_snps': 31625}. Best is trial 124 with value: 0.244896984085243.
[I 2025-12-06 03:11:04,986] Trial 149 finished with value: 0.22579282737585812 and parameters: {'model_type': 'mlp', 'hidden_dims': '[512, 64]', 'dropout': 0.39851489399363677, 'batch_norm': False, 'lr': 1.5103128244070802e-05, 'weight_decay': 2.9592931313422685e-07, 'epochs': 123, 'loss': 'mae', 'optimizer': 'adam', 'graph_mode': 'off', 'use_snp_selection': True, 'num_snps': 34359}. Best is trial 124 with value: 0.244896984085243.
[I 2025-12-06 03:12:08,146] Trial 0 finished with value: 0.16671799883818356 and parameters: {'model_type': 'mlp', 'hidden_dims': '[128, 64]', 'dropout': 0.199031432379812, 'batch_norm': True, 'lr': 1.8408544111075837e-06, 'weight_decay': 5.5136510071208614e-05, 'epochs': 336, 'loss': 'mae', 'optimizer': 'adam', 'graph_mode': 'off', 'use_snp_selection': True, 'num_snps': 43862}. Best is trial 0 with value: 0.16671799883818356.
[I 2025-12-06 03:12:46,357] Trial 1 finished with value: 0.21097608139762186 and parameters: {'model_type': 'mlp', 'hidden_dims': '[256, 128]', 'dropout': 0.4370668075331726, 'batch_norm': True, 'lr': 7.133471581159139e-05, 'weight_decay': 1.128633586803549e-05, 'epochs': 242, 'loss': 'mae', 'optimizer': 'adam', 'graph_mode': 'off', 'use_snp_selection': False}. Best is trial 1 with value: 0.21097608139762186.
[I 2025-12-06 03:13:21,701] Trial 2 finished with value: 0.17329290697016977 and parameters: {'model_type': 'mlp', 'hidden_dims': '[256, 128, 64]', 'dropout': 0.41314357415569625, 'batch_norm': False, 'lr': 3.952233718592101e-06, 'weight_decay': 0.00026754769258252603, 'epochs': 149, 'loss': 'mse', 'optimizer': 'adam', 'graph_mode': 'off', 'use_snp_selection': True, 'num_snps': 11571}. Best is trial 1 with value: 0.21097608139762186.
[I 2025-12-06 03:14:51,354] Trial 3 finished with value: 0.21939035779692345 and parameters: {'model_type': 'mlp', 'hidden_dims': '[512, 64]', 'dropout': 0.5938127374509361, 'batch_norm': False, 'lr': 5.67704586114731e-06, 'weight_decay': 2.4518087630137052e-05, 'epochs': 320, 'loss': 'mae', 'optimizer': 'adam', 'graph_mode': 'off', 'use_snp_selection': False}. Best is trial 3 with value: 0.21939035779692345.
[I 2025-12-06 03:16:12,965] Trial 4 finished with value: 0.18415021129524223 and parameters: {'model_type': 'mlp', 'hidden_dims': '[512, 128]', 'dropout': 0.25746343592134413, 'batch_norm': True, 'lr': 1.3467657668402788e-06, 'weight_decay': 0.00033087251918647806, 'epochs': 277, 'loss': 'mse', 'optimizer': 'adam', 'graph_mode': 'off', 'use_snp_selection': True, 'num_snps': 36675}. Best is trial 3 with value: 0.21939035779692345.
[I 2025-12-06 03:17:10,260] Trial 5 finished with value: 0.14102134428726723 and parameters: {'model_type': 'mlp', 'hidden_dims': '[512, 64]', 'dropout': 0.38275350994408375, 'batch_norm': True, 'lr': 1.5586664309232824e-06, 'weight_decay': 0.0008227664668621182, 'epochs': 145, 'loss': 'mae', 'optimizer': 'adam', 'graph_mode': 'off', 'use_snp_selection': True, 'num_snps': 32148}. Best is trial 3 with value: 0.21939035779692345.
[I 2025-12-06 03:17:42,181] Trial 6 finished with value: 0.19411865350601143 and parameters: {'model_type': 'mlp', 'hidden_dims': '[256, 128]', 'dropout': 0.3930109900265879, 'batch_norm': False, 'lr': 4.892964372128395e-05, 'weight_decay': 1.5809549317992182e-06, 'epochs': 199, 'loss': 'mse', 'optimizer': 'adam', 'graph_mode': 'off', 'use_snp_selection': False}. Best is trial 3 with value: 0.21939035779692345.
[I 2025-12-06 03:18:14,936] Trial 7 finished with value: 0.2176625012787725 and parameters: {'model_type': 'mlp', 'hidden_dims': '[512, 256]', 'dropout': 0.15343979219678458, 'batch_norm': True, 'lr': 6.234003099047341e-05, 'weight_decay': 3.894760610535477e-07, 'epochs': 97, 'loss': 'mse', 'optimizer': 'adam', 'graph_mode': 'off', 'use_snp_selection': False}. Best is trial 3 with value: 0.21939035779692345.
[I 2025-12-06 03:19:44,324] Trial 8 finished with value: 0.21273229160080404 and parameters: {'model_type': 'mlp', 'hidden_dims': '[512, 128]', 'dropout': 0.10743001231661406, 'batch_norm': True, 'lr': 0.00023728538449271062, 'weight_decay': 1.7629071578048637e-05, 'epochs': 312, 'loss': 'mae', 'optimizer': 'adam', 'graph_mode': 'off', 'use_snp_selection': False}. Best is trial 3 with value: 0.21939035779692345.
[I 2025-12-06 03:20:37,631] Trial 9 finished with value: 0.21071810315205095 and parameters: {'model_type': 'mlp', 'hidden_dims': '[512, 64]', 'dropout': 0.14505336736221927, 'batch_norm': True, 'lr': 5.8619638388111826e-05, 'weight_decay': 6.200156172669308e-07, 'epochs': 175, 'loss': 'mse', 'optimizer': 'adam', 'graph_mode': 'off', 'use_snp_selection': False}. Best is trial 3 with value: 0.21939035779692345.
[I 2025-12-06 03:20:59,239] Trial 10 finished with value: 0.18190805938578755 and parameters: {'model_type': 'mlp', 'hidden_dims': '[512, 64]', 'dropout': 0.5885461262002587, 'batch_norm': False, 'lr': 8.769366258768696e-06, 'weight_decay': 2.78273193871783e-06, 'epochs': 55, 'loss': 'mae', 'optimizer': 'adam', 'graph_mode': 'off', 'use_snp_selection': False}. Best is trial 3 with value: 0.21939035779692345.
[I 2025-12-06 03:21:26,469] Trial 11 finished with value: 0.20342155576286491 and parameters: {'model_type': 'mlp', 'hidden_dims': '[512, 256]', 'dropout': 0.583942291816117, 'batch_norm': False, 'lr': 1.422933652790185e-05, 'weight_decay': 1.18635098029648e-07, 'epochs': 77, 'loss': 'mse', 'optimizer': 'adam', 'graph_mode': 'off', 'use_snp_selection': False}. Best is trial 3 with value: 0.21939035779692345.
[I 2025-12-06 03:21:57,374] Trial 12 finished with value: 0.20395720939105422 and parameters: {'model_type': 'mlp', 'hidden_dims': '[512, 256]', 'dropout': 0.2637316882220091, 'batch_norm': False, 'lr': 0.0006753264773209732, 'weight_decay': 1.3081036432574914e-07, 'epochs': 93, 'loss': 'mae', 'optimizer': 'adam', 'graph_mode': 'off', 'use_snp_selection': False}. Best is trial 3 with value: 0.21939035779692345.
