[I 2025-12-05 14:49:55,742] Trial 127 finished with value: 0.09265308020453322 and parameters: {'model_type': 'mlp', 'hidden_dims': '[128, 64]', 'dropout': 0.1574410490624315, 'batch_norm': True, 'lr': 0.00022777287091612166, 'weight_decay': 4.57824117274107e-07, 'epochs': 186, 'loss': 'mse', 'optimizer': 'adam', 'graph_mode': 'off', 'use_snp_selection': False}. Best is trial 104 with value: 0.1040249856957381.
[I 2025-12-05 14:49:56,552] Trial 128 finished with value: 0.0947556034048178 and parameters: {'model_type': 'mlp', 'hidden_dims': '[256, 128]', 'dropout': 0.24461350747151894, 'batch_norm': True, 'lr': 9.61478814978079e-05, 'weight_decay': 9.871449322562573e-06, 'epochs': 62, 'loss': 'mae', 'optimizer': 'adam', 'graph_mode': 'off', 'use_snp_selection': False}. Best is trial 104 with value: 0.1040249856957381.
[I 2025-12-05 14:49:57,572] Trial 129 finished with value: 0.07131776476819668 and parameters: {'model_type': 'mlp', 'hidden_dims': '[128, 64]', 'dropout': 0.13874069004035372, 'batch_norm': True, 'lr': 7.434740584353242e-05, 'weight_decay': 1.6746738129933418e-05, 'epochs': 294, 'loss': 'mae', 'optimizer': 'adam', 'graph_mode': 'off', 'use_snp_selection': False}. Best is trial 104 with value: 0.1040249856957381.
[I 2025-12-05 14:49:58,317] Trial 130 finished with value: 0.0921990901800591 and parameters: {'model_type': 'mlp', 'hidden_dims': '[128, 64]', 'dropout': 0.1203900780721062, 'batch_norm': True, 'lr': 0.00016523342546222676, 'weight_decay': 6.275927619728957e-06, 'epochs': 107, 'loss': 'mae', 'optimizer': 'adam', 'graph_mode': 'off', 'use_snp_selection': False}. Best is trial 104 with value: 0.1040249856957381.
[I 2025-12-05 14:49:59,367] Trial 131 finished with value: 0.08570070956826699 and parameters: {'model_type': 'mlp', 'hidden_dims': '[128, 64]', 'dropout': 0.10006650382146202, 'batch_norm': True, 'lr': 0.00028098571973696077, 'weight_decay': 2.5365230094520874e-06, 'epochs': 314, 'loss': 'mae', 'optimizer': 'adam', 'graph_mode': 'off', 'use_snp_selection': False}. Best is trial 104 with value: 0.1040249856957381.
[I 2025-12-05 14:50:01,954] Trial 132 finished with value: 0.08033643342917049 and parameters: {'model_type': 'mlp', 'hidden_dims': '[512, 128]', 'dropout': 0.11336581501732702, 'batch_norm': True, 'lr': 0.0003259803460115809, 'weight_decay': 0.00019590505127810713, 'epochs': 325, 'loss': 'mae', 'optimizer': 'adam', 'graph_mode': 'off', 'use_snp_selection': False}. Best is trial 104 with value: 0.1040249856957381.
[I 2025-12-05 14:50:03,050] Trial 133 finished with value: 0.0914712656857794 and parameters: {'model_type': 'mlp', 'hidden_dims': '[256, 128]', 'dropout': 0.1494491694967423, 'batch_norm': True, 'lr': 0.0008108158856963922, 'weight_decay': 9.599805863591569e-05, 'epochs': 170, 'loss': 'mae', 'optimizer': 'adam', 'graph_mode': 'off', 'use_snp_selection': False}. Best is trial 104 with value: 0.1040249856957381.
[I 2025-12-05 14:50:05,712] Trial 134 finished with value: 0.06011622861439187 and parameters: {'model_type': 'mlp', 'hidden_dims': '[512, 256]', 'dropout': 0.12849719859040137, 'batch_norm': True, 'lr': 0.00019158586551908344, 'weight_decay': 3.552198327005075e-07, 'epochs': 336, 'loss': 'mae', 'optimizer': 'adam', 'graph_mode': 'off', 'use_snp_selection': False}. Best is trial 104 with value: 0.1040249856957381.
[I 2025-12-05 14:50:06,512] Trial 135 finished with value: 0.08027398550084341 and parameters: {'model_type': 'mlp', 'hidden_dims': '[128, 64]', 'dropout': 0.30076119854012073, 'batch_norm': True, 'lr': 0.0009993931092065825, 'weight_decay': 1.5185617395052915e-06, 'epochs': 148, 'loss': 'mae', 'optimizer': 'adam', 'graph_mode': 'off', 'use_snp_selection': False}. Best is trial 104 with value: 0.1040249856957381.
[I 2025-12-05 14:50:07,515] Trial 136 finished with value: 0.08075941239854312 and parameters: {'model_type': 'mlp', 'hidden_dims': '[256, 128, 64]', 'dropout': 0.10673087687556142, 'batch_norm': True, 'lr': 6.321027637815186e-05, 'weight_decay': 3.6490885835432024e-06, 'epochs': 131, 'loss': 'mae', 'optimizer': 'adam', 'graph_mode': 'off', 'use_snp_selection': False}. Best is trial 104 with value: 0.1040249856957381.
[I 2025-12-05 14:50:08,454] Trial 137 finished with value: 0.0940047775934876 and parameters: {'model_type': 'mlp', 'hidden_dims': '[128, 64]', 'dropout': 0.13502666663329446, 'batch_norm': True, 'lr': 0.0002403939771068299, 'weight_decay': 1.9782537246531145e-06, 'epochs': 236, 'loss': 'mae', 'optimizer': 'adam', 'graph_mode': 'off', 'use_snp_selection': False}. Best is trial 104 with value: 0.1040249856957381.
[I 2025-12-05 14:50:10,909] Trial 138 finished with value: 0.07829900208130816 and parameters: {'model_type': 'mlp', 'hidden_dims': '[512, 64]', 'dropout': 0.3296589384899573, 'batch_norm': True, 'lr': 0.0003811199223328231, 'weight_decay': 2.9477435536925016e-06, 'epochs': 303, 'loss': 'mse', 'optimizer': 'adam', 'graph_mode': 'off', 'use_snp_selection': False}. Best is trial 104 with value: 0.1040249856957381.
[I 2025-12-05 14:50:11,956] Trial 139 finished with value: 0.048988801684826624 and parameters: {'model_type': 'mlp', 'hidden_dims': '[128, 64]', 'dropout': 0.11602272279790654, 'batch_norm': False, 'lr': 0.0006497875457677418, 'weight_decay': 8.019030725729902e-06, 'epochs': 329, 'loss': 'mae', 'optimizer': 'adam', 'graph_mode': 'off', 'use_snp_selection': False}. Best is trial 104 with value: 0.1040249856957381.
[I 2025-12-05 14:50:14,537] Trial 140 finished with value: 0.09647773067851362 and parameters: {'model_type': 'mlp', 'hidden_dims': '[512, 128]', 'dropout': 0.16138689043909896, 'batch_norm': True, 'lr': 0.000536032149517771, 'weight_decay': 4.246187104501766e-06, 'epochs': 321, 'loss': 'mae', 'optimizer': 'adam', 'graph_mode': 'off', 'use_snp_selection': False}. Best is trial 104 with value: 0.1040249856957381.
[I 2025-12-05 14:50:17,105] Trial 141 finished with value: 0.09157662058955343 and parameters: {'model_type': 'mlp', 'hidden_dims': '[512, 128]', 'dropout': 0.15423883028029395, 'batch_norm': True, 'lr': 0.0004998589420101649, 'weight_decay': 1.0838713766123209e-05, 'epochs': 321, 'loss': 'mae', 'optimizer': 'adam', 'graph_mode': 'off', 'use_snp_selection': False}. Best is trial 104 with value: 0.1040249856957381.
[I 2025-12-05 14:50:19,627] Trial 142 finished with value: 0.08679394385902285 and parameters: {'model_type': 'mlp', 'hidden_dims': '[512, 128]', 'dropout': 0.55818726244491, 'batch_norm': True, 'lr': 0.0005594141663046282, 'weight_decay': 4.877114500313116e-06, 'epochs': 313, 'loss': 'mae', 'optimizer': 'adam', 'graph_mode': 'off', 'use_snp_selection': False}. Best is trial 104 with value: 0.1040249856957381.
[I 2025-12-05 14:50:22,311] Trial 143 finished with value: 0.08458218689130896 and parameters: {'model_type': 'mlp', 'hidden_dims': '[512, 128]', 'dropout': 0.12775380192035313, 'batch_norm': True, 'lr': 0.0007571437359766019, 'weight_decay': 2.3170180502356624e-06, 'epochs': 341, 'loss': 'mae', 'optimizer': 'adam', 'graph_mode': 'off', 'use_snp_selection': False}. Best is trial 104 with value: 0.1040249856957381.
[I 2025-12-05 14:50:25,043] Trial 144 finished with value: 0.09303863493311898 and parameters: {'model_type': 'mlp', 'hidden_dims': '[512, 128]', 'dropout': 0.1442662889335732, 'batch_norm': True, 'lr': 0.0006305944117090149, 'weight_decay': 5.777365908699408e-06, 'epochs': 350, 'loss': 'mae', 'optimizer': 'adam', 'graph_mode': 'off', 'use_snp_selection': False}. Best is trial 104 with value: 0.1040249856957381.
[I 2025-12-05 14:50:26,486] Trial 145 finished with value: 0.06880993110282234 and parameters: {'model_type': 'mlp', 'hidden_dims': '[256, 128]', 'dropout': 0.18348140838324914, 'batch_norm': True, 'lr': 5.113908872687025e-05, 'weight_decay': 4.2517014697694765e-06, 'epochs': 300, 'loss': 'mae', 'optimizer': 'adam', 'graph_mode': 'off', 'use_snp_selection': False}. Best is trial 104 with value: 0.1040249856957381.
[I 2025-12-05 14:50:27,774] Trial 146 finished with value: 0.06504218999508606 and parameters: {'model_type': 'mlp', 'hidden_dims': '[128, 64]', 'dropout': 0.11065521306390379, 'batch_norm': True, 'lr': 0.00045668671336554246, 'weight_decay': 3.2291904878070854e-06, 'epochs': 308, 'loss': 'mae', 'optimizer': 'adam', 'graph_mode': 'off', 'use_snp_selection': True, 'num_snps': 6945}. Best is trial 104 with value: 0.1040249856957381.
[I 2025-12-05 14:50:29,623] Trial 147 finished with value: 0.08476511146026548 and parameters: {'model_type': 'mlp', 'hidden_dims': '[512, 128]', 'dropout': 0.15854798942859014, 'batch_norm': True, 'lr': 0.0008525991915607721, 'weight_decay': 5.158725860110793e-07, 'epochs': 194, 'loss': 'mae', 'optimizer': 'adam', 'graph_mode': 'off', 'use_snp_selection': False}. Best is trial 104 with value: 0.1040249856957381.
[I 2025-12-05 14:50:30,538] Trial 148 finished with value: 0.07409160667004892 and parameters: {'model_type': 'mlp', 'hidden_dims': '[128, 64]', 'dropout': 0.3752427348003528, 'batch_norm': True, 'lr': 9.360290258691199e-05, 'weight_decay': 0.0006296799517770422, 'epochs': 224, 'loss': 'mae', 'optimizer': 'adam', 'graph_mode': 'off', 'use_snp_selection': False}. Best is trial 104 with value: 0.1040249856957381.
[I 2025-12-05 14:50:31,592] Trial 149 finished with value: 0.0917363031468465 and parameters: {'model_type': 'mlp', 'hidden_dims': '[128, 64]', 'dropout': 0.13844838104903012, 'batch_norm': True, 'lr': 0.00011421449349448734, 'weight_decay': 6.710730819008004e-07, 'epochs': 319, 'loss': 'mae', 'optimizer': 'adam', 'graph_mode': 'off', 'use_snp_selection': False}. Best is trial 104 with value: 0.1040249856957381.
[I 2025-12-05 14:50:33,892] Trial 0 finished with value: -0.02314255905516231 and parameters: {'model_type': 'mlp', 'hidden_dims': '[128, 64]', 'dropout': 0.199031432379812, 'batch_norm': True, 'lr': 1.8408544111075837e-06, 'weight_decay': 5.5136510071208614e-05, 'epochs': 336, 'loss': 'mae', 'optimizer': 'adam', 'graph_mode': 'off', 'use_snp_selection': True, 'num_snps': 43862}. Best is trial 0 with value: -0.02314255905516231.
[I 2025-12-05 14:50:35,119] Trial 1 finished with value: 0.047867929310427326 and parameters: {'model_type': 'mlp', 'hidden_dims': '[256, 128]', 'dropout': 0.4370668075331726, 'batch_norm': True, 'lr': 7.133471581159139e-05, 'weight_decay': 1.128633586803549e-05, 'epochs': 242, 'loss': 'mae', 'optimizer': 'adam', 'graph_mode': 'off', 'use_snp_selection': False}. Best is trial 1 with value: 0.047867929310427326.
[I 2025-12-05 14:50:36,215] Trial 2 finished with value: -0.0018075860472198124 and parameters: {'model_type': 'mlp', 'hidden_dims': '[256, 128, 64]', 'dropout': 0.41314357415569625, 'batch_norm': False, 'lr': 3.952233718592101e-06, 'weight_decay': 0.00026754769258252603, 'epochs': 149, 'loss': 'mse', 'optimizer': 'adam', 'graph_mode': 'off', 'use_snp_selection': True, 'num_snps': 11571}. Best is trial 1 with value: 0.047867929310427326.
[I 2025-12-05 14:50:38,356] Trial 3 finished with value: 0.010586691119200112 and parameters: {'model_type': 'mlp', 'hidden_dims': '[512, 64]', 'dropout': 0.5938127374509361, 'batch_norm': False, 'lr': 5.67704586114731e-06, 'weight_decay': 2.4518087630137052e-05, 'epochs': 320, 'loss': 'mae', 'optimizer': 'adam', 'graph_mode': 'off', 'use_snp_selection': False}. Best is trial 1 with value: 0.047867929310427326.
[I 2025-12-05 14:50:40,742] Trial 4 finished with value: 0.007287080225989898 and parameters: {'model_type': 'mlp', 'hidden_dims': '[512, 128]', 'dropout': 0.25746343592134413, 'batch_norm': True, 'lr': 1.3467657668402788e-06, 'weight_decay': 0.00033087251918647806, 'epochs': 277, 'loss': 'mse', 'optimizer': 'adam', 'graph_mode': 'off', 'use_snp_selection': True, 'num_snps': 36675}. Best is trial 1 with value: 0.047867929310427326.
[I 2025-12-05 14:50:42,629] Trial 5 finished with value: -0.010623898703109955 and parameters: {'model_type': 'mlp', 'hidden_dims': '[512, 64]', 'dropout': 0.38275350994408375, 'batch_norm': True, 'lr': 1.5586664309232824e-06, 'weight_decay': 0.0008227664668621182, 'epochs': 145, 'loss': 'mae', 'optimizer': 'adam', 'graph_mode': 'off', 'use_snp_selection': True, 'num_snps': 32148}. Best is trial 1 with value: 0.047867929310427326.
[I 2025-12-05 14:50:43,735] Trial 6 finished with value: 0.03426248172550572 and parameters: {'model_type': 'mlp', 'hidden_dims': '[256, 128]', 'dropout': 0.3930109900265879, 'batch_norm': False, 'lr': 4.892964372128395e-05, 'weight_decay': 1.5809549317992182e-06, 'epochs': 199, 'loss': 'mse', 'optimizer': 'adam', 'graph_mode': 'off', 'use_snp_selection': False}. Best is trial 1 with value: 0.047867929310427326.
[I 2025-12-05 14:50:44,911] Trial 7 finished with value: 0.057954601054213954 and parameters: {'model_type': 'mlp', 'hidden_dims': '[512, 256]', 'dropout': 0.15343979219678458, 'batch_norm': True, 'lr': 6.234003099047341e-05, 'weight_decay': 3.894760610535477e-07, 'epochs': 97, 'loss': 'mse', 'optimizer': 'adam', 'graph_mode': 'off', 'use_snp_selection': False}. Best is trial 7 with value: 0.057954601054213954.
[I 2025-12-05 14:50:47,033] Trial 8 finished with value: 0.04238785799208625 and parameters: {'model_type': 'mlp', 'hidden_dims': '[512, 128]', 'dropout': 0.10743001231661406, 'batch_norm': True, 'lr': 0.00023728538449271062, 'weight_decay': 1.7629071578048637e-05, 'epochs': 312, 'loss': 'mae', 'optimizer': 'adam', 'graph_mode': 'off', 'use_snp_selection': False}. Best is trial 7 with value: 0.057954601054213954.
[I 2025-12-05 14:50:48,549] Trial 9 finished with value: 0.0509615173434297 and parameters: {'model_type': 'mlp', 'hidden_dims': '[512, 64]', 'dropout': 0.14505336736221927, 'batch_norm': True, 'lr': 5.8619638388111826e-05, 'weight_decay': 6.200156172669308e-07, 'epochs': 175, 'loss': 'mse', 'optimizer': 'adam', 'graph_mode': 'off', 'use_snp_selection': False}. Best is trial 7 with value: 0.057954601054213954.
[I 2025-12-05 14:50:49,486] Trial 10 finished with value: -0.034899879699895275 and parameters: {'model_type': 'mlp', 'hidden_dims': '[512, 256]', 'dropout': 0.2736992815328032, 'batch_norm': False, 'lr': 0.00032393778075602147, 'weight_decay': 1.1511946696017092e-07, 'epochs': 41, 'loss': 'mse', 'optimizer': 'adam', 'graph_mode': 'off', 'use_snp_selection': False}. Best is trial 7 with value: 0.057954601054213954.
[I 2025-12-05 14:50:50,583] Trial 11 finished with value: 0.004064283301960615 and parameters: {'model_type': 'mlp', 'hidden_dims': '[512, 256]', 'dropout': 0.10095648685224448, 'batch_norm': True, 'lr': 1.6474108386126448e-05, 'weight_decay': 6.203180869264506e-07, 'epochs': 77, 'loss': 'mse', 'optimizer': 'adam', 'graph_mode': 'off', 'use_snp_selection': False}. Best is trial 7 with value: 0.057954601054213954.
[I 2025-12-05 14:50:51,810] Trial 12 finished with value: 0.04742766803806115 and parameters: {'model_type': 'mlp', 'hidden_dims': '[512, 256]', 'dropout': 0.1977119287227368, 'batch_norm': True, 'lr': 0.000121041789182661, 'weight_decay': 1.2192432071058163e-06, 'epochs': 106, 'loss': 'mse', 'optimizer': 'adam', 'graph_mode': 'off', 'use_snp_selection': False}. Best is trial 7 with value: 0.057954601054213954.
[I 2025-12-05 14:50:53,368] Trial 13 finished with value: 0.015453308250068838 and parameters: {'model_type': 'mlp', 'hidden_dims': '[512, 64]', 'dropout': 0.17892004217860003, 'batch_norm': True, 'lr': 1.9472380101128875e-05, 'weight_decay': 1.1026057540153843e-07, 'epochs': 182, 'loss': 'mse', 'optimizer': 'adam', 'graph_mode': 'off', 'use_snp_selection': False}. Best is trial 7 with value: 0.057954601054213954.
[I 2025-12-05 14:50:54,105] Trial 14 finished with value: 0.05738670698583448 and parameters: {'model_type': 'mlp', 'hidden_dims': '[128, 64]', 'dropout': 0.3012984444538551, 'batch_norm': True, 'lr': 0.0006681578335050954, 'weight_decay': 4.814764599662762e-07, 'epochs': 110, 'loss': 'mse', 'optimizer': 'adam', 'graph_mode': 'off', 'use_snp_selection': False}. Best is trial 7 with value: 0.057954601054213954.
[I 2025-12-05 14:50:54,835] Trial 15 finished with value: 0.04768694440886904 and parameters: {'model_type': 'mlp', 'hidden_dims': '[128, 64]', 'dropout': 0.3032826114627972, 'batch_norm': True, 'lr': 0.0006356475435070072, 'weight_decay': 3.1369850385006404e-06, 'epochs': 106, 'loss': 'mse', 'optimizer': 'adam', 'graph_mode': 'off', 'use_snp_selection': False}. Best is trial 7 with value: 0.057954601054213954.
[I 2025-12-05 14:50:55,503] Trial 16 finished with value: 0.051340382196046835 and parameters: {'model_type': 'mlp', 'hidden_dims': '[128, 64]', 'dropout': 0.47522796769107767, 'batch_norm': True, 'lr': 0.0007721828573036061, 'weight_decay': 3.315063111115081e-07, 'epochs': 47, 'loss': 'mse', 'optimizer': 'adam', 'graph_mode': 'off', 'use_snp_selection': False}. Best is trial 7 with value: 0.057954601054213954.
[I 2025-12-05 14:50:56,424] Trial 17 finished with value: 0.019870883988204954 and parameters: {'model_type': 'mlp', 'hidden_dims': '[256, 128, 64]', 'dropout': 0.32888830259108426, 'batch_norm': True, 'lr': 0.00022533880842590709, 'weight_decay': 3.784040923164914e-06, 'epochs': 111, 'loss': 'mse', 'optimizer': 'adam', 'graph_mode': 'off', 'use_snp_selection': False}. Best is trial 7 with value: 0.057954601054213954.
[I 2025-12-05 14:50:58,933] Trial 18 finished with value: 0.04835628471840898 and parameters: {'model_type': 'mlp', 'hidden_dims': '[128, 64]', 'dropout': 0.2472307763740555, 'batch_norm': False, 'lr': 0.000979666639662749, 'weight_decay': 2.855598826329304e-07, 'epochs': 226, 'loss': 'mse', 'optimizer': 'adam', 'graph_mode': 'off', 'use_snp_selection': True, 'num_snps': 58241}. Best is trial 7 with value: 0.057954601054213954.
[I 2025-12-05 14:51:00,293] Trial 19 finished with value: 0.030287280792147833 and parameters: {'model_type': 'mlp', 'hidden_dims': '[512, 256]', 'dropout': 0.520299837989321, 'batch_norm': True, 'lr': 1.0436614786391874e-05, 'weight_decay': 5.616604511856029e-06, 'epochs': 138, 'loss': 'mse', 'optimizer': 'adam', 'graph_mode': 'off', 'use_snp_selection': False}. Best is trial 7 with value: 0.057954601054213954.
[I 2025-12-05 14:51:01,391] Trial 20 finished with value: 0.04795764027798201 and parameters: {'model_type': 'mlp', 'hidden_dims': '[512, 256]', 'dropout': 0.34828251779168334, 'batch_norm': True, 'lr': 0.00011196106742373393, 'weight_decay': 2.735785276124728e-07, 'epochs': 76, 'loss': 'mse', 'optimizer': 'adam', 'graph_mode': 'off', 'use_snp_selection': False}. Best is trial 7 with value: 0.057954601054213954.
[I 2025-12-05 14:51:02,033] Trial 21 finished with value: 0.046918554066756414 and parameters: {'model_type': 'mlp', 'hidden_dims': '[128, 64]', 'dropout': 0.4755809271545696, 'batch_norm': True, 'lr': 0.0004776871689243618, 'weight_decay': 2.837439094836612e-07, 'epochs': 46, 'loss': 'mse', 'optimizer': 'adam', 'graph_mode': 'off', 'use_snp_selection': False}. Best is trial 7 with value: 0.057954601054213954.
[I 2025-12-05 14:51:02,710] Trial 22 finished with value: 0.045102570226592725 and parameters: {'model_type': 'mlp', 'hidden_dims': '[128, 64]', 'dropout': 0.5447308805905808, 'batch_norm': True, 'lr': 0.0008252734424172188, 'weight_decay': 9.606832583545451e-07, 'epochs': 72, 'loss': 'mse', 'optimizer': 'adam', 'graph_mode': 'off', 'use_snp_selection': False}. Best is trial 7 with value: 0.057954601054213954.
[I 2025-12-05 14:51:03,382] Trial 23 finished with value: 0.06317597915090485 and parameters: {'model_type': 'mlp', 'hidden_dims': '[128, 64]', 'dropout': 0.4707206455339781, 'batch_norm': True, 'lr': 0.00035971448257670507, 'weight_decay': 3.605039070570317e-07, 'epochs': 67, 'loss': 'mse', 'optimizer': 'adam', 'graph_mode': 'off', 'use_snp_selection': False}. Best is trial 23 with value: 0.06317597915090485.
[I 2025-12-05 14:51:04,125] Trial 24 finished with value: 0.05560423261739384 and parameters: {'model_type': 'mlp', 'hidden_dims': '[128, 64]', 'dropout': 0.30064083112093387, 'batch_norm': True, 'lr': 0.00016411853719611318, 'weight_decay': 1.794022213356721e-06, 'epochs': 122, 'loss': 'mse', 'optimizer': 'adam', 'graph_mode': 'off', 'use_snp_selection': False}. Best is trial 23 with value: 0.06317597915090485.
[I 2025-12-05 14:51:04,809] Trial 25 finished with value: 0.044078437009429136 and parameters: {'model_type': 'mlp', 'hidden_dims': '[128, 64]', 'dropout': 0.2297571179537936, 'batch_norm': True, 'lr': 0.0003833948745646682, 'weight_decay': 1.0281199639435083e-07, 'epochs': 79, 'loss': 'mse', 'optimizer': 'adam', 'graph_mode': 'off', 'use_snp_selection': False}. Best is trial 23 with value: 0.06317597915090485.
[I 2025-12-05 14:51:05,624] Trial 26 finished with value: -0.011941773900450271 and parameters: {'model_type': 'mlp', 'hidden_dims': '[512, 128]', 'dropout': 0.45727954713256697, 'batch_norm': True, 'lr': 3.176022432363814e-05, 'weight_decay': 6.216455498105533e-07, 'epochs': 90, 'loss': 'mae', 'optimizer': 'adam', 'graph_mode': 'off', 'use_snp_selection': True, 'num_snps': 3842}. Best is trial 23 with value: 0.06317597915090485.
[I 2025-12-05 14:51:06,631] Trial 27 finished with value: 0.024673249120558963 and parameters: {'model_type': 'mlp', 'hidden_dims': '[256, 128, 64]', 'dropout': 0.5260554932000863, 'batch_norm': False, 'lr': 9.231694342193575e-05, 'weight_decay': 1.8355490661678068e-07, 'epochs': 153, 'loss': 'mse', 'optimizer': 'adam', 'graph_mode': 'off', 'use_snp_selection': False}. Best is trial 23 with value: 0.06317597915090485.
[I 2025-12-05 14:51:07,582] Trial 28 finished with value: 0.04249758338201629 and parameters: {'model_type': 'mlp', 'hidden_dims': '[256, 128]', 'dropout': 0.1500035094574004, 'batch_norm': True, 'lr': 0.00018599569623849386, 'weight_decay': 2.48917799510499e-06, 'epochs': 125, 'loss': 'mse', 'optimizer': 'adam', 'graph_mode': 'off', 'use_snp_selection': False}. Best is trial 23 with value: 0.06317597915090485.
