[I 2025-12-05 16:26:25,542] Trial 76 finished with value: 0.025298599715621456 and parameters: {'model_type': 'mlp', 'hidden_dims': '[512, 64]', 'dropout': 0.42731217870696364, 'batch_norm': True, 'lr': 4.004786046940138e-05, 'weight_decay': 6.2043631647133e-05, 'epochs': 318, 'loss': 'mae', 'optimizer': 'adam', 'graph_mode': 'off', 'use_snp_selection': False}. Best is trial 46 with value: 0.07279895725465674.
[I 2025-12-05 16:26:26,530] Trial 77 finished with value: 0.018060966723213685 and parameters: {'model_type': 'mlp', 'hidden_dims': '[128, 64]', 'dropout': 0.39880686477813243, 'batch_norm': True, 'lr': 6.0470865313391547e-05, 'weight_decay': 0.00012139546324209487, 'epochs': 259, 'loss': 'mae', 'optimizer': 'adam', 'graph_mode': 'off', 'use_snp_selection': False}. Best is trial 46 with value: 0.07279895725465674.
[I 2025-12-05 16:26:27,424] Trial 78 finished with value: -0.002331704112685589 and parameters: {'model_type': 'mlp', 'hidden_dims': '[512, 256]', 'dropout': 0.4821591786760489, 'batch_norm': False, 'lr': 1.0087771566710253e-06, 'weight_decay': 0.0002349411603492521, 'epochs': 245, 'loss': 'mae', 'optimizer': 'adam', 'graph_mode': 'off', 'use_snp_selection': True, 'num_snps': 2246}. Best is trial 46 with value: 0.07279895725465674.
[I 2025-12-05 16:26:28,606] Trial 79 finished with value: 0.03975908264301955 and parameters: {'model_type': 'mlp', 'hidden_dims': '[256, 128, 64]', 'dropout': 0.14222744953006017, 'batch_norm': True, 'lr': 2.024919090762295e-05, 'weight_decay': 0.00045984252852827997, 'epochs': 235, 'loss': 'mae', 'optimizer': 'adam', 'graph_mode': 'off', 'use_snp_selection': False}. Best is trial 46 with value: 0.07279895725465674.
[I 2025-12-05 16:26:30,576] Trial 80 finished with value: 0.002974903426852593 and parameters: {'model_type': 'mlp', 'hidden_dims': '[512, 256]', 'dropout': 0.47041095794356835, 'batch_norm': True, 'lr': 3.4551131087420795e-06, 'weight_decay': 0.0007148096525242189, 'epochs': 304, 'loss': 'mae', 'optimizer': 'adam', 'graph_mode': 'off', 'use_snp_selection': False}. Best is trial 46 with value: 0.07279895725465674.
[I 2025-12-05 16:26:31,783] Trial 81 finished with value: 0.07257816690019557 and parameters: {'model_type': 'mlp', 'hidden_dims': '[256, 128]', 'dropout': 0.38307128643517857, 'batch_norm': True, 'lr': 2.6897069836454826e-05, 'weight_decay': 0.0007174065801337392, 'epochs': 250, 'loss': 'mae', 'optimizer': 'adam', 'graph_mode': 'off', 'use_snp_selection': False}. Best is trial 46 with value: 0.07279895725465674.
[I 2025-12-05 16:26:33,032] Trial 82 finished with value: 0.04432385155706062 and parameters: {'model_type': 'mlp', 'hidden_dims': '[256, 128]', 'dropout': 0.36674790256604944, 'batch_norm': True, 'lr': 0.0002843098761605616, 'weight_decay': 0.00033775482149401035, 'epochs': 275, 'loss': 'mae', 'optimizer': 'adam', 'graph_mode': 'off', 'use_snp_selection': False}. Best is trial 46 with value: 0.07279895725465674.
[I 2025-12-05 16:26:34,250] Trial 83 finished with value: 0.024923822549076192 and parameters: {'model_type': 'mlp', 'hidden_dims': '[256, 128]', 'dropout': 0.4027686237036658, 'batch_norm': True, 'lr': 2.9801011568222134e-05, 'weight_decay': 0.0005184500012563512, 'epochs': 252, 'loss': 'mae', 'optimizer': 'adam', 'graph_mode': 'off', 'use_snp_selection': False}. Best is trial 46 with value: 0.07279895725465674.
[I 2025-12-05 16:26:35,841] Trial 84 finished with value: 0.03535190160976498 and parameters: {'model_type': 'mlp', 'hidden_dims': '[512, 64]', 'dropout': 0.38779044542523317, 'batch_norm': True, 'lr': 0.00010970149716020925, 'weight_decay': 0.0001577674911435871, 'epochs': 210, 'loss': 'mae', 'optimizer': 'adam', 'graph_mode': 'off', 'use_snp_selection': False}. Best is trial 46 with value: 0.07279895725465674.
[I 2025-12-05 16:26:36,721] Trial 85 finished with value: 0.0538618766271278 and parameters: {'model_type': 'mlp', 'hidden_dims': '[256, 128]', 'dropout': 0.33207447563310377, 'batch_norm': True, 'lr': 0.00014743358456040928, 'weight_decay': 0.0008108532392831288, 'epochs': 103, 'loss': 'mae', 'optimizer': 'adam', 'graph_mode': 'off', 'use_snp_selection': False}. Best is trial 46 with value: 0.07279895725465674.
[I 2025-12-05 16:26:37,705] Trial 86 finished with value: 0.040463100822052435 and parameters: {'model_type': 'mlp', 'hidden_dims': '[512, 256]', 'dropout': 0.43734872406664516, 'batch_norm': True, 'lr': 1.2979882191546958e-05, 'weight_decay': 0.00029539067889739856, 'epochs': 59, 'loss': 'mse', 'optimizer': 'adam', 'graph_mode': 'off', 'use_snp_selection': False}. Best is trial 46 with value: 0.07279895725465674.
[I 2025-12-05 16:26:39,842] Trial 87 finished with value: 0.0391100350272134 and parameters: {'model_type': 'mlp', 'hidden_dims': '[512, 128]', 'dropout': 0.4936692773051064, 'batch_norm': True, 'lr': 3.6213033838601416e-05, 'weight_decay': 0.00039050502066165883, 'epochs': 350, 'loss': 'mae', 'optimizer': 'adam', 'graph_mode': 'off', 'use_snp_selection': False}. Best is trial 46 with value: 0.07279895725465674.
[I 2025-12-05 16:26:41,131] Trial 88 finished with value: 0.019624702519164382 and parameters: {'model_type': 'mlp', 'hidden_dims': '[256, 128]', 'dropout': 0.3752464954937403, 'batch_norm': True, 'lr': 1.838854939705426e-05, 'weight_decay': 0.000600581793063738, 'epochs': 285, 'loss': 'mae', 'optimizer': 'adam', 'graph_mode': 'off', 'use_snp_selection': False}. Best is trial 46 with value: 0.07279895725465674.
[I 2025-12-05 16:26:42,921] Trial 89 finished with value: 0.01967815214207985 and parameters: {'model_type': 'mlp', 'hidden_dims': '[512, 256]', 'dropout': 0.29040815977326523, 'batch_norm': False, 'lr': 5.007753025744144e-05, 'weight_decay': 0.00022723338407060878, 'epochs': 262, 'loss': 'mse', 'optimizer': 'adam', 'graph_mode': 'off', 'use_snp_selection': False}. Best is trial 46 with value: 0.07279895725465674.
[I 2025-12-05 16:26:45,171] Trial 90 finished with value: 0.041081217521654695 and parameters: {'model_type': 'mlp', 'hidden_dims': '[512, 64]', 'dropout': 0.4267707641996632, 'batch_norm': True, 'lr': 2.3762978714502306e-05, 'weight_decay': 0.0007226221507738704, 'epochs': 84, 'loss': 'mae', 'optimizer': 'adam', 'graph_mode': 'off', 'use_snp_selection': True, 'num_snps': 48165}. Best is trial 46 with value: 0.07279895725465674.
[I 2025-12-05 16:26:46,324] Trial 91 finished with value: 0.029334578466563035 and parameters: {'model_type': 'mlp', 'hidden_dims': '[256, 128]', 'dropout': 0.3560004560888087, 'batch_norm': True, 'lr': 2.7520662049964903e-05, 'weight_decay': 0.0009969073372654259, 'epochs': 252, 'loss': 'mae', 'optimizer': 'adam', 'graph_mode': 'off', 'use_snp_selection': False}. Best is trial 46 with value: 0.07279895725465674.
[I 2025-12-05 16:26:47,496] Trial 92 finished with value: 0.025346379212213097 and parameters: {'model_type': 'mlp', 'hidden_dims': '[256, 128]', 'dropout': 0.38360336119740135, 'batch_norm': True, 'lr': 8.174962632499045e-05, 'weight_decay': 0.0006938452613706953, 'epochs': 257, 'loss': 'mae', 'optimizer': 'adam', 'graph_mode': 'off', 'use_snp_selection': False}. Best is trial 46 with value: 0.07279895725465674.
[I 2025-12-05 16:26:48,671] Trial 93 finished with value: 0.01887506607180257 and parameters: {'model_type': 'mlp', 'hidden_dims': '[256, 128]', 'dropout': 0.40254228055772534, 'batch_norm': True, 'lr': 1.5631884730339188e-05, 'weight_decay': 0.00045915379739609584, 'epochs': 236, 'loss': 'mae', 'optimizer': 'adam', 'graph_mode': 'off', 'use_snp_selection': False}. Best is trial 46 with value: 0.07279895725465674.
[I 2025-12-05 16:26:49,924] Trial 94 finished with value: 0.04644275631192504 and parameters: {'model_type': 'mlp', 'hidden_dims': '[256, 128]', 'dropout': 0.4123854672548045, 'batch_norm': True, 'lr': 0.0009759757218298173, 'weight_decay': 0.0003076882960981194, 'epochs': 268, 'loss': 'mae', 'optimizer': 'adam', 'graph_mode': 'off', 'use_snp_selection': False}. Best is trial 46 with value: 0.07279895725465674.
[I 2025-12-05 16:26:51,129] Trial 95 finished with value: 0.013244578045947879 and parameters: {'model_type': 'mlp', 'hidden_dims': '[256, 128]', 'dropout': 0.4497229667687471, 'batch_norm': True, 'lr': 2.640493778641191e-05, 'weight_decay': 0.0005597280194192187, 'epochs': 243, 'loss': 'mae', 'optimizer': 'adam', 'graph_mode': 'off', 'use_snp_selection': False}. Best is trial 46 with value: 0.07279895725465674.
[I 2025-12-05 16:26:52,072] Trial 96 finished with value: 0.03439595037832274 and parameters: {'model_type': 'mlp', 'hidden_dims': '[128, 64]', 'dropout': 0.39315492496406046, 'batch_norm': True, 'lr': 6.475236045427036e-05, 'weight_decay': 0.00041322847873050567, 'epochs': 227, 'loss': 'mae', 'optimizer': 'adam', 'graph_mode': 'off', 'use_snp_selection': False}. Best is trial 46 with value: 0.07279895725465674.
[I 2025-12-05 16:26:52,888] Trial 97 finished with value: -0.01824486764757638 and parameters: {'model_type': 'mlp', 'hidden_dims': '[256, 128]', 'dropout': 0.32180181938010816, 'batch_norm': True, 'lr': 3.934517566451175e-05, 'weight_decay': 0.00019773051412096774, 'epochs': 74, 'loss': 'mae', 'optimizer': 'adam', 'graph_mode': 'off', 'use_snp_selection': False}. Best is trial 46 with value: 0.07279895725465674.
[I 2025-12-05 16:26:54,938] Trial 98 finished with value: 0.0277124733058522 and parameters: {'model_type': 'mlp', 'hidden_dims': '[512, 64]', 'dropout': 0.37313351507849096, 'batch_norm': False, 'lr': 8.732082736137769e-06, 'weight_decay': 0.00010002665871913786, 'epochs': 339, 'loss': 'mse', 'optimizer': 'adam', 'graph_mode': 'off', 'use_snp_selection': False}. Best is trial 46 with value: 0.07279895725465674.
[I 2025-12-05 16:26:56,796] Trial 99 finished with value: -0.03907984817264465 and parameters: {'model_type': 'mlp', 'hidden_dims': '[512, 256]', 'dropout': 0.42129608802974294, 'batch_norm': True, 'lr': 2.1941686072942238e-05, 'weight_decay': 0.00014538765696505053, 'epochs': 276, 'loss': 'mae', 'optimizer': 'adam', 'graph_mode': 'off', 'use_snp_selection': False}. Best is trial 46 with value: 0.07279895725465674.
[I 2025-12-05 16:26:58,073] Trial 100 finished with value: 0.035540326786909694 and parameters: {'model_type': 'mlp', 'hidden_dims': '[256, 128, 64]', 'dropout': 0.41109510204623556, 'batch_norm': False, 'lr': 1.1614861679370774e-05, 'weight_decay': 0.0008007138247969548, 'epochs': 294, 'loss': 'mae', 'optimizer': 'adam', 'graph_mode': 'off', 'use_snp_selection': False}. Best is trial 46 with value: 0.07279895725465674.
[I 2025-12-05 16:26:58,988] Trial 101 finished with value: 0.02444033873023692 and parameters: {'model_type': 'mlp', 'hidden_dims': '[256, 128]', 'dropout': 0.10434665722481973, 'batch_norm': True, 'lr': 0.0005383622952555429, 'weight_decay': 0.000814990558063511, 'epochs': 109, 'loss': 'mae', 'optimizer': 'adam', 'graph_mode': 'off', 'use_snp_selection': False}. Best is trial 46 with value: 0.07279895725465674.
[I 2025-12-05 16:26:59,871] Trial 102 finished with value: 0.06100916043365686 and parameters: {'model_type': 'mlp', 'hidden_dims': '[256, 128]', 'dropout': 0.33539738859497426, 'batch_norm': True, 'lr': 0.0001373908392805711, 'weight_decay': 0.0006357411861813001, 'epochs': 98, 'loss': 'mae', 'optimizer': 'adam', 'graph_mode': 'off', 'use_snp_selection': False}. Best is trial 46 with value: 0.07279895725465674.
[I 2025-12-05 16:27:00,808] Trial 103 finished with value: 0.028186312699768592 and parameters: {'model_type': 'mlp', 'hidden_dims': '[256, 128]', 'dropout': 0.26087399310364406, 'batch_norm': True, 'lr': 0.00015508186863274435, 'weight_decay': 0.0005446903177770392, 'epochs': 124, 'loss': 'mae', 'optimizer': 'adam', 'graph_mode': 'off', 'use_snp_selection': False}. Best is trial 46 with value: 0.07279895725465674.
[I 2025-12-05 16:27:01,678] Trial 104 finished with value: 0.015140265764195129 and parameters: {'model_type': 'mlp', 'hidden_dims': '[256, 128]', 'dropout': 0.43805139589701947, 'batch_norm': True, 'lr': 4.582720791873623e-05, 'weight_decay': 0.0006003769228868551, 'epochs': 98, 'loss': 'mae', 'optimizer': 'adam', 'graph_mode': 'off', 'use_snp_selection': False}. Best is trial 46 with value: 0.07279895725465674.
[I 2025-12-05 16:27:03,328] Trial 105 finished with value: 0.027316915594313863 and parameters: {'model_type': 'mlp', 'hidden_dims': '[512, 128]', 'dropout': 0.33961438576206554, 'batch_norm': True, 'lr': 0.00025384320723617594, 'weight_decay': 0.00026330906273236133, 'epochs': 219, 'loss': 'mae', 'optimizer': 'adam', 'graph_mode': 'off', 'use_snp_selection': False}. Best is trial 46 with value: 0.07279895725465674.
[I 2025-12-05 16:27:04,205] Trial 106 finished with value: -0.0020793484963845823 and parameters: {'model_type': 'mlp', 'hidden_dims': '[256, 128]', 'dropout': 0.18104032329879619, 'batch_norm': True, 'lr': 3.4399816066861555e-05, 'weight_decay': 0.0003948964894603332, 'epochs': 95, 'loss': 'mae', 'optimizer': 'adam', 'graph_mode': 'off', 'use_snp_selection': False}. Best is trial 46 with value: 0.07279895725465674.
[I 2025-12-05 16:27:05,170] Trial 107 finished with value: 0.03627936843726482 and parameters: {'model_type': 'mlp', 'hidden_dims': '[512, 64]', 'dropout': 0.3567163340629396, 'batch_norm': True, 'lr': 0.0003326851405074992, 'weight_decay': 1.729732471333342e-06, 'epochs': 49, 'loss': 'mae', 'optimizer': 'adam', 'graph_mode': 'off', 'use_snp_selection': False}. Best is trial 46 with value: 0.07279895725465674.
[I 2025-12-05 16:27:06,260] Trial 108 finished with value: 0.0184352503491582 and parameters: {'model_type': 'mlp', 'hidden_dims': '[256, 128]', 'dropout': 0.4694091896686013, 'batch_norm': False, 'lr': 0.0007228842384903714, 'weight_decay': 0.0003372391535005666, 'epochs': 249, 'loss': 'mse', 'optimizer': 'adam', 'graph_mode': 'off', 'use_snp_selection': True, 'num_snps': 11322}. Best is trial 46 with value: 0.07279895725465674.
[I 2025-12-05 16:27:07,716] Trial 109 finished with value: 0.033346437711862666 and parameters: {'model_type': 'mlp', 'hidden_dims': '[512, 256]', 'dropout': 0.44940273828070915, 'batch_norm': True, 'lr': 0.00022236446036964273, 'weight_decay': 0.0006725587199791058, 'epochs': 184, 'loss': 'mae', 'optimizer': 'adam', 'graph_mode': 'off', 'use_snp_selection': False}. Best is trial 46 with value: 0.07279895725465674.
[I 2025-12-05 16:27:09,525] Trial 110 finished with value: 0.020411859358344702 and parameters: {'model_type': 'mlp', 'hidden_dims': '[512, 64]', 'dropout': 0.13342259348339547, 'batch_norm': False, 'lr': 1.808137158046619e-05, 'weight_decay': 0.0005014985303058868, 'epochs': 265, 'loss': 'mae', 'optimizer': 'adam', 'graph_mode': 'off', 'use_snp_selection': False}. Best is trial 46 with value: 0.07279895725465674.
[I 2025-12-05 16:27:10,410] Trial 111 finished with value: 0.04286566735183751 and parameters: {'model_type': 'mlp', 'hidden_dims': '[256, 128]', 'dropout': 0.33934880281957774, 'batch_norm': True, 'lr': 0.00010230542157981043, 'weight_decay': 0.0008243839487255606, 'epochs': 92, 'loss': 'mae', 'optimizer': 'adam', 'graph_mode': 'off', 'use_snp_selection': False}. Best is trial 46 with value: 0.07279895725465674.
[I 2025-12-05 16:27:11,303] Trial 112 finished with value: 0.022614309118897686 and parameters: {'model_type': 'mlp', 'hidden_dims': '[256, 128]', 'dropout': 0.21406302428002244, 'batch_norm': True, 'lr': 0.00011864646574184388, 'weight_decay': 0.0008755110003462846, 'epochs': 101, 'loss': 'mae', 'optimizer': 'adam', 'graph_mode': 'off', 'use_snp_selection': False}. Best is trial 46 with value: 0.07279895725465674.
[I 2025-12-05 16:27:12,149] Trial 113 finished with value: 0.03461472691354492 and parameters: {'model_type': 'mlp', 'hidden_dims': '[256, 128]', 'dropout': 0.30811554272439495, 'batch_norm': True, 'lr': 0.00014613367845808743, 'weight_decay': 0.0007014634269418656, 'epochs': 80, 'loss': 'mae', 'optimizer': 'adam', 'graph_mode': 'off', 'use_snp_selection': False}. Best is trial 46 with value: 0.07279895725465674.
[I 2025-12-05 16:27:13,037] Trial 114 finished with value: 0.047420124633890864 and parameters: {'model_type': 'mlp', 'hidden_dims': '[256, 128]', 'dropout': 0.1553734903938726, 'batch_norm': True, 'lr': 5.437435792564686e-05, 'weight_decay': 0.0009853792068982253, 'epochs': 102, 'loss': 'mae', 'optimizer': 'adam', 'graph_mode': 'off', 'use_snp_selection': False}. Best is trial 46 with value: 0.07279895725465674.
[I 2025-12-05 16:27:13,959] Trial 115 finished with value: 0.022363690212680455 and parameters: {'model_type': 'mlp', 'hidden_dims': '[256, 128]', 'dropout': 0.3816786586101331, 'batch_norm': True, 'lr': 1.455543260559893e-05, 'weight_decay': 0.00041280445174900985, 'epochs': 140, 'loss': 'mae', 'optimizer': 'adam', 'graph_mode': 'off', 'use_snp_selection': False}. Best is trial 46 with value: 0.07279895725465674.
[I 2025-12-05 16:27:15,132] Trial 116 finished with value: 0.03726208770372307 and parameters: {'model_type': 'mlp', 'hidden_dims': '[512, 128]', 'dropout': 0.28836573765432133, 'batch_norm': True, 'lr': 9.121111769080779e-05, 'weight_decay': 0.0004790638821274909, 'epochs': 112, 'loss': 'mae', 'optimizer': 'adam', 'graph_mode': 'off', 'use_snp_selection': False}. Best is trial 46 with value: 0.07279895725465674.
[I 2025-12-05 16:27:15,943] Trial 117 finished with value: 0.007491405126201349 and parameters: {'model_type': 'mlp', 'hidden_dims': '[256, 128]', 'dropout': 0.3900744165707374, 'batch_norm': True, 'lr': 3.0854280248049545e-05, 'weight_decay': 1.0561899745944915e-05, 'epochs': 69, 'loss': 'mae', 'optimizer': 'adam', 'graph_mode': 'off', 'use_snp_selection': False}. Best is trial 46 with value: 0.07279895725465674.
[I 2025-12-05 16:27:17,064] Trial 118 finished with value: -0.0008818820023669774 and parameters: {'model_type': 'mlp', 'hidden_dims': '[512, 64]', 'dropout': 0.5254293261297451, 'batch_norm': False, 'lr': 0.00016921472785389865, 'weight_decay': 5.173196242980921e-06, 'epochs': 88, 'loss': 'mse', 'optimizer': 'adam', 'graph_mode': 'off', 'use_snp_selection': False}. Best is trial 46 with value: 0.07279895725465674.
[I 2025-12-05 16:27:19,205] Trial 119 finished with value: 0.059499089899600795 and parameters: {'model_type': 'mlp', 'hidden_dims': '[512, 256]', 'dropout': 0.3663358738994537, 'batch_norm': True, 'lr': 7.639224367334281e-05, 'weight_decay': 0.0002829701973502279, 'epochs': 345, 'loss': 'mae', 'optimizer': 'adam', 'graph_mode': 'off', 'use_snp_selection': False}. Best is trial 46 with value: 0.07279895725465674.
[I 2025-12-05 16:27:21,308] Trial 120 finished with value: 0.035710154750148604 and parameters: {'model_type': 'mlp', 'hidden_dims': '[512, 256]', 'dropout': 0.40798486029229536, 'batch_norm': True, 'lr': 7.980156565161243e-05, 'weight_decay': 0.0002624109677890013, 'epochs': 342, 'loss': 'mae', 'optimizer': 'adam', 'graph_mode': 'off', 'use_snp_selection': False}. Best is trial 46 with value: 0.07279895725465674.
[I 2025-12-05 16:27:23,388] Trial 121 finished with value: 0.04940679050659816 and parameters: {'model_type': 'mlp', 'hidden_dims': '[512, 256]', 'dropout': 0.32149725945778435, 'batch_norm': True, 'lr': 6.363027137675715e-05, 'weight_decay': 0.000308149463271242, 'epochs': 333, 'loss': 'mae', 'optimizer': 'adam', 'graph_mode': 'off', 'use_snp_selection': False}. Best is trial 46 with value: 0.07279895725465674.
[I 2025-12-05 16:27:25,414] Trial 122 finished with value: 0.04158028612493874 and parameters: {'model_type': 'mlp', 'hidden_dims': '[512, 256]', 'dropout': 0.36099702055643446, 'batch_norm': True, 'lr': 4.482882174981774e-05, 'weight_decay': 0.00020154104852738219, 'epochs': 319, 'loss': 'mae', 'optimizer': 'adam', 'graph_mode': 'off', 'use_snp_selection': False}. Best is trial 46 with value: 0.07279895725465674.
[I 2025-12-05 16:27:27,549] Trial 123 finished with value: 0.04634264510868006 and parameters: {'model_type': 'mlp', 'hidden_dims': '[512, 256]', 'dropout': 0.3475845450887834, 'batch_norm': True, 'lr': 2.5325105297957486e-05, 'weight_decay': 0.0006196246830535267, 'epochs': 346, 'loss': 'mae', 'optimizer': 'adam', 'graph_mode': 'off', 'use_snp_selection': False}. Best is trial 46 with value: 0.07279895725465674.
[I 2025-12-05 16:27:29,257] Trial 124 finished with value: 0.040566543292423846 and parameters: {'model_type': 'mlp', 'hidden_dims': '[512, 256]', 'dropout': 0.3711314949921842, 'batch_norm': True, 'lr': 2.0899970289109432e-05, 'weight_decay': 0.0001807005219561239, 'epochs': 233, 'loss': 'mae', 'optimizer': 'adam', 'graph_mode': 'off', 'use_snp_selection': False}. Best is trial 46 with value: 0.07279895725465674.
[I 2025-12-05 16:27:30,104] Trial 125 finished with value: 0.0415944515159177 and parameters: {'model_type': 'mlp', 'hidden_dims': '[128, 64]', 'dropout': 0.39715148133007605, 'batch_norm': True, 'lr': 3.7907517843376566e-05, 'weight_decay': 0.0003714628398627516, 'epochs': 152, 'loss': 'mae', 'optimizer': 'adam', 'graph_mode': 'off', 'use_snp_selection': False}. Best is trial 46 with value: 0.07279895725465674.
[I 2025-12-05 16:27:31,439] Trial 126 finished with value: 0.03407591086922987 and parameters: {'model_type': 'mlp', 'hidden_dims': '[256, 128]', 'dropout': 0.33659577503368765, 'batch_norm': False, 'lr': 0.00012918668360253444, 'weight_decay': 0.0005174795682048356, 'epochs': 328, 'loss': 'mae', 'optimizer': 'adam', 'graph_mode': 'off', 'use_snp_selection': False}. Best is trial 46 with value: 0.07279895725465674.
[I 2025-12-05 16:27:32,865] Trial 127 finished with value: 0.06736908532586872 and parameters: {'model_type': 'mlp', 'hidden_dims': '[512, 64]', 'dropout': 0.4587697448830155, 'batch_norm': True, 'lr': 6.719282806893704e-05, 'weight_decay': 0.0007375077196031623, 'epochs': 175, 'loss': 'mae', 'optimizer': 'adam', 'graph_mode': 'off', 'use_snp_selection': False}. Best is trial 46 with value: 0.07279895725465674.
