[I 2025-12-05 15:35:53,085] Trial 121 finished with value: 0.13156677725099647 and parameters: {'model_type': 'mlp', 'hidden_dims': '[512, 256]', 'dropout': 0.17480538015637187, 'batch_norm': True, 'lr': 0.00022033562082752057, 'weight_decay': 1.1232443345086606e-07, 'epochs': 236, 'loss': 'mse', 'optimizer': 'adam', 'graph_mode': 'off', 'use_snp_selection': True, 'num_snps': 26780}. Best is trial 93 with value: 0.13754056954986763.
[I 2025-12-05 15:35:54,933] Trial 122 finished with value: 0.11556901158425822 and parameters: {'model_type': 'mlp', 'hidden_dims': '[512, 256]', 'dropout': 0.16128582156471666, 'batch_norm': True, 'lr': 0.00015521873923292134, 'weight_decay': 1.312629067768125e-07, 'epochs': 207, 'loss': 'mse', 'optimizer': 'adam', 'graph_mode': 'off', 'use_snp_selection': True, 'num_snps': 27476}. Best is trial 93 with value: 0.13754056954986763.
[I 2025-12-05 15:35:56,836] Trial 123 finished with value: 0.12323312244448825 and parameters: {'model_type': 'mlp', 'hidden_dims': '[512, 256]', 'dropout': 0.17213205748075122, 'batch_norm': True, 'lr': 0.0002886898363828698, 'weight_decay': 1.040310974605017e-07, 'epochs': 242, 'loss': 'mse', 'optimizer': 'adam', 'graph_mode': 'off', 'use_snp_selection': True, 'num_snps': 26728}. Best is trial 93 with value: 0.13754056954986763.
[I 2025-12-05 15:35:58,870] Trial 124 finished with value: 0.07735270867703907 and parameters: {'model_type': 'mlp', 'hidden_dims': '[512, 256]', 'dropout': 0.2097852333121099, 'batch_norm': True, 'lr': 7.160632230362128e-06, 'weight_decay': 2.1746526668910673e-07, 'epochs': 265, 'loss': 'mse', 'optimizer': 'adam', 'graph_mode': 'off', 'use_snp_selection': True, 'num_snps': 28525}. Best is trial 93 with value: 0.13754056954986763.
[I 2025-12-05 15:36:01,122] Trial 125 finished with value: 0.12875077714404315 and parameters: {'model_type': 'mlp', 'hidden_dims': '[512, 256]', 'dropout': 0.21919301772900698, 'batch_norm': True, 'lr': 0.0002447951252829259, 'weight_decay': 1.5139924740509463e-07, 'epochs': 252, 'loss': 'mse', 'optimizer': 'adam', 'graph_mode': 'off', 'use_snp_selection': True, 'num_snps': 33614}. Best is trial 93 with value: 0.13754056954986763.
[I 2025-12-05 15:36:03,221] Trial 126 finished with value: 0.11562564305148967 and parameters: {'model_type': 'mlp', 'hidden_dims': '[512, 256]', 'dropout': 0.25162743712707253, 'batch_norm': True, 'lr': 0.0003158556624660936, 'weight_decay': 5.684898506546178e-07, 'epochs': 238, 'loss': 'mse', 'optimizer': 'adam', 'graph_mode': 'off', 'use_snp_selection': True, 'num_snps': 31398}. Best is trial 93 with value: 0.13754056954986763.
[I 2025-12-05 15:36:04,561] Trial 127 finished with value: 0.09766581434618091 and parameters: {'model_type': 'mlp', 'hidden_dims': '[256, 128, 64]', 'dropout': 0.1860009798291123, 'batch_norm': True, 'lr': 0.00017368714209223786, 'weight_decay': 1.24912199134841e-07, 'epochs': 133, 'loss': 'mse', 'optimizer': 'adam', 'graph_mode': 'off', 'use_snp_selection': True, 'num_snps': 17758}. Best is trial 93 with value: 0.13754056954986763.
[I 2025-12-05 15:36:06,057] Trial 128 finished with value: 0.1376755675112636 and parameters: {'model_type': 'mlp', 'hidden_dims': '[512, 256]', 'dropout': 0.1986976302511123, 'batch_norm': True, 'lr': 0.00044541283819887116, 'weight_decay': 2.615682407294083e-07, 'epochs': 101, 'loss': 'mse', 'optimizer': 'adam', 'graph_mode': 'off', 'use_snp_selection': True, 'num_snps': 23319}. Best is trial 128 with value: 0.1376755675112636.
[I 2025-12-05 15:36:07,548] Trial 129 finished with value: 0.13205450629360402 and parameters: {'model_type': 'mlp', 'hidden_dims': '[512, 256]', 'dropout': 0.12606577577848585, 'batch_norm': True, 'lr': 0.0005868793904244596, 'weight_decay': 2.3187368085999142e-07, 'epochs': 94, 'loss': 'mse', 'optimizer': 'adam', 'graph_mode': 'off', 'use_snp_selection': True, 'num_snps': 22694}. Best is trial 128 with value: 0.1376755675112636.
[I 2025-12-05 15:36:08,875] Trial 130 finished with value: 0.12155152188810131 and parameters: {'model_type': 'mlp', 'hidden_dims': '[512, 256]', 'dropout': 0.19672629494816243, 'batch_norm': True, 'lr': 0.0006066823574374675, 'weight_decay': 2.386113007596489e-07, 'epochs': 53, 'loss': 'mse', 'optimizer': 'adam', 'graph_mode': 'off', 'use_snp_selection': True, 'num_snps': 21861}. Best is trial 128 with value: 0.1376755675112636.
[I 2025-12-05 15:36:10,251] Trial 131 finished with value: 0.11890390833248994 and parameters: {'model_type': 'mlp', 'hidden_dims': '[512, 256]', 'dropout': 0.12859644405563245, 'batch_norm': True, 'lr': 0.0004164917973435066, 'weight_decay': 1.9460137234244159e-07, 'epochs': 98, 'loss': 'mse', 'optimizer': 'adam', 'graph_mode': 'off', 'use_snp_selection': True, 'num_snps': 19961}. Best is trial 128 with value: 0.1376755675112636.
[I 2025-12-05 15:36:11,781] Trial 132 finished with value: 0.12204736125708093 and parameters: {'model_type': 'mlp', 'hidden_dims': '[512, 256]', 'dropout': 0.11201429901291295, 'batch_norm': True, 'lr': 0.00048134425506482986, 'weight_decay': 2.961411781901695e-07, 'epochs': 108, 'loss': 'mse', 'optimizer': 'adam', 'graph_mode': 'off', 'use_snp_selection': True, 'num_snps': 23415}. Best is trial 128 with value: 0.1376755675112636.
[I 2025-12-05 15:36:13,341] Trial 133 finished with value: 0.12981906222982004 and parameters: {'model_type': 'mlp', 'hidden_dims': '[512, 256]', 'dropout': 0.14873062047881608, 'batch_norm': True, 'lr': 0.000755736738213278, 'weight_decay': 1.6461622054189407e-07, 'epochs': 90, 'loss': 'mse', 'optimizer': 'adam', 'graph_mode': 'off', 'use_snp_selection': True, 'num_snps': 24898}. Best is trial 128 with value: 0.1376755675112636.
[I 2025-12-05 15:36:14,851] Trial 134 finished with value: 0.12959877400423653 and parameters: {'model_type': 'mlp', 'hidden_dims': '[512, 256]', 'dropout': 0.15214570136086253, 'batch_norm': True, 'lr': 0.0008034305624406657, 'weight_decay': 1.8070700351184561e-07, 'epochs': 86, 'loss': 'mse', 'optimizer': 'adam', 'graph_mode': 'off', 'use_snp_selection': True, 'num_snps': 25123}. Best is trial 128 with value: 0.1376755675112636.
[I 2025-12-05 15:36:16,265] Trial 135 finished with value: 0.1125144373545455 and parameters: {'model_type': 'mlp', 'hidden_dims': '[512, 256]', 'dropout': 0.12855452419894986, 'batch_norm': True, 'lr': 0.000674860184062802, 'weight_decay': 3.770889695176975e-07, 'epochs': 77, 'loss': 'mse', 'optimizer': 'adam', 'graph_mode': 'off', 'use_snp_selection': True, 'num_snps': 21686}. Best is trial 128 with value: 0.1376755675112636.
[I 2025-12-05 15:36:17,690] Trial 136 finished with value: 0.12393651403601585 and parameters: {'model_type': 'mlp', 'hidden_dims': '[512, 128]', 'dropout': 0.13945136777996509, 'batch_norm': True, 'lr': 0.0005335572224533126, 'weight_decay': 2.427617371492546e-07, 'epochs': 69, 'loss': 'mse', 'optimizer': 'adam', 'graph_mode': 'off', 'use_snp_selection': True, 'num_snps': 23066}. Best is trial 128 with value: 0.1376755675112636.
[I 2025-12-05 15:36:19,266] Trial 137 finished with value: 0.1257488827072737 and parameters: {'model_type': 'mlp', 'hidden_dims': '[512, 256]', 'dropout': 0.17453149646925498, 'batch_norm': True, 'lr': 0.0005792208057593533, 'weight_decay': 1.20003354073046e-07, 'epochs': 103, 'loss': 'mse', 'optimizer': 'adam', 'graph_mode': 'off', 'use_snp_selection': True, 'num_snps': 24564}. Best is trial 128 with value: 0.1376755675112636.
[I 2025-12-05 15:36:20,812] Trial 138 finished with value: 0.11791749060754232 and parameters: {'model_type': 'mlp', 'hidden_dims': '[512, 64]', 'dropout': 0.18368629165888026, 'batch_norm': True, 'lr': 0.0007688134388869088, 'weight_decay': 1.0201627292804617e-07, 'epochs': 87, 'loss': 'mse', 'optimizer': 'adam', 'graph_mode': 'off', 'use_snp_selection': True, 'num_snps': 25852}. Best is trial 128 with value: 0.1376755675112636.
[I 2025-12-05 15:36:22,152] Trial 139 finished with value: 0.125677188286996 and parameters: {'model_type': 'mlp', 'hidden_dims': '[512, 256]', 'dropout': 0.19914414897339108, 'batch_norm': True, 'lr': 0.0008743181476468664, 'weight_decay': 1.7616382021127593e-07, 'epochs': 118, 'loss': 'mse', 'optimizer': 'adam', 'graph_mode': 'off', 'use_snp_selection': False}. Best is trial 128 with value: 0.1376755675112636.
[I 2025-12-05 15:36:23,799] Trial 140 finished with value: 0.12875938503211726 and parameters: {'model_type': 'mlp', 'hidden_dims': '[512, 256]', 'dropout': 0.145493856200844, 'batch_norm': True, 'lr': 0.00046747502756710666, 'weight_decay': 2.8857204560305734e-07, 'epochs': 98, 'loss': 'mse', 'optimizer': 'adam', 'graph_mode': 'off', 'use_snp_selection': True, 'num_snps': 27162}. Best is trial 128 with value: 0.1376755675112636.
[I 2025-12-05 15:36:25,476] Trial 141 finished with value: 0.11867617351091336 and parameters: {'model_type': 'mlp', 'hidden_dims': '[512, 256]', 'dropout': 0.1488763598234712, 'batch_norm': True, 'lr': 0.0007934476680134606, 'weight_decay': 2.017037023683021e-07, 'epochs': 81, 'loss': 'mse', 'optimizer': 'adam', 'graph_mode': 'off', 'use_snp_selection': True, 'num_snps': 28799}. Best is trial 128 with value: 0.1376755675112636.
[I 2025-12-05 15:36:26,985] Trial 142 finished with value: 0.11994351836159514 and parameters: {'model_type': 'mlp', 'hidden_dims': '[512, 256]', 'dropout': 0.1594879932842178, 'batch_norm': True, 'lr': 0.0006721542888071959, 'weight_decay': 1.6299166330592374e-07, 'epochs': 72, 'loss': 'mse', 'optimizer': 'adam', 'graph_mode': 'off', 'use_snp_selection': True, 'num_snps': 25444}. Best is trial 128 with value: 0.1376755675112636.
[I 2025-12-05 15:36:28,310] Trial 143 finished with value: 0.11590449371338564 and parameters: {'model_type': 'mlp', 'hidden_dims': '[512, 256]', 'dropout': 0.10461822443953661, 'batch_norm': True, 'lr': 0.0009635614735884544, 'weight_decay': 1.360228223822693e-07, 'epochs': 86, 'loss': 'mse', 'optimizer': 'adam', 'graph_mode': 'off', 'use_snp_selection': True, 'num_snps': 20479}. Best is trial 128 with value: 0.1376755675112636.
[I 2025-12-05 15:36:29,832] Trial 144 finished with value: 0.11803361779120339 and parameters: {'model_type': 'mlp', 'hidden_dims': '[512, 256]', 'dropout': 0.16606558146599085, 'batch_norm': True, 'lr': 0.00039310832661127994, 'weight_decay': 2.1812972256331347e-07, 'epochs': 94, 'loss': 'mse', 'optimizer': 'adam', 'graph_mode': 'off', 'use_snp_selection': True, 'num_snps': 24222}. Best is trial 128 with value: 0.1376755675112636.
[I 2025-12-05 15:36:31,123] Trial 145 finished with value: 0.1298052333971552 and parameters: {'model_type': 'mlp', 'hidden_dims': '[512, 256]', 'dropout': 0.20604380587709795, 'batch_norm': True, 'lr': 0.0005675482594997836, 'weight_decay': 1.7966573028926272e-07, 'epochs': 69, 'loss': 'mse', 'optimizer': 'adam', 'graph_mode': 'off', 'use_snp_selection': True, 'num_snps': 18925}. Best is trial 128 with value: 0.1376755675112636.
[I 2025-12-05 15:36:32,447] Trial 146 finished with value: 0.11977353328017719 and parameters: {'model_type': 'mlp', 'hidden_dims': '[512, 256]', 'dropout': 0.2063439460269525, 'batch_norm': True, 'lr': 0.0005836290586835754, 'weight_decay': 3.451873587214918e-07, 'epochs': 71, 'loss': 'mse', 'optimizer': 'adam', 'graph_mode': 'off', 'use_snp_selection': True, 'num_snps': 18776}. Best is trial 128 with value: 0.1376755675112636.
[I 2025-12-05 15:36:33,548] Trial 147 finished with value: 0.08479084272133568 and parameters: {'model_type': 'mlp', 'hidden_dims': '[256, 128]', 'dropout': 0.22920503315594673, 'batch_norm': False, 'lr': 0.00046405313213559383, 'weight_decay': 2.5249262638598736e-07, 'epochs': 41, 'loss': 'mse', 'optimizer': 'adam', 'graph_mode': 'off', 'use_snp_selection': True, 'num_snps': 16501}. Best is trial 128 with value: 0.1376755675112636.
[I 2025-12-05 15:36:34,637] Trial 148 finished with value: 0.11934468886457264 and parameters: {'model_type': 'mlp', 'hidden_dims': '[512, 256]', 'dropout': 0.2163967730710266, 'batch_norm': True, 'lr': 0.00036173940476933754, 'weight_decay': 1.4512010458962413e-07, 'epochs': 64, 'loss': 'mse', 'optimizer': 'adam', 'graph_mode': 'off', 'use_snp_selection': True, 'num_snps': 13609}. Best is trial 128 with value: 0.1376755675112636.
[I 2025-12-05 15:36:36,376] Trial 149 finished with value: 0.11716396099006829 and parameters: {'model_type': 'mlp', 'hidden_dims': '[512, 256]', 'dropout': 0.19099852613198642, 'batch_norm': True, 'lr': 0.0005319452876072443, 'weight_decay': 4.4667561549761264e-07, 'epochs': 230, 'loss': 'mse', 'optimizer': 'adam', 'graph_mode': 'off', 'use_snp_selection': True, 'num_snps': 22457}. Best is trial 128 with value: 0.1376755675112636.
[I 2025-12-05 15:36:38,649] Trial 0 finished with value: 0.04750022744981465 and parameters: {'model_type': 'mlp', 'hidden_dims': '[128, 64]', 'dropout': 0.199031432379812, 'batch_norm': True, 'lr': 1.8408544111075837e-06, 'weight_decay': 5.5136510071208614e-05, 'epochs': 336, 'loss': 'mae', 'optimizer': 'adam', 'graph_mode': 'off', 'use_snp_selection': True, 'num_snps': 43862}. Best is trial 0 with value: 0.04750022744981465.
[I 2025-12-05 15:36:39,847] Trial 1 finished with value: 0.11114862351319998 and parameters: {'model_type': 'mlp', 'hidden_dims': '[256, 128]', 'dropout': 0.4370668075331726, 'batch_norm': True, 'lr': 7.133471581159139e-05, 'weight_decay': 1.128633586803549e-05, 'epochs': 242, 'loss': 'mae', 'optimizer': 'adam', 'graph_mode': 'off', 'use_snp_selection': False}. Best is trial 1 with value: 0.11114862351319998.
[I 2025-12-05 15:36:40,876] Trial 2 finished with value: 0.03999210787665635 and parameters: {'model_type': 'mlp', 'hidden_dims': '[256, 128, 64]', 'dropout': 0.41314357415569625, 'batch_norm': False, 'lr': 3.952233718592101e-06, 'weight_decay': 0.00026754769258252603, 'epochs': 149, 'loss': 'mse', 'optimizer': 'adam', 'graph_mode': 'off', 'use_snp_selection': True, 'num_snps': 11571}. Best is trial 1 with value: 0.11114862351319998.
[I 2025-12-05 15:36:42,831] Trial 3 finished with value: 0.06558172659876496 and parameters: {'model_type': 'mlp', 'hidden_dims': '[512, 64]', 'dropout': 0.5938127374509361, 'batch_norm': False, 'lr': 5.67704586114731e-06, 'weight_decay': 2.4518087630137052e-05, 'epochs': 320, 'loss': 'mae', 'optimizer': 'adam', 'graph_mode': 'off', 'use_snp_selection': False}. Best is trial 1 with value: 0.11114862351319998.
[I 2025-12-05 15:36:45,065] Trial 4 finished with value: 0.03641139076517355 and parameters: {'model_type': 'mlp', 'hidden_dims': '[512, 128]', 'dropout': 0.25746343592134413, 'batch_norm': True, 'lr': 1.3467657668402788e-06, 'weight_decay': 0.00033087251918647806, 'epochs': 277, 'loss': 'mse', 'optimizer': 'adam', 'graph_mode': 'off', 'use_snp_selection': True, 'num_snps': 36675}. Best is trial 1 with value: 0.11114862351319998.
[I 2025-12-05 15:36:46,809] Trial 5 finished with value: 0.044870411068818325 and parameters: {'model_type': 'mlp', 'hidden_dims': '[512, 64]', 'dropout': 0.38275350994408375, 'batch_norm': True, 'lr': 1.5586664309232824e-06, 'weight_decay': 0.0008227664668621182, 'epochs': 145, 'loss': 'mae', 'optimizer': 'adam', 'graph_mode': 'off', 'use_snp_selection': True, 'num_snps': 32148}. Best is trial 1 with value: 0.11114862351319998.
[I 2025-12-05 15:36:47,854] Trial 6 finished with value: 0.0873150834097552 and parameters: {'model_type': 'mlp', 'hidden_dims': '[256, 128]', 'dropout': 0.3930109900265879, 'batch_norm': False, 'lr': 4.892964372128395e-05, 'weight_decay': 1.5809549317992182e-06, 'epochs': 199, 'loss': 'mse', 'optimizer': 'adam', 'graph_mode': 'off', 'use_snp_selection': False}. Best is trial 1 with value: 0.11114862351319998.
[I 2025-12-05 15:36:48,986] Trial 7 finished with value: 0.10339755015782062 and parameters: {'model_type': 'mlp', 'hidden_dims': '[512, 256]', 'dropout': 0.15343979219678458, 'batch_norm': True, 'lr': 6.234003099047341e-05, 'weight_decay': 3.894760610535477e-07, 'epochs': 97, 'loss': 'mse', 'optimizer': 'adam', 'graph_mode': 'off', 'use_snp_selection': False}. Best is trial 1 with value: 0.11114862351319998.
[I 2025-12-05 15:36:50,939] Trial 8 finished with value: 0.11763285420585988 and parameters: {'model_type': 'mlp', 'hidden_dims': '[512, 128]', 'dropout': 0.10743001231661406, 'batch_norm': True, 'lr': 0.00023728538449271062, 'weight_decay': 1.7629071578048637e-05, 'epochs': 312, 'loss': 'mae', 'optimizer': 'adam', 'graph_mode': 'off', 'use_snp_selection': False}. Best is trial 8 with value: 0.11763285420585988.
[I 2025-12-05 15:36:52,344] Trial 9 finished with value: 0.11217295645372238 and parameters: {'model_type': 'mlp', 'hidden_dims': '[512, 64]', 'dropout': 0.14505336736221927, 'batch_norm': True, 'lr': 5.8619638388111826e-05, 'weight_decay': 6.200156172669308e-07, 'epochs': 175, 'loss': 'mse', 'optimizer': 'adam', 'graph_mode': 'off', 'use_snp_selection': False}. Best is trial 8 with value: 0.11763285420585988.
[I 2025-12-05 15:36:53,302] Trial 10 finished with value: 0.06734043646475477 and parameters: {'model_type': 'mlp', 'hidden_dims': '[512, 128]', 'dropout': 0.2800030442581858, 'batch_norm': False, 'lr': 0.0004919806695968258, 'weight_decay': 2.9953888095455486e-06, 'epochs': 55, 'loss': 'mae', 'optimizer': 'adam', 'graph_mode': 'off', 'use_snp_selection': False}. Best is trial 8 with value: 0.11763285420585988.
[I 2025-12-05 15:36:54,883] Trial 11 finished with value: 0.107241480677424 and parameters: {'model_type': 'mlp', 'hidden_dims': '[512, 128]', 'dropout': 0.10095648685224448, 'batch_norm': True, 'lr': 0.0003411435764085616, 'weight_decay': 1.2045055692919657e-07, 'epochs': 216, 'loss': 'mse', 'optimizer': 'adam', 'graph_mode': 'off', 'use_snp_selection': False}. Best is trial 8 with value: 0.11763285420585988.
[I 2025-12-05 15:36:56,692] Trial 12 finished with value: 0.11349444378808421 and parameters: {'model_type': 'mlp', 'hidden_dims': '[512, 64]', 'dropout': 0.10344600881777158, 'batch_norm': True, 'lr': 0.00018400807026440393, 'weight_decay': 2.071258764988014e-06, 'epochs': 281, 'loss': 'mae', 'optimizer': 'adam', 'graph_mode': 'off', 'use_snp_selection': False}. Best is trial 8 with value: 0.11763285420585988.
[I 2025-12-05 15:36:57,701] Trial 13 finished with value: 0.10775888003349049 and parameters: {'model_type': 'mlp', 'hidden_dims': '[128, 64]', 'dropout': 0.24294613148916022, 'batch_norm': True, 'lr': 0.00020209017454184854, 'weight_decay': 4.439089487662099e-06, 'epochs': 285, 'loss': 'mae', 'optimizer': 'adam', 'graph_mode': 'off', 'use_snp_selection': False}. Best is trial 8 with value: 0.11763285420585988.
[I 2025-12-05 15:36:58,942] Trial 14 finished with value: 0.10612385242820006 and parameters: {'model_type': 'mlp', 'hidden_dims': '[256, 128, 64]', 'dropout': 0.3221595656802847, 'batch_norm': True, 'lr': 0.0008417026281429627, 'weight_decay': 5.724103314313124e-05, 'epochs': 282, 'loss': 'mae', 'optimizer': 'adam', 'graph_mode': 'off', 'use_snp_selection': False}. Best is trial 8 with value: 0.11763285420585988.
[I 2025-12-05 15:37:00,682] Trial 15 finished with value: 0.13579569764987007 and parameters: {'model_type': 'mlp', 'hidden_dims': '[512, 256]', 'dropout': 0.10515697852451877, 'batch_norm': True, 'lr': 0.0001572871022003765, 'weight_decay': 1.2913386141637801e-05, 'epochs': 254, 'loss': 'mae', 'optimizer': 'adam', 'graph_mode': 'off', 'use_snp_selection': False}. Best is trial 15 with value: 0.13579569764987007.
[I 2025-12-05 15:37:02,757] Trial 16 finished with value: 0.14105610079653463 and parameters: {'model_type': 'mlp', 'hidden_dims': '[512, 256]', 'dropout': 0.1930554518103474, 'batch_norm': True, 'lr': 2.1517090787442848e-05, 'weight_decay': 1.5410574496034664e-05, 'epochs': 350, 'loss': 'mae', 'optimizer': 'adam', 'graph_mode': 'off', 'use_snp_selection': False}. Best is trial 16 with value: 0.14105610079653463.
[I 2025-12-05 15:37:04,856] Trial 17 finished with value: 0.06937231559039385 and parameters: {'model_type': 'mlp', 'hidden_dims': '[512, 256]', 'dropout': 0.17958502443247115, 'batch_norm': True, 'lr': 1.2647807396981942e-05, 'weight_decay': 6.449959055330151e-05, 'epochs': 350, 'loss': 'mae', 'optimizer': 'adam', 'graph_mode': 'off', 'use_snp_selection': False}. Best is trial 16 with value: 0.14105610079653463.
[I 2025-12-05 15:37:08,044] Trial 18 finished with value: 0.10654624167205881 and parameters: {'model_type': 'mlp', 'hidden_dims': '[512, 256]', 'dropout': 0.5098431992326697, 'batch_norm': False, 'lr': 2.602518011640583e-05, 'weight_decay': 7.956555163835118e-06, 'epochs': 241, 'loss': 'mae', 'optimizer': 'adam', 'graph_mode': 'off', 'use_snp_selection': True, 'num_snps': 58241}. Best is trial 16 with value: 0.14105610079653463.
[I 2025-12-05 15:37:09,803] Trial 19 finished with value: 0.09342056338831453 and parameters: {'model_type': 'mlp', 'hidden_dims': '[512, 256]', 'dropout': 0.2188165531710541, 'batch_norm': True, 'lr': 2.2667527159931726e-05, 'weight_decay': 0.00018460747760263216, 'epochs': 249, 'loss': 'mae', 'optimizer': 'adam', 'graph_mode': 'off', 'use_snp_selection': False}. Best is trial 16 with value: 0.14105610079653463.
[I 2025-12-05 15:37:11,021] Trial 20 finished with value: 0.12057785200360538 and parameters: {'model_type': 'mlp', 'hidden_dims': '[512, 256]', 'dropout': 0.31210475580753505, 'batch_norm': True, 'lr': 1.229246530856131e-05, 'weight_decay': 2.417613357794622e-05, 'epochs': 113, 'loss': 'mae', 'optimizer': 'adam', 'graph_mode': 'off', 'use_snp_selection': False}. Best is trial 16 with value: 0.14105610079653463.
[I 2025-12-05 15:37:12,023] Trial 21 finished with value: 0.06152536961908674 and parameters: {'model_type': 'mlp', 'hidden_dims': '[512, 256]', 'dropout': 0.3081808672297337, 'batch_norm': True, 'lr': 9.098146157256033e-06, 'weight_decay': 2.7398497168878922e-05, 'epochs': 63, 'loss': 'mae', 'optimizer': 'adam', 'graph_mode': 'off', 'use_snp_selection': False}. Best is trial 16 with value: 0.14105610079653463.
