[I 2025-12-05 15:45:18,543] Trial 30 finished with value: 0.029680699368534347 and parameters: {'model_type': 'mlp', 'hidden_dims': '[256, 128, 64]', 'dropout': 0.20184111176631303, 'batch_norm': True, 'lr': 2.004602824470094e-05, 'weight_decay': 6.161367985670939e-07, 'epochs': 220, 'loss': 'mse', 'optimizer': 'adam', 'graph_mode': 'off', 'use_snp_selection': False}. Best is trial 25 with value: 0.0824597717905614.
[I 2025-12-05 15:45:20,648] Trial 31 finished with value: 0.040958494332827715 and parameters: {'model_type': 'mlp', 'hidden_dims': '[512, 64]', 'dropout': 0.18360382565367261, 'batch_norm': True, 'lr': 4.807370595302431e-05, 'weight_decay': 7.568504057136291e-07, 'epochs': 347, 'loss': 'mse', 'optimizer': 'adam', 'graph_mode': 'off', 'use_snp_selection': False}. Best is trial 25 with value: 0.0824597717905614.
[I 2025-12-05 15:45:22,403] Trial 32 finished with value: 0.06312023973763535 and parameters: {'model_type': 'mlp', 'hidden_dims': '[512, 64]', 'dropout': 0.19330401871895697, 'batch_norm': True, 'lr': 0.0006186709369089784, 'weight_decay': 1.9474638761906995e-07, 'epochs': 248, 'loss': 'mse', 'optimizer': 'adam', 'graph_mode': 'off', 'use_snp_selection': False}. Best is trial 25 with value: 0.0824597717905614.
[I 2025-12-05 15:45:24,151] Trial 33 finished with value: 0.059311955163278744 and parameters: {'model_type': 'mlp', 'hidden_dims': '[512, 64]', 'dropout': 0.13710055438841184, 'batch_norm': True, 'lr': 0.0002611037014841862, 'weight_decay': 2.0843666633530163e-07, 'epochs': 246, 'loss': 'mse', 'optimizer': 'adam', 'graph_mode': 'off', 'use_snp_selection': False}. Best is trial 25 with value: 0.0824597717905614.
[I 2025-12-05 15:45:25,922] Trial 34 finished with value: 0.06489804214770596 and parameters: {'model_type': 'mlp', 'hidden_dims': '[512, 64]', 'dropout': 0.24671991787190384, 'batch_norm': True, 'lr': 0.00016203503789176589, 'weight_decay': 1.703253290719826e-07, 'epochs': 260, 'loss': 'mae', 'optimizer': 'adam', 'graph_mode': 'off', 'use_snp_selection': False}. Best is trial 25 with value: 0.0824597717905614.
[I 2025-12-05 15:45:27,834] Trial 35 finished with value: 0.058661888716312775 and parameters: {'model_type': 'mlp', 'hidden_dims': '[512, 64]', 'dropout': 0.2879421300106198, 'batch_norm': False, 'lr': 0.00015849088512894584, 'weight_decay': 1.1471875267925722e-07, 'epochs': 297, 'loss': 'mae', 'optimizer': 'adam', 'graph_mode': 'off', 'use_snp_selection': False}. Best is trial 25 with value: 0.0824597717905614.
[I 2025-12-05 15:45:30,671] Trial 36 finished with value: 0.04196957189377812 and parameters: {'model_type': 'mlp', 'hidden_dims': '[256, 128]', 'dropout': 0.24077609656227966, 'batch_norm': True, 'lr': 8.477231260587175e-05, 'weight_decay': 1.0687295154404784e-05, 'epochs': 265, 'loss': 'mae', 'optimizer': 'adam', 'graph_mode': 'off', 'use_snp_selection': True, 'num_snps': 58661}. Best is trial 25 with value: 0.0824597717905614.
[I 2025-12-05 15:45:32,338] Trial 37 finished with value: 0.019015174230542768 and parameters: {'model_type': 'mlp', 'hidden_dims': '[512, 64]', 'dropout': 0.37013579454839035, 'batch_norm': True, 'lr': 4.446294938689996e-06, 'weight_decay': 2.413639443341734e-05, 'epochs': 204, 'loss': 'mae', 'optimizer': 'adam', 'graph_mode': 'off', 'use_snp_selection': False}. Best is trial 25 with value: 0.0824597717905614.
[I 2025-12-05 15:45:33,824] Trial 38 finished with value: 0.05056756964926205 and parameters: {'model_type': 'mlp', 'hidden_dims': '[256, 128, 64]', 'dropout': 0.24569757242663579, 'batch_norm': False, 'lr': 5.1600284721746316e-05, 'weight_decay': 3.9958105153981186e-07, 'epochs': 234, 'loss': 'mae', 'optimizer': 'adam', 'graph_mode': 'off', 'use_snp_selection': True, 'num_snps': 19911}. Best is trial 25 with value: 0.0824597717905614.
[I 2025-12-05 15:45:35,845] Trial 39 finished with value: 0.013719619069789524 and parameters: {'model_type': 'mlp', 'hidden_dims': '[512, 64]', 'dropout': 0.4246116819735686, 'batch_norm': True, 'lr': 8.026509099386485e-06, 'weight_decay': 0.00010412398872024448, 'epochs': 328, 'loss': 'mae', 'optimizer': 'adam', 'graph_mode': 'off', 'use_snp_selection': False}. Best is trial 25 with value: 0.0824597717905614.
[I 2025-12-05 15:45:37,739] Trial 40 finished with value: 0.054610718311603725 and parameters: {'model_type': 'mlp', 'hidden_dims': '[512, 256]', 'dropout': 0.2807533208687125, 'batch_norm': True, 'lr': 6.422869309255336e-05, 'weight_decay': 2.500624635786492e-07, 'epochs': 284, 'loss': 'mae', 'optimizer': 'adam', 'graph_mode': 'off', 'use_snp_selection': False}. Best is trial 25 with value: 0.0824597717905614.
[I 2025-12-05 15:45:39,485] Trial 41 finished with value: 0.007906120922870487 and parameters: {'model_type': 'mlp', 'hidden_dims': '[512, 64]', 'dropout': 0.20400068952112893, 'batch_norm': True, 'lr': 2.320370617557869e-06, 'weight_decay': 1.5901096494206887e-07, 'epochs': 249, 'loss': 'mse', 'optimizer': 'adam', 'graph_mode': 'off', 'use_snp_selection': False}. Best is trial 25 with value: 0.0824597717905614.
[I 2025-12-05 15:45:41,302] Trial 42 finished with value: 0.054626099167309976 and parameters: {'model_type': 'mlp', 'hidden_dims': '[512, 64]', 'dropout': 0.1608671477290821, 'batch_norm': True, 'lr': 0.00030499344223158874, 'weight_decay': 3.072187697856463e-07, 'epochs': 266, 'loss': 'mse', 'optimizer': 'adam', 'graph_mode': 'off', 'use_snp_selection': False}. Best is trial 25 with value: 0.0824597717905614.
[I 2025-12-05 15:45:43,280] Trial 43 finished with value: 0.060663052146895 and parameters: {'model_type': 'mlp', 'hidden_dims': '[512, 64]', 'dropout': 0.13046331003429898, 'batch_norm': True, 'lr': 0.00010050131657217954, 'weight_decay': 1.0569242182593352e-07, 'epochs': 306, 'loss': 'mae', 'optimizer': 'adam', 'graph_mode': 'off', 'use_snp_selection': False}. Best is trial 25 with value: 0.0824597717905614.
[I 2025-12-05 15:45:44,959] Trial 44 finished with value: 0.06161114691324062 and parameters: {'model_type': 'mlp', 'hidden_dims': '[512, 64]', 'dropout': 0.17273295648922, 'batch_norm': True, 'lr': 0.00014818305934458225, 'weight_decay': 1.5750139102520152e-06, 'epochs': 232, 'loss': 'mse', 'optimizer': 'adam', 'graph_mode': 'off', 'use_snp_selection': False}. Best is trial 25 with value: 0.0824597717905614.
[I 2025-12-05 15:45:46,517] Trial 45 finished with value: 0.060588703676286264 and parameters: {'model_type': 'mlp', 'hidden_dims': '[512, 128]', 'dropout': 0.1209637568453093, 'batch_norm': True, 'lr': 0.0006014751295726006, 'weight_decay': 1.7959647527253642e-07, 'epochs': 198, 'loss': 'mse', 'optimizer': 'adam', 'graph_mode': 'off', 'use_snp_selection': False}. Best is trial 25 with value: 0.0824597717905614.
[I 2025-12-05 15:45:47,781] Trial 46 finished with value: 0.0630299377236497 and parameters: {'model_type': 'mlp', 'hidden_dims': '[256, 128]', 'dropout': 0.19971570200889172, 'batch_norm': False, 'lr': 2.3004712472628565e-05, 'weight_decay': 5.252194681211013e-07, 'epochs': 286, 'loss': 'mae', 'optimizer': 'adam', 'graph_mode': 'off', 'use_snp_selection': False}. Best is trial 25 with value: 0.0824597717905614.
[I 2025-12-05 15:45:49,563] Trial 47 finished with value: 0.03127940830549623 and parameters: {'model_type': 'mlp', 'hidden_dims': '[512, 64]', 'dropout': 0.2577310256444136, 'batch_norm': True, 'lr': 4.213868661367746e-05, 'weight_decay': 0.0002577508138934835, 'epochs': 256, 'loss': 'mse', 'optimizer': 'adam', 'graph_mode': 'off', 'use_snp_selection': False}. Best is trial 25 with value: 0.0824597717905614.
[I 2025-12-05 15:45:50,601] Trial 48 finished with value: 0.059710754554014346 and parameters: {'model_type': 'mlp', 'hidden_dims': '[256, 128, 64]', 'dropout': 0.3257377013663872, 'batch_norm': True, 'lr': 0.00035917599314910244, 'weight_decay': 7.660115947814809e-06, 'epochs': 179, 'loss': 'mse', 'optimizer': 'adam', 'graph_mode': 'off', 'use_snp_selection': False}. Best is trial 25 with value: 0.0824597717905614.
[I 2025-12-05 15:45:52,882] Trial 49 finished with value: 0.049902116388168105 and parameters: {'model_type': 'mlp', 'hidden_dims': '[128, 64]', 'dropout': 0.21022505254831927, 'batch_norm': True, 'lr': 0.00025779493214646813, 'weight_decay': 2.0796610922791864e-06, 'epochs': 156, 'loss': 'mae', 'optimizer': 'adam', 'graph_mode': 'off', 'use_snp_selection': True, 'num_snps': 46888}. Best is trial 25 with value: 0.0824597717905614.
[I 2025-12-05 15:45:54,591] Trial 50 finished with value: 0.05952601442634769 and parameters: {'model_type': 'mlp', 'hidden_dims': '[512, 128]', 'dropout': 0.4579193794196349, 'batch_norm': True, 'lr': 0.0007179804247049982, 'weight_decay': 1.181527236362738e-06, 'epochs': 220, 'loss': 'mse', 'optimizer': 'adam', 'graph_mode': 'off', 'use_snp_selection': False}. Best is trial 25 with value: 0.0824597717905614.
[I 2025-12-05 15:45:55,812] Trial 51 finished with value: 0.05573192248945569 and parameters: {'model_type': 'mlp', 'hidden_dims': '[256, 128]', 'dropout': 0.1885207465921803, 'batch_norm': False, 'lr': 2.073460892137056e-05, 'weight_decay': 4.785801508548116e-07, 'epochs': 280, 'loss': 'mae', 'optimizer': 'adam', 'graph_mode': 'off', 'use_snp_selection': False}. Best is trial 25 with value: 0.0824597717905614.
[I 2025-12-05 15:45:57,106] Trial 52 finished with value: 0.03652441439069178 and parameters: {'model_type': 'mlp', 'hidden_dims': '[256, 128]', 'dropout': 0.22422919438270741, 'batch_norm': False, 'lr': 1.5198408876926289e-05, 'weight_decay': 5.140683223917916e-07, 'epochs': 291, 'loss': 'mae', 'optimizer': 'adam', 'graph_mode': 'off', 'use_snp_selection': False}. Best is trial 25 with value: 0.0824597717905614.
[I 2025-12-05 15:45:58,444] Trial 53 finished with value: 0.07743733351451632 and parameters: {'model_type': 'mlp', 'hidden_dims': '[256, 128]', 'dropout': 0.16420961650583632, 'batch_norm': False, 'lr': 5.814477279436835e-05, 'weight_decay': 2.4405453542290857e-07, 'epochs': 317, 'loss': 'mae', 'optimizer': 'adam', 'graph_mode': 'off', 'use_snp_selection': False}. Best is trial 25 with value: 0.0824597717905614.
[I 2025-12-05 15:45:59,776] Trial 54 finished with value: 0.04561818516417907 and parameters: {'model_type': 'mlp', 'hidden_dims': '[256, 128]', 'dropout': 0.16416936981271862, 'batch_norm': False, 'lr': 6.305408593193415e-05, 'weight_decay': 3.305408184681744e-07, 'epochs': 315, 'loss': 'mae', 'optimizer': 'adam', 'graph_mode': 'off', 'use_snp_selection': False}. Best is trial 25 with value: 0.0824597717905614.
[I 2025-12-05 15:46:01,567] Trial 55 finished with value: 0.04287408325528568 and parameters: {'model_type': 'mlp', 'hidden_dims': '[512, 64]', 'dropout': 0.12016822219286208, 'batch_norm': False, 'lr': 0.00010770064836717657, 'weight_decay': 1.5825398442495196e-07, 'epochs': 272, 'loss': 'mae', 'optimizer': 'adam', 'graph_mode': 'off', 'use_snp_selection': False}. Best is trial 25 with value: 0.0824597717905614.
[I 2025-12-05 15:46:02,979] Trial 56 finished with value: 0.035670268776935965 and parameters: {'model_type': 'mlp', 'hidden_dims': '[256, 128, 64]', 'dropout': 0.5615917849015515, 'batch_norm': False, 'lr': 0.00017263095135715476, 'weight_decay': 2.2966782812918886e-07, 'epochs': 343, 'loss': 'mse', 'optimizer': 'adam', 'graph_mode': 'off', 'use_snp_selection': False}. Best is trial 25 with value: 0.0824597717905614.
[I 2025-12-05 15:46:04,806] Trial 57 finished with value: 0.04776957446057661 and parameters: {'model_type': 'mlp', 'hidden_dims': '[512, 64]', 'dropout': 0.15132440223510396, 'batch_norm': True, 'lr': 0.0009886580681465423, 'weight_decay': 1.5281698035843776e-05, 'epochs': 263, 'loss': 'mse', 'optimizer': 'adam', 'graph_mode': 'off', 'use_snp_selection': False}. Best is trial 25 with value: 0.0824597717905614.
[I 2025-12-05 15:46:06,497] Trial 58 finished with value: 0.05685990594459741 and parameters: {'model_type': 'mlp', 'hidden_dims': '[512, 256]', 'dropout': 0.11329378200482787, 'batch_norm': True, 'lr': 0.0002105705063560361, 'weight_decay': 1.472605848116405e-07, 'epochs': 238, 'loss': 'mae', 'optimizer': 'adam', 'graph_mode': 'off', 'use_snp_selection': False}. Best is trial 25 with value: 0.0824597717905614.
[I 2025-12-05 15:46:07,614] Trial 59 finished with value: 0.056324923360036167 and parameters: {'model_type': 'mlp', 'hidden_dims': '[256, 128]', 'dropout': 0.30471976078628404, 'batch_norm': False, 'lr': 3.0048156515537653e-05, 'weight_decay': 7.543013540857331e-07, 'epochs': 211, 'loss': 'mse', 'optimizer': 'adam', 'graph_mode': 'off', 'use_snp_selection': False}. Best is trial 25 with value: 0.0824597717905614.
[I 2025-12-05 15:46:09,477] Trial 60 finished with value: 0.034911053623077726 and parameters: {'model_type': 'mlp', 'hidden_dims': '[512, 64]', 'dropout': 0.2688077138089139, 'batch_norm': True, 'lr': 8.062015996685602e-05, 'weight_decay': 2.7700247415711025e-07, 'epochs': 329, 'loss': 'mse', 'optimizer': 'adam', 'graph_mode': 'off', 'use_snp_selection': True, 'num_snps': 24139}. Best is trial 25 with value: 0.0824597717905614.
[I 2025-12-05 15:46:10,773] Trial 61 finished with value: 0.07283439812528095 and parameters: {'model_type': 'mlp', 'hidden_dims': '[256, 128]', 'dropout': 0.1956149650986041, 'batch_norm': False, 'lr': 2.341648875143094e-05, 'weight_decay': 5.823531898579211e-07, 'epochs': 304, 'loss': 'mae', 'optimizer': 'adam', 'graph_mode': 'off', 'use_snp_selection': False}. Best is trial 25 with value: 0.0824597717905614.
[I 2025-12-05 15:46:12,051] Trial 62 finished with value: 0.04609341575033631 and parameters: {'model_type': 'mlp', 'hidden_dims': '[256, 128]', 'dropout': 0.2476244485847659, 'batch_norm': False, 'lr': 3.705931509356924e-05, 'weight_decay': 4.0741669555910036e-07, 'epochs': 310, 'loss': 'mae', 'optimizer': 'adam', 'graph_mode': 'off', 'use_snp_selection': False}. Best is trial 25 with value: 0.0824597717905614.
[I 2025-12-05 15:46:13,413] Trial 63 finished with value: 0.0588537402552887 and parameters: {'model_type': 'mlp', 'hidden_dims': '[256, 128]', 'dropout': 0.1828192283480857, 'batch_norm': False, 'lr': 2.5209223163314202e-05, 'weight_decay': 3.7509485962356607e-06, 'epochs': 333, 'loss': 'mae', 'optimizer': 'adam', 'graph_mode': 'off', 'use_snp_selection': False}. Best is trial 25 with value: 0.0824597717905614.
[I 2025-12-05 15:46:14,488] Trial 64 finished with value: 0.03601417748007743 and parameters: {'model_type': 'mlp', 'hidden_dims': '[256, 128]', 'dropout': 0.2236644425335688, 'batch_norm': False, 'lr': 1.5180927338222666e-05, 'weight_decay': 1.294091687569356e-06, 'epochs': 188, 'loss': 'mae', 'optimizer': 'adam', 'graph_mode': 'off', 'use_snp_selection': False}. Best is trial 25 with value: 0.0824597717905614.
[I 2025-12-05 15:46:15,783] Trial 65 finished with value: 0.05706762714954128 and parameters: {'model_type': 'mlp', 'hidden_dims': '[256, 128, 64]', 'dropout': 0.14897902676484925, 'batch_norm': False, 'lr': 4.8593111526576264e-05, 'weight_decay': 7.427991351483218e-07, 'epochs': 296, 'loss': 'mae', 'optimizer': 'adam', 'graph_mode': 'off', 'use_snp_selection': False}. Best is trial 25 with value: 0.0824597717905614.
[I 2025-12-05 15:46:16,616] Trial 66 finished with value: 0.07291664385049873 and parameters: {'model_type': 'mlp', 'hidden_dims': '[128, 64]', 'dropout': 0.17331281174339297, 'batch_norm': True, 'lr': 5.859715495196035e-05, 'weight_decay': 1.368264270459073e-07, 'epochs': 161, 'loss': 'mse', 'optimizer': 'adam', 'graph_mode': 'off', 'use_snp_selection': False}. Best is trial 25 with value: 0.0824597717905614.
[I 2025-12-05 15:46:17,433] Trial 67 finished with value: 0.049313902562072416 and parameters: {'model_type': 'mlp', 'hidden_dims': '[128, 64]', 'dropout': 0.16168726810606912, 'batch_norm': True, 'lr': 1.038788092140181e-06, 'weight_decay': 0.0009446634395666504, 'epochs': 166, 'loss': 'mae', 'optimizer': 'adam', 'graph_mode': 'off', 'use_snp_selection': False}. Best is trial 25 with value: 0.0824597717905614.
[I 2025-12-05 15:46:18,208] Trial 68 finished with value: 0.054942172056637095 and parameters: {'model_type': 'mlp', 'hidden_dims': '[128, 64]', 'dropout': 0.17492935263588705, 'batch_norm': False, 'lr': 5.299176576163535e-05, 'weight_decay': 1.3875781328691734e-07, 'epochs': 135, 'loss': 'mse', 'optimizer': 'adam', 'graph_mode': 'off', 'use_snp_selection': False}. Best is trial 25 with value: 0.0824597717905614.
[I 2025-12-05 15:46:19,280] Trial 69 finished with value: 0.054415829234367365 and parameters: {'model_type': 'mlp', 'hidden_dims': '[128, 64]', 'dropout': 0.29130535216320136, 'batch_norm': True, 'lr': 0.000123573156600265, 'weight_decay': 1.0312063195160043e-07, 'epochs': 319, 'loss': 'mse', 'optimizer': 'adam', 'graph_mode': 'off', 'use_snp_selection': False}. Best is trial 25 with value: 0.0824597717905614.
[I 2025-12-05 15:46:20,353] Trial 70 finished with value: 0.031178591369697424 and parameters: {'model_type': 'mlp', 'hidden_dims': '[128, 64]', 'dropout': 0.13452214782112018, 'batch_norm': True, 'lr': 3.992551261538546e-05, 'weight_decay': 2.7617478301796245e-07, 'epochs': 304, 'loss': 'mae', 'optimizer': 'adam', 'graph_mode': 'off', 'use_snp_selection': False}. Best is trial 25 with value: 0.0824597717905614.
[I 2025-12-05 15:46:22,117] Trial 71 finished with value: 0.07137562570312615 and parameters: {'model_type': 'mlp', 'hidden_dims': '[512, 64]', 'dropout': 0.19316722882621368, 'batch_norm': True, 'lr': 2.9665320716423835e-05, 'weight_decay': 1.7490943808260013e-07, 'epochs': 258, 'loss': 'mse', 'optimizer': 'adam', 'graph_mode': 'off', 'use_snp_selection': False}. Best is trial 25 with value: 0.0824597717905614.
[I 2025-12-05 15:46:23,479] Trial 72 finished with value: 0.009895604703063146 and parameters: {'model_type': 'mlp', 'hidden_dims': '[512, 64]', 'dropout': 0.21355009935227484, 'batch_norm': True, 'lr': 1.1638784413132545e-05, 'weight_decay': 2.121615590980043e-07, 'epochs': 147, 'loss': 'mse', 'optimizer': 'adam', 'graph_mode': 'off', 'use_snp_selection': False}. Best is trial 25 with value: 0.0824597717905614.
[I 2025-12-05 15:46:24,926] Trial 73 finished with value: 0.04699062831281769 and parameters: {'model_type': 'mlp', 'hidden_dims': '[512, 128]', 'dropout': 0.19490727206413783, 'batch_norm': True, 'lr': 2.898724339384891e-05, 'weight_decay': 3.609921424646836e-07, 'epochs': 165, 'loss': 'mse', 'optimizer': 'adam', 'graph_mode': 'off', 'use_snp_selection': False}. Best is trial 25 with value: 0.0824597717905614.
[I 2025-12-05 15:46:26,098] Trial 74 finished with value: 0.06670388409955828 and parameters: {'model_type': 'mlp', 'hidden_dims': '[256, 128, 64]', 'dropout': 0.10046110903558789, 'batch_norm': True, 'lr': 7.57896688597036e-05, 'weight_decay': 7.334511242802292e-06, 'epochs': 225, 'loss': 'mse', 'optimizer': 'adam', 'graph_mode': 'off', 'use_snp_selection': False}. Best is trial 25 with value: 0.0824597717905614.
[I 2025-12-05 15:46:27,249] Trial 75 finished with value: 0.06344803093263794 and parameters: {'model_type': 'mlp', 'hidden_dims': '[256, 128]', 'dropout': 0.10254430663673098, 'batch_norm': True, 'lr': 6.491784542520768e-05, 'weight_decay': 3.598227456034993e-05, 'epochs': 241, 'loss': 'mse', 'optimizer': 'adam', 'graph_mode': 'off', 'use_snp_selection': False}. Best is trial 25 with value: 0.0824597717905614.
[I 2025-12-05 15:46:28,787] Trial 76 finished with value: 0.03960948715394091 and parameters: {'model_type': 'mlp', 'hidden_dims': '[512, 64]', 'dropout': 0.1264571799348444, 'batch_norm': True, 'lr': 7.965086070506356e-05, 'weight_decay': 1.3667919079300683e-07, 'epochs': 191, 'loss': 'mse', 'optimizer': 'adam', 'graph_mode': 'off', 'use_snp_selection': False}. Best is trial 25 with value: 0.0824597717905614.
[I 2025-12-05 15:46:30,374] Trial 77 finished with value: 0.05822121519886089 and parameters: {'model_type': 'mlp', 'hidden_dims': '[512, 256]', 'dropout': 0.14490746870466698, 'batch_norm': True, 'lr': 5.6807422357080726e-05, 'weight_decay': 6.231285373436725e-07, 'epochs': 205, 'loss': 'mse', 'optimizer': 'adam', 'graph_mode': 'off', 'use_snp_selection': False}. Best is trial 25 with value: 0.0824597717905614.
[I 2025-12-05 15:46:31,339] Trial 78 finished with value: -0.0018046303068638676 and parameters: {'model_type': 'mlp', 'hidden_dims': '[256, 128, 64]', 'dropout': 0.17416368613845762, 'batch_norm': True, 'lr': 3.975157330346891e-05, 'weight_decay': 9.504235881845289e-07, 'epochs': 223, 'loss': 'mse', 'optimizer': 'adam', 'graph_mode': 'off', 'use_snp_selection': True, 'num_snps': 2246}. Best is trial 25 with value: 0.0824597717905614.
[I 2025-12-05 15:46:33,004] Trial 79 finished with value: 0.07313366351165179 and parameters: {'model_type': 'mlp', 'hidden_dims': '[512, 64]', 'dropout': 0.10842083764009423, 'batch_norm': False, 'lr': 1.6484797378890035e-05, 'weight_decay': 1.8119995734054177e-07, 'epochs': 227, 'loss': 'mae', 'optimizer': 'adam', 'graph_mode': 'off', 'use_snp_selection': False}. Best is trial 25 with value: 0.0824597717905614.
[I 2025-12-05 15:46:33,899] Trial 80 finished with value: 0.08238976509821487 and parameters: {'model_type': 'mlp', 'hidden_dims': '[128, 64]', 'dropout': 0.11069037729235758, 'batch_norm': False, 'lr': 7.743628308501491e-06, 'weight_decay': 0.00010754363072905691, 'epochs': 229, 'loss': 'mse', 'optimizer': 'adam', 'graph_mode': 'off', 'use_snp_selection': False}. Best is trial 25 with value: 0.0824597717905614.
[I 2025-12-05 15:46:34,785] Trial 81 finished with value: 0.04574051473224052 and parameters: {'model_type': 'mlp', 'hidden_dims': '[128, 64]', 'dropout': 0.10312758961029692, 'batch_norm': False, 'lr': 5.659551991289307e-06, 'weight_decay': 0.000581202470260533, 'epochs': 230, 'loss': 'mse', 'optimizer': 'adam', 'graph_mode': 'off', 'use_snp_selection': False}. Best is trial 25 with value: 0.0824597717905614.
