[I 2025-12-05 23:47:47,116] Trial 10 finished with value: 0.21309707979554032 and parameters: {'model_type': 'mlp', 'hidden_dims': '[512, 64]', 'dropout': 0.5885461262002587, 'batch_norm': False, 'lr': 8.769366258768696e-06, 'weight_decay': 2.78273193871783e-06, 'epochs': 55, 'loss': 'mae', 'optimizer': 'adam', 'graph_mode': 'off', 'use_snp_selection': False}. Best is trial 3 with value: 0.2451249502172085.
[I 2025-12-05 23:48:23,842] Trial 11 finished with value: 0.23594054498300138 and parameters: {'model_type': 'mlp', 'hidden_dims': '[256, 128]', 'dropout': 0.5874224943486895, 'batch_norm': False, 'lr': 1.579181036140435e-05, 'weight_decay': 2.2706826306130984e-05, 'epochs': 243, 'loss': 'mae', 'optimizer': 'adam', 'graph_mode': 'off', 'use_snp_selection': False}. Best is trial 3 with value: 0.2451249502172085.
[I 2025-12-05 23:49:00,973] Trial 12 finished with value: 0.17673313410067742 and parameters: {'model_type': 'mlp', 'hidden_dims': '[256, 128]', 'dropout': 0.4856805755923864, 'batch_norm': False, 'lr': 0.0006753264773209732, 'weight_decay': 5.275092102447975e-06, 'epochs': 251, 'loss': 'mae', 'optimizer': 'adam', 'graph_mode': 'off', 'use_snp_selection': False}. Best is trial 3 with value: 0.2451249502172085.
[I 2025-12-05 23:49:25,934] Trial 13 finished with value: 0.24092356022606992 and parameters: {'model_type': 'mlp', 'hidden_dims': '[128, 64]', 'dropout': 0.4964828887099272, 'batch_norm': False, 'lr': 1.3373175420781734e-05, 'weight_decay': 6.713476180492357e-05, 'epochs': 295, 'loss': 'mae', 'optimizer': 'adam', 'graph_mode': 'off', 'use_snp_selection': False}. Best is trial 3 with value: 0.2451249502172085.
[I 2025-12-05 23:50:17,158] Trial 14 finished with value: 0.231319732431314 and parameters: {'model_type': 'mlp', 'hidden_dims': '[256, 128, 64]', 'dropout': 0.3012984444538551, 'batch_norm': True, 'lr': 0.00017558188744418174, 'weight_decay': 1.1414924884997386e-07, 'epochs': 348, 'loss': 'mae', 'optimizer': 'adam', 'graph_mode': 'off', 'use_snp_selection': False}. Best is trial 3 with value: 0.2451249502172085.
[I 2025-12-05 23:51:21,362] Trial 15 finished with value: 0.23983586923491668 and parameters: {'model_type': 'mlp', 'hidden_dims': '[512, 256]', 'dropout': 0.49726651430271585, 'batch_norm': False, 'lr': 6.294235686680938e-06, 'weight_decay': 8.792310813628029e-06, 'epochs': 231, 'loss': 'mae', 'optimizer': 'adam', 'graph_mode': 'off', 'use_snp_selection': False}. Best is trial 3 with value: 0.2451249502172085.
[I 2025-12-05 23:52:03,016] Trial 16 finished with value: 0.2429066713068841 and parameters: {'model_type': 'mlp', 'hidden_dims': '[256, 128]', 'dropout': 0.45302885241005486, 'batch_norm': True, 'lr': 2.6608075792700583e-05, 'weight_decay': 5.8441507564978774e-05, 'epochs': 276, 'loss': 'mae', 'optimizer': 'adam', 'graph_mode': 'off', 'use_snp_selection': False}. Best is trial 3 with value: 0.2451249502172085.
[I 2025-12-05 23:52:58,935] Trial 17 finished with value: 0.23298410390058577 and parameters: {'model_type': 'mlp', 'hidden_dims': '[512, 64]', 'dropout': 0.31793710483525317, 'batch_norm': False, 'lr': 0.0001275431231574476, 'weight_decay': 2.5157504144511443e-05, 'epochs': 202, 'loss': 'mae', 'optimizer': 'adam', 'graph_mode': 'off', 'use_snp_selection': False}. Best is trial 3 with value: 0.2451249502172085.
[I 2025-12-05 23:54:16,145] Trial 18 finished with value: 0.09342329386914575 and parameters: {'model_type': 'mlp', 'hidden_dims': '[256, 128]', 'dropout': 0.5502199602442214, 'batch_norm': False, 'lr': 0.0009735993119677173, 'weight_decay': 0.00014041902757141856, 'epochs': 311, 'loss': 'mae', 'optimizer': 'adam', 'graph_mode': 'off', 'use_snp_selection': True, 'num_snps': 58241}. Best is trial 3 with value: 0.2451249502172085.
[I 2025-12-05 23:55:18,803] Trial 19 finished with value: 0.20256570563619752 and parameters: {'model_type': 'mlp', 'hidden_dims': '[512, 64]', 'dropout': 0.5424343934987939, 'batch_norm': True, 'lr': 3.2361429570756863e-06, 'weight_decay': 3.941372928245584e-06, 'epochs': 225, 'loss': 'mae', 'optimizer': 'adam', 'graph_mode': 'off', 'use_snp_selection': False}. Best is trial 3 with value: 0.2451249502172085.
[I 2025-12-05 23:56:34,289] Trial 20 finished with value: 0.23033138299097225 and parameters: {'model_type': 'mlp', 'hidden_dims': '[512, 128]', 'dropout': 0.4473400660533885, 'batch_norm': True, 'lr': 0.0003609828576220872, 'weight_decay': 8.256426710192134e-07, 'epochs': 275, 'loss': 'mae', 'optimizer': 'adam', 'graph_mode': 'off', 'use_snp_selection': False}. Best is trial 3 with value: 0.2451249502172085.
[I 2025-12-05 23:57:15,537] Trial 21 finished with value: 0.2245858700160502 and parameters: {'model_type': 'mlp', 'hidden_dims': '[256, 128]', 'dropout': 0.45215345780831073, 'batch_norm': True, 'lr': 2.441359808480688e-05, 'weight_decay': 5.9336928136062495e-05, 'epochs': 273, 'loss': 'mae', 'optimizer': 'adam', 'graph_mode': 'off', 'use_snp_selection': False}. Best is trial 3 with value: 0.2451249502172085.
[I 2025-12-05 23:58:02,973] Trial 22 finished with value: 0.2268485889449113 and parameters: {'model_type': 'mlp', 'hidden_dims': '[256, 128]', 'dropout': 0.3559511520520937, 'batch_norm': True, 'lr': 3.0671967375607745e-05, 'weight_decay': 1.123340479810494e-05, 'epochs': 321, 'loss': 'mae', 'optimizer': 'adam', 'graph_mode': 'off', 'use_snp_selection': False}. Best is trial 3 with value: 0.2451249502172085.
[I 2025-12-05 23:58:42,918] Trial 23 finished with value: 0.23975557495965488 and parameters: {'model_type': 'mlp', 'hidden_dims': '[256, 128]', 'dropout': 0.4372648366381374, 'batch_norm': True, 'lr': 9.002796660349704e-05, 'weight_decay': 4.123770207985261e-05, 'epochs': 263, 'loss': 'mae', 'optimizer': 'adam', 'graph_mode': 'off', 'use_snp_selection': False}. Best is trial 3 with value: 0.2451249502172085.
[I 2025-12-05 23:59:26,992] Trial 24 finished with value: 0.21842753052404512 and parameters: {'model_type': 'mlp', 'hidden_dims': '[256, 128]', 'dropout': 0.5274740790630678, 'batch_norm': True, 'lr': 2.2687596520415506e-05, 'weight_decay': 0.0001415112187370994, 'epochs': 295, 'loss': 'mae', 'optimizer': 'adam', 'graph_mode': 'off', 'use_snp_selection': False}. Best is trial 3 with value: 0.2451249502172085.
[I 2025-12-06 00:00:30,460] Trial 25 finished with value: 0.237807427139402 and parameters: {'model_type': 'mlp', 'hidden_dims': '[512, 256]', 'dropout': 0.5986841729537261, 'batch_norm': True, 'lr': 8.42461547226307e-06, 'weight_decay': 8.140653925042072e-06, 'epochs': 226, 'loss': 'mae', 'optimizer': 'adam', 'graph_mode': 'off', 'use_snp_selection': False}. Best is trial 3 with value: 0.2451249502172085.
[I 2025-12-06 00:00:59,831] Trial 26 finished with value: 0.2019560731079897 and parameters: {'model_type': 'mlp', 'hidden_dims': '[128, 64]', 'dropout': 0.3513365877169587, 'batch_norm': False, 'lr': 4.045273862387813e-05, 'weight_decay': 0.00015265805543382736, 'epochs': 293, 'loss': 'mae', 'optimizer': 'adam', 'graph_mode': 'off', 'use_snp_selection': True, 'num_snps': 3842}. Best is trial 3 with value: 0.2451249502172085.
[I 2025-12-06 00:01:48,526] Trial 27 finished with value: 0.17689476772091434 and parameters: {'model_type': 'mlp', 'hidden_dims': '[256, 128, 64]', 'dropout': 0.4725950272669728, 'batch_norm': True, 'lr': 3.944155249826643e-06, 'weight_decay': 3.308105985344024e-05, 'epochs': 331, 'loss': 'mse', 'optimizer': 'adam', 'graph_mode': 'off', 'use_snp_selection': False}. Best is trial 3 with value: 0.2451249502172085.
[I 2025-12-06 00:02:39,960] Trial 28 finished with value: 0.24554543750501523 and parameters: {'model_type': 'mlp', 'hidden_dims': '[512, 64]', 'dropout': 0.26673595624506075, 'batch_norm': False, 'lr': 1.5122176566091531e-05, 'weight_decay': 1.4086383058944841e-05, 'epochs': 181, 'loss': 'mae', 'optimizer': 'adam', 'graph_mode': 'off', 'use_snp_selection': False}. Best is trial 28 with value: 0.24554543750501523.
[I 2025-12-06 00:03:23,764] Trial 29 finished with value: 0.21809854116178623 and parameters: {'model_type': 'mlp', 'hidden_dims': '[512, 64]', 'dropout': 0.2306566326141554, 'batch_norm': False, 'lr': 2.320440320155318e-06, 'weight_decay': 3.024002784689886e-06, 'epochs': 158, 'loss': 'mae', 'optimizer': 'adam', 'graph_mode': 'off', 'use_snp_selection': True, 'num_snps': 19468}. Best is trial 28 with value: 0.24554543750501523.
[I 2025-12-06 00:03:57,238] Trial 30 finished with value: 0.23172873379652628 and parameters: {'model_type': 'mlp', 'hidden_dims': '[512, 64]', 'dropout': 0.2786768443571839, 'batch_norm': False, 'lr': 7.452152324241131e-06, 'weight_decay': 1.2313173494206244e-05, 'epochs': 108, 'loss': 'mae', 'optimizer': 'adam', 'graph_mode': 'off', 'use_snp_selection': False}. Best is trial 28 with value: 0.24554543750501523.
[I 2025-12-06 00:04:48,946] Trial 31 finished with value: 0.247591816862721 and parameters: {'model_type': 'mlp', 'hidden_dims': '[512, 64]', 'dropout': 0.24243757059627913, 'batch_norm': False, 'lr': 1.4337941871274989e-05, 'weight_decay': 7.179659301891436e-05, 'epochs': 182, 'loss': 'mae', 'optimizer': 'adam', 'graph_mode': 'off', 'use_snp_selection': False}. Best is trial 31 with value: 0.247591816862721.
[I 2025-12-06 00:05:39,733] Trial 32 finished with value: 0.2379487258017104 and parameters: {'model_type': 'mlp', 'hidden_dims': '[512, 64]', 'dropout': 0.20867471102954188, 'batch_norm': False, 'lr': 1.62816787013334e-05, 'weight_decay': 1.722430042375327e-05, 'epochs': 178, 'loss': 'mae', 'optimizer': 'adam', 'graph_mode': 'off', 'use_snp_selection': False}. Best is trial 31 with value: 0.247591816862721.
[I 2025-12-06 00:06:17,152] Trial 33 finished with value: 0.22900049241648582 and parameters: {'model_type': 'mlp', 'hidden_dims': '[512, 64]', 'dropout': 0.26874974291015846, 'batch_norm': False, 'lr': 4.866594728567504e-06, 'weight_decay': 8.822340236655884e-05, 'epochs': 123, 'loss': 'mae', 'optimizer': 'adam', 'graph_mode': 'off', 'use_snp_selection': False}. Best is trial 31 with value: 0.247591816862721.
[I 2025-12-06 00:07:46,177] Trial 34 finished with value: 0.24165052458490122 and parameters: {'model_type': 'mlp', 'hidden_dims': '[512, 64]', 'dropout': 0.23945878618537908, 'batch_norm': False, 'lr': 1.133810378834678e-05, 'weight_decay': 0.000523339875991667, 'epochs': 206, 'loss': 'mse', 'optimizer': 'adam', 'graph_mode': 'off', 'use_snp_selection': True, 'num_snps': 58283}. Best is trial 31 with value: 0.247591816862721.
[I 2025-12-06 00:08:36,929] Trial 35 finished with value: 0.23059879021114232 and parameters: {'model_type': 'mlp', 'hidden_dims': '[512, 64]', 'dropout': 0.3099987534514242, 'batch_norm': False, 'lr': 2.2907416953010487e-06, 'weight_decay': 6.016281774218059e-06, 'epochs': 178, 'loss': 'mae', 'optimizer': 'adam', 'graph_mode': 'off', 'use_snp_selection': False}. Best is trial 31 with value: 0.247591816862721.
[I 2025-12-06 00:09:11,434] Trial 36 finished with value: 0.2603350420262447 and parameters: {'model_type': 'mlp', 'hidden_dims': '[128, 64]', 'dropout': 0.1790087660987533, 'batch_norm': False, 'lr': 3.875991399732898e-05, 'weight_decay': 3.6853217732711426e-05, 'epochs': 138, 'loss': 'mse', 'optimizer': 'adam', 'graph_mode': 'off', 'use_snp_selection': True, 'num_snps': 18869}. Best is trial 36 with value: 0.2603350420262447.
[I 2025-12-06 00:09:46,770] Trial 37 finished with value: 0.26732035923459463 and parameters: {'model_type': 'mlp', 'hidden_dims': '[128, 64]', 'dropout': 0.18105274328298693, 'batch_norm': False, 'lr': 3.925355453403931e-05, 'weight_decay': 0.000291071912830787, 'epochs': 146, 'loss': 'mse', 'optimizer': 'adam', 'graph_mode': 'off', 'use_snp_selection': True, 'num_snps': 20617}. Best is trial 37 with value: 0.26732035923459463.
[I 2025-12-06 00:10:22,118] Trial 38 finished with value: 0.2528846392296641 and parameters: {'model_type': 'mlp', 'hidden_dims': '[128, 64]', 'dropout': 0.1712272283733957, 'batch_norm': False, 'lr': 9.335704439378683e-05, 'weight_decay': 0.0004594906431031928, 'epochs': 137, 'loss': 'mse', 'optimizer': 'adam', 'graph_mode': 'off', 'use_snp_selection': True, 'num_snps': 20772}. Best is trial 37 with value: 0.26732035923459463.
[I 2025-12-06 00:10:57,122] Trial 39 finished with value: 0.2534768415110843 and parameters: {'model_type': 'mlp', 'hidden_dims': '[128, 64]', 'dropout': 0.17445184187402504, 'batch_norm': False, 'lr': 0.00011442071659629305, 'weight_decay': 0.00025531562206444053, 'epochs': 135, 'loss': 'mse', 'optimizer': 'adam', 'graph_mode': 'off', 'use_snp_selection': True, 'num_snps': 20625}. Best is trial 37 with value: 0.26732035923459463.
[I 2025-12-06 00:11:31,122] Trial 40 finished with value: 0.2506972879313516 and parameters: {'model_type': 'mlp', 'hidden_dims': '[128, 64]', 'dropout': 0.17154582143994218, 'batch_norm': False, 'lr': 0.00014008745588196334, 'weight_decay': 0.0008340329337334324, 'epochs': 80, 'loss': 'mse', 'optimizer': 'adam', 'graph_mode': 'off', 'use_snp_selection': True, 'num_snps': 20807}. Best is trial 37 with value: 0.26732035923459463.
[I 2025-12-06 00:12:04,934] Trial 41 finished with value: 0.24657240202159633 and parameters: {'model_type': 'mlp', 'hidden_dims': '[128, 64]', 'dropout': 0.16757055338426827, 'batch_norm': False, 'lr': 9.48351412740346e-05, 'weight_decay': 0.0007390755290277336, 'epochs': 85, 'loss': 'mse', 'optimizer': 'adam', 'graph_mode': 'off', 'use_snp_selection': True, 'num_snps': 20182}. Best is trial 37 with value: 0.26732035923459463.
[I 2025-12-06 00:12:40,256] Trial 42 finished with value: 0.2480275444351588 and parameters: {'model_type': 'mlp', 'hidden_dims': '[128, 64]', 'dropout': 0.10441382911930508, 'batch_norm': False, 'lr': 0.00015126130716384742, 'weight_decay': 0.0003717833920210344, 'epochs': 129, 'loss': 'mse', 'optimizer': 'adam', 'graph_mode': 'off', 'use_snp_selection': True, 'num_snps': 21071}. Best is trial 37 with value: 0.26732035923459463.
[I 2025-12-06 00:13:14,387] Trial 43 finished with value: 0.2442603351824466 and parameters: {'model_type': 'mlp', 'hidden_dims': '[128, 64]', 'dropout': 0.17826758965794345, 'batch_norm': False, 'lr': 0.00027850537354380577, 'weight_decay': 0.00022049394972856542, 'epochs': 74, 'loss': 'mse', 'optimizer': 'adam', 'graph_mode': 'off', 'use_snp_selection': True, 'num_snps': 21732}. Best is trial 37 with value: 0.26732035923459463.
[I 2025-12-06 00:13:46,669] Trial 44 finished with value: 0.2465778375666355 and parameters: {'model_type': 'mlp', 'hidden_dims': '[128, 64]', 'dropout': 0.13016824679020048, 'batch_norm': False, 'lr': 8.063680137146575e-05, 'weight_decay': 0.00085012835228946, 'epochs': 152, 'loss': 'mse', 'optimizer': 'adam', 'graph_mode': 'off', 'use_snp_selection': True, 'num_snps': 13328}. Best is trial 37 with value: 0.26732035923459463.
[I 2025-12-06 00:14:24,558] Trial 45 finished with value: 0.24105505631535507 and parameters: {'model_type': 'mlp', 'hidden_dims': '[128, 64]', 'dropout': 0.19288173553239651, 'batch_norm': False, 'lr': 4.595272421914422e-05, 'weight_decay': 0.00048041331235907194, 'epochs': 137, 'loss': 'mse', 'optimizer': 'adam', 'graph_mode': 'off', 'use_snp_selection': True, 'num_snps': 26711}. Best is trial 37 with value: 0.26732035923459463.
[I 2025-12-06 00:14:55,698] Trial 46 finished with value: 0.23858273800881472 and parameters: {'model_type': 'mlp', 'hidden_dims': '[128, 64]', 'dropout': 0.13064205428740738, 'batch_norm': False, 'lr': 0.00010628373268284481, 'weight_decay': 0.00021965715329917273, 'epochs': 43, 'loss': 'mse', 'optimizer': 'adam', 'graph_mode': 'off', 'use_snp_selection': True, 'num_snps': 15377}. Best is trial 37 with value: 0.26732035923459463.
[I 2025-12-06 00:15:33,097] Trial 47 finished with value: 0.2489668610259464 and parameters: {'model_type': 'mlp', 'hidden_dims': '[128, 64]', 'dropout': 0.20973136821036548, 'batch_norm': False, 'lr': 6.0140265195062176e-05, 'weight_decay': 0.0005417967537085775, 'epochs': 117, 'loss': 'mse', 'optimizer': 'adam', 'graph_mode': 'off', 'use_snp_selection': True, 'num_snps': 27292}. Best is trial 37 with value: 0.26732035923459463.
[I 2025-12-06 00:16:03,203] Trial 48 finished with value: 0.23045932376964395 and parameters: {'model_type': 'mlp', 'hidden_dims': '[128, 64]', 'dropout': 0.15615199284841752, 'batch_norm': False, 'lr': 0.00021067982025538403, 'weight_decay': 0.000337054834366664, 'epochs': 100, 'loss': 'mse', 'optimizer': 'adam', 'graph_mode': 'off', 'use_snp_selection': True, 'num_snps': 10249}. Best is trial 37 with value: 0.26732035923459463.
[I 2025-12-06 00:16:38,565] Trial 49 finished with value: 0.242019425678059 and parameters: {'model_type': 'mlp', 'hidden_dims': '[128, 64]', 'dropout': 0.18550391396935975, 'batch_norm': False, 'lr': 0.0004514859074676051, 'weight_decay': 0.0002498799923331959, 'epochs': 71, 'loss': 'mse', 'optimizer': 'adam', 'graph_mode': 'off', 'use_snp_selection': True, 'num_snps': 25338}. Best is trial 37 with value: 0.26732035923459463.
[I 2025-12-06 00:17:12,608] Trial 50 finished with value: 0.24721777717253862 and parameters: {'model_type': 'mlp', 'hidden_dims': '[128, 64]', 'dropout': 0.13383836430471213, 'batch_norm': False, 'lr': 3.761079443396414e-05, 'weight_decay': 0.00012035617879354813, 'epochs': 166, 'loss': 'mse', 'optimizer': 'adam', 'graph_mode': 'off', 'use_snp_selection': True, 'num_snps': 16748}. Best is trial 37 with value: 0.26732035923459463.
[I 2025-12-06 00:17:50,130] Trial 51 finished with value: 0.2504803667028786 and parameters: {'model_type': 'mlp', 'hidden_dims': '[128, 64]', 'dropout': 0.2153386640329195, 'batch_norm': False, 'lr': 7.162514831014257e-05, 'weight_decay': 0.0005803801385004613, 'epochs': 110, 'loss': 'mse', 'optimizer': 'adam', 'graph_mode': 'off', 'use_snp_selection': True, 'num_snps': 27725}. Best is trial 37 with value: 0.26732035923459463.
[I 2025-12-06 00:18:27,841] Trial 52 finished with value: 0.25539152837592577 and parameters: {'model_type': 'mlp', 'hidden_dims': '[128, 64]', 'dropout': 0.2061769361632544, 'batch_norm': False, 'lr': 7.002635964262374e-05, 'weight_decay': 0.0009732684409514599, 'epochs': 140, 'loss': 'mse', 'optimizer': 'adam', 'graph_mode': 'off', 'use_snp_selection': True, 'num_snps': 24715}. Best is trial 37 with value: 0.26732035923459463.
[I 2025-12-06 00:19:03,533] Trial 53 finished with value: 0.25791700000698575 and parameters: {'model_type': 'mlp', 'hidden_dims': '[128, 64]', 'dropout': 0.17134136291926672, 'batch_norm': False, 'lr': 0.00013126976391428542, 'weight_decay': 0.0009900702661275386, 'epochs': 130, 'loss': 'mse', 'optimizer': 'adam', 'graph_mode': 'off', 'use_snp_selection': True, 'num_snps': 22021}. Best is trial 37 with value: 0.26732035923459463.
[I 2025-12-06 00:19:39,796] Trial 54 finished with value: 0.25129633632495396 and parameters: {'model_type': 'mlp', 'hidden_dims': '[128, 64]', 'dropout': 0.15149190561531573, 'batch_norm': False, 'lr': 5.824256454374666e-05, 'weight_decay': 0.000350645790580859, 'epochs': 141, 'loss': 'mse', 'optimizer': 'adam', 'graph_mode': 'off', 'use_snp_selection': True, 'num_snps': 23749}. Best is trial 37 with value: 0.26732035923459463.
[I 2025-12-06 00:20:13,330] Trial 55 finished with value: 0.24268088632573623 and parameters: {'model_type': 'mlp', 'hidden_dims': '[128, 64]', 'dropout': 0.19915400318829302, 'batch_norm': False, 'lr': 0.00012306282718182226, 'weight_decay': 0.0009769631732844562, 'epochs': 159, 'loss': 'mse', 'optimizer': 'adam', 'graph_mode': 'off', 'use_snp_selection': True, 'num_snps': 16219}. Best is trial 37 with value: 0.26732035923459463.
[I 2025-12-06 00:21:06,669] Trial 56 finished with value: 0.24511254551631106 and parameters: {'model_type': 'mlp', 'hidden_dims': '[512, 128]', 'dropout': 0.12138210895177662, 'batch_norm': False, 'lr': 0.00018403578372424933, 'weight_decay': 0.00018307758604250329, 'epochs': 136, 'loss': 'mse', 'optimizer': 'adam', 'graph_mode': 'off', 'use_snp_selection': True, 'num_snps': 33989}. Best is trial 37 with value: 0.26732035923459463.
[I 2025-12-06 00:21:46,727] Trial 57 finished with value: 0.24106807358309212 and parameters: {'model_type': 'mlp', 'hidden_dims': '[256, 128, 64]', 'dropout': 0.22787587006705562, 'batch_norm': False, 'lr': 0.0002687152232738018, 'weight_decay': 0.00010509239476193797, 'epochs': 91, 'loss': 'mse', 'optimizer': 'adam', 'graph_mode': 'off', 'use_snp_selection': True, 'num_snps': 29598}. Best is trial 37 with value: 0.26732035923459463.
[I 2025-12-06 00:22:16,288] Trial 58 finished with value: 0.22830761187678247 and parameters: {'model_type': 'mlp', 'hidden_dims': '[128, 64]', 'dropout': 0.15092258180118884, 'batch_norm': False, 'lr': 4.928615517040326e-05, 'weight_decay': 0.0006646690236753293, 'epochs': 148, 'loss': 'mse', 'optimizer': 'adam', 'graph_mode': 'off', 'use_snp_selection': True, 'num_snps': 7881}. Best is trial 37 with value: 0.26732035923459463.
[I 2025-12-06 00:22:56,383] Trial 59 finished with value: 0.25785792715036615 and parameters: {'model_type': 'mlp', 'hidden_dims': '[512, 256]', 'dropout': 0.10090896960630731, 'batch_norm': False, 'lr': 3.2028394723310955e-05, 'weight_decay': 0.00046363384871972766, 'epochs': 128, 'loss': 'mse', 'optimizer': 'adam', 'graph_mode': 'off', 'use_snp_selection': True, 'num_snps': 17623}. Best is trial 37 with value: 0.26732035923459463.
[I 2025-12-06 00:23:34,651] Trial 60 finished with value: 0.2436710116964757 and parameters: {'model_type': 'mlp', 'hidden_dims': '[512, 256]', 'dropout': 0.10900574015704735, 'batch_norm': False, 'lr': 2.9893319287606987e-05, 'weight_decay': 0.0003147608979775666, 'epochs': 124, 'loss': 'mse', 'optimizer': 'adam', 'graph_mode': 'off', 'use_snp_selection': True, 'num_snps': 15730}. Best is trial 37 with value: 0.26732035923459463.
