[I 2025-12-05 14:27:27,314] Trial 107 finished with value: 0.06115043769205147 and parameters: {'model_type': 'mlp', 'hidden_dims': '[512, 128]', 'dropout': 0.28711728383242424, 'batch_norm': False, 'lr': 3.6771355129312964e-05, 'weight_decay': 4.163093391475556e-05, 'epochs': 66, 'loss': 'mse', 'optimizer': 'adam', 'graph_mode': 'off', 'use_snp_selection': True, 'num_snps': 14127}. Best is trial 106 with value: 0.08859831686662437.
[I 2025-12-05 14:27:28,160] Trial 108 finished with value: 0.028060429861375587 and parameters: {'model_type': 'mlp', 'hidden_dims': '[512, 128]', 'dropout': 0.29703255581377336, 'batch_norm': False, 'lr': 5.9019542324588746e-05, 'weight_decay': 1.9235684344539693e-05, 'epochs': 54, 'loss': 'mae', 'optimizer': 'adam', 'graph_mode': 'off', 'use_snp_selection': True, 'num_snps': 4772}. Best is trial 106 with value: 0.08859831686662437.
[I 2025-12-05 14:27:29,393] Trial 109 finished with value: 0.03997689570612885 and parameters: {'model_type': 'mlp', 'hidden_dims': '[512, 128]', 'dropout': 0.22297730908268643, 'batch_norm': False, 'lr': 2.4963266255604168e-05, 'weight_decay': 4.893173781499647e-05, 'epochs': 78, 'loss': 'mse', 'optimizer': 'adam', 'graph_mode': 'off', 'use_snp_selection': False}. Best is trial 106 with value: 0.08859831686662437.
[I 2025-12-05 14:27:32,042] Trial 110 finished with value: 0.05823657183132586 and parameters: {'model_type': 'mlp', 'hidden_dims': '[512, 128]', 'dropout': 0.2749941143074151, 'batch_norm': False, 'lr': 1.0262160144256486e-05, 'weight_decay': 5.9038691651269094e-05, 'epochs': 68, 'loss': 'mse', 'optimizer': 'adam', 'graph_mode': 'off', 'use_snp_selection': True, 'num_snps': 52087}. Best is trial 106 with value: 0.08859831686662437.
[I 2025-12-05 14:27:33,122] Trial 111 finished with value: 0.0423546339628771 and parameters: {'model_type': 'mlp', 'hidden_dims': '[512, 128]', 'dropout': 0.3118011379980855, 'batch_norm': False, 'lr': 2.815646774439746e-05, 'weight_decay': 2.5599813948391977e-05, 'epochs': 88, 'loss': 'mse', 'optimizer': 'adam', 'graph_mode': 'off', 'use_snp_selection': True, 'num_snps': 11125}. Best is trial 106 with value: 0.08859831686662437.
[I 2025-12-05 14:27:34,218] Trial 112 finished with value: 0.046461235190588396 and parameters: {'model_type': 'mlp', 'hidden_dims': '[512, 128]', 'dropout': 0.24843854688103822, 'batch_norm': False, 'lr': 4.922152309792244e-05, 'weight_decay': 4.3169748341455074e-05, 'epochs': 52, 'loss': 'mse', 'optimizer': 'adam', 'graph_mode': 'off', 'use_snp_selection': True, 'num_snps': 13196}. Best is trial 106 with value: 0.08859831686662437.
[I 2025-12-05 14:27:35,438] Trial 113 finished with value: 0.06166969198254245 and parameters: {'model_type': 'mlp', 'hidden_dims': '[256, 128, 64]', 'dropout': 0.3238419872421194, 'batch_norm': False, 'lr': 2.1571780227513196e-05, 'weight_decay': 9.118155532222425e-05, 'epochs': 46, 'loss': 'mse', 'optimizer': 'adam', 'graph_mode': 'off', 'use_snp_selection': True, 'num_snps': 15827}. Best is trial 106 with value: 0.08859831686662437.
[I 2025-12-05 14:27:37,470] Trial 114 finished with value: 0.03017903795290615 and parameters: {'model_type': 'mlp', 'hidden_dims': '[256, 128, 64]', 'dropout': 0.2918964702604462, 'batch_norm': False, 'lr': 1.7525692962954805e-05, 'weight_decay': 0.0004836514097639051, 'epochs': 99, 'loss': 'mse', 'optimizer': 'adam', 'graph_mode': 'off', 'use_snp_selection': True, 'num_snps': 36759}. Best is trial 106 with value: 0.08859831686662437.
[I 2025-12-05 14:27:38,733] Trial 115 finished with value: 0.04280776349001502 and parameters: {'model_type': 'mlp', 'hidden_dims': '[256, 128, 64]', 'dropout': 0.2820516475638076, 'batch_norm': False, 'lr': 3.5907005378990576e-06, 'weight_decay': 0.00027990048312817676, 'epochs': 69, 'loss': 'mae', 'optimizer': 'adam', 'graph_mode': 'off', 'use_snp_selection': True, 'num_snps': 17730}. Best is trial 106 with value: 0.08859831686662437.
[I 2025-12-05 14:27:39,810] Trial 116 finished with value: 0.06416064661096643 and parameters: {'model_type': 'mlp', 'hidden_dims': '[512, 128]', 'dropout': 0.3052463629690396, 'batch_norm': True, 'lr': 4.423082597331892e-05, 'weight_decay': 1.304029198241697e-05, 'epochs': 60, 'loss': 'mse', 'optimizer': 'adam', 'graph_mode': 'off', 'use_snp_selection': False}. Best is trial 106 with value: 0.08859831686662437.
[I 2025-12-05 14:27:40,848] Trial 117 finished with value: 0.04736617693127964 and parameters: {'model_type': 'mlp', 'hidden_dims': '[256, 128, 64]', 'dropout': 0.35489930622159127, 'batch_norm': False, 'lr': 2.9912166767190644e-05, 'weight_decay': 3.200228960565434e-05, 'epochs': 112, 'loss': 'mse', 'optimizer': 'adam', 'graph_mode': 'off', 'use_snp_selection': True, 'num_snps': 8563}. Best is trial 106 with value: 0.08859831686662437.
[I 2025-12-05 14:27:42,387] Trial 118 finished with value: -1.3080888198077776e-05 and parameters: {'model_type': 'mlp', 'hidden_dims': '[256, 128, 64]', 'dropout': 0.47559492181270463, 'batch_norm': False, 'lr': 4.496349696637992e-06, 'weight_decay': 8.042022264119344e-05, 'epochs': 121, 'loss': 'mse', 'optimizer': 'adam', 'graph_mode': 'off', 'use_snp_selection': True, 'num_snps': 21699}. Best is trial 106 with value: 0.08859831686662437.
[I 2025-12-05 14:27:44,585] Trial 119 finished with value: 0.05102411502473047 and parameters: {'model_type': 'mlp', 'hidden_dims': '[128, 64]', 'dropout': 0.3348283319565839, 'batch_norm': False, 'lr': 1.4037566695719296e-05, 'weight_decay': 0.000398266274009154, 'epochs': 75, 'loss': 'mae', 'optimizer': 'adam', 'graph_mode': 'off', 'use_snp_selection': True, 'num_snps': 46619}. Best is trial 106 with value: 0.08859831686662437.
[I 2025-12-05 14:27:46,108] Trial 120 finished with value: 0.06330475538336679 and parameters: {'model_type': 'mlp', 'hidden_dims': '[512, 128]', 'dropout': 0.25971497308667996, 'batch_norm': False, 'lr': 6.750381249662232e-06, 'weight_decay': 6.243948849888399e-05, 'epochs': 137, 'loss': 'mse', 'optimizer': 'adam', 'graph_mode': 'off', 'use_snp_selection': False}. Best is trial 106 with value: 0.08859831686662437.
[I 2025-12-05 14:27:47,746] Trial 121 finished with value: 0.051525909184908375 and parameters: {'model_type': 'mlp', 'hidden_dims': '[256, 128]', 'dropout': 0.435705703875445, 'batch_norm': False, 'lr': 1.1492282059383343e-05, 'weight_decay': 0.00012932065510626027, 'epochs': 48, 'loss': 'mse', 'optimizer': 'adam', 'graph_mode': 'off', 'use_snp_selection': True, 'num_snps': 29811}. Best is trial 106 with value: 0.08859831686662437.
[I 2025-12-05 14:27:49,839] Trial 122 finished with value: 0.04972607104682067 and parameters: {'model_type': 'mlp', 'hidden_dims': '[256, 128]', 'dropout': 0.26924608823222973, 'batch_norm': False, 'lr': 1.287961289593106e-05, 'weight_decay': 0.00011255999047940614, 'epochs': 170, 'loss': 'mse', 'optimizer': 'adam', 'graph_mode': 'off', 'use_snp_selection': True, 'num_snps': 35673}. Best is trial 106 with value: 0.08859831686662437.
[I 2025-12-05 14:27:51,312] Trial 123 finished with value: 0.06977005630080141 and parameters: {'model_type': 'mlp', 'hidden_dims': '[256, 128, 64]', 'dropout': 0.463159933199266, 'batch_norm': False, 'lr': 9.180188459179006e-06, 'weight_decay': 3.7885225671790426e-05, 'epochs': 192, 'loss': 'mse', 'optimizer': 'adam', 'graph_mode': 'off', 'use_snp_selection': True, 'num_snps': 19380}. Best is trial 106 with value: 0.08859831686662437.
[I 2025-12-05 14:27:53,033] Trial 124 finished with value: 0.06560093766578104 and parameters: {'model_type': 'mlp', 'hidden_dims': '[256, 128]', 'dropout': 0.48912133016141485, 'batch_norm': False, 'lr': 2.0913979580358724e-05, 'weight_decay': 7.1225346689683e-05, 'epochs': 209, 'loss': 'mse', 'optimizer': 'adam', 'graph_mode': 'off', 'use_snp_selection': True, 'num_snps': 29225}. Best is trial 106 with value: 0.08859831686662437.
[I 2025-12-05 14:27:54,529] Trial 125 finished with value: 0.022575621415465888 and parameters: {'model_type': 'mlp', 'hidden_dims': '[256, 128, 64]', 'dropout': 0.445701049302078, 'batch_norm': False, 'lr': 1.8354490000665417e-05, 'weight_decay': 0.0005256220892854603, 'epochs': 41, 'loss': 'mse', 'optimizer': 'adam', 'graph_mode': 'off', 'use_snp_selection': True, 'num_snps': 23924}. Best is trial 106 with value: 0.08859831686662437.
[I 2025-12-05 14:27:56,487] Trial 126 finished with value: 0.06502957033455481 and parameters: {'model_type': 'mlp', 'hidden_dims': '[256, 128, 64]', 'dropout': 0.3690133016396764, 'batch_norm': False, 'lr': 5.443063240944572e-06, 'weight_decay': 0.0007608556773841034, 'epochs': 201, 'loss': 'mse', 'optimizer': 'adam', 'graph_mode': 'off', 'use_snp_selection': True, 'num_snps': 31406}. Best is trial 106 with value: 0.08859831686662437.
[I 2025-12-05 14:27:57,623] Trial 127 finished with value: 0.0512903352211976 and parameters: {'model_type': 'mlp', 'hidden_dims': '[512, 64]', 'dropout': 0.458137586609797, 'batch_norm': False, 'lr': 1.6111174768500347e-05, 'weight_decay': 6.92054672221694e-06, 'epochs': 129, 'loss': 'mae', 'optimizer': 'adam', 'graph_mode': 'off', 'use_snp_selection': True, 'num_snps': 11858}. Best is trial 106 with value: 0.08859831686662437.
[I 2025-12-05 14:27:59,178] Trial 128 finished with value: 0.04934800263404877 and parameters: {'model_type': 'mlp', 'hidden_dims': '[512, 256]', 'dropout': 0.5233963415285219, 'batch_norm': False, 'lr': 1.2252456966904318e-05, 'weight_decay': 4.954696889756493e-05, 'epochs': 146, 'loss': 'mse', 'optimizer': 'adam', 'graph_mode': 'off', 'use_snp_selection': False}. Best is trial 106 with value: 0.08859831686662437.
[I 2025-12-05 14:28:00,445] Trial 129 finished with value: 0.03284101907521478 and parameters: {'model_type': 'mlp', 'hidden_dims': '[256, 128]', 'dropout': 0.3200494159597735, 'batch_norm': False, 'lr': 8.043707624785695e-06, 'weight_decay': 0.00015460803380749547, 'epochs': 60, 'loss': 'mse', 'optimizer': 'adam', 'graph_mode': 'off', 'use_snp_selection': True, 'num_snps': 16753}. Best is trial 106 with value: 0.08859831686662437.
[I 2025-12-05 14:28:02,173] Trial 130 finished with value: 0.04674695357783481 and parameters: {'model_type': 'mlp', 'hidden_dims': '[256, 128, 64]', 'dropout': 0.4011322789520982, 'batch_norm': False, 'lr': 2.6525603238255653e-06, 'weight_decay': 2.2319476350368978e-05, 'epochs': 160, 'loss': 'mse', 'optimizer': 'adam', 'graph_mode': 'off', 'use_snp_selection': True, 'num_snps': 27641}. Best is trial 106 with value: 0.08859831686662437.
[I 2025-12-05 14:28:03,606] Trial 131 finished with value: 0.051262033938420784 and parameters: {'model_type': 'mlp', 'hidden_dims': '[256, 128, 64]', 'dropout': 0.49884416760435, 'batch_norm': False, 'lr': 9.33536868124446e-06, 'weight_decay': 3.771579156094095e-05, 'epochs': 177, 'loss': 'mse', 'optimizer': 'adam', 'graph_mode': 'off', 'use_snp_selection': True, 'num_snps': 19746}. Best is trial 106 with value: 0.08859831686662437.
[I 2025-12-05 14:28:04,795] Trial 132 finished with value: 0.007386564647845766 and parameters: {'model_type': 'mlp', 'hidden_dims': '[256, 128, 64]', 'dropout': 0.45760333177398127, 'batch_norm': False, 'lr': 1.0243387989590692e-05, 'weight_decay': 2.626128001099153e-05, 'epochs': 184, 'loss': 'mse', 'optimizer': 'adam', 'graph_mode': 'off', 'use_snp_selection': True, 'num_snps': 9768}. Best is trial 106 with value: 0.08859831686662437.
[I 2025-12-05 14:28:06,358] Trial 133 finished with value: 0.03637394581058199 and parameters: {'model_type': 'mlp', 'hidden_dims': '[256, 128, 64]', 'dropout': 0.42116113020901125, 'batch_norm': False, 'lr': 6.503769652341639e-06, 'weight_decay': 0.00031738550135103935, 'epochs': 193, 'loss': 'mse', 'optimizer': 'adam', 'graph_mode': 'off', 'use_snp_selection': True, 'num_snps': 19045}. Best is trial 106 with value: 0.08859831686662437.
[I 2025-12-05 14:28:09,174] Trial 134 finished with value: 0.041237629410258214 and parameters: {'model_type': 'mlp', 'hidden_dims': '[256, 128, 64]', 'dropout': 0.4377329603776877, 'batch_norm': False, 'lr': 4.002808336177835e-06, 'weight_decay': 3.7760535965471946e-05, 'epochs': 198, 'loss': 'mse', 'optimizer': 'adam', 'graph_mode': 'off', 'use_snp_selection': True, 'num_snps': 56913}. Best is trial 106 with value: 0.08859831686662437.
[I 2025-12-05 14:28:10,461] Trial 135 finished with value: 0.06690616472628887 and parameters: {'model_type': 'mlp', 'hidden_dims': '[256, 128, 64]', 'dropout': 0.46848048894797034, 'batch_norm': False, 'lr': 8.269030983219947e-06, 'weight_decay': 9.598199564676489e-05, 'epochs': 188, 'loss': 'mse', 'optimizer': 'adam', 'graph_mode': 'off', 'use_snp_selection': True, 'num_snps': 14523}. Best is trial 106 with value: 0.08859831686662437.
[I 2025-12-05 14:28:12,389] Trial 136 finished with value: 0.06710564834023368 and parameters: {'model_type': 'mlp', 'hidden_dims': '[512, 128]', 'dropout': 0.42966188519869897, 'batch_norm': True, 'lr': 1.4643401058289113e-05, 'weight_decay': 4.3378421237699324e-06, 'epochs': 217, 'loss': 'mse', 'optimizer': 'adam', 'graph_mode': 'off', 'use_snp_selection': True, 'num_snps': 24999}. Best is trial 106 with value: 0.08859831686662437.
[I 2025-12-05 14:28:14,417] Trial 137 finished with value: 0.05306690666283979 and parameters: {'model_type': 'mlp', 'hidden_dims': '[256, 128]', 'dropout': 0.481839480895418, 'batch_norm': False, 'lr': 2.4794957298117116e-05, 'weight_decay': 5.658172623458267e-05, 'epochs': 118, 'loss': 'mae', 'optimizer': 'adam', 'graph_mode': 'off', 'use_snp_selection': True, 'num_snps': 38422}. Best is trial 106 with value: 0.08859831686662437.
[I 2025-12-05 14:28:15,545] Trial 138 finished with value: 0.06922220285403452 and parameters: {'model_type': 'mlp', 'hidden_dims': '[256, 128, 64]', 'dropout': 0.44387024850313583, 'batch_norm': False, 'lr': 3.298517820044474e-05, 'weight_decay': 1.6343804790828878e-05, 'epochs': 204, 'loss': 'mse', 'optimizer': 'adam', 'graph_mode': 'off', 'use_snp_selection': False}. Best is trial 106 with value: 0.08859831686662437.
[I 2025-12-05 14:28:17,289] Trial 139 finished with value: 0.06311958437100443 and parameters: {'model_type': 'mlp', 'hidden_dims': '[256, 128, 64]', 'dropout': 0.5402594599323126, 'batch_norm': False, 'lr': 7.061665400075959e-06, 'weight_decay': 0.00019564252305742183, 'epochs': 106, 'loss': 'mse', 'optimizer': 'adam', 'graph_mode': 'off', 'use_snp_selection': True, 'num_snps': 33042}. Best is trial 106 with value: 0.08859831686662437.
[I 2025-12-05 14:28:19,041] Trial 140 finished with value: 0.07039983806976935 and parameters: {'model_type': 'mlp', 'hidden_dims': '[512, 128]', 'dropout': 0.46522996456231064, 'batch_norm': False, 'lr': 1.2041049059606289e-05, 'weight_decay': 0.0002448710659193428, 'epochs': 90, 'loss': 'mse', 'optimizer': 'adam', 'graph_mode': 'off', 'use_snp_selection': True, 'num_snps': 26630}. Best is trial 106 with value: 0.08859831686662437.
[I 2025-12-05 14:28:20,730] Trial 141 finished with value: 0.05810967885029964 and parameters: {'model_type': 'mlp', 'hidden_dims': '[512, 128]', 'dropout': 0.46475200886312273, 'batch_norm': False, 'lr': 1.1899912432671037e-05, 'weight_decay': 0.0002351034853248731, 'epochs': 91, 'loss': 'mse', 'optimizer': 'adam', 'graph_mode': 'off', 'use_snp_selection': True, 'num_snps': 26507}. Best is trial 106 with value: 0.08859831686662437.
[I 2025-12-05 14:28:22,125] Trial 142 finished with value: 0.04724257932483395 and parameters: {'model_type': 'mlp', 'hidden_dims': '[512, 128]', 'dropout': 0.4138762682485794, 'batch_norm': False, 'lr': 1.9830035241899522e-05, 'weight_decay': 0.0004483978810088958, 'epochs': 80, 'loss': 'mse', 'optimizer': 'adam', 'graph_mode': 'off', 'use_snp_selection': True, 'num_snps': 20781}. Best is trial 106 with value: 0.08859831686662437.
[I 2025-12-05 14:28:23,261] Trial 143 finished with value: 0.03707542933616593 and parameters: {'model_type': 'mlp', 'hidden_dims': '[512, 128]', 'dropout': 0.4733723368756691, 'batch_norm': False, 'lr': 1.67076286297201e-05, 'weight_decay': 0.00034257758185320467, 'epochs': 101, 'loss': 'mse', 'optimizer': 'adam', 'graph_mode': 'off', 'use_snp_selection': True, 'num_snps': 13049}. Best is trial 106 with value: 0.08859831686662437.
[I 2025-12-05 14:28:24,933] Trial 144 finished with value: 0.06263194629626309 and parameters: {'model_type': 'mlp', 'hidden_dims': '[512, 128]', 'dropout': 0.4959536827277278, 'batch_norm': False, 'lr': 9.237960963131661e-06, 'weight_decay': 4.610649309132649e-05, 'epochs': 126, 'loss': 'mse', 'optimizer': 'adam', 'graph_mode': 'off', 'use_snp_selection': True, 'num_snps': 22283}. Best is trial 106 with value: 0.08859831686662437.
[I 2025-12-05 14:28:26,810] Trial 145 finished with value: 0.05408109847971375 and parameters: {'model_type': 'mlp', 'hidden_dims': '[512, 128]', 'dropout': 0.45014602315722085, 'batch_norm': False, 'lr': 1.3940417729790839e-05, 'weight_decay': 0.0002637941959901587, 'epochs': 227, 'loss': 'mse', 'optimizer': 'adam', 'graph_mode': 'off', 'use_snp_selection': True, 'num_snps': 24085}. Best is trial 106 with value: 0.08859831686662437.
[I 2025-12-05 14:28:28,974] Trial 146 finished with value: 0.03586453250340916 and parameters: {'model_type': 'mlp', 'hidden_dims': '[256, 128, 64]', 'dropout': 0.2920979303717436, 'batch_norm': False, 'lr': 1.0983512873257196e-05, 'weight_decay': 6.909242787460776e-05, 'epochs': 141, 'loss': 'mse', 'optimizer': 'adam', 'graph_mode': 'off', 'use_snp_selection': True, 'num_snps': 43518}. Best is trial 106 with value: 0.08859831686662437.
[I 2025-12-05 14:28:30,334] Trial 147 finished with value: 0.058082836708843115 and parameters: {'model_type': 'mlp', 'hidden_dims': '[256, 128]', 'dropout': 0.3044240495609006, 'batch_norm': False, 'lr': 2.2982166861525876e-05, 'weight_decay': 0.0006104937183818916, 'epochs': 212, 'loss': 'mae', 'optimizer': 'adam', 'graph_mode': 'off', 'use_snp_selection': True, 'num_snps': 15906}. Best is trial 106 with value: 0.08859831686662437.
[I 2025-12-05 14:28:31,021] Trial 148 finished with value: 0.019887571225450134 and parameters: {'model_type': 'mlp', 'hidden_dims': '[128, 64]', 'dropout': 0.5056320368211208, 'batch_norm': False, 'lr': 0.00031115042550581613, 'weight_decay': 0.00011630086348486272, 'epochs': 110, 'loss': 'mse', 'optimizer': 'adam', 'graph_mode': 'off', 'use_snp_selection': False}. Best is trial 106 with value: 0.08859831686662437.
[I 2025-12-05 14:28:32,601] Trial 149 finished with value: 0.024251865761021427 and parameters: {'model_type': 'mlp', 'hidden_dims': '[256, 128, 64]', 'dropout': 0.279297402754882, 'batch_norm': False, 'lr': 4.585784493464367e-06, 'weight_decay': 3.0764097028403316e-05, 'epochs': 84, 'loss': 'mse', 'optimizer': 'adam', 'graph_mode': 'off', 'use_snp_selection': True, 'num_snps': 28939}. Best is trial 106 with value: 0.08859831686662437.
[I 2025-12-05 14:28:34,895] Trial 0 finished with value: -0.023024786357947403 and parameters: {'model_type': 'mlp', 'hidden_dims': '[128, 64]', 'dropout': 0.199031432379812, 'batch_norm': True, 'lr': 1.8408544111075837e-06, 'weight_decay': 5.5136510071208614e-05, 'epochs': 336, 'loss': 'mae', 'optimizer': 'adam', 'graph_mode': 'off', 'use_snp_selection': True, 'num_snps': 43862}. Best is trial 0 with value: -0.023024786357947403.
[I 2025-12-05 14:28:35,990] Trial 1 finished with value: 0.05180076028098866 and parameters: {'model_type': 'mlp', 'hidden_dims': '[256, 128]', 'dropout': 0.4370668075331726, 'batch_norm': True, 'lr': 7.133471581159139e-05, 'weight_decay': 1.128633586803549e-05, 'epochs': 242, 'loss': 'mae', 'optimizer': 'adam', 'graph_mode': 'off', 'use_snp_selection': False}. Best is trial 1 with value: 0.05180076028098866.
[I 2025-12-05 14:28:37,013] Trial 2 finished with value: 0.005133421520897277 and parameters: {'model_type': 'mlp', 'hidden_dims': '[256, 128, 64]', 'dropout': 0.41314357415569625, 'batch_norm': False, 'lr': 3.952233718592101e-06, 'weight_decay': 0.00026754769258252603, 'epochs': 149, 'loss': 'mse', 'optimizer': 'adam', 'graph_mode': 'off', 'use_snp_selection': True, 'num_snps': 11571}. Best is trial 1 with value: 0.05180076028098866.
[I 2025-12-05 14:28:39,003] Trial 3 finished with value: 0.025670881949851822 and parameters: {'model_type': 'mlp', 'hidden_dims': '[512, 64]', 'dropout': 0.5938127374509361, 'batch_norm': False, 'lr': 5.67704586114731e-06, 'weight_decay': 2.4518087630137052e-05, 'epochs': 320, 'loss': 'mae', 'optimizer': 'adam', 'graph_mode': 'off', 'use_snp_selection': False}. Best is trial 1 with value: 0.05180076028098866.
[I 2025-12-05 14:28:41,330] Trial 4 finished with value: 0.0572556708922615 and parameters: {'model_type': 'mlp', 'hidden_dims': '[512, 128]', 'dropout': 0.25746343592134413, 'batch_norm': True, 'lr': 1.3467657668402788e-06, 'weight_decay': 0.00033087251918647806, 'epochs': 277, 'loss': 'mse', 'optimizer': 'adam', 'graph_mode': 'off', 'use_snp_selection': True, 'num_snps': 36675}. Best is trial 4 with value: 0.0572556708922615.
[I 2025-12-05 14:28:43,129] Trial 5 finished with value: 0.06552593845841431 and parameters: {'model_type': 'mlp', 'hidden_dims': '[512, 64]', 'dropout': 0.38275350994408375, 'batch_norm': True, 'lr': 1.5586664309232824e-06, 'weight_decay': 0.0008227664668621182, 'epochs': 145, 'loss': 'mae', 'optimizer': 'adam', 'graph_mode': 'off', 'use_snp_selection': True, 'num_snps': 32148}. Best is trial 5 with value: 0.06552593845841431.
[I 2025-12-05 14:28:44,152] Trial 6 finished with value: 0.04628627179938197 and parameters: {'model_type': 'mlp', 'hidden_dims': '[256, 128]', 'dropout': 0.3930109900265879, 'batch_norm': False, 'lr': 4.892964372128395e-05, 'weight_decay': 1.5809549317992182e-06, 'epochs': 199, 'loss': 'mse', 'optimizer': 'adam', 'graph_mode': 'off', 'use_snp_selection': False}. Best is trial 5 with value: 0.06552593845841431.
