[I 2025-12-05 16:13:46,717] Trial 107 finished with value: 0.09088297339048228 and parameters: {'model_type': 'mlp', 'hidden_dims': '[256, 128]', 'dropout': 0.2160426520619165, 'batch_norm': False, 'lr': 1.0751474883217484e-06, 'weight_decay': 3.425848807335435e-05, 'epochs': 319, 'loss': 'mae', 'optimizer': 'adam', 'graph_mode': 'off', 'use_snp_selection': True, 'num_snps': 16568}. Best is trial 62 with value: 0.15725047618264015.
[I 2025-12-05 16:13:48,128] Trial 108 finished with value: 0.1527884205926312 and parameters: {'model_type': 'mlp', 'hidden_dims': '[512, 128]', 'dropout': 0.16224455150687678, 'batch_norm': True, 'lr': 0.00015214618150175138, 'weight_decay': 6.931570980828316e-05, 'epochs': 43, 'loss': 'mae', 'optimizer': 'adam', 'graph_mode': 'off', 'use_snp_selection': True, 'num_snps': 23298}. Best is trial 62 with value: 0.15725047618264015.
[I 2025-12-05 16:13:49,641] Trial 109 finished with value: 0.14617935053788084 and parameters: {'model_type': 'mlp', 'hidden_dims': '[512, 128]', 'dropout': 0.12906730299065872, 'batch_norm': True, 'lr': 0.00010268993781791406, 'weight_decay': 7.305912045042385e-05, 'epochs': 81, 'loss': 'mae', 'optimizer': 'adam', 'graph_mode': 'off', 'use_snp_selection': True, 'num_snps': 23172}. Best is trial 62 with value: 0.15725047618264015.
[I 2025-12-05 16:13:50,955] Trial 110 finished with value: 0.14041809290170149 and parameters: {'model_type': 'mlp', 'hidden_dims': '[512, 128]', 'dropout': 0.11068138138249006, 'batch_norm': True, 'lr': 0.00014077039263210223, 'weight_decay': 9.976510281431386e-05, 'epochs': 47, 'loss': 'mae', 'optimizer': 'adam', 'graph_mode': 'off', 'use_snp_selection': True, 'num_snps': 19697}. Best is trial 62 with value: 0.15725047618264015.
[I 2025-12-05 16:13:52,566] Trial 111 finished with value: 0.1300339783444403 and parameters: {'model_type': 'mlp', 'hidden_dims': '[512, 128]', 'dropout': 0.16084691430047277, 'batch_norm': True, 'lr': 0.0001228669235351273, 'weight_decay': 5.952971470057623e-05, 'epochs': 336, 'loss': 'mae', 'optimizer': 'adam', 'graph_mode': 'off', 'use_snp_selection': True, 'num_snps': 15102}. Best is trial 62 with value: 0.15725047618264015.
[I 2025-12-05 16:13:54,389] Trial 112 finished with value: 0.11529766335655472 and parameters: {'model_type': 'mlp', 'hidden_dims': '[512, 128]', 'dropout': 0.33885703122638433, 'batch_norm': True, 'lr': 0.00017864214716605372, 'weight_decay': 0.0002467259136868711, 'epochs': 127, 'loss': 'mae', 'optimizer': 'adam', 'graph_mode': 'off', 'use_snp_selection': True, 'num_snps': 29304}. Best is trial 62 with value: 0.15725047618264015.
[I 2025-12-05 16:13:56,138] Trial 113 finished with value: 0.13655990219917802 and parameters: {'model_type': 'mlp', 'hidden_dims': '[256, 128, 64]', 'dropout': 0.16686506080037228, 'batch_norm': True, 'lr': 0.0002998466839459352, 'weight_decay': 1.618570571416076e-07, 'epochs': 330, 'loss': 'mae', 'optimizer': 'adam', 'graph_mode': 'off', 'use_snp_selection': True, 'num_snps': 17574}. Best is trial 62 with value: 0.15725047618264015.
[I 2025-12-05 16:13:57,750] Trial 114 finished with value: 0.14358727742713817 and parameters: {'model_type': 'mlp', 'hidden_dims': '[256, 128]', 'dropout': 0.1894222593720495, 'batch_norm': False, 'lr': 0.00015123557715470312, 'weight_decay': 0.00018069955747481678, 'epochs': 313, 'loss': 'mae', 'optimizer': 'adam', 'graph_mode': 'off', 'use_snp_selection': True, 'num_snps': 22131}. Best is trial 62 with value: 0.15725047618264015.
[I 2025-12-05 16:13:59,013] Trial 115 finished with value: 0.12423921651012303 and parameters: {'model_type': 'mlp', 'hidden_dims': '[512, 128]', 'dropout': 0.17626145890837144, 'batch_norm': True, 'lr': 0.00020943998762814245, 'weight_decay': 4.050239914129642e-05, 'epochs': 160, 'loss': 'mae', 'optimizer': 'adam', 'graph_mode': 'off', 'use_snp_selection': True, 'num_snps': 13134}. Best is trial 62 with value: 0.15725047618264015.
[I 2025-12-05 16:14:00,867] Trial 116 finished with value: 0.14093812833639732 and parameters: {'model_type': 'mlp', 'hidden_dims': '[512, 64]', 'dropout': 0.14928952166690393, 'batch_norm': False, 'lr': 0.00024583724762952506, 'weight_decay': 0.00011695324496003788, 'epochs': 323, 'loss': 'mae', 'optimizer': 'adam', 'graph_mode': 'off', 'use_snp_selection': True, 'num_snps': 20432}. Best is trial 62 with value: 0.15725047618264015.
[I 2025-12-05 16:14:02,297] Trial 117 finished with value: 0.14833338791721212 and parameters: {'model_type': 'mlp', 'hidden_dims': '[256, 128]', 'dropout': 0.1557797890248282, 'batch_norm': False, 'lr': 0.0003567857701290361, 'weight_decay': 5.2536066353044905e-05, 'epochs': 298, 'loss': 'mae', 'optimizer': 'adam', 'graph_mode': 'off', 'use_snp_selection': False}. Best is trial 62 with value: 0.15725047618264015.
[I 2025-12-05 16:14:03,131] Trial 118 finished with value: 0.13622617224080738 and parameters: {'model_type': 'mlp', 'hidden_dims': '[256, 128]', 'dropout': 0.14084027255912818, 'batch_norm': True, 'lr': 0.00035564339710655277, 'weight_decay': 5.2762835177904124e-05, 'epochs': 96, 'loss': 'mae', 'optimizer': 'adam', 'graph_mode': 'off', 'use_snp_selection': False}. Best is trial 62 with value: 0.15725047618264015.
[I 2025-12-05 16:14:04,656] Trial 119 finished with value: 0.14483503050960192 and parameters: {'model_type': 'mlp', 'hidden_dims': '[256, 128]', 'dropout': 0.15758481630354018, 'batch_norm': False, 'lr': 0.0006139067980570415, 'weight_decay': 8.817382006051701e-05, 'epochs': 340, 'loss': 'mse', 'optimizer': 'adam', 'graph_mode': 'off', 'use_snp_selection': False}. Best is trial 62 with value: 0.15725047618264015.
[I 2025-12-05 16:14:07,053] Trial 120 finished with value: 0.13532322457291981 and parameters: {'model_type': 'mlp', 'hidden_dims': '[512, 128]', 'dropout': 0.127073574203708, 'batch_norm': False, 'lr': 0.0004453466679014008, 'weight_decay': 0.00027317622954788155, 'epochs': 296, 'loss': 'mae', 'optimizer': 'adam', 'graph_mode': 'off', 'use_snp_selection': False}. Best is trial 62 with value: 0.15725047618264015.
[I 2025-12-05 16:14:08,470] Trial 121 finished with value: 0.13931383343058823 and parameters: {'model_type': 'mlp', 'hidden_dims': '[256, 128]', 'dropout': 0.17311522792687134, 'batch_norm': False, 'lr': 0.00037852415000889933, 'weight_decay': 2.5505052493863847e-05, 'epochs': 306, 'loss': 'mae', 'optimizer': 'adam', 'graph_mode': 'off', 'use_snp_selection': True, 'num_snps': 14468}. Best is trial 62 with value: 0.15725047618264015.
[I 2025-12-05 16:14:09,997] Trial 122 finished with value: 0.13776850168568683 and parameters: {'model_type': 'mlp', 'hidden_dims': '[256, 128]', 'dropout': 0.18227456336263326, 'batch_norm': False, 'lr': 0.00032378870133154594, 'weight_decay': 7.44777226841278e-05, 'epochs': 318, 'loss': 'mae', 'optimizer': 'adam', 'graph_mode': 'off', 'use_snp_selection': True, 'num_snps': 18766}. Best is trial 62 with value: 0.15725047618264015.
[I 2025-12-05 16:14:11,311] Trial 123 finished with value: 0.14500413253783695 and parameters: {'model_type': 'mlp', 'hidden_dims': '[256, 128]', 'dropout': 0.15123336214407265, 'batch_norm': False, 'lr': 0.00016470854393514707, 'weight_decay': 4.699439424957001e-05, 'epochs': 266, 'loss': 'mae', 'optimizer': 'adam', 'graph_mode': 'off', 'use_snp_selection': False}. Best is trial 62 with value: 0.15725047618264015.
[I 2025-12-05 16:14:12,809] Trial 124 finished with value: 0.12718234819507834 and parameters: {'model_type': 'mlp', 'hidden_dims': '[256, 128]', 'dropout': 0.22165618516168775, 'batch_norm': False, 'lr': 0.00019659072304551, 'weight_decay': 0.00015253975096379298, 'epochs': 331, 'loss': 'mae', 'optimizer': 'adam', 'graph_mode': 'off', 'use_snp_selection': False}. Best is trial 62 with value: 0.15725047618264015.
[I 2025-12-05 16:14:14,516] Trial 125 finished with value: 0.13825999074454873 and parameters: {'model_type': 'mlp', 'hidden_dims': '[256, 128]', 'dropout': 0.2026507336795691, 'batch_norm': False, 'lr': 0.0002700919293441426, 'weight_decay': 6.164462054394354e-05, 'epochs': 324, 'loss': 'mae', 'optimizer': 'adam', 'graph_mode': 'off', 'use_snp_selection': True, 'num_snps': 24546}. Best is trial 62 with value: 0.15725047618264015.
[I 2025-12-05 16:14:16,144] Trial 126 finished with value: 0.13957505324096364 and parameters: {'model_type': 'mlp', 'hidden_dims': '[512, 256]', 'dropout': 0.1381783645568558, 'batch_norm': False, 'lr': 9.84844323127185e-05, 'weight_decay': 0.00020747940955868655, 'epochs': 315, 'loss': 'mae', 'optimizer': 'adam', 'graph_mode': 'off', 'use_snp_selection': True, 'num_snps': 16148}. Best is trial 62 with value: 0.15725047618264015.
[I 2025-12-05 16:14:17,515] Trial 127 finished with value: 0.12439873488603433 and parameters: {'model_type': 'mlp', 'hidden_dims': '[256, 128]', 'dropout': 0.16418394960371135, 'batch_norm': True, 'lr': 0.00023415020612626067, 'weight_decay': 3.265511105320642e-05, 'epochs': 299, 'loss': 'mae', 'optimizer': 'adam', 'graph_mode': 'off', 'use_snp_selection': True, 'num_snps': 11826}. Best is trial 62 with value: 0.15725047618264015.
[I 2025-12-05 16:14:18,541] Trial 128 finished with value: 0.12816089155577343 and parameters: {'model_type': 'mlp', 'hidden_dims': '[128, 64]', 'dropout': 0.11788890908805763, 'batch_norm': False, 'lr': 0.0005021830774200935, 'weight_decay': 1.7461668815811894e-05, 'epochs': 337, 'loss': 'mae', 'optimizer': 'adam', 'graph_mode': 'off', 'use_snp_selection': False}. Best is trial 62 with value: 0.15725047618264015.
[I 2025-12-05 16:14:21,409] Trial 129 finished with value: 0.1332322427201983 and parameters: {'model_type': 'mlp', 'hidden_dims': '[256, 128]', 'dropout': 0.1886906391123379, 'batch_norm': False, 'lr': 0.0001222261598652245, 'weight_decay': 0.0003994570700432498, 'epochs': 234, 'loss': 'mae', 'optimizer': 'adam', 'graph_mode': 'off', 'use_snp_selection': True, 'num_snps': 57451}. Best is trial 62 with value: 0.15725047618264015.
[I 2025-12-05 16:14:25,414] Trial 130 finished with value: 0.14162512863640758 and parameters: {'model_type': 'mlp', 'hidden_dims': '[512, 128]', 'dropout': 0.5945446905065848, 'batch_norm': True, 'lr': 0.0003274762951511104, 'weight_decay': 0.00010446138739080707, 'epochs': 350, 'loss': 'mae', 'optimizer': 'adam', 'graph_mode': 'off', 'use_snp_selection': True, 'num_snps': 53433}. Best is trial 62 with value: 0.15725047618264015.
[I 2025-12-05 16:14:27,060] Trial 131 finished with value: 0.06069699561349335 and parameters: {'model_type': 'mlp', 'hidden_dims': '[256, 128]', 'dropout': 0.21095379191113178, 'batch_norm': True, 'lr': 1.2189814811696452e-05, 'weight_decay': 3.808769426609388e-05, 'epochs': 344, 'loss': 'mae', 'optimizer': 'adam', 'graph_mode': 'off', 'use_snp_selection': True, 'num_snps': 17532}. Best is trial 62 with value: 0.15725047618264015.
[I 2025-12-05 16:14:28,738] Trial 132 finished with value: 0.145237258739545 and parameters: {'model_type': 'mlp', 'hidden_dims': '[256, 128]', 'dropout': 0.1984114601176412, 'batch_norm': True, 'lr': 0.0005533825917493435, 'weight_decay': 5.19656113873535e-05, 'epochs': 331, 'loss': 'mae', 'optimizer': 'adam', 'graph_mode': 'off', 'use_snp_selection': True, 'num_snps': 20380}. Best is trial 62 with value: 0.15725047618264015.
[I 2025-12-05 16:14:31,046] Trial 133 finished with value: 0.14140705616763016 and parameters: {'model_type': 'mlp', 'hidden_dims': '[256, 128]', 'dropout': 0.17333639251363642, 'batch_norm': True, 'lr': 0.00039071841937752746, 'weight_decay': 6.388014600723719e-05, 'epochs': 325, 'loss': 'mae', 'optimizer': 'adam', 'graph_mode': 'off', 'use_snp_selection': True, 'num_snps': 38835}. Best is trial 62 with value: 0.15725047618264015.
[I 2025-12-05 16:14:32,689] Trial 134 finished with value: 0.1438072281494026 and parameters: {'model_type': 'mlp', 'hidden_dims': '[256, 128]', 'dropout': 0.24007450688704757, 'batch_norm': True, 'lr': 0.0004197448899899591, 'weight_decay': 8.178929715163252e-05, 'epochs': 339, 'loss': 'mae', 'optimizer': 'adam', 'graph_mode': 'off', 'use_snp_selection': True, 'num_snps': 18752}. Best is trial 62 with value: 0.15725047618264015.
[I 2025-12-05 16:14:34,382] Trial 135 finished with value: 0.06503577116105694 and parameters: {'model_type': 'mlp', 'hidden_dims': '[256, 128]', 'dropout': 0.15601867607311526, 'batch_norm': True, 'lr': 2.0400085744526827e-06, 'weight_decay': 1.3039682299656991e-05, 'epochs': 283, 'loss': 'mae', 'optimizer': 'adam', 'graph_mode': 'off', 'use_snp_selection': True, 'num_snps': 22626}. Best is trial 62 with value: 0.15725047618264015.
[I 2025-12-05 16:14:36,457] Trial 136 finished with value: 0.14662968929526343 and parameters: {'model_type': 'mlp', 'hidden_dims': '[256, 128]', 'dropout': 0.18641758556727184, 'batch_norm': False, 'lr': 0.00029355199166572666, 'weight_decay': 0.00012637295865151592, 'epochs': 307, 'loss': 'mae', 'optimizer': 'adam', 'graph_mode': 'off', 'use_snp_selection': True, 'num_snps': 33520}. Best is trial 62 with value: 0.15725047618264015.
[I 2025-12-05 16:14:38,010] Trial 137 finished with value: 0.14245659612077693 and parameters: {'model_type': 'mlp', 'hidden_dims': '[256, 128, 64]', 'dropout': 0.13191817647980028, 'batch_norm': False, 'lr': 0.00020867377953698234, 'weight_decay': 2.6610679987927613e-05, 'epochs': 335, 'loss': 'mae', 'optimizer': 'adam', 'graph_mode': 'off', 'use_snp_selection': True, 'num_snps': 16668}. Best is trial 62 with value: 0.15725047618264015.
[I 2025-12-05 16:14:40,667] Trial 138 finished with value: 0.14311753890993772 and parameters: {'model_type': 'mlp', 'hidden_dims': '[256, 128]', 'dropout': 0.1654297209620794, 'batch_norm': True, 'lr': 0.0006460528018403168, 'weight_decay': 4.5317394414249673e-05, 'epochs': 318, 'loss': 'mae', 'optimizer': 'adam', 'graph_mode': 'off', 'use_snp_selection': True, 'num_snps': 47438}. Best is trial 62 with value: 0.15725047618264015.
[I 2025-12-05 16:14:42,738] Trial 139 finished with value: 0.12843182642987946 and parameters: {'model_type': 'mlp', 'hidden_dims': '[512, 128]', 'dropout': 0.20502972840037778, 'batch_norm': False, 'lr': 0.00015311660249277276, 'weight_decay': 0.00017533637639179846, 'epochs': 344, 'loss': 'mae', 'optimizer': 'adam', 'graph_mode': 'off', 'use_snp_selection': True, 'num_snps': 21559}. Best is trial 62 with value: 0.15725047618264015.
[I 2025-12-05 16:14:44,234] Trial 140 finished with value: 0.13078845029572994 and parameters: {'model_type': 'mlp', 'hidden_dims': '[256, 128]', 'dropout': 0.14831709511893607, 'batch_norm': True, 'lr': 0.00025388700204802023, 'weight_decay': 0.0005282331140177428, 'epochs': 329, 'loss': 'mse', 'optimizer': 'adam', 'graph_mode': 'off', 'use_snp_selection': True, 'num_snps': 14311}. Best is trial 62 with value: 0.15725047618264015.
[I 2025-12-05 16:14:45,972] Trial 141 finished with value: 0.15543275957792257 and parameters: {'model_type': 'mlp', 'hidden_dims': '[512, 128]', 'dropout': 0.16199557166190912, 'batch_norm': False, 'lr': 0.00016175693842916542, 'weight_decay': 0.00046009967121240114, 'epochs': 290, 'loss': 'mae', 'optimizer': 'adam', 'graph_mode': 'off', 'use_snp_selection': True, 'num_snps': 19227}. Best is trial 62 with value: 0.15725047618264015.
[I 2025-12-05 16:14:47,668] Trial 142 finished with value: 0.14314771407328278 and parameters: {'model_type': 'mlp', 'hidden_dims': '[512, 128]', 'dropout': 0.17630560249937063, 'batch_norm': False, 'lr': 0.00018271711502744833, 'weight_decay': 0.0006593587420955831, 'epochs': 276, 'loss': 'mae', 'optimizer': 'adam', 'graph_mode': 'off', 'use_snp_selection': True, 'num_snps': 18761}. Best is trial 62 with value: 0.15725047618264015.
[I 2025-12-05 16:14:49,256] Trial 143 finished with value: 0.14319411065533533 and parameters: {'model_type': 'mlp', 'hidden_dims': '[512, 128]', 'dropout': 0.19556813337936113, 'batch_norm': False, 'lr': 0.00016485290730138428, 'weight_decay': 7.193608591119361e-06, 'epochs': 312, 'loss': 'mae', 'optimizer': 'adam', 'graph_mode': 'off', 'use_snp_selection': True, 'num_snps': 15588}. Best is trial 62 with value: 0.15725047618264015.
[I 2025-12-05 16:14:51,026] Trial 144 finished with value: 0.14179982898888877 and parameters: {'model_type': 'mlp', 'hidden_dims': '[512, 128]', 'dropout': 0.13850847560731155, 'batch_norm': False, 'lr': 0.00021902638991948034, 'weight_decay': 0.0009236796601123086, 'epochs': 290, 'loss': 'mae', 'optimizer': 'adam', 'graph_mode': 'off', 'use_snp_selection': True, 'num_snps': 19821}. Best is trial 62 with value: 0.15725047618264015.
[I 2025-12-05 16:14:52,690] Trial 145 finished with value: 0.1574260873906022 and parameters: {'model_type': 'mlp', 'hidden_dims': '[512, 128]', 'dropout': 0.16035295981631928, 'batch_norm': False, 'lr': 0.0005104973023991696, 'weight_decay': 0.0002834460293294208, 'epochs': 301, 'loss': 'mae', 'optimizer': 'adam', 'graph_mode': 'off', 'use_snp_selection': True, 'num_snps': 17344}. Best is trial 145 with value: 0.1574260873906022.
[I 2025-12-05 16:14:54,315] Trial 146 finished with value: 0.1494798286744135 and parameters: {'model_type': 'mlp', 'hidden_dims': '[512, 128]', 'dropout': 0.1638962723286678, 'batch_norm': False, 'lr': 0.00013444835833836195, 'weight_decay': 0.0003040380150474553, 'epochs': 287, 'loss': 'mae', 'optimizer': 'adam', 'graph_mode': 'off', 'use_snp_selection': True, 'num_snps': 17207}. Best is trial 145 with value: 0.1574260873906022.
[I 2025-12-05 16:14:56,027] Trial 147 finished with value: 0.12674103941948375 and parameters: {'model_type': 'mlp', 'hidden_dims': '[512, 128]', 'dropout': 0.16002047972949113, 'batch_norm': False, 'lr': 0.0001318482103997467, 'weight_decay': 0.00031484900433666706, 'epochs': 300, 'loss': 'mae', 'optimizer': 'adam', 'graph_mode': 'off', 'use_snp_selection': True, 'num_snps': 17987}. Best is trial 145 with value: 0.1574260873906022.
[I 2025-12-05 16:14:57,599] Trial 148 finished with value: 0.14301619578378413 and parameters: {'model_type': 'mlp', 'hidden_dims': '[512, 128]', 'dropout': 0.1425643587665935, 'batch_norm': False, 'lr': 7.32907338105208e-05, 'weight_decay': 0.00041999629098263936, 'epochs': 258, 'loss': 'mae', 'optimizer': 'adam', 'graph_mode': 'off', 'use_snp_selection': True, 'num_snps': 17090}. Best is trial 145 with value: 0.1574260873906022.
[I 2025-12-05 16:14:59,957] Trial 149 finished with value: 0.14162761002012506 and parameters: {'model_type': 'mlp', 'hidden_dims': '[512, 128]', 'dropout': 0.14929327190110983, 'batch_norm': False, 'lr': 0.0008354978590753148, 'weight_decay': 0.00024089276430774498, 'epochs': 288, 'loss': 'mae', 'optimizer': 'adam', 'graph_mode': 'off', 'use_snp_selection': False}. Best is trial 145 with value: 0.1574260873906022.
[I 2025-12-05 16:15:02,163] Trial 0 finished with value: 0.0028426485319686065 and parameters: {'model_type': 'mlp', 'hidden_dims': '[128, 64]', 'dropout': 0.199031432379812, 'batch_norm': True, 'lr': 1.8408544111075837e-06, 'weight_decay': 5.5136510071208614e-05, 'epochs': 336, 'loss': 'mae', 'optimizer': 'adam', 'graph_mode': 'off', 'use_snp_selection': True, 'num_snps': 43862}. Best is trial 0 with value: 0.0028426485319686065.
[I 2025-12-05 16:15:03,324] Trial 1 finished with value: 0.0006265217536331161 and parameters: {'model_type': 'mlp', 'hidden_dims': '[256, 128]', 'dropout': 0.4370668075331726, 'batch_norm': True, 'lr': 7.133471581159139e-05, 'weight_decay': 1.128633586803549e-05, 'epochs': 242, 'loss': 'mae', 'optimizer': 'adam', 'graph_mode': 'off', 'use_snp_selection': False}. Best is trial 0 with value: 0.0028426485319686065.
[I 2025-12-05 16:15:04,379] Trial 2 finished with value: -0.001939275022504842 and parameters: {'model_type': 'mlp', 'hidden_dims': '[256, 128, 64]', 'dropout': 0.41314357415569625, 'batch_norm': False, 'lr': 3.952233718592101e-06, 'weight_decay': 0.00026754769258252603, 'epochs': 149, 'loss': 'mse', 'optimizer': 'adam', 'graph_mode': 'off', 'use_snp_selection': True, 'num_snps': 11571}. Best is trial 0 with value: 0.0028426485319686065.
[I 2025-12-05 16:15:06,518] Trial 3 finished with value: -0.018105103598655067 and parameters: {'model_type': 'mlp', 'hidden_dims': '[512, 64]', 'dropout': 0.5938127374509361, 'batch_norm': False, 'lr': 5.67704586114731e-06, 'weight_decay': 2.4518087630137052e-05, 'epochs': 320, 'loss': 'mae', 'optimizer': 'adam', 'graph_mode': 'off', 'use_snp_selection': False}. Best is trial 0 with value: 0.0028426485319686065.
[I 2025-12-05 16:15:08,875] Trial 4 finished with value: 0.024485224539466468 and parameters: {'model_type': 'mlp', 'hidden_dims': '[512, 128]', 'dropout': 0.25746343592134413, 'batch_norm': True, 'lr': 1.3467657668402788e-06, 'weight_decay': 0.00033087251918647806, 'epochs': 277, 'loss': 'mse', 'optimizer': 'adam', 'graph_mode': 'off', 'use_snp_selection': True, 'num_snps': 36675}. Best is trial 4 with value: 0.024485224539466468.
[I 2025-12-05 16:15:10,688] Trial 5 finished with value: -0.04299287844403824 and parameters: {'model_type': 'mlp', 'hidden_dims': '[512, 64]', 'dropout': 0.38275350994408375, 'batch_norm': True, 'lr': 1.5586664309232824e-06, 'weight_decay': 0.0008227664668621182, 'epochs': 145, 'loss': 'mae', 'optimizer': 'adam', 'graph_mode': 'off', 'use_snp_selection': True, 'num_snps': 32148}. Best is trial 4 with value: 0.024485224539466468.
[I 2025-12-05 16:15:11,736] Trial 6 finished with value: 0.019411182003711464 and parameters: {'model_type': 'mlp', 'hidden_dims': '[256, 128]', 'dropout': 0.3930109900265879, 'batch_norm': False, 'lr': 4.892964372128395e-05, 'weight_decay': 1.5809549317992182e-06, 'epochs': 199, 'loss': 'mse', 'optimizer': 'adam', 'graph_mode': 'off', 'use_snp_selection': False}. Best is trial 4 with value: 0.024485224539466468.
