[I 2025-12-05 16:10:50,469] Trial 59 finished with value: 0.05821000749768637 and parameters: {'model_type': 'mlp', 'hidden_dims': '[512, 256]', 'dropout': 0.5631379366831802, 'batch_norm': True, 'lr': 0.0003933519302297676, 'weight_decay': 1.954856217611612e-05, 'epochs': 90, 'loss': 'mae', 'optimizer': 'adam', 'graph_mode': 'off', 'use_snp_selection': False}. Best is trial 39 with value: 0.09628022092225558.
[I 2025-12-05 16:10:51,639] Trial 60 finished with value: 0.03374523403482714 and parameters: {'model_type': 'mlp', 'hidden_dims': '[256, 128]', 'dropout': 0.5989883452334668, 'batch_norm': False, 'lr': 0.00022797075988749296, 'weight_decay': 8.379734647289669e-07, 'epochs': 194, 'loss': 'mse', 'optimizer': 'adam', 'graph_mode': 'off', 'use_snp_selection': False}. Best is trial 39 with value: 0.09628022092225558.
[I 2025-12-05 16:10:52,670] Trial 61 finished with value: 0.09261458299342944 and parameters: {'model_type': 'mlp', 'hidden_dims': '[256, 128, 64]', 'dropout': 0.441887890059961, 'batch_norm': False, 'lr': 0.0005702675470164771, 'weight_decay': 0.0005900109157377383, 'epochs': 141, 'loss': 'mse', 'optimizer': 'adam', 'graph_mode': 'off', 'use_snp_selection': False}. Best is trial 39 with value: 0.09628022092225558.
[I 2025-12-05 16:10:53,495] Trial 62 finished with value: 0.05610353827467052 and parameters: {'model_type': 'mlp', 'hidden_dims': '[128, 64]', 'dropout': 0.46113187361117575, 'batch_norm': False, 'lr': 0.0005347077460059589, 'weight_decay': 4.2313717604161626e-05, 'epochs': 144, 'loss': 'mse', 'optimizer': 'adam', 'graph_mode': 'off', 'use_snp_selection': False}. Best is trial 39 with value: 0.09628022092225558.
[I 2025-12-05 16:10:54,634] Trial 63 finished with value: 0.04106433559826162 and parameters: {'model_type': 'mlp', 'hidden_dims': '[256, 128, 64]', 'dropout': 0.3880586923943876, 'batch_norm': False, 'lr': 0.00030919688317111504, 'weight_decay': 0.0002088562517217925, 'epochs': 167, 'loss': 'mse', 'optimizer': 'adam', 'graph_mode': 'off', 'use_snp_selection': False}. Best is trial 39 with value: 0.09628022092225558.
[I 2025-12-05 16:10:56,212] Trial 64 finished with value: 0.05220223722510228 and parameters: {'model_type': 'mlp', 'hidden_dims': '[512, 256]', 'dropout': 0.4931215380227737, 'batch_norm': False, 'lr': 0.00018569205223038958, 'weight_decay': 0.0009818239558059374, 'epochs': 134, 'loss': 'mse', 'optimizer': 'adam', 'graph_mode': 'off', 'use_snp_selection': False}. Best is trial 39 with value: 0.09628022092225558.
[I 2025-12-05 16:10:57,662] Trial 65 finished with value: 0.10536764442322526 and parameters: {'model_type': 'mlp', 'hidden_dims': '[512, 64]', 'dropout': 0.4229230511212084, 'batch_norm': True, 'lr': 0.0001220974935268125, 'weight_decay': 8.31837280663838e-05, 'epochs': 119, 'loss': 'mae', 'optimizer': 'adam', 'graph_mode': 'off', 'use_snp_selection': False}. Best is trial 65 with value: 0.10536764442322526.
[I 2025-12-05 16:10:59,206] Trial 66 finished with value: 0.07550742294968907 and parameters: {'model_type': 'mlp', 'hidden_dims': '[512, 64]', 'dropout': 0.5423337317560827, 'batch_norm': False, 'lr': 0.00010392678472901761, 'weight_decay': 0.00013492199769336288, 'epochs': 102, 'loss': 'mse', 'optimizer': 'adam', 'graph_mode': 'off', 'use_snp_selection': True, 'num_snps': 22881}. Best is trial 65 with value: 0.10536764442322526.
[I 2025-12-05 16:11:00,683] Trial 67 finished with value: 0.006046279169049114 and parameters: {'model_type': 'mlp', 'hidden_dims': '[512, 64]', 'dropout': 0.46554834463228045, 'batch_norm': True, 'lr': 1.038788092140181e-06, 'weight_decay': 0.00026009073970253304, 'epochs': 114, 'loss': 'mae', 'optimizer': 'adam', 'graph_mode': 'off', 'use_snp_selection': False}. Best is trial 65 with value: 0.10536764442322526.
[I 2025-12-05 16:11:01,917] Trial 68 finished with value: 0.0697211236172857 and parameters: {'model_type': 'mlp', 'hidden_dims': '[512, 64]', 'dropout': 0.3326798987697642, 'batch_norm': True, 'lr': 0.0002655468972285094, 'weight_decay': 7.488969478097806e-05, 'epochs': 77, 'loss': 'mae', 'optimizer': 'adam', 'graph_mode': 'off', 'use_snp_selection': False}. Best is trial 65 with value: 0.10536764442322526.
[I 2025-12-05 16:11:02,710] Trial 69 finished with value: 0.07041949321381746 and parameters: {'model_type': 'mlp', 'hidden_dims': '[128, 64]', 'dropout': 0.4327787989252899, 'batch_norm': True, 'lr': 0.00012467828460294896, 'weight_decay': 0.00013431576754652046, 'epochs': 123, 'loss': 'mse', 'optimizer': 'adam', 'graph_mode': 'off', 'use_snp_selection': False}. Best is trial 65 with value: 0.10536764442322526.
[I 2025-12-05 16:11:03,778] Trial 70 finished with value: 0.040808350402919163 and parameters: {'model_type': 'mlp', 'hidden_dims': '[512, 64]', 'dropout': 0.2833082857186198, 'batch_norm': False, 'lr': 0.00016108399840552876, 'weight_decay': 0.0006467988397739231, 'epochs': 56, 'loss': 'mae', 'optimizer': 'adam', 'graph_mode': 'off', 'use_snp_selection': False}. Best is trial 65 with value: 0.10536764442322526.
[I 2025-12-05 16:11:04,831] Trial 71 finished with value: 0.0770327351807709 and parameters: {'model_type': 'mlp', 'hidden_dims': '[256, 128]', 'dropout': 0.41883594015862863, 'batch_norm': True, 'lr': 0.0003593235303002408, 'weight_decay': 3.32445082072704e-05, 'epochs': 149, 'loss': 'mae', 'optimizer': 'adam', 'graph_mode': 'off', 'use_snp_selection': False}. Best is trial 65 with value: 0.10536764442322526.
[I 2025-12-05 16:11:05,863] Trial 72 finished with value: 0.09575855449756585 and parameters: {'model_type': 'mlp', 'hidden_dims': '[256, 128, 64]', 'dropout': 0.4404468093559574, 'batch_norm': True, 'lr': 0.000565741493528513, 'weight_decay': 1.3679994334262802e-05, 'epochs': 121, 'loss': 'mae', 'optimizer': 'adam', 'graph_mode': 'off', 'use_snp_selection': False}. Best is trial 65 with value: 0.10536764442322526.
[I 2025-12-05 16:11:07,197] Trial 73 finished with value: 0.05053864264313624 and parameters: {'model_type': 'mlp', 'hidden_dims': '[512, 256]', 'dropout': 0.4452422074465033, 'batch_norm': True, 'lr': 7.697487201858626e-05, 'weight_decay': 1.8046448664708175e-07, 'epochs': 92, 'loss': 'mae', 'optimizer': 'adam', 'graph_mode': 'off', 'use_snp_selection': False}. Best is trial 65 with value: 0.10536764442322526.
[I 2025-12-05 16:11:08,003] Trial 74 finished with value: 0.0797085591698353 and parameters: {'model_type': 'mlp', 'hidden_dims': '[128, 64]', 'dropout': 0.4023135047589706, 'batch_norm': True, 'lr': 0.0005460542563611129, 'weight_decay': 1.3035257250820412e-05, 'epochs': 127, 'loss': 'mae', 'optimizer': 'adam', 'graph_mode': 'off', 'use_snp_selection': False}. Best is trial 65 with value: 0.10536764442322526.
[I 2025-12-05 16:11:08,956] Trial 75 finished with value: 0.0731936763643713 and parameters: {'model_type': 'mlp', 'hidden_dims': '[256, 128, 64]', 'dropout': 0.49574227561267076, 'batch_norm': True, 'lr': 0.00021218744296435036, 'weight_decay': 8.801228966181616e-05, 'epochs': 99, 'loss': 'mae', 'optimizer': 'adam', 'graph_mode': 'off', 'use_snp_selection': False}. Best is trial 65 with value: 0.10536764442322526.
[I 2025-12-05 16:11:11,672] Trial 76 finished with value: 0.07885350634300772 and parameters: {'model_type': 'mlp', 'hidden_dims': '[512, 64]', 'dropout': 0.47258813506694686, 'batch_norm': True, 'lr': 0.000442945444135693, 'weight_decay': 4.3812186133289974e-05, 'epochs': 327, 'loss': 'mae', 'optimizer': 'adam', 'graph_mode': 'off', 'use_snp_selection': False}. Best is trial 65 with value: 0.10536764442322526.
[I 2025-12-05 16:11:14,085] Trial 77 finished with value: 0.03653285047606284 and parameters: {'model_type': 'mlp', 'hidden_dims': '[512, 128]', 'dropout': 0.5726368306751503, 'batch_norm': True, 'lr': 1.1530424534117282e-05, 'weight_decay': 0.0003531496434255211, 'epochs': 272, 'loss': 'mae', 'optimizer': 'adam', 'graph_mode': 'off', 'use_snp_selection': False}. Best is trial 65 with value: 0.10536764442322526.
[I 2025-12-05 16:11:15,043] Trial 78 finished with value: 0.07536045300515312 and parameters: {'model_type': 'mlp', 'hidden_dims': '[256, 128, 64]', 'dropout': 0.3712475579991723, 'batch_norm': True, 'lr': 0.0008124126296597952, 'weight_decay': 5.4910865512194664e-05, 'epochs': 119, 'loss': 'mae', 'optimizer': 'adam', 'graph_mode': 'off', 'use_snp_selection': True, 'num_snps': 2246}. Best is trial 65 with value: 0.10536764442322526.
[I 2025-12-05 16:11:16,251] Trial 79 finished with value: 0.07340305172115452 and parameters: {'model_type': 'mlp', 'hidden_dims': '[512, 256]', 'dropout': 0.5216031465528924, 'batch_norm': True, 'lr': 0.0002682183606226763, 'weight_decay': 8.544857661292563e-06, 'epochs': 67, 'loss': 'mae', 'optimizer': 'adam', 'graph_mode': 'off', 'use_snp_selection': False}. Best is trial 65 with value: 0.10536764442322526.
[I 2025-12-05 16:11:17,239] Trial 80 finished with value: 0.07465773409139409 and parameters: {'model_type': 'mlp', 'hidden_dims': '[256, 128, 64]', 'dropout': 0.44391664431925965, 'batch_norm': True, 'lr': 0.00017098985712125022, 'weight_decay': 5.329378741768452e-06, 'epochs': 109, 'loss': 'mse', 'optimizer': 'adam', 'graph_mode': 'off', 'use_snp_selection': False}. Best is trial 65 with value: 0.10536764442322526.
[I 2025-12-05 16:11:18,324] Trial 81 finished with value: 0.07038252741496763 and parameters: {'model_type': 'mlp', 'hidden_dims': '[256, 128, 64]', 'dropout': 0.42630169984277094, 'batch_norm': True, 'lr': 0.0005817777646414664, 'weight_decay': 2.019015451257494e-05, 'epochs': 139, 'loss': 'mae', 'optimizer': 'adam', 'graph_mode': 'off', 'use_snp_selection': False}. Best is trial 65 with value: 0.10536764442322526.
[I 2025-12-05 16:11:19,911] Trial 82 finished with value: 0.07685612049847161 and parameters: {'model_type': 'mlp', 'hidden_dims': '[256, 128, 64]', 'dropout': 0.4136623500617906, 'batch_norm': True, 'lr': 0.0006824885735261937, 'weight_decay': 2.5427839968161465e-05, 'epochs': 309, 'loss': 'mae', 'optimizer': 'adam', 'graph_mode': 'off', 'use_snp_selection': False}. Best is trial 65 with value: 0.10536764442322526.
[I 2025-12-05 16:11:21,083] Trial 83 finished with value: 0.05763183420671568 and parameters: {'model_type': 'mlp', 'hidden_dims': '[256, 128, 64]', 'dropout': 0.3977081242424745, 'batch_norm': True, 'lr': 0.00034746662523119884, 'weight_decay': 1.222047192493048e-05, 'epochs': 172, 'loss': 'mae', 'optimizer': 'adam', 'graph_mode': 'off', 'use_snp_selection': False}. Best is trial 65 with value: 0.10536764442322526.
[I 2025-12-05 16:11:22,193] Trial 84 finished with value: 0.0701320937552481 and parameters: {'model_type': 'mlp', 'hidden_dims': '[256, 128, 64]', 'dropout': 0.47962066655098184, 'batch_norm': True, 'lr': 0.00046521660299169, 'weight_decay': 3.3510542160831586e-05, 'epochs': 157, 'loss': 'mae', 'optimizer': 'adam', 'graph_mode': 'off', 'use_snp_selection': False}. Best is trial 65 with value: 0.10536764442322526.
[I 2025-12-05 16:11:22,913] Trial 85 finished with value: 0.0731955907059904 and parameters: {'model_type': 'mlp', 'hidden_dims': '[128, 64]', 'dropout': 0.38304580017569406, 'batch_norm': True, 'lr': 0.000841293176857616, 'weight_decay': 1.515807896154641e-05, 'epochs': 83, 'loss': 'mae', 'optimizer': 'adam', 'graph_mode': 'off', 'use_snp_selection': False}. Best is trial 65 with value: 0.10536764442322526.
[I 2025-12-05 16:11:24,465] Trial 86 finished with value: 0.0740581710833478 and parameters: {'model_type': 'mlp', 'hidden_dims': '[512, 128]', 'dropout': 0.42475693441271956, 'batch_norm': False, 'lr': 0.00037841612986795647, 'weight_decay': 8.121027041073421e-05, 'epochs': 134, 'loss': 'mae', 'optimizer': 'adam', 'graph_mode': 'off', 'use_snp_selection': False}. Best is trial 65 with value: 0.10536764442322526.
[I 2025-12-05 16:11:25,945] Trial 87 finished with value: 0.08455085931777315 and parameters: {'model_type': 'mlp', 'hidden_dims': '[256, 128, 64]', 'dropout': 0.44427973009729754, 'batch_norm': True, 'lr': 0.00012510678343708885, 'weight_decay': 0.00012145174968306659, 'epochs': 287, 'loss': 'mae', 'optimizer': 'adam', 'graph_mode': 'off', 'use_snp_selection': False}. Best is trial 65 with value: 0.10536764442322526.
[I 2025-12-05 16:11:26,998] Trial 88 finished with value: 0.08577061344027694 and parameters: {'model_type': 'mlp', 'hidden_dims': '[256, 128]', 'dropout': 0.46518590422189043, 'batch_norm': True, 'lr': 0.0006037978172076713, 'weight_decay': 2.217459220625573e-05, 'epochs': 149, 'loss': 'mse', 'optimizer': 'adam', 'graph_mode': 'off', 'use_snp_selection': False}. Best is trial 65 with value: 0.10536764442322526.
[I 2025-12-05 16:11:29,298] Trial 89 finished with value: 0.04341941815059878 and parameters: {'model_type': 'mlp', 'hidden_dims': '[256, 128, 64]', 'dropout': 0.35953897531880374, 'batch_norm': False, 'lr': 4.645500979311817e-06, 'weight_decay': 8.983015458099922e-06, 'epochs': 187, 'loss': 'mae', 'optimizer': 'adam', 'graph_mode': 'off', 'use_snp_selection': True, 'num_snps': 45058}. Best is trial 65 with value: 0.10536764442322526.
[I 2025-12-05 16:11:31,477] Trial 90 finished with value: 0.06549225611379865 and parameters: {'model_type': 'mlp', 'hidden_dims': '[512, 256]', 'dropout': 0.48866307891294963, 'batch_norm': True, 'lr': 0.00023205068351914444, 'weight_decay': 5.230977260630061e-05, 'epochs': 236, 'loss': 'mse', 'optimizer': 'adam', 'graph_mode': 'off', 'use_snp_selection': False}. Best is trial 65 with value: 0.10536764442322526.
[I 2025-12-05 16:11:32,585] Trial 91 finished with value: 0.04529667355139689 and parameters: {'model_type': 'mlp', 'hidden_dims': '[256, 128, 64]', 'dropout': 0.4382265389336131, 'batch_norm': False, 'lr': 0.0009775695966253142, 'weight_decay': 0.0006016901877609407, 'epochs': 164, 'loss': 'mse', 'optimizer': 'adam', 'graph_mode': 'off', 'use_snp_selection': False}. Best is trial 65 with value: 0.10536764442322526.
[I 2025-12-05 16:11:33,658] Trial 92 finished with value: 0.10001111400308717 and parameters: {'model_type': 'mlp', 'hidden_dims': '[256, 128, 64]', 'dropout': 0.4492552963464746, 'batch_norm': False, 'lr': 0.0006584179751076158, 'weight_decay': 0.0003877005734164351, 'epochs': 159, 'loss': 'mse', 'optimizer': 'adam', 'graph_mode': 'off', 'use_snp_selection': False}. Best is trial 65 with value: 0.10536764442322526.
[I 2025-12-05 16:11:34,688] Trial 93 finished with value: 0.04514543959347797 and parameters: {'model_type': 'mlp', 'hidden_dims': '[256, 128, 64]', 'dropout': 0.40831424461074955, 'batch_norm': False, 'lr': 0.000478232546709341, 'weight_decay': 0.00016963707954019617, 'epochs': 142, 'loss': 'mse', 'optimizer': 'adam', 'graph_mode': 'off', 'use_snp_selection': False}. Best is trial 65 with value: 0.10536764442322526.
[I 2025-12-05 16:11:35,689] Trial 94 finished with value: 0.07751665890122171 and parameters: {'model_type': 'mlp', 'hidden_dims': '[256, 128, 64]', 'dropout': 0.5059453266072216, 'batch_norm': False, 'lr': 0.0007569741243225662, 'weight_decay': 0.0004368376455499794, 'epochs': 131, 'loss': 'mse', 'optimizer': 'adam', 'graph_mode': 'off', 'use_snp_selection': False}. Best is trial 65 with value: 0.10536764442322526.
[I 2025-12-05 16:11:37,491] Trial 95 finished with value: 0.07336850564588761 and parameters: {'model_type': 'mlp', 'hidden_dims': '[512, 64]', 'dropout': 0.4574295223554588, 'batch_norm': False, 'lr': 0.0002886843521075269, 'weight_decay': 0.0007695618290070962, 'epochs': 176, 'loss': 'mse', 'optimizer': 'adam', 'graph_mode': 'off', 'use_snp_selection': False}. Best is trial 65 with value: 0.10536764442322526.
[I 2025-12-05 16:11:39,133] Trial 96 finished with value: 0.0856918289301464 and parameters: {'model_type': 'mlp', 'hidden_dims': '[512, 128]', 'dropout': 0.41800853553917144, 'batch_norm': False, 'lr': 0.00014237112710040965, 'weight_decay': 0.0002275711477056477, 'epochs': 153, 'loss': 'mse', 'optimizer': 'adam', 'graph_mode': 'off', 'use_snp_selection': False}. Best is trial 65 with value: 0.10536764442322526.
[I 2025-12-05 16:11:40,102] Trial 97 finished with value: 0.02528122996280799 and parameters: {'model_type': 'mlp', 'hidden_dims': '[256, 128, 64]', 'dropout': 0.5315403748891568, 'batch_norm': False, 'lr': 0.000409642861556575, 'weight_decay': 6.349871876929051e-05, 'epochs': 121, 'loss': 'mae', 'optimizer': 'adam', 'graph_mode': 'off', 'use_snp_selection': False}. Best is trial 65 with value: 0.10536764442322526.
[I 2025-12-05 16:11:40,839] Trial 98 finished with value: 0.08053359017097175 and parameters: {'model_type': 'mlp', 'hidden_dims': '[128, 64]', 'dropout': 0.39642463976217496, 'batch_norm': True, 'lr': 0.0006431614843107841, 'weight_decay': 3.811432339908664e-05, 'epochs': 109, 'loss': 'mse', 'optimizer': 'adam', 'graph_mode': 'off', 'use_snp_selection': False}. Best is trial 65 with value: 0.10536764442322526.
[I 2025-12-05 16:11:41,928] Trial 99 finished with value: 0.06737779943388966 and parameters: {'model_type': 'mlp', 'hidden_dims': '[512, 256]', 'dropout': 0.45315965586233825, 'batch_norm': False, 'lr': 0.0001933446272846923, 'weight_decay': 2.7663010656065266e-05, 'epochs': 58, 'loss': 'mae', 'optimizer': 'adam', 'graph_mode': 'off', 'use_snp_selection': False}. Best is trial 65 with value: 0.10536764442322526.
[I 2025-12-05 16:11:43,055] Trial 100 finished with value: 0.022982535711177456 and parameters: {'model_type': 'mlp', 'hidden_dims': '[256, 128, 64]', 'dropout': 0.4357953484574263, 'batch_norm': True, 'lr': 2.9289084854327876e-05, 'weight_decay': 1.627147968340516e-05, 'epochs': 159, 'loss': 'mse', 'optimizer': 'adam', 'graph_mode': 'off', 'use_snp_selection': False}. Best is trial 65 with value: 0.10536764442322526.
[I 2025-12-05 16:11:44,207] Trial 101 finished with value: 0.07889585598406623 and parameters: {'model_type': 'mlp', 'hidden_dims': '[256, 128, 64]', 'dropout': 0.4706865375776329, 'batch_norm': False, 'lr': 0.0007480217765425345, 'weight_decay': 0.00030788503560774547, 'epochs': 186, 'loss': 'mse', 'optimizer': 'adam', 'graph_mode': 'off', 'use_snp_selection': False}. Best is trial 65 with value: 0.10536764442322526.
[I 2025-12-05 16:11:45,251] Trial 102 finished with value: 0.0816768042006343 and parameters: {'model_type': 'mlp', 'hidden_dims': '[256, 128, 64]', 'dropout': 0.4490795023687508, 'batch_norm': False, 'lr': 0.0005439814785861527, 'weight_decay': 0.0005467566084427521, 'epochs': 147, 'loss': 'mse', 'optimizer': 'adam', 'graph_mode': 'off', 'use_snp_selection': False}. Best is trial 65 with value: 0.10536764442322526.
[I 2025-12-05 16:11:46,004] Trial 103 finished with value: 0.035442427710191376 and parameters: {'model_type': 'mlp', 'hidden_dims': '[256, 128, 64]', 'dropout': 0.4270235470134082, 'batch_norm': False, 'lr': 0.0008524076371915182, 'weight_decay': 0.00042416485673665806, 'epochs': 46, 'loss': 'mse', 'optimizer': 'adam', 'graph_mode': 'off', 'use_snp_selection': False}. Best is trial 65 with value: 0.10536764442322526.
[I 2025-12-05 16:11:47,017] Trial 104 finished with value: 0.04233519574259163 and parameters: {'model_type': 'mlp', 'hidden_dims': '[256, 128, 64]', 'dropout': 0.40903175916695567, 'batch_norm': False, 'lr': 0.0003268477791502091, 'weight_decay': 0.00018829346190930483, 'epochs': 137, 'loss': 'mse', 'optimizer': 'adam', 'graph_mode': 'off', 'use_snp_selection': False}. Best is trial 65 with value: 0.10536764442322526.
[I 2025-12-05 16:11:48,530] Trial 105 finished with value: 0.026049105968892025 and parameters: {'model_type': 'mlp', 'hidden_dims': '[512, 64]', 'dropout': 0.5008533792567743, 'batch_norm': False, 'lr': 0.0004903329041353525, 'weight_decay': 0.0006713281996001953, 'epochs': 125, 'loss': 'mse', 'optimizer': 'adam', 'graph_mode': 'off', 'use_snp_selection': False}. Best is trial 65 with value: 0.10536764442322526.
[I 2025-12-05 16:11:50,286] Trial 106 finished with value: 0.055875660865588955 and parameters: {'model_type': 'mlp', 'hidden_dims': '[512, 256]', 'dropout': 0.4849694851425981, 'batch_norm': False, 'lr': 8.787663669413242e-05, 'weight_decay': 8.229687112344383e-05, 'epochs': 172, 'loss': 'mae', 'optimizer': 'adam', 'graph_mode': 'off', 'use_snp_selection': False}. Best is trial 65 with value: 0.10536764442322526.
[I 2025-12-05 16:11:51,908] Trial 107 finished with value: 0.033965571470495975 and parameters: {'model_type': 'mlp', 'hidden_dims': '[256, 128, 64]', 'dropout': 0.43572051043461124, 'batch_norm': True, 'lr': 2.2031158580962367e-05, 'weight_decay': 0.0003908164443880271, 'epochs': 114, 'loss': 'mse', 'optimizer': 'adam', 'graph_mode': 'off', 'use_snp_selection': True, 'num_snps': 26771}. Best is trial 65 with value: 0.10536764442322526.
[I 2025-12-05 16:11:54,442] Trial 108 finished with value: 0.06269078083171113 and parameters: {'model_type': 'mlp', 'hidden_dims': '[512, 128]', 'dropout': 0.3921058666352981, 'batch_norm': False, 'lr': 5.7231104902501556e-05, 'weight_decay': 0.0002733301169918691, 'epochs': 304, 'loss': 'mae', 'optimizer': 'adam', 'graph_mode': 'off', 'use_snp_selection': False}. Best is trial 65 with value: 0.10536764442322526.
[I 2025-12-05 16:11:55,289] Trial 109 finished with value: 0.0835596859864762 and parameters: {'model_type': 'mlp', 'hidden_dims': '[128, 64]', 'dropout': 0.46416188616527887, 'batch_norm': True, 'lr': 0.0006609669691792339, 'weight_decay': 0.0005240120977716375, 'epochs': 159, 'loss': 'mae', 'optimizer': 'adam', 'graph_mode': 'off', 'use_snp_selection': False}. Best is trial 65 with value: 0.10536764442322526.
[I 2025-12-05 16:11:56,500] Trial 110 finished with value: 0.06509120423241893 and parameters: {'model_type': 'mlp', 'hidden_dims': '[256, 128, 64]', 'dropout': 0.5389170024652447, 'batch_norm': True, 'lr': 0.000985628775292692, 'weight_decay': 9.527713172342923e-05, 'epochs': 197, 'loss': 'mse', 'optimizer': 'adam', 'graph_mode': 'off', 'use_snp_selection': False}. Best is trial 65 with value: 0.10536764442322526.
