[I 2025-12-05 14:24:02,078] Trial 51 finished with value: 0.09110348573057475 and parameters: {'model_type': 'mlp', 'hidden_dims': '[256, 128, 64]', 'dropout': 0.2704947621824332, 'batch_norm': True, 'lr': 0.0005634676331879313, 'weight_decay': 7.8547171212371e-05, 'epochs': 188, 'loss': 'mse', 'optimizer': 'adam', 'graph_mode': 'off', 'use_snp_selection': True, 'num_snps': 6926}. Best is trial 42 with value: 0.11245789228187227.
[I 2025-12-05 14:24:02,859] Trial 52 finished with value: 0.08380749766952905 and parameters: {'model_type': 'mlp', 'hidden_dims': '[256, 128, 64]', 'dropout': 0.18209613432477018, 'batch_norm': True, 'lr': 0.00030564008015847695, 'weight_decay': 9.843040222719768e-06, 'epochs': 81, 'loss': 'mse', 'optimizer': 'adam', 'graph_mode': 'off', 'use_snp_selection': True, 'num_snps': 7200}. Best is trial 42 with value: 0.11245789228187227.
[I 2025-12-05 14:24:04,119] Trial 53 finished with value: 0.10606519695522226 and parameters: {'model_type': 'mlp', 'hidden_dims': '[256, 128, 64]', 'dropout': 0.2981688771012444, 'batch_norm': True, 'lr': 0.0006359722508739743, 'weight_decay': 2.134445387192452e-06, 'epochs': 278, 'loss': 'mse', 'optimizer': 'adam', 'graph_mode': 'off', 'use_snp_selection': True, 'num_snps': 12599}. Best is trial 42 with value: 0.11245789228187227.
[I 2025-12-05 14:24:05,411] Trial 54 finished with value: 0.10828130234795427 and parameters: {'model_type': 'mlp', 'hidden_dims': '[256, 128, 64]', 'dropout': 0.3285836874088054, 'batch_norm': True, 'lr': 0.0007363475663732946, 'weight_decay': 0.0005914379262497527, 'epochs': 167, 'loss': 'mse', 'optimizer': 'adam', 'graph_mode': 'off', 'use_snp_selection': True, 'num_snps': 19711}. Best is trial 42 with value: 0.11245789228187227.
[I 2025-12-05 14:24:06,258] Trial 55 finished with value: 0.09971670406585183 and parameters: {'model_type': 'mlp', 'hidden_dims': '[256, 128, 64]', 'dropout': 0.31917266386210086, 'batch_norm': True, 'lr': 0.0007999509677520894, 'weight_decay': 0.00012238398362441802, 'epochs': 147, 'loss': 'mse', 'optimizer': 'adam', 'graph_mode': 'off', 'use_snp_selection': True, 'num_snps': 5534}. Best is trial 42 with value: 0.11245789228187227.
[I 2025-12-05 14:24:07,298] Trial 56 finished with value: 0.09823277639679992 and parameters: {'model_type': 'mlp', 'hidden_dims': '[256, 128, 64]', 'dropout': 0.3574573192702176, 'batch_norm': True, 'lr': 0.0003909121596095663, 'weight_decay': 0.00021901049970566352, 'epochs': 163, 'loss': 'mse', 'optimizer': 'adam', 'graph_mode': 'off', 'use_snp_selection': True, 'num_snps': 11319}. Best is trial 42 with value: 0.11245789228187227.
[I 2025-12-05 14:24:08,518] Trial 57 finished with value: 0.11292278072869436 and parameters: {'model_type': 'mlp', 'hidden_dims': '[256, 128, 64]', 'dropout': 0.34294228577725144, 'batch_norm': True, 'lr': 0.0007197506326439835, 'weight_decay': 0.0006096880862858369, 'epochs': 194, 'loss': 'mse', 'optimizer': 'adam', 'graph_mode': 'off', 'use_snp_selection': True, 'num_snps': 15774}. Best is trial 57 with value: 0.11292278072869436.
[I 2025-12-05 14:24:09,754] Trial 58 finished with value: -0.007796159083779835 and parameters: {'model_type': 'mlp', 'hidden_dims': '[256, 128, 64]', 'dropout': 0.34299334103099355, 'batch_norm': False, 'lr': 1.0889258301622254e-06, 'weight_decay': 0.0004961203703753663, 'epochs': 191, 'loss': 'mse', 'optimizer': 'adam', 'graph_mode': 'off', 'use_snp_selection': True, 'num_snps': 19300}. Best is trial 57 with value: 0.11292278072869436.
[I 2025-12-05 14:24:10,887] Trial 59 finished with value: 0.08788215067905157 and parameters: {'model_type': 'mlp', 'hidden_dims': '[256, 128, 64]', 'dropout': 0.39720277647695595, 'batch_norm': True, 'lr': 0.0007684925832985793, 'weight_decay': 0.0005054782898252085, 'epochs': 161, 'loss': 'mse', 'optimizer': 'adam', 'graph_mode': 'off', 'use_snp_selection': True, 'num_snps': 14842}. Best is trial 57 with value: 0.11292278072869436.
[I 2025-12-05 14:24:12,453] Trial 60 finished with value: 0.11999688278480873 and parameters: {'model_type': 'mlp', 'hidden_dims': '[256, 128, 64]', 'dropout': 0.2867498757867465, 'batch_norm': True, 'lr': 0.000695519054313101, 'weight_decay': 0.0004556525069500525, 'epochs': 183, 'loss': 'mse', 'optimizer': 'adam', 'graph_mode': 'off', 'use_snp_selection': True, 'num_snps': 27741}. Best is trial 60 with value: 0.11999688278480873.
[I 2025-12-05 14:24:14,009] Trial 61 finished with value: 0.11693611623497491 and parameters: {'model_type': 'mlp', 'hidden_dims': '[256, 128, 64]', 'dropout': 0.3316831775288327, 'batch_norm': True, 'lr': 0.0009816386914860047, 'weight_decay': 0.0005581352971491418, 'epochs': 179, 'loss': 'mse', 'optimizer': 'adam', 'graph_mode': 'off', 'use_snp_selection': True, 'num_snps': 27458}. Best is trial 60 with value: 0.11999688278480873.
[I 2025-12-05 14:24:15,587] Trial 62 finished with value: 0.10163966975516317 and parameters: {'model_type': 'mlp', 'hidden_dims': '[256, 128, 64]', 'dropout': 0.2714876182654441, 'batch_norm': True, 'lr': 0.0009564000341746984, 'weight_decay': 0.0003371142374337865, 'epochs': 181, 'loss': 'mse', 'optimizer': 'adam', 'graph_mode': 'off', 'use_snp_selection': True, 'num_snps': 27870}. Best is trial 60 with value: 0.11999688278480873.
[I 2025-12-05 14:24:17,373] Trial 63 finished with value: 0.09087233643028512 and parameters: {'model_type': 'mlp', 'hidden_dims': '[256, 128, 64]', 'dropout': 0.35091529224722967, 'batch_norm': True, 'lr': 0.000637517300894611, 'weight_decay': 0.00070397389618685, 'epochs': 196, 'loss': 'mse', 'optimizer': 'adam', 'graph_mode': 'off', 'use_snp_selection': True, 'num_snps': 33794}. Best is trial 60 with value: 0.11999688278480873.
[I 2025-12-05 14:24:18,277] Trial 64 finished with value: 0.10752881253467234 and parameters: {'model_type': 'mlp', 'hidden_dims': '[256, 128, 64]', 'dropout': 0.31700762756686396, 'batch_norm': True, 'lr': 0.00045725493740793235, 'weight_decay': 0.0003292128875816284, 'epochs': 208, 'loss': 'mse', 'optimizer': 'adam', 'graph_mode': 'off', 'use_snp_selection': True, 'num_snps': 4234}. Best is trial 60 with value: 0.11999688278480873.
[I 2025-12-05 14:24:19,888] Trial 65 finished with value: 0.0822891522542616 and parameters: {'model_type': 'mlp', 'hidden_dims': '[256, 128, 64]', 'dropout': 0.29158812807207624, 'batch_norm': True, 'lr': 0.0002167398320747927, 'weight_decay': 2.8117357705247464e-05, 'epochs': 225, 'loss': 'mse', 'optimizer': 'adam', 'graph_mode': 'off', 'use_snp_selection': True, 'num_snps': 27241}. Best is trial 60 with value: 0.11999688278480873.
[I 2025-12-05 14:24:21,411] Trial 66 finished with value: 0.10417635355027537 and parameters: {'model_type': 'mlp', 'hidden_dims': '[256, 128]', 'dropout': 0.27979622076347505, 'batch_norm': True, 'lr': 0.0002825630611035515, 'weight_decay': 0.00019061126233108538, 'epochs': 126, 'loss': 'mse', 'optimizer': 'adam', 'graph_mode': 'off', 'use_snp_selection': True, 'num_snps': 30529}. Best is trial 60 with value: 0.11999688278480873.
[I 2025-12-05 14:24:23,297] Trial 67 finished with value: 0.11386307647209765 and parameters: {'model_type': 'mlp', 'hidden_dims': '[256, 128, 64]', 'dropout': 0.4296002833112597, 'batch_norm': True, 'lr': 0.000719453346833415, 'weight_decay': 8.54222436676307e-06, 'epochs': 176, 'loss': 'mse', 'optimizer': 'adam', 'graph_mode': 'off', 'use_snp_selection': True, 'num_snps': 38326}. Best is trial 60 with value: 0.11999688278480873.
[I 2025-12-05 14:24:25,347] Trial 68 finished with value: 0.10547227607554885 and parameters: {'model_type': 'mlp', 'hidden_dims': '[512, 64]', 'dropout': 0.4332721623047629, 'batch_norm': True, 'lr': 0.0009949281045889486, 'weight_decay': 3.1587414234408914e-05, 'epochs': 202, 'loss': 'mse', 'optimizer': 'adam', 'graph_mode': 'off', 'use_snp_selection': True, 'num_snps': 39950}. Best is trial 60 with value: 0.11999688278480873.
[I 2025-12-05 14:24:27,428] Trial 69 finished with value: 0.09112178106968502 and parameters: {'model_type': 'mlp', 'hidden_dims': '[256, 128, 64]', 'dropout': 0.41550860186077676, 'batch_norm': True, 'lr': 0.00036705157071430727, 'weight_decay': 0.00036766895130137684, 'epochs': 152, 'loss': 'mse', 'optimizer': 'adam', 'graph_mode': 'off', 'use_snp_selection': True, 'num_snps': 46366}. Best is trial 60 with value: 0.11999688278480873.
[I 2025-12-05 14:24:29,178] Trial 70 finished with value: 0.05564170540014293 and parameters: {'model_type': 'mlp', 'hidden_dims': '[256, 128]', 'dropout': 0.47775751649298737, 'batch_norm': False, 'lr': 0.0004954441226603237, 'weight_decay': 7.405777347880703e-05, 'epochs': 174, 'loss': 'mse', 'optimizer': 'adam', 'graph_mode': 'off', 'use_snp_selection': True, 'num_snps': 37958}. Best is trial 60 with value: 0.11999688278480873.
[I 2025-12-05 14:24:29,992] Trial 71 finished with value: 0.08202972668585878 and parameters: {'model_type': 'mlp', 'hidden_dims': '[256, 128, 64]', 'dropout': 0.3730852772647636, 'batch_norm': True, 'lr': 0.0006897852886289398, 'weight_decay': 8.732167585203654e-06, 'epochs': 185, 'loss': 'mse', 'optimizer': 'adam', 'graph_mode': 'off', 'use_snp_selection': True, 'num_snps': 2302}. Best is trial 60 with value: 0.11999688278480873.
[I 2025-12-05 14:24:31,444] Trial 72 finished with value: 0.10159398227869759 and parameters: {'model_type': 'mlp', 'hidden_dims': '[256, 128, 64]', 'dropout': 0.22405897111522538, 'batch_norm': True, 'lr': 0.0008001067515388808, 'weight_decay': 1.6832017494849415e-05, 'epochs': 134, 'loss': 'mse', 'optimizer': 'adam', 'graph_mode': 'off', 'use_snp_selection': True, 'num_snps': 25954}. Best is trial 60 with value: 0.11999688278480873.
[I 2025-12-05 14:24:32,906] Trial 73 finished with value: 0.10747260158702762 and parameters: {'model_type': 'mlp', 'hidden_dims': '[256, 128, 64]', 'dropout': 0.3358262667271955, 'batch_norm': True, 'lr': 0.0005823983852539557, 'weight_decay': 7.458272724890477e-06, 'epochs': 214, 'loss': 'mse', 'optimizer': 'adam', 'graph_mode': 'off', 'use_snp_selection': True, 'num_snps': 22802}. Best is trial 60 with value: 0.11999688278480873.
[I 2025-12-05 14:24:34,237] Trial 74 finished with value: 0.08284951097647514 and parameters: {'model_type': 'mlp', 'hidden_dims': '[256, 128, 64]', 'dropout': 0.49319840832406187, 'batch_norm': True, 'lr': 0.0004529225972853786, 'weight_decay': 3.1567764425659466e-06, 'epochs': 154, 'loss': 'mse', 'optimizer': 'adam', 'graph_mode': 'off', 'use_snp_selection': True, 'num_snps': 21883}. Best is trial 60 with value: 0.11999688278480873.
[I 2025-12-05 14:24:35,963] Trial 75 finished with value: 0.10069605369288366 and parameters: {'model_type': 'mlp', 'hidden_dims': '[256, 128, 64]', 'dropout': 0.2361870549985926, 'batch_norm': True, 'lr': 0.000747433805078387, 'weight_decay': 1.3936671510270917e-05, 'epochs': 177, 'loss': 'mse', 'optimizer': 'adam', 'graph_mode': 'off', 'use_snp_selection': True, 'num_snps': 33055}. Best is trial 60 with value: 0.11999688278480873.
[I 2025-12-05 14:24:38,546] Trial 76 finished with value: 0.07438128258151072 and parameters: {'model_type': 'mlp', 'hidden_dims': '[256, 128, 64]', 'dropout': 0.3985819937681595, 'batch_norm': True, 'lr': 0.00014087156816801447, 'weight_decay': 6.313617284941675e-06, 'epochs': 245, 'loss': 'mse', 'optimizer': 'adam', 'graph_mode': 'off', 'use_snp_selection': True, 'num_snps': 56793}. Best is trial 60 with value: 0.11999688278480873.
[I 2025-12-05 14:24:39,819] Trial 77 finished with value: 0.09422086477646732 and parameters: {'model_type': 'mlp', 'hidden_dims': '[256, 128]', 'dropout': 0.2608759397607215, 'batch_norm': True, 'lr': 0.0008391342599398878, 'weight_decay': 0.0007996802961421143, 'epochs': 232, 'loss': 'mse', 'optimizer': 'adam', 'graph_mode': 'off', 'use_snp_selection': True, 'num_snps': 18161}. Best is trial 60 with value: 0.11999688278480873.
[I 2025-12-05 14:24:41,455] Trial 78 finished with value: 0.063404053842635 and parameters: {'model_type': 'mlp', 'hidden_dims': '[256, 128, 64]', 'dropout': 0.32102677638275057, 'batch_norm': True, 'lr': 7.423862602929254e-06, 'weight_decay': 1.371675315526212e-07, 'epochs': 197, 'loss': 'mae', 'optimizer': 'adam', 'graph_mode': 'off', 'use_snp_selection': True, 'num_snps': 29040}. Best is trial 60 with value: 0.11999688278480873.
[I 2025-12-05 14:24:42,442] Trial 79 finished with value: 0.11171623849069864 and parameters: {'model_type': 'mlp', 'hidden_dims': '[128, 64]', 'dropout': 0.598460471828689, 'batch_norm': True, 'lr': 0.00040468543781948185, 'weight_decay': 3.608344093357382e-05, 'epochs': 169, 'loss': 'mae', 'optimizer': 'adam', 'graph_mode': 'off', 'use_snp_selection': True, 'num_snps': 10986}. Best is trial 60 with value: 0.11999688278480873.
[I 2025-12-05 14:24:43,505] Trial 80 finished with value: 0.08892533740232626 and parameters: {'model_type': 'mlp', 'hidden_dims': '[128, 64]', 'dropout': 0.5563515480790826, 'batch_norm': True, 'lr': 0.00039835054495119496, 'weight_decay': 0.0004262928681812018, 'epochs': 170, 'loss': 'mae', 'optimizer': 'adam', 'graph_mode': 'off', 'use_snp_selection': True, 'num_snps': 13988}. Best is trial 60 with value: 0.11999688278480873.
[I 2025-12-05 14:24:44,383] Trial 81 finished with value: 0.11327082441608947 and parameters: {'model_type': 'mlp', 'hidden_dims': '[128, 64]', 'dropout': 0.5509811935196718, 'batch_norm': True, 'lr': 0.0005096593509088236, 'weight_decay': 2.0538832252809466e-05, 'epochs': 142, 'loss': 'mae', 'optimizer': 'adam', 'graph_mode': 'off', 'use_snp_selection': True, 'num_snps': 8934}. Best is trial 60 with value: 0.11999688278480873.
[I 2025-12-05 14:24:45,280] Trial 82 finished with value: 0.0912008095065478 and parameters: {'model_type': 'mlp', 'hidden_dims': '[128, 64]', 'dropout': 0.5977920909492167, 'batch_norm': True, 'lr': 0.0005331952676816349, 'weight_decay': 2.197357768797786e-05, 'epochs': 138, 'loss': 'mae', 'optimizer': 'adam', 'graph_mode': 'off', 'use_snp_selection': True, 'num_snps': 10011}. Best is trial 60 with value: 0.11999688278480873.
[I 2025-12-05 14:24:46,139] Trial 83 finished with value: 0.09018815325499002 and parameters: {'model_type': 'mlp', 'hidden_dims': '[128, 64]', 'dropout': 0.5941874505268966, 'batch_norm': True, 'lr': 0.000277309760802809, 'weight_decay': 3.6857444283344695e-05, 'epochs': 116, 'loss': 'mae', 'optimizer': 'adam', 'graph_mode': 'off', 'use_snp_selection': True, 'num_snps': 9620}. Best is trial 60 with value: 0.11999688278480873.
[I 2025-12-05 14:24:46,986] Trial 84 finished with value: 0.08335562426131947 and parameters: {'model_type': 'mlp', 'hidden_dims': '[128, 64]', 'dropout': 0.5674083052417179, 'batch_norm': True, 'lr': 0.0003261855747248268, 'weight_decay': 5.188867117365322e-05, 'epochs': 217, 'loss': 'mae', 'optimizer': 'adam', 'graph_mode': 'off', 'use_snp_selection': True, 'num_snps': 4106}. Best is trial 60 with value: 0.11999688278480873.
[I 2025-12-05 14:24:48,150] Trial 85 finished with value: 0.0719597088573481 and parameters: {'model_type': 'mlp', 'hidden_dims': '[128, 64]', 'dropout': 0.5181868064785902, 'batch_norm': True, 'lr': 0.00022097477887692346, 'weight_decay': 0.0002450817833349512, 'epochs': 158, 'loss': 'mae', 'optimizer': 'adam', 'graph_mode': 'off', 'use_snp_selection': True, 'num_snps': 17899}. Best is trial 60 with value: 0.11999688278480873.
[I 2025-12-05 14:24:49,494] Trial 86 finished with value: 0.08590647970779691 and parameters: {'model_type': 'mlp', 'hidden_dims': '[128, 64]', 'dropout': 0.5748003473112454, 'batch_norm': True, 'lr': 0.00044431978262118925, 'weight_decay': 2.3236231718757866e-07, 'epochs': 145, 'loss': 'mae', 'optimizer': 'adam', 'graph_mode': 'off', 'use_snp_selection': True, 'num_snps': 24539}. Best is trial 60 with value: 0.11999688278480873.
[I 2025-12-05 14:24:50,443] Trial 87 finished with value: 0.07454740795009553 and parameters: {'model_type': 'mlp', 'hidden_dims': '[128, 64]', 'dropout': 0.5449051503704281, 'batch_norm': False, 'lr': 0.0006333803115325803, 'weight_decay': 0.00012865437328911256, 'epochs': 173, 'loss': 'mae', 'optimizer': 'adam', 'graph_mode': 'off', 'use_snp_selection': True, 'num_snps': 11429}. Best is trial 60 with value: 0.11999688278480873.
[I 2025-12-05 14:24:51,521] Trial 88 finished with value: 0.09393941188955261 and parameters: {'model_type': 'mlp', 'hidden_dims': '[128, 64]', 'dropout': 0.5376292116260163, 'batch_norm': True, 'lr': 0.0009976968380336446, 'weight_decay': 0.0001787156351411654, 'epochs': 301, 'loss': 'mae', 'optimizer': 'adam', 'graph_mode': 'off', 'use_snp_selection': True, 'num_snps': 8303}. Best is trial 60 with value: 0.11999688278480873.
[I 2025-12-05 14:24:53,019] Trial 89 finished with value: 0.08421122952809254 and parameters: {'model_type': 'mlp', 'hidden_dims': '[512, 64]', 'dropout': 0.5180169115011167, 'batch_norm': True, 'lr': 0.0003677718425712139, 'weight_decay': 1.172373743455557e-05, 'epochs': 262, 'loss': 'mae', 'optimizer': 'adam', 'graph_mode': 'off', 'use_snp_selection': False}. Best is trial 60 with value: 0.11999688278480873.
[I 2025-12-05 14:24:54,968] Trial 90 finished with value: 0.10613712433107762 and parameters: {'model_type': 'mlp', 'hidden_dims': '[256, 128]', 'dropout': 0.5816358397602162, 'batch_norm': True, 'lr': 0.0005493750378328064, 'weight_decay': 2.2489322117991007e-05, 'epochs': 312, 'loss': 'mae', 'optimizer': 'adam', 'graph_mode': 'off', 'use_snp_selection': True, 'num_snps': 36155}. Best is trial 60 with value: 0.11999688278480873.
[I 2025-12-05 14:24:56,428] Trial 91 finished with value: 0.10696682399080044 and parameters: {'model_type': 'mlp', 'hidden_dims': '[128, 64]', 'dropout': 0.31028894994412637, 'batch_norm': True, 'lr': 0.0006707142507370225, 'weight_decay': 0.0006886866953900903, 'epochs': 190, 'loss': 'mae', 'optimizer': 'adam', 'graph_mode': 'off', 'use_snp_selection': True, 'num_snps': 26244}. Best is trial 60 with value: 0.11999688278480873.
[I 2025-12-05 14:24:57,331] Trial 92 finished with value: 0.09627744214175749 and parameters: {'model_type': 'mlp', 'hidden_dims': '[512, 256]', 'dropout': 0.2968650056694946, 'batch_norm': True, 'lr': 0.0008539136468672495, 'weight_decay': 0.0009656640868032117, 'epochs': 185, 'loss': 'mae', 'optimizer': 'adam', 'graph_mode': 'off', 'use_snp_selection': True, 'num_snps': 6830}. Best is trial 60 with value: 0.11999688278480873.
[I 2025-12-05 14:24:58,193] Trial 93 finished with value: 0.10495389047092211 and parameters: {'model_type': 'mlp', 'hidden_dims': '[512, 128]', 'dropout': 0.3655427277961179, 'batch_norm': True, 'lr': 0.0004684391257427318, 'weight_decay': 3.7412301659224014e-06, 'epochs': 205, 'loss': 'mse', 'optimizer': 'adam', 'graph_mode': 'off', 'use_snp_selection': True, 'num_snps': 5059}. Best is trial 60 with value: 0.11999688278480873.
[I 2025-12-05 14:24:59,486] Trial 94 finished with value: 0.09657609736446648 and parameters: {'model_type': 'mlp', 'hidden_dims': '[256, 128, 64]', 'dropout': 0.17333779330799878, 'batch_norm': True, 'lr': 0.0005822162237703528, 'weight_decay': 1.2141840522839954e-05, 'epochs': 142, 'loss': 'mae', 'optimizer': 'adam', 'graph_mode': 'off', 'use_snp_selection': True, 'num_snps': 20689}. Best is trial 60 with value: 0.11999688278480873.
[I 2025-12-05 14:25:01,183] Trial 95 finished with value: 0.11124826291219943 and parameters: {'model_type': 'mlp', 'hidden_dims': '[128, 64]', 'dropout': 0.19478963615980277, 'batch_norm': True, 'lr': 0.0006723360922183952, 'weight_decay': 7.218168552267662e-05, 'epochs': 271, 'loss': 'mse', 'optimizer': 'adam', 'graph_mode': 'off', 'use_snp_selection': True, 'num_snps': 31258}. Best is trial 60 with value: 0.11999688278480873.
[I 2025-12-05 14:25:02,926] Trial 96 finished with value: 0.10107455806644489 and parameters: {'model_type': 'mlp', 'hidden_dims': '[128, 64]', 'dropout': 0.14319418428092007, 'batch_norm': True, 'lr': 9.206101958375734e-05, 'weight_decay': 1.2014238060933032e-07, 'epochs': 276, 'loss': 'mae', 'optimizer': 'adam', 'graph_mode': 'off', 'use_snp_selection': True, 'num_snps': 31905}. Best is trial 60 with value: 0.11999688278480873.
[I 2025-12-05 14:25:04,585] Trial 97 finished with value: 0.10007863471542608 and parameters: {'model_type': 'mlp', 'hidden_dims': '[128, 64]', 'dropout': 0.19310226191178664, 'batch_norm': True, 'lr': 0.000883998199986416, 'weight_decay': 9.356617949205928e-05, 'epochs': 272, 'loss': 'mse', 'optimizer': 'adam', 'graph_mode': 'off', 'use_snp_selection': True, 'num_snps': 29588}. Best is trial 60 with value: 0.11999688278480873.
[I 2025-12-05 14:25:06,624] Trial 98 finished with value: 0.10593534616014003 and parameters: {'model_type': 'mlp', 'hidden_dims': '[128, 64]', 'dropout': 0.11911738794277495, 'batch_norm': True, 'lr': 0.0004097474341140489, 'weight_decay': 3.4463796941491645e-05, 'epochs': 253, 'loss': 'mse', 'optimizer': 'adam', 'graph_mode': 'off', 'use_snp_selection': True, 'num_snps': 43341}. Best is trial 60 with value: 0.11999688278480873.
[I 2025-12-05 14:25:08,462] Trial 99 finished with value: 0.10121546636744672 and parameters: {'model_type': 'mlp', 'hidden_dims': '[128, 64]', 'dropout': 0.3443458882931461, 'batch_norm': True, 'lr': 0.0005281929929096677, 'weight_decay': 6.276934747230682e-05, 'epochs': 289, 'loss': 'mae', 'optimizer': 'adam', 'graph_mode': 'off', 'use_snp_selection': True, 'num_snps': 34408}. Best is trial 60 with value: 0.11999688278480873.
[I 2025-12-05 14:25:09,879] Trial 100 finished with value: 0.08755276525643729 and parameters: {'model_type': 'mlp', 'hidden_dims': '[128, 64]', 'dropout': 0.21839306837723355, 'batch_norm': False, 'lr': 0.0003068303552887955, 'weight_decay': 0.00027980316652824716, 'epochs': 296, 'loss': 'mse', 'optimizer': 'adam', 'graph_mode': 'off', 'use_snp_selection': True, 'num_snps': 23473}. Best is trial 60 with value: 0.11999688278480873.
