[I 2025-12-05 15:50:18,547] Trial 46 finished with value: 0.05419069806672984 and parameters: {'model_type': 'mlp', 'hidden_dims': '[512, 64]', 'dropout': 0.438335518888488, 'batch_norm': True, 'lr': 0.0009409388054698286, 'weight_decay': 1.649800473596253e-07, 'epochs': 143, 'loss': 'mse', 'optimizer': 'adam', 'graph_mode': 'off', 'use_snp_selection': False}. Best is trial 16 with value: 0.08817918641086803.
[I 2025-12-05 15:50:20,330] Trial 47 finished with value: 0.07333520734219112 and parameters: {'model_type': 'mlp', 'hidden_dims': '[512, 64]', 'dropout': 0.2665550988983105, 'batch_norm': True, 'lr': 0.0005874261180742897, 'weight_decay': 6.801189091838016e-07, 'epochs': 334, 'loss': 'mse', 'optimizer': 'adam', 'graph_mode': 'off', 'use_snp_selection': False}. Best is trial 16 with value: 0.08817918641086803.
[I 2025-12-05 15:50:21,479] Trial 48 finished with value: -0.008571399504294022 and parameters: {'model_type': 'mlp', 'hidden_dims': '[256, 128]', 'dropout': 0.3308582091326991, 'batch_norm': False, 'lr': 0.0006474082594624844, 'weight_decay': 8.806179304440115e-07, 'epochs': 331, 'loss': 'mse', 'optimizer': 'adam', 'graph_mode': 'off', 'use_snp_selection': False}. Best is trial 16 with value: 0.08817918641086803.
[I 2025-12-05 15:50:23,278] Trial 49 finished with value: 0.06413208182668868 and parameters: {'model_type': 'mlp', 'hidden_dims': '[512, 64]', 'dropout': 0.27675306861595833, 'batch_norm': True, 'lr': 0.0005058586565440172, 'weight_decay': 2.1144913577935741e-07, 'epochs': 339, 'loss': 'mse', 'optimizer': 'adam', 'graph_mode': 'off', 'use_snp_selection': False}. Best is trial 16 with value: 0.08817918641086803.
[I 2025-12-05 15:50:24,503] Trial 50 finished with value: 0.05868600694954104 and parameters: {'model_type': 'mlp', 'hidden_dims': '[256, 128, 64]', 'dropout': 0.4015495736324988, 'batch_norm': True, 'lr': 0.0007596765873850128, 'weight_decay': 8.525730680328487e-07, 'epochs': 319, 'loss': 'mse', 'optimizer': 'adam', 'graph_mode': 'off', 'use_snp_selection': False}. Best is trial 16 with value: 0.08817918641086803.
[I 2025-12-05 15:50:26,228] Trial 51 finished with value: 0.0819707893448602 and parameters: {'model_type': 'mlp', 'hidden_dims': '[512, 64]', 'dropout': 0.2643961571559308, 'batch_norm': True, 'lr': 0.0003183134718258732, 'weight_decay': 5.592798679451085e-07, 'epochs': 299, 'loss': 'mse', 'optimizer': 'adam', 'graph_mode': 'off', 'use_snp_selection': False}. Best is trial 16 with value: 0.08817918641086803.
[I 2025-12-05 15:50:27,948] Trial 52 finished with value: 0.06055651222309498 and parameters: {'model_type': 'mlp', 'hidden_dims': '[512, 64]', 'dropout': 0.36156488938838743, 'batch_norm': True, 'lr': 0.0003703952866650751, 'weight_decay': 5.540631993793944e-07, 'epochs': 302, 'loss': 'mse', 'optimizer': 'adam', 'graph_mode': 'off', 'use_snp_selection': False}. Best is trial 16 with value: 0.08817918641086803.
[I 2025-12-05 15:50:29,751] Trial 53 finished with value: 0.05265580919338886 and parameters: {'model_type': 'mlp', 'hidden_dims': '[512, 64]', 'dropout': 0.2640299548594376, 'batch_norm': True, 'lr': 0.0005083272389069255, 'weight_decay': 5.792466181586077e-07, 'epochs': 329, 'loss': 'mse', 'optimizer': 'adam', 'graph_mode': 'off', 'use_snp_selection': False}. Best is trial 16 with value: 0.08817918641086803.
[I 2025-12-05 15:50:30,666] Trial 54 finished with value: 0.06202908209147741 and parameters: {'model_type': 'mlp', 'hidden_dims': '[512, 64]', 'dropout': 0.3138935732424028, 'batch_norm': True, 'lr': 0.00093643570333856, 'weight_decay': 1.0666852103163703e-07, 'epochs': 47, 'loss': 'mse', 'optimizer': 'adam', 'graph_mode': 'off', 'use_snp_selection': False}. Best is trial 16 with value: 0.08817918641086803.
[I 2025-12-05 15:50:32,270] Trial 55 finished with value: 0.019350175359142532 and parameters: {'model_type': 'mlp', 'hidden_dims': '[512, 64]', 'dropout': 0.3014517623820939, 'batch_norm': False, 'lr': 0.0005729075411924591, 'weight_decay': 2.6449481068502756e-07, 'epochs': 282, 'loss': 'mse', 'optimizer': 'adam', 'graph_mode': 'off', 'use_snp_selection': False}. Best is trial 16 with value: 0.08817918641086803.
[I 2025-12-05 15:50:33,380] Trial 56 finished with value: 0.048699069486780114 and parameters: {'model_type': 'mlp', 'hidden_dims': '[256, 128]', 'dropout': 0.5915875502395606, 'batch_norm': True, 'lr': 0.0004114620583824482, 'weight_decay': 2.6009393229659014e-06, 'epochs': 295, 'loss': 'mse', 'optimizer': 'adam', 'graph_mode': 'off', 'use_snp_selection': False}. Best is trial 16 with value: 0.08817918641086803.
[I 2025-12-05 15:50:34,610] Trial 57 finished with value: 0.060834506868332756 and parameters: {'model_type': 'mlp', 'hidden_dims': '[256, 128, 64]', 'dropout': 0.2563904154018592, 'batch_norm': True, 'lr': 0.0002943466610318826, 'weight_decay': 5.246128978958739e-07, 'epochs': 350, 'loss': 'mse', 'optimizer': 'adam', 'graph_mode': 'off', 'use_snp_selection': False}. Best is trial 16 with value: 0.08817918641086803.
[I 2025-12-05 15:50:35,623] Trial 58 finished with value: 0.03354811160052323 and parameters: {'model_type': 'mlp', 'hidden_dims': '[128, 64]', 'dropout': 0.4309244222196599, 'batch_norm': True, 'lr': 0.0002101183445888185, 'weight_decay': 8.142198794715338e-07, 'epochs': 312, 'loss': 'mse', 'optimizer': 'adam', 'graph_mode': 'off', 'use_snp_selection': False}. Best is trial 16 with value: 0.08817918641086803.
[I 2025-12-05 15:50:37,317] Trial 59 finished with value: 0.0636491637206327 and parameters: {'model_type': 'mlp', 'hidden_dims': '[512, 64]', 'dropout': 0.33688972526675043, 'batch_norm': True, 'lr': 0.0007532664210222103, 'weight_decay': 1.1631115583746947e-06, 'epochs': 305, 'loss': 'mse', 'optimizer': 'adam', 'graph_mode': 'off', 'use_snp_selection': False}. Best is trial 16 with value: 0.08817918641086803.
[I 2025-12-05 15:50:38,066] Trial 60 finished with value: 0.042183923465395255 and parameters: {'model_type': 'mlp', 'hidden_dims': '[256, 128, 64]', 'dropout': 0.22099445367699483, 'batch_norm': False, 'lr': 0.00041996008561696413, 'weight_decay': 8.698772189287651e-06, 'epochs': 83, 'loss': 'mse', 'optimizer': 'adam', 'graph_mode': 'off', 'use_snp_selection': False}. Best is trial 16 with value: 0.08817918641086803.
[I 2025-12-05 15:50:39,656] Trial 61 finished with value: 0.035932615927733266 and parameters: {'model_type': 'mlp', 'hidden_dims': '[512, 64]', 'dropout': 0.284378985845506, 'batch_norm': True, 'lr': 0.0003378416022168498, 'weight_decay': 2.1102315098801727e-06, 'epochs': 273, 'loss': 'mse', 'optimizer': 'adam', 'graph_mode': 'off', 'use_snp_selection': False}. Best is trial 16 with value: 0.08817918641086803.
[I 2025-12-05 15:50:41,246] Trial 62 finished with value: 0.07460484768787788 and parameters: {'model_type': 'mlp', 'hidden_dims': '[512, 64]', 'dropout': 0.2350761347371266, 'batch_norm': True, 'lr': 0.0003168063930112948, 'weight_decay': 3.677962560335657e-06, 'epochs': 257, 'loss': 'mse', 'optimizer': 'adam', 'graph_mode': 'off', 'use_snp_selection': False}. Best is trial 16 with value: 0.08817918641086803.
[I 2025-12-05 15:50:42,833] Trial 63 finished with value: 0.06908085569246408 and parameters: {'model_type': 'mlp', 'hidden_dims': '[512, 64]', 'dropout': 0.15278831350695413, 'batch_norm': True, 'lr': 0.00012773520387779786, 'weight_decay': 3.841374587490001e-06, 'epochs': 252, 'loss': 'mse', 'optimizer': 'adam', 'graph_mode': 'off', 'use_snp_selection': False}. Best is trial 16 with value: 0.08817918641086803.
[I 2025-12-05 15:50:44,494] Trial 64 finished with value: 0.06778513338636345 and parameters: {'model_type': 'mlp', 'hidden_dims': '[512, 64]', 'dropout': 0.2657634930273002, 'batch_norm': True, 'lr': 0.0005408811240146959, 'weight_decay': 6.696330978542699e-06, 'epochs': 282, 'loss': 'mse', 'optimizer': 'adam', 'graph_mode': 'off', 'use_snp_selection': False}. Best is trial 16 with value: 0.08817918641086803.
[I 2025-12-05 15:50:45,905] Trial 65 finished with value: 0.004697144827426697 and parameters: {'model_type': 'mlp', 'hidden_dims': '[512, 64]', 'dropout': 0.1924507049856623, 'batch_norm': True, 'lr': 9.43616264131011e-06, 'weight_decay': 3.422849054117704e-06, 'epochs': 206, 'loss': 'mse', 'optimizer': 'adam', 'graph_mode': 'off', 'use_snp_selection': False}. Best is trial 16 with value: 0.08817918641086803.
[I 2025-12-05 15:50:47,009] Trial 66 finished with value: 0.06083220657092922 and parameters: {'model_type': 'mlp', 'hidden_dims': '[256, 128, 64]', 'dropout': 0.30816112320187117, 'batch_norm': True, 'lr': 0.0007758949512633507, 'weight_decay': 4.3189207736827664e-07, 'epochs': 260, 'loss': 'mse', 'optimizer': 'adam', 'graph_mode': 'off', 'use_snp_selection': False}. Best is trial 16 with value: 0.08817918641086803.
[I 2025-12-05 15:50:48,744] Trial 67 finished with value: 0.08184943331219997 and parameters: {'model_type': 'mlp', 'hidden_dims': '[512, 128]', 'dropout': 0.2410423810349869, 'batch_norm': True, 'lr': 0.00016376867660378015, 'weight_decay': 1.155637753641378e-05, 'epochs': 317, 'loss': 'mse', 'optimizer': 'adam', 'graph_mode': 'off', 'use_snp_selection': False}. Best is trial 16 with value: 0.08817918641086803.
[I 2025-12-05 15:50:50,216] Trial 68 finished with value: 0.053264574410223114 and parameters: {'model_type': 'mlp', 'hidden_dims': '[512, 128]', 'dropout': 0.17048721868770464, 'batch_norm': True, 'lr': 0.0001728127199164221, 'weight_decay': 1.6582471552522363e-05, 'epochs': 233, 'loss': 'mse', 'optimizer': 'adam', 'graph_mode': 'off', 'use_snp_selection': False}. Best is trial 16 with value: 0.08817918641086803.
[I 2025-12-05 15:50:51,867] Trial 69 finished with value: 0.06308919947661912 and parameters: {'model_type': 'mlp', 'hidden_dims': '[512, 128]', 'dropout': 0.219564462707212, 'batch_norm': True, 'lr': 5.308265214184997e-05, 'weight_decay': 2.4880466275178006e-05, 'epochs': 291, 'loss': 'mse', 'optimizer': 'adam', 'graph_mode': 'off', 'use_snp_selection': False}. Best is trial 16 with value: 0.08817918641086803.
[I 2025-12-05 15:50:53,596] Trial 70 finished with value: 0.06529971996367595 and parameters: {'model_type': 'mlp', 'hidden_dims': '[512, 128]', 'dropout': 0.12334923154016449, 'batch_norm': True, 'lr': 0.00023849465886095268, 'weight_decay': 1.004716403890187e-05, 'epochs': 316, 'loss': 'mse', 'optimizer': 'adam', 'graph_mode': 'off', 'use_snp_selection': False}. Best is trial 16 with value: 0.08817918641086803.
[I 2025-12-05 15:50:55,349] Trial 71 finished with value: 0.032807980108667784 and parameters: {'model_type': 'mlp', 'hidden_dims': '[512, 128]', 'dropout': 0.24615363652499958, 'batch_norm': True, 'lr': 9.460268047574635e-05, 'weight_decay': 6.94200126714185e-07, 'epochs': 324, 'loss': 'mse', 'optimizer': 'adam', 'graph_mode': 'off', 'use_snp_selection': False}. Best is trial 16 with value: 0.08817918641086803.
[I 2025-12-05 15:50:56,490] Trial 72 finished with value: 0.07275649330797057 and parameters: {'model_type': 'mlp', 'hidden_dims': '[256, 128]', 'dropout': 0.2670328158391266, 'batch_norm': True, 'lr': 6.693736109992268e-05, 'weight_decay': 6.21380463413712e-06, 'epochs': 304, 'loss': 'mse', 'optimizer': 'adam', 'graph_mode': 'off', 'use_snp_selection': False}. Best is trial 16 with value: 0.08817918641086803.
[I 2025-12-05 15:50:57,509] Trial 73 finished with value: 0.07422502449748306 and parameters: {'model_type': 'mlp', 'hidden_dims': '[128, 64]', 'dropout': 0.23824711469145216, 'batch_norm': True, 'lr': 0.00015291526266746343, 'weight_decay': 1.1686446311727131e-06, 'epochs': 343, 'loss': 'mse', 'optimizer': 'adam', 'graph_mode': 'off', 'use_snp_selection': False}. Best is trial 16 with value: 0.08817918641086803.
[I 2025-12-05 15:50:58,569] Trial 74 finished with value: 0.06987496126909402 and parameters: {'model_type': 'mlp', 'hidden_dims': '[128, 64]', 'dropout': 0.23659489478319734, 'batch_norm': True, 'lr': 0.00020510440362892868, 'weight_decay': 1.0969598216453096e-06, 'epochs': 339, 'loss': 'mse', 'optimizer': 'adam', 'graph_mode': 'off', 'use_snp_selection': False}. Best is trial 16 with value: 0.08817918641086803.
[I 2025-12-05 15:50:59,597] Trial 75 finished with value: 0.05821736939058025 and parameters: {'model_type': 'mlp', 'hidden_dims': '[128, 64]', 'dropout': 0.2837040290587656, 'batch_norm': True, 'lr': 0.00014120260479427133, 'weight_decay': 2.1872630255678376e-06, 'epochs': 297, 'loss': 'mae', 'optimizer': 'adam', 'graph_mode': 'off', 'use_snp_selection': False}. Best is trial 16 with value: 0.08817918641086803.
[I 2025-12-05 15:51:00,585] Trial 76 finished with value: 0.0630606894774311 and parameters: {'model_type': 'mlp', 'hidden_dims': '[128, 64]', 'dropout': 0.19127919963227896, 'batch_norm': True, 'lr': 0.00031665962299836286, 'weight_decay': 1.1805552833197373e-05, 'epochs': 278, 'loss': 'mse', 'optimizer': 'adam', 'graph_mode': 'off', 'use_snp_selection': False}. Best is trial 16 with value: 0.08817918641086803.
[I 2025-12-05 15:51:01,557] Trial 77 finished with value: 0.07409506344706503 and parameters: {'model_type': 'mlp', 'hidden_dims': '[128, 64]', 'dropout': 0.21524854057075174, 'batch_norm': True, 'lr': 0.00016567858385298158, 'weight_decay': 2.405748497793027e-07, 'epochs': 263, 'loss': 'mae', 'optimizer': 'adam', 'graph_mode': 'off', 'use_snp_selection': False}. Best is trial 16 with value: 0.08817918641086803.
[I 2025-12-05 15:51:03,228] Trial 78 finished with value: 0.07861842304743547 and parameters: {'model_type': 'mlp', 'hidden_dims': '[512, 128]', 'dropout': 0.2305610938032548, 'batch_norm': True, 'lr': 0.00011539682912389014, 'weight_decay': 1.944694140131963e-05, 'epochs': 287, 'loss': 'mse', 'optimizer': 'adam', 'graph_mode': 'off', 'use_snp_selection': False}. Best is trial 16 with value: 0.08817918641086803.
[I 2025-12-05 15:51:04,866] Trial 79 finished with value: 0.04778986703676648 and parameters: {'model_type': 'mlp', 'hidden_dims': '[512, 128]', 'dropout': 0.14189760721884118, 'batch_norm': False, 'lr': 0.00045358507500309407, 'weight_decay': 2.1703691362528342e-05, 'epochs': 289, 'loss': 'mae', 'optimizer': 'adam', 'graph_mode': 'off', 'use_snp_selection': False}. Best is trial 16 with value: 0.08817918641086803.
[I 2025-12-05 15:51:06,302] Trial 80 finished with value: 0.06106393921789578 and parameters: {'model_type': 'mlp', 'hidden_dims': '[512, 128]', 'dropout': 0.20575455167394036, 'batch_norm': True, 'lr': 9.965278295391684e-05, 'weight_decay': 3.926388502362073e-05, 'epochs': 223, 'loss': 'mae', 'optimizer': 'adam', 'graph_mode': 'off', 'use_snp_selection': False}. Best is trial 16 with value: 0.08817918641086803.
[I 2025-12-05 15:51:08,018] Trial 81 finished with value: 0.0519970415513455 and parameters: {'model_type': 'mlp', 'hidden_dims': '[512, 128]', 'dropout': 0.23047094315828406, 'batch_norm': True, 'lr': 0.00012632310617884747, 'weight_decay': 1.3374205618857162e-05, 'epochs': 312, 'loss': 'mse', 'optimizer': 'adam', 'graph_mode': 'off', 'use_snp_selection': False}. Best is trial 16 with value: 0.08817918641086803.
[I 2025-12-05 15:51:09,835] Trial 82 finished with value: 0.05072898789448576 and parameters: {'model_type': 'mlp', 'hidden_dims': '[512, 128]', 'dropout': 0.2520668767109464, 'batch_norm': True, 'lr': 0.0002749079904714232, 'weight_decay': 9.718548499771905e-06, 'epochs': 342, 'loss': 'mse', 'optimizer': 'adam', 'graph_mode': 'off', 'use_snp_selection': False}. Best is trial 16 with value: 0.08817918641086803.
[I 2025-12-05 15:51:11,591] Trial 83 finished with value: 0.058164493686195536 and parameters: {'model_type': 'mlp', 'hidden_dims': '[512, 256]', 'dropout': 0.11917594243637687, 'batch_norm': True, 'lr': 8.47210896454191e-05, 'weight_decay': 1.2204753196847041e-06, 'epochs': 323, 'loss': 'mse', 'optimizer': 'adam', 'graph_mode': 'off', 'use_snp_selection': False}. Best is trial 16 with value: 0.08817918641086803.
[I 2025-12-05 15:51:13,301] Trial 84 finished with value: 0.0655380279543123 and parameters: {'model_type': 'mlp', 'hidden_dims': '[512, 128]', 'dropout': 0.29096760927885007, 'batch_norm': True, 'lr': 0.00022674878752254198, 'weight_decay': 3.0826700026033893e-07, 'epochs': 298, 'loss': 'mse', 'optimizer': 'adam', 'graph_mode': 'off', 'use_snp_selection': False}. Best is trial 16 with value: 0.08817918641086803.
[I 2025-12-05 15:51:14,388] Trial 85 finished with value: 0.06013903198158128 and parameters: {'model_type': 'mlp', 'hidden_dims': '[256, 128, 64]', 'dropout': 0.325254452373556, 'batch_norm': True, 'lr': 0.00018870220273310473, 'weight_decay': 4.297263415728481e-07, 'epochs': 239, 'loss': 'mse', 'optimizer': 'adam', 'graph_mode': 'off', 'use_snp_selection': False}. Best is trial 16 with value: 0.08817918641086803.
[I 2025-12-05 15:51:15,373] Trial 86 finished with value: 0.06510404489732244 and parameters: {'model_type': 'mlp', 'hidden_dims': '[128, 64]', 'dropout': 0.24311188562067043, 'batch_norm': True, 'lr': 4.20308883825284e-05, 'weight_decay': 5.06270726585624e-06, 'epochs': 270, 'loss': 'mse', 'optimizer': 'adam', 'graph_mode': 'off', 'use_snp_selection': False}. Best is trial 16 with value: 0.08817918641086803.
[I 2025-12-05 15:51:16,841] Trial 87 finished with value: 0.0532385479947767 and parameters: {'model_type': 'mlp', 'hidden_dims': '[512, 128]', 'dropout': 0.2294866143169634, 'batch_norm': True, 'lr': 0.0001108308456085782, 'weight_decay': 7.013279936750894e-06, 'epochs': 281, 'loss': 'mae', 'optimizer': 'adam', 'graph_mode': 'off', 'use_snp_selection': True, 'num_snps': 19154}. Best is trial 16 with value: 0.08817918641086803.
[I 2025-12-05 15:51:18,108] Trial 88 finished with value: 0.012243579959766 and parameters: {'model_type': 'mlp', 'hidden_dims': '[512, 64]', 'dropout': 0.34416459077534595, 'batch_norm': True, 'lr': 1.1664965422250752e-06, 'weight_decay': 1.917896547640805e-05, 'epochs': 160, 'loss': 'mse', 'optimizer': 'adam', 'graph_mode': 'off', 'use_snp_selection': False}. Best is trial 16 with value: 0.08817918641086803.
[I 2025-12-05 15:51:19,195] Trial 89 finished with value: 0.07065578571529592 and parameters: {'model_type': 'mlp', 'hidden_dims': '[256, 128, 64]', 'dropout': 0.18207692554283159, 'batch_norm': True, 'lr': 0.00039270704837047864, 'weight_decay': 2.1048549754678406e-06, 'epochs': 252, 'loss': 'mae', 'optimizer': 'adam', 'graph_mode': 'off', 'use_snp_selection': False}. Best is trial 16 with value: 0.08817918641086803.
[I 2025-12-05 15:51:20,902] Trial 90 finished with value: 0.058572345944731694 and parameters: {'model_type': 'mlp', 'hidden_dims': '[512, 128]', 'dropout': 0.15548484277584965, 'batch_norm': True, 'lr': 0.0001485305775953878, 'weight_decay': 3.097921301064335e-05, 'epochs': 308, 'loss': 'mse', 'optimizer': 'adam', 'graph_mode': 'off', 'use_snp_selection': False}. Best is trial 16 with value: 0.08817918641086803.
[I 2025-12-05 15:51:21,857] Trial 91 finished with value: 0.06876949605728164 and parameters: {'model_type': 'mlp', 'hidden_dims': '[128, 64]', 'dropout': 0.21228781106804145, 'batch_norm': True, 'lr': 0.0001535859754284573, 'weight_decay': 2.888984918032223e-07, 'epochs': 262, 'loss': 'mae', 'optimizer': 'adam', 'graph_mode': 'off', 'use_snp_selection': False}. Best is trial 16 with value: 0.08817918641086803.
[I 2025-12-05 15:51:22,796] Trial 92 finished with value: 0.06424738348478112 and parameters: {'model_type': 'mlp', 'hidden_dims': '[128, 64]', 'dropout': 0.2552722530007121, 'batch_norm': True, 'lr': 0.0001723022264717086, 'weight_decay': 1.5421712626890968e-07, 'epochs': 266, 'loss': 'mae', 'optimizer': 'adam', 'graph_mode': 'off', 'use_snp_selection': False}. Best is trial 16 with value: 0.08817918641086803.
[I 2025-12-05 15:51:23,801] Trial 93 finished with value: 0.03818632450793769 and parameters: {'model_type': 'mlp', 'hidden_dims': '[128, 64]', 'dropout': 0.2150906829588664, 'batch_norm': True, 'lr': 7.476837559770181e-05, 'weight_decay': 1.5688368145188646e-05, 'epochs': 328, 'loss': 'mae', 'optimizer': 'adam', 'graph_mode': 'off', 'use_snp_selection': False}. Best is trial 16 with value: 0.08817918641086803.
[I 2025-12-05 15:51:24,749] Trial 94 finished with value: 0.05221659776394795 and parameters: {'model_type': 'mlp', 'hidden_dims': '[128, 64]', 'dropout': 0.11361550330482467, 'batch_norm': True, 'lr': 0.00030158275616171636, 'weight_decay': 2.2112928258016972e-07, 'epochs': 285, 'loss': 'mae', 'optimizer': 'adam', 'graph_mode': 'off', 'use_snp_selection': False}. Best is trial 16 with value: 0.08817918641086803.
[I 2025-12-05 15:51:26,404] Trial 95 finished with value: 0.0311613065624126 and parameters: {'model_type': 'mlp', 'hidden_dims': '[512, 64]', 'dropout': 0.2717931099171555, 'batch_norm': True, 'lr': 1.7027022356816734e-05, 'weight_decay': 4.930903333304556e-07, 'epochs': 292, 'loss': 'mae', 'optimizer': 'adam', 'graph_mode': 'off', 'use_snp_selection': False}. Best is trial 16 with value: 0.08817918641086803.
[I 2025-12-05 15:51:27,514] Trial 96 finished with value: 0.029221575919933834 and parameters: {'model_type': 'mlp', 'hidden_dims': '[256, 128]', 'dropout': 0.29454893157805195, 'batch_norm': False, 'lr': 0.0002577146583934026, 'weight_decay': 3.9425557206177535e-06, 'epochs': 276, 'loss': 'mae', 'optimizer': 'adam', 'graph_mode': 'off', 'use_snp_selection': False}. Best is trial 16 with value: 0.08817918641086803.
[I 2025-12-05 15:51:28,484] Trial 97 finished with value: 0.07095135586289536 and parameters: {'model_type': 'mlp', 'hidden_dims': '[128, 64]', 'dropout': 0.13618135729952713, 'batch_norm': True, 'lr': 0.0001210596525367194, 'weight_decay': 7.365720937619121e-07, 'epochs': 248, 'loss': 'mae', 'optimizer': 'adam', 'graph_mode': 'off', 'use_snp_selection': False}. Best is trial 16 with value: 0.08817918641086803.
