[I 2025-12-05 15:02:33,060] Trial 52 finished with value: 0.2713138900156849 and parameters: {'model_type': 'mlp', 'hidden_dims': '[512, 128]', 'dropout': 0.5103953213910641, 'batch_norm': False, 'lr': 8.273001840599444e-06, 'weight_decay': 0.0007203667046427403, 'epochs': 92, 'loss': 'mae', 'optimizer': 'adam', 'graph_mode': 'off', 'use_snp_selection': False}. Best is trial 10 with value: 0.2718261143261549.
[I 2025-12-05 15:03:03,680] Trial 53 finished with value: 0.2659022378049293 and parameters: {'model_type': 'mlp', 'hidden_dims': '[512, 128]', 'dropout': 0.5448415893955675, 'batch_norm': False, 'lr': 7.95487842682474e-06, 'weight_decay': 0.000702604676954342, 'epochs': 82, 'loss': 'mae', 'optimizer': 'adam', 'graph_mode': 'off', 'use_snp_selection': False}. Best is trial 10 with value: 0.2718261143261549.
[I 2025-12-05 15:03:44,441] Trial 54 finished with value: 0.2635576859832264 and parameters: {'model_type': 'mlp', 'hidden_dims': '[512, 128]', 'dropout': 0.49143088292093806, 'batch_norm': False, 'lr': 1.5996427798033232e-05, 'weight_decay': 0.0003410915974825314, 'epochs': 119, 'loss': 'mae', 'optimizer': 'adam', 'graph_mode': 'off', 'use_snp_selection': False}. Best is trial 10 with value: 0.2718261143261549.
[I 2025-12-05 15:04:11,836] Trial 55 finished with value: 0.254784691756646 and parameters: {'model_type': 'mlp', 'hidden_dims': '[512, 64]', 'dropout': 0.3847953062632278, 'batch_norm': False, 'lr': 5.759229354670976e-06, 'weight_decay': 2.2905391528548287e-06, 'epochs': 70, 'loss': 'mae', 'optimizer': 'adam', 'graph_mode': 'off', 'use_snp_selection': False}. Best is trial 10 with value: 0.2718261143261549.
[I 2025-12-05 15:05:27,253] Trial 56 finished with value: 0.17218072093888348 and parameters: {'model_type': 'mlp', 'hidden_dims': '[512, 256]', 'dropout': 0.5101595966055592, 'batch_norm': False, 'lr': 0.0007171669415635536, 'weight_decay': 4.448598525417892e-06, 'epochs': 248, 'loss': 'mae', 'optimizer': 'adam', 'graph_mode': 'off', 'use_snp_selection': False}. Best is trial 10 with value: 0.2718261143261549.
[I 2025-12-05 15:05:46,756] Trial 57 finished with value: 0.22852576851282533 and parameters: {'model_type': 'mlp', 'hidden_dims': '[512, 128]', 'dropout': 0.573492349243097, 'batch_norm': False, 'lr': 9.148540628868094e-06, 'weight_decay': 6.121189869565623e-05, 'epochs': 42, 'loss': 'mae', 'optimizer': 'adam', 'graph_mode': 'off', 'use_snp_selection': False}. Best is trial 10 with value: 0.2718261143261549.
[I 2025-12-05 15:06:10,417] Trial 58 finished with value: 0.20196254882222658 and parameters: {'model_type': 'mlp', 'hidden_dims': '[512, 64]', 'dropout': 0.5855661923330973, 'batch_norm': False, 'lr': 2.54682790714754e-06, 'weight_decay': 1.4003573564686105e-05, 'epochs': 57, 'loss': 'mae', 'optimizer': 'adam', 'graph_mode': 'off', 'use_snp_selection': False}. Best is trial 10 with value: 0.2718261143261549.
[I 2025-12-05 15:06:42,715] Trial 59 finished with value: 0.27220164744591663 and parameters: {'model_type': 'mlp', 'hidden_dims': '[512, 64]', 'dropout': 0.36273009858394845, 'batch_norm': False, 'lr': 2.4391175725156974e-05, 'weight_decay': 0.0006298129729689404, 'epochs': 89, 'loss': 'mae', 'optimizer': 'adam', 'graph_mode': 'off', 'use_snp_selection': False}. Best is trial 59 with value: 0.27220164744591663.
[I 2025-12-05 15:07:15,099] Trial 60 finished with value: 0.227656802731596 and parameters: {'model_type': 'mlp', 'hidden_dims': '[512, 128]', 'dropout': 0.36235676281238355, 'batch_norm': False, 'lr': 2.2741067262313152e-05, 'weight_decay': 0.0006903324189051901, 'epochs': 110, 'loss': 'mse', 'optimizer': 'adam', 'graph_mode': 'off', 'use_snp_selection': True, 'num_snps': 2400}. Best is trial 59 with value: 0.27220164744591663.
[I 2025-12-05 15:07:48,041] Trial 61 finished with value: 0.26406404592849586 and parameters: {'model_type': 'mlp', 'hidden_dims': '[512, 64]', 'dropout': 0.5636845055212677, 'batch_norm': False, 'lr': 1.5821061541782744e-05, 'weight_decay': 0.0002456067462628571, 'epochs': 92, 'loss': 'mae', 'optimizer': 'adam', 'graph_mode': 'off', 'use_snp_selection': False}. Best is trial 59 with value: 0.27220164744591663.
[I 2025-12-05 15:08:13,904] Trial 62 finished with value: 0.2584081697415793 and parameters: {'model_type': 'mlp', 'hidden_dims': '[512, 64]', 'dropout': 0.2674416800163206, 'batch_norm': False, 'lr': 7.158156900445995e-06, 'weight_decay': 0.0005434169579594442, 'epochs': 65, 'loss': 'mae', 'optimizer': 'adam', 'graph_mode': 'off', 'use_snp_selection': False}. Best is trial 59 with value: 0.27220164744591663.
[I 2025-12-05 15:08:45,006] Trial 63 finished with value: 0.25823589384242396 and parameters: {'model_type': 'mlp', 'hidden_dims': '[512, 64]', 'dropout': 0.22835040162415007, 'batch_norm': False, 'lr': 2.6258430273430575e-05, 'weight_decay': 7.711692223445815e-06, 'epochs': 85, 'loss': 'mae', 'optimizer': 'adam', 'graph_mode': 'off', 'use_snp_selection': False}. Best is trial 59 with value: 0.27220164744591663.
[I 2025-12-05 15:09:53,101] Trial 64 finished with value: 0.2574389203231007 and parameters: {'model_type': 'mlp', 'hidden_dims': '[512, 64]', 'dropout': 0.32310702807217234, 'batch_norm': False, 'lr': 1.0193667487424767e-05, 'weight_decay': 0.0009538154245264436, 'epochs': 216, 'loss': 'mae', 'optimizer': 'adam', 'graph_mode': 'off', 'use_snp_selection': False}. Best is trial 59 with value: 0.27220164744591663.
[I 2025-12-05 15:11:36,813] Trial 65 finished with value: 0.2524037104402558 and parameters: {'model_type': 'mlp', 'hidden_dims': '[512, 64]', 'dropout': 0.12377983870433235, 'batch_norm': False, 'lr': 4.8593111526576264e-05, 'weight_decay': 0.000365974074811543, 'epochs': 349, 'loss': 'mae', 'optimizer': 'adam', 'graph_mode': 'off', 'use_snp_selection': False}. Best is trial 59 with value: 0.27220164744591663.
[I 2025-12-05 15:12:01,700] Trial 66 finished with value: 0.2655202462705632 and parameters: {'model_type': 'mlp', 'hidden_dims': '[256, 128]', 'dropout': 0.5421466341937017, 'batch_norm': False, 'lr': 1.3339980070873338e-05, 'weight_decay': 1.6869926961424956e-06, 'epochs': 128, 'loss': 'mae', 'optimizer': 'adam', 'graph_mode': 'off', 'use_snp_selection': False}. Best is trial 59 with value: 0.27220164744591663.
[I 2025-12-05 15:12:14,637] Trial 67 finished with value: 0.18926476510341445 and parameters: {'model_type': 'mlp', 'hidden_dims': '[128, 64]', 'dropout': 0.5923226879833359, 'batch_norm': False, 'lr': 3.783154637190207e-06, 'weight_decay': 0.00019311145420368466, 'epochs': 94, 'loss': 'mae', 'optimizer': 'adam', 'graph_mode': 'off', 'use_snp_selection': False}. Best is trial 59 with value: 0.27220164744591663.
[I 2025-12-05 15:12:44,259] Trial 68 finished with value: 0.2642043744508788 and parameters: {'model_type': 'mlp', 'hidden_dims': '[512, 64]', 'dropout': 0.4799443764438646, 'batch_norm': False, 'lr': 1.7963999258063726e-05, 'weight_decay': 4.5616743067161246e-07, 'epochs': 79, 'loss': 'mae', 'optimizer': 'adam', 'graph_mode': 'off', 'use_snp_selection': False}. Best is trial 59 with value: 0.27220164744591663.
[I 2025-12-05 15:13:33,273] Trial 69 finished with value: 0.20837026124815256 and parameters: {'model_type': 'mlp', 'hidden_dims': '[512, 128]', 'dropout': 0.40697537153077284, 'batch_norm': True, 'lr': 5.402957749394135e-06, 'weight_decay': 3.03411708708235e-06, 'epochs': 146, 'loss': 'mae', 'optimizer': 'adam', 'graph_mode': 'off', 'use_snp_selection': False}. Best is trial 59 with value: 0.27220164744591663.
[I 2025-12-05 15:13:48,758] Trial 70 finished with value: 0.20462145762424483 and parameters: {'model_type': 'mlp', 'hidden_dims': '[256, 128, 64]', 'dropout': 0.5830707197888595, 'batch_norm': False, 'lr': 7.535794029343569e-06, 'weight_decay': 0.0007032654075502983, 'epochs': 62, 'loss': 'mae', 'optimizer': 'adam', 'graph_mode': 'off', 'use_snp_selection': False}. Best is trial 59 with value: 0.27220164744591663.
[I 2025-12-05 15:14:26,031] Trial 71 finished with value: 0.25073085707092824 and parameters: {'model_type': 'mlp', 'hidden_dims': '[512, 128]', 'dropout': 0.5103060990890949, 'batch_norm': False, 'lr': 1.1416410743164684e-05, 'weight_decay': 0.0009908975769034394, 'epochs': 106, 'loss': 'mae', 'optimizer': 'adam', 'graph_mode': 'off', 'use_snp_selection': False}. Best is trial 59 with value: 0.27220164744591663.
[I 2025-12-05 15:15:01,610] Trial 72 finished with value: 0.2649377317330289 and parameters: {'model_type': 'mlp', 'hidden_dims': '[512, 128]', 'dropout': 0.5272971463033581, 'batch_norm': False, 'lr': 1.043404506995609e-05, 'weight_decay': 0.0007201841043752952, 'epochs': 100, 'loss': 'mae', 'optimizer': 'adam', 'graph_mode': 'off', 'use_snp_selection': False}. Best is trial 59 with value: 0.27220164744591663.
[I 2025-12-05 15:15:29,397] Trial 73 finished with value: 0.2580674978965846 and parameters: {'model_type': 'mlp', 'hidden_dims': '[512, 128]', 'dropout': 0.5481774706596295, 'batch_norm': False, 'lr': 8.553223153364018e-06, 'weight_decay': 0.0005298593055539973, 'epochs': 72, 'loss': 'mae', 'optimizer': 'adam', 'graph_mode': 'off', 'use_snp_selection': False}. Best is trial 59 with value: 0.27220164744591663.
[I 2025-12-05 15:15:50,877] Trial 74 finished with value: 0.2573120278144391 and parameters: {'model_type': 'mlp', 'hidden_dims': '[512, 128]', 'dropout': 0.4472472539063785, 'batch_norm': False, 'lr': 1.967720433980291e-05, 'weight_decay': 0.0003693364520031714, 'epochs': 50, 'loss': 'mae', 'optimizer': 'adam', 'graph_mode': 'off', 'use_snp_selection': False}. Best is trial 59 with value: 0.27220164744591663.
[I 2025-12-05 15:16:23,469] Trial 75 finished with value: 0.25868043960093334 and parameters: {'model_type': 'mlp', 'hidden_dims': '[512, 256]', 'dropout': 0.5629915618875818, 'batch_norm': False, 'lr': 6.52498741310575e-06, 'weight_decay': 1.1882455793034792e-06, 'epochs': 89, 'loss': 'mae', 'optimizer': 'adam', 'graph_mode': 'off', 'use_snp_selection': False}. Best is trial 59 with value: 0.27220164744591663.
[I 2025-12-05 15:17:36,206] Trial 76 finished with value: 0.26632357451875055 and parameters: {'model_type': 'mlp', 'hidden_dims': '[512, 128]', 'dropout': 0.5294387602563607, 'batch_norm': False, 'lr': 1.454306320109647e-05, 'weight_decay': 0.00041770935541854545, 'epochs': 116, 'loss': 'mae', 'optimizer': 'adam', 'graph_mode': 'off', 'use_snp_selection': True, 'num_snps': 49234}. Best is trial 59 with value: 0.27220164744591663.
[I 2025-12-05 15:18:12,211] Trial 77 finished with value: 0.26341391476932813 and parameters: {'model_type': 'mlp', 'hidden_dims': '[512, 64]', 'dropout': 0.4975731348288098, 'batch_norm': False, 'lr': 2.6295694417765e-05, 'weight_decay': 0.00028111969562816285, 'epochs': 104, 'loss': 'mae', 'optimizer': 'adam', 'graph_mode': 'off', 'use_snp_selection': False}. Best is trial 59 with value: 0.27220164744591663.
[I 2025-12-05 15:18:55,426] Trial 78 finished with value: 0.25241609222584854 and parameters: {'model_type': 'mlp', 'hidden_dims': '[512, 64]', 'dropout': 0.5989182355582517, 'batch_norm': False, 'lr': 4.4560345570843315e-06, 'weight_decay': 0.0008454780888969812, 'epochs': 128, 'loss': 'mse', 'optimizer': 'adam', 'graph_mode': 'off', 'use_snp_selection': False}. Best is trial 59 with value: 0.27220164744591663.
[I 2025-12-05 15:19:20,043] Trial 79 finished with value: 0.2526766201476186 and parameters: {'model_type': 'mlp', 'hidden_dims': '[512, 128]', 'dropout': 0.5600226432613009, 'batch_norm': False, 'lr': 9.824120673740172e-06, 'weight_decay': 1.8161604221759483e-05, 'epochs': 61, 'loss': 'mae', 'optimizer': 'adam', 'graph_mode': 'off', 'use_snp_selection': False}. Best is trial 59 with value: 0.27220164744591663.
[I 2025-12-05 15:19:40,030] Trial 80 finished with value: 0.24748470145580556 and parameters: {'model_type': 'mlp', 'hidden_dims': '[256, 128]', 'dropout': 0.4599043683415117, 'batch_norm': True, 'lr': 6.792894880434349e-05, 'weight_decay': 4.113213396665683e-06, 'epochs': 93, 'loss': 'mae', 'optimizer': 'adam', 'graph_mode': 'off', 'use_snp_selection': False}. Best is trial 59 with value: 0.27220164744591663.
[I 2025-12-05 15:20:25,745] Trial 81 finished with value: 0.2561440792101418 and parameters: {'model_type': 'mlp', 'hidden_dims': '[512, 128]', 'dropout': 0.5828828773567241, 'batch_norm': False, 'lr': 3.3199708130757196e-05, 'weight_decay': 0.000595246868843052, 'epochs': 139, 'loss': 'mae', 'optimizer': 'adam', 'graph_mode': 'off', 'use_snp_selection': False}. Best is trial 59 with value: 0.27220164744591663.
[I 2025-12-05 15:21:23,649] Trial 82 finished with value: 0.25594023611528033 and parameters: {'model_type': 'mlp', 'hidden_dims': '[512, 128]', 'dropout': 0.5544962272912292, 'batch_norm': False, 'lr': 8.229065709869706e-05, 'weight_decay': 0.0001372185606102019, 'epochs': 184, 'loss': 'mae', 'optimizer': 'adam', 'graph_mode': 'off', 'use_snp_selection': False}. Best is trial 59 with value: 0.27220164744591663.
[I 2025-12-05 15:21:50,585] Trial 83 finished with value: 0.2733847506123631 and parameters: {'model_type': 'mlp', 'hidden_dims': '[512, 128]', 'dropout': 0.5201274752251556, 'batch_norm': False, 'lr': 4.293541176259405e-05, 'weight_decay': 6.437703600448136e-06, 'epochs': 70, 'loss': 'mae', 'optimizer': 'adam', 'graph_mode': 'off', 'use_snp_selection': False}. Best is trial 83 with value: 0.2733847506123631.
[I 2025-12-05 15:22:17,208] Trial 84 finished with value: 0.2621636170238438 and parameters: {'model_type': 'mlp', 'hidden_dims': '[512, 128]', 'dropout': 0.5134383799072465, 'batch_norm': False, 'lr': 4.8093660468377304e-05, 'weight_decay': 9.621380498931331e-06, 'epochs': 69, 'loss': 'mae', 'optimizer': 'adam', 'graph_mode': 'off', 'use_snp_selection': False}. Best is trial 83 with value: 0.2733847506123631.
[I 2025-12-05 15:22:47,548] Trial 85 finished with value: 0.25870997436196336 and parameters: {'model_type': 'mlp', 'hidden_dims': '[512, 128]', 'dropout': 0.5359509759635834, 'batch_norm': False, 'lr': 1.1472143089231195e-05, 'weight_decay': 6.747714572827544e-06, 'epochs': 81, 'loss': 'mae', 'optimizer': 'adam', 'graph_mode': 'off', 'use_snp_selection': False}. Best is trial 83 with value: 0.2733847506123631.
[I 2025-12-05 15:22:57,159] Trial 86 finished with value: 0.2089268436172885 and parameters: {'model_type': 'mlp', 'hidden_dims': '[128, 64]', 'dropout': 0.4828852112526447, 'batch_norm': False, 'lr': 5.101677585009797e-06, 'weight_decay': 6.059416165382489e-06, 'epochs': 47, 'loss': 'mae', 'optimizer': 'adam', 'graph_mode': 'off', 'use_snp_selection': False}. Best is trial 83 with value: 0.2733847506123631.
[I 2025-12-05 15:24:01,364] Trial 87 finished with value: 0.25517202168028563 and parameters: {'model_type': 'mlp', 'hidden_dims': '[512, 64]', 'dropout': 0.5676305097282721, 'batch_norm': False, 'lr': 6.7328405300410315e-06, 'weight_decay': 2.3662592833293496e-06, 'epochs': 287, 'loss': 'mae', 'optimizer': 'adam', 'graph_mode': 'off', 'use_snp_selection': True, 'num_snps': 21748}. Best is trial 83 with value: 0.2733847506123631.
[I 2025-12-05 15:24:30,317] Trial 88 finished with value: 0.2809523674077484 and parameters: {'model_type': 'mlp', 'hidden_dims': '[512, 128]', 'dropout': 0.522763824940561, 'batch_norm': False, 'lr': 1.6655411381431428e-05, 'weight_decay': 5.5364302729374755e-06, 'epochs': 77, 'loss': 'mae', 'optimizer': 'adam', 'graph_mode': 'off', 'use_snp_selection': False}. Best is trial 88 with value: 0.2809523674077484.
[I 2025-12-05 15:24:44,739] Trial 89 finished with value: 0.23602585972088114 and parameters: {'model_type': 'mlp', 'hidden_dims': '[256, 128, 64]', 'dropout': 0.5807222687069129, 'batch_norm': False, 'lr': 1.7860295210399818e-05, 'weight_decay': 5.300641442172306e-06, 'epochs': 55, 'loss': 'mse', 'optimizer': 'adam', 'graph_mode': 'off', 'use_snp_selection': False}. Best is trial 88 with value: 0.2809523674077484.
[I 2025-12-05 15:25:12,986] Trial 90 finished with value: 0.276661790575142 and parameters: {'model_type': 'mlp', 'hidden_dims': '[512, 64]', 'dropout': 0.548418114239022, 'batch_norm': False, 'lr': 4.294650590674753e-05, 'weight_decay': 3.981701426126655e-06, 'epochs': 75, 'loss': 'mae', 'optimizer': 'adam', 'graph_mode': 'off', 'use_snp_selection': False}. Best is trial 88 with value: 0.2809523674077484.
[I 2025-12-05 15:25:41,794] Trial 91 finished with value: 0.2760419064756247 and parameters: {'model_type': 'mlp', 'hidden_dims': '[512, 64]', 'dropout': 0.5423253374316783, 'batch_norm': False, 'lr': 3.959739290392211e-05, 'weight_decay': 3.895134084011214e-06, 'epochs': 77, 'loss': 'mae', 'optimizer': 'adam', 'graph_mode': 'off', 'use_snp_selection': False}. Best is trial 88 with value: 0.2809523674077484.
[I 2025-12-05 15:26:10,138] Trial 92 finished with value: 0.2588605917159247 and parameters: {'model_type': 'mlp', 'hidden_dims': '[512, 64]', 'dropout': 0.49794253096334445, 'batch_norm': False, 'lr': 5.538266622613376e-05, 'weight_decay': 8.850584216819798e-06, 'epochs': 75, 'loss': 'mae', 'optimizer': 'adam', 'graph_mode': 'off', 'use_snp_selection': False}. Best is trial 88 with value: 0.2809523674077484.
[I 2025-12-05 15:26:41,495] Trial 93 finished with value: 0.25689765560310973 and parameters: {'model_type': 'mlp', 'hidden_dims': '[512, 64]', 'dropout': 0.5415959060149069, 'batch_norm': False, 'lr': 3.7816451666866084e-05, 'weight_decay': 3.7742182556022345e-06, 'epochs': 86, 'loss': 'mae', 'optimizer': 'adam', 'graph_mode': 'off', 'use_snp_selection': False}. Best is trial 88 with value: 0.2809523674077484.
[I 2025-12-05 15:27:07,433] Trial 94 finished with value: 0.26064419075797723 and parameters: {'model_type': 'mlp', 'hidden_dims': '[512, 64]', 'dropout': 0.5246416279778567, 'batch_norm': False, 'lr': 2.933685973069935e-05, 'weight_decay': 2.931449509987281e-06, 'epochs': 66, 'loss': 'mae', 'optimizer': 'adam', 'graph_mode': 'off', 'use_snp_selection': False}. Best is trial 88 with value: 0.2809523674077484.
[I 2025-12-05 15:27:28,059] Trial 95 finished with value: 0.2563599447180872 and parameters: {'model_type': 'mlp', 'hidden_dims': '[512, 64]', 'dropout': 0.5502033813040738, 'batch_norm': False, 'lr': 4.345607905373793e-05, 'weight_decay': 1.3924393851653762e-05, 'epochs': 47, 'loss': 'mae', 'optimizer': 'adam', 'graph_mode': 'off', 'use_snp_selection': False}. Best is trial 88 with value: 0.2809523674077484.
[I 2025-12-05 15:27:57,590] Trial 96 finished with value: 0.26422817135463195 and parameters: {'model_type': 'mlp', 'hidden_dims': '[512, 128]', 'dropout': 0.5162149794781723, 'batch_norm': False, 'lr': 2.3706834040806752e-05, 'weight_decay': 5.117573035935736e-06, 'epochs': 79, 'loss': 'mae', 'optimizer': 'adam', 'graph_mode': 'off', 'use_snp_selection': False}. Best is trial 88 with value: 0.2809523674077484.
[I 2025-12-05 15:28:32,683] Trial 97 finished with value: 0.2709075307221259 and parameters: {'model_type': 'mlp', 'hidden_dims': '[512, 256]', 'dropout': 0.5062191162959242, 'batch_norm': False, 'lr': 5.807407133664245e-05, 'weight_decay': 2.012065331539449e-06, 'epochs': 97, 'loss': 'mae', 'optimizer': 'adam', 'graph_mode': 'off', 'use_snp_selection': False}. Best is trial 88 with value: 0.2809523674077484.
[I 2025-12-05 15:28:56,324] Trial 98 finished with value: 0.27643533189285824 and parameters: {'model_type': 'mlp', 'hidden_dims': '[512, 256]', 'dropout': 0.5046628955626639, 'batch_norm': False, 'lr': 7.44435953117752e-05, 'weight_decay': 7.877113886104987e-07, 'epochs': 58, 'loss': 'mae', 'optimizer': 'adam', 'graph_mode': 'off', 'use_snp_selection': False}. Best is trial 88 with value: 0.2809523674077484.
[I 2025-12-05 15:29:20,034] Trial 99 finished with value: 0.26259174532944024 and parameters: {'model_type': 'mlp', 'hidden_dims': '[512, 256]', 'dropout': 0.47138164398463794, 'batch_norm': False, 'lr': 0.0001451464511652959, 'weight_decay': 7.835656297003853e-07, 'epochs': 58, 'loss': 'mae', 'optimizer': 'adam', 'graph_mode': 'off', 'use_snp_selection': False}. Best is trial 88 with value: 0.2809523674077484.
[I 2025-12-05 15:29:47,712] Trial 100 finished with value: 0.24747687965501405 and parameters: {'model_type': 'mlp', 'hidden_dims': '[512, 256]', 'dropout': 0.43091750130938455, 'batch_norm': True, 'lr': 8.88264139461653e-05, 'weight_decay': 1.6469367514012286e-06, 'epochs': 70, 'loss': 'mae', 'optimizer': 'adam', 'graph_mode': 'off', 'use_snp_selection': False}. Best is trial 88 with value: 0.2809523674077484.
[I 2025-12-05 15:30:21,539] Trial 101 finished with value: 0.2570836953809925 and parameters: {'model_type': 'mlp', 'hidden_dims': '[512, 256]', 'dropout': 0.5084758139458052, 'batch_norm': False, 'lr': 6.194135127527565e-05, 'weight_decay': 2.7623428939581953e-07, 'epochs': 95, 'loss': 'mae', 'optimizer': 'adam', 'graph_mode': 'off', 'use_snp_selection': False}. Best is trial 88 with value: 0.2809523674077484.
[I 2025-12-05 15:31:00,338] Trial 102 finished with value: 0.25623947106949896 and parameters: {'model_type': 'mlp', 'hidden_dims': '[512, 256]', 'dropout': 0.4901330691822913, 'batch_norm': False, 'lr': 3.959303248473032e-05, 'weight_decay': 2.020731580720021e-06, 'epochs': 113, 'loss': 'mae', 'optimizer': 'adam', 'graph_mode': 'off', 'use_snp_selection': False}. Best is trial 88 with value: 0.2809523674077484.
[I 2025-12-05 15:32:36,001] Trial 103 finished with value: 0.2539302817297928 and parameters: {'model_type': 'mlp', 'hidden_dims': '[512, 256]', 'dropout': 0.504704274297694, 'batch_norm': False, 'lr': 0.00011862314149104133, 'weight_decay': 3.4229895783902253e-06, 'epochs': 321, 'loss': 'mae', 'optimizer': 'adam', 'graph_mode': 'off', 'use_snp_selection': False}. Best is trial 88 with value: 0.2809523674077484.
