[I 2025-12-05 22:12:15,207] Trial 60 finished with value: 0.21374996623822487 and parameters: {'model_type': 'mlp', 'hidden_dims': '[256, 128, 64]', 'dropout': 0.20989377702658985, 'batch_norm': False, 'lr': 3.189147291721575e-05, 'weight_decay': 0.0003868445787707515, 'epochs': 269, 'loss': 'mse', 'optimizer': 'adam', 'graph_mode': 'off', 'use_snp_selection': True, 'num_snps': 28389}. Best is trial 45 with value: 0.22042093462114573.
[I 2025-12-05 22:13:10,300] Trial 61 finished with value: 0.20655478087160045 and parameters: {'model_type': 'mlp', 'hidden_dims': '[256, 128, 64]', 'dropout': 0.2139782507240613, 'batch_norm': False, 'lr': 2.9784442082244586e-05, 'weight_decay': 0.00040481211682412687, 'epochs': 263, 'loss': 'mse', 'optimizer': 'adam', 'graph_mode': 'off', 'use_snp_selection': True, 'num_snps': 28530}. Best is trial 45 with value: 0.22042093462114573.
[I 2025-12-05 22:14:10,750] Trial 62 finished with value: 0.20161096175149598 and parameters: {'model_type': 'mlp', 'hidden_dims': '[256, 128, 64]', 'dropout': 0.23719633947750293, 'batch_norm': False, 'lr': 1.784261042763266e-05, 'weight_decay': 0.0005853026160082508, 'epochs': 281, 'loss': 'mse', 'optimizer': 'adam', 'graph_mode': 'off', 'use_snp_selection': True, 'num_snps': 33560}. Best is trial 45 with value: 0.22042093462114573.
[I 2025-12-05 22:15:03,778] Trial 63 finished with value: 0.21438540218576563 and parameters: {'model_type': 'mlp', 'hidden_dims': '[256, 128, 64]', 'dropout': 0.27111610237122524, 'batch_norm': False, 'lr': 1.4798282352741673e-05, 'weight_decay': 0.00032530386041945014, 'epochs': 270, 'loss': 'mse', 'optimizer': 'adam', 'graph_mode': 'off', 'use_snp_selection': True, 'num_snps': 26340}. Best is trial 45 with value: 0.22042093462114573.
[I 2025-12-05 22:15:58,665] Trial 64 finished with value: 0.2076290852360962 and parameters: {'model_type': 'mlp', 'hidden_dims': '[256, 128, 64]', 'dropout': 0.2614166547989683, 'batch_norm': False, 'lr': 8.21332681652308e-06, 'weight_decay': 0.00027682402726615147, 'epochs': 312, 'loss': 'mse', 'optimizer': 'adam', 'graph_mode': 'off', 'use_snp_selection': True, 'num_snps': 25443}. Best is trial 45 with value: 0.22042093462114573.
[I 2025-12-05 22:16:44,654] Trial 65 finished with value: 0.21696985579676548 and parameters: {'model_type': 'mlp', 'hidden_dims': '[256, 128, 64]', 'dropout': 0.28981293124232155, 'batch_norm': False, 'lr': 1.2654044213021161e-05, 'weight_decay': 0.00010674979109370282, 'epochs': 250, 'loss': 'mse', 'optimizer': 'adam', 'graph_mode': 'off', 'use_snp_selection': True, 'num_snps': 19566}. Best is trial 45 with value: 0.22042093462114573.
[I 2025-12-05 22:17:31,077] Trial 66 finished with value: 0.21838796442768055 and parameters: {'model_type': 'mlp', 'hidden_dims': '[256, 128, 64]', 'dropout': 0.13735845235599461, 'batch_norm': False, 'lr': 1.2278980029695509e-05, 'weight_decay': 9.589603419507435e-05, 'epochs': 256, 'loss': 'mse', 'optimizer': 'adam', 'graph_mode': 'off', 'use_snp_selection': True, 'num_snps': 19569}. Best is trial 45 with value: 0.22042093462114573.
[I 2025-12-05 22:18:16,968] Trial 67 finished with value: 0.2106205610044199 and parameters: {'model_type': 'mlp', 'hidden_dims': '[256, 128, 64]', 'dropout': 0.1948682825488598, 'batch_norm': False, 'lr': 2.462622468172367e-05, 'weight_decay': 0.00011064684915897809, 'epochs': 254, 'loss': 'mse', 'optimizer': 'adam', 'graph_mode': 'off', 'use_snp_selection': True, 'num_snps': 19179}. Best is trial 45 with value: 0.22042093462114573.
[I 2025-12-05 22:19:01,625] Trial 68 finished with value: 0.21338315217270964 and parameters: {'model_type': 'mlp', 'hidden_dims': '[256, 128, 64]', 'dropout': 0.13506601598706525, 'batch_norm': False, 'lr': 8.109862890258097e-06, 'weight_decay': 3.840212717623848e-05, 'epochs': 225, 'loss': 'mse', 'optimizer': 'adam', 'graph_mode': 'off', 'use_snp_selection': True, 'num_snps': 19283}. Best is trial 45 with value: 0.22042093462114573.
[I 2025-12-05 22:19:38,285] Trial 69 finished with value: 0.20600015279555134 and parameters: {'model_type': 'mlp', 'hidden_dims': '[256, 128, 64]', 'dropout': 0.29148576336791154, 'batch_norm': False, 'lr': 1.7362502025760997e-05, 'weight_decay': 7.827589298844058e-05, 'epochs': 244, 'loss': 'mse', 'optimizer': 'adam', 'graph_mode': 'off', 'use_snp_selection': True, 'num_snps': 8591}. Best is trial 45 with value: 0.22042093462114573.
[I 2025-12-05 22:20:20,893] Trial 70 finished with value: 0.21656956336411398 and parameters: {'model_type': 'mlp', 'hidden_dims': '[256, 128, 64]', 'dropout': 0.12537498811218917, 'batch_norm': False, 'lr': 9.042574760059771e-06, 'weight_decay': 5.5157309657684504e-05, 'epochs': 197, 'loss': 'mse', 'optimizer': 'adam', 'graph_mode': 'off', 'use_snp_selection': True, 'num_snps': 17742}. Best is trial 45 with value: 0.22042093462114573.
[I 2025-12-05 22:21:04,419] Trial 71 finished with value: 0.21608118231958534 and parameters: {'model_type': 'mlp', 'hidden_dims': '[256, 128, 64]', 'dropout': 0.10467899277814358, 'batch_norm': False, 'lr': 9.691519977786652e-06, 'weight_decay': 0.00012087873955303741, 'epochs': 202, 'loss': 'mse', 'optimizer': 'adam', 'graph_mode': 'off', 'use_snp_selection': True, 'num_snps': 18599}. Best is trial 45 with value: 0.22042093462114573.
[I 2025-12-05 22:21:53,472] Trial 72 finished with value: 0.20722198099201453 and parameters: {'model_type': 'mlp', 'hidden_dims': '[256, 128, 64]', 'dropout': 0.1351501278386531, 'batch_norm': False, 'lr': 1.2751026993016943e-05, 'weight_decay': 5.966651422182483e-05, 'epochs': 257, 'loss': 'mse', 'optimizer': 'adam', 'graph_mode': 'off', 'use_snp_selection': True, 'num_snps': 22176}. Best is trial 45 with value: 0.22042093462114573.
[I 2025-12-05 22:22:35,627] Trial 73 finished with value: 0.1787242841872218 and parameters: {'model_type': 'mlp', 'hidden_dims': '[256, 128, 64]', 'dropout': 0.15143013368434363, 'batch_norm': False, 'lr': 2.9610405264822857e-06, 'weight_decay': 9.184790564937654e-05, 'epochs': 182, 'loss': 'mse', 'optimizer': 'adam', 'graph_mode': 'off', 'use_snp_selection': True, 'num_snps': 17668}. Best is trial 45 with value: 0.22042093462114573.
[I 2025-12-05 22:23:16,528] Trial 74 finished with value: 0.20796696308820284 and parameters: {'model_type': 'mlp', 'hidden_dims': '[128, 64]', 'dropout': 0.11851211868814696, 'batch_norm': False, 'lr': 6.858280825502159e-06, 'weight_decay': 0.00024666331251522317, 'epochs': 205, 'loss': 'mse', 'optimizer': 'adam', 'graph_mode': 'off', 'use_snp_selection': True, 'num_snps': 21118}. Best is trial 45 with value: 0.22042093462114573.
[I 2025-12-05 22:24:16,315] Trial 75 finished with value: 0.19878429892652605 and parameters: {'model_type': 'mlp', 'hidden_dims': '[256, 128, 64]', 'dropout': 0.2292420291509689, 'batch_norm': False, 'lr': 1.946905296044306e-05, 'weight_decay': 5.339463915660733e-05, 'epochs': 230, 'loss': 'mse', 'optimizer': 'adam', 'graph_mode': 'off', 'use_snp_selection': True, 'num_snps': 37420}. Best is trial 45 with value: 0.22042093462114573.
[I 2025-12-05 22:25:06,787] Trial 76 finished with value: 0.20672766960932293 and parameters: {'model_type': 'mlp', 'hidden_dims': '[256, 128, 64]', 'dropout': 0.18619193693732744, 'batch_norm': False, 'lr': 1.5550096171656978e-05, 'weight_decay': 0.00018621985268188693, 'epochs': 279, 'loss': 'mse', 'optimizer': 'adam', 'graph_mode': 'off', 'use_snp_selection': True, 'num_snps': 22949}. Best is trial 45 with value: 0.22042093462114573.
[I 2025-12-05 22:25:44,486] Trial 77 finished with value: 0.19145416667712992 and parameters: {'model_type': 'mlp', 'hidden_dims': '[256, 128, 64]', 'dropout': 0.20595021231284122, 'batch_norm': False, 'lr': 4.2640813201046e-06, 'weight_decay': 0.0001273830035520907, 'epochs': 251, 'loss': 'mse', 'optimizer': 'adam', 'graph_mode': 'off', 'use_snp_selection': True, 'num_snps': 9781}. Best is trial 45 with value: 0.22042093462114573.
[I 2025-12-05 22:26:37,395] Trial 78 finished with value: 0.2118817803812386 and parameters: {'model_type': 'mlp', 'hidden_dims': '[512, 64]', 'dropout': 0.14678072960839594, 'batch_norm': False, 'lr': 2.5745342730649794e-05, 'weight_decay': 0.0007612903801727028, 'epochs': 273, 'loss': 'mse', 'optimizer': 'adam', 'graph_mode': 'off', 'use_snp_selection': True, 'num_snps': 16686}. Best is trial 45 with value: 0.22042093462114573.
[I 2025-12-05 22:27:22,344] Trial 79 finished with value: 0.20930017960631422 and parameters: {'model_type': 'mlp', 'hidden_dims': '[256, 128, 64]', 'dropout': 0.12474120411892665, 'batch_norm': False, 'lr': 3.47578649246447e-05, 'weight_decay': 0.0001028141893287502, 'epochs': 158, 'loss': 'mse', 'optimizer': 'adam', 'graph_mode': 'off', 'use_snp_selection': True, 'num_snps': 24189}. Best is trial 45 with value: 0.22042093462114573.
[I 2025-12-05 22:28:08,616] Trial 80 finished with value: 0.21653697109513997 and parameters: {'model_type': 'mlp', 'hidden_dims': '[512, 256]', 'dropout': 0.18052851604017447, 'batch_norm': False, 'lr': 9.90906491925777e-06, 'weight_decay': 3.475371534305171e-05, 'epochs': 240, 'loss': 'mse', 'optimizer': 'adam', 'graph_mode': 'off', 'use_snp_selection': True, 'num_snps': 13021}. Best is trial 45 with value: 0.22042093462114573.
[I 2025-12-05 22:28:55,172] Trial 81 finished with value: 0.21408647297577482 and parameters: {'model_type': 'mlp', 'hidden_dims': '[512, 256]', 'dropout': 0.18516327028469703, 'batch_norm': False, 'lr': 9.359483009102193e-06, 'weight_decay': 5.559362410152056e-05, 'epochs': 241, 'loss': 'mse', 'optimizer': 'adam', 'graph_mode': 'off', 'use_snp_selection': True, 'num_snps': 13171}. Best is trial 45 with value: 0.22042093462114573.
[I 2025-12-05 22:29:50,037] Trial 82 finished with value: 0.20777062445458636 and parameters: {'model_type': 'mlp', 'hidden_dims': '[512, 256]', 'dropout': 0.1570152321880947, 'batch_norm': False, 'lr': 1.2323993648154975e-05, 'weight_decay': 3.531318793279486e-05, 'epochs': 209, 'loss': 'mse', 'optimizer': 'adam', 'graph_mode': 'off', 'use_snp_selection': True, 'num_snps': 20967}. Best is trial 45 with value: 0.22042093462114573.
[I 2025-12-05 22:30:41,547] Trial 83 finished with value: 0.2159624049757153 and parameters: {'model_type': 'mlp', 'hidden_dims': '[512, 256]', 'dropout': 0.20040375134795974, 'batch_norm': False, 'lr': 7.290935641367438e-06, 'weight_decay': 1.3532197036029894e-05, 'epochs': 227, 'loss': 'mse', 'optimizer': 'adam', 'graph_mode': 'off', 'use_snp_selection': True, 'num_snps': 17468}. Best is trial 45 with value: 0.22042093462114573.
[I 2025-12-05 22:31:26,450] Trial 84 finished with value: 0.20578692942030036 and parameters: {'model_type': 'mlp', 'hidden_dims': '[512, 256]', 'dropout': 0.1368721874421011, 'batch_norm': False, 'lr': 1.1127408703828773e-05, 'weight_decay': 7.736179721854292e-05, 'epochs': 192, 'loss': 'mse', 'optimizer': 'adam', 'graph_mode': 'off', 'use_snp_selection': True, 'num_snps': 13931}. Best is trial 45 with value: 0.22042093462114573.
[I 2025-12-05 22:32:09,641] Trial 85 finished with value: 0.20309862803990683 and parameters: {'model_type': 'mlp', 'hidden_dims': '[128, 64]', 'dropout': 0.17583186441000095, 'batch_norm': False, 'lr': 2.1104407894240028e-05, 'weight_decay': 0.00013769327594065207, 'epochs': 133, 'loss': 'mse', 'optimizer': 'adam', 'graph_mode': 'off', 'use_snp_selection': True, 'num_snps': 30331}. Best is trial 45 with value: 0.22042093462114573.
[I 2025-12-05 22:32:44,923] Trial 86 finished with value: 0.19090493332978048 and parameters: {'model_type': 'mlp', 'hidden_dims': '[256, 128, 64]', 'dropout': 0.21711924299434834, 'batch_norm': False, 'lr': 8.728421403610273e-06, 'weight_decay': 3.184225852846289e-05, 'epochs': 260, 'loss': 'mse', 'optimizer': 'adam', 'graph_mode': 'off', 'use_snp_selection': True, 'num_snps': 6700}. Best is trial 45 with value: 0.22042093462114573.
[I 2025-12-05 22:33:23,617] Trial 87 finished with value: 0.17364495276108588 and parameters: {'model_type': 'mlp', 'hidden_dims': '[256, 128, 64]', 'dropout': 0.22922983251998594, 'batch_norm': False, 'lr': 3.4654417708363667e-06, 'weight_decay': 0.00021649931622547242, 'epochs': 242, 'loss': 'mse', 'optimizer': 'adam', 'graph_mode': 'off', 'use_snp_selection': True, 'num_snps': 10770}. Best is trial 45 with value: 0.22042093462114573.
[I 2025-12-05 22:34:12,896] Trial 88 finished with value: 0.21484656479487638 and parameters: {'model_type': 'mlp', 'hidden_dims': '[512, 64]', 'dropout': 0.27952839083885217, 'batch_norm': False, 'lr': 5.2026019029787375e-05, 'weight_decay': 5.2617532165989194e-05, 'epochs': 288, 'loss': 'mse', 'optimizer': 'adam', 'graph_mode': 'off', 'use_snp_selection': True, 'num_snps': 13661}. Best is trial 45 with value: 0.22042093462114573.
[I 2025-12-05 22:35:02,466] Trial 89 finished with value: 0.21666392659373587 and parameters: {'model_type': 'mlp', 'hidden_dims': '[512, 256]', 'dropout': 0.14761479320113446, 'batch_norm': False, 'lr': 4.6072436442655085e-06, 'weight_decay': 7.9865718741502e-05, 'epochs': 219, 'loss': 'mse', 'optimizer': 'adam', 'graph_mode': 'off', 'use_snp_selection': True, 'num_snps': 16613}. Best is trial 45 with value: 0.22042093462114573.
[I 2025-12-05 22:35:49,894] Trial 90 finished with value: 0.21158796581314135 and parameters: {'model_type': 'mlp', 'hidden_dims': '[512, 256]', 'dropout': 0.12086334202126955, 'batch_norm': False, 'lr': 4.5897011390095845e-06, 'weight_decay': 1.886765117201986e-05, 'epochs': 213, 'loss': 'mse', 'optimizer': 'adam', 'graph_mode': 'off', 'use_snp_selection': True, 'num_snps': 15140}. Best is trial 45 with value: 0.22042093462114573.
[I 2025-12-05 22:36:39,537] Trial 91 finished with value: 0.20320372369760378 and parameters: {'model_type': 'mlp', 'hidden_dims': '[512, 256]', 'dropout': 0.1467199961040646, 'batch_norm': False, 'lr': 6.1379216580409665e-06, 'weight_decay': 0.00016776081084411704, 'epochs': 197, 'loss': 'mse', 'optimizer': 'adam', 'graph_mode': 'off', 'use_snp_selection': True, 'num_snps': 17641}. Best is trial 45 with value: 0.22042093462114573.
[I 2025-12-05 22:37:34,100] Trial 92 finished with value: 0.2004748035575042 and parameters: {'model_type': 'mlp', 'hidden_dims': '[512, 256]', 'dropout': 0.18013891999572063, 'batch_norm': False, 'lr': 2.6328769991569297e-06, 'weight_decay': 4.69473782618982e-05, 'epochs': 223, 'loss': 'mse', 'optimizer': 'adam', 'graph_mode': 'off', 'use_snp_selection': True, 'num_snps': 20156}. Best is trial 45 with value: 0.22042093462114573.
[I 2025-12-05 22:38:36,401] Trial 93 finished with value: 0.1944708692032998 and parameters: {'model_type': 'mlp', 'hidden_dims': '[512, 256]', 'dropout': 0.16146425535406642, 'batch_norm': False, 'lr': 1.5988808774664274e-06, 'weight_decay': 8.04938581397367e-05, 'epochs': 249, 'loss': 'mse', 'optimizer': 'adam', 'graph_mode': 'off', 'use_snp_selection': True, 'num_snps': 24215}. Best is trial 45 with value: 0.22042093462114573.
[I 2025-12-05 22:39:21,378] Trial 94 finished with value: 0.1912067501305957 and parameters: {'model_type': 'mlp', 'hidden_dims': '[256, 128, 64]', 'dropout': 0.19219068681536172, 'batch_norm': False, 'lr': 3.5842140540988317e-06, 'weight_decay': 0.000329997119878641, 'epochs': 306, 'loss': 'mse', 'optimizer': 'adam', 'graph_mode': 'off', 'use_snp_selection': True, 'num_snps': 15729}. Best is trial 45 with value: 0.22042093462114573.
[I 2025-12-05 22:40:01,866] Trial 95 finished with value: 0.1990893925746772 and parameters: {'model_type': 'mlp', 'hidden_dims': '[256, 128, 64]', 'dropout': 0.3278923848511214, 'batch_norm': False, 'lr': 7.485330972363895e-06, 'weight_decay': 0.0006162234395515554, 'epochs': 263, 'loss': 'mse', 'optimizer': 'adam', 'graph_mode': 'off', 'use_snp_selection': True, 'num_snps': 12452}. Best is trial 45 with value: 0.22042093462114573.
[I 2025-12-05 22:40:59,330] Trial 96 finished with value: 0.21659034224175305 and parameters: {'model_type': 'mlp', 'hidden_dims': '[512, 256]', 'dropout': 0.11326131509216636, 'batch_norm': False, 'lr': 5.304688004024419e-06, 'weight_decay': 0.00010135571743370577, 'epochs': 238, 'loss': 'mse', 'optimizer': 'adam', 'graph_mode': 'off', 'use_snp_selection': True, 'num_snps': 21688}. Best is trial 45 with value: 0.22042093462114573.
[I 2025-12-05 22:41:57,470] Trial 97 finished with value: 0.20194594118653927 and parameters: {'model_type': 'mlp', 'hidden_dims': '[512, 256]', 'dropout': 0.1310231908454357, 'batch_norm': False, 'lr': 4.946431940295775e-06, 'weight_decay': 6.412497195949067e-05, 'epochs': 236, 'loss': 'mse', 'optimizer': 'adam', 'graph_mode': 'off', 'use_snp_selection': True, 'num_snps': 22391}. Best is trial 45 with value: 0.22042093462114573.
[I 2025-12-05 22:43:26,863] Trial 98 finished with value: 0.18497135857314312 and parameters: {'model_type': 'mlp', 'hidden_dims': '[512, 256]', 'dropout': 0.10858662926538372, 'batch_norm': False, 'lr': 9.309645962313245e-06, 'weight_decay': 9.495680400336744e-05, 'epochs': 184, 'loss': 'mse', 'optimizer': 'adam', 'graph_mode': 'off', 'use_snp_selection': True, 'num_snps': 54210}. Best is trial 45 with value: 0.22042093462114573.
[I 2025-12-05 22:44:22,180] Trial 99 finished with value: 0.21212693505941793 and parameters: {'model_type': 'mlp', 'hidden_dims': '[512, 256]', 'dropout': 0.10211963888836859, 'batch_norm': False, 'lr': 2.3416979392149293e-06, 'weight_decay': 0.0001487682049161176, 'epochs': 216, 'loss': 'mse', 'optimizer': 'adam', 'graph_mode': 'off', 'use_snp_selection': True, 'num_snps': 21097}. Best is trial 45 with value: 0.22042093462114573.
[I 2025-12-05 22:45:20,457] Trial 100 finished with value: 0.20887580870035283 and parameters: {'model_type': 'mlp', 'hidden_dims': '[512, 256]', 'dropout': 0.11536114058300923, 'batch_norm': False, 'lr': 1.3942246211139106e-05, 'weight_decay': 6.997110532109658e-05, 'epochs': 343, 'loss': 'mse', 'optimizer': 'adam', 'graph_mode': 'off', 'use_snp_selection': True, 'num_snps': 16776}. Best is trial 45 with value: 0.22042093462114573.
[I 2025-12-05 22:46:13,175] Trial 101 finished with value: 0.2191635747913395 and parameters: {'model_type': 'mlp', 'hidden_dims': '[512, 128]', 'dropout': 0.1675557290343587, 'batch_norm': False, 'lr': 1.1315168682084564e-05, 'weight_decay': 0.0004909280306679253, 'epochs': 234, 'loss': 'mse', 'optimizer': 'adam', 'graph_mode': 'off', 'use_snp_selection': True, 'num_snps': 18347}. Best is trial 45 with value: 0.22042093462114573.
[I 2025-12-05 22:46:58,148] Trial 102 finished with value: 0.20593445280638445 and parameters: {'model_type': 'mlp', 'hidden_dims': '[256, 128, 64]', 'dropout': 0.15185219035812, 'batch_norm': False, 'lr': 6.367967293606077e-06, 'weight_decay': 3.169243682051631e-05, 'epochs': 234, 'loss': 'mse', 'optimizer': 'adam', 'graph_mode': 'off', 'use_snp_selection': True, 'num_snps': 18938}. Best is trial 45 with value: 0.22042093462114573.
[I 2025-12-05 22:47:35,703] Trial 103 finished with value: 0.19235369307669403 and parameters: {'model_type': 'mlp', 'hidden_dims': '[128, 64]', 'dropout': 0.1669238290864974, 'batch_norm': False, 'lr': 5.700480470903809e-06, 'weight_decay': 0.00021261959649469656, 'epochs': 222, 'loss': 'mse', 'optimizer': 'adam', 'graph_mode': 'off', 'use_snp_selection': True, 'num_snps': 14057}. Best is trial 45 with value: 0.22042093462114573.
[I 2025-12-05 22:48:16,126] Trial 104 finished with value: 0.19925138490159505 and parameters: {'model_type': 'mlp', 'hidden_dims': '[512, 128]', 'dropout': 0.14256885327686122, 'batch_norm': False, 'lr': 1.6682312481879403e-05, 'weight_decay': 4.535347285505596e-05, 'epochs': 173, 'loss': 'mse', 'optimizer': 'adam', 'graph_mode': 'off', 'use_snp_selection': True, 'num_snps': 10813}. Best is trial 45 with value: 0.22042093462114573.
[I 2025-12-05 22:49:06,481] Trial 105 finished with value: 0.20769906678571073 and parameters: {'model_type': 'mlp', 'hidden_dims': '[256, 128, 64]', 'dropout': 0.12848970624112235, 'batch_norm': False, 'lr': 7.817010266479185e-06, 'weight_decay': 0.00011270473242792576, 'epochs': 239, 'loss': 'mse', 'optimizer': 'adam', 'graph_mode': 'off', 'use_snp_selection': True, 'num_snps': 24721}. Best is trial 45 with value: 0.22042093462114573.
[I 2025-12-05 22:50:01,035] Trial 106 finished with value: 0.2175353544392178 and parameters: {'model_type': 'mlp', 'hidden_dims': '[512, 256]', 'dropout': 0.17530976698866052, 'batch_norm': False, 'lr': 1.0374714885239863e-05, 'weight_decay': 0.0003041254998632518, 'epochs': 255, 'loss': 'mse', 'optimizer': 'adam', 'graph_mode': 'off', 'use_snp_selection': True, 'num_snps': 17894}. Best is trial 45 with value: 0.22042093462114573.
[I 2025-12-05 22:50:54,783] Trial 107 finished with value: 0.21698335357873075 and parameters: {'model_type': 'mlp', 'hidden_dims': '[512, 128]', 'dropout': 0.3087294385983977, 'batch_norm': False, 'lr': 1.2834624007642097e-05, 'weight_decay': 0.00045546112459261996, 'epochs': 254, 'loss': 'mse', 'optimizer': 'adam', 'graph_mode': 'off', 'use_snp_selection': True, 'num_snps': 18072}. Best is trial 45 with value: 0.22042093462114573.
[I 2025-12-05 22:51:53,130] Trial 108 finished with value: 0.2099200595817853 and parameters: {'model_type': 'mlp', 'hidden_dims': '[512, 128]', 'dropout': 0.32050846964913726, 'batch_norm': False, 'lr': 1.898413373236042e-05, 'weight_decay': 0.0003019985011550688, 'epochs': 255, 'loss': 'mse', 'optimizer': 'adam', 'graph_mode': 'off', 'use_snp_selection': True, 'num_snps': 20866}. Best is trial 45 with value: 0.22042093462114573.
[I 2025-12-05 22:52:53,709] Trial 109 finished with value: 0.2098340882540764 and parameters: {'model_type': 'mlp', 'hidden_dims': '[512, 128]', 'dropout': 0.305452211884195, 'batch_norm': False, 'lr': 2.4161612250533723e-05, 'weight_decay': 0.0004789056921951222, 'epochs': 246, 'loss': 'mse', 'optimizer': 'adam', 'graph_mode': 'off', 'use_snp_selection': True, 'num_snps': 23187}. Best is trial 45 with value: 0.22042093462114573.
