[I 2025-12-05 15:53:51,016] Trial 88 finished with value: 0.006391896669429294 and parameters: {'model_type': 'mlp', 'hidden_dims': '[512, 128]', 'dropout': 0.43859725518322573, 'batch_norm': False, 'lr': 0.00015065928841917858, 'weight_decay': 0.00022019162887232063, 'epochs': 238, 'loss': 'mse', 'optimizer': 'adam', 'graph_mode': 'off', 'use_snp_selection': False}. Best is trial 82 with value: 0.03743082586854673.
[I 2025-12-05 15:53:52,811] Trial 89 finished with value: 0.02103863579729823 and parameters: {'model_type': 'mlp', 'hidden_dims': '[512, 128]', 'dropout': 0.5331783181908573, 'batch_norm': False, 'lr': 0.0001029440932458722, 'weight_decay': 0.00011957960074711892, 'epochs': 321, 'loss': 'mse', 'optimizer': 'adam', 'graph_mode': 'off', 'use_snp_selection': False}. Best is trial 82 with value: 0.03743082586854673.
[I 2025-12-05 15:53:54,408] Trial 90 finished with value: 0.016998340735777728 and parameters: {'model_type': 'mlp', 'hidden_dims': '[512, 64]', 'dropout': 0.4614261020555263, 'batch_norm': False, 'lr': 0.0005409457119468429, 'weight_decay': 5.6544102169260275e-05, 'epochs': 273, 'loss': 'mse', 'optimizer': 'adam', 'graph_mode': 'off', 'use_snp_selection': False}. Best is trial 82 with value: 0.03743082586854673.
[I 2025-12-05 15:53:55,583] Trial 91 finished with value: 0.010142748465092657 and parameters: {'model_type': 'mlp', 'hidden_dims': '[256, 128, 64]', 'dropout': 0.48225266298617475, 'batch_norm': False, 'lr': 0.00038098192301967156, 'weight_decay': 0.00030371875400318895, 'epochs': 293, 'loss': 'mse', 'optimizer': 'adam', 'graph_mode': 'off', 'use_snp_selection': False}. Best is trial 82 with value: 0.03743082586854673.
[I 2025-12-05 15:53:57,254] Trial 92 finished with value: -0.002764331654775373 and parameters: {'model_type': 'mlp', 'hidden_dims': '[512, 128]', 'dropout': 0.4926455206745674, 'batch_norm': False, 'lr': 0.0002415565288793068, 'weight_decay': 2.7647932175642914e-05, 'epochs': 285, 'loss': 'mse', 'optimizer': 'adam', 'graph_mode': 'off', 'use_snp_selection': False}. Best is trial 82 with value: 0.03743082586854673.
[I 2025-12-05 15:53:58,860] Trial 93 finished with value: 0.028501042384519195 and parameters: {'model_type': 'mlp', 'hidden_dims': '[512, 256]', 'dropout': 0.5151543608346677, 'batch_norm': False, 'lr': 0.00017068422477138965, 'weight_decay': 4.5063258292506014e-05, 'epochs': 266, 'loss': 'mse', 'optimizer': 'adam', 'graph_mode': 'off', 'use_snp_selection': False}. Best is trial 82 with value: 0.03743082586854673.
[I 2025-12-05 15:54:00,431] Trial 94 finished with value: 0.01828500014903568 and parameters: {'model_type': 'mlp', 'hidden_dims': '[512, 256]', 'dropout': 0.5151031529624736, 'batch_norm': False, 'lr': 0.0001836363844314813, 'weight_decay': 5.783587773514588e-05, 'epochs': 264, 'loss': 'mse', 'optimizer': 'adam', 'graph_mode': 'off', 'use_snp_selection': False}. Best is trial 82 with value: 0.03743082586854673.
[I 2025-12-05 15:54:02,182] Trial 95 finished with value: 0.021993174903289565 and parameters: {'model_type': 'mlp', 'hidden_dims': '[512, 128]', 'dropout': 0.44702564450145665, 'batch_norm': False, 'lr': 5.1876187679828854e-05, 'weight_decay': 8.960610102621281e-05, 'epochs': 248, 'loss': 'mse', 'optimizer': 'adam', 'graph_mode': 'off', 'use_snp_selection': True, 'num_snps': 30198}. Best is trial 82 with value: 0.03743082586854673.
[I 2025-12-05 15:54:03,807] Trial 96 finished with value: 0.019475021056365397 and parameters: {'model_type': 'mlp', 'hidden_dims': '[512, 256]', 'dropout': 0.5353774860947919, 'batch_norm': False, 'lr': 1.7547493319397367e-06, 'weight_decay': 0.00015847505982591914, 'epochs': 268, 'loss': 'mse', 'optimizer': 'adam', 'graph_mode': 'off', 'use_snp_selection': False}. Best is trial 82 with value: 0.03743082586854673.
[I 2025-12-05 15:54:04,667] Trial 97 finished with value: -0.0020739405031795204 and parameters: {'model_type': 'mlp', 'hidden_dims': '[128, 64]', 'dropout': 0.4047370513275206, 'batch_norm': False, 'lr': 0.00014869210323319225, 'weight_decay': 4.3834957959896935e-05, 'epochs': 237, 'loss': 'mse', 'optimizer': 'adam', 'graph_mode': 'off', 'use_snp_selection': False}. Best is trial 82 with value: 0.03743082586854673.
[I 2025-12-05 15:54:06,422] Trial 98 finished with value: 0.014082825363455101 and parameters: {'model_type': 'mlp', 'hidden_dims': '[512, 256]', 'dropout': 0.49813419777474044, 'batch_norm': False, 'lr': 0.0001659327537390029, 'weight_decay': 1.0300423721450313e-05, 'epochs': 315, 'loss': 'mse', 'optimizer': 'adam', 'graph_mode': 'off', 'use_snp_selection': False}. Best is trial 82 with value: 0.03743082586854673.
[I 2025-12-05 15:54:08,044] Trial 99 finished with value: -0.017876896096916433 and parameters: {'model_type': 'mlp', 'hidden_dims': '[512, 256]', 'dropout': 0.4658052387727099, 'batch_norm': False, 'lr': 7.737283265762893e-05, 'weight_decay': 0.00012092873570804903, 'epochs': 280, 'loss': 'mse', 'optimizer': 'adam', 'graph_mode': 'off', 'use_snp_selection': False}. Best is trial 82 with value: 0.03743082586854673.
[I 2025-12-05 15:54:09,134] Trial 100 finished with value: 0.010012074917354792 and parameters: {'model_type': 'mlp', 'hidden_dims': '[512, 128]', 'dropout': 0.5107520142993044, 'batch_norm': False, 'lr': 6.064373484708118e-06, 'weight_decay': 1.6037697342751603e-05, 'epochs': 259, 'loss': 'mse', 'optimizer': 'adam', 'graph_mode': 'off', 'use_snp_selection': True, 'num_snps': 10544}. Best is trial 82 with value: 0.03743082586854673.
[I 2025-12-05 15:54:10,873] Trial 101 finished with value: 0.019238564923419636 and parameters: {'model_type': 'mlp', 'hidden_dims': '[512, 256]', 'dropout': 0.47747201721331606, 'batch_norm': False, 'lr': 0.00032139505144132167, 'weight_decay': 4.756511674767333e-05, 'epochs': 302, 'loss': 'mse', 'optimizer': 'adam', 'graph_mode': 'off', 'use_snp_selection': False}. Best is trial 82 with value: 0.03743082586854673.
[I 2025-12-05 15:54:12,579] Trial 102 finished with value: 0.024268353413996475 and parameters: {'model_type': 'mlp', 'hidden_dims': '[512, 256]', 'dropout': 0.5556149265130941, 'batch_norm': False, 'lr': 0.0002193199777647276, 'weight_decay': 6.573406703061767e-05, 'epochs': 297, 'loss': 'mse', 'optimizer': 'adam', 'graph_mode': 'off', 'use_snp_selection': False}. Best is trial 82 with value: 0.03743082586854673.
[I 2025-12-05 15:54:14,287] Trial 103 finished with value: 0.015716578373622687 and parameters: {'model_type': 'mlp', 'hidden_dims': '[512, 256]', 'dropout': 0.560796082820828, 'batch_norm': False, 'lr': 0.00020928923537479518, 'weight_decay': 6.877616185945828e-06, 'epochs': 310, 'loss': 'mse', 'optimizer': 'adam', 'graph_mode': 'off', 'use_snp_selection': False}. Best is trial 82 with value: 0.03743082586854673.
[I 2025-12-05 15:54:15,976] Trial 104 finished with value: 0.0114305360693734 and parameters: {'model_type': 'mlp', 'hidden_dims': '[512, 256]', 'dropout': 0.5708067512355282, 'batch_norm': False, 'lr': 0.00025123894646989, 'weight_decay': 6.537843583901926e-05, 'epochs': 286, 'loss': 'mse', 'optimizer': 'adam', 'graph_mode': 'off', 'use_snp_selection': False}. Best is trial 82 with value: 0.03743082586854673.
[I 2025-12-05 15:54:16,938] Trial 105 finished with value: -0.027495837614665508 and parameters: {'model_type': 'mlp', 'hidden_dims': '[512, 256]', 'dropout': 0.5375126263282485, 'batch_norm': False, 'lr': 0.00013321612093149504, 'weight_decay': 8.589833171191313e-05, 'epochs': 58, 'loss': 'mse', 'optimizer': 'adam', 'graph_mode': 'off', 'use_snp_selection': False}. Best is trial 82 with value: 0.03743082586854673.
[I 2025-12-05 15:54:18,107] Trial 106 finished with value: 0.014105035465333364 and parameters: {'model_type': 'mlp', 'hidden_dims': '[256, 128, 64]', 'dropout': 0.5261913058747589, 'batch_norm': False, 'lr': 0.0002852237205783983, 'weight_decay': 0.00010426513314454155, 'epochs': 295, 'loss': 'mae', 'optimizer': 'adam', 'graph_mode': 'off', 'use_snp_selection': False}. Best is trial 82 with value: 0.03743082586854673.
[I 2025-12-05 15:54:19,863] Trial 107 finished with value: 0.008450497599494651 and parameters: {'model_type': 'mlp', 'hidden_dims': '[512, 256]', 'dropout': 0.5984360992030545, 'batch_norm': False, 'lr': 0.00021413636519594626, 'weight_decay': 2.2326944809277167e-05, 'epochs': 325, 'loss': 'mse', 'optimizer': 'adam', 'graph_mode': 'off', 'use_snp_selection': False}. Best is trial 82 with value: 0.03743082586854673.
[I 2025-12-05 15:54:21,517] Trial 108 finished with value: 0.02330926901488216 and parameters: {'model_type': 'mlp', 'hidden_dims': '[512, 64]', 'dropout': 0.5479270454686903, 'batch_norm': False, 'lr': 0.00036374058375679316, 'weight_decay': 0.00020218189535730352, 'epochs': 274, 'loss': 'mse', 'optimizer': 'adam', 'graph_mode': 'off', 'use_snp_selection': False}. Best is trial 82 with value: 0.03743082586854673.
[I 2025-12-05 15:54:23,079] Trial 109 finished with value: -0.028518200113960834 and parameters: {'model_type': 'mlp', 'hidden_dims': '[512, 64]', 'dropout': 0.5458752739199668, 'batch_norm': False, 'lr': 0.00037462482423292556, 'weight_decay': 0.00016140930122564425, 'epochs': 252, 'loss': 'mse', 'optimizer': 'adam', 'graph_mode': 'off', 'use_snp_selection': False}. Best is trial 82 with value: 0.03743082586854673.
[I 2025-12-05 15:54:24,712] Trial 110 finished with value: -0.006657379413424407 and parameters: {'model_type': 'mlp', 'hidden_dims': '[512, 64]', 'dropout': 0.5578493682132469, 'batch_norm': True, 'lr': 0.00045298383035814467, 'weight_decay': 0.00019882895828737324, 'epochs': 273, 'loss': 'mse', 'optimizer': 'adam', 'graph_mode': 'off', 'use_snp_selection': False}. Best is trial 82 with value: 0.03743082586854673.
[I 2025-12-05 15:54:26,374] Trial 111 finished with value: 0.013833870785033762 and parameters: {'model_type': 'mlp', 'hidden_dims': '[512, 64]', 'dropout': 0.49937597426366576, 'batch_norm': False, 'lr': 0.0003009369799406076, 'weight_decay': 7.757484647200836e-05, 'epochs': 281, 'loss': 'mse', 'optimizer': 'adam', 'graph_mode': 'off', 'use_snp_selection': False}. Best is trial 82 with value: 0.03743082586854673.
[I 2025-12-05 15:54:27,984] Trial 112 finished with value: -0.031087658689897775 and parameters: {'model_type': 'mlp', 'hidden_dims': '[512, 64]', 'dropout': 0.5170652480244428, 'batch_norm': False, 'lr': 0.0005171733722130106, 'weight_decay': 0.0001303468265400744, 'epochs': 264, 'loss': 'mse', 'optimizer': 'adam', 'graph_mode': 'off', 'use_snp_selection': False}. Best is trial 82 with value: 0.03743082586854673.
[I 2025-12-05 15:54:29,667] Trial 113 finished with value: 0.01606119426227152 and parameters: {'model_type': 'mlp', 'hidden_dims': '[512, 256]', 'dropout': 0.5792557461950458, 'batch_norm': False, 'lr': 0.00026728428168361996, 'weight_decay': 3.413521779263422e-05, 'epochs': 290, 'loss': 'mse', 'optimizer': 'adam', 'graph_mode': 'off', 'use_snp_selection': False}. Best is trial 82 with value: 0.03743082586854673.
[I 2025-12-05 15:54:30,775] Trial 114 finished with value: 0.015395307401310497 and parameters: {'model_type': 'mlp', 'hidden_dims': '[256, 128]', 'dropout': 0.31731354180719834, 'batch_norm': False, 'lr': 0.0003513762758027723, 'weight_decay': 6.226112703936868e-05, 'epochs': 276, 'loss': 'mse', 'optimizer': 'adam', 'graph_mode': 'off', 'use_snp_selection': False}. Best is trial 82 with value: 0.03743082586854673.
[I 2025-12-05 15:54:33,757] Trial 115 finished with value: 0.015202618159625711 and parameters: {'model_type': 'mlp', 'hidden_dims': '[512, 256]', 'dropout': 0.5503313661549166, 'batch_norm': False, 'lr': 0.0001774996463082244, 'weight_decay': 0.00018218713860342314, 'epochs': 342, 'loss': 'mse', 'optimizer': 'adam', 'graph_mode': 'off', 'use_snp_selection': True, 'num_snps': 51689}. Best is trial 82 with value: 0.03743082586854673.
[I 2025-12-05 15:54:35,521] Trial 116 finished with value: -0.017379859417875326 and parameters: {'model_type': 'mlp', 'hidden_dims': '[512, 256]', 'dropout': 0.4893628391778798, 'batch_norm': False, 'lr': 0.00010571585955570159, 'weight_decay': 1.3427203605394331e-05, 'epochs': 303, 'loss': 'mse', 'optimizer': 'adam', 'graph_mode': 'off', 'use_snp_selection': False}. Best is trial 82 with value: 0.03743082586854673.
[I 2025-12-05 15:54:37,063] Trial 117 finished with value: 0.025711545887437126 and parameters: {'model_type': 'mlp', 'hidden_dims': '[512, 128]', 'dropout': 0.5256796657773048, 'batch_norm': False, 'lr': 0.00023577241655348689, 'weight_decay': 4.8670908179108265e-05, 'epochs': 248, 'loss': 'mse', 'optimizer': 'adam', 'graph_mode': 'off', 'use_snp_selection': False}. Best is trial 82 with value: 0.03743082586854673.
[I 2025-12-05 15:54:38,505] Trial 118 finished with value: 0.032300027424080925 and parameters: {'model_type': 'mlp', 'hidden_dims': '[512, 128]', 'dropout': 0.5278891293658714, 'batch_norm': False, 'lr': 0.0001170182645017897, 'weight_decay': 4.867119970294294e-05, 'epochs': 225, 'loss': 'mse', 'optimizer': 'adam', 'graph_mode': 'off', 'use_snp_selection': False}. Best is trial 82 with value: 0.03743082586854673.
[I 2025-12-05 15:54:39,993] Trial 119 finished with value: 0.022268714849795708 and parameters: {'model_type': 'mlp', 'hidden_dims': '[512, 128]', 'dropout': 0.5252880218049275, 'batch_norm': False, 'lr': 0.0001171278411005276, 'weight_decay': 4.82353943228279e-05, 'epochs': 223, 'loss': 'mae', 'optimizer': 'adam', 'graph_mode': 'off', 'use_snp_selection': False}. Best is trial 82 with value: 0.03743082586854673.
[I 2025-12-05 15:54:41,451] Trial 120 finished with value: -0.01839005803563654 and parameters: {'model_type': 'mlp', 'hidden_dims': '[512, 128]', 'dropout': 0.5326266118807119, 'batch_norm': False, 'lr': 0.00013858831556896355, 'weight_decay': 3.0198694568522046e-05, 'epochs': 216, 'loss': 'mse', 'optimizer': 'adam', 'graph_mode': 'off', 'use_snp_selection': False}. Best is trial 82 with value: 0.03743082586854673.
[I 2025-12-05 15:54:42,991] Trial 121 finished with value: -0.02012299758378028 and parameters: {'model_type': 'mlp', 'hidden_dims': '[512, 128]', 'dropout': 0.5680210563450819, 'batch_norm': False, 'lr': 0.00022647080036575692, 'weight_decay': 0.00010712938802263899, 'epochs': 245, 'loss': 'mse', 'optimizer': 'adam', 'graph_mode': 'off', 'use_snp_selection': False}. Best is trial 82 with value: 0.03743082586854673.
[I 2025-12-05 15:54:44,511] Trial 122 finished with value: -0.00037662689577752884 and parameters: {'model_type': 'mlp', 'hidden_dims': '[512, 128]', 'dropout': 0.5116849889609435, 'batch_norm': False, 'lr': 0.00019731394135828918, 'weight_decay': 8.124237144690136e-05, 'epochs': 251, 'loss': 'mse', 'optimizer': 'adam', 'graph_mode': 'off', 'use_snp_selection': False}. Best is trial 82 with value: 0.03743082586854673.
[I 2025-12-05 15:54:46,110] Trial 123 finished with value: 0.02265493040350516 and parameters: {'model_type': 'mlp', 'hidden_dims': '[512, 128]', 'dropout': 0.5854142515350498, 'batch_norm': False, 'lr': 0.00017084953607900895, 'weight_decay': 0.0002548264767269668, 'epochs': 259, 'loss': 'mse', 'optimizer': 'adam', 'graph_mode': 'off', 'use_snp_selection': False}. Best is trial 82 with value: 0.03743082586854673.
[I 2025-12-05 15:54:47,645] Trial 124 finished with value: 0.008196239936661805 and parameters: {'model_type': 'mlp', 'hidden_dims': '[512, 128]', 'dropout': 0.5380608596245702, 'batch_norm': False, 'lr': 6.850975144075981e-05, 'weight_decay': 3.9557926913865345e-05, 'epochs': 241, 'loss': 'mse', 'optimizer': 'adam', 'graph_mode': 'off', 'use_snp_selection': False}. Best is trial 82 with value: 0.03743082586854673.
[I 2025-12-05 15:54:49,126] Trial 125 finished with value: -0.024057707538527765 and parameters: {'model_type': 'mlp', 'hidden_dims': '[512, 128]', 'dropout': 0.5044995698831782, 'batch_norm': False, 'lr': 0.0004229361310074873, 'weight_decay': 0.0001423071277968583, 'epochs': 227, 'loss': 'mse', 'optimizer': 'adam', 'graph_mode': 'off', 'use_snp_selection': False}. Best is trial 82 with value: 0.03743082586854673.
[I 2025-12-05 15:54:50,698] Trial 126 finished with value: 0.007971903081323062 and parameters: {'model_type': 'mlp', 'hidden_dims': '[512, 128]', 'dropout': 0.5537009462999878, 'batch_norm': False, 'lr': 9.258895236757219e-05, 'weight_decay': 4.9392820960178227e-05, 'epochs': 267, 'loss': 'mse', 'optimizer': 'adam', 'graph_mode': 'off', 'use_snp_selection': False}. Best is trial 82 with value: 0.03743082586854673.
[I 2025-12-05 15:54:52,333] Trial 127 finished with value: -0.016540887094653272 and parameters: {'model_type': 'mlp', 'hidden_dims': '[512, 64]', 'dropout': 0.4751245673615663, 'batch_norm': False, 'lr': 0.00023298694780217187, 'weight_decay': 6.480934072076044e-05, 'epochs': 272, 'loss': 'mse', 'optimizer': 'adam', 'graph_mode': 'off', 'use_snp_selection': False}. Best is trial 82 with value: 0.03743082586854673.
[I 2025-12-05 15:54:53,859] Trial 128 finished with value: -0.008168611638086964 and parameters: {'model_type': 'mlp', 'hidden_dims': '[512, 128]', 'dropout': 0.5205750288576935, 'batch_norm': False, 'lr': 0.00015468205784686804, 'weight_decay': 0.00011325989156086373, 'epochs': 235, 'loss': 'mse', 'optimizer': 'adam', 'graph_mode': 'off', 'use_snp_selection': False}. Best is trial 82 with value: 0.03743082586854673.
[I 2025-12-05 15:54:55,458] Trial 129 finished with value: -0.028871785710692162 and parameters: {'model_type': 'mlp', 'hidden_dims': '[512, 128]', 'dropout': 0.48841812924246636, 'batch_norm': True, 'lr': 2.5475455643028307e-06, 'weight_decay': 0.00032268922416636887, 'epochs': 259, 'loss': 'mse', 'optimizer': 'adam', 'graph_mode': 'off', 'use_snp_selection': False}. Best is trial 82 with value: 0.03743082586854673.
[I 2025-12-05 15:54:56,349] Trial 130 finished with value: -0.031401898400591 and parameters: {'model_type': 'mlp', 'hidden_dims': '[128, 64]', 'dropout': 0.5418864357618068, 'batch_norm': False, 'lr': 0.00025438686174466895, 'weight_decay': 2.55050524938638e-05, 'epochs': 279, 'loss': 'mse', 'optimizer': 'adam', 'graph_mode': 'off', 'use_snp_selection': False}. Best is trial 82 with value: 0.03743082586854673.
[I 2025-12-05 15:54:58,554] Trial 131 finished with value: 0.03299155630862202 and parameters: {'model_type': 'mlp', 'hidden_dims': '[512, 256]', 'dropout': 0.4569710483410072, 'batch_norm': False, 'lr': 0.00033992246296522924, 'weight_decay': 1.7299693760887905e-05, 'epochs': 298, 'loss': 'mse', 'optimizer': 'adam', 'graph_mode': 'off', 'use_snp_selection': True, 'num_snps': 38802}. Best is trial 82 with value: 0.03743082586854673.
[I 2025-12-05 15:55:00,274] Trial 132 finished with value: 0.017826049305404698 and parameters: {'model_type': 'mlp', 'hidden_dims': '[512, 256]', 'dropout': 0.44306270790384755, 'batch_norm': False, 'lr': 0.00034359022659246946, 'weight_decay': 1.880891323221412e-05, 'epochs': 299, 'loss': 'mse', 'optimizer': 'adam', 'graph_mode': 'off', 'use_snp_selection': False}. Best is trial 82 with value: 0.03743082586854673.
[I 2025-12-05 15:55:01,948] Trial 133 finished with value: 0.05280820846972677 and parameters: {'model_type': 'mlp', 'hidden_dims': '[512, 256]', 'dropout': 0.4626646221983872, 'batch_norm': False, 'lr': 0.0005855864101094283, 'weight_decay': 7.523239452479565e-05, 'epochs': 287, 'loss': 'mse', 'optimizer': 'adam', 'graph_mode': 'off', 'use_snp_selection': False}. Best is trial 133 with value: 0.05280820846972677.
[I 2025-12-05 15:55:03,632] Trial 134 finished with value: 0.02241019554604926 and parameters: {'model_type': 'mlp', 'hidden_dims': '[512, 256]', 'dropout': 0.41918931287012706, 'batch_norm': False, 'lr': 0.0007021181932163501, 'weight_decay': 7.811286635764219e-05, 'epochs': 293, 'loss': 'mse', 'optimizer': 'adam', 'graph_mode': 'off', 'use_snp_selection': False}. Best is trial 133 with value: 0.05280820846972677.
[I 2025-12-05 15:55:05,850] Trial 135 finished with value: 0.011692147607778368 and parameters: {'model_type': 'mlp', 'hidden_dims': '[512, 256]', 'dropout': 0.454641649189508, 'batch_norm': False, 'lr': 0.00047275833924377466, 'weight_decay': 3.5114159820424774e-05, 'epochs': 286, 'loss': 'mse', 'optimizer': 'adam', 'graph_mode': 'off', 'use_snp_selection': True, 'num_snps': 38577}. Best is trial 133 with value: 0.05280820846972677.
[I 2025-12-05 15:55:07,598] Trial 136 finished with value: 0.01163089038746206 and parameters: {'model_type': 'mlp', 'hidden_dims': '[512, 256]', 'dropout': 0.4668529763037303, 'batch_norm': False, 'lr': 0.00011708801280624133, 'weight_decay': 9.907294678675229e-05, 'epochs': 311, 'loss': 'mse', 'optimizer': 'adam', 'graph_mode': 'off', 'use_snp_selection': False}. Best is trial 133 with value: 0.05280820846972677.
[I 2025-12-05 15:55:09,272] Trial 137 finished with value: 0.006638207954155425 and parameters: {'model_type': 'mlp', 'hidden_dims': '[512, 256]', 'dropout': 0.4573594580789289, 'batch_norm': False, 'lr': 0.00019140174325609077, 'weight_decay': 5.213137439831642e-05, 'epochs': 297, 'loss': 'mse', 'optimizer': 'adam', 'graph_mode': 'off', 'use_snp_selection': False}. Best is trial 133 with value: 0.05280820846972677.
[I 2025-12-05 15:55:11,032] Trial 138 finished with value: -0.005108097119589955 and parameters: {'model_type': 'mlp', 'hidden_dims': '[512, 256]', 'dropout': 0.5016800783843688, 'batch_norm': False, 'lr': 0.0006014618122452733, 'weight_decay': 6.737539656332477e-05, 'epochs': 307, 'loss': 'mse', 'optimizer': 'adam', 'graph_mode': 'off', 'use_snp_selection': False}. Best is trial 133 with value: 0.05280820846972677.
[I 2025-12-05 15:55:12,726] Trial 139 finished with value: 0.013186972642207757 and parameters: {'model_type': 'mlp', 'hidden_dims': '[512, 256]', 'dropout': 0.4874383456398209, 'batch_norm': False, 'lr': 0.0009712953759106114, 'weight_decay': 8.042213830470495e-06, 'epochs': 288, 'loss': 'mse', 'optimizer': 'adam', 'graph_mode': 'off', 'use_snp_selection': False}. Best is trial 133 with value: 0.05280820846972677.
