[I 2025-12-06 08:59:36,482] Trial 145 finished with value: 0.3160030875955768 and parameters: {'model_type': 'mlp', 'hidden_dims': '[512, 256]', 'dropout': 0.5857188783209077, 'batch_norm': False, 'lr': 1.31977363402135e-05, 'weight_decay': 1.1963699369772754e-07, 'epochs': 321, 'loss': 'mae', 'optimizer': 'adam', 'graph_mode': 'off', 'use_snp_selection': False}. Best is trial 71 with value: 0.3204759444484463.
[I 2025-12-06 09:00:37,827] Trial 146 finished with value: 0.3124839751997713 and parameters: {'model_type': 'mlp', 'hidden_dims': '[512, 64]', 'dropout': 0.5763886675131431, 'batch_norm': False, 'lr': 1.561913499770862e-05, 'weight_decay': 2.209833173258685e-07, 'epochs': 325, 'loss': 'mae', 'optimizer': 'adam', 'graph_mode': 'off', 'use_snp_selection': False}. Best is trial 71 with value: 0.3204759444484463.
[I 2025-12-06 09:01:42,561] Trial 147 finished with value: 0.31704166732839123 and parameters: {'model_type': 'mlp', 'hidden_dims': '[512, 256]', 'dropout': 0.4879404832743618, 'batch_norm': False, 'lr': 9.902087875467637e-06, 'weight_decay': 1.205418137905948e-07, 'epochs': 341, 'loss': 'mae', 'optimizer': 'adam', 'graph_mode': 'off', 'use_snp_selection': False}. Best is trial 71 with value: 0.3204759444484463.
[I 2025-12-06 09:02:18,530] Trial 148 finished with value: 0.308965112415716 and parameters: {'model_type': 'mlp', 'hidden_dims': '[256, 128]', 'dropout': 0.5609845827063243, 'batch_norm': False, 'lr': 7.090880686697199e-05, 'weight_decay': 1.0226472080030892e-07, 'epochs': 348, 'loss': 'mae', 'optimizer': 'adam', 'graph_mode': 'off', 'use_snp_selection': False}. Best is trial 71 with value: 0.3204759444484463.
[I 2025-12-06 09:03:21,038] Trial 149 finished with value: 0.31311495714549686 and parameters: {'model_type': 'mlp', 'hidden_dims': '[512, 128]', 'dropout': 0.3327923285593665, 'batch_norm': False, 'lr': 8.424800880258864e-06, 'weight_decay': 1.3136695767265834e-07, 'epochs': 329, 'loss': 'mae', 'optimizer': 'adam', 'graph_mode': 'off', 'use_snp_selection': False}. Best is trial 71 with value: 0.3204759444484463.
