[I 2025-12-05 14:30:09,236] Trial 58 finished with value: 0.03341297849684558 and parameters: {'model_type': 'mlp', 'hidden_dims': '[256, 128, 64]', 'dropout': 0.30971382256995406, 'batch_norm': True, 'lr': 0.00038506011274270114, 'weight_decay': 1.359530293591024e-06, 'epochs': 123, 'loss': 'mse', 'optimizer': 'adam', 'graph_mode': 'off', 'use_snp_selection': True, 'num_snps': 25449}. Best is trial 5 with value: 0.06552593845841431.
[I 2025-12-05 14:30:11,502] Trial 59 finished with value: 0.04297815642368149 and parameters: {'model_type': 'mlp', 'hidden_dims': '[512, 64]', 'dropout': 0.12461894349149533, 'batch_norm': True, 'lr': 0.0008959572470119034, 'weight_decay': 3.308605163096538e-05, 'epochs': 103, 'loss': 'mae', 'optimizer': 'adam', 'graph_mode': 'off', 'use_snp_selection': True, 'num_snps': 45777}. Best is trial 5 with value: 0.06552593845841431.
[I 2025-12-05 14:30:12,606] Trial 60 finished with value: -0.004082379151101107 and parameters: {'model_type': 'mlp', 'hidden_dims': '[512, 64]', 'dropout': 0.43484155848572514, 'batch_norm': False, 'lr': 2.1192319653859016e-06, 'weight_decay': 2.0533495645085324e-06, 'epochs': 84, 'loss': 'mae', 'optimizer': 'adam', 'graph_mode': 'off', 'use_snp_selection': False}. Best is trial 5 with value: 0.06552593845841431.
[I 2025-12-05 14:30:14,201] Trial 61 finished with value: 0.04370818858281952 and parameters: {'model_type': 'mlp', 'hidden_dims': '[512, 64]', 'dropout': 0.18256055142022576, 'batch_norm': True, 'lr': 0.0004435090997782788, 'weight_decay': 1.4529023316796413e-05, 'epochs': 214, 'loss': 'mse', 'optimizer': 'adam', 'graph_mode': 'off', 'use_snp_selection': False}. Best is trial 5 with value: 0.06552593845841431.
[I 2025-12-05 14:30:15,886] Trial 62 finished with value: 0.04308374862579172 and parameters: {'model_type': 'mlp', 'hidden_dims': '[512, 64]', 'dropout': 0.19390359800002144, 'batch_norm': True, 'lr': 0.0007048450315433005, 'weight_decay': 2.491992336533114e-05, 'epochs': 235, 'loss': 'mse', 'optimizer': 'adam', 'graph_mode': 'off', 'use_snp_selection': False}. Best is trial 5 with value: 0.06552593845841431.
[I 2025-12-05 14:30:17,272] Trial 63 finished with value: 0.04163288142372041 and parameters: {'model_type': 'mlp', 'hidden_dims': '[512, 64]', 'dropout': 0.22290960580895508, 'batch_norm': True, 'lr': 0.0002857230377021396, 'weight_decay': 0.00017164060291189847, 'epochs': 164, 'loss': 'mse', 'optimizer': 'adam', 'graph_mode': 'off', 'use_snp_selection': False}. Best is trial 5 with value: 0.06552593845841431.
[I 2025-12-05 14:30:18,839] Trial 64 finished with value: 0.00013136154684592797 and parameters: {'model_type': 'mlp', 'hidden_dims': '[512, 64]', 'dropout': 0.16668861258764578, 'batch_norm': True, 'lr': 1.527355936476971e-06, 'weight_decay': 3.0983041183039437e-06, 'epochs': 201, 'loss': 'mse', 'optimizer': 'adam', 'graph_mode': 'off', 'use_snp_selection': False}. Best is trial 5 with value: 0.06552593845841431.
[I 2025-12-05 14:30:20,209] Trial 65 finished with value: 0.03258334658137986 and parameters: {'model_type': 'mlp', 'hidden_dims': '[256, 128]', 'dropout': 0.24524139161572625, 'batch_norm': True, 'lr': 4.5312018343246936e-06, 'weight_decay': 1.2792691710766028e-05, 'epochs': 141, 'loss': 'mse', 'optimizer': 'adam', 'graph_mode': 'off', 'use_snp_selection': True, 'num_snps': 21343}. Best is trial 5 with value: 0.06552593845841431.
[I 2025-12-05 14:30:21,561] Trial 66 finished with value: 0.049477954403256336 and parameters: {'model_type': 'mlp', 'hidden_dims': '[512, 64]', 'dropout': 0.12638419356900654, 'batch_norm': True, 'lr': 0.00022076378853211616, 'weight_decay': 1.994550897254896e-05, 'epochs': 156, 'loss': 'mae', 'optimizer': 'adam', 'graph_mode': 'off', 'use_snp_selection': False}. Best is trial 5 with value: 0.06552593845841431.
[I 2025-12-05 14:30:24,271] Trial 67 finished with value: 0.05259785047652337 and parameters: {'model_type': 'mlp', 'hidden_dims': '[512, 64]', 'dropout': 0.2001019480185932, 'batch_norm': True, 'lr': 0.0005039670215737231, 'weight_decay': 7.198678358219392e-05, 'epochs': 173, 'loss': 'mse', 'optimizer': 'adam', 'graph_mode': 'off', 'use_snp_selection': True, 'num_snps': 50510}. Best is trial 5 with value: 0.06552593845841431.
[I 2025-12-05 14:30:26,270] Trial 68 finished with value: 0.0034657945515397482 and parameters: {'model_type': 'mlp', 'hidden_dims': '[128, 64]', 'dropout': 0.4710625894809028, 'batch_norm': False, 'lr': 7.1159702593665475e-06, 'weight_decay': 8.460095315141715e-06, 'epochs': 258, 'loss': 'mae', 'optimizer': 'adam', 'graph_mode': 'off', 'use_snp_selection': True, 'num_snps': 39794}. Best is trial 5 with value: 0.06552593845841431.
[I 2025-12-05 14:30:27,775] Trial 69 finished with value: 0.03691339303753721 and parameters: {'model_type': 'mlp', 'hidden_dims': '[512, 128]', 'dropout': 0.5103030200533091, 'batch_norm': True, 'lr': 2.9070629683202598e-06, 'weight_decay': 0.0007185077792777324, 'epochs': 190, 'loss': 'mae', 'optimizer': 'adam', 'graph_mode': 'off', 'use_snp_selection': False}. Best is trial 5 with value: 0.06552593845841431.
[I 2025-12-05 14:30:29,950] Trial 70 finished with value: 0.059072881018014854 and parameters: {'model_type': 'mlp', 'hidden_dims': '[512, 256]', 'dropout': 0.14575063599405727, 'batch_norm': True, 'lr': 0.00016564361890938868, 'weight_decay': 0.0003255886513965279, 'epochs': 226, 'loss': 'mae', 'optimizer': 'adam', 'graph_mode': 'off', 'use_snp_selection': True, 'num_snps': 35517}. Best is trial 5 with value: 0.06552593845841431.
[I 2025-12-05 14:30:32,131] Trial 71 finished with value: 0.0473286468498275 and parameters: {'model_type': 'mlp', 'hidden_dims': '[512, 256]', 'dropout': 0.1490412434972467, 'batch_norm': True, 'lr': 0.00011509563434789735, 'weight_decay': 0.0003747329997891261, 'epochs': 225, 'loss': 'mae', 'optimizer': 'adam', 'graph_mode': 'off', 'use_snp_selection': True, 'num_snps': 35735}. Best is trial 5 with value: 0.06552593845841431.
[I 2025-12-05 14:30:33,991] Trial 72 finished with value: 0.04806411562080282 and parameters: {'model_type': 'mlp', 'hidden_dims': '[512, 256]', 'dropout': 0.16858468434079973, 'batch_norm': True, 'lr': 0.00017262191193208155, 'weight_decay': 0.00029248564085912113, 'epochs': 220, 'loss': 'mae', 'optimizer': 'adam', 'graph_mode': 'off', 'use_snp_selection': True, 'num_snps': 28569}. Best is trial 5 with value: 0.06552593845841431.
[I 2025-12-05 14:30:36,037] Trial 73 finished with value: 0.0507501383569818 and parameters: {'model_type': 'mlp', 'hidden_dims': '[512, 256]', 'dropout': 0.1128298332547326, 'batch_norm': True, 'lr': 0.0003563853991720475, 'weight_decay': 0.0008829935908211952, 'epochs': 242, 'loss': 'mae', 'optimizer': 'adam', 'graph_mode': 'off', 'use_snp_selection': True, 'num_snps': 31584}. Best is trial 5 with value: 0.06552593845841431.
[I 2025-12-05 14:30:38,155] Trial 74 finished with value: 0.051239943349817275 and parameters: {'model_type': 'mlp', 'hidden_dims': '[512, 256]', 'dropout': 0.14302632336762977, 'batch_norm': True, 'lr': 0.0001293702475330751, 'weight_decay': 0.00046281970305225595, 'epochs': 211, 'loss': 'mae', 'optimizer': 'adam', 'graph_mode': 'off', 'use_snp_selection': True, 'num_snps': 34825}. Best is trial 5 with value: 0.06552593845841431.
[I 2025-12-05 14:30:40,381] Trial 75 finished with value: 0.05762476768962234 and parameters: {'model_type': 'mlp', 'hidden_dims': '[256, 128, 64]', 'dropout': 0.20736789271265788, 'batch_norm': True, 'lr': 7.763640564378542e-05, 'weight_decay': 5.529388609776292e-06, 'epochs': 291, 'loss': 'mae', 'optimizer': 'adam', 'graph_mode': 'off', 'use_snp_selection': True, 'num_snps': 38789}. Best is trial 5 with value: 0.06552593845841431.
[I 2025-12-05 14:30:41,916] Trial 76 finished with value: 0.057359626152986655 and parameters: {'model_type': 'mlp', 'hidden_dims': '[512, 64]', 'dropout': 0.22188591863985296, 'batch_norm': True, 'lr': 3.4686506977747306e-05, 'weight_decay': 0.00010028764517459422, 'epochs': 122, 'loss': 'mae', 'optimizer': 'adam', 'graph_mode': 'off', 'use_snp_selection': True, 'num_snps': 25441}. Best is trial 5 with value: 0.06552593845841431.
[I 2025-12-05 14:30:44,360] Trial 77 finished with value: 0.0313039284645735 and parameters: {'model_type': 'mlp', 'hidden_dims': '[512, 64]', 'dropout': 0.2594183312094518, 'batch_norm': True, 'lr': 0.00016877993645479273, 'weight_decay': 4.829603125852806e-05, 'epochs': 180, 'loss': 'mae', 'optimizer': 'adam', 'graph_mode': 'off', 'use_snp_selection': True, 'num_snps': 43996}. Best is trial 5 with value: 0.06552593845841431.
[I 2025-12-05 14:30:45,890] Trial 78 finished with value: 0.012739876019533422 and parameters: {'model_type': 'mlp', 'hidden_dims': '[512, 64]', 'dropout': 0.10220247829738091, 'batch_norm': False, 'lr': 0.00023329416976864933, 'weight_decay': 0.00020114858191303323, 'epochs': 200, 'loss': 'mse', 'optimizer': 'adam', 'graph_mode': 'off', 'use_snp_selection': False}. Best is trial 5 with value: 0.06552593845841431.
[I 2025-12-05 14:30:47,667] Trial 79 finished with value: -0.0020032215580858916 and parameters: {'model_type': 'mlp', 'hidden_dims': '[512, 256]', 'dropout': 0.40053898487365214, 'batch_norm': True, 'lr': 1.7691429104356462e-05, 'weight_decay': 0.0006270542956722233, 'epochs': 136, 'loss': 'mae', 'optimizer': 'adam', 'graph_mode': 'off', 'use_snp_selection': True, 'num_snps': 30607}. Best is trial 5 with value: 0.06552593845841431.
[I 2025-12-05 14:30:48,598] Trial 80 finished with value: 0.03661737871397776 and parameters: {'model_type': 'mlp', 'hidden_dims': '[256, 128]', 'dropout': 0.2815876603040711, 'batch_norm': True, 'lr': 0.0002918921147958497, 'weight_decay': 5.30043792208394e-07, 'epochs': 149, 'loss': 'mae', 'optimizer': 'adam', 'graph_mode': 'off', 'use_snp_selection': False}. Best is trial 5 with value: 0.06552593845841431.
[I 2025-12-05 14:30:50,825] Trial 81 finished with value: 0.04939345170856365 and parameters: {'model_type': 'mlp', 'hidden_dims': '[256, 128, 64]', 'dropout': 0.17914899701159867, 'batch_norm': True, 'lr': 6.833430551556177e-05, 'weight_decay': 5.077982473824122e-06, 'epochs': 313, 'loss': 'mae', 'optimizer': 'adam', 'graph_mode': 'off', 'use_snp_selection': True, 'num_snps': 38114}. Best is trial 5 with value: 0.06552593845841431.
[I 2025-12-05 14:30:53,436] Trial 82 finished with value: 0.04743483269561685 and parameters: {'model_type': 'mlp', 'hidden_dims': '[512, 64]', 'dropout': 0.20691151248463052, 'batch_norm': True, 'lr': 8.744841568599801e-05, 'weight_decay': 7.044697588145656e-06, 'epochs': 276, 'loss': 'mae', 'optimizer': 'adam', 'graph_mode': 'off', 'use_snp_selection': True, 'num_snps': 41087}. Best is trial 5 with value: 0.06552593845841431.
[I 2025-12-05 14:30:55,627] Trial 83 finished with value: 0.043758011827554254 and parameters: {'model_type': 'mlp', 'hidden_dims': '[256, 128, 64]', 'dropout': 0.19200506263715483, 'batch_norm': True, 'lr': 0.00010187897960661432, 'weight_decay': 3.6097886219660803e-06, 'epochs': 300, 'loss': 'mae', 'optimizer': 'adam', 'graph_mode': 'off', 'use_snp_selection': True, 'num_snps': 37090}. Best is trial 5 with value: 0.06552593845841431.
[I 2025-12-05 14:30:58,108] Trial 84 finished with value: 0.0481146204794518 and parameters: {'model_type': 'mlp', 'hidden_dims': '[256, 128, 64]', 'dropout': 0.23405397417907703, 'batch_norm': True, 'lr': 4.935931115572564e-05, 'weight_decay': 1.1154299963002281e-05, 'epochs': 332, 'loss': 'mae', 'optimizer': 'adam', 'graph_mode': 'off', 'use_snp_selection': True, 'num_snps': 44680}. Best is trial 5 with value: 0.06552593845841431.
[I 2025-12-05 14:30:59,995] Trial 85 finished with value: 0.05539310074932247 and parameters: {'model_type': 'mlp', 'hidden_dims': '[256, 128, 64]', 'dropout': 0.2133473361326136, 'batch_norm': True, 'lr': 7.696088019498196e-05, 'weight_decay': 1.8584399630634e-07, 'epochs': 163, 'loss': 'mae', 'optimizer': 'adam', 'graph_mode': 'off', 'use_snp_selection': True, 'num_snps': 34970}. Best is trial 5 with value: 0.06552593845841431.
[I 2025-12-05 14:31:02,296] Trial 86 finished with value: 0.03825973313847889 and parameters: {'model_type': 'mlp', 'hidden_dims': '[256, 128, 64]', 'dropout': 0.3338530716344072, 'batch_norm': True, 'lr': 0.00013170549323871, 'weight_decay': 5.893696156592038e-06, 'epochs': 186, 'loss': 'mae', 'optimizer': 'adam', 'graph_mode': 'off', 'use_snp_selection': True, 'num_snps': 47288}. Best is trial 5 with value: 0.06552593845841431.
[I 2025-12-05 14:31:04,276] Trial 87 finished with value: 0.05936673224460107 and parameters: {'model_type': 'mlp', 'hidden_dims': '[512, 64]', 'dropout': 0.36303701998214566, 'batch_norm': True, 'lr': 5.6869981431668845e-05, 'weight_decay': 4.044400513129321e-05, 'epochs': 241, 'loss': 'mae', 'optimizer': 'adam', 'graph_mode': 'off', 'use_snp_selection': True, 'num_snps': 29223}. Best is trial 5 with value: 0.06552593845841431.
[I 2025-12-05 14:31:05,975] Trial 88 finished with value: 0.04872670888394543 and parameters: {'model_type': 'mlp', 'hidden_dims': '[512, 64]', 'dropout': 0.36296715062729157, 'batch_norm': True, 'lr': 5.746378067291536e-05, 'weight_decay': 3.840169464414646e-05, 'epochs': 237, 'loss': 'mse', 'optimizer': 'adam', 'graph_mode': 'off', 'use_snp_selection': False}. Best is trial 5 with value: 0.06552593845841431.
[I 2025-12-05 14:31:07,475] Trial 89 finished with value: 0.04264679483402936 and parameters: {'model_type': 'mlp', 'hidden_dims': '[512, 64]', 'dropout': 0.38041248789212706, 'batch_norm': True, 'lr': 0.00016154720726575721, 'weight_decay': 6.092250137655878e-05, 'epochs': 250, 'loss': 'mae', 'optimizer': 'adam', 'graph_mode': 'off', 'use_snp_selection': True, 'num_snps': 18728}. Best is trial 5 with value: 0.06552593845841431.
[I 2025-12-05 14:31:08,864] Trial 90 finished with value: 0.0389310010931562 and parameters: {'model_type': 'mlp', 'hidden_dims': '[512, 64]', 'dropout': 0.35098310601159294, 'batch_norm': True, 'lr': 0.00011000753838496243, 'weight_decay': 9.01664279671445e-05, 'epochs': 259, 'loss': 'mae', 'optimizer': 'adam', 'graph_mode': 'off', 'use_snp_selection': True, 'num_snps': 15339}. Best is trial 5 with value: 0.06552593845841431.
[I 2025-12-05 14:31:10,744] Trial 91 finished with value: 0.04607337517539645 and parameters: {'model_type': 'mlp', 'hidden_dims': '[512, 64]', 'dropout': 0.4245878079657904, 'batch_norm': True, 'lr': 3.3230608239883913e-05, 'weight_decay': 1.6509610816172338e-05, 'epochs': 223, 'loss': 'mae', 'optimizer': 'adam', 'graph_mode': 'off', 'use_snp_selection': True, 'num_snps': 29041}. Best is trial 5 with value: 0.06552593845841431.
[I 2025-12-05 14:31:12,796] Trial 92 finished with value: 0.04068827272021417 and parameters: {'model_type': 'mlp', 'hidden_dims': '[128, 64]', 'dropout': 0.4056748314625156, 'batch_norm': True, 'lr': 4.267966515244888e-05, 'weight_decay': 2.0654403099583104e-05, 'epochs': 279, 'loss': 'mae', 'optimizer': 'adam', 'graph_mode': 'off', 'use_snp_selection': True, 'num_snps': 37713}. Best is trial 5 with value: 0.06552593845841431.
[I 2025-12-05 14:31:13,687] Trial 93 finished with value: 0.014462624150022363 and parameters: {'model_type': 'mlp', 'hidden_dims': '[512, 128]', 'dropout': 0.2945479004415081, 'batch_norm': True, 'lr': 6.626711185687532e-05, 'weight_decay': 3.224105781894317e-05, 'epochs': 193, 'loss': 'mae', 'optimizer': 'adam', 'graph_mode': 'off', 'use_snp_selection': True, 'num_snps': 2218}. Best is trial 5 with value: 0.06552593845841431.
[I 2025-12-05 14:31:14,751] Trial 94 finished with value: 0.05861566420673365 and parameters: {'model_type': 'mlp', 'hidden_dims': '[512, 64]', 'dropout': 0.1547199950673561, 'batch_norm': True, 'lr': 8.930861825273955e-05, 'weight_decay': 9.019582152744764e-06, 'epochs': 206, 'loss': 'mae', 'optimizer': 'adam', 'graph_mode': 'off', 'use_snp_selection': True, 'num_snps': 8011}. Best is trial 5 with value: 0.06552593845841431.
[I 2025-12-05 14:31:15,782] Trial 95 finished with value: 0.05172879318465081 and parameters: {'model_type': 'mlp', 'hidden_dims': '[512, 64]', 'dropout': 0.1556159737867904, 'batch_norm': True, 'lr': 0.0006975741910784645, 'weight_decay': 1.0458279958303612e-06, 'epochs': 205, 'loss': 'mae', 'optimizer': 'adam', 'graph_mode': 'off', 'use_snp_selection': True, 'num_snps': 6996}. Best is trial 5 with value: 0.06552593845841431.
[I 2025-12-05 14:31:17,176] Trial 96 finished with value: 0.02907849954647394 and parameters: {'model_type': 'mlp', 'hidden_dims': '[512, 64]', 'dropout': 0.11742819338172894, 'batch_norm': False, 'lr': 0.000218344868901734, 'weight_decay': 0.00013533442855493248, 'epochs': 171, 'loss': 'mse', 'optimizer': 'adam', 'graph_mode': 'off', 'use_snp_selection': False}. Best is trial 5 with value: 0.06552593845841431.
[I 2025-12-05 14:31:18,204] Trial 97 finished with value: 0.06440561133165684 and parameters: {'model_type': 'mlp', 'hidden_dims': '[512, 64]', 'dropout': 0.1360668703448292, 'batch_norm': True, 'lr': 9.41506908046192e-05, 'weight_decay': 7.58546646050796e-06, 'epochs': 231, 'loss': 'mae', 'optimizer': 'adam', 'graph_mode': 'off', 'use_snp_selection': True, 'num_snps': 5654}. Best is trial 5 with value: 0.06552593845841431.
[I 2025-12-05 14:31:19,884] Trial 98 finished with value: 0.02221138476903164 and parameters: {'model_type': 'mlp', 'hidden_dims': '[512, 64]', 'dropout': 0.13666597266014652, 'batch_norm': True, 'lr': 1.0379065078193609e-05, 'weight_decay': 2.3251033704544633e-05, 'epochs': 235, 'loss': 'mae', 'optimizer': 'adam', 'graph_mode': 'off', 'use_snp_selection': False}. Best is trial 5 with value: 0.06552593845841431.
[I 2025-12-05 14:31:20,876] Trial 99 finished with value: 0.06727357873478364 and parameters: {'model_type': 'mlp', 'hidden_dims': '[512, 64]', 'dropout': 0.32231893392880695, 'batch_norm': True, 'lr': 0.00012144559715054113, 'weight_decay': 1.3069141063047236e-05, 'epochs': 214, 'loss': 'mse', 'optimizer': 'adam', 'graph_mode': 'off', 'use_snp_selection': True, 'num_snps': 5390}. Best is trial 99 with value: 0.06727357873478364.
[I 2025-12-05 14:31:22,037] Trial 100 finished with value: 0.047701702359496265 and parameters: {'model_type': 'mlp', 'hidden_dims': '[512, 64]', 'dropout': 0.3226300468142557, 'batch_norm': True, 'lr': 0.00011740895049498246, 'weight_decay': 1.2454425131794826e-05, 'epochs': 230, 'loss': 'mae', 'optimizer': 'adam', 'graph_mode': 'off', 'use_snp_selection': True, 'num_snps': 10009}. Best is trial 99 with value: 0.06727357873478364.
[I 2025-12-05 14:31:23,064] Trial 101 finished with value: 0.041272623160790604 and parameters: {'model_type': 'mlp', 'hidden_dims': '[512, 64]', 'dropout': 0.2512711867935656, 'batch_norm': True, 'lr': 0.0001554194941431238, 'weight_decay': 7.467173207740858e-06, 'epochs': 217, 'loss': 'mse', 'optimizer': 'adam', 'graph_mode': 'off', 'use_snp_selection': True, 'num_snps': 5930}. Best is trial 99 with value: 0.06727357873478364.
[I 2025-12-05 14:31:24,077] Trial 102 finished with value: 0.03765012028635119 and parameters: {'model_type': 'mlp', 'hidden_dims': '[512, 64]', 'dropout': 0.5634889817689144, 'batch_norm': True, 'lr': 0.00018556895423822327, 'weight_decay': 1.5572012271661642e-05, 'epochs': 240, 'loss': 'mse', 'optimizer': 'adam', 'graph_mode': 'off', 'use_snp_selection': True, 'num_snps': 4922}. Best is trial 99 with value: 0.06727357873478364.
[I 2025-12-05 14:31:25,380] Trial 103 finished with value: 0.05615705296106772 and parameters: {'model_type': 'mlp', 'hidden_dims': '[512, 64]', 'dropout': 0.2690075054497748, 'batch_norm': True, 'lr': 9.52343889770431e-05, 'weight_decay': 1.0588739911492931e-05, 'epochs': 254, 'loss': 'mse', 'optimizer': 'adam', 'graph_mode': 'off', 'use_snp_selection': True, 'num_snps': 14103}. Best is trial 99 with value: 0.06727357873478364.
[I 2025-12-05 14:31:26,523] Trial 104 finished with value: 0.02930609417323639 and parameters: {'model_type': 'mlp', 'hidden_dims': '[512, 64]', 'dropout': 0.35489704169386493, 'batch_norm': True, 'lr': 0.00012605383947788377, 'weight_decay': 4.2925501890936436e-06, 'epochs': 226, 'loss': 'mse', 'optimizer': 'adam', 'graph_mode': 'off', 'use_snp_selection': True, 'num_snps': 9877}. Best is trial 99 with value: 0.06727357873478364.
[I 2025-12-05 14:31:27,401] Trial 105 finished with value: 0.046809813845660686 and parameters: {'model_type': 'mlp', 'hidden_dims': '[512, 64]', 'dropout': 0.3221001743878945, 'batch_norm': True, 'lr': 0.0003219632162940261, 'weight_decay': 1.8224223354035372e-06, 'epochs': 155, 'loss': 'mse', 'optimizer': 'adam', 'graph_mode': 'off', 'use_snp_selection': True, 'num_snps': 4218}. Best is trial 99 with value: 0.06727357873478364.
[I 2025-12-05 14:31:28,655] Trial 106 finished with value: 0.0387498114066476 and parameters: {'model_type': 'mlp', 'hidden_dims': '[512, 64]', 'dropout': 0.30499155029304226, 'batch_norm': True, 'lr': 0.00045231003013073253, 'weight_decay': 4.175614176215395e-05, 'epochs': 127, 'loss': 'mse', 'optimizer': 'adam', 'graph_mode': 'off', 'use_snp_selection': False}. Best is trial 99 with value: 0.06727357873478364.
[I 2025-12-05 14:31:29,841] Trial 107 finished with value: 0.06024041084899878 and parameters: {'model_type': 'mlp', 'hidden_dims': '[512, 64]', 'dropout': 0.13372819186263074, 'batch_norm': True, 'lr': 2.7787289878898548e-05, 'weight_decay': 2.538895249514486e-06, 'epochs': 212, 'loss': 'mae', 'optimizer': 'adam', 'graph_mode': 'off', 'use_snp_selection': True, 'num_snps': 11705}. Best is trial 99 with value: 0.06727357873478364.
[I 2025-12-05 14:31:30,923] Trial 108 finished with value: 0.015409436132841958 and parameters: {'model_type': 'mlp', 'hidden_dims': '[512, 256]', 'dropout': 0.13536519519066242, 'batch_norm': True, 'lr': 4.965991588605012e-05, 'weight_decay': 0.0008159564934380478, 'epochs': 144, 'loss': 'mae', 'optimizer': 'adam', 'graph_mode': 'off', 'use_snp_selection': True, 'num_snps': 11290}. Best is trial 99 with value: 0.06727357873478364.
