[I 2025-12-06 10:51:33,010] Trial 141 finished with value: 0.19416285223651036 and parameters: {'model_type': 'mlp', 'hidden_dims': '[512, 256]', 'dropout': 0.13621763373823734, 'batch_norm': True, 'lr': 6.062890368285765e-05, 'weight_decay': 5.261292168259142e-05, 'epochs': 298, 'loss': 'mse', 'optimizer': 'adam', 'graph_mode': 'off', 'use_snp_selection': False}. Best is trial 118 with value: 0.2024649360837997.
[I 2025-12-06 10:53:08,891] Trial 142 finished with value: 0.1895954910171243 and parameters: {'model_type': 'mlp', 'hidden_dims': '[512, 256]', 'dropout': 0.14393664460556369, 'batch_norm': True, 'lr': 3.720373418457265e-05, 'weight_decay': 7.670805214587216e-05, 'epochs': 310, 'loss': 'mse', 'optimizer': 'adam', 'graph_mode': 'off', 'use_snp_selection': False}. Best is trial 118 with value: 0.2024649360837997.
[I 2025-12-06 10:54:38,753] Trial 143 finished with value: 0.19753402470392628 and parameters: {'model_type': 'mlp', 'hidden_dims': '[512, 256]', 'dropout': 0.1578791052477499, 'batch_norm': True, 'lr': 9.067782164589927e-05, 'weight_decay': 6.444637575792074e-05, 'epochs': 289, 'loss': 'mse', 'optimizer': 'adam', 'graph_mode': 'off', 'use_snp_selection': False}. Best is trial 118 with value: 0.2024649360837997.
[I 2025-12-06 10:56:08,389] Trial 144 finished with value: 0.19605372440308333 and parameters: {'model_type': 'mlp', 'hidden_dims': '[512, 256]', 'dropout': 0.15831913420612623, 'batch_norm': True, 'lr': 8.239217403090268e-05, 'weight_decay': 2.550456076353993e-05, 'epochs': 288, 'loss': 'mse', 'optimizer': 'adam', 'graph_mode': 'off', 'use_snp_selection': False}. Best is trial 118 with value: 0.2024649360837997.
[I 2025-12-06 10:57:38,369] Trial 145 finished with value: 0.19379741901929362 and parameters: {'model_type': 'mlp', 'hidden_dims': '[512, 256]', 'dropout': 0.15969946916520505, 'batch_norm': True, 'lr': 8.42057151954874e-05, 'weight_decay': 2.77701312160581e-05, 'epochs': 289, 'loss': 'mse', 'optimizer': 'adam', 'graph_mode': 'off', 'use_snp_selection': False}. Best is trial 118 with value: 0.2024649360837997.
[I 2025-12-06 10:59:04,250] Trial 146 finished with value: 0.18450860423672408 and parameters: {'model_type': 'mlp', 'hidden_dims': '[512, 256]', 'dropout': 0.11533327618966752, 'batch_norm': True, 'lr': 4.510391091282576e-05, 'weight_decay': 1.298641785278578e-05, 'epochs': 275, 'loss': 'mse', 'optimizer': 'adam', 'graph_mode': 'off', 'use_snp_selection': False}. Best is trial 118 with value: 0.2024649360837997.
[I 2025-12-06 11:00:44,427] Trial 147 finished with value: 0.1866068756841407 and parameters: {'model_type': 'mlp', 'hidden_dims': '[512, 256]', 'dropout': 0.17626483827335407, 'batch_norm': True, 'lr': 9.292418097737207e-05, 'weight_decay': 3.3922364244520604e-05, 'epochs': 325, 'loss': 'mse', 'optimizer': 'adam', 'graph_mode': 'off', 'use_snp_selection': False}. Best is trial 118 with value: 0.2024649360837997.
[I 2025-12-06 11:02:06,357] Trial 148 finished with value: 0.18081371445849354 and parameters: {'model_type': 'mlp', 'hidden_dims': '[512, 256]', 'dropout': 0.1568701889662009, 'batch_norm': False, 'lr': 5.4452798579667156e-05, 'weight_decay': 1.6186744172979692e-06, 'epochs': 269, 'loss': 'mse', 'optimizer': 'adam', 'graph_mode': 'off', 'use_snp_selection': False}. Best is trial 118 with value: 0.2024649360837997.
[I 2025-12-06 11:02:33,091] Trial 149 finished with value: 0.179158607360767 and parameters: {'model_type': 'mlp', 'hidden_dims': '[128, 64]', 'dropout': 0.12694754954455653, 'batch_norm': True, 'lr': 3.306741841172397e-05, 'weight_decay': 6.755839936732166e-05, 'epochs': 283, 'loss': 'mse', 'optimizer': 'adam', 'graph_mode': 'off', 'use_snp_selection': False}. Best is trial 118 with value: 0.2024649360837997.
[I 2025-12-06 11:03:44,915] Trial 0 finished with value: 0.1625027819061568 and parameters: {'model_type': 'mlp', 'hidden_dims': '[128, 64]', 'dropout': 0.199031432379812, 'batch_norm': True, 'lr': 1.8408544111075837e-06, 'weight_decay': 5.5136510071208614e-05, 'epochs': 336, 'loss': 'mae', 'optimizer': 'adam', 'graph_mode': 'off', 'use_snp_selection': True, 'num_snps': 43862}. Best is trial 0 with value: 0.1625027819061568.
[I 2025-12-06 11:04:25,901] Trial 1 finished with value: 0.20431115617837187 and parameters: {'model_type': 'mlp', 'hidden_dims': '[256, 128]', 'dropout': 0.4370668075331726, 'batch_norm': True, 'lr': 7.133471581159139e-05, 'weight_decay': 1.128633586803549e-05, 'epochs': 242, 'loss': 'mae', 'optimizer': 'adam', 'graph_mode': 'off', 'use_snp_selection': False}. Best is trial 1 with value: 0.20431115617837187.
[I 2025-12-06 11:05:02,958] Trial 2 finished with value: 0.1605360990872498 and parameters: {'model_type': 'mlp', 'hidden_dims': '[256, 128, 64]', 'dropout': 0.41314357415569625, 'batch_norm': False, 'lr': 3.952233718592101e-06, 'weight_decay': 0.00026754769258252603, 'epochs': 149, 'loss': 'mse', 'optimizer': 'adam', 'graph_mode': 'off', 'use_snp_selection': True, 'num_snps': 11571}. Best is trial 1 with value: 0.20431115617837187.
[I 2025-12-06 11:06:39,208] Trial 3 finished with value: 0.21973440253557702 and parameters: {'model_type': 'mlp', 'hidden_dims': '[512, 64]', 'dropout': 0.5938127374509361, 'batch_norm': False, 'lr': 5.67704586114731e-06, 'weight_decay': 2.4518087630137052e-05, 'epochs': 320, 'loss': 'mae', 'optimizer': 'adam', 'graph_mode': 'off', 'use_snp_selection': False}. Best is trial 3 with value: 0.21973440253557702.
[I 2025-12-06 11:08:05,231] Trial 4 finished with value: 0.16546618207559877 and parameters: {'model_type': 'mlp', 'hidden_dims': '[512, 128]', 'dropout': 0.25746343592134413, 'batch_norm': True, 'lr': 1.3467657668402788e-06, 'weight_decay': 0.00033087251918647806, 'epochs': 277, 'loss': 'mse', 'optimizer': 'adam', 'graph_mode': 'off', 'use_snp_selection': True, 'num_snps': 36675}. Best is trial 3 with value: 0.21973440253557702.
[I 2025-12-06 11:09:05,337] Trial 5 finished with value: 0.12072547715156376 and parameters: {'model_type': 'mlp', 'hidden_dims': '[512, 64]', 'dropout': 0.38275350994408375, 'batch_norm': True, 'lr': 1.5586664309232824e-06, 'weight_decay': 0.0008227664668621182, 'epochs': 145, 'loss': 'mae', 'optimizer': 'adam', 'graph_mode': 'off', 'use_snp_selection': True, 'num_snps': 32148}. Best is trial 3 with value: 0.21973440253557702.
[I 2025-12-06 11:09:39,217] Trial 6 finished with value: 0.2192124448705164 and parameters: {'model_type': 'mlp', 'hidden_dims': '[256, 128]', 'dropout': 0.3930109900265879, 'batch_norm': False, 'lr': 4.892964372128395e-05, 'weight_decay': 1.5809549317992182e-06, 'epochs': 199, 'loss': 'mse', 'optimizer': 'adam', 'graph_mode': 'off', 'use_snp_selection': False}. Best is trial 3 with value: 0.21973440253557702.
[I 2025-12-06 11:10:14,030] Trial 7 finished with value: 0.20963435166884822 and parameters: {'model_type': 'mlp', 'hidden_dims': '[512, 256]', 'dropout': 0.15343979219678458, 'batch_norm': True, 'lr': 6.234003099047341e-05, 'weight_decay': 3.894760610535477e-07, 'epochs': 97, 'loss': 'mse', 'optimizer': 'adam', 'graph_mode': 'off', 'use_snp_selection': False}. Best is trial 3 with value: 0.21973440253557702.
[I 2025-12-06 11:11:50,122] Trial 8 finished with value: 0.2144226841689571 and parameters: {'model_type': 'mlp', 'hidden_dims': '[512, 128]', 'dropout': 0.10743001231661406, 'batch_norm': True, 'lr': 0.00023728538449271062, 'weight_decay': 1.7629071578048637e-05, 'epochs': 312, 'loss': 'mae', 'optimizer': 'adam', 'graph_mode': 'off', 'use_snp_selection': False}. Best is trial 3 with value: 0.21973440253557702.
[I 2025-12-06 11:12:47,260] Trial 9 finished with value: 0.20998635523843096 and parameters: {'model_type': 'mlp', 'hidden_dims': '[512, 64]', 'dropout': 0.14505336736221927, 'batch_norm': True, 'lr': 5.8619638388111826e-05, 'weight_decay': 6.200156172669308e-07, 'epochs': 175, 'loss': 'mse', 'optimizer': 'adam', 'graph_mode': 'off', 'use_snp_selection': False}. Best is trial 3 with value: 0.21973440253557702.
[I 2025-12-06 11:13:10,105] Trial 10 finished with value: 0.19824241627805148 and parameters: {'model_type': 'mlp', 'hidden_dims': '[512, 64]', 'dropout': 0.5885461262002587, 'batch_norm': False, 'lr': 8.769366258768696e-06, 'weight_decay': 2.78273193871783e-06, 'epochs': 55, 'loss': 'mae', 'optimizer': 'adam', 'graph_mode': 'off', 'use_snp_selection': False}. Best is trial 3 with value: 0.21973440253557702.
[I 2025-12-06 11:13:49,323] Trial 11 finished with value: 0.21906038963354554 and parameters: {'model_type': 'mlp', 'hidden_dims': '[256, 128]', 'dropout': 0.583942291816117, 'batch_norm': False, 'lr': 1.422933652790185e-05, 'weight_decay': 2.805519019095577e-06, 'epochs': 231, 'loss': 'mse', 'optimizer': 'adam', 'graph_mode': 'off', 'use_snp_selection': False}. Best is trial 3 with value: 0.21973440253557702.
[I 2025-12-06 11:14:29,082] Trial 12 finished with value: 0.06684332032857918 and parameters: {'model_type': 'mlp', 'hidden_dims': '[256, 128]', 'dropout': 0.4779690972965961, 'batch_norm': False, 'lr': 0.0006753264773209732, 'weight_decay': 1.3081036432574914e-07, 'epochs': 240, 'loss': 'mae', 'optimizer': 'adam', 'graph_mode': 'off', 'use_snp_selection': False}. Best is trial 3 with value: 0.21973440253557702.
[I 2025-12-06 11:14:56,200] Trial 13 finished with value: 0.20492338396977744 and parameters: {'model_type': 'mlp', 'hidden_dims': '[128, 64]', 'dropout': 0.3041365173646664, 'batch_norm': False, 'lr': 2.0021225389711998e-05, 'weight_decay': 4.373608364627903e-05, 'epochs': 293, 'loss': 'mse', 'optimizer': 'adam', 'graph_mode': 'off', 'use_snp_selection': False}. Best is trial 3 with value: 0.21973440253557702.
[I 2025-12-06 11:16:40,753] Trial 14 finished with value: 0.21505307105270802 and parameters: {'model_type': 'mlp', 'hidden_dims': '[512, 256]', 'dropout': 0.5143108008659758, 'batch_norm': False, 'lr': 5.932455544499841e-06, 'weight_decay': 2.3625593107335962e-06, 'epochs': 344, 'loss': 'mse', 'optimizer': 'adam', 'graph_mode': 'off', 'use_snp_selection': False}. Best is trial 3 with value: 0.21973440253557702.
[I 2025-12-06 11:17:13,819] Trial 15 finished with value: 0.20832400680613622 and parameters: {'model_type': 'mlp', 'hidden_dims': '[256, 128, 64]', 'dropout': 0.32864867985638985, 'batch_norm': False, 'lr': 0.00018429018027102804, 'weight_decay': 5.343087596659364e-05, 'epochs': 190, 'loss': 'mae', 'optimizer': 'adam', 'graph_mode': 'off', 'use_snp_selection': False}. Best is trial 3 with value: 0.21973440253557702.
[I 2025-12-06 11:17:33,999] Trial 16 finished with value: 0.22144766745914574 and parameters: {'model_type': 'mlp', 'hidden_dims': '[256, 128]', 'dropout': 0.5053372842363391, 'batch_norm': False, 'lr': 3.243454594745554e-05, 'weight_decay': 1.2294468020462874e-06, 'epochs': 98, 'loss': 'mse', 'optimizer': 'adam', 'graph_mode': 'off', 'use_snp_selection': False}. Best is trial 16 with value: 0.22144766745914574.
[I 2025-12-06 11:17:53,494] Trial 17 finished with value: 0.11489366220703841 and parameters: {'model_type': 'mlp', 'hidden_dims': '[512, 64]', 'dropout': 0.543474321376226, 'batch_norm': False, 'lr': 3.378196935792496e-06, 'weight_decay': 6.503919561253859e-06, 'epochs': 43, 'loss': 'mae', 'optimizer': 'adam', 'graph_mode': 'off', 'use_snp_selection': False}. Best is trial 16 with value: 0.22144766745914574.
[I 2025-12-06 11:18:56,134] Trial 18 finished with value: 0.22108678857215266 and parameters: {'model_type': 'mlp', 'hidden_dims': '[256, 128]', 'dropout': 0.49511833116234694, 'batch_norm': False, 'lr': 2.797772152750264e-05, 'weight_decay': 4.5859171107988616e-07, 'epochs': 103, 'loss': 'mse', 'optimizer': 'adam', 'graph_mode': 'off', 'use_snp_selection': True, 'num_snps': 58241}. Best is trial 16 with value: 0.22144766745914574.
[I 2025-12-06 11:19:58,317] Trial 19 finished with value: 0.2207963608452849 and parameters: {'model_type': 'mlp', 'hidden_dims': '[256, 128]', 'dropout': 0.473800948811775, 'batch_norm': False, 'lr': 2.8408775276891154e-05, 'weight_decay': 1.1354159408743119e-07, 'epochs': 109, 'loss': 'mse', 'optimizer': 'adam', 'graph_mode': 'off', 'use_snp_selection': True, 'num_snps': 55667}. Best is trial 16 with value: 0.22144766745914574.
[I 2025-12-06 11:20:58,398] Trial 20 finished with value: 0.21669029786884852 and parameters: {'model_type': 'mlp', 'hidden_dims': '[256, 128]', 'dropout': 0.524902523376672, 'batch_norm': False, 'lr': 0.00015494944568602081, 'weight_decay': 5.295326074184958e-07, 'epochs': 87, 'loss': 'mse', 'optimizer': 'adam', 'graph_mode': 'off', 'use_snp_selection': True, 'num_snps': 57703}. Best is trial 16 with value: 0.22144766745914574.
[I 2025-12-06 11:22:02,037] Trial 21 finished with value: 0.220124779363369 and parameters: {'model_type': 'mlp', 'hidden_dims': '[256, 128]', 'dropout': 0.4727088783203093, 'batch_norm': False, 'lr': 2.987655409514362e-05, 'weight_decay': 1.0355093150196372e-07, 'epochs': 106, 'loss': 'mse', 'optimizer': 'adam', 'graph_mode': 'off', 'use_snp_selection': True, 'num_snps': 59811}. Best is trial 16 with value: 0.22144766745914574.
[I 2025-12-06 11:23:02,451] Trial 22 finished with value: 0.22194273407423243 and parameters: {'model_type': 'mlp', 'hidden_dims': '[256, 128]', 'dropout': 0.45674149447670526, 'batch_norm': False, 'lr': 1.4806658141852765e-05, 'weight_decay': 3.0191566540155994e-07, 'epochs': 132, 'loss': 'mse', 'optimizer': 'adam', 'graph_mode': 'off', 'use_snp_selection': True, 'num_snps': 48956}. Best is trial 22 with value: 0.22194273407423243.
[I 2025-12-06 11:24:00,620] Trial 23 finished with value: 0.20891539424806407 and parameters: {'model_type': 'mlp', 'hidden_dims': '[256, 128]', 'dropout': 0.4373308784106001, 'batch_norm': False, 'lr': 1.520686477310037e-05, 'weight_decay': 3.0080695193995506e-07, 'epochs': 129, 'loss': 'mse', 'optimizer': 'adam', 'graph_mode': 'off', 'use_snp_selection': True, 'num_snps': 45569}. Best is trial 22 with value: 0.22194273407423243.
[I 2025-12-06 11:24:38,700] Trial 24 finished with value: 0.1974772667005656 and parameters: {'model_type': 'mlp', 'hidden_dims': '[256, 128]', 'dropout': 0.5175695345075122, 'batch_norm': False, 'lr': 1.0331463677061544e-05, 'weight_decay': 9.801436418807389e-07, 'epochs': 72, 'loss': 'mse', 'optimizer': 'adam', 'graph_mode': 'off', 'use_snp_selection': True, 'num_snps': 17821}. Best is trial 22 with value: 0.22194273407423243.
[I 2025-12-06 11:25:38,259] Trial 25 finished with value: 0.20989992658813078 and parameters: {'model_type': 'mlp', 'hidden_dims': '[256, 128]', 'dropout': 0.35039592604060865, 'batch_norm': False, 'lr': 0.00010530488215650414, 'weight_decay': 2.3243921855902055e-07, 'epochs': 130, 'loss': 'mse', 'optimizer': 'adam', 'graph_mode': 'off', 'use_snp_selection': True, 'num_snps': 48442}. Best is trial 22 with value: 0.22194273407423243.
[I 2025-12-06 11:26:17,698] Trial 26 finished with value: 0.20535094099057835 and parameters: {'model_type': 'mlp', 'hidden_dims': '[256, 128]', 'dropout': 0.5508401534014779, 'batch_norm': False, 'lr': 3.614697123989981e-05, 'weight_decay': 9.868985205600041e-07, 'epochs': 76, 'loss': 'mse', 'optimizer': 'adam', 'graph_mode': 'off', 'use_snp_selection': True, 'num_snps': 20664}. Best is trial 22 with value: 0.22194273407423243.
[I 2025-12-06 11:27:30,984] Trial 27 finished with value: 0.20803470048265688 and parameters: {'model_type': 'mlp', 'hidden_dims': '[512, 128]', 'dropout': 0.48350978620043733, 'batch_norm': False, 'lr': 2.2633068710824833e-05, 'weight_decay': 4.975660642935628e-06, 'epochs': 123, 'loss': 'mse', 'optimizer': 'adam', 'graph_mode': 'off', 'use_snp_selection': True, 'num_snps': 49553}. Best is trial 22 with value: 0.22194273407423243.
[I 2025-12-06 11:28:20,724] Trial 28 finished with value: 0.18697009425810288 and parameters: {'model_type': 'mlp', 'hidden_dims': '[128, 64]', 'dropout': 0.43702142965764246, 'batch_norm': False, 'lr': 0.0005388560200940643, 'weight_decay': 2.0828819973110283e-07, 'epochs': 158, 'loss': 'mse', 'optimizer': 'adam', 'graph_mode': 'off', 'use_snp_selection': True, 'num_snps': 40255}. Best is trial 22 with value: 0.22194273407423243.
[I 2025-12-06 11:29:18,320] Trial 29 finished with value: 0.2043788561202978 and parameters: {'model_type': 'mlp', 'hidden_dims': '[512, 256]', 'dropout': 0.2523135802350327, 'batch_norm': False, 'lr': 3.0092107056283355e-06, 'weight_decay': 9.668381404327733e-07, 'epochs': 174, 'loss': 'mse', 'optimizer': 'adam', 'graph_mode': 'off', 'use_snp_selection': True, 'num_snps': 25966}. Best is trial 22 with value: 0.22194273407423243.
[I 2025-12-06 11:30:10,029] Trial 30 finished with value: 0.19623803431703343 and parameters: {'model_type': 'mlp', 'hidden_dims': '[128, 64]', 'dropout': 0.5584582245629975, 'batch_norm': False, 'lr': 9.790130886563861e-06, 'weight_decay': 5.620877193125285e-07, 'epochs': 75, 'loss': 'mse', 'optimizer': 'adam', 'graph_mode': 'off', 'use_snp_selection': True, 'num_snps': 53270}. Best is trial 22 with value: 0.22194273407423243.
[I 2025-12-06 11:31:11,419] Trial 31 finished with value: 0.21277038034986528 and parameters: {'model_type': 'mlp', 'hidden_dims': '[256, 128]', 'dropout': 0.49093599157216594, 'batch_norm': False, 'lr': 3.4005692619485525e-05, 'weight_decay': 1.7298147259617823e-07, 'epochs': 111, 'loss': 'mse', 'optimizer': 'adam', 'graph_mode': 'off', 'use_snp_selection': True, 'num_snps': 55164}. Best is trial 22 with value: 0.22194273407423243.
[I 2025-12-06 11:32:11,957] Trial 32 finished with value: 0.21301200741905418 and parameters: {'model_type': 'mlp', 'hidden_dims': '[256, 128]', 'dropout': 0.4505294858508832, 'batch_norm': False, 'lr': 8.795950654632576e-05, 'weight_decay': 1.0104265635870238e-07, 'epochs': 114, 'loss': 'mse', 'optimizer': 'adam', 'graph_mode': 'off', 'use_snp_selection': True, 'num_snps': 53228}. Best is trial 22 with value: 0.22194273407423243.
[I 2025-12-06 11:33:08,931] Trial 33 finished with value: 0.20551346870053325 and parameters: {'model_type': 'mlp', 'hidden_dims': '[256, 128, 64]', 'dropout': 0.39892427255816765, 'batch_norm': False, 'lr': 1.7111758231884254e-05, 'weight_decay': 2.971934245880572e-07, 'epochs': 55, 'loss': 'mse', 'optimizer': 'adam', 'graph_mode': 'off', 'use_snp_selection': True, 'num_snps': 59420}. Best is trial 22 with value: 0.22194273407423243.
[I 2025-12-06 11:34:11,059] Trial 34 finished with value: 0.21343908337666492 and parameters: {'model_type': 'mlp', 'hidden_dims': '[256, 128]', 'dropout': 0.4605291460786119, 'batch_norm': False, 'lr': 3.9363463851994245e-05, 'weight_decay': 1.3868200880543732e-06, 'epochs': 143, 'loss': 'mse', 'optimizer': 'adam', 'graph_mode': 'off', 'use_snp_selection': True, 'num_snps': 50503}. Best is trial 22 with value: 0.22194273407423243.
[I 2025-12-06 11:35:01,552] Trial 35 finished with value: 0.2110244923035606 and parameters: {'model_type': 'mlp', 'hidden_dims': '[256, 128]', 'dropout': 0.41716067644141774, 'batch_norm': True, 'lr': 2.3370708068846938e-05, 'weight_decay': 4.183200300077687e-07, 'epochs': 91, 'loss': 'mse', 'optimizer': 'adam', 'graph_mode': 'off', 'use_snp_selection': True, 'num_snps': 38703}. Best is trial 22 with value: 0.22194273407423243.
[I 2025-12-06 11:36:06,855] Trial 36 finished with value: 0.21388017264301568 and parameters: {'model_type': 'mlp', 'hidden_dims': '[256, 128]', 'dropout': 0.5075561072783973, 'batch_norm': False, 'lr': 7.143797791647527e-06, 'weight_decay': 1.862926009819565e-07, 'epochs': 213, 'loss': 'mse', 'optimizer': 'adam', 'graph_mode': 'off', 'use_snp_selection': True, 'num_snps': 44725}. Best is trial 22 with value: 0.22194273407423243.
[I 2025-12-06 11:37:13,812] Trial 37 finished with value: 0.2219005215746172 and parameters: {'model_type': 'mlp', 'hidden_dims': '[256, 128, 64]', 'dropout': 0.4258269329761558, 'batch_norm': False, 'lr': 1.213719922468392e-05, 'weight_decay': 6.605298097127033e-07, 'epochs': 159, 'loss': 'mse', 'optimizer': 'adam', 'graph_mode': 'off', 'use_snp_selection': True, 'num_snps': 54718}. Best is trial 22 with value: 0.22194273407423243.
[I 2025-12-06 11:38:06,716] Trial 38 finished with value: 0.11880350181181969 and parameters: {'model_type': 'mlp', 'hidden_dims': '[256, 128, 64]', 'dropout': 0.3625309975168254, 'batch_norm': True, 'lr': 2.313424484846628e-06, 'weight_decay': 5.029511194312586e-06, 'epochs': 162, 'loss': 'mse', 'optimizer': 'adam', 'graph_mode': 'off', 'use_snp_selection': True, 'num_snps': 33492}. Best is trial 22 with value: 0.22194273407423243.
[I 2025-12-06 11:38:39,857] Trial 39 finished with value: 0.1527685499542903 and parameters: {'model_type': 'mlp', 'hidden_dims': '[256, 128, 64]', 'dropout': 0.41093125020629806, 'batch_norm': False, 'lr': 5.11290907159514e-06, 'weight_decay': 0.00016807320533150001, 'epochs': 147, 'loss': 'mse', 'optimizer': 'adam', 'graph_mode': 'off', 'use_snp_selection': True, 'num_snps': 5787}. Best is trial 22 with value: 0.22194273407423243.
[I 2025-12-06 11:39:05,526] Trial 40 finished with value: 0.1876576989788405 and parameters: {'model_type': 'mlp', 'hidden_dims': '[256, 128, 64]', 'dropout': 0.3810575065578649, 'batch_norm': True, 'lr': 1.1928443217834684e-05, 'weight_decay': 1.6988782109357271e-06, 'epochs': 136, 'loss': 'mae', 'optimizer': 'adam', 'graph_mode': 'off', 'use_snp_selection': False}. Best is trial 22 with value: 0.22194273407423243.
[I 2025-12-06 11:40:18,880] Trial 41 finished with value: 0.2151295604391425 and parameters: {'model_type': 'mlp', 'hidden_dims': '[512, 128]', 'dropout': 0.43214718270956776, 'batch_norm': False, 'lr': 2.7786351733215224e-05, 'weight_decay': 7.345913768508613e-07, 'epochs': 103, 'loss': 'mse', 'optimizer': 'adam', 'graph_mode': 'off', 'use_snp_selection': True, 'num_snps': 55335}. Best is trial 22 with value: 0.22194273407423243.
