[I 2025-12-05 19:38:00,236] Trial 16 finished with value: 0.26599760570521536 and parameters: {'model_type': 'mlp', 'hidden_dims': '[256, 128, 64]', 'dropout': 0.558513902174278, 'batch_norm': True, 'lr': 2.1517090787442848e-05, 'weight_decay': 5.098763140321504e-06, 'epochs': 69, 'loss': 'mae', 'optimizer': 'adam', 'graph_mode': 'off', 'use_snp_selection': False}. Best is trial 7 with value: 0.2913727448419525.
[I 2025-12-05 19:38:27,229] Trial 17 finished with value: 0.2900594853178621 and parameters: {'model_type': 'mlp', 'hidden_dims': '[512, 128]', 'dropout': 0.15847318111315195, 'batch_norm': True, 'lr': 0.00011620307138345767, 'weight_decay': 4.7456925405414646e-07, 'epochs': 124, 'loss': 'mse', 'optimizer': 'adam', 'graph_mode': 'off', 'use_snp_selection': False}. Best is trial 7 with value: 0.2913727448419525.
[I 2025-12-05 19:39:25,133] Trial 18 finished with value: 0.2915270481770887 and parameters: {'model_type': 'mlp', 'hidden_dims': '[512, 256]', 'dropout': 0.32043400281835244, 'batch_norm': False, 'lr': 0.0001196276768011323, 'weight_decay': 3.793590444654012e-07, 'epochs': 125, 'loss': 'mse', 'optimizer': 'adam', 'graph_mode': 'off', 'use_snp_selection': True, 'num_snps': 58241}. Best is trial 18 with value: 0.2915270481770887.
[I 2025-12-05 19:40:33,712] Trial 19 finished with value: 0.28666208548540684 and parameters: {'model_type': 'mlp', 'hidden_dims': '[512, 256]', 'dropout': 0.5068548955181613, 'batch_norm': False, 'lr': 1.5743510448184712e-05, 'weight_decay': 2.1399778060523466e-07, 'epochs': 202, 'loss': 'mse', 'optimizer': 'adam', 'graph_mode': 'off', 'use_snp_selection': True, 'num_snps': 55667}. Best is trial 18 with value: 0.2915270481770887.
[I 2025-12-05 19:41:37,683] Trial 20 finished with value: 0.28483831897945644 and parameters: {'model_type': 'mlp', 'hidden_dims': '[512, 256]', 'dropout': 0.4772541275236246, 'batch_norm': False, 'lr': 3.6216206188106275e-05, 'weight_decay': 1.0018756988793329e-06, 'epochs': 166, 'loss': 'mse', 'optimizer': 'adam', 'graph_mode': 'off', 'use_snp_selection': True, 'num_snps': 57703}. Best is trial 18 with value: 0.2915270481770887.
[I 2025-12-05 19:42:05,870] Trial 21 finished with value: 0.27063211958230715 and parameters: {'model_type': 'mlp', 'hidden_dims': '[512, 256]', 'dropout': 0.3270571068780319, 'batch_norm': False, 'lr': 0.0001110460183250365, 'weight_decay': 4.2260737377505987e-07, 'epochs': 120, 'loss': 'mse', 'optimizer': 'adam', 'graph_mode': 'off', 'use_snp_selection': True, 'num_snps': 11878}. Best is trial 18 with value: 0.2915270481770887.
[I 2025-12-05 19:42:41,349] Trial 22 finished with value: 0.27964350354392115 and parameters: {'model_type': 'mlp', 'hidden_dims': '[512, 256]', 'dropout': 0.23287196034093183, 'batch_norm': False, 'lr': 0.0002237973745175603, 'weight_decay': 1.317584150592274e-07, 'epochs': 135, 'loss': 'mse', 'optimizer': 'adam', 'graph_mode': 'off', 'use_snp_selection': True, 'num_snps': 22259}. Best is trial 18 with value: 0.2915270481770887.
[I 2025-12-05 19:43:27,540] Trial 23 finished with value: 0.2960536708497362 and parameters: {'model_type': 'mlp', 'hidden_dims': '[512, 128]', 'dropout': 0.15412086494486904, 'batch_norm': False, 'lr': 8.713838224956081e-05, 'weight_decay': 6.037425903991419e-07, 'epochs': 89, 'loss': 'mse', 'optimizer': 'adam', 'graph_mode': 'off', 'use_snp_selection': True, 'num_snps': 46925}. Best is trial 23 with value: 0.2960536708497362.
[I 2025-12-05 19:44:07,665] Trial 24 finished with value: 0.2623757459331574 and parameters: {'model_type': 'mlp', 'hidden_dims': '[512, 256]', 'dropout': 0.33595916765206413, 'batch_norm': False, 'lr': 7.980398592528222e-05, 'weight_decay': 8.659738161790263e-07, 'epochs': 41, 'loss': 'mse', 'optimizer': 'adam', 'graph_mode': 'off', 'use_snp_selection': True, 'num_snps': 47173}. Best is trial 23 with value: 0.2960536708497362.
[I 2025-12-05 19:44:48,492] Trial 25 finished with value: 0.288529724331014 and parameters: {'model_type': 'mlp', 'hidden_dims': '[256, 128, 64]', 'dropout': 0.15221241225263582, 'batch_norm': False, 'lr': 0.00044781347987735804, 'weight_decay': 2.1365426178465523e-07, 'epochs': 88, 'loss': 'mse', 'optimizer': 'adam', 'graph_mode': 'off', 'use_snp_selection': True, 'num_snps': 48442}. Best is trial 23 with value: 0.2960536708497362.
[I 2025-12-05 19:45:40,498] Trial 26 finished with value: 0.2852210868444306 and parameters: {'model_type': 'mlp', 'hidden_dims': '[256, 128]', 'dropout': 0.23873520414431304, 'batch_norm': False, 'lr': 2.9887611797501362e-05, 'weight_decay': 3.4432408665144244e-06, 'epochs': 170, 'loss': 'mse', 'optimizer': 'adam', 'graph_mode': 'off', 'use_snp_selection': True, 'num_snps': 59939}. Best is trial 23 with value: 0.2960536708497362.
[I 2025-12-05 19:46:20,085] Trial 27 finished with value: 0.2957900692339073 and parameters: {'model_type': 'mlp', 'hidden_dims': '[128, 64]', 'dropout': 0.2711890894608783, 'batch_norm': False, 'lr': 8.853784651159014e-06, 'weight_decay': 2.0588462535663924e-06, 'epochs': 227, 'loss': 'mse', 'optimizer': 'adam', 'graph_mode': 'off', 'use_snp_selection': True, 'num_snps': 40343}. Best is trial 23 with value: 0.2960536708497362.
[I 2025-12-05 19:47:01,018] Trial 28 finished with value: 0.29410487720879913 and parameters: {'model_type': 'mlp', 'hidden_dims': '[128, 64]', 'dropout': 0.29971965565634434, 'batch_norm': False, 'lr': 7.5164744772254755e-06, 'weight_decay': 5.320067635939032e-06, 'epochs': 256, 'loss': 'mse', 'optimizer': 'adam', 'graph_mode': 'off', 'use_snp_selection': True, 'num_snps': 41169}. Best is trial 23 with value: 0.2960536708497362.
[I 2025-12-05 19:47:40,827] Trial 29 finished with value: 0.29525451949721315 and parameters: {'model_type': 'mlp', 'hidden_dims': '[128, 64]', 'dropout': 0.2868492035950917, 'batch_norm': False, 'lr': 7.6088254603734275e-06, 'weight_decay': 4.2084880778162426e-05, 'epochs': 243, 'loss': 'mse', 'optimizer': 'adam', 'graph_mode': 'off', 'use_snp_selection': True, 'num_snps': 39980}. Best is trial 23 with value: 0.2960536708497362.
[I 2025-12-05 19:48:13,103] Trial 30 finished with value: 0.27850727574518747 and parameters: {'model_type': 'mlp', 'hidden_dims': '[128, 64]', 'dropout': 0.3734690276583029, 'batch_norm': False, 'lr': 2.684310301633202e-06, 'weight_decay': 7.655333274974744e-05, 'epochs': 232, 'loss': 'mse', 'optimizer': 'adam', 'graph_mode': 'off', 'use_snp_selection': True, 'num_snps': 24252}. Best is trial 23 with value: 0.2960536708497362.
[I 2025-12-05 19:48:53,493] Trial 31 finished with value: 0.2923869727487251 and parameters: {'model_type': 'mlp', 'hidden_dims': '[128, 64]', 'dropout': 0.28343839023417244, 'batch_norm': False, 'lr': 8.306434000616183e-06, 'weight_decay': 7.514606810428229e-05, 'epochs': 251, 'loss': 'mse', 'optimizer': 'adam', 'graph_mode': 'off', 'use_snp_selection': True, 'num_snps': 40970}. Best is trial 23 with value: 0.2960536708497362.
[I 2025-12-05 19:49:33,619] Trial 32 finished with value: 0.2959920521774776 and parameters: {'model_type': 'mlp', 'hidden_dims': '[128, 64]', 'dropout': 0.35623149572534357, 'batch_norm': False, 'lr': 8.94613397548485e-06, 'weight_decay': 6.1537624490648665e-06, 'epochs': 273, 'loss': 'mse', 'optimizer': 'adam', 'graph_mode': 'off', 'use_snp_selection': True, 'num_snps': 38758}. Best is trial 23 with value: 0.2960536708497362.
[I 2025-12-05 19:50:10,049] Trial 33 finished with value: 0.28382172614707357 and parameters: {'model_type': 'mlp', 'hidden_dims': '[128, 64]', 'dropout': 0.3603644621111452, 'batch_norm': False, 'lr': 3.3700170954917316e-06, 'weight_decay': 3.976239345779476e-05, 'epochs': 219, 'loss': 'mse', 'optimizer': 'adam', 'graph_mode': 'off', 'use_snp_selection': True, 'num_snps': 34350}. Best is trial 23 with value: 0.2960536708497362.
[I 2025-12-05 19:50:55,735] Trial 34 finished with value: 0.2957970814247346 and parameters: {'model_type': 'mlp', 'hidden_dims': '[128, 64]', 'dropout': 0.4392320852601539, 'batch_norm': False, 'lr': 1.0600846497095665e-05, 'weight_decay': 9.370767933512817e-06, 'epochs': 278, 'loss': 'mse', 'optimizer': 'adam', 'graph_mode': 'off', 'use_snp_selection': True, 'num_snps': 50058}. Best is trial 23 with value: 0.2960536708497362.
[I 2025-12-05 19:51:42,620] Trial 35 finished with value: 0.2895944000076261 and parameters: {'model_type': 'mlp', 'hidden_dims': '[128, 64]', 'dropout': 0.4324369368679781, 'batch_norm': False, 'lr': 1.2157538274128433e-05, 'weight_decay': 1.1559154820429354e-05, 'epochs': 291, 'loss': 'mse', 'optimizer': 'adam', 'graph_mode': 'off', 'use_snp_selection': True, 'num_snps': 51722}. Best is trial 23 with value: 0.2960536708497362.
[I 2025-12-05 19:52:30,448] Trial 36 finished with value: 0.29276527334389124 and parameters: {'model_type': 'mlp', 'hidden_dims': '[128, 64]', 'dropout': 0.47085037364768745, 'batch_norm': False, 'lr': 5.460303368771661e-06, 'weight_decay': 8.216411559259343e-06, 'epochs': 344, 'loss': 'mse', 'optimizer': 'adam', 'graph_mode': 'off', 'use_snp_selection': True, 'num_snps': 48857}. Best is trial 23 with value: 0.2960536708497362.
[I 2025-12-05 19:53:04,817] Trial 37 finished with value: 0.28531522547397303 and parameters: {'model_type': 'mlp', 'hidden_dims': '[128, 64]', 'dropout': 0.4054610954358261, 'batch_norm': False, 'lr': 2.0963657460413472e-05, 'weight_decay': 8.215022109906701e-06, 'epochs': 286, 'loss': 'mse', 'optimizer': 'adam', 'graph_mode': 'off', 'use_snp_selection': True, 'num_snps': 26462}. Best is trial 23 with value: 0.2960536708497362.
[I 2025-12-05 19:53:50,814] Trial 38 finished with value: 0.2851671905019125 and parameters: {'model_type': 'mlp', 'hidden_dims': '[128, 64]', 'dropout': 0.42638794352163184, 'batch_norm': False, 'lr': 2.0986580360282224e-06, 'weight_decay': 1.8649028719850422e-06, 'epochs': 262, 'loss': 'mse', 'optimizer': 'adam', 'graph_mode': 'off', 'use_snp_selection': True, 'num_snps': 52378}. Best is trial 23 with value: 0.2960536708497362.
[I 2025-12-05 19:54:37,896] Trial 39 finished with value: 0.29376464634149546 and parameters: {'model_type': 'mlp', 'hidden_dims': '[256, 128]', 'dropout': 0.46176601689036534, 'batch_norm': False, 'lr': 4.379873543515667e-06, 'weight_decay': 1.7172551176898692e-05, 'epochs': 219, 'loss': 'mse', 'optimizer': 'adam', 'graph_mode': 'off', 'use_snp_selection': True, 'num_snps': 44698}. Best is trial 23 with value: 0.2960536708497362.
[I 2025-12-05 19:55:41,528] Trial 40 finished with value: 0.28178624727509954 and parameters: {'model_type': 'mlp', 'hidden_dims': '[512, 64]', 'dropout': 0.521075698600532, 'batch_norm': False, 'lr': 3.562254772050539e-05, 'weight_decay': 5.126154710715455e-06, 'epochs': 315, 'loss': 'mae', 'optimizer': 'adam', 'graph_mode': 'off', 'use_snp_selection': True, 'num_snps': 37309}. Best is trial 23 with value: 0.2960536708497362.
[I 2025-12-05 19:56:22,581] Trial 41 finished with value: 0.29813825651287335 and parameters: {'model_type': 'mlp', 'hidden_dims': '[128, 64]', 'dropout': 0.25217919246200293, 'batch_norm': False, 'lr': 8.61785486286107e-06, 'weight_decay': 4.174528979500633e-05, 'epochs': 268, 'loss': 'mse', 'optimizer': 'adam', 'graph_mode': 'off', 'use_snp_selection': True, 'num_snps': 41274}. Best is trial 41 with value: 0.29813825651287335.
[I 2025-12-05 19:57:05,103] Trial 42 finished with value: 0.29020206935547277 and parameters: {'model_type': 'mlp', 'hidden_dims': '[128, 64]', 'dropout': 0.20836408473453097, 'batch_norm': False, 'lr': 1.1384544900440683e-05, 'weight_decay': 2.9378390750021416e-05, 'epochs': 272, 'loss': 'mse', 'optimizer': 'adam', 'graph_mode': 'off', 'use_snp_selection': True, 'num_snps': 43270}. Best is trial 41 with value: 0.29813825651287335.
[I 2025-12-05 19:57:58,589] Trial 43 finished with value: 0.2773496046352611 and parameters: {'model_type': 'mlp', 'hidden_dims': '[512, 128]', 'dropout': 0.24957766105045598, 'batch_norm': False, 'lr': 1.7877311646299114e-05, 'weight_decay': 0.00010462315074603262, 'epochs': 301, 'loss': 'mse', 'optimizer': 'adam', 'graph_mode': 'off', 'use_snp_selection': True, 'num_snps': 29257}. Best is trial 41 with value: 0.29813825651287335.
[I 2025-12-05 19:58:39,693] Trial 44 finished with value: 0.28896850186702405 and parameters: {'model_type': 'mlp', 'hidden_dims': '[128, 64]', 'dropout': 0.2606221197311461, 'batch_norm': False, 'lr': 9.30056221114215e-06, 'weight_decay': 0.00019420605492074806, 'epochs': 330, 'loss': 'mse', 'optimizer': 'adam', 'graph_mode': 'off', 'use_snp_selection': True, 'num_snps': 36565}. Best is trial 41 with value: 0.29813825651287335.
[I 2025-12-05 19:59:23,762] Trial 45 finished with value: 0.29477370849969053 and parameters: {'model_type': 'mlp', 'hidden_dims': '[128, 64]', 'dropout': 0.35909885128456376, 'batch_norm': False, 'lr': 5.542190357178388e-06, 'weight_decay': 1.6850813507247676e-05, 'epochs': 274, 'loss': 'mse', 'optimizer': 'adam', 'graph_mode': 'off', 'use_snp_selection': True, 'num_snps': 46541}. Best is trial 41 with value: 0.29813825651287335.
[I 2025-12-05 20:00:32,865] Trial 46 finished with value: 0.28251234627280847 and parameters: {'model_type': 'mlp', 'hidden_dims': '[512, 128]', 'dropout': 0.12722133969968707, 'batch_norm': False, 'lr': 2.6166045856350208e-05, 'weight_decay': 1.7397359428225022e-06, 'epochs': 228, 'loss': 'mse', 'optimizer': 'adam', 'graph_mode': 'off', 'use_snp_selection': True, 'num_snps': 52126}. Best is trial 41 with value: 0.29813825651287335.
[I 2025-12-05 20:00:55,655] Trial 47 finished with value: 0.2595153420763682 and parameters: {'model_type': 'mlp', 'hidden_dims': '[512, 64]', 'dropout': 0.38564338392716346, 'batch_norm': False, 'lr': 4.6628434423909906e-05, 'weight_decay': 2.3916608737423996e-06, 'epochs': 188, 'loss': 'mae', 'optimizer': 'adam', 'graph_mode': 'off', 'use_snp_selection': True, 'num_snps': 2313}. Best is trial 41 with value: 0.29813825651287335.
[I 2025-12-05 20:01:46,882] Trial 48 finished with value: 0.29613153985062574 and parameters: {'model_type': 'mlp', 'hidden_dims': '[256, 128, 64]', 'dropout': 0.17808971499853038, 'batch_norm': False, 'lr': 4.048184988313075e-06, 'weight_decay': 0.0004359283256572386, 'epochs': 297, 'loss': 'mse', 'optimizer': 'adam', 'graph_mode': 'off', 'use_snp_selection': True, 'num_snps': 42654}. Best is trial 41 with value: 0.29813825651287335.
[I 2025-12-05 20:02:44,481] Trial 49 finished with value: 0.2787959009756996 and parameters: {'model_type': 'mlp', 'hidden_dims': '[256, 128, 64]', 'dropout': 0.1711110252143507, 'batch_norm': False, 'lr': 1.397777939102245e-06, 'weight_decay': 0.0008918976942371614, 'epochs': 306, 'loss': 'mse', 'optimizer': 'adam', 'graph_mode': 'off', 'use_snp_selection': True, 'num_snps': 51123}. Best is trial 41 with value: 0.29813825651287335.
[I 2025-12-05 20:03:53,633] Trial 50 finished with value: 0.29173133990072253 and parameters: {'model_type': 'mlp', 'hidden_dims': '[512, 128]', 'dropout': 0.1917588286418651, 'batch_norm': False, 'lr': 3.133441147187937e-06, 'weight_decay': 0.00043422448906526114, 'epochs': 289, 'loss': 'mse', 'optimizer': 'adam', 'graph_mode': 'off', 'use_snp_selection': True, 'num_snps': 44224}. Best is trial 41 with value: 0.29813825651287335.
[I 2025-12-05 20:04:40,415] Trial 51 finished with value: 0.3005070042178704 and parameters: {'model_type': 'mlp', 'hidden_dims': '[256, 128, 64]', 'dropout': 0.22386481044116088, 'batch_norm': False, 'lr': 4.11046144475266e-06, 'weight_decay': 0.0005484259879454044, 'epochs': 264, 'loss': 'mse', 'optimizer': 'adam', 'graph_mode': 'off', 'use_snp_selection': True, 'num_snps': 38798}. Best is trial 51 with value: 0.3005070042178704.
[I 2025-12-05 20:05:29,303] Trial 52 finished with value: 0.28654119837963343 and parameters: {'model_type': 'mlp', 'hidden_dims': '[256, 128, 64]', 'dropout': 0.22677583797776343, 'batch_norm': False, 'lr': 1.949358870217066e-06, 'weight_decay': 0.0005053295550463561, 'epochs': 327, 'loss': 'mse', 'optimizer': 'adam', 'graph_mode': 'off', 'use_snp_selection': True, 'num_snps': 37730}. Best is trial 51 with value: 0.3005070042178704.
[I 2025-12-05 20:06:11,142] Trial 53 finished with value: 0.2944268362600172 and parameters: {'model_type': 'mlp', 'hidden_dims': '[256, 128, 64]', 'dropout': 0.13036278620974182, 'batch_norm': False, 'lr': 3.989931766513275e-06, 'weight_decay': 0.00019568821682330908, 'epochs': 267, 'loss': 'mse', 'optimizer': 'adam', 'graph_mode': 'off', 'use_snp_selection': True, 'num_snps': 31132}. Best is trial 51 with value: 0.3005070042178704.
[I 2025-12-05 20:06:56,056] Trial 54 finished with value: 0.2965396367146431 and parameters: {'model_type': 'mlp', 'hidden_dims': '[256, 128, 64]', 'dropout': 0.17728729777354613, 'batch_norm': False, 'lr': 5.437797228924789e-06, 'weight_decay': 0.00024325743596766844, 'epochs': 299, 'loss': 'mse', 'optimizer': 'adam', 'graph_mode': 'off', 'use_snp_selection': True, 'num_snps': 34315}. Best is trial 51 with value: 0.3005070042178704.
[I 2025-12-05 20:07:41,202] Trial 55 finished with value: 0.2739578778059795 and parameters: {'model_type': 'mlp', 'hidden_dims': '[256, 128, 64]', 'dropout': 0.17641108221719937, 'batch_norm': False, 'lr': 2.4294923227098264e-06, 'weight_decay': 0.0005607379536621204, 'epochs': 306, 'loss': 'mae', 'optimizer': 'adam', 'graph_mode': 'off', 'use_snp_selection': True, 'num_snps': 34040}. Best is trial 51 with value: 0.3005070042178704.
[I 2025-12-05 20:08:26,900] Trial 56 finished with value: 0.2929856676999015 and parameters: {'model_type': 'mlp', 'hidden_dims': '[256, 128, 64]', 'dropout': 0.2116330431060989, 'batch_norm': False, 'lr': 5.217398491765057e-06, 'weight_decay': 0.00014953695492502173, 'epochs': 320, 'loss': 'mse', 'optimizer': 'adam', 'graph_mode': 'off', 'use_snp_selection': True, 'num_snps': 33314}. Best is trial 51 with value: 0.3005070042178704.
[I 2025-12-05 20:09:06,303] Trial 57 finished with value: 0.2597278519533299 and parameters: {'model_type': 'mlp', 'hidden_dims': '[256, 128, 64]', 'dropout': 0.13805413776622583, 'batch_norm': True, 'lr': 7.154553184060192e-06, 'weight_decay': 0.000298489556085547, 'epochs': 245, 'loss': 'mse', 'optimizer': 'adam', 'graph_mode': 'off', 'use_snp_selection': True, 'num_snps': 28883}. Best is trial 51 with value: 0.3005070042178704.
[I 2025-12-05 20:09:37,985] Trial 58 finished with value: 0.2914848367608151 and parameters: {'model_type': 'mlp', 'hidden_dims': '[256, 128, 64]', 'dropout': 0.16617577391783261, 'batch_norm': False, 'lr': 1.648466162985693e-06, 'weight_decay': 0.0007425230314572646, 'epochs': 297, 'loss': 'mse', 'optimizer': 'adam', 'graph_mode': 'off', 'use_snp_selection': False}. Best is trial 51 with value: 0.3005070042178704.
[I 2025-12-05 20:10:28,381] Trial 59 finished with value: 0.28099853634930233 and parameters: {'model_type': 'mlp', 'hidden_dims': '[256, 128, 64]', 'dropout': 0.1193705298493429, 'batch_norm': False, 'lr': 1.4452877914111293e-05, 'weight_decay': 0.00038637417663612823, 'epochs': 281, 'loss': 'mae', 'optimizer': 'adam', 'graph_mode': 'off', 'use_snp_selection': True, 'num_snps': 43270}. Best is trial 51 with value: 0.3005070042178704.
[I 2025-12-05 20:11:17,128] Trial 60 finished with value: 0.2926489359268195 and parameters: {'model_type': 'mlp', 'hidden_dims': '[256, 128, 64]', 'dropout': 0.21857994174582698, 'batch_norm': False, 'lr': 6.37968134115985e-06, 'weight_decay': 0.0002380099742728855, 'epochs': 344, 'loss': 'mse', 'optimizer': 'adam', 'graph_mode': 'off', 'use_snp_selection': True, 'num_snps': 35767}. Best is trial 51 with value: 0.3005070042178704.
[I 2025-12-05 20:12:17,779] Trial 61 finished with value: 0.28455895288941735 and parameters: {'model_type': 'mlp', 'hidden_dims': '[512, 128]', 'dropout': 0.19649497311197628, 'batch_norm': False, 'lr': 9.689890744469815e-06, 'weight_decay': 0.0007172450116580676, 'epochs': 260, 'loss': 'mse', 'optimizer': 'adam', 'graph_mode': 'off', 'use_snp_selection': True, 'num_snps': 39674}. Best is trial 51 with value: 0.3005070042178704.
[I 2025-12-05 20:13:05,998] Trial 62 finished with value: 0.29340526709022596 and parameters: {'model_type': 'mlp', 'hidden_dims': '[256, 128]', 'dropout': 0.18305349647251498, 'batch_norm': False, 'lr': 4.398033877265387e-06, 'weight_decay': 0.0001236806901678117, 'epochs': 152, 'loss': 'mse', 'optimizer': 'adam', 'graph_mode': 'off', 'use_snp_selection': True, 'num_snps': 55197}. Best is trial 51 with value: 0.3005070042178704.
[I 2025-12-05 20:13:58,111] Trial 63 finished with value: 0.2850837784403447 and parameters: {'model_type': 'mlp', 'hidden_dims': '[256, 128, 64]', 'dropout': 0.14836641583619936, 'batch_norm': False, 'lr': 1.135973865890137e-05, 'weight_decay': 2.7081180269324893e-05, 'epochs': 280, 'loss': 'mse', 'optimizer': 'adam', 'graph_mode': 'off', 'use_snp_selection': True, 'num_snps': 45241}. Best is trial 51 with value: 0.3005070042178704.
[I 2025-12-05 20:14:49,117] Trial 64 finished with value: 0.2612127840993842 and parameters: {'model_type': 'mlp', 'hidden_dims': '[256, 128, 64]', 'dropout': 0.3036682807582063, 'batch_norm': False, 'lr': 1.083602449748085e-06, 'weight_decay': 0.00032986292951427804, 'epochs': 296, 'loss': 'mse', 'optimizer': 'adam', 'graph_mode': 'off', 'use_snp_selection': True, 'num_snps': 42258}. Best is trial 51 with value: 0.3005070042178704.
[I 2025-12-05 20:15:50,279] Trial 65 finished with value: 0.2764474332794745 and parameters: {'model_type': 'mlp', 'hidden_dims': '[512, 64]', 'dropout': 0.24582924460037348, 'batch_norm': True, 'lr': 3.0819829146862025e-06, 'weight_decay': 6.144741541497618e-05, 'epochs': 271, 'loss': 'mse', 'optimizer': 'adam', 'graph_mode': 'off', 'use_snp_selection': True, 'num_snps': 38801}. Best is trial 51 with value: 0.3005070042178704.
