[I 2025-12-05 15:08:12,826] Trial 146 finished with value: 0.013382490038720876 and parameters: {'model_type': 'mlp', 'hidden_dims': '[512, 64]', 'dropout': 0.33695910605489515, 'batch_norm': False, 'lr': 0.0005612124597258745, 'weight_decay': 1.4308023649772335e-05, 'epochs': 65, 'loss': 'mae', 'optimizer': 'adam', 'graph_mode': 'off', 'use_snp_selection': True, 'num_snps': 11017}. Best is trial 124 with value: 0.08547736083653104.
[I 2025-12-05 15:08:13,550] Trial 147 finished with value: 0.04871034305678004 and parameters: {'model_type': 'mlp', 'hidden_dims': '[512, 64]', 'dropout': 0.36376155671551463, 'batch_norm': False, 'lr': 0.0006521080926690928, 'weight_decay': 2.1693130898380623e-05, 'epochs': 74, 'loss': 'mae', 'optimizer': 'adam', 'graph_mode': 'off', 'use_snp_selection': True, 'num_snps': 6003}. Best is trial 124 with value: 0.08547736083653104.
[I 2025-12-05 15:08:14,376] Trial 148 finished with value: 0.050809370112743786 and parameters: {'model_type': 'mlp', 'hidden_dims': '[512, 64]', 'dropout': 0.33069637582600925, 'batch_norm': False, 'lr': 0.0008274091847722008, 'weight_decay': 4.325324807700006e-05, 'epochs': 66, 'loss': 'mae', 'optimizer': 'adam', 'graph_mode': 'off', 'use_snp_selection': True, 'num_snps': 8705}. Best is trial 124 with value: 0.08547736083653104.
[I 2025-12-05 15:08:15,130] Trial 149 finished with value: 0.05077655796608985 and parameters: {'model_type': 'mlp', 'hidden_dims': '[512, 64]', 'dropout': 0.32267219845465295, 'batch_norm': False, 'lr': 0.0008335864144196762, 'weight_decay': 4.2093493414555706e-05, 'epochs': 87, 'loss': 'mae', 'optimizer': 'adam', 'graph_mode': 'off', 'use_snp_selection': True, 'num_snps': 5458}. Best is trial 124 with value: 0.08547736083653104.
[I 2025-12-05 15:08:17,536] Trial 0 finished with value: 0.045249438553327144 and parameters: {'model_type': 'mlp', 'hidden_dims': '[128, 64]', 'dropout': 0.199031432379812, 'batch_norm': True, 'lr': 1.8408544111075837e-06, 'weight_decay': 5.5136510071208614e-05, 'epochs': 336, 'loss': 'mae', 'optimizer': 'adam', 'graph_mode': 'off', 'use_snp_selection': True, 'num_snps': 43862}. Best is trial 0 with value: 0.045249438553327144.
[I 2025-12-05 15:08:18,823] Trial 1 finished with value: 0.10345333979538991 and parameters: {'model_type': 'mlp', 'hidden_dims': '[256, 128]', 'dropout': 0.4370668075331726, 'batch_norm': True, 'lr': 7.133471581159139e-05, 'weight_decay': 1.128633586803549e-05, 'epochs': 242, 'loss': 'mae', 'optimizer': 'adam', 'graph_mode': 'off', 'use_snp_selection': False}. Best is trial 1 with value: 0.10345333979538991.
[I 2025-12-05 15:08:19,947] Trial 2 finished with value: 0.0311671637671143 and parameters: {'model_type': 'mlp', 'hidden_dims': '[256, 128, 64]', 'dropout': 0.41314357415569625, 'batch_norm': False, 'lr': 3.952233718592101e-06, 'weight_decay': 0.00026754769258252603, 'epochs': 149, 'loss': 'mse', 'optimizer': 'adam', 'graph_mode': 'off', 'use_snp_selection': True, 'num_snps': 11571}. Best is trial 1 with value: 0.10345333979538991.
[I 2025-12-05 15:08:22,261] Trial 3 finished with value: 0.03588929656765134 and parameters: {'model_type': 'mlp', 'hidden_dims': '[512, 64]', 'dropout': 0.5938127374509361, 'batch_norm': False, 'lr': 5.67704586114731e-06, 'weight_decay': 2.4518087630137052e-05, 'epochs': 320, 'loss': 'mae', 'optimizer': 'adam', 'graph_mode': 'off', 'use_snp_selection': False}. Best is trial 1 with value: 0.10345333979538991.
[I 2025-12-05 15:08:24,780] Trial 4 finished with value: 0.005625002127020549 and parameters: {'model_type': 'mlp', 'hidden_dims': '[512, 128]', 'dropout': 0.25746343592134413, 'batch_norm': True, 'lr': 1.3467657668402788e-06, 'weight_decay': 0.00033087251918647806, 'epochs': 277, 'loss': 'mse', 'optimizer': 'adam', 'graph_mode': 'off', 'use_snp_selection': True, 'num_snps': 36675}. Best is trial 1 with value: 0.10345333979538991.
[I 2025-12-05 15:08:26,784] Trial 5 finished with value: 0.067169063395976 and parameters: {'model_type': 'mlp', 'hidden_dims': '[512, 64]', 'dropout': 0.38275350994408375, 'batch_norm': True, 'lr': 1.5586664309232824e-06, 'weight_decay': 0.0008227664668621182, 'epochs': 145, 'loss': 'mae', 'optimizer': 'adam', 'graph_mode': 'off', 'use_snp_selection': True, 'num_snps': 32148}. Best is trial 1 with value: 0.10345333979538991.
[I 2025-12-05 15:08:27,965] Trial 6 finished with value: 0.1085349262486941 and parameters: {'model_type': 'mlp', 'hidden_dims': '[256, 128]', 'dropout': 0.3930109900265879, 'batch_norm': False, 'lr': 4.892964372128395e-05, 'weight_decay': 1.5809549317992182e-06, 'epochs': 199, 'loss': 'mse', 'optimizer': 'adam', 'graph_mode': 'off', 'use_snp_selection': False}. Best is trial 6 with value: 0.1085349262486941.
[I 2025-12-05 15:08:29,216] Trial 7 finished with value: 0.11844736746393306 and parameters: {'model_type': 'mlp', 'hidden_dims': '[512, 256]', 'dropout': 0.15343979219678458, 'batch_norm': True, 'lr': 6.234003099047341e-05, 'weight_decay': 3.894760610535477e-07, 'epochs': 97, 'loss': 'mse', 'optimizer': 'adam', 'graph_mode': 'off', 'use_snp_selection': False}. Best is trial 7 with value: 0.11844736746393306.
[I 2025-12-05 15:08:31,493] Trial 8 finished with value: 0.12183592227197806 and parameters: {'model_type': 'mlp', 'hidden_dims': '[512, 128]', 'dropout': 0.10743001231661406, 'batch_norm': True, 'lr': 0.00023728538449271062, 'weight_decay': 1.7629071578048637e-05, 'epochs': 312, 'loss': 'mae', 'optimizer': 'adam', 'graph_mode': 'off', 'use_snp_selection': False}. Best is trial 8 with value: 0.12183592227197806.
[I 2025-12-05 15:08:33,096] Trial 9 finished with value: 0.09708051994589845 and parameters: {'model_type': 'mlp', 'hidden_dims': '[512, 64]', 'dropout': 0.14505336736221927, 'batch_norm': True, 'lr': 5.8619638388111826e-05, 'weight_decay': 6.200156172669308e-07, 'epochs': 175, 'loss': 'mse', 'optimizer': 'adam', 'graph_mode': 'off', 'use_snp_selection': False}. Best is trial 8 with value: 0.12183592227197806.
[I 2025-12-05 15:08:34,114] Trial 10 finished with value: 0.00381641749453193 and parameters: {'model_type': 'mlp', 'hidden_dims': '[512, 128]', 'dropout': 0.2800030442581858, 'batch_norm': False, 'lr': 0.0004919806695968258, 'weight_decay': 2.9953888095455486e-06, 'epochs': 55, 'loss': 'mae', 'optimizer': 'adam', 'graph_mode': 'off', 'use_snp_selection': False}. Best is trial 8 with value: 0.12183592227197806.
[I 2025-12-05 15:08:35,229] Trial 11 finished with value: 0.10461647603529896 and parameters: {'model_type': 'mlp', 'hidden_dims': '[512, 256]', 'dropout': 0.10095648685224448, 'batch_norm': True, 'lr': 0.0003926892266729099, 'weight_decay': 3.172181990533228e-07, 'epochs': 70, 'loss': 'mse', 'optimizer': 'adam', 'graph_mode': 'off', 'use_snp_selection': False}. Best is trial 8 with value: 0.12183592227197806.
[I 2025-12-05 15:08:36,557] Trial 12 finished with value: 0.10870009550109086 and parameters: {'model_type': 'mlp', 'hidden_dims': '[512, 256]', 'dropout': 0.18206399419301494, 'batch_norm': True, 'lr': 0.00026576228959612443, 'weight_decay': 1.3081036432574914e-07, 'epochs': 115, 'loss': 'mae', 'optimizer': 'adam', 'graph_mode': 'off', 'use_snp_selection': False}. Best is trial 8 with value: 0.12183592227197806.
[I 2025-12-05 15:08:38,447] Trial 13 finished with value: 0.09797436392533701 and parameters: {'model_type': 'mlp', 'hidden_dims': '[512, 256]', 'dropout': 0.28178980110198326, 'batch_norm': True, 'lr': 0.0001448400953749671, 'weight_decay': 3.475237872468419e-06, 'epochs': 232, 'loss': 'mse', 'optimizer': 'adam', 'graph_mode': 'off', 'use_snp_selection': False}. Best is trial 8 with value: 0.12183592227197806.
[I 2025-12-05 15:08:39,662] Trial 14 finished with value: 0.08838267519743591 and parameters: {'model_type': 'mlp', 'hidden_dims': '[512, 128]', 'dropout': 0.12319334351899142, 'batch_norm': True, 'lr': 1.6126431293848547e-05, 'weight_decay': 6.0578250711704925e-05, 'epochs': 93, 'loss': 'mse', 'optimizer': 'adam', 'graph_mode': 'off', 'use_snp_selection': False}. Best is trial 8 with value: 0.12183592227197806.
[I 2025-12-05 15:08:40,689] Trial 15 finished with value: 0.08266934646830697 and parameters: {'model_type': 'mlp', 'hidden_dims': '[128, 64]', 'dropout': 0.2144644905818855, 'batch_norm': True, 'lr': 2.002944590579291e-05, 'weight_decay': 7.236536090132001e-06, 'epochs': 297, 'loss': 'mae', 'optimizer': 'adam', 'graph_mode': 'off', 'use_snp_selection': False}. Best is trial 8 with value: 0.12183592227197806.
[I 2025-12-05 15:08:42,079] Trial 16 finished with value: 0.10036597016512051 and parameters: {'model_type': 'mlp', 'hidden_dims': '[256, 128, 64]', 'dropout': 0.558513902174278, 'batch_norm': True, 'lr': 0.0001512632734045256, 'weight_decay': 7.089073588272327e-07, 'epochs': 258, 'loss': 'mae', 'optimizer': 'adam', 'graph_mode': 'off', 'use_snp_selection': False}. Best is trial 8 with value: 0.12183592227197806.
[I 2025-12-05 15:08:43,828] Trial 17 finished with value: 0.10000324220566104 and parameters: {'model_type': 'mlp', 'hidden_dims': '[512, 128]', 'dropout': 0.32888830259108426, 'batch_norm': True, 'lr': 0.000906375209920231, 'weight_decay': 2.5157504144511443e-05, 'epochs': 202, 'loss': 'mse', 'optimizer': 'adam', 'graph_mode': 'off', 'use_snp_selection': False}. Best is trial 8 with value: 0.12183592227197806.
[I 2025-12-05 15:08:46,770] Trial 18 finished with value: 0.1069417950570809 and parameters: {'model_type': 'mlp', 'hidden_dims': '[512, 256]', 'dropout': 0.5005423020298181, 'batch_norm': False, 'lr': 0.00010178167867639588, 'weight_decay': 2.427593612355222e-07, 'epochs': 112, 'loss': 'mae', 'optimizer': 'adam', 'graph_mode': 'off', 'use_snp_selection': True, 'num_snps': 58241}. Best is trial 8 with value: 0.12183592227197806.
[I 2025-12-05 15:08:48,334] Trial 19 finished with value: 0.08880476838283374 and parameters: {'model_type': 'mlp', 'hidden_dims': '[512, 128]', 'dropout': 0.15554717684689037, 'batch_norm': True, 'lr': 2.212519359055588e-05, 'weight_decay': 1.0530737528724215e-06, 'epochs': 156, 'loss': 'mse', 'optimizer': 'adam', 'graph_mode': 'off', 'use_snp_selection': False}. Best is trial 8 with value: 0.12183592227197806.
[I 2025-12-05 15:08:49,290] Trial 20 finished with value: 0.03081373426549694 and parameters: {'model_type': 'mlp', 'hidden_dims': '[512, 256]', 'dropout': 0.2263663991477394, 'batch_norm': True, 'lr': 9.550837657878982e-06, 'weight_decay': 6.363898158648573e-06, 'epochs': 43, 'loss': 'mse', 'optimizer': 'adam', 'graph_mode': 'off', 'use_snp_selection': False}. Best is trial 8 with value: 0.12183592227197806.
[I 2025-12-05 15:08:50,646] Trial 21 finished with value: 0.12111762509297892 and parameters: {'model_type': 'mlp', 'hidden_dims': '[512, 256]', 'dropout': 0.1760549570982352, 'batch_norm': True, 'lr': 0.0002653433610323151, 'weight_decay': 1.0421381452602179e-07, 'epochs': 118, 'loss': 'mae', 'optimizer': 'adam', 'graph_mode': 'off', 'use_snp_selection': False}. Best is trial 8 with value: 0.12183592227197806.
[I 2025-12-05 15:08:51,831] Trial 22 finished with value: 0.11512573569687115 and parameters: {'model_type': 'mlp', 'hidden_dims': '[512, 256]', 'dropout': 0.16378419421054377, 'batch_norm': True, 'lr': 0.00021838022052284747, 'weight_decay': 1.19094083920789e-07, 'epochs': 89, 'loss': 'mae', 'optimizer': 'adam', 'graph_mode': 'off', 'use_snp_selection': False}. Best is trial 8 with value: 0.12183592227197806.
[I 2025-12-05 15:08:53,211] Trial 23 finished with value: 0.11599660274587117 and parameters: {'model_type': 'mlp', 'hidden_dims': '[512, 256]', 'dropout': 0.11115049940420715, 'batch_norm': True, 'lr': 0.0008962709224037021, 'weight_decay': 3.2666120737763034e-07, 'epochs': 128, 'loss': 'mae', 'optimizer': 'adam', 'graph_mode': 'off', 'use_snp_selection': False}. Best is trial 8 with value: 0.12183592227197806.
[I 2025-12-05 15:08:54,860] Trial 24 finished with value: 0.10735669652200842 and parameters: {'model_type': 'mlp', 'hidden_dims': '[512, 256]', 'dropout': 0.32169788581351544, 'batch_norm': True, 'lr': 3.5720896500451895e-05, 'weight_decay': 1.1824232634687951e-07, 'epochs': 184, 'loss': 'mae', 'optimizer': 'adam', 'graph_mode': 'off', 'use_snp_selection': False}. Best is trial 8 with value: 0.12183592227197806.
[I 2025-12-05 15:08:55,713] Trial 25 finished with value: 0.10713958388345554 and parameters: {'model_type': 'mlp', 'hidden_dims': '[256, 128, 64]', 'dropout': 0.2190693272481038, 'batch_norm': True, 'lr': 0.00040699164619160234, 'weight_decay': 1.7482430011963154e-06, 'epochs': 79, 'loss': 'mae', 'optimizer': 'adam', 'graph_mode': 'off', 'use_snp_selection': False}. Best is trial 8 with value: 0.12183592227197806.
[I 2025-12-05 15:08:56,899] Trial 26 finished with value: 0.09144696998105828 and parameters: {'model_type': 'mlp', 'hidden_dims': '[256, 128]', 'dropout': 0.14291930259320273, 'batch_norm': True, 'lr': 0.00013034791925775152, 'weight_decay': 1.5609481603882106e-05, 'epochs': 345, 'loss': 'mae', 'optimizer': 'adam', 'graph_mode': 'off', 'use_snp_selection': True, 'num_snps': 3842}. Best is trial 8 with value: 0.12183592227197806.
[I 2025-12-05 15:08:57,616] Trial 27 finished with value: 0.11719707501767 and parameters: {'model_type': 'mlp', 'hidden_dims': '[128, 64]', 'dropout': 0.17817081932983528, 'batch_norm': False, 'lr': 0.0002641652316942584, 'weight_decay': 8.411503092769373e-05, 'epochs': 103, 'loss': 'mae', 'optimizer': 'adam', 'graph_mode': 'off', 'use_snp_selection': False}. Best is trial 8 with value: 0.12183592227197806.
[I 2025-12-05 15:08:59,533] Trial 28 finished with value: 0.10792440320102518 and parameters: {'model_type': 'mlp', 'hidden_dims': '[512, 128]', 'dropout': 0.10094649135079681, 'batch_norm': True, 'lr': 0.00010118004692841974, 'weight_decay': 2.3047001304777736e-07, 'epochs': 228, 'loss': 'mse', 'optimizer': 'adam', 'graph_mode': 'off', 'use_snp_selection': False}. Best is trial 8 with value: 0.12183592227197806.
[I 2025-12-05 15:09:01,194] Trial 29 finished with value: 0.10185816307580908 and parameters: {'model_type': 'mlp', 'hidden_dims': '[128, 64]', 'dropout': 0.19678335547921874, 'batch_norm': True, 'lr': 0.0005388560200940643, 'weight_decay': 0.00012363202694194868, 'epochs': 323, 'loss': 'mae', 'optimizer': 'adam', 'graph_mode': 'off', 'use_snp_selection': True, 'num_snps': 19468}. Best is trial 8 with value: 0.12183592227197806.
[I 2025-12-05 15:09:02,603] Trial 30 finished with value: 0.10715654881619768 and parameters: {'model_type': 'mlp', 'hidden_dims': '[512, 256]', 'dropout': 0.2523135802350327, 'batch_norm': True, 'lr': 0.0001996039138787096, 'weight_decay': 4.817113677703904e-07, 'epochs': 129, 'loss': 'mae', 'optimizer': 'adam', 'graph_mode': 'off', 'use_snp_selection': False}. Best is trial 8 with value: 0.12183592227197806.
[I 2025-12-05 15:09:03,309] Trial 31 finished with value: 0.08388827223488386 and parameters: {'model_type': 'mlp', 'hidden_dims': '[128, 64]', 'dropout': 0.1748058519419537, 'batch_norm': False, 'lr': 0.00027907073437137206, 'weight_decay': 4.562630290780423e-05, 'epochs': 93, 'loss': 'mae', 'optimizer': 'adam', 'graph_mode': 'off', 'use_snp_selection': False}. Best is trial 8 with value: 0.12183592227197806.
[I 2025-12-05 15:09:04,038] Trial 32 finished with value: 0.1113825350949762 and parameters: {'model_type': 'mlp', 'hidden_dims': '[128, 64]', 'dropout': 0.13869667124176288, 'batch_norm': False, 'lr': 7.908504796345224e-05, 'weight_decay': 7.220257330211234e-05, 'epochs': 109, 'loss': 'mae', 'optimizer': 'adam', 'graph_mode': 'off', 'use_snp_selection': False}. Best is trial 8 with value: 0.12183592227197806.
[I 2025-12-05 15:09:04,843] Trial 33 finished with value: 0.11857936516927535 and parameters: {'model_type': 'mlp', 'hidden_dims': '[128, 64]', 'dropout': 0.19547990147536237, 'batch_norm': False, 'lr': 0.000630662557483804, 'weight_decay': 0.00015303666203148733, 'epochs': 163, 'loss': 'mae', 'optimizer': 'adam', 'graph_mode': 'off', 'use_snp_selection': False}. Best is trial 8 with value: 0.12183592227197806.
[I 2025-12-05 15:09:05,639] Trial 34 finished with value: 0.08317056769276915 and parameters: {'model_type': 'mlp', 'hidden_dims': '[128, 64]', 'dropout': 0.23642534976085897, 'batch_norm': False, 'lr': 0.0005696546182573269, 'weight_decay': 0.00033155892219993813, 'epochs': 158, 'loss': 'mae', 'optimizer': 'adam', 'graph_mode': 'off', 'use_snp_selection': False}. Best is trial 8 with value: 0.12183592227197806.
[I 2025-12-05 15:09:06,827] Trial 35 finished with value: 0.08954672683544787 and parameters: {'model_type': 'mlp', 'hidden_dims': '[256, 128]', 'dropout': 0.4544759458916865, 'batch_norm': False, 'lr': 0.000751619951585378, 'weight_decay': 0.0009119597082290585, 'epochs': 210, 'loss': 'mae', 'optimizer': 'adam', 'graph_mode': 'off', 'use_snp_selection': False}. Best is trial 8 with value: 0.12183592227197806.
[I 2025-12-05 15:09:10,205] Trial 36 finished with value: 0.10537832860106987 and parameters: {'model_type': 'mlp', 'hidden_dims': '[512, 64]', 'dropout': 0.2920639680684033, 'batch_norm': False, 'lr': 3.247085102704309e-05, 'weight_decay': 2.6918611992435812e-05, 'epochs': 172, 'loss': 'mae', 'optimizer': 'adam', 'graph_mode': 'off', 'use_snp_selection': True, 'num_snps': 58661}. Best is trial 8 with value: 0.12183592227197806.
[I 2025-12-05 15:09:11,324] Trial 37 finished with value: 0.07839897063454411 and parameters: {'model_type': 'mlp', 'hidden_dims': '[256, 128, 64]', 'dropout': 0.20147684364268403, 'batch_norm': False, 'lr': 3.3843341254597788e-06, 'weight_decay': 1.2269875926613369e-05, 'epochs': 136, 'loss': 'mse', 'optimizer': 'adam', 'graph_mode': 'off', 'use_snp_selection': False}. Best is trial 8 with value: 0.12183592227197806.
[I 2025-12-05 15:09:13,009] Trial 38 finished with value: 0.10260516831443935 and parameters: {'model_type': 'mlp', 'hidden_dims': '[512, 128]', 'dropout': 0.12667182147752487, 'batch_norm': True, 'lr': 0.00039346159759211106, 'weight_decay': 0.00018281817027084634, 'epochs': 267, 'loss': 'mae', 'optimizer': 'adam', 'graph_mode': 'off', 'use_snp_selection': True, 'num_snps': 19911}. Best is trial 8 with value: 0.12183592227197806.
[I 2025-12-05 15:09:15,205] Trial 39 finished with value: 0.110976563012223 and parameters: {'model_type': 'mlp', 'hidden_dims': '[512, 256]', 'dropout': 0.25096476469497053, 'batch_norm': False, 'lr': 5.1711140161191084e-05, 'weight_decay': 0.000494866061743946, 'epochs': 298, 'loss': 'mse', 'optimizer': 'adam', 'graph_mode': 'off', 'use_snp_selection': False}. Best is trial 8 with value: 0.12183592227197806.
[I 2025-12-05 15:09:16,685] Trial 40 finished with value: 0.10222030711403773 and parameters: {'model_type': 'mlp', 'hidden_dims': '[512, 64]', 'dropout': 0.36217256579175006, 'batch_norm': True, 'lr': 0.0001879544223177932, 'weight_decay': 5.019728879267228e-06, 'epochs': 148, 'loss': 'mae', 'optimizer': 'adam', 'graph_mode': 'off', 'use_snp_selection': False}. Best is trial 8 with value: 0.12183592227197806.
[I 2025-12-05 15:09:17,364] Trial 41 finished with value: 0.08466969578088207 and parameters: {'model_type': 'mlp', 'hidden_dims': '[128, 64]', 'dropout': 0.18183416324219207, 'batch_norm': False, 'lr': 0.00028408600917573555, 'weight_decay': 8.862080872959378e-05, 'epochs': 63, 'loss': 'mae', 'optimizer': 'adam', 'graph_mode': 'off', 'use_snp_selection': False}. Best is trial 8 with value: 0.12183592227197806.
[I 2025-12-05 15:09:18,113] Trial 42 finished with value: 0.11402184140732483 and parameters: {'model_type': 'mlp', 'hidden_dims': '[128, 64]', 'dropout': 0.15890663948126835, 'batch_norm': False, 'lr': 0.000607286688949884, 'weight_decay': 0.00015759832673354455, 'epochs': 103, 'loss': 'mae', 'optimizer': 'adam', 'graph_mode': 'off', 'use_snp_selection': False}. Best is trial 8 with value: 0.12183592227197806.
[I 2025-12-05 15:09:18,924] Trial 43 finished with value: 0.0860768937795775 and parameters: {'model_type': 'mlp', 'hidden_dims': '[128, 64]', 'dropout': 0.19352959407094214, 'batch_norm': False, 'lr': 0.00034144763795176887, 'weight_decay': 3.9452485215247383e-05, 'epochs': 118, 'loss': 'mae', 'optimizer': 'adam', 'graph_mode': 'off', 'use_snp_selection': False}. Best is trial 8 with value: 0.12183592227197806.
[I 2025-12-05 15:09:19,809] Trial 44 finished with value: 0.11310979616642837 and parameters: {'model_type': 'mlp', 'hidden_dims': '[128, 64]', 'dropout': 0.12611743927596536, 'batch_norm': False, 'lr': 7.068834801336231e-05, 'weight_decay': 0.00010040081007592979, 'epochs': 171, 'loss': 'mae', 'optimizer': 'adam', 'graph_mode': 'off', 'use_snp_selection': False}. Best is trial 8 with value: 0.12183592227197806.
[I 2025-12-05 15:09:20,713] Trial 45 finished with value: 0.11885704421763507 and parameters: {'model_type': 'mlp', 'hidden_dims': '[256, 128]', 'dropout': 0.17332032025191754, 'batch_norm': False, 'lr': 0.00010621453475148429, 'weight_decay': 0.0005040495183563358, 'epochs': 77, 'loss': 'mae', 'optimizer': 'adam', 'graph_mode': 'off', 'use_snp_selection': False}. Best is trial 8 with value: 0.12183592227197806.
[I 2025-12-05 15:09:21,529] Trial 46 finished with value: 0.06479700578668841 and parameters: {'model_type': 'mlp', 'hidden_dims': '[256, 128]', 'dropout': 0.14691757535329306, 'batch_norm': False, 'lr': 0.00010752181397126454, 'weight_decay': 0.000277037480012027, 'epochs': 49, 'loss': 'mse', 'optimizer': 'adam', 'graph_mode': 'off', 'use_snp_selection': False}. Best is trial 8 with value: 0.12183592227197806.
[I 2025-12-05 15:09:22,402] Trial 47 finished with value: 0.061263651718601535 and parameters: {'model_type': 'mlp', 'hidden_dims': '[256, 128]', 'dropout': 0.2712946371127088, 'batch_norm': True, 'lr': 4.5257013991055714e-05, 'weight_decay': 0.0005853046967071862, 'epochs': 69, 'loss': 'mae', 'optimizer': 'adam', 'graph_mode': 'off', 'use_snp_selection': False}. Best is trial 8 with value: 0.12183592227197806.
