[I 2025-12-05 16:24:25,786] Trial 132 finished with value: 0.1918923448483304 and parameters: {'model_type': 'mlp', 'hidden_dims': '[512, 128]', 'dropout': 0.11859840544496085, 'batch_norm': True, 'lr': 0.0008096391359997533, 'weight_decay': 1.1041492591469025e-05, 'epochs': 297, 'loss': 'mae', 'optimizer': 'adam', 'graph_mode': 'off', 'use_snp_selection': False}. Best is trial 113 with value: 0.19443631717083304.
[I 2025-12-05 16:24:27,588] Trial 133 finished with value: 0.18937780109812657 and parameters: {'model_type': 'mlp', 'hidden_dims': '[512, 128]', 'dropout': 0.14928320203302303, 'batch_norm': True, 'lr': 0.0009981626011493015, 'weight_decay': 1.917318536429491e-05, 'epochs': 310, 'loss': 'mae', 'optimizer': 'adam', 'graph_mode': 'off', 'use_snp_selection': False}. Best is trial 113 with value: 0.19443631717083304.
[I 2025-12-05 16:24:29,433] Trial 134 finished with value: 0.17459267114818477 and parameters: {'model_type': 'mlp', 'hidden_dims': '[512, 128]', 'dropout': 0.11859828274027652, 'batch_norm': True, 'lr': 0.0009994537903438784, 'weight_decay': 2.083550103040479e-05, 'epochs': 310, 'loss': 'mae', 'optimizer': 'adam', 'graph_mode': 'off', 'use_snp_selection': False}. Best is trial 113 with value: 0.19443631717083304.
[I 2025-12-05 16:24:31,317] Trial 135 finished with value: 0.17024219260835557 and parameters: {'model_type': 'mlp', 'hidden_dims': '[512, 128]', 'dropout': 0.17762490538562464, 'batch_norm': True, 'lr': 0.00023839677378485703, 'weight_decay': 1.7261748659473306e-05, 'epochs': 317, 'loss': 'mae', 'optimizer': 'adam', 'graph_mode': 'off', 'use_snp_selection': False}. Best is trial 113 with value: 0.19443631717083304.
[I 2025-12-05 16:24:33,131] Trial 136 finished with value: 0.1728001615425102 and parameters: {'model_type': 'mlp', 'hidden_dims': '[512, 128]', 'dropout': 0.32718523732826726, 'batch_norm': True, 'lr': 0.0007184006049816341, 'weight_decay': 2.8178896023172485e-05, 'epochs': 303, 'loss': 'mae', 'optimizer': 'adam', 'graph_mode': 'off', 'use_snp_selection': False}. Best is trial 113 with value: 0.19443631717083304.
[I 2025-12-05 16:24:34,997] Trial 137 finished with value: 0.1630368373147921 and parameters: {'model_type': 'mlp', 'hidden_dims': '[512, 128]', 'dropout': 0.2278349550570235, 'batch_norm': True, 'lr': 0.0003332526889375373, 'weight_decay': 1.5063950017282242e-05, 'epochs': 329, 'loss': 'mae', 'optimizer': 'adam', 'graph_mode': 'off', 'use_snp_selection': False}. Best is trial 113 with value: 0.19443631717083304.
[I 2025-12-05 16:24:36,911] Trial 138 finished with value: 0.1808850147904178 and parameters: {'model_type': 'mlp', 'hidden_dims': '[512, 128]', 'dropout': 0.15741217910334038, 'batch_norm': True, 'lr': 0.0006337716536756117, 'weight_decay': 1.1508720759149074e-05, 'epochs': 340, 'loss': 'mse', 'optimizer': 'adam', 'graph_mode': 'off', 'use_snp_selection': False}. Best is trial 113 with value: 0.19443631717083304.
[I 2025-12-05 16:24:38,749] Trial 139 finished with value: 0.17473182320697944 and parameters: {'model_type': 'mlp', 'hidden_dims': '[512, 128]', 'dropout': 0.13820728520191433, 'batch_norm': True, 'lr': 0.0005360943381174681, 'weight_decay': 3.3955598754501454e-05, 'epochs': 311, 'loss': 'mae', 'optimizer': 'adam', 'graph_mode': 'off', 'use_snp_selection': False}. Best is trial 113 with value: 0.19443631717083304.
[I 2025-12-05 16:24:40,435] Trial 140 finished with value: 0.1627168622316133 and parameters: {'model_type': 'mlp', 'hidden_dims': '[512, 128]', 'dropout': 0.1281869238688964, 'batch_norm': False, 'lr': 0.0001412565713377556, 'weight_decay': 2.5004647291717625e-06, 'epochs': 281, 'loss': 'mae', 'optimizer': 'adam', 'graph_mode': 'off', 'use_snp_selection': False}. Best is trial 113 with value: 0.19443631717083304.
[I 2025-12-05 16:24:42,194] Trial 141 finished with value: 0.1756639455298222 and parameters: {'model_type': 'mlp', 'hidden_dims': '[512, 128]', 'dropout': 0.14973424162558205, 'batch_norm': True, 'lr': 0.000996022047501372, 'weight_decay': 5.555024087503445e-06, 'epochs': 299, 'loss': 'mae', 'optimizer': 'adam', 'graph_mode': 'off', 'use_snp_selection': False}. Best is trial 113 with value: 0.19443631717083304.
[I 2025-12-05 16:24:44,099] Trial 142 finished with value: 0.16697269822069274 and parameters: {'model_type': 'mlp', 'hidden_dims': '[512, 128]', 'dropout': 0.16649316786087753, 'batch_norm': True, 'lr': 0.0008462408741657391, 'weight_decay': 7.863200075898055e-06, 'epochs': 323, 'loss': 'mae', 'optimizer': 'adam', 'graph_mode': 'off', 'use_snp_selection': False}. Best is trial 113 with value: 0.19443631717083304.
[I 2025-12-05 16:24:45,865] Trial 143 finished with value: 0.1735548691140926 and parameters: {'model_type': 'mlp', 'hidden_dims': '[512, 128]', 'dropout': 0.1444088159176882, 'batch_norm': True, 'lr': 0.0008338347868874919, 'weight_decay': 4.443818398684575e-06, 'epochs': 287, 'loss': 'mae', 'optimizer': 'adam', 'graph_mode': 'off', 'use_snp_selection': False}. Best is trial 113 with value: 0.19443631717083304.
[I 2025-12-05 16:24:47,653] Trial 144 finished with value: 0.16570602754237843 and parameters: {'model_type': 'mlp', 'hidden_dims': '[512, 128]', 'dropout': 0.11442808620357546, 'batch_norm': True, 'lr': 0.0007078819440574686, 'weight_decay': 1.872352301773025e-05, 'epochs': 296, 'loss': 'mae', 'optimizer': 'adam', 'graph_mode': 'off', 'use_snp_selection': False}. Best is trial 113 with value: 0.19443631717083304.
[I 2025-12-05 16:24:48,893] Trial 145 finished with value: 0.1872646163803341 and parameters: {'model_type': 'mlp', 'hidden_dims': '[256, 128]', 'dropout': 0.13174260389408257, 'batch_norm': True, 'lr': 0.0007804833212987909, 'weight_decay': 2.4149604555279537e-05, 'epochs': 307, 'loss': 'mae', 'optimizer': 'adam', 'graph_mode': 'off', 'use_snp_selection': False}. Best is trial 113 with value: 0.19443631717083304.
[I 2025-12-05 16:24:50,076] Trial 146 finished with value: 0.1732092619014256 and parameters: {'model_type': 'mlp', 'hidden_dims': '[256, 128]', 'dropout': 0.12835503303586832, 'batch_norm': True, 'lr': 0.00020575135416051312, 'weight_decay': 2.3086989526391055e-05, 'epochs': 307, 'loss': 'mse', 'optimizer': 'adam', 'graph_mode': 'off', 'use_snp_selection': False}. Best is trial 113 with value: 0.19443631717083304.
[I 2025-12-05 16:24:51,197] Trial 147 finished with value: 0.17204281177715558 and parameters: {'model_type': 'mlp', 'hidden_dims': '[256, 128]', 'dropout': 0.11226458773160725, 'batch_norm': True, 'lr': 0.00038491771441163556, 'weight_decay': 4.1648479305419314e-05, 'epochs': 275, 'loss': 'mae', 'optimizer': 'adam', 'graph_mode': 'off', 'use_snp_selection': False}. Best is trial 113 with value: 0.19443631717083304.
[I 2025-12-05 16:24:52,404] Trial 148 finished with value: 0.16953165964285202 and parameters: {'model_type': 'mlp', 'hidden_dims': '[256, 128]', 'dropout': 0.5331475504201768, 'batch_norm': True, 'lr': 0.00016123603371103257, 'weight_decay': 2.427821215261455e-05, 'epochs': 317, 'loss': 'mae', 'optimizer': 'adam', 'graph_mode': 'off', 'use_snp_selection': False}. Best is trial 113 with value: 0.19443631717083304.
[I 2025-12-05 16:24:53,371] Trial 149 finished with value: 0.17239626700439398 and parameters: {'model_type': 'mlp', 'hidden_dims': '[128, 64]', 'dropout': 0.18549000775181973, 'batch_norm': True, 'lr': 0.000571271425172344, 'weight_decay': 1.1102889492437828e-05, 'epochs': 302, 'loss': 'mse', 'optimizer': 'adam', 'graph_mode': 'off', 'use_snp_selection': False}. Best is trial 113 with value: 0.19443631717083304.
[I 2025-12-05 16:24:55,531] Trial 0 finished with value: 0.03210213230700996 and parameters: {'model_type': 'mlp', 'hidden_dims': '[128, 64]', 'dropout': 0.199031432379812, 'batch_norm': True, 'lr': 1.8408544111075837e-06, 'weight_decay': 5.5136510071208614e-05, 'epochs': 336, 'loss': 'mae', 'optimizer': 'adam', 'graph_mode': 'off', 'use_snp_selection': True, 'num_snps': 43862}. Best is trial 0 with value: 0.03210213230700996.
[I 2025-12-05 16:24:56,586] Trial 1 finished with value: 0.06553796709983993 and parameters: {'model_type': 'mlp', 'hidden_dims': '[256, 128]', 'dropout': 0.4370668075331726, 'batch_norm': True, 'lr': 7.133471581159139e-05, 'weight_decay': 1.128633586803549e-05, 'epochs': 242, 'loss': 'mae', 'optimizer': 'adam', 'graph_mode': 'off', 'use_snp_selection': False}. Best is trial 1 with value: 0.06553796709983993.
[I 2025-12-05 16:24:58,918] Trial 2 finished with value: 0.0009715822191045965 and parameters: {'model_type': 'mlp', 'hidden_dims': '[256, 128, 64]', 'dropout': 0.41314357415569625, 'batch_norm': False, 'lr': 3.952233718592101e-06, 'weight_decay': 0.00026754769258252603, 'epochs': 149, 'loss': 'mse', 'optimizer': 'adam', 'graph_mode': 'off', 'use_snp_selection': True, 'num_snps': 11571}. Best is trial 1 with value: 0.06553796709983993.
[I 2025-12-05 16:25:01,686] Trial 3 finished with value: 0.02622176213415355 and parameters: {'model_type': 'mlp', 'hidden_dims': '[512, 64]', 'dropout': 0.5938127374509361, 'batch_norm': False, 'lr': 5.67704586114731e-06, 'weight_decay': 2.4518087630137052e-05, 'epochs': 320, 'loss': 'mae', 'optimizer': 'adam', 'graph_mode': 'off', 'use_snp_selection': False}. Best is trial 1 with value: 0.06553796709983993.
[I 2025-12-05 16:25:03,860] Trial 4 finished with value: -0.01085093777846605 and parameters: {'model_type': 'mlp', 'hidden_dims': '[512, 128]', 'dropout': 0.25746343592134413, 'batch_norm': True, 'lr': 1.3467657668402788e-06, 'weight_decay': 0.00033087251918647806, 'epochs': 277, 'loss': 'mse', 'optimizer': 'adam', 'graph_mode': 'off', 'use_snp_selection': True, 'num_snps': 36675}. Best is trial 1 with value: 0.06553796709983993.
[I 2025-12-05 16:25:05,589] Trial 5 finished with value: 0.05630950503873898 and parameters: {'model_type': 'mlp', 'hidden_dims': '[512, 64]', 'dropout': 0.38275350994408375, 'batch_norm': True, 'lr': 1.5586664309232824e-06, 'weight_decay': 0.0008227664668621182, 'epochs': 145, 'loss': 'mae', 'optimizer': 'adam', 'graph_mode': 'off', 'use_snp_selection': True, 'num_snps': 32148}. Best is trial 1 with value: 0.06553796709983993.
[I 2025-12-05 16:25:06,584] Trial 6 finished with value: 0.02449742172589951 and parameters: {'model_type': 'mlp', 'hidden_dims': '[256, 128]', 'dropout': 0.3930109900265879, 'batch_norm': False, 'lr': 4.892964372128395e-05, 'weight_decay': 1.5809549317992182e-06, 'epochs': 199, 'loss': 'mse', 'optimizer': 'adam', 'graph_mode': 'off', 'use_snp_selection': False}. Best is trial 1 with value: 0.06553796709983993.
[I 2025-12-05 16:25:07,672] Trial 7 finished with value: 0.053412367822946755 and parameters: {'model_type': 'mlp', 'hidden_dims': '[512, 256]', 'dropout': 0.15343979219678458, 'batch_norm': True, 'lr': 6.234003099047341e-05, 'weight_decay': 3.894760610535477e-07, 'epochs': 97, 'loss': 'mse', 'optimizer': 'adam', 'graph_mode': 'off', 'use_snp_selection': False}. Best is trial 1 with value: 0.06553796709983993.
[I 2025-12-05 16:25:09,507] Trial 8 finished with value: 0.05127423002577988 and parameters: {'model_type': 'mlp', 'hidden_dims': '[512, 128]', 'dropout': 0.10743001231661406, 'batch_norm': True, 'lr': 0.00023728538449271062, 'weight_decay': 1.7629071578048637e-05, 'epochs': 312, 'loss': 'mae', 'optimizer': 'adam', 'graph_mode': 'off', 'use_snp_selection': False}. Best is trial 1 with value: 0.06553796709983993.
[I 2025-12-05 16:25:10,906] Trial 9 finished with value: 0.061111340658458704 and parameters: {'model_type': 'mlp', 'hidden_dims': '[512, 64]', 'dropout': 0.14505336736221927, 'batch_norm': True, 'lr': 5.8619638388111826e-05, 'weight_decay': 6.200156172669308e-07, 'epochs': 175, 'loss': 'mse', 'optimizer': 'adam', 'graph_mode': 'off', 'use_snp_selection': False}. Best is trial 1 with value: 0.06553796709983993.
[I 2025-12-05 16:25:11,990] Trial 10 finished with value: 0.039271490604102115 and parameters: {'model_type': 'mlp', 'hidden_dims': '[256, 128]', 'dropout': 0.5365714961141473, 'batch_norm': False, 'lr': 0.00032955828969150785, 'weight_decay': 3.381683344261174e-06, 'epochs': 236, 'loss': 'mae', 'optimizer': 'adam', 'graph_mode': 'off', 'use_snp_selection': False}. Best is trial 1 with value: 0.06553796709983993.
[I 2025-12-05 16:25:13,057] Trial 11 finished with value: 0.017338734288377504 and parameters: {'model_type': 'mlp', 'hidden_dims': '[256, 128]', 'dropout': 0.2851700052976396, 'batch_norm': True, 'lr': 1.6474108386126448e-05, 'weight_decay': 1.2045055692919657e-07, 'epochs': 222, 'loss': 'mse', 'optimizer': 'adam', 'graph_mode': 'off', 'use_snp_selection': False}. Best is trial 1 with value: 0.06553796709983993.
[I 2025-12-05 16:25:13,965] Trial 12 finished with value: 0.015468122137146783 and parameters: {'model_type': 'mlp', 'hidden_dims': '[512, 64]', 'dropout': 0.4779690972965961, 'batch_norm': True, 'lr': 0.000121041789182661, 'weight_decay': 2.1974776777319986e-06, 'epochs': 43, 'loss': 'mae', 'optimizer': 'adam', 'graph_mode': 'off', 'use_snp_selection': False}. Best is trial 1 with value: 0.06553796709983993.
[I 2025-12-05 16:25:14,783] Trial 13 finished with value: -0.01978308450231707 and parameters: {'model_type': 'mlp', 'hidden_dims': '[128, 64]', 'dropout': 0.3041365173646664, 'batch_norm': True, 'lr': 1.8184704710575438e-05, 'weight_decay': 5.529355006935713e-07, 'epochs': 157, 'loss': 'mse', 'optimizer': 'adam', 'graph_mode': 'off', 'use_snp_selection': False}. Best is trial 1 with value: 0.06553796709983993.
[I 2025-12-05 16:25:15,930] Trial 14 finished with value: 0.04727793016977492 and parameters: {'model_type': 'mlp', 'hidden_dims': '[256, 128, 64]', 'dropout': 0.4668543239728036, 'batch_norm': True, 'lr': 0.0006681578335050954, 'weight_decay': 5.023111485526689e-06, 'epochs': 263, 'loss': 'mse', 'optimizer': 'adam', 'graph_mode': 'off', 'use_snp_selection': False}. Best is trial 1 with value: 0.06553796709983993.
[I 2025-12-05 16:25:17,349] Trial 15 finished with value: 0.05407708166218279 and parameters: {'model_type': 'mlp', 'hidden_dims': '[512, 256]', 'dropout': 0.2097289363457977, 'batch_norm': True, 'lr': 0.0001045571331345049, 'weight_decay': 6.682546297843178e-05, 'epochs': 190, 'loss': 'mae', 'optimizer': 'adam', 'graph_mode': 'off', 'use_snp_selection': False}. Best is trial 1 with value: 0.06553796709983993.
[I 2025-12-05 16:25:18,164] Trial 16 finished with value: 0.06123640323564309 and parameters: {'model_type': 'mlp', 'hidden_dims': '[256, 128]', 'dropout': 0.3400578620313633, 'batch_norm': True, 'lr': 2.1517090787442848e-05, 'weight_decay': 8.323335531778455e-07, 'epochs': 98, 'loss': 'mse', 'optimizer': 'adam', 'graph_mode': 'off', 'use_snp_selection': False}. Best is trial 1 with value: 0.06553796709983993.
[I 2025-12-05 16:25:18,964] Trial 17 finished with value: 0.061299467077313805 and parameters: {'model_type': 'mlp', 'hidden_dims': '[256, 128]', 'dropout': 0.3359509294360599, 'batch_norm': True, 'lr': 1.6075016220146412e-05, 'weight_decay': 7.570637314062092e-06, 'epochs': 104, 'loss': 'mae', 'optimizer': 'adam', 'graph_mode': 'off', 'use_snp_selection': False}. Best is trial 1 with value: 0.06553796709983993.
[I 2025-12-05 16:25:21,249] Trial 18 finished with value: 0.051977293639294236 and parameters: {'model_type': 'mlp', 'hidden_dims': '[256, 128]', 'dropout': 0.4624669734906147, 'batch_norm': False, 'lr': 5.895320539592683e-06, 'weight_decay': 7.595560978713356e-06, 'epochs': 94, 'loss': 'mae', 'optimizer': 'adam', 'graph_mode': 'off', 'use_snp_selection': True, 'num_snps': 58241}. Best is trial 1 with value: 0.06553796709983993.
[I 2025-12-05 16:25:22,008] Trial 19 finished with value: -0.01850752222090921 and parameters: {'model_type': 'mlp', 'hidden_dims': '[256, 128]', 'dropout': 0.33794681415577893, 'batch_norm': True, 'lr': 1.0436614786391874e-05, 'weight_decay': 3.814282647383259e-05, 'epochs': 49, 'loss': 'mae', 'optimizer': 'adam', 'graph_mode': 'off', 'use_snp_selection': False}. Best is trial 1 with value: 0.06553796709983993.
[I 2025-12-05 16:25:22,909] Trial 20 finished with value: 0.033170005635218484 and parameters: {'model_type': 'mlp', 'hidden_dims': '[256, 128]', 'dropout': 0.4381416955900931, 'batch_norm': True, 'lr': 0.00018572983005243663, 'weight_decay': 9.820467674312867e-06, 'epochs': 122, 'loss': 'mae', 'optimizer': 'adam', 'graph_mode': 'off', 'use_snp_selection': False}. Best is trial 1 with value: 0.06553796709983993.
[I 2025-12-05 16:25:23,714] Trial 21 finished with value: 0.026803985549245644 and parameters: {'model_type': 'mlp', 'hidden_dims': '[256, 128]', 'dropout': 0.3426036956588672, 'batch_norm': True, 'lr': 2.7547720844241457e-05, 'weight_decay': 1.2117525214895774e-06, 'epochs': 79, 'loss': 'mae', 'optimizer': 'adam', 'graph_mode': 'off', 'use_snp_selection': False}. Best is trial 1 with value: 0.06553796709983993.
[I 2025-12-05 16:25:24,609] Trial 22 finished with value: 0.007433039166031976 and parameters: {'model_type': 'mlp', 'hidden_dims': '[256, 128]', 'dropout': 0.5150024058682912, 'batch_norm': True, 'lr': 3.511276726977528e-05, 'weight_decay': 1.2941717804374767e-07, 'epochs': 123, 'loss': 'mae', 'optimizer': 'adam', 'graph_mode': 'off', 'use_snp_selection': False}. Best is trial 1 with value: 0.06553796709983993.
[I 2025-12-05 16:25:25,404] Trial 23 finished with value: -0.01109779332679008 and parameters: {'model_type': 'mlp', 'hidden_dims': '[256, 128]', 'dropout': 0.35578796843939364, 'batch_norm': True, 'lr': 1.3646765242622918e-05, 'weight_decay': 1.5526043665925642e-05, 'epochs': 73, 'loss': 'mse', 'optimizer': 'adam', 'graph_mode': 'off', 'use_snp_selection': False}. Best is trial 1 with value: 0.06553796709983993.
[I 2025-12-05 16:25:26,571] Trial 24 finished with value: 0.03457183803444828 and parameters: {'model_type': 'mlp', 'hidden_dims': '[256, 128]', 'dropout': 0.30365747156191303, 'batch_norm': True, 'lr': 2.7013005792357815e-05, 'weight_decay': 4.234220392496255e-06, 'epochs': 269, 'loss': 'mae', 'optimizer': 'adam', 'graph_mode': 'off', 'use_snp_selection': False}. Best is trial 1 with value: 0.06553796709983993.
[I 2025-12-05 16:25:27,462] Trial 25 finished with value: 0.018255111969488 and parameters: {'model_type': 'mlp', 'hidden_dims': '[256, 128]', 'dropout': 0.22972307360675576, 'batch_norm': True, 'lr': 9.831069546038199e-06, 'weight_decay': 8.885444342341119e-05, 'epochs': 119, 'loss': 'mae', 'optimizer': 'adam', 'graph_mode': 'off', 'use_snp_selection': False}. Best is trial 1 with value: 0.06553796709983993.
[I 2025-12-05 16:25:28,356] Trial 26 finished with value: 0.06057563382642723 and parameters: {'model_type': 'mlp', 'hidden_dims': '[512, 128]', 'dropout': 0.41858504283208753, 'batch_norm': False, 'lr': 9.41515330557756e-05, 'weight_decay': 2.6956935454614915e-07, 'epochs': 222, 'loss': 'mse', 'optimizer': 'adam', 'graph_mode': 'off', 'use_snp_selection': True, 'num_snps': 3842}. Best is trial 1 with value: 0.06553796709983993.
[I 2025-12-05 16:25:29,390] Trial 27 finished with value: 0.018984641079587784 and parameters: {'model_type': 'mlp', 'hidden_dims': '[256, 128, 64]', 'dropout': 0.36959351884730185, 'batch_norm': True, 'lr': 3.708794373669967e-05, 'weight_decay': 1.069174499568345e-06, 'epochs': 182, 'loss': 'mae', 'optimizer': 'adam', 'graph_mode': 'off', 'use_snp_selection': False}. Best is trial 1 with value: 0.06553796709983993.
[I 2025-12-05 16:25:30,399] Trial 28 finished with value: 0.044476323289720614 and parameters: {'model_type': 'mlp', 'hidden_dims': '[128, 64]', 'dropout': 0.3254314863734792, 'batch_norm': True, 'lr': 0.000969179544040909, 'weight_decay': 0.00011837572117061313, 'epochs': 295, 'loss': 'mse', 'optimizer': 'adam', 'graph_mode': 'off', 'use_snp_selection': False}. Best is trial 1 with value: 0.06553796709983993.
[I 2025-12-05 16:25:31,865] Trial 29 finished with value: -0.019383051201020282 and parameters: {'model_type': 'mlp', 'hidden_dims': '[512, 256]', 'dropout': 0.2638128166792724, 'batch_norm': True, 'lr': 2.8966762461994946e-06, 'weight_decay': 2.863104443991659e-05, 'epochs': 242, 'loss': 'mae', 'optimizer': 'adam', 'graph_mode': 'off', 'use_snp_selection': True, 'num_snps': 19468}. Best is trial 1 with value: 0.06553796709983993.
[I 2025-12-05 16:25:32,564] Trial 30 finished with value: 0.04132548465560033 and parameters: {'model_type': 'mlp', 'hidden_dims': '[128, 64]', 'dropout': 0.4993354289235561, 'batch_norm': True, 'lr': 7.6088254603734275e-06, 'weight_decay': 2.4994696589811735e-06, 'epochs': 73, 'loss': 'mae', 'optimizer': 'adam', 'graph_mode': 'off', 'use_snp_selection': False}. Best is trial 1 with value: 0.06553796709983993.
[I 2025-12-05 16:25:33,927] Trial 31 finished with value: 0.04346180680163117 and parameters: {'model_type': 'mlp', 'hidden_dims': '[512, 64]', 'dropout': 0.1358383897168521, 'batch_norm': True, 'lr': 6.143742161187615e-05, 'weight_decay': 7.170628909042163e-07, 'epochs': 173, 'loss': 'mse', 'optimizer': 'adam', 'graph_mode': 'off', 'use_snp_selection': False}. Best is trial 1 with value: 0.06553796709983993.
[I 2025-12-05 16:25:35,140] Trial 32 finished with value: 0.06902366905572252 and parameters: {'model_type': 'mlp', 'hidden_dims': '[512, 64]', 'dropout': 0.4271052587019456, 'batch_norm': True, 'lr': 2.5778392723042867e-05, 'weight_decay': 2.9745865715957684e-07, 'epochs': 140, 'loss': 'mse', 'optimizer': 'adam', 'graph_mode': 'off', 'use_snp_selection': False}. Best is trial 32 with value: 0.06902366905572252.
[I 2025-12-05 16:25:36,348] Trial 33 finished with value: 0.02306074817515046 and parameters: {'model_type': 'mlp', 'hidden_dims': '[512, 64]', 'dropout': 0.4199542049943168, 'batch_norm': True, 'lr': 2.1840449064282166e-05, 'weight_decay': 1.6756112564444096e-07, 'epochs': 140, 'loss': 'mse', 'optimizer': 'adam', 'graph_mode': 'off', 'use_snp_selection': False}. Best is trial 32 with value: 0.06902366905572252.
