[I 2025-12-06 06:56:13,088] Trial 70 finished with value: 0.3211325184296953 and parameters: {'model_type': 'mlp', 'hidden_dims': '[128, 64]', 'dropout': 0.5192857021985543, 'batch_norm': False, 'lr': 1.3754505546002166e-06, 'weight_decay': 5.722456532957654e-07, 'epochs': 210, 'loss': 'mse', 'optimizer': 'adam', 'graph_mode': 'off', 'use_snp_selection': True, 'num_snps': 54051}. Best is trial 44 with value: 0.37286893305453894.
[I 2025-12-06 06:56:40,085] Trial 71 finished with value: 0.3643119188838456 and parameters: {'model_type': 'mlp', 'hidden_dims': '[256, 128]', 'dropout': 0.5996604051085133, 'batch_norm': False, 'lr': 1.1217485739056695e-05, 'weight_decay': 1.4906263845538053e-07, 'epochs': 230, 'loss': 'mse', 'optimizer': 'adam', 'graph_mode': 'off', 'use_snp_selection': False}. Best is trial 44 with value: 0.37286893305453894.
[I 2025-12-06 06:57:30,486] Trial 72 finished with value: 0.3602314530335877 and parameters: {'model_type': 'mlp', 'hidden_dims': '[256, 128]', 'dropout': 0.5553222826009026, 'batch_norm': False, 'lr': 1.3423905520560217e-05, 'weight_decay': 4.4593277038048907e-07, 'epochs': 236, 'loss': 'mse', 'optimizer': 'adam', 'graph_mode': 'off', 'use_snp_selection': True, 'num_snps': 44553}. Best is trial 44 with value: 0.37286893305453894.
[I 2025-12-06 06:57:56,617] Trial 73 finished with value: 0.36918716965657206 and parameters: {'model_type': 'mlp', 'hidden_dims': '[256, 128]', 'dropout': 0.5800031466036405, 'batch_norm': False, 'lr': 9.03570102470964e-06, 'weight_decay': 1.0099233222890471e-07, 'epochs': 219, 'loss': 'mae', 'optimizer': 'adam', 'graph_mode': 'off', 'use_snp_selection': False}. Best is trial 44 with value: 0.37286893305453894.
[I 2025-12-06 06:58:47,498] Trial 74 finished with value: 0.350904740078553 and parameters: {'model_type': 'mlp', 'hidden_dims': '[256, 128]', 'dropout': 0.4598268852244887, 'batch_norm': False, 'lr': 4.948309135645544e-05, 'weight_decay': 1.8536176478678435e-05, 'epochs': 205, 'loss': 'mse', 'optimizer': 'adam', 'graph_mode': 'off', 'use_snp_selection': True, 'num_snps': 49186}. Best is trial 44 with value: 0.37286893305453894.
[I 2025-12-06 06:59:19,387] Trial 75 finished with value: 0.32266726358499687 and parameters: {'model_type': 'mlp', 'hidden_dims': '[256, 128]', 'dropout': 0.5353529277830551, 'batch_norm': True, 'lr': 4.381807183940727e-06, 'weight_decay': 0.00016469347272390051, 'epochs': 272, 'loss': 'mae', 'optimizer': 'adam', 'graph_mode': 'off', 'use_snp_selection': False}. Best is trial 44 with value: 0.37286893305453894.
[I 2025-12-06 07:00:16,186] Trial 76 finished with value: 0.37400640977899324 and parameters: {'model_type': 'mlp', 'hidden_dims': '[512, 128]', 'dropout': 0.5604829761722, 'batch_norm': False, 'lr': 6.866142065592247e-06, 'weight_decay': 3.5544033325365e-07, 'epochs': 96, 'loss': 'mse', 'optimizer': 'adam', 'graph_mode': 'off', 'use_snp_selection': True, 'num_snps': 59649}. Best is trial 76 with value: 0.37400640977899324.
[I 2025-12-06 07:01:10,802] Trial 77 finished with value: 0.374286834156706 and parameters: {'model_type': 'mlp', 'hidden_dims': '[512, 128]', 'dropout': 0.49057012989489746, 'batch_norm': False, 'lr': 6.165118391896303e-06, 'weight_decay': 3.071664678504978e-07, 'epochs': 89, 'loss': 'mse', 'optimizer': 'adam', 'graph_mode': 'off', 'use_snp_selection': True, 'num_snps': 58517}. Best is trial 77 with value: 0.374286834156706.
[I 2025-12-06 07:02:06,986] Trial 78 finished with value: 0.3503558353737518 and parameters: {'model_type': 'mlp', 'hidden_dims': '[512, 128]', 'dropout': 0.4922281446017379, 'batch_norm': False, 'lr': 2.1236702154139824e-06, 'weight_decay': 3.0799574260018565e-07, 'epochs': 93, 'loss': 'mse', 'optimizer': 'adam', 'graph_mode': 'off', 'use_snp_selection': True, 'num_snps': 59662}. Best is trial 77 with value: 0.374286834156706.
[I 2025-12-06 07:02:56,299] Trial 79 finished with value: 0.35881561440597765 and parameters: {'model_type': 'mlp', 'hidden_dims': '[512, 128]', 'dropout': 0.46378484775752027, 'batch_norm': False, 'lr': 3.0506511596032063e-06, 'weight_decay': 7.50621520344987e-07, 'epochs': 63, 'loss': 'mse', 'optimizer': 'adam', 'graph_mode': 'off', 'use_snp_selection': True, 'num_snps': 56840}. Best is trial 77 with value: 0.374286834156706.
[I 2025-12-06 07:03:50,715] Trial 80 finished with value: 0.3673826439393223 and parameters: {'model_type': 'mlp', 'hidden_dims': '[512, 128]', 'dropout': 0.10914931702323669, 'batch_norm': False, 'lr': 5.859511974958525e-06, 'weight_decay': 4.1025549840746583e-07, 'epochs': 82, 'loss': 'mse', 'optimizer': 'adam', 'graph_mode': 'off', 'use_snp_selection': True, 'num_snps': 59924}. Best is trial 77 with value: 0.374286834156706.
[I 2025-12-06 07:04:47,944] Trial 81 finished with value: 0.3774215998036302 and parameters: {'model_type': 'mlp', 'hidden_dims': '[512, 128]', 'dropout': 0.5631709544819277, 'batch_norm': False, 'lr': 7.774770842576653e-06, 'weight_decay': 9.236415863960731e-07, 'epochs': 111, 'loss': 'mse', 'optimizer': 'adam', 'graph_mode': 'off', 'use_snp_selection': True, 'num_snps': 56423}. Best is trial 81 with value: 0.3774215998036302.
[I 2025-12-06 07:05:45,707] Trial 82 finished with value: 0.3707091768649383 and parameters: {'model_type': 'mlp', 'hidden_dims': '[512, 128]', 'dropout': 0.4989233311405522, 'batch_norm': False, 'lr': 7.600621768945613e-06, 'weight_decay': 1.0385902653251904e-06, 'epochs': 113, 'loss': 'mse', 'optimizer': 'adam', 'graph_mode': 'off', 'use_snp_selection': True, 'num_snps': 56691}. Best is trial 81 with value: 0.3774215998036302.
[I 2025-12-06 07:06:43,363] Trial 83 finished with value: 0.377423297269324 and parameters: {'model_type': 'mlp', 'hidden_dims': '[512, 128]', 'dropout': 0.5052617952744464, 'batch_norm': False, 'lr': 6.868433489041836e-06, 'weight_decay': 1.3191689883856547e-06, 'epochs': 115, 'loss': 'mse', 'optimizer': 'adam', 'graph_mode': 'off', 'use_snp_selection': True, 'num_snps': 55946}. Best is trial 83 with value: 0.377423297269324.
[I 2025-12-06 07:07:40,878] Trial 84 finished with value: 0.3725898799349987 and parameters: {'model_type': 'mlp', 'hidden_dims': '[512, 128]', 'dropout': 0.4967327390371594, 'batch_norm': False, 'lr': 7.668695515701032e-06, 'weight_decay': 5.649519266188576e-07, 'epochs': 111, 'loss': 'mse', 'optimizer': 'adam', 'graph_mode': 'off', 'use_snp_selection': True, 'num_snps': 56705}. Best is trial 83 with value: 0.377423297269324.
[I 2025-12-06 07:08:38,709] Trial 85 finished with value: 0.36935778333690317 and parameters: {'model_type': 'mlp', 'hidden_dims': '[512, 128]', 'dropout': 0.5044423706268933, 'batch_norm': False, 'lr': 7.67079241416094e-06, 'weight_decay': 2.3699049137620708e-07, 'epochs': 111, 'loss': 'mse', 'optimizer': 'adam', 'graph_mode': 'off', 'use_snp_selection': True, 'num_snps': 56692}. Best is trial 83 with value: 0.377423297269324.
[I 2025-12-06 07:09:36,195] Trial 86 finished with value: 0.37423656031758146 and parameters: {'model_type': 'mlp', 'hidden_dims': '[512, 128]', 'dropout': 0.4922009324398859, 'batch_norm': False, 'lr': 7.872803521133492e-06, 'weight_decay': 1.3351632488320422e-06, 'epochs': 126, 'loss': 'mse', 'optimizer': 'adam', 'graph_mode': 'off', 'use_snp_selection': True, 'num_snps': 53160}. Best is trial 83 with value: 0.377423297269324.
[I 2025-12-06 07:10:32,788] Trial 87 finished with value: 0.3731545340827066 and parameters: {'model_type': 'mlp', 'hidden_dims': '[512, 128]', 'dropout': 0.513984313951895, 'batch_norm': False, 'lr': 4.63776208706255e-06, 'weight_decay': 1.2935217999084727e-06, 'epochs': 122, 'loss': 'mse', 'optimizer': 'adam', 'graph_mode': 'off', 'use_snp_selection': True, 'num_snps': 52607}. Best is trial 83 with value: 0.377423297269324.
[I 2025-12-06 07:11:29,996] Trial 88 finished with value: 0.3318811245844039 and parameters: {'model_type': 'mlp', 'hidden_dims': '[512, 128]', 'dropout': 0.5273046431520448, 'batch_norm': True, 'lr': 3.901490444079759e-06, 'weight_decay': 1.4362901052021649e-06, 'epochs': 123, 'loss': 'mse', 'optimizer': 'adam', 'graph_mode': 'off', 'use_snp_selection': True, 'num_snps': 52620}. Best is trial 83 with value: 0.377423297269324.
[I 2025-12-06 07:12:24,339] Trial 89 finished with value: 0.37125740177189204 and parameters: {'model_type': 'mlp', 'hidden_dims': '[512, 128]', 'dropout': 0.4657114134821706, 'batch_norm': False, 'lr': 4.719644966015072e-06, 'weight_decay': 6.298641872137635e-07, 'epochs': 102, 'loss': 'mse', 'optimizer': 'adam', 'graph_mode': 'off', 'use_snp_selection': True, 'num_snps': 54348}. Best is trial 83 with value: 0.377423297269324.
[I 2025-12-06 07:13:25,107] Trial 90 finished with value: 0.363342698807445 and parameters: {'model_type': 'mlp', 'hidden_dims': '[512, 128]', 'dropout': 0.5093184091053836, 'batch_norm': False, 'lr': 1.508861470513246e-05, 'weight_decay': 1.299078121536456e-06, 'epochs': 129, 'loss': 'mse', 'optimizer': 'adam', 'graph_mode': 'off', 'use_snp_selection': True, 'num_snps': 57463}. Best is trial 83 with value: 0.377423297269324.
[I 2025-12-06 07:14:17,006] Trial 91 finished with value: 0.3744358822405277 and parameters: {'model_type': 'mlp', 'hidden_dims': '[512, 128]', 'dropout': 0.5511568725869288, 'batch_norm': False, 'lr': 6.821161016228965e-06, 'weight_decay': 2.188691252570424e-06, 'epochs': 94, 'loss': 'mse', 'optimizer': 'adam', 'graph_mode': 'off', 'use_snp_selection': True, 'num_snps': 51958}. Best is trial 83 with value: 0.377423297269324.
[I 2025-12-06 07:15:08,917] Trial 92 finished with value: 0.37028431553854896 and parameters: {'model_type': 'mlp', 'hidden_dims': '[512, 128]', 'dropout': 0.49433266402606607, 'batch_norm': False, 'lr': 1.0186622605437704e-05, 'weight_decay': 2.3950013466552265e-06, 'epochs': 92, 'loss': 'mse', 'optimizer': 'adam', 'graph_mode': 'off', 'use_snp_selection': True, 'num_snps': 52613}. Best is trial 83 with value: 0.377423297269324.
[I 2025-12-06 07:16:07,089] Trial 93 finished with value: 0.3722495474577567 and parameters: {'model_type': 'mlp', 'hidden_dims': '[512, 128]', 'dropout': 0.5465849973842801, 'batch_norm': False, 'lr': 8.407449186848102e-06, 'weight_decay': 2.5431442931472613e-07, 'epochs': 120, 'loss': 'mse', 'optimizer': 'adam', 'graph_mode': 'off', 'use_snp_selection': True, 'num_snps': 55432}. Best is trial 83 with value: 0.377423297269324.
[I 2025-12-06 07:17:02,346] Trial 94 finished with value: 0.3770644762859809 and parameters: {'model_type': 'mlp', 'hidden_dims': '[512, 128]', 'dropout': 0.5480927024082641, 'batch_norm': False, 'lr': 8.115516932677071e-06, 'weight_decay': 3.754996473700172e-07, 'epochs': 106, 'loss': 'mse', 'optimizer': 'adam', 'graph_mode': 'off', 'use_snp_selection': True, 'num_snps': 54859}. Best is trial 83 with value: 0.377423297269324.
[I 2025-12-06 07:17:55,423] Trial 95 finished with value: 0.36624492444593704 and parameters: {'model_type': 'mlp', 'hidden_dims': '[512, 128]', 'dropout': 0.5584546615465654, 'batch_norm': False, 'lr': 1.979362397797735e-05, 'weight_decay': 3.6443220546872314e-07, 'epochs': 107, 'loss': 'mse', 'optimizer': 'adam', 'graph_mode': 'off', 'use_snp_selection': True, 'num_snps': 50807}. Best is trial 83 with value: 0.377423297269324.
[I 2025-12-06 07:18:58,500] Trial 96 finished with value: 0.37632588624053664 and parameters: {'model_type': 'mlp', 'hidden_dims': '[512, 128]', 'dropout': 0.5278057098327104, 'batch_norm': False, 'lr': 4.892488741758981e-06, 'weight_decay': 4.95080544375951e-07, 'epochs': 138, 'loss': 'mse', 'optimizer': 'adam', 'graph_mode': 'off', 'use_snp_selection': True, 'num_snps': 58398}. Best is trial 83 with value: 0.377423297269324.
[I 2025-12-06 07:20:01,210] Trial 97 finished with value: 0.36711656969174644 and parameters: {'model_type': 'mlp', 'hidden_dims': '[512, 128]', 'dropout': 0.5235267868033239, 'batch_norm': False, 'lr': 2.887738917521937e-06, 'weight_decay': 3.060707623728162e-06, 'epochs': 137, 'loss': 'mse', 'optimizer': 'adam', 'graph_mode': 'off', 'use_snp_selection': True, 'num_snps': 58066}. Best is trial 83 with value: 0.377423297269324.
[I 2025-12-06 07:21:01,974] Trial 98 finished with value: 0.3734176461142199 and parameters: {'model_type': 'mlp', 'hidden_dims': '[512, 128]', 'dropout': 0.5390253070013512, 'batch_norm': False, 'lr': 3.582461036614655e-06, 'weight_decay': 2.0602476085892394e-06, 'epochs': 149, 'loss': 'mse', 'optimizer': 'adam', 'graph_mode': 'off', 'use_snp_selection': True, 'num_snps': 52400}. Best is trial 83 with value: 0.377423297269324.
[I 2025-12-06 07:22:02,894] Trial 99 finished with value: 0.3691595535078206 and parameters: {'model_type': 'mlp', 'hidden_dims': '[512, 128]', 'dropout': 0.5373796890810048, 'batch_norm': False, 'lr': 3.4547365946164122e-06, 'weight_decay': 2.28906400088902e-06, 'epochs': 146, 'loss': 'mse', 'optimizer': 'adam', 'graph_mode': 'off', 'use_snp_selection': True, 'num_snps': 53242}. Best is trial 83 with value: 0.377423297269324.
[I 2025-12-06 07:23:00,211] Trial 100 finished with value: 0.34281475955885565 and parameters: {'model_type': 'mlp', 'hidden_dims': '[512, 128]', 'dropout': 0.5171977550537289, 'batch_norm': False, 'lr': 1.8918254885980808e-06, 'weight_decay': 1.9236964848961844e-07, 'epochs': 98, 'loss': 'mse', 'optimizer': 'adam', 'graph_mode': 'off', 'use_snp_selection': True, 'num_snps': 59987}. Best is trial 83 with value: 0.377423297269324.
[I 2025-12-06 07:23:57,627] Trial 101 finished with value: 0.3763687052884987 and parameters: {'model_type': 'mlp', 'hidden_dims': '[512, 128]', 'dropout': 0.5629871005977913, 'batch_norm': False, 'lr': 5.05408988578464e-06, 'weight_decay': 8.604483035760403e-07, 'epochs': 119, 'loss': 'mse', 'optimizer': 'adam', 'graph_mode': 'off', 'use_snp_selection': True, 'num_snps': 54949}. Best is trial 83 with value: 0.377423297269324.
[I 2025-12-06 07:24:49,828] Trial 102 finished with value: 0.3757762276386306 and parameters: {'model_type': 'mlp', 'hidden_dims': '[512, 128]', 'dropout': 0.5525302259314546, 'batch_norm': False, 'lr': 5.1538142399232085e-06, 'weight_decay': 8.867947434303439e-07, 'epochs': 86, 'loss': 'mse', 'optimizer': 'adam', 'graph_mode': 'off', 'use_snp_selection': True, 'num_snps': 55237}. Best is trial 83 with value: 0.377423297269324.
[I 2025-12-06 07:25:42,218] Trial 103 finished with value: 0.363875745592442 and parameters: {'model_type': 'mlp', 'hidden_dims': '[512, 128]', 'dropout': 0.5500364152250696, 'batch_norm': False, 'lr': 5.381059582523436e-06, 'weight_decay': 8.425853014464425e-07, 'epochs': 89, 'loss': 'mse', 'optimizer': 'adam', 'graph_mode': 'off', 'use_snp_selection': True, 'num_snps': 54763}. Best is trial 83 with value: 0.377423297269324.
[I 2025-12-06 07:26:34,327] Trial 104 finished with value: 0.3713226645891799 and parameters: {'model_type': 'mlp', 'hidden_dims': '[512, 128]', 'dropout': 0.5310192799163099, 'batch_norm': False, 'lr': 6.705833529219321e-06, 'weight_decay': 1.7742470700542541e-06, 'epochs': 76, 'loss': 'mse', 'optimizer': 'adam', 'graph_mode': 'off', 'use_snp_selection': True, 'num_snps': 58296}. Best is trial 83 with value: 0.377423297269324.
[I 2025-12-06 07:27:22,518] Trial 105 finished with value: 0.33351727990393903 and parameters: {'model_type': 'mlp', 'hidden_dims': '[512, 128]', 'dropout': 0.5615645099358012, 'batch_norm': False, 'lr': 2.609743167698751e-06, 'weight_decay': 4.807805328879759e-07, 'epochs': 62, 'loss': 'mse', 'optimizer': 'adam', 'graph_mode': 'off', 'use_snp_selection': True, 'num_snps': 55208}. Best is trial 83 with value: 0.377423297269324.
[I 2025-12-06 07:28:17,752] Trial 106 finished with value: 0.3660874425404281 and parameters: {'model_type': 'mlp', 'hidden_dims': '[512, 128]', 'dropout': 0.5453918225966795, 'batch_norm': False, 'lr': 4.000543223803785e-06, 'weight_decay': 8.854179006578268e-07, 'epochs': 101, 'loss': 'mse', 'optimizer': 'adam', 'graph_mode': 'off', 'use_snp_selection': True, 'num_snps': 55771}. Best is trial 83 with value: 0.377423297269324.
[I 2025-12-06 07:29:19,465] Trial 107 finished with value: 0.37800007718678985 and parameters: {'model_type': 'mlp', 'hidden_dims': '[512, 128]', 'dropout': 0.5724355559555669, 'batch_norm': False, 'lr': 5.483531376256563e-06, 'weight_decay': 6.610882180337482e-07, 'epochs': 131, 'loss': 'mse', 'optimizer': 'adam', 'graph_mode': 'off', 'use_snp_selection': True, 'num_snps': 58245}. Best is trial 107 with value: 0.37800007718678985.
[I 2025-12-06 07:30:12,823] Trial 108 finished with value: 0.33483625449543286 and parameters: {'model_type': 'mlp', 'hidden_dims': '[512, 128]', 'dropout': 0.5643712370159759, 'batch_norm': True, 'lr': 5.051563688763674e-06, 'weight_decay': 6.577971820809333e-07, 'epochs': 83, 'loss': 'mse', 'optimizer': 'adam', 'graph_mode': 'off', 'use_snp_selection': True, 'num_snps': 57995}. Best is trial 107 with value: 0.37800007718678985.
[I 2025-12-06 07:31:14,297] Trial 109 finished with value: 0.37175865979478667 and parameters: {'model_type': 'mlp', 'hidden_dims': '[512, 128]', 'dropout': 0.593216007876605, 'batch_norm': False, 'lr': 6.428036298246833e-06, 'weight_decay': 1.0427416731446868e-06, 'epochs': 129, 'loss': 'mse', 'optimizer': 'adam', 'graph_mode': 'off', 'use_snp_selection': True, 'num_snps': 58594}. Best is trial 107 with value: 0.37800007718678985.
[I 2025-12-06 07:32:08,114] Trial 110 finished with value: 0.37025110850731036 and parameters: {'model_type': 'mlp', 'hidden_dims': '[512, 128]', 'dropout': 0.5493529023318092, 'batch_norm': False, 'lr': 1.2612918732521415e-05, 'weight_decay': 3.303782418054926e-07, 'epochs': 117, 'loss': 'mse', 'optimizer': 'adam', 'graph_mode': 'off', 'use_snp_selection': True, 'num_snps': 49610}. Best is trial 107 with value: 0.37800007718678985.
[I 2025-12-06 07:33:09,429] Trial 111 finished with value: 0.37686183260718586 and parameters: {'model_type': 'mlp', 'hidden_dims': '[512, 128]', 'dropout': 0.5317407690179157, 'batch_norm': False, 'lr': 5.786498306575043e-06, 'weight_decay': 5.515721908521257e-07, 'epochs': 148, 'loss': 'mse', 'optimizer': 'adam', 'graph_mode': 'off', 'use_snp_selection': True, 'num_snps': 53451}. Best is trial 107 with value: 0.37800007718678985.
[I 2025-12-06 07:34:10,580] Trial 112 finished with value: 0.3716280787342018 and parameters: {'model_type': 'mlp', 'hidden_dims': '[512, 128]', 'dropout': 0.5738057733562377, 'batch_norm': False, 'lr': 8.656797551557779e-06, 'weight_decay': 3.8533531226489317e-07, 'epochs': 136, 'loss': 'mse', 'optimizer': 'adam', 'graph_mode': 'off', 'use_snp_selection': True, 'num_snps': 55809}. Best is trial 107 with value: 0.37800007718678985.
[I 2025-12-06 07:35:08,825] Trial 113 finished with value: 0.37310941652662793 and parameters: {'model_type': 'mlp', 'hidden_dims': '[512, 128]', 'dropout': 0.5278080748373859, 'batch_norm': False, 'lr': 5.673984741790907e-06, 'weight_decay': 5.313291447015282e-07, 'epochs': 107, 'loss': 'mse', 'optimizer': 'adam', 'graph_mode': 'off', 'use_snp_selection': True, 'num_snps': 58769}. Best is trial 107 with value: 0.37800007718678985.
[I 2025-12-06 07:35:58,893] Trial 114 finished with value: 0.36691866286527974 and parameters: {'model_type': 'mlp', 'hidden_dims': '[512, 128]', 'dropout': 0.5560826002152912, 'batch_norm': False, 'lr': 6.53717598138118e-06, 'weight_decay': 6.799099454028735e-07, 'epochs': 77, 'loss': 'mse', 'optimizer': 'adam', 'graph_mode': 'off', 'use_snp_selection': True, 'num_snps': 53902}. Best is trial 107 with value: 0.37800007718678985.
[I 2025-12-06 07:36:51,215] Trial 115 finished with value: 0.3685754125572123 and parameters: {'model_type': 'mlp', 'hidden_dims': '[512, 128]', 'dropout': 0.5766359596086086, 'batch_norm': False, 'lr': 4.375108057325236e-06, 'weight_decay': 1.49364806724188e-06, 'epochs': 99, 'loss': 'mse', 'optimizer': 'adam', 'graph_mode': 'off', 'use_snp_selection': True, 'num_snps': 51733}. Best is trial 107 with value: 0.37800007718678985.
[I 2025-12-06 07:37:45,512] Trial 116 finished with value: 0.37175683092309697 and parameters: {'model_type': 'mlp', 'hidden_dims': '[512, 128]', 'dropout': 0.4889939142045976, 'batch_norm': False, 'lr': 4.982271975060603e-06, 'weight_decay': 4.639305362121876e-07, 'epochs': 95, 'loss': 'mse', 'optimizer': 'adam', 'graph_mode': 'off', 'use_snp_selection': True, 'num_snps': 55699}. Best is trial 107 with value: 0.37800007718678985.
[I 2025-12-06 07:38:41,952] Trial 117 finished with value: 0.3699723451576479 and parameters: {'model_type': 'mlp', 'hidden_dims': '[512, 128]', 'dropout': 0.47138168196828256, 'batch_norm': False, 'lr': 9.859473413396428e-06, 'weight_decay': 1.1259489187296034e-06, 'epochs': 117, 'loss': 'mse', 'optimizer': 'adam', 'graph_mode': 'off', 'use_snp_selection': True, 'num_snps': 53773}. Best is trial 107 with value: 0.37800007718678985.
[I 2025-12-06 07:39:38,973] Trial 118 finished with value: 0.3692222091784151 and parameters: {'model_type': 'mlp', 'hidden_dims': '[512, 128]', 'dropout': 0.5862158706481668, 'batch_norm': False, 'lr': 7.651491679680565e-06, 'weight_decay': 9.305605494114777e-07, 'epochs': 105, 'loss': 'mse', 'optimizer': 'adam', 'graph_mode': 'off', 'use_snp_selection': True, 'num_snps': 58006}. Best is trial 107 with value: 0.37800007718678985.
[I 2025-12-06 07:40:41,238] Trial 119 finished with value: 0.37613380727830525 and parameters: {'model_type': 'mlp', 'hidden_dims': '[512, 128]', 'dropout': 0.5420736801708163, 'batch_norm': False, 'lr': 5.599525008637351e-06, 'weight_decay': 2.86744397910315e-07, 'epochs': 140, 'loss': 'mse', 'optimizer': 'adam', 'graph_mode': 'off', 'use_snp_selection': True, 'num_snps': 56425}. Best is trial 107 with value: 0.37800007718678985.
