[I 2025-12-05 15:47:41,752] Trial 34 finished with value: 0.047669767357568796 and parameters: {'model_type': 'mlp', 'hidden_dims': '[128, 64]', 'dropout': 0.18589388942558216, 'batch_norm': True, 'lr': 0.0003857250260043045, 'weight_decay': 0.00020126894735144767, 'epochs': 131, 'loss': 'mse', 'optimizer': 'adam', 'graph_mode': 'off', 'use_snp_selection': True, 'num_snps': 23439}. Best is trial 30 with value: 0.0646982345676169.
[I 2025-12-05 15:47:42,719] Trial 35 finished with value: 0.01378362167625289 and parameters: {'model_type': 'mlp', 'hidden_dims': '[128, 64]', 'dropout': 0.2831363351202483, 'batch_norm': False, 'lr': 2.8945959070496487e-06, 'weight_decay': 0.0005626149259783705, 'epochs': 260, 'loss': 'mse', 'optimizer': 'adam', 'graph_mode': 'off', 'use_snp_selection': True, 'num_snps': 8660}. Best is trial 30 with value: 0.0646982345676169.
[I 2025-12-05 15:47:44,281] Trial 36 finished with value: 0.053680582383779304 and parameters: {'model_type': 'mlp', 'hidden_dims': '[128, 64]', 'dropout': 0.24590605067541596, 'batch_norm': True, 'lr': 3.9837155560530947e-05, 'weight_decay': 1.752252585415167e-05, 'epochs': 336, 'loss': 'mse', 'optimizer': 'adam', 'graph_mode': 'off', 'use_snp_selection': True, 'num_snps': 23660}. Best is trial 30 with value: 0.0646982345676169.
[I 2025-12-05 15:47:45,226] Trial 37 finished with value: 0.045033996277695595 and parameters: {'model_type': 'mlp', 'hidden_dims': '[512, 64]', 'dropout': 0.13660432339651418, 'batch_norm': True, 'lr': 0.0002490260850621674, 'weight_decay': 0.0001763879669429817, 'epochs': 159, 'loss': 'mse', 'optimizer': 'adam', 'graph_mode': 'off', 'use_snp_selection': True, 'num_snps': 9365}. Best is trial 30 with value: 0.0646982345676169.
[I 2025-12-05 15:47:45,991] Trial 38 finished with value: 0.026972516259289814 and parameters: {'model_type': 'mlp', 'hidden_dims': '[128, 64]', 'dropout': 0.20396984685964398, 'batch_norm': False, 'lr': 8.505022421953498e-05, 'weight_decay': 0.00036334676286105136, 'epochs': 208, 'loss': 'mse', 'optimizer': 'adam', 'graph_mode': 'off', 'use_snp_selection': True, 'num_snps': 2203}. Best is trial 30 with value: 0.0646982345676169.
[I 2025-12-05 15:47:47,860] Trial 39 finished with value: 0.042967101947719216 and parameters: {'model_type': 'mlp', 'hidden_dims': '[128, 64]', 'dropout': 0.32166187182812567, 'batch_norm': True, 'lr': 0.00014905394954346484, 'weight_decay': 2.8942498755049446e-05, 'epochs': 140, 'loss': 'mse', 'optimizer': 'adam', 'graph_mode': 'off', 'use_snp_selection': True, 'num_snps': 44480}. Best is trial 30 with value: 0.0646982345676169.
[I 2025-12-05 15:47:49,178] Trial 40 finished with value: 0.055627490083441984 and parameters: {'model_type': 'mlp', 'hidden_dims': '[512, 64]', 'dropout': 0.12324537983918173, 'batch_norm': True, 'lr': 4.096843931649585e-05, 'weight_decay': 0.0009132355218226541, 'epochs': 291, 'loss': 'mse', 'optimizer': 'adam', 'graph_mode': 'off', 'use_snp_selection': True, 'num_snps': 15722}. Best is trial 30 with value: 0.0646982345676169.
[I 2025-12-05 15:47:50,521] Trial 41 finished with value: 0.047813466591501486 and parameters: {'model_type': 'mlp', 'hidden_dims': '[512, 64]', 'dropout': 0.12791608162818366, 'batch_norm': True, 'lr': 4.529310463002266e-05, 'weight_decay': 0.0009691796946117711, 'epochs': 290, 'loss': 'mse', 'optimizer': 'adam', 'graph_mode': 'off', 'use_snp_selection': True, 'num_snps': 16547}. Best is trial 30 with value: 0.0646982345676169.
[I 2025-12-05 15:47:52,124] Trial 42 finished with value: 0.06171636182836165 and parameters: {'model_type': 'mlp', 'hidden_dims': '[512, 64]', 'dropout': 0.2690945424755161, 'batch_norm': True, 'lr': 6.397647626044174e-05, 'weight_decay': 0.00046090683153021244, 'epochs': 252, 'loss': 'mse', 'optimizer': 'adam', 'graph_mode': 'off', 'use_snp_selection': True, 'num_snps': 25345}. Best is trial 30 with value: 0.0646982345676169.
[I 2025-12-05 15:47:53,838] Trial 43 finished with value: -0.022967179558283087 and parameters: {'model_type': 'mlp', 'hidden_dims': '[512, 64]', 'dropout': 0.2885035375087929, 'batch_norm': True, 'lr': 8.626351460802893e-06, 'weight_decay': 0.0004042502187323495, 'epochs': 258, 'loss': 'mse', 'optimizer': 'adam', 'graph_mode': 'off', 'use_snp_selection': True, 'num_snps': 28913}. Best is trial 30 with value: 0.0646982345676169.
[I 2025-12-05 15:47:55,491] Trial 44 finished with value: 0.056422349310210035 and parameters: {'model_type': 'mlp', 'hidden_dims': '[512, 128]', 'dropout': 0.26870376665210405, 'batch_norm': True, 'lr': 7.757215466077482e-05, 'weight_decay': 0.0006216924976916348, 'epochs': 343, 'loss': 'mse', 'optimizer': 'adam', 'graph_mode': 'off', 'use_snp_selection': True, 'num_snps': 24349}. Best is trial 30 with value: 0.0646982345676169.
[I 2025-12-05 15:47:57,291] Trial 45 finished with value: 0.03784409853244552 and parameters: {'model_type': 'mlp', 'hidden_dims': '[512, 128]', 'dropout': 0.26170493615908796, 'batch_norm': True, 'lr': 6.967184686655158e-05, 'weight_decay': 0.00023436853656734843, 'epochs': 345, 'loss': 'mse', 'optimizer': 'adam', 'graph_mode': 'off', 'use_snp_selection': True, 'num_snps': 27592}. Best is trial 30 with value: 0.0646982345676169.
[I 2025-12-05 15:47:59,421] Trial 46 finished with value: 0.061974588004001095 and parameters: {'model_type': 'mlp', 'hidden_dims': '[512, 128]', 'dropout': 0.3816497058672774, 'batch_norm': True, 'lr': 0.0002738091213909015, 'weight_decay': 0.000647412603503666, 'epochs': 314, 'loss': 'mse', 'optimizer': 'adam', 'graph_mode': 'off', 'use_snp_selection': True, 'num_snps': 35375}. Best is trial 30 with value: 0.0646982345676169.
[I 2025-12-05 15:48:01,486] Trial 47 finished with value: 0.013242694940044247 and parameters: {'model_type': 'mlp', 'hidden_dims': '[512, 128]', 'dropout': 0.3895826957411338, 'batch_norm': False, 'lr': 0.0002469165529672141, 'weight_decay': 6.443567722432985e-05, 'epochs': 312, 'loss': 'mse', 'optimizer': 'adam', 'graph_mode': 'off', 'use_snp_selection': True, 'num_snps': 35135}. Best is trial 30 with value: 0.0646982345676169.
[I 2025-12-05 15:48:03,715] Trial 48 finished with value: 0.03283296221841021 and parameters: {'model_type': 'mlp', 'hidden_dims': '[256, 128, 64]', 'dropout': 0.3617532797533255, 'batch_norm': True, 'lr': 0.00011376933241539872, 'weight_decay': 0.00012093551170501768, 'epochs': 326, 'loss': 'mse', 'optimizer': 'adam', 'graph_mode': 'off', 'use_snp_selection': True, 'num_snps': 42964}. Best is trial 30 with value: 0.0646982345676169.
[I 2025-12-05 15:48:05,852] Trial 49 finished with value: 0.044906417867813485 and parameters: {'model_type': 'mlp', 'hidden_dims': '[512, 128]', 'dropout': 0.3194493080804421, 'batch_norm': True, 'lr': 0.00062526308156907, 'weight_decay': 0.0005194000265891786, 'epochs': 241, 'loss': 'mse', 'optimizer': 'adam', 'graph_mode': 'off', 'use_snp_selection': True, 'num_snps': 38925}. Best is trial 30 with value: 0.0646982345676169.
[I 2025-12-05 15:48:06,860] Trial 50 finished with value: 0.055480324147877076 and parameters: {'model_type': 'mlp', 'hidden_dims': '[128, 64]', 'dropout': 0.3657578647329595, 'batch_norm': True, 'lr': 0.00018913049624996817, 'weight_decay': 1.5286025047280384e-05, 'epochs': 273, 'loss': 'mse', 'optimizer': 'adam', 'graph_mode': 'off', 'use_snp_selection': True, 'num_snps': 6352}. Best is trial 30 with value: 0.0646982345676169.
[I 2025-12-05 15:48:08,555] Trial 51 finished with value: 0.05330903084268822 and parameters: {'model_type': 'mlp', 'hidden_dims': '[512, 128]', 'dropout': 0.26112394612842327, 'batch_norm': True, 'lr': 0.0003232509155868773, 'weight_decay': 0.0006708439546862093, 'epochs': 350, 'loss': 'mse', 'optimizer': 'adam', 'graph_mode': 'off', 'use_snp_selection': True, 'num_snps': 23899}. Best is trial 30 with value: 0.0646982345676169.
[I 2025-12-05 15:48:10,471] Trial 52 finished with value: 0.03843850044402553 and parameters: {'model_type': 'mlp', 'hidden_dims': '[512, 128]', 'dropout': 0.22405502720376336, 'batch_norm': True, 'lr': 9.948846973443037e-05, 'weight_decay': 0.0003067704344920655, 'epochs': 324, 'loss': 'mse', 'optimizer': 'adam', 'graph_mode': 'off', 'use_snp_selection': True, 'num_snps': 31091}. Best is trial 30 with value: 0.0646982345676169.
[I 2025-12-05 15:48:12,190] Trial 53 finished with value: 0.029640447001248613 and parameters: {'model_type': 'mlp', 'hidden_dims': '[512, 128]', 'dropout': 0.3184117262933617, 'batch_norm': True, 'lr': 6.393463389480358e-05, 'weight_decay': 0.0004795321514660172, 'epochs': 302, 'loss': 'mse', 'optimizer': 'adam', 'graph_mode': 'off', 'use_snp_selection': True, 'num_snps': 26372}. Best is trial 30 with value: 0.0646982345676169.
[I 2025-12-05 15:48:13,579] Trial 54 finished with value: -0.00883382836116945 and parameters: {'model_type': 'mlp', 'hidden_dims': '[512, 128]', 'dropout': 0.2643892072497827, 'batch_norm': True, 'lr': 2.3331591024480374e-05, 'weight_decay': 0.00016219473919518052, 'epochs': 223, 'loss': 'mse', 'optimizer': 'adam', 'graph_mode': 'off', 'use_snp_selection': True, 'num_snps': 21151}. Best is trial 30 with value: 0.0646982345676169.
[I 2025-12-05 15:48:15,641] Trial 55 finished with value: 0.049486443819821355 and parameters: {'model_type': 'mlp', 'hidden_dims': '[512, 128]', 'dropout': 0.2990479914344535, 'batch_norm': True, 'lr': 0.00013637705913871164, 'weight_decay': 0.0002935067383104586, 'epochs': 337, 'loss': 'mse', 'optimizer': 'adam', 'graph_mode': 'off', 'use_snp_selection': True, 'num_snps': 33513}. Best is trial 30 with value: 0.0646982345676169.
[I 2025-12-05 15:48:17,487] Trial 56 finished with value: 0.04760147580013526 and parameters: {'model_type': 'mlp', 'hidden_dims': '[128, 64]', 'dropout': 0.18323227097371414, 'batch_norm': True, 'lr': 0.00020983670530965197, 'weight_decay': 6.1857690593537445e-06, 'epochs': 199, 'loss': 'mse', 'optimizer': 'adam', 'graph_mode': 'off', 'use_snp_selection': True, 'num_snps': 40740}. Best is trial 30 with value: 0.0646982345676169.
[I 2025-12-05 15:48:19,734] Trial 57 finished with value: 0.058229783543597945 and parameters: {'model_type': 'mlp', 'hidden_dims': '[256, 128]', 'dropout': 0.2787148872640251, 'batch_norm': True, 'lr': 0.00011027489539164934, 'weight_decay': 9.65081334699e-05, 'epochs': 310, 'loss': 'mse', 'optimizer': 'adam', 'graph_mode': 'off', 'use_snp_selection': True, 'num_snps': 47545}. Best is trial 30 with value: 0.0646982345676169.
[I 2025-12-05 15:48:21,980] Trial 58 finished with value: 0.0068468546257514536 and parameters: {'model_type': 'mlp', 'hidden_dims': '[256, 128]', 'dropout': 0.41908411710552, 'batch_norm': False, 'lr': 1.0889258301622254e-06, 'weight_decay': 2.4573659119526743e-05, 'epochs': 254, 'loss': 'mse', 'optimizer': 'adam', 'graph_mode': 'off', 'use_snp_selection': True, 'num_snps': 49669}. Best is trial 30 with value: 0.0646982345676169.
[I 2025-12-05 15:48:24,381] Trial 59 finished with value: 0.040969103279671314 and parameters: {'model_type': 'mlp', 'hidden_dims': '[256, 128]', 'dropout': 0.3330701388232408, 'batch_norm': True, 'lr': 0.00011774338386334197, 'weight_decay': 0.00011666245753202402, 'epochs': 283, 'loss': 'mse', 'optimizer': 'adam', 'graph_mode': 'off', 'use_snp_selection': True, 'num_snps': 52510}. Best is trial 30 with value: 0.0646982345676169.
[I 2025-12-05 15:48:25,438] Trial 60 finished with value: 0.06781677087822072 and parameters: {'model_type': 'mlp', 'hidden_dims': '[256, 128]', 'dropout': 0.2430281254810792, 'batch_norm': True, 'lr': 0.00029464003063388035, 'weight_decay': 5.741847296524997e-05, 'epochs': 304, 'loss': 'mse', 'optimizer': 'adam', 'graph_mode': 'off', 'use_snp_selection': True, 'num_snps': 6371}. Best is trial 60 with value: 0.06781677087822072.
[I 2025-12-05 15:48:26,572] Trial 61 finished with value: 0.04593979222865377 and parameters: {'model_type': 'mlp', 'hidden_dims': '[256, 128]', 'dropout': 0.24191278999495494, 'batch_norm': True, 'lr': 0.0004983308076429783, 'weight_decay': 5.175098518783423e-05, 'epochs': 311, 'loss': 'mse', 'optimizer': 'adam', 'graph_mode': 'off', 'use_snp_selection': True, 'num_snps': 7893}. Best is trial 60 with value: 0.06781677087822072.
[I 2025-12-05 15:48:27,568] Trial 62 finished with value: 0.05514460147334082 and parameters: {'model_type': 'mlp', 'hidden_dims': '[256, 128]', 'dropout': 0.21766777320696368, 'batch_norm': True, 'lr': 0.0002646820253099622, 'weight_decay': 7.982802870970468e-05, 'epochs': 297, 'loss': 'mse', 'optimizer': 'adam', 'graph_mode': 'off', 'use_snp_selection': True, 'num_snps': 4702}. Best is trial 60 with value: 0.06781677087822072.
[I 2025-12-05 15:48:28,785] Trial 63 finished with value: 0.05661666421731309 and parameters: {'model_type': 'mlp', 'hidden_dims': '[256, 128]', 'dropout': 0.37611098109082564, 'batch_norm': True, 'lr': 0.00016075576726732414, 'weight_decay': 3.50903942212343e-05, 'epochs': 317, 'loss': 'mse', 'optimizer': 'adam', 'graph_mode': 'off', 'use_snp_selection': True, 'num_snps': 11694}. Best is trial 60 with value: 0.06781677087822072.
[I 2025-12-05 15:48:29,998] Trial 64 finished with value: 0.06420852476672229 and parameters: {'model_type': 'mlp', 'hidden_dims': '[256, 128]', 'dropout': 0.2488593085349701, 'batch_norm': True, 'lr': 0.00032749436158188786, 'weight_decay': 1.3044877850537022e-05, 'epochs': 271, 'loss': 'mse', 'optimizer': 'adam', 'graph_mode': 'off', 'use_snp_selection': True, 'num_snps': 13541}. Best is trial 60 with value: 0.06781677087822072.
[I 2025-12-05 15:48:31,336] Trial 65 finished with value: 0.04535354119634954 and parameters: {'model_type': 'mlp', 'hidden_dims': '[256, 128, 64]', 'dropout': 0.2352837564765391, 'batch_norm': True, 'lr': 0.0003412787247493696, 'weight_decay': 1.3846959127978504e-05, 'epochs': 271, 'loss': 'mae', 'optimizer': 'adam', 'graph_mode': 'off', 'use_snp_selection': True, 'num_snps': 13756}. Best is trial 60 with value: 0.06781677087822072.
[I 2025-12-05 15:48:32,327] Trial 66 finished with value: 0.028806211715495862 and parameters: {'model_type': 'mlp', 'hidden_dims': '[256, 128]', 'dropout': 0.4077398184675896, 'batch_norm': True, 'lr': 0.0005380550943702698, 'weight_decay': 4.5270564252656296e-06, 'epochs': 251, 'loss': 'mse', 'optimizer': 'adam', 'graph_mode': 'off', 'use_snp_selection': True, 'num_snps': 5372}. Best is trial 60 with value: 0.06781677087822072.
[I 2025-12-05 15:48:33,424] Trial 67 finished with value: 0.047321294012261594 and parameters: {'model_type': 'mlp', 'hidden_dims': '[128, 64]', 'dropout': 0.29508446745037753, 'batch_norm': True, 'lr': 0.0002897749455943089, 'weight_decay': 1.2141770843393192e-05, 'epochs': 236, 'loss': 'mse', 'optimizer': 'adam', 'graph_mode': 'off', 'use_snp_selection': True, 'num_snps': 11793}. Best is trial 60 with value: 0.06781677087822072.
[I 2025-12-05 15:48:34,775] Trial 68 finished with value: 0.05029646081393269 and parameters: {'model_type': 'mlp', 'hidden_dims': '[256, 128]', 'dropout': 0.18707192237601863, 'batch_norm': True, 'lr': 0.0009170723239699647, 'weight_decay': 2.026469517558498e-05, 'epochs': 269, 'loss': 'mse', 'optimizer': 'adam', 'graph_mode': 'off', 'use_snp_selection': True, 'num_snps': 19046}. Best is trial 60 with value: 0.06781677087822072.
[I 2025-12-05 15:48:35,465] Trial 69 finished with value: 0.0664500821382462 and parameters: {'model_type': 'mlp', 'hidden_dims': '[512, 64]', 'dropout': 0.24988317627046117, 'batch_norm': True, 'lr': 0.0004450026181256065, 'weight_decay': 5.7353187266401285e-06, 'epochs': 55, 'loss': 'mse', 'optimizer': 'adam', 'graph_mode': 'off', 'use_snp_selection': True, 'num_snps': 5189}. Best is trial 60 with value: 0.06781677087822072.
[I 2025-12-05 15:48:36,128] Trial 70 finished with value: 0.06264103955303053 and parameters: {'model_type': 'mlp', 'hidden_dims': '[512, 64]', 'dropout': 0.21039329545728366, 'batch_norm': False, 'lr': 0.0007669917299967521, 'weight_decay': 5.594719736495451e-06, 'epochs': 57, 'loss': 'mae', 'optimizer': 'adam', 'graph_mode': 'off', 'use_snp_selection': True, 'num_snps': 4747}. Best is trial 60 with value: 0.06781677087822072.
[I 2025-12-05 15:48:36,772] Trial 71 finished with value: 0.05129322159424245 and parameters: {'model_type': 'mlp', 'hidden_dims': '[512, 64]', 'dropout': 0.21529910379949668, 'batch_norm': False, 'lr': 0.0007059845960691724, 'weight_decay': 5.944575900075727e-06, 'epochs': 54, 'loss': 'mae', 'optimizer': 'adam', 'graph_mode': 'off', 'use_snp_selection': True, 'num_snps': 4251}. Best is trial 60 with value: 0.06781677087822072.
[I 2025-12-05 15:48:37,569] Trial 72 finished with value: 0.03474213592549814 and parameters: {'model_type': 'mlp', 'hidden_dims': '[512, 64]', 'dropout': 0.25134217181058494, 'batch_norm': False, 'lr': 0.00044552236017080405, 'weight_decay': 2.8906658566929737e-06, 'epochs': 72, 'loss': 'mae', 'optimizer': 'adam', 'graph_mode': 'off', 'use_snp_selection': True, 'num_snps': 7845}. Best is trial 60 with value: 0.06781677087822072.
[I 2025-12-05 15:48:38,203] Trial 73 finished with value: 0.03866169391598059 and parameters: {'model_type': 'mlp', 'hidden_dims': '[512, 64]', 'dropout': 0.19339330611487257, 'batch_norm': False, 'lr': 0.0007148546943157388, 'weight_decay': 9.249002320489005e-06, 'epochs': 59, 'loss': 'mae', 'optimizer': 'adam', 'graph_mode': 'off', 'use_snp_selection': True, 'num_snps': 3290}. Best is trial 60 with value: 0.06781677087822072.
[I 2025-12-05 15:48:39,056] Trial 74 finished with value: 0.04529681091974149 and parameters: {'model_type': 'mlp', 'hidden_dims': '[512, 64]', 'dropout': 0.1656113766553705, 'batch_norm': False, 'lr': 0.0005550482724552834, 'weight_decay': 1.964725385598313e-06, 'epochs': 90, 'loss': 'mae', 'optimizer': 'adam', 'graph_mode': 'off', 'use_snp_selection': True, 'num_snps': 10011}. Best is trial 60 with value: 0.06781677087822072.
[I 2025-12-05 15:48:39,750] Trial 75 finished with value: 0.022546298979766684 and parameters: {'model_type': 'mlp', 'hidden_dims': '[512, 64]', 'dropout': 0.2278597639193195, 'batch_norm': False, 'lr': 0.0009660839456358191, 'weight_decay': 4.831064831063847e-06, 'epochs': 44, 'loss': 'mae', 'optimizer': 'adam', 'graph_mode': 'off', 'use_snp_selection': True, 'num_snps': 6262}. Best is trial 60 with value: 0.06781677087822072.
[I 2025-12-05 15:48:40,542] Trial 76 finished with value: 0.028811204394091555 and parameters: {'model_type': 'mlp', 'hidden_dims': '[512, 64]', 'dropout': 0.20338224417628412, 'batch_norm': True, 'lr': 0.00041779254253619094, 'weight_decay': 2.3453929386822067e-06, 'epochs': 64, 'loss': 'mse', 'optimizer': 'adam', 'graph_mode': 'off', 'use_snp_selection': True, 'num_snps': 7852}. Best is trial 60 with value: 0.06781677087822072.
[I 2025-12-05 15:48:41,203] Trial 77 finished with value: 0.0640486028199864 and parameters: {'model_type': 'mlp', 'hidden_dims': '[512, 64]', 'dropout': 0.30848240621421613, 'batch_norm': True, 'lr': 0.00034819051105373244, 'weight_decay': 1.048500307317771e-06, 'epochs': 84, 'loss': 'mae', 'optimizer': 'adam', 'graph_mode': 'off', 'use_snp_selection': True, 'num_snps': 2634}. Best is trial 60 with value: 0.06781677087822072.
[I 2025-12-05 15:48:41,875] Trial 78 finished with value: 0.034598428893458516 and parameters: {'model_type': 'mlp', 'hidden_dims': '[512, 64]', 'dropout': 0.27832317808558005, 'batch_norm': False, 'lr': 0.000780621955469824, 'weight_decay': 1.0787380597506743e-06, 'epochs': 109, 'loss': 'mae', 'optimizer': 'adam', 'graph_mode': 'off', 'use_snp_selection': True, 'num_snps': 2899}. Best is trial 60 with value: 0.06781677087822072.
[I 2025-12-05 15:48:42,519] Trial 79 finished with value: 0.03975591625830388 and parameters: {'model_type': 'mlp', 'hidden_dims': '[512, 64]', 'dropout': 0.21280798214240998, 'batch_norm': True, 'lr': 0.00021811399587236507, 'weight_decay': 1.6355469527326672e-07, 'epochs': 85, 'loss': 'mae', 'optimizer': 'adam', 'graph_mode': 'off', 'use_snp_selection': True, 'num_snps': 2007}. Best is trial 60 with value: 0.06781677087822072.
[I 2025-12-05 15:48:43,560] Trial 80 finished with value: 0.046893512579870386 and parameters: {'model_type': 'mlp', 'hidden_dims': '[512, 64]', 'dropout': 0.24848973834781765, 'batch_norm': True, 'lr': 0.0003567130858639155, 'weight_decay': 3.7535869190396962e-06, 'epochs': 97, 'loss': 'mae', 'optimizer': 'adam', 'graph_mode': 'off', 'use_snp_selection': True, 'num_snps': 14137}. Best is trial 60 with value: 0.06781677087822072.
[I 2025-12-05 15:48:44,313] Trial 81 finished with value: 0.06293712827771279 and parameters: {'model_type': 'mlp', 'hidden_dims': '[512, 64]', 'dropout': 0.3250713189128315, 'batch_norm': True, 'lr': 0.00047325135021514947, 'weight_decay': 7.562218610684873e-06, 'epochs': 77, 'loss': 'mae', 'optimizer': 'adam', 'graph_mode': 'off', 'use_snp_selection': True, 'num_snps': 6310}. Best is trial 60 with value: 0.06781677087822072.
[I 2025-12-05 15:48:45,042] Trial 82 finished with value: 0.06314233272791818 and parameters: {'model_type': 'mlp', 'hidden_dims': '[512, 64]', 'dropout': 0.3368481228573548, 'batch_norm': True, 'lr': 0.00044927460939652033, 'weight_decay': 1.0666870606966456e-06, 'epochs': 63, 'loss': 'mae', 'optimizer': 'adam', 'graph_mode': 'off', 'use_snp_selection': True, 'num_snps': 6066}. Best is trial 60 with value: 0.06781677087822072.
[I 2025-12-05 15:48:45,763] Trial 83 finished with value: 0.053455413067216274 and parameters: {'model_type': 'mlp', 'hidden_dims': '[512, 64]', 'dropout': 0.33860960773557996, 'batch_norm': True, 'lr': 0.0004300790640200123, 'weight_decay': 1.1944021938058004e-06, 'epochs': 51, 'loss': 'mae', 'optimizer': 'adam', 'graph_mode': 'off', 'use_snp_selection': True, 'num_snps': 6235}. Best is trial 60 with value: 0.06781677087822072.
