[I 2025-12-06 04:19:47,302] Trial 68 finished with value: 0.37895262142035296 and parameters: {'model_type': 'mlp', 'hidden_dims': '[512, 128]', 'dropout': 0.5058941498479217, 'batch_norm': False, 'lr': 2.982685464400671e-06, 'weight_decay': 0.00017100588922375277, 'epochs': 339, 'loss': 'mse', 'optimizer': 'adam', 'graph_mode': 'off', 'use_snp_selection': True, 'num_snps': 26900}. Best is trial 52 with value: 0.38377765493411103.
[I 2025-12-06 04:20:30,369] Trial 69 finished with value: 0.3586595021020173 and parameters: {'model_type': 'mlp', 'hidden_dims': '[256, 128, 64]', 'dropout': 0.5888521144010368, 'batch_norm': False, 'lr': 9.942385740740309e-05, 'weight_decay': 0.0003627191043424546, 'epochs': 145, 'loss': 'mse', 'optimizer': 'adam', 'graph_mode': 'off', 'use_snp_selection': True, 'num_snps': 40548}. Best is trial 52 with value: 0.38377765493411103.
[I 2025-12-06 04:21:48,270] Trial 70 finished with value: 0.3654418646235787 and parameters: {'model_type': 'mlp', 'hidden_dims': '[512, 128]', 'dropout': 0.4500798871508439, 'batch_norm': False, 'lr': 4.449572593496894e-06, 'weight_decay': 6.431502483604472e-05, 'epochs': 314, 'loss': 'mse', 'optimizer': 'adam', 'graph_mode': 'off', 'use_snp_selection': True, 'num_snps': 44903}. Best is trial 52 with value: 0.38377765493411103.
[I 2025-12-06 04:23:15,480] Trial 71 finished with value: 0.38088934963172766 and parameters: {'model_type': 'mlp', 'hidden_dims': '[512, 128]', 'dropout': 0.5481319209484387, 'batch_norm': False, 'lr': 1.9329817287899245e-06, 'weight_decay': 0.0002368710976892022, 'epochs': 343, 'loss': 'mse', 'optimizer': 'adam', 'graph_mode': 'off', 'use_snp_selection': True, 'num_snps': 49124}. Best is trial 52 with value: 0.38377765493411103.
[I 2025-12-06 04:24:49,166] Trial 72 finished with value: 0.3745397504941149 and parameters: {'model_type': 'mlp', 'hidden_dims': '[512, 128]', 'dropout': 0.5370494553122723, 'batch_norm': False, 'lr': 1.3137850063664602e-06, 'weight_decay': 0.00041921666764465205, 'epochs': 329, 'loss': 'mse', 'optimizer': 'adam', 'graph_mode': 'off', 'use_snp_selection': True, 'num_snps': 55517}. Best is trial 52 with value: 0.38377765493411103.
[I 2025-12-06 04:26:08,415] Trial 73 finished with value: 0.3802440294101662 and parameters: {'model_type': 'mlp', 'hidden_dims': '[512, 128]', 'dropout': 0.5669604452286545, 'batch_norm': False, 'lr': 1.8899528350743862e-06, 'weight_decay': 8.856318048604034e-05, 'epochs': 337, 'loss': 'mse', 'optimizer': 'adam', 'graph_mode': 'off', 'use_snp_selection': True, 'num_snps': 44077}. Best is trial 52 with value: 0.38377765493411103.
[I 2025-12-06 04:27:36,044] Trial 74 finished with value: 0.37956467935072136 and parameters: {'model_type': 'mlp', 'hidden_dims': '[512, 256]', 'dropout': 0.5211343733830941, 'batch_norm': False, 'lr': 2.465010304217915e-06, 'weight_decay': 0.0005700532357887288, 'epochs': 341, 'loss': 'mse', 'optimizer': 'adam', 'graph_mode': 'off', 'use_snp_selection': True, 'num_snps': 49810}. Best is trial 52 with value: 0.38377765493411103.
[I 2025-12-06 04:28:38,478] Trial 75 finished with value: 0.3793703471493943 and parameters: {'model_type': 'mlp', 'hidden_dims': '[512, 128]', 'dropout': 0.4821839755640399, 'batch_norm': False, 'lr': 3.372604818322917e-06, 'weight_decay': 1.4524062835615853e-05, 'epochs': 306, 'loss': 'mse', 'optimizer': 'adam', 'graph_mode': 'off', 'use_snp_selection': True, 'num_snps': 33326}. Best is trial 52 with value: 0.38377765493411103.
[I 2025-12-06 04:29:37,473] Trial 76 finished with value: 0.3532179833853881 and parameters: {'model_type': 'mlp', 'hidden_dims': '[512, 128]', 'dropout': 0.5544580409072319, 'batch_norm': False, 'lr': 1.4980336494577267e-06, 'weight_decay': 4.636195763135927e-05, 'epochs': 128, 'loss': 'mse', 'optimizer': 'adam', 'graph_mode': 'off', 'use_snp_selection': True, 'num_snps': 55918}. Best is trial 52 with value: 0.38377765493411103.
[I 2025-12-06 04:30:54,368] Trial 77 finished with value: 0.356775775171256 and parameters: {'model_type': 'mlp', 'hidden_dims': '[512, 64]', 'dropout': 0.5987281503026802, 'batch_norm': True, 'lr': 5.281027063632753e-06, 'weight_decay': 0.00020092078792948516, 'epochs': 330, 'loss': 'mse', 'optimizer': 'adam', 'graph_mode': 'off', 'use_snp_selection': True, 'num_snps': 42796}. Best is trial 52 with value: 0.38377765493411103.
[I 2025-12-06 04:31:42,198] Trial 78 finished with value: 0.37666279159902266 and parameters: {'model_type': 'mlp', 'hidden_dims': '[128, 64]', 'dropout': 0.5664478995251614, 'batch_norm': False, 'lr': 7.066631088139115e-06, 'weight_decay': 3.011374984997424e-05, 'epochs': 290, 'loss': 'mse', 'optimizer': 'adam', 'graph_mode': 'off', 'use_snp_selection': True, 'num_snps': 51781}. Best is trial 52 with value: 0.38377765493411103.
[I 2025-12-06 04:33:09,170] Trial 79 finished with value: 0.34943812919229156 and parameters: {'model_type': 'mlp', 'hidden_dims': '[512, 128]', 'dropout': 0.5849170165172124, 'batch_norm': False, 'lr': 1.6992813862893825e-05, 'weight_decay': 0.00026026438016770435, 'epochs': 278, 'loss': 'mse', 'optimizer': 'adam', 'graph_mode': 'off', 'use_snp_selection': True, 'num_snps': 57632}. Best is trial 52 with value: 0.38377765493411103.
[I 2025-12-06 04:34:20,137] Trial 80 finished with value: 0.37293862862785265 and parameters: {'model_type': 'mlp', 'hidden_dims': '[512, 256]', 'dropout': 0.5241891499602422, 'batch_norm': False, 'lr': 2.8960736326573536e-06, 'weight_decay': 0.00012959757105584366, 'epochs': 343, 'loss': 'mse', 'optimizer': 'adam', 'graph_mode': 'off', 'use_snp_selection': False}. Best is trial 52 with value: 0.38377765493411103.
[I 2025-12-06 04:35:43,206] Trial 81 finished with value: 0.37818401736915325 and parameters: {'model_type': 'mlp', 'hidden_dims': '[512, 128]', 'dropout': 0.5448890739463447, 'batch_norm': False, 'lr': 1.8927751774946738e-06, 'weight_decay': 0.0002324005933286025, 'epochs': 320, 'loss': 'mse', 'optimizer': 'adam', 'graph_mode': 'off', 'use_snp_selection': True, 'num_snps': 48557}. Best is trial 52 with value: 0.38377765493411103.
[I 2025-12-06 04:37:10,919] Trial 82 finished with value: 0.38418994542046764 and parameters: {'model_type': 'mlp', 'hidden_dims': '[512, 128]', 'dropout': 0.5528510354880685, 'batch_norm': False, 'lr': 2.060018852804772e-06, 'weight_decay': 0.0003281679570127398, 'epochs': 350, 'loss': 'mse', 'optimizer': 'adam', 'graph_mode': 'off', 'use_snp_selection': True, 'num_snps': 48734}. Best is trial 82 with value: 0.38418994542046764.
[I 2025-12-06 04:38:41,589] Trial 83 finished with value: 0.37658491804000394 and parameters: {'model_type': 'mlp', 'hidden_dims': '[512, 128]', 'dropout': 0.4938796863354298, 'batch_norm': False, 'lr': 2.472915900875986e-06, 'weight_decay': 0.0003443797238924205, 'epochs': 331, 'loss': 'mse', 'optimizer': 'adam', 'graph_mode': 'off', 'use_snp_selection': True, 'num_snps': 53333}. Best is trial 82 with value: 0.38418994542046764.
[I 2025-12-06 04:39:07,579] Trial 84 finished with value: 0.3073034769974588 and parameters: {'model_type': 'mlp', 'hidden_dims': '[512, 128]', 'dropout': 0.36620984708985477, 'batch_norm': False, 'lr': 1.2290283080517586e-06, 'weight_decay': 0.00015736063097987542, 'epochs': 344, 'loss': 'mse', 'optimizer': 'adam', 'graph_mode': 'off', 'use_snp_selection': True, 'num_snps': 3293}. Best is trial 82 with value: 0.38418994542046764.
[I 2025-12-06 04:40:26,590] Trial 85 finished with value: 0.37958737395625153 and parameters: {'model_type': 'mlp', 'hidden_dims': '[512, 128]', 'dropout': 0.5805520584348278, 'batch_norm': False, 'lr': 1.7029623985214703e-06, 'weight_decay': 0.0005966869876800607, 'epochs': 314, 'loss': 'mse', 'optimizer': 'adam', 'graph_mode': 'off', 'use_snp_selection': True, 'num_snps': 46381}. Best is trial 82 with value: 0.38418994542046764.
[I 2025-12-06 04:41:03,192] Trial 86 finished with value: 0.3308910118217917 and parameters: {'model_type': 'mlp', 'hidden_dims': '[256, 128, 64]', 'dropout': 0.5586805703767298, 'batch_norm': False, 'lr': 1.0000040913312611e-06, 'weight_decay': 0.00010805975816853802, 'epochs': 325, 'loss': 'mse', 'optimizer': 'adam', 'graph_mode': 'off', 'use_snp_selection': False}. Best is trial 82 with value: 0.38418994542046764.
[I 2025-12-06 04:42:42,867] Trial 87 finished with value: 0.3511243185952602 and parameters: {'model_type': 'mlp', 'hidden_dims': '[512, 128]', 'dropout': 0.5103211245457746, 'batch_norm': False, 'lr': 8.826969076806322e-06, 'weight_decay': 3.632463071390618e-06, 'epochs': 349, 'loss': 'mse', 'optimizer': 'adam', 'graph_mode': 'off', 'use_snp_selection': True, 'num_snps': 58012}. Best is trial 82 with value: 0.38418994542046764.
[I 2025-12-06 04:43:45,805] Trial 88 finished with value: 0.3379969526555229 and parameters: {'model_type': 'mlp', 'hidden_dims': '[512, 128]', 'dropout': 0.5412348944237579, 'batch_norm': True, 'lr': 1.5570230305592636e-06, 'weight_decay': 0.0009981389210075755, 'epochs': 301, 'loss': 'mae', 'optimizer': 'adam', 'graph_mode': 'off', 'use_snp_selection': False}. Best is trial 82 with value: 0.38418994542046764.
[I 2025-12-06 04:44:42,359] Trial 89 finished with value: 0.37868596193918147 and parameters: {'model_type': 'mlp', 'hidden_dims': '[512, 128]', 'dropout': 0.5754783696951926, 'batch_norm': False, 'lr': 4.180005006494457e-06, 'weight_decay': 0.00018598881854489655, 'epochs': 334, 'loss': 'mse', 'optimizer': 'adam', 'graph_mode': 'off', 'use_snp_selection': True, 'num_snps': 27131}. Best is trial 82 with value: 0.38418994542046764.
[I 2025-12-06 04:45:54,101] Trial 90 finished with value: 0.37948273376122876 and parameters: {'model_type': 'mlp', 'hidden_dims': '[512, 256]', 'dropout': 0.5311787454478241, 'batch_norm': False, 'lr': 3.207339945736483e-06, 'weight_decay': 8.311758374434835e-05, 'epochs': 350, 'loss': 'mae', 'optimizer': 'adam', 'graph_mode': 'off', 'use_snp_selection': False}. Best is trial 82 with value: 0.38418994542046764.
[I 2025-12-06 04:47:20,654] Trial 91 finished with value: 0.3814621664521113 and parameters: {'model_type': 'mlp', 'hidden_dims': '[512, 128]', 'dropout': 0.5497791706338879, 'batch_norm': False, 'lr': 2.004518567613786e-06, 'weight_decay': 0.00027527416036524083, 'epochs': 341, 'loss': 'mse', 'optimizer': 'adam', 'graph_mode': 'off', 'use_snp_selection': True, 'num_snps': 48413}. Best is trial 82 with value: 0.38418994542046764.
[I 2025-12-06 04:48:48,353] Trial 92 finished with value: 0.38148521728275747 and parameters: {'model_type': 'mlp', 'hidden_dims': '[512, 128]', 'dropout': 0.5542528231326418, 'batch_norm': False, 'lr': 2.2429412930927776e-06, 'weight_decay': 0.0003529940931155105, 'epochs': 339, 'loss': 'mse', 'optimizer': 'adam', 'graph_mode': 'off', 'use_snp_selection': True, 'num_snps': 49622}. Best is trial 82 with value: 0.38418994542046764.
[I 2025-12-06 04:50:13,134] Trial 93 finished with value: 0.38140909252811106 and parameters: {'model_type': 'mlp', 'hidden_dims': '[512, 128]', 'dropout': 0.5545567552350682, 'batch_norm': False, 'lr': 2.159218421496877e-06, 'weight_decay': 0.00027394347261611315, 'epochs': 342, 'loss': 'mse', 'optimizer': 'adam', 'graph_mode': 'off', 'use_snp_selection': True, 'num_snps': 47443}. Best is trial 82 with value: 0.38418994542046764.
[I 2025-12-06 04:51:39,050] Trial 94 finished with value: 0.3840300627691949 and parameters: {'model_type': 'mlp', 'hidden_dims': '[512, 128]', 'dropout': 0.588988607989539, 'batch_norm': False, 'lr': 2.170646948908715e-06, 'weight_decay': 0.000376420845411975, 'epochs': 342, 'loss': 'mse', 'optimizer': 'adam', 'graph_mode': 'off', 'use_snp_selection': True, 'num_snps': 47870}. Best is trial 82 with value: 0.38418994542046764.
[I 2025-12-06 04:53:05,556] Trial 95 finished with value: 0.38481260605352013 and parameters: {'model_type': 'mlp', 'hidden_dims': '[512, 128]', 'dropout': 0.5915936430578662, 'batch_norm': False, 'lr': 2.052874010594358e-06, 'weight_decay': 0.0003736351660101212, 'epochs': 342, 'loss': 'mse', 'optimizer': 'adam', 'graph_mode': 'off', 'use_snp_selection': True, 'num_snps': 47879}. Best is trial 95 with value: 0.38481260605352013.
[I 2025-12-06 04:54:24,271] Trial 96 finished with value: 0.3818580601156925 and parameters: {'model_type': 'mlp', 'hidden_dims': '[512, 128]', 'dropout': 0.5887274416055589, 'batch_norm': False, 'lr': 2.6436140703788782e-06, 'weight_decay': 0.0005054307907442356, 'epochs': 322, 'loss': 'mse', 'optimizer': 'adam', 'graph_mode': 'off', 'use_snp_selection': True, 'num_snps': 44947}. Best is trial 95 with value: 0.38481260605352013.
[I 2025-12-06 04:55:43,253] Trial 97 finished with value: 0.380022046156343 and parameters: {'model_type': 'mlp', 'hidden_dims': '[512, 128]', 'dropout': 0.5834516831589402, 'batch_norm': False, 'lr': 2.517567314059527e-06, 'weight_decay': 0.00038548507500749666, 'epochs': 321, 'loss': 'mse', 'optimizer': 'adam', 'graph_mode': 'off', 'use_snp_selection': True, 'num_snps': 45608}. Best is trial 95 with value: 0.38481260605352013.
[I 2025-12-06 04:57:04,455] Trial 98 finished with value: 0.3742260863809562 and parameters: {'model_type': 'mlp', 'hidden_dims': '[512, 128]', 'dropout': 0.5634160164234647, 'batch_norm': False, 'lr': 1.1896904920561996e-06, 'weight_decay': 0.00045743614081517867, 'epochs': 325, 'loss': 'mse', 'optimizer': 'adam', 'graph_mode': 'off', 'use_snp_selection': True, 'num_snps': 46928}. Best is trial 95 with value: 0.38481260605352013.
[I 2025-12-06 04:58:29,091] Trial 99 finished with value: 0.3814947508672527 and parameters: {'model_type': 'mlp', 'hidden_dims': '[512, 128]', 'dropout': 0.5891311153549739, 'batch_norm': False, 'lr': 2.1821492842622785e-06, 'weight_decay': 0.0005275584726231604, 'epochs': 341, 'loss': 'mse', 'optimizer': 'adam', 'graph_mode': 'off', 'use_snp_selection': True, 'num_snps': 47892}. Best is trial 95 with value: 0.38481260605352013.
[I 2025-12-06 04:59:25,622] Trial 100 finished with value: 0.3537793302989761 and parameters: {'model_type': 'mlp', 'hidden_dims': '[512, 128]', 'dropout': 0.5901539607636053, 'batch_norm': False, 'lr': 1.6637325258358877e-06, 'weight_decay': 0.0006845791848850288, 'epochs': 179, 'loss': 'mse', 'optimizer': 'adam', 'graph_mode': 'off', 'use_snp_selection': True, 'num_snps': 42021}. Best is trial 95 with value: 0.38481260605352013.
[I 2025-12-06 05:00:50,741] Trial 101 finished with value: 0.3795503193043172 and parameters: {'model_type': 'mlp', 'hidden_dims': '[512, 128]', 'dropout': 0.5703894716939025, 'batch_norm': False, 'lr': 2.9987311770034446e-06, 'weight_decay': 0.00030753098517833445, 'epochs': 341, 'loss': 'mse', 'optimizer': 'adam', 'graph_mode': 'off', 'use_snp_selection': True, 'num_snps': 48188}. Best is trial 95 with value: 0.38481260605352013.
[I 2025-12-06 05:02:09,703] Trial 102 finished with value: 0.3813537821530253 and parameters: {'model_type': 'mlp', 'hidden_dims': '[512, 128]', 'dropout': 0.5878211419932176, 'batch_norm': False, 'lr': 2.1263444954062345e-06, 'weight_decay': 0.0005148503603938106, 'epochs': 334, 'loss': 'mse', 'optimizer': 'adam', 'graph_mode': 'off', 'use_snp_selection': True, 'num_snps': 44246}. Best is trial 95 with value: 0.38481260605352013.
[I 2025-12-06 05:03:36,915] Trial 103 finished with value: 0.3842337085414764 and parameters: {'model_type': 'mlp', 'hidden_dims': '[512, 128]', 'dropout': 0.5554551301725935, 'batch_norm': False, 'lr': 2.2595261952446845e-06, 'weight_decay': 0.00028601960864368123, 'epochs': 329, 'loss': 'mse', 'optimizer': 'adam', 'graph_mode': 'off', 'use_snp_selection': True, 'num_snps': 50741}. Best is trial 95 with value: 0.38481260605352013.
[I 2025-12-06 05:05:04,647] Trial 104 finished with value: 0.3800596080814323 and parameters: {'model_type': 'mlp', 'hidden_dims': '[512, 128]', 'dropout': 0.5743444611148203, 'batch_norm': False, 'lr': 2.5771180751875846e-06, 'weight_decay': 0.0007275399491662268, 'epochs': 330, 'loss': 'mse', 'optimizer': 'adam', 'graph_mode': 'off', 'use_snp_selection': True, 'num_snps': 51368}. Best is trial 95 with value: 0.38481260605352013.
[I 2025-12-06 05:06:33,359] Trial 105 finished with value: 0.3745139562805712 and parameters: {'model_type': 'mlp', 'hidden_dims': '[512, 128]', 'dropout': 0.5580659368849706, 'batch_norm': False, 'lr': 3.6157293595275303e-06, 'weight_decay': 0.0003339231324704433, 'epochs': 317, 'loss': 'mse', 'optimizer': 'adam', 'graph_mode': 'off', 'use_snp_selection': True, 'num_snps': 53781}. Best is trial 95 with value: 0.38481260605352013.
[I 2025-12-06 05:08:01,296] Trial 106 finished with value: 0.3828201238577199 and parameters: {'model_type': 'mlp', 'hidden_dims': '[512, 128]', 'dropout': 0.5994714368876852, 'batch_norm': False, 'lr': 1.723359448398587e-06, 'weight_decay': 0.000488943653630712, 'epochs': 344, 'loss': 'mse', 'optimizer': 'adam', 'graph_mode': 'off', 'use_snp_selection': True, 'num_snps': 49780}. Best is trial 95 with value: 0.38481260605352013.
[I 2025-12-06 05:09:28,316] Trial 107 finished with value: 0.34917963166178134 and parameters: {'model_type': 'mlp', 'hidden_dims': '[512, 128]', 'dropout': 0.5948062805887696, 'batch_norm': True, 'lr': 1.534137898691853e-06, 'weight_decay': 0.0009595914084560599, 'epochs': 326, 'loss': 'mse', 'optimizer': 'adam', 'graph_mode': 'off', 'use_snp_selection': True, 'num_snps': 50462}. Best is trial 95 with value: 0.38481260605352013.
[I 2025-12-06 05:11:00,827] Trial 108 finished with value: 0.37836625527073575 and parameters: {'model_type': 'mlp', 'hidden_dims': '[512, 128]', 'dropout': 0.5833714661250023, 'batch_norm': False, 'lr': 1.719536875916321e-06, 'weight_decay': 0.0005153560392857021, 'epochs': 345, 'loss': 'mse', 'optimizer': 'adam', 'graph_mode': 'off', 'use_snp_selection': True, 'num_snps': 52793}. Best is trial 95 with value: 0.38481260605352013.
[I 2025-12-06 05:11:39,513] Trial 109 finished with value: 0.36981859888280544 and parameters: {'model_type': 'mlp', 'hidden_dims': '[512, 128]', 'dropout': 0.10156832919071063, 'batch_norm': False, 'lr': 1.247162503535377e-06, 'weight_decay': 0.0004079121330652035, 'epochs': 335, 'loss': 'mse', 'optimizer': 'adam', 'graph_mode': 'off', 'use_snp_selection': True, 'num_snps': 13196}. Best is trial 95 with value: 0.38481260605352013.
[I 2025-12-06 05:12:48,387] Trial 110 finished with value: 0.3788313828886516 and parameters: {'model_type': 'mlp', 'hidden_dims': '[512, 64]', 'dropout': 0.5703443840940443, 'batch_norm': False, 'lr': 2.8447180489663836e-06, 'weight_decay': 0.0005544709026083422, 'epochs': 311, 'loss': 'mse', 'optimizer': 'adam', 'graph_mode': 'off', 'use_snp_selection': True, 'num_snps': 38891}. Best is trial 95 with value: 0.38481260605352013.
[I 2025-12-06 05:14:15,843] Trial 111 finished with value: 0.3808595815853483 and parameters: {'model_type': 'mlp', 'hidden_dims': '[512, 128]', 'dropout': 0.5889745819530389, 'batch_norm': False, 'lr': 1.9245927241045565e-06, 'weight_decay': 0.00036279002367467413, 'epochs': 344, 'loss': 'mse', 'optimizer': 'adam', 'graph_mode': 'off', 'use_snp_selection': True, 'num_snps': 49189}. Best is trial 95 with value: 0.38481260605352013.
[I 2025-12-06 05:15:40,535] Trial 112 finished with value: 0.3844307459680993 and parameters: {'model_type': 'mlp', 'hidden_dims': '[512, 128]', 'dropout': 0.5979614290805222, 'batch_norm': False, 'lr': 2.321119297884922e-06, 'weight_decay': 0.0006752686992529888, 'epochs': 350, 'loss': 'mse', 'optimizer': 'adam', 'graph_mode': 'off', 'use_snp_selection': True, 'num_snps': 46651}. Best is trial 95 with value: 0.38481260605352013.
[I 2025-12-06 05:17:04,340] Trial 113 finished with value: 0.3783512827397645 and parameters: {'model_type': 'mlp', 'hidden_dims': '[512, 128]', 'dropout': 0.5798681071865301, 'batch_norm': False, 'lr': 2.321047177554837e-06, 'weight_decay': 0.0006981456654531575, 'epochs': 350, 'loss': 'mse', 'optimizer': 'adam', 'graph_mode': 'off', 'use_snp_selection': True, 'num_snps': 45787}. Best is trial 95 with value: 0.38481260605352013.
[I 2025-12-06 05:18:31,946] Trial 114 finished with value: 0.379481384608018 and parameters: {'model_type': 'mlp', 'hidden_dims': '[512, 128]', 'dropout': 0.5971501363705394, 'batch_norm': False, 'lr': 1.4004650151245244e-06, 'weight_decay': 0.0004683681512395149, 'epochs': 334, 'loss': 'mse', 'optimizer': 'adam', 'graph_mode': 'off', 'use_snp_selection': True, 'num_snps': 50678}. Best is trial 95 with value: 0.38481260605352013.
[I 2025-12-06 05:20:00,800] Trial 115 finished with value: 0.3333617387612765 and parameters: {'model_type': 'mlp', 'hidden_dims': '[512, 128]', 'dropout': 0.5661128858792764, 'batch_norm': False, 'lr': 4.1963591751149564e-05, 'weight_decay': 0.0006173217720360333, 'epochs': 327, 'loss': 'mse', 'optimizer': 'adam', 'graph_mode': 'off', 'use_snp_selection': True, 'num_snps': 53765}. Best is trial 95 with value: 0.38481260605352013.
[I 2025-12-06 05:20:46,088] Trial 116 finished with value: 0.3735875862056958 and parameters: {'model_type': 'mlp', 'hidden_dims': '[128, 64]', 'dropout': 0.2626042230285079, 'batch_norm': False, 'lr': 3.3258881236411946e-06, 'weight_decay': 0.0004029436230469148, 'epochs': 322, 'loss': 'mse', 'optimizer': 'adam', 'graph_mode': 'off', 'use_snp_selection': True, 'num_snps': 44149}. Best is trial 95 with value: 0.38481260605352013.
[I 2025-12-06 05:22:08,319] Trial 117 finished with value: 0.34278193167494664 and parameters: {'model_type': 'mlp', 'hidden_dims': '[512, 128]', 'dropout': 0.5997449167668916, 'batch_norm': False, 'lr': 0.000206932575202112, 'weight_decay': 0.00021091496300249012, 'epochs': 338, 'loss': 'mse', 'optimizer': 'adam', 'graph_mode': 'off', 'use_snp_selection': True, 'num_snps': 47510}. Best is trial 95 with value: 0.38481260605352013.
