[I 2025-12-05 15:30:10,624] Trial 66 finished with value: 0.02552889119242376 and parameters: {'model_type': 'mlp', 'hidden_dims': '[256, 128]', 'dropout': 0.38111511520364016, 'batch_norm': False, 'lr': 1.1029515529485764e-06, 'weight_decay': 6.781022521649117e-07, 'epochs': 203, 'loss': 'mse', 'optimizer': 'adam', 'graph_mode': 'off', 'use_snp_selection': True, 'num_snps': 41496}. Best is trial 18 with value: 0.10370338241819542.
[I 2025-12-05 15:30:12,425] Trial 67 finished with value: 0.07415402115502027 and parameters: {'model_type': 'mlp', 'hidden_dims': '[128, 64]', 'dropout': 0.2937365817150871, 'batch_norm': False, 'lr': 0.0009956573546164222, 'weight_decay': 2.955887145542788e-07, 'epochs': 139, 'loss': 'mse', 'optimizer': 'adam', 'graph_mode': 'off', 'use_snp_selection': True, 'num_snps': 32841}. Best is trial 18 with value: 0.10370338241819542.
[I 2025-12-05 15:30:14,299] Trial 68 finished with value: 0.07012762552645775 and parameters: {'model_type': 'mlp', 'hidden_dims': '[512, 128]', 'dropout': 0.3329585200702133, 'batch_norm': False, 'lr': 0.00020625133714372333, 'weight_decay': 2.9872659396002766e-06, 'epochs': 189, 'loss': 'mae', 'optimizer': 'adam', 'graph_mode': 'off', 'use_snp_selection': False}. Best is trial 18 with value: 0.10370338241819542.
[I 2025-12-05 15:30:15,373] Trial 69 finished with value: 0.006951231568431628 and parameters: {'model_type': 'mlp', 'hidden_dims': '[128, 64]', 'dropout': 0.35651135812302165, 'batch_norm': True, 'lr': 4.939961883438957e-05, 'weight_decay': 1.1334647021017801e-05, 'epochs': 121, 'loss': 'mse', 'optimizer': 'adam', 'graph_mode': 'off', 'use_snp_selection': True, 'num_snps': 8341}. Best is trial 18 with value: 0.10370338241819542.
[I 2025-12-05 15:30:17,118] Trial 70 finished with value: 0.0489254755365246 and parameters: {'model_type': 'mlp', 'hidden_dims': '[256, 128]', 'dropout': 0.44087094707941665, 'batch_norm': False, 'lr': 0.00013822784420471128, 'weight_decay': 9.460781506097005e-07, 'epochs': 244, 'loss': 'mse', 'optimizer': 'adam', 'graph_mode': 'off', 'use_snp_selection': True, 'num_snps': 24960}. Best is trial 18 with value: 0.10370338241819542.
[I 2025-12-05 15:30:18,392] Trial 71 finished with value: 0.10237645852575615 and parameters: {'model_type': 'mlp', 'hidden_dims': '[512, 256]', 'dropout': 0.1257072871285773, 'batch_norm': True, 'lr': 2.5346771078464277e-05, 'weight_decay': 2.9502603791912724e-07, 'epochs': 79, 'loss': 'mse', 'optimizer': 'adam', 'graph_mode': 'off', 'use_snp_selection': False}. Best is trial 18 with value: 0.10370338241819542.
[I 2025-12-05 15:30:19,640] Trial 72 finished with value: 0.040088615612974825 and parameters: {'model_type': 'mlp', 'hidden_dims': '[512, 256]', 'dropout': 0.13482635352712, 'batch_norm': True, 'lr': 2.9968898478367347e-05, 'weight_decay': 2.7324088706213735e-07, 'epochs': 81, 'loss': 'mse', 'optimizer': 'adam', 'graph_mode': 'off', 'use_snp_selection': False}. Best is trial 18 with value: 0.10370338241819542.
[I 2025-12-05 15:30:21,023] Trial 73 finished with value: 0.05905299193790344 and parameters: {'model_type': 'mlp', 'hidden_dims': '[512, 256]', 'dropout': 0.13097685355518973, 'batch_norm': True, 'lr': 1.3474831087361404e-05, 'weight_decay': 5.614482863937561e-07, 'epochs': 104, 'loss': 'mse', 'optimizer': 'adam', 'graph_mode': 'off', 'use_snp_selection': False}. Best is trial 18 with value: 0.10370338241819542.
[I 2025-12-05 15:30:22,223] Trial 74 finished with value: 0.03700953270507467 and parameters: {'model_type': 'mlp', 'hidden_dims': '[512, 256]', 'dropout': 0.4627431322703676, 'batch_norm': True, 'lr': 2.789866503901249e-05, 'weight_decay': 6.600953450195223e-06, 'epochs': 68, 'loss': 'mse', 'optimizer': 'adam', 'graph_mode': 'off', 'use_snp_selection': False}. Best is trial 18 with value: 0.10370338241819542.
[I 2025-12-05 15:30:23,306] Trial 75 finished with value: 0.10041464132421045 and parameters: {'model_type': 'mlp', 'hidden_dims': '[512, 256]', 'dropout': 0.10144654624179836, 'batch_norm': True, 'lr': 2.1819981785157657e-05, 'weight_decay': 4.537113693948979e-06, 'epochs': 54, 'loss': 'mse', 'optimizer': 'adam', 'graph_mode': 'off', 'use_snp_selection': False}. Best is trial 18 with value: 0.10370338241819542.
[I 2025-12-05 15:30:24,408] Trial 76 finished with value: 0.036151074153031 and parameters: {'model_type': 'mlp', 'hidden_dims': '[512, 256]', 'dropout': 0.11018383296432982, 'batch_norm': True, 'lr': 2.0688116492332744e-05, 'weight_decay': 2.8539032207306486e-05, 'epochs': 57, 'loss': 'mse', 'optimizer': 'adam', 'graph_mode': 'off', 'use_snp_selection': False}. Best is trial 18 with value: 0.10370338241819542.
[I 2025-12-05 15:30:25,552] Trial 77 finished with value: 0.04823231011759245 and parameters: {'model_type': 'mlp', 'hidden_dims': '[512, 256]', 'dropout': 0.10181218426743327, 'batch_norm': True, 'lr': 1.3048547417872352e-05, 'weight_decay': 4.460681104748997e-06, 'epochs': 63, 'loss': 'mse', 'optimizer': 'adam', 'graph_mode': 'off', 'use_snp_selection': False}. Best is trial 18 with value: 0.10370338241819542.
[I 2025-12-05 15:30:27,590] Trial 78 finished with value: 0.03478679232838844 and parameters: {'model_type': 'mlp', 'hidden_dims': '[512, 256]', 'dropout': 0.162891903071997, 'batch_norm': True, 'lr': 7.350238738550359e-06, 'weight_decay': 1.385793526725815e-05, 'epochs': 85, 'loss': 'mae', 'optimizer': 'adam', 'graph_mode': 'off', 'use_snp_selection': True, 'num_snps': 34944}. Best is trial 18 with value: 0.10370338241819542.
[I 2025-12-05 15:30:28,589] Trial 79 finished with value: 0.07915680833100516 and parameters: {'model_type': 'mlp', 'hidden_dims': '[512, 256]', 'dropout': 0.11491761643741727, 'batch_norm': True, 'lr': 0.0006363292044653179, 'weight_decay': 8.184622797331762e-06, 'epochs': 40, 'loss': 'mse', 'optimizer': 'adam', 'graph_mode': 'off', 'use_snp_selection': False}. Best is trial 18 with value: 0.10370338241819542.
[I 2025-12-05 15:30:29,864] Trial 80 finished with value: 0.07485875137368952 and parameters: {'model_type': 'mlp', 'hidden_dims': '[256, 128, 64]', 'dropout': 0.22903979877561426, 'batch_norm': True, 'lr': 0.0005159693923540114, 'weight_decay': 1.5126247813673005e-07, 'epochs': 73, 'loss': 'mse', 'optimizer': 'adam', 'graph_mode': 'off', 'use_snp_selection': True, 'num_snps': 15484}. Best is trial 18 with value: 0.10370338241819542.
[I 2025-12-05 15:30:31,238] Trial 81 finished with value: 0.059101857314758144 and parameters: {'model_type': 'mlp', 'hidden_dims': '[512, 64]', 'dropout': 0.36904288117894907, 'batch_norm': True, 'lr': 1.8680768937498643e-05, 'weight_decay': 2.2582430286768357e-06, 'epochs': 93, 'loss': 'mse', 'optimizer': 'adam', 'graph_mode': 'off', 'use_snp_selection': False}. Best is trial 18 with value: 0.10370338241819542.
[I 2025-12-05 15:30:32,164] Trial 82 finished with value: 0.06454886323401009 and parameters: {'model_type': 'mlp', 'hidden_dims': '[128, 64]', 'dropout': 0.12314078052138036, 'batch_norm': False, 'lr': 4.241509207095872e-05, 'weight_decay': 1.3200747166434886e-06, 'epochs': 223, 'loss': 'mse', 'optimizer': 'adam', 'graph_mode': 'off', 'use_snp_selection': False}. Best is trial 18 with value: 0.10370338241819542.
[I 2025-12-05 15:30:33,406] Trial 83 finished with value: 0.05806914916232572 and parameters: {'model_type': 'mlp', 'hidden_dims': '[256, 128]', 'dropout': 0.17227716381592312, 'batch_norm': True, 'lr': 2.866655506476966e-05, 'weight_decay': 6.088273608273624e-06, 'epochs': 202, 'loss': 'mse', 'optimizer': 'adam', 'graph_mode': 'off', 'use_snp_selection': False}. Best is trial 18 with value: 0.10370338241819542.
[I 2025-12-05 15:30:34,539] Trial 84 finished with value: 0.09053727260162406 and parameters: {'model_type': 'mlp', 'hidden_dims': '[512, 256]', 'dropout': 0.5509811935196718, 'batch_norm': False, 'lr': 0.0003468857229066662, 'weight_decay': 4.077309376181572e-06, 'epochs': 60, 'loss': 'mse', 'optimizer': 'adam', 'graph_mode': 'off', 'use_snp_selection': False}. Best is trial 18 with value: 0.10370338241819542.
[I 2025-12-05 15:30:35,746] Trial 85 finished with value: 0.02718374400959297 and parameters: {'model_type': 'mlp', 'hidden_dims': '[512, 256]', 'dropout': 0.5692276327074908, 'batch_norm': False, 'lr': 0.0008040289191064196, 'weight_decay': 4.33111629492859e-06, 'epochs': 75, 'loss': 'mse', 'optimizer': 'adam', 'graph_mode': 'off', 'use_snp_selection': False}. Best is trial 18 with value: 0.10370338241819542.
[I 2025-12-05 15:30:36,829] Trial 86 finished with value: 0.022229513786255352 and parameters: {'model_type': 'mlp', 'hidden_dims': '[512, 256]', 'dropout': 0.5175160650320023, 'batch_norm': False, 'lr': 0.0003505698133733888, 'weight_decay': 9.355699760063516e-06, 'epochs': 54, 'loss': 'mse', 'optimizer': 'adam', 'graph_mode': 'off', 'use_snp_selection': False}. Best is trial 18 with value: 0.10370338241819542.
[I 2025-12-05 15:30:38,213] Trial 87 finished with value: 0.09060530261657838 and parameters: {'model_type': 'mlp', 'hidden_dims': '[512, 256]', 'dropout': 0.5951457990351587, 'batch_norm': True, 'lr': 0.0002516621187434486, 'weight_decay': 1.7236043239127823e-05, 'epochs': 102, 'loss': 'mae', 'optimizer': 'adam', 'graph_mode': 'off', 'use_snp_selection': False}. Best is trial 18 with value: 0.10370338241819542.
[I 2025-12-05 15:30:39,331] Trial 88 finished with value: 0.06712390526349103 and parameters: {'model_type': 'mlp', 'hidden_dims': '[512, 256]', 'dropout': 0.5811038893641338, 'batch_norm': True, 'lr': 0.00027254975879712997, 'weight_decay': 4.0761100907332645e-05, 'epochs': 59, 'loss': 'mae', 'optimizer': 'adam', 'graph_mode': 'off', 'use_snp_selection': False}. Best is trial 18 with value: 0.10370338241819542.
[I 2025-12-05 15:30:42,315] Trial 89 finished with value: 0.06450423469776449 and parameters: {'model_type': 'mlp', 'hidden_dims': '[512, 256]', 'dropout': 0.5526034862076219, 'batch_norm': False, 'lr': 0.0002290875490199842, 'weight_decay': 1.8961650203347544e-05, 'epochs': 119, 'loss': 'mae', 'optimizer': 'adam', 'graph_mode': 'off', 'use_snp_selection': True, 'num_snps': 54323}. Best is trial 18 with value: 0.10370338241819542.
[I 2025-12-05 15:30:43,666] Trial 90 finished with value: 0.028566564886328985 and parameters: {'model_type': 'mlp', 'hidden_dims': '[512, 256]', 'dropout': 0.5942198631626765, 'batch_norm': False, 'lr': 0.00016682875366852786, 'weight_decay': 2.4758712205360492e-05, 'epochs': 86, 'loss': 'mae', 'optimizer': 'adam', 'graph_mode': 'off', 'use_snp_selection': False}. Best is trial 18 with value: 0.10370338241819542.
[I 2025-12-05 15:30:45,025] Trial 91 finished with value: 0.06494367202115094 and parameters: {'model_type': 'mlp', 'hidden_dims': '[512, 256]', 'dropout': 0.5327132739789541, 'batch_norm': True, 'lr': 0.0004519898347997385, 'weight_decay': 1.5200799910439795e-05, 'epochs': 97, 'loss': 'mae', 'optimizer': 'adam', 'graph_mode': 'off', 'use_snp_selection': False}. Best is trial 18 with value: 0.10370338241819542.
[I 2025-12-05 15:30:46,056] Trial 92 finished with value: 0.07283531574113022 and parameters: {'model_type': 'mlp', 'hidden_dims': '[512, 256]', 'dropout': 0.5506481378861648, 'batch_norm': True, 'lr': 0.0003419566482915019, 'weight_decay': 5.5228581527853473e-05, 'epochs': 45, 'loss': 'mae', 'optimizer': 'adam', 'graph_mode': 'off', 'use_snp_selection': False}. Best is trial 18 with value: 0.10370338241819542.
[I 2025-12-05 15:30:46,767] Trial 93 finished with value: 0.05784569658288614 and parameters: {'model_type': 'mlp', 'hidden_dims': '[128, 64]', 'dropout': 0.5779168067984978, 'batch_norm': True, 'lr': 2.4503701089643757e-05, 'weight_decay': 1.0603768368689899e-05, 'epochs': 76, 'loss': 'mse', 'optimizer': 'adam', 'graph_mode': 'off', 'use_snp_selection': False}. Best is trial 18 with value: 0.10370338241819542.
[I 2025-12-05 15:30:48,158] Trial 94 finished with value: 0.06755932960981295 and parameters: {'model_type': 'mlp', 'hidden_dims': '[512, 256]', 'dropout': 0.5988432141316653, 'batch_norm': True, 'lr': 0.0007673331671113367, 'weight_decay': 3.765900958529665e-06, 'epochs': 100, 'loss': 'mae', 'optimizer': 'adam', 'graph_mode': 'off', 'use_snp_selection': False}. Best is trial 18 with value: 0.10370338241819542.
[I 2025-12-05 15:30:50,995] Trial 95 finished with value: 0.07664291376544631 and parameters: {'model_type': 'mlp', 'hidden_dims': '[512, 128]', 'dropout': 0.1516688109280793, 'batch_norm': True, 'lr': 0.00039550028344826526, 'weight_decay': 5.953044040675551e-06, 'epochs': 348, 'loss': 'mse', 'optimizer': 'adam', 'graph_mode': 'off', 'use_snp_selection': False}. Best is trial 18 with value: 0.10370338241819542.
[I 2025-12-05 15:30:53,122] Trial 96 finished with value: 0.03291441237578166 and parameters: {'model_type': 'mlp', 'hidden_dims': '[128, 64]', 'dropout': 0.49262412538276673, 'batch_norm': False, 'lr': 2.3294687156157485e-06, 'weight_decay': 2.8713731356460894e-06, 'epochs': 49, 'loss': 'mse', 'optimizer': 'adam', 'graph_mode': 'off', 'use_snp_selection': True, 'num_snps': 46545}. Best is trial 18 with value: 0.10370338241819542.
[I 2025-12-05 15:30:54,033] Trial 97 finished with value: 0.07150878024651869 and parameters: {'model_type': 'mlp', 'hidden_dims': '[256, 128, 64]', 'dropout': 0.2875777670409401, 'batch_norm': False, 'lr': 0.0002992555568208555, 'weight_decay': 1.876247818186234e-06, 'epochs': 69, 'loss': 'mse', 'optimizer': 'adam', 'graph_mode': 'off', 'use_snp_selection': False}. Best is trial 18 with value: 0.10370338241819542.
[I 2025-12-05 15:30:55,972] Trial 98 finished with value: 0.06751189958449993 and parameters: {'model_type': 'mlp', 'hidden_dims': '[128, 64]', 'dropout': 0.19945760320733139, 'batch_norm': True, 'lr': 0.0005978623410611499, 'weight_decay': 0.0009305913353248954, 'epochs': 61, 'loss': 'mse', 'optimizer': 'adam', 'graph_mode': 'off', 'use_snp_selection': True, 'num_snps': 39765}. Best is trial 18 with value: 0.10370338241819542.
[I 2025-12-05 15:30:57,791] Trial 99 finished with value: 0.06587856688774518 and parameters: {'model_type': 'mlp', 'hidden_dims': '[512, 64]', 'dropout': 0.3117228350810653, 'batch_norm': False, 'lr': 0.0002499504861407381, 'weight_decay': 2.1554554659297635e-05, 'epochs': 166, 'loss': 'mae', 'optimizer': 'adam', 'graph_mode': 'off', 'use_snp_selection': False}. Best is trial 18 with value: 0.10370338241819542.
[I 2025-12-05 15:30:59,795] Trial 100 finished with value: 0.05050017866836055 and parameters: {'model_type': 'mlp', 'hidden_dims': '[512, 256]', 'dropout': 0.34268804066670616, 'batch_norm': False, 'lr': 0.000514181358832404, 'weight_decay': 7.883194445619378e-06, 'epochs': 212, 'loss': 'mse', 'optimizer': 'adam', 'graph_mode': 'off', 'use_snp_selection': False}. Best is trial 18 with value: 0.10370338241819542.
[I 2025-12-05 15:31:00,993] Trial 101 finished with value: 0.06242732499464638 and parameters: {'model_type': 'mlp', 'hidden_dims': '[256, 128]', 'dropout': 0.42067702936580176, 'batch_norm': False, 'lr': 1.7281358648078662e-05, 'weight_decay': 3.6700184090182936e-07, 'epochs': 190, 'loss': 'mse', 'optimizer': 'adam', 'graph_mode': 'off', 'use_snp_selection': False}. Best is trial 18 with value: 0.10370338241819542.
[I 2025-12-05 15:31:02,469] Trial 102 finished with value: 0.05503181893214939 and parameters: {'model_type': 'mlp', 'hidden_dims': '[256, 128]', 'dropout': 0.32858844668648607, 'batch_norm': False, 'lr': 3.4407293334525145e-05, 'weight_decay': 5.222798842156165e-06, 'epochs': 297, 'loss': 'mse', 'optimizer': 'adam', 'graph_mode': 'off', 'use_snp_selection': False}. Best is trial 18 with value: 0.10370338241819542.
[I 2025-12-05 15:31:03,612] Trial 103 finished with value: 0.07354600283179208 and parameters: {'model_type': 'mlp', 'hidden_dims': '[256, 128]', 'dropout': 0.38973039227719586, 'batch_norm': False, 'lr': 9.681027239029007e-05, 'weight_decay': 3.602480034245966e-06, 'epochs': 180, 'loss': 'mse', 'optimizer': 'adam', 'graph_mode': 'off', 'use_snp_selection': False}. Best is trial 18 with value: 0.10370338241819542.
[I 2025-12-05 15:31:04,827] Trial 104 finished with value: 0.06522611951032699 and parameters: {'model_type': 'mlp', 'hidden_dims': '[256, 128]', 'dropout': 0.34994048178202897, 'batch_norm': False, 'lr': 1.4577223296633872e-05, 'weight_decay': 1.1733706470040453e-05, 'epochs': 202, 'loss': 'mse', 'optimizer': 'adam', 'graph_mode': 'off', 'use_snp_selection': False}. Best is trial 18 with value: 0.10370338241819542.
[I 2025-12-05 15:31:06,497] Trial 105 finished with value: 0.0794751888870718 and parameters: {'model_type': 'mlp', 'hidden_dims': '[128, 64]', 'dropout': 0.32031633200968307, 'batch_norm': False, 'lr': 0.00021287376073265263, 'weight_decay': 2.7060498948249118e-06, 'epochs': 134, 'loss': 'mse', 'optimizer': 'adam', 'graph_mode': 'off', 'use_snp_selection': True, 'num_snps': 30090}. Best is trial 18 with value: 0.10370338241819542.
[I 2025-12-05 15:31:07,371] Trial 106 finished with value: 0.08859217338196806 and parameters: {'model_type': 'mlp', 'hidden_dims': '[256, 128]', 'dropout': 0.40635620568639885, 'batch_norm': False, 'lr': 0.00018313730429574043, 'weight_decay': 1.5804505110683745e-06, 'epochs': 81, 'loss': 'mse', 'optimizer': 'adam', 'graph_mode': 'off', 'use_snp_selection': False}. Best is trial 18 with value: 0.10370338241819542.
[I 2025-12-05 15:31:08,340] Trial 107 finished with value: 0.06564687626950177 and parameters: {'model_type': 'mlp', 'hidden_dims': '[256, 128]', 'dropout': 0.363469509927184, 'batch_norm': True, 'lr': 0.0001760400491406301, 'weight_decay': 1.6092793637361183e-05, 'epochs': 111, 'loss': 'mse', 'optimizer': 'adam', 'graph_mode': 'off', 'use_snp_selection': False}. Best is trial 18 with value: 0.10370338241819542.
[I 2025-12-05 15:31:09,585] Trial 108 finished with value: 0.06183679367836307 and parameters: {'model_type': 'mlp', 'hidden_dims': '[512, 256]', 'dropout': 0.3781480185728177, 'batch_norm': False, 'lr': 0.0004306432859201402, 'weight_decay': 6.812939746867298e-06, 'epochs': 82, 'loss': 'mse', 'optimizer': 'adam', 'graph_mode': 'off', 'use_snp_selection': False}. Best is trial 18 with value: 0.10370338241819542.
[I 2025-12-05 15:31:10,614] Trial 109 finished with value: 0.0642278191421583 and parameters: {'model_type': 'mlp', 'hidden_dims': '[128, 64]', 'dropout': 0.41163519919858127, 'batch_norm': False, 'lr': 0.0003141495824241768, 'weight_decay': 4.686455981914757e-06, 'epochs': 48, 'loss': 'mae', 'optimizer': 'adam', 'graph_mode': 'off', 'use_snp_selection': True, 'num_snps': 9689}. Best is trial 18 with value: 0.10370338241819542.
[I 2025-12-05 15:31:11,528] Trial 110 finished with value: 0.08473905197812308 and parameters: {'model_type': 'mlp', 'hidden_dims': '[256, 128]', 'dropout': 0.5367400007987836, 'batch_norm': True, 'lr': 0.0001544144623677777, 'weight_decay': 7.767330956710051e-07, 'epochs': 91, 'loss': 'mse', 'optimizer': 'adam', 'graph_mode': 'off', 'use_snp_selection': False}. Best is trial 18 with value: 0.10370338241819542.
[I 2025-12-05 15:31:12,549] Trial 111 finished with value: 0.057715018333115764 and parameters: {'model_type': 'mlp', 'hidden_dims': '[256, 128]', 'dropout': 0.5491290164407441, 'batch_norm': True, 'lr': 0.00014014829555348494, 'weight_decay': 7.786286265263688e-07, 'epochs': 120, 'loss': 'mse', 'optimizer': 'adam', 'graph_mode': 'off', 'use_snp_selection': False}. Best is trial 18 with value: 0.10370338241819542.
[I 2025-12-05 15:31:13,470] Trial 112 finished with value: 0.04384408333597588 and parameters: {'model_type': 'mlp', 'hidden_dims': '[256, 128]', 'dropout': 0.5361173109626947, 'batch_norm': True, 'lr': 7.206204811758095e-05, 'weight_decay': 1.589678417530821e-06, 'epochs': 93, 'loss': 'mse', 'optimizer': 'adam', 'graph_mode': 'off', 'use_snp_selection': False}. Best is trial 18 with value: 0.10370338241819542.
[I 2025-12-05 15:31:14,425] Trial 113 finished with value: 0.06371735466037906 and parameters: {'model_type': 'mlp', 'hidden_dims': '[256, 128]', 'dropout': 0.5118039242842451, 'batch_norm': True, 'lr': 0.00019480820417850186, 'weight_decay': 1.0870347605634535e-06, 'epochs': 107, 'loss': 'mse', 'optimizer': 'adam', 'graph_mode': 'off', 'use_snp_selection': False}. Best is trial 18 with value: 0.10370338241819542.
[I 2025-12-05 15:31:15,297] Trial 114 finished with value: 0.07046426142013554 and parameters: {'model_type': 'mlp', 'hidden_dims': '[256, 128]', 'dropout': 0.5819224231205137, 'batch_norm': True, 'lr': 0.0001546082556123361, 'weight_decay': 4.0059039421603614e-07, 'epochs': 78, 'loss': 'mse', 'optimizer': 'adam', 'graph_mode': 'off', 'use_snp_selection': False}. Best is trial 18 with value: 0.10370338241819542.
[I 2025-12-05 15:31:16,137] Trial 115 finished with value: 0.0694975504598562 and parameters: {'model_type': 'mlp', 'hidden_dims': '[256, 128]', 'dropout': 0.24327048532062912, 'batch_norm': True, 'lr': 0.0002564923593221751, 'weight_decay': 2.0096949107607575e-07, 'epochs': 67, 'loss': 'mse', 'optimizer': 'adam', 'graph_mode': 'off', 'use_snp_selection': False}. Best is trial 18 with value: 0.10370338241819542.
[I 2025-12-05 15:31:17,035] Trial 116 finished with value: 0.0566513378926171 and parameters: {'model_type': 'mlp', 'hidden_dims': '[512, 256]', 'dropout': 0.5068561632209059, 'batch_norm': False, 'lr': 0.00011992296246956713, 'weight_decay': 2.0994279762422595e-06, 'epochs': 89, 'loss': 'mse', 'optimizer': 'adam', 'graph_mode': 'off', 'use_snp_selection': True, 'num_snps': 4338}. Best is trial 18 with value: 0.10370338241819542.
[I 2025-12-05 15:31:18,394] Trial 117 finished with value: 0.052703227994283605 and parameters: {'model_type': 'mlp', 'hidden_dims': '[512, 128]', 'dropout': 0.4798051591122162, 'batch_norm': True, 'lr': 0.0003966601952306631, 'weight_decay': 2.3704890112362865e-07, 'epochs': 100, 'loss': 'mse', 'optimizer': 'adam', 'graph_mode': 'off', 'use_snp_selection': False}. Best is trial 18 with value: 0.10370338241819542.
