[I 2025-12-05 22:52:20,399] Trial 123 finished with value: 0.2907955252083177 and parameters: {'model_type': 'mlp', 'hidden_dims': '[512, 64]', 'dropout': 0.5510161449506202, 'batch_norm': False, 'lr': 3.7104162803942018e-06, 'weight_decay': 0.00045359605269502674, 'epochs': 188, 'loss': 'mse', 'optimizer': 'adam', 'graph_mode': 'off', 'use_snp_selection': False}. Best is trial 108 with value: 0.29654801718972074.
[I 2025-12-05 22:53:00,732] Trial 124 finished with value: 0.2957641883956622 and parameters: {'model_type': 'mlp', 'hidden_dims': '[512, 64]', 'dropout': 0.5358891594605923, 'batch_norm': False, 'lr': 4.979949565273457e-06, 'weight_decay': 1.7682642483145784e-07, 'epochs': 201, 'loss': 'mse', 'optimizer': 'adam', 'graph_mode': 'off', 'use_snp_selection': False}. Best is trial 108 with value: 0.29654801718972074.
[I 2025-12-05 22:53:39,722] Trial 125 finished with value: 0.29253827276720884 and parameters: {'model_type': 'mlp', 'hidden_dims': '[512, 64]', 'dropout': 0.525130935976724, 'batch_norm': False, 'lr': 5.897462662548709e-06, 'weight_decay': 2.4746353498984194e-07, 'epochs': 193, 'loss': 'mse', 'optimizer': 'adam', 'graph_mode': 'off', 'use_snp_selection': False}. Best is trial 108 with value: 0.29654801718972074.
[I 2025-12-05 22:54:14,053] Trial 126 finished with value: 0.29432543547945306 and parameters: {'model_type': 'mlp', 'hidden_dims': '[512, 64]', 'dropout': 0.5345883136860976, 'batch_norm': False, 'lr': 5.030473880793986e-06, 'weight_decay': 2.0850492658258718e-06, 'epochs': 166, 'loss': 'mse', 'optimizer': 'adam', 'graph_mode': 'off', 'use_snp_selection': False}. Best is trial 108 with value: 0.29654801718972074.
[I 2025-12-05 22:54:47,451] Trial 127 finished with value: 0.27818770610215376 and parameters: {'model_type': 'mlp', 'hidden_dims': '[512, 64]', 'dropout': 0.5351272856433488, 'batch_norm': True, 'lr': 5.005518827338221e-06, 'weight_decay': 4.57824117274107e-07, 'epochs': 160, 'loss': 'mse', 'optimizer': 'adam', 'graph_mode': 'off', 'use_snp_selection': False}. Best is trial 108 with value: 0.29654801718972074.
[I 2025-12-05 22:55:21,696] Trial 128 finished with value: 0.2923227720591504 and parameters: {'model_type': 'mlp', 'hidden_dims': '[512, 64]', 'dropout': 0.49834188811121116, 'batch_norm': False, 'lr': 6.896110350322742e-06, 'weight_decay': 2.469501118384266e-07, 'epochs': 166, 'loss': 'mse', 'optimizer': 'adam', 'graph_mode': 'off', 'use_snp_selection': False}. Best is trial 108 with value: 0.29654801718972074.
[I 2025-12-05 22:55:58,043] Trial 129 finished with value: 0.28933993639104383 and parameters: {'model_type': 'mlp', 'hidden_dims': '[512, 64]', 'dropout': 0.5142283995002188, 'batch_norm': False, 'lr': 3.387207049282554e-06, 'weight_decay': 1.4233647732611735e-06, 'epochs': 178, 'loss': 'mse', 'optimizer': 'adam', 'graph_mode': 'off', 'use_snp_selection': False}. Best is trial 108 with value: 0.29654801718972074.
[I 2025-12-05 22:56:30,829] Trial 130 finished with value: 0.2934659561362986 and parameters: {'model_type': 'mlp', 'hidden_dims': '[512, 64]', 'dropout': 0.5433489873121282, 'batch_norm': False, 'lr': 7.951190774664762e-06, 'weight_decay': 1.144756439580023e-06, 'epochs': 158, 'loss': 'mse', 'optimizer': 'adam', 'graph_mode': 'off', 'use_snp_selection': False}. Best is trial 108 with value: 0.29654801718972074.
[I 2025-12-05 22:57:10,688] Trial 131 finished with value: 0.28846080763453363 and parameters: {'model_type': 'mlp', 'hidden_dims': '[512, 64]', 'dropout': 0.5558825040247148, 'batch_norm': False, 'lr': 1.0149004783970412e-05, 'weight_decay': 4.059365821917747e-06, 'epochs': 199, 'loss': 'mse', 'optimizer': 'adam', 'graph_mode': 'off', 'use_snp_selection': False}. Best is trial 108 with value: 0.29654801718972074.
[I 2025-12-05 22:57:53,373] Trial 132 finished with value: 0.2891108341430713 and parameters: {'model_type': 'mlp', 'hidden_dims': '[512, 64]', 'dropout': 0.3667836733594109, 'batch_norm': False, 'lr': 4.748558000147899e-06, 'weight_decay': 2.261438134272834e-06, 'epochs': 214, 'loss': 'mse', 'optimizer': 'adam', 'graph_mode': 'off', 'use_snp_selection': False}. Best is trial 108 with value: 0.29654801718972074.
[I 2025-12-05 22:58:25,119] Trial 133 finished with value: 0.2921517135673007 and parameters: {'model_type': 'mlp', 'hidden_dims': '[512, 64]', 'dropout': 0.5673007139623686, 'batch_norm': False, 'lr': 5.472983667978143e-06, 'weight_decay': 1.578661159324947e-05, 'epochs': 152, 'loss': 'mse', 'optimizer': 'adam', 'graph_mode': 'off', 'use_snp_selection': False}. Best is trial 108 with value: 0.29654801718972074.
[I 2025-12-05 22:59:06,700] Trial 134 finished with value: 0.29429614045724356 and parameters: {'model_type': 'mlp', 'hidden_dims': '[512, 64]', 'dropout': 0.5321716371491572, 'batch_norm': False, 'lr': 3.941032133700873e-06, 'weight_decay': 9.894294924813518e-06, 'epochs': 208, 'loss': 'mse', 'optimizer': 'adam', 'graph_mode': 'off', 'use_snp_selection': False}. Best is trial 108 with value: 0.29654801718972074.
[I 2025-12-05 22:59:47,397] Trial 135 finished with value: 0.29262827241774453 and parameters: {'model_type': 'mlp', 'hidden_dims': '[512, 64]', 'dropout': 0.5362640787461602, 'batch_norm': False, 'lr': 3.869054834773726e-06, 'weight_decay': 0.0009907559196989401, 'epochs': 203, 'loss': 'mse', 'optimizer': 'adam', 'graph_mode': 'off', 'use_snp_selection': False}. Best is trial 108 with value: 0.29654801718972074.
[I 2025-12-05 23:00:24,804] Trial 136 finished with value: 0.28740612435215784 and parameters: {'model_type': 'mlp', 'hidden_dims': '[512, 64]', 'dropout': 0.5231488147822381, 'batch_norm': False, 'lr': 3.027124288388604e-06, 'weight_decay': 9.507567321432027e-06, 'epochs': 184, 'loss': 'mse', 'optimizer': 'adam', 'graph_mode': 'off', 'use_snp_selection': False}. Best is trial 108 with value: 0.29654801718972074.
[I 2025-12-05 23:01:06,396] Trial 137 finished with value: 0.28865434062668754 and parameters: {'model_type': 'mlp', 'hidden_dims': '[512, 64]', 'dropout': 0.5504273016838912, 'batch_norm': False, 'lr': 3.509136158682322e-06, 'weight_decay': 5.346089620021166e-06, 'epochs': 208, 'loss': 'mse', 'optimizer': 'adam', 'graph_mode': 'off', 'use_snp_selection': False}. Best is trial 108 with value: 0.29654801718972074.
[I 2025-12-05 23:01:34,699] Trial 138 finished with value: 0.2798421551992486 and parameters: {'model_type': 'mlp', 'hidden_dims': '[512, 64]', 'dropout': 0.4820228597894443, 'batch_norm': False, 'lr': 2.647106471531544e-06, 'weight_decay': 8.062651180193812e-06, 'epochs': 132, 'loss': 'mse', 'optimizer': 'adam', 'graph_mode': 'off', 'use_snp_selection': False}. Best is trial 108 with value: 0.29654801718972074.
[I 2025-12-05 23:02:10,267] Trial 139 finished with value: 0.2807913285700668 and parameters: {'model_type': 'mlp', 'hidden_dims': '[512, 64]', 'dropout': 0.4464360748996328, 'batch_norm': False, 'lr': 4.896819742058027e-05, 'weight_decay': 8.401531674149483e-07, 'epochs': 175, 'loss': 'mse', 'optimizer': 'adam', 'graph_mode': 'off', 'use_snp_selection': False}. Best is trial 108 with value: 0.29654801718972074.
[I 2025-12-05 23:02:32,388] Trial 140 finished with value: 0.23121163542618262 and parameters: {'model_type': 'mlp', 'hidden_dims': '[256, 128, 64]', 'dropout': 0.502474890801375, 'batch_norm': False, 'lr': 4.100534938726104e-06, 'weight_decay': 0.0007349752769602598, 'epochs': 190, 'loss': 'mae', 'optimizer': 'adam', 'graph_mode': 'off', 'use_snp_selection': False}. Best is trial 108 with value: 0.29654801718972074.
[I 2025-12-05 23:02:50,343] Trial 141 finished with value: 0.29141748149774915 and parameters: {'model_type': 'mlp', 'hidden_dims': '[128, 64]', 'dropout': 0.5804323429690796, 'batch_norm': False, 'lr': 4.676284434559327e-06, 'weight_decay': 2.6539754481053986e-05, 'epochs': 262, 'loss': 'mse', 'optimizer': 'adam', 'graph_mode': 'off', 'use_snp_selection': False}. Best is trial 108 with value: 0.29654801718972074.
[I 2025-12-05 23:03:33,447] Trial 142 finished with value: 0.29726499886717594 and parameters: {'model_type': 'mlp', 'hidden_dims': '[512, 64]', 'dropout': 0.5619716476544935, 'batch_norm': False, 'lr': 5.77321513273104e-06, 'weight_decay': 2.0131964236225988e-05, 'epochs': 217, 'loss': 'mse', 'optimizer': 'adam', 'graph_mode': 'off', 'use_snp_selection': False}. Best is trial 142 with value: 0.29726499886717594.
[I 2025-12-05 23:04:16,801] Trial 143 finished with value: 0.294599858276379 and parameters: {'model_type': 'mlp', 'hidden_dims': '[512, 64]', 'dropout': 0.5324947351889523, 'batch_norm': False, 'lr': 5.379497394970331e-06, 'weight_decay': 2.09376881409559e-05, 'epochs': 217, 'loss': 'mse', 'optimizer': 'adam', 'graph_mode': 'off', 'use_snp_selection': False}. Best is trial 142 with value: 0.29726499886717594.
[I 2025-12-05 23:05:00,130] Trial 144 finished with value: 0.28969145009167085 and parameters: {'model_type': 'mlp', 'hidden_dims': '[512, 64]', 'dropout': 0.5148894031908978, 'batch_norm': False, 'lr': 6.326351437749497e-06, 'weight_decay': 1.867109859633877e-05, 'epochs': 218, 'loss': 'mse', 'optimizer': 'adam', 'graph_mode': 'off', 'use_snp_selection': False}. Best is trial 142 with value: 0.29726499886717594.
[I 2025-12-05 23:05:40,123] Trial 145 finished with value: 0.2902860358493594 and parameters: {'model_type': 'mlp', 'hidden_dims': '[512, 64]', 'dropout': 0.5314885941969115, 'batch_norm': False, 'lr': 5.101007761321964e-06, 'weight_decay': 3.3102075244311888e-06, 'epochs': 199, 'loss': 'mse', 'optimizer': 'adam', 'graph_mode': 'off', 'use_snp_selection': False}. Best is trial 142 with value: 0.29726499886717594.
[I 2025-12-05 23:06:45,906] Trial 146 finished with value: 0.29220393499152497 and parameters: {'model_type': 'mlp', 'hidden_dims': '[512, 64]', 'dropout': 0.5391044666470196, 'batch_norm': False, 'lr': 5.805664549261222e-06, 'weight_decay': 2.0235783563081808e-05, 'epochs': 209, 'loss': 'mse', 'optimizer': 'adam', 'graph_mode': 'off', 'use_snp_selection': True, 'num_snps': 51450}. Best is trial 142 with value: 0.29726499886717594.
[I 2025-12-05 23:07:30,166] Trial 147 finished with value: 0.2948725983667643 and parameters: {'model_type': 'mlp', 'hidden_dims': '[512, 64]', 'dropout': 0.5559656507497276, 'batch_norm': False, 'lr': 3.196563120517461e-06, 'weight_decay': 3.998875283988462e-07, 'epochs': 224, 'loss': 'mse', 'optimizer': 'adam', 'graph_mode': 'off', 'use_snp_selection': False}. Best is trial 142 with value: 0.29726499886717594.
[I 2025-12-05 23:08:14,676] Trial 148 finished with value: 0.29108619140904074 and parameters: {'model_type': 'mlp', 'hidden_dims': '[512, 64]', 'dropout': 0.5574183031291322, 'batch_norm': False, 'lr': 6.983416574128671e-06, 'weight_decay': 1.8265292168249676e-07, 'epochs': 225, 'loss': 'mse', 'optimizer': 'adam', 'graph_mode': 'off', 'use_snp_selection': False}. Best is trial 142 with value: 0.29726499886717594.
[I 2025-12-05 23:08:57,882] Trial 149 finished with value: 0.2902467787643236 and parameters: {'model_type': 'mlp', 'hidden_dims': '[512, 64]', 'dropout': 0.5474245055224213, 'batch_norm': False, 'lr': 3.4548680221189175e-06, 'weight_decay': 4.197211238724764e-07, 'epochs': 217, 'loss': 'mse', 'optimizer': 'adam', 'graph_mode': 'off', 'use_snp_selection': False}. Best is trial 142 with value: 0.29726499886717594.
[I 2025-12-05 23:09:54,246] Trial 0 finished with value: 0.26479417123537347 and parameters: {'model_type': 'mlp', 'hidden_dims': '[128, 64]', 'dropout': 0.199031432379812, 'batch_norm': True, 'lr': 1.8408544111075837e-06, 'weight_decay': 5.5136510071208614e-05, 'epochs': 336, 'loss': 'mae', 'optimizer': 'adam', 'graph_mode': 'off', 'use_snp_selection': True, 'num_snps': 43862}. Best is trial 0 with value: 0.26479417123537347.
[I 2025-12-05 23:10:21,160] Trial 1 finished with value: 0.2889565342417885 and parameters: {'model_type': 'mlp', 'hidden_dims': '[256, 128]', 'dropout': 0.4370668075331726, 'batch_norm': True, 'lr': 7.133471581159139e-05, 'weight_decay': 1.128633586803549e-05, 'epochs': 242, 'loss': 'mae', 'optimizer': 'adam', 'graph_mode': 'off', 'use_snp_selection': False}. Best is trial 1 with value: 0.2889565342417885.
[I 2025-12-05 23:10:47,649] Trial 2 finished with value: 0.27696320356607185 and parameters: {'model_type': 'mlp', 'hidden_dims': '[256, 128, 64]', 'dropout': 0.41314357415569625, 'batch_norm': False, 'lr': 3.952233718592101e-06, 'weight_decay': 0.00026754769258252603, 'epochs': 149, 'loss': 'mse', 'optimizer': 'adam', 'graph_mode': 'off', 'use_snp_selection': True, 'num_snps': 11571}. Best is trial 1 with value: 0.2889565342417885.
[I 2025-12-05 23:11:48,367] Trial 3 finished with value: 0.286569894957591 and parameters: {'model_type': 'mlp', 'hidden_dims': '[512, 64]', 'dropout': 0.5938127374509361, 'batch_norm': False, 'lr': 5.67704586114731e-06, 'weight_decay': 2.4518087630137052e-05, 'epochs': 320, 'loss': 'mae', 'optimizer': 'adam', 'graph_mode': 'off', 'use_snp_selection': False}. Best is trial 1 with value: 0.2889565342417885.
[I 2025-12-05 23:12:48,838] Trial 4 finished with value: 0.2674476619484305 and parameters: {'model_type': 'mlp', 'hidden_dims': '[512, 128]', 'dropout': 0.25746343592134413, 'batch_norm': True, 'lr': 1.3467657668402788e-06, 'weight_decay': 0.00033087251918647806, 'epochs': 277, 'loss': 'mse', 'optimizer': 'adam', 'graph_mode': 'off', 'use_snp_selection': True, 'num_snps': 36675}. Best is trial 1 with value: 0.2889565342417885.
[I 2025-12-05 23:13:31,732] Trial 5 finished with value: 0.2545556042631331 and parameters: {'model_type': 'mlp', 'hidden_dims': '[512, 64]', 'dropout': 0.38275350994408375, 'batch_norm': True, 'lr': 1.5586664309232824e-06, 'weight_decay': 0.0008227664668621182, 'epochs': 145, 'loss': 'mae', 'optimizer': 'adam', 'graph_mode': 'off', 'use_snp_selection': True, 'num_snps': 32148}. Best is trial 1 with value: 0.2889565342417885.
[I 2025-12-05 23:13:54,333] Trial 6 finished with value: 0.28582985475796036 and parameters: {'model_type': 'mlp', 'hidden_dims': '[256, 128]', 'dropout': 0.3930109900265879, 'batch_norm': False, 'lr': 4.892964372128395e-05, 'weight_decay': 1.5809549317992182e-06, 'epochs': 199, 'loss': 'mse', 'optimizer': 'adam', 'graph_mode': 'off', 'use_snp_selection': False}. Best is trial 1 with value: 0.2889565342417885.
[I 2025-12-05 23:14:16,584] Trial 7 finished with value: 0.2889274808580061 and parameters: {'model_type': 'mlp', 'hidden_dims': '[512, 256]', 'dropout': 0.15343979219678458, 'batch_norm': True, 'lr': 6.234003099047341e-05, 'weight_decay': 3.894760610535477e-07, 'epochs': 97, 'loss': 'mse', 'optimizer': 'adam', 'graph_mode': 'off', 'use_snp_selection': False}. Best is trial 1 with value: 0.2889565342417885.
[I 2025-12-05 23:15:16,729] Trial 8 finished with value: 0.28976523573367974 and parameters: {'model_type': 'mlp', 'hidden_dims': '[512, 128]', 'dropout': 0.10743001231661406, 'batch_norm': True, 'lr': 0.00023728538449271062, 'weight_decay': 1.7629071578048637e-05, 'epochs': 312, 'loss': 'mae', 'optimizer': 'adam', 'graph_mode': 'off', 'use_snp_selection': False}. Best is trial 8 with value: 0.28976523573367974.
[I 2025-12-05 23:15:52,741] Trial 9 finished with value: 0.3016673276975667 and parameters: {'model_type': 'mlp', 'hidden_dims': '[512, 64]', 'dropout': 0.14505336736221927, 'batch_norm': True, 'lr': 5.8619638388111826e-05, 'weight_decay': 6.200156172669308e-07, 'epochs': 175, 'loss': 'mse', 'optimizer': 'adam', 'graph_mode': 'off', 'use_snp_selection': False}. Best is trial 9 with value: 0.3016673276975667.
[I 2025-12-05 23:16:05,521] Trial 10 finished with value: -0.02280604051763807 and parameters: {'model_type': 'mlp', 'hidden_dims': '[512, 64]', 'dropout': 0.27531666245262887, 'batch_norm': False, 'lr': 0.00032393778075602147, 'weight_decay': 1.1714031539166647e-07, 'epochs': 44, 'loss': 'mse', 'optimizer': 'adam', 'graph_mode': 'off', 'use_snp_selection': False}. Best is trial 9 with value: 0.3016673276975667.
[I 2025-12-05 23:16:48,752] Trial 11 finished with value: 0.28891073036919174 and parameters: {'model_type': 'mlp', 'hidden_dims': '[512, 128]', 'dropout': 0.10095648685224448, 'batch_norm': True, 'lr': 0.0007381466848241802, 'weight_decay': 1.969664044175748e-06, 'epochs': 216, 'loss': 'mae', 'optimizer': 'adam', 'graph_mode': 'off', 'use_snp_selection': False}. Best is trial 9 with value: 0.3016673276975667.
[I 2025-12-05 23:17:43,506] Trial 12 finished with value: 0.2960025419661403 and parameters: {'model_type': 'mlp', 'hidden_dims': '[512, 128]', 'dropout': 0.10344600881777158, 'batch_norm': True, 'lr': 0.00018400807026440393, 'weight_decay': 2.652725854953085e-06, 'epochs': 281, 'loss': 'mae', 'optimizer': 'adam', 'graph_mode': 'off', 'use_snp_selection': False}. Best is trial 9 with value: 0.3016673276975667.
[I 2025-12-05 23:18:01,237] Trial 13 finished with value: 0.27423459649273607 and parameters: {'model_type': 'mlp', 'hidden_dims': '[128, 64]', 'dropout': 0.21612815944527586, 'batch_norm': True, 'lr': 1.537109700844877e-05, 'weight_decay': 2.1978369390547452e-06, 'epochs': 258, 'loss': 'mse', 'optimizer': 'adam', 'graph_mode': 'off', 'use_snp_selection': False}. Best is trial 9 with value: 0.3016673276975667.
[I 2025-12-05 23:18:21,204] Trial 14 finished with value: 0.2888202911522749 and parameters: {'model_type': 'mlp', 'hidden_dims': '[256, 128, 64]', 'dropout': 0.3012984444538551, 'batch_norm': True, 'lr': 0.00017558188744418174, 'weight_decay': 6.0566029709182e-07, 'epochs': 166, 'loss': 'mse', 'optimizer': 'adam', 'graph_mode': 'off', 'use_snp_selection': False}. Best is trial 9 with value: 0.3016673276975667.
[I 2025-12-05 23:18:45,079] Trial 15 finished with value: 0.28777216058099775 and parameters: {'model_type': 'mlp', 'hidden_dims': '[512, 256]', 'dropout': 0.1723492905468449, 'batch_norm': True, 'lr': 1.89989485263331e-05, 'weight_decay': 4.647398975110266e-06, 'epochs': 106, 'loss': 'mae', 'optimizer': 'adam', 'graph_mode': 'off', 'use_snp_selection': False}. Best is trial 9 with value: 0.3016673276975667.
[I 2025-12-05 23:19:29,519] Trial 16 finished with value: 0.2928632639993053 and parameters: {'model_type': 'mlp', 'hidden_dims': '[512, 128]', 'dropout': 0.558513902174278, 'batch_norm': True, 'lr': 0.0001280047128166989, 'weight_decay': 1.0661008213867922e-07, 'epochs': 223, 'loss': 'mae', 'optimizer': 'adam', 'graph_mode': 'off', 'use_snp_selection': False}. Best is trial 9 with value: 0.3016673276975667.
[I 2025-12-05 23:20:25,221] Trial 17 finished with value: 0.2882362109485942 and parameters: {'model_type': 'mlp', 'hidden_dims': '[512, 64]', 'dropout': 0.32888830259108426, 'batch_norm': True, 'lr': 0.000906375209920231, 'weight_decay': 4.900658026597541e-07, 'epochs': 287, 'loss': 'mse', 'optimizer': 'adam', 'graph_mode': 'off', 'use_snp_selection': False}. Best is trial 9 with value: 0.3016673276975667.
[I 2025-12-05 23:21:31,679] Trial 18 finished with value: 0.28131334485988335 and parameters: {'model_type': 'mlp', 'hidden_dims': '[512, 128]', 'dropout': 0.5053317114683149, 'batch_norm': False, 'lr': 2.797772152750264e-05, 'weight_decay': 5.399175074092964e-06, 'epochs': 180, 'loss': 'mae', 'optimizer': 'adam', 'graph_mode': 'off', 'use_snp_selection': True, 'num_snps': 58241}. Best is trial 9 with value: 0.3016673276975667.
[I 2025-12-05 23:21:57,700] Trial 19 finished with value: 0.29354992329485363 and parameters: {'model_type': 'mlp', 'hidden_dims': '[512, 64]', 'dropout': 0.14601246093479409, 'batch_norm': True, 'lr': 0.00048753983738097695, 'weight_decay': 6.40592369999028e-05, 'epochs': 119, 'loss': 'mse', 'optimizer': 'adam', 'graph_mode': 'off', 'use_snp_selection': False}. Best is trial 9 with value: 0.3016673276975667.
[I 2025-12-05 23:22:04,270] Trial 20 finished with value: 0.28679458438995586 and parameters: {'model_type': 'mlp', 'hidden_dims': '[128, 64]', 'dropout': 0.22713525795094816, 'batch_norm': True, 'lr': 0.00010303661336735763, 'weight_decay': 9.458689684923737e-07, 'epochs': 43, 'loss': 'mse', 'optimizer': 'adam', 'graph_mode': 'off', 'use_snp_selection': False}. Best is trial 9 with value: 0.3016673276975667.
[I 2025-12-05 23:22:31,744] Trial 21 finished with value: 0.2900865160083338 and parameters: {'model_type': 'mlp', 'hidden_dims': '[512, 64]', 'dropout': 0.1439060887486503, 'batch_norm': True, 'lr': 0.0004244458160266558, 'weight_decay': 6.429409263522788e-05, 'epochs': 127, 'loss': 'mse', 'optimizer': 'adam', 'graph_mode': 'off', 'use_snp_selection': False}. Best is trial 9 with value: 0.3016673276975667.
[I 2025-12-05 23:22:55,692] Trial 22 finished with value: 0.2892734809450877 and parameters: {'model_type': 'mlp', 'hidden_dims': '[512, 64]', 'dropout': 0.14693082447186612, 'batch_norm': True, 'lr': 0.0004956379946628611, 'weight_decay': 6.0900392062628344e-05, 'epochs': 107, 'loss': 'mse', 'optimizer': 'adam', 'graph_mode': 'off', 'use_snp_selection': False}. Best is trial 9 with value: 0.3016673276975667.
[I 2025-12-05 23:23:13,336] Trial 23 finished with value: 0.29293273808613496 and parameters: {'model_type': 'mlp', 'hidden_dims': '[512, 64]', 'dropout': 0.18726480922516295, 'batch_norm': True, 'lr': 0.00020456354586795083, 'weight_decay': 5.085738575554533e-06, 'epochs': 71, 'loss': 'mse', 'optimizer': 'adam', 'graph_mode': 'off', 'use_snp_selection': False}. Best is trial 9 with value: 0.3016673276975667.
[I 2025-12-05 23:23:50,823] Trial 24 finished with value: 0.2947331548169321 and parameters: {'model_type': 'mlp', 'hidden_dims': '[512, 64]', 'dropout': 0.1059475231704499, 'batch_norm': True, 'lr': 0.00010661852435894754, 'weight_decay': 2.3456863125399286e-07, 'epochs': 184, 'loss': 'mse', 'optimizer': 'adam', 'graph_mode': 'off', 'use_snp_selection': False}. Best is trial 9 with value: 0.3016673276975667.
