[I 2025-12-05 15:03:15,571] Trial 36 finished with value: 0.01558482651919437 and parameters: {'model_type': 'mlp', 'hidden_dims': '[256, 128]', 'dropout': 0.4259061228636643, 'batch_norm': True, 'lr': 2.8050869020116803e-05, 'weight_decay': 6.886876803351276e-05, 'epochs': 270, 'loss': 'mae', 'optimizer': 'adam', 'graph_mode': 'off', 'use_snp_selection': True, 'num_snps': 58661}. Best is trial 35 with value: 0.06441747970138538.
[I 2025-12-05 15:03:16,687] Trial 37 finished with value: 0.03348106297094131 and parameters: {'model_type': 'mlp', 'hidden_dims': '[256, 128]', 'dropout': 0.11417919497041042, 'batch_norm': False, 'lr': 5.883297798216278e-05, 'weight_decay': 1.3123696059939873e-05, 'epochs': 245, 'loss': 'mae', 'optimizer': 'adam', 'graph_mode': 'off', 'use_snp_selection': False}. Best is trial 35 with value: 0.06441747970138538.
[I 2025-12-05 15:03:18,056] Trial 38 finished with value: 0.048058000207545484 and parameters: {'model_type': 'mlp', 'hidden_dims': '[256, 128]', 'dropout': 0.37368499955075024, 'batch_norm': True, 'lr': 4.9305036747752664e-05, 'weight_decay': 1.477941676434842e-06, 'epochs': 224, 'loss': 'mae', 'optimizer': 'adam', 'graph_mode': 'off', 'use_snp_selection': True, 'num_snps': 19911}. Best is trial 35 with value: 0.06441747970138538.
[I 2025-12-05 15:03:19,882] Trial 39 finished with value: 0.035115338675554116 and parameters: {'model_type': 'mlp', 'hidden_dims': '[512, 64]', 'dropout': 0.40491549826838436, 'batch_norm': True, 'lr': 3.6805754224842775e-06, 'weight_decay': 3.1454796673030104e-05, 'epochs': 298, 'loss': 'mae', 'optimizer': 'adam', 'graph_mode': 'off', 'use_snp_selection': False}. Best is trial 35 with value: 0.06441747970138538.
[I 2025-12-05 15:03:21,909] Trial 40 finished with value: 0.044309868948052424 and parameters: {'model_type': 'mlp', 'hidden_dims': '[512, 128]', 'dropout': 0.20084652191150193, 'batch_norm': False, 'lr': 0.00021538499815600067, 'weight_decay': 4.246780783668976e-06, 'epochs': 345, 'loss': 'mae', 'optimizer': 'adam', 'graph_mode': 'off', 'use_snp_selection': False}. Best is trial 35 with value: 0.06441747970138538.
[I 2025-12-05 15:03:23,019] Trial 41 finished with value: 0.0405123291194506 and parameters: {'model_type': 'mlp', 'hidden_dims': '[256, 128, 64]', 'dropout': 0.14199213639909675, 'batch_norm': True, 'lr': 7.776901638563931e-05, 'weight_decay': 2.4354455197269554e-07, 'epochs': 235, 'loss': 'mae', 'optimizer': 'adam', 'graph_mode': 'off', 'use_snp_selection': False}. Best is trial 35 with value: 0.06441747970138538.
[I 2025-12-05 15:03:24,038] Trial 42 finished with value: 0.03619969076334908 and parameters: {'model_type': 'mlp', 'hidden_dims': '[256, 128]', 'dropout': 0.1310559672274241, 'batch_norm': True, 'lr': 7.063461006532171e-05, 'weight_decay': 5.786818173672667e-07, 'epochs': 199, 'loss': 'mae', 'optimizer': 'adam', 'graph_mode': 'off', 'use_snp_selection': False}. Best is trial 35 with value: 0.06441747970138538.
[I 2025-12-05 15:03:25,705] Trial 43 finished with value: 0.04936292252380423 and parameters: {'model_type': 'mlp', 'hidden_dims': '[512, 64]', 'dropout': 0.10464847378492867, 'batch_norm': True, 'lr': 0.00012334397977156527, 'weight_decay': 2.484734872917861e-07, 'epochs': 256, 'loss': 'mae', 'optimizer': 'adam', 'graph_mode': 'off', 'use_snp_selection': False}. Best is trial 35 with value: 0.06441747970138538.
[I 2025-12-05 15:03:27,239] Trial 44 finished with value: 0.014110671401148654 and parameters: {'model_type': 'mlp', 'hidden_dims': '[512, 256]', 'dropout': 0.1712373140723213, 'batch_norm': True, 'lr': 2.9045819840156843e-05, 'weight_decay': 1.0054103378953771e-07, 'epochs': 221, 'loss': 'mae', 'optimizer': 'adam', 'graph_mode': 'off', 'use_snp_selection': False}. Best is trial 35 with value: 0.06441747970138538.
[I 2025-12-05 15:03:28,202] Trial 45 finished with value: 0.05163374798975446 and parameters: {'model_type': 'mlp', 'hidden_dims': '[256, 128]', 'dropout': 0.23657588495833742, 'batch_norm': True, 'lr': 0.00040559413392303543, 'weight_decay': 1.0279930431315626e-06, 'epochs': 185, 'loss': 'mae', 'optimizer': 'adam', 'graph_mode': 'off', 'use_snp_selection': False}. Best is trial 35 with value: 0.06441747970138538.
[I 2025-12-05 15:03:29,441] Trial 46 finished with value: 0.024920039243886402 and parameters: {'model_type': 'mlp', 'hidden_dims': '[512, 128]', 'dropout': 0.12671519574264892, 'batch_norm': False, 'lr': 0.00018284313029326053, 'weight_decay': 1.6097827931353846e-07, 'epochs': 140, 'loss': 'mae', 'optimizer': 'adam', 'graph_mode': 'off', 'use_snp_selection': False}. Best is trial 35 with value: 0.06441747970138538.
[I 2025-12-05 15:03:30,401] Trial 47 finished with value: 0.02764493044986581 and parameters: {'model_type': 'mlp', 'hidden_dims': '[128, 64]', 'dropout': 0.4576939042561261, 'batch_norm': True, 'lr': 1.4579508636067837e-05, 'weight_decay': 5.442055212311962e-07, 'epochs': 283, 'loss': 'mae', 'optimizer': 'adam', 'graph_mode': 'off', 'use_snp_selection': False}. Best is trial 35 with value: 0.06441747970138538.
[I 2025-12-05 15:03:31,453] Trial 48 finished with value: 0.005645800142220893 and parameters: {'model_type': 'mlp', 'hidden_dims': '[256, 128]', 'dropout': 0.525407107270402, 'batch_norm': True, 'lr': 7.540651966040168e-05, 'weight_decay': 3.055729644907952e-07, 'epochs': 210, 'loss': 'mse', 'optimizer': 'adam', 'graph_mode': 'off', 'use_snp_selection': False}. Best is trial 35 with value: 0.06441747970138538.
[I 2025-12-05 15:03:34,011] Trial 49 finished with value: 0.035182139516699996 and parameters: {'model_type': 'mlp', 'hidden_dims': '[512, 64]', 'dropout': 0.18520033849308928, 'batch_norm': False, 'lr': 3.8222359172333444e-05, 'weight_decay': 1.7713905398505816e-06, 'epochs': 186, 'loss': 'mae', 'optimizer': 'adam', 'graph_mode': 'off', 'use_snp_selection': True, 'num_snps': 46888}. Best is trial 35 with value: 0.06441747970138538.
[I 2025-12-05 15:03:35,622] Trial 50 finished with value: 0.05091926611174802 and parameters: {'model_type': 'mlp', 'hidden_dims': '[512, 256]', 'dropout': 0.14991600024443832, 'batch_norm': True, 'lr': 0.0002991780015386373, 'weight_decay': 1.4859632852248244e-07, 'epochs': 230, 'loss': 'mse', 'optimizer': 'adam', 'graph_mode': 'off', 'use_snp_selection': False}. Best is trial 35 with value: 0.06441747970138538.
[I 2025-12-05 15:03:36,923] Trial 51 finished with value: 0.05154147955890651 and parameters: {'model_type': 'mlp', 'hidden_dims': '[512, 256]', 'dropout': 0.15017064538164787, 'batch_norm': True, 'lr': 9.500516523654244e-05, 'weight_decay': 5.205888455039593e-07, 'epochs': 159, 'loss': 'mse', 'optimizer': 'adam', 'graph_mode': 'off', 'use_snp_selection': False}. Best is trial 35 with value: 0.06441747970138538.
[I 2025-12-05 15:03:38,253] Trial 52 finished with value: 0.05154377141162437 and parameters: {'model_type': 'mlp', 'hidden_dims': '[512, 256]', 'dropout': 0.35151338171985624, 'batch_norm': True, 'lr': 5.400116599503827e-05, 'weight_decay': 7.499822676416468e-07, 'epochs': 168, 'loss': 'mse', 'optimizer': 'adam', 'graph_mode': 'off', 'use_snp_selection': False}. Best is trial 35 with value: 0.06441747970138538.
[I 2025-12-05 15:03:39,426] Trial 53 finished with value: 0.06087325777141398 and parameters: {'model_type': 'mlp', 'hidden_dims': '[512, 256]', 'dropout': 0.3948038103818409, 'batch_norm': True, 'lr': 0.00011559794887778079, 'weight_decay': 3.5760647616199993e-07, 'epochs': 114, 'loss': 'mse', 'optimizer': 'adam', 'graph_mode': 'off', 'use_snp_selection': False}. Best is trial 35 with value: 0.06441747970138538.
[I 2025-12-05 15:03:40,597] Trial 54 finished with value: 0.05907336721698237 and parameters: {'model_type': 'mlp', 'hidden_dims': '[512, 256]', 'dropout': 0.3936067372430611, 'batch_norm': True, 'lr': 0.0001343852851944375, 'weight_decay': 3.511096545403913e-07, 'epochs': 114, 'loss': 'mse', 'optimizer': 'adam', 'graph_mode': 'off', 'use_snp_selection': False}. Best is trial 35 with value: 0.06441747970138538.
[I 2025-12-05 15:03:41,357] Trial 55 finished with value: 0.027731082602980225 and parameters: {'model_type': 'mlp', 'hidden_dims': '[256, 128, 64]', 'dropout': 0.396541071141176, 'batch_norm': False, 'lr': 0.00016531977830218684, 'weight_decay': 3.478310301220476e-07, 'epochs': 62, 'loss': 'mse', 'optimizer': 'adam', 'graph_mode': 'off', 'use_snp_selection': False}. Best is trial 35 with value: 0.06441747970138538.
[I 2025-12-05 15:03:42,203] Trial 56 finished with value: 0.06091779438746657 and parameters: {'model_type': 'mlp', 'hidden_dims': '[256, 128]', 'dropout': 0.3554048286220648, 'batch_norm': True, 'lr': 0.0001219853226945981, 'weight_decay': 1.0516862943636281e-06, 'epochs': 114, 'loss': 'mse', 'optimizer': 'adam', 'graph_mode': 'off', 'use_snp_selection': False}. Best is trial 35 with value: 0.06441747970138538.
[I 2025-12-05 15:03:43,107] Trial 57 finished with value: -0.0054322459437536035 and parameters: {'model_type': 'mlp', 'hidden_dims': '[256, 128]', 'dropout': 0.35529246736618847, 'batch_norm': True, 'lr': 2.275306959605761e-05, 'weight_decay': 2.952210251151329e-06, 'epochs': 145, 'loss': 'mse', 'optimizer': 'adam', 'graph_mode': 'off', 'use_snp_selection': False}. Best is trial 35 with value: 0.06441747970138538.
[I 2025-12-05 15:03:43,912] Trial 58 finished with value: 0.012659694101429857 and parameters: {'model_type': 'mlp', 'hidden_dims': '[256, 128]', 'dropout': 0.32998883035167587, 'batch_norm': False, 'lr': 0.00028751321321870103, 'weight_decay': 7.059644183934026e-06, 'epochs': 113, 'loss': 'mse', 'optimizer': 'adam', 'graph_mode': 'off', 'use_snp_selection': False}. Best is trial 35 with value: 0.06441747970138538.
[I 2025-12-05 15:03:44,662] Trial 59 finished with value: 0.0408205323171786 and parameters: {'model_type': 'mlp', 'hidden_dims': '[256, 128]', 'dropout': 0.42533819416297647, 'batch_norm': True, 'lr': 0.000569775254764796, 'weight_decay': 1.1023873477846284e-06, 'epochs': 82, 'loss': 'mse', 'optimizer': 'adam', 'graph_mode': 'off', 'use_snp_selection': False}. Best is trial 35 with value: 0.06441747970138538.
[I 2025-12-05 15:03:46,004] Trial 60 finished with value: 0.051511648369556 and parameters: {'model_type': 'mlp', 'hidden_dims': '[512, 64]', 'dropout': 0.3082566842770433, 'batch_norm': True, 'lr': 4.0624434173515157e-05, 'weight_decay': 1.9591308838934664e-06, 'epochs': 68, 'loss': 'mse', 'optimizer': 'adam', 'graph_mode': 'off', 'use_snp_selection': True, 'num_snps': 24139}. Best is trial 35 with value: 0.06441747970138538.
[I 2025-12-05 15:03:46,807] Trial 61 finished with value: 0.038378606752581014 and parameters: {'model_type': 'mlp', 'hidden_dims': '[256, 128]', 'dropout': 0.3678217145244354, 'batch_norm': True, 'lr': 0.0001222173832344224, 'weight_decay': 4.1940290192173776e-07, 'epochs': 109, 'loss': 'mse', 'optimizer': 'adam', 'graph_mode': 'off', 'use_snp_selection': False}. Best is trial 35 with value: 0.06441747970138538.
[I 2025-12-05 15:03:48,000] Trial 62 finished with value: 0.0643872183885584 and parameters: {'model_type': 'mlp', 'hidden_dims': '[512, 256]', 'dropout': 0.3829129895127511, 'batch_norm': True, 'lr': 0.00013900983306628376, 'weight_decay': 7.357183013133144e-07, 'epochs': 121, 'loss': 'mse', 'optimizer': 'adam', 'graph_mode': 'off', 'use_snp_selection': False}. Best is trial 35 with value: 0.06441747970138538.
[I 2025-12-05 15:03:49,252] Trial 63 finished with value: 0.07434790383048129 and parameters: {'model_type': 'mlp', 'hidden_dims': '[512, 256]', 'dropout': 0.4621697294446957, 'batch_norm': True, 'lr': 0.00018473668093377273, 'weight_decay': 7.303445355981042e-07, 'epochs': 132, 'loss': 'mse', 'optimizer': 'adam', 'graph_mode': 'off', 'use_snp_selection': False}. Best is trial 63 with value: 0.07434790383048129.
[I 2025-12-05 15:03:50,181] Trial 64 finished with value: 0.03618801128870352 and parameters: {'model_type': 'mlp', 'hidden_dims': '[256, 128]', 'dropout': 0.4640287223343584, 'batch_norm': True, 'lr': 0.0001870978179385627, 'weight_decay': 7.564791399176183e-07, 'epochs': 142, 'loss': 'mse', 'optimizer': 'adam', 'graph_mode': 'off', 'use_snp_selection': False}. Best is trial 63 with value: 0.07434790383048129.
[I 2025-12-05 15:03:50,923] Trial 65 finished with value: 0.03227118029695665 and parameters: {'model_type': 'mlp', 'hidden_dims': '[128, 64]', 'dropout': 0.5410732552846549, 'batch_norm': True, 'lr': 6.246051247298338e-05, 'weight_decay': 1.6203666912517072e-06, 'epochs': 132, 'loss': 'mse', 'optimizer': 'adam', 'graph_mode': 'off', 'use_snp_selection': False}. Best is trial 63 with value: 0.07434790383048129.
[I 2025-12-05 15:03:52,031] Trial 66 finished with value: 0.07077326368053337 and parameters: {'model_type': 'mlp', 'hidden_dims': '[512, 128]', 'dropout': 0.28072420477994864, 'batch_norm': True, 'lr': 0.00022898832607685794, 'weight_decay': 0.00012554117005730476, 'epochs': 99, 'loss': 'mse', 'optimizer': 'adam', 'graph_mode': 'off', 'use_snp_selection': False}. Best is trial 63 with value: 0.07434790383048129.
[I 2025-12-05 15:03:53,069] Trial 67 finished with value: 0.018600276062159304 and parameters: {'model_type': 'mlp', 'hidden_dims': '[512, 128]', 'dropout': 0.4807234131846909, 'batch_norm': False, 'lr': 1.038788092140181e-06, 'weight_decay': 0.0009446634395666513, 'epochs': 93, 'loss': 'mse', 'optimizer': 'adam', 'graph_mode': 'off', 'use_snp_selection': False}. Best is trial 63 with value: 0.07434790383048129.
[I 2025-12-05 15:03:54,145] Trial 68 finished with value: 0.05383700966011267 and parameters: {'model_type': 'mlp', 'hidden_dims': '[512, 128]', 'dropout': 0.11830321413142653, 'batch_norm': True, 'lr': 0.0002628976967949955, 'weight_decay': 0.0002591787421298467, 'epochs': 100, 'loss': 'mse', 'optimizer': 'adam', 'graph_mode': 'off', 'use_snp_selection': False}. Best is trial 63 with value: 0.07434790383048129.
[I 2025-12-05 15:03:55,414] Trial 69 finished with value: 0.06562915472658144 and parameters: {'model_type': 'mlp', 'hidden_dims': '[512, 128]', 'dropout': 0.4172704898434386, 'batch_norm': True, 'lr': 0.00042279107652255, 'weight_decay': 8.995376141992453e-05, 'epochs': 151, 'loss': 'mse', 'optimizer': 'adam', 'graph_mode': 'off', 'use_snp_selection': False}. Best is trial 63 with value: 0.07434790383048129.
[I 2025-12-05 15:03:56,686] Trial 70 finished with value: 0.06068216426041644 and parameters: {'model_type': 'mlp', 'hidden_dims': '[512, 128]', 'dropout': 0.41887598802088716, 'batch_norm': True, 'lr': 0.0003822585889589598, 'weight_decay': 0.000221726736092611, 'epochs': 152, 'loss': 'mse', 'optimizer': 'adam', 'graph_mode': 'off', 'use_snp_selection': False}. Best is trial 63 with value: 0.07434790383048129.
[I 2025-12-05 15:03:57,894] Trial 71 finished with value: 0.0635585871566669 and parameters: {'model_type': 'mlp', 'hidden_dims': '[512, 128]', 'dropout': 0.2838215426568408, 'batch_norm': True, 'lr': 0.00034382777547080346, 'weight_decay': 0.00012590225152421275, 'epochs': 126, 'loss': 'mse', 'optimizer': 'adam', 'graph_mode': 'off', 'use_snp_selection': False}. Best is trial 63 with value: 0.07434790383048129.
[I 2025-12-05 15:03:59,119] Trial 72 finished with value: 0.05633578053857594 and parameters: {'model_type': 'mlp', 'hidden_dims': '[512, 128]', 'dropout': 0.43528435101160445, 'batch_norm': True, 'lr': 0.0004992579284968328, 'weight_decay': 0.0001331534435345249, 'epochs': 128, 'loss': 'mse', 'optimizer': 'adam', 'graph_mode': 'off', 'use_snp_selection': False}. Best is trial 63 with value: 0.07434790383048129.
[I 2025-12-05 15:04:00,516] Trial 73 finished with value: 0.05753519497151801 and parameters: {'model_type': 'mlp', 'hidden_dims': '[512, 128]', 'dropout': 0.3124819745881687, 'batch_norm': True, 'lr': 0.0008235423130125488, 'weight_decay': 9.436617986926533e-05, 'epochs': 176, 'loss': 'mse', 'optimizer': 'adam', 'graph_mode': 'off', 'use_snp_selection': False}. Best is trial 63 with value: 0.07434790383048129.
[I 2025-12-05 15:04:01,740] Trial 74 finished with value: 0.05585438755198471 and parameters: {'model_type': 'mlp', 'hidden_dims': '[512, 128]', 'dropout': 0.2685253305763347, 'batch_norm': True, 'lr': 0.0002234229574004973, 'weight_decay': 0.0005155567969937544, 'epochs': 137, 'loss': 'mse', 'optimizer': 'adam', 'graph_mode': 'off', 'use_snp_selection': False}. Best is trial 63 with value: 0.07434790383048129.
[I 2025-12-05 15:04:02,892] Trial 75 finished with value: 0.07302101959149787 and parameters: {'model_type': 'mlp', 'hidden_dims': '[512, 128]', 'dropout': 0.20778395018364548, 'batch_norm': True, 'lr': 0.0003398235829090509, 'weight_decay': 2.915951201066328e-05, 'epochs': 121, 'loss': 'mse', 'optimizer': 'adam', 'graph_mode': 'off', 'use_snp_selection': False}. Best is trial 63 with value: 0.07434790383048129.
[I 2025-12-05 15:04:04,053] Trial 76 finished with value: 0.045133798088261026 and parameters: {'model_type': 'mlp', 'hidden_dims': '[512, 128]', 'dropout': 0.2854655745816253, 'batch_norm': True, 'lr': 0.0004763594545174984, 'weight_decay': 2.741469777614307e-05, 'epochs': 123, 'loss': 'mse', 'optimizer': 'adam', 'graph_mode': 'off', 'use_snp_selection': False}. Best is trial 63 with value: 0.07434790383048129.
[I 2025-12-05 15:04:05,135] Trial 77 finished with value: 0.06874331824324736 and parameters: {'model_type': 'mlp', 'hidden_dims': '[512, 128]', 'dropout': 0.24490083701818915, 'batch_norm': True, 'lr': 0.0007128126452537558, 'weight_decay': 0.00015843489207215065, 'epochs': 102, 'loss': 'mse', 'optimizer': 'adam', 'graph_mode': 'off', 'use_snp_selection': False}. Best is trial 63 with value: 0.07434790383048129.
[I 2025-12-05 15:04:05,830] Trial 78 finished with value: 0.061233664885179055 and parameters: {'model_type': 'mlp', 'hidden_dims': '[512, 128]', 'dropout': 0.24938352954481532, 'batch_norm': True, 'lr': 0.0007841241310675962, 'weight_decay': 0.0001751322859439517, 'epochs': 80, 'loss': 'mse', 'optimizer': 'adam', 'graph_mode': 'off', 'use_snp_selection': True, 'num_snps': 2246}. Best is trial 63 with value: 0.07434790383048129.
[I 2025-12-05 15:04:06,999] Trial 79 finished with value: 0.05452189356648088 and parameters: {'model_type': 'mlp', 'hidden_dims': '[512, 128]', 'dropout': 0.22435179607741898, 'batch_norm': True, 'lr': 0.0003451369488982539, 'weight_decay': 3.5440696586496e-05, 'epochs': 122, 'loss': 'mse', 'optimizer': 'adam', 'graph_mode': 'off', 'use_snp_selection': False}. Best is trial 63 with value: 0.07434790383048129.
[I 2025-12-05 15:04:08,119] Trial 80 finished with value: 0.05837748951775315 and parameters: {'model_type': 'mlp', 'hidden_dims': '[512, 128]', 'dropout': 0.27154016736209696, 'batch_norm': True, 'lr': 0.0006056677938298811, 'weight_decay': 0.00041588853974900867, 'epochs': 100, 'loss': 'mse', 'optimizer': 'adam', 'graph_mode': 'off', 'use_snp_selection': False}. Best is trial 63 with value: 0.07434790383048129.
[I 2025-12-05 15:04:09,436] Trial 81 finished with value: 0.04848116141707391 and parameters: {'model_type': 'mlp', 'hidden_dims': '[512, 128]', 'dropout': 0.20944745688456784, 'batch_norm': True, 'lr': 0.0004551515984698835, 'weight_decay': 7.619300025339806e-05, 'epochs': 150, 'loss': 'mse', 'optimizer': 'adam', 'graph_mode': 'off', 'use_snp_selection': False}. Best is trial 63 with value: 0.07434790383048129.
[I 2025-12-05 15:04:10,666] Trial 82 finished with value: 0.04713632897538893 and parameters: {'model_type': 'mlp', 'hidden_dims': '[512, 128]', 'dropout': 0.2848826923988027, 'batch_norm': True, 'lr': 0.000721470976754813, 'weight_decay': 0.0001256671320060484, 'epochs': 133, 'loss': 'mse', 'optimizer': 'adam', 'graph_mode': 'off', 'use_snp_selection': False}. Best is trial 63 with value: 0.07434790383048129.
[I 2025-12-05 15:04:11,961] Trial 83 finished with value: 0.04468738727208215 and parameters: {'model_type': 'mlp', 'hidden_dims': '[512, 128]', 'dropout': 0.16418664905337582, 'batch_norm': True, 'lr': 0.0002417713726653745, 'weight_decay': 1.8715728408460942e-05, 'epochs': 157, 'loss': 'mse', 'optimizer': 'adam', 'graph_mode': 'off', 'use_snp_selection': False}. Best is trial 63 with value: 0.07434790383048129.
[I 2025-12-05 15:04:12,996] Trial 84 finished with value: 0.04384871769840343 and parameters: {'model_type': 'mlp', 'hidden_dims': '[512, 128]', 'dropout': 0.26045000658529965, 'batch_norm': True, 'lr': 0.0003172989801088453, 'weight_decay': 5.3026632999160457e-05, 'epochs': 89, 'loss': 'mse', 'optimizer': 'adam', 'graph_mode': 'off', 'use_snp_selection': False}. Best is trial 63 with value: 0.07434790383048129.
[I 2025-12-05 15:04:14,087] Trial 85 finished with value: 0.06686264264569254 and parameters: {'model_type': 'mlp', 'hidden_dims': '[512, 64]', 'dropout': 0.2335975370786632, 'batch_norm': True, 'lr': 0.0006027283908056379, 'weight_decay': 4.5676957790034236e-05, 'epochs': 105, 'loss': 'mse', 'optimizer': 'adam', 'graph_mode': 'off', 'use_snp_selection': False}. Best is trial 63 with value: 0.07434790383048129.
[I 2025-12-05 15:04:15,176] Trial 86 finished with value: 0.06130666108656294 and parameters: {'model_type': 'mlp', 'hidden_dims': '[512, 128]', 'dropout': 0.24394193872358094, 'batch_norm': True, 'lr': 0.0005275711645160518, 'weight_decay': 4.125865980822704e-05, 'epochs': 104, 'loss': 'mse', 'optimizer': 'adam', 'graph_mode': 'off', 'use_snp_selection': False}. Best is trial 63 with value: 0.07434790383048129.
[I 2025-12-05 15:04:16,062] Trial 87 finished with value: 0.038217692994225394 and parameters: {'model_type': 'mlp', 'hidden_dims': '[512, 64]', 'dropout': 0.21744796969226618, 'batch_norm': True, 'lr': 0.0006736467566844558, 'weight_decay': 0.0001028298992201746, 'epochs': 51, 'loss': 'mse', 'optimizer': 'adam', 'graph_mode': 'off', 'use_snp_selection': False}. Best is trial 63 with value: 0.07434790383048129.
