[I 2025-12-05 15:27:03,899] Trial 110 finished with value: 0.14915752854198086 and parameters: {'model_type': 'mlp', 'hidden_dims': '[512, 64]', 'dropout': 0.17380946956714974, 'batch_norm': True, 'lr': 5.786194415925147e-05, 'weight_decay': 8.7927541271815e-05, 'epochs': 219, 'loss': 'mae', 'optimizer': 'adam', 'graph_mode': 'off', 'use_snp_selection': False}. Best is trial 71 with value: 0.15351481769690967.
[I 2025-12-05 15:27:07,387] Trial 111 finished with value: 0.13882158944373532 and parameters: {'model_type': 'mlp', 'hidden_dims': '[512, 64]', 'dropout': 0.17804677735818, 'batch_norm': True, 'lr': 5.506031137633732e-05, 'weight_decay': 8.603879602494926e-05, 'epochs': 223, 'loss': 'mae', 'optimizer': 'adam', 'graph_mode': 'off', 'use_snp_selection': False}. Best is trial 71 with value: 0.15351481769690967.
[I 2025-12-05 15:27:10,958] Trial 112 finished with value: 0.13078018887483642 and parameters: {'model_type': 'mlp', 'hidden_dims': '[512, 64]', 'dropout': 0.14030246464350596, 'batch_norm': True, 'lr': 6.293036348205032e-05, 'weight_decay': 0.0001673775540475541, 'epochs': 232, 'loss': 'mae', 'optimizer': 'adam', 'graph_mode': 'off', 'use_snp_selection': False}. Best is trial 71 with value: 0.15351481769690967.
[I 2025-12-05 15:27:14,325] Trial 113 finished with value: 0.12907736532082745 and parameters: {'model_type': 'mlp', 'hidden_dims': '[512, 256]', 'dropout': 0.19576637446609887, 'batch_norm': True, 'lr': 3.984043617158954e-05, 'weight_decay': 7.301729450493783e-05, 'epochs': 215, 'loss': 'mae', 'optimizer': 'adam', 'graph_mode': 'off', 'use_snp_selection': False}. Best is trial 71 with value: 0.15351481769690967.
[I 2025-12-05 15:27:17,432] Trial 114 finished with value: 0.13266825126348236 and parameters: {'model_type': 'mlp', 'hidden_dims': '[512, 64]', 'dropout': 0.15956571312763412, 'batch_norm': True, 'lr': 9.17962544573278e-05, 'weight_decay': 0.00012737708178685365, 'epochs': 192, 'loss': 'mae', 'optimizer': 'adam', 'graph_mode': 'off', 'use_snp_selection': False}. Best is trial 71 with value: 0.15351481769690967.
[I 2025-12-05 15:27:22,195] Trial 115 finished with value: 0.1272646814428251 and parameters: {'model_type': 'mlp', 'hidden_dims': '[512, 64]', 'dropout': 0.16722721969399232, 'batch_norm': True, 'lr': 4.772465185613385e-05, 'weight_decay': 5.24925527284713e-05, 'epochs': 328, 'loss': 'mae', 'optimizer': 'adam', 'graph_mode': 'off', 'use_snp_selection': False}. Best is trial 71 with value: 0.15351481769690967.
[I 2025-12-05 15:27:25,423] Trial 116 finished with value: 0.14381119447110752 and parameters: {'model_type': 'mlp', 'hidden_dims': '[512, 256]', 'dropout': 0.11155639239137283, 'batch_norm': True, 'lr': 7.224720057405074e-05, 'weight_decay': 2.7452172435644174e-05, 'epochs': 204, 'loss': 'mae', 'optimizer': 'adam', 'graph_mode': 'off', 'use_snp_selection': False}. Best is trial 71 with value: 0.15351481769690967.
[I 2025-12-05 15:27:28,284] Trial 117 finished with value: 0.1313966348852776 and parameters: {'model_type': 'mlp', 'hidden_dims': '[512, 256]', 'dropout': 0.11494132547752782, 'batch_norm': False, 'lr': 7.935340473917522e-05, 'weight_decay': 2.7687314066876324e-05, 'epochs': 176, 'loss': 'mae', 'optimizer': 'adam', 'graph_mode': 'off', 'use_snp_selection': False}. Best is trial 71 with value: 0.15351481769690967.
[I 2025-12-05 15:27:31,555] Trial 118 finished with value: 0.14693126864703931 and parameters: {'model_type': 'mlp', 'hidden_dims': '[512, 256]', 'dropout': 0.10875028415613185, 'batch_norm': True, 'lr': 0.0001063152482439576, 'weight_decay': 1.886262011728265e-05, 'epochs': 204, 'loss': 'mae', 'optimizer': 'adam', 'graph_mode': 'off', 'use_snp_selection': False}. Best is trial 71 with value: 0.15351481769690967.
[I 2025-12-05 15:27:34,855] Trial 119 finished with value: 0.14854974628519177 and parameters: {'model_type': 'mlp', 'hidden_dims': '[512, 256]', 'dropout': 0.13313204835126943, 'batch_norm': True, 'lr': 0.0001737942362879894, 'weight_decay': 1.9319079040853367e-05, 'epochs': 209, 'loss': 'mae', 'optimizer': 'adam', 'graph_mode': 'off', 'use_snp_selection': False}. Best is trial 71 with value: 0.15351481769690967.
[I 2025-12-05 15:27:38,704] Trial 120 finished with value: 0.14185803047794895 and parameters: {'model_type': 'mlp', 'hidden_dims': '[512, 256]', 'dropout': 0.13160730411545432, 'batch_norm': True, 'lr': 0.00018026925346341098, 'weight_decay': 4.179697674931016e-05, 'epochs': 250, 'loss': 'mae', 'optimizer': 'adam', 'graph_mode': 'off', 'use_snp_selection': False}. Best is trial 71 with value: 0.15351481769690967.
[I 2025-12-05 15:27:41,974] Trial 121 finished with value: 0.1344792249443702 and parameters: {'model_type': 'mlp', 'hidden_dims': '[512, 256]', 'dropout': 0.14960917087522874, 'batch_norm': True, 'lr': 0.0001066549458856922, 'weight_decay': 1.3688151665878222e-05, 'epochs': 205, 'loss': 'mae', 'optimizer': 'adam', 'graph_mode': 'off', 'use_snp_selection': False}. Best is trial 71 with value: 0.15351481769690967.
[I 2025-12-05 15:27:45,357] Trial 122 finished with value: 0.13766575480897122 and parameters: {'model_type': 'mlp', 'hidden_dims': '[512, 256]', 'dropout': 0.12386044040064827, 'batch_norm': True, 'lr': 0.0002483125954630287, 'weight_decay': 1.8659245181057313e-05, 'epochs': 217, 'loss': 'mae', 'optimizer': 'adam', 'graph_mode': 'off', 'use_snp_selection': False}. Best is trial 71 with value: 0.15351481769690967.
[I 2025-12-05 15:27:49,061] Trial 123 finished with value: 0.13552395522515318 and parameters: {'model_type': 'mlp', 'hidden_dims': '[512, 256]', 'dropout': 0.14381284344882983, 'batch_norm': True, 'lr': 0.00013931707055987887, 'weight_decay': 6.9837302134456934e-06, 'epochs': 239, 'loss': 'mae', 'optimizer': 'adam', 'graph_mode': 'off', 'use_snp_selection': False}. Best is trial 71 with value: 0.15351481769690967.
[I 2025-12-05 15:27:52,223] Trial 124 finished with value: 0.1444718717177432 and parameters: {'model_type': 'mlp', 'hidden_dims': '[512, 256]', 'dropout': 0.18590361199516967, 'batch_norm': True, 'lr': 0.00011822599286783303, 'weight_decay': 1.5152013713792261e-05, 'epochs': 196, 'loss': 'mae', 'optimizer': 'adam', 'graph_mode': 'off', 'use_snp_selection': False}. Best is trial 71 with value: 0.15351481769690967.
[I 2025-12-05 15:27:54,374] Trial 125 finished with value: 0.13405812221674587 and parameters: {'model_type': 'mlp', 'hidden_dims': '[256, 128]', 'dropout': 0.18542726504212967, 'batch_norm': True, 'lr': 0.00011900678180494991, 'weight_decay': 9.376811717345655e-05, 'epochs': 233, 'loss': 'mae', 'optimizer': 'adam', 'graph_mode': 'off', 'use_snp_selection': False}. Best is trial 71 with value: 0.15351481769690967.
[I 2025-12-05 15:27:57,432] Trial 126 finished with value: 0.13541523903403674 and parameters: {'model_type': 'mlp', 'hidden_dims': '[512, 256]', 'dropout': 0.20439818613986993, 'batch_norm': True, 'lr': 0.00016763612494527576, 'weight_decay': 1.0944462808438819e-05, 'epochs': 187, 'loss': 'mse', 'optimizer': 'adam', 'graph_mode': 'off', 'use_snp_selection': False}. Best is trial 71 with value: 0.15351481769690967.
[I 2025-12-05 15:28:00,912] Trial 127 finished with value: 0.1380377472641926 and parameters: {'model_type': 'mlp', 'hidden_dims': '[512, 256]', 'dropout': 0.1745252844332668, 'batch_norm': True, 'lr': 0.00022207694864737363, 'weight_decay': 8.453993797876517e-06, 'epochs': 222, 'loss': 'mae', 'optimizer': 'adam', 'graph_mode': 'off', 'use_snp_selection': False}. Best is trial 71 with value: 0.15351481769690967.
[I 2025-12-05 15:28:03,108] Trial 128 finished with value: 0.11017702534169434 and parameters: {'model_type': 'mlp', 'hidden_dims': '[512, 64]', 'dropout': 0.10835762346976241, 'batch_norm': True, 'lr': 0.00010130337750827704, 'weight_decay': 3.5529712604237864e-05, 'epochs': 206, 'loss': 'mae', 'optimizer': 'adam', 'graph_mode': 'off', 'use_snp_selection': True, 'num_snps': 12722}. Best is trial 71 with value: 0.15351481769690967.
[I 2025-12-05 15:28:04,999] Trial 129 finished with value: 0.12382056597511398 and parameters: {'model_type': 'mlp', 'hidden_dims': '[256, 128, 64]', 'dropout': 0.13475827489435074, 'batch_norm': True, 'lr': 0.0009649421778766892, 'weight_decay': 2.233499769034148e-05, 'epochs': 192, 'loss': 'mae', 'optimizer': 'adam', 'graph_mode': 'off', 'use_snp_selection': False}. Best is trial 71 with value: 0.15351481769690967.
[I 2025-12-05 15:28:09,945] Trial 130 finished with value: 0.12871281156633574 and parameters: {'model_type': 'mlp', 'hidden_dims': '[512, 256]', 'dropout': 0.2149805863892988, 'batch_norm': True, 'lr': 0.0001477305380177566, 'weight_decay': 5.7108472966439e-05, 'epochs': 340, 'loss': 'mae', 'optimizer': 'adam', 'graph_mode': 'off', 'use_snp_selection': False}. Best is trial 71 with value: 0.15351481769690967.
[I 2025-12-05 15:28:13,093] Trial 131 finished with value: 0.13366943779499915 and parameters: {'model_type': 'mlp', 'hidden_dims': '[512, 256]', 'dropout': 0.15751020387590395, 'batch_norm': True, 'lr': 8.395334894739312e-05, 'weight_decay': 1.5986440756718e-05, 'epochs': 198, 'loss': 'mae', 'optimizer': 'adam', 'graph_mode': 'off', 'use_snp_selection': False}. Best is trial 71 with value: 0.15351481769690967.
[I 2025-12-05 15:28:16,420] Trial 132 finished with value: 0.08852819762129754 and parameters: {'model_type': 'mlp', 'hidden_dims': '[512, 256]', 'dropout': 0.18356839038606187, 'batch_norm': True, 'lr': 2.2757652887330195e-06, 'weight_decay': 1.1960726741139951e-05, 'epochs': 212, 'loss': 'mae', 'optimizer': 'adam', 'graph_mode': 'off', 'use_snp_selection': False}. Best is trial 71 with value: 0.15351481769690967.
[I 2025-12-05 15:28:19,425] Trial 133 finished with value: 0.1382870616967581 and parameters: {'model_type': 'mlp', 'hidden_dims': '[512, 256]', 'dropout': 0.19557303416389601, 'batch_norm': True, 'lr': 0.00012499158740068375, 'weight_decay': 1.568650606016265e-05, 'epochs': 183, 'loss': 'mae', 'optimizer': 'adam', 'graph_mode': 'off', 'use_snp_selection': False}. Best is trial 71 with value: 0.15351481769690967.
[I 2025-12-05 15:28:22,204] Trial 134 finished with value: 0.1413546316710439 and parameters: {'model_type': 'mlp', 'hidden_dims': '[512, 256]', 'dropout': 0.10018620262674734, 'batch_norm': True, 'lr': 5.795878997812984e-05, 'weight_decay': 0.00010580401366632098, 'epochs': 166, 'loss': 'mae', 'optimizer': 'adam', 'graph_mode': 'off', 'use_snp_selection': False}. Best is trial 71 with value: 0.15351481769690967.
[I 2025-12-05 15:28:27,221] Trial 135 finished with value: 0.135867779441445 and parameters: {'model_type': 'mlp', 'hidden_dims': '[512, 256]', 'dropout': 0.167542255309998, 'batch_norm': True, 'lr': 9.364616678432034e-05, 'weight_decay': 1.9558294546532128e-05, 'epochs': 245, 'loss': 'mae', 'optimizer': 'adam', 'graph_mode': 'off', 'use_snp_selection': False}. Best is trial 71 with value: 0.15351481769690967.
[I 2025-12-05 15:28:29,846] Trial 136 finished with value: 0.13450723567186618 and parameters: {'model_type': 'mlp', 'hidden_dims': '[512, 256]', 'dropout': 0.12285984363978175, 'batch_norm': True, 'lr': 6.726026944926019e-05, 'weight_decay': 2.3635684711408838e-05, 'epochs': 141, 'loss': 'mae', 'optimizer': 'adam', 'graph_mode': 'off', 'use_snp_selection': False}. Best is trial 71 with value: 0.15351481769690967.
[I 2025-12-05 15:28:33,012] Trial 137 finished with value: 0.13806876460164497 and parameters: {'model_type': 'mlp', 'hidden_dims': '[512, 256]', 'dropout': 0.15192077034171247, 'batch_norm': True, 'lr': 0.00010615171945260843, 'weight_decay': 0.00019463176910151456, 'epochs': 197, 'loss': 'mae', 'optimizer': 'adam', 'graph_mode': 'off', 'use_snp_selection': False}. Best is trial 71 with value: 0.15351481769690967.
[I 2025-12-05 15:28:35,763] Trial 138 finished with value: 0.12291699862408592 and parameters: {'model_type': 'mlp', 'hidden_dims': '[512, 256]', 'dropout': 0.14152421044253, 'batch_norm': False, 'lr': 7.545681728069347e-05, 'weight_decay': 4.696065941829478e-06, 'epochs': 170, 'loss': 'mae', 'optimizer': 'adam', 'graph_mode': 'off', 'use_snp_selection': False}. Best is trial 71 with value: 0.15351481769690967.
[I 2025-12-05 15:28:39,655] Trial 139 finished with value: 0.11593598035634765 and parameters: {'model_type': 'mlp', 'hidden_dims': '[512, 256]', 'dropout': 0.23303077310498124, 'batch_norm': True, 'lr': 5.224859991482914e-05, 'weight_decay': 0.00013266438874802883, 'epochs': 258, 'loss': 'mae', 'optimizer': 'adam', 'graph_mode': 'off', 'use_snp_selection': False}. Best is trial 71 with value: 0.15351481769690967.
[I 2025-12-05 15:28:43,241] Trial 140 finished with value: 0.1333781197974827 and parameters: {'model_type': 'mlp', 'hidden_dims': '[512, 64]', 'dropout': 0.17338048015332144, 'batch_norm': True, 'lr': 0.00013609735857143495, 'weight_decay': 4.823291492457062e-05, 'epochs': 230, 'loss': 'mae', 'optimizer': 'adam', 'graph_mode': 'off', 'use_snp_selection': False}. Best is trial 71 with value: 0.15351481769690967.
[I 2025-12-05 15:28:46,446] Trial 141 finished with value: 0.14763576866546912 and parameters: {'model_type': 'mlp', 'hidden_dims': '[512, 256]', 'dropout': 0.11209780060397086, 'batch_norm': True, 'lr': 6.852814423875673e-05, 'weight_decay': 3.129683795965713e-05, 'epochs': 201, 'loss': 'mae', 'optimizer': 'adam', 'graph_mode': 'off', 'use_snp_selection': False}. Best is trial 71 with value: 0.15351481769690967.
[I 2025-12-05 15:28:49,494] Trial 142 finished with value: 0.15272438123127208 and parameters: {'model_type': 'mlp', 'hidden_dims': '[512, 256]', 'dropout': 0.11434856947781268, 'batch_norm': True, 'lr': 6.324343159443054e-05, 'weight_decay': 3.779522617394382e-05, 'epochs': 190, 'loss': 'mae', 'optimizer': 'adam', 'graph_mode': 'off', 'use_snp_selection': False}. Best is trial 71 with value: 0.15351481769690967.
[I 2025-12-05 15:28:52,575] Trial 143 finished with value: 0.12841236385375765 and parameters: {'model_type': 'mlp', 'hidden_dims': '[512, 256]', 'dropout': 0.11310358555642806, 'batch_norm': True, 'lr': 6.197381620048624e-05, 'weight_decay': 3.3169151430684134e-05, 'epochs': 189, 'loss': 'mae', 'optimizer': 'adam', 'graph_mode': 'off', 'use_snp_selection': False}. Best is trial 71 with value: 0.15351481769690967.
[I 2025-12-05 15:28:55,516] Trial 144 finished with value: 0.13495331419285667 and parameters: {'model_type': 'mlp', 'hidden_dims': '[512, 256]', 'dropout': 0.12468990566212587, 'batch_norm': True, 'lr': 9.028258059608141e-05, 'weight_decay': 6.794824562246461e-05, 'epochs': 179, 'loss': 'mae', 'optimizer': 'adam', 'graph_mode': 'off', 'use_snp_selection': False}. Best is trial 71 with value: 0.15351481769690967.
[I 2025-12-05 15:28:58,791] Trial 145 finished with value: 0.15583753681025092 and parameters: {'model_type': 'mlp', 'hidden_dims': '[512, 256]', 'dropout': 0.10018842374895888, 'batch_norm': True, 'lr': 0.00010984851771528766, 'weight_decay': 8.300275862751545e-05, 'epochs': 208, 'loss': 'mae', 'optimizer': 'adam', 'graph_mode': 'off', 'use_snp_selection': False}. Best is trial 145 with value: 0.15583753681025092.
[I 2025-12-05 15:29:00,844] Trial 146 finished with value: 0.13463958048765512 and parameters: {'model_type': 'mlp', 'hidden_dims': '[256, 128]', 'dropout': 0.10575144279498867, 'batch_norm': True, 'lr': 0.0006010321072127371, 'weight_decay': 7.919563877244073e-05, 'epochs': 218, 'loss': 'mae', 'optimizer': 'adam', 'graph_mode': 'off', 'use_snp_selection': False}. Best is trial 145 with value: 0.15583753681025092.
[I 2025-12-05 15:29:04,174] Trial 147 finished with value: 0.13960270270347327 and parameters: {'model_type': 'mlp', 'hidden_dims': '[512, 128]', 'dropout': 0.12793875271296767, 'batch_norm': True, 'lr': 0.0008126664240877124, 'weight_decay': 0.00010597717068764084, 'epochs': 210, 'loss': 'mse', 'optimizer': 'adam', 'graph_mode': 'off', 'use_snp_selection': False}. Best is trial 145 with value: 0.15583753681025092.
[I 2025-12-05 15:29:07,373] Trial 148 finished with value: 0.13842881993943498 and parameters: {'model_type': 'mlp', 'hidden_dims': '[512, 256]', 'dropout': 0.10041067696406386, 'batch_norm': True, 'lr': 8.05851142362311e-05, 'weight_decay': 6.13036278725131e-05, 'epochs': 202, 'loss': 'mae', 'optimizer': 'adam', 'graph_mode': 'off', 'use_snp_selection': False}. Best is trial 145 with value: 0.15583753681025092.
[I 2025-12-05 15:29:10,837] Trial 149 finished with value: 0.1446360114805184 and parameters: {'model_type': 'mlp', 'hidden_dims': '[512, 256]', 'dropout': 0.11005521195199036, 'batch_norm': True, 'lr': 0.00015823630891348197, 'weight_decay': 3.7638853936860786e-05, 'epochs': 221, 'loss': 'mae', 'optimizer': 'adam', 'graph_mode': 'off', 'use_snp_selection': True, 'num_snps': 29744}. Best is trial 145 with value: 0.15583753681025092.
[I 2025-12-05 15:29:13,347] Trial 0 finished with value: 0.05733778395534488 and parameters: {'model_type': 'mlp', 'hidden_dims': '[128, 64]', 'dropout': 0.199031432379812, 'batch_norm': True, 'lr': 1.8408544111075837e-06, 'weight_decay': 5.5136510071208614e-05, 'epochs': 336, 'loss': 'mae', 'optimizer': 'adam', 'graph_mode': 'off', 'use_snp_selection': True, 'num_snps': 43862}. Best is trial 0 with value: 0.05733778395534488.
[I 2025-12-05 15:29:14,685] Trial 1 finished with value: 0.0800220021056675 and parameters: {'model_type': 'mlp', 'hidden_dims': '[256, 128]', 'dropout': 0.4370668075331726, 'batch_norm': True, 'lr': 7.133471581159139e-05, 'weight_decay': 1.128633586803549e-05, 'epochs': 242, 'loss': 'mae', 'optimizer': 'adam', 'graph_mode': 'off', 'use_snp_selection': False}. Best is trial 1 with value: 0.0800220021056675.
[I 2025-12-05 15:29:15,908] Trial 2 finished with value: 0.028957029246279995 and parameters: {'model_type': 'mlp', 'hidden_dims': '[256, 128, 64]', 'dropout': 0.41314357415569625, 'batch_norm': False, 'lr': 3.952233718592101e-06, 'weight_decay': 0.00026754769258252603, 'epochs': 149, 'loss': 'mse', 'optimizer': 'adam', 'graph_mode': 'off', 'use_snp_selection': True, 'num_snps': 11571}. Best is trial 1 with value: 0.0800220021056675.
[I 2025-12-05 15:29:18,463] Trial 3 finished with value: 0.07217829184433631 and parameters: {'model_type': 'mlp', 'hidden_dims': '[512, 64]', 'dropout': 0.5938127374509361, 'batch_norm': False, 'lr': 5.67704586114731e-06, 'weight_decay': 2.4518087630137052e-05, 'epochs': 320, 'loss': 'mae', 'optimizer': 'adam', 'graph_mode': 'off', 'use_snp_selection': False}. Best is trial 1 with value: 0.0800220021056675.
[I 2025-12-05 15:29:21,172] Trial 4 finished with value: 0.044901266642785896 and parameters: {'model_type': 'mlp', 'hidden_dims': '[512, 128]', 'dropout': 0.25746343592134413, 'batch_norm': True, 'lr': 1.3467657668402788e-06, 'weight_decay': 0.00033087251918647806, 'epochs': 277, 'loss': 'mse', 'optimizer': 'adam', 'graph_mode': 'off', 'use_snp_selection': True, 'num_snps': 36675}. Best is trial 1 with value: 0.0800220021056675.
[I 2025-12-05 15:29:23,244] Trial 5 finished with value: 0.013996901860308377 and parameters: {'model_type': 'mlp', 'hidden_dims': '[512, 64]', 'dropout': 0.38275350994408375, 'batch_norm': True, 'lr': 1.5586664309232824e-06, 'weight_decay': 0.0008227664668621182, 'epochs': 145, 'loss': 'mae', 'optimizer': 'adam', 'graph_mode': 'off', 'use_snp_selection': True, 'num_snps': 32148}. Best is trial 1 with value: 0.0800220021056675.
[I 2025-12-05 15:29:24,441] Trial 6 finished with value: 0.09501064169326207 and parameters: {'model_type': 'mlp', 'hidden_dims': '[256, 128]', 'dropout': 0.3930109900265879, 'batch_norm': False, 'lr': 4.892964372128395e-05, 'weight_decay': 1.5809549317992182e-06, 'epochs': 199, 'loss': 'mse', 'optimizer': 'adam', 'graph_mode': 'off', 'use_snp_selection': False}. Best is trial 6 with value: 0.09501064169326207.
[I 2025-12-05 15:29:25,736] Trial 7 finished with value: 0.11528134753305326 and parameters: {'model_type': 'mlp', 'hidden_dims': '[512, 256]', 'dropout': 0.15343979219678458, 'batch_norm': True, 'lr': 6.234003099047341e-05, 'weight_decay': 3.894760610535477e-07, 'epochs': 97, 'loss': 'mse', 'optimizer': 'adam', 'graph_mode': 'off', 'use_snp_selection': False}. Best is trial 7 with value: 0.11528134753305326.
[I 2025-12-05 15:29:28,274] Trial 8 finished with value: 0.11261501091157908 and parameters: {'model_type': 'mlp', 'hidden_dims': '[512, 128]', 'dropout': 0.10743001231661406, 'batch_norm': True, 'lr': 0.00023728538449271062, 'weight_decay': 1.7629071578048637e-05, 'epochs': 312, 'loss': 'mae', 'optimizer': 'adam', 'graph_mode': 'off', 'use_snp_selection': False}. Best is trial 7 with value: 0.11528134753305326.
[I 2025-12-05 15:29:29,985] Trial 9 finished with value: 0.10620165552322076 and parameters: {'model_type': 'mlp', 'hidden_dims': '[512, 64]', 'dropout': 0.14505336736221927, 'batch_norm': True, 'lr': 5.8619638388111826e-05, 'weight_decay': 6.200156172669308e-07, 'epochs': 175, 'loss': 'mse', 'optimizer': 'adam', 'graph_mode': 'off', 'use_snp_selection': False}. Best is trial 7 with value: 0.11528134753305326.
[I 2025-12-05 15:29:31,033] Trial 10 finished with value: 0.022141294091461275 and parameters: {'model_type': 'mlp', 'hidden_dims': '[512, 256]', 'dropout': 0.2736992815328032, 'batch_norm': False, 'lr': 0.00032393778075602147, 'weight_decay': 1.1511946696017092e-07, 'epochs': 41, 'loss': 'mse', 'optimizer': 'adam', 'graph_mode': 'off', 'use_snp_selection': False}. Best is trial 7 with value: 0.11528134753305326.
[I 2025-12-05 15:29:32,131] Trial 11 finished with value: 0.11431211947153 and parameters: {'model_type': 'mlp', 'hidden_dims': '[512, 128]', 'dropout': 0.10095648685224448, 'batch_norm': True, 'lr': 0.0007666984023899753, 'weight_decay': 2.512571353186099e-06, 'epochs': 70, 'loss': 'mae', 'optimizer': 'adam', 'graph_mode': 'off', 'use_snp_selection': False}. Best is trial 7 with value: 0.11528134753305326.
