[I 2025-12-05 16:33:41,265] Trial 26 finished with value: 0.04478683260918392 and parameters: {'model_type': 'mlp', 'hidden_dims': '[256, 128, 64]', 'dropout': 0.1740574416712855, 'batch_norm': True, 'lr': 0.00011396425784900865, 'weight_decay': 0.0009995184567791959, 'epochs': 187, 'loss': 'mae', 'optimizer': 'adam', 'graph_mode': 'off', 'use_snp_selection': True, 'num_snps': 3842}. Best is trial 8 with value: 0.11483888533968921.
[I 2025-12-05 16:33:42,717] Trial 27 finished with value: 0.06068295393920867 and parameters: {'model_type': 'mlp', 'hidden_dims': '[512, 128]', 'dropout': 0.5916123333422963, 'batch_norm': False, 'lr': 3.708794373669967e-05, 'weight_decay': 7.274099029981332e-05, 'epochs': 251, 'loss': 'mse', 'optimizer': 'adam', 'graph_mode': 'off', 'use_snp_selection': False}. Best is trial 8 with value: 0.11483888533968921.
[I 2025-12-05 16:33:43,792] Trial 28 finished with value: 0.09745276169471406 and parameters: {'model_type': 'mlp', 'hidden_dims': '[256, 128]', 'dropout': 0.5446517125861267, 'batch_norm': True, 'lr': 0.00019434447726613438, 'weight_decay': 1.8691034746521335e-05, 'epochs': 297, 'loss': 'mae', 'optimizer': 'adam', 'graph_mode': 'off', 'use_snp_selection': False}. Best is trial 8 with value: 0.11483888533968921.
[I 2025-12-05 16:33:45,216] Trial 29 finished with value: 0.07430493784939286 and parameters: {'model_type': 'mlp', 'hidden_dims': '[128, 64]', 'dropout': 0.19565660752550904, 'batch_norm': True, 'lr': 8.521040913798177e-05, 'weight_decay': 3.298948302124128e-05, 'epochs': 317, 'loss': 'mae', 'optimizer': 'adam', 'graph_mode': 'off', 'use_snp_selection': True, 'num_snps': 19468}. Best is trial 8 with value: 0.11483888533968921.
[I 2025-12-05 16:33:46,027] Trial 30 finished with value: 0.11336173656486546 and parameters: {'model_type': 'mlp', 'hidden_dims': '[128, 64]', 'dropout': 0.24112862927171635, 'batch_norm': True, 'lr': 0.0007081266019101939, 'weight_decay': 0.00019522459826188028, 'epochs': 220, 'loss': 'mae', 'optimizer': 'adam', 'graph_mode': 'off', 'use_snp_selection': False}. Best is trial 8 with value: 0.11483888533968921.
[I 2025-12-05 16:33:46,828] Trial 31 finished with value: 0.11713727821537256 and parameters: {'model_type': 'mlp', 'hidden_dims': '[128, 64]', 'dropout': 0.24799473563213015, 'batch_norm': True, 'lr': 0.0007806985363335579, 'weight_decay': 0.00017269117808819387, 'epochs': 218, 'loss': 'mae', 'optimizer': 'adam', 'graph_mode': 'off', 'use_snp_selection': False}. Best is trial 31 with value: 0.11713727821537256.
[I 2025-12-05 16:33:47,607] Trial 32 finished with value: 0.1035868551833696 and parameters: {'model_type': 'mlp', 'hidden_dims': '[128, 64]', 'dropout': 0.3214424970245884, 'batch_norm': True, 'lr': 0.0003539129865918827, 'weight_decay': 5.2706341161099005e-05, 'epochs': 202, 'loss': 'mae', 'optimizer': 'adam', 'graph_mode': 'off', 'use_snp_selection': False}. Best is trial 31 with value: 0.11713727821537256.
[I 2025-12-05 16:33:48,560] Trial 33 finished with value: 0.10509930615277746 and parameters: {'model_type': 'mlp', 'hidden_dims': '[128, 64]', 'dropout': 0.28525956711764544, 'batch_norm': True, 'lr': 0.0006627653445667321, 'weight_decay': 0.0005120466885982286, 'epochs': 332, 'loss': 'mae', 'optimizer': 'adam', 'graph_mode': 'off', 'use_snp_selection': False}. Best is trial 31 with value: 0.11713727821537256.
[I 2025-12-05 16:33:49,428] Trial 34 finished with value: 0.08749699859915194 and parameters: {'model_type': 'mlp', 'hidden_dims': '[128, 64]', 'dropout': 0.3607585513956517, 'batch_norm': True, 'lr': 0.00031764125272808354, 'weight_decay': 8.493495623584855e-06, 'epochs': 247, 'loss': 'mae', 'optimizer': 'adam', 'graph_mode': 'off', 'use_snp_selection': False}. Best is trial 31 with value: 0.11713727821537256.
[I 2025-12-05 16:33:50,255] Trial 35 finished with value: 0.08666331928935843 and parameters: {'model_type': 'mlp', 'hidden_dims': '[256, 128]', 'dropout': 0.1361153828064532, 'batch_norm': False, 'lr': 0.00019760820852834143, 'weight_decay': 0.0005226528064408065, 'epochs': 158, 'loss': 'mae', 'optimizer': 'adam', 'graph_mode': 'off', 'use_snp_selection': False}. Best is trial 31 with value: 0.11713727821537256.
[I 2025-12-05 16:33:53,231] Trial 36 finished with value: 0.0323492069675885 and parameters: {'model_type': 'mlp', 'hidden_dims': '[512, 64]', 'dropout': 0.4259061228636643, 'batch_norm': True, 'lr': 7.296152431196514e-06, 'weight_decay': 1.2099685896795082e-05, 'epochs': 227, 'loss': 'mse', 'optimizer': 'adam', 'graph_mode': 'off', 'use_snp_selection': True, 'num_snps': 58661}. Best is trial 31 with value: 0.11713727821537256.
[I 2025-12-05 16:33:54,212] Trial 37 finished with value: 0.10370560417294084 and parameters: {'model_type': 'mlp', 'hidden_dims': '[256, 128, 64]', 'dropout': 0.18272302977330002, 'batch_norm': True, 'lr': 0.0009474794844561687, 'weight_decay': 0.00013772464878835706, 'epochs': 190, 'loss': 'mae', 'optimizer': 'adam', 'graph_mode': 'off', 'use_snp_selection': False}. Best is trial 31 with value: 0.11713727821537256.
[I 2025-12-05 16:33:55,522] Trial 38 finished with value: 0.07762779661625024 and parameters: {'model_type': 'mlp', 'hidden_dims': '[512, 128]', 'dropout': 0.10047830548099904, 'batch_norm': False, 'lr': 0.000476156055118924, 'weight_decay': 7.297621737194278e-05, 'epochs': 289, 'loss': 'mse', 'optimizer': 'adam', 'graph_mode': 'off', 'use_snp_selection': True, 'num_snps': 19911}. Best is trial 31 with value: 0.11713727821537256.
[I 2025-12-05 16:33:56,316] Trial 39 finished with value: 0.11023755557132886 and parameters: {'model_type': 'mlp', 'hidden_dims': '[256, 128]', 'dropout': 0.23759278958155125, 'batch_norm': True, 'lr': 0.00014058087896256724, 'weight_decay': 3.1454796673030104e-05, 'epochs': 135, 'loss': 'mae', 'optimizer': 'adam', 'graph_mode': 'off', 'use_snp_selection': False}. Best is trial 31 with value: 0.11713727821537256.
[I 2025-12-05 16:33:57,800] Trial 40 finished with value: 0.11949162597362419 and parameters: {'model_type': 'mlp', 'hidden_dims': '[512, 64]', 'dropout': 0.385171058359009, 'batch_norm': True, 'lr': 0.0006307427045774259, 'weight_decay': 0.00021604509022260876, 'epochs': 256, 'loss': 'mse', 'optimizer': 'adam', 'graph_mode': 'off', 'use_snp_selection': False}. Best is trial 40 with value: 0.11949162597362419.
[I 2025-12-05 16:33:59,273] Trial 41 finished with value: -0.009197212217570819 and parameters: {'model_type': 'mlp', 'hidden_dims': '[512, 64]', 'dropout': 0.4625642912682247, 'batch_norm': True, 'lr': 2.320370617557869e-06, 'weight_decay': 0.0004214969880116298, 'epochs': 253, 'loss': 'mse', 'optimizer': 'adam', 'graph_mode': 'off', 'use_snp_selection': False}. Best is trial 40 with value: 0.11949162597362419.
[I 2025-12-05 16:34:00,837] Trial 42 finished with value: 0.12022726255272126 and parameters: {'model_type': 'mlp', 'hidden_dims': '[512, 64]', 'dropout': 0.3996414961699289, 'batch_norm': True, 'lr': 0.0004892443443934778, 'weight_decay': 0.00019145972025973694, 'epochs': 282, 'loss': 'mse', 'optimizer': 'adam', 'graph_mode': 'off', 'use_snp_selection': False}. Best is trial 42 with value: 0.12022726255272126.
[I 2025-12-05 16:34:02,393] Trial 43 finished with value: 0.11844815738732957 and parameters: {'model_type': 'mlp', 'hidden_dims': '[512, 64]', 'dropout': 0.3968936205016845, 'batch_norm': True, 'lr': 0.0006004587797499283, 'weight_decay': 0.0001684934038550522, 'epochs': 279, 'loss': 'mse', 'optimizer': 'adam', 'graph_mode': 'off', 'use_snp_selection': False}. Best is trial 42 with value: 0.12022726255272126.
[I 2025-12-05 16:34:03,966] Trial 44 finished with value: 0.11346579263459161 and parameters: {'model_type': 'mlp', 'hidden_dims': '[512, 64]', 'dropout': 0.39201679845664855, 'batch_norm': True, 'lr': 0.0005905434110176769, 'weight_decay': 0.00018404371118453696, 'epochs': 277, 'loss': 'mse', 'optimizer': 'adam', 'graph_mode': 'off', 'use_snp_selection': False}. Best is trial 42 with value: 0.12022726255272126.
[I 2025-12-05 16:34:05,650] Trial 45 finished with value: 0.1077692924789278 and parameters: {'model_type': 'mlp', 'hidden_dims': '[512, 64]', 'dropout': 0.4040741554249228, 'batch_norm': True, 'lr': 0.00040559413392303543, 'weight_decay': 0.00021549465708325317, 'epochs': 319, 'loss': 'mse', 'optimizer': 'adam', 'graph_mode': 'off', 'use_snp_selection': False}. Best is trial 42 with value: 0.12022726255272126.
[I 2025-12-05 16:34:07,205] Trial 46 finished with value: 0.059673481115008316 and parameters: {'model_type': 'mlp', 'hidden_dims': '[512, 64]', 'dropout': 0.44669005999920997, 'batch_norm': False, 'lr': 0.0002645727337172143, 'weight_decay': 0.0006475671285458384, 'epochs': 285, 'loss': 'mse', 'optimizer': 'adam', 'graph_mode': 'off', 'use_snp_selection': False}. Best is trial 42 with value: 0.12022726255272126.
[I 2025-12-05 16:34:08,930] Trial 47 finished with value: 0.11094480373450971 and parameters: {'model_type': 'mlp', 'hidden_dims': '[512, 64]', 'dropout': 0.4133050569015876, 'batch_norm': True, 'lr': 0.000551929174988673, 'weight_decay': 0.0002786660823186702, 'epochs': 331, 'loss': 'mse', 'optimizer': 'adam', 'graph_mode': 'off', 'use_snp_selection': False}. Best is trial 42 with value: 0.12022726255272126.
[I 2025-12-05 16:34:10,440] Trial 48 finished with value: 0.1139681813861459 and parameters: {'model_type': 'mlp', 'hidden_dims': '[512, 64]', 'dropout': 0.3708193236397618, 'batch_norm': True, 'lr': 0.00036321948526928756, 'weight_decay': 0.0003508299788064541, 'epochs': 264, 'loss': 'mse', 'optimizer': 'adam', 'graph_mode': 'off', 'use_snp_selection': False}. Best is trial 42 with value: 0.12022726255272126.
[I 2025-12-05 16:34:13,030] Trial 49 finished with value: 0.12799070346506838 and parameters: {'model_type': 'mlp', 'hidden_dims': '[512, 64]', 'dropout': 0.37552058304187724, 'batch_norm': True, 'lr': 0.0007140254888586703, 'weight_decay': 6.686522825737146e-05, 'epochs': 303, 'loss': 'mse', 'optimizer': 'adam', 'graph_mode': 'off', 'use_snp_selection': True, 'num_snps': 46888}. Best is trial 49 with value: 0.12799070346506838.
[I 2025-12-05 16:34:15,678] Trial 50 finished with value: 0.10490440676275942 and parameters: {'model_type': 'mlp', 'hidden_dims': '[512, 64]', 'dropout': 0.3375083785195682, 'batch_norm': True, 'lr': 0.0007688629975931453, 'weight_decay': 0.00016576189255620508, 'epochs': 301, 'loss': 'mse', 'optimizer': 'adam', 'graph_mode': 'off', 'use_snp_selection': True, 'num_snps': 46345}. Best is trial 49 with value: 0.12799070346506838.
[I 2025-12-05 16:34:18,449] Trial 51 finished with value: 0.10855084263312943 and parameters: {'model_type': 'mlp', 'hidden_dims': '[512, 64]', 'dropout': 0.37812878895861246, 'batch_norm': True, 'lr': 0.00047276495749549075, 'weight_decay': 8.84757318219441e-05, 'epochs': 350, 'loss': 'mse', 'optimizer': 'adam', 'graph_mode': 'off', 'use_snp_selection': True, 'num_snps': 47105}. Best is trial 49 with value: 0.12799070346506838.
[I 2025-12-05 16:34:19,953] Trial 52 finished with value: 0.10154865616699113 and parameters: {'model_type': 'mlp', 'hidden_dims': '[512, 64]', 'dropout': 0.47585116119851867, 'batch_norm': True, 'lr': 0.0009573935338644355, 'weight_decay': 5.241471452260838e-05, 'epochs': 279, 'loss': 'mse', 'optimizer': 'adam', 'graph_mode': 'off', 'use_snp_selection': True, 'num_snps': 22057}. Best is trial 49 with value: 0.12799070346506838.
[I 2025-12-05 16:34:22,091] Trial 53 finished with value: 0.10922169694830618 and parameters: {'model_type': 'mlp', 'hidden_dims': '[512, 64]', 'dropout': 0.43869711931478217, 'batch_norm': True, 'lr': 0.0006656137731925067, 'weight_decay': 7.353321026702973e-05, 'epochs': 308, 'loss': 'mse', 'optimizer': 'adam', 'graph_mode': 'off', 'use_snp_selection': True, 'num_snps': 37397}. Best is trial 49 with value: 0.12799070346506838.
[I 2025-12-05 16:34:24,209] Trial 54 finished with value: 0.11194772563490155 and parameters: {'model_type': 'mlp', 'hidden_dims': '[512, 256]', 'dropout': 0.5064408184251691, 'batch_norm': True, 'lr': 0.00025290306649824513, 'weight_decay': 0.00023418631242908924, 'epochs': 42, 'loss': 'mse', 'optimizer': 'adam', 'graph_mode': 'off', 'use_snp_selection': True, 'num_snps': 51553}. Best is trial 49 with value: 0.12799070346506838.
[I 2025-12-05 16:34:25,875] Trial 55 finished with value: 0.10959824644471867 and parameters: {'model_type': 'mlp', 'hidden_dims': '[512, 64]', 'dropout': 0.3079141043870848, 'batch_norm': True, 'lr': 0.00040275852978371735, 'weight_decay': 0.00012687851127652364, 'epochs': 298, 'loss': 'mse', 'optimizer': 'adam', 'graph_mode': 'off', 'use_snp_selection': False}. Best is trial 49 with value: 0.12799070346506838.
[I 2025-12-05 16:34:27,418] Trial 56 finished with value: 0.11448080160515348 and parameters: {'model_type': 'mlp', 'hidden_dims': '[512, 128]', 'dropout': 0.34565883153242727, 'batch_norm': True, 'lr': 0.0005505629073549096, 'weight_decay': 4.1281940956185494e-05, 'epochs': 268, 'loss': 'mse', 'optimizer': 'adam', 'graph_mode': 'off', 'use_snp_selection': False}. Best is trial 49 with value: 0.12799070346506838.
[I 2025-12-05 16:34:29,171] Trial 57 finished with value: 0.11677142342698886 and parameters: {'model_type': 'mlp', 'hidden_dims': '[512, 64]', 'dropout': 0.4047059860673202, 'batch_norm': True, 'lr': 0.0007717112498183581, 'weight_decay': 2.2783780550460318e-05, 'epochs': 338, 'loss': 'mse', 'optimizer': 'adam', 'graph_mode': 'off', 'use_snp_selection': False}. Best is trial 49 with value: 0.12799070346506838.
[I 2025-12-05 16:34:30,871] Trial 58 finished with value: 0.04787477938748834 and parameters: {'model_type': 'mlp', 'hidden_dims': '[512, 64]', 'dropout': 0.41279356016770063, 'batch_norm': False, 'lr': 0.0008350124077651047, 'weight_decay': 0.0001465058147842553, 'epochs': 339, 'loss': 'mse', 'optimizer': 'adam', 'graph_mode': 'off', 'use_snp_selection': True, 'num_snps': 26798}. Best is trial 49 with value: 0.12799070346506838.
[I 2025-12-05 16:34:32,581] Trial 59 finished with value: 0.1171783068633513 and parameters: {'model_type': 'mlp', 'hidden_dims': '[512, 64]', 'dropout': 0.39269727970699386, 'batch_norm': True, 'lr': 0.0009966255452201526, 'weight_decay': 2.5061118643345026e-05, 'epochs': 325, 'loss': 'mse', 'optimizer': 'adam', 'graph_mode': 'off', 'use_snp_selection': False}. Best is trial 49 with value: 0.12799070346506838.
[I 2025-12-05 16:34:34,309] Trial 60 finished with value: 0.11303464954875915 and parameters: {'model_type': 'mlp', 'hidden_dims': '[512, 64]', 'dropout': 0.3828782818069677, 'batch_norm': True, 'lr': 0.0009663185305464039, 'weight_decay': 0.0003790038054292727, 'epochs': 327, 'loss': 'mse', 'optimizer': 'adam', 'graph_mode': 'off', 'use_snp_selection': False}. Best is trial 49 with value: 0.12799070346506838.
[I 2025-12-05 16:34:35,912] Trial 61 finished with value: 0.10702915407467074 and parameters: {'model_type': 'mlp', 'hidden_dims': '[512, 64]', 'dropout': 0.4261191807072417, 'batch_norm': True, 'lr': 0.000717982021757324, 'weight_decay': 2.793821144212667e-05, 'epochs': 291, 'loss': 'mse', 'optimizer': 'adam', 'graph_mode': 'off', 'use_snp_selection': False}. Best is trial 49 with value: 0.12799070346506838.
[I 2025-12-05 16:34:37,688] Trial 62 finished with value: 0.11342011445383414 and parameters: {'model_type': 'mlp', 'hidden_dims': '[512, 64]', 'dropout': 0.3984836651979467, 'batch_norm': True, 'lr': 0.0005390511488403039, 'weight_decay': 2.4577538422435558e-05, 'epochs': 345, 'loss': 'mse', 'optimizer': 'adam', 'graph_mode': 'off', 'use_snp_selection': False}. Best is trial 49 with value: 0.12799070346506838.
[I 2025-12-05 16:34:39,379] Trial 63 finished with value: 0.11344843097913311 and parameters: {'model_type': 'mlp', 'hidden_dims': '[512, 64]', 'dropout': 0.37269793687940567, 'batch_norm': True, 'lr': 0.0003122109494826367, 'weight_decay': 9.95046327371322e-05, 'epochs': 319, 'loss': 'mse', 'optimizer': 'adam', 'graph_mode': 'off', 'use_snp_selection': False}. Best is trial 49 with value: 0.12799070346506838.
[I 2025-12-05 16:34:41,068] Trial 64 finished with value: 0.1143988841367159 and parameters: {'model_type': 'mlp', 'hidden_dims': '[512, 64]', 'dropout': 0.3584786028113525, 'batch_norm': True, 'lr': 0.0007847949711472296, 'weight_decay': 6.267287405421041e-05, 'epochs': 310, 'loss': 'mse', 'optimizer': 'adam', 'graph_mode': 'off', 'use_snp_selection': False}. Best is trial 49 with value: 0.12799070346506838.
[I 2025-12-05 16:34:42,575] Trial 65 finished with value: 0.11574746929950026 and parameters: {'model_type': 'mlp', 'hidden_dims': '[512, 64]', 'dropout': 0.4589919553438425, 'batch_norm': True, 'lr': 0.000441828966892849, 'weight_decay': 1.685544490495253e-05, 'epochs': 260, 'loss': 'mse', 'optimizer': 'adam', 'graph_mode': 'off', 'use_snp_selection': False}. Best is trial 49 with value: 0.12799070346506838.
[I 2025-12-05 16:34:43,729] Trial 66 finished with value: 0.08934940266978067 and parameters: {'model_type': 'mlp', 'hidden_dims': '[256, 128, 64]', 'dropout': 0.42341378043044353, 'batch_norm': True, 'lr': 1.9286431586928316e-05, 'weight_decay': 0.0002937487183791086, 'epochs': 324, 'loss': 'mse', 'optimizer': 'adam', 'graph_mode': 'off', 'use_snp_selection': False}. Best is trial 49 with value: 0.12799070346506838.
[I 2025-12-05 16:34:45,290] Trial 67 finished with value: 0.11712884718919965 and parameters: {'model_type': 'mlp', 'hidden_dims': '[512, 256]', 'dropout': 0.3896746971360948, 'batch_norm': True, 'lr': 0.000667458663338779, 'weight_decay': 3.9759487127419324e-05, 'epochs': 277, 'loss': 'mse', 'optimizer': 'adam', 'graph_mode': 'off', 'use_snp_selection': False}. Best is trial 49 with value: 0.12799070346506838.
[I 2025-12-05 16:34:46,738] Trial 68 finished with value: 0.11288633281314918 and parameters: {'model_type': 'mlp', 'hidden_dims': '[512, 256]', 'dropout': 0.333035962221165, 'batch_norm': True, 'lr': 0.0005849354812986621, 'weight_decay': 1.1129952330395544e-07, 'epochs': 241, 'loss': 'mse', 'optimizer': 'adam', 'graph_mode': 'off', 'use_snp_selection': False}. Best is trial 49 with value: 0.12799070346506838.
[I 2025-12-05 16:34:48,108] Trial 69 finished with value: 0.1130223228226079 and parameters: {'model_type': 'mlp', 'hidden_dims': '[512, 256]', 'dropout': 0.3170854317184413, 'batch_norm': True, 'lr': 0.000366305882139086, 'weight_decay': 4.0936219426861205e-05, 'epochs': 214, 'loss': 'mse', 'optimizer': 'adam', 'graph_mode': 'off', 'use_snp_selection': False}. Best is trial 49 with value: 0.12799070346506838.
[I 2025-12-05 16:34:50,285] Trial 70 finished with value: 0.07125089728037584 and parameters: {'model_type': 'mlp', 'hidden_dims': '[512, 256]', 'dropout': 0.38360452335310885, 'batch_norm': False, 'lr': 0.0009826374647487952, 'weight_decay': 9.656328310232464e-05, 'epochs': 273, 'loss': 'mse', 'optimizer': 'adam', 'graph_mode': 'off', 'use_snp_selection': True, 'num_snps': 39966}. Best is trial 49 with value: 0.12799070346506838.
[I 2025-12-05 16:34:52,039] Trial 71 finished with value: 0.11933380356612792 and parameters: {'model_type': 'mlp', 'hidden_dims': '[512, 64]', 'dropout': 0.40439253305516626, 'batch_norm': True, 'lr': 0.0007237526033782323, 'weight_decay': 2.1471156430132e-05, 'epochs': 338, 'loss': 'mse', 'optimizer': 'adam', 'graph_mode': 'off', 'use_snp_selection': False}. Best is trial 49 with value: 0.12799070346506838.
