[I 2025-12-05 15:48:46,581] Trial 84 finished with value: 0.032369507706533546 and parameters: {'model_type': 'mlp', 'hidden_dims': '[512, 64]', 'dropout': 0.45558539419159405, 'batch_norm': True, 'lr': 0.0005807219301442597, 'weight_decay': 2.807417505577833e-06, 'epochs': 66, 'loss': 'mae', 'optimizer': 'adam', 'graph_mode': 'off', 'use_snp_selection': True, 'num_snps': 8936}. Best is trial 60 with value: 0.06781677087822072.
[I 2025-12-05 15:48:47,329] Trial 85 finished with value: 0.03856234555288323 and parameters: {'model_type': 'mlp', 'hidden_dims': '[512, 256]', 'dropout': 0.34825103755205106, 'batch_norm': True, 'lr': 0.0002961916237526835, 'weight_decay': 9.347318093751781e-07, 'epochs': 77, 'loss': 'mae', 'optimizer': 'adam', 'graph_mode': 'off', 'use_snp_selection': True, 'num_snps': 5825}. Best is trial 60 with value: 0.06781677087822072.
[I 2025-12-05 15:48:48,286] Trial 86 finished with value: 0.05984416771564823 and parameters: {'model_type': 'mlp', 'hidden_dims': '[512, 64]', 'dropout': 0.3708925237142766, 'batch_norm': True, 'lr': 0.00048237551912370534, 'weight_decay': 4.465250766207157e-07, 'epochs': 104, 'loss': 'mae', 'optimizer': 'adam', 'graph_mode': 'off', 'use_snp_selection': True, 'num_snps': 11070}. Best is trial 60 with value: 0.06781677087822072.
[I 2025-12-05 15:48:49,048] Trial 87 finished with value: 0.05877808637748864 and parameters: {'model_type': 'mlp', 'hidden_dims': '[512, 64]', 'dropout': 0.3302844349418276, 'batch_norm': True, 'lr': 0.0007663134728896154, 'weight_decay': 1.5728360086871273e-06, 'epochs': 126, 'loss': 'mae', 'optimizer': 'adam', 'graph_mode': 'off', 'use_snp_selection': True, 'num_snps': 3903}. Best is trial 60 with value: 0.06781677087822072.
[I 2025-12-05 15:48:49,798] Trial 88 finished with value: 0.02434120692438814 and parameters: {'model_type': 'mlp', 'hidden_dims': '[256, 128, 64]', 'dropout': 0.40034102011420103, 'batch_norm': True, 'lr': 0.00035254644236613387, 'weight_decay': 7.73787583768828e-06, 'epochs': 44, 'loss': 'mae', 'optimizer': 'adam', 'graph_mode': 'off', 'use_snp_selection': True, 'num_snps': 7558}. Best is trial 60 with value: 0.06781677087822072.
[I 2025-12-05 15:48:50,816] Trial 89 finished with value: 0.04301708031075567 and parameters: {'model_type': 'mlp', 'hidden_dims': '[512, 64]', 'dropout': 0.30965492462495686, 'batch_norm': True, 'lr': 0.0008130215418468144, 'weight_decay': 8.456481068375424e-07, 'epochs': 82, 'loss': 'mae', 'optimizer': 'adam', 'graph_mode': 'off', 'use_snp_selection': False}. Best is trial 60 with value: 0.06781677087822072.
[I 2025-12-05 15:48:51,456] Trial 90 finished with value: 0.05528995226643181 and parameters: {'model_type': 'mlp', 'hidden_dims': '[256, 128]', 'dropout': 0.3495426661895057, 'batch_norm': False, 'lr': 0.0006223627694900731, 'weight_decay': 5.503104531299514e-07, 'epochs': 40, 'loss': 'mae', 'optimizer': 'adam', 'graph_mode': 'off', 'use_snp_selection': True, 'num_snps': 4628}. Best is trial 60 with value: 0.06781677087822072.
[I 2025-12-05 15:48:53,151] Trial 91 finished with value: 0.03062307350051225 and parameters: {'model_type': 'mlp', 'hidden_dims': '[512, 64]', 'dropout': 0.28899371233381416, 'batch_norm': True, 'lr': 0.00022658945544208188, 'weight_decay': 0.0006945811566318784, 'epochs': 58, 'loss': 'mae', 'optimizer': 'adam', 'graph_mode': 'off', 'use_snp_selection': True, 'num_snps': 36634}. Best is trial 60 with value: 0.06781677087822072.
[I 2025-12-05 15:48:54,010] Trial 92 finished with value: 0.025119082084562105 and parameters: {'model_type': 'mlp', 'hidden_dims': '[512, 64]', 'dropout': 0.27469243760844886, 'batch_norm': True, 'lr': 0.00027293843015050806, 'weight_decay': 5.5278838859858506e-06, 'epochs': 70, 'loss': 'mae', 'optimizer': 'adam', 'graph_mode': 'off', 'use_snp_selection': True, 'num_snps': 10184}. Best is trial 60 with value: 0.06781677087822072.
[I 2025-12-05 15:48:55,275] Trial 93 finished with value: 0.04863711592847146 and parameters: {'model_type': 'mlp', 'hidden_dims': '[512, 64]', 'dropout': 0.38151759789783624, 'batch_norm': True, 'lr': 0.00048195341125073477, 'weight_decay': 1.0938686516777841e-05, 'epochs': 285, 'loss': 'mae', 'optimizer': 'adam', 'graph_mode': 'off', 'use_snp_selection': True, 'num_snps': 13873}. Best is trial 60 with value: 0.06781677087822072.
[I 2025-12-05 15:48:56,073] Trial 94 finished with value: 0.04561883601466289 and parameters: {'model_type': 'mlp', 'hidden_dims': '[512, 64]', 'dropout': 0.30856176053116297, 'batch_norm': True, 'lr': 0.0003107242606050774, 'weight_decay': 0.00041116839286161954, 'epochs': 93, 'loss': 'mae', 'optimizer': 'adam', 'graph_mode': 'off', 'use_snp_selection': True, 'num_snps': 6564}. Best is trial 60 with value: 0.06781677087822072.
[I 2025-12-05 15:48:56,695] Trial 95 finished with value: 0.0320187550067952 and parameters: {'model_type': 'mlp', 'hidden_dims': '[512, 64]', 'dropout': 0.2334842103458658, 'batch_norm': True, 'lr': 0.00019504002973203764, 'weight_decay': 2.162397657392205e-07, 'epochs': 58, 'loss': 'mse', 'optimizer': 'adam', 'graph_mode': 'off', 'use_snp_selection': True, 'num_snps': 2476}. Best is trial 60 with value: 0.06781677087822072.
[I 2025-12-05 15:48:58,466] Trial 96 finished with value: 0.05177461208768911 and parameters: {'model_type': 'mlp', 'hidden_dims': '[512, 256]', 'dropout': 0.2550561342214331, 'batch_norm': True, 'lr': 0.00038843577929059935, 'weight_decay': 1.9857086014369638e-05, 'epochs': 120, 'loss': 'mse', 'optimizer': 'adam', 'graph_mode': 'off', 'use_snp_selection': True, 'num_snps': 34063}. Best is trial 60 with value: 0.06781677087822072.
[I 2025-12-05 15:49:00,360] Trial 97 finished with value: 0.04321006034760416 and parameters: {'model_type': 'mlp', 'hidden_dims': '[512, 64]', 'dropout': 0.1796435106664783, 'batch_norm': True, 'lr': 0.0006021527294204188, 'weight_decay': 3.9545084553125984e-05, 'epochs': 329, 'loss': 'mse', 'optimizer': 'adam', 'graph_mode': 'off', 'use_snp_selection': True, 'num_snps': 30017}. Best is trial 60 with value: 0.06781677087822072.
[I 2025-12-05 15:49:01,030] Trial 98 finished with value: 0.04539823880898646 and parameters: {'model_type': 'mlp', 'hidden_dims': '[256, 128]', 'dropout': 0.3239198578204596, 'batch_norm': True, 'lr': 0.00042772019754335155, 'weight_decay': 3.2376575287295825e-06, 'epochs': 63, 'loss': 'mae', 'optimizer': 'adam', 'graph_mode': 'off', 'use_snp_selection': True, 'num_snps': 4465}. Best is trial 60 with value: 0.06781677087822072.
[I 2025-12-05 15:49:01,942] Trial 99 finished with value: 0.0033620886828603707 and parameters: {'model_type': 'mlp', 'hidden_dims': '[512, 64]', 'dropout': 0.36191546078503756, 'batch_norm': True, 'lr': 3.806683444452683e-06, 'weight_decay': 0.00022619689754277707, 'epochs': 74, 'loss': 'mse', 'optimizer': 'adam', 'graph_mode': 'off', 'use_snp_selection': True, 'num_snps': 12597}. Best is trial 60 with value: 0.06781677087822072.
[I 2025-12-05 15:49:02,858] Trial 100 finished with value: 0.0437341522843504 and parameters: {'model_type': 'mlp', 'hidden_dims': '[256, 128]', 'dropout': 0.2689424028608447, 'batch_norm': True, 'lr': 0.00034995486529938355, 'weight_decay': 0.00015172233406938752, 'epochs': 151, 'loss': 'mse', 'optimizer': 'adam', 'graph_mode': 'off', 'use_snp_selection': True, 'num_snps': 9511}. Best is trial 60 with value: 0.06781677087822072.
[I 2025-12-05 15:49:03,446] Trial 101 finished with value: -0.018008490609060613 and parameters: {'model_type': 'mlp', 'hidden_dims': '[128, 64]', 'dropout': 0.3138698851744586, 'batch_norm': True, 'lr': 4.936692695210259e-05, 'weight_decay': 7.0151440586596645e-06, 'epochs': 52, 'loss': 'mse', 'optimizer': 'adam', 'graph_mode': 'off', 'use_snp_selection': True, 'num_snps': 2027}. Best is trial 60 with value: 0.06781677087822072.
[I 2025-12-05 15:49:04,187] Trial 102 finished with value: 0.08464553310069903 and parameters: {'model_type': 'mlp', 'hidden_dims': '[128, 64]', 'dropout': 0.29421762996785394, 'batch_norm': True, 'lr': 0.00023942399398128574, 'weight_decay': 1.2924496702317521e-05, 'epochs': 87, 'loss': 'mse', 'optimizer': 'adam', 'graph_mode': 'off', 'use_snp_selection': True, 'num_snps': 5244}. Best is trial 102 with value: 0.08464553310069903.
[I 2025-12-05 15:49:04,942] Trial 103 finished with value: 0.036658544104880036 and parameters: {'model_type': 'mlp', 'hidden_dims': '[128, 64]', 'dropout': 0.29222833474487403, 'batch_norm': True, 'lr': 0.00025726827938780516, 'weight_decay': 2.7134318280913898e-05, 'epochs': 87, 'loss': 'mse', 'optimizer': 'adam', 'graph_mode': 'off', 'use_snp_selection': True, 'num_snps': 7027}. Best is trial 102 with value: 0.08464553310069903.
[I 2025-12-05 15:49:05,714] Trial 104 finished with value: 0.03638675653590662 and parameters: {'model_type': 'mlp', 'hidden_dims': '[256, 128, 64]', 'dropout': 0.244189382657301, 'batch_norm': True, 'lr': 0.00018947532318717126, 'weight_decay': 1.3301494499056813e-05, 'epochs': 103, 'loss': 'mse', 'optimizer': 'adam', 'graph_mode': 'off', 'use_snp_selection': True, 'num_snps': 5186}. Best is trial 102 with value: 0.08464553310069903.
[I 2025-12-05 15:49:06,955] Trial 105 finished with value: 0.048657962636691275 and parameters: {'model_type': 'mlp', 'hidden_dims': '[512, 64]', 'dropout': 0.3016175408010126, 'batch_norm': True, 'lr': 0.0005415892565203756, 'weight_decay': 1.7049081682794574e-05, 'epochs': 167, 'loss': 'mse', 'optimizer': 'adam', 'graph_mode': 'off', 'use_snp_selection': True, 'num_snps': 18861}. Best is trial 102 with value: 0.08464553310069903.
[I 2025-12-05 15:49:07,861] Trial 106 finished with value: 0.0798703276557283 and parameters: {'model_type': 'mlp', 'hidden_dims': '[128, 64]', 'dropout': 0.2862146547719122, 'batch_norm': True, 'lr': 0.00013357660946961328, 'weight_decay': 6.0426941108282396e-05, 'epochs': 297, 'loss': 'mse', 'optimizer': 'adam', 'graph_mode': 'off', 'use_snp_selection': False}. Best is trial 102 with value: 0.08464553310069903.
[I 2025-12-05 15:49:08,780] Trial 107 finished with value: 0.057558029237131464 and parameters: {'model_type': 'mlp', 'hidden_dims': '[128, 64]', 'dropout': 0.2839790698021216, 'batch_norm': True, 'lr': 0.0002328492649151595, 'weight_decay': 5.433883074705378e-05, 'epochs': 305, 'loss': 'mse', 'optimizer': 'adam', 'graph_mode': 'off', 'use_snp_selection': False}. Best is trial 102 with value: 0.08464553310069903.
[I 2025-12-05 15:49:09,645] Trial 108 finished with value: 0.027986391603051514 and parameters: {'model_type': 'mlp', 'hidden_dims': '[128, 64]', 'dropout': 0.33510576531740077, 'batch_norm': False, 'lr': 0.00012648515050853862, 'weight_decay': 6.066635533274863e-05, 'epochs': 320, 'loss': 'mse', 'optimizer': 'adam', 'graph_mode': 'off', 'use_snp_selection': False}. Best is trial 102 with value: 0.08464553310069903.
[I 2025-12-05 15:49:10,267] Trial 109 finished with value: 0.027078674968099244 and parameters: {'model_type': 'mlp', 'hidden_dims': '[128, 64]', 'dropout': 0.32674318346253545, 'batch_norm': True, 'lr': 0.0001575516822159388, 'weight_decay': 3.1773890148921054e-05, 'epochs': 79, 'loss': 'mae', 'optimizer': 'adam', 'graph_mode': 'off', 'use_snp_selection': False}. Best is trial 102 with value: 0.08464553310069903.
[I 2025-12-05 15:49:11,170] Trial 110 finished with value: 0.058117015005152886 and parameters: {'model_type': 'mlp', 'hidden_dims': '[128, 64]', 'dropout': 0.21013786849158167, 'batch_norm': True, 'lr': 0.0002935937838935603, 'weight_decay': 4.3002796132052514e-05, 'epochs': 294, 'loss': 'mse', 'optimizer': 'adam', 'graph_mode': 'off', 'use_snp_selection': False}. Best is trial 102 with value: 0.08464553310069903.
[I 2025-12-05 15:49:12,759] Trial 111 finished with value: 0.04600161768457806 and parameters: {'model_type': 'mlp', 'hidden_dims': '[512, 128]', 'dropout': 0.2724944812198872, 'batch_norm': True, 'lr': 9.157479047868853e-05, 'weight_decay': 8.905709067804657e-06, 'epochs': 263, 'loss': 'mse', 'optimizer': 'adam', 'graph_mode': 'off', 'use_snp_selection': False}. Best is trial 102 with value: 0.08464553310069903.
[I 2025-12-05 15:49:14,676] Trial 112 finished with value: 0.050423344711582926 and parameters: {'model_type': 'mlp', 'hidden_dims': '[128, 64]', 'dropout': 0.22233199728421243, 'batch_norm': True, 'lr': 0.0003806652084689302, 'weight_decay': 2.1916098489950074e-05, 'epochs': 278, 'loss': 'mse', 'optimizer': 'adam', 'graph_mode': 'off', 'use_snp_selection': True, 'num_snps': 39414}. Best is trial 102 with value: 0.08464553310069903.
[I 2025-12-05 15:49:15,689] Trial 113 finished with value: 0.05572704864553205 and parameters: {'model_type': 'mlp', 'hidden_dims': '[256, 128]', 'dropout': 0.236471535489213, 'batch_norm': True, 'lr': 3.557752076868438e-05, 'weight_decay': 7.572844736861007e-05, 'epochs': 208, 'loss': 'mse', 'optimizer': 'adam', 'graph_mode': 'off', 'use_snp_selection': True, 'num_snps': 8900}. Best is trial 102 with value: 0.08464553310069903.
[I 2025-12-05 15:49:17,201] Trial 114 finished with value: 0.03764828896006215 and parameters: {'model_type': 'mlp', 'hidden_dims': '[512, 64]', 'dropout': 0.2604077316999305, 'batch_norm': True, 'lr': 5.502670653773163e-05, 'weight_decay': 1.0582052013674024e-05, 'epochs': 300, 'loss': 'mse', 'optimizer': 'adam', 'graph_mode': 'off', 'use_snp_selection': True, 'num_snps': 21650}. Best is trial 102 with value: 0.08464553310069903.
[I 2025-12-05 15:49:18,182] Trial 115 finished with value: 0.05903751135341977 and parameters: {'model_type': 'mlp', 'hidden_dims': '[512, 64]', 'dropout': 0.29668036589457436, 'batch_norm': True, 'lr': 6.434348037771028e-05, 'weight_decay': 1.5499160619910202e-06, 'epochs': 290, 'loss': 'mse', 'optimizer': 'adam', 'graph_mode': 'off', 'use_snp_selection': True, 'num_snps': 3877}. Best is trial 102 with value: 0.08464553310069903.
[I 2025-12-05 15:49:19,561] Trial 116 finished with value: 0.0793525392901737 and parameters: {'model_type': 'mlp', 'hidden_dims': '[512, 128]', 'dropout': 0.2507481780349688, 'batch_norm': True, 'lr': 0.0001764753054774992, 'weight_decay': 0.0008032775800959281, 'epochs': 190, 'loss': 'mse', 'optimizer': 'adam', 'graph_mode': 'off', 'use_snp_selection': False}. Best is trial 102 with value: 0.08464553310069903.
[I 2025-12-05 15:49:20,943] Trial 117 finished with value: 0.07460563077189583 and parameters: {'model_type': 'mlp', 'hidden_dims': '[512, 128]', 'dropout': 0.255576769467556, 'batch_norm': True, 'lr': 0.00017821558263002524, 'weight_decay': 0.0008458041558580548, 'epochs': 194, 'loss': 'mse', 'optimizer': 'adam', 'graph_mode': 'off', 'use_snp_selection': False}. Best is trial 102 with value: 0.08464553310069903.
[I 2025-12-05 15:49:22,284] Trial 118 finished with value: 0.040736955859372474 and parameters: {'model_type': 'mlp', 'hidden_dims': '[512, 128]', 'dropout': 0.2534384055276802, 'batch_norm': False, 'lr': 0.0001767021083924071, 'weight_decay': 0.0008601178312038546, 'epochs': 192, 'loss': 'mae', 'optimizer': 'adam', 'graph_mode': 'off', 'use_snp_selection': False}. Best is trial 102 with value: 0.08464553310069903.
[I 2025-12-05 15:49:23,617] Trial 119 finished with value: 0.03464678901186133 and parameters: {'model_type': 'mlp', 'hidden_dims': '[512, 128]', 'dropout': 0.1950970916245063, 'batch_norm': True, 'lr': 0.00013017688312825647, 'weight_decay': 1.9878404905617666e-06, 'epochs': 186, 'loss': 'mse', 'optimizer': 'adam', 'graph_mode': 'off', 'use_snp_selection': False}. Best is trial 102 with value: 0.08464553310069903.
[I 2025-12-05 15:49:24,914] Trial 120 finished with value: 0.04414024975328727 and parameters: {'model_type': 'mlp', 'hidden_dims': '[512, 128]', 'dropout': 0.22763588861620077, 'batch_norm': True, 'lr': 0.00014828745981823905, 'weight_decay': 1.5263261084071303e-05, 'epochs': 178, 'loss': 'mse', 'optimizer': 'adam', 'graph_mode': 'off', 'use_snp_selection': False}. Best is trial 102 with value: 0.08464553310069903.
[I 2025-12-05 15:49:26,286] Trial 121 finished with value: 0.048961375933684784 and parameters: {'model_type': 'mlp', 'hidden_dims': '[512, 128]', 'dropout': 0.28358887250420495, 'batch_norm': True, 'lr': 0.0002041208673991251, 'weight_decay': 0.0005650288244900078, 'epochs': 197, 'loss': 'mse', 'optimizer': 'adam', 'graph_mode': 'off', 'use_snp_selection': False}. Best is trial 102 with value: 0.08464553310069903.
[I 2025-12-05 15:49:27,552] Trial 122 finished with value: 0.06774507595092034 and parameters: {'model_type': 'mlp', 'hidden_dims': '[512, 128]', 'dropout': 0.2409562947861513, 'batch_norm': True, 'lr': 0.0002570090070784744, 'weight_decay': 6.627101612316512e-06, 'epochs': 167, 'loss': 'mse', 'optimizer': 'adam', 'graph_mode': 'off', 'use_snp_selection': False}. Best is trial 102 with value: 0.08464553310069903.
[I 2025-12-05 15:49:28,824] Trial 123 finished with value: 0.05345461611561893 and parameters: {'model_type': 'mlp', 'hidden_dims': '[512, 128]', 'dropout': 0.2490073011486034, 'batch_norm': True, 'lr': 0.0002499989552563283, 'weight_decay': 5.125486780782978e-06, 'epochs': 169, 'loss': 'mse', 'optimizer': 'adam', 'graph_mode': 'off', 'use_snp_selection': False}. Best is trial 102 with value: 0.08464553310069903.
[I 2025-12-05 15:49:30,157] Trial 124 finished with value: 0.06804044194034094 and parameters: {'model_type': 'mlp', 'hidden_dims': '[512, 128]', 'dropout': 0.2337682684828274, 'batch_norm': True, 'lr': 0.00017687347923240926, 'weight_decay': 3.990998888551495e-06, 'epochs': 179, 'loss': 'mse', 'optimizer': 'adam', 'graph_mode': 'off', 'use_snp_selection': False}. Best is trial 102 with value: 0.08464553310069903.
[I 2025-12-05 15:49:31,442] Trial 125 finished with value: 0.043726911657914015 and parameters: {'model_type': 'mlp', 'hidden_dims': '[512, 128]', 'dropout': 0.23748120660424896, 'batch_norm': True, 'lr': 0.00017880764127251833, 'weight_decay': 7.594572002030774e-06, 'epochs': 174, 'loss': 'mse', 'optimizer': 'adam', 'graph_mode': 'off', 'use_snp_selection': False}. Best is trial 102 with value: 0.08464553310069903.
[I 2025-12-05 15:49:32,681] Trial 126 finished with value: 0.04889109582801126 and parameters: {'model_type': 'mlp', 'hidden_dims': '[512, 128]', 'dropout': 0.2638141614349575, 'batch_norm': True, 'lr': 0.00021479843332373807, 'weight_decay': 3.9584067893809e-06, 'epochs': 159, 'loss': 'mse', 'optimizer': 'adam', 'graph_mode': 'off', 'use_snp_selection': False}. Best is trial 102 with value: 0.08464553310069903.
[I 2025-12-05 15:49:33,985] Trial 127 finished with value: 0.07521700697289493 and parameters: {'model_type': 'mlp', 'hidden_dims': '[512, 128]', 'dropout': 0.22597880338745419, 'batch_norm': True, 'lr': 0.00032006952089382235, 'weight_decay': 6.562577000172106e-06, 'epochs': 180, 'loss': 'mse', 'optimizer': 'adam', 'graph_mode': 'off', 'use_snp_selection': False}. Best is trial 102 with value: 0.08464553310069903.
[I 2025-12-05 15:49:35,447] Trial 128 finished with value: 0.05206448227828707 and parameters: {'model_type': 'mlp', 'hidden_dims': '[512, 128]', 'dropout': 0.22077599840795611, 'batch_norm': True, 'lr': 0.00032663486968612435, 'weight_decay': 3.513901128328377e-06, 'epochs': 218, 'loss': 'mse', 'optimizer': 'adam', 'graph_mode': 'off', 'use_snp_selection': False}. Best is trial 102 with value: 0.08464553310069903.
[I 2025-12-05 15:49:36,800] Trial 129 finished with value: 0.06040014064459257 and parameters: {'model_type': 'mlp', 'hidden_dims': '[512, 128]', 'dropout': 0.24434650067332728, 'batch_norm': True, 'lr': 0.00016016176636771896, 'weight_decay': 2.391535237365512e-06, 'epochs': 184, 'loss': 'mse', 'optimizer': 'adam', 'graph_mode': 'off', 'use_snp_selection': False}. Best is trial 102 with value: 0.08464553310069903.
[I 2025-12-05 15:49:38,155] Trial 130 finished with value: 0.05509986767064289 and parameters: {'model_type': 'mlp', 'hidden_dims': '[512, 128]', 'dropout': 0.20272017328872471, 'batch_norm': True, 'lr': 0.00010222639318323878, 'weight_decay': 6.37979616252368e-06, 'epochs': 193, 'loss': 'mse', 'optimizer': 'adam', 'graph_mode': 'off', 'use_snp_selection': False}. Best is trial 102 with value: 0.08464553310069903.
[I 2025-12-05 15:49:39,325] Trial 131 finished with value: 0.05436728912341716 and parameters: {'model_type': 'mlp', 'hidden_dims': '[512, 128]', 'dropout': 0.5751817178258657, 'batch_norm': True, 'lr': 0.0002731761182570021, 'weight_decay': 9.379388531663474e-06, 'epochs': 138, 'loss': 'mse', 'optimizer': 'adam', 'graph_mode': 'off', 'use_snp_selection': False}. Best is trial 102 with value: 0.08464553310069903.
[I 2025-12-05 15:49:40,623] Trial 132 finished with value: 0.04730199994279624 and parameters: {'model_type': 'mlp', 'hidden_dims': '[512, 128]', 'dropout': 0.2302978380324386, 'batch_norm': True, 'lr': 0.0003920159826529192, 'weight_decay': 4.284939494140465e-06, 'epochs': 176, 'loss': 'mse', 'optimizer': 'adam', 'graph_mode': 'off', 'use_snp_selection': False}. Best is trial 102 with value: 0.08464553310069903.
[I 2025-12-05 15:49:42,005] Trial 133 finished with value: 0.05175352442079325 and parameters: {'model_type': 'mlp', 'hidden_dims': '[512, 128]', 'dropout': 0.2587133502597122, 'batch_norm': True, 'lr': 0.00030507477410799544, 'weight_decay': 0.0007308975496799755, 'epochs': 199, 'loss': 'mse', 'optimizer': 'adam', 'graph_mode': 'off', 'use_snp_selection': False}. Best is trial 102 with value: 0.08464553310069903.
[I 2025-12-05 15:49:43,277] Trial 134 finished with value: 0.04875483237549492 and parameters: {'model_type': 'mlp', 'hidden_dims': '[512, 256]', 'dropout': 0.1741024443100801, 'batch_norm': True, 'lr': 0.00022979042694427058, 'weight_decay': 1.1939105822832837e-05, 'epochs': 168, 'loss': 'mse', 'optimizer': 'adam', 'graph_mode': 'off', 'use_snp_selection': False}. Best is trial 102 with value: 0.08464553310069903.
