[I 2025-12-06 07:45:19,350] Trial 90 finished with value: 0.29849380068282594 and parameters: {'model_type': 'mlp', 'hidden_dims': '[512, 64]', 'dropout': 0.2650689594286771, 'batch_norm': False, 'lr': 2.5451921353982767e-05, 'weight_decay': 5.314338606587934e-07, 'epochs': 94, 'loss': 'mse', 'optimizer': 'adam', 'graph_mode': 'off', 'use_snp_selection': True, 'num_snps': 53710}. Best is trial 80 with value: 0.3014506697026106.
[I 2025-12-06 07:46:12,517] Trial 91 finished with value: 0.2957622259729468 and parameters: {'model_type': 'mlp', 'hidden_dims': '[512, 64]', 'dropout': 0.27786329338693977, 'batch_norm': False, 'lr': 2.3695873806555432e-05, 'weight_decay': 5.445651450289062e-07, 'epochs': 109, 'loss': 'mse', 'optimizer': 'adam', 'graph_mode': 'off', 'use_snp_selection': True, 'num_snps': 55073}. Best is trial 80 with value: 0.3014506697026106.
[I 2025-12-06 07:47:04,966] Trial 92 finished with value: 0.2958239328519433 and parameters: {'model_type': 'mlp', 'hidden_dims': '[512, 64]', 'dropout': 0.25515858785119255, 'batch_norm': False, 'lr': 2.7193047196367493e-05, 'weight_decay': 1.0661351675700536e-07, 'epochs': 95, 'loss': 'mse', 'optimizer': 'adam', 'graph_mode': 'off', 'use_snp_selection': True, 'num_snps': 57030}. Best is trial 80 with value: 0.3014506697026106.
[I 2025-12-06 07:47:49,610] Trial 93 finished with value: 0.0466151241170346 and parameters: {'model_type': 'mlp', 'hidden_dims': '[512, 64]', 'dropout': 0.28540375584772343, 'batch_norm': False, 'lr': 0.00043904432734350786, 'weight_decay': 2.5976981503161214e-07, 'epochs': 65, 'loss': 'mse', 'optimizer': 'adam', 'graph_mode': 'off', 'use_snp_selection': True, 'num_snps': 50892}. Best is trial 80 with value: 0.3014506697026106.
[I 2025-12-06 07:48:43,588] Trial 94 finished with value: 0.2921967880051374 and parameters: {'model_type': 'mlp', 'hidden_dims': '[512, 64]', 'dropout': 0.30011421009369427, 'batch_norm': False, 'lr': 3.792380945919055e-05, 'weight_decay': 6.855965369374537e-07, 'epochs': 122, 'loss': 'mse', 'optimizer': 'adam', 'graph_mode': 'off', 'use_snp_selection': True, 'num_snps': 53278}. Best is trial 80 with value: 0.3014506697026106.
[I 2025-12-06 07:49:23,411] Trial 95 finished with value: 0.28590534654586264 and parameters: {'model_type': 'mlp', 'hidden_dims': '[128, 64]', 'dropout': 0.23956128443170804, 'batch_norm': False, 'lr': 1.1562881284355383e-05, 'weight_decay': 4.0737000550628985e-07, 'epochs': 58, 'loss': 'mse', 'optimizer': 'adam', 'graph_mode': 'off', 'use_snp_selection': True, 'num_snps': 58347}. Best is trial 80 with value: 0.3014506697026106.
[I 2025-12-06 07:50:27,769] Trial 96 finished with value: 0.2860943727130693 and parameters: {'model_type': 'mlp', 'hidden_dims': '[512, 256]', 'dropout': 0.32661191757353836, 'batch_norm': False, 'lr': 1.8109956576634824e-05, 'weight_decay': 1.2166059800404768e-06, 'epochs': 183, 'loss': 'mse', 'optimizer': 'adam', 'graph_mode': 'off', 'use_snp_selection': True, 'num_snps': 54726}. Best is trial 80 with value: 0.3014506697026106.
[I 2025-12-06 07:51:17,731] Trial 97 finished with value: 0.284226261242703 and parameters: {'model_type': 'mlp', 'hidden_dims': '[512, 256]', 'dropout': 0.2893486539814594, 'batch_norm': False, 'lr': 1.3312884257521591e-05, 'weight_decay': 1.3948607174018611e-06, 'epochs': 80, 'loss': 'mae', 'optimizer': 'adam', 'graph_mode': 'off', 'use_snp_selection': True, 'num_snps': 56533}. Best is trial 80 with value: 0.3014506697026106.
[I 2025-12-06 07:52:08,590] Trial 98 finished with value: 0.30113109890142015 and parameters: {'model_type': 'mlp', 'hidden_dims': '[512, 256]', 'dropout': 0.16328751781855866, 'batch_norm': False, 'lr': 6.663249430142599e-06, 'weight_decay': 9.406218077331198e-07, 'epochs': 100, 'loss': 'mse', 'optimizer': 'adam', 'graph_mode': 'off', 'use_snp_selection': True, 'num_snps': 52652}. Best is trial 80 with value: 0.3014506697026106.
[I 2025-12-06 07:53:04,838] Trial 99 finished with value: 0.2760154427831892 and parameters: {'model_type': 'mlp', 'hidden_dims': '[512, 64]', 'dropout': 0.1694188852287115, 'batch_norm': True, 'lr': 7.236743156230115e-06, 'weight_decay': 5.284346129057606e-07, 'epochs': 136, 'loss': 'mse', 'optimizer': 'adam', 'graph_mode': 'off', 'use_snp_selection': True, 'num_snps': 53164}. Best is trial 80 with value: 0.3014506697026106.
[I 2025-12-06 07:53:47,875] Trial 100 finished with value: 0.29380316508640086 and parameters: {'model_type': 'mlp', 'hidden_dims': '[256, 128, 64]', 'dropout': 0.26450080616423544, 'batch_norm': False, 'lr': 9.93484901695369e-06, 'weight_decay': 9.571959016902575e-07, 'epochs': 98, 'loss': 'mse', 'optimizer': 'adam', 'graph_mode': 'off', 'use_snp_selection': True, 'num_snps': 52252}. Best is trial 80 with value: 0.3014506697026106.
[I 2025-12-06 07:54:33,182] Trial 101 finished with value: 0.2987736202824691 and parameters: {'model_type': 'mlp', 'hidden_dims': '[512, 256]', 'dropout': 0.18691545191785838, 'batch_norm': False, 'lr': 2.1247922797749213e-05, 'weight_decay': 7.165101274296961e-07, 'epochs': 73, 'loss': 'mse', 'optimizer': 'adam', 'graph_mode': 'off', 'use_snp_selection': True, 'num_snps': 49763}. Best is trial 80 with value: 0.3014506697026106.
[I 2025-12-06 07:55:23,618] Trial 102 finished with value: 0.2940657290429801 and parameters: {'model_type': 'mlp', 'hidden_dims': '[512, 256]', 'dropout': 0.1621602973665324, 'batch_norm': False, 'lr': 2.1202679485146817e-05, 'weight_decay': 8.281024026135947e-07, 'epochs': 92, 'loss': 'mse', 'optimizer': 'adam', 'graph_mode': 'off', 'use_snp_selection': True, 'num_snps': 54539}. Best is trial 80 with value: 0.3014506697026106.
[I 2025-12-06 07:56:13,056] Trial 103 finished with value: 0.29418047393324287 and parameters: {'model_type': 'mlp', 'hidden_dims': '[512, 256]', 'dropout': 0.18155593569330314, 'batch_norm': False, 'lr': 4.1703280278364215e-05, 'weight_decay': 3.3820979475375144e-07, 'epochs': 107, 'loss': 'mse', 'optimizer': 'adam', 'graph_mode': 'off', 'use_snp_selection': True, 'num_snps': 48946}. Best is trial 80 with value: 0.3014506697026106.
[I 2025-12-06 07:57:03,131] Trial 104 finished with value: 0.2994527602419286 and parameters: {'model_type': 'mlp', 'hidden_dims': '[512, 256]', 'dropout': 0.19223106982900193, 'batch_norm': False, 'lr': 2.794244022358467e-05, 'weight_decay': 6.927926815496183e-07, 'epochs': 84, 'loss': 'mse', 'optimizer': 'adam', 'graph_mode': 'off', 'use_snp_selection': True, 'num_snps': 56055}. Best is trial 80 with value: 0.3014506697026106.
[I 2025-12-06 07:57:52,300] Trial 105 finished with value: 0.29393061658112507 and parameters: {'model_type': 'mlp', 'hidden_dims': '[512, 256]', 'dropout': 0.10763084127693034, 'batch_norm': False, 'lr': 2.8833440363145742e-05, 'weight_decay': 6.742111106123715e-07, 'epochs': 71, 'loss': 'mse', 'optimizer': 'adam', 'graph_mode': 'off', 'use_snp_selection': True, 'num_snps': 58250}. Best is trial 80 with value: 0.3014506697026106.
[I 2025-12-06 07:58:42,741] Trial 106 finished with value: 0.2967124463754422 and parameters: {'model_type': 'mlp', 'hidden_dims': '[512, 256]', 'dropout': 0.19003591667931904, 'batch_norm': False, 'lr': 2.0263977895526395e-05, 'weight_decay': 1.75461730447389e-06, 'epochs': 83, 'loss': 'mse', 'optimizer': 'adam', 'graph_mode': 'off', 'use_snp_selection': True, 'num_snps': 56537}. Best is trial 80 with value: 0.3014506697026106.
[I 2025-12-06 07:58:59,288] Trial 107 finished with value: 0.29567544536771695 and parameters: {'model_type': 'mlp', 'hidden_dims': '[512, 256]', 'dropout': 0.14905454097500165, 'batch_norm': False, 'lr': 1.0953372375781054e-05, 'weight_decay': 9.365408425519153e-07, 'epochs': 65, 'loss': 'mse', 'optimizer': 'adam', 'graph_mode': 'off', 'use_snp_selection': False}. Best is trial 80 with value: 0.3014506697026106.
[I 2025-12-06 07:59:56,033] Trial 108 finished with value: 0.29226327202358754 and parameters: {'model_type': 'mlp', 'hidden_dims': '[512, 256]', 'dropout': 0.18074183334340635, 'batch_norm': False, 'lr': 1.526588457755144e-05, 'weight_decay': 6.993517596218697e-07, 'epochs': 148, 'loss': 'mse', 'optimizer': 'adam', 'graph_mode': 'off', 'use_snp_selection': True, 'num_snps': 50963}. Best is trial 80 with value: 0.3014506697026106.
[I 2025-12-06 08:00:23,865] Trial 109 finished with value: 0.2776358113787327 and parameters: {'model_type': 'mlp', 'hidden_dims': '[512, 256]', 'dropout': 0.12323979116753385, 'batch_norm': False, 'lr': 3.2544235473226e-05, 'weight_decay': 1.4215439697179392e-06, 'epochs': 115, 'loss': 'mse', 'optimizer': 'adam', 'graph_mode': 'off', 'use_snp_selection': True, 'num_snps': 11636}. Best is trial 80 with value: 0.3014506697026106.
[I 2025-12-06 08:01:18,975] Trial 110 finished with value: 0.3024680275887575 and parameters: {'model_type': 'mlp', 'hidden_dims': '[512, 256]', 'dropout': 0.19811528883005963, 'batch_norm': False, 'lr': 6.723068589489468e-06, 'weight_decay': 1.6322164268239854e-07, 'epochs': 101, 'loss': 'mse', 'optimizer': 'adam', 'graph_mode': 'off', 'use_snp_selection': True, 'num_snps': 59878}. Best is trial 110 with value: 0.3024680275887575.
[I 2025-12-06 08:02:11,898] Trial 111 finished with value: 0.29342813846327254 and parameters: {'model_type': 'mlp', 'hidden_dims': '[512, 256]', 'dropout': 0.2150264969240034, 'batch_norm': False, 'lr': 6.196746161487785e-06, 'weight_decay': 4.3862298766223416e-07, 'epochs': 88, 'loss': 'mse', 'optimizer': 'adam', 'graph_mode': 'off', 'use_snp_selection': True, 'num_snps': 59859}. Best is trial 110 with value: 0.3024680275887575.
[I 2025-12-06 08:03:05,122] Trial 112 finished with value: 0.2957792735132414 and parameters: {'model_type': 'mlp', 'hidden_dims': '[512, 256]', 'dropout': 0.19527911019639213, 'batch_norm': False, 'lr': 5.257076170504973e-06, 'weight_decay': 1.7222055655221503e-07, 'epochs': 103, 'loss': 'mse', 'optimizer': 'adam', 'graph_mode': 'off', 'use_snp_selection': True, 'num_snps': 56013}. Best is trial 110 with value: 0.3024680275887575.
[I 2025-12-06 08:03:54,727] Trial 113 finished with value: 0.2968893154002812 and parameters: {'model_type': 'mlp', 'hidden_dims': '[512, 256]', 'dropout': 0.22635059881556807, 'batch_norm': False, 'lr': 4.297330479686143e-06, 'weight_decay': 2.1389876666484445e-07, 'epochs': 74, 'loss': 'mse', 'optimizer': 'adam', 'graph_mode': 'off', 'use_snp_selection': True, 'num_snps': 57977}. Best is trial 110 with value: 0.3024680275887575.
[I 2025-12-06 08:04:39,880] Trial 114 finished with value: 0.27753245281389965 and parameters: {'model_type': 'mlp', 'hidden_dims': '[512, 256]', 'dropout': 0.2044382222221577, 'batch_norm': False, 'lr': 3.3641437080316742e-06, 'weight_decay': 1.2959152154089591e-07, 'epochs': 54, 'loss': 'mse', 'optimizer': 'adam', 'graph_mode': 'off', 'use_snp_selection': True, 'num_snps': 55182}. Best is trial 110 with value: 0.3024680275887575.
[I 2025-12-06 08:05:10,108] Trial 115 finished with value: 0.29451435013595784 and parameters: {'model_type': 'mlp', 'hidden_dims': '[512, 256]', 'dropout': 0.13149453723239773, 'batch_norm': False, 'lr': 8.785759054424973e-06, 'weight_decay': 3.096329150920468e-07, 'epochs': 84, 'loss': 'mse', 'optimizer': 'adam', 'graph_mode': 'off', 'use_snp_selection': True, 'num_snps': 18271}. Best is trial 110 with value: 0.3024680275887575.
[I 2025-12-06 08:05:57,483] Trial 116 finished with value: 0.2897808615373144 and parameters: {'model_type': 'mlp', 'hidden_dims': '[512, 256]', 'dropout': 0.1621004661167522, 'batch_norm': False, 'lr': 1.748407210418189e-05, 'weight_decay': 1.0550063389935144e-06, 'epochs': 100, 'loss': 'mae', 'optimizer': 'adam', 'graph_mode': 'off', 'use_snp_selection': True, 'num_snps': 46730}. Best is trial 110 with value: 0.3024680275887575.
[I 2025-12-06 08:06:55,462] Trial 117 finished with value: 0.29834757651659516 and parameters: {'model_type': 'mlp', 'hidden_dims': '[512, 256]', 'dropout': 0.3477967602567111, 'batch_norm': False, 'lr': 6.779181846909002e-06, 'weight_decay': 2.5142957934728714e-07, 'epochs': 125, 'loss': 'mse', 'optimizer': 'adam', 'graph_mode': 'off', 'use_snp_selection': True, 'num_snps': 58594}. Best is trial 110 with value: 0.3024680275887575.
[I 2025-12-06 08:07:41,044] Trial 118 finished with value: 0.27429883353836876 and parameters: {'model_type': 'mlp', 'hidden_dims': '[512, 256]', 'dropout': 0.18556442396482253, 'batch_norm': True, 'lr': 1.2882777972324504e-05, 'weight_decay': 2.0753755270573152e-06, 'epochs': 68, 'loss': 'mse', 'optimizer': 'adam', 'graph_mode': 'off', 'use_snp_selection': True, 'num_snps': 51803}. Best is trial 110 with value: 0.3024680275887575.
[I 2025-12-06 08:09:01,855] Trial 119 finished with value: 0.27915423629081487 and parameters: {'model_type': 'mlp', 'hidden_dims': '[512, 128]', 'dropout': 0.23627785945517804, 'batch_norm': False, 'lr': 2.243267242380889e-05, 'weight_decay': 8.153113431699691e-07, 'epochs': 277, 'loss': 'mse', 'optimizer': 'adam', 'graph_mode': 'off', 'use_snp_selection': True, 'num_snps': 57099}. Best is trial 110 with value: 0.3024680275887575.
[I 2025-12-06 08:09:40,319] Trial 120 finished with value: 0.2775827658424177 and parameters: {'model_type': 'mlp', 'hidden_dims': '[256, 128]', 'dropout': 0.1662677958557185, 'batch_norm': False, 'lr': 5.15407246424213e-05, 'weight_decay': 3.9377691209836905e-07, 'epochs': 47, 'loss': 'mse', 'optimizer': 'adam', 'graph_mode': 'off', 'use_snp_selection': True, 'num_snps': 50308}. Best is trial 110 with value: 0.3024680275887575.
[I 2025-12-06 08:10:30,688] Trial 121 finished with value: 0.2947967976869904 and parameters: {'model_type': 'mlp', 'hidden_dims': '[512, 256]', 'dropout': 0.17477585815662788, 'batch_norm': False, 'lr': 2.6223610227085283e-05, 'weight_decay': 5.56862506731603e-07, 'epochs': 93, 'loss': 'mse', 'optimizer': 'adam', 'graph_mode': 'off', 'use_snp_selection': True, 'num_snps': 53741}. Best is trial 110 with value: 0.3024680275887575.
[I 2025-12-06 08:11:18,129] Trial 122 finished with value: 0.2969316675112573 and parameters: {'model_type': 'mlp', 'hidden_dims': '[512, 256]', 'dropout': 0.21947600524467523, 'batch_norm': False, 'lr': 3.556369709548801e-05, 'weight_decay': 5.022984175957343e-07, 'epochs': 77, 'loss': 'mse', 'optimizer': 'adam', 'graph_mode': 'off', 'use_snp_selection': True, 'num_snps': 52846}. Best is trial 110 with value: 0.3024680275887575.
[I 2025-12-06 08:11:59,507] Trial 123 finished with value: 0.3000579919436507 and parameters: {'model_type': 'mlp', 'hidden_dims': '[128, 64]', 'dropout': 0.197865938671297, 'batch_norm': False, 'lr': 9.64062315585535e-06, 'weight_decay': 6.004370217344063e-07, 'epochs': 114, 'loss': 'mse', 'optimizer': 'adam', 'graph_mode': 'off', 'use_snp_selection': True, 'num_snps': 55925}. Best is trial 110 with value: 0.3024680275887575.
[I 2025-12-06 08:12:41,595] Trial 124 finished with value: 0.2956344683251937 and parameters: {'model_type': 'mlp', 'hidden_dims': '[128, 64]', 'dropout': 0.19158627305958864, 'batch_norm': False, 'lr': 9.539469189632236e-06, 'weight_decay': 6.868701116916351e-07, 'epochs': 110, 'loss': 'mse', 'optimizer': 'adam', 'graph_mode': 'off', 'use_snp_selection': True, 'num_snps': 58879}. Best is trial 110 with value: 0.3024680275887575.
[I 2025-12-06 08:13:23,101] Trial 125 finished with value: 0.2973321440853999 and parameters: {'model_type': 'mlp', 'hidden_dims': '[128, 64]', 'dropout': 0.19937609095643852, 'batch_norm': False, 'lr': 1.1136848770772134e-05, 'weight_decay': 1.2647650350579564e-06, 'epochs': 117, 'loss': 'mse', 'optimizer': 'adam', 'graph_mode': 'off', 'use_snp_selection': True, 'num_snps': 55704}. Best is trial 110 with value: 0.3024680275887575.
[I 2025-12-06 08:14:03,775] Trial 126 finished with value: 0.2969164905263675 and parameters: {'model_type': 'mlp', 'hidden_dims': '[128, 64]', 'dropout': 0.4296050416370296, 'batch_norm': False, 'lr': 1.4713301009897439e-05, 'weight_decay': 9.302872842710605e-07, 'epochs': 88, 'loss': 'mse', 'optimizer': 'adam', 'graph_mode': 'off', 'use_snp_selection': True, 'num_snps': 57220}. Best is trial 110 with value: 0.3024680275887575.
[I 2025-12-06 08:14:11,365] Trial 127 finished with value: 0.28486625725521647 and parameters: {'model_type': 'mlp', 'hidden_dims': '[128, 64]', 'dropout': 0.2094805189572553, 'batch_norm': False, 'lr': 7.685406588568005e-06, 'weight_decay': 1.5352042612264894e-06, 'epochs': 62, 'loss': 'mse', 'optimizer': 'adam', 'graph_mode': 'off', 'use_snp_selection': False}. Best is trial 110 with value: 0.3024680275887575.
[I 2025-12-06 08:15:12,635] Trial 128 finished with value: 0.3008591097459993 and parameters: {'model_type': 'mlp', 'hidden_dims': '[512, 256]', 'dropout': 0.4672939729225617, 'batch_norm': False, 'lr': 5.650916920665429e-06, 'weight_decay': 6.04850660141312e-07, 'epochs': 164, 'loss': 'mse', 'optimizer': 'adam', 'graph_mode': 'off', 'use_snp_selection': True, 'num_snps': 54574}. Best is trial 110 with value: 0.3024680275887575.
[I 2025-12-06 08:16:09,895] Trial 129 finished with value: 0.29700830207032436 and parameters: {'model_type': 'mlp', 'hidden_dims': '[512, 256]', 'dropout': 0.4562505175172687, 'batch_norm': False, 'lr': 4.5477490954361385e-06, 'weight_decay': 1.4409937306624507e-07, 'epochs': 137, 'loss': 'mse', 'optimizer': 'adam', 'graph_mode': 'off', 'use_snp_selection': True, 'num_snps': 54467}. Best is trial 110 with value: 0.3024680275887575.
[I 2025-12-06 08:16:31,972] Trial 130 finished with value: 0.19635057675711862 and parameters: {'model_type': 'mlp', 'hidden_dims': '[256, 128, 64]', 'dropout': 0.4716891395803907, 'batch_norm': False, 'lr': 5.386243628345202e-06, 'weight_decay': 3.377003897482864e-07, 'epochs': 155, 'loss': 'mse', 'optimizer': 'adam', 'graph_mode': 'off', 'use_snp_selection': True, 'num_snps': 2056}. Best is trial 110 with value: 0.3024680275887575.
[I 2025-12-06 08:17:20,276] Trial 131 finished with value: 0.30039757962803015 and parameters: {'model_type': 'mlp', 'hidden_dims': '[512, 256]', 'dropout': 0.4916629082988958, 'batch_norm': False, 'lr': 6.3054600762030275e-06, 'weight_decay': 6.394875508534319e-07, 'epochs': 102, 'loss': 'mse', 'optimizer': 'adam', 'graph_mode': 'off', 'use_snp_selection': True, 'num_snps': 48092}. Best is trial 110 with value: 0.3024680275887575.
[I 2025-12-06 08:18:08,935] Trial 132 finished with value: 0.3029190495520343 and parameters: {'model_type': 'mlp', 'hidden_dims': '[512, 256]', 'dropout': 0.49674257683120193, 'batch_norm': False, 'lr': 6.491319533473514e-06, 'weight_decay': 4.71834026198471e-07, 'epochs': 104, 'loss': 'mse', 'optimizer': 'adam', 'graph_mode': 'off', 'use_snp_selection': True, 'num_snps': 48043}. Best is trial 132 with value: 0.3029190495520343.
[I 2025-12-06 08:18:58,402] Trial 133 finished with value: 0.28488978020669536 and parameters: {'model_type': 'mlp', 'hidden_dims': '[512, 256]', 'dropout': 0.48912874826572117, 'batch_norm': False, 'lr': 3.6595663016635873e-06, 'weight_decay': 6.246283965928586e-07, 'epochs': 110, 'loss': 'mse', 'optimizer': 'adam', 'graph_mode': 'off', 'use_snp_selection': True, 'num_snps': 48021}. Best is trial 132 with value: 0.3029190495520343.
[I 2025-12-06 08:20:01,321] Trial 134 finished with value: 0.2968513543844805 and parameters: {'model_type': 'mlp', 'hidden_dims': '[512, 256]', 'dropout': 0.4504230516970482, 'batch_norm': False, 'lr': 5.894156399385366e-06, 'weight_decay': 4.4567332627594845e-07, 'epochs': 166, 'loss': 'mse', 'optimizer': 'adam', 'graph_mode': 'off', 'use_snp_selection': True, 'num_snps': 55993}. Best is trial 132 with value: 0.3029190495520343.
[I 2025-12-06 08:20:56,112] Trial 135 finished with value: 0.29780730535103606 and parameters: {'model_type': 'mlp', 'hidden_dims': '[512, 256]', 'dropout': 0.47091352462598335, 'batch_norm': False, 'lr': 6.35363262991345e-06, 'weight_decay': 1.054040585251122e-06, 'epochs': 102, 'loss': 'mse', 'optimizer': 'adam', 'graph_mode': 'off', 'use_snp_selection': True, 'num_snps': 59151}. Best is trial 132 with value: 0.3029190495520343.
[I 2025-12-06 08:21:45,462] Trial 136 finished with value: 0.2979113442745421 and parameters: {'model_type': 'mlp', 'hidden_dims': '[512, 256]', 'dropout': 0.5017373863811826, 'batch_norm': False, 'lr': 7.452512046005412e-06, 'weight_decay': 8.095298456772904e-07, 'epochs': 128, 'loss': 'mse', 'optimizer': 'adam', 'graph_mode': 'off', 'use_snp_selection': True, 'num_snps': 44209}. Best is trial 132 with value: 0.3029190495520343.
[I 2025-12-06 08:22:43,091] Trial 137 finished with value: 0.2866464575135391 and parameters: {'model_type': 'mlp', 'hidden_dims': '[512, 256]', 'dropout': 0.4395480121908192, 'batch_norm': False, 'lr': 9.805196637870253e-06, 'weight_decay': 2.2864845600145402e-07, 'epochs': 116, 'loss': 'mae', 'optimizer': 'adam', 'graph_mode': 'off', 'use_snp_selection': True, 'num_snps': 59867}. Best is trial 132 with value: 0.3029190495520343.
[I 2025-12-06 08:23:24,679] Trial 138 finished with value: 0.27654610062373414 and parameters: {'model_type': 'mlp', 'hidden_dims': '[128, 64]', 'dropout': 0.41328384960942666, 'batch_norm': False, 'lr': 4.935643285258393e-06, 'weight_decay': 6.134597435643551e-07, 'epochs': 98, 'loss': 'mse', 'optimizer': 'adam', 'graph_mode': 'off', 'use_snp_selection': True, 'num_snps': 57888}. Best is trial 132 with value: 0.3029190495520343.
[I 2025-12-06 08:23:48,383] Trial 139 finished with value: 0.2761891474645469 and parameters: {'model_type': 'mlp', 'hidden_dims': '[512, 256]', 'dropout': 0.4906239670536109, 'batch_norm': False, 'lr': 8.676637857404848e-06, 'weight_decay': 1.5140422059618372e-05, 'epochs': 106, 'loss': 'mse', 'optimizer': 'adam', 'graph_mode': 'off', 'use_snp_selection': True, 'num_snps': 5014}. Best is trial 132 with value: 0.3029190495520343.
