[I 2025-12-06 11:44:41,627] Trial 33 finished with value: 0.37055466980063245 and parameters: {'model_type': 'mlp', 'hidden_dims': '[256, 128, 64]', 'dropout': 0.417592334227588, 'batch_norm': False, 'lr': 3.8355997277374935e-06, 'weight_decay': 7.35848183343065e-05, 'epochs': 222, 'loss': 'mse', 'optimizer': 'adam', 'graph_mode': 'off', 'use_snp_selection': True, 'num_snps': 44289}. Best is trial 21 with value: 0.3771881954265961.
[I 2025-12-06 11:45:39,658] Trial 34 finished with value: 0.3749651687626142 and parameters: {'model_type': 'mlp', 'hidden_dims': '[512, 128]', 'dropout': 0.5659146615525761, 'batch_norm': False, 'lr': 4.359873992194011e-06, 'weight_decay': 0.0002007164914124834, 'epochs': 123, 'loss': 'mse', 'optimizer': 'adam', 'graph_mode': 'off', 'use_snp_selection': True, 'num_snps': 55151}. Best is trial 21 with value: 0.3771881954265961.
[I 2025-12-06 11:46:27,942] Trial 35 finished with value: 0.3443983791147534 and parameters: {'model_type': 'mlp', 'hidden_dims': '[512, 128]', 'dropout': 0.5998190012525704, 'batch_norm': True, 'lr': 5.281975982880031e-06, 'weight_decay': 0.0004171960677757623, 'epochs': 130, 'loss': 'mse', 'optimizer': 'adam', 'graph_mode': 'off', 'use_snp_selection': True, 'num_snps': 38703}. Best is trial 21 with value: 0.3771881954265961.
[I 2025-12-06 11:47:14,058] Trial 36 finished with value: 0.2464397662117122 and parameters: {'model_type': 'mlp', 'hidden_dims': '[512, 128]', 'dropout': 0.5681512588927742, 'batch_norm': False, 'lr': 1.005419280341699e-06, 'weight_decay': 3.0325390833174003e-05, 'epochs': 73, 'loss': 'mse', 'optimizer': 'adam', 'graph_mode': 'off', 'use_snp_selection': True, 'num_snps': 47391}. Best is trial 21 with value: 0.3771881954265961.
[I 2025-12-06 11:48:07,959] Trial 37 finished with value: 0.35757350612285943 and parameters: {'model_type': 'mlp', 'hidden_dims': '[512, 128]', 'dropout': 0.4314081794810973, 'batch_norm': False, 'lr': 1.7164669121090716e-06, 'weight_decay': 1.4089006700519878e-05, 'epochs': 105, 'loss': 'mse', 'optimizer': 'adam', 'graph_mode': 'off', 'use_snp_selection': True, 'num_snps': 52928}. Best is trial 21 with value: 0.3771881954265961.
[I 2025-12-06 11:48:45,766] Trial 38 finished with value: 0.3343624079857038 and parameters: {'model_type': 'mlp', 'hidden_dims': '[256, 128]', 'dropout': 0.5610831666704506, 'batch_norm': True, 'lr': 2.2666434242762953e-05, 'weight_decay': 0.0006131372193896689, 'epochs': 129, 'loss': 'mse', 'optimizer': 'adam', 'graph_mode': 'off', 'use_snp_selection': True, 'num_snps': 33492}. Best is trial 21 with value: 0.3771881954265961.
[I 2025-12-06 11:49:10,510] Trial 39 finished with value: 0.34776265974920983 and parameters: {'model_type': 'mlp', 'hidden_dims': '[512, 128]', 'dropout': 0.5273019276339408, 'batch_norm': False, 'lr': 1.0558480541596845e-05, 'weight_decay': 2.462171749617981e-07, 'epochs': 80, 'loss': 'mse', 'optimizer': 'adam', 'graph_mode': 'off', 'use_snp_selection': True, 'num_snps': 5787}. Best is trial 21 with value: 0.3771881954265961.
[I 2025-12-06 11:49:30,454] Trial 40 finished with value: 0.33662439699778784 and parameters: {'model_type': 'mlp', 'hidden_dims': '[256, 128, 64]', 'dropout': 0.2779533421886583, 'batch_norm': True, 'lr': 4.288780540521598e-06, 'weight_decay': 9.737848050713292e-06, 'epochs': 153, 'loss': 'mae', 'optimizer': 'adam', 'graph_mode': 'off', 'use_snp_selection': False}. Best is trial 21 with value: 0.3771881954265961.
[I 2025-12-06 11:50:17,213] Trial 41 finished with value: 0.36788808932613193 and parameters: {'model_type': 'mlp', 'hidden_dims': '[128, 64]', 'dropout': 0.39307893059204896, 'batch_norm': False, 'lr': 3.346516814492597e-06, 'weight_decay': 0.00022166887646382156, 'epochs': 195, 'loss': 'mse', 'optimizer': 'adam', 'graph_mode': 'off', 'use_snp_selection': True, 'num_snps': 56023}. Best is trial 21 with value: 0.3771881954265961.
[I 2025-12-06 11:51:26,462] Trial 42 finished with value: 0.3637676743200961 and parameters: {'model_type': 'mlp', 'hidden_dims': '[512, 256]', 'dropout': 0.5762715417769192, 'batch_norm': False, 'lr': 1.724956661752638e-06, 'weight_decay': 0.00024444605479972275, 'epochs': 191, 'loss': 'mse', 'optimizer': 'adam', 'graph_mode': 'off', 'use_snp_selection': True, 'num_snps': 55084}. Best is trial 21 with value: 0.3771881954265961.
[I 2025-12-06 11:52:50,862] Trial 43 finished with value: 0.34664419655590145 and parameters: {'model_type': 'mlp', 'hidden_dims': '[512, 128]', 'dropout': 0.5457874146914227, 'batch_norm': False, 'lr': 1.4928301354431545e-05, 'weight_decay': 0.00014149474899451405, 'epochs': 250, 'loss': 'mse', 'optimizer': 'adam', 'graph_mode': 'off', 'use_snp_selection': True, 'num_snps': 59921}. Best is trial 21 with value: 0.3771881954265961.
[I 2025-12-06 11:54:16,305] Trial 44 finished with value: 0.3449362041460159 and parameters: {'model_type': 'mlp', 'hidden_dims': '[512, 256]', 'dropout': 0.3184632250216348, 'batch_norm': False, 'lr': 6.854009721451022e-06, 'weight_decay': 0.0006508458515501226, 'epochs': 295, 'loss': 'mse', 'optimizer': 'adam', 'graph_mode': 'off', 'use_snp_selection': True, 'num_snps': 53317}. Best is trial 21 with value: 0.3771881954265961.
[I 2025-12-06 11:54:54,225] Trial 45 finished with value: 0.3639820346321172 and parameters: {'model_type': 'mlp', 'hidden_dims': '[256, 128]', 'dropout': 0.21982597037918242, 'batch_norm': False, 'lr': 8.63386764332819e-06, 'weight_decay': 6.883006098242198e-05, 'epochs': 54, 'loss': 'mse', 'optimizer': 'adam', 'graph_mode': 'off', 'use_snp_selection': True, 'num_snps': 44059}. Best is trial 21 with value: 0.3771881954265961.
[I 2025-12-06 11:55:31,720] Trial 46 finished with value: 0.32475068263765927 and parameters: {'model_type': 'mlp', 'hidden_dims': '[512, 256]', 'dropout': 0.5185537893126717, 'batch_norm': True, 'lr': 5.3140178768052525e-06, 'weight_decay': 0.00034738817961141386, 'epochs': 169, 'loss': 'mse', 'optimizer': 'adam', 'graph_mode': 'off', 'use_snp_selection': False}. Best is trial 21 with value: 0.3771881954265961.
[I 2025-12-06 11:56:03,259] Trial 47 finished with value: 0.3536864677069956 and parameters: {'model_type': 'mlp', 'hidden_dims': '[512, 128]', 'dropout': 0.3705412610296772, 'batch_norm': False, 'lr': 1.3827300958172493e-06, 'weight_decay': 3.323091649840282e-05, 'epochs': 138, 'loss': 'mae', 'optimizer': 'adam', 'graph_mode': 'off', 'use_snp_selection': False}. Best is trial 21 with value: 0.3771881954265961.
[I 2025-12-06 11:56:54,156] Trial 48 finished with value: 0.35826045616087243 and parameters: {'model_type': 'mlp', 'hidden_dims': '[512, 64]', 'dropout': 0.48016849198967454, 'batch_norm': False, 'lr': 2.1260845049206816e-06, 'weight_decay': 2.8522235303494337e-06, 'epochs': 116, 'loss': 'mse', 'optimizer': 'adam', 'graph_mode': 'off', 'use_snp_selection': True, 'num_snps': 45048}. Best is trial 21 with value: 0.3771881954265961.
[I 2025-12-06 11:57:08,452] Trial 49 finished with value: 0.3459765556272372 and parameters: {'model_type': 'mlp', 'hidden_dims': '[128, 64]', 'dropout': 0.5845516122789575, 'batch_norm': False, 'lr': 8.232336048469119e-05, 'weight_decay': 1.0617466822816891e-06, 'epochs': 185, 'loss': 'mse', 'optimizer': 'adam', 'graph_mode': 'off', 'use_snp_selection': False}. Best is trial 21 with value: 0.3771881954265961.
[I 2025-12-06 11:58:00,273] Trial 50 finished with value: 0.37484245584617293 and parameters: {'model_type': 'mlp', 'hidden_dims': '[512, 256]', 'dropout': 0.4475793723813206, 'batch_norm': False, 'lr': 1.4709526376092993e-05, 'weight_decay': 0.00018595846964709022, 'epochs': 97, 'loss': 'mae', 'optimizer': 'adam', 'graph_mode': 'off', 'use_snp_selection': True, 'num_snps': 51266}. Best is trial 21 with value: 0.3771881954265961.
[I 2025-12-06 11:58:49,850] Trial 51 finished with value: 0.3689285520289138 and parameters: {'model_type': 'mlp', 'hidden_dims': '[512, 256]', 'dropout': 0.44830170550571313, 'batch_norm': False, 'lr': 1.4990546479888728e-05, 'weight_decay': 0.00016113545073631334, 'epochs': 85, 'loss': 'mae', 'optimizer': 'adam', 'graph_mode': 'off', 'use_snp_selection': True, 'num_snps': 50492}. Best is trial 21 with value: 0.3771881954265961.
[I 2025-12-06 11:59:38,223] Trial 52 finished with value: 0.35845304041314563 and parameters: {'model_type': 'mlp', 'hidden_dims': '[512, 256]', 'dropout': 0.41663435280425154, 'batch_norm': False, 'lr': 4.035061606931615e-05, 'weight_decay': 8.97413372450105e-05, 'epochs': 61, 'loss': 'mae', 'optimizer': 'adam', 'graph_mode': 'off', 'use_snp_selection': True, 'num_snps': 56023}. Best is trial 21 with value: 0.3771881954265961.
[I 2025-12-06 12:00:27,342] Trial 53 finished with value: 0.37239698655681364 and parameters: {'model_type': 'mlp', 'hidden_dims': '[512, 256]', 'dropout': 0.5497656187130462, 'batch_norm': False, 'lr': 2.539819832892662e-05, 'weight_decay': 0.00022219370577486946, 'epochs': 96, 'loss': 'mae', 'optimizer': 'adam', 'graph_mode': 'off', 'use_snp_selection': True, 'num_snps': 47116}. Best is trial 21 with value: 0.3771881954265961.
[I 2025-12-06 12:01:44,460] Trial 54 finished with value: 0.3737761043683895 and parameters: {'model_type': 'mlp', 'hidden_dims': '[512, 256]', 'dropout': 0.4955937793007447, 'batch_norm': False, 'lr': 1.0284485304040457e-05, 'weight_decay': 0.00047452524696528633, 'epochs': 209, 'loss': 'mae', 'optimizer': 'adam', 'graph_mode': 'off', 'use_snp_selection': True, 'num_snps': 59896}. Best is trial 21 with value: 0.3771881954265961.
[I 2025-12-06 12:02:09,881] Trial 55 finished with value: 0.36924029311954953 and parameters: {'model_type': 'mlp', 'hidden_dims': '[512, 256]', 'dropout': 0.4922589917343628, 'batch_norm': False, 'lr': 1.7661106651231445e-05, 'weight_decay': 0.0005156539165711746, 'epochs': 108, 'loss': 'mae', 'optimizer': 'adam', 'graph_mode': 'off', 'use_snp_selection': False}. Best is trial 21 with value: 0.3771881954265961.
[I 2025-12-06 12:03:09,659] Trial 56 finished with value: 0.3631152634653243 and parameters: {'model_type': 'mlp', 'hidden_dims': '[256, 128, 64]', 'dropout': 0.5183616495150064, 'batch_norm': False, 'lr': 1.069243393386677e-05, 'weight_decay': 0.0003494139014418248, 'epochs': 235, 'loss': 'mae', 'optimizer': 'adam', 'graph_mode': 'off', 'use_snp_selection': True, 'num_snps': 59135}. Best is trial 21 with value: 0.3771881954265961.
[I 2025-12-06 12:03:55,835] Trial 57 finished with value: 0.32658273210056993 and parameters: {'model_type': 'mlp', 'hidden_dims': '[512, 256]', 'dropout': 0.4521521378275698, 'batch_norm': True, 'lr': 9.022279355297927e-06, 'weight_decay': 0.0008946259409421031, 'epochs': 45, 'loss': 'mae', 'optimizer': 'adam', 'graph_mode': 'off', 'use_snp_selection': True, 'num_snps': 56409}. Best is trial 21 with value: 0.3771881954265961.
[I 2025-12-06 12:04:30,772] Trial 58 finished with value: 0.36994861074336555 and parameters: {'model_type': 'mlp', 'hidden_dims': '[512, 64]', 'dropout': 0.5337241354880168, 'batch_norm': False, 'lr': 1.3811358989518537e-05, 'weight_decay': 0.00011970461699280314, 'epochs': 160, 'loss': 'mae', 'optimizer': 'adam', 'graph_mode': 'off', 'use_snp_selection': False}. Best is trial 21 with value: 0.3771881954265961.
[I 2025-12-06 12:05:18,012] Trial 59 finished with value: 0.13015649637461996 and parameters: {'model_type': 'mlp', 'hidden_dims': '[512, 256]', 'dropout': 0.5832617463414814, 'batch_norm': False, 'lr': 0.0009546296535099733, 'weight_decay': 1.6789984570160963e-06, 'epochs': 68, 'loss': 'mae', 'optimizer': 'adam', 'graph_mode': 'off', 'use_snp_selection': True, 'num_snps': 51491}. Best is trial 21 with value: 0.3771881954265961.
[I 2025-12-06 12:06:03,396] Trial 60 finished with value: 0.3617161402396822 and parameters: {'model_type': 'mlp', 'hidden_dims': '[128, 64]', 'dropout': 0.5026645252779476, 'batch_norm': False, 'lr': 6.753688615333367e-06, 'weight_decay': 2.092415855482002e-07, 'epochs': 141, 'loss': 'mae', 'optimizer': 'adam', 'graph_mode': 'off', 'use_snp_selection': True, 'num_snps': 59751}. Best is trial 21 with value: 0.3771881954265961.
[I 2025-12-06 12:07:15,724] Trial 61 finished with value: 0.3621466094713779 and parameters: {'model_type': 'mlp', 'hidden_dims': '[512, 256]', 'dropout': 0.43212953626196565, 'batch_norm': False, 'lr': 4.602599061148589e-06, 'weight_decay': 5.986480775306853e-05, 'epochs': 202, 'loss': 'mse', 'optimizer': 'adam', 'graph_mode': 'off', 'use_snp_selection': True, 'num_snps': 55747}. Best is trial 21 with value: 0.3771881954265961.
[I 2025-12-06 12:08:09,502] Trial 62 finished with value: 0.3518968484585223 and parameters: {'model_type': 'mlp', 'hidden_dims': '[512, 256]', 'dropout': 0.48641997863351305, 'batch_norm': False, 'lr': 3.283497044023559e-06, 'weight_decay': 0.0002923084619579309, 'epochs': 89, 'loss': 'mae', 'optimizer': 'adam', 'graph_mode': 'off', 'use_snp_selection': True, 'num_snps': 56770}. Best is trial 21 with value: 0.3771881954265961.
[I 2025-12-06 12:09:19,143] Trial 63 finished with value: 0.3582444974932762 and parameters: {'model_type': 'mlp', 'hidden_dims': '[512, 256]', 'dropout': 0.39250194865481375, 'batch_norm': False, 'lr': 6.128074470548888e-06, 'weight_decay': 0.00017853089435708588, 'epochs': 214, 'loss': 'mse', 'optimizer': 'adam', 'graph_mode': 'off', 'use_snp_selection': True, 'num_snps': 50753}. Best is trial 21 with value: 0.3771881954265961.
[I 2025-12-06 12:10:32,952] Trial 64 finished with value: 0.35019053515399 and parameters: {'model_type': 'mlp', 'hidden_dims': '[512, 256]', 'dropout': 0.4657344680596702, 'batch_norm': False, 'lr': 1.8422901768365246e-05, 'weight_decay': 0.0001115526967464714, 'epochs': 226, 'loss': 'mse', 'optimizer': 'adam', 'graph_mode': 'off', 'use_snp_selection': True, 'num_snps': 53866}. Best is trial 21 with value: 0.3771881954265961.
[I 2025-12-06 12:11:37,148] Trial 65 finished with value: 0.3747104472074664 and parameters: {'model_type': 'mlp', 'hidden_dims': '[512, 256]', 'dropout': 0.5527469078492705, 'batch_norm': False, 'lr': 2.2561541275600974e-06, 'weight_decay': 0.0006624810577955549, 'epochs': 243, 'loss': 'mae', 'optimizer': 'adam', 'graph_mode': 'off', 'use_snp_selection': True, 'num_snps': 41271}. Best is trial 21 with value: 0.3771881954265961.
[I 2025-12-06 12:12:33,771] Trial 66 finished with value: 0.3725031788136079 and parameters: {'model_type': 'mlp', 'hidden_dims': '[512, 256]', 'dropout': 0.5544174160474672, 'batch_norm': False, 'lr': 2.2753026359339982e-06, 'weight_decay': 0.00047555046444061426, 'epochs': 270, 'loss': 'mae', 'optimizer': 'adam', 'graph_mode': 'off', 'use_snp_selection': False}. Best is trial 21 with value: 0.3771881954265961.
[I 2025-12-06 12:13:39,016] Trial 67 finished with value: 0.3698945000920007 and parameters: {'model_type': 'mlp', 'hidden_dims': '[512, 128]', 'dropout': 0.5999369550753098, 'batch_norm': False, 'lr': 3.2171356144991344e-06, 'weight_decay': 0.0009787011798975502, 'epochs': 251, 'loss': 'mae', 'optimizer': 'adam', 'graph_mode': 'off', 'use_snp_selection': True, 'num_snps': 41295}. Best is trial 21 with value: 0.3771881954265961.
[I 2025-12-06 12:14:23,783] Trial 68 finished with value: 0.36759451394156467 and parameters: {'model_type': 'mlp', 'hidden_dims': '[256, 128]', 'dropout': 0.5090107022822309, 'batch_norm': False, 'lr': 7.933688631647226e-06, 'weight_decay': 0.00036924783986889276, 'epochs': 241, 'loss': 'mae', 'optimizer': 'adam', 'graph_mode': 'off', 'use_snp_selection': True, 'num_snps': 34672}. Best is trial 21 with value: 0.3771881954265961.
[I 2025-12-06 12:15:30,406] Trial 69 finished with value: 0.36363085699069764 and parameters: {'model_type': 'mlp', 'hidden_dims': '[512, 256]', 'dropout': 0.538364723504178, 'batch_norm': False, 'lr': 1.3541361377106433e-06, 'weight_decay': 1.0167307192421256e-07, 'epochs': 284, 'loss': 'mae', 'optimizer': 'adam', 'graph_mode': 'off', 'use_snp_selection': True, 'num_snps': 39061}. Best is trial 21 with value: 0.3771881954265961.
[I 2025-12-06 12:16:04,021] Trial 70 finished with value: 0.3394624949037169 and parameters: {'model_type': 'mlp', 'hidden_dims': '[128, 64]', 'dropout': 0.5700320163580236, 'batch_norm': True, 'lr': 1.255883317818875e-05, 'weight_decay': 0.0006831753013048845, 'epochs': 181, 'loss': 'mae', 'optimizer': 'adam', 'graph_mode': 'off', 'use_snp_selection': True, 'num_snps': 27587}. Best is trial 21 with value: 0.3771881954265961.
[I 2025-12-06 12:17:18,958] Trial 71 finished with value: 0.37054148252123 and parameters: {'model_type': 'mlp', 'hidden_dims': '[512, 256]', 'dropout': 0.5153649399876298, 'batch_norm': False, 'lr': 2.964007753452839e-06, 'weight_decay': 0.00023980572785023218, 'epochs': 209, 'loss': 'mse', 'optimizer': 'adam', 'graph_mode': 'off', 'use_snp_selection': True, 'num_snps': 57597}. Best is trial 21 with value: 0.3771881954265961.
[I 2025-12-06 12:18:25,475] Trial 72 finished with value: 0.33141391635261364 and parameters: {'model_type': 'mlp', 'hidden_dims': '[512, 256]', 'dropout': 0.46307754274169777, 'batch_norm': False, 'lr': 0.0006450415499832938, 'weight_decay': 0.0005796136391193735, 'epochs': 221, 'loss': 'mse', 'optimizer': 'adam', 'graph_mode': 'off', 'use_snp_selection': True, 'num_snps': 47331}. Best is trial 21 with value: 0.3771881954265961.
[I 2025-12-06 12:19:33,142] Trial 73 finished with value: 0.3724243976495826 and parameters: {'model_type': 'mlp', 'hidden_dims': '[512, 256]', 'dropout': 0.5551692598469349, 'batch_norm': False, 'lr': 4.097097878800165e-06, 'weight_decay': 0.00019188225249794127, 'epochs': 205, 'loss': 'mse', 'optimizer': 'adam', 'graph_mode': 'off', 'use_snp_selection': True, 'num_snps': 50117}. Best is trial 21 with value: 0.3771881954265961.
[I 2025-12-06 12:20:29,649] Trial 74 finished with value: 0.36335561852224824 and parameters: {'model_type': 'mlp', 'hidden_dims': '[512, 256]', 'dropout': 0.49232936070551614, 'batch_norm': False, 'lr': 2.9733724989000194e-05, 'weight_decay': 0.00013823029574708251, 'epochs': 117, 'loss': 'mse', 'optimizer': 'adam', 'graph_mode': 'off', 'use_snp_selection': True, 'num_snps': 54220}. Best is trial 21 with value: 0.3771881954265961.
[I 2025-12-06 12:21:16,630] Trial 75 finished with value: 0.20383886640103185 and parameters: {'model_type': 'mlp', 'hidden_dims': '[256, 128, 64]', 'dropout': 0.5861204492404445, 'batch_norm': False, 'lr': 1.939182313697335e-06, 'weight_decay': 0.0002828935742006015, 'epochs': 100, 'loss': 'mae', 'optimizer': 'adam', 'graph_mode': 'off', 'use_snp_selection': True, 'num_snps': 57495}. Best is trial 21 with value: 0.3771881954265961.
[I 2025-12-06 12:21:57,812] Trial 76 finished with value: 0.37827641757205727 and parameters: {'model_type': 'mlp', 'hidden_dims': '[512, 128]', 'dropout': 0.5303270409829424, 'batch_norm': False, 'lr': 2.6059960391711056e-06, 'weight_decay': 9.300857664001977e-05, 'epochs': 191, 'loss': 'mse', 'optimizer': 'adam', 'graph_mode': 'off', 'use_snp_selection': False}. Best is trial 76 with value: 0.37827641757205727.
[I 2025-12-06 12:22:39,721] Trial 77 finished with value: 0.376771633376635 and parameters: {'model_type': 'mlp', 'hidden_dims': '[512, 128]', 'dropout': 0.5304868153570693, 'batch_norm': False, 'lr': 2.539295749326838e-06, 'weight_decay': 2.02506991806572e-05, 'epochs': 193, 'loss': 'mse', 'optimizer': 'adam', 'graph_mode': 'off', 'use_snp_selection': False}. Best is trial 76 with value: 0.37827641757205727.
[I 2025-12-06 12:23:17,734] Trial 78 finished with value: 0.37491640709287477 and parameters: {'model_type': 'mlp', 'hidden_dims': '[512, 128]', 'dropout': 0.5313382363944237, 'batch_norm': False, 'lr': 2.4392043835181608e-06, 'weight_decay': 2.3223029669453195e-05, 'epochs': 171, 'loss': 'mse', 'optimizer': 'adam', 'graph_mode': 'off', 'use_snp_selection': False}. Best is trial 76 with value: 0.37827641757205727.
[I 2025-12-06 12:23:59,459] Trial 79 finished with value: 0.3723429240096083 and parameters: {'model_type': 'mlp', 'hidden_dims': '[512, 128]', 'dropout': 0.5319358875466996, 'batch_norm': False, 'lr': 2.3619695093689466e-06, 'weight_decay': 3.769804739375251e-05, 'epochs': 190, 'loss': 'mse', 'optimizer': 'adam', 'graph_mode': 'off', 'use_snp_selection': False}. Best is trial 76 with value: 0.37827641757205727.
[I 2025-12-06 12:24:38,544] Trial 80 finished with value: 0.3457388014894192 and parameters: {'model_type': 'mlp', 'hidden_dims': '[512, 128]', 'dropout': 0.5408468348637276, 'batch_norm': False, 'lr': 1.173137262860109e-06, 'weight_decay': 2.035092114340198e-05, 'epochs': 176, 'loss': 'mse', 'optimizer': 'adam', 'graph_mode': 'off', 'use_snp_selection': False}. Best is trial 76 with value: 0.37827641757205727.
[I 2025-12-06 12:25:15,499] Trial 81 finished with value: 0.35650936701316355 and parameters: {'model_type': 'mlp', 'hidden_dims': '[512, 128]', 'dropout': 0.569568003163911, 'batch_norm': False, 'lr': 1.6362957090082451e-06, 'weight_decay': 5.06270726585624e-06, 'epochs': 165, 'loss': 'mse', 'optimizer': 'adam', 'graph_mode': 'off', 'use_snp_selection': False}. Best is trial 76 with value: 0.37827641757205727.
[I 2025-12-06 12:25:57,613] Trial 82 finished with value: 0.3693771425490268 and parameters: {'model_type': 'mlp', 'hidden_dims': '[512, 128]', 'dropout': 0.5586202689587492, 'batch_norm': False, 'lr': 2.6197264518780636e-06, 'weight_decay': 1.4936030224224452e-05, 'epochs': 192, 'loss': 'mse', 'optimizer': 'adam', 'graph_mode': 'off', 'use_snp_selection': False}. Best is trial 76 with value: 0.37827641757205727.
[I 2025-12-06 12:26:32,360] Trial 83 finished with value: 0.3780364746336561 and parameters: {'model_type': 'mlp', 'hidden_dims': '[512, 128]', 'dropout': 0.5768035025454114, 'batch_norm': False, 'lr': 4.851161354932665e-06, 'weight_decay': 2.862140638419211e-05, 'epochs': 154, 'loss': 'mse', 'optimizer': 'adam', 'graph_mode': 'off', 'use_snp_selection': False}. Best is trial 76 with value: 0.37827641757205727.
