[I 2025-12-05 15:10:35,768] Trial 100 finished with value: 0.03920669737412663 and parameters: {'model_type': 'mlp', 'hidden_dims': '[512, 256]', 'dropout': 0.3702599170999101, 'batch_norm': True, 'lr': 1.7038638092458407e-05, 'weight_decay': 1.919051958084071e-06, 'epochs': 152, 'loss': 'mae', 'optimizer': 'adam', 'graph_mode': 'off', 'use_snp_selection': False}. Best is trial 88 with value: 0.12668341454697915.
[I 2025-12-05 15:10:36,734] Trial 101 finished with value: 0.10715412948146875 and parameters: {'model_type': 'mlp', 'hidden_dims': '[256, 128]', 'dropout': 0.17069117188121657, 'batch_norm': True, 'lr': 0.00010859303417394533, 'weight_decay': 6.649896088676603e-07, 'epochs': 105, 'loss': 'mae', 'optimizer': 'adam', 'graph_mode': 'off', 'use_snp_selection': False}. Best is trial 88 with value: 0.12668341454697915.
[I 2025-12-05 15:10:37,826] Trial 102 finished with value: 0.11593704286221013 and parameters: {'model_type': 'mlp', 'hidden_dims': '[512, 256]', 'dropout': 0.15778984639911522, 'batch_norm': True, 'lr': 6.249558736581772e-05, 'weight_decay': 2.2041905026984146e-07, 'epochs': 66, 'loss': 'mae', 'optimizer': 'adam', 'graph_mode': 'off', 'use_snp_selection': False}. Best is trial 88 with value: 0.12668341454697915.
[I 2025-12-05 15:10:39,103] Trial 103 finished with value: 0.12456571155247678 and parameters: {'model_type': 'mlp', 'hidden_dims': '[512, 128]', 'dropout': 0.1781374826285964, 'batch_norm': True, 'lr': 0.000153034448074463, 'weight_decay': 4.642609210999666e-07, 'epochs': 100, 'loss': 'mae', 'optimizer': 'adam', 'graph_mode': 'off', 'use_snp_selection': False}. Best is trial 88 with value: 0.12668341454697915.
[I 2025-12-05 15:10:40,413] Trial 104 finished with value: 0.10329505815586 and parameters: {'model_type': 'mlp', 'hidden_dims': '[512, 128]', 'dropout': 0.18502442239996492, 'batch_norm': True, 'lr': 0.00013583740633681075, 'weight_decay': 4.556199730028508e-07, 'epochs': 112, 'loss': 'mae', 'optimizer': 'adam', 'graph_mode': 'off', 'use_snp_selection': False}. Best is trial 88 with value: 0.12668341454697915.
[I 2025-12-05 15:10:41,657] Trial 105 finished with value: 0.09197268243016883 and parameters: {'model_type': 'mlp', 'hidden_dims': '[512, 128]', 'dropout': 0.12837647770297436, 'batch_norm': True, 'lr': 0.00018228570611310117, 'weight_decay': 8.943778701942281e-07, 'epochs': 98, 'loss': 'mae', 'optimizer': 'adam', 'graph_mode': 'off', 'use_snp_selection': False}. Best is trial 88 with value: 0.12668341454697915.
[I 2025-12-05 15:10:42,890] Trial 106 finished with value: 0.11290629233252455 and parameters: {'model_type': 'mlp', 'hidden_dims': '[512, 128]', 'dropout': 0.22214798593090448, 'batch_norm': True, 'lr': 0.0008106750643436384, 'weight_decay': 1.3706316288133244e-05, 'epochs': 90, 'loss': 'mae', 'optimizer': 'adam', 'graph_mode': 'off', 'use_snp_selection': False}. Best is trial 88 with value: 0.12668341454697915.
[I 2025-12-05 15:10:45,201] Trial 107 finished with value: 0.12010408086176877 and parameters: {'model_type': 'mlp', 'hidden_dims': '[512, 128]', 'dropout': 0.3384141697551572, 'batch_norm': True, 'lr': 0.00015816306212632097, 'weight_decay': 1.5665168621412066e-07, 'epochs': 309, 'loss': 'mae', 'optimizer': 'adam', 'graph_mode': 'off', 'use_snp_selection': False}. Best is trial 88 with value: 0.12668341454697915.
[I 2025-12-05 15:10:46,409] Trial 108 finished with value: 0.07771565122070234 and parameters: {'model_type': 'mlp', 'hidden_dims': '[256, 128, 64]', 'dropout': 0.1766958147214519, 'batch_norm': True, 'lr': 2.8463196420347623e-05, 'weight_decay': 6.240477999191737e-07, 'epochs': 140, 'loss': 'mae', 'optimizer': 'adam', 'graph_mode': 'off', 'use_snp_selection': True, 'num_snps': 11322}. Best is trial 88 with value: 0.12668341454697915.
[I 2025-12-05 15:10:48,916] Trial 109 finished with value: 0.09776324602972626 and parameters: {'model_type': 'mlp', 'hidden_dims': '[512, 256]', 'dropout': 0.19571791297314, 'batch_norm': True, 'lr': 8.732167611859634e-05, 'weight_decay': 3.563833088788411e-07, 'epochs': 349, 'loss': 'mae', 'optimizer': 'adam', 'graph_mode': 'off', 'use_snp_selection': False}. Best is trial 88 with value: 0.12668341454697915.
[I 2025-12-05 15:10:50,319] Trial 110 finished with value: 0.1184927669781194 and parameters: {'model_type': 'mlp', 'hidden_dims': '[512, 256]', 'dropout': 0.14613460766770459, 'batch_norm': True, 'lr': 5.042441024924205e-05, 'weight_decay': 8.459612131396903e-06, 'epochs': 129, 'loss': 'mae', 'optimizer': 'adam', 'graph_mode': 'off', 'use_snp_selection': False}. Best is trial 88 with value: 0.12668341454697915.
[I 2025-12-05 15:10:52,640] Trial 111 finished with value: 0.11019615010578682 and parameters: {'model_type': 'mlp', 'hidden_dims': '[512, 128]', 'dropout': 0.33934880281957774, 'batch_norm': True, 'lr': 0.0002289583729144593, 'weight_decay': 1.7339988500199464e-07, 'epochs': 310, 'loss': 'mae', 'optimizer': 'adam', 'graph_mode': 'off', 'use_snp_selection': False}. Best is trial 88 with value: 0.12668341454697915.
[I 2025-12-05 15:10:54,904] Trial 112 finished with value: 0.1015026460599662 and parameters: {'model_type': 'mlp', 'hidden_dims': '[512, 128]', 'dropout': 0.24475111802813598, 'batch_norm': True, 'lr': 0.00029751602721468434, 'weight_decay': 2.9821759099058616e-07, 'epochs': 298, 'loss': 'mae', 'optimizer': 'adam', 'graph_mode': 'off', 'use_snp_selection': False}. Best is trial 88 with value: 0.12668341454697915.
[I 2025-12-05 15:10:57,294] Trial 113 finished with value: 0.10845485856381652 and parameters: {'model_type': 'mlp', 'hidden_dims': '[512, 128]', 'dropout': 0.45859492276200275, 'batch_norm': True, 'lr': 0.00016891625322567707, 'weight_decay': 1.3981303001662115e-07, 'epochs': 327, 'loss': 'mae', 'optimizer': 'adam', 'graph_mode': 'off', 'use_snp_selection': False}. Best is trial 88 with value: 0.12668341454697915.
[I 2025-12-05 15:10:59,617] Trial 114 finished with value: 0.1028338137660283 and parameters: {'model_type': 'mlp', 'hidden_dims': '[512, 128]', 'dropout': 0.1139162072386268, 'batch_norm': True, 'lr': 0.00014662784127384006, 'weight_decay': 1.1111843317351209e-07, 'epochs': 317, 'loss': 'mae', 'optimizer': 'adam', 'graph_mode': 'off', 'use_snp_selection': False}. Best is trial 88 with value: 0.12668341454697915.
[I 2025-12-05 15:11:00,998] Trial 115 finished with value: 0.10778888265194624 and parameters: {'model_type': 'mlp', 'hidden_dims': '[512, 128]', 'dropout': 0.3924692350586051, 'batch_norm': True, 'lr': 0.00020521987566928833, 'weight_decay': 5.066053658114429e-07, 'epochs': 120, 'loss': 'mae', 'optimizer': 'adam', 'graph_mode': 'off', 'use_snp_selection': False}. Best is trial 88 with value: 0.12668341454697915.
[I 2025-12-05 15:11:03,136] Trial 116 finished with value: 0.11006107776741884 and parameters: {'model_type': 'mlp', 'hidden_dims': '[512, 64]', 'dropout': 0.2672227173102095, 'batch_norm': True, 'lr': 0.00038495061261785505, 'weight_decay': 1.516452271819186e-07, 'epochs': 279, 'loss': 'mae', 'optimizer': 'adam', 'graph_mode': 'off', 'use_snp_selection': False}. Best is trial 88 with value: 0.12668341454697915.
[I 2025-12-05 15:11:05,420] Trial 117 finished with value: 0.11879818190125932 and parameters: {'model_type': 'mlp', 'hidden_dims': '[512, 256]', 'dropout': 0.16311968150620473, 'batch_norm': True, 'lr': 4.371569587725974e-05, 'weight_decay': 1.4411581503008427e-06, 'epochs': 306, 'loss': 'mae', 'optimizer': 'adam', 'graph_mode': 'off', 'use_snp_selection': False}. Best is trial 88 with value: 0.12668341454697915.
[I 2025-12-05 15:11:07,858] Trial 118 finished with value: 0.09826297858473704 and parameters: {'model_type': 'mlp', 'hidden_dims': '[512, 256]', 'dropout': 0.1362605855433553, 'batch_norm': True, 'lr': 2.978180605979622e-06, 'weight_decay': 7.708369885377539e-07, 'epochs': 339, 'loss': 'mae', 'optimizer': 'adam', 'graph_mode': 'off', 'use_snp_selection': False}. Best is trial 88 with value: 0.12668341454697915.
[I 2025-12-05 15:11:09,142] Trial 119 finished with value: 0.10521543742763735 and parameters: {'model_type': 'mlp', 'hidden_dims': '[512, 256]', 'dropout': 0.5990127129355303, 'batch_norm': True, 'lr': 3.464957430814478e-05, 'weight_decay': 2.5104607874926954e-07, 'epochs': 102, 'loss': 'mae', 'optimizer': 'adam', 'graph_mode': 'off', 'use_snp_selection': False}. Best is trial 88 with value: 0.12668341454697915.
[I 2025-12-05 15:11:11,063] Trial 120 finished with value: 0.10343768903502534 and parameters: {'model_type': 'mlp', 'hidden_dims': '[512, 128]', 'dropout': 0.12070448746551388, 'batch_norm': True, 'lr': 0.0005435719569993421, 'weight_decay': 1.0907773988415382e-06, 'epochs': 235, 'loss': 'mae', 'optimizer': 'adam', 'graph_mode': 'off', 'use_snp_selection': False}. Best is trial 88 with value: 0.12668341454697915.
[I 2025-12-05 15:11:11,915] Trial 121 finished with value: 0.09100436822352091 and parameters: {'model_type': 'mlp', 'hidden_dims': '[256, 128]', 'dropout': 0.1829141322945226, 'batch_norm': True, 'lr': 0.00011324054050307621, 'weight_decay': 4.145350738608186e-07, 'epochs': 74, 'loss': 'mae', 'optimizer': 'adam', 'graph_mode': 'off', 'use_snp_selection': False}. Best is trial 88 with value: 0.12668341454697915.
[I 2025-12-05 15:11:13,071] Trial 122 finished with value: 0.10485764315609879 and parameters: {'model_type': 'mlp', 'hidden_dims': '[512, 256]', 'dropout': 0.17273876767013077, 'batch_norm': True, 'lr': 9.667408025814331e-05, 'weight_decay': 2.4003879193345545e-06, 'epochs': 78, 'loss': 'mae', 'optimizer': 'adam', 'graph_mode': 'off', 'use_snp_selection': False}. Best is trial 88 with value: 0.12668341454697915.
[I 2025-12-05 15:11:13,955] Trial 123 finished with value: 0.09670580125889185 and parameters: {'model_type': 'mlp', 'hidden_dims': '[256, 128]', 'dropout': 0.300095115796144, 'batch_norm': True, 'lr': 7.798096117963553e-05, 'weight_decay': 4.1956700219464305e-06, 'epochs': 87, 'loss': 'mae', 'optimizer': 'adam', 'graph_mode': 'off', 'use_snp_selection': False}. Best is trial 88 with value: 0.12668341454697915.
[I 2025-12-05 15:11:15,271] Trial 124 finished with value: 0.11469974938755849 and parameters: {'model_type': 'mlp', 'hidden_dims': '[512, 256]', 'dropout': 0.15160102752417481, 'batch_norm': True, 'lr': 6.648420167809084e-05, 'weight_decay': 1.2630684780760462e-07, 'epochs': 109, 'loss': 'mae', 'optimizer': 'adam', 'graph_mode': 'off', 'use_snp_selection': False}. Best is trial 88 with value: 0.12668341454697915.
[I 2025-12-05 15:11:16,210] Trial 125 finished with value: 0.11848294883206112 and parameters: {'model_type': 'mlp', 'hidden_dims': '[256, 128, 64]', 'dropout': 0.20662236736905049, 'batch_norm': True, 'lr': 0.000157040438661268, 'weight_decay': 5.611892567133632e-07, 'epochs': 95, 'loss': 'mae', 'optimizer': 'adam', 'graph_mode': 'off', 'use_snp_selection': False}. Best is trial 88 with value: 0.12668341454697915.
[I 2025-12-05 15:11:17,981] Trial 126 finished with value: 0.11738216161303147 and parameters: {'model_type': 'mlp', 'hidden_dims': '[512, 256]', 'dropout': 0.13124729566092494, 'batch_norm': True, 'lr': 5.581587226888351e-05, 'weight_decay': 2.037848445666231e-07, 'epochs': 204, 'loss': 'mae', 'optimizer': 'adam', 'graph_mode': 'off', 'use_snp_selection': False}. Best is trial 88 with value: 0.12668341454697915.
[I 2025-12-05 15:11:19,482] Trial 127 finished with value: 0.10553162324326071 and parameters: {'model_type': 'mlp', 'hidden_dims': '[512, 128]', 'dropout': 0.10789308378554033, 'batch_norm': True, 'lr': 0.0001375640150755259, 'weight_decay': 1.775334212138952e-06, 'epochs': 145, 'loss': 'mae', 'optimizer': 'adam', 'graph_mode': 'off', 'use_snp_selection': False}. Best is trial 88 with value: 0.12668341454697915.
[I 2025-12-05 15:11:22,177] Trial 128 finished with value: 0.12102363616289018 and parameters: {'model_type': 'mlp', 'hidden_dims': '[512, 256]', 'dropout': 0.15918617807084043, 'batch_norm': True, 'lr': 0.00010052252476452857, 'weight_decay': 3.1655422898712494e-07, 'epochs': 115, 'loss': 'mae', 'optimizer': 'adam', 'graph_mode': 'off', 'use_snp_selection': True, 'num_snps': 51726}. Best is trial 88 with value: 0.12668341454697915.
[I 2025-12-05 15:11:25,097] Trial 129 finished with value: 0.10773910029698569 and parameters: {'model_type': 'mlp', 'hidden_dims': '[512, 256]', 'dropout': 0.16044030686704475, 'batch_norm': True, 'lr': 8.269771182236018e-05, 'weight_decay': 3.2565451339474416e-07, 'epochs': 134, 'loss': 'mae', 'optimizer': 'adam', 'graph_mode': 'off', 'use_snp_selection': True, 'num_snps': 52886}. Best is trial 88 with value: 0.12668341454697915.
[I 2025-12-05 15:11:27,342] Trial 130 finished with value: 0.09429213846768626 and parameters: {'model_type': 'mlp', 'hidden_dims': '[512, 256]', 'dropout': 0.14189681491553224, 'batch_norm': True, 'lr': 0.000257423101998731, 'weight_decay': 2.4018433298654744e-05, 'epochs': 116, 'loss': 'mae', 'optimizer': 'adam', 'graph_mode': 'off', 'use_snp_selection': True, 'num_snps': 37386}. Best is trial 88 with value: 0.12668341454697915.
[I 2025-12-05 15:11:30,081] Trial 131 finished with value: 0.08704692556960243 and parameters: {'model_type': 'mlp', 'hidden_dims': '[512, 256]', 'dropout': 0.18892948082170274, 'batch_norm': True, 'lr': 0.0001019600110903773, 'weight_decay': 0.0006871274016119049, 'epochs': 125, 'loss': 'mae', 'optimizer': 'adam', 'graph_mode': 'off', 'use_snp_selection': True, 'num_snps': 50559}. Best is trial 88 with value: 0.12668341454697915.
[I 2025-12-05 15:11:32,277] Trial 132 finished with value: 0.12088267371498948 and parameters: {'model_type': 'mlp', 'hidden_dims': '[512, 256]', 'dropout': 0.10048906871544283, 'batch_norm': True, 'lr': 6.574489303269606e-05, 'weight_decay': 4.463895302825855e-07, 'epochs': 104, 'loss': 'mae', 'optimizer': 'adam', 'graph_mode': 'off', 'use_snp_selection': True, 'num_snps': 38552}. Best is trial 88 with value: 0.12668341454697915.
[I 2025-12-05 15:11:34,554] Trial 133 finished with value: 0.1142568184369033 and parameters: {'model_type': 'mlp', 'hidden_dims': '[512, 256]', 'dropout': 0.10159087799308542, 'batch_norm': True, 'lr': 6.815462771037506e-05, 'weight_decay': 4.2565169110672525e-07, 'epochs': 106, 'loss': 'mae', 'optimizer': 'adam', 'graph_mode': 'off', 'use_snp_selection': True, 'num_snps': 40461}. Best is trial 88 with value: 0.12668341454697915.
[I 2025-12-05 15:11:36,358] Trial 134 finished with value: 0.08705981751834002 and parameters: {'model_type': 'mlp', 'hidden_dims': '[512, 256]', 'dropout': 0.12335967534563516, 'batch_norm': True, 'lr': 4.7697108236629065e-05, 'weight_decay': 6.038311681993142e-07, 'epochs': 98, 'loss': 'mae', 'optimizer': 'adam', 'graph_mode': 'off', 'use_snp_selection': True, 'num_snps': 30667}. Best is trial 88 with value: 0.12668341454697915.
[I 2025-12-05 15:11:39,085] Trial 135 finished with value: 0.11996627432255541 and parameters: {'model_type': 'mlp', 'hidden_dims': '[512, 256]', 'dropout': 0.11948317020941308, 'batch_norm': True, 'lr': 4.048457176564669e-05, 'weight_decay': 2.9440582101920005e-07, 'epochs': 115, 'loss': 'mae', 'optimizer': 'adam', 'graph_mode': 'off', 'use_snp_selection': True, 'num_snps': 52703}. Best is trial 88 with value: 0.12668341454697915.
[I 2025-12-05 15:11:41,050] Trial 136 finished with value: 0.08225329256369243 and parameters: {'model_type': 'mlp', 'hidden_dims': '[512, 256]', 'dropout': 0.10886692758689659, 'batch_norm': True, 'lr': 5.221701208338532e-05, 'weight_decay': 7.800961434308761e-07, 'epochs': 121, 'loss': 'mae', 'optimizer': 'adam', 'graph_mode': 'off', 'use_snp_selection': True, 'num_snps': 31720}. Best is trial 88 with value: 0.12668341454697915.
[I 2025-12-05 15:11:42,838] Trial 137 finished with value: 0.08809193871881552 and parameters: {'model_type': 'mlp', 'hidden_dims': '[512, 256]', 'dropout': 0.15200968621613697, 'batch_norm': True, 'lr': 6.281088045890609e-05, 'weight_decay': 4.830250213104736e-07, 'epochs': 167, 'loss': 'mae', 'optimizer': 'adam', 'graph_mode': 'off', 'use_snp_selection': True, 'num_snps': 26051}. Best is trial 88 with value: 0.12668341454697915.
[I 2025-12-05 15:11:45,420] Trial 138 finished with value: 0.10072156330550035 and parameters: {'model_type': 'mlp', 'hidden_dims': '[512, 256]', 'dropout': 0.1322258677492005, 'batch_norm': True, 'lr': 7.58301156529179e-05, 'weight_decay': 2.2958350689944976e-07, 'epochs': 110, 'loss': 'mae', 'optimizer': 'adam', 'graph_mode': 'off', 'use_snp_selection': True, 'num_snps': 48932}. Best is trial 88 with value: 0.12668341454697915.
[I 2025-12-05 15:11:47,770] Trial 139 finished with value: 0.10651400977141827 and parameters: {'model_type': 'mlp', 'hidden_dims': '[512, 64]', 'dropout': 0.16650691245064617, 'batch_norm': True, 'lr': 0.00017864858413914567, 'weight_decay': 9.894546380080045e-07, 'epochs': 89, 'loss': 'mae', 'optimizer': 'adam', 'graph_mode': 'off', 'use_snp_selection': True, 'num_snps': 41533}. Best is trial 88 with value: 0.12668341454697915.
[I 2025-12-05 15:11:49,231] Trial 140 finished with value: 0.12615101912835855 and parameters: {'model_type': 'mlp', 'hidden_dims': '[512, 256]', 'dropout': 0.14369165389363409, 'batch_norm': True, 'lr': 0.00012396109455636715, 'weight_decay': 6.851012172802523e-07, 'epochs': 136, 'loss': 'mae', 'optimizer': 'adam', 'graph_mode': 'off', 'use_snp_selection': False}. Best is trial 88 with value: 0.12668341454697915.
[I 2025-12-05 15:11:50,630] Trial 141 finished with value: 0.10881823910620764 and parameters: {'model_type': 'mlp', 'hidden_dims': '[512, 256]', 'dropout': 0.13746644551037446, 'batch_norm': True, 'lr': 0.00011653317968128556, 'weight_decay': 3.691827418778201e-07, 'epochs': 128, 'loss': 'mae', 'optimizer': 'adam', 'graph_mode': 'off', 'use_snp_selection': False}. Best is trial 88 with value: 0.12668341454697915.
[I 2025-12-05 15:11:52,120] Trial 142 finished with value: 0.10373931243161102 and parameters: {'model_type': 'mlp', 'hidden_dims': '[512, 256]', 'dropout': 0.3194983104500563, 'batch_norm': True, 'lr': 8.973155312854874e-05, 'weight_decay': 6.184403858308628e-07, 'epochs': 142, 'loss': 'mae', 'optimizer': 'adam', 'graph_mode': 'off', 'use_snp_selection': False}. Best is trial 88 with value: 0.12668341454697915.
[I 2025-12-05 15:11:53,654] Trial 143 finished with value: 0.11784145512726618 and parameters: {'model_type': 'mlp', 'hidden_dims': '[512, 256]', 'dropout': 0.10051278710579534, 'batch_norm': True, 'lr': 0.00013835741861108853, 'weight_decay': 6.94255546625865e-07, 'epochs': 157, 'loss': 'mae', 'optimizer': 'adam', 'graph_mode': 'off', 'use_snp_selection': False}. Best is trial 88 with value: 0.12668341454697915.
[I 2025-12-05 15:11:55,121] Trial 144 finished with value: 0.10711615474233252 and parameters: {'model_type': 'mlp', 'hidden_dims': '[512, 256]', 'dropout': 0.14929679275288088, 'batch_norm': True, 'lr': 0.0002168699407875417, 'weight_decay': 5.131673427520348e-07, 'epochs': 136, 'loss': 'mae', 'optimizer': 'adam', 'graph_mode': 'off', 'use_snp_selection': False}. Best is trial 88 with value: 0.12668341454697915.
[I 2025-12-05 15:11:56,624] Trial 145 finished with value: 0.11952435982834059 and parameters: {'model_type': 'mlp', 'hidden_dims': '[512, 256]', 'dropout': 0.1253592458233935, 'batch_norm': True, 'lr': 9.70159916183771e-05, 'weight_decay': 9.055135164187693e-07, 'epochs': 148, 'loss': 'mae', 'optimizer': 'adam', 'graph_mode': 'off', 'use_snp_selection': False}. Best is trial 88 with value: 0.12668341454697915.
[I 2025-12-05 15:11:57,906] Trial 146 finished with value: 0.11203826531641077 and parameters: {'model_type': 'mlp', 'hidden_dims': '[512, 128]', 'dropout': 0.17681932013410656, 'batch_norm': True, 'lr': 5.583277199933152e-05, 'weight_decay': 2.827641054673711e-07, 'epochs': 104, 'loss': 'mae', 'optimizer': 'adam', 'graph_mode': 'off', 'use_snp_selection': False}. Best is trial 88 with value: 0.12668341454697915.
[I 2025-12-05 15:11:59,365] Trial 147 finished with value: 0.12020945229939972 and parameters: {'model_type': 'mlp', 'hidden_dims': '[512, 256]', 'dropout': 0.1115658878837791, 'batch_norm': True, 'lr': 7.104303206774484e-05, 'weight_decay': 3.9130415278350494e-07, 'epochs': 133, 'loss': 'mae', 'optimizer': 'adam', 'graph_mode': 'off', 'use_snp_selection': False}. Best is trial 88 with value: 0.12668341454697915.
[I 2025-12-05 15:12:00,785] Trial 148 finished with value: 0.11283991660285654 and parameters: {'model_type': 'mlp', 'hidden_dims': '[512, 256]', 'dropout': 0.11231844822979921, 'batch_norm': True, 'lr': 7.12362514007919e-05, 'weight_decay': 3.901452080782339e-07, 'epochs': 132, 'loss': 'mae', 'optimizer': 'adam', 'graph_mode': 'off', 'use_snp_selection': False}. Best is trial 88 with value: 0.12668341454697915.
[I 2025-12-05 15:12:02,942] Trial 149 finished with value: 0.11642090635510456 and parameters: {'model_type': 'mlp', 'hidden_dims': '[512, 256]', 'dropout': 0.1594699870089275, 'batch_norm': True, 'lr': 6.65509401946192e-05, 'weight_decay': 1.1810146222030242e-06, 'epochs': 124, 'loss': 'mae', 'optimizer': 'adam', 'graph_mode': 'off', 'use_snp_selection': True, 'num_snps': 36495}. Best is trial 88 with value: 0.12668341454697915.
[I 2025-12-05 15:12:05,252] Trial 0 finished with value: 0.1031270717739128 and parameters: {'model_type': 'mlp', 'hidden_dims': '[128, 64]', 'dropout': 0.199031432379812, 'batch_norm': True, 'lr': 1.8408544111075837e-06, 'weight_decay': 5.5136510071208614e-05, 'epochs': 336, 'loss': 'mae', 'optimizer': 'adam', 'graph_mode': 'off', 'use_snp_selection': True, 'num_snps': 43862}. Best is trial 0 with value: 0.1031270717739128.
[I 2025-12-05 15:12:06,412] Trial 1 finished with value: 0.11808800374138019 and parameters: {'model_type': 'mlp', 'hidden_dims': '[256, 128]', 'dropout': 0.4370668075331726, 'batch_norm': True, 'lr': 7.133471581159139e-05, 'weight_decay': 1.128633586803549e-05, 'epochs': 242, 'loss': 'mae', 'optimizer': 'adam', 'graph_mode': 'off', 'use_snp_selection': False}. Best is trial 1 with value: 0.11808800374138019.
