[I 2025-12-05 16:10:53,013] Trial 115 finished with value: 0.04788631530471377 and parameters: {'model_type': 'mlp', 'hidden_dims': '[128, 64]', 'dropout': 0.1523060829216994, 'batch_norm': True, 'lr': 2.3850633183488253e-05, 'weight_decay': 1.9111415321352526e-06, 'epochs': 74, 'loss': 'mae', 'optimizer': 'adam', 'graph_mode': 'off', 'use_snp_selection': True, 'num_snps': 40670}. Best is trial 55 with value: 0.15835618302911308.
[I 2025-12-05 16:10:57,528] Trial 116 finished with value: 0.12134879777515316 and parameters: {'model_type': 'mlp', 'hidden_dims': '[512, 256]', 'dropout': 0.20725488350431548, 'batch_norm': True, 'lr': 0.0005704383627127406, 'weight_decay': 0.0005176775312969973, 'epochs': 223, 'loss': 'mae', 'optimizer': 'adam', 'graph_mode': 'off', 'use_snp_selection': True, 'num_snps': 44830}. Best is trial 55 with value: 0.15835618302911308.
[I 2025-12-05 16:11:00,228] Trial 117 finished with value: 0.12197812914225187 and parameters: {'model_type': 'mlp', 'hidden_dims': '[256, 128]', 'dropout': 0.16999247802931572, 'batch_norm': True, 'lr': 0.0007800833107414987, 'weight_decay': 1.446212349609456e-05, 'epochs': 191, 'loss': 'mae', 'optimizer': 'adam', 'graph_mode': 'off', 'use_snp_selection': True, 'num_snps': 31701}. Best is trial 55 with value: 0.15835618302911308.
[I 2025-12-05 16:11:03,506] Trial 118 finished with value: 0.0801792500423348 and parameters: {'model_type': 'mlp', 'hidden_dims': '[512, 256]', 'dropout': 0.13011689225604725, 'batch_norm': False, 'lr': 0.00040734582486347303, 'weight_decay': 6.417488838920925e-06, 'epochs': 214, 'loss': 'mse', 'optimizer': 'adam', 'graph_mode': 'off', 'use_snp_selection': False}. Best is trial 55 with value: 0.15835618302911308.
[I 2025-12-05 16:11:06,551] Trial 119 finished with value: 0.10108049057462593 and parameters: {'model_type': 'mlp', 'hidden_dims': '[256, 128]', 'dropout': 0.14189364616550576, 'batch_norm': True, 'lr': 4.8364016785817405e-05, 'weight_decay': 2.171699940233108e-07, 'epochs': 174, 'loss': 'mae', 'optimizer': 'adam', 'graph_mode': 'off', 'use_snp_selection': True, 'num_snps': 38635}. Best is trial 55 with value: 0.15835618302911308.
[I 2025-12-05 16:11:07,934] Trial 120 finished with value: 0.14871607015993693 and parameters: {'model_type': 'mlp', 'hidden_dims': '[512, 256]', 'dropout': 0.15980806989911014, 'batch_norm': True, 'lr': 0.0005107720519048142, 'weight_decay': 0.0007594189021531923, 'epochs': 55, 'loss': 'mae', 'optimizer': 'adam', 'graph_mode': 'off', 'use_snp_selection': False}. Best is trial 55 with value: 0.15835618302911308.
[I 2025-12-05 16:11:09,356] Trial 121 finished with value: 0.15208927020375007 and parameters: {'model_type': 'mlp', 'hidden_dims': '[512, 256]', 'dropout': 0.16103822190331232, 'batch_norm': True, 'lr': 0.000473640019628003, 'weight_decay': 0.0006193422466397287, 'epochs': 59, 'loss': 'mae', 'optimizer': 'adam', 'graph_mode': 'off', 'use_snp_selection': False}. Best is trial 55 with value: 0.15835618302911308.
[I 2025-12-05 16:11:10,759] Trial 122 finished with value: 0.12559300567546644 and parameters: {'model_type': 'mlp', 'hidden_dims': '[512, 256]', 'dropout': 0.12469761627632889, 'batch_norm': True, 'lr': 0.0005292733690454778, 'weight_decay': 0.0007188789028257478, 'epochs': 53, 'loss': 'mae', 'optimizer': 'adam', 'graph_mode': 'off', 'use_snp_selection': False}. Best is trial 55 with value: 0.15835618302911308.
[I 2025-12-05 16:11:12,276] Trial 123 finished with value: 0.1330216367717599 and parameters: {'model_type': 'mlp', 'hidden_dims': '[512, 256]', 'dropout': 0.11074094826427563, 'batch_norm': True, 'lr': 0.0004803789625266999, 'weight_decay': 0.000641087300171632, 'epochs': 62, 'loss': 'mae', 'optimizer': 'adam', 'graph_mode': 'off', 'use_snp_selection': False}. Best is trial 55 with value: 0.15835618302911308.
[I 2025-12-05 16:11:13,713] Trial 124 finished with value: 0.125777056553365 and parameters: {'model_type': 'mlp', 'hidden_dims': '[512, 256]', 'dropout': 0.16245133520843866, 'batch_norm': True, 'lr': 0.0007280149266314232, 'weight_decay': 0.00076139132205986, 'epochs': 57, 'loss': 'mae', 'optimizer': 'adam', 'graph_mode': 'off', 'use_snp_selection': False}. Best is trial 55 with value: 0.15835618302911308.
[I 2025-12-05 16:11:15,006] Trial 125 finished with value: 0.1318686402330582 and parameters: {'model_type': 'mlp', 'hidden_dims': '[512, 256]', 'dropout': 0.18105430941094258, 'batch_norm': True, 'lr': 0.00037936625780872707, 'weight_decay': 0.00039238167260230195, 'epochs': 45, 'loss': 'mae', 'optimizer': 'adam', 'graph_mode': 'off', 'use_snp_selection': False}. Best is trial 55 with value: 0.15835618302911308.
[I 2025-12-05 16:11:16,251] Trial 126 finished with value: 0.12946772725883346 and parameters: {'model_type': 'mlp', 'hidden_dims': '[512, 256]', 'dropout': 0.13906127623006054, 'batch_norm': True, 'lr': 0.0006249539647570446, 'weight_decay': 0.0005283385020620412, 'epochs': 40, 'loss': 'mae', 'optimizer': 'adam', 'graph_mode': 'off', 'use_snp_selection': False}. Best is trial 55 with value: 0.15835618302911308.
[I 2025-12-05 16:11:17,998] Trial 127 finished with value: 0.12962806514866354 and parameters: {'model_type': 'mlp', 'hidden_dims': '[512, 256]', 'dropout': 0.16385031228067562, 'batch_norm': True, 'lr': 0.0004883383650312607, 'weight_decay': 0.0002740047318202708, 'epochs': 85, 'loss': 'mae', 'optimizer': 'adam', 'graph_mode': 'off', 'use_snp_selection': False}. Best is trial 55 with value: 0.15835618302911308.
[I 2025-12-05 16:11:21,220] Trial 128 finished with value: 0.12987574178932457 and parameters: {'model_type': 'mlp', 'hidden_dims': '[512, 256]', 'dropout': 0.1180392066844934, 'batch_norm': True, 'lr': 0.0006950952139945497, 'weight_decay': 0.0008237459463337804, 'epochs': 207, 'loss': 'mae', 'optimizer': 'adam', 'graph_mode': 'off', 'use_snp_selection': False}. Best is trial 55 with value: 0.15835618302911308.
[I 2025-12-05 16:11:22,654] Trial 129 finished with value: 0.1304819327328116 and parameters: {'model_type': 'mlp', 'hidden_dims': '[512, 256]', 'dropout': 0.19924769775186024, 'batch_norm': True, 'lr': 0.0009916812936178634, 'weight_decay': 0.0004580522078254209, 'epochs': 57, 'loss': 'mse', 'optimizer': 'adam', 'graph_mode': 'off', 'use_snp_selection': False}. Best is trial 55 with value: 0.15835618302911308.
[I 2025-12-05 16:11:24,507] Trial 130 finished with value: 0.1362345229165004 and parameters: {'model_type': 'mlp', 'hidden_dims': '[512, 128]', 'dropout': 0.1003966183450191, 'batch_norm': True, 'lr': 7.446698138427449e-06, 'weight_decay': 0.0005882536464880641, 'epochs': 95, 'loss': 'mae', 'optimizer': 'adam', 'graph_mode': 'off', 'use_snp_selection': False}. Best is trial 55 with value: 0.15835618302911308.
[I 2025-12-05 16:11:25,633] Trial 131 finished with value: 0.1222734186397039 and parameters: {'model_type': 'mlp', 'hidden_dims': '[256, 128, 64]', 'dropout': 0.15347597848569403, 'batch_norm': True, 'lr': 0.0002609757731370377, 'weight_decay': 1.150689730114809e-07, 'epochs': 75, 'loss': 'mae', 'optimizer': 'adam', 'graph_mode': 'off', 'use_snp_selection': False}. Best is trial 55 with value: 0.15835618302911308.
[I 2025-12-05 16:11:28,408] Trial 132 finished with value: 0.12046908853138971 and parameters: {'model_type': 'mlp', 'hidden_dims': '[512, 256]', 'dropout': 0.1728428697137683, 'batch_norm': True, 'lr': 0.0003217623891951523, 'weight_decay': 1.5545145689256856e-07, 'epochs': 65, 'loss': 'mae', 'optimizer': 'adam', 'graph_mode': 'off', 'use_snp_selection': True, 'num_snps': 33994}. Best is trial 55 with value: 0.15835618302911308.
[I 2025-12-05 16:11:29,595] Trial 133 finished with value: 0.1411812369301699 and parameters: {'model_type': 'mlp', 'hidden_dims': '[128, 64]', 'dropout': 0.13286988543163972, 'batch_norm': True, 'lr': 0.00038621018060795514, 'weight_decay': 1.9931351230460568e-07, 'epochs': 198, 'loss': 'mae', 'optimizer': 'adam', 'graph_mode': 'off', 'use_snp_selection': False}. Best is trial 55 with value: 0.15835618302911308.
[I 2025-12-05 16:11:31,515] Trial 134 finished with value: 0.12636716745303858 and parameters: {'model_type': 'mlp', 'hidden_dims': '[256, 128]', 'dropout': 0.12988431439699508, 'batch_norm': True, 'lr': 0.0005720640064555602, 'weight_decay': 1.8163986257213728e-07, 'epochs': 198, 'loss': 'mae', 'optimizer': 'adam', 'graph_mode': 'off', 'use_snp_selection': False}. Best is trial 55 with value: 0.15835618302911308.
[I 2025-12-05 16:11:34,910] Trial 135 finished with value: 0.017597115870706663 and parameters: {'model_type': 'mlp', 'hidden_dims': '[512, 256]', 'dropout': 0.13957827672801787, 'batch_norm': True, 'lr': 2.351998976930802e-06, 'weight_decay': 0.000993891412062786, 'epochs': 222, 'loss': 'mae', 'optimizer': 'adam', 'graph_mode': 'off', 'use_snp_selection': False}. Best is trial 55 with value: 0.15835618302911308.
[I 2025-12-05 16:11:38,410] Trial 136 finished with value: 0.1255906874128788 and parameters: {'model_type': 'mlp', 'hidden_dims': '[512, 128]', 'dropout': 0.3551798814947792, 'batch_norm': True, 'lr': 0.0004293974917946238, 'weight_decay': 0.0003606056879575059, 'epochs': 233, 'loss': 'mae', 'optimizer': 'adam', 'graph_mode': 'off', 'use_snp_selection': False}. Best is trial 55 with value: 0.15835618302911308.
[I 2025-12-05 16:11:39,650] Trial 137 finished with value: 0.1332620610119887 and parameters: {'model_type': 'mlp', 'hidden_dims': '[128, 64]', 'dropout': 0.1460852507505484, 'batch_norm': True, 'lr': 0.00039749168293884955, 'weight_decay': 1.5160535068105455e-07, 'epochs': 217, 'loss': 'mae', 'optimizer': 'adam', 'graph_mode': 'off', 'use_snp_selection': False}. Best is trial 55 with value: 0.15835618302911308.
[I 2025-12-05 16:11:42,545] Trial 138 finished with value: 0.12276771375198187 and parameters: {'model_type': 'mlp', 'hidden_dims': '[512, 64]', 'dropout': 0.11917531859597601, 'batch_norm': True, 'lr': 0.00022613878238112928, 'weight_decay': 1.1608322897970279e-07, 'epochs': 181, 'loss': 'mae', 'optimizer': 'adam', 'graph_mode': 'off', 'use_snp_selection': False}. Best is trial 55 with value: 0.15835618302911308.
[I 2025-12-05 16:11:45,577] Trial 139 finished with value: 0.11245820016625986 and parameters: {'model_type': 'mlp', 'hidden_dims': '[512, 256]', 'dropout': 0.1318810646475245, 'batch_norm': False, 'lr': 0.0005122720654220848, 'weight_decay': 3.9864251918434286e-07, 'epochs': 194, 'loss': 'mae', 'optimizer': 'adam', 'graph_mode': 'off', 'use_snp_selection': False}. Best is trial 55 with value: 0.15835618302911308.
[I 2025-12-05 16:11:47,529] Trial 140 finished with value: 0.12794449014841727 and parameters: {'model_type': 'mlp', 'hidden_dims': '[256, 128]', 'dropout': 0.10829414661051476, 'batch_norm': True, 'lr': 0.0006507545671201357, 'weight_decay': 2.086876107150318e-07, 'epochs': 204, 'loss': 'mae', 'optimizer': 'adam', 'graph_mode': 'off', 'use_snp_selection': False}. Best is trial 55 with value: 0.15835618302911308.
[I 2025-12-05 16:11:50,521] Trial 141 finished with value: 0.1456514217177779 and parameters: {'model_type': 'mlp', 'hidden_dims': '[128, 64]', 'dropout': 0.15011060011647043, 'batch_norm': True, 'lr': 0.000297508339255647, 'weight_decay': 2.5872753873798233e-07, 'epochs': 72, 'loss': 'mae', 'optimizer': 'adam', 'graph_mode': 'off', 'use_snp_selection': True, 'num_snps': 49136}. Best is trial 55 with value: 0.15835618302911308.
[I 2025-12-05 16:11:53,678] Trial 142 finished with value: 0.08764644747266735 and parameters: {'model_type': 'mlp', 'hidden_dims': '[128, 64]', 'dropout': 0.371852469194591, 'batch_norm': True, 'lr': 0.00029399619111007057, 'weight_decay': 2.698079334560527e-07, 'epochs': 47, 'loss': 'mae', 'optimizer': 'adam', 'graph_mode': 'off', 'use_snp_selection': True, 'num_snps': 56762}. Best is trial 55 with value: 0.15835618302911308.
[I 2025-12-05 16:11:54,448] Trial 143 finished with value: 0.1249410872116972 and parameters: {'model_type': 'mlp', 'hidden_dims': '[128, 64]', 'dropout': 0.1592234353071365, 'batch_norm': True, 'lr': 0.00036937421907770894, 'weight_decay': 1.852935843949553e-07, 'epochs': 55, 'loss': 'mae', 'optimizer': 'adam', 'graph_mode': 'off', 'use_snp_selection': False}. Best is trial 55 with value: 0.15835618302911308.
[I 2025-12-05 16:11:57,325] Trial 144 finished with value: 0.13045253157385883 and parameters: {'model_type': 'mlp', 'hidden_dims': '[128, 64]', 'dropout': 0.1471808653781688, 'batch_norm': True, 'lr': 0.00019672008880580746, 'weight_decay': 0.0004756176204720926, 'epochs': 119, 'loss': 'mae', 'optimizer': 'adam', 'graph_mode': 'off', 'use_snp_selection': True, 'num_snps': 49601}. Best is trial 55 with value: 0.15835618302911308.
[I 2025-12-05 16:11:58,101] Trial 145 finished with value: 0.13277244048852835 and parameters: {'model_type': 'mlp', 'hidden_dims': '[128, 64]', 'dropout': 0.18744237130719907, 'batch_norm': True, 'lr': 0.00045582088472901787, 'weight_decay': 0.0006808418702206003, 'epochs': 74, 'loss': 'mae', 'optimizer': 'adam', 'graph_mode': 'off', 'use_snp_selection': False}. Best is trial 55 with value: 0.15835618302911308.
[I 2025-12-05 16:12:02,697] Trial 146 finished with value: 0.11312614624528375 and parameters: {'model_type': 'mlp', 'hidden_dims': '[512, 256]', 'dropout': 0.12446686042832933, 'batch_norm': True, 'lr': 0.0005664289792581405, 'weight_decay': 4.849086435538025e-07, 'epochs': 211, 'loss': 'mse', 'optimizer': 'adam', 'graph_mode': 'off', 'use_snp_selection': True, 'num_snps': 46143}. Best is trial 55 with value: 0.15835618302911308.
[I 2025-12-05 16:12:06,156] Trial 147 finished with value: 0.13616446968939316 and parameters: {'model_type': 'mlp', 'hidden_dims': '[512, 128]', 'dropout': 0.17176436712285478, 'batch_norm': True, 'lr': 0.0008023875130879439, 'weight_decay': 1.3616261053226347e-07, 'epochs': 228, 'loss': 'mae', 'optimizer': 'adam', 'graph_mode': 'off', 'use_snp_selection': False}. Best is trial 55 with value: 0.15835618302911308.
[I 2025-12-05 16:12:09,600] Trial 148 finished with value: 0.15943618497947767 and parameters: {'model_type': 'mlp', 'hidden_dims': '[256, 128]', 'dropout': 0.1387664322419482, 'batch_norm': True, 'lr': 0.00024756837248426466, 'weight_decay': 3.286898014302174e-07, 'epochs': 153, 'loss': 'mae', 'optimizer': 'adam', 'graph_mode': 'off', 'use_snp_selection': True, 'num_snps': 51833}. Best is trial 148 with value: 0.15943618497947767.
[I 2025-12-05 16:12:11,750] Trial 149 finished with value: 0.13358009059188047 and parameters: {'model_type': 'mlp', 'hidden_dims': '[256, 128]', 'dropout': 0.15387393976598018, 'batch_norm': True, 'lr': 0.00011925570327949911, 'weight_decay': 3.449186106667589e-07, 'epochs': 241, 'loss': 'mae', 'optimizer': 'adam', 'graph_mode': 'off', 'use_snp_selection': False}. Best is trial 148 with value: 0.15943618497947767.
[I 2025-12-05 16:12:14,298] Trial 0 finished with value: 0.048834799359811526 and parameters: {'model_type': 'mlp', 'hidden_dims': '[128, 64]', 'dropout': 0.199031432379812, 'batch_norm': True, 'lr': 1.8408544111075837e-06, 'weight_decay': 5.5136510071208614e-05, 'epochs': 336, 'loss': 'mae', 'optimizer': 'adam', 'graph_mode': 'off', 'use_snp_selection': True, 'num_snps': 43862}. Best is trial 0 with value: 0.048834799359811526.
[I 2025-12-05 16:12:15,598] Trial 1 finished with value: 0.06599717438416529 and parameters: {'model_type': 'mlp', 'hidden_dims': '[256, 128]', 'dropout': 0.4370668075331726, 'batch_norm': True, 'lr': 7.133471581159139e-05, 'weight_decay': 1.128633586803549e-05, 'epochs': 242, 'loss': 'mae', 'optimizer': 'adam', 'graph_mode': 'off', 'use_snp_selection': False}. Best is trial 1 with value: 0.06599717438416529.
[I 2025-12-05 16:12:16,829] Trial 2 finished with value: 0.035931094400809625 and parameters: {'model_type': 'mlp', 'hidden_dims': '[256, 128, 64]', 'dropout': 0.41314357415569625, 'batch_norm': False, 'lr': 3.952233718592101e-06, 'weight_decay': 0.00026754769258252603, 'epochs': 149, 'loss': 'mse', 'optimizer': 'adam', 'graph_mode': 'off', 'use_snp_selection': True, 'num_snps': 11571}. Best is trial 1 with value: 0.06599717438416529.
[I 2025-12-05 16:12:19,356] Trial 3 finished with value: 0.06765258569173173 and parameters: {'model_type': 'mlp', 'hidden_dims': '[512, 64]', 'dropout': 0.5938127374509361, 'batch_norm': False, 'lr': 5.67704586114731e-06, 'weight_decay': 2.4518087630137052e-05, 'epochs': 320, 'loss': 'mae', 'optimizer': 'adam', 'graph_mode': 'off', 'use_snp_selection': False}. Best is trial 3 with value: 0.06765258569173173.
[I 2025-12-05 16:12:21,922] Trial 4 finished with value: -0.009691883623836904 and parameters: {'model_type': 'mlp', 'hidden_dims': '[512, 128]', 'dropout': 0.25746343592134413, 'batch_norm': True, 'lr': 1.3467657668402788e-06, 'weight_decay': 0.00033087251918647806, 'epochs': 277, 'loss': 'mse', 'optimizer': 'adam', 'graph_mode': 'off', 'use_snp_selection': True, 'num_snps': 36675}. Best is trial 3 with value: 0.06765258569173173.
[I 2025-12-05 16:12:23,966] Trial 5 finished with value: 0.05686863676268355 and parameters: {'model_type': 'mlp', 'hidden_dims': '[512, 64]', 'dropout': 0.38275350994408375, 'batch_norm': True, 'lr': 1.5586664309232824e-06, 'weight_decay': 0.0008227664668621182, 'epochs': 145, 'loss': 'mae', 'optimizer': 'adam', 'graph_mode': 'off', 'use_snp_selection': True, 'num_snps': 32148}. Best is trial 3 with value: 0.06765258569173173.
[I 2025-12-05 16:12:25,143] Trial 6 finished with value: 0.0619660998114176 and parameters: {'model_type': 'mlp', 'hidden_dims': '[256, 128]', 'dropout': 0.3930109900265879, 'batch_norm': False, 'lr': 4.892964372128395e-05, 'weight_decay': 1.5809549317992182e-06, 'epochs': 199, 'loss': 'mse', 'optimizer': 'adam', 'graph_mode': 'off', 'use_snp_selection': False}. Best is trial 3 with value: 0.06765258569173173.
[I 2025-12-05 16:12:26,473] Trial 7 finished with value: 0.0757189519249569 and parameters: {'model_type': 'mlp', 'hidden_dims': '[512, 256]', 'dropout': 0.15343979219678458, 'batch_norm': True, 'lr': 6.234003099047341e-05, 'weight_decay': 3.894760610535477e-07, 'epochs': 97, 'loss': 'mse', 'optimizer': 'adam', 'graph_mode': 'off', 'use_snp_selection': False}. Best is trial 7 with value: 0.0757189519249569.
[I 2025-12-05 16:12:29,008] Trial 8 finished with value: 0.0969003496076127 and parameters: {'model_type': 'mlp', 'hidden_dims': '[512, 128]', 'dropout': 0.10743001231661406, 'batch_norm': True, 'lr': 0.00023728538449271062, 'weight_decay': 1.7629071578048637e-05, 'epochs': 312, 'loss': 'mae', 'optimizer': 'adam', 'graph_mode': 'off', 'use_snp_selection': False}. Best is trial 8 with value: 0.0969003496076127.
[I 2025-12-05 16:12:30,746] Trial 9 finished with value: 0.085303536033871 and parameters: {'model_type': 'mlp', 'hidden_dims': '[512, 64]', 'dropout': 0.14505336736221927, 'batch_norm': True, 'lr': 5.8619638388111826e-05, 'weight_decay': 6.200156172669308e-07, 'epochs': 175, 'loss': 'mse', 'optimizer': 'adam', 'graph_mode': 'off', 'use_snp_selection': False}. Best is trial 8 with value: 0.0969003496076127.
[I 2025-12-05 16:12:31,807] Trial 10 finished with value: -0.00753639681320136 and parameters: {'model_type': 'mlp', 'hidden_dims': '[512, 128]', 'dropout': 0.2800030442581858, 'batch_norm': False, 'lr': 0.0004919806695968258, 'weight_decay': 2.9953888095455486e-06, 'epochs': 55, 'loss': 'mae', 'optimizer': 'adam', 'graph_mode': 'off', 'use_snp_selection': False}. Best is trial 8 with value: 0.0969003496076127.
[I 2025-12-05 16:12:33,749] Trial 11 finished with value: 0.11053973902787548 and parameters: {'model_type': 'mlp', 'hidden_dims': '[512, 128]', 'dropout': 0.10095648685224448, 'batch_norm': True, 'lr': 0.0003411435764085616, 'weight_decay': 1.2045055692919657e-07, 'epochs': 216, 'loss': 'mse', 'optimizer': 'adam', 'graph_mode': 'off', 'use_snp_selection': False}. Best is trial 11 with value: 0.11053973902787548.
[I 2025-12-05 16:12:35,962] Trial 12 finished with value: 0.10408073125130111 and parameters: {'model_type': 'mlp', 'hidden_dims': '[512, 128]', 'dropout': 0.10344600881777158, 'batch_norm': True, 'lr': 0.0006674532614549997, 'weight_decay': 1.3081036432574914e-07, 'epochs': 255, 'loss': 'mae', 'optimizer': 'adam', 'graph_mode': 'off', 'use_snp_selection': False}. Best is trial 11 with value: 0.11053973902787548.
[I 2025-12-05 16:12:38,083] Trial 13 finished with value: 0.07772119942011262 and parameters: {'model_type': 'mlp', 'hidden_dims': '[512, 128]', 'dropout': 0.22096278001553593, 'batch_norm': True, 'lr': 0.0005692918571972218, 'weight_decay': 1.0885943577911259e-07, 'epochs': 236, 'loss': 'mse', 'optimizer': 'adam', 'graph_mode': 'off', 'use_snp_selection': False}. Best is trial 11 with value: 0.11053973902787548.
[I 2025-12-05 16:12:40,239] Trial 14 finished with value: 0.0834420751508193 and parameters: {'model_type': 'mlp', 'hidden_dims': '[512, 128]', 'dropout': 0.3012984444538551, 'batch_norm': True, 'lr': 0.0002108574938852793, 'weight_decay': 1.0838231003431842e-07, 'epochs': 243, 'loss': 'mse', 'optimizer': 'adam', 'graph_mode': 'off', 'use_snp_selection': False}. Best is trial 11 with value: 0.11053973902787548.
[I 2025-12-05 16:12:41,261] Trial 15 finished with value: 0.11091910312757376 and parameters: {'model_type': 'mlp', 'hidden_dims': '[128, 64]', 'dropout': 0.10272160099215884, 'batch_norm': True, 'lr': 0.0008020255002946251, 'weight_decay': 3.9745576709552696e-07, 'epochs': 281, 'loss': 'mae', 'optimizer': 'adam', 'graph_mode': 'off', 'use_snp_selection': False}. Best is trial 15 with value: 0.11091910312757376.
[I 2025-12-05 16:12:42,154] Trial 16 finished with value: 0.07582490134270482 and parameters: {'model_type': 'mlp', 'hidden_dims': '[128, 64]', 'dropout': 0.558513902174278, 'batch_norm': True, 'lr': 0.00017549215405955411, 'weight_decay': 8.205536878789158e-07, 'epochs': 206, 'loss': 'mae', 'optimizer': 'adam', 'graph_mode': 'off', 'use_snp_selection': False}. Best is trial 15 with value: 0.11091910312757376.
