[I 2025-12-05 20:19:26,930] Trial 11 finished with value: 0.2167867771484852 and parameters: {'model_type': 'mlp', 'hidden_dims': '[512, 256]', 'dropout': 0.30438831352760154, 'batch_norm': False, 'lr': 1.6474108386126448e-05, 'weight_decay': 1.1557995186088584e-07, 'epochs': 77, 'loss': 'mse', 'optimizer': 'adam', 'graph_mode': 'off', 'use_snp_selection': False}. Best is trial 6 with value: 0.21718718115606386.
[I 2025-12-05 20:20:36,462] Trial 12 finished with value: 0.20771224157682977 and parameters: {'model_type': 'mlp', 'hidden_dims': '[512, 256]', 'dropout': 0.30345365279407, 'batch_norm': False, 'lr': 1.3209655691727925e-05, 'weight_decay': 1.3081036432574914e-07, 'epochs': 228, 'loss': 'mse', 'optimizer': 'adam', 'graph_mode': 'off', 'use_snp_selection': False}. Best is trial 6 with value: 0.21718718115606386.
[I 2025-12-05 20:21:08,397] Trial 13 finished with value: 0.21501207673517375 and parameters: {'model_type': 'mlp', 'hidden_dims': '[512, 256]', 'dropout': 0.3041365173646664, 'batch_norm': False, 'lr': 1.7059846107560612e-05, 'weight_decay': 2.215502086408347e-06, 'epochs': 90, 'loss': 'mse', 'optimizer': 'adam', 'graph_mode': 'off', 'use_snp_selection': False}. Best is trial 6 with value: 0.21718718115606386.
[I 2025-12-05 20:21:42,456] Trial 14 finished with value: 0.21531467434803986 and parameters: {'model_type': 'mlp', 'hidden_dims': '[256, 128]', 'dropout': 0.4777872496595318, 'batch_norm': False, 'lr': 0.0001457690241539883, 'weight_decay': 1.0514232802334672e-07, 'epochs': 203, 'loss': 'mse', 'optimizer': 'adam', 'graph_mode': 'off', 'use_snp_selection': False}. Best is trial 6 with value: 0.21718718115606386.
[I 2025-12-05 20:21:51,177] Trial 15 finished with value: 0.19064884975052512 and parameters: {'model_type': 'mlp', 'hidden_dims': '[128, 64]', 'dropout': 0.3283339992286779, 'batch_norm': False, 'lr': 1.6267534889505977e-05, 'weight_decay': 2.384785823589797e-06, 'epochs': 41, 'loss': 'mse', 'optimizer': 'adam', 'graph_mode': 'off', 'use_snp_selection': False}. Best is trial 6 with value: 0.21718718115606386.
[I 2025-12-05 20:22:14,005] Trial 16 finished with value: 0.20569552669321314 and parameters: {'model_type': 'mlp', 'hidden_dims': '[256, 128, 64]', 'dropout': 0.24875323535153587, 'batch_norm': False, 'lr': 0.0006223658498360614, 'weight_decay': 3.92175555783758e-07, 'epochs': 120, 'loss': 'mse', 'optimizer': 'adam', 'graph_mode': 'off', 'use_snp_selection': False}. Best is trial 6 with value: 0.21718718115606386.
[I 2025-12-05 20:22:46,409] Trial 17 finished with value: 0.2100446908205364 and parameters: {'model_type': 'mlp', 'hidden_dims': '[256, 128]', 'dropout': 0.3644351458078396, 'batch_norm': False, 'lr': 3.753147549884073e-05, 'weight_decay': 1.0934517988859599e-06, 'epochs': 189, 'loss': 'mse', 'optimizer': 'adam', 'graph_mode': 'off', 'use_snp_selection': False}. Best is trial 6 with value: 0.21718718115606386.
[I 2025-12-05 20:24:39,680] Trial 18 finished with value: 0.21084696106593848 and parameters: {'model_type': 'mlp', 'hidden_dims': '[512, 256]', 'dropout': 0.4838829734439946, 'batch_norm': False, 'lr': 5.895320539592683e-06, 'weight_decay': 5.399175074092964e-06, 'epochs': 266, 'loss': 'mse', 'optimizer': 'adam', 'graph_mode': 'off', 'use_snp_selection': True, 'num_snps': 58241}. Best is trial 6 with value: 0.21718718115606386.
[I 2025-12-05 20:25:06,885] Trial 19 finished with value: 0.21448136686823172 and parameters: {'model_type': 'mlp', 'hidden_dims': '[256, 128]', 'dropout': 0.24466856002194395, 'batch_norm': False, 'lr': 0.00011627090733844577, 'weight_decay': 2.0144633312027786e-07, 'epochs': 154, 'loss': 'mse', 'optimizer': 'adam', 'graph_mode': 'off', 'use_snp_selection': False}. Best is trial 6 with value: 0.21718718115606386.
[I 2025-12-05 20:25:33,996] Trial 20 finished with value: 0.21880708483171013 and parameters: {'model_type': 'mlp', 'hidden_dims': '[512, 256]', 'dropout': 0.4114385182054616, 'batch_norm': False, 'lr': 9.660113122115066e-06, 'weight_decay': 7.324492366601109e-07, 'epochs': 73, 'loss': 'mse', 'optimizer': 'adam', 'graph_mode': 'off', 'use_snp_selection': False}. Best is trial 20 with value: 0.21880708483171013.
[I 2025-12-05 20:26:04,147] Trial 21 finished with value: 0.21923757221159734 and parameters: {'model_type': 'mlp', 'hidden_dims': '[512, 256]', 'dropout': 0.43119079976994173, 'batch_norm': False, 'lr': 2.628402266887435e-05, 'weight_decay': 7.459376344706679e-07, 'epochs': 85, 'loss': 'mse', 'optimizer': 'adam', 'graph_mode': 'off', 'use_snp_selection': False}. Best is trial 21 with value: 0.21923757221159734.
[I 2025-12-05 20:26:44,554] Trial 22 finished with value: 0.2234372591751102 and parameters: {'model_type': 'mlp', 'hidden_dims': '[512, 256]', 'dropout': 0.44028436020040623, 'batch_norm': False, 'lr': 2.97569017988868e-05, 'weight_decay': 4.905653876075577e-06, 'epochs': 123, 'loss': 'mse', 'optimizer': 'adam', 'graph_mode': 'off', 'use_snp_selection': False}. Best is trial 22 with value: 0.2234372591751102.
[I 2025-12-05 20:27:10,170] Trial 23 finished with value: 0.22414481380283596 and parameters: {'model_type': 'mlp', 'hidden_dims': '[512, 256]', 'dropout': 0.45700288156596985, 'batch_norm': False, 'lr': 8.51730989210912e-06, 'weight_decay': 4.969378121587043e-06, 'epochs': 67, 'loss': 'mse', 'optimizer': 'adam', 'graph_mode': 'off', 'use_snp_selection': False}. Best is trial 23 with value: 0.22414481380283596.
[I 2025-12-05 20:27:49,491] Trial 24 finished with value: 0.21949705995063112 and parameters: {'model_type': 'mlp', 'hidden_dims': '[512, 256]', 'dropout': 0.5421068879818585, 'batch_norm': False, 'lr': 2.7013005792357815e-05, 'weight_decay': 5.001258575325163e-06, 'epochs': 119, 'loss': 'mse', 'optimizer': 'adam', 'graph_mode': 'off', 'use_snp_selection': False}. Best is trial 23 with value: 0.22414481380283596.
[I 2025-12-05 20:28:30,260] Trial 25 finished with value: 0.21692872157535067 and parameters: {'model_type': 'mlp', 'hidden_dims': '[512, 256]', 'dropout': 0.5721137536079982, 'batch_norm': False, 'lr': 2.6580190680958222e-05, 'weight_decay': 4.140030173201642e-06, 'epochs': 124, 'loss': 'mse', 'optimizer': 'adam', 'graph_mode': 'off', 'use_snp_selection': False}. Best is trial 23 with value: 0.22414481380283596.
[I 2025-12-05 20:29:01,984] Trial 26 finished with value: 0.12631066760634427 and parameters: {'model_type': 'mlp', 'hidden_dims': '[512, 256]', 'dropout': 0.5265988665760095, 'batch_norm': False, 'lr': 3.4503885552926233e-06, 'weight_decay': 7.335002665770718e-06, 'epochs': 115, 'loss': 'mse', 'optimizer': 'adam', 'graph_mode': 'off', 'use_snp_selection': True, 'num_snps': 3842}. Best is trial 23 with value: 0.22414481380283596.
[I 2025-12-05 20:29:25,489] Trial 27 finished with value: 0.19769157612702712 and parameters: {'model_type': 'mlp', 'hidden_dims': '[512, 256]', 'dropout': 0.4810045330871683, 'batch_norm': False, 'lr': 7.563345593384963e-06, 'weight_decay': 3.7728781986273995e-05, 'epochs': 60, 'loss': 'mae', 'optimizer': 'adam', 'graph_mode': 'off', 'use_snp_selection': False}. Best is trial 23 with value: 0.22414481380283596.
[I 2025-12-05 20:30:01,376] Trial 28 finished with value: 0.2066457670688031 and parameters: {'model_type': 'mlp', 'hidden_dims': '[512, 256]', 'dropout': 0.5446517125861267, 'batch_norm': False, 'lr': 2.776776792923058e-05, 'weight_decay': 7.90182777504812e-05, 'epochs': 107, 'loss': 'mse', 'optimizer': 'adam', 'graph_mode': 'off', 'use_snp_selection': False}. Best is trial 23 with value: 0.22414481380283596.
[I 2025-12-05 20:30:39,136] Trial 29 finished with value: 0.16119898033881688 and parameters: {'model_type': 'mlp', 'hidden_dims': '[128, 64]', 'dropout': 0.4540184348968538, 'batch_norm': False, 'lr': 2.8966762461994946e-06, 'weight_decay': 7.556740997596572e-05, 'epochs': 131, 'loss': 'mae', 'optimizer': 'adam', 'graph_mode': 'off', 'use_snp_selection': True, 'num_snps': 19468}. Best is trial 23 with value: 0.22414481380283596.
[I 2025-12-05 20:31:08,780] Trial 30 finished with value: 0.21955896003842246 and parameters: {'model_type': 'mlp', 'hidden_dims': '[256, 128, 64]', 'dropout': 0.4999971148942929, 'batch_norm': False, 'lr': 1.0393320449859489e-05, 'weight_decay': 1.3050045048437942e-05, 'epochs': 169, 'loss': 'mse', 'optimizer': 'adam', 'graph_mode': 'off', 'use_snp_selection': False}. Best is trial 23 with value: 0.22414481380283596.
[I 2025-12-05 20:31:37,429] Trial 31 finished with value: 0.21877905075517537 and parameters: {'model_type': 'mlp', 'hidden_dims': '[256, 128, 64]', 'dropout': 0.507987143710005, 'batch_norm': False, 'lr': 1.0626850990857163e-05, 'weight_decay': 1.0117629802940004e-05, 'epochs': 161, 'loss': 'mse', 'optimizer': 'adam', 'graph_mode': 'off', 'use_snp_selection': False}. Best is trial 23 with value: 0.22414481380283596.
[I 2025-12-05 20:32:07,578] Trial 32 finished with value: 0.21846933411451844 and parameters: {'model_type': 'mlp', 'hidden_dims': '[256, 128, 64]', 'dropout': 0.554127293798389, 'batch_norm': False, 'lr': 2.1326287195462875e-05, 'weight_decay': 3.394771338912019e-06, 'epochs': 172, 'loss': 'mse', 'optimizer': 'adam', 'graph_mode': 'off', 'use_snp_selection': False}. Best is trial 23 with value: 0.22414481380283596.
[I 2025-12-05 20:32:31,998] Trial 33 finished with value: 0.1659716443017198 and parameters: {'model_type': 'mlp', 'hidden_dims': '[256, 128, 64]', 'dropout': 0.4544553755415724, 'batch_norm': False, 'lr': 2.2920146119790223e-06, 'weight_decay': 1.4421923940419352e-05, 'epochs': 129, 'loss': 'mse', 'optimizer': 'adam', 'graph_mode': 'off', 'use_snp_selection': False}. Best is trial 23 with value: 0.22414481380283596.
[I 2025-12-05 20:32:46,947] Trial 34 finished with value: 0.169212536153336 and parameters: {'model_type': 'mlp', 'hidden_dims': '[256, 128, 64]', 'dropout': 0.5049866154270591, 'batch_norm': False, 'lr': 5.352487163745896e-06, 'weight_decay': 2.6213764752666e-05, 'epochs': 61, 'loss': 'mae', 'optimizer': 'adam', 'graph_mode': 'off', 'use_snp_selection': False}. Best is trial 23 with value: 0.22414481380283596.
[I 2025-12-05 20:33:08,263] Trial 35 finished with value: 0.2117053067822381 and parameters: {'model_type': 'mlp', 'hidden_dims': '[128, 64]', 'dropout': 0.596853196682366, 'batch_norm': True, 'lr': 3.919328310730697e-05, 'weight_decay': 7.299576041901273e-06, 'epochs': 216, 'loss': 'mse', 'optimizer': 'adam', 'graph_mode': 'off', 'use_snp_selection': False}. Best is trial 23 with value: 0.22414481380283596.
[I 2025-12-05 20:34:32,379] Trial 36 finished with value: 0.2192259894574034 and parameters: {'model_type': 'mlp', 'hidden_dims': '[512, 128]', 'dropout': 0.44922864807700713, 'batch_norm': False, 'lr': 0.00010242554533747736, 'weight_decay': 3.6166318901544112e-06, 'epochs': 148, 'loss': 'mse', 'optimizer': 'adam', 'graph_mode': 'off', 'use_snp_selection': True, 'num_snps': 58661}. Best is trial 23 with value: 0.22414481380283596.
[I 2025-12-05 20:35:06,119] Trial 37 finished with value: 0.2008338904146219 and parameters: {'model_type': 'mlp', 'hidden_dims': '[512, 64]', 'dropout': 0.5670445502633508, 'batch_norm': False, 'lr': 7.073738175603238e-06, 'weight_decay': 0.00015203581064735782, 'epochs': 99, 'loss': 'mae', 'optimizer': 'adam', 'graph_mode': 'off', 'use_snp_selection': False}. Best is trial 23 with value: 0.22414481380283596.
[I 2025-12-05 20:35:53,339] Trial 38 finished with value: 0.15291158009617684 and parameters: {'model_type': 'mlp', 'hidden_dims': '[512, 256]', 'dropout': 0.4162635504042479, 'batch_norm': True, 'lr': 1.0085539846117678e-05, 'weight_decay': 2.1579932242274643e-05, 'epochs': 142, 'loss': 'mse', 'optimizer': 'adam', 'graph_mode': 'off', 'use_snp_selection': True, 'num_snps': 19911}. Best is trial 23 with value: 0.22414481380283596.
[I 2025-12-05 20:36:25,414] Trial 39 finished with value: 0.1945120001880803 and parameters: {'model_type': 'mlp', 'hidden_dims': '[256, 128, 64]', 'dropout': 0.3763549641952814, 'batch_norm': False, 'lr': 1.1551364739465579e-06, 'weight_decay': 3.8455018339969256e-05, 'epochs': 186, 'loss': 'mse', 'optimizer': 'adam', 'graph_mode': 'off', 'use_snp_selection': False}. Best is trial 23 with value: 0.22414481380283596.
[I 2025-12-05 20:37:01,243] Trial 40 finished with value: 0.18677522067311886 and parameters: {'model_type': 'mlp', 'hidden_dims': '[512, 128]', 'dropout': 0.5035590111732432, 'batch_norm': True, 'lr': 4.570230950345396e-06, 'weight_decay': 1.1043342292186808e-05, 'epochs': 105, 'loss': 'mae', 'optimizer': 'adam', 'graph_mode': 'off', 'use_snp_selection': False}. Best is trial 23 with value: 0.22414481380283596.
[I 2025-12-05 20:37:29,390] Trial 41 finished with value: 0.2252617680500248 and parameters: {'model_type': 'mlp', 'hidden_dims': '[512, 256]', 'dropout': 0.4290058739081786, 'batch_norm': False, 'lr': 2.1058143546770188e-05, 'weight_decay': 1.1853669434685549e-06, 'epochs': 77, 'loss': 'mse', 'optimizer': 'adam', 'graph_mode': 'off', 'use_snp_selection': False}. Best is trial 41 with value: 0.2252617680500248.
[I 2025-12-05 20:37:52,751] Trial 42 finished with value: 0.2186477831803796 and parameters: {'model_type': 'mlp', 'hidden_dims': '[512, 256]', 'dropout': 0.3996414961699289, 'batch_norm': False, 'lr': 4.6289335756811016e-05, 'weight_decay': 1.2442770683940206e-06, 'epochs': 60, 'loss': 'mse', 'optimizer': 'adam', 'graph_mode': 'off', 'use_snp_selection': False}. Best is trial 41 with value: 0.2252617680500248.
[I 2025-12-05 20:38:19,598] Trial 43 finished with value: 0.22068247686213582 and parameters: {'model_type': 'mlp', 'hidden_dims': '[512, 256]', 'dropout': 0.4701506999195749, 'batch_norm': False, 'lr': 7.253009906836702e-05, 'weight_decay': 6.001037151753958e-06, 'epochs': 73, 'loss': 'mse', 'optimizer': 'adam', 'graph_mode': 'off', 'use_snp_selection': False}. Best is trial 41 with value: 0.2252617680500248.
[I 2025-12-05 20:38:44,799] Trial 44 finished with value: 0.22391501557573007 and parameters: {'model_type': 'mlp', 'hidden_dims': '[512, 256]', 'dropout': 0.4695192909041757, 'batch_norm': False, 'lr': 7.376621676079005e-05, 'weight_decay': 2.842287337420879e-06, 'epochs': 67, 'loss': 'mse', 'optimizer': 'adam', 'graph_mode': 'off', 'use_snp_selection': False}. Best is trial 41 with value: 0.2252617680500248.
[I 2025-12-05 20:39:11,607] Trial 45 finished with value: 0.2251515954076761 and parameters: {'model_type': 'mlp', 'hidden_dims': '[512, 256]', 'dropout': 0.35019224605660193, 'batch_norm': False, 'lr': 9.468201753141677e-05, 'weight_decay': 2.720706681247031e-06, 'epochs': 73, 'loss': 'mse', 'optimizer': 'adam', 'graph_mode': 'off', 'use_snp_selection': False}. Best is trial 41 with value: 0.2252617680500248.
[I 2025-12-05 20:39:33,330] Trial 46 finished with value: 0.22467039831887506 and parameters: {'model_type': 'mlp', 'hidden_dims': '[512, 256]', 'dropout': 0.3475355331695298, 'batch_norm': True, 'lr': 0.00024781223196303296, 'weight_decay': 2.3663680364104773e-06, 'epochs': 52, 'loss': 'mse', 'optimizer': 'adam', 'graph_mode': 'off', 'use_snp_selection': False}. Best is trial 41 with value: 0.2252617680500248.
[I 2025-12-05 20:39:54,987] Trial 47 finished with value: 0.21309529405348876 and parameters: {'model_type': 'mlp', 'hidden_dims': '[512, 256]', 'dropout': 0.3485362149247432, 'batch_norm': True, 'lr': 0.00022726701837954001, 'weight_decay': 1.4353916844496612e-06, 'epochs': 52, 'loss': 'mse', 'optimizer': 'adam', 'graph_mode': 'off', 'use_snp_selection': False}. Best is trial 41 with value: 0.2252617680500248.
[I 2025-12-05 20:40:25,588] Trial 48 finished with value: 0.211529973434678 and parameters: {'model_type': 'mlp', 'hidden_dims': '[512, 64]', 'dropout': 0.3267652264705011, 'batch_norm': True, 'lr': 0.0004806843815284873, 'weight_decay': 3.0008409192564104e-06, 'epochs': 85, 'loss': 'mse', 'optimizer': 'adam', 'graph_mode': 'off', 'use_snp_selection': False}. Best is trial 41 with value: 0.2252617680500248.
[I 2025-12-05 20:42:18,952] Trial 49 finished with value: 0.21118954697229478 and parameters: {'model_type': 'mlp', 'hidden_dims': '[512, 256]', 'dropout': 0.2759120063354237, 'batch_norm': True, 'lr': 0.00017792797835012805, 'weight_decay': 3.946637445760036e-07, 'epochs': 343, 'loss': 'mse', 'optimizer': 'adam', 'graph_mode': 'off', 'use_snp_selection': True, 'num_snps': 46888}. Best is trial 41 with value: 0.2252617680500248.
[I 2025-12-05 20:42:37,908] Trial 50 finished with value: 0.21593947397269925 and parameters: {'model_type': 'mlp', 'hidden_dims': '[512, 256]', 'dropout': 0.21338423396245543, 'batch_norm': True, 'lr': 0.0002991780015386373, 'weight_decay': 1.7698298030933502e-06, 'epochs': 42, 'loss': 'mse', 'optimizer': 'adam', 'graph_mode': 'off', 'use_snp_selection': False}. Best is trial 41 with value: 0.2252617680500248.
[I 2025-12-05 20:43:04,418] Trial 51 finished with value: 0.2121748504266472 and parameters: {'model_type': 'mlp', 'hidden_dims': '[512, 256]', 'dropout': 0.42870700449676047, 'batch_norm': True, 'lr': 7.80867478132227e-05, 'weight_decay': 9.897276609059718e-07, 'epochs': 70, 'loss': 'mse', 'optimizer': 'adam', 'graph_mode': 'off', 'use_snp_selection': False}. Best is trial 41 with value: 0.2252617680500248.
[I 2025-12-05 20:43:36,221] Trial 52 finished with value: 0.21402654896085388 and parameters: {'model_type': 'mlp', 'hidden_dims': '[512, 256]', 'dropout': 0.35151338171985624, 'batch_norm': False, 'lr': 0.00010569476593667999, 'weight_decay': 2.5237405162655907e-06, 'epochs': 92, 'loss': 'mse', 'optimizer': 'adam', 'graph_mode': 'off', 'use_snp_selection': False}. Best is trial 41 with value: 0.2252617680500248.
[I 2025-12-05 20:43:57,426] Trial 53 finished with value: 0.20522175490514255 and parameters: {'model_type': 'mlp', 'hidden_dims': '[512, 256]', 'dropout': 0.3887869275999218, 'batch_norm': False, 'lr': 5.307831191254052e-05, 'weight_decay': 1.7427640189564363e-06, 'epochs': 52, 'loss': 'mse', 'optimizer': 'adam', 'graph_mode': 'off', 'use_snp_selection': False}. Best is trial 41 with value: 0.2252617680500248.
[I 2025-12-05 20:44:25,998] Trial 54 finished with value: 0.23112022995098971 and parameters: {'model_type': 'mlp', 'hidden_dims': '[512, 256]', 'dropout': 0.3244889398074725, 'batch_norm': False, 'lr': 0.00015905040529082566, 'weight_decay': 5.73907225040492e-07, 'epochs': 80, 'loss': 'mse', 'optimizer': 'adam', 'graph_mode': 'off', 'use_snp_selection': False}. Best is trial 54 with value: 0.23112022995098971.
[I 2025-12-05 20:44:56,161] Trial 55 finished with value: 0.21216030538265965 and parameters: {'model_type': 'mlp', 'hidden_dims': '[512, 256]', 'dropout': 0.3274741655490617, 'batch_norm': True, 'lr': 0.0008867689603414763, 'weight_decay': 2.565094617664793e-07, 'epochs': 83, 'loss': 'mse', 'optimizer': 'adam', 'graph_mode': 'off', 'use_snp_selection': False}. Best is trial 54 with value: 0.23112022995098971.
[I 2025-12-05 20:45:20,544] Trial 56 finished with value: 0.21465477065531177 and parameters: {'model_type': 'mlp', 'hidden_dims': '[512, 256]', 'dropout': 0.2869195628166378, 'batch_norm': False, 'lr': 0.00014930805041332902, 'weight_decay': 6.193908238467754e-07, 'epochs': 64, 'loss': 'mse', 'optimizer': 'adam', 'graph_mode': 'off', 'use_snp_selection': False}. Best is trial 54 with value: 0.23112022995098971.
[I 2025-12-05 20:45:38,764] Trial 57 finished with value: 0.01466814135219266 and parameters: {'model_type': 'mlp', 'hidden_dims': '[512, 128]', 'dropout': 0.3670956426060622, 'batch_norm': False, 'lr': 0.00041111190665918726, 'weight_decay': 4.6878416574941617e-07, 'epochs': 41, 'loss': 'mse', 'optimizer': 'adam', 'graph_mode': 'off', 'use_snp_selection': False}. Best is trial 54 with value: 0.23112022995098971.
[I 2025-12-05 20:47:09,438] Trial 58 finished with value: 0.20594727361949805 and parameters: {'model_type': 'mlp', 'hidden_dims': '[512, 256]', 'dropout': 0.40228275019692983, 'batch_norm': False, 'lr': 0.0002060934065218492, 'weight_decay': 8.606771103950714e-07, 'epochs': 313, 'loss': 'mse', 'optimizer': 'adam', 'graph_mode': 'off', 'use_snp_selection': False}. Best is trial 54 with value: 0.23112022995098971.
[I 2025-12-05 20:47:21,857] Trial 59 finished with value: 0.20237031519340962 and parameters: {'model_type': 'mlp', 'hidden_dims': '[128, 64]', 'dropout': 0.3464380304881393, 'batch_norm': False, 'lr': 8.134013251125947e-05, 'weight_decay': 2.0185389668636742e-07, 'epochs': 95, 'loss': 'mae', 'optimizer': 'adam', 'graph_mode': 'off', 'use_snp_selection': False}. Best is trial 54 with value: 0.23112022995098971.
[I 2025-12-05 20:47:39,041] Trial 60 finished with value: 0.21351800939098292 and parameters: {'model_type': 'mlp', 'hidden_dims': '[256, 128]', 'dropout': 0.27228558995405316, 'batch_norm': True, 'lr': 0.0003018729414576608, 'weight_decay': 1.172012103623933e-06, 'epochs': 77, 'loss': 'mse', 'optimizer': 'adam', 'graph_mode': 'off', 'use_snp_selection': False}. Best is trial 54 with value: 0.23112022995098971.
[I 2025-12-05 20:48:00,474] Trial 61 finished with value: 0.209249155226289 and parameters: {'model_type': 'mlp', 'hidden_dims': '[512, 256]', 'dropout': 0.42417783964919636, 'batch_norm': False, 'lr': 0.00013930718981046552, 'weight_decay': 2.425984660157695e-06, 'epochs': 53, 'loss': 'mse', 'optimizer': 'adam', 'graph_mode': 'off', 'use_snp_selection': False}. Best is trial 54 with value: 0.23112022995098971.
[I 2025-12-05 20:48:35,930] Trial 62 finished with value: 0.22248459710581328 and parameters: {'model_type': 'mlp', 'hidden_dims': '[512, 256]', 'dropout': 0.4609269881892852, 'batch_norm': False, 'lr': 1.4460974938311867e-05, 'weight_decay': 5.537650706947282e-06, 'epochs': 104, 'loss': 'mse', 'optimizer': 'adam', 'graph_mode': 'off', 'use_snp_selection': False}. Best is trial 54 with value: 0.23112022995098971.
