[I 2025-12-05 14:46:18,412] Trial 20 finished with value: 0.04572526947120595 and parameters: {'model_type': 'mlp', 'hidden_dims': '[256, 128]', 'dropout': 0.5261159530557956, 'batch_norm': False, 'lr': 0.0005313055587407805, 'weight_decay': 0.00017680016161656075, 'epochs': 73, 'loss': 'mse', 'optimizer': 'adam', 'graph_mode': 'off', 'use_snp_selection': True, 'num_snps': 57703}. Best is trial 18 with value: 0.11411391432010902.
[I 2025-12-05 14:46:19,713] Trial 21 finished with value: 0.03833023277223894 and parameters: {'model_type': 'mlp', 'hidden_dims': '[256, 128]', 'dropout': 0.43591467949744034, 'batch_norm': False, 'lr': 2.7977930747174584e-05, 'weight_decay': 6.657064426874852e-06, 'epochs': 209, 'loss': 'mse', 'optimizer': 'adam', 'graph_mode': 'off', 'use_snp_selection': True, 'num_snps': 11878}. Best is trial 18 with value: 0.11411391432010902.
[I 2025-12-05 14:46:21,275] Trial 22 finished with value: 0.07041624319281342 and parameters: {'model_type': 'mlp', 'hidden_dims': '[256, 128]', 'dropout': 0.49458226456786025, 'batch_norm': False, 'lr': 0.0007539579177393196, 'weight_decay': 2.0659303325757547e-05, 'epochs': 178, 'loss': 'mse', 'optimizer': 'adam', 'graph_mode': 'off', 'use_snp_selection': True, 'num_snps': 22259}. Best is trial 18 with value: 0.11411391432010902.
[I 2025-12-05 14:46:23,939] Trial 23 finished with value: 0.06136610112302791 and parameters: {'model_type': 'mlp', 'hidden_dims': '[256, 128]', 'dropout': 0.36137681115975895, 'batch_norm': True, 'lr': 1.0628034687362993e-05, 'weight_decay': 1.4454366392221173e-05, 'epochs': 226, 'loss': 'mae', 'optimizer': 'adam', 'graph_mode': 'off', 'use_snp_selection': True, 'num_snps': 46925}. Best is trial 18 with value: 0.11411391432010902.
[I 2025-12-05 14:46:25,455] Trial 24 finished with value: 0.06439429576974862 and parameters: {'model_type': 'mlp', 'hidden_dims': '[256, 128]', 'dropout': 0.43659571158317556, 'batch_norm': False, 'lr': 0.00010307505106809837, 'weight_decay': 4.2126242985898195e-06, 'epochs': 272, 'loss': 'mse', 'optimizer': 'adam', 'graph_mode': 'off', 'use_snp_selection': False}. Best is trial 18 with value: 0.11411391432010902.
[I 2025-12-05 14:46:26,872] Trial 25 finished with value: 0.08153674527228127 and parameters: {'model_type': 'mlp', 'hidden_dims': '[256, 128, 64]', 'dropout': 0.43685604077743717, 'batch_norm': False, 'lr': 3.733119632901007e-05, 'weight_decay': 3.2979146657524975e-05, 'epochs': 251, 'loss': 'mse', 'optimizer': 'adam', 'graph_mode': 'off', 'use_snp_selection': False}. Best is trial 18 with value: 0.11411391432010902.
[I 2025-12-05 14:46:27,850] Trial 26 finished with value: 0.07652742622295945 and parameters: {'model_type': 'mlp', 'hidden_dims': '[512, 256]', 'dropout': 0.5069455652653113, 'batch_norm': True, 'lr': 0.00027613557033854234, 'weight_decay': 0.00014096943224065547, 'epochs': 145, 'loss': 'mae', 'optimizer': 'adam', 'graph_mode': 'off', 'use_snp_selection': True, 'num_snps': 2344}. Best is trial 18 with value: 0.11411391432010902.
[I 2025-12-05 14:46:28,744] Trial 27 finished with value: 0.05945996616641077 and parameters: {'model_type': 'mlp', 'hidden_dims': '[128, 64]', 'dropout': 0.3110352356969266, 'batch_norm': False, 'lr': 2.5859998003912627e-06, 'weight_decay': 8.986187725856165e-07, 'epochs': 190, 'loss': 'mse', 'optimizer': 'adam', 'graph_mode': 'off', 'use_snp_selection': False}. Best is trial 18 with value: 0.11411391432010902.
[I 2025-12-05 14:46:32,453] Trial 28 finished with value: 0.06311839385495605 and parameters: {'model_type': 'mlp', 'hidden_dims': '[512, 128]', 'dropout': 0.566313116551328, 'batch_norm': True, 'lr': 2.51911038565132e-05, 'weight_decay': 2.3751930590248514e-07, 'epochs': 295, 'loss': 'mae', 'optimizer': 'adam', 'graph_mode': 'off', 'use_snp_selection': True, 'num_snps': 48700}. Best is trial 18 with value: 0.11411391432010902.
[I 2025-12-05 14:46:34,505] Trial 29 finished with value: 0.07067865953450789 and parameters: {'model_type': 'mlp', 'hidden_dims': '[128, 64]', 'dropout': 0.2769554157843872, 'batch_norm': True, 'lr': 0.0009401051573095968, 'weight_decay': 8.369413239222784e-05, 'epochs': 338, 'loss': 'mae', 'optimizer': 'adam', 'graph_mode': 'off', 'use_snp_selection': True, 'num_snps': 26940}. Best is trial 18 with value: 0.11411391432010902.
[I 2025-12-05 14:46:35,821] Trial 30 finished with value: 0.09789486990736863 and parameters: {'model_type': 'mlp', 'hidden_dims': '[256, 128]', 'dropout': 0.3612888232457831, 'batch_norm': False, 'lr': 9.859759743684195e-06, 'weight_decay': 3.226026689927448e-05, 'epochs': 224, 'loss': 'mse', 'optimizer': 'adam', 'graph_mode': 'off', 'use_snp_selection': False}. Best is trial 18 with value: 0.11411391432010902.
[I 2025-12-05 14:46:37,133] Trial 31 finished with value: 0.04939005055158536 and parameters: {'model_type': 'mlp', 'hidden_dims': '[256, 128]', 'dropout': 0.3550960265073595, 'batch_norm': False, 'lr': 9.543918107164728e-06, 'weight_decay': 4.458112577258841e-05, 'epochs': 220, 'loss': 'mse', 'optimizer': 'adam', 'graph_mode': 'off', 'use_snp_selection': False}. Best is trial 18 with value: 0.11411391432010902.
[I 2025-12-05 14:46:38,390] Trial 32 finished with value: 0.06547038050357244 and parameters: {'model_type': 'mlp', 'hidden_dims': '[256, 128]', 'dropout': 0.41349115481892296, 'batch_norm': False, 'lr': 3.2242049299417058e-06, 'weight_decay': 1.0369156095452409e-05, 'epochs': 197, 'loss': 'mse', 'optimizer': 'adam', 'graph_mode': 'off', 'use_snp_selection': False}. Best is trial 18 with value: 0.11411391432010902.
[I 2025-12-05 14:46:39,539] Trial 33 finished with value: 0.04844982183521077 and parameters: {'model_type': 'mlp', 'hidden_dims': '[256, 128]', 'dropout': 0.224008853116206, 'batch_norm': False, 'lr': 5.105244925962432e-06, 'weight_decay': 3.067990586495529e-05, 'epochs': 162, 'loss': 'mse', 'optimizer': 'adam', 'graph_mode': 'off', 'use_snp_selection': False}. Best is trial 18 with value: 0.11411391432010902.
[I 2025-12-05 14:46:40,943] Trial 34 finished with value: 0.04320660261166443 and parameters: {'model_type': 'mlp', 'hidden_dims': '[256, 128, 64]', 'dropout': 0.40200337659845, 'batch_norm': False, 'lr': 1.7314620437324168e-05, 'weight_decay': 0.00010122502323190741, 'epochs': 253, 'loss': 'mse', 'optimizer': 'adam', 'graph_mode': 'off', 'use_snp_selection': False}. Best is trial 18 with value: 0.11411391432010902.
[I 2025-12-05 14:46:42,421] Trial 35 finished with value: 0.05464535461045254 and parameters: {'model_type': 'mlp', 'hidden_dims': '[512, 64]', 'dropout': 0.4501167721396555, 'batch_norm': False, 'lr': 1.0314255209296193e-06, 'weight_decay': 0.0003167836833871256, 'epochs': 122, 'loss': 'mse', 'optimizer': 'adam', 'graph_mode': 'off', 'use_snp_selection': False}. Best is trial 18 with value: 0.11411391432010902.
[I 2025-12-05 14:46:44,609] Trial 36 finished with value: 0.0643671501596347 and parameters: {'model_type': 'mlp', 'hidden_dims': '[256, 128]', 'dropout': 0.376211642036331, 'batch_norm': False, 'lr': 8.1716190709444e-06, 'weight_decay': 2.5295790691049805e-06, 'epochs': 227, 'loss': 'mse', 'optimizer': 'adam', 'graph_mode': 'off', 'use_snp_selection': True, 'num_snps': 38703}. Best is trial 18 with value: 0.11411391432010902.
[I 2025-12-05 14:46:45,810] Trial 37 finished with value: -0.0039511618909740896 and parameters: {'model_type': 'mlp', 'hidden_dims': '[256, 128]', 'dropout': 0.5664224964103527, 'batch_norm': True, 'lr': 4.329327358696834e-06, 'weight_decay': 0.0006057160914412838, 'epochs': 192, 'loss': 'mae', 'optimizer': 'adam', 'graph_mode': 'off', 'use_snp_selection': False}. Best is trial 18 with value: 0.11411391432010902.
[I 2025-12-05 14:46:49,818] Trial 38 finished with value: 0.08903582004639145 and parameters: {'model_type': 'mlp', 'hidden_dims': '[512, 128]', 'dropout': 0.4035982589590173, 'batch_norm': False, 'lr': 3.9865551376140124e-05, 'weight_decay': 1.3805113143320985e-05, 'epochs': 281, 'loss': 'mse', 'optimizer': 'adam', 'graph_mode': 'off', 'use_snp_selection': True, 'num_snps': 58812}. Best is trial 18 with value: 0.11411391432010902.
[I 2025-12-05 14:46:52,430] Trial 39 finished with value: 0.08323216660103394 and parameters: {'model_type': 'mlp', 'hidden_dims': '[512, 64]', 'dropout': 0.5979541964709264, 'batch_norm': True, 'lr': 6.65154111476475e-05, 'weight_decay': 3.647376180132787e-05, 'epochs': 305, 'loss': 'mse', 'optimizer': 'adam', 'graph_mode': 'off', 'use_snp_selection': False}. Best is trial 18 with value: 0.11411391432010902.
[I 2025-12-05 14:46:54,406] Trial 40 finished with value: 0.07137173738694308 and parameters: {'model_type': 'mlp', 'hidden_dims': '[512, 256]', 'dropout': 0.33783247736546895, 'batch_norm': False, 'lr': 0.00016230583149227327, 'weight_decay': 8.055804892203511e-06, 'epochs': 208, 'loss': 'mae', 'optimizer': 'adam', 'graph_mode': 'off', 'use_snp_selection': False}. Best is trial 18 with value: 0.11411391432010902.
[I 2025-12-05 14:46:55,601] Trial 41 finished with value: 0.07970150122193759 and parameters: {'model_type': 'mlp', 'hidden_dims': '[256, 128]', 'dropout': 0.38194616634293943, 'batch_norm': False, 'lr': 5.740789744343554e-05, 'weight_decay': 1.9203696647598605e-06, 'epochs': 200, 'loss': 'mse', 'optimizer': 'adam', 'graph_mode': 'off', 'use_snp_selection': False}. Best is trial 18 with value: 0.11411391432010902.
[I 2025-12-05 14:46:56,937] Trial 42 finished with value: 0.06355043782386402 and parameters: {'model_type': 'mlp', 'hidden_dims': '[256, 128]', 'dropout': 0.497210110983297, 'batch_norm': False, 'lr': 1.2385351696075492e-05, 'weight_decay': 1.4236932925193566e-06, 'epochs': 237, 'loss': 'mse', 'optimizer': 'adam', 'graph_mode': 'off', 'use_snp_selection': False}. Best is trial 18 with value: 0.11411391432010902.
[I 2025-12-05 14:46:58,289] Trial 43 finished with value: 0.08380755633428673 and parameters: {'model_type': 'mlp', 'hidden_dims': '[256, 128]', 'dropout': 0.4084286988060103, 'batch_norm': False, 'lr': 4.4530469159193193e-05, 'weight_decay': 5.112610738287099e-07, 'epochs': 255, 'loss': 'mse', 'optimizer': 'adam', 'graph_mode': 'off', 'use_snp_selection': False}. Best is trial 18 with value: 0.11411391432010902.
[I 2025-12-05 14:46:59,343] Trial 44 finished with value: 0.06926306231313199 and parameters: {'model_type': 'mlp', 'hidden_dims': '[256, 128]', 'dropout': 0.4601438371144097, 'batch_norm': False, 'lr': 8.616014345069533e-05, 'weight_decay': 3.571953091354845e-06, 'epochs': 150, 'loss': 'mse', 'optimizer': 'adam', 'graph_mode': 'off', 'use_snp_selection': False}. Best is trial 18 with value: 0.11411391432010902.
[I 2025-12-05 14:47:00,541] Trial 45 finished with value: 0.0762975895828796 and parameters: {'model_type': 'mlp', 'hidden_dims': '[256, 128]', 'dropout': 0.2824854472794322, 'batch_norm': True, 'lr': 0.0004204700994098158, 'weight_decay': 5.522839475958909e-06, 'epochs': 181, 'loss': 'mse', 'optimizer': 'adam', 'graph_mode': 'off', 'use_snp_selection': False}. Best is trial 18 with value: 0.11411391432010902.
[I 2025-12-05 14:47:02,251] Trial 46 finished with value: 0.06669665432834843 and parameters: {'model_type': 'mlp', 'hidden_dims': '[512, 128]', 'dropout': 0.42585644806933665, 'batch_norm': False, 'lr': 0.00019006735514051818, 'weight_decay': 1.814278567271881e-05, 'epochs': 162, 'loss': 'mae', 'optimizer': 'adam', 'graph_mode': 'off', 'use_snp_selection': False}. Best is trial 18 with value: 0.11411391432010902.
[I 2025-12-05 14:47:03,637] Trial 47 finished with value: 0.0803583682586425 and parameters: {'model_type': 'mlp', 'hidden_dims': '[256, 128]', 'dropout': 0.3889634946251875, 'batch_norm': False, 'lr': 2.463909257875506e-05, 'weight_decay': 8.743171321608326e-07, 'epochs': 266, 'loss': 'mse', 'optimizer': 'adam', 'graph_mode': 'off', 'use_snp_selection': False}. Best is trial 18 with value: 0.11411391432010902.
[I 2025-12-05 14:47:04,632] Trial 48 finished with value: 0.004538744907022487 and parameters: {'model_type': 'mlp', 'hidden_dims': '[128, 64]', 'dropout': 0.481415057139957, 'batch_norm': True, 'lr': 1.4366295984694303e-05, 'weight_decay': 4.783496367101682e-06, 'epochs': 237, 'loss': 'mse', 'optimizer': 'adam', 'graph_mode': 'off', 'use_snp_selection': False}. Best is trial 18 with value: 0.11411391432010902.
[I 2025-12-05 14:47:06,259] Trial 49 finished with value: 0.026894406226414494 and parameters: {'model_type': 'mlp', 'hidden_dims': '[512, 64]', 'dropout': 0.32306595864699017, 'batch_norm': False, 'lr': 2.1262132304019993e-06, 'weight_decay': 2.6608540299242467e-05, 'epochs': 211, 'loss': 'mae', 'optimizer': 'adam', 'graph_mode': 'off', 'use_snp_selection': True, 'num_snps': 19473}. Best is trial 18 with value: 0.11411391432010902.
[I 2025-12-05 14:47:07,277] Trial 50 finished with value: 0.06565260612955358 and parameters: {'model_type': 'mlp', 'hidden_dims': '[256, 128]', 'dropout': 0.5149657100234524, 'batch_norm': False, 'lr': 2.0636454805025255e-05, 'weight_decay': 2.850529516360954e-07, 'epochs': 135, 'loss': 'mse', 'optimizer': 'adam', 'graph_mode': 'off', 'use_snp_selection': False}. Best is trial 18 with value: 0.11411391432010902.
[I 2025-12-05 14:47:11,427] Trial 51 finished with value: 0.07200764464870096 and parameters: {'model_type': 'mlp', 'hidden_dims': '[512, 128]', 'dropout': 0.39385995041869903, 'batch_norm': False, 'lr': 3.7618626352828366e-05, 'weight_decay': 1.3607412671652056e-05, 'epochs': 296, 'loss': 'mse', 'optimizer': 'adam', 'graph_mode': 'off', 'use_snp_selection': True, 'num_snps': 59780}. Best is trial 18 with value: 0.11411391432010902.
[I 2025-12-05 14:47:15,219] Trial 52 finished with value: 0.07141538308680725 and parameters: {'model_type': 'mlp', 'hidden_dims': '[512, 128]', 'dropout': 0.36230983948683493, 'batch_norm': False, 'lr': 4.7670256233842666e-05, 'weight_decay': 1.1829265875418032e-05, 'epochs': 317, 'loss': 'mse', 'optimizer': 'adam', 'graph_mode': 'off', 'use_snp_selection': True, 'num_snps': 51577}. Best is trial 18 with value: 0.11411391432010902.
[I 2025-12-05 14:47:18,375] Trial 53 finished with value: 0.08444242078769752 and parameters: {'model_type': 'mlp', 'hidden_dims': '[512, 128]', 'dropout': 0.4520545914920593, 'batch_norm': False, 'lr': 7.025398713558134e-06, 'weight_decay': 2.1405358798359204e-05, 'epochs': 283, 'loss': 'mse', 'optimizer': 'adam', 'graph_mode': 'off', 'use_snp_selection': True, 'num_snps': 41667}. Best is trial 18 with value: 0.11411391432010902.
[I 2025-12-05 14:47:22,013] Trial 54 finished with value: 0.05249297778161844 and parameters: {'model_type': 'mlp', 'hidden_dims': '[512, 128]', 'dropout': 0.5398896157223712, 'batch_norm': False, 'lr': 8.530988443817444e-05, 'weight_decay': 5.742580998749829e-05, 'epochs': 247, 'loss': 'mse', 'optimizer': 'adam', 'graph_mode': 'off', 'use_snp_selection': True, 'num_snps': 53832}. Best is trial 18 with value: 0.11411391432010902.
[I 2025-12-05 14:47:24,734] Trial 55 finished with value: 0.07800164679948292 and parameters: {'model_type': 'mlp', 'hidden_dims': '[256, 128, 64]', 'dropout': 0.42031290809256616, 'batch_norm': False, 'lr': 1.4520827543247981e-05, 'weight_decay': 7.439712459929637e-06, 'epochs': 223, 'loss': 'mse', 'optimizer': 'adam', 'graph_mode': 'off', 'use_snp_selection': True, 'num_snps': 49721}. Best is trial 18 with value: 0.11411391432010902.
[I 2025-12-05 14:47:27,979] Trial 56 finished with value: 0.07320457604782073 and parameters: {'model_type': 'mlp', 'hidden_dims': '[256, 128]', 'dropout': 0.37128982541802236, 'batch_norm': True, 'lr': 2.8655848362974142e-05, 'weight_decay': 2.5247564680625187e-06, 'epochs': 269, 'loss': 'mse', 'optimizer': 'adam', 'graph_mode': 'off', 'use_snp_selection': True, 'num_snps': 59893}. Best is trial 18 with value: 0.11411391432010902.
[I 2025-12-05 14:47:30,733] Trial 57 finished with value: 0.06805365650825047 and parameters: {'model_type': 'mlp', 'hidden_dims': '[512, 256]', 'dropout': 0.34349291823246847, 'batch_norm': False, 'lr': 3.37569146721279e-05, 'weight_decay': 0.00012214557972447873, 'epochs': 328, 'loss': 'mae', 'optimizer': 'adam', 'graph_mode': 'off', 'use_snp_selection': False}. Best is trial 18 with value: 0.11411391432010902.
[I 2025-12-05 14:47:32,662] Trial 58 finished with value: 0.09611831632141016 and parameters: {'model_type': 'mlp', 'hidden_dims': '[256, 128]', 'dropout': 0.47563524765855836, 'batch_norm': False, 'lr': 0.0001258922606152456, 'weight_decay': 4.729555162172971e-05, 'epochs': 188, 'loss': 'mse', 'optimizer': 'adam', 'graph_mode': 'off', 'use_snp_selection': True, 'num_snps': 33578}. Best is trial 18 with value: 0.11411391432010902.
[I 2025-12-05 14:47:33,857] Trial 59 finished with value: 0.0674968085537218 and parameters: {'model_type': 'mlp', 'hidden_dims': '[256, 128]', 'dropout': 0.483742437628401, 'batch_norm': True, 'lr': 0.00012444611457749735, 'weight_decay': 4.833611413332095e-05, 'epochs': 190, 'loss': 'mse', 'optimizer': 'adam', 'graph_mode': 'off', 'use_snp_selection': False}. Best is trial 18 with value: 0.11411391432010902.
[I 2025-12-05 14:47:35,846] Trial 60 finished with value: 0.05878781034414249 and parameters: {'model_type': 'mlp', 'hidden_dims': '[256, 128]', 'dropout': 0.4440491449476367, 'batch_norm': False, 'lr': 0.0003150634961854781, 'weight_decay': 1.74765425944277e-06, 'epochs': 203, 'loss': 'mae', 'optimizer': 'adam', 'graph_mode': 'off', 'use_snp_selection': True, 'num_snps': 33358}. Best is trial 18 with value: 0.11411391432010902.
[I 2025-12-05 14:47:38,183] Trial 61 finished with value: 0.07979497955680571 and parameters: {'model_type': 'mlp', 'hidden_dims': '[256, 128]', 'dropout': 0.5437353396000133, 'batch_norm': False, 'lr': 7.504303887614122e-05, 'weight_decay': 1.595987744016463e-05, 'epochs': 180, 'loss': 'mse', 'optimizer': 'adam', 'graph_mode': 'off', 'use_snp_selection': True, 'num_snps': 44600}. Best is trial 18 with value: 0.11411391432010902.
[I 2025-12-05 14:47:40,011] Trial 62 finished with value: 0.08581341415355337 and parameters: {'model_type': 'mlp', 'hidden_dims': '[256, 128]', 'dropout': 0.42813920436396646, 'batch_norm': False, 'lr': 5.32586266963431e-05, 'weight_decay': 7.581709710499788e-05, 'epochs': 230, 'loss': 'mse', 'optimizer': 'adam', 'graph_mode': 'off', 'use_snp_selection': True, 'num_snps': 27301}. Best is trial 18 with value: 0.11411391432010902.
[I 2025-12-05 14:47:42,829] Trial 63 finished with value: 0.08969866951699701 and parameters: {'model_type': 'mlp', 'hidden_dims': '[256, 128]', 'dropout': 0.47022262770270123, 'batch_norm': False, 'lr': 0.00021698306341827372, 'weight_decay': 4.0749807460139075e-05, 'epochs': 217, 'loss': 'mse', 'optimizer': 'adam', 'graph_mode': 'off', 'use_snp_selection': True, 'num_snps': 54982}. Best is trial 18 with value: 0.11411391432010902.
[I 2025-12-05 14:47:45,604] Trial 64 finished with value: 0.07604340913033655 and parameters: {'model_type': 'mlp', 'hidden_dims': '[256, 128]', 'dropout': 0.4654913690273603, 'batch_norm': False, 'lr': 0.0002368872509071666, 'weight_decay': 0.00016633859832569596, 'epochs': 166, 'loss': 'mse', 'optimizer': 'adam', 'graph_mode': 'off', 'use_snp_selection': True, 'num_snps': 54201}. Best is trial 18 with value: 0.11411391432010902.
[I 2025-12-05 14:47:48,417] Trial 65 finished with value: 0.08056769924963826 and parameters: {'model_type': 'mlp', 'hidden_dims': '[256, 128]', 'dropout': 0.505454624077785, 'batch_norm': False, 'lr': 0.0004710565292684913, 'weight_decay': 3.460694124311435e-05, 'epochs': 215, 'loss': 'mse', 'optimizer': 'adam', 'graph_mode': 'off', 'use_snp_selection': True, 'num_snps': 51856}. Best is trial 18 with value: 0.11411391432010902.
[I 2025-12-05 14:47:49,677] Trial 66 finished with value: 0.07289488222959617 and parameters: {'model_type': 'mlp', 'hidden_dims': '[256, 128]', 'dropout': 0.48168922322080665, 'batch_norm': False, 'lr': 0.00021089123706366955, 'weight_decay': 4.3491449705771435e-05, 'epochs': 217, 'loss': 'mse', 'optimizer': 'adam', 'graph_mode': 'off', 'use_snp_selection': False}. Best is trial 18 with value: 0.11411391432010902.
[I 2025-12-05 14:47:52,022] Trial 67 finished with value: 0.07454942947425255 and parameters: {'model_type': 'mlp', 'hidden_dims': '[256, 128]', 'dropout': 0.524738569575288, 'batch_norm': False, 'lr': 0.0007093690159947287, 'weight_decay': 2.4984982589251846e-05, 'epochs': 241, 'loss': 'mse', 'optimizer': 'adam', 'graph_mode': 'off', 'use_snp_selection': True, 'num_snps': 41511}. Best is trial 18 with value: 0.11411391432010902.
[I 2025-12-05 14:47:53,214] Trial 68 finished with value: 0.08282879189796416 and parameters: {'model_type': 'mlp', 'hidden_dims': '[256, 128]', 'dropout': 0.4626141198968115, 'batch_norm': True, 'lr': 0.0001245674153381948, 'weight_decay': 9.521232976214878e-05, 'epochs': 189, 'loss': 'mae', 'optimizer': 'adam', 'graph_mode': 'off', 'use_snp_selection': False}. Best is trial 18 with value: 0.11411391432010902.
[I 2025-12-05 14:47:55,183] Trial 69 finished with value: 0.08796469637832083 and parameters: {'model_type': 'mlp', 'hidden_dims': '[128, 64]', 'dropout': 0.4407153156538717, 'batch_norm': False, 'lr': 9.649924148875605e-05, 'weight_decay': 9.989758973100895e-07, 'epochs': 173, 'loss': 'mse', 'optimizer': 'adam', 'graph_mode': 'off', 'use_snp_selection': True, 'num_snps': 36656}. Best is trial 18 with value: 0.11411391432010902.
[I 2025-12-05 14:47:56,404] Trial 70 finished with value: 0.07068821493929218 and parameters: {'model_type': 'mlp', 'hidden_dims': '[256, 128, 64]', 'dropout': 0.4979082307469192, 'batch_norm': False, 'lr': 0.00014164318457729027, 'weight_decay': 6.083340560111814e-05, 'epochs': 202, 'loss': 'mse', 'optimizer': 'adam', 'graph_mode': 'off', 'use_snp_selection': False}. Best is trial 18 with value: 0.11411391432010902.
