[I 2025-12-05 15:24:11,211] Trial 58 finished with value: 0.12210452520205238 and parameters: {'model_type': 'mlp', 'hidden_dims': '[512, 128]', 'dropout': 0.2761514538673032, 'batch_norm': True, 'lr': 8.684500506121332e-05, 'weight_decay': 1.3926214214203576e-07, 'epochs': 335, 'loss': 'mse', 'optimizer': 'adam', 'graph_mode': 'off', 'use_snp_selection': False}. Best is trial 56 with value: 0.14803738775102046.
[I 2025-12-05 15:24:12,996] Trial 59 finished with value: 0.14121921285042882 and parameters: {'model_type': 'mlp', 'hidden_dims': '[512, 128]', 'dropout': 0.2458178760830529, 'batch_norm': True, 'lr': 0.0002992962172250085, 'weight_decay': 3.1339479593754075e-07, 'epochs': 89, 'loss': 'mae', 'optimizer': 'adam', 'graph_mode': 'off', 'use_snp_selection': False}. Best is trial 56 with value: 0.14803738775102046.
[I 2025-12-05 15:24:16,624] Trial 60 finished with value: 0.12967105234581733 and parameters: {'model_type': 'mlp', 'hidden_dims': '[512, 128]', 'dropout': 0.18570396553042756, 'batch_norm': True, 'lr': 2.036281454883151e-05, 'weight_decay': 8.379734647289669e-07, 'epochs': 325, 'loss': 'mae', 'optimizer': 'adam', 'graph_mode': 'off', 'use_snp_selection': True, 'num_snps': 24139}. Best is trial 56 with value: 0.14803738775102046.
[I 2025-12-05 15:24:17,829] Trial 61 finished with value: 0.13445096182680563 and parameters: {'model_type': 'mlp', 'hidden_dims': '[512, 128]', 'dropout': 0.2399276937334674, 'batch_norm': True, 'lr': 0.0002656445773558508, 'weight_decay': 3.5359338265246786e-07, 'epochs': 40, 'loss': 'mae', 'optimizer': 'adam', 'graph_mode': 'off', 'use_snp_selection': False}. Best is trial 56 with value: 0.14803738775102046.
[I 2025-12-05 15:24:19,548] Trial 62 finished with value: 0.13322613506300865 and parameters: {'model_type': 'mlp', 'hidden_dims': '[512, 128]', 'dropout': 0.3070376381237929, 'batch_norm': True, 'lr': 0.0004961360113156492, 'weight_decay': 2.1847229828487533e-07, 'epochs': 83, 'loss': 'mae', 'optimizer': 'adam', 'graph_mode': 'off', 'use_snp_selection': False}. Best is trial 56 with value: 0.14803738775102046.
[I 2025-12-05 15:24:20,870] Trial 63 finished with value: 0.12477847071171805 and parameters: {'model_type': 'mlp', 'hidden_dims': '[512, 128]', 'dropout': 0.24651913731755215, 'batch_norm': True, 'lr': 0.0003508432090570552, 'weight_decay': 1.0468040874710268e-07, 'epochs': 52, 'loss': 'mae', 'optimizer': 'adam', 'graph_mode': 'off', 'use_snp_selection': False}. Best is trial 56 with value: 0.14803738775102046.
[I 2025-12-05 15:24:23,015] Trial 64 finished with value: 0.13721707315825943 and parameters: {'model_type': 'mlp', 'hidden_dims': '[512, 128]', 'dropout': 0.2917599605972272, 'batch_norm': True, 'lr': 0.0001510811659680463, 'weight_decay': 2.8198044730964604e-07, 'epochs': 115, 'loss': 'mae', 'optimizer': 'adam', 'graph_mode': 'off', 'use_snp_selection': False}. Best is trial 56 with value: 0.14803738775102046.
[I 2025-12-05 15:24:24,787] Trial 65 finished with value: 0.1076247768738167 and parameters: {'model_type': 'mlp', 'hidden_dims': '[512, 128]', 'dropout': 0.21093760370938283, 'batch_norm': True, 'lr': 3.3133196869383015e-05, 'weight_decay': 5.9975122257308126e-05, 'epochs': 85, 'loss': 'mae', 'optimizer': 'adam', 'graph_mode': 'off', 'use_snp_selection': False}. Best is trial 56 with value: 0.14803738775102046.
[I 2025-12-05 15:24:29,308] Trial 66 finished with value: 0.12635527260574408 and parameters: {'model_type': 'mlp', 'hidden_dims': '[512, 128]', 'dropout': 0.26582701002935916, 'batch_norm': True, 'lr': 0.00011879599895630027, 'weight_decay': 3.3188655181952663e-06, 'epochs': 309, 'loss': 'mae', 'optimizer': 'adam', 'graph_mode': 'off', 'use_snp_selection': False}. Best is trial 56 with value: 0.14803738775102046.
[I 2025-12-05 15:24:34,218] Trial 67 finished with value: 0.13519016136877526 and parameters: {'model_type': 'mlp', 'hidden_dims': '[512, 128]', 'dropout': 0.32636913320851263, 'batch_norm': True, 'lr': 0.0007299899972385191, 'weight_decay': 0.0002104380154951638, 'epochs': 341, 'loss': 'mae', 'optimizer': 'adam', 'graph_mode': 'off', 'use_snp_selection': False}. Best is trial 56 with value: 0.14803738775102046.
[I 2025-12-05 15:24:36,615] Trial 68 finished with value: 0.12554208711953796 and parameters: {'model_type': 'mlp', 'hidden_dims': '[512, 256]', 'dropout': 0.37741505076252596, 'batch_norm': False, 'lr': 5.299176576163535e-05, 'weight_decay': 1.345177709110473e-07, 'epochs': 141, 'loss': 'mae', 'optimizer': 'adam', 'graph_mode': 'off', 'use_snp_selection': False}. Best is trial 56 with value: 0.14803738775102046.
[I 2025-12-05 15:24:38,062] Trial 69 finished with value: 0.09943307103655415 and parameters: {'model_type': 'mlp', 'hidden_dims': '[512, 128]', 'dropout': 0.22868279910719413, 'batch_norm': True, 'lr': 1.4281136463631972e-05, 'weight_decay': 5.418535990584689e-07, 'epochs': 58, 'loss': 'mae', 'optimizer': 'adam', 'graph_mode': 'off', 'use_snp_selection': False}. Best is trial 56 with value: 0.14803738775102046.
[I 2025-12-05 15:24:42,751] Trial 70 finished with value: 0.1160989492844272 and parameters: {'model_type': 'mlp', 'hidden_dims': '[512, 64]', 'dropout': 0.5803855355615716, 'batch_norm': True, 'lr': 8.778203151720473e-05, 'weight_decay': 2.419992031409815e-07, 'epochs': 324, 'loss': 'mae', 'optimizer': 'adam', 'graph_mode': 'off', 'use_snp_selection': False}. Best is trial 56 with value: 0.14803738775102046.
[I 2025-12-05 15:24:47,115] Trial 71 finished with value: 0.15351481769690967 and parameters: {'model_type': 'mlp', 'hidden_dims': '[512, 256]', 'dropout': 0.17991913349458138, 'batch_norm': True, 'lr': 5.936843334874701e-05, 'weight_decay': 0.00011365356136497221, 'epochs': 294, 'loss': 'mae', 'optimizer': 'adam', 'graph_mode': 'off', 'use_snp_selection': False}. Best is trial 71 with value: 0.15351481769690967.
[I 2025-12-05 15:24:51,389] Trial 72 finished with value: 0.13982386821083173 and parameters: {'model_type': 'mlp', 'hidden_dims': '[512, 256]', 'dropout': 0.1792977226516842, 'batch_norm': True, 'lr': 7.370986446475654e-05, 'weight_decay': 0.00011082420611189629, 'epochs': 288, 'loss': 'mae', 'optimizer': 'adam', 'graph_mode': 'off', 'use_snp_selection': False}. Best is trial 71 with value: 0.15351481769690967.
[I 2025-12-05 15:24:56,391] Trial 73 finished with value: 0.10982691713831035 and parameters: {'model_type': 'mlp', 'hidden_dims': '[512, 256]', 'dropout': 0.19998301775588917, 'batch_norm': True, 'lr': 2.5383787269165055e-05, 'weight_decay': 0.0002968755495647042, 'epochs': 345, 'loss': 'mae', 'optimizer': 'adam', 'graph_mode': 'off', 'use_snp_selection': False}. Best is trial 71 with value: 0.15351481769690967.
[I 2025-12-05 15:24:58,292] Trial 74 finished with value: 0.12814890787801136 and parameters: {'model_type': 'mlp', 'hidden_dims': '[512, 256]', 'dropout': 0.16596266292008172, 'batch_norm': True, 'lr': 0.0004238150612571852, 'weight_decay': 5.750318799178434e-05, 'epochs': 97, 'loss': 'mae', 'optimizer': 'adam', 'graph_mode': 'off', 'use_snp_selection': False}. Best is trial 71 with value: 0.15351481769690967.
[I 2025-12-05 15:25:02,824] Trial 75 finished with value: 0.13726999941510176 and parameters: {'model_type': 'mlp', 'hidden_dims': '[512, 256]', 'dropout': 0.23176255589104144, 'batch_norm': True, 'lr': 0.00010790503415347609, 'weight_decay': 0.00016184637717892177, 'epochs': 307, 'loss': 'mae', 'optimizer': 'adam', 'graph_mode': 'off', 'use_snp_selection': False}. Best is trial 71 with value: 0.15351481769690967.
[I 2025-12-05 15:25:04,627] Trial 76 finished with value: 0.07445921693879964 and parameters: {'model_type': 'mlp', 'hidden_dims': '[256, 128]', 'dropout': 0.1962831489205482, 'batch_norm': True, 'lr': 0.00029986745200567236, 'weight_decay': 0.00046878374583578356, 'epochs': 275, 'loss': 'mse', 'optimizer': 'adam', 'graph_mode': 'off', 'use_snp_selection': True, 'num_snps': 3325}. Best is trial 71 with value: 0.15351481769690967.
[I 2025-12-05 15:25:09,322] Trial 77 finished with value: 0.14315465516567866 and parameters: {'model_type': 'mlp', 'hidden_dims': '[512, 128]', 'dropout': 0.46536123279547054, 'batch_norm': True, 'lr': 4.275872560280519e-05, 'weight_decay': 1.3899342765226724e-07, 'epochs': 324, 'loss': 'mae', 'optimizer': 'adam', 'graph_mode': 'off', 'use_snp_selection': False}. Best is trial 71 with value: 0.15351481769690967.
[I 2025-12-05 15:25:12,167] Trial 78 finished with value: 0.11859677035385932 and parameters: {'model_type': 'mlp', 'hidden_dims': '[256, 128, 64]', 'dropout': 0.46544627699523694, 'batch_norm': True, 'lr': 4.183753506454991e-05, 'weight_decay': 1.7060657120094773e-07, 'epochs': 325, 'loss': 'mae', 'optimizer': 'adam', 'graph_mode': 'off', 'use_snp_selection': False}. Best is trial 71 with value: 0.15351481769690967.
[I 2025-12-05 15:25:16,805] Trial 79 finished with value: 0.1243432720791724 and parameters: {'model_type': 'mlp', 'hidden_dims': '[512, 256]', 'dropout': 0.48537498595525846, 'batch_norm': True, 'lr': 2.9288390609460624e-05, 'weight_decay': 0.00010197502386526377, 'epochs': 318, 'loss': 'mae', 'optimizer': 'adam', 'graph_mode': 'off', 'use_snp_selection': False}. Best is trial 71 with value: 0.15351481769690967.
[I 2025-12-05 15:25:21,575] Trial 80 finished with value: 0.11498455986841757 and parameters: {'model_type': 'mlp', 'hidden_dims': '[512, 128]', 'dropout': 0.5302197501804813, 'batch_norm': False, 'lr': 6.297460341615894e-05, 'weight_decay': 0.00014812503371711082, 'epochs': 336, 'loss': 'mae', 'optimizer': 'adam', 'graph_mode': 'off', 'use_snp_selection': False}. Best is trial 71 with value: 0.15351481769690967.
[I 2025-12-05 15:25:25,904] Trial 81 finished with value: 0.1269292769874032 and parameters: {'model_type': 'mlp', 'hidden_dims': '[512, 128]', 'dropout': 0.4263016998427709, 'batch_norm': True, 'lr': 5.68525122826222e-05, 'weight_decay': 1.3149139160013506e-07, 'epochs': 294, 'loss': 'mae', 'optimizer': 'adam', 'graph_mode': 'off', 'use_snp_selection': False}. Best is trial 71 with value: 0.15351481769690967.
[I 2025-12-05 15:25:28,158] Trial 82 finished with value: 0.09147990332004402 and parameters: {'model_type': 'mlp', 'hidden_dims': '[512, 128]', 'dropout': 0.3856064149860605, 'batch_norm': True, 'lr': 3.542128273415163e-05, 'weight_decay': 1.6130658646929874e-06, 'epochs': 127, 'loss': 'mae', 'optimizer': 'adam', 'graph_mode': 'off', 'use_snp_selection': False}. Best is trial 71 with value: 0.15351481769690967.
[I 2025-12-05 15:25:31,208] Trial 83 finished with value: 0.14191170719498236 and parameters: {'model_type': 'mlp', 'hidden_dims': '[512, 128]', 'dropout': 0.12751520883662973, 'batch_norm': True, 'lr': 0.00021439598691355035, 'weight_decay': 4.3435955425173417e-07, 'epochs': 187, 'loss': 'mae', 'optimizer': 'adam', 'graph_mode': 'off', 'use_snp_selection': False}. Best is trial 71 with value: 0.15351481769690967.
[I 2025-12-05 15:25:34,211] Trial 84 finished with value: 0.1342631785229276 and parameters: {'model_type': 'mlp', 'hidden_dims': '[512, 128]', 'dropout': 0.40290485656903174, 'batch_norm': True, 'lr': 0.00014404606802830233, 'weight_decay': 4.040171592007566e-07, 'epochs': 184, 'loss': 'mae', 'optimizer': 'adam', 'graph_mode': 'off', 'use_snp_selection': False}. Best is trial 71 with value: 0.15351481769690967.
[I 2025-12-05 15:25:36,889] Trial 85 finished with value: 0.1393746550671549 and parameters: {'model_type': 'mlp', 'hidden_dims': '[512, 64]', 'dropout': 0.1252816574452657, 'batch_norm': True, 'lr': 0.0001912404093879746, 'weight_decay': 1.602363843256241e-07, 'epochs': 161, 'loss': 'mae', 'optimizer': 'adam', 'graph_mode': 'off', 'use_snp_selection': False}. Best is trial 71 with value: 0.15351481769690967.
[I 2025-12-05 15:25:39,973] Trial 86 finished with value: 0.14777258622605896 and parameters: {'model_type': 'mlp', 'hidden_dims': '[512, 256]', 'dropout': 0.14512173251242957, 'batch_norm': True, 'lr': 7.894407984194627e-05, 'weight_decay': 2.299214300855569e-05, 'epochs': 192, 'loss': 'mae', 'optimizer': 'adam', 'graph_mode': 'off', 'use_snp_selection': False}. Best is trial 71 with value: 0.15351481769690967.
[I 2025-12-05 15:25:44,473] Trial 87 finished with value: 0.13935803397168828 and parameters: {'model_type': 'mlp', 'hidden_dims': '[512, 256]', 'dropout': 0.1416542649550046, 'batch_norm': True, 'lr': 8.599198646126418e-05, 'weight_decay': 2.451591419812114e-05, 'epochs': 305, 'loss': 'mse', 'optimizer': 'adam', 'graph_mode': 'off', 'use_snp_selection': False}. Best is trial 71 with value: 0.15351481769690967.
[I 2025-12-05 15:25:48,953] Trial 88 finished with value: 0.11271993954595527 and parameters: {'model_type': 'mlp', 'hidden_dims': '[512, 256]', 'dropout': 0.14617984555408, 'batch_norm': True, 'lr': 4.5874097104879545e-05, 'weight_decay': 3.2721262909768657e-05, 'epochs': 171, 'loss': 'mae', 'optimizer': 'adam', 'graph_mode': 'off', 'use_snp_selection': True, 'num_snps': 48766}. Best is trial 71 with value: 0.15351481769690967.
[I 2025-12-05 15:25:52,411] Trial 89 finished with value: 0.14529988154871465 and parameters: {'model_type': 'mlp', 'hidden_dims': '[512, 256]', 'dropout': 0.169792972476634, 'batch_norm': True, 'lr': 6.849376187202725e-05, 'weight_decay': 7.181537565621728e-05, 'epochs': 220, 'loss': 'mae', 'optimizer': 'adam', 'graph_mode': 'off', 'use_snp_selection': False}. Best is trial 71 with value: 0.15351481769690967.
[I 2025-12-05 15:25:55,763] Trial 90 finished with value: 0.1425084909810552 and parameters: {'model_type': 'mlp', 'hidden_dims': '[512, 256]', 'dropout': 0.1560553633165384, 'batch_norm': True, 'lr': 6.703288467371898e-05, 'weight_decay': 2.015296781897718e-05, 'epochs': 212, 'loss': 'mae', 'optimizer': 'adam', 'graph_mode': 'off', 'use_snp_selection': False}. Best is trial 71 with value: 0.15351481769690967.
[I 2025-12-05 15:25:58,324] Trial 91 finished with value: 0.12533745680129296 and parameters: {'model_type': 'mlp', 'hidden_dims': '[512, 256]', 'dropout': 0.17783965003163796, 'batch_norm': True, 'lr': 5.493712975807045e-05, 'weight_decay': 5.0337130462872143e-05, 'epochs': 151, 'loss': 'mae', 'optimizer': 'adam', 'graph_mode': 'off', 'use_snp_selection': False}. Best is trial 71 with value: 0.15351481769690967.
[I 2025-12-05 15:26:01,479] Trial 92 finished with value: 0.13473911784854256 and parameters: {'model_type': 'mlp', 'hidden_dims': '[512, 256]', 'dropout': 0.16705961469454722, 'batch_norm': True, 'lr': 9.579821910407257e-05, 'weight_decay': 6.125232635474584e-05, 'epochs': 199, 'loss': 'mae', 'optimizer': 'adam', 'graph_mode': 'off', 'use_snp_selection': False}. Best is trial 71 with value: 0.15351481769690967.
[I 2025-12-05 15:26:05,004] Trial 93 finished with value: 0.11982344323450783 and parameters: {'model_type': 'mlp', 'hidden_dims': '[512, 256]', 'dropout': 0.18804194459621967, 'batch_norm': True, 'lr': 4.4431030305126086e-05, 'weight_decay': 7.558363406375141e-05, 'epochs': 226, 'loss': 'mae', 'optimizer': 'adam', 'graph_mode': 'off', 'use_snp_selection': False}. Best is trial 71 with value: 0.15351481769690967.
[I 2025-12-05 15:26:08,856] Trial 94 finished with value: 0.13798218855583355 and parameters: {'model_type': 'mlp', 'hidden_dims': '[512, 256]', 'dropout': 0.12057544319629118, 'batch_norm': True, 'lr': 7.795318518624247e-05, 'weight_decay': 9.882509210107177e-06, 'epochs': 254, 'loss': 'mae', 'optimizer': 'adam', 'graph_mode': 'off', 'use_snp_selection': False}. Best is trial 71 with value: 0.15351481769690967.
[I 2025-12-05 15:26:13,709] Trial 95 finished with value: 0.13680294862340334 and parameters: {'model_type': 'mlp', 'hidden_dims': '[512, 256]', 'dropout': 0.10796406843787018, 'batch_norm': True, 'lr': 0.0001235939451935417, 'weight_decay': 0.00013221901887541289, 'epochs': 331, 'loss': 'mae', 'optimizer': 'adam', 'graph_mode': 'off', 'use_snp_selection': False}. Best is trial 71 with value: 0.15351481769690967.
[I 2025-12-05 15:26:16,202] Trial 96 finished with value: 0.10778422152610846 and parameters: {'model_type': 'mlp', 'hidden_dims': '[256, 128]', 'dropout': 0.21748670279168175, 'batch_norm': True, 'lr': 3.665590490254299e-05, 'weight_decay': 1.406231886383218e-05, 'epochs': 282, 'loss': 'mae', 'optimizer': 'adam', 'graph_mode': 'off', 'use_snp_selection': False}. Best is trial 71 with value: 0.15351481769690967.
[I 2025-12-05 15:26:20,885] Trial 97 finished with value: 0.13758468435338075 and parameters: {'model_type': 'mlp', 'hidden_dims': '[512, 256]', 'dropout': 0.451325576247745, 'batch_norm': True, 'lr': 6.453576278250325e-05, 'weight_decay': 0.0002494614983461008, 'epochs': 321, 'loss': 'mae', 'optimizer': 'adam', 'graph_mode': 'off', 'use_snp_selection': False}. Best is trial 71 with value: 0.15351481769690967.
[I 2025-12-05 15:26:23,598] Trial 98 finished with value: 0.12767452539297408 and parameters: {'model_type': 'mlp', 'hidden_dims': '[256, 128, 64]', 'dropout': 0.2041155802589077, 'batch_norm': False, 'lr': 2.9042946846120176e-05, 'weight_decay': 0.00010002665871913786, 'epochs': 313, 'loss': 'mae', 'optimizer': 'adam', 'graph_mode': 'off', 'use_snp_selection': False}. Best is trial 71 with value: 0.15351481769690967.
[I 2025-12-05 15:26:28,632] Trial 99 finished with value: 0.13605692076916107 and parameters: {'model_type': 'mlp', 'hidden_dims': '[512, 256]', 'dropout': 0.14810350761420346, 'batch_norm': True, 'lr': 1.711035347152015e-05, 'weight_decay': 0.0002091581085046542, 'epochs': 349, 'loss': 'mae', 'optimizer': 'adam', 'graph_mode': 'off', 'use_snp_selection': False}. Best is trial 71 with value: 0.15351481769690967.
[I 2025-12-05 15:26:32,666] Trial 100 finished with value: 0.11010621243570565 and parameters: {'model_type': 'mlp', 'hidden_dims': '[512, 128]', 'dropout': 0.170995810218013, 'batch_norm': True, 'lr': 2.274820284576318e-05, 'weight_decay': 2.804810829630492e-05, 'epochs': 268, 'loss': 'mse', 'optimizer': 'adam', 'graph_mode': 'off', 'use_snp_selection': False}. Best is trial 71 with value: 0.15351481769690967.
[I 2025-12-05 15:26:35,841] Trial 101 finished with value: 0.14427386754299254 and parameters: {'model_type': 'mlp', 'hidden_dims': '[512, 256]', 'dropout': 0.1579140429889896, 'batch_norm': True, 'lr': 6.735510140169004e-05, 'weight_decay': 1.667515979857445e-05, 'epochs': 197, 'loss': 'mae', 'optimizer': 'adam', 'graph_mode': 'off', 'use_snp_selection': False}. Best is trial 71 with value: 0.15351481769690967.
[I 2025-12-05 15:26:39,144] Trial 102 finished with value: 0.12668367965347482 and parameters: {'model_type': 'mlp', 'hidden_dims': '[512, 256]', 'dropout': 0.1528671664545572, 'batch_norm': True, 'lr': 5.018138556545937e-05, 'weight_decay': 1.662765414172756e-05, 'epochs': 209, 'loss': 'mae', 'optimizer': 'adam', 'graph_mode': 'off', 'use_snp_selection': False}. Best is trial 71 with value: 0.15351481769690967.
[I 2025-12-05 15:26:41,993] Trial 103 finished with value: 0.14435739241670822 and parameters: {'model_type': 'mlp', 'hidden_dims': '[512, 256]', 'dropout': 0.1372640493384906, 'batch_norm': True, 'lr': 0.00010732793984784846, 'weight_decay': 4.316269491329847e-05, 'epochs': 173, 'loss': 'mae', 'optimizer': 'adam', 'graph_mode': 'off', 'use_snp_selection': False}. Best is trial 71 with value: 0.15351481769690967.
[I 2025-12-05 15:26:45,134] Trial 104 finished with value: 0.13464133526073072 and parameters: {'model_type': 'mlp', 'hidden_dims': '[512, 256]', 'dropout': 0.13631862772047149, 'batch_norm': True, 'lr': 0.0001098874774581557, 'weight_decay': 4.0120601919163806e-05, 'epochs': 193, 'loss': 'mae', 'optimizer': 'adam', 'graph_mode': 'off', 'use_snp_selection': False}. Best is trial 71 with value: 0.15351481769690967.
[I 2025-12-05 15:26:48,027] Trial 105 finished with value: 0.13102530005607518 and parameters: {'model_type': 'mlp', 'hidden_dims': '[512, 256]', 'dropout': 0.16117988796731808, 'batch_norm': True, 'lr': 0.0001308438046486602, 'weight_decay': 4.702155206303558e-05, 'epochs': 175, 'loss': 'mae', 'optimizer': 'adam', 'graph_mode': 'off', 'use_snp_selection': False}. Best is trial 71 with value: 0.15351481769690967.
[I 2025-12-05 15:26:50,783] Trial 106 finished with value: 0.12701573435719082 and parameters: {'model_type': 'mlp', 'hidden_dims': '[512, 256]', 'dropout': 0.1178794668385234, 'batch_norm': True, 'lr': 0.0001648377217114789, 'weight_decay': 6.681458645532136e-05, 'epochs': 166, 'loss': 'mae', 'optimizer': 'adam', 'graph_mode': 'off', 'use_snp_selection': False}. Best is trial 71 with value: 0.15351481769690967.
[I 2025-12-05 15:26:54,688] Trial 107 finished with value: 0.1348222074541826 and parameters: {'model_type': 'mlp', 'hidden_dims': '[512, 256]', 'dropout': 0.10148030183081191, 'batch_norm': True, 'lr': 8.263842843249847e-05, 'weight_decay': 2.2743694000746616e-05, 'epochs': 181, 'loss': 'mae', 'optimizer': 'adam', 'graph_mode': 'off', 'use_snp_selection': True, 'num_snps': 37972}. Best is trial 71 with value: 0.15351481769690967.
[I 2025-12-05 15:26:57,334] Trial 108 finished with value: 0.10869661689078185 and parameters: {'model_type': 'mlp', 'hidden_dims': '[512, 256]', 'dropout': 0.18638387110410515, 'batch_norm': True, 'lr': 7.156249907269667e-05, 'weight_decay': 1.0303031940421632e-05, 'epochs': 154, 'loss': 'mae', 'optimizer': 'adam', 'graph_mode': 'off', 'use_snp_selection': False}. Best is trial 71 with value: 0.15351481769690967.
[I 2025-12-05 15:27:00,500] Trial 109 finished with value: 0.14041271250521759 and parameters: {'model_type': 'mlp', 'hidden_dims': '[512, 256]', 'dropout': 0.1284588145077047, 'batch_norm': True, 'lr': 9.993409816072848e-05, 'weight_decay': 3.366596956247547e-05, 'epochs': 199, 'loss': 'mae', 'optimizer': 'adam', 'graph_mode': 'off', 'use_snp_selection': False}. Best is trial 71 with value: 0.15351481769690967.
