Running from this directory: /cluster/work/simennes/Project_thesis/Project_thesis
Name of job: mlp_w_ens
ID of job: 23690570
The job was run on these nodes: idun-07-04
[I 2025-12-05 14:23:27,102] Trial 0 finished with value: -0.026335177031530512 and parameters: {'model_type': 'mlp', 'hidden_dims': '[128, 64]', 'dropout': 0.199031432379812, 'batch_norm': True, 'lr': 1.8408544111075837e-06, 'weight_decay': 5.5136510071208614e-05, 'epochs': 336, 'loss': 'mae', 'optimizer': 'adam', 'graph_mode': 'off', 'use_snp_selection': True, 'num_snps': 43862}. Best is trial 0 with value: -0.026335177031530512.
[I 2025-12-05 14:23:28,252] Trial 1 finished with value: 0.024472466081472462 and parameters: {'model_type': 'mlp', 'hidden_dims': '[256, 128]', 'dropout': 0.4370668075331726, 'batch_norm': True, 'lr': 7.133471581159139e-05, 'weight_decay': 1.128633586803549e-05, 'epochs': 242, 'loss': 'mae', 'optimizer': 'adam', 'graph_mode': 'off', 'use_snp_selection': False}. Best is trial 1 with value: 0.024472466081472462.
[I 2025-12-05 14:23:29,273] Trial 2 finished with value: 0.03535649369441226 and parameters: {'model_type': 'mlp', 'hidden_dims': '[256, 128, 64]', 'dropout': 0.41314357415569625, 'batch_norm': False, 'lr': 3.952233718592101e-06, 'weight_decay': 0.00026754769258252603, 'epochs': 149, 'loss': 'mse', 'optimizer': 'adam', 'graph_mode': 'off', 'use_snp_selection': True, 'num_snps': 11571}. Best is trial 2 with value: 0.03535649369441226.
[I 2025-12-05 14:23:31,073] Trial 3 finished with value: 0.03095405766402886 and parameters: {'model_type': 'mlp', 'hidden_dims': '[512, 64]', 'dropout': 0.5938127374509361, 'batch_norm': False, 'lr': 5.67704586114731e-06, 'weight_decay': 2.4518087630137052e-05, 'epochs': 320, 'loss': 'mae', 'optimizer': 'adam', 'graph_mode': 'off', 'use_snp_selection': False}. Best is trial 2 with value: 0.03535649369441226.
[I 2025-12-05 14:23:33,322] Trial 4 finished with value: -0.016577664259356837 and parameters: {'model_type': 'mlp', 'hidden_dims': '[512, 128]', 'dropout': 0.25746343592134413, 'batch_norm': True, 'lr': 1.3467657668402788e-06, 'weight_decay': 0.00033087251918647806, 'epochs': 277, 'loss': 'mse', 'optimizer': 'adam', 'graph_mode': 'off', 'use_snp_selection': True, 'num_snps': 36675}. Best is trial 2 with value: 0.03535649369441226.
[I 2025-12-05 14:23:35,077] Trial 5 finished with value: 0.026307783117801346 and parameters: {'model_type': 'mlp', 'hidden_dims': '[512, 64]', 'dropout': 0.38275350994408375, 'batch_norm': True, 'lr': 1.5586664309232824e-06, 'weight_decay': 0.0008227664668621182, 'epochs': 145, 'loss': 'mae', 'optimizer': 'adam', 'graph_mode': 'off', 'use_snp_selection': True, 'num_snps': 32148}. Best is trial 2 with value: 0.03535649369441226.
[I 2025-12-05 14:23:36,036] Trial 6 finished with value: 0.00859796519167185 and parameters: {'model_type': 'mlp', 'hidden_dims': '[256, 128]', 'dropout': 0.3930109900265879, 'batch_norm': False, 'lr': 4.892964372128395e-05, 'weight_decay': 1.5809549317992182e-06, 'epochs': 199, 'loss': 'mse', 'optimizer': 'adam', 'graph_mode': 'off', 'use_snp_selection': False}. Best is trial 2 with value: 0.03535649369441226.
[I 2025-12-05 14:23:37,123] Trial 7 finished with value: 0.030210964821195476 and parameters: {'model_type': 'mlp', 'hidden_dims': '[512, 256]', 'dropout': 0.15343979219678458, 'batch_norm': True, 'lr': 6.234003099047341e-05, 'weight_decay': 3.894760610535477e-07, 'epochs': 97, 'loss': 'mse', 'optimizer': 'adam', 'graph_mode': 'off', 'use_snp_selection': False}. Best is trial 2 with value: 0.03535649369441226.
[I 2025-12-05 14:23:38,891] Trial 8 finished with value: 0.0315894152642054 and parameters: {'model_type': 'mlp', 'hidden_dims': '[512, 128]', 'dropout': 0.10743001231661406, 'batch_norm': True, 'lr': 0.00023728538449271062, 'weight_decay': 1.7629071578048637e-05, 'epochs': 312, 'loss': 'mae', 'optimizer': 'adam', 'graph_mode': 'off', 'use_snp_selection': False}. Best is trial 2 with value: 0.03535649369441226.
[I 2025-12-05 14:23:40,223] Trial 9 finished with value: 0.019167527669159676 and parameters: {'model_type': 'mlp', 'hidden_dims': '[512, 64]', 'dropout': 0.14505336736221927, 'batch_norm': True, 'lr': 5.8619638388111826e-05, 'weight_decay': 6.200156172669308e-07, 'epochs': 175, 'loss': 'mse', 'optimizer': 'adam', 'graph_mode': 'off', 'use_snp_selection': False}. Best is trial 2 with value: 0.03535649369441226.
[I 2025-12-05 14:23:40,900] Trial 10 finished with value: -0.02536866958008374 and parameters: {'model_type': 'mlp', 'hidden_dims': '[256, 128, 64]', 'dropout': 0.5344471988899759, 'batch_norm': False, 'lr': 1.080428984628536e-05, 'weight_decay': 0.0001397766261378007, 'epochs': 43, 'loss': 'mse', 'optimizer': 'adam', 'graph_mode': 'off', 'use_snp_selection': True, 'num_snps': 4154}. Best is trial 2 with value: 0.03535649369441226.
[I 2025-12-05 14:23:41,875] Trial 11 finished with value: 0.03540190113916154 and parameters: {'model_type': 'mlp', 'hidden_dims': '[512, 128]', 'dropout': 0.3372576707439438, 'batch_norm': False, 'lr': 0.0007035074985054279, 'weight_decay': 3.074394582448942e-06, 'epochs': 240, 'loss': 'mae', 'optimizer': 'adam', 'graph_mode': 'off', 'use_snp_selection': True, 'num_snps': 6849}. Best is trial 11 with value: 0.03540190113916154.
[I 2025-12-05 14:23:42,844] Trial 12 finished with value: 0.02025343079341074 and parameters: {'model_type': 'mlp', 'hidden_dims': '[256, 128, 64]', 'dropout': 0.28681524965375393, 'batch_norm': False, 'lr': 0.00072344478727683, 'weight_decay': 2.8038717616089895e-06, 'epochs': 219, 'loss': 'mae', 'optimizer': 'adam', 'graph_mode': 'off', 'use_snp_selection': True, 'num_snps': 6789}. Best is trial 11 with value: 0.03540190113916154.
[I 2025-12-05 14:23:44,067] Trial 13 finished with value: 0.014466868900330717 and parameters: {'model_type': 'mlp', 'hidden_dims': '[256, 128, 64]', 'dropout': 0.46994541965231784, 'batch_norm': False, 'lr': 1.2299327733043356e-05, 'weight_decay': 1.3917882897272238e-07, 'epochs': 137, 'loss': 'mse', 'optimizer': 'adam', 'graph_mode': 'off', 'use_snp_selection': True, 'num_snps': 16362}. Best is trial 11 with value: 0.03540190113916154.
[I 2025-12-05 14:23:45,520] Trial 14 finished with value: 0.028370457539964193 and parameters: {'model_type': 'mlp', 'hidden_dims': '[512, 128]', 'dropout': 0.3110734543916103, 'batch_norm': False, 'lr': 0.000992546712510151, 'weight_decay': 5.852897613470261e-06, 'epochs': 257, 'loss': 'mae', 'optimizer': 'adam', 'graph_mode': 'off', 'use_snp_selection': True, 'num_snps': 18889}. Best is trial 11 with value: 0.03540190113916154.
[I 2025-12-05 14:23:48,107] Trial 15 finished with value: 0.04020844874576051 and parameters: {'model_type': 'mlp', 'hidden_dims': '[512, 256]', 'dropout': 0.34186062050090266, 'batch_norm': False, 'lr': 0.00023713924108629755, 'weight_decay': 9.856442772738052e-05, 'epochs': 90, 'loss': 'mse', 'optimizer': 'adam', 'graph_mode': 'off', 'use_snp_selection': True, 'num_snps': 57534}. Best is trial 15 with value: 0.04020844874576051.
[I 2025-12-05 14:23:50,866] Trial 16 finished with value: 0.022077184049838477 and parameters: {'model_type': 'mlp', 'hidden_dims': '[512, 256]', 'dropout': 0.23371387699890656, 'batch_norm': False, 'lr': 0.00021563279180588022, 'weight_decay': 5.8052956646421225e-05, 'epochs': 54, 'loss': 'mae', 'optimizer': 'adam', 'graph_mode': 'off', 'use_snp_selection': True, 'num_snps': 58111}. Best is trial 15 with value: 0.04020844874576051.
[I 2025-12-05 14:23:53,649] Trial 17 finished with value: 0.0061565489826105775 and parameters: {'model_type': 'mlp', 'hidden_dims': '[512, 256]', 'dropout': 0.3359696440706496, 'batch_norm': False, 'lr': 0.0003153244729064553, 'weight_decay': 3.9791378651891376e-06, 'epochs': 82, 'loss': 'mse', 'optimizer': 'adam', 'graph_mode': 'off', 'use_snp_selection': True, 'num_snps': 59156}. Best is trial 15 with value: 0.04020844874576051.
[I 2025-12-05 14:23:55,753] Trial 18 finished with value: 0.014897097892157818 and parameters: {'model_type': 'mlp', 'hidden_dims': '[128, 64]', 'dropout': 0.47627753018274765, 'batch_norm': False, 'lr': 0.00047888981119151785, 'weight_decay': 6.259694470710904e-05, 'epochs': 97, 'loss': 'mae', 'optimizer': 'adam', 'graph_mode': 'off', 'use_snp_selection': True, 'num_snps': 48075}. Best is trial 15 with value: 0.04020844874576051.
[I 2025-12-05 14:23:57,500] Trial 19 finished with value: 0.03264262551691147 and parameters: {'model_type': 'mlp', 'hidden_dims': '[512, 128]', 'dropout': 0.36124893281600445, 'batch_norm': False, 'lr': 0.00027854139843726527, 'weight_decay': 1.5128072841983007e-06, 'epochs': 292, 'loss': 'mse', 'optimizer': 'adam', 'graph_mode': 'off', 'use_snp_selection': True, 'num_snps': 23587}. Best is trial 15 with value: 0.04020844874576051.
[I 2025-12-05 14:23:59,139] Trial 20 finished with value: 0.030159628667209313 and parameters: {'model_type': 'mlp', 'hidden_dims': '[512, 256]', 'dropout': 0.29713712842742895, 'batch_norm': False, 'lr': 0.00012661053552033948, 'weight_decay': 8.10962749307551e-06, 'epochs': 227, 'loss': 'mae', 'optimizer': 'adam', 'graph_mode': 'off', 'use_snp_selection': True, 'num_snps': 25013}. Best is trial 15 with value: 0.04020844874576051.
[I 2025-12-05 14:24:00,105] Trial 21 finished with value: 0.01966980287702618 and parameters: {'model_type': 'mlp', 'hidden_dims': '[256, 128, 64]', 'dropout': 0.41428070243367293, 'batch_norm': False, 'lr': 3.935737517088724e-06, 'weight_decay': 0.0002107751029385382, 'epochs': 146, 'loss': 'mse', 'optimizer': 'adam', 'graph_mode': 'off', 'use_snp_selection': True, 'num_snps': 11078}. Best is trial 15 with value: 0.04020844874576051.
[I 2025-12-05 14:24:01,097] Trial 22 finished with value: 0.026891304984122125 and parameters: {'model_type': 'mlp', 'hidden_dims': '[512, 128]', 'dropout': 0.3407621798861611, 'batch_norm': False, 'lr': 2.7496555259612187e-05, 'weight_decay': 0.0009687373237242097, 'epochs': 176, 'loss': 'mse', 'optimizer': 'adam', 'graph_mode': 'off', 'use_snp_selection': True, 'num_snps': 11894}. Best is trial 15 with value: 0.04020844874576051.
[I 2025-12-05 14:24:01,783] Trial 23 finished with value: 0.021992668254410836 and parameters: {'model_type': 'mlp', 'hidden_dims': '[256, 128, 64]', 'dropout': 0.4695441603713695, 'batch_norm': False, 'lr': 0.00012458735561596227, 'weight_decay': 0.00038721829992515355, 'epochs': 119, 'loss': 'mse', 'optimizer': 'adam', 'graph_mode': 'off', 'use_snp_selection': True, 'num_snps': 2223}. Best is trial 15 with value: 0.04020844874576051.
[I 2025-12-05 14:24:04,200] Trial 24 finished with value: 0.03670967480766894 and parameters: {'model_type': 'mlp', 'hidden_dims': '[512, 256]', 'dropout': 0.43141617775766394, 'batch_norm': False, 'lr': 2.433544966355557e-05, 'weight_decay': 0.00010043793492330673, 'epochs': 177, 'loss': 'mse', 'optimizer': 'adam', 'graph_mode': 'off', 'use_snp_selection': True, 'num_snps': 42918}. Best is trial 15 with value: 0.04020844874576051.
[I 2025-12-05 14:24:06,916] Trial 25 finished with value: 0.02625630155533917 and parameters: {'model_type': 'mlp', 'hidden_dims': '[512, 256]', 'dropout': 0.5185323146895002, 'batch_norm': False, 'lr': 3.026985538133661e-05, 'weight_decay': 3.0086771954547363e-05, 'epochs': 198, 'loss': 'mse', 'optimizer': 'adam', 'graph_mode': 'off', 'use_snp_selection': True, 'num_snps': 51202}. Best is trial 15 with value: 0.04020844874576051.
[I 2025-12-05 14:24:09,329] Trial 26 finished with value: 0.005285364958266689 and parameters: {'model_type': 'mlp', 'hidden_dims': '[512, 256]', 'dropout': 0.24162843379985766, 'batch_norm': False, 'lr': 1.5319063252479474e-05, 'weight_decay': 0.00013225664416546465, 'epochs': 266, 'loss': 'mse', 'optimizer': 'adam', 'graph_mode': 'off', 'use_snp_selection': True, 'num_snps': 39851}. Best is trial 15 with value: 0.04020844874576051.
[I 2025-12-05 14:24:12,032] Trial 27 finished with value: 0.029069721384163576 and parameters: {'model_type': 'mlp', 'hidden_dims': '[512, 256]', 'dropout': 0.36432026408598006, 'batch_norm': False, 'lr': 0.0005203756107305404, 'weight_decay': 9.184854182491129e-05, 'epochs': 219, 'loss': 'mse', 'optimizer': 'adam', 'graph_mode': 'off', 'use_snp_selection': True, 'num_snps': 51210}. Best is trial 15 with value: 0.04020844874576051.
[I 2025-12-05 14:24:13,920] Trial 28 finished with value: 0.006959478496517972 and parameters: {'model_type': 'mlp', 'hidden_dims': '[512, 256]', 'dropout': 0.4390470739394028, 'batch_norm': False, 'lr': 2.2309808114261614e-05, 'weight_decay': 3.372245617235168e-05, 'epochs': 175, 'loss': 'mae', 'optimizer': 'adam', 'graph_mode': 'off', 'use_snp_selection': True, 'num_snps': 31674}. Best is trial 15 with value: 0.04020844874576051.
[I 2025-12-05 14:24:16,488] Trial 29 finished with value: 0.035031815662023305 and parameters: {'model_type': 'mlp', 'hidden_dims': '[128, 64]', 'dropout': 0.3107874982001251, 'batch_norm': False, 'lr': 0.0001066924423427719, 'weight_decay': 1.4733726904277321e-05, 'epochs': 349, 'loss': 'mae', 'optimizer': 'adam', 'graph_mode': 'off', 'use_snp_selection': True, 'num_snps': 53996}. Best is trial 15 with value: 0.04020844874576051.
[I 2025-12-05 14:24:18,415] Trial 30 finished with value: 0.026821698518085947 and parameters: {'model_type': 'mlp', 'hidden_dims': '[256, 128]', 'dropout': 0.21419912111616662, 'batch_norm': False, 'lr': 0.0003875882872781561, 'weight_decay': 0.0005580274603859084, 'epochs': 119, 'loss': 'mse', 'optimizer': 'adam', 'graph_mode': 'off', 'use_snp_selection': True, 'num_snps': 43337}. Best is trial 15 with value: 0.04020844874576051.
[I 2025-12-05 14:24:19,350] Trial 31 finished with value: 0.029560823046665814 and parameters: {'model_type': 'mlp', 'hidden_dims': '[128, 64]', 'dropout': 0.4225291389816354, 'batch_norm': False, 'lr': 6.507167229889453e-06, 'weight_decay': 0.00012457942986978562, 'epochs': 165, 'loss': 'mse', 'optimizer': 'adam', 'graph_mode': 'off', 'use_snp_selection': True, 'num_snps': 10594}. Best is trial 15 with value: 0.04020844874576051.
[I 2025-12-05 14:24:20,882] Trial 32 finished with value: 0.03282977307680711 and parameters: {'model_type': 'mlp', 'hidden_dims': '[256, 128, 64]', 'dropout': 0.39241719173953205, 'batch_norm': False, 'lr': 2.516985408619468e-06, 'weight_decay': 0.00024911925716979995, 'epochs': 240, 'loss': 'mse', 'optimizer': 'adam', 'graph_mode': 'off', 'use_snp_selection': True, 'num_snps': 22719}. Best is trial 15 with value: 0.04020844874576051.
[I 2025-12-05 14:24:22,010] Trial 33 finished with value: 0.04555024989504239 and parameters: {'model_type': 'mlp', 'hidden_dims': '[512, 128]', 'dropout': 0.5010028635661434, 'batch_norm': False, 'lr': 2.9985038636955e-06, 'weight_decay': 4.663562015495513e-05, 'epochs': 68, 'loss': 'mse', 'optimizer': 'adam', 'graph_mode': 'off', 'use_snp_selection': True, 'num_snps': 16440}. Best is trial 33 with value: 0.04555024989504239.
[I 2025-12-05 14:24:22,998] Trial 34 finished with value: 0.0032942604036462534 and parameters: {'model_type': 'mlp', 'hidden_dims': '[512, 128]', 'dropout': 0.5265202434996307, 'batch_norm': False, 'lr': 0.00016217495012552677, 'weight_decay': 4.4299703687350805e-05, 'epochs': 62, 'loss': 'mse', 'optimizer': 'adam', 'graph_mode': 'off', 'use_snp_selection': False}. Best is trial 33 with value: 0.04555024989504239.
[I 2025-12-05 14:24:24,432] Trial 35 finished with value: 0.01130745057204013 and parameters: {'model_type': 'mlp', 'hidden_dims': '[512, 128]', 'dropout': 0.5651302442632484, 'batch_norm': True, 'lr': 0.0006440321582042386, 'weight_decay': 7.902390085574588e-05, 'epochs': 81, 'loss': 'mse', 'optimizer': 'adam', 'graph_mode': 'off', 'use_snp_selection': True, 'num_snps': 27791}. Best is trial 33 with value: 0.04555024989504239.
[I 2025-12-05 14:24:25,604] Trial 36 finished with value: -0.024959570858240614 and parameters: {'model_type': 'mlp', 'hidden_dims': '[512, 128]', 'dropout': 0.49874193980665044, 'batch_norm': False, 'lr': 2.8061425780502136e-06, 'weight_decay': 1.9665532250550216e-05, 'epochs': 123, 'loss': 'mae', 'optimizer': 'adam', 'graph_mode': 'off', 'use_snp_selection': True, 'num_snps': 18116}. Best is trial 33 with value: 0.04555024989504239.
[I 2025-12-05 14:24:27,762] Trial 37 finished with value: 0.018483978807142507 and parameters: {'model_type': 'mlp', 'hidden_dims': '[512, 128]', 'dropout': 0.447743664806836, 'batch_norm': False, 'lr': 1.0661807028389837e-06, 'weight_decay': 9.338166359618875e-06, 'epochs': 80, 'loss': 'mse', 'optimizer': 'adam', 'graph_mode': 'off', 'use_snp_selection': True, 'num_snps': 43553}. Best is trial 33 with value: 0.04555024989504239.
[I 2025-12-05 14:24:28,589] Trial 38 finished with value: 0.011485233511143021 and parameters: {'model_type': 'mlp', 'hidden_dims': '[256, 128]', 'dropout': 0.26783985786419645, 'batch_norm': True, 'lr': 4.203176659927192e-05, 'weight_decay': 1.8025840774910935e-06, 'epochs': 98, 'loss': 'mse', 'optimizer': 'adam', 'graph_mode': 'off', 'use_snp_selection': False}. Best is trial 33 with value: 0.04555024989504239.
[I 2025-12-05 14:24:30,263] Trial 39 finished with value: 0.03248584160034382 and parameters: {'model_type': 'mlp', 'hidden_dims': '[512, 64]', 'dropout': 0.37868848964072077, 'batch_norm': False, 'lr': 6.680599497161081e-06, 'weight_decay': 6.904143068813526e-07, 'epochs': 63, 'loss': 'mae', 'optimizer': 'adam', 'graph_mode': 'off', 'use_snp_selection': True, 'num_snps': 34705}. Best is trial 33 with value: 0.04555024989504239.
[I 2025-12-05 14:24:31,781] Trial 40 finished with value: 0.02455414518805855 and parameters: {'model_type': 'mlp', 'hidden_dims': '[512, 256]', 'dropout': 0.5779790891983257, 'batch_norm': True, 'lr': 9.321510947729464e-05, 'weight_decay': 0.0001658350739597788, 'epochs': 242, 'loss': 'mse', 'optimizer': 'adam', 'graph_mode': 'off', 'use_snp_selection': False}. Best is trial 33 with value: 0.04555024989504239.
[I 2025-12-05 14:24:32,705] Trial 41 finished with value: 0.018290815858930456 and parameters: {'model_type': 'mlp', 'hidden_dims': '[512, 128]', 'dropout': 0.4052019458977976, 'batch_norm': False, 'lr': 4.548192445156418e-06, 'weight_decay': 0.00044991791307318735, 'epochs': 152, 'loss': 'mse', 'optimizer': 'adam', 'graph_mode': 'off', 'use_snp_selection': True, 'num_snps': 8651}. Best is trial 33 with value: 0.04555024989504239.
[I 2025-12-05 14:24:33,857] Trial 42 finished with value: -0.0028099690894175353 and parameters: {'model_type': 'mlp', 'hidden_dims': '[512, 64]', 'dropout': 0.3286944759289269, 'batch_norm': False, 'lr': 2.3659965784493878e-06, 'weight_decay': 0.0003049779063983405, 'epochs': 191, 'loss': 'mse', 'optimizer': 'adam', 'graph_mode': 'off', 'use_snp_selection': True, 'num_snps': 13243}. Best is trial 33 with value: 0.04555024989504239.
[I 2025-12-05 14:24:34,561] Trial 43 finished with value: -0.04771124591998646 and parameters: {'model_type': 'mlp', 'hidden_dims': '[512, 256]', 'dropout': 0.4463700846885992, 'batch_norm': False, 'lr': 1.7070193193840081e-06, 'weight_decay': 9.919026224085191e-05, 'epochs': 43, 'loss': 'mse', 'optimizer': 'adam', 'graph_mode': 'off', 'use_snp_selection': True, 'num_snps': 5918}. Best is trial 33 with value: 0.04555024989504239.
[I 2025-12-05 14:24:36,402] Trial 44 finished with value: -0.008654237504151252 and parameters: {'model_type': 'mlp', 'hidden_dims': '[256, 128, 64]', 'dropout': 0.48364294029323873, 'batch_norm': False, 'lr': 7.839908807836922e-06, 'weight_decay': 0.0006368055024406753, 'epochs': 104, 'loss': 'mse', 'optimizer': 'adam', 'graph_mode': 'off', 'use_snp_selection': True, 'num_snps': 39019}. Best is trial 33 with value: 0.04555024989504239.
[I 2025-12-05 14:24:37,329] Trial 45 finished with value: 0.00039715182765165066 and parameters: {'model_type': 'mlp', 'hidden_dims': '[256, 128]', 'dropout': 0.37689014854213065, 'batch_norm': True, 'lr': 1.616392207652929e-05, 'weight_decay': 4.988715650649104e-05, 'epochs': 134, 'loss': 'mae', 'optimizer': 'adam', 'graph_mode': 'off', 'use_snp_selection': False}. Best is trial 33 with value: 0.04555024989504239.
[I 2025-12-05 14:24:39,718] Trial 46 finished with value: 0.0027165108025980675 and parameters: {'model_type': 'mlp', 'hidden_dims': '[512, 128]', 'dropout': 0.4111383929741015, 'batch_norm': False, 'lr': 0.0008071381015702099, 'weight_decay': 0.00017286343257750877, 'epochs': 160, 'loss': 'mse', 'optimizer': 'adam', 'graph_mode': 'off', 'use_snp_selection': True, 'num_snps': 46755}. Best is trial 33 with value: 0.04555024989504239.
[I 2025-12-05 14:24:40,965] Trial 47 finished with value: -0.0018291550476155231 and parameters: {'model_type': 'mlp', 'hidden_dims': '[256, 128, 64]', 'dropout': 0.2743515676043026, 'batch_norm': False, 'lr': 9.911918847895418e-06, 'weight_decay': 5.617641078811294e-06, 'epochs': 210, 'loss': 'mse', 'optimizer': 'adam', 'graph_mode': 'off', 'use_snp_selection': True, 'num_snps': 15138}. Best is trial 33 with value: 0.04555024989504239.
[I 2025-12-05 14:24:41,850] Trial 48 finished with value: 0.03620350843453867 and parameters: {'model_type': 'mlp', 'hidden_dims': '[512, 256]', 'dropout': 0.35105861791229215, 'batch_norm': False, 'lr': 3.7162238201999465e-06, 'weight_decay': 2.3136163478147662e-05, 'epochs': 187, 'loss': 'mae', 'optimizer': 'adam', 'graph_mode': 'off', 'use_snp_selection': True, 'num_snps': 6635}. Best is trial 33 with value: 0.04555024989504239.
[I 2025-12-05 14:24:42,656] Trial 49 finished with value: 0.02509345334274426 and parameters: {'model_type': 'mlp', 'hidden_dims': '[512, 256]', 'dropout': 0.3221599353421881, 'batch_norm': False, 'lr': 4.546166679050324e-06, 'weight_decay': 1.3704545418763911e-05, 'epochs': 257, 'loss': 'mae', 'optimizer': 'adam', 'graph_mode': 'off', 'use_snp_selection': True, 'num_snps': 2096}. Best is trial 33 with value: 0.04555024989504239.
