[I 2025-12-05 17:27:01,138] Trial 0 finished with value: 0.2958745295449809 and parameters: {'model_type': 'mlp', 'hidden_dims': '[128, 64]', 'dropout': 0.199031432379812, 'batch_norm': True, 'lr': 1.8408544111075837e-06, 'weight_decay': 5.5136510071208614e-05, 'epochs': 336, 'loss': 'mae', 'optimizer': 'adam', 'graph_mode': 'off', 'use_snp_selection': True, 'num_snps': 43862}. Best is trial 0 with value: 0.2958745295449809.
[I 2025-12-05 17:27:30,098] Trial 1 finished with value: 0.3456192548600153 and parameters: {'model_type': 'mlp', 'hidden_dims': '[256, 128]', 'dropout': 0.4370668075331726, 'batch_norm': True, 'lr': 7.133471581159139e-05, 'weight_decay': 1.128633586803549e-05, 'epochs': 242, 'loss': 'mae', 'optimizer': 'adam', 'graph_mode': 'off', 'use_snp_selection': False}. Best is trial 1 with value: 0.3456192548600153.
[I 2025-12-05 17:27:57,964] Trial 2 finished with value: 0.3407325818203669 and parameters: {'model_type': 'mlp', 'hidden_dims': '[256, 128, 64]', 'dropout': 0.41314357415569625, 'batch_norm': False, 'lr': 3.952233718592101e-06, 'weight_decay': 0.00026754769258252603, 'epochs': 149, 'loss': 'mse', 'optimizer': 'adam', 'graph_mode': 'off', 'use_snp_selection': True, 'num_snps': 11571}. Best is trial 1 with value: 0.3456192548600153.
[I 2025-12-05 17:29:03,526] Trial 3 finished with value: 0.3765593265192691 and parameters: {'model_type': 'mlp', 'hidden_dims': '[512, 64]', 'dropout': 0.5938127374509361, 'batch_norm': False, 'lr': 5.67704586114731e-06, 'weight_decay': 2.4518087630137052e-05, 'epochs': 320, 'loss': 'mae', 'optimizer': 'adam', 'graph_mode': 'off', 'use_snp_selection': False}. Best is trial 3 with value: 0.3765593265192691.
[I 2025-12-05 17:30:07,309] Trial 4 finished with value: 0.3009084113989828 and parameters: {'model_type': 'mlp', 'hidden_dims': '[512, 128]', 'dropout': 0.25746343592134413, 'batch_norm': True, 'lr': 1.3467657668402788e-06, 'weight_decay': 0.00033087251918647806, 'epochs': 277, 'loss': 'mse', 'optimizer': 'adam', 'graph_mode': 'off', 'use_snp_selection': True, 'num_snps': 36675}. Best is trial 3 with value: 0.3765593265192691.
[I 2025-12-05 17:30:53,351] Trial 5 finished with value: 0.2864245920763181 and parameters: {'model_type': 'mlp', 'hidden_dims': '[512, 64]', 'dropout': 0.38275350994408375, 'batch_norm': True, 'lr': 1.5586664309232824e-06, 'weight_decay': 0.0008227664668621182, 'epochs': 145, 'loss': 'mae', 'optimizer': 'adam', 'graph_mode': 'off', 'use_snp_selection': True, 'num_snps': 32148}. Best is trial 3 with value: 0.3765593265192691.
[I 2025-12-05 17:31:17,248] Trial 6 finished with value: 0.35227644964708965 and parameters: {'model_type': 'mlp', 'hidden_dims': '[256, 128]', 'dropout': 0.3930109900265879, 'batch_norm': False, 'lr': 4.892964372128395e-05, 'weight_decay': 1.5809549317992182e-06, 'epochs': 199, 'loss': 'mse', 'optimizer': 'adam', 'graph_mode': 'off', 'use_snp_selection': False}. Best is trial 3 with value: 0.3765593265192691.
[I 2025-12-05 17:31:41,290] Trial 7 finished with value: 0.34881540562491037 and parameters: {'model_type': 'mlp', 'hidden_dims': '[512, 256]', 'dropout': 0.15343979219678458, 'batch_norm': True, 'lr': 6.234003099047341e-05, 'weight_decay': 3.894760610535477e-07, 'epochs': 97, 'loss': 'mse', 'optimizer': 'adam', 'graph_mode': 'off', 'use_snp_selection': False}. Best is trial 3 with value: 0.3765593265192691.
[I 2025-12-05 17:32:46,817] Trial 8 finished with value: 0.3400475373644716 and parameters: {'model_type': 'mlp', 'hidden_dims': '[512, 128]', 'dropout': 0.10743001231661406, 'batch_norm': True, 'lr': 0.00023728538449271062, 'weight_decay': 1.7629071578048637e-05, 'epochs': 312, 'loss': 'mae', 'optimizer': 'adam', 'graph_mode': 'off', 'use_snp_selection': False}. Best is trial 3 with value: 0.3765593265192691.
[I 2025-12-05 17:33:26,235] Trial 9 finished with value: 0.3444505318254712 and parameters: {'model_type': 'mlp', 'hidden_dims': '[512, 64]', 'dropout': 0.14505336736221927, 'batch_norm': True, 'lr': 5.8619638388111826e-05, 'weight_decay': 6.200156172669308e-07, 'epochs': 175, 'loss': 'mse', 'optimizer': 'adam', 'graph_mode': 'off', 'use_snp_selection': False}. Best is trial 3 with value: 0.3765593265192691.
[I 2025-12-05 17:33:41,368] Trial 10 finished with value: 0.35672898541602616 and parameters: {'model_type': 'mlp', 'hidden_dims': '[512, 64]', 'dropout': 0.5885461262002587, 'batch_norm': False, 'lr': 8.769366258768696e-06, 'weight_decay': 2.78273193871783e-06, 'epochs': 55, 'loss': 'mae', 'optimizer': 'adam', 'graph_mode': 'off', 'use_snp_selection': False}. Best is trial 3 with value: 0.3765593265192691.
[I 2025-12-05 17:34:00,607] Trial 11 finished with value: 0.368382164630888 and parameters: {'model_type': 'mlp', 'hidden_dims': '[512, 64]', 'dropout': 0.583942291816117, 'batch_norm': False, 'lr': 1.1821335968986158e-05, 'weight_decay': 4.061640528568547e-06, 'epochs': 77, 'loss': 'mae', 'optimizer': 'adam', 'graph_mode': 'off', 'use_snp_selection': False}. Best is trial 3 with value: 0.3765593265192691.
[I 2025-12-05 17:34:12,851] Trial 12 finished with value: 0.3316842365663004 and parameters: {'model_type': 'mlp', 'hidden_dims': '[512, 64]', 'dropout': 0.593097749012682, 'batch_norm': False, 'lr': 1.2808693622626188e-05, 'weight_decay': 1.3081036432574914e-07, 'epochs': 40, 'loss': 'mae', 'optimizer': 'adam', 'graph_mode': 'off', 'use_snp_selection': False}. Best is trial 3 with value: 0.3765593265192691.
[I 2025-12-05 17:35:01,969] Trial 13 finished with value: 0.36258966265941694 and parameters: {'model_type': 'mlp', 'hidden_dims': '[512, 64]', 'dropout': 0.5043641748401543, 'batch_norm': False, 'lr': 1.3373175420781734e-05, 'weight_decay': 4.373608364627903e-05, 'epochs': 235, 'loss': 'mae', 'optimizer': 'adam', 'graph_mode': 'off', 'use_snp_selection': False}. Best is trial 3 with value: 0.3765593265192691.
[I 2025-12-05 17:35:11,014] Trial 14 finished with value: 0.34085505437304436 and parameters: {'model_type': 'mlp', 'hidden_dims': '[128, 64]', 'dropout': 0.5300180653494536, 'batch_norm': False, 'lr': 5.096356034191146e-06, 'weight_decay': 4.57067734295802e-06, 'epochs': 93, 'loss': 'mae', 'optimizer': 'adam', 'graph_mode': 'off', 'use_snp_selection': False}. Best is trial 3 with value: 0.3765593265192691.
[I 2025-12-05 17:36:09,029] Trial 15 finished with value: 0.3589172383309532 and parameters: {'model_type': 'mlp', 'hidden_dims': '[512, 256]', 'dropout': 0.29817671914947536, 'batch_norm': False, 'lr': 1.8411764708572348e-05, 'weight_decay': 4.4084956876871386e-05, 'epochs': 278, 'loss': 'mae', 'optimizer': 'adam', 'graph_mode': 'off', 'use_snp_selection': False}. Best is trial 3 with value: 0.3765593265192691.
[I 2025-12-05 17:36:48,452] Trial 16 finished with value: 0.32745165313507524 and parameters: {'model_type': 'mlp', 'hidden_dims': '[256, 128, 64]', 'dropout': 0.4992385332513618, 'batch_norm': False, 'lr': 0.00017549215405955411, 'weight_decay': 6.80662468241148e-06, 'epochs': 350, 'loss': 'mae', 'optimizer': 'adam', 'graph_mode': 'off', 'use_snp_selection': False}. Best is trial 3 with value: 0.3765593265192691.
[I 2025-12-05 17:37:14,858] Trial 17 finished with value: 0.09548579776066861 and parameters: {'model_type': 'mlp', 'hidden_dims': '[512, 64]', 'dropout': 0.543474321376226, 'batch_norm': False, 'lr': 0.000906375209920231, 'weight_decay': 1.3398043894594233e-06, 'epochs': 113, 'loss': 'mae', 'optimizer': 'adam', 'graph_mode': 'off', 'use_snp_selection': False}. Best is trial 3 with value: 0.3765593265192691.
[I 2025-12-05 17:38:31,859] Trial 18 finished with value: 0.3822386229851775 and parameters: {'model_type': 'mlp', 'hidden_dims': '[512, 64]', 'dropout': 0.4928065509878574, 'batch_norm': False, 'lr': 3.4071412855829388e-06, 'weight_decay': 0.00012275232383599145, 'epochs': 214, 'loss': 'mae', 'optimizer': 'adam', 'graph_mode': 'off', 'use_snp_selection': True, 'num_snps': 58241}. Best is trial 18 with value: 0.3822386229851775.
[I 2025-12-05 17:39:47,690] Trial 19 finished with value: 0.37553500696324243 and parameters: {'model_type': 'mlp', 'hidden_dims': '[512, 64]', 'dropout': 0.47355279224247543, 'batch_norm': False, 'lr': 3.558104577254903e-06, 'weight_decay': 0.00015299712892081902, 'epochs': 220, 'loss': 'mae', 'optimizer': 'adam', 'graph_mode': 'off', 'use_snp_selection': True, 'num_snps': 55667}. Best is trial 18 with value: 0.3822386229851775.
[I 2025-12-05 17:41:15,642] Trial 20 finished with value: 0.369485713845039 and parameters: {'model_type': 'mlp', 'hidden_dims': '[512, 256]', 'dropout': 0.34258156279977026, 'batch_norm': False, 'lr': 2.6947108542472294e-06, 'weight_decay': 0.00010232480909485412, 'epochs': 279, 'loss': 'mae', 'optimizer': 'adam', 'graph_mode': 'off', 'use_snp_selection': True, 'num_snps': 57703}. Best is trial 18 with value: 0.3822386229851775.
[I 2025-12-05 17:42:35,304] Trial 21 finished with value: 0.377163095043633 and parameters: {'model_type': 'mlp', 'hidden_dims': '[512, 64]', 'dropout': 0.4712114550042495, 'batch_norm': False, 'lr': 5.375530754466607e-06, 'weight_decay': 0.00011727750911803841, 'epochs': 220, 'loss': 'mae', 'optimizer': 'adam', 'graph_mode': 'off', 'use_snp_selection': True, 'num_snps': 59811}. Best is trial 18 with value: 0.3822386229851775.
[I 2025-12-05 17:43:48,895] Trial 22 finished with value: 0.3724487970874609 and parameters: {'model_type': 'mlp', 'hidden_dims': '[512, 64]', 'dropout': 0.45609671190547896, 'batch_norm': False, 'lr': 5.010086366325364e-06, 'weight_decay': 1.9313690787220153e-05, 'epochs': 190, 'loss': 'mae', 'optimizer': 'adam', 'graph_mode': 'off', 'use_snp_selection': True, 'num_snps': 58828}. Best is trial 18 with value: 0.3822386229851775.
[I 2025-12-05 17:44:30,089] Trial 23 finished with value: 0.3734149084900196 and parameters: {'model_type': 'mlp', 'hidden_dims': '[512, 64]', 'dropout': 0.5457724774320233, 'batch_norm': False, 'lr': 7.006416983641065e-06, 'weight_decay': 0.0006636831771235611, 'epochs': 256, 'loss': 'mae', 'optimizer': 'adam', 'graph_mode': 'off', 'use_snp_selection': True, 'num_snps': 17926}. Best is trial 18 with value: 0.3822386229851775.
[I 2025-12-05 17:45:46,025] Trial 24 finished with value: 0.35213745620178755 and parameters: {'model_type': 'mlp', 'hidden_dims': '[512, 64]', 'dropout': 0.47727813802796587, 'batch_norm': False, 'lr': 2.3528762955371375e-05, 'weight_decay': 0.00012262219309121857, 'epochs': 306, 'loss': 'mae', 'optimizer': 'adam', 'graph_mode': 'off', 'use_snp_selection': True, 'num_snps': 44859}. Best is trial 18 with value: 0.3822386229851775.
[I 2025-12-05 17:46:46,521] Trial 25 finished with value: 0.32384195813012007 and parameters: {'model_type': 'mlp', 'hidden_dims': '[512, 128]', 'dropout': 0.5472566816920805, 'batch_norm': False, 'lr': 1.0330290508933576e-06, 'weight_decay': 2.56676638461767e-05, 'epochs': 162, 'loss': 'mae', 'optimizer': 'adam', 'graph_mode': 'off', 'use_snp_selection': True, 'num_snps': 48648}. Best is trial 18 with value: 0.3822386229851775.
[I 2025-12-05 17:47:24,012] Trial 26 finished with value: 0.37259332418564484 and parameters: {'model_type': 'mlp', 'hidden_dims': '[256, 128]', 'dropout': 0.3264359686733017, 'batch_norm': False, 'lr': 2.751432006122694e-06, 'weight_decay': 0.0003019938264709172, 'epochs': 213, 'loss': 'mse', 'optimizer': 'adam', 'graph_mode': 'off', 'use_snp_selection': True, 'num_snps': 25205}. Best is trial 18 with value: 0.3822386229851775.
[I 2025-12-05 17:48:25,008] Trial 27 finished with value: 0.36479568067186097 and parameters: {'model_type': 'mlp', 'hidden_dims': '[256, 128, 64]', 'dropout': 0.43141166825998795, 'batch_norm': False, 'lr': 7.249239313142331e-06, 'weight_decay': 7.517656424070059e-05, 'epochs': 310, 'loss': 'mae', 'optimizer': 'adam', 'graph_mode': 'off', 'use_snp_selection': True, 'num_snps': 51399}. Best is trial 18 with value: 0.3822386229851775.
[I 2025-12-05 17:48:48,411] Trial 28 finished with value: 0.35618617661899465 and parameters: {'model_type': 'mlp', 'hidden_dims': '[128, 64]', 'dropout': 0.5142695602712549, 'batch_norm': False, 'lr': 3.264823670856648e-05, 'weight_decay': 0.00018506472565614395, 'epochs': 131, 'loss': 'mae', 'optimizer': 'adam', 'graph_mode': 'off', 'use_snp_selection': True, 'num_snps': 3579}. Best is trial 18 with value: 0.3822386229851775.
[I 2025-12-05 17:49:30,208] Trial 29 finished with value: 0.35718992679512396 and parameters: {'model_type': 'mlp', 'hidden_dims': '[128, 64]', 'dropout': 0.5643813348668664, 'batch_norm': False, 'lr': 2.2583459898128754e-06, 'weight_decay': 3.754305687880231e-05, 'epochs': 263, 'loss': 'mae', 'optimizer': 'adam', 'graph_mode': 'off', 'use_snp_selection': True, 'num_snps': 39638}. Best is trial 18 with value: 0.3822386229851775.
[I 2025-12-05 17:50:35,089] Trial 30 finished with value: 0.3733937819921259 and parameters: {'model_type': 'mlp', 'hidden_dims': '[512, 64]', 'dropout': 0.3802642448727081, 'batch_norm': False, 'lr': 1.8717720058235835e-06, 'weight_decay': 6.746737524292793e-05, 'epochs': 187, 'loss': 'mae', 'optimizer': 'adam', 'graph_mode': 'off', 'use_snp_selection': True, 'num_snps': 50007}. Best is trial 18 with value: 0.3822386229851775.
[I 2025-12-05 17:51:53,607] Trial 31 finished with value: 0.3752983929585171 and parameters: {'model_type': 'mlp', 'hidden_dims': '[512, 64]', 'dropout': 0.47965732093640095, 'batch_norm': False, 'lr': 3.792491442915772e-06, 'weight_decay': 0.0001846465777739665, 'epochs': 217, 'loss': 'mae', 'optimizer': 'adam', 'graph_mode': 'off', 'use_snp_selection': True, 'num_snps': 59246}. Best is trial 18 with value: 0.3822386229851775.
[I 2025-12-05 17:53:07,920] Trial 32 finished with value: 0.3739134274968022 and parameters: {'model_type': 'mlp', 'hidden_dims': '[512, 64]', 'dropout': 0.45762374234186587, 'batch_norm': False, 'lr': 3.1667791219516405e-06, 'weight_decay': 0.0004943278576551398, 'epochs': 228, 'loss': 'mae', 'optimizer': 'adam', 'graph_mode': 'off', 'use_snp_selection': True, 'num_snps': 53228}. Best is trial 18 with value: 0.3822386229851775.
[I 2025-12-05 17:54:25,458] Trial 33 finished with value: 0.3737663725024925 and parameters: {'model_type': 'mlp', 'hidden_dims': '[512, 64]', 'dropout': 0.4205650973541829, 'batch_norm': False, 'lr': 5.9513686163102055e-06, 'weight_decay': 1.2113337937410407e-05, 'epochs': 245, 'loss': 'mae', 'optimizer': 'adam', 'graph_mode': 'off', 'use_snp_selection': True, 'num_snps': 53746}. Best is trial 18 with value: 0.3822386229851775.
[I 2025-12-05 17:55:23,265] Trial 34 finished with value: 0.3337610318861898 and parameters: {'model_type': 'mlp', 'hidden_dims': '[256, 128]', 'dropout': 0.240844481425324, 'batch_norm': True, 'lr': 9.896662115478166e-06, 'weight_decay': 0.00014558575784970595, 'epochs': 210, 'loss': 'mae', 'optimizer': 'adam', 'graph_mode': 'off', 'use_snp_selection': True, 'num_snps': 58627}. Best is trial 18 with value: 0.3822386229851775.
[I 2025-12-05 17:56:21,758] Trial 35 finished with value: 0.34107212807724163 and parameters: {'model_type': 'mlp', 'hidden_dims': '[512, 64]', 'dropout': 0.47665069595857895, 'batch_norm': False, 'lr': 1.0043037681427614e-06, 'weight_decay': 0.0004176969982687859, 'epochs': 170, 'loss': 'mse', 'optimizer': 'adam', 'graph_mode': 'off', 'use_snp_selection': True, 'num_snps': 45063}. Best is trial 18 with value: 0.3822386229851775.
[I 2025-12-05 17:57:23,158] Trial 36 finished with value: 0.3692445910307788 and parameters: {'model_type': 'mlp', 'hidden_dims': '[256, 128, 64]', 'dropout': 0.3962009561747507, 'batch_norm': False, 'lr': 4.40988286393976e-06, 'weight_decay': 7.450149701798831e-05, 'epochs': 293, 'loss': 'mae', 'optimizer': 'adam', 'graph_mode': 'off', 'use_snp_selection': True, 'num_snps': 53955}. Best is trial 18 with value: 0.3822386229851775.
[I 2025-12-05 17:58:38,903] Trial 37 finished with value: 0.3145101420152385 and parameters: {'model_type': 'mlp', 'hidden_dims': '[512, 128]', 'dropout': 0.44259822117706016, 'batch_norm': True, 'lr': 1.5176646638974008e-06, 'weight_decay': 0.0002103617205443855, 'epochs': 329, 'loss': 'mse', 'optimizer': 'adam', 'graph_mode': 'off', 'use_snp_selection': True, 'num_snps': 40439}. Best is trial 18 with value: 0.3822386229851775.
[I 2025-12-05 17:59:29,586] Trial 38 finished with value: 0.3617014956323728 and parameters: {'model_type': 'mlp', 'hidden_dims': '[512, 64]', 'dropout': 0.36742304478620247, 'batch_norm': False, 'lr': 1.9565205720184797e-05, 'weight_decay': 3.2192671476803027e-05, 'epochs': 259, 'loss': 'mae', 'optimizer': 'adam', 'graph_mode': 'off', 'use_snp_selection': True, 'num_snps': 26428}. Best is trial 18 with value: 0.3822386229851775.
[I 2025-12-05 18:00:34,395] Trial 39 finished with value: 0.338683659068516 and parameters: {'model_type': 'mlp', 'hidden_dims': '[512, 64]', 'dropout': 0.5686986722546501, 'batch_norm': True, 'lr': 1.89343252615054e-06, 'weight_decay': 0.0009134062407675706, 'epochs': 202, 'loss': 'mae', 'optimizer': 'adam', 'graph_mode': 'off', 'use_snp_selection': True, 'num_snps': 46917}. Best is trial 18 with value: 0.3822386229851775.
[I 2025-12-05 18:01:36,849] Trial 40 finished with value: 0.35501422252831 and parameters: {'model_type': 'mlp', 'hidden_dims': '[512, 256]', 'dropout': 0.5179190374129228, 'batch_norm': False, 'lr': 3.70615391686689e-05, 'weight_decay': 1.1168840575051137e-05, 'epochs': 154, 'loss': 'mse', 'optimizer': 'adam', 'graph_mode': 'off', 'use_snp_selection': True, 'num_snps': 54160}. Best is trial 18 with value: 0.3822386229851775.
[I 2025-12-05 18:02:56,269] Trial 41 finished with value: 0.3719261218739744 and parameters: {'model_type': 'mlp', 'hidden_dims': '[512, 64]', 'dropout': 0.48250623649771923, 'batch_norm': False, 'lr': 3.4992352317647614e-06, 'weight_decay': 0.00023168779246642135, 'epochs': 223, 'loss': 'mae', 'optimizer': 'adam', 'graph_mode': 'off', 'use_snp_selection': True, 'num_snps': 58955}. Best is trial 18 with value: 0.3822386229851775.
[I 2025-12-05 18:04:16,477] Trial 42 finished with value: 0.3779180878982097 and parameters: {'model_type': 'mlp', 'hidden_dims': '[512, 64]', 'dropout': 0.461171022536467, 'batch_norm': False, 'lr': 4.271350167120746e-06, 'weight_decay': 9.605515434348033e-05, 'epochs': 245, 'loss': 'mae', 'optimizer': 'adam', 'graph_mode': 'off', 'use_snp_selection': True, 'num_snps': 56041}. Best is trial 18 with value: 0.3822386229851775.
[I 2025-12-05 18:05:35,024] Trial 43 finished with value: 0.3667875345297111 and parameters: {'model_type': 'mlp', 'hidden_dims': '[512, 64]', 'dropout': 0.414845430020565, 'batch_norm': False, 'lr': 7.880795138180244e-06, 'weight_decay': 9.955630978031257e-05, 'epochs': 243, 'loss': 'mae', 'optimizer': 'adam', 'graph_mode': 'off', 'use_snp_selection': True, 'num_snps': 55170}. Best is trial 18 with value: 0.3822386229851775.
[I 2025-12-05 18:06:15,469] Trial 44 finished with value: 0.3742101553338789 and parameters: {'model_type': 'mlp', 'hidden_dims': '[512, 64]', 'dropout': 0.4014071676198549, 'batch_norm': False, 'lr': 4.337636796549701e-06, 'weight_decay': 2.3225451404601837e-05, 'epochs': 185, 'loss': 'mae', 'optimizer': 'adam', 'graph_mode': 'off', 'use_snp_selection': False}. Best is trial 18 with value: 0.3822386229851775.
[I 2025-12-05 18:07:16,977] Trial 45 finished with value: 0.33441352738553076 and parameters: {'model_type': 'mlp', 'hidden_dims': '[256, 128]', 'dropout': 0.4530009723133068, 'batch_norm': True, 'lr': 0.00011749650261212473, 'weight_decay': 5.007848837555397e-05, 'epochs': 331, 'loss': 'mae', 'optimizer': 'adam', 'graph_mode': 'off', 'use_snp_selection': True, 'num_snps': 49036}. Best is trial 18 with value: 0.3822386229851775.
[I 2025-12-05 18:08:06,739] Trial 46 finished with value: 0.3718246678848959 and parameters: {'model_type': 'mlp', 'hidden_dims': '[512, 64]', 'dropout': 0.49953567224597534, 'batch_norm': False, 'lr': 2.3168560671305665e-06, 'weight_decay': 0.00034738817961141386, 'epochs': 234, 'loss': 'mae', 'optimizer': 'adam', 'graph_mode': 'off', 'use_snp_selection': False}. Best is trial 18 with value: 0.3822386229851775.
[I 2025-12-05 18:09:06,171] Trial 47 finished with value: 0.3740366304155197 and parameters: {'model_type': 'mlp', 'hidden_dims': '[512, 128]', 'dropout': 0.5305485766476876, 'batch_norm': False, 'lr': 9.741138244278191e-06, 'weight_decay': 0.000140728607787267, 'epochs': 202, 'loss': 'mae', 'optimizer': 'adam', 'graph_mode': 'off', 'use_snp_selection': True, 'num_snps': 40574}. Best is trial 18 with value: 0.3822386229851775.
[I 2025-12-05 18:10:01,797] Trial 48 finished with value: 0.3427554221371264 and parameters: {'model_type': 'mlp', 'hidden_dims': '[512, 64]', 'dropout': 0.43013004807586874, 'batch_norm': False, 'lr': 1.736861125127711e-05, 'weight_decay': 6.012014492907765e-05, 'epochs': 268, 'loss': 'mse', 'optimizer': 'adam', 'graph_mode': 'off', 'use_snp_selection': False}. Best is trial 18 with value: 0.3822386229851775.
[I 2025-12-05 18:10:19,973] Trial 49 finished with value: 0.3679231764455098 and parameters: {'model_type': 'mlp', 'hidden_dims': '[128, 64]', 'dropout': 0.570481253126383, 'batch_norm': False, 'lr': 5.971558120955496e-06, 'weight_decay': 0.0006333519947775161, 'epochs': 247, 'loss': 'mae', 'optimizer': 'adam', 'graph_mode': 'off', 'use_snp_selection': False}. Best is trial 18 with value: 0.3822386229851775.
[I 2025-12-05 18:11:47,756] Trial 50 finished with value: 0.3334946733400515 and parameters: {'model_type': 'mlp', 'hidden_dims': '[512, 64]', 'dropout': 0.5976459895867611, 'batch_norm': True, 'lr': 1.5891075680526322e-06, 'weight_decay': 8.998846246626306e-05, 'epochs': 289, 'loss': 'mae', 'optimizer': 'adam', 'graph_mode': 'off', 'use_snp_selection': True, 'num_snps': 55380}. Best is trial 18 with value: 0.3822386229851775.
