[I 2025-12-05 23:56:28,865] Trial 69 finished with value: 0.23508312563550238 and parameters: {'model_type': 'mlp', 'hidden_dims': '[512, 256]', 'dropout': 0.2735927955501695, 'batch_norm': False, 'lr': 1.6496478542664777e-05, 'weight_decay': 1.0474171083010397e-07, 'epochs': 128, 'loss': 'mae', 'optimizer': 'adam', 'graph_mode': 'off', 'use_snp_selection': True, 'num_snps': 51267}. Best is trial 23 with value: 0.26245140985759446.
[I 2025-12-05 23:57:33,015] Trial 70 finished with value: 0.23687110576012 and parameters: {'model_type': 'mlp', 'hidden_dims': '[512, 64]', 'dropout': 0.4195110766361489, 'batch_norm': False, 'lr': 3.4238020871009598e-06, 'weight_decay': 5.829027911160859e-07, 'epochs': 101, 'loss': 'mae', 'optimizer': 'adam', 'graph_mode': 'off', 'use_snp_selection': True, 'num_snps': 54677}. Best is trial 23 with value: 0.26245140985759446.
[I 2025-12-05 23:58:34,230] Trial 71 finished with value: 0.2642535058997173 and parameters: {'model_type': 'mlp', 'hidden_dims': '[512, 256]', 'dropout': 0.3688237689061259, 'batch_norm': False, 'lr': 4.654039068366625e-06, 'weight_decay': 1.9688781307243335e-07, 'epochs': 78, 'loss': 'mae', 'optimizer': 'adam', 'graph_mode': 'off', 'use_snp_selection': True, 'num_snps': 57336}. Best is trial 71 with value: 0.2642535058997173.
[I 2025-12-05 23:59:33,493] Trial 72 finished with value: 0.2476249163244872 and parameters: {'model_type': 'mlp', 'hidden_dims': '[512, 256]', 'dropout': 0.32214130596941537, 'batch_norm': False, 'lr': 4.607754155871629e-06, 'weight_decay': 1.8934177377822528e-07, 'epochs': 68, 'loss': 'mae', 'optimizer': 'adam', 'graph_mode': 'off', 'use_snp_selection': True, 'num_snps': 57576}. Best is trial 71 with value: 0.2642535058997173.
[I 2025-12-06 00:00:24,751] Trial 73 finished with value: 0.25696330892166597 and parameters: {'model_type': 'mlp', 'hidden_dims': '[512, 256]', 'dropout': 0.3448002588138425, 'batch_norm': False, 'lr': 1.0307867507914526e-05, 'weight_decay': 3.029829615631404e-07, 'epochs': 52, 'loss': 'mae', 'optimizer': 'adam', 'graph_mode': 'off', 'use_snp_selection': True, 'num_snps': 48709}. Best is trial 71 with value: 0.2642535058997173.
[I 2025-12-06 00:01:16,937] Trial 74 finished with value: 0.24429791546742155 and parameters: {'model_type': 'mlp', 'hidden_dims': '[512, 256]', 'dropout': 0.3499699921088232, 'batch_norm': False, 'lr': 1.1048573962764908e-05, 'weight_decay': 3.5859984083317686e-07, 'epochs': 53, 'loss': 'mae', 'optimizer': 'adam', 'graph_mode': 'off', 'use_snp_selection': True, 'num_snps': 49474}. Best is trial 71 with value: 0.2642535058997173.
[I 2025-12-06 00:02:13,117] Trial 75 finished with value: 0.24804060858550964 and parameters: {'model_type': 'mlp', 'hidden_dims': '[512, 256]', 'dropout': 0.4342579534908163, 'batch_norm': False, 'lr': 8.857691163908548e-06, 'weight_decay': 0.0006180967263134995, 'epochs': 82, 'loss': 'mae', 'optimizer': 'adam', 'graph_mode': 'off', 'use_snp_selection': True, 'num_snps': 47782}. Best is trial 71 with value: 0.2642535058997173.
[I 2025-12-06 00:03:01,419] Trial 76 finished with value: 0.2457128127528707 and parameters: {'model_type': 'mlp', 'hidden_dims': '[256, 128]', 'dropout': 0.3430051373350907, 'batch_norm': False, 'lr': 1.3487885476555446e-05, 'weight_decay': 2.1388897612922936e-07, 'epochs': 91, 'loss': 'mae', 'optimizer': 'adam', 'graph_mode': 'off', 'use_snp_selection': True, 'num_snps': 45134}. Best is trial 71 with value: 0.2642535058997173.
[I 2025-12-06 00:03:22,536] Trial 77 finished with value: 0.24930517678711617 and parameters: {'model_type': 'mlp', 'hidden_dims': '[512, 128]', 'dropout': 0.36663717520437145, 'batch_norm': False, 'lr': 6.7483890750911695e-06, 'weight_decay': 1.475304528122393e-07, 'epochs': 57, 'loss': 'mae', 'optimizer': 'adam', 'graph_mode': 'off', 'use_snp_selection': False}. Best is trial 71 with value: 0.2642535058997173.
[I 2025-12-06 00:04:20,568] Trial 78 finished with value: 0.2492395410040535 and parameters: {'model_type': 'mlp', 'hidden_dims': '[512, 256]', 'dropout': 0.37859835112969786, 'batch_norm': False, 'lr': 3.242772153999341e-06, 'weight_decay': 5.190095928030331e-07, 'epochs': 74, 'loss': 'mae', 'optimizer': 'adam', 'graph_mode': 'off', 'use_snp_selection': True, 'num_snps': 53325}. Best is trial 71 with value: 0.2642535058997173.
[I 2025-12-06 00:05:14,327] Trial 79 finished with value: 0.2435191587721211 and parameters: {'model_type': 'mlp', 'hidden_dims': '[512, 256]', 'dropout': 0.3980635074551245, 'batch_norm': False, 'lr': 4.583664003948242e-06, 'weight_decay': 2.952554802130836e-07, 'epochs': 96, 'loss': 'mae', 'optimizer': 'adam', 'graph_mode': 'off', 'use_snp_selection': True, 'num_snps': 40543}. Best is trial 71 with value: 0.2642535058997173.
[I 2025-12-06 00:06:08,035] Trial 80 finished with value: 0.22162969735527543 and parameters: {'model_type': 'mlp', 'hidden_dims': '[256, 128, 64]', 'dropout': 0.3608944348973271, 'batch_norm': True, 'lr': 9.399034356240213e-06, 'weight_decay': 1.0637795588411847e-06, 'epochs': 119, 'loss': 'mse', 'optimizer': 'adam', 'graph_mode': 'off', 'use_snp_selection': True, 'num_snps': 51559}. Best is trial 71 with value: 0.2642535058997173.
[I 2025-12-06 00:06:27,158] Trial 81 finished with value: 0.24158613139149968 and parameters: {'model_type': 'mlp', 'hidden_dims': '[512, 128]', 'dropout': 0.3705499616847611, 'batch_norm': False, 'lr': 6.72079440311798e-06, 'weight_decay': 1.537726117527887e-07, 'epochs': 49, 'loss': 'mae', 'optimizer': 'adam', 'graph_mode': 'off', 'use_snp_selection': False}. Best is trial 71 with value: 0.2642535058997173.
[I 2025-12-06 00:06:48,812] Trial 82 finished with value: 0.2392898191569161 and parameters: {'model_type': 'mlp', 'hidden_dims': '[512, 128]', 'dropout': 0.4096631306966609, 'batch_norm': False, 'lr': 7.723713902090464e-06, 'weight_decay': 1.0636837948089303e-07, 'epochs': 59, 'loss': 'mae', 'optimizer': 'adam', 'graph_mode': 'off', 'use_snp_selection': False}. Best is trial 71 with value: 0.2642535058997173.
[I 2025-12-06 00:07:12,736] Trial 83 finished with value: 0.2592760600233044 and parameters: {'model_type': 'mlp', 'hidden_dims': '[512, 128]', 'dropout': 0.3642745495346973, 'batch_norm': False, 'lr': 6.775310023417348e-06, 'weight_decay': 3.791089418205016e-07, 'epochs': 68, 'loss': 'mae', 'optimizer': 'adam', 'graph_mode': 'off', 'use_snp_selection': False}. Best is trial 71 with value: 0.2642535058997173.
[I 2025-12-06 00:07:36,738] Trial 84 finished with value: 0.2479228137063977 and parameters: {'model_type': 'mlp', 'hidden_dims': '[512, 128]', 'dropout': 0.34295601022399114, 'batch_norm': False, 'lr': 2.782528039591617e-06, 'weight_decay': 3.9124609963255393e-07, 'epochs': 68, 'loss': 'mae', 'optimizer': 'adam', 'graph_mode': 'off', 'use_snp_selection': False}. Best is trial 71 with value: 0.2642535058997173.
[I 2025-12-06 00:08:05,096] Trial 85 finished with value: 0.24889626294826545 and parameters: {'model_type': 'mlp', 'hidden_dims': '[512, 256]', 'dropout': 0.3253336146698864, 'batch_norm': False, 'lr': 4.078663638356674e-06, 'weight_decay': 2.222312706451584e-07, 'epochs': 85, 'loss': 'mae', 'optimizer': 'adam', 'graph_mode': 'off', 'use_snp_selection': False}. Best is trial 71 with value: 0.2642535058997173.
[I 2025-12-06 00:08:30,938] Trial 86 finished with value: 0.1871839788748168 and parameters: {'model_type': 'mlp', 'hidden_dims': '[512, 256]', 'dropout': 0.3898905752228753, 'batch_norm': False, 'lr': 1.4545132539847464e-06, 'weight_decay': 1.4230268190965867e-06, 'epochs': 75, 'loss': 'mae', 'optimizer': 'adam', 'graph_mode': 'off', 'use_snp_selection': False}. Best is trial 71 with value: 0.2642535058997173.
[I 2025-12-06 00:09:21,656] Trial 87 finished with value: 0.22579076143704238 and parameters: {'model_type': 'mlp', 'hidden_dims': '[512, 256]', 'dropout': 0.29885432242736903, 'batch_norm': False, 'lr': 2.052094531232318e-06, 'weight_decay': 3.1027122893531897e-07, 'epochs': 44, 'loss': 'mae', 'optimizer': 'adam', 'graph_mode': 'off', 'use_snp_selection': True, 'num_snps': 49036}. Best is trial 71 with value: 0.2642535058997173.
[I 2025-12-06 00:10:18,553] Trial 88 finished with value: 0.25453882042015663 and parameters: {'model_type': 'mlp', 'hidden_dims': '[512, 128]', 'dropout': 0.35430578647119676, 'batch_norm': False, 'lr': 6.0446141131288815e-06, 'weight_decay': 6.290535474881266e-06, 'epochs': 64, 'loss': 'mae', 'optimizer': 'adam', 'graph_mode': 'off', 'use_snp_selection': True, 'num_snps': 53883}. Best is trial 71 with value: 0.2642535058997173.
[I 2025-12-06 00:11:15,706] Trial 89 finished with value: 0.2339125308910149 and parameters: {'model_type': 'mlp', 'hidden_dims': '[512, 128]', 'dropout': 0.382100948049916, 'batch_norm': False, 'lr': 5.952792980373723e-06, 'weight_decay': 4.4034788960540014e-07, 'epochs': 62, 'loss': 'mae', 'optimizer': 'adam', 'graph_mode': 'off', 'use_snp_selection': True, 'num_snps': 54765}. Best is trial 71 with value: 0.2642535058997173.
[I 2025-12-06 00:12:15,365] Trial 90 finished with value: 0.2392483991996215 and parameters: {'model_type': 'mlp', 'hidden_dims': '[512, 128]', 'dropout': 0.3554284183867783, 'batch_norm': False, 'lr': 1.127833475949856e-05, 'weight_decay': 6.755846378264581e-07, 'epochs': 79, 'loss': 'mae', 'optimizer': 'adam', 'graph_mode': 'off', 'use_snp_selection': True, 'num_snps': 53178}. Best is trial 71 with value: 0.2642535058997173.
[I 2025-12-06 00:13:15,463] Trial 91 finished with value: 0.2403082748774336 and parameters: {'model_type': 'mlp', 'hidden_dims': '[512, 128]', 'dropout': 0.33775860901464105, 'batch_norm': False, 'lr': 5.1642749289556805e-06, 'weight_decay': 7.1470727041268455e-06, 'epochs': 70, 'loss': 'mae', 'optimizer': 'adam', 'graph_mode': 'off', 'use_snp_selection': True, 'num_snps': 57031}. Best is trial 71 with value: 0.2642535058997173.
[I 2025-12-06 00:13:51,508] Trial 92 finished with value: 0.24576958811920813 and parameters: {'model_type': 'mlp', 'hidden_dims': '[512, 128]', 'dropout': 0.3523158481635977, 'batch_norm': False, 'lr': 8.123007529146514e-06, 'weight_decay': 1.2560446419587127e-05, 'epochs': 89, 'loss': 'mae', 'optimizer': 'adam', 'graph_mode': 'off', 'use_snp_selection': True, 'num_snps': 14959}. Best is trial 71 with value: 0.2642535058997173.
[I 2025-12-06 00:14:27,496] Trial 93 finished with value: 0.23162802712514546 and parameters: {'model_type': 'mlp', 'hidden_dims': '[512, 256]', 'dropout': 0.3167489065461714, 'batch_norm': False, 'lr': 3.968851088785112e-06, 'weight_decay': 5.580301041065505e-06, 'epochs': 48, 'loss': 'mae', 'optimizer': 'adam', 'graph_mode': 'off', 'use_snp_selection': True, 'num_snps': 19048}. Best is trial 71 with value: 0.2642535058997173.
[I 2025-12-06 00:14:58,896] Trial 94 finished with value: 0.2453543626381423 and parameters: {'model_type': 'mlp', 'hidden_dims': '[256, 128]', 'dropout': 0.37880847440393217, 'batch_norm': False, 'lr': 6.097537775308221e-06, 'weight_decay': 2.4770556278051714e-06, 'epochs': 106, 'loss': 'mae', 'optimizer': 'adam', 'graph_mode': 'off', 'use_snp_selection': True, 'num_snps': 9476}. Best is trial 71 with value: 0.2642535058997173.
[I 2025-12-06 00:15:56,686] Trial 95 finished with value: 0.25647348155494903 and parameters: {'model_type': 'mlp', 'hidden_dims': '[512, 64]', 'dropout': 0.2822213110328519, 'batch_norm': False, 'lr': 0.00010344733172741367, 'weight_decay': 3.676730690950108e-06, 'epochs': 58, 'loss': 'mae', 'optimizer': 'adam', 'graph_mode': 'off', 'use_snp_selection': True, 'num_snps': 58263}. Best is trial 71 with value: 0.2642535058997173.
[I 2025-12-06 00:16:54,847] Trial 96 finished with value: 0.2569642680941378 and parameters: {'model_type': 'mlp', 'hidden_dims': '[512, 64]', 'dropout': 0.10989189687296735, 'batch_norm': False, 'lr': 4.43494085227732e-05, 'weight_decay': 3.6198905274871302e-06, 'epochs': 59, 'loss': 'mae', 'optimizer': 'adam', 'graph_mode': 'off', 'use_snp_selection': True, 'num_snps': 58583}. Best is trial 71 with value: 0.2642535058997173.
[I 2025-12-06 00:17:53,121] Trial 97 finished with value: 0.2639384478322282 and parameters: {'model_type': 'mlp', 'hidden_dims': '[512, 64]', 'dropout': 0.15695682674256198, 'batch_norm': False, 'lr': 7.773573920918747e-05, 'weight_decay': 3.6362246677206347e-06, 'epochs': 60, 'loss': 'mae', 'optimizer': 'adam', 'graph_mode': 'off', 'use_snp_selection': True, 'num_snps': 58342}. Best is trial 71 with value: 0.2642535058997173.
[I 2025-12-06 00:18:51,548] Trial 98 finished with value: 0.216621900246037 and parameters: {'model_type': 'mlp', 'hidden_dims': '[512, 64]', 'dropout': 0.13328664757738026, 'batch_norm': True, 'lr': 8.563782123466903e-05, 'weight_decay': 3.5589453742942215e-06, 'epochs': 58, 'loss': 'mse', 'optimizer': 'adam', 'graph_mode': 'off', 'use_snp_selection': True, 'num_snps': 58648}. Best is trial 71 with value: 0.2642535058997173.
[I 2025-12-06 00:19:10,544] Trial 99 finished with value: 0.26328489181609943 and parameters: {'model_type': 'mlp', 'hidden_dims': '[512, 64]', 'dropout': 0.12087954472694662, 'batch_norm': False, 'lr': 7.310877900186115e-05, 'weight_decay': 4.2128449724866355e-06, 'epochs': 49, 'loss': 'mae', 'optimizer': 'adam', 'graph_mode': 'off', 'use_snp_selection': False}. Best is trial 71 with value: 0.2642535058997173.
[I 2025-12-06 00:19:29,303] Trial 100 finished with value: 0.2713285310457074 and parameters: {'model_type': 'mlp', 'hidden_dims': '[512, 64]', 'dropout': 0.10246232662540586, 'batch_norm': False, 'lr': 8.592238699231843e-05, 'weight_decay': 2.5403755768100877e-06, 'epochs': 48, 'loss': 'mae', 'optimizer': 'adam', 'graph_mode': 'off', 'use_snp_selection': False}. Best is trial 100 with value: 0.2713285310457074.
[I 2025-12-06 00:19:48,360] Trial 101 finished with value: 0.2700217907842706 and parameters: {'model_type': 'mlp', 'hidden_dims': '[512, 64]', 'dropout': 0.10410586428295099, 'batch_norm': False, 'lr': 8.547839948435133e-05, 'weight_decay': 4.201180444493013e-06, 'epochs': 49, 'loss': 'mae', 'optimizer': 'adam', 'graph_mode': 'off', 'use_snp_selection': False}. Best is trial 100 with value: 0.2713285310457074.
[I 2025-12-06 00:20:05,246] Trial 102 finished with value: 0.266093673890564 and parameters: {'model_type': 'mlp', 'hidden_dims': '[512, 64]', 'dropout': 0.10251695463491015, 'batch_norm': False, 'lr': 8.1863132764188e-05, 'weight_decay': 4.563316730318101e-06, 'epochs': 40, 'loss': 'mae', 'optimizer': 'adam', 'graph_mode': 'off', 'use_snp_selection': False}. Best is trial 100 with value: 0.2713285310457074.
[I 2025-12-06 00:20:24,348] Trial 103 finished with value: 0.2520780638634781 and parameters: {'model_type': 'mlp', 'hidden_dims': '[512, 64]', 'dropout': 0.10079634560640811, 'batch_norm': False, 'lr': 5.2864107815587974e-05, 'weight_decay': 2.647884681213268e-06, 'epochs': 49, 'loss': 'mae', 'optimizer': 'adam', 'graph_mode': 'off', 'use_snp_selection': False}. Best is trial 100 with value: 0.2713285310457074.
[I 2025-12-06 00:20:42,219] Trial 104 finished with value: 0.26565060299699594 and parameters: {'model_type': 'mlp', 'hidden_dims': '[512, 64]', 'dropout': 0.1320926460081602, 'batch_norm': False, 'lr': 6.755305893710991e-05, 'weight_decay': 2.1350581690073182e-06, 'epochs': 44, 'loss': 'mae', 'optimizer': 'adam', 'graph_mode': 'off', 'use_snp_selection': False}. Best is trial 100 with value: 0.2713285310457074.
[I 2025-12-06 00:20:59,112] Trial 105 finished with value: 0.24453035661751882 and parameters: {'model_type': 'mlp', 'hidden_dims': '[512, 64]', 'dropout': 0.11997239532420788, 'batch_norm': False, 'lr': 3.982200278038713e-05, 'weight_decay': 1.9044806348860684e-06, 'epochs': 40, 'loss': 'mae', 'optimizer': 'adam', 'graph_mode': 'off', 'use_snp_selection': False}. Best is trial 100 with value: 0.2713285310457074.
[I 2025-12-06 00:21:17,968] Trial 106 finished with value: 0.2609000897103254 and parameters: {'model_type': 'mlp', 'hidden_dims': '[512, 64]', 'dropout': 0.1627948156690307, 'batch_norm': False, 'lr': 6.866545888353876e-05, 'weight_decay': 4.367340180671067e-06, 'epochs': 48, 'loss': 'mae', 'optimizer': 'adam', 'graph_mode': 'off', 'use_snp_selection': False}. Best is trial 100 with value: 0.2713285310457074.
[I 2025-12-06 00:21:36,398] Trial 107 finished with value: 0.2599779484841774 and parameters: {'model_type': 'mlp', 'hidden_dims': '[512, 64]', 'dropout': 0.16343686497075577, 'batch_norm': False, 'lr': 7.675052263712056e-05, 'weight_decay': 4.4919133200230725e-06, 'epochs': 46, 'loss': 'mae', 'optimizer': 'adam', 'graph_mode': 'off', 'use_snp_selection': False}. Best is trial 100 with value: 0.2713285310457074.
[I 2025-12-06 00:21:54,802] Trial 108 finished with value: 0.2552665910848651 and parameters: {'model_type': 'mlp', 'hidden_dims': '[512, 64]', 'dropout': 0.158136818264448, 'batch_norm': False, 'lr': 6.725622577549263e-05, 'weight_decay': 4.938496526593585e-06, 'epochs': 46, 'loss': 'mae', 'optimizer': 'adam', 'graph_mode': 'off', 'use_snp_selection': False}. Best is trial 100 with value: 0.2713285310457074.
[I 2025-12-06 00:22:12,761] Trial 109 finished with value: 0.27079742235980697 and parameters: {'model_type': 'mlp', 'hidden_dims': '[512, 64]', 'dropout': 0.16433248034623327, 'batch_norm': False, 'lr': 7.929751058507975e-05, 'weight_decay': 4.527255821431498e-06, 'epochs': 44, 'loss': 'mae', 'optimizer': 'adam', 'graph_mode': 'off', 'use_snp_selection': False}. Best is trial 100 with value: 0.2713285310457074.
[I 2025-12-06 00:22:32,869] Trial 110 finished with value: 0.26691074947814275 and parameters: {'model_type': 'mlp', 'hidden_dims': '[512, 64]', 'dropout': 0.13386010271164547, 'batch_norm': False, 'lr': 0.00011573699961446732, 'weight_decay': 2.1531971220501273e-06, 'epochs': 53, 'loss': 'mae', 'optimizer': 'adam', 'graph_mode': 'off', 'use_snp_selection': False}. Best is trial 100 with value: 0.2713285310457074.
[I 2025-12-06 00:22:50,052] Trial 111 finished with value: 0.2560154330000546 and parameters: {'model_type': 'mlp', 'hidden_dims': '[512, 64]', 'dropout': 0.14068241912506702, 'batch_norm': False, 'lr': 0.0001823343989327348, 'weight_decay': 2.2164623328326745e-06, 'epochs': 41, 'loss': 'mae', 'optimizer': 'adam', 'graph_mode': 'off', 'use_snp_selection': False}. Best is trial 100 with value: 0.2713285310457074.
[I 2025-12-06 00:23:10,160] Trial 112 finished with value: 0.25680463672399856 and parameters: {'model_type': 'mlp', 'hidden_dims': '[512, 64]', 'dropout': 0.12378868379520712, 'batch_norm': False, 'lr': 0.0001117171378477157, 'weight_decay': 3.1195352778689816e-06, 'epochs': 53, 'loss': 'mae', 'optimizer': 'adam', 'graph_mode': 'off', 'use_snp_selection': False}. Best is trial 100 with value: 0.2713285310457074.
[I 2025-12-06 00:23:30,015] Trial 113 finished with value: 0.25524169796472757 and parameters: {'model_type': 'mlp', 'hidden_dims': '[512, 64]', 'dropout': 0.18609189191800016, 'batch_norm': False, 'lr': 0.00014526590987759514, 'weight_decay': 1.6936913356067168e-06, 'epochs': 52, 'loss': 'mae', 'optimizer': 'adam', 'graph_mode': 'off', 'use_snp_selection': False}. Best is trial 100 with value: 0.2713285310457074.
[I 2025-12-06 00:24:51,878] Trial 114 finished with value: 0.2227596928434885 and parameters: {'model_type': 'mlp', 'hidden_dims': '[512, 64]', 'dropout': 0.17225142963329587, 'batch_norm': False, 'lr': 9.045419651256758e-05, 'weight_decay': 7.672435679882586e-06, 'epochs': 304, 'loss': 'mae', 'optimizer': 'adam', 'graph_mode': 'off', 'use_snp_selection': False}. Best is trial 100 with value: 0.2713285310457074.
[I 2025-12-06 00:25:14,585] Trial 115 finished with value: 0.2536040121663595 and parameters: {'model_type': 'mlp', 'hidden_dims': '[512, 64]', 'dropout': 0.14403120606759062, 'batch_norm': False, 'lr': 5.676941902906135e-05, 'weight_decay': 2.9146311770729002e-06, 'epochs': 63, 'loss': 'mae', 'optimizer': 'adam', 'graph_mode': 'off', 'use_snp_selection': False}. Best is trial 100 with value: 0.2713285310457074.
[I 2025-12-06 00:25:32,589] Trial 116 finished with value: 0.24956825008470324 and parameters: {'model_type': 'mlp', 'hidden_dims': '[512, 64]', 'dropout': 0.13235447108723117, 'batch_norm': False, 'lr': 7.455791400303372e-05, 'weight_decay': 4.564759939491273e-06, 'epochs': 44, 'loss': 'mae', 'optimizer': 'adam', 'graph_mode': 'off', 'use_snp_selection': False}. Best is trial 100 with value: 0.2713285310457074.
[I 2025-12-06 00:25:53,268] Trial 117 finished with value: 0.26421492120730095 and parameters: {'model_type': 'mlp', 'hidden_dims': '[512, 64]', 'dropout': 0.11344214155296993, 'batch_norm': False, 'lr': 6.275541582829998e-05, 'weight_decay': 1.3825871293299758e-06, 'epochs': 55, 'loss': 'mae', 'optimizer': 'adam', 'graph_mode': 'off', 'use_snp_selection': False}. Best is trial 100 with value: 0.2713285310457074.
[I 2025-12-06 00:26:10,532] Trial 118 finished with value: 0.23745025259822355 and parameters: {'model_type': 'mlp', 'hidden_dims': '[512, 64]', 'dropout': 0.11261415091072628, 'batch_norm': True, 'lr': 6.361492670963433e-05, 'weight_decay': 1.2212886245939665e-06, 'epochs': 40, 'loss': 'mse', 'optimizer': 'adam', 'graph_mode': 'off', 'use_snp_selection': False}. Best is trial 100 with value: 0.2713285310457074.
[I 2025-12-06 00:26:30,188] Trial 119 finished with value: 0.23851127468138472 and parameters: {'model_type': 'mlp', 'hidden_dims': '[512, 64]', 'dropout': 0.1927245760299878, 'batch_norm': False, 'lr': 0.00011697045071423156, 'weight_decay': 2.4775429664723456e-06, 'epochs': 51, 'loss': 'mae', 'optimizer': 'adam', 'graph_mode': 'off', 'use_snp_selection': False}. Best is trial 100 with value: 0.2713285310457074.
[I 2025-12-06 00:26:51,338] Trial 120 finished with value: 0.26772383913994824 and parameters: {'model_type': 'mlp', 'hidden_dims': '[512, 64]', 'dropout': 0.1521982423955049, 'batch_norm': False, 'lr': 9.105200492608322e-05, 'weight_decay': 1.3955395374455317e-06, 'epochs': 57, 'loss': 'mae', 'optimizer': 'adam', 'graph_mode': 'off', 'use_snp_selection': False}. Best is trial 100 with value: 0.2713285310457074.
