[I 2025-12-06 05:05:50,986] Trial 136 finished with value: 0.30506528440507 and parameters: {'model_type': 'mlp', 'hidden_dims': '[256, 128]', 'dropout': 0.5979125177212742, 'batch_norm': True, 'lr': 4.122659129359997e-05, 'weight_decay': 1.2616944227259226e-07, 'epochs': 157, 'loss': 'mae', 'optimizer': 'adam', 'graph_mode': 'off', 'use_snp_selection': False}. Best is trial 58 with value: 0.31528413736659905.
[I 2025-12-06 05:06:07,622] Trial 137 finished with value: 0.2691520454585718 and parameters: {'model_type': 'mlp', 'hidden_dims': '[128, 64]', 'dropout': 0.5809776269017178, 'batch_norm': True, 'lr': 2.2975734365990353e-06, 'weight_decay': 1.7842064590513e-05, 'epochs': 236, 'loss': 'mae', 'optimizer': 'adam', 'graph_mode': 'off', 'use_snp_selection': False}. Best is trial 58 with value: 0.31528413736659905.
[I 2025-12-06 05:06:48,024] Trial 138 finished with value: 0.3055047581117969 and parameters: {'model_type': 'mlp', 'hidden_dims': '[512, 128]', 'dropout': 0.5544700095307866, 'batch_norm': False, 'lr': 3.152173616278104e-05, 'weight_decay': 6.874981089457241e-06, 'epochs': 203, 'loss': 'mae', 'optimizer': 'adam', 'graph_mode': 'off', 'use_snp_selection': False}. Best is trial 58 with value: 0.31528413736659905.
[I 2025-12-06 05:07:18,978] Trial 139 finished with value: 0.31751484692709636 and parameters: {'model_type': 'mlp', 'hidden_dims': '[512, 256]', 'dropout': 0.536402759401188, 'batch_norm': True, 'lr': 6.805549292503247e-05, 'weight_decay': 1.5319844456757072e-07, 'epochs': 146, 'loss': 'mae', 'optimizer': 'adam', 'graph_mode': 'off', 'use_snp_selection': False}. Best is trial 139 with value: 0.31751484692709636.
[I 2025-12-06 05:07:50,456] Trial 140 finished with value: 0.30733384111005196 and parameters: {'model_type': 'mlp', 'hidden_dims': '[512, 256]', 'dropout': 0.4504356713488923, 'batch_norm': True, 'lr': 6.930204295403281e-05, 'weight_decay': 2.325060091225407e-07, 'epochs': 149, 'loss': 'mse', 'optimizer': 'adam', 'graph_mode': 'off', 'use_snp_selection': False}. Best is trial 139 with value: 0.31751484692709636.
[I 2025-12-06 05:08:19,111] Trial 141 finished with value: 0.3116768709390759 and parameters: {'model_type': 'mlp', 'hidden_dims': '[512, 256]', 'dropout': 0.5425097192038923, 'batch_norm': True, 'lr': 9.63331944960023e-05, 'weight_decay': 1.787366162383317e-07, 'epochs': 133, 'loss': 'mae', 'optimizer': 'adam', 'graph_mode': 'off', 'use_snp_selection': False}. Best is trial 139 with value: 0.31751484692709636.
[I 2025-12-06 05:08:51,462] Trial 142 finished with value: 0.31213252109447553 and parameters: {'model_type': 'mlp', 'hidden_dims': '[512, 256]', 'dropout': 0.502960512531677, 'batch_norm': True, 'lr': 4.922119005768836e-05, 'weight_decay': 1.5493288714602656e-07, 'epochs': 154, 'loss': 'mae', 'optimizer': 'adam', 'graph_mode': 'off', 'use_snp_selection': False}. Best is trial 139 with value: 0.31751484692709636.
[I 2025-12-06 05:09:25,394] Trial 143 finished with value: 0.31108047308471937 and parameters: {'model_type': 'mlp', 'hidden_dims': '[512, 256]', 'dropout': 0.5342290074955313, 'batch_norm': True, 'lr': 5.8983475660844785e-05, 'weight_decay': 2.2057635247405003e-06, 'epochs': 163, 'loss': 'mae', 'optimizer': 'adam', 'graph_mode': 'off', 'use_snp_selection': False}. Best is trial 139 with value: 0.31751484692709636.
[I 2025-12-06 05:09:55,922] Trial 144 finished with value: 0.31084331399296533 and parameters: {'model_type': 'mlp', 'hidden_dims': '[512, 128]', 'dropout': 0.1793014806746826, 'batch_norm': True, 'lr': 0.00045282523091511723, 'weight_decay': 3.5294257423705473e-06, 'epochs': 144, 'loss': 'mae', 'optimizer': 'adam', 'graph_mode': 'off', 'use_snp_selection': False}. Best is trial 139 with value: 0.31751484692709636.
[I 2025-12-06 05:10:31,815] Trial 145 finished with value: 0.3110101670330131 and parameters: {'model_type': 'mlp', 'hidden_dims': '[512, 64]', 'dropout': 0.4812478450658037, 'batch_norm': True, 'lr': 7.886483151314964e-05, 'weight_decay': 1.4401599738442024e-07, 'epochs': 175, 'loss': 'mae', 'optimizer': 'adam', 'graph_mode': 'off', 'use_snp_selection': False}. Best is trial 139 with value: 0.31751484692709636.
[I 2025-12-06 05:11:11,278] Trial 146 finished with value: 0.3092787344580884 and parameters: {'model_type': 'mlp', 'hidden_dims': '[512, 256]', 'dropout': 0.5662952810432327, 'batch_norm': True, 'lr': 3.638231976241958e-05, 'weight_decay': 5.540410741583154e-06, 'epochs': 194, 'loss': 'mae', 'optimizer': 'adam', 'graph_mode': 'off', 'use_snp_selection': False}. Best is trial 139 with value: 0.31751484692709636.
[I 2025-12-06 05:11:53,731] Trial 147 finished with value: 0.31359368299810725 and parameters: {'model_type': 'mlp', 'hidden_dims': '[512, 128]', 'dropout': 0.5884810065241829, 'batch_norm': True, 'lr': 0.00038107505361927355, 'weight_decay': 1.3302972869336028e-06, 'epochs': 212, 'loss': 'mae', 'optimizer': 'adam', 'graph_mode': 'off', 'use_snp_selection': False}. Best is trial 139 with value: 0.31751484692709636.
[I 2025-12-06 05:12:38,092] Trial 148 finished with value: 0.3108144723681797 and parameters: {'model_type': 'mlp', 'hidden_dims': '[512, 128]', 'dropout': 0.5891938197132133, 'batch_norm': True, 'lr': 0.0003677251296800218, 'weight_decay': 1.5482855626605815e-06, 'epochs': 223, 'loss': 'mae', 'optimizer': 'adam', 'graph_mode': 'off', 'use_snp_selection': False}. Best is trial 139 with value: 0.31751484692709636.
[I 2025-12-06 05:13:16,400] Trial 149 finished with value: 0.30522261305034065 and parameters: {'model_type': 'mlp', 'hidden_dims': '[256, 128, 64]', 'dropout': 0.5833626730400058, 'batch_norm': True, 'lr': 0.0004118927116140978, 'weight_decay': 1.3754459739349423e-06, 'epochs': 215, 'loss': 'mae', 'optimizer': 'adam', 'graph_mode': 'off', 'use_snp_selection': True, 'num_snps': 29744}. Best is trial 139 with value: 0.31751484692709636.
[I 2025-12-06 05:14:09,226] Trial 0 finished with value: 0.2668588230359722 and parameters: {'model_type': 'mlp', 'hidden_dims': '[128, 64]', 'dropout': 0.199031432379812, 'batch_norm': True, 'lr': 1.8408544111075837e-06, 'weight_decay': 5.5136510071208614e-05, 'epochs': 336, 'loss': 'mae', 'optimizer': 'adam', 'graph_mode': 'off', 'use_snp_selection': True, 'num_snps': 43862}. Best is trial 0 with value: 0.2668588230359722.
[I 2025-12-06 05:14:35,934] Trial 1 finished with value: 0.30743576683921847 and parameters: {'model_type': 'mlp', 'hidden_dims': '[256, 128]', 'dropout': 0.4370668075331726, 'batch_norm': True, 'lr': 7.133471581159139e-05, 'weight_decay': 1.128633586803549e-05, 'epochs': 242, 'loss': 'mae', 'optimizer': 'adam', 'graph_mode': 'off', 'use_snp_selection': False}. Best is trial 1 with value: 0.30743576683921847.
[I 2025-12-06 05:15:02,608] Trial 2 finished with value: 0.27720910182754643 and parameters: {'model_type': 'mlp', 'hidden_dims': '[256, 128, 64]', 'dropout': 0.41314357415569625, 'batch_norm': False, 'lr': 3.952233718592101e-06, 'weight_decay': 0.00026754769258252603, 'epochs': 149, 'loss': 'mse', 'optimizer': 'adam', 'graph_mode': 'off', 'use_snp_selection': True, 'num_snps': 11571}. Best is trial 1 with value: 0.30743576683921847.
[I 2025-12-06 05:16:03,131] Trial 3 finished with value: 0.30963871781457336 and parameters: {'model_type': 'mlp', 'hidden_dims': '[512, 64]', 'dropout': 0.5938127374509361, 'batch_norm': False, 'lr': 5.67704586114731e-06, 'weight_decay': 2.4518087630137052e-05, 'epochs': 320, 'loss': 'mae', 'optimizer': 'adam', 'graph_mode': 'off', 'use_snp_selection': False}. Best is trial 3 with value: 0.30963871781457336.
[I 2025-12-06 05:17:03,643] Trial 4 finished with value: 0.286221994121136 and parameters: {'model_type': 'mlp', 'hidden_dims': '[512, 128]', 'dropout': 0.25746343592134413, 'batch_norm': True, 'lr': 1.3467657668402788e-06, 'weight_decay': 0.00033087251918647806, 'epochs': 277, 'loss': 'mse', 'optimizer': 'adam', 'graph_mode': 'off', 'use_snp_selection': True, 'num_snps': 36675}. Best is trial 3 with value: 0.30963871781457336.
[I 2025-12-06 05:17:47,106] Trial 5 finished with value: 0.24819551653672547 and parameters: {'model_type': 'mlp', 'hidden_dims': '[512, 64]', 'dropout': 0.38275350994408375, 'batch_norm': True, 'lr': 1.5586664309232824e-06, 'weight_decay': 0.0008227664668621182, 'epochs': 145, 'loss': 'mae', 'optimizer': 'adam', 'graph_mode': 'off', 'use_snp_selection': True, 'num_snps': 32148}. Best is trial 3 with value: 0.30963871781457336.
[I 2025-12-06 05:18:09,770] Trial 6 finished with value: 0.3092381186774846 and parameters: {'model_type': 'mlp', 'hidden_dims': '[256, 128]', 'dropout': 0.3930109900265879, 'batch_norm': False, 'lr': 4.892964372128395e-05, 'weight_decay': 1.5809549317992182e-06, 'epochs': 199, 'loss': 'mse', 'optimizer': 'adam', 'graph_mode': 'off', 'use_snp_selection': False}. Best is trial 3 with value: 0.30963871781457336.
[I 2025-12-06 05:18:32,066] Trial 7 finished with value: 0.30677677907653084 and parameters: {'model_type': 'mlp', 'hidden_dims': '[512, 256]', 'dropout': 0.15343979219678458, 'batch_norm': True, 'lr': 6.234003099047341e-05, 'weight_decay': 3.894760610535477e-07, 'epochs': 97, 'loss': 'mse', 'optimizer': 'adam', 'graph_mode': 'off', 'use_snp_selection': False}. Best is trial 3 with value: 0.30963871781457336.
[I 2025-12-06 05:19:32,010] Trial 8 finished with value: 0.30884340457705484 and parameters: {'model_type': 'mlp', 'hidden_dims': '[512, 128]', 'dropout': 0.10743001231661406, 'batch_norm': True, 'lr': 0.00023728538449271062, 'weight_decay': 1.7629071578048637e-05, 'epochs': 312, 'loss': 'mae', 'optimizer': 'adam', 'graph_mode': 'off', 'use_snp_selection': False}. Best is trial 3 with value: 0.30963871781457336.
[I 2025-12-06 05:20:07,878] Trial 9 finished with value: 0.3131750626873203 and parameters: {'model_type': 'mlp', 'hidden_dims': '[512, 64]', 'dropout': 0.14505336736221927, 'batch_norm': True, 'lr': 5.8619638388111826e-05, 'weight_decay': 6.200156172669308e-07, 'epochs': 175, 'loss': 'mse', 'optimizer': 'adam', 'graph_mode': 'off', 'use_snp_selection': False}. Best is trial 9 with value: 0.3131750626873203.
[I 2025-12-06 05:20:20,725] Trial 10 finished with value: 0.1196044739141318 and parameters: {'model_type': 'mlp', 'hidden_dims': '[512, 64]', 'dropout': 0.27531666245262887, 'batch_norm': False, 'lr': 0.00032393778075602147, 'weight_decay': 1.1714031539166647e-07, 'epochs': 44, 'loss': 'mse', 'optimizer': 'adam', 'graph_mode': 'off', 'use_snp_selection': False}. Best is trial 9 with value: 0.3131750626873203.
[I 2025-12-06 05:21:02,897] Trial 11 finished with value: 0.30497982843115057 and parameters: {'model_type': 'mlp', 'hidden_dims': '[512, 64]', 'dropout': 0.583942291816117, 'batch_norm': False, 'lr': 1.422933652790185e-05, 'weight_decay': 1.969664044175748e-06, 'epochs': 213, 'loss': 'mae', 'optimizer': 'adam', 'graph_mode': 'off', 'use_snp_selection': False}. Best is trial 9 with value: 0.3131750626873203.
[I 2025-12-06 05:21:34,834] Trial 12 finished with value: 0.29920818600112165 and parameters: {'model_type': 'mlp', 'hidden_dims': '[512, 64]', 'dropout': 0.5873431926823272, 'batch_norm': False, 'lr': 9.73724436814812e-06, 'weight_decay': 2.4563027710910354e-06, 'epochs': 154, 'loss': 'mae', 'optimizer': 'adam', 'graph_mode': 'off', 'use_snp_selection': False}. Best is trial 9 with value: 0.3131750626873203.
[I 2025-12-06 05:22:25,315] Trial 13 finished with value: 0.30752361526584004 and parameters: {'model_type': 'mlp', 'hidden_dims': '[512, 64]', 'dropout': 0.5086194929129976, 'batch_norm': False, 'lr': 1.4304506621636526e-05, 'weight_decay': 4.373608364627903e-05, 'epochs': 261, 'loss': 'mse', 'optimizer': 'adam', 'graph_mode': 'off', 'use_snp_selection': False}. Best is trial 9 with value: 0.3131750626873203.
[I 2025-12-06 05:22:44,919] Trial 14 finished with value: 0.30524300459821846 and parameters: {'model_type': 'mlp', 'hidden_dims': '[128, 64]', 'dropout': 0.3012984444538551, 'batch_norm': True, 'lr': 0.0001457690241539883, 'weight_decay': 5.543728086118145e-07, 'epochs': 293, 'loss': 'mse', 'optimizer': 'adam', 'graph_mode': 'off', 'use_snp_selection': False}. Best is trial 9 with value: 0.3131750626873203.
[I 2025-12-06 05:23:30,385] Trial 15 finished with value: 0.3117645013025694 and parameters: {'model_type': 'mlp', 'hidden_dims': '[512, 256]', 'dropout': 0.48263162073930665, 'batch_norm': False, 'lr': 2.200457974768058e-05, 'weight_decay': 4.647398975110266e-06, 'epochs': 231, 'loss': 'mae', 'optimizer': 'adam', 'graph_mode': 'off', 'use_snp_selection': False}. Best is trial 9 with value: 0.3131750626873203.
[I 2025-12-06 05:24:14,945] Trial 16 finished with value: 0.3080860603882127 and parameters: {'model_type': 'mlp', 'hidden_dims': '[512, 256]', 'dropout': 0.4969375229785773, 'batch_norm': True, 'lr': 0.0006624584306992511, 'weight_decay': 5.098763140321504e-06, 'epochs': 223, 'loss': 'mae', 'optimizer': 'adam', 'graph_mode': 'off', 'use_snp_selection': False}. Best is trial 9 with value: 0.3131750626873203.
[I 2025-12-06 05:24:49,779] Trial 17 finished with value: 0.30819238311362496 and parameters: {'model_type': 'mlp', 'hidden_dims': '[512, 256]', 'dropout': 0.32888830259108426, 'batch_norm': False, 'lr': 2.349300150160787e-05, 'weight_decay': 5.115095763297772e-07, 'epochs': 170, 'loss': 'mse', 'optimizer': 'adam', 'graph_mode': 'off', 'use_snp_selection': False}. Best is trial 9 with value: 0.3131750626873203.
[I 2025-12-06 05:25:42,219] Trial 18 finished with value: 0.30080326916414857 and parameters: {'model_type': 'mlp', 'hidden_dims': '[256, 128, 64]', 'dropout': 0.4914997841934554, 'batch_norm': False, 'lr': 3.0348852136513778e-05, 'weight_decay': 5.399175074092964e-06, 'epochs': 182, 'loss': 'mae', 'optimizer': 'adam', 'graph_mode': 'off', 'use_snp_selection': True, 'num_snps': 58241}. Best is trial 9 with value: 0.3131750626873203.
[I 2025-12-06 05:26:05,730] Trial 19 finished with value: 0.3105769929795016 and parameters: {'model_type': 'mlp', 'hidden_dims': '[512, 256]', 'dropout': 0.23324420910999216, 'batch_norm': True, 'lr': 0.0001339917175887314, 'weight_decay': 1.1354159408743119e-07, 'epochs': 104, 'loss': 'mse', 'optimizer': 'adam', 'graph_mode': 'off', 'use_snp_selection': False}. Best is trial 9 with value: 0.3131750626873203.
[I 2025-12-06 05:26:29,429] Trial 20 finished with value: 0.3036993440796781 and parameters: {'model_type': 'mlp', 'hidden_dims': '[512, 256]', 'dropout': 0.4513672923341566, 'batch_norm': True, 'lr': 5.446670185967407e-06, 'weight_decay': 7.640536898816976e-07, 'epochs': 105, 'loss': 'mse', 'optimizer': 'adam', 'graph_mode': 'off', 'use_snp_selection': False}. Best is trial 9 with value: 0.3131750626873203.
[I 2025-12-06 05:26:56,515] Trial 21 finished with value: 0.31094699883050814 and parameters: {'model_type': 'mlp', 'hidden_dims': '[512, 256]', 'dropout': 0.22062607605030624, 'batch_norm': True, 'lr': 0.00011467620668229786, 'weight_decay': 1.0394939605771429e-07, 'epochs': 124, 'loss': 'mse', 'optimizer': 'adam', 'graph_mode': 'off', 'use_snp_selection': False}. Best is trial 9 with value: 0.3131750626873203.
[I 2025-12-06 05:27:23,593] Trial 22 finished with value: 0.3110674889872795 and parameters: {'model_type': 'mlp', 'hidden_dims': '[512, 256]', 'dropout': 0.19060436159123115, 'batch_norm': True, 'lr': 9.625238311652474e-05, 'weight_decay': 2.4877339842300446e-07, 'epochs': 124, 'loss': 'mse', 'optimizer': 'adam', 'graph_mode': 'off', 'use_snp_selection': False}. Best is trial 9 with value: 0.3131750626873203.
[I 2025-12-06 05:27:39,756] Trial 23 finished with value: 0.30245909846526214 and parameters: {'model_type': 'mlp', 'hidden_dims': '[512, 256]', 'dropout': 0.1342291012775216, 'batch_norm': True, 'lr': 3.974711141066826e-05, 'weight_decay': 3.2666120737763034e-07, 'epochs': 62, 'loss': 'mse', 'optimizer': 'adam', 'graph_mode': 'off', 'use_snp_selection': False}. Best is trial 9 with value: 0.3131750626873203.
[I 2025-12-06 05:28:27,225] Trial 24 finished with value: 0.3083838127815155 and parameters: {'model_type': 'mlp', 'hidden_dims': '[512, 256]', 'dropout': 0.17227445917333037, 'batch_norm': True, 'lr': 2.2287625585448792e-05, 'weight_decay': 1.018561179465042e-06, 'epochs': 240, 'loss': 'mse', 'optimizer': 'adam', 'graph_mode': 'off', 'use_snp_selection': False}. Best is trial 9 with value: 0.3131750626873203.
[I 2025-12-06 05:28:49,480] Trial 25 finished with value: 0.3077353065263355 and parameters: {'model_type': 'mlp', 'hidden_dims': '[256, 128, 64]', 'dropout': 0.33689287742500834, 'batch_norm': True, 'lr': 0.0009358011302087154, 'weight_decay': 2.581055413114375e-07, 'epochs': 190, 'loss': 'mse', 'optimizer': 'adam', 'graph_mode': 'off', 'use_snp_selection': False}. Best is trial 9 with value: 0.3131750626873203.
[I 2025-12-06 05:29:12,168] Trial 26 finished with value: 0.28811256998870444 and parameters: {'model_type': 'mlp', 'hidden_dims': '[512, 128]', 'dropout': 0.10169797340285561, 'batch_norm': False, 'lr': 7.874786149555692e-05, 'weight_decay': 4.465407521312378e-06, 'epochs': 73, 'loss': 'mae', 'optimizer': 'adam', 'graph_mode': 'off', 'use_snp_selection': True, 'num_snps': 3842}. Best is trial 9 with value: 0.3131750626873203.
[I 2025-12-06 05:29:22,936] Trial 27 finished with value: 0.30479546588271017 and parameters: {'model_type': 'mlp', 'hidden_dims': '[128, 64]', 'dropout': 0.18262956434514543, 'batch_norm': True, 'lr': 0.0003213568641845202, 'weight_decay': 2.1643467772563286e-07, 'epochs': 122, 'loss': 'mse', 'optimizer': 'adam', 'graph_mode': 'off', 'use_snp_selection': False}. Best is trial 9 with value: 0.3131750626873203.
[I 2025-12-06 05:29:48,148] Trial 28 finished with value: 0.3103147201643723 and parameters: {'model_type': 'mlp', 'hidden_dims': '[256, 128]', 'dropout': 0.5446517125861267, 'batch_norm': False, 'lr': 1.597687963134124e-05, 'weight_decay': 1.1861573414922658e-06, 'epochs': 227, 'loss': 'mae', 'optimizer': 'adam', 'graph_mode': 'off', 'use_snp_selection': False}. Best is trial 9 with value: 0.3131750626873203.
[I 2025-12-06 05:30:17,362] Trial 29 finished with value: 0.2516048566725839 and parameters: {'model_type': 'mlp', 'hidden_dims': '[128, 64]', 'dropout': 0.19746355719393088, 'batch_norm': True, 'lr': 2.8966762461994946e-06, 'weight_decay': 0.00010774073487650296, 'epochs': 173, 'loss': 'mae', 'optimizer': 'adam', 'graph_mode': 'off', 'use_snp_selection': True, 'num_snps': 19468}. Best is trial 9 with value: 0.3131750626873203.
[I 2025-12-06 05:30:45,768] Trial 30 finished with value: 0.28946770282086354 and parameters: {'model_type': 'mlp', 'hidden_dims': '[512, 256]', 'dropout': 0.14497498555684998, 'batch_norm': True, 'lr': 8.668888692922407e-06, 'weight_decay': 2.932431159299033e-06, 'epochs': 132, 'loss': 'mse', 'optimizer': 'adam', 'graph_mode': 'off', 'use_snp_selection': False}. Best is trial 9 with value: 0.3131750626873203.
[I 2025-12-06 05:31:14,083] Trial 31 finished with value: 0.3136372669321699 and parameters: {'model_type': 'mlp', 'hidden_dims': '[512, 256]', 'dropout': 0.22552817579977696, 'batch_norm': True, 'lr': 0.00011773465257145794, 'weight_decay': 1.0051423349737781e-07, 'epochs': 131, 'loss': 'mse', 'optimizer': 'adam', 'graph_mode': 'off', 'use_snp_selection': False}. Best is trial 31 with value: 0.3136372669321699.
[I 2025-12-06 05:31:55,090] Trial 32 finished with value: 0.31171584198948976 and parameters: {'model_type': 'mlp', 'hidden_dims': '[512, 256]', 'dropout': 0.22375150906551655, 'batch_norm': True, 'lr': 8.524537708884686e-05, 'weight_decay': 1.868806938420997e-07, 'epochs': 203, 'loss': 'mse', 'optimizer': 'adam', 'graph_mode': 'off', 'use_snp_selection': False}. Best is trial 31 with value: 0.3136372669321699.
[I 2025-12-06 05:32:36,267] Trial 33 finished with value: 0.3093459593779309 and parameters: {'model_type': 'mlp', 'hidden_dims': '[512, 256]', 'dropout': 0.22799504690839645, 'batch_norm': True, 'lr': 0.0002038183494347475, 'weight_decay': 2.07915659111716e-07, 'epochs': 204, 'loss': 'mse', 'optimizer': 'adam', 'graph_mode': 'off', 'use_snp_selection': False}. Best is trial 31 with value: 0.3136372669321699.
[I 2025-12-06 05:32:56,009] Trial 34 finished with value: 0.30872261963299186 and parameters: {'model_type': 'mlp', 'hidden_dims': '[256, 128]', 'dropout': 0.28099625383530513, 'batch_norm': True, 'lr': 5.28471514361127e-05, 'weight_decay': 1.6847466863119253e-07, 'epochs': 164, 'loss': 'mse', 'optimizer': 'adam', 'graph_mode': 'off', 'use_snp_selection': False}. Best is trial 31 with value: 0.3136372669321699.
[I 2025-12-06 05:33:45,123] Trial 35 finished with value: 0.3104617233425597 and parameters: {'model_type': 'mlp', 'hidden_dims': '[512, 256]', 'dropout': 0.2541673587845622, 'batch_norm': True, 'lr': 7.630290265663671e-05, 'weight_decay': 7.98797213782467e-06, 'epochs': 249, 'loss': 'mse', 'optimizer': 'adam', 'graph_mode': 'off', 'use_snp_selection': False}. Best is trial 31 with value: 0.3136372669321699.
[I 2025-12-06 05:34:44,951] Trial 36 finished with value: 0.30627046033239774 and parameters: {'model_type': 'mlp', 'hidden_dims': '[256, 128, 64]', 'dropout': 0.4468632864883953, 'batch_norm': True, 'lr': 3.37832037845598e-05, 'weight_decay': 6.909749952004684e-07, 'epochs': 265, 'loss': 'mae', 'optimizer': 'adam', 'graph_mode': 'off', 'use_snp_selection': True, 'num_snps': 58661}. Best is trial 31 with value: 0.3136372669321699.
[I 2025-12-06 05:35:23,590] Trial 37 finished with value: 0.14693706167489712 and parameters: {'model_type': 'mlp', 'hidden_dims': '[512, 64]', 'dropout': 0.36035244696499213, 'batch_norm': False, 'lr': 0.00046492826823403815, 'weight_decay': 3.740333068743954e-07, 'epochs': 193, 'loss': 'mse', 'optimizer': 'adam', 'graph_mode': 'off', 'use_snp_selection': False}. Best is trial 31 with value: 0.3136372669321699.
