[I 2025-12-05 14:27:19,421] Trial 1 finished with value: 0.12741814025949086 and parameters: {'model_type': 'mlp', 'hidden_dims': '[256, 128]', 'dropout': 0.4370668075331726, 'batch_norm': True, 'lr': 7.133471581159139e-05, 'weight_decay': 1.128633586803549e-05, 'epochs': 242, 'loss': 'mae', 'optimizer': 'adam', 'graph_mode': 'off', 'use_snp_selection': False}. Best is trial 1 with value: 0.12741814025949086.
[I 2025-12-05 14:27:20,523] Trial 2 finished with value: 0.04000102985533424 and parameters: {'model_type': 'mlp', 'hidden_dims': '[256, 128, 64]', 'dropout': 0.41314357415569625, 'batch_norm': False, 'lr': 3.952233718592101e-06, 'weight_decay': 0.00026754769258252603, 'epochs': 149, 'loss': 'mse', 'optimizer': 'adam', 'graph_mode': 'off', 'use_snp_selection': True, 'num_snps': 11571}. Best is trial 1 with value: 0.12741814025949086.
[I 2025-12-05 14:27:22,864] Trial 3 finished with value: 0.09653583162980066 and parameters: {'model_type': 'mlp', 'hidden_dims': '[512, 64]', 'dropout': 0.5938127374509361, 'batch_norm': False, 'lr': 5.67704586114731e-06, 'weight_decay': 2.4518087630137052e-05, 'epochs': 320, 'loss': 'mae', 'optimizer': 'adam', 'graph_mode': 'off', 'use_snp_selection': False}. Best is trial 1 with value: 0.12741814025949086.
[I 2025-12-05 14:27:25,484] Trial 4 finished with value: 0.030987776182671962 and parameters: {'model_type': 'mlp', 'hidden_dims': '[512, 128]', 'dropout': 0.25746343592134413, 'batch_norm': True, 'lr': 1.3467657668402788e-06, 'weight_decay': 0.00033087251918647806, 'epochs': 277, 'loss': 'mse', 'optimizer': 'adam', 'graph_mode': 'off', 'use_snp_selection': True, 'num_snps': 36675}. Best is trial 1 with value: 0.12741814025949086.
[I 2025-12-05 14:27:27,428] Trial 5 finished with value: 0.059393406971450714 and parameters: {'model_type': 'mlp', 'hidden_dims': '[512, 64]', 'dropout': 0.38275350994408375, 'batch_norm': True, 'lr': 1.5586664309232824e-06, 'weight_decay': 0.0008227664668621182, 'epochs': 145, 'loss': 'mae', 'optimizer': 'adam', 'graph_mode': 'off', 'use_snp_selection': True, 'num_snps': 32148}. Best is trial 1 with value: 0.12741814025949086.
[I 2025-12-05 14:27:28,581] Trial 6 finished with value: 0.09149155346914854 and parameters: {'model_type': 'mlp', 'hidden_dims': '[256, 128]', 'dropout': 0.3930109900265879, 'batch_norm': False, 'lr': 4.892964372128395e-05, 'weight_decay': 1.5809549317992182e-06, 'epochs': 199, 'loss': 'mse', 'optimizer': 'adam', 'graph_mode': 'off', 'use_snp_selection': False}. Best is trial 1 with value: 0.12741814025949086.
[I 2025-12-05 14:27:29,804] Trial 7 finished with value: 0.08906973040039919 and parameters: {'model_type': 'mlp', 'hidden_dims': '[512, 256]', 'dropout': 0.15343979219678458, 'batch_norm': True, 'lr': 6.234003099047341e-05, 'weight_decay': 3.894760610535477e-07, 'epochs': 97, 'loss': 'mse', 'optimizer': 'adam', 'graph_mode': 'off', 'use_snp_selection': False}. Best is trial 1 with value: 0.12741814025949086.
[I 2025-12-05 14:27:32,124] Trial 8 finished with value: 0.10934665819414734 and parameters: {'model_type': 'mlp', 'hidden_dims': '[512, 128]', 'dropout': 0.10743001231661406, 'batch_norm': True, 'lr': 0.00023728538449271062, 'weight_decay': 1.7629071578048637e-05, 'epochs': 312, 'loss': 'mae', 'optimizer': 'adam', 'graph_mode': 'off', 'use_snp_selection': False}. Best is trial 1 with value: 0.12741814025949086.
[I 2025-12-05 14:27:33,763] Trial 9 finished with value: 0.08896484829728113 and parameters: {'model_type': 'mlp', 'hidden_dims': '[512, 64]', 'dropout': 0.14505336736221927, 'batch_norm': True, 'lr': 5.8619638388111826e-05, 'weight_decay': 6.200156172669308e-07, 'epochs': 175, 'loss': 'mse', 'optimizer': 'adam', 'graph_mode': 'off', 'use_snp_selection': False}. Best is trial 1 with value: 0.12741814025949086.
[I 2025-12-05 14:27:35,036] Trial 10 finished with value: 0.08877030378785106 and parameters: {'model_type': 'mlp', 'hidden_dims': '[256, 128]', 'dropout': 0.5365714961141473, 'batch_norm': False, 'lr': 0.00032955828969150785, 'weight_decay': 3.381683344261174e-06, 'epochs': 236, 'loss': 'mae', 'optimizer': 'adam', 'graph_mode': 'off', 'use_snp_selection': False}. Best is trial 1 with value: 0.12741814025949086.
[I 2025-12-05 14:27:37,215] Trial 11 finished with value: 0.1047327670212955 and parameters: {'model_type': 'mlp', 'hidden_dims': '[512, 128]', 'dropout': 0.2851700052976396, 'batch_norm': True, 'lr': 0.0005194831231105461, 'weight_decay': 7.0869802591332905e-06, 'epochs': 292, 'loss': 'mae', 'optimizer': 'adam', 'graph_mode': 'off', 'use_snp_selection': False}. Best is trial 1 with value: 0.12741814025949086.
[I 2025-12-05 14:27:39,226] Trial 12 finished with value: 0.10183562333907104 and parameters: {'model_type': 'mlp', 'hidden_dims': '[512, 128]', 'dropout': 0.4779690972965961, 'batch_norm': True, 'lr': 0.00026576228959612443, 'weight_decay': 3.319617863684014e-05, 'epochs': 246, 'loss': 'mae', 'optimizer': 'adam', 'graph_mode': 'off', 'use_snp_selection': False}. Best is trial 1 with value: 0.12741814025949086.
[I 2025-12-05 14:27:40,074] Trial 13 finished with value: 0.11352795110464935 and parameters: {'model_type': 'mlp', 'hidden_dims': '[256, 128]', 'dropout': 0.3041365173646664, 'batch_norm': True, 'lr': 0.0001448400953749671, 'weight_decay': 1.152865323241676e-05, 'epochs': 52, 'loss': 'mae', 'optimizer': 'adam', 'graph_mode': 'off', 'use_snp_selection': False}. Best is trial 1 with value: 0.12741814025949086.
[I 2025-12-05 14:27:40,898] Trial 14 finished with value: 0.06539774759322177 and parameters: {'model_type': 'mlp', 'hidden_dims': '[256, 128]', 'dropout': 0.3098766372723432, 'batch_norm': True, 'lr': 1.8098544137859603e-05, 'weight_decay': 1.1414924884997386e-07, 'epochs': 42, 'loss': 'mae', 'optimizer': 'adam', 'graph_mode': 'off', 'use_snp_selection': False}. Best is trial 1 with value: 0.12741814025949086.
[I 2025-12-05 14:27:41,709] Trial 15 finished with value: 0.10756481598057452 and parameters: {'model_type': 'mlp', 'hidden_dims': '[256, 128]', 'dropout': 0.4578474191024107, 'batch_norm': True, 'lr': 0.0001484615019442469, 'weight_decay': 9.289684675552499e-05, 'epochs': 41, 'loss': 'mae', 'optimizer': 'adam', 'graph_mode': 'off', 'use_snp_selection': False}. Best is trial 1 with value: 0.12741814025949086.
[I 2025-12-05 14:27:42,666] Trial 16 finished with value: 0.11013403112143831 and parameters: {'model_type': 'mlp', 'hidden_dims': '[256, 128]', 'dropout': 0.32065580381154934, 'batch_norm': True, 'lr': 1.5819268129322878e-05, 'weight_decay': 6.011625021251703e-06, 'epochs': 98, 'loss': 'mae', 'optimizer': 'adam', 'graph_mode': 'off', 'use_snp_selection': False}. Best is trial 1 with value: 0.12741814025949086.
[I 2025-12-05 14:27:43,576] Trial 17 finished with value: 0.10636148579757103 and parameters: {'model_type': 'mlp', 'hidden_dims': '[128, 64]', 'dropout': 0.2174542087235227, 'batch_norm': True, 'lr': 0.000906375209920231, 'weight_decay': 1.4022321186022505e-06, 'epochs': 220, 'loss': 'mae', 'optimizer': 'adam', 'graph_mode': 'off', 'use_snp_selection': False}. Best is trial 1 with value: 0.12741814025949086.
[I 2025-12-05 14:27:46,414] Trial 18 finished with value: 0.10216041759503502 and parameters: {'model_type': 'mlp', 'hidden_dims': '[512, 256]', 'dropout': 0.4624669734906147, 'batch_norm': False, 'lr': 0.00011314282718172297, 'weight_decay': 0.00010312401360366706, 'epochs': 93, 'loss': 'mae', 'optimizer': 'adam', 'graph_mode': 'off', 'use_snp_selection': True, 'num_snps': 58241}. Best is trial 1 with value: 0.12741814025949086.
[I 2025-12-05 14:27:47,884] Trial 19 finished with value: 0.09676670560918661 and parameters: {'model_type': 'mlp', 'hidden_dims': '[256, 128, 64]', 'dropout': 0.35247700437870566, 'batch_norm': True, 'lr': 1.766840331447259e-05, 'weight_decay': 1.1569932048498745e-05, 'epochs': 257, 'loss': 'mae', 'optimizer': 'adam', 'graph_mode': 'off', 'use_snp_selection': False}. Best is trial 1 with value: 0.12741814025949086.
[I 2025-12-05 14:27:48,943] Trial 20 finished with value: 0.09410113184130048 and parameters: {'model_type': 'mlp', 'hidden_dims': '[256, 128]', 'dropout': 0.5508234860183092, 'batch_norm': True, 'lr': 0.00011305640263483609, 'weight_decay': 2.99959299686549e-06, 'epochs': 135, 'loss': 'mae', 'optimizer': 'adam', 'graph_mode': 'off', 'use_snp_selection': False}. Best is trial 1 with value: 0.12741814025949086.
[I 2025-12-05 14:27:49,875] Trial 21 finished with value: 0.09062390708561273 and parameters: {'model_type': 'mlp', 'hidden_dims': '[256, 128]', 'dropout': 0.32488756118684015, 'batch_norm': True, 'lr': 2.6102338118860982e-05, 'weight_decay': 6.128200887702149e-06, 'epochs': 88, 'loss': 'mae', 'optimizer': 'adam', 'graph_mode': 'off', 'use_snp_selection': False}. Best is trial 1 with value: 0.12741814025949086.
[I 2025-12-05 14:27:50,714] Trial 22 finished with value: 0.0416448778490044 and parameters: {'model_type': 'mlp', 'hidden_dims': '[256, 128]', 'dropout': 0.26586427126142814, 'batch_norm': True, 'lr': 8.056421979692715e-06, 'weight_decay': 1.0726724730913318e-05, 'epochs': 58, 'loss': 'mae', 'optimizer': 'adam', 'graph_mode': 'off', 'use_snp_selection': False}. Best is trial 1 with value: 0.12741814025949086.
[I 2025-12-05 14:27:51,697] Trial 23 finished with value: 0.0983534117583906 and parameters: {'model_type': 'mlp', 'hidden_dims': '[256, 128]', 'dropout': 0.3412082907404064, 'batch_norm': True, 'lr': 3.52486827818663e-05, 'weight_decay': 4.575846266108349e-06, 'epochs': 115, 'loss': 'mae', 'optimizer': 'adam', 'graph_mode': 'off', 'use_snp_selection': False}. Best is trial 1 with value: 0.12741814025949086.
[I 2025-12-05 14:27:52,520] Trial 24 finished with value: 0.05391564887129996 and parameters: {'model_type': 'mlp', 'hidden_dims': '[256, 128]', 'dropout': 0.4325815793572126, 'batch_norm': True, 'lr': 1.1848550498972236e-05, 'weight_decay': 1.6622170907977205e-06, 'epochs': 69, 'loss': 'mae', 'optimizer': 'adam', 'graph_mode': 'off', 'use_snp_selection': False}. Best is trial 1 with value: 0.12741814025949086.
[I 2025-12-05 14:27:53,673] Trial 25 finished with value: 0.11905589744679641 and parameters: {'model_type': 'mlp', 'hidden_dims': '[256, 128]', 'dropout': 0.37656414946855676, 'batch_norm': True, 'lr': 7.17260214337888e-05, 'weight_decay': 3.445814395244365e-05, 'epochs': 194, 'loss': 'mae', 'optimizer': 'adam', 'graph_mode': 'off', 'use_snp_selection': False}. Best is trial 1 with value: 0.12741814025949086.
[I 2025-12-05 14:27:54,622] Trial 26 finished with value: 0.07569886618942785 and parameters: {'model_type': 'mlp', 'hidden_dims': '[256, 128]', 'dropout': 0.5104770554426354, 'batch_norm': True, 'lr': 9.41515330557756e-05, 'weight_decay': 9.516657810025634e-05, 'epochs': 179, 'loss': 'mse', 'optimizer': 'adam', 'graph_mode': 'off', 'use_snp_selection': True, 'num_snps': 3842}. Best is trial 1 with value: 0.12741814025949086.
[I 2025-12-05 14:27:55,864] Trial 27 finished with value: 0.11814237716253473 and parameters: {'model_type': 'mlp', 'hidden_dims': '[256, 128, 64]', 'dropout': 0.3625916554728143, 'batch_norm': False, 'lr': 0.00017547682449306493, 'weight_decay': 3.7728781986273995e-05, 'epochs': 210, 'loss': 'mae', 'optimizer': 'adam', 'graph_mode': 'off', 'use_snp_selection': False}. Best is trial 1 with value: 0.12741814025949086.
[I 2025-12-05 14:27:57,114] Trial 28 finished with value: 0.11514067461752954 and parameters: {'model_type': 'mlp', 'hidden_dims': '[256, 128, 64]', 'dropout': 0.40053018253395667, 'batch_norm': False, 'lr': 6.990726924848047e-05, 'weight_decay': 4.149441603085715e-05, 'epochs': 209, 'loss': 'mae', 'optimizer': 'adam', 'graph_mode': 'off', 'use_snp_selection': False}. Best is trial 1 with value: 0.12741814025949086.
[I 2025-12-05 14:27:58,594] Trial 29 finished with value: 0.08545685850852618 and parameters: {'model_type': 'mlp', 'hidden_dims': '[128, 64]', 'dropout': 0.35743458784442395, 'batch_norm': False, 'lr': 0.0005388560200940643, 'weight_decay': 5.5227103357724904e-05, 'epochs': 179, 'loss': 'mae', 'optimizer': 'adam', 'graph_mode': 'off', 'use_snp_selection': True, 'num_snps': 19468}. Best is trial 1 with value: 0.12741814025949086.
[I 2025-12-05 14:27:59,980] Trial 30 finished with value: 0.0926777144176581 and parameters: {'model_type': 'mlp', 'hidden_dims': '[256, 128, 64]', 'dropout': 0.43278966881523206, 'batch_norm': False, 'lr': 3.6797783114663476e-05, 'weight_decay': 0.0002295949399758589, 'epochs': 269, 'loss': 'mae', 'optimizer': 'adam', 'graph_mode': 'off', 'use_snp_selection': False}. Best is trial 1 with value: 0.12741814025949086.
[I 2025-12-05 14:28:01,187] Trial 31 finished with value: 0.10844585484371846 and parameters: {'model_type': 'mlp', 'hidden_dims': '[256, 128, 64]', 'dropout': 0.3818406261098396, 'batch_norm': False, 'lr': 8.442814288192434e-05, 'weight_decay': 4.66234188340343e-05, 'epochs': 213, 'loss': 'mae', 'optimizer': 'adam', 'graph_mode': 'off', 'use_snp_selection': False}. Best is trial 1 with value: 0.12741814025949086.
[I 2025-12-05 14:28:02,427] Trial 32 finished with value: 0.1302124254881053 and parameters: {'model_type': 'mlp', 'hidden_dims': '[256, 128, 64]', 'dropout': 0.41504113952639254, 'batch_norm': False, 'lr': 0.00019068819618105068, 'weight_decay': 2.2732494838517552e-05, 'epochs': 229, 'loss': 'mae', 'optimizer': 'adam', 'graph_mode': 'off', 'use_snp_selection': False}. Best is trial 32 with value: 0.1302124254881053.
[I 2025-12-05 14:28:03,670] Trial 33 finished with value: 0.08805662652507389 and parameters: {'model_type': 'mlp', 'hidden_dims': '[256, 128, 64]', 'dropout': 0.4943253903517, 'batch_norm': False, 'lr': 0.00019222978174280518, 'weight_decay': 2.1851609463260707e-05, 'epochs': 230, 'loss': 'mae', 'optimizer': 'adam', 'graph_mode': 'off', 'use_snp_selection': False}. Best is trial 32 with value: 0.1302124254881053.
[I 2025-12-05 14:28:06,753] Trial 34 finished with value: 0.09905692891066911 and parameters: {'model_type': 'mlp', 'hidden_dims': '[256, 128, 64]', 'dropout': 0.42924000531468515, 'batch_norm': False, 'lr': 0.00045273882665945183, 'weight_decay': 1.7889187052173837e-05, 'epochs': 190, 'loss': 'mse', 'optimizer': 'adam', 'graph_mode': 'off', 'use_snp_selection': True, 'num_snps': 58283}. Best is trial 32 with value: 0.1302124254881053.
[I 2025-12-05 14:28:08,270] Trial 35 finished with value: 0.07966792423616283 and parameters: {'model_type': 'mlp', 'hidden_dims': '[256, 128, 64]', 'dropout': 0.3693899362600313, 'batch_norm': False, 'lr': 3.7076321611887164e-06, 'weight_decay': 0.0001529051529381839, 'epochs': 288, 'loss': 'mae', 'optimizer': 'adam', 'graph_mode': 'off', 'use_snp_selection': False}. Best is trial 32 with value: 0.1302124254881053.
[I 2025-12-05 14:28:09,356] Trial 36 finished with value: 0.09860273286270144 and parameters: {'model_type': 'mlp', 'hidden_dims': '[256, 128, 64]', 'dropout': 0.41264183950876615, 'batch_norm': False, 'lr': 0.00016877887786593355, 'weight_decay': 6.755483740834853e-05, 'epochs': 156, 'loss': 'mae', 'optimizer': 'adam', 'graph_mode': 'off', 'use_snp_selection': False}. Best is trial 32 with value: 0.1302124254881053.
[I 2025-12-05 14:28:11,058] Trial 37 finished with value: 0.10328824422553867 and parameters: {'model_type': 'mlp', 'hidden_dims': '[512, 256]', 'dropout': 0.45111436562499363, 'batch_norm': False, 'lr': 4.374191893122314e-05, 'weight_decay': 0.000692133842143259, 'epochs': 253, 'loss': 'mse', 'optimizer': 'adam', 'graph_mode': 'off', 'use_snp_selection': True, 'num_snps': 22282}. Best is trial 32 with value: 0.1302124254881053.
[I 2025-12-05 14:28:12,575] Trial 38 finished with value: 0.09441432439228287 and parameters: {'model_type': 'mlp', 'hidden_dims': '[512, 64]', 'dropout': 0.5867152014277068, 'batch_norm': False, 'lr': 0.0003332025055487213, 'weight_decay': 3.139556712738074e-05, 'epochs': 162, 'loss': 'mae', 'optimizer': 'adam', 'graph_mode': 'off', 'use_snp_selection': False}. Best is trial 32 with value: 0.1302124254881053.
[I 2025-12-05 14:28:13,465] Trial 39 finished with value: 0.09454168776790489 and parameters: {'model_type': 'mlp', 'hidden_dims': '[128, 64]', 'dropout': 0.2152082809727138, 'batch_norm': False, 'lr': 0.0007350042820898064, 'weight_decay': 0.00035607173864072217, 'epochs': 197, 'loss': 'mse', 'optimizer': 'adam', 'graph_mode': 'off', 'use_snp_selection': False}. Best is trial 32 with value: 0.1302124254881053.
[I 2025-12-05 14:28:15,069] Trial 40 finished with value: 0.09032268974820368 and parameters: {'model_type': 'mlp', 'hidden_dims': '[256, 128, 64]', 'dropout': 0.39500559341330366, 'batch_norm': False, 'lr': 2.379810282692746e-05, 'weight_decay': 1.6483617794957767e-05, 'epochs': 344, 'loss': 'mae', 'optimizer': 'adam', 'graph_mode': 'off', 'use_snp_selection': False}. Best is trial 32 with value: 0.1302124254881053.
[I 2025-12-05 14:28:16,306] Trial 41 finished with value: 0.09360804236215473 and parameters: {'model_type': 'mlp', 'hidden_dims': '[256, 128, 64]', 'dropout': 0.41093125020629806, 'batch_norm': False, 'lr': 7.037441935481985e-05, 'weight_decay': 3.8058843779184585e-05, 'epochs': 208, 'loss': 'mae', 'optimizer': 'adam', 'graph_mode': 'off', 'use_snp_selection': False}. Best is trial 32 with value: 0.1302124254881053.
[I 2025-12-05 14:28:17,567] Trial 42 finished with value: 0.1145829283291448 and parameters: {'model_type': 'mlp', 'hidden_dims': '[256, 128, 64]', 'dropout': 0.3995879408077549, 'batch_norm': False, 'lr': 5.157494597642637e-05, 'weight_decay': 2.7305779757886373e-05, 'epochs': 226, 'loss': 'mae', 'optimizer': 'adam', 'graph_mode': 'off', 'use_snp_selection': False}. Best is trial 32 with value: 0.1302124254881053.
[I 2025-12-05 14:28:18,835] Trial 43 finished with value: 0.11891026632609261 and parameters: {'model_type': 'mlp', 'hidden_dims': '[256, 128, 64]', 'dropout': 0.34166571009394786, 'batch_norm': False, 'lr': 7.269795798718348e-05, 'weight_decay': 5.320469155759678e-05, 'epochs': 239, 'loss': 'mae', 'optimizer': 'adam', 'graph_mode': 'off', 'use_snp_selection': False}. Best is trial 32 with value: 0.1302124254881053.
[I 2025-12-05 14:28:20,857] Trial 44 finished with value: 0.11781930650148949 and parameters: {'model_type': 'mlp', 'hidden_dims': '[512, 64]', 'dropout': 0.28391140050995073, 'batch_norm': False, 'lr': 0.00025461598834879617, 'weight_decay': 0.00014106828553849197, 'epochs': 268, 'loss': 'mae', 'optimizer': 'adam', 'graph_mode': 'off', 'use_snp_selection': False}. Best is trial 32 with value: 0.1302124254881053.
[I 2025-12-05 14:28:22,819] Trial 45 finished with value: 0.1111750372012674 and parameters: {'model_type': 'mlp', 'hidden_dims': '[512, 128]', 'dropout': 0.3702506408073731, 'batch_norm': False, 'lr': 0.00011116484002244488, 'weight_decay': 1.8143249450089866e-05, 'epochs': 243, 'loss': 'mae', 'optimizer': 'adam', 'graph_mode': 'off', 'use_snp_selection': False}. Best is trial 32 with value: 0.1302124254881053.
[I 2025-12-05 14:28:24,300] Trial 46 finished with value: 0.10904551898629819 and parameters: {'model_type': 'mlp', 'hidden_dims': '[256, 128, 64]', 'dropout': 0.3392753600018638, 'batch_norm': False, 'lr': 0.00019319074172182533, 'weight_decay': 5.6001079725374714e-05, 'epochs': 300, 'loss': 'mae', 'optimizer': 'adam', 'graph_mode': 'off', 'use_snp_selection': False}. Best is trial 32 with value: 0.1302124254881053.
[I 2025-12-05 14:28:26,256] Trial 47 finished with value: 0.10841339831364398 and parameters: {'model_type': 'mlp', 'hidden_dims': '[512, 256]', 'dropout': 0.47981792189754, 'batch_norm': True, 'lr': 0.0003368406379275874, 'weight_decay': 1.0323876001426363e-05, 'epochs': 237, 'loss': 'mae', 'optimizer': 'adam', 'graph_mode': 'off', 'use_snp_selection': False}. Best is trial 32 with value: 0.1302124254881053.
[I 2025-12-05 14:28:28,482] Trial 48 finished with value: 0.09857061963343271 and parameters: {'model_type': 'mlp', 'hidden_dims': '[256, 128, 64]', 'dropout': 0.25265542838589905, 'batch_norm': False, 'lr': 0.00014008818981440827, 'weight_decay': 7.076817299597215e-05, 'epochs': 196, 'loss': 'mse', 'optimizer': 'adam', 'graph_mode': 'off', 'use_snp_selection': True, 'num_snps': 43224}. Best is trial 32 with value: 0.1302124254881053.
[I 2025-12-05 14:28:30,555] Trial 49 finished with value: 0.10949584479387015 and parameters: {'model_type': 'mlp', 'hidden_dims': '[512, 128]', 'dropout': 0.29806003891143895, 'batch_norm': True, 'lr': 7.325312813208084e-05, 'weight_decay': 2.8433806711184745e-05, 'epochs': 259, 'loss': 'mae', 'optimizer': 'adam', 'graph_mode': 'off', 'use_snp_selection': False}. Best is trial 32 with value: 0.1302124254881053.
[I 2025-12-05 14:28:32,704] Trial 50 finished with value: 0.11573938224701896 and parameters: {'model_type': 'mlp', 'hidden_dims': '[512, 64]', 'dropout': 0.3697909259438141, 'batch_norm': False, 'lr': 5.331027743338547e-05, 'weight_decay': 0.00023042723700974216, 'epochs': 277, 'loss': 'mae', 'optimizer': 'adam', 'graph_mode': 'off', 'use_snp_selection': False}. Best is trial 32 with value: 0.1302124254881053.
[I 2025-12-05 14:28:35,072] Trial 51 finished with value: 0.11346768098522439 and parameters: {'model_type': 'mlp', 'hidden_dims': '[512, 64]', 'dropout': 0.2818979448018076, 'batch_norm': False, 'lr': 0.00025575111643001827, 'weight_decay': 0.00017645067207062954, 'epochs': 329, 'loss': 'mae', 'optimizer': 'adam', 'graph_mode': 'off', 'use_snp_selection': False}. Best is trial 32 with value: 0.1302124254881053.
[I 2025-12-05 14:28:37,162] Trial 52 finished with value: 0.06924616515184008 and parameters: {'model_type': 'mlp', 'hidden_dims': '[512, 64]', 'dropout': 0.23621266477618597, 'batch_norm': False, 'lr': 1.0921708743861942e-06, 'weight_decay': 0.00012865582833396664, 'epochs': 275, 'loss': 'mae', 'optimizer': 'adam', 'graph_mode': 'off', 'use_snp_selection': False}. Best is trial 32 with value: 0.1302124254881053.
