[I 2025-12-05 20:49:01,293] Trial 63 finished with value: 0.22329505859105314 and parameters: {'model_type': 'mlp', 'hidden_dims': '[512, 256]', 'dropout': 0.3200522181079194, 'batch_norm': False, 'lr': 4.31970263957582e-05, 'weight_decay': 7.796613615654281e-06, 'epochs': 67, 'loss': 'mse', 'optimizer': 'adam', 'graph_mode': 'off', 'use_snp_selection': False}. Best is trial 54 with value: 0.23112022995098971.
[I 2025-12-05 20:49:30,228] Trial 64 finished with value: 0.22243927321407791 and parameters: {'model_type': 'mlp', 'hidden_dims': '[512, 256]', 'dropout': 0.43998522226738934, 'batch_norm': False, 'lr': 1.9510213059585767e-05, 'weight_decay': 4.490302957554668e-06, 'epochs': 80, 'loss': 'mse', 'optimizer': 'adam', 'graph_mode': 'off', 'use_snp_selection': False}. Best is trial 54 with value: 0.23112022995098971.
[I 2025-12-05 20:50:07,965] Trial 65 finished with value: 0.2192545767112299 and parameters: {'model_type': 'mlp', 'hidden_dims': '[512, 256]', 'dropout': 0.38710317002872596, 'batch_norm': False, 'lr': 6.736932315744236e-05, 'weight_decay': 2.8870048793564273e-06, 'epochs': 114, 'loss': 'mse', 'optimizer': 'adam', 'graph_mode': 'off', 'use_snp_selection': False}. Best is trial 54 with value: 0.23112022995098971.
[I 2025-12-05 20:51:30,384] Trial 66 finished with value: 0.20222331669340737 and parameters: {'model_type': 'mlp', 'hidden_dims': '[512, 64]', 'dropout': 0.2934570926203762, 'batch_norm': False, 'lr': 3.318650657043712e-05, 'weight_decay': 0.0008281283468112786, 'epochs': 280, 'loss': 'mse', 'optimizer': 'adam', 'graph_mode': 'off', 'use_snp_selection': False}. Best is trial 54 with value: 0.23112022995098971.
[I 2025-12-05 20:52:15,370] Trial 67 finished with value: 0.18992116938171516 and parameters: {'model_type': 'mlp', 'hidden_dims': '[512, 256]', 'dropout': 0.3648539086298827, 'batch_norm': False, 'lr': 9.266679463283434e-05, 'weight_decay': 5.605179289429852e-07, 'epochs': 88, 'loss': 'mse', 'optimizer': 'adam', 'graph_mode': 'off', 'use_snp_selection': True, 'num_snps': 22951}. Best is trial 54 with value: 0.23112022995098971.
[I 2025-12-05 20:52:36,458] Trial 68 finished with value: 0.19671281873299098 and parameters: {'model_type': 'mlp', 'hidden_dims': '[512, 256]', 'dropout': 0.4896443825512042, 'batch_norm': False, 'lr': 0.00017606097605839304, 'weight_decay': 1.9461322335898918e-06, 'epochs': 52, 'loss': 'mse', 'optimizer': 'adam', 'graph_mode': 'off', 'use_snp_selection': False}. Best is trial 54 with value: 0.23112022995098971.
[I 2025-12-05 20:53:02,129] Trial 69 finished with value: 0.229489407279244 and parameters: {'model_type': 'mlp', 'hidden_dims': '[512, 256]', 'dropout': 0.22868279910719413, 'batch_norm': False, 'lr': 5.808629350909564e-05, 'weight_decay': 3.851429749967073e-06, 'epochs': 69, 'loss': 'mse', 'optimizer': 'adam', 'graph_mode': 'off', 'use_snp_selection': False}. Best is trial 54 with value: 0.23112022995098971.
[I 2025-12-05 20:53:18,427] Trial 70 finished with value: 0.22252441255982142 and parameters: {'model_type': 'mlp', 'hidden_dims': '[256, 128]', 'dropout': 0.1696685677668125, 'batch_norm': False, 'lr': 0.0001260940219530732, 'weight_decay': 3.5122543205737896e-06, 'epochs': 73, 'loss': 'mse', 'optimizer': 'adam', 'graph_mode': 'off', 'use_snp_selection': False}. Best is trial 54 with value: 0.23112022995098971.
[I 2025-12-05 20:53:41,828] Trial 71 finished with value: 0.2240922766238756 and parameters: {'model_type': 'mlp', 'hidden_dims': '[512, 256]', 'dropout': 0.2374265408751493, 'batch_norm': False, 'lr': 5.955983673858583e-05, 'weight_decay': 1.4804504522666122e-06, 'epochs': 60, 'loss': 'mse', 'optimizer': 'adam', 'graph_mode': 'off', 'use_snp_selection': False}. Best is trial 54 with value: 0.23112022995098971.
[I 2025-12-05 20:54:05,767] Trial 72 finished with value: 0.23017466899870115 and parameters: {'model_type': 'mlp', 'hidden_dims': '[512, 256]', 'dropout': 0.19936761372314896, 'batch_norm': False, 'lr': 6.156477712474042e-05, 'weight_decay': 1.4511505178004886e-06, 'epochs': 62, 'loss': 'mse', 'optimizer': 'adam', 'graph_mode': 'off', 'use_snp_selection': False}. Best is trial 54 with value: 0.23112022995098971.
[I 2025-12-05 20:54:27,861] Trial 73 finished with value: 0.22437437710014424 and parameters: {'model_type': 'mlp', 'hidden_dims': '[512, 256]', 'dropout': 0.21567003269246365, 'batch_norm': False, 'lr': 5.408273310733025e-05, 'weight_decay': 8.270347049546477e-07, 'epochs': 55, 'loss': 'mse', 'optimizer': 'adam', 'graph_mode': 'off', 'use_snp_selection': False}. Best is trial 54 with value: 0.23112022995098971.
[I 2025-12-05 20:54:47,560] Trial 74 finished with value: 0.21047667242452892 and parameters: {'model_type': 'mlp', 'hidden_dims': '[512, 256]', 'dropout': 0.18727746190158617, 'batch_norm': False, 'lr': 5.1674932251117516e-05, 'weight_decay': 2.764825494269338e-07, 'epochs': 46, 'loss': 'mse', 'optimizer': 'adam', 'graph_mode': 'off', 'use_snp_selection': False}. Best is trial 54 with value: 0.23112022995098971.
[I 2025-12-05 20:55:09,603] Trial 75 finished with value: 0.22615236515374376 and parameters: {'model_type': 'mlp', 'hidden_dims': '[512, 256]', 'dropout': 0.13190841573668238, 'batch_norm': False, 'lr': 3.710588371852e-05, 'weight_decay': 7.692074189402875e-07, 'epochs': 55, 'loss': 'mse', 'optimizer': 'adam', 'graph_mode': 'off', 'use_snp_selection': False}. Best is trial 54 with value: 0.23112022995098971.
[I 2025-12-05 20:55:31,123] Trial 76 finished with value: 0.21718288366574945 and parameters: {'model_type': 'mlp', 'hidden_dims': '[512, 256]', 'dropout': 0.10715784458036853, 'batch_norm': False, 'lr': 3.883265879048923e-05, 'weight_decay': 7.439498346985639e-07, 'epochs': 53, 'loss': 'mae', 'optimizer': 'adam', 'graph_mode': 'off', 'use_snp_selection': False}. Best is trial 54 with value: 0.23112022995098971.
[I 2025-12-05 20:55:42,368] Trial 77 finished with value: 0.2238130512008573 and parameters: {'model_type': 'mlp', 'hidden_dims': '[128, 64]', 'dropout': 0.1440973378272086, 'batch_norm': False, 'lr': 9.016895069100317e-05, 'weight_decay': 1.1309849215000413e-06, 'epochs': 80, 'loss': 'mse', 'optimizer': 'adam', 'graph_mode': 'off', 'use_snp_selection': False}. Best is trial 54 with value: 0.23112022995098971.
[I 2025-12-05 20:56:14,361] Trial 78 finished with value: 0.2213288835653998 and parameters: {'model_type': 'mlp', 'hidden_dims': '[512, 256]', 'dropout': 0.1304915321185174, 'batch_norm': False, 'lr': 2.3626313396336166e-05, 'weight_decay': 8.878712074075648e-07, 'epochs': 92, 'loss': 'mse', 'optimizer': 'adam', 'graph_mode': 'off', 'use_snp_selection': False}. Best is trial 54 with value: 0.23112022995098971.
[I 2025-12-05 20:56:44,626] Trial 79 finished with value: 0.18994927685137103 and parameters: {'model_type': 'mlp', 'hidden_dims': '[512, 256]', 'dropout': 0.21513436139677936, 'batch_norm': False, 'lr': 3.2908159028523014e-05, 'weight_decay': 4.658374909895316e-07, 'epochs': 55, 'loss': 'mse', 'optimizer': 'adam', 'graph_mode': 'off', 'use_snp_selection': True, 'num_snps': 3769}. Best is trial 54 with value: 0.23112022995098971.
[I 2025-12-05 20:57:03,263] Trial 80 finished with value: 0.20418680051439236 and parameters: {'model_type': 'mlp', 'hidden_dims': '[512, 128]', 'dropout': 0.1692950069886688, 'batch_norm': True, 'lr': 0.0002654836621019615, 'weight_decay': 2.976093513995867e-07, 'epochs': 42, 'loss': 'mse', 'optimizer': 'adam', 'graph_mode': 'off', 'use_snp_selection': False}. Best is trial 54 with value: 0.23112022995098971.
[I 2025-12-05 20:57:28,333] Trial 81 finished with value: 0.22341133313670886 and parameters: {'model_type': 'mlp', 'hidden_dims': '[512, 256]', 'dropout': 0.2282326802591423, 'batch_norm': False, 'lr': 5.94594831391863e-05, 'weight_decay': 2.1129061360738413e-06, 'epochs': 67, 'loss': 'mse', 'optimizer': 'adam', 'graph_mode': 'off', 'use_snp_selection': False}. Best is trial 54 with value: 0.23112022995098971.
[I 2025-12-05 20:57:55,549] Trial 82 finished with value: 0.22216404934517575 and parameters: {'model_type': 'mlp', 'hidden_dims': '[512, 256]', 'dropout': 0.18752446041023105, 'batch_norm': False, 'lr': 0.00011589966981427907, 'weight_decay': 1.4378024679362598e-06, 'epochs': 75, 'loss': 'mse', 'optimizer': 'adam', 'graph_mode': 'off', 'use_snp_selection': False}. Best is trial 54 with value: 0.23112022995098971.
[I 2025-12-05 20:58:18,341] Trial 83 finished with value: 0.22777117457386592 and parameters: {'model_type': 'mlp', 'hidden_dims': '[512, 256]', 'dropout': 0.25766668715181373, 'batch_norm': False, 'lr': 4.111201501375172e-05, 'weight_decay': 4.174234713272898e-06, 'epochs': 58, 'loss': 'mse', 'optimizer': 'adam', 'graph_mode': 'off', 'use_snp_selection': False}. Best is trial 54 with value: 0.23112022995098971.
[I 2025-12-05 20:58:41,443] Trial 84 finished with value: 0.23119195009048346 and parameters: {'model_type': 'mlp', 'hidden_dims': '[512, 256]', 'dropout': 0.2077522881301703, 'batch_norm': False, 'lr': 4.5845047907590945e-05, 'weight_decay': 6.760668941743268e-07, 'epochs': 59, 'loss': 'mse', 'optimizer': 'adam', 'graph_mode': 'off', 'use_snp_selection': False}. Best is trial 84 with value: 0.23119195009048346.
[I 2025-12-05 20:59:15,168] Trial 85 finished with value: 0.21965844879082708 and parameters: {'model_type': 'mlp', 'hidden_dims': '[512, 256]', 'dropout': 0.25642226880306324, 'batch_norm': False, 'lr': 3.382535194657357e-05, 'weight_decay': 3.931511622879392e-06, 'epochs': 99, 'loss': 'mse', 'optimizer': 'adam', 'graph_mode': 'off', 'use_snp_selection': False}. Best is trial 84 with value: 0.23119195009048346.
[I 2025-12-05 20:59:38,745] Trial 86 finished with value: 0.22072194336947387 and parameters: {'model_type': 'mlp', 'hidden_dims': '[512, 64]', 'dropout': 0.31149452236902364, 'batch_norm': False, 'lr': 4.2721162511497714e-05, 'weight_decay': 5.456056974253127e-07, 'epochs': 61, 'loss': 'mse', 'optimizer': 'adam', 'graph_mode': 'off', 'use_snp_selection': False}. Best is trial 84 with value: 0.23119195009048346.
[I 2025-12-05 21:00:54,031] Trial 87 finished with value: 0.20710116866153286 and parameters: {'model_type': 'mlp', 'hidden_dims': '[512, 256]', 'dropout': 0.2597182223056839, 'batch_norm': False, 'lr': 1.8595715272873863e-05, 'weight_decay': 1.2513311339968936e-06, 'epochs': 252, 'loss': 'mse', 'optimizer': 'adam', 'graph_mode': 'off', 'use_snp_selection': False}. Best is trial 84 with value: 0.23119195009048346.
[I 2025-12-05 21:01:31,562] Trial 88 finished with value: 0.19432273486996582 and parameters: {'model_type': 'mlp', 'hidden_dims': '[512, 256]', 'dropout': 0.23276396493383944, 'batch_norm': True, 'lr': 2.413662908083844e-05, 'weight_decay': 8.36492403768633e-06, 'epochs': 110, 'loss': 'mae', 'optimizer': 'adam', 'graph_mode': 'off', 'use_snp_selection': False}. Best is trial 84 with value: 0.23119195009048346.
[I 2025-12-05 21:01:51,515] Trial 89 finished with value: 0.22787147163254326 and parameters: {'model_type': 'mlp', 'hidden_dims': '[512, 256]', 'dropout': 0.20355347772177207, 'batch_norm': False, 'lr': 1.2384863040787954e-05, 'weight_decay': 0.0005966869876800607, 'epochs': 46, 'loss': 'mse', 'optimizer': 'adam', 'graph_mode': 'off', 'use_snp_selection': False}. Best is trial 84 with value: 0.23119195009048346.
[I 2025-12-05 21:02:09,836] Trial 90 finished with value: 0.21431987805958239 and parameters: {'model_type': 'mlp', 'hidden_dims': '[512, 256]', 'dropout': 0.19737165734624207, 'batch_norm': False, 'lr': 1.2924508497117726e-05, 'weight_decay': 0.00023231848582044797, 'epochs': 40, 'loss': 'mse', 'optimizer': 'adam', 'graph_mode': 'off', 'use_snp_selection': False}. Best is trial 84 with value: 0.23119195009048346.
[I 2025-12-05 21:02:29,838] Trial 91 finished with value: 0.21551451513033254 and parameters: {'model_type': 'mlp', 'hidden_dims': '[512, 256]', 'dropout': 0.1713621101003414, 'batch_norm': False, 'lr': 4.661728139023124e-05, 'weight_decay': 6.677913679446879e-07, 'epochs': 47, 'loss': 'mse', 'optimizer': 'adam', 'graph_mode': 'off', 'use_snp_selection': False}. Best is trial 84 with value: 0.23119195009048346.
[I 2025-12-05 21:02:56,056] Trial 92 finished with value: 0.22373504670041733 and parameters: {'model_type': 'mlp', 'hidden_dims': '[512, 256]', 'dropout': 0.19785097627708909, 'batch_norm': False, 'lr': 0.0001705976909277031, 'weight_decay': 2.0856269176021766e-06, 'epochs': 71, 'loss': 'mse', 'optimizer': 'adam', 'graph_mode': 'off', 'use_snp_selection': False}. Best is trial 84 with value: 0.23119195009048346.
[I 2025-12-05 21:03:26,059] Trial 93 finished with value: 0.21964928595323627 and parameters: {'model_type': 'mlp', 'hidden_dims': '[512, 256]', 'dropout': 0.15690692613442755, 'batch_norm': False, 'lr': 6.618330271776175e-05, 'weight_decay': 9.872298855186202e-07, 'epochs': 85, 'loss': 'mse', 'optimizer': 'adam', 'graph_mode': 'off', 'use_snp_selection': False}. Best is trial 84 with value: 0.23119195009048346.
[I 2025-12-05 21:03:49,773] Trial 94 finished with value: 0.22401495694496582 and parameters: {'model_type': 'mlp', 'hidden_dims': '[512, 256]', 'dropout': 0.13258475665436434, 'batch_norm': False, 'lr': 2.8269442562314822e-05, 'weight_decay': 0.00044576360835512323, 'epochs': 61, 'loss': 'mse', 'optimizer': 'adam', 'graph_mode': 'off', 'use_snp_selection': False}. Best is trial 84 with value: 0.23119195009048346.
[I 2025-12-05 21:04:02,883] Trial 95 finished with value: 0.2152866077971288 and parameters: {'model_type': 'mlp', 'hidden_dims': '[256, 128]', 'dropout': 0.221056937332226, 'batch_norm': False, 'lr': 1.1974856034650101e-05, 'weight_decay': 3.524403388760864e-07, 'epochs': 49, 'loss': 'mse', 'optimizer': 'adam', 'graph_mode': 'off', 'use_snp_selection': False}. Best is trial 84 with value: 0.23119195009048346.
[I 2025-12-05 21:05:04,577] Trial 96 finished with value: 0.21309546546827143 and parameters: {'model_type': 'mlp', 'hidden_dims': '[512, 256]', 'dropout': 0.338484364638095, 'batch_norm': False, 'lr': 1.5053673815846404e-05, 'weight_decay': 1.4930695386831026e-06, 'epochs': 78, 'loss': 'mse', 'optimizer': 'adam', 'graph_mode': 'off', 'use_snp_selection': True, 'num_snps': 48962}. Best is trial 84 with value: 0.23119195009048346.
[I 2025-12-05 21:05:14,560] Trial 97 finished with value: 0.2066796501165534 and parameters: {'model_type': 'mlp', 'hidden_dims': '[128, 64]', 'dropout': 0.2450580918287326, 'batch_norm': True, 'lr': 8.673975187388856e-05, 'weight_decay': 2.4775611720732522e-06, 'epochs': 59, 'loss': 'mse', 'optimizer': 'adam', 'graph_mode': 'off', 'use_snp_selection': False}. Best is trial 84 with value: 0.23119195009048346.
[I 2025-12-05 21:05:39,218] Trial 98 finished with value: 0.22120632360469078 and parameters: {'model_type': 'mlp', 'hidden_dims': '[512, 256]', 'dropout': 0.11898201290065885, 'batch_norm': False, 'lr': 2.0292218049957056e-05, 'weight_decay': 6.513653255443579e-06, 'epochs': 65, 'loss': 'mse', 'optimizer': 'adam', 'graph_mode': 'off', 'use_snp_selection': False}. Best is trial 84 with value: 0.23119195009048346.
[I 2025-12-05 21:05:59,249] Trial 99 finished with value: 0.22649796696931168 and parameters: {'model_type': 'mlp', 'hidden_dims': '[512, 128]', 'dropout': 0.2044524332741504, 'batch_norm': False, 'lr': 3.8697074376630254e-05, 'weight_decay': 1.7694077114388635e-06, 'epochs': 48, 'loss': 'mse', 'optimizer': 'adam', 'graph_mode': 'off', 'use_snp_selection': False}. Best is trial 84 with value: 0.23119195009048346.
[I 2025-12-05 21:06:18,792] Trial 100 finished with value: 0.22819299701334064 and parameters: {'model_type': 'mlp', 'hidden_dims': '[512, 128]', 'dropout': 0.2034669326991725, 'batch_norm': False, 'lr': 3.7102373146588015e-05, 'weight_decay': 0.00010009704105857947, 'epochs': 46, 'loss': 'mse', 'optimizer': 'adam', 'graph_mode': 'off', 'use_snp_selection': False}. Best is trial 84 with value: 0.23119195009048346.
[I 2025-12-05 21:06:37,835] Trial 101 finished with value: 0.21262702016309717 and parameters: {'model_type': 'mlp', 'hidden_dims': '[512, 128]', 'dropout': 0.2091906545851392, 'batch_norm': False, 'lr': 3.4629033855911086e-05, 'weight_decay': 0.00014349078253992245, 'epochs': 44, 'loss': 'mse', 'optimizer': 'adam', 'graph_mode': 'off', 'use_snp_selection': False}. Best is trial 84 with value: 0.23119195009048346.
[I 2025-12-05 21:07:04,236] Trial 102 finished with value: 0.23243310564913916 and parameters: {'model_type': 'mlp', 'hidden_dims': '[512, 128]', 'dropout': 0.20180028582994752, 'batch_norm': False, 'lr': 3.9631747335768594e-05, 'weight_decay': 4.841974197796144e-05, 'epochs': 72, 'loss': 'mse', 'optimizer': 'adam', 'graph_mode': 'off', 'use_snp_selection': False}. Best is trial 102 with value: 0.23243310564913916.
[I 2025-12-05 21:07:29,915] Trial 103 finished with value: 0.22579857714494467 and parameters: {'model_type': 'mlp', 'hidden_dims': '[512, 128]', 'dropout': 0.18396425534008187, 'batch_norm': False, 'lr': 4.0083120688598827e-05, 'weight_decay': 6.55950425982153e-05, 'epochs': 69, 'loss': 'mse', 'optimizer': 'adam', 'graph_mode': 'off', 'use_snp_selection': False}. Best is trial 102 with value: 0.23243310564913916.
[I 2025-12-05 21:07:52,757] Trial 104 finished with value: 0.2210645569191026 and parameters: {'model_type': 'mlp', 'hidden_dims': '[512, 128]', 'dropout': 0.184123514511249, 'batch_norm': False, 'lr': 3.990512279996984e-05, 'weight_decay': 8.348912657287085e-05, 'epochs': 58, 'loss': 'mse', 'optimizer': 'adam', 'graph_mode': 'off', 'use_snp_selection': False}. Best is trial 102 with value: 0.23243310564913916.
[I 2025-12-05 21:08:12,702] Trial 105 finished with value: 0.22147855214746173 and parameters: {'model_type': 'mlp', 'hidden_dims': '[512, 128]', 'dropout': 0.20308587818124962, 'batch_norm': False, 'lr': 2.9606974031339628e-05, 'weight_decay': 4.831171058867416e-05, 'epochs': 47, 'loss': 'mse', 'optimizer': 'adam', 'graph_mode': 'off', 'use_snp_selection': False}. Best is trial 102 with value: 0.23243310564913916.
[I 2025-12-05 21:08:37,529] Trial 106 finished with value: 0.2254647257035967 and parameters: {'model_type': 'mlp', 'hidden_dims': '[512, 128]', 'dropout': 0.1563752627540934, 'batch_norm': False, 'lr': 5.068674119591645e-05, 'weight_decay': 0.0004079856235752417, 'epochs': 66, 'loss': 'mse', 'optimizer': 'adam', 'graph_mode': 'off', 'use_snp_selection': False}. Best is trial 102 with value: 0.23243310564913916.
[I 2025-12-05 21:09:07,514] Trial 107 finished with value: 0.21064460706307195 and parameters: {'model_type': 'mlp', 'hidden_dims': '[512, 128]', 'dropout': 0.17869897912185922, 'batch_norm': False, 'lr': 2.3910711583705974e-05, 'weight_decay': 9.012711096767949e-05, 'epochs': 85, 'loss': 'mae', 'optimizer': 'adam', 'graph_mode': 'off', 'use_snp_selection': False}. Best is trial 102 with value: 0.23243310564913916.
[I 2025-12-05 21:09:33,150] Trial 108 finished with value: 0.22937374010897366 and parameters: {'model_type': 'mlp', 'hidden_dims': '[512, 128]', 'dropout': 0.22598268157497511, 'batch_norm': False, 'lr': 3.791139750979966e-05, 'weight_decay': 0.00010469235135957641, 'epochs': 69, 'loss': 'mse', 'optimizer': 'adam', 'graph_mode': 'off', 'use_snp_selection': False}. Best is trial 102 with value: 0.23243310564913916.
[I 2025-12-05 21:09:53,003] Trial 109 finished with value: 0.2235894493499672 and parameters: {'model_type': 'mlp', 'hidden_dims': '[512, 128]', 'dropout': 0.2265636966556997, 'batch_norm': False, 'lr': 4.749370667993215e-05, 'weight_decay': 0.00011287934804266174, 'epochs': 47, 'loss': 'mse', 'optimizer': 'adam', 'graph_mode': 'off', 'use_snp_selection': False}. Best is trial 102 with value: 0.23243310564913916.
[I 2025-12-05 21:10:15,522] Trial 110 finished with value: 0.2232951019324267 and parameters: {'model_type': 'mlp', 'hidden_dims': '[512, 128]', 'dropout': 0.25243888168210005, 'batch_norm': False, 'lr': 3.581819273557178e-05, 'weight_decay': 2.915387263712064e-05, 'epochs': 57, 'loss': 'mse', 'optimizer': 'adam', 'graph_mode': 'off', 'use_snp_selection': False}. Best is trial 102 with value: 0.23243310564913916.
[I 2025-12-05 21:10:41,662] Trial 111 finished with value: 0.23124423990618276 and parameters: {'model_type': 'mlp', 'hidden_dims': '[512, 128]', 'dropout': 0.20402007625283328, 'batch_norm': False, 'lr': 6.060839695312303e-05, 'weight_decay': 1.760640293376568e-05, 'epochs': 71, 'loss': 'mse', 'optimizer': 'adam', 'graph_mode': 'off', 'use_snp_selection': False}. Best is trial 102 with value: 0.23243310564913916.
[I 2025-12-05 21:11:08,335] Trial 112 finished with value: 0.22110800151711696 and parameters: {'model_type': 'mlp', 'hidden_dims': '[512, 128]', 'dropout': 0.2688022411579499, 'batch_norm': False, 'lr': 6.081294690643373e-05, 'weight_decay': 0.0006441051896939763, 'epochs': 73, 'loss': 'mse', 'optimizer': 'adam', 'graph_mode': 'off', 'use_snp_selection': False}. Best is trial 102 with value: 0.23243310564913916.
[I 2025-12-05 21:11:32,667] Trial 113 finished with value: 0.22430842958025562 and parameters: {'model_type': 'mlp', 'hidden_dims': '[512, 128]', 'dropout': 0.2385680018882191, 'batch_norm': False, 'lr': 5.5393395253023084e-05, 'weight_decay': 0.00022847251371447587, 'epochs': 64, 'loss': 'mse', 'optimizer': 'adam', 'graph_mode': 'off', 'use_snp_selection': False}. Best is trial 102 with value: 0.23243310564913916.
[I 2025-12-05 21:12:06,505] Trial 114 finished with value: 0.22535444111886038 and parameters: {'model_type': 'mlp', 'hidden_dims': '[512, 128]', 'dropout': 0.19758258542659718, 'batch_norm': False, 'lr': 7.308730656016121e-05, 'weight_decay': 1.5075385043729186e-05, 'epochs': 100, 'loss': 'mse', 'optimizer': 'adam', 'graph_mode': 'off', 'use_snp_selection': False}. Best is trial 102 with value: 0.23243310564913916.
