[I 2025-12-05 16:38:13,923] Trial 101 finished with value: 0.3102968361784856 and parameters: {'model_type': 'mlp', 'hidden_dims': '[512, 64]', 'dropout': 0.24582477241874912, 'batch_norm': False, 'lr': 4.7918336240024255e-06, 'weight_decay': 3.358903197514536e-05, 'epochs': 350, 'loss': 'mae', 'optimizer': 'adam', 'graph_mode': 'off', 'use_snp_selection': True, 'num_snps': 45686}. Best is trial 81 with value: 0.3134854573083974.
[I 2025-12-05 16:39:37,303] Trial 102 finished with value: 0.31242661874922 and parameters: {'model_type': 'mlp', 'hidden_dims': '[512, 64]', 'dropout': 0.21996671311488464, 'batch_norm': False, 'lr': 6.395982348881288e-06, 'weight_decay': 0.00011655314906581081, 'epochs': 340, 'loss': 'mae', 'optimizer': 'adam', 'graph_mode': 'off', 'use_snp_selection': True, 'num_snps': 50223}. Best is trial 81 with value: 0.3134854573083974.
[I 2025-12-05 16:40:59,908] Trial 103 finished with value: 0.3121707256979332 and parameters: {'model_type': 'mlp', 'hidden_dims': '[512, 64]', 'dropout': 0.2656894450244813, 'batch_norm': False, 'lr': 6.277472038195627e-06, 'weight_decay': 0.00014635127549246618, 'epochs': 334, 'loss': 'mae', 'optimizer': 'adam', 'graph_mode': 'off', 'use_snp_selection': True, 'num_snps': 50393}. Best is trial 81 with value: 0.3134854573083974.
[I 2025-12-05 16:42:21,676] Trial 104 finished with value: 0.30953390352174964 and parameters: {'model_type': 'mlp', 'hidden_dims': '[512, 64]', 'dropout': 0.2698624666589234, 'batch_norm': False, 'lr': 8.660484660846046e-06, 'weight_decay': 6.730534417148998e-05, 'epochs': 337, 'loss': 'mae', 'optimizer': 'adam', 'graph_mode': 'off', 'use_snp_selection': True, 'num_snps': 49462}. Best is trial 81 with value: 0.3134854573083974.
[I 2025-12-05 16:43:45,932] Trial 105 finished with value: 0.3122792041547886 and parameters: {'model_type': 'mlp', 'hidden_dims': '[512, 64]', 'dropout': 0.42726629730613264, 'batch_norm': False, 'lr': 6.1447431304922974e-06, 'weight_decay': 0.0001144656714717815, 'epochs': 343, 'loss': 'mae', 'optimizer': 'adam', 'graph_mode': 'off', 'use_snp_selection': True, 'num_snps': 51004}. Best is trial 81 with value: 0.3134854573083974.
[I 2025-12-05 16:45:13,642] Trial 106 finished with value: 0.3123753519878427 and parameters: {'model_type': 'mlp', 'hidden_dims': '[512, 64]', 'dropout': 0.42782551011415015, 'batch_norm': False, 'lr': 6.9434163230369276e-06, 'weight_decay': 0.00011904283071741335, 'epochs': 334, 'loss': 'mae', 'optimizer': 'adam', 'graph_mode': 'off', 'use_snp_selection': True, 'num_snps': 55230}. Best is trial 81 with value: 0.3134854573083974.
[I 2025-12-05 16:46:35,918] Trial 107 finished with value: 0.31292901835041775 and parameters: {'model_type': 'mlp', 'hidden_dims': '[512, 64]', 'dropout': 0.42826113859784054, 'batch_norm': False, 'lr': 6.568885733541987e-06, 'weight_decay': 0.00011938710829759405, 'epochs': 332, 'loss': 'mae', 'optimizer': 'adam', 'graph_mode': 'off', 'use_snp_selection': True, 'num_snps': 50445}. Best is trial 81 with value: 0.3134854573083974.
[I 2025-12-05 16:47:39,307] Trial 108 finished with value: 0.3085408115199667 and parameters: {'model_type': 'mlp', 'hidden_dims': '[512, 64]', 'dropout': 0.40879742787582546, 'batch_norm': False, 'lr': 6.496507664362584e-06, 'weight_decay': 0.00010823073183140345, 'epochs': 333, 'loss': 'mae', 'optimizer': 'adam', 'graph_mode': 'off', 'use_snp_selection': True, 'num_snps': 34762}. Best is trial 81 with value: 0.3134854573083974.
[I 2025-12-05 16:49:02,823] Trial 109 finished with value: 0.31071929177070146 and parameters: {'model_type': 'mlp', 'hidden_dims': '[512, 64]', 'dropout': 0.45549787139698605, 'batch_norm': False, 'lr': 1.1451707576045662e-05, 'weight_decay': 8.373555330895872e-05, 'epochs': 343, 'loss': 'mae', 'optimizer': 'adam', 'graph_mode': 'off', 'use_snp_selection': True, 'num_snps': 50266}. Best is trial 81 with value: 0.3134854573083974.
[I 2025-12-05 16:50:19,771] Trial 110 finished with value: 0.31163421138960296 and parameters: {'model_type': 'mlp', 'hidden_dims': '[512, 64]', 'dropout': 0.4000214098167488, 'batch_norm': False, 'lr': 6.200468900507247e-06, 'weight_decay': 0.00014982146036086758, 'epochs': 325, 'loss': 'mae', 'optimizer': 'adam', 'graph_mode': 'off', 'use_snp_selection': True, 'num_snps': 46900}. Best is trial 81 with value: 0.3134854573083974.
[I 2025-12-05 16:51:45,233] Trial 111 finished with value: 0.31149478534255465 and parameters: {'model_type': 'mlp', 'hidden_dims': '[512, 64]', 'dropout': 0.4252771440328728, 'batch_norm': False, 'lr': 7.705628144238147e-06, 'weight_decay': 0.00012897000462831862, 'epochs': 314, 'loss': 'mae', 'optimizer': 'adam', 'graph_mode': 'off', 'use_snp_selection': True, 'num_snps': 55381}. Best is trial 81 with value: 0.3134854573083974.
[I 2025-12-05 16:52:45,023] Trial 112 finished with value: 0.31121613577976676 and parameters: {'model_type': 'mlp', 'hidden_dims': '[256, 128]', 'dropout': 0.43066719460798225, 'batch_norm': False, 'lr': 9.223506227525112e-06, 'weight_decay': 0.00019941861900096735, 'epochs': 339, 'loss': 'mae', 'optimizer': 'adam', 'graph_mode': 'off', 'use_snp_selection': True, 'num_snps': 51135}. Best is trial 81 with value: 0.3134854573083974.
[I 2025-12-05 16:54:09,617] Trial 113 finished with value: 0.312639117404041 and parameters: {'model_type': 'mlp', 'hidden_dims': '[512, 64]', 'dropout': 0.44426930879999005, 'batch_norm': False, 'lr': 5.134971710326884e-06, 'weight_decay': 4.724930855871875e-05, 'epochs': 330, 'loss': 'mae', 'optimizer': 'adam', 'graph_mode': 'off', 'use_snp_selection': True, 'num_snps': 52792}. Best is trial 81 with value: 0.3134854573083974.
[I 2025-12-05 16:55:35,133] Trial 114 finished with value: 0.31168686156229597 and parameters: {'model_type': 'mlp', 'hidden_dims': '[512, 64]', 'dropout': 0.4469858388821259, 'batch_norm': False, 'lr': 4.684651501133254e-06, 'weight_decay': 4.892358466415955e-05, 'epochs': 330, 'loss': 'mae', 'optimizer': 'adam', 'graph_mode': 'off', 'use_snp_selection': True, 'num_snps': 53491}. Best is trial 81 with value: 0.3134854573083974.
[I 2025-12-05 16:56:47,564] Trial 115 finished with value: 0.3102487154180876 and parameters: {'model_type': 'mlp', 'hidden_dims': '[512, 64]', 'dropout': 0.4735088828199618, 'batch_norm': False, 'lr': 5.264866800402011e-06, 'weight_decay': 6.326023548965821e-05, 'epochs': 319, 'loss': 'mae', 'optimizer': 'adam', 'graph_mode': 'off', 'use_snp_selection': True, 'num_snps': 44048}. Best is trial 81 with value: 0.3134854573083974.
[I 2025-12-05 16:58:08,172] Trial 116 finished with value: 0.30606892714789724 and parameters: {'model_type': 'mlp', 'hidden_dims': '[512, 64]', 'dropout': 0.4644701096271104, 'batch_norm': False, 'lr': 0.00033884031701467745, 'weight_decay': 0.0001123736417885119, 'epochs': 344, 'loss': 'mae', 'optimizer': 'adam', 'graph_mode': 'off', 'use_snp_selection': True, 'num_snps': 48521}. Best is trial 81 with value: 0.3134854573083974.
[I 2025-12-05 16:59:38,598] Trial 117 finished with value: 0.30468547980890365 and parameters: {'model_type': 'mlp', 'hidden_dims': '[512, 64]', 'dropout': 0.40987560449904914, 'batch_norm': False, 'lr': 3.5353019561082103e-06, 'weight_decay': 8.676115084928091e-05, 'epochs': 335, 'loss': 'mse', 'optimizer': 'adam', 'graph_mode': 'off', 'use_snp_selection': True, 'num_snps': 57206}. Best is trial 81 with value: 0.3134854573083974.
[I 2025-12-05 17:00:59,606] Trial 118 finished with value: 0.3118584717470425 and parameters: {'model_type': 'mlp', 'hidden_dims': '[512, 64]', 'dropout': 0.44154134680441365, 'batch_norm': False, 'lr': 6.10317245194052e-06, 'weight_decay': 0.00023303673574058626, 'epochs': 325, 'loss': 'mae', 'optimizer': 'adam', 'graph_mode': 'off', 'use_snp_selection': True, 'num_snps': 50441}. Best is trial 81 with value: 0.3134854573083974.
[I 2025-12-05 17:01:58,821] Trial 119 finished with value: 0.306904214250973 and parameters: {'model_type': 'mlp', 'hidden_dims': '[512, 64]', 'dropout': 0.3830198200402307, 'batch_norm': False, 'lr': 1.3219347063499467e-05, 'weight_decay': 0.00015488595376904712, 'epochs': 312, 'loss': 'mae', 'optimizer': 'adam', 'graph_mode': 'off', 'use_snp_selection': False}. Best is trial 81 with value: 0.3134854573083974.
[I 2025-12-05 17:03:26,405] Trial 120 finished with value: 0.3036983860962611 and parameters: {'model_type': 'mlp', 'hidden_dims': '[512, 64]', 'dropout': 0.2603964950566792, 'batch_norm': False, 'lr': 8.405535316752462e-05, 'weight_decay': 7.16271079354618e-05, 'epochs': 330, 'loss': 'mae', 'optimizer': 'adam', 'graph_mode': 'off', 'use_snp_selection': True, 'num_snps': 55842}. Best is trial 81 with value: 0.3134854573083974.
[I 2025-12-05 17:04:48,961] Trial 121 finished with value: 0.31022164998239143 and parameters: {'model_type': 'mlp', 'hidden_dims': '[512, 128]', 'dropout': 0.426682180741346, 'batch_norm': False, 'lr': 7.237580521758497e-06, 'weight_decay': 0.0001004892908652645, 'epochs': 320, 'loss': 'mae', 'optimizer': 'adam', 'graph_mode': 'off', 'use_snp_selection': True, 'num_snps': 52218}. Best is trial 81 with value: 0.3134854573083974.
[I 2025-12-05 17:06:08,844] Trial 122 finished with value: 0.3118667508923175 and parameters: {'model_type': 'mlp', 'hidden_dims': '[512, 64]', 'dropout': 0.4514901912852983, 'batch_norm': False, 'lr': 1.0708475525081913e-05, 'weight_decay': 0.00012804073728609833, 'epochs': 300, 'loss': 'mae', 'optimizer': 'adam', 'graph_mode': 'off', 'use_snp_selection': True, 'num_snps': 52590}. Best is trial 81 with value: 0.3134854573083974.
[I 2025-12-05 17:07:03,166] Trial 123 finished with value: 0.3033680081091781 and parameters: {'model_type': 'mlp', 'hidden_dims': '[512, 128]', 'dropout': 0.44066620348965657, 'batch_norm': False, 'lr': 8.598173487169097e-06, 'weight_decay': 0.0001853486953909117, 'epochs': 340, 'loss': 'mae', 'optimizer': 'adam', 'graph_mode': 'off', 'use_snp_selection': True, 'num_snps': 26719}. Best is trial 81 with value: 0.3134854573083974.
[I 2025-12-05 17:08:32,566] Trial 124 finished with value: 0.310074027441673 and parameters: {'model_type': 'mlp', 'hidden_dims': '[512, 64]', 'dropout': 0.48501480881741893, 'batch_norm': False, 'lr': 4.524837013165952e-06, 'weight_decay': 0.0001425962688346939, 'epochs': 350, 'loss': 'mae', 'optimizer': 'adam', 'graph_mode': 'off', 'use_snp_selection': True, 'num_snps': 54920}. Best is trial 81 with value: 0.3134854573083974.
[I 2025-12-05 17:09:20,441] Trial 125 finished with value: 0.30878580836243963 and parameters: {'model_type': 'mlp', 'hidden_dims': '[128, 64]', 'dropout': 0.4138036340401365, 'batch_norm': False, 'lr': 6.832783733099081e-06, 'weight_decay': 0.00011508685634427406, 'epochs': 310, 'loss': 'mae', 'optimizer': 'adam', 'graph_mode': 'off', 'use_snp_selection': True, 'num_snps': 51392}. Best is trial 81 with value: 0.3134854573083974.
[I 2025-12-05 17:10:52,178] Trial 126 finished with value: 0.31080773806270084 and parameters: {'model_type': 'mlp', 'hidden_dims': '[512, 64]', 'dropout': 0.22225287325060175, 'batch_norm': False, 'lr': 5.420021940897911e-06, 'weight_decay': 0.00026234216732805326, 'epochs': 327, 'loss': 'mae', 'optimizer': 'adam', 'graph_mode': 'off', 'use_snp_selection': True, 'num_snps': 58790}. Best is trial 81 with value: 0.3134854573083974.
[I 2025-12-05 17:12:12,339] Trial 127 finished with value: 0.3082366259049026 and parameters: {'model_type': 'mlp', 'hidden_dims': '[512, 64]', 'dropout': 0.460723674576072, 'batch_norm': False, 'lr': 7.249958061380861e-06, 'weight_decay': 8.068626111618601e-05, 'epochs': 296, 'loss': 'mae', 'optimizer': 'adam', 'graph_mode': 'off', 'use_snp_selection': True, 'num_snps': 53584}. Best is trial 81 with value: 0.3134854573083974.
[I 2025-12-05 17:13:29,592] Trial 128 finished with value: 0.29640658850531065 and parameters: {'model_type': 'mlp', 'hidden_dims': '[512, 128]', 'dropout': 0.43331376193651605, 'batch_norm': True, 'lr': 8.4656270085046e-06, 'weight_decay': 5.547617137924973e-05, 'epochs': 317, 'loss': 'mae', 'optimizer': 'adam', 'graph_mode': 'off', 'use_snp_selection': True, 'num_snps': 47890}. Best is trial 81 with value: 0.3134854573083974.
[I 2025-12-05 17:14:02,918] Trial 129 finished with value: 0.29424712985329127 and parameters: {'model_type': 'mlp', 'hidden_dims': '[256, 128, 64]', 'dropout': 0.3974419359892379, 'batch_norm': False, 'lr': 9.55262425585072e-06, 'weight_decay': 0.00022439232828198017, 'epochs': 337, 'loss': 'mae', 'optimizer': 'adam', 'graph_mode': 'off', 'use_snp_selection': True, 'num_snps': 15762}. Best is trial 81 with value: 0.3134854573083974.
[I 2025-12-05 17:15:19,352] Trial 130 finished with value: 0.30686134972205925 and parameters: {'model_type': 'mlp', 'hidden_dims': '[512, 64]', 'dropout': 0.42051898148982036, 'batch_norm': False, 'lr': 1.5712788158779142e-05, 'weight_decay': 0.00018472326947026443, 'epochs': 303, 'loss': 'mae', 'optimizer': 'adam', 'graph_mode': 'off', 'use_snp_selection': True, 'num_snps': 49392}. Best is trial 81 with value: 0.3134854573083974.
[I 2025-12-05 17:16:38,530] Trial 131 finished with value: 0.3136408675838745 and parameters: {'model_type': 'mlp', 'hidden_dims': '[512, 64]', 'dropout': 0.2409095357869519, 'batch_norm': False, 'lr': 5.764840412691134e-06, 'weight_decay': 0.000344335041995732, 'epochs': 284, 'loss': 'mae', 'optimizer': 'adam', 'graph_mode': 'off', 'use_snp_selection': True, 'num_snps': 54357}. Best is trial 131 with value: 0.3136408675838745.
[I 2025-12-05 17:17:57,490] Trial 132 finished with value: 0.31119023337152696 and parameters: {'model_type': 'mlp', 'hidden_dims': '[512, 64]', 'dropout': 0.24249946506599313, 'batch_norm': False, 'lr': 6.048928933969388e-06, 'weight_decay': 0.0004200581652045349, 'epochs': 283, 'loss': 'mae', 'optimizer': 'adam', 'graph_mode': 'off', 'use_snp_selection': True, 'num_snps': 54273}. Best is trial 131 with value: 0.3136408675838745.
[I 2025-12-05 17:19:12,061] Trial 133 finished with value: 0.31175377121477077 and parameters: {'model_type': 'mlp', 'hidden_dims': '[512, 64]', 'dropout': 0.25482198649995946, 'batch_norm': False, 'lr': 4.970596414082629e-06, 'weight_decay': 0.00031762320936931855, 'epochs': 276, 'loss': 'mae', 'optimizer': 'adam', 'graph_mode': 'off', 'use_snp_selection': True, 'num_snps': 50795}. Best is trial 131 with value: 0.3136408675838745.
[I 2025-12-05 17:20:35,375] Trial 134 finished with value: 0.31369914368772533 and parameters: {'model_type': 'mlp', 'hidden_dims': '[512, 256]', 'dropout': 0.26927451749656955, 'batch_norm': False, 'lr': 4.384434534322914e-06, 'weight_decay': 9.407591848712828e-05, 'epochs': 293, 'loss': 'mae', 'optimizer': 'adam', 'graph_mode': 'off', 'use_snp_selection': True, 'num_snps': 56090}. Best is trial 134 with value: 0.31369914368772533.
[I 2025-12-05 17:22:06,494] Trial 135 finished with value: 0.31332142749063085 and parameters: {'model_type': 'mlp', 'hidden_dims': '[512, 256]', 'dropout': 0.28672561159500604, 'batch_norm': False, 'lr': 4.301112057420805e-06, 'weight_decay': 0.00010125523371957565, 'epochs': 344, 'loss': 'mae', 'optimizer': 'adam', 'graph_mode': 'off', 'use_snp_selection': True, 'num_snps': 56176}. Best is trial 134 with value: 0.31369914368772533.
[I 2025-12-05 17:23:38,516] Trial 136 finished with value: 0.3127848921077322 and parameters: {'model_type': 'mlp', 'hidden_dims': '[512, 256]', 'dropout': 0.2793626130664836, 'batch_norm': False, 'lr': 3.066146503086325e-06, 'weight_decay': 2.9814917144752655e-06, 'epochs': 345, 'loss': 'mae', 'optimizer': 'adam', 'graph_mode': 'off', 'use_snp_selection': True, 'num_snps': 56712}. Best is trial 134 with value: 0.31369914368772533.
[I 2025-12-05 17:25:08,395] Trial 137 finished with value: 0.3103039497363504 and parameters: {'model_type': 'mlp', 'hidden_dims': '[512, 256]', 'dropout': 0.3031828133322992, 'batch_norm': False, 'lr': 2.494389914884013e-06, 'weight_decay': 2.509314108399619e-06, 'epochs': 321, 'loss': 'mae', 'optimizer': 'adam', 'graph_mode': 'off', 'use_snp_selection': True, 'num_snps': 58668}. Best is trial 134 with value: 0.31369914368772533.
[I 2025-12-05 17:26:32,530] Trial 138 finished with value: 0.30694616151362725 and parameters: {'model_type': 'mlp', 'hidden_dims': '[512, 256]', 'dropout': 0.28628019684042844, 'batch_norm': False, 'lr': 2.8607008599766415e-06, 'weight_decay': 5.0435069969048045e-06, 'epochs': 294, 'loss': 'mse', 'optimizer': 'adam', 'graph_mode': 'off', 'use_snp_selection': True, 'num_snps': 56703}. Best is trial 134 with value: 0.31369914368772533.
[I 2025-12-05 17:27:50,699] Trial 139 finished with value: 0.307677476734755 and parameters: {'model_type': 'mlp', 'hidden_dims': '[512, 256]', 'dropout': 0.2730692800234131, 'batch_norm': False, 'lr': 3.772744848846581e-06, 'weight_decay': 6.297739116834137e-07, 'epochs': 260, 'loss': 'mae', 'optimizer': 'adam', 'graph_mode': 'off', 'use_snp_selection': True, 'num_snps': 56152}. Best is trial 134 with value: 0.31369914368772533.
[I 2025-12-05 17:28:56,172] Trial 140 finished with value: 0.3149820521457113 and parameters: {'model_type': 'mlp', 'hidden_dims': '[512, 256]', 'dropout': 0.3204727319050529, 'batch_norm': False, 'lr': 3.0600327899433937e-06, 'weight_decay': 3.118255515377083e-06, 'epochs': 345, 'loss': 'mae', 'optimizer': 'adam', 'graph_mode': 'off', 'use_snp_selection': False}. Best is trial 140 with value: 0.3149820521457113.
[I 2025-12-05 17:30:02,134] Trial 141 finished with value: 0.30915526410973604 and parameters: {'model_type': 'mlp', 'hidden_dims': '[512, 256]', 'dropout': 0.3221008553661173, 'batch_norm': False, 'lr': 3.1418703907304146e-06, 'weight_decay': 2.357875002081194e-06, 'epochs': 346, 'loss': 'mae', 'optimizer': 'adam', 'graph_mode': 'off', 'use_snp_selection': False}. Best is trial 140 with value: 0.3149820521457113.
[I 2025-12-05 17:31:05,218] Trial 142 finished with value: 0.3072106495531922 and parameters: {'model_type': 'mlp', 'hidden_dims': '[512, 256]', 'dropout': 0.3114114675332472, 'batch_norm': False, 'lr': 1.9897593146646244e-06, 'weight_decay': 1.2639522148015486e-05, 'epochs': 330, 'loss': 'mae', 'optimizer': 'adam', 'graph_mode': 'off', 'use_snp_selection': False}. Best is trial 140 with value: 0.3149820521457113.
[I 2025-12-05 17:32:09,899] Trial 143 finished with value: 0.30922476134562615 and parameters: {'model_type': 'mlp', 'hidden_dims': '[512, 256]', 'dropout': 0.2813731039106743, 'batch_norm': False, 'lr': 3.456420287737197e-06, 'weight_decay': 3.4243541364842113e-06, 'epochs': 339, 'loss': 'mae', 'optimizer': 'adam', 'graph_mode': 'off', 'use_snp_selection': False}. Best is trial 140 with value: 0.3149820521457113.
[I 2025-12-05 17:33:16,515] Trial 144 finished with value: 0.3069758131816472 and parameters: {'model_type': 'mlp', 'hidden_dims': '[512, 256]', 'dropout': 0.29993029133595817, 'batch_norm': False, 'lr': 4.4702891620004545e-06, 'weight_decay': 3.7759957921748826e-06, 'epochs': 350, 'loss': 'mae', 'optimizer': 'adam', 'graph_mode': 'off', 'use_snp_selection': False}. Best is trial 140 with value: 0.3149820521457113.
[I 2025-12-05 17:34:18,725] Trial 145 finished with value: 0.31113401993408507 and parameters: {'model_type': 'mlp', 'hidden_dims': '[512, 256]', 'dropout': 0.3434658555974756, 'batch_norm': False, 'lr': 2.5026188992964946e-06, 'weight_decay': 1.3915119482147399e-06, 'epochs': 325, 'loss': 'mae', 'optimizer': 'adam', 'graph_mode': 'off', 'use_snp_selection': False}. Best is trial 140 with value: 0.3149820521457113.
[I 2025-12-05 17:35:46,300] Trial 146 finished with value: 0.31615250030285846 and parameters: {'model_type': 'mlp', 'hidden_dims': '[512, 256]', 'dropout': 0.23058669639933632, 'batch_norm': False, 'lr': 4.293559348159822e-06, 'weight_decay': 8.600488888872454e-06, 'epochs': 335, 'loss': 'mae', 'optimizer': 'adam', 'graph_mode': 'off', 'use_snp_selection': True, 'num_snps': 54888}. Best is trial 146 with value: 0.31615250030285846.
[I 2025-12-05 17:37:15,542] Trial 147 finished with value: 0.31042602354804505 and parameters: {'model_type': 'mlp', 'hidden_dims': '[512, 256]', 'dropout': 0.227064976171629, 'batch_norm': False, 'lr': 4.029456168026018e-06, 'weight_decay': 1.8323391065052789e-06, 'epochs': 306, 'loss': 'mae', 'optimizer': 'adam', 'graph_mode': 'off', 'use_snp_selection': True, 'num_snps': 59612}. Best is trial 146 with value: 0.31615250030285846.
[I 2025-12-05 17:38:43,290] Trial 148 finished with value: 0.312764041166531 and parameters: {'model_type': 'mlp', 'hidden_dims': '[512, 256]', 'dropout': 0.2510681540585644, 'batch_norm': False, 'lr': 2.9699306256713953e-06, 'weight_decay': 1.6126819305473008e-05, 'epochs': 314, 'loss': 'mae', 'optimizer': 'adam', 'graph_mode': 'off', 'use_snp_selection': True, 'num_snps': 57580}. Best is trial 146 with value: 0.31615250030285846.
[I 2025-12-05 17:40:11,388] Trial 149 finished with value: 0.2828338659938705 and parameters: {'model_type': 'mlp', 'hidden_dims': '[512, 256]', 'dropout': 0.23510689040197424, 'batch_norm': True, 'lr': 2.952918676734881e-06, 'weight_decay': 6.0446939153462755e-06, 'epochs': 311, 'loss': 'mae', 'optimizer': 'adam', 'graph_mode': 'off', 'use_snp_selection': True, 'num_snps': 58166}. Best is trial 146 with value: 0.31615250030285846.
[I 2025-12-05 17:41:17,650] Trial 0 finished with value: 0.2551946078458716 and parameters: {'model_type': 'mlp', 'hidden_dims': '[128, 64]', 'dropout': 0.199031432379812, 'batch_norm': True, 'lr': 1.8408544111075837e-06, 'weight_decay': 5.5136510071208614e-05, 'epochs': 336, 'loss': 'mae', 'optimizer': 'adam', 'graph_mode': 'off', 'use_snp_selection': True, 'num_snps': 43862}. Best is trial 0 with value: 0.2551946078458716.
