Running from this directory: /cluster/work/simennes/Project_thesis/Project_thesis
Name of job: mlp_t
ID of job: 23690569
The job was run on these nodes: idun-07-04
[I 2025-12-05 14:24:08,960] Trial 0 finished with value: 0.15209856237721908 and parameters: {'model_type': 'mlp', 'hidden_dims': '[128, 64]', 'dropout': 0.199031432379812, 'batch_norm': True, 'lr': 1.8408544111075837e-06, 'weight_decay': 5.5136510071208614e-05, 'epochs': 336, 'loss': 'mae', 'optimizer': 'adam', 'graph_mode': 'off', 'use_snp_selection': True, 'num_snps': 43862}. Best is trial 0 with value: 0.15209856237721908.
[I 2025-12-05 14:24:49,970] Trial 1 finished with value: 0.2360684016108749 and parameters: {'model_type': 'mlp', 'hidden_dims': '[256, 128]', 'dropout': 0.4370668075331726, 'batch_norm': True, 'lr': 7.133471581159139e-05, 'weight_decay': 1.128633586803549e-05, 'epochs': 242, 'loss': 'mae', 'optimizer': 'adam', 'graph_mode': 'off', 'use_snp_selection': False}. Best is trial 1 with value: 0.2360684016108749.
[I 2025-12-05 14:25:27,805] Trial 2 finished with value: 0.2215794918374765 and parameters: {'model_type': 'mlp', 'hidden_dims': '[256, 128, 64]', 'dropout': 0.41314357415569625, 'batch_norm': False, 'lr': 3.952233718592101e-06, 'weight_decay': 0.00026754769258252603, 'epochs': 149, 'loss': 'mse', 'optimizer': 'adam', 'graph_mode': 'off', 'use_snp_selection': True, 'num_snps': 11571}. Best is trial 1 with value: 0.2360684016108749.
[I 2025-12-05 14:27:04,028] Trial 3 finished with value: 0.26933697694847636 and parameters: {'model_type': 'mlp', 'hidden_dims': '[512, 64]', 'dropout': 0.5938127374509361, 'batch_norm': False, 'lr': 5.67704586114731e-06, 'weight_decay': 2.4518087630137052e-05, 'epochs': 320, 'loss': 'mae', 'optimizer': 'adam', 'graph_mode': 'off', 'use_snp_selection': False}. Best is trial 3 with value: 0.26933697694847636.
[I 2025-12-05 14:28:31,217] Trial 4 finished with value: 0.13501350662764477 and parameters: {'model_type': 'mlp', 'hidden_dims': '[512, 128]', 'dropout': 0.25746343592134413, 'batch_norm': True, 'lr': 1.3467657668402788e-06, 'weight_decay': 0.00033087251918647806, 'epochs': 277, 'loss': 'mse', 'optimizer': 'adam', 'graph_mode': 'off', 'use_snp_selection': True, 'num_snps': 36675}. Best is trial 3 with value: 0.26933697694847636.
[I 2025-12-05 14:29:32,284] Trial 5 finished with value: 0.15237067957117076 and parameters: {'model_type': 'mlp', 'hidden_dims': '[512, 64]', 'dropout': 0.38275350994408375, 'batch_norm': True, 'lr': 1.5586664309232824e-06, 'weight_decay': 0.0008227664668621182, 'epochs': 145, 'loss': 'mae', 'optimizer': 'adam', 'graph_mode': 'off', 'use_snp_selection': True, 'num_snps': 32148}. Best is trial 3 with value: 0.26933697694847636.
[I 2025-12-05 14:30:06,319] Trial 6 finished with value: 0.2355954530579199 and parameters: {'model_type': 'mlp', 'hidden_dims': '[256, 128]', 'dropout': 0.3930109900265879, 'batch_norm': False, 'lr': 4.892964372128395e-05, 'weight_decay': 1.5809549317992182e-06, 'epochs': 199, 'loss': 'mse', 'optimizer': 'adam', 'graph_mode': 'off', 'use_snp_selection': False}. Best is trial 3 with value: 0.26933697694847636.
[I 2025-12-05 14:30:41,418] Trial 7 finished with value: 0.24153770721087753 and parameters: {'model_type': 'mlp', 'hidden_dims': '[512, 256]', 'dropout': 0.15343979219678458, 'batch_norm': True, 'lr': 6.234003099047341e-05, 'weight_decay': 3.894760610535477e-07, 'epochs': 97, 'loss': 'mse', 'optimizer': 'adam', 'graph_mode': 'off', 'use_snp_selection': False}. Best is trial 3 with value: 0.26933697694847636.
[I 2025-12-05 14:32:17,591] Trial 8 finished with value: 0.24418849046724814 and parameters: {'model_type': 'mlp', 'hidden_dims': '[512, 128]', 'dropout': 0.10743001231661406, 'batch_norm': True, 'lr': 0.00023728538449271062, 'weight_decay': 1.7629071578048637e-05, 'epochs': 312, 'loss': 'mae', 'optimizer': 'adam', 'graph_mode': 'off', 'use_snp_selection': False}. Best is trial 3 with value: 0.26933697694847636.
[I 2025-12-05 14:33:14,918] Trial 9 finished with value: 0.24007857002103808 and parameters: {'model_type': 'mlp', 'hidden_dims': '[512, 64]', 'dropout': 0.14505336736221927, 'batch_norm': True, 'lr': 5.8619638388111826e-05, 'weight_decay': 6.200156172669308e-07, 'epochs': 175, 'loss': 'mse', 'optimizer': 'adam', 'graph_mode': 'off', 'use_snp_selection': False}. Best is trial 3 with value: 0.26933697694847636.
[I 2025-12-05 14:33:37,967] Trial 10 finished with value: 0.2718261143261549 and parameters: {'model_type': 'mlp', 'hidden_dims': '[512, 64]', 'dropout': 0.5885461262002587, 'batch_norm': False, 'lr': 8.769366258768696e-06, 'weight_decay': 2.78273193871783e-06, 'epochs': 55, 'loss': 'mae', 'optimizer': 'adam', 'graph_mode': 'off', 'use_snp_selection': False}. Best is trial 10 with value: 0.2718261143261549.
[I 2025-12-05 14:34:07,076] Trial 11 finished with value: 0.26827551239507896 and parameters: {'model_type': 'mlp', 'hidden_dims': '[512, 64]', 'dropout': 0.583942291816117, 'batch_norm': False, 'lr': 1.1821335968986158e-05, 'weight_decay': 4.061640528568547e-06, 'epochs': 77, 'loss': 'mae', 'optimizer': 'adam', 'graph_mode': 'off', 'use_snp_selection': False}. Best is trial 10 with value: 0.2718261143261549.
[I 2025-12-05 14:34:25,931] Trial 12 finished with value: 0.2372643448355094 and parameters: {'model_type': 'mlp', 'hidden_dims': '[512, 64]', 'dropout': 0.593097749012682, 'batch_norm': False, 'lr': 9.73724436814812e-06, 'weight_decay': 1.3081036432574914e-07, 'epochs': 40, 'loss': 'mae', 'optimizer': 'adam', 'graph_mode': 'off', 'use_snp_selection': False}. Best is trial 10 with value: 0.2718261143261549.
[I 2025-12-05 14:35:39,752] Trial 13 finished with value: 0.258859155061525 and parameters: {'model_type': 'mlp', 'hidden_dims': '[512, 64]', 'dropout': 0.5043641748401543, 'batch_norm': False, 'lr': 1.139383629587953e-05, 'weight_decay': 4.373608364627903e-05, 'epochs': 237, 'loss': 'mae', 'optimizer': 'adam', 'graph_mode': 'off', 'use_snp_selection': False}. Best is trial 10 with value: 0.2718261143261549.
[I 2025-12-05 14:36:06,609] Trial 14 finished with value: 0.26204450011614255 and parameters: {'model_type': 'mlp', 'hidden_dims': '[128, 64]', 'dropout': 0.5300180653494536, 'batch_norm': False, 'lr': 5.096356034191146e-06, 'weight_decay': 3.5346420493229508e-06, 'epochs': 287, 'loss': 'mae', 'optimizer': 'adam', 'graph_mode': 'off', 'use_snp_selection': False}. Best is trial 10 with value: 0.2718261143261549.
[I 2025-12-05 14:36:44,852] Trial 15 finished with value: 0.25015546708522507 and parameters: {'model_type': 'mlp', 'hidden_dims': '[512, 256]', 'dropout': 0.29817671914947536, 'batch_norm': False, 'lr': 2.112268730609403e-05, 'weight_decay': 5.343087596659364e-05, 'epochs': 110, 'loss': 'mae', 'optimizer': 'adam', 'graph_mode': 'off', 'use_snp_selection': False}. Best is trial 10 with value: 0.2718261143261549.
[I 2025-12-05 14:37:40,296] Trial 16 finished with value: 0.25349167757057767 and parameters: {'model_type': 'mlp', 'hidden_dims': '[256, 128, 64]', 'dropout': 0.49887409780975667, 'batch_norm': False, 'lr': 0.00017549215405955411, 'weight_decay': 2.66242976641068e-06, 'epochs': 350, 'loss': 'mae', 'optimizer': 'adam', 'graph_mode': 'off', 'use_snp_selection': False}. Best is trial 10 with value: 0.2718261143261549.
[I 2025-12-05 14:38:47,897] Trial 17 finished with value: 0.1082077088324487 and parameters: {'model_type': 'mlp', 'hidden_dims': '[512, 64]', 'dropout': 0.46956397995943144, 'batch_norm': False, 'lr': 0.000906375209920231, 'weight_decay': 2.0204960671781686e-05, 'epochs': 219, 'loss': 'mae', 'optimizer': 'adam', 'graph_mode': 'off', 'use_snp_selection': False}. Best is trial 10 with value: 0.2718261143261549.
[I 2025-12-05 14:40:44,116] Trial 18 finished with value: 0.25588363953969134 and parameters: {'model_type': 'mlp', 'hidden_dims': '[512, 64]', 'dropout': 0.5468831937008775, 'batch_norm': False, 'lr': 5.4850663591507836e-06, 'weight_decay': 7.489058431436532e-07, 'epochs': 261, 'loss': 'mae', 'optimizer': 'adam', 'graph_mode': 'off', 'use_snp_selection': True, 'num_snps': 58241}. Best is trial 10 with value: 0.2718261143261549.
[I 2025-12-05 14:41:05,079] Trial 19 finished with value: 0.20499344220289975 and parameters: {'model_type': 'mlp', 'hidden_dims': '[512, 64]', 'dropout': 0.3166616674880815, 'batch_norm': False, 'lr': 2.7960991179492955e-06, 'weight_decay': 7.0921580813814515e-06, 'epochs': 48, 'loss': 'mae', 'optimizer': 'adam', 'graph_mode': 'off', 'use_snp_selection': False}. Best is trial 10 with value: 0.2718261143261549.
[I 2025-12-05 14:41:49,802] Trial 20 finished with value: 0.2643861213675406 and parameters: {'model_type': 'mlp', 'hidden_dims': '[512, 128]', 'dropout': 0.5575420017847416, 'batch_norm': False, 'lr': 2.3361432915417936e-05, 'weight_decay': 0.00015711537877451736, 'epochs': 135, 'loss': 'mae', 'optimizer': 'adam', 'graph_mode': 'off', 'use_snp_selection': False}. Best is trial 10 with value: 0.2718261143261549.
[I 2025-12-05 14:42:22,462] Trial 21 finished with value: 0.2551772791498369 and parameters: {'model_type': 'mlp', 'hidden_dims': '[512, 64]', 'dropout': 0.5801943431504863, 'batch_norm': False, 'lr': 9.239240239969327e-06, 'weight_decay': 5.061469485056187e-06, 'epochs': 90, 'loss': 'mae', 'optimizer': 'adam', 'graph_mode': 'off', 'use_snp_selection': False}. Best is trial 10 with value: 0.2718261143261549.
[I 2025-12-05 14:42:53,271] Trial 22 finished with value: 0.25254675234275553 and parameters: {'model_type': 'mlp', 'hidden_dims': '[512, 64]', 'dropout': 0.5954392114625428, 'batch_norm': False, 'lr': 1.612247667023162e-05, 'weight_decay': 1.5577301059134687e-06, 'epochs': 84, 'loss': 'mae', 'optimizer': 'adam', 'graph_mode': 'off', 'use_snp_selection': False}. Best is trial 10 with value: 0.2718261143261549.
[I 2025-12-05 14:43:19,027] Trial 23 finished with value: 0.25749563201792736 and parameters: {'model_type': 'mlp', 'hidden_dims': '[512, 64]', 'dropout': 0.4661242614137625, 'batch_norm': False, 'lr': 6.3124350372302285e-06, 'weight_decay': 1.0488901139924964e-05, 'epochs': 65, 'loss': 'mae', 'optimizer': 'adam', 'graph_mode': 'off', 'use_snp_selection': False}. Best is trial 10 with value: 0.2718261143261549.
[I 2025-12-05 14:44:00,180] Trial 24 finished with value: 0.26324191365887856 and parameters: {'model_type': 'mlp', 'hidden_dims': '[512, 64]', 'dropout': 0.5216695780334031, 'batch_norm': False, 'lr': 2.7013005792357815e-05, 'weight_decay': 2.6365778716808287e-05, 'epochs': 122, 'loss': 'mae', 'optimizer': 'adam', 'graph_mode': 'off', 'use_snp_selection': False}. Best is trial 10 with value: 0.2718261143261549.
[I 2025-12-05 14:44:54,232] Trial 25 finished with value: 0.25040751023318103 and parameters: {'model_type': 'mlp', 'hidden_dims': '[512, 256]', 'dropout': 0.5583647361469108, 'batch_norm': False, 'lr': 2.8647442901983927e-06, 'weight_decay': 1.98101369371317e-06, 'epochs': 165, 'loss': 'mae', 'optimizer': 'adam', 'graph_mode': 'off', 'use_snp_selection': False}. Best is trial 10 with value: 0.2718261143261549.
[I 2025-12-05 14:45:25,539] Trial 26 finished with value: 0.18763927719537948 and parameters: {'model_type': 'mlp', 'hidden_dims': '[256, 128]', 'dropout': 0.4701260204320745, 'batch_norm': False, 'lr': 1.3724514093739104e-05, 'weight_decay': 9.516657810025634e-05, 'epochs': 76, 'loss': 'mse', 'optimizer': 'adam', 'graph_mode': 'off', 'use_snp_selection': True, 'num_snps': 3842}. Best is trial 10 with value: 0.2718261143261549.
[I 2025-12-05 14:45:45,781] Trial 27 finished with value: 0.2435621292148101 and parameters: {'model_type': 'mlp', 'hidden_dims': '[128, 64]', 'dropout': 0.5916123333422963, 'batch_norm': False, 'lr': 7.217485159930573e-06, 'weight_decay': 1.7324982408186623e-07, 'epochs': 199, 'loss': 'mae', 'optimizer': 'adam', 'graph_mode': 'off', 'use_snp_selection': False}. Best is trial 10 with value: 0.2718261143261549.
[I 2025-12-05 14:46:01,861] Trial 28 finished with value: 0.19644424463986493 and parameters: {'model_type': 'mlp', 'hidden_dims': '[256, 128, 64]', 'dropout': 0.49952892294358076, 'batch_norm': False, 'lr': 3.3207113804230235e-06, 'weight_decay': 5.068235496355108e-06, 'epochs': 67, 'loss': 'mae', 'optimizer': 'adam', 'graph_mode': 'off', 'use_snp_selection': False}. Best is trial 10 with value: 0.2718261143261549.
[I 2025-12-05 14:46:40,846] Trial 29 finished with value: 0.2406789605399667 and parameters: {'model_type': 'mlp', 'hidden_dims': '[128, 64]', 'dropout': 0.3467572556454796, 'batch_norm': False, 'lr': 2.2329990928910513e-06, 'weight_decay': 9.696673610073384e-07, 'epochs': 117, 'loss': 'mae', 'optimizer': 'adam', 'graph_mode': 'off', 'use_snp_selection': True, 'num_snps': 19468}. Best is trial 10 with value: 0.2718261143261549.
[I 2025-12-05 14:48:14,237] Trial 30 finished with value: 0.24935854297398982 and parameters: {'model_type': 'mlp', 'hidden_dims': '[512, 64]', 'dropout': 0.2523135802350327, 'batch_norm': False, 'lr': 0.000112625852689709, 'weight_decay': 3.305888672576384e-07, 'epochs': 315, 'loss': 'mae', 'optimizer': 'adam', 'graph_mode': 'off', 'use_snp_selection': False}. Best is trial 10 with value: 0.2718261143261549.
[I 2025-12-05 14:48:58,629] Trial 31 finished with value: 0.26670512474878644 and parameters: {'model_type': 'mlp', 'hidden_dims': '[512, 128]', 'dropout': 0.5560020289805757, 'batch_norm': False, 'lr': 3.3887151354418794e-05, 'weight_decay': 0.00012696008530175065, 'epochs': 134, 'loss': 'mae', 'optimizer': 'adam', 'graph_mode': 'off', 'use_snp_selection': False}. Best is trial 10 with value: 0.2718261143261549.
[I 2025-12-05 14:49:22,754] Trial 32 finished with value: 0.2563700475211844 and parameters: {'model_type': 'mlp', 'hidden_dims': '[512, 128]', 'dropout': 0.5565856153736186, 'batch_norm': False, 'lr': 3.070309842783583e-05, 'weight_decay': 9.803658821803803e-05, 'epochs': 60, 'loss': 'mae', 'optimizer': 'adam', 'graph_mode': 'off', 'use_snp_selection': False}. Best is trial 10 with value: 0.2718261143261549.
[I 2025-12-05 14:49:57,455] Trial 33 finished with value: 0.2635647940850693 and parameters: {'model_type': 'mlp', 'hidden_dims': '[512, 128]', 'dropout': 0.5341520902094788, 'batch_norm': False, 'lr': 3.6186501856133685e-05, 'weight_decay': 2.787145882784307e-05, 'epochs': 98, 'loss': 'mae', 'optimizer': 'adam', 'graph_mode': 'off', 'use_snp_selection': False}. Best is trial 10 with value: 0.2718261143261549.
[I 2025-12-05 14:50:51,069] Trial 34 finished with value: 0.2281279376999618 and parameters: {'model_type': 'mlp', 'hidden_dims': '[512, 128]', 'dropout': 0.4343611070373393, 'batch_norm': True, 'lr': 1.799788372814633e-05, 'weight_decay': 1.2830367221195114e-05, 'epochs': 162, 'loss': 'mae', 'optimizer': 'adam', 'graph_mode': 'off', 'use_snp_selection': False}. Best is trial 10 with value: 0.2718261143261549.
[I 2025-12-05 14:52:05,363] Trial 35 finished with value: 0.2593206914457638 and parameters: {'model_type': 'mlp', 'hidden_dims': '[256, 128]', 'dropout': 0.5712475214200545, 'batch_norm': False, 'lr': 4.552446851669065e-06, 'weight_decay': 0.0004610441174617924, 'epochs': 184, 'loss': 'mse', 'optimizer': 'adam', 'graph_mode': 'off', 'use_snp_selection': True, 'num_snps': 57586}. Best is trial 10 with value: 0.2718261143261549.
[I 2025-12-05 14:52:50,208] Trial 36 finished with value: 0.19277806497861555 and parameters: {'model_type': 'mlp', 'hidden_dims': '[512, 128]', 'dropout': 0.598500114156592, 'batch_norm': False, 'lr': 1.2846759529805668e-06, 'weight_decay': 0.00021177701230566575, 'epochs': 134, 'loss': 'mae', 'optimizer': 'adam', 'graph_mode': 'off', 'use_snp_selection': False}. Best is trial 10 with value: 0.2718261143261549.
[I 2025-12-05 14:53:33,601] Trial 37 finished with value: 0.23914282350670152 and parameters: {'model_type': 'mlp', 'hidden_dims': '[256, 128, 64]', 'dropout': 0.5209124582322433, 'batch_norm': True, 'lr': 0.00010103487407549232, 'weight_decay': 9.096918760018813e-05, 'epochs': 109, 'loss': 'mse', 'optimizer': 'adam', 'graph_mode': 'off', 'use_snp_selection': True, 'num_snps': 22282}. Best is trial 10 with value: 0.2718261143261549.
[I 2025-12-05 14:54:40,343] Trial 38 finished with value: 0.2580007161874047 and parameters: {'model_type': 'mlp', 'hidden_dims': '[512, 64]', 'dropout': 0.41808897534963263, 'batch_norm': False, 'lr': 4.225742179310148e-05, 'weight_decay': 0.00046644832351108945, 'epochs': 217, 'loss': 'mae', 'optimizer': 'adam', 'graph_mode': 'off', 'use_snp_selection': False}. Best is trial 10 with value: 0.2718261143261549.
[I 2025-12-05 14:55:30,959] Trial 39 finished with value: 0.22983769728773193 and parameters: {'model_type': 'mlp', 'hidden_dims': '[512, 256]', 'dropout': 0.4844313230893421, 'batch_norm': True, 'lr': 8.119374590000267e-06, 'weight_decay': 7.292174767457787e-06, 'epochs': 151, 'loss': 'mae', 'optimizer': 'adam', 'graph_mode': 'off', 'use_snp_selection': False}. Best is trial 10 with value: 0.2718261143261549.
[I 2025-12-05 14:55:45,218] Trial 40 finished with value: 0.2475608455353669 and parameters: {'model_type': 'mlp', 'hidden_dims': '[256, 128]', 'dropout': 0.5701381222610548, 'batch_norm': False, 'lr': 1.3614011775068937e-05, 'weight_decay': 3.554480512294832e-05, 'epochs': 54, 'loss': 'mse', 'optimizer': 'adam', 'graph_mode': 'off', 'use_snp_selection': False}. Best is trial 10 with value: 0.2718261143261549.
[I 2025-12-05 14:56:16,667] Trial 41 finished with value: 0.2660224811001045 and parameters: {'model_type': 'mlp', 'hidden_dims': '[512, 128]', 'dropout': 0.5487825026737904, 'batch_norm': False, 'lr': 2.037113485620341e-05, 'weight_decay': 0.00016807320533150001, 'epochs': 86, 'loss': 'mae', 'optimizer': 'adam', 'graph_mode': 'off', 'use_snp_selection': False}. Best is trial 10 with value: 0.2718261143261549.
[I 2025-12-05 14:56:48,922] Trial 42 finished with value: 0.26907120466334583 and parameters: {'model_type': 'mlp', 'hidden_dims': '[512, 128]', 'dropout': 0.5315254568395268, 'batch_norm': False, 'lr': 1.1929455306263871e-05, 'weight_decay': 0.0007235013078712196, 'epochs': 88, 'loss': 'mae', 'optimizer': 'adam', 'graph_mode': 'off', 'use_snp_selection': False}. Best is trial 10 with value: 0.2718261143261549.
[I 2025-12-05 14:57:25,046] Trial 43 finished with value: 0.26825265082885696 and parameters: {'model_type': 'mlp', 'hidden_dims': '[512, 128]', 'dropout': 0.5273044995438104, 'batch_norm': False, 'lr': 1.1461888603872341e-05, 'weight_decay': 0.0009468832263459871, 'epochs': 102, 'loss': 'mae', 'optimizer': 'adam', 'graph_mode': 'off', 'use_snp_selection': False}. Best is trial 10 with value: 0.2718261143261549.
[I 2025-12-05 14:58:00,974] Trial 44 finished with value: 0.2631749173092842 and parameters: {'model_type': 'mlp', 'hidden_dims': '[512, 128]', 'dropout': 0.5177670531928474, 'batch_norm': False, 'lr': 1.0308016848885407e-05, 'weight_decay': 0.0009099317984008603, 'epochs': 101, 'loss': 'mae', 'optimizer': 'adam', 'graph_mode': 'off', 'use_snp_selection': False}. Best is trial 10 with value: 0.2718261143261549.
[I 2025-12-05 14:58:20,073] Trial 45 finished with value: 0.14998549392692073 and parameters: {'model_type': 'mlp', 'hidden_dims': '[512, 64]', 'dropout': 0.4484271953162941, 'batch_norm': True, 'lr': 3.823859446423282e-06, 'weight_decay': 0.0003485845942193724, 'epochs': 40, 'loss': 'mae', 'optimizer': 'adam', 'graph_mode': 'off', 'use_snp_selection': False}. Best is trial 10 with value: 0.2718261143261549.
[I 2025-12-05 14:58:49,272] Trial 46 finished with value: 0.26944434603512724 and parameters: {'model_type': 'mlp', 'hidden_dims': '[512, 128]', 'dropout': 0.5794600660609713, 'batch_norm': False, 'lr': 1.1107064715056602e-05, 'weight_decay': 0.000803458938182039, 'epochs': 77, 'loss': 'mae', 'optimizer': 'adam', 'graph_mode': 'off', 'use_snp_selection': False}. Best is trial 10 with value: 0.2718261143261549.
[I 2025-12-05 14:59:17,913] Trial 47 finished with value: 0.24483680142100495 and parameters: {'model_type': 'mlp', 'hidden_dims': '[512, 64]', 'dropout': 0.5764429466812734, 'batch_norm': False, 'lr': 6.133259927909668e-06, 'weight_decay': 0.00047953637106045837, 'epochs': 75, 'loss': 'mae', 'optimizer': 'adam', 'graph_mode': 'off', 'use_snp_selection': False}. Best is trial 10 with value: 0.2718261143261549.
[I 2025-12-05 15:00:17,274] Trial 48 finished with value: 0.21194093094203734 and parameters: {'model_type': 'mlp', 'hidden_dims': '[128, 64]', 'dropout': 0.5990120183139114, 'batch_norm': False, 'lr': 1.6621637338238077e-06, 'weight_decay': 3.193273635899892e-06, 'epochs': 276, 'loss': 'mse', 'optimizer': 'adam', 'graph_mode': 'off', 'use_snp_selection': True, 'num_snps': 43224}. Best is trial 10 with value: 0.2718261143261549.
[I 2025-12-05 15:00:45,855] Trial 49 finished with value: 0.19171635222047562 and parameters: {'model_type': 'mlp', 'hidden_dims': '[512, 64]', 'dropout': 0.1853182659628498, 'batch_norm': False, 'lr': 1.0372224037761836e-06, 'weight_decay': 1.0921229426141005e-06, 'epochs': 75, 'loss': 'mae', 'optimizer': 'adam', 'graph_mode': 'off', 'use_snp_selection': False}. Best is trial 10 with value: 0.2718261143261549.
[I 2025-12-05 15:01:37,573] Trial 50 finished with value: 0.18402521921112164 and parameters: {'model_type': 'mlp', 'hidden_dims': '[256, 128, 64]', 'dropout': 0.536146912079092, 'batch_norm': True, 'lr': 4.529404367851309e-06, 'weight_decay': 0.0002804830760028016, 'epochs': 312, 'loss': 'mae', 'optimizer': 'adam', 'graph_mode': 'off', 'use_snp_selection': False}. Best is trial 10 with value: 0.2718261143261549.
[I 2025-12-05 15:01:59,723] Trial 51 finished with value: 0.2595826560386354 and parameters: {'model_type': 'mlp', 'hidden_dims': '[512, 128]', 'dropout': 0.5742981872543943, 'batch_norm': False, 'lr': 1.2448107157480226e-05, 'weight_decay': 0.0005988143608721733, 'epochs': 52, 'loss': 'mae', 'optimizer': 'adam', 'graph_mode': 'off', 'use_snp_selection': False}. Best is trial 10 with value: 0.2718261143261549.
