[I 2025-12-05 16:04:23,834] Trial 52 finished with value: 0.16999126363929476 and parameters: {'model_type': 'mlp', 'hidden_dims': '[512, 128]', 'dropout': 0.1111455322691671, 'batch_norm': True, 'lr': 0.00035991904714791317, 'weight_decay': 2.261424319752468e-06, 'epochs': 301, 'loss': 'mae', 'optimizer': 'adam', 'graph_mode': 'off', 'use_snp_selection': False}. Best is trial 24 with value: 0.17902410124327034.
[I 2025-12-05 16:04:28,761] Trial 53 finished with value: 0.16146285014648828 and parameters: {'model_type': 'mlp', 'hidden_dims': '[512, 128]', 'dropout': 0.10031417204093152, 'batch_norm': True, 'lr': 0.0002910824855898311, 'weight_decay': 0.0007871230623739149, 'epochs': 344, 'loss': 'mae', 'optimizer': 'adam', 'graph_mode': 'off', 'use_snp_selection': False}. Best is trial 24 with value: 0.17902410124327034.
[I 2025-12-05 16:04:31,442] Trial 54 finished with value: 0.16110433853724282 and parameters: {'model_type': 'mlp', 'hidden_dims': '[256, 128, 64]', 'dropout': 0.14060892199789674, 'batch_norm': True, 'lr': 0.000686102795962589, 'weight_decay': 8.763431179482427e-05, 'epochs': 311, 'loss': 'mae', 'optimizer': 'adam', 'graph_mode': 'off', 'use_snp_selection': False}. Best is trial 24 with value: 0.17902410124327034.
[I 2025-12-05 16:04:35,650] Trial 55 finished with value: 0.15911936158457232 and parameters: {'model_type': 'mlp', 'hidden_dims': '[512, 128]', 'dropout': 0.1785699806293843, 'batch_norm': True, 'lr': 0.00015863770194555522, 'weight_decay': 8.661849827549024e-06, 'epochs': 286, 'loss': 'mse', 'optimizer': 'adam', 'graph_mode': 'off', 'use_snp_selection': False}. Best is trial 24 with value: 0.17902410124327034.
[I 2025-12-05 16:04:39,513] Trial 56 finished with value: 0.14824410167184768 and parameters: {'model_type': 'mlp', 'hidden_dims': '[512, 256]', 'dropout': 0.5468233155565247, 'batch_norm': True, 'lr': 0.00012585201398486679, 'weight_decay': 2.8722583350316244e-05, 'epochs': 257, 'loss': 'mae', 'optimizer': 'adam', 'graph_mode': 'off', 'use_snp_selection': False}. Best is trial 24 with value: 0.17902410124327034.
[I 2025-12-05 16:04:41,737] Trial 57 finished with value: 0.006908774085166139 and parameters: {'model_type': 'mlp', 'hidden_dims': '[512, 64]', 'dropout': 0.1516941947967983, 'batch_norm': False, 'lr': 0.0009865258095220527, 'weight_decay': 5.883375301756553e-07, 'epochs': 130, 'loss': 'mae', 'optimizer': 'adam', 'graph_mode': 'off', 'use_snp_selection': False}. Best is trial 24 with value: 0.17902410124327034.
[I 2025-12-05 16:04:46,369] Trial 58 finished with value: 0.15160748990881945 and parameters: {'model_type': 'mlp', 'hidden_dims': '[512, 128]', 'dropout': 0.4018482870806801, 'batch_norm': True, 'lr': 9.71058687308425e-05, 'weight_decay': 4.820216615870959e-06, 'epochs': 320, 'loss': 'mse', 'optimizer': 'adam', 'graph_mode': 'off', 'use_snp_selection': False}. Best is trial 24 with value: 0.17902410124327034.
[I 2025-12-05 16:04:50,739] Trial 59 finished with value: 0.14223345376241336 and parameters: {'model_type': 'mlp', 'hidden_dims': '[512, 128]', 'dropout': 0.13364528095037762, 'batch_norm': True, 'lr': 2.7788997219222257e-05, 'weight_decay': 1.3757578044178245e-05, 'epochs': 299, 'loss': 'mae', 'optimizer': 'adam', 'graph_mode': 'off', 'use_snp_selection': False}. Best is trial 24 with value: 0.17902410124327034.
[I 2025-12-05 16:04:53,205] Trial 60 finished with value: 0.1458674944051832 and parameters: {'model_type': 'mlp', 'hidden_dims': '[256, 128]', 'dropout': 0.1943854775525793, 'batch_norm': True, 'lr': 6.377084762271715e-05, 'weight_decay': 1.1646862583756644e-06, 'epochs': 224, 'loss': 'mae', 'optimizer': 'adam', 'graph_mode': 'off', 'use_snp_selection': True, 'num_snps': 24139}. Best is trial 24 with value: 0.17902410124327034.
[I 2025-12-05 16:04:55,685] Trial 61 finished with value: 0.16394909629678067 and parameters: {'model_type': 'mlp', 'hidden_dims': '[256, 128]', 'dropout': 0.13248035804675315, 'batch_norm': True, 'lr': 0.00020836963495008773, 'weight_decay': 5.437046906344079e-05, 'epochs': 283, 'loss': 'mae', 'optimizer': 'adam', 'graph_mode': 'off', 'use_snp_selection': False}. Best is trial 24 with value: 0.17902410124327034.
[I 2025-12-05 16:04:58,237] Trial 62 finished with value: 0.1629950718656368 and parameters: {'model_type': 'mlp', 'hidden_dims': '[256, 128]', 'dropout': 0.11453748909446768, 'batch_norm': True, 'lr': 0.0001854385117036014, 'weight_decay': 7.530929243879922e-05, 'epochs': 296, 'loss': 'mae', 'optimizer': 'adam', 'graph_mode': 'off', 'use_snp_selection': False}. Best is trial 24 with value: 0.17902410124327034.
[I 2025-12-05 16:05:00,593] Trial 63 finished with value: 0.16491374038656184 and parameters: {'model_type': 'mlp', 'hidden_dims': '[256, 128]', 'dropout': 0.16538293203627227, 'batch_norm': True, 'lr': 0.0003806509048735169, 'weight_decay': 0.00014936689723505086, 'epochs': 267, 'loss': 'mae', 'optimizer': 'adam', 'graph_mode': 'off', 'use_snp_selection': False}. Best is trial 24 with value: 0.17902410124327034.
[I 2025-12-05 16:05:02,174] Trial 64 finished with value: 0.15859479543407326 and parameters: {'model_type': 'mlp', 'hidden_dims': '[128, 64]', 'dropout': 0.131783188567829, 'batch_norm': True, 'lr': 0.00022254856537509487, 'weight_decay': 3.642852030067185e-05, 'epochs': 338, 'loss': 'mae', 'optimizer': 'adam', 'graph_mode': 'off', 'use_snp_selection': False}. Best is trial 24 with value: 0.17902410124327034.
[I 2025-12-05 16:05:04,925] Trial 65 finished with value: 0.15817207272816555 and parameters: {'model_type': 'mlp', 'hidden_dims': '[256, 128]', 'dropout': 0.11464697959790336, 'batch_norm': True, 'lr': 0.00029156093652473147, 'weight_decay': 4.989157126750079e-05, 'epochs': 326, 'loss': 'mae', 'optimizer': 'adam', 'graph_mode': 'off', 'use_snp_selection': False}. Best is trial 24 with value: 0.17902410124327034.
[I 2025-12-05 16:05:09,471] Trial 66 finished with value: 0.1777663745070903 and parameters: {'model_type': 'mlp', 'hidden_dims': '[512, 128]', 'dropout': 0.3681717713752696, 'batch_norm': True, 'lr': 8.804914502908599e-05, 'weight_decay': 0.0002389317605218402, 'epochs': 313, 'loss': 'mse', 'optimizer': 'adam', 'graph_mode': 'off', 'use_snp_selection': False}. Best is trial 24 with value: 0.17902410124327034.
[I 2025-12-05 16:05:12,178] Trial 67 finished with value: 0.1019336878040819 and parameters: {'model_type': 'mlp', 'hidden_dims': '[512, 128]', 'dropout': 0.3439360810465122, 'batch_norm': True, 'lr': 1.038788092140181e-06, 'weight_decay': 0.0003665197405892897, 'epochs': 165, 'loss': 'mse', 'optimizer': 'adam', 'graph_mode': 'off', 'use_snp_selection': False}. Best is trial 24 with value: 0.17902410124327034.
[I 2025-12-05 16:05:15,148] Trial 68 finished with value: 0.14301496950833134 and parameters: {'model_type': 'mlp', 'hidden_dims': '[512, 128]', 'dropout': 0.3326798987697642, 'batch_norm': False, 'lr': 5.299176576163535e-05, 'weight_decay': 0.0002591787421298467, 'epochs': 191, 'loss': 'mse', 'optimizer': 'adam', 'graph_mode': 'off', 'use_snp_selection': False}. Best is trial 24 with value: 0.17902410124327034.
[I 2025-12-05 16:05:17,634] Trial 69 finished with value: 0.13161550339874084 and parameters: {'model_type': 'mlp', 'hidden_dims': '[512, 128]', 'dropout': 0.42243235886509917, 'batch_norm': True, 'lr': 8.772711330573165e-05, 'weight_decay': 3.03411708708235e-06, 'epochs': 147, 'loss': 'mse', 'optimizer': 'adam', 'graph_mode': 'off', 'use_snp_selection': False}. Best is trial 24 with value: 0.17902410124327034.
[I 2025-12-05 16:05:22,201] Trial 70 finished with value: 0.1505115828443057 and parameters: {'model_type': 'mlp', 'hidden_dims': '[512, 64]', 'dropout': 0.3698120714351383, 'batch_norm': True, 'lr': 0.00012561257021392156, 'weight_decay': 8.085809365373969e-07, 'epochs': 315, 'loss': 'mse', 'optimizer': 'adam', 'graph_mode': 'off', 'use_snp_selection': False}. Best is trial 24 with value: 0.17902410124327034.
[I 2025-12-05 16:05:25,062] Trial 71 finished with value: 0.15958652048136257 and parameters: {'model_type': 'mlp', 'hidden_dims': '[512, 128]', 'dropout': 0.3786389316202828, 'batch_norm': True, 'lr': 0.00019219306201430312, 'weight_decay': 0.0002462071065873351, 'epochs': 176, 'loss': 'mse', 'optimizer': 'adam', 'graph_mode': 'off', 'use_snp_selection': False}. Best is trial 24 with value: 0.17902410124327034.
[I 2025-12-05 16:05:27,905] Trial 72 finished with value: 0.16609119255870905 and parameters: {'model_type': 'mlp', 'hidden_dims': '[256, 128, 64]', 'dropout': 0.2997262848338845, 'batch_norm': True, 'lr': 0.0001128902258443663, 'weight_decay': 2.4948668993507542e-05, 'epochs': 334, 'loss': 'mae', 'optimizer': 'adam', 'graph_mode': 'off', 'use_snp_selection': False}. Best is trial 24 with value: 0.17902410124327034.
[I 2025-12-05 16:05:32,376] Trial 73 finished with value: 0.14974277711787656 and parameters: {'model_type': 'mlp', 'hidden_dims': '[512, 128]', 'dropout': 0.46784737758407247, 'batch_norm': True, 'lr': 7.281273500208924e-05, 'weight_decay': 0.0005580284331867094, 'epochs': 307, 'loss': 'mae', 'optimizer': 'adam', 'graph_mode': 'off', 'use_snp_selection': False}. Best is trial 24 with value: 0.17902410124327034.
[I 2025-12-05 16:05:36,618] Trial 74 finished with value: 0.16203018513451525 and parameters: {'model_type': 'mlp', 'hidden_dims': '[512, 128]', 'dropout': 0.14868017484858959, 'batch_norm': True, 'lr': 0.0004238150612571852, 'weight_decay': 0.00017871159778929223, 'epochs': 288, 'loss': 'mse', 'optimizer': 'adam', 'graph_mode': 'off', 'use_snp_selection': False}. Best is trial 24 with value: 0.17902410124327034.
[I 2025-12-05 16:05:38,392] Trial 75 finished with value: 0.07280366197708038 and parameters: {'model_type': 'mlp', 'hidden_dims': '[512, 256]', 'dropout': 0.10642000700152517, 'batch_norm': True, 'lr': 0.00015083703059395466, 'weight_decay': 8.679391333996705e-05, 'epochs': 294, 'loss': 'mae', 'optimizer': 'adam', 'graph_mode': 'off', 'use_snp_selection': True, 'num_snps': 2869}. Best is trial 24 with value: 0.17902410124327034.
[I 2025-12-05 16:05:42,451] Trial 76 finished with value: 0.1601399159654731 and parameters: {'model_type': 'mlp', 'hidden_dims': '[512, 64]', 'dropout': 0.35954190837674066, 'batch_norm': True, 'lr': 0.00029337900284485215, 'weight_decay': 5.417558652111119e-06, 'epochs': 274, 'loss': 'mae', 'optimizer': 'adam', 'graph_mode': 'off', 'use_snp_selection': False}. Best is trial 24 with value: 0.17902410124327034.
[I 2025-12-05 16:05:47,158] Trial 77 finished with value: 0.14054185726741333 and parameters: {'model_type': 'mlp', 'hidden_dims': '[512, 128]', 'dropout': 0.18231254344359965, 'batch_norm': True, 'lr': 4.275872560280519e-05, 'weight_decay': 9.770778328433659e-06, 'epochs': 326, 'loss': 'mse', 'optimizer': 'adam', 'graph_mode': 'off', 'use_snp_selection': False}. Best is trial 24 with value: 0.17902410124327034.
[I 2025-12-05 16:05:52,116] Trial 78 finished with value: 0.10338140583220749 and parameters: {'model_type': 'mlp', 'hidden_dims': '[512, 128]', 'dropout': 0.22367375469254955, 'batch_norm': True, 'lr': 7.970829229306545e-06, 'weight_decay': 3.348258764911005e-07, 'epochs': 346, 'loss': 'mae', 'optimizer': 'adam', 'graph_mode': 'off', 'use_snp_selection': False}. Best is trial 24 with value: 0.17902410124327034.
[I 2025-12-05 16:05:54,675] Trial 79 finished with value: 0.15533235005938584 and parameters: {'model_type': 'mlp', 'hidden_dims': '[256, 128]', 'dropout': 0.13303246810743263, 'batch_norm': False, 'lr': 5.9207197934931816e-05, 'weight_decay': 1.4615368851582399e-07, 'epochs': 306, 'loss': 'mae', 'optimizer': 'adam', 'graph_mode': 'off', 'use_snp_selection': False}. Best is trial 24 with value: 0.17902410124327034.
[I 2025-12-05 16:05:56,039] Trial 80 finished with value: 0.1564257503217727 and parameters: {'model_type': 'mlp', 'hidden_dims': '[128, 64]', 'dropout': 0.16212850286388986, 'batch_norm': True, 'lr': 0.00016485909170253391, 'weight_decay': 1.9103529015295155e-06, 'epochs': 266, 'loss': 'mse', 'optimizer': 'adam', 'graph_mode': 'off', 'use_snp_selection': False}. Best is trial 24 with value: 0.17902410124327034.
[I 2025-12-05 16:06:00,467] Trial 81 finished with value: 0.15607422971765497 and parameters: {'model_type': 'mlp', 'hidden_dims': '[512, 128]', 'dropout': 0.12009981869112257, 'batch_norm': True, 'lr': 0.0002495595996818262, 'weight_decay': 1.7850437620405979e-06, 'epochs': 303, 'loss': 'mae', 'optimizer': 'adam', 'graph_mode': 'off', 'use_snp_selection': False}. Best is trial 24 with value: 0.17902410124327034.
[I 2025-12-05 16:06:05,043] Trial 82 finished with value: 0.1723916126009535 and parameters: {'model_type': 'mlp', 'hidden_dims': '[512, 128]', 'dropout': 0.18968474380483102, 'batch_norm': True, 'lr': 0.00010262265616179187, 'weight_decay': 1.2675450201768094e-06, 'epochs': 315, 'loss': 'mae', 'optimizer': 'adam', 'graph_mode': 'off', 'use_snp_selection': False}. Best is trial 24 with value: 0.17902410124327034.
[I 2025-12-05 16:06:09,630] Trial 83 finished with value: 0.15120436899110498 and parameters: {'model_type': 'mlp', 'hidden_dims': '[512, 128]', 'dropout': 0.14125543540535565, 'batch_norm': True, 'lr': 0.00013455261059285888, 'weight_decay': 6.980596869897686e-06, 'epochs': 316, 'loss': 'mae', 'optimizer': 'adam', 'graph_mode': 'off', 'use_snp_selection': False}. Best is trial 24 with value: 0.17902410124327034.
[I 2025-12-05 16:06:14,429] Trial 84 finished with value: 0.1700842072042844 and parameters: {'model_type': 'mlp', 'hidden_dims': '[512, 128]', 'dropout': 0.10143806212005775, 'batch_norm': True, 'lr': 9.296806621189195e-05, 'weight_decay': 4.148564385645431e-06, 'epochs': 333, 'loss': 'mae', 'optimizer': 'adam', 'graph_mode': 'off', 'use_snp_selection': False}. Best is trial 24 with value: 0.17902410124327034.
[I 2025-12-05 16:06:18,731] Trial 85 finished with value: 0.16647792491110364 and parameters: {'model_type': 'mlp', 'hidden_dims': '[512, 128]', 'dropout': 0.1252816574452657, 'batch_norm': True, 'lr': 7.409141094321788e-05, 'weight_decay': 4.831341918197856e-07, 'epochs': 293, 'loss': 'mae', 'optimizer': 'adam', 'graph_mode': 'off', 'use_snp_selection': False}. Best is trial 24 with value: 0.17902410124327034.
[I 2025-12-05 16:06:22,874] Trial 86 finished with value: 0.1716740027736702 and parameters: {'model_type': 'mlp', 'hidden_dims': '[512, 128]', 'dropout': 0.15460929021225436, 'batch_norm': True, 'lr': 0.00010279477818013557, 'weight_decay': 2.4734431378255276e-06, 'epochs': 280, 'loss': 'mae', 'optimizer': 'adam', 'graph_mode': 'off', 'use_snp_selection': False}. Best is trial 24 with value: 0.17902410124327034.
[I 2025-12-05 16:06:28,222] Trial 87 finished with value: 0.15529788184555554 and parameters: {'model_type': 'mlp', 'hidden_dims': '[512, 64]', 'dropout': 0.1699790408036884, 'batch_norm': True, 'lr': 0.00013449192280191015, 'weight_decay': 1.3112931599850992e-06, 'epochs': 319, 'loss': 'mae', 'optimizer': 'adam', 'graph_mode': 'off', 'use_snp_selection': True, 'num_snps': 43141}. Best is trial 24 with value: 0.17902410124327034.
[I 2025-12-05 16:06:33,128] Trial 88 finished with value: 0.1616769578089635 and parameters: {'model_type': 'mlp', 'hidden_dims': '[512, 128]', 'dropout': 0.11309234434224394, 'batch_norm': True, 'lr': 0.00021428633379131168, 'weight_decay': 4.032948486486185e-06, 'epochs': 340, 'loss': 'mae', 'optimizer': 'adam', 'graph_mode': 'off', 'use_snp_selection': False}. Best is trial 24 with value: 0.17902410124327034.
[I 2025-12-05 16:06:35,834] Trial 89 finished with value: 0.15779462970794028 and parameters: {'model_type': 'mlp', 'hidden_dims': '[256, 128, 64]', 'dropout': 0.1423587166659401, 'batch_norm': True, 'lr': 0.00016988893415880439, 'weight_decay': 1.2102557606359412e-05, 'epochs': 311, 'loss': 'mae', 'optimizer': 'adam', 'graph_mode': 'off', 'use_snp_selection': False}. Best is trial 24 with value: 0.17902410124327034.
[I 2025-12-05 16:06:40,569] Trial 90 finished with value: 0.16934685842857813 and parameters: {'model_type': 'mlp', 'hidden_dims': '[512, 128]', 'dropout': 0.18053586648732517, 'batch_norm': True, 'lr': 0.00011290236362304881, 'weight_decay': 8.012749610113939e-07, 'epochs': 326, 'loss': 'mse', 'optimizer': 'adam', 'graph_mode': 'off', 'use_snp_selection': False}. Best is trial 24 with value: 0.17902410124327034.
[I 2025-12-05 16:06:44,915] Trial 91 finished with value: 0.15700065177036027 and parameters: {'model_type': 'mlp', 'hidden_dims': '[512, 128]', 'dropout': 0.24995239091737215, 'batch_norm': True, 'lr': 0.0003112105605796198, 'weight_decay': 1.5661711416922658e-06, 'epochs': 296, 'loss': 'mae', 'optimizer': 'adam', 'graph_mode': 'off', 'use_snp_selection': False}. Best is trial 24 with value: 0.17902410124327034.
[I 2025-12-05 16:06:49,935] Trial 92 finished with value: 0.16908302381189735 and parameters: {'model_type': 'mlp', 'hidden_dims': '[512, 128]', 'dropout': 0.191444540166519, 'batch_norm': True, 'lr': 0.0006127480823305866, 'weight_decay': 1.712463141813234e-05, 'epochs': 350, 'loss': 'mae', 'optimizer': 'adam', 'graph_mode': 'off', 'use_snp_selection': False}. Best is trial 24 with value: 0.17902410124327034.
[I 2025-12-05 16:06:54,376] Trial 93 finished with value: 0.1629126722605805 and parameters: {'model_type': 'mlp', 'hidden_dims': '[512, 128]', 'dropout': 0.19850069257122743, 'batch_norm': True, 'lr': 0.00024969866390596836, 'weight_decay': 2.8341596432219215e-06, 'epochs': 304, 'loss': 'mae', 'optimizer': 'adam', 'graph_mode': 'off', 'use_snp_selection': False}. Best is trial 24 with value: 0.17902410124327034.
[I 2025-12-05 16:06:58,589] Trial 94 finished with value: 0.17197952672104785 and parameters: {'model_type': 'mlp', 'hidden_dims': '[512, 128]', 'dropout': 0.12978063969458156, 'batch_norm': True, 'lr': 8.525647743857095e-05, 'weight_decay': 2.026839468865181e-06, 'epochs': 286, 'loss': 'mae', 'optimizer': 'adam', 'graph_mode': 'off', 'use_snp_selection': False}. Best is trial 24 with value: 0.17902410124327034.
[I 2025-12-05 16:07:02,820] Trial 95 finished with value: 0.16764999341730297 and parameters: {'model_type': 'mlp', 'hidden_dims': '[512, 128]', 'dropout': 0.12826879818136602, 'batch_norm': True, 'lr': 8.686101905734073e-05, 'weight_decay': 6.013985918606722e-07, 'epochs': 287, 'loss': 'mae', 'optimizer': 'adam', 'graph_mode': 'off', 'use_snp_selection': False}. Best is trial 24 with value: 0.17902410124327034.
[I 2025-12-05 16:07:05,077] Trial 96 finished with value: 0.13398219076776896 and parameters: {'model_type': 'mlp', 'hidden_dims': '[256, 128]', 'dropout': 0.11194351894884685, 'batch_norm': False, 'lr': 4.52397442259588e-05, 'weight_decay': 2.300246309025029e-06, 'epochs': 260, 'loss': 'mae', 'optimizer': 'adam', 'graph_mode': 'off', 'use_snp_selection': False}. Best is trial 24 with value: 0.17902410124327034.
[I 2025-12-05 16:07:09,143] Trial 97 finished with value: 0.17264699267376024 and parameters: {'model_type': 'mlp', 'hidden_dims': '[512, 256]', 'dropout': 0.1002629870889965, 'batch_norm': True, 'lr': 6.603750824512332e-05, 'weight_decay': 3.4346482738490207e-06, 'epochs': 273, 'loss': 'mae', 'optimizer': 'adam', 'graph_mode': 'off', 'use_snp_selection': False}. Best is trial 24 with value: 0.17902410124327034.
[I 2025-12-05 16:07:13,248] Trial 98 finished with value: 0.17105979200843305 and parameters: {'model_type': 'mlp', 'hidden_dims': '[512, 256]', 'dropout': 0.10470689441840156, 'batch_norm': True, 'lr': 6.120912265530413e-05, 'weight_decay': 3.6526222126706227e-06, 'epochs': 274, 'loss': 'mae', 'optimizer': 'adam', 'graph_mode': 'off', 'use_snp_selection': False}. Best is trial 24 with value: 0.17902410124327034.
[I 2025-12-05 16:07:17,914] Trial 99 finished with value: 0.166882646597995 and parameters: {'model_type': 'mlp', 'hidden_dims': '[512, 256]', 'dropout': 0.11856696330999922, 'batch_norm': True, 'lr': 3.7128208156131865e-05, 'weight_decay': 6.72707362423948e-06, 'epochs': 321, 'loss': 'mae', 'optimizer': 'adam', 'graph_mode': 'off', 'use_snp_selection': False}. Best is trial 24 with value: 0.17902410124327034.
[I 2025-12-05 16:07:23,100] Trial 100 finished with value: 0.13920157511644202 and parameters: {'model_type': 'mlp', 'hidden_dims': '[512, 256]', 'dropout': 0.15635311450112638, 'batch_norm': True, 'lr': 2.9937502244318893e-05, 'weight_decay': 9.57775622243023e-07, 'epochs': 237, 'loss': 'mse', 'optimizer': 'adam', 'graph_mode': 'off', 'use_snp_selection': True, 'num_snps': 50880}. Best is trial 24 with value: 0.17902410124327034.
[I 2025-12-05 16:07:27,470] Trial 101 finished with value: 0.15586007932594248 and parameters: {'model_type': 'mlp', 'hidden_dims': '[512, 256]', 'dropout': 0.127613577430135, 'batch_norm': True, 'lr': 6.998549579836008e-05, 'weight_decay': 4.936725547120588e-06, 'epochs': 298, 'loss': 'mae', 'optimizer': 'adam', 'graph_mode': 'off', 'use_snp_selection': False}. Best is trial 24 with value: 0.17902410124327034.
[I 2025-12-05 16:07:31,206] Trial 102 finished with value: 0.15247903339883456 and parameters: {'model_type': 'mlp', 'hidden_dims': '[512, 64]', 'dropout': 0.13643688916254998, 'batch_norm': True, 'lr': 5.239968277051671e-05, 'weight_decay': 3.322387689250271e-06, 'epochs': 248, 'loss': 'mae', 'optimizer': 'adam', 'graph_mode': 'off', 'use_snp_selection': False}. Best is trial 24 with value: 0.17902410124327034.
[I 2025-12-05 16:07:35,371] Trial 103 finished with value: 0.17546445113887416 and parameters: {'model_type': 'mlp', 'hidden_dims': '[512, 128]', 'dropout': 0.11067776716238956, 'batch_norm': True, 'lr': 7.860988880957655e-05, 'weight_decay': 8.845771218409387e-06, 'epochs': 282, 'loss': 'mae', 'optimizer': 'adam', 'graph_mode': 'off', 'use_snp_selection': False}. Best is trial 24 with value: 0.17902410124327034.
