[I 2025-12-06 13:06:25,249] Trial 48 finished with value: 0.2134853342578479 and parameters: {'model_type': 'mlp', 'hidden_dims': '[128, 64]', 'dropout': 0.16903631851451628, 'batch_norm': False, 'lr': 1.797368590858684e-06, 'weight_decay': 5.43064578610972e-05, 'epochs': 222, 'loss': 'mse', 'optimizer': 'adam', 'graph_mode': 'off', 'use_snp_selection': False}. Best is trial 32 with value: 0.21525622059083407.
[I 2025-12-06 13:07:27,070] Trial 49 finished with value: 0.1925653508921914 and parameters: {'model_type': 'mlp', 'hidden_dims': '[128, 64]', 'dropout': 0.15806227884287355, 'batch_norm': False, 'lr': 1.5629064099630406e-06, 'weight_decay': 6.250451307174044e-05, 'epochs': 313, 'loss': 'mse', 'optimizer': 'adam', 'graph_mode': 'off', 'use_snp_selection': True, 'num_snps': 46888}. Best is trial 32 with value: 0.21525622059083407.
[I 2025-12-06 13:07:43,719] Trial 50 finished with value: 0.18919683821435315 and parameters: {'model_type': 'mlp', 'hidden_dims': '[128, 64]', 'dropout': 0.1756059628228727, 'batch_norm': False, 'lr': 1.3316069164337609e-06, 'weight_decay': 1.8620502812402796e-05, 'epochs': 151, 'loss': 'mse', 'optimizer': 'adam', 'graph_mode': 'off', 'use_snp_selection': False}. Best is trial 32 with value: 0.21525622059083407.
[I 2025-12-06 13:08:05,434] Trial 51 finished with value: 0.20229514140577637 and parameters: {'model_type': 'mlp', 'hidden_dims': '[128, 64]', 'dropout': 0.13902219988417827, 'batch_norm': False, 'lr': 2.583616543802853e-06, 'weight_decay': 1.0754846824335488e-05, 'epochs': 221, 'loss': 'mse', 'optimizer': 'adam', 'graph_mode': 'off', 'use_snp_selection': False}. Best is trial 32 with value: 0.21525622059083407.
[I 2025-12-06 13:08:41,123] Trial 52 finished with value: 0.21458012831630774 and parameters: {'model_type': 'mlp', 'hidden_dims': '[256, 128, 64]', 'dropout': 0.21449372666989247, 'batch_norm': False, 'lr': 3.960609331824326e-06, 'weight_decay': 5.628985113213361e-05, 'epochs': 206, 'loss': 'mse', 'optimizer': 'adam', 'graph_mode': 'off', 'use_snp_selection': False}. Best is trial 32 with value: 0.21525622059083407.
[I 2025-12-06 13:09:16,767] Trial 53 finished with value: 0.20525073106298986 and parameters: {'model_type': 'mlp', 'hidden_dims': '[256, 128, 64]', 'dropout': 0.21111400488654897, 'batch_norm': False, 'lr': 3.814092049051417e-06, 'weight_decay': 5.123620498698759e-05, 'epochs': 205, 'loss': 'mse', 'optimizer': 'adam', 'graph_mode': 'off', 'use_snp_selection': False}. Best is trial 32 with value: 0.21525622059083407.
[I 2025-12-06 13:09:56,681] Trial 54 finished with value: 0.19730906494888542 and parameters: {'model_type': 'mlp', 'hidden_dims': '[256, 128, 64]', 'dropout': 0.30970516604985965, 'batch_norm': False, 'lr': 1.973833134765919e-06, 'weight_decay': 8.986438142345056e-05, 'epochs': 235, 'loss': 'mse', 'optimizer': 'adam', 'graph_mode': 'off', 'use_snp_selection': False}. Best is trial 32 with value: 0.21525622059083407.
[I 2025-12-06 13:10:15,828] Trial 55 finished with value: 0.2078251790087843 and parameters: {'model_type': 'mlp', 'hidden_dims': '[128, 64]', 'dropout': 0.21999626140720105, 'batch_norm': False, 'lr': 4.246711716237183e-06, 'weight_decay': 4.0895214227141676e-05, 'epochs': 184, 'loss': 'mse', 'optimizer': 'adam', 'graph_mode': 'off', 'use_snp_selection': False}. Best is trial 32 with value: 0.21525622059083407.
[I 2025-12-06 13:10:59,814] Trial 56 finished with value: 0.2146437359171768 and parameters: {'model_type': 'mlp', 'hidden_dims': '[256, 128]', 'dropout': 0.22723901230550536, 'batch_norm': False, 'lr': 3.1002541036965536e-06, 'weight_decay': 0.0002911226954567049, 'epochs': 264, 'loss': 'mse', 'optimizer': 'adam', 'graph_mode': 'off', 'use_snp_selection': False}. Best is trial 32 with value: 0.21525622059083407.
[I 2025-12-06 13:11:46,963] Trial 57 finished with value: 0.17026558001952669 and parameters: {'model_type': 'mlp', 'hidden_dims': '[256, 128]', 'dropout': 0.16899542448909033, 'batch_norm': True, 'lr': 1.5039191697389e-05, 'weight_decay': 0.0002814636684060287, 'epochs': 283, 'loss': 'mse', 'optimizer': 'adam', 'graph_mode': 'off', 'use_snp_selection': False}. Best is trial 32 with value: 0.21525622059083407.
[I 2025-12-06 13:12:31,751] Trial 58 finished with value: 0.19053537749353805 and parameters: {'model_type': 'mlp', 'hidden_dims': '[256, 128]', 'dropout': 0.2262067378956306, 'batch_norm': False, 'lr': 7.2245017066340915e-06, 'weight_decay': 0.00017645071048292798, 'epochs': 269, 'loss': 'mse', 'optimizer': 'adam', 'graph_mode': 'off', 'use_snp_selection': False}. Best is trial 32 with value: 0.21525622059083407.
[I 2025-12-06 13:13:07,086] Trial 59 finished with value: 0.1979615522672699 and parameters: {'model_type': 'mlp', 'hidden_dims': '[256, 128]', 'dropout': 0.18921446763701538, 'batch_norm': False, 'lr': 1.2199560098786416e-06, 'weight_decay': 0.00046737304122661195, 'epochs': 203, 'loss': 'mse', 'optimizer': 'adam', 'graph_mode': 'off', 'use_snp_selection': False}. Best is trial 32 with value: 0.21525622059083407.
[I 2025-12-06 13:14:05,753] Trial 60 finished with value: 0.20564136845071404 and parameters: {'model_type': 'mlp', 'hidden_dims': '[512, 64]', 'dropout': 0.13433697798736366, 'batch_norm': False, 'lr': 1.6948387443209548e-06, 'weight_decay': 0.0001062367791444444, 'epochs': 183, 'loss': 'mse', 'optimizer': 'adam', 'graph_mode': 'off', 'use_snp_selection': False}. Best is trial 32 with value: 0.21525622059083407.
[I 2025-12-06 13:14:55,116] Trial 61 finished with value: 0.2084528179934459 and parameters: {'model_type': 'mlp', 'hidden_dims': '[256, 128, 64]', 'dropout': 0.24717994914220215, 'batch_norm': False, 'lr': 3.102500083576604e-06, 'weight_decay': 5.497763669906248e-05, 'epochs': 299, 'loss': 'mse', 'optimizer': 'adam', 'graph_mode': 'off', 'use_snp_selection': False}. Best is trial 32 with value: 0.21525622059083407.
[I 2025-12-06 13:15:38,278] Trial 62 finished with value: 0.20747715847556397 and parameters: {'model_type': 'mlp', 'hidden_dims': '[256, 128]', 'dropout': 0.29302168828034675, 'batch_norm': False, 'lr': 3.6391917412863025e-06, 'weight_decay': 3.264145205745001e-05, 'epochs': 257, 'loss': 'mse', 'optimizer': 'adam', 'graph_mode': 'off', 'use_snp_selection': False}. Best is trial 32 with value: 0.21525622059083407.
[I 2025-12-06 13:16:50,302] Trial 63 finished with value: 0.20880708961308714 and parameters: {'model_type': 'mlp', 'hidden_dims': '[512, 128]', 'dropout': 0.3218128613419081, 'batch_norm': False, 'lr': 1.8526079313648257e-06, 'weight_decay': 0.00027439464189256754, 'epochs': 229, 'loss': 'mse', 'optimizer': 'adam', 'graph_mode': 'off', 'use_snp_selection': False}. Best is trial 32 with value: 0.21525622059083407.
[I 2025-12-06 13:17:07,545] Trial 64 finished with value: 0.20298055925872852 and parameters: {'model_type': 'mlp', 'hidden_dims': '[128, 64]', 'dropout': 0.2009915345997718, 'batch_norm': False, 'lr': 4.752363685059048e-06, 'weight_decay': 0.00018646115211545588, 'epochs': 156, 'loss': 'mse', 'optimizer': 'adam', 'graph_mode': 'off', 'use_snp_selection': False}. Best is trial 32 with value: 0.21525622059083407.
[I 2025-12-06 13:17:48,507] Trial 65 finished with value: 0.21048022624151425 and parameters: {'model_type': 'mlp', 'hidden_dims': '[256, 128, 64]', 'dropout': 0.2550111002114326, 'batch_norm': False, 'lr': 2.769505943749942e-06, 'weight_decay': 0.0006236095314583241, 'epochs': 240, 'loss': 'mse', 'optimizer': 'adam', 'graph_mode': 'off', 'use_snp_selection': False}. Best is trial 32 with value: 0.21525622059083407.
[I 2025-12-06 13:18:29,382] Trial 66 finished with value: 0.1957288825643169 and parameters: {'model_type': 'mlp', 'hidden_dims': '[256, 128, 64]', 'dropout': 0.2520051980317803, 'batch_norm': False, 'lr': 1.0820889271553559e-05, 'weight_decay': 0.0005628430135730876, 'epochs': 240, 'loss': 'mse', 'optimizer': 'adam', 'graph_mode': 'off', 'use_snp_selection': False}. Best is trial 32 with value: 0.21525622059083407.
[I 2025-12-06 13:19:17,390] Trial 67 finished with value: 0.16718538039984443 and parameters: {'model_type': 'mlp', 'hidden_dims': '[256, 128, 64]', 'dropout': 0.22718512819605005, 'batch_norm': False, 'lr': 0.00010117023530751639, 'weight_decay': 0.0008788219373140064, 'epochs': 213, 'loss': 'mse', 'optimizer': 'adam', 'graph_mode': 'off', 'use_snp_selection': True, 'num_snps': 22951}. Best is trial 32 with value: 0.21525622059083407.
[I 2025-12-06 13:19:56,839] Trial 68 finished with value: 0.19753305621497103 and parameters: {'model_type': 'mlp', 'hidden_dims': '[256, 128]', 'dropout': 0.28165708754456864, 'batch_norm': False, 'lr': 6.840461186934717e-06, 'weight_decay': 0.00035206563483143903, 'epochs': 228, 'loss': 'mse', 'optimizer': 'adam', 'graph_mode': 'off', 'use_snp_selection': False}. Best is trial 32 with value: 0.21525622059083407.
[I 2025-12-06 13:20:25,307] Trial 69 finished with value: 0.19752114557935996 and parameters: {'model_type': 'mlp', 'hidden_dims': '[256, 128, 64]', 'dropout': 0.17861723552405834, 'batch_norm': False, 'lr': 0.0008925222241173445, 'weight_decay': 0.00045765325018404756, 'epochs': 159, 'loss': 'mse', 'optimizer': 'adam', 'graph_mode': 'off', 'use_snp_selection': False}. Best is trial 32 with value: 0.21525622059083407.
[I 2025-12-06 13:21:27,922] Trial 70 finished with value: 0.2104599790310225 and parameters: {'model_type': 'mlp', 'hidden_dims': '[512, 64]', 'dropout': 0.26136004743784536, 'batch_norm': False, 'lr': 2.694783127275274e-06, 'weight_decay': 0.00010641416049169567, 'epochs': 198, 'loss': 'mse', 'optimizer': 'adam', 'graph_mode': 'off', 'use_snp_selection': False}. Best is trial 32 with value: 0.21525622059083407.
[I 2025-12-06 13:22:32,047] Trial 71 finished with value: 0.20771069522905608 and parameters: {'model_type': 'mlp', 'hidden_dims': '[512, 64]', 'dropout': 0.26067630569919764, 'batch_norm': False, 'lr': 2.5632804809034966e-06, 'weight_decay': 0.00015565945039128855, 'epochs': 202, 'loss': 'mse', 'optimizer': 'adam', 'graph_mode': 'off', 'use_snp_selection': False}. Best is trial 32 with value: 0.21525622059083407.
[I 2025-12-06 13:23:30,518] Trial 72 finished with value: 0.20055149992530233 and parameters: {'model_type': 'mlp', 'hidden_dims': '[512, 64]', 'dropout': 0.23795476877129298, 'batch_norm': False, 'lr': 3.2172075567230245e-06, 'weight_decay': 9.929492018045285e-05, 'epochs': 182, 'loss': 'mse', 'optimizer': 'adam', 'graph_mode': 'off', 'use_snp_selection': False}. Best is trial 32 with value: 0.21525622059083407.
[I 2025-12-06 13:24:32,859] Trial 73 finished with value: 0.2031151904417985 and parameters: {'model_type': 'mlp', 'hidden_dims': '[512, 64]', 'dropout': 0.2065644164568544, 'batch_norm': False, 'lr': 4.3660016522440106e-06, 'weight_decay': 0.0002795072064216101, 'epochs': 196, 'loss': 'mse', 'optimizer': 'adam', 'graph_mode': 'off', 'use_snp_selection': False}. Best is trial 32 with value: 0.21525622059083407.
[I 2025-12-06 13:25:54,250] Trial 74 finished with value: 0.20698382465967366 and parameters: {'model_type': 'mlp', 'hidden_dims': '[512, 64]', 'dropout': 0.1967729536257276, 'batch_norm': False, 'lr': 2.102706162193711e-06, 'weight_decay': 0.0007568709276768275, 'epochs': 263, 'loss': 'mse', 'optimizer': 'adam', 'graph_mode': 'off', 'use_snp_selection': False}. Best is trial 32 with value: 0.21525622059083407.
[I 2025-12-06 13:26:18,011] Trial 75 finished with value: 0.19322022108310874 and parameters: {'model_type': 'mlp', 'hidden_dims': '[128, 64]', 'dropout': 0.25951820652486746, 'batch_norm': False, 'lr': 1.3521511618696863e-06, 'weight_decay': 6.513676508809763e-05, 'epochs': 246, 'loss': 'mse', 'optimizer': 'adam', 'graph_mode': 'off', 'use_snp_selection': False}. Best is trial 32 with value: 0.21525622059083407.
[I 2025-12-06 13:26:44,636] Trial 76 finished with value: 0.1566998191461444 and parameters: {'model_type': 'mlp', 'hidden_dims': '[256, 128, 64]', 'dropout': 0.21974165284339747, 'batch_norm': True, 'lr': 2.7892670868393855e-06, 'weight_decay': 0.00022273735834176848, 'epochs': 139, 'loss': 'mse', 'optimizer': 'adam', 'graph_mode': 'off', 'use_snp_selection': False}. Best is trial 32 with value: 0.21525622059083407.
[I 2025-12-06 13:27:24,745] Trial 77 finished with value: 0.2078734142780528 and parameters: {'model_type': 'mlp', 'hidden_dims': '[256, 128, 64]', 'dropout': 0.278335388668007, 'batch_norm': False, 'lr': 1.945698421524465e-06, 'weight_decay': 0.0001236431611813055, 'epochs': 234, 'loss': 'mse', 'optimizer': 'adam', 'graph_mode': 'off', 'use_snp_selection': False}. Best is trial 32 with value: 0.21525622059083407.
[I 2025-12-06 13:27:57,073] Trial 78 finished with value: 0.16370539163345632 and parameters: {'model_type': 'mlp', 'hidden_dims': '[512, 64]', 'dropout': 0.16452440502854493, 'batch_norm': False, 'lr': 5.294648573428504e-06, 'weight_decay': 5.026365104128227e-05, 'epochs': 210, 'loss': 'mse', 'optimizer': 'adam', 'graph_mode': 'off', 'use_snp_selection': True, 'num_snps': 2246}. Best is trial 32 with value: 0.21525622059083407.
[I 2025-12-06 13:29:07,216] Trial 79 finished with value: 0.19888089385920474 and parameters: {'model_type': 'mlp', 'hidden_dims': '[512, 128]', 'dropout': 0.2972544880179632, 'batch_norm': False, 'lr': 1.1627865964282838e-06, 'weight_decay': 0.0003661699228604779, 'epochs': 225, 'loss': 'mse', 'optimizer': 'adam', 'graph_mode': 'off', 'use_snp_selection': False}. Best is trial 32 with value: 0.21525622059083407.
[I 2025-12-06 13:29:37,425] Trial 80 finished with value: 0.2063482111652898 and parameters: {'model_type': 'mlp', 'hidden_dims': '[256, 128, 64]', 'dropout': 0.2303964097335235, 'batch_norm': False, 'lr': 3.4849463711442582e-06, 'weight_decay': 2.803603285212467e-05, 'epochs': 166, 'loss': 'mse', 'optimizer': 'adam', 'graph_mode': 'off', 'use_snp_selection': False}. Best is trial 32 with value: 0.21525622059083407.
[I 2025-12-06 13:30:20,218] Trial 81 finished with value: 0.20504550309713104 and parameters: {'model_type': 'mlp', 'hidden_dims': '[256, 128, 64]', 'dropout': 0.33016772992856136, 'batch_norm': False, 'lr': 2.908266199345697e-06, 'weight_decay': 1.593638699689558e-05, 'epochs': 254, 'loss': 'mse', 'optimizer': 'adam', 'graph_mode': 'off', 'use_snp_selection': False}. Best is trial 32 with value: 0.21525622059083407.
[I 2025-12-06 13:31:06,028] Trial 82 finished with value: 0.209987730818954 and parameters: {'model_type': 'mlp', 'hidden_dims': '[256, 128, 64]', 'dropout': 0.2433071119801476, 'batch_norm': False, 'lr': 4.42254892797217e-06, 'weight_decay': 0.000551582193874626, 'epochs': 275, 'loss': 'mse', 'optimizer': 'adam', 'graph_mode': 'off', 'use_snp_selection': False}. Best is trial 32 with value: 0.21525622059083407.
[I 2025-12-06 13:31:54,530] Trial 83 finished with value: 0.19909517396820386 and parameters: {'model_type': 'mlp', 'hidden_dims': '[256, 128, 64]', 'dropout': 0.24337395158294622, 'batch_norm': False, 'lr': 9.152273243141333e-06, 'weight_decay': 0.0007116605196007728, 'epochs': 294, 'loss': 'mse', 'optimizer': 'adam', 'graph_mode': 'off', 'use_snp_selection': False}. Best is trial 32 with value: 0.21525622059083407.
[I 2025-12-06 13:32:40,374] Trial 84 finished with value: 0.20633971746044383 and parameters: {'model_type': 'mlp', 'hidden_dims': '[256, 128, 64]', 'dropout': 0.2730769172052703, 'batch_norm': False, 'lr': 4.153318818439498e-06, 'weight_decay': 0.0005227728249714189, 'epochs': 275, 'loss': 'mse', 'optimizer': 'adam', 'graph_mode': 'off', 'use_snp_selection': False}. Best is trial 32 with value: 0.21525622059083407.
[I 2025-12-06 13:33:18,640] Trial 85 finished with value: 0.20354804311306712 and parameters: {'model_type': 'mlp', 'hidden_dims': '[256, 128, 64]', 'dropout': 0.19382636927204835, 'batch_norm': False, 'lr': 2.4350800014791894e-06, 'weight_decay': 8.96049028619482e-05, 'epochs': 222, 'loss': 'mse', 'optimizer': 'adam', 'graph_mode': 'off', 'use_snp_selection': False}. Best is trial 32 with value: 0.21525622059083407.
[I 2025-12-06 13:33:59,494] Trial 86 finished with value: 0.19617667129932853 and parameters: {'model_type': 'mlp', 'hidden_dims': '[256, 128]', 'dropout': 0.15130401895645418, 'batch_norm': False, 'lr': 4.835508190589403e-06, 'weight_decay': 0.00014221398120822798, 'epochs': 241, 'loss': 'mse', 'optimizer': 'adam', 'graph_mode': 'off', 'use_snp_selection': False}. Best is trial 32 with value: 0.21525622059083407.
[I 2025-12-06 13:34:47,340] Trial 87 finished with value: 0.2020826611232736 and parameters: {'model_type': 'mlp', 'hidden_dims': '[256, 128, 64]', 'dropout': 0.2116166583391452, 'batch_norm': False, 'lr': 6.149136310534891e-06, 'weight_decay': 0.0003922946529451132, 'epochs': 289, 'loss': 'mse', 'optimizer': 'adam', 'graph_mode': 'off', 'use_snp_selection': False}. Best is trial 32 with value: 0.21525622059083407.
[I 2025-12-06 13:35:13,357] Trial 88 finished with value: 0.11555970397036397 and parameters: {'model_type': 'mlp', 'hidden_dims': '[128, 64]', 'dropout': 0.2547479398469121, 'batch_norm': True, 'lr': 1.5699550084482234e-06, 'weight_decay': 0.00024606868388438207, 'epochs': 275, 'loss': 'mse', 'optimizer': 'adam', 'graph_mode': 'off', 'use_snp_selection': False}. Best is trial 32 with value: 0.21525622059083407.
[I 2025-12-06 13:36:02,987] Trial 89 finished with value: 0.18991292421225917 and parameters: {'model_type': 'mlp', 'hidden_dims': '[256, 128, 64]', 'dropout': 0.30645355103601457, 'batch_norm': False, 'lr': 4.013612291599195e-05, 'weight_decay': 0.0009634295693684594, 'epochs': 305, 'loss': 'mse', 'optimizer': 'adam', 'graph_mode': 'off', 'use_snp_selection': False}. Best is trial 32 with value: 0.21525622059083407.
[I 2025-12-06 13:37:09,488] Trial 90 finished with value: 0.1990005138189463 and parameters: {'model_type': 'mlp', 'hidden_dims': '[256, 128, 64]', 'dropout': 0.45889900964263414, 'batch_norm': False, 'lr': 3.7834701478789408e-06, 'weight_decay': 0.0003144213045721835, 'epochs': 194, 'loss': 'mse', 'optimizer': 'adam', 'graph_mode': 'off', 'use_snp_selection': True, 'num_snps': 48165}. Best is trial 32 with value: 0.21525622059083407.
[I 2025-12-06 13:37:52,198] Trial 91 finished with value: 0.21114138016660372 and parameters: {'model_type': 'mlp', 'hidden_dims': '[256, 128, 64]', 'dropout': 0.28931113716620305, 'batch_norm': False, 'lr': 2.9846118296895016e-06, 'weight_decay': 2.528449602328972e-07, 'epochs': 257, 'loss': 'mse', 'optimizer': 'adam', 'graph_mode': 'off', 'use_snp_selection': False}. Best is trial 32 with value: 0.21525622059083407.
[I 2025-12-06 13:38:33,472] Trial 92 finished with value: 0.20979743802718462 and parameters: {'model_type': 'mlp', 'hidden_dims': '[256, 128, 64]', 'dropout': 0.3584486494657481, 'batch_norm': False, 'lr': 3.2602296146237955e-06, 'weight_decay': 4.6034697474536263e-07, 'epochs': 246, 'loss': 'mse', 'optimizer': 'adam', 'graph_mode': 'off', 'use_snp_selection': False}. Best is trial 32 with value: 0.21525622059083407.
[I 2025-12-06 13:39:17,270] Trial 93 finished with value: 0.21390292656840684 and parameters: {'model_type': 'mlp', 'hidden_dims': '[256, 128, 64]', 'dropout': 0.2646213302543824, 'batch_norm': False, 'lr': 2.1633042703524675e-06, 'weight_decay': 1.5224065069940357e-07, 'epochs': 262, 'loss': 'mse', 'optimizer': 'adam', 'graph_mode': 'off', 'use_snp_selection': False}. Best is trial 32 with value: 0.21525622059083407.
[I 2025-12-06 13:40:00,892] Trial 94 finished with value: 0.2025002996005413 and parameters: {'model_type': 'mlp', 'hidden_dims': '[256, 128, 64]', 'dropout': 0.28696960380309955, 'batch_norm': False, 'lr': 1.839559393876357e-06, 'weight_decay': 2.1505915409869291e-07, 'epochs': 260, 'loss': 'mse', 'optimizer': 'adam', 'graph_mode': 'off', 'use_snp_selection': False}. Best is trial 32 with value: 0.21525622059083407.
[I 2025-12-06 13:41:06,676] Trial 95 finished with value: 0.20896026795411665 and parameters: {'model_type': 'mlp', 'hidden_dims': '[512, 256]', 'dropout': 0.2730333195705359, 'batch_norm': False, 'lr': 2.1938109079532457e-06, 'weight_decay': 1.3559546954341327e-07, 'epochs': 207, 'loss': 'mse', 'optimizer': 'adam', 'graph_mode': 'off', 'use_snp_selection': False}. Best is trial 32 with value: 0.21525622059083407.
[I 2025-12-06 13:41:46,869] Trial 96 finished with value: 0.2093607350128214 and parameters: {'model_type': 'mlp', 'hidden_dims': '[256, 128, 64]', 'dropout': 0.2335388812419797, 'batch_norm': False, 'lr': 2.627385576115482e-06, 'weight_decay': 2.2388521029229685e-07, 'epochs': 235, 'loss': 'mse', 'optimizer': 'adam', 'graph_mode': 'off', 'use_snp_selection': False}. Best is trial 32 with value: 0.21525622059083407.
[I 2025-12-06 13:42:24,722] Trial 97 finished with value: 0.20647162059261137 and parameters: {'model_type': 'mlp', 'hidden_dims': '[256, 128]', 'dropout': 0.26278971798960027, 'batch_norm': False, 'lr': 1.4289298095981885e-06, 'weight_decay': 2.585735648393843e-07, 'epochs': 220, 'loss': 'mse', 'optimizer': 'adam', 'graph_mode': 'off', 'use_snp_selection': False}. Best is trial 32 with value: 0.21525622059083407.
[I 2025-12-06 13:42:48,617] Trial 98 finished with value: 0.18925266164220428 and parameters: {'model_type': 'mlp', 'hidden_dims': '[128, 64]', 'dropout': 0.17744355406350265, 'batch_norm': False, 'lr': 1.779996859186127e-06, 'weight_decay': 1.2576920913656868e-06, 'epochs': 249, 'loss': 'mae', 'optimizer': 'adam', 'graph_mode': 'off', 'use_snp_selection': False}. Best is trial 32 with value: 0.21525622059083407.
[I 2025-12-06 13:43:20,511] Trial 99 finished with value: 0.20892872797467224 and parameters: {'model_type': 'mlp', 'hidden_dims': '[256, 128, 64]', 'dropout': 0.3020284575075352, 'batch_norm': False, 'lr': 2.3294687156157485e-06, 'weight_decay': 1.0008551354694244e-07, 'epochs': 178, 'loss': 'mse', 'optimizer': 'adam', 'graph_mode': 'off', 'use_snp_selection': False}. Best is trial 32 with value: 0.21525622059083407.
