[I 2025-12-05 14:48:30,594] Trial 71 finished with value: 0.08867069034426485 and parameters: {'model_type': 'mlp', 'hidden_dims': '[512, 64]', 'dropout': 0.42112726854923554, 'batch_norm': False, 'lr': 1.2200153670074651e-05, 'weight_decay': 0.0001892202270629655, 'epochs': 166, 'loss': 'mse', 'optimizer': 'adam', 'graph_mode': 'off', 'use_snp_selection': False}. Best is trial 23 with value: 0.13083647489442385.
[I 2025-12-05 14:48:32,174] Trial 72 finished with value: 0.0846721299528932 and parameters: {'model_type': 'mlp', 'hidden_dims': '[512, 64]', 'dropout': 0.430239293683937, 'batch_norm': False, 'lr': 1.0265717885665441e-05, 'weight_decay': 0.00020476002593669868, 'epochs': 152, 'loss': 'mse', 'optimizer': 'adam', 'graph_mode': 'off', 'use_snp_selection': False}. Best is trial 23 with value: 0.13083647489442385.
[I 2025-12-05 14:48:33,847] Trial 73 finished with value: 0.07310713618615315 and parameters: {'model_type': 'mlp', 'hidden_dims': '[512, 64]', 'dropout': 0.44692877303776957, 'batch_norm': False, 'lr': 3.4505783644894033e-06, 'weight_decay': 5.459549304376775e-05, 'epochs': 169, 'loss': 'mse', 'optimizer': 'adam', 'graph_mode': 'off', 'use_snp_selection': False}. Best is trial 23 with value: 0.13083647489442385.
[I 2025-12-05 14:48:35,281] Trial 74 finished with value: 0.09337300292505625 and parameters: {'model_type': 'mlp', 'hidden_dims': '[512, 64]', 'dropout': 0.41473949906936963, 'batch_norm': False, 'lr': 7.29511122613744e-06, 'weight_decay': 0.00034787803381530286, 'epochs': 128, 'loss': 'mse', 'optimizer': 'adam', 'graph_mode': 'off', 'use_snp_selection': False}. Best is trial 23 with value: 0.13083647489442385.
[I 2025-12-05 14:48:35,969] Trial 75 finished with value: 0.0675102477616218 and parameters: {'model_type': 'mlp', 'hidden_dims': '[256, 128]', 'dropout': 0.5083890953429502, 'batch_norm': False, 'lr': 1.7297068854812345e-05, 'weight_decay': 0.00015821480207467312, 'epochs': 40, 'loss': 'mse', 'optimizer': 'adam', 'graph_mode': 'off', 'use_snp_selection': False}. Best is trial 23 with value: 0.13083647489442385.
[I 2025-12-05 14:48:37,223] Trial 76 finished with value: 0.07839900824917065 and parameters: {'model_type': 'mlp', 'hidden_dims': '[256, 128]', 'dropout': 0.2607964045824713, 'batch_norm': False, 'lr': 7.757297462070534e-05, 'weight_decay': 1.1731350876726582e-05, 'epochs': 306, 'loss': 'mse', 'optimizer': 'adam', 'graph_mode': 'off', 'use_snp_selection': True, 'num_snps': 8010}. Best is trial 23 with value: 0.13083647489442385.
[I 2025-12-05 14:48:39,137] Trial 77 finished with value: 0.12759772547793607 and parameters: {'model_type': 'mlp', 'hidden_dims': '[512, 256]', 'dropout': 0.36119030831327925, 'batch_norm': True, 'lr': 0.0009996283498157905, 'weight_decay': 0.0006365566353077703, 'epochs': 206, 'loss': 'mse', 'optimizer': 'adam', 'graph_mode': 'off', 'use_snp_selection': False}. Best is trial 23 with value: 0.13083647489442385.
[I 2025-12-05 14:48:40,712] Trial 78 finished with value: 0.12641891384833837 and parameters: {'model_type': 'mlp', 'hidden_dims': '[512, 256]', 'dropout': 0.3583000455692118, 'batch_norm': True, 'lr': 0.0007500220009348075, 'weight_decay': 0.0005885994080302396, 'epochs': 226, 'loss': 'mae', 'optimizer': 'adam', 'graph_mode': 'off', 'use_snp_selection': True, 'num_snps': 17170}. Best is trial 23 with value: 0.13083647489442385.
[I 2025-12-05 14:48:42,239] Trial 79 finished with value: 0.11005207590628266 and parameters: {'model_type': 'mlp', 'hidden_dims': '[512, 256]', 'dropout': 0.36630506219142617, 'batch_norm': True, 'lr': 0.0008113516189625465, 'weight_decay': 0.000600888436057056, 'epochs': 207, 'loss': 'mae', 'optimizer': 'adam', 'graph_mode': 'off', 'use_snp_selection': True, 'num_snps': 16850}. Best is trial 23 with value: 0.13083647489442385.
[I 2025-12-05 14:48:44,094] Trial 80 finished with value: 0.12144357108836197 and parameters: {'model_type': 'mlp', 'hidden_dims': '[512, 256]', 'dropout': 0.3592518692634897, 'batch_norm': True, 'lr': 0.0005702708021823896, 'weight_decay': 6.580517785058714e-06, 'epochs': 218, 'loss': 'mae', 'optimizer': 'adam', 'graph_mode': 'off', 'use_snp_selection': True, 'num_snps': 22854}. Best is trial 23 with value: 0.13083647489442385.
[I 2025-12-05 14:48:45,538] Trial 81 finished with value: 0.10806627634086391 and parameters: {'model_type': 'mlp', 'hidden_dims': '[512, 256]', 'dropout': 0.33802909643943635, 'batch_norm': True, 'lr': 0.0007954317252843815, 'weight_decay': 0.0006894132010671476, 'epochs': 225, 'loss': 'mae', 'optimizer': 'adam', 'graph_mode': 'off', 'use_snp_selection': True, 'num_snps': 14655}. Best is trial 23 with value: 0.13083647489442385.
[I 2025-12-05 14:48:46,827] Trial 82 finished with value: 0.10989363229658797 and parameters: {'model_type': 'mlp', 'hidden_dims': '[512, 256]', 'dropout': 0.37404038586146987, 'batch_norm': True, 'lr': 0.0009049599674336062, 'weight_decay': 0.0004195737253774191, 'epochs': 232, 'loss': 'mae', 'optimizer': 'adam', 'graph_mode': 'off', 'use_snp_selection': True, 'num_snps': 9826}. Best is trial 23 with value: 0.13083647489442385.
[I 2025-12-05 14:48:48,535] Trial 83 finished with value: 0.12146409507357404 and parameters: {'model_type': 'mlp', 'hidden_dims': '[512, 256]', 'dropout': 0.32253087048684437, 'batch_norm': True, 'lr': 0.0009995463739849205, 'weight_decay': 0.000965946835798124, 'epochs': 270, 'loss': 'mae', 'optimizer': 'adam', 'graph_mode': 'off', 'use_snp_selection': True, 'num_snps': 17896}. Best is trial 23 with value: 0.13083647489442385.
[I 2025-12-05 14:48:52,543] Trial 84 finished with value: 0.12125789990561787 and parameters: {'model_type': 'mlp', 'hidden_dims': '[512, 256]', 'dropout': 0.38514474331167814, 'batch_norm': True, 'lr': 0.00045801776334229873, 'weight_decay': 1.7197713230346526e-06, 'epochs': 259, 'loss': 'mse', 'optimizer': 'adam', 'graph_mode': 'off', 'use_snp_selection': True, 'num_snps': 58193}. Best is trial 23 with value: 0.13083647489442385.
[I 2025-12-05 14:48:54,571] Trial 85 finished with value: 0.11955956859857064 and parameters: {'model_type': 'mlp', 'hidden_dims': '[512, 256]', 'dropout': 0.30859360629785704, 'batch_norm': True, 'lr': 0.0005879494974586374, 'weight_decay': 0.0007201352223273502, 'epochs': 214, 'loss': 'mae', 'optimizer': 'adam', 'graph_mode': 'off', 'use_snp_selection': False}. Best is trial 23 with value: 0.13083647489442385.
[I 2025-12-05 14:48:55,890] Trial 86 finished with value: 0.1191350838245334 and parameters: {'model_type': 'mlp', 'hidden_dims': '[256, 128, 64]', 'dropout': 0.4040745092050414, 'batch_norm': True, 'lr': 0.00022516208134144166, 'weight_decay': 0.000429119720299133, 'epochs': 245, 'loss': 'mse', 'optimizer': 'adam', 'graph_mode': 'off', 'use_snp_selection': False}. Best is trial 23 with value: 0.13083647489442385.
[I 2025-12-05 14:48:57,634] Trial 87 finished with value: 0.11526158200842307 and parameters: {'model_type': 'mlp', 'hidden_dims': '[256, 128]', 'dropout': 0.34911311616997853, 'batch_norm': True, 'lr': 0.00030372442530344796, 'weight_decay': 2.02298711594077e-05, 'epochs': 196, 'loss': 'mse', 'optimizer': 'adam', 'graph_mode': 'off', 'use_snp_selection': True, 'num_snps': 28473}. Best is trial 23 with value: 0.13083647489442385.
[I 2025-12-05 14:48:59,727] Trial 88 finished with value: 0.10708956775615416 and parameters: {'model_type': 'mlp', 'hidden_dims': '[512, 256]', 'dropout': 0.23836607042741606, 'batch_norm': True, 'lr': 3.662636856827876e-05, 'weight_decay': 3.013591631930993e-06, 'epochs': 237, 'loss': 'mae', 'optimizer': 'adam', 'graph_mode': 'off', 'use_snp_selection': False}. Best is trial 23 with value: 0.13083647489442385.
[I 2025-12-05 14:49:03,050] Trial 89 finished with value: 0.0989568139944055 and parameters: {'model_type': 'mlp', 'hidden_dims': '[512, 128]', 'dropout': 0.4698698363138015, 'batch_norm': True, 'lr': 6.22539625382697e-05, 'weight_decay': 9.201137230673182e-06, 'epochs': 181, 'loss': 'mse', 'optimizer': 'adam', 'graph_mode': 'off', 'use_snp_selection': True, 'num_snps': 52292}. Best is trial 23 with value: 0.13083647489442385.
[I 2025-12-05 14:49:04,314] Trial 90 finished with value: 0.09775254117023172 and parameters: {'model_type': 'mlp', 'hidden_dims': '[256, 128]', 'dropout': 0.33350969763475, 'batch_norm': False, 'lr': 4.183161789122429e-05, 'weight_decay': 0.0003291753951186347, 'epochs': 204, 'loss': 'mse', 'optimizer': 'adam', 'graph_mode': 'off', 'use_snp_selection': False}. Best is trial 23 with value: 0.13083647489442385.
[I 2025-12-05 14:49:06,122] Trial 91 finished with value: 0.007778977425408146 and parameters: {'model_type': 'mlp', 'hidden_dims': '[512, 64]', 'dropout': 0.38165118640489964, 'batch_norm': False, 'lr': 0.0006811627511681428, 'weight_decay': 0.0005118422252996657, 'epochs': 191, 'loss': 'mse', 'optimizer': 'adam', 'graph_mode': 'off', 'use_snp_selection': False}. Best is trial 23 with value: 0.13083647489442385.
[I 2025-12-05 14:49:06,891] Trial 92 finished with value: 0.06924392700689747 and parameters: {'model_type': 'mlp', 'hidden_dims': '[128, 64]', 'dropout': 0.4259478402456883, 'batch_norm': False, 'lr': 1.9381898708707072e-05, 'weight_decay': 3.317831106383937e-05, 'epochs': 159, 'loss': 'mse', 'optimizer': 'adam', 'graph_mode': 'off', 'use_snp_selection': False}. Best is trial 23 with value: 0.13083647489442385.
[I 2025-12-05 14:49:07,968] Trial 93 finished with value: 0.07357760785349059 and parameters: {'model_type': 'mlp', 'hidden_dims': '[256, 128, 64]', 'dropout': 0.39605453836508037, 'batch_norm': False, 'lr': 1.198332522185091e-05, 'weight_decay': 0.00022976813415026396, 'epochs': 169, 'loss': 'mse', 'optimizer': 'adam', 'graph_mode': 'off', 'use_snp_selection': False}. Best is trial 23 with value: 0.13083647489442385.
[I 2025-12-05 14:49:09,351] Trial 94 finished with value: 0.13030807780818238 and parameters: {'model_type': 'mlp', 'hidden_dims': '[256, 128]', 'dropout': 0.10870196300512489, 'batch_norm': False, 'lr': 2.6511631920878852e-05, 'weight_decay': 4.659989361476502e-05, 'epochs': 277, 'loss': 'mse', 'optimizer': 'adam', 'graph_mode': 'off', 'use_snp_selection': False}. Best is trial 23 with value: 0.13083647489442385.
[I 2025-12-05 14:49:10,755] Trial 95 finished with value: 0.10395563740005462 and parameters: {'model_type': 'mlp', 'hidden_dims': '[256, 128]', 'dropout': 0.1560094664546581, 'batch_norm': False, 'lr': 2.5792701617278222e-05, 'weight_decay': 1.3555755144760738e-05, 'epochs': 285, 'loss': 'mse', 'optimizer': 'adam', 'graph_mode': 'off', 'use_snp_selection': False}. Best is trial 23 with value: 0.13083647489442385.
[I 2025-12-05 14:49:12,170] Trial 96 finished with value: 0.11627361619188038 and parameters: {'model_type': 'mlp', 'hidden_dims': '[256, 128]', 'dropout': 0.10660784606560512, 'batch_norm': False, 'lr': 3.255553315798455e-05, 'weight_decay': 3.853022839161256e-05, 'epochs': 274, 'loss': 'mse', 'optimizer': 'adam', 'graph_mode': 'off', 'use_snp_selection': False}. Best is trial 23 with value: 0.13083647489442385.
[I 2025-12-05 14:49:13,783] Trial 97 finished with value: 0.11807041829798977 and parameters: {'model_type': 'mlp', 'hidden_dims': '[256, 128]', 'dropout': 0.11765790540968313, 'batch_norm': False, 'lr': 0.00015487645625084448, 'weight_decay': 2.3998232208869246e-07, 'epochs': 258, 'loss': 'mse', 'optimizer': 'adam', 'graph_mode': 'off', 'use_snp_selection': True, 'num_snps': 19787}. Best is trial 23 with value: 0.13083647489442385.
[I 2025-12-05 14:49:15,260] Trial 98 finished with value: 0.04831586504229966 and parameters: {'model_type': 'mlp', 'hidden_dims': '[256, 128]', 'dropout': 0.5799271749167072, 'batch_norm': False, 'lr': 1.931218318799684e-06, 'weight_decay': 4.276490345204348e-06, 'epochs': 298, 'loss': 'mae', 'optimizer': 'adam', 'graph_mode': 'off', 'use_snp_selection': False}. Best is trial 23 with value: 0.13083647489442385.
[I 2025-12-05 14:49:16,470] Trial 99 finished with value: 0.0844418128261957 and parameters: {'model_type': 'mlp', 'hidden_dims': '[512, 256]', 'dropout': 0.29497552917977893, 'batch_norm': False, 'lr': 2.2692315561689083e-05, 'weight_decay': 2.020272676306395e-06, 'epochs': 268, 'loss': 'mse', 'optimizer': 'adam', 'graph_mode': 'off', 'use_snp_selection': True, 'num_snps': 7496}. Best is trial 23 with value: 0.13083647489442385.
[I 2025-12-05 14:49:17,878] Trial 100 finished with value: 0.0902043234328372 and parameters: {'model_type': 'mlp', 'hidden_dims': '[256, 128]', 'dropout': 0.5311318351386707, 'batch_norm': True, 'lr': 2.9638093450678578e-05, 'weight_decay': 4.9645314589227135e-05, 'epochs': 279, 'loss': 'mse', 'optimizer': 'adam', 'graph_mode': 'off', 'use_snp_selection': False}. Best is trial 23 with value: 0.13083647489442385.
[I 2025-12-05 14:49:20,266] Trial 101 finished with value: 0.12053471501422733 and parameters: {'model_type': 'mlp', 'hidden_dims': '[512, 128]', 'dropout': 0.36063511547042065, 'batch_norm': False, 'lr': 8.772561189741677e-06, 'weight_decay': 9.691236715080761e-05, 'epochs': 289, 'loss': 'mse', 'optimizer': 'adam', 'graph_mode': 'off', 'use_snp_selection': False}. Best is trial 23 with value: 0.13083647489442385.
[I 2025-12-05 14:49:21,276] Trial 102 finished with value: 0.1039028036959973 and parameters: {'model_type': 'mlp', 'hidden_dims': '[256, 128]', 'dropout': 0.20620686381067185, 'batch_norm': False, 'lr': 1.4192774812922098e-05, 'weight_decay': 0.0001597293253052937, 'epochs': 148, 'loss': 'mse', 'optimizer': 'adam', 'graph_mode': 'off', 'use_snp_selection': False}. Best is trial 23 with value: 0.13083647489442385.
[I 2025-12-05 14:49:22,984] Trial 103 finished with value: 0.09389616111234504 and parameters: {'model_type': 'mlp', 'hidden_dims': '[512, 64]', 'dropout': 0.45312914027449985, 'batch_norm': False, 'lr': 2.3194330156014034e-05, 'weight_decay': 6.468539892929775e-05, 'epochs': 175, 'loss': 'mse', 'optimizer': 'adam', 'graph_mode': 'off', 'use_snp_selection': False}. Best is trial 23 with value: 0.13083647489442385.
[I 2025-12-05 14:49:24,148] Trial 104 finished with value: 0.1014006326469476 and parameters: {'model_type': 'mlp', 'hidden_dims': '[256, 128, 64]', 'dropout': 0.40952556092947945, 'batch_norm': False, 'lr': 0.0004775165335288754, 'weight_decay': 0.00035835157859427484, 'epochs': 186, 'loss': 'mse', 'optimizer': 'adam', 'graph_mode': 'off', 'use_snp_selection': False}. Best is trial 23 with value: 0.13083647489442385.
[I 2025-12-05 14:49:25,559] Trial 105 finished with value: 0.11271527830864975 and parameters: {'model_type': 'mlp', 'hidden_dims': '[512, 256]', 'dropout': 0.17522497577188673, 'batch_norm': False, 'lr': 1.8758985064531612e-05, 'weight_decay': 0.0002714820840565347, 'epochs': 113, 'loss': 'mse', 'optimizer': 'adam', 'graph_mode': 'off', 'use_snp_selection': False}. Best is trial 23 with value: 0.13083647489442385.
[I 2025-12-05 14:49:26,784] Trial 106 finished with value: 0.12260725933214275 and parameters: {'model_type': 'mlp', 'hidden_dims': '[256, 128]', 'dropout': 0.5546109875797548, 'batch_norm': False, 'lr': 1.5612857785234206e-05, 'weight_decay': 7.701290198643829e-06, 'epochs': 212, 'loss': 'mse', 'optimizer': 'adam', 'graph_mode': 'off', 'use_snp_selection': False}. Best is trial 23 with value: 0.13083647489442385.
[I 2025-12-05 14:49:28,063] Trial 107 finished with value: 0.05433204037707237 and parameters: {'model_type': 'mlp', 'hidden_dims': '[256, 128]', 'dropout': 0.3450717118268024, 'batch_norm': False, 'lr': 5.872182473011022e-06, 'weight_decay': 0.0007250957678686341, 'epochs': 199, 'loss': 'mse', 'optimizer': 'adam', 'graph_mode': 'off', 'use_snp_selection': True, 'num_snps': 13043}. Best is trial 23 with value: 0.13083647489442385.
[I 2025-12-05 14:49:30,548] Trial 108 finished with value: 0.10046268373190254 and parameters: {'model_type': 'mlp', 'hidden_dims': '[512, 128]', 'dropout': 0.3754298261443289, 'batch_norm': False, 'lr': 4.633547761164983e-05, 'weight_decay': 5.692563396909156e-06, 'epochs': 305, 'loss': 'mae', 'optimizer': 'adam', 'graph_mode': 'off', 'use_snp_selection': False}. Best is trial 23 with value: 0.13083647489442385.
[I 2025-12-05 14:49:33,749] Trial 109 finished with value: 0.11152826774348644 and parameters: {'model_type': 'mlp', 'hidden_dims': '[512, 256]', 'dropout': 0.3152967422969682, 'batch_norm': False, 'lr': 2.8623424588304606e-05, 'weight_decay': 1.535692862265978e-05, 'epochs': 250, 'loss': 'mse', 'optimizer': 'adam', 'graph_mode': 'off', 'use_snp_selection': True, 'num_snps': 47059}. Best is trial 23 with value: 0.13083647489442385.
[I 2025-12-05 14:49:34,729] Trial 110 finished with value: 0.10449762514698266 and parameters: {'model_type': 'mlp', 'hidden_dims': '[128, 64]', 'dropout': 0.20676270191042107, 'batch_norm': False, 'lr': 1.1423951215463349e-05, 'weight_decay': 1.042919193855568e-05, 'epochs': 262, 'loss': 'mse', 'optimizer': 'adam', 'graph_mode': 'off', 'use_snp_selection': False}. Best is trial 23 with value: 0.13083647489442385.
[I 2025-12-05 14:49:35,992] Trial 111 finished with value: 0.09677727847648178 and parameters: {'model_type': 'mlp', 'hidden_dims': '[256, 128]', 'dropout': 0.5435846078064045, 'batch_norm': False, 'lr': 1.574488258253885e-05, 'weight_decay': 1.9194422108939073e-05, 'epochs': 219, 'loss': 'mse', 'optimizer': 'adam', 'graph_mode': 'off', 'use_snp_selection': False}. Best is trial 23 with value: 0.13083647489442385.
[I 2025-12-05 14:49:37,221] Trial 112 finished with value: 0.10193947016113337 and parameters: {'model_type': 'mlp', 'hidden_dims': '[256, 128]', 'dropout': 0.5617226319243257, 'batch_norm': False, 'lr': 0.0006967391277134383, 'weight_decay': 7.83043396647392e-06, 'epochs': 212, 'loss': 'mse', 'optimizer': 'adam', 'graph_mode': 'off', 'use_snp_selection': False}. Best is trial 23 with value: 0.13083647489442385.
[I 2025-12-05 14:49:38,269] Trial 113 finished with value: 0.09532374247928715 and parameters: {'model_type': 'mlp', 'hidden_dims': '[256, 128]', 'dropout': 0.5105330588484642, 'batch_norm': False, 'lr': 1.4828204113625423e-05, 'weight_decay': 0.00012063847643760403, 'epochs': 159, 'loss': 'mse', 'optimizer': 'adam', 'graph_mode': 'off', 'use_snp_selection': False}. Best is trial 23 with value: 0.13083647489442385.
[I 2025-12-05 14:49:39,523] Trial 114 finished with value: 0.07633588387079743 and parameters: {'model_type': 'mlp', 'hidden_dims': '[256, 128]', 'dropout': 0.5729832192497349, 'batch_norm': False, 'lr': 9.773545732730798e-06, 'weight_decay': 1.4340087320828227e-07, 'epochs': 232, 'loss': 'mse', 'optimizer': 'adam', 'graph_mode': 'off', 'use_snp_selection': False}. Best is trial 23 with value: 0.13083647489442385.
[I 2025-12-05 14:49:41,030] Trial 115 finished with value: 0.10433760412394033 and parameters: {'model_type': 'mlp', 'hidden_dims': '[256, 128]', 'dropout': 0.5964638610572645, 'batch_norm': False, 'lr': 3.770889659487196e-05, 'weight_decay': 3.906059445054543e-06, 'epochs': 321, 'loss': 'mse', 'optimizer': 'adam', 'graph_mode': 'off', 'use_snp_selection': False}. Best is trial 23 with value: 0.13083647489442385.
[I 2025-12-05 14:49:42,917] Trial 116 finished with value: 0.08959141290885891 and parameters: {'model_type': 'mlp', 'hidden_dims': '[512, 64]', 'dropout': 0.49317602948905076, 'batch_norm': False, 'lr': 2.355828286303753e-05, 'weight_decay': 0.0005454167814772733, 'epochs': 205, 'loss': 'mse', 'optimizer': 'adam', 'graph_mode': 'off', 'use_snp_selection': False}. Best is trial 23 with value: 0.13083647489442385.
[I 2025-12-05 14:49:46,168] Trial 117 finished with value: 0.11850026161504529 and parameters: {'model_type': 'mlp', 'hidden_dims': '[256, 128, 64]', 'dropout': 0.41762656023922967, 'batch_norm': True, 'lr': 0.0008943577523567521, 'weight_decay': 2.816699131928253e-05, 'epochs': 294, 'loss': 'mae', 'optimizer': 'adam', 'graph_mode': 'off', 'use_snp_selection': True, 'num_snps': 55916}. Best is trial 23 with value: 0.13083647489442385.
[I 2025-12-05 14:49:46,995] Trial 118 finished with value: 0.02864762282312988 and parameters: {'model_type': 'mlp', 'hidden_dims': '[256, 128]', 'dropout': 0.5258463589433621, 'batch_norm': False, 'lr': 1.6536598100832013e-05, 'weight_decay': 3.0637600520964395e-06, 'epochs': 56, 'loss': 'mse', 'optimizer': 'adam', 'graph_mode': 'off', 'use_snp_selection': False}. Best is trial 23 with value: 0.13083647489442385.
[I 2025-12-05 14:49:48,926] Trial 119 finished with value: 0.10826965502284631 and parameters: {'model_type': 'mlp', 'hidden_dims': '[512, 256]', 'dropout': 0.5545232155472961, 'batch_norm': False, 'lr': 2.0246250591499387e-05, 'weight_decay': 8.504434611823429e-05, 'epochs': 226, 'loss': 'mse', 'optimizer': 'adam', 'graph_mode': 'off', 'use_snp_selection': True, 'num_snps': 24589}. Best is trial 23 with value: 0.13083647489442385.
[I 2025-12-05 14:49:50,033] Trial 120 finished with value: 0.08058609200211031 and parameters: {'model_type': 'mlp', 'hidden_dims': '[256, 128]', 'dropout': 0.35561892665238637, 'batch_norm': True, 'lr': 7.854113378788921e-06, 'weight_decay': 5.71106400991146e-06, 'epochs': 179, 'loss': 'mae', 'optimizer': 'adam', 'graph_mode': 'off', 'use_snp_selection': False}. Best is trial 23 with value: 0.13083647489442385.
[I 2025-12-05 14:49:51,688] Trial 121 finished with value: 0.12031283757297216 and parameters: {'model_type': 'mlp', 'hidden_dims': '[512, 256]', 'dropout': 0.32798054696035817, 'batch_norm': True, 'lr': 0.0008957286995928015, 'weight_decay': 0.0009871710961710594, 'epochs': 269, 'loss': 'mae', 'optimizer': 'adam', 'graph_mode': 'off', 'use_snp_selection': True, 'num_snps': 17325}. Best is trial 23 with value: 0.13083647489442385.
