[I 2025-12-06 05:06:25,194] Trial 132 finished with value: 0.2515915730424978 and parameters: {'model_type': 'mlp', 'hidden_dims': '[256, 128, 64]', 'dropout': 0.503215798733431, 'batch_norm': False, 'lr': 4.230354558253383e-06, 'weight_decay': 6.434668123057793e-05, 'epochs': 317, 'loss': 'mae', 'optimizer': 'adam', 'graph_mode': 'off', 'use_snp_selection': False}. Best is trial 132 with value: 0.2515915730424978.
[I 2025-12-06 05:07:13,699] Trial 133 finished with value: 0.23746338465825936 and parameters: {'model_type': 'mlp', 'hidden_dims': '[256, 128, 64]', 'dropout': 0.49905057944355874, 'batch_norm': False, 'lr': 4.2269944430570915e-06, 'weight_decay': 6.371928074932237e-05, 'epochs': 312, 'loss': 'mae', 'optimizer': 'adam', 'graph_mode': 'off', 'use_snp_selection': False}. Best is trial 132 with value: 0.2515915730424978.
[I 2025-12-06 05:08:04,142] Trial 134 finished with value: 0.24559161472312505 and parameters: {'model_type': 'mlp', 'hidden_dims': '[256, 128, 64]', 'dropout': 0.5159585785986248, 'batch_norm': False, 'lr': 2.777066464370006e-06, 'weight_decay': 0.00012600521517956202, 'epochs': 325, 'loss': 'mae', 'optimizer': 'adam', 'graph_mode': 'off', 'use_snp_selection': False}. Best is trial 132 with value: 0.2515915730424978.
[I 2025-12-06 05:08:53,516] Trial 135 finished with value: 0.2370450720739196 and parameters: {'model_type': 'mlp', 'hidden_dims': '[256, 128, 64]', 'dropout': 0.5144495852502939, 'batch_norm': False, 'lr': 2.663357994167615e-06, 'weight_decay': 0.00013880383815432563, 'epochs': 317, 'loss': 'mae', 'optimizer': 'adam', 'graph_mode': 'off', 'use_snp_selection': False}. Best is trial 132 with value: 0.2515915730424978.
[I 2025-12-06 05:09:45,171] Trial 136 finished with value: 0.2333588375871943 and parameters: {'model_type': 'mlp', 'hidden_dims': '[256, 128, 64]', 'dropout': 0.5053840303701539, 'batch_norm': False, 'lr': 2.272882623657082e-06, 'weight_decay': 8.219179915187782e-05, 'epochs': 334, 'loss': 'mae', 'optimizer': 'adam', 'graph_mode': 'off', 'use_snp_selection': False}. Best is trial 132 with value: 0.2515915730424978.
[I 2025-12-06 05:10:33,306] Trial 137 finished with value: 0.23765189579470408 and parameters: {'model_type': 'mlp', 'hidden_dims': '[256, 128, 64]', 'dropout': 0.5272281057522701, 'batch_norm': False, 'lr': 3.3272799040013144e-06, 'weight_decay': 5.991103562011025e-05, 'epochs': 309, 'loss': 'mae', 'optimizer': 'adam', 'graph_mode': 'off', 'use_snp_selection': False}. Best is trial 132 with value: 0.2515915730424978.
[I 2025-12-06 05:11:23,607] Trial 138 finished with value: 0.2353659620420522 and parameters: {'model_type': 'mlp', 'hidden_dims': '[256, 128, 64]', 'dropout': 0.4837393537937441, 'batch_norm': False, 'lr': 2.8484266378244948e-06, 'weight_decay': 0.00022115573627535186, 'epochs': 325, 'loss': 'mse', 'optimizer': 'adam', 'graph_mode': 'off', 'use_snp_selection': False}. Best is trial 132 with value: 0.2515915730424978.
[I 2025-12-06 05:12:28,074] Trial 139 finished with value: 0.1781340751331163 and parameters: {'model_type': 'mlp', 'hidden_dims': '[256, 128, 64]', 'dropout': 0.49497008736343884, 'batch_norm': True, 'lr': 3.799173821934582e-06, 'weight_decay': 0.00010287938178416719, 'epochs': 304, 'loss': 'mae', 'optimizer': 'adam', 'graph_mode': 'off', 'use_snp_selection': True, 'num_snps': 37939}. Best is trial 132 with value: 0.2515915730424978.
[I 2025-12-06 05:13:21,472] Trial 140 finished with value: 0.2387583452139102 and parameters: {'model_type': 'mlp', 'hidden_dims': '[256, 128, 64]', 'dropout': 0.515683821036381, 'batch_norm': False, 'lr': 2.00946205638796e-06, 'weight_decay': 0.0003560349547210096, 'epochs': 350, 'loss': 'mae', 'optimizer': 'adam', 'graph_mode': 'off', 'use_snp_selection': False}. Best is trial 132 with value: 0.2515915730424978.
[I 2025-12-06 05:14:11,037] Trial 141 finished with value: 0.2469696243424349 and parameters: {'model_type': 'mlp', 'hidden_dims': '[256, 128, 64]', 'dropout': 0.4783010837074524, 'batch_norm': False, 'lr': 4.587312589523979e-06, 'weight_decay': 3.352043446389593e-05, 'epochs': 320, 'loss': 'mae', 'optimizer': 'adam', 'graph_mode': 'off', 'use_snp_selection': False}. Best is trial 132 with value: 0.2515915730424978.
[I 2025-12-06 05:15:00,542] Trial 142 finished with value: 0.21841419800736742 and parameters: {'model_type': 'mlp', 'hidden_dims': '[256, 128, 64]', 'dropout': 0.5042605881670362, 'batch_norm': False, 'lr': 1.4884844954449572e-06, 'weight_decay': 2.7323981839967337e-05, 'epochs': 319, 'loss': 'mae', 'optimizer': 'adam', 'graph_mode': 'off', 'use_snp_selection': False}. Best is trial 132 with value: 0.2515915730424978.
[I 2025-12-06 05:15:46,985] Trial 143 finished with value: 0.24242750465866675 and parameters: {'model_type': 'mlp', 'hidden_dims': '[256, 128, 64]', 'dropout': 0.4775237306012066, 'batch_norm': False, 'lr': 4.512896382144311e-06, 'weight_decay': 3.348376640927366e-05, 'epochs': 297, 'loss': 'mae', 'optimizer': 'adam', 'graph_mode': 'off', 'use_snp_selection': False}. Best is trial 132 with value: 0.2515915730424978.
[I 2025-12-06 05:16:37,818] Trial 144 finished with value: 0.25094750568711127 and parameters: {'model_type': 'mlp', 'hidden_dims': '[256, 128, 64]', 'dropout': 0.48515370732027285, 'batch_norm': False, 'lr': 3.0980355559466526e-06, 'weight_decay': 4.29369422874825e-05, 'epochs': 329, 'loss': 'mae', 'optimizer': 'adam', 'graph_mode': 'off', 'use_snp_selection': False}. Best is trial 132 with value: 0.2515915730424978.
[I 2025-12-06 05:17:30,264] Trial 145 finished with value: 0.2461811489466954 and parameters: {'model_type': 'mlp', 'hidden_dims': '[256, 128, 64]', 'dropout': 0.49242964575452364, 'batch_norm': False, 'lr': 2.8282128319777004e-06, 'weight_decay': 4.6254729426707364e-05, 'epochs': 340, 'loss': 'mae', 'optimizer': 'adam', 'graph_mode': 'off', 'use_snp_selection': False}. Best is trial 132 with value: 0.2515915730424978.
[I 2025-12-06 05:18:23,025] Trial 146 finished with value: 0.24185696799703033 and parameters: {'model_type': 'mlp', 'hidden_dims': '[256, 128, 64]', 'dropout': 0.458813385657477, 'batch_norm': False, 'lr': 2.549048539789835e-06, 'weight_decay': 4.515130327306587e-05, 'epochs': 343, 'loss': 'mae', 'optimizer': 'adam', 'graph_mode': 'off', 'use_snp_selection': False}. Best is trial 132 with value: 0.2515915730424978.
[I 2025-12-06 05:19:15,080] Trial 147 finished with value: 0.2493438006698884 and parameters: {'model_type': 'mlp', 'hidden_dims': '[256, 128, 64]', 'dropout': 0.48506417942827734, 'batch_norm': False, 'lr': 2.9732310091694743e-06, 'weight_decay': 4.197641808319246e-05, 'epochs': 338, 'loss': 'mae', 'optimizer': 'adam', 'graph_mode': 'off', 'use_snp_selection': False}. Best is trial 132 with value: 0.2515915730424978.
[I 2025-12-06 05:20:07,121] Trial 148 finished with value: 0.22509049630197628 and parameters: {'model_type': 'mlp', 'hidden_dims': '[256, 128, 64]', 'dropout': 0.48494859027911497, 'batch_norm': False, 'lr': 1.7682509876455889e-06, 'weight_decay': 4.056385871441958e-05, 'epochs': 338, 'loss': 'mae', 'optimizer': 'adam', 'graph_mode': 'off', 'use_snp_selection': False}. Best is trial 132 with value: 0.2515915730424978.
[I 2025-12-06 05:20:57,675] Trial 149 finished with value: 0.23831428291571138 and parameters: {'model_type': 'mlp', 'hidden_dims': '[256, 128, 64]', 'dropout': 0.4694108597111583, 'batch_norm': False, 'lr': 2.9965446170064497e-06, 'weight_decay': 5.765614087742765e-05, 'epochs': 327, 'loss': 'mae', 'optimizer': 'adam', 'graph_mode': 'off', 'use_snp_selection': False}. Best is trial 132 with value: 0.2515915730424978.
[I 2025-12-06 05:22:02,522] Trial 0 finished with value: 0.16995236547080758 and parameters: {'model_type': 'mlp', 'hidden_dims': '[128, 64]', 'dropout': 0.199031432379812, 'batch_norm': True, 'lr': 1.8408544111075837e-06, 'weight_decay': 5.5136510071208614e-05, 'epochs': 336, 'loss': 'mae', 'optimizer': 'adam', 'graph_mode': 'off', 'use_snp_selection': True, 'num_snps': 43862}. Best is trial 0 with value: 0.16995236547080758.
[I 2025-12-06 05:22:42,373] Trial 1 finished with value: 0.275018634004912 and parameters: {'model_type': 'mlp', 'hidden_dims': '[256, 128]', 'dropout': 0.4370668075331726, 'batch_norm': True, 'lr': 7.133471581159139e-05, 'weight_decay': 1.128633586803549e-05, 'epochs': 242, 'loss': 'mae', 'optimizer': 'adam', 'graph_mode': 'off', 'use_snp_selection': False}. Best is trial 1 with value: 0.275018634004912.
[I 2025-12-06 05:23:18,413] Trial 2 finished with value: 0.2340750818739507 and parameters: {'model_type': 'mlp', 'hidden_dims': '[256, 128, 64]', 'dropout': 0.41314357415569625, 'batch_norm': False, 'lr': 3.952233718592101e-06, 'weight_decay': 0.00026754769258252603, 'epochs': 149, 'loss': 'mse', 'optimizer': 'adam', 'graph_mode': 'off', 'use_snp_selection': True, 'num_snps': 11571}. Best is trial 1 with value: 0.275018634004912.
[I 2025-12-06 05:24:50,760] Trial 3 finished with value: 0.285052822493798 and parameters: {'model_type': 'mlp', 'hidden_dims': '[512, 64]', 'dropout': 0.5938127374509361, 'batch_norm': False, 'lr': 5.67704586114731e-06, 'weight_decay': 2.4518087630137052e-05, 'epochs': 320, 'loss': 'mae', 'optimizer': 'adam', 'graph_mode': 'off', 'use_snp_selection': False}. Best is trial 3 with value: 0.285052822493798.
[I 2025-12-06 05:26:14,188] Trial 4 finished with value: 0.22141239220781928 and parameters: {'model_type': 'mlp', 'hidden_dims': '[512, 128]', 'dropout': 0.25746343592134413, 'batch_norm': True, 'lr': 1.3467657668402788e-06, 'weight_decay': 0.00033087251918647806, 'epochs': 277, 'loss': 'mse', 'optimizer': 'adam', 'graph_mode': 'off', 'use_snp_selection': True, 'num_snps': 36675}. Best is trial 3 with value: 0.285052822493798.
[I 2025-12-06 05:27:12,624] Trial 5 finished with value: 0.20094004931270254 and parameters: {'model_type': 'mlp', 'hidden_dims': '[512, 64]', 'dropout': 0.38275350994408375, 'batch_norm': True, 'lr': 1.5586664309232824e-06, 'weight_decay': 0.0008227664668621182, 'epochs': 145, 'loss': 'mae', 'optimizer': 'adam', 'graph_mode': 'off', 'use_snp_selection': True, 'num_snps': 32148}. Best is trial 3 with value: 0.285052822493798.
[I 2025-12-06 05:27:45,538] Trial 6 finished with value: 0.2652703736751823 and parameters: {'model_type': 'mlp', 'hidden_dims': '[256, 128]', 'dropout': 0.3930109900265879, 'batch_norm': False, 'lr': 4.892964372128395e-05, 'weight_decay': 1.5809549317992182e-06, 'epochs': 199, 'loss': 'mse', 'optimizer': 'adam', 'graph_mode': 'off', 'use_snp_selection': False}. Best is trial 3 with value: 0.285052822493798.
[I 2025-12-06 05:28:19,121] Trial 7 finished with value: 0.25300850291590754 and parameters: {'model_type': 'mlp', 'hidden_dims': '[512, 256]', 'dropout': 0.15343979219678458, 'batch_norm': True, 'lr': 6.234003099047341e-05, 'weight_decay': 3.894760610535477e-07, 'epochs': 97, 'loss': 'mse', 'optimizer': 'adam', 'graph_mode': 'off', 'use_snp_selection': False}. Best is trial 3 with value: 0.285052822493798.
[I 2025-12-06 05:29:51,186] Trial 8 finished with value: 0.2798214690816574 and parameters: {'model_type': 'mlp', 'hidden_dims': '[512, 128]', 'dropout': 0.10743001231661406, 'batch_norm': True, 'lr': 0.00023728538449271062, 'weight_decay': 1.7629071578048637e-05, 'epochs': 312, 'loss': 'mae', 'optimizer': 'adam', 'graph_mode': 'off', 'use_snp_selection': False}. Best is trial 3 with value: 0.285052822493798.
[I 2025-12-06 05:30:46,096] Trial 9 finished with value: 0.2800717404685534 and parameters: {'model_type': 'mlp', 'hidden_dims': '[512, 64]', 'dropout': 0.14505336736221927, 'batch_norm': True, 'lr': 5.8619638388111826e-05, 'weight_decay': 6.200156172669308e-07, 'epochs': 175, 'loss': 'mse', 'optimizer': 'adam', 'graph_mode': 'off', 'use_snp_selection': False}. Best is trial 3 with value: 0.285052822493798.
[I 2025-12-06 05:31:08,146] Trial 10 finished with value: 0.27599892422783673 and parameters: {'model_type': 'mlp', 'hidden_dims': '[512, 64]', 'dropout': 0.5885461262002587, 'batch_norm': False, 'lr': 8.769366258768696e-06, 'weight_decay': 2.78273193871783e-06, 'epochs': 55, 'loss': 'mae', 'optimizer': 'adam', 'graph_mode': 'off', 'use_snp_selection': False}. Best is trial 3 with value: 0.285052822493798.
[I 2025-12-06 05:32:12,207] Trial 11 finished with value: 0.2630302050472893 and parameters: {'model_type': 'mlp', 'hidden_dims': '[512, 64]', 'dropout': 0.583942291816117, 'batch_norm': False, 'lr': 1.422933652790185e-05, 'weight_decay': 1.2045055692919657e-07, 'epochs': 213, 'loss': 'mse', 'optimizer': 'adam', 'graph_mode': 'off', 'use_snp_selection': False}. Best is trial 3 with value: 0.285052822493798.
[I 2025-12-06 05:33:00,118] Trial 12 finished with value: 0.18858505634516223 and parameters: {'model_type': 'mlp', 'hidden_dims': '[512, 64]', 'dropout': 0.2637316882220091, 'batch_norm': False, 'lr': 0.0006753264773209732, 'weight_decay': 1.6488595357534196e-06, 'epochs': 154, 'loss': 'mae', 'optimizer': 'adam', 'graph_mode': 'off', 'use_snp_selection': False}. Best is trial 3 with value: 0.285052822493798.
[I 2025-12-06 05:34:17,232] Trial 13 finished with value: 0.27186453668073735 and parameters: {'model_type': 'mlp', 'hidden_dims': '[512, 64]', 'dropout': 0.5086194929129976, 'batch_norm': False, 'lr': 1.4304506621636526e-05, 'weight_decay': 4.373608364627903e-05, 'epochs': 261, 'loss': 'mse', 'optimizer': 'adam', 'graph_mode': 'off', 'use_snp_selection': False}. Best is trial 3 with value: 0.285052822493798.
[I 2025-12-06 05:34:44,259] Trial 14 finished with value: 0.26241945677591844 and parameters: {'model_type': 'mlp', 'hidden_dims': '[128, 64]', 'dropout': 0.3012984444538551, 'batch_norm': True, 'lr': 0.00017558188744418174, 'weight_decay': 4.57067734295802e-06, 'epochs': 293, 'loss': 'mse', 'optimizer': 'adam', 'graph_mode': 'off', 'use_snp_selection': False}. Best is trial 3 with value: 0.285052822493798.
[I 2025-12-06 05:35:53,345] Trial 15 finished with value: 0.27496555207394247 and parameters: {'model_type': 'mlp', 'hidden_dims': '[512, 256]', 'dropout': 0.48263162073930665, 'batch_norm': False, 'lr': 2.200457974768058e-05, 'weight_decay': 4.081624813577402e-07, 'epochs': 231, 'loss': 'mae', 'optimizer': 'adam', 'graph_mode': 'off', 'use_snp_selection': False}. Best is trial 3 with value: 0.285052822493798.
[I 2025-12-06 05:36:49,383] Trial 16 finished with value: 0.23662657556940223 and parameters: {'model_type': 'mlp', 'hidden_dims': '[256, 128, 64]', 'dropout': 0.3148124780833136, 'batch_norm': True, 'lr': 6.013316929814413e-06, 'weight_decay': 3.895033692555648e-05, 'epochs': 350, 'loss': 'mse', 'optimizer': 'adam', 'graph_mode': 'off', 'use_snp_selection': False}. Best is trial 3 with value: 0.285052822493798.
[I 2025-12-06 05:37:26,544] Trial 17 finished with value: 0.2885683625132243 and parameters: {'model_type': 'mlp', 'hidden_dims': '[512, 64]', 'dropout': 0.5199905774474576, 'batch_norm': False, 'lr': 0.00015757341301155474, 'weight_decay': 5.666950082267898e-07, 'epochs': 113, 'loss': 'mae', 'optimizer': 'adam', 'graph_mode': 'off', 'use_snp_selection': False}. Best is trial 17 with value: 0.2885683625132243.
[I 2025-12-06 05:38:39,924] Trial 18 finished with value: 0.13551090700343169 and parameters: {'model_type': 'mlp', 'hidden_dims': '[512, 64]', 'dropout': 0.5272377108188301, 'batch_norm': False, 'lr': 0.0006372689902154905, 'weight_decay': 5.409591144113358e-06, 'epochs': 103, 'loss': 'mae', 'optimizer': 'adam', 'graph_mode': 'off', 'use_snp_selection': True, 'num_snps': 58241}. Best is trial 17 with value: 0.2885683625132243.
[I 2025-12-06 05:39:00,097] Trial 19 finished with value: 0.20195444512887342 and parameters: {'model_type': 'mlp', 'hidden_dims': '[512, 64]', 'dropout': 0.5463690211280188, 'batch_norm': False, 'lr': 0.00015983041030594416, 'weight_decay': 1.1354159408743119e-07, 'epochs': 49, 'loss': 'mae', 'optimizer': 'adam', 'graph_mode': 'off', 'use_snp_selection': False}. Best is trial 17 with value: 0.2885683625132243.
[I 2025-12-06 05:39:34,234] Trial 20 finished with value: 0.2833277392181158 and parameters: {'model_type': 'mlp', 'hidden_dims': '[512, 128]', 'dropout': 0.4702777660605099, 'batch_norm': False, 'lr': 3.324514570871408e-06, 'weight_decay': 0.00015711537877451736, 'epochs': 100, 'loss': 'mae', 'optimizer': 'adam', 'graph_mode': 'off', 'use_snp_selection': False}. Best is trial 17 with value: 0.2885683625132243.
[I 2025-12-06 05:40:05,543] Trial 21 finished with value: 0.2696947933807018 and parameters: {'model_type': 'mlp', 'hidden_dims': '[512, 128]', 'dropout': 0.45631329040701424, 'batch_norm': False, 'lr': 3.184392811999443e-06, 'weight_decay': 0.00012400061805349644, 'epochs': 89, 'loss': 'mae', 'optimizer': 'adam', 'graph_mode': 'off', 'use_snp_selection': False}. Best is trial 17 with value: 0.2885683625132243.
[I 2025-12-06 05:40:46,778] Trial 22 finished with value: 0.27044590623294285 and parameters: {'model_type': 'mlp', 'hidden_dims': '[512, 128]', 'dropout': 0.5466149221009567, 'batch_norm': False, 'lr': 2.625353214218878e-06, 'weight_decay': 0.0001196538411982376, 'epochs': 126, 'loss': 'mae', 'optimizer': 'adam', 'graph_mode': 'off', 'use_snp_selection': False}. Best is trial 17 with value: 0.2885683625132243.
[I 2025-12-06 05:41:14,075] Trial 23 finished with value: 0.26765613457856446 and parameters: {'model_type': 'mlp', 'hidden_dims': '[512, 128]', 'dropout': 0.5968415406439916, 'batch_norm': False, 'lr': 6.807064240273762e-06, 'weight_decay': 3.2201061262144025e-05, 'epochs': 74, 'loss': 'mae', 'optimizer': 'adam', 'graph_mode': 'off', 'use_snp_selection': False}. Best is trial 17 with value: 0.2885683625132243.
[I 2025-12-06 05:41:36,639] Trial 24 finished with value: 0.28565421456002466 and parameters: {'model_type': 'mlp', 'hidden_dims': '[256, 128]', 'dropout': 0.4851565581561931, 'batch_norm': False, 'lr': 2.7013005792357815e-05, 'weight_decay': 0.0001270704558237165, 'epochs': 119, 'loss': 'mae', 'optimizer': 'adam', 'graph_mode': 'off', 'use_snp_selection': False}. Best is trial 17 with value: 0.2885683625132243.
[I 2025-12-06 05:42:07,634] Trial 25 finished with value: 0.2685648422302854 and parameters: {'model_type': 'mlp', 'hidden_dims': '[256, 128]', 'dropout': 0.5077793534481079, 'batch_norm': False, 'lr': 2.7997812624196e-05, 'weight_decay': 0.0008835998501523608, 'epochs': 181, 'loss': 'mae', 'optimizer': 'adam', 'graph_mode': 'off', 'use_snp_selection': False}. Best is trial 17 with value: 0.2885683625132243.
[I 2025-12-06 05:42:38,591] Trial 26 finished with value: 0.2595466616905616 and parameters: {'model_type': 'mlp', 'hidden_dims': '[256, 128]', 'dropout': 0.5568241654378683, 'batch_norm': False, 'lr': 0.00028027139785017773, 'weight_decay': 2.059455957337608e-05, 'epochs': 128, 'loss': 'mae', 'optimizer': 'adam', 'graph_mode': 'off', 'use_snp_selection': True, 'num_snps': 3842}. Best is trial 17 with value: 0.2885683625132243.
[I 2025-12-06 05:43:01,678] Trial 27 finished with value: 0.2773328309866764 and parameters: {'model_type': 'mlp', 'hidden_dims': '[256, 128]', 'dropout': 0.4925336421747884, 'batch_norm': False, 'lr': 1.4453086535645407e-05, 'weight_decay': 6.9353603097244e-06, 'epochs': 123, 'loss': 'mae', 'optimizer': 'adam', 'graph_mode': 'off', 'use_snp_selection': False}. Best is trial 17 with value: 0.2885683625132243.
[I 2025-12-06 05:43:19,187] Trial 28 finished with value: 0.2783789012859867 and parameters: {'model_type': 'mlp', 'hidden_dims': '[128, 64]', 'dropout': 0.3605904672314801, 'batch_norm': False, 'lr': 0.00010358006723701865, 'weight_decay': 8.893404912157771e-05, 'epochs': 170, 'loss': 'mae', 'optimizer': 'adam', 'graph_mode': 'off', 'use_snp_selection': False}. Best is trial 17 with value: 0.2885683625132243.
[I 2025-12-06 05:44:00,196] Trial 29 finished with value: 0.2940019562924307 and parameters: {'model_type': 'mlp', 'hidden_dims': '[512, 256]', 'dropout': 0.4371891926530383, 'batch_norm': False, 'lr': 0.0003881124774636409, 'weight_decay': 6.234967680617935e-05, 'epochs': 65, 'loss': 'mae', 'optimizer': 'adam', 'graph_mode': 'off', 'use_snp_selection': True, 'num_snps': 19468}. Best is trial 29 with value: 0.2940019562924307.
[I 2025-12-06 05:44:39,326] Trial 30 finished with value: 0.2929114521705429 and parameters: {'model_type': 'mlp', 'hidden_dims': '[512, 256]', 'dropout': 0.43688756758113795, 'batch_norm': False, 'lr': 0.00029856307973287444, 'weight_decay': 6.183330182145208e-05, 'epochs': 58, 'loss': 'mae', 'optimizer': 'adam', 'graph_mode': 'off', 'use_snp_selection': True, 'num_snps': 18365}. Best is trial 29 with value: 0.2940019562924307.
[I 2025-12-06 05:45:18,867] Trial 31 finished with value: 0.2900638921003692 and parameters: {'model_type': 'mlp', 'hidden_dims': '[512, 256]', 'dropout': 0.43549563149822623, 'batch_norm': False, 'lr': 0.0004124547525341467, 'weight_decay': 7.109419912458816e-05, 'epochs': 70, 'loss': 'mae', 'optimizer': 'adam', 'graph_mode': 'off', 'use_snp_selection': True, 'num_snps': 18314}. Best is trial 29 with value: 0.2940019562924307.
[I 2025-12-06 05:45:57,511] Trial 32 finished with value: 0.2833654898145254 and parameters: {'model_type': 'mlp', 'hidden_dims': '[512, 256]', 'dropout': 0.44182355442770344, 'batch_norm': False, 'lr': 0.00038041499928177265, 'weight_decay': 6.482445850017591e-05, 'epochs': 40, 'loss': 'mae', 'optimizer': 'adam', 'graph_mode': 'off', 'use_snp_selection': True, 'num_snps': 20866}. Best is trial 29 with value: 0.2940019562924307.
[I 2025-12-06 05:46:38,015] Trial 33 finished with value: 0.2773162759804768 and parameters: {'model_type': 'mlp', 'hidden_dims': '[512, 256]', 'dropout': 0.4191699246768676, 'batch_norm': False, 'lr': 0.0009943106677207899, 'weight_decay': 0.00032547914151365544, 'epochs': 73, 'loss': 'mae', 'optimizer': 'adam', 'graph_mode': 'off', 'use_snp_selection': True, 'num_snps': 19398}. Best is trial 29 with value: 0.2940019562924307.
