Running from this directory: /cluster/work/simennes/Project_thesis/Project_thesis
Name of job: mlp_t_ens
ID of job: 23690568
The job was run on these nodes: idun-07-08
[I 2025-12-05 14:22:52,983] Trial 0 finished with value: 0.005285211210199783 and parameters: {'model_type': 'mlp', 'hidden_dims': '[128, 64]', 'dropout': 0.199031432379812, 'batch_norm': True, 'lr': 1.8408544111075837e-06, 'weight_decay': 5.5136510071208614e-05, 'epochs': 336, 'loss': 'mae', 'optimizer': 'adam', 'graph_mode': 'off', 'use_snp_selection': True, 'num_snps': 43862}. Best is trial 0 with value: 0.005285211210199783.
[I 2025-12-05 14:22:53,984] Trial 1 finished with value: 0.06283062785538635 and parameters: {'model_type': 'mlp', 'hidden_dims': '[256, 128]', 'dropout': 0.4370668075331726, 'batch_norm': True, 'lr': 7.133471581159139e-05, 'weight_decay': 1.128633586803549e-05, 'epochs': 242, 'loss': 'mae', 'optimizer': 'adam', 'graph_mode': 'off', 'use_snp_selection': False}. Best is trial 1 with value: 0.06283062785538635.
[I 2025-12-05 14:22:54,935] Trial 2 finished with value: 0.059716493083778896 and parameters: {'model_type': 'mlp', 'hidden_dims': '[256, 128, 64]', 'dropout': 0.41314357415569625, 'batch_norm': False, 'lr': 3.952233718592101e-06, 'weight_decay': 0.00026754769258252603, 'epochs': 149, 'loss': 'mse', 'optimizer': 'adam', 'graph_mode': 'off', 'use_snp_selection': True, 'num_snps': 11571}. Best is trial 1 with value: 0.06283062785538635.
[I 2025-12-05 14:22:56,561] Trial 3 finished with value: 0.02739601623289735 and parameters: {'model_type': 'mlp', 'hidden_dims': '[512, 64]', 'dropout': 0.5938127374509361, 'batch_norm': False, 'lr': 5.67704586114731e-06, 'weight_decay': 2.4518087630137052e-05, 'epochs': 320, 'loss': 'mae', 'optimizer': 'adam', 'graph_mode': 'off', 'use_snp_selection': False}. Best is trial 1 with value: 0.06283062785538635.
[I 2025-12-05 14:22:58,565] Trial 4 finished with value: 0.0307984492124585 and parameters: {'model_type': 'mlp', 'hidden_dims': '[512, 128]', 'dropout': 0.25746343592134413, 'batch_norm': True, 'lr': 1.3467657668402788e-06, 'weight_decay': 0.00033087251918647806, 'epochs': 277, 'loss': 'mse', 'optimizer': 'adam', 'graph_mode': 'off', 'use_snp_selection': True, 'num_snps': 36675}. Best is trial 1 with value: 0.06283062785538635.
[I 2025-12-05 14:23:00,190] Trial 5 finished with value: 0.029188034083199494 and parameters: {'model_type': 'mlp', 'hidden_dims': '[512, 64]', 'dropout': 0.38275350994408375, 'batch_norm': True, 'lr': 1.5586664309232824e-06, 'weight_decay': 0.0008227664668621182, 'epochs': 145, 'loss': 'mae', 'optimizer': 'adam', 'graph_mode': 'off', 'use_snp_selection': True, 'num_snps': 32148}. Best is trial 1 with value: 0.06283062785538635.
[I 2025-12-05 14:23:01,097] Trial 6 finished with value: 0.06011786473484894 and parameters: {'model_type': 'mlp', 'hidden_dims': '[256, 128]', 'dropout': 0.3930109900265879, 'batch_norm': False, 'lr': 4.892964372128395e-05, 'weight_decay': 1.5809549317992182e-06, 'epochs': 199, 'loss': 'mse', 'optimizer': 'adam', 'graph_mode': 'off', 'use_snp_selection': False}. Best is trial 1 with value: 0.06283062785538635.
[I 2025-12-05 14:23:02,105] Trial 7 finished with value: 0.10713212507356783 and parameters: {'model_type': 'mlp', 'hidden_dims': '[512, 256]', 'dropout': 0.15343979219678458, 'batch_norm': True, 'lr': 6.234003099047341e-05, 'weight_decay': 3.894760610535477e-07, 'epochs': 97, 'loss': 'mse', 'optimizer': 'adam', 'graph_mode': 'off', 'use_snp_selection': False}. Best is trial 7 with value: 0.10713212507356783.
[I 2025-12-05 14:23:03,728] Trial 8 finished with value: 0.0801602809088662 and parameters: {'model_type': 'mlp', 'hidden_dims': '[512, 128]', 'dropout': 0.10743001231661406, 'batch_norm': True, 'lr': 0.00023728538449271062, 'weight_decay': 1.7629071578048637e-05, 'epochs': 312, 'loss': 'mae', 'optimizer': 'adam', 'graph_mode': 'off', 'use_snp_selection': False}. Best is trial 7 with value: 0.10713212507356783.
[I 2025-12-05 14:23:04,947] Trial 9 finished with value: 0.07665281000944395 and parameters: {'model_type': 'mlp', 'hidden_dims': '[512, 64]', 'dropout': 0.14505336736221927, 'batch_norm': True, 'lr': 5.8619638388111826e-05, 'weight_decay': 6.200156172669308e-07, 'epochs': 175, 'loss': 'mse', 'optimizer': 'adam', 'graph_mode': 'off', 'use_snp_selection': False}. Best is trial 7 with value: 0.10713212507356783.
[I 2025-12-05 14:23:05,796] Trial 10 finished with value: -0.0025248877050606995 and parameters: {'model_type': 'mlp', 'hidden_dims': '[512, 256]', 'dropout': 0.2736992815328032, 'batch_norm': False, 'lr': 0.00032393778075602147, 'weight_decay': 1.1511946696017092e-07, 'epochs': 41, 'loss': 'mse', 'optimizer': 'adam', 'graph_mode': 'off', 'use_snp_selection': False}. Best is trial 7 with value: 0.10713212507356783.
[I 2025-12-05 14:23:06,729] Trial 11 finished with value: 0.05645635413555329 and parameters: {'model_type': 'mlp', 'hidden_dims': '[512, 128]', 'dropout': 0.10095648685224448, 'batch_norm': True, 'lr': 0.0007666984023899753, 'weight_decay': 2.512571353186099e-06, 'epochs': 70, 'loss': 'mae', 'optimizer': 'adam', 'graph_mode': 'off', 'use_snp_selection': False}. Best is trial 7 with value: 0.10713212507356783.
[I 2025-12-05 14:23:07,720] Trial 12 finished with value: 0.06694405365637264 and parameters: {'model_type': 'mlp', 'hidden_dims': '[512, 256]', 'dropout': 0.18206399419301494, 'batch_norm': True, 'lr': 0.00026576228959612443, 'weight_decay': 1.3081036432574914e-07, 'epochs': 88, 'loss': 'mae', 'optimizer': 'adam', 'graph_mode': 'off', 'use_snp_selection': False}. Best is trial 7 with value: 0.10713212507356783.
[I 2025-12-05 14:23:09,126] Trial 13 finished with value: 0.08526675545148334 and parameters: {'model_type': 'mlp', 'hidden_dims': '[512, 128]', 'dropout': 0.28178980110198326, 'batch_norm': True, 'lr': 1.6203139973043888e-05, 'weight_decay': 3.475237872468419e-06, 'epochs': 237, 'loss': 'mse', 'optimizer': 'adam', 'graph_mode': 'off', 'use_snp_selection': False}. Best is trial 7 with value: 0.10713212507356783.
[I 2025-12-05 14:23:10,512] Trial 14 finished with value: 0.026359261410406818 and parameters: {'model_type': 'mlp', 'hidden_dims': '[512, 256]', 'dropout': 0.2896280300541336, 'batch_norm': True, 'lr': 1.6126431293848547e-05, 'weight_decay': 4.814764599662762e-07, 'epochs': 229, 'loss': 'mse', 'optimizer': 'adam', 'graph_mode': 'off', 'use_snp_selection': False}. Best is trial 7 with value: 0.10713212507356783.
[I 2025-12-05 14:23:11,250] Trial 15 finished with value: 0.019857889196323343 and parameters: {'model_type': 'mlp', 'hidden_dims': '[128, 64]', 'dropout': 0.5096328930994195, 'batch_norm': True, 'lr': 2.002944590579291e-05, 'weight_decay': 4.647398975110266e-06, 'epochs': 106, 'loss': 'mse', 'optimizer': 'adam', 'graph_mode': 'off', 'use_snp_selection': False}. Best is trial 7 with value: 0.10713212507356783.
[I 2025-12-05 14:23:12,316] Trial 16 finished with value: 0.03138512496752288 and parameters: {'model_type': 'mlp', 'hidden_dims': '[256, 128, 64]', 'dropout': 0.22778926902104135, 'batch_norm': True, 'lr': 1.1251056317244023e-05, 'weight_decay': 4.833299252951357e-07, 'epochs': 258, 'loss': 'mse', 'optimizer': 'adam', 'graph_mode': 'off', 'use_snp_selection': False}. Best is trial 7 with value: 0.10713212507356783.
[I 2025-12-05 14:23:13,623] Trial 17 finished with value: 0.07658071468855532 and parameters: {'model_type': 'mlp', 'hidden_dims': '[512, 128]', 'dropout': 0.32888830259108426, 'batch_norm': True, 'lr': 0.00011492121034538856, 'weight_decay': 1.3398043894594233e-06, 'epochs': 202, 'loss': 'mse', 'optimizer': 'adam', 'graph_mode': 'off', 'use_snp_selection': False}. Best is trial 7 with value: 0.10713212507356783.
[I 2025-12-05 14:23:16,227] Trial 18 finished with value: 0.07338543770578546 and parameters: {'model_type': 'mlp', 'hidden_dims': '[512, 256]', 'dropout': 0.33865819962077415, 'batch_norm': False, 'lr': 2.797772152750264e-05, 'weight_decay': 5.399175074092964e-06, 'epochs': 133, 'loss': 'mse', 'optimizer': 'adam', 'graph_mode': 'off', 'use_snp_selection': True, 'num_snps': 58241}. Best is trial 7 with value: 0.10713212507356783.
[I 2025-12-05 14:23:17,761] Trial 19 finished with value: 0.039079554266540605 and parameters: {'model_type': 'mlp', 'hidden_dims': '[512, 128]', 'dropout': 0.18625362219272576, 'batch_norm': True, 'lr': 6.333309448676149e-06, 'weight_decay': 2.714195880240099e-07, 'epochs': 281, 'loss': 'mse', 'optimizer': 'adam', 'graph_mode': 'off', 'use_snp_selection': False}. Best is trial 7 with value: 0.10713212507356783.
[I 2025-12-05 14:23:19,013] Trial 20 finished with value: 0.05671416198935156 and parameters: {'model_type': 'mlp', 'hidden_dims': '[512, 256]', 'dropout': 0.3115274285876474, 'batch_norm': True, 'lr': 0.00010819146253297384, 'weight_decay': 4.679666515308887e-05, 'epochs': 178, 'loss': 'mse', 'optimizer': 'adam', 'graph_mode': 'off', 'use_snp_selection': False}. Best is trial 7 with value: 0.10713212507356783.
[I 2025-12-05 14:23:20,613] Trial 21 finished with value: 0.07702392040899919 and parameters: {'model_type': 'mlp', 'hidden_dims': '[512, 128]', 'dropout': 0.107423778918767, 'batch_norm': True, 'lr': 0.0002653433610323151, 'weight_decay': 1.5685969505030866e-05, 'epochs': 302, 'loss': 'mae', 'optimizer': 'adam', 'graph_mode': 'off', 'use_snp_selection': False}. Best is trial 7 with value: 0.10713212507356783.
[I 2025-12-05 14:23:22,339] Trial 22 finished with value: 0.08732028590786037 and parameters: {'model_type': 'mlp', 'hidden_dims': '[512, 128]', 'dropout': 0.1587476811261986, 'batch_norm': True, 'lr': 0.0007619147420995667, 'weight_decay': 5.0124536119779676e-06, 'epochs': 345, 'loss': 'mae', 'optimizer': 'adam', 'graph_mode': 'off', 'use_snp_selection': False}. Best is trial 7 with value: 0.10713212507356783.
[I 2025-12-05 14:23:24,064] Trial 23 finished with value: 0.09526725011989096 and parameters: {'model_type': 'mlp', 'hidden_dims': '[512, 128]', 'dropout': 0.23070381072043317, 'batch_norm': True, 'lr': 0.0009188986332127422, 'weight_decay': 5.049714990038614e-06, 'epochs': 346, 'loss': 'mae', 'optimizer': 'adam', 'graph_mode': 'off', 'use_snp_selection': False}. Best is trial 7 with value: 0.10713212507356783.
[I 2025-12-05 14:23:25,799] Trial 24 finished with value: 0.10019733702223314 and parameters: {'model_type': 'mlp', 'hidden_dims': '[512, 128]', 'dropout': 0.16120019738111652, 'batch_norm': True, 'lr': 0.0009046721073276503, 'weight_decay': 1.1782598377876349e-06, 'epochs': 350, 'loss': 'mae', 'optimizer': 'adam', 'graph_mode': 'off', 'use_snp_selection': False}. Best is trial 7 with value: 0.10713212507356783.
[I 2025-12-05 14:23:27,036] Trial 25 finished with value: 0.08395661402908228 and parameters: {'model_type': 'mlp', 'hidden_dims': '[256, 128, 64]', 'dropout': 0.225357179253905, 'batch_norm': True, 'lr': 0.0009831340995463018, 'weight_decay': 1.0722332608519498e-06, 'epochs': 347, 'loss': 'mae', 'optimizer': 'adam', 'graph_mode': 'off', 'use_snp_selection': False}. Best is trial 7 with value: 0.10713212507356783.
[I 2025-12-05 14:23:27,967] Trial 26 finished with value: 0.11052482098322255 and parameters: {'model_type': 'mlp', 'hidden_dims': '[256, 128]', 'dropout': 0.15217452924346847, 'batch_norm': True, 'lr': 0.0004758515142308064, 'weight_decay': 2.8022660285198504e-07, 'epochs': 289, 'loss': 'mae', 'optimizer': 'adam', 'graph_mode': 'off', 'use_snp_selection': True, 'num_snps': 3842}. Best is trial 26 with value: 0.11052482098322255.
[I 2025-12-05 14:23:28,800] Trial 27 finished with value: 0.09120776937508296 and parameters: {'model_type': 'mlp', 'hidden_dims': '[256, 128]', 'dropout': 0.14722388169200235, 'batch_norm': False, 'lr': 0.0004530773143980352, 'weight_decay': 2.728802627592295e-07, 'epochs': 296, 'loss': 'mae', 'optimizer': 'adam', 'graph_mode': 'off', 'use_snp_selection': True, 'num_snps': 2812}. Best is trial 26 with value: 0.11052482098322255.
[I 2025-12-05 14:23:29,880] Trial 28 finished with value: 0.07716582227045303 and parameters: {'model_type': 'mlp', 'hidden_dims': '[256, 128]', 'dropout': 0.16214639914242523, 'batch_norm': True, 'lr': 0.00012710958233294264, 'weight_decay': 2.3316212455597944e-07, 'epochs': 121, 'loss': 'mae', 'optimizer': 'adam', 'graph_mode': 'off', 'use_snp_selection': True, 'num_snps': 16664}. Best is trial 26 with value: 0.11052482098322255.
[I 2025-12-05 14:23:31,231] Trial 29 finished with value: 0.10139200747926297 and parameters: {'model_type': 'mlp', 'hidden_dims': '[128, 64]', 'dropout': 0.2120764207467203, 'batch_norm': True, 'lr': 0.0005342068583738341, 'weight_decay': 8.978649692263225e-07, 'epochs': 267, 'loss': 'mae', 'optimizer': 'adam', 'graph_mode': 'off', 'use_snp_selection': True, 'num_snps': 19668}. Best is trial 26 with value: 0.11052482098322255.
[I 2025-12-05 14:23:32,537] Trial 30 finished with value: 0.0968290403553494 and parameters: {'model_type': 'mlp', 'hidden_dims': '[128, 64]', 'dropout': 0.19942656361148284, 'batch_norm': True, 'lr': 0.00015656123443443171, 'weight_decay': 6.98590395144228e-07, 'epochs': 223, 'loss': 'mae', 'optimizer': 'adam', 'graph_mode': 'off', 'use_snp_selection': True, 'num_snps': 20021}. Best is trial 26 with value: 0.11052482098322255.
[I 2025-12-05 14:23:33,478] Trial 31 finished with value: 0.08943676345736255 and parameters: {'model_type': 'mlp', 'hidden_dims': '[128, 64]', 'dropout': 0.12840568378770467, 'batch_norm': True, 'lr': 0.0004965529191408703, 'weight_decay': 1.9768291254203146e-06, 'epochs': 326, 'loss': 'mae', 'optimizer': 'adam', 'graph_mode': 'off', 'use_snp_selection': True, 'num_snps': 2132}. Best is trial 26 with value: 0.11052482098322255.
[I 2025-12-05 14:23:34,946] Trial 32 finished with value: 0.10629955764067252 and parameters: {'model_type': 'mlp', 'hidden_dims': '[128, 64]', 'dropout': 0.20903185562227758, 'batch_norm': True, 'lr': 0.0005084400438765032, 'weight_decay': 8.301788459514492e-07, 'epochs': 290, 'loss': 'mae', 'optimizer': 'adam', 'graph_mode': 'off', 'use_snp_selection': True, 'num_snps': 22448}. Best is trial 26 with value: 0.11052482098322255.
[I 2025-12-05 14:23:36,409] Trial 33 finished with value: 0.11081772898948684 and parameters: {'model_type': 'mlp', 'hidden_dims': '[128, 64]', 'dropout': 0.21270376185717677, 'batch_norm': True, 'lr': 0.0005486711003591204, 'weight_decay': 1.9280951212406502e-07, 'epochs': 268, 'loss': 'mae', 'optimizer': 'adam', 'graph_mode': 'off', 'use_snp_selection': True, 'num_snps': 23125}. Best is trial 33 with value: 0.11081772898948684.
[I 2025-12-05 14:23:37,906] Trial 34 finished with value: 0.1046153470426677 and parameters: {'model_type': 'mlp', 'hidden_dims': '[128, 64]', 'dropout': 0.24786135114665792, 'batch_norm': True, 'lr': 0.00018170841821327398, 'weight_decay': 1.983486125853098e-07, 'epochs': 253, 'loss': 'mae', 'optimizer': 'adam', 'graph_mode': 'off', 'use_snp_selection': True, 'num_snps': 24673}. Best is trial 33 with value: 0.11081772898948684.
[I 2025-12-05 14:23:39,003] Trial 35 finished with value: 0.06911218711097053 and parameters: {'model_type': 'mlp', 'hidden_dims': '[128, 64]', 'dropout': 0.4553934890419157, 'batch_norm': False, 'lr': 0.00038338748745013533, 'weight_decay': 3.164989341989857e-07, 'epochs': 285, 'loss': 'mae', 'optimizer': 'adam', 'graph_mode': 'off', 'use_snp_selection': True, 'num_snps': 12746}. Best is trial 33 with value: 0.11081772898948684.
[I 2025-12-05 14:23:40,659] Trial 36 finished with value: 0.09302702190303334 and parameters: {'model_type': 'mlp', 'hidden_dims': '[256, 128]', 'dropout': 0.1773717927790659, 'batch_norm': True, 'lr': 7.605622452708364e-05, 'weight_decay': 1.0653048973066244e-07, 'epochs': 301, 'loss': 'mae', 'optimizer': 'adam', 'graph_mode': 'off', 'use_snp_selection': True, 'num_snps': 27549}. Best is trial 33 with value: 0.11081772898948684.
[I 2025-12-05 14:23:42,707] Trial 37 finished with value: 0.08969770866938946 and parameters: {'model_type': 'mlp', 'hidden_dims': '[128, 64]', 'dropout': 0.20399108846965833, 'batch_norm': True, 'lr': 3.512375683562856e-05, 'weight_decay': 4.551505772701409e-07, 'epochs': 325, 'loss': 'mae', 'optimizer': 'adam', 'graph_mode': 'off', 'use_snp_selection': True, 'num_snps': 40444}. Best is trial 33 with value: 0.11081772898948684.
[I 2025-12-05 14:23:43,647] Trial 38 finished with value: 0.08667001478863304 and parameters: {'model_type': 'mlp', 'hidden_dims': '[256, 128]', 'dropout': 0.13115457074402587, 'batch_norm': False, 'lr': 0.0005746123586063997, 'weight_decay': 1.698128084109727e-07, 'epochs': 215, 'loss': 'mae', 'optimizer': 'adam', 'graph_mode': 'off', 'use_snp_selection': True, 'num_snps': 9422}. Best is trial 33 with value: 0.11081772898948684.
[I 2025-12-05 14:23:45,950] Trial 39 finished with value: 0.07637609072631489 and parameters: {'model_type': 'mlp', 'hidden_dims': '[512, 64]', 'dropout': 0.2532907353768312, 'batch_norm': True, 'lr': 0.00019754465706966592, 'weight_decay': 0.00013884369875704708, 'epochs': 164, 'loss': 'mae', 'optimizer': 'adam', 'graph_mode': 'off', 'use_snp_selection': True, 'num_snps': 48306}. Best is trial 33 with value: 0.11081772898948684.
[I 2025-12-05 14:23:47,629] Trial 40 finished with value: 0.04715832914761961 and parameters: {'model_type': 'mlp', 'hidden_dims': '[128, 64]', 'dropout': 0.5511066827785251, 'batch_norm': True, 'lr': 8.23816660357713e-05, 'weight_decay': 3.5738768139936725e-07, 'epochs': 252, 'loss': 'mae', 'optimizer': 'adam', 'graph_mode': 'off', 'use_snp_selection': True, 'num_snps': 31291}. Best is trial 33 with value: 0.11081772898948684.
[I 2025-12-05 14:23:49,141] Trial 41 finished with value: 0.09478333843752415 and parameters: {'model_type': 'mlp', 'hidden_dims': '[128, 64]', 'dropout': 0.2481462175050977, 'batch_norm': True, 'lr': 0.00017345291075641843, 'weight_decay': 1.8688231133363784e-07, 'epochs': 262, 'loss': 'mae', 'optimizer': 'adam', 'graph_mode': 'off', 'use_snp_selection': True, 'num_snps': 25026}. Best is trial 33 with value: 0.11081772898948684.
[I 2025-12-05 14:23:50,584] Trial 42 finished with value: 0.11245789228187227 and parameters: {'model_type': 'mlp', 'hidden_dims': '[128, 64]', 'dropout': 0.3657536118327464, 'batch_norm': True, 'lr': 0.0003447731165429701, 'weight_decay': 1.6054157737608142e-07, 'epochs': 243, 'loss': 'mae', 'optimizer': 'adam', 'graph_mode': 'off', 'use_snp_selection': True, 'num_snps': 23713}. Best is trial 42 with value: 0.11245789228187227.
[I 2025-12-05 14:23:52,014] Trial 43 finished with value: 0.10084911254391976 and parameters: {'model_type': 'mlp', 'hidden_dims': '[128, 64]', 'dropout': 0.3853510093037312, 'batch_norm': True, 'lr': 0.000329021235150623, 'weight_decay': 1.0066399664542825e-07, 'epochs': 272, 'loss': 'mae', 'optimizer': 'adam', 'graph_mode': 'off', 'use_snp_selection': True, 'num_snps': 22117}. Best is trial 42 with value: 0.11245789228187227.
[I 2025-12-05 14:23:53,026] Trial 44 finished with value: 0.10496757228259694 and parameters: {'model_type': 'mlp', 'hidden_dims': '[512, 256]', 'dropout': 0.4518307676320122, 'batch_norm': True, 'lr': 0.0006478938402379774, 'weight_decay': 7.932311577549808e-07, 'epochs': 242, 'loss': 'mae', 'optimizer': 'adam', 'graph_mode': 'off', 'use_snp_selection': True, 'num_snps': 7922}. Best is trial 42 with value: 0.11245789228187227.
[I 2025-12-05 14:23:54,726] Trial 45 finished with value: 0.09835580941821766 and parameters: {'model_type': 'mlp', 'hidden_dims': '[256, 128]', 'dropout': 0.37365647803917496, 'batch_norm': True, 'lr': 0.0004208307240499393, 'weight_decay': 1.8398725465758192e-07, 'epochs': 287, 'loss': 'mae', 'optimizer': 'adam', 'graph_mode': 'off', 'use_snp_selection': True, 'num_snps': 29483}. Best is trial 42 with value: 0.11245789228187227.
[I 2025-12-05 14:23:55,941] Trial 46 finished with value: 0.10316860848273716 and parameters: {'model_type': 'mlp', 'hidden_dims': '[128, 64]', 'dropout': 0.1268748495055854, 'batch_norm': False, 'lr': 0.00033668627083655923, 'weight_decay': 4.044620289582238e-07, 'epochs': 313, 'loss': 'mse', 'optimizer': 'adam', 'graph_mode': 'off', 'use_snp_selection': True, 'num_snps': 15947}. Best is trial 42 with value: 0.11245789228187227.
[I 2025-12-05 14:23:57,550] Trial 47 finished with value: 0.018181120011806853 and parameters: {'model_type': 'mlp', 'hidden_dims': '[512, 256]', 'dropout': 0.41303306450493443, 'batch_norm': True, 'lr': 2.800079900342993e-06, 'weight_decay': 6.127274314929567e-07, 'epochs': 45, 'loss': 'mae', 'optimizer': 'adam', 'graph_mode': 'off', 'use_snp_selection': True, 'num_snps': 35135}. Best is trial 42 with value: 0.11245789228187227.
[I 2025-12-05 14:23:58,758] Trial 48 finished with value: 0.10397375206927267 and parameters: {'model_type': 'mlp', 'hidden_dims': '[512, 64]', 'dropout': 0.30470416413881557, 'batch_norm': True, 'lr': 0.0002467290002321037, 'weight_decay': 1.4977223657266964e-07, 'epochs': 209, 'loss': 'mse', 'optimizer': 'adam', 'graph_mode': 'off', 'use_snp_selection': True, 'num_snps': 16116}. Best is trial 42 with value: 0.11245789228187227.
[I 2025-12-05 14:24:00,204] Trial 49 finished with value: 0.04495703500977588 and parameters: {'model_type': 'mlp', 'hidden_dims': '[128, 64]', 'dropout': 0.36315323184535836, 'batch_norm': True, 'lr': 4.635816024215175e-05, 'weight_decay': 0.0009709528483568237, 'epochs': 236, 'loss': 'mae', 'optimizer': 'adam', 'graph_mode': 'off', 'use_snp_selection': True, 'num_snps': 24176}. Best is trial 42 with value: 0.11245789228187227.
[I 2025-12-05 14:24:01,131] Trial 50 finished with value: 0.10917114875921989 and parameters: {'model_type': 'mlp', 'hidden_dims': '[256, 128, 64]', 'dropout': 0.27618428361274355, 'batch_norm': True, 'lr': 0.0006751938648001921, 'weight_decay': 8.67035652352341e-06, 'epochs': 188, 'loss': 'mse', 'optimizer': 'adam', 'graph_mode': 'off', 'use_snp_selection': True, 'num_snps': 6162}. Best is trial 42 with value: 0.11245789228187227.
