[I 2025-12-05 16:25:07,951] Trial 24 finished with value: 0.037583914839048764 and parameters: {'model_type': 'mlp', 'hidden_dims': '[512, 256]', 'dropout': 0.3065867560214893, 'batch_norm': True, 'lr': 9.880240987529524e-05, 'weight_decay': 9.043979821213232e-07, 'epochs': 118, 'loss': 'mse', 'optimizer': 'adam', 'graph_mode': 'off', 'use_snp_selection': False}. Best is trial 16 with value: 0.04766495257198574.
[I 2025-12-05 16:25:08,994] Trial 25 finished with value: 0.03284082528045525 and parameters: {'model_type': 'mlp', 'hidden_dims': '[512, 256]', 'dropout': 0.2190693272481038, 'batch_norm': True, 'lr': 0.0004165519688771244, 'weight_decay': 2.999904457843579e-07, 'epochs': 64, 'loss': 'mse', 'optimizer': 'adam', 'graph_mode': 'off', 'use_snp_selection': False}. Best is trial 16 with value: 0.04766495257198574.
[I 2025-12-05 16:25:09,795] Trial 26 finished with value: 0.00828906861304973 and parameters: {'model_type': 'mlp', 'hidden_dims': '[512, 256]', 'dropout': 0.3017666430086059, 'batch_norm': True, 'lr': 3.5652153356401597e-05, 'weight_decay': 0.00015265805543382736, 'epochs': 89, 'loss': 'mse', 'optimizer': 'adam', 'graph_mode': 'off', 'use_snp_selection': True, 'num_snps': 3842}. Best is trial 16 with value: 0.04766495257198574.
[I 2025-12-05 16:25:10,933] Trial 27 finished with value: 0.023246685926046284 and parameters: {'model_type': 'mlp', 'hidden_dims': '[256, 128, 64]', 'dropout': 0.16715659476428255, 'batch_norm': False, 'lr': 9.071120844048233e-05, 'weight_decay': 2.984547040022667e-05, 'epochs': 217, 'loss': 'mse', 'optimizer': 'adam', 'graph_mode': 'off', 'use_snp_selection': False}. Best is trial 16 with value: 0.04766495257198574.
[I 2025-12-05 16:25:11,730] Trial 28 finished with value: 0.02862215725316512 and parameters: {'model_type': 'mlp', 'hidden_dims': '[128, 64]', 'dropout': 0.2236722911767887, 'batch_norm': True, 'lr': 0.0001759600007129804, 'weight_decay': 1.8219834248060387e-07, 'epochs': 137, 'loss': 'mse', 'optimizer': 'adam', 'graph_mode': 'off', 'use_snp_selection': False}. Best is trial 16 with value: 0.04766495257198574.
[I 2025-12-05 16:25:12,957] Trial 29 finished with value: 0.026896543767222725 and parameters: {'model_type': 'mlp', 'hidden_dims': '[256, 128]', 'dropout': 0.24388047180244735, 'batch_norm': True, 'lr': 1.0723974152844549e-05, 'weight_decay': 8.998479561642212e-06, 'epochs': 108, 'loss': 'mse', 'optimizer': 'adam', 'graph_mode': 'off', 'use_snp_selection': True, 'num_snps': 19468}. Best is trial 16 with value: 0.04766495257198574.
[I 2025-12-05 16:25:13,803] Trial 30 finished with value: 0.04048492564007016 and parameters: {'model_type': 'mlp', 'hidden_dims': '[128, 64]', 'dropout': 0.35141346167957443, 'batch_norm': True, 'lr': 2.3791753045898957e-05, 'weight_decay': 4.0913469167965335e-05, 'epochs': 160, 'loss': 'mse', 'optimizer': 'adam', 'graph_mode': 'off', 'use_snp_selection': False}. Best is trial 16 with value: 0.04766495257198574.
[I 2025-12-05 16:25:15,036] Trial 31 finished with value: 0.04601643909923511 and parameters: {'model_type': 'mlp', 'hidden_dims': '[512, 256]', 'dropout': 0.11641259136954246, 'batch_norm': True, 'lr': 0.00018911013776104266, 'weight_decay': 8.341559353535258e-05, 'epochs': 114, 'loss': 'mse', 'optimizer': 'adam', 'graph_mode': 'off', 'use_snp_selection': False}. Best is trial 16 with value: 0.04766495257198574.
[I 2025-12-05 16:25:16,187] Trial 32 finished with value: 0.05707157008206899 and parameters: {'model_type': 'mlp', 'hidden_dims': '[512, 256]', 'dropout': 0.18972717071984757, 'batch_norm': True, 'lr': 6.498771111495683e-05, 'weight_decay': 0.00012010101990251404, 'epochs': 96, 'loss': 'mse', 'optimizer': 'adam', 'graph_mode': 'off', 'use_snp_selection': False}. Best is trial 32 with value: 0.05707157008206899.
[I 2025-12-05 16:25:17,182] Trial 33 finished with value: 0.018692183680311256 and parameters: {'model_type': 'mlp', 'hidden_dims': '[512, 256]', 'dropout': 0.19547990147536237, 'batch_norm': True, 'lr': 6.243293136949207e-05, 'weight_decay': 0.00011111105956757078, 'epochs': 56, 'loss': 'mse', 'optimizer': 'adam', 'graph_mode': 'off', 'use_snp_selection': False}. Best is trial 32 with value: 0.05707157008206899.
[I 2025-12-05 16:25:18,326] Trial 34 finished with value: 0.05953244523262261 and parameters: {'model_type': 'mlp', 'hidden_dims': '[512, 256]', 'dropout': 0.14544472376507156, 'batch_norm': True, 'lr': 3.979788313900948e-05, 'weight_decay': 0.00022750361785088042, 'epochs': 93, 'loss': 'mae', 'optimizer': 'adam', 'graph_mode': 'off', 'use_snp_selection': False}. Best is trial 34 with value: 0.05953244523262261.
[I 2025-12-05 16:25:19,270] Trial 35 finished with value: 0.02736894591850703 and parameters: {'model_type': 'mlp', 'hidden_dims': '[256, 128]', 'dropout': 0.13263564200653197, 'batch_norm': False, 'lr': 4.0684985248602584e-05, 'weight_decay': 0.0003539855080412264, 'epochs': 133, 'loss': 'mae', 'optimizer': 'adam', 'graph_mode': 'off', 'use_snp_selection': False}. Best is trial 34 with value: 0.05953244523262261.
[I 2025-12-05 16:25:22,068] Trial 36 finished with value: -0.010976603411703936 and parameters: {'model_type': 'mlp', 'hidden_dims': '[512, 256]', 'dropout': 0.17832454725808156, 'batch_norm': True, 'lr': 4.955210065721023e-06, 'weight_decay': 0.0005995149697875252, 'epochs': 75, 'loss': 'mae', 'optimizer': 'adam', 'graph_mode': 'off', 'use_snp_selection': True, 'num_snps': 58661}. Best is trial 34 with value: 0.05953244523262261.
[I 2025-12-05 16:25:23,385] Trial 37 finished with value: 0.025217797805858266 and parameters: {'model_type': 'mlp', 'hidden_dims': '[512, 64]', 'dropout': 0.47201793239269857, 'batch_norm': True, 'lr': 9.701777366951142e-06, 'weight_decay': 0.00016730053218613023, 'epochs': 130, 'loss': 'mae', 'optimizer': 'adam', 'graph_mode': 'off', 'use_snp_selection': False}. Best is trial 34 with value: 0.05953244523262261.
[I 2025-12-05 16:25:24,636] Trial 38 finished with value: 0.016605861287901473 and parameters: {'model_type': 'mlp', 'hidden_dims': '[256, 128, 64]', 'dropout': 0.5749822693823109, 'batch_norm': False, 'lr': 8.934705111862086e-05, 'weight_decay': 0.00028247984416814704, 'epochs': 158, 'loss': 'mae', 'optimizer': 'adam', 'graph_mode': 'off', 'use_snp_selection': True, 'num_snps': 19911}. Best is trial 34 with value: 0.05953244523262261.
[I 2025-12-05 16:25:25,735] Trial 39 finished with value: 0.038811573717468885 and parameters: {'model_type': 'mlp', 'hidden_dims': '[512, 256]', 'dropout': 0.11958252771835882, 'batch_norm': True, 'lr': 2.485134487958098e-06, 'weight_decay': 0.0005137036070115116, 'epochs': 94, 'loss': 'mae', 'optimizer': 'adam', 'graph_mode': 'off', 'use_snp_selection': False}. Best is trial 34 with value: 0.05953244523262261.
[I 2025-12-05 16:25:26,999] Trial 40 finished with value: 0.04647394143768364 and parameters: {'model_type': 'mlp', 'hidden_dims': '[256, 128]', 'dropout': 0.16720931598564343, 'batch_norm': True, 'lr': 0.00020432242064596668, 'weight_decay': 1.6686544075764516e-05, 'epochs': 282, 'loss': 'mae', 'optimizer': 'adam', 'graph_mode': 'off', 'use_snp_selection': False}. Best is trial 34 with value: 0.05953244523262261.
[I 2025-12-05 16:25:28,288] Trial 41 finished with value: 0.04495536890196519 and parameters: {'model_type': 'mlp', 'hidden_dims': '[256, 128]', 'dropout': 0.16440126572028893, 'batch_norm': True, 'lr': 0.0001924198272377111, 'weight_decay': 1.8828943720851387e-05, 'epochs': 288, 'loss': 'mae', 'optimizer': 'adam', 'graph_mode': 'off', 'use_snp_selection': False}. Best is trial 34 with value: 0.05953244523262261.
[I 2025-12-05 16:25:29,700] Trial 42 finished with value: 0.05190502163593427 and parameters: {'model_type': 'mlp', 'hidden_dims': '[256, 128]', 'dropout': 0.20382545450657277, 'batch_norm': True, 'lr': 0.00039037331028445656, 'weight_decay': 0.00021663962117130124, 'epochs': 348, 'loss': 'mae', 'optimizer': 'adam', 'graph_mode': 'off', 'use_snp_selection': False}. Best is trial 34 with value: 0.05953244523262261.
[I 2025-12-05 16:25:31,072] Trial 43 finished with value: 0.0395221243745499 and parameters: {'model_type': 'mlp', 'hidden_dims': '[256, 128]', 'dropout': 0.2760515673271829, 'batch_norm': True, 'lr': 0.0004034453066894875, 'weight_decay': 0.0008902733649771849, 'epochs': 339, 'loss': 'mae', 'optimizer': 'adam', 'graph_mode': 'off', 'use_snp_selection': False}. Best is trial 34 with value: 0.05953244523262261.
[I 2025-12-05 16:25:32,407] Trial 44 finished with value: 0.03742856139346335 and parameters: {'model_type': 'mlp', 'hidden_dims': '[256, 128]', 'dropout': 0.1956898086623443, 'batch_norm': True, 'lr': 0.0005329505775848549, 'weight_decay': 0.0002143055693406996, 'epochs': 323, 'loss': 'mae', 'optimizer': 'adam', 'graph_mode': 'off', 'use_snp_selection': False}. Best is trial 34 with value: 0.05953244523262261.
[I 2025-12-05 16:25:33,670] Trial 45 finished with value: 0.06213177289557189 and parameters: {'model_type': 'mlp', 'hidden_dims': '[256, 128]', 'dropout': 0.4040741554249228, 'batch_norm': True, 'lr': 0.0003014703424229728, 'weight_decay': 0.00043325212814214524, 'epochs': 280, 'loss': 'mae', 'optimizer': 'adam', 'graph_mode': 'off', 'use_snp_selection': False}. Best is trial 45 with value: 0.06213177289557189.
[I 2025-12-05 16:25:35,069] Trial 46 finished with value: 0.07279895725465674 and parameters: {'model_type': 'mlp', 'hidden_dims': '[256, 128]', 'dropout': 0.401399452804665, 'batch_norm': True, 'lr': 5.0866668236590876e-05, 'weight_decay': 0.0006148608205168365, 'epochs': 349, 'loss': 'mae', 'optimizer': 'adam', 'graph_mode': 'off', 'use_snp_selection': False}. Best is trial 46 with value: 0.07279895725465674.
[I 2025-12-05 16:25:36,336] Trial 47 finished with value: 0.022439901484226105 and parameters: {'model_type': 'mlp', 'hidden_dims': '[256, 128]', 'dropout': 0.4176818095537042, 'batch_norm': False, 'lr': 5.1770506858882604e-05, 'weight_decay': 0.0004393752631394581, 'epochs': 301, 'loss': 'mae', 'optimizer': 'adam', 'graph_mode': 'off', 'use_snp_selection': False}. Best is trial 46 with value: 0.07279895725465674.
[I 2025-12-05 16:25:37,541] Trial 48 finished with value: 0.0555577587086005 and parameters: {'model_type': 'mlp', 'hidden_dims': '[256, 128]', 'dropout': 0.38259323874490275, 'batch_norm': True, 'lr': 2.5904389857527362e-05, 'weight_decay': 0.0006909277953807008, 'epochs': 253, 'loss': 'mae', 'optimizer': 'adam', 'graph_mode': 'off', 'use_snp_selection': False}. Best is trial 46 with value: 0.07279895725465674.
[I 2025-12-05 16:25:39,949] Trial 49 finished with value: -0.012052642452362339 and parameters: {'model_type': 'mlp', 'hidden_dims': '[256, 128]', 'dropout': 0.376736840362843, 'batch_norm': True, 'lr': 2.0705714392424854e-05, 'weight_decay': 0.0007945785464248743, 'epochs': 261, 'loss': 'mae', 'optimizer': 'adam', 'graph_mode': 'off', 'use_snp_selection': True, 'num_snps': 46888}. Best is trial 46 with value: 0.07279895725465674.
[I 2025-12-05 16:25:41,758] Trial 50 finished with value: 0.0252946842501674 and parameters: {'model_type': 'mlp', 'hidden_dims': '[512, 128]', 'dropout': 0.4414117870204101, 'batch_norm': True, 'lr': 2.44704447192685e-05, 'weight_decay': 0.0003828922823974053, 'epochs': 253, 'loss': 'mae', 'optimizer': 'adam', 'graph_mode': 'off', 'use_snp_selection': False}. Best is trial 46 with value: 0.07279895725465674.
[I 2025-12-05 16:25:43,094] Trial 51 finished with value: 0.026883500903946162 and parameters: {'model_type': 'mlp', 'hidden_dims': '[256, 128]', 'dropout': 0.40544075218773207, 'batch_norm': True, 'lr': 2.8958709054628393e-05, 'weight_decay': 0.0002058996086734589, 'epochs': 327, 'loss': 'mae', 'optimizer': 'adam', 'graph_mode': 'off', 'use_snp_selection': False}. Best is trial 46 with value: 0.07279895725465674.
[I 2025-12-05 16:25:44,370] Trial 52 finished with value: 0.037451100647466394 and parameters: {'model_type': 'mlp', 'hidden_dims': '[256, 128]', 'dropout': 0.3673837449385657, 'batch_norm': True, 'lr': 7.44390728211754e-05, 'weight_decay': 0.0006181728572780142, 'epochs': 311, 'loss': 'mae', 'optimizer': 'adam', 'graph_mode': 'off', 'use_snp_selection': False}. Best is trial 46 with value: 0.07279895725465674.
[I 2025-12-05 16:25:45,719] Trial 53 finished with value: 0.03204744341967383 and parameters: {'model_type': 'mlp', 'hidden_dims': '[256, 128]', 'dropout': 0.4322072090000777, 'batch_norm': True, 'lr': 4.612864797911719e-05, 'weight_decay': 0.00026358397730364975, 'epochs': 343, 'loss': 'mae', 'optimizer': 'adam', 'graph_mode': 'off', 'use_snp_selection': False}. Best is trial 46 with value: 0.07279895725465674.
[I 2025-12-05 16:25:47,857] Trial 54 finished with value: 0.05659464669995172 and parameters: {'model_type': 'mlp', 'hidden_dims': '[512, 64]', 'dropout': 0.4568656501051136, 'batch_norm': True, 'lr': 1.5996427798033232e-05, 'weight_decay': 0.00012300810166671826, 'epochs': 348, 'loss': 'mae', 'optimizer': 'adam', 'graph_mode': 'off', 'use_snp_selection': False}. Best is trial 46 with value: 0.07279895725465674.
[I 2025-12-05 16:25:49,477] Trial 55 finished with value: 0.011058480963385664 and parameters: {'model_type': 'mlp', 'hidden_dims': '[512, 64]', 'dropout': 0.45894331376810904, 'batch_norm': True, 'lr': 7.179929953169379e-06, 'weight_decay': 0.00013267326290104022, 'epochs': 216, 'loss': 'mae', 'optimizer': 'adam', 'graph_mode': 'off', 'use_snp_selection': False}. Best is trial 46 with value: 0.07279895725465674.
[I 2025-12-05 16:25:51,353] Trial 56 finished with value: 0.02482978314070551 and parameters: {'model_type': 'mlp', 'hidden_dims': '[512, 64]', 'dropout': 0.4881586824779245, 'batch_norm': True, 'lr': 1.2486756186990651e-05, 'weight_decay': 0.0008937810686008749, 'epochs': 292, 'loss': 'mae', 'optimizer': 'adam', 'graph_mode': 'off', 'use_snp_selection': False}. Best is trial 46 with value: 0.07279895725465674.
[I 2025-12-05 16:25:53,160] Trial 57 finished with value: 0.003639637907644459 and parameters: {'model_type': 'mlp', 'hidden_dims': '[512, 64]', 'dropout': 0.5258194955309446, 'batch_norm': True, 'lr': 1.6258903543159738e-05, 'weight_decay': 0.00010078225017387186, 'epochs': 267, 'loss': 'mae', 'optimizer': 'adam', 'graph_mode': 'off', 'use_snp_selection': False}. Best is trial 46 with value: 0.07279895725465674.
[I 2025-12-05 16:25:54,844] Trial 58 finished with value: 0.058832551956360946 and parameters: {'model_type': 'mlp', 'hidden_dims': '[512, 64]', 'dropout': 0.39569077115740325, 'batch_norm': False, 'lr': 1.7862375402397498e-05, 'weight_decay': 0.0005769636481475614, 'epochs': 238, 'loss': 'mae', 'optimizer': 'adam', 'graph_mode': 'off', 'use_snp_selection': False}. Best is trial 46 with value: 0.07279895725465674.
[I 2025-12-05 16:25:56,479] Trial 59 finished with value: 0.002243098273964707 and parameters: {'model_type': 'mlp', 'hidden_dims': '[512, 64]', 'dropout': 0.3983628491813933, 'batch_norm': False, 'lr': 7.2377871999429165e-06, 'weight_decay': 0.0004333730195927956, 'epochs': 222, 'loss': 'mae', 'optimizer': 'adam', 'graph_mode': 'off', 'use_snp_selection': False}. Best is trial 46 with value: 0.07279895725465674.
[I 2025-12-05 16:25:57,999] Trial 60 finished with value: 0.031385232457847585 and parameters: {'model_type': 'mlp', 'hidden_dims': '[512, 64]', 'dropout': 0.4286518861898342, 'batch_norm': False, 'lr': 1.6660098156926865e-05, 'weight_decay': 7.18040956585546e-05, 'epochs': 195, 'loss': 'mae', 'optimizer': 'adam', 'graph_mode': 'off', 'use_snp_selection': False}. Best is trial 46 with value: 0.07279895725465674.
[I 2025-12-05 16:25:59,677] Trial 61 finished with value: 0.03465559802371278 and parameters: {'model_type': 'mlp', 'hidden_dims': '[512, 64]', 'dropout': 0.34746483106613396, 'batch_norm': False, 'lr': 3.108026173801699e-05, 'weight_decay': 0.0006471902260515013, 'epochs': 239, 'loss': 'mae', 'optimizer': 'adam', 'graph_mode': 'off', 'use_snp_selection': False}. Best is trial 46 with value: 0.07279895725465674.
[I 2025-12-05 16:26:01,338] Trial 62 finished with value: 0.026991255884607417 and parameters: {'model_type': 'mlp', 'hidden_dims': '[512, 64]', 'dropout': 0.38924905071050164, 'batch_norm': False, 'lr': 4.329068403574585e-05, 'weight_decay': 0.00029072520347198934, 'epochs': 230, 'loss': 'mae', 'optimizer': 'adam', 'graph_mode': 'off', 'use_snp_selection': False}. Best is trial 46 with value: 0.07279895725465674.
[I 2025-12-05 16:26:03,060] Trial 63 finished with value: 0.06149759851491194 and parameters: {'model_type': 'mlp', 'hidden_dims': '[512, 128]', 'dropout': 0.44701666502263626, 'batch_norm': False, 'lr': 2.6209371948140706e-05, 'weight_decay': 0.0005157618854785441, 'epochs': 250, 'loss': 'mae', 'optimizer': 'adam', 'graph_mode': 'off', 'use_snp_selection': False}. Best is trial 46 with value: 0.07279895725465674.
[I 2025-12-05 16:26:05,097] Trial 64 finished with value: 0.038615138412263994 and parameters: {'model_type': 'mlp', 'hidden_dims': '[512, 128]', 'dropout': 0.44422794099627255, 'batch_norm': False, 'lr': 7.236999676996625e-05, 'weight_decay': 0.0009792046321796678, 'epochs': 329, 'loss': 'mae', 'optimizer': 'adam', 'graph_mode': 'off', 'use_snp_selection': False}. Best is trial 46 with value: 0.07279895725465674.
[I 2025-12-05 16:26:06,922] Trial 65 finished with value: 0.03337547984324891 and parameters: {'model_type': 'mlp', 'hidden_dims': '[512, 128]', 'dropout': 0.5068308975862458, 'batch_norm': False, 'lr': 1.8706583130542954e-05, 'weight_decay': 0.00017029826743089976, 'epochs': 270, 'loss': 'mae', 'optimizer': 'adam', 'graph_mode': 'off', 'use_snp_selection': False}. Best is trial 46 with value: 0.07279895725465674.
[I 2025-12-05 16:26:08,486] Trial 66 finished with value: 0.051406149657233224 and parameters: {'model_type': 'mlp', 'hidden_dims': '[512, 128]', 'dropout': 0.41584343509216354, 'batch_norm': False, 'lr': 1.332213636145916e-05, 'weight_decay': 0.00048057309734513584, 'epochs': 203, 'loss': 'mae', 'optimizer': 'adam', 'graph_mode': 'off', 'use_snp_selection': False}. Best is trial 46 with value: 0.07279895725465674.
[I 2025-12-05 16:26:10,008] Trial 67 finished with value: 0.032263175150326714 and parameters: {'model_type': 'mlp', 'hidden_dims': '[128, 64]', 'dropout': 0.4583471489804235, 'batch_norm': False, 'lr': 3.66640756774449e-05, 'weight_decay': 0.00034247112826201874, 'epochs': 298, 'loss': 'mae', 'optimizer': 'adam', 'graph_mode': 'off', 'use_snp_selection': True, 'num_snps': 22951}. Best is trial 46 with value: 0.07279895725465674.
[I 2025-12-05 16:26:11,926] Trial 68 finished with value: 0.046809331594283916 and parameters: {'model_type': 'mlp', 'hidden_dims': '[512, 128]', 'dropout': 0.3326798987697642, 'batch_norm': False, 'lr': 5.299176576163535e-05, 'weight_decay': 0.0001286772463405131, 'epochs': 311, 'loss': 'mae', 'optimizer': 'adam', 'graph_mode': 'off', 'use_snp_selection': False}. Best is trial 46 with value: 0.07279895725465674.
[I 2025-12-05 16:26:12,973] Trial 69 finished with value: -0.008329913715735493 and parameters: {'model_type': 'mlp', 'hidden_dims': '[256, 128, 64]', 'dropout': 0.5007302681208813, 'batch_norm': False, 'lr': 8.057047093229441e-06, 'weight_decay': 4.0397264089390675e-05, 'epochs': 183, 'loss': 'mae', 'optimizer': 'adam', 'graph_mode': 'off', 'use_snp_selection': False}. Best is trial 46 with value: 0.07279895725465674.
[I 2025-12-05 16:26:14,704] Trial 70 finished with value: 0.06566315118821983 and parameters: {'model_type': 'mlp', 'hidden_dims': '[512, 64]', 'dropout': 0.4546874861307413, 'batch_norm': False, 'lr': 2.27948152442891e-05, 'weight_decay': 0.00022019947273216255, 'epochs': 247, 'loss': 'mae', 'optimizer': 'adam', 'graph_mode': 'off', 'use_snp_selection': False}. Best is trial 46 with value: 0.07279895725465674.
[I 2025-12-05 16:26:16,434] Trial 71 finished with value: 0.028042703262795225 and parameters: {'model_type': 'mlp', 'hidden_dims': '[512, 64]', 'dropout': 0.36281003565033054, 'batch_norm': False, 'lr': 2.215147425762562e-05, 'weight_decay': 0.0002552154262201059, 'epochs': 247, 'loss': 'mae', 'optimizer': 'adam', 'graph_mode': 'off', 'use_snp_selection': False}. Best is trial 46 with value: 0.07279895725465674.
[I 2025-12-05 16:26:17,992] Trial 72 finished with value: 0.0349537025387652 and parameters: {'model_type': 'mlp', 'hidden_dims': '[512, 64]', 'dropout': 0.5308838487181181, 'batch_norm': False, 'lr': 3.2367577628070846e-05, 'weight_decay': 0.0005621040704819559, 'epochs': 207, 'loss': 'mae', 'optimizer': 'adam', 'graph_mode': 'off', 'use_snp_selection': False}. Best is trial 46 with value: 0.07279895725465674.
[I 2025-12-05 16:26:19,642] Trial 73 finished with value: 0.029587341778319193 and parameters: {'model_type': 'mlp', 'hidden_dims': '[512, 64]', 'dropout': 0.4628522323232785, 'batch_norm': False, 'lr': 1.5426772219442285e-05, 'weight_decay': 0.0003568789999256952, 'epochs': 227, 'loss': 'mae', 'optimizer': 'adam', 'graph_mode': 'off', 'use_snp_selection': False}. Best is trial 46 with value: 0.07279895725465674.
[I 2025-12-05 16:26:21,475] Trial 74 finished with value: 0.01858802453238588 and parameters: {'model_type': 'mlp', 'hidden_dims': '[512, 64]', 'dropout': 0.450838712303902, 'batch_norm': False, 'lr': 1.0484293688932914e-05, 'weight_decay': 0.00018326045909700515, 'epochs': 277, 'loss': 'mae', 'optimizer': 'adam', 'graph_mode': 'off', 'use_snp_selection': False}. Best is trial 46 with value: 0.07279895725465674.
[I 2025-12-05 16:26:23,532] Trial 75 finished with value: 0.037189915833020164 and parameters: {'model_type': 'mlp', 'hidden_dims': '[512, 128]', 'dropout': 0.4168844509862327, 'batch_norm': False, 'lr': 2.632417810735538e-05, 'weight_decay': 8.856413483506716e-05, 'epochs': 333, 'loss': 'mae', 'optimizer': 'adam', 'graph_mode': 'off', 'use_snp_selection': False}. Best is trial 46 with value: 0.07279895725465674.
