[I 2025-12-05 14:44:21,209] Trial 118 finished with value: 0.06208555181007992 and parameters: {'model_type': 'mlp', 'hidden_dims': '[512, 128]', 'dropout': 0.1702746723527878, 'batch_norm': True, 'lr': 2.978180605979622e-06, 'weight_decay': 2.797243822209877e-05, 'epochs': 212, 'loss': 'mae', 'optimizer': 'adam', 'graph_mode': 'off', 'use_snp_selection': False}. Best is trial 52 with value: 0.1769979941376395.
[I 2025-12-05 14:44:24,619] Trial 119 finished with value: 0.13156457535913132 and parameters: {'model_type': 'mlp', 'hidden_dims': '[512, 128]', 'dropout': 0.14220950162462928, 'batch_norm': False, 'lr': 0.00044553489527623355, 'weight_decay': 2.1403640951558984e-05, 'epochs': 225, 'loss': 'mae', 'optimizer': 'adam', 'graph_mode': 'off', 'use_snp_selection': False}. Best is trial 52 with value: 0.1769979941376395.
[I 2025-12-05 14:44:26,854] Trial 120 finished with value: 0.1559214429651502 and parameters: {'model_type': 'mlp', 'hidden_dims': '[256, 128]', 'dropout': 0.10821049025250024, 'batch_norm': True, 'lr': 0.00010540873385805229, 'weight_decay': 1.4189472571044712e-05, 'epochs': 238, 'loss': 'mae', 'optimizer': 'adam', 'graph_mode': 'off', 'use_snp_selection': False}. Best is trial 52 with value: 0.1769979941376395.
[I 2025-12-05 14:44:30,673] Trial 121 finished with value: 0.1644349459378366 and parameters: {'model_type': 'mlp', 'hidden_dims': '[512, 128]', 'dropout': 0.12319280651713768, 'batch_norm': True, 'lr': 0.00026770955001767993, 'weight_decay': 3.660459254833834e-07, 'epochs': 251, 'loss': 'mae', 'optimizer': 'adam', 'graph_mode': 'off', 'use_snp_selection': False}. Best is trial 52 with value: 0.1769979941376395.
[I 2025-12-05 14:44:35,022] Trial 122 finished with value: 0.16658782265468 and parameters: {'model_type': 'mlp', 'hidden_dims': '[512, 128]', 'dropout': 0.1126798356236645, 'batch_norm': True, 'lr': 0.00018270669389582083, 'weight_decay': 6.537983002780125e-05, 'epochs': 295, 'loss': 'mae', 'optimizer': 'adam', 'graph_mode': 'off', 'use_snp_selection': False}. Best is trial 52 with value: 0.1769979941376395.
[I 2025-12-05 14:44:38,298] Trial 123 finished with value: 0.16937968998888608 and parameters: {'model_type': 'mlp', 'hidden_dims': '[512, 128]', 'dropout': 0.15113450045424084, 'batch_norm': True, 'lr': 0.00018768546874038973, 'weight_decay': 6.671414845937806e-05, 'epochs': 205, 'loss': 'mae', 'optimizer': 'adam', 'graph_mode': 'off', 'use_snp_selection': False}. Best is trial 52 with value: 0.1769979941376395.
[I 2025-12-05 14:44:41,555] Trial 124 finished with value: 0.14539953726501198 and parameters: {'model_type': 'mlp', 'hidden_dims': '[512, 128]', 'dropout': 0.3356802399423846, 'batch_norm': True, 'lr': 0.000186965179730509, 'weight_decay': 6.372483833800373e-05, 'epochs': 204, 'loss': 'mae', 'optimizer': 'adam', 'graph_mode': 'off', 'use_snp_selection': False}. Best is trial 52 with value: 0.1769979941376395.
[I 2025-12-05 14:44:44,262] Trial 125 finished with value: 0.156629520633784 and parameters: {'model_type': 'mlp', 'hidden_dims': '[512, 128]', 'dropout': 0.15310228090814434, 'batch_norm': True, 'lr': 0.00012310695300968841, 'weight_decay': 4.851399422325052e-05, 'epochs': 162, 'loss': 'mae', 'optimizer': 'adam', 'graph_mode': 'off', 'use_snp_selection': False}. Best is trial 52 with value: 0.1769979941376395.
[I 2025-12-05 14:44:47,287] Trial 126 finished with value: 0.15829777717833965 and parameters: {'model_type': 'mlp', 'hidden_dims': '[512, 128]', 'dropout': 0.18168015645058427, 'batch_norm': True, 'lr': 0.00018162059164845916, 'weight_decay': 4.118515355525937e-05, 'epochs': 188, 'loss': 'mae', 'optimizer': 'adam', 'graph_mode': 'off', 'use_snp_selection': False}. Best is trial 52 with value: 0.1769979941376395.
[I 2025-12-05 14:44:50,615] Trial 127 finished with value: 0.1456565908354629 and parameters: {'model_type': 'mlp', 'hidden_dims': '[512, 256]', 'dropout': 0.13478588045752724, 'batch_norm': True, 'lr': 4.750315233654943e-05, 'weight_decay': 9.531806052028976e-05, 'epochs': 208, 'loss': 'mae', 'optimizer': 'adam', 'graph_mode': 'off', 'use_snp_selection': False}. Best is trial 52 with value: 0.1769979941376395.
[I 2025-12-05 14:44:54,161] Trial 128 finished with value: 0.16182329322064629 and parameters: {'model_type': 'mlp', 'hidden_dims': '[512, 64]', 'dropout': 0.1489277737231916, 'batch_norm': True, 'lr': 0.00014704249465191666, 'weight_decay': 5.719673541897194e-05, 'epochs': 230, 'loss': 'mae', 'optimizer': 'adam', 'graph_mode': 'off', 'use_snp_selection': False}. Best is trial 52 with value: 0.1769979941376395.
[I 2025-12-05 14:44:56,084] Trial 129 finished with value: 0.10680132423737415 and parameters: {'model_type': 'mlp', 'hidden_dims': '[256, 128, 64]', 'dropout': 0.10051767907068292, 'batch_norm': True, 'lr': 0.0002231665955686059, 'weight_decay': 3.51531525300512e-05, 'epochs': 197, 'loss': 'mse', 'optimizer': 'adam', 'graph_mode': 'off', 'use_snp_selection': True, 'num_snps': 9760}. Best is trial 52 with value: 0.1769979941376395.
[I 2025-12-05 14:44:59,805] Trial 130 finished with value: 0.1595595584410905 and parameters: {'model_type': 'mlp', 'hidden_dims': '[512, 128]', 'dropout': 0.16644136879304652, 'batch_norm': True, 'lr': 0.0003477887548847441, 'weight_decay': 0.00014320008423802195, 'epochs': 244, 'loss': 'mae', 'optimizer': 'adam', 'graph_mode': 'off', 'use_snp_selection': False}. Best is trial 52 with value: 0.1769979941376395.
[I 2025-12-05 14:45:04,238] Trial 131 finished with value: 0.12181201383567669 and parameters: {'model_type': 'mlp', 'hidden_dims': '[512, 128]', 'dropout': 0.12318653800091356, 'batch_norm': True, 'lr': 9.790320162923424e-06, 'weight_decay': 1.6823987284371334e-05, 'epochs': 299, 'loss': 'mae', 'optimizer': 'adam', 'graph_mode': 'off', 'use_snp_selection': False}. Best is trial 52 with value: 0.1769979941376395.
[I 2025-12-05 14:45:07,676] Trial 132 finished with value: 0.15475279731103375 and parameters: {'model_type': 'mlp', 'hidden_dims': '[512, 128]', 'dropout': 0.11231863159007412, 'batch_norm': True, 'lr': 0.0007107460078266106, 'weight_decay': 3.3433789424959155e-05, 'epochs': 219, 'loss': 'mae', 'optimizer': 'adam', 'graph_mode': 'off', 'use_snp_selection': False}. Best is trial 52 with value: 0.1769979941376395.
[I 2025-12-05 14:45:12,036] Trial 133 finished with value: 0.15611944880579118 and parameters: {'model_type': 'mlp', 'hidden_dims': '[512, 128]', 'dropout': 0.5005286756291119, 'batch_norm': True, 'lr': 0.0002496879038658856, 'weight_decay': 4.649734556891943e-05, 'epochs': 292, 'loss': 'mae', 'optimizer': 'adam', 'graph_mode': 'off', 'use_snp_selection': False}. Best is trial 52 with value: 0.1769979941376395.
[I 2025-12-05 14:45:16,803] Trial 134 finished with value: 0.14946649876364654 and parameters: {'model_type': 'mlp', 'hidden_dims': '[512, 128]', 'dropout': 0.13550944440767915, 'batch_norm': True, 'lr': 0.00031288823902977985, 'weight_decay': 6.912522976996542e-05, 'epochs': 328, 'loss': 'mae', 'optimizer': 'adam', 'graph_mode': 'off', 'use_snp_selection': False}. Best is trial 52 with value: 0.1769979941376395.
[I 2025-12-05 14:45:20,755] Trial 135 finished with value: 0.16009869452732395 and parameters: {'model_type': 'mlp', 'hidden_dims': '[512, 128]', 'dropout': 0.12436319766355146, 'batch_norm': True, 'lr': 0.0004131965787120262, 'weight_decay': 8.041689842774145e-05, 'epochs': 259, 'loss': 'mae', 'optimizer': 'adam', 'graph_mode': 'off', 'use_snp_selection': False}. Best is trial 52 with value: 0.1769979941376395.
[I 2025-12-05 14:45:24,585] Trial 136 finished with value: 0.15429504192717308 and parameters: {'model_type': 'mlp', 'hidden_dims': '[512, 128]', 'dropout': 0.10941542572123493, 'batch_norm': True, 'lr': 0.00020455882932399324, 'weight_decay': 0.0002060600814740972, 'epochs': 252, 'loss': 'mae', 'optimizer': 'adam', 'graph_mode': 'off', 'use_snp_selection': False}. Best is trial 52 with value: 0.1769979941376395.
[I 2025-12-05 14:45:28,213] Trial 137 finished with value: 0.14978740237487242 and parameters: {'model_type': 'mlp', 'hidden_dims': '[512, 128]', 'dropout': 0.14130450674602912, 'batch_norm': True, 'lr': 0.00037758022489835653, 'weight_decay': 1.234293070928958e-07, 'epochs': 236, 'loss': 'mae', 'optimizer': 'adam', 'graph_mode': 'off', 'use_snp_selection': False}. Best is trial 52 with value: 0.1769979941376395.
[I 2025-12-05 14:45:30,950] Trial 138 finished with value: 0.1566733935734529 and parameters: {'model_type': 'mlp', 'hidden_dims': '[256, 128]', 'dropout': 0.10079655030103114, 'batch_norm': True, 'lr': 0.0008413796680827622, 'weight_decay': 4.966341739188834e-07, 'epochs': 316, 'loss': 'mae', 'optimizer': 'adam', 'graph_mode': 'off', 'use_snp_selection': False}. Best is trial 52 with value: 0.1769979941376395.
[I 2025-12-05 14:45:35,146] Trial 139 finished with value: 0.15268598162932645 and parameters: {'model_type': 'mlp', 'hidden_dims': '[512, 128]', 'dropout': 0.15979030962417973, 'batch_norm': True, 'lr': 0.0005207147494242525, 'weight_decay': 0.0005586103630186783, 'epochs': 279, 'loss': 'mae', 'optimizer': 'adam', 'graph_mode': 'off', 'use_snp_selection': False}. Best is trial 52 with value: 0.1769979941376395.
[I 2025-12-05 14:45:39,038] Trial 140 finished with value: 0.10309521932792204 and parameters: {'model_type': 'mlp', 'hidden_dims': '[512, 256]', 'dropout': 0.11804010181231678, 'batch_norm': False, 'lr': 0.0006159665596822175, 'weight_decay': 0.0009887458784373058, 'epochs': 265, 'loss': 'mse', 'optimizer': 'adam', 'graph_mode': 'off', 'use_snp_selection': False}. Best is trial 52 with value: 0.1769979941376395.
[I 2025-12-05 14:45:43,177] Trial 141 finished with value: 0.1608105172725383 and parameters: {'model_type': 'mlp', 'hidden_dims': '[512, 128]', 'dropout': 0.12799861014422217, 'batch_norm': True, 'lr': 0.0002857021740561074, 'weight_decay': 2.0485688308089546e-06, 'epochs': 274, 'loss': 'mae', 'optimizer': 'adam', 'graph_mode': 'off', 'use_snp_selection': False}. Best is trial 52 with value: 0.1769979941376395.
[I 2025-12-05 14:45:47,513] Trial 142 finished with value: 0.164852791009369 and parameters: {'model_type': 'mlp', 'hidden_dims': '[512, 128]', 'dropout': 0.11581738135203304, 'batch_norm': True, 'lr': 0.00024178314766375828, 'weight_decay': 6.809340778974269e-07, 'epochs': 293, 'loss': 'mae', 'optimizer': 'adam', 'graph_mode': 'off', 'use_snp_selection': False}. Best is trial 52 with value: 0.1769979941376395.
[I 2025-12-05 14:45:51,820] Trial 143 finished with value: 0.16511599218810016 and parameters: {'model_type': 'mlp', 'hidden_dims': '[512, 128]', 'dropout': 0.13358637103429064, 'batch_norm': True, 'lr': 0.00016337719075567108, 'weight_decay': 2.1411750553302483e-07, 'epochs': 291, 'loss': 'mae', 'optimizer': 'adam', 'graph_mode': 'off', 'use_snp_selection': False}. Best is trial 52 with value: 0.1769979941376395.
[I 2025-12-05 14:45:55,605] Trial 144 finished with value: 0.15934663729258092 and parameters: {'model_type': 'mlp', 'hidden_dims': '[512, 128]', 'dropout': 0.14708826023489913, 'batch_norm': True, 'lr': 0.000174058500360616, 'weight_decay': 1.5832266695490089e-07, 'epochs': 246, 'loss': 'mae', 'optimizer': 'adam', 'graph_mode': 'off', 'use_snp_selection': False}. Best is trial 52 with value: 0.1769979941376395.
[I 2025-12-05 14:46:00,090] Trial 145 finished with value: 0.15805106382836237 and parameters: {'model_type': 'mlp', 'hidden_dims': '[512, 128]', 'dropout': 0.12968090369392923, 'batch_norm': True, 'lr': 0.00013054012794946958, 'weight_decay': 2.552952482007042e-07, 'epochs': 305, 'loss': 'mae', 'optimizer': 'adam', 'graph_mode': 'off', 'use_snp_selection': False}. Best is trial 52 with value: 0.1769979941376395.
[I 2025-12-05 14:46:04,309] Trial 146 finished with value: 0.16044010398685715 and parameters: {'model_type': 'mlp', 'hidden_dims': '[512, 128]', 'dropout': 0.137319170701126, 'batch_norm': True, 'lr': 0.00015509101085862397, 'weight_decay': 1.9742414339805646e-07, 'epochs': 284, 'loss': 'mae', 'optimizer': 'adam', 'graph_mode': 'off', 'use_snp_selection': False}. Best is trial 52 with value: 0.1769979941376395.
[I 2025-12-05 14:46:08,737] Trial 147 finished with value: 0.15078527994597238 and parameters: {'model_type': 'mlp', 'hidden_dims': '[512, 128]', 'dropout': 0.156020591019819, 'batch_norm': True, 'lr': 0.00019749116354032017, 'weight_decay': 3.026039603162444e-07, 'epochs': 299, 'loss': 'mae', 'optimizer': 'adam', 'graph_mode': 'off', 'use_snp_selection': False}. Best is trial 52 with value: 0.1769979941376395.
[I 2025-12-05 14:46:12,797] Trial 148 finished with value: 0.16778578869611874 and parameters: {'model_type': 'mlp', 'hidden_dims': '[512, 128]', 'dropout': 0.11362330661701679, 'batch_norm': True, 'lr': 0.00010850648001891934, 'weight_decay': 1.0224686004152854e-07, 'epochs': 269, 'loss': 'mae', 'optimizer': 'adam', 'graph_mode': 'off', 'use_snp_selection': False}. Best is trial 52 with value: 0.1769979941376395.
[I 2025-12-05 14:46:14,141] Trial 149 finished with value: 0.15039635807961724 and parameters: {'model_type': 'mlp', 'hidden_dims': '[128, 64]', 'dropout': 0.17431879438691125, 'batch_norm': True, 'lr': 0.00010215113971944061, 'weight_decay': 1.4175221686030887e-07, 'epochs': 255, 'loss': 'mae', 'optimizer': 'adam', 'graph_mode': 'off', 'use_snp_selection': False}. Best is trial 52 with value: 0.1769979941376395.
[I 2025-12-05 14:46:16,562] Trial 0 finished with value: 0.03558407864176102 and parameters: {'model_type': 'mlp', 'hidden_dims': '[128, 64]', 'dropout': 0.199031432379812, 'batch_norm': True, 'lr': 1.8408544111075837e-06, 'weight_decay': 5.5136510071208614e-05, 'epochs': 336, 'loss': 'mae', 'optimizer': 'adam', 'graph_mode': 'off', 'use_snp_selection': True, 'num_snps': 43862}. Best is trial 0 with value: 0.03558407864176102.
[I 2025-12-05 14:46:17,863] Trial 1 finished with value: 0.10371243077533142 and parameters: {'model_type': 'mlp', 'hidden_dims': '[256, 128]', 'dropout': 0.4370668075331726, 'batch_norm': True, 'lr': 7.133471581159139e-05, 'weight_decay': 1.128633586803549e-05, 'epochs': 242, 'loss': 'mae', 'optimizer': 'adam', 'graph_mode': 'off', 'use_snp_selection': False}. Best is trial 1 with value: 0.10371243077533142.
[I 2025-12-05 14:46:19,057] Trial 2 finished with value: 0.04148121583042552 and parameters: {'model_type': 'mlp', 'hidden_dims': '[256, 128, 64]', 'dropout': 0.41314357415569625, 'batch_norm': False, 'lr': 3.952233718592101e-06, 'weight_decay': 0.00026754769258252603, 'epochs': 149, 'loss': 'mse', 'optimizer': 'adam', 'graph_mode': 'off', 'use_snp_selection': True, 'num_snps': 11571}. Best is trial 1 with value: 0.10371243077533142.
[I 2025-12-05 14:46:21,617] Trial 3 finished with value: 0.04016954339423762 and parameters: {'model_type': 'mlp', 'hidden_dims': '[512, 64]', 'dropout': 0.5938127374509361, 'batch_norm': False, 'lr': 5.67704586114731e-06, 'weight_decay': 2.4518087630137052e-05, 'epochs': 320, 'loss': 'mae', 'optimizer': 'adam', 'graph_mode': 'off', 'use_snp_selection': False}. Best is trial 1 with value: 0.10371243077533142.
[I 2025-12-05 14:46:24,350] Trial 4 finished with value: 0.04152923859260656 and parameters: {'model_type': 'mlp', 'hidden_dims': '[512, 128]', 'dropout': 0.25746343592134413, 'batch_norm': True, 'lr': 1.3467657668402788e-06, 'weight_decay': 0.00033087251918647806, 'epochs': 277, 'loss': 'mse', 'optimizer': 'adam', 'graph_mode': 'off', 'use_snp_selection': True, 'num_snps': 36675}. Best is trial 1 with value: 0.10371243077533142.
[I 2025-12-05 14:46:26,509] Trial 5 finished with value: 0.03613171134462663 and parameters: {'model_type': 'mlp', 'hidden_dims': '[512, 64]', 'dropout': 0.38275350994408375, 'batch_norm': True, 'lr': 1.5586664309232824e-06, 'weight_decay': 0.0008227664668621182, 'epochs': 145, 'loss': 'mae', 'optimizer': 'adam', 'graph_mode': 'off', 'use_snp_selection': True, 'num_snps': 32148}. Best is trial 1 with value: 0.10371243077533142.
[I 2025-12-05 14:46:27,658] Trial 6 finished with value: 0.12995315368379257 and parameters: {'model_type': 'mlp', 'hidden_dims': '[256, 128]', 'dropout': 0.3930109900265879, 'batch_norm': False, 'lr': 4.892964372128395e-05, 'weight_decay': 1.5809549317992182e-06, 'epochs': 199, 'loss': 'mse', 'optimizer': 'adam', 'graph_mode': 'off', 'use_snp_selection': False}. Best is trial 6 with value: 0.12995315368379257.
[I 2025-12-05 14:46:28,920] Trial 7 finished with value: 0.0934197789840932 and parameters: {'model_type': 'mlp', 'hidden_dims': '[512, 256]', 'dropout': 0.15343979219678458, 'batch_norm': True, 'lr': 6.234003099047341e-05, 'weight_decay': 3.894760610535477e-07, 'epochs': 97, 'loss': 'mse', 'optimizer': 'adam', 'graph_mode': 'off', 'use_snp_selection': False}. Best is trial 6 with value: 0.12995315368379257.
[I 2025-12-05 14:46:31,462] Trial 8 finished with value: 0.1085999871712044 and parameters: {'model_type': 'mlp', 'hidden_dims': '[512, 128]', 'dropout': 0.10743001231661406, 'batch_norm': True, 'lr': 0.00023728538449271062, 'weight_decay': 1.7629071578048637e-05, 'epochs': 312, 'loss': 'mae', 'optimizer': 'adam', 'graph_mode': 'off', 'use_snp_selection': False}. Best is trial 6 with value: 0.12995315368379257.
[I 2025-12-05 14:46:33,208] Trial 9 finished with value: 0.11688732823170661 and parameters: {'model_type': 'mlp', 'hidden_dims': '[512, 64]', 'dropout': 0.14505336736221927, 'batch_norm': True, 'lr': 5.8619638388111826e-05, 'weight_decay': 6.200156172669308e-07, 'epochs': 175, 'loss': 'mse', 'optimizer': 'adam', 'graph_mode': 'off', 'use_snp_selection': False}. Best is trial 6 with value: 0.12995315368379257.
[I 2025-12-05 14:46:33,923] Trial 10 finished with value: 0.08293460816653737 and parameters: {'model_type': 'mlp', 'hidden_dims': '[256, 128]', 'dropout': 0.5267360651501256, 'batch_norm': False, 'lr': 0.00032393778075602147, 'weight_decay': 1.936962886850364e-06, 'epochs': 46, 'loss': 'mse', 'optimizer': 'adam', 'graph_mode': 'off', 'use_snp_selection': False}. Best is trial 6 with value: 0.12995315368379257.
[I 2025-12-05 14:46:35,040] Trial 11 finished with value: 0.11393478858410949 and parameters: {'model_type': 'mlp', 'hidden_dims': '[256, 128]', 'dropout': 0.30438831352760154, 'batch_norm': False, 'lr': 1.6474108386126448e-05, 'weight_decay': 1.1958586605608392e-07, 'epochs': 185, 'loss': 'mse', 'optimizer': 'adam', 'graph_mode': 'off', 'use_snp_selection': False}. Best is trial 6 with value: 0.12995315368379257.
[I 2025-12-05 14:46:37,008] Trial 12 finished with value: 0.10561781085692522 and parameters: {'model_type': 'mlp', 'hidden_dims': '[512, 64]', 'dropout': 0.2566297617165757, 'batch_norm': False, 'lr': 2.1956038299947918e-05, 'weight_decay': 1.255784110448998e-06, 'epochs': 218, 'loss': 'mse', 'optimizer': 'adam', 'graph_mode': 'off', 'use_snp_selection': False}. Best is trial 6 with value: 0.12995315368379257.
[I 2025-12-05 14:46:37,793] Trial 13 finished with value: 0.09062470467650469 and parameters: {'model_type': 'mlp', 'hidden_dims': '[128, 64]', 'dropout': 0.4741937675090661, 'batch_norm': False, 'lr': 8.582121287988678e-05, 'weight_decay': 2.269687923320985e-06, 'epochs': 174, 'loss': 'mse', 'optimizer': 'adam', 'graph_mode': 'off', 'use_snp_selection': False}. Best is trial 6 with value: 0.12995315368379257.
[I 2025-12-05 14:46:39,129] Trial 14 finished with value: 0.1174297721566255 and parameters: {'model_type': 'mlp', 'hidden_dims': '[256, 128, 64]', 'dropout': 0.3012984444538551, 'batch_norm': True, 'lr': 0.0006681578335050954, 'weight_decay': 4.808456429945621e-07, 'epochs': 246, 'loss': 'mse', 'optimizer': 'adam', 'graph_mode': 'off', 'use_snp_selection': False}. Best is trial 6 with value: 0.12995315368379257.
[I 2025-12-05 14:46:40,451] Trial 15 finished with value: 0.1270337594321714 and parameters: {'model_type': 'mlp', 'hidden_dims': '[256, 128, 64]', 'dropout': 0.32572093903428045, 'batch_norm': False, 'lr': 0.0006216690609510676, 'weight_decay': 1.2239391526087753e-07, 'epochs': 254, 'loss': 'mse', 'optimizer': 'adam', 'graph_mode': 'off', 'use_snp_selection': False}. Best is trial 6 with value: 0.12995315368379257.
[I 2025-12-05 14:46:41,879] Trial 16 finished with value: 0.09373869150392052 and parameters: {'model_type': 'mlp', 'hidden_dims': '[256, 128, 64]', 'dropout': 0.33905627926991483, 'batch_norm': False, 'lr': 0.0007560683756175617, 'weight_decay': 1.105292204915476e-07, 'epochs': 287, 'loss': 'mse', 'optimizer': 'adam', 'graph_mode': 'off', 'use_snp_selection': False}. Best is trial 6 with value: 0.12995315368379257.
[I 2025-12-05 14:46:43,981] Trial 17 finished with value: 0.11206455264542786 and parameters: {'model_type': 'mlp', 'hidden_dims': '[512, 256]', 'dropout': 0.506158305663621, 'batch_norm': False, 'lr': 0.00020080387707850192, 'weight_decay': 7.028490454089706e-06, 'epochs': 239, 'loss': 'mse', 'optimizer': 'adam', 'graph_mode': 'off', 'use_snp_selection': False}. Best is trial 6 with value: 0.12995315368379257.
[I 2025-12-05 14:46:47,062] Trial 18 finished with value: 0.1293359923934324 and parameters: {'model_type': 'mlp', 'hidden_dims': '[256, 128]', 'dropout': 0.37428250764473453, 'batch_norm': False, 'lr': 1.192702186255374e-05, 'weight_decay': 4.109412643182284e-06, 'epochs': 278, 'loss': 'mse', 'optimizer': 'adam', 'graph_mode': 'off', 'use_snp_selection': True, 'num_snps': 58241}. Best is trial 6 with value: 0.12995315368379257.
[I 2025-12-05 14:46:49,912] Trial 19 finished with value: 0.1061364375553398 and parameters: {'model_type': 'mlp', 'hidden_dims': '[256, 128]', 'dropout': 0.39346547913906177, 'batch_norm': False, 'lr': 1.0436614786391874e-05, 'weight_decay': 4.783105564689756e-06, 'epochs': 210, 'loss': 'mse', 'optimizer': 'adam', 'graph_mode': 'off', 'use_snp_selection': True, 'num_snps': 55667}. Best is trial 6 with value: 0.12995315368379257.
