[I 2025-12-06 12:57:29,164] Trial 136 finished with value: 0.3723788984126887 and parameters: {'model_type': 'mlp', 'hidden_dims': '[512, 64]', 'dropout': 0.5706218664639879, 'batch_norm': False, 'lr': 4.880810677776752e-06, 'weight_decay': 7.369405464387145e-05, 'epochs': 128, 'loss': 'mse', 'optimizer': 'adam', 'graph_mode': 'off', 'use_snp_selection': False}. Best is trial 134 with value: 0.37854464520042397.
[I 2025-12-06 12:58:12,172] Trial 137 finished with value: 0.372926554788758 and parameters: {'model_type': 'mlp', 'hidden_dims': '[512, 64]', 'dropout': 0.5549771230937008, 'batch_norm': False, 'lr': 3.961438309764846e-06, 'weight_decay': 6.433504652299135e-05, 'epochs': 197, 'loss': 'mse', 'optimizer': 'adam', 'graph_mode': 'off', 'use_snp_selection': False}. Best is trial 134 with value: 0.37854464520042397.
[I 2025-12-06 12:58:51,370] Trial 138 finished with value: 0.3727713651460483 and parameters: {'model_type': 'mlp', 'hidden_dims': '[512, 64]', 'dropout': 0.5423095598813555, 'batch_norm': False, 'lr': 2.993053511175106e-06, 'weight_decay': 4.7096716669990975e-05, 'epochs': 177, 'loss': 'mse', 'optimizer': 'adam', 'graph_mode': 'off', 'use_snp_selection': False}. Best is trial 134 with value: 0.37854464520042397.
[I 2025-12-06 12:59:16,562] Trial 139 finished with value: 0.3655291333017982 and parameters: {'model_type': 'mlp', 'hidden_dims': '[512, 64]', 'dropout': 0.5652291425903367, 'batch_norm': False, 'lr': 3.412760850410582e-06, 'weight_decay': 1.4900330479079688e-05, 'epochs': 104, 'loss': 'mse', 'optimizer': 'adam', 'graph_mode': 'off', 'use_snp_selection': False}. Best is trial 134 with value: 0.37854464520042397.
[I 2025-12-06 12:59:53,880] Trial 140 finished with value: 0.37411041438668763 and parameters: {'model_type': 'mlp', 'hidden_dims': '[512, 128]', 'dropout': 0.530027991877648, 'batch_norm': False, 'lr': 2.5579047685123855e-06, 'weight_decay': 2.019074855717766e-05, 'epochs': 167, 'loss': 'mse', 'optimizer': 'adam', 'graph_mode': 'off', 'use_snp_selection': False}. Best is trial 134 with value: 0.37854464520042397.
[I 2025-12-06 13:00:15,764] Trial 141 finished with value: 0.3647154900783801 and parameters: {'model_type': 'mlp', 'hidden_dims': '[512, 64]', 'dropout': 0.5833650299612101, 'batch_norm': False, 'lr': 6.9165301151126036e-06, 'weight_decay': 0.00010917846453951111, 'epochs': 87, 'loss': 'mse', 'optimizer': 'adam', 'graph_mode': 'off', 'use_snp_selection': False}. Best is trial 134 with value: 0.37854464520042397.
[I 2025-12-06 13:00:47,370] Trial 142 finished with value: 0.36114468341661626 and parameters: {'model_type': 'mlp', 'hidden_dims': '[256, 128, 64]', 'dropout': 0.5534994048966995, 'batch_norm': False, 'lr': 8.666035599784552e-06, 'weight_decay': 0.00013770462054443888, 'epochs': 119, 'loss': 'mse', 'optimizer': 'adam', 'graph_mode': 'off', 'use_snp_selection': True, 'num_snps': 21021}. Best is trial 134 with value: 0.37854464520042397.
[I 2025-12-06 13:01:11,177] Trial 143 finished with value: 0.36881927031667244 and parameters: {'model_type': 'mlp', 'hidden_dims': '[512, 128]', 'dropout': 0.5402669742458485, 'batch_norm': False, 'lr': 5.420687019051409e-06, 'weight_decay': 3.587758089140297e-05, 'epochs': 98, 'loss': 'mse', 'optimizer': 'adam', 'graph_mode': 'off', 'use_snp_selection': False}. Best is trial 134 with value: 0.37854464520042397.
[I 2025-12-06 13:01:45,040] Trial 144 finished with value: 0.3679040947174945 and parameters: {'model_type': 'mlp', 'hidden_dims': '[512, 64]', 'dropout': 0.5734213216028872, 'batch_norm': False, 'lr': 1.2608667771493294e-05, 'weight_decay': 0.00021928778323038547, 'epochs': 152, 'loss': 'mse', 'optimizer': 'adam', 'graph_mode': 'off', 'use_snp_selection': False}. Best is trial 134 with value: 0.37854464520042397.
[I 2025-12-06 13:02:09,652] Trial 145 finished with value: 0.3368055825560833 and parameters: {'model_type': 'mlp', 'hidden_dims': '[512, 128]', 'dropout': 0.26183960779290905, 'batch_norm': False, 'lr': 4.492261220696292e-06, 'weight_decay': 8.911482116827924e-05, 'epochs': 180, 'loss': 'mse', 'optimizer': 'adam', 'graph_mode': 'off', 'use_snp_selection': True, 'num_snps': 3330}. Best is trial 134 with value: 0.37854464520042397.
[I 2025-12-06 13:02:19,169] Trial 146 finished with value: 0.2569939647168805 and parameters: {'model_type': 'mlp', 'hidden_dims': '[128, 64]', 'dropout': 0.5608772435834448, 'batch_norm': True, 'lr': 2.2158490482062094e-06, 'weight_decay': 0.000119652634509545, 'epochs': 92, 'loss': 'mse', 'optimizer': 'adam', 'graph_mode': 'off', 'use_snp_selection': False}. Best is trial 134 with value: 0.37854464520042397.
[I 2025-12-06 13:02:59,876] Trial 147 finished with value: 0.23471912637955575 and parameters: {'model_type': 'mlp', 'hidden_dims': '[512, 64]', 'dropout': 0.17176436712285478, 'batch_norm': False, 'lr': 0.00041439412501127895, 'weight_decay': 0.0001701180420189028, 'epochs': 192, 'loss': 'mse', 'optimizer': 'adam', 'graph_mode': 'off', 'use_snp_selection': False}. Best is trial 134 with value: 0.37854464520042397.
[I 2025-12-06 13:03:57,979] Trial 148 finished with value: 0.3669368637616278 and parameters: {'model_type': 'mlp', 'hidden_dims': '[512, 128]', 'dropout': 0.5227166084172568, 'batch_norm': False, 'lr': 3.7373172184480357e-06, 'weight_decay': 5.3566737838592025e-05, 'epochs': 163, 'loss': 'mse', 'optimizer': 'adam', 'graph_mode': 'off', 'use_snp_selection': True, 'num_snps': 45803}. Best is trial 134 with value: 0.37854464520042397.
[I 2025-12-06 13:04:19,612] Trial 149 finished with value: 0.36432346907271407 and parameters: {'model_type': 'mlp', 'hidden_dims': '[256, 128]', 'dropout': 0.5941510653622855, 'batch_norm': False, 'lr': 2.6858883118072123e-06, 'weight_decay': 2.854447280679066e-05, 'epochs': 171, 'loss': 'mse', 'optimizer': 'adam', 'graph_mode': 'off', 'use_snp_selection': False}. Best is trial 134 with value: 0.37854464520042397.
