[I 2025-12-05 15:33:27,812] Trial 16 finished with value: -0.01733890654480845 and parameters: {'model_type': 'mlp', 'hidden_dims': '[256, 128, 64]', 'dropout': 0.5091001905188361, 'batch_norm': False, 'lr': 0.00021783781789519438, 'weight_decay': 4.67635342570317e-07, 'epochs': 115, 'loss': 'mae', 'optimizer': 'adam', 'graph_mode': 'off', 'use_snp_selection': False}. Best is trial 10 with value: 0.026692469015349163.
[I 2025-12-05 15:33:28,846] Trial 17 finished with value: -0.015579776094896707 and parameters: {'model_type': 'mlp', 'hidden_dims': '[512, 64]', 'dropout': 0.4599163501058064, 'batch_norm': False, 'lr': 0.000906375209920231, 'weight_decay': 1.3398043894594233e-06, 'epochs': 71, 'loss': 'mae', 'optimizer': 'adam', 'graph_mode': 'off', 'use_snp_selection': False}. Best is trial 10 with value: 0.026692469015349163.
[I 2025-12-05 15:33:32,381] Trial 18 finished with value: -0.029203880418844752 and parameters: {'model_type': 'mlp', 'hidden_dims': '[512, 64]', 'dropout': 0.5485291674363698, 'batch_norm': False, 'lr': 8.709402589858703e-06, 'weight_decay': 7.197637349971628e-05, 'epochs': 226, 'loss': 'mae', 'optimizer': 'adam', 'graph_mode': 'off', 'use_snp_selection': True, 'num_snps': 58241}. Best is trial 10 with value: 0.026692469015349163.
[I 2025-12-05 15:33:33,747] Trial 19 finished with value: -0.017369161875035635 and parameters: {'model_type': 'mlp', 'hidden_dims': '[512, 64]', 'dropout': 0.3274540220844255, 'batch_norm': False, 'lr': 2.7309185585511194e-05, 'weight_decay': 2.3050635906856387e-07, 'epochs': 133, 'loss': 'mae', 'optimizer': 'adam', 'graph_mode': 'off', 'use_snp_selection': False}. Best is trial 10 with value: 0.026692469015349163.
[I 2025-12-05 15:33:34,760] Trial 20 finished with value: -0.013464231908380732 and parameters: {'model_type': 'mlp', 'hidden_dims': '[512, 128]', 'dropout': 0.5555807096041452, 'batch_norm': False, 'lr': 2.8346086927902196e-06, 'weight_decay': 6.433416948757086e-06, 'epochs': 71, 'loss': 'mae', 'optimizer': 'adam', 'graph_mode': 'off', 'use_snp_selection': False}. Best is trial 10 with value: 0.026692469015349163.
[I 2025-12-05 15:33:36,699] Trial 21 finished with value: 0.007723245922002859 and parameters: {'model_type': 'mlp', 'hidden_dims': '[512, 64]', 'dropout': 0.5801943431504863, 'batch_norm': False, 'lr': 7.447119888337097e-06, 'weight_decay': 4.297056457959928e-05, 'epochs': 270, 'loss': 'mae', 'optimizer': 'adam', 'graph_mode': 'off', 'use_snp_selection': False}. Best is trial 10 with value: 0.026692469015349163.
[I 2025-12-05 15:33:38,982] Trial 22 finished with value: -0.03909346070560869 and parameters: {'model_type': 'mlp', 'hidden_dims': '[512, 64]', 'dropout': 0.5954392114625428, 'batch_norm': False, 'lr': 3.477396262636142e-06, 'weight_decay': 2.234736040373779e-05, 'epochs': 343, 'loss': 'mae', 'optimizer': 'adam', 'graph_mode': 'off', 'use_snp_selection': False}. Best is trial 10 with value: 0.026692469015349163.
[I 2025-12-05 15:33:40,546] Trial 23 finished with value: -0.026365867986555516 and parameters: {'model_type': 'mlp', 'hidden_dims': '[512, 64]', 'dropout': 0.4835532484303363, 'batch_norm': False, 'lr': 6.3124350372302285e-06, 'weight_decay': 1.337661036202276e-06, 'epochs': 183, 'loss': 'mae', 'optimizer': 'adam', 'graph_mode': 'off', 'use_snp_selection': False}. Best is trial 10 with value: 0.026692469015349163.
[I 2025-12-05 15:33:42,663] Trial 24 finished with value: -0.007896561545637108 and parameters: {'model_type': 'mlp', 'hidden_dims': '[512, 64]', 'dropout': 0.5162142006383152, 'batch_norm': False, 'lr': 2.7013005792357815e-05, 'weight_decay': 9.697960693100934e-05, 'epochs': 300, 'loss': 'mae', 'optimizer': 'adam', 'graph_mode': 'off', 'use_snp_selection': False}. Best is trial 10 with value: 0.026692469015349163.
[I 2025-12-05 15:33:44,478] Trial 25 finished with value: -0.008985578393246256 and parameters: {'model_type': 'mlp', 'hidden_dims': '[512, 256]', 'dropout': 0.599048443037655, 'batch_norm': False, 'lr': 2.5246235599105472e-06, 'weight_decay': 2.1053908705806355e-05, 'epochs': 235, 'loss': 'mae', 'optimizer': 'adam', 'graph_mode': 'off', 'use_snp_selection': False}. Best is trial 10 with value: 0.026692469015349163.
[I 2025-12-05 15:33:45,214] Trial 26 finished with value: -0.0331303509586905 and parameters: {'model_type': 'mlp', 'hidden_dims': '[256, 128]', 'dropout': 0.5545828071842807, 'batch_norm': False, 'lr': 1.2102317464274057e-05, 'weight_decay': 2.53607323042403e-06, 'epochs': 47, 'loss': 'mse', 'optimizer': 'adam', 'graph_mode': 'off', 'use_snp_selection': True, 'num_snps': 3842}. Best is trial 10 with value: 0.026692469015349163.
[I 2025-12-05 15:33:45,852] Trial 27 finished with value: -0.037657415222450905 and parameters: {'model_type': 'mlp', 'hidden_dims': '[128, 64]', 'dropout': 0.4482319547172068, 'batch_norm': False, 'lr': 1.993900549717498e-05, 'weight_decay': 6.9353603097244e-06, 'epochs': 90, 'loss': 'mae', 'optimizer': 'adam', 'graph_mode': 'off', 'use_snp_selection': False}. Best is trial 10 with value: 0.026692469015349163.
[I 2025-12-05 15:33:46,973] Trial 28 finished with value: 0.012088781960900984 and parameters: {'model_type': 'mlp', 'hidden_dims': '[256, 128, 64]', 'dropout': 0.5446517125861267, 'batch_norm': False, 'lr': 1.0562377048190092e-06, 'weight_decay': 0.00015272473867071942, 'epochs': 212, 'loss': 'mae', 'optimizer': 'adam', 'graph_mode': 'off', 'use_snp_selection': False}. Best is trial 10 with value: 0.026692469015349163.
[I 2025-12-05 15:33:48,216] Trial 29 finished with value: 0.021373871248711315 and parameters: {'model_type': 'mlp', 'hidden_dims': '[128, 64]', 'dropout': 0.49589671868792384, 'batch_norm': False, 'lr': 2.2329990928910513e-06, 'weight_decay': 4.2830829448126104e-05, 'epochs': 122, 'loss': 'mae', 'optimizer': 'adam', 'graph_mode': 'off', 'use_snp_selection': True, 'num_snps': 19468}. Best is trial 10 with value: 0.026692469015349163.
[I 2025-12-05 15:33:49,431] Trial 30 finished with value: 0.018831562933088228 and parameters: {'model_type': 'mlp', 'hidden_dims': '[128, 64]', 'dropout': 0.49156332406223274, 'batch_norm': False, 'lr': 2.2577767229492036e-06, 'weight_decay': 2.3722011435539794e-07, 'epochs': 127, 'loss': 'mae', 'optimizer': 'adam', 'graph_mode': 'off', 'use_snp_selection': True, 'num_snps': 18365}. Best is trial 10 with value: 0.026692469015349163.
[I 2025-12-05 15:33:50,644] Trial 31 finished with value: 0.030845206416427535 and parameters: {'model_type': 'mlp', 'hidden_dims': '[128, 64]', 'dropout': 0.48893780514879204, 'batch_norm': False, 'lr': 1.8717720058235835e-06, 'weight_decay': 2.373850613966135e-07, 'epochs': 125, 'loss': 'mae', 'optimizer': 'adam', 'graph_mode': 'off', 'use_snp_selection': True, 'num_snps': 18314}. Best is trial 31 with value: 0.030845206416427535.
[I 2025-12-05 15:33:52,052] Trial 32 finished with value: -0.01807598871649267 and parameters: {'model_type': 'mlp', 'hidden_dims': '[128, 64]', 'dropout': 0.4823689504081157, 'batch_norm': False, 'lr': 2.022120901852598e-06, 'weight_decay': 2.158882015971158e-07, 'epochs': 126, 'loss': 'mae', 'optimizer': 'adam', 'graph_mode': 'off', 'use_snp_selection': True, 'num_snps': 20866}. Best is trial 31 with value: 0.030845206416427535.
[I 2025-12-05 15:33:53,432] Trial 33 finished with value: -0.013988669457520182 and parameters: {'model_type': 'mlp', 'hidden_dims': '[128, 64]', 'dropout': 0.35804388030425904, 'batch_norm': False, 'lr': 2.1343848339349226e-06, 'weight_decay': 6.980133565937828e-07, 'epochs': 166, 'loss': 'mae', 'optimizer': 'adam', 'graph_mode': 'off', 'use_snp_selection': True, 'num_snps': 19398}. Best is trial 31 with value: 0.030845206416427535.
[I 2025-12-05 15:33:54,791] Trial 34 finished with value: -0.010565943022895458 and parameters: {'model_type': 'mlp', 'hidden_dims': '[128, 64]', 'dropout': 0.4208732694557006, 'batch_norm': False, 'lr': 4.215846147818648e-06, 'weight_decay': 2.940842315769722e-07, 'epochs': 151, 'loss': 'mae', 'optimizer': 'adam', 'graph_mode': 'off', 'use_snp_selection': True, 'num_snps': 20424}. Best is trial 31 with value: 0.030845206416427535.
[I 2025-12-05 15:33:55,990] Trial 35 finished with value: -0.02268782180828508 and parameters: {'model_type': 'mlp', 'hidden_dims': '[128, 64]', 'dropout': 0.4320075500144334, 'batch_norm': True, 'lr': 1.0686250928008656e-06, 'weight_decay': 4.04807903310428e-05, 'epochs': 127, 'loss': 'mae', 'optimizer': 'adam', 'graph_mode': 'off', 'use_snp_selection': True, 'num_snps': 15505}. Best is trial 31 with value: 0.030845206416427535.
[I 2025-12-05 15:33:57,385] Trial 36 finished with value: 0.02578038139131787 and parameters: {'model_type': 'mlp', 'hidden_dims': '[128, 64]', 'dropout': 0.46110241830901194, 'batch_norm': False, 'lr': 1.5910424745226594e-06, 'weight_decay': 9.941493039253009e-07, 'epochs': 86, 'loss': 'mse', 'optimizer': 'adam', 'graph_mode': 'off', 'use_snp_selection': True, 'num_snps': 25264}. Best is trial 31 with value: 0.030845206416427535.
[I 2025-12-05 15:33:58,886] Trial 37 finished with value: 0.00864416695538061 and parameters: {'model_type': 'mlp', 'hidden_dims': '[128, 64]', 'dropout': 0.4614484542970492, 'batch_norm': False, 'lr': 1.4731223335696722e-06, 'weight_decay': 8.398181036285424e-07, 'epochs': 62, 'loss': 'mse', 'optimizer': 'adam', 'graph_mode': 'off', 'use_snp_selection': True, 'num_snps': 30174}. Best is trial 31 with value: 0.030845206416427535.
[I 2025-12-05 15:33:59,784] Trial 38 finished with value: -0.008886633229163526 and parameters: {'model_type': 'mlp', 'hidden_dims': '[128, 64]', 'dropout': 0.4054610954358261, 'batch_norm': True, 'lr': 3.7532851214661526e-06, 'weight_decay': 2.3689808320831405e-06, 'epochs': 87, 'loss': 'mse', 'optimizer': 'adam', 'graph_mode': 'off', 'use_snp_selection': True, 'num_snps': 7456}. Best is trial 31 with value: 0.030845206416427535.
[I 2025-12-05 15:34:01,276] Trial 39 finished with value: -0.03017538756733889 and parameters: {'model_type': 'mlp', 'hidden_dims': '[128, 64]', 'dropout': 0.3692811895711126, 'batch_norm': False, 'lr': 1.7389161754418479e-06, 'weight_decay': 9.9433013353888e-06, 'epochs': 103, 'loss': 'mse', 'optimizer': 'adam', 'graph_mode': 'off', 'use_snp_selection': True, 'num_snps': 28115}. Best is trial 31 with value: 0.030845206416427535.
[I 2025-12-05 15:34:02,844] Trial 40 finished with value: -0.02060678928986766 and parameters: {'model_type': 'mlp', 'hidden_dims': '[256, 128]', 'dropout': 0.25277963469221726, 'batch_norm': True, 'lr': 5.068729630720872e-06, 'weight_decay': 0.000423718075507204, 'epochs': 153, 'loss': 'mse', 'optimizer': 'adam', 'graph_mode': 'off', 'use_snp_selection': True, 'num_snps': 25327}. Best is trial 31 with value: 0.030845206416427535.
[I 2025-12-05 15:34:03,931] Trial 41 finished with value: 0.004492574693625174 and parameters: {'model_type': 'mlp', 'hidden_dims': '[128, 64]', 'dropout': 0.4973007540958108, 'batch_norm': False, 'lr': 2.9452713544821316e-06, 'weight_decay': 1.0905565392598161e-06, 'epochs': 111, 'loss': 'mse', 'optimizer': 'adam', 'graph_mode': 'off', 'use_snp_selection': True, 'num_snps': 13788}. Best is trial 31 with value: 0.030845206416427535.
[I 2025-12-05 15:34:05,355] Trial 42 finished with value: -0.0098425998529827 and parameters: {'model_type': 'mlp', 'hidden_dims': '[128, 64]', 'dropout': 0.5230393593904321, 'batch_norm': False, 'lr': 1.492973197676841e-06, 'weight_decay': 1.792281103439449e-07, 'epochs': 138, 'loss': 'mse', 'optimizer': 'adam', 'graph_mode': 'off', 'use_snp_selection': True, 'num_snps': 23582}. Best is trial 31 with value: 0.030845206416427535.
[I 2025-12-05 15:34:06,509] Trial 43 finished with value: -0.03213082908183618 and parameters: {'model_type': 'mlp', 'hidden_dims': '[128, 64]', 'dropout': 0.46586090484258547, 'batch_norm': False, 'lr': 2.0338636017708962e-06, 'weight_decay': 4.571085139165675e-07, 'epochs': 119, 'loss': 'mae', 'optimizer': 'adam', 'graph_mode': 'off', 'use_snp_selection': True, 'num_snps': 15528}. Best is trial 31 with value: 0.030845206416427535.
[I 2025-12-05 15:34:07,443] Trial 44 finished with value: -0.017536991860544766 and parameters: {'model_type': 'mlp', 'hidden_dims': '[128, 64]', 'dropout': 0.43320044479476755, 'batch_norm': False, 'lr': 1.0279762705960482e-06, 'weight_decay': 2.0423932494107166e-06, 'epochs': 85, 'loss': 'mse', 'optimizer': 'adam', 'graph_mode': 'off', 'use_snp_selection': True, 'num_snps': 9275}. Best is trial 31 with value: 0.030845206416427535.
[I 2025-12-05 15:34:09,357] Trial 45 finished with value: -0.00024052055342724024 and parameters: {'model_type': 'mlp', 'hidden_dims': '[512, 128]', 'dropout': 0.39328220712246875, 'batch_norm': False, 'lr': 2.5927272637696333e-06, 'weight_decay': 3.055960763349517e-07, 'epochs': 59, 'loss': 'mae', 'optimizer': 'adam', 'graph_mode': 'off', 'use_snp_selection': True, 'num_snps': 36086}. Best is trial 31 with value: 0.030845206416427535.
[I 2025-12-05 15:34:10,594] Trial 46 finished with value: 0.013847899490389793 and parameters: {'model_type': 'mlp', 'hidden_dims': '[128, 64]', 'dropout': 0.5296545545204333, 'batch_norm': True, 'lr': 4.8639473668200315e-06, 'weight_decay': 3.831992705637392e-06, 'epochs': 98, 'loss': 'mae', 'optimizer': 'adam', 'graph_mode': 'off', 'use_snp_selection': True, 'num_snps': 17965}. Best is trial 31 with value: 0.030845206416427535.
[I 2025-12-05 15:34:12,115] Trial 47 finished with value: 0.0035114967626292096 and parameters: {'model_type': 'mlp', 'hidden_dims': '[256, 128, 64]', 'dropout': 0.5721830433678717, 'batch_norm': False, 'lr': 1.4381611237930913e-06, 'weight_decay': 1.358085282818651e-05, 'epochs': 164, 'loss': 'mse', 'optimizer': 'adam', 'graph_mode': 'off', 'use_snp_selection': True, 'num_snps': 23413}. Best is trial 31 with value: 0.030845206416427535.
[I 2025-12-05 15:34:13,920] Trial 48 finished with value: 0.016813308615782115 and parameters: {'model_type': 'mlp', 'hidden_dims': '[512, 256]', 'dropout': 0.5033766683389966, 'batch_norm': False, 'lr': 3.55598528620455e-06, 'weight_decay': 1.498329979539132e-07, 'epochs': 188, 'loss': 'mae', 'optimizer': 'adam', 'graph_mode': 'off', 'use_snp_selection': True, 'num_snps': 27072}. Best is trial 31 with value: 0.030845206416427535.
[I 2025-12-05 15:34:15,578] Trial 49 finished with value: -0.009426472711182613 and parameters: {'model_type': 'mlp', 'hidden_dims': '[128, 64]', 'dropout': 0.3287993431475715, 'batch_norm': False, 'lr': 3.828571630336747e-05, 'weight_decay': 5.690601620076072e-07, 'epochs': 64, 'loss': 'mae', 'optimizer': 'adam', 'graph_mode': 'off', 'use_snp_selection': True, 'num_snps': 34882}. Best is trial 31 with value: 0.030845206416427535.
[I 2025-12-05 15:34:17,675] Trial 50 finished with value: -0.02952317915357429 and parameters: {'model_type': 'mlp', 'hidden_dims': '[256, 128]', 'dropout': 0.4749575547678272, 'batch_norm': False, 'lr': 0.00013282022866337715, 'weight_decay': 9.529761950282686e-07, 'epochs': 79, 'loss': 'mae', 'optimizer': 'adam', 'graph_mode': 'off', 'use_snp_selection': True, 'num_snps': 44790}. Best is trial 31 with value: 0.030845206416427535.
[I 2025-12-05 15:34:18,672] Trial 51 finished with value: -0.004839613573495331 and parameters: {'model_type': 'mlp', 'hidden_dims': '[512, 64]', 'dropout': 0.5653299157397947, 'batch_norm': False, 'lr': 9.122711841793962e-06, 'weight_decay': 3.0756175700522546e-07, 'epochs': 40, 'loss': 'mae', 'optimizer': 'adam', 'graph_mode': 'off', 'use_snp_selection': True, 'num_snps': 11631}. Best is trial 31 with value: 0.030845206416427535.
[I 2025-12-05 15:34:19,931] Trial 52 finished with value: 0.008200624763657497 and parameters: {'model_type': 'mlp', 'hidden_dims': '[512, 128]', 'dropout': 0.5335380488220877, 'batch_norm': False, 'lr': 1.1778830465849886e-05, 'weight_decay': 1.2983998351842172e-07, 'epochs': 52, 'loss': 'mae', 'optimizer': 'adam', 'graph_mode': 'off', 'use_snp_selection': True, 'num_snps': 18016}. Best is trial 31 with value: 0.030845206416427535.
[I 2025-12-05 15:34:21,872] Trial 53 finished with value: 0.00045912258053173695 and parameters: {'model_type': 'mlp', 'hidden_dims': '[128, 64]', 'dropout': 0.5760367109492518, 'batch_norm': False, 'lr': 6.654161191936557e-06, 'weight_decay': 4.198985058691834e-07, 'epochs': 95, 'loss': 'mae', 'optimizer': 'adam', 'graph_mode': 'off', 'use_snp_selection': True, 'num_snps': 42633}. Best is trial 31 with value: 0.030845206416427535.
[I 2025-12-05 15:34:22,897] Trial 54 finished with value: 0.010259455252322866 and parameters: {'model_type': 'mlp', 'hidden_dims': '[512, 64]', 'dropout': 0.4967459001073743, 'batch_norm': False, 'lr': 0.00010062818895006419, 'weight_decay': 1.105016216866884e-07, 'epochs': 72, 'loss': 'mae', 'optimizer': 'adam', 'graph_mode': 'off', 'use_snp_selection': False}. Best is trial 31 with value: 0.030845206416427535.
[I 2025-12-05 15:34:23,849] Trial 55 finished with value: -0.016678581250680165 and parameters: {'model_type': 'mlp', 'hidden_dims': '[256, 128, 64]', 'dropout': 0.5466549636758534, 'batch_norm': False, 'lr': 2.4772128276543395e-06, 'weight_decay': 1.8195238994516068e-07, 'epochs': 142, 'loss': 'mae', 'optimizer': 'adam', 'graph_mode': 'off', 'use_snp_selection': False}. Best is trial 31 with value: 0.030845206416427535.
[I 2025-12-05 15:34:24,719] Trial 56 finished with value: 0.0219241762372618 and parameters: {'model_type': 'mlp', 'hidden_dims': '[512, 64]', 'dropout': 0.5212234851584918, 'batch_norm': False, 'lr': 8.706481872134311e-06, 'weight_decay': 5.942312937563571e-06, 'epochs': 116, 'loss': 'mae', 'optimizer': 'adam', 'graph_mode': 'off', 'use_snp_selection': True, 'num_snps': 4627}. Best is trial 31 with value: 0.030845206416427535.
[I 2025-12-05 15:34:25,668] Trial 57 finished with value: 0.0019341434944547457 and parameters: {'model_type': 'mlp', 'hidden_dims': '[128, 64]', 'dropout': 0.44871355868030127, 'batch_norm': True, 'lr': 0.0007370054935123828, 'weight_decay': 6.543089574478333e-06, 'epochs': 116, 'loss': 'mae', 'optimizer': 'adam', 'graph_mode': 'off', 'use_snp_selection': True, 'num_snps': 6684}. Best is trial 31 with value: 0.030845206416427535.
[I 2025-12-05 15:34:26,487] Trial 58 finished with value: 0.019137223561449965 and parameters: {'model_type': 'mlp', 'hidden_dims': '[512, 256]', 'dropout': 0.5219867491300962, 'batch_norm': False, 'lr': 1.6905739654619577e-05, 'weight_decay': 1.659086804390339e-06, 'epochs': 107, 'loss': 'mse', 'optimizer': 'adam', 'graph_mode': 'off', 'use_snp_selection': True, 'num_snps': 3708}. Best is trial 31 with value: 0.030845206416427535.
[I 2025-12-05 15:34:27,262] Trial 59 finished with value: -0.03303473224923062 and parameters: {'model_type': 'mlp', 'hidden_dims': '[512, 256]', 'dropout': 0.5078506765691025, 'batch_norm': False, 'lr': 1.4139678220641965e-05, 'weight_decay': 4.774237061361905e-06, 'epochs': 106, 'loss': 'mse', 'optimizer': 'adam', 'graph_mode': 'off', 'use_snp_selection': True, 'num_snps': 2305}. Best is trial 31 with value: 0.030845206416427535.
[I 2025-12-05 15:34:28,381] Trial 60 finished with value: 0.010589646726040378 and parameters: {'model_type': 'mlp', 'hidden_dims': '[512, 256]', 'dropout': 0.5210092855305012, 'batch_norm': False, 'lr': 2.0804421500858592e-05, 'weight_decay': 1.450957270093088e-06, 'epochs': 163, 'loss': 'mse', 'optimizer': 'adam', 'graph_mode': 'off', 'use_snp_selection': True, 'num_snps': 10787}. Best is trial 31 with value: 0.030845206416427535.
[I 2025-12-05 15:34:29,249] Trial 61 finished with value: 0.004787518660030483 and parameters: {'model_type': 'mlp', 'hidden_dims': '[512, 256]', 'dropout': 0.4822591397386914, 'batch_norm': False, 'lr': 8.727364438350525e-06, 'weight_decay': 2.076788409356405e-06, 'epochs': 127, 'loss': 'mse', 'optimizer': 'adam', 'graph_mode': 'off', 'use_snp_selection': True, 'num_snps': 4758}. Best is trial 31 with value: 0.030845206416427535.
[I 2025-12-05 15:34:30,395] Trial 62 finished with value: 0.016915143623111806 and parameters: {'model_type': 'mlp', 'hidden_dims': '[512, 64]', 'dropout': 0.536301746309278, 'batch_norm': False, 'lr': 3.363827343398809e-05, 'weight_decay': 4.759063692522161e-06, 'epochs': 137, 'loss': 'mse', 'optimizer': 'adam', 'graph_mode': 'off', 'use_snp_selection': True, 'num_snps': 13762}. Best is trial 31 with value: 0.030845206416427535.
[I 2025-12-05 15:34:31,924] Trial 63 finished with value: 0.010630481197077024 and parameters: {'model_type': 'mlp', 'hidden_dims': '[512, 256]', 'dropout': 0.44710833517498494, 'batch_norm': False, 'lr': 1.691400000149599e-05, 'weight_decay': 1.3426982111495527e-05, 'epochs': 80, 'loss': 'mse', 'optimizer': 'adam', 'graph_mode': 'off', 'use_snp_selection': True, 'num_snps': 22736}. Best is trial 31 with value: 0.030845206416427535.
[I 2025-12-05 15:34:32,951] Trial 64 finished with value: 0.038837352766533786 and parameters: {'model_type': 'mlp', 'hidden_dims': '[512, 64]', 'dropout': 0.5600683271268249, 'batch_norm': False, 'lr': 3.2209762197881777e-06, 'weight_decay': 3.252986083899545e-06, 'epochs': 96, 'loss': 'mae', 'optimizer': 'adam', 'graph_mode': 'off', 'use_snp_selection': True, 'num_snps': 8432}. Best is trial 64 with value: 0.038837352766533786.
[I 2025-12-05 15:34:33,887] Trial 65 finished with value: 0.015538697177389739 and parameters: {'model_type': 'mlp', 'hidden_dims': '[512, 64]', 'dropout': 0.5514888968826401, 'batch_norm': False, 'lr': 3.1532617725902487e-06, 'weight_decay': 3.2024572865480097e-06, 'epochs': 96, 'loss': 'mae', 'optimizer': 'adam', 'graph_mode': 'off', 'use_snp_selection': True, 'num_snps': 6735}. Best is trial 64 with value: 0.038837352766533786.
