[I 2025-12-05 18:00:48,649] Trial 56 finished with value: 0.17888763127048632 and parameters: {'model_type': 'mlp', 'hidden_dims': '[128, 64]', 'dropout': 0.1327127663490721, 'batch_norm': True, 'lr': 4.3036527205018446e-06, 'weight_decay': 4.901107834906177e-05, 'epochs': 102, 'loss': 'mae', 'optimizer': 'adam', 'graph_mode': 'off', 'use_snp_selection': False}. Best is trial 47 with value: 0.23559119926943253.
[I 2025-12-05 18:01:38,299] Trial 57 finished with value: 0.23424647204927385 and parameters: {'model_type': 'mlp', 'hidden_dims': '[256, 128, 64]', 'dropout': 0.2234437743190429, 'batch_norm': False, 'lr': 0.0004659271685047402, 'weight_decay': 0.0005952423158404471, 'epochs': 135, 'loss': 'mse', 'optimizer': 'adam', 'graph_mode': 'off', 'use_snp_selection': True, 'num_snps': 29791}. Best is trial 47 with value: 0.23559119926943253.
[I 2025-12-05 18:02:28,238] Trial 58 finished with value: 0.21506484823425845 and parameters: {'model_type': 'mlp', 'hidden_dims': '[256, 128, 64]', 'dropout': 0.2068434441711876, 'batch_norm': False, 'lr': 0.0006513932303751587, 'weight_decay': 0.0005805611109139708, 'epochs': 129, 'loss': 'mse', 'optimizer': 'adam', 'graph_mode': 'off', 'use_snp_selection': True, 'num_snps': 30920}. Best is trial 47 with value: 0.23559119926943253.
[I 2025-12-05 18:03:15,606] Trial 59 finished with value: 0.22710553027959274 and parameters: {'model_type': 'mlp', 'hidden_dims': '[512, 256]', 'dropout': 0.16348673642529934, 'batch_norm': False, 'lr': 0.00034321292087354833, 'weight_decay': 0.0003419693753180471, 'epochs': 163, 'loss': 'mse', 'optimizer': 'adam', 'graph_mode': 'off', 'use_snp_selection': True, 'num_snps': 16452}. Best is trial 47 with value: 0.23559119926943253.
[I 2025-12-05 18:04:03,893] Trial 60 finished with value: 0.22550939875016648 and parameters: {'model_type': 'mlp', 'hidden_dims': '[256, 128, 64]', 'dropout': 0.24272413258888498, 'batch_norm': False, 'lr': 7.135533429592974e-06, 'weight_decay': 0.0002401756519045081, 'epochs': 116, 'loss': 'mse', 'optimizer': 'adam', 'graph_mode': 'off', 'use_snp_selection': True, 'num_snps': 28930}. Best is trial 47 with value: 0.23559119926943253.
[I 2025-12-05 18:04:55,991] Trial 61 finished with value: 0.21913425551377136 and parameters: {'model_type': 'mlp', 'hidden_dims': '[256, 128, 64]', 'dropout': 0.19038660864299978, 'batch_norm': False, 'lr': 9.329554101355227e-05, 'weight_decay': 0.00010981621030264129, 'epochs': 93, 'loss': 'mse', 'optimizer': 'adam', 'graph_mode': 'off', 'use_snp_selection': True, 'num_snps': 38534}. Best is trial 47 with value: 0.23559119926943253.
[I 2025-12-05 18:06:01,743] Trial 62 finished with value: 0.22713458821957316 and parameters: {'model_type': 'mlp', 'hidden_dims': '[256, 128, 64]', 'dropout': 0.22530062143074606, 'batch_norm': False, 'lr': 9.970030455351326e-06, 'weight_decay': 6.595067118847495e-05, 'epochs': 138, 'loss': 'mse', 'optimizer': 'adam', 'graph_mode': 'off', 'use_snp_selection': True, 'num_snps': 52631}. Best is trial 47 with value: 0.23559119926943253.
[I 2025-12-05 18:06:32,505] Trial 63 finished with value: 0.21547621295860586 and parameters: {'model_type': 'mlp', 'hidden_dims': '[512, 128]', 'dropout': 0.15213211628408446, 'batch_norm': False, 'lr': 2.66732690325798e-06, 'weight_decay': 1.61242940267585e-05, 'epochs': 84, 'loss': 'mae', 'optimizer': 'adam', 'graph_mode': 'off', 'use_snp_selection': False}. Best is trial 47 with value: 0.23559119926943253.
[I 2025-12-05 18:07:22,846] Trial 64 finished with value: 0.22151280453584365 and parameters: {'model_type': 'mlp', 'hidden_dims': '[512, 64]', 'dropout': 0.29198800337821446, 'batch_norm': False, 'lr': 0.00020053581068650884, 'weight_decay': 0.0006512851117499776, 'epochs': 159, 'loss': 'mae', 'optimizer': 'adam', 'graph_mode': 'off', 'use_snp_selection': False}. Best is trial 47 with value: 0.23559119926943253.
[I 2025-12-05 18:08:52,209] Trial 65 finished with value: 0.22174064002104318 and parameters: {'model_type': 'mlp', 'hidden_dims': '[512, 64]', 'dropout': 0.49055575556173514, 'batch_norm': False, 'lr': 0.0003965930754778855, 'weight_decay': 2.1294559112284045e-05, 'epochs': 303, 'loss': 'mae', 'optimizer': 'adam', 'graph_mode': 'off', 'use_snp_selection': False}. Best is trial 47 with value: 0.23559119926943253.
[I 2025-12-05 18:09:54,658] Trial 66 finished with value: 0.2289434643229412 and parameters: {'model_type': 'mlp', 'hidden_dims': '[256, 128]', 'dropout': 0.3418137582700407, 'batch_norm': False, 'lr': 6.079855295756134e-06, 'weight_decay': 5.9546948938870645e-06, 'epochs': 179, 'loss': 'mae', 'optimizer': 'adam', 'graph_mode': 'off', 'use_snp_selection': True, 'num_snps': 42001}. Best is trial 47 with value: 0.23559119926943253.
[I 2025-12-05 18:10:24,943] Trial 67 finished with value: 0.2222776171611472 and parameters: {'model_type': 'mlp', 'hidden_dims': '[128, 64]', 'dropout': 0.5826349598369057, 'batch_norm': False, 'lr': 3.4370518121768764e-06, 'weight_decay': 0.0004342371295749093, 'epochs': 340, 'loss': 'mse', 'optimizer': 'adam', 'graph_mode': 'off', 'use_snp_selection': False}. Best is trial 47 with value: 0.23559119926943253.
[I 2025-12-05 18:11:11,894] Trial 68 finished with value: 0.21156246486257824 and parameters: {'model_type': 'mlp', 'hidden_dims': '[256, 128, 64]', 'dropout': 0.5518511813292316, 'batch_norm': False, 'lr': 4.682595274561636e-06, 'weight_decay': 0.000996546385187281, 'epochs': 286, 'loss': 'mae', 'optimizer': 'adam', 'graph_mode': 'off', 'use_snp_selection': False}. Best is trial 47 with value: 0.23559119926943253.
[I 2025-12-05 18:11:58,194] Trial 69 finished with value: 0.22353366363127627 and parameters: {'model_type': 'mlp', 'hidden_dims': '[512, 64]', 'dropout': 0.23147904720007556, 'batch_norm': True, 'lr': 2.3809224788043792e-05, 'weight_decay': 1.0070848699608992e-05, 'epochs': 237, 'loss': 'mae', 'optimizer': 'adam', 'graph_mode': 'off', 'use_snp_selection': True, 'num_snps': 11852}. Best is trial 47 with value: 0.23559119926943253.
[I 2025-12-05 18:13:13,826] Trial 70 finished with value: 0.23239360547516333 and parameters: {'model_type': 'mlp', 'hidden_dims': '[512, 128]', 'dropout': 0.10199813602657017, 'batch_norm': False, 'lr': 1.57074935485173e-05, 'weight_decay': 8.295365127198761e-05, 'epochs': 248, 'loss': 'mae', 'optimizer': 'adam', 'graph_mode': 'off', 'use_snp_selection': False}. Best is trial 47 with value: 0.23559119926943253.
[I 2025-12-05 18:14:36,903] Trial 71 finished with value: 0.22689203382421477 and parameters: {'model_type': 'mlp', 'hidden_dims': '[512, 64]', 'dropout': 0.5401990111781393, 'batch_norm': False, 'lr': 1.057889580837015e-05, 'weight_decay': 3.2798848106355273e-07, 'epochs': 274, 'loss': 'mae', 'optimizer': 'adam', 'graph_mode': 'off', 'use_snp_selection': False}. Best is trial 47 with value: 0.23559119926943253.
[I 2025-12-05 18:16:14,270] Trial 72 finished with value: 0.22945905108230286 and parameters: {'model_type': 'mlp', 'hidden_dims': '[512, 64]', 'dropout': 0.2082655821153809, 'batch_norm': False, 'lr': 6.733434439996105e-06, 'weight_decay': 0.00012713872214415855, 'epochs': 323, 'loss': 'mae', 'optimizer': 'adam', 'graph_mode': 'off', 'use_snp_selection': False}. Best is trial 47 with value: 0.23559119926943253.
[I 2025-12-05 18:17:33,184] Trial 73 finished with value: 0.23149083934503606 and parameters: {'model_type': 'mlp', 'hidden_dims': '[512, 64]', 'dropout': 0.5788155084908132, 'batch_norm': False, 'lr': 1.2083048042360732e-05, 'weight_decay': 3.770724905000589e-05, 'epochs': 259, 'loss': 'mae', 'optimizer': 'adam', 'graph_mode': 'off', 'use_snp_selection': False}. Best is trial 47 with value: 0.23559119926943253.
[I 2025-12-05 18:18:39,324] Trial 74 finished with value: 0.2284781552879153 and parameters: {'model_type': 'mlp', 'hidden_dims': '[512, 64]', 'dropout': 0.5223342328303825, 'batch_norm': False, 'lr': 4.140543966530493e-05, 'weight_decay': 2.359209805751281e-05, 'epochs': 215, 'loss': 'mae', 'optimizer': 'adam', 'graph_mode': 'off', 'use_snp_selection': False}. Best is trial 47 with value: 0.23559119926943253.
[I 2025-12-05 18:20:01,606] Trial 75 finished with value: 0.22789131328082277 and parameters: {'model_type': 'mlp', 'hidden_dims': '[512, 256]', 'dropout': 0.543500216664872, 'batch_norm': False, 'lr': 5.380269299041123e-06, 'weight_decay': 1.361904542870956e-05, 'epochs': 268, 'loss': 'mae', 'optimizer': 'adam', 'graph_mode': 'off', 'use_snp_selection': False}. Best is trial 47 with value: 0.23559119926943253.
[I 2025-12-05 18:21:29,865] Trial 76 finished with value: 0.218208065641895 and parameters: {'model_type': 'mlp', 'hidden_dims': '[512, 64]', 'dropout': 0.5590341934638882, 'batch_norm': False, 'lr': 1.988771524250811e-06, 'weight_decay': 7.5412488833461335e-06, 'epochs': 291, 'loss': 'mae', 'optimizer': 'adam', 'graph_mode': 'off', 'use_snp_selection': False}. Best is trial 47 with value: 0.23559119926943253.
[I 2025-12-05 18:23:05,810] Trial 77 finished with value: 0.22369590860201566 and parameters: {'model_type': 'mlp', 'hidden_dims': '[512, 64]', 'dropout': 0.5732915278834146, 'batch_norm': False, 'lr': 8.369905288710992e-06, 'weight_decay': 5.589290130387362e-05, 'epochs': 320, 'loss': 'mse', 'optimizer': 'adam', 'graph_mode': 'off', 'use_snp_selection': False}. Best is trial 47 with value: 0.23559119926943253.
[I 2025-12-05 18:24:16,005] Trial 78 finished with value: 0.22798320307594042 and parameters: {'model_type': 'mlp', 'hidden_dims': '[512, 64]', 'dropout': 0.36646989096247307, 'batch_norm': False, 'lr': 1.94457248021684e-05, 'weight_decay': 3.865140340714891e-06, 'epochs': 227, 'loss': 'mae', 'optimizer': 'adam', 'graph_mode': 'off', 'use_snp_selection': False}. Best is trial 47 with value: 0.23559119926943253.
[I 2025-12-05 18:24:44,391] Trial 79 finished with value: 0.1476541027395257 and parameters: {'model_type': 'mlp', 'hidden_dims': '[256, 128, 64]', 'dropout': 0.47894808679959944, 'batch_norm': False, 'lr': 1.4030964497183029e-06, 'weight_decay': 3.055308061708214e-05, 'epochs': 153, 'loss': 'mae', 'optimizer': 'adam', 'graph_mode': 'off', 'use_snp_selection': False}. Best is trial 47 with value: 0.23559119926943253.
[I 2025-12-05 18:26:12,376] Trial 80 finished with value: 0.19159787598148914 and parameters: {'model_type': 'mlp', 'hidden_dims': '[512, 128]', 'dropout': 0.5006383513774271, 'batch_norm': True, 'lr': 4.10194030530473e-06, 'weight_decay': 1.6874132074754736e-05, 'epochs': 302, 'loss': 'mae', 'optimizer': 'adam', 'graph_mode': 'off', 'use_snp_selection': True, 'num_snps': 35321}. Best is trial 47 with value: 0.23559119926943253.
[I 2025-12-05 18:27:06,355] Trial 81 finished with value: 0.22338880314120976 and parameters: {'model_type': 'mlp', 'hidden_dims': '[512, 128]', 'dropout': 0.26256769648687966, 'batch_norm': False, 'lr': 3.167161003659316e-06, 'weight_decay': 0.0002008866770141665, 'epochs': 141, 'loss': 'mae', 'optimizer': 'adam', 'graph_mode': 'off', 'use_snp_selection': True, 'num_snps': 24880}. Best is trial 47 with value: 0.23559119926943253.
[I 2025-12-05 18:28:07,279] Trial 82 finished with value: 0.2263955857555923 and parameters: {'model_type': 'mlp', 'hidden_dims': '[512, 128]', 'dropout': 0.28986034139694805, 'batch_norm': False, 'lr': 2.702249885384748e-06, 'weight_decay': 0.0001377229379479687, 'epochs': 189, 'loss': 'mae', 'optimizer': 'adam', 'graph_mode': 'off', 'use_snp_selection': True, 'num_snps': 26868}. Best is trial 47 with value: 0.23559119926943253.
[I 2025-12-05 18:29:24,551] Trial 83 finished with value: 0.2318570978165456 and parameters: {'model_type': 'mlp', 'hidden_dims': '[512, 128]', 'dropout': 0.26836163239409977, 'batch_norm': False, 'lr': 3.474893188169075e-06, 'weight_decay': 0.00024649575246274934, 'epochs': 246, 'loss': 'mae', 'optimizer': 'adam', 'graph_mode': 'off', 'use_snp_selection': True, 'num_snps': 32867}. Best is trial 47 with value: 0.23559119926943253.
[I 2025-12-05 18:30:18,379] Trial 84 finished with value: 0.23757450921942724 and parameters: {'model_type': 'mlp', 'hidden_dims': '[512, 128]', 'dropout': 0.2454307784348369, 'batch_norm': False, 'lr': 5.546792867501041e-06, 'weight_decay': 0.0004262928681812018, 'epochs': 168, 'loss': 'mae', 'optimizer': 'adam', 'graph_mode': 'off', 'use_snp_selection': True, 'num_snps': 22294}. Best is trial 84 with value: 0.23757450921942724.
[I 2025-12-05 18:31:08,068] Trial 85 finished with value: 0.22786815766118457 and parameters: {'model_type': 'mlp', 'hidden_dims': '[512, 64]', 'dropout': 0.2468081868664666, 'batch_norm': False, 'lr': 6.822127380057408e-06, 'weight_decay': 0.0005205399594178858, 'epochs': 171, 'loss': 'mae', 'optimizer': 'adam', 'graph_mode': 'off', 'use_snp_selection': True, 'num_snps': 17770}. Best is trial 84 with value: 0.23757450921942724.
[I 2025-12-05 18:31:31,196] Trial 86 finished with value: 0.22086612090811836 and parameters: {'model_type': 'mlp', 'hidden_dims': '[256, 128]', 'dropout': 0.19977540216317935, 'batch_norm': False, 'lr': 5.34493651973116e-06, 'weight_decay': 0.0004189545544172584, 'epochs': 118, 'loss': 'mae', 'optimizer': 'adam', 'graph_mode': 'off', 'use_snp_selection': False}. Best is trial 84 with value: 0.23757450921942724.
[I 2025-12-05 18:32:17,539] Trial 87 finished with value: 0.234420497687704 and parameters: {'model_type': 'mlp', 'hidden_dims': '[512, 128]', 'dropout': 0.5993698455104215, 'batch_norm': False, 'lr': 9.251758934570313e-06, 'weight_decay': 0.0007959170830157616, 'epochs': 201, 'loss': 'mae', 'optimizer': 'adam', 'graph_mode': 'off', 'use_snp_selection': True, 'num_snps': 13295}. Best is trial 84 with value: 0.23757450921942724.
[I 2025-12-05 18:32:59,106] Trial 88 finished with value: 0.25605761547142347 and parameters: {'model_type': 'mlp', 'hidden_dims': '[512, 128]', 'dropout': 0.136332011814304, 'batch_norm': False, 'lr': 9.639371631643236e-06, 'weight_decay': 0.0006412550139903298, 'epochs': 152, 'loss': 'mae', 'optimizer': 'adam', 'graph_mode': 'off', 'use_snp_selection': True, 'num_snps': 11229}. Best is trial 88 with value: 0.25605761547142347.
[I 2025-12-05 18:33:36,565] Trial 89 finished with value: 0.23135676721177312 and parameters: {'model_type': 'mlp', 'hidden_dims': '[512, 128]', 'dropout': 0.13538341591467926, 'batch_norm': False, 'lr': 9.342180185806815e-06, 'weight_decay': 0.0007174840492122523, 'epochs': 169, 'loss': 'mae', 'optimizer': 'adam', 'graph_mode': 'off', 'use_snp_selection': True, 'num_snps': 6513}. Best is trial 88 with value: 0.25605761547142347.
[I 2025-12-05 18:34:19,563] Trial 90 finished with value: 0.23273489228962285 and parameters: {'model_type': 'mlp', 'hidden_dims': '[512, 128]', 'dropout': 0.16940164552817982, 'batch_norm': False, 'lr': 1.3891420515329799e-05, 'weight_decay': 0.0004059127991450432, 'epochs': 153, 'loss': 'mse', 'optimizer': 'adam', 'graph_mode': 'off', 'use_snp_selection': True, 'num_snps': 12449}. Best is trial 88 with value: 0.25605761547142347.
[I 2025-12-05 18:35:00,041] Trial 91 finished with value: 0.2348166788380285 and parameters: {'model_type': 'mlp', 'hidden_dims': '[512, 128]', 'dropout': 0.5910633482674954, 'batch_norm': False, 'lr': 7.822142135526324e-06, 'weight_decay': 0.0008316494975458831, 'epochs': 208, 'loss': 'mae', 'optimizer': 'adam', 'graph_mode': 'off', 'use_snp_selection': True, 'num_snps': 8237}. Best is trial 88 with value: 0.25605761547142347.
[I 2025-12-05 18:35:39,874] Trial 92 finished with value: 0.24062299337859114 and parameters: {'model_type': 'mlp', 'hidden_dims': '[512, 128]', 'dropout': 0.5930429429050905, 'batch_norm': False, 'lr': 7.745782569645812e-06, 'weight_decay': 0.0005373669935042694, 'epochs': 205, 'loss': 'mae', 'optimizer': 'adam', 'graph_mode': 'off', 'use_snp_selection': True, 'num_snps': 7462}. Best is trial 88 with value: 0.25605761547142347.
[I 2025-12-05 18:36:19,737] Trial 93 finished with value: 0.22520414375438266 and parameters: {'model_type': 'mlp', 'hidden_dims': '[512, 128]', 'dropout': 0.5934780057140464, 'batch_norm': False, 'lr': 8.308777693212451e-06, 'weight_decay': 0.0008697137278605069, 'epochs': 203, 'loss': 'mae', 'optimizer': 'adam', 'graph_mode': 'off', 'use_snp_selection': True, 'num_snps': 7592}. Best is trial 88 with value: 0.25605761547142347.
[I 2025-12-05 18:36:53,255] Trial 94 finished with value: 0.1964559466005507 and parameters: {'model_type': 'mlp', 'hidden_dims': '[512, 128]', 'dropout': 0.5570582203617167, 'batch_norm': False, 'lr': 1.6110612076044884e-05, 'weight_decay': 0.0005474000964940644, 'epochs': 182, 'loss': 'mae', 'optimizer': 'adam', 'graph_mode': 'off', 'use_snp_selection': True, 'num_snps': 2296}. Best is trial 88 with value: 0.25605761547142347.
[I 2025-12-05 18:37:33,796] Trial 95 finished with value: 0.24702696935398052 and parameters: {'model_type': 'mlp', 'hidden_dims': '[512, 128]', 'dropout': 0.591333659450328, 'batch_norm': False, 'lr': 1.2281042452832365e-05, 'weight_decay': 0.0007704274699566898, 'epochs': 198, 'loss': 'mae', 'optimizer': 'adam', 'graph_mode': 'off', 'use_snp_selection': True, 'num_snps': 8515}. Best is trial 88 with value: 0.25605761547142347.
[I 2025-12-05 18:38:15,206] Trial 96 finished with value: 0.24172425387256607 and parameters: {'model_type': 'mlp', 'hidden_dims': '[512, 128]', 'dropout': 0.586977348559488, 'batch_norm': False, 'lr': 1.2071128903416541e-05, 'weight_decay': 0.0007881687692466624, 'epochs': 208, 'loss': 'mae', 'optimizer': 'adam', 'graph_mode': 'off', 'use_snp_selection': True, 'num_snps': 8973}. Best is trial 88 with value: 0.25605761547142347.
[I 2025-12-05 18:38:55,771] Trial 97 finished with value: 0.23660412852019172 and parameters: {'model_type': 'mlp', 'hidden_dims': '[512, 128]', 'dropout': 0.587214457367401, 'batch_norm': False, 'lr': 1.200009519898333e-05, 'weight_decay': 0.0006884416750359315, 'epochs': 212, 'loss': 'mae', 'optimizer': 'adam', 'graph_mode': 'off', 'use_snp_selection': True, 'num_snps': 8345}. Best is trial 88 with value: 0.25605761547142347.
[I 2025-12-05 18:39:36,725] Trial 98 finished with value: 0.25023130987522674 and parameters: {'model_type': 'mlp', 'hidden_dims': '[512, 128]', 'dropout': 0.5760286527992506, 'batch_norm': False, 'lr': 2.7497691369920648e-05, 'weight_decay': 0.0003515508929517691, 'epochs': 209, 'loss': 'mae', 'optimizer': 'adam', 'graph_mode': 'off', 'use_snp_selection': True, 'num_snps': 8600}. Best is trial 88 with value: 0.25605761547142347.
[I 2025-12-05 18:40:18,089] Trial 99 finished with value: 0.24327952358010477 and parameters: {'model_type': 'mlp', 'hidden_dims': '[512, 128]', 'dropout': 0.5881844002242175, 'batch_norm': False, 'lr': 2.335488354894708e-05, 'weight_decay': 0.00035327137220921354, 'epochs': 214, 'loss': 'mae', 'optimizer': 'adam', 'graph_mode': 'off', 'use_snp_selection': True, 'num_snps': 8719}. Best is trial 88 with value: 0.25605761547142347.
[I 2025-12-05 18:41:00,313] Trial 100 finished with value: 0.24823978480261344 and parameters: {'model_type': 'mlp', 'hidden_dims': '[512, 128]', 'dropout': 0.5841671365069179, 'batch_norm': False, 'lr': 2.87394025060766e-05, 'weight_decay': 0.0003575695663135259, 'epochs': 214, 'loss': 'mae', 'optimizer': 'adam', 'graph_mode': 'off', 'use_snp_selection': True, 'num_snps': 9719}. Best is trial 88 with value: 0.25605761547142347.
[I 2025-12-05 18:41:41,127] Trial 101 finished with value: 0.24630954331268873 and parameters: {'model_type': 'mlp', 'hidden_dims': '[512, 128]', 'dropout': 0.5755530736901109, 'batch_norm': False, 'lr': 2.7287583413187737e-05, 'weight_decay': 0.0003342235127448182, 'epochs': 195, 'loss': 'mae', 'optimizer': 'adam', 'graph_mode': 'off', 'use_snp_selection': True, 'num_snps': 8882}. Best is trial 88 with value: 0.25605761547142347.
[I 2025-12-05 18:42:22,206] Trial 102 finished with value: 0.24196444841780834 and parameters: {'model_type': 'mlp', 'hidden_dims': '[512, 128]', 'dropout': 0.5752869744246027, 'batch_norm': False, 'lr': 2.533912202634631e-05, 'weight_decay': 0.00034808071462202054, 'epochs': 194, 'loss': 'mae', 'optimizer': 'adam', 'graph_mode': 'off', 'use_snp_selection': True, 'num_snps': 9378}. Best is trial 88 with value: 0.25605761547142347.
[I 2025-12-05 18:43:03,917] Trial 103 finished with value: 0.2504250991901072 and parameters: {'model_type': 'mlp', 'hidden_dims': '[512, 128]', 'dropout': 0.585509591170214, 'batch_norm': False, 'lr': 2.8057360847313102e-05, 'weight_decay': 0.00035123971411026077, 'epochs': 214, 'loss': 'mae', 'optimizer': 'adam', 'graph_mode': 'off', 'use_snp_selection': True, 'num_snps': 9109}. Best is trial 88 with value: 0.25605761547142347.
[I 2025-12-05 18:43:40,365] Trial 104 finished with value: 0.23267353052474543 and parameters: {'model_type': 'mlp', 'hidden_dims': '[512, 128]', 'dropout': 0.5716814880937976, 'batch_norm': False, 'lr': 2.9982294697445227e-05, 'weight_decay': 0.0003576686759587777, 'epochs': 192, 'loss': 'mae', 'optimizer': 'adam', 'graph_mode': 'off', 'use_snp_selection': True, 'num_snps': 5262}. Best is trial 88 with value: 0.25605761547142347.
[I 2025-12-05 18:44:23,121] Trial 105 finished with value: 0.2492870897170482 and parameters: {'model_type': 'mlp', 'hidden_dims': '[512, 128]', 'dropout': 0.5751027005927697, 'batch_norm': False, 'lr': 2.3659140408568742e-05, 'weight_decay': 0.00047653971696745687, 'epochs': 221, 'loss': 'mae', 'optimizer': 'adam', 'graph_mode': 'off', 'use_snp_selection': True, 'num_snps': 9803}. Best is trial 88 with value: 0.25605761547142347.
[I 2025-12-05 18:45:05,625] Trial 106 finished with value: 0.24767913343172226 and parameters: {'model_type': 'mlp', 'hidden_dims': '[512, 128]', 'dropout': 0.5738768327456572, 'batch_norm': False, 'lr': 2.594598855864513e-05, 'weight_decay': 0.00022372848891205618, 'epochs': 222, 'loss': 'mae', 'optimizer': 'adam', 'graph_mode': 'off', 'use_snp_selection': True, 'num_snps': 9380}. Best is trial 88 with value: 0.25605761547142347.
