[I 2025-12-05 15:59:20,564] Trial 145 finished with value: 0.09802998481847723 and parameters: {'model_type': 'mlp', 'hidden_dims': '[512, 256]', 'dropout': 0.31038416696255566, 'batch_norm': True, 'lr': 6.781091701415718e-05, 'weight_decay': 6.684542851371982e-06, 'epochs': 243, 'loss': 'mae', 'optimizer': 'adam', 'graph_mode': 'off', 'use_snp_selection': False}. Best is trial 109 with value: 0.12967053490485272.
[I 2025-12-05 15:59:22,122] Trial 146 finished with value: 0.11477728134038129 and parameters: {'model_type': 'mlp', 'hidden_dims': '[512, 64]', 'dropout': 0.375542435526224, 'batch_norm': True, 'lr': 8.899155368113683e-05, 'weight_decay': 2.359496196546107e-05, 'epochs': 197, 'loss': 'mae', 'optimizer': 'adam', 'graph_mode': 'off', 'use_snp_selection': False}. Best is trial 109 with value: 0.12967053490485272.
[I 2025-12-05 15:59:23,679] Trial 147 finished with value: 0.10677856698798359 and parameters: {'model_type': 'mlp', 'hidden_dims': '[512, 64]', 'dropout': 0.372277120486416, 'batch_norm': True, 'lr': 9.889004352313285e-05, 'weight_decay': 2.3514338707029934e-05, 'epochs': 198, 'loss': 'mae', 'optimizer': 'adam', 'graph_mode': 'off', 'use_snp_selection': False}. Best is trial 109 with value: 0.12967053490485272.
[I 2025-12-05 15:59:25,373] Trial 148 finished with value: 0.10371253132577017 and parameters: {'model_type': 'mlp', 'hidden_dims': '[512, 64]', 'dropout': 0.3807709159332683, 'batch_norm': True, 'lr': 8.806463997346862e-05, 'weight_decay': 4.0860877606241115e-05, 'epochs': 186, 'loss': 'mae', 'optimizer': 'adam', 'graph_mode': 'off', 'use_snp_selection': True, 'num_snps': 28603}. Best is trial 109 with value: 0.12967053490485272.
[I 2025-12-05 15:59:26,860] Trial 149 finished with value: 0.10927537122114626 and parameters: {'model_type': 'mlp', 'hidden_dims': '[512, 64]', 'dropout': 0.361313029523669, 'batch_norm': True, 'lr': 0.0001179653152899982, 'weight_decay': 1.2022712819297215e-05, 'epochs': 191, 'loss': 'mae', 'optimizer': 'adam', 'graph_mode': 'off', 'use_snp_selection': False}. Best is trial 109 with value: 0.12967053490485272.
[I 2025-12-05 15:59:29,547] Trial 0 finished with value: 0.02099647591838199 and parameters: {'model_type': 'mlp', 'hidden_dims': '[128, 64]', 'dropout': 0.199031432379812, 'batch_norm': True, 'lr': 1.8408544111075837e-06, 'weight_decay': 5.5136510071208614e-05, 'epochs': 336, 'loss': 'mae', 'optimizer': 'adam', 'graph_mode': 'off', 'use_snp_selection': True, 'num_snps': 43862}. Best is trial 0 with value: 0.02099647591838199.
[I 2025-12-05 15:59:31,117] Trial 1 finished with value: 0.07218920406633589 and parameters: {'model_type': 'mlp', 'hidden_dims': '[256, 128]', 'dropout': 0.4370668075331726, 'batch_norm': True, 'lr': 7.133471581159139e-05, 'weight_decay': 1.128633586803549e-05, 'epochs': 242, 'loss': 'mae', 'optimizer': 'adam', 'graph_mode': 'off', 'use_snp_selection': False}. Best is trial 1 with value: 0.07218920406633589.
[I 2025-12-05 15:59:32,440] Trial 2 finished with value: 0.0315426818095375 and parameters: {'model_type': 'mlp', 'hidden_dims': '[256, 128, 64]', 'dropout': 0.41314357415569625, 'batch_norm': False, 'lr': 3.952233718592101e-06, 'weight_decay': 0.00026754769258252603, 'epochs': 149, 'loss': 'mse', 'optimizer': 'adam', 'graph_mode': 'off', 'use_snp_selection': True, 'num_snps': 11571}. Best is trial 1 with value: 0.07218920406633589.
[I 2025-12-05 15:59:35,668] Trial 3 finished with value: 0.02736368060843973 and parameters: {'model_type': 'mlp', 'hidden_dims': '[512, 64]', 'dropout': 0.5938127374509361, 'batch_norm': False, 'lr': 5.67704586114731e-06, 'weight_decay': 2.4518087630137052e-05, 'epochs': 320, 'loss': 'mae', 'optimizer': 'adam', 'graph_mode': 'off', 'use_snp_selection': False}. Best is trial 1 with value: 0.07218920406633589.
[I 2025-12-05 15:59:38,792] Trial 4 finished with value: 0.039966401245651435 and parameters: {'model_type': 'mlp', 'hidden_dims': '[512, 128]', 'dropout': 0.25746343592134413, 'batch_norm': True, 'lr': 1.3467657668402788e-06, 'weight_decay': 0.00033087251918647806, 'epochs': 277, 'loss': 'mse', 'optimizer': 'adam', 'graph_mode': 'off', 'use_snp_selection': True, 'num_snps': 36675}. Best is trial 1 with value: 0.07218920406633589.
[I 2025-12-05 15:59:41,232] Trial 5 finished with value: -0.013742559205194784 and parameters: {'model_type': 'mlp', 'hidden_dims': '[512, 64]', 'dropout': 0.38275350994408375, 'batch_norm': True, 'lr': 1.5586664309232824e-06, 'weight_decay': 0.0008227664668621182, 'epochs': 145, 'loss': 'mae', 'optimizer': 'adam', 'graph_mode': 'off', 'use_snp_selection': True, 'num_snps': 32148}. Best is trial 1 with value: 0.07218920406633589.
[I 2025-12-05 15:59:42,627] Trial 6 finished with value: 0.04858175975410726 and parameters: {'model_type': 'mlp', 'hidden_dims': '[256, 128]', 'dropout': 0.3930109900265879, 'batch_norm': False, 'lr': 4.892964372128395e-05, 'weight_decay': 1.5809549317992182e-06, 'epochs': 199, 'loss': 'mse', 'optimizer': 'adam', 'graph_mode': 'off', 'use_snp_selection': False}. Best is trial 1 with value: 0.07218920406633589.
[I 2025-12-05 15:59:44,158] Trial 7 finished with value: 0.060841484024264224 and parameters: {'model_type': 'mlp', 'hidden_dims': '[512, 256]', 'dropout': 0.15343979219678458, 'batch_norm': True, 'lr': 6.234003099047341e-05, 'weight_decay': 3.894760610535477e-07, 'epochs': 97, 'loss': 'mse', 'optimizer': 'adam', 'graph_mode': 'off', 'use_snp_selection': False}. Best is trial 1 with value: 0.07218920406633589.
[I 2025-12-05 15:59:47,321] Trial 8 finished with value: 0.06592840874111762 and parameters: {'model_type': 'mlp', 'hidden_dims': '[512, 128]', 'dropout': 0.10743001231661406, 'batch_norm': True, 'lr': 0.00023728538449271062, 'weight_decay': 1.7629071578048637e-05, 'epochs': 312, 'loss': 'mae', 'optimizer': 'adam', 'graph_mode': 'off', 'use_snp_selection': False}. Best is trial 1 with value: 0.07218920406633589.
[I 2025-12-05 15:59:49,460] Trial 9 finished with value: 0.058318962230880955 and parameters: {'model_type': 'mlp', 'hidden_dims': '[512, 64]', 'dropout': 0.14505336736221927, 'batch_norm': True, 'lr': 5.8619638388111826e-05, 'weight_decay': 6.200156172669308e-07, 'epochs': 175, 'loss': 'mse', 'optimizer': 'adam', 'graph_mode': 'off', 'use_snp_selection': False}. Best is trial 1 with value: 0.07218920406633589.
[I 2025-12-05 15:59:50,987] Trial 10 finished with value: 0.023471031603815237 and parameters: {'model_type': 'mlp', 'hidden_dims': '[256, 128]', 'dropout': 0.5365714961141473, 'batch_norm': False, 'lr': 0.00032955828969150785, 'weight_decay': 3.381683344261174e-06, 'epochs': 236, 'loss': 'mae', 'optimizer': 'adam', 'graph_mode': 'off', 'use_snp_selection': False}. Best is trial 1 with value: 0.07218920406633589.
[I 2025-12-05 15:59:54,008] Trial 11 finished with value: 0.06996075237487345 and parameters: {'model_type': 'mlp', 'hidden_dims': '[512, 128]', 'dropout': 0.2851700052976396, 'batch_norm': True, 'lr': 0.0005194831231105461, 'weight_decay': 7.0869802591332905e-06, 'epochs': 292, 'loss': 'mae', 'optimizer': 'adam', 'graph_mode': 'off', 'use_snp_selection': False}. Best is trial 1 with value: 0.07218920406633589.
[I 2025-12-05 15:59:56,777] Trial 12 finished with value: 0.06648687425016772 and parameters: {'model_type': 'mlp', 'hidden_dims': '[512, 128]', 'dropout': 0.2938624176579116, 'batch_norm': True, 'lr': 0.0006753264773209732, 'weight_decay': 4.718434479659835e-06, 'epochs': 254, 'loss': 'mae', 'optimizer': 'adam', 'graph_mode': 'off', 'use_snp_selection': False}. Best is trial 1 with value: 0.07218920406633589.
[I 2025-12-05 15:59:58,354] Trial 13 finished with value: 0.007967541833601842 and parameters: {'model_type': 'mlp', 'hidden_dims': '[256, 128]', 'dropout': 0.49592134948971256, 'batch_norm': True, 'lr': 1.488586596554662e-05, 'weight_decay': 1.4927792200876436e-07, 'epochs': 237, 'loss': 'mae', 'optimizer': 'adam', 'graph_mode': 'off', 'use_snp_selection': False}. Best is trial 1 with value: 0.07218920406633589.
[I 2025-12-05 15:59:59,026] Trial 14 finished with value: 0.051302177648298086 and parameters: {'model_type': 'mlp', 'hidden_dims': '[128, 64]', 'dropout': 0.3098766372723432, 'batch_norm': True, 'lr': 0.00017558188744418174, 'weight_decay': 6.9442169885097e-05, 'epochs': 42, 'loss': 'mae', 'optimizer': 'adam', 'graph_mode': 'off', 'use_snp_selection': False}. Best is trial 1 with value: 0.07218920406633589.
[I 2025-12-05 16:00:00,781] Trial 15 finished with value: 0.06066735569161522 and parameters: {'model_type': 'mlp', 'hidden_dims': '[256, 128, 64]', 'dropout': 0.4578474191024107, 'batch_norm': True, 'lr': 0.0006240035394884164, 'weight_decay': 7.236536090132001e-06, 'epochs': 284, 'loss': 'mae', 'optimizer': 'adam', 'graph_mode': 'off', 'use_snp_selection': False}. Best is trial 1 with value: 0.07218920406633589.
[I 2025-12-05 16:00:03,139] Trial 16 finished with value: 0.05418423454798388 and parameters: {'model_type': 'mlp', 'hidden_dims': '[512, 256]', 'dropout': 0.2342652691870644, 'batch_norm': True, 'lr': 2.1517090787442848e-05, 'weight_decay': 1.3938878336382636e-06, 'epochs': 206, 'loss': 'mae', 'optimizer': 'adam', 'graph_mode': 'off', 'use_snp_selection': False}. Best is trial 1 with value: 0.07218920406633589.
[I 2025-12-05 16:00:05,146] Trial 17 finished with value: 0.05500447704436937 and parameters: {'model_type': 'mlp', 'hidden_dims': '[256, 128]', 'dropout': 0.3359509294360599, 'batch_norm': True, 'lr': 0.00012778299641210154, 'weight_decay': 4.279596648260934e-05, 'epochs': 350, 'loss': 'mae', 'optimizer': 'adam', 'graph_mode': 'off', 'use_snp_selection': False}. Best is trial 1 with value: 0.07218920406633589.
[I 2025-12-05 16:00:09,600] Trial 18 finished with value: 0.07029703137834606 and parameters: {'model_type': 'mlp', 'hidden_dims': '[512, 128]', 'dropout': 0.4482398733766778, 'batch_norm': False, 'lr': 0.0009779451471082124, 'weight_decay': 1.0315216097288506e-05, 'epochs': 282, 'loss': 'mae', 'optimizer': 'adam', 'graph_mode': 'off', 'use_snp_selection': True, 'num_snps': 58241}. Best is trial 1 with value: 0.07218920406633589.
[I 2025-12-05 16:00:13,896] Trial 19 finished with value: 0.041911081005351083 and parameters: {'model_type': 'mlp', 'hidden_dims': '[512, 128]', 'dropout': 0.45196583838831206, 'batch_norm': False, 'lr': 1.0436614786391874e-05, 'weight_decay': 0.00013897692613641711, 'epochs': 257, 'loss': 'mae', 'optimizer': 'adam', 'graph_mode': 'off', 'use_snp_selection': True, 'num_snps': 55667}. Best is trial 1 with value: 0.07218920406633589.
[I 2025-12-05 16:00:17,140] Trial 20 finished with value: 0.05773580598298462 and parameters: {'model_type': 'mlp', 'hidden_dims': '[256, 128]', 'dropout': 0.535364311157857, 'batch_norm': False, 'lr': 0.00010061464030767575, 'weight_decay': 1.534822427790456e-05, 'epochs': 220, 'loss': 'mae', 'optimizer': 'adam', 'graph_mode': 'off', 'use_snp_selection': True, 'num_snps': 57703}. Best is trial 1 with value: 0.07218920406633589.
[I 2025-12-05 16:00:18,855] Trial 21 finished with value: 0.06066585409367198 and parameters: {'model_type': 'mlp', 'hidden_dims': '[512, 128]', 'dropout': 0.3617626161856043, 'batch_norm': False, 'lr': 0.0004145524612254489, 'weight_decay': 7.921674471363372e-06, 'epochs': 283, 'loss': 'mae', 'optimizer': 'adam', 'graph_mode': 'off', 'use_snp_selection': True, 'num_snps': 11878}. Best is trial 1 with value: 0.07218920406633589.
[I 2025-12-05 16:00:21,212] Trial 22 finished with value: 0.06877103074971612 and parameters: {'model_type': 'mlp', 'hidden_dims': '[512, 128]', 'dropout': 0.4461667251469354, 'batch_norm': False, 'lr': 0.00096647309784342, 'weight_decay': 2.347131718965477e-06, 'epochs': 302, 'loss': 'mae', 'optimizer': 'adam', 'graph_mode': 'off', 'use_snp_selection': True, 'num_snps': 22259}. Best is trial 1 with value: 0.07218920406633589.
[I 2025-12-05 16:00:24,880] Trial 23 finished with value: 0.06761775769529402 and parameters: {'model_type': 'mlp', 'hidden_dims': '[512, 128]', 'dropout': 0.5031118597874318, 'batch_norm': False, 'lr': 0.00037191663013246955, 'weight_decay': 1.1755499160282349e-05, 'epochs': 267, 'loss': 'mae', 'optimizer': 'adam', 'graph_mode': 'off', 'use_snp_selection': True, 'num_snps': 46925}. Best is trial 1 with value: 0.07218920406633589.
[I 2025-12-05 16:00:27,997] Trial 24 finished with value: 0.07271881734361885 and parameters: {'model_type': 'mlp', 'hidden_dims': '[512, 128]', 'dropout': 0.3431261025147959, 'batch_norm': True, 'lr': 0.0009068088197905362, 'weight_decay': 8.507414600114701e-07, 'epochs': 299, 'loss': 'mae', 'optimizer': 'adam', 'graph_mode': 'off', 'use_snp_selection': False}. Best is trial 24 with value: 0.07271881734361885.
[I 2025-12-05 16:00:29,885] Trial 25 finished with value: 0.06354411751927878 and parameters: {'model_type': 'mlp', 'hidden_dims': '[256, 128, 64]', 'dropout': 0.4157908427088918, 'batch_norm': True, 'lr': 0.0009332353356286111, 'weight_decay': 1.0375128864783039e-07, 'epochs': 320, 'loss': 'mae', 'optimizer': 'adam', 'graph_mode': 'off', 'use_snp_selection': False}. Best is trial 24 with value: 0.07271881734361885.
[I 2025-12-05 16:00:31,011] Trial 26 finished with value: 0.06682767507779064 and parameters: {'model_type': 'mlp', 'hidden_dims': '[128, 64]', 'dropout': 0.3444519897227373, 'batch_norm': False, 'lr': 0.0002158180290114648, 'weight_decay': 6.716227295267031e-07, 'epochs': 235, 'loss': 'mse', 'optimizer': 'adam', 'graph_mode': 'off', 'use_snp_selection': True, 'num_snps': 2344}. Best is trial 24 with value: 0.07271881734361885.
[I 2025-12-05 16:00:33,186] Trial 27 finished with value: 0.03465291852946373 and parameters: {'model_type': 'mlp', 'hidden_dims': '[512, 256]', 'dropout': 0.597765130631055, 'batch_norm': True, 'lr': 0.00010190440932767873, 'weight_decay': 2.677922139666298e-07, 'epochs': 170, 'loss': 'mae', 'optimizer': 'adam', 'graph_mode': 'off', 'use_snp_selection': False}. Best is trial 24 with value: 0.07271881734361885.
[I 2025-12-05 16:00:36,170] Trial 28 finished with value: 0.05332693672264398 and parameters: {'model_type': 'mlp', 'hidden_dims': '[256, 128]', 'dropout': 0.48749705834167145, 'batch_norm': False, 'lr': 2.647727993038509e-05, 'weight_decay': 3.3263387219962654e-05, 'epochs': 255, 'loss': 'mae', 'optimizer': 'adam', 'graph_mode': 'off', 'use_snp_selection': True, 'num_snps': 48700}. Best is trial 24 with value: 0.07271881734361885.
[I 2025-12-05 16:00:38,208] Trial 29 finished with value: 0.04824124830097877 and parameters: {'model_type': 'mlp', 'hidden_dims': '[128, 64]', 'dropout': 0.5457298218340595, 'batch_norm': True, 'lr': 4.283893789018336e-06, 'weight_decay': 6.28123189020637e-05, 'epochs': 336, 'loss': 'mae', 'optimizer': 'adam', 'graph_mode': 'off', 'use_snp_selection': True, 'num_snps': 26940}. Best is trial 24 with value: 0.07271881734361885.
[I 2025-12-05 16:00:40,695] Trial 30 finished with value: 0.05027656240491422 and parameters: {'model_type': 'mlp', 'hidden_dims': '[512, 128]', 'dropout': 0.43036020521390117, 'batch_norm': True, 'lr': 0.0002660081144030287, 'weight_decay': 3.13744795751148e-06, 'epochs': 218, 'loss': 'mae', 'optimizer': 'adam', 'graph_mode': 'off', 'use_snp_selection': False}. Best is trial 24 with value: 0.07271881734361885.
[I 2025-12-05 16:00:43,764] Trial 31 finished with value: 0.07182660301148093 and parameters: {'model_type': 'mlp', 'hidden_dims': '[512, 128]', 'dropout': 0.28275114079979746, 'batch_norm': True, 'lr': 0.0005839245315441976, 'weight_decay': 6.374729663574695e-06, 'epochs': 297, 'loss': 'mae', 'optimizer': 'adam', 'graph_mode': 'off', 'use_snp_selection': False}. Best is trial 24 with value: 0.07271881734361885.
[I 2025-12-05 16:00:46,892] Trial 32 finished with value: 0.06631832041889144 and parameters: {'model_type': 'mlp', 'hidden_dims': '[512, 128]', 'dropout': 0.2195372915191759, 'batch_norm': True, 'lr': 0.0006795091821109267, 'weight_decay': 9.004352369222102e-07, 'epochs': 300, 'loss': 'mae', 'optimizer': 'adam', 'graph_mode': 'off', 'use_snp_selection': False}. Best is trial 24 with value: 0.07271881734361885.
[I 2025-12-05 16:00:50,315] Trial 33 finished with value: 0.06596759300227996 and parameters: {'model_type': 'mlp', 'hidden_dims': '[512, 128]', 'dropout': 0.37795087794704096, 'batch_norm': True, 'lr': 0.0004710714304564388, 'weight_decay': 5.272701749708854e-06, 'epochs': 335, 'loss': 'mae', 'optimizer': 'adam', 'graph_mode': 'off', 'use_snp_selection': False}. Best is trial 24 with value: 0.07271881734361885.
[I 2025-12-05 16:00:53,206] Trial 34 finished with value: 0.04411448547485157 and parameters: {'model_type': 'mlp', 'hidden_dims': '[512, 128]', 'dropout': 0.3289370630687393, 'batch_norm': True, 'lr': 0.0009758106795453978, 'weight_decay': 2.405425166476559e-05, 'epochs': 270, 'loss': 'mse', 'optimizer': 'adam', 'graph_mode': 'off', 'use_snp_selection': False}. Best is trial 24 with value: 0.07271881734361885.
[I 2025-12-05 16:00:56,508] Trial 35 finished with value: 0.06765250019491717 and parameters: {'model_type': 'mlp', 'hidden_dims': '[512, 64]', 'dropout': 0.25119685362016464, 'batch_norm': True, 'lr': 0.00015563297295389172, 'weight_decay': 1.7823513856362827e-06, 'epochs': 319, 'loss': 'mae', 'optimizer': 'adam', 'graph_mode': 'off', 'use_snp_selection': False}. Best is trial 24 with value: 0.07271881734361885.
[I 2025-12-05 16:00:59,188] Trial 36 finished with value: 0.03912069774299051 and parameters: {'model_type': 'mlp', 'hidden_dims': '[256, 128, 64]', 'dropout': 0.4100262236844793, 'batch_norm': False, 'lr': 2.2048752279767195e-06, 'weight_decay': 1.0260982565889371e-05, 'epochs': 286, 'loss': 'mae', 'optimizer': 'adam', 'graph_mode': 'off', 'use_snp_selection': True, 'num_snps': 38703}. Best is trial 24 with value: 0.07271881734361885.
[I 2025-12-05 16:01:02,318] Trial 37 finished with value: 0.03501481601898633 and parameters: {'model_type': 'mlp', 'hidden_dims': '[512, 128]', 'dropout': 0.27309976116399465, 'batch_norm': True, 'lr': 3.7605370354055004e-05, 'weight_decay': 0.00021302636915726693, 'epochs': 304, 'loss': 'mse', 'optimizer': 'adam', 'graph_mode': 'off', 'use_snp_selection': False}. Best is trial 24 with value: 0.07271881734361885.
[I 2025-12-05 16:01:05,811] Trial 38 finished with value: 0.04679277894228484 and parameters: {'model_type': 'mlp', 'hidden_dims': '[256, 128]', 'dropout': 0.1866747905165022, 'batch_norm': False, 'lr': 7.820383768528309e-05, 'weight_decay': 2.1203425244234946e-05, 'epochs': 264, 'loss': 'mae', 'optimizer': 'adam', 'graph_mode': 'off', 'use_snp_selection': True, 'num_snps': 58812}. Best is trial 24 with value: 0.07271881734361885.
[I 2025-12-05 16:01:07,563] Trial 39 finished with value: 0.06251682552250071 and parameters: {'model_type': 'mlp', 'hidden_dims': '[512, 64]', 'dropout': 0.37303581128039287, 'batch_norm': True, 'lr': 8.155511017666417e-06, 'weight_decay': 3.702712245931325e-07, 'epochs': 118, 'loss': 'mse', 'optimizer': 'adam', 'graph_mode': 'off', 'use_snp_selection': False}. Best is trial 24 with value: 0.07271881734361885.
[I 2025-12-05 16:01:10,266] Trial 40 finished with value: 0.06665609348374063 and parameters: {'model_type': 'mlp', 'hidden_dims': '[512, 256]', 'dropout': 0.40030424101282097, 'batch_norm': True, 'lr': 0.0003001656456530483, 'weight_decay': 9.544899184082038e-05, 'epochs': 244, 'loss': 'mae', 'optimizer': 'adam', 'graph_mode': 'off', 'use_snp_selection': False}. Best is trial 24 with value: 0.07271881734361885.
[I 2025-12-05 16:01:13,384] Trial 41 finished with value: 0.06225063240689131 and parameters: {'model_type': 'mlp', 'hidden_dims': '[512, 128]', 'dropout': 0.2951912539574882, 'batch_norm': True, 'lr': 0.0005638250708236961, 'weight_decay': 5.0589383884333606e-06, 'epochs': 295, 'loss': 'mae', 'optimizer': 'adam', 'graph_mode': 'off', 'use_snp_selection': False}. Best is trial 24 with value: 0.07271881734361885.
[I 2025-12-05 16:01:16,719] Trial 42 finished with value: 0.06660986435422567 and parameters: {'model_type': 'mlp', 'hidden_dims': '[512, 128]', 'dropout': 0.3143610544800616, 'batch_norm': True, 'lr': 0.00047158652832840936, 'weight_decay': 1.2798960571574849e-05, 'epochs': 323, 'loss': 'mae', 'optimizer': 'adam', 'graph_mode': 'off', 'use_snp_selection': False}. Best is trial 24 with value: 0.07271881734361885.
[I 2025-12-05 16:01:19,665] Trial 43 finished with value: 0.0777124155792725 and parameters: {'model_type': 'mlp', 'hidden_dims': '[512, 128]', 'dropout': 0.27399884757178333, 'batch_norm': True, 'lr': 0.0006644692138449021, 'weight_decay': 1.190231695273994e-06, 'epochs': 276, 'loss': 'mae', 'optimizer': 'adam', 'graph_mode': 'off', 'use_snp_selection': False}. Best is trial 43 with value: 0.0777124155792725.
[I 2025-12-05 16:01:22,619] Trial 44 finished with value: 0.06191357467051864 and parameters: {'model_type': 'mlp', 'hidden_dims': '[512, 128]', 'dropout': 0.1965109084850412, 'batch_norm': True, 'lr': 0.0007127350335053921, 'weight_decay': 1.1379097470522914e-06, 'epochs': 275, 'loss': 'mae', 'optimizer': 'adam', 'graph_mode': 'off', 'use_snp_selection': False}. Best is trial 43 with value: 0.0777124155792725.
[I 2025-12-05 16:01:24,820] Trial 45 finished with value: 0.07990556576985153 and parameters: {'model_type': 'mlp', 'hidden_dims': '[512, 128]', 'dropout': 0.25101180454433386, 'batch_norm': True, 'lr': 0.0007717611537931894, 'weight_decay': 2.679719894859676e-06, 'epochs': 181, 'loss': 'mae', 'optimizer': 'adam', 'graph_mode': 'off', 'use_snp_selection': False}. Best is trial 45 with value: 0.07990556576985153.
[I 2025-12-05 16:01:26,151] Trial 46 finished with value: 0.06758479416797686 and parameters: {'model_type': 'mlp', 'hidden_dims': '[256, 128]', 'dropout': 0.25099755611943514, 'batch_norm': True, 'lr': 0.00021318629126042772, 'weight_decay': 2.5975661874985998e-06, 'epochs': 174, 'loss': 'mae', 'optimizer': 'adam', 'graph_mode': 'off', 'use_snp_selection': False}. Best is trial 45 with value: 0.07990556576985153.
