[I 2025-12-05 15:04:16,809] Trial 88 finished with value: 0.051342637277557925 and parameters: {'model_type': 'mlp', 'hidden_dims': '[256, 128, 64]', 'dropout': 0.2929435456026147, 'batch_norm': True, 'lr': 0.0003673279767318644, 'weight_decay': 0.00018358291222126397, 'epochs': 76, 'loss': 'mse', 'optimizer': 'adam', 'graph_mode': 'off', 'use_snp_selection': False}. Best is trial 63 with value: 0.07434790383048129.
[I 2025-12-05 15:04:17,916] Trial 89 finished with value: 0.0483216508834078 and parameters: {'model_type': 'mlp', 'hidden_dims': '[512, 128]', 'dropout': 0.22895012261570047, 'batch_norm': True, 'lr': 0.0008898072225042272, 'weight_decay': 5.6431823488608496e-05, 'epochs': 94, 'loss': 'mse', 'optimizer': 'adam', 'graph_mode': 'off', 'use_snp_selection': False}. Best is trial 63 with value: 0.07434790383048129.
[I 2025-12-05 15:04:20,436] Trial 90 finished with value: 0.04001289782021425 and parameters: {'model_type': 'mlp', 'hidden_dims': '[512, 128]', 'dropout': 0.31682883143218366, 'batch_norm': True, 'lr': 0.00019281140608442857, 'weight_decay': 0.0001440686570698792, 'epochs': 119, 'loss': 'mse', 'optimizer': 'adam', 'graph_mode': 'off', 'use_snp_selection': True, 'num_snps': 48165}. Best is trial 63 with value: 0.07434790383048129.
[I 2025-12-05 15:04:21,705] Trial 91 finished with value: 0.052406735218688744 and parameters: {'model_type': 'mlp', 'hidden_dims': '[512, 64]', 'dropout': 0.19072319621147832, 'batch_norm': True, 'lr': 0.000980333675583674, 'weight_decay': 4.4258738890526464e-05, 'epochs': 135, 'loss': 'mse', 'optimizer': 'adam', 'graph_mode': 'off', 'use_snp_selection': False}. Best is trial 63 with value: 0.07434790383048129.
[I 2025-12-05 15:04:22,807] Trial 92 finished with value: 0.05426193051181135 and parameters: {'model_type': 'mlp', 'hidden_dims': '[512, 64]', 'dropout': 0.2583833377793808, 'batch_norm': True, 'lr': 0.000413770938544222, 'weight_decay': 2.0850890222731904e-05, 'epochs': 105, 'loss': 'mse', 'optimizer': 'adam', 'graph_mode': 'off', 'use_snp_selection': False}. Best is trial 63 with value: 0.07434790383048129.
[I 2025-12-05 15:04:24,174] Trial 93 finished with value: 0.05097192947356181 and parameters: {'model_type': 'mlp', 'hidden_dims': '[512, 64]', 'dropout': 0.20398005907718797, 'batch_norm': True, 'lr': 0.0001543498248139635, 'weight_decay': 7.859819219375898e-05, 'epochs': 175, 'loss': 'mse', 'optimizer': 'adam', 'graph_mode': 'off', 'use_snp_selection': False}. Best is trial 63 with value: 0.07434790383048129.
[I 2025-12-05 15:04:25,434] Trial 94 finished with value: 0.043543477796682245 and parameters: {'model_type': 'mlp', 'hidden_dims': '[512, 64]', 'dropout': 0.4123292036751628, 'batch_norm': True, 'lr': 0.0005876059455580078, 'weight_decay': 1.201093115315718e-05, 'epochs': 147, 'loss': 'mse', 'optimizer': 'adam', 'graph_mode': 'off', 'use_snp_selection': False}. Best is trial 63 with value: 0.07434790383048129.
[I 2025-12-05 15:04:26,780] Trial 95 finished with value: 0.0660768222723365 and parameters: {'model_type': 'mlp', 'hidden_dims': '[512, 128]', 'dropout': 0.33919657918864815, 'batch_norm': True, 'lr': 0.0003157602723661858, 'weight_decay': 0.00017442866857538791, 'epochs': 168, 'loss': 'mse', 'optimizer': 'adam', 'graph_mode': 'off', 'use_snp_selection': False}. Best is trial 63 with value: 0.07434790383048129.
[I 2025-12-05 15:04:27,992] Trial 96 finished with value: 0.06166908459091839 and parameters: {'model_type': 'mlp', 'hidden_dims': '[512, 128]', 'dropout': 0.3851030936782642, 'batch_norm': True, 'lr': 0.00026853481823455445, 'weight_decay': 0.00017132164806267172, 'epochs': 120, 'loss': 'mse', 'optimizer': 'adam', 'graph_mode': 'off', 'use_snp_selection': False}. Best is trial 63 with value: 0.07434790383048129.
[I 2025-12-05 15:04:29,149] Trial 97 finished with value: 0.05699914405312542 and parameters: {'model_type': 'mlp', 'hidden_dims': '[512, 128]', 'dropout': 0.33931726347279106, 'batch_norm': True, 'lr': 0.0003331135031437682, 'weight_decay': 9.030165352087964e-05, 'epochs': 109, 'loss': 'mse', 'optimizer': 'adam', 'graph_mode': 'off', 'use_snp_selection': False}. Best is trial 63 with value: 0.07434790383048129.
[I 2025-12-05 15:04:30,222] Trial 98 finished with value: 0.06393523021728224 and parameters: {'model_type': 'mlp', 'hidden_dims': '[512, 128]', 'dropout': 0.4461440232098123, 'batch_norm': True, 'lr': 0.0004361643735456649, 'weight_decay': 0.00011975423812394163, 'epochs': 89, 'loss': 'mse', 'optimizer': 'adam', 'graph_mode': 'off', 'use_snp_selection': False}. Best is trial 63 with value: 0.07434790383048129.
[I 2025-12-05 15:04:31,274] Trial 99 finished with value: 0.049464185781227035 and parameters: {'model_type': 'mlp', 'hidden_dims': '[512, 256]', 'dropout': 0.44475917521987995, 'batch_norm': True, 'lr': 0.0004330665535765733, 'weight_decay': 0.00028804522677957424, 'epochs': 89, 'loss': 'mae', 'optimizer': 'adam', 'graph_mode': 'off', 'use_snp_selection': False}. Best is trial 63 with value: 0.07434790383048129.
[I 2025-12-05 15:04:32,042] Trial 100 finished with value: 0.05002782906450899 and parameters: {'model_type': 'mlp', 'hidden_dims': '[128, 64]', 'dropout': 0.5078493080831494, 'batch_norm': True, 'lr': 0.0006297036480460343, 'weight_decay': 0.0003759867484191431, 'epochs': 169, 'loss': 'mse', 'optimizer': 'adam', 'graph_mode': 'off', 'use_snp_selection': False}. Best is trial 63 with value: 0.07434790383048129.
[I 2025-12-05 15:04:33,029] Trial 101 finished with value: 0.05579575002635981 and parameters: {'model_type': 'mlp', 'hidden_dims': '[512, 128]', 'dropout': 0.46808132036302397, 'batch_norm': True, 'lr': 0.0002499841470038523, 'weight_decay': 0.00010565109941326944, 'epochs': 75, 'loss': 'mse', 'optimizer': 'adam', 'graph_mode': 'off', 'use_snp_selection': False}. Best is trial 63 with value: 0.07434790383048129.
[I 2025-12-05 15:04:34,102] Trial 102 finished with value: 0.057338852805858154 and parameters: {'model_type': 'mlp', 'hidden_dims': '[512, 128]', 'dropout': 0.43476587211158807, 'batch_norm': True, 'lr': 0.00031139356521235633, 'weight_decay': 6.700378999745909e-05, 'epochs': 98, 'loss': 'mse', 'optimizer': 'adam', 'graph_mode': 'off', 'use_snp_selection': False}. Best is trial 63 with value: 0.07434790383048129.
[I 2025-12-05 15:04:35,296] Trial 103 finished with value: 0.05001591430271642 and parameters: {'model_type': 'mlp', 'hidden_dims': '[512, 128]', 'dropout': 0.4083787260633368, 'batch_norm': True, 'lr': 0.00021200975638873939, 'weight_decay': 0.0002043533669614135, 'epochs': 129, 'loss': 'mse', 'optimizer': 'adam', 'graph_mode': 'off', 'use_snp_selection': False}. Best is trial 63 with value: 0.07434790383048129.
[I 2025-12-05 15:04:36,452] Trial 104 finished with value: 0.05966881044035709 and parameters: {'model_type': 'mlp', 'hidden_dims': '[512, 128]', 'dropout': 0.3782086631279305, 'batch_norm': True, 'lr': 0.0005215232107568594, 'weight_decay': 0.0001249341543343888, 'epochs': 108, 'loss': 'mse', 'optimizer': 'adam', 'graph_mode': 'off', 'use_snp_selection': False}. Best is trial 63 with value: 0.07434790383048129.
[I 2025-12-05 15:04:37,764] Trial 105 finished with value: 0.04879198587326296 and parameters: {'model_type': 'mlp', 'hidden_dims': '[512, 128]', 'dropout': 0.4509346606402305, 'batch_norm': True, 'lr': 0.00017573536541718045, 'weight_decay': 0.00024633895252722384, 'epochs': 143, 'loss': 'mse', 'optimizer': 'adam', 'graph_mode': 'off', 'use_snp_selection': False}. Best is trial 63 with value: 0.07434790383048129.
[I 2025-12-05 15:04:39,234] Trial 106 finished with value: 0.058989980629303086 and parameters: {'model_type': 'mlp', 'hidden_dims': '[512, 256]', 'dropout': 0.24010175659213118, 'batch_norm': True, 'lr': 0.000722386269583062, 'weight_decay': 0.00014144737111843416, 'epochs': 189, 'loss': 'mse', 'optimizer': 'adam', 'graph_mode': 'off', 'use_snp_selection': False}. Best is trial 63 with value: 0.07434790383048129.
[I 2025-12-05 15:04:40,553] Trial 107 finished with value: 0.06306726597773082 and parameters: {'model_type': 'mlp', 'hidden_dims': '[512, 128]', 'dropout': 0.2787986802432689, 'batch_norm': True, 'lr': 0.0004288902821036631, 'weight_decay': 0.000632869407191007, 'epochs': 160, 'loss': 'mse', 'optimizer': 'adam', 'graph_mode': 'off', 'use_snp_selection': False}. Best is trial 63 with value: 0.07434790383048129.
[I 2025-12-05 15:04:41,603] Trial 108 finished with value: 0.051883440889201424 and parameters: {'model_type': 'mlp', 'hidden_dims': '[256, 128, 64]', 'dropout': 0.34254370519432326, 'batch_norm': True, 'lr': 0.00029034967474962897, 'weight_decay': 0.00011672918621582702, 'epochs': 213, 'loss': 'mae', 'optimizer': 'adam', 'graph_mode': 'off', 'use_snp_selection': False}. Best is trial 63 with value: 0.07434790383048129.
[I 2025-12-05 15:04:43,545] Trial 109 finished with value: 0.03931370904819521 and parameters: {'model_type': 'mlp', 'hidden_dims': '[512, 128]', 'dropout': 0.32312378426873056, 'batch_norm': True, 'lr': 0.0003506680709184221, 'weight_decay': 1.4197098790915017e-05, 'epochs': 118, 'loss': 'mse', 'optimizer': 'adam', 'graph_mode': 'off', 'use_snp_selection': True, 'num_snps': 37017}. Best is trial 63 with value: 0.07434790383048129.
[I 2025-12-05 15:04:44,819] Trial 110 finished with value: 0.058957363071986624 and parameters: {'model_type': 'mlp', 'hidden_dims': '[512, 256]', 'dropout': 0.29444177027142876, 'batch_norm': True, 'lr': 8.786171119533764e-05, 'weight_decay': 6.413502413577866e-05, 'epochs': 139, 'loss': 'mse', 'optimizer': 'adam', 'graph_mode': 'off', 'use_snp_selection': False}. Best is trial 63 with value: 0.07434790383048129.
[I 2025-12-05 15:04:46,221] Trial 111 finished with value: 0.06092693502366356 and parameters: {'model_type': 'mlp', 'hidden_dims': '[512, 64]', 'dropout': 0.36277056100815497, 'batch_norm': True, 'lr': 0.0004829594119329675, 'weight_decay': 0.00016056841030302258, 'epochs': 170, 'loss': 'mse', 'optimizer': 'adam', 'graph_mode': 'off', 'use_snp_selection': False}. Best is trial 63 with value: 0.07434790383048129.
[I 2025-12-05 15:04:47,290] Trial 112 finished with value: 0.04476130091856509 and parameters: {'model_type': 'mlp', 'hidden_dims': '[512, 64]', 'dropout': 0.13202497798590881, 'batch_norm': True, 'lr': 0.00020647901242459984, 'weight_decay': 4.6723083288708414e-07, 'epochs': 87, 'loss': 'mse', 'optimizer': 'adam', 'graph_mode': 'off', 'use_snp_selection': False}. Best is trial 63 with value: 0.07434790383048129.
[I 2025-12-05 15:04:48,595] Trial 113 finished with value: 0.055313524906548756 and parameters: {'model_type': 'mlp', 'hidden_dims': '[512, 128]', 'dropout': 0.47680732450812785, 'batch_norm': True, 'lr': 0.00038053313529757226, 'weight_decay': 0.0002929973143919625, 'epochs': 153, 'loss': 'mse', 'optimizer': 'adam', 'graph_mode': 'off', 'use_snp_selection': False}. Best is trial 63 with value: 0.07434790383048129.
[I 2025-12-05 15:04:49,990] Trial 114 finished with value: 0.04787460402308255 and parameters: {'model_type': 'mlp', 'hidden_dims': '[512, 128]', 'dropout': 0.4237909760018267, 'batch_norm': True, 'lr': 0.00013589251372898094, 'weight_decay': 9.134790525005553e-05, 'epochs': 181, 'loss': 'mse', 'optimizer': 'adam', 'graph_mode': 'off', 'use_snp_selection': False}. Best is trial 63 with value: 0.07434790383048129.
[I 2025-12-05 15:04:50,794] Trial 115 finished with value: 0.0663863334087823 and parameters: {'model_type': 'mlp', 'hidden_dims': '[128, 64]', 'dropout': 0.4913133677834475, 'batch_norm': True, 'lr': 4.84838239080768e-05, 'weight_decay': 8.509314656233302e-06, 'epochs': 196, 'loss': 'mse', 'optimizer': 'adam', 'graph_mode': 'off', 'use_snp_selection': False}. Best is trial 63 with value: 0.07434790383048129.
[I 2025-12-05 15:04:51,601] Trial 116 finished with value: 0.038663370180588824 and parameters: {'model_type': 'mlp', 'hidden_dims': '[128, 64]', 'dropout': 0.49748655859362034, 'batch_norm': True, 'lr': 4.581941183327211e-05, 'weight_decay': 2.297224118155693e-05, 'epochs': 197, 'loss': 'mse', 'optimizer': 'adam', 'graph_mode': 'off', 'use_snp_selection': False}. Best is trial 63 with value: 0.07434790383048129.
[I 2025-12-05 15:04:52,320] Trial 117 finished with value: 0.0009134124125364641 and parameters: {'model_type': 'mlp', 'hidden_dims': '[128, 64]', 'dropout': 0.5270759570224595, 'batch_norm': True, 'lr': 2.4708101643798716e-05, 'weight_decay': 7.287633443082839e-06, 'epochs': 126, 'loss': 'mse', 'optimizer': 'adam', 'graph_mode': 'off', 'use_snp_selection': False}. Best is trial 63 with value: 0.07434790383048129.
[I 2025-12-05 15:04:54,027] Trial 118 finished with value: -0.008330768730270841 and parameters: {'model_type': 'mlp', 'hidden_dims': '[512, 256]', 'dropout': 0.2660967716389886, 'batch_norm': True, 'lr': 2.978180605979622e-06, 'weight_decay': 8.666817098972018e-06, 'epochs': 255, 'loss': 'mae', 'optimizer': 'adam', 'graph_mode': 'off', 'use_snp_selection': False}. Best is trial 63 with value: 0.07434790383048129.
[I 2025-12-05 15:04:55,166] Trial 119 finished with value: 0.0266116166674787 and parameters: {'model_type': 'mlp', 'hidden_dims': '[512, 128]', 'dropout': 0.4910520460019266, 'batch_norm': True, 'lr': 3.297815488881257e-05, 'weight_decay': 3.1839706195695574e-05, 'epochs': 101, 'loss': 'mse', 'optimizer': 'adam', 'graph_mode': 'off', 'use_snp_selection': False}. Best is trial 63 with value: 0.07434790383048129.
[I 2025-12-05 15:04:56,033] Trial 120 finished with value: 0.04235064318448603 and parameters: {'model_type': 'mlp', 'hidden_dims': '[128, 64]', 'dropout': 0.5076647420470357, 'batch_norm': True, 'lr': 0.00024849520406376523, 'weight_decay': 4.209169482231763e-05, 'epochs': 202, 'loss': 'mse', 'optimizer': 'adam', 'graph_mode': 'off', 'use_snp_selection': False}. Best is trial 63 with value: 0.07434790383048129.
[I 2025-12-05 15:04:56,906] Trial 121 finished with value: 0.06378584060438539 and parameters: {'model_type': 'mlp', 'hidden_dims': '[128, 64]', 'dropout': 0.4650814548817148, 'batch_norm': True, 'lr': 0.0002950193896548812, 'weight_decay': 0.00020766483165795974, 'epochs': 215, 'loss': 'mse', 'optimizer': 'adam', 'graph_mode': 'off', 'use_snp_selection': False}. Best is trial 63 with value: 0.07434790383048129.
[I 2025-12-05 15:04:57,795] Trial 122 finished with value: 0.043133525239057065 and parameters: {'model_type': 'mlp', 'hidden_dims': '[128, 64]', 'dropout': 0.43357598497688965, 'batch_norm': True, 'lr': 0.00028650645305668864, 'weight_decay': 0.00020377613600340992, 'epochs': 234, 'loss': 'mse', 'optimizer': 'adam', 'graph_mode': 'off', 'use_snp_selection': False}. Best is trial 63 with value: 0.07434790383048129.
[I 2025-12-05 15:04:58,649] Trial 123 finished with value: 0.041824197703897496 and parameters: {'model_type': 'mlp', 'hidden_dims': '[128, 64]', 'dropout': 0.45515565771735733, 'batch_norm': True, 'lr': 0.00016479427766719477, 'weight_decay': 0.0001580964663733143, 'epochs': 222, 'loss': 'mse', 'optimizer': 'adam', 'graph_mode': 'off', 'use_snp_selection': False}. Best is trial 63 with value: 0.07434790383048129.
[I 2025-12-05 15:05:00,074] Trial 124 finished with value: 0.05392002818871381 and parameters: {'model_type': 'mlp', 'hidden_dims': '[512, 128]', 'dropout': 0.46914298572238144, 'batch_norm': True, 'lr': 0.0005684776232811753, 'weight_decay': 7.624463098668846e-05, 'epochs': 189, 'loss': 'mse', 'optimizer': 'adam', 'graph_mode': 'off', 'use_snp_selection': False}. Best is trial 63 with value: 0.07434790383048129.
[I 2025-12-05 15:05:00,887] Trial 125 finished with value: 0.03725822754704722 and parameters: {'model_type': 'mlp', 'hidden_dims': '[128, 64]', 'dropout': 0.44575040219940004, 'batch_norm': True, 'lr': 6.79993683952781e-05, 'weight_decay': 5.257052802194969e-05, 'epochs': 202, 'loss': 'mse', 'optimizer': 'adam', 'graph_mode': 'off', 'use_snp_selection': False}. Best is trial 63 with value: 0.07434790383048129.
[I 2025-12-05 15:05:01,709] Trial 126 finished with value: 0.03766483086202202 and parameters: {'model_type': 'mlp', 'hidden_dims': '[128, 64]', 'dropout': 0.2283965786418601, 'batch_norm': True, 'lr': 0.00033886842670260303, 'weight_decay': 0.0003251042033914697, 'epochs': 207, 'loss': 'mse', 'optimizer': 'adam', 'graph_mode': 'off', 'use_snp_selection': False}. Best is trial 63 with value: 0.07434790383048129.
[I 2025-12-05 15:05:02,397] Trial 127 finished with value: 0.04852266639270378 and parameters: {'model_type': 'mlp', 'hidden_dims': '[128, 64]', 'dropout': 0.2513288907638547, 'batch_norm': True, 'lr': 0.0004387862606811579, 'weight_decay': 0.0002331336243630608, 'epochs': 109, 'loss': 'mse', 'optimizer': 'adam', 'graph_mode': 'off', 'use_snp_selection': False}. Best is trial 63 with value: 0.07434790383048129.
[I 2025-12-05 15:05:04,049] Trial 128 finished with value: 0.05501938672325936 and parameters: {'model_type': 'mlp', 'hidden_dims': '[512, 128]', 'dropout': 0.4020561040071308, 'batch_norm': True, 'lr': 0.00023077865891550504, 'weight_decay': 0.00011483383129200267, 'epochs': 240, 'loss': 'mse', 'optimizer': 'adam', 'graph_mode': 'off', 'use_snp_selection': False}. Best is trial 63 with value: 0.07434790383048129.
[I 2025-12-05 15:05:05,199] Trial 129 finished with value: 0.022741132015450423 and parameters: {'model_type': 'mlp', 'hidden_dims': '[512, 256]', 'dropout': 0.48557350841770625, 'batch_norm': False, 'lr': 0.00037827937865810593, 'weight_decay': 1.7742475509602828e-07, 'epochs': 216, 'loss': 'mae', 'optimizer': 'adam', 'graph_mode': 'off', 'use_snp_selection': True, 'num_snps': 9760}. Best is trial 63 with value: 0.07434790383048129.
[I 2025-12-05 15:05:06,322] Trial 130 finished with value: 0.03354082640006341 and parameters: {'model_type': 'mlp', 'hidden_dims': '[512, 128]', 'dropout': 0.4664457225217077, 'batch_norm': True, 'lr': 5.350102699524111e-05, 'weight_decay': 4.907199312285616e-06, 'epochs': 96, 'loss': 'mse', 'optimizer': 'adam', 'graph_mode': 'off', 'use_snp_selection': False}. Best is trial 63 with value: 0.07434790383048129.
[I 2025-12-05 15:05:07,758] Trial 131 finished with value: 0.03182172249875336 and parameters: {'model_type': 'mlp', 'hidden_dims': '[512, 64]', 'dropout': 0.17633406784691805, 'batch_norm': True, 'lr': 8.347554992037772e-05, 'weight_decay': 8.886847127311609e-07, 'epochs': 182, 'loss': 'mse', 'optimizer': 'adam', 'graph_mode': 'off', 'use_snp_selection': False}. Best is trial 63 with value: 0.07434790383048129.
[I 2025-12-05 15:05:08,640] Trial 132 finished with value: 0.05122065086817413 and parameters: {'model_type': 'mlp', 'hidden_dims': '[256, 128, 64]', 'dropout': 0.11571716612891529, 'batch_norm': True, 'lr': 0.00027023533880776257, 'weight_decay': 1.3382802829230275e-06, 'epochs': 132, 'loss': 'mse', 'optimizer': 'adam', 'graph_mode': 'off', 'use_snp_selection': False}. Best is trial 63 with value: 0.07434790383048129.
[I 2025-12-05 15:05:09,968] Trial 133 finished with value: 0.039211385007296734 and parameters: {'model_type': 'mlp', 'hidden_dims': '[512, 64]', 'dropout': 0.38487906303844843, 'batch_norm': True, 'lr': 3.705832368939112e-05, 'weight_decay': 2.921753355536376e-07, 'epochs': 164, 'loss': 'mse', 'optimizer': 'adam', 'graph_mode': 'off', 'use_snp_selection': False}. Best is trial 63 with value: 0.07434790383048129.
[I 2025-12-05 15:05:11,140] Trial 134 finished with value: 0.051347539353671943 and parameters: {'model_type': 'mlp', 'hidden_dims': '[512, 128]', 'dropout': 0.21390771176039455, 'batch_norm': True, 'lr': 6.009444062312647e-05, 'weight_decay': 6.199636489169924e-07, 'epochs': 123, 'loss': 'mse', 'optimizer': 'adam', 'graph_mode': 'off', 'use_snp_selection': False}. Best is trial 63 with value: 0.07434790383048129.
[I 2025-12-05 15:05:11,940] Trial 135 finished with value: 0.049751003441577624 and parameters: {'model_type': 'mlp', 'hidden_dims': '[128, 64]', 'dropout': 0.15855534311928998, 'batch_norm': True, 'lr': 0.0005328090908720134, 'weight_decay': 8.436980312152675e-05, 'epochs': 192, 'loss': 'mse', 'optimizer': 'adam', 'graph_mode': 'off', 'use_snp_selection': False}. Best is trial 63 with value: 0.07434790383048129.
[I 2025-12-05 15:05:12,768] Trial 136 finished with value: 0.044069101019092255 and parameters: {'model_type': 'mlp', 'hidden_dims': '[256, 128]', 'dropout': 0.30142743426626206, 'batch_norm': True, 'lr': 0.00010571881543403733, 'weight_decay': 0.00019324279522688658, 'epochs': 113, 'loss': 'mse', 'optimizer': 'adam', 'graph_mode': 'off', 'use_snp_selection': False}. Best is trial 63 with value: 0.07434790383048129.
[I 2025-12-05 15:05:14,064] Trial 137 finished with value: 0.051593449626135796 and parameters: {'model_type': 'mlp', 'hidden_dims': '[512, 256]', 'dropout': 0.1376337019176964, 'batch_norm': True, 'lr': 0.0008351521503544452, 'weight_decay': 3.284903530751883e-06, 'epochs': 147, 'loss': 'mse', 'optimizer': 'adam', 'graph_mode': 'off', 'use_snp_selection': False}. Best is trial 63 with value: 0.07434790383048129.
[I 2025-12-05 15:05:15,345] Trial 138 finished with value: 0.05647250420181788 and parameters: {'model_type': 'mlp', 'hidden_dims': '[512, 128]', 'dropout': 0.1014017079830335, 'batch_norm': True, 'lr': 0.0007143647691710062, 'weight_decay': 0.00013712571175120012, 'epochs': 137, 'loss': 'mse', 'optimizer': 'adam', 'graph_mode': 'off', 'use_snp_selection': False}. Best is trial 63 with value: 0.07434790383048129.
[I 2025-12-05 15:05:16,957] Trial 139 finished with value: 0.047058822833197435 and parameters: {'model_type': 'mlp', 'hidden_dims': '[512, 64]', 'dropout': 0.2807037436661427, 'batch_norm': True, 'lr': 0.00032165350873414474, 'weight_decay': 0.00010302953332197373, 'epochs': 227, 'loss': 'mae', 'optimizer': 'adam', 'graph_mode': 'off', 'use_snp_selection': False}. Best is trial 63 with value: 0.07434790383048129.
