[I 2025-12-05 15:20:16,348] Trial 112 finished with value: 0.06552989796277406 and parameters: {'model_type': 'mlp', 'hidden_dims': '[256, 128, 64]', 'dropout': 0.12398500355343581, 'batch_norm': True, 'lr': 0.0007257450355989357, 'weight_decay': 0.0003613804073266785, 'epochs': 306, 'loss': 'mae', 'optimizer': 'adam', 'graph_mode': 'off', 'use_snp_selection': False}. Best is trial 73 with value: 0.08745127049003182.
[I 2025-12-05 15:20:18,260] Trial 113 finished with value: 0.073861231048277 and parameters: {'model_type': 'mlp', 'hidden_dims': '[256, 128, 64]', 'dropout': 0.10964041877918149, 'batch_norm': True, 'lr': 0.0006073827627068268, 'weight_decay': 0.0004031640058758822, 'epochs': 315, 'loss': 'mae', 'optimizer': 'adam', 'graph_mode': 'off', 'use_snp_selection': False}. Best is trial 73 with value: 0.08745127049003182.
[I 2025-12-05 15:20:20,277] Trial 114 finished with value: 0.06473009993900058 and parameters: {'model_type': 'mlp', 'hidden_dims': '[256, 128, 64]', 'dropout': 0.14375734999767992, 'batch_norm': True, 'lr': 0.0008834070334776941, 'weight_decay': 0.0008398379306601973, 'epochs': 343, 'loss': 'mae', 'optimizer': 'adam', 'graph_mode': 'off', 'use_snp_selection': False}. Best is trial 73 with value: 0.08745127049003182.
[I 2025-12-05 15:20:22,250] Trial 115 finished with value: 0.07496843694195145 and parameters: {'model_type': 'mlp', 'hidden_dims': '[256, 128, 64]', 'dropout': 0.12197570365875159, 'batch_norm': True, 'lr': 0.0007274229289089579, 'weight_decay': 0.0005106288807543613, 'epochs': 324, 'loss': 'mae', 'optimizer': 'adam', 'graph_mode': 'off', 'use_snp_selection': False}. Best is trial 73 with value: 0.08745127049003182.
[I 2025-12-05 15:20:23,536] Trial 116 finished with value: 0.05722284945226343 and parameters: {'model_type': 'mlp', 'hidden_dims': '[256, 128, 64]', 'dropout': 0.15519587940166038, 'batch_norm': True, 'lr': 0.0005129479803839748, 'weight_decay': 0.000278427921706914, 'epochs': 159, 'loss': 'mae', 'optimizer': 'adam', 'graph_mode': 'off', 'use_snp_selection': False}. Best is trial 73 with value: 0.08745127049003182.
[I 2025-12-05 15:20:26,901] Trial 117 finished with value: 0.03834803769538137 and parameters: {'model_type': 'mlp', 'hidden_dims': '[512, 256]', 'dropout': 0.26873426000120043, 'batch_norm': True, 'lr': 1.277627355099084e-05, 'weight_decay': 0.00015242049345528323, 'epochs': 328, 'loss': 'mae', 'optimizer': 'adam', 'graph_mode': 'off', 'use_snp_selection': False}. Best is trial 73 with value: 0.08745127049003182.
[I 2025-12-05 15:20:28,702] Trial 118 finished with value: 0.06790059840770962 and parameters: {'model_type': 'mlp', 'hidden_dims': '[256, 128]', 'dropout': 0.16786683665764998, 'batch_norm': True, 'lr': 1.8651219013754498e-05, 'weight_decay': 0.0006776812489670458, 'epochs': 294, 'loss': 'mae', 'optimizer': 'adam', 'graph_mode': 'off', 'use_snp_selection': False}. Best is trial 73 with value: 0.08745127049003182.
[I 2025-12-05 15:20:30,836] Trial 119 finished with value: 0.07229985817989813 and parameters: {'model_type': 'mlp', 'hidden_dims': '[256, 128, 64]', 'dropout': 0.13220640345773668, 'batch_norm': True, 'lr': 0.0008476262747729161, 'weight_decay': 0.00020893315831510494, 'epochs': 317, 'loss': 'mae', 'optimizer': 'adam', 'graph_mode': 'off', 'use_snp_selection': True, 'num_snps': 24108}. Best is trial 73 with value: 0.08745127049003182.
[I 2025-12-05 15:20:32,708] Trial 120 finished with value: 0.06564836015252332 and parameters: {'model_type': 'mlp', 'hidden_dims': '[256, 128, 64]', 'dropout': 0.3654269310869445, 'batch_norm': True, 'lr': 0.0006388723880169699, 'weight_decay': 8.974247889136424e-05, 'epochs': 308, 'loss': 'mae', 'optimizer': 'adam', 'graph_mode': 'off', 'use_snp_selection': False}. Best is trial 73 with value: 0.08745127049003182.
[I 2025-12-05 15:20:34,685] Trial 121 finished with value: 0.09122489630728824 and parameters: {'model_type': 'mlp', 'hidden_dims': '[256, 128, 64]', 'dropout': 0.11961661513198901, 'batch_norm': True, 'lr': 0.0008959289110919129, 'weight_decay': 0.0004161678321319594, 'epochs': 335, 'loss': 'mae', 'optimizer': 'adam', 'graph_mode': 'off', 'use_snp_selection': False}. Best is trial 121 with value: 0.09122489630728824.
[I 2025-12-05 15:20:36,656] Trial 122 finished with value: 0.08355684066208366 and parameters: {'model_type': 'mlp', 'hidden_dims': '[256, 128, 64]', 'dropout': 0.11545826530613627, 'batch_norm': True, 'lr': 0.00098668251867249, 'weight_decay': 0.0005072371568910129, 'epochs': 334, 'loss': 'mae', 'optimizer': 'adam', 'graph_mode': 'off', 'use_snp_selection': False}. Best is trial 121 with value: 0.09122489630728824.
[I 2025-12-05 15:20:38,676] Trial 123 finished with value: 0.081139170587238 and parameters: {'model_type': 'mlp', 'hidden_dims': '[256, 128, 64]', 'dropout': 0.14178347673525007, 'batch_norm': True, 'lr': 0.0009645884944984746, 'weight_decay': 0.0005217382605819021, 'epochs': 340, 'loss': 'mae', 'optimizer': 'adam', 'graph_mode': 'off', 'use_snp_selection': False}. Best is trial 121 with value: 0.09122489630728824.
[I 2025-12-05 15:20:40,670] Trial 124 finished with value: 0.07277197399785551 and parameters: {'model_type': 'mlp', 'hidden_dims': '[256, 128, 64]', 'dropout': 0.1400274306577194, 'batch_norm': True, 'lr': 0.000942594678472984, 'weight_decay': 0.0005497931184033296, 'epochs': 339, 'loss': 'mae', 'optimizer': 'adam', 'graph_mode': 'off', 'use_snp_selection': False}. Best is trial 121 with value: 0.09122489630728824.
[I 2025-12-05 15:20:42,639] Trial 125 finished with value: 0.08560355554507332 and parameters: {'model_type': 'mlp', 'hidden_dims': '[256, 128, 64]', 'dropout': 0.11638137554419345, 'batch_norm': True, 'lr': 0.0009923977417901355, 'weight_decay': 0.00045732561185350364, 'epochs': 333, 'loss': 'mae', 'optimizer': 'adam', 'graph_mode': 'off', 'use_snp_selection': False}. Best is trial 121 with value: 0.09122489630728824.
[I 2025-12-05 15:20:44,611] Trial 126 finished with value: 0.0831920694459515 and parameters: {'model_type': 'mlp', 'hidden_dims': '[256, 128, 64]', 'dropout': 0.14880634169629967, 'batch_norm': True, 'lr': 0.0009875662967955207, 'weight_decay': 0.0008565705594401322, 'epochs': 333, 'loss': 'mae', 'optimizer': 'adam', 'graph_mode': 'off', 'use_snp_selection': False}. Best is trial 121 with value: 0.09122489630728824.
[I 2025-12-05 15:20:46,577] Trial 127 finished with value: 0.06318793846934728 and parameters: {'model_type': 'mlp', 'hidden_dims': '[256, 128, 64]', 'dropout': 0.1154363042110279, 'batch_norm': True, 'lr': 0.0009969846611421875, 'weight_decay': 0.0009144343259245551, 'epochs': 333, 'loss': 'mae', 'optimizer': 'adam', 'graph_mode': 'off', 'use_snp_selection': False}. Best is trial 121 with value: 0.09122489630728824.
[I 2025-12-05 15:20:48,515] Trial 128 finished with value: 0.06997195383053541 and parameters: {'model_type': 'mlp', 'hidden_dims': '[256, 128, 64]', 'dropout': 0.12765923696737402, 'batch_norm': True, 'lr': 0.0007524287401934655, 'weight_decay': 0.000737950805566089, 'epochs': 326, 'loss': 'mae', 'optimizer': 'adam', 'graph_mode': 'off', 'use_snp_selection': False}. Best is trial 121 with value: 0.09122489630728824.
[I 2025-12-05 15:20:50,518] Trial 129 finished with value: 0.08199042346062618 and parameters: {'model_type': 'mlp', 'hidden_dims': '[256, 128, 64]', 'dropout': 0.1442429902944029, 'batch_norm': True, 'lr': 0.000850279419662778, 'weight_decay': 0.0006132413421107532, 'epochs': 342, 'loss': 'mae', 'optimizer': 'adam', 'graph_mode': 'off', 'use_snp_selection': False}. Best is trial 121 with value: 0.09122489630728824.
[I 2025-12-05 15:20:52,553] Trial 130 finished with value: 0.07482643405454864 and parameters: {'model_type': 'mlp', 'hidden_dims': '[256, 128, 64]', 'dropout': 0.14632520743667388, 'batch_norm': True, 'lr': 0.0006614504904637595, 'weight_decay': 0.0006323947316478535, 'epochs': 350, 'loss': 'mae', 'optimizer': 'adam', 'graph_mode': 'off', 'use_snp_selection': False}. Best is trial 121 with value: 0.09122489630728824.
[I 2025-12-05 15:20:54,576] Trial 131 finished with value: 0.08044672694024667 and parameters: {'model_type': 'mlp', 'hidden_dims': '[256, 128, 64]', 'dropout': 0.135973938968904, 'batch_norm': True, 'lr': 0.0008707442013650078, 'weight_decay': 0.0004502693746916212, 'epochs': 341, 'loss': 'mae', 'optimizer': 'adam', 'graph_mode': 'off', 'use_snp_selection': False}. Best is trial 121 with value: 0.09122489630728824.
[I 2025-12-05 15:20:56,553] Trial 132 finished with value: 0.07436133282109643 and parameters: {'model_type': 'mlp', 'hidden_dims': '[256, 128, 64]', 'dropout': 0.13578659839183577, 'batch_norm': True, 'lr': 0.0008221753248732039, 'weight_decay': 0.00046675598028744184, 'epochs': 336, 'loss': 'mae', 'optimizer': 'adam', 'graph_mode': 'off', 'use_snp_selection': False}. Best is trial 121 with value: 0.09122489630728824.
[I 2025-12-05 15:20:58,511] Trial 133 finished with value: 0.0658698465323474 and parameters: {'model_type': 'mlp', 'hidden_dims': '[256, 128, 64]', 'dropout': 0.12185038068851685, 'batch_norm': True, 'lr': 0.0007671909117862618, 'weight_decay': 0.0005567260453857915, 'epochs': 331, 'loss': 'mae', 'optimizer': 'adam', 'graph_mode': 'off', 'use_snp_selection': False}. Best is trial 121 with value: 0.09122489630728824.
[I 2025-12-05 15:21:00,423] Trial 134 finished with value: 0.0662816233804701 and parameters: {'model_type': 'mlp', 'hidden_dims': '[256, 128, 64]', 'dropout': 0.11076947776505933, 'batch_norm': True, 'lr': 0.0008649449021783106, 'weight_decay': 0.0007680758620643878, 'epochs': 315, 'loss': 'mae', 'optimizer': 'adam', 'graph_mode': 'off', 'use_snp_selection': False}. Best is trial 121 with value: 0.09122489630728824.
[I 2025-12-05 15:21:02,413] Trial 135 finished with value: 0.0729101794525184 and parameters: {'model_type': 'mlp', 'hidden_dims': '[256, 128, 64]', 'dropout': 0.10118906592911592, 'batch_norm': True, 'lr': 0.0006469518995061233, 'weight_decay': 0.0004225172456016588, 'epochs': 339, 'loss': 'mae', 'optimizer': 'adam', 'graph_mode': 'off', 'use_snp_selection': False}. Best is trial 121 with value: 0.09122489630728824.
[I 2025-12-05 15:21:04,399] Trial 136 finished with value: 0.054177873321647564 and parameters: {'model_type': 'mlp', 'hidden_dims': '[256, 128, 64]', 'dropout': 0.14849487769758246, 'batch_norm': False, 'lr': 0.000996206188889847, 'weight_decay': 0.000973112405175034, 'epochs': 345, 'loss': 'mae', 'optimizer': 'adam', 'graph_mode': 'off', 'use_snp_selection': False}. Best is trial 121 with value: 0.09122489630728824.
[I 2025-12-05 15:21:06,349] Trial 137 finished with value: 0.06602806151612114 and parameters: {'model_type': 'mlp', 'hidden_dims': '[256, 128, 64]', 'dropout': 0.13577815146209252, 'batch_norm': True, 'lr': 0.0007261282223294921, 'weight_decay': 0.0005618318519394588, 'epochs': 325, 'loss': 'mse', 'optimizer': 'adam', 'graph_mode': 'off', 'use_snp_selection': False}. Best is trial 121 with value: 0.09122489630728824.
[I 2025-12-05 15:21:07,611] Trial 138 finished with value: 0.07004401168652244 and parameters: {'model_type': 'mlp', 'hidden_dims': '[128, 64]', 'dropout': 0.1170240838831193, 'batch_norm': True, 'lr': 0.0005790316360251883, 'weight_decay': 0.0003502196266707766, 'epochs': 334, 'loss': 'mae', 'optimizer': 'adam', 'graph_mode': 'off', 'use_snp_selection': False}. Best is trial 121 with value: 0.09122489630728824.
[I 2025-12-05 15:21:09,529] Trial 139 finished with value: 0.07828893673705978 and parameters: {'model_type': 'mlp', 'hidden_dims': '[256, 128, 64]', 'dropout': 0.12940501559202436, 'batch_norm': True, 'lr': 0.0008620909397758509, 'weight_decay': 0.0006922005035818323, 'epochs': 320, 'loss': 'mae', 'optimizer': 'adam', 'graph_mode': 'off', 'use_snp_selection': False}. Best is trial 121 with value: 0.09122489630728824.
[I 2025-12-05 15:21:11,480] Trial 140 finished with value: 0.023641402927713932 and parameters: {'model_type': 'mlp', 'hidden_dims': '[256, 128, 64]', 'dropout': 0.15558074329807733, 'batch_norm': True, 'lr': 1.649323330871108e-06, 'weight_decay': 0.0007202636216806661, 'epochs': 329, 'loss': 'mae', 'optimizer': 'adam', 'graph_mode': 'off', 'use_snp_selection': False}. Best is trial 121 with value: 0.09122489630728824.
[I 2025-12-05 15:21:13,437] Trial 141 finished with value: 0.05904631510892608 and parameters: {'model_type': 'mlp', 'hidden_dims': '[256, 128, 64]', 'dropout': 0.3129794982184994, 'batch_norm': True, 'lr': 0.0008642870348217924, 'weight_decay': 0.0004644560953093163, 'epochs': 322, 'loss': 'mae', 'optimizer': 'adam', 'graph_mode': 'off', 'use_snp_selection': False}. Best is trial 121 with value: 0.09122489630728824.
[I 2025-12-05 15:21:15,344] Trial 142 finished with value: 0.07674147132887228 and parameters: {'model_type': 'mlp', 'hidden_dims': '[256, 128, 64]', 'dropout': 0.12980013928454173, 'batch_norm': True, 'lr': 0.0007796112438523373, 'weight_decay': 0.0006475283689981831, 'epochs': 317, 'loss': 'mae', 'optimizer': 'adam', 'graph_mode': 'off', 'use_snp_selection': False}. Best is trial 121 with value: 0.09122489630728824.
[I 2025-12-05 15:21:17,341] Trial 143 finished with value: 0.057869918392463436 and parameters: {'model_type': 'mlp', 'hidden_dims': '[256, 128, 64]', 'dropout': 0.1438059309836392, 'batch_norm': True, 'lr': 0.0008822680116875793, 'weight_decay': 0.0008199491149898969, 'epochs': 341, 'loss': 'mae', 'optimizer': 'adam', 'graph_mode': 'off', 'use_snp_selection': False}. Best is trial 121 with value: 0.09122489630728824.
[I 2025-12-05 15:21:19,222] Trial 144 finished with value: 0.05763364485472719 and parameters: {'model_type': 'mlp', 'hidden_dims': '[256, 128, 64]', 'dropout': 0.12046357539976614, 'batch_norm': True, 'lr': 0.0009875778047909523, 'weight_decay': 0.0005045424775714203, 'epochs': 312, 'loss': 'mae', 'optimizer': 'adam', 'graph_mode': 'off', 'use_snp_selection': False}. Best is trial 121 with value: 0.09122489630728824.
[I 2025-12-05 15:21:21,252] Trial 145 finished with value: 0.07167500130988813 and parameters: {'model_type': 'mlp', 'hidden_dims': '[256, 128, 64]', 'dropout': 0.17869199573233926, 'batch_norm': True, 'lr': 0.0006915823100820124, 'weight_decay': 0.00038366071867642547, 'epochs': 346, 'loss': 'mae', 'optimizer': 'adam', 'graph_mode': 'off', 'use_snp_selection': False}. Best is trial 121 with value: 0.09122489630728824.
[I 2025-12-05 15:21:23,220] Trial 146 finished with value: 0.06789215308527444 and parameters: {'model_type': 'mlp', 'hidden_dims': '[256, 128, 64]', 'dropout': 0.10797755635788059, 'batch_norm': True, 'lr': 0.0006150633408076245, 'weight_decay': 0.0003304159736989498, 'epochs': 334, 'loss': 'mae', 'optimizer': 'adam', 'graph_mode': 'off', 'use_snp_selection': False}. Best is trial 121 with value: 0.09122489630728824.
[I 2025-12-05 15:21:25,150] Trial 147 finished with value: 0.08301173311192188 and parameters: {'model_type': 'mlp', 'hidden_dims': '[256, 128, 64]', 'dropout': 0.12994212185308301, 'batch_norm': True, 'lr': 0.0007999565497876989, 'weight_decay': 0.000575382108779134, 'epochs': 324, 'loss': 'mae', 'optimizer': 'adam', 'graph_mode': 'off', 'use_snp_selection': False}. Best is trial 121 with value: 0.09122489630728824.
[I 2025-12-05 15:21:28,509] Trial 148 finished with value: 0.07745369516269943 and parameters: {'model_type': 'mlp', 'hidden_dims': '[512, 64]', 'dropout': 0.14254678369863227, 'batch_norm': True, 'lr': 0.0007864341967883381, 'weight_decay': 0.0005848932433145204, 'epochs': 328, 'loss': 'mae', 'optimizer': 'adam', 'graph_mode': 'off', 'use_snp_selection': False}. Best is trial 121 with value: 0.09122489630728824.
[I 2025-12-05 15:21:30,508] Trial 149 finished with value: 0.07400864542831316 and parameters: {'model_type': 'mlp', 'hidden_dims': '[256, 128, 64]', 'dropout': 0.15572885624142685, 'batch_norm': True, 'lr': 0.0009950182735484062, 'weight_decay': 0.0009737320628577611, 'epochs': 341, 'loss': 'mae', 'optimizer': 'adam', 'graph_mode': 'off', 'use_snp_selection': False}. Best is trial 121 with value: 0.09122489630728824.
[I 2025-12-05 15:21:33,835] Trial 0 finished with value: 0.0659782063291762 and parameters: {'model_type': 'mlp', 'hidden_dims': '[128, 64]', 'dropout': 0.199031432379812, 'batch_norm': True, 'lr': 1.8408544111075837e-06, 'weight_decay': 5.5136510071208614e-05, 'epochs': 336, 'loss': 'mae', 'optimizer': 'adam', 'graph_mode': 'off', 'use_snp_selection': True, 'num_snps': 43862}. Best is trial 0 with value: 0.0659782063291762.
[I 2025-12-05 15:21:36,084] Trial 1 finished with value: 0.0999421386851122 and parameters: {'model_type': 'mlp', 'hidden_dims': '[256, 128]', 'dropout': 0.4370668075331726, 'batch_norm': True, 'lr': 7.133471581159139e-05, 'weight_decay': 1.128633586803549e-05, 'epochs': 242, 'loss': 'mae', 'optimizer': 'adam', 'graph_mode': 'off', 'use_snp_selection': False}. Best is trial 1 with value: 0.0999421386851122.
[I 2025-12-05 15:21:37,872] Trial 2 finished with value: 0.04041139048306722 and parameters: {'model_type': 'mlp', 'hidden_dims': '[256, 128, 64]', 'dropout': 0.41314357415569625, 'batch_norm': False, 'lr': 3.952233718592101e-06, 'weight_decay': 0.00026754769258252603, 'epochs': 149, 'loss': 'mse', 'optimizer': 'adam', 'graph_mode': 'off', 'use_snp_selection': True, 'num_snps': 11571}. Best is trial 1 with value: 0.0999421386851122.
[I 2025-12-05 15:21:42,537] Trial 3 finished with value: 0.11257837171351374 and parameters: {'model_type': 'mlp', 'hidden_dims': '[512, 64]', 'dropout': 0.5938127374509361, 'batch_norm': False, 'lr': 5.67704586114731e-06, 'weight_decay': 2.4518087630137052e-05, 'epochs': 320, 'loss': 'mae', 'optimizer': 'adam', 'graph_mode': 'off', 'use_snp_selection': False}. Best is trial 3 with value: 0.11257837171351374.
[I 2025-12-05 15:21:46,902] Trial 4 finished with value: 0.1263244619776328 and parameters: {'model_type': 'mlp', 'hidden_dims': '[512, 128]', 'dropout': 0.25746343592134413, 'batch_norm': True, 'lr': 1.3467657668402788e-06, 'weight_decay': 0.00033087251918647806, 'epochs': 277, 'loss': 'mse', 'optimizer': 'adam', 'graph_mode': 'off', 'use_snp_selection': True, 'num_snps': 36675}. Best is trial 4 with value: 0.1263244619776328.
[I 2025-12-05 15:21:50,123] Trial 5 finished with value: 0.05733443763409211 and parameters: {'model_type': 'mlp', 'hidden_dims': '[512, 64]', 'dropout': 0.38275350994408375, 'batch_norm': True, 'lr': 1.5586664309232824e-06, 'weight_decay': 0.0008227664668621182, 'epochs': 145, 'loss': 'mae', 'optimizer': 'adam', 'graph_mode': 'off', 'use_snp_selection': True, 'num_snps': 32148}. Best is trial 4 with value: 0.1263244619776328.
[I 2025-12-05 15:21:52,040] Trial 6 finished with value: 0.10148189207979914 and parameters: {'model_type': 'mlp', 'hidden_dims': '[256, 128]', 'dropout': 0.3930109900265879, 'batch_norm': False, 'lr': 4.892964372128395e-05, 'weight_decay': 1.5809549317992182e-06, 'epochs': 199, 'loss': 'mse', 'optimizer': 'adam', 'graph_mode': 'off', 'use_snp_selection': False}. Best is trial 4 with value: 0.1263244619776328.
[I 2025-12-05 15:21:54,025] Trial 7 finished with value: 0.11123454734106258 and parameters: {'model_type': 'mlp', 'hidden_dims': '[512, 256]', 'dropout': 0.15343979219678458, 'batch_norm': True, 'lr': 6.234003099047341e-05, 'weight_decay': 3.894760610535477e-07, 'epochs': 97, 'loss': 'mse', 'optimizer': 'adam', 'graph_mode': 'off', 'use_snp_selection': False}. Best is trial 4 with value: 0.1263244619776328.
[I 2025-12-05 15:21:58,628] Trial 8 finished with value: 0.1131618906710287 and parameters: {'model_type': 'mlp', 'hidden_dims': '[512, 128]', 'dropout': 0.10743001231661406, 'batch_norm': True, 'lr': 0.00023728538449271062, 'weight_decay': 1.7629071578048637e-05, 'epochs': 312, 'loss': 'mae', 'optimizer': 'adam', 'graph_mode': 'off', 'use_snp_selection': False}. Best is trial 4 with value: 0.1263244619776328.
[I 2025-12-05 15:22:01,576] Trial 9 finished with value: 0.10001171887949666 and parameters: {'model_type': 'mlp', 'hidden_dims': '[512, 64]', 'dropout': 0.14505336736221927, 'batch_norm': True, 'lr': 5.8619638388111826e-05, 'weight_decay': 6.200156172669308e-07, 'epochs': 175, 'loss': 'mse', 'optimizer': 'adam', 'graph_mode': 'off', 'use_snp_selection': False}. Best is trial 4 with value: 0.1263244619776328.
[I 2025-12-05 15:22:07,458] Trial 10 finished with value: 0.0856521389623271 and parameters: {'model_type': 'mlp', 'hidden_dims': '[512, 128]', 'dropout': 0.2549147281275221, 'batch_norm': False, 'lr': 1.080428984628536e-05, 'weight_decay': 0.0001397766261378007, 'epochs': 256, 'loss': 'mse', 'optimizer': 'adam', 'graph_mode': 'off', 'use_snp_selection': True, 'num_snps': 57847}. Best is trial 4 with value: 0.1263244619776328.
[I 2025-12-05 15:22:09,469] Trial 11 finished with value: 0.10568115734673349 and parameters: {'model_type': 'mlp', 'hidden_dims': '[512, 128]', 'dropout': 0.2908205407277709, 'batch_norm': True, 'lr': 0.0007035074985054279, 'weight_decay': 3.074394582448942e-06, 'epochs': 266, 'loss': 'mae', 'optimizer': 'adam', 'graph_mode': 'off', 'use_snp_selection': True, 'num_snps': 7093}. Best is trial 4 with value: 0.1263244619776328.
[I 2025-12-05 15:22:13,898] Trial 12 finished with value: 0.11945180784667175 and parameters: {'model_type': 'mlp', 'hidden_dims': '[512, 128]', 'dropout': 0.2379250770033356, 'batch_norm': True, 'lr': 0.00038430349923342257, 'weight_decay': 0.0009195886437027288, 'epochs': 299, 'loss': 'mse', 'optimizer': 'adam', 'graph_mode': 'off', 'use_snp_selection': False}. Best is trial 4 with value: 0.1263244619776328.
[I 2025-12-05 15:22:17,601] Trial 13 finished with value: 0.11456565449964035 and parameters: {'model_type': 'mlp', 'hidden_dims': '[512, 128]', 'dropout': 0.29627587905786035, 'batch_norm': True, 'lr': 0.00023656056080575746, 'weight_decay': 0.0008594150197641446, 'epochs': 277, 'loss': 'mse', 'optimizer': 'adam', 'graph_mode': 'off', 'use_snp_selection': True, 'num_snps': 28162}. Best is trial 4 with value: 0.1263244619776328.
