[I 2025-12-05 16:20:19,000] Trial 111 finished with value: 0.12065681300090952 and parameters: {'model_type': 'mlp', 'hidden_dims': '[512, 256]', 'dropout': 0.1400978179795672, 'batch_norm': True, 'lr': 0.0005337656128613466, 'weight_decay': 1.1827009966799296e-06, 'epochs': 120, 'loss': 'mse', 'optimizer': 'adam', 'graph_mode': 'off', 'use_snp_selection': False}. Best is trial 69 with value: 0.135331097196207.
[I 2025-12-05 16:20:20,022] Trial 112 finished with value: 0.10865272759243472 and parameters: {'model_type': 'mlp', 'hidden_dims': '[512, 256]', 'dropout': 0.10661182423544852, 'batch_norm': True, 'lr': 0.0008054494096076256, 'weight_decay': 6.402630062914847e-07, 'epochs': 94, 'loss': 'mse', 'optimizer': 'adam', 'graph_mode': 'off', 'use_snp_selection': False}. Best is trial 69 with value: 0.135331097196207.
[I 2025-12-05 16:20:21,140] Trial 113 finished with value: 0.1300039893817859 and parameters: {'model_type': 'mlp', 'hidden_dims': '[512, 64]', 'dropout': 0.10099922696288534, 'batch_norm': True, 'lr': 0.0004059088929463871, 'weight_decay': 4.3089252628383446e-07, 'epochs': 112, 'loss': 'mse', 'optimizer': 'adam', 'graph_mode': 'off', 'use_snp_selection': False}. Best is trial 69 with value: 0.135331097196207.
[I 2025-12-05 16:20:22,125] Trial 114 finished with value: 0.1161838417932948 and parameters: {'model_type': 'mlp', 'hidden_dims': '[512, 256]', 'dropout': 0.1597682313476134, 'batch_norm': True, 'lr': 0.0001273797837942843, 'weight_decay': 7.526411757123311e-07, 'epochs': 83, 'loss': 'mse', 'optimizer': 'adam', 'graph_mode': 'off', 'use_snp_selection': False}. Best is trial 69 with value: 0.135331097196207.
[I 2025-12-05 16:20:22,771] Trial 115 finished with value: 0.10836730951504976 and parameters: {'model_type': 'mlp', 'hidden_dims': '[128, 64]', 'dropout': 0.11966075258207132, 'batch_norm': True, 'lr': 0.00016650261387841093, 'weight_decay': 2.6164038724346954e-07, 'epochs': 103, 'loss': 'mse', 'optimizer': 'adam', 'graph_mode': 'off', 'use_snp_selection': False}. Best is trial 69 with value: 0.135331097196207.
[I 2025-12-05 16:20:23,729] Trial 116 finished with value: 0.1043704220371353 and parameters: {'model_type': 'mlp', 'hidden_dims': '[512, 256]', 'dropout': 0.17392418594855755, 'batch_norm': True, 'lr': 7.355523929380458e-05, 'weight_decay': 5.509359479808463e-07, 'epochs': 76, 'loss': 'mae', 'optimizer': 'adam', 'graph_mode': 'off', 'use_snp_selection': False}. Best is trial 69 with value: 0.135331097196207.
[I 2025-12-05 16:20:24,860] Trial 117 finished with value: 0.043153059318117436 and parameters: {'model_type': 'mlp', 'hidden_dims': '[512, 256]', 'dropout': 0.5803441491716996, 'batch_norm': False, 'lr': 0.000677317804070928, 'weight_decay': 8.77199129314181e-07, 'epochs': 124, 'loss': 'mse', 'optimizer': 'adam', 'graph_mode': 'off', 'use_snp_selection': False}. Best is trial 69 with value: 0.135331097196207.
[I 2025-12-05 16:20:25,484] Trial 118 finished with value: 0.11486389546417056 and parameters: {'model_type': 'mlp', 'hidden_dims': '[128, 64]', 'dropout': 0.20458374481573358, 'batch_norm': True, 'lr': 0.0009776543168387504, 'weight_decay': 3.5431855031844235e-07, 'epochs': 86, 'loss': 'mse', 'optimizer': 'adam', 'graph_mode': 'off', 'use_snp_selection': False}. Best is trial 69 with value: 0.135331097196207.
[I 2025-12-05 16:20:26,275] Trial 119 finished with value: 0.1265710595104204 and parameters: {'model_type': 'mlp', 'hidden_dims': '[256, 128]', 'dropout': 0.3065403514838747, 'batch_norm': True, 'lr': 0.0003305898460042881, 'weight_decay': 1.9695514359307656e-07, 'epochs': 113, 'loss': 'mse', 'optimizer': 'adam', 'graph_mode': 'off', 'use_snp_selection': False}. Best is trial 69 with value: 0.135331097196207.
[I 2025-12-05 16:20:27,204] Trial 120 finished with value: 0.11233615602807573 and parameters: {'model_type': 'mlp', 'hidden_dims': '[512, 256]', 'dropout': 0.1327802427614958, 'batch_norm': True, 'lr': 0.0002694320838965487, 'weight_decay': 5.847789274753915e-07, 'epochs': 69, 'loss': 'mse', 'optimizer': 'adam', 'graph_mode': 'off', 'use_snp_selection': False}. Best is trial 69 with value: 0.135331097196207.
[I 2025-12-05 16:20:28,287] Trial 121 finished with value: 0.13067199048557002 and parameters: {'model_type': 'mlp', 'hidden_dims': '[512, 64]', 'dropout': 0.10161308499756953, 'batch_norm': True, 'lr': 0.0004291622470921353, 'weight_decay': 4.637585236052197e-07, 'epochs': 108, 'loss': 'mse', 'optimizer': 'adam', 'graph_mode': 'off', 'use_snp_selection': False}. Best is trial 69 with value: 0.135331097196207.
[I 2025-12-05 16:20:29,365] Trial 122 finished with value: 0.13938263865135994 and parameters: {'model_type': 'mlp', 'hidden_dims': '[512, 64]', 'dropout': 0.14598120323883335, 'batch_norm': True, 'lr': 0.0005999452159916095, 'weight_decay': 4.134457304026572e-07, 'epochs': 107, 'loss': 'mse', 'optimizer': 'adam', 'graph_mode': 'off', 'use_snp_selection': False}. Best is trial 122 with value: 0.13938263865135994.
[I 2025-12-05 16:20:30,396] Trial 123 finished with value: 0.11950486586214036 and parameters: {'model_type': 'mlp', 'hidden_dims': '[512, 64]', 'dropout': 0.14560820455523532, 'batch_norm': True, 'lr': 0.0005321323798465048, 'weight_decay': 3.1375258972563447e-07, 'epochs': 96, 'loss': 'mse', 'optimizer': 'adam', 'graph_mode': 'off', 'use_snp_selection': False}. Best is trial 122 with value: 0.13938263865135994.
[I 2025-12-05 16:20:31,847] Trial 124 finished with value: 0.12312896546710543 and parameters: {'model_type': 'mlp', 'hidden_dims': '[512, 64]', 'dropout': 0.12448213092097515, 'batch_norm': True, 'lr': 0.0008451412810405335, 'weight_decay': 4.1926522275704057e-07, 'epochs': 207, 'loss': 'mse', 'optimizer': 'adam', 'graph_mode': 'off', 'use_snp_selection': False}. Best is trial 122 with value: 0.13938263865135994.
[I 2025-12-05 16:20:32,897] Trial 125 finished with value: 0.10551936030288606 and parameters: {'model_type': 'mlp', 'hidden_dims': '[512, 64]', 'dropout': 0.16232765290359147, 'batch_norm': True, 'lr': 0.0005915359770897845, 'weight_decay': 2.5546198778292795e-07, 'epochs': 101, 'loss': 'mse', 'optimizer': 'adam', 'graph_mode': 'off', 'use_snp_selection': False}. Best is trial 122 with value: 0.13938263865135994.
[I 2025-12-05 16:20:34,152] Trial 126 finished with value: 0.10653140984403567 and parameters: {'model_type': 'mlp', 'hidden_dims': '[512, 64]', 'dropout': 0.15029645092052515, 'batch_norm': True, 'lr': 9.360805710904316e-05, 'weight_decay': 4.662481805031198e-07, 'epochs': 155, 'loss': 'mse', 'optimizer': 'adam', 'graph_mode': 'off', 'use_snp_selection': False}. Best is trial 122 with value: 0.13938263865135994.
[I 2025-12-05 16:20:35,267] Trial 127 finished with value: 0.11353350953175065 and parameters: {'model_type': 'mlp', 'hidden_dims': '[512, 64]', 'dropout': 0.18314753746488258, 'batch_norm': True, 'lr': 0.00013496815445855048, 'weight_decay': 7.368585554141775e-07, 'epochs': 118, 'loss': 'mae', 'optimizer': 'adam', 'graph_mode': 'off', 'use_snp_selection': False}. Best is trial 122 with value: 0.13938263865135994.
[I 2025-12-05 16:20:36,170] Trial 128 finished with value: 0.11687225545713363 and parameters: {'model_type': 'mlp', 'hidden_dims': '[512, 64]', 'dropout': 0.3861962541945021, 'batch_norm': True, 'lr': 0.0007181529370703699, 'weight_decay': 3.553663300654995e-07, 'epochs': 60, 'loss': 'mse', 'optimizer': 'adam', 'graph_mode': 'off', 'use_snp_selection': False}. Best is trial 122 with value: 0.13938263865135994.
[I 2025-12-05 16:20:37,186] Trial 129 finished with value: 0.0452055057013599 and parameters: {'model_type': 'mlp', 'hidden_dims': '[512, 64]', 'dropout': 0.13686834653531282, 'batch_norm': True, 'lr': 2.482918876985895e-06, 'weight_decay': 3.6820287025350586e-05, 'epochs': 90, 'loss': 'mse', 'optimizer': 'adam', 'graph_mode': 'off', 'use_snp_selection': False}. Best is trial 122 with value: 0.13938263865135994.
[I 2025-12-05 16:20:38,253] Trial 130 finished with value: 0.11578657422543531 and parameters: {'model_type': 'mlp', 'hidden_dims': '[512, 256]', 'dropout': 0.10006726417449628, 'batch_norm': True, 'lr': 0.00011078009010996892, 'weight_decay': 2.2397540024994117e-07, 'epochs': 105, 'loss': 'mse', 'optimizer': 'adam', 'graph_mode': 'off', 'use_snp_selection': False}. Best is trial 122 with value: 0.13938263865135994.
[I 2025-12-05 16:20:38,932] Trial 131 finished with value: 0.11214948552227148 and parameters: {'model_type': 'mlp', 'hidden_dims': '[128, 64]', 'dropout': 0.11556214048459384, 'batch_norm': True, 'lr': 0.0004917280327746039, 'weight_decay': 6.195335702580554e-07, 'epochs': 128, 'loss': 'mse', 'optimizer': 'adam', 'graph_mode': 'off', 'use_snp_selection': False}. Best is trial 122 with value: 0.13938263865135994.
[I 2025-12-05 16:20:40,019] Trial 132 finished with value: 0.11878543280887228 and parameters: {'model_type': 'mlp', 'hidden_dims': '[512, 256]', 'dropout': 0.10972767658865715, 'batch_norm': True, 'lr': 0.0003914427476154789, 'weight_decay': 1.039440722292894e-06, 'epochs': 110, 'loss': 'mse', 'optimizer': 'adam', 'graph_mode': 'off', 'use_snp_selection': False}. Best is trial 122 with value: 0.13938263865135994.
[I 2025-12-05 16:20:40,829] Trial 133 finished with value: 0.11168899115158672 and parameters: {'model_type': 'mlp', 'hidden_dims': '[256, 128, 64]', 'dropout': 0.1283191663180362, 'batch_norm': True, 'lr': 0.0005969964612691517, 'weight_decay': 5.069390865849395e-07, 'epochs': 117, 'loss': 'mse', 'optimizer': 'adam', 'graph_mode': 'off', 'use_snp_selection': False}. Best is trial 122 with value: 0.13938263865135994.
[I 2025-12-05 16:20:41,483] Trial 134 finished with value: 0.10577025146295715 and parameters: {'model_type': 'mlp', 'hidden_dims': '[128, 64]', 'dropout': 0.12114799910340263, 'batch_norm': True, 'lr': 0.0004401006102866481, 'weight_decay': 7.366369371844082e-06, 'epochs': 108, 'loss': 'mse', 'optimizer': 'adam', 'graph_mode': 'off', 'use_snp_selection': False}. Best is trial 122 with value: 0.13938263865135994.
[I 2025-12-05 16:20:42,504] Trial 135 finished with value: 0.1231446157953105 and parameters: {'model_type': 'mlp', 'hidden_dims': '[512, 64]', 'dropout': 0.1538302188684407, 'batch_norm': True, 'lr': 0.00017782666509925943, 'weight_decay': 6.487579629319727e-07, 'epochs': 93, 'loss': 'mse', 'optimizer': 'adam', 'graph_mode': 'off', 'use_snp_selection': False}. Best is trial 122 with value: 0.13938263865135994.
[I 2025-12-05 16:20:43,721] Trial 136 finished with value: 0.12516559932714402 and parameters: {'model_type': 'mlp', 'hidden_dims': '[512, 256]', 'dropout': 0.13689654697827164, 'batch_norm': True, 'lr': 0.0007590261917862533, 'weight_decay': 1.5076582191895833e-07, 'epochs': 135, 'loss': 'mse', 'optimizer': 'adam', 'graph_mode': 'off', 'use_snp_selection': False}. Best is trial 122 with value: 0.13938263865135994.
[I 2025-12-05 16:20:44,404] Trial 137 finished with value: 0.1272497460349135 and parameters: {'model_type': 'mlp', 'hidden_dims': '[128, 64]', 'dropout': 0.17184758677080902, 'batch_norm': True, 'lr': 0.00031055713311880774, 'weight_decay': 8.312992535992175e-07, 'epochs': 123, 'loss': 'mse', 'optimizer': 'adam', 'graph_mode': 'off', 'use_snp_selection': False}. Best is trial 122 with value: 0.13938263865135994.
[I 2025-12-05 16:20:45,615] Trial 138 finished with value: 0.12308055365921115 and parameters: {'model_type': 'mlp', 'hidden_dims': '[512, 256]', 'dropout': 0.1427194892174098, 'batch_norm': False, 'lr': 0.00015024038594925988, 'weight_decay': 4.0729338165326804e-07, 'epochs': 144, 'loss': 'mae', 'optimizer': 'adam', 'graph_mode': 'off', 'use_snp_selection': False}. Best is trial 122 with value: 0.13938263865135994.
[I 2025-12-05 16:20:46,572] Trial 139 finished with value: 0.14332901005637386 and parameters: {'model_type': 'mlp', 'hidden_dims': '[512, 256]', 'dropout': 0.11265820533924674, 'batch_norm': True, 'lr': 0.0008750894749306009, 'weight_decay': 1.5848901534725017e-06, 'epochs': 76, 'loss': 'mse', 'optimizer': 'adam', 'graph_mode': 'off', 'use_snp_selection': False}. Best is trial 139 with value: 0.14332901005637386.
[I 2025-12-05 16:20:47,532] Trial 140 finished with value: 0.12040353707476505 and parameters: {'model_type': 'mlp', 'hidden_dims': '[512, 256]', 'dropout': 0.18867747907886687, 'batch_norm': True, 'lr': 0.0009287666112708178, 'weight_decay': 1.3307637802073e-06, 'epochs': 76, 'loss': 'mse', 'optimizer': 'adam', 'graph_mode': 'off', 'use_snp_selection': False}. Best is trial 139 with value: 0.14332901005637386.
[I 2025-12-05 16:20:48,519] Trial 141 finished with value: 0.125707330992389 and parameters: {'model_type': 'mlp', 'hidden_dims': '[512, 256]', 'dropout': 0.1100693543367286, 'batch_norm': True, 'lr': 0.000635483885228121, 'weight_decay': 1.705445682814416e-06, 'epochs': 84, 'loss': 'mse', 'optimizer': 'adam', 'graph_mode': 'off', 'use_snp_selection': False}. Best is trial 139 with value: 0.14332901005637386.
[I 2025-12-05 16:20:49,576] Trial 142 finished with value: 0.08189309671105421 and parameters: {'model_type': 'mlp', 'hidden_dims': '[512, 256]', 'dropout': 0.12766673738343423, 'batch_norm': True, 'lr': 1.8182493008052717e-05, 'weight_decay': 1.1850480992523205e-06, 'epochs': 100, 'loss': 'mse', 'optimizer': 'adam', 'graph_mode': 'off', 'use_snp_selection': False}. Best is trial 139 with value: 0.14332901005637386.
[I 2025-12-05 16:20:50,602] Trial 143 finished with value: 0.11362448255461895 and parameters: {'model_type': 'mlp', 'hidden_dims': '[512, 256]', 'dropout': 0.11647503157117674, 'batch_norm': True, 'lr': 0.0008340411872189726, 'weight_decay': 1.542944292598258e-06, 'epochs': 92, 'loss': 'mse', 'optimizer': 'adam', 'graph_mode': 'off', 'use_snp_selection': False}. Best is trial 139 with value: 0.14332901005637386.
[I 2025-12-05 16:20:51,264] Trial 144 finished with value: 0.12364985871153714 and parameters: {'model_type': 'mlp', 'hidden_dims': '[256, 128]', 'dropout': 0.16048468692658882, 'batch_norm': True, 'lr': 0.000687088354347666, 'weight_decay': 4.991504007938428e-07, 'epochs': 49, 'loss': 'mse', 'optimizer': 'adam', 'graph_mode': 'off', 'use_snp_selection': False}. Best is trial 139 with value: 0.14332901005637386.
[I 2025-12-05 16:20:52,188] Trial 145 finished with value: 0.10370798545041654 and parameters: {'model_type': 'mlp', 'hidden_dims': '[512, 256]', 'dropout': 0.10783419292763913, 'batch_norm': True, 'lr': 8.611468612463926e-05, 'weight_decay': 9.873960062453829e-07, 'epochs': 66, 'loss': 'mse', 'optimizer': 'adam', 'graph_mode': 'off', 'use_snp_selection': False}. Best is trial 139 with value: 0.14332901005637386.
[I 2025-12-05 16:20:52,850] Trial 146 finished with value: 0.004574521206515394 and parameters: {'model_type': 'mlp', 'hidden_dims': '[128, 64]', 'dropout': 0.14558589749130849, 'batch_norm': True, 'lr': 7.201795006618523e-06, 'weight_decay': 3.073672087202852e-07, 'epochs': 114, 'loss': 'mse', 'optimizer': 'adam', 'graph_mode': 'off', 'use_snp_selection': False}. Best is trial 139 with value: 0.14332901005637386.
[I 2025-12-05 16:20:53,609] Trial 147 finished with value: 0.1010701753470641 and parameters: {'model_type': 'mlp', 'hidden_dims': '[512, 256]', 'dropout': 0.13175730451522785, 'batch_norm': True, 'lr': 0.000986222916639685, 'weight_decay': 6.961395105169409e-07, 'epochs': 73, 'loss': 'mse', 'optimizer': 'adam', 'graph_mode': 'off', 'use_snp_selection': True, 'num_snps': 5859}. Best is trial 139 with value: 0.14332901005637386.
[I 2025-12-05 16:20:54,651] Trial 148 finished with value: 0.1245965444644405 and parameters: {'model_type': 'mlp', 'hidden_dims': '[512, 64]', 'dropout': 0.12286298670901794, 'batch_norm': True, 'lr': 0.0004984616409874621, 'weight_decay': 4.0645076034049803e-07, 'epochs': 99, 'loss': 'mse', 'optimizer': 'adam', 'graph_mode': 'off', 'use_snp_selection': False}. Best is trial 139 with value: 0.14332901005637386.
[I 2025-12-05 16:20:55,275] Trial 149 finished with value: 0.11740242940423028 and parameters: {'model_type': 'mlp', 'hidden_dims': '[128, 64]', 'dropout': 0.15367328423518392, 'batch_norm': True, 'lr': 4.764255689834256e-05, 'weight_decay': 8.808061697458953e-07, 'epochs': 86, 'loss': 'mse', 'optimizer': 'adam', 'graph_mode': 'off', 'use_snp_selection': False}. Best is trial 139 with value: 0.14332901005637386.
[I 2025-12-05 16:20:57,452] Trial 0 finished with value: 0.03131495790158017 and parameters: {'model_type': 'mlp', 'hidden_dims': '[128, 64]', 'dropout': 0.199031432379812, 'batch_norm': True, 'lr': 1.8408544111075837e-06, 'weight_decay': 5.5136510071208614e-05, 'epochs': 336, 'loss': 'mae', 'optimizer': 'adam', 'graph_mode': 'off', 'use_snp_selection': True, 'num_snps': 43862}. Best is trial 0 with value: 0.03131495790158017.
[I 2025-12-05 16:20:58,503] Trial 1 finished with value: 0.09342064827711744 and parameters: {'model_type': 'mlp', 'hidden_dims': '[256, 128]', 'dropout': 0.4370668075331726, 'batch_norm': True, 'lr': 7.133471581159139e-05, 'weight_decay': 1.128633586803549e-05, 'epochs': 242, 'loss': 'mae', 'optimizer': 'adam', 'graph_mode': 'off', 'use_snp_selection': False}. Best is trial 1 with value: 0.09342064827711744.
[I 2025-12-05 16:20:59,484] Trial 2 finished with value: 0.02363870943872046 and parameters: {'model_type': 'mlp', 'hidden_dims': '[256, 128, 64]', 'dropout': 0.41314357415569625, 'batch_norm': False, 'lr': 3.952233718592101e-06, 'weight_decay': 0.00026754769258252603, 'epochs': 149, 'loss': 'mse', 'optimizer': 'adam', 'graph_mode': 'off', 'use_snp_selection': True, 'num_snps': 11571}. Best is trial 1 with value: 0.09342064827711744.
[I 2025-12-05 16:21:01,338] Trial 3 finished with value: 0.007069021219685893 and parameters: {'model_type': 'mlp', 'hidden_dims': '[512, 64]', 'dropout': 0.5938127374509361, 'batch_norm': False, 'lr': 5.67704586114731e-06, 'weight_decay': 2.4518087630137052e-05, 'epochs': 320, 'loss': 'mae', 'optimizer': 'adam', 'graph_mode': 'off', 'use_snp_selection': False}. Best is trial 1 with value: 0.09342064827711744.
[I 2025-12-05 16:21:03,487] Trial 4 finished with value: 0.048351102981930745 and parameters: {'model_type': 'mlp', 'hidden_dims': '[512, 128]', 'dropout': 0.25746343592134413, 'batch_norm': True, 'lr': 1.3467657668402788e-06, 'weight_decay': 0.00033087251918647806, 'epochs': 277, 'loss': 'mse', 'optimizer': 'adam', 'graph_mode': 'off', 'use_snp_selection': True, 'num_snps': 36675}. Best is trial 1 with value: 0.09342064827711744.
[I 2025-12-05 16:21:05,211] Trial 5 finished with value: -0.009661755764535429 and parameters: {'model_type': 'mlp', 'hidden_dims': '[512, 64]', 'dropout': 0.38275350994408375, 'batch_norm': True, 'lr': 1.5586664309232824e-06, 'weight_decay': 0.0008227664668621182, 'epochs': 145, 'loss': 'mae', 'optimizer': 'adam', 'graph_mode': 'off', 'use_snp_selection': True, 'num_snps': 32148}. Best is trial 1 with value: 0.09342064827711744.
[I 2025-12-05 16:21:06,158] Trial 6 finished with value: 0.05853742310515973 and parameters: {'model_type': 'mlp', 'hidden_dims': '[256, 128]', 'dropout': 0.3930109900265879, 'batch_norm': False, 'lr': 4.892964372128395e-05, 'weight_decay': 1.5809549317992182e-06, 'epochs': 199, 'loss': 'mse', 'optimizer': 'adam', 'graph_mode': 'off', 'use_snp_selection': False}. Best is trial 1 with value: 0.09342064827711744.
[I 2025-12-05 16:21:07,186] Trial 7 finished with value: 0.0723624796265275 and parameters: {'model_type': 'mlp', 'hidden_dims': '[512, 256]', 'dropout': 0.15343979219678458, 'batch_norm': True, 'lr': 6.234003099047341e-05, 'weight_decay': 3.894760610535477e-07, 'epochs': 97, 'loss': 'mse', 'optimizer': 'adam', 'graph_mode': 'off', 'use_snp_selection': False}. Best is trial 1 with value: 0.09342064827711744.
[I 2025-12-05 16:21:09,032] Trial 8 finished with value: 0.11272539229308953 and parameters: {'model_type': 'mlp', 'hidden_dims': '[512, 128]', 'dropout': 0.10743001231661406, 'batch_norm': True, 'lr': 0.00023728538449271062, 'weight_decay': 1.7629071578048637e-05, 'epochs': 312, 'loss': 'mae', 'optimizer': 'adam', 'graph_mode': 'off', 'use_snp_selection': False}. Best is trial 8 with value: 0.11272539229308953.
[I 2025-12-05 16:21:10,371] Trial 9 finished with value: 0.0799793443498163 and parameters: {'model_type': 'mlp', 'hidden_dims': '[512, 64]', 'dropout': 0.14505336736221927, 'batch_norm': True, 'lr': 5.8619638388111826e-05, 'weight_decay': 6.200156172669308e-07, 'epochs': 175, 'loss': 'mse', 'optimizer': 'adam', 'graph_mode': 'off', 'use_snp_selection': False}. Best is trial 8 with value: 0.11272539229308953.
[I 2025-12-05 16:21:11,248] Trial 10 finished with value: 0.03415605873756675 and parameters: {'model_type': 'mlp', 'hidden_dims': '[512, 128]', 'dropout': 0.2800030442581858, 'batch_norm': False, 'lr': 0.0004919806695968258, 'weight_decay': 2.9953888095455486e-06, 'epochs': 55, 'loss': 'mae', 'optimizer': 'adam', 'graph_mode': 'off', 'use_snp_selection': False}. Best is trial 8 with value: 0.11272539229308953.
[I 2025-12-05 16:21:12,304] Trial 11 finished with value: 0.0998829407207358 and parameters: {'model_type': 'mlp', 'hidden_dims': '[256, 128]', 'dropout': 0.5025533409127559, 'batch_norm': True, 'lr': 0.0004219456914890788, 'weight_decay': 7.0869802591332905e-06, 'epochs': 239, 'loss': 'mae', 'optimizer': 'adam', 'graph_mode': 'off', 'use_snp_selection': False}. Best is trial 8 with value: 0.11272539229308953.
[I 2025-12-05 16:21:13,994] Trial 12 finished with value: 0.10152011356811143 and parameters: {'model_type': 'mlp', 'hidden_dims': '[512, 128]', 'dropout': 0.5266996967984326, 'batch_norm': True, 'lr': 0.0006753264773209732, 'weight_decay': 4.19780668911197e-06, 'epochs': 268, 'loss': 'mae', 'optimizer': 'adam', 'graph_mode': 'off', 'use_snp_selection': False}. Best is trial 8 with value: 0.11272539229308953.
