[I 2025-12-05 15:52:50,726] Trial 0 finished with value: 0.01672937418144259 and parameters: {'model_type': 'mlp', 'hidden_dims': '[128, 64]', 'dropout': 0.199031432379812, 'batch_norm': True, 'lr': 1.8408544111075837e-06, 'weight_decay': 5.5136510071208614e-05, 'epochs': 336, 'loss': 'mae', 'optimizer': 'adam', 'graph_mode': 'off', 'use_snp_selection': True, 'num_snps': 43862}. Best is trial 0 with value: 0.01672937418144259.
[I 2025-12-05 15:52:51,699] Trial 1 finished with value: 0.08164660702089847 and parameters: {'model_type': 'mlp', 'hidden_dims': '[256, 128]', 'dropout': 0.4370668075331726, 'batch_norm': True, 'lr': 7.133471581159139e-05, 'weight_decay': 1.128633586803549e-05, 'epochs': 242, 'loss': 'mae', 'optimizer': 'adam', 'graph_mode': 'off', 'use_snp_selection': False}. Best is trial 1 with value: 0.08164660702089847.
[I 2025-12-05 15:52:52,595] Trial 2 finished with value: 0.010343496150836344 and parameters: {'model_type': 'mlp', 'hidden_dims': '[256, 128, 64]', 'dropout': 0.41314357415569625, 'batch_norm': False, 'lr': 3.952233718592101e-06, 'weight_decay': 0.00026754769258252603, 'epochs': 149, 'loss': 'mse', 'optimizer': 'adam', 'graph_mode': 'off', 'use_snp_selection': True, 'num_snps': 11571}. Best is trial 1 with value: 0.08164660702089847.
[I 2025-12-05 15:52:54,257] Trial 3 finished with value: 0.04082883476704542 and parameters: {'model_type': 'mlp', 'hidden_dims': '[512, 64]', 'dropout': 0.5938127374509361, 'batch_norm': False, 'lr': 5.67704586114731e-06, 'weight_decay': 2.4518087630137052e-05, 'epochs': 320, 'loss': 'mae', 'optimizer': 'adam', 'graph_mode': 'off', 'use_snp_selection': False}. Best is trial 1 with value: 0.08164660702089847.
[I 2025-12-05 15:52:56,339] Trial 4 finished with value: -0.014605309367430035 and parameters: {'model_type': 'mlp', 'hidden_dims': '[512, 128]', 'dropout': 0.25746343592134413, 'batch_norm': True, 'lr': 1.3467657668402788e-06, 'weight_decay': 0.00033087251918647806, 'epochs': 277, 'loss': 'mse', 'optimizer': 'adam', 'graph_mode': 'off', 'use_snp_selection': True, 'num_snps': 36675}. Best is trial 1 with value: 0.08164660702089847.
[I 2025-12-05 15:52:57,960] Trial 5 finished with value: 0.01723750002918328 and parameters: {'model_type': 'mlp', 'hidden_dims': '[512, 64]', 'dropout': 0.38275350994408375, 'batch_norm': True, 'lr': 1.5586664309232824e-06, 'weight_decay': 0.0008227664668621182, 'epochs': 145, 'loss': 'mae', 'optimizer': 'adam', 'graph_mode': 'off', 'use_snp_selection': True, 'num_snps': 32148}. Best is trial 1 with value: 0.08164660702089847.
[I 2025-12-05 15:52:58,891] Trial 6 finished with value: 0.05486897728940268 and parameters: {'model_type': 'mlp', 'hidden_dims': '[256, 128]', 'dropout': 0.3930109900265879, 'batch_norm': False, 'lr': 4.892964372128395e-05, 'weight_decay': 1.5809549317992182e-06, 'epochs': 199, 'loss': 'mse', 'optimizer': 'adam', 'graph_mode': 'off', 'use_snp_selection': False}. Best is trial 1 with value: 0.08164660702089847.
[I 2025-12-05 15:52:59,893] Trial 7 finished with value: 0.07648406100787267 and parameters: {'model_type': 'mlp', 'hidden_dims': '[512, 256]', 'dropout': 0.15343979219678458, 'batch_norm': True, 'lr': 6.234003099047341e-05, 'weight_decay': 3.894760610535477e-07, 'epochs': 97, 'loss': 'mse', 'optimizer': 'adam', 'graph_mode': 'off', 'use_snp_selection': False}. Best is trial 1 with value: 0.08164660702089847.
[I 2025-12-05 15:53:01,495] Trial 8 finished with value: 0.0897672831346869 and parameters: {'model_type': 'mlp', 'hidden_dims': '[512, 128]', 'dropout': 0.10743001231661406, 'batch_norm': True, 'lr': 0.00023728538449271062, 'weight_decay': 1.7629071578048637e-05, 'epochs': 312, 'loss': 'mae', 'optimizer': 'adam', 'graph_mode': 'off', 'use_snp_selection': False}. Best is trial 8 with value: 0.0897672831346869.
[I 2025-12-05 15:53:02,702] Trial 9 finished with value: 0.09697667166102092 and parameters: {'model_type': 'mlp', 'hidden_dims': '[512, 64]', 'dropout': 0.14505336736221927, 'batch_norm': True, 'lr': 5.8619638388111826e-05, 'weight_decay': 6.200156172669308e-07, 'epochs': 175, 'loss': 'mse', 'optimizer': 'adam', 'graph_mode': 'off', 'use_snp_selection': False}. Best is trial 9 with value: 0.09697667166102092.
[I 2025-12-05 15:53:03,542] Trial 10 finished with value: -0.007677524594679559 and parameters: {'model_type': 'mlp', 'hidden_dims': '[512, 64]', 'dropout': 0.27531666245262887, 'batch_norm': False, 'lr': 0.00032393778075602147, 'weight_decay': 1.1714031539166647e-07, 'epochs': 44, 'loss': 'mse', 'optimizer': 'adam', 'graph_mode': 'off', 'use_snp_selection': False}. Best is trial 9 with value: 0.09697667166102092.
[I 2025-12-05 15:53:04,878] Trial 11 finished with value: 0.09903251440880385 and parameters: {'model_type': 'mlp', 'hidden_dims': '[512, 128]', 'dropout': 0.10095648685224448, 'batch_norm': True, 'lr': 0.0007381466848241802, 'weight_decay': 1.969664044175748e-06, 'epochs': 216, 'loss': 'mae', 'optimizer': 'adam', 'graph_mode': 'off', 'use_snp_selection': False}. Best is trial 11 with value: 0.09903251440880385.
[I 2025-12-05 15:53:06,213] Trial 12 finished with value: 0.08995692755535946 and parameters: {'model_type': 'mlp', 'hidden_dims': '[512, 128]', 'dropout': 0.10344600881777158, 'batch_norm': True, 'lr': 0.0006753264773209732, 'weight_decay': 2.0975627484345868e-06, 'epochs': 208, 'loss': 'mae', 'optimizer': 'adam', 'graph_mode': 'off', 'use_snp_selection': False}. Best is trial 11 with value: 0.09903251440880385.
[I 2025-12-05 15:53:07,024] Trial 13 finished with value: 0.02151124342330857 and parameters: {'model_type': 'mlp', 'hidden_dims': '[128, 64]', 'dropout': 0.22096278001553593, 'batch_norm': True, 'lr': 1.3373175420781734e-05, 'weight_decay': 2.1978369390547452e-06, 'epochs': 147, 'loss': 'mse', 'optimizer': 'adam', 'graph_mode': 'off', 'use_snp_selection': False}. Best is trial 11 with value: 0.09903251440880385.
[I 2025-12-05 15:53:08,110] Trial 14 finished with value: 0.0959737140040029 and parameters: {'model_type': 'mlp', 'hidden_dims': '[256, 128, 64]', 'dropout': 0.31612449728949465, 'batch_norm': True, 'lr': 0.0008980959006851178, 'weight_decay': 5.631894527472498e-07, 'epochs': 254, 'loss': 'mse', 'optimizer': 'adam', 'graph_mode': 'off', 'use_snp_selection': False}. Best is trial 11 with value: 0.09903251440880385.
[I 2025-12-05 15:53:09,372] Trial 15 finished with value: 0.08132096788802395 and parameters: {'model_type': 'mlp', 'hidden_dims': '[512, 256]', 'dropout': 0.1723492905468449, 'batch_norm': True, 'lr': 0.0001572871022003765, 'weight_decay': 1.3159354875897403e-07, 'epochs': 175, 'loss': 'mae', 'optimizer': 'adam', 'graph_mode': 'off', 'use_snp_selection': False}. Best is trial 11 with value: 0.09903251440880385.
[I 2025-12-05 15:53:10,414] Trial 16 finished with value: 0.027481441311123875 and parameters: {'model_type': 'mlp', 'hidden_dims': '[512, 128]', 'dropout': 0.558513902174278, 'batch_norm': True, 'lr': 2.1517090787442848e-05, 'weight_decay': 5.098763140321504e-06, 'epochs': 98, 'loss': 'mae', 'optimizer': 'adam', 'graph_mode': 'off', 'use_snp_selection': False}. Best is trial 11 with value: 0.09903251440880385.
[I 2025-12-05 15:53:11,818] Trial 17 finished with value: 0.08311058420033299 and parameters: {'model_type': 'mlp', 'hidden_dims': '[512, 64]', 'dropout': 0.1477523186384118, 'batch_norm': True, 'lr': 0.00011238703062431768, 'weight_decay': 4.4639962184346194e-07, 'epochs': 229, 'loss': 'mse', 'optimizer': 'adam', 'graph_mode': 'off', 'use_snp_selection': False}. Best is trial 11 with value: 0.09903251440880385.
[I 2025-12-05 15:53:14,691] Trial 18 finished with value: 0.07796446969823498 and parameters: {'model_type': 'mlp', 'hidden_dims': '[512, 128]', 'dropout': 0.5053317114683149, 'batch_norm': False, 'lr': 0.0004769062200280696, 'weight_decay': 5.145278831585014e-06, 'epochs': 282, 'loss': 'mae', 'optimizer': 'adam', 'graph_mode': 'off', 'use_snp_selection': True, 'num_snps': 58241}. Best is trial 11 with value: 0.09903251440880385.
[I 2025-12-05 15:53:15,708] Trial 19 finished with value: 0.036058357177804735 and parameters: {'model_type': 'mlp', 'hidden_dims': '[512, 64]', 'dropout': 0.31692091263899563, 'batch_norm': True, 'lr': 1.352570837276448e-05, 'weight_decay': 9.613139564687042e-07, 'epochs': 100, 'loss': 'mse', 'optimizer': 'adam', 'graph_mode': 'off', 'use_snp_selection': False}. Best is trial 11 with value: 0.09903251440880385.
[I 2025-12-05 15:53:16,497] Trial 20 finished with value: 0.07398887869113524 and parameters: {'model_type': 'mlp', 'hidden_dims': '[128, 64]', 'dropout': 0.23887975920589624, 'batch_norm': True, 'lr': 0.00017882775052665845, 'weight_decay': 4.679666515308887e-05, 'epochs': 177, 'loss': 'mse', 'optimizer': 'adam', 'graph_mode': 'off', 'use_snp_selection': False}. Best is trial 11 with value: 0.09903251440880385.
[I 2025-12-05 15:53:17,536] Trial 21 finished with value: 0.10472905664331927 and parameters: {'model_type': 'mlp', 'hidden_dims': '[256, 128, 64]', 'dropout': 0.3426036956588672, 'batch_norm': True, 'lr': 0.0005892472244929169, 'weight_decay': 4.255019457663658e-07, 'epochs': 254, 'loss': 'mse', 'optimizer': 'adam', 'graph_mode': 'off', 'use_snp_selection': False}. Best is trial 21 with value: 0.10472905664331927.
[I 2025-12-05 15:53:18,558] Trial 22 finished with value: 0.10512017188639697 and parameters: {'model_type': 'mlp', 'hidden_dims': '[256, 128, 64]', 'dropout': 0.13096596943730135, 'batch_norm': True, 'lr': 0.0004961983068741814, 'weight_decay': 2.4532545220295074e-07, 'epochs': 228, 'loss': 'mse', 'optimizer': 'adam', 'graph_mode': 'off', 'use_snp_selection': False}. Best is trial 22 with value: 0.10512017188639697.
[I 2025-12-05 15:53:19,645] Trial 23 finished with value: 0.10827547382267287 and parameters: {'model_type': 'mlp', 'hidden_dims': '[256, 128, 64]', 'dropout': 0.45700288156596985, 'batch_norm': True, 'lr': 0.0004207880394684694, 'weight_decay': 2.4045598906710013e-07, 'epochs': 278, 'loss': 'mse', 'optimizer': 'adam', 'graph_mode': 'off', 'use_snp_selection': False}. Best is trial 23 with value: 0.10827547382267287.
[I 2025-12-05 15:53:20,750] Trial 24 finished with value: 0.09489246463237373 and parameters: {'model_type': 'mlp', 'hidden_dims': '[256, 128, 64]', 'dropout': 0.46987033741278, 'batch_norm': True, 'lr': 0.0003697112567279623, 'weight_decay': 2.2335650433043997e-07, 'epochs': 269, 'loss': 'mse', 'optimizer': 'adam', 'graph_mode': 'off', 'use_snp_selection': False}. Best is trial 23 with value: 0.10827547382267287.
[I 2025-12-05 15:53:21,938] Trial 25 finished with value: 0.09006201589320253 and parameters: {'model_type': 'mlp', 'hidden_dims': '[256, 128, 64]', 'dropout': 0.5335323239954018, 'batch_norm': True, 'lr': 0.000979042349104034, 'weight_decay': 2.5144632342159524e-07, 'epochs': 304, 'loss': 'mse', 'optimizer': 'adam', 'graph_mode': 'off', 'use_snp_selection': False}. Best is trial 23 with value: 0.10827547382267287.
[I 2025-12-05 15:53:22,951] Trial 26 finished with value: 0.08611056688152124 and parameters: {'model_type': 'mlp', 'hidden_dims': '[256, 128, 64]', 'dropout': 0.4529718515974194, 'batch_norm': True, 'lr': 0.0004973118113386203, 'weight_decay': 1.0014962721619608e-07, 'epochs': 253, 'loss': 'mse', 'optimizer': 'adam', 'graph_mode': 'off', 'use_snp_selection': True, 'num_snps': 3842}. Best is trial 23 with value: 0.10827547382267287.
[I 2025-12-05 15:53:24,050] Trial 27 finished with value: 0.08760743953812596 and parameters: {'model_type': 'mlp', 'hidden_dims': '[256, 128, 64]', 'dropout': 0.3363069452852519, 'batch_norm': False, 'lr': 0.00013124371629824307, 'weight_decay': 2.418585117095152e-07, 'epochs': 292, 'loss': 'mse', 'optimizer': 'adam', 'graph_mode': 'off', 'use_snp_selection': False}. Best is trial 23 with value: 0.10827547382267287.
[I 2025-12-05 15:53:25,304] Trial 28 finished with value: 0.1032241662297524 and parameters: {'model_type': 'mlp', 'hidden_dims': '[256, 128, 64]', 'dropout': 0.3671570075868377, 'batch_norm': True, 'lr': 0.00025452758534625297, 'weight_decay': 8.74418883788382e-07, 'epochs': 348, 'loss': 'mse', 'optimizer': 'adam', 'graph_mode': 'off', 'use_snp_selection': False}. Best is trial 23 with value: 0.10827547382267287.
[I 2025-12-05 15:53:26,700] Trial 29 finished with value: 0.12282764779048544 and parameters: {'model_type': 'mlp', 'hidden_dims': '[256, 128, 64]', 'dropout': 0.49167567708325965, 'batch_norm': True, 'lr': 0.0005388560200940643, 'weight_decay': 3.6588750384546717e-06, 'epochs': 229, 'loss': 'mse', 'optimizer': 'adam', 'graph_mode': 'off', 'use_snp_selection': True, 'num_snps': 19468}. Best is trial 29 with value: 0.12282764779048544.
[I 2025-12-05 15:53:28,019] Trial 30 finished with value: 0.06646996558446293 and parameters: {'model_type': 'mlp', 'hidden_dims': '[256, 128, 64]', 'dropout': 0.5000006126334586, 'batch_norm': True, 'lr': 9.455558314098071e-05, 'weight_decay': 3.995859528590237e-06, 'epochs': 229, 'loss': 'mse', 'optimizer': 'adam', 'graph_mode': 'off', 'use_snp_selection': True, 'num_snps': 18365}. Best is trial 29 with value: 0.12282764779048544.
[I 2025-12-05 15:53:29,440] Trial 31 finished with value: 0.10189195030720587 and parameters: {'model_type': 'mlp', 'hidden_dims': '[256, 128, 64]', 'dropout': 0.4934536792598294, 'batch_norm': True, 'lr': 0.00046368896172685237, 'weight_decay': 1.1129252699099745e-06, 'epochs': 265, 'loss': 'mse', 'optimizer': 'adam', 'graph_mode': 'off', 'use_snp_selection': True, 'num_snps': 20689}. Best is trial 29 with value: 0.12282764779048544.
[I 2025-12-05 15:53:30,869] Trial 32 finished with value: 0.08297274294722744 and parameters: {'model_type': 'mlp', 'hidden_dims': '[256, 128, 64]', 'dropout': 0.42435671670838243, 'batch_norm': True, 'lr': 0.0002490161642098986, 'weight_decay': 2.1698071280588855e-07, 'epochs': 237, 'loss': 'mse', 'optimizer': 'adam', 'graph_mode': 'off', 'use_snp_selection': True, 'num_snps': 20754}. Best is trial 29 with value: 0.12282764779048544.
[I 2025-12-05 15:53:33,256] Trial 33 finished with value: 0.10654232449261042 and parameters: {'model_type': 'mlp', 'hidden_dims': '[256, 128, 64]', 'dropout': 0.5448109252430697, 'batch_norm': True, 'lr': 0.0006895611813200994, 'weight_decay': 8.90688258163921e-06, 'epochs': 330, 'loss': 'mse', 'optimizer': 'adam', 'graph_mode': 'off', 'use_snp_selection': True, 'num_snps': 50127}. Best is trial 29 with value: 0.12282764779048544.
[I 2025-12-05 15:53:35,634] Trial 34 finished with value: 0.10878773526745002 and parameters: {'model_type': 'mlp', 'hidden_dims': '[256, 128]', 'dropout': 0.5832690886076772, 'batch_norm': True, 'lr': 0.0003395939106838062, 'weight_decay': 9.196531062008233e-06, 'epochs': 330, 'loss': 'mse', 'optimizer': 'adam', 'graph_mode': 'off', 'use_snp_selection': True, 'num_snps': 53746}. Best is trial 29 with value: 0.12282764779048544.
[I 2025-12-05 15:53:38,262] Trial 35 finished with value: 0.021137120033714853 and parameters: {'model_type': 'mlp', 'hidden_dims': '[256, 128]', 'dropout': 0.591606776555468, 'batch_norm': False, 'lr': 0.00035248346086821415, 'weight_decay': 9.563312809727065e-06, 'epochs': 330, 'loss': 'mse', 'optimizer': 'adam', 'graph_mode': 'off', 'use_snp_selection': True, 'num_snps': 56959}. Best is trial 29 with value: 0.12282764779048544.
[I 2025-12-05 15:53:40,746] Trial 36 finished with value: 0.047906150081923386 and parameters: {'model_type': 'mlp', 'hidden_dims': '[256, 128]', 'dropout': 0.5484117664842464, 'batch_norm': True, 'lr': 2.754609501416685e-06, 'weight_decay': 7.07116787020322e-05, 'epochs': 334, 'loss': 'mse', 'optimizer': 'adam', 'graph_mode': 'off', 'use_snp_selection': True, 'num_snps': 50241}. Best is trial 29 with value: 0.12282764779048544.
[I 2025-12-05 15:53:43,084] Trial 37 finished with value: 0.10232502137657394 and parameters: {'model_type': 'mlp', 'hidden_dims': '[256, 128]', 'dropout': 0.575822427309054, 'batch_norm': True, 'lr': 0.0002439876826989849, 'weight_decay': 1.1838512870893027e-05, 'epochs': 348, 'loss': 'mse', 'optimizer': 'adam', 'graph_mode': 'off', 'use_snp_selection': True, 'num_snps': 47185}. Best is trial 29 with value: 0.12282764779048544.
[I 2025-12-05 15:53:44,971] Trial 38 finished with value: 0.0748066991965959 and parameters: {'model_type': 'mlp', 'hidden_dims': '[256, 128]', 'dropout': 0.530193245535665, 'batch_norm': False, 'lr': 0.0009977994504809205, 'weight_decay': 3.619172260223099e-05, 'epochs': 297, 'loss': 'mse', 'optimizer': 'adam', 'graph_mode': 'off', 'use_snp_selection': True, 'num_snps': 40503}. Best is trial 29 with value: 0.12282764779048544.
[I 2025-12-05 15:53:46,657] Trial 39 finished with value: 0.09781565362524867 and parameters: {'model_type': 'mlp', 'hidden_dims': '[512, 256]', 'dropout': 0.4715767361808177, 'batch_norm': True, 'lr': 2.9933308093753322e-05, 'weight_decay': 7.246013658846021e-05, 'epochs': 319, 'loss': 'mse', 'optimizer': 'adam', 'graph_mode': 'off', 'use_snp_selection': True, 'num_snps': 28665}. Best is trial 29 with value: 0.12282764779048544.
[I 2025-12-05 15:53:48,964] Trial 40 finished with value: 0.07092089416340051 and parameters: {'model_type': 'mlp', 'hidden_dims': '[128, 64]', 'dropout': 0.5984833158713825, 'batch_norm': True, 'lr': 8.236786111318074e-05, 'weight_decay': 0.00016807320533150001, 'epochs': 284, 'loss': 'mse', 'optimizer': 'adam', 'graph_mode': 'off', 'use_snp_selection': True, 'num_snps': 53411}. Best is trial 29 with value: 0.12282764779048544.
[I 2025-12-05 15:53:50,738] Trial 41 finished with value: 0.10214179643197091 and parameters: {'model_type': 'mlp', 'hidden_dims': '[256, 128, 64]', 'dropout': 0.5244800606267005, 'batch_norm': True, 'lr': 0.0006303809818364798, 'weight_decay': 7.160303059318573e-06, 'epochs': 319, 'loss': 'mse', 'optimizer': 'adam', 'graph_mode': 'off', 'use_snp_selection': True, 'num_snps': 29718}. Best is trial 29 with value: 0.12282764779048544.
[I 2025-12-05 15:53:53,128] Trial 42 finished with value: 0.11263408156013484 and parameters: {'model_type': 'mlp', 'hidden_dims': '[256, 128, 64]', 'dropout': 0.5589207829462358, 'batch_norm': True, 'lr': 0.000373601791202182, 'weight_decay': 1.9827091753787733e-05, 'epochs': 306, 'loss': 'mse', 'optimizer': 'adam', 'graph_mode': 'off', 'use_snp_selection': True, 'num_snps': 51745}. Best is trial 29 with value: 0.12282764779048544.
[I 2025-12-05 15:53:55,795] Trial 43 finished with value: 0.10381386771359108 and parameters: {'model_type': 'mlp', 'hidden_dims': '[256, 128, 64]', 'dropout': 0.5672309882736876, 'batch_norm': True, 'lr': 0.00017784044687806344, 'weight_decay': 1.8624801310507175e-05, 'epochs': 305, 'loss': 'mse', 'optimizer': 'adam', 'graph_mode': 'off', 'use_snp_selection': True, 'num_snps': 52423}. Best is trial 29 with value: 0.12282764779048544.
[I 2025-12-05 15:53:58,120] Trial 44 finished with value: 0.1026873935158687 and parameters: {'model_type': 'mlp', 'hidden_dims': '[256, 128]', 'dropout': 0.4733399242250919, 'batch_norm': True, 'lr': 0.00037299158896004396, 'weight_decay': 3.199614358346875e-06, 'epochs': 330, 'loss': 'mse', 'optimizer': 'adam', 'graph_mode': 'off', 'use_snp_selection': True, 'num_snps': 46860}. Best is trial 29 with value: 0.12282764779048544.
[I 2025-12-05 15:54:00,810] Trial 45 finished with value: 0.10295729910634062 and parameters: {'model_type': 'mlp', 'hidden_dims': '[256, 128, 64]', 'dropout': 0.44543735318534505, 'batch_norm': True, 'lr': 0.0007127522155777608, 'weight_decay': 2.706828031080525e-05, 'epochs': 270, 'loss': 'mse', 'optimizer': 'adam', 'graph_mode': 'off', 'use_snp_selection': True, 'num_snps': 58699}. Best is trial 29 with value: 0.12282764779048544.
[I 2025-12-05 15:54:02,802] Trial 46 finished with value: 0.11516046687260022 and parameters: {'model_type': 'mlp', 'hidden_dims': '[256, 128, 64]', 'dropout': 0.3994712136727298, 'batch_norm': True, 'lr': 0.00029734889410734194, 'weight_decay': 1.4987978073785988e-05, 'epochs': 291, 'loss': 'mse', 'optimizer': 'adam', 'graph_mode': 'off', 'use_snp_selection': True, 'num_snps': 38498}. Best is trial 29 with value: 0.12282764779048544.
[I 2025-12-05 15:54:04,887] Trial 47 finished with value: 0.05094510229157965 and parameters: {'model_type': 'mlp', 'hidden_dims': '[512, 256]', 'dropout': 0.4002351290973339, 'batch_norm': False, 'lr': 0.00017353647728612462, 'weight_decay': 1.4460046630090782e-05, 'epochs': 291, 'loss': 'mse', 'optimizer': 'adam', 'graph_mode': 'off', 'use_snp_selection': True, 'num_snps': 39853}. Best is trial 29 with value: 0.12282764779048544.
[I 2025-12-05 15:54:06,740] Trial 48 finished with value: 0.06523784641644953 and parameters: {'model_type': 'mlp', 'hidden_dims': '[256, 128]', 'dropout': 0.4164404415910767, 'batch_norm': True, 'lr': 4.4775093178114215e-05, 'weight_decay': 0.00020009652314335733, 'epochs': 311, 'loss': 'mae', 'optimizer': 'adam', 'graph_mode': 'off', 'use_snp_selection': True, 'num_snps': 34205}. Best is trial 29 with value: 0.12282764779048544.
[I 2025-12-05 15:54:08,210] Trial 49 finished with value: 0.09696370930969771 and parameters: {'model_type': 'mlp', 'hidden_dims': '[256, 128, 64]', 'dropout': 0.50857967316427, 'batch_norm': True, 'lr': 0.0002956301983637503, 'weight_decay': 2.665317623448119e-05, 'epochs': 249, 'loss': 'mse', 'optimizer': 'adam', 'graph_mode': 'off', 'use_snp_selection': True, 'num_snps': 23051}. Best is trial 29 with value: 0.12282764779048544.
[I 2025-12-05 15:54:09,329] Trial 50 finished with value: 0.10039904364413482 and parameters: {'model_type': 'mlp', 'hidden_dims': '[256, 128, 64]', 'dropout': 0.3757121831273986, 'batch_norm': True, 'lr': 0.0002121673963513499, 'weight_decay': 1.9657490590994486e-05, 'epochs': 199, 'loss': 'mse', 'optimizer': 'adam', 'graph_mode': 'off', 'use_snp_selection': True, 'num_snps': 13533}. Best is trial 29 with value: 0.12282764779048544.
