[I 2025-12-06 02:40:14,374] Trial 75 finished with value: 0.19332464438847938 and parameters: {'model_type': 'mlp', 'hidden_dims': '[256, 128]', 'dropout': 0.18448056481678868, 'batch_norm': False, 'lr': 5.404321978148221e-06, 'weight_decay': 7.819130615363282e-05, 'epochs': 95, 'loss': 'mae', 'optimizer': 'adam', 'graph_mode': 'off', 'use_snp_selection': True, 'num_snps': 29350}. Best is trial 74 with value: 0.20470863597462086.
[I 2025-12-06 02:40:49,194] Trial 76 finished with value: 0.18653736770752385 and parameters: {'model_type': 'mlp', 'hidden_dims': '[256, 128]', 'dropout': 0.17753653225490798, 'batch_norm': False, 'lr': 5.02873617979357e-06, 'weight_decay': 6.633301754582916e-05, 'epochs': 101, 'loss': 'mae', 'optimizer': 'adam', 'graph_mode': 'off', 'use_snp_selection': True, 'num_snps': 30084}. Best is trial 74 with value: 0.20470863597462086.
[I 2025-12-06 02:41:04,346] Trial 77 finished with value: 0.16491248534199276 and parameters: {'model_type': 'mlp', 'hidden_dims': '[256, 128]', 'dropout': 0.1484116700074705, 'batch_norm': False, 'lr': 3.69697082806377e-06, 'weight_decay': 7.793753017071994e-05, 'epochs': 91, 'loss': 'mae', 'optimizer': 'adam', 'graph_mode': 'off', 'use_snp_selection': False}. Best is trial 74 with value: 0.20470863597462086.
[I 2025-12-06 02:41:37,080] Trial 78 finished with value: 0.19836437794960696 and parameters: {'model_type': 'mlp', 'hidden_dims': '[256, 128]', 'dropout': 0.1878313024002722, 'batch_norm': False, 'lr': 1.2492735630613914e-05, 'weight_decay': 7.325113174585708e-06, 'epochs': 80, 'loss': 'mae', 'optimizer': 'adam', 'graph_mode': 'off', 'use_snp_selection': True, 'num_snps': 27433}. Best is trial 74 with value: 0.20470863597462086.
[I 2025-12-06 02:42:09,373] Trial 79 finished with value: 0.1983191678236724 and parameters: {'model_type': 'mlp', 'hidden_dims': '[256, 128]', 'dropout': 0.1899206293965685, 'batch_norm': False, 'lr': 1.1948076691407615e-05, 'weight_decay': 7.1586060270872625e-06, 'epochs': 78, 'loss': 'mae', 'optimizer': 'adam', 'graph_mode': 'off', 'use_snp_selection': True, 'num_snps': 26994}. Best is trial 74 with value: 0.20470863597462086.
[I 2025-12-06 02:42:41,350] Trial 80 finished with value: 0.19489960395698583 and parameters: {'model_type': 'mlp', 'hidden_dims': '[256, 128]', 'dropout': 0.1630537352720913, 'batch_norm': False, 'lr': 1.2306697082018194e-05, 'weight_decay': 7.731443085534596e-06, 'epochs': 75, 'loss': 'mae', 'optimizer': 'adam', 'graph_mode': 'off', 'use_snp_selection': True, 'num_snps': 26220}. Best is trial 74 with value: 0.20470863597462086.
[I 2025-12-06 02:43:13,688] Trial 81 finished with value: 0.1834130816547816 and parameters: {'model_type': 'mlp', 'hidden_dims': '[256, 128]', 'dropout': 0.12682211066268184, 'batch_norm': False, 'lr': 1.2187877845349572e-05, 'weight_decay': 2.858985569114915e-06, 'epochs': 79, 'loss': 'mae', 'optimizer': 'adam', 'graph_mode': 'off', 'use_snp_selection': True, 'num_snps': 26601}. Best is trial 74 with value: 0.20470863597462086.
[I 2025-12-06 02:43:42,816] Trial 82 finished with value: 0.20127186592508034 and parameters: {'model_type': 'mlp', 'hidden_dims': '[256, 128]', 'dropout': 0.16371580437633723, 'batch_norm': False, 'lr': 1.8426200498759074e-05, 'weight_decay': 7.083771672425301e-06, 'epochs': 53, 'loss': 'mae', 'optimizer': 'adam', 'graph_mode': 'off', 'use_snp_selection': True, 'num_snps': 20902}. Best is trial 74 with value: 0.20470863597462086.
[I 2025-12-06 02:44:16,623] Trial 83 finished with value: 0.19606444516501415 and parameters: {'model_type': 'mlp', 'hidden_dims': '[256, 128]', 'dropout': 0.16469627728843225, 'batch_norm': False, 'lr': 1.5167444465505388e-05, 'weight_decay': 7.465827262724245e-06, 'epochs': 69, 'loss': 'mae', 'optimizer': 'adam', 'graph_mode': 'off', 'use_snp_selection': True, 'num_snps': 31604}. Best is trial 74 with value: 0.20470863597462086.
[I 2025-12-06 02:44:45,300] Trial 84 finished with value: 0.17316611018623632 and parameters: {'model_type': 'mlp', 'hidden_dims': '[256, 128]', 'dropout': 0.163537903043447, 'batch_norm': False, 'lr': 1.4234002575101066e-05, 'weight_decay': 6.946178735129909e-06, 'epochs': 50, 'loss': 'mae', 'optimizer': 'adam', 'graph_mode': 'off', 'use_snp_selection': True, 'num_snps': 20115}. Best is trial 74 with value: 0.20470863597462086.
[I 2025-12-06 02:45:17,016] Trial 85 finished with value: 0.19628606812494015 and parameters: {'model_type': 'mlp', 'hidden_dims': '[256, 128]', 'dropout': 0.13178570549427784, 'batch_norm': False, 'lr': 1.0101890235847618e-05, 'weight_decay': 1.2162303177858362e-05, 'epochs': 59, 'loss': 'mae', 'optimizer': 'adam', 'graph_mode': 'off', 'use_snp_selection': True, 'num_snps': 27364}. Best is trial 74 with value: 0.20470863597462086.
[I 2025-12-06 02:45:47,463] Trial 86 finished with value: 0.19883469316247876 and parameters: {'model_type': 'mlp', 'hidden_dims': '[256, 128]', 'dropout': 0.1273121936177285, 'batch_norm': False, 'lr': 1.1072218854653896e-05, 'weight_decay': 1.1930914015203223e-05, 'epochs': 40, 'loss': 'mae', 'optimizer': 'adam', 'graph_mode': 'off', 'use_snp_selection': True, 'num_snps': 26454}. Best is trial 74 with value: 0.20470863597462086.
[I 2025-12-06 02:46:20,767] Trial 87 finished with value: 0.18910993234015058 and parameters: {'model_type': 'mlp', 'hidden_dims': '[256, 128]', 'dropout': 0.1138931934363013, 'batch_norm': False, 'lr': 1.1455962262909194e-05, 'weight_decay': 4.709361610175268e-06, 'epochs': 58, 'loss': 'mae', 'optimizer': 'adam', 'graph_mode': 'off', 'use_snp_selection': True, 'num_snps': 31586}. Best is trial 74 with value: 0.20470863597462086.
[I 2025-12-06 02:46:52,166] Trial 88 finished with value: 0.17890563987288333 and parameters: {'model_type': 'mlp', 'hidden_dims': '[256, 128]', 'dropout': 0.126192014755824, 'batch_norm': True, 'lr': 1.8769502150704582e-05, 'weight_decay': 1.0422528573637363e-05, 'epochs': 67, 'loss': 'mae', 'optimizer': 'adam', 'graph_mode': 'off', 'use_snp_selection': True, 'num_snps': 25487}. Best is trial 74 with value: 0.20470863597462086.
[I 2025-12-06 02:47:22,675] Trial 89 finished with value: 0.1693895598292773 and parameters: {'model_type': 'mlp', 'hidden_dims': '[256, 128]', 'dropout': 0.15781662080178394, 'batch_norm': False, 'lr': 9.716024010859695e-06, 'weight_decay': 7.973481297548643e-06, 'epochs': 40, 'loss': 'mae', 'optimizer': 'adam', 'graph_mode': 'off', 'use_snp_selection': True, 'num_snps': 26822}. Best is trial 74 with value: 0.20470863597462086.
[I 2025-12-06 02:47:33,328] Trial 90 finished with value: 0.17848186040244196 and parameters: {'model_type': 'mlp', 'hidden_dims': '[256, 128]', 'dropout': 0.1386698894315218, 'batch_norm': False, 'lr': 8.169825272523253e-06, 'weight_decay': 1.6022798732606873e-05, 'epochs': 49, 'loss': 'mae', 'optimizer': 'adam', 'graph_mode': 'off', 'use_snp_selection': False}. Best is trial 74 with value: 0.20470863597462086.
[I 2025-12-06 02:48:02,040] Trial 91 finished with value: 0.1934839513694062 and parameters: {'model_type': 'mlp', 'hidden_dims': '[256, 128]', 'dropout': 0.10032606805399452, 'batch_norm': False, 'lr': 2.602419644518998e-05, 'weight_decay': 1.23784524984627e-05, 'epochs': 56, 'loss': 'mae', 'optimizer': 'adam', 'graph_mode': 'off', 'use_snp_selection': True, 'num_snps': 19395}. Best is trial 74 with value: 0.20470863597462086.
[I 2025-12-06 02:48:32,980] Trial 92 finished with value: 0.18852139749878943 and parameters: {'model_type': 'mlp', 'hidden_dims': '[256, 128]', 'dropout': 0.21350873481737967, 'batch_norm': False, 'lr': 1.4433757523138354e-05, 'weight_decay': 5.860014164644435e-06, 'epochs': 83, 'loss': 'mae', 'optimizer': 'adam', 'graph_mode': 'off', 'use_snp_selection': True, 'num_snps': 22522}. Best is trial 74 with value: 0.20470863597462086.
[I 2025-12-06 02:49:07,330] Trial 93 finished with value: 0.18487493885364592 and parameters: {'model_type': 'mlp', 'hidden_dims': '[256, 128]', 'dropout': 0.14345709904194603, 'batch_norm': False, 'lr': 1.8793592297521096e-05, 'weight_decay': 2.948766552703683e-06, 'epochs': 72, 'loss': 'mae', 'optimizer': 'adam', 'graph_mode': 'off', 'use_snp_selection': True, 'num_snps': 33254}. Best is trial 74 with value: 0.20470863597462086.
[I 2025-12-06 02:49:37,648] Trial 94 finished with value: 0.19623605969079283 and parameters: {'model_type': 'mlp', 'hidden_dims': '[256, 128]', 'dropout': 0.155372432706339, 'batch_norm': False, 'lr': 1.2465004680981927e-05, 'weight_decay': 1.101706249463197e-05, 'epochs': 45, 'loss': 'mae', 'optimizer': 'adam', 'graph_mode': 'off', 'use_snp_selection': True, 'num_snps': 26585}. Best is trial 74 with value: 0.20470863597462086.
[I 2025-12-06 02:50:09,147] Trial 95 finished with value: 0.1738912240872433 and parameters: {'model_type': 'mlp', 'hidden_dims': '[256, 128]', 'dropout': 0.11485914316082674, 'batch_norm': False, 'lr': 1.2264242885934899e-05, 'weight_decay': 1.0434568632457038e-05, 'epochs': 63, 'loss': 'mae', 'optimizer': 'adam', 'graph_mode': 'off', 'use_snp_selection': True, 'num_snps': 26815}. Best is trial 74 with value: 0.20470863597462086.
[I 2025-12-06 02:50:41,146] Trial 96 finished with value: 0.15322165735152818 and parameters: {'model_type': 'mlp', 'hidden_dims': '[256, 128]', 'dropout': 0.16780383430641263, 'batch_norm': False, 'lr': 7.4515172802897705e-06, 'weight_decay': 3.809223489753343e-06, 'epochs': 45, 'loss': 'mae', 'optimizer': 'adam', 'graph_mode': 'off', 'use_snp_selection': True, 'num_snps': 30759}. Best is trial 74 with value: 0.20470863597462086.
[I 2025-12-06 02:51:11,410] Trial 97 finished with value: 0.19238347309727405 and parameters: {'model_type': 'mlp', 'hidden_dims': '[256, 128]', 'dropout': 0.13760252905754947, 'batch_norm': False, 'lr': 9.920082950884044e-06, 'weight_decay': 7.30322560006396e-06, 'epochs': 56, 'loss': 'mae', 'optimizer': 'adam', 'graph_mode': 'off', 'use_snp_selection': True, 'num_snps': 23997}. Best is trial 74 with value: 0.20470863597462086.
[I 2025-12-06 02:51:42,411] Trial 98 finished with value: 0.19750024957397508 and parameters: {'model_type': 'mlp', 'hidden_dims': '[256, 128]', 'dropout': 0.19728013294819663, 'batch_norm': False, 'lr': 0.0002940944539185437, 'weight_decay': 5.062330882958343e-06, 'epochs': 43, 'loss': 'mae', 'optimizer': 'adam', 'graph_mode': 'off', 'use_snp_selection': True, 'num_snps': 27512}. Best is trial 74 with value: 0.20470863597462086.
[I 2025-12-06 02:52:13,215] Trial 99 finished with value: 0.1864883203653018 and parameters: {'model_type': 'mlp', 'hidden_dims': '[256, 128]', 'dropout': 0.19306424889797125, 'batch_norm': False, 'lr': 0.00014506689731630056, 'weight_decay': 9.333993855928794e-06, 'epochs': 41, 'loss': 'mae', 'optimizer': 'adam', 'graph_mode': 'off', 'use_snp_selection': True, 'num_snps': 27749}. Best is trial 74 with value: 0.20470863597462086.
[I 2025-12-06 02:52:48,250] Trial 100 finished with value: 0.1768784750930803 and parameters: {'model_type': 'mlp', 'hidden_dims': '[256, 128]', 'dropout': 0.15481466368769126, 'batch_norm': False, 'lr': 0.0005602269138988253, 'weight_decay': 5.336338808200711e-06, 'epochs': 69, 'loss': 'mae', 'optimizer': 'adam', 'graph_mode': 'off', 'use_snp_selection': True, 'num_snps': 35600}. Best is trial 74 with value: 0.20470863597462086.
[I 2025-12-06 02:53:21,531] Trial 101 finished with value: 0.1990837692368499 and parameters: {'model_type': 'mlp', 'hidden_dims': '[256, 128]', 'dropout': 0.17827786011951946, 'batch_norm': False, 'lr': 1.5312889533467558e-05, 'weight_decay': 1.604644127853555e-05, 'epochs': 62, 'loss': 'mae', 'optimizer': 'adam', 'graph_mode': 'off', 'use_snp_selection': True, 'num_snps': 31267}. Best is trial 74 with value: 0.20470863597462086.
[I 2025-12-06 02:53:54,192] Trial 102 finished with value: 0.18925443196280511 and parameters: {'model_type': 'mlp', 'hidden_dims': '[256, 128]', 'dropout': 0.1761945427568133, 'batch_norm': False, 'lr': 3.6948965166703096e-05, 'weight_decay': 1.742206490803711e-05, 'epochs': 48, 'loss': 'mae', 'optimizer': 'adam', 'graph_mode': 'off', 'use_snp_selection': True, 'num_snps': 32312}. Best is trial 74 with value: 0.20470863597462086.
[I 2025-12-06 02:54:25,262] Trial 103 finished with value: 0.18768983593213828 and parameters: {'model_type': 'mlp', 'hidden_dims': '[256, 128]', 'dropout': 0.20220438570887955, 'batch_norm': False, 'lr': 0.00019487885086701275, 'weight_decay': 1.146540145227466e-05, 'epochs': 62, 'loss': 'mae', 'optimizer': 'adam', 'graph_mode': 'off', 'use_snp_selection': True, 'num_snps': 25368}. Best is trial 74 with value: 0.20470863597462086.
[I 2025-12-06 02:54:55,269] Trial 104 finished with value: 0.17827458587155148 and parameters: {'model_type': 'mlp', 'hidden_dims': '[256, 128]', 'dropout': 0.163057807612679, 'batch_norm': False, 'lr': 0.0003775670749375907, 'weight_decay': 4.467380982313512e-06, 'epochs': 54, 'loss': 'mae', 'optimizer': 'adam', 'graph_mode': 'off', 'use_snp_selection': True, 'num_snps': 23369}. Best is trial 74 with value: 0.20470863597462086.
[I 2025-12-06 02:55:27,685] Trial 105 finished with value: 0.18096303277879003 and parameters: {'model_type': 'mlp', 'hidden_dims': '[256, 128]', 'dropout': 0.1842033187920952, 'batch_norm': False, 'lr': 2.055918746975296e-05, 'weight_decay': 6.251187866232593e-06, 'epochs': 71, 'loss': 'mae', 'optimizer': 'adam', 'graph_mode': 'off', 'use_snp_selection': True, 'num_snps': 27778}. Best is trial 74 with value: 0.20470863597462086.
[I 2025-12-06 02:56:02,061] Trial 106 finished with value: 0.19463661109014135 and parameters: {'model_type': 'mlp', 'hidden_dims': '[256, 128]', 'dropout': 0.11652064915405749, 'batch_norm': False, 'lr': 1.19730861682614e-05, 'weight_decay': 1.5399120522048077e-05, 'epochs': 79, 'loss': 'mae', 'optimizer': 'adam', 'graph_mode': 'off', 'use_snp_selection': True, 'num_snps': 31470}. Best is trial 74 with value: 0.20470863597462086.
[I 2025-12-06 02:56:32,405] Trial 107 finished with value: 0.18345475767764546 and parameters: {'model_type': 'mlp', 'hidden_dims': '[256, 128]', 'dropout': 0.1501742209173052, 'batch_norm': False, 'lr': 1.7053608356041237e-05, 'weight_decay': 2.078497569512859e-05, 'epochs': 40, 'loss': 'mae', 'optimizer': 'adam', 'graph_mode': 'off', 'use_snp_selection': True, 'num_snps': 25862}. Best is trial 74 with value: 0.20470863597462086.
[I 2025-12-06 02:57:00,916] Trial 108 finished with value: 0.18352941347780802 and parameters: {'model_type': 'mlp', 'hidden_dims': '[256, 128, 64]', 'dropout': 0.13203337601761606, 'batch_norm': False, 'lr': 2.4284345325888968e-05, 'weight_decay': 8.713105147679117e-06, 'epochs': 61, 'loss': 'mae', 'optimizer': 'adam', 'graph_mode': 'off', 'use_snp_selection': True, 'num_snps': 18023}. Best is trial 74 with value: 0.20470863597462086.
[I 2025-12-06 02:57:35,525] Trial 109 finished with value: 0.200194855418289 and parameters: {'model_type': 'mlp', 'hidden_dims': '[512, 64]', 'dropout': 0.21676026454002864, 'batch_norm': False, 'lr': 9.054299131777914e-06, 'weight_decay': 2.34648965802348e-06, 'epochs': 46, 'loss': 'mae', 'optimizer': 'adam', 'graph_mode': 'off', 'use_snp_selection': True, 'num_snps': 30382}. Best is trial 74 with value: 0.20470863597462086.
[I 2025-12-06 02:57:51,284] Trial 110 finished with value: 0.16584994289325206 and parameters: {'model_type': 'mlp', 'hidden_dims': '[512, 64]', 'dropout': 0.19600387405651473, 'batch_norm': True, 'lr': 8.098249189552657e-06, 'weight_decay': 2.1904321244076557e-06, 'epochs': 45, 'loss': 'mae', 'optimizer': 'adam', 'graph_mode': 'off', 'use_snp_selection': False}. Best is trial 74 with value: 0.20470863597462086.
[I 2025-12-06 02:58:28,187] Trial 111 finished with value: 0.17655473078793366 and parameters: {'model_type': 'mlp', 'hidden_dims': '[512, 64]', 'dropout': 0.21440412611519827, 'batch_norm': False, 'lr': 9.570942026209434e-06, 'weight_decay': 1.2962671767925085e-06, 'epochs': 54, 'loss': 'mae', 'optimizer': 'adam', 'graph_mode': 'off', 'use_snp_selection': True, 'num_snps': 33749}. Best is trial 74 with value: 0.20470863597462086.
[I 2025-12-06 02:59:06,530] Trial 112 finished with value: 0.18498097423694998 and parameters: {'model_type': 'mlp', 'hidden_dims': '[512, 64]', 'dropout': 0.17521790404757506, 'batch_norm': False, 'lr': 1.0645947965495697e-05, 'weight_decay': 6.956063150470176e-06, 'epochs': 84, 'loss': 'mae', 'optimizer': 'adam', 'graph_mode': 'off', 'use_snp_selection': True, 'num_snps': 30270}. Best is trial 74 with value: 0.20470863597462086.
[I 2025-12-06 02:59:38,494] Trial 113 finished with value: 0.1949893078316552 and parameters: {'model_type': 'mlp', 'hidden_dims': '[256, 128]', 'dropout': 0.15930384858946378, 'batch_norm': False, 'lr': 1.5714846057994042e-05, 'weight_decay': 5.28047692656045e-06, 'epochs': 65, 'loss': 'mae', 'optimizer': 'adam', 'graph_mode': 'off', 'use_snp_selection': True, 'num_snps': 27633}. Best is trial 74 with value: 0.20470863597462086.
[I 2025-12-06 03:00:10,594] Trial 114 finished with value: 0.17730796864524395 and parameters: {'model_type': 'mlp', 'hidden_dims': '[256, 128]', 'dropout': 0.148088280289824, 'batch_norm': False, 'lr': 1.5746033947851476e-05, 'weight_decay': 3.2923157810082914e-06, 'epochs': 65, 'loss': 'mae', 'optimizer': 'adam', 'graph_mode': 'off', 'use_snp_selection': True, 'num_snps': 27690}. Best is trial 74 with value: 0.20470863597462086.
[I 2025-12-06 03:01:08,647] Trial 115 finished with value: 0.18156628681101455 and parameters: {'model_type': 'mlp', 'hidden_dims': '[512, 64]', 'dropout': 0.18439678692374642, 'batch_norm': False, 'lr': 6.674104797901076e-06, 'weight_decay': 5.396323333549992e-06, 'epochs': 240, 'loss': 'mae', 'optimizer': 'adam', 'graph_mode': 'off', 'use_snp_selection': True, 'num_snps': 34658}. Best is trial 74 with value: 0.20470863597462086.
[I 2025-12-06 03:01:40,379] Trial 116 finished with value: 0.19131207322989993 and parameters: {'model_type': 'mlp', 'hidden_dims': '[256, 128]', 'dropout': 0.1723205359616393, 'batch_norm': False, 'lr': 2.1874617333847826e-05, 'weight_decay': 1.1086798186256612e-05, 'epochs': 47, 'loss': 'mae', 'optimizer': 'adam', 'graph_mode': 'off', 'use_snp_selection': True, 'num_snps': 29454}. Best is trial 74 with value: 0.20470863597462086.
[I 2025-12-06 03:02:13,207] Trial 117 finished with value: 0.20119409188435838 and parameters: {'model_type': 'mlp', 'hidden_dims': '[256, 128]', 'dropout': 0.22194413429839133, 'batch_norm': False, 'lr': 8.754743976841355e-05, 'weight_decay': 2.68097802229035e-06, 'epochs': 54, 'loss': 'mae', 'optimizer': 'adam', 'graph_mode': 'off', 'use_snp_selection': True, 'num_snps': 31180}. Best is trial 74 with value: 0.20470863597462086.
[I 2025-12-06 03:02:46,292] Trial 118 finished with value: 0.19075946156442006 and parameters: {'model_type': 'mlp', 'hidden_dims': '[256, 128]', 'dropout': 0.22483957382446818, 'batch_norm': False, 'lr': 8.217319857869086e-05, 'weight_decay': 2.5528602102868075e-06, 'epochs': 54, 'loss': 'mae', 'optimizer': 'adam', 'graph_mode': 'off', 'use_snp_selection': True, 'num_snps': 32222}. Best is trial 74 with value: 0.20470863597462086.
[I 2025-12-06 03:03:16,969] Trial 119 finished with value: 0.1916289263072424 and parameters: {'model_type': 'mlp', 'hidden_dims': '[128, 64]', 'dropout': 0.20692779652789914, 'batch_norm': False, 'lr': 0.0003320408473135089, 'weight_decay': 1.7516652321086665e-06, 'epochs': 46, 'loss': 'mae', 'optimizer': 'adam', 'graph_mode': 'off', 'use_snp_selection': True, 'num_snps': 30574}. Best is trial 74 with value: 0.20470863597462086.
[I 2025-12-06 03:03:48,246] Trial 120 finished with value: 0.18082711153354558 and parameters: {'model_type': 'mlp', 'hidden_dims': '[256, 128]', 'dropout': 0.19701493589584554, 'batch_norm': False, 'lr': 8.83135830775383e-06, 'weight_decay': 1.038800282139324e-07, 'epochs': 74, 'loss': 'mae', 'optimizer': 'adam', 'graph_mode': 'off', 'use_snp_selection': True, 'num_snps': 24030}. Best is trial 74 with value: 0.20470863597462086.
[I 2025-12-06 03:04:20,320] Trial 121 finished with value: 0.17743812558323532 and parameters: {'model_type': 'mlp', 'hidden_dims': '[256, 128]', 'dropout': 0.15668956345139798, 'batch_norm': False, 'lr': 1.3313588603775916e-05, 'weight_decay': 3.643675199740565e-06, 'epochs': 62, 'loss': 'mae', 'optimizer': 'adam', 'graph_mode': 'off', 'use_snp_selection': True, 'num_snps': 28148}. Best is trial 74 with value: 0.20470863597462086.
[I 2025-12-06 03:04:52,906] Trial 122 finished with value: 0.18298133305976888 and parameters: {'model_type': 'mlp', 'hidden_dims': '[256, 128]', 'dropout': 0.2171582004444013, 'batch_norm': False, 'lr': 0.0008361736650255105, 'weight_decay': 7.910499675459675e-07, 'epochs': 67, 'loss': 'mae', 'optimizer': 'adam', 'graph_mode': 'off', 'use_snp_selection': True, 'num_snps': 29072}. Best is trial 74 with value: 0.20470863597462086.
[I 2025-12-06 03:05:25,844] Trial 123 finished with value: 0.18780774158634297 and parameters: {'model_type': 'mlp', 'hidden_dims': '[256, 128]', 'dropout': 0.18927433094211543, 'batch_norm': False, 'lr': 0.000263658581264117, 'weight_decay': 4.321781286094635e-06, 'epochs': 57, 'loss': 'mae', 'optimizer': 'adam', 'graph_mode': 'off', 'use_snp_selection': True, 'num_snps': 31408}. Best is trial 74 with value: 0.20470863597462086.
[I 2025-12-06 03:05:55,624] Trial 124 finished with value: 0.18753536976038804 and parameters: {'model_type': 'mlp', 'hidden_dims': '[256, 128]', 'dropout': 0.12212621702027145, 'batch_norm': False, 'lr': 0.0005404193825792364, 'weight_decay': 5.348683974424054e-06, 'epochs': 40, 'loss': 'mae', 'optimizer': 'adam', 'graph_mode': 'off', 'use_snp_selection': True, 'num_snps': 24445}. Best is trial 74 with value: 0.20470863597462086.
