[I 2025-12-06 05:34:18,393] Trial 31 finished with value: 0.24395073847625634 and parameters: {'model_type': 'mlp', 'hidden_dims': '[512, 256]', 'dropout': 0.10126391937142809, 'batch_norm': True, 'lr': 9.627073410050276e-05, 'weight_decay': 8.974280790259746e-06, 'epochs': 231, 'loss': 'mae', 'optimizer': 'adam', 'graph_mode': 'off', 'use_snp_selection': False}. Best is trial 23 with value: 0.252174980633632.
[I 2025-12-06 05:35:36,044] Trial 32 finished with value: 0.24759862757151158 and parameters: {'model_type': 'mlp', 'hidden_dims': '[512, 256]', 'dropout': 0.12917035928300213, 'batch_norm': True, 'lr': 0.00019688548620029215, 'weight_decay': 2.1585055385392437e-05, 'epochs': 253, 'loss': 'mae', 'optimizer': 'adam', 'graph_mode': 'off', 'use_snp_selection': False}. Best is trial 23 with value: 0.252174980633632.
[I 2025-12-06 05:36:56,632] Trial 33 finished with value: 0.2435751578654032 and parameters: {'model_type': 'mlp', 'hidden_dims': '[512, 256]', 'dropout': 0.12675256597286702, 'batch_norm': True, 'lr': 0.0005519777646270274, 'weight_decay': 2.8458742947300988e-05, 'epochs': 263, 'loss': 'mae', 'optimizer': 'adam', 'graph_mode': 'off', 'use_snp_selection': False}. Best is trial 23 with value: 0.252174980633632.
[I 2025-12-06 05:38:35,162] Trial 34 finished with value: 0.20152072194192186 and parameters: {'model_type': 'mlp', 'hidden_dims': '[512, 256]', 'dropout': 0.17173390003629846, 'batch_norm': True, 'lr': 3.8190281669228594e-06, 'weight_decay': 2.9802882843578968e-06, 'epochs': 327, 'loss': 'mae', 'optimizer': 'adam', 'graph_mode': 'off', 'use_snp_selection': False}. Best is trial 23 with value: 0.252174980633632.
[I 2025-12-06 05:39:20,081] Trial 35 finished with value: 0.23865158229214328 and parameters: {'model_type': 'mlp', 'hidden_dims': '[256, 128]', 'dropout': 0.22417555284349405, 'batch_norm': False, 'lr': 0.0002507591862271002, 'weight_decay': 0.00012144674814394603, 'epochs': 279, 'loss': 'mae', 'optimizer': 'adam', 'graph_mode': 'off', 'use_snp_selection': False}. Best is trial 23 with value: 0.252174980633632.
[I 2025-12-06 05:40:41,077] Trial 36 finished with value: 0.23211218386008073 and parameters: {'model_type': 'mlp', 'hidden_dims': '[256, 128, 64]', 'dropout': 0.1313623669401877, 'batch_norm': True, 'lr': 0.00018336890780698946, 'weight_decay': 2.1333805043158913e-05, 'epochs': 250, 'loss': 'mse', 'optimizer': 'adam', 'graph_mode': 'off', 'use_snp_selection': True, 'num_snps': 58661}. Best is trial 23 with value: 0.252174980633632.
[I 2025-12-06 05:42:13,735] Trial 37 finished with value: 0.20829829654510706 and parameters: {'model_type': 'mlp', 'hidden_dims': '[512, 64]', 'dropout': 0.2612604744121134, 'batch_norm': True, 'lr': 6.048689898441797e-06, 'weight_decay': 3.609871833535644e-05, 'epochs': 311, 'loss': 'mae', 'optimizer': 'adam', 'graph_mode': 'off', 'use_snp_selection': False}. Best is trial 23 with value: 0.252174980633632.
[I 2025-12-06 05:43:02,759] Trial 38 finished with value: 0.20617138907373095 and parameters: {'model_type': 'mlp', 'hidden_dims': '[512, 128]', 'dropout': 0.4634843905908045, 'batch_norm': False, 'lr': 8.593365871666008e-05, 'weight_decay': 9.182861866609901e-06, 'epochs': 159, 'loss': 'mse', 'optimizer': 'adam', 'graph_mode': 'off', 'use_snp_selection': True, 'num_snps': 19911}. Best is trial 23 with value: 0.252174980633632.
[I 2025-12-06 05:44:30,252] Trial 39 finished with value: 0.24432675899567405 and parameters: {'model_type': 'mlp', 'hidden_dims': '[512, 256]', 'dropout': 0.15911280457868648, 'batch_norm': True, 'lr': 4.4452933931663403e-05, 'weight_decay': 9.101180929703178e-07, 'epochs': 289, 'loss': 'mae', 'optimizer': 'adam', 'graph_mode': 'off', 'use_snp_selection': False}. Best is trial 23 with value: 0.252174980633632.
[I 2025-12-06 05:45:36,935] Trial 40 finished with value: 0.24141181146265006 and parameters: {'model_type': 'mlp', 'hidden_dims': '[512, 64]', 'dropout': 0.21867786259108946, 'batch_norm': True, 'lr': 0.0006498636897402032, 'weight_decay': 2.0467835111777083e-07, 'epochs': 213, 'loss': 'mse', 'optimizer': 'adam', 'graph_mode': 'off', 'use_snp_selection': False}. Best is trial 23 with value: 0.252174980633632.
[I 2025-12-06 05:46:50,237] Trial 41 finished with value: 0.2486047087963507 and parameters: {'model_type': 'mlp', 'hidden_dims': '[512, 256]', 'dropout': 0.1213146683147269, 'batch_norm': True, 'lr': 0.0003529131207422196, 'weight_decay': 1.1092937818150653e-05, 'epochs': 235, 'loss': 'mae', 'optimizer': 'adam', 'graph_mode': 'off', 'use_snp_selection': False}. Best is trial 23 with value: 0.252174980633632.
[I 2025-12-06 05:48:11,401] Trial 42 finished with value: 0.2443209782135151 and parameters: {'model_type': 'mlp', 'hidden_dims': '[512, 256]', 'dropout': 0.12641664192308608, 'batch_norm': True, 'lr': 0.00039037331028445656, 'weight_decay': 1.587233458895598e-05, 'epochs': 264, 'loss': 'mae', 'optimizer': 'adam', 'graph_mode': 'off', 'use_snp_selection': False}. Best is trial 23 with value: 0.252174980633632.
[I 2025-12-06 05:49:28,592] Trial 43 finished with value: 0.24847540684897212 and parameters: {'model_type': 'mlp', 'hidden_dims': '[512, 256]', 'dropout': 0.141144735990749, 'batch_norm': True, 'lr': 0.00028172348765708794, 'weight_decay': 8.217412841732242e-06, 'epochs': 250, 'loss': 'mae', 'optimizer': 'adam', 'graph_mode': 'off', 'use_snp_selection': False}. Best is trial 23 with value: 0.252174980633632.
[I 2025-12-06 05:50:25,093] Trial 44 finished with value: 0.23970225941179435 and parameters: {'model_type': 'mlp', 'hidden_dims': '[512, 256]', 'dropout': 0.15191424323383027, 'batch_norm': True, 'lr': 0.0003004819193370911, 'weight_decay': 3.886007062946196e-06, 'epochs': 176, 'loss': 'mae', 'optimizer': 'adam', 'graph_mode': 'off', 'use_snp_selection': False}. Best is trial 23 with value: 0.252174980633632.
[I 2025-12-06 05:50:47,226] Trial 45 finished with value: 0.2509873043900556 and parameters: {'model_type': 'mlp', 'hidden_dims': '[256, 128]', 'dropout': 0.1845209670121284, 'batch_norm': True, 'lr': 0.0006340316124754834, 'weight_decay': 7.849584954123875e-06, 'epochs': 110, 'loss': 'mae', 'optimizer': 'adam', 'graph_mode': 'off', 'use_snp_selection': False}. Best is trial 23 with value: 0.252174980633632.
[I 2025-12-06 05:51:06,300] Trial 46 finished with value: 0.23408348562913153 and parameters: {'model_type': 'mlp', 'hidden_dims': '[256, 128]', 'dropout': 0.18631387217627146, 'batch_norm': False, 'lr': 0.00066104180494849, 'weight_decay': 7.847397911415585e-06, 'epochs': 92, 'loss': 'mae', 'optimizer': 'adam', 'graph_mode': 'off', 'use_snp_selection': False}. Best is trial 23 with value: 0.252174980633632.
[I 2025-12-06 05:51:30,089] Trial 47 finished with value: 0.23409996498106994 and parameters: {'model_type': 'mlp', 'hidden_dims': '[256, 128]', 'dropout': 0.3545072738481547, 'batch_norm': True, 'lr': 0.000922082601847125, 'weight_decay': 8.542460145966894e-05, 'epochs': 122, 'loss': 'mse', 'optimizer': 'adam', 'graph_mode': 'off', 'use_snp_selection': False}. Best is trial 23 with value: 0.252174980633632.
[I 2025-12-06 05:51:47,131] Trial 48 finished with value: 0.08780044318202553 and parameters: {'model_type': 'mlp', 'hidden_dims': '[256, 128]', 'dropout': 0.24735351436318637, 'batch_norm': True, 'lr': 1.1170552432785515e-06, 'weight_decay': 0.0006963874766430621, 'epochs': 75, 'loss': 'mae', 'optimizer': 'adam', 'graph_mode': 'off', 'use_snp_selection': False}. Best is trial 23 with value: 0.252174980633632.
[I 2025-12-06 05:52:42,181] Trial 49 finished with value: 0.22846566912739458 and parameters: {'model_type': 'mlp', 'hidden_dims': '[512, 128]', 'dropout': 0.14791753031307928, 'batch_norm': True, 'lr': 0.00046965512438380184, 'weight_decay': 9.534119955367034e-06, 'epochs': 48, 'loss': 'mae', 'optimizer': 'adam', 'graph_mode': 'off', 'use_snp_selection': True, 'num_snps': 46888}. Best is trial 23 with value: 0.252174980633632.
[I 2025-12-06 05:53:13,953] Trial 50 finished with value: 0.19476380799142196 and parameters: {'model_type': 'mlp', 'hidden_dims': '[256, 128]', 'dropout': 0.18417575215867907, 'batch_norm': True, 'lr': 2.3328885470867203e-06, 'weight_decay': 3.4685200757866416e-06, 'epochs': 181, 'loss': 'mae', 'optimizer': 'adam', 'graph_mode': 'off', 'use_snp_selection': False}. Best is trial 23 with value: 0.252174980633632.
[I 2025-12-06 05:53:39,660] Trial 51 finished with value: 0.23518964030197234 and parameters: {'model_type': 'mlp', 'hidden_dims': '[128, 64]', 'dropout': 0.11569969262546226, 'batch_norm': True, 'lr': 0.00032851962127764363, 'weight_decay': 1.8118797904992363e-06, 'epochs': 276, 'loss': 'mae', 'optimizer': 'adam', 'graph_mode': 'off', 'use_snp_selection': False}. Best is trial 23 with value: 0.252174980633632.
[I 2025-12-06 05:54:45,104] Trial 52 finished with value: 0.24392892328855248 and parameters: {'model_type': 'mlp', 'hidden_dims': '[512, 64]', 'dropout': 0.14847541405198653, 'batch_norm': True, 'lr': 0.0006618823822312291, 'weight_decay': 5.960501885787944e-06, 'epochs': 211, 'loss': 'mae', 'optimizer': 'adam', 'graph_mode': 'off', 'use_snp_selection': False}. Best is trial 23 with value: 0.252174980633632.
[I 2025-12-06 05:56:18,878] Trial 53 finished with value: 0.2474291344367975 and parameters: {'model_type': 'mlp', 'hidden_dims': '[512, 128]', 'dropout': 0.11813763482689707, 'batch_norm': True, 'lr': 0.00016075025965935183, 'weight_decay': 1.170301822059054e-06, 'epochs': 312, 'loss': 'mae', 'optimizer': 'adam', 'graph_mode': 'off', 'use_snp_selection': False}. Best is trial 23 with value: 0.252174980633632.
[I 2025-12-06 05:57:01,913] Trial 54 finished with value: 0.24262264965933483 and parameters: {'model_type': 'mlp', 'hidden_dims': '[512, 256]', 'dropout': 0.1748042419138972, 'batch_norm': True, 'lr': 0.00024692680710668207, 'weight_decay': 2.1520914298137465e-06, 'epochs': 128, 'loss': 'mae', 'optimizer': 'adam', 'graph_mode': 'off', 'use_snp_selection': False}. Best is trial 23 with value: 0.252174980633632.
[I 2025-12-06 05:57:42,615] Trial 55 finished with value: 0.23324951986493145 and parameters: {'model_type': 'mlp', 'hidden_dims': '[256, 128, 64]', 'dropout': 0.20144563946232208, 'batch_norm': True, 'lr': 0.0003674299839340918, 'weight_decay': 1.719559327426818e-05, 'epochs': 239, 'loss': 'mae', 'optimizer': 'adam', 'graph_mode': 'off', 'use_snp_selection': False}. Best is trial 23 with value: 0.252174980633632.
[I 2025-12-06 05:59:10,661] Trial 56 finished with value: 0.2340760567424974 and parameters: {'model_type': 'mlp', 'hidden_dims': '[512, 256]', 'dropout': 0.5468233155565247, 'batch_norm': True, 'lr': 0.0005564085338224421, 'weight_decay': 1.1431787245004321e-05, 'epochs': 290, 'loss': 'mae', 'optimizer': 'adam', 'graph_mode': 'off', 'use_snp_selection': False}. Best is trial 23 with value: 0.252174980633632.
[I 2025-12-06 06:00:31,588] Trial 57 finished with value: 0.23713574396059728 and parameters: {'model_type': 'mlp', 'hidden_dims': '[512, 64]', 'dropout': 0.11146656980834323, 'batch_norm': False, 'lr': 6.930025221122913e-05, 'weight_decay': 4.472888495985742e-06, 'epochs': 272, 'loss': 'mae', 'optimizer': 'adam', 'graph_mode': 'off', 'use_snp_selection': False}. Best is trial 23 with value: 0.252174980633632.
[I 2025-12-06 06:02:13,628] Trial 58 finished with value: 0.23477765776067008 and parameters: {'model_type': 'mlp', 'hidden_dims': '[512, 128]', 'dropout': 0.14486983396547035, 'batch_norm': True, 'lr': 0.000997032330770753, 'weight_decay': 2.382539418649257e-06, 'epochs': 340, 'loss': 'mse', 'optimizer': 'adam', 'graph_mode': 'off', 'use_snp_selection': False}. Best is trial 23 with value: 0.252174980633632.
[I 2025-12-06 06:03:02,850] Trial 59 finished with value: 0.236972333649229 and parameters: {'model_type': 'mlp', 'hidden_dims': '[256, 128]', 'dropout': 0.41347749797378586, 'batch_norm': True, 'lr': 3.33737306819431e-05, 'weight_decay': 3.323169324827904e-05, 'epochs': 300, 'loss': 'mae', 'optimizer': 'adam', 'graph_mode': 'off', 'use_snp_selection': False}. Best is trial 23 with value: 0.252174980633632.
[I 2025-12-06 06:04:05,167] Trial 60 finished with value: 0.21271904613924505 and parameters: {'model_type': 'mlp', 'hidden_dims': '[512, 256]', 'dropout': 0.29507957033480936, 'batch_norm': True, 'lr': 0.00010925198313338006, 'weight_decay': 7.264662422068538e-06, 'epochs': 248, 'loss': 'mae', 'optimizer': 'adam', 'graph_mode': 'off', 'use_snp_selection': True, 'num_snps': 24139}. Best is trial 23 with value: 0.252174980633632.
[I 2025-12-06 06:05:24,042] Trial 61 finished with value: 0.2454844046671464 and parameters: {'model_type': 'mlp', 'hidden_dims': '[512, 256]', 'dropout': 0.13794651346521095, 'batch_norm': True, 'lr': 0.00016787315203640465, 'weight_decay': 1.982499442435717e-05, 'epochs': 258, 'loss': 'mae', 'optimizer': 'adam', 'graph_mode': 'off', 'use_snp_selection': False}. Best is trial 23 with value: 0.252174980633632.
[I 2025-12-06 06:06:33,579] Trial 62 finished with value: 0.242048557405863 and parameters: {'model_type': 'mlp', 'hidden_dims': '[512, 256]', 'dropout': 0.11838941659005026, 'batch_norm': True, 'lr': 0.0002271821629728648, 'weight_decay': 4.777193720748917e-05, 'epochs': 223, 'loss': 'mae', 'optimizer': 'adam', 'graph_mode': 'off', 'use_snp_selection': False}. Best is trial 23 with value: 0.252174980633632.
[I 2025-12-06 06:07:48,876] Trial 63 finished with value: 0.24026569410755338 and parameters: {'model_type': 'mlp', 'hidden_dims': '[512, 256]', 'dropout': 0.16378068596490766, 'batch_norm': True, 'lr': 0.00027792744878400786, 'weight_decay': 1.3489556491467872e-05, 'epochs': 243, 'loss': 'mae', 'optimizer': 'adam', 'graph_mode': 'off', 'use_snp_selection': False}. Best is trial 23 with value: 0.252174980633632.
[I 2025-12-06 06:08:48,602] Trial 64 finished with value: 0.24394331357799323 and parameters: {'model_type': 'mlp', 'hidden_dims': '[512, 256]', 'dropout': 0.1041896932974552, 'batch_norm': True, 'lr': 0.0002023696947596068, 'weight_decay': 5.211997186427213e-06, 'epochs': 187, 'loss': 'mae', 'optimizer': 'adam', 'graph_mode': 'off', 'use_snp_selection': False}. Best is trial 23 with value: 0.252174980633632.
[I 2025-12-06 06:09:17,476] Trial 65 finished with value: 0.2437460122402951 and parameters: {'model_type': 'mlp', 'hidden_dims': '[128, 64]', 'dropout': 0.13469553571299772, 'batch_norm': True, 'lr': 0.00013923502389717043, 'weight_decay': 1.2761470763098748e-05, 'epochs': 316, 'loss': 'mae', 'optimizer': 'adam', 'graph_mode': 'off', 'use_snp_selection': False}. Best is trial 23 with value: 0.252174980633632.
[I 2025-12-06 06:10:47,582] Trial 66 finished with value: 0.25069050371446117 and parameters: {'model_type': 'mlp', 'hidden_dims': '[512, 256]', 'dropout': 0.17061686023125378, 'batch_norm': True, 'lr': 0.0004334341110057816, 'weight_decay': 2.0419998718049598e-05, 'epochs': 296, 'loss': 'mae', 'optimizer': 'adam', 'graph_mode': 'off', 'use_snp_selection': False}. Best is trial 23 with value: 0.252174980633632.
[I 2025-12-06 06:12:18,085] Trial 67 finished with value: 0.24321775929620865 and parameters: {'model_type': 'mlp', 'hidden_dims': '[512, 64]', 'dropout': 0.1976195833006666, 'batch_norm': True, 'lr': 0.00045316636546506654, 'weight_decay': 2.5809330772298833e-05, 'epochs': 299, 'loss': 'mae', 'optimizer': 'adam', 'graph_mode': 'off', 'use_snp_selection': False}. Best is trial 23 with value: 0.252174980633632.
[I 2025-12-06 06:13:43,560] Trial 68 finished with value: 0.2425693287904264 and parameters: {'model_type': 'mlp', 'hidden_dims': '[512, 128]', 'dropout': 0.2160796369244949, 'batch_norm': True, 'lr': 1.9073999631018934e-05, 'weight_decay': 3.781007414422056e-05, 'epochs': 281, 'loss': 'mae', 'optimizer': 'adam', 'graph_mode': 'off', 'use_snp_selection': False}. Best is trial 23 with value: 0.252174980633632.
[I 2025-12-06 06:14:36,585] Trial 69 finished with value: 0.22149616779710138 and parameters: {'model_type': 'mlp', 'hidden_dims': '[256, 128, 64]', 'dropout': 0.2351960371782565, 'batch_norm': False, 'lr': 0.0003728260564128121, 'weight_decay': 6.9981659601392475e-06, 'epochs': 336, 'loss': 'mae', 'optimizer': 'adam', 'graph_mode': 'off', 'use_snp_selection': False}. Best is trial 23 with value: 0.252174980633632.
[I 2025-12-06 06:15:59,915] Trial 70 finished with value: 0.24367286044892422 and parameters: {'model_type': 'mlp', 'hidden_dims': '[512, 256]', 'dropout': 0.17135765386424054, 'batch_norm': True, 'lr': 0.0005605771824823993, 'weight_decay': 1.0569114489870702e-05, 'epochs': 272, 'loss': 'mae', 'optimizer': 'adam', 'graph_mode': 'off', 'use_snp_selection': False}. Best is trial 23 with value: 0.252174980633632.
[I 2025-12-06 06:17:32,642] Trial 71 finished with value: 0.24525568562588695 and parameters: {'model_type': 'mlp', 'hidden_dims': '[512, 256]', 'dropout': 0.15499269113136765, 'batch_norm': True, 'lr': 0.0002079651921055522, 'weight_decay': 1.854755553831806e-05, 'epochs': 306, 'loss': 'mae', 'optimizer': 'adam', 'graph_mode': 'off', 'use_snp_selection': False}. Best is trial 23 with value: 0.252174980633632.
[I 2025-12-06 06:19:01,738] Trial 72 finished with value: 0.2470539754822541 and parameters: {'model_type': 'mlp', 'hidden_dims': '[512, 256]', 'dropout': 0.12112318169739994, 'batch_norm': True, 'lr': 0.000769395646319069, 'weight_decay': 5.6548153605242175e-05, 'epochs': 293, 'loss': 'mae', 'optimizer': 'adam', 'graph_mode': 'off', 'use_snp_selection': False}. Best is trial 23 with value: 0.252174980633632.
[I 2025-12-06 06:20:13,853] Trial 73 finished with value: 0.2469250729628442 and parameters: {'model_type': 'mlp', 'hidden_dims': '[512, 256]', 'dropout': 0.10140983445077548, 'batch_norm': True, 'lr': 0.0004001452881926557, 'weight_decay': 2.5280242251924492e-05, 'epochs': 232, 'loss': 'mae', 'optimizer': 'adam', 'graph_mode': 'off', 'use_snp_selection': False}. Best is trial 23 with value: 0.252174980633632.
[I 2025-12-06 06:21:51,087] Trial 74 finished with value: 0.24109739507642414 and parameters: {'model_type': 'mlp', 'hidden_dims': '[512, 256]', 'dropout': 0.13873098811183654, 'batch_norm': True, 'lr': 0.0002960180600894714, 'weight_decay': 4.795144769978971e-06, 'epochs': 322, 'loss': 'mae', 'optimizer': 'adam', 'graph_mode': 'off', 'use_snp_selection': False}. Best is trial 23 with value: 0.252174980633632.
[I 2025-12-06 06:23:10,671] Trial 75 finished with value: 0.22249020947797882 and parameters: {'model_type': 'mlp', 'hidden_dims': '[512, 256]', 'dropout': 0.1722590030149021, 'batch_norm': True, 'lr': 6.52498741310575e-06, 'weight_decay': 1.4292075038705094e-05, 'epochs': 259, 'loss': 'mae', 'optimizer': 'adam', 'graph_mode': 'off', 'use_snp_selection': False}. Best is trial 23 with value: 0.252174980633632.
[I 2025-12-06 06:23:42,136] Trial 76 finished with value: 0.17031032456560713 and parameters: {'model_type': 'mlp', 'hidden_dims': '[256, 128]', 'dropout': 0.12622669514194154, 'batch_norm': True, 'lr': 0.0007381273714365819, 'weight_decay': 8.123542878774315e-06, 'epochs': 159, 'loss': 'mse', 'optimizer': 'adam', 'graph_mode': 'off', 'use_snp_selection': True, 'num_snps': 3325}. Best is trial 23 with value: 0.252174980633632.
[I 2025-12-06 06:25:08,040] Trial 77 finished with value: 0.24854285858165354 and parameters: {'model_type': 'mlp', 'hidden_dims': '[512, 64]', 'dropout': 0.15608670239291453, 'batch_norm': True, 'lr': 0.00013298957585053698, 'weight_decay': 2.5714135042224447e-06, 'epochs': 285, 'loss': 'mae', 'optimizer': 'adam', 'graph_mode': 'off', 'use_snp_selection': False}. Best is trial 23 with value: 0.252174980633632.
[I 2025-12-06 06:26:34,409] Trial 78 finished with value: 0.24908333243324604 and parameters: {'model_type': 'mlp', 'hidden_dims': '[512, 64]', 'dropout': 0.1858375456955195, 'batch_norm': True, 'lr': 5.6569511029671514e-05, 'weight_decay': 2.6809943224821724e-06, 'epochs': 285, 'loss': 'mae', 'optimizer': 'adam', 'graph_mode': 'off', 'use_snp_selection': False}. Best is trial 23 with value: 0.252174980633632.
[I 2025-12-06 06:28:01,175] Trial 79 finished with value: 0.23841900892572693 and parameters: {'model_type': 'mlp', 'hidden_dims': '[512, 64]', 'dropout': 0.21078453998728452, 'batch_norm': True, 'lr': 5.583143776721937e-05, 'weight_decay': 1.1843087708343601e-06, 'epochs': 286, 'loss': 'mae', 'optimizer': 'adam', 'graph_mode': 'off', 'use_snp_selection': False}. Best is trial 23 with value: 0.252174980633632.
[I 2025-12-06 06:29:05,184] Trial 80 finished with value: 0.2500772403933475 and parameters: {'model_type': 'mlp', 'hidden_dims': '[512, 64]', 'dropout': 0.1900081641967782, 'batch_norm': True, 'lr': 3.1042595522069854e-05, 'weight_decay': 2.4661748393506993e-06, 'epochs': 204, 'loss': 'mae', 'optimizer': 'adam', 'graph_mode': 'off', 'use_snp_selection': False}. Best is trial 23 with value: 0.252174980633632.
[I 2025-12-06 06:30:09,750] Trial 81 finished with value: 0.2357000509401821 and parameters: {'model_type': 'mlp', 'hidden_dims': '[512, 64]', 'dropout': 0.1929232836175432, 'batch_norm': True, 'lr': 3.6629149122239965e-05, 'weight_decay': 2.99239036607187e-06, 'epochs': 206, 'loss': 'mae', 'optimizer': 'adam', 'graph_mode': 'off', 'use_snp_selection': False}. Best is trial 23 with value: 0.252174980633632.
[I 2025-12-06 06:31:10,302] Trial 82 finished with value: 0.23878164710661648 and parameters: {'model_type': 'mlp', 'hidden_dims': '[512, 64]', 'dropout': 0.18343037822256753, 'batch_norm': True, 'lr': 1.9866675651998636e-05, 'weight_decay': 2.584853059549903e-06, 'epochs': 192, 'loss': 'mae', 'optimizer': 'adam', 'graph_mode': 'off', 'use_snp_selection': False}. Best is trial 23 with value: 0.252174980633632.
