[I 2025-12-05 15:12:14,739] Trial 52 finished with value: 0.2394820558720056 and parameters: {'model_type': 'mlp', 'hidden_dims': '[256, 128, 64]', 'dropout': 0.4417740111839512, 'batch_norm': True, 'lr': 4.516635417737578e-05, 'weight_decay': 0.00015708254017785187, 'epochs': 231, 'loss': 'mae', 'optimizer': 'adam', 'graph_mode': 'off', 'use_snp_selection': False}. Best is trial 23 with value: 0.2521825967980717.
[I 2025-12-05 15:13:08,230] Trial 53 finished with value: 0.2406250138951374 and parameters: {'model_type': 'mlp', 'hidden_dims': '[256, 128, 64]', 'dropout': 0.3882137135830158, 'batch_norm': True, 'lr': 2.8187698995972418e-05, 'weight_decay': 9.238007068925893e-07, 'epochs': 329, 'loss': 'mae', 'optimizer': 'adam', 'graph_mode': 'off', 'use_snp_selection': False}. Best is trial 23 with value: 0.2521825967980717.
[I 2025-12-05 15:13:49,300] Trial 54 finished with value: 0.24648255920426004 and parameters: {'model_type': 'mlp', 'hidden_dims': '[256, 128, 64]', 'dropout': 0.40509965448315055, 'batch_norm': True, 'lr': 8.286207350600833e-05, 'weight_decay': 2.8876056264381566e-06, 'epochs': 241, 'loss': 'mae', 'optimizer': 'adam', 'graph_mode': 'off', 'use_snp_selection': False}. Best is trial 23 with value: 0.2521825967980717.
[I 2025-12-05 15:14:08,702] Trial 55 finished with value: 0.20770639732665153 and parameters: {'model_type': 'mlp', 'hidden_dims': '[512, 256]', 'dropout': 0.48540907322715876, 'batch_norm': True, 'lr': 1.256435865451005e-05, 'weight_decay': 1.8452672137998959e-06, 'epochs': 42, 'loss': 'mae', 'optimizer': 'adam', 'graph_mode': 'off', 'use_snp_selection': False}. Best is trial 23 with value: 0.2521825967980717.
[I 2025-12-05 15:14:53,994] Trial 56 finished with value: 0.24463065031966785 and parameters: {'model_type': 'mlp', 'hidden_dims': '[256, 128, 64]', 'dropout': 0.3588780168411417, 'batch_norm': True, 'lr': 6.283331498797926e-05, 'weight_decay': 1.228526115707111e-06, 'epochs': 272, 'loss': 'mae', 'optimizer': 'adam', 'graph_mode': 'off', 'use_snp_selection': False}. Best is trial 23 with value: 0.2521825967980717.
[I 2025-12-05 15:15:41,649] Trial 57 finished with value: 0.23609251749083535 and parameters: {'model_type': 'mlp', 'hidden_dims': '[256, 128]', 'dropout': 0.25632041972156866, 'batch_norm': False, 'lr': 2.47946988294505e-05, 'weight_decay': 7.537919293520905e-06, 'epochs': 296, 'loss': 'mae', 'optimizer': 'adam', 'graph_mode': 'off', 'use_snp_selection': False}. Best is trial 23 with value: 0.2521825967980717.
[I 2025-12-05 15:16:49,595] Trial 58 finished with value: 0.24616277053915084 and parameters: {'model_type': 'mlp', 'hidden_dims': '[512, 256]', 'dropout': 0.4701468420513475, 'batch_norm': True, 'lr': 0.00010199836622277295, 'weight_decay': 3.9920019698009356e-07, 'epochs': 216, 'loss': 'mae', 'optimizer': 'adam', 'graph_mode': 'off', 'use_snp_selection': False}. Best is trial 23 with value: 0.2521825967980717.
[I 2025-12-05 15:17:20,865] Trial 59 finished with value: 0.2436018564273456 and parameters: {'model_type': 'mlp', 'hidden_dims': '[256, 128, 64]', 'dropout': 0.3280068512723858, 'batch_norm': True, 'lr': 0.00023500854785676693, 'weight_decay': 2.0185389668636742e-07, 'epochs': 172, 'loss': 'mae', 'optimizer': 'adam', 'graph_mode': 'off', 'use_snp_selection': False}. Best is trial 23 with value: 0.2521825967980717.
[I 2025-12-05 15:18:32,007] Trial 60 finished with value: 0.24346593742677586 and parameters: {'model_type': 'mlp', 'hidden_dims': '[512, 64]', 'dropout': 0.5142476363532219, 'batch_norm': True, 'lr': 1.30069167115296e-05, 'weight_decay': 3.8703122379177156e-06, 'epochs': 229, 'loss': 'mae', 'optimizer': 'adam', 'graph_mode': 'off', 'use_snp_selection': False}. Best is trial 23 with value: 0.2521825967980717.
[I 2025-12-05 15:19:13,939] Trial 61 finished with value: 0.24211562122634703 and parameters: {'model_type': 'mlp', 'hidden_dims': '[256, 128, 64]', 'dropout': 0.37312166478547826, 'batch_norm': True, 'lr': 3.6060215232212014e-05, 'weight_decay': 2.5222564956183436e-06, 'epochs': 247, 'loss': 'mae', 'optimizer': 'adam', 'graph_mode': 'off', 'use_snp_selection': False}. Best is trial 23 with value: 0.2521825967980717.
[I 2025-12-05 15:19:53,818] Trial 62 finished with value: 0.24134213102497268 and parameters: {'model_type': 'mlp', 'hidden_dims': '[256, 128, 64]', 'dropout': 0.38184132473736326, 'batch_norm': True, 'lr': 4.009451113237497e-05, 'weight_decay': 1.682556587391573e-06, 'epochs': 233, 'loss': 'mae', 'optimizer': 'adam', 'graph_mode': 'off', 'use_snp_selection': False}. Best is trial 23 with value: 0.2521825967980717.
[I 2025-12-05 15:20:29,234] Trial 63 finished with value: 0.24037698630589038 and parameters: {'model_type': 'mlp', 'hidden_dims': '[256, 128, 64]', 'dropout': 0.3473686702513317, 'batch_norm': True, 'lr': 2.7441564067562936e-05, 'weight_decay': 1.227773766839188e-05, 'epochs': 202, 'loss': 'mae', 'optimizer': 'adam', 'graph_mode': 'off', 'use_snp_selection': False}. Best is trial 23 with value: 0.2521825967980717.
[I 2025-12-05 15:21:13,217] Trial 64 finished with value: 0.24395255720640924 and parameters: {'model_type': 'mlp', 'hidden_dims': '[256, 128, 64]', 'dropout': 0.30299279864444156, 'batch_norm': True, 'lr': 5.343478988345101e-05, 'weight_decay': 6.006896339212372e-07, 'epochs': 262, 'loss': 'mae', 'optimizer': 'adam', 'graph_mode': 'off', 'use_snp_selection': False}. Best is trial 23 with value: 0.2521825967980717.
[I 2025-12-05 15:22:22,477] Trial 65 finished with value: 0.24400274126077687 and parameters: {'model_type': 'mlp', 'hidden_dims': '[512, 256]', 'dropout': 0.42933360350784705, 'batch_norm': True, 'lr': 1.9441451835489514e-05, 'weight_decay': 1.152167833005949e-06, 'epochs': 221, 'loss': 'mae', 'optimizer': 'adam', 'graph_mode': 'off', 'use_snp_selection': False}. Best is trial 23 with value: 0.2521825967980717.
[I 2025-12-05 15:23:15,138] Trial 66 finished with value: 0.24756116268332456 and parameters: {'model_type': 'mlp', 'hidden_dims': '[256, 128, 64]', 'dropout': 0.5537576134753744, 'batch_norm': True, 'lr': 3.9087215940485776e-05, 'weight_decay': 0.0008281283468112786, 'epochs': 280, 'loss': 'mae', 'optimizer': 'adam', 'graph_mode': 'off', 'use_snp_selection': True, 'num_snps': 22881}. Best is trial 23 with value: 0.2521825967980717.
[I 2025-12-05 15:23:34,766] Trial 67 finished with value: 0.1314783043866585 and parameters: {'model_type': 'mlp', 'hidden_dims': '[128, 64]', 'dropout': 0.5013195098427512, 'batch_norm': True, 'lr': 1.038788092140181e-06, 'weight_decay': 2.7057839730834296e-06, 'epochs': 189, 'loss': 'mse', 'optimizer': 'adam', 'graph_mode': 'off', 'use_snp_selection': False}. Best is trial 23 with value: 0.2521825967980717.
[I 2025-12-05 15:24:14,440] Trial 68 finished with value: 0.24897849206650596 and parameters: {'model_type': 'mlp', 'hidden_dims': '[256, 128]', 'dropout': 0.5713048772640487, 'batch_norm': True, 'lr': 3.287714365577513e-05, 'weight_decay': 4.876328204339939e-06, 'epochs': 235, 'loss': 'mae', 'optimizer': 'adam', 'graph_mode': 'off', 'use_snp_selection': False}. Best is trial 23 with value: 0.2521825967980717.
[I 2025-12-05 15:24:55,751] Trial 69 finished with value: 0.2453765526683934 and parameters: {'model_type': 'mlp', 'hidden_dims': '[256, 128]', 'dropout': 0.5782766416999715, 'batch_norm': False, 'lr': 3.096899516159325e-05, 'weight_decay': 5.073058903563439e-06, 'epochs': 252, 'loss': 'mae', 'optimizer': 'adam', 'graph_mode': 'off', 'use_snp_selection': False}. Best is trial 23 with value: 0.2521825967980717.
[I 2025-12-05 15:25:12,719] Trial 70 finished with value: 0.24662998924063775 and parameters: {'model_type': 'mlp', 'hidden_dims': '[256, 128]', 'dropout': 0.5666111374038503, 'batch_norm': True, 'lr': 6.829009940211249e-05, 'weight_decay': 3.394233154194848e-06, 'epochs': 73, 'loss': 'mae', 'optimizer': 'adam', 'graph_mode': 'off', 'use_snp_selection': False}. Best is trial 23 with value: 0.2521825967980717.
[I 2025-12-05 15:25:52,216] Trial 71 finished with value: 0.24747640320486886 and parameters: {'model_type': 'mlp', 'hidden_dims': '[256, 128]', 'dropout': 0.538207518635236, 'batch_norm': True, 'lr': 1.622356950776427e-05, 'weight_decay': 2.3073054424253664e-06, 'epochs': 233, 'loss': 'mae', 'optimizer': 'adam', 'graph_mode': 'off', 'use_snp_selection': False}. Best is trial 23 with value: 0.2521825967980717.
[I 2025-12-05 15:26:28,675] Trial 72 finished with value: 0.24727556277237336 and parameters: {'model_type': 'mlp', 'hidden_dims': '[256, 128]', 'dropout': 0.5194193637256781, 'batch_norm': True, 'lr': 2.2091996737849567e-05, 'weight_decay': 5.077419064481101e-06, 'epochs': 211, 'loss': 'mae', 'optimizer': 'adam', 'graph_mode': 'off', 'use_snp_selection': False}. Best is trial 23 with value: 0.2521825967980717.
[I 2025-12-05 15:27:43,532] Trial 73 finished with value: 0.2394879888550762 and parameters: {'model_type': 'mlp', 'hidden_dims': '[512, 256]', 'dropout': 0.4086478401530814, 'batch_norm': True, 'lr': 4.004524352225059e-05, 'weight_decay': 1.5600940025089554e-06, 'epochs': 241, 'loss': 'mae', 'optimizer': 'adam', 'graph_mode': 'off', 'use_snp_selection': False}. Best is trial 23 with value: 0.2521825967980717.
[I 2025-12-05 15:28:53,211] Trial 74 finished with value: 0.2425546813447808 and parameters: {'model_type': 'mlp', 'hidden_dims': '[512, 128]', 'dropout': 0.582036713000213, 'batch_norm': True, 'lr': 3.141373757378179e-05, 'weight_decay': 1.0104160552327314e-06, 'epochs': 222, 'loss': 'mae', 'optimizer': 'adam', 'graph_mode': 'off', 'use_snp_selection': False}. Best is trial 23 with value: 0.2521825967980717.
[I 2025-12-05 15:29:27,833] Trial 75 finished with value: 0.24297936236633752 and parameters: {'model_type': 'mlp', 'hidden_dims': '[256, 128]', 'dropout': 0.3916815161384936, 'batch_norm': True, 'lr': 5.175690347529947e-05, 'weight_decay': 8.119639108989197e-06, 'epochs': 197, 'loss': 'mae', 'optimizer': 'adam', 'graph_mode': 'off', 'use_snp_selection': False}. Best is trial 23 with value: 0.2521825967980717.
[I 2025-12-05 15:30:01,475] Trial 76 finished with value: 0.19024658169265532 and parameters: {'model_type': 'mlp', 'hidden_dims': '[256, 128, 64]', 'dropout': 0.5481434280442701, 'batch_norm': True, 'lr': 2.284966315916127e-05, 'weight_decay': 2.120017454840593e-06, 'epochs': 207, 'loss': 'mae', 'optimizer': 'adam', 'graph_mode': 'off', 'use_snp_selection': True, 'num_snps': 3325}. Best is trial 23 with value: 0.2521825967980717.
[I 2025-12-05 15:31:20,356] Trial 77 finished with value: 0.252926157531937 and parameters: {'model_type': 'mlp', 'hidden_dims': '[512, 256]', 'dropout': 0.4371490691152811, 'batch_norm': True, 'lr': 4.3521587529377504e-05, 'weight_decay': 3.241971079710701e-06, 'epochs': 257, 'loss': 'mae', 'optimizer': 'adam', 'graph_mode': 'off', 'use_snp_selection': False}. Best is trial 77 with value: 0.252926157531937.
[I 2025-12-05 15:32:39,319] Trial 78 finished with value: 0.24029657122038875 and parameters: {'model_type': 'mlp', 'hidden_dims': '[512, 256]', 'dropout': 0.4572476786151736, 'batch_norm': True, 'lr': 7.970829229306545e-06, 'weight_decay': 6.016155162460435e-06, 'epochs': 256, 'loss': 'mae', 'optimizer': 'adam', 'graph_mode': 'off', 'use_snp_selection': False}. Best is trial 77 with value: 0.252926157531937.
[I 2025-12-05 15:34:03,779] Trial 79 finished with value: 0.2392717295079235 and parameters: {'model_type': 'mlp', 'hidden_dims': '[512, 256]', 'dropout': 0.4332600201150451, 'batch_norm': True, 'lr': 4.444801072411033e-05, 'weight_decay': 3.255147043634814e-06, 'epochs': 275, 'loss': 'mse', 'optimizer': 'adam', 'graph_mode': 'off', 'use_snp_selection': False}. Best is trial 77 with value: 0.252926157531937.
[I 2025-12-05 15:35:39,515] Trial 80 finished with value: 0.2486156939358716 and parameters: {'model_type': 'mlp', 'hidden_dims': '[512, 256]', 'dropout': 0.4748578925821039, 'batch_norm': True, 'lr': 5.745957071615423e-05, 'weight_decay': 1.0587167467031282e-05, 'epochs': 315, 'loss': 'mae', 'optimizer': 'adam', 'graph_mode': 'off', 'use_snp_selection': False}. Best is trial 77 with value: 0.252926157531937.
[I 2025-12-05 15:37:07,113] Trial 81 finished with value: 0.2397615582307498 and parameters: {'model_type': 'mlp', 'hidden_dims': '[512, 256]', 'dropout': 0.4793830390357059, 'batch_norm': True, 'lr': 9.46222254877049e-05, 'weight_decay': 1.861754607212603e-05, 'epochs': 286, 'loss': 'mae', 'optimizer': 'adam', 'graph_mode': 'off', 'use_snp_selection': False}. Best is trial 77 with value: 0.252926157531937.
[I 2025-12-05 15:38:41,671] Trial 82 finished with value: 0.2504859373631232 and parameters: {'model_type': 'mlp', 'hidden_dims': '[512, 256]', 'dropout': 0.4965113426355094, 'batch_norm': True, 'lr': 6.78980136893654e-05, 'weight_decay': 1.2119474907520358e-05, 'epochs': 311, 'loss': 'mae', 'optimizer': 'adam', 'graph_mode': 'off', 'use_snp_selection': False}. Best is trial 77 with value: 0.252926157531937.
[I 2025-12-05 15:40:17,907] Trial 83 finished with value: 0.247546533646042 and parameters: {'model_type': 'mlp', 'hidden_dims': '[512, 256]', 'dropout': 0.4703115180893062, 'batch_norm': True, 'lr': 7.522799343639318e-05, 'weight_decay': 2.5575783119137207e-05, 'epochs': 317, 'loss': 'mae', 'optimizer': 'adam', 'graph_mode': 'off', 'use_snp_selection': False}. Best is trial 77 with value: 0.252926157531937.
[I 2025-12-05 15:41:57,334] Trial 84 finished with value: 0.24551470749149046 and parameters: {'model_type': 'mlp', 'hidden_dims': '[512, 256]', 'dropout': 0.4923757848293242, 'batch_norm': True, 'lr': 5.6750813696866245e-05, 'weight_decay': 1.1615814953149797e-05, 'epochs': 328, 'loss': 'mae', 'optimizer': 'adam', 'graph_mode': 'off', 'use_snp_selection': False}. Best is trial 77 with value: 0.252926157531937.
[I 2025-12-05 15:43:31,207] Trial 85 finished with value: 0.2501754549766801 and parameters: {'model_type': 'mlp', 'hidden_dims': '[512, 256]', 'dropout': 0.5299518556806563, 'batch_norm': True, 'lr': 6.714269724672813e-05, 'weight_decay': 3.353973362107476e-05, 'epochs': 308, 'loss': 'mae', 'optimizer': 'adam', 'graph_mode': 'off', 'use_snp_selection': False}. Best is trial 77 with value: 0.252926157531937.
[I 2025-12-05 15:45:02,153] Trial 86 finished with value: 0.24198108091388265 and parameters: {'model_type': 'mlp', 'hidden_dims': '[512, 256]', 'dropout': 0.5176106341858154, 'batch_norm': False, 'lr': 0.0001187730216503574, 'weight_decay': 8.964757641142261e-05, 'epochs': 308, 'loss': 'mae', 'optimizer': 'adam', 'graph_mode': 'off', 'use_snp_selection': False}. Best is trial 77 with value: 0.252926157531937.
[I 2025-12-05 15:46:46,358] Trial 87 finished with value: 0.24827093368401193 and parameters: {'model_type': 'mlp', 'hidden_dims': '[512, 256]', 'dropout': 0.5261857899355847, 'batch_norm': True, 'lr': 7.364357322615865e-05, 'weight_decay': 3.919927840876928e-05, 'epochs': 345, 'loss': 'mae', 'optimizer': 'adam', 'graph_mode': 'off', 'use_snp_selection': False}. Best is trial 77 with value: 0.252926157531937.
[I 2025-12-05 15:48:38,141] Trial 88 finished with value: 0.24631729702883276 and parameters: {'model_type': 'mlp', 'hidden_dims': '[512, 256]', 'dropout': 0.5692276327074908, 'batch_norm': True, 'lr': 5.7186398309462166e-05, 'weight_decay': 1.5279245280619624e-05, 'epochs': 300, 'loss': 'mae', 'optimizer': 'adam', 'graph_mode': 'off', 'use_snp_selection': True, 'num_snps': 48766}. Best is trial 77 with value: 0.252926157531937.
[I 2025-12-05 15:50:07,421] Trial 89 finished with value: 0.24391131935765303 and parameters: {'model_type': 'mlp', 'hidden_dims': '[512, 256]', 'dropout': 0.5024217967899605, 'batch_norm': True, 'lr': 0.0002048255545944586, 'weight_decay': 1.0833124396403273e-05, 'epochs': 293, 'loss': 'mae', 'optimizer': 'adam', 'graph_mode': 'off', 'use_snp_selection': False}. Best is trial 77 with value: 0.252926157531937.
[I 2025-12-05 15:51:45,642] Trial 90 finished with value: 0.23696934075684953 and parameters: {'model_type': 'mlp', 'hidden_dims': '[512, 256]', 'dropout': 0.5269852965327115, 'batch_norm': True, 'lr': 0.00014702635612653072, 'weight_decay': 2.1750989738393988e-05, 'epochs': 324, 'loss': 'mse', 'optimizer': 'adam', 'graph_mode': 'off', 'use_snp_selection': False}. Best is trial 77 with value: 0.252926157531937.
[I 2025-12-05 15:53:21,141] Trial 91 finished with value: 0.2437157106590154 and parameters: {'model_type': 'mlp', 'hidden_dims': '[512, 256]', 'dropout': 0.4468122164264611, 'batch_norm': True, 'lr': 4.5268675969235584e-05, 'weight_decay': 3.664688797355649e-05, 'epochs': 314, 'loss': 'mae', 'optimizer': 'adam', 'graph_mode': 'off', 'use_snp_selection': False}. Best is trial 77 with value: 0.252926157531937.
[I 2025-12-05 15:55:03,107] Trial 92 finished with value: 0.2461430683914426 and parameters: {'model_type': 'mlp', 'hidden_dims': '[512, 256]', 'dropout': 0.5454717731409587, 'batch_norm': True, 'lr': 3.444179498400531e-05, 'weight_decay': 4.637652057144726e-06, 'epochs': 337, 'loss': 'mae', 'optimizer': 'adam', 'graph_mode': 'off', 'use_snp_selection': False}. Best is trial 77 with value: 0.252926157531937.
[I 2025-12-05 15:56:31,688] Trial 93 finished with value: 0.2364943360175762 and parameters: {'model_type': 'mlp', 'hidden_dims': '[512, 256]', 'dropout': 0.49337752470722074, 'batch_norm': True, 'lr': 1.8584642867975003e-05, 'weight_decay': 8.12864688283596e-05, 'epochs': 289, 'loss': 'mae', 'optimizer': 'adam', 'graph_mode': 'off', 'use_snp_selection': False}. Best is trial 77 with value: 0.252926157531937.
[I 2025-12-05 15:58:13,728] Trial 94 finished with value: 0.2411501811527202 and parameters: {'model_type': 'mlp', 'hidden_dims': '[512, 256]', 'dropout': 0.4662956368005463, 'batch_norm': True, 'lr': 6.574496667417956e-05, 'weight_decay': 8.025961382994306e-06, 'epochs': 337, 'loss': 'mae', 'optimizer': 'adam', 'graph_mode': 'off', 'use_snp_selection': False}. Best is trial 77 with value: 0.252926157531937.
[I 2025-12-05 15:59:03,735] Trial 95 finished with value: 0.24670973949560143 and parameters: {'model_type': 'mlp', 'hidden_dims': '[256, 128]', 'dropout': 0.10796406843787018, 'batch_norm': True, 'lr': 2.5580794811346342e-05, 'weight_decay': 1.4017672353087405e-05, 'epochs': 305, 'loss': 'mae', 'optimizer': 'adam', 'graph_mode': 'off', 'use_snp_selection': False}. Best is trial 77 with value: 0.252926157531937.
[I 2025-12-05 16:00:25,535] Trial 96 finished with value: 0.24225218588662062 and parameters: {'model_type': 'mlp', 'hidden_dims': '[512, 256]', 'dropout': 0.4405111490169754, 'batch_norm': True, 'lr': 9.193900131591929e-05, 'weight_decay': 5.8719700148976115e-06, 'epochs': 265, 'loss': 'mae', 'optimizer': 'adam', 'graph_mode': 'off', 'use_snp_selection': False}. Best is trial 77 with value: 0.252926157531937.
[I 2025-12-05 16:01:34,384] Trial 97 finished with value: 0.23940766798968927 and parameters: {'model_type': 'mlp', 'hidden_dims': '[512, 64]', 'dropout': 0.5904862841981497, 'batch_norm': True, 'lr': 1.1046372286433315e-05, 'weight_decay': 3.868151352568892e-06, 'epochs': 220, 'loss': 'mae', 'optimizer': 'adam', 'graph_mode': 'off', 'use_snp_selection': False}. Best is trial 77 with value: 0.252926157531937.
[I 2025-12-05 16:02:44,960] Trial 98 finished with value: 0.24461964733274527 and parameters: {'model_type': 'mlp', 'hidden_dims': '[512, 128]', 'dropout': 0.4238139489317791, 'batch_norm': True, 'lr': 0.00010775247833081518, 'weight_decay': 0.0003267063631640504, 'epochs': 226, 'loss': 'mae', 'optimizer': 'adam', 'graph_mode': 'off', 'use_snp_selection': False}. Best is trial 77 with value: 0.252926157531937.
[I 2025-12-05 16:03:59,468] Trial 99 finished with value: 0.24342157310859078 and parameters: {'model_type': 'mlp', 'hidden_dims': '[512, 256]', 'dropout': 0.5087882983922078, 'batch_norm': False, 'lr': 4.300276666727629e-05, 'weight_decay': 7.513423220385287e-07, 'epochs': 246, 'loss': 'mae', 'optimizer': 'adam', 'graph_mode': 'off', 'use_snp_selection': False}. Best is trial 77 with value: 0.252926157531937.
[I 2025-12-05 16:04:24,371] Trial 100 finished with value: 0.24679559716793978 and parameters: {'model_type': 'mlp', 'hidden_dims': '[128, 64]', 'dropout': 0.45181911510289713, 'batch_norm': True, 'lr': 3.354048484073733e-05, 'weight_decay': 1.361546270299994e-06, 'epochs': 261, 'loss': 'mae', 'optimizer': 'adam', 'graph_mode': 'off', 'use_snp_selection': False}. Best is trial 77 with value: 0.252926157531937.
[I 2025-12-05 16:06:09,219] Trial 101 finished with value: 0.24836222581663542 and parameters: {'model_type': 'mlp', 'hidden_dims': '[512, 256]', 'dropout': 0.534733521895544, 'batch_norm': True, 'lr': 7.2854027836198e-05, 'weight_decay': 0.0001296132591213723, 'epochs': 348, 'loss': 'mae', 'optimizer': 'adam', 'graph_mode': 'off', 'use_snp_selection': False}. Best is trial 77 with value: 0.252926157531937.
[I 2025-12-05 16:07:53,609] Trial 102 finished with value: 0.24521303620459775 and parameters: {'model_type': 'mlp', 'hidden_dims': '[512, 256]', 'dropout': 0.5348149002602868, 'batch_norm': True, 'lr': 0.00017987496905394105, 'weight_decay': 0.0004300984901125284, 'epochs': 346, 'loss': 'mae', 'optimizer': 'adam', 'graph_mode': 'off', 'use_snp_selection': False}. Best is trial 77 with value: 0.252926157531937.
[I 2025-12-05 16:09:30,985] Trial 103 finished with value: 0.24271951256000707 and parameters: {'model_type': 'mlp', 'hidden_dims': '[512, 256]', 'dropout': 0.5586300791079233, 'batch_norm': True, 'lr': 5.1777723568640275e-05, 'weight_decay': 0.00010603520284193084, 'epochs': 321, 'loss': 'mae', 'optimizer': 'adam', 'graph_mode': 'off', 'use_snp_selection': False}. Best is trial 77 with value: 0.252926157531937.
