[I 2025-12-05 14:49:44,159] Trial 123 finished with value: 0.049294236271518424 and parameters: {'model_type': 'mlp', 'hidden_dims': '[256, 128]', 'dropout': 0.1004848400496949, 'batch_norm': True, 'lr': 5.8935839190198566e-06, 'weight_decay': 2.2685314328619252e-05, 'epochs': 305, 'loss': 'mae', 'optimizer': 'adam', 'graph_mode': 'off', 'use_snp_selection': False}. Best is trial 18 with value: 0.11411391432010902.
[I 2025-12-05 14:49:45,659] Trial 124 finished with value: 0.07119448996797878 and parameters: {'model_type': 'mlp', 'hidden_dims': '[256, 128]', 'dropout': 0.12923208225374616, 'batch_norm': True, 'lr': 6.4185356710362835e-06, 'weight_decay': 1.1027179087056944e-05, 'epochs': 275, 'loss': 'mae', 'optimizer': 'adam', 'graph_mode': 'off', 'use_snp_selection': False}. Best is trial 18 with value: 0.11411391432010902.
[I 2025-12-05 14:49:47,146] Trial 125 finished with value: 0.09222508742081797 and parameters: {'model_type': 'mlp', 'hidden_dims': '[256, 128]', 'dropout': 0.15281188742956722, 'batch_norm': True, 'lr': 4.904017641933329e-06, 'weight_decay': 3.168213094420329e-05, 'epochs': 267, 'loss': 'mae', 'optimizer': 'adam', 'graph_mode': 'off', 'use_snp_selection': False}. Best is trial 18 with value: 0.11411391432010902.
[I 2025-12-05 14:49:48,568] Trial 126 finished with value: 0.08780034877735722 and parameters: {'model_type': 'mlp', 'hidden_dims': '[256, 128]', 'dropout': 0.15539060867839444, 'batch_norm': False, 'lr': 4.9056100569070615e-06, 'weight_decay': 3.011712323368344e-05, 'epochs': 265, 'loss': 'mae', 'optimizer': 'adam', 'graph_mode': 'off', 'use_snp_selection': False}. Best is trial 18 with value: 0.11411391432010902.
[I 2025-12-05 14:49:50,057] Trial 127 finished with value: 0.0907706642383922 and parameters: {'model_type': 'mlp', 'hidden_dims': '[256, 128]', 'dropout': 0.13912066467839634, 'batch_norm': True, 'lr': 7.1023824245387356e-06, 'weight_decay': 6.552687070063594e-05, 'epochs': 271, 'loss': 'mae', 'optimizer': 'adam', 'graph_mode': 'off', 'use_snp_selection': False}. Best is trial 18 with value: 0.11411391432010902.
[I 2025-12-05 14:49:51,509] Trial 128 finished with value: 0.04446976035467086 and parameters: {'model_type': 'mlp', 'hidden_dims': '[256, 128]', 'dropout': 0.2109082558874009, 'batch_norm': True, 'lr': 2.9070692825243327e-06, 'weight_decay': 4.010522978945763e-05, 'epochs': 257, 'loss': 'mae', 'optimizer': 'adam', 'graph_mode': 'off', 'use_snp_selection': False}. Best is trial 18 with value: 0.11411391432010902.
[I 2025-12-05 14:49:52,957] Trial 129 finished with value: 0.08506660874458125 and parameters: {'model_type': 'mlp', 'hidden_dims': '[256, 128]', 'dropout': 0.3082247369531576, 'batch_norm': False, 'lr': 3.5339136883011395e-06, 'weight_decay': 5.400651716457015e-05, 'epochs': 267, 'loss': 'mae', 'optimizer': 'adam', 'graph_mode': 'off', 'use_snp_selection': False}. Best is trial 18 with value: 0.11411391432010902.
[I 2025-12-05 14:49:54,276] Trial 130 finished with value: 0.08366720754489428 and parameters: {'model_type': 'mlp', 'hidden_dims': '[256, 128]', 'dropout': 0.10947683491235861, 'batch_norm': True, 'lr': 1.5422716012878215e-05, 'weight_decay': 4.548559800067128e-05, 'epochs': 208, 'loss': 'mae', 'optimizer': 'adam', 'graph_mode': 'off', 'use_snp_selection': False}. Best is trial 18 with value: 0.11411391432010902.
[I 2025-12-05 14:49:55,754] Trial 131 finished with value: 0.04893369584276276 and parameters: {'model_type': 'mlp', 'hidden_dims': '[256, 128]', 'dropout': 0.14067058811826966, 'batch_norm': True, 'lr': 5.201202945707168e-06, 'weight_decay': 6.494281125494156e-05, 'epochs': 271, 'loss': 'mae', 'optimizer': 'adam', 'graph_mode': 'off', 'use_snp_selection': False}. Best is trial 18 with value: 0.11411391432010902.
[I 2025-12-05 14:49:57,070] Trial 132 finished with value: 0.04917961994576648 and parameters: {'model_type': 'mlp', 'hidden_dims': '[256, 128]', 'dropout': 0.15632567818037216, 'batch_norm': True, 'lr': 1.3192097607475506e-05, 'weight_decay': 7.984367430433321e-05, 'epochs': 226, 'loss': 'mae', 'optimizer': 'adam', 'graph_mode': 'off', 'use_snp_selection': False}. Best is trial 18 with value: 0.11411391432010902.
[I 2025-12-05 14:49:58,559] Trial 133 finished with value: 0.06510965365933664 and parameters: {'model_type': 'mlp', 'hidden_dims': '[256, 128]', 'dropout': 0.13114085776973763, 'batch_norm': True, 'lr': 7.1795761320357195e-06, 'weight_decay': 3.6005447042906225e-05, 'epochs': 276, 'loss': 'mae', 'optimizer': 'adam', 'graph_mode': 'off', 'use_snp_selection': False}. Best is trial 18 with value: 0.11411391432010902.
[I 2025-12-05 14:50:01,003] Trial 134 finished with value: 0.03051534684767871 and parameters: {'model_type': 'mlp', 'hidden_dims': '[512, 256]', 'dropout': 0.324945540403868, 'batch_norm': True, 'lr': 9.13875217945207e-06, 'weight_decay': 2.8742218382492872e-05, 'epochs': 281, 'loss': 'mae', 'optimizer': 'adam', 'graph_mode': 'off', 'use_snp_selection': False}. Best is trial 18 with value: 0.11411391432010902.
[I 2025-12-05 14:50:01,922] Trial 135 finished with value: 0.0630265796285877 and parameters: {'model_type': 'mlp', 'hidden_dims': '[256, 128]', 'dropout': 0.14481786292635213, 'batch_norm': True, 'lr': 6.704415172102404e-06, 'weight_decay': 6.862076040280787e-06, 'epochs': 92, 'loss': 'mae', 'optimizer': 'adam', 'graph_mode': 'off', 'use_snp_selection': False}. Best is trial 18 with value: 0.11411391432010902.
[I 2025-12-05 14:50:03,291] Trial 136 finished with value: 0.06881712095239155 and parameters: {'model_type': 'mlp', 'hidden_dims': '[256, 128]', 'dropout': 0.11725423484031458, 'batch_norm': False, 'lr': 4.485850271285778e-06, 'weight_decay': 1.9043677632945206e-05, 'epochs': 239, 'loss': 'mae', 'optimizer': 'adam', 'graph_mode': 'off', 'use_snp_selection': False}. Best is trial 18 with value: 0.11411391432010902.
[I 2025-12-05 14:50:04,724] Trial 137 finished with value: 0.06336314005706976 and parameters: {'model_type': 'mlp', 'hidden_dims': '[256, 128]', 'dropout': 0.13317109928158583, 'batch_norm': True, 'lr': 1.1898767109307212e-05, 'weight_decay': 1.2328173398760202e-07, 'epochs': 264, 'loss': 'mae', 'optimizer': 'adam', 'graph_mode': 'off', 'use_snp_selection': True, 'num_snps': 13169}. Best is trial 18 with value: 0.11411391432010902.
[I 2025-12-05 14:50:05,996] Trial 138 finished with value: 0.04612459609085975 and parameters: {'model_type': 'mlp', 'hidden_dims': '[256, 128]', 'dropout': 0.24332602126616754, 'batch_norm': False, 'lr': 3.713967111323323e-06, 'weight_decay': 0.00014298943558125016, 'epochs': 217, 'loss': 'mae', 'optimizer': 'adam', 'graph_mode': 'off', 'use_snp_selection': False}. Best is trial 18 with value: 0.11411391432010902.
[I 2025-12-05 14:50:07,425] Trial 139 finished with value: 0.08345943320705472 and parameters: {'model_type': 'mlp', 'hidden_dims': '[256, 128]', 'dropout': 0.16924811048795113, 'batch_norm': True, 'lr': 0.0004118406538038342, 'weight_decay': 5.0487921249528445e-05, 'epochs': 259, 'loss': 'mae', 'optimizer': 'adam', 'graph_mode': 'off', 'use_snp_selection': False}. Best is trial 18 with value: 0.11411391432010902.
[I 2025-12-05 14:50:08,406] Trial 140 finished with value: 0.04224372875064912 and parameters: {'model_type': 'mlp', 'hidden_dims': '[128, 64]', 'dropout': 0.11065836341578639, 'batch_norm': True, 'lr': 8.781767095489833e-06, 'weight_decay': 2.488361539843148e-05, 'epochs': 232, 'loss': 'mae', 'optimizer': 'adam', 'graph_mode': 'off', 'use_snp_selection': False}. Best is trial 18 with value: 0.11411391432010902.
[I 2025-12-05 14:50:09,897] Trial 141 finished with value: 0.07060659710719627 and parameters: {'model_type': 'mlp', 'hidden_dims': '[256, 128]', 'dropout': 0.1227274796737065, 'batch_norm': True, 'lr': 9.583862334845337e-06, 'weight_decay': 1.6892924836948306e-05, 'epochs': 288, 'loss': 'mae', 'optimizer': 'adam', 'graph_mode': 'off', 'use_snp_selection': False}. Best is trial 18 with value: 0.11411391432010902.
[I 2025-12-05 14:50:11,377] Trial 142 finished with value: 0.007610652341487744 and parameters: {'model_type': 'mlp', 'hidden_dims': '[256, 128]', 'dropout': 0.4336074534680649, 'batch_norm': True, 'lr': 5.8169849277507825e-06, 'weight_decay': 1.4907480245609225e-05, 'epochs': 278, 'loss': 'mae', 'optimizer': 'adam', 'graph_mode': 'off', 'use_snp_selection': False}. Best is trial 18 with value: 0.11411391432010902.
[I 2025-12-05 14:50:12,777] Trial 143 finished with value: 0.06612506733303505 and parameters: {'model_type': 'mlp', 'hidden_dims': '[256, 128]', 'dropout': 0.12690082872199152, 'batch_norm': True, 'lr': 1.0668340391189915e-05, 'weight_decay': 1.2007995256740844e-05, 'epochs': 252, 'loss': 'mae', 'optimizer': 'adam', 'graph_mode': 'off', 'use_snp_selection': False}. Best is trial 18 with value: 0.11411391432010902.
[I 2025-12-05 14:50:14,253] Trial 144 finished with value: 0.07189959750278858 and parameters: {'model_type': 'mlp', 'hidden_dims': '[256, 128]', 'dropout': 0.1397316511957113, 'batch_norm': True, 'lr': 1.3312934021525813e-05, 'weight_decay': 6.725074843128385e-05, 'epochs': 270, 'loss': 'mae', 'optimizer': 'adam', 'graph_mode': 'off', 'use_snp_selection': False}. Best is trial 18 with value: 0.11411391432010902.
[I 2025-12-05 14:50:16,716] Trial 145 finished with value: 0.05000795821980221 and parameters: {'model_type': 'mlp', 'hidden_dims': '[512, 64]', 'dropout': 0.44876580571966307, 'batch_norm': True, 'lr': 1.9800484540095032e-05, 'weight_decay': 3.927833106337909e-05, 'epochs': 286, 'loss': 'mae', 'optimizer': 'adam', 'graph_mode': 'off', 'use_snp_selection': False}. Best is trial 18 with value: 0.11411391432010902.
[I 2025-12-05 14:50:17,917] Trial 146 finished with value: 0.06926960117210251 and parameters: {'model_type': 'mlp', 'hidden_dims': '[256, 128]', 'dropout': 0.15123698088322915, 'batch_norm': False, 'lr': 6.20375578198226e-06, 'weight_decay': 2.153430854687119e-05, 'epochs': 298, 'loss': 'mae', 'optimizer': 'adam', 'graph_mode': 'off', 'use_snp_selection': True, 'num_snps': 6870}. Best is trial 18 with value: 0.11411391432010902.
[I 2025-12-05 14:50:20,455] Trial 147 finished with value: 0.03869726507512283 and parameters: {'model_type': 'mlp', 'hidden_dims': '[512, 128]', 'dropout': 0.47426983623064106, 'batch_norm': True, 'lr': 8.002255845728025e-06, 'weight_decay': 3.229937775688486e-05, 'epochs': 297, 'loss': 'mae', 'optimizer': 'adam', 'graph_mode': 'off', 'use_snp_selection': False}. Best is trial 18 with value: 0.11411391432010902.
[I 2025-12-05 14:50:22,348] Trial 148 finished with value: 0.029019846454432854 and parameters: {'model_type': 'mlp', 'hidden_dims': '[512, 64]', 'dropout': 0.5086929926728905, 'batch_norm': True, 'lr': 1.644934667554025e-05, 'weight_decay': 1.3008914960828729e-05, 'epochs': 186, 'loss': 'mse', 'optimizer': 'adam', 'graph_mode': 'off', 'use_snp_selection': False}. Best is trial 18 with value: 0.11411391432010902.
[I 2025-12-05 14:50:23,919] Trial 149 finished with value: 0.10427845512844232 and parameters: {'model_type': 'mlp', 'hidden_dims': '[256, 128, 64]', 'dropout': 0.11259288284752171, 'batch_norm': False, 'lr': 0.00011130067202758103, 'weight_decay': 8.46863991139322e-05, 'epochs': 309, 'loss': 'mae', 'optimizer': 'adam', 'graph_mode': 'off', 'use_snp_selection': False}. Best is trial 18 with value: 0.11411391432010902.
[I 2025-12-05 14:50:26,257] Trial 0 finished with value: 0.045236874318994987 and parameters: {'model_type': 'mlp', 'hidden_dims': '[128, 64]', 'dropout': 0.199031432379812, 'batch_norm': True, 'lr': 1.8408544111075837e-06, 'weight_decay': 5.5136510071208614e-05, 'epochs': 336, 'loss': 'mae', 'optimizer': 'adam', 'graph_mode': 'off', 'use_snp_selection': True, 'num_snps': 43862}. Best is trial 0 with value: 0.045236874318994987.
[I 2025-12-05 14:50:27,484] Trial 1 finished with value: 0.10910283890063324 and parameters: {'model_type': 'mlp', 'hidden_dims': '[256, 128]', 'dropout': 0.4370668075331726, 'batch_norm': True, 'lr': 7.133471581159139e-05, 'weight_decay': 1.128633586803549e-05, 'epochs': 242, 'loss': 'mae', 'optimizer': 'adam', 'graph_mode': 'off', 'use_snp_selection': False}. Best is trial 1 with value: 0.10910283890063324.
[I 2025-12-05 14:50:28,575] Trial 2 finished with value: 0.06584954103873196 and parameters: {'model_type': 'mlp', 'hidden_dims': '[256, 128, 64]', 'dropout': 0.41314357415569625, 'batch_norm': False, 'lr': 3.952233718592101e-06, 'weight_decay': 0.00026754769258252603, 'epochs': 149, 'loss': 'mse', 'optimizer': 'adam', 'graph_mode': 'off', 'use_snp_selection': True, 'num_snps': 11571}. Best is trial 1 with value: 0.10910283890063324.
[I 2025-12-05 14:50:30,838] Trial 3 finished with value: 0.07240525324320507 and parameters: {'model_type': 'mlp', 'hidden_dims': '[512, 64]', 'dropout': 0.5938127374509361, 'batch_norm': False, 'lr': 5.67704586114731e-06, 'weight_decay': 2.4518087630137052e-05, 'epochs': 320, 'loss': 'mae', 'optimizer': 'adam', 'graph_mode': 'off', 'use_snp_selection': False}. Best is trial 1 with value: 0.10910283890063324.
[I 2025-12-05 14:50:33,276] Trial 4 finished with value: 0.05768710322198927 and parameters: {'model_type': 'mlp', 'hidden_dims': '[512, 128]', 'dropout': 0.25746343592134413, 'batch_norm': True, 'lr': 1.3467657668402788e-06, 'weight_decay': 0.00033087251918647806, 'epochs': 277, 'loss': 'mse', 'optimizer': 'adam', 'graph_mode': 'off', 'use_snp_selection': True, 'num_snps': 36675}. Best is trial 1 with value: 0.10910283890063324.
[I 2025-12-05 14:50:35,202] Trial 5 finished with value: 0.020310388959600727 and parameters: {'model_type': 'mlp', 'hidden_dims': '[512, 64]', 'dropout': 0.38275350994408375, 'batch_norm': True, 'lr': 1.5586664309232824e-06, 'weight_decay': 0.0008227664668621182, 'epochs': 145, 'loss': 'mae', 'optimizer': 'adam', 'graph_mode': 'off', 'use_snp_selection': True, 'num_snps': 32148}. Best is trial 1 with value: 0.10910283890063324.
[I 2025-12-05 14:50:36,316] Trial 6 finished with value: 0.12739303931365237 and parameters: {'model_type': 'mlp', 'hidden_dims': '[256, 128]', 'dropout': 0.3930109900265879, 'batch_norm': False, 'lr': 4.892964372128395e-05, 'weight_decay': 1.5809549317992182e-06, 'epochs': 199, 'loss': 'mse', 'optimizer': 'adam', 'graph_mode': 'off', 'use_snp_selection': False}. Best is trial 6 with value: 0.12739303931365237.
[I 2025-12-05 14:50:37,525] Trial 7 finished with value: 0.1262763810989041 and parameters: {'model_type': 'mlp', 'hidden_dims': '[512, 256]', 'dropout': 0.15343979219678458, 'batch_norm': True, 'lr': 6.234003099047341e-05, 'weight_decay': 3.894760610535477e-07, 'epochs': 97, 'loss': 'mse', 'optimizer': 'adam', 'graph_mode': 'off', 'use_snp_selection': False}. Best is trial 6 with value: 0.12739303931365237.
[I 2025-12-05 14:50:39,774] Trial 8 finished with value: 0.13106529662383581 and parameters: {'model_type': 'mlp', 'hidden_dims': '[512, 128]', 'dropout': 0.10743001231661406, 'batch_norm': True, 'lr': 0.00023728538449271062, 'weight_decay': 1.7629071578048637e-05, 'epochs': 312, 'loss': 'mae', 'optimizer': 'adam', 'graph_mode': 'off', 'use_snp_selection': False}. Best is trial 8 with value: 0.13106529662383581.
[I 2025-12-05 14:50:41,386] Trial 9 finished with value: 0.14006061642029918 and parameters: {'model_type': 'mlp', 'hidden_dims': '[512, 64]', 'dropout': 0.14505336736221927, 'batch_norm': True, 'lr': 5.8619638388111826e-05, 'weight_decay': 6.200156172669308e-07, 'epochs': 175, 'loss': 'mse', 'optimizer': 'adam', 'graph_mode': 'off', 'use_snp_selection': False}. Best is trial 9 with value: 0.14006061642029918.
[I 2025-12-05 14:50:42,377] Trial 10 finished with value: 0.014561121321724118 and parameters: {'model_type': 'mlp', 'hidden_dims': '[512, 64]', 'dropout': 0.27531666245262887, 'batch_norm': False, 'lr': 0.00032393778075602147, 'weight_decay': 1.1714031539166647e-07, 'epochs': 44, 'loss': 'mse', 'optimizer': 'adam', 'graph_mode': 'off', 'use_snp_selection': False}. Best is trial 9 with value: 0.14006061642029918.
[I 2025-12-05 14:50:44,190] Trial 11 finished with value: 0.120595895076484 and parameters: {'model_type': 'mlp', 'hidden_dims': '[512, 128]', 'dropout': 0.10095648685224448, 'batch_norm': True, 'lr': 0.0007381466848241802, 'weight_decay': 1.969664044175748e-06, 'epochs': 216, 'loss': 'mae', 'optimizer': 'adam', 'graph_mode': 'off', 'use_snp_selection': False}. Best is trial 9 with value: 0.14006061642029918.
[I 2025-12-05 14:50:46,305] Trial 12 finished with value: 0.12712395337117244 and parameters: {'model_type': 'mlp', 'hidden_dims': '[512, 128]', 'dropout': 0.10344600881777158, 'batch_norm': True, 'lr': 0.00018400807026440393, 'weight_decay': 2.652725854953085e-06, 'epochs': 281, 'loss': 'mae', 'optimizer': 'adam', 'graph_mode': 'off', 'use_snp_selection': False}. Best is trial 9 with value: 0.14006061642029918.
[I 2025-12-05 14:50:47,119] Trial 13 finished with value: 0.06088621854383163 and parameters: {'model_type': 'mlp', 'hidden_dims': '[128, 64]', 'dropout': 0.21562224788131257, 'batch_norm': True, 'lr': 1.343038855084232e-05, 'weight_decay': 5.9577988329204815e-05, 'epochs': 156, 'loss': 'mse', 'optimizer': 'adam', 'graph_mode': 'off', 'use_snp_selection': False}. Best is trial 9 with value: 0.14006061642029918.
[I 2025-12-05 14:50:48,472] Trial 14 finished with value: 0.13307528939336455 and parameters: {'model_type': 'mlp', 'hidden_dims': '[256, 128, 64]', 'dropout': 0.3012984444538551, 'batch_norm': True, 'lr': 0.00017558188744418174, 'weight_decay': 4.841366235436571e-06, 'epochs': 262, 'loss': 'mse', 'optimizer': 'adam', 'graph_mode': 'off', 'use_snp_selection': False}. Best is trial 9 with value: 0.14006061642029918.
[I 2025-12-05 14:50:49,746] Trial 15 finished with value: 0.13452945396128305 and parameters: {'model_type': 'mlp', 'hidden_dims': '[256, 128, 64]', 'dropout': 0.31359178219967865, 'batch_norm': True, 'lr': 1.89989485263331e-05, 'weight_decay': 4.5695438936681996e-07, 'epochs': 231, 'loss': 'mse', 'optimizer': 'adam', 'graph_mode': 'off', 'use_snp_selection': False}. Best is trial 9 with value: 0.14006061642029918.
[I 2025-12-05 14:50:50,856] Trial 16 finished with value: 0.08186126502290841 and parameters: {'model_type': 'mlp', 'hidden_dims': '[256, 128, 64]', 'dropout': 0.49687416814791446, 'batch_norm': True, 'lr': 2.020613287813334e-05, 'weight_decay': 5.288879860867798e-07, 'epochs': 170, 'loss': 'mse', 'optimizer': 'adam', 'graph_mode': 'off', 'use_snp_selection': False}. Best is trial 9 with value: 0.14006061642029918.
[I 2025-12-05 14:50:52,082] Trial 17 finished with value: 0.04761067411271668 and parameters: {'model_type': 'mlp', 'hidden_dims': '[512, 256]', 'dropout': 0.32888830259108426, 'batch_norm': True, 'lr': 9.860999992103347e-06, 'weight_decay': 1.3703928200152247e-07, 'epochs': 88, 'loss': 'mse', 'optimizer': 'adam', 'graph_mode': 'off', 'use_snp_selection': False}. Best is trial 9 with value: 0.14006061642029918.
[I 2025-12-05 14:50:55,148] Trial 18 finished with value: 0.10086707802836468 and parameters: {'model_type': 'mlp', 'hidden_dims': '[256, 128, 64]', 'dropout': 0.5098431992326697, 'batch_norm': False, 'lr': 2.797772152750264e-05, 'weight_decay': 5.366019376428184e-07, 'epochs': 213, 'loss': 'mse', 'optimizer': 'adam', 'graph_mode': 'off', 'use_snp_selection': True, 'num_snps': 58241}. Best is trial 9 with value: 0.14006061642029918.
[I 2025-12-05 14:50:56,568] Trial 19 finished with value: 0.12007676902851065 and parameters: {'model_type': 'mlp', 'hidden_dims': '[512, 64]', 'dropout': 0.21482453924325612, 'batch_norm': True, 'lr': 3.894031016016926e-05, 'weight_decay': 2.714195880240099e-07, 'epochs': 119, 'loss': 'mse', 'optimizer': 'adam', 'graph_mode': 'off', 'use_snp_selection': False}. Best is trial 9 with value: 0.14006061642029918.
[I 2025-12-05 14:50:58,472] Trial 20 finished with value: 0.13808666247880058 and parameters: {'model_type': 'mlp', 'hidden_dims': '[512, 64]', 'dropout': 0.16614018505263262, 'batch_norm': True, 'lr': 0.00010303661336735763, 'weight_decay': 9.196626925486478e-07, 'epochs': 239, 'loss': 'mse', 'optimizer': 'adam', 'graph_mode': 'off', 'use_snp_selection': False}. Best is trial 9 with value: 0.14006061642029918.
[I 2025-12-05 14:51:00,381] Trial 21 finished with value: 0.14689517948224912 and parameters: {'model_type': 'mlp', 'hidden_dims': '[512, 64]', 'dropout': 0.17213934804952746, 'batch_norm': True, 'lr': 0.00011467620668229786, 'weight_decay': 1.0611586441718242e-06, 'epochs': 236, 'loss': 'mse', 'optimizer': 'adam', 'graph_mode': 'off', 'use_snp_selection': False}. Best is trial 21 with value: 0.14689517948224912.
[I 2025-12-05 14:51:02,040] Trial 22 finished with value: 0.12611408707972935 and parameters: {'model_type': 'mlp', 'hidden_dims': '[512, 64]', 'dropout': 0.16482687806697485, 'batch_norm': True, 'lr': 0.00011577917763340625, 'weight_decay': 1.190967438013041e-06, 'epochs': 181, 'loss': 'mse', 'optimizer': 'adam', 'graph_mode': 'off', 'use_snp_selection': False}. Best is trial 21 with value: 0.14689517948224912.
[I 2025-12-05 14:51:04,047] Trial 23 finished with value: 0.13710350218939363 and parameters: {'model_type': 'mlp', 'hidden_dims': '[512, 64]', 'dropout': 0.15248970155182617, 'batch_norm': True, 'lr': 0.0005456074953648887, 'weight_decay': 4.141044331777251e-06, 'epochs': 258, 'loss': 'mse', 'optimizer': 'adam', 'graph_mode': 'off', 'use_snp_selection': False}. Best is trial 21 with value: 0.14689517948224912.
[I 2025-12-05 14:51:05,764] Trial 24 finished with value: 0.1412485725163442 and parameters: {'model_type': 'mlp', 'hidden_dims': '[512, 64]', 'dropout': 0.24524453359542225, 'batch_norm': True, 'lr': 9.417846860484307e-05, 'weight_decay': 9.238210375282749e-07, 'epochs': 197, 'loss': 'mse', 'optimizer': 'adam', 'graph_mode': 'off', 'use_snp_selection': False}. Best is trial 21 with value: 0.14689517948224912.
