[I 2025-12-05 15:28:08,398] Trial 52 finished with value: 0.2796503056705729 and parameters: {'model_type': 'mlp', 'hidden_dims': '[256, 128]', 'dropout': 0.5530260665395138, 'batch_norm': False, 'lr': 7.973559622190223e-05, 'weight_decay': 4.566714184671474e-07, 'epochs': 161, 'loss': 'mse', 'optimizer': 'adam', 'graph_mode': 'off', 'use_snp_selection': False}. Best is trial 42 with value: 0.28439639703244574.
[I 2025-12-05 15:28:23,746] Trial 53 finished with value: 0.2777446612578908 and parameters: {'model_type': 'mlp', 'hidden_dims': '[256, 128]', 'dropout': 0.5566425757072344, 'batch_norm': False, 'lr': 8.149410690059423e-05, 'weight_decay': 3.683383140471931e-07, 'epochs': 118, 'loss': 'mse', 'optimizer': 'adam', 'graph_mode': 'off', 'use_snp_selection': False}. Best is trial 42 with value: 0.28439639703244574.
[I 2025-12-05 15:28:39,634] Trial 54 finished with value: 0.215201582499375 and parameters: {'model_type': 'mlp', 'hidden_dims': '[256, 128]', 'dropout': 0.5649834156303403, 'batch_norm': False, 'lr': 8.729369620548301e-05, 'weight_decay': 4.357325957457822e-07, 'epochs': 124, 'loss': 'mse', 'optimizer': 'adam', 'graph_mode': 'off', 'use_snp_selection': False}. Best is trial 42 with value: 0.28439639703244574.
[I 2025-12-05 15:28:58,969] Trial 55 finished with value: 0.2714028240683025 and parameters: {'model_type': 'mlp', 'hidden_dims': '[256, 128]', 'dropout': 0.5734689180256172, 'batch_norm': False, 'lr': 0.00027199553471547543, 'weight_decay': 1.086344998526784e-06, 'epochs': 162, 'loss': 'mse', 'optimizer': 'adam', 'graph_mode': 'off', 'use_snp_selection': False}. Best is trial 42 with value: 0.28439639703244574.
[I 2025-12-05 15:29:13,496] Trial 56 finished with value: 0.2785666422308727 and parameters: {'model_type': 'mlp', 'hidden_dims': '[256, 128]', 'dropout': 0.5156396759397935, 'batch_norm': False, 'lr': 0.0001439978602605423, 'weight_decay': 2.3612309955622514e-06, 'epochs': 109, 'loss': 'mse', 'optimizer': 'adam', 'graph_mode': 'off', 'use_snp_selection': False}. Best is trial 42 with value: 0.28439639703244574.
[I 2025-12-05 15:29:28,727] Trial 57 finished with value: 0.27787448708192636 and parameters: {'model_type': 'mlp', 'hidden_dims': '[256, 128]', 'dropout': 0.5167477826766433, 'batch_norm': False, 'lr': 4.1156190662757985e-05, 'weight_decay': 2.834624192152983e-06, 'epochs': 116, 'loss': 'mse', 'optimizer': 'adam', 'graph_mode': 'off', 'use_snp_selection': False}. Best is trial 42 with value: 0.28439639703244574.
[I 2025-12-05 15:29:42,576] Trial 58 finished with value: 0.27912516511936813 and parameters: {'model_type': 'mlp', 'hidden_dims': '[256, 128]', 'dropout': 0.5078632198749963, 'batch_norm': False, 'lr': 4.3238165589036855e-05, 'weight_decay': 2.59483222210962e-06, 'epochs': 101, 'loss': 'mse', 'optimizer': 'adam', 'graph_mode': 'off', 'use_snp_selection': False}. Best is trial 42 with value: 0.28439639703244574.
[I 2025-12-05 15:29:56,267] Trial 59 finished with value: 0.2812628395912864 and parameters: {'model_type': 'mlp', 'hidden_dims': '[256, 128]', 'dropout': 0.49439336484118795, 'batch_norm': False, 'lr': 2.9183996110086917e-05, 'weight_decay': 2.1912350954200655e-06, 'epochs': 100, 'loss': 'mse', 'optimizer': 'adam', 'graph_mode': 'off', 'use_snp_selection': False}. Best is trial 42 with value: 0.28439639703244574.
[I 2025-12-05 15:30:08,393] Trial 60 finished with value: 0.2731791762620606 and parameters: {'model_type': 'mlp', 'hidden_dims': '[256, 128]', 'dropout': 0.5997922157574546, 'batch_norm': False, 'lr': 2.589295483433803e-05, 'weight_decay': 6.182569835255035e-07, 'epochs': 82, 'loss': 'mse', 'optimizer': 'adam', 'graph_mode': 'off', 'use_snp_selection': False}. Best is trial 42 with value: 0.28439639703244574.
[I 2025-12-05 15:30:22,237] Trial 61 finished with value: 0.267628897957198 and parameters: {'model_type': 'mlp', 'hidden_dims': '[256, 128]', 'dropout': 0.49119396861679243, 'batch_norm': False, 'lr': 0.000134295793025613, 'weight_decay': 2.095339482487671e-06, 'epochs': 101, 'loss': 'mse', 'optimizer': 'adam', 'graph_mode': 'off', 'use_snp_selection': False}. Best is trial 42 with value: 0.28439639703244574.
[I 2025-12-05 15:30:38,779] Trial 62 finished with value: 0.28112852643784947 and parameters: {'model_type': 'mlp', 'hidden_dims': '[256, 128]', 'dropout': 0.43883075141530975, 'batch_norm': False, 'lr': 7.017397785026862e-05, 'weight_decay': 2.0317693203092545e-06, 'epochs': 131, 'loss': 'mse', 'optimizer': 'adam', 'graph_mode': 'off', 'use_snp_selection': False}. Best is trial 42 with value: 0.28439639703244574.
[I 2025-12-05 15:31:00,328] Trial 63 finished with value: 0.28047292562002724 and parameters: {'model_type': 'mlp', 'hidden_dims': '[256, 128]', 'dropout': 0.5382851620613146, 'batch_norm': False, 'lr': 3.107938861186126e-05, 'weight_decay': 3.691972151853266e-06, 'epochs': 186, 'loss': 'mse', 'optimizer': 'adam', 'graph_mode': 'off', 'use_snp_selection': False}. Best is trial 42 with value: 0.28439639703244574.
[I 2025-12-05 15:31:21,489] Trial 64 finished with value: 0.2717587016970962 and parameters: {'model_type': 'mlp', 'hidden_dims': '[256, 128]', 'dropout': 0.5427266643806709, 'batch_norm': False, 'lr': 7.236999676996625e-05, 'weight_decay': 3.816348835549327e-06, 'epochs': 182, 'loss': 'mse', 'optimizer': 'adam', 'graph_mode': 'off', 'use_snp_selection': False}. Best is trial 42 with value: 0.28439639703244574.
[I 2025-12-05 15:31:40,386] Trial 65 finished with value: 0.2787348676530897 and parameters: {'model_type': 'mlp', 'hidden_dims': '[256, 128]', 'dropout': 0.4455111856879095, 'batch_norm': False, 'lr': 3.170427277762936e-05, 'weight_decay': 1.294890607901381e-05, 'epochs': 157, 'loss': 'mse', 'optimizer': 'adam', 'graph_mode': 'off', 'use_snp_selection': False}. Best is trial 42 with value: 0.28439639703244574.
[I 2025-12-05 15:32:02,953] Trial 66 finished with value: 0.2545684621012506 and parameters: {'model_type': 'mlp', 'hidden_dims': '[256, 128]', 'dropout': 0.533630326281574, 'batch_norm': False, 'lr': 2.323519147386863e-05, 'weight_decay': 8.865904404436494e-06, 'epochs': 135, 'loss': 'mse', 'optimizer': 'adam', 'graph_mode': 'off', 'use_snp_selection': True, 'num_snps': 3487}. Best is trial 42 with value: 0.28439639703244574.
[I 2025-12-05 15:32:24,752] Trial 67 finished with value: 0.2714512586706962 and parameters: {'model_type': 'mlp', 'hidden_dims': '[256, 128]', 'dropout': 0.4570989524039003, 'batch_norm': False, 'lr': 6.270191208415454e-05, 'weight_decay': 1.0310239240714743e-06, 'epochs': 189, 'loss': 'mse', 'optimizer': 'adam', 'graph_mode': 'off', 'use_snp_selection': False}. Best is trial 42 with value: 0.28439639703244574.
[I 2025-12-05 15:32:42,398] Trial 68 finished with value: 0.2754163937231729 and parameters: {'model_type': 'mlp', 'hidden_dims': '[256, 128]', 'dropout': 0.4946448618433531, 'batch_norm': False, 'lr': 0.0001079896746702464, 'weight_decay': 1.850405570548558e-06, 'epochs': 143, 'loss': 'mse', 'optimizer': 'adam', 'graph_mode': 'off', 'use_snp_selection': False}. Best is trial 42 with value: 0.28439639703244574.
[I 2025-12-05 15:33:00,759] Trial 69 finished with value: 0.27290569722047187 and parameters: {'model_type': 'mlp', 'hidden_dims': '[256, 128]', 'dropout': 0.4304873693047696, 'batch_norm': False, 'lr': 1.8277485152429638e-05, 'weight_decay': 7.574100647437207e-06, 'epochs': 151, 'loss': 'mse', 'optimizer': 'adam', 'graph_mode': 'off', 'use_snp_selection': False}. Best is trial 42 with value: 0.28439639703244574.
[I 2025-12-05 15:33:17,674] Trial 70 finished with value: 0.25873557802767166 and parameters: {'model_type': 'mlp', 'hidden_dims': '[512, 256]', 'dropout': 0.5871330021865104, 'batch_norm': False, 'lr': 3.601304672146967e-06, 'weight_decay': 6.2375689876296644e-06, 'epochs': 67, 'loss': 'mse', 'optimizer': 'adam', 'graph_mode': 'off', 'use_snp_selection': False}. Best is trial 42 with value: 0.28439639703244574.
[I 2025-12-05 15:33:30,479] Trial 71 finished with value: 0.27686654115847853 and parameters: {'model_type': 'mlp', 'hidden_dims': '[256, 128]', 'dropout': 0.47582398151213695, 'batch_norm': False, 'lr': 4.52528401926674e-05, 'weight_decay': 4.320773173636811e-06, 'epochs': 90, 'loss': 'mse', 'optimizer': 'adam', 'graph_mode': 'off', 'use_snp_selection': False}. Best is trial 42 with value: 0.28439639703244574.
[I 2025-12-05 15:33:44,580] Trial 72 finished with value: 0.27763909779927365 and parameters: {'model_type': 'mlp', 'hidden_dims': '[256, 128]', 'dropout': 0.5059446262751114, 'batch_norm': False, 'lr': 3.176302796735016e-05, 'weight_decay': 1.242776061530256e-06, 'epochs': 104, 'loss': 'mse', 'optimizer': 'adam', 'graph_mode': 'off', 'use_snp_selection': False}. Best is trial 42 with value: 0.28439639703244574.
[I 2025-12-05 15:33:57,586] Trial 73 finished with value: 0.27485339830429795 and parameters: {'model_type': 'mlp', 'hidden_dims': '[256, 128]', 'dropout': 0.5481774706596295, 'batch_norm': False, 'lr': 4.345768695439179e-05, 'weight_decay': 3.464711561616581e-06, 'epochs': 92, 'loss': 'mse', 'optimizer': 'adam', 'graph_mode': 'off', 'use_snp_selection': False}. Best is trial 42 with value: 0.28439639703244574.
[I 2025-12-05 15:34:11,892] Trial 74 finished with value: 0.28253165087567716 and parameters: {'model_type': 'mlp', 'hidden_dims': '[128, 64]', 'dropout': 0.5338961168623633, 'batch_norm': False, 'lr': 3.5857243337665006e-05, 'weight_decay': 1.2009555089435536e-07, 'epochs': 192, 'loss': 'mse', 'optimizer': 'adam', 'graph_mode': 'off', 'use_snp_selection': False}. Best is trial 42 with value: 0.28439639703244574.
[I 2025-12-05 15:34:26,728] Trial 75 finished with value: 0.2681383832931794 and parameters: {'model_type': 'mlp', 'hidden_dims': '[128, 64]', 'dropout': 0.573460159472479, 'batch_norm': False, 'lr': 6.629766641179217e-05, 'weight_decay': 1.163052186321465e-07, 'epochs': 202, 'loss': 'mse', 'optimizer': 'adam', 'graph_mode': 'off', 'use_snp_selection': False}. Best is trial 42 with value: 0.28439639703244574.
[I 2025-12-05 15:34:40,820] Trial 76 finished with value: 0.2814264739506235 and parameters: {'model_type': 'mlp', 'hidden_dims': '[128, 64]', 'dropout': 0.5277289412563804, 'batch_norm': False, 'lr': 2.8565481338685498e-05, 'weight_decay': 1.9456210429738255e-07, 'epochs': 187, 'loss': 'mse', 'optimizer': 'adam', 'graph_mode': 'off', 'use_snp_selection': False}. Best is trial 42 with value: 0.28439639703244574.
[I 2025-12-05 15:34:55,218] Trial 77 finished with value: 0.28185378333714306 and parameters: {'model_type': 'mlp', 'hidden_dims': '[128, 64]', 'dropout': 0.5270999667745655, 'batch_norm': False, 'lr': 2.6572589840189118e-05, 'weight_decay': 1.3591496199864877e-07, 'epochs': 193, 'loss': 'mse', 'optimizer': 'adam', 'graph_mode': 'off', 'use_snp_selection': False}. Best is trial 42 with value: 0.28439639703244574.
[I 2025-12-05 15:35:37,535] Trial 78 finished with value: 0.2782748294115333 and parameters: {'model_type': 'mlp', 'hidden_dims': '[128, 64]', 'dropout': 0.530017902406277, 'batch_norm': False, 'lr': 1.8900095554307466e-05, 'weight_decay': 1.3963631004105988e-07, 'epochs': 214, 'loss': 'mse', 'optimizer': 'adam', 'graph_mode': 'off', 'use_snp_selection': True, 'num_snps': 47926}. Best is trial 42 with value: 0.28439639703244574.
[I 2025-12-05 15:35:51,945] Trial 79 finished with value: 0.28286801743707474 and parameters: {'model_type': 'mlp', 'hidden_dims': '[128, 64]', 'dropout': 0.4691535779164317, 'batch_norm': False, 'lr': 2.752456207860258e-05, 'weight_decay': 1.2525171270325183e-07, 'epochs': 194, 'loss': 'mse', 'optimizer': 'adam', 'graph_mode': 'off', 'use_snp_selection': False}. Best is trial 42 with value: 0.28439639703244574.
[I 2025-12-05 15:36:06,267] Trial 80 finished with value: 0.2760311960981695 and parameters: {'model_type': 'mlp', 'hidden_dims': '[128, 64]', 'dropout': 0.4258063460195122, 'batch_norm': False, 'lr': 2.716156248908069e-05, 'weight_decay': 2.0978057903676583e-07, 'epochs': 192, 'loss': 'mse', 'optimizer': 'adam', 'graph_mode': 'off', 'use_snp_selection': False}. Best is trial 42 with value: 0.28439639703244574.
[I 2025-12-05 15:36:20,211] Trial 81 finished with value: 0.27767170746124126 and parameters: {'model_type': 'mlp', 'hidden_dims': '[128, 64]', 'dropout': 0.4635316030007661, 'batch_norm': False, 'lr': 3.670501238829746e-05, 'weight_decay': 1.2854455636018657e-07, 'epochs': 184, 'loss': 'mse', 'optimizer': 'adam', 'graph_mode': 'off', 'use_snp_selection': False}. Best is trial 42 with value: 0.28439639703244574.
[I 2025-12-05 15:36:36,043] Trial 82 finished with value: 0.2843158222093168 and parameters: {'model_type': 'mlp', 'hidden_dims': '[128, 64]', 'dropout': 0.48773213261813747, 'batch_norm': False, 'lr': 1.8779458212317987e-05, 'weight_decay': 1.0117173034944313e-07, 'epochs': 221, 'loss': 'mse', 'optimizer': 'adam', 'graph_mode': 'off', 'use_snp_selection': False}. Best is trial 42 with value: 0.28439639703244574.
[I 2025-12-05 15:36:51,952] Trial 83 finished with value: 0.2764918616488254 and parameters: {'model_type': 'mlp', 'hidden_dims': '[128, 64]', 'dropout': 0.4867390358796042, 'batch_norm': False, 'lr': 2.080700279576102e-05, 'weight_decay': 1.0736888717070064e-07, 'epochs': 222, 'loss': 'mse', 'optimizer': 'adam', 'graph_mode': 'off', 'use_snp_selection': False}. Best is trial 42 with value: 0.28439639703244574.
[I 2025-12-05 15:37:06,633] Trial 84 finished with value: 0.27753434234014895 and parameters: {'model_type': 'mlp', 'hidden_dims': '[128, 64]', 'dropout': 0.5033583754130723, 'batch_norm': False, 'lr': 1.5976142313566443e-05, 'weight_decay': 2.69340892328462e-07, 'epochs': 199, 'loss': 'mse', 'optimizer': 'adam', 'graph_mode': 'off', 'use_snp_selection': False}. Best is trial 42 with value: 0.28439639703244574.
[I 2025-12-05 15:37:23,781] Trial 85 finished with value: 0.27120843232645797 and parameters: {'model_type': 'mlp', 'hidden_dims': '[128, 64]', 'dropout': 0.3777026233804489, 'batch_norm': False, 'lr': 5.177597152964774e-05, 'weight_decay': 1.6081527351468513e-07, 'epochs': 247, 'loss': 'mse', 'optimizer': 'adam', 'graph_mode': 'off', 'use_snp_selection': False}. Best is trial 42 with value: 0.28439639703244574.
[I 2025-12-05 15:37:39,849] Trial 86 finished with value: 0.27498216574114037 and parameters: {'model_type': 'mlp', 'hidden_dims': '[128, 64]', 'dropout': 0.5250903868480667, 'batch_norm': False, 'lr': 2.9110454248101066e-05, 'weight_decay': 2.0572232034020453e-07, 'epochs': 226, 'loss': 'mse', 'optimizer': 'adam', 'graph_mode': 'off', 'use_snp_selection': False}. Best is trial 42 with value: 0.28439639703244574.
[I 2025-12-05 15:37:53,495] Trial 87 finished with value: 0.2857285364616648 and parameters: {'model_type': 'mlp', 'hidden_dims': '[128, 64]', 'dropout': 0.48001537244682346, 'batch_norm': False, 'lr': 1.2606940988685383e-05, 'weight_decay': 2.766610371575507e-07, 'epochs': 179, 'loss': 'mse', 'optimizer': 'adam', 'graph_mode': 'off', 'use_snp_selection': False}. Best is trial 87 with value: 0.2857285364616648.
[I 2025-12-05 15:38:08,972] Trial 88 finished with value: 0.27922561960614667 and parameters: {'model_type': 'mlp', 'hidden_dims': '[128, 64]', 'dropout': 0.4779864628985162, 'batch_norm': False, 'lr': 1.2480680205641469e-05, 'weight_decay': 2.85407228924281e-07, 'epochs': 215, 'loss': 'mse', 'optimizer': 'adam', 'graph_mode': 'off', 'use_snp_selection': False}. Best is trial 87 with value: 0.2857285364616648.
[I 2025-12-05 15:38:22,635] Trial 89 finished with value: 0.2790847403971397 and parameters: {'model_type': 'mlp', 'hidden_dims': '[128, 64]', 'dropout': 0.46055717447974154, 'batch_norm': False, 'lr': 1.610290926243048e-05, 'weight_decay': 1.0126410466190219e-07, 'epochs': 179, 'loss': 'mse', 'optimizer': 'adam', 'graph_mode': 'off', 'use_snp_selection': False}. Best is trial 87 with value: 0.2857285364616648.
[I 2025-12-05 15:38:51,405] Trial 90 finished with value: 0.2729783795794779 and parameters: {'model_type': 'mlp', 'hidden_dims': '[128, 64]', 'dropout': 0.4961878821932238, 'batch_norm': False, 'lr': 1.0985324697340591e-05, 'weight_decay': 2.261501885526654e-07, 'epochs': 170, 'loss': 'mse', 'optimizer': 'adam', 'graph_mode': 'off', 'use_snp_selection': True, 'num_snps': 18400}. Best is trial 87 with value: 0.2857285364616648.
[I 2025-12-05 15:39:06,396] Trial 91 finished with value: 0.2806178322825071 and parameters: {'model_type': 'mlp', 'hidden_dims': '[128, 64]', 'dropout': 0.4469492762141211, 'batch_norm': False, 'lr': 3.4571308422293745e-05, 'weight_decay': 1.729130422215741e-07, 'epochs': 205, 'loss': 'mse', 'optimizer': 'adam', 'graph_mode': 'off', 'use_snp_selection': False}. Best is trial 87 with value: 0.2857285364616648.
[I 2025-12-05 15:39:21,322] Trial 92 finished with value: 0.27658143975638627 and parameters: {'model_type': 'mlp', 'hidden_dims': '[128, 64]', 'dropout': 0.4479476315064842, 'batch_norm': False, 'lr': 3.7854187445318314e-05, 'weight_decay': 1.413317717610802e-07, 'epochs': 204, 'loss': 'mse', 'optimizer': 'adam', 'graph_mode': 'off', 'use_snp_selection': False}. Best is trial 87 with value: 0.2857285364616648.
[I 2025-12-05 15:39:35,772] Trial 93 finished with value: 0.2763546854885373 and parameters: {'model_type': 'mlp', 'hidden_dims': '[128, 64]', 'dropout': 0.42370207087949574, 'batch_norm': False, 'lr': 2.2956312215650602e-05, 'weight_decay': 1.6412895985516352e-07, 'epochs': 195, 'loss': 'mse', 'optimizer': 'adam', 'graph_mode': 'off', 'use_snp_selection': False}. Best is trial 87 with value: 0.2857285364616648.
[I 2025-12-05 15:39:52,013] Trial 94 finished with value: 0.2821833537330497 and parameters: {'model_type': 'mlp', 'hidden_dims': '[128, 64]', 'dropout': 0.474081826767323, 'batch_norm': False, 'lr': 2.126966617824139e-05, 'weight_decay': 1.9041970678387044e-07, 'epochs': 229, 'loss': 'mse', 'optimizer': 'adam', 'graph_mode': 'off', 'use_snp_selection': False}. Best is trial 87 with value: 0.2857285364616648.
[I 2025-12-05 15:40:08,637] Trial 95 finished with value: 0.2813734375379794 and parameters: {'model_type': 'mlp', 'hidden_dims': '[128, 64]', 'dropout': 0.47011795020018643, 'batch_norm': False, 'lr': 2.0675396251427613e-05, 'weight_decay': 3.331179982603052e-07, 'epochs': 236, 'loss': 'mse', 'optimizer': 'adam', 'graph_mode': 'off', 'use_snp_selection': False}. Best is trial 87 with value: 0.2857285364616648.
[I 2025-12-05 15:40:25,200] Trial 96 finished with value: 0.27836412677146205 and parameters: {'model_type': 'mlp', 'hidden_dims': '[128, 64]', 'dropout': 0.5208478343387223, 'batch_norm': False, 'lr': 1.4157561240008656e-05, 'weight_decay': 3.240457795906948e-07, 'epochs': 235, 'loss': 'mse', 'optimizer': 'adam', 'graph_mode': 'off', 'use_snp_selection': False}. Best is trial 87 with value: 0.2857285364616648.
[I 2025-12-05 15:40:42,699] Trial 97 finished with value: 0.27636093740104395 and parameters: {'model_type': 'mlp', 'hidden_dims': '[128, 64]', 'dropout': 0.4714367115909716, 'batch_norm': False, 'lr': 1.851806446311218e-05, 'weight_decay': 2.391738579977154e-07, 'epochs': 254, 'loss': 'mse', 'optimizer': 'adam', 'graph_mode': 'off', 'use_snp_selection': False}. Best is trial 87 with value: 0.2857285364616648.
[I 2025-12-05 15:40:58,529] Trial 98 finished with value: 0.2787181820609269 and parameters: {'model_type': 'mlp', 'hidden_dims': '[128, 64]', 'dropout': 0.41217568060085874, 'batch_norm': False, 'lr': 8.563056320241105e-06, 'weight_decay': 5.099931072547316e-07, 'epochs': 221, 'loss': 'mse', 'optimizer': 'adam', 'graph_mode': 'off', 'use_snp_selection': False}. Best is trial 87 with value: 0.2857285364616648.
[I 2025-12-05 15:41:14,806] Trial 99 finished with value: 0.2748920006426477 and parameters: {'model_type': 'mlp', 'hidden_dims': '[128, 64]', 'dropout': 0.4832727149027819, 'batch_norm': False, 'lr': 2.3068205903423835e-05, 'weight_decay': 3.83039802196668e-07, 'epochs': 230, 'loss': 'mse', 'optimizer': 'adam', 'graph_mode': 'off', 'use_snp_selection': False}. Best is trial 87 with value: 0.2857285364616648.
[I 2025-12-05 15:41:30,163] Trial 100 finished with value: 0.2789869809474882 and parameters: {'model_type': 'mlp', 'hidden_dims': '[128, 64]', 'dropout': 0.39898878313729635, 'batch_norm': False, 'lr': 1.998531839574552e-05, 'weight_decay': 7.241139811487929e-07, 'epochs': 211, 'loss': 'mse', 'optimizer': 'adam', 'graph_mode': 'off', 'use_snp_selection': False}. Best is trial 87 with value: 0.2857285364616648.
[I 2025-12-05 15:41:47,119] Trial 101 finished with value: 0.27347229101081316 and parameters: {'model_type': 'mlp', 'hidden_dims': '[128, 64]', 'dropout': 0.5023675153336725, 'batch_norm': False, 'lr': 2.755295890740841e-05, 'weight_decay': 1.2952142271668684e-07, 'epochs': 242, 'loss': 'mse', 'optimizer': 'adam', 'graph_mode': 'off', 'use_snp_selection': False}. Best is trial 87 with value: 0.2857285364616648.
[I 2025-12-05 15:42:07,777] Trial 102 finished with value: 0.2696225937165445 and parameters: {'model_type': 'mlp', 'hidden_dims': '[256, 128, 64]', 'dropout': 0.4653327395087525, 'batch_norm': False, 'lr': 5.104720591635787e-05, 'weight_decay': 2.0040952277072157e-07, 'epochs': 175, 'loss': 'mse', 'optimizer': 'adam', 'graph_mode': 'off', 'use_snp_selection': False}. Best is trial 87 with value: 0.2857285364616648.
[I 2025-12-05 15:42:22,402] Trial 103 finished with value: 0.28449648836783015 and parameters: {'model_type': 'mlp', 'hidden_dims': '[128, 64]', 'dropout': 0.43736452983301444, 'batch_norm': False, 'lr': 1.2384605589625713e-05, 'weight_decay': 1.0344384945363674e-07, 'epochs': 198, 'loss': 'mse', 'optimizer': 'adam', 'graph_mode': 'off', 'use_snp_selection': False}. Best is trial 87 with value: 0.2857285364616648.
