[I 2025-12-05 18:06:01,035] Trial 107 finished with value: 0.22636684743429583 and parameters: {'model_type': 'mlp', 'hidden_dims': '[512, 64]', 'dropout': 0.5907849854350381, 'batch_norm': False, 'lr': 8.000833153767472e-05, 'weight_decay': 0.00034119851089777517, 'epochs': 221, 'loss': 'mae', 'optimizer': 'adam', 'graph_mode': 'off', 'use_snp_selection': True, 'num_snps': 58447}. Best is trial 37 with value: 0.25786006345063966.
[I 2025-12-05 18:06:50,277] Trial 108 finished with value: 0.24337754931244157 and parameters: {'model_type': 'mlp', 'hidden_dims': '[256, 128]', 'dropout': 0.506053196460764, 'batch_norm': False, 'lr': 3.4041835069488224e-05, 'weight_decay': 7.196464251142669e-06, 'epochs': 121, 'loss': 'mae', 'optimizer': 'adam', 'graph_mode': 'off', 'use_snp_selection': True, 'num_snps': 30661}. Best is trial 37 with value: 0.25786006345063966.
[I 2025-12-05 18:07:59,884] Trial 109 finished with value: 0.2330329800280829 and parameters: {'model_type': 'mlp', 'hidden_dims': '[512, 64]', 'dropout': 0.5831674231771267, 'batch_norm': False, 'lr': 0.00010133016263355257, 'weight_decay': 0.0002542768420223357, 'epochs': 172, 'loss': 'mae', 'optimizer': 'adam', 'graph_mode': 'off', 'use_snp_selection': True, 'num_snps': 37015}. Best is trial 37 with value: 0.25786006345063966.
[I 2025-12-05 18:08:58,769] Trial 110 finished with value: 0.19440121097087856 and parameters: {'model_type': 'mlp', 'hidden_dims': '[128, 64]', 'dropout': 0.22719838670971898, 'batch_norm': False, 'lr': 0.00029055989837395175, 'weight_decay': 0.000459076341800831, 'epochs': 241, 'loss': 'mse', 'optimizer': 'adam', 'graph_mode': 'off', 'use_snp_selection': True, 'num_snps': 46244}. Best is trial 37 with value: 0.25786006345063966.
[I 2025-12-05 18:10:08,710] Trial 111 finished with value: 0.22937086803045337 and parameters: {'model_type': 'mlp', 'hidden_dims': '[512, 64]', 'dropout': 0.5734662777120537, 'batch_norm': False, 'lr': 0.0004714324838098932, 'weight_decay': 0.00017269909028049473, 'epochs': 187, 'loss': 'mae', 'optimizer': 'adam', 'graph_mode': 'off', 'use_snp_selection': True, 'num_snps': 34707}. Best is trial 37 with value: 0.25786006345063966.
[I 2025-12-05 18:11:10,022] Trial 112 finished with value: 0.22294504479483152 and parameters: {'model_type': 'mlp', 'hidden_dims': '[512, 64]', 'dropout': 0.5651236398578106, 'batch_norm': False, 'lr': 0.0005958180601761645, 'weight_decay': 0.00014621135768834453, 'epochs': 202, 'loss': 'mae', 'optimizer': 'adam', 'graph_mode': 'off', 'use_snp_selection': True, 'num_snps': 25935}. Best is trial 37 with value: 0.25786006345063966.
[I 2025-12-05 18:12:17,167] Trial 113 finished with value: 0.2327742537310978 and parameters: {'model_type': 'mlp', 'hidden_dims': '[512, 64]', 'dropout': 0.5413486265831707, 'batch_norm': False, 'lr': 0.00036624535081382305, 'weight_decay': 0.00018881664786708194, 'epochs': 189, 'loss': 'mae', 'optimizer': 'adam', 'graph_mode': 'off', 'use_snp_selection': True, 'num_snps': 32617}. Best is trial 37 with value: 0.25786006345063966.
[I 2025-12-05 18:13:25,854] Trial 114 finished with value: 0.23622430004189426 and parameters: {'model_type': 'mlp', 'hidden_dims': '[512, 64]', 'dropout': 0.5699803226174278, 'batch_norm': False, 'lr': 0.00017366551231185896, 'weight_decay': 0.00010198681221421175, 'epochs': 176, 'loss': 'mae', 'optimizer': 'adam', 'graph_mode': 'off', 'use_snp_selection': True, 'num_snps': 35736}. Best is trial 37 with value: 0.25786006345063966.
[I 2025-12-05 18:14:43,497] Trial 115 finished with value: 0.2436283959729188 and parameters: {'model_type': 'mlp', 'hidden_dims': '[512, 64]', 'dropout': 0.5589262699049519, 'batch_norm': False, 'lr': 0.0004967344905635649, 'weight_decay': 0.0003094102834561441, 'epochs': 191, 'loss': 'mae', 'optimizer': 'adam', 'graph_mode': 'off', 'use_snp_selection': True, 'num_snps': 41325}. Best is trial 37 with value: 0.25786006345063966.
[I 2025-12-05 18:15:45,013] Trial 116 finished with value: 0.23549666635671654 and parameters: {'model_type': 'mlp', 'hidden_dims': '[512, 128]', 'dropout': 0.5999896092149408, 'batch_norm': False, 'lr': 0.0006576628740993134, 'weight_decay': 0.0002200610360924157, 'epochs': 135, 'loss': 'mae', 'optimizer': 'adam', 'graph_mode': 'off', 'use_snp_selection': True, 'num_snps': 33629}. Best is trial 37 with value: 0.25786006345063966.
[I 2025-12-05 18:17:18,148] Trial 117 finished with value: 0.2539534835213769 and parameters: {'model_type': 'mlp', 'hidden_dims': '[512, 64]', 'dropout': 0.5764901462851597, 'batch_norm': False, 'lr': 4.386563532050912e-06, 'weight_decay': 8.031571784404027e-05, 'epochs': 293, 'loss': 'mae', 'optimizer': 'adam', 'graph_mode': 'off', 'use_snp_selection': True, 'num_snps': 39078}. Best is trial 37 with value: 0.25786006345063966.
[I 2025-12-05 18:18:47,953] Trial 118 finished with value: 0.24240813057163318 and parameters: {'model_type': 'mlp', 'hidden_dims': '[512, 256]', 'dropout': 0.5896195138302596, 'batch_norm': False, 'lr': 3.5274672365131112e-06, 'weight_decay': 7.586858774249528e-05, 'epochs': 282, 'loss': 'mae', 'optimizer': 'adam', 'graph_mode': 'off', 'use_snp_selection': True, 'num_snps': 38401}. Best is trial 37 with value: 0.25786006345063966.
[I 2025-12-05 18:20:36,067] Trial 119 finished with value: 0.16995082286806526 and parameters: {'model_type': 'mlp', 'hidden_dims': '[512, 64]', 'dropout': 0.48325372211055856, 'batch_norm': True, 'lr': 1.9293300033931664e-06, 'weight_decay': 8.799921434482024e-05, 'epochs': 255, 'loss': 'mae', 'optimizer': 'adam', 'graph_mode': 'off', 'use_snp_selection': True, 'num_snps': 52244}. Best is trial 37 with value: 0.25786006345063966.
[I 2025-12-05 18:21:13,932] Trial 120 finished with value: 0.21439803988963196 and parameters: {'model_type': 'mlp', 'hidden_dims': '[256, 128, 64]', 'dropout': 0.42649953184710543, 'batch_norm': False, 'lr': 4.515637631918172e-06, 'weight_decay': 0.00012078013981241182, 'epochs': 266, 'loss': 'mae', 'optimizer': 'adam', 'graph_mode': 'off', 'use_snp_selection': True, 'num_snps': 7184}. Best is trial 37 with value: 0.25786006345063966.
[I 2025-12-05 18:22:52,407] Trial 121 finished with value: 0.23375367538134278 and parameters: {'model_type': 'mlp', 'hidden_dims': '[512, 64]', 'dropout': 0.5781204948430636, 'batch_norm': False, 'lr': 4.288304644101497e-05, 'weight_decay': 0.0001664749975549891, 'epochs': 288, 'loss': 'mae', 'optimizer': 'adam', 'graph_mode': 'off', 'use_snp_selection': True, 'num_snps': 43555}. Best is trial 37 with value: 0.25786006345063966.
[I 2025-12-05 18:24:32,700] Trial 122 finished with value: 0.23109952822991847 and parameters: {'model_type': 'mlp', 'hidden_dims': '[512, 64]', 'dropout': 0.5488766125120172, 'batch_norm': False, 'lr': 2.4451087893917927e-06, 'weight_decay': 0.00014061188759877246, 'epochs': 197, 'loss': 'mae', 'optimizer': 'adam', 'graph_mode': 'off', 'use_snp_selection': True, 'num_snps': 57094}. Best is trial 37 with value: 0.25786006345063966.
[I 2025-12-05 18:26:10,247] Trial 123 finished with value: 0.25003246107613414 and parameters: {'model_type': 'mlp', 'hidden_dims': '[512, 64]', 'dropout': 0.5713415405805119, 'batch_norm': False, 'lr': 2.93074412766651e-06, 'weight_decay': 1.601468039171111e-05, 'epochs': 346, 'loss': 'mae', 'optimizer': 'adam', 'graph_mode': 'off', 'use_snp_selection': True, 'num_snps': 37337}. Best is trial 37 with value: 0.25786006345063966.
[I 2025-12-05 18:28:19,417] Trial 124 finished with value: 0.24205676443584254 and parameters: {'model_type': 'mlp', 'hidden_dims': '[512, 64]', 'dropout': 0.5596534634268511, 'batch_norm': False, 'lr': 3.154733241004412e-06, 'weight_decay': 2.4871686296005685e-05, 'epochs': 331, 'loss': 'mae', 'optimizer': 'adam', 'graph_mode': 'off', 'use_snp_selection': True, 'num_snps': 54853}. Best is trial 37 with value: 0.25786006345063966.
[I 2025-12-05 18:29:59,437] Trial 125 finished with value: 0.23359733145467793 and parameters: {'model_type': 'mlp', 'hidden_dims': '[512, 64]', 'dropout': 0.5374564117163031, 'batch_norm': False, 'lr': 5.371699346435799e-06, 'weight_decay': 1.2333781091689548e-05, 'epochs': 343, 'loss': 'mae', 'optimizer': 'adam', 'graph_mode': 'off', 'use_snp_selection': True, 'num_snps': 38968}. Best is trial 37 with value: 0.25786006345063966.
[I 2025-12-05 18:31:39,716] Trial 126 finished with value: 0.2414849812962076 and parameters: {'model_type': 'mlp', 'hidden_dims': '[512, 64]', 'dropout': 0.5927849468010802, 'batch_norm': False, 'lr': 2.839802812981058e-06, 'weight_decay': 1.9832638789276574e-05, 'epochs': 322, 'loss': 'mae', 'optimizer': 'adam', 'graph_mode': 'off', 'use_snp_selection': True, 'num_snps': 41006}. Best is trial 37 with value: 0.25786006345063966.
[I 2025-12-05 18:33:35,973] Trial 127 finished with value: 0.23666517893574285 and parameters: {'model_type': 'mlp', 'hidden_dims': '[512, 64]', 'dropout': 0.4960411598824256, 'batch_norm': False, 'lr': 3.951117814991654e-06, 'weight_decay': 1.6096068421444278e-05, 'epochs': 310, 'loss': 'mae', 'optimizer': 'adam', 'graph_mode': 'off', 'use_snp_selection': True, 'num_snps': 49363}. Best is trial 37 with value: 0.25786006345063966.
[I 2025-12-05 18:35:43,469] Trial 128 finished with value: 0.22766255141959935 and parameters: {'model_type': 'mlp', 'hidden_dims': '[512, 64]', 'dropout': 0.46848955339308496, 'batch_norm': False, 'lr': 9.342324303744937e-06, 'weight_decay': 1.0817790331654674e-05, 'epochs': 295, 'loss': 'mae', 'optimizer': 'adam', 'graph_mode': 'off', 'use_snp_selection': True, 'num_snps': 58643}. Best is trial 37 with value: 0.25786006345063966.
[I 2025-12-05 18:36:52,664] Trial 129 finished with value: 0.22882322757949156 and parameters: {'model_type': 'mlp', 'hidden_dims': '[512, 256]', 'dropout': 0.3381719520203644, 'batch_norm': False, 'lr': 4.38695672143986e-06, 'weight_decay': 5.197145537352e-05, 'epochs': 99, 'loss': 'mae', 'optimizer': 'adam', 'graph_mode': 'off', 'use_snp_selection': True, 'num_snps': 47355}. Best is trial 37 with value: 0.25786006345063966.
[I 2025-12-05 18:38:23,590] Trial 130 finished with value: 0.22310395487568271 and parameters: {'model_type': 'mlp', 'hidden_dims': '[512, 64]', 'dropout': 0.5811044858314294, 'batch_norm': False, 'lr': 1.5768567436071346e-06, 'weight_decay': 1.4319724070002269e-05, 'epochs': 306, 'loss': 'mse', 'optimizer': 'adam', 'graph_mode': 'off', 'use_snp_selection': True, 'num_snps': 36925}. Best is trial 37 with value: 0.25786006345063966.
[I 2025-12-05 18:39:26,326] Trial 131 finished with value: 0.24699106952207997 and parameters: {'model_type': 'mlp', 'hidden_dims': '[512, 64]', 'dropout': 0.5711392557050262, 'batch_norm': False, 'lr': 0.0004719891396427617, 'weight_decay': 0.00020519663397758583, 'epochs': 129, 'loss': 'mae', 'optimizer': 'adam', 'graph_mode': 'off', 'use_snp_selection': True, 'num_snps': 35142}. Best is trial 37 with value: 0.25786006345063966.
[I 2025-12-05 18:40:36,851] Trial 132 finished with value: 0.24167451483751728 and parameters: {'model_type': 'mlp', 'hidden_dims': '[512, 64]', 'dropout': 0.565538155885637, 'batch_norm': False, 'lr': 1.4863976441588353e-05, 'weight_decay': 0.00012496263250050035, 'epochs': 230, 'loss': 'mae', 'optimizer': 'adam', 'graph_mode': 'off', 'use_snp_selection': True, 'num_snps': 29573}. Best is trial 37 with value: 0.25786006345063966.
[I 2025-12-05 18:41:37,394] Trial 133 finished with value: 0.23662452487003546 and parameters: {'model_type': 'mlp', 'hidden_dims': '[512, 64]', 'dropout': 0.5465318766153073, 'batch_norm': False, 'lr': 5.60844097895388e-05, 'weight_decay': 9.394983023193848e-06, 'epochs': 144, 'loss': 'mae', 'optimizer': 'adam', 'graph_mode': 'off', 'use_snp_selection': True, 'num_snps': 31246}. Best is trial 37 with value: 0.25786006345063966.
[I 2025-12-05 18:42:57,856] Trial 134 finished with value: 0.2429444937533999 and parameters: {'model_type': 'mlp', 'hidden_dims': '[512, 64]', 'dropout': 0.5304994890882628, 'batch_norm': False, 'lr': 3.5191665151862387e-06, 'weight_decay': 2.2523210476871196e-05, 'epochs': 269, 'loss': 'mae', 'optimizer': 'adam', 'graph_mode': 'off', 'use_snp_selection': True, 'num_snps': 34032}. Best is trial 37 with value: 0.25786006345063966.
[I 2025-12-05 18:44:09,549] Trial 135 finished with value: 0.24390218383180243 and parameters: {'model_type': 'mlp', 'hidden_dims': '[512, 64]', 'dropout': 0.5760546398188047, 'batch_norm': False, 'lr': 2.659857249493725e-06, 'weight_decay': 8.207619051206815e-05, 'epochs': 182, 'loss': 'mae', 'optimizer': 'adam', 'graph_mode': 'off', 'use_snp_selection': True, 'num_snps': 36468}. Best is trial 37 with value: 0.25786006345063966.
[I 2025-12-05 18:45:14,542] Trial 136 finished with value: 0.24034963987925803 and parameters: {'model_type': 'mlp', 'hidden_dims': '[512, 64]', 'dropout': 0.5564589699337095, 'batch_norm': False, 'lr': 7.10015709099683e-06, 'weight_decay': 3.1957910983336915e-05, 'epochs': 116, 'loss': 'mae', 'optimizer': 'adam', 'graph_mode': 'off', 'use_snp_selection': True, 'num_snps': 40204}. Best is trial 37 with value: 0.25786006345063966.
[I 2025-12-05 18:46:11,107] Trial 137 finished with value: 0.24088359899970851 and parameters: {'model_type': 'mlp', 'hidden_dims': '[256, 128]', 'dropout': 0.5155834265606031, 'batch_norm': False, 'lr': 2.0830170607343613e-05, 'weight_decay': 0.00037931821250979363, 'epochs': 149, 'loss': 'mae', 'optimizer': 'adam', 'graph_mode': 'off', 'use_snp_selection': True, 'num_snps': 37804}. Best is trial 37 with value: 0.25786006345063966.
[I 2025-12-05 18:47:46,971] Trial 138 finished with value: 0.18699820036355935 and parameters: {'model_type': 'mlp', 'hidden_dims': '[512, 64]', 'dropout': 0.5902382398272878, 'batch_norm': False, 'lr': 0.0007863112518903203, 'weight_decay': 6.297307566386988e-06, 'epochs': 168, 'loss': 'mae', 'optimizer': 'adam', 'graph_mode': 'off', 'use_snp_selection': True, 'num_snps': 59939}. Best is trial 37 with value: 0.25786006345063966.
[I 2025-12-05 18:48:46,715] Trial 139 finished with value: 0.17084238114519304 and parameters: {'model_type': 'mlp', 'hidden_dims': '[128, 64]', 'dropout': 0.539314628859053, 'batch_norm': False, 'lr': 2.2457669441192636e-06, 'weight_decay': 0.0001031515144332046, 'epochs': 138, 'loss': 'mae', 'optimizer': 'adam', 'graph_mode': 'off', 'use_snp_selection': True, 'num_snps': 56277}. Best is trial 37 with value: 0.25786006345063966.
[I 2025-12-05 18:49:54,477] Trial 140 finished with value: 0.1461354523309506 and parameters: {'model_type': 'mlp', 'hidden_dims': '[512, 64]', 'dropout': 0.5989222554860311, 'batch_norm': True, 'lr': 1.821926108213994e-06, 'weight_decay': 0.00023589797582739878, 'epochs': 123, 'loss': 'mae', 'optimizer': 'adam', 'graph_mode': 'off', 'use_snp_selection': True, 'num_snps': 41824}. Best is trial 37 with value: 0.25786006345063966.
[I 2025-12-05 18:51:06,637] Trial 141 finished with value: 0.2348002810062914 and parameters: {'model_type': 'mlp', 'hidden_dims': '[512, 64]', 'dropout': 0.5501130860995137, 'batch_norm': False, 'lr': 0.00035372250237335613, 'weight_decay': 3.008769680190092e-05, 'epochs': 164, 'loss': 'mae', 'optimizer': 'adam', 'graph_mode': 'off', 'use_snp_selection': True, 'num_snps': 40320}. Best is trial 37 with value: 0.25786006345063966.
[I 2025-12-05 18:52:18,323] Trial 142 finished with value: 0.24211336666511332 and parameters: {'model_type': 'mlp', 'hidden_dims': '[512, 64]', 'dropout': 0.5627608046276722, 'batch_norm': False, 'lr': 0.000246180022015348, 'weight_decay': 3.4238698026828294e-05, 'epochs': 174, 'loss': 'mae', 'optimizer': 'adam', 'graph_mode': 'off', 'use_snp_selection': True, 'num_snps': 38326}. Best is trial 37 with value: 0.25786006345063966.
[I 2025-12-05 18:53:28,618] Trial 143 finished with value: 0.2477593081308988 and parameters: {'model_type': 'mlp', 'hidden_dims': '[512, 64]', 'dropout': 0.5819327604381437, 'batch_norm': False, 'lr': 5.9341019386354955e-06, 'weight_decay': 0.00016176985001986914, 'epochs': 158, 'loss': 'mae', 'optimizer': 'adam', 'graph_mode': 'off', 'use_snp_selection': True, 'num_snps': 38741}. Best is trial 37 with value: 0.25786006345063966.
[I 2025-12-05 18:54:54,788] Trial 144 finished with value: 0.22429249798652254 and parameters: {'model_type': 'mlp', 'hidden_dims': '[512, 64]', 'dropout': 0.571957498045159, 'batch_norm': False, 'lr': 0.00027584789243987365, 'weight_decay': 1.754304276626083e-05, 'epochs': 156, 'loss': 'mae', 'optimizer': 'adam', 'graph_mode': 'off', 'use_snp_selection': True, 'num_snps': 53873}. Best is trial 37 with value: 0.25786006345063966.
[I 2025-12-05 18:56:18,979] Trial 145 finished with value: 0.2284218336349691 and parameters: {'model_type': 'mlp', 'hidden_dims': '[512, 128]', 'dropout': 0.5236407451340307, 'batch_norm': False, 'lr': 0.0002441890722932048, 'weight_decay': 5.574495493822987e-05, 'epochs': 208, 'loss': 'mae', 'optimizer': 'adam', 'graph_mode': 'off', 'use_snp_selection': True, 'num_snps': 44410}. Best is trial 37 with value: 0.25786006345063966.
[I 2025-12-05 18:57:47,272] Trial 146 finished with value: 0.24392348004732747 and parameters: {'model_type': 'mlp', 'hidden_dims': '[512, 64]', 'dropout': 0.5066440921077346, 'batch_norm': False, 'lr': 0.00031274979546228515, 'weight_decay': 2.4457789731743718e-05, 'epochs': 148, 'loss': 'mae', 'optimizer': 'adam', 'graph_mode': 'off', 'use_snp_selection': True, 'num_snps': 57885}. Best is trial 37 with value: 0.25786006345063966.
[I 2025-12-05 18:58:54,464] Trial 147 finished with value: 0.24200524148230715 and parameters: {'model_type': 'mlp', 'hidden_dims': '[512, 64]', 'dropout': 0.5492413921718138, 'batch_norm': False, 'lr': 0.00041553895036406004, 'weight_decay': 4.194396390626972e-05, 'epochs': 133, 'loss': 'mae', 'optimizer': 'adam', 'graph_mode': 'off', 'use_snp_selection': True, 'num_snps': 39874}. Best is trial 37 with value: 0.25786006345063966.
[I 2025-12-05 19:00:06,550] Trial 148 finished with value: 0.2254081186899267 and parameters: {'model_type': 'mlp', 'hidden_dims': '[512, 256]', 'dropout': 0.5558878223245689, 'batch_norm': False, 'lr': 0.0001704477053451074, 'weight_decay': 0.00011695357287519385, 'epochs': 195, 'loss': 'mae', 'optimizer': 'adam', 'graph_mode': 'off', 'use_snp_selection': True, 'num_snps': 35933}. Best is trial 37 with value: 0.25786006345063966.
[I 2025-12-05 19:01:09,427] Trial 149 finished with value: 0.23848321387484722 and parameters: {'model_type': 'mlp', 'hidden_dims': '[512, 64]', 'dropout': 0.5304799399471427, 'batch_norm': False, 'lr': 0.0005680407525695693, 'weight_decay': 0.0001425038347205933, 'epochs': 141, 'loss': 'mae', 'optimizer': 'adam', 'graph_mode': 'off', 'use_snp_selection': True, 'num_snps': 34428}. Best is trial 37 with value: 0.25786006345063966.
[I 2025-12-05 19:02:17,446] Trial 0 finished with value: 0.15527051366032468 and parameters: {'model_type': 'mlp', 'hidden_dims': '[128, 64]', 'dropout': 0.199031432379812, 'batch_norm': True, 'lr': 1.8408544111075837e-06, 'weight_decay': 5.5136510071208614e-05, 'epochs': 336, 'loss': 'mae', 'optimizer': 'adam', 'graph_mode': 'off', 'use_snp_selection': True, 'num_snps': 43862}. Best is trial 0 with value: 0.15527051366032468.
[I 2025-12-05 19:02:57,241] Trial 1 finished with value: 0.22513221810685197 and parameters: {'model_type': 'mlp', 'hidden_dims': '[256, 128]', 'dropout': 0.4370668075331726, 'batch_norm': True, 'lr': 7.133471581159139e-05, 'weight_decay': 1.128633586803549e-05, 'epochs': 242, 'loss': 'mae', 'optimizer': 'adam', 'graph_mode': 'off', 'use_snp_selection': False}. Best is trial 1 with value: 0.22513221810685197.
[I 2025-12-05 19:03:33,951] Trial 2 finished with value: 0.2166392054314973 and parameters: {'model_type': 'mlp', 'hidden_dims': '[256, 128, 64]', 'dropout': 0.41314357415569625, 'batch_norm': False, 'lr': 3.952233718592101e-06, 'weight_decay': 0.00026754769258252603, 'epochs': 149, 'loss': 'mse', 'optimizer': 'adam', 'graph_mode': 'off', 'use_snp_selection': True, 'num_snps': 11571}. Best is trial 1 with value: 0.22513221810685197.
[I 2025-12-05 19:05:06,115] Trial 3 finished with value: 0.25649640621267433 and parameters: {'model_type': 'mlp', 'hidden_dims': '[512, 64]', 'dropout': 0.5938127374509361, 'batch_norm': False, 'lr': 5.67704586114731e-06, 'weight_decay': 2.4518087630137052e-05, 'epochs': 320, 'loss': 'mae', 'optimizer': 'adam', 'graph_mode': 'off', 'use_snp_selection': False}. Best is trial 3 with value: 0.25649640621267433.
[I 2025-12-05 19:06:30,758] Trial 4 finished with value: 0.13077397859155876 and parameters: {'model_type': 'mlp', 'hidden_dims': '[512, 128]', 'dropout': 0.25746343592134413, 'batch_norm': True, 'lr': 1.3467657668402788e-06, 'weight_decay': 0.00033087251918647806, 'epochs': 277, 'loss': 'mse', 'optimizer': 'adam', 'graph_mode': 'off', 'use_snp_selection': True, 'num_snps': 36675}. Best is trial 3 with value: 0.25649640621267433.
[I 2025-12-05 19:07:30,314] Trial 5 finished with value: 0.18506722699687456 and parameters: {'model_type': 'mlp', 'hidden_dims': '[512, 64]', 'dropout': 0.38275350994408375, 'batch_norm': True, 'lr': 1.5586664309232824e-06, 'weight_decay': 0.0008227664668621182, 'epochs': 145, 'loss': 'mae', 'optimizer': 'adam', 'graph_mode': 'off', 'use_snp_selection': True, 'num_snps': 32148}. Best is trial 3 with value: 0.25649640621267433.
[I 2025-12-05 19:08:03,325] Trial 6 finished with value: 0.22816890052913658 and parameters: {'model_type': 'mlp', 'hidden_dims': '[256, 128]', 'dropout': 0.3930109900265879, 'batch_norm': False, 'lr': 4.892964372128395e-05, 'weight_decay': 1.5809549317992182e-06, 'epochs': 199, 'loss': 'mse', 'optimizer': 'adam', 'graph_mode': 'off', 'use_snp_selection': False}. Best is trial 3 with value: 0.25649640621267433.
