[I 2025-12-05 22:21:51,595] Trial 69 finished with value: 0.21440180450618485 and parameters: {'model_type': 'mlp', 'hidden_dims': '[512, 256]', 'dropout': 0.1880998501801673, 'batch_norm': False, 'lr': 0.0009143665448647125, 'weight_decay': 1.0182904912655418e-07, 'epochs': 92, 'loss': 'mae', 'optimizer': 'adam', 'graph_mode': 'off', 'use_snp_selection': False}. Best is trial 33 with value: 0.21897778420797964.
[I 2025-12-05 22:22:19,754] Trial 70 finished with value: 0.20981819627129972 and parameters: {'model_type': 'mlp', 'hidden_dims': '[512, 256]', 'dropout': 0.23517599867613373, 'batch_norm': False, 'lr': 0.0003822585889589598, 'weight_decay': 4.678932177694581e-07, 'epochs': 76, 'loss': 'mae', 'optimizer': 'adam', 'graph_mode': 'off', 'use_snp_selection': False}. Best is trial 33 with value: 0.21897778420797964.
[I 2025-12-05 22:22:52,832] Trial 71 finished with value: 0.21260067839183386 and parameters: {'model_type': 'mlp', 'hidden_dims': '[512, 256]', 'dropout': 0.1847938351631968, 'batch_norm': False, 'lr': 0.00023778981000070932, 'weight_decay': 1.1690130787921472e-07, 'epochs': 94, 'loss': 'mae', 'optimizer': 'adam', 'graph_mode': 'off', 'use_snp_selection': False}. Best is trial 33 with value: 0.21897778420797964.
[I 2025-12-05 22:23:26,670] Trial 72 finished with value: 0.19988772305567298 and parameters: {'model_type': 'mlp', 'hidden_dims': '[512, 256]', 'dropout': 0.16594933377497129, 'batch_norm': False, 'lr': 0.0008299614838590999, 'weight_decay': 2.1388696022533252e-07, 'epochs': 97, 'loss': 'mae', 'optimizer': 'adam', 'graph_mode': 'off', 'use_snp_selection': False}. Best is trial 33 with value: 0.21897778420797964.
[I 2025-12-05 22:23:59,305] Trial 73 finished with value: 0.21238515468871255 and parameters: {'model_type': 'mlp', 'hidden_dims': '[512, 256]', 'dropout': 0.18060691219792047, 'batch_norm': False, 'lr': 0.00023885529092691453, 'weight_decay': 1.8046448664708175e-07, 'epochs': 92, 'loss': 'mae', 'optimizer': 'adam', 'graph_mode': 'off', 'use_snp_selection': False}. Best is trial 33 with value: 0.21897778420797964.
[I 2025-12-05 22:24:16,805] Trial 74 finished with value: 0.19596329649998465 and parameters: {'model_type': 'mlp', 'hidden_dims': '[256, 128, 64]', 'dropout': 0.12052680512633904, 'batch_norm': False, 'lr': 0.000946214511088409, 'weight_decay': 1.1337294822661521e-07, 'epochs': 79, 'loss': 'mae', 'optimizer': 'adam', 'graph_mode': 'off', 'use_snp_selection': False}. Best is trial 33 with value: 0.21897778420797964.
[I 2025-12-05 22:24:43,377] Trial 75 finished with value: 0.21197685450931206 and parameters: {'model_type': 'mlp', 'hidden_dims': '[512, 256]', 'dropout': 0.20644791534739032, 'batch_norm': False, 'lr': 0.00016369139137383025, 'weight_decay': 3.178168682082328e-07, 'epochs': 70, 'loss': 'mae', 'optimizer': 'adam', 'graph_mode': 'off', 'use_snp_selection': False}. Best is trial 33 with value: 0.21897778420797964.
[I 2025-12-05 22:25:04,554] Trial 76 finished with value: 0.18697020188576557 and parameters: {'model_type': 'mlp', 'hidden_dims': '[512, 256]', 'dropout': 0.1618030236100161, 'batch_norm': False, 'lr': 0.00040061257622570827, 'weight_decay': 2.451831806656898e-07, 'epochs': 50, 'loss': 'mae', 'optimizer': 'adam', 'graph_mode': 'off', 'use_snp_selection': False}. Best is trial 33 with value: 0.21897778420797964.
[I 2025-12-05 22:25:40,825] Trial 77 finished with value: 0.20647207603348788 and parameters: {'model_type': 'mlp', 'hidden_dims': '[512, 256]', 'dropout': 0.22450565891654267, 'batch_norm': False, 'lr': 0.00033274169126405777, 'weight_decay': 1.3112888144652747e-07, 'epochs': 106, 'loss': 'mae', 'optimizer': 'adam', 'graph_mode': 'off', 'use_snp_selection': False}. Best is trial 33 with value: 0.21897778420797964.
[I 2025-12-05 22:26:11,817] Trial 78 finished with value: 0.11973124859218501 and parameters: {'model_type': 'mlp', 'hidden_dims': '[256, 128]', 'dropout': 0.12776106935949083, 'batch_norm': False, 'lr': 0.00020701462336770193, 'weight_decay': 1.8362095817379634e-07, 'epochs': 128, 'loss': 'mae', 'optimizer': 'adam', 'graph_mode': 'off', 'use_snp_selection': True, 'num_snps': 2246}. Best is trial 33 with value: 0.21897778420797964.
[I 2025-12-05 22:26:58,145] Trial 79 finished with value: 0.20552820618832257 and parameters: {'model_type': 'mlp', 'hidden_dims': '[512, 256]', 'dropout': 0.11607100380832543, 'batch_norm': False, 'lr': 0.000283738659617265, 'weight_decay': 3.4875689364863164e-07, 'epochs': 144, 'loss': 'mae', 'optimizer': 'adam', 'graph_mode': 'off', 'use_snp_selection': False}. Best is trial 33 with value: 0.21897778420797964.
[I 2025-12-05 22:27:11,646] Trial 80 finished with value: 0.21217944177585046 and parameters: {'model_type': 'mlp', 'hidden_dims': '[128, 64]', 'dropout': 0.19068571795159472, 'batch_norm': False, 'lr': 0.00044227266778123136, 'weight_decay': 4.641569640745932e-07, 'epochs': 108, 'loss': 'mae', 'optimizer': 'adam', 'graph_mode': 'off', 'use_snp_selection': False}. Best is trial 33 with value: 0.21897778420797964.
[I 2025-12-05 22:27:43,882] Trial 81 finished with value: 0.21218086989793644 and parameters: {'model_type': 'mlp', 'hidden_dims': '[512, 256]', 'dropout': 0.14517813493972717, 'batch_norm': False, 'lr': 0.00023399032079487257, 'weight_decay': 1.794785667846963e-07, 'epochs': 91, 'loss': 'mae', 'optimizer': 'adam', 'graph_mode': 'off', 'use_snp_selection': False}. Best is trial 33 with value: 0.21897778420797964.
[I 2025-12-05 22:28:17,242] Trial 82 finished with value: 0.2133237775193793 and parameters: {'model_type': 'mlp', 'hidden_dims': '[512, 256]', 'dropout': 0.17697308593602956, 'batch_norm': False, 'lr': 0.00024299962245364913, 'weight_decay': 1.0181183489601176e-07, 'epochs': 95, 'loss': 'mae', 'optimizer': 'adam', 'graph_mode': 'off', 'use_snp_selection': False}. Best is trial 33 with value: 0.21897778420797964.
[I 2025-12-05 22:28:52,028] Trial 83 finished with value: 0.20558470161235495 and parameters: {'model_type': 'mlp', 'hidden_dims': '[512, 256]', 'dropout': 0.17087355495336026, 'batch_norm': False, 'lr': 0.00015666170349843775, 'weight_decay': 1.0685988438523484e-07, 'epochs': 100, 'loss': 'mae', 'optimizer': 'adam', 'graph_mode': 'off', 'use_snp_selection': False}. Best is trial 33 with value: 0.21897778420797964.
[I 2025-12-05 22:29:15,140] Trial 84 finished with value: 0.19512028839006731 and parameters: {'model_type': 'mlp', 'hidden_dims': '[512, 256]', 'dropout': 0.23935404538954297, 'batch_norm': False, 'lr': 0.0003507328480928564, 'weight_decay': 2.658583292436164e-07, 'epochs': 57, 'loss': 'mae', 'optimizer': 'adam', 'graph_mode': 'off', 'use_snp_selection': False}. Best is trial 33 with value: 0.21897778420797964.
[I 2025-12-05 22:30:46,349] Trial 85 finished with value: 0.1982691462661773 and parameters: {'model_type': 'mlp', 'hidden_dims': '[512, 256]', 'dropout': 0.19773887810474827, 'batch_norm': False, 'lr': 0.0001942916366059051, 'weight_decay': 2.1499940272019377e-07, 'epochs': 308, 'loss': 'mae', 'optimizer': 'adam', 'graph_mode': 'off', 'use_snp_selection': False}. Best is trial 33 with value: 0.21897778420797964.
[I 2025-12-05 22:31:24,171] Trial 86 finished with value: 0.2099088953639315 and parameters: {'model_type': 'mlp', 'hidden_dims': '[512, 256]', 'dropout': 0.15607066371880532, 'batch_norm': False, 'lr': 0.00027966182480061, 'weight_decay': 1.387786818665059e-07, 'epochs': 111, 'loss': 'mae', 'optimizer': 'adam', 'graph_mode': 'off', 'use_snp_selection': False}. Best is trial 33 with value: 0.21897778420797964.
[I 2025-12-05 22:31:41,869] Trial 87 finished with value: 0.18852595904204725 and parameters: {'model_type': 'mlp', 'hidden_dims': '[256, 128, 64]', 'dropout': 0.21890167713007158, 'batch_norm': False, 'lr': 0.000731006030457373, 'weight_decay': 1.2360807699249703e-07, 'epochs': 80, 'loss': 'mae', 'optimizer': 'adam', 'graph_mode': 'off', 'use_snp_selection': False}. Best is trial 33 with value: 0.21897778420797964.
[I 2025-12-05 22:32:25,475] Trial 88 finished with value: 0.20707006969188463 and parameters: {'model_type': 'mlp', 'hidden_dims': '[512, 256]', 'dropout': 0.2726438338997891, 'batch_norm': False, 'lr': 0.0006110552855391143, 'weight_decay': 6.722565355316911e-07, 'epochs': 133, 'loss': 'mae', 'optimizer': 'adam', 'graph_mode': 'off', 'use_snp_selection': False}. Best is trial 33 with value: 0.21897778420797964.
[I 2025-12-05 22:32:53,461] Trial 89 finished with value: 0.20074576992348545 and parameters: {'model_type': 'mlp', 'hidden_dims': '[512, 256]', 'dropout': 0.17945002429515083, 'batch_norm': False, 'lr': 1.368397401527448e-05, 'weight_decay': 1.0161641024327157e-07, 'epochs': 73, 'loss': 'mae', 'optimizer': 'adam', 'graph_mode': 'off', 'use_snp_selection': False}. Best is trial 33 with value: 0.21897778420797964.
[I 2025-12-05 22:33:44,538] Trial 90 finished with value: 0.19351482763350497 and parameters: {'model_type': 'mlp', 'hidden_dims': '[128, 64]', 'dropout': 0.12804833214620723, 'batch_norm': False, 'lr': 0.0005445092002247445, 'weight_decay': 4.2106759381022037e-07, 'epochs': 91, 'loss': 'mae', 'optimizer': 'adam', 'graph_mode': 'off', 'use_snp_selection': True, 'num_snps': 48165}. Best is trial 33 with value: 0.21897778420797964.
[I 2025-12-05 22:34:17,376] Trial 91 finished with value: 0.2128189930969225 and parameters: {'model_type': 'mlp', 'hidden_dims': '[512, 256]', 'dropout': 0.1835217960490581, 'batch_norm': False, 'lr': 0.0002484753598965498, 'weight_decay': 1.9201873773773602e-07, 'epochs': 94, 'loss': 'mae', 'optimizer': 'adam', 'graph_mode': 'off', 'use_snp_selection': False}. Best is trial 33 with value: 0.21897778420797964.
[I 2025-12-05 22:34:57,908] Trial 92 finished with value: 0.20506490416919587 and parameters: {'model_type': 'mlp', 'hidden_dims': '[512, 256]', 'dropout': 0.2088639062056164, 'batch_norm': False, 'lr': 0.0002780254771874856, 'weight_decay': 1.6511725630725655e-07, 'epochs': 122, 'loss': 'mae', 'optimizer': 'adam', 'graph_mode': 'off', 'use_snp_selection': False}. Best is trial 33 with value: 0.21897778420797964.
[I 2025-12-05 22:35:28,039] Trial 93 finished with value: 0.21470173423063618 and parameters: {'model_type': 'mlp', 'hidden_dims': '[512, 256]', 'dropout': 0.13886640016514504, 'batch_norm': False, 'lr': 0.00043322021315584633, 'weight_decay': 3.06337299027513e-07, 'epochs': 83, 'loss': 'mae', 'optimizer': 'adam', 'graph_mode': 'off', 'use_snp_selection': False}. Best is trial 33 with value: 0.21897778420797964.
[I 2025-12-05 22:35:54,142] Trial 94 finished with value: 0.21222490247170894 and parameters: {'model_type': 'mlp', 'hidden_dims': '[256, 128]', 'dropout': 0.10970322554121646, 'batch_norm': False, 'lr': 0.00042118568706177013, 'weight_decay': 2.6925513296224514e-07, 'epochs': 142, 'loss': 'mae', 'optimizer': 'adam', 'graph_mode': 'off', 'use_snp_selection': False}. Best is trial 33 with value: 0.21897778420797964.
[I 2025-12-05 22:36:24,565] Trial 95 finished with value: 0.19977494961216874 and parameters: {'model_type': 'mlp', 'hidden_dims': '[512, 256]', 'dropout': 0.13746275430538513, 'batch_norm': False, 'lr': 0.0009868924929747225, 'weight_decay': 5.497351848900343e-07, 'epochs': 84, 'loss': 'mae', 'optimizer': 'adam', 'graph_mode': 'off', 'use_snp_selection': False}. Best is trial 33 with value: 0.21897778420797964.
[I 2025-12-05 22:36:48,509] Trial 96 finished with value: 0.1981731595279432 and parameters: {'model_type': 'mlp', 'hidden_dims': '[512, 256]', 'dropout': 0.16102554082499806, 'batch_norm': False, 'lr': 0.0003300786126795839, 'weight_decay': 3.117867128380085e-07, 'epochs': 60, 'loss': 'mae', 'optimizer': 'adam', 'graph_mode': 'off', 'use_snp_selection': False}. Best is trial 33 with value: 0.21897778420797964.
[I 2025-12-05 22:37:23,620] Trial 97 finished with value: 0.2184957340415011 and parameters: {'model_type': 'mlp', 'hidden_dims': '[512, 256]', 'dropout': 0.10057927724421348, 'batch_norm': False, 'lr': 0.0005292725188397482, 'weight_decay': 9.691879075846385e-07, 'epochs': 101, 'loss': 'mae', 'optimizer': 'adam', 'graph_mode': 'off', 'use_snp_selection': False}. Best is trial 33 with value: 0.21897778420797964.
[I 2025-12-05 22:38:07,432] Trial 98 finished with value: 0.18878583251123923 and parameters: {'model_type': 'mlp', 'hidden_dims': '[512, 256]', 'dropout': 0.12237853208549389, 'batch_norm': False, 'lr': 1.0079507573984861e-06, 'weight_decay': 8.43627809577119e-07, 'epochs': 129, 'loss': 'mae', 'optimizer': 'adam', 'graph_mode': 'off', 'use_snp_selection': False}. Best is trial 33 with value: 0.21897778420797964.
[I 2025-12-05 22:38:28,311] Trial 99 finished with value: 0.2045979991055475 and parameters: {'model_type': 'mlp', 'hidden_dims': '[256, 128, 64]', 'dropout': 0.10198225861285572, 'batch_norm': False, 'lr': 0.0005399533776454655, 'weight_decay': 4.126491912624661e-07, 'epochs': 102, 'loss': 'mae', 'optimizer': 'adam', 'graph_mode': 'off', 'use_snp_selection': False}. Best is trial 33 with value: 0.21897778420797964.
[I 2025-12-05 22:39:06,467] Trial 100 finished with value: 0.19310178794498217 and parameters: {'model_type': 'mlp', 'hidden_dims': '[512, 64]', 'dropout': 0.11221085261322773, 'batch_norm': False, 'lr': 0.0007047400147681719, 'weight_decay': 1.1330217072193524e-06, 'epochs': 112, 'loss': 'mae', 'optimizer': 'adam', 'graph_mode': 'off', 'use_snp_selection': False}. Best is trial 33 with value: 0.21897778420797964.
[I 2025-12-05 22:39:36,825] Trial 101 finished with value: 0.19658368461814374 and parameters: {'model_type': 'mlp', 'hidden_dims': '[512, 256]', 'dropout': 0.15182358564061893, 'batch_norm': False, 'lr': 0.0008446766878201823, 'weight_decay': 2.1678872820972897e-07, 'epochs': 83, 'loss': 'mae', 'optimizer': 'adam', 'graph_mode': 'off', 'use_snp_selection': False}. Best is trial 33 with value: 0.21897778420797964.
[I 2025-12-05 22:40:16,972] Trial 102 finished with value: 0.2121070972490034 and parameters: {'model_type': 'mlp', 'hidden_dims': '[512, 256]', 'dropout': 0.13925261402988043, 'batch_norm': False, 'lr': 0.0004414211775925291, 'weight_decay': 6.218670013776134e-07, 'epochs': 119, 'loss': 'mae', 'optimizer': 'adam', 'graph_mode': 'off', 'use_snp_selection': False}. Best is trial 33 with value: 0.21897778420797964.
[I 2025-12-05 22:40:43,753] Trial 103 finished with value: 0.21624257344285155 and parameters: {'model_type': 'mlp', 'hidden_dims': '[512, 256]', 'dropout': 0.1288004162601749, 'batch_norm': False, 'lr': 0.00034658962009654856, 'weight_decay': 1.9370986893681858e-07, 'epochs': 70, 'loss': 'mae', 'optimizer': 'adam', 'graph_mode': 'off', 'use_snp_selection': False}. Best is trial 33 with value: 0.21897778420797964.
[I 2025-12-05 22:41:10,470] Trial 104 finished with value: 0.18636508611327499 and parameters: {'model_type': 'mlp', 'hidden_dims': '[512, 256]', 'dropout': 0.13088928195215604, 'batch_norm': False, 'lr': 0.00032987215468851855, 'weight_decay': 3.4474315383468734e-07, 'epochs': 70, 'loss': 'mae', 'optimizer': 'adam', 'graph_mode': 'off', 'use_snp_selection': False}. Best is trial 33 with value: 0.21897778420797964.
[I 2025-12-05 22:41:58,831] Trial 105 finished with value: 0.20267152884548884 and parameters: {'model_type': 'mlp', 'hidden_dims': '[512, 256]', 'dropout': 0.12039314385370775, 'batch_norm': False, 'lr': 0.0005291493323239709, 'weight_decay': 1.6373524686108615e-07, 'epochs': 150, 'loss': 'mae', 'optimizer': 'adam', 'graph_mode': 'off', 'use_snp_selection': False}. Best is trial 33 with value: 0.21897778420797964.
[I 2025-12-05 22:42:18,459] Trial 106 finished with value: 0.17343347434533854 and parameters: {'model_type': 'mlp', 'hidden_dims': '[512, 128]', 'dropout': 0.14717831453528268, 'batch_norm': False, 'lr': 0.0003712930892645437, 'weight_decay': 2.900234509422935e-07, 'epochs': 44, 'loss': 'mae', 'optimizer': 'adam', 'graph_mode': 'off', 'use_snp_selection': False}. Best is trial 33 with value: 0.21897778420797964.
[I 2025-12-05 22:42:49,376] Trial 107 finished with value: 0.20813896959241643 and parameters: {'model_type': 'mlp', 'hidden_dims': '[512, 256]', 'dropout': 0.36191546078503756, 'batch_norm': False, 'lr': 0.0006076387352900638, 'weight_decay': 5.212238176499739e-07, 'epochs': 86, 'loss': 'mae', 'optimizer': 'adam', 'graph_mode': 'off', 'use_snp_selection': False}. Best is trial 33 with value: 0.21897778420797964.
[I 2025-12-05 22:43:17,093] Trial 108 finished with value: 0.1744590215530865 and parameters: {'model_type': 'mlp', 'hidden_dims': '[512, 64]', 'dropout': 0.16868835117214986, 'batch_norm': False, 'lr': 0.0004468300512750046, 'weight_decay': 1.3653540362079556e-07, 'epochs': 74, 'loss': 'mae', 'optimizer': 'adam', 'graph_mode': 'off', 'use_snp_selection': False}. Best is trial 33 with value: 0.21897778420797964.
[I 2025-12-05 22:44:09,017] Trial 109 finished with value: 0.19262312206635962 and parameters: {'model_type': 'mlp', 'hidden_dims': '[512, 256]', 'dropout': 0.10052595026222187, 'batch_norm': False, 'lr': 0.0003135611553935137, 'weight_decay': 2.2963747433878616e-07, 'epochs': 102, 'loss': 'mae', 'optimizer': 'adam', 'graph_mode': 'off', 'use_snp_selection': True, 'num_snps': 28308}. Best is trial 33 with value: 0.21897778420797964.
[I 2025-12-05 22:44:54,075] Trial 110 finished with value: 0.20739729028392592 and parameters: {'model_type': 'mlp', 'hidden_dims': '[512, 256]', 'dropout': 0.11167835784637165, 'batch_norm': False, 'lr': 0.0002060900941101284, 'weight_decay': 3.574703884990728e-07, 'epochs': 139, 'loss': 'mae', 'optimizer': 'adam', 'graph_mode': 'off', 'use_snp_selection': False}. Best is trial 33 with value: 0.21897778420797964.
[I 2025-12-05 22:45:27,665] Trial 111 finished with value: 0.2044824925608058 and parameters: {'model_type': 'mlp', 'hidden_dims': '[512, 256]', 'dropout': 0.12748013171860986, 'batch_norm': False, 'lr': 0.0002638849799392411, 'weight_decay': 1.9652954331621583e-07, 'epochs': 96, 'loss': 'mae', 'optimizer': 'adam', 'graph_mode': 'off', 'use_snp_selection': False}. Best is trial 33 with value: 0.21897778420797964.
[I 2025-12-05 22:45:53,492] Trial 112 finished with value: 0.20085156295797785 and parameters: {'model_type': 'mlp', 'hidden_dims': '[512, 256]', 'dropout': 0.1587525224200758, 'batch_norm': False, 'lr': 0.00018210265965379815, 'weight_decay': 1.7686431121136752e-07, 'epochs': 67, 'loss': 'mae', 'optimizer': 'adam', 'graph_mode': 'off', 'use_snp_selection': False}. Best is trial 33 with value: 0.21897778420797964.
[I 2025-12-05 22:46:30,373] Trial 113 finished with value: 0.21002106750287855 and parameters: {'model_type': 'mlp', 'hidden_dims': '[512, 256]', 'dropout': 0.13544479028187068, 'batch_norm': False, 'lr': 0.00022729953243419334, 'weight_decay': 2.590608841789212e-07, 'epochs': 108, 'loss': 'mae', 'optimizer': 'adam', 'graph_mode': 'off', 'use_snp_selection': False}. Best is trial 33 with value: 0.21897778420797964.
[I 2025-12-05 22:47:01,879] Trial 114 finished with value: 0.21086159486671008 and parameters: {'model_type': 'mlp', 'hidden_dims': '[512, 256]', 'dropout': 0.17723680412189127, 'batch_norm': False, 'lr': 0.0004101853451713188, 'weight_decay': 1.2687047509388656e-07, 'epochs': 88, 'loss': 'mae', 'optimizer': 'adam', 'graph_mode': 'off', 'use_snp_selection': False}. Best is trial 33 with value: 0.21897778420797964.
[I 2025-12-05 22:47:35,883] Trial 115 finished with value: 0.20462587939644314 and parameters: {'model_type': 'mlp', 'hidden_dims': '[512, 256]', 'dropout': 0.19896244003616398, 'batch_norm': False, 'lr': 0.0001400942855800208, 'weight_decay': 2.0744503785490545e-07, 'epochs': 97, 'loss': 'mae', 'optimizer': 'adam', 'graph_mode': 'off', 'use_snp_selection': False}. Best is trial 33 with value: 0.21897778420797964.
[I 2025-12-05 22:48:04,634] Trial 116 finished with value: 0.1863522633465001 and parameters: {'model_type': 'mlp', 'hidden_dims': '[512, 64]', 'dropout': 0.1488932967772634, 'batch_norm': False, 'lr': 0.0004993378190529572, 'weight_decay': 1.5464799944196074e-07, 'epochs': 78, 'loss': 'mae', 'optimizer': 'adam', 'graph_mode': 'off', 'use_snp_selection': False}. Best is trial 33 with value: 0.21897778420797964.
[I 2025-12-05 22:48:28,189] Trial 117 finished with value: 0.1979948475276855 and parameters: {'model_type': 'mlp', 'hidden_dims': '[256, 128]', 'dropout': 0.11833035565714792, 'batch_norm': False, 'lr': 2.2932525307680388e-05, 'weight_decay': 4.3823955236083863e-07, 'epochs': 121, 'loss': 'mae', 'optimizer': 'adam', 'graph_mode': 'off', 'use_snp_selection': False}. Best is trial 33 with value: 0.21897778420797964.
[I 2025-12-05 22:49:05,943] Trial 118 finished with value: 0.20782992895929492 and parameters: {'model_type': 'mlp', 'hidden_dims': '[512, 256]', 'dropout': 0.14091860610065404, 'batch_norm': False, 'lr': 0.0007735595308895328, 'weight_decay': 2.9610468091538696e-07, 'epochs': 111, 'loss': 'mae', 'optimizer': 'adam', 'graph_mode': 'off', 'use_snp_selection': False}. Best is trial 33 with value: 0.21897778420797964.
[I 2025-12-05 22:49:28,004] Trial 119 finished with value: 0.17380345206063674 and parameters: {'model_type': 'mlp', 'hidden_dims': '[512, 256]', 'dropout': 0.5990127129355303, 'batch_norm': False, 'lr': 0.00036197491947661885, 'weight_decay': 1.0089449170944437e-07, 'epochs': 53, 'loss': 'mae', 'optimizer': 'adam', 'graph_mode': 'off', 'use_snp_selection': False}. Best is trial 33 with value: 0.21897778420797964.
[I 2025-12-05 22:49:39,728] Trial 120 finished with value: 0.21108578384814902 and parameters: {'model_type': 'mlp', 'hidden_dims': '[128, 64]', 'dropout': 0.16759787997190895, 'batch_norm': False, 'lr': 0.00029786734830254756, 'weight_decay': 9.51218341327006e-07, 'epochs': 81, 'loss': 'mae', 'optimizer': 'adam', 'graph_mode': 'off', 'use_snp_selection': False}. Best is trial 33 with value: 0.21897778420797964.
