[I 2025-12-05 14:36:03,227] Trial 112 finished with value: 0.0942877952589968 and parameters: {'model_type': 'mlp', 'hidden_dims': '[256, 128]', 'dropout': 0.20299270664881464, 'batch_norm': False, 'lr': 0.00027429963758679536, 'weight_decay': 2.916514021595606e-06, 'epochs': 250, 'loss': 'mae', 'optimizer': 'adam', 'graph_mode': 'off', 'use_snp_selection': False}. Best is trial 111 with value: 0.10997558096353947.
[I 2025-12-05 14:36:04,675] Trial 113 finished with value: 0.0930577189459098 and parameters: {'model_type': 'mlp', 'hidden_dims': '[256, 128]', 'dropout': 0.21380930581191573, 'batch_norm': False, 'lr': 0.00021687152871576384, 'weight_decay': 3.138446269605262e-06, 'epochs': 237, 'loss': 'mae', 'optimizer': 'adam', 'graph_mode': 'off', 'use_snp_selection': False}. Best is trial 111 with value: 0.10997558096353947.
[I 2025-12-05 14:36:06,310] Trial 114 finished with value: 0.08910287410622976 and parameters: {'model_type': 'mlp', 'hidden_dims': '[256, 128]', 'dropout': 0.2493149294118836, 'batch_norm': False, 'lr': 1.5257163957025795e-05, 'weight_decay': 2.056256152753005e-06, 'epochs': 283, 'loss': 'mae', 'optimizer': 'adam', 'graph_mode': 'off', 'use_snp_selection': False}. Best is trial 111 with value: 0.10997558096353947.
[I 2025-12-05 14:36:07,952] Trial 115 finished with value: 0.085883479250749 and parameters: {'model_type': 'mlp', 'hidden_dims': '[256, 128]', 'dropout': 0.2794161640543589, 'batch_norm': False, 'lr': 0.0001707906834614723, 'weight_decay': 1.5953532709646258e-06, 'epochs': 289, 'loss': 'mae', 'optimizer': 'adam', 'graph_mode': 'off', 'use_snp_selection': False}. Best is trial 111 with value: 0.10997558096353947.
[I 2025-12-05 14:36:08,897] Trial 116 finished with value: 0.09002072473662814 and parameters: {'model_type': 'mlp', 'hidden_dims': '[128, 64]', 'dropout': 0.19597123564839736, 'batch_norm': False, 'lr': 0.00015355663378124586, 'weight_decay': 9.930679465525821e-07, 'epochs': 227, 'loss': 'mae', 'optimizer': 'adam', 'graph_mode': 'off', 'use_snp_selection': False}. Best is trial 111 with value: 0.10997558096353947.
[I 2025-12-05 14:36:11,625] Trial 117 finished with value: 0.10124256686022276 and parameters: {'model_type': 'mlp', 'hidden_dims': '[512, 64]', 'dropout': 0.22639643717894423, 'batch_norm': False, 'lr': 6.1960853905397595e-06, 'weight_decay': 4.496098035012076e-06, 'epochs': 262, 'loss': 'mae', 'optimizer': 'adam', 'graph_mode': 'off', 'use_snp_selection': False}. Best is trial 111 with value: 0.10997558096353947.
[I 2025-12-05 14:36:14,420] Trial 118 finished with value: 0.026283435657083503 and parameters: {'model_type': 'mlp', 'hidden_dims': '[512, 64]', 'dropout': 0.36249140772392274, 'batch_norm': False, 'lr': 2.1016736087690434e-06, 'weight_decay': 2.5261146683736335e-06, 'epochs': 273, 'loss': 'mae', 'optimizer': 'adam', 'graph_mode': 'off', 'use_snp_selection': False}. Best is trial 111 with value: 0.10997558096353947.
[I 2025-12-05 14:36:17,122] Trial 119 finished with value: 0.09445001177881192 and parameters: {'model_type': 'mlp', 'hidden_dims': '[512, 64]', 'dropout': 0.2228564207949099, 'batch_norm': False, 'lr': 5.832032760181564e-06, 'weight_decay': 4.4921308572785055e-06, 'epochs': 261, 'loss': 'mae', 'optimizer': 'adam', 'graph_mode': 'off', 'use_snp_selection': False}. Best is trial 111 with value: 0.10997558096353947.
[I 2025-12-05 14:36:19,879] Trial 120 finished with value: 0.09308334972869861 and parameters: {'model_type': 'mlp', 'hidden_dims': '[512, 64]', 'dropout': 0.1801454909541528, 'batch_norm': False, 'lr': 6.794933637281437e-06, 'weight_decay': 6.461402435337322e-06, 'epochs': 268, 'loss': 'mae', 'optimizer': 'adam', 'graph_mode': 'off', 'use_snp_selection': False}. Best is trial 111 with value: 0.10997558096353947.
[I 2025-12-05 14:36:22,483] Trial 121 finished with value: 0.06879567119033513 and parameters: {'model_type': 'mlp', 'hidden_dims': '[512, 64]', 'dropout': 0.20667739924424458, 'batch_norm': False, 'lr': 3.785999667802395e-06, 'weight_decay': 3.4387667755045e-06, 'epochs': 248, 'loss': 'mae', 'optimizer': 'adam', 'graph_mode': 'off', 'use_snp_selection': False}. Best is trial 111 with value: 0.10997558096353947.
[I 2025-12-05 14:36:24,156] Trial 122 finished with value: 0.0927408632613223 and parameters: {'model_type': 'mlp', 'hidden_dims': '[256, 128]', 'dropout': 0.2313858855847916, 'batch_norm': False, 'lr': 0.0001278357996971607, 'weight_decay': 4.0428340197050706e-06, 'epochs': 297, 'loss': 'mae', 'optimizer': 'adam', 'graph_mode': 'off', 'use_snp_selection': False}. Best is trial 111 with value: 0.10997558096353947.
[I 2025-12-05 14:36:25,708] Trial 123 finished with value: 0.07996814970902046 and parameters: {'model_type': 'mlp', 'hidden_dims': '[256, 128, 64]', 'dropout': 0.26972351472156325, 'batch_norm': False, 'lr': 0.0002693247276885567, 'weight_decay': 5.285153909947268e-06, 'epochs': 260, 'loss': 'mae', 'optimizer': 'adam', 'graph_mode': 'off', 'use_snp_selection': False}. Best is trial 111 with value: 0.10997558096353947.
[I 2025-12-05 14:36:27,339] Trial 124 finished with value: 0.08195740681869294 and parameters: {'model_type': 'mlp', 'hidden_dims': '[256, 128]', 'dropout': 0.1883425374576689, 'batch_norm': False, 'lr': 9.383196231994953e-06, 'weight_decay': 8.886941756161388e-06, 'epochs': 280, 'loss': 'mae', 'optimizer': 'adam', 'graph_mode': 'off', 'use_snp_selection': False}. Best is trial 111 with value: 0.10997558096353947.
[I 2025-12-05 14:36:30,638] Trial 125 finished with value: 0.10360427156262417 and parameters: {'model_type': 'mlp', 'hidden_dims': '[512, 64]', 'dropout': 0.21484285980607273, 'batch_norm': False, 'lr': 0.00019212868177786394, 'weight_decay': 1.772834617446866e-06, 'epochs': 342, 'loss': 'mae', 'optimizer': 'adam', 'graph_mode': 'off', 'use_snp_selection': False}. Best is trial 111 with value: 0.10997558096353947.
[I 2025-12-05 14:36:33,157] Trial 126 finished with value: 0.09317353613065565 and parameters: {'model_type': 'mlp', 'hidden_dims': '[512, 64]', 'dropout': 0.2166938674612076, 'batch_norm': False, 'lr': 0.00019997279880808747, 'weight_decay': 1.7497017368733137e-06, 'epochs': 239, 'loss': 'mae', 'optimizer': 'adam', 'graph_mode': 'off', 'use_snp_selection': False}. Best is trial 111 with value: 0.10997558096353947.
[I 2025-12-05 14:36:36,514] Trial 127 finished with value: 0.04045892581704734 and parameters: {'model_type': 'mlp', 'hidden_dims': '[512, 64]', 'dropout': 0.19961441162341467, 'batch_norm': True, 'lr': 1.1239301330658129e-05, 'weight_decay': 1.2370135237148441e-07, 'epochs': 341, 'loss': 'mae', 'optimizer': 'adam', 'graph_mode': 'off', 'use_snp_selection': False}. Best is trial 111 with value: 0.10997558096353947.
[I 2025-12-05 14:36:38,813] Trial 128 finished with value: 0.08779021698526969 and parameters: {'model_type': 'mlp', 'hidden_dims': '[512, 64]', 'dropout': 0.15952124483840366, 'batch_norm': False, 'lr': 0.00015697901518039605, 'weight_decay': 2.4690343630470288e-06, 'epochs': 211, 'loss': 'mae', 'optimizer': 'adam', 'graph_mode': 'off', 'use_snp_selection': False}. Best is trial 111 with value: 0.10997558096353947.
[I 2025-12-05 14:36:42,149] Trial 129 finished with value: 0.09573656032562877 and parameters: {'model_type': 'mlp', 'hidden_dims': '[512, 64]', 'dropout': 0.2570652290325777, 'batch_norm': False, 'lr': 0.00011275219562785419, 'weight_decay': 5.799518093566615e-07, 'epochs': 346, 'loss': 'mae', 'optimizer': 'adam', 'graph_mode': 'off', 'use_snp_selection': False}. Best is trial 111 with value: 0.10997558096353947.
[I 2025-12-05 14:36:45,357] Trial 130 finished with value: 0.08680006402212419 and parameters: {'model_type': 'mlp', 'hidden_dims': '[512, 64]', 'dropout': 0.21140431631536463, 'batch_norm': False, 'lr': 9.160692420051556e-05, 'weight_decay': 1.2588070917123961e-06, 'epochs': 328, 'loss': 'mae', 'optimizer': 'adam', 'graph_mode': 'off', 'use_snp_selection': False}. Best is trial 111 with value: 0.10997558096353947.
[I 2025-12-05 14:36:46,863] Trial 131 finished with value: 0.07164256575246031 and parameters: {'model_type': 'mlp', 'hidden_dims': '[256, 128]', 'dropout': 0.23013633393466926, 'batch_norm': False, 'lr': 0.00039875525654672574, 'weight_decay': 3.3059036220784177e-06, 'epochs': 253, 'loss': 'mae', 'optimizer': 'adam', 'graph_mode': 'off', 'use_snp_selection': False}. Best is trial 111 with value: 0.10997558096353947.
[I 2025-12-05 14:36:48,027] Trial 132 finished with value: 0.07565421106566304 and parameters: {'model_type': 'mlp', 'hidden_dims': '[256, 128]', 'dropout': 0.2919358395621098, 'batch_norm': False, 'lr': 0.000304124749940141, 'weight_decay': 0.0001485309716485401, 'epochs': 161, 'loss': 'mse', 'optimizer': 'adam', 'graph_mode': 'off', 'use_snp_selection': False}. Best is trial 111 with value: 0.10997558096353947.
[I 2025-12-05 14:36:50,584] Trial 133 finished with value: 0.08344670275364321 and parameters: {'model_type': 'mlp', 'hidden_dims': '[512, 64]', 'dropout': 0.2458882945177689, 'batch_norm': False, 'lr': 0.00018647904558343847, 'weight_decay': 1.955556155233006e-06, 'epochs': 245, 'loss': 'mae', 'optimizer': 'adam', 'graph_mode': 'off', 'use_snp_selection': False}. Best is trial 111 with value: 0.10997558096353947.
[I 2025-12-05 14:36:52,246] Trial 134 finished with value: 0.04602398128449108 and parameters: {'model_type': 'mlp', 'hidden_dims': '[512, 128]', 'dropout': 0.5311372862863, 'batch_norm': False, 'lr': 0.00024425429230007695, 'weight_decay': 2.854758781850131e-06, 'epochs': 128, 'loss': 'mse', 'optimizer': 'adam', 'graph_mode': 'off', 'use_snp_selection': False}. Best is trial 111 with value: 0.10997558096353947.
[I 2025-12-05 14:36:53,505] Trial 135 finished with value: 0.08768425059379363 and parameters: {'model_type': 'mlp', 'hidden_dims': '[256, 128]', 'dropout': 0.17410292987145082, 'batch_norm': False, 'lr': 0.0003491142384190352, 'weight_decay': 4.506653595571004e-06, 'epochs': 186, 'loss': 'mae', 'optimizer': 'adam', 'graph_mode': 'off', 'use_snp_selection': False}. Best is trial 111 with value: 0.10997558096353947.
[I 2025-12-05 14:36:54,802] Trial 136 finished with value: 0.06603364978099908 and parameters: {'model_type': 'mlp', 'hidden_dims': '[256, 128]', 'dropout': 0.3293132633531341, 'batch_norm': False, 'lr': 0.00022520476961782184, 'weight_decay': 6.038308428906125e-06, 'epochs': 196, 'loss': 'mse', 'optimizer': 'adam', 'graph_mode': 'off', 'use_snp_selection': False}. Best is trial 111 with value: 0.10997558096353947.
[I 2025-12-05 14:36:57,374] Trial 137 finished with value: -0.024083346539095454 and parameters: {'model_type': 'mlp', 'hidden_dims': '[256, 128, 64]', 'dropout': 0.18817798063267838, 'batch_norm': False, 'lr': 4.339639858679377e-06, 'weight_decay': 3.8102732599143685e-06, 'epochs': 74, 'loss': 'mae', 'optimizer': 'adam', 'graph_mode': 'off', 'use_snp_selection': True, 'num_snps': 52512}. Best is trial 111 with value: 0.10997558096353947.
[I 2025-12-05 14:37:00,168] Trial 138 finished with value: 0.08690468103447792 and parameters: {'model_type': 'mlp', 'hidden_dims': '[512, 64]', 'dropout': 0.2209112051042046, 'batch_norm': False, 'lr': 7.753143378098666e-05, 'weight_decay': 1.6412150927050289e-06, 'epochs': 265, 'loss': 'mse', 'optimizer': 'adam', 'graph_mode': 'off', 'use_snp_selection': False}. Best is trial 111 with value: 0.10997558096353947.
[I 2025-12-05 14:37:01,291] Trial 139 finished with value: 0.09670168142945568 and parameters: {'model_type': 'mlp', 'hidden_dims': '[256, 128]', 'dropout': 0.30909606216120905, 'batch_norm': False, 'lr': 0.0001373489356571981, 'weight_decay': 2.380588712778721e-06, 'epochs': 148, 'loss': 'mae', 'optimizer': 'adam', 'graph_mode': 'off', 'use_snp_selection': False}. Best is trial 111 with value: 0.10997558096353947.
[I 2025-12-05 14:37:05,523] Trial 140 finished with value: 0.04275612631393025 and parameters: {'model_type': 'mlp', 'hidden_dims': '[512, 64]', 'dropout': 0.2059952795016383, 'batch_norm': False, 'lr': 2.736291701053748e-06, 'weight_decay': 7.77225311274235e-06, 'epochs': 334, 'loss': 'mse', 'optimizer': 'adam', 'graph_mode': 'off', 'use_snp_selection': True, 'num_snps': 48545}. Best is trial 111 with value: 0.10997558096353947.
[I 2025-12-05 14:37:07,028] Trial 141 finished with value: 0.05887671820057123 and parameters: {'model_type': 'mlp', 'hidden_dims': '[256, 128]', 'dropout': 0.19556915327139268, 'batch_norm': False, 'lr': 0.00044640075977502936, 'weight_decay': 5.045646630732244e-06, 'epochs': 323, 'loss': 'mae', 'optimizer': 'adam', 'graph_mode': 'off', 'use_snp_selection': True, 'num_snps': 10627}. Best is trial 111 with value: 0.10997558096353947.
[I 2025-12-05 14:37:09,527] Trial 142 finished with value: 0.0964218841697431 and parameters: {'model_type': 'mlp', 'hidden_dims': '[256, 128]', 'dropout': 0.2347529043572053, 'batch_norm': False, 'lr': 0.00011835409526619004, 'weight_decay': 3.374026044145933e-07, 'epochs': 309, 'loss': 'mae', 'optimizer': 'adam', 'graph_mode': 'off', 'use_snp_selection': True, 'num_snps': 35522}. Best is trial 111 with value: 0.10997558096353947.
[I 2025-12-05 14:37:12,005] Trial 143 finished with value: 0.10010252952750581 and parameters: {'model_type': 'mlp', 'hidden_dims': '[256, 128]', 'dropout': 0.21478068076000795, 'batch_norm': False, 'lr': 0.0002968312114218032, 'weight_decay': 3.635607752794388e-06, 'epochs': 344, 'loss': 'mae', 'optimizer': 'adam', 'graph_mode': 'off', 'use_snp_selection': True, 'num_snps': 33735}. Best is trial 111 with value: 0.10997558096353947.
[I 2025-12-05 14:37:15,736] Trial 144 finished with value: 0.0784890080004116 and parameters: {'model_type': 'mlp', 'hidden_dims': '[256, 128]', 'dropout': 0.22441832136623713, 'batch_norm': False, 'lr': 0.00027300528501427715, 'weight_decay': 3.505597345290027e-06, 'epochs': 350, 'loss': 'mae', 'optimizer': 'adam', 'graph_mode': 'off', 'use_snp_selection': True, 'num_snps': 57943}. Best is trial 111 with value: 0.10997558096353947.
[I 2025-12-05 14:37:18,508] Trial 145 finished with value: 0.10137049367566282 and parameters: {'model_type': 'mlp', 'hidden_dims': '[256, 128]', 'dropout': 0.24397283093367605, 'batch_norm': False, 'lr': 0.00017527108917254458, 'weight_decay': 2.832952524463569e-06, 'epochs': 344, 'loss': 'mae', 'optimizer': 'adam', 'graph_mode': 'off', 'use_snp_selection': True, 'num_snps': 38381}. Best is trial 111 with value: 0.10997558096353947.
[I 2025-12-05 14:37:21,028] Trial 146 finished with value: 0.10250438512069587 and parameters: {'model_type': 'mlp', 'hidden_dims': '[256, 128]', 'dropout': 0.21480894967019992, 'batch_norm': False, 'lr': 0.00019983997301824786, 'weight_decay': 7.081713389133733e-07, 'epochs': 343, 'loss': 'mae', 'optimizer': 'adam', 'graph_mode': 'off', 'use_snp_selection': True, 'num_snps': 33595}. Best is trial 111 with value: 0.10997558096353947.
[I 2025-12-05 14:37:23,199] Trial 147 finished with value: 0.09000848186799883 and parameters: {'model_type': 'mlp', 'hidden_dims': '[128, 64]', 'dropout': 0.21447094369828418, 'batch_norm': False, 'lr': 0.00019704692283238975, 'weight_decay': 8.296499701746622e-07, 'epochs': 342, 'loss': 'mae', 'optimizer': 'adam', 'graph_mode': 'off', 'use_snp_selection': True, 'num_snps': 33798}. Best is trial 111 with value: 0.10997558096353947.
[I 2025-12-05 14:37:25,989] Trial 148 finished with value: 0.081340974304626 and parameters: {'model_type': 'mlp', 'hidden_dims': '[256, 128]', 'dropout': 0.24202720140562908, 'batch_norm': False, 'lr': 0.0001545084503830695, 'weight_decay': 6.835180857519821e-07, 'epochs': 345, 'loss': 'mae', 'optimizer': 'adam', 'graph_mode': 'off', 'use_snp_selection': True, 'num_snps': 39338}. Best is trial 111 with value: 0.10997558096353947.
[I 2025-12-05 14:37:29,080] Trial 149 finished with value: 0.07334211100922983 and parameters: {'model_type': 'mlp', 'hidden_dims': '[256, 128]', 'dropout': 0.2038923707769374, 'batch_norm': True, 'lr': 0.00017725551928186146, 'weight_decay': 9.455165272801206e-07, 'epochs': 332, 'loss': 'mae', 'optimizer': 'adam', 'graph_mode': 'off', 'use_snp_selection': True, 'num_snps': 44530}. Best is trial 111 with value: 0.10997558096353947.
[I 2025-12-05 14:37:32,377] Trial 0 finished with value: 0.06292004628056067 and parameters: {'model_type': 'mlp', 'hidden_dims': '[128, 64]', 'dropout': 0.199031432379812, 'batch_norm': True, 'lr': 1.8408544111075837e-06, 'weight_decay': 5.5136510071208614e-05, 'epochs': 336, 'loss': 'mae', 'optimizer': 'adam', 'graph_mode': 'off', 'use_snp_selection': True, 'num_snps': 43862}. Best is trial 0 with value: 0.06292004628056067.
[I 2025-12-05 14:37:34,545] Trial 1 finished with value: 0.13357823710774458 and parameters: {'model_type': 'mlp', 'hidden_dims': '[256, 128]', 'dropout': 0.4370668075331726, 'batch_norm': True, 'lr': 7.133471581159139e-05, 'weight_decay': 1.128633586803549e-05, 'epochs': 242, 'loss': 'mae', 'optimizer': 'adam', 'graph_mode': 'off', 'use_snp_selection': False}. Best is trial 1 with value: 0.13357823710774458.
[I 2025-12-05 14:37:36,321] Trial 2 finished with value: 0.07956553909389164 and parameters: {'model_type': 'mlp', 'hidden_dims': '[256, 128, 64]', 'dropout': 0.41314357415569625, 'batch_norm': False, 'lr': 3.952233718592101e-06, 'weight_decay': 0.00026754769258252603, 'epochs': 149, 'loss': 'mse', 'optimizer': 'adam', 'graph_mode': 'off', 'use_snp_selection': True, 'num_snps': 11571}. Best is trial 1 with value: 0.13357823710774458.
[I 2025-12-05 14:37:40,859] Trial 3 finished with value: 0.10735352439355325 and parameters: {'model_type': 'mlp', 'hidden_dims': '[512, 64]', 'dropout': 0.5938127374509361, 'batch_norm': False, 'lr': 5.67704586114731e-06, 'weight_decay': 2.4518087630137052e-05, 'epochs': 320, 'loss': 'mae', 'optimizer': 'adam', 'graph_mode': 'off', 'use_snp_selection': False}. Best is trial 1 with value: 0.13357823710774458.
[I 2025-12-05 14:37:45,227] Trial 4 finished with value: 0.06250904233700187 and parameters: {'model_type': 'mlp', 'hidden_dims': '[512, 128]', 'dropout': 0.25746343592134413, 'batch_norm': True, 'lr': 1.3467657668402788e-06, 'weight_decay': 0.00033087251918647806, 'epochs': 277, 'loss': 'mse', 'optimizer': 'adam', 'graph_mode': 'off', 'use_snp_selection': True, 'num_snps': 36675}. Best is trial 1 with value: 0.13357823710774458.
[I 2025-12-05 14:37:48,406] Trial 5 finished with value: 0.07492279245607623 and parameters: {'model_type': 'mlp', 'hidden_dims': '[512, 64]', 'dropout': 0.38275350994408375, 'batch_norm': True, 'lr': 1.5586664309232824e-06, 'weight_decay': 0.0008227664668621182, 'epochs': 145, 'loss': 'mae', 'optimizer': 'adam', 'graph_mode': 'off', 'use_snp_selection': True, 'num_snps': 32148}. Best is trial 1 with value: 0.13357823710774458.
[I 2025-12-05 14:37:50,292] Trial 6 finished with value: 0.1352076851881473 and parameters: {'model_type': 'mlp', 'hidden_dims': '[256, 128]', 'dropout': 0.3930109900265879, 'batch_norm': False, 'lr': 4.892964372128395e-05, 'weight_decay': 1.5809549317992182e-06, 'epochs': 199, 'loss': 'mse', 'optimizer': 'adam', 'graph_mode': 'off', 'use_snp_selection': False}. Best is trial 6 with value: 0.1352076851881473.
[I 2025-12-05 14:37:52,156] Trial 7 finished with value: 0.13806657067959 and parameters: {'model_type': 'mlp', 'hidden_dims': '[512, 256]', 'dropout': 0.15343979219678458, 'batch_norm': True, 'lr': 6.234003099047341e-05, 'weight_decay': 3.894760610535477e-07, 'epochs': 97, 'loss': 'mse', 'optimizer': 'adam', 'graph_mode': 'off', 'use_snp_selection': False}. Best is trial 7 with value: 0.13806657067959.
[I 2025-12-05 14:37:56,651] Trial 8 finished with value: 0.16425476779755838 and parameters: {'model_type': 'mlp', 'hidden_dims': '[512, 128]', 'dropout': 0.10743001231661406, 'batch_norm': True, 'lr': 0.00023728538449271062, 'weight_decay': 1.7629071578048637e-05, 'epochs': 312, 'loss': 'mae', 'optimizer': 'adam', 'graph_mode': 'off', 'use_snp_selection': False}. Best is trial 8 with value: 0.16425476779755838.
[I 2025-12-05 14:37:59,457] Trial 9 finished with value: 0.15050319737514115 and parameters: {'model_type': 'mlp', 'hidden_dims': '[512, 64]', 'dropout': 0.14505336736221927, 'batch_norm': True, 'lr': 5.8619638388111826e-05, 'weight_decay': 6.200156172669308e-07, 'epochs': 175, 'loss': 'mse', 'optimizer': 'adam', 'graph_mode': 'off', 'use_snp_selection': False}. Best is trial 8 with value: 0.16425476779755838.
[I 2025-12-05 14:38:00,791] Trial 10 finished with value: 0.10089039828607002 and parameters: {'model_type': 'mlp', 'hidden_dims': '[512, 128]', 'dropout': 0.2800030442581858, 'batch_norm': False, 'lr': 0.0004919806695968258, 'weight_decay': 2.9953888095455486e-06, 'epochs': 55, 'loss': 'mae', 'optimizer': 'adam', 'graph_mode': 'off', 'use_snp_selection': False}. Best is trial 8 with value: 0.16425476779755838.
[I 2025-12-05 14:38:04,152] Trial 11 finished with value: 0.15970964366718288 and parameters: {'model_type': 'mlp', 'hidden_dims': '[512, 128]', 'dropout': 0.10095648685224448, 'batch_norm': True, 'lr': 0.0003411435764085616, 'weight_decay': 1.2045055692919657e-07, 'epochs': 216, 'loss': 'mse', 'optimizer': 'adam', 'graph_mode': 'off', 'use_snp_selection': False}. Best is trial 8 with value: 0.16425476779755838.
[I 2025-12-05 14:38:07,972] Trial 12 finished with value: 0.16044240891136896 and parameters: {'model_type': 'mlp', 'hidden_dims': '[512, 128]', 'dropout': 0.10344600881777158, 'batch_norm': True, 'lr': 0.0006674532614549997, 'weight_decay': 1.3081036432574914e-07, 'epochs': 255, 'loss': 'mae', 'optimizer': 'adam', 'graph_mode': 'off', 'use_snp_selection': False}. Best is trial 8 with value: 0.16425476779755838.
[I 2025-12-05 14:38:12,162] Trial 13 finished with value: 0.15319679337888306 and parameters: {'model_type': 'mlp', 'hidden_dims': '[512, 128]', 'dropout': 0.24294613148916022, 'batch_norm': True, 'lr': 0.00020263148232071683, 'weight_decay': 5.014770300041101e-06, 'epochs': 285, 'loss': 'mae', 'optimizer': 'adam', 'graph_mode': 'off', 'use_snp_selection': False}. Best is trial 8 with value: 0.16425476779755838.
