[I 2025-12-06 04:27:55,272] Trial 137 finished with value: 0.2992213463033704 and parameters: {'model_type': 'mlp', 'hidden_dims': '[512, 256]', 'dropout': 0.5532605635316636, 'batch_norm': False, 'lr': 1.0962098478557948e-05, 'weight_decay': 1.4039704509223411e-06, 'epochs': 208, 'loss': 'mse', 'optimizer': 'adam', 'graph_mode': 'off', 'use_snp_selection': True, 'num_snps': 25915}. Best is trial 117 with value: 0.30504323694695823.
[I 2025-12-06 04:28:38,605] Trial 138 finished with value: 0.2949991037860033 and parameters: {'model_type': 'mlp', 'hidden_dims': '[512, 256]', 'dropout': 0.5257150411207672, 'batch_norm': False, 'lr': 1.6119333472925105e-05, 'weight_decay': 3.4904898483908493e-06, 'epochs': 167, 'loss': 'mse', 'optimizer': 'adam', 'graph_mode': 'off', 'use_snp_selection': True, 'num_snps': 29800}. Best is trial 117 with value: 0.30504323694695823.
[I 2025-12-06 04:29:28,749] Trial 139 finished with value: 0.29577215947485336 and parameters: {'model_type': 'mlp', 'hidden_dims': '[512, 128]', 'dropout': 0.576115362354032, 'batch_norm': False, 'lr': 1.1638856050481603e-05, 'weight_decay': 1.7148503068251556e-06, 'epochs': 184, 'loss': 'mae', 'optimizer': 'adam', 'graph_mode': 'off', 'use_snp_selection': True, 'num_snps': 36382}. Best is trial 117 with value: 0.30504323694695823.
[I 2025-12-06 04:30:08,683] Trial 140 finished with value: 0.2985657275480646 and parameters: {'model_type': 'mlp', 'hidden_dims': '[256, 128]', 'dropout': 0.5931714697678709, 'batch_norm': False, 'lr': 1.001491315122057e-05, 'weight_decay': 2.4451423416122615e-06, 'epochs': 199, 'loss': 'mse', 'optimizer': 'adam', 'graph_mode': 'off', 'use_snp_selection': True, 'num_snps': 33168}. Best is trial 117 with value: 0.30504323694695823.
[I 2025-12-06 04:30:54,315] Trial 141 finished with value: 0.2993330602880892 and parameters: {'model_type': 'mlp', 'hidden_dims': '[512, 256]', 'dropout': 0.5771306351391238, 'batch_norm': False, 'lr': 9.155846145147405e-06, 'weight_decay': 1.7514176003988375e-06, 'epochs': 179, 'loss': 'mse', 'optimizer': 'adam', 'graph_mode': 'off', 'use_snp_selection': True, 'num_snps': 31128}. Best is trial 117 with value: 0.30504323694695823.
[I 2025-12-06 04:31:38,723] Trial 142 finished with value: 0.30098728270489666 and parameters: {'model_type': 'mlp', 'hidden_dims': '[512, 256]', 'dropout': 0.558278375694873, 'batch_norm': False, 'lr': 7.737906583735353e-06, 'weight_decay': 1.9566238024012033e-06, 'epochs': 159, 'loss': 'mse', 'optimizer': 'adam', 'graph_mode': 'off', 'use_snp_selection': True, 'num_snps': 32003}. Best is trial 117 with value: 0.30504323694695823.
[I 2025-12-06 04:32:22,593] Trial 143 finished with value: 0.2969731434126711 and parameters: {'model_type': 'mlp', 'hidden_dims': '[512, 256]', 'dropout': 0.5814551405698777, 'batch_norm': False, 'lr': 1.4572963121883841e-05, 'weight_decay': 4.369263889330812e-06, 'epochs': 167, 'loss': 'mse', 'optimizer': 'adam', 'graph_mode': 'off', 'use_snp_selection': True, 'num_snps': 30230}. Best is trial 117 with value: 0.30504323694695823.
[I 2025-12-06 04:33:14,288] Trial 144 finished with value: 0.3014823574465201 and parameters: {'model_type': 'mlp', 'hidden_dims': '[512, 256]', 'dropout': 0.5410174621608683, 'batch_norm': False, 'lr': 5.240007496756206e-06, 'weight_decay': 2.8557021144034315e-06, 'epochs': 193, 'loss': 'mse', 'optimizer': 'adam', 'graph_mode': 'off', 'use_snp_selection': True, 'num_snps': 36525}. Best is trial 117 with value: 0.30504323694695823.
[I 2025-12-06 04:34:05,622] Trial 145 finished with value: 0.3008372831311171 and parameters: {'model_type': 'mlp', 'hidden_dims': '[512, 256]', 'dropout': 0.5374778783821811, 'batch_norm': False, 'lr': 5.112648841476231e-06, 'weight_decay': 3.7356464048604013e-06, 'epochs': 191, 'loss': 'mse', 'optimizer': 'adam', 'graph_mode': 'off', 'use_snp_selection': True, 'num_snps': 36419}. Best is trial 117 with value: 0.30504323694695823.
[I 2025-12-06 04:34:51,463] Trial 146 finished with value: 0.30162941547444716 and parameters: {'model_type': 'mlp', 'hidden_dims': '[512, 128]', 'dropout': 0.5490053650682127, 'batch_norm': False, 'lr': 7.460671759376934e-06, 'weight_decay': 2.7887517069169418e-06, 'epochs': 219, 'loss': 'mse', 'optimizer': 'adam', 'graph_mode': 'off', 'use_snp_selection': True, 'num_snps': 27741}. Best is trial 117 with value: 0.30504323694695823.
[I 2025-12-06 04:35:38,936] Trial 147 finished with value: 0.30001402774076447 and parameters: {'model_type': 'mlp', 'hidden_dims': '[512, 128]', 'dropout': 0.5511255639494221, 'batch_norm': False, 'lr': 6.892466207140574e-06, 'weight_decay': 5.722092180111844e-06, 'epochs': 249, 'loss': 'mse', 'optimizer': 'adam', 'graph_mode': 'off', 'use_snp_selection': True, 'num_snps': 26965}. Best is trial 117 with value: 0.30504323694695823.
[I 2025-12-06 04:36:26,427] Trial 148 finished with value: 0.2823843353803183 and parameters: {'model_type': 'mlp', 'hidden_dims': '[512, 128]', 'dropout': 0.5301967664862022, 'batch_norm': False, 'lr': 1.880675837103991e-05, 'weight_decay': 2.441367353890359e-06, 'epochs': 238, 'loss': 'mse', 'optimizer': 'adam', 'graph_mode': 'off', 'use_snp_selection': True, 'num_snps': 27979}. Best is trial 117 with value: 0.30504323694695823.
[I 2025-12-06 04:37:10,392] Trial 149 finished with value: 0.2923715198761904 and parameters: {'model_type': 'mlp', 'hidden_dims': '[512, 128]', 'dropout': 0.5646587446302693, 'batch_norm': False, 'lr': 8.963782486470979e-06, 'weight_decay': 7.716921795271382e-06, 'epochs': 223, 'loss': 'mse', 'optimizer': 'adam', 'graph_mode': 'off', 'use_snp_selection': False}. Best is trial 117 with value: 0.30504323694695823.
[I 2025-12-06 04:38:07,200] Trial 0 finished with value: 0.2559376694772644 and parameters: {'model_type': 'mlp', 'hidden_dims': '[128, 64]', 'dropout': 0.199031432379812, 'batch_norm': True, 'lr': 1.8408544111075837e-06, 'weight_decay': 5.5136510071208614e-05, 'epochs': 336, 'loss': 'mae', 'optimizer': 'adam', 'graph_mode': 'off', 'use_snp_selection': True, 'num_snps': 43862}. Best is trial 0 with value: 0.2559376694772644.
[I 2025-12-06 04:38:34,257] Trial 1 finished with value: 0.29457987821693316 and parameters: {'model_type': 'mlp', 'hidden_dims': '[256, 128]', 'dropout': 0.4370668075331726, 'batch_norm': True, 'lr': 7.133471581159139e-05, 'weight_decay': 1.128633586803549e-05, 'epochs': 242, 'loss': 'mae', 'optimizer': 'adam', 'graph_mode': 'off', 'use_snp_selection': False}. Best is trial 1 with value: 0.29457987821693316.
[I 2025-12-06 04:39:00,920] Trial 2 finished with value: 0.26996618315244686 and parameters: {'model_type': 'mlp', 'hidden_dims': '[256, 128, 64]', 'dropout': 0.41314357415569625, 'batch_norm': False, 'lr': 3.952233718592101e-06, 'weight_decay': 0.00026754769258252603, 'epochs': 149, 'loss': 'mse', 'optimizer': 'adam', 'graph_mode': 'off', 'use_snp_selection': True, 'num_snps': 11571}. Best is trial 1 with value: 0.29457987821693316.
[I 2025-12-06 04:40:01,720] Trial 3 finished with value: 0.2976750567903959 and parameters: {'model_type': 'mlp', 'hidden_dims': '[512, 64]', 'dropout': 0.5938127374509361, 'batch_norm': False, 'lr': 5.67704586114731e-06, 'weight_decay': 2.4518087630137052e-05, 'epochs': 320, 'loss': 'mae', 'optimizer': 'adam', 'graph_mode': 'off', 'use_snp_selection': False}. Best is trial 3 with value: 0.2976750567903959.
[I 2025-12-06 04:41:02,408] Trial 4 finished with value: 0.26468447562273617 and parameters: {'model_type': 'mlp', 'hidden_dims': '[512, 128]', 'dropout': 0.25746343592134413, 'batch_norm': True, 'lr': 1.3467657668402788e-06, 'weight_decay': 0.00033087251918647806, 'epochs': 277, 'loss': 'mse', 'optimizer': 'adam', 'graph_mode': 'off', 'use_snp_selection': True, 'num_snps': 36675}. Best is trial 3 with value: 0.2976750567903959.
[I 2025-12-06 04:41:45,580] Trial 5 finished with value: 0.2432174200316362 and parameters: {'model_type': 'mlp', 'hidden_dims': '[512, 64]', 'dropout': 0.38275350994408375, 'batch_norm': True, 'lr': 1.5586664309232824e-06, 'weight_decay': 0.0008227664668621182, 'epochs': 145, 'loss': 'mae', 'optimizer': 'adam', 'graph_mode': 'off', 'use_snp_selection': True, 'num_snps': 32148}. Best is trial 3 with value: 0.2976750567903959.
[I 2025-12-06 04:42:08,232] Trial 6 finished with value: 0.29929436217786 and parameters: {'model_type': 'mlp', 'hidden_dims': '[256, 128]', 'dropout': 0.3930109900265879, 'batch_norm': False, 'lr': 4.892964372128395e-05, 'weight_decay': 1.5809549317992182e-06, 'epochs': 199, 'loss': 'mse', 'optimizer': 'adam', 'graph_mode': 'off', 'use_snp_selection': False}. Best is trial 6 with value: 0.29929436217786.
[I 2025-12-06 04:42:30,517] Trial 7 finished with value: 0.2988373687257984 and parameters: {'model_type': 'mlp', 'hidden_dims': '[512, 256]', 'dropout': 0.15343979219678458, 'batch_norm': True, 'lr': 6.234003099047341e-05, 'weight_decay': 3.894760610535477e-07, 'epochs': 97, 'loss': 'mse', 'optimizer': 'adam', 'graph_mode': 'off', 'use_snp_selection': False}. Best is trial 6 with value: 0.29929436217786.
[I 2025-12-06 04:43:30,665] Trial 8 finished with value: 0.29796197383505085 and parameters: {'model_type': 'mlp', 'hidden_dims': '[512, 128]', 'dropout': 0.10743001231661406, 'batch_norm': True, 'lr': 0.00023728538449271062, 'weight_decay': 1.7629071578048637e-05, 'epochs': 312, 'loss': 'mae', 'optimizer': 'adam', 'graph_mode': 'off', 'use_snp_selection': False}. Best is trial 6 with value: 0.29929436217786.
[I 2025-12-06 04:44:06,647] Trial 9 finished with value: 0.29675137438724714 and parameters: {'model_type': 'mlp', 'hidden_dims': '[512, 64]', 'dropout': 0.14505336736221927, 'batch_norm': True, 'lr': 5.8619638388111826e-05, 'weight_decay': 6.200156172669308e-07, 'epochs': 175, 'loss': 'mse', 'optimizer': 'adam', 'graph_mode': 'off', 'use_snp_selection': False}. Best is trial 6 with value: 0.29929436217786.
[I 2025-12-06 04:44:15,495] Trial 10 finished with value: 0.22017087219435982 and parameters: {'model_type': 'mlp', 'hidden_dims': '[256, 128]', 'dropout': 0.5267360651501256, 'batch_norm': False, 'lr': 0.00032393778075602147, 'weight_decay': 1.936962886850364e-06, 'epochs': 46, 'loss': 'mse', 'optimizer': 'adam', 'graph_mode': 'off', 'use_snp_selection': False}. Best is trial 6 with value: 0.29929436217786.
[I 2025-12-06 04:44:34,200] Trial 11 finished with value: 0.29916995536292124 and parameters: {'model_type': 'mlp', 'hidden_dims': '[512, 256]', 'dropout': 0.30438831352760154, 'batch_norm': False, 'lr': 1.6474108386126448e-05, 'weight_decay': 1.1557995186088584e-07, 'epochs': 77, 'loss': 'mse', 'optimizer': 'adam', 'graph_mode': 'off', 'use_snp_selection': False}. Best is trial 6 with value: 0.29929436217786.
[I 2025-12-06 04:45:19,317] Trial 12 finished with value: 0.2973703425008508 and parameters: {'model_type': 'mlp', 'hidden_dims': '[512, 256]', 'dropout': 0.30345365279407, 'batch_norm': False, 'lr': 1.3209655691727925e-05, 'weight_decay': 1.3081036432574914e-07, 'epochs': 228, 'loss': 'mse', 'optimizer': 'adam', 'graph_mode': 'off', 'use_snp_selection': False}. Best is trial 6 with value: 0.29929436217786.
[I 2025-12-06 04:45:40,307] Trial 13 finished with value: 0.3022276878025328 and parameters: {'model_type': 'mlp', 'hidden_dims': '[512, 256]', 'dropout': 0.3041365173646664, 'batch_norm': False, 'lr': 1.7059846107560612e-05, 'weight_decay': 2.215502086408347e-06, 'epochs': 90, 'loss': 'mse', 'optimizer': 'adam', 'graph_mode': 'off', 'use_snp_selection': False}. Best is trial 13 with value: 0.3022276878025328.
[I 2025-12-06 04:46:03,445] Trial 14 finished with value: 0.30170702342913414 and parameters: {'model_type': 'mlp', 'hidden_dims': '[256, 128]', 'dropout': 0.4775860401239199, 'batch_norm': False, 'lr': 1.8515283540496236e-05, 'weight_decay': 2.9485387428537088e-06, 'epochs': 203, 'loss': 'mse', 'optimizer': 'adam', 'graph_mode': 'off', 'use_snp_selection': False}. Best is trial 13 with value: 0.3022276878025328.
[I 2025-12-06 04:46:13,460] Trial 15 finished with value: 0.29948247620200336 and parameters: {'model_type': 'mlp', 'hidden_dims': '[128, 64]', 'dropout': 0.4842859214315609, 'batch_norm': False, 'lr': 1.5349602488718283e-05, 'weight_decay': 2.7151002232381553e-06, 'epochs': 109, 'loss': 'mse', 'optimizer': 'adam', 'graph_mode': 'off', 'use_snp_selection': False}. Best is trial 13 with value: 0.3022276878025328.
[I 2025-12-06 04:46:36,865] Trial 16 finished with value: 0.28637492266280606 and parameters: {'model_type': 'mlp', 'hidden_dims': '[256, 128, 64]', 'dropout': 0.49548735804867233, 'batch_norm': False, 'lr': 0.00017549215405955411, 'weight_decay': 5.098763140321504e-06, 'epochs': 206, 'loss': 'mse', 'optimizer': 'adam', 'graph_mode': 'off', 'use_snp_selection': False}. Best is trial 13 with value: 0.3022276878025328.
[I 2025-12-06 04:47:05,441] Trial 17 finished with value: 0.187013901121341 and parameters: {'model_type': 'mlp', 'hidden_dims': '[256, 128]', 'dropout': 0.32888830259108426, 'batch_norm': False, 'lr': 0.000906375209920231, 'weight_decay': 5.22524745148761e-07, 'epochs': 264, 'loss': 'mse', 'optimizer': 'adam', 'graph_mode': 'off', 'use_snp_selection': False}. Best is trial 13 with value: 0.3022276878025328.
[I 2025-12-06 04:48:05,480] Trial 18 finished with value: 0.30407583502110824 and parameters: {'model_type': 'mlp', 'hidden_dims': '[512, 256]', 'dropout': 0.2312628506238401, 'batch_norm': False, 'lr': 5.895320539592683e-06, 'weight_decay': 5.1284909832915915e-05, 'epochs': 136, 'loss': 'mse', 'optimizer': 'adam', 'graph_mode': 'off', 'use_snp_selection': True, 'num_snps': 58241}. Best is trial 18 with value: 0.30407583502110824.
[I 2025-12-06 04:49:03,482] Trial 19 finished with value: 0.3062375931415773 and parameters: {'model_type': 'mlp', 'hidden_dims': '[512, 256]', 'dropout': 0.23740597688310255, 'batch_norm': False, 'lr': 5.767840939344411e-06, 'weight_decay': 5.6158937663828e-05, 'epochs': 132, 'loss': 'mse', 'optimizer': 'adam', 'graph_mode': 'off', 'use_snp_selection': True, 'num_snps': 55667}. Best is trial 19 with value: 0.3062375931415773.
[I 2025-12-06 04:50:02,461] Trial 20 finished with value: 0.30444170801425885 and parameters: {'model_type': 'mlp', 'hidden_dims': '[512, 256]', 'dropout': 0.2234072291344338, 'batch_norm': False, 'lr': 4.558277358562508e-06, 'weight_decay': 6.03843060477238e-05, 'epochs': 132, 'loss': 'mse', 'optimizer': 'adam', 'graph_mode': 'off', 'use_snp_selection': True, 'num_snps': 57703}. Best is trial 19 with value: 0.3062375931415773.
[I 2025-12-06 04:51:02,301] Trial 21 finished with value: 0.3092264416225702 and parameters: {'model_type': 'mlp', 'hidden_dims': '[512, 256]', 'dropout': 0.21608125620642743, 'batch_norm': False, 'lr': 3.4067812907763153e-06, 'weight_decay': 6.240828532429687e-05, 'epochs': 127, 'loss': 'mse', 'optimizer': 'adam', 'graph_mode': 'off', 'use_snp_selection': True, 'num_snps': 59845}. Best is trial 21 with value: 0.3092264416225702.
[I 2025-12-06 04:52:02,031] Trial 22 finished with value: 0.30352002844161047 and parameters: {'model_type': 'mlp', 'hidden_dims': '[512, 256]', 'dropout': 0.23724341703358476, 'batch_norm': False, 'lr': 3.0547652316429354e-06, 'weight_decay': 0.00010392392951710245, 'epochs': 127, 'loss': 'mse', 'optimizer': 'adam', 'graph_mode': 'off', 'use_snp_selection': True, 'num_snps': 59635}. Best is trial 21 with value: 0.3092264416225702.
[I 2025-12-06 04:52:46,194] Trial 23 finished with value: 0.30108857446109155 and parameters: {'model_type': 'mlp', 'hidden_dims': '[512, 256]', 'dropout': 0.18603709218350384, 'batch_norm': False, 'lr': 7.033685324209763e-06, 'weight_decay': 0.00015442883947506113, 'epochs': 58, 'loss': 'mse', 'optimizer': 'adam', 'graph_mode': 'off', 'use_snp_selection': True, 'num_snps': 51170}. Best is trial 21 with value: 0.3092264416225702.
[I 2025-12-06 04:53:53,164] Trial 24 finished with value: 0.306782507580932 and parameters: {'model_type': 'mlp', 'hidden_dims': '[512, 256]', 'dropout': 0.2619364254158056, 'batch_norm': False, 'lr': 3.127125040660233e-06, 'weight_decay': 3.3613189633918335e-05, 'epochs': 171, 'loss': 'mse', 'optimizer': 'adam', 'graph_mode': 'off', 'use_snp_selection': True, 'num_snps': 59676}. Best is trial 21 with value: 0.3092264416225702.
[I 2025-12-06 04:54:51,235] Trial 25 finished with value: 0.3026398852392869 and parameters: {'model_type': 'mlp', 'hidden_dims': '[512, 256]', 'dropout': 0.26704543008479464, 'batch_norm': False, 'lr': 2.525339768002393e-06, 'weight_decay': 2.985741597599423e-05, 'epochs': 168, 'loss': 'mse', 'optimizer': 'adam', 'graph_mode': 'off', 'use_snp_selection': True, 'num_snps': 48648}. Best is trial 21 with value: 0.3092264416225702.
[I 2025-12-06 04:55:23,947] Trial 26 finished with value: 0.29528393894022253 and parameters: {'model_type': 'mlp', 'hidden_dims': '[512, 256]', 'dropout': 0.3578423549662221, 'batch_norm': False, 'lr': 9.489932359098394e-06, 'weight_decay': 6.824031569191681e-06, 'epochs': 174, 'loss': 'mae', 'optimizer': 'adam', 'graph_mode': 'off', 'use_snp_selection': True, 'num_snps': 15352}. Best is trial 21 with value: 0.3092264416225702.
[I 2025-12-06 04:56:14,929] Trial 27 finished with value: 0.27572280285806205 and parameters: {'model_type': 'mlp', 'hidden_dims': '[512, 256]', 'dropout': 0.17655459084906752, 'batch_norm': False, 'lr': 1.1807903705496437e-06, 'weight_decay': 0.00011405171588048061, 'epochs': 113, 'loss': 'mse', 'optimizer': 'adam', 'graph_mode': 'off', 'use_snp_selection': True, 'num_snps': 49332}. Best is trial 21 with value: 0.3092264416225702.
[I 2025-12-06 04:56:44,209] Trial 28 finished with value: 0.2835569391620716 and parameters: {'model_type': 'mlp', 'hidden_dims': '[128, 64]', 'dropout': 0.1217703903481114, 'batch_norm': False, 'lr': 3.0159433733494728e-05, 'weight_decay': 0.0007139245379102172, 'epochs': 158, 'loss': 'mse', 'optimizer': 'adam', 'graph_mode': 'off', 'use_snp_selection': True, 'num_snps': 20572}. Best is trial 21 with value: 0.3092264416225702.
[I 2025-12-06 04:57:20,934] Trial 29 finished with value: 0.19249226980995754 and parameters: {'model_type': 'mlp', 'hidden_dims': '[256, 128, 64]', 'dropout': 0.26604666782500913, 'batch_norm': False, 'lr': 2.2722298506687673e-06, 'weight_decay': 1.2952164003921455e-05, 'epochs': 65, 'loss': 'mae', 'optimizer': 'adam', 'graph_mode': 'off', 'use_snp_selection': True, 'num_snps': 42428}. Best is trial 21 with value: 0.3092264416225702.
[I 2025-12-06 04:58:24,689] Trial 30 finished with value: 0.29049006314207687 and parameters: {'model_type': 'mlp', 'hidden_dims': '[512, 128]', 'dropout': 0.20774578306868896, 'batch_norm': False, 'lr': 1.0059927497642944e-06, 'weight_decay': 3.893568147885251e-05, 'epochs': 187, 'loss': 'mse', 'optimizer': 'adam', 'graph_mode': 'off', 'use_snp_selection': True, 'num_snps': 53270}. Best is trial 21 with value: 0.3092264416225702.
[I 2025-12-06 04:59:22,855] Trial 31 finished with value: 0.3061103242873595 and parameters: {'model_type': 'mlp', 'hidden_dims': '[512, 256]', 'dropout': 0.20885096708237239, 'batch_norm': False, 'lr': 4.063769715447454e-06, 'weight_decay': 7.319200137089266e-05, 'epochs': 122, 'loss': 'mse', 'optimizer': 'adam', 'graph_mode': 'off', 'use_snp_selection': True, 'num_snps': 59155}. Best is trial 21 with value: 0.3092264416225702.
[I 2025-12-06 05:00:19,756] Trial 32 finished with value: 0.30282873119154646 and parameters: {'model_type': 'mlp', 'hidden_dims': '[512, 256]', 'dropout': 0.17034185610604383, 'batch_norm': False, 'lr': 3.4246204584252263e-06, 'weight_decay': 6.15224391479617e-05, 'epochs': 115, 'loss': 'mse', 'optimizer': 'adam', 'graph_mode': 'off', 'use_snp_selection': True, 'num_snps': 58810}. Best is trial 21 with value: 0.3092264416225702.
[I 2025-12-06 05:01:09,169] Trial 33 finished with value: 0.3046534818622745 and parameters: {'model_type': 'mlp', 'hidden_dims': '[512, 256]', 'dropout': 0.19937571408607369, 'batch_norm': False, 'lr': 8.735248439752535e-06, 'weight_decay': 0.0002417809145739789, 'epochs': 87, 'loss': 'mse', 'optimizer': 'adam', 'graph_mode': 'off', 'use_snp_selection': True, 'num_snps': 53746}. Best is trial 21 with value: 0.3092264416225702.
[I 2025-12-06 05:01:47,852] Trial 34 finished with value: 0.25085473701599553 and parameters: {'model_type': 'mlp', 'hidden_dims': '[128, 64]', 'dropout': 0.27363512749363006, 'batch_norm': False, 'lr': 1.9048233263420534e-06, 'weight_decay': 2.0964181892187047e-05, 'epochs': 153, 'loss': 'mae', 'optimizer': 'adam', 'graph_mode': 'off', 'use_snp_selection': True, 'num_snps': 44801}. Best is trial 21 with value: 0.3092264416225702.
[I 2025-12-06 05:02:46,202] Trial 35 finished with value: 0.2694981558211628 and parameters: {'model_type': 'mlp', 'hidden_dims': '[512, 256]', 'dropout': 0.23578711163561697, 'batch_norm': True, 'lr': 3.905575584679427e-06, 'weight_decay': 9.197957368328016e-05, 'epochs': 121, 'loss': 'mse', 'optimizer': 'adam', 'graph_mode': 'off', 'use_snp_selection': True, 'num_snps': 59736}. Best is trial 21 with value: 0.3092264416225702.
[I 2025-12-06 05:03:54,463] Trial 36 finished with value: 0.29645548916654674 and parameters: {'model_type': 'mlp', 'hidden_dims': '[512, 256]', 'dropout': 0.28523168221739126, 'batch_norm': False, 'lr': 5.269377871779031e-06, 'weight_decay': 0.0003461146211867709, 'epochs': 227, 'loss': 'mse', 'optimizer': 'adam', 'graph_mode': 'off', 'use_snp_selection': True, 'num_snps': 51586}. Best is trial 21 with value: 0.3092264416225702.
[I 2025-12-06 05:04:53,144] Trial 37 finished with value: 0.28392522185472097 and parameters: {'model_type': 'mlp', 'hidden_dims': '[512, 64]', 'dropout': 0.2098260664544247, 'batch_norm': False, 'lr': 1.88549312355286e-06, 'weight_decay': 1.0199830331303484e-05, 'epochs': 147, 'loss': 'mae', 'optimizer': 'adam', 'graph_mode': 'off', 'use_snp_selection': True, 'num_snps': 54692}. Best is trial 21 with value: 0.3092264416225702.
