[I 2025-12-06 09:49:52,476] Trial 27 finished with value: 0.37377832157183755 and parameters: {'model_type': 'mlp', 'hidden_dims': '[512, 256]', 'dropout': 0.4505538394743273, 'batch_norm': False, 'lr': 3.7608576805419707e-06, 'weight_decay': 9.211006472356309e-06, 'epochs': 272, 'loss': 'mae', 'optimizer': 'adam', 'graph_mode': 'off', 'use_snp_selection': False}. Best is trial 21 with value: 0.38161588475176045.
[I 2025-12-06 09:50:42,609] Trial 28 finished with value: 0.37514213875056135 and parameters: {'model_type': 'mlp', 'hidden_dims': '[512, 256]', 'dropout': 0.33879162118476425, 'batch_norm': False, 'lr': 1.024528578386996e-06, 'weight_decay': 5.355784885289668e-07, 'epochs': 233, 'loss': 'mse', 'optimizer': 'adam', 'graph_mode': 'off', 'use_snp_selection': False}. Best is trial 21 with value: 0.38161588475176045.
[I 2025-12-06 09:51:15,260] Trial 29 finished with value: 0.34788296533905616 and parameters: {'model_type': 'mlp', 'hidden_dims': '[128, 64]', 'dropout': 0.5154708649295417, 'batch_norm': False, 'lr': 1.975018793733613e-06, 'weight_decay': 1.302623445497834e-05, 'epochs': 325, 'loss': 'mae', 'optimizer': 'adam', 'graph_mode': 'off', 'use_snp_selection': True, 'num_snps': 19468}. Best is trial 21 with value: 0.38161588475176045.
[I 2025-12-06 09:51:48,909] Trial 30 finished with value: 0.34860668904356007 and parameters: {'model_type': 'mlp', 'hidden_dims': '[256, 128]', 'dropout': 0.2523135802350327, 'batch_norm': False, 'lr': 0.0001787155823809422, 'weight_decay': 2.4813971388646674e-07, 'epochs': 301, 'loss': 'mae', 'optimizer': 'adam', 'graph_mode': 'off', 'use_snp_selection': False}. Best is trial 21 with value: 0.38161588475176045.
[I 2025-12-06 09:52:57,065] Trial 31 finished with value: 0.37547606507569353 and parameters: {'model_type': 'mlp', 'hidden_dims': '[512, 128]', 'dropout': 0.5549619400840187, 'batch_norm': False, 'lr': 4.493581407729816e-06, 'weight_decay': 5.2706051809104526e-05, 'epochs': 330, 'loss': 'mae', 'optimizer': 'adam', 'graph_mode': 'off', 'use_snp_selection': False}. Best is trial 21 with value: 0.38161588475176045.
[I 2025-12-06 09:53:34,798] Trial 32 finished with value: 0.36335172812992506 and parameters: {'model_type': 'mlp', 'hidden_dims': '[256, 128, 64]', 'dropout': 0.47236890037373924, 'batch_norm': False, 'lr': 8.49999361489693e-06, 'weight_decay': 7.380004480579292e-06, 'epochs': 329, 'loss': 'mae', 'optimizer': 'adam', 'graph_mode': 'off', 'use_snp_selection': False}. Best is trial 21 with value: 0.38161588475176045.
[I 2025-12-06 09:54:39,560] Trial 33 finished with value: 0.37757643972451965 and parameters: {'model_type': 'mlp', 'hidden_dims': '[512, 256]', 'dropout': 0.5640803881311349, 'batch_norm': False, 'lr': 1.7698785220113678e-06, 'weight_decay': 4.135013656806006e-06, 'epochs': 310, 'loss': 'mae', 'optimizer': 'adam', 'graph_mode': 'off', 'use_snp_selection': False}. Best is trial 21 with value: 0.38161588475176045.
[I 2025-12-06 09:55:40,238] Trial 34 finished with value: 0.3752638038578704 and parameters: {'model_type': 'mlp', 'hidden_dims': '[512, 256]', 'dropout': 0.4276466438673292, 'batch_norm': False, 'lr': 1.8666734257713301e-06, 'weight_decay': 2.604019769102547e-06, 'epochs': 288, 'loss': 'mae', 'optimizer': 'adam', 'graph_mode': 'off', 'use_snp_selection': False}. Best is trial 21 with value: 0.38161588475176045.
[I 2025-12-06 09:56:36,950] Trial 35 finished with value: 0.34363254246739594 and parameters: {'model_type': 'mlp', 'hidden_dims': '[512, 256]', 'dropout': 0.5677307493378301, 'batch_norm': True, 'lr': 3.3119869504094393e-06, 'weight_decay': 1.0580284536532736e-06, 'epochs': 265, 'loss': 'mae', 'optimizer': 'adam', 'graph_mode': 'off', 'use_snp_selection': False}. Best is trial 21 with value: 0.38161588475176045.
[I 2025-12-06 09:58:11,057] Trial 36 finished with value: 0.37602939609833 and parameters: {'model_type': 'mlp', 'hidden_dims': '[512, 256]', 'dropout': 0.4756129760132672, 'batch_norm': False, 'lr': 1.5395421230872504e-06, 'weight_decay': 4.401594504603237e-06, 'epochs': 308, 'loss': 'mae', 'optimizer': 'adam', 'graph_mode': 'off', 'use_snp_selection': True, 'num_snps': 58661}. Best is trial 21 with value: 0.38161588475176045.
[I 2025-12-06 09:58:48,546] Trial 37 finished with value: 0.3690622362980903 and parameters: {'model_type': 'mlp', 'hidden_dims': '[256, 128]', 'dropout': 0.3876081862562828, 'batch_norm': False, 'lr': 4.054730596571049e-06, 'weight_decay': 1.3353168677917424e-05, 'epochs': 329, 'loss': 'mse', 'optimizer': 'adam', 'graph_mode': 'off', 'use_snp_selection': False}. Best is trial 21 with value: 0.38161588475176045.
[I 2025-12-06 09:59:25,814] Trial 38 finished with value: 0.3105728887301459 and parameters: {'model_type': 'mlp', 'hidden_dims': '[512, 256]', 'dropout': 0.5264540910189692, 'batch_norm': True, 'lr': 2.0064177347899414e-06, 'weight_decay': 2.1453345610485802e-06, 'epochs': 159, 'loss': 'mae', 'optimizer': 'adam', 'graph_mode': 'off', 'use_snp_selection': True, 'num_snps': 19911}. Best is trial 21 with value: 0.38161588475176045.
[I 2025-12-06 09:59:41,776] Trial 39 finished with value: 0.3058897594081514 and parameters: {'model_type': 'mlp', 'hidden_dims': '[256, 128, 64]', 'dropout': 0.40929995184129053, 'batch_norm': False, 'lr': 1.2964038476570126e-06, 'weight_decay': 8.140327257141351e-07, 'epochs': 114, 'loss': 'mse', 'optimizer': 'adam', 'graph_mode': 'off', 'use_snp_selection': False}. Best is trial 21 with value: 0.38161588475176045.
[I 2025-12-06 10:00:41,567] Trial 40 finished with value: 0.3548896727765559 and parameters: {'model_type': 'mlp', 'hidden_dims': '[512, 128]', 'dropout': 0.4516631822043905, 'batch_norm': True, 'lr': 0.00010299837783030175, 'weight_decay': 4.489470230160319e-06, 'epochs': 284, 'loss': 'mae', 'optimizer': 'adam', 'graph_mode': 'off', 'use_snp_selection': False}. Best is trial 21 with value: 0.38161588475176045.
[I 2025-12-06 10:01:46,520] Trial 41 finished with value: 0.37622133379856126 and parameters: {'model_type': 'mlp', 'hidden_dims': '[512, 64]', 'dropout': 0.598512754874621, 'batch_norm': False, 'lr': 6.730750252096974e-06, 'weight_decay': 2.6745796242782336e-05, 'epochs': 314, 'loss': 'mae', 'optimizer': 'adam', 'graph_mode': 'off', 'use_snp_selection': False}. Best is trial 21 with value: 0.38161588475176045.
[I 2025-12-06 10:02:09,804] Trial 42 finished with value: 0.37303229496284557 and parameters: {'model_type': 'mlp', 'hidden_dims': '[128, 64]', 'dropout': 0.5673005012781385, 'batch_norm': False, 'lr': 6.471559758038858e-06, 'weight_decay': 3.4100338968613976e-05, 'epochs': 339, 'loss': 'mae', 'optimizer': 'adam', 'graph_mode': 'off', 'use_snp_selection': False}. Best is trial 21 with value: 0.38161588475176045.
[I 2025-12-06 10:03:13,893] Trial 43 finished with value: 0.37802801687683585 and parameters: {'model_type': 'mlp', 'hidden_dims': '[512, 64]', 'dropout': 0.5408755590681921, 'batch_norm': False, 'lr': 2.514903418687396e-06, 'weight_decay': 1.1774174986744581e-05, 'epochs': 308, 'loss': 'mae', 'optimizer': 'adam', 'graph_mode': 'off', 'use_snp_selection': False}. Best is trial 21 with value: 0.38161588475176045.
[I 2025-12-06 10:04:18,867] Trial 44 finished with value: 0.3811480118574328 and parameters: {'model_type': 'mlp', 'hidden_dims': '[512, 256]', 'dropout': 0.5385490817493612, 'batch_norm': False, 'lr': 2.731300591774471e-06, 'weight_decay': 1.0645476339140863e-05, 'epochs': 311, 'loss': 'mae', 'optimizer': 'adam', 'graph_mode': 'off', 'use_snp_selection': False}. Best is trial 21 with value: 0.38161588475176045.
[I 2025-12-06 10:04:47,384] Trial 45 finished with value: 0.34749227585380904 and parameters: {'model_type': 'mlp', 'hidden_dims': '[256, 128]', 'dropout': 0.5413654478954265, 'batch_norm': False, 'lr': 1.4233900727859362e-06, 'weight_decay': 1.704113341566465e-05, 'epochs': 238, 'loss': 'mae', 'optimizer': 'adam', 'graph_mode': 'off', 'use_snp_selection': False}. Best is trial 21 with value: 0.38161588475176045.
[I 2025-12-06 10:05:08,653] Trial 46 finished with value: 0.34205360090527304 and parameters: {'model_type': 'mlp', 'hidden_dims': '[128, 64]', 'dropout': 0.5745899520935314, 'batch_norm': True, 'lr': 1.114987796028141e-05, 'weight_decay': 2.0110380303608144e-06, 'epochs': 300, 'loss': 'mse', 'optimizer': 'adam', 'graph_mode': 'off', 'use_snp_selection': False}. Best is trial 21 with value: 0.38161588475176045.
[I 2025-12-06 10:05:22,264] Trial 47 finished with value: 0.3149657036116296 and parameters: {'model_type': 'mlp', 'hidden_dims': '[512, 64]', 'dropout': 0.511032845767093, 'batch_norm': False, 'lr': 4.137609096658546e-06, 'weight_decay': 8.891040891356356e-05, 'epochs': 44, 'loss': 'mae', 'optimizer': 'adam', 'graph_mode': 'off', 'use_snp_selection': False}. Best is trial 21 with value: 0.38161588475176045.
[I 2025-12-06 10:06:16,030] Trial 48 finished with value: 0.34768855611472155 and parameters: {'model_type': 'mlp', 'hidden_dims': '[512, 64]', 'dropout': 0.5334971143839279, 'batch_norm': False, 'lr': 1.9479299238073842e-05, 'weight_decay': 4.796652470709742e-06, 'epochs': 258, 'loss': 'mse', 'optimizer': 'adam', 'graph_mode': 'off', 'use_snp_selection': False}. Best is trial 21 with value: 0.38161588475176045.
[I 2025-12-06 10:07:39,733] Trial 49 finished with value: 0.35796356885633424 and parameters: {'model_type': 'mlp', 'hidden_dims': '[512, 256]', 'dropout': 0.559581582293204, 'batch_norm': False, 'lr': 3.469837603522817e-05, 'weight_decay': 3.138516400360869e-06, 'epochs': 339, 'loss': 'mae', 'optimizer': 'adam', 'graph_mode': 'off', 'use_snp_selection': True, 'num_snps': 46888}. Best is trial 21 with value: 0.38161588475176045.
[I 2025-12-06 10:08:43,167] Trial 50 finished with value: 0.3760484120024117 and parameters: {'model_type': 'mlp', 'hidden_dims': '[512, 128]', 'dropout': 0.5992701608341526, 'batch_norm': False, 'lr': 1.9623981140687907e-06, 'weight_decay': 1.8988496380961656e-05, 'epochs': 305, 'loss': 'mae', 'optimizer': 'adam', 'graph_mode': 'off', 'use_snp_selection': False}. Best is trial 21 with value: 0.38161588475176045.
[I 2025-12-06 10:09:49,995] Trial 51 finished with value: 0.37948774078238984 and parameters: {'model_type': 'mlp', 'hidden_dims': '[512, 256]', 'dropout': 0.4942704868073419, 'batch_norm': False, 'lr': 2.4714056148062314e-06, 'weight_decay': 8.224263755144308e-06, 'epochs': 320, 'loss': 'mae', 'optimizer': 'adam', 'graph_mode': 'off', 'use_snp_selection': False}. Best is trial 21 with value: 0.38161588475176045.
[I 2025-12-06 10:10:51,736] Trial 52 finished with value: 0.37132149674142606 and parameters: {'model_type': 'mlp', 'hidden_dims': '[512, 256]', 'dropout': 0.5109000732205154, 'batch_norm': False, 'lr': 3.0292829901897158e-06, 'weight_decay': 6.616936580841803e-06, 'epochs': 294, 'loss': 'mae', 'optimizer': 'adam', 'graph_mode': 'off', 'use_snp_selection': False}. Best is trial 21 with value: 0.38161588475176045.
[I 2025-12-06 10:11:50,722] Trial 53 finished with value: 0.3758752344442915 and parameters: {'model_type': 'mlp', 'hidden_dims': '[512, 256]', 'dropout': 0.543138290743295, 'batch_norm': False, 'lr': 4.999765535660342e-06, 'weight_decay': 0.0007871230623739149, 'epochs': 280, 'loss': 'mae', 'optimizer': 'adam', 'graph_mode': 'off', 'use_snp_selection': False}. Best is trial 21 with value: 0.38161588475176045.
[I 2025-12-06 10:12:12,677] Trial 54 finished with value: 0.3676297098094408 and parameters: {'model_type': 'mlp', 'hidden_dims': '[128, 64]', 'dropout': 0.4719140701362331, 'batch_norm': False, 'lr': 2.435256818182346e-06, 'weight_decay': 9.347289093399756e-06, 'epochs': 314, 'loss': 'mae', 'optimizer': 'adam', 'graph_mode': 'off', 'use_snp_selection': False}. Best is trial 21 with value: 0.38161588475176045.
[I 2025-12-06 10:13:22,593] Trial 55 finished with value: 0.3677640741611053 and parameters: {'model_type': 'mlp', 'hidden_dims': '[512, 256]', 'dropout': 0.5800671841585077, 'batch_norm': False, 'lr': 1.249137507012082e-06, 'weight_decay': 3.4694752115305496e-06, 'epochs': 337, 'loss': 'mae', 'optimizer': 'adam', 'graph_mode': 'off', 'use_snp_selection': False}. Best is trial 21 with value: 0.38161588475176045.
[I 2025-12-06 10:14:32,627] Trial 56 finished with value: 0.15007224980820552 and parameters: {'model_type': 'mlp', 'hidden_dims': '[512, 64]', 'dropout': 0.49056774856357716, 'batch_norm': False, 'lr': 0.0007171669415635536, 'weight_decay': 1.4808282438107747e-05, 'epochs': 349, 'loss': 'mse', 'optimizer': 'adam', 'graph_mode': 'off', 'use_snp_selection': False}. Best is trial 21 with value: 0.38161588475176045.
[I 2025-12-06 10:14:55,684] Trial 57 finished with value: 0.247231785900274 and parameters: {'model_type': 'mlp', 'hidden_dims': '[256, 128, 64]', 'dropout': 0.5226076970700884, 'batch_norm': True, 'lr': 1.6679605436865059e-06, 'weight_decay': 5.7780159535975395e-06, 'epochs': 181, 'loss': 'mae', 'optimizer': 'adam', 'graph_mode': 'off', 'use_snp_selection': False}. Best is trial 21 with value: 0.38161588475176045.
[I 2025-12-06 10:15:11,361] Trial 58 finished with value: 0.36599255892886395 and parameters: {'model_type': 'mlp', 'hidden_dims': '[128, 64]', 'dropout': 0.20660483606825308, 'batch_norm': False, 'lr': 2.291154541781739e-06, 'weight_decay': 1.6381854697913024e-06, 'epochs': 201, 'loss': 'mae', 'optimizer': 'adam', 'graph_mode': 'off', 'use_snp_selection': False}. Best is trial 21 with value: 0.38161588475176045.
[I 2025-12-06 10:16:17,625] Trial 59 finished with value: 0.36180236352574247 and parameters: {'model_type': 'mlp', 'hidden_dims': '[512, 256]', 'dropout': 0.3680719223169815, 'batch_norm': False, 'lr': 3.333823998998342e-06, 'weight_decay': 8.701531815830142e-06, 'epochs': 317, 'loss': 'mse', 'optimizer': 'adam', 'graph_mode': 'off', 'use_snp_selection': False}. Best is trial 21 with value: 0.38161588475176045.
[I 2025-12-06 10:16:28,797] Trial 60 finished with value: 0.3570932226305653 and parameters: {'model_type': 'mlp', 'hidden_dims': '[128, 64]', 'dropout': 0.43500540085271355, 'batch_norm': False, 'lr': 5.321739546426458e-06, 'weight_decay': 1.1718901180899568e-05, 'epochs': 121, 'loss': 'mae', 'optimizer': 'adam', 'graph_mode': 'off', 'use_snp_selection': False}. Best is trial 21 with value: 0.38161588475176045.
[I 2025-12-06 10:17:35,838] Trial 61 finished with value: 0.3770395654800922 and parameters: {'model_type': 'mlp', 'hidden_dims': '[512, 256]', 'dropout': 0.49016428347156327, 'batch_norm': False, 'lr': 2.6527870613864366e-06, 'weight_decay': 3.669365763696764e-05, 'epochs': 321, 'loss': 'mae', 'optimizer': 'adam', 'graph_mode': 'off', 'use_snp_selection': False}. Best is trial 21 with value: 0.38161588475176045.
[I 2025-12-06 10:18:45,353] Trial 62 finished with value: 0.37905658015744587 and parameters: {'model_type': 'mlp', 'hidden_dims': '[512, 256]', 'dropout': 0.4971777380425747, 'batch_norm': False, 'lr': 3.082400667545735e-06, 'weight_decay': 4.2313717604161626e-05, 'epochs': 334, 'loss': 'mae', 'optimizer': 'adam', 'graph_mode': 'off', 'use_snp_selection': False}. Best is trial 21 with value: 0.38161588475176045.
[I 2025-12-06 10:19:54,930] Trial 63 finished with value: 0.3795943364339153 and parameters: {'model_type': 'mlp', 'hidden_dims': '[512, 256]', 'dropout': 0.5476148795189436, 'batch_norm': False, 'lr': 3.6807146021326513e-06, 'weight_decay': 0.00010984193786760063, 'epochs': 335, 'loss': 'mae', 'optimizer': 'adam', 'graph_mode': 'off', 'use_snp_selection': False}. Best is trial 21 with value: 0.38161588475176045.
[I 2025-12-06 10:21:04,476] Trial 64 finished with value: 0.3663559260357925 and parameters: {'model_type': 'mlp', 'hidden_dims': '[512, 256]', 'dropout': 0.507352948040148, 'batch_norm': False, 'lr': 9.50286432205335e-06, 'weight_decay': 0.00011122760771755712, 'epochs': 336, 'loss': 'mae', 'optimizer': 'adam', 'graph_mode': 'off', 'use_snp_selection': False}. Best is trial 21 with value: 0.38161588475176045.
[I 2025-12-06 10:22:15,999] Trial 65 finished with value: 0.37749328865000836 and parameters: {'model_type': 'mlp', 'hidden_dims': '[512, 64]', 'dropout': 0.5459846996621682, 'batch_norm': False, 'lr': 3.5601680033703274e-06, 'weight_decay': 0.00035855087137895664, 'epochs': 347, 'loss': 'mae', 'optimizer': 'adam', 'graph_mode': 'off', 'use_snp_selection': False}. Best is trial 21 with value: 0.38161588475176045.
[I 2025-12-06 10:22:49,565] Trial 66 finished with value: 0.3526590619226111 and parameters: {'model_type': 'mlp', 'hidden_dims': '[512, 256]', 'dropout': 0.4580909488671154, 'batch_norm': False, 'lr': 4.72116340732256e-06, 'weight_decay': 0.0001458800106415332, 'epochs': 73, 'loss': 'mae', 'optimizer': 'adam', 'graph_mode': 'off', 'use_snp_selection': True, 'num_snps': 22881}. Best is trial 21 with value: 0.38161588475176045.
[I 2025-12-06 10:23:10,287] Trial 67 finished with value: 0.37000251418054253 and parameters: {'model_type': 'mlp', 'hidden_dims': '[128, 64]', 'dropout': 0.4088194660803423, 'batch_norm': False, 'lr': 8.186301698674736e-06, 'weight_decay': 0.00021043801549516417, 'epochs': 297, 'loss': 'mae', 'optimizer': 'adam', 'graph_mode': 'off', 'use_snp_selection': False}. Best is trial 21 with value: 0.38161588475176045.
[I 2025-12-06 10:24:18,180] Trial 68 finished with value: 0.3437253297509493 and parameters: {'model_type': 'mlp', 'hidden_dims': '[512, 256]', 'dropout': 0.5238145560527977, 'batch_norm': False, 'lr': 1.5815410505739007e-05, 'weight_decay': 6.758411368267838e-05, 'epochs': 331, 'loss': 'mse', 'optimizer': 'adam', 'graph_mode': 'off', 'use_snp_selection': False}. Best is trial 21 with value: 0.38161588475176045.
[I 2025-12-06 10:24:55,571] Trial 69 finished with value: 0.37342928324026725 and parameters: {'model_type': 'mlp', 'hidden_dims': '[256, 128]', 'dropout': 0.31946095607612834, 'batch_norm': False, 'lr': 6.019070296506176e-06, 'weight_decay': 2.1838481163115007e-05, 'epochs': 325, 'loss': 'mae', 'optimizer': 'adam', 'graph_mode': 'off', 'use_snp_selection': False}. Best is trial 21 with value: 0.38161588475176045.
[I 2025-12-06 10:26:06,369] Trial 70 finished with value: 0.3775653974652699 and parameters: {'model_type': 'mlp', 'hidden_dims': '[512, 256]', 'dropout': 0.4993391683755087, 'batch_norm': False, 'lr': 3.0187891000406386e-06, 'weight_decay': 0.0003205261760203484, 'epochs': 341, 'loss': 'mae', 'optimizer': 'adam', 'graph_mode': 'off', 'use_snp_selection': False}. Best is trial 21 with value: 0.38161588475176045.
[I 2025-12-06 10:27:11,223] Trial 71 finished with value: 0.3764082390163887 and parameters: {'model_type': 'mlp', 'hidden_dims': '[512, 256]', 'dropout': 0.5565109864489615, 'batch_norm': False, 'lr': 2.14883102027462e-06, 'weight_decay': 4.285900822384681e-05, 'epochs': 310, 'loss': 'mae', 'optimizer': 'adam', 'graph_mode': 'off', 'use_snp_selection': False}. Best is trial 21 with value: 0.38161588475176045.
[I 2025-12-06 10:28:09,864] Trial 72 finished with value: 0.3630797252203061 and parameters: {'model_type': 'mlp', 'hidden_dims': '[512, 256]', 'dropout': 0.5803339981643685, 'batch_norm': False, 'lr': 1.1358571460486669e-06, 'weight_decay': 5.5761068209754055e-06, 'epochs': 278, 'loss': 'mae', 'optimizer': 'adam', 'graph_mode': 'off', 'use_snp_selection': False}. Best is trial 21 with value: 0.38161588475176045.
[I 2025-12-06 10:29:13,679] Trial 73 finished with value: 0.3745263803333749 and parameters: {'model_type': 'mlp', 'hidden_dims': '[512, 256]', 'dropout': 0.532523026991224, 'batch_norm': False, 'lr': 1.6103664946811797e-06, 'weight_decay': 3.1506354229574334e-06, 'epochs': 305, 'loss': 'mae', 'optimizer': 'adam', 'graph_mode': 'off', 'use_snp_selection': False}. Best is trial 21 with value: 0.38161588475176045.
[I 2025-12-06 10:30:19,992] Trial 74 finished with value: 0.3769788606551433 and parameters: {'model_type': 'mlp', 'hidden_dims': '[512, 256]', 'dropout': 0.5488337196129542, 'batch_norm': False, 'lr': 3.6132037584744624e-06, 'weight_decay': 7.572790137346848e-06, 'epochs': 318, 'loss': 'mae', 'optimizer': 'adam', 'graph_mode': 'off', 'use_snp_selection': False}. Best is trial 21 with value: 0.38161588475176045.
[I 2025-12-06 10:31:20,507] Trial 75 finished with value: 0.3814756048337275 and parameters: {'model_type': 'mlp', 'hidden_dims': '[512, 128]', 'dropout': 0.5837906208304244, 'batch_norm': False, 'lr': 2.6685356561428836e-06, 'weight_decay': 2.340961277856712e-06, 'epochs': 289, 'loss': 'mae', 'optimizer': 'adam', 'graph_mode': 'off', 'use_snp_selection': False}. Best is trial 21 with value: 0.38161588475176045.
[I 2025-12-06 10:32:29,728] Trial 76 finished with value: 0.34121453281247477 and parameters: {'model_type': 'mlp', 'hidden_dims': '[512, 128]', 'dropout': 0.48081561412478974, 'batch_norm': True, 'lr': 2.6963299777403052e-06, 'weight_decay': 2.3124068420612038e-06, 'epochs': 331, 'loss': 'mae', 'optimizer': 'adam', 'graph_mode': 'off', 'use_snp_selection': False}. Best is trial 21 with value: 0.38161588475176045.
[I 2025-12-06 10:33:30,010] Trial 77 finished with value: 0.3738961469239067 and parameters: {'model_type': 'mlp', 'hidden_dims': '[512, 128]', 'dropout': 0.5849730556859626, 'batch_norm': False, 'lr': 4.6549579084427955e-06, 'weight_decay': 1.3419638504217984e-06, 'epochs': 288, 'loss': 'mse', 'optimizer': 'adam', 'graph_mode': 'off', 'use_snp_selection': False}. Best is trial 21 with value: 0.38161588475176045.
[I 2025-12-06 10:33:55,220] Trial 78 finished with value: 0.33739297426603737 and parameters: {'model_type': 'mlp', 'hidden_dims': '[512, 128]', 'dropout': 0.4598268852244887, 'batch_norm': False, 'lr': 3.961965339474901e-06, 'weight_decay': 1.914903345222515e-06, 'epochs': 322, 'loss': 'mae', 'optimizer': 'adam', 'graph_mode': 'off', 'use_snp_selection': True, 'num_snps': 2246}. Best is trial 21 with value: 0.38161588475176045.
