[I 2025-12-05 15:41:34,420] Trial 133 finished with value: 0.17205662394796392 and parameters: {'model_type': 'mlp', 'hidden_dims': '[256, 128]', 'dropout': 0.21302457542765085, 'batch_norm': True, 'lr': 0.000521112435317626, 'weight_decay': 1.025855190984383e-07, 'epochs': 269, 'loss': 'mse', 'optimizer': 'adam', 'graph_mode': 'off', 'use_snp_selection': True, 'num_snps': 10666}. Best is trial 114 with value: 0.19455525211499858.
[I 2025-12-05 15:41:35,620] Trial 134 finished with value: 0.18153907650850185 and parameters: {'model_type': 'mlp', 'hidden_dims': '[256, 128]', 'dropout': 0.2254803420517253, 'batch_norm': True, 'lr': 0.0006600808100126641, 'weight_decay': 3.540207041852088e-06, 'epochs': 259, 'loss': 'mse', 'optimizer': 'adam', 'graph_mode': 'off', 'use_snp_selection': True, 'num_snps': 12364}. Best is trial 114 with value: 0.19455525211499858.
[I 2025-12-05 15:41:36,896] Trial 135 finished with value: 0.15967816690703168 and parameters: {'model_type': 'mlp', 'hidden_dims': '[256, 128]', 'dropout': 0.1952840807318677, 'batch_norm': True, 'lr': 0.0004543464807998007, 'weight_decay': 3.346998785826732e-06, 'epochs': 256, 'loss': 'mse', 'optimizer': 'adam', 'graph_mode': 'off', 'use_snp_selection': True, 'num_snps': 14969}. Best is trial 114 with value: 0.19455525211499858.
[I 2025-12-05 15:41:38,421] Trial 136 finished with value: 0.1757234997777621 and parameters: {'model_type': 'mlp', 'hidden_dims': '[256, 128]', 'dropout': 0.22515267942681402, 'batch_norm': True, 'lr': 0.00037677854722598504, 'weight_decay': 5.414992422148265e-06, 'epochs': 242, 'loss': 'mse', 'optimizer': 'adam', 'graph_mode': 'off', 'use_snp_selection': True, 'num_snps': 19145}. Best is trial 114 with value: 0.19455525211499858.
[I 2025-12-05 15:41:39,599] Trial 137 finished with value: 0.1549669910665105 and parameters: {'model_type': 'mlp', 'hidden_dims': '[256, 128]', 'dropout': 0.2559164728418616, 'batch_norm': True, 'lr': 0.0003148348947158959, 'weight_decay': 2.289466533027602e-06, 'epochs': 261, 'loss': 'mse', 'optimizer': 'adam', 'graph_mode': 'off', 'use_snp_selection': True, 'num_snps': 9539}. Best is trial 114 with value: 0.19455525211499858.
[I 2025-12-05 15:41:41,001] Trial 138 finished with value: 0.16455344567265467 and parameters: {'model_type': 'mlp', 'hidden_dims': '[128, 64]', 'dropout': 0.20573340057291228, 'batch_norm': True, 'lr': 0.0008575336035893817, 'weight_decay': 4.121816898517161e-06, 'epochs': 249, 'loss': 'mse', 'optimizer': 'adam', 'graph_mode': 'off', 'use_snp_selection': True, 'num_snps': 15910}. Best is trial 114 with value: 0.19455525211499858.
[I 2025-12-05 15:41:42,261] Trial 139 finished with value: 0.08109979454301179 and parameters: {'model_type': 'mlp', 'hidden_dims': '[256, 128]', 'dropout': 0.22708974843772622, 'batch_norm': True, 'lr': 3.1695094605206434e-05, 'weight_decay': 1.3792772821889907e-06, 'epochs': 278, 'loss': 'mse', 'optimizer': 'adam', 'graph_mode': 'off', 'use_snp_selection': True, 'num_snps': 11932}. Best is trial 114 with value: 0.19455525211499858.
[I 2025-12-05 15:41:43,971] Trial 140 finished with value: 0.16965254420822298 and parameters: {'model_type': 'mlp', 'hidden_dims': '[256, 128, 64]', 'dropout': 0.5957360279941444, 'batch_norm': True, 'lr': 0.000578430892084041, 'weight_decay': 8.519348151704378e-06, 'epochs': 282, 'loss': 'mse', 'optimizer': 'adam', 'graph_mode': 'off', 'use_snp_selection': True, 'num_snps': 21984}. Best is trial 114 with value: 0.19455525211499858.
[I 2025-12-05 15:41:45,054] Trial 141 finished with value: 0.17829043332078331 and parameters: {'model_type': 'mlp', 'hidden_dims': '[256, 128]', 'dropout': 0.2388608361047686, 'batch_norm': True, 'lr': 0.0006894274129988816, 'weight_decay': 1.568043348199766e-07, 'epochs': 270, 'loss': 'mse', 'optimizer': 'adam', 'graph_mode': 'off', 'use_snp_selection': True, 'num_snps': 7656}. Best is trial 114 with value: 0.19455525211499858.
[I 2025-12-05 15:41:46,251] Trial 142 finished with value: 0.18674209475221548 and parameters: {'model_type': 'mlp', 'hidden_dims': '[256, 128]', 'dropout': 0.21454567335161398, 'batch_norm': True, 'lr': 0.0006776958499042796, 'weight_decay': 3.4334965372006353e-06, 'epochs': 253, 'loss': 'mse', 'optimizer': 'adam', 'graph_mode': 'off', 'use_snp_selection': True, 'num_snps': 12676}. Best is trial 114 with value: 0.19455525211499858.
[I 2025-12-05 15:41:47,593] Trial 143 finished with value: 0.16747293431552668 and parameters: {'model_type': 'mlp', 'hidden_dims': '[256, 128]', 'dropout': 0.214978508459453, 'batch_norm': True, 'lr': 0.0005304399768824308, 'weight_decay': 2.973385269584465e-06, 'epochs': 259, 'loss': 'mse', 'optimizer': 'adam', 'graph_mode': 'off', 'use_snp_selection': True, 'num_snps': 13734}. Best is trial 114 with value: 0.19455525211499858.
[I 2025-12-05 15:41:48,986] Trial 144 finished with value: 0.17401856512819605 and parameters: {'model_type': 'mlp', 'hidden_dims': '[256, 128]', 'dropout': 0.18725745495741444, 'batch_norm': True, 'lr': 0.0004193310810491865, 'weight_decay': 2.0159215403870825e-05, 'epochs': 253, 'loss': 'mse', 'optimizer': 'adam', 'graph_mode': 'off', 'use_snp_selection': True, 'num_snps': 15124}. Best is trial 114 with value: 0.19455525211499858.
[I 2025-12-05 15:41:50,578] Trial 145 finished with value: 0.1810371172582684 and parameters: {'model_type': 'mlp', 'hidden_dims': '[512, 128]', 'dropout': 0.2655914091646064, 'batch_norm': True, 'lr': 0.0008233678537860519, 'weight_decay': 3.712718189310772e-06, 'epochs': 264, 'loss': 'mse', 'optimizer': 'adam', 'graph_mode': 'off', 'use_snp_selection': True, 'num_snps': 20490}. Best is trial 114 with value: 0.19455525211499858.
[I 2025-12-05 15:41:51,846] Trial 146 finished with value: 0.17233472777815093 and parameters: {'model_type': 'mlp', 'hidden_dims': '[512, 64]', 'dropout': 0.2609862585607246, 'batch_norm': True, 'lr': 0.0008773572820089037, 'weight_decay': 2.534175438643823e-06, 'epochs': 267, 'loss': 'mse', 'optimizer': 'adam', 'graph_mode': 'off', 'use_snp_selection': True, 'num_snps': 11276}. Best is trial 114 with value: 0.19455525211499858.
[I 2025-12-05 15:41:53,209] Trial 147 finished with value: 0.14317295274529965 and parameters: {'model_type': 'mlp', 'hidden_dims': '[512, 128]', 'dropout': 0.27215286458722454, 'batch_norm': False, 'lr': 0.0006866290393192634, 'weight_decay': 3.5556871108317806e-06, 'epochs': 276, 'loss': 'mse', 'optimizer': 'adam', 'graph_mode': 'off', 'use_snp_selection': True, 'num_snps': 16903}. Best is trial 114 with value: 0.19455525211499858.
[I 2025-12-05 15:41:54,461] Trial 148 finished with value: 0.16124292701414272 and parameters: {'model_type': 'mlp', 'hidden_dims': '[256, 128]', 'dropout': 0.27943813307453114, 'batch_norm': True, 'lr': 0.0006142534521357671, 'weight_decay': 1.982278935577421e-06, 'epochs': 112, 'loss': 'mse', 'optimizer': 'adam', 'graph_mode': 'off', 'use_snp_selection': True, 'num_snps': 20087}. Best is trial 114 with value: 0.19455525211499858.
[I 2025-12-05 15:41:55,805] Trial 149 finished with value: 0.16938601166766165 and parameters: {'model_type': 'mlp', 'hidden_dims': '[512, 128]', 'dropout': 0.22827875383434904, 'batch_norm': True, 'lr': 0.00023209006527439703, 'weight_decay': 8.206077565997207e-07, 'epochs': 298, 'loss': 'mse', 'optimizer': 'adam', 'graph_mode': 'off', 'use_snp_selection': True, 'num_snps': 12845}. Best is trial 114 with value: 0.19455525211499858.
[I 2025-12-05 15:41:58,218] Trial 0 finished with value: 0.01796056789861906 and parameters: {'model_type': 'mlp', 'hidden_dims': '[128, 64]', 'dropout': 0.199031432379812, 'batch_norm': True, 'lr': 1.8408544111075837e-06, 'weight_decay': 5.5136510071208614e-05, 'epochs': 336, 'loss': 'mae', 'optimizer': 'adam', 'graph_mode': 'off', 'use_snp_selection': True, 'num_snps': 43862}. Best is trial 0 with value: 0.01796056789861906.
[I 2025-12-05 15:41:59,363] Trial 1 finished with value: 0.04422201833581286 and parameters: {'model_type': 'mlp', 'hidden_dims': '[256, 128]', 'dropout': 0.4370668075331726, 'batch_norm': True, 'lr': 7.133471581159139e-05, 'weight_decay': 1.128633586803549e-05, 'epochs': 242, 'loss': 'mae', 'optimizer': 'adam', 'graph_mode': 'off', 'use_snp_selection': False}. Best is trial 1 with value: 0.04422201833581286.
[I 2025-12-05 15:42:00,462] Trial 2 finished with value: 0.03097955334496006 and parameters: {'model_type': 'mlp', 'hidden_dims': '[256, 128, 64]', 'dropout': 0.41314357415569625, 'batch_norm': False, 'lr': 3.952233718592101e-06, 'weight_decay': 0.00026754769258252603, 'epochs': 149, 'loss': 'mse', 'optimizer': 'adam', 'graph_mode': 'off', 'use_snp_selection': True, 'num_snps': 11571}. Best is trial 1 with value: 0.04422201833581286.
[I 2025-12-05 15:42:02,341] Trial 3 finished with value: 0.0711103146279391 and parameters: {'model_type': 'mlp', 'hidden_dims': '[512, 64]', 'dropout': 0.5938127374509361, 'batch_norm': False, 'lr': 5.67704586114731e-06, 'weight_decay': 2.4518087630137052e-05, 'epochs': 320, 'loss': 'mae', 'optimizer': 'adam', 'graph_mode': 'off', 'use_snp_selection': False}. Best is trial 3 with value: 0.0711103146279391.
[I 2025-12-05 15:42:04,572] Trial 4 finished with value: 0.07239070609425559 and parameters: {'model_type': 'mlp', 'hidden_dims': '[512, 128]', 'dropout': 0.25746343592134413, 'batch_norm': True, 'lr': 1.3467657668402788e-06, 'weight_decay': 0.00033087251918647806, 'epochs': 277, 'loss': 'mse', 'optimizer': 'adam', 'graph_mode': 'off', 'use_snp_selection': True, 'num_snps': 36675}. Best is trial 4 with value: 0.07239070609425559.
[I 2025-12-05 15:42:06,342] Trial 5 finished with value: 0.02546443209993538 and parameters: {'model_type': 'mlp', 'hidden_dims': '[512, 64]', 'dropout': 0.38275350994408375, 'batch_norm': True, 'lr': 1.5586664309232824e-06, 'weight_decay': 0.0008227664668621182, 'epochs': 145, 'loss': 'mae', 'optimizer': 'adam', 'graph_mode': 'off', 'use_snp_selection': True, 'num_snps': 32148}. Best is trial 4 with value: 0.07239070609425559.
[I 2025-12-05 15:42:07,398] Trial 6 finished with value: 0.07597547217153904 and parameters: {'model_type': 'mlp', 'hidden_dims': '[256, 128]', 'dropout': 0.3930109900265879, 'batch_norm': False, 'lr': 4.892964372128395e-05, 'weight_decay': 1.5809549317992182e-06, 'epochs': 199, 'loss': 'mse', 'optimizer': 'adam', 'graph_mode': 'off', 'use_snp_selection': False}. Best is trial 6 with value: 0.07597547217153904.
[I 2025-12-05 15:42:08,552] Trial 7 finished with value: 0.050275032823926265 and parameters: {'model_type': 'mlp', 'hidden_dims': '[512, 256]', 'dropout': 0.15343979219678458, 'batch_norm': True, 'lr': 6.234003099047341e-05, 'weight_decay': 3.894760610535477e-07, 'epochs': 97, 'loss': 'mse', 'optimizer': 'adam', 'graph_mode': 'off', 'use_snp_selection': False}. Best is trial 6 with value: 0.07597547217153904.
[I 2025-12-05 15:42:10,429] Trial 8 finished with value: 0.05319636244503419 and parameters: {'model_type': 'mlp', 'hidden_dims': '[512, 128]', 'dropout': 0.10743001231661406, 'batch_norm': True, 'lr': 0.00023728538449271062, 'weight_decay': 1.7629071578048637e-05, 'epochs': 312, 'loss': 'mae', 'optimizer': 'adam', 'graph_mode': 'off', 'use_snp_selection': False}. Best is trial 6 with value: 0.07597547217153904.
[I 2025-12-05 15:42:11,824] Trial 9 finished with value: 0.06436424666102881 and parameters: {'model_type': 'mlp', 'hidden_dims': '[512, 64]', 'dropout': 0.14505336736221927, 'batch_norm': True, 'lr': 5.8619638388111826e-05, 'weight_decay': 6.200156172669308e-07, 'epochs': 175, 'loss': 'mse', 'optimizer': 'adam', 'graph_mode': 'off', 'use_snp_selection': False}. Best is trial 6 with value: 0.07597547217153904.
[I 2025-12-05 15:42:12,593] Trial 10 finished with value: 0.017286401097903824 and parameters: {'model_type': 'mlp', 'hidden_dims': '[256, 128]', 'dropout': 0.5267360651501256, 'batch_norm': False, 'lr': 0.00032393778075602147, 'weight_decay': 1.936962886850364e-06, 'epochs': 46, 'loss': 'mse', 'optimizer': 'adam', 'graph_mode': 'off', 'use_snp_selection': False}. Best is trial 6 with value: 0.07597547217153904.
[I 2025-12-05 15:42:15,815] Trial 11 finished with value: 0.05608445274317258 and parameters: {'model_type': 'mlp', 'hidden_dims': '[512, 128]', 'dropout': 0.26786631378741416, 'batch_norm': False, 'lr': 1.2467800292900095e-05, 'weight_decay': 2.805519019095577e-06, 'epochs': 248, 'loss': 'mse', 'optimizer': 'adam', 'graph_mode': 'off', 'use_snp_selection': True, 'num_snps': 59915}. Best is trial 6 with value: 0.07597547217153904.
[I 2025-12-05 15:42:16,833] Trial 12 finished with value: 0.04091185853097332 and parameters: {'model_type': 'mlp', 'hidden_dims': '[512, 128]', 'dropout': 0.3131971633261129, 'batch_norm': False, 'lr': 1.6491753181045373e-05, 'weight_decay': 1.046668821935964e-07, 'epochs': 234, 'loss': 'mse', 'optimizer': 'adam', 'graph_mode': 'off', 'use_snp_selection': True, 'num_snps': 8741}. Best is trial 6 with value: 0.07597547217153904.
[I 2025-12-05 15:42:18,430] Trial 13 finished with value: 0.05361001932907204 and parameters: {'model_type': 'mlp', 'hidden_dims': '[256, 128]', 'dropout': 0.25150379677329193, 'batch_norm': False, 'lr': 2.3323323883109033e-05, 'weight_decay': 0.00012560873309796632, 'epochs': 277, 'loss': 'mse', 'optimizer': 'adam', 'graph_mode': 'off', 'use_snp_selection': True, 'num_snps': 28162}. Best is trial 6 with value: 0.07597547217153904.
[I 2025-12-05 15:42:19,489] Trial 14 finished with value: 0.06299964143115788 and parameters: {'model_type': 'mlp', 'hidden_dims': '[256, 128, 64]', 'dropout': 0.3273507750503114, 'batch_norm': True, 'lr': 0.0009998076236933976, 'weight_decay': 2.9196532205641e-06, 'epochs': 208, 'loss': 'mse', 'optimizer': 'adam', 'graph_mode': 'off', 'use_snp_selection': False}. Best is trial 6 with value: 0.07597547217153904.
[I 2025-12-05 15:42:21,802] Trial 15 finished with value: 0.03504058128995445 and parameters: {'model_type': 'mlp', 'hidden_dims': '[128, 64]', 'dropout': 0.48177467097578114, 'batch_norm': False, 'lr': 7.159172693182823e-06, 'weight_decay': 0.000980572352827026, 'epochs': 285, 'loss': 'mse', 'optimizer': 'adam', 'graph_mode': 'off', 'use_snp_selection': True, 'num_snps': 45389}. Best is trial 6 with value: 0.07597547217153904.
[I 2025-12-05 15:42:23,295] Trial 16 finished with value: 0.04570241525342574 and parameters: {'model_type': 'mlp', 'hidden_dims': '[512, 256]', 'dropout': 0.2452054641609909, 'batch_norm': False, 'lr': 0.00016298882735125004, 'weight_decay': 4.7694313232819585e-06, 'epochs': 195, 'loss': 'mse', 'optimizer': 'adam', 'graph_mode': 'off', 'use_snp_selection': False}. Best is trial 6 with value: 0.07597547217153904.
[I 2025-12-05 15:42:25,040] Trial 17 finished with value: 0.03252719010326875 and parameters: {'model_type': 'mlp', 'hidden_dims': '[512, 128]', 'dropout': 0.3543702409063752, 'batch_norm': True, 'lr': 1.0138541947475892e-06, 'weight_decay': 7.225491944739041e-07, 'epochs': 275, 'loss': 'mse', 'optimizer': 'adam', 'graph_mode': 'off', 'use_snp_selection': True, 'num_snps': 25400}. Best is trial 6 with value: 0.07597547217153904.
[I 2025-12-05 15:42:27,079] Trial 18 finished with value: 0.06401108727774271 and parameters: {'model_type': 'mlp', 'hidden_dims': '[256, 128]', 'dropout': 0.45636041306649316, 'batch_norm': False, 'lr': 3.4929640053658854e-05, 'weight_decay': 5.394512930728927e-05, 'epochs': 125, 'loss': 'mse', 'optimizer': 'adam', 'graph_mode': 'off', 'use_snp_selection': True, 'num_snps': 43778}. Best is trial 6 with value: 0.07597547217153904.
[I 2025-12-05 15:42:29,099] Trial 19 finished with value: 0.05735766341590323 and parameters: {'model_type': 'mlp', 'hidden_dims': '[512, 128]', 'dropout': 0.2962347511336434, 'batch_norm': True, 'lr': 0.00013847822027307616, 'weight_decay': 0.0002452587646667411, 'epochs': 349, 'loss': 'mse', 'optimizer': 'adam', 'graph_mode': 'off', 'use_snp_selection': False}. Best is trial 6 with value: 0.07597547217153904.
[I 2025-12-05 15:42:30,155] Trial 20 finished with value: 0.025530573440392824 and parameters: {'model_type': 'mlp', 'hidden_dims': '[256, 128]', 'dropout': 0.21064819436239257, 'batch_norm': True, 'lr': 2.852213168845019e-06, 'weight_decay': 1.3547158413002277e-07, 'epochs': 218, 'loss': 'mse', 'optimizer': 'adam', 'graph_mode': 'off', 'use_snp_selection': False}. Best is trial 6 with value: 0.07597547217153904.
[I 2025-12-05 15:42:31,993] Trial 21 finished with value: 0.04456341421489082 and parameters: {'model_type': 'mlp', 'hidden_dims': '[512, 64]', 'dropout': 0.5535527355779193, 'batch_norm': False, 'lr': 6.128795801675836e-06, 'weight_decay': 3.086538734904235e-05, 'epochs': 306, 'loss': 'mae', 'optimizer': 'adam', 'graph_mode': 'off', 'use_snp_selection': False}. Best is trial 6 with value: 0.07597547217153904.
[I 2025-12-05 15:42:33,837] Trial 22 finished with value: 0.018831584681962242 and parameters: {'model_type': 'mlp', 'hidden_dims': '[512, 64]', 'dropout': 0.4898672442533545, 'batch_norm': False, 'lr': 8.540962941481733e-06, 'weight_decay': 5.943383249237163e-06, 'epochs': 315, 'loss': 'mae', 'optimizer': 'adam', 'graph_mode': 'off', 'use_snp_selection': False}. Best is trial 6 with value: 0.07597547217153904.
[I 2025-12-05 15:42:35,561] Trial 23 finished with value: 0.03785578478847547 and parameters: {'model_type': 'mlp', 'hidden_dims': '[512, 64]', 'dropout': 0.5899734868117269, 'batch_norm': False, 'lr': 3.2022023732821497e-06, 'weight_decay': 1.0462935277464818e-06, 'epochs': 263, 'loss': 'mae', 'optimizer': 'adam', 'graph_mode': 'off', 'use_snp_selection': False}. Best is trial 6 with value: 0.07597547217153904.
[I 2025-12-05 15:42:37,398] Trial 24 finished with value: 0.09185736455113036 and parameters: {'model_type': 'mlp', 'hidden_dims': '[512, 256]', 'dropout': 0.5983913387433193, 'batch_norm': False, 'lr': 3.18358997011128e-05, 'weight_decay': 0.00015046053737884408, 'epochs': 300, 'loss': 'mae', 'optimizer': 'adam', 'graph_mode': 'off', 'use_snp_selection': False}. Best is trial 24 with value: 0.09185736455113036.
[I 2025-12-05 15:42:38,817] Trial 25 finished with value: 0.07985791987230992 and parameters: {'model_type': 'mlp', 'hidden_dims': '[512, 256]', 'dropout': 0.3825960589738351, 'batch_norm': False, 'lr': 3.8837439488269115e-05, 'weight_decay': 0.00031911748824107284, 'epochs': 177, 'loss': 'mae', 'optimizer': 'adam', 'graph_mode': 'off', 'use_snp_selection': False}. Best is trial 24 with value: 0.09185736455113036.
[I 2025-12-05 15:42:40,203] Trial 26 finished with value: 0.0796962113966259 and parameters: {'model_type': 'mlp', 'hidden_dims': '[512, 256]', 'dropout': 0.38948758036271974, 'batch_norm': False, 'lr': 3.6066264512597755e-05, 'weight_decay': 9.930305253203603e-05, 'epochs': 170, 'loss': 'mae', 'optimizer': 'adam', 'graph_mode': 'off', 'use_snp_selection': False}. Best is trial 24 with value: 0.09185736455113036.
[I 2025-12-05 15:42:41,571] Trial 27 finished with value: 0.07079288298437404 and parameters: {'model_type': 'mlp', 'hidden_dims': '[512, 256]', 'dropout': 0.3567161441582714, 'batch_norm': False, 'lr': 2.770898853949421e-05, 'weight_decay': 0.00011339821397763536, 'epochs': 162, 'loss': 'mae', 'optimizer': 'adam', 'graph_mode': 'off', 'use_snp_selection': False}. Best is trial 24 with value: 0.09185736455113036.
[I 2025-12-05 15:42:42,729] Trial 28 finished with value: 0.03303736421742067 and parameters: {'model_type': 'mlp', 'hidden_dims': '[512, 256]', 'dropout': 0.49266971868312665, 'batch_norm': False, 'lr': 0.0001072923664324058, 'weight_decay': 0.00047167758138864555, 'epochs': 116, 'loss': 'mae', 'optimizer': 'adam', 'graph_mode': 'off', 'use_snp_selection': False}. Best is trial 24 with value: 0.09185736455113036.
[I 2025-12-05 15:42:43,789] Trial 29 finished with value: 0.045466342463263816 and parameters: {'model_type': 'mlp', 'hidden_dims': '[512, 256]', 'dropout': 0.5522783636788136, 'batch_norm': False, 'lr': 1.7440418496510147e-05, 'weight_decay': 9.154139573707219e-05, 'epochs': 88, 'loss': 'mae', 'optimizer': 'adam', 'graph_mode': 'off', 'use_snp_selection': False}. Best is trial 24 with value: 0.09185736455113036.
[I 2025-12-05 15:42:45,145] Trial 30 finished with value: 0.06081900584271057 and parameters: {'model_type': 'mlp', 'hidden_dims': '[512, 256]', 'dropout': 0.4211474312581261, 'batch_norm': False, 'lr': 3.859341308468482e-05, 'weight_decay': 4.195605880359922e-05, 'epochs': 169, 'loss': 'mae', 'optimizer': 'adam', 'graph_mode': 'off', 'use_snp_selection': False}. Best is trial 24 with value: 0.09185736455113036.
[I 2025-12-05 15:42:46,533] Trial 31 finished with value: 0.05131552147968578 and parameters: {'model_type': 'mlp', 'hidden_dims': '[512, 256]', 'dropout': 0.39734438254334553, 'batch_norm': False, 'lr': 3.93556471342374e-05, 'weight_decay': 0.00016101483874952018, 'epochs': 183, 'loss': 'mae', 'optimizer': 'adam', 'graph_mode': 'off', 'use_snp_selection': False}. Best is trial 24 with value: 0.09185736455113036.
[I 2025-12-05 15:42:47,351] Trial 32 finished with value: 0.07376030991422115 and parameters: {'model_type': 'mlp', 'hidden_dims': '[128, 64]', 'dropout': 0.37111216939045866, 'batch_norm': False, 'lr': 8.135980522595172e-05, 'weight_decay': 6.735322989356423e-05, 'epochs': 212, 'loss': 'mae', 'optimizer': 'adam', 'graph_mode': 'off', 'use_snp_selection': False}. Best is trial 24 with value: 0.09185736455113036.
[I 2025-12-05 15:42:48,641] Trial 33 finished with value: 0.07592598384355537 and parameters: {'model_type': 'mlp', 'hidden_dims': '[512, 256]', 'dropout': 0.4525447540021658, 'batch_norm': False, 'lr': 4.852437438225046e-05, 'weight_decay': 1.1915221294139031e-05, 'epochs': 138, 'loss': 'mae', 'optimizer': 'adam', 'graph_mode': 'off', 'use_snp_selection': False}. Best is trial 24 with value: 0.09185736455113036.
