[I 2025-12-05 14:25:58,199] Trial 101 finished with value: 0.04596236497855792 and parameters: {'model_type': 'mlp', 'hidden_dims': '[256, 128, 64]', 'dropout': 0.16453019230071383, 'batch_norm': False, 'lr': 0.00015829605434482624, 'weight_decay': 2.4383582358070526e-05, 'epochs': 227, 'loss': 'mse', 'optimizer': 'adam', 'graph_mode': 'off', 'use_snp_selection': True, 'num_snps': 36573}. Best is trial 101 with value: 0.04596236497855792.
[I 2025-12-05 14:26:00,031] Trial 102 finished with value: 0.029789854130592788 and parameters: {'model_type': 'mlp', 'hidden_dims': '[256, 128, 64]', 'dropout': 0.21524467809736755, 'batch_norm': False, 'lr': 0.00013705347219521724, 'weight_decay': 2.381027229269785e-05, 'epochs': 203, 'loss': 'mse', 'optimizer': 'adam', 'graph_mode': 'off', 'use_snp_selection': True, 'num_snps': 35432}. Best is trial 101 with value: 0.04596236497855792.
[I 2025-12-05 14:26:02,396] Trial 103 finished with value: 0.014087848909195079 and parameters: {'model_type': 'mlp', 'hidden_dims': '[256, 128, 64]', 'dropout': 0.18348075766897579, 'batch_norm': False, 'lr': 0.00010128536913018237, 'weight_decay': 1.4913636618277957e-05, 'epochs': 225, 'loss': 'mse', 'optimizer': 'adam', 'graph_mode': 'off', 'use_snp_selection': True, 'num_snps': 47351}. Best is trial 101 with value: 0.04596236497855792.
[I 2025-12-05 14:26:04,406] Trial 104 finished with value: 0.006845640228334627 and parameters: {'model_type': 'mlp', 'hidden_dims': '[256, 128, 64]', 'dropout': 0.22849787714603517, 'batch_norm': False, 'lr': 0.0004126619598876495, 'weight_decay': 3.869407845587945e-05, 'epochs': 214, 'loss': 'mse', 'optimizer': 'adam', 'graph_mode': 'off', 'use_snp_selection': True, 'num_snps': 40236}. Best is trial 101 with value: 0.04596236497855792.
[I 2025-12-05 14:26:06,261] Trial 105 finished with value: 0.02526626883330069 and parameters: {'model_type': 'mlp', 'hidden_dims': '[256, 128, 64]', 'dropout': 0.16638895762863048, 'batch_norm': False, 'lr': 0.0001810708935679914, 'weight_decay': 2.949540913224097e-05, 'epochs': 244, 'loss': 'mse', 'optimizer': 'adam', 'graph_mode': 'off', 'use_snp_selection': True, 'num_snps': 37116}. Best is trial 101 with value: 0.04596236497855792.
[I 2025-12-05 14:26:08,679] Trial 106 finished with value: 0.019667609964240253 and parameters: {'model_type': 'mlp', 'hidden_dims': '[256, 128, 64]', 'dropout': 0.20051575131330449, 'batch_norm': False, 'lr': 0.00014893932304969616, 'weight_decay': 2.489156892240709e-05, 'epochs': 254, 'loss': 'mse', 'optimizer': 'adam', 'graph_mode': 'off', 'use_snp_selection': True, 'num_snps': 53031}. Best is trial 101 with value: 0.04596236497855792.
[I 2025-12-05 14:26:10,428] Trial 107 finished with value: 0.007903756170293336 and parameters: {'model_type': 'mlp', 'hidden_dims': '[256, 128, 64]', 'dropout': 0.14410332806163648, 'batch_norm': False, 'lr': 0.0006458747729980863, 'weight_decay': 1.855445851464832e-05, 'epochs': 54, 'loss': 'mse', 'optimizer': 'adam', 'graph_mode': 'off', 'use_snp_selection': True, 'num_snps': 41294}. Best is trial 101 with value: 0.04596236497855792.
[I 2025-12-05 14:26:11,477] Trial 108 finished with value: -0.004512548514354441 and parameters: {'model_type': 'mlp', 'hidden_dims': '[256, 128, 64]', 'dropout': 0.21381886003976974, 'batch_norm': False, 'lr': 0.0002356024263362282, 'weight_decay': 1.2800058030388216e-05, 'epochs': 228, 'loss': 'mse', 'optimizer': 'adam', 'graph_mode': 'off', 'use_snp_selection': False}. Best is trial 101 with value: 0.04596236497855792.
[I 2025-12-05 14:26:13,200] Trial 109 finished with value: 0.023944130365230944 and parameters: {'model_type': 'mlp', 'hidden_dims': '[128, 64]', 'dropout': 0.19008664583515894, 'batch_norm': False, 'lr': 0.0005634441373757639, 'weight_decay': 3.4556157204410845e-05, 'epochs': 303, 'loss': 'mse', 'optimizer': 'adam', 'graph_mode': 'off', 'use_snp_selection': True, 'num_snps': 33279}. Best is trial 101 with value: 0.04596236497855792.
[I 2025-12-05 14:26:15,658] Trial 110 finished with value: 0.028351974245134852 and parameters: {'model_type': 'mlp', 'hidden_dims': '[256, 128, 64]', 'dropout': 0.272902467845135, 'batch_norm': True, 'lr': 1.9289422033228505e-05, 'weight_decay': 1.010806562667894e-05, 'epochs': 76, 'loss': 'mse', 'optimizer': 'adam', 'graph_mode': 'off', 'use_snp_selection': True, 'num_snps': 59886}. Best is trial 101 with value: 0.04596236497855792.
[I 2025-12-05 14:26:17,770] Trial 111 finished with value: 0.03630863997229573 and parameters: {'model_type': 'mlp', 'hidden_dims': '[256, 128]', 'dropout': 0.16887037175466804, 'batch_norm': False, 'lr': 0.00019487999869512824, 'weight_decay': 4.844429110243446e-05, 'epochs': 237, 'loss': 'mse', 'optimizer': 'adam', 'graph_mode': 'off', 'use_snp_selection': True, 'num_snps': 45062}. Best is trial 101 with value: 0.04596236497855792.
[I 2025-12-05 14:26:19,290] Trial 112 finished with value: 0.034429907582884 and parameters: {'model_type': 'mlp', 'hidden_dims': '[512, 64]', 'dropout': 0.15122986092309224, 'batch_norm': False, 'lr': 0.0002752950184959058, 'weight_decay': 7.976557333561727e-05, 'epochs': 221, 'loss': 'mse', 'optimizer': 'adam', 'graph_mode': 'off', 'use_snp_selection': True, 'num_snps': 26247}. Best is trial 101 with value: 0.04596236497855792.
[I 2025-12-05 14:26:20,679] Trial 113 finished with value: 0.057445034998274455 and parameters: {'model_type': 'mlp', 'hidden_dims': '[512, 128]', 'dropout': 0.11288648290202347, 'batch_norm': False, 'lr': 0.0002132411491512314, 'weight_decay': 6.20356688523784e-05, 'epochs': 231, 'loss': 'mse', 'optimizer': 'adam', 'graph_mode': 'off', 'use_snp_selection': True, 'num_snps': 22792}. Best is trial 113 with value: 0.057445034998274455.
[I 2025-12-05 14:26:21,998] Trial 114 finished with value: 0.004353300461305589 and parameters: {'model_type': 'mlp', 'hidden_dims': '[512, 128]', 'dropout': 0.10483045754252511, 'batch_norm': False, 'lr': 0.0007442414262611288, 'weight_decay': 6.21291335947456e-05, 'epochs': 184, 'loss': 'mse', 'optimizer': 'adam', 'graph_mode': 'off', 'use_snp_selection': True, 'num_snps': 22154}. Best is trial 113 with value: 0.057445034998274455.
[I 2025-12-05 14:26:23,159] Trial 115 finished with value: 0.017272251452304228 and parameters: {'model_type': 'mlp', 'hidden_dims': '[512, 128]', 'dropout': 0.11614153626578345, 'batch_norm': False, 'lr': 1.2721714333820668e-06, 'weight_decay': 2.4249692860056175e-07, 'epochs': 200, 'loss': 'mse', 'optimizer': 'adam', 'graph_mode': 'off', 'use_snp_selection': True, 'num_snps': 16316}. Best is trial 113 with value: 0.057445034998274455.
[I 2025-12-05 14:26:24,592] Trial 116 finished with value: 0.0264012011378212 and parameters: {'model_type': 'mlp', 'hidden_dims': '[512, 128]', 'dropout': 0.13148050300643563, 'batch_norm': False, 'lr': 0.0003190034552732581, 'weight_decay': 1.6925982867601832e-05, 'epochs': 212, 'loss': 'mse', 'optimizer': 'adam', 'graph_mode': 'off', 'use_snp_selection': False}. Best is trial 113 with value: 0.057445034998274455.
[I 2025-12-05 14:26:25,881] Trial 117 finished with value: 0.029462828639498048 and parameters: {'model_type': 'mlp', 'hidden_dims': '[512, 128]', 'dropout': 0.24142293271076737, 'batch_norm': False, 'lr': 0.0004706631614137352, 'weight_decay': 2.1779950139381828e-05, 'epochs': 230, 'loss': 'mse', 'optimizer': 'adam', 'graph_mode': 'off', 'use_snp_selection': True, 'num_snps': 19775}. Best is trial 113 with value: 0.057445034998274455.
[I 2025-12-05 14:26:27,629] Trial 118 finished with value: 0.032776503245896156 and parameters: {'model_type': 'mlp', 'hidden_dims': '[512, 256]', 'dropout': 0.2619483683574938, 'batch_norm': False, 'lr': 0.00011763271459424772, 'weight_decay': 4.21590110205322e-05, 'epochs': 91, 'loss': 'mse', 'optimizer': 'adam', 'graph_mode': 'off', 'use_snp_selection': True, 'num_snps': 37651}. Best is trial 113 with value: 0.057445034998274455.
[I 2025-12-05 14:26:29,155] Trial 119 finished with value: 0.04070029773963038 and parameters: {'model_type': 'mlp', 'hidden_dims': '[512, 256]', 'dropout': 0.4584927665641505, 'batch_norm': False, 'lr': 0.00024128652353365773, 'weight_decay': 8.308012994124894e-06, 'epochs': 249, 'loss': 'mse', 'optimizer': 'adam', 'graph_mode': 'off', 'use_snp_selection': False}. Best is trial 113 with value: 0.057445034998274455.
[I 2025-12-05 14:26:30,795] Trial 120 finished with value: 0.038341713021322686 and parameters: {'model_type': 'mlp', 'hidden_dims': '[512, 256]', 'dropout': 0.5455311078243965, 'batch_norm': False, 'lr': 0.000137385961969881, 'weight_decay': 8.784577761911773e-06, 'epochs': 241, 'loss': 'mse', 'optimizer': 'adam', 'graph_mode': 'off', 'use_snp_selection': True, 'num_snps': 28307}. Best is trial 113 with value: 0.057445034998274455.
[I 2025-12-05 14:26:32,478] Trial 121 finished with value: 0.027727640909747844 and parameters: {'model_type': 'mlp', 'hidden_dims': '[512, 256]', 'dropout': 0.4983931320734426, 'batch_norm': False, 'lr': 0.00015891283345526678, 'weight_decay': 4.69458913485655e-06, 'epochs': 272, 'loss': 'mse', 'optimizer': 'adam', 'graph_mode': 'off', 'use_snp_selection': True, 'num_snps': 28308}. Best is trial 113 with value: 0.057445034998274455.
[I 2025-12-05 14:26:34,338] Trial 122 finished with value: 0.010438262053072023 and parameters: {'model_type': 'mlp', 'hidden_dims': '[512, 256]', 'dropout': 0.5533211138555425, 'batch_norm': False, 'lr': 0.0002538315314497078, 'weight_decay': 7.87855286932026e-06, 'epochs': 247, 'loss': 'mse', 'optimizer': 'adam', 'graph_mode': 'off', 'use_snp_selection': True, 'num_snps': 31597}. Best is trial 113 with value: 0.057445034998274455.
[I 2025-12-05 14:26:35,773] Trial 123 finished with value: 0.02195172361893906 and parameters: {'model_type': 'mlp', 'hidden_dims': '[512, 256]', 'dropout': 0.4613693310628693, 'batch_norm': False, 'lr': 0.00014038708526859146, 'weight_decay': 8.666867459063751e-06, 'epochs': 242, 'loss': 'mse', 'optimizer': 'adam', 'graph_mode': 'off', 'use_snp_selection': True, 'num_snps': 23345}. Best is trial 113 with value: 0.057445034998274455.
[I 2025-12-05 14:26:37,746] Trial 124 finished with value: 0.016562288954743654 and parameters: {'model_type': 'mlp', 'hidden_dims': '[512, 256]', 'dropout': 0.5000808600032749, 'batch_norm': False, 'lr': 0.00019718672841438582, 'weight_decay': 5.640167565916224e-06, 'epochs': 254, 'loss': 'mse', 'optimizer': 'adam', 'graph_mode': 'off', 'use_snp_selection': True, 'num_snps': 35482}. Best is trial 113 with value: 0.057445034998274455.
[I 2025-12-05 14:26:39,646] Trial 125 finished with value: -0.0016385264609359758 and parameters: {'model_type': 'mlp', 'hidden_dims': '[512, 256]', 'dropout': 0.5190904272965948, 'batch_norm': False, 'lr': 0.0001700417072904485, 'weight_decay': 1.2084463056667786e-05, 'epochs': 266, 'loss': 'mse', 'optimizer': 'adam', 'graph_mode': 'off', 'use_snp_selection': True, 'num_snps': 33176}. Best is trial 113 with value: 0.057445034998274455.
[I 2025-12-05 14:26:42,225] Trial 126 finished with value: 0.025083775014228562 and parameters: {'model_type': 'mlp', 'hidden_dims': '[512, 256]', 'dropout': 0.5619967449338642, 'batch_norm': False, 'lr': 0.0001037167986664402, 'weight_decay': 1.55695116851431e-05, 'epochs': 241, 'loss': 'mse', 'optimizer': 'adam', 'graph_mode': 'off', 'use_snp_selection': True, 'num_snps': 49244}. Best is trial 113 with value: 0.057445034998274455.
[I 2025-12-05 14:26:43,897] Trial 127 finished with value: 0.008886363316158226 and parameters: {'model_type': 'mlp', 'hidden_dims': '[512, 256]', 'dropout': 0.5422203661366588, 'batch_norm': False, 'lr': 0.00022343560527025752, 'weight_decay': 2.8542806785048506e-05, 'epochs': 282, 'loss': 'mse', 'optimizer': 'adam', 'graph_mode': 'off', 'use_snp_selection': False}. Best is trial 113 with value: 0.057445034998274455.
[I 2025-12-05 14:26:46,745] Trial 128 finished with value: 0.0015428996435722792 and parameters: {'model_type': 'mlp', 'hidden_dims': '[512, 256]', 'dropout': 0.4242573583684415, 'batch_norm': False, 'lr': 0.00027948931624995147, 'weight_decay': 7.216498060600889e-06, 'epochs': 218, 'loss': 'mse', 'optimizer': 'adam', 'graph_mode': 'off', 'use_snp_selection': True, 'num_snps': 57389}. Best is trial 113 with value: 0.057445034998274455.
[I 2025-12-05 14:26:47,970] Trial 129 finished with value: 0.02456991448068127 and parameters: {'model_type': 'mlp', 'hidden_dims': '[512, 128]', 'dropout': 0.5285328786853475, 'batch_norm': False, 'lr': 6.0099545027243235e-05, 'weight_decay': 0.0005586103630186783, 'epochs': 221, 'loss': 'mae', 'optimizer': 'adam', 'graph_mode': 'off', 'use_snp_selection': True, 'num_snps': 17462}. Best is trial 113 with value: 0.057445034998274455.
[I 2025-12-05 14:26:49,491] Trial 130 finished with value: -0.0052228712639095475 and parameters: {'model_type': 'mlp', 'hidden_dims': '[512, 256]', 'dropout': 0.5751817178258657, 'batch_norm': False, 'lr': 0.00012016852073412488, 'weight_decay': 2.577825034638217e-06, 'epochs': 249, 'loss': 'mse', 'optimizer': 'adam', 'graph_mode': 'off', 'use_snp_selection': False}. Best is trial 113 with value: 0.057445034998274455.
[I 2025-12-05 14:26:50,968] Trial 131 finished with value: 0.01603702566193573 and parameters: {'model_type': 'mlp', 'hidden_dims': '[512, 256]', 'dropout': 0.584861063915017, 'batch_norm': True, 'lr': 0.00034444112029934077, 'weight_decay': 1.0256276622659708e-05, 'epochs': 230, 'loss': 'mse', 'optimizer': 'adam', 'graph_mode': 'off', 'use_snp_selection': False}. Best is trial 113 with value: 0.057445034998274455.
[I 2025-12-05 14:26:52,528] Trial 132 finished with value: 0.02253321557008844 and parameters: {'model_type': 'mlp', 'hidden_dims': '[512, 128]', 'dropout': 0.5942315954944472, 'batch_norm': False, 'lr': 0.000411467940223187, 'weight_decay': 6.966841379989636e-05, 'epochs': 262, 'loss': 'mse', 'optimizer': 'adam', 'graph_mode': 'off', 'use_snp_selection': False}. Best is trial 113 with value: 0.057445034998274455.
[I 2025-12-05 14:26:53,512] Trial 133 finished with value: 0.02487924451742025 and parameters: {'model_type': 'mlp', 'hidden_dims': '[256, 128, 64]', 'dropout': 0.48565094148660154, 'batch_norm': False, 'lr': 0.00035655038139664665, 'weight_decay': 8.465604572576107e-05, 'epochs': 207, 'loss': 'mse', 'optimizer': 'adam', 'graph_mode': 'off', 'use_snp_selection': False}. Best is trial 113 with value: 0.057445034998274455.
[I 2025-12-05 14:26:54,966] Trial 134 finished with value: -0.0154395522399573 and parameters: {'model_type': 'mlp', 'hidden_dims': '[512, 256]', 'dropout': 0.20172967787797466, 'batch_norm': False, 'lr': 0.0006520928822974665, 'weight_decay': 0.00024061020761722188, 'epochs': 226, 'loss': 'mse', 'optimizer': 'adam', 'graph_mode': 'off', 'use_snp_selection': False}. Best is trial 113 with value: 0.057445034998274455.
[I 2025-12-05 14:26:55,667] Trial 135 finished with value: 0.058737702320805836 and parameters: {'model_type': 'mlp', 'hidden_dims': '[128, 64]', 'dropout': 0.39335968046572906, 'batch_norm': False, 'lr': 0.0005037403416708467, 'weight_decay': 2.1523826661862404e-05, 'epochs': 111, 'loss': 'mse', 'optimizer': 'adam', 'graph_mode': 'off', 'use_snp_selection': False}. Best is trial 135 with value: 0.058737702320805836.
[I 2025-12-05 14:26:56,357] Trial 136 finished with value: -0.024685091579895374 and parameters: {'model_type': 'mlp', 'hidden_dims': '[128, 64]', 'dropout': 0.3906499650031732, 'batch_norm': False, 'lr': 2.0400085744526793e-06, 'weight_decay': 2.2290190866385466e-05, 'epochs': 99, 'loss': 'mse', 'optimizer': 'adam', 'graph_mode': 'off', 'use_snp_selection': False}. Best is trial 135 with value: 0.058737702320805836.
[I 2025-12-05 14:26:58,155] Trial 137 finished with value: 0.040564292042126984 and parameters: {'model_type': 'mlp', 'hidden_dims': '[128, 64]', 'dropout': 0.46389520094346515, 'batch_norm': False, 'lr': 0.0005776856697791012, 'weight_decay': 3.161708750050324e-05, 'epochs': 128, 'loss': 'mse', 'optimizer': 'adam', 'graph_mode': 'off', 'use_snp_selection': True, 'num_snps': 42117}. Best is trial 135 with value: 0.058737702320805836.
[I 2025-12-05 14:27:00,071] Trial 138 finished with value: 0.030211758153484845 and parameters: {'model_type': 'mlp', 'hidden_dims': '[128, 64]', 'dropout': 0.46050538695244475, 'batch_norm': False, 'lr': 0.0005325259436067131, 'weight_decay': 3.6575198812209244e-05, 'epochs': 121, 'loss': 'mae', 'optimizer': 'adam', 'graph_mode': 'off', 'use_snp_selection': True, 'num_snps': 45077}. Best is trial 135 with value: 0.058737702320805836.
[I 2025-12-05 14:27:01,816] Trial 139 finished with value: 0.03286397374716247 and parameters: {'model_type': 'mlp', 'hidden_dims': '[128, 64]', 'dropout': 0.4502839644692859, 'batch_norm': False, 'lr': 0.0008431681157007854, 'weight_decay': 2.6931739663138047e-05, 'epochs': 106, 'loss': 'mse', 'optimizer': 'adam', 'graph_mode': 'off', 'use_snp_selection': True, 'num_snps': 41403}. Best is trial 135 with value: 0.058737702320805836.
[I 2025-12-05 14:27:02,522] Trial 140 finished with value: -0.006703910098936784 and parameters: {'model_type': 'mlp', 'hidden_dims': '[128, 64]', 'dropout': 0.43822559361223357, 'batch_norm': False, 'lr': 0.00047998091206955776, 'weight_decay': 2.0321520635858397e-05, 'epochs': 110, 'loss': 'mse', 'optimizer': 'adam', 'graph_mode': 'off', 'use_snp_selection': False}. Best is trial 135 with value: 0.058737702320805836.
[I 2025-12-05 14:27:03,898] Trial 141 finished with value: 0.005249348596252328 and parameters: {'model_type': 'mlp', 'hidden_dims': '[128, 64]', 'dropout': 0.4879704747854075, 'batch_norm': False, 'lr': 0.0006418546355933471, 'weight_decay': 1.5908030518669112e-05, 'epochs': 112, 'loss': 'mse', 'optimizer': 'adam', 'graph_mode': 'off', 'use_snp_selection': True, 'num_snps': 28879}. Best is trial 135 with value: 0.058737702320805836.
[I 2025-12-05 14:27:05,525] Trial 142 finished with value: 0.03351355144041954 and parameters: {'model_type': 'mlp', 'hidden_dims': '[128, 64]', 'dropout': 0.5135244195740565, 'batch_norm': False, 'lr': 0.0004303096458944827, 'weight_decay': 3.403893716852852e-05, 'epochs': 146, 'loss': 'mse', 'optimizer': 'adam', 'graph_mode': 'off', 'use_snp_selection': True, 'num_snps': 30349}. Best is trial 135 with value: 0.058737702320805836.
[I 2025-12-05 14:27:06,563] Trial 143 finished with value: 0.013388522846475145 and parameters: {'model_type': 'mlp', 'hidden_dims': '[128, 64]', 'dropout': 0.34346184913546085, 'batch_norm': False, 'lr': 0.0005682861564115679, 'weight_decay': 4.340186197875158e-05, 'epochs': 140, 'loss': 'mse', 'optimizer': 'adam', 'graph_mode': 'off', 'use_snp_selection': True, 'num_snps': 12468}. Best is trial 135 with value: 0.058737702320805836.
[I 2025-12-05 14:27:07,920] Trial 144 finished with value: 0.012703861072766862 and parameters: {'model_type': 'mlp', 'hidden_dims': '[128, 64]', 'dropout': 0.4702626615311399, 'batch_norm': False, 'lr': 0.0007540325161676117, 'weight_decay': 1.2221664630998177e-05, 'epochs': 73, 'loss': 'mse', 'optimizer': 'adam', 'graph_mode': 'off', 'use_snp_selection': True, 'num_snps': 26558}. Best is trial 135 with value: 0.058737702320805836.
[I 2025-12-05 14:27:09,323] Trial 145 finished with value: 0.03496804818481611 and parameters: {'model_type': 'mlp', 'hidden_dims': '[512, 256]', 'dropout': 0.32747967758393665, 'batch_norm': False, 'lr': 0.0008940955356608173, 'weight_decay': 2.4720915539360406e-05, 'epochs': 129, 'loss': 'mse', 'optimizer': 'adam', 'graph_mode': 'off', 'use_snp_selection': True, 'num_snps': 24006}. Best is trial 135 with value: 0.058737702320805836.
[I 2025-12-05 14:27:10,984] Trial 146 finished with value: 0.027977110280585766 and parameters: {'model_type': 'mlp', 'hidden_dims': '[512, 128]', 'dropout': 0.3674115482035465, 'batch_norm': False, 'lr': 0.00024625061195909066, 'weight_decay': 3.056070660126023e-05, 'epochs': 82, 'loss': 'mse', 'optimizer': 'adam', 'graph_mode': 'off', 'use_snp_selection': True, 'num_snps': 35376}. Best is trial 135 with value: 0.058737702320805836.
[I 2025-12-05 14:27:12,780] Trial 147 finished with value: 0.039188289742578104 and parameters: {'model_type': 'mlp', 'hidden_dims': '[256, 128, 64]', 'dropout': 0.13839426462908222, 'batch_norm': False, 'lr': 0.00030313506625666026, 'weight_decay': 1.9323033119326998e-05, 'epochs': 154, 'loss': 'mae', 'optimizer': 'adam', 'graph_mode': 'off', 'use_snp_selection': True, 'num_snps': 38417}. Best is trial 135 with value: 0.058737702320805836.
[I 2025-12-05 14:27:13,674] Trial 148 finished with value: 0.03335837887688232 and parameters: {'model_type': 'mlp', 'hidden_dims': '[256, 128, 64]', 'dropout': 0.4061388993859083, 'batch_norm': False, 'lr': 0.0002839690662282808, 'weight_decay': 2.0089391895795028e-05, 'epochs': 127, 'loss': 'mae', 'optimizer': 'adam', 'graph_mode': 'off', 'use_snp_selection': False}. Best is trial 135 with value: 0.058737702320805836.
[I 2025-12-05 14:27:15,774] Trial 149 finished with value: 0.035904893784653474 and parameters: {'model_type': 'mlp', 'hidden_dims': '[256, 128, 64]', 'dropout': 0.124676958802385, 'batch_norm': False, 'lr': 0.00038822250996843274, 'weight_decay': 1.7927186517447486e-05, 'epochs': 171, 'loss': 'mae', 'optimizer': 'adam', 'graph_mode': 'off', 'use_snp_selection': True, 'num_snps': 41539}. Best is trial 135 with value: 0.058737702320805836.
[I 2025-12-05 14:27:18,130] Trial 0 finished with value: 0.06038571567055712 and parameters: {'model_type': 'mlp', 'hidden_dims': '[128, 64]', 'dropout': 0.199031432379812, 'batch_norm': True, 'lr': 1.8408544111075837e-06, 'weight_decay': 5.5136510071208614e-05, 'epochs': 336, 'loss': 'mae', 'optimizer': 'adam', 'graph_mode': 'off', 'use_snp_selection': True, 'num_snps': 43862}. Best is trial 0 with value: 0.06038571567055712.
