[I 2025-12-05 15:46:16,257] Trial 132 finished with value: 0.040094790096231105 and parameters: {'model_type': 'mlp', 'hidden_dims': '[512, 64]', 'dropout': 0.48672145125614313, 'batch_norm': True, 'lr': 0.00031499637967822127, 'weight_decay': 2.811140648492667e-06, 'epochs': 313, 'loss': 'mse', 'optimizer': 'adam', 'graph_mode': 'off', 'use_snp_selection': False}. Best is trial 112 with value: 0.056979649035466894.
[I 2025-12-05 15:46:18,228] Trial 133 finished with value: 0.05417465477129586 and parameters: {'model_type': 'mlp', 'hidden_dims': '[512, 64]', 'dropout': 0.44507748536708236, 'batch_norm': True, 'lr': 0.0002495812800532081, 'weight_decay': 6.850766896735872e-07, 'epochs': 331, 'loss': 'mse', 'optimizer': 'adam', 'graph_mode': 'off', 'use_snp_selection': False}. Best is trial 112 with value: 0.056979649035466894.
[I 2025-12-05 15:46:20,212] Trial 134 finished with value: 0.047961500227101425 and parameters: {'model_type': 'mlp', 'hidden_dims': '[512, 64]', 'dropout': 0.4406051831046855, 'batch_norm': True, 'lr': 0.0002401233883420181, 'weight_decay': 1.7421753314721667e-06, 'epochs': 330, 'loss': 'mse', 'optimizer': 'adam', 'graph_mode': 'off', 'use_snp_selection': False}. Best is trial 112 with value: 0.056979649035466894.
[I 2025-12-05 15:46:22,231] Trial 135 finished with value: 0.041108396398235686 and parameters: {'model_type': 'mlp', 'hidden_dims': '[512, 64]', 'dropout': 0.475296708047627, 'batch_norm': True, 'lr': 0.0003608943147618205, 'weight_decay': 6.736593787600141e-07, 'epochs': 342, 'loss': 'mse', 'optimizer': 'adam', 'graph_mode': 'off', 'use_snp_selection': False}. Best is trial 112 with value: 0.056979649035466894.
[I 2025-12-05 15:46:24,156] Trial 136 finished with value: 0.038302777558738385 and parameters: {'model_type': 'mlp', 'hidden_dims': '[512, 64]', 'dropout': 0.5262225331946794, 'batch_norm': True, 'lr': 0.00027942416754982917, 'weight_decay': 9.42585206453573e-07, 'epochs': 319, 'loss': 'mse', 'optimizer': 'adam', 'graph_mode': 'off', 'use_snp_selection': False}. Best is trial 112 with value: 0.056979649035466894.
[I 2025-12-05 15:46:26,000] Trial 137 finished with value: 0.035882692711405734 and parameters: {'model_type': 'mlp', 'hidden_dims': '[512, 64]', 'dropout': 0.5038941289551543, 'batch_norm': True, 'lr': 0.00018481911244351023, 'weight_decay': 1.2080257856435658e-06, 'epochs': 298, 'loss': 'mse', 'optimizer': 'adam', 'graph_mode': 'off', 'use_snp_selection': False}. Best is trial 112 with value: 0.056979649035466894.
[I 2025-12-05 15:46:29,196] Trial 138 finished with value: 0.03376062844210609 and parameters: {'model_type': 'mlp', 'hidden_dims': '[512, 64]', 'dropout': 0.4508925500859826, 'batch_norm': False, 'lr': 0.00022892051742802935, 'weight_decay': 4.91941345806896e-07, 'epochs': 309, 'loss': 'mse', 'optimizer': 'adam', 'graph_mode': 'off', 'use_snp_selection': True, 'num_snps': 54416}. Best is trial 112 with value: 0.056979649035466894.
[I 2025-12-05 15:46:31,219] Trial 139 finished with value: 0.030198296448135334 and parameters: {'model_type': 'mlp', 'hidden_dims': '[512, 64]', 'dropout': 0.43318115760736553, 'batch_norm': True, 'lr': 0.0001348771024634948, 'weight_decay': 8.435267070043619e-07, 'epochs': 335, 'loss': 'mse', 'optimizer': 'adam', 'graph_mode': 'off', 'use_snp_selection': False}. Best is trial 112 with value: 0.056979649035466894.
[I 2025-12-05 15:46:31,994] Trial 140 finished with value: 0.03947117646807901 and parameters: {'model_type': 'mlp', 'hidden_dims': '[256, 128]', 'dropout': 0.5147244516004151, 'batch_norm': True, 'lr': 0.0003398313852518461, 'weight_decay': 3.7706605332600514e-07, 'epochs': 96, 'loss': 'mse', 'optimizer': 'adam', 'graph_mode': 'off', 'use_snp_selection': False}. Best is trial 112 with value: 0.056979649035466894.
[I 2025-12-05 15:46:33,112] Trial 141 finished with value: 0.033828107927937 and parameters: {'model_type': 'mlp', 'hidden_dims': '[512, 64]', 'dropout': 0.4907924404572501, 'batch_norm': True, 'lr': 0.00016611437001668627, 'weight_decay': 1.4487444978859869e-06, 'epochs': 112, 'loss': 'mse', 'optimizer': 'adam', 'graph_mode': 'off', 'use_snp_selection': False}. Best is trial 112 with value: 0.056979649035466894.
[I 2025-12-05 15:46:34,070] Trial 142 finished with value: 0.038565015434916715 and parameters: {'model_type': 'mlp', 'hidden_dims': '[128, 64]', 'dropout': 0.556589449005706, 'batch_norm': True, 'lr': 0.00040948470239499644, 'weight_decay': 3.5592896832833206e-06, 'epochs': 324, 'loss': 'mse', 'optimizer': 'adam', 'graph_mode': 'off', 'use_snp_selection': False}. Best is trial 112 with value: 0.056979649035466894.
[I 2025-12-05 15:46:36,078] Trial 143 finished with value: 0.037927340677730535 and parameters: {'model_type': 'mlp', 'hidden_dims': '[512, 64]', 'dropout': 0.4229072678651224, 'batch_norm': True, 'lr': 0.00019435563595087365, 'weight_decay': 6.460150305688912e-07, 'epochs': 342, 'loss': 'mse', 'optimizer': 'adam', 'graph_mode': 'off', 'use_snp_selection': False}. Best is trial 112 with value: 0.056979649035466894.
[I 2025-12-05 15:46:38,121] Trial 144 finished with value: 0.039741980874277515 and parameters: {'model_type': 'mlp', 'hidden_dims': '[512, 256]', 'dropout': 0.5733436334822605, 'batch_norm': True, 'lr': 0.00025541904172313054, 'weight_decay': 0.0008207888314789442, 'epochs': 350, 'loss': 'mse', 'optimizer': 'adam', 'graph_mode': 'off', 'use_snp_selection': False}. Best is trial 112 with value: 0.056979649035466894.
[I 2025-12-05 15:46:40,084] Trial 145 finished with value: 0.045633904967397484 and parameters: {'model_type': 'mlp', 'hidden_dims': '[512, 64]', 'dropout': 0.46377975689435175, 'batch_norm': True, 'lr': 0.00029162568795409376, 'weight_decay': 2.602415763744019e-07, 'epochs': 330, 'loss': 'mse', 'optimizer': 'adam', 'graph_mode': 'off', 'use_snp_selection': False}. Best is trial 112 with value: 0.056979649035466894.
[I 2025-12-05 15:46:41,115] Trial 146 finished with value: -0.0002364124076932504 and parameters: {'model_type': 'mlp', 'hidden_dims': '[512, 64]', 'dropout': 0.30918494850526584, 'batch_norm': True, 'lr': 0.00010446250956474854, 'weight_decay': 7.387127661903627e-06, 'epochs': 320, 'loss': 'mse', 'optimizer': 'adam', 'graph_mode': 'off', 'use_snp_selection': True, 'num_snps': 2186}. Best is trial 112 with value: 0.056979649035466894.
[I 2025-12-05 15:46:43,092] Trial 147 finished with value: 0.04874981829749707 and parameters: {'model_type': 'mlp', 'hidden_dims': '[512, 64]', 'dropout': 0.44652754965409136, 'batch_norm': True, 'lr': 0.00022067025777096973, 'weight_decay': 1.1540451455602244e-05, 'epochs': 335, 'loss': 'mse', 'optimizer': 'adam', 'graph_mode': 'off', 'use_snp_selection': False}. Best is trial 112 with value: 0.056979649035466894.
[I 2025-12-05 15:46:45,096] Trial 148 finished with value: 0.03797597496973128 and parameters: {'model_type': 'mlp', 'hidden_dims': '[512, 64]', 'dropout': 0.5397045876346585, 'batch_norm': True, 'lr': 0.00013380064617924108, 'weight_decay': 2.5819282128384386e-06, 'epochs': 340, 'loss': 'mse', 'optimizer': 'adam', 'graph_mode': 'off', 'use_snp_selection': False}. Best is trial 112 with value: 0.056979649035466894.
[I 2025-12-05 15:46:46,870] Trial 149 finished with value: 0.026549290367480757 and parameters: {'model_type': 'mlp', 'hidden_dims': '[512, 256]', 'dropout': 0.5029240165111672, 'batch_norm': True, 'lr': 5.8707190800305865e-05, 'weight_decay': 0.0005913295101510125, 'epochs': 272, 'loss': 'mse', 'optimizer': 'adam', 'graph_mode': 'off', 'use_snp_selection': True, 'num_snps': 25955}. Best is trial 112 with value: 0.056979649035466894.
[I 2025-12-05 15:47:01,988] Trial 0 finished with value: 0.010875858718381896 and parameters: {'model_type': 'mlp', 'hidden_dims': '[128, 64]', 'dropout': 0.199031432379812, 'batch_norm': True, 'lr': 1.8408544111075837e-06, 'weight_decay': 5.5136510071208614e-05, 'epochs': 336, 'loss': 'mae', 'optimizer': 'adam', 'graph_mode': 'off', 'use_snp_selection': True, 'num_snps': 43862}. Best is trial 0 with value: 0.010875858718381896.
[I 2025-12-05 15:47:03,005] Trial 1 finished with value: 0.05486888838971025 and parameters: {'model_type': 'mlp', 'hidden_dims': '[256, 128]', 'dropout': 0.4370668075331726, 'batch_norm': True, 'lr': 7.133471581159139e-05, 'weight_decay': 1.128633586803549e-05, 'epochs': 242, 'loss': 'mae', 'optimizer': 'adam', 'graph_mode': 'off', 'use_snp_selection': False}. Best is trial 1 with value: 0.05486888838971025.
[I 2025-12-05 15:47:03,946] Trial 2 finished with value: -0.015938099400744796 and parameters: {'model_type': 'mlp', 'hidden_dims': '[256, 128, 64]', 'dropout': 0.41314357415569625, 'batch_norm': False, 'lr': 3.952233718592101e-06, 'weight_decay': 0.00026754769258252603, 'epochs': 149, 'loss': 'mse', 'optimizer': 'adam', 'graph_mode': 'off', 'use_snp_selection': True, 'num_snps': 11571}. Best is trial 1 with value: 0.05486888838971025.
[I 2025-12-05 15:47:05,701] Trial 3 finished with value: 0.025111525790241836 and parameters: {'model_type': 'mlp', 'hidden_dims': '[512, 64]', 'dropout': 0.5938127374509361, 'batch_norm': False, 'lr': 5.67704586114731e-06, 'weight_decay': 2.4518087630137052e-05, 'epochs': 320, 'loss': 'mae', 'optimizer': 'adam', 'graph_mode': 'off', 'use_snp_selection': False}. Best is trial 1 with value: 0.05486888838971025.
[I 2025-12-05 15:47:07,779] Trial 4 finished with value: -0.01063786407239327 and parameters: {'model_type': 'mlp', 'hidden_dims': '[512, 128]', 'dropout': 0.25746343592134413, 'batch_norm': True, 'lr': 1.3467657668402788e-06, 'weight_decay': 0.00033087251918647806, 'epochs': 277, 'loss': 'mse', 'optimizer': 'adam', 'graph_mode': 'off', 'use_snp_selection': True, 'num_snps': 36675}. Best is trial 1 with value: 0.05486888838971025.
[I 2025-12-05 15:47:09,400] Trial 5 finished with value: -0.000734914614692429 and parameters: {'model_type': 'mlp', 'hidden_dims': '[512, 64]', 'dropout': 0.38275350994408375, 'batch_norm': True, 'lr': 1.5586664309232824e-06, 'weight_decay': 0.0008227664668621182, 'epochs': 145, 'loss': 'mae', 'optimizer': 'adam', 'graph_mode': 'off', 'use_snp_selection': True, 'num_snps': 32148}. Best is trial 1 with value: 0.05486888838971025.
[I 2025-12-05 15:47:10,312] Trial 6 finished with value: 0.03940550445239021 and parameters: {'model_type': 'mlp', 'hidden_dims': '[256, 128]', 'dropout': 0.3930109900265879, 'batch_norm': False, 'lr': 4.892964372128395e-05, 'weight_decay': 1.5809549317992182e-06, 'epochs': 199, 'loss': 'mse', 'optimizer': 'adam', 'graph_mode': 'off', 'use_snp_selection': False}. Best is trial 1 with value: 0.05486888838971025.
[I 2025-12-05 15:47:11,324] Trial 7 finished with value: 0.05427319748027448 and parameters: {'model_type': 'mlp', 'hidden_dims': '[512, 256]', 'dropout': 0.15343979219678458, 'batch_norm': True, 'lr': 6.234003099047341e-05, 'weight_decay': 3.894760610535477e-07, 'epochs': 97, 'loss': 'mse', 'optimizer': 'adam', 'graph_mode': 'off', 'use_snp_selection': False}. Best is trial 1 with value: 0.05486888838971025.
[I 2025-12-05 15:47:13,085] Trial 8 finished with value: 0.04797086370550496 and parameters: {'model_type': 'mlp', 'hidden_dims': '[512, 128]', 'dropout': 0.10743001231661406, 'batch_norm': True, 'lr': 0.00023728538449271062, 'weight_decay': 1.7629071578048637e-05, 'epochs': 312, 'loss': 'mae', 'optimizer': 'adam', 'graph_mode': 'off', 'use_snp_selection': False}. Best is trial 1 with value: 0.05486888838971025.
[I 2025-12-05 15:47:14,361] Trial 9 finished with value: 0.05508655816078871 and parameters: {'model_type': 'mlp', 'hidden_dims': '[512, 64]', 'dropout': 0.14505336736221927, 'batch_norm': True, 'lr': 5.8619638388111826e-05, 'weight_decay': 6.200156172669308e-07, 'epochs': 175, 'loss': 'mse', 'optimizer': 'adam', 'graph_mode': 'off', 'use_snp_selection': False}. Best is trial 9 with value: 0.05508655816078871.
[I 2025-12-05 15:47:15,180] Trial 10 finished with value: 0.04410406810183936 and parameters: {'model_type': 'mlp', 'hidden_dims': '[512, 64]', 'dropout': 0.27531666245262887, 'batch_norm': False, 'lr': 0.00032393778075602147, 'weight_decay': 1.1714031539166647e-07, 'epochs': 44, 'loss': 'mse', 'optimizer': 'adam', 'graph_mode': 'off', 'use_snp_selection': False}. Best is trial 9 with value: 0.05508655816078871.
[I 2025-12-05 15:47:16,191] Trial 11 finished with value: 0.008420278203595656 and parameters: {'model_type': 'mlp', 'hidden_dims': '[256, 128]', 'dropout': 0.5011246104824927, 'batch_norm': True, 'lr': 1.6474108386126448e-05, 'weight_decay': 2.8129958937311506e-06, 'epochs': 239, 'loss': 'mae', 'optimizer': 'adam', 'graph_mode': 'off', 'use_snp_selection': False}. Best is trial 9 with value: 0.05508655816078871.
[I 2025-12-05 15:47:17,164] Trial 12 finished with value: 0.05376453623959747 and parameters: {'model_type': 'mlp', 'hidden_dims': '[256, 128]', 'dropout': 0.4779690972965961, 'batch_norm': True, 'lr': 0.000121041789182661, 'weight_decay': 4.19780668911197e-06, 'epochs': 219, 'loss': 'mae', 'optimizer': 'adam', 'graph_mode': 'off', 'use_snp_selection': False}. Best is trial 9 with value: 0.05508655816078871.
[I 2025-12-05 15:47:17,883] Trial 13 finished with value: 0.030079682032630933 and parameters: {'model_type': 'mlp', 'hidden_dims': '[128, 64]', 'dropout': 0.3037065148378758, 'batch_norm': True, 'lr': 1.8184704710575438e-05, 'weight_decay': 6.97716041744421e-07, 'epochs': 157, 'loss': 'mse', 'optimizer': 'adam', 'graph_mode': 'off', 'use_snp_selection': False}. Best is trial 9 with value: 0.05508655816078871.
[I 2025-12-05 15:47:18,968] Trial 14 finished with value: 0.05262618118495479 and parameters: {'model_type': 'mlp', 'hidden_dims': '[256, 128, 64]', 'dropout': 0.4774917249809648, 'batch_norm': True, 'lr': 0.0006681578335050954, 'weight_decay': 1.0971024377881592e-07, 'epochs': 263, 'loss': 'mse', 'optimizer': 'adam', 'graph_mode': 'off', 'use_snp_selection': False}. Best is trial 9 with value: 0.05508655816078871.
[I 2025-12-05 15:47:20,310] Trial 15 finished with value: 0.03894818286849218 and parameters: {'model_type': 'mlp', 'hidden_dims': '[512, 256]', 'dropout': 0.5699025908888742, 'batch_norm': True, 'lr': 0.0001045571331345049, 'weight_decay': 7.236536090132001e-06, 'epochs': 190, 'loss': 'mae', 'optimizer': 'adam', 'graph_mode': 'off', 'use_snp_selection': False}. Best is trial 9 with value: 0.05508655816078871.
[I 2025-12-05 15:47:21,056] Trial 16 finished with value: 0.04768777540105503 and parameters: {'model_type': 'mlp', 'hidden_dims': '[256, 128]', 'dropout': 0.3400578620313633, 'batch_norm': True, 'lr': 2.1517090787442848e-05, 'weight_decay': 7.882980925273178e-05, 'epochs': 98, 'loss': 'mse', 'optimizer': 'adam', 'graph_mode': 'off', 'use_snp_selection': False}. Best is trial 9 with value: 0.05508655816078871.
[I 2025-12-05 15:47:22,710] Trial 17 finished with value: 0.0310165534465784 and parameters: {'model_type': 'mlp', 'hidden_dims': '[512, 64]', 'dropout': 0.2174542087235227, 'batch_norm': True, 'lr': 9.746523544442226e-06, 'weight_decay': 7.208825532007247e-07, 'epochs': 279, 'loss': 'mae', 'optimizer': 'adam', 'graph_mode': 'off', 'use_snp_selection': False}. Best is trial 9 with value: 0.05508655816078871.
[I 2025-12-05 15:47:25,100] Trial 18 finished with value: 0.028757729811055684 and parameters: {'model_type': 'mlp', 'hidden_dims': '[256, 128]', 'dropout': 0.10884892417738423, 'batch_norm': False, 'lr': 0.0009735993119677173, 'weight_decay': 1.0315216097288506e-05, 'epochs': 184, 'loss': 'mse', 'optimizer': 'adam', 'graph_mode': 'off', 'use_snp_selection': True, 'num_snps': 58241}. Best is trial 9 with value: 0.05508655816078871.
[I 2025-12-05 15:47:26,663] Trial 19 finished with value: 0.03875289272660953 and parameters: {'model_type': 'mlp', 'hidden_dims': '[512, 64]', 'dropout': 0.42887889798689083, 'batch_norm': True, 'lr': 5.356605669826495e-05, 'weight_decay': 3.210676296043814e-07, 'epochs': 244, 'loss': 'mae', 'optimizer': 'adam', 'graph_mode': 'off', 'use_snp_selection': False}. Best is trial 9 with value: 0.05508655816078871.
[I 2025-12-05 15:47:27,724] Trial 20 finished with value: 0.04631246926933976 and parameters: {'model_type': 'mlp', 'hidden_dims': '[512, 128]', 'dropout': 0.34297698673380095, 'batch_norm': True, 'lr': 0.00018572983005243663, 'weight_decay': 1.8907823396101775e-06, 'epochs': 113, 'loss': 'mae', 'optimizer': 'adam', 'graph_mode': 'off', 'use_snp_selection': False}. Best is trial 9 with value: 0.05508655816078871.
[I 2025-12-05 15:47:28,557] Trial 21 finished with value: 0.03611150425080377 and parameters: {'model_type': 'mlp', 'hidden_dims': '[512, 256]', 'dropout': 0.1688434512378943, 'batch_norm': True, 'lr': 5.721741449780154e-05, 'weight_decay': 2.96187550954143e-07, 'epochs': 49, 'loss': 'mse', 'optimizer': 'adam', 'graph_mode': 'off', 'use_snp_selection': False}. Best is trial 9 with value: 0.05508655816078871.
[I 2025-12-05 15:47:29,623] Trial 22 finished with value: 0.03776210211283726 and parameters: {'model_type': 'mlp', 'hidden_dims': '[512, 256]', 'dropout': 0.14924760953649188, 'batch_norm': True, 'lr': 3.511276726977528e-05, 'weight_decay': 6.64240867970077e-07, 'epochs': 115, 'loss': 'mse', 'optimizer': 'adam', 'graph_mode': 'off', 'use_snp_selection': False}. Best is trial 9 with value: 0.05508655816078871.
[I 2025-12-05 15:47:30,566] Trial 23 finished with value: 0.03226911819869177 and parameters: {'model_type': 'mlp', 'hidden_dims': '[512, 256]', 'dropout': 0.23070381072043317, 'batch_norm': True, 'lr': 9.002796660349704e-05, 'weight_decay': 3.2666120737763034e-07, 'epochs': 80, 'loss': 'mse', 'optimizer': 'adam', 'graph_mode': 'off', 'use_snp_selection': False}. Best is trial 9 with value: 0.05508655816078871.
[I 2025-12-05 15:47:31,819] Trial 24 finished with value: 0.043072174383835475 and parameters: {'model_type': 'mlp', 'hidden_dims': '[512, 256]', 'dropout': 0.16393818537711172, 'batch_norm': True, 'lr': 0.0004055138799270616, 'weight_decay': 1.3169436449445738e-06, 'epochs': 169, 'loss': 'mse', 'optimizer': 'adam', 'graph_mode': 'off', 'use_snp_selection': False}. Best is trial 9 with value: 0.05508655816078871.
[I 2025-12-05 15:47:32,656] Trial 25 finished with value: 0.04467275206205836 and parameters: {'model_type': 'mlp', 'hidden_dims': '[256, 128, 64]', 'dropout': 0.5335323239954018, 'batch_norm': True, 'lr': 0.00013837138049694456, 'weight_decay': 3.834383452465513e-06, 'epochs': 132, 'loss': 'mse', 'optimizer': 'adam', 'graph_mode': 'off', 'use_snp_selection': False}. Best is trial 9 with value: 0.05508655816078871.
[I 2025-12-05 15:47:33,313] Trial 26 finished with value: 0.060990974604380285 and parameters: {'model_type': 'mlp', 'hidden_dims': '[128, 64]', 'dropout': 0.30662807104989853, 'batch_norm': True, 'lr': 7.552087462875498e-05, 'weight_decay': 8.325917583499545e-06, 'epochs': 77, 'loss': 'mse', 'optimizer': 'adam', 'graph_mode': 'off', 'use_snp_selection': True, 'num_snps': 3842}. Best is trial 26 with value: 0.060990974604380285.
[I 2025-12-05 15:47:34,058] Trial 27 finished with value: 0.05139412861257525 and parameters: {'model_type': 'mlp', 'hidden_dims': '[128, 64]', 'dropout': 0.30193661434271013, 'batch_norm': False, 'lr': 2.985754561963787e-05, 'weight_decay': 3.7728781986273995e-05, 'epochs': 210, 'loss': 'mse', 'optimizer': 'adam', 'graph_mode': 'off', 'use_snp_selection': True, 'num_snps': 2812}. Best is trial 26 with value: 0.060990974604380285.
[I 2025-12-05 15:47:35,044] Trial 28 finished with value: 0.008214001881376954 and parameters: {'model_type': 'mlp', 'hidden_dims': '[128, 64]', 'dropout': 0.4421871938612874, 'batch_norm': True, 'lr': 1.2702809395400402e-05, 'weight_decay': 8.451007046308065e-06, 'epochs': 70, 'loss': 'mae', 'optimizer': 'adam', 'graph_mode': 'off', 'use_snp_selection': True, 'num_snps': 16664}. Best is trial 26 with value: 0.060990974604380285.
[I 2025-12-05 15:47:36,327] Trial 29 finished with value: 0.014144536290174635 and parameters: {'model_type': 'mlp', 'hidden_dims': '[128, 64]', 'dropout': 0.3541245880248185, 'batch_norm': True, 'lr': 2.8047521320976694e-05, 'weight_decay': 4.614105838493116e-05, 'epochs': 229, 'loss': 'mae', 'optimizer': 'adam', 'graph_mode': 'off', 'use_snp_selection': True, 'num_snps': 19668}. Best is trial 26 with value: 0.060990974604380285.
[I 2025-12-05 15:47:37,104] Trial 30 finished with value: 0.0646982345676169 and parameters: {'model_type': 'mlp', 'hidden_dims': '[128, 64]', 'dropout': 0.20304008718931066, 'batch_norm': True, 'lr': 7.77856878729214e-05, 'weight_decay': 7.466731112158841e-05, 'epochs': 171, 'loss': 'mse', 'optimizer': 'adam', 'graph_mode': 'off', 'use_snp_selection': True, 'num_snps': 3639}. Best is trial 30 with value: 0.0646982345676169.
[I 2025-12-05 15:47:37,858] Trial 31 finished with value: 0.02244309769882082 and parameters: {'model_type': 'mlp', 'hidden_dims': '[128, 64]', 'dropout': 0.20207775015824875, 'batch_norm': True, 'lr': 7.991549579730703e-05, 'weight_decay': 8.970651988260853e-05, 'epochs': 182, 'loss': 'mse', 'optimizer': 'adam', 'graph_mode': 'off', 'use_snp_selection': True, 'num_snps': 2132}. Best is trial 30 with value: 0.0646982345676169.
[I 2025-12-05 15:47:39,310] Trial 32 finished with value: 0.059948356515562434 and parameters: {'model_type': 'mlp', 'hidden_dims': '[128, 64]', 'dropout': 0.25890506666510665, 'batch_norm': True, 'lr': 0.000152918189061068, 'weight_decay': 0.00011190481341845656, 'epochs': 252, 'loss': 'mse', 'optimizer': 'adam', 'graph_mode': 'off', 'use_snp_selection': True, 'num_snps': 23391}. Best is trial 30 with value: 0.0646982345676169.
[I 2025-12-05 15:47:40,487] Trial 33 finished with value: 0.03129654548098362 and parameters: {'model_type': 'mlp', 'hidden_dims': '[128, 64]', 'dropout': 0.2417402566233192, 'batch_norm': True, 'lr': 0.00017245439063439533, 'weight_decay': 0.0001261109517751949, 'epochs': 302, 'loss': 'mse', 'optimizer': 'adam', 'graph_mode': 'off', 'use_snp_selection': True, 'num_snps': 11281}. Best is trial 30 with value: 0.0646982345676169.
