[I 2025-12-05 15:19:30,647] Trial 8 finished with value: 0.08146422390900915 and parameters: {'model_type': 'mlp', 'hidden_dims': '[512, 128]', 'dropout': 0.10743001231661406, 'batch_norm': True, 'lr': 0.00023728538449271062, 'weight_decay': 1.7629071578048637e-05, 'epochs': 312, 'loss': 'mae', 'optimizer': 'adam', 'graph_mode': 'off', 'use_snp_selection': False}. Best is trial 7 with value: 0.0940919207294577.
[I 2025-12-05 15:19:32,749] Trial 9 finished with value: 0.05497714989345312 and parameters: {'model_type': 'mlp', 'hidden_dims': '[512, 64]', 'dropout': 0.14505336736221927, 'batch_norm': True, 'lr': 5.8619638388111826e-05, 'weight_decay': 6.200156172669308e-07, 'epochs': 175, 'loss': 'mse', 'optimizer': 'adam', 'graph_mode': 'off', 'use_snp_selection': False}. Best is trial 7 with value: 0.0940919207294577.
[I 2025-12-05 15:19:33,851] Trial 10 finished with value: -0.028700294460612303 and parameters: {'model_type': 'mlp', 'hidden_dims': '[512, 256]', 'dropout': 0.2736992815328032, 'batch_norm': False, 'lr': 0.00032393778075602147, 'weight_decay': 1.1511946696017092e-07, 'epochs': 41, 'loss': 'mse', 'optimizer': 'adam', 'graph_mode': 'off', 'use_snp_selection': False}. Best is trial 7 with value: 0.0940919207294577.
[I 2025-12-05 15:19:34,822] Trial 11 finished with value: 0.012506414003124052 and parameters: {'model_type': 'mlp', 'hidden_dims': '[256, 128]', 'dropout': 0.5011246104824927, 'batch_norm': True, 'lr': 1.6474108386126448e-05, 'weight_decay': 2.8129958937311506e-06, 'epochs': 77, 'loss': 'mae', 'optimizer': 'adam', 'graph_mode': 'off', 'use_snp_selection': False}. Best is trial 7 with value: 0.0940919207294577.
[I 2025-12-05 15:19:37,482] Trial 12 finished with value: 0.08652132981528439 and parameters: {'model_type': 'mlp', 'hidden_dims': '[512, 256]', 'dropout': 0.4779690972965961, 'batch_norm': True, 'lr': 0.000121041789182661, 'weight_decay': 1.3081036432574914e-07, 'epochs': 248, 'loss': 'mae', 'optimizer': 'adam', 'graph_mode': 'off', 'use_snp_selection': False}. Best is trial 7 with value: 0.0940919207294577.
[I 2025-12-05 15:19:39,935] Trial 13 finished with value: 0.05613298785441592 and parameters: {'model_type': 'mlp', 'hidden_dims': '[512, 256]', 'dropout': 0.3015309124038663, 'batch_norm': True, 'lr': 1.8184704710575438e-05, 'weight_decay': 3.7813806106960503e-06, 'epochs': 224, 'loss': 'mse', 'optimizer': 'adam', 'graph_mode': 'off', 'use_snp_selection': False}. Best is trial 7 with value: 0.0940919207294577.
[I 2025-12-05 15:19:40,982] Trial 14 finished with value: 0.09293005655444558 and parameters: {'model_type': 'mlp', 'hidden_dims': '[256, 128]', 'dropout': 0.47260361404074946, 'batch_norm': True, 'lr': 0.0006809598175709456, 'weight_decay': 5.366986687375328e-07, 'epochs': 114, 'loss': 'mse', 'optimizer': 'adam', 'graph_mode': 'off', 'use_snp_selection': False}. Best is trial 7 with value: 0.0940919207294577.
[I 2025-12-05 15:19:41,763] Trial 15 finished with value: 0.07862440880770452 and parameters: {'model_type': 'mlp', 'hidden_dims': '[128, 64]', 'dropout': 0.5864162554894389, 'batch_norm': True, 'lr': 0.0006369112382724065, 'weight_decay': 4.007592925312596e-07, 'epochs': 106, 'loss': 'mse', 'optimizer': 'adam', 'graph_mode': 'off', 'use_snp_selection': False}. Best is trial 7 with value: 0.0940919207294577.
[I 2025-12-05 15:19:42,784] Trial 16 finished with value: 0.09143418051531797 and parameters: {'model_type': 'mlp', 'hidden_dims': '[256, 128, 64]', 'dropout': 0.32498898452198355, 'batch_norm': True, 'lr': 0.0007721332394299998, 'weight_decay': 4.833299252951357e-07, 'epochs': 104, 'loss': 'mse', 'optimizer': 'adam', 'graph_mode': 'off', 'use_snp_selection': False}. Best is trial 7 with value: 0.0940919207294577.
[I 2025-12-05 15:19:43,577] Trial 17 finished with value: 0.09764399533380454 and parameters: {'model_type': 'mlp', 'hidden_dims': '[256, 128]', 'dropout': 0.5239703284243921, 'batch_norm': True, 'lr': 0.0002246265796864556, 'weight_decay': 1.3398043894594233e-06, 'epochs': 43, 'loss': 'mse', 'optimizer': 'adam', 'graph_mode': 'off', 'use_snp_selection': False}. Best is trial 17 with value: 0.09764399533380454.
[I 2025-12-05 15:19:46,857] Trial 18 finished with value: 0.09103163605558365 and parameters: {'model_type': 'mlp', 'hidden_dims': '[512, 256]', 'dropout': 0.5411969552219991, 'batch_norm': False, 'lr': 0.00018595297947060594, 'weight_decay': 1.64176391803623e-06, 'epochs': 49, 'loss': 'mse', 'optimizer': 'adam', 'graph_mode': 'off', 'use_snp_selection': True, 'num_snps': 58241}. Best is trial 17 with value: 0.09764399533380454.
[I 2025-12-05 15:19:48,261] Trial 19 finished with value: 0.026478680971341446 and parameters: {'model_type': 'mlp', 'hidden_dims': '[512, 256]', 'dropout': 0.1872146858609159, 'batch_norm': True, 'lr': 2.118043669762921e-05, 'weight_decay': 5.616604511856029e-06, 'epochs': 81, 'loss': 'mse', 'optimizer': 'adam', 'graph_mode': 'off', 'use_snp_selection': False}. Best is trial 17 with value: 0.09764399533380454.
[I 2025-12-05 15:19:49,192] Trial 20 finished with value: 0.08621325273998304 and parameters: {'model_type': 'mlp', 'hidden_dims': '[256, 128]', 'dropout': 0.2263663991477394, 'batch_norm': True, 'lr': 0.00010819146253297384, 'weight_decay': 2.662452439070007e-07, 'epochs': 69, 'loss': 'mse', 'optimizer': 'adam', 'graph_mode': 'off', 'use_snp_selection': False}. Best is trial 17 with value: 0.09764399533380454.
[I 2025-12-05 15:19:50,289] Trial 21 finished with value: 0.08990308086294813 and parameters: {'model_type': 'mlp', 'hidden_dims': '[256, 128]', 'dropout': 0.47400523955278123, 'batch_norm': True, 'lr': 0.0004484020275963593, 'weight_decay': 9.757172261068941e-07, 'epochs': 120, 'loss': 'mse', 'optimizer': 'adam', 'graph_mode': 'off', 'use_snp_selection': False}. Best is trial 17 with value: 0.09764399533380454.
[I 2025-12-05 15:19:51,411] Trial 22 finished with value: 0.08822044398977953 and parameters: {'model_type': 'mlp', 'hidden_dims': '[256, 128]', 'dropout': 0.5447308805905808, 'batch_norm': True, 'lr': 0.0008795994613476346, 'weight_decay': 2.057868946182529e-07, 'epochs': 126, 'loss': 'mse', 'optimizer': 'adam', 'graph_mode': 'off', 'use_snp_selection': False}. Best is trial 17 with value: 0.09764399533380454.
[I 2025-12-05 15:19:52,375] Trial 23 finished with value: 0.07766070554775432 and parameters: {'model_type': 'mlp', 'hidden_dims': '[256, 128]', 'dropout': 0.357122883601812, 'batch_norm': True, 'lr': 0.00017894590333109985, 'weight_decay': 8.739822690434779e-07, 'epochs': 82, 'loss': 'mse', 'optimizer': 'adam', 'graph_mode': 'off', 'use_snp_selection': False}. Best is trial 17 with value: 0.09764399533380454.
[I 2025-12-05 15:19:53,652] Trial 24 finished with value: 0.07187671699567846 and parameters: {'model_type': 'mlp', 'hidden_dims': '[256, 128]', 'dropout': 0.4393943818768671, 'batch_norm': True, 'lr': 0.0004187803883680246, 'weight_decay': 1.794022213356721e-06, 'epochs': 169, 'loss': 'mse', 'optimizer': 'adam', 'graph_mode': 'off', 'use_snp_selection': False}. Best is trial 17 with value: 0.09764399533380454.
[I 2025-12-05 15:19:54,551] Trial 25 finished with value: 0.0575932133582809 and parameters: {'model_type': 'mlp', 'hidden_dims': '[256, 128, 64]', 'dropout': 0.5335323239954018, 'batch_norm': True, 'lr': 3.0637592690322695e-05, 'weight_decay': 2.999904457843579e-07, 'epochs': 61, 'loss': 'mse', 'optimizer': 'adam', 'graph_mode': 'off', 'use_snp_selection': False}. Best is trial 17 with value: 0.09764399533380454.
[I 2025-12-05 15:19:55,697] Trial 26 finished with value: 0.06253200287225187 and parameters: {'model_type': 'mlp', 'hidden_dims': '[512, 128]', 'dropout': 0.5017230081415421, 'batch_norm': True, 'lr': 0.00011495936532106056, 'weight_decay': 6.829166967028787e-06, 'epochs': 108, 'loss': 'mse', 'optimizer': 'adam', 'graph_mode': 'off', 'use_snp_selection': True, 'num_snps': 3842}. Best is trial 17 with value: 0.09764399533380454.
[I 2025-12-05 15:19:56,481] Trial 27 finished with value: 0.06510916090293165 and parameters: {'model_type': 'mlp', 'hidden_dims': '[128, 64]', 'dropout': 0.45420232846991665, 'batch_norm': False, 'lr': 0.0002641652316942584, 'weight_decay': 9.239048513164648e-07, 'epochs': 91, 'loss': 'mse', 'optimizer': 'adam', 'graph_mode': 'off', 'use_snp_selection': False}. Best is trial 17 with value: 0.09764399533380454.
[I 2025-12-05 15:19:57,659] Trial 28 finished with value: 0.09611726092084578 and parameters: {'model_type': 'mlp', 'hidden_dims': '[512, 256]', 'dropout': 0.10141915081861069, 'batch_norm': True, 'lr': 0.00046511171748511574, 'weight_decay': 1.0016179599922595e-07, 'epochs': 53, 'loss': 'mse', 'optimizer': 'adam', 'graph_mode': 'off', 'use_snp_selection': False}. Best is trial 17 with value: 0.09764399533380454.
[I 2025-12-05 15:19:59,232] Trial 29 finished with value: 0.05369069936190146 and parameters: {'model_type': 'mlp', 'hidden_dims': '[512, 256]', 'dropout': 0.1038744233151062, 'batch_norm': True, 'lr': 1.0723974152844549e-05, 'weight_decay': 1.1137362721793677e-07, 'epochs': 55, 'loss': 'mse', 'optimizer': 'adam', 'graph_mode': 'off', 'use_snp_selection': True, 'num_snps': 19468}. Best is trial 17 with value: 0.09764399533380454.
[I 2025-12-05 15:20:01,026] Trial 30 finished with value: 0.08874418683430685 and parameters: {'model_type': 'mlp', 'hidden_dims': '[512, 256]', 'dropout': 0.1643682238690179, 'batch_norm': True, 'lr': 8.059343690145652e-05, 'weight_decay': 1.850202317674621e-07, 'epochs': 139, 'loss': 'mse', 'optimizer': 'adam', 'graph_mode': 'off', 'use_snp_selection': False}. Best is trial 17 with value: 0.09764399533380454.
[I 2025-12-05 15:20:02,174] Trial 31 finished with value: 0.0726375049470779 and parameters: {'model_type': 'mlp', 'hidden_dims': '[512, 256]', 'dropout': 0.14913151198880575, 'batch_norm': True, 'lr': 0.0005125461137288532, 'weight_decay': 4.0334316472251185e-07, 'epochs': 48, 'loss': 'mse', 'optimizer': 'adam', 'graph_mode': 'off', 'use_snp_selection': False}. Best is trial 17 with value: 0.09764399533380454.
[I 2025-12-05 15:20:02,972] Trial 32 finished with value: 0.09136199412114562 and parameters: {'model_type': 'mlp', 'hidden_dims': '[128, 64]', 'dropout': 0.22805252004048365, 'batch_norm': True, 'lr': 0.0009086093360571844, 'weight_decay': 2.1276266243426138e-07, 'epochs': 91, 'loss': 'mse', 'optimizer': 'adam', 'graph_mode': 'off', 'use_snp_selection': False}. Best is trial 17 with value: 0.09764399533380454.
[I 2025-12-05 15:20:04,111] Trial 33 finished with value: 0.09342789672765428 and parameters: {'model_type': 'mlp', 'hidden_dims': '[256, 128]', 'dropout': 0.11550154851071188, 'batch_norm': True, 'lr': 0.00033791582590399867, 'weight_decay': 8.822340236655884e-05, 'epochs': 125, 'loss': 'mse', 'optimizer': 'adam', 'graph_mode': 'off', 'use_snp_selection': False}. Best is trial 17 with value: 0.09764399533380454.
[I 2025-12-05 15:20:05,402] Trial 34 finished with value: 0.07367456877995757 and parameters: {'model_type': 'mlp', 'hidden_dims': '[512, 256]', 'dropout': 0.13215180216051728, 'batch_norm': True, 'lr': 0.00016002986500852247, 'weight_decay': 6.306627832629143e-05, 'epochs': 66, 'loss': 'mae', 'optimizer': 'adam', 'graph_mode': 'off', 'use_snp_selection': False}. Best is trial 17 with value: 0.09764399533380454.
[I 2025-12-05 15:20:06,697] Trial 35 finished with value: 0.06778535416462977 and parameters: {'model_type': 'mlp', 'hidden_dims': '[256, 128]', 'dropout': 0.19075423498056188, 'batch_norm': False, 'lr': 4.040920312339525e-05, 'weight_decay': 4.590998942143832e-05, 'epochs': 174, 'loss': 'mse', 'optimizer': 'adam', 'graph_mode': 'off', 'use_snp_selection': False}. Best is trial 17 with value: 0.09764399533380454.
[I 2025-12-05 15:20:09,713] Trial 36 finished with value: 0.08496193156801424 and parameters: {'model_type': 'mlp', 'hidden_dims': '[512, 64]', 'dropout': 0.11673689815759726, 'batch_norm': True, 'lr': 0.00035425179870396314, 'weight_decay': 6.886876803351276e-05, 'epochs': 42, 'loss': 'mse', 'optimizer': 'adam', 'graph_mode': 'off', 'use_snp_selection': True, 'num_snps': 58661}. Best is trial 17 with value: 0.09764399533380454.
[I 2025-12-05 15:20:10,939] Trial 37 finished with value: 0.049833330660900066 and parameters: {'model_type': 'mlp', 'hidden_dims': '[256, 128, 64]', 'dropout': 0.17547436915550307, 'batch_norm': True, 'lr': 3.773475062837e-06, 'weight_decay': 0.0002346111825650937, 'epochs': 161, 'loss': 'mae', 'optimizer': 'adam', 'graph_mode': 'off', 'use_snp_selection': False}. Best is trial 17 with value: 0.09764399533380454.
[I 2025-12-05 15:20:12,522] Trial 38 finished with value: 0.07260621365569393 and parameters: {'model_type': 'mlp', 'hidden_dims': '[256, 128]', 'dropout': 0.2186963806700058, 'batch_norm': False, 'lr': 8.976817656340686e-05, 'weight_decay': 0.00013672735644634044, 'epochs': 135, 'loss': 'mse', 'optimizer': 'adam', 'graph_mode': 'off', 'use_snp_selection': True, 'num_snps': 19911}. Best is trial 17 with value: 0.09764399533380454.
[I 2025-12-05 15:20:14,791] Trial 39 finished with value: 0.07523984588727461 and parameters: {'model_type': 'mlp', 'hidden_dims': '[512, 128]', 'dropout': 0.14594220168490912, 'batch_norm': True, 'lr': 0.00021133811751294774, 'weight_decay': 0.0007806989097402438, 'epochs': 198, 'loss': 'mse', 'optimizer': 'adam', 'graph_mode': 'off', 'use_snp_selection': False}. Best is trial 17 with value: 0.09764399533380454.
[I 2025-12-05 15:20:16,298] Trial 40 finished with value: 0.09650353343214274 and parameters: {'model_type': 'mlp', 'hidden_dims': '[512, 256]', 'dropout': 0.26862402879134306, 'batch_norm': True, 'lr': 0.00030288274905416047, 'weight_decay': 1.3894103153516703e-05, 'epochs': 95, 'loss': 'mae', 'optimizer': 'adam', 'graph_mode': 'off', 'use_snp_selection': False}. Best is trial 17 with value: 0.09764399533380454.
[I 2025-12-05 15:20:17,828] Trial 41 finished with value: 0.0879265161853364 and parameters: {'model_type': 'mlp', 'hidden_dims': '[512, 256]', 'dropout': 0.2550978051134176, 'batch_norm': True, 'lr': 0.00032839263155278207, 'weight_decay': 2.2277021546688062e-05, 'epochs': 98, 'loss': 'mae', 'optimizer': 'adam', 'graph_mode': 'off', 'use_snp_selection': False}. Best is trial 17 with value: 0.09764399533380454.
[I 2025-12-05 15:20:21,207] Trial 42 finished with value: 0.08568984747758779 and parameters: {'model_type': 'mlp', 'hidden_dims': '[512, 256]', 'dropout': 0.12336673834743371, 'batch_norm': True, 'lr': 0.00029042442308919975, 'weight_decay': 1.273022956444889e-05, 'epochs': 348, 'loss': 'mae', 'optimizer': 'adam', 'graph_mode': 'off', 'use_snp_selection': False}. Best is trial 17 with value: 0.09764399533380454.
[I 2025-12-05 15:20:22,500] Trial 43 finished with value: 0.08632391078551854 and parameters: {'model_type': 'mlp', 'hidden_dims': '[512, 256]', 'dropout': 0.20923653178824336, 'batch_norm': True, 'lr': 0.0005413463369748523, 'weight_decay': 3.372885511331697e-05, 'epochs': 66, 'loss': 'mae', 'optimizer': 'adam', 'graph_mode': 'off', 'use_snp_selection': False}. Best is trial 17 with value: 0.09764399533380454.
[I 2025-12-05 15:20:23,869] Trial 44 finished with value: 0.06775686133137457 and parameters: {'model_type': 'mlp', 'hidden_dims': '[512, 64]', 'dropout': 0.40976114755964765, 'batch_norm': True, 'lr': 5.984658459298163e-05, 'weight_decay': 0.00010040081007592979, 'epochs': 79, 'loss': 'mae', 'optimizer': 'adam', 'graph_mode': 'off', 'use_snp_selection': False}. Best is trial 17 with value: 0.09764399533380454.
[I 2025-12-05 15:20:25,775] Trial 45 finished with value: 0.08314841862247545 and parameters: {'model_type': 'mlp', 'hidden_dims': '[512, 256]', 'dropout': 0.10030286299494301, 'batch_norm': True, 'lr': 0.0001414173009959726, 'weight_decay': 2.7616794717163247e-06, 'epochs': 155, 'loss': 'mae', 'optimizer': 'adam', 'graph_mode': 'off', 'use_snp_selection': False}. Best is trial 17 with value: 0.09764399533380454.
[I 2025-12-05 15:20:27,199] Trial 46 finished with value: 0.11623434863361608 and parameters: {'model_type': 'mlp', 'hidden_dims': '[512, 256]', 'dropout': 0.2880612633679474, 'batch_norm': False, 'lr': 0.00023729357033456884, 'weight_decay': 9.870473499561963e-06, 'epochs': 91, 'loss': 'mae', 'optimizer': 'adam', 'graph_mode': 'off', 'use_snp_selection': False}. Best is trial 46 with value: 0.11623434863361608.
[I 2025-12-05 15:20:28,291] Trial 47 finished with value: 0.04800750773943528 and parameters: {'model_type': 'mlp', 'hidden_dims': '[512, 256]', 'dropout': 0.28711600536789533, 'batch_norm': False, 'lr': 0.0002485887905014627, 'weight_decay': 9.283764979293104e-06, 'epochs': 40, 'loss': 'mae', 'optimizer': 'adam', 'graph_mode': 'off', 'use_snp_selection': False}. Best is trial 46 with value: 0.11623434863361608.
[I 2025-12-05 15:20:29,719] Trial 48 finished with value: 0.10137015731276762 and parameters: {'model_type': 'mlp', 'hidden_dims': '[512, 256]', 'dropout': 0.32882695761385583, 'batch_norm': False, 'lr': 6.752113277258883e-05, 'weight_decay': 1.5167874660258301e-05, 'epochs': 91, 'loss': 'mae', 'optimizer': 'adam', 'graph_mode': 'off', 'use_snp_selection': False}. Best is trial 46 with value: 0.11623434863361608.
[I 2025-12-05 15:20:32,323] Trial 49 finished with value: 0.07769872868663004 and parameters: {'model_type': 'mlp', 'hidden_dims': '[512, 256]', 'dropout': 0.3521347160874466, 'batch_norm': False, 'lr': 3.804465474564543e-05, 'weight_decay': 1.1935061700119564e-05, 'epochs': 59, 'loss': 'mae', 'optimizer': 'adam', 'graph_mode': 'off', 'use_snp_selection': True, 'num_snps': 46888}. Best is trial 46 with value: 0.11623434863361608.
[I 2025-12-05 15:20:33,789] Trial 50 finished with value: 0.084348179184408 and parameters: {'model_type': 'mlp', 'hidden_dims': '[512, 256]', 'dropout': 0.3187965488624393, 'batch_norm': False, 'lr': 0.00014090397297691331, 'weight_decay': 1.635222212128241e-05, 'epochs': 89, 'loss': 'mae', 'optimizer': 'adam', 'graph_mode': 'off', 'use_snp_selection': False}. Best is trial 46 with value: 0.11623434863361608.
[I 2025-12-05 15:20:35,135] Trial 51 finished with value: 0.09692619627277552 and parameters: {'model_type': 'mlp', 'hidden_dims': '[512, 256]', 'dropout': 0.250935690748759, 'batch_norm': False, 'lr': 6.0705492274342894e-05, 'weight_decay': 5.37475869236528e-06, 'epochs': 75, 'loss': 'mae', 'optimizer': 'adam', 'graph_mode': 'off', 'use_snp_selection': False}. Best is trial 46 with value: 0.11623434863361608.
[I 2025-12-05 15:20:36,459] Trial 52 finished with value: 0.0617361054368511 and parameters: {'model_type': 'mlp', 'hidden_dims': '[512, 256]', 'dropout': 0.2536505442920915, 'batch_norm': False, 'lr': 8.792990967150246e-05, 'weight_decay': 6.781785160806137e-06, 'epochs': 71, 'loss': 'mae', 'optimizer': 'adam', 'graph_mode': 'off', 'use_snp_selection': False}. Best is trial 46 with value: 0.11623434863361608.
[I 2025-12-05 15:20:37,637] Trial 53 finished with value: 0.054539797071807755 and parameters: {'model_type': 'mlp', 'hidden_dims': '[512, 256]', 'dropout': 0.38343002600138476, 'batch_norm': False, 'lr': 2.7141149067009716e-05, 'weight_decay': 4.6709132530738555e-06, 'epochs': 52, 'loss': 'mae', 'optimizer': 'adam', 'graph_mode': 'off', 'use_snp_selection': False}. Best is trial 46 with value: 0.11623434863361608.
[I 2025-12-05 15:20:40,600] Trial 54 finished with value: 0.07899771558303759 and parameters: {'model_type': 'mlp', 'hidden_dims': '[512, 256]', 'dropout': 0.3154449255676304, 'batch_norm': False, 'lr': 1.0694541266414286e-05, 'weight_decay': 2.88002776383978e-06, 'epochs': 294, 'loss': 'mae', 'optimizer': 'adam', 'graph_mode': 'off', 'use_snp_selection': False}. Best is trial 46 with value: 0.11623434863361608.
[I 2025-12-05 15:20:41,918] Trial 55 finished with value: 0.10949373736558088 and parameters: {'model_type': 'mlp', 'hidden_dims': '[512, 256]', 'dropout': 0.2737189312713496, 'batch_norm': False, 'lr': 4.440912815099319e-05, 'weight_decay': 3.172814203256749e-05, 'epochs': 76, 'loss': 'mae', 'optimizer': 'adam', 'graph_mode': 'off', 'use_snp_selection': False}. Best is trial 46 with value: 0.11623434863361608.
[I 2025-12-05 15:20:43,486] Trial 56 finished with value: 0.08716460381836037 and parameters: {'model_type': 'mlp', 'hidden_dims': '[512, 128]', 'dropout': 0.2857283317653806, 'batch_norm': False, 'lr': 5.351788395620665e-05, 'weight_decay': 3.030235744784273e-05, 'epochs': 111, 'loss': 'mae', 'optimizer': 'adam', 'graph_mode': 'off', 'use_snp_selection': False}. Best is trial 46 with value: 0.11623434863361608.
[I 2025-12-05 15:20:44,464] Trial 57 finished with value: 0.09939728316517929 and parameters: {'model_type': 'mlp', 'hidden_dims': '[128, 64]', 'dropout': 0.2698297563493367, 'batch_norm': False, 'lr': 7.052047531723663e-05, 'weight_decay': 9.316291839237362e-06, 'epochs': 219, 'loss': 'mae', 'optimizer': 'adam', 'graph_mode': 'off', 'use_snp_selection': False}. Best is trial 46 with value: 0.11623434863361608.
[I 2025-12-05 15:20:45,482] Trial 58 finished with value: 0.09527786189467313 and parameters: {'model_type': 'mlp', 'hidden_dims': '[128, 64]', 'dropout': 0.3363209171241471, 'batch_norm': False, 'lr': 4.3195018209758885e-05, 'weight_decay': 2.2942704970118104e-05, 'epochs': 241, 'loss': 'mae', 'optimizer': 'adam', 'graph_mode': 'off', 'use_snp_selection': False}. Best is trial 46 with value: 0.11623434863361608.
[I 2025-12-05 15:20:46,399] Trial 59 finished with value: 0.1011420418601196 and parameters: {'model_type': 'mlp', 'hidden_dims': '[128, 64]', 'dropout': 0.24016054017802935, 'batch_norm': False, 'lr': 6.166975669357893e-05, 'weight_decay': 9.095178547516014e-06, 'epochs': 183, 'loss': 'mae', 'optimizer': 'adam', 'graph_mode': 'off', 'use_snp_selection': False}. Best is trial 46 with value: 0.11623434863361608.
