[I 2025-12-05 16:00:06,688] Trial 105 finished with value: 0.10108061208333093 and parameters: {'model_type': 'mlp', 'hidden_dims': '[512, 256]', 'dropout': 0.11218305850924216, 'batch_norm': True, 'lr': 0.00018981839159555486, 'weight_decay': 1.1635166190695608e-05, 'epochs': 296, 'loss': 'mae', 'optimizer': 'adam', 'graph_mode': 'off', 'use_snp_selection': False}. Best is trial 73 with value: 0.12343974487497228.
[I 2025-12-05 16:00:08,047] Trial 106 finished with value: 0.10876298621345931 and parameters: {'model_type': 'mlp', 'hidden_dims': '[512, 128]', 'dropout': 0.14526004528887645, 'batch_norm': True, 'lr': 0.0007711691273243041, 'weight_decay': 3.183749437175954e-05, 'epochs': 161, 'loss': 'mae', 'optimizer': 'adam', 'graph_mode': 'off', 'use_snp_selection': False}. Best is trial 73 with value: 0.12343974487497228.
[I 2025-12-05 16:00:09,479] Trial 107 finished with value: 0.0998939015037517 and parameters: {'model_type': 'mlp', 'hidden_dims': '[512, 128]', 'dropout': 0.14788411967808465, 'batch_norm': True, 'lr': 0.0008808993242671163, 'weight_decay': 6.75762221164809e-05, 'epochs': 166, 'loss': 'mae', 'optimizer': 'adam', 'graph_mode': 'off', 'use_snp_selection': False}. Best is trial 73 with value: 0.12343974487497228.
[I 2025-12-05 16:00:10,637] Trial 108 finished with value: 0.08597447282114709 and parameters: {'model_type': 'mlp', 'hidden_dims': '[512, 128]', 'dropout': 0.19253244275263387, 'batch_norm': True, 'lr': 0.0007328634547841005, 'weight_decay': 6.282492685195799e-06, 'epochs': 161, 'loss': 'mae', 'optimizer': 'adam', 'graph_mode': 'off', 'use_snp_selection': True, 'num_snps': 11322}. Best is trial 73 with value: 0.12343974487497228.
[I 2025-12-05 16:00:12,023] Trial 109 finished with value: 0.08191340491476432 and parameters: {'model_type': 'mlp', 'hidden_dims': '[512, 128]', 'dropout': 0.1738684540507138, 'batch_norm': True, 'lr': 0.000613162078831959, 'weight_decay': 3.4051241789944853e-05, 'epochs': 155, 'loss': 'mse', 'optimizer': 'adam', 'graph_mode': 'off', 'use_snp_selection': False}. Best is trial 73 with value: 0.12343974487497228.
[I 2025-12-05 16:00:13,540] Trial 110 finished with value: 0.04175656544463665 and parameters: {'model_type': 'mlp', 'hidden_dims': '[512, 128]', 'dropout': 0.15879049535803524, 'batch_norm': True, 'lr': 0.00021118815667978182, 'weight_decay': 0.0008327804552006847, 'epochs': 188, 'loss': 'mae', 'optimizer': 'adam', 'graph_mode': 'off', 'use_snp_selection': False}. Best is trial 73 with value: 0.12343974487497228.
[I 2025-12-05 16:00:15,673] Trial 111 finished with value: 0.10582969090351406 and parameters: {'model_type': 'mlp', 'hidden_dims': '[512, 256]', 'dropout': 0.12736730811862318, 'batch_norm': True, 'lr': 0.000511123394626157, 'weight_decay': 8.040089645883555e-06, 'epochs': 349, 'loss': 'mae', 'optimizer': 'adam', 'graph_mode': 'off', 'use_snp_selection': False}. Best is trial 73 with value: 0.12343974487497228.
[I 2025-12-05 16:00:17,108] Trial 112 finished with value: 0.08640433616193881 and parameters: {'model_type': 'mlp', 'hidden_dims': '[512, 128]', 'dropout': 0.13641397583802176, 'batch_norm': True, 'lr': 0.0003728758852905556, 'weight_decay': 0.00019978871435321577, 'epochs': 174, 'loss': 'mae', 'optimizer': 'adam', 'graph_mode': 'off', 'use_snp_selection': False}. Best is trial 73 with value: 0.12343974487497228.
[I 2025-12-05 16:00:18,950] Trial 113 finished with value: 0.1101681146179926 and parameters: {'model_type': 'mlp', 'hidden_dims': '[512, 256]', 'dropout': 0.14324060918520884, 'batch_norm': True, 'lr': 0.00015182697712603233, 'weight_decay': 2.8511735395206108e-05, 'epochs': 286, 'loss': 'mae', 'optimizer': 'adam', 'graph_mode': 'off', 'use_snp_selection': False}. Best is trial 73 with value: 0.12343974487497228.
[I 2025-12-05 16:00:20,204] Trial 114 finished with value: 0.0870597450404737 and parameters: {'model_type': 'mlp', 'hidden_dims': '[256, 128, 64]', 'dropout': 0.14603490688861628, 'batch_norm': True, 'lr': 0.0001457021956069909, 'weight_decay': 0.0005514976800862351, 'epochs': 301, 'loss': 'mae', 'optimizer': 'adam', 'graph_mode': 'off', 'use_snp_selection': False}. Best is trial 73 with value: 0.12343974487497228.
[I 2025-12-05 16:00:21,192] Trial 115 finished with value: 0.10084270162519945 and parameters: {'model_type': 'mlp', 'hidden_dims': '[128, 64]', 'dropout': 0.16497418215803547, 'batch_norm': True, 'lr': 9.942389941011184e-05, 'weight_decay': 2.3507646402341447e-05, 'epochs': 269, 'loss': 'mae', 'optimizer': 'adam', 'graph_mode': 'off', 'use_snp_selection': False}. Best is trial 73 with value: 0.12343974487497228.
[I 2025-12-05 16:00:23,060] Trial 116 finished with value: 0.10131839559532223 and parameters: {'model_type': 'mlp', 'hidden_dims': '[512, 64]', 'dropout': 0.2019984306964183, 'batch_norm': True, 'lr': 0.00012152318855358448, 'weight_decay': 0.0003907400754836267, 'epochs': 284, 'loss': 'mae', 'optimizer': 'adam', 'graph_mode': 'off', 'use_snp_selection': False}. Best is trial 73 with value: 0.12343974487497228.
[I 2025-12-05 16:00:24,181] Trial 117 finished with value: 0.07874671022296911 and parameters: {'model_type': 'mlp', 'hidden_dims': '[256, 128]', 'dropout': 0.1836429289580269, 'batch_norm': True, 'lr': 0.00015774305791653963, 'weight_decay': 1.4871744279936797e-05, 'epochs': 228, 'loss': 'mae', 'optimizer': 'adam', 'graph_mode': 'off', 'use_snp_selection': False}. Best is trial 73 with value: 0.12343974487497228.
[I 2025-12-05 16:00:25,415] Trial 118 finished with value: 0.05953031290008058 and parameters: {'model_type': 'mlp', 'hidden_dims': '[512, 128]', 'dropout': 0.3547364702559422, 'batch_norm': False, 'lr': 2.978180605979622e-06, 'weight_decay': 2.597772811019802e-06, 'epochs': 125, 'loss': 'mae', 'optimizer': 'adam', 'graph_mode': 'off', 'use_snp_selection': False}. Best is trial 73 with value: 0.12343974487497228.
[I 2025-12-05 16:00:27,002] Trial 119 finished with value: 0.1087080096348834 and parameters: {'model_type': 'mlp', 'hidden_dims': '[512, 256]', 'dropout': 0.1540557734230183, 'batch_norm': True, 'lr': 0.00031562686925045656, 'weight_decay': 9.860036304314866e-05, 'epochs': 212, 'loss': 'mae', 'optimizer': 'adam', 'graph_mode': 'off', 'use_snp_selection': False}. Best is trial 73 with value: 0.12343974487497228.
[I 2025-12-05 16:00:28,697] Trial 120 finished with value: 0.09354416944304782 and parameters: {'model_type': 'mlp', 'hidden_dims': '[512, 128]', 'dropout': 0.22711789051360157, 'batch_norm': True, 'lr': 0.00022730549089427393, 'weight_decay': 8.745888722765384e-05, 'epochs': 237, 'loss': 'mae', 'optimizer': 'adam', 'graph_mode': 'off', 'use_snp_selection': False}. Best is trial 73 with value: 0.12343974487497228.
[I 2025-12-05 16:00:30,238] Trial 121 finished with value: 0.09400404917080353 and parameters: {'model_type': 'mlp', 'hidden_dims': '[512, 256]', 'dropout': 0.1552381072084693, 'batch_norm': True, 'lr': 0.00031474746602649174, 'weight_decay': 0.00011587921240335573, 'epochs': 197, 'loss': 'mae', 'optimizer': 'adam', 'graph_mode': 'off', 'use_snp_selection': False}. Best is trial 73 with value: 0.12343974487497228.
[I 2025-12-05 16:00:31,835] Trial 122 finished with value: 0.10335407087008532 and parameters: {'model_type': 'mlp', 'hidden_dims': '[512, 256]', 'dropout': 0.14235144510686204, 'batch_norm': True, 'lr': 0.00039694328477332745, 'weight_decay': 3.20105324626819e-05, 'epochs': 210, 'loss': 'mae', 'optimizer': 'adam', 'graph_mode': 'off', 'use_snp_selection': False}. Best is trial 73 with value: 0.12343974487497228.
[I 2025-12-05 16:00:33,750] Trial 123 finished with value: 0.10505847643171791 and parameters: {'model_type': 'mlp', 'hidden_dims': '[512, 256]', 'dropout': 0.17281554471903865, 'batch_norm': True, 'lr': 0.00027679035394030785, 'weight_decay': 4.772600396758038e-05, 'epochs': 287, 'loss': 'mae', 'optimizer': 'adam', 'graph_mode': 'off', 'use_snp_selection': False}. Best is trial 73 with value: 0.12343974487497228.
[I 2025-12-05 16:00:35,302] Trial 124 finished with value: 0.07899235271252972 and parameters: {'model_type': 'mlp', 'hidden_dims': '[512, 256]', 'dropout': 0.4151420586719883, 'batch_norm': True, 'lr': 0.00025085697010308417, 'weight_decay': 5.560473395761659e-06, 'epochs': 203, 'loss': 'mae', 'optimizer': 'adam', 'graph_mode': 'off', 'use_snp_selection': False}. Best is trial 73 with value: 0.12343974487497228.
[I 2025-12-05 16:00:36,896] Trial 125 finished with value: 0.07516056322158632 and parameters: {'model_type': 'mlp', 'hidden_dims': '[512, 256]', 'dropout': 0.13021915197311737, 'batch_norm': True, 'lr': 0.00018392187310948784, 'weight_decay': 3.7700699286761636e-05, 'epochs': 214, 'loss': 'mae', 'optimizer': 'adam', 'graph_mode': 'off', 'use_snp_selection': False}. Best is trial 73 with value: 0.12343974487497228.
[I 2025-12-05 16:00:38,136] Trial 126 finished with value: 0.0886248407179721 and parameters: {'model_type': 'mlp', 'hidden_dims': '[256, 128, 64]', 'dropout': 0.1526994637385444, 'batch_norm': True, 'lr': 0.00029991316617842775, 'weight_decay': 2.196227283809594e-05, 'epochs': 276, 'loss': 'mae', 'optimizer': 'adam', 'graph_mode': 'off', 'use_snp_selection': False}. Best is trial 73 with value: 0.12343974487497228.
[I 2025-12-05 16:00:40,057] Trial 127 finished with value: 0.10481279228476913 and parameters: {'model_type': 'mlp', 'hidden_dims': '[512, 256]', 'dropout': 0.20815825212215947, 'batch_norm': True, 'lr': 0.00020441300278019228, 'weight_decay': 0.00014416310086486943, 'epochs': 306, 'loss': 'mae', 'optimizer': 'adam', 'graph_mode': 'off', 'use_snp_selection': False}. Best is trial 73 with value: 0.12343974487497228.
[I 2025-12-05 16:00:42,363] Trial 128 finished with value: 0.11489108965012768 and parameters: {'model_type': 'mlp', 'hidden_dims': '[256, 128]', 'dropout': 0.11206886138610607, 'batch_norm': True, 'lr': 0.00013955456608504937, 'weight_decay': 9.82112252684545e-06, 'epochs': 226, 'loss': 'mae', 'optimizer': 'adam', 'graph_mode': 'off', 'use_snp_selection': True, 'num_snps': 51726}. Best is trial 73 with value: 0.12343974487497228.
[I 2025-12-05 16:00:44,982] Trial 129 finished with value: 0.07771925654784487 and parameters: {'model_type': 'mlp', 'hidden_dims': '[256, 128]', 'dropout': 0.10947018347018057, 'batch_norm': True, 'lr': 0.00014175218033140406, 'weight_decay': 1.0597824416997235e-05, 'epochs': 221, 'loss': 'mse', 'optimizer': 'adam', 'graph_mode': 'off', 'use_snp_selection': True, 'num_snps': 52886}. Best is trial 73 with value: 0.12343974487497228.
[I 2025-12-05 16:00:47,073] Trial 130 finished with value: 0.09435493767802186 and parameters: {'model_type': 'mlp', 'hidden_dims': '[256, 128]', 'dropout': 0.11730151418563453, 'batch_norm': True, 'lr': 8.515177500577615e-05, 'weight_decay': 7.52046595373913e-06, 'epochs': 180, 'loss': 'mae', 'optimizer': 'adam', 'graph_mode': 'off', 'use_snp_selection': True, 'num_snps': 37386}. Best is trial 73 with value: 0.12343974487497228.
[I 2025-12-05 16:00:49,592] Trial 131 finished with value: 0.0789124701824981 and parameters: {'model_type': 'mlp', 'hidden_dims': '[256, 128]', 'dropout': 0.13236528523941193, 'batch_norm': True, 'lr': 0.00010362511667224252, 'weight_decay': 1.2397116880630327e-05, 'epochs': 229, 'loss': 'mae', 'optimizer': 'adam', 'graph_mode': 'off', 'use_snp_selection': True, 'num_snps': 52055}. Best is trial 73 with value: 0.12343974487497228.
[I 2025-12-05 16:00:51,218] Trial 132 finished with value: 0.0709495982233977 and parameters: {'model_type': 'mlp', 'hidden_dims': '[256, 128]', 'dropout': 0.10048906871544283, 'batch_norm': True, 'lr': 0.00012382601231788782, 'weight_decay': 4.18863526074857e-06, 'epochs': 206, 'loss': 'mae', 'optimizer': 'adam', 'graph_mode': 'off', 'use_snp_selection': True, 'num_snps': 28495}. Best is trial 73 with value: 0.12343974487497228.
[I 2025-12-05 16:00:53,288] Trial 133 finished with value: 0.10946832088027178 and parameters: {'model_type': 'mlp', 'hidden_dims': '[512, 256]', 'dropout': 0.1249491211883056, 'batch_norm': True, 'lr': 0.00023618318055178725, 'weight_decay': 7.023807493123872e-05, 'epochs': 147, 'loss': 'mae', 'optimizer': 'adam', 'graph_mode': 'off', 'use_snp_selection': True, 'num_snps': 41014}. Best is trial 73 with value: 0.12343974487497228.
[I 2025-12-05 16:00:55,395] Trial 134 finished with value: 0.08585720314293478 and parameters: {'model_type': 'mlp', 'hidden_dims': '[512, 128]', 'dropout': 0.16366283796180034, 'batch_norm': True, 'lr': 0.0001634487361214301, 'weight_decay': 9.514663473066371e-05, 'epochs': 146, 'loss': 'mae', 'optimizer': 'adam', 'graph_mode': 'off', 'use_snp_selection': True, 'num_snps': 38598}. Best is trial 73 with value: 0.12343974487497228.
[I 2025-12-05 16:00:57,743] Trial 135 finished with value: 0.05267494699938048 and parameters: {'model_type': 'mlp', 'hidden_dims': '[256, 128]', 'dropout': 0.14192504706315703, 'batch_norm': True, 'lr': 5.153999118587367e-05, 'weight_decay': 7.38090548287779e-05, 'epochs': 112, 'loss': 'mae', 'optimizer': 'adam', 'graph_mode': 'off', 'use_snp_selection': True, 'num_snps': 50384}. Best is trial 73 with value: 0.12343974487497228.
[I 2025-12-05 16:00:59,969] Trial 136 finished with value: 0.0684267193960039 and parameters: {'model_type': 'mlp', 'hidden_dims': '[512, 256]', 'dropout': 0.12389664117369814, 'batch_norm': True, 'lr': 0.00017664610822865193, 'weight_decay': 5.7635060638389024e-05, 'epochs': 157, 'loss': 'mae', 'optimizer': 'adam', 'graph_mode': 'off', 'use_snp_selection': True, 'num_snps': 41672}. Best is trial 73 with value: 0.12343974487497228.
[I 2025-12-05 16:01:01,729] Trial 137 finished with value: 0.0912723768029625 and parameters: {'model_type': 'mlp', 'hidden_dims': '[512, 256]', 'dropout': 0.10966720283385195, 'batch_norm': True, 'lr': 0.00023058253515014908, 'weight_decay': 6.407908380755596e-06, 'epochs': 134, 'loss': 'mae', 'optimizer': 'adam', 'graph_mode': 'off', 'use_snp_selection': True, 'num_snps': 29204}. Best is trial 73 with value: 0.12343974487497228.
[I 2025-12-05 16:01:04,510] Trial 138 finished with value: 0.06169100798012951 and parameters: {'model_type': 'mlp', 'hidden_dims': '[512, 128]', 'dropout': 0.19472686436888617, 'batch_norm': False, 'lr': 0.0002708648490932695, 'weight_decay': 0.0001695615195057672, 'epochs': 235, 'loss': 'mae', 'optimizer': 'adam', 'graph_mode': 'off', 'use_snp_selection': True, 'num_snps': 49534}. Best is trial 73 with value: 0.12343974487497228.
[I 2025-12-05 16:01:07,273] Trial 139 finished with value: 0.08837689560447447 and parameters: {'model_type': 'mlp', 'hidden_dims': '[256, 128, 64]', 'dropout': 0.1772085413604774, 'batch_norm': True, 'lr': 0.0001997986466014992, 'weight_decay': 0.0002969628156903362, 'epochs': 247, 'loss': 'mae', 'optimizer': 'adam', 'graph_mode': 'off', 'use_snp_selection': True, 'num_snps': 55663}. Best is trial 73 with value: 0.12343974487497228.
[I 2025-12-05 16:01:08,919] Trial 140 finished with value: 0.10070728336232491 and parameters: {'model_type': 'mlp', 'hidden_dims': '[512, 64]', 'dropout': 0.1510454723203064, 'batch_norm': True, 'lr': 0.00034328422562636624, 'weight_decay': 3.2921596959262106e-06, 'epochs': 223, 'loss': 'mae', 'optimizer': 'adam', 'graph_mode': 'off', 'use_snp_selection': False}. Best is trial 73 with value: 0.12343974487497228.
[I 2025-12-05 16:01:10,813] Trial 141 finished with value: 0.07114393205968067 and parameters: {'model_type': 'mlp', 'hidden_dims': '[512, 256]', 'dropout': 0.1294539240861161, 'batch_norm': True, 'lr': 1.2841667931171941e-05, 'weight_decay': 4.354232315498476e-05, 'epochs': 291, 'loss': 'mae', 'optimizer': 'adam', 'graph_mode': 'off', 'use_snp_selection': False}. Best is trial 73 with value: 0.12343974487497228.
[I 2025-12-05 16:01:12,795] Trial 142 finished with value: 0.06091312837415683 and parameters: {'model_type': 'mlp', 'hidden_dims': '[512, 256]', 'dropout': 0.13867205864438215, 'batch_norm': True, 'lr': 2.6390988342952845e-05, 'weight_decay': 1.9231540717973956e-05, 'epochs': 318, 'loss': 'mae', 'optimizer': 'adam', 'graph_mode': 'off', 'use_snp_selection': False}. Best is trial 73 with value: 0.12343974487497228.
[I 2025-12-05 16:01:14,355] Trial 143 finished with value: 0.07900778045234381 and parameters: {'model_type': 'mlp', 'hidden_dims': '[512, 256]', 'dropout': 0.12017719357801188, 'batch_norm': True, 'lr': 0.00041654732137641487, 'weight_decay': 2.590268043173453e-05, 'epochs': 214, 'loss': 'mae', 'optimizer': 'adam', 'graph_mode': 'off', 'use_snp_selection': False}. Best is trial 73 with value: 0.12343974487497228.
[I 2025-12-05 16:01:15,668] Trial 144 finished with value: 0.09327301226502992 and parameters: {'model_type': 'mlp', 'hidden_dims': '[512, 256]', 'dropout': 0.1595766569418483, 'batch_norm': True, 'lr': 0.0007567683548732368, 'weight_decay': 8.790331014762508e-06, 'epochs': 151, 'loss': 'mae', 'optimizer': 'adam', 'graph_mode': 'off', 'use_snp_selection': False}. Best is trial 73 with value: 0.12343974487497228.
[I 2025-12-05 16:01:17,078] Trial 145 finished with value: 0.09368529213941319 and parameters: {'model_type': 'mlp', 'hidden_dims': '[512, 256]', 'dropout': 0.11507069127731859, 'batch_norm': True, 'lr': 0.00031337196580147965, 'weight_decay': 4.5744603704705116e-06, 'epochs': 162, 'loss': 'mae', 'optimizer': 'adam', 'graph_mode': 'off', 'use_snp_selection': False}. Best is trial 73 with value: 0.12343974487497228.
[I 2025-12-05 16:01:18,632] Trial 146 finished with value: 0.0952371099179025 and parameters: {'model_type': 'mlp', 'hidden_dims': '[512, 256]', 'dropout': 0.14249552913974084, 'batch_norm': True, 'lr': 0.0001374593617797613, 'weight_decay': 5.446746446775773e-06, 'epochs': 197, 'loss': 'mae', 'optimizer': 'adam', 'graph_mode': 'off', 'use_snp_selection': False}. Best is trial 73 with value: 0.12343974487497228.
[I 2025-12-05 16:01:19,688] Trial 147 finished with value: 0.09986969668225835 and parameters: {'model_type': 'mlp', 'hidden_dims': '[128, 64]', 'dropout': 0.10078574171333143, 'batch_norm': True, 'lr': 0.00021994137840493223, 'weight_decay': 0.0001255419119553579, 'epochs': 299, 'loss': 'mae', 'optimizer': 'adam', 'graph_mode': 'off', 'use_snp_selection': False}. Best is trial 73 with value: 0.12343974487497228.
[I 2025-12-05 16:01:21,977] Trial 148 finished with value: 0.07519774501829132 and parameters: {'model_type': 'mlp', 'hidden_dims': '[512, 128]', 'dropout': 0.12379484301562493, 'batch_norm': True, 'lr': 0.0009784953454152446, 'weight_decay': 1.6195102210623157e-05, 'epochs': 311, 'loss': 'mae', 'optimizer': 'adam', 'graph_mode': 'off', 'use_snp_selection': True, 'num_snps': 34565}. Best is trial 73 with value: 0.12343974487497228.
[I 2025-12-05 16:01:23,007] Trial 149 finished with value: 0.09046422741376722 and parameters: {'model_type': 'mlp', 'hidden_dims': '[256, 128]', 'dropout': 0.16709724364691417, 'batch_norm': True, 'lr': 0.00016310318992627897, 'weight_decay': 0.0004553440774963726, 'epochs': 173, 'loss': 'mae', 'optimizer': 'adam', 'graph_mode': 'off', 'use_snp_selection': False}. Best is trial 73 with value: 0.12343974487497228.
[I 2025-12-05 16:01:25,508] Trial 0 finished with value: 0.026568424375645626 and parameters: {'model_type': 'mlp', 'hidden_dims': '[128, 64]', 'dropout': 0.199031432379812, 'batch_norm': True, 'lr': 1.8408544111075837e-06, 'weight_decay': 5.5136510071208614e-05, 'epochs': 336, 'loss': 'mae', 'optimizer': 'adam', 'graph_mode': 'off', 'use_snp_selection': True, 'num_snps': 43862}. Best is trial 0 with value: 0.026568424375645626.
[I 2025-12-05 16:01:26,960] Trial 1 finished with value: 0.07962296987352413 and parameters: {'model_type': 'mlp', 'hidden_dims': '[256, 128]', 'dropout': 0.4370668075331726, 'batch_norm': True, 'lr': 7.133471581159139e-05, 'weight_decay': 1.128633586803549e-05, 'epochs': 242, 'loss': 'mae', 'optimizer': 'adam', 'graph_mode': 'off', 'use_snp_selection': False}. Best is trial 1 with value: 0.07962296987352413.
[I 2025-12-05 16:01:28,257] Trial 2 finished with value: 0.034468852449286796 and parameters: {'model_type': 'mlp', 'hidden_dims': '[256, 128, 64]', 'dropout': 0.41314357415569625, 'batch_norm': False, 'lr': 3.952233718592101e-06, 'weight_decay': 0.00026754769258252603, 'epochs': 149, 'loss': 'mse', 'optimizer': 'adam', 'graph_mode': 'off', 'use_snp_selection': True, 'num_snps': 11571}. Best is trial 1 with value: 0.07962296987352413.
[I 2025-12-05 16:01:31,360] Trial 3 finished with value: 0.03927732036606556 and parameters: {'model_type': 'mlp', 'hidden_dims': '[512, 64]', 'dropout': 0.5938127374509361, 'batch_norm': False, 'lr': 5.67704586114731e-06, 'weight_decay': 2.4518087630137052e-05, 'epochs': 320, 'loss': 'mae', 'optimizer': 'adam', 'graph_mode': 'off', 'use_snp_selection': False}. Best is trial 1 with value: 0.07962296987352413.
[I 2025-12-05 16:01:34,569] Trial 4 finished with value: -0.001229214791890754 and parameters: {'model_type': 'mlp', 'hidden_dims': '[512, 128]', 'dropout': 0.25746343592134413, 'batch_norm': True, 'lr': 1.3467657668402788e-06, 'weight_decay': 0.00033087251918647806, 'epochs': 277, 'loss': 'mse', 'optimizer': 'adam', 'graph_mode': 'off', 'use_snp_selection': True, 'num_snps': 36675}. Best is trial 1 with value: 0.07962296987352413.
[I 2025-12-05 16:01:36,895] Trial 5 finished with value: 0.0012860305092194132 and parameters: {'model_type': 'mlp', 'hidden_dims': '[512, 64]', 'dropout': 0.38275350994408375, 'batch_norm': True, 'lr': 1.5586664309232824e-06, 'weight_decay': 0.0008227664668621182, 'epochs': 145, 'loss': 'mae', 'optimizer': 'adam', 'graph_mode': 'off', 'use_snp_selection': True, 'num_snps': 32148}. Best is trial 1 with value: 0.07962296987352413.
