[I 2025-12-06 03:43:34,206] Trial 26 finished with value: 0.17942089888440899 and parameters: {'model_type': 'mlp', 'hidden_dims': '[512, 64]', 'dropout': 0.10150847394378269, 'batch_norm': False, 'lr': 1.8028190744312385e-05, 'weight_decay': 0.0009995078357804478, 'epochs': 79, 'loss': 'mse', 'optimizer': 'adam', 'graph_mode': 'off', 'use_snp_selection': True, 'num_snps': 3842}. Best is trial 21 with value: 0.20868984701698076.
[I 2025-12-06 03:44:13,688] Trial 27 finished with value: 0.18475222780159217 and parameters: {'model_type': 'mlp', 'hidden_dims': '[512, 64]', 'dropout': 0.16172093695684947, 'batch_norm': False, 'lr': 2.815141056237779e-06, 'weight_decay': 0.00012968826809083535, 'epochs': 123, 'loss': 'mae', 'optimizer': 'adam', 'graph_mode': 'off', 'use_snp_selection': False}. Best is trial 21 with value: 0.20868984701698076.
[I 2025-12-06 03:45:04,141] Trial 28 finished with value: 0.2034939184734231 and parameters: {'model_type': 'mlp', 'hidden_dims': '[512, 64]', 'dropout': 0.5446517125861267, 'batch_norm': False, 'lr': 2.8489680113377872e-05, 'weight_decay': 9.301094221614199e-06, 'epochs': 167, 'loss': 'mae', 'optimizer': 'adam', 'graph_mode': 'off', 'use_snp_selection': False}. Best is trial 21 with value: 0.20868984701698076.
[I 2025-12-06 03:45:42,012] Trial 29 finished with value: 0.15326974268378343 and parameters: {'model_type': 'mlp', 'hidden_dims': '[128, 64]', 'dropout': 0.5269309545167287, 'batch_norm': False, 'lr': 2.320440320155318e-06, 'weight_decay': 1.0468434370500147e-05, 'epochs': 179, 'loss': 'mae', 'optimizer': 'adam', 'graph_mode': 'off', 'use_snp_selection': True, 'num_snps': 19468}. Best is trial 21 with value: 0.20868984701698076.
[I 2025-12-06 03:46:10,009] Trial 30 finished with value: 0.19004379380467865 and parameters: {'model_type': 'mlp', 'hidden_dims': '[256, 128]', 'dropout': 0.5507223444358839, 'batch_norm': False, 'lr': 3.562676382244939e-05, 'weight_decay': 2.927690646553373e-06, 'epochs': 167, 'loss': 'mae', 'optimizer': 'adam', 'graph_mode': 'off', 'use_snp_selection': False}. Best is trial 21 with value: 0.20868984701698076.
[I 2025-12-06 03:46:48,723] Trial 31 finished with value: 0.19361403514135098 and parameters: {'model_type': 'mlp', 'hidden_dims': '[512, 64]', 'dropout': 0.532567851638772, 'batch_norm': False, 'lr': 1.4091076752885697e-05, 'weight_decay': 4.2311444916833046e-05, 'epochs': 121, 'loss': 'mae', 'optimizer': 'adam', 'graph_mode': 'off', 'use_snp_selection': False}. Best is trial 21 with value: 0.20868984701698076.
[I 2025-12-06 03:47:14,125] Trial 32 finished with value: 0.20474085415488688 and parameters: {'model_type': 'mlp', 'hidden_dims': '[512, 64]', 'dropout': 0.4588404724195714, 'batch_norm': False, 'lr': 3.158769718207268e-05, 'weight_decay': 1.7901977859488177e-05, 'epochs': 70, 'loss': 'mae', 'optimizer': 'adam', 'graph_mode': 'off', 'use_snp_selection': False}. Best is trial 21 with value: 0.20868984701698076.
[I 2025-12-06 03:47:40,796] Trial 33 finished with value: 0.19065782673065435 and parameters: {'model_type': 'mlp', 'hidden_dims': '[256, 128, 64]', 'dropout': 0.4773193280697157, 'batch_norm': False, 'lr': 3.3757640091301966e-05, 'weight_decay': 1.8272048927162713e-05, 'epochs': 154, 'loss': 'mae', 'optimizer': 'adam', 'graph_mode': 'off', 'use_snp_selection': False}. Best is trial 21 with value: 0.20868984701698076.
[I 2025-12-06 03:47:59,205] Trial 34 finished with value: 0.19360181598885864 and parameters: {'model_type': 'mlp', 'hidden_dims': '[512, 64]', 'dropout': 0.45090515181171253, 'batch_norm': True, 'lr': 9.497494417646125e-05, 'weight_decay': 5.605230551266117e-06, 'epochs': 42, 'loss': 'mae', 'optimizer': 'adam', 'graph_mode': 'off', 'use_snp_selection': False}. Best is trial 21 with value: 0.20868984701698076.
[I 2025-12-06 03:48:50,056] Trial 35 finished with value: 0.1482975496810694 and parameters: {'model_type': 'mlp', 'hidden_dims': '[128, 64]', 'dropout': 0.5586086601265008, 'batch_norm': False, 'lr': 6.161614267310432e-06, 'weight_decay': 1.0102399954911543e-05, 'epochs': 71, 'loss': 'mse', 'optimizer': 'adam', 'graph_mode': 'off', 'use_snp_selection': True, 'num_snps': 57586}. Best is trial 21 with value: 0.20868984701698076.
[I 2025-12-06 03:49:14,451] Trial 36 finished with value: 0.19950857997407695 and parameters: {'model_type': 'mlp', 'hidden_dims': '[256, 128]', 'dropout': 0.4426926228796941, 'batch_norm': False, 'lr': 2.674812445612258e-05, 'weight_decay': 3.168214111634553e-05, 'epochs': 139, 'loss': 'mae', 'optimizer': 'adam', 'graph_mode': 'off', 'use_snp_selection': False}. Best is trial 21 with value: 0.20868984701698076.
[I 2025-12-06 03:50:08,866] Trial 37 finished with value: 0.12327915775873295 and parameters: {'model_type': 'mlp', 'hidden_dims': '[512, 64]', 'dropout': 0.38011871341137915, 'batch_norm': True, 'lr': 1.1152546142192734e-06, 'weight_decay': 0.00032223976477668473, 'epochs': 211, 'loss': 'mse', 'optimizer': 'adam', 'graph_mode': 'off', 'use_snp_selection': True, 'num_snps': 22282}. Best is trial 21 with value: 0.20868984701698076.
[I 2025-12-06 03:51:23,007] Trial 38 finished with value: 0.1912372903607716 and parameters: {'model_type': 'mlp', 'hidden_dims': '[512, 64]', 'dropout': 0.5987504632979572, 'batch_norm': False, 'lr': 4.225742179310148e-05, 'weight_decay': 1.5649719968478883e-05, 'epochs': 260, 'loss': 'mae', 'optimizer': 'adam', 'graph_mode': 'off', 'use_snp_selection': False}. Best is trial 21 with value: 0.20868984701698076.
[I 2025-12-06 03:51:39,044] Trial 39 finished with value: 0.19886680646954866 and parameters: {'model_type': 'mlp', 'hidden_dims': '[256, 128, 64]', 'dropout': 0.40491549826838436, 'batch_norm': True, 'lr': 8.03303445522819e-05, 'weight_decay': 1.3519633775674466e-06, 'epochs': 72, 'loss': 'mae', 'optimizer': 'adam', 'graph_mode': 'off', 'use_snp_selection': False}. Best is trial 21 with value: 0.20868984701698076.
[I 2025-12-06 03:52:36,042] Trial 40 finished with value: 0.18923141368266172 and parameters: {'model_type': 'mlp', 'hidden_dims': '[512, 64]', 'dropout': 0.5656137028387085, 'batch_norm': False, 'lr': 4.767147905519569e-06, 'weight_decay': 7.3098194687550526e-06, 'epochs': 188, 'loss': 'mse', 'optimizer': 'adam', 'graph_mode': 'off', 'use_snp_selection': False}. Best is trial 21 with value: 0.20868984701698076.
[I 2025-12-06 03:53:02,442] Trial 41 finished with value: 0.19418192586497032 and parameters: {'model_type': 'mlp', 'hidden_dims': '[256, 128]', 'dropout': 0.4419959533428821, 'batch_norm': False, 'lr': 2.3013630742962534e-05, 'weight_decay': 4.603821669359581e-05, 'epochs': 151, 'loss': 'mae', 'optimizer': 'adam', 'graph_mode': 'off', 'use_snp_selection': False}. Best is trial 21 with value: 0.20868984701698076.
[I 2025-12-06 03:53:26,278] Trial 42 finished with value: 0.19587368749601788 and parameters: {'model_type': 'mlp', 'hidden_dims': '[256, 128]', 'dropout': 0.3657950741412654, 'batch_norm': False, 'lr': 2.6480425921912784e-05, 'weight_decay': 2.9149463505906414e-05, 'epochs': 132, 'loss': 'mae', 'optimizer': 'adam', 'graph_mode': 'off', 'use_snp_selection': False}. Best is trial 21 with value: 0.20868984701698076.
[I 2025-12-06 03:53:46,899] Trial 43 finished with value: 0.1971570322862228 and parameters: {'model_type': 'mlp', 'hidden_dims': '[256, 128]', 'dropout': 0.4545405779016945, 'batch_norm': False, 'lr': 5.2844727729105246e-05, 'weight_decay': 3.752209114789542e-06, 'epochs': 109, 'loss': 'mae', 'optimizer': 'adam', 'graph_mode': 'off', 'use_snp_selection': False}. Best is trial 21 with value: 0.20868984701698076.
[I 2025-12-06 03:54:15,253] Trial 44 finished with value: 0.1953471584251351 and parameters: {'model_type': 'mlp', 'hidden_dims': '[256, 128]', 'dropout': 0.4220057949539673, 'batch_norm': False, 'lr': 8.390844261679584e-06, 'weight_decay': 1.3455621507266727e-05, 'epochs': 164, 'loss': 'mae', 'optimizer': 'adam', 'graph_mode': 'off', 'use_snp_selection': False}. Best is trial 21 with value: 0.20868984701698076.
[I 2025-12-06 03:54:58,160] Trial 45 finished with value: 0.19439998814633827 and parameters: {'model_type': 'mlp', 'hidden_dims': '[512, 128]', 'dropout': 0.5314396842072647, 'batch_norm': True, 'lr': 1.659186233839795e-05, 'weight_decay': 8.94896621829094e-05, 'epochs': 133, 'loss': 'mae', 'optimizer': 'adam', 'graph_mode': 'off', 'use_snp_selection': False}. Best is trial 21 with value: 0.20868984701698076.
[I 2025-12-06 03:55:15,581] Trial 46 finished with value: 0.1883721463468459 and parameters: {'model_type': 'mlp', 'hidden_dims': '[256, 128]', 'dropout': 0.5108365103579541, 'batch_norm': False, 'lr': 3.98304878688835e-05, 'weight_decay': 1.8251456383398756e-06, 'epochs': 85, 'loss': 'mae', 'optimizer': 'adam', 'graph_mode': 'off', 'use_snp_selection': False}. Best is trial 21 with value: 0.20868984701698076.
[I 2025-12-06 03:55:51,839] Trial 47 finished with value: 0.19589030122211656 and parameters: {'model_type': 'mlp', 'hidden_dims': '[512, 64]', 'dropout': 0.46928707398499225, 'batch_norm': False, 'lr': 1.0527047281416142e-05, 'weight_decay': 3.012228883779138e-05, 'epochs': 110, 'loss': 'mae', 'optimizer': 'adam', 'graph_mode': 'off', 'use_snp_selection': False}. Best is trial 21 with value: 0.20868984701698076.
[I 2025-12-06 03:56:15,818] Trial 48 finished with value: 0.1913947803946722 and parameters: {'model_type': 'mlp', 'hidden_dims': '[512, 64]', 'dropout': 0.42895869637630196, 'batch_norm': False, 'lr': 3.0902282041957704e-05, 'weight_decay': 1.952336463717902e-05, 'epochs': 64, 'loss': 'mse', 'optimizer': 'adam', 'graph_mode': 'off', 'use_snp_selection': False}. Best is trial 21 with value: 0.20868984701698076.
[I 2025-12-06 03:57:06,306] Trial 49 finished with value: 0.19651277524973265 and parameters: {'model_type': 'mlp', 'hidden_dims': '[128, 64]', 'dropout': 0.575007262142175, 'batch_norm': False, 'lr': 6.915680755170015e-05, 'weight_decay': 0.0005066159281116349, 'epochs': 142, 'loss': 'mae', 'optimizer': 'adam', 'graph_mode': 'off', 'use_snp_selection': True, 'num_snps': 46888}. Best is trial 21 with value: 0.20868984701698076.
[I 2025-12-06 03:58:41,301] Trial 50 finished with value: 0.19481142003762014 and parameters: {'model_type': 'mlp', 'hidden_dims': '[512, 128]', 'dropout': 0.3484440341413383, 'batch_norm': True, 'lr': 1.6300979442380827e-05, 'weight_decay': 0.00023442912137023613, 'epochs': 330, 'loss': 'mae', 'optimizer': 'adam', 'graph_mode': 'off', 'use_snp_selection': False}. Best is trial 21 with value: 0.20868984701698076.
[I 2025-12-06 03:58:53,202] Trial 51 finished with value: 0.18780755417984404 and parameters: {'model_type': 'mlp', 'hidden_dims': '[256, 128, 64]', 'dropout': 0.40059052777775805, 'batch_norm': True, 'lr': 9.019541831423365e-05, 'weight_decay': 6.522106092547311e-07, 'epochs': 41, 'loss': 'mae', 'optimizer': 'adam', 'graph_mode': 'off', 'use_snp_selection': False}. Best is trial 21 with value: 0.20868984701698076.
[I 2025-12-06 03:59:09,636] Trial 52 finished with value: 0.17430588402238384 and parameters: {'model_type': 'mlp', 'hidden_dims': '[256, 128, 64]', 'dropout': 0.40416666211751995, 'batch_norm': True, 'lr': 8.832551382828072e-05, 'weight_decay': 1.8334554196123076e-07, 'epochs': 74, 'loss': 'mae', 'optimizer': 'adam', 'graph_mode': 'off', 'use_snp_selection': False}. Best is trial 21 with value: 0.20868984701698076.
[I 2025-12-06 03:59:23,893] Trial 53 finished with value: 0.18639485337393308 and parameters: {'model_type': 'mlp', 'hidden_dims': '[256, 128, 64]', 'dropout': 0.5128128040535422, 'batch_norm': True, 'lr': 5.4797191203410266e-05, 'weight_decay': 1.0783127568448148e-06, 'epochs': 58, 'loss': 'mae', 'optimizer': 'adam', 'graph_mode': 'off', 'use_snp_selection': False}. Best is trial 21 with value: 0.20868984701698076.
[I 2025-12-06 03:59:45,875] Trial 54 finished with value: 0.17740150084165504 and parameters: {'model_type': 'mlp', 'hidden_dims': '[256, 128, 64]', 'dropout': 0.37100189499504144, 'batch_norm': True, 'lr': 0.00013456935096407504, 'weight_decay': 1.640665184193088e-06, 'epochs': 115, 'loss': 'mae', 'optimizer': 'adam', 'graph_mode': 'off', 'use_snp_selection': False}. Best is trial 21 with value: 0.20868984701698076.
[I 2025-12-06 04:00:03,691] Trial 55 finished with value: 0.19447440190065052 and parameters: {'model_type': 'mlp', 'hidden_dims': '[256, 128, 64]', 'dropout': 0.46958538834003616, 'batch_norm': True, 'lr': 0.00023542354484559237, 'weight_decay': 8.348680740838101e-06, 'epochs': 84, 'loss': 'mae', 'optimizer': 'adam', 'graph_mode': 'off', 'use_snp_selection': False}. Best is trial 21 with value: 0.20868984701698076.
[I 2025-12-06 04:01:00,984] Trial 56 finished with value: 0.18947233399225866 and parameters: {'model_type': 'mlp', 'hidden_dims': '[512, 64]', 'dropout': 0.2873880072001833, 'batch_norm': False, 'lr': 2.9309384404404826e-05, 'weight_decay': 6.342285025130212e-05, 'epochs': 192, 'loss': 'mae', 'optimizer': 'adam', 'graph_mode': 'off', 'use_snp_selection': False}. Best is trial 21 with value: 0.20868984701698076.
[I 2025-12-06 04:02:40,758] Trial 57 finished with value: 0.18887211147222496 and parameters: {'model_type': 'mlp', 'hidden_dims': '[512, 256]', 'dropout': 0.13094382569768725, 'batch_norm': False, 'lr': 2.0837408366645665e-05, 'weight_decay': 2.5419931066902835e-05, 'epochs': 349, 'loss': 'mae', 'optimizer': 'adam', 'graph_mode': 'off', 'use_snp_selection': False}. Best is trial 21 with value: 0.20868984701698076.
[I 2025-12-06 04:03:15,524] Trial 58 finished with value: 0.19413501569444855 and parameters: {'model_type': 'mlp', 'hidden_dims': '[512, 64]', 'dropout': 0.5903621552480256, 'batch_norm': False, 'lr': 4.713263094603128e-05, 'weight_decay': 3.014906709301067e-07, 'epochs': 105, 'loss': 'mae', 'optimizer': 'adam', 'graph_mode': 'off', 'use_snp_selection': False}. Best is trial 21 with value: 0.20868984701698076.
[I 2025-12-06 04:04:02,732] Trial 59 finished with value: 0.17642043488170528 and parameters: {'model_type': 'mlp', 'hidden_dims': '[256, 128]', 'dropout': 0.3500875991489233, 'batch_norm': True, 'lr': 8.065600581824873e-06, 'weight_decay': 8.241042154146495e-05, 'epochs': 299, 'loss': 'mae', 'optimizer': 'adam', 'graph_mode': 'off', 'use_snp_selection': False}. Best is trial 21 with value: 0.20868984701698076.
[I 2025-12-06 04:04:34,051] Trial 60 finished with value: 0.1650567384857852 and parameters: {'model_type': 'mlp', 'hidden_dims': '[512, 64]', 'dropout': 0.488605155337631, 'batch_norm': False, 'lr': 4.249705071166233e-06, 'weight_decay': 4.129771571754082e-06, 'epochs': 208, 'loss': 'mse', 'optimizer': 'adam', 'graph_mode': 'off', 'use_snp_selection': True, 'num_snps': 2400}. Best is trial 21 with value: 0.20868984701698076.
[I 2025-12-06 04:05:07,891] Trial 61 finished with value: 0.1972299722667133 and parameters: {'model_type': 'mlp', 'hidden_dims': '[512, 64]', 'dropout': 0.20252241882863212, 'batch_norm': False, 'lr': 1.2253080539045049e-05, 'weight_decay': 0.00011627040826122548, 'epochs': 101, 'loss': 'mae', 'optimizer': 'adam', 'graph_mode': 'off', 'use_snp_selection': False}. Best is trial 21 with value: 0.20868984701698076.
[I 2025-12-06 04:05:39,952] Trial 62 finished with value: 0.20580991168373203 and parameters: {'model_type': 'mlp', 'hidden_dims': '[512, 64]', 'dropout': 0.18315877069413206, 'batch_norm': False, 'lr': 1.4128526915256277e-05, 'weight_decay': 5.302872851322011e-05, 'epochs': 94, 'loss': 'mae', 'optimizer': 'adam', 'graph_mode': 'off', 'use_snp_selection': False}. Best is trial 21 with value: 0.20868984701698076.
[I 2025-12-06 04:06:04,621] Trial 63 finished with value: 0.19222539875434444 and parameters: {'model_type': 'mlp', 'hidden_dims': '[512, 64]', 'dropout': 0.22835040162415002, 'batch_norm': False, 'lr': 1.999877914666629e-05, 'weight_decay': 5.1450892974531474e-05, 'epochs': 66, 'loss': 'mae', 'optimizer': 'adam', 'graph_mode': 'off', 'use_snp_selection': False}. Best is trial 21 with value: 0.20868984701698076.
[I 2025-12-06 04:06:25,176] Trial 64 finished with value: 0.18006110472122655 and parameters: {'model_type': 'mlp', 'hidden_dims': '[512, 64]', 'dropout': 0.1212493570306938, 'batch_norm': False, 'lr': 1.4578219895202194e-05, 'weight_decay': 2.2364500515887123e-05, 'epochs': 50, 'loss': 'mae', 'optimizer': 'adam', 'graph_mode': 'off', 'use_snp_selection': False}. Best is trial 21 with value: 0.20868984701698076.
[I 2025-12-06 04:07:08,517] Trial 65 finished with value: 0.19849398209092112 and parameters: {'model_type': 'mlp', 'hidden_dims': '[512, 64]', 'dropout': 0.25463026316717907, 'batch_norm': False, 'lr': 2.6624015349222372e-05, 'weight_decay': 3.5744782276045924e-05, 'epochs': 138, 'loss': 'mae', 'optimizer': 'adam', 'graph_mode': 'off', 'use_snp_selection': False}. Best is trial 21 with value: 0.20868984701698076.
[I 2025-12-06 04:07:38,197] Trial 66 finished with value: 0.19657004275801382 and parameters: {'model_type': 'mlp', 'hidden_dims': '[512, 128]', 'dropout': 0.41077045833094544, 'batch_norm': False, 'lr': 1.0017243197161317e-05, 'weight_decay': 5.985592815809421e-05, 'epochs': 84, 'loss': 'mae', 'optimizer': 'adam', 'graph_mode': 'off', 'use_snp_selection': False}. Best is trial 21 with value: 0.20868984701698076.
[I 2025-12-06 04:08:09,326] Trial 67 finished with value: 0.19622016009659166 and parameters: {'model_type': 'mlp', 'hidden_dims': '[512, 64]', 'dropout': 0.16168726810606912, 'batch_norm': False, 'lr': 3.638169789810682e-05, 'weight_decay': 1.3953494931560379e-05, 'epochs': 91, 'loss': 'mae', 'optimizer': 'adam', 'graph_mode': 'off', 'use_snp_selection': False}. Best is trial 21 with value: 0.20868984701698076.
[I 2025-12-06 04:08:36,406] Trial 68 finished with value: 0.1609621048698636 and parameters: {'model_type': 'mlp', 'hidden_dims': '[256, 128, 64]', 'dropout': 0.436760227950176, 'batch_norm': False, 'lr': 0.0005511280769585186, 'weight_decay': 3.526085187138544e-05, 'epochs': 158, 'loss': 'mae', 'optimizer': 'adam', 'graph_mode': 'off', 'use_snp_selection': False}. Best is trial 21 with value: 0.20868984701698076.
[I 2025-12-06 04:09:15,678] Trial 69 finished with value: 0.1810438674363829 and parameters: {'model_type': 'mlp', 'hidden_dims': '[512, 256]', 'dropout': 0.5473854495832089, 'batch_norm': False, 'lr': 3.1530137634170796e-06, 'weight_decay': 9.150736364123311e-05, 'epochs': 120, 'loss': 'mae', 'optimizer': 'adam', 'graph_mode': 'off', 'use_snp_selection': False}. Best is trial 21 with value: 0.20868984701698076.
[I 2025-12-06 04:09:37,360] Trial 70 finished with value: 0.17828498114480432 and parameters: {'model_type': 'mlp', 'hidden_dims': '[128, 64]', 'dropout': 0.18072570848801525, 'batch_norm': False, 'lr': 1.7586503128468133e-06, 'weight_decay': 0.00017163065367819388, 'epochs': 226, 'loss': 'mae', 'optimizer': 'adam', 'graph_mode': 'off', 'use_snp_selection': False}. Best is trial 21 with value: 0.20868984701698076.
[I 2025-12-06 04:10:31,002] Trial 71 finished with value: 0.18897822107047407 and parameters: {'model_type': 'mlp', 'hidden_dims': '[512, 64]', 'dropout': 0.25047760448647305, 'batch_norm': False, 'lr': 2.5888839298619885e-05, 'weight_decay': 4.383229990892227e-05, 'epochs': 177, 'loss': 'mae', 'optimizer': 'adam', 'graph_mode': 'off', 'use_snp_selection': False}. Best is trial 21 with value: 0.20868984701698076.
[I 2025-12-06 04:11:15,502] Trial 72 finished with value: 0.18392712713749992 and parameters: {'model_type': 'mlp', 'hidden_dims': '[512, 64]', 'dropout': 0.2120397463440944, 'batch_norm': False, 'lr': 1.799098488276822e-05, 'weight_decay': 2.3439332325299444e-05, 'epochs': 141, 'loss': 'mae', 'optimizer': 'adam', 'graph_mode': 'off', 'use_snp_selection': False}. Best is trial 21 with value: 0.20868984701698076.
[I 2025-12-06 04:11:47,058] Trial 73 finished with value: 0.20180193821325076 and parameters: {'model_type': 'mlp', 'hidden_dims': '[512, 64]', 'dropout': 0.25098795026971604, 'batch_norm': False, 'lr': 2.5909308966566397e-05, 'weight_decay': 8.020294630512827e-06, 'epochs': 92, 'loss': 'mae', 'optimizer': 'adam', 'graph_mode': 'off', 'use_snp_selection': False}. Best is trial 21 with value: 0.20868984701698076.
[I 2025-12-06 04:12:19,442] Trial 74 finished with value: 0.18430575157647353 and parameters: {'model_type': 'mlp', 'hidden_dims': '[512, 64]', 'dropout': 0.23294965309649565, 'batch_norm': False, 'lr': 6.375239309985819e-05, 'weight_decay': 7.552029004684164e-06, 'epochs': 96, 'loss': 'mae', 'optimizer': 'adam', 'graph_mode': 'off', 'use_snp_selection': False}. Best is trial 21 with value: 0.20868984701698076.
[I 2025-12-06 04:12:45,144] Trial 75 finished with value: 0.20090340878040402 and parameters: {'model_type': 'mlp', 'hidden_dims': '[512, 64]', 'dropout': 0.2872199039106829, 'batch_norm': False, 'lr': 4.078782071533103e-05, 'weight_decay': 1.2338973595703868e-05, 'epochs': 70, 'loss': 'mae', 'optimizer': 'adam', 'graph_mode': 'off', 'use_snp_selection': False}. Best is trial 21 with value: 0.20868984701698076.
[I 2025-12-06 04:13:26,912] Trial 76 finished with value: 0.21110188042063088 and parameters: {'model_type': 'mlp', 'hidden_dims': '[512, 64]', 'dropout': 0.2780123825650996, 'batch_norm': False, 'lr': 4.4134414168990764e-05, 'weight_decay': 1.1881360769346951e-05, 'epochs': 50, 'loss': 'mae', 'optimizer': 'adam', 'graph_mode': 'off', 'use_snp_selection': True, 'num_snps': 24547}. Best is trial 76 with value: 0.21110188042063088.
[I 2025-12-06 04:14:07,109] Trial 77 finished with value: 0.20389211807764474 and parameters: {'model_type': 'mlp', 'hidden_dims': '[512, 64]', 'dropout': 0.2874029459959938, 'batch_norm': False, 'lr': 4.43820395447127e-05, 'weight_decay': 1.1627966890729098e-05, 'epochs': 51, 'loss': 'mae', 'optimizer': 'adam', 'graph_mode': 'off', 'use_snp_selection': True, 'num_snps': 21418}. Best is trial 76 with value: 0.21110188042063088.
