[I 2025-12-05 20:46:20,996] Trial 109 finished with value: 0.3057041556263743 and parameters: {'model_type': 'mlp', 'hidden_dims': '[512, 64]', 'dropout': 0.4477557871489437, 'batch_norm': False, 'lr': 2.862788775496117e-06, 'weight_decay': 2.7923794380523694e-06, 'epochs': 260, 'loss': 'mse', 'optimizer': 'adam', 'graph_mode': 'off', 'use_snp_selection': False}. Best is trial 105 with value: 0.30751839937923303.
[I 2025-12-05 20:47:11,798] Trial 110 finished with value: 0.3034550138983353 and parameters: {'model_type': 'mlp', 'hidden_dims': '[512, 64]', 'dropout': 0.40452770304926583, 'batch_norm': False, 'lr': 2.8541544508387776e-06, 'weight_decay': 8.793748434838765e-06, 'epochs': 262, 'loss': 'mse', 'optimizer': 'adam', 'graph_mode': 'off', 'use_snp_selection': False}. Best is trial 105 with value: 0.30751839937923303.
[I 2025-12-05 20:48:01,237] Trial 111 finished with value: 0.3022607789279575 and parameters: {'model_type': 'mlp', 'hidden_dims': '[512, 64]', 'dropout': 0.47150137651885105, 'batch_norm': False, 'lr': 2.099373632087106e-06, 'weight_decay': 3.8014323296146838e-06, 'epochs': 254, 'loss': 'mse', 'optimizer': 'adam', 'graph_mode': 'off', 'use_snp_selection': False}. Best is trial 105 with value: 0.30751839937923303.
[I 2025-12-05 20:48:56,900] Trial 112 finished with value: 0.300889683246266 and parameters: {'model_type': 'mlp', 'hidden_dims': '[512, 64]', 'dropout': 0.5025020741947762, 'batch_norm': False, 'lr': 5.562534515852127e-06, 'weight_decay': 2.797973565398452e-06, 'epochs': 290, 'loss': 'mse', 'optimizer': 'adam', 'graph_mode': 'off', 'use_snp_selection': False}. Best is trial 105 with value: 0.30751839937923303.
[I 2025-12-05 20:49:47,025] Trial 113 finished with value: 0.3042123215617204 and parameters: {'model_type': 'mlp', 'hidden_dims': '[512, 64]', 'dropout': 0.45379086453780165, 'batch_norm': False, 'lr': 4.6291075907572535e-06, 'weight_decay': 6.362840781708651e-06, 'epochs': 258, 'loss': 'mse', 'optimizer': 'adam', 'graph_mode': 'off', 'use_snp_selection': False}. Best is trial 105 with value: 0.30751839937923303.
[I 2025-12-05 20:50:39,614] Trial 114 finished with value: 0.3006898455368452 and parameters: {'model_type': 'mlp', 'hidden_dims': '[512, 64]', 'dropout': 0.4456050329970544, 'batch_norm': False, 'lr': 3.411712520941267e-06, 'weight_decay': 5.512664258841196e-06, 'epochs': 272, 'loss': 'mse', 'optimizer': 'adam', 'graph_mode': 'off', 'use_snp_selection': False}. Best is trial 105 with value: 0.30751839937923303.
[I 2025-12-05 20:51:23,812] Trial 115 finished with value: 0.2919848371028733 and parameters: {'model_type': 'mlp', 'hidden_dims': '[512, 64]', 'dropout': 0.4293350260511487, 'batch_norm': False, 'lr': 1.2688980772692016e-06, 'weight_decay': 1.6203524434792264e-06, 'epochs': 224, 'loss': 'mse', 'optimizer': 'adam', 'graph_mode': 'off', 'use_snp_selection': False}. Best is trial 105 with value: 0.30751839937923303.
[I 2025-12-05 20:52:11,024] Trial 116 finished with value: 0.294766065336119 and parameters: {'model_type': 'mlp', 'hidden_dims': '[512, 64]', 'dropout': 0.4874955311504865, 'batch_norm': False, 'lr': 2.713995145315409e-06, 'weight_decay': 1.5355730631947658e-05, 'epochs': 251, 'loss': 'mse', 'optimizer': 'adam', 'graph_mode': 'off', 'use_snp_selection': True, 'num_snps': 27031}. Best is trial 105 with value: 0.30751839937923303.
[I 2025-12-05 20:52:56,053] Trial 117 finished with value: 0.30032987809915335 and parameters: {'model_type': 'mlp', 'hidden_dims': '[512, 64]', 'dropout': 0.4733747396430204, 'batch_norm': False, 'lr': 6.4208073732001615e-06, 'weight_decay': 2.5380672464197305e-06, 'epochs': 230, 'loss': 'mse', 'optimizer': 'adam', 'graph_mode': 'off', 'use_snp_selection': False}. Best is trial 105 with value: 0.30751839937923303.
[I 2025-12-05 20:53:44,152] Trial 118 finished with value: 0.29987310222527325 and parameters: {'model_type': 'mlp', 'hidden_dims': '[512, 64]', 'dropout': 0.27399720621941814, 'batch_norm': False, 'lr': 3.805844265855428e-06, 'weight_decay': 3.756513354701374e-06, 'epochs': 246, 'loss': 'mae', 'optimizer': 'adam', 'graph_mode': 'off', 'use_snp_selection': False}. Best is trial 105 with value: 0.30751839937923303.
[I 2025-12-05 20:54:14,686] Trial 119 finished with value: 0.30348965223347546 and parameters: {'model_type': 'mlp', 'hidden_dims': '[256, 128]', 'dropout': 0.5037856665506909, 'batch_norm': False, 'lr': 2.2984321604409222e-06, 'weight_decay': 1.0379209305631428e-06, 'epochs': 285, 'loss': 'mse', 'optimizer': 'adam', 'graph_mode': 'off', 'use_snp_selection': False}. Best is trial 105 with value: 0.30751839937923303.
[I 2025-12-05 20:54:55,863] Trial 120 finished with value: 0.3012541480251446 and parameters: {'model_type': 'mlp', 'hidden_dims': '[512, 64]', 'dropout': 0.48564159093837156, 'batch_norm': False, 'lr': 2.998602280842229e-06, 'weight_decay': 8.706086720171896e-06, 'epochs': 207, 'loss': 'mse', 'optimizer': 'adam', 'graph_mode': 'off', 'use_snp_selection': False}. Best is trial 105 with value: 0.30751839937923303.
[I 2025-12-05 20:55:42,935] Trial 121 finished with value: 0.30445656335185467 and parameters: {'model_type': 'mlp', 'hidden_dims': '[512, 64]', 'dropout': 0.5372978962526841, 'batch_norm': False, 'lr': 3.212415594162107e-06, 'weight_decay': 0.00044345497331315265, 'epochs': 241, 'loss': 'mse', 'optimizer': 'adam', 'graph_mode': 'off', 'use_snp_selection': False}. Best is trial 105 with value: 0.30751839937923303.
[I 2025-12-05 20:56:31,445] Trial 122 finished with value: 0.30309741450045513 and parameters: {'model_type': 'mlp', 'hidden_dims': '[512, 64]', 'dropout': 0.5423788953980364, 'batch_norm': False, 'lr': 4.764057868036749e-06, 'weight_decay': 0.00043715227440937945, 'epochs': 249, 'loss': 'mse', 'optimizer': 'adam', 'graph_mode': 'off', 'use_snp_selection': False}. Best is trial 105 with value: 0.30751839937923303.
[I 2025-12-05 20:57:18,603] Trial 123 finished with value: 0.29586255761011876 and parameters: {'model_type': 'mlp', 'hidden_dims': '[512, 64]', 'dropout': 0.5087269887321136, 'batch_norm': False, 'lr': 1.5694622103939166e-06, 'weight_decay': 1.8664949843322674e-06, 'epochs': 241, 'loss': 'mse', 'optimizer': 'adam', 'graph_mode': 'off', 'use_snp_selection': False}. Best is trial 105 with value: 0.30751839937923303.
[I 2025-12-05 20:58:09,450] Trial 124 finished with value: 0.3025443458891781 and parameters: {'model_type': 'mlp', 'hidden_dims': '[512, 64]', 'dropout': 0.5208694117769019, 'batch_norm': False, 'lr': 5.4363194682898875e-06, 'weight_decay': 4.297603268390234e-06, 'epochs': 262, 'loss': 'mse', 'optimizer': 'adam', 'graph_mode': 'off', 'use_snp_selection': False}. Best is trial 105 with value: 0.30751839937923303.
[I 2025-12-05 20:58:53,304] Trial 125 finished with value: 0.30123063160022623 and parameters: {'model_type': 'mlp', 'hidden_dims': '[512, 64]', 'dropout': 0.46606663700597206, 'batch_norm': False, 'lr': 1.8972154043544869e-06, 'weight_decay': 0.0005532907361174277, 'epochs': 222, 'loss': 'mse', 'optimizer': 'adam', 'graph_mode': 'off', 'use_snp_selection': False}. Best is trial 105 with value: 0.30751839937923303.
[I 2025-12-05 20:59:46,027] Trial 126 finished with value: 0.30438077072959313 and parameters: {'model_type': 'mlp', 'hidden_dims': '[512, 64]', 'dropout': 0.45639489997942895, 'batch_norm': False, 'lr': 4.177111212465215e-06, 'weight_decay': 2.9557196851025385e-06, 'epochs': 273, 'loss': 'mse', 'optimizer': 'adam', 'graph_mode': 'off', 'use_snp_selection': False}. Best is trial 105 with value: 0.30751839937923303.
[I 2025-12-05 21:00:25,363] Trial 127 finished with value: 0.30273511750815363 and parameters: {'model_type': 'mlp', 'hidden_dims': '[512, 64]', 'dropout': 0.49768802504876053, 'batch_norm': False, 'lr': 3.231899266885679e-06, 'weight_decay': 0.00023867228420233934, 'epochs': 196, 'loss': 'mse', 'optimizer': 'adam', 'graph_mode': 'off', 'use_snp_selection': False}. Best is trial 105 with value: 0.30751839937923303.
[I 2025-12-05 21:00:50,163] Trial 128 finished with value: 0.2727232576480404 and parameters: {'model_type': 'mlp', 'hidden_dims': '[256, 128, 64]', 'dropout': 0.5417279446143083, 'batch_norm': True, 'lr': 3.7068959468458763e-06, 'weight_decay': 0.0003151848986742519, 'epochs': 219, 'loss': 'mse', 'optimizer': 'adam', 'graph_mode': 'off', 'use_snp_selection': False}. Best is trial 105 with value: 0.30751839937923303.
[I 2025-12-05 21:01:35,777] Trial 129 finished with value: 0.29979684615620456 and parameters: {'model_type': 'mlp', 'hidden_dims': '[512, 64]', 'dropout': 0.47693145920451646, 'batch_norm': False, 'lr': 2.6699788028120452e-06, 'weight_decay': 2.298782772759787e-06, 'epochs': 232, 'loss': 'mse', 'optimizer': 'adam', 'graph_mode': 'off', 'use_snp_selection': False}. Best is trial 105 with value: 0.30751839937923303.
[I 2025-12-05 21:02:26,285] Trial 130 finished with value: 0.3053651625840921 and parameters: {'model_type': 'mlp', 'hidden_dims': '[512, 256]', 'dropout': 0.5729346714918907, 'batch_norm': False, 'lr': 4.5162278046668315e-06, 'weight_decay': 0.0005912576573204465, 'epochs': 259, 'loss': 'mse', 'optimizer': 'adam', 'graph_mode': 'off', 'use_snp_selection': False}. Best is trial 105 with value: 0.30751839937923303.
[I 2025-12-05 21:03:16,079] Trial 131 finished with value: 0.30684536948237695 and parameters: {'model_type': 'mlp', 'hidden_dims': '[512, 256]', 'dropout': 0.5873794651497485, 'batch_norm': False, 'lr': 4.3870144642807224e-06, 'weight_decay': 0.0006126362798434647, 'epochs': 255, 'loss': 'mse', 'optimizer': 'adam', 'graph_mode': 'off', 'use_snp_selection': False}. Best is trial 105 with value: 0.30751839937923303.
[I 2025-12-05 21:04:06,424] Trial 132 finished with value: 0.3019996855348259 and parameters: {'model_type': 'mlp', 'hidden_dims': '[512, 256]', 'dropout': 0.5899666789238328, 'batch_norm': False, 'lr': 4.91287119859062e-06, 'weight_decay': 0.000764593837060929, 'epochs': 258, 'loss': 'mse', 'optimizer': 'adam', 'graph_mode': 'off', 'use_snp_selection': False}. Best is trial 105 with value: 0.30751839937923303.
[I 2025-12-05 21:05:08,467] Trial 133 finished with value: 0.300630068791389 and parameters: {'model_type': 'mlp', 'hidden_dims': '[512, 256]', 'dropout': 0.5735507884675941, 'batch_norm': False, 'lr': 6.195865342589545e-06, 'weight_decay': 0.000621456103332173, 'epochs': 325, 'loss': 'mse', 'optimizer': 'adam', 'graph_mode': 'off', 'use_snp_selection': False}. Best is trial 105 with value: 0.30751839937923303.
[I 2025-12-05 21:05:59,332] Trial 134 finished with value: 0.30392861481720246 and parameters: {'model_type': 'mlp', 'hidden_dims': '[512, 256]', 'dropout': 0.5834990212093124, 'batch_norm': False, 'lr': 4.380559258596933e-06, 'weight_decay': 0.0002597789772882553, 'epochs': 261, 'loss': 'mse', 'optimizer': 'adam', 'graph_mode': 'off', 'use_snp_selection': False}. Best is trial 105 with value: 0.30751839937923303.
[I 2025-12-05 21:06:36,411] Trial 135 finished with value: 0.30467411545457923 and parameters: {'model_type': 'mlp', 'hidden_dims': '[512, 256]', 'dropout': 0.5655687435566865, 'batch_norm': False, 'lr': 3.943475250325923e-06, 'weight_decay': 0.0005472040283644134, 'epochs': 182, 'loss': 'mse', 'optimizer': 'adam', 'graph_mode': 'off', 'use_snp_selection': False}. Best is trial 105 with value: 0.30751839937923303.
[I 2025-12-05 21:07:13,121] Trial 136 finished with value: 0.30330268314108105 and parameters: {'model_type': 'mlp', 'hidden_dims': '[512, 256]', 'dropout': 0.5553010936957341, 'batch_norm': False, 'lr': 5.512552653845565e-06, 'weight_decay': 0.0005414454971530291, 'epochs': 180, 'loss': 'mse', 'optimizer': 'adam', 'graph_mode': 'off', 'use_snp_selection': False}. Best is trial 105 with value: 0.30751839937923303.
[I 2025-12-05 21:08:05,236] Trial 137 finished with value: 0.3073319747442703 and parameters: {'model_type': 'mlp', 'hidden_dims': '[512, 256]', 'dropout': 0.5626042482216906, 'batch_norm': False, 'lr': 3.522255336214743e-06, 'weight_decay': 0.000676865415092044, 'epochs': 268, 'loss': 'mse', 'optimizer': 'adam', 'graph_mode': 'off', 'use_snp_selection': False}. Best is trial 105 with value: 0.30751839937923303.
[I 2025-12-05 21:08:39,626] Trial 138 finished with value: 0.28045596942694234 and parameters: {'model_type': 'mlp', 'hidden_dims': '[512, 256]', 'dropout': 0.5701729391544282, 'batch_norm': False, 'lr': 2.7745278674940254e-06, 'weight_decay': 0.0006828721624377662, 'epochs': 253, 'loss': 'mse', 'optimizer': 'adam', 'graph_mode': 'off', 'use_snp_selection': True, 'num_snps': 13643}. Best is trial 105 with value: 0.30751839937923303.
[I 2025-12-05 21:09:31,313] Trial 139 finished with value: 0.2855332557476944 and parameters: {'model_type': 'mlp', 'hidden_dims': '[512, 256]', 'dropout': 0.5932552153042656, 'batch_norm': False, 'lr': 2.2800031296644597e-06, 'weight_decay': 0.0008452534480351888, 'epochs': 267, 'loss': 'mae', 'optimizer': 'adam', 'graph_mode': 'off', 'use_snp_selection': False}. Best is trial 105 with value: 0.30751839937923303.
[I 2025-12-05 21:10:24,858] Trial 140 finished with value: 0.3008942769434614 and parameters: {'model_type': 'mlp', 'hidden_dims': '[512, 256]', 'dropout': 0.37489823634286323, 'batch_norm': False, 'lr': 3.4758477182937158e-06, 'weight_decay': 1.394443158106054e-06, 'epochs': 276, 'loss': 'mse', 'optimizer': 'adam', 'graph_mode': 'off', 'use_snp_selection': False}. Best is trial 105 with value: 0.30751839937923303.
[I 2025-12-05 21:11:18,929] Trial 141 finished with value: 0.2600066027094614 and parameters: {'model_type': 'mlp', 'hidden_dims': '[512, 256]', 'dropout': 0.5599128317496962, 'batch_norm': False, 'lr': 0.0005966001717065013, 'weight_decay': 0.00039997613691445966, 'epochs': 281, 'loss': 'mse', 'optimizer': 'adam', 'graph_mode': 'off', 'use_snp_selection': False}. Best is trial 105 with value: 0.30751839937923303.
[I 2025-12-05 21:12:10,624] Trial 142 finished with value: 0.30606476737758526 and parameters: {'model_type': 'mlp', 'hidden_dims': '[512, 256]', 'dropout': 0.5837190360064908, 'batch_norm': False, 'lr': 3.7980381584852533e-06, 'weight_decay': 0.0005834547178515859, 'epochs': 266, 'loss': 'mse', 'optimizer': 'adam', 'graph_mode': 'off', 'use_snp_selection': False}. Best is trial 105 with value: 0.30751839937923303.
[I 2025-12-05 21:13:02,253] Trial 143 finished with value: 0.3035658980483572 and parameters: {'model_type': 'mlp', 'hidden_dims': '[512, 256]', 'dropout': 0.5838035751502807, 'batch_norm': False, 'lr': 4.691848826794107e-06, 'weight_decay': 0.00035705403969057324, 'epochs': 266, 'loss': 'mse', 'optimizer': 'adam', 'graph_mode': 'off', 'use_snp_selection': False}. Best is trial 105 with value: 0.30751839937923303.
[I 2025-12-05 21:13:57,862] Trial 144 finished with value: 0.2985141577829572 and parameters: {'model_type': 'mlp', 'hidden_dims': '[512, 256]', 'dropout': 0.5904358839388707, 'batch_norm': False, 'lr': 6.970339736805066e-06, 'weight_decay': 4.835868264031612e-06, 'epochs': 289, 'loss': 'mse', 'optimizer': 'adam', 'graph_mode': 'off', 'use_snp_selection': False}. Best is trial 105 with value: 0.30751839937923303.
[I 2025-12-05 21:14:14,593] Trial 145 finished with value: 0.2665935625627088 and parameters: {'model_type': 'mlp', 'hidden_dims': '[512, 256]', 'dropout': 0.5751164770689737, 'batch_norm': False, 'lr': 2.996254630788303e-06, 'weight_decay': 0.0009934301597205757, 'epochs': 66, 'loss': 'mse', 'optimizer': 'adam', 'graph_mode': 'off', 'use_snp_selection': False}. Best is trial 105 with value: 0.30751839937923303.
[I 2025-12-05 21:15:06,827] Trial 146 finished with value: 0.30329101622745097 and parameters: {'model_type': 'mlp', 'hidden_dims': '[512, 256]', 'dropout': 0.5220006460203743, 'batch_norm': False, 'lr': 3.567376486118313e-06, 'weight_decay': 0.000608326151593144, 'epochs': 269, 'loss': 'mse', 'optimizer': 'adam', 'graph_mode': 'off', 'use_snp_selection': False}. Best is trial 105 with value: 0.30751839937923303.
[I 2025-12-05 21:15:38,381] Trial 147 finished with value: 0.30355429820391705 and parameters: {'model_type': 'mlp', 'hidden_dims': '[256, 128]', 'dropout': 0.5784935084050832, 'batch_norm': False, 'lr': 5.463386003109413e-06, 'weight_decay': 0.00030877742090025057, 'epochs': 296, 'loss': 'mse', 'optimizer': 'adam', 'graph_mode': 'off', 'use_snp_selection': False}. Best is trial 105 with value: 0.30751839937923303.
[I 2025-12-05 21:16:27,311] Trial 148 finished with value: 0.307297500295765 and parameters: {'model_type': 'mlp', 'hidden_dims': '[512, 256]', 'dropout': 0.5465070780058475, 'batch_norm': False, 'lr': 4.131665872634333e-06, 'weight_decay': 3.1887185490619206e-06, 'epochs': 250, 'loss': 'mse', 'optimizer': 'adam', 'graph_mode': 'off', 'use_snp_selection': False}. Best is trial 105 with value: 0.30751839937923303.
[I 2025-12-05 21:17:16,056] Trial 149 finished with value: 0.29909178140739573 and parameters: {'model_type': 'mlp', 'hidden_dims': '[512, 256]', 'dropout': 0.5991014265061205, 'batch_norm': False, 'lr': 2.538623755203068e-06, 'weight_decay': 3.1300113163597096e-06, 'epochs': 249, 'loss': 'mse', 'optimizer': 'adam', 'graph_mode': 'off', 'use_snp_selection': False}. Best is trial 105 with value: 0.30751839937923303.
[I 2025-12-05 21:18:13,877] Trial 0 finished with value: 0.2756537505445041 and parameters: {'model_type': 'mlp', 'hidden_dims': '[128, 64]', 'dropout': 0.199031432379812, 'batch_norm': True, 'lr': 1.8408544111075837e-06, 'weight_decay': 5.5136510071208614e-05, 'epochs': 336, 'loss': 'mae', 'optimizer': 'adam', 'graph_mode': 'off', 'use_snp_selection': True, 'num_snps': 43862}. Best is trial 0 with value: 0.2756537505445041.
[I 2025-12-05 21:18:40,551] Trial 1 finished with value: 0.3017902791399005 and parameters: {'model_type': 'mlp', 'hidden_dims': '[256, 128]', 'dropout': 0.4370668075331726, 'batch_norm': True, 'lr': 7.133471581159139e-05, 'weight_decay': 1.128633586803549e-05, 'epochs': 242, 'loss': 'mae', 'optimizer': 'adam', 'graph_mode': 'off', 'use_snp_selection': False}. Best is trial 1 with value: 0.3017902791399005.
[I 2025-12-05 21:19:07,197] Trial 2 finished with value: 0.25762333546988353 and parameters: {'model_type': 'mlp', 'hidden_dims': '[256, 128, 64]', 'dropout': 0.41314357415569625, 'batch_norm': False, 'lr': 3.952233718592101e-06, 'weight_decay': 0.00026754769258252603, 'epochs': 149, 'loss': 'mse', 'optimizer': 'adam', 'graph_mode': 'off', 'use_snp_selection': True, 'num_snps': 11571}. Best is trial 1 with value: 0.3017902791399005.
[I 2025-12-05 21:20:07,765] Trial 3 finished with value: 0.30968944964839273 and parameters: {'model_type': 'mlp', 'hidden_dims': '[512, 64]', 'dropout': 0.5938127374509361, 'batch_norm': False, 'lr': 5.67704586114731e-06, 'weight_decay': 2.4518087630137052e-05, 'epochs': 320, 'loss': 'mae', 'optimizer': 'adam', 'graph_mode': 'off', 'use_snp_selection': False}. Best is trial 3 with value: 0.30968944964839273.
[I 2025-12-05 21:21:08,238] Trial 4 finished with value: 0.2677785970299924 and parameters: {'model_type': 'mlp', 'hidden_dims': '[512, 128]', 'dropout': 0.25746343592134413, 'batch_norm': True, 'lr': 1.3467657668402788e-06, 'weight_decay': 0.00033087251918647806, 'epochs': 277, 'loss': 'mse', 'optimizer': 'adam', 'graph_mode': 'off', 'use_snp_selection': True, 'num_snps': 36675}. Best is trial 3 with value: 0.30968944964839273.
[I 2025-12-05 21:21:51,350] Trial 5 finished with value: 0.265605645434787 and parameters: {'model_type': 'mlp', 'hidden_dims': '[512, 64]', 'dropout': 0.38275350994408375, 'batch_norm': True, 'lr': 1.5586664309232824e-06, 'weight_decay': 0.0008227664668621182, 'epochs': 145, 'loss': 'mae', 'optimizer': 'adam', 'graph_mode': 'off', 'use_snp_selection': True, 'num_snps': 32148}. Best is trial 3 with value: 0.30968944964839273.
[I 2025-12-05 21:22:13,944] Trial 6 finished with value: 0.30184301283428316 and parameters: {'model_type': 'mlp', 'hidden_dims': '[256, 128]', 'dropout': 0.3930109900265879, 'batch_norm': False, 'lr': 4.892964372128395e-05, 'weight_decay': 1.5809549317992182e-06, 'epochs': 199, 'loss': 'mse', 'optimizer': 'adam', 'graph_mode': 'off', 'use_snp_selection': False}. Best is trial 3 with value: 0.30968944964839273.
[I 2025-12-05 21:22:36,189] Trial 7 finished with value: 0.3048296071529678 and parameters: {'model_type': 'mlp', 'hidden_dims': '[512, 256]', 'dropout': 0.15343979219678458, 'batch_norm': True, 'lr': 6.234003099047341e-05, 'weight_decay': 3.894760610535477e-07, 'epochs': 97, 'loss': 'mse', 'optimizer': 'adam', 'graph_mode': 'off', 'use_snp_selection': False}. Best is trial 3 with value: 0.30968944964839273.
[I 2025-12-05 21:23:36,027] Trial 8 finished with value: 0.3003140978786253 and parameters: {'model_type': 'mlp', 'hidden_dims': '[512, 128]', 'dropout': 0.10743001231661406, 'batch_norm': True, 'lr': 0.00023728538449271062, 'weight_decay': 1.7629071578048637e-05, 'epochs': 312, 'loss': 'mae', 'optimizer': 'adam', 'graph_mode': 'off', 'use_snp_selection': False}. Best is trial 3 with value: 0.30968944964839273.
[I 2025-12-05 21:24:11,908] Trial 9 finished with value: 0.30723299660244746 and parameters: {'model_type': 'mlp', 'hidden_dims': '[512, 64]', 'dropout': 0.14505336736221927, 'batch_norm': True, 'lr': 5.8619638388111826e-05, 'weight_decay': 6.200156172669308e-07, 'epochs': 175, 'loss': 'mse', 'optimizer': 'adam', 'graph_mode': 'off', 'use_snp_selection': False}. Best is trial 3 with value: 0.30968944964839273.
[I 2025-12-05 21:24:26,635] Trial 10 finished with value: 0.2697542483036323 and parameters: {'model_type': 'mlp', 'hidden_dims': '[512, 64]', 'dropout': 0.5885461262002587, 'batch_norm': False, 'lr': 8.769366258768696e-06, 'weight_decay': 2.78273193871783e-06, 'epochs': 55, 'loss': 'mae', 'optimizer': 'adam', 'graph_mode': 'off', 'use_snp_selection': False}. Best is trial 3 with value: 0.30968944964839273.
