[I 2025-12-05 15:29:33,238] Trial 12 finished with value: 0.0913093103054739 and parameters: {'model_type': 'mlp', 'hidden_dims': '[512, 256]', 'dropout': 0.10344600881777158, 'batch_norm': True, 'lr': 0.0006753264773209732, 'weight_decay': 1.2006458821839938e-06, 'epochs': 63, 'loss': 'mae', 'optimizer': 'adam', 'graph_mode': 'off', 'use_snp_selection': False}. Best is trial 7 with value: 0.11528134753305326.
[I 2025-12-05 15:29:34,516] Trial 13 finished with value: 0.05092970792331947 and parameters: {'model_type': 'mlp', 'hidden_dims': '[512, 256]', 'dropout': 0.206733630507397, 'batch_norm': True, 'lr': 1.3373175420781734e-05, 'weight_decay': 1.8965593394883618e-07, 'epochs': 92, 'loss': 'mse', 'optimizer': 'adam', 'graph_mode': 'off', 'use_snp_selection': False}. Best is trial 7 with value: 0.11528134753305326.
[I 2025-12-05 15:29:35,897] Trial 14 finished with value: 0.12768990619840626 and parameters: {'model_type': 'mlp', 'hidden_dims': '[512, 128]', 'dropout': 0.3012984444538551, 'batch_norm': True, 'lr': 0.0009000048932733863, 'weight_decay': 3.2568808920327207e-06, 'epochs': 110, 'loss': 'mae', 'optimizer': 'adam', 'graph_mode': 'off', 'use_snp_selection': False}. Best is trial 14 with value: 0.12768990619840626.
[I 2025-12-05 15:29:36,644] Trial 15 finished with value: 0.0893816411865958 and parameters: {'model_type': 'mlp', 'hidden_dims': '[128, 64]', 'dropout': 0.31234772133630384, 'batch_norm': True, 'lr': 0.0001572871022003765, 'weight_decay': 4.647398975110266e-06, 'epochs': 117, 'loss': 'mse', 'optimizer': 'adam', 'graph_mode': 'off', 'use_snp_selection': False}. Best is trial 14 with value: 0.12768990619840626.
[I 2025-12-05 15:29:37,553] Trial 16 finished with value: 0.054590240945803135 and parameters: {'model_type': 'mlp', 'hidden_dims': '[256, 128, 64]', 'dropout': 0.47522796769107767, 'batch_norm': True, 'lr': 2.1517090787442848e-05, 'weight_decay': 3.749525779502734e-07, 'epochs': 104, 'loss': 'mae', 'optimizer': 'adam', 'graph_mode': 'off', 'use_snp_selection': False}. Best is trial 14 with value: 0.12768990619840626.
[I 2025-12-05 15:29:39,437] Trial 17 finished with value: 0.09700958597178845 and parameters: {'model_type': 'mlp', 'hidden_dims': '[512, 128]', 'dropout': 0.20279681066158253, 'batch_norm': True, 'lr': 0.00011570589018203527, 'weight_decay': 3.784040923164914e-06, 'epochs': 202, 'loss': 'mse', 'optimizer': 'adam', 'graph_mode': 'off', 'use_snp_selection': False}. Best is trial 14 with value: 0.12768990619840626.
[I 2025-12-05 15:29:42,808] Trial 18 finished with value: 0.08592304548370616 and parameters: {'model_type': 'mlp', 'hidden_dims': '[512, 256]', 'dropout': 0.32223702172256136, 'batch_norm': False, 'lr': 0.0009812890749830259, 'weight_decay': 4.999091826142784e-07, 'epochs': 143, 'loss': 'mae', 'optimizer': 'adam', 'graph_mode': 'off', 'use_snp_selection': True, 'num_snps': 58241}. Best is trial 14 with value: 0.12768990619840626.
[I 2025-12-05 15:29:44,273] Trial 19 finished with value: 0.06197336023195304 and parameters: {'model_type': 'mlp', 'hidden_dims': '[512, 128]', 'dropout': 0.520299837989321, 'batch_norm': True, 'lr': 1.352570837276448e-05, 'weight_decay': 5.5269312676552045e-05, 'epochs': 119, 'loss': 'mse', 'optimizer': 'adam', 'graph_mode': 'off', 'use_snp_selection': False}. Best is trial 14 with value: 0.12768990619840626.
[I 2025-12-05 15:29:46,375] Trial 20 finished with value: 0.11072998717395724 and parameters: {'model_type': 'mlp', 'hidden_dims': '[512, 256]', 'dropout': 0.25316953857911023, 'batch_norm': True, 'lr': 0.0003752998029954438, 'weight_decay': 5.783402506345549e-06, 'epochs': 237, 'loss': 'mse', 'optimizer': 'adam', 'graph_mode': 'off', 'use_snp_selection': False}. Best is trial 14 with value: 0.12768990619840626.
[I 2025-12-05 15:29:47,452] Trial 21 finished with value: 0.0858578816607159 and parameters: {'model_type': 'mlp', 'hidden_dims': '[512, 128]', 'dropout': 0.16914449639955972, 'batch_norm': True, 'lr': 0.000538286824244745, 'weight_decay': 1.3648862565284844e-06, 'epochs': 67, 'loss': 'mae', 'optimizer': 'adam', 'graph_mode': 'off', 'use_snp_selection': False}. Best is trial 14 with value: 0.12768990619840626.
[I 2025-12-05 15:29:48,630] Trial 22 finished with value: 0.08100260739795762 and parameters: {'model_type': 'mlp', 'hidden_dims': '[512, 128]', 'dropout': 0.1621037130767129, 'batch_norm': True, 'lr': 0.00017640201052701975, 'weight_decay': 2.7412454809982558e-06, 'epochs': 84, 'loss': 'mae', 'optimizer': 'adam', 'graph_mode': 'off', 'use_snp_selection': False}. Best is trial 14 with value: 0.12768990619840626.
[I 2025-12-05 15:29:49,548] Trial 23 finished with value: 0.1000628783741524 and parameters: {'model_type': 'mlp', 'hidden_dims': '[512, 128]', 'dropout': 0.13297069507397122, 'batch_norm': True, 'lr': 0.0009552301034003669, 'weight_decay': 3.2666120737763034e-07, 'epochs': 40, 'loss': 'mae', 'optimizer': 'adam', 'graph_mode': 'off', 'use_snp_selection': False}. Best is trial 14 with value: 0.12768990619840626.
[I 2025-12-05 15:29:50,652] Trial 24 finished with value: 0.10422915342145725 and parameters: {'model_type': 'mlp', 'hidden_dims': '[512, 128]', 'dropout': 0.3517537266294317, 'batch_norm': True, 'lr': 0.0004830187108272664, 'weight_decay': 8.203853848771131e-07, 'epochs': 71, 'loss': 'mae', 'optimizer': 'adam', 'graph_mode': 'off', 'use_snp_selection': False}. Best is trial 14 with value: 0.12768990619840626.
[I 2025-12-05 15:29:51,621] Trial 25 finished with value: 0.11540214412683741 and parameters: {'model_type': 'mlp', 'hidden_dims': '[256, 128, 64]', 'dropout': 0.2297571179537936, 'batch_norm': True, 'lr': 0.00010984905236956413, 'weight_decay': 2.67068026613755e-06, 'epochs': 124, 'loss': 'mae', 'optimizer': 'adam', 'graph_mode': 'off', 'use_snp_selection': False}. Best is trial 14 with value: 0.12768990619840626.
[I 2025-12-05 15:29:52,670] Trial 26 finished with value: 0.03641534663761222 and parameters: {'model_type': 'mlp', 'hidden_dims': '[256, 128, 64]', 'dropout': 0.22847972007378098, 'batch_norm': True, 'lr': 3.5652153356401597e-05, 'weight_decay': 1.0083670741577279e-07, 'epochs': 130, 'loss': 'mae', 'optimizer': 'adam', 'graph_mode': 'off', 'use_snp_selection': True, 'num_snps': 3842}. Best is trial 14 with value: 0.12768990619840626.
[I 2025-12-05 15:29:53,794] Trial 27 finished with value: 0.11263906232117571 and parameters: {'model_type': 'mlp', 'hidden_dims': '[256, 128, 64]', 'dropout': 0.30059047811097117, 'batch_norm': False, 'lr': 9.071120844048233e-05, 'weight_decay': 9.830677373354123e-06, 'epochs': 174, 'loss': 'mae', 'optimizer': 'adam', 'graph_mode': 'off', 'use_snp_selection': False}. Best is trial 14 with value: 0.12768990619840626.
[I 2025-12-05 15:29:54,904] Trial 28 finished with value: 0.08063164468405458 and parameters: {'model_type': 'mlp', 'hidden_dims': '[256, 128, 64]', 'dropout': 0.278862532541005, 'batch_norm': True, 'lr': 1.8734325613178324e-05, 'weight_decay': 2.222770713466035e-07, 'epochs': 167, 'loss': 'mse', 'optimizer': 'adam', 'graph_mode': 'off', 'use_snp_selection': False}. Best is trial 14 with value: 0.12768990619840626.
[I 2025-12-05 15:29:56,319] Trial 29 finished with value: 0.08112787463751228 and parameters: {'model_type': 'mlp', 'hidden_dims': '[128, 64]', 'dropout': 0.22887494314545864, 'batch_norm': True, 'lr': 3.2662305049396354e-05, 'weight_decay': 5.5227103357724904e-05, 'epochs': 108, 'loss': 'mae', 'optimizer': 'adam', 'graph_mode': 'off', 'use_snp_selection': True, 'num_snps': 19468}. Best is trial 14 with value: 0.12768990619840626.
[I 2025-12-05 15:29:57,605] Trial 30 finished with value: 0.03962407075888189 and parameters: {'model_type': 'mlp', 'hidden_dims': '[256, 128]', 'dropout': 0.3448564760021705, 'batch_norm': True, 'lr': 7.6088254603734275e-06, 'weight_decay': 2.601454501408819e-05, 'epochs': 220, 'loss': 'mae', 'optimizer': 'adam', 'graph_mode': 'off', 'use_snp_selection': False}. Best is trial 14 with value: 0.12768990619840626.
[I 2025-12-05 15:29:58,264] Trial 31 finished with value: 0.10216467404500759 and parameters: {'model_type': 'mlp', 'hidden_dims': '[128, 64]', 'dropout': 0.17189887580102575, 'batch_norm': True, 'lr': 0.000283565385151053, 'weight_decay': 2.2325560812790273e-06, 'epochs': 90, 'loss': 'mae', 'optimizer': 'adam', 'graph_mode': 'off', 'use_snp_selection': False}. Best is trial 14 with value: 0.12768990619840626.
[I 2025-12-05 15:29:59,312] Trial 32 finished with value: 0.11856027733543358 and parameters: {'model_type': 'mlp', 'hidden_dims': '[512, 256]', 'dropout': 0.12623386952239138, 'batch_norm': True, 'lr': 0.00011085168839174366, 'weight_decay': 8.107518149341354e-06, 'epochs': 61, 'loss': 'mae', 'optimizer': 'adam', 'graph_mode': 'off', 'use_snp_selection': False}. Best is trial 14 with value: 0.12768990619840626.
[I 2025-12-05 15:30:00,766] Trial 33 finished with value: 0.09558475674821956 and parameters: {'model_type': 'mlp', 'hidden_dims': '[512, 256]', 'dropout': 0.19410729435541293, 'batch_norm': True, 'lr': 0.00011611923489049966, 'weight_decay': 8.359828012114944e-06, 'epochs': 130, 'loss': 'mae', 'optimizer': 'adam', 'graph_mode': 'off', 'use_snp_selection': False}. Best is trial 14 with value: 0.12768990619840626.
[I 2025-12-05 15:30:01,750] Trial 34 finished with value: 0.1075339061915903 and parameters: {'model_type': 'mlp', 'hidden_dims': '[512, 256]', 'dropout': 0.1351678308498948, 'batch_norm': True, 'lr': 7.677690134864679e-05, 'weight_decay': 9.049362460584294e-07, 'epochs': 51, 'loss': 'mae', 'optimizer': 'adam', 'graph_mode': 'off', 'use_snp_selection': False}. Best is trial 14 with value: 0.12768990619840626.
[I 2025-12-05 15:30:02,658] Trial 35 finished with value: 0.10304639346361462 and parameters: {'model_type': 'mlp', 'hidden_dims': '[256, 128, 64]', 'dropout': 0.22000685112353816, 'batch_norm': False, 'lr': 4.603577764515555e-05, 'weight_decay': 1.7479081285587815e-05, 'epochs': 101, 'loss': 'mae', 'optimizer': 'adam', 'graph_mode': 'off', 'use_snp_selection': False}. Best is trial 14 with value: 0.12768990619840626.
[I 2025-12-05 15:30:06,129] Trial 36 finished with value: 0.044702564006281725 and parameters: {'model_type': 'mlp', 'hidden_dims': '[512, 256]', 'dropout': 0.18370980374424467, 'batch_norm': True, 'lr': 2.929973644452311e-06, 'weight_decay': 4.751802101585892e-06, 'epochs': 152, 'loss': 'mae', 'optimizer': 'adam', 'graph_mode': 'off', 'use_snp_selection': True, 'num_snps': 58661}. Best is trial 14 with value: 0.12768990619840626.
[I 2025-12-05 15:30:07,075] Trial 37 finished with value: 0.11131136114328721 and parameters: {'model_type': 'mlp', 'hidden_dims': '[256, 128]', 'dropout': 0.24876975198477902, 'batch_norm': True, 'lr': 0.00017553092943972478, 'weight_decay': 9.096918760018813e-05, 'epochs': 83, 'loss': 'mse', 'optimizer': 'adam', 'graph_mode': 'off', 'use_snp_selection': False}. Best is trial 14 with value: 0.12768990619840626.
[I 2025-12-05 15:30:08,816] Trial 38 finished with value: 0.10121576603779647 and parameters: {'model_type': 'mlp', 'hidden_dims': '[512, 64]', 'dropout': 0.1502162110967726, 'batch_norm': False, 'lr': 0.00011030728446483149, 'weight_decay': 1.424670282844502e-05, 'epochs': 267, 'loss': 'mae', 'optimizer': 'adam', 'graph_mode': 'off', 'use_snp_selection': True, 'num_snps': 19911}. Best is trial 14 with value: 0.12768990619840626.
[I 2025-12-05 15:30:10,272] Trial 39 finished with value: 0.09297363896936102 and parameters: {'model_type': 'mlp', 'hidden_dims': '[512, 256]', 'dropout': 0.593444752072398, 'batch_norm': True, 'lr': 5.715668603795819e-05, 'weight_decay': 3.1454796673030104e-05, 'epochs': 130, 'loss': 'mse', 'optimizer': 'adam', 'graph_mode': 'off', 'use_snp_selection': False}. Best is trial 14 with value: 0.12768990619840626.
[I 2025-12-05 15:30:11,013] Trial 40 finished with value: 0.11937744828300104 and parameters: {'model_type': 'mlp', 'hidden_dims': '[256, 128, 64]', 'dropout': 0.28723236093196375, 'batch_norm': True, 'lr': 0.00022419272945477074, 'weight_decay': 7.30150697723922e-06, 'epochs': 56, 'loss': 'mae', 'optimizer': 'adam', 'graph_mode': 'off', 'use_snp_selection': False}. Best is trial 14 with value: 0.12768990619840626.
[I 2025-12-05 15:30:11,783] Trial 41 finished with value: 0.08335115346374729 and parameters: {'model_type': 'mlp', 'hidden_dims': '[256, 128, 64]', 'dropout': 0.36518513828862864, 'batch_norm': True, 'lr': 0.00023696226901805074, 'weight_decay': 7.1596880971865045e-06, 'epochs': 63, 'loss': 'mae', 'optimizer': 'adam', 'graph_mode': 'off', 'use_snp_selection': False}. Best is trial 14 with value: 0.12768990619840626.
[I 2025-12-05 15:30:13,455] Trial 42 finished with value: 0.10418947940336223 and parameters: {'model_type': 'mlp', 'hidden_dims': '[256, 128, 64]', 'dropout': 0.29443230419003785, 'batch_norm': True, 'lr': 0.0004047945735118151, 'weight_decay': 2.029153798028729e-06, 'epochs': 348, 'loss': 'mae', 'optimizer': 'adam', 'graph_mode': 'off', 'use_snp_selection': False}. Best is trial 14 with value: 0.12768990619840626.
[I 2025-12-05 15:30:14,226] Trial 43 finished with value: 0.09234280016811998 and parameters: {'model_type': 'mlp', 'hidden_dims': '[256, 128, 64]', 'dropout': 0.3308083465001379, 'batch_norm': True, 'lr': 0.00014438876910879736, 'weight_decay': 3.42366390000006e-06, 'epochs': 51, 'loss': 'mae', 'optimizer': 'adam', 'graph_mode': 'off', 'use_snp_selection': False}. Best is trial 14 with value: 0.12768990619840626.
[I 2025-12-05 15:30:15,404] Trial 44 finished with value: 0.09935402128115803 and parameters: {'model_type': 'mlp', 'hidden_dims': '[512, 64]', 'dropout': 0.4258548684333214, 'batch_norm': True, 'lr': 0.00022566475747512344, 'weight_decay': 1.0306600210291285e-05, 'epochs': 79, 'loss': 'mae', 'optimizer': 'adam', 'graph_mode': 'off', 'use_snp_selection': False}. Best is trial 14 with value: 0.12768990619840626.
[I 2025-12-05 15:30:16,178] Trial 45 finished with value: 0.10690948449223264 and parameters: {'model_type': 'mlp', 'hidden_dims': '[256, 128, 64]', 'dropout': 0.1209637568453093, 'batch_norm': True, 'lr': 7.409178869480359e-05, 'weight_decay': 0.00010130569287670845, 'epochs': 57, 'loss': 'mae', 'optimizer': 'adam', 'graph_mode': 'off', 'use_snp_selection': False}. Best is trial 14 with value: 0.12768990619840626.
[I 2025-12-05 15:30:17,491] Trial 46 finished with value: 0.10656135712734843 and parameters: {'model_type': 'mlp', 'hidden_dims': '[512, 256]', 'dropout': 0.27101938364591005, 'batch_norm': False, 'lr': 4.190309447877816e-05, 'weight_decay': 1.7253384557043092e-06, 'epochs': 103, 'loss': 'mse', 'optimizer': 'adam', 'graph_mode': 'off', 'use_snp_selection': False}. Best is trial 14 with value: 0.12768990619840626.
[I 2025-12-05 15:30:18,416] Trial 47 finished with value: 0.11325421893910466 and parameters: {'model_type': 'mlp', 'hidden_dims': '[256, 128]', 'dropout': 0.23683440952335127, 'batch_norm': True, 'lr': 0.0006138145493585835, 'weight_decay': 6.359895876866024e-06, 'epochs': 118, 'loss': 'mae', 'optimizer': 'adam', 'graph_mode': 'off', 'use_snp_selection': False}. Best is trial 14 with value: 0.12768990619840626.
[I 2025-12-05 15:30:20,057] Trial 48 finished with value: 0.0684575625964902 and parameters: {'model_type': 'mlp', 'hidden_dims': '[512, 256]', 'dropout': 0.3835826187661274, 'batch_norm': True, 'lr': 2.3008533016759084e-05, 'weight_decay': 1.0201310005877701e-06, 'epochs': 161, 'loss': 'mse', 'optimizer': 'adam', 'graph_mode': 'off', 'use_snp_selection': False}. Best is trial 14 with value: 0.12768990619840626.
[I 2025-12-05 15:30:22,283] Trial 49 finished with value: 0.1170763241464446 and parameters: {'model_type': 'mlp', 'hidden_dims': '[256, 128, 64]', 'dropout': 0.2066220980834402, 'batch_norm': True, 'lr': 6.130458398551878e-05, 'weight_decay': 3.393196266730768e-06, 'epochs': 93, 'loss': 'mae', 'optimizer': 'adam', 'graph_mode': 'off', 'use_snp_selection': True, 'num_snps': 46888}. Best is trial 14 with value: 0.12768990619840626.
[I 2025-12-05 15:30:24,656] Trial 50 finished with value: 0.13183701202040027 and parameters: {'model_type': 'mlp', 'hidden_dims': '[256, 128, 64]', 'dropout': 0.2056523973998954, 'batch_norm': True, 'lr': 0.0002991780015386373, 'weight_decay': 3.246684089646987e-06, 'epochs': 74, 'loss': 'mae', 'optimizer': 'adam', 'graph_mode': 'off', 'use_snp_selection': True, 'num_snps': 46345}. Best is trial 50 with value: 0.13183701202040027.
[I 2025-12-05 15:30:27,084] Trial 51 finished with value: 0.12252766684271754 and parameters: {'model_type': 'mlp', 'hidden_dims': '[256, 128, 64]', 'dropout': 0.21239554732484586, 'batch_norm': True, 'lr': 0.0003199831420854327, 'weight_decay': 4.053856443916984e-06, 'epochs': 81, 'loss': 'mae', 'optimizer': 'adam', 'graph_mode': 'off', 'use_snp_selection': True, 'num_snps': 46497}. Best is trial 50 with value: 0.13183701202040027.
[I 2025-12-05 15:30:29,397] Trial 52 finished with value: 0.11588226027181397 and parameters: {'model_type': 'mlp', 'hidden_dims': '[256, 128, 64]', 'dropout': 0.2846677889079501, 'batch_norm': True, 'lr': 0.00029847352485380994, 'weight_decay': 3.6734301127133134e-06, 'epochs': 74, 'loss': 'mae', 'optimizer': 'adam', 'graph_mode': 'off', 'use_snp_selection': True, 'num_snps': 46972}. Best is trial 50 with value: 0.13183701202040027.
[I 2025-12-05 15:30:31,587] Trial 53 finished with value: 0.0957082509505356 and parameters: {'model_type': 'mlp', 'hidden_dims': '[256, 128, 64]', 'dropout': 0.2029680032638288, 'batch_norm': True, 'lr': 0.00043932579759291664, 'weight_decay': 1.3742106011574427e-05, 'epochs': 51, 'loss': 'mae', 'optimizer': 'adam', 'graph_mode': 'off', 'use_snp_selection': True, 'num_snps': 46797}. Best is trial 50 with value: 0.13183701202040027.
[I 2025-12-05 15:30:33,638] Trial 54 finished with value: 0.10020882952363107 and parameters: {'model_type': 'mlp', 'hidden_dims': '[256, 128, 64]', 'dropout': 0.18112049113766635, 'batch_norm': True, 'lr': 0.00024010504034739253, 'weight_decay': 5.664333608144609e-06, 'epochs': 90, 'loss': 'mae', 'optimizer': 'adam', 'graph_mode': 'off', 'use_snp_selection': True, 'num_snps': 40172}. Best is trial 50 with value: 0.13183701202040027.
[I 2025-12-05 15:30:36,294] Trial 55 finished with value: 0.10357942131944163 and parameters: {'model_type': 'mlp', 'hidden_dims': '[256, 128, 64]', 'dropout': 0.2648076374049022, 'batch_norm': True, 'lr': 0.0007936070782082446, 'weight_decay': 1.5381323360610102e-06, 'epochs': 77, 'loss': 'mae', 'optimizer': 'adam', 'graph_mode': 'off', 'use_snp_selection': True, 'num_snps': 52249}. Best is trial 50 with value: 0.13183701202040027.
[I 2025-12-05 15:30:38,750] Trial 56 finished with value: 0.10807307316112912 and parameters: {'model_type': 'mlp', 'hidden_dims': '[256, 128, 64]', 'dropout': 0.3067784925522933, 'batch_norm': True, 'lr': 0.0003588533238343457, 'weight_decay': 4.000974528466089e-06, 'epochs': 58, 'loss': 'mae', 'optimizer': 'adam', 'graph_mode': 'off', 'use_snp_selection': True, 'num_snps': 50431}. Best is trial 50 with value: 0.13183701202040027.
[I 2025-12-05 15:30:40,619] Trial 57 finished with value: 0.07892935451610383 and parameters: {'model_type': 'mlp', 'hidden_dims': '[128, 64]', 'dropout': 0.21255603646726787, 'batch_norm': True, 'lr': 0.00018435670210593244, 'weight_decay': 7.705409562743654e-06, 'epochs': 110, 'loss': 'mae', 'optimizer': 'adam', 'graph_mode': 'off', 'use_snp_selection': True, 'num_snps': 36146}. Best is trial 50 with value: 0.13183701202040027.
[I 2025-12-05 15:30:42,261] Trial 58 finished with value: 0.06995484168574202 and parameters: {'model_type': 'mlp', 'hidden_dims': '[512, 128]', 'dropout': 0.11359020755101962, 'batch_norm': False, 'lr': 0.0005914265449283759, 'weight_decay': 2.1042614820608693e-05, 'epochs': 41, 'loss': 'mae', 'optimizer': 'adam', 'graph_mode': 'off', 'use_snp_selection': True, 'num_snps': 28119}. Best is trial 50 with value: 0.13183701202040027.
[I 2025-12-05 15:30:44,696] Trial 59 finished with value: 0.10186383098777296 and parameters: {'model_type': 'mlp', 'hidden_dims': '[256, 128, 64]', 'dropout': 0.2511144253151083, 'batch_norm': True, 'lr': 0.00013502765173802517, 'weight_decay': 0.0006548677363600756, 'epochs': 96, 'loss': 'mae', 'optimizer': 'adam', 'graph_mode': 'off', 'use_snp_selection': True, 'num_snps': 53295}. Best is trial 50 with value: 0.13183701202040027.
[I 2025-12-05 15:30:48,025] Trial 60 finished with value: 0.10661649179932192 and parameters: {'model_type': 'mlp', 'hidden_dims': '[512, 64]', 'dropout': 0.3225343031731905, 'batch_norm': True, 'lr': 0.0007889441436112074, 'weight_decay': 3.141682213622874e-06, 'epochs': 307, 'loss': 'mae', 'optimizer': 'adam', 'graph_mode': 'off', 'use_snp_selection': True, 'num_snps': 41340}. Best is trial 50 with value: 0.13183701202040027.
[I 2025-12-05 15:30:50,315] Trial 61 finished with value: 0.10387674828230414 and parameters: {'model_type': 'mlp', 'hidden_dims': '[256, 128, 64]', 'dropout': 0.27638751342700496, 'batch_norm': True, 'lr': 0.00028299909390740586, 'weight_decay': 4.41421933135474e-06, 'epochs': 73, 'loss': 'mae', 'optimizer': 'adam', 'graph_mode': 'off', 'use_snp_selection': True, 'num_snps': 45846}. Best is trial 50 with value: 0.13183701202040027.
[I 2025-12-05 15:30:52,634] Trial 62 finished with value: 0.09846237283350985 and parameters: {'model_type': 'mlp', 'hidden_dims': '[256, 128, 64]', 'dropout': 0.2821096778907896, 'batch_norm': True, 'lr': 0.0003201134350252294, 'weight_decay': 2.470013078445585e-06, 'epochs': 67, 'loss': 'mae', 'optimizer': 'adam', 'graph_mode': 'off', 'use_snp_selection': True, 'num_snps': 49392}. Best is trial 50 with value: 0.13183701202040027.
