[I 2025-12-05 14:32:14,121] Trial 110 finished with value: 0.11726604258871465 and parameters: {'model_type': 'mlp', 'hidden_dims': '[512, 128]', 'dropout': 0.2116442330006182, 'batch_norm': True, 'lr': 0.00019671971278698285, 'weight_decay': 2.299004732782943e-05, 'epochs': 213, 'loss': 'mae', 'optimizer': 'adam', 'graph_mode': 'off', 'use_snp_selection': True, 'num_snps': 26398}. Best is trial 83 with value: 0.12218661542207429.
[I 2025-12-05 14:32:15,846] Trial 111 finished with value: 0.10802860880449673 and parameters: {'model_type': 'mlp', 'hidden_dims': '[512, 128]', 'dropout': 0.2176716958293785, 'batch_norm': True, 'lr': 0.00016450960453327014, 'weight_decay': 2.290496989968881e-05, 'epochs': 212, 'loss': 'mae', 'optimizer': 'adam', 'graph_mode': 'off', 'use_snp_selection': True, 'num_snps': 27159}. Best is trial 83 with value: 0.12218661542207429.
[I 2025-12-05 14:32:17,091] Trial 112 finished with value: 0.10051929773381979 and parameters: {'model_type': 'mlp', 'hidden_dims': '[512, 128]', 'dropout': 0.18694275970838, 'batch_norm': True, 'lr': 0.00020784195843801922, 'weight_decay': 1.571517642809656e-05, 'epochs': 226, 'loss': 'mae', 'optimizer': 'adam', 'graph_mode': 'off', 'use_snp_selection': True, 'num_snps': 13331}. Best is trial 83 with value: 0.12218661542207429.
[I 2025-12-05 14:32:19,166] Trial 113 finished with value: 0.11674822807861591 and parameters: {'model_type': 'mlp', 'hidden_dims': '[512, 128]', 'dropout': 0.1118041387072472, 'batch_norm': True, 'lr': 0.00027332847327926174, 'weight_decay': 7.4149793338808495e-06, 'epochs': 168, 'loss': 'mae', 'optimizer': 'adam', 'graph_mode': 'off', 'use_snp_selection': True, 'num_snps': 38279}. Best is trial 83 with value: 0.12218661542207429.
[I 2025-12-05 14:32:21,244] Trial 114 finished with value: 0.1030416997408635 and parameters: {'model_type': 'mlp', 'hidden_dims': '[512, 128]', 'dropout': 0.19985819064581983, 'batch_norm': True, 'lr': 0.00027750125194163713, 'weight_decay': 5.476566108283269e-06, 'epochs': 178, 'loss': 'mae', 'optimizer': 'adam', 'graph_mode': 'off', 'use_snp_selection': True, 'num_snps': 36989}. Best is trial 83 with value: 0.12218661542207429.
[I 2025-12-05 14:32:23,488] Trial 115 finished with value: 0.10825361553846197 and parameters: {'model_type': 'mlp', 'hidden_dims': '[512, 128]', 'dropout': 0.24465076756225557, 'batch_norm': True, 'lr': 0.00017851087496303995, 'weight_decay': 6.8420716699075904e-06, 'epochs': 217, 'loss': 'mae', 'optimizer': 'adam', 'graph_mode': 'off', 'use_snp_selection': True, 'num_snps': 39059}. Best is trial 83 with value: 0.12218661542207429.
[I 2025-12-05 14:32:25,184] Trial 116 finished with value: 0.07757726864157767 and parameters: {'model_type': 'mlp', 'hidden_dims': '[512, 128]', 'dropout': 0.17771147261375156, 'batch_norm': True, 'lr': 0.00014624375228436054, 'weight_decay': 3.020700551039219e-05, 'epochs': 161, 'loss': 'mae', 'optimizer': 'adam', 'graph_mode': 'off', 'use_snp_selection': True, 'num_snps': 28978}. Best is trial 83 with value: 0.12218661542207429.
[I 2025-12-05 14:32:27,704] Trial 117 finished with value: 0.11946945028946712 and parameters: {'model_type': 'mlp', 'hidden_dims': '[256, 128]', 'dropout': 0.10615970703717911, 'batch_norm': True, 'lr': 0.00041134335772271787, 'weight_decay': 3.972825920594254e-06, 'epochs': 235, 'loss': 'mae', 'optimizer': 'adam', 'graph_mode': 'off', 'use_snp_selection': True, 'num_snps': 53249}. Best is trial 83 with value: 0.12218661542207429.
[I 2025-12-05 14:32:30,084] Trial 118 finished with value: 0.08125859034866906 and parameters: {'model_type': 'mlp', 'hidden_dims': '[256, 128]', 'dropout': 0.10896361511521066, 'batch_norm': True, 'lr': 0.00010161267966627205, 'weight_decay': 2.057064195105521e-06, 'epochs': 190, 'loss': 'mae', 'optimizer': 'adam', 'graph_mode': 'off', 'use_snp_selection': True, 'num_snps': 51532}. Best is trial 83 with value: 0.12218661542207429.
[I 2025-12-05 14:32:32,474] Trial 119 finished with value: 0.09523106364750662 and parameters: {'model_type': 'mlp', 'hidden_dims': '[256, 128]', 'dropout': 0.12823873690109358, 'batch_norm': True, 'lr': 0.0003340790451833234, 'weight_decay': 3.763456329078509e-06, 'epochs': 168, 'loss': 'mae', 'optimizer': 'adam', 'graph_mode': 'off', 'use_snp_selection': True, 'num_snps': 52692}. Best is trial 83 with value: 0.12218661542207429.
[I 2025-12-05 14:32:34,477] Trial 120 finished with value: 0.08300052981424828 and parameters: {'model_type': 'mlp', 'hidden_dims': '[256, 128]', 'dropout': 0.10037641745961459, 'batch_norm': False, 'lr': 0.000554947370707963, 'weight_decay': 7.709447248521374e-06, 'epochs': 201, 'loss': 'mae', 'optimizer': 'adam', 'graph_mode': 'off', 'use_snp_selection': True, 'num_snps': 41322}. Best is trial 83 with value: 0.12218661542207429.
[I 2025-12-05 14:32:36,395] Trial 121 finished with value: 0.0938496186786449 and parameters: {'model_type': 'mlp', 'hidden_dims': '[256, 128]', 'dropout': 0.14439971143134728, 'batch_norm': True, 'lr': 0.00041900126476541186, 'weight_decay': 4.4501450246488465e-06, 'epochs': 243, 'loss': 'mae', 'optimizer': 'adam', 'graph_mode': 'off', 'use_snp_selection': True, 'num_snps': 35445}. Best is trial 83 with value: 0.12218661542207429.
[I 2025-12-05 14:32:38,015] Trial 122 finished with value: 0.1009268250893357 and parameters: {'model_type': 'mlp', 'hidden_dims': '[512, 256]', 'dropout': 0.12064459886189823, 'batch_norm': True, 'lr': 0.0005188718819031104, 'weight_decay': 4.069567966627292e-05, 'epochs': 236, 'loss': 'mae', 'optimizer': 'adam', 'graph_mode': 'off', 'use_snp_selection': True, 'num_snps': 24456}. Best is trial 83 with value: 0.12218661542207429.
[I 2025-12-05 14:32:41,001] Trial 123 finished with value: 0.09496983127746811 and parameters: {'model_type': 'mlp', 'hidden_dims': '[512, 128]', 'dropout': 0.16975161752485254, 'batch_norm': True, 'lr': 0.0003674762519019507, 'weight_decay': 2.4239158257205916e-06, 'epochs': 235, 'loss': 'mae', 'optimizer': 'adam', 'graph_mode': 'off', 'use_snp_selection': True, 'num_snps': 54142}. Best is trial 83 with value: 0.12218661542207429.
[I 2025-12-05 14:32:42,944] Trial 124 finished with value: 0.09127579911372223 and parameters: {'model_type': 'mlp', 'hidden_dims': '[512, 128]', 'dropout': 0.10955107979536596, 'batch_norm': True, 'lr': 0.00043649649910784124, 'weight_decay': 2.4161835833478898e-05, 'epochs': 224, 'loss': 'mae', 'optimizer': 'adam', 'graph_mode': 'off', 'use_snp_selection': True, 'num_snps': 31774}. Best is trial 83 with value: 0.12218661542207429.
[I 2025-12-05 14:32:45,497] Trial 125 finished with value: 0.11550702415352923 and parameters: {'model_type': 'mlp', 'hidden_dims': '[512, 128]', 'dropout': 0.15467444574145436, 'batch_norm': True, 'lr': 0.0007123077680988958, 'weight_decay': 1.85149596687117e-05, 'epochs': 209, 'loss': 'mae', 'optimizer': 'adam', 'graph_mode': 'off', 'use_snp_selection': True, 'num_snps': 46129}. Best is trial 83 with value: 0.12218661542207429.
[I 2025-12-05 14:32:47,655] Trial 126 finished with value: 0.09092237283892467 and parameters: {'model_type': 'mlp', 'hidden_dims': '[256, 128]', 'dropout': 0.4023996109753541, 'batch_norm': True, 'lr': 0.0007873222408727985, 'weight_decay': 1.1535699306231968e-05, 'epochs': 208, 'loss': 'mae', 'optimizer': 'adam', 'graph_mode': 'off', 'use_snp_selection': True, 'num_snps': 44537}. Best is trial 83 with value: 0.12218661542207429.
[I 2025-12-05 14:32:50,040] Trial 127 finished with value: 0.10305618119613784 and parameters: {'model_type': 'mlp', 'hidden_dims': '[512, 128]', 'dropout': 0.1275028944838622, 'batch_norm': True, 'lr': 0.0009694725529313467, 'weight_decay': 1.9275126860950497e-05, 'epochs': 194, 'loss': 'mae', 'optimizer': 'adam', 'graph_mode': 'off', 'use_snp_selection': True, 'num_snps': 42546}. Best is trial 83 with value: 0.12218661542207429.
[I 2025-12-05 14:32:52,215] Trial 128 finished with value: 0.1084923085760622 and parameters: {'model_type': 'mlp', 'hidden_dims': '[128, 64]', 'dropout': 0.14319638306529142, 'batch_norm': True, 'lr': 0.0007049789869694909, 'weight_decay': 1.6507850173488158e-05, 'epochs': 146, 'loss': 'mae', 'optimizer': 'adam', 'graph_mode': 'off', 'use_snp_selection': True, 'num_snps': 49359}. Best is trial 83 with value: 0.12218661542207429.
[I 2025-12-05 14:32:54,789] Trial 129 finished with value: 0.11432164572541675 and parameters: {'model_type': 'mlp', 'hidden_dims': '[512, 128]', 'dropout': 0.20825110055232374, 'batch_norm': True, 'lr': 0.000614135821011931, 'weight_decay': 5.0000780330689804e-05, 'epochs': 214, 'loss': 'mae', 'optimizer': 'adam', 'graph_mode': 'off', 'use_snp_selection': True, 'num_snps': 45531}. Best is trial 83 with value: 0.12218661542207429.
[I 2025-12-05 14:32:57,306] Trial 130 finished with value: 0.09278807969551395 and parameters: {'model_type': 'mlp', 'hidden_dims': '[512, 256]', 'dropout': 0.21155931223019817, 'batch_norm': True, 'lr': 0.000593075661509594, 'weight_decay': 5.638108970847995e-05, 'epochs': 210, 'loss': 'mae', 'optimizer': 'adam', 'graph_mode': 'off', 'use_snp_selection': True, 'num_snps': 44805}. Best is trial 83 with value: 0.12218661542207429.
[I 2025-12-05 14:33:00,267] Trial 131 finished with value: 0.12230851635635709 and parameters: {'model_type': 'mlp', 'hidden_dims': '[512, 128]', 'dropout': 0.19481912902816265, 'batch_norm': True, 'lr': 0.0006088982678012741, 'weight_decay': 4.9589225305323e-05, 'epochs': 216, 'loss': 'mae', 'optimizer': 'adam', 'graph_mode': 'off', 'use_snp_selection': True, 'num_snps': 54938}. Best is trial 131 with value: 0.12230851635635709.
[I 2025-12-05 14:33:03,196] Trial 132 finished with value: 0.0815833844780358 and parameters: {'model_type': 'mlp', 'hidden_dims': '[512, 128]', 'dropout': 0.23219654869781045, 'batch_norm': True, 'lr': 0.0006266571844281902, 'weight_decay': 7.888160900751099e-05, 'epochs': 202, 'loss': 'mae', 'optimizer': 'adam', 'graph_mode': 'off', 'use_snp_selection': True, 'num_snps': 55393}. Best is trial 131 with value: 0.12230851635635709.
[I 2025-12-05 14:33:05,918] Trial 133 finished with value: 0.09077311603475614 and parameters: {'model_type': 'mlp', 'hidden_dims': '[512, 128]', 'dropout': 0.19380830194402426, 'batch_norm': True, 'lr': 0.0005083051671716265, 'weight_decay': 0.00010448487918090004, 'epochs': 215, 'loss': 'mae', 'optimizer': 'adam', 'graph_mode': 'off', 'use_snp_selection': True, 'num_snps': 49560}. Best is trial 131 with value: 0.12230851635635709.
[I 2025-12-05 14:33:08,786] Trial 134 finished with value: 0.11108981559325741 and parameters: {'model_type': 'mlp', 'hidden_dims': '[512, 128]', 'dropout': 0.20354127637653768, 'batch_norm': True, 'lr': 0.0008277305287667892, 'weight_decay': 4.6555031124394705e-05, 'epochs': 183, 'loss': 'mae', 'optimizer': 'adam', 'graph_mode': 'off', 'use_snp_selection': True, 'num_snps': 55464}. Best is trial 131 with value: 0.12230851635635709.
[I 2025-12-05 14:33:11,103] Trial 135 finished with value: 0.10663964301982416 and parameters: {'model_type': 'mlp', 'hidden_dims': '[512, 128]', 'dropout': 0.18055212395081768, 'batch_norm': True, 'lr': 0.0007634340076668892, 'weight_decay': 0.000177523603293364, 'epochs': 227, 'loss': 'mae', 'optimizer': 'adam', 'graph_mode': 'off', 'use_snp_selection': True, 'num_snps': 39837}. Best is trial 131 with value: 0.12230851635635709.
[I 2025-12-05 14:33:12,980] Trial 136 finished with value: 0.09917043166129767 and parameters: {'model_type': 'mlp', 'hidden_dims': '[256, 128, 64]', 'dropout': 0.16815748104509343, 'batch_norm': True, 'lr': 0.0005846355706352581, 'weight_decay': 5.215247403776389e-05, 'epochs': 197, 'loss': 'mse', 'optimizer': 'adam', 'graph_mode': 'off', 'use_snp_selection': True, 'num_snps': 34472}. Best is trial 131 with value: 0.12230851635635709.
[I 2025-12-05 14:33:16,155] Trial 137 finished with value: 0.09062595664880706 and parameters: {'model_type': 'mlp', 'hidden_dims': '[512, 64]', 'dropout': 0.18744175377015362, 'batch_norm': True, 'lr': 0.0006985309810512867, 'weight_decay': 3.8378320641739225e-05, 'epochs': 221, 'loss': 'mae', 'optimizer': 'adam', 'graph_mode': 'off', 'use_snp_selection': True, 'num_snps': 59568}. Best is trial 131 with value: 0.12230851635635709.
[I 2025-12-05 14:33:18,721] Trial 138 finished with value: 0.03705259504399197 and parameters: {'model_type': 'mlp', 'hidden_dims': '[512, 128]', 'dropout': 0.15371275712033916, 'batch_norm': True, 'lr': 9.068691290460915e-06, 'weight_decay': 2.5536756539234434e-05, 'epochs': 215, 'loss': 'mae', 'optimizer': 'adam', 'graph_mode': 'off', 'use_snp_selection': True, 'num_snps': 46032}. Best is trial 131 with value: 0.12230851635635709.
[I 2025-12-05 14:33:21,626] Trial 139 finished with value: 0.10510736063258842 and parameters: {'model_type': 'mlp', 'hidden_dims': '[512, 128]', 'dropout': 0.21207954870520346, 'batch_norm': True, 'lr': 0.0004801694313740486, 'weight_decay': 0.0001242769742828146, 'epochs': 257, 'loss': 'mae', 'optimizer': 'adam', 'graph_mode': 'off', 'use_snp_selection': True, 'num_snps': 50406}. Best is trial 131 with value: 0.12230851635635709.
[I 2025-12-05 14:33:24,777] Trial 140 finished with value: 0.10009448054332391 and parameters: {'model_type': 'mlp', 'hidden_dims': '[512, 128]', 'dropout': 0.2285725554829059, 'batch_norm': True, 'lr': 0.0003939691023857368, 'weight_decay': 8.994121061748924e-07, 'epochs': 245, 'loss': 'mae', 'optimizer': 'adam', 'graph_mode': 'off', 'use_snp_selection': True, 'num_snps': 57352}. Best is trial 131 with value: 0.12230851635635709.
[I 2025-12-05 14:33:27,236] Trial 141 finished with value: 0.09674235475632441 and parameters: {'model_type': 'mlp', 'hidden_dims': '[512, 128]', 'dropout': 0.1337146219406208, 'batch_norm': True, 'lr': 0.0003115347199867104, 'weight_decay': 2.211787705197359e-05, 'epochs': 232, 'loss': 'mae', 'optimizer': 'adam', 'graph_mode': 'off', 'use_snp_selection': True, 'num_snps': 42402}. Best is trial 131 with value: 0.12230851635635709.
[I 2025-12-05 14:33:29,947] Trial 142 finished with value: 0.08129899561530579 and parameters: {'model_type': 'mlp', 'hidden_dims': '[512, 128]', 'dropout': 0.11467004493852477, 'batch_norm': True, 'lr': 0.000415608714782083, 'weight_decay': 2.9867197246437765e-06, 'epochs': 241, 'loss': 'mae', 'optimizer': 'adam', 'graph_mode': 'off', 'use_snp_selection': True, 'num_snps': 47332}. Best is trial 131 with value: 0.12230851635635709.
[I 2025-12-05 14:33:32,885] Trial 143 finished with value: 0.0765989411533884 and parameters: {'model_type': 'mlp', 'hidden_dims': '[512, 128]', 'dropout': 0.3654503012161056, 'batch_norm': True, 'lr': 0.0005879011297262306, 'weight_decay': 8.974719469665191e-05, 'epochs': 251, 'loss': 'mae', 'optimizer': 'adam', 'graph_mode': 'off', 'use_snp_selection': True, 'num_snps': 51927}. Best is trial 131 with value: 0.12230851635635709.
[I 2025-12-05 14:33:34,451] Trial 144 finished with value: 0.09154075071367075 and parameters: {'model_type': 'mlp', 'hidden_dims': '[512, 128]', 'dropout': 0.12773616489423842, 'batch_norm': True, 'lr': 0.00027936860361768806, 'weight_decay': 1.8847035985529343e-05, 'epochs': 207, 'loss': 'mae', 'optimizer': 'adam', 'graph_mode': 'off', 'use_snp_selection': False}. Best is trial 131 with value: 0.12230851635635709.
[I 2025-12-05 14:33:36,460] Trial 145 finished with value: 0.10513516661176944 and parameters: {'model_type': 'mlp', 'hidden_dims': '[512, 128]', 'dropout': 0.16199427692440346, 'batch_norm': True, 'lr': 0.00019365641909676866, 'weight_decay': 2.9407083422544305e-05, 'epochs': 223, 'loss': 'mae', 'optimizer': 'adam', 'graph_mode': 'off', 'use_snp_selection': True, 'num_snps': 33275}. Best is trial 131 with value: 0.12230851635635709.
[I 2025-12-05 14:33:38,118] Trial 146 finished with value: 0.07441991665261632 and parameters: {'model_type': 'mlp', 'hidden_dims': '[512, 128]', 'dropout': 0.250116916473375, 'batch_norm': False, 'lr': 0.00050917614980311, 'weight_decay': 9.68919246432025e-06, 'epochs': 235, 'loss': 'mae', 'optimizer': 'adam', 'graph_mode': 'off', 'use_snp_selection': False}. Best is trial 131 with value: 0.12230851635635709.
[I 2025-12-05 14:33:39,611] Trial 147 finished with value: 0.08621863528267808 and parameters: {'model_type': 'mlp', 'hidden_dims': '[512, 128]', 'dropout': 0.1374799080014169, 'batch_norm': True, 'lr': 0.0003362043366463079, 'weight_decay': 6.417776456296108e-05, 'epochs': 189, 'loss': 'mse', 'optimizer': 'adam', 'graph_mode': 'off', 'use_snp_selection': False}. Best is trial 131 with value: 0.12230851635635709.
[I 2025-12-05 14:33:41,909] Trial 148 finished with value: 0.10603715473750758 and parameters: {'model_type': 'mlp', 'hidden_dims': '[512, 256]', 'dropout': 0.10797203384767813, 'batch_norm': True, 'lr': 0.0002637664348201054, 'weight_decay': 0.00015432620389908104, 'epochs': 242, 'loss': 'mae', 'optimizer': 'adam', 'graph_mode': 'off', 'use_snp_selection': True, 'num_snps': 38305}. Best is trial 131 with value: 0.12230851635635709.
[I 2025-12-05 14:33:43,468] Trial 149 finished with value: 0.10267519604808216 and parameters: {'model_type': 'mlp', 'hidden_dims': '[512, 128]', 'dropout': 0.12181287113028572, 'batch_norm': True, 'lr': 0.0006753648586678028, 'weight_decay': 4.0449766412543515e-05, 'epochs': 202, 'loss': 'mae', 'optimizer': 'adam', 'graph_mode': 'off', 'use_snp_selection': False}. Best is trial 131 with value: 0.12230851635635709.
[I 2025-12-05 14:33:46,018] Trial 0 finished with value: 0.05975844862286504 and parameters: {'model_type': 'mlp', 'hidden_dims': '[128, 64]', 'dropout': 0.199031432379812, 'batch_norm': True, 'lr': 1.8408544111075837e-06, 'weight_decay': 5.5136510071208614e-05, 'epochs': 336, 'loss': 'mae', 'optimizer': 'adam', 'graph_mode': 'off', 'use_snp_selection': True, 'num_snps': 43862}. Best is trial 0 with value: 0.05975844862286504.
[I 2025-12-05 14:33:47,504] Trial 1 finished with value: 0.07344276351860467 and parameters: {'model_type': 'mlp', 'hidden_dims': '[256, 128]', 'dropout': 0.4370668075331726, 'batch_norm': True, 'lr': 7.133471581159139e-05, 'weight_decay': 1.128633586803549e-05, 'epochs': 242, 'loss': 'mae', 'optimizer': 'adam', 'graph_mode': 'off', 'use_snp_selection': False}. Best is trial 1 with value: 0.07344276351860467.
[I 2025-12-05 14:33:48,822] Trial 2 finished with value: 0.029431950172252468 and parameters: {'model_type': 'mlp', 'hidden_dims': '[256, 128, 64]', 'dropout': 0.41314357415569625, 'batch_norm': False, 'lr': 3.952233718592101e-06, 'weight_decay': 0.00026754769258252603, 'epochs': 149, 'loss': 'mse', 'optimizer': 'adam', 'graph_mode': 'off', 'use_snp_selection': True, 'num_snps': 11571}. Best is trial 1 with value: 0.07344276351860467.
[I 2025-12-05 14:33:51,905] Trial 3 finished with value: 0.07816168485345436 and parameters: {'model_type': 'mlp', 'hidden_dims': '[512, 64]', 'dropout': 0.5938127374509361, 'batch_norm': False, 'lr': 5.67704586114731e-06, 'weight_decay': 2.4518087630137052e-05, 'epochs': 320, 'loss': 'mae', 'optimizer': 'adam', 'graph_mode': 'off', 'use_snp_selection': False}. Best is trial 3 with value: 0.07816168485345436.
[I 2025-12-05 14:33:54,978] Trial 4 finished with value: 0.06548957580743546 and parameters: {'model_type': 'mlp', 'hidden_dims': '[512, 128]', 'dropout': 0.25746343592134413, 'batch_norm': True, 'lr': 1.3467657668402788e-06, 'weight_decay': 0.00033087251918647806, 'epochs': 277, 'loss': 'mse', 'optimizer': 'adam', 'graph_mode': 'off', 'use_snp_selection': True, 'num_snps': 36675}. Best is trial 3 with value: 0.07816168485345436.
[I 2025-12-05 14:33:57,297] Trial 5 finished with value: 0.01470342778305526 and parameters: {'model_type': 'mlp', 'hidden_dims': '[512, 64]', 'dropout': 0.38275350994408375, 'batch_norm': True, 'lr': 1.5586664309232824e-06, 'weight_decay': 0.0008227664668621182, 'epochs': 145, 'loss': 'mae', 'optimizer': 'adam', 'graph_mode': 'off', 'use_snp_selection': True, 'num_snps': 32148}. Best is trial 3 with value: 0.07816168485345436.
[I 2025-12-05 14:33:58,618] Trial 6 finished with value: 0.10447235252636494 and parameters: {'model_type': 'mlp', 'hidden_dims': '[256, 128]', 'dropout': 0.3930109900265879, 'batch_norm': False, 'lr': 4.892964372128395e-05, 'weight_decay': 1.5809549317992182e-06, 'epochs': 199, 'loss': 'mse', 'optimizer': 'adam', 'graph_mode': 'off', 'use_snp_selection': False}. Best is trial 6 with value: 0.10447235252636494.
[I 2025-12-05 14:34:00,076] Trial 7 finished with value: 0.07643428108528409 and parameters: {'model_type': 'mlp', 'hidden_dims': '[512, 256]', 'dropout': 0.15343979219678458, 'batch_norm': True, 'lr': 6.234003099047341e-05, 'weight_decay': 3.894760610535477e-07, 'epochs': 97, 'loss': 'mse', 'optimizer': 'adam', 'graph_mode': 'off', 'use_snp_selection': False}. Best is trial 6 with value: 0.10447235252636494.
[I 2025-12-05 14:34:03,124] Trial 8 finished with value: 0.07582680058066565 and parameters: {'model_type': 'mlp', 'hidden_dims': '[512, 128]', 'dropout': 0.10743001231661406, 'batch_norm': True, 'lr': 0.00023728538449271062, 'weight_decay': 1.7629071578048637e-05, 'epochs': 312, 'loss': 'mae', 'optimizer': 'adam', 'graph_mode': 'off', 'use_snp_selection': False}. Best is trial 6 with value: 0.10447235252636494.
[I 2025-12-05 14:34:05,160] Trial 9 finished with value: 0.06445238486189858 and parameters: {'model_type': 'mlp', 'hidden_dims': '[512, 64]', 'dropout': 0.14505336736221927, 'batch_norm': True, 'lr': 5.8619638388111826e-05, 'weight_decay': 6.200156172669308e-07, 'epochs': 175, 'loss': 'mse', 'optimizer': 'adam', 'graph_mode': 'off', 'use_snp_selection': False}. Best is trial 6 with value: 0.10447235252636494.
[I 2025-12-05 14:34:05,956] Trial 10 finished with value: 0.03212491533269127 and parameters: {'model_type': 'mlp', 'hidden_dims': '[256, 128]', 'dropout': 0.5267360651501256, 'batch_norm': False, 'lr': 0.00032393778075602147, 'weight_decay': 1.936962886850364e-06, 'epochs': 46, 'loss': 'mse', 'optimizer': 'adam', 'graph_mode': 'off', 'use_snp_selection': False}. Best is trial 6 with value: 0.10447235252636494.
