[I 2025-12-06 01:41:53,211] Trial 75 finished with value: 0.23576928203533068 and parameters: {'model_type': 'mlp', 'hidden_dims': '[256, 128, 64]', 'dropout': 0.19651999700510298, 'batch_norm': False, 'lr': 8.30857263364897e-06, 'weight_decay': 9.121616266691156e-06, 'epochs': 299, 'loss': 'mae', 'optimizer': 'adam', 'graph_mode': 'off', 'use_snp_selection': False}. Best is trial 44 with value: 0.24707068504388907.
[I 2025-12-06 01:42:08,071] Trial 76 finished with value: 0.10932192860497092 and parameters: {'model_type': 'mlp', 'hidden_dims': '[512, 256]', 'dropout': 0.5383447760571782, 'batch_norm': True, 'lr': 2.4106714932177915e-06, 'weight_decay': 5.244881502219013e-07, 'epochs': 40, 'loss': 'mae', 'optimizer': 'adam', 'graph_mode': 'off', 'use_snp_selection': False}. Best is trial 44 with value: 0.24707068504388907.
[I 2025-12-06 01:43:21,969] Trial 77 finished with value: 0.24292608003445934 and parameters: {'model_type': 'mlp', 'hidden_dims': '[512, 64]', 'dropout': 0.48647573888205475, 'batch_norm': False, 'lr': 4.416870840451763e-06, 'weight_decay': 1.870954875520475e-05, 'epochs': 324, 'loss': 'mae', 'optimizer': 'adam', 'graph_mode': 'off', 'use_snp_selection': False}. Best is trial 44 with value: 0.24707068504388907.
[I 2025-12-06 01:43:47,545] Trial 78 finished with value: 0.1766965480001209 and parameters: {'model_type': 'mlp', 'hidden_dims': '[512, 64]', 'dropout': 0.48836719864359923, 'batch_norm': False, 'lr': 4.568060061293078e-06, 'weight_decay': 1.6479344719323032e-05, 'epochs': 324, 'loss': 'mae', 'optimizer': 'adam', 'graph_mode': 'off', 'use_snp_selection': True, 'num_snps': 2246}. Best is trial 44 with value: 0.24707068504388907.
[I 2025-12-06 01:44:37,524] Trial 79 finished with value: 0.22300892007535794 and parameters: {'model_type': 'mlp', 'hidden_dims': '[512, 64]', 'dropout': 0.474908579535701, 'batch_norm': False, 'lr': 3.563392068291381e-06, 'weight_decay': 1.1469837810023104e-05, 'epochs': 210, 'loss': 'mse', 'optimizer': 'adam', 'graph_mode': 'off', 'use_snp_selection': False}. Best is trial 44 with value: 0.24707068504388907.
[I 2025-12-06 01:45:02,437] Trial 80 finished with value: 0.21011122551074557 and parameters: {'model_type': 'mlp', 'hidden_dims': '[512, 64]', 'dropout': 0.5034969779363972, 'batch_norm': False, 'lr': 2.7921771908682577e-06, 'weight_decay': 8.334134036614576e-06, 'epochs': 89, 'loss': 'mae', 'optimizer': 'adam', 'graph_mode': 'off', 'use_snp_selection': False}. Best is trial 44 with value: 0.24707068504388907.
[I 2025-12-06 01:46:19,823] Trial 81 finished with value: 0.23582992499889235 and parameters: {'model_type': 'mlp', 'hidden_dims': '[512, 64]', 'dropout': 0.44982313605867813, 'batch_norm': False, 'lr': 6.0147701277289686e-06, 'weight_decay': 8.98473162163025e-05, 'epochs': 339, 'loss': 'mae', 'optimizer': 'adam', 'graph_mode': 'off', 'use_snp_selection': False}. Best is trial 44 with value: 0.24707068504388907.
[I 2025-12-06 01:47:35,405] Trial 82 finished with value: 0.22414248714050178 and parameters: {'model_type': 'mlp', 'hidden_dims': '[512, 64]', 'dropout': 0.5103091062351028, 'batch_norm': False, 'lr': 4.836661057604871e-06, 'weight_decay': 3.163440414395856e-05, 'epochs': 330, 'loss': 'mae', 'optimizer': 'adam', 'graph_mode': 'off', 'use_snp_selection': False}. Best is trial 44 with value: 0.24707068504388907.
[I 2025-12-06 01:48:47,117] Trial 83 finished with value: 0.2248921291276448 and parameters: {'model_type': 'mlp', 'hidden_dims': '[512, 64]', 'dropout': 0.5827549720785709, 'batch_norm': False, 'lr': 1.4636670680165828e-05, 'weight_decay': 2.1942715541893347e-05, 'epochs': 315, 'loss': 'mae', 'optimizer': 'adam', 'graph_mode': 'off', 'use_snp_selection': False}. Best is trial 44 with value: 0.24707068504388907.
[I 2025-12-06 01:50:04,318] Trial 84 finished with value: 0.2281529421124814 and parameters: {'model_type': 'mlp', 'hidden_dims': '[512, 64]', 'dropout': 0.4671359378785857, 'batch_norm': False, 'lr': 7.818700294686891e-06, 'weight_decay': 6.4087646858729785e-06, 'epochs': 339, 'loss': 'mae', 'optimizer': 'adam', 'graph_mode': 'off', 'use_snp_selection': False}. Best is trial 44 with value: 0.24707068504388907.
[I 2025-12-06 01:50:45,803] Trial 85 finished with value: 0.23919434012954827 and parameters: {'model_type': 'mlp', 'hidden_dims': '[256, 128]', 'dropout': 0.5600591054314213, 'batch_norm': False, 'lr': 4.112054071406764e-06, 'weight_decay': 3.4940472511771416e-06, 'epochs': 331, 'loss': 'mae', 'optimizer': 'adam', 'graph_mode': 'off', 'use_snp_selection': False}. Best is trial 44 with value: 0.24707068504388907.
[I 2025-12-06 01:51:58,335] Trial 86 finished with value: 0.23447704562826388 and parameters: {'model_type': 'mlp', 'hidden_dims': '[512, 128]', 'dropout': 0.41361642321268294, 'batch_norm': False, 'lr': 1.9981571285073444e-05, 'weight_decay': 1.3388360281329053e-05, 'epochs': 320, 'loss': 'mae', 'optimizer': 'adam', 'graph_mode': 'off', 'use_snp_selection': False}. Best is trial 44 with value: 0.24707068504388907.
[I 2025-12-06 01:53:18,708] Trial 87 finished with value: 0.19510643115622073 and parameters: {'model_type': 'mlp', 'hidden_dims': '[512, 64]', 'dropout': 0.5459557845019085, 'batch_norm': True, 'lr': 9.070724148159625e-06, 'weight_decay': 0.00038965411896519855, 'epochs': 350, 'loss': 'mae', 'optimizer': 'adam', 'graph_mode': 'off', 'use_snp_selection': False}. Best is trial 44 with value: 0.24707068504388907.
[I 2025-12-06 01:53:39,001] Trial 88 finished with value: 0.23140186825587858 and parameters: {'model_type': 'mlp', 'hidden_dims': '[128, 64]', 'dropout': 0.5254975904033014, 'batch_norm': False, 'lr': 2.0984785349902355e-06, 'weight_decay': 4.689751556144461e-06, 'epochs': 307, 'loss': 'mae', 'optimizer': 'adam', 'graph_mode': 'off', 'use_snp_selection': False}. Best is trial 44 with value: 0.24707068504388907.
[I 2025-12-06 01:54:35,513] Trial 89 finished with value: 0.2328260554761954 and parameters: {'model_type': 'mlp', 'hidden_dims': '[256, 128, 64]', 'dropout': 0.49058062644941136, 'batch_norm': False, 'lr': 2.6756319925994243e-06, 'weight_decay': 1.9198317508736003e-05, 'epochs': 282, 'loss': 'mae', 'optimizer': 'adam', 'graph_mode': 'off', 'use_snp_selection': True, 'num_snps': 45058}. Best is trial 44 with value: 0.24707068504388907.
[I 2025-12-06 01:55:52,714] Trial 90 finished with value: 0.23063407720063994 and parameters: {'model_type': 'mlp', 'hidden_dims': '[512, 64]', 'dropout': 0.5345176959139816, 'batch_norm': False, 'lr': 1.1564931790530559e-05, 'weight_decay': 5.0324113160018615e-05, 'epochs': 341, 'loss': 'mae', 'optimizer': 'adam', 'graph_mode': 'off', 'use_snp_selection': False}. Best is trial 44 with value: 0.24707068504388907.
[I 2025-12-06 01:56:59,648] Trial 91 finished with value: 0.23140631845503928 and parameters: {'model_type': 'mlp', 'hidden_dims': '[512, 64]', 'dropout': 0.5098534120566462, 'batch_norm': False, 'lr': 1.3398528901112364e-05, 'weight_decay': 4.108085568808289e-05, 'epochs': 291, 'loss': 'mae', 'optimizer': 'adam', 'graph_mode': 'off', 'use_snp_selection': False}. Best is trial 44 with value: 0.24707068504388907.
[I 2025-12-06 01:57:54,977] Trial 92 finished with value: 0.23523916877055945 and parameters: {'model_type': 'mlp', 'hidden_dims': '[512, 64]', 'dropout': 0.3371861535730329, 'batch_norm': False, 'lr': 6.669201988230919e-06, 'weight_decay': 0.00010341718609661349, 'epochs': 233, 'loss': 'mae', 'optimizer': 'adam', 'graph_mode': 'off', 'use_snp_selection': False}. Best is trial 44 with value: 0.24707068504388907.
[I 2025-12-06 01:58:30,760] Trial 93 finished with value: 0.23849648728299516 and parameters: {'model_type': 'mlp', 'hidden_dims': '[512, 64]', 'dropout': 0.5726710591381078, 'batch_norm': False, 'lr': 3.4209063586354608e-06, 'weight_decay': 0.00015872243091647788, 'epochs': 140, 'loss': 'mae', 'optimizer': 'adam', 'graph_mode': 'off', 'use_snp_selection': False}. Best is trial 44 with value: 0.24707068504388907.
[I 2025-12-06 01:59:33,551] Trial 94 finished with value: 0.23212777894035908 and parameters: {'model_type': 'mlp', 'hidden_dims': '[512, 64]', 'dropout': 0.4717622865950504, 'batch_norm': False, 'lr': 2.6654799997024225e-05, 'weight_decay': 1.04570729092208e-05, 'epochs': 273, 'loss': 'mae', 'optimizer': 'adam', 'graph_mode': 'off', 'use_snp_selection': False}. Best is trial 44 with value: 0.24707068504388907.
[I 2025-12-06 02:00:35,165] Trial 95 finished with value: 0.20887236780767457 and parameters: {'model_type': 'mlp', 'hidden_dims': '[512, 64]', 'dropout': 0.10796406843787018, 'batch_norm': False, 'lr': 1.0013060924044717e-05, 'weight_decay': 7.986571874150172e-05, 'epochs': 263, 'loss': 'mse', 'optimizer': 'adam', 'graph_mode': 'off', 'use_snp_selection': False}. Best is trial 44 with value: 0.24707068504388907.
[I 2025-12-06 02:01:07,775] Trial 96 finished with value: 0.24919812745278708 and parameters: {'model_type': 'mlp', 'hidden_dims': '[256, 128, 64]', 'dropout': 0.5875588369206035, 'batch_norm': False, 'lr': 5.3671706653410805e-06, 'weight_decay': 5.8448314828143075e-05, 'epochs': 248, 'loss': 'mae', 'optimizer': 'adam', 'graph_mode': 'off', 'use_snp_selection': False}. Best is trial 96 with value: 0.24919812745278708.
[I 2025-12-06 02:01:49,500] Trial 97 finished with value: 0.24411549802347068 and parameters: {'model_type': 'mlp', 'hidden_dims': '[256, 128, 64]', 'dropout': 0.5894602834662175, 'batch_norm': False, 'lr': 5.217057048765486e-06, 'weight_decay': 5.868086863154159e-05, 'epochs': 332, 'loss': 'mae', 'optimizer': 'adam', 'graph_mode': 'off', 'use_snp_selection': False}. Best is trial 96 with value: 0.24919812745278708.
[I 2025-12-06 02:02:28,933] Trial 98 finished with value: 0.21726888599315353 and parameters: {'model_type': 'mlp', 'hidden_dims': '[256, 128, 64]', 'dropout': 0.5914468609990062, 'batch_norm': False, 'lr': 4.8039019032265835e-06, 'weight_decay': 2.7985271226258328e-05, 'epochs': 311, 'loss': 'mae', 'optimizer': 'adam', 'graph_mode': 'off', 'use_snp_selection': False}. Best is trial 96 with value: 0.24919812745278708.
[I 2025-12-06 02:03:01,460] Trial 99 finished with value: 0.22464403232019325 and parameters: {'model_type': 'mlp', 'hidden_dims': '[256, 128, 64]', 'dropout': 0.5992685921175055, 'batch_norm': False, 'lr': 4.272447911168686e-06, 'weight_decay': 5.6279055139966806e-05, 'epochs': 248, 'loss': 'mae', 'optimizer': 'adam', 'graph_mode': 'off', 'use_snp_selection': False}. Best is trial 96 with value: 0.24919812745278708.
[I 2025-12-06 02:03:42,785] Trial 100 finished with value: 0.20314097038239126 and parameters: {'model_type': 'mlp', 'hidden_dims': '[256, 128, 64]', 'dropout': 0.5887772737211459, 'batch_norm': True, 'lr': 5.63825306666416e-06, 'weight_decay': 3.6525640212581605e-05, 'epochs': 323, 'loss': 'mae', 'optimizer': 'adam', 'graph_mode': 'off', 'use_snp_selection': False}. Best is trial 96 with value: 0.24919812745278708.
[I 2025-12-06 02:04:24,417] Trial 101 finished with value: 0.23090873957259966 and parameters: {'model_type': 'mlp', 'hidden_dims': '[256, 128, 64]', 'dropout': 0.5752964114704153, 'batch_norm': False, 'lr': 7.806193715193318e-06, 'weight_decay': 0.00011417468486502165, 'epochs': 332, 'loss': 'mae', 'optimizer': 'adam', 'graph_mode': 'off', 'use_snp_selection': False}. Best is trial 96 with value: 0.24919812745278708.
[I 2025-12-06 02:05:07,309] Trial 102 finished with value: 0.2439679939631167 and parameters: {'model_type': 'mlp', 'hidden_dims': '[256, 128, 64]', 'dropout': 0.5581122348092328, 'batch_norm': False, 'lr': 5.398834503287048e-06, 'weight_decay': 6.534276177807762e-05, 'epochs': 343, 'loss': 'mae', 'optimizer': 'adam', 'graph_mode': 'off', 'use_snp_selection': False}. Best is trial 96 with value: 0.24919812745278708.
[I 2025-12-06 02:05:36,706] Trial 103 finished with value: 0.23456732161600208 and parameters: {'model_type': 'mlp', 'hidden_dims': '[256, 128, 64]', 'dropout': 0.5662366583202244, 'batch_norm': False, 'lr': 3.7438302885937458e-06, 'weight_decay': 5.996273129456072e-05, 'epochs': 219, 'loss': 'mae', 'optimizer': 'adam', 'graph_mode': 'off', 'use_snp_selection': False}. Best is trial 96 with value: 0.24919812745278708.
[I 2025-12-06 02:06:19,635] Trial 104 finished with value: 0.242563099251104 and parameters: {'model_type': 'mlp', 'hidden_dims': '[256, 128, 64]', 'dropout': 0.5468806759938831, 'batch_norm': False, 'lr': 5.1823979291971776e-06, 'weight_decay': 1.4665859193898743e-05, 'epochs': 343, 'loss': 'mae', 'optimizer': 'adam', 'graph_mode': 'off', 'use_snp_selection': False}. Best is trial 96 with value: 0.24919812745278708.
[I 2025-12-06 02:06:59,953] Trial 105 finished with value: 0.23511519166787406 and parameters: {'model_type': 'mlp', 'hidden_dims': '[256, 128, 64]', 'dropout': 0.440278864786423, 'batch_norm': False, 'lr': 3.2644126832050535e-06, 'weight_decay': 7.785971173339006e-06, 'epochs': 318, 'loss': 'mae', 'optimizer': 'adam', 'graph_mode': 'off', 'use_snp_selection': False}. Best is trial 96 with value: 0.24919812745278708.
[I 2025-12-06 02:08:09,938] Trial 106 finished with value: 0.24926995518454506 and parameters: {'model_type': 'mlp', 'hidden_dims': '[512, 256]', 'dropout': 0.5895161155041723, 'batch_norm': False, 'lr': 2.5946449083455703e-06, 'weight_decay': 1.9235822728530233e-06, 'epochs': 303, 'loss': 'mae', 'optimizer': 'adam', 'graph_mode': 'off', 'use_snp_selection': False}. Best is trial 106 with value: 0.24926995518454506.
[I 2025-12-06 02:09:18,894] Trial 107 finished with value: 0.22574731553123026 and parameters: {'model_type': 'mlp', 'hidden_dims': '[512, 256]', 'dropout': 0.5853378677338633, 'batch_norm': False, 'lr': 1.6458479739771434e-06, 'weight_decay': 2.4587660957535777e-06, 'epochs': 298, 'loss': 'mae', 'optimizer': 'adam', 'graph_mode': 'off', 'use_snp_selection': False}. Best is trial 106 with value: 0.24926995518454506.
[I 2025-12-06 02:09:54,975] Trial 108 finished with value: 0.2068081353232954 and parameters: {'model_type': 'mlp', 'hidden_dims': '[512, 256]', 'dropout': 0.5767763884445268, 'batch_norm': False, 'lr': 3.965237800451633e-06, 'weight_decay': 7.476519652554465e-05, 'epochs': 287, 'loss': 'mae', 'optimizer': 'adam', 'graph_mode': 'off', 'use_snp_selection': True, 'num_snps': 11322}. Best is trial 106 with value: 0.24926995518454506.
[I 2025-12-06 02:11:02,440] Trial 109 finished with value: 0.21827321896661664 and parameters: {'model_type': 'mlp', 'hidden_dims': '[512, 256]', 'dropout': 0.5519463095163282, 'batch_norm': False, 'lr': 0.00037610220606246186, 'weight_decay': 1.6375126425674078e-06, 'epochs': 300, 'loss': 'mae', 'optimizer': 'adam', 'graph_mode': 'off', 'use_snp_selection': False}. Best is trial 106 with value: 0.24926995518454506.
[I 2025-12-06 02:12:17,420] Trial 110 finished with value: 0.21152598348082802 and parameters: {'model_type': 'mlp', 'hidden_dims': '[512, 256]', 'dropout': 0.5877165628768496, 'batch_norm': False, 'lr': 6.207021380994898e-06, 'weight_decay': 9.172450087696051e-07, 'epochs': 326, 'loss': 'mse', 'optimizer': 'adam', 'graph_mode': 'off', 'use_snp_selection': False}. Best is trial 106 with value: 0.24926995518454506.
[I 2025-12-06 02:13:00,623] Trial 111 finished with value: 0.23348958831618255 and parameters: {'model_type': 'mlp', 'hidden_dims': '[256, 128, 64]', 'dropout': 0.5653947698848527, 'batch_norm': False, 'lr': 2.434381082560084e-06, 'weight_decay': 3.285184410826054e-06, 'epochs': 344, 'loss': 'mae', 'optimizer': 'adam', 'graph_mode': 'off', 'use_snp_selection': False}. Best is trial 106 with value: 0.24926995518454506.
[I 2025-12-06 02:13:42,673] Trial 112 finished with value: 0.23260466449190947 and parameters: {'model_type': 'mlp', 'hidden_dims': '[256, 128, 64]', 'dropout': 0.42357355341394726, 'batch_norm': False, 'lr': 2.044312148598976e-06, 'weight_decay': 5.988943462522162e-06, 'epochs': 333, 'loss': 'mae', 'optimizer': 'adam', 'graph_mode': 'off', 'use_snp_selection': False}. Best is trial 106 with value: 0.24926995518454506.
[I 2025-12-06 02:14:21,467] Trial 113 finished with value: 0.23193041726639793 and parameters: {'model_type': 'mlp', 'hidden_dims': '[256, 128]', 'dropout': 0.4551685182199759, 'batch_norm': False, 'lr': 2.776461773022606e-06, 'weight_decay': 2.105175677096297e-06, 'epochs': 306, 'loss': 'mae', 'optimizer': 'adam', 'graph_mode': 'off', 'use_snp_selection': False}. Best is trial 106 with value: 0.24926995518454506.
[I 2025-12-06 02:15:35,152] Trial 114 finished with value: 0.24218965178287588 and parameters: {'model_type': 'mlp', 'hidden_dims': '[512, 128]', 'dropout': 0.5994945800534877, 'batch_norm': False, 'lr': 5.320221199395082e-06, 'weight_decay': 2.4869756769698392e-05, 'epochs': 322, 'loss': 'mae', 'optimizer': 'adam', 'graph_mode': 'off', 'use_snp_selection': False}. Best is trial 106 with value: 0.24926995518454506.
[I 2025-12-06 02:15:51,661] Trial 115 finished with value: 0.21601963668302626 and parameters: {'model_type': 'mlp', 'hidden_dims': '[512, 256]', 'dropout': 0.3870233662775457, 'batch_norm': False, 'lr': 7.457393050271114e-06, 'weight_decay': 1.0293110462733473e-07, 'epochs': 48, 'loss': 'mae', 'optimizer': 'adam', 'graph_mode': 'off', 'use_snp_selection': False}. Best is trial 106 with value: 0.24926995518454506.
[I 2025-12-06 02:16:02,407] Trial 116 finished with value: 0.23400085693703376 and parameters: {'model_type': 'mlp', 'hidden_dims': '[128, 64]', 'dropout': 0.5241591436289615, 'batch_norm': False, 'lr': 4.384284804444282e-06, 'weight_decay': 1.7641968632830604e-05, 'epochs': 119, 'loss': 'mae', 'optimizer': 'adam', 'graph_mode': 'off', 'use_snp_selection': False}. Best is trial 106 with value: 0.24926995518454506.
[I 2025-12-06 02:16:44,215] Trial 117 finished with value: 0.23350477156212995 and parameters: {'model_type': 'mlp', 'hidden_dims': '[256, 128, 64]', 'dropout': 0.5404674830816671, 'batch_norm': False, 'lr': 3.2602111324983407e-06, 'weight_decay': 4.325788826356015e-06, 'epochs': 333, 'loss': 'mae', 'optimizer': 'adam', 'graph_mode': 'off', 'use_snp_selection': False}. Best is trial 106 with value: 0.24926995518454506.
[I 2025-12-06 02:18:02,084] Trial 118 finished with value: 0.2396775849635388 and parameters: {'model_type': 'mlp', 'hidden_dims': '[512, 64]', 'dropout': 0.5659080454369072, 'batch_norm': False, 'lr': 8.40891291431208e-06, 'weight_decay': 1.4001155614792118e-06, 'epochs': 343, 'loss': 'mae', 'optimizer': 'adam', 'graph_mode': 'off', 'use_snp_selection': False}. Best is trial 106 with value: 0.24926995518454506.
[I 2025-12-06 02:19:13,924] Trial 119 finished with value: 0.23823807842743286 and parameters: {'model_type': 'mlp', 'hidden_dims': '[512, 64]', 'dropout': 0.5590099562119555, 'batch_norm': False, 'lr': 3.6449306197853374e-06, 'weight_decay': 0.00013828606361281317, 'epochs': 313, 'loss': 'mae', 'optimizer': 'adam', 'graph_mode': 'off', 'use_snp_selection': False}. Best is trial 106 with value: 0.24926995518454506.
[I 2025-12-06 02:19:58,247] Trial 120 finished with value: 0.1543530904510574 and parameters: {'model_type': 'mlp', 'hidden_dims': '[256, 128, 64]', 'dropout': 0.5808105961252393, 'batch_norm': True, 'lr': 1.3211652970170723e-06, 'weight_decay': 9.939458126177565e-06, 'epochs': 350, 'loss': 'mae', 'optimizer': 'adam', 'graph_mode': 'off', 'use_snp_selection': False}. Best is trial 106 with value: 0.24926995518454506.
[I 2025-12-06 02:20:41,349] Trial 121 finished with value: 0.23010218602654903 and parameters: {'model_type': 'mlp', 'hidden_dims': '[256, 128, 64]', 'dropout': 0.546386114167415, 'batch_norm': False, 'lr': 4.682469856278667e-06, 'weight_decay': 1.409554952684032e-05, 'epochs': 344, 'loss': 'mae', 'optimizer': 'adam', 'graph_mode': 'off', 'use_snp_selection': False}. Best is trial 106 with value: 0.24926995518454506.
[I 2025-12-06 02:21:22,639] Trial 122 finished with value: 0.22840929718989716 and parameters: {'model_type': 'mlp', 'hidden_dims': '[256, 128, 64]', 'dropout': 0.5321314481207526, 'batch_norm': False, 'lr': 5.43373383458783e-06, 'weight_decay': 5.470100748583491e-06, 'epochs': 328, 'loss': 'mae', 'optimizer': 'adam', 'graph_mode': 'off', 'use_snp_selection': False}. Best is trial 106 with value: 0.24926995518454506.
[I 2025-12-06 02:22:04,999] Trial 123 finished with value: 0.23978786429679366 and parameters: {'model_type': 'mlp', 'hidden_dims': '[256, 128, 64]', 'dropout': 0.5517080406687893, 'batch_norm': False, 'lr': 6.381851573724123e-06, 'weight_decay': 1.216895670787361e-05, 'epochs': 338, 'loss': 'mae', 'optimizer': 'adam', 'graph_mode': 'off', 'use_snp_selection': False}. Best is trial 106 with value: 0.24926995518454506.
[I 2025-12-06 02:22:44,879] Trial 124 finished with value: 0.24596950801824388 and parameters: {'model_type': 'mlp', 'hidden_dims': '[256, 128, 64]', 'dropout': 0.5749093598022132, 'batch_norm': False, 'lr': 5.493485781759631e-06, 'weight_decay': 7.073008381587769e-06, 'epochs': 316, 'loss': 'mae', 'optimizer': 'adam', 'graph_mode': 'off', 'use_snp_selection': False}. Best is trial 106 with value: 0.24926995518454506.
[I 2025-12-06 02:23:24,751] Trial 125 finished with value: 0.2282687135703279 and parameters: {'model_type': 'mlp', 'hidden_dims': '[256, 128, 64]', 'dropout': 0.5893653909972305, 'batch_norm': False, 'lr': 7.321530973386011e-06, 'weight_decay': 6.665678696603394e-06, 'epochs': 317, 'loss': 'mae', 'optimizer': 'adam', 'graph_mode': 'off', 'use_snp_selection': False}. Best is trial 106 with value: 0.24926995518454506.
[I 2025-12-06 02:24:31,266] Trial 126 finished with value: 0.23007266962996825 and parameters: {'model_type': 'mlp', 'hidden_dims': '[512, 64]', 'dropout': 0.5739874228778611, 'batch_norm': False, 'lr': 5.1469182314883965e-05, 'weight_decay': 1.8626503721396615e-06, 'epochs': 294, 'loss': 'mae', 'optimizer': 'adam', 'graph_mode': 'off', 'use_snp_selection': False}. Best is trial 106 with value: 0.24926995518454506.
