[I 2025-12-06 03:06:30,356] Trial 37 finished with value: 0.2548783017016071 and parameters: {'model_type': 'mlp', 'hidden_dims': '[512, 64]', 'dropout': 0.19359431888793072, 'batch_norm': True, 'lr': 1.8544733753179877e-06, 'weight_decay': 6.652270876431875e-06, 'epochs': 124, 'loss': 'mse', 'optimizer': 'adam', 'graph_mode': 'off', 'use_snp_selection': True, 'num_snps': 44766}. Best is trial 36 with value: 0.29946446024589535.
[I 2025-12-06 03:07:21,933] Trial 38 finished with value: 0.29840033842599983 and parameters: {'model_type': 'mlp', 'hidden_dims': '[512, 64]', 'dropout': 0.22547182911586214, 'batch_norm': False, 'lr': 5.198826293270546e-06, 'weight_decay': 1.1386726804421165e-06, 'epochs': 115, 'loss': 'mse', 'optimizer': 'adam', 'graph_mode': 'off', 'use_snp_selection': True, 'num_snps': 50037}. Best is trial 36 with value: 0.29946446024589535.
[I 2025-12-06 03:08:12,520] Trial 39 finished with value: 0.2961438644714959 and parameters: {'model_type': 'mlp', 'hidden_dims': '[512, 64]', 'dropout': 0.22827607703555813, 'batch_norm': False, 'lr': 4.304269106686427e-06, 'weight_decay': 9.993602804299036e-07, 'epochs': 110, 'loss': 'mse', 'optimizer': 'adam', 'graph_mode': 'off', 'use_snp_selection': True, 'num_snps': 49507}. Best is trial 36 with value: 0.29946446024589535.
[I 2025-12-06 03:09:01,669] Trial 40 finished with value: 0.22103983085984238 and parameters: {'model_type': 'mlp', 'hidden_dims': '[512, 64]', 'dropout': 0.16502406222071456, 'batch_norm': True, 'lr': 1.0227473947501654e-06, 'weight_decay': 8.234226966923457e-07, 'epochs': 97, 'loss': 'mse', 'optimizer': 'adam', 'graph_mode': 'off', 'use_snp_selection': True, 'num_snps': 50089}. Best is trial 36 with value: 0.29946446024589535.
[I 2025-12-06 03:09:46,547] Trial 41 finished with value: 0.29693417226829866 and parameters: {'model_type': 'mlp', 'hidden_dims': '[512, 64]', 'dropout': 0.22910316920016033, 'batch_norm': False, 'lr': 3.532495881425039e-06, 'weight_decay': 2.1623380375768881e-07, 'epochs': 120, 'loss': 'mse', 'optimizer': 'adam', 'graph_mode': 'off', 'use_snp_selection': True, 'num_snps': 38471}. Best is trial 36 with value: 0.29946446024589535.
[I 2025-12-06 03:10:32,557] Trial 42 finished with value: 0.29967360485855526 and parameters: {'model_type': 'mlp', 'hidden_dims': '[512, 64]', 'dropout': 0.23277769384349395, 'batch_norm': False, 'lr': 3.5031666380818396e-06, 'weight_decay': 1.8479535335713608e-07, 'epochs': 120, 'loss': 'mse', 'optimizer': 'adam', 'graph_mode': 'off', 'use_snp_selection': True, 'num_snps': 39799}. Best is trial 42 with value: 0.29967360485855526.
[I 2025-12-06 03:11:20,403] Trial 43 finished with value: 0.29653569821917297 and parameters: {'model_type': 'mlp', 'hidden_dims': '[512, 64]', 'dropout': 0.25038365038459315, 'batch_norm': False, 'lr': 2.283278354433631e-06, 'weight_decay': 2.1170988036396042e-07, 'epochs': 144, 'loss': 'mse', 'optimizer': 'adam', 'graph_mode': 'off', 'use_snp_selection': True, 'num_snps': 38707}. Best is trial 42 with value: 0.29967360485855526.
[I 2025-12-06 03:11:59,779] Trial 44 finished with value: 0.2790358138412411 and parameters: {'model_type': 'mlp', 'hidden_dims': '[512, 64]', 'dropout': 0.13462799800616054, 'batch_norm': False, 'lr': 1.9916133751225937e-06, 'weight_decay': 2.1169771439630426e-07, 'epochs': 74, 'loss': 'mse', 'optimizer': 'adam', 'graph_mode': 'off', 'use_snp_selection': True, 'num_snps': 36862}. Best is trial 42 with value: 0.29967360485855526.
[I 2025-12-06 03:12:40,623] Trial 45 finished with value: 0.2777649863524904 and parameters: {'model_type': 'mlp', 'hidden_dims': '[256, 128]', 'dropout': 0.20621963517166733, 'batch_norm': False, 'lr': 1.419964256409289e-06, 'weight_decay': 3.8301847591448236e-07, 'epochs': 159, 'loss': 'mse', 'optimizer': 'adam', 'graph_mode': 'off', 'use_snp_selection': True, 'num_snps': 38823}. Best is trial 42 with value: 0.29967360485855526.
[I 2025-12-06 03:13:28,604] Trial 46 finished with value: 0.2693180370793035 and parameters: {'model_type': 'mlp', 'hidden_dims': '[512, 64]', 'dropout': 0.2587556351652662, 'batch_norm': True, 'lr': 1.0836746365498864e-05, 'weight_decay': 1.0991566867587161e-07, 'epochs': 132, 'loss': 'mse', 'optimizer': 'adam', 'graph_mode': 'off', 'use_snp_selection': True, 'num_snps': 40451}. Best is trial 42 with value: 0.29967360485855526.
[I 2025-12-06 03:14:05,366] Trial 47 finished with value: 0.27814089901749683 and parameters: {'model_type': 'mlp', 'hidden_dims': '[512, 64]', 'dropout': 0.17039651113771986, 'batch_norm': False, 'lr': 2.6513564146003975e-06, 'weight_decay': 1.8299440789948218e-07, 'epochs': 77, 'loss': 'mse', 'optimizer': 'adam', 'graph_mode': 'off', 'use_snp_selection': True, 'num_snps': 30830}. Best is trial 42 with value: 0.29967360485855526.
[I 2025-12-06 03:15:05,608] Trial 48 finished with value: 0.2899715556205861 and parameters: {'model_type': 'mlp', 'hidden_dims': '[512, 64]', 'dropout': 0.1028540603286677, 'batch_norm': False, 'lr': 6.678470999442434e-06, 'weight_decay': 4.3868066527171995e-07, 'epochs': 162, 'loss': 'mse', 'optimizer': 'adam', 'graph_mode': 'off', 'use_snp_selection': True, 'num_snps': 52188}. Best is trial 42 with value: 0.29967360485855526.
[I 2025-12-06 03:15:46,703] Trial 49 finished with value: 0.27393089581228425 and parameters: {'model_type': 'mlp', 'hidden_dims': '[512, 128]', 'dropout': 0.2117686104600896, 'batch_norm': False, 'lr': 1.298831315323221e-06, 'weight_decay': 1.6723798348477108e-06, 'epochs': 118, 'loss': 'mse', 'optimizer': 'adam', 'graph_mode': 'off', 'use_snp_selection': True, 'num_snps': 31435}. Best is trial 42 with value: 0.29967360485855526.
[I 2025-12-06 03:16:25,562] Trial 50 finished with value: 0.28672950557481547 and parameters: {'model_type': 'mlp', 'hidden_dims': '[256, 128, 64]', 'dropout': 0.2622801067505077, 'batch_norm': False, 'lr': 9.965782962038137e-05, 'weight_decay': 2.2294001930288088e-07, 'epochs': 97, 'loss': 'mse', 'optimizer': 'adam', 'graph_mode': 'off', 'use_snp_selection': True, 'num_snps': 41444}. Best is trial 42 with value: 0.29967360485855526.
[I 2025-12-06 03:17:23,187] Trial 51 finished with value: 0.2972876592463186 and parameters: {'model_type': 'mlp', 'hidden_dims': '[512, 64]', 'dropout': 0.24370145055302544, 'batch_norm': False, 'lr': 3.20174665666467e-06, 'weight_decay': 1.6005401660748747e-07, 'epochs': 141, 'loss': 'mse', 'optimizer': 'adam', 'graph_mode': 'off', 'use_snp_selection': True, 'num_snps': 52603}. Best is trial 42 with value: 0.29967360485855526.
[I 2025-12-06 03:18:21,638] Trial 52 finished with value: 0.2988189700451908 and parameters: {'model_type': 'mlp', 'hidden_dims': '[512, 64]', 'dropout': 0.18155885844881975, 'batch_norm': False, 'lr': 3.547193650434837e-06, 'weight_decay': 2.9739176912221225e-07, 'epochs': 148, 'loss': 'mse', 'optimizer': 'adam', 'graph_mode': 'off', 'use_snp_selection': True, 'num_snps': 53158}. Best is trial 42 with value: 0.29967360485855526.
[I 2025-12-06 03:19:21,855] Trial 53 finished with value: 0.2952101897737041 and parameters: {'model_type': 'mlp', 'hidden_dims': '[512, 64]', 'dropout': 0.12479048096496283, 'batch_norm': False, 'lr': 3.1946115318467626e-06, 'weight_decay': 3.386277557728762e-07, 'epochs': 159, 'loss': 'mse', 'optimizer': 'adam', 'graph_mode': 'off', 'use_snp_selection': True, 'num_snps': 53496}. Best is trial 42 with value: 0.29967360485855526.
[I 2025-12-06 03:20:24,207] Trial 54 finished with value: 0.2953024835112888 and parameters: {'model_type': 'mlp', 'hidden_dims': '[512, 64]', 'dropout': 0.1848879984530631, 'batch_norm': False, 'lr': 5.062621552868033e-06, 'weight_decay': 1.4507254019623704e-07, 'epochs': 176, 'loss': 'mse', 'optimizer': 'adam', 'graph_mode': 'off', 'use_snp_selection': True, 'num_snps': 52769}. Best is trial 42 with value: 0.29967360485855526.
[I 2025-12-06 03:21:05,112] Trial 55 finished with value: 0.2908969351661731 and parameters: {'model_type': 'mlp', 'hidden_dims': '[128, 64]', 'dropout': 0.1678815226775523, 'batch_norm': False, 'lr': 3.7842713906786895e-06, 'weight_decay': 6.163762502379038e-07, 'epochs': 106, 'loss': 'mse', 'optimizer': 'adam', 'graph_mode': 'off', 'use_snp_selection': True, 'num_snps': 54732}. Best is trial 42 with value: 0.29967360485855526.
[I 2025-12-06 03:21:51,162] Trial 56 finished with value: 0.29655792187500196 and parameters: {'model_type': 'mlp', 'hidden_dims': '[512, 64]', 'dropout': 0.22056427973465612, 'batch_norm': False, 'lr': 1.093350995903171e-05, 'weight_decay': 2.7002373669269225e-07, 'epochs': 84, 'loss': 'mse', 'optimizer': 'adam', 'graph_mode': 'off', 'use_snp_selection': True, 'num_snps': 47385}. Best is trial 42 with value: 0.29967360485855526.
[I 2025-12-06 03:22:47,523] Trial 57 finished with value: 0.2608022628086562 and parameters: {'model_type': 'mlp', 'hidden_dims': '[512, 64]', 'dropout': 0.14772285623296236, 'batch_norm': True, 'lr': 5.912424538589583e-06, 'weight_decay': 1.6785900462051025e-06, 'epochs': 193, 'loss': 'mse', 'optimizer': 'adam', 'graph_mode': 'off', 'use_snp_selection': True, 'num_snps': 42200}. Best is trial 42 with value: 0.29967360485855526.
[I 2025-12-06 03:23:26,534] Trial 58 finished with value: 0.2263446933922027 and parameters: {'model_type': 'mlp', 'hidden_dims': '[256, 128]', 'dropout': 0.27571222089458164, 'batch_norm': False, 'lr': 2.7167736302867357e-06, 'weight_decay': 1.3750701742641584e-07, 'epochs': 47, 'loss': 'mse', 'optimizer': 'adam', 'graph_mode': 'off', 'use_snp_selection': True, 'num_snps': 50730}. Best is trial 42 with value: 0.29967360485855526.
[I 2025-12-06 03:24:16,959] Trial 59 finished with value: 0.29959396216424733 and parameters: {'model_type': 'mlp', 'hidden_dims': '[512, 128]', 'dropout': 0.24247476959065267, 'batch_norm': False, 'lr': 4.4978460544992005e-06, 'weight_decay': 6.029574519543222e-07, 'epochs': 131, 'loss': 'mse', 'optimizer': 'adam', 'graph_mode': 'off', 'use_snp_selection': True, 'num_snps': 44854}. Best is trial 42 with value: 0.29967360485855526.
[I 2025-12-06 03:25:10,230] Trial 60 finished with value: 0.2929642329927892 and parameters: {'model_type': 'mlp', 'hidden_dims': '[512, 128]', 'dropout': 0.17941502524238317, 'batch_norm': False, 'lr': 7.40916763449319e-06, 'weight_decay': 3.0978683646779135e-06, 'epochs': 138, 'loss': 'mse', 'optimizer': 'adam', 'graph_mode': 'off', 'use_snp_selection': True, 'num_snps': 47435}. Best is trial 42 with value: 0.29967360485855526.
[I 2025-12-06 03:25:59,236] Trial 61 finished with value: 0.29934968087487535 and parameters: {'model_type': 'mlp', 'hidden_dims': '[512, 128]', 'dropout': 0.24307113860627155, 'batch_norm': False, 'lr': 4.3864795757545916e-06, 'weight_decay': 5.525360602361617e-07, 'epochs': 126, 'loss': 'mse', 'optimizer': 'adam', 'graph_mode': 'off', 'use_snp_selection': True, 'num_snps': 43433}. Best is trial 42 with value: 0.29967360485855526.
[I 2025-12-06 03:26:52,063] Trial 62 finished with value: 0.3001575503294788 and parameters: {'model_type': 'mlp', 'hidden_dims': '[512, 128]', 'dropout': 0.24069161103106657, 'batch_norm': False, 'lr': 4.5592935690526935e-06, 'weight_decay': 9.921824942474264e-07, 'epochs': 152, 'loss': 'mse', 'optimizer': 'adam', 'graph_mode': 'off', 'use_snp_selection': True, 'num_snps': 44565}. Best is trial 62 with value: 0.3001575503294788.
[I 2025-12-06 03:27:48,621] Trial 63 finished with value: 0.29783417813860436 and parameters: {'model_type': 'mlp', 'hidden_dims': '[512, 128]', 'dropout': 0.20431745060705137, 'batch_norm': False, 'lr': 4.728050039996763e-06, 'weight_decay': 1.1366066852712725e-06, 'epochs': 167, 'loss': 'mse', 'optimizer': 'adam', 'graph_mode': 'off', 'use_snp_selection': True, 'num_snps': 46679}. Best is trial 62 with value: 0.3001575503294788.
[I 2025-12-06 03:28:37,757] Trial 64 finished with value: 0.29398723621679423 and parameters: {'model_type': 'mlp', 'hidden_dims': '[512, 128]', 'dropout': 0.30152259805221415, 'batch_norm': False, 'lr': 1.0352076545314575e-05, 'weight_decay': 5.70975603046398e-07, 'epochs': 129, 'loss': 'mse', 'optimizer': 'adam', 'graph_mode': 'off', 'use_snp_selection': True, 'num_snps': 43191}. Best is trial 62 with value: 0.3001575503294788.
[I 2025-12-06 03:29:30,251] Trial 65 finished with value: 0.29521580310250123 and parameters: {'model_type': 'mlp', 'hidden_dims': '[512, 128]', 'dropout': 0.26796166325086884, 'batch_norm': False, 'lr': 5.916934948855318e-06, 'weight_decay': 4.630362324105558e-07, 'epochs': 152, 'loss': 'mse', 'optimizer': 'adam', 'graph_mode': 'off', 'use_snp_selection': True, 'num_snps': 43517}. Best is trial 62 with value: 0.3001575503294788.
[I 2025-12-06 03:30:12,094] Trial 66 finished with value: 0.29422476134856657 and parameters: {'model_type': 'mlp', 'hidden_dims': '[512, 128]', 'dropout': 0.21162798925649645, 'batch_norm': False, 'lr': 1.5753368516912982e-05, 'weight_decay': 2.1531061704543268e-06, 'epochs': 111, 'loss': 'mse', 'optimizer': 'adam', 'graph_mode': 'off', 'use_snp_selection': True, 'num_snps': 34711}. Best is trial 62 with value: 0.3001575503294788.
[I 2025-12-06 03:31:13,749] Trial 67 finished with value: 0.2965369439635554 and parameters: {'model_type': 'mlp', 'hidden_dims': '[512, 128]', 'dropout': 0.24613988505600087, 'batch_norm': False, 'lr': 4.636892994566383e-06, 'weight_decay': 8.714639982800309e-07, 'epochs': 153, 'loss': 'mse', 'optimizer': 'adam', 'graph_mode': 'off', 'use_snp_selection': True, 'num_snps': 56481}. Best is trial 62 with value: 0.3001575503294788.
[I 2025-12-06 03:32:06,775] Trial 68 finished with value: 0.28969074042523385 and parameters: {'model_type': 'mlp', 'hidden_dims': '[512, 128]', 'dropout': 0.15623551622901602, 'batch_norm': False, 'lr': 1.9218924671818568e-06, 'weight_decay': 1.1781764048885096e-06, 'epochs': 86, 'loss': 'mse', 'optimizer': 'adam', 'graph_mode': 'off', 'use_snp_selection': True, 'num_snps': 59881}. Best is trial 62 with value: 0.3001575503294788.
[I 2025-12-06 03:33:07,731] Trial 69 finished with value: 0.29015461911661083 and parameters: {'model_type': 'mlp', 'hidden_dims': '[512, 128]', 'dropout': 0.23886641579053916, 'batch_norm': False, 'lr': 8.465083199980276e-06, 'weight_decay': 7.421334127347127e-07, 'epochs': 185, 'loss': 'mse', 'optimizer': 'adam', 'graph_mode': 'off', 'use_snp_selection': True, 'num_snps': 49111}. Best is trial 62 with value: 0.3001575503294788.
[I 2025-12-06 03:33:46,098] Trial 70 finished with value: 0.28240597607855905 and parameters: {'model_type': 'mlp', 'hidden_dims': '[512, 128]', 'dropout': 0.29330021450954935, 'batch_norm': False, 'lr': 0.000590239289244014, 'weight_decay': 2.9528132750233885e-07, 'epochs': 129, 'loss': 'mse', 'optimizer': 'adam', 'graph_mode': 'off', 'use_snp_selection': True, 'num_snps': 26903}. Best is trial 62 with value: 0.3001575503294788.
[I 2025-12-06 03:34:42,806] Trial 71 finished with value: 0.2971371810582567 and parameters: {'model_type': 'mlp', 'hidden_dims': '[512, 128]', 'dropout': 0.20660510604322255, 'batch_norm': False, 'lr': 4.509519094908638e-06, 'weight_decay': 1.3843322011505155e-06, 'epochs': 174, 'loss': 'mse', 'optimizer': 'adam', 'graph_mode': 'off', 'use_snp_selection': True, 'num_snps': 45943}. Best is trial 62 with value: 0.3001575503294788.
[I 2025-12-06 03:35:37,739] Trial 72 finished with value: 0.30060275474441334 and parameters: {'model_type': 'mlp', 'hidden_dims': '[512, 128]', 'dropout': 0.1962192717697458, 'batch_norm': False, 'lr': 3.916161450987306e-06, 'weight_decay': 4.120858962211298e-06, 'epochs': 167, 'loss': 'mse', 'optimizer': 'adam', 'graph_mode': 'off', 'use_snp_selection': True, 'num_snps': 44861}. Best is trial 72 with value: 0.30060275474441334.
[I 2025-12-06 03:36:30,251] Trial 73 finished with value: 0.29415522522006 and parameters: {'model_type': 'mlp', 'hidden_dims': '[512, 128]', 'dropout': 0.1841780097183905, 'batch_norm': False, 'lr': 2.201345068265969e-06, 'weight_decay': 3.4523834817654106e-06, 'epochs': 149, 'loss': 'mse', 'optimizer': 'adam', 'graph_mode': 'off', 'use_snp_selection': True, 'num_snps': 44626}. Best is trial 72 with value: 0.30060275474441334.
[I 2025-12-06 03:37:10,409] Trial 74 finished with value: 0.2934424160673274 and parameters: {'model_type': 'mlp', 'hidden_dims': '[128, 64]', 'dropout': 0.2241197197519559, 'batch_norm': False, 'lr': 3.90933460318588e-06, 'weight_decay': 4.415229751683154e-06, 'epochs': 135, 'loss': 'mse', 'optimizer': 'adam', 'graph_mode': 'off', 'use_snp_selection': True, 'num_snps': 49136}. Best is trial 72 with value: 0.30060275474441334.
[I 2025-12-06 03:37:49,904] Trial 75 finished with value: 0.2925087582007547 and parameters: {'model_type': 'mlp', 'hidden_dims': '[256, 128, 64]', 'dropout': 0.19683468717833746, 'batch_norm': False, 'lr': 6.570175708907005e-06, 'weight_decay': 2.3973834947280263e-06, 'epochs': 116, 'loss': 'mse', 'optimizer': 'adam', 'graph_mode': 'off', 'use_snp_selection': True, 'num_snps': 40995}. Best is trial 72 with value: 0.30060275474441334.
[I 2025-12-06 03:38:14,799] Trial 76 finished with value: 0.22225728448559257 and parameters: {'model_type': 'mlp', 'hidden_dims': '[512, 128]', 'dropout': 0.12702378989090662, 'batch_norm': True, 'lr': 2.7117960084006444e-06, 'weight_decay': 1.593638699689558e-05, 'epochs': 102, 'loss': 'mse', 'optimizer': 'adam', 'graph_mode': 'off', 'use_snp_selection': True, 'num_snps': 6546}. Best is trial 72 with value: 0.30060275474441334.
[I 2025-12-06 03:39:02,648] Trial 77 finished with value: 0.29580329753428924 and parameters: {'model_type': 'mlp', 'hidden_dims': '[512, 128]', 'dropout': 0.27646368971848534, 'batch_norm': False, 'lr': 1.6117745830660008e-06, 'weight_decay': 6.357535549183506e-06, 'epochs': 167, 'loss': 'mse', 'optimizer': 'adam', 'graph_mode': 'off', 'use_snp_selection': True, 'num_snps': 35382}. Best is trial 72 with value: 0.30060275474441334.
[I 2025-12-06 03:40:09,506] Trial 78 finished with value: 0.29354971540621044 and parameters: {'model_type': 'mlp', 'hidden_dims': '[512, 128]', 'dropout': 0.2524818881344943, 'batch_norm': False, 'lr': 5.4205672162554015e-06, 'weight_decay': 5.023275226064836e-07, 'epochs': 187, 'loss': 'mse', 'optimizer': 'adam', 'graph_mode': 'off', 'use_snp_selection': True, 'num_snps': 55518}. Best is trial 72 with value: 0.30060275474441334.
[I 2025-12-06 03:40:51,480] Trial 79 finished with value: 0.29141642585880606 and parameters: {'model_type': 'mlp', 'hidden_dims': '[256, 128]', 'dropout': 0.22117910782138603, 'batch_norm': False, 'lr': 4.13476310630932e-05, 'weight_decay': 8.30202825867072e-06, 'epochs': 126, 'loss': 'mse', 'optimizer': 'adam', 'graph_mode': 'off', 'use_snp_selection': True, 'num_snps': 44471}. Best is trial 72 with value: 0.30060275474441334.
[I 2025-12-06 03:41:56,829] Trial 80 finished with value: 0.2893871661623876 and parameters: {'model_type': 'mlp', 'hidden_dims': '[512, 128]', 'dropout': 0.23797752697897576, 'batch_norm': False, 'lr': 7.718325092287078e-06, 'weight_decay': 6.644178805475584e-07, 'epochs': 204, 'loss': 'mse', 'optimizer': 'adam', 'graph_mode': 'off', 'use_snp_selection': True, 'num_snps': 50779}. Best is trial 72 with value: 0.30060275474441334.
[I 2025-12-06 03:42:53,832] Trial 81 finished with value: 0.298808502383882 and parameters: {'model_type': 'mlp', 'hidden_dims': '[512, 128]', 'dropout': 0.19972711702601267, 'batch_norm': False, 'lr': 3.829123280184291e-06, 'weight_decay': 1.1334111526157631e-06, 'epochs': 166, 'loss': 'mse', 'optimizer': 'adam', 'graph_mode': 'off', 'use_snp_selection': True, 'num_snps': 46876}. Best is trial 72 with value: 0.30060275474441334.
[I 2025-12-06 03:43:49,094] Trial 82 finished with value: 0.30065198356150186 and parameters: {'model_type': 'mlp', 'hidden_dims': '[512, 128]', 'dropout': 0.17527752789229514, 'batch_norm': False, 'lr': 2.5437497753868223e-06, 'weight_decay': 2.1991512411803944e-06, 'epochs': 149, 'loss': 'mse', 'optimizer': 'adam', 'graph_mode': 'off', 'use_snp_selection': True, 'num_snps': 47532}. Best is trial 82 with value: 0.30065198356150186.
[I 2025-12-06 03:44:44,209] Trial 83 finished with value: 0.29562369043873904 and parameters: {'model_type': 'mlp', 'hidden_dims': '[512, 128]', 'dropout': 0.15378923175360718, 'batch_norm': False, 'lr': 2.797354220858054e-06, 'weight_decay': 1.7148396739664228e-06, 'epochs': 147, 'loss': 'mse', 'optimizer': 'adam', 'graph_mode': 'off', 'use_snp_selection': True, 'num_snps': 47737}. Best is trial 82 with value: 0.30065198356150186.
[I 2025-12-06 03:45:39,505] Trial 84 finished with value: 0.29670699957420565 and parameters: {'model_type': 'mlp', 'hidden_dims': '[512, 128]', 'dropout': 0.19514439950136953, 'batch_norm': False, 'lr': 3.7876634144426245e-06, 'weight_decay': 3.7192809296982383e-06, 'epochs': 164, 'loss': 'mse', 'optimizer': 'adam', 'graph_mode': 'off', 'use_snp_selection': True, 'num_snps': 45309}. Best is trial 82 with value: 0.30065198356150186.
[I 2025-12-06 03:46:30,506] Trial 85 finished with value: 0.28285638960654796 and parameters: {'model_type': 'mlp', 'hidden_dims': '[512, 128]', 'dropout': 0.17875761994026756, 'batch_norm': False, 'lr': 1.2529869868420493e-06, 'weight_decay': 2.099496010117512e-06, 'epochs': 157, 'loss': 'mse', 'optimizer': 'adam', 'graph_mode': 'off', 'use_snp_selection': True, 'num_snps': 40097}. Best is trial 82 with value: 0.30065198356150186.
[I 2025-12-06 03:47:25,034] Trial 86 finished with value: 0.30219272602284764 and parameters: {'model_type': 'mlp', 'hidden_dims': '[512, 128]', 'dropout': 0.1349134011673191, 'batch_norm': False, 'lr': 2.1466016625111723e-06, 'weight_decay': 5.770207420464368e-06, 'epochs': 174, 'loss': 'mse', 'optimizer': 'adam', 'graph_mode': 'off', 'use_snp_selection': True, 'num_snps': 42622}. Best is trial 86 with value: 0.30219272602284764.
