[I 2025-12-05 15:21:38,394] Trial 6 finished with value: 0.1186499769231316 and parameters: {'model_type': 'mlp', 'hidden_dims': '[256, 128]', 'dropout': 0.3930109900265879, 'batch_norm': False, 'lr': 4.892964372128395e-05, 'weight_decay': 1.5809549317992182e-06, 'epochs': 199, 'loss': 'mse', 'optimizer': 'adam', 'graph_mode': 'off', 'use_snp_selection': False}. Best is trial 1 with value: 0.12179826101607956.
[I 2025-12-05 15:21:40,255] Trial 7 finished with value: 0.12633469789338353 and parameters: {'model_type': 'mlp', 'hidden_dims': '[512, 256]', 'dropout': 0.15343979219678458, 'batch_norm': True, 'lr': 6.234003099047341e-05, 'weight_decay': 3.894760610535477e-07, 'epochs': 97, 'loss': 'mse', 'optimizer': 'adam', 'graph_mode': 'off', 'use_snp_selection': False}. Best is trial 7 with value: 0.12633469789338353.
[I 2025-12-05 15:21:44,742] Trial 8 finished with value: 0.1455416377416381 and parameters: {'model_type': 'mlp', 'hidden_dims': '[512, 128]', 'dropout': 0.10743001231661406, 'batch_norm': True, 'lr': 0.00023728538449271062, 'weight_decay': 1.7629071578048637e-05, 'epochs': 312, 'loss': 'mae', 'optimizer': 'adam', 'graph_mode': 'off', 'use_snp_selection': False}. Best is trial 8 with value: 0.1455416377416381.
[I 2025-12-05 15:21:47,600] Trial 9 finished with value: 0.12134608892580016 and parameters: {'model_type': 'mlp', 'hidden_dims': '[512, 64]', 'dropout': 0.14505336736221927, 'batch_norm': True, 'lr': 5.8619638388111826e-05, 'weight_decay': 6.200156172669308e-07, 'epochs': 175, 'loss': 'mse', 'optimizer': 'adam', 'graph_mode': 'off', 'use_snp_selection': False}. Best is trial 8 with value: 0.1455416377416381.
[I 2025-12-05 15:21:48,970] Trial 10 finished with value: 0.0201001542799816 and parameters: {'model_type': 'mlp', 'hidden_dims': '[512, 128]', 'dropout': 0.2800030442581858, 'batch_norm': False, 'lr': 0.0004919806695968258, 'weight_decay': 2.9953888095455486e-06, 'epochs': 55, 'loss': 'mae', 'optimizer': 'adam', 'graph_mode': 'off', 'use_snp_selection': False}. Best is trial 8 with value: 0.1455416377416381.
[I 2025-12-05 15:21:50,543] Trial 11 finished with value: 0.13297100187417452 and parameters: {'model_type': 'mlp', 'hidden_dims': '[512, 256]', 'dropout': 0.10095648685224448, 'batch_norm': True, 'lr': 0.0003926892266729099, 'weight_decay': 3.172181990533228e-07, 'epochs': 70, 'loss': 'mse', 'optimizer': 'adam', 'graph_mode': 'off', 'use_snp_selection': False}. Best is trial 8 with value: 0.1455416377416381.
[I 2025-12-05 15:21:51,716] Trial 12 finished with value: 0.1468268608936162 and parameters: {'model_type': 'mlp', 'hidden_dims': '[512, 256]', 'dropout': 0.10344600881777158, 'batch_norm': True, 'lr': 0.0006753264773209732, 'weight_decay': 1.3081036432574914e-07, 'epochs': 40, 'loss': 'mae', 'optimizer': 'adam', 'graph_mode': 'off', 'use_snp_selection': False}. Best is trial 12 with value: 0.1468268608936162.
[I 2025-12-05 15:21:55,493] Trial 13 finished with value: 0.13155190314211654 and parameters: {'model_type': 'mlp', 'hidden_dims': '[512, 128]', 'dropout': 0.24294613148916022, 'batch_norm': True, 'lr': 0.00020263148232071683, 'weight_decay': 1.0885943577911259e-07, 'epochs': 253, 'loss': 'mae', 'optimizer': 'adam', 'graph_mode': 'off', 'use_snp_selection': False}. Best is trial 12 with value: 0.1468268608936162.
[I 2025-12-05 15:21:59,834] Trial 14 finished with value: 0.13706875047003542 and parameters: {'model_type': 'mlp', 'hidden_dims': '[512, 256]', 'dropout': 0.3221595656802847, 'batch_norm': True, 'lr': 0.000922330603992367, 'weight_decay': 4.57067734295802e-06, 'epochs': 294, 'loss': 'mae', 'optimizer': 'adam', 'graph_mode': 'off', 'use_snp_selection': False}. Best is trial 12 with value: 0.1468268608936162.
[I 2025-12-05 15:22:01,070] Trial 15 finished with value: 0.13959845396845552 and parameters: {'model_type': 'mlp', 'hidden_dims': '[128, 64]', 'dropout': 0.10515697852451877, 'batch_norm': True, 'lr': 0.00018429018027102804, 'weight_decay': 6.682546297843178e-05, 'epochs': 219, 'loss': 'mae', 'optimizer': 'adam', 'graph_mode': 'off', 'use_snp_selection': False}. Best is trial 12 with value: 0.1468268608936162.
[I 2025-12-05 15:22:02,334] Trial 16 finished with value: 0.07238806954545066 and parameters: {'model_type': 'mlp', 'hidden_dims': '[256, 128, 64]', 'dropout': 0.19236941781656602, 'batch_norm': True, 'lr': 1.2586985041154999e-05, 'weight_decay': 1.110237718300656e-05, 'epochs': 98, 'loss': 'mae', 'optimizer': 'adam', 'graph_mode': 'off', 'use_snp_selection': False}. Best is trial 12 with value: 0.1468268608936162.
[I 2025-12-05 15:22:07,308] Trial 17 finished with value: 0.13515637450674173 and parameters: {'model_type': 'mlp', 'hidden_dims': '[512, 256]', 'dropout': 0.5434692890636532, 'batch_norm': True, 'lr': 0.0001700155970829766, 'weight_decay': 1.3398043894594233e-06, 'epochs': 349, 'loss': 'mae', 'optimizer': 'adam', 'graph_mode': 'off', 'use_snp_selection': False}. Best is trial 12 with value: 0.1468268608936162.
[I 2025-12-05 15:22:11,957] Trial 18 finished with value: 0.02480933528435792 and parameters: {'model_type': 'mlp', 'hidden_dims': '[512, 128]', 'dropout': 0.46470375425664545, 'batch_norm': False, 'lr': 0.0009897362511876527, 'weight_decay': 5.1284909832915915e-05, 'epochs': 123, 'loss': 'mae', 'optimizer': 'adam', 'graph_mode': 'off', 'use_snp_selection': True, 'num_snps': 58241}. Best is trial 12 with value: 0.1468268608936162.
[I 2025-12-05 15:22:16,392] Trial 19 finished with value: 0.14277961533266315 and parameters: {'model_type': 'mlp', 'hidden_dims': '[512, 128]', 'dropout': 0.31848849517917976, 'batch_norm': True, 'lr': 2.2789757615406074e-05, 'weight_decay': 1.1354159408743119e-07, 'epochs': 299, 'loss': 'mae', 'optimizer': 'adam', 'graph_mode': 'off', 'use_snp_selection': False}. Best is trial 12 with value: 0.1468268608936162.
[I 2025-12-05 15:22:17,598] Trial 20 finished with value: 0.1334796430522643 and parameters: {'model_type': 'mlp', 'hidden_dims': '[512, 256]', 'dropout': 0.19812532526213855, 'batch_norm': True, 'lr': 0.0003516836857329344, 'weight_decay': 6.421600743942308e-06, 'epochs': 43, 'loss': 'mae', 'optimizer': 'adam', 'graph_mode': 'off', 'use_snp_selection': False}. Best is trial 12 with value: 0.1468268608936162.
[I 2025-12-05 15:22:21,970] Trial 21 finished with value: 0.09026344677917143 and parameters: {'model_type': 'mlp', 'hidden_dims': '[512, 128]', 'dropout': 0.3021580785804693, 'batch_norm': True, 'lr': 1.600104399513837e-05, 'weight_decay': 1.0394939605771429e-07, 'epochs': 299, 'loss': 'mae', 'optimizer': 'adam', 'graph_mode': 'off', 'use_snp_selection': False}. Best is trial 12 with value: 0.1468268608936162.
[I 2025-12-05 15:22:25,882] Trial 22 finished with value: 0.13668900646626628 and parameters: {'model_type': 'mlp', 'hidden_dims': '[512, 128]', 'dropout': 0.1629904129754279, 'batch_norm': True, 'lr': 2.597380445267139e-05, 'weight_decay': 3.117588332853499e-07, 'epochs': 262, 'loss': 'mae', 'optimizer': 'adam', 'graph_mode': 'off', 'use_snp_selection': False}. Best is trial 12 with value: 0.1468268608936162.
[I 2025-12-05 15:22:30,453] Trial 23 finished with value: 0.13268067780810602 and parameters: {'model_type': 'mlp', 'hidden_dims': '[512, 128]', 'dropout': 0.23070381072043317, 'batch_norm': True, 'lr': 0.00011807398412846929, 'weight_decay': 2.0387772194663758e-07, 'epochs': 317, 'loss': 'mae', 'optimizer': 'adam', 'graph_mode': 'off', 'use_snp_selection': False}. Best is trial 12 with value: 0.1468268608936162.
[I 2025-12-05 15:22:33,742] Trial 24 finished with value: 0.0834950400760424 and parameters: {'model_type': 'mlp', 'hidden_dims': '[512, 128]', 'dropout': 0.3469904279280027, 'batch_norm': True, 'lr': 2.7013005792357815e-05, 'weight_decay': 9.905353781686856e-07, 'epochs': 209, 'loss': 'mae', 'optimizer': 'adam', 'graph_mode': 'off', 'use_snp_selection': False}. Best is trial 12 with value: 0.1468268608936162.
[I 2025-12-05 15:22:36,269] Trial 25 finished with value: 0.11868769096841028 and parameters: {'model_type': 'mlp', 'hidden_dims': '[256, 128, 64]', 'dropout': 0.5031465945636014, 'batch_norm': True, 'lr': 0.0006354095006624668, 'weight_decay': 3.0032671333485123e-05, 'epochs': 285, 'loss': 'mae', 'optimizer': 'adam', 'graph_mode': 'off', 'use_snp_selection': False}. Best is trial 12 with value: 0.1468268608936162.
[I 2025-12-05 15:22:37,973] Trial 26 finished with value: 0.0863441070854773 and parameters: {'model_type': 'mlp', 'hidden_dims': '[256, 128]', 'dropout': 0.1357839523014341, 'batch_norm': True, 'lr': 1.2550693142833744e-05, 'weight_decay': 2.443643243280606e-06, 'epochs': 237, 'loss': 'mae', 'optimizer': 'adam', 'graph_mode': 'off', 'use_snp_selection': True, 'num_snps': 3842}. Best is trial 12 with value: 0.1468268608936162.
[I 2025-12-05 15:22:39,449] Trial 27 finished with value: 0.11612124950765618 and parameters: {'model_type': 'mlp', 'hidden_dims': '[128, 64]', 'dropout': 0.11675642375236583, 'batch_norm': False, 'lr': 0.000342416368914435, 'weight_decay': 1.7324982408186623e-07, 'epochs': 320, 'loss': 'mae', 'optimizer': 'adam', 'graph_mode': 'off', 'use_snp_selection': False}. Best is trial 12 with value: 0.1468268608936162.
[I 2025-12-05 15:22:42,350] Trial 28 finished with value: 0.14748970822912608 and parameters: {'model_type': 'mlp', 'hidden_dims': '[512, 256]', 'dropout': 0.21819274887175172, 'batch_norm': True, 'lr': 0.00011955193262015558, 'weight_decay': 0.00011837572117061313, 'epochs': 178, 'loss': 'mae', 'optimizer': 'adam', 'graph_mode': 'off', 'use_snp_selection': False}. Best is trial 28 with value: 0.14748970822912608.
[I 2025-12-05 15:22:44,944] Trial 29 finished with value: 0.1317618682959592 and parameters: {'model_type': 'mlp', 'hidden_dims': '[512, 256]', 'dropout': 0.17833283002637434, 'batch_norm': True, 'lr': 0.00012373778598016806, 'weight_decay': 0.00012363202694194868, 'epochs': 179, 'loss': 'mae', 'optimizer': 'adam', 'graph_mode': 'off', 'use_snp_selection': True, 'num_snps': 19468}. Best is trial 28 with value: 0.14748970822912608.
[I 2025-12-05 15:22:46,956] Trial 30 finished with value: 0.1372691897515107 and parameters: {'model_type': 'mlp', 'hidden_dims': '[512, 256]', 'dropout': 0.22465171884605872, 'batch_norm': True, 'lr': 0.0006436867876426981, 'weight_decay': 0.00018221677321050432, 'epochs': 108, 'loss': 'mae', 'optimizer': 'adam', 'graph_mode': 'off', 'use_snp_selection': False}. Best is trial 28 with value: 0.14748970822912608.
[I 2025-12-05 15:22:51,989] Trial 31 finished with value: 0.13856751240725002 and parameters: {'model_type': 'mlp', 'hidden_dims': '[512, 256]', 'dropout': 0.27995624533534386, 'batch_norm': True, 'lr': 0.0002515573967554178, 'weight_decay': 0.0006822239039943662, 'epochs': 350, 'loss': 'mae', 'optimizer': 'adam', 'graph_mode': 'off', 'use_snp_selection': False}. Best is trial 28 with value: 0.14748970822912608.
[I 2025-12-05 15:22:52,749] Trial 32 finished with value: 0.13365889180693763 and parameters: {'model_type': 'mlp', 'hidden_dims': '[128, 64]', 'dropout': 0.22141376903272472, 'batch_norm': True, 'lr': 0.00010105268510989215, 'weight_decay': 2.204388133330519e-05, 'epochs': 70, 'loss': 'mae', 'optimizer': 'adam', 'graph_mode': 'off', 'use_snp_selection': False}. Best is trial 28 with value: 0.14748970822912608.
[I 2025-12-05 15:22:56,228] Trial 33 finished with value: 0.12541234732243345 and parameters: {'model_type': 'mlp', 'hidden_dims': '[512, 256]', 'dropout': 0.13502589860044542, 'batch_norm': True, 'lr': 3.911041483732538e-05, 'weight_decay': 8.822340236655884e-05, 'epochs': 227, 'loss': 'mae', 'optimizer': 'adam', 'graph_mode': 'off', 'use_snp_selection': False}. Best is trial 28 with value: 0.14748970822912608.
[I 2025-12-05 15:22:58,903] Trial 34 finished with value: 0.07444100851554658 and parameters: {'model_type': 'mlp', 'hidden_dims': '[512, 128]', 'dropout': 0.3430109843448889, 'batch_norm': True, 'lr': 6.003623229413168e-06, 'weight_decay': 1.758020486970184e-05, 'epochs': 160, 'loss': 'mae', 'optimizer': 'adam', 'graph_mode': 'off', 'use_snp_selection': False}. Best is trial 28 with value: 0.14748970822912608.
[I 2025-12-05 15:23:01,210] Trial 35 finished with value: 0.12864851634707225 and parameters: {'model_type': 'mlp', 'hidden_dims': '[256, 128]', 'dropout': 0.17622863314280965, 'batch_norm': False, 'lr': 9.637152059197406e-05, 'weight_decay': 4.588363376006164e-05, 'epochs': 263, 'loss': 'mae', 'optimizer': 'adam', 'graph_mode': 'off', 'use_snp_selection': False}. Best is trial 28 with value: 0.14748970822912608.
[I 2025-12-05 15:23:08,143] Trial 36 finished with value: 0.13688332781212495 and parameters: {'model_type': 'mlp', 'hidden_dims': '[512, 64]', 'dropout': 0.2647350333615621, 'batch_norm': True, 'lr': 0.00028185084162744975, 'weight_decay': 0.0003652724040310916, 'epochs': 314, 'loss': 'mse', 'optimizer': 'adam', 'graph_mode': 'off', 'use_snp_selection': True, 'num_snps': 58661}. Best is trial 28 with value: 0.14748970822912608.
[I 2025-12-05 15:23:09,644] Trial 37 finished with value: 0.11205072504750535 and parameters: {'model_type': 'mlp', 'hidden_dims': '[256, 128, 64]', 'dropout': 0.20756871511263536, 'batch_norm': True, 'lr': 1.7940783335112983e-05, 'weight_decay': 1.3923105701706286e-05, 'epochs': 134, 'loss': 'mae', 'optimizer': 'adam', 'graph_mode': 'off', 'use_snp_selection': False}. Best is trial 28 with value: 0.14748970822912608.
[I 2025-12-05 15:23:12,197] Trial 38 finished with value: 0.10261079223345312 and parameters: {'model_type': 'mlp', 'hidden_dims': '[512, 128]', 'dropout': 0.4194750000055196, 'batch_norm': False, 'lr': 0.000556012306999711, 'weight_decay': 5.170721721947004e-07, 'epochs': 188, 'loss': 'mse', 'optimizer': 'adam', 'graph_mode': 'off', 'use_snp_selection': True, 'num_snps': 19911}. Best is trial 28 with value: 0.14748970822912608.
[I 2025-12-05 15:23:16,368] Trial 39 finished with value: 0.03189393492720333 and parameters: {'model_type': 'mlp', 'hidden_dims': '[512, 256]', 'dropout': 0.3079175483030952, 'batch_norm': True, 'lr': 3.0091994997138954e-06, 'weight_decay': 7.292174767457787e-06, 'epochs': 281, 'loss': 'mae', 'optimizer': 'adam', 'graph_mode': 'off', 'use_snp_selection': False}. Best is trial 28 with value: 0.14748970822912608.
[I 2025-12-05 15:23:19,055] Trial 40 finished with value: 0.11942377694079376 and parameters: {'model_type': 'mlp', 'hidden_dims': '[512, 64]', 'dropout': 0.3622417554402906, 'batch_norm': True, 'lr': 7.428279915527672e-05, 'weight_decay': 1.7831666163207106e-07, 'epochs': 163, 'loss': 'mse', 'optimizer': 'adam', 'graph_mode': 'off', 'use_snp_selection': False}. Best is trial 28 with value: 0.14748970822912608.
[I 2025-12-05 15:23:20,256] Trial 41 finished with value: 0.13455265709786016 and parameters: {'model_type': 'mlp', 'hidden_dims': '[128, 64]', 'dropout': 0.11318227741671434, 'batch_norm': True, 'lr': 0.0001623226265117277, 'weight_decay': 0.00015121818073930476, 'epochs': 218, 'loss': 'mae', 'optimizer': 'adam', 'graph_mode': 'off', 'use_snp_selection': False}. Best is trial 28 with value: 0.14748970822912608.
[I 2025-12-05 15:23:21,823] Trial 42 finished with value: 0.11751919561808039 and parameters: {'model_type': 'mlp', 'hidden_dims': '[128, 64]', 'dropout': 0.10207315330725256, 'batch_norm': True, 'lr': 0.00022258375151805243, 'weight_decay': 8.920620692414074e-05, 'epochs': 332, 'loss': 'mae', 'optimizer': 'adam', 'graph_mode': 'off', 'use_snp_selection': False}. Best is trial 28 with value: 0.14748970822912608.
[I 2025-12-05 15:23:23,315] Trial 43 finished with value: 0.1404260327262129 and parameters: {'model_type': 'mlp', 'hidden_dims': '[128, 64]', 'dropout': 0.13664421099313578, 'batch_norm': True, 'lr': 4.684932319064525e-05, 'weight_decay': 3.570432386894742e-05, 'epochs': 298, 'loss': 'mae', 'optimizer': 'adam', 'graph_mode': 'off', 'use_snp_selection': False}. Best is trial 28 with value: 0.14748970822912608.
[I 2025-12-05 15:23:24,829] Trial 44 finished with value: 0.12164151777855643 and parameters: {'model_type': 'mlp', 'hidden_dims': '[128, 64]', 'dropout': 0.15406608362669552, 'batch_norm': True, 'lr': 3.414897632450377e-05, 'weight_decay': 4.049236020890635e-05, 'epochs': 302, 'loss': 'mae', 'optimizer': 'adam', 'graph_mode': 'off', 'use_snp_selection': False}. Best is trial 28 with value: 0.14748970822912608.
[I 2025-12-05 15:23:27,238] Trial 45 finished with value: 0.11744652819954855 and parameters: {'model_type': 'mlp', 'hidden_dims': '[256, 128]', 'dropout': 0.1333381212282598, 'batch_norm': True, 'lr': 4.9586098820406145e-05, 'weight_decay': 2.8383950797597083e-05, 'epochs': 274, 'loss': 'mae', 'optimizer': 'adam', 'graph_mode': 'off', 'use_snp_selection': False}. Best is trial 28 with value: 0.14748970822912608.
[I 2025-12-05 15:23:31,582] Trial 46 finished with value: 0.12527842512075016 and parameters: {'model_type': 'mlp', 'hidden_dims': '[512, 128]', 'dropout': 0.16899996406841716, 'batch_norm': False, 'lr': 7.486693320856561e-05, 'weight_decay': 8.459076889214037e-06, 'epochs': 302, 'loss': 'mae', 'optimizer': 'adam', 'graph_mode': 'off', 'use_snp_selection': False}. Best is trial 28 with value: 0.14748970822912608.
[I 2025-12-05 15:23:36,358] Trial 47 finished with value: 0.11594249048832017 and parameters: {'model_type': 'mlp', 'hidden_dims': '[512, 256]', 'dropout': 0.12930571450645795, 'batch_norm': True, 'lr': 2.275917518294153e-05, 'weight_decay': 0.00023434546074335512, 'epochs': 331, 'loss': 'mse', 'optimizer': 'adam', 'graph_mode': 'off', 'use_snp_selection': False}. Best is trial 28 with value: 0.14748970822912608.
[I 2025-12-05 15:23:37,660] Trial 48 finished with value: 0.10128398706158473 and parameters: {'model_type': 'mlp', 'hidden_dims': '[128, 64]', 'dropout': 0.25265542838589905, 'batch_norm': True, 'lr': 9.451945051395459e-06, 'weight_decay': 0.00043509562449581756, 'epochs': 248, 'loss': 'mae', 'optimizer': 'adam', 'graph_mode': 'off', 'use_snp_selection': False}. Best is trial 28 with value: 0.14748970822912608.
[I 2025-12-05 15:23:41,230] Trial 49 finished with value: 0.126572109937745 and parameters: {'model_type': 'mlp', 'hidden_dims': '[512, 128]', 'dropout': 0.19294638573821327, 'batch_norm': True, 'lr': 4.03575099407019e-05, 'weight_decay': 5.1868556583924745e-06, 'epochs': 70, 'loss': 'mae', 'optimizer': 'adam', 'graph_mode': 'off', 'use_snp_selection': True, 'num_snps': 46888}. Best is trial 28 with value: 0.14748970822912608.
[I 2025-12-05 15:23:45,203] Trial 50 finished with value: 0.1385495322474656 and parameters: {'model_type': 'mlp', 'hidden_dims': '[512, 256]', 'dropout': 0.15820740878543155, 'batch_norm': True, 'lr': 0.00014090397297691331, 'weight_decay': 7.65013717510394e-05, 'epochs': 266, 'loss': 'mae', 'optimizer': 'adam', 'graph_mode': 'off', 'use_snp_selection': False}. Best is trial 28 with value: 0.14748970822912608.
[I 2025-12-05 15:23:46,367] Trial 51 finished with value: 0.12798887459027664 and parameters: {'model_type': 'mlp', 'hidden_dims': '[128, 64]', 'dropout': 0.11569969262546226, 'batch_norm': True, 'lr': 0.00020215484149225884, 'weight_decay': 7.970912266508153e-05, 'epochs': 203, 'loss': 'mae', 'optimizer': 'adam', 'graph_mode': 'off', 'use_snp_selection': False}. Best is trial 28 with value: 0.14748970822912608.
[I 2025-12-05 15:23:47,803] Trial 52 finished with value: 0.062236669199588035 and parameters: {'model_type': 'mlp', 'hidden_dims': '[128, 64]', 'dropout': 0.1156755676000218, 'batch_norm': True, 'lr': 1.0921708743861942e-06, 'weight_decay': 3.9982960075413854e-05, 'epochs': 290, 'loss': 'mae', 'optimizer': 'adam', 'graph_mode': 'off', 'use_snp_selection': False}. Best is trial 28 with value: 0.14748970822912608.
[I 2025-12-05 15:23:49,114] Trial 53 finished with value: 0.13889651470667108 and parameters: {'model_type': 'mlp', 'hidden_dims': '[128, 64]', 'dropout': 0.10168231172619094, 'batch_norm': True, 'lr': 0.00041326141478969044, 'weight_decay': 1.3051016111023173e-05, 'epochs': 236, 'loss': 'mae', 'optimizer': 'adam', 'graph_mode': 'off', 'use_snp_selection': False}. Best is trial 28 with value: 0.14748970822912608.
[I 2025-12-05 15:23:51,857] Trial 54 finished with value: 0.1360612636367786 and parameters: {'model_type': 'mlp', 'hidden_dims': '[256, 128, 64]', 'dropout': 0.14690273566181344, 'batch_norm': True, 'lr': 0.0007666884378762631, 'weight_decay': 1.7786326196808014e-05, 'epochs': 313, 'loss': 'mae', 'optimizer': 'adam', 'graph_mode': 'off', 'use_snp_selection': False}. Best is trial 28 with value: 0.14748970822912608.
[I 2025-12-05 15:23:56,697] Trial 55 finished with value: 0.14687590550899296 and parameters: {'model_type': 'mlp', 'hidden_dims': '[512, 128]', 'dropout': 0.18072927786726795, 'batch_norm': True, 'lr': 5.777260966149076e-05, 'weight_decay': 5.5402320898081276e-05, 'epochs': 336, 'loss': 'mae', 'optimizer': 'adam', 'graph_mode': 'off', 'use_snp_selection': False}. Best is trial 28 with value: 0.14748970822912608.
[I 2025-12-05 15:24:01,529] Trial 56 finished with value: 0.14803738775102046 and parameters: {'model_type': 'mlp', 'hidden_dims': '[512, 128]', 'dropout': 0.20992238150521747, 'batch_norm': True, 'lr': 5.833559209490175e-05, 'weight_decay': 0.0001129047027995032, 'epochs': 334, 'loss': 'mae', 'optimizer': 'adam', 'graph_mode': 'off', 'use_snp_selection': False}. Best is trial 56 with value: 0.14803738775102046.
[I 2025-12-05 15:24:06,377] Trial 57 finished with value: 0.12331962931985425 and parameters: {'model_type': 'mlp', 'hidden_dims': '[512, 128]', 'dropout': 0.21289650807258403, 'batch_norm': False, 'lr': 6.14988219284242e-05, 'weight_decay': 0.00012173581744308626, 'epochs': 342, 'loss': 'mae', 'optimizer': 'adam', 'graph_mode': 'off', 'use_snp_selection': False}. Best is trial 56 with value: 0.14803738775102046.
