[I 2025-12-05 15:16:35,189] Trial 8 finished with value: 0.07598263944383649 and parameters: {'model_type': 'mlp', 'hidden_dims': '[512, 128]', 'dropout': 0.10743001231661406, 'batch_norm': True, 'lr': 0.00023728538449271062, 'weight_decay': 1.7629071578048637e-05, 'epochs': 312, 'loss': 'mae', 'optimizer': 'adam', 'graph_mode': 'off', 'use_snp_selection': False}. Best is trial 8 with value: 0.07598263944383649.
[I 2025-12-05 15:16:37,316] Trial 9 finished with value: 0.04811817126568959 and parameters: {'model_type': 'mlp', 'hidden_dims': '[512, 64]', 'dropout': 0.14505336736221927, 'batch_norm': True, 'lr': 5.8619638388111826e-05, 'weight_decay': 6.200156172669308e-07, 'epochs': 175, 'loss': 'mse', 'optimizer': 'adam', 'graph_mode': 'off', 'use_snp_selection': False}. Best is trial 8 with value: 0.07598263944383649.
[I 2025-12-05 15:16:38,504] Trial 10 finished with value: 0.06285480407921365 and parameters: {'model_type': 'mlp', 'hidden_dims': '[512, 128]', 'dropout': 0.2800030442581858, 'batch_norm': False, 'lr': 0.0004919806695968258, 'weight_decay': 2.9953888095455486e-06, 'epochs': 55, 'loss': 'mae', 'optimizer': 'adam', 'graph_mode': 'off', 'use_snp_selection': False}. Best is trial 8 with value: 0.07598263944383649.
[I 2025-12-05 15:16:39,907] Trial 11 finished with value: 0.015423380105112353 and parameters: {'model_type': 'mlp', 'hidden_dims': '[512, 128]', 'dropout': 0.2431723102499158, 'batch_norm': False, 'lr': 0.0007312141697563474, 'weight_decay': 3.062975539845402e-06, 'epochs': 77, 'loss': 'mae', 'optimizer': 'adam', 'graph_mode': 'off', 'use_snp_selection': False}. Best is trial 8 with value: 0.07598263944383649.
[I 2025-12-05 15:16:41,017] Trial 12 finished with value: 0.06221767686064825 and parameters: {'model_type': 'mlp', 'hidden_dims': '[512, 128]', 'dropout': 0.10344600881777158, 'batch_norm': False, 'lr': 0.0006159006513942946, 'weight_decay': 1.3081036432574914e-07, 'epochs': 40, 'loss': 'mae', 'optimizer': 'adam', 'graph_mode': 'off', 'use_snp_selection': False}. Best is trial 8 with value: 0.07598263944383649.
[I 2025-12-05 15:16:43,674] Trial 13 finished with value: 0.058750216210018316 and parameters: {'model_type': 'mlp', 'hidden_dims': '[512, 128]', 'dropout': 0.3039588759638207, 'batch_norm': False, 'lr': 0.00023284399572303963, 'weight_decay': 6.001658082910393e-06, 'epochs': 247, 'loss': 'mae', 'optimizer': 'adam', 'graph_mode': 'off', 'use_snp_selection': False}. Best is trial 8 with value: 0.07598263944383649.
[I 2025-12-05 15:16:46,769] Trial 14 finished with value: 0.05941601312007621 and parameters: {'model_type': 'mlp', 'hidden_dims': '[512, 128]', 'dropout': 0.5050584905097204, 'batch_norm': True, 'lr': 0.00021863835391135544, 'weight_decay': 5.724103314313124e-05, 'epochs': 291, 'loss': 'mae', 'optimizer': 'adam', 'graph_mode': 'off', 'use_snp_selection': False}. Best is trial 8 with value: 0.07598263944383649.
[I 2025-12-05 15:16:47,821] Trial 15 finished with value: 0.043939846254606486 and parameters: {'model_type': 'mlp', 'hidden_dims': '[128, 64]', 'dropout': 0.3112141746725227, 'batch_norm': False, 'lr': 0.00018666437734889113, 'weight_decay': 1.557266379803388e-05, 'epochs': 218, 'loss': 'mae', 'optimizer': 'adam', 'graph_mode': 'off', 'use_snp_selection': False}. Best is trial 8 with value: 0.07598263944383649.
[I 2025-12-05 15:16:48,985] Trial 16 finished with value: 0.020650804022280048 and parameters: {'model_type': 'mlp', 'hidden_dims': '[256, 128, 64]', 'dropout': 0.20385083949487778, 'batch_norm': True, 'lr': 1.2586985041154999e-05, 'weight_decay': 1.965847335858875e-06, 'epochs': 123, 'loss': 'mae', 'optimizer': 'adam', 'graph_mode': 'off', 'use_snp_selection': False}. Best is trial 8 with value: 0.07598263944383649.
[I 2025-12-05 15:16:50,132] Trial 17 finished with value: 0.028977925608424382 and parameters: {'model_type': 'mlp', 'hidden_dims': '[512, 256]', 'dropout': 0.10230308008198463, 'batch_norm': False, 'lr': 0.0003842438968293341, 'weight_decay': 4.44481515892685e-05, 'epochs': 43, 'loss': 'mae', 'optimizer': 'adam', 'graph_mode': 'off', 'use_snp_selection': False}. Best is trial 8 with value: 0.07598263944383649.
[I 2025-12-05 15:16:54,879] Trial 18 finished with value: 0.0447570604641658 and parameters: {'model_type': 'mlp', 'hidden_dims': '[512, 128]', 'dropout': 0.32547294178776626, 'batch_norm': False, 'lr': 0.0009897362511876527, 'weight_decay': 5.2170752646525835e-06, 'epochs': 284, 'loss': 'mae', 'optimizer': 'adam', 'graph_mode': 'off', 'use_snp_selection': True, 'num_snps': 58241}. Best is trial 8 with value: 0.07598263944383649.
[I 2025-12-05 15:16:58,168] Trial 19 finished with value: 0.05964429073532836 and parameters: {'model_type': 'mlp', 'hidden_dims': '[512, 128]', 'dropout': 0.48894942095390714, 'batch_norm': True, 'lr': 0.00011765466542116184, 'weight_decay': 7.007690416384572e-07, 'epochs': 314, 'loss': 'mae', 'optimizer': 'adam', 'graph_mode': 'off', 'use_snp_selection': False}. Best is trial 8 with value: 0.07598263944383649.
[I 2025-12-05 15:16:59,664] Trial 20 finished with value: 0.07042161273666668 and parameters: {'model_type': 'mlp', 'hidden_dims': '[512, 128]', 'dropout': 0.25140244001858847, 'batch_norm': True, 'lr': 1.9778622737898004e-05, 'weight_decay': 0.0001247981980720522, 'epochs': 90, 'loss': 'mae', 'optimizer': 'adam', 'graph_mode': 'off', 'use_snp_selection': False}. Best is trial 8 with value: 0.07598263944383649.
[I 2025-12-05 15:17:01,165] Trial 21 finished with value: 0.03386703784043041 and parameters: {'model_type': 'mlp', 'hidden_dims': '[512, 128]', 'dropout': 0.24515627973040416, 'batch_norm': True, 'lr': 1.4010916137608241e-05, 'weight_decay': 0.00012999262735072, 'epochs': 90, 'loss': 'mae', 'optimizer': 'adam', 'graph_mode': 'off', 'use_snp_selection': False}. Best is trial 8 with value: 0.07598263944383649.
[I 2025-12-05 15:17:02,880] Trial 22 finished with value: 0.02244194192763931 and parameters: {'model_type': 'mlp', 'hidden_dims': '[512, 128]', 'dropout': 0.2782952549701734, 'batch_norm': True, 'lr': 2.2707695895829396e-05, 'weight_decay': 0.00012506009376990192, 'epochs': 117, 'loss': 'mae', 'optimizer': 'adam', 'graph_mode': 'off', 'use_snp_selection': False}. Best is trial 8 with value: 0.07598263944383649.
[I 2025-12-05 15:17:04,146] Trial 23 finished with value: 0.06607391050086833 and parameters: {'model_type': 'mlp', 'hidden_dims': '[512, 128]', 'dropout': 0.20001025686426477, 'batch_norm': True, 'lr': 0.00036581901766592783, 'weight_decay': 2.3852804796417705e-05, 'epochs': 65, 'loss': 'mae', 'optimizer': 'adam', 'graph_mode': 'off', 'use_snp_selection': False}. Best is trial 8 with value: 0.07598263944383649.
[I 2025-12-05 15:17:05,453] Trial 24 finished with value: 0.033542523106674584 and parameters: {'model_type': 'mlp', 'hidden_dims': '[512, 128]', 'dropout': 0.191974616894514, 'batch_norm': True, 'lr': 2.8020316073450984e-05, 'weight_decay': 2.73940460341445e-05, 'epochs': 68, 'loss': 'mae', 'optimizer': 'adam', 'graph_mode': 'off', 'use_snp_selection': False}. Best is trial 8 with value: 0.07598263944383649.
[I 2025-12-05 15:17:07,523] Trial 25 finished with value: 0.06953571801562645 and parameters: {'model_type': 'mlp', 'hidden_dims': '[512, 256]', 'dropout': 0.13983210344553382, 'batch_norm': True, 'lr': 0.00011914869416071656, 'weight_decay': 0.00011604595173744647, 'epochs': 162, 'loss': 'mae', 'optimizer': 'adam', 'graph_mode': 'off', 'use_snp_selection': False}. Best is trial 8 with value: 0.07598263944383649.
[I 2025-12-05 15:17:08,763] Trial 26 finished with value: 0.04090010178434275 and parameters: {'model_type': 'mlp', 'hidden_dims': '[512, 256]', 'dropout': 0.1487896127118326, 'batch_norm': True, 'lr': 0.00011396425784900865, 'weight_decay': 0.0009995306414572783, 'epochs': 170, 'loss': 'mae', 'optimizer': 'adam', 'graph_mode': 'off', 'use_snp_selection': True, 'num_snps': 3842}. Best is trial 8 with value: 0.07598263944383649.
[I 2025-12-05 15:17:11,229] Trial 27 finished with value: 0.06110151082942477 and parameters: {'model_type': 'mlp', 'hidden_dims': '[512, 256]', 'dropout': 0.14153896471468957, 'batch_norm': True, 'lr': 0.00011047259337015737, 'weight_decay': 0.00013213884428112566, 'epochs': 215, 'loss': 'mse', 'optimizer': 'adam', 'graph_mode': 'off', 'use_snp_selection': False}. Best is trial 8 with value: 0.07598263944383649.
[I 2025-12-05 15:17:14,800] Trial 28 finished with value: 0.07588035271036007 and parameters: {'model_type': 'mlp', 'hidden_dims': '[512, 256]', 'dropout': 0.1006208908723342, 'batch_norm': True, 'lr': 1.597687963134124e-05, 'weight_decay': 0.0003181040947903299, 'epochs': 350, 'loss': 'mae', 'optimizer': 'adam', 'graph_mode': 'off', 'use_snp_selection': False}. Best is trial 8 with value: 0.07598263944383649.
[I 2025-12-05 15:17:16,765] Trial 29 finished with value: 0.02500404315099975 and parameters: {'model_type': 'mlp', 'hidden_dims': '[128, 64]', 'dropout': 0.18012991187472574, 'batch_norm': True, 'lr': 7.661580115337146e-06, 'weight_decay': 0.00031693975906676574, 'epochs': 344, 'loss': 'mae', 'optimizer': 'adam', 'graph_mode': 'off', 'use_snp_selection': True, 'num_snps': 19468}. Best is trial 8 with value: 0.07598263944383649.
[I 2025-12-05 15:17:18,647] Trial 30 finished with value: 0.046337104557501445 and parameters: {'model_type': 'mlp', 'hidden_dims': '[256, 128]', 'dropout': 0.21840837466466845, 'batch_norm': True, 'lr': 3.542157463662971e-06, 'weight_decay': 6.384958277342087e-05, 'epochs': 315, 'loss': 'mae', 'optimizer': 'adam', 'graph_mode': 'off', 'use_snp_selection': False}. Best is trial 8 with value: 0.07598263944383649.
[I 2025-12-05 15:17:22,220] Trial 31 finished with value: 0.051709965038638527 and parameters: {'model_type': 'mlp', 'hidden_dims': '[512, 256]', 'dropout': 0.10452865787787058, 'batch_norm': True, 'lr': 1.4091076752885697e-05, 'weight_decay': 0.0005190703049217317, 'epochs': 350, 'loss': 'mae', 'optimizer': 'adam', 'graph_mode': 'off', 'use_snp_selection': False}. Best is trial 8 with value: 0.07598263944383649.
[I 2025-12-05 15:17:25,066] Trial 32 finished with value: 0.057492330280124154 and parameters: {'model_type': 'mlp', 'hidden_dims': '[512, 256]', 'dropout': 0.12897708781796471, 'batch_norm': True, 'lr': 3.7009324849267675e-05, 'weight_decay': 0.00019105793573188245, 'epochs': 259, 'loss': 'mae', 'optimizer': 'adam', 'graph_mode': 'off', 'use_snp_selection': False}. Best is trial 8 with value: 0.07598263944383649.
[I 2025-12-05 15:17:28,425] Trial 33 finished with value: 0.08617519563411301 and parameters: {'model_type': 'mlp', 'hidden_dims': '[512, 256]', 'dropout': 0.1711219126015809, 'batch_norm': True, 'lr': 2.0105328545820112e-05, 'weight_decay': 8.822340236655884e-05, 'epochs': 326, 'loss': 'mae', 'optimizer': 'adam', 'graph_mode': 'off', 'use_snp_selection': False}. Best is trial 33 with value: 0.08617519563411301.
[I 2025-12-05 15:17:30,414] Trial 34 finished with value: 0.04215169291103052 and parameters: {'model_type': 'mlp', 'hidden_dims': '[256, 128, 64]', 'dropout': 0.16997035187346096, 'batch_norm': True, 'lr': 2.05689560554885e-05, 'weight_decay': 7.439098817771211e-05, 'epochs': 325, 'loss': 'mae', 'optimizer': 'adam', 'graph_mode': 'off', 'use_snp_selection': False}. Best is trial 33 with value: 0.08617519563411301.
[I 2025-12-05 15:17:33,608] Trial 35 finished with value: 0.007961936188435843 and parameters: {'model_type': 'mlp', 'hidden_dims': '[512, 256]', 'dropout': 0.22328562655849454, 'batch_norm': True, 'lr': 7.906022775626281e-06, 'weight_decay': 0.0003796537661895961, 'epochs': 306, 'loss': 'mae', 'optimizer': 'adam', 'graph_mode': 'off', 'use_snp_selection': False}. Best is trial 33 with value: 0.08617519563411301.
[I 2025-12-05 15:17:36,819] Trial 36 finished with value: 0.05230239032254394 and parameters: {'model_type': 'mlp', 'hidden_dims': '[128, 64]', 'dropout': 0.1719014741976848, 'batch_norm': True, 'lr': 2.6432498513725455e-06, 'weight_decay': 1.0687295154404784e-05, 'epochs': 335, 'loss': 'mse', 'optimizer': 'adam', 'graph_mode': 'off', 'use_snp_selection': True, 'num_snps': 58661}. Best is trial 33 with value: 0.08617519563411301.
[I 2025-12-05 15:17:38,696] Trial 37 finished with value: 0.05057107454815781 and parameters: {'model_type': 'mlp', 'hidden_dims': '[256, 128]', 'dropout': 0.11843005102027765, 'batch_norm': True, 'lr': 3.911825147225225e-05, 'weight_decay': 3.7197092094454644e-05, 'epochs': 297, 'loss': 'mae', 'optimizer': 'adam', 'graph_mode': 'off', 'use_snp_selection': False}. Best is trial 33 with value: 0.08617519563411301.
[I 2025-12-05 15:17:40,804] Trial 38 finished with value: 0.05019030079610165 and parameters: {'model_type': 'mlp', 'hidden_dims': '[512, 64]', 'dropout': 0.1666062197822542, 'batch_norm': True, 'lr': 7.900184711207535e-06, 'weight_decay': 0.00021679171625037775, 'epochs': 267, 'loss': 'mse', 'optimizer': 'adam', 'graph_mode': 'off', 'use_snp_selection': True, 'num_snps': 19911}. Best is trial 33 with value: 0.08617519563411301.
[I 2025-12-05 15:17:44,205] Trial 39 finished with value: 0.0229762463468068 and parameters: {'model_type': 'mlp', 'hidden_dims': '[512, 256]', 'dropout': 0.593444752072398, 'batch_norm': True, 'lr': 1.9477662944104757e-05, 'weight_decay': 0.000494866061743946, 'epochs': 330, 'loss': 'mae', 'optimizer': 'adam', 'graph_mode': 'off', 'use_snp_selection': False}. Best is trial 33 with value: 0.08617519563411301.
[I 2025-12-05 15:17:46,843] Trial 40 finished with value: 0.017066584591350357 and parameters: {'model_type': 'mlp', 'hidden_dims': '[512, 256]', 'dropout': 0.23198053198968652, 'batch_norm': True, 'lr': 4.767147905519569e-06, 'weight_decay': 8.260070772572587e-05, 'epochs': 238, 'loss': 'mse', 'optimizer': 'adam', 'graph_mode': 'off', 'use_snp_selection': False}. Best is trial 33 with value: 0.08617519563411301.
[I 2025-12-05 15:17:48,834] Trial 41 finished with value: 0.03617549432497843 and parameters: {'model_type': 'mlp', 'hidden_dims': '[512, 256]', 'dropout': 0.13565419431980047, 'batch_norm': True, 'lr': 7.537203873077524e-05, 'weight_decay': 0.00016807320533150001, 'epochs': 156, 'loss': 'mae', 'optimizer': 'adam', 'graph_mode': 'off', 'use_snp_selection': False}. Best is trial 33 with value: 0.08617519563411301.
[I 2025-12-05 15:17:50,672] Trial 42 finished with value: 0.023421755792502035 and parameters: {'model_type': 'mlp', 'hidden_dims': '[512, 256]', 'dropout': 0.12977541200805534, 'batch_norm': True, 'lr': 1.1775036778471707e-05, 'weight_decay': 9.173365330859725e-05, 'epochs': 135, 'loss': 'mae', 'optimizer': 'adam', 'graph_mode': 'off', 'use_snp_selection': False}. Best is trial 33 with value: 0.08617519563411301.
[I 2025-12-05 15:17:51,749] Trial 43 finished with value: 0.041276636184214406 and parameters: {'model_type': 'mlp', 'hidden_dims': '[256, 128, 64]', 'dropout': 0.36777615361736904, 'batch_norm': True, 'lr': 4.853863013475687e-05, 'weight_decay': 1.9294982991378903e-05, 'epochs': 107, 'loss': 'mae', 'optimizer': 'adam', 'graph_mode': 'off', 'use_snp_selection': False}. Best is trial 33 with value: 0.08617519563411301.
[I 2025-12-05 15:17:54,036] Trial 44 finished with value: 0.05412971913942247 and parameters: {'model_type': 'mlp', 'hidden_dims': '[512, 256]', 'dropout': 0.15406608362669552, 'batch_norm': True, 'lr': 8.131900430163623e-05, 'weight_decay': 0.0005969117938373037, 'epochs': 189, 'loss': 'mae', 'optimizer': 'adam', 'graph_mode': 'off', 'use_snp_selection': False}. Best is trial 33 with value: 0.08617519563411301.
[I 2025-12-05 15:17:57,605] Trial 45 finished with value: 0.05815311024173427 and parameters: {'model_type': 'mlp', 'hidden_dims': '[512, 64]', 'dropout': 0.27143607373816925, 'batch_norm': True, 'lr': 2.7945550729536608e-05, 'weight_decay': 0.0002670342648486646, 'epochs': 350, 'loss': 'mae', 'optimizer': 'adam', 'graph_mode': 'off', 'use_snp_selection': False}. Best is trial 33 with value: 0.08617519563411301.
[I 2025-12-05 15:17:59,417] Trial 46 finished with value: 0.05700427003801309 and parameters: {'model_type': 'mlp', 'hidden_dims': '[256, 128]', 'dropout': 0.12237176629180031, 'batch_norm': True, 'lr': 0.00016935026158082275, 'weight_decay': 3.310278685650155e-05, 'epochs': 300, 'loss': 'mae', 'optimizer': 'adam', 'graph_mode': 'off', 'use_snp_selection': False}. Best is trial 33 with value: 0.08617519563411301.
[I 2025-12-05 15:18:01,995] Trial 47 finished with value: 0.06714930096408213 and parameters: {'model_type': 'mlp', 'hidden_dims': '[512, 256]', 'dropout': 0.1972223997171541, 'batch_norm': True, 'lr': 0.0002792458396332852, 'weight_decay': 6.359895876866024e-06, 'epochs': 229, 'loss': 'mae', 'optimizer': 'adam', 'graph_mode': 'off', 'use_snp_selection': False}. Best is trial 33 with value: 0.08617519563411301.
[I 2025-12-05 15:18:04,949] Trial 48 finished with value: -0.009973456087476539 and parameters: {'model_type': 'mlp', 'hidden_dims': '[512, 256]', 'dropout': 0.1034652614561046, 'batch_norm': True, 'lr': 1.1170552432785515e-06, 'weight_decay': 0.00010507740444090134, 'epochs': 273, 'loss': 'mae', 'optimizer': 'adam', 'graph_mode': 'off', 'use_snp_selection': False}. Best is trial 33 with value: 0.08617519563411301.
[I 2025-12-05 15:18:07,355] Trial 49 finished with value: 0.02452511945896656 and parameters: {'model_type': 'mlp', 'hidden_dims': '[128, 64]', 'dropout': 0.15869293853362965, 'batch_norm': False, 'lr': 1.7202117838654852e-05, 'weight_decay': 1.6781090043221852e-05, 'epochs': 156, 'loss': 'mse', 'optimizer': 'adam', 'graph_mode': 'off', 'use_snp_selection': True, 'num_snps': 46888}. Best is trial 33 with value: 0.08617519563411301.
[I 2025-12-05 15:18:08,837] Trial 50 finished with value: 0.027497486192790924 and parameters: {'model_type': 'mlp', 'hidden_dims': '[512, 128]', 'dropout': 0.18086238619599923, 'batch_norm': True, 'lr': 1.0273292468231314e-05, 'weight_decay': 5.3432342394281106e-05, 'epochs': 88, 'loss': 'mae', 'optimizer': 'adam', 'graph_mode': 'off', 'use_snp_selection': False}. Best is trial 33 with value: 0.08617519563411301.
[I 2025-12-05 15:18:11,237] Trial 51 finished with value: 0.05825007007152099 and parameters: {'model_type': 'mlp', 'hidden_dims': '[512, 256]', 'dropout': 0.20386434278493573, 'batch_norm': True, 'lr': 0.0002871211203155564, 'weight_decay': 7.836397804351335e-06, 'epochs': 207, 'loss': 'mae', 'optimizer': 'adam', 'graph_mode': 'off', 'use_snp_selection': False}. Best is trial 33 with value: 0.08617519563411301.
[I 2025-12-05 15:18:13,880] Trial 52 finished with value: 0.06442000438325227 and parameters: {'model_type': 'mlp', 'hidden_dims': '[512, 256]', 'dropout': 0.2536505442920915, 'batch_norm': True, 'lr': 0.00048712210590659425, 'weight_decay': 4.041381296812353e-06, 'epochs': 238, 'loss': 'mae', 'optimizer': 'adam', 'graph_mode': 'off', 'use_snp_selection': False}. Best is trial 33 with value: 0.08617519563411301.
[I 2025-12-05 15:18:16,154] Trial 53 finished with value: 0.061360850532641474 and parameters: {'model_type': 'mlp', 'hidden_dims': '[512, 256]', 'dropout': 0.21792061898453163, 'batch_norm': True, 'lr': 0.00016075025965935183, 'weight_decay': 2.1403662168497423e-06, 'epochs': 192, 'loss': 'mae', 'optimizer': 'adam', 'graph_mode': 'off', 'use_snp_selection': False}. Best is trial 33 with value: 0.08617519563411301.
[I 2025-12-05 15:18:19,161] Trial 54 finished with value: 0.05923296701203887 and parameters: {'model_type': 'mlp', 'hidden_dims': '[512, 256]', 'dropout': 0.43743617279638136, 'batch_norm': True, 'lr': 0.00024692680710668207, 'weight_decay': 1.2680377226938885e-05, 'epochs': 284, 'loss': 'mae', 'optimizer': 'adam', 'graph_mode': 'off', 'use_snp_selection': False}. Best is trial 33 with value: 0.08617519563411301.
[I 2025-12-05 15:18:22,584] Trial 55 finished with value: 0.05949459767642635 and parameters: {'model_type': 'mlp', 'hidden_dims': '[512, 128]', 'dropout': 0.18700400641348086, 'batch_norm': True, 'lr': 0.0003371404209739211, 'weight_decay': 1.000330175776035e-06, 'epochs': 337, 'loss': 'mae', 'optimizer': 'adam', 'graph_mode': 'off', 'use_snp_selection': False}. Best is trial 33 with value: 0.08617519563411301.
[I 2025-12-05 15:18:25,866] Trial 56 finished with value: 0.043454757337120224 and parameters: {'model_type': 'mlp', 'hidden_dims': '[512, 64]', 'dropout': 0.11964398291404549, 'batch_norm': False, 'lr': 5.444036182446705e-05, 'weight_decay': 7.324152203190395e-06, 'epochs': 321, 'loss': 'mae', 'optimizer': 'adam', 'graph_mode': 'off', 'use_snp_selection': False}. Best is trial 33 with value: 0.08617519563411301.
[I 2025-12-05 15:18:27,520] Trial 57 finished with value: 0.07327174884239142 and parameters: {'model_type': 'mlp', 'hidden_dims': '[256, 128, 64]', 'dropout': 0.1470073113493424, 'batch_norm': True, 'lr': 0.0006744222314802099, 'weight_decay': 0.00021502811941303987, 'epochs': 253, 'loss': 'mae', 'optimizer': 'adam', 'graph_mode': 'off', 'use_snp_selection': False}. Best is trial 33 with value: 0.08617519563411301.
[I 2025-12-05 15:18:29,398] Trial 58 finished with value: 0.06478505140799636 and parameters: {'model_type': 'mlp', 'hidden_dims': '[256, 128, 64]', 'dropout': 0.1421515568436077, 'batch_norm': True, 'lr': 0.0009969046936348193, 'weight_decay': 0.0002320366429523724, 'epochs': 311, 'loss': 'mae', 'optimizer': 'adam', 'graph_mode': 'off', 'use_snp_selection': False}. Best is trial 33 with value: 0.08617519563411301.
[I 2025-12-05 15:18:30,729] Trial 59 finished with value: 0.07673185267584084 and parameters: {'model_type': 'mlp', 'hidden_dims': '[256, 128, 64]', 'dropout': 0.15622459756216822, 'batch_norm': True, 'lr': 0.0005399484499302034, 'weight_decay': 0.0003820360531267326, 'epochs': 172, 'loss': 'mae', 'optimizer': 'adam', 'graph_mode': 'off', 'use_snp_selection': False}. Best is trial 33 with value: 0.08617519563411301.
