[I 2025-12-05 23:31:26,426] Trial 69 finished with value: 0.3076573429869506 and parameters: {'model_type': 'mlp', 'hidden_dims': '[512, 256]', 'dropout': 0.2908562520575053, 'batch_norm': True, 'lr': 7.465183399339934e-05, 'weight_decay': 2.2910886357318465e-07, 'epochs': 221, 'loss': 'mae', 'optimizer': 'adam', 'graph_mode': 'off', 'use_snp_selection': False}. Best is trial 30 with value: 0.31280682310133995.
[I 2025-12-05 23:32:15,537] Trial 70 finished with value: 0.30862868531358056 and parameters: {'model_type': 'mlp', 'hidden_dims': '[512, 256]', 'dropout': 0.21345812839385048, 'batch_norm': True, 'lr': 4.171470342147917e-05, 'weight_decay': 1.319290966789486e-07, 'epochs': 249, 'loss': 'mse', 'optimizer': 'adam', 'graph_mode': 'off', 'use_snp_selection': False}. Best is trial 30 with value: 0.31280682310133995.
[I 2025-12-05 23:32:56,815] Trial 71 finished with value: 0.30994682315450656 and parameters: {'model_type': 'mlp', 'hidden_dims': '[512, 256]', 'dropout': 0.12113075685944746, 'batch_norm': True, 'lr': 9.58483015259555e-05, 'weight_decay': 2.751530095633506e-07, 'epochs': 204, 'loss': 'mae', 'optimizer': 'adam', 'graph_mode': 'off', 'use_snp_selection': False}. Best is trial 30 with value: 0.31280682310133995.
[I 2025-12-05 23:33:37,917] Trial 72 finished with value: 0.3100226288420904 and parameters: {'model_type': 'mlp', 'hidden_dims': '[512, 256]', 'dropout': 0.13793020505949213, 'batch_norm': True, 'lr': 0.00017514247855880986, 'weight_decay': 3.3256240916047093e-07, 'epochs': 203, 'loss': 'mae', 'optimizer': 'adam', 'graph_mode': 'off', 'use_snp_selection': False}. Best is trial 30 with value: 0.31280682310133995.
[I 2025-12-05 23:34:18,652] Trial 73 finished with value: 0.30814437989965404 and parameters: {'model_type': 'mlp', 'hidden_dims': '[512, 256]', 'dropout': 0.1230316126530425, 'batch_norm': True, 'lr': 0.00014949151327521838, 'weight_decay': 3.157787568420165e-07, 'epochs': 201, 'loss': 'mae', 'optimizer': 'adam', 'graph_mode': 'off', 'use_snp_selection': False}. Best is trial 30 with value: 0.31280682310133995.
[I 2025-12-05 23:34:55,490] Trial 74 finished with value: 0.3127552988868646 and parameters: {'model_type': 'mlp', 'hidden_dims': '[512, 256]', 'dropout': 0.13903443668132667, 'batch_norm': True, 'lr': 0.00018881667394874218, 'weight_decay': 1.905830158354849e-07, 'epochs': 179, 'loss': 'mae', 'optimizer': 'adam', 'graph_mode': 'off', 'use_snp_selection': False}. Best is trial 30 with value: 0.31280682310133995.
[I 2025-12-05 23:35:31,991] Trial 75 finished with value: 0.3096780323899402 and parameters: {'model_type': 'mlp', 'hidden_dims': '[512, 256]', 'dropout': 0.14595093650244007, 'batch_norm': True, 'lr': 0.0002894943928712938, 'weight_decay': 1.7731890779650395e-07, 'epochs': 177, 'loss': 'mae', 'optimizer': 'adam', 'graph_mode': 'off', 'use_snp_selection': False}. Best is trial 30 with value: 0.31280682310133995.
[I 2025-12-05 23:36:09,901] Trial 76 finished with value: 0.30905013950898835 and parameters: {'model_type': 'mlp', 'hidden_dims': '[512, 256]', 'dropout': 0.11253650539670415, 'batch_norm': True, 'lr': 0.0004119320607639494, 'weight_decay': 2.920022742796766e-07, 'epochs': 185, 'loss': 'mae', 'optimizer': 'adam', 'graph_mode': 'off', 'use_snp_selection': False}. Best is trial 30 with value: 0.31280682310133995.
[I 2025-12-05 23:36:42,503] Trial 77 finished with value: 0.3102052436751016 and parameters: {'model_type': 'mlp', 'hidden_dims': '[512, 256]', 'dropout': 0.13940919581735986, 'batch_norm': True, 'lr': 0.00019293914506731335, 'weight_decay': 4.542204944199606e-07, 'epochs': 155, 'loss': 'mae', 'optimizer': 'adam', 'graph_mode': 'off', 'use_snp_selection': False}. Best is trial 30 with value: 0.31280682310133995.
[I 2025-12-05 23:37:37,862] Trial 78 finished with value: 0.30569887363482706 and parameters: {'model_type': 'mlp', 'hidden_dims': '[512, 256]', 'dropout': 0.14040104737656753, 'batch_norm': False, 'lr': 0.00017982088805018132, 'weight_decay': 7.567093638030359e-07, 'epochs': 153, 'loss': 'mae', 'optimizer': 'adam', 'graph_mode': 'off', 'use_snp_selection': True, 'num_snps': 47926}. Best is trial 30 with value: 0.31280682310133995.
[I 2025-12-05 23:37:54,999] Trial 79 finished with value: 0.3083465522434171 and parameters: {'model_type': 'mlp', 'hidden_dims': '[256, 128]', 'dropout': 0.16769639483248666, 'batch_norm': True, 'lr': 0.0004490017035995532, 'weight_decay': 4.981915361319282e-07, 'epochs': 134, 'loss': 'mae', 'optimizer': 'adam', 'graph_mode': 'off', 'use_snp_selection': False}. Best is trial 30 with value: 0.31280682310133995.
[I 2025-12-05 23:38:28,587] Trial 80 finished with value: 0.304800681793248 and parameters: {'model_type': 'mlp', 'hidden_dims': '[512, 256]', 'dropout': 0.24552587368210474, 'batch_norm': True, 'lr': 0.00021381878973065867, 'weight_decay': 1.4051530863248555e-07, 'epochs': 161, 'loss': 'mae', 'optimizer': 'adam', 'graph_mode': 'off', 'use_snp_selection': False}. Best is trial 30 with value: 0.31280682310133995.
[I 2025-12-05 23:39:10,788] Trial 81 finished with value: 0.313795582611371 and parameters: {'model_type': 'mlp', 'hidden_dims': '[512, 256]', 'dropout': 0.11465090958011842, 'batch_norm': True, 'lr': 9.810694517622758e-05, 'weight_decay': 1.9629706305442882e-07, 'epochs': 210, 'loss': 'mae', 'optimizer': 'adam', 'graph_mode': 'off', 'use_snp_selection': False}. Best is trial 81 with value: 0.313795582611371.
[I 2025-12-05 23:39:45,471] Trial 82 finished with value: 0.3102410492112185 and parameters: {'model_type': 'mlp', 'hidden_dims': '[512, 256]', 'dropout': 0.32310986390122265, 'batch_norm': True, 'lr': 0.00012114314095777127, 'weight_decay': 1.9822110873840495e-07, 'epochs': 167, 'loss': 'mae', 'optimizer': 'adam', 'graph_mode': 'off', 'use_snp_selection': False}. Best is trial 81 with value: 0.313795582611371.
[I 2025-12-05 23:40:19,672] Trial 83 finished with value: 0.31091974151642404 and parameters: {'model_type': 'mlp', 'hidden_dims': '[512, 256]', 'dropout': 0.3645376806166068, 'batch_norm': True, 'lr': 0.00012772598190946867, 'weight_decay': 1.8054158491792977e-07, 'epochs': 164, 'loss': 'mae', 'optimizer': 'adam', 'graph_mode': 'off', 'use_snp_selection': False}. Best is trial 81 with value: 0.313795582611371.
[I 2025-12-05 23:40:54,881] Trial 84 finished with value: 0.3074548594414491 and parameters: {'model_type': 'mlp', 'hidden_dims': '[512, 256]', 'dropout': 0.32247997328573424, 'batch_norm': True, 'lr': 7.771123510248734e-05, 'weight_decay': 1.9567322084156105e-07, 'epochs': 170, 'loss': 'mae', 'optimizer': 'adam', 'graph_mode': 'off', 'use_snp_selection': False}. Best is trial 81 with value: 0.313795582611371.
[I 2025-12-05 23:41:10,228] Trial 85 finished with value: 0.30644683407477646 and parameters: {'model_type': 'mlp', 'hidden_dims': '[128, 64]', 'dropout': 0.3777026233804489, 'batch_norm': True, 'lr': 9.96476850800322e-05, 'weight_decay': 1.1817032005544879e-07, 'epochs': 211, 'loss': 'mae', 'optimizer': 'adam', 'graph_mode': 'off', 'use_snp_selection': False}. Best is trial 81 with value: 0.313795582611371.
[I 2025-12-05 23:41:47,033] Trial 86 finished with value: 0.30941429434072576 and parameters: {'model_type': 'mlp', 'hidden_dims': '[512, 256]', 'dropout': 0.35704206023941576, 'batch_norm': True, 'lr': 0.000123892690559623, 'weight_decay': 2.3258287960900176e-07, 'epochs': 179, 'loss': 'mae', 'optimizer': 'adam', 'graph_mode': 'off', 'use_snp_selection': False}. Best is trial 81 with value: 0.313795582611371.
[I 2025-12-05 23:42:06,872] Trial 87 finished with value: 0.302625171881359 and parameters: {'model_type': 'mlp', 'hidden_dims': '[256, 128, 64]', 'dropout': 0.39488174029680695, 'batch_norm': False, 'lr': 5.8952488505825236e-05, 'weight_decay': 1.472716298603615e-07, 'epochs': 167, 'loss': 'mae', 'optimizer': 'adam', 'graph_mode': 'off', 'use_snp_selection': False}. Best is trial 81 with value: 0.313795582611371.
[I 2025-12-05 23:42:36,982] Trial 88 finished with value: 0.30912803339630235 and parameters: {'model_type': 'mlp', 'hidden_dims': '[512, 256]', 'dropout': 0.4194230520221646, 'batch_norm': True, 'lr': 0.00015183293931488045, 'weight_decay': 1.7764441757645407e-07, 'epochs': 141, 'loss': 'mae', 'optimizer': 'adam', 'graph_mode': 'off', 'use_snp_selection': False}. Best is trial 81 with value: 0.313795582611371.
[I 2025-12-05 23:43:17,574] Trial 89 finished with value: 0.312827281063925 and parameters: {'model_type': 'mlp', 'hidden_dims': '[512, 256]', 'dropout': 0.43704670938853074, 'batch_norm': True, 'lr': 4.786825201039813e-05, 'weight_decay': 1.0131300765824619e-07, 'epochs': 195, 'loss': 'mae', 'optimizer': 'adam', 'graph_mode': 'off', 'use_snp_selection': True, 'num_snps': 23366}. Best is trial 81 with value: 0.313795582611371.
[I 2025-12-05 23:43:57,729] Trial 90 finished with value: 0.3071752327706375 and parameters: {'model_type': 'mlp', 'hidden_dims': '[512, 256]', 'dropout': 0.436847982009011, 'batch_norm': True, 'lr': 5.267384418742119e-05, 'weight_decay': 1.0637038793455359e-07, 'epochs': 189, 'loss': 'mae', 'optimizer': 'adam', 'graph_mode': 'off', 'use_snp_selection': True, 'num_snps': 23069}. Best is trial 81 with value: 0.313795582611371.
[I 2025-12-05 23:44:31,509] Trial 91 finished with value: 0.30973184298380235 and parameters: {'model_type': 'mlp', 'hidden_dims': '[512, 256]', 'dropout': 0.3527939522419808, 'batch_norm': True, 'lr': 4.088708999633494e-05, 'weight_decay': 2.579500595994279e-07, 'epochs': 217, 'loss': 'mae', 'optimizer': 'adam', 'graph_mode': 'off', 'use_snp_selection': True, 'num_snps': 13834}. Best is trial 81 with value: 0.313795582611371.
[I 2025-12-05 23:45:21,163] Trial 92 finished with value: 0.30603726011779897 and parameters: {'model_type': 'mlp', 'hidden_dims': '[512, 256]', 'dropout': 0.3283323991494002, 'batch_norm': True, 'lr': 0.00011229338772335954, 'weight_decay': 1.4454761343885484e-07, 'epochs': 234, 'loss': 'mae', 'optimizer': 'adam', 'graph_mode': 'off', 'use_snp_selection': True, 'num_snps': 30421}. Best is trial 81 with value: 0.313795582611371.
[I 2025-12-05 23:46:07,533] Trial 93 finished with value: 0.3053908879852796 and parameters: {'model_type': 'mlp', 'hidden_dims': '[512, 256]', 'dropout': 0.28613012203107824, 'batch_norm': True, 'lr': 7.046310615579961e-05, 'weight_decay': 2.0500950396840287e-07, 'epochs': 196, 'loss': 'mae', 'optimizer': 'adam', 'graph_mode': 'off', 'use_snp_selection': True, 'num_snps': 29757}. Best is trial 81 with value: 0.313795582611371.
[I 2025-12-05 23:46:37,408] Trial 94 finished with value: 0.31069413483453995 and parameters: {'model_type': 'mlp', 'hidden_dims': '[512, 256]', 'dropout': 0.10272116517874895, 'batch_norm': True, 'lr': 0.00012442737020679502, 'weight_decay': 3.726521936119039e-07, 'epochs': 182, 'loss': 'mae', 'optimizer': 'adam', 'graph_mode': 'off', 'use_snp_selection': True, 'num_snps': 10839}. Best is trial 81 with value: 0.313795582611371.
[I 2025-12-05 23:47:04,497] Trial 95 finished with value: 0.30692828467897404 and parameters: {'model_type': 'mlp', 'hidden_dims': '[256, 128]', 'dropout': 0.10015436160099361, 'batch_norm': True, 'lr': 9.119826774052984e-05, 'weight_decay': 6.959856013533692e-07, 'epochs': 182, 'loss': 'mae', 'optimizer': 'adam', 'graph_mode': 'off', 'use_snp_selection': True, 'num_snps': 10932}. Best is trial 81 with value: 0.313795582611371.
[I 2025-12-05 23:47:38,026] Trial 96 finished with value: 0.24228542186292193 and parameters: {'model_type': 'mlp', 'hidden_dims': '[512, 256]', 'dropout': 0.406281530314237, 'batch_norm': True, 'lr': 1.46071349188792e-06, 'weight_decay': 1.2636393802225523e-07, 'epochs': 194, 'loss': 'mae', 'optimizer': 'adam', 'graph_mode': 'off', 'use_snp_selection': True, 'num_snps': 15042}. Best is trial 81 with value: 0.313795582611371.
[I 2025-12-05 23:48:02,537] Trial 97 finished with value: 0.290495325194677 and parameters: {'model_type': 'mlp', 'hidden_dims': '[128, 64]', 'dropout': 0.44954706280308665, 'batch_norm': False, 'lr': 2.770833227344972e-05, 'weight_decay': 1.0106150328028644e-07, 'epochs': 224, 'loss': 'mae', 'optimizer': 'adam', 'graph_mode': 'off', 'use_snp_selection': True, 'num_snps': 7703}. Best is trial 81 with value: 0.313795582611371.
[I 2025-12-05 23:48:39,739] Trial 98 finished with value: 0.3077027444455525 and parameters: {'model_type': 'mlp', 'hidden_dims': '[512, 256]', 'dropout': 0.11135603170556153, 'batch_norm': True, 'lr': 0.00024251582822280683, 'weight_decay': 4.0652503656155057e-07, 'epochs': 213, 'loss': 'mae', 'optimizer': 'adam', 'graph_mode': 'off', 'use_snp_selection': True, 'num_snps': 18329}. Best is trial 81 with value: 0.313795582611371.
[I 2025-12-05 23:49:12,869] Trial 99 finished with value: 0.30131414665255596 and parameters: {'model_type': 'mlp', 'hidden_dims': '[256, 128, 64]', 'dropout': 0.15848183851869327, 'batch_norm': True, 'lr': 0.0001454678776246588, 'weight_decay': 1.6274535687724623e-07, 'epochs': 124, 'loss': 'mae', 'optimizer': 'adam', 'graph_mode': 'off', 'use_snp_selection': True, 'num_snps': 26411}. Best is trial 81 with value: 0.313795582611371.
[I 2025-12-05 23:50:06,430] Trial 100 finished with value: 0.3079907973434769 and parameters: {'model_type': 'mlp', 'hidden_dims': '[512, 256]', 'dropout': 0.470645464244986, 'batch_norm': True, 'lr': 4.581870300825531e-05, 'weight_decay': 2.5634499311192925e-07, 'epochs': 210, 'loss': 'mae', 'optimizer': 'adam', 'graph_mode': 'off', 'use_snp_selection': True, 'num_snps': 37406}. Best is trial 81 with value: 0.313795582611371.
[I 2025-12-05 23:50:41,718] Trial 101 finished with value: 0.31113165610372173 and parameters: {'model_type': 'mlp', 'hidden_dims': '[512, 256]', 'dropout': 0.503584514973183, 'batch_norm': True, 'lr': 8.345131348041567e-05, 'weight_decay': 1.8942944863578603e-07, 'epochs': 171, 'loss': 'mae', 'optimizer': 'adam', 'graph_mode': 'off', 'use_snp_selection': False}. Best is trial 81 with value: 0.313795582611371.
[I 2025-12-05 23:51:18,018] Trial 102 finished with value: 0.279729677472725 and parameters: {'model_type': 'mlp', 'hidden_dims': '[512, 256]', 'dropout': 0.5087212480048631, 'batch_norm': True, 'lr': 1.8672219987002257e-06, 'weight_decay': 3.591745513154302e-07, 'epochs': 159, 'loss': 'mae', 'optimizer': 'adam', 'graph_mode': 'off', 'use_snp_selection': False}. Best is trial 81 with value: 0.313795582611371.
[I 2025-12-05 23:51:53,759] Trial 103 finished with value: 0.3106758228454744 and parameters: {'model_type': 'mlp', 'hidden_dims': '[512, 256]', 'dropout': 0.4454774676064547, 'batch_norm': True, 'lr': 8.477967361042495e-05, 'weight_decay': 1.7691840478602226e-07, 'epochs': 173, 'loss': 'mae', 'optimizer': 'adam', 'graph_mode': 'off', 'use_snp_selection': False}. Best is trial 81 with value: 0.313795582611371.
[I 2025-12-05 23:52:29,310] Trial 104 finished with value: 0.30865983670016534 and parameters: {'model_type': 'mlp', 'hidden_dims': '[512, 256]', 'dropout': 0.4395428318486481, 'batch_norm': True, 'lr': 8.224870610256702e-05, 'weight_decay': 1.3025507175975194e-07, 'epochs': 172, 'loss': 'mae', 'optimizer': 'adam', 'graph_mode': 'off', 'use_snp_selection': False}. Best is trial 81 with value: 0.313795582611371.
[I 2025-12-05 23:53:07,866] Trial 105 finished with value: 0.30813206758624184 and parameters: {'model_type': 'mlp', 'hidden_dims': '[512, 256]', 'dropout': 0.4057271766110109, 'batch_norm': True, 'lr': 6.871236266216473e-05, 'weight_decay': 2.522927481389829e-07, 'epochs': 189, 'loss': 'mae', 'optimizer': 'adam', 'graph_mode': 'off', 'use_snp_selection': False}. Best is trial 81 with value: 0.313795582611371.
[I 2025-12-05 23:53:43,796] Trial 106 finished with value: 0.3031042221423429 and parameters: {'model_type': 'mlp', 'hidden_dims': '[512, 64]', 'dropout': 0.4325905374038985, 'batch_norm': False, 'lr': 0.00010781293109505498, 'weight_decay': 1.2586763140685823e-07, 'epochs': 177, 'loss': 'mae', 'optimizer': 'adam', 'graph_mode': 'off', 'use_snp_selection': False}. Best is trial 81 with value: 0.313795582611371.
[I 2025-12-05 23:54:24,126] Trial 107 finished with value: 0.31078759234228037 and parameters: {'model_type': 'mlp', 'hidden_dims': '[512, 256]', 'dropout': 0.4962498227732718, 'batch_norm': True, 'lr': 5.560113174145187e-05, 'weight_decay': 3.084701109510822e-05, 'epochs': 199, 'loss': 'mae', 'optimizer': 'adam', 'graph_mode': 'off', 'use_snp_selection': False}. Best is trial 81 with value: 0.313795582611371.
[I 2025-12-05 23:54:51,243] Trial 108 finished with value: 0.2985241472394722 and parameters: {'model_type': 'mlp', 'hidden_dims': '[512, 256]', 'dropout': 0.49702188838327693, 'batch_norm': True, 'lr': 5.518052782440875e-05, 'weight_decay': 7.968238278557285e-05, 'epochs': 183, 'loss': 'mae', 'optimizer': 'adam', 'graph_mode': 'off', 'use_snp_selection': True, 'num_snps': 7272}. Best is trial 81 with value: 0.313795582611371.
[I 2025-12-05 23:55:31,483] Trial 109 finished with value: 0.30686393377558063 and parameters: {'model_type': 'mlp', 'hidden_dims': '[512, 256]', 'dropout': 0.47145755100698894, 'batch_norm': True, 'lr': 3.483154448187142e-05, 'weight_decay': 3.2686352267730365e-05, 'epochs': 199, 'loss': 'mae', 'optimizer': 'adam', 'graph_mode': 'off', 'use_snp_selection': False}. Best is trial 81 with value: 0.313795582611371.
[I 2025-12-05 23:56:05,306] Trial 110 finished with value: 0.3085029408867528 and parameters: {'model_type': 'mlp', 'hidden_dims': '[512, 64]', 'dropout': 0.5331624398682666, 'batch_norm': True, 'lr': 6.297059302566255e-05, 'weight_decay': 5.473794938039092e-05, 'epochs': 163, 'loss': 'mae', 'optimizer': 'adam', 'graph_mode': 'off', 'use_snp_selection': False}. Best is trial 81 with value: 0.313795582611371.
[I 2025-12-05 23:56:36,300] Trial 111 finished with value: 0.31135926030217537 and parameters: {'model_type': 'mlp', 'hidden_dims': '[512, 256]', 'dropout': 0.45097316292446366, 'batch_norm': True, 'lr': 8.383249494644905e-05, 'weight_decay': 1.766949989457975e-05, 'epochs': 146, 'loss': 'mae', 'optimizer': 'adam', 'graph_mode': 'off', 'use_snp_selection': False}. Best is trial 81 with value: 0.313795582611371.
[I 2025-12-05 23:57:06,741] Trial 112 finished with value: 0.3103890055321282 and parameters: {'model_type': 'mlp', 'hidden_dims': '[512, 256]', 'dropout': 0.45167673302902334, 'batch_norm': True, 'lr': 3.824040904866197e-05, 'weight_decay': 1.3555700176842403e-05, 'epochs': 143, 'loss': 'mae', 'optimizer': 'adam', 'graph_mode': 'off', 'use_snp_selection': False}. Best is trial 81 with value: 0.313795582611371.
[I 2025-12-05 23:57:34,885] Trial 113 finished with value: 0.3121493479775909 and parameters: {'model_type': 'mlp', 'hidden_dims': '[512, 256]', 'dropout': 0.4961174636572013, 'batch_norm': True, 'lr': 4.6631873235221825e-05, 'weight_decay': 3.151043364434748e-05, 'epochs': 130, 'loss': 'mae', 'optimizer': 'adam', 'graph_mode': 'off', 'use_snp_selection': False}. Best is trial 81 with value: 0.313795582611371.
[I 2025-12-05 23:58:03,476] Trial 114 finished with value: 0.30692438623519835 and parameters: {'model_type': 'mlp', 'hidden_dims': '[512, 256]', 'dropout': 0.4871188184352409, 'batch_norm': True, 'lr': 2.8771221261955348e-05, 'weight_decay': 1.9591048365155264e-05, 'epochs': 133, 'loss': 'mae', 'optimizer': 'adam', 'graph_mode': 'off', 'use_snp_selection': False}. Best is trial 81 with value: 0.313795582611371.
[I 2025-12-05 23:58:34,925] Trial 115 finished with value: 0.3103023911587156 and parameters: {'model_type': 'mlp', 'hidden_dims': '[512, 256]', 'dropout': 0.5132448302330928, 'batch_norm': True, 'lr': 4.6554826027713313e-05, 'weight_decay': 2.4774990342644104e-05, 'epochs': 149, 'loss': 'mae', 'optimizer': 'adam', 'graph_mode': 'off', 'use_snp_selection': False}. Best is trial 81 with value: 0.313795582611371.
[I 2025-12-05 23:58:57,155] Trial 116 finished with value: 0.29859606227867264 and parameters: {'model_type': 'mlp', 'hidden_dims': '[256, 128]', 'dropout': 0.5210124760307082, 'batch_norm': True, 'lr': 2.133205121127329e-05, 'weight_decay': 4.694168511413547e-05, 'epochs': 190, 'loss': 'mae', 'optimizer': 'adam', 'graph_mode': 'off', 'use_snp_selection': False}. Best is trial 81 with value: 0.313795582611371.
[I 2025-12-05 23:59:25,164] Trial 117 finished with value: 0.302384585349868 and parameters: {'model_type': 'mlp', 'hidden_dims': '[512, 256]', 'dropout': 0.497257591918069, 'batch_norm': False, 'lr': 7.439120631589032e-05, 'weight_decay': 1.1881841446669532e-05, 'epochs': 130, 'loss': 'mae', 'optimizer': 'adam', 'graph_mode': 'off', 'use_snp_selection': False}. Best is trial 81 with value: 0.313795582611371.
[I 2025-12-06 00:00:22,175] Trial 118 finished with value: 0.3085735787037749 and parameters: {'model_type': 'mlp', 'hidden_dims': '[512, 256]', 'dropout': 0.4769978804232452, 'batch_norm': True, 'lr': 5.139366421398123e-05, 'weight_decay': 3.1185696851214706e-05, 'epochs': 294, 'loss': 'mae', 'optimizer': 'adam', 'graph_mode': 'off', 'use_snp_selection': False}. Best is trial 81 with value: 0.313795582611371.
[I 2025-12-06 00:00:48,560] Trial 119 finished with value: 0.2955993997435927 and parameters: {'model_type': 'mlp', 'hidden_dims': '[512, 64]', 'dropout': 0.4249062482578853, 'batch_norm': True, 'lr': 5.238846474809473e-06, 'weight_decay': 1.6331446034106093e-05, 'epochs': 121, 'loss': 'mae', 'optimizer': 'adam', 'graph_mode': 'off', 'use_snp_selection': False}. Best is trial 81 with value: 0.313795582611371.
[I 2025-12-06 00:01:01,097] Trial 120 finished with value: 0.29603079368714064 and parameters: {'model_type': 'mlp', 'hidden_dims': '[128, 64]', 'dropout': 0.5660350176681013, 'batch_norm': True, 'lr': 9.247429280950413e-06, 'weight_decay': 1.8619070933652773e-05, 'epochs': 158, 'loss': 'mae', 'optimizer': 'adam', 'graph_mode': 'off', 'use_snp_selection': False}. Best is trial 81 with value: 0.313795582611371.
