[I 2025-12-05 15:48:43,087] Trial 144 finished with value: 0.07476735699667171 and parameters: {'model_type': 'mlp', 'hidden_dims': '[512, 256]', 'dropout': 0.26529818336190225, 'batch_norm': True, 'lr': 0.0003652639315387736, 'weight_decay': 8.709993589567721e-05, 'epochs': 218, 'loss': 'mae', 'optimizer': 'adam', 'graph_mode': 'off', 'use_snp_selection': False}. Best is trial 78 with value: 0.08363337388283676.
[I 2025-12-05 15:48:44,733] Trial 145 finished with value: 0.05519024991978563 and parameters: {'model_type': 'mlp', 'hidden_dims': '[512, 256]', 'dropout': 0.211082814636469, 'batch_norm': True, 'lr': 0.00047732426745430897, 'weight_decay': 0.00010043497772230494, 'epochs': 233, 'loss': 'mae', 'optimizer': 'adam', 'graph_mode': 'off', 'use_snp_selection': False}. Best is trial 78 with value: 0.08363337388283676.
[I 2025-12-05 15:48:46,306] Trial 146 finished with value: 0.03437157927122766 and parameters: {'model_type': 'mlp', 'hidden_dims': '[512, 256]', 'dropout': 0.22759591198622275, 'batch_norm': False, 'lr': 0.0003519902951776162, 'weight_decay': 9.159025319175617e-05, 'epochs': 216, 'loss': 'mae', 'optimizer': 'adam', 'graph_mode': 'off', 'use_snp_selection': False}. Best is trial 78 with value: 0.08363337388283676.
[I 2025-12-05 15:48:48,155] Trial 147 finished with value: 0.04661513591404645 and parameters: {'model_type': 'mlp', 'hidden_dims': '[512, 256]', 'dropout': 0.25576885665680826, 'batch_norm': True, 'lr': 0.0005141806209491127, 'weight_decay': 7.04988027999473e-06, 'epochs': 294, 'loss': 'mae', 'optimizer': 'adam', 'graph_mode': 'off', 'use_snp_selection': False}. Best is trial 78 with value: 0.08363337388283676.
[I 2025-12-05 15:48:49,747] Trial 148 finished with value: 0.05099055066434195 and parameters: {'model_type': 'mlp', 'hidden_dims': '[512, 256]', 'dropout': 0.2668097967466204, 'batch_norm': True, 'lr': 0.00038765121358505376, 'weight_decay': 3.888926727723084e-06, 'epochs': 223, 'loss': 'mae', 'optimizer': 'adam', 'graph_mode': 'off', 'use_snp_selection': False}. Best is trial 78 with value: 0.08363337388283676.
[I 2025-12-05 15:48:51,258] Trial 149 finished with value: 0.0660797329665511 and parameters: {'model_type': 'mlp', 'hidden_dims': '[512, 256]', 'dropout': 0.3139562631555778, 'batch_norm': True, 'lr': 0.0007341486627520236, 'weight_decay': 5.2146593914661244e-05, 'epochs': 210, 'loss': 'mae', 'optimizer': 'adam', 'graph_mode': 'off', 'use_snp_selection': False}. Best is trial 78 with value: 0.08363337388283676.
[I 2025-12-05 15:49:05,613] Trial 0 finished with value: 0.021161463300784607 and parameters: {'model_type': 'mlp', 'hidden_dims': '[128, 64]', 'dropout': 0.199031432379812, 'batch_norm': True, 'lr': 1.8408544111075837e-06, 'weight_decay': 5.5136510071208614e-05, 'epochs': 336, 'loss': 'mae', 'optimizer': 'adam', 'graph_mode': 'off', 'use_snp_selection': True, 'num_snps': 43862}. Best is trial 0 with value: 0.021161463300784607.
[I 2025-12-05 15:49:06,668] Trial 1 finished with value: 0.06158165415514971 and parameters: {'model_type': 'mlp', 'hidden_dims': '[256, 128]', 'dropout': 0.4370668075331726, 'batch_norm': True, 'lr': 7.133471581159139e-05, 'weight_decay': 1.128633586803549e-05, 'epochs': 242, 'loss': 'mae', 'optimizer': 'adam', 'graph_mode': 'off', 'use_snp_selection': False}. Best is trial 1 with value: 0.06158165415514971.
[I 2025-12-05 15:49:07,638] Trial 2 finished with value: 0.005474378044024928 and parameters: {'model_type': 'mlp', 'hidden_dims': '[256, 128, 64]', 'dropout': 0.41314357415569625, 'batch_norm': False, 'lr': 3.952233718592101e-06, 'weight_decay': 0.00026754769258252603, 'epochs': 149, 'loss': 'mse', 'optimizer': 'adam', 'graph_mode': 'off', 'use_snp_selection': True, 'num_snps': 11571}. Best is trial 1 with value: 0.06158165415514971.
[I 2025-12-05 15:49:09,382] Trial 3 finished with value: 0.029229197681630903 and parameters: {'model_type': 'mlp', 'hidden_dims': '[512, 64]', 'dropout': 0.5938127374509361, 'batch_norm': False, 'lr': 5.67704586114731e-06, 'weight_decay': 2.4518087630137052e-05, 'epochs': 320, 'loss': 'mae', 'optimizer': 'adam', 'graph_mode': 'off', 'use_snp_selection': False}. Best is trial 1 with value: 0.06158165415514971.
[I 2025-12-05 15:49:11,449] Trial 4 finished with value: 0.02175183587822678 and parameters: {'model_type': 'mlp', 'hidden_dims': '[512, 128]', 'dropout': 0.25746343592134413, 'batch_norm': True, 'lr': 1.3467657668402788e-06, 'weight_decay': 0.00033087251918647806, 'epochs': 277, 'loss': 'mse', 'optimizer': 'adam', 'graph_mode': 'off', 'use_snp_selection': True, 'num_snps': 36675}. Best is trial 1 with value: 0.06158165415514971.
[I 2025-12-05 15:49:13,049] Trial 5 finished with value: 0.032283172515105374 and parameters: {'model_type': 'mlp', 'hidden_dims': '[512, 64]', 'dropout': 0.38275350994408375, 'batch_norm': True, 'lr': 1.5586664309232824e-06, 'weight_decay': 0.0008227664668621182, 'epochs': 145, 'loss': 'mae', 'optimizer': 'adam', 'graph_mode': 'off', 'use_snp_selection': True, 'num_snps': 32148}. Best is trial 1 with value: 0.06158165415514971.
[I 2025-12-05 15:49:14,020] Trial 6 finished with value: 0.06583953683622595 and parameters: {'model_type': 'mlp', 'hidden_dims': '[256, 128]', 'dropout': 0.3930109900265879, 'batch_norm': False, 'lr': 4.892964372128395e-05, 'weight_decay': 1.5809549317992182e-06, 'epochs': 199, 'loss': 'mse', 'optimizer': 'adam', 'graph_mode': 'off', 'use_snp_selection': False}. Best is trial 6 with value: 0.06583953683622595.
[I 2025-12-05 15:49:15,093] Trial 7 finished with value: 0.06400279250312407 and parameters: {'model_type': 'mlp', 'hidden_dims': '[512, 256]', 'dropout': 0.15343979219678458, 'batch_norm': True, 'lr': 6.234003099047341e-05, 'weight_decay': 3.894760610535477e-07, 'epochs': 97, 'loss': 'mse', 'optimizer': 'adam', 'graph_mode': 'off', 'use_snp_selection': False}. Best is trial 6 with value: 0.06583953683622595.
[I 2025-12-05 15:49:16,850] Trial 8 finished with value: 0.0686386346864943 and parameters: {'model_type': 'mlp', 'hidden_dims': '[512, 128]', 'dropout': 0.10743001231661406, 'batch_norm': True, 'lr': 0.00023728538449271062, 'weight_decay': 1.7629071578048637e-05, 'epochs': 312, 'loss': 'mae', 'optimizer': 'adam', 'graph_mode': 'off', 'use_snp_selection': False}. Best is trial 8 with value: 0.0686386346864943.
[I 2025-12-05 15:49:18,155] Trial 9 finished with value: 0.0538960534906795 and parameters: {'model_type': 'mlp', 'hidden_dims': '[512, 64]', 'dropout': 0.14505336736221927, 'batch_norm': True, 'lr': 5.8619638388111826e-05, 'weight_decay': 6.200156172669308e-07, 'epochs': 175, 'loss': 'mse', 'optimizer': 'adam', 'graph_mode': 'off', 'use_snp_selection': False}. Best is trial 8 with value: 0.0686386346864943.
[I 2025-12-05 15:49:19,080] Trial 10 finished with value: 0.018957670352890543 and parameters: {'model_type': 'mlp', 'hidden_dims': '[512, 128]', 'dropout': 0.2800030442581858, 'batch_norm': False, 'lr': 0.0004919806695968258, 'weight_decay': 2.9953888095455486e-06, 'epochs': 55, 'loss': 'mae', 'optimizer': 'adam', 'graph_mode': 'off', 'use_snp_selection': False}. Best is trial 8 with value: 0.0686386346864943.
[I 2025-12-05 15:49:20,107] Trial 11 finished with value: 0.0344663077241189 and parameters: {'model_type': 'mlp', 'hidden_dims': '[256, 128]', 'dropout': 0.5025533409127559, 'batch_norm': False, 'lr': 0.00034089430505247417, 'weight_decay': 2.512571353186099e-06, 'epochs': 239, 'loss': 'mse', 'optimizer': 'adam', 'graph_mode': 'off', 'use_snp_selection': False}. Best is trial 8 with value: 0.0686386346864943.
[I 2025-12-05 15:49:21,489] Trial 12 finished with value: 0.005166626589668081 and parameters: {'model_type': 'mlp', 'hidden_dims': '[512, 128]', 'dropout': 0.33506312640228997, 'batch_norm': False, 'lr': 1.764783267762576e-05, 'weight_decay': 1.3081036432574914e-07, 'epochs': 211, 'loss': 'mae', 'optimizer': 'adam', 'graph_mode': 'off', 'use_snp_selection': False}. Best is trial 8 with value: 0.0686386346864943.
[I 2025-12-05 15:49:22,563] Trial 13 finished with value: 0.05890142185371975 and parameters: {'model_type': 'mlp', 'hidden_dims': '[256, 128]', 'dropout': 0.5103047831198696, 'batch_norm': False, 'lr': 0.00020309888958837082, 'weight_decay': 2.875929917712265e-06, 'epochs': 285, 'loss': 'mse', 'optimizer': 'adam', 'graph_mode': 'off', 'use_snp_selection': False}. Best is trial 8 with value: 0.0686386346864943.
[I 2025-12-05 15:49:23,626] Trial 14 finished with value: 0.028085730065724544 and parameters: {'model_type': 'mlp', 'hidden_dims': '[128, 64]', 'dropout': 0.3012984444538551, 'batch_norm': True, 'lr': 0.0008639601853827713, 'weight_decay': 5.472340527804409e-05, 'epochs': 347, 'loss': 'mse', 'optimizer': 'adam', 'graph_mode': 'off', 'use_snp_selection': False}. Best is trial 8 with value: 0.0686386346864943.
[I 2025-12-05 15:49:24,754] Trial 15 finished with value: 0.06585358016585253 and parameters: {'model_type': 'mlp', 'hidden_dims': '[256, 128, 64]', 'dropout': 0.2129519999585601, 'batch_norm': False, 'lr': 0.0001572871022003765, 'weight_decay': 9.78235226321606e-07, 'epochs': 278, 'loss': 'mae', 'optimizer': 'adam', 'graph_mode': 'off', 'use_snp_selection': False}. Best is trial 8 with value: 0.0686386346864943.
[I 2025-12-05 15:49:25,937] Trial 16 finished with value: 0.08817918641086803 and parameters: {'model_type': 'mlp', 'hidden_dims': '[256, 128, 64]', 'dropout': 0.10794295220147085, 'batch_norm': True, 'lr': 0.00015960797606526716, 'weight_decay': 1.0765286122019607e-05, 'epochs': 300, 'loss': 'mae', 'optimizer': 'adam', 'graph_mode': 'off', 'use_snp_selection': False}. Best is trial 16 with value: 0.08817918641086803.
[I 2025-12-05 15:49:27,120] Trial 17 finished with value: 0.06599817132181923 and parameters: {'model_type': 'mlp', 'hidden_dims': '[256, 128, 64]', 'dropout': 0.10230308008198463, 'batch_norm': True, 'lr': 2.349300150160787e-05, 'weight_decay': 7.470963505970814e-06, 'epochs': 302, 'loss': 'mae', 'optimizer': 'adam', 'graph_mode': 'off', 'use_snp_selection': False}. Best is trial 16 with value: 0.08817918641086803.
[I 2025-12-05 15:49:30,153] Trial 18 finished with value: 0.07085932371913842 and parameters: {'model_type': 'mlp', 'hidden_dims': '[512, 256]', 'dropout': 0.10884892417738423, 'batch_norm': True, 'lr': 0.0001494700280077901, 'weight_decay': 7.197637349971628e-05, 'epochs': 244, 'loss': 'mae', 'optimizer': 'adam', 'graph_mode': 'off', 'use_snp_selection': True, 'num_snps': 58241}. Best is trial 16 with value: 0.08817918641086803.
[I 2025-12-05 15:49:32,937] Trial 19 finished with value: 0.036629287913274994 and parameters: {'model_type': 'mlp', 'hidden_dims': '[512, 256]', 'dropout': 0.22410497278093666, 'batch_norm': True, 'lr': 0.00011163151669502135, 'weight_decay': 8.341381027411685e-05, 'epochs': 243, 'loss': 'mae', 'optimizer': 'adam', 'graph_mode': 'off', 'use_snp_selection': True, 'num_snps': 55667}. Best is trial 16 with value: 0.08817918641086803.
[I 2025-12-05 15:49:36,028] Trial 20 finished with value: -0.004101048487405339 and parameters: {'model_type': 'mlp', 'hidden_dims': '[512, 256]', 'dropout': 0.16537971321786588, 'batch_norm': True, 'lr': 1.0030457920595432e-05, 'weight_decay': 0.00017680016161656075, 'epochs': 257, 'loss': 'mae', 'optimizer': 'adam', 'graph_mode': 'off', 'use_snp_selection': True, 'num_snps': 57703}. Best is trial 16 with value: 0.08817918641086803.
[I 2025-12-05 15:49:37,377] Trial 21 finished with value: 0.028079497532037076 and parameters: {'model_type': 'mlp', 'hidden_dims': '[256, 128, 64]', 'dropout': 0.1019291873324428, 'batch_norm': True, 'lr': 0.00028210786735893346, 'weight_decay': 9.072120434084293e-06, 'epochs': 308, 'loss': 'mae', 'optimizer': 'adam', 'graph_mode': 'off', 'use_snp_selection': True, 'num_snps': 11878}. Best is trial 16 with value: 0.08817918641086803.
[I 2025-12-05 15:49:38,963] Trial 22 finished with value: 0.0616817132995081 and parameters: {'model_type': 'mlp', 'hidden_dims': '[512, 128]', 'dropout': 0.1334728215636729, 'batch_norm': True, 'lr': 0.0009269476642029135, 'weight_decay': 2.478555969641428e-05, 'epochs': 322, 'loss': 'mae', 'optimizer': 'adam', 'graph_mode': 'off', 'use_snp_selection': True, 'num_snps': 22259}. Best is trial 16 with value: 0.08817918641086803.
[I 2025-12-05 15:49:41,356] Trial 23 finished with value: 0.05284096769742899 and parameters: {'model_type': 'mlp', 'hidden_dims': '[512, 256]', 'dropout': 0.17467311282413, 'batch_norm': True, 'lr': 0.00010928412257046682, 'weight_decay': 1.856187830086767e-05, 'epochs': 221, 'loss': 'mae', 'optimizer': 'adam', 'graph_mode': 'off', 'use_snp_selection': True, 'num_snps': 46925}. Best is trial 16 with value: 0.08817918641086803.
[I 2025-12-05 15:49:43,052] Trial 24 finished with value: 0.07658284275132088 and parameters: {'model_type': 'mlp', 'hidden_dims': '[512, 128]', 'dropout': 0.1358550877561121, 'batch_norm': True, 'lr': 0.0005143518460288361, 'weight_decay': 6.186070236396458e-06, 'epochs': 296, 'loss': 'mae', 'optimizer': 'adam', 'graph_mode': 'off', 'use_snp_selection': False}. Best is trial 16 with value: 0.08817918641086803.
[I 2025-12-05 15:49:44,143] Trial 25 finished with value: 0.06269497043930598 and parameters: {'model_type': 'mlp', 'hidden_dims': '[256, 128, 64]', 'dropout': 0.2516101086819589, 'batch_norm': True, 'lr': 0.0004818450933336341, 'weight_decay': 5.78259392857274e-06, 'epochs': 270, 'loss': 'mae', 'optimizer': 'adam', 'graph_mode': 'off', 'use_snp_selection': False}. Best is trial 16 with value: 0.08817918641086803.
[I 2025-12-05 15:49:45,051] Trial 26 finished with value: 0.01588952131764602 and parameters: {'model_type': 'mlp', 'hidden_dims': '[512, 256]', 'dropout': 0.182849451693314, 'batch_norm': True, 'lr': 0.0004976579145170707, 'weight_decay': 0.0001013022415158679, 'epochs': 298, 'loss': 'mae', 'optimizer': 'adam', 'graph_mode': 'off', 'use_snp_selection': True, 'num_snps': 2344}. Best is trial 16 with value: 0.08817918641086803.
[I 2025-12-05 15:49:45,964] Trial 27 finished with value: 0.05335014442292119 and parameters: {'model_type': 'mlp', 'hidden_dims': '[128, 64]', 'dropout': 0.13979953311099177, 'batch_norm': True, 'lr': 0.00013120189827324445, 'weight_decay': 3.7473662819097316e-05, 'epochs': 262, 'loss': 'mae', 'optimizer': 'adam', 'graph_mode': 'off', 'use_snp_selection': False}. Best is trial 16 with value: 0.08817918641086803.
[I 2025-12-05 15:49:48,405] Trial 28 finished with value: 0.05277294550510514 and parameters: {'model_type': 'mlp', 'hidden_dims': '[512, 256]', 'dropout': 0.23070166493559494, 'batch_norm': True, 'lr': 4.178439342108346e-05, 'weight_decay': 4.777265365396963e-06, 'epochs': 228, 'loss': 'mae', 'optimizer': 'adam', 'graph_mode': 'off', 'use_snp_selection': True, 'num_snps': 48700}. Best is trial 16 with value: 0.08817918641086803.
[I 2025-12-05 15:49:50,093] Trial 29 finished with value: 0.06099542925566449 and parameters: {'model_type': 'mlp', 'hidden_dims': '[128, 64]', 'dropout': 0.19747259024234365, 'batch_norm': True, 'lr': 0.0004232814061338315, 'weight_decay': 4.6849154096281604e-05, 'epochs': 347, 'loss': 'mae', 'optimizer': 'adam', 'graph_mode': 'off', 'use_snp_selection': True, 'num_snps': 26940}. Best is trial 16 with value: 0.08817918641086803.
[I 2025-12-05 15:49:51,071] Trial 30 finished with value: 0.06091921575729052 and parameters: {'model_type': 'mlp', 'hidden_dims': '[256, 128, 64]', 'dropout': 0.12886662502630503, 'batch_norm': True, 'lr': 8.079168678714519e-05, 'weight_decay': 0.0009985228973016622, 'epochs': 180, 'loss': 'mae', 'optimizer': 'adam', 'graph_mode': 'off', 'use_snp_selection': False}. Best is trial 16 with value: 0.08817918641086803.
[I 2025-12-05 15:49:52,760] Trial 31 finished with value: 0.06662865517573814 and parameters: {'model_type': 'mlp', 'hidden_dims': '[512, 128]', 'dropout': 0.10547612663773802, 'batch_norm': True, 'lr': 0.00019913499168081123, 'weight_decay': 1.455718004663888e-05, 'epochs': 293, 'loss': 'mae', 'optimizer': 'adam', 'graph_mode': 'off', 'use_snp_selection': False}. Best is trial 16 with value: 0.08817918641086803.
[I 2025-12-05 15:49:54,573] Trial 32 finished with value: 0.06304651790665666 and parameters: {'model_type': 'mlp', 'hidden_dims': '[512, 128]', 'dropout': 0.18271799360472626, 'batch_norm': True, 'lr': 0.00025355541752004695, 'weight_decay': 1.2916781959364779e-05, 'epochs': 332, 'loss': 'mae', 'optimizer': 'adam', 'graph_mode': 'off', 'use_snp_selection': False}. Best is trial 16 with value: 0.08817918641086803.
[I 2025-12-05 15:49:56,361] Trial 33 finished with value: 0.059757143187779915 and parameters: {'model_type': 'mlp', 'hidden_dims': '[512, 128]', 'dropout': 0.10012291261655017, 'batch_norm': True, 'lr': 0.0006616583653050195, 'weight_decay': 0.00011438282922955864, 'epochs': 320, 'loss': 'mae', 'optimizer': 'adam', 'graph_mode': 'off', 'use_snp_selection': False}. Best is trial 16 with value: 0.08817918641086803.
[I 2025-12-05 15:49:57,897] Trial 34 finished with value: 0.06239918530844392 and parameters: {'model_type': 'mlp', 'hidden_dims': '[512, 128]', 'dropout': 0.12424312352144185, 'batch_norm': True, 'lr': 9.030155836193225e-05, 'weight_decay': 2.87793396283016e-05, 'epochs': 253, 'loss': 'mae', 'optimizer': 'adam', 'graph_mode': 'off', 'use_snp_selection': False}. Best is trial 16 with value: 0.08817918641086803.
[I 2025-12-05 15:49:59,606] Trial 35 finished with value: 0.058527284251322795 and parameters: {'model_type': 'mlp', 'hidden_dims': '[512, 128]', 'dropout': 0.15835757334320577, 'batch_norm': True, 'lr': 0.000176625380471118, 'weight_decay': 0.00039706304137522173, 'epochs': 310, 'loss': 'mae', 'optimizer': 'adam', 'graph_mode': 'off', 'use_snp_selection': False}. Best is trial 16 with value: 0.08817918641086803.
[I 2025-12-05 15:50:01,236] Trial 36 finished with value: 0.06864202011757652 and parameters: {'model_type': 'mlp', 'hidden_dims': '[512, 64]', 'dropout': 0.20584121487001242, 'batch_norm': True, 'lr': 0.00028388823447490395, 'weight_decay': 4.740474314623542e-06, 'epochs': 286, 'loss': 'mae', 'optimizer': 'adam', 'graph_mode': 'off', 'use_snp_selection': False}. Best is trial 16 with value: 0.08817918641086803.
[I 2025-12-05 15:50:03,384] Trial 37 finished with value: -0.003324018012464126 and parameters: {'model_type': 'mlp', 'hidden_dims': '[512, 64]', 'dropout': 0.20263218445852085, 'batch_norm': True, 'lr': 2.6246285399617145e-06, 'weight_decay': 4.582648882585399e-06, 'epochs': 288, 'loss': 'mae', 'optimizer': 'adam', 'graph_mode': 'off', 'use_snp_selection': True, 'num_snps': 38290}. Best is trial 16 with value: 0.08817918641086803.
[I 2025-12-05 15:50:04,987] Trial 38 finished with value: 0.07272679505790601 and parameters: {'model_type': 'mlp', 'hidden_dims': '[512, 64]', 'dropout': 0.23715165584213768, 'batch_norm': True, 'lr': 0.00035411671227121957, 'weight_decay': 1.6127223740610466e-06, 'epochs': 269, 'loss': 'mae', 'optimizer': 'adam', 'graph_mode': 'off', 'use_snp_selection': False}. Best is trial 16 with value: 0.08817918641086803.
[I 2025-12-05 15:50:08,096] Trial 39 finished with value: 0.06297349232838804 and parameters: {'model_type': 'mlp', 'hidden_dims': '[512, 64]', 'dropout': 0.2433975737863913, 'batch_norm': True, 'lr': 0.0006403061784616043, 'weight_decay': 1.6416033827479016e-06, 'epochs': 247, 'loss': 'mae', 'optimizer': 'adam', 'graph_mode': 'off', 'use_snp_selection': True, 'num_snps': 59978}. Best is trial 16 with value: 0.08817918641086803.
[I 2025-12-05 15:50:09,495] Trial 40 finished with value: 0.040044464719400596 and parameters: {'model_type': 'mlp', 'hidden_dims': '[512, 64]', 'dropout': 0.3176236182867418, 'batch_norm': True, 'lr': 3.296885524765102e-05, 'weight_decay': 3.6982030370391837e-07, 'epochs': 195, 'loss': 'mae', 'optimizer': 'adam', 'graph_mode': 'off', 'use_snp_selection': False}. Best is trial 16 with value: 0.08817918641086803.
[I 2025-12-05 15:50:11,122] Trial 41 finished with value: 0.07098863154348255 and parameters: {'model_type': 'mlp', 'hidden_dims': '[512, 64]', 'dropout': 0.27656334056924814, 'batch_norm': True, 'lr': 0.0002507818133335503, 'weight_decay': 1.6141000671556576e-06, 'epochs': 273, 'loss': 'mae', 'optimizer': 'adam', 'graph_mode': 'off', 'use_snp_selection': False}. Best is trial 16 with value: 0.08817918641086803.
[I 2025-12-05 15:50:12,609] Trial 42 finished with value: 0.06845611548292566 and parameters: {'model_type': 'mlp', 'hidden_dims': '[512, 64]', 'dropout': 0.3636574777271269, 'batch_norm': True, 'lr': 0.00035451986702156075, 'weight_decay': 1.4236932925193566e-06, 'epochs': 230, 'loss': 'mae', 'optimizer': 'adam', 'graph_mode': 'off', 'use_snp_selection': False}. Best is trial 16 with value: 0.08817918641086803.
[I 2025-12-05 15:50:14,207] Trial 43 finished with value: 0.07516691393573177 and parameters: {'model_type': 'mlp', 'hidden_dims': '[512, 64]', 'dropout': 0.28695620280008105, 'batch_norm': True, 'lr': 0.0006559504464850675, 'weight_decay': 6.892520169007358e-07, 'epochs': 267, 'loss': 'mae', 'optimizer': 'adam', 'graph_mode': 'off', 'use_snp_selection': False}. Best is trial 16 with value: 0.08817918641086803.
[I 2025-12-05 15:50:15,820] Trial 44 finished with value: 0.07632707612500933 and parameters: {'model_type': 'mlp', 'hidden_dims': '[512, 64]', 'dropout': 0.2736683489596619, 'batch_norm': True, 'lr': 0.0006751685680044814, 'weight_decay': 6.668252188419856e-07, 'epochs': 272, 'loss': 'mse', 'optimizer': 'adam', 'graph_mode': 'off', 'use_snp_selection': False}. Best is trial 16 with value: 0.08817918641086803.
[I 2025-12-05 15:50:17,371] Trial 45 finished with value: 0.022795476928631188 and parameters: {'model_type': 'mlp', 'hidden_dims': '[512, 64]', 'dropout': 0.2932081488063113, 'batch_norm': False, 'lr': 0.0006657757357198297, 'weight_decay': 3.32976570547074e-07, 'epochs': 266, 'loss': 'mse', 'optimizer': 'adam', 'graph_mode': 'off', 'use_snp_selection': False}. Best is trial 16 with value: 0.08817918641086803.
