[I 2025-12-05 15:39:59,860] Trial 126 finished with value: 0.10647868307180139 and parameters: {'model_type': 'mlp', 'hidden_dims': '[512, 128]', 'dropout': 0.14516241589003218, 'batch_norm': True, 'lr': 0.0008934987601266953, 'weight_decay': 2.408806322105915e-05, 'epochs': 290, 'loss': 'mse', 'optimizer': 'adam', 'graph_mode': 'off', 'use_snp_selection': False}. Best is trial 16 with value: 0.14105610079653463.
[I 2025-12-05 15:40:00,933] Trial 127 finished with value: 0.1186100595678565 and parameters: {'model_type': 'mlp', 'hidden_dims': '[128, 64]', 'dropout': 0.33340116851290386, 'batch_norm': True, 'lr': 0.00065011199199166, 'weight_decay': 6.1925941969545396e-06, 'epochs': 335, 'loss': 'mae', 'optimizer': 'adam', 'graph_mode': 'off', 'use_snp_selection': False}. Best is trial 16 with value: 0.14105610079653463.
[I 2025-12-05 15:40:03,081] Trial 128 finished with value: 0.1022047178111994 and parameters: {'model_type': 'mlp', 'hidden_dims': '[256, 128, 64]', 'dropout': 0.18149539967143896, 'batch_norm': True, 'lr': 0.0004630286335534054, 'weight_decay': 1.5832379310297002e-05, 'epochs': 276, 'loss': 'mae', 'optimizer': 'adam', 'graph_mode': 'off', 'use_snp_selection': True, 'num_snps': 39076}. Best is trial 16 with value: 0.14105610079653463.
[I 2025-12-05 15:40:04,991] Trial 129 finished with value: 0.11662410403034107 and parameters: {'model_type': 'mlp', 'hidden_dims': '[512, 128]', 'dropout': 0.12209125055136101, 'batch_norm': True, 'lr': 0.00018187091093311243, 'weight_decay': 1.2425430879708483e-05, 'epochs': 298, 'loss': 'mae', 'optimizer': 'adam', 'graph_mode': 'off', 'use_snp_selection': False}. Best is trial 16 with value: 0.14105610079653463.
[I 2025-12-05 15:40:06,278] Trial 130 finished with value: 0.04745955097939583 and parameters: {'model_type': 'mlp', 'hidden_dims': '[256, 128]', 'dropout': 0.19506088456564655, 'batch_norm': True, 'lr': 1.864901068924354e-06, 'weight_decay': 2.761084945737128e-05, 'epochs': 315, 'loss': 'mae', 'optimizer': 'adam', 'graph_mode': 'off', 'use_snp_selection': False}. Best is trial 16 with value: 0.14105610079653463.
[I 2025-12-05 15:40:08,194] Trial 131 finished with value: 0.10934490884083463 and parameters: {'model_type': 'mlp', 'hidden_dims': '[512, 128]', 'dropout': 0.21325143292798138, 'batch_norm': True, 'lr': 0.000994866468573328, 'weight_decay': 3.0098999605980484e-05, 'epochs': 297, 'loss': 'mae', 'optimizer': 'adam', 'graph_mode': 'off', 'use_snp_selection': False}. Best is trial 16 with value: 0.14105610079653463.
[I 2025-12-05 15:40:10,068] Trial 132 finished with value: 0.11810735998730265 and parameters: {'model_type': 'mlp', 'hidden_dims': '[512, 128]', 'dropout': 0.26203207839491643, 'batch_norm': True, 'lr': 0.0006312512449497067, 'weight_decay': 2.5915426556917126e-05, 'epochs': 294, 'loss': 'mae', 'optimizer': 'adam', 'graph_mode': 'off', 'use_snp_selection': False}. Best is trial 16 with value: 0.14105610079653463.
[I 2025-12-05 15:40:11,915] Trial 133 finished with value: 0.11356947731325023 and parameters: {'model_type': 'mlp', 'hidden_dims': '[512, 128]', 'dropout': 0.2046639249638854, 'batch_norm': True, 'lr': 0.0005438562897497771, 'weight_decay': 2.1080691059310577e-05, 'epochs': 282, 'loss': 'mae', 'optimizer': 'adam', 'graph_mode': 'off', 'use_snp_selection': False}. Best is trial 16 with value: 0.14105610079653463.
[I 2025-12-05 15:40:13,823] Trial 134 finished with value: 0.12347227670981782 and parameters: {'model_type': 'mlp', 'hidden_dims': '[512, 128]', 'dropout': 0.15305778629475056, 'batch_norm': True, 'lr': 0.00014149418037048936, 'weight_decay': 1.3664143550263783e-05, 'epochs': 303, 'loss': 'mae', 'optimizer': 'adam', 'graph_mode': 'off', 'use_snp_selection': False}. Best is trial 16 with value: 0.14105610079653463.
[I 2025-12-05 15:40:15,785] Trial 135 finished with value: 0.12195748556606972 and parameters: {'model_type': 'mlp', 'hidden_dims': '[512, 128]', 'dropout': 0.16748472513338222, 'batch_norm': True, 'lr': 0.0007503457669322994, 'weight_decay': 4.041113601575259e-05, 'epochs': 309, 'loss': 'mae', 'optimizer': 'adam', 'graph_mode': 'off', 'use_snp_selection': False}. Best is trial 16 with value: 0.14105610079653463.
[I 2025-12-05 15:40:17,770] Trial 136 finished with value: 0.1194346715057941 and parameters: {'model_type': 'mlp', 'hidden_dims': '[512, 256]', 'dropout': 0.21902242839783465, 'batch_norm': True, 'lr': 0.0006147752263525783, 'weight_decay': 4.9973186938594884e-05, 'epochs': 320, 'loss': 'mae', 'optimizer': 'adam', 'graph_mode': 'off', 'use_snp_selection': False}. Best is trial 16 with value: 0.14105610079653463.
[I 2025-12-05 15:40:19,627] Trial 137 finished with value: 0.11791325444207096 and parameters: {'model_type': 'mlp', 'hidden_dims': '[512, 128]', 'dropout': 0.28061604420569886, 'batch_norm': True, 'lr': 0.0008467866258421644, 'weight_decay': 1.9504445281364696e-05, 'epochs': 290, 'loss': 'mae', 'optimizer': 'adam', 'graph_mode': 'off', 'use_snp_selection': False}. Best is trial 16 with value: 0.14105610079653463.
[I 2025-12-05 15:40:21,395] Trial 138 finished with value: 0.09851590277988455 and parameters: {'model_type': 'mlp', 'hidden_dims': '[512, 128]', 'dropout': 0.24949947633806205, 'batch_norm': False, 'lr': 3.679089716655354e-05, 'weight_decay': 8.51810468076438e-06, 'epochs': 271, 'loss': 'mae', 'optimizer': 'adam', 'graph_mode': 'off', 'use_snp_selection': False}. Best is trial 16 with value: 0.14105610079653463.
[I 2025-12-05 15:40:23,444] Trial 139 finished with value: 0.11936030134011331 and parameters: {'model_type': 'mlp', 'hidden_dims': '[512, 256]', 'dropout': 0.13761235422650397, 'batch_norm': True, 'lr': 0.00045262642334322574, 'weight_decay': 1.0865907610547499e-05, 'epochs': 339, 'loss': 'mae', 'optimizer': 'adam', 'graph_mode': 'off', 'use_snp_selection': False}. Best is trial 16 with value: 0.14105610079653463.
[I 2025-12-05 15:40:24,516] Trial 140 finished with value: 0.12040334823797548 and parameters: {'model_type': 'mlp', 'hidden_dims': '[128, 64]', 'dropout': 0.11136234177636778, 'batch_norm': True, 'lr': 0.00037372155140640543, 'weight_decay': 1.5557912799880166e-05, 'epochs': 327, 'loss': 'mae', 'optimizer': 'adam', 'graph_mode': 'off', 'use_snp_selection': False}. Best is trial 16 with value: 0.14105610079653463.
[I 2025-12-05 15:40:26,113] Trial 141 finished with value: 0.11783025988653233 and parameters: {'model_type': 'mlp', 'hidden_dims': '[512, 256]', 'dropout': 0.2311285206575967, 'batch_norm': True, 'lr': 0.00032152828195449384, 'weight_decay': 1.798464244410931e-06, 'epochs': 220, 'loss': 'mae', 'optimizer': 'adam', 'graph_mode': 'off', 'use_snp_selection': False}. Best is trial 16 with value: 0.14105610079653463.
[I 2025-12-05 15:40:27,774] Trial 142 finished with value: 0.05729194448754517 and parameters: {'model_type': 'mlp', 'hidden_dims': '[512, 256]', 'dropout': 0.1972864153563523, 'batch_norm': True, 'lr': 1.2638565429900836e-05, 'weight_decay': 1.2323211509110533e-06, 'epochs': 238, 'loss': 'mae', 'optimizer': 'adam', 'graph_mode': 'off', 'use_snp_selection': False}. Best is trial 16 with value: 0.14105610079653463.
[I 2025-12-05 15:40:29,317] Trial 143 finished with value: 0.12345136094678816 and parameters: {'model_type': 'mlp', 'hidden_dims': '[512, 256]', 'dropout': 0.20700773663014924, 'batch_norm': True, 'lr': 0.000558259701614564, 'weight_decay': 4.858848376884309e-06, 'epochs': 201, 'loss': 'mae', 'optimizer': 'adam', 'graph_mode': 'off', 'use_snp_selection': False}. Best is trial 16 with value: 0.14105610079653463.
[I 2025-12-05 15:40:31,242] Trial 144 finished with value: 0.1088701104922045 and parameters: {'model_type': 'mlp', 'hidden_dims': '[512, 256]', 'dropout': 0.1787072830226017, 'batch_norm': True, 'lr': 0.0007062464244462786, 'weight_decay': 2.774246360449238e-06, 'epochs': 306, 'loss': 'mae', 'optimizer': 'adam', 'graph_mode': 'off', 'use_snp_selection': False}. Best is trial 16 with value: 0.14105610079653463.
[I 2025-12-05 15:40:32,400] Trial 145 finished with value: 0.1254562966079362 and parameters: {'model_type': 'mlp', 'hidden_dims': '[256, 128]', 'dropout': 0.15949247202324746, 'batch_norm': True, 'lr': 0.00020132535921790065, 'weight_decay': 2.2664320796991173e-06, 'epochs': 251, 'loss': 'mae', 'optimizer': 'adam', 'graph_mode': 'off', 'use_snp_selection': False}. Best is trial 16 with value: 0.14105610079653463.
[I 2025-12-05 15:40:33,568] Trial 146 finished with value: 0.11658162708032165 and parameters: {'model_type': 'mlp', 'hidden_dims': '[256, 128]', 'dropout': 0.16169164072071612, 'batch_norm': True, 'lr': 0.00014981630610644373, 'weight_decay': 2.202401537577939e-06, 'epochs': 249, 'loss': 'mae', 'optimizer': 'adam', 'graph_mode': 'off', 'use_snp_selection': False}. Best is trial 16 with value: 0.14105610079653463.
[I 2025-12-05 15:40:34,744] Trial 147 finished with value: 0.12100332627988787 and parameters: {'model_type': 'mlp', 'hidden_dims': '[256, 128]', 'dropout': 0.14407752152928416, 'batch_norm': True, 'lr': 0.00019702023212264089, 'weight_decay': 2.328901671373632e-05, 'epochs': 260, 'loss': 'mae', 'optimizer': 'adam', 'graph_mode': 'off', 'use_snp_selection': False}. Best is trial 16 with value: 0.14105610079653463.
[I 2025-12-05 15:40:35,765] Trial 148 finished with value: 0.10860162566225429 and parameters: {'model_type': 'mlp', 'hidden_dims': '[256, 128]', 'dropout': 0.3487585666798262, 'batch_norm': True, 'lr': 0.00011232967383218539, 'weight_decay': 1.2877509217897233e-05, 'epochs': 185, 'loss': 'mse', 'optimizer': 'adam', 'graph_mode': 'off', 'use_snp_selection': False}. Best is trial 16 with value: 0.14105610079653463.
[I 2025-12-05 15:40:37,595] Trial 149 finished with value: 0.1238683133755888 and parameters: {'model_type': 'mlp', 'hidden_dims': '[256, 128]', 'dropout': 0.1730810016831626, 'batch_norm': True, 'lr': 0.00022198579305990224, 'weight_decay': 6.9758440579563445e-06, 'epochs': 315, 'loss': 'mae', 'optimizer': 'adam', 'graph_mode': 'off', 'use_snp_selection': True, 'num_snps': 29744}. Best is trial 16 with value: 0.14105610079653463.
[I 2025-12-05 15:40:39,867] Trial 0 finished with value: 0.030967266537754216 and parameters: {'model_type': 'mlp', 'hidden_dims': '[128, 64]', 'dropout': 0.199031432379812, 'batch_norm': True, 'lr': 1.8408544111075837e-06, 'weight_decay': 5.5136510071208614e-05, 'epochs': 336, 'loss': 'mae', 'optimizer': 'adam', 'graph_mode': 'off', 'use_snp_selection': True, 'num_snps': 43862}. Best is trial 0 with value: 0.030967266537754216.
[I 2025-12-05 15:40:41,027] Trial 1 finished with value: 0.07187106628905787 and parameters: {'model_type': 'mlp', 'hidden_dims': '[256, 128]', 'dropout': 0.4370668075331726, 'batch_norm': True, 'lr': 7.133471581159139e-05, 'weight_decay': 1.128633586803549e-05, 'epochs': 242, 'loss': 'mae', 'optimizer': 'adam', 'graph_mode': 'off', 'use_snp_selection': False}. Best is trial 1 with value: 0.07187106628905787.
[I 2025-12-05 15:40:42,043] Trial 2 finished with value: 0.05200375628159364 and parameters: {'model_type': 'mlp', 'hidden_dims': '[256, 128, 64]', 'dropout': 0.41314357415569625, 'batch_norm': False, 'lr': 3.952233718592101e-06, 'weight_decay': 0.00026754769258252603, 'epochs': 149, 'loss': 'mse', 'optimizer': 'adam', 'graph_mode': 'off', 'use_snp_selection': True, 'num_snps': 11571}. Best is trial 1 with value: 0.07187106628905787.
[I 2025-12-05 15:40:44,000] Trial 3 finished with value: 0.07119783851728327 and parameters: {'model_type': 'mlp', 'hidden_dims': '[512, 64]', 'dropout': 0.5938127374509361, 'batch_norm': False, 'lr': 5.67704586114731e-06, 'weight_decay': 2.4518087630137052e-05, 'epochs': 320, 'loss': 'mae', 'optimizer': 'adam', 'graph_mode': 'off', 'use_snp_selection': False}. Best is trial 1 with value: 0.07187106628905787.
[I 2025-12-05 15:40:46,235] Trial 4 finished with value: 0.006581416707793919 and parameters: {'model_type': 'mlp', 'hidden_dims': '[512, 128]', 'dropout': 0.25746343592134413, 'batch_norm': True, 'lr': 1.3467657668402788e-06, 'weight_decay': 0.00033087251918647806, 'epochs': 277, 'loss': 'mse', 'optimizer': 'adam', 'graph_mode': 'off', 'use_snp_selection': True, 'num_snps': 36675}. Best is trial 1 with value: 0.07187106628905787.
[I 2025-12-05 15:40:47,986] Trial 5 finished with value: 0.03526180243767791 and parameters: {'model_type': 'mlp', 'hidden_dims': '[512, 64]', 'dropout': 0.38275350994408375, 'batch_norm': True, 'lr': 1.5586664309232824e-06, 'weight_decay': 0.0008227664668621182, 'epochs': 145, 'loss': 'mae', 'optimizer': 'adam', 'graph_mode': 'off', 'use_snp_selection': True, 'num_snps': 32148}. Best is trial 1 with value: 0.07187106628905787.
[I 2025-12-05 15:40:49,043] Trial 6 finished with value: 0.08376951184169532 and parameters: {'model_type': 'mlp', 'hidden_dims': '[256, 128]', 'dropout': 0.3930109900265879, 'batch_norm': False, 'lr': 4.892964372128395e-05, 'weight_decay': 1.5809549317992182e-06, 'epochs': 199, 'loss': 'mse', 'optimizer': 'adam', 'graph_mode': 'off', 'use_snp_selection': False}. Best is trial 6 with value: 0.08376951184169532.
[I 2025-12-05 15:40:50,173] Trial 7 finished with value: 0.054139057136443916 and parameters: {'model_type': 'mlp', 'hidden_dims': '[512, 256]', 'dropout': 0.15343979219678458, 'batch_norm': True, 'lr': 6.234003099047341e-05, 'weight_decay': 3.894760610535477e-07, 'epochs': 97, 'loss': 'mse', 'optimizer': 'adam', 'graph_mode': 'off', 'use_snp_selection': False}. Best is trial 6 with value: 0.08376951184169532.
[I 2025-12-05 15:40:52,112] Trial 8 finished with value: 0.07499138270513186 and parameters: {'model_type': 'mlp', 'hidden_dims': '[512, 128]', 'dropout': 0.10743001231661406, 'batch_norm': True, 'lr': 0.00023728538449271062, 'weight_decay': 1.7629071578048637e-05, 'epochs': 312, 'loss': 'mae', 'optimizer': 'adam', 'graph_mode': 'off', 'use_snp_selection': False}. Best is trial 6 with value: 0.08376951184169532.
[I 2025-12-05 15:40:53,533] Trial 9 finished with value: 0.06301178065444028 and parameters: {'model_type': 'mlp', 'hidden_dims': '[512, 64]', 'dropout': 0.14505336736221927, 'batch_norm': True, 'lr': 5.8619638388111826e-05, 'weight_decay': 6.200156172669308e-07, 'epochs': 175, 'loss': 'mse', 'optimizer': 'adam', 'graph_mode': 'off', 'use_snp_selection': False}. Best is trial 6 with value: 0.08376951184169532.
[I 2025-12-05 15:40:54,289] Trial 10 finished with value: 0.016357008250797896 and parameters: {'model_type': 'mlp', 'hidden_dims': '[256, 128]', 'dropout': 0.5267360651501256, 'batch_norm': False, 'lr': 0.00032393778075602147, 'weight_decay': 1.936962886850364e-06, 'epochs': 46, 'loss': 'mse', 'optimizer': 'adam', 'graph_mode': 'off', 'use_snp_selection': False}. Best is trial 6 with value: 0.08376951184169532.
[I 2025-12-05 15:40:55,938] Trial 11 finished with value: 0.05900979478566938 and parameters: {'model_type': 'mlp', 'hidden_dims': '[512, 128]', 'dropout': 0.30438831352760154, 'batch_norm': False, 'lr': 0.0007666984023899753, 'weight_decay': 2.512571353186099e-06, 'epochs': 239, 'loss': 'mae', 'optimizer': 'adam', 'graph_mode': 'off', 'use_snp_selection': False}. Best is trial 6 with value: 0.08376951184169532.
[I 2025-12-05 15:40:57,573] Trial 12 finished with value: 0.059381245083357764 and parameters: {'model_type': 'mlp', 'hidden_dims': '[512, 128]', 'dropout': 0.4779690972965961, 'batch_norm': False, 'lr': 0.00026576228959612443, 'weight_decay': 1.3081036432574914e-07, 'epochs': 235, 'loss': 'mae', 'optimizer': 'adam', 'graph_mode': 'off', 'use_snp_selection': False}. Best is trial 6 with value: 0.08376951184169532.
[I 2025-12-05 15:40:58,829] Trial 13 finished with value: 0.07458216808919238 and parameters: {'model_type': 'mlp', 'hidden_dims': '[256, 128]', 'dropout': 0.3136384318677555, 'batch_norm': False, 'lr': 1.581618310073141e-05, 'weight_decay': 4.380057356309532e-06, 'epochs': 285, 'loss': 'mse', 'optimizer': 'adam', 'graph_mode': 'off', 'use_snp_selection': False}. Best is trial 6 with value: 0.08376951184169532.
[I 2025-12-05 15:40:59,697] Trial 14 finished with value: 0.07864930325997009 and parameters: {'model_type': 'mlp', 'hidden_dims': '[128, 64]', 'dropout': 0.2386468568583971, 'batch_norm': True, 'lr': 0.00017558188744418174, 'weight_decay': 5.472340527804409e-05, 'epochs': 203, 'loss': 'mse', 'optimizer': 'adam', 'graph_mode': 'off', 'use_snp_selection': False}. Best is trial 6 with value: 0.08376951184169532.
[I 2025-12-05 15:41:00,538] Trial 15 finished with value: 0.0782196508532403 and parameters: {'model_type': 'mlp', 'hidden_dims': '[128, 64]', 'dropout': 0.2474489173716922, 'batch_norm': False, 'lr': 1.6267534889505977e-05, 'weight_decay': 7.640313926697123e-05, 'epochs': 195, 'loss': 'mse', 'optimizer': 'adam', 'graph_mode': 'off', 'use_snp_selection': False}. Best is trial 6 with value: 0.08376951184169532.
[I 2025-12-05 15:41:01,276] Trial 16 finished with value: 0.07052669338110017 and parameters: {'model_type': 'mlp', 'hidden_dims': '[128, 64]', 'dropout': 0.32962807357042556, 'batch_norm': True, 'lr': 0.00012807572047011966, 'weight_decay': 7.781155070114133e-07, 'epochs': 105, 'loss': 'mse', 'optimizer': 'adam', 'graph_mode': 'off', 'use_snp_selection': False}. Best is trial 6 with value: 0.08376951184169532.
[I 2025-12-05 15:41:02,364] Trial 17 finished with value: 0.07248556050123087 and parameters: {'model_type': 'mlp', 'hidden_dims': '[256, 128, 64]', 'dropout': 0.24337632476761947, 'batch_norm': False, 'lr': 2.349300150160787e-05, 'weight_decay': 5.2011835493510306e-06, 'epochs': 218, 'loss': 'mse', 'optimizer': 'adam', 'graph_mode': 'off', 'use_snp_selection': False}. Best is trial 6 with value: 0.08376951184169532.
[I 2025-12-05 15:41:05,342] Trial 18 finished with value: 0.04333436040468118 and parameters: {'model_type': 'mlp', 'hidden_dims': '[512, 256]', 'dropout': 0.37864681859452576, 'batch_norm': False, 'lr': 0.0009620630595655681, 'weight_decay': 7.197637349971628e-05, 'epochs': 172, 'loss': 'mse', 'optimizer': 'adam', 'graph_mode': 'off', 'use_snp_selection': True, 'num_snps': 58241}. Best is trial 6 with value: 0.08376951184169532.
[I 2025-12-05 15:41:06,296] Trial 19 finished with value: 0.06853922885680634 and parameters: {'model_type': 'mlp', 'hidden_dims': '[256, 128]', 'dropout': 0.5157140133784281, 'batch_norm': True, 'lr': 0.00012498497987933264, 'weight_decay': 1.1354159408743119e-07, 'epochs': 117, 'loss': 'mse', 'optimizer': 'adam', 'graph_mode': 'off', 'use_snp_selection': False}. Best is trial 6 with value: 0.08376951184169532.
[I 2025-12-05 15:41:07,148] Trial 20 finished with value: 0.08667014115822665 and parameters: {'model_type': 'mlp', 'hidden_dims': '[128, 64]', 'dropout': 0.2763485291932811, 'batch_norm': False, 'lr': 7.951283186534742e-06, 'weight_decay': 3.875856927505992e-05, 'epochs': 208, 'loss': 'mse', 'optimizer': 'adam', 'graph_mode': 'off', 'use_snp_selection': False}. Best is trial 20 with value: 0.08667014115822665.
[I 2025-12-05 15:41:07,965] Trial 21 finished with value: 0.07553527612253126 and parameters: {'model_type': 'mlp', 'hidden_dims': '[128, 64]', 'dropout': 0.27598657986883673, 'batch_norm': False, 'lr': 6.30726778122691e-06, 'weight_decay': 3.44263132080461e-05, 'epochs': 205, 'loss': 'mse', 'optimizer': 'adam', 'graph_mode': 'off', 'use_snp_selection': False}. Best is trial 20 with value: 0.08667014115822665.
[I 2025-12-05 15:41:08,845] Trial 22 finished with value: 0.06539515861334742 and parameters: {'model_type': 'mlp', 'hidden_dims': '[128, 64]', 'dropout': 0.352367735746185, 'batch_norm': False, 'lr': 3.511276726977528e-05, 'weight_decay': 0.00018373720535940166, 'epochs': 264, 'loss': 'mse', 'optimizer': 'adam', 'graph_mode': 'off', 'use_snp_selection': False}. Best is trial 20 with value: 0.08667014115822665.
[I 2025-12-05 15:41:09,643] Trial 23 finished with value: 0.08053030165522605 and parameters: {'model_type': 'mlp', 'hidden_dims': '[128, 64]', 'dropout': 0.1914038413427484, 'batch_norm': False, 'lr': 1.0481692224176654e-05, 'weight_decay': 6.985537676419472e-06, 'epochs': 170, 'loss': 'mse', 'optimizer': 'adam', 'graph_mode': 'off', 'use_snp_selection': False}. Best is trial 20 with value: 0.08667014115822665.
[I 2025-12-05 15:41:10,416] Trial 24 finished with value: 0.07821435461163005 and parameters: {'model_type': 'mlp', 'hidden_dims': '[128, 64]', 'dropout': 0.1871153692828477, 'batch_norm': False, 'lr': 9.79454048741123e-06, 'weight_decay': 7.155673581155691e-06, 'epochs': 169, 'loss': 'mse', 'optimizer': 'adam', 'graph_mode': 'off', 'use_snp_selection': False}. Best is trial 20 with value: 0.08667014115822665.
[I 2025-12-05 15:41:11,329] Trial 25 finished with value: 0.06254018795361212 and parameters: {'model_type': 'mlp', 'hidden_dims': '[256, 128]', 'dropout': 0.20659399060640368, 'batch_norm': False, 'lr': 2.6894397723399197e-06, 'weight_decay': 1.0077734665942408e-06, 'epochs': 132, 'loss': 'mse', 'optimizer': 'adam', 'graph_mode': 'off', 'use_snp_selection': False}. Best is trial 20 with value: 0.08667014115822665.
[I 2025-12-05 15:41:12,127] Trial 26 finished with value: 0.05931207872876576 and parameters: {'model_type': 'mlp', 'hidden_dims': '[128, 64]', 'dropout': 0.29005650493846463, 'batch_norm': False, 'lr': 1.112294038743056e-05, 'weight_decay': 2.443643243280606e-06, 'epochs': 175, 'loss': 'mse', 'optimizer': 'adam', 'graph_mode': 'off', 'use_snp_selection': True, 'num_snps': 3842}. Best is trial 20 with value: 0.08667014115822665.
[I 2025-12-05 15:41:13,222] Trial 27 finished with value: 0.06402867457516442 and parameters: {'model_type': 'mlp', 'hidden_dims': '[256, 128, 64]', 'dropout': 0.4407537372609304, 'batch_norm': False, 'lr': 3.214366588532807e-05, 'weight_decay': 1.1694934417881414e-05, 'epochs': 221, 'loss': 'mse', 'optimizer': 'adam', 'graph_mode': 'off', 'use_snp_selection': False}. Best is trial 20 with value: 0.08667014115822665.
