[I 2025-12-05 15:52:23,170] Trial 36 finished with value: -0.0027578534882692924 and parameters: {'model_type': 'mlp', 'hidden_dims': '[256, 128]', 'dropout': 0.17044267455922502, 'batch_norm': False, 'lr': 8.996015466462316e-05, 'weight_decay': 5.395056305959805e-05, 'epochs': 265, 'loss': 'mae', 'optimizer': 'adam', 'graph_mode': 'off', 'use_snp_selection': True, 'num_snps': 58661}. Best is trial 22 with value: 0.022763159205916747.
[I 2025-12-05 15:52:24,404] Trial 37 finished with value: 0.001854169383474548 and parameters: {'model_type': 'mlp', 'hidden_dims': '[256, 128]', 'dropout': 0.20756871511263542, 'batch_norm': True, 'lr': 4.630830605229618e-05, 'weight_decay': 2.533781847955704e-05, 'epochs': 301, 'loss': 'mae', 'optimizer': 'adam', 'graph_mode': 'off', 'use_snp_selection': False}. Best is trial 22 with value: 0.022763159205916747.
[I 2025-12-05 15:52:25,619] Trial 38 finished with value: -0.01022450674840966 and parameters: {'model_type': 'mlp', 'hidden_dims': '[512, 64]', 'dropout': 0.10013168427927559, 'batch_norm': False, 'lr': 0.00015336567652785862, 'weight_decay': 1.4718740952094895e-05, 'epochs': 185, 'loss': 'mae', 'optimizer': 'adam', 'graph_mode': 'off', 'use_snp_selection': True, 'num_snps': 19911}. Best is trial 22 with value: 0.022763159205916747.
[I 2025-12-05 15:52:26,524] Trial 39 finished with value: -0.010415016385547175 and parameters: {'model_type': 'mlp', 'hidden_dims': '[256, 128]', 'dropout': 0.13115457074402587, 'batch_norm': True, 'lr': 4.492273476873691e-06, 'weight_decay': 0.0001525452359458335, 'epochs': 162, 'loss': 'mae', 'optimizer': 'adam', 'graph_mode': 'off', 'use_snp_selection': False}. Best is trial 22 with value: 0.022763159205916747.
[I 2025-12-05 15:52:28,384] Trial 40 finished with value: 0.01108259151766844 and parameters: {'model_type': 'mlp', 'hidden_dims': '[512, 128]', 'dropout': 0.26538286304859926, 'batch_norm': False, 'lr': 5.9844762676840965e-05, 'weight_decay': 9.281829772100316e-06, 'epochs': 349, 'loss': 'mae', 'optimizer': 'adam', 'graph_mode': 'off', 'use_snp_selection': False}. Best is trial 22 with value: 0.022763159205916747.
[I 2025-12-05 15:52:29,434] Trial 41 finished with value: 0.003197430653098776 and parameters: {'model_type': 'mlp', 'hidden_dims': '[256, 128, 64]', 'dropout': 0.5938978098801626, 'batch_norm': False, 'lr': 2.3697058531536487e-05, 'weight_decay': 9.882030868942081e-07, 'epochs': 232, 'loss': 'mse', 'optimizer': 'adam', 'graph_mode': 'off', 'use_snp_selection': False}. Best is trial 22 with value: 0.022763159205916747.
[I 2025-12-05 15:52:30,830] Trial 42 finished with value: 0.01858575275688607 and parameters: {'model_type': 'mlp', 'hidden_dims': '[512, 256]', 'dropout': 0.3668203050891774, 'batch_norm': False, 'lr': 1.6902686877653996e-05, 'weight_decay': 2.6820615944766415e-06, 'epochs': 207, 'loss': 'mse', 'optimizer': 'adam', 'graph_mode': 'off', 'use_snp_selection': False}. Best is trial 22 with value: 0.022763159205916747.
[I 2025-12-05 15:52:32,244] Trial 43 finished with value: -0.015439448451845595 and parameters: {'model_type': 'mlp', 'hidden_dims': '[512, 64]', 'dropout': 0.3678507457425245, 'batch_norm': False, 'lr': 8.37046278543162e-06, 'weight_decay': 2.863136766721088e-06, 'epochs': 205, 'loss': 'mse', 'optimizer': 'adam', 'graph_mode': 'off', 'use_snp_selection': False}. Best is trial 22 with value: 0.022763159205916747.
[I 2025-12-05 15:52:33,226] Trial 44 finished with value: 0.006119440814859288 and parameters: {'model_type': 'mlp', 'hidden_dims': '[256, 128]', 'dropout': 0.4258548684333214, 'batch_norm': False, 'lr': 4.1762748850958725e-05, 'weight_decay': 6.038087327688078e-06, 'epochs': 189, 'loss': 'mae', 'optimizer': 'adam', 'graph_mode': 'off', 'use_snp_selection': False}. Best is trial 22 with value: 0.022763159205916747.
[I 2025-12-05 15:52:34,439] Trial 45 finished with value: -0.004591414380614072 and parameters: {'model_type': 'mlp', 'hidden_dims': '[512, 256]', 'dropout': 0.4040741554249228, 'batch_norm': False, 'lr': 1.3430024421356446e-05, 'weight_decay': 5.053463780279605e-07, 'epochs': 141, 'loss': 'mse', 'optimizer': 'adam', 'graph_mode': 'off', 'use_snp_selection': False}. Best is trial 22 with value: 0.022763159205916747.
[I 2025-12-05 15:52:35,994] Trial 46 finished with value: 0.03156398717208372 and parameters: {'model_type': 'mlp', 'hidden_dims': '[512, 256]', 'dropout': 0.47427484128517927, 'batch_norm': False, 'lr': 0.00023124596431137602, 'weight_decay': 1.2000598679921534e-05, 'epochs': 262, 'loss': 'mse', 'optimizer': 'adam', 'graph_mode': 'off', 'use_snp_selection': False}. Best is trial 46 with value: 0.03156398717208372.
[I 2025-12-05 15:52:37,596] Trial 47 finished with value: 0.0032694616766561027 and parameters: {'model_type': 'mlp', 'hidden_dims': '[512, 256]', 'dropout': 0.5283765495332834, 'batch_norm': True, 'lr': 0.00022901300526606547, 'weight_decay': 2.5041189612281727e-05, 'epochs': 260, 'loss': 'mse', 'optimizer': 'adam', 'graph_mode': 'off', 'use_snp_selection': False}. Best is trial 46 with value: 0.03156398717208372.
[I 2025-12-05 15:52:39,345] Trial 48 finished with value: 0.019263690649216545 and parameters: {'model_type': 'mlp', 'hidden_dims': '[512, 256]', 'dropout': 0.4540134117237326, 'batch_norm': False, 'lr': 0.00034515239825795726, 'weight_decay': 1.3093310738709124e-05, 'epochs': 315, 'loss': 'mse', 'optimizer': 'adam', 'graph_mode': 'off', 'use_snp_selection': False}. Best is trial 46 with value: 0.03156398717208372.
[I 2025-12-05 15:52:42,059] Trial 49 finished with value: 0.022863176088036955 and parameters: {'model_type': 'mlp', 'hidden_dims': '[512, 256]', 'dropout': 0.47032943388371196, 'batch_norm': False, 'lr': 0.0003068937911638511, 'weight_decay': 1.6927235535634215e-05, 'epochs': 330, 'loss': 'mse', 'optimizer': 'adam', 'graph_mode': 'off', 'use_snp_selection': True, 'num_snps': 46888}. Best is trial 46 with value: 0.03156398717208372.
[I 2025-12-05 15:52:44,742] Trial 50 finished with value: 0.013439472668670306 and parameters: {'model_type': 'mlp', 'hidden_dims': '[512, 256]', 'dropout': 0.4579193794196348, 'batch_norm': False, 'lr': 0.0003838520369751386, 'weight_decay': 0.00010740997891926175, 'epochs': 317, 'loss': 'mse', 'optimizer': 'adam', 'graph_mode': 'off', 'use_snp_selection': True, 'num_snps': 46345}. Best is trial 46 with value: 0.03156398717208372.
[I 2025-12-05 15:52:47,522] Trial 51 finished with value: -0.005129860888098536 and parameters: {'model_type': 'mlp', 'hidden_dims': '[512, 256]', 'dropout': 0.4790527908560459, 'batch_norm': False, 'lr': 0.0005364896118674517, 'weight_decay': 1.5618622673457197e-05, 'epochs': 329, 'loss': 'mse', 'optimizer': 'adam', 'graph_mode': 'off', 'use_snp_selection': True, 'num_snps': 47105}. Best is trial 46 with value: 0.03156398717208372.
[I 2025-12-05 15:52:49,070] Trial 52 finished with value: 0.010134829146884893 and parameters: {'model_type': 'mlp', 'hidden_dims': '[512, 256]', 'dropout': 0.5445457072460385, 'batch_norm': False, 'lr': 0.00025810676231527164, 'weight_decay': 3.1702785309918686e-05, 'epochs': 300, 'loss': 'mse', 'optimizer': 'adam', 'graph_mode': 'off', 'use_snp_selection': True, 'num_snps': 22057}. Best is trial 46 with value: 0.03156398717208372.
[I 2025-12-05 15:52:51,264] Trial 53 finished with value: -0.010927329756493985 and parameters: {'model_type': 'mlp', 'hidden_dims': '[512, 256]', 'dropout': 0.3809466914164456, 'batch_norm': False, 'lr': 0.0008569635977114225, 'weight_decay': 1.2333981033295563e-05, 'epochs': 348, 'loss': 'mse', 'optimizer': 'adam', 'graph_mode': 'off', 'use_snp_selection': True, 'num_snps': 37397}. Best is trial 46 with value: 0.03156398717208372.
[I 2025-12-05 15:52:54,242] Trial 54 finished with value: -0.000827790881748871 and parameters: {'model_type': 'mlp', 'hidden_dims': '[512, 256]', 'dropout': 0.5594270075815693, 'batch_norm': False, 'lr': 0.00021081372479896392, 'weight_decay': 3.7771270623804355e-06, 'epochs': 329, 'loss': 'mse', 'optimizer': 'adam', 'graph_mode': 'off', 'use_snp_selection': True, 'num_snps': 51553}. Best is trial 46 with value: 0.03156398717208372.
[I 2025-12-05 15:52:55,984] Trial 55 finished with value: 0.02282196768675015 and parameters: {'model_type': 'mlp', 'hidden_dims': '[512, 256]', 'dropout': 0.4834725229480167, 'batch_norm': False, 'lr': 0.00032194041963727225, 'weight_decay': 3.978835076587607e-05, 'epochs': 298, 'loss': 'mse', 'optimizer': 'adam', 'graph_mode': 'off', 'use_snp_selection': False}. Best is trial 46 with value: 0.03156398717208372.
[I 2025-12-05 15:52:57,690] Trial 56 finished with value: 0.029062829485176 and parameters: {'model_type': 'mlp', 'hidden_dims': '[512, 256]', 'dropout': 0.4624220310642921, 'batch_norm': False, 'lr': 0.00032750030086879715, 'weight_decay': 3.956173261811184e-05, 'epochs': 293, 'loss': 'mse', 'optimizer': 'adam', 'graph_mode': 'off', 'use_snp_selection': False}. Best is trial 46 with value: 0.03156398717208372.
[I 2025-12-05 15:52:59,408] Trial 57 finished with value: 0.001992755689571021 and parameters: {'model_type': 'mlp', 'hidden_dims': '[512, 128]', 'dropout': 0.49658258235846414, 'batch_norm': False, 'lr': 0.0006299323809413836, 'weight_decay': 3.7672672285375855e-05, 'epochs': 298, 'loss': 'mse', 'optimizer': 'adam', 'graph_mode': 'off', 'use_snp_selection': False}. Best is trial 46 with value: 0.03156398717208372.
[I 2025-12-05 15:53:01,101] Trial 58 finished with value: 0.004030808794482204 and parameters: {'model_type': 'mlp', 'hidden_dims': '[512, 256]', 'dropout': 0.47069334319883105, 'batch_norm': False, 'lr': 0.0003274418661445399, 'weight_decay': 0.00014182153170340676, 'epochs': 311, 'loss': 'mse', 'optimizer': 'adam', 'graph_mode': 'off', 'use_snp_selection': True, 'num_snps': 26798}. Best is trial 46 with value: 0.03156398717208372.
[I 2025-12-05 15:53:01,994] Trial 59 finished with value: -0.04047128196273722 and parameters: {'model_type': 'mlp', 'hidden_dims': '[128, 64]', 'dropout': 0.4325731454566582, 'batch_norm': False, 'lr': 0.0004565724878128641, 'weight_decay': 8.230252444674917e-05, 'epochs': 287, 'loss': 'mse', 'optimizer': 'adam', 'graph_mode': 'off', 'use_snp_selection': False}. Best is trial 46 with value: 0.03156398717208372.
[I 2025-12-05 15:53:03,822] Trial 60 finished with value: 0.02156178141180089 and parameters: {'model_type': 'mlp', 'hidden_dims': '[512, 256]', 'dropout': 0.5205676139919342, 'batch_norm': False, 'lr': 0.00028321907056442054, 'weight_decay': 7.4147216137937e-05, 'epochs': 331, 'loss': 'mse', 'optimizer': 'adam', 'graph_mode': 'off', 'use_snp_selection': False}. Best is trial 46 with value: 0.03156398717208372.
[I 2025-12-05 15:53:05,622] Trial 61 finished with value: -0.006518898205018228 and parameters: {'model_type': 'mlp', 'hidden_dims': '[512, 256]', 'dropout': 0.5202354352191905, 'batch_norm': False, 'lr': 0.0002931948297656975, 'weight_decay': 7.161186893075863e-05, 'epochs': 327, 'loss': 'mse', 'optimizer': 'adam', 'graph_mode': 'off', 'use_snp_selection': False}. Best is trial 46 with value: 0.03156398717208372.
[I 2025-12-05 15:53:07,417] Trial 62 finished with value: 0.013836988662955792 and parameters: {'model_type': 'mlp', 'hidden_dims': '[512, 256]', 'dropout': 0.48052570930752647, 'batch_norm': False, 'lr': 0.00038929162814261995, 'weight_decay': 0.0003674256026799104, 'epochs': 339, 'loss': 'mse', 'optimizer': 'adam', 'graph_mode': 'off', 'use_snp_selection': False}. Best is trial 46 with value: 0.03156398717208372.
[I 2025-12-05 15:53:09,070] Trial 63 finished with value: 0.016742392916012632 and parameters: {'model_type': 'mlp', 'hidden_dims': '[512, 256]', 'dropout': 0.5729532651996792, 'batch_norm': False, 'lr': 0.00018734768231227572, 'weight_decay': 2.0527686053388234e-05, 'epochs': 276, 'loss': 'mse', 'optimizer': 'adam', 'graph_mode': 'off', 'use_snp_selection': False}. Best is trial 46 with value: 0.03156398717208372.
[I 2025-12-05 15:53:10,274] Trial 64 finished with value: 0.00017400596110586023 and parameters: {'model_type': 'mlp', 'hidden_dims': '[256, 128, 64]', 'dropout': 0.4169566409503414, 'batch_norm': False, 'lr': 0.00012521605351692815, 'weight_decay': 4.177219263928829e-05, 'epochs': 306, 'loss': 'mse', 'optimizer': 'adam', 'graph_mode': 'off', 'use_snp_selection': False}. Best is trial 46 with value: 0.03156398717208372.
[I 2025-12-05 15:53:11,953] Trial 65 finished with value: -0.013967571275018595 and parameters: {'model_type': 'mlp', 'hidden_dims': '[512, 256]', 'dropout': 0.4514586544878994, 'batch_norm': False, 'lr': 0.0007616024880661356, 'weight_decay': 6.79906261343602e-05, 'epochs': 290, 'loss': 'mse', 'optimizer': 'adam', 'graph_mode': 'off', 'use_snp_selection': False}. Best is trial 46 with value: 0.03156398717208372.
[I 2025-12-05 15:53:13,741] Trial 66 finished with value: 0.01796301440127716 and parameters: {'model_type': 'mlp', 'hidden_dims': '[512, 64]', 'dropout': 0.5053576441134237, 'batch_norm': False, 'lr': 0.0005292695974962006, 'weight_decay': 1.1650867380512056e-05, 'epochs': 321, 'loss': 'mse', 'optimizer': 'adam', 'graph_mode': 'off', 'use_snp_selection': False}. Best is trial 46 with value: 0.03156398717208372.
[I 2025-12-05 15:53:15,577] Trial 67 finished with value: -4.136015526159171e-05 and parameters: {'model_type': 'mlp', 'hidden_dims': '[512, 256]', 'dropout': 0.5278109212931497, 'batch_norm': False, 'lr': 0.000282454191035704, 'weight_decay': 2.9995895913919278e-05, 'epochs': 338, 'loss': 'mse', 'optimizer': 'adam', 'graph_mode': 'off', 'use_snp_selection': False}. Best is trial 46 with value: 0.03156398717208372.
[I 2025-12-05 15:53:17,159] Trial 68 finished with value: 0.026293996111387673 and parameters: {'model_type': 'mlp', 'hidden_dims': '[512, 256]', 'dropout': 0.466819834327053, 'batch_norm': False, 'lr': 0.0003810015399683889, 'weight_decay': 1.7670049123162852e-05, 'epochs': 269, 'loss': 'mse', 'optimizer': 'adam', 'graph_mode': 'off', 'use_snp_selection': False}. Best is trial 46 with value: 0.03156398717208372.
[I 2025-12-05 15:53:20,045] Trial 69 finished with value: 0.0046476939397244454 and parameters: {'model_type': 'mlp', 'hidden_dims': '[512, 256]', 'dropout': 0.4690049782500122, 'batch_norm': False, 'lr': 0.000656358816695406, 'weight_decay': 1.8454279950844258e-05, 'epochs': 271, 'loss': 'mse', 'optimizer': 'adam', 'graph_mode': 'off', 'use_snp_selection': True, 'num_snps': 52937}. Best is trial 46 with value: 0.03156398717208372.
[I 2025-12-05 15:53:21,782] Trial 70 finished with value: 0.03409431544573049 and parameters: {'model_type': 'mlp', 'hidden_dims': '[512, 256]', 'dropout': 0.4926529103764074, 'batch_norm': False, 'lr': 0.00020712906468621132, 'weight_decay': 0.00010416556767460225, 'epochs': 292, 'loss': 'mse', 'optimizer': 'adam', 'graph_mode': 'off', 'use_snp_selection': False}. Best is trial 70 with value: 0.03409431544573049.
[I 2025-12-05 15:53:23,457] Trial 71 finished with value: 0.011869081112812412 and parameters: {'model_type': 'mlp', 'hidden_dims': '[512, 256]', 'dropout': 0.49297560000256185, 'batch_norm': False, 'lr': 0.0001851680964158817, 'weight_decay': 0.0001949090920474116, 'epochs': 284, 'loss': 'mse', 'optimizer': 'adam', 'graph_mode': 'off', 'use_snp_selection': False}. Best is trial 70 with value: 0.03409431544573049.
[I 2025-12-05 15:53:25,028] Trial 72 finished with value: 0.0199003336614254 and parameters: {'model_type': 'mlp', 'hidden_dims': '[512, 256]', 'dropout': 0.5198594939138399, 'batch_norm': False, 'lr': 0.0004220010955739263, 'weight_decay': 0.0004178555622011237, 'epochs': 254, 'loss': 'mse', 'optimizer': 'adam', 'graph_mode': 'off', 'use_snp_selection': False}. Best is trial 70 with value: 0.03409431544573049.
[I 2025-12-05 15:53:26,689] Trial 73 finished with value: 0.02590077115767044 and parameters: {'model_type': 'mlp', 'hidden_dims': '[512, 256]', 'dropout': 0.4870196448533164, 'batch_norm': False, 'lr': 1.0944189860155205e-06, 'weight_decay': 9.729642621405653e-05, 'epochs': 295, 'loss': 'mse', 'optimizer': 'adam', 'graph_mode': 'off', 'use_snp_selection': False}. Best is trial 70 with value: 0.03409431544573049.
[I 2025-12-05 15:53:28,393] Trial 74 finished with value: -0.013238063829631478 and parameters: {'model_type': 'mlp', 'hidden_dims': '[512, 256]', 'dropout': 0.4388847630711006, 'batch_norm': False, 'lr': 2.669514078510244e-06, 'weight_decay': 5.396755563810317e-05, 'epochs': 295, 'loss': 'mse', 'optimizer': 'adam', 'graph_mode': 'off', 'use_snp_selection': False}. Best is trial 70 with value: 0.03409431544573049.
[I 2025-12-05 15:53:29,295] Trial 75 finished with value: -0.03590613073864479 and parameters: {'model_type': 'mlp', 'hidden_dims': '[128, 64]', 'dropout': 0.4874883542704109, 'batch_norm': False, 'lr': 1.1691835578140096e-06, 'weight_decay': 3.5077337730541155e-05, 'epochs': 279, 'loss': 'mse', 'optimizer': 'adam', 'graph_mode': 'off', 'use_snp_selection': False}. Best is trial 70 with value: 0.03409431544573049.
[I 2025-12-05 15:53:30,900] Trial 76 finished with value: 0.0010302081122198446 and parameters: {'model_type': 'mlp', 'hidden_dims': '[512, 256]', 'dropout': 0.4695981437785999, 'batch_norm': False, 'lr': 8.913585358891932e-05, 'weight_decay': 2.1419416053061085e-05, 'epochs': 269, 'loss': 'mse', 'optimizer': 'adam', 'graph_mode': 'off', 'use_snp_selection': False}. Best is trial 70 with value: 0.03409431544573049.
[I 2025-12-05 15:53:32,520] Trial 77 finished with value: 0.03405576479254481 and parameters: {'model_type': 'mlp', 'hidden_dims': '[512, 128]', 'dropout': 0.5083890953429503, 'batch_norm': False, 'lr': 0.00012855942895838936, 'weight_decay': 0.00011336800675561097, 'epochs': 263, 'loss': 'mse', 'optimizer': 'adam', 'graph_mode': 'off', 'use_snp_selection': False}. Best is trial 70 with value: 0.03409431544573049.
[I 2025-12-05 15:53:34,087] Trial 78 finished with value: 0.023879046762702777 and parameters: {'model_type': 'mlp', 'hidden_dims': '[512, 128]', 'dropout': 0.5460925527647822, 'batch_norm': False, 'lr': 0.00012442209883900145, 'weight_decay': 0.00010456191998296904, 'epochs': 255, 'loss': 'mse', 'optimizer': 'adam', 'graph_mode': 'off', 'use_snp_selection': False}. Best is trial 70 with value: 0.03409431544573049.
[I 2025-12-05 15:53:35,646] Trial 79 finished with value: 0.014925369124377018 and parameters: {'model_type': 'mlp', 'hidden_dims': '[512, 128]', 'dropout': 0.564127687396933, 'batch_norm': False, 'lr': 0.00012690863452359037, 'weight_decay': 0.00024110109759771455, 'epochs': 257, 'loss': 'mse', 'optimizer': 'adam', 'graph_mode': 'off', 'use_snp_selection': False}. Best is trial 70 with value: 0.03409431544573049.
[I 2025-12-05 15:53:37,223] Trial 80 finished with value: 0.02149391777546014 and parameters: {'model_type': 'mlp', 'hidden_dims': '[512, 128]', 'dropout': 0.5445120545974891, 'batch_norm': False, 'lr': 0.0001025115069931471, 'weight_decay': 9.505062210497568e-05, 'epochs': 252, 'loss': 'mse', 'optimizer': 'adam', 'graph_mode': 'off', 'use_snp_selection': False}. Best is trial 70 with value: 0.03409431544573049.
[I 2025-12-05 15:53:38,722] Trial 81 finished with value: -0.009938556368390694 and parameters: {'model_type': 'mlp', 'hidden_dims': '[512, 128]', 'dropout': 0.5078859468381678, 'batch_norm': False, 'lr': 0.0001589637703679233, 'weight_decay': 0.0001283421790190395, 'epochs': 232, 'loss': 'mse', 'optimizer': 'adam', 'graph_mode': 'off', 'use_snp_selection': False}. Best is trial 70 with value: 0.03409431544573049.
[I 2025-12-05 15:53:40,428] Trial 82 finished with value: 0.03743082586854673 and parameters: {'model_type': 'mlp', 'hidden_dims': '[512, 128]', 'dropout': 0.5443099499869772, 'batch_norm': False, 'lr': 0.00021851091582106717, 'weight_decay': 0.00019885411835097262, 'epochs': 306, 'loss': 'mse', 'optimizer': 'adam', 'graph_mode': 'off', 'use_snp_selection': False}. Best is trial 82 with value: 0.03743082586854673.
[I 2025-12-05 15:53:42,094] Trial 83 finished with value: 0.01734177955349599 and parameters: {'model_type': 'mlp', 'hidden_dims': '[512, 128]', 'dropout': 0.579912408797008, 'batch_norm': False, 'lr': 7.69338438400658e-05, 'weight_decay': 0.00026927227099434977, 'epochs': 280, 'loss': 'mse', 'optimizer': 'adam', 'graph_mode': 'off', 'use_snp_selection': False}. Best is trial 82 with value: 0.03743082586854673.
[I 2025-12-05 15:53:43,694] Trial 84 finished with value: 0.019188191416305057 and parameters: {'model_type': 'mlp', 'hidden_dims': '[512, 128]', 'dropout': 0.5432862821081471, 'batch_norm': False, 'lr': 0.000223996627711508, 'weight_decay': 0.00017226429982600142, 'epochs': 264, 'loss': 'mse', 'optimizer': 'adam', 'graph_mode': 'off', 'use_snp_selection': False}. Best is trial 82 with value: 0.03743082586854673.
[I 2025-12-05 15:53:45,407] Trial 85 finished with value: 0.0026480813387034807 and parameters: {'model_type': 'mlp', 'hidden_dims': '[512, 128]', 'dropout': 0.5528510354880685, 'batch_norm': False, 'lr': 0.0001973466802202525, 'weight_decay': 0.0004914102653765036, 'epochs': 305, 'loss': 'mse', 'optimizer': 'adam', 'graph_mode': 'off', 'use_snp_selection': False}. Best is trial 82 with value: 0.03743082586854673.
[I 2025-12-05 15:53:47,154] Trial 86 finished with value: 0.014214254237100167 and parameters: {'model_type': 'mlp', 'hidden_dims': '[512, 128]', 'dropout': 0.5074217253514672, 'batch_norm': False, 'lr': 0.00025513258476184646, 'weight_decay': 9.78086789475686e-05, 'epochs': 308, 'loss': 'mse', 'optimizer': 'adam', 'graph_mode': 'off', 'use_snp_selection': False}. Best is trial 82 with value: 0.03743082586854673.
[I 2025-12-05 15:53:49,486] Trial 87 finished with value: 0.008602557774063197 and parameters: {'model_type': 'mlp', 'hidden_dims': '[512, 128]', 'dropout': 0.5820257158715874, 'batch_norm': False, 'lr': 0.00013128793752756858, 'weight_decay': 0.0005673108134189399, 'epochs': 291, 'loss': 'mse', 'optimizer': 'adam', 'graph_mode': 'off', 'use_snp_selection': True, 'num_snps': 41738}. Best is trial 82 with value: 0.03743082586854673.
