[I 2025-12-05 16:29:02,001] Trial 29 finished with value: 0.032905295543687894 and parameters: {'model_type': 'mlp', 'hidden_dims': '[128, 64]', 'dropout': 0.19862717694588056, 'batch_norm': False, 'lr': 1.962324516553123e-05, 'weight_decay': 7.160232088410508e-05, 'epochs': 227, 'loss': 'mae', 'optimizer': 'adam', 'graph_mode': 'off', 'use_snp_selection': True, 'num_snps': 23339}. Best is trial 23 with value: 0.04954747502704046.
[I 2025-12-05 16:29:03,914] Trial 30 finished with value: 0.03510505753548695 and parameters: {'model_type': 'mlp', 'hidden_dims': '[256, 128]', 'dropout': 0.10075824674586258, 'batch_norm': False, 'lr': 0.0004943613420208485, 'weight_decay': 4.5787639194330915e-05, 'epochs': 279, 'loss': 'mse', 'optimizer': 'adam', 'graph_mode': 'off', 'use_snp_selection': True, 'num_snps': 37207}. Best is trial 23 with value: 0.04954747502704046.
[I 2025-12-05 16:29:06,101] Trial 31 finished with value: 0.05619280643669682 and parameters: {'model_type': 'mlp', 'hidden_dims': '[256, 128]', 'dropout': 0.11243074248174315, 'batch_norm': False, 'lr': 0.0009970115218496715, 'weight_decay': 2.9973774940743366e-05, 'epochs': 277, 'loss': 'mse', 'optimizer': 'adam', 'graph_mode': 'off', 'use_snp_selection': True, 'num_snps': 41325}. Best is trial 31 with value: 0.05619280643669682.
[I 2025-12-05 16:29:08,611] Trial 32 finished with value: 0.04658137312757741 and parameters: {'model_type': 'mlp', 'hidden_dims': '[256, 128]', 'dropout': 0.1332304835114232, 'batch_norm': False, 'lr': 7.830865480688654e-05, 'weight_decay': 2.0390679189687377e-05, 'epochs': 251, 'loss': 'mse', 'optimizer': 'adam', 'graph_mode': 'off', 'use_snp_selection': True, 'num_snps': 48309}. Best is trial 31 with value: 0.05619280643669682.
[I 2025-12-05 16:29:11,114] Trial 33 finished with value: 0.0056236963368044394 and parameters: {'model_type': 'mlp', 'hidden_dims': '[256, 128]', 'dropout': 0.1282607236305972, 'batch_norm': False, 'lr': 0.0009509897060597276, 'weight_decay': 2.3826787211202483e-05, 'epochs': 252, 'loss': 'mse', 'optimizer': 'adam', 'graph_mode': 'off', 'use_snp_selection': True, 'num_snps': 50729}. Best is trial 31 with value: 0.05619280643669682.
[I 2025-12-05 16:29:13,746] Trial 34 finished with value: 0.023136507757294804 and parameters: {'model_type': 'mlp', 'hidden_dims': '[256, 128]', 'dropout': 0.1744169216591523, 'batch_norm': False, 'lr': 0.00010560027979099311, 'weight_decay': 9.93682886827405e-06, 'epochs': 331, 'loss': 'mae', 'optimizer': 'adam', 'graph_mode': 'off', 'use_snp_selection': True, 'num_snps': 49726}. Best is trial 31 with value: 0.05619280643669682.
[I 2025-12-05 16:29:16,524] Trial 35 finished with value: 0.013876702831985657 and parameters: {'model_type': 'mlp', 'hidden_dims': '[256, 128]', 'dropout': 0.1323038033466282, 'batch_norm': True, 'lr': 0.000522059277318979, 'weight_decay': 0.000505428108817952, 'epochs': 347, 'loss': 'mse', 'optimizer': 'adam', 'graph_mode': 'off', 'use_snp_selection': True, 'num_snps': 53674}. Best is trial 31 with value: 0.05619280643669682.
[I 2025-12-05 16:29:19,188] Trial 36 finished with value: 0.02506056220102407 and parameters: {'model_type': 'mlp', 'hidden_dims': '[512, 64]', 'dropout': 0.22481593856165782, 'batch_norm': False, 'lr': 2.7599303291722325e-06, 'weight_decay': 0.00018325896060743203, 'epochs': 298, 'loss': 'mse', 'optimizer': 'adam', 'graph_mode': 'off', 'use_snp_selection': True, 'num_snps': 41134}. Best is trial 31 with value: 0.05619280643669682.
[I 2025-12-05 16:29:21,059] Trial 37 finished with value: 0.020967676674217752 and parameters: {'model_type': 'mlp', 'hidden_dims': '[256, 128, 64]', 'dropout': 0.2641245492485761, 'batch_norm': False, 'lr': 8.747789946151897e-05, 'weight_decay': 7.22116261657746e-05, 'epochs': 265, 'loss': 'mae', 'optimizer': 'adam', 'graph_mode': 'off', 'use_snp_selection': True, 'num_snps': 30844}. Best is trial 31 with value: 0.05619280643669682.
[I 2025-12-05 16:29:23,837] Trial 38 finished with value: 0.01494572087421654 and parameters: {'model_type': 'mlp', 'hidden_dims': '[512, 128]', 'dropout': 0.17788934455327932, 'batch_norm': True, 'lr': 0.00022203273973105112, 'weight_decay': 1.4053839742945455e-05, 'epochs': 239, 'loss': 'mse', 'optimizer': 'adam', 'graph_mode': 'off', 'use_snp_selection': True, 'num_snps': 48306}. Best is trial 31 with value: 0.05619280643669682.
[I 2025-12-05 16:29:26,704] Trial 39 finished with value: -0.01246907893222043 and parameters: {'model_type': 'mlp', 'hidden_dims': '[256, 128]', 'dropout': 0.12123392439101618, 'batch_norm': False, 'lr': 8.140172905724792e-06, 'weight_decay': 0.00024633391569298666, 'epochs': 275, 'loss': 'mse', 'optimizer': 'adam', 'graph_mode': 'off', 'use_snp_selection': True, 'num_snps': 57666}. Best is trial 31 with value: 0.05619280643669682.
[I 2025-12-05 16:29:29,181] Trial 40 finished with value: 0.009801455358445565 and parameters: {'model_type': 'mlp', 'hidden_dims': '[512, 256]', 'dropout': 0.1501411875894134, 'batch_norm': True, 'lr': 1.0628769153821777e-06, 'weight_decay': 3.6919642043200164e-05, 'epochs': 311, 'loss': 'mae', 'optimizer': 'adam', 'graph_mode': 'off', 'use_snp_selection': True, 'num_snps': 38403}. Best is trial 31 with value: 0.05619280643669682.
[I 2025-12-05 16:29:30,240] Trial 41 finished with value: 0.03048113963730222 and parameters: {'model_type': 'mlp', 'hidden_dims': '[256, 128]', 'dropout': 0.2111439302237466, 'batch_norm': False, 'lr': 4.928164709672905e-05, 'weight_decay': 2.760132327608872e-05, 'epochs': 210, 'loss': 'mse', 'optimizer': 'adam', 'graph_mode': 'off', 'use_snp_selection': False}. Best is trial 31 with value: 0.05619280643669682.
[I 2025-12-05 16:29:31,355] Trial 42 finished with value: -0.018409946715106786 and parameters: {'model_type': 'mlp', 'hidden_dims': '[256, 128]', 'dropout': 0.28616644996448853, 'batch_norm': False, 'lr': 6.910758731715888e-05, 'weight_decay': 0.0005329191985397626, 'epochs': 244, 'loss': 'mse', 'optimizer': 'adam', 'graph_mode': 'off', 'use_snp_selection': False}. Best is trial 31 with value: 0.05619280643669682.
[I 2025-12-05 16:29:33,114] Trial 43 finished with value: 0.041463766049507356 and parameters: {'model_type': 'mlp', 'hidden_dims': '[256, 128]', 'dropout': 0.40402391466172083, 'batch_norm': False, 'lr': 4.485442993738566e-05, 'weight_decay': 4.849072624193135e-06, 'epochs': 178, 'loss': 'mse', 'optimizer': 'adam', 'graph_mode': 'off', 'use_snp_selection': True, 'num_snps': 31477}. Best is trial 31 with value: 0.05619280643669682.
[I 2025-12-05 16:29:34,910] Trial 44 finished with value: 0.025875822457601047 and parameters: {'model_type': 'mlp', 'hidden_dims': '[512, 64]', 'dropout': 0.319378993064625, 'batch_norm': False, 'lr': 3.5392169971337565e-05, 'weight_decay': 5.6401704433409395e-06, 'epochs': 176, 'loss': 'mse', 'optimizer': 'adam', 'graph_mode': 'off', 'use_snp_selection': True, 'num_snps': 30106}. Best is trial 31 with value: 0.05619280643669682.
[I 2025-12-05 16:29:37,117] Trial 45 finished with value: 0.033772894956342364 and parameters: {'model_type': 'mlp', 'hidden_dims': '[256, 128]', 'dropout': 0.43136159975613836, 'batch_norm': False, 'lr': 2.9182542875471586e-05, 'weight_decay': 3.3874057210267953e-06, 'epochs': 235, 'loss': 'mse', 'optimizer': 'adam', 'graph_mode': 'off', 'use_snp_selection': True, 'num_snps': 44759}. Best is trial 31 with value: 0.05619280643669682.
[I 2025-12-05 16:29:39,086] Trial 46 finished with value: 0.02520082990595099 and parameters: {'model_type': 'mlp', 'hidden_dims': '[256, 128, 64]', 'dropout': 0.49775813005438624, 'batch_norm': True, 'lr': 1.4774808877500886e-05, 'weight_decay': 2.3016431437867187e-05, 'epochs': 204, 'loss': 'mse', 'optimizer': 'adam', 'graph_mode': 'off', 'use_snp_selection': True, 'num_snps': 33383}. Best is trial 31 with value: 0.05619280643669682.
[I 2025-12-05 16:29:41,318] Trial 47 finished with value: 0.029746807870009648 and parameters: {'model_type': 'mlp', 'hidden_dims': '[256, 128]', 'dropout': 0.4164404415910767, 'batch_norm': False, 'lr': 2.2726477749659717e-05, 'weight_decay': 7.332143988912684e-05, 'epochs': 289, 'loss': 'mse', 'optimizer': 'adam', 'graph_mode': 'off', 'use_snp_selection': True, 'num_snps': 42860}. Best is trial 31 with value: 0.05619280643669682.
[I 2025-12-05 16:29:43,079] Trial 48 finished with value: 0.05405074139312188 and parameters: {'model_type': 'mlp', 'hidden_dims': '[512, 128]', 'dropout': 0.47634476187876085, 'batch_norm': False, 'lr': 5.0889365459568085e-05, 'weight_decay': 9.990522064245352e-06, 'epochs': 222, 'loss': 'mse', 'optimizer': 'adam', 'graph_mode': 'off', 'use_snp_selection': True, 'num_snps': 27301}. Best is trial 31 with value: 0.05619280643669682.
[I 2025-12-05 16:29:44,873] Trial 49 finished with value: 0.04549246857050818 and parameters: {'model_type': 'mlp', 'hidden_dims': '[512, 128]', 'dropout': 0.5759931993463798, 'batch_norm': False, 'lr': 5.037704996768045e-05, 'weight_decay': 9.378370028842339e-06, 'epochs': 268, 'loss': 'mse', 'optimizer': 'adam', 'graph_mode': 'off', 'use_snp_selection': True, 'num_snps': 27341}. Best is trial 31 with value: 0.05619280643669682.
[I 2025-12-05 16:29:47,030] Trial 50 finished with value: 0.04185310652088141 and parameters: {'model_type': 'mlp', 'hidden_dims': '[512, 128]', 'dropout': 0.5771191735458004, 'batch_norm': False, 'lr': 0.00017885878345522138, 'weight_decay': 8.114881397018073e-06, 'epochs': 274, 'loss': 'mse', 'optimizer': 'adam', 'graph_mode': 'off', 'use_snp_selection': True, 'num_snps': 34361}. Best is trial 31 with value: 0.05619280643669682.
[I 2025-12-05 16:29:49,160] Trial 51 finished with value: 0.01657822716844614 and parameters: {'model_type': 'mlp', 'hidden_dims': '[512, 128]', 'dropout': 0.5968674682029852, 'batch_norm': False, 'lr': 8.547660211519392e-05, 'weight_decay': 9.587762265534698e-06, 'epochs': 267, 'loss': 'mse', 'optimizer': 'adam', 'graph_mode': 'off', 'use_snp_selection': True, 'num_snps': 35422}. Best is trial 31 with value: 0.05619280643669682.
[I 2025-12-05 16:29:51,068] Trial 52 finished with value: 0.00045048571386902225 and parameters: {'model_type': 'mlp', 'hidden_dims': '[512, 128]', 'dropout': 0.5667054140615287, 'batch_norm': False, 'lr': 0.00021018645397931886, 'weight_decay': 1.4577152901733444e-05, 'epochs': 308, 'loss': 'mse', 'optimizer': 'adam', 'graph_mode': 'off', 'use_snp_selection': True, 'num_snps': 28097}. Best is trial 31 with value: 0.05619280643669682.
[I 2025-12-05 16:29:53,519] Trial 53 finished with value: -0.004423289521150796 and parameters: {'model_type': 'mlp', 'hidden_dims': '[512, 128]', 'dropout': 0.5540278301213197, 'batch_norm': False, 'lr': 5.990361971942332e-05, 'weight_decay': 8.098993651832174e-06, 'epochs': 247, 'loss': 'mse', 'optimizer': 'adam', 'graph_mode': 'off', 'use_snp_selection': True, 'num_snps': 41323}. Best is trial 31 with value: 0.05619280643669682.
[I 2025-12-05 16:29:56,333] Trial 54 finished with value: 0.049904933075646696 and parameters: {'model_type': 'mlp', 'hidden_dims': '[512, 128]', 'dropout': 0.49060410476692723, 'batch_norm': False, 'lr': 0.0003807413870342091, 'weight_decay': 2.051845908302461e-06, 'epochs': 283, 'loss': 'mse', 'optimizer': 'adam', 'graph_mode': 'off', 'use_snp_selection': True, 'num_snps': 47066}. Best is trial 31 with value: 0.05619280643669682.
[I 2025-12-05 16:29:59,233] Trial 55 finished with value: 0.03328627383859376 and parameters: {'model_type': 'mlp', 'hidden_dims': '[512, 128]', 'dropout': 0.4667033507988908, 'batch_norm': False, 'lr': 0.00031437531226616734, 'weight_decay': 1.4000420512241128e-06, 'epochs': 284, 'loss': 'mse', 'optimizer': 'adam', 'graph_mode': 'off', 'use_snp_selection': True, 'num_snps': 47094}. Best is trial 31 with value: 0.05619280643669682.
[I 2025-12-05 16:30:02,012] Trial 56 finished with value: 0.020706274770145656 and parameters: {'model_type': 'mlp', 'hidden_dims': '[512, 128]', 'dropout': 0.4814069794452412, 'batch_norm': False, 'lr': 0.0007601908308652434, 'weight_decay': 2.7700247415711025e-07, 'epochs': 228, 'loss': 'mse', 'optimizer': 'adam', 'graph_mode': 'off', 'use_snp_selection': True, 'num_snps': 51627}. Best is trial 31 with value: 0.05619280643669682.
[I 2025-12-05 16:30:05,283] Trial 57 finished with value: 0.005542865779986635 and parameters: {'model_type': 'mlp', 'hidden_dims': '[512, 128]', 'dropout': 0.5341619113557464, 'batch_norm': True, 'lr': 0.0005881102745059916, 'weight_decay': 3.64649612732111e-06, 'epochs': 261, 'loss': 'mse', 'optimizer': 'adam', 'graph_mode': 'off', 'use_snp_selection': True, 'num_snps': 54750}. Best is trial 31 with value: 0.05619280643669682.
[I 2025-12-05 16:30:06,400] Trial 58 finished with value: 0.02909581041932447 and parameters: {'model_type': 'mlp', 'hidden_dims': '[512, 128]', 'dropout': 0.5285382057586262, 'batch_norm': False, 'lr': 0.0003404075005608296, 'weight_decay': 5.351110388180581e-07, 'epochs': 299, 'loss': 'mse', 'optimizer': 'adam', 'graph_mode': 'off', 'use_snp_selection': True, 'num_snps': 9275}. Best is trial 31 with value: 0.05619280643669682.
[I 2025-12-05 16:30:08,609] Trial 59 finished with value: -0.0002872157080704229 and parameters: {'model_type': 'mlp', 'hidden_dims': '[512, 128]', 'dropout': 0.3625122447124751, 'batch_norm': False, 'lr': 0.00012482206563171587, 'weight_decay': 2.458930651390703e-06, 'epochs': 252, 'loss': 'mae', 'optimizer': 'adam', 'graph_mode': 'off', 'use_snp_selection': True, 'num_snps': 39410}. Best is trial 31 with value: 0.05619280643669682.
[I 2025-12-05 16:30:09,955] Trial 60 finished with value: 0.01219304606481436 and parameters: {'model_type': 'mlp', 'hidden_dims': '[256, 128, 64]', 'dropout': 0.5112301875471157, 'batch_norm': False, 'lr': 0.00036607381661827275, 'weight_decay': 1.6948679190753302e-05, 'epochs': 228, 'loss': 'mse', 'optimizer': 'adam', 'graph_mode': 'off', 'use_snp_selection': True, 'num_snps': 16409}. Best is trial 31 with value: 0.05619280643669682.
[I 2025-12-05 16:30:12,751] Trial 61 finished with value: 0.007844571572632093 and parameters: {'model_type': 'mlp', 'hidden_dims': '[512, 128]', 'dropout': 0.5729907620611405, 'batch_norm': False, 'lr': 7.738990148567608e-05, 'weight_decay': 1.944183578774301e-06, 'epochs': 279, 'loss': 'mse', 'optimizer': 'adam', 'graph_mode': 'off', 'use_snp_selection': True, 'num_snps': 46592}. Best is trial 31 with value: 0.05619280643669682.
[I 2025-12-05 16:30:14,858] Trial 62 finished with value: 0.018549358310762584 and parameters: {'model_type': 'mlp', 'hidden_dims': '[512, 128]', 'dropout': 0.5796533079886043, 'batch_norm': False, 'lr': 0.0001684431119101903, 'weight_decay': 3.15481251636638e-05, 'epochs': 272, 'loss': 'mse', 'optimizer': 'adam', 'graph_mode': 'off', 'use_snp_selection': True, 'num_snps': 34760}. Best is trial 31 with value: 0.05619280643669682.
[I 2025-12-05 16:30:16,573] Trial 63 finished with value: 0.015215379868289318 and parameters: {'model_type': 'mlp', 'hidden_dims': '[512, 128]', 'dropout': 0.5491281244351996, 'batch_norm': False, 'lr': 5.2011663545589806e-05, 'weight_decay': 1.1456370273927611e-05, 'epochs': 324, 'loss': 'mse', 'optimizer': 'adam', 'graph_mode': 'off', 'use_snp_selection': True, 'num_snps': 23122}. Best is trial 31 with value: 0.05619280643669682.
[I 2025-12-05 16:30:18,376] Trial 64 finished with value: 0.039907334035393455 and parameters: {'model_type': 'mlp', 'hidden_dims': '[128, 64]', 'dropout': 0.490644709132336, 'batch_norm': False, 'lr': 0.0006985462824551078, 'weight_decay': 2.048117356845719e-05, 'epochs': 302, 'loss': 'mse', 'optimizer': 'adam', 'graph_mode': 'off', 'use_snp_selection': True, 'num_snps': 28695}. Best is trial 31 with value: 0.05619280643669682.
[I 2025-12-05 16:30:20,970] Trial 65 finished with value: 0.01406487499056532 and parameters: {'model_type': 'mlp', 'hidden_dims': '[512, 128]', 'dropout': 0.5478951996288328, 'batch_norm': False, 'lr': 0.00044468636191856474, 'weight_decay': 6.500169225639436e-06, 'epochs': 291, 'loss': 'mse', 'optimizer': 'adam', 'graph_mode': 'off', 'use_snp_selection': True, 'num_snps': 44576}. Best is trial 31 with value: 0.05619280643669682.
[I 2025-12-05 16:30:22,701] Trial 66 finished with value: 0.03842222184472345 and parameters: {'model_type': 'mlp', 'hidden_dims': '[512, 256]', 'dropout': 0.11038808456874794, 'batch_norm': False, 'lr': 0.00017810784199251038, 'weight_decay': 4.263520317923537e-06, 'epochs': 223, 'loss': 'mse', 'optimizer': 'adam', 'graph_mode': 'off', 'use_snp_selection': True, 'num_snps': 27470}. Best is trial 31 with value: 0.05619280643669682.
[I 2025-12-05 16:30:23,574] Trial 67 finished with value: 0.023913292653091403 and parameters: {'model_type': 'mlp', 'hidden_dims': '[512, 128]', 'dropout': 0.5855869134913915, 'batch_norm': False, 'lr': 0.0002905567650632356, 'weight_decay': 1.1699409131008036e-05, 'epochs': 257, 'loss': 'mse', 'optimizer': 'adam', 'graph_mode': 'off', 'use_snp_selection': True, 'num_snps': 2558}. Best is trial 31 with value: 0.05619280643669682.
[I 2025-12-05 16:30:25,140] Trial 68 finished with value: 0.054210066073583536 and parameters: {'model_type': 'mlp', 'hidden_dims': '[512, 64]', 'dropout': 0.513991581350994, 'batch_norm': False, 'lr': 0.00010474445383901644, 'weight_decay': 7.471494259112187e-06, 'epochs': 239, 'loss': 'mse', 'optimizer': 'adam', 'graph_mode': 'off', 'use_snp_selection': True, 'num_snps': 21730}. Best is trial 31 with value: 0.05619280643669682.
[I 2025-12-05 16:30:26,546] Trial 69 finished with value: 0.021063944294569245 and parameters: {'model_type': 'mlp', 'hidden_dims': '[512, 64]', 'dropout': 0.4519290358512568, 'batch_norm': False, 'lr': 0.00011012758384811918, 'weight_decay': 2.2922637981919925e-06, 'epochs': 202, 'loss': 'mse', 'optimizer': 'adam', 'graph_mode': 'off', 'use_snp_selection': True, 'num_snps': 21291}. Best is trial 31 with value: 0.05619280643669682.
[I 2025-12-05 16:30:27,807] Trial 70 finished with value: 0.024811347374068097 and parameters: {'model_type': 'mlp', 'hidden_dims': '[512, 64]', 'dropout': 0.474506561586443, 'batch_norm': False, 'lr': 4.0553355650579255e-05, 'weight_decay': 9.888281873601724e-07, 'epochs': 242, 'loss': 'mae', 'optimizer': 'adam', 'graph_mode': 'off', 'use_snp_selection': True, 'num_snps': 17233}. Best is trial 31 with value: 0.05619280643669682.
[I 2025-12-05 16:30:29,556] Trial 71 finished with value: 0.024671995259767956 and parameters: {'model_type': 'mlp', 'hidden_dims': '[512, 64]', 'dropout': 0.5122109958350001, 'batch_norm': False, 'lr': 6.374687602528101e-05, 'weight_decay': 6.921763396013317e-06, 'epochs': 263, 'loss': 'mse', 'optimizer': 'adam', 'graph_mode': 'off', 'use_snp_selection': True, 'num_snps': 25839}. Best is trial 31 with value: 0.05619280643669682.
[I 2025-12-05 16:30:31,542] Trial 72 finished with value: 0.030332147106551084 and parameters: {'model_type': 'mlp', 'hidden_dims': '[256, 128, 64]', 'dropout': 0.16264977545194476, 'batch_norm': False, 'lr': 0.00025086226215305325, 'weight_decay': 9.091044118557076e-06, 'epochs': 270, 'loss': 'mse', 'optimizer': 'adam', 'graph_mode': 'off', 'use_snp_selection': True, 'num_snps': 32773}. Best is trial 31 with value: 0.05619280643669682.
[I 2025-12-05 16:30:32,493] Trial 73 finished with value: 0.03931828396609029 and parameters: {'model_type': 'mlp', 'hidden_dims': '[512, 128]', 'dropout': 0.5618215143114785, 'batch_norm': False, 'lr': 9.801975170625102e-05, 'weight_decay': 1.6300743126300848e-05, 'epochs': 220, 'loss': 'mse', 'optimizer': 'adam', 'graph_mode': 'off', 'use_snp_selection': True, 'num_snps': 7134}. Best is trial 31 with value: 0.05619280643669682.
[I 2025-12-05 16:30:34,815] Trial 74 finished with value: -0.0019449550389560658 and parameters: {'model_type': 'mlp', 'hidden_dims': '[512, 64]', 'dropout': 0.5386634162067381, 'batch_norm': False, 'lr': 0.00013824756165726183, 'weight_decay': 5.906610434684957e-05, 'epochs': 252, 'loss': 'mse', 'optimizer': 'adam', 'graph_mode': 'off', 'use_snp_selection': True, 'num_snps': 40093}. Best is trial 31 with value: 0.05619280643669682.
[I 2025-12-05 16:30:36,820] Trial 75 finished with value: 0.015716211434901164 and parameters: {'model_type': 'mlp', 'hidden_dims': '[128, 64]', 'dropout': 0.14351151298777243, 'batch_norm': False, 'lr': 5.5461270755762045e-05, 'weight_decay': 1.345601142289773e-05, 'epochs': 236, 'loss': 'mse', 'optimizer': 'adam', 'graph_mode': 'off', 'use_snp_selection': True, 'num_snps': 36629}. Best is trial 31 with value: 0.05619280643669682.
[I 2025-12-05 16:30:38,055] Trial 76 finished with value: 0.0016258378831788282 and parameters: {'model_type': 'mlp', 'hidden_dims': '[256, 128, 64]', 'dropout': 0.43520720853708483, 'batch_norm': True, 'lr': 3.075047906459383e-05, 'weight_decay': 9.858869841594555e-05, 'epochs': 285, 'loss': 'mse', 'optimizer': 'adam', 'graph_mode': 'off', 'use_snp_selection': False}. Best is trial 31 with value: 0.05619280643669682.
[I 2025-12-05 16:30:39,375] Trial 77 finished with value: 0.04164807105159839 and parameters: {'model_type': 'mlp', 'hidden_dims': '[512, 128]', 'dropout': 0.5168112313651696, 'batch_norm': False, 'lr': 7.394094438531145e-05, 'weight_decay': 3.6398566738698187e-05, 'epochs': 317, 'loss': 'mse', 'optimizer': 'adam', 'graph_mode': 'off', 'use_snp_selection': True, 'num_snps': 14851}. Best is trial 31 with value: 0.05619280643669682.
[I 2025-12-05 16:30:40,823] Trial 78 finished with value: -0.002478572142914142 and parameters: {'model_type': 'mlp', 'hidden_dims': '[512, 64]', 'dropout': 0.4991624648381132, 'batch_norm': False, 'lr': 0.00018930779942744318, 'weight_decay': 0.0001725241765310543, 'epochs': 190, 'loss': 'mse', 'optimizer': 'adam', 'graph_mode': 'off', 'use_snp_selection': True, 'num_snps': 20909}. Best is trial 31 with value: 0.05619280643669682.
