[I 2025-12-05 15:02:51,368] Trial 43 finished with value: -0.024441382961913963 and parameters: {'model_type': 'mlp', 'hidden_dims': '[512, 256]', 'dropout': 0.11047139071443872, 'batch_norm': True, 'lr': 2.1409924724993155e-06, 'weight_decay': 2.7656528729506413e-05, 'epochs': 296, 'loss': 'mae', 'optimizer': 'adam', 'graph_mode': 'off', 'use_snp_selection': False}. Best is trial 31 with value: 0.09732593083060198.
[I 2025-12-05 15:02:53,095] Trial 44 finished with value: 0.09296124529119013 and parameters: {'model_type': 'mlp', 'hidden_dims': '[512, 256]', 'dropout': 0.12587401901020295, 'batch_norm': True, 'lr': 0.0001892104994842434, 'weight_decay': 1.2238037822222146e-05, 'epochs': 272, 'loss': 'mse', 'optimizer': 'adam', 'graph_mode': 'off', 'use_snp_selection': False}. Best is trial 31 with value: 0.09732593083060198.
[I 2025-12-05 15:02:54,822] Trial 45 finished with value: 0.07694673649659126 and parameters: {'model_type': 'mlp', 'hidden_dims': '[512, 128]', 'dropout': 0.1333381212282598, 'batch_norm': True, 'lr': 0.0002964721793486316, 'weight_decay': 6.246344848820209e-06, 'epochs': 274, 'loss': 'mse', 'optimizer': 'adam', 'graph_mode': 'off', 'use_snp_selection': False}. Best is trial 31 with value: 0.09732593083060198.
[I 2025-12-05 15:02:56,046] Trial 46 finished with value: 0.040840948491092544 and parameters: {'model_type': 'mlp', 'hidden_dims': '[256, 128]', 'dropout': 0.2138658857473816, 'batch_norm': True, 'lr': 0.00020571782322011838, 'weight_decay': 2.0110380303608144e-06, 'epochs': 305, 'loss': 'mse', 'optimizer': 'adam', 'graph_mode': 'off', 'use_snp_selection': False}. Best is trial 31 with value: 0.09732593083060198.
[I 2025-12-05 15:02:57,215] Trial 47 finished with value: 0.0544170619139045 and parameters: {'model_type': 'mlp', 'hidden_dims': '[512, 256]', 'dropout': 0.2577310256444136, 'batch_norm': False, 'lr': 5.293235620826607e-05, 'weight_decay': 7.870705593413524e-05, 'epochs': 120, 'loss': 'mse', 'optimizer': 'adam', 'graph_mode': 'off', 'use_snp_selection': False}. Best is trial 31 with value: 0.09732593083060198.
[I 2025-12-05 15:02:58,222] Trial 48 finished with value: 0.06079567877188748 and parameters: {'model_type': 'mlp', 'hidden_dims': '[128, 64]', 'dropout': 0.15166420741175862, 'batch_norm': True, 'lr': 0.00010373355461709086, 'weight_decay': 1.0201310005877701e-06, 'epochs': 319, 'loss': 'mse', 'optimizer': 'adam', 'graph_mode': 'off', 'use_snp_selection': False}. Best is trial 31 with value: 0.09732593083060198.
[I 2025-12-05 15:03:00,932] Trial 49 finished with value: 0.08945522521206122 and parameters: {'model_type': 'mlp', 'hidden_dims': '[512, 64]', 'dropout': 0.1218788975485461, 'batch_norm': True, 'lr': 0.0006423867916677473, 'weight_decay': 3.946637445760036e-07, 'epochs': 286, 'loss': 'mse', 'optimizer': 'adam', 'graph_mode': 'off', 'use_snp_selection': True, 'num_snps': 46888}. Best is trial 31 with value: 0.09732593083060198.
[I 2025-12-05 15:03:03,440] Trial 50 finished with value: 0.08111605504944762 and parameters: {'model_type': 'mlp', 'hidden_dims': '[512, 128]', 'dropout': 0.17532353196322525, 'batch_norm': True, 'lr': 0.0005816161649723492, 'weight_decay': 4.830936308591571e-07, 'epochs': 207, 'loss': 'mse', 'optimizer': 'adam', 'graph_mode': 'off', 'use_snp_selection': True, 'num_snps': 46345}. Best is trial 31 with value: 0.09732593083060198.
[I 2025-12-05 15:03:05,993] Trial 51 finished with value: 0.044289584835648016 and parameters: {'model_type': 'mlp', 'hidden_dims': '[512, 128]', 'dropout': 0.17211627280072878, 'batch_norm': True, 'lr': 0.0005929722518578382, 'weight_decay': 3.868920628202353e-07, 'epochs': 207, 'loss': 'mse', 'optimizer': 'adam', 'graph_mode': 'off', 'use_snp_selection': True, 'num_snps': 46497}. Best is trial 31 with value: 0.09732593083060198.
[I 2025-12-05 15:03:08,623] Trial 52 finished with value: 0.08019243135297792 and parameters: {'model_type': 'mlp', 'hidden_dims': '[512, 128]', 'dropout': 0.11806411649169832, 'batch_norm': True, 'lr': 0.00039592505494863927, 'weight_decay': 3.8088171022828995e-07, 'epochs': 244, 'loss': 'mse', 'optimizer': 'adam', 'graph_mode': 'off', 'use_snp_selection': True, 'num_snps': 47120}. Best is trial 31 with value: 0.09732593083060198.
[I 2025-12-05 15:03:10,795] Trial 53 finished with value: 0.06435974410623493 and parameters: {'model_type': 'mlp', 'hidden_dims': '[512, 128]', 'dropout': 0.14363526046795014, 'batch_norm': True, 'lr': 0.0008512094490903014, 'weight_decay': 1.8954180251644307e-07, 'epochs': 196, 'loss': 'mse', 'optimizer': 'adam', 'graph_mode': 'off', 'use_snp_selection': True, 'num_snps': 39726}. Best is trial 31 with value: 0.09732593083060198.
[I 2025-12-05 15:03:13,054] Trial 54 finished with value: 0.08237985206747829 and parameters: {'model_type': 'mlp', 'hidden_dims': '[512, 128]', 'dropout': 0.5546440174004239, 'batch_norm': True, 'lr': 0.0005752952636193952, 'weight_decay': 7.358366811506795e-07, 'epochs': 42, 'loss': 'mse', 'optimizer': 'adam', 'graph_mode': 'off', 'use_snp_selection': True, 'num_snps': 52298}. Best is trial 31 with value: 0.09732593083060198.
[I 2025-12-05 15:03:15,476] Trial 55 finished with value: 0.07152668753217292 and parameters: {'model_type': 'mlp', 'hidden_dims': '[512, 128]', 'dropout': 0.540819333545785, 'batch_norm': True, 'lr': 0.0005230001240962474, 'weight_decay': 4.924027762804216e-07, 'epochs': 46, 'loss': 'mse', 'optimizer': 'adam', 'graph_mode': 'off', 'use_snp_selection': True, 'num_snps': 53774}. Best is trial 31 with value: 0.09732593083060198.
[I 2025-12-05 15:03:17,956] Trial 56 finished with value: 0.048705942173147526 and parameters: {'model_type': 'mlp', 'hidden_dims': '[512, 128]', 'dropout': 0.552358854558193, 'batch_norm': True, 'lr': 0.0003588533238343457, 'weight_decay': 2.7046593402712065e-07, 'epochs': 136, 'loss': 'mse', 'optimizer': 'adam', 'graph_mode': 'off', 'use_snp_selection': True, 'num_snps': 50431}. Best is trial 31 with value: 0.09732593083060198.
[I 2025-12-05 15:03:19,851] Trial 57 finished with value: 0.05003302130827866 and parameters: {'model_type': 'mlp', 'hidden_dims': '[512, 128]', 'dropout': 0.581778637101358, 'batch_norm': True, 'lr': 0.000694781878998966, 'weight_decay': 8.132968393817558e-07, 'epochs': 66, 'loss': 'mse', 'optimizer': 'adam', 'graph_mode': 'off', 'use_snp_selection': True, 'num_snps': 39903}. Best is trial 31 with value: 0.09732593083060198.
[I 2025-12-05 15:03:22,268] Trial 58 finished with value: 0.040718511061284685 and parameters: {'model_type': 'mlp', 'hidden_dims': '[512, 128]', 'dropout': 0.5093833972683453, 'batch_norm': False, 'lr': 0.0004914458905020386, 'weight_decay': 1.1470466344995e-07, 'epochs': 89, 'loss': 'mse', 'optimizer': 'adam', 'graph_mode': 'off', 'use_snp_selection': True, 'num_snps': 52978}. Best is trial 31 with value: 0.09732593083060198.
[I 2025-12-05 15:03:24,032] Trial 59 finished with value: 0.05627930077113852 and parameters: {'model_type': 'mlp', 'hidden_dims': '[512, 64]', 'dropout': 0.5734093476339152, 'batch_norm': True, 'lr': 0.0007051003832287265, 'weight_decay': 6.804767536383186e-07, 'epochs': 161, 'loss': 'mse', 'optimizer': 'adam', 'graph_mode': 'off', 'use_snp_selection': True, 'num_snps': 29523}. Best is trial 31 with value: 0.09732593083060198.
[I 2025-12-05 15:03:26,497] Trial 60 finished with value: 0.03694070249758671 and parameters: {'model_type': 'mlp', 'hidden_dims': '[256, 128, 64]', 'dropout': 0.3964245424863043, 'batch_norm': True, 'lr': 0.00023499569569908764, 'weight_decay': 1.7460810639506486e-07, 'epochs': 226, 'loss': 'mse', 'optimizer': 'adam', 'graph_mode': 'off', 'use_snp_selection': True, 'num_snps': 51934}. Best is trial 31 with value: 0.09732593083060198.
[I 2025-12-05 15:03:28,548] Trial 61 finished with value: 0.07345681122485354 and parameters: {'model_type': 'mlp', 'hidden_dims': '[512, 256]', 'dropout': 0.46621935160901373, 'batch_norm': True, 'lr': 0.0003309896629832182, 'weight_decay': 5.667244332015797e-07, 'epochs': 292, 'loss': 'mse', 'optimizer': 'adam', 'graph_mode': 'off', 'use_snp_selection': True, 'num_snps': 32250}. Best is trial 31 with value: 0.09732593083060198.
[I 2025-12-05 15:03:31,109] Trial 62 finished with value: 0.06990050337910221 and parameters: {'model_type': 'mlp', 'hidden_dims': '[512, 256]', 'dropout': 0.5160537481051534, 'batch_norm': True, 'lr': 0.0001333929593365541, 'weight_decay': 2.945447028814561e-07, 'epochs': 282, 'loss': 'mse', 'optimizer': 'adam', 'graph_mode': 'off', 'use_snp_selection': True, 'num_snps': 43042}. Best is trial 31 with value: 0.09732593083060198.
[I 2025-12-05 15:03:34,019] Trial 63 finished with value: 0.07046509716231522 and parameters: {'model_type': 'mlp', 'hidden_dims': '[512, 128]', 'dropout': 0.12377188349613767, 'batch_norm': True, 'lr': 0.0009695914083355531, 'weight_decay': 3.853605718931717e-06, 'epochs': 264, 'loss': 'mse', 'optimizer': 'adam', 'graph_mode': 'off', 'use_snp_selection': True, 'num_snps': 48659}. Best is trial 31 with value: 0.09732593083060198.
[I 2025-12-05 15:03:37,471] Trial 64 finished with value: 0.07167739526440198 and parameters: {'model_type': 'mlp', 'hidden_dims': '[512, 256]', 'dropout': 0.20348852690914632, 'batch_norm': True, 'lr': 0.0004896441438323949, 'weight_decay': 1.1366986479990621e-06, 'epochs': 270, 'loss': 'mse', 'optimizer': 'adam', 'graph_mode': 'off', 'use_snp_selection': True, 'num_snps': 59706}. Best is trial 31 with value: 0.09732593083060198.
[I 2025-12-05 15:03:39,173] Trial 65 finished with value: 0.06029510769808023 and parameters: {'model_type': 'mlp', 'hidden_dims': '[512, 64]', 'dropout': 0.16125060752362186, 'batch_norm': True, 'lr': 0.0002683582625275133, 'weight_decay': 2.2722692571248303e-05, 'epochs': 218, 'loss': 'mse', 'optimizer': 'adam', 'graph_mode': 'off', 'use_snp_selection': True, 'num_snps': 26397}. Best is trial 31 with value: 0.09732593083060198.
[I 2025-12-05 15:03:41,247] Trial 66 finished with value: 0.017844972814922404 and parameters: {'model_type': 'mlp', 'hidden_dims': '[512, 256]', 'dropout': 0.4848153272024346, 'batch_norm': True, 'lr': 3.798577631426677e-05, 'weight_decay': 3.514283179244464e-05, 'epochs': 187, 'loss': 'mse', 'optimizer': 'adam', 'graph_mode': 'off', 'use_snp_selection': True, 'num_snps': 37495}. Best is trial 31 with value: 0.09732593083060198.
[I 2025-12-05 15:03:42,361] Trial 67 finished with value: 0.08596306487707754 and parameters: {'model_type': 'mlp', 'hidden_dims': '[256, 128]', 'dropout': 0.18685274598450866, 'batch_norm': True, 'lr': 0.0001981145435578609, 'weight_decay': 1.4776956983404538e-06, 'epochs': 246, 'loss': 'mse', 'optimizer': 'adam', 'graph_mode': 'off', 'use_snp_selection': False}. Best is trial 31 with value: 0.09732593083060198.
[I 2025-12-05 15:03:43,484] Trial 68 finished with value: 0.05070324646117983 and parameters: {'model_type': 'mlp', 'hidden_dims': '[256, 128]', 'dropout': 0.5672231041635429, 'batch_norm': True, 'lr': 0.00018307703199347777, 'weight_decay': 1.4543628382138933e-06, 'epochs': 234, 'loss': 'mse', 'optimizer': 'adam', 'graph_mode': 'off', 'use_snp_selection': False}. Best is trial 31 with value: 0.09732593083060198.
[I 2025-12-05 15:03:46,297] Trial 69 finished with value: 0.05234677057432571 and parameters: {'model_type': 'mlp', 'hidden_dims': '[256, 128]', 'dropout': 0.5240585882581064, 'batch_norm': True, 'lr': 0.00020972029862373071, 'weight_decay': 1.947593377443969e-06, 'epochs': 247, 'loss': 'mse', 'optimizer': 'adam', 'graph_mode': 'off', 'use_snp_selection': True, 'num_snps': 55857}. Best is trial 31 with value: 0.09732593083060198.
[I 2025-12-05 15:03:47,458] Trial 70 finished with value: 0.029748454621297913 and parameters: {'model_type': 'mlp', 'hidden_dims': '[256, 128]', 'dropout': 0.3386380993844757, 'batch_norm': False, 'lr': 0.0008289102905457512, 'weight_decay': 8.501945661228551e-06, 'epochs': 260, 'loss': 'mse', 'optimizer': 'adam', 'graph_mode': 'off', 'use_snp_selection': False}. Best is trial 31 with value: 0.09732593083060198.
[I 2025-12-05 15:03:48,570] Trial 71 finished with value: 0.07229945980803984 and parameters: {'model_type': 'mlp', 'hidden_dims': '[256, 128]', 'dropout': 0.1836245437875372, 'batch_norm': True, 'lr': 9.719768673068914e-05, 'weight_decay': 1.408409465268738e-05, 'epochs': 228, 'loss': 'mse', 'optimizer': 'adam', 'graph_mode': 'off', 'use_snp_selection': False}. Best is trial 31 with value: 0.09732593083060198.
[I 2025-12-05 15:03:49,563] Trial 72 finished with value: 0.06822637394710523 and parameters: {'model_type': 'mlp', 'hidden_dims': '[128, 64]', 'dropout': 0.14425052710651826, 'batch_norm': True, 'lr': 0.0001317436326896103, 'weight_decay': 4.751290759332236e-07, 'epochs': 280, 'loss': 'mse', 'optimizer': 'adam', 'graph_mode': 'off', 'use_snp_selection': False}. Best is trial 31 with value: 0.09732593083060198.
[I 2025-12-05 15:03:51,343] Trial 73 finished with value: 0.08234468488798452 and parameters: {'model_type': 'mlp', 'hidden_dims': '[512, 256]', 'dropout': 0.1203767854561441, 'batch_norm': True, 'lr': 0.0004066240482102988, 'weight_decay': 3.776609660099318e-06, 'epochs': 288, 'loss': 'mse', 'optimizer': 'adam', 'graph_mode': 'off', 'use_snp_selection': False}. Best is trial 31 with value: 0.09732593083060198.
[I 2025-12-05 15:03:53,219] Trial 74 finished with value: 0.0833464009319485 and parameters: {'model_type': 'mlp', 'hidden_dims': '[512, 64]', 'dropout': 0.1154057681743409, 'batch_norm': True, 'lr': 0.00038888201697639886, 'weight_decay': 3.354628797194575e-06, 'epochs': 313, 'loss': 'mse', 'optimizer': 'adam', 'graph_mode': 'off', 'use_snp_selection': False}. Best is trial 31 with value: 0.09732593083060198.
[I 2025-12-05 15:03:55,130] Trial 75 finished with value: 0.07240260568176818 and parameters: {'model_type': 'mlp', 'hidden_dims': '[512, 64]', 'dropout': 0.11529419944989702, 'batch_norm': True, 'lr': 0.000368020960749552, 'weight_decay': 5.451630939693953e-06, 'epochs': 315, 'loss': 'mse', 'optimizer': 'adam', 'graph_mode': 'off', 'use_snp_selection': False}. Best is trial 31 with value: 0.09732593083060198.
[I 2025-12-05 15:03:57,098] Trial 76 finished with value: 0.06848674921882329 and parameters: {'model_type': 'mlp', 'hidden_dims': '[512, 64]', 'dropout': 0.10220497674471282, 'batch_norm': True, 'lr': 0.00044569948429683064, 'weight_decay': 3.1425239351095697e-06, 'epochs': 333, 'loss': 'mse', 'optimizer': 'adam', 'graph_mode': 'off', 'use_snp_selection': False}. Best is trial 31 with value: 0.09732593083060198.
[I 2025-12-05 15:03:58,909] Trial 77 finished with value: 0.09186440757672386 and parameters: {'model_type': 'mlp', 'hidden_dims': '[512, 64]', 'dropout': 0.12527289388044702, 'batch_norm': True, 'lr': 0.0003229836312516038, 'weight_decay': 3.871504002586426e-06, 'epochs': 291, 'loss': 'mse', 'optimizer': 'adam', 'graph_mode': 'off', 'use_snp_selection': False}. Best is trial 31 with value: 0.09732593083060198.
[I 2025-12-05 15:04:00,782] Trial 78 finished with value: 0.05107041504787682 and parameters: {'model_type': 'mlp', 'hidden_dims': '[512, 64]', 'dropout': 0.13030991771331704, 'batch_norm': True, 'lr': 0.00025442045030354976, 'weight_decay': 3.5517473662613553e-06, 'epochs': 307, 'loss': 'mse', 'optimizer': 'adam', 'graph_mode': 'off', 'use_snp_selection': False}. Best is trial 31 with value: 0.09732593083060198.
[I 2025-12-05 15:04:02,561] Trial 79 finished with value: 0.07124147021028823 and parameters: {'model_type': 'mlp', 'hidden_dims': '[512, 64]', 'dropout': 0.14450302484539412, 'batch_norm': True, 'lr': 0.00030121912955829387, 'weight_decay': 2.333939429901739e-06, 'epochs': 291, 'loss': 'mse', 'optimizer': 'adam', 'graph_mode': 'off', 'use_snp_selection': False}. Best is trial 31 with value: 0.09732593083060198.
[I 2025-12-05 15:04:04,368] Trial 80 finished with value: 0.02102318346904669 and parameters: {'model_type': 'mlp', 'hidden_dims': '[512, 64]', 'dropout': 0.11793743853127842, 'batch_norm': True, 'lr': 1.1513517158903404e-05, 'weight_decay': 4.434195052521041e-06, 'epochs': 300, 'loss': 'mse', 'optimizer': 'adam', 'graph_mode': 'off', 'use_snp_selection': False}. Best is trial 31 with value: 0.09732593083060198.
[I 2025-12-05 15:04:06,185] Trial 81 finished with value: 0.06686523895014836 and parameters: {'model_type': 'mlp', 'hidden_dims': '[512, 64]', 'dropout': 0.15826283423446202, 'batch_norm': True, 'lr': 0.00019118171601966425, 'weight_decay': 1.1413914018931335e-05, 'epochs': 286, 'loss': 'mse', 'optimizer': 'adam', 'graph_mode': 'off', 'use_snp_selection': False}. Best is trial 31 with value: 0.09732593083060198.
[I 2025-12-05 15:04:08,113] Trial 82 finished with value: 0.09439787570806644 and parameters: {'model_type': 'mlp', 'hidden_dims': '[512, 256]', 'dropout': 0.1367942350799159, 'batch_norm': True, 'lr': 0.0004157113526524304, 'weight_decay': 6.259367389641387e-06, 'epochs': 319, 'loss': 'mse', 'optimizer': 'adam', 'graph_mode': 'off', 'use_snp_selection': False}. Best is trial 31 with value: 0.09732593083060198.
[I 2025-12-05 15:04:10,033] Trial 83 finished with value: 0.07695768338885649 and parameters: {'model_type': 'mlp', 'hidden_dims': '[512, 64]', 'dropout': 0.13996462648667568, 'batch_norm': True, 'lr': 0.0004252264462354359, 'weight_decay': 7.242564546537512e-06, 'epochs': 322, 'loss': 'mse', 'optimizer': 'adam', 'graph_mode': 'off', 'use_snp_selection': False}. Best is trial 31 with value: 0.09732593083060198.
[I 2025-12-05 15:04:11,322] Trial 84 finished with value: 0.07015243511049311 and parameters: {'model_type': 'mlp', 'hidden_dims': '[256, 128, 64]', 'dropout': 0.12363019427820432, 'batch_norm': True, 'lr': 0.0005292128531824569, 'weight_decay': 2.8945348136808103e-06, 'epochs': 308, 'loss': 'mse', 'optimizer': 'adam', 'graph_mode': 'off', 'use_snp_selection': False}. Best is trial 31 with value: 0.09732593083060198.
[I 2025-12-05 15:04:13,276] Trial 85 finished with value: 0.0728534636662622 and parameters: {'model_type': 'mlp', 'hidden_dims': '[512, 256]', 'dropout': 0.1019176625346586, 'batch_norm': True, 'lr': 0.0003462887976270583, 'weight_decay': 1.7711532268904671e-06, 'epochs': 339, 'loss': 'mse', 'optimizer': 'adam', 'graph_mode': 'off', 'use_snp_selection': False}. Best is trial 31 with value: 0.09732593083060198.
[I 2025-12-05 15:04:15,019] Trial 86 finished with value: 0.06768388682690231 and parameters: {'model_type': 'mlp', 'hidden_dims': '[512, 256]', 'dropout': 0.11444100020207916, 'batch_norm': True, 'lr': 0.00027233575207206637, 'weight_decay': 1.2646021512814815e-06, 'epochs': 280, 'loss': 'mse', 'optimizer': 'adam', 'graph_mode': 'off', 'use_snp_selection': False}. Best is trial 31 with value: 0.09732593083060198.
[I 2025-12-05 15:04:16,899] Trial 87 finished with value: 0.03558434269083452 and parameters: {'model_type': 'mlp', 'hidden_dims': '[512, 64]', 'dropout': 0.16661557916921713, 'batch_norm': False, 'lr': 0.0006654685349870505, 'weight_decay': 4.573790630450494e-06, 'epochs': 312, 'loss': 'mse', 'optimizer': 'adam', 'graph_mode': 'off', 'use_snp_selection': False}. Best is trial 31 with value: 0.09732593083060198.
[I 2025-12-05 15:04:18,748] Trial 88 finished with value: 0.07775148692340636 and parameters: {'model_type': 'mlp', 'hidden_dims': '[512, 256]', 'dropout': 0.15009099640189072, 'batch_norm': True, 'lr': 0.0008321650535510325, 'weight_decay': 8.140402198235187e-07, 'epochs': 296, 'loss': 'mse', 'optimizer': 'adam', 'graph_mode': 'off', 'use_snp_selection': False}. Best is trial 31 with value: 0.09732593083060198.
[I 2025-12-05 15:04:20,093] Trial 89 finished with value: 0.09056768204041749 and parameters: {'model_type': 'mlp', 'hidden_dims': '[256, 128]', 'dropout': 0.1302498204157118, 'batch_norm': True, 'lr': 0.0004243495375813538, 'weight_decay': 7.641692944866332e-06, 'epochs': 347, 'loss': 'mse', 'optimizer': 'adam', 'graph_mode': 'off', 'use_snp_selection': False}. Best is trial 31 with value: 0.09732593083060198.
[I 2025-12-05 15:04:21,419] Trial 90 finished with value: 0.06366030364677158 and parameters: {'model_type': 'mlp', 'hidden_dims': '[256, 128]', 'dropout': 0.1350608236105373, 'batch_norm': True, 'lr': 0.00023266307980714243, 'weight_decay': 1.0629723447038706e-05, 'epochs': 340, 'loss': 'mse', 'optimizer': 'adam', 'graph_mode': 'off', 'use_snp_selection': False}. Best is trial 31 with value: 0.09732593083060198.
[I 2025-12-05 15:04:22,757] Trial 91 finished with value: 0.07748481371577065 and parameters: {'model_type': 'mlp', 'hidden_dims': '[256, 128]', 'dropout': 0.12628652155062747, 'batch_norm': True, 'lr': 0.0004423394766014927, 'weight_decay': 6.776931498782391e-06, 'epochs': 347, 'loss': 'mse', 'optimizer': 'adam', 'graph_mode': 'off', 'use_snp_selection': False}. Best is trial 31 with value: 0.09732593083060198.
[I 2025-12-05 15:04:24,035] Trial 92 finished with value: 0.07049227196932896 and parameters: {'model_type': 'mlp', 'hidden_dims': '[256, 128]', 'dropout': 0.10037100405243722, 'batch_norm': True, 'lr': 0.0003679037685789991, 'weight_decay': 1.7072950100463163e-05, 'epochs': 332, 'loss': 'mse', 'optimizer': 'adam', 'graph_mode': 'off', 'use_snp_selection': False}. Best is trial 31 with value: 0.09732593083060198.
[I 2025-12-05 15:04:25,287] Trial 93 finished with value: 0.08793149901881953 and parameters: {'model_type': 'mlp', 'hidden_dims': '[256, 128]', 'dropout': 0.19401731281575652, 'batch_norm': True, 'lr': 0.0005713452913343883, 'weight_decay': 2.3807722405459142e-06, 'epochs': 318, 'loss': 'mse', 'optimizer': 'adam', 'graph_mode': 'off', 'use_snp_selection': False}. Best is trial 31 with value: 0.09732593083060198.
[I 2025-12-05 15:04:26,582] Trial 94 finished with value: 0.08565138151391409 and parameters: {'model_type': 'mlp', 'hidden_dims': '[256, 128]', 'dropout': 0.25552320123904015, 'batch_norm': True, 'lr': 0.0005743756026693821, 'weight_decay': 8.327382435107954e-06, 'epochs': 321, 'loss': 'mse', 'optimizer': 'adam', 'graph_mode': 'off', 'use_snp_selection': False}. Best is trial 31 with value: 0.09732593083060198.
