[I 2025-12-05 16:29:12,091] Trial 119 finished with value: 0.06822137195418214 and parameters: {'model_type': 'mlp', 'hidden_dims': '[256, 128]', 'dropout': 0.2714352838248859, 'batch_norm': True, 'lr': 0.0007191191257888722, 'weight_decay': 0.0006339260258811937, 'epochs': 270, 'loss': 'mse', 'optimizer': 'adam', 'graph_mode': 'off', 'use_snp_selection': True, 'num_snps': 13199}. Best is trial 87 with value: 0.10100013413584537.
[I 2025-12-05 16:29:13,207] Trial 120 finished with value: 0.07910069770733714 and parameters: {'model_type': 'mlp', 'hidden_dims': '[256, 128]', 'dropout': 0.2888325352509552, 'batch_norm': True, 'lr': 0.0008989185888477198, 'weight_decay': 0.0007632077102040549, 'epochs': 258, 'loss': 'mse', 'optimizer': 'adam', 'graph_mode': 'off', 'use_snp_selection': True, 'num_snps': 9795}. Best is trial 87 with value: 0.10100013413584537.
[I 2025-12-05 16:29:14,344] Trial 121 finished with value: 0.05550228766544418 and parameters: {'model_type': 'mlp', 'hidden_dims': '[256, 128]', 'dropout': 0.29100344605636863, 'batch_norm': True, 'lr': 0.0008731951795968835, 'weight_decay': 0.0008369644001353586, 'epochs': 244, 'loss': 'mse', 'optimizer': 'adam', 'graph_mode': 'off', 'use_snp_selection': True, 'num_snps': 11253}. Best is trial 87 with value: 0.10100013413584537.
[I 2025-12-05 16:29:15,431] Trial 122 finished with value: 0.034154522548942925 and parameters: {'model_type': 'mlp', 'hidden_dims': '[256, 128]', 'dropout': 0.31107904622083526, 'batch_norm': True, 'lr': 2.7452021712280873e-05, 'weight_decay': 0.00046784960361418836, 'epochs': 249, 'loss': 'mse', 'optimizer': 'adam', 'graph_mode': 'off', 'use_snp_selection': True, 'num_snps': 9247}. Best is trial 87 with value: 0.10100013413584537.
[I 2025-12-05 16:29:17,055] Trial 123 finished with value: 0.06830068112372191 and parameters: {'model_type': 'mlp', 'hidden_dims': '[256, 128]', 'dropout': 0.2506538889979617, 'batch_norm': True, 'lr': 0.0009002124985091141, 'weight_decay': 0.0006993068261622059, 'epochs': 262, 'loss': 'mse', 'optimizer': 'adam', 'graph_mode': 'off', 'use_snp_selection': True, 'num_snps': 28176}. Best is trial 87 with value: 0.10100013413584537.
[I 2025-12-05 16:29:18,001] Trial 124 finished with value: 0.05225361782155862 and parameters: {'model_type': 'mlp', 'hidden_dims': '[256, 128]', 'dropout': 0.2844007439735928, 'batch_norm': True, 'lr': 0.0007021593306940897, 'weight_decay': 0.0005870559400113029, 'epochs': 252, 'loss': 'mse', 'optimizer': 'adam', 'graph_mode': 'off', 'use_snp_selection': True, 'num_snps': 4520}. Best is trial 87 with value: 0.10100013413584537.
[I 2025-12-05 16:29:19,413] Trial 125 finished with value: 0.0703820647294943 and parameters: {'model_type': 'mlp', 'hidden_dims': '[256, 128]', 'dropout': 0.23433501119917408, 'batch_norm': True, 'lr': 0.0005611432899237464, 'weight_decay': 0.00040093634275418307, 'epochs': 268, 'loss': 'mse', 'optimizer': 'adam', 'graph_mode': 'off', 'use_snp_selection': True, 'num_snps': 20218}. Best is trial 87 with value: 0.10100013413584537.
[I 2025-12-05 16:29:20,674] Trial 126 finished with value: -0.023757018297194725 and parameters: {'model_type': 'mlp', 'hidden_dims': '[256, 128]', 'dropout': 0.2677580283545397, 'batch_norm': True, 'lr': 1.854152410224158e-06, 'weight_decay': 0.0008274023624983426, 'epochs': 257, 'loss': 'mse', 'optimizer': 'adam', 'graph_mode': 'off', 'use_snp_selection': True, 'num_snps': 15694}. Best is trial 87 with value: 0.10100013413584537.
[I 2025-12-05 16:29:21,852] Trial 127 finished with value: 0.06388856468183476 and parameters: {'model_type': 'mlp', 'hidden_dims': '[256, 128]', 'dropout': 0.25273255749020007, 'batch_norm': True, 'lr': 0.0007799978574487902, 'weight_decay': 0.0005359865978808858, 'epochs': 273, 'loss': 'mse', 'optimizer': 'adam', 'graph_mode': 'off', 'use_snp_selection': True, 'num_snps': 12287}. Best is trial 87 with value: 0.10100013413584537.
[I 2025-12-05 16:29:23,419] Trial 128 finished with value: 0.06880873799692369 and parameters: {'model_type': 'mlp', 'hidden_dims': '[256, 128]', 'dropout': 0.29369508975636843, 'batch_norm': True, 'lr': 0.00043922830633871606, 'weight_decay': 0.0009929999374586782, 'epochs': 281, 'loss': 'mse', 'optimizer': 'adam', 'graph_mode': 'off', 'use_snp_selection': True, 'num_snps': 25172}. Best is trial 87 with value: 0.10100013413584537.
[I 2025-12-05 16:29:24,659] Trial 129 finished with value: 0.07633521430590122 and parameters: {'model_type': 'mlp', 'hidden_dims': '[512, 256]', 'dropout': 0.22511054734322955, 'batch_norm': True, 'lr': 0.0005468397277133263, 'weight_decay': 0.0004536811492509877, 'epochs': 177, 'loss': 'mse', 'optimizer': 'adam', 'graph_mode': 'off', 'use_snp_selection': True, 'num_snps': 16976}. Best is trial 87 with value: 0.10100013413584537.
[I 2025-12-05 16:29:25,900] Trial 130 finished with value: 0.07294672372760047 and parameters: {'model_type': 'mlp', 'hidden_dims': '[512, 256]', 'dropout': 0.22498432694712275, 'batch_norm': True, 'lr': 0.0007000733495280627, 'weight_decay': 0.00046320888142627306, 'epochs': 176, 'loss': 'mse', 'optimizer': 'adam', 'graph_mode': 'off', 'use_snp_selection': True, 'num_snps': 17069}. Best is trial 87 with value: 0.10100013413584537.
[I 2025-12-05 16:29:27,018] Trial 131 finished with value: 0.06839664224846946 and parameters: {'model_type': 'mlp', 'hidden_dims': '[512, 256]', 'dropout': 0.20210586901544839, 'batch_norm': True, 'lr': 0.0005376598825811896, 'weight_decay': 0.0003458241920426321, 'epochs': 190, 'loss': 'mse', 'optimizer': 'adam', 'graph_mode': 'off', 'use_snp_selection': True, 'num_snps': 12356}. Best is trial 87 with value: 0.10100013413584537.
[I 2025-12-05 16:29:28,165] Trial 132 finished with value: 0.08187578887418408 and parameters: {'model_type': 'mlp', 'hidden_dims': '[512, 256]', 'dropout': 0.21303265095251828, 'batch_norm': True, 'lr': 0.0006232573269819225, 'weight_decay': 0.0007162342557468228, 'epochs': 286, 'loss': 'mse', 'optimizer': 'adam', 'graph_mode': 'off', 'use_snp_selection': True, 'num_snps': 8789}. Best is trial 87 with value: 0.10100013413584537.
[I 2025-12-05 16:29:29,325] Trial 133 finished with value: 0.07325859297995198 and parameters: {'model_type': 'mlp', 'hidden_dims': '[512, 256]', 'dropout': 0.21757229001948405, 'batch_norm': True, 'lr': 0.0006358570082838828, 'weight_decay': 0.000715231765189697, 'epochs': 278, 'loss': 'mse', 'optimizer': 'adam', 'graph_mode': 'off', 'use_snp_selection': True, 'num_snps': 9786}. Best is trial 87 with value: 0.10100013413584537.
[I 2025-12-05 16:29:30,331] Trial 134 finished with value: 0.0937461563501917 and parameters: {'model_type': 'mlp', 'hidden_dims': '[512, 256]', 'dropout': 0.19127782042628588, 'batch_norm': True, 'lr': 0.0008344684275922173, 'weight_decay': 0.0005930759864886055, 'epochs': 203, 'loss': 'mse', 'optimizer': 'adam', 'graph_mode': 'off', 'use_snp_selection': True, 'num_snps': 7139}. Best is trial 87 with value: 0.10100013413584537.
[I 2025-12-05 16:29:31,428] Trial 135 finished with value: 0.071543566257051 and parameters: {'model_type': 'mlp', 'hidden_dims': '[512, 256]', 'dropout': 0.19291606097044375, 'batch_norm': True, 'lr': 0.0008479222172195213, 'weight_decay': 0.0006012611381628022, 'epochs': 286, 'loss': 'mae', 'optimizer': 'adam', 'graph_mode': 'off', 'use_snp_selection': True, 'num_snps': 6632}. Best is trial 87 with value: 0.10100013413584537.
[I 2025-12-05 16:29:32,221] Trial 136 finished with value: 0.06673668547706622 and parameters: {'model_type': 'mlp', 'hidden_dims': '[512, 256]', 'dropout': 0.2085948959609814, 'batch_norm': True, 'lr': 0.0007820468909045616, 'weight_decay': 0.0008331383263504098, 'epochs': 40, 'loss': 'mse', 'optimizer': 'adam', 'graph_mode': 'off', 'use_snp_selection': True, 'num_snps': 7970}. Best is trial 87 with value: 0.10100013413584537.
[I 2025-12-05 16:29:33,090] Trial 137 finished with value: 0.05961945650152916 and parameters: {'model_type': 'mlp', 'hidden_dims': '[512, 256]', 'dropout': 0.16986525923809567, 'batch_norm': True, 'lr': 0.0009220419003154602, 'weight_decay': 0.0006570441299888922, 'epochs': 214, 'loss': 'mse', 'optimizer': 'adam', 'graph_mode': 'off', 'use_snp_selection': True, 'num_snps': 2419}. Best is trial 87 with value: 0.10100013413584537.
[I 2025-12-05 16:29:34,223] Trial 138 finished with value: 0.07911340281846363 and parameters: {'model_type': 'mlp', 'hidden_dims': '[256, 128, 64]', 'dropout': 0.20100042669309526, 'batch_norm': False, 'lr': 0.0006099819388627226, 'weight_decay': 0.00040916070946644457, 'epochs': 311, 'loss': 'mse', 'optimizer': 'adam', 'graph_mode': 'off', 'use_snp_selection': True, 'num_snps': 8657}. Best is trial 87 with value: 0.10100013413584537.
[I 2025-12-05 16:29:35,384] Trial 139 finished with value: 0.04507719005878808 and parameters: {'model_type': 'mlp', 'hidden_dims': '[256, 128, 64]', 'dropout': 0.3433464750755667, 'batch_norm': False, 'lr': 0.0006307267292605808, 'weight_decay': 0.00039029820581088165, 'epochs': 334, 'loss': 'mse', 'optimizer': 'adam', 'graph_mode': 'off', 'use_snp_selection': True, 'num_snps': 8662}. Best is trial 87 with value: 0.10100013413584537.
[I 2025-12-05 16:29:36,400] Trial 140 finished with value: 0.022199946229025262 and parameters: {'model_type': 'mlp', 'hidden_dims': '[256, 128, 64]', 'dropout': 0.18608941638079843, 'batch_norm': False, 'lr': 0.0004663305695584873, 'weight_decay': 0.00045065460456409094, 'epochs': 294, 'loss': 'mse', 'optimizer': 'adam', 'graph_mode': 'off', 'use_snp_selection': True, 'num_snps': 5232}. Best is trial 87 with value: 0.10100013413584537.
[I 2025-12-05 16:29:37,584] Trial 141 finished with value: 0.06264316189924171 and parameters: {'model_type': 'mlp', 'hidden_dims': '[256, 128, 64]', 'dropout': 0.21196409997761884, 'batch_norm': False, 'lr': 0.000592481787782866, 'weight_decay': 0.0007392978014633033, 'epochs': 313, 'loss': 'mse', 'optimizer': 'adam', 'graph_mode': 'off', 'use_snp_selection': True, 'num_snps': 10510}. Best is trial 87 with value: 0.10100013413584537.
[I 2025-12-05 16:29:38,868] Trial 142 finished with value: 0.061021657847330685 and parameters: {'model_type': 'mlp', 'hidden_dims': '[256, 128, 64]', 'dropout': 0.19986180411992968, 'batch_norm': False, 'lr': 0.0007385055523359374, 'weight_decay': 0.0005674235655439266, 'epochs': 326, 'loss': 'mse', 'optimizer': 'adam', 'graph_mode': 'off', 'use_snp_selection': True, 'num_snps': 13703}. Best is trial 87 with value: 0.10100013413584537.
[I 2025-12-05 16:29:40,219] Trial 143 finished with value: 0.05528566559846862 and parameters: {'model_type': 'mlp', 'hidden_dims': '[128, 64]', 'dropout': 0.2245469564385802, 'batch_norm': False, 'lr': 0.0009591838317976167, 'weight_decay': 0.0002637581068817258, 'epochs': 347, 'loss': 'mse', 'optimizer': 'adam', 'graph_mode': 'off', 'use_snp_selection': True, 'num_snps': 16987}. Best is trial 87 with value: 0.10100013413584537.
[I 2025-12-05 16:29:41,261] Trial 144 finished with value: 0.050455351633084296 and parameters: {'model_type': 'mlp', 'hidden_dims': '[512, 128]', 'dropout': 0.17730387985971674, 'batch_norm': True, 'lr': 0.0004245307422638863, 'weight_decay': 0.0008759624502577019, 'epochs': 315, 'loss': 'mse', 'optimizer': 'adam', 'graph_mode': 'off', 'use_snp_selection': True, 'num_snps': 3578}. Best is trial 87 with value: 0.10100013413584537.
[I 2025-12-05 16:29:42,344] Trial 145 finished with value: 0.07013607564435075 and parameters: {'model_type': 'mlp', 'hidden_dims': '[512, 256]', 'dropout': 0.1628730517611384, 'batch_norm': True, 'lr': 0.0006630788403848056, 'weight_decay': 0.0005063643009823269, 'epochs': 299, 'loss': 'mse', 'optimizer': 'adam', 'graph_mode': 'off', 'use_snp_selection': True, 'num_snps': 6102}. Best is trial 87 with value: 0.10100013413584537.
[I 2025-12-05 16:29:43,417] Trial 146 finished with value: 0.07210974870261126 and parameters: {'model_type': 'mlp', 'hidden_dims': '[256, 128, 64]', 'dropout': 0.49419614791922084, 'batch_norm': True, 'lr': 0.0008209813762802782, 'weight_decay': 0.0006781548200364177, 'epochs': 201, 'loss': 'mae', 'optimizer': 'adam', 'graph_mode': 'off', 'use_snp_selection': True, 'num_snps': 7901}. Best is trial 87 with value: 0.10100013413584537.
[I 2025-12-05 16:29:44,638] Trial 147 finished with value: 0.08160435351906904 and parameters: {'model_type': 'mlp', 'hidden_dims': '[512, 64]', 'dropout': 0.23459194622725865, 'batch_norm': True, 'lr': 0.0005819775820630779, 'weight_decay': 0.00040137143397416577, 'epochs': 304, 'loss': 'mse', 'optimizer': 'adam', 'graph_mode': 'off', 'use_snp_selection': True, 'num_snps': 10734}. Best is trial 87 with value: 0.10100013413584537.
[I 2025-12-05 16:29:45,853] Trial 148 finished with value: 0.06290338800867952 and parameters: {'model_type': 'mlp', 'hidden_dims': '[512, 64]', 'dropout': 0.24533281197676224, 'batch_norm': True, 'lr': 0.0005051461846088163, 'weight_decay': 0.00040342943863073624, 'epochs': 286, 'loss': 'mse', 'optimizer': 'adam', 'graph_mode': 'off', 'use_snp_selection': True, 'num_snps': 11388}. Best is trial 87 with value: 0.10100013413584537.
[I 2025-12-05 16:29:46,968] Trial 149 finished with value: 0.041390542267377005 and parameters: {'model_type': 'mlp', 'hidden_dims': '[512, 64]', 'dropout': 0.2304406690754518, 'batch_norm': False, 'lr': 7.255733357617499e-05, 'weight_decay': 0.000584717050421778, 'epochs': 327, 'loss': 'mse', 'optimizer': 'adam', 'graph_mode': 'off', 'use_snp_selection': True, 'num_snps': 9290}. Best is trial 87 with value: 0.10100013413584537.
[I 2025-12-05 16:30:02,249] Trial 0 finished with value: 0.00524628222154195 and parameters: {'model_type': 'mlp', 'hidden_dims': '[128, 64]', 'dropout': 0.199031432379812, 'batch_norm': True, 'lr': 1.8408544111075837e-06, 'weight_decay': 5.5136510071208614e-05, 'epochs': 336, 'loss': 'mae', 'optimizer': 'adam', 'graph_mode': 'off', 'use_snp_selection': True, 'num_snps': 43862}. Best is trial 0 with value: 0.00524628222154195.
[I 2025-12-05 16:30:03,268] Trial 1 finished with value: 0.05601106132042809 and parameters: {'model_type': 'mlp', 'hidden_dims': '[256, 128]', 'dropout': 0.4370668075331726, 'batch_norm': True, 'lr': 7.133471581159139e-05, 'weight_decay': 1.128633586803549e-05, 'epochs': 242, 'loss': 'mae', 'optimizer': 'adam', 'graph_mode': 'off', 'use_snp_selection': False}. Best is trial 1 with value: 0.05601106132042809.
[I 2025-12-05 16:30:04,225] Trial 2 finished with value: -0.020635355244769595 and parameters: {'model_type': 'mlp', 'hidden_dims': '[256, 128, 64]', 'dropout': 0.41314357415569625, 'batch_norm': False, 'lr': 3.952233718592101e-06, 'weight_decay': 0.00026754769258252603, 'epochs': 149, 'loss': 'mse', 'optimizer': 'adam', 'graph_mode': 'off', 'use_snp_selection': True, 'num_snps': 11571}. Best is trial 1 with value: 0.05601106132042809.
[I 2025-12-05 16:30:06,000] Trial 3 finished with value: 0.05865080435683864 and parameters: {'model_type': 'mlp', 'hidden_dims': '[512, 64]', 'dropout': 0.5938127374509361, 'batch_norm': False, 'lr': 5.67704586114731e-06, 'weight_decay': 2.4518087630137052e-05, 'epochs': 320, 'loss': 'mae', 'optimizer': 'adam', 'graph_mode': 'off', 'use_snp_selection': False}. Best is trial 3 with value: 0.05865080435683864.
[I 2025-12-05 16:30:08,108] Trial 4 finished with value: -0.031397416744015 and parameters: {'model_type': 'mlp', 'hidden_dims': '[512, 128]', 'dropout': 0.25746343592134413, 'batch_norm': True, 'lr': 1.3467657668402788e-06, 'weight_decay': 0.00033087251918647806, 'epochs': 277, 'loss': 'mse', 'optimizer': 'adam', 'graph_mode': 'off', 'use_snp_selection': True, 'num_snps': 36675}. Best is trial 3 with value: 0.05865080435683864.
[I 2025-12-05 16:30:09,803] Trial 5 finished with value: -0.0009060518835872715 and parameters: {'model_type': 'mlp', 'hidden_dims': '[512, 64]', 'dropout': 0.38275350994408375, 'batch_norm': True, 'lr': 1.5586664309232824e-06, 'weight_decay': 0.0008227664668621182, 'epochs': 145, 'loss': 'mae', 'optimizer': 'adam', 'graph_mode': 'off', 'use_snp_selection': True, 'num_snps': 32148}. Best is trial 3 with value: 0.05865080435683864.
[I 2025-12-05 16:30:10,727] Trial 6 finished with value: 0.0233192996265885 and parameters: {'model_type': 'mlp', 'hidden_dims': '[256, 128]', 'dropout': 0.3930109900265879, 'batch_norm': False, 'lr': 4.892964372128395e-05, 'weight_decay': 1.5809549317992182e-06, 'epochs': 199, 'loss': 'mse', 'optimizer': 'adam', 'graph_mode': 'off', 'use_snp_selection': False}. Best is trial 3 with value: 0.05865080435683864.
[I 2025-12-05 16:30:11,737] Trial 7 finished with value: 0.06164937790102422 and parameters: {'model_type': 'mlp', 'hidden_dims': '[512, 256]', 'dropout': 0.15343979219678458, 'batch_norm': True, 'lr': 6.234003099047341e-05, 'weight_decay': 3.894760610535477e-07, 'epochs': 97, 'loss': 'mse', 'optimizer': 'adam', 'graph_mode': 'off', 'use_snp_selection': False}. Best is trial 7 with value: 0.06164937790102422.
[I 2025-12-05 16:30:13,500] Trial 8 finished with value: 0.0546068332701407 and parameters: {'model_type': 'mlp', 'hidden_dims': '[512, 128]', 'dropout': 0.10743001231661406, 'batch_norm': True, 'lr': 0.00023728538449271062, 'weight_decay': 1.7629071578048637e-05, 'epochs': 312, 'loss': 'mae', 'optimizer': 'adam', 'graph_mode': 'off', 'use_snp_selection': False}. Best is trial 7 with value: 0.06164937790102422.
[I 2025-12-05 16:30:14,780] Trial 9 finished with value: 0.07418170351669094 and parameters: {'model_type': 'mlp', 'hidden_dims': '[512, 64]', 'dropout': 0.14505336736221927, 'batch_norm': True, 'lr': 5.8619638388111826e-05, 'weight_decay': 6.200156172669308e-07, 'epochs': 175, 'loss': 'mse', 'optimizer': 'adam', 'graph_mode': 'off', 'use_snp_selection': False}. Best is trial 9 with value: 0.07418170351669094.
[I 2025-12-05 16:30:15,607] Trial 10 finished with value: 0.02006984314265066 and parameters: {'model_type': 'mlp', 'hidden_dims': '[512, 64]', 'dropout': 0.27531666245262887, 'batch_norm': False, 'lr': 0.00032393778075602147, 'weight_decay': 1.1714031539166647e-07, 'epochs': 44, 'loss': 'mse', 'optimizer': 'adam', 'graph_mode': 'off', 'use_snp_selection': False}. Best is trial 9 with value: 0.07418170351669094.
[I 2025-12-05 16:30:16,520] Trial 11 finished with value: 0.00221650180745272 and parameters: {'model_type': 'mlp', 'hidden_dims': '[512, 256]', 'dropout': 0.10095648685224448, 'batch_norm': True, 'lr': 1.6474108386126448e-05, 'weight_decay': 6.203180869264506e-07, 'epochs': 67, 'loss': 'mse', 'optimizer': 'adam', 'graph_mode': 'off', 'use_snp_selection': False}. Best is trial 9 with value: 0.07418170351669094.
[I 2025-12-05 16:30:17,574] Trial 12 finished with value: 0.05633068453012802 and parameters: {'model_type': 'mlp', 'hidden_dims': '[512, 256]', 'dropout': 0.1977119287227368, 'batch_norm': True, 'lr': 0.000121041789182661, 'weight_decay': 1.2192432071058163e-06, 'epochs': 106, 'loss': 'mse', 'optimizer': 'adam', 'graph_mode': 'off', 'use_snp_selection': False}. Best is trial 9 with value: 0.07418170351669094.
[I 2025-12-05 16:30:18,890] Trial 13 finished with value: 0.06718873032234142 and parameters: {'model_type': 'mlp', 'hidden_dims': '[512, 256]', 'dropout': 0.17892004217860003, 'batch_norm': True, 'lr': 1.9472380101128875e-05, 'weight_decay': 1.1026057540153843e-07, 'epochs': 181, 'loss': 'mse', 'optimizer': 'adam', 'graph_mode': 'off', 'use_snp_selection': False}. Best is trial 9 with value: 0.07418170351669094.
[I 2025-12-05 16:30:19,675] Trial 14 finished with value: 0.01620148925036876 and parameters: {'model_type': 'mlp', 'hidden_dims': '[128, 64]', 'dropout': 0.2991507366346635, 'batch_norm': True, 'lr': 1.6188188667508504e-05, 'weight_decay': 1.0446702096786969e-07, 'epochs': 208, 'loss': 'mse', 'optimizer': 'adam', 'graph_mode': 'off', 'use_snp_selection': False}. Best is trial 9 with value: 0.07418170351669094.
[I 2025-12-05 16:30:20,576] Trial 15 finished with value: 0.04779301339678686 and parameters: {'model_type': 'mlp', 'hidden_dims': '[256, 128, 64]', 'dropout': 0.20322170229119665, 'batch_norm': True, 'lr': 1.89989485263331e-05, 'weight_decay': 3.2179532533076768e-06, 'epochs': 156, 'loss': 'mse', 'optimizer': 'adam', 'graph_mode': 'off', 'use_snp_selection': False}. Best is trial 9 with value: 0.07418170351669094.
[I 2025-12-05 16:30:22,098] Trial 16 finished with value: 0.05701376302819473 and parameters: {'model_type': 'mlp', 'hidden_dims': '[512, 256]', 'dropout': 0.3284774989350755, 'batch_norm': True, 'lr': 0.0006624584306992511, 'weight_decay': 2.6780688286274454e-07, 'epochs': 240, 'loss': 'mse', 'optimizer': 'adam', 'graph_mode': 'off', 'use_snp_selection': False}. Best is trial 9 with value: 0.07418170351669094.
[I 2025-12-05 16:30:23,371] Trial 17 finished with value: 0.01448564367506372 and parameters: {'model_type': 'mlp', 'hidden_dims': '[512, 64]', 'dropout': 0.49862004707204005, 'batch_norm': True, 'lr': 7.474904384339106e-06, 'weight_decay': 4.3593097945209165e-06, 'epochs': 170, 'loss': 'mse', 'optimizer': 'adam', 'graph_mode': 'off', 'use_snp_selection': False}. Best is trial 9 with value: 0.07418170351669094.
[I 2025-12-05 16:30:25,953] Trial 18 finished with value: 0.039114611129974636 and parameters: {'model_type': 'mlp', 'hidden_dims': '[512, 256]', 'dropout': 0.1555666123318153, 'batch_norm': False, 'lr': 2.797772152750264e-05, 'weight_decay': 2.427593612355222e-07, 'epochs': 110, 'loss': 'mse', 'optimizer': 'adam', 'graph_mode': 'off', 'use_snp_selection': True, 'num_snps': 58241}. Best is trial 9 with value: 0.07418170351669094.
[I 2025-12-05 16:30:27,503] Trial 19 finished with value: 0.05807623618578853 and parameters: {'model_type': 'mlp', 'hidden_dims': '[512, 64]', 'dropout': 0.23740597688310255, 'batch_norm': True, 'lr': 0.00014334793979738487, 'weight_decay': 6.422837333273952e-07, 'epochs': 237, 'loss': 'mse', 'optimizer': 'adam', 'graph_mode': 'off', 'use_snp_selection': False}. Best is trial 9 with value: 0.07418170351669094.
