[I 2025-12-05 20:15:39,459] Trial 111 finished with value: 0.26373071094533523 and parameters: {'model_type': 'mlp', 'hidden_dims': '[512, 256]', 'dropout': 0.5143542181838824, 'batch_norm': False, 'lr': 1.1998518370189917e-05, 'weight_decay': 1.447079903545308e-07, 'epochs': 190, 'loss': 'mae', 'optimizer': 'adam', 'graph_mode': 'off', 'use_snp_selection': False}. Best is trial 91 with value: 0.2747815494022535.
[I 2025-12-05 20:16:39,916] Trial 112 finished with value: 0.24684038637367864 and parameters: {'model_type': 'mlp', 'hidden_dims': '[512, 256]', 'dropout': 0.5000884652616837, 'batch_norm': False, 'lr': 1.3519118422132163e-06, 'weight_decay': 1.6479944570373863e-07, 'epochs': 197, 'loss': 'mae', 'optimizer': 'adam', 'graph_mode': 'off', 'use_snp_selection': False}. Best is trial 91 with value: 0.2747815494022535.
[I 2025-12-05 20:17:30,278] Trial 113 finished with value: 0.2561792625950803 and parameters: {'model_type': 'mlp', 'hidden_dims': '[512, 128]', 'dropout': 0.4883915485944408, 'batch_norm': False, 'lr': 1.6241716071468365e-05, 'weight_decay': 2.8849637648357403e-07, 'epochs': 161, 'loss': 'mae', 'optimizer': 'adam', 'graph_mode': 'off', 'use_snp_selection': False}. Best is trial 91 with value: 0.2747815494022535.
[I 2025-12-05 20:18:37,958] Trial 114 finished with value: 0.24971978449328977 and parameters: {'model_type': 'mlp', 'hidden_dims': '[512, 256]', 'dropout': 0.10156832919071063, 'batch_norm': False, 'lr': 3.2195252805214614e-05, 'weight_decay': 1.3511739738318795e-07, 'epochs': 228, 'loss': 'mae', 'optimizer': 'adam', 'graph_mode': 'off', 'use_snp_selection': False}. Best is trial 91 with value: 0.2747815494022535.
[I 2025-12-05 20:19:09,502] Trial 115 finished with value: 0.25793868494754285 and parameters: {'model_type': 'mlp', 'hidden_dims': '[256, 128]', 'dropout': 0.4458175753820544, 'batch_norm': False, 'lr': 2.5801892506978773e-05, 'weight_decay': 3.6117607161203895e-07, 'epochs': 184, 'loss': 'mae', 'optimizer': 'adam', 'graph_mode': 'off', 'use_snp_selection': False}. Best is trial 91 with value: 0.2747815494022535.
[I 2025-12-05 20:19:48,848] Trial 116 finished with value: 0.2568424931470345 and parameters: {'model_type': 'mlp', 'hidden_dims': '[512, 256]', 'dropout': 0.12390149806663875, 'batch_norm': False, 'lr': 3.169983013472412e-06, 'weight_decay': 4.5315965867295e-07, 'epochs': 118, 'loss': 'mae', 'optimizer': 'adam', 'graph_mode': 'off', 'use_snp_selection': False}. Best is trial 91 with value: 0.2747815494022535.
[I 2025-12-05 20:20:04,359] Trial 117 finished with value: 0.24053428151449152 and parameters: {'model_type': 'mlp', 'hidden_dims': '[128, 64]', 'dropout': 0.4693761565480455, 'batch_norm': False, 'lr': 5.6529597753267804e-06, 'weight_decay': 2.054708314817506e-07, 'epochs': 136, 'loss': 'mae', 'optimizer': 'adam', 'graph_mode': 'off', 'use_snp_selection': False}. Best is trial 91 with value: 0.2747815494022535.
[I 2025-12-05 20:20:20,397] Trial 118 finished with value: 0.23851521574265483 and parameters: {'model_type': 'mlp', 'hidden_dims': '[128, 64]', 'dropout': 0.48549780217820226, 'batch_norm': False, 'lr': 3.3664157229093e-05, 'weight_decay': 1.3918086237286396e-06, 'epochs': 145, 'loss': 'mse', 'optimizer': 'adam', 'graph_mode': 'off', 'use_snp_selection': False}. Best is trial 91 with value: 0.2747815494022535.
[I 2025-12-05 20:20:57,153] Trial 119 finished with value: 0.2567678009809821 and parameters: {'model_type': 'mlp', 'hidden_dims': '[512, 256]', 'dropout': 0.5204022215157325, 'batch_norm': False, 'lr': 8.9519571320932e-06, 'weight_decay': 2.7710581105121603e-07, 'epochs': 109, 'loss': 'mae', 'optimizer': 'adam', 'graph_mode': 'off', 'use_snp_selection': False}. Best is trial 91 with value: 0.2747815494022535.
[I 2025-12-05 20:21:38,382] Trial 120 finished with value: 0.26555271021903054 and parameters: {'model_type': 'mlp', 'hidden_dims': '[512, 64]', 'dropout': 0.5034942186477148, 'batch_norm': False, 'lr': 1.4225131526500191e-05, 'weight_decay': 1.6546049689501146e-07, 'epochs': 127, 'loss': 'mae', 'optimizer': 'adam', 'graph_mode': 'off', 'use_snp_selection': False}. Best is trial 91 with value: 0.2747815494022535.
[I 2025-12-05 20:22:19,419] Trial 121 finished with value: 0.24963314651988827 and parameters: {'model_type': 'mlp', 'hidden_dims': '[512, 64]', 'dropout': 0.5052596467865781, 'batch_norm': False, 'lr': 1.3518177039425885e-05, 'weight_decay': 1.618570571416076e-07, 'epochs': 126, 'loss': 'mae', 'optimizer': 'adam', 'graph_mode': 'off', 'use_snp_selection': False}. Best is trial 91 with value: 0.2747815494022535.
[I 2025-12-05 20:23:06,996] Trial 122 finished with value: 0.25740224107517334 and parameters: {'model_type': 'mlp', 'hidden_dims': '[512, 64]', 'dropout': 0.528272389902765, 'batch_norm': False, 'lr': 1.9335233468522222e-05, 'weight_decay': 1.1456747469208114e-07, 'epochs': 152, 'loss': 'mae', 'optimizer': 'adam', 'graph_mode': 'off', 'use_snp_selection': False}. Best is trial 91 with value: 0.2747815494022535.
[I 2025-12-05 20:23:40,294] Trial 123 finished with value: 0.26479192870307483 and parameters: {'model_type': 'mlp', 'hidden_dims': '[512, 64]', 'dropout': 0.5089143497618291, 'batch_norm': False, 'lr': 2.4322933233016928e-05, 'weight_decay': 1.3380512049723317e-05, 'epochs': 98, 'loss': 'mae', 'optimizer': 'adam', 'graph_mode': 'off', 'use_snp_selection': False}. Best is trial 91 with value: 0.2747815494022535.
[I 2025-12-05 20:24:13,904] Trial 124 finished with value: 0.262165700783474 and parameters: {'model_type': 'mlp', 'hidden_dims': '[512, 64]', 'dropout': 0.4807352092338453, 'batch_norm': False, 'lr': 2.5327063369212123e-05, 'weight_decay': 1.0233864987508146e-05, 'epochs': 99, 'loss': 'mae', 'optimizer': 'adam', 'graph_mode': 'off', 'use_snp_selection': False}. Best is trial 91 with value: 0.2747815494022535.
[I 2025-12-05 20:24:55,143] Trial 125 finished with value: 0.26739918128906864 and parameters: {'model_type': 'mlp', 'hidden_dims': '[512, 64]', 'dropout': 0.4666599995631381, 'batch_norm': False, 'lr': 1.6652566567435527e-05, 'weight_decay': 1.4748972255548311e-05, 'epochs': 127, 'loss': 'mae', 'optimizer': 'adam', 'graph_mode': 'off', 'use_snp_selection': False}. Best is trial 91 with value: 0.2747815494022535.
[I 2025-12-05 20:25:26,584] Trial 126 finished with value: 0.270116022985885 and parameters: {'model_type': 'mlp', 'hidden_dims': '[512, 64]', 'dropout': 0.4309120540527615, 'batch_norm': False, 'lr': 4.2020992094523274e-05, 'weight_decay': 1.4094824778136819e-05, 'epochs': 91, 'loss': 'mae', 'optimizer': 'adam', 'graph_mode': 'off', 'use_snp_selection': False}. Best is trial 91 with value: 0.2747815494022535.
[I 2025-12-05 20:25:58,023] Trial 127 finished with value: 0.25550329414720185 and parameters: {'model_type': 'mlp', 'hidden_dims': '[512, 64]', 'dropout': 0.39607987078436935, 'batch_norm': False, 'lr': 4.0090239589286674e-05, 'weight_decay': 1.6686982495304205e-05, 'epochs': 91, 'loss': 'mae', 'optimizer': 'adam', 'graph_mode': 'off', 'use_snp_selection': False}. Best is trial 91 with value: 0.2747815494022535.
[I 2025-12-05 20:26:28,177] Trial 128 finished with value: 0.24080839705169552 and parameters: {'model_type': 'mlp', 'hidden_dims': '[512, 64]', 'dropout': 0.4287850118451256, 'batch_norm': True, 'lr': 5.5865782703116067e-05, 'weight_decay': 1.4395064811442388e-05, 'epochs': 84, 'loss': 'mae', 'optimizer': 'adam', 'graph_mode': 'off', 'use_snp_selection': False}. Best is trial 91 with value: 0.2747815494022535.
[I 2025-12-05 20:27:00,494] Trial 129 finished with value: 0.26282755701358257 and parameters: {'model_type': 'mlp', 'hidden_dims': '[512, 64]', 'dropout': 0.4672176079220221, 'batch_norm': False, 'lr': 2.0772607918088645e-05, 'weight_decay': 2.3197823506361476e-05, 'epochs': 94, 'loss': 'mae', 'optimizer': 'adam', 'graph_mode': 'off', 'use_snp_selection': False}. Best is trial 91 with value: 0.2747815494022535.
[I 2025-12-05 20:27:29,413] Trial 130 finished with value: 0.2595294910409659 and parameters: {'model_type': 'mlp', 'hidden_dims': '[512, 64]', 'dropout': 0.4186845644355506, 'batch_norm': False, 'lr': 2.4207704971388547e-05, 'weight_decay': 8.360467537408465e-06, 'epochs': 81, 'loss': 'mae', 'optimizer': 'adam', 'graph_mode': 'off', 'use_snp_selection': False}. Best is trial 91 with value: 0.2747815494022535.
[I 2025-12-05 20:27:52,841] Trial 131 finished with value: 0.26228663110349737 and parameters: {'model_type': 'mlp', 'hidden_dims': '[512, 64]', 'dropout': 0.4534735838118093, 'batch_norm': False, 'lr': 1.6755897775682997e-05, 'weight_decay': 2.725060748058721e-05, 'epochs': 60, 'loss': 'mae', 'optimizer': 'adam', 'graph_mode': 'off', 'use_snp_selection': False}. Best is trial 91 with value: 0.2747815494022535.
[I 2025-12-05 20:28:31,021] Trial 132 finished with value: 0.26320851435666504 and parameters: {'model_type': 'mlp', 'hidden_dims': '[512, 64]', 'dropout': 0.4435359965363857, 'batch_norm': False, 'lr': 1.165622360838809e-05, 'weight_decay': 1.5770859807037725e-05, 'epochs': 115, 'loss': 'mae', 'optimizer': 'adam', 'graph_mode': 'off', 'use_snp_selection': False}. Best is trial 91 with value: 0.2747815494022535.
[I 2025-12-05 20:28:56,806] Trial 133 finished with value: 0.24961725167812254 and parameters: {'model_type': 'mlp', 'hidden_dims': '[512, 64]', 'dropout': 0.49144268970485466, 'batch_norm': False, 'lr': 1.8108564929550487e-05, 'weight_decay': 1.1772408848079288e-05, 'epochs': 69, 'loss': 'mae', 'optimizer': 'adam', 'graph_mode': 'off', 'use_snp_selection': False}. Best is trial 91 with value: 0.2747815494022535.
[I 2025-12-05 20:29:32,197] Trial 134 finished with value: 0.24401456695589277 and parameters: {'model_type': 'mlp', 'hidden_dims': '[512, 64]', 'dropout': 0.434238497280701, 'batch_norm': False, 'lr': 1.5210382283257479e-05, 'weight_decay': 7.944732724383543e-06, 'epochs': 105, 'loss': 'mae', 'optimizer': 'adam', 'graph_mode': 'off', 'use_snp_selection': False}. Best is trial 91 with value: 0.2747815494022535.
[I 2025-12-05 20:30:25,150] Trial 135 finished with value: 0.2554561071979303 and parameters: {'model_type': 'mlp', 'hidden_dims': '[512, 64]', 'dropout': 0.4591792213961318, 'batch_norm': False, 'lr': 3.1700527047419296e-05, 'weight_decay': 6.234377214876907e-06, 'epochs': 173, 'loss': 'mae', 'optimizer': 'adam', 'graph_mode': 'off', 'use_snp_selection': False}. Best is trial 91 with value: 0.2747815494022535.
[I 2025-12-05 20:30:44,387] Trial 136 finished with value: 0.25238228018868847 and parameters: {'model_type': 'mlp', 'hidden_dims': '[512, 64]', 'dropout': 0.40918264947518485, 'batch_norm': False, 'lr': 8.281006794516881e-06, 'weight_decay': 1.9888976820066884e-05, 'epochs': 44, 'loss': 'mae', 'optimizer': 'adam', 'graph_mode': 'off', 'use_snp_selection': False}. Best is trial 91 with value: 0.2747815494022535.
[I 2025-12-05 20:31:28,003] Trial 137 finished with value: 0.2637153733869961 and parameters: {'model_type': 'mlp', 'hidden_dims': '[512, 64]', 'dropout': 0.47245470264808276, 'batch_norm': False, 'lr': 2.205209317436512e-05, 'weight_decay': 1.3393077339826958e-05, 'epochs': 137, 'loss': 'mae', 'optimizer': 'adam', 'graph_mode': 'off', 'use_snp_selection': False}. Best is trial 91 with value: 0.2747815494022535.
[I 2025-12-05 20:31:52,147] Trial 138 finished with value: 0.26043228582428657 and parameters: {'model_type': 'mlp', 'hidden_dims': '[256, 128]', 'dropout': 0.4782437113066435, 'batch_norm': False, 'lr': 3.943004335849722e-05, 'weight_decay': 1.847808697823352e-07, 'epochs': 131, 'loss': 'mae', 'optimizer': 'adam', 'graph_mode': 'off', 'use_snp_selection': False}. Best is trial 91 with value: 0.2747815494022535.
[I 2025-12-05 20:32:41,377] Trial 139 finished with value: 0.2376444042676403 and parameters: {'model_type': 'mlp', 'hidden_dims': '[512, 64]', 'dropout': 0.5132223348554636, 'batch_norm': False, 'lr': 1.9892275693181726e-05, 'weight_decay': 3.382032445727547e-05, 'epochs': 158, 'loss': 'mse', 'optimizer': 'adam', 'graph_mode': 'off', 'use_snp_selection': False}. Best is trial 91 with value: 0.2747815494022535.
[I 2025-12-05 20:33:08,347] Trial 140 finished with value: 0.276079263167137 and parameters: {'model_type': 'mlp', 'hidden_dims': '[512, 128]', 'dropout': 0.4924282944620625, 'batch_norm': False, 'lr': 1.3647717011857641e-05, 'weight_decay': 9.669007411980968e-06, 'epochs': 73, 'loss': 'mae', 'optimizer': 'adam', 'graph_mode': 'off', 'use_snp_selection': False}. Best is trial 140 with value: 0.276079263167137.
[I 2025-12-05 20:33:38,688] Trial 141 finished with value: 0.25714009461146214 and parameters: {'model_type': 'mlp', 'hidden_dims': '[512, 64]', 'dropout': 0.49614982103911587, 'batch_norm': False, 'lr': 1.3019438932908597e-05, 'weight_decay': 1.796153187593907e-05, 'epochs': 86, 'loss': 'mae', 'optimizer': 'adam', 'graph_mode': 'off', 'use_snp_selection': False}. Best is trial 140 with value: 0.276079263167137.
[I 2025-12-05 20:34:30,795] Trial 142 finished with value: 0.2685050897352659 and parameters: {'model_type': 'mlp', 'hidden_dims': '[512, 128]', 'dropout': 0.4860243899897442, 'batch_norm': False, 'lr': 7.165976432610679e-06, 'weight_decay': 1.0477935505885534e-05, 'epochs': 166, 'loss': 'mae', 'optimizer': 'adam', 'graph_mode': 'off', 'use_snp_selection': False}. Best is trial 140 with value: 0.276079263167137.
[I 2025-12-05 20:35:22,498] Trial 143 finished with value: 0.26244477452393944 and parameters: {'model_type': 'mlp', 'hidden_dims': '[512, 128]', 'dropout': 0.48991322273980387, 'batch_norm': False, 'lr': 1.1028148709171806e-05, 'weight_decay': 2.5941677404786413e-05, 'epochs': 165, 'loss': 'mae', 'optimizer': 'adam', 'graph_mode': 'off', 'use_snp_selection': False}. Best is trial 140 with value: 0.276079263167137.
[I 2025-12-05 20:35:48,656] Trial 144 finished with value: 0.25516742798671194 and parameters: {'model_type': 'mlp', 'hidden_dims': '[512, 128]', 'dropout': 0.4654306667806989, 'batch_norm': False, 'lr': 1.767778412507449e-05, 'weight_decay': 1.0611842915503327e-05, 'epochs': 70, 'loss': 'mae', 'optimizer': 'adam', 'graph_mode': 'off', 'use_snp_selection': False}. Best is trial 140 with value: 0.276079263167137.
[I 2025-12-05 20:36:35,509] Trial 145 finished with value: 0.2612896130639628 and parameters: {'model_type': 'mlp', 'hidden_dims': '[512, 128]', 'dropout': 0.5070514015979789, 'batch_norm': False, 'lr': 9.610109456440305e-06, 'weight_decay': 9.242561356218663e-06, 'epochs': 147, 'loss': 'mae', 'optimizer': 'adam', 'graph_mode': 'off', 'use_snp_selection': False}. Best is trial 140 with value: 0.276079263167137.
[I 2025-12-05 20:37:02,815] Trial 146 finished with value: 0.253575765307859 and parameters: {'model_type': 'mlp', 'hidden_dims': '[512, 128]', 'dropout': 0.5241693497740384, 'batch_norm': False, 'lr': 1.48321461522826e-05, 'weight_decay': 4.469462481943863e-05, 'epochs': 74, 'loss': 'mae', 'optimizer': 'adam', 'graph_mode': 'off', 'use_snp_selection': False}. Best is trial 140 with value: 0.276079263167137.
[I 2025-12-05 20:37:36,544] Trial 147 finished with value: 0.24488724650779284 and parameters: {'model_type': 'mlp', 'hidden_dims': '[512, 128]', 'dropout': 0.4533035818014159, 'batch_norm': False, 'lr': 2.5506130591022546e-05, 'weight_decay': 2.2541430078128428e-07, 'epochs': 99, 'loss': 'mae', 'optimizer': 'adam', 'graph_mode': 'off', 'use_snp_selection': False}. Best is trial 140 with value: 0.276079263167137.
[I 2025-12-05 20:38:24,476] Trial 148 finished with value: 0.2539276382861798 and parameters: {'model_type': 'mlp', 'hidden_dims': '[512, 128]', 'dropout': 0.43908222201714847, 'batch_norm': False, 'lr': 2.975419702886771e-05, 'weight_decay': 1.3004629804130654e-05, 'epochs': 153, 'loss': 'mae', 'optimizer': 'adam', 'graph_mode': 'off', 'use_snp_selection': False}. Best is trial 140 with value: 0.276079263167137.
[I 2025-12-05 20:38:46,383] Trial 149 finished with value: 0.19051623532869055 and parameters: {'model_type': 'mlp', 'hidden_dims': '[512, 128]', 'dropout': 0.5373046131287242, 'batch_norm': True, 'lr': 4.710563128596144e-06, 'weight_decay': 7.199250953802734e-06, 'epochs': 53, 'loss': 'mae', 'optimizer': 'adam', 'graph_mode': 'off', 'use_snp_selection': False}. Best is trial 140 with value: 0.276079263167137.
[I 2025-12-05 20:39:51,628] Trial 0 finished with value: 0.17952345910920903 and parameters: {'model_type': 'mlp', 'hidden_dims': '[128, 64]', 'dropout': 0.199031432379812, 'batch_norm': True, 'lr': 1.8408544111075837e-06, 'weight_decay': 5.5136510071208614e-05, 'epochs': 336, 'loss': 'mae', 'optimizer': 'adam', 'graph_mode': 'off', 'use_snp_selection': True, 'num_snps': 43862}. Best is trial 0 with value: 0.17952345910920903.
[I 2025-12-05 20:40:32,602] Trial 1 finished with value: 0.21807767694084776 and parameters: {'model_type': 'mlp', 'hidden_dims': '[256, 128]', 'dropout': 0.4370668075331726, 'batch_norm': True, 'lr': 7.133471581159139e-05, 'weight_decay': 1.128633586803549e-05, 'epochs': 242, 'loss': 'mae', 'optimizer': 'adam', 'graph_mode': 'off', 'use_snp_selection': False}. Best is trial 1 with value: 0.21807767694084776.
[I 2025-12-05 20:41:10,049] Trial 2 finished with value: 0.23415178514826418 and parameters: {'model_type': 'mlp', 'hidden_dims': '[256, 128, 64]', 'dropout': 0.41314357415569625, 'batch_norm': False, 'lr': 3.952233718592101e-06, 'weight_decay': 0.00026754769258252603, 'epochs': 149, 'loss': 'mse', 'optimizer': 'adam', 'graph_mode': 'off', 'use_snp_selection': True, 'num_snps': 11571}. Best is trial 2 with value: 0.23415178514826418.
[I 2025-12-05 20:42:45,341] Trial 3 finished with value: 0.23417311437131733 and parameters: {'model_type': 'mlp', 'hidden_dims': '[512, 64]', 'dropout': 0.5938127374509361, 'batch_norm': False, 'lr': 5.67704586114731e-06, 'weight_decay': 2.4518087630137052e-05, 'epochs': 320, 'loss': 'mae', 'optimizer': 'adam', 'graph_mode': 'off', 'use_snp_selection': False}. Best is trial 3 with value: 0.23417311437131733.
[I 2025-12-05 20:44:11,592] Trial 4 finished with value: 0.15209044672877114 and parameters: {'model_type': 'mlp', 'hidden_dims': '[512, 128]', 'dropout': 0.25746343592134413, 'batch_norm': True, 'lr': 1.3467657668402788e-06, 'weight_decay': 0.00033087251918647806, 'epochs': 277, 'loss': 'mse', 'optimizer': 'adam', 'graph_mode': 'off', 'use_snp_selection': True, 'num_snps': 36675}. Best is trial 3 with value: 0.23417311437131733.
[I 2025-12-05 20:45:11,920] Trial 5 finished with value: 0.17585749189917743 and parameters: {'model_type': 'mlp', 'hidden_dims': '[512, 64]', 'dropout': 0.38275350994408375, 'batch_norm': True, 'lr': 1.5586664309232824e-06, 'weight_decay': 0.0008227664668621182, 'epochs': 145, 'loss': 'mae', 'optimizer': 'adam', 'graph_mode': 'off', 'use_snp_selection': True, 'num_snps': 32148}. Best is trial 3 with value: 0.23417311437131733.
[I 2025-12-05 20:45:45,826] Trial 6 finished with value: 0.2130904076507068 and parameters: {'model_type': 'mlp', 'hidden_dims': '[256, 128]', 'dropout': 0.3930109900265879, 'batch_norm': False, 'lr': 4.892964372128395e-05, 'weight_decay': 1.5809549317992182e-06, 'epochs': 199, 'loss': 'mse', 'optimizer': 'adam', 'graph_mode': 'off', 'use_snp_selection': False}. Best is trial 3 with value: 0.23417311437131733.
[I 2025-12-05 20:46:20,523] Trial 7 finished with value: 0.21281106457762622 and parameters: {'model_type': 'mlp', 'hidden_dims': '[512, 256]', 'dropout': 0.15343979219678458, 'batch_norm': True, 'lr': 6.234003099047341e-05, 'weight_decay': 3.894760610535477e-07, 'epochs': 97, 'loss': 'mse', 'optimizer': 'adam', 'graph_mode': 'off', 'use_snp_selection': False}. Best is trial 3 with value: 0.23417311437131733.
[I 2025-12-05 20:47:55,386] Trial 8 finished with value: 0.22777743172438075 and parameters: {'model_type': 'mlp', 'hidden_dims': '[512, 128]', 'dropout': 0.10743001231661406, 'batch_norm': True, 'lr': 0.00023728538449271062, 'weight_decay': 1.7629071578048637e-05, 'epochs': 312, 'loss': 'mae', 'optimizer': 'adam', 'graph_mode': 'off', 'use_snp_selection': False}. Best is trial 3 with value: 0.23417311437131733.
[I 2025-12-05 20:48:51,880] Trial 9 finished with value: 0.21925837537609744 and parameters: {'model_type': 'mlp', 'hidden_dims': '[512, 64]', 'dropout': 0.14505336736221927, 'batch_norm': True, 'lr': 5.8619638388111826e-05, 'weight_decay': 6.200156172669308e-07, 'epochs': 175, 'loss': 'mse', 'optimizer': 'adam', 'graph_mode': 'off', 'use_snp_selection': False}. Best is trial 3 with value: 0.23417311437131733.
[I 2025-12-05 20:49:14,650] Trial 10 finished with value: 0.22052741296273726 and parameters: {'model_type': 'mlp', 'hidden_dims': '[512, 64]', 'dropout': 0.5885461262002587, 'batch_norm': False, 'lr': 8.769366258768696e-06, 'weight_decay': 2.78273193871783e-06, 'epochs': 55, 'loss': 'mae', 'optimizer': 'adam', 'graph_mode': 'off', 'use_snp_selection': False}. Best is trial 3 with value: 0.23417311437131733.
[I 2025-12-05 20:49:49,100] Trial 11 finished with value: 0.2055442136681334 and parameters: {'model_type': 'mlp', 'hidden_dims': '[256, 128, 64]', 'dropout': 0.5856267066773996, 'batch_norm': False, 'lr': 8.596969843802065e-06, 'weight_decay': 7.644279067619585e-05, 'epochs': 222, 'loss': 'mse', 'optimizer': 'adam', 'graph_mode': 'off', 'use_snp_selection': True, 'num_snps': 5419}. Best is trial 3 with value: 0.23417311437131733.
[I 2025-12-05 20:50:23,623] Trial 12 finished with value: 0.1965552445707229 and parameters: {'model_type': 'mlp', 'hidden_dims': '[256, 128, 64]', 'dropout': 0.49541318006391155, 'batch_norm': False, 'lr': 8.040010782675621e-06, 'weight_decay': 0.00012297995556334715, 'epochs': 147, 'loss': 'mae', 'optimizer': 'adam', 'graph_mode': 'off', 'use_snp_selection': True, 'num_snps': 7003}. Best is trial 3 with value: 0.23417311437131733.
