[I 2025-12-05 14:52:31,870] Trial 77 finished with value: 0.1408744428579322 and parameters: {'model_type': 'mlp', 'hidden_dims': '[512, 128]', 'dropout': 0.20986635104020757, 'batch_norm': True, 'lr': 0.00012251131965024335, 'weight_decay': 8.621888597075459e-05, 'epochs': 129, 'loss': 'mse', 'optimizer': 'adam', 'graph_mode': 'off', 'use_snp_selection': False}. Best is trial 45 with value: 0.14826626548093985.
[I 2025-12-05 14:52:32,699] Trial 78 finished with value: 0.12065250546921795 and parameters: {'model_type': 'mlp', 'hidden_dims': '[512, 128]', 'dropout': 0.22476028865405642, 'batch_norm': True, 'lr': 0.00011278407827903048, 'weight_decay': 7.737129458267858e-05, 'epochs': 124, 'loss': 'mse', 'optimizer': 'adam', 'graph_mode': 'off', 'use_snp_selection': True, 'num_snps': 2246}. Best is trial 45 with value: 0.14826626548093985.
[I 2025-12-05 14:52:34,779] Trial 79 finished with value: 0.1427516252104305 and parameters: {'model_type': 'mlp', 'hidden_dims': '[512, 128]', 'dropout': 0.20694381720069113, 'batch_norm': True, 'lr': 0.0001704960699975901, 'weight_decay': 4.914747556759611e-05, 'epochs': 275, 'loss': 'mse', 'optimizer': 'adam', 'graph_mode': 'off', 'use_snp_selection': False}. Best is trial 45 with value: 0.14826626548093985.
[I 2025-12-05 14:52:36,863] Trial 80 finished with value: 0.13403728261229378 and parameters: {'model_type': 'mlp', 'hidden_dims': '[512, 128]', 'dropout': 0.1776643231222041, 'batch_norm': True, 'lr': 0.00017335906538521495, 'weight_decay': 0.0001310527559860609, 'epochs': 276, 'loss': 'mse', 'optimizer': 'adam', 'graph_mode': 'off', 'use_snp_selection': False}. Best is trial 45 with value: 0.14826626548093985.
[I 2025-12-05 14:52:38,826] Trial 81 finished with value: 0.13591264898824046 and parameters: {'model_type': 'mlp', 'hidden_dims': '[512, 128]', 'dropout': 0.20393333540442263, 'batch_norm': True, 'lr': 0.00013069712412674603, 'weight_decay': 4.5465027932564484e-05, 'epochs': 258, 'loss': 'mse', 'optimizer': 'adam', 'graph_mode': 'off', 'use_snp_selection': False}. Best is trial 45 with value: 0.14826626548093985.
[I 2025-12-05 14:52:40,835] Trial 82 finished with value: 0.1315432718772377 and parameters: {'model_type': 'mlp', 'hidden_dims': '[512, 128]', 'dropout': 0.21381514511843702, 'batch_norm': True, 'lr': 0.00018730127354694997, 'weight_decay': 8.746994124389108e-05, 'epochs': 267, 'loss': 'mse', 'optimizer': 'adam', 'graph_mode': 'off', 'use_snp_selection': False}. Best is trial 45 with value: 0.14826626548093985.
[I 2025-12-05 14:52:42,706] Trial 83 finished with value: 0.13524689522401367 and parameters: {'model_type': 'mlp', 'hidden_dims': '[512, 128]', 'dropout': 0.2381447424138987, 'batch_norm': True, 'lr': 0.00027012602621884636, 'weight_decay': 5.810028776897622e-05, 'epochs': 236, 'loss': 'mse', 'optimizer': 'adam', 'graph_mode': 'off', 'use_snp_selection': False}. Best is trial 45 with value: 0.14826626548093985.
[I 2025-12-05 14:52:44,368] Trial 84 finished with value: 0.14204621930265254 and parameters: {'model_type': 'mlp', 'hidden_dims': '[512, 128]', 'dropout': 0.26960873849067973, 'batch_norm': True, 'lr': 0.0002127487817301394, 'weight_decay': 3.3158594255628216e-05, 'epochs': 194, 'loss': 'mse', 'optimizer': 'adam', 'graph_mode': 'off', 'use_snp_selection': False}. Best is trial 45 with value: 0.14826626548093985.
[I 2025-12-05 14:52:46,095] Trial 85 finished with value: 0.14355811320024756 and parameters: {'model_type': 'mlp', 'hidden_dims': '[512, 128]', 'dropout': 0.26486699019784166, 'batch_norm': True, 'lr': 0.0005067107908522294, 'weight_decay': 2.8817266708215357e-05, 'epochs': 201, 'loss': 'mse', 'optimizer': 'adam', 'graph_mode': 'off', 'use_snp_selection': False}. Best is trial 45 with value: 0.14826626548093985.
[I 2025-12-05 14:52:47,737] Trial 86 finished with value: 0.08701985828614951 and parameters: {'model_type': 'mlp', 'hidden_dims': '[512, 128]', 'dropout': 0.26417838924749376, 'batch_norm': False, 'lr': 0.0006473479516435, 'weight_decay': 1.8926259378232252e-05, 'epochs': 193, 'loss': 'mse', 'optimizer': 'adam', 'graph_mode': 'off', 'use_snp_selection': False}. Best is trial 45 with value: 0.14826626548093985.
[I 2025-12-05 14:52:49,550] Trial 87 finished with value: 0.1348019994394509 and parameters: {'model_type': 'mlp', 'hidden_dims': '[512, 256]', 'dropout': 0.30779382142426553, 'batch_norm': True, 'lr': 0.0002190750566858635, 'weight_decay': 2.5164126776570322e-05, 'epochs': 218, 'loss': 'mse', 'optimizer': 'adam', 'graph_mode': 'off', 'use_snp_selection': False}. Best is trial 45 with value: 0.14826626548093985.
[I 2025-12-05 14:52:51,193] Trial 88 finished with value: 0.08611701288918944 and parameters: {'model_type': 'mlp', 'hidden_dims': '[512, 128]', 'dropout': 0.19225416164160036, 'batch_norm': True, 'lr': 7.713892775275903e-06, 'weight_decay': 3.108533112117874e-05, 'epochs': 178, 'loss': 'mse', 'optimizer': 'adam', 'graph_mode': 'off', 'use_snp_selection': False}. Best is trial 45 with value: 0.14826626548093985.
[I 2025-12-05 14:52:54,119] Trial 89 finished with value: 0.1276700114509876 and parameters: {'model_type': 'mlp', 'hidden_dims': '[512, 128]', 'dropout': 0.25219816799553957, 'batch_norm': True, 'lr': 0.000155716709833543, 'weight_decay': 4.870420032384804e-05, 'epochs': 245, 'loss': 'mse', 'optimizer': 'adam', 'graph_mode': 'off', 'use_snp_selection': True, 'num_snps': 45058}. Best is trial 45 with value: 0.14826626548093985.
[I 2025-12-05 14:52:55,282] Trial 90 finished with value: 0.126034002244617 and parameters: {'model_type': 'mlp', 'hidden_dims': '[256, 128, 64]', 'dropout': 0.23036184300685525, 'batch_norm': True, 'lr': 0.0004927857435993437, 'weight_decay': 3.5197982447839846e-05, 'epochs': 186, 'loss': 'mse', 'optimizer': 'adam', 'graph_mode': 'off', 'use_snp_selection': False}. Best is trial 45 with value: 0.14826626548093985.
[I 2025-12-05 14:52:57,045] Trial 91 finished with value: 0.13381267971769886 and parameters: {'model_type': 'mlp', 'hidden_dims': '[512, 128]', 'dropout': 0.29161329838316546, 'batch_norm': True, 'lr': 0.0009713799791431543, 'weight_decay': 0.00016510388996812916, 'epochs': 202, 'loss': 'mse', 'optimizer': 'adam', 'graph_mode': 'off', 'use_snp_selection': False}. Best is trial 45 with value: 0.14826626548093985.
[I 2025-12-05 14:52:58,905] Trial 92 finished with value: 0.1331777860554776 and parameters: {'model_type': 'mlp', 'hidden_dims': '[512, 128]', 'dropout': 0.2738023019382253, 'batch_norm': True, 'lr': 0.00034108027080789836, 'weight_decay': 5.389272665450549e-05, 'epochs': 234, 'loss': 'mse', 'optimizer': 'adam', 'graph_mode': 'off', 'use_snp_selection': False}. Best is trial 45 with value: 0.14826626548093985.
[I 2025-12-05 14:53:00,712] Trial 93 finished with value: 0.14235233346010323 and parameters: {'model_type': 'mlp', 'hidden_dims': '[512, 128]', 'dropout': 0.25938079163902733, 'batch_norm': True, 'lr': 0.00024785122313994884, 'weight_decay': 0.00012469719514556928, 'epochs': 213, 'loss': 'mse', 'optimizer': 'adam', 'graph_mode': 'off', 'use_snp_selection': False}. Best is trial 45 with value: 0.14826626548093985.
[I 2025-12-05 14:53:02,512] Trial 94 finished with value: 0.13091551039043298 and parameters: {'model_type': 'mlp', 'hidden_dims': '[512, 128]', 'dropout': 0.26252738111115187, 'batch_norm': True, 'lr': 0.00025849324240549243, 'weight_decay': 0.00012625131420089037, 'epochs': 213, 'loss': 'mse', 'optimizer': 'adam', 'graph_mode': 'off', 'use_snp_selection': False}. Best is trial 45 with value: 0.14826626548093985.
[I 2025-12-05 14:53:03,740] Trial 95 finished with value: 0.14028864033690172 and parameters: {'model_type': 'mlp', 'hidden_dims': '[256, 128]', 'dropout': 0.24302679759831272, 'batch_norm': True, 'lr': 0.00021111790206797466, 'weight_decay': 0.00022813938722985298, 'epochs': 223, 'loss': 'mse', 'optimizer': 'adam', 'graph_mode': 'off', 'use_snp_selection': False}. Best is trial 45 with value: 0.14826626548093985.
[I 2025-12-05 14:53:05,883] Trial 96 finished with value: 0.13749828578301493 and parameters: {'model_type': 'mlp', 'hidden_dims': '[512, 128]', 'dropout': 0.23260414565013882, 'batch_norm': True, 'lr': 0.00015977698255881633, 'weight_decay': 6.294449740431874e-06, 'epochs': 285, 'loss': 'mse', 'optimizer': 'adam', 'graph_mode': 'off', 'use_snp_selection': False}. Best is trial 45 with value: 0.14826626548093985.
[I 2025-12-05 14:53:07,849] Trial 97 finished with value: 0.13074338234827917 and parameters: {'model_type': 'mlp', 'hidden_dims': '[512, 64]', 'dropout': 0.22124359215628173, 'batch_norm': True, 'lr': 0.00037590645329464717, 'weight_decay': 1.5153081635705315e-05, 'epochs': 254, 'loss': 'mse', 'optimizer': 'adam', 'graph_mode': 'off', 'use_snp_selection': False}. Best is trial 45 with value: 0.14826626548093985.
[I 2025-12-05 14:53:09,564] Trial 98 finished with value: 0.14648529332885382 and parameters: {'model_type': 'mlp', 'hidden_dims': '[512, 128]', 'dropout': 0.252800522557422, 'batch_norm': True, 'lr': 0.00010063162354930608, 'weight_decay': 7.145492688228475e-05, 'epochs': 193, 'loss': 'mse', 'optimizer': 'adam', 'graph_mode': 'off', 'use_snp_selection': False}. Best is trial 45 with value: 0.14826626548093985.
[I 2025-12-05 14:53:11,239] Trial 99 finished with value: 0.13335232372677408 and parameters: {'model_type': 'mlp', 'hidden_dims': '[512, 128]', 'dropout': 0.26863102557695784, 'batch_norm': True, 'lr': 0.000107683511733507, 'weight_decay': 7.016691715996257e-05, 'epochs': 195, 'loss': 'mse', 'optimizer': 'adam', 'graph_mode': 'off', 'use_snp_selection': False}. Best is trial 45 with value: 0.14826626548093985.
[I 2025-12-05 14:53:13,154] Trial 100 finished with value: 0.1284795488566457 and parameters: {'model_type': 'mlp', 'hidden_dims': '[512, 128]', 'dropout': 0.3035531968589361, 'batch_norm': False, 'lr': 2.020149046799501e-05, 'weight_decay': 0.00010547562101885552, 'epochs': 240, 'loss': 'mse', 'optimizer': 'adam', 'graph_mode': 'off', 'use_snp_selection': False}. Best is trial 45 with value: 0.14826626548093985.
[I 2025-12-05 14:53:14,709] Trial 101 finished with value: 0.11241116158880121 and parameters: {'model_type': 'mlp', 'hidden_dims': '[512, 128]', 'dropout': 0.24696649745466442, 'batch_norm': True, 'lr': 8.00157975693993e-05, 'weight_decay': 0.00014594961049194832, 'epochs': 162, 'loss': 'mse', 'optimizer': 'adam', 'graph_mode': 'off', 'use_snp_selection': False}. Best is trial 45 with value: 0.14826626548093985.
[I 2025-12-05 14:53:15,572] Trial 102 finished with value: 0.12043392566652263 and parameters: {'model_type': 'mlp', 'hidden_dims': '[128, 64]', 'dropout': 0.28144627113698384, 'batch_norm': True, 'lr': 9.522984908438821e-05, 'weight_decay': 6.029209475902778e-05, 'epochs': 189, 'loss': 'mse', 'optimizer': 'adam', 'graph_mode': 'off', 'use_snp_selection': False}. Best is trial 45 with value: 0.14826626548093985.
[I 2025-12-05 14:53:17,219] Trial 103 finished with value: 0.14583163032503169 and parameters: {'model_type': 'mlp', 'hidden_dims': '[512, 128]', 'dropout': 0.26087399310364406, 'batch_norm': True, 'lr': 0.00014020409454252602, 'weight_decay': 2.978481876346197e-05, 'epochs': 178, 'loss': 'mse', 'optimizer': 'adam', 'graph_mode': 'off', 'use_snp_selection': False}. Best is trial 45 with value: 0.14826626548093985.
[I 2025-12-05 14:53:18,705] Trial 104 finished with value: 0.12989880183235397 and parameters: {'model_type': 'mlp', 'hidden_dims': '[512, 128]', 'dropout': 0.26600252367825683, 'batch_norm': True, 'lr': 0.00014374397880837715, 'weight_decay': 2.7869197917202667e-05, 'epochs': 147, 'loss': 'mse', 'optimizer': 'adam', 'graph_mode': 'off', 'use_snp_selection': False}. Best is trial 45 with value: 0.14826626548093985.
[I 2025-12-05 14:53:20,345] Trial 105 finished with value: 0.1274710912737751 and parameters: {'model_type': 'mlp', 'hidden_dims': '[512, 128]', 'dropout': 0.25882643133752437, 'batch_norm': True, 'lr': 0.000241016324795838, 'weight_decay': 2.1937808447214664e-05, 'epochs': 179, 'loss': 'mse', 'optimizer': 'adam', 'graph_mode': 'off', 'use_snp_selection': False}. Best is trial 45 with value: 0.14826626548093985.
[I 2025-12-05 14:53:21,967] Trial 106 finished with value: 0.13311470806617398 and parameters: {'model_type': 'mlp', 'hidden_dims': '[512, 128]', 'dropout': 0.15228180213640896, 'batch_norm': True, 'lr': 0.00020616822603686661, 'weight_decay': 1.0977323258110685e-05, 'epochs': 172, 'loss': 'mse', 'optimizer': 'adam', 'graph_mode': 'off', 'use_snp_selection': False}. Best is trial 45 with value: 0.14826626548093985.
[I 2025-12-05 14:53:23,756] Trial 107 finished with value: 0.1219403133135296 and parameters: {'model_type': 'mlp', 'hidden_dims': '[512, 128]', 'dropout': 0.19467759215209796, 'batch_norm': True, 'lr': 0.00017458797532801288, 'weight_decay': 0.00019667589458218984, 'epochs': 211, 'loss': 'mse', 'optimizer': 'adam', 'graph_mode': 'off', 'use_snp_selection': False}. Best is trial 45 with value: 0.14826626548093985.
[I 2025-12-05 14:53:25,493] Trial 108 finished with value: 0.1245007651697585 and parameters: {'model_type': 'mlp', 'hidden_dims': '[512, 128]', 'dropout': 0.2178852117904255, 'batch_norm': True, 'lr': 0.00013937901691981998, 'weight_decay': 3.836543807501206e-05, 'epochs': 200, 'loss': 'mse', 'optimizer': 'adam', 'graph_mode': 'off', 'use_snp_selection': False}. Best is trial 45 with value: 0.14826626548093985.
[I 2025-12-05 14:53:27,381] Trial 109 finished with value: 0.1331827406898291 and parameters: {'model_type': 'mlp', 'hidden_dims': '[512, 128]', 'dropout': 0.3169814070660144, 'batch_norm': True, 'lr': 0.0002752625896587909, 'weight_decay': 3.0540692978648744e-05, 'epochs': 152, 'loss': 'mse', 'optimizer': 'adam', 'graph_mode': 'off', 'use_snp_selection': True, 'num_snps': 28308}. Best is trial 45 with value: 0.14826626548093985.
[I 2025-12-05 14:53:29,275] Trial 110 finished with value: 0.1310571924550331 and parameters: {'model_type': 'mlp', 'hidden_dims': '[512, 128]', 'dropout': 0.25233538740852957, 'batch_norm': True, 'lr': 0.0003187224057071878, 'weight_decay': 5.0301508800730055e-05, 'epochs': 231, 'loss': 'mse', 'optimizer': 'adam', 'graph_mode': 'off', 'use_snp_selection': False}. Best is trial 45 with value: 0.14826626548093985.
[I 2025-12-05 14:53:30,993] Trial 111 finished with value: 0.14028704661047528 and parameters: {'model_type': 'mlp', 'hidden_dims': '[512, 64]', 'dropout': 0.2342702952133304, 'batch_norm': True, 'lr': 0.00010809521048224458, 'weight_decay': 2.085962435556918e-06, 'epochs': 195, 'loss': 'mse', 'optimizer': 'adam', 'graph_mode': 'off', 'use_snp_selection': False}. Best is trial 45 with value: 0.14826626548093985.
[I 2025-12-05 14:53:32,809] Trial 112 finished with value: 0.13946951805339147 and parameters: {'model_type': 'mlp', 'hidden_dims': '[512, 256]', 'dropout': 0.28580755636472366, 'batch_norm': True, 'lr': 0.00016952861577574515, 'weight_decay': 8.061266130734482e-05, 'epochs': 218, 'loss': 'mse', 'optimizer': 'adam', 'graph_mode': 'off', 'use_snp_selection': False}. Best is trial 45 with value: 0.14826626548093985.
[I 2025-12-05 14:53:34,536] Trial 113 finished with value: 0.12795067390864198 and parameters: {'model_type': 'mlp', 'hidden_dims': '[512, 64]', 'dropout': 0.2790616588036308, 'batch_norm': True, 'lr': 0.00014779080338269435, 'weight_decay': 0.00012087223949518921, 'epochs': 206, 'loss': 'mse', 'optimizer': 'adam', 'graph_mode': 'off', 'use_snp_selection': False}. Best is trial 45 with value: 0.14826626548093985.
[I 2025-12-05 14:53:36,130] Trial 114 finished with value: 0.13244685655839902 and parameters: {'model_type': 'mlp', 'hidden_dims': '[512, 128]', 'dropout': 0.24190704774764, 'batch_norm': True, 'lr': 8.446058556912841e-05, 'weight_decay': 0.0003617086607263198, 'epochs': 179, 'loss': 'mse', 'optimizer': 'adam', 'graph_mode': 'off', 'use_snp_selection': False}. Best is trial 45 with value: 0.14826626548093985.
[I 2025-12-05 14:53:37,545] Trial 115 finished with value: 0.1383753383202254 and parameters: {'model_type': 'mlp', 'hidden_dims': '[512, 128]', 'dropout': 0.25551856135235895, 'batch_norm': True, 'lr': 6.89221625655517e-05, 'weight_decay': 1.0293110462733473e-07, 'epochs': 140, 'loss': 'mse', 'optimizer': 'adam', 'graph_mode': 'off', 'use_snp_selection': False}. Best is trial 45 with value: 0.14826626548093985.
[I 2025-12-05 14:53:39,725] Trial 116 finished with value: 0.13359170729158518 and parameters: {'model_type': 'mlp', 'hidden_dims': '[512, 128]', 'dropout': 0.18074809528898111, 'batch_norm': True, 'lr': 0.00011746136758157579, 'weight_decay': 9.413582634409275e-05, 'epochs': 304, 'loss': 'mse', 'optimizer': 'adam', 'graph_mode': 'off', 'use_snp_selection': False}. Best is trial 45 with value: 0.14826626548093985.
[I 2025-12-05 14:53:40,883] Trial 117 finished with value: 0.124512068585528 and parameters: {'model_type': 'mlp', 'hidden_dims': '[256, 128, 64]', 'dropout': 0.20674701462081518, 'batch_norm': True, 'lr': 0.0001958183307521757, 'weight_decay': 0.0002954371486540017, 'epochs': 190, 'loss': 'mse', 'optimizer': 'adam', 'graph_mode': 'off', 'use_snp_selection': False}. Best is trial 45 with value: 0.14826626548093985.
[I 2025-12-05 14:53:42,428] Trial 118 finished with value: 0.14071323604857952 and parameters: {'model_type': 'mlp', 'hidden_dims': '[512, 64]', 'dropout': 0.3267839006156396, 'batch_norm': True, 'lr': 0.0002295681331702398, 'weight_decay': 3.5175437034736697e-06, 'epochs': 168, 'loss': 'mse', 'optimizer': 'adam', 'graph_mode': 'off', 'use_snp_selection': False}. Best is trial 45 with value: 0.14826626548093985.
[I 2025-12-05 14:53:43,573] Trial 119 finished with value: 0.05370307189689326 and parameters: {'model_type': 'mlp', 'hidden_dims': '[256, 128]', 'dropout': 0.4412174768196113, 'batch_norm': False, 'lr': 0.0005720280856806815, 'weight_decay': 9.918624418409032e-07, 'epochs': 204, 'loss': 'mse', 'optimizer': 'adam', 'graph_mode': 'off', 'use_snp_selection': False}. Best is trial 45 with value: 0.14826626548093985.
[I 2025-12-05 14:53:45,335] Trial 120 finished with value: 0.1360766860531745 and parameters: {'model_type': 'mlp', 'hidden_dims': '[512, 128]', 'dropout': 0.29615249069208727, 'batch_norm': True, 'lr': 0.00012846409185236703, 'weight_decay': 4.4332837665038775e-05, 'epochs': 215, 'loss': 'mse', 'optimizer': 'adam', 'graph_mode': 'off', 'use_snp_selection': False}. Best is trial 45 with value: 0.14826626548093985.
[I 2025-12-05 14:53:47,021] Trial 121 finished with value: 0.1367315670837077 and parameters: {'model_type': 'mlp', 'hidden_dims': '[512, 128]', 'dropout': 0.29118979904460884, 'batch_norm': True, 'lr': 0.0004102195151823912, 'weight_decay': 6.965288657216742e-07, 'epochs': 199, 'loss': 'mse', 'optimizer': 'adam', 'graph_mode': 'off', 'use_snp_selection': False}. Best is trial 45 with value: 0.14826626548093985.
[I 2025-12-05 14:53:48,837] Trial 122 finished with value: 0.1387017614356251 and parameters: {'model_type': 'mlp', 'hidden_dims': '[512, 128]', 'dropout': 0.2708204853983852, 'batch_norm': True, 'lr': 0.000313350412807341, 'weight_decay': 6.330678803038977e-05, 'epochs': 226, 'loss': 'mse', 'optimizer': 'adam', 'graph_mode': 'off', 'use_snp_selection': False}. Best is trial 45 with value: 0.14826626548093985.
[I 2025-12-05 14:53:50,452] Trial 123 finished with value: 0.13315849026961118 and parameters: {'model_type': 'mlp', 'hidden_dims': '[512, 128]', 'dropout': 0.25018399736690927, 'batch_norm': True, 'lr': 0.0003585088260082583, 'weight_decay': 3.351452137326942e-05, 'epochs': 184, 'loss': 'mse', 'optimizer': 'adam', 'graph_mode': 'off', 'use_snp_selection': False}. Best is trial 45 with value: 0.14826626548093985.
[I 2025-12-05 14:53:52,191] Trial 124 finished with value: 0.10716074732184044 and parameters: {'model_type': 'mlp', 'hidden_dims': '[512, 128]', 'dropout': 0.2739914515554108, 'batch_norm': True, 'lr': 1.4504751778719533e-05, 'weight_decay': 7.485272027698643e-05, 'epochs': 210, 'loss': 'mse', 'optimizer': 'adam', 'graph_mode': 'off', 'use_snp_selection': False}. Best is trial 45 with value: 0.14826626548093985.
[I 2025-12-05 14:53:53,982] Trial 125 finished with value: 0.13481384884464873 and parameters: {'model_type': 'mlp', 'hidden_dims': '[512, 128]', 'dropout': 0.22950418217071927, 'batch_norm': True, 'lr': 0.00048657066186128477, 'weight_decay': 8.652500671712471e-07, 'epochs': 221, 'loss': 'mse', 'optimizer': 'adam', 'graph_mode': 'off', 'use_snp_selection': False}. Best is trial 45 with value: 0.14826626548093985.
[I 2025-12-05 14:53:54,879] Trial 126 finished with value: 0.12861230283410494 and parameters: {'model_type': 'mlp', 'hidden_dims': '[128, 64]', 'dropout': 0.3049831324353256, 'batch_norm': True, 'lr': 0.0008294542112653464, 'weight_decay': 1.6543811214867707e-05, 'epochs': 204, 'loss': 'mae', 'optimizer': 'adam', 'graph_mode': 'off', 'use_snp_selection': False}. Best is trial 45 with value: 0.14826626548093985.
[I 2025-12-05 14:53:56,564] Trial 127 finished with value: 0.13356492794615457 and parameters: {'model_type': 'mlp', 'hidden_dims': '[512, 128]', 'dropout': 0.2601078145896704, 'batch_norm': True, 'lr': 0.0002541049150374551, 'weight_decay': 0.00010417442711225473, 'epochs': 198, 'loss': 'mse', 'optimizer': 'adam', 'graph_mode': 'off', 'use_snp_selection': False}. Best is trial 45 with value: 0.14826626548093985.
[I 2025-12-05 14:53:57,797] Trial 128 finished with value: 0.10086798464300793 and parameters: {'model_type': 'mlp', 'hidden_dims': '[512, 128]', 'dropout': 0.2170771196687646, 'batch_norm': True, 'lr': 9.854442426697071e-05, 'weight_decay': 4.6413955755990694e-07, 'epochs': 190, 'loss': 'mse', 'optimizer': 'adam', 'graph_mode': 'off', 'use_snp_selection': True, 'num_snps': 12722}. Best is trial 45 with value: 0.14826626548093985.
