[I 2025-12-05 15:09:44,222] Trial 48 finished with value: 0.004039381735009695 and parameters: {'model_type': 'mlp', 'hidden_dims': '[256, 128]', 'dropout': 0.5215794677997472, 'batch_norm': True, 'lr': 8.223950478214593e-06, 'weight_decay': 0.0006963874766430621, 'epochs': 114, 'loss': 'mse', 'optimizer': 'adam', 'graph_mode': 'off', 'use_snp_selection': False}. Best is trial 40 with value: 0.07016881205196591.
[I 2025-12-05 15:09:46,553] Trial 49 finished with value: 0.018029338690989195 and parameters: {'model_type': 'mlp', 'hidden_dims': '[128, 64]', 'dropout': 0.3349714662336849, 'batch_norm': False, 'lr': 7.103744649282331e-05, 'weight_decay': 3.0494099097453596e-06, 'epochs': 173, 'loss': 'mae', 'optimizer': 'adam', 'graph_mode': 'off', 'use_snp_selection': True, 'num_snps': 46888}. Best is trial 40 with value: 0.07016881205196591.
[I 2025-12-05 15:09:48,003] Trial 50 finished with value: 0.002296574780827774 and parameters: {'model_type': 'mlp', 'hidden_dims': '[512, 128]', 'dropout': 0.4778705238278272, 'batch_norm': False, 'lr': 4.4325127244325096e-05, 'weight_decay': 6.999329498620779e-06, 'epochs': 123, 'loss': 'mse', 'optimizer': 'adam', 'graph_mode': 'off', 'use_snp_selection': False}. Best is trial 40 with value: 0.07016881205196591.
[I 2025-12-05 15:09:49,479] Trial 51 finished with value: 0.015254615132797852 and parameters: {'model_type': 'mlp', 'hidden_dims': '[512, 128]', 'dropout': 0.17808971499853038, 'batch_norm': True, 'lr': 8.26991777858618e-06, 'weight_decay': 6.360246653732975e-07, 'epochs': 137, 'loss': 'mae', 'optimizer': 'adam', 'graph_mode': 'off', 'use_snp_selection': False}. Best is trial 40 with value: 0.07016881205196591.
[I 2025-12-05 15:09:50,695] Trial 52 finished with value: 0.002581878191517364 and parameters: {'model_type': 'mlp', 'hidden_dims': '[512, 128]', 'dropout': 0.1746869809639402, 'batch_norm': True, 'lr': 6.53638051468052e-06, 'weight_decay': 6.340345088602507e-07, 'epochs': 92, 'loss': 'mae', 'optimizer': 'adam', 'graph_mode': 'off', 'use_snp_selection': False}. Best is trial 40 with value: 0.07016881205196591.
[I 2025-12-05 15:09:52,610] Trial 53 finished with value: 0.03476637239688414 and parameters: {'model_type': 'mlp', 'hidden_dims': '[512, 128]', 'dropout': 0.13352554932798905, 'batch_norm': True, 'lr': 3.1917921907186786e-06, 'weight_decay': 1.4354063008487116e-06, 'epochs': 205, 'loss': 'mae', 'optimizer': 'adam', 'graph_mode': 'off', 'use_snp_selection': False}. Best is trial 40 with value: 0.07016881205196591.
[I 2025-12-05 15:09:53,665] Trial 54 finished with value: 0.025737536105516892 and parameters: {'model_type': 'mlp', 'hidden_dims': '[512, 128]', 'dropout': 0.17731749337248254, 'batch_norm': True, 'lr': 0.0002408674309684929, 'weight_decay': 3.250546860251595e-07, 'epochs': 55, 'loss': 'mae', 'optimizer': 'adam', 'graph_mode': 'off', 'use_snp_selection': False}. Best is trial 40 with value: 0.07016881205196591.
[I 2025-12-05 15:09:55,001] Trial 55 finished with value: -0.02242114716303536 and parameters: {'model_type': 'mlp', 'hidden_dims': '[512, 64]', 'dropout': 0.2367459576834887, 'batch_norm': True, 'lr': 4.432789754844574e-06, 'weight_decay': 1.67584157527362e-07, 'epochs': 107, 'loss': 'mae', 'optimizer': 'adam', 'graph_mode': 'off', 'use_snp_selection': False}. Best is trial 40 with value: 0.07016881205196591.
[I 2025-12-05 15:09:55,939] Trial 56 finished with value: 0.017008450631800193 and parameters: {'model_type': 'mlp', 'hidden_dims': '[256, 128, 64]', 'dropout': 0.5615917849015515, 'batch_norm': False, 'lr': 1.404477319920861e-06, 'weight_decay': 5.716566120603876e-07, 'epochs': 126, 'loss': 'mae', 'optimizer': 'adam', 'graph_mode': 'off', 'use_snp_selection': False}. Best is trial 40 with value: 0.07016881205196591.
[I 2025-12-05 15:09:56,926] Trial 57 finished with value: 0.02643835490246858 and parameters: {'model_type': 'mlp', 'hidden_dims': '[256, 128]', 'dropout': 0.29755148192070735, 'batch_norm': True, 'lr': 3.080408022931988e-05, 'weight_decay': 1.1143491490284274e-06, 'epochs': 149, 'loss': 'mae', 'optimizer': 'adam', 'graph_mode': 'off', 'use_snp_selection': False}. Best is trial 40 with value: 0.07016881205196591.
[I 2025-12-05 15:09:58,070] Trial 58 finished with value: 0.0020753331394407454 and parameters: {'model_type': 'mlp', 'hidden_dims': '[512, 128]', 'dropout': 0.3783038309968352, 'batch_norm': False, 'lr': 1.0795446007347502e-05, 'weight_decay': 8.517553591724928e-05, 'epochs': 79, 'loss': 'mae', 'optimizer': 'adam', 'graph_mode': 'off', 'use_snp_selection': False}. Best is trial 40 with value: 0.07016881205196591.
[I 2025-12-05 15:09:59,756] Trial 59 finished with value: 0.007661415112870678 and parameters: {'model_type': 'mlp', 'hidden_dims': '[512, 256]', 'dropout': 0.4506430251003434, 'batch_norm': False, 'lr': 0.00018765293459878837, 'weight_decay': 2.388049589260695e-06, 'epochs': 168, 'loss': 'mse', 'optimizer': 'adam', 'graph_mode': 'off', 'use_snp_selection': False}. Best is trial 40 with value: 0.07016881205196591.
[I 2025-12-05 15:10:01,441] Trial 60 finished with value: 0.02717360953780779 and parameters: {'model_type': 'mlp', 'hidden_dims': '[512, 128]', 'dropout': 0.5988863410253442, 'batch_norm': False, 'lr': 1.7589592882022974e-05, 'weight_decay': 3.9047792677561106e-07, 'epochs': 98, 'loss': 'mae', 'optimizer': 'adam', 'graph_mode': 'off', 'use_snp_selection': True, 'num_snps': 24139}. Best is trial 40 with value: 0.07016881205196591.
[I 2025-12-05 15:10:02,505] Trial 61 finished with value: 0.013585506521312567 and parameters: {'model_type': 'mlp', 'hidden_dims': '[512, 128]', 'dropout': 0.4167429021439562, 'batch_norm': False, 'lr': 2.6199256275638618e-06, 'weight_decay': 2.0803751221873214e-05, 'epochs': 60, 'loss': 'mae', 'optimizer': 'adam', 'graph_mode': 'off', 'use_snp_selection': False}. Best is trial 40 with value: 0.07016881205196591.
[I 2025-12-05 15:10:03,642] Trial 62 finished with value: 0.023287174768113896 and parameters: {'model_type': 'mlp', 'hidden_dims': '[512, 128]', 'dropout': 0.4423025476330162, 'batch_norm': False, 'lr': 1.816023065805294e-06, 'weight_decay': 1.5349266348847923e-05, 'epochs': 72, 'loss': 'mae', 'optimizer': 'adam', 'graph_mode': 'off', 'use_snp_selection': False}. Best is trial 40 with value: 0.07016881205196591.
[I 2025-12-05 15:10:04,731] Trial 63 finished with value: 0.027971239432800037 and parameters: {'model_type': 'mlp', 'hidden_dims': '[512, 128]', 'dropout': 0.5029450461529213, 'batch_norm': False, 'lr': 3.277835414716723e-06, 'weight_decay': 3.421042186129005e-05, 'epochs': 68, 'loss': 'mae', 'optimizer': 'adam', 'graph_mode': 'off', 'use_snp_selection': False}. Best is trial 40 with value: 0.07016881205196591.
[I 2025-12-05 15:10:06,177] Trial 64 finished with value: 0.014564469488181048 and parameters: {'model_type': 'mlp', 'hidden_dims': '[512, 128]', 'dropout': 0.5354712476103389, 'batch_norm': False, 'lr': 6.549202113388819e-06, 'weight_decay': 8.65725190399313e-06, 'epochs': 133, 'loss': 'mae', 'optimizer': 'adam', 'graph_mode': 'off', 'use_snp_selection': False}. Best is trial 40 with value: 0.07016881205196591.
[I 2025-12-05 15:10:07,557] Trial 65 finished with value: 0.025570344943751926 and parameters: {'model_type': 'mlp', 'hidden_dims': '[512, 128]', 'dropout': 0.48260726050275116, 'batch_norm': False, 'lr': 0.000496708151046961, 'weight_decay': 5.3539631721288715e-06, 'epochs': 113, 'loss': 'mae', 'optimizer': 'adam', 'graph_mode': 'off', 'use_snp_selection': False}. Best is trial 40 with value: 0.07016881205196591.
[I 2025-12-05 15:10:08,798] Trial 66 finished with value: 0.02789445917580755 and parameters: {'model_type': 'mlp', 'hidden_dims': '[512, 64]', 'dropout': 0.15581394003148683, 'batch_norm': False, 'lr': 3.903216449365181e-06, 'weight_decay': 6.12942194123508e-05, 'epochs': 87, 'loss': 'mae', 'optimizer': 'adam', 'graph_mode': 'off', 'use_snp_selection': False}. Best is trial 40 with value: 0.07016881205196591.
[I 2025-12-05 15:10:09,561] Trial 67 finished with value: -0.02275056966245937 and parameters: {'model_type': 'mlp', 'hidden_dims': '[256, 128]', 'dropout': 0.46786400675585543, 'batch_norm': False, 'lr': 1.038788092140181e-06, 'weight_decay': 0.00021043801549516417, 'epochs': 48, 'loss': 'mae', 'optimizer': 'adam', 'graph_mode': 'off', 'use_snp_selection': False}. Best is trial 40 with value: 0.07016881205196591.
[I 2025-12-05 15:10:10,760] Trial 68 finished with value: 0.016663642163267114 and parameters: {'model_type': 'mlp', 'hidden_dims': '[512, 128]', 'dropout': 0.5545304256672486, 'batch_norm': False, 'lr': 5.6030931265007347e-05, 'weight_decay': 1.1466783151179313e-06, 'epochs': 82, 'loss': 'mse', 'optimizer': 'adam', 'graph_mode': 'off', 'use_snp_selection': False}. Best is trial 40 with value: 0.07016881205196591.
[I 2025-12-05 15:10:11,528] Trial 69 finished with value: 0.042800910393885866 and parameters: {'model_type': 'mlp', 'hidden_dims': '[128, 64]', 'dropout': 0.19540660964455633, 'batch_norm': True, 'lr': 9.903967407888945e-05, 'weight_decay': 2.8267134097974392e-05, 'epochs': 140, 'loss': 'mae', 'optimizer': 'adam', 'graph_mode': 'off', 'use_snp_selection': False}. Best is trial 40 with value: 0.07016881205196591.
[I 2025-12-05 15:10:12,523] Trial 70 finished with value: 0.018541852361440375 and parameters: {'model_type': 'mlp', 'hidden_dims': '[512, 128]', 'dropout': 0.5037769685860634, 'batch_norm': False, 'lr': 5.283642987695862e-06, 'weight_decay': 1.3882997517563286e-05, 'epochs': 188, 'loss': 'mae', 'optimizer': 'adam', 'graph_mode': 'off', 'use_snp_selection': True, 'num_snps': 4823}. Best is trial 40 with value: 0.07016881205196591.
[I 2025-12-05 15:10:14,989] Trial 71 finished with value: 0.058800842014469036 and parameters: {'model_type': 'mlp', 'hidden_dims': '[512, 64]', 'dropout': 0.513830041199674, 'batch_norm': False, 'lr': 1.0985616543391238e-05, 'weight_decay': 2.3000136485101375e-05, 'epochs': 308, 'loss': 'mae', 'optimizer': 'adam', 'graph_mode': 'off', 'use_snp_selection': False}. Best is trial 40 with value: 0.07016881205196591.
[I 2025-12-05 15:10:17,401] Trial 72 finished with value: 0.030168956660732674 and parameters: {'model_type': 'mlp', 'hidden_dims': '[512, 64]', 'dropout': 0.5213449344214115, 'batch_norm': False, 'lr': 9.377386585570562e-06, 'weight_decay': 2.234947942611079e-05, 'epochs': 304, 'loss': 'mae', 'optimizer': 'adam', 'graph_mode': 'off', 'use_snp_selection': False}. Best is trial 40 with value: 0.07016881205196591.
[I 2025-12-05 15:10:19,447] Trial 73 finished with value: 0.054138807403837384 and parameters: {'model_type': 'mlp', 'hidden_dims': '[512, 64]', 'dropout': 0.49246173103832874, 'batch_norm': False, 'lr': 1.3298376170054877e-05, 'weight_decay': 4.649492360120211e-06, 'epochs': 240, 'loss': 'mae', 'optimizer': 'adam', 'graph_mode': 'off', 'use_snp_selection': False}. Best is trial 40 with value: 0.07016881205196591.
[I 2025-12-05 15:10:22,033] Trial 74 finished with value: 0.054563529078682144 and parameters: {'model_type': 'mlp', 'hidden_dims': '[512, 64]', 'dropout': 0.49284496607527684, 'batch_norm': False, 'lr': 1.38722158214858e-05, 'weight_decay': 4.363425075898367e-06, 'epochs': 327, 'loss': 'mae', 'optimizer': 'adam', 'graph_mode': 'off', 'use_snp_selection': False}. Best is trial 40 with value: 0.07016881205196591.
[I 2025-12-05 15:10:24,624] Trial 75 finished with value: 0.0145387828047231 and parameters: {'model_type': 'mlp', 'hidden_dims': '[512, 64]', 'dropout': 0.5314804021241263, 'batch_norm': False, 'lr': 1.3759099495007915e-05, 'weight_decay': 5.386061048156905e-06, 'epochs': 329, 'loss': 'mae', 'optimizer': 'adam', 'graph_mode': 'off', 'use_snp_selection': False}. Best is trial 40 with value: 0.07016881205196591.
[I 2025-12-05 15:10:26,844] Trial 76 finished with value: 0.028929274683056214 and parameters: {'model_type': 'mlp', 'hidden_dims': '[512, 64]', 'dropout': 0.4934445588366099, 'batch_norm': False, 'lr': 2.1824241958484884e-05, 'weight_decay': 9.01432990084336e-06, 'epochs': 270, 'loss': 'mae', 'optimizer': 'adam', 'graph_mode': 'off', 'use_snp_selection': False}. Best is trial 40 with value: 0.07016881205196591.
[I 2025-12-05 15:10:29,150] Trial 77 finished with value: 0.027536294574897147 and parameters: {'model_type': 'mlp', 'hidden_dims': '[512, 64]', 'dropout': 0.5749787536162041, 'batch_norm': False, 'lr': 1.1008924364008114e-05, 'weight_decay': 3.9686600712887776e-06, 'epochs': 286, 'loss': 'mse', 'optimizer': 'adam', 'graph_mode': 'off', 'use_snp_selection': False}. Best is trial 40 with value: 0.07016881205196591.
[I 2025-12-05 15:10:31,775] Trial 78 finished with value: 0.04738482043935576 and parameters: {'model_type': 'mlp', 'hidden_dims': '[512, 64]', 'dropout': 0.5131765200780326, 'batch_norm': False, 'lr': 1.558780815348872e-05, 'weight_decay': 1.8241215571985083e-06, 'epochs': 342, 'loss': 'mae', 'optimizer': 'adam', 'graph_mode': 'off', 'use_snp_selection': False}. Best is trial 40 with value: 0.07016881205196591.
[I 2025-12-05 15:10:34,324] Trial 79 finished with value: 0.018244881770090888 and parameters: {'model_type': 'mlp', 'hidden_dims': '[512, 64]', 'dropout': 0.47856127428121464, 'batch_norm': False, 'lr': 2.5904733674355872e-05, 'weight_decay': 2.494724765365098e-06, 'epochs': 320, 'loss': 'mae', 'optimizer': 'adam', 'graph_mode': 'off', 'use_snp_selection': False}. Best is trial 40 with value: 0.07016881205196591.
[I 2025-12-05 15:10:36,343] Trial 80 finished with value: 0.046877195571728286 and parameters: {'model_type': 'mlp', 'hidden_dims': '[512, 64]', 'dropout': 0.44387175299686715, 'batch_norm': False, 'lr': 1.1861899628082752e-05, 'weight_decay': 3.955054472350625e-05, 'epochs': 227, 'loss': 'mae', 'optimizer': 'adam', 'graph_mode': 'off', 'use_snp_selection': False}. Best is trial 40 with value: 0.07016881205196591.
[I 2025-12-05 15:10:38,764] Trial 81 finished with value: 0.014658893301339281 and parameters: {'model_type': 'mlp', 'hidden_dims': '[512, 64]', 'dropout': 0.5464046237389943, 'batch_norm': False, 'lr': 7.56403080924902e-06, 'weight_decay': 7.184606997102247e-07, 'epochs': 305, 'loss': 'mae', 'optimizer': 'adam', 'graph_mode': 'off', 'use_snp_selection': False}. Best is trial 40 with value: 0.07016881205196591.
[I 2025-12-05 15:10:41,305] Trial 82 finished with value: 0.0212208156949278 and parameters: {'model_type': 'mlp', 'hidden_dims': '[512, 64]', 'dropout': 0.46572160086453024, 'batch_norm': False, 'lr': 9.900399972977302e-06, 'weight_decay': 3.219637748555666e-06, 'epochs': 327, 'loss': 'mae', 'optimizer': 'adam', 'graph_mode': 'off', 'use_snp_selection': False}. Best is trial 40 with value: 0.07016881205196591.
[I 2025-12-05 15:10:42,580] Trial 83 finished with value: 0.01747978768103606 and parameters: {'model_type': 'mlp', 'hidden_dims': '[256, 128, 64]', 'dropout': 0.49185381732790184, 'batch_norm': True, 'lr': 3.587522245996535e-05, 'weight_decay': 9.275977124044369e-07, 'epochs': 251, 'loss': 'mae', 'optimizer': 'adam', 'graph_mode': 'off', 'use_snp_selection': False}. Best is trial 40 with value: 0.07016881205196591.
[I 2025-12-05 15:10:43,981] Trial 84 finished with value: 0.054783857511884505 and parameters: {'model_type': 'mlp', 'hidden_dims': '[256, 128]', 'dropout': 0.27215631659006884, 'batch_norm': False, 'lr': 0.0001731793845808177, 'weight_decay': 4.983047576098391e-07, 'epochs': 312, 'loss': 'mae', 'optimizer': 'adam', 'graph_mode': 'off', 'use_snp_selection': False}. Best is trial 40 with value: 0.07016881205196591.
[I 2025-12-05 15:10:45,424] Trial 85 finished with value: 0.042326221957848756 and parameters: {'model_type': 'mlp', 'hidden_dims': '[256, 128]', 'dropout': 0.2505833210864264, 'batch_norm': False, 'lr': 0.00018988700510282817, 'weight_decay': 1.7382631701185604e-06, 'epochs': 310, 'loss': 'mse', 'optimizer': 'adam', 'graph_mode': 'off', 'use_snp_selection': False}. Best is trial 40 with value: 0.07016881205196591.
[I 2025-12-05 15:10:46,932] Trial 86 finished with value: 0.0429383267350201 and parameters: {'model_type': 'mlp', 'hidden_dims': '[256, 128]', 'dropout': 0.33334143015933515, 'batch_norm': False, 'lr': 0.00028766974964231415, 'weight_decay': 5.019495886001552e-07, 'epochs': 338, 'loss': 'mae', 'optimizer': 'adam', 'graph_mode': 'off', 'use_snp_selection': False}. Best is trial 40 with value: 0.07016881205196591.
[I 2025-12-05 15:10:48,287] Trial 87 finished with value: 0.04476731783611506 and parameters: {'model_type': 'mlp', 'hidden_dims': '[256, 128]', 'dropout': 0.4257319268829585, 'batch_norm': False, 'lr': 0.00012964531993985798, 'weight_decay': 3.0978187455570627e-07, 'epochs': 282, 'loss': 'mae', 'optimizer': 'adam', 'graph_mode': 'off', 'use_snp_selection': False}. Best is trial 40 with value: 0.07016881205196591.
[I 2025-12-05 15:10:50,957] Trial 88 finished with value: 0.0370935145489333 and parameters: {'model_type': 'mlp', 'hidden_dims': '[256, 128]', 'dropout': 0.27674654606911364, 'batch_norm': False, 'lr': 0.00017109284997367615, 'weight_decay': 4.457314922409279e-06, 'epochs': 300, 'loss': 'mae', 'optimizer': 'adam', 'graph_mode': 'off', 'use_snp_selection': True, 'num_snps': 48766}. Best is trial 40 with value: 0.07016881205196591.
[I 2025-12-05 15:10:53,500] Trial 89 finished with value: 0.03660442433835339 and parameters: {'model_type': 'mlp', 'hidden_dims': '[512, 256]', 'dropout': 0.5097517725275432, 'batch_norm': False, 'lr': 0.00043832917088793515, 'weight_decay': 6.604875974132865e-06, 'epochs': 326, 'loss': 'mae', 'optimizer': 'adam', 'graph_mode': 'off', 'use_snp_selection': False}. Best is trial 40 with value: 0.07016881205196591.
[I 2025-12-05 15:10:55,869] Trial 90 finished with value: 0.0341142843573965 and parameters: {'model_type': 'mlp', 'hidden_dims': '[512, 64]', 'dropout': 0.3180678027041235, 'batch_norm': False, 'lr': 7.764676275627547e-05, 'weight_decay': 9.904600394797076e-06, 'epochs': 289, 'loss': 'mse', 'optimizer': 'adam', 'graph_mode': 'off', 'use_snp_selection': False}. Best is trial 40 with value: 0.07016881205196591.
[I 2025-12-05 15:10:57,351] Trial 91 finished with value: 0.03402473787885053 and parameters: {'model_type': 'mlp', 'hidden_dims': '[256, 128]', 'dropout': 0.13461378626905685, 'batch_norm': True, 'lr': 6.70356020744346e-06, 'weight_decay': 7.756716634191821e-07, 'epochs': 317, 'loss': 'mae', 'optimizer': 'adam', 'graph_mode': 'off', 'use_snp_selection': False}. Best is trial 40 with value: 0.07016881205196591.
[I 2025-12-05 15:10:59,749] Trial 92 finished with value: 0.040840776280786396 and parameters: {'model_type': 'mlp', 'hidden_dims': '[512, 64]', 'dropout': 0.19164187517405415, 'batch_norm': False, 'lr': 1.6981229993211683e-05, 'weight_decay': 1.71065093891984e-07, 'epochs': 297, 'loss': 'mae', 'optimizer': 'adam', 'graph_mode': 'off', 'use_snp_selection': False}. Best is trial 40 with value: 0.07016881205196591.
[I 2025-12-05 15:11:00,437] Trial 93 finished with value: 0.022469506560977823 and parameters: {'model_type': 'mlp', 'hidden_dims': '[128, 64]', 'dropout': 0.21875978831562323, 'batch_norm': True, 'lr': 4.695714082995441e-06, 'weight_decay': 1.123438690407473e-06, 'epochs': 105, 'loss': 'mae', 'optimizer': 'adam', 'graph_mode': 'off', 'use_snp_selection': False}. Best is trial 40 with value: 0.07016881205196591.
[I 2025-12-05 15:11:01,812] Trial 94 finished with value: 0.03921347779958696 and parameters: {'model_type': 'mlp', 'hidden_dims': '[512, 128]', 'dropout': 0.163365072378582, 'batch_norm': False, 'lr': 0.00010826722650462914, 'weight_decay': 5.221317268128452e-07, 'epochs': 120, 'loss': 'mae', 'optimizer': 'adam', 'graph_mode': 'off', 'use_snp_selection': False}. Best is trial 40 with value: 0.07016881205196591.
[I 2025-12-05 15:11:03,321] Trial 95 finished with value: 0.029661475757370676 and parameters: {'model_type': 'mlp', 'hidden_dims': '[256, 128]', 'dropout': 0.5199877450596523, 'batch_norm': False, 'lr': 0.00028038393956168625, 'weight_decay': 4.0699307852418884e-07, 'epochs': 349, 'loss': 'mae', 'optimizer': 'adam', 'graph_mode': 'off', 'use_snp_selection': False}. Best is trial 40 with value: 0.07016881205196591.
[I 2025-12-05 15:11:05,184] Trial 96 finished with value: 0.024491718878182113 and parameters: {'model_type': 'mlp', 'hidden_dims': '[512, 128]', 'dropout': 0.5375628057234556, 'batch_norm': True, 'lr': 0.00014917348418923198, 'weight_decay': 1.3937085439636593e-06, 'epochs': 204, 'loss': 'mae', 'optimizer': 'adam', 'graph_mode': 'off', 'use_snp_selection': False}. Best is trial 40 with value: 0.07016881205196591.
[I 2025-12-05 15:11:06,067] Trial 97 finished with value: 0.03379672918041726 and parameters: {'model_type': 'mlp', 'hidden_dims': '[256, 128, 64]', 'dropout': 0.20411325292381766, 'batch_norm': False, 'lr': 5.645577682405651e-06, 'weight_decay': 2.1247689382182314e-06, 'epochs': 94, 'loss': 'mae', 'optimizer': 'adam', 'graph_mode': 'off', 'use_snp_selection': False}. Best is trial 40 with value: 0.07016881205196591.
[I 2025-12-05 15:11:07,693] Trial 98 finished with value: 0.02465345996003547 and parameters: {'model_type': 'mlp', 'hidden_dims': '[512, 128]', 'dropout': 0.47812407295838744, 'batch_norm': False, 'lr': 3.873865626108418e-06, 'weight_decay': 2.815921331513902e-06, 'epochs': 155, 'loss': 'mae', 'optimizer': 'adam', 'graph_mode': 'off', 'use_snp_selection': False}. Best is trial 40 with value: 0.07016881205196591.
[I 2025-12-05 15:11:09,661] Trial 99 finished with value: 0.04382546202623597 and parameters: {'model_type': 'mlp', 'hidden_dims': '[512, 64]', 'dropout': 0.26980558492717027, 'batch_norm': False, 'lr': 7.367679343278512e-06, 'weight_decay': 1.2299351257655844e-05, 'epochs': 220, 'loss': 'mse', 'optimizer': 'adam', 'graph_mode': 'off', 'use_snp_selection': False}. Best is trial 40 with value: 0.07016881205196591.
