[I 2025-12-06 02:02:23,545] Trial 25 finished with value: 0.18784427279935084 and parameters: {'model_type': 'mlp', 'hidden_dims': '[512, 128]', 'dropout': 0.18189443338315908, 'batch_norm': False, 'lr': 1.332536735500612e-05, 'weight_decay': 3.2599458683034443e-06, 'epochs': 98, 'loss': 'mse', 'optimizer': 'adam', 'graph_mode': 'off', 'use_snp_selection': True, 'num_snps': 48592}. Best is trial 22 with value: 0.19261999869299412.
[I 2025-12-06 02:03:10,220] Trial 26 finished with value: 0.17950529957448974 and parameters: {'model_type': 'mlp', 'hidden_dims': '[512, 128]', 'dropout': 0.35235735125573786, 'batch_norm': False, 'lr': 1.1801057077261026e-05, 'weight_decay': 6.227120159379646e-06, 'epochs': 76, 'loss': 'mae', 'optimizer': 'adam', 'graph_mode': 'off', 'use_snp_selection': True, 'num_snps': 49004}. Best is trial 22 with value: 0.19261999869299412.
[I 2025-12-06 02:04:13,576] Trial 27 finished with value: 0.17714931856675925 and parameters: {'model_type': 'mlp', 'hidden_dims': '[512, 128]', 'dropout': 0.20616027942474022, 'batch_norm': False, 'lr': 7.439579449679153e-06, 'weight_decay': 2.4315333020711366e-06, 'epochs': 171, 'loss': 'mse', 'optimizer': 'adam', 'graph_mode': 'off', 'use_snp_selection': True, 'num_snps': 50740}. Best is trial 22 with value: 0.19261999869299412.
[I 2025-12-06 02:05:09,279] Trial 28 finished with value: 0.19173995698224092 and parameters: {'model_type': 'mlp', 'hidden_dims': '[512, 128]', 'dropout': 0.5154708649295417, 'batch_norm': False, 'lr': 1.9007037244590268e-05, 'weight_decay': 7.046168589390205e-06, 'epochs': 93, 'loss': 'mse', 'optimizer': 'adam', 'graph_mode': 'off', 'use_snp_selection': True, 'num_snps': 59550}. Best is trial 22 with value: 0.19261999869299412.
[I 2025-12-06 02:05:56,817] Trial 29 finished with value: 0.18223255641937866 and parameters: {'model_type': 'mlp', 'hidden_dims': '[128, 64]', 'dropout': 0.5493551737537505, 'batch_norm': False, 'lr': 3.204276597294372e-06, 'weight_decay': 6.611979575802503e-05, 'epochs': 220, 'loss': 'mae', 'optimizer': 'adam', 'graph_mode': 'off', 'use_snp_selection': True, 'num_snps': 58874}. Best is trial 22 with value: 0.19261999869299412.
[I 2025-12-06 02:06:30,746] Trial 30 finished with value: 0.18531551006258776 and parameters: {'model_type': 'mlp', 'hidden_dims': '[256, 128]', 'dropout': 0.48370645057681916, 'batch_norm': False, 'lr': 2.2377701606014778e-05, 'weight_decay': 5.730720978771877e-05, 'epochs': 167, 'loss': 'mse', 'optimizer': 'adam', 'graph_mode': 'off', 'use_snp_selection': True, 'num_snps': 22658}. Best is trial 22 with value: 0.19261999869299412.
[I 2025-12-06 02:07:20,338] Trial 31 finished with value: 0.18106750535568272 and parameters: {'model_type': 'mlp', 'hidden_dims': '[512, 128]', 'dropout': 0.35676005397459143, 'batch_norm': False, 'lr': 1.761084772310832e-05, 'weight_decay': 6.348530040840294e-06, 'epochs': 89, 'loss': 'mse', 'optimizer': 'adam', 'graph_mode': 'off', 'use_snp_selection': True, 'num_snps': 50108}. Best is trial 22 with value: 0.19261999869299412.
[I 2025-12-06 02:08:07,158] Trial 32 finished with value: 0.1843282528213857 and parameters: {'model_type': 'mlp', 'hidden_dims': '[512, 128]', 'dropout': 0.45920577000794593, 'batch_norm': False, 'lr': 1.312517223425498e-05, 'weight_decay': 9.294610469555304e-06, 'epochs': 62, 'loss': 'mse', 'optimizer': 'adam', 'graph_mode': 'off', 'use_snp_selection': True, 'num_snps': 53266}. Best is trial 22 with value: 0.19261999869299412.
[I 2025-12-06 02:09:10,558] Trial 33 finished with value: 0.18562967175781253 and parameters: {'model_type': 'mlp', 'hidden_dims': '[512, 128]', 'dropout': 0.1945507825997833, 'batch_norm': False, 'lr': 5.289690847281296e-06, 'weight_decay': 1.73338477718959e-05, 'epochs': 131, 'loss': 'mse', 'optimizer': 'adam', 'graph_mode': 'off', 'use_snp_selection': True, 'num_snps': 59420}. Best is trial 22 with value: 0.19261999869299412.
[I 2025-12-06 02:09:47,497] Trial 34 finished with value: 0.06782187191093016 and parameters: {'model_type': 'mlp', 'hidden_dims': '[256, 128, 64]', 'dropout': 0.5517902785475819, 'batch_norm': False, 'lr': 2.2078521744625084e-06, 'weight_decay': 1.0072789993387901e-06, 'epochs': 52, 'loss': 'mae', 'optimizer': 'adam', 'graph_mode': 'off', 'use_snp_selection': True, 'num_snps': 43536}. Best is trial 22 with value: 0.19261999869299412.
[I 2025-12-06 02:10:44,710] Trial 35 finished with value: 0.1893733855394848 and parameters: {'model_type': 'mlp', 'hidden_dims': '[512, 128]', 'dropout': 0.27659727845946286, 'batch_norm': False, 'lr': 5.555115715983643e-06, 'weight_decay': 3.618919838760529e-05, 'epochs': 119, 'loss': 'mse', 'optimizer': 'adam', 'graph_mode': 'off', 'use_snp_selection': True, 'num_snps': 53946}. Best is trial 22 with value: 0.19261999869299412.
[I 2025-12-06 02:11:32,388] Trial 36 finished with value: 0.16860796224998353 and parameters: {'model_type': 'mlp', 'hidden_dims': '[128, 64]', 'dropout': 0.42256234514588753, 'batch_norm': False, 'lr': 1.0075058762961109e-06, 'weight_decay': 0.00020371098715339943, 'epochs': 258, 'loss': 'mse', 'optimizer': 'adam', 'graph_mode': 'off', 'use_snp_selection': True, 'num_snps': 54744}. Best is trial 22 with value: 0.19261999869299412.
[I 2025-12-06 02:12:11,534] Trial 37 finished with value: 0.18855664360981444 and parameters: {'model_type': 'mlp', 'hidden_dims': '[256, 128]', 'dropout': 0.26907822958289446, 'batch_norm': False, 'lr': 6.321893065439391e-06, 'weight_decay': 3.494333427649404e-05, 'epochs': 120, 'loss': 'mae', 'optimizer': 'adam', 'graph_mode': 'off', 'use_snp_selection': True, 'num_snps': 37804}. Best is trial 22 with value: 0.19261999869299412.
[I 2025-12-06 02:13:00,857] Trial 38 finished with value: 0.18485798339326315 and parameters: {'model_type': 'mlp', 'hidden_dims': '[512, 64]', 'dropout': 0.3750883671231967, 'batch_norm': False, 'lr': 3.350408910630753e-05, 'weight_decay': 0.00010643992240149636, 'epochs': 78, 'loss': 'mse', 'optimizer': 'adam', 'graph_mode': 'off', 'use_snp_selection': True, 'num_snps': 53041}. Best is trial 22 with value: 0.19261999869299412.
[I 2025-12-06 02:14:05,027] Trial 39 finished with value: 0.18930109305752646 and parameters: {'model_type': 'mlp', 'hidden_dims': '[512, 128]', 'dropout': 0.2843548285566352, 'batch_norm': False, 'lr': 2.320370617557869e-06, 'weight_decay': 3.064834335592582e-05, 'epochs': 158, 'loss': 'mse', 'optimizer': 'adam', 'graph_mode': 'off', 'use_snp_selection': True, 'num_snps': 54316}. Best is trial 22 with value: 0.19261999869299412.
[I 2025-12-06 02:15:03,443] Trial 40 finished with value: 0.16308126806883042 and parameters: {'model_type': 'mlp', 'hidden_dims': '[512, 128]', 'dropout': 0.2906202781205146, 'batch_norm': False, 'lr': 2.2821179716098627e-06, 'weight_decay': 3.0343986703755726e-05, 'epochs': 155, 'loss': 'mae', 'optimizer': 'adam', 'graph_mode': 'off', 'use_snp_selection': True, 'num_snps': 47316}. Best is trial 22 with value: 0.19261999869299412.
[I 2025-12-06 02:16:01,717] Trial 41 finished with value: 0.18654916236403918 and parameters: {'model_type': 'mlp', 'hidden_dims': '[512, 128]', 'dropout': 0.22322656386482284, 'batch_norm': False, 'lr': 4.5992945189666314e-06, 'weight_decay': 0.00011237546348950901, 'epochs': 121, 'loss': 'mse', 'optimizer': 'adam', 'graph_mode': 'off', 'use_snp_selection': True, 'num_snps': 54865}. Best is trial 22 with value: 0.19261999869299412.
[I 2025-12-06 02:17:41,384] Trial 42 finished with value: 0.18644923255293896 and parameters: {'model_type': 'mlp', 'hidden_dims': '[512, 128]', 'dropout': 0.3133536215761602, 'batch_norm': False, 'lr': 2.9833581690107072e-06, 'weight_decay': 1.3564895618975629e-05, 'epochs': 348, 'loss': 'mse', 'optimizer': 'adam', 'graph_mode': 'off', 'use_snp_selection': True, 'num_snps': 55488}. Best is trial 22 with value: 0.19261999869299412.
[I 2025-12-06 02:18:55,081] Trial 43 finished with value: 0.16998590589705556 and parameters: {'model_type': 'mlp', 'hidden_dims': '[512, 128]', 'dropout': 0.270669319529362, 'batch_norm': False, 'lr': 8.568618580018346e-06, 'weight_decay': 3.0376165360730742e-05, 'epochs': 184, 'loss': 'mse', 'optimizer': 'adam', 'graph_mode': 'off', 'use_snp_selection': True, 'num_snps': 59150}. Best is trial 22 with value: 0.19261999869299412.
[I 2025-12-06 02:19:18,640] Trial 44 finished with value: 0.07919326535578987 and parameters: {'model_type': 'mlp', 'hidden_dims': '[256, 128, 64]', 'dropout': 0.34139309595638095, 'batch_norm': False, 'lr': 1.4600663453807367e-06, 'weight_decay': 8.224162374562526e-06, 'epochs': 139, 'loss': 'mse', 'optimizer': 'adam', 'graph_mode': 'off', 'use_snp_selection': True, 'num_snps': 2639}. Best is trial 22 with value: 0.19261999869299412.
[I 2025-12-06 02:20:15,152] Trial 45 finished with value: 0.18521714261939973 and parameters: {'model_type': 'mlp', 'hidden_dims': '[512, 64]', 'dropout': 0.3994712136727298, 'batch_norm': False, 'lr': 4.419335192209332e-06, 'weight_decay': 0.0009669331628569786, 'epochs': 159, 'loss': 'mse', 'optimizer': 'adam', 'graph_mode': 'off', 'use_snp_selection': True, 'num_snps': 43478}. Best is trial 22 with value: 0.19261999869299412.
[I 2025-12-06 02:21:10,369] Trial 46 finished with value: 0.18085138213767832 and parameters: {'model_type': 'mlp', 'hidden_dims': '[512, 128]', 'dropout': 0.24475666610455693, 'batch_norm': False, 'lr': 4.1002114280632136e-05, 'weight_decay': 0.0005542794834756085, 'epochs': 109, 'loss': 'mse', 'optimizer': 'adam', 'graph_mode': 'off', 'use_snp_selection': True, 'num_snps': 52825}. Best is trial 22 with value: 0.19261999869299412.
[I 2025-12-06 02:21:55,573] Trial 47 finished with value: 0.18410820519069898 and parameters: {'model_type': 'mlp', 'hidden_dims': '[256, 128]', 'dropout': 0.29080891312518287, 'batch_norm': False, 'lr': 2.7529668888739034e-05, 'weight_decay': 1.515224461373696e-07, 'epochs': 88, 'loss': 'mse', 'optimizer': 'adam', 'graph_mode': 'off', 'use_snp_selection': True, 'num_snps': 56199}. Best is trial 22 with value: 0.19261999869299412.
[I 2025-12-06 02:22:49,252] Trial 48 finished with value: 0.18546316770851112 and parameters: {'model_type': 'mlp', 'hidden_dims': '[512, 128]', 'dropout': 0.3650247197086886, 'batch_norm': False, 'lr': 9.13539530398347e-05, 'weight_decay': 2.0232019854447932e-05, 'epochs': 104, 'loss': 'mse', 'optimizer': 'adam', 'graph_mode': 'off', 'use_snp_selection': True, 'num_snps': 52052}. Best is trial 22 with value: 0.19261999869299412.
[I 2025-12-06 02:23:36,636] Trial 49 finished with value: 0.14733556047070465 and parameters: {'model_type': 'mlp', 'hidden_dims': '[512, 128]', 'dropout': 0.597354991449746, 'batch_norm': False, 'lr': 6.127302541467126e-06, 'weight_decay': 4.386124293477593e-05, 'epochs': 45, 'loss': 'mse', 'optimizer': 'adam', 'graph_mode': 'off', 'use_snp_selection': True, 'num_snps': 59723}. Best is trial 22 with value: 0.19261999869299412.
[I 2025-12-06 02:24:17,659] Trial 50 finished with value: 0.18157674755497052 and parameters: {'model_type': 'mlp', 'hidden_dims': '[512, 256]', 'dropout': 0.22522319325987458, 'batch_norm': False, 'lr': 2.2771309370868455e-06, 'weight_decay': 0.00010578668038128318, 'epochs': 70, 'loss': 'mse', 'optimizer': 'adam', 'graph_mode': 'off', 'use_snp_selection': True, 'num_snps': 37616}. Best is trial 22 with value: 0.19261999869299412.
[I 2025-12-06 02:24:56,501] Trial 51 finished with value: 0.17597340706729744 and parameters: {'model_type': 'mlp', 'hidden_dims': '[256, 128]', 'dropout': 0.26428741318582677, 'batch_norm': False, 'lr': 6.764795061998155e-06, 'weight_decay': 3.9708156993385204e-05, 'epochs': 117, 'loss': 'mae', 'optimizer': 'adam', 'graph_mode': 'off', 'use_snp_selection': True, 'num_snps': 36389}. Best is trial 22 with value: 0.19261999869299412.
[I 2025-12-06 02:25:38,480] Trial 52 finished with value: 0.18436316605840913 and parameters: {'model_type': 'mlp', 'hidden_dims': '[256, 128]', 'dropout': 0.28332878180779536, 'batch_norm': False, 'lr': 9.413329218463657e-06, 'weight_decay': 0.00017931211498330472, 'epochs': 136, 'loss': 'mae', 'optimizer': 'adam', 'graph_mode': 'off', 'use_snp_selection': True, 'num_snps': 40493}. Best is trial 22 with value: 0.19261999869299412.
[I 2025-12-06 02:26:12,047] Trial 53 finished with value: 0.1882256388803603 and parameters: {'model_type': 'mlp', 'hidden_dims': '[256, 128]', 'dropout': 0.3182230300223789, 'batch_norm': False, 'lr': 5.9740641507135565e-06, 'weight_decay': 7.15977373681824e-05, 'epochs': 85, 'loss': 'mae', 'optimizer': 'adam', 'graph_mode': 'off', 'use_snp_selection': True, 'num_snps': 28364}. Best is trial 22 with value: 0.19261999869299412.
[I 2025-12-06 02:26:48,229] Trial 54 finished with value: 0.19479145829919436 and parameters: {'model_type': 'mlp', 'hidden_dims': '[256, 128]', 'dropout': 0.26524376573499614, 'batch_norm': False, 'lr': 1.5233057368613542e-05, 'weight_decay': 1.3013337074333742e-05, 'epochs': 120, 'loss': 'mae', 'optimizer': 'adam', 'graph_mode': 'off', 'use_snp_selection': True, 'num_snps': 30135}. Best is trial 54 with value: 0.19479145829919436.
[I 2025-12-06 02:27:22,949] Trial 55 finished with value: 0.1945456972118104 and parameters: {'model_type': 'mlp', 'hidden_dims': '[512, 256]', 'dropout': 0.2496113241605351, 'batch_norm': False, 'lr': 1.5022685153089225e-05, 'weight_decay': 1.3621372157917158e-05, 'epochs': 100, 'loss': 'mae', 'optimizer': 'adam', 'graph_mode': 'off', 'use_snp_selection': True, 'num_snps': 20932}. Best is trial 54 with value: 0.19479145829919436.
[I 2025-12-06 02:28:14,527] Trial 56 finished with value: 0.18765100974605875 and parameters: {'model_type': 'mlp', 'hidden_dims': '[512, 64]', 'dropout': 0.25149870242448824, 'batch_norm': False, 'lr': 1.4018512101655198e-05, 'weight_decay': 1.3109723430986444e-05, 'epochs': 189, 'loss': 'mae', 'optimizer': 'adam', 'graph_mode': 'off', 'use_snp_selection': True, 'num_snps': 32970}. Best is trial 54 with value: 0.19479145829919436.
[I 2025-12-06 02:28:44,856] Trial 57 finished with value: 0.13534279889144263 and parameters: {'model_type': 'mlp', 'hidden_dims': '[128, 64]', 'dropout': 0.3090900157758063, 'batch_norm': True, 'lr': 2.337069206299156e-05, 'weight_decay': 5.419437230745234e-06, 'epochs': 207, 'loss': 'mae', 'optimizer': 'adam', 'graph_mode': 'off', 'use_snp_selection': True, 'num_snps': 17615}. Best is trial 54 with value: 0.19479145829919436.
[I 2025-12-06 02:29:00,996] Trial 58 finished with value: 0.17740423256934978 and parameters: {'model_type': 'mlp', 'hidden_dims': '[256, 128, 64]', 'dropout': 0.12931999046005493, 'batch_norm': False, 'lr': 1.648103321184848e-05, 'weight_decay': 2.200213708764619e-05, 'epochs': 99, 'loss': 'mae', 'optimizer': 'adam', 'graph_mode': 'off', 'use_snp_selection': False}. Best is trial 54 with value: 0.19479145829919436.
[I 2025-12-06 02:29:44,562] Trial 59 finished with value: 0.18130315081061257 and parameters: {'model_type': 'mlp', 'hidden_dims': '[512, 256]', 'dropout': 0.3389750719474195, 'batch_norm': False, 'lr': 5.655949239763784e-05, 'weight_decay': 1.3930040420575097e-05, 'epochs': 150, 'loss': 'mae', 'optimizer': 'adam', 'graph_mode': 'off', 'use_snp_selection': True, 'num_snps': 28548}. Best is trial 54 with value: 0.19479145829919436.
[I 2025-12-06 02:30:21,577] Trial 60 finished with value: 0.1855466256669307 and parameters: {'model_type': 'mlp', 'hidden_dims': '[512, 256]', 'dropout': 0.2030690645486593, 'batch_norm': False, 'lr': 1.0542077583861471e-05, 'weight_decay': 1.6577259589020123e-06, 'epochs': 126, 'loss': 'mae', 'optimizer': 'adam', 'graph_mode': 'off', 'use_snp_selection': True, 'num_snps': 21873}. Best is trial 54 with value: 0.19479145829919436.
[I 2025-12-06 02:30:58,496] Trial 61 finished with value: 0.1827722241518538 and parameters: {'model_type': 'mlp', 'hidden_dims': '[512, 256]', 'dropout': 0.23661375323572342, 'batch_norm': False, 'lr': 4.368792762144066e-05, 'weight_decay': 4.754962203118873e-06, 'epochs': 111, 'loss': 'mae', 'optimizer': 'adam', 'graph_mode': 'off', 'use_snp_selection': True, 'num_snps': 23897}. Best is trial 54 with value: 0.19479145829919436.
[I 2025-12-06 02:31:28,234] Trial 62 finished with value: 0.16640153024413923 and parameters: {'model_type': 'mlp', 'hidden_dims': '[512, 256]', 'dropout': 0.25854461787740524, 'batch_norm': False, 'lr': 2.0482666150420224e-05, 'weight_decay': 6.3360847189e-07, 'epochs': 86, 'loss': 'mse', 'optimizer': 'adam', 'graph_mode': 'off', 'use_snp_selection': True, 'num_snps': 14336}. Best is trial 54 with value: 0.19479145829919436.
[I 2025-12-06 02:32:16,374] Trial 63 finished with value: 0.18616472860537345 and parameters: {'model_type': 'mlp', 'hidden_dims': '[512, 256]', 'dropout': 0.2790656615039003, 'batch_norm': False, 'lr': 1.4055901062435898e-05, 'weight_decay': 8.458129705051877e-06, 'epochs': 59, 'loss': 'mse', 'optimizer': 'adam', 'graph_mode': 'off', 'use_snp_selection': True, 'num_snps': 57006}. Best is trial 54 with value: 0.19479145829919436.
[I 2025-12-06 02:33:11,735] Trial 64 finished with value: 0.18482254245247848 and parameters: {'model_type': 'mlp', 'hidden_dims': '[512, 256]', 'dropout': 0.3009215937144021, 'batch_norm': False, 'lr': 2.408087588407569e-05, 'weight_decay': 1.8523540951527617e-07, 'epochs': 97, 'loss': 'mse', 'optimizer': 'adam', 'graph_mode': 'off', 'use_snp_selection': True, 'num_snps': 57774}. Best is trial 54 with value: 0.19479145829919436.
[I 2025-12-06 02:33:39,694] Trial 65 finished with value: 0.137454111004551 and parameters: {'model_type': 'mlp', 'hidden_dims': '[512, 128]', 'dropout': 0.16854600931373062, 'batch_norm': True, 'lr': 8.28783624231094e-06, 'weight_decay': 4.791931524895334e-05, 'epochs': 143, 'loss': 'mae', 'optimizer': 'adam', 'graph_mode': 'off', 'use_snp_selection': True, 'num_snps': 8138}. Best is trial 54 with value: 0.19479145829919436.
[I 2025-12-06 02:33:53,132] Trial 66 finished with value: 0.1862042156990146 and parameters: {'model_type': 'mlp', 'hidden_dims': '[256, 128]', 'dropout': 0.2317716879701265, 'batch_norm': False, 'lr': 1.679465557527228e-05, 'weight_decay': 2.385865453338139e-05, 'epochs': 77, 'loss': 'mse', 'optimizer': 'adam', 'graph_mode': 'off', 'use_snp_selection': False}. Best is trial 54 with value: 0.19479145829919436.
[I 2025-12-06 02:34:37,895] Trial 67 finished with value: 0.17962408120294512 and parameters: {'model_type': 'mlp', 'hidden_dims': '[512, 256]', 'dropout': 0.21055135563346253, 'batch_norm': False, 'lr': 3.914894257561213e-06, 'weight_decay': 4.6427571943367294e-07, 'epochs': 66, 'loss': 'mse', 'optimizer': 'adam', 'graph_mode': 'off', 'use_snp_selection': True, 'num_snps': 48015}. Best is trial 54 with value: 0.19479145829919436.
[I 2025-12-06 02:35:36,618] Trial 68 finished with value: 0.17678444389154788 and parameters: {'model_type': 'mlp', 'hidden_dims': '[512, 128]', 'dropout': 0.32963380109279466, 'batch_norm': False, 'lr': 1.8686627250097512e-06, 'weight_decay': 1.9773184579127115e-06, 'epochs': 164, 'loss': 'mse', 'optimizer': 'adam', 'graph_mode': 'off', 'use_snp_selection': True, 'num_snps': 46242}. Best is trial 54 with value: 0.19479145829919436.
[I 2025-12-06 02:36:09,322] Trial 69 finished with value: 0.16758823293137104 and parameters: {'model_type': 'mlp', 'hidden_dims': '[512, 256]', 'dropout': 0.5273579241745686, 'batch_norm': False, 'lr': 1.068602992866153e-05, 'weight_decay': 1.7940465953562878e-05, 'epochs': 51, 'loss': 'mae', 'optimizer': 'adam', 'graph_mode': 'off', 'use_snp_selection': True, 'num_snps': 24898}. Best is trial 54 with value: 0.19479145829919436.
[I 2025-12-06 02:36:51,254] Trial 70 finished with value: 0.1790979258867073 and parameters: {'model_type': 'mlp', 'hidden_dims': '[128, 64]', 'dropout': 0.2577640355782483, 'batch_norm': True, 'lr': 3.012594215928247e-05, 'weight_decay': 4.052475679518774e-06, 'epochs': 111, 'loss': 'mse', 'optimizer': 'adam', 'graph_mode': 'off', 'use_snp_selection': True, 'num_snps': 57008}. Best is trial 54 with value: 0.19479145829919436.
[I 2025-12-06 02:37:29,192] Trial 71 finished with value: 0.18485903570687473 and parameters: {'model_type': 'mlp', 'hidden_dims': '[256, 128]', 'dropout': 0.28378965524849625, 'batch_norm': False, 'lr': 2.773460712785565e-06, 'weight_decay': 3.408515004444579e-05, 'epochs': 124, 'loss': 'mae', 'optimizer': 'adam', 'graph_mode': 'off', 'use_snp_selection': True, 'num_snps': 34444}. Best is trial 54 with value: 0.19479145829919436.
[I 2025-12-06 02:38:30,862] Trial 72 finished with value: 0.16684578804102812 and parameters: {'model_type': 'mlp', 'hidden_dims': '[256, 128]', 'dropout': 0.2703252272339454, 'batch_norm': False, 'lr': 7.142380059673721e-06, 'weight_decay': 1.0326509492403273e-05, 'epochs': 310, 'loss': 'mae', 'optimizer': 'adam', 'graph_mode': 'off', 'use_snp_selection': True, 'num_snps': 50845}. Best is trial 54 with value: 0.19479145829919436.
[I 2025-12-06 02:39:05,254] Trial 73 finished with value: 0.1909123132351942 and parameters: {'model_type': 'mlp', 'hidden_dims': '[256, 128]', 'dropout': 0.18887189515783606, 'batch_norm': False, 'lr': 4.884373709249483e-06, 'weight_decay': 2.831772970838362e-05, 'epochs': 101, 'loss': 'mae', 'optimizer': 'adam', 'graph_mode': 'off', 'use_snp_selection': True, 'num_snps': 28971}. Best is trial 54 with value: 0.19479145829919436.
[I 2025-12-06 02:39:40,157] Trial 74 finished with value: 0.20470863597462086 and parameters: {'model_type': 'mlp', 'hidden_dims': '[256, 128]', 'dropout': 0.19111528003036643, 'batch_norm': False, 'lr': 4.92470810763432e-06, 'weight_decay': 3.281122696130593e-07, 'epochs': 102, 'loss': 'mae', 'optimizer': 'adam', 'graph_mode': 'off', 'use_snp_selection': True, 'num_snps': 30013}. Best is trial 74 with value: 0.20470863597462086.
