[I 2025-12-05 16:01:28,087] Trial 47 finished with value: 0.078838921826118 and parameters: {'model_type': 'mlp', 'hidden_dims': '[512, 128]', 'dropout': 0.1728428455768638, 'batch_norm': True, 'lr': 0.00034470669357522044, 'weight_decay': 0.0009669331628569803, 'epochs': 151, 'loss': 'mae', 'optimizer': 'adam', 'graph_mode': 'off', 'use_snp_selection': False}. Best is trial 45 with value: 0.07990556576985153.
[I 2025-12-05 16:01:28,930] Trial 48 finished with value: 0.05530815225160899 and parameters: {'model_type': 'mlp', 'hidden_dims': '[128, 64]', 'dropout': 0.14924442697510976, 'batch_norm': True, 'lr': 0.00033271604847382873, 'weight_decay': 0.0004891252178363271, 'epochs': 140, 'loss': 'mse', 'optimizer': 'adam', 'graph_mode': 'off', 'use_snp_selection': False}. Best is trial 45 with value: 0.07990556576985153.
[I 2025-12-05 16:01:31,184] Trial 49 finished with value: 0.07203261515940435 and parameters: {'model_type': 'mlp', 'hidden_dims': '[512, 128]', 'dropout': 0.17109478935532332, 'batch_norm': True, 'lr': 5.1744036379339534e-05, 'weight_decay': 0.0009812385850764573, 'epochs': 187, 'loss': 'mae', 'optimizer': 'adam', 'graph_mode': 'off', 'use_snp_selection': False}. Best is trial 45 with value: 0.07990556576985153.
[I 2025-12-05 16:01:33,209] Trial 50 finished with value: 0.06503555664453951 and parameters: {'model_type': 'mlp', 'hidden_dims': '[512, 64]', 'dropout': 0.11702190037435414, 'batch_norm': True, 'lr': 0.00017061903132500398, 'weight_decay': 6.530563661898766e-07, 'epochs': 159, 'loss': 'mae', 'optimizer': 'adam', 'graph_mode': 'off', 'use_snp_selection': False}. Best is trial 45 with value: 0.07990556576985153.
[I 2025-12-05 16:01:35,469] Trial 51 finished with value: 0.05410132405243643 and parameters: {'model_type': 'mlp', 'hidden_dims': '[512, 128]', 'dropout': 0.18089845857013828, 'batch_norm': True, 'lr': 5.408169768294602e-05, 'weight_decay': 0.0008331448858684098, 'epochs': 193, 'loss': 'mae', 'optimizer': 'adam', 'graph_mode': 'off', 'use_snp_selection': False}. Best is trial 45 with value: 0.07990556576985153.
[I 2025-12-05 16:01:37,786] Trial 52 finished with value: 0.057928103825497006 and parameters: {'model_type': 'mlp', 'hidden_dims': '[512, 128]', 'dropout': 0.2153386640329195, 'batch_norm': True, 'lr': 4.130136000568523e-05, 'weight_decay': 0.00042423785699431665, 'epochs': 195, 'loss': 'mae', 'optimizer': 'adam', 'graph_mode': 'off', 'use_snp_selection': False}. Best is trial 45 with value: 0.07990556576985153.
[I 2025-12-05 16:01:39,661] Trial 53 finished with value: 0.03992745177233235 and parameters: {'model_type': 'mlp', 'hidden_dims': '[512, 128]', 'dropout': 0.13885890118128005, 'batch_norm': True, 'lr': 7.759172119836995e-05, 'weight_decay': 0.0009880064452244906, 'epochs': 139, 'loss': 'mae', 'optimizer': 'adam', 'graph_mode': 'off', 'use_snp_selection': False}. Best is trial 45 with value: 0.07990556576985153.
[I 2025-12-05 16:01:41,396] Trial 54 finished with value: 0.06749179171047011 and parameters: {'model_type': 'mlp', 'hidden_dims': '[512, 128]', 'dropout': 0.16911869326238357, 'batch_norm': True, 'lr': 1.9491745560654985e-05, 'weight_decay': 0.00025721214460679295, 'epochs': 124, 'loss': 'mae', 'optimizer': 'adam', 'graph_mode': 'off', 'use_snp_selection': False}. Best is trial 45 with value: 0.07990556576985153.
[I 2025-12-05 16:01:42,743] Trial 55 finished with value: 0.058607422343328115 and parameters: {'model_type': 'mlp', 'hidden_dims': '[256, 128]', 'dropout': 0.11967863029724768, 'batch_norm': True, 'lr': 0.0007794481467141734, 'weight_decay': 0.0006381082388747913, 'epochs': 187, 'loss': 'mae', 'optimizer': 'adam', 'graph_mode': 'off', 'use_snp_selection': False}. Best is trial 45 with value: 0.07990556576985153.
[I 2025-12-05 16:01:43,989] Trial 56 finished with value: 0.06232031386466947 and parameters: {'model_type': 'mlp', 'hidden_dims': '[256, 128, 64]', 'dropout': 0.22267830846341605, 'batch_norm': True, 'lr': 0.0004018440846091324, 'weight_decay': 2.590237278306782e-07, 'epochs': 159, 'loss': 'mae', 'optimizer': 'adam', 'graph_mode': 'off', 'use_snp_selection': False}. Best is trial 45 with value: 0.07990556576985153.
[I 2025-12-05 16:01:46,551] Trial 57 finished with value: 0.04068651347395876 and parameters: {'model_type': 'mlp', 'hidden_dims': '[512, 128]', 'dropout': 0.16715654260385945, 'batch_norm': True, 'lr': 7.144212725197321e-05, 'weight_decay': 1.716353585805226e-06, 'epochs': 227, 'loss': 'mae', 'optimizer': 'adam', 'graph_mode': 'off', 'use_snp_selection': False}. Best is trial 45 with value: 0.07990556576985153.
[I 2025-12-05 16:01:48,972] Trial 58 finished with value: 0.06045638088196354 and parameters: {'model_type': 'mlp', 'hidden_dims': '[512, 256]', 'dropout': 0.2667659810558052, 'batch_norm': True, 'lr': 2.797282701127292e-05, 'weight_decay': 9.456033727941487e-07, 'epochs': 210, 'loss': 'mae', 'optimizer': 'adam', 'graph_mode': 'off', 'use_snp_selection': False}. Best is trial 45 with value: 0.07990556576985153.
[I 2025-12-05 16:01:50,452] Trial 59 finished with value: 0.050130976705347205 and parameters: {'model_type': 'mlp', 'hidden_dims': '[512, 128]', 'dropout': 0.3193026903858856, 'batch_norm': True, 'lr': 0.0007626446104615982, 'weight_decay': 3.8863510537585244e-07, 'epochs': 94, 'loss': 'mae', 'optimizer': 'adam', 'graph_mode': 'off', 'use_snp_selection': False}. Best is trial 45 with value: 0.07990556576985153.
[I 2025-12-05 16:01:51,838] Trial 60 finished with value: 0.04272119304038194 and parameters: {'model_type': 'mlp', 'hidden_dims': '[256, 128]', 'dropout': 0.3577715944923708, 'batch_norm': True, 'lr': 0.00011051894197088966, 'weight_decay': 0.0001760627681621851, 'epochs': 187, 'loss': 'mse', 'optimizer': 'adam', 'graph_mode': 'off', 'use_snp_selection': False}. Best is trial 45 with value: 0.07990556576985153.
[I 2025-12-05 16:01:53,897] Trial 61 finished with value: 0.06490806448599441 and parameters: {'model_type': 'mlp', 'hidden_dims': '[512, 128]', 'dropout': 0.29803921914154013, 'batch_norm': True, 'lr': 0.000566737224752996, 'weight_decay': 3.592303901798376e-06, 'epochs': 163, 'loss': 'mae', 'optimizer': 'adam', 'graph_mode': 'off', 'use_snp_selection': False}. Best is trial 45 with value: 0.07990556576985153.
[I 2025-12-05 16:01:56,606] Trial 62 finished with value: 0.06404691078535989 and parameters: {'model_type': 'mlp', 'hidden_dims': '[512, 128]', 'dropout': 0.23192505239144745, 'batch_norm': True, 'lr': 0.0004976218884980653, 'weight_decay': 3.918708974253231e-06, 'epochs': 246, 'loss': 'mae', 'optimizer': 'adam', 'graph_mode': 'off', 'use_snp_selection': False}. Best is trial 45 with value: 0.07990556576985153.
[I 2025-12-05 16:01:59,028] Trial 63 finished with value: 0.0727185087460571 and parameters: {'model_type': 'mlp', 'hidden_dims': '[512, 128]', 'dropout': 0.20582801352719043, 'batch_norm': True, 'lr': 0.00026674331857825796, 'weight_decay': 2.1527027541860624e-06, 'epochs': 208, 'loss': 'mae', 'optimizer': 'adam', 'graph_mode': 'off', 'use_snp_selection': False}. Best is trial 45 with value: 0.07990556576985153.
[I 2025-12-05 16:02:01,495] Trial 64 finished with value: 0.0825544899739195 and parameters: {'model_type': 'mlp', 'hidden_dims': '[512, 128]', 'dropout': 0.20204025356557143, 'batch_norm': True, 'lr': 0.0002486346156009997, 'weight_decay': 2.130112997537949e-06, 'epochs': 215, 'loss': 'mae', 'optimizer': 'adam', 'graph_mode': 'off', 'use_snp_selection': False}. Best is trial 64 with value: 0.0825544899739195.
[I 2025-12-05 16:02:03,861] Trial 65 finished with value: 0.04776271182459772 and parameters: {'model_type': 'mlp', 'hidden_dims': '[512, 128]', 'dropout': 0.25312474184927924, 'batch_norm': True, 'lr': 0.00024305634363527013, 'weight_decay': 2.137634837179144e-06, 'epochs': 206, 'loss': 'mae', 'optimizer': 'adam', 'graph_mode': 'off', 'use_snp_selection': False}. Best is trial 64 with value: 0.0825544899739195.
[I 2025-12-05 16:02:06,387] Trial 66 finished with value: 0.05040458931752016 and parameters: {'model_type': 'mlp', 'hidden_dims': '[512, 128]', 'dropout': 0.24025546982389698, 'batch_norm': True, 'lr': 0.000138779304952941, 'weight_decay': 1.4371040005669065e-06, 'epochs': 221, 'loss': 'mae', 'optimizer': 'adam', 'graph_mode': 'off', 'use_snp_selection': False}. Best is trial 64 with value: 0.0825544899739195.
[I 2025-12-05 16:02:07,442] Trial 67 finished with value: 0.056580988271212 and parameters: {'model_type': 'mlp', 'hidden_dims': '[128, 64]', 'dropout': 0.21091150886150054, 'batch_norm': True, 'lr': 0.00034523411913240125, 'weight_decay': 5.247656875286518e-07, 'epochs': 227, 'loss': 'mae', 'optimizer': 'adam', 'graph_mode': 'off', 'use_snp_selection': False}. Best is trial 64 with value: 0.0825544899739195.
[I 2025-12-05 16:02:10,128] Trial 68 finished with value: 0.06160648801060203 and parameters: {'model_type': 'mlp', 'hidden_dims': '[512, 128]', 'dropout': 0.20050005347035668, 'batch_norm': True, 'lr': 0.000263067904744546, 'weight_decay': 1.097494169599785e-06, 'epochs': 247, 'loss': 'mae', 'optimizer': 'adam', 'graph_mode': 'off', 'use_snp_selection': False}. Best is trial 64 with value: 0.0825544899739195.
[I 2025-12-05 16:02:11,597] Trial 69 finished with value: 0.05630875827194753 and parameters: {'model_type': 'mlp', 'hidden_dims': '[256, 128]', 'dropout': 0.2784212772637822, 'batch_norm': True, 'lr': 0.0002063884191924113, 'weight_decay': 2.7660333029272078e-06, 'epochs': 211, 'loss': 'mae', 'optimizer': 'adam', 'graph_mode': 'off', 'use_snp_selection': False}. Best is trial 64 with value: 0.0825544899739195.
[I 2025-12-05 16:02:12,982] Trial 70 finished with value: 0.04694671091065815 and parameters: {'model_type': 'mlp', 'hidden_dims': '[256, 128, 64]', 'dropout': 0.23964503172291612, 'batch_norm': True, 'lr': 0.0007990705203644764, 'weight_decay': 8.480251864643631e-07, 'epochs': 179, 'loss': 'mae', 'optimizer': 'adam', 'graph_mode': 'off', 'use_snp_selection': False}. Best is trial 64 with value: 0.0825544899739195.
[I 2025-12-05 16:02:15,316] Trial 71 finished with value: 0.052792482959233014 and parameters: {'model_type': 'mlp', 'hidden_dims': '[512, 128]', 'dropout': 0.16983614617824197, 'batch_norm': True, 'lr': 0.00041772095302131107, 'weight_decay': 2.03192522666746e-06, 'epochs': 198, 'loss': 'mae', 'optimizer': 'adam', 'graph_mode': 'off', 'use_snp_selection': False}. Best is trial 64 with value: 0.0825544899739195.
[I 2025-12-05 16:02:17,474] Trial 72 finished with value: 0.0634261120654661 and parameters: {'model_type': 'mlp', 'hidden_dims': '[512, 128]', 'dropout': 0.20572862671956615, 'batch_norm': True, 'lr': 4.644028027557954e-05, 'weight_decay': 1.282344031994657e-06, 'epochs': 180, 'loss': 'mae', 'optimizer': 'adam', 'graph_mode': 'off', 'use_snp_selection': False}. Best is trial 64 with value: 0.0825544899739195.
[I 2025-12-05 16:02:19,432] Trial 73 finished with value: 0.0759313033343162 and parameters: {'model_type': 'mlp', 'hidden_dims': '[512, 128]', 'dropout': 0.13232684802891376, 'batch_norm': True, 'lr': 0.0002872065169211588, 'weight_decay': 0.0003465494910812971, 'epochs': 149, 'loss': 'mae', 'optimizer': 'adam', 'graph_mode': 'off', 'use_snp_selection': False}. Best is trial 64 with value: 0.0825544899739195.
[I 2025-12-05 16:02:21,091] Trial 74 finished with value: 0.05067872722101894 and parameters: {'model_type': 'mlp', 'hidden_dims': '[512, 128]', 'dropout': 0.12749537501795, 'batch_norm': True, 'lr': 0.00030274019460918713, 'weight_decay': 3.770724905000589e-05, 'epochs': 111, 'loss': 'mae', 'optimizer': 'adam', 'graph_mode': 'off', 'use_snp_selection': False}. Best is trial 64 with value: 0.0825544899739195.
[I 2025-12-05 16:02:23,064] Trial 75 finished with value: 0.07653260518924697 and parameters: {'model_type': 'mlp', 'hidden_dims': '[512, 128]', 'dropout': 0.10034914708183801, 'batch_norm': True, 'lr': 0.0001889466803362477, 'weight_decay': 0.0001072277886276483, 'epochs': 151, 'loss': 'mae', 'optimizer': 'adam', 'graph_mode': 'off', 'use_snp_selection': False}. Best is trial 64 with value: 0.0825544899739195.
[I 2025-12-05 16:02:24,982] Trial 76 finished with value: 0.06401726428533788 and parameters: {'model_type': 'mlp', 'hidden_dims': '[512, 128]', 'dropout': 0.10124962183369429, 'batch_norm': True, 'lr': 0.00020183729651068006, 'weight_decay': 0.00034925851101618637, 'epochs': 149, 'loss': 'mae', 'optimizer': 'adam', 'graph_mode': 'off', 'use_snp_selection': False}. Best is trial 64 with value: 0.0825544899739195.
[I 2025-12-05 16:02:26,783] Trial 77 finished with value: 0.0598696790239071 and parameters: {'model_type': 'mlp', 'hidden_dims': '[512, 128]', 'dropout': 0.14056612022746837, 'batch_norm': True, 'lr': 0.00041993369821749526, 'weight_decay': 0.00011970379990423243, 'epochs': 129, 'loss': 'mae', 'optimizer': 'adam', 'graph_mode': 'off', 'use_snp_selection': False}. Best is trial 64 with value: 0.0825544899739195.
[I 2025-12-05 16:02:28,754] Trial 78 finished with value: 0.07297838952307831 and parameters: {'model_type': 'mlp', 'hidden_dims': '[512, 128]', 'dropout': 0.1575711262896988, 'batch_norm': True, 'lr': 0.000647590523075423, 'weight_decay': 0.0005001996756745192, 'epochs': 151, 'loss': 'mae', 'optimizer': 'adam', 'graph_mode': 'off', 'use_snp_selection': False}. Best is trial 64 with value: 0.0825544899739195.
[I 2025-12-05 16:02:30,737] Trial 79 finished with value: 0.04935829502894373 and parameters: {'model_type': 'mlp', 'hidden_dims': '[512, 128]', 'dropout': 0.1554409681877113, 'batch_norm': True, 'lr': 0.000599854657747863, 'weight_decay': 0.0007043436785359394, 'epochs': 152, 'loss': 'mse', 'optimizer': 'adam', 'graph_mode': 'off', 'use_snp_selection': False}. Best is trial 64 with value: 0.0825544899739195.
[I 2025-12-05 16:02:32,791] Trial 80 finished with value: 0.07193322103112028 and parameters: {'model_type': 'mlp', 'hidden_dims': '[512, 128]', 'dropout': 0.1303411303330469, 'batch_norm': True, 'lr': 0.0009957897258130264, 'weight_decay': 0.0005237176261815427, 'epochs': 167, 'loss': 'mae', 'optimizer': 'adam', 'graph_mode': 'off', 'use_snp_selection': False}. Best is trial 64 with value: 0.0825544899739195.
[I 2025-12-05 16:02:34,394] Trial 81 finished with value: 0.07171816535001903 and parameters: {'model_type': 'mlp', 'hidden_dims': '[512, 128]', 'dropout': 0.18816308101905216, 'batch_norm': True, 'lr': 0.0002961552391285115, 'weight_decay': 0.00028786184795038194, 'epochs': 104, 'loss': 'mae', 'optimizer': 'adam', 'graph_mode': 'off', 'use_snp_selection': False}. Best is trial 64 with value: 0.0825544899739195.
[I 2025-12-05 16:02:36,248] Trial 82 finished with value: 0.07828644132441215 and parameters: {'model_type': 'mlp', 'hidden_dims': '[512, 128]', 'dropout': 0.10196389707259049, 'batch_norm': True, 'lr': 0.0008272776571797205, 'weight_decay': 0.00040177269089780473, 'epochs': 135, 'loss': 'mae', 'optimizer': 'adam', 'graph_mode': 'off', 'use_snp_selection': False}. Best is trial 64 with value: 0.0825544899739195.
[I 2025-12-05 16:02:38,058] Trial 83 finished with value: 0.06471434992475758 and parameters: {'model_type': 'mlp', 'hidden_dims': '[512, 128]', 'dropout': 0.11075875661721173, 'batch_norm': True, 'lr': 0.000839941736395968, 'weight_decay': 0.0003735079492809228, 'epochs': 130, 'loss': 'mae', 'optimizer': 'adam', 'graph_mode': 'off', 'use_snp_selection': False}. Best is trial 64 with value: 0.0825544899739195.
[I 2025-12-05 16:02:39,512] Trial 84 finished with value: 0.08996978047822614 and parameters: {'model_type': 'mlp', 'hidden_dims': '[512, 256]', 'dropout': 0.13650362456197235, 'batch_norm': True, 'lr': 0.0004983215403121076, 'weight_decay': 0.0006305933751505865, 'epochs': 91, 'loss': 'mae', 'optimizer': 'adam', 'graph_mode': 'off', 'use_snp_selection': False}. Best is trial 84 with value: 0.08996978047822614.
[I 2025-12-05 16:02:40,895] Trial 85 finished with value: 0.06904982111881958 and parameters: {'model_type': 'mlp', 'hidden_dims': '[512, 256]', 'dropout': 0.15144467812096202, 'batch_norm': True, 'lr': 0.0006810889257243189, 'weight_decay': 0.000559272626603962, 'epochs': 76, 'loss': 'mae', 'optimizer': 'adam', 'graph_mode': 'off', 'use_snp_selection': False}. Best is trial 84 with value: 0.08996978047822614.
[I 2025-12-05 16:02:42,770] Trial 86 finished with value: 0.04324996635052943 and parameters: {'model_type': 'mlp', 'hidden_dims': '[512, 256]', 'dropout': 0.12382516647102414, 'batch_norm': False, 'lr': 0.0004830468681134112, 'weight_decay': 0.0007238039483368066, 'epochs': 142, 'loss': 'mae', 'optimizer': 'adam', 'graph_mode': 'off', 'use_snp_selection': False}. Best is trial 84 with value: 0.08996978047822614.
[I 2025-12-05 16:02:44,151] Trial 87 finished with value: 0.05774780296593023 and parameters: {'model_type': 'mlp', 'hidden_dims': '[512, 256]', 'dropout': 0.10929786741633542, 'batch_norm': True, 'lr': 0.0006433113127271584, 'weight_decay': 0.00018388755523459743, 'epochs': 77, 'loss': 'mae', 'optimizer': 'adam', 'graph_mode': 'off', 'use_snp_selection': False}. Best is trial 84 with value: 0.08996978047822614.
[I 2025-12-05 16:02:45,976] Trial 88 finished with value: 0.0604645920516986 and parameters: {'model_type': 'mlp', 'hidden_dims': '[512, 64]', 'dropout': 0.15872522342230128, 'batch_norm': True, 'lr': 0.00037105871066147033, 'weight_decay': 0.00043659023031662053, 'epochs': 134, 'loss': 'mae', 'optimizer': 'adam', 'graph_mode': 'off', 'use_snp_selection': False}. Best is trial 84 with value: 0.08996978047822614.
[I 2025-12-05 16:02:47,500] Trial 89 finished with value: 0.05739789387521694 and parameters: {'model_type': 'mlp', 'hidden_dims': '[512, 256]', 'dropout': 0.13238996876872752, 'batch_norm': True, 'lr': 0.0005046177593003063, 'weight_decay': 0.00024249416961848565, 'epochs': 47, 'loss': 'mae', 'optimizer': 'adam', 'graph_mode': 'off', 'use_snp_selection': True, 'num_snps': 17094}. Best is trial 84 with value: 0.08996978047822614.
[I 2025-12-05 16:02:48,415] Trial 90 finished with value: 0.08174581438866396 and parameters: {'model_type': 'mlp', 'hidden_dims': '[128, 64]', 'dropout': 0.10309680232203394, 'batch_norm': True, 'lr': 0.00036779033811644397, 'weight_decay': 8.513180806972329e-05, 'epochs': 154, 'loss': 'mae', 'optimizer': 'adam', 'graph_mode': 'off', 'use_snp_selection': False}. Best is trial 84 with value: 0.08996978047822614.
[I 2025-12-05 16:02:49,338] Trial 91 finished with value: 0.061684349245303985 and parameters: {'model_type': 'mlp', 'hidden_dims': '[128, 64]', 'dropout': 0.10774661130135996, 'batch_norm': True, 'lr': 0.00041348387645329506, 'weight_decay': 9.964490895541859e-05, 'epochs': 155, 'loss': 'mae', 'optimizer': 'adam', 'graph_mode': 'off', 'use_snp_selection': False}. Best is trial 84 with value: 0.08996978047822614.
[I 2025-12-05 16:02:50,275] Trial 92 finished with value: 0.06831290492134273 and parameters: {'model_type': 'mlp', 'hidden_dims': '[128, 64]', 'dropout': 0.14182983380749548, 'batch_norm': True, 'lr': 0.0005925606889932257, 'weight_decay': 5.194235012510515e-05, 'epochs': 169, 'loss': 'mae', 'optimizer': 'adam', 'graph_mode': 'off', 'use_snp_selection': False}. Best is trial 84 with value: 0.08996978047822614.
[I 2025-12-05 16:02:51,132] Trial 93 finished with value: 0.04929921552441601 and parameters: {'model_type': 'mlp', 'hidden_dims': '[128, 64]', 'dropout': 0.1791253177498679, 'batch_norm': True, 'lr': 0.00035826317474291013, 'weight_decay': 0.0005885221994101098, 'epochs': 147, 'loss': 'mae', 'optimizer': 'adam', 'graph_mode': 'off', 'use_snp_selection': False}. Best is trial 84 with value: 0.08996978047822614.
[I 2025-12-05 16:02:51,939] Trial 94 finished with value: 0.07721005821676061 and parameters: {'model_type': 'mlp', 'hidden_dims': '[128, 64]', 'dropout': 0.11953727704682196, 'batch_norm': True, 'lr': 0.00018348121742188997, 'weight_decay': 0.000316981337085348, 'epochs': 119, 'loss': 'mae', 'optimizer': 'adam', 'graph_mode': 'off', 'use_snp_selection': False}. Best is trial 84 with value: 0.08996978047822614.
[I 2025-12-05 16:02:52,786] Trial 95 finished with value: 0.057548171846286106 and parameters: {'model_type': 'mlp', 'hidden_dims': '[128, 64]', 'dropout': 0.11821724178368823, 'batch_norm': True, 'lr': 0.0001475330033800788, 'weight_decay': 0.00031860271753657776, 'epochs': 119, 'loss': 'mae', 'optimizer': 'adam', 'graph_mode': 'off', 'use_snp_selection': False}. Best is trial 84 with value: 0.08996978047822614.
[I 2025-12-05 16:02:53,582] Trial 96 finished with value: 0.06766773497276568 and parameters: {'model_type': 'mlp', 'hidden_dims': '[128, 64]', 'dropout': 0.10417018005362959, 'batch_norm': True, 'lr': 0.00019126334139593523, 'weight_decay': 0.00013986005081908636, 'epochs': 87, 'loss': 'mse', 'optimizer': 'adam', 'graph_mode': 'off', 'use_snp_selection': False}. Best is trial 84 with value: 0.08996978047822614.
[I 2025-12-05 16:02:54,403] Trial 97 finished with value: 0.038056547407366983 and parameters: {'model_type': 'mlp', 'hidden_dims': '[128, 64]', 'dropout': 0.10043223162823134, 'batch_norm': False, 'lr': 0.00017780778135235552, 'weight_decay': 7.204233072567974e-05, 'epochs': 114, 'loss': 'mae', 'optimizer': 'adam', 'graph_mode': 'off', 'use_snp_selection': False}. Best is trial 84 with value: 0.08996978047822614.
[I 2025-12-05 16:02:55,278] Trial 98 finished with value: 0.06488275414930877 and parameters: {'model_type': 'mlp', 'hidden_dims': '[128, 64]', 'dropout': 0.13209254727899422, 'batch_norm': True, 'lr': 0.0001094707366311446, 'weight_decay': 0.0008414677134047223, 'epochs': 138, 'loss': 'mae', 'optimizer': 'adam', 'graph_mode': 'off', 'use_snp_selection': False}. Best is trial 84 with value: 0.08996978047822614.
