[I 2025-12-05 15:37:16,442] Trial 50 finished with value: 0.3561028332836825 and parameters: {'model_type': 'mlp', 'hidden_dims': '[512, 128]', 'dropout': 0.1917588286418651, 'batch_norm': False, 'lr': 2.4974717997840875e-06, 'weight_decay': 0.00029313024160848187, 'epochs': 230, 'loss': 'mae', 'optimizer': 'adam', 'graph_mode': 'off', 'use_snp_selection': True, 'num_snps': 59919}. Best is trial 42 with value: 0.36431438077416745.
[I 2025-12-05 15:38:29,344] Trial 51 finished with value: 0.3594343320197345 and parameters: {'model_type': 'mlp', 'hidden_dims': '[512, 128]', 'dropout': 0.4861719813029009, 'batch_norm': False, 'lr': 4.049263217628792e-06, 'weight_decay': 6.028091946291363e-05, 'epochs': 202, 'loss': 'mse', 'optimizer': 'adam', 'graph_mode': 'off', 'use_snp_selection': True, 'num_snps': 55799}. Best is trial 42 with value: 0.36431438077416745.
[I 2025-12-05 15:39:41,244] Trial 52 finished with value: 0.3631418626223322 and parameters: {'model_type': 'mlp', 'hidden_dims': '[512, 128]', 'dropout': 0.5249527336404511, 'batch_norm': False, 'lr': 3.2687304638073048e-06, 'weight_decay': 0.00015839119957744522, 'epochs': 194, 'loss': 'mse', 'optimizer': 'adam', 'graph_mode': 'off', 'use_snp_selection': True, 'num_snps': 56458}. Best is trial 42 with value: 0.36431438077416745.
[I 2025-12-05 15:40:49,055] Trial 53 finished with value: 0.3647281037504135 and parameters: {'model_type': 'mlp', 'hidden_dims': '[512, 128]', 'dropout': 0.5540278301213197, 'batch_norm': False, 'lr': 3.1307314266909847e-06, 'weight_decay': 0.0001723127116258933, 'epochs': 168, 'loss': 'mse', 'optimizer': 'adam', 'graph_mode': 'off', 'use_snp_selection': True, 'num_snps': 57230}. Best is trial 53 with value: 0.3647281037504135.
[I 2025-12-05 15:41:52,369] Trial 54 finished with value: 0.35714466717465443 and parameters: {'model_type': 'mlp', 'hidden_dims': '[512, 128]', 'dropout': 0.5714025205285748, 'batch_norm': False, 'lr': 1.6713913390037098e-06, 'weight_decay': 0.00025103407846868616, 'epochs': 171, 'loss': 'mse', 'optimizer': 'adam', 'graph_mode': 'off', 'use_snp_selection': True, 'num_snps': 51036}. Best is trial 53 with value: 0.3647281037504135.
[I 2025-12-05 15:43:03,818] Trial 55 finished with value: 0.34799519077072105 and parameters: {'model_type': 'mlp', 'hidden_dims': '[512, 128]', 'dropout': 0.5224448809103084, 'batch_norm': False, 'lr': 9.34517773090313e-06, 'weight_decay': 0.0005806242734947204, 'epochs': 179, 'loss': 'mse', 'optimizer': 'adam', 'graph_mode': 'off', 'use_snp_selection': True, 'num_snps': 59018}. Best is trial 53 with value: 0.3647281037504135.
[I 2025-12-05 15:43:56,697] Trial 56 finished with value: 0.265782764875008 and parameters: {'model_type': 'mlp', 'hidden_dims': '[512, 128]', 'dropout': 0.5142476363532219, 'batch_norm': False, 'lr': 0.00043133481604813837, 'weight_decay': 0.00017973884249582552, 'epochs': 130, 'loss': 'mse', 'optimizer': 'adam', 'graph_mode': 'off', 'use_snp_selection': True, 'num_snps': 45760}. Best is trial 53 with value: 0.3647281037504135.
[I 2025-12-05 15:44:59,148] Trial 57 finished with value: 0.2749538797942849 and parameters: {'model_type': 'mlp', 'hidden_dims': '[512, 256]', 'dropout': 0.5525278546284449, 'batch_norm': True, 'lr': 1.2471390240308362e-06, 'weight_decay': 0.00010380188879397111, 'epochs': 162, 'loss': 'mse', 'optimizer': 'adam', 'graph_mode': 'off', 'use_snp_selection': True, 'num_snps': 51208}. Best is trial 53 with value: 0.3647281037504135.
[I 2025-12-05 15:45:30,186] Trial 58 finished with value: 0.35782721164151265 and parameters: {'model_type': 'mlp', 'hidden_dims': '[512, 128]', 'dropout': 0.3241618777015958, 'batch_norm': False, 'lr': 2.99838284105587e-06, 'weight_decay': 0.0004316752654164099, 'epochs': 136, 'loss': 'mse', 'optimizer': 'adam', 'graph_mode': 'off', 'use_snp_selection': False}. Best is trial 53 with value: 0.3647281037504135.
[I 2025-12-05 15:46:45,844] Trial 59 finished with value: 0.36039602208240606 and parameters: {'model_type': 'mlp', 'hidden_dims': '[512, 128]', 'dropout': 0.5953611152615588, 'batch_norm': False, 'lr': 5.282562589381427e-06, 'weight_decay': 3.143554158445884e-05, 'epochs': 212, 'loss': 'mse', 'optimizer': 'adam', 'graph_mode': 'off', 'use_snp_selection': True, 'num_snps': 57481}. Best is trial 53 with value: 0.3647281037504135.
[I 2025-12-05 15:47:42,740] Trial 60 finished with value: 0.35766359349694066 and parameters: {'model_type': 'mlp', 'hidden_dims': '[256, 128]', 'dropout': 0.5101647429123782, 'batch_norm': False, 'lr': 2.2513504616662722e-06, 'weight_decay': 1.61242940267585e-05, 'epochs': 239, 'loss': 'mse', 'optimizer': 'adam', 'graph_mode': 'off', 'use_snp_selection': True, 'num_snps': 53021}. Best is trial 53 with value: 0.3647281037504135.
[I 2025-12-05 15:49:00,397] Trial 61 finished with value: 0.3597234151552315 and parameters: {'model_type': 'mlp', 'hidden_dims': '[512, 64]', 'dropout': 0.5764887955313078, 'batch_norm': False, 'lr': 2.6509198377882728e-06, 'weight_decay': 0.00015506638654100253, 'epochs': 225, 'loss': 'mae', 'optimizer': 'adam', 'graph_mode': 'off', 'use_snp_selection': True, 'num_snps': 57624}. Best is trial 53 with value: 0.3647281037504135.
[I 2025-12-05 15:50:14,809] Trial 62 finished with value: 0.3673121891396239 and parameters: {'model_type': 'mlp', 'hidden_dims': '[512, 64]', 'dropout': 0.45030185723712446, 'batch_norm': False, 'lr': 3.3869135883456143e-06, 'weight_decay': 0.00013931414757318704, 'epochs': 191, 'loss': 'mae', 'optimizer': 'adam', 'graph_mode': 'off', 'use_snp_selection': True, 'num_snps': 59890}. Best is trial 62 with value: 0.3673121891396239.
[I 2025-12-05 15:51:29,516] Trial 63 finished with value: 0.35599688024072523 and parameters: {'model_type': 'mlp', 'hidden_dims': '[512, 256]', 'dropout': 0.40257352594501405, 'batch_norm': False, 'lr': 3.216716917282494e-06, 'weight_decay': 7.162750568730144e-05, 'epochs': 192, 'loss': 'mse', 'optimizer': 'adam', 'graph_mode': 'off', 'use_snp_selection': True, 'num_snps': 59710}. Best is trial 62 with value: 0.3673121891396239.
[I 2025-12-05 15:52:30,481] Trial 64 finished with value: 0.3462375746194519 and parameters: {'model_type': 'mlp', 'hidden_dims': '[512, 64]', 'dropout': 0.4508576918611865, 'batch_norm': False, 'lr': 2.069124160144598e-06, 'weight_decay': 0.00029778121981675486, 'epochs': 159, 'loss': 'mae', 'optimizer': 'adam', 'graph_mode': 'off', 'use_snp_selection': True, 'num_snps': 50386}. Best is trial 62 with value: 0.3673121891396239.
[I 2025-12-05 15:53:37,077] Trial 65 finished with value: 0.35540651402689133 and parameters: {'model_type': 'mlp', 'hidden_dims': '[512, 128]', 'dropout': 0.3747455036084859, 'batch_norm': False, 'lr': 5.101269478394778e-06, 'weight_decay': 0.00012197853773343381, 'epochs': 182, 'loss': 'mae', 'optimizer': 'adam', 'graph_mode': 'off', 'use_snp_selection': True, 'num_snps': 54556}. Best is trial 62 with value: 0.3673121891396239.
[I 2025-12-05 15:53:53,771] Trial 66 finished with value: 0.3198296591417103 and parameters: {'model_type': 'mlp', 'hidden_dims': '[128, 64]', 'dropout': 0.5355518148982933, 'batch_norm': False, 'lr': 1.7898169750896547e-06, 'weight_decay': 0.0002306741986484227, 'epochs': 211, 'loss': 'mae', 'optimizer': 'adam', 'graph_mode': 'off', 'use_snp_selection': False}. Best is trial 62 with value: 0.3673121891396239.
[I 2025-12-05 15:55:06,577] Trial 67 finished with value: 0.35085276382752734 and parameters: {'model_type': 'mlp', 'hidden_dims': '[512, 128]', 'dropout': 0.3588505805817713, 'batch_norm': False, 'lr': 7.809107879116562e-06, 'weight_decay': 0.0007012648049933777, 'epochs': 196, 'loss': 'mae', 'optimizer': 'adam', 'graph_mode': 'off', 'use_snp_selection': True, 'num_snps': 57408}. Best is trial 62 with value: 0.3673121891396239.
[I 2025-12-05 15:56:26,894] Trial 68 finished with value: 0.33142495825169405 and parameters: {'model_type': 'mlp', 'hidden_dims': '[512, 64]', 'dropout': 0.3479708086147786, 'batch_norm': False, 'lr': 1.1341177194479852e-05, 'weight_decay': 1.8476270700468697e-07, 'epochs': 261, 'loss': 'mse', 'optimizer': 'adam', 'graph_mode': 'off', 'use_snp_selection': True, 'num_snps': 53939}. Best is trial 62 with value: 0.3673121891396239.
[I 2025-12-05 15:58:05,636] Trial 69 finished with value: 0.35834601586576864 and parameters: {'model_type': 'mlp', 'hidden_dims': '[512, 256]', 'dropout': 0.3120819420349117, 'batch_norm': False, 'lr': 1.1555068871911579e-06, 'weight_decay': 0.0003523773915965161, 'epochs': 319, 'loss': 'mae', 'optimizer': 'adam', 'graph_mode': 'off', 'use_snp_selection': True, 'num_snps': 59816}. Best is trial 62 with value: 0.3673121891396239.
[I 2025-12-05 15:59:08,399] Trial 70 finished with value: 0.36162264490666157 and parameters: {'model_type': 'mlp', 'hidden_dims': '[512, 128]', 'dropout': 0.49399557510739006, 'batch_norm': False, 'lr': 6.42698042083882e-06, 'weight_decay': 1.8166778342040887e-06, 'epochs': 142, 'loss': 'mae', 'optimizer': 'adam', 'graph_mode': 'off', 'use_snp_selection': True, 'num_snps': 55877}. Best is trial 62 with value: 0.3673121891396239.
[I 2025-12-05 16:00:16,488] Trial 71 finished with value: 0.361096847852202 and parameters: {'model_type': 'mlp', 'hidden_dims': '[512, 128]', 'dropout': 0.4969747559696198, 'batch_norm': False, 'lr': 3.4982325730612165e-06, 'weight_decay': 1.2451085265363092e-06, 'epochs': 174, 'loss': 'mae', 'optimizer': 'adam', 'graph_mode': 'off', 'use_snp_selection': True, 'num_snps': 55890}. Best is trial 62 with value: 0.3673121891396239.
[I 2025-12-05 16:01:10,478] Trial 72 finished with value: 0.36089341634692657 and parameters: {'model_type': 'mlp', 'hidden_dims': '[512, 128]', 'dropout': 0.44459439192504835, 'batch_norm': False, 'lr': 6.204558566799271e-06, 'weight_decay': 0.0001573003612018611, 'epochs': 103, 'loss': 'mae', 'optimizer': 'adam', 'graph_mode': 'off', 'use_snp_selection': True, 'num_snps': 52728}. Best is trial 62 with value: 0.3673121891396239.
[I 2025-12-05 16:02:13,559] Trial 73 finished with value: 0.3499051550805442 and parameters: {'model_type': 'mlp', 'hidden_dims': '[512, 128]', 'dropout': 0.46921506617490566, 'batch_norm': False, 'lr': 2.6561549573564387e-06, 'weight_decay': 3.721814902450449e-06, 'epochs': 139, 'loss': 'mae', 'optimizer': 'adam', 'graph_mode': 'off', 'use_snp_selection': True, 'num_snps': 57541}. Best is trial 62 with value: 0.3673121891396239.
[I 2025-12-05 16:03:08,811] Trial 74 finished with value: 0.3575342654750191 and parameters: {'model_type': 'mlp', 'hidden_dims': '[512, 128]', 'dropout': 0.5564122059005272, 'batch_norm': False, 'lr': 4.7620321505001995e-06, 'weight_decay': 1.0810953339778202e-06, 'epochs': 120, 'loss': 'mae', 'optimizer': 'adam', 'graph_mode': 'off', 'use_snp_selection': True, 'num_snps': 50477}. Best is trial 62 with value: 0.3673121891396239.
[I 2025-12-05 16:04:01,974] Trial 75 finished with value: 0.35944639012458623 and parameters: {'model_type': 'mlp', 'hidden_dims': '[256, 128]', 'dropout': 0.5195661990884617, 'batch_norm': False, 'lr': 3.3428566792741717e-06, 'weight_decay': 7.446752802764217e-06, 'epochs': 188, 'loss': 'mae', 'optimizer': 'adam', 'graph_mode': 'off', 'use_snp_selection': True, 'num_snps': 54956}. Best is trial 62 with value: 0.3673121891396239.
[I 2025-12-05 16:04:46,591] Trial 76 finished with value: 0.3632635478815279 and parameters: {'model_type': 'mlp', 'hidden_dims': '[512, 64]', 'dropout': 0.3401607278356506, 'batch_norm': False, 'lr': 4.356537887555184e-06, 'weight_decay': 0.00010770719933609187, 'epochs': 152, 'loss': 'mae', 'optimizer': 'adam', 'graph_mode': 'off', 'use_snp_selection': True, 'num_snps': 30549}. Best is trial 62 with value: 0.3673121891396239.
[I 2025-12-05 16:05:19,407] Trial 77 finished with value: 0.36006299705790823 and parameters: {'model_type': 'mlp', 'hidden_dims': '[512, 64]', 'dropout': 0.25952584114994104, 'batch_norm': False, 'lr': 4.280758861364025e-06, 'weight_decay': 5.035662147826926e-07, 'epochs': 146, 'loss': 'mae', 'optimizer': 'adam', 'graph_mode': 'off', 'use_snp_selection': False}. Best is trial 62 with value: 0.3673121891396239.
[I 2025-12-05 16:06:05,765] Trial 78 finished with value: 0.3255279506879568 and parameters: {'model_type': 'mlp', 'hidden_dims': '[512, 64]', 'dropout': 0.4860559772614043, 'batch_norm': True, 'lr': 1.3985908483613083e-05, 'weight_decay': 4.355426054821804e-05, 'epochs': 155, 'loss': 'mae', 'optimizer': 'adam', 'graph_mode': 'off', 'use_snp_selection': True, 'num_snps': 31701}. Best is trial 62 with value: 0.3673121891396239.
[I 2025-12-05 16:06:45,568] Trial 79 finished with value: 0.3395958666094796 and parameters: {'model_type': 'mlp', 'hidden_dims': '[512, 64]', 'dropout': 0.5027554353563235, 'batch_norm': False, 'lr': 4.3319313080963454e-05, 'weight_decay': 2.3461683157846664e-06, 'epochs': 114, 'loss': 'mse', 'optimizer': 'adam', 'graph_mode': 'off', 'use_snp_selection': True, 'num_snps': 28484}. Best is trial 62 with value: 0.3673121891396239.
[I 2025-12-05 16:07:35,929] Trial 80 finished with value: 0.3628729842577549 and parameters: {'model_type': 'mlp', 'hidden_dims': '[512, 64]', 'dropout': 0.5431553521330457, 'batch_norm': False, 'lr': 6.9767326976481945e-06, 'weight_decay': 9.611451116703738e-05, 'epochs': 166, 'loss': 'mae', 'optimizer': 'adam', 'graph_mode': 'off', 'use_snp_selection': True, 'num_snps': 36279}. Best is trial 62 with value: 0.3673121891396239.
[I 2025-12-05 16:08:26,341] Trial 81 finished with value: 0.36095973719805324 and parameters: {'model_type': 'mlp', 'hidden_dims': '[512, 64]', 'dropout': 0.5314316188514185, 'batch_norm': False, 'lr': 4.518358777897e-06, 'weight_decay': 0.00010861923513534579, 'epochs': 178, 'loss': 'mae', 'optimizer': 'adam', 'graph_mode': 'off', 'use_snp_selection': True, 'num_snps': 34744}. Best is trial 62 with value: 0.3673121891396239.
[I 2025-12-05 16:09:12,492] Trial 82 finished with value: 0.35408544300294015 and parameters: {'model_type': 'mlp', 'hidden_dims': '[512, 64]', 'dropout': 0.43712492838605044, 'batch_norm': False, 'lr': 6.004002929136947e-06, 'weight_decay': 7.64184148845599e-05, 'epochs': 170, 'loss': 'mae', 'optimizer': 'adam', 'graph_mode': 'off', 'use_snp_selection': True, 'num_snps': 29972}. Best is trial 62 with value: 0.3673121891396239.
[I 2025-12-05 16:09:51,675] Trial 83 finished with value: 0.3588886934602814 and parameters: {'model_type': 'mlp', 'hidden_dims': '[512, 64]', 'dropout': 0.5421133296358074, 'batch_norm': False, 'lr': 7.054406987864773e-06, 'weight_decay': 8.92496342115389e-05, 'epochs': 139, 'loss': 'mae', 'optimizer': 'adam', 'graph_mode': 'off', 'use_snp_selection': True, 'num_snps': 24499}. Best is trial 62 with value: 0.3673121891396239.
[I 2025-12-05 16:10:27,543] Trial 84 finished with value: 0.29557600161499864 and parameters: {'model_type': 'mlp', 'hidden_dims': '[128, 64]', 'dropout': 0.5695181479856148, 'batch_norm': False, 'lr': 2.021279347530682e-06, 'weight_decay': 0.0001677830919886837, 'epochs': 163, 'loss': 'mae', 'optimizer': 'adam', 'graph_mode': 'off', 'use_snp_selection': True, 'num_snps': 33973}. Best is trial 62 with value: 0.3673121891396239.
[I 2025-12-05 16:11:29,002] Trial 85 finished with value: 0.35390864426691826 and parameters: {'model_type': 'mlp', 'hidden_dims': '[512, 256]', 'dropout': 0.34016404642462245, 'batch_norm': False, 'lr': 8.582470358732798e-06, 'weight_decay': 0.0001315345922455284, 'epochs': 149, 'loss': 'mae', 'optimizer': 'adam', 'graph_mode': 'off', 'use_snp_selection': True, 'num_snps': 53155}. Best is trial 62 with value: 0.3673121891396239.
[I 2025-12-05 16:12:12,035] Trial 86 finished with value: 0.34923754440583366 and parameters: {'model_type': 'mlp', 'hidden_dims': '[512, 64]', 'dropout': 0.31145755025410926, 'batch_norm': False, 'lr': 2.341187703607331e-06, 'weight_decay': 0.00019768251801928876, 'epochs': 69, 'loss': 'mae', 'optimizer': 'adam', 'graph_mode': 'off', 'use_snp_selection': True, 'num_snps': 41705}. Best is trial 62 with value: 0.3673121891396239.
[I 2025-12-05 16:12:56,866] Trial 87 finished with value: 0.34725605175413043 and parameters: {'model_type': 'mlp', 'hidden_dims': '[512, 64]', 'dropout': 0.47129930195762954, 'batch_norm': False, 'lr': 1.5945612647052885e-05, 'weight_decay': 3.1685620115668266e-05, 'epochs': 188, 'loss': 'mae', 'optimizer': 'adam', 'graph_mode': 'off', 'use_snp_selection': True, 'num_snps': 26951}. Best is trial 62 with value: 0.3673121891396239.
[I 2025-12-05 16:13:44,115] Trial 88 finished with value: 0.28749632285202287 and parameters: {'model_type': 'mlp', 'hidden_dims': '[512, 256]', 'dropout': 0.41330166945490016, 'batch_norm': True, 'lr': 1.4272267165126254e-06, 'weight_decay': 4.636291573842756e-05, 'epochs': 127, 'loss': 'mae', 'optimizer': 'adam', 'graph_mode': 'off', 'use_snp_selection': True, 'num_snps': 36733}. Best is trial 62 with value: 0.3673121891396239.
[I 2025-12-05 16:14:17,461] Trial 89 finished with value: 0.3455001797719648 and parameters: {'model_type': 'mlp', 'hidden_dims': '[512, 64]', 'dropout': 0.5502322801086615, 'batch_norm': False, 'lr': 3.4721946538246666e-06, 'weight_decay': 0.00010252082536284731, 'epochs': 167, 'loss': 'mse', 'optimizer': 'adam', 'graph_mode': 'off', 'use_snp_selection': True, 'num_snps': 14606}. Best is trial 62 with value: 0.3673121891396239.
[I 2025-12-05 16:15:00,448] Trial 90 finished with value: 0.35892460962931894 and parameters: {'model_type': 'mlp', 'hidden_dims': '[512, 128]', 'dropout': 0.5816860423844393, 'batch_norm': False, 'lr': 5.362638011883317e-06, 'weight_decay': 9.042866432544884e-07, 'epochs': 201, 'loss': 'mae', 'optimizer': 'adam', 'graph_mode': 'off', 'use_snp_selection': False}. Best is trial 62 with value: 0.3673121891396239.
[I 2025-12-05 16:16:18,132] Trial 91 finished with value: 0.3605095093881087 and parameters: {'model_type': 'mlp', 'hidden_dims': '[512, 128]', 'dropout': 0.389514658523575, 'batch_norm': False, 'lr': 2.910520538420696e-06, 'weight_decay': 0.00024189887583216723, 'epochs': 217, 'loss': 'mae', 'optimizer': 'adam', 'graph_mode': 'off', 'use_snp_selection': True, 'num_snps': 58683}. Best is trial 62 with value: 0.3673121891396239.
[I 2025-12-05 16:17:15,530] Trial 92 finished with value: 0.3562230771251589 and parameters: {'model_type': 'mlp', 'hidden_dims': '[512, 128]', 'dropout': 0.37309835910526845, 'batch_norm': False, 'lr': 1.7337133677568173e-06, 'weight_decay': 0.00013771334080118363, 'epochs': 205, 'loss': 'mae', 'optimizer': 'adam', 'graph_mode': 'off', 'use_snp_selection': True, 'num_snps': 38884}. Best is trial 62 with value: 0.3673121891396239.
[I 2025-12-05 16:18:33,417] Trial 93 finished with value: 0.3609553211588973 and parameters: {'model_type': 'mlp', 'hidden_dims': '[512, 128]', 'dropout': 0.5239230620812837, 'batch_norm': False, 'lr': 4.025027816102555e-06, 'weight_decay': 0.00036003942848617583, 'epochs': 232, 'loss': 'mae', 'optimizer': 'adam', 'graph_mode': 'off', 'use_snp_selection': True, 'num_snps': 55771}. Best is trial 62 with value: 0.3673121891396239.
[I 2025-12-05 16:19:56,576] Trial 94 finished with value: 0.34721625892086216 and parameters: {'model_type': 'mlp', 'hidden_dims': '[512, 128]', 'dropout': 0.35737742766723035, 'batch_norm': False, 'lr': 1.0644369764415128e-05, 'weight_decay': 0.00020734765766850552, 'epochs': 248, 'loss': 'mae', 'optimizer': 'adam', 'graph_mode': 'off', 'use_snp_selection': True, 'num_snps': 58346}. Best is trial 62 with value: 0.3673121891396239.
[I 2025-12-05 16:21:07,654] Trial 95 finished with value: 0.3590832967548475 and parameters: {'model_type': 'mlp', 'hidden_dims': '[512, 128]', 'dropout': 0.34573669579299815, 'batch_norm': False, 'lr': 2.539980727374222e-06, 'weight_decay': 6.803395168567573e-05, 'epochs': 193, 'loss': 'mae', 'optimizer': 'adam', 'graph_mode': 'off', 'use_snp_selection': True, 'num_snps': 56690}. Best is trial 62 with value: 0.3673121891396239.
[I 2025-12-05 16:21:55,981] Trial 96 finished with value: 0.3650050313099159 and parameters: {'model_type': 'mlp', 'hidden_dims': '[256, 128]', 'dropout': 0.31237400467593335, 'batch_norm': False, 'lr': 3.0284427479128574e-06, 'weight_decay': 0.00027496062018125714, 'epochs': 157, 'loss': 'mse', 'optimizer': 'adam', 'graph_mode': 'off', 'use_snp_selection': True, 'num_snps': 49722}. Best is trial 62 with value: 0.3673121891396239.
[I 2025-12-05 16:22:42,648] Trial 97 finished with value: 0.3574339560315326 and parameters: {'model_type': 'mlp', 'hidden_dims': '[256, 128]', 'dropout': 0.28761192853548584, 'batch_norm': False, 'lr': 4.493814885931869e-06, 'weight_decay': 0.0004510509812520682, 'epochs': 158, 'loss': 'mse', 'optimizer': 'adam', 'graph_mode': 'off', 'use_snp_selection': True, 'num_snps': 46502}. Best is trial 62 with value: 0.3673121891396239.
[I 2025-12-05 16:23:29,360] Trial 98 finished with value: 0.3555773533356883 and parameters: {'model_type': 'mlp', 'hidden_dims': '[256, 128]', 'dropout': 0.26962635549360436, 'batch_norm': False, 'lr': 3.209133781148876e-06, 'weight_decay': 8.19857433641697e-05, 'epochs': 142, 'loss': 'mse', 'optimizer': 'adam', 'graph_mode': 'off', 'use_snp_selection': True, 'num_snps': 49222}. Best is trial 62 with value: 0.3673121891396239.
[I 2025-12-05 16:24:16,338] Trial 99 finished with value: 0.35648526885026904 and parameters: {'model_type': 'mlp', 'hidden_dims': '[256, 128]', 'dropout': 0.5096816831948519, 'batch_norm': False, 'lr': 6.727815227425273e-06, 'weight_decay': 1.8858567787132718e-06, 'epochs': 183, 'loss': 'mse', 'optimizer': 'adam', 'graph_mode': 'off', 'use_snp_selection': True, 'num_snps': 44605}. Best is trial 62 with value: 0.3673121891396239.
