[I 2025-12-06 07:07:08,430] Trial 40 finished with value: 0.2812367968868361 and parameters: {'model_type': 'mlp', 'hidden_dims': '[512, 128]', 'dropout': 0.4086193780193275, 'batch_norm': False, 'lr': 5.530253426010415e-06, 'weight_decay': 1.3130542805847108e-05, 'epochs': 55, 'loss': 'mse', 'optimizer': 'adam', 'graph_mode': 'off', 'use_snp_selection': True, 'num_snps': 43676}. Best is trial 26 with value: 0.29975099303053165.
[I 2025-12-06 07:07:56,213] Trial 41 finished with value: 0.2924912911274555 and parameters: {'model_type': 'mlp', 'hidden_dims': '[512, 256]', 'dropout': 0.5636783119088086, 'batch_norm': False, 'lr': 3.601993328810964e-05, 'weight_decay': 1.4308426949158855e-06, 'epochs': 77, 'loss': 'mse', 'optimizer': 'adam', 'graph_mode': 'off', 'use_snp_selection': True, 'num_snps': 53731}. Best is trial 26 with value: 0.29975099303053165.
[I 2025-12-06 07:08:44,469] Trial 42 finished with value: 0.2971512123764188 and parameters: {'model_type': 'mlp', 'hidden_dims': '[512, 256]', 'dropout': 0.4656233333600565, 'batch_norm': False, 'lr': 2.8674476214240134e-05, 'weight_decay': 1.9246670367082308e-06, 'epochs': 80, 'loss': 'mse', 'optimizer': 'adam', 'graph_mode': 'off', 'use_snp_selection': True, 'num_snps': 54279}. Best is trial 26 with value: 0.29975099303053165.
[I 2025-12-06 07:09:31,513] Trial 43 finished with value: 0.29537869311226883 and parameters: {'model_type': 'mlp', 'hidden_dims': '[512, 256]', 'dropout': 0.4744409657805688, 'batch_norm': False, 'lr': 9.833521391551636e-05, 'weight_decay': 2.4006315190219657e-06, 'epochs': 70, 'loss': 'mse', 'optimizer': 'adam', 'graph_mode': 'off', 'use_snp_selection': True, 'num_snps': 54940}. Best is trial 26 with value: 0.29975099303053165.
[I 2025-12-06 07:10:19,777] Trial 44 finished with value: 0.29684396556916454 and parameters: {'model_type': 'mlp', 'hidden_dims': '[512, 256]', 'dropout': 0.4270630637621158, 'batch_norm': False, 'lr': 2.045463836627592e-05, 'weight_decay': 4.834547135135661e-06, 'epochs': 96, 'loss': 'mse', 'optimizer': 'adam', 'graph_mode': 'off', 'use_snp_selection': True, 'num_snps': 49416}. Best is trial 26 with value: 0.29975099303053165.
[I 2025-12-06 07:11:03,954] Trial 45 finished with value: 0.28352355503818083 and parameters: {'model_type': 'mlp', 'hidden_dims': '[512, 256]', 'dropout': 0.4636492452372732, 'batch_norm': False, 'lr': 1.101003140803764e-05, 'weight_decay': 6.503177336683e-07, 'epochs': 47, 'loss': 'mse', 'optimizer': 'adam', 'graph_mode': 'off', 'use_snp_selection': True, 'num_snps': 55325}. Best is trial 26 with value: 0.29975099303053165.
[I 2025-12-06 07:11:51,064] Trial 46 finished with value: 0.2867704053928721 and parameters: {'model_type': 'mlp', 'hidden_dims': '[256, 128]', 'dropout': 0.5942571762326717, 'batch_norm': True, 'lr': 4.8655765348390194e-05, 'weight_decay': 1.6291529061608463e-06, 'epochs': 109, 'loss': 'mse', 'optimizer': 'adam', 'graph_mode': 'off', 'use_snp_selection': True, 'num_snps': 59969}. Best is trial 26 with value: 0.29975099303053165.
[I 2025-12-06 07:12:40,417] Trial 47 finished with value: 0.2824977778493777 and parameters: {'model_type': 'mlp', 'hidden_dims': '[512, 256]', 'dropout': 0.5057502379750872, 'batch_norm': False, 'lr': 7.918495049550987e-05, 'weight_decay': 2.1342749792619217e-07, 'epochs': 142, 'loss': 'mse', 'optimizer': 'adam', 'graph_mode': 'off', 'use_snp_selection': True, 'num_snps': 41916}. Best is trial 26 with value: 0.29975099303053165.
[I 2025-12-06 07:13:27,932] Trial 48 finished with value: 0.29888573407281416 and parameters: {'model_type': 'mlp', 'hidden_dims': '[512, 256]', 'dropout': 0.5243377295413125, 'batch_norm': False, 'lr': 2.6835386676870912e-05, 'weight_decay': 5.355096074269689e-07, 'epochs': 92, 'loss': 'mse', 'optimizer': 'adam', 'graph_mode': 'off', 'use_snp_selection': True, 'num_snps': 49321}. Best is trial 26 with value: 0.29975099303053165.
[I 2025-12-06 07:14:28,515] Trial 49 finished with value: 0.28718111797279233 and parameters: {'model_type': 'mlp', 'hidden_dims': '[512, 128]', 'dropout': 0.5257635845315531, 'batch_norm': True, 'lr': 1.4066673334250197e-05, 'weight_decay': 4.830621982476726e-07, 'epochs': 196, 'loss': 'mse', 'optimizer': 'adam', 'graph_mode': 'off', 'use_snp_selection': True, 'num_snps': 47499}. Best is trial 26 with value: 0.29975099303053165.
[I 2025-12-06 07:15:04,369] Trial 50 finished with value: 0.29169161193754134 and parameters: {'model_type': 'mlp', 'hidden_dims': '[128, 64]', 'dropout': 0.495472842927052, 'batch_norm': False, 'lr': 6.7005439101697165e-06, 'weight_decay': 3.0467226027346483e-07, 'epochs': 153, 'loss': 'mse', 'optimizer': 'adam', 'graph_mode': 'off', 'use_snp_selection': True, 'num_snps': 37814}. Best is trial 26 with value: 0.29975099303053165.
[I 2025-12-06 07:15:54,962] Trial 51 finished with value: 0.29962534842666355 and parameters: {'model_type': 'mlp', 'hidden_dims': '[512, 256]', 'dropout': 0.4424180973261682, 'batch_norm': False, 'lr': 2.657644069998381e-05, 'weight_decay': 5.823556144858142e-07, 'epochs': 88, 'loss': 'mse', 'optimizer': 'adam', 'graph_mode': 'off', 'use_snp_selection': True, 'num_snps': 55921}. Best is trial 26 with value: 0.29975099303053165.
[I 2025-12-06 07:16:42,943] Trial 52 finished with value: 0.299740730907835 and parameters: {'model_type': 'mlp', 'hidden_dims': '[512, 256]', 'dropout': 0.44585054306129207, 'batch_norm': False, 'lr': 1.8589393278649824e-05, 'weight_decay': 8.541488609784569e-07, 'epochs': 71, 'loss': 'mse', 'optimizer': 'adam', 'graph_mode': 'off', 'use_snp_selection': True, 'num_snps': 55659}. Best is trial 26 with value: 0.29975099303053165.
[I 2025-12-06 07:17:27,255] Trial 53 finished with value: 0.28463253285772944 and parameters: {'model_type': 'mlp', 'hidden_dims': '[512, 256]', 'dropout': 0.4152807140717889, 'batch_norm': False, 'lr': 1.831286574021937e-05, 'weight_decay': 5.938477266010022e-07, 'epochs': 178, 'loss': 'mse', 'optimizer': 'adam', 'graph_mode': 'off', 'use_snp_selection': True, 'num_snps': 29738}. Best is trial 26 with value: 0.29975099303053165.
[I 2025-12-06 07:18:12,009] Trial 54 finished with value: 0.28483665486973886 and parameters: {'model_type': 'mlp', 'hidden_dims': '[512, 256]', 'dropout': 0.368084996652182, 'batch_norm': False, 'lr': 4.934167610967673e-05, 'weight_decay': 2.7887939930971803e-07, 'epochs': 97, 'loss': 'mae', 'optimizer': 'adam', 'graph_mode': 'off', 'use_snp_selection': True, 'num_snps': 43018}. Best is trial 26 with value: 0.29975099303053165.
[I 2025-12-06 07:19:07,793] Trial 55 finished with value: 0.2950389796292724 and parameters: {'model_type': 'mlp', 'hidden_dims': '[512, 256]', 'dropout': 0.4889610528228895, 'batch_norm': False, 'lr': 2.6672359871167386e-05, 'weight_decay': 1.291800207672846e-07, 'epochs': 122, 'loss': 'mse', 'optimizer': 'adam', 'graph_mode': 'off', 'use_snp_selection': True, 'num_snps': 55519}. Best is trial 26 with value: 0.29975099303053165.
[I 2025-12-06 07:19:46,419] Trial 56 finished with value: 0.2653013802053245 and parameters: {'model_type': 'mlp', 'hidden_dims': '[256, 128, 64]', 'dropout': 0.5816195039043838, 'batch_norm': False, 'lr': 1.8918890620960042e-05, 'weight_decay': 4.62975574316105e-07, 'epochs': 53, 'loss': 'mse', 'optimizer': 'adam', 'graph_mode': 'off', 'use_snp_selection': True, 'num_snps': 49812}. Best is trial 26 with value: 0.29975099303053165.
[I 2025-12-06 07:20:37,591] Trial 57 finished with value: 0.27304040066138235 and parameters: {'model_type': 'mlp', 'hidden_dims': '[512, 64]', 'dropout': 0.32573706748688264, 'batch_norm': True, 'lr': 8.263185867377376e-06, 'weight_decay': 7.878324030627085e-07, 'epochs': 90, 'loss': 'mse', 'optimizer': 'adam', 'graph_mode': 'off', 'use_snp_selection': True, 'num_snps': 55946}. Best is trial 26 with value: 0.29975099303053165.
[I 2025-12-06 07:21:43,275] Trial 58 finished with value: 0.28402191806248467 and parameters: {'model_type': 'mlp', 'hidden_dims': '[512, 256]', 'dropout': 0.5555521394926176, 'batch_norm': False, 'lr': 2.5097825499226688e-05, 'weight_decay': 3.1113125109705486e-06, 'epochs': 251, 'loss': 'mae', 'optimizer': 'adam', 'graph_mode': 'off', 'use_snp_selection': True, 'num_snps': 45590}. Best is trial 26 with value: 0.29975099303053165.
[I 2025-12-06 07:22:37,425] Trial 59 finished with value: 0.296622196725128 and parameters: {'model_type': 'mlp', 'hidden_dims': '[512, 256]', 'dropout': 0.44414608416783624, 'batch_norm': False, 'lr': 4.913703603094676e-06, 'weight_decay': 6.23236191111046e-07, 'epochs': 105, 'loss': 'mse', 'optimizer': 'adam', 'graph_mode': 'off', 'use_snp_selection': True, 'num_snps': 57061}. Best is trial 26 with value: 0.29975099303053165.
[I 2025-12-06 07:23:23,413] Trial 60 finished with value: 0.29837967376772456 and parameters: {'model_type': 'mlp', 'hidden_dims': '[512, 256]', 'dropout': 0.5194756094710269, 'batch_norm': False, 'lr': 1.6635474037414197e-05, 'weight_decay': 1.1384178602938935e-06, 'epochs': 76, 'loss': 'mse', 'optimizer': 'adam', 'graph_mode': 'off', 'use_snp_selection': True, 'num_snps': 50077}. Best is trial 26 with value: 0.29975099303053165.
[I 2025-12-06 07:24:09,660] Trial 61 finished with value: 0.2934285689187771 and parameters: {'model_type': 'mlp', 'hidden_dims': '[512, 256]', 'dropout': 0.5241092415982652, 'batch_norm': False, 'lr': 1.4758024283458296e-05, 'weight_decay': 1.2027881753822678e-06, 'epochs': 77, 'loss': 'mse', 'optimizer': 'adam', 'graph_mode': 'off', 'use_snp_selection': True, 'num_snps': 50199}. Best is trial 26 with value: 0.29975099303053165.
[I 2025-12-06 07:24:53,455] Trial 62 finished with value: 0.29525650104185047 and parameters: {'model_type': 'mlp', 'hidden_dims': '[512, 256]', 'dropout': 0.5137722717410939, 'batch_norm': False, 'lr': 1.1757053305630339e-05, 'weight_decay': 1.006396361458535e-06, 'epochs': 67, 'loss': 'mse', 'optimizer': 'adam', 'graph_mode': 'off', 'use_snp_selection': True, 'num_snps': 48163}. Best is trial 26 with value: 0.29975099303053165.
[I 2025-12-06 07:25:36,987] Trial 63 finished with value: 0.2811370555494141 and parameters: {'model_type': 'mlp', 'hidden_dims': '[512, 256]', 'dropout': 0.5376774064298715, 'batch_norm': False, 'lr': 1.622022536582511e-05, 'weight_decay': 0.00011981815216528063, 'epochs': 51, 'loss': 'mse', 'optimizer': 'adam', 'graph_mode': 'off', 'use_snp_selection': True, 'num_snps': 52325}. Best is trial 26 with value: 0.29975099303053165.
[I 2025-12-06 07:26:19,509] Trial 64 finished with value: 0.29817219436510756 and parameters: {'model_type': 'mlp', 'hidden_dims': '[512, 256]', 'dropout': 0.47837151140883066, 'batch_norm': False, 'lr': 8.510379583290376e-06, 'weight_decay': 0.0004917783154403117, 'epochs': 88, 'loss': 'mse', 'optimizer': 'adam', 'graph_mode': 'off', 'use_snp_selection': True, 'num_snps': 41022}. Best is trial 26 with value: 0.29975099303053165.
[I 2025-12-06 07:27:05,933] Trial 65 finished with value: 0.2938160515182661 and parameters: {'model_type': 'mlp', 'hidden_dims': '[512, 256]', 'dropout': 0.43721141149670306, 'batch_norm': False, 'lr': 3.106675253322531e-05, 'weight_decay': 0.0004968086964685885, 'epochs': 118, 'loss': 'mse', 'optimizer': 'adam', 'graph_mode': 'off', 'use_snp_selection': True, 'num_snps': 41615}. Best is trial 26 with value: 0.29975099303053165.
[I 2025-12-06 07:27:43,396] Trial 66 finished with value: 0.29057430929068045 and parameters: {'model_type': 'mlp', 'hidden_dims': '[512, 128]', 'dropout': 0.47850309522527523, 'batch_norm': False, 'lr': 4.3812230589251964e-05, 'weight_decay': 3.694578059862627e-05, 'epochs': 73, 'loss': 'mse', 'optimizer': 'adam', 'graph_mode': 'off', 'use_snp_selection': True, 'num_snps': 34040}. Best is trial 26 with value: 0.29975099303053165.
[I 2025-12-06 07:27:55,861] Trial 67 finished with value: 0.2217879732370256 and parameters: {'model_type': 'mlp', 'hidden_dims': '[512, 256]', 'dropout': 0.40188444553980035, 'batch_norm': False, 'lr': 5.827645635749302e-05, 'weight_decay': 8.010928890428728e-05, 'epochs': 42, 'loss': 'mae', 'optimizer': 'adam', 'graph_mode': 'off', 'use_snp_selection': False}. Best is trial 26 with value: 0.29975099303053165.
[I 2025-12-06 07:28:40,717] Trial 68 finished with value: 0.28994155414332773 and parameters: {'model_type': 'mlp', 'hidden_dims': '[512, 64]', 'dropout': 0.4999341399167001, 'batch_norm': True, 'lr': 2.4148956248466058e-05, 'weight_decay': 0.0009723175659163882, 'epochs': 87, 'loss': 'mse', 'optimizer': 'adam', 'graph_mode': 'off', 'use_snp_selection': True, 'num_snps': 45496}. Best is trial 26 with value: 0.29975099303053165.
[I 2025-12-06 07:29:16,023] Trial 69 finished with value: 0.2785046535908467 and parameters: {'model_type': 'mlp', 'hidden_dims': '[256, 128]', 'dropout': 0.48121587710365166, 'batch_norm': False, 'lr': 8.255890521954632e-06, 'weight_decay': 1.6594455244262465e-07, 'epochs': 59, 'loss': 'mse', 'optimizer': 'adam', 'graph_mode': 'off', 'use_snp_selection': True, 'num_snps': 40197}. Best is trial 26 with value: 0.29975099303053165.
[I 2025-12-06 07:30:10,062] Trial 70 finished with value: 0.29177703538762084 and parameters: {'model_type': 'mlp', 'hidden_dims': '[512, 256]', 'dropout': 0.4242425112583005, 'batch_norm': False, 'lr': 2.0593660728206476e-05, 'weight_decay': 0.00025882896914306176, 'epochs': 103, 'loss': 'mse', 'optimizer': 'adam', 'graph_mode': 'off', 'use_snp_selection': True, 'num_snps': 57571}. Best is trial 26 with value: 0.29975099303053165.
[I 2025-12-06 07:30:58,598] Trial 71 finished with value: 0.29681245846465154 and parameters: {'model_type': 'mlp', 'hidden_dims': '[512, 256]', 'dropout': 0.5443953577874564, 'batch_norm': False, 'lr': 8.79203703483209e-06, 'weight_decay': 4.4197252579818856e-07, 'epochs': 91, 'loss': 'mse', 'optimizer': 'adam', 'graph_mode': 'off', 'use_snp_selection': True, 'num_snps': 51036}. Best is trial 26 with value: 0.29975099303053165.
[I 2025-12-06 07:32:01,127] Trial 72 finished with value: 0.29201582403262416 and parameters: {'model_type': 'mlp', 'hidden_dims': '[512, 256]', 'dropout': 0.5701796371904181, 'batch_norm': False, 'lr': 1.2477248260469238e-05, 'weight_decay': 8.131160785320457e-07, 'epochs': 215, 'loss': 'mse', 'optimizer': 'adam', 'graph_mode': 'off', 'use_snp_selection': True, 'num_snps': 47174}. Best is trial 26 with value: 0.29975099303053165.
[I 2025-12-06 07:32:52,196] Trial 73 finished with value: 0.29456038102428195 and parameters: {'model_type': 'mlp', 'hidden_dims': '[512, 256]', 'dropout': 0.510769578465616, 'batch_norm': False, 'lr': 1.6721331394055052e-05, 'weight_decay': 7.086929277888204e-06, 'epochs': 85, 'loss': 'mse', 'optimizer': 'adam', 'graph_mode': 'off', 'use_snp_selection': True, 'num_snps': 57873}. Best is trial 26 with value: 0.29975099303053165.
[I 2025-12-06 07:33:41,080] Trial 74 finished with value: 0.293660595275629 and parameters: {'model_type': 'mlp', 'hidden_dims': '[128, 64]', 'dropout': 0.5799759337594427, 'batch_norm': False, 'lr': 6.075388773833298e-06, 'weight_decay': 3.442669590997774e-07, 'epochs': 323, 'loss': 'mse', 'optimizer': 'adam', 'graph_mode': 'off', 'use_snp_selection': True, 'num_snps': 53697}. Best is trial 26 with value: 0.29975099303053165.
[I 2025-12-06 07:34:16,373] Trial 75 finished with value: 0.28433978278399047 and parameters: {'model_type': 'mlp', 'hidden_dims': '[512, 256]', 'dropout': 0.5298499123153876, 'batch_norm': False, 'lr': 3.2140084347649864e-05, 'weight_decay': 1.3968506085948114e-06, 'epochs': 114, 'loss': 'mse', 'optimizer': 'adam', 'graph_mode': 'off', 'use_snp_selection': True, 'num_snps': 24043}. Best is trial 26 with value: 0.29975099303053165.
[I 2025-12-06 07:34:33,040] Trial 76 finished with value: 0.2909912215120494 and parameters: {'model_type': 'mlp', 'hidden_dims': '[512, 256]', 'dropout': 0.5537377461869274, 'batch_norm': False, 'lr': 1.180799527515378e-05, 'weight_decay': 2.0014140205040338e-06, 'epochs': 66, 'loss': 'mse', 'optimizer': 'adam', 'graph_mode': 'off', 'use_snp_selection': False}. Best is trial 26 with value: 0.29975099303053165.
[I 2025-12-06 07:35:11,585] Trial 77 finished with value: 0.28833126161742784 and parameters: {'model_type': 'mlp', 'hidden_dims': '[256, 128, 64]', 'dropout': 0.4466818946831901, 'batch_norm': False, 'lr': 2.1967243402087326e-05, 'weight_decay': 4.027863910114099e-06, 'epochs': 74, 'loss': 'mse', 'optimizer': 'adam', 'graph_mode': 'off', 'use_snp_selection': True, 'num_snps': 45274}. Best is trial 26 with value: 0.29975099303053165.
[I 2025-12-06 07:36:02,031] Trial 78 finished with value: 0.290548894155689 and parameters: {'model_type': 'mlp', 'hidden_dims': '[512, 256]', 'dropout': 0.4630941691105743, 'batch_norm': False, 'lr': 1.5809150541624018e-05, 'weight_decay': 2.631124395904627e-06, 'epochs': 101, 'loss': 'mae', 'optimizer': 'adam', 'graph_mode': 'off', 'use_snp_selection': True, 'num_snps': 51746}. Best is trial 26 with value: 0.29975099303053165.
[I 2025-12-06 07:36:45,399] Trial 79 finished with value: 0.2775833787379708 and parameters: {'model_type': 'mlp', 'hidden_dims': '[512, 256]', 'dropout': 0.5997311176801983, 'batch_norm': False, 'lr': 4.902772055552898e-06, 'weight_decay': 5.719748370878315e-07, 'epochs': 61, 'loss': 'mse', 'optimizer': 'adam', 'graph_mode': 'off', 'use_snp_selection': True, 'num_snps': 48703}. Best is trial 26 with value: 0.29975099303053165.
[I 2025-12-06 07:37:45,668] Trial 80 finished with value: 0.3014506697026106 and parameters: {'model_type': 'mlp', 'hidden_dims': '[512, 256]', 'dropout': 0.4930278291024396, 'batch_norm': False, 'lr': 1.0025754031296694e-05, 'weight_decay': 9.733821119622075e-07, 'epochs': 133, 'loss': 'mse', 'optimizer': 'adam', 'graph_mode': 'off', 'use_snp_selection': True, 'num_snps': 59535}. Best is trial 80 with value: 0.3014506697026106.
[I 2025-12-06 07:38:45,146] Trial 81 finished with value: 0.2960148033920261 and parameters: {'model_type': 'mlp', 'hidden_dims': '[512, 256]', 'dropout': 0.4891511408219942, 'batch_norm': False, 'lr': 1.0136002330321656e-05, 'weight_decay': 1.0794067888270974e-06, 'epochs': 130, 'loss': 'mse', 'optimizer': 'adam', 'graph_mode': 'off', 'use_snp_selection': True, 'num_snps': 58829}. Best is trial 80 with value: 0.3014506697026106.
[I 2025-12-06 07:39:35,656] Trial 82 finished with value: 0.29411845492520355 and parameters: {'model_type': 'mlp', 'hidden_dims': '[512, 256]', 'dropout': 0.5186061744233713, 'batch_norm': False, 'lr': 7.723713902090464e-06, 'weight_decay': 9.121483544624449e-07, 'epochs': 83, 'loss': 'mse', 'optimizer': 'adam', 'graph_mode': 'off', 'use_snp_selection': True, 'num_snps': 56749}. Best is trial 80 with value: 0.3014506697026106.
[I 2025-12-06 07:40:25,825] Trial 83 finished with value: 0.30127058112741106 and parameters: {'model_type': 'mlp', 'hidden_dims': '[512, 256]', 'dropout': 0.25213002451315664, 'batch_norm': False, 'lr': 1.350161392416075e-05, 'weight_decay': 1.8109974742483603e-06, 'epochs': 90, 'loss': 'mse', 'optimizer': 'adam', 'graph_mode': 'off', 'use_snp_selection': True, 'num_snps': 54324}. Best is trial 80 with value: 0.3014506697026106.
[I 2025-12-06 07:41:11,865] Trial 84 finished with value: 0.2913527337525214 and parameters: {'model_type': 'mlp', 'hidden_dims': '[512, 256]', 'dropout': 0.14306258852530718, 'batch_norm': False, 'lr': 1.4427076222857112e-05, 'weight_decay': 1.710596941515364e-06, 'epochs': 47, 'loss': 'mse', 'optimizer': 'adam', 'graph_mode': 'off', 'use_snp_selection': True, 'num_snps': 59336}. Best is trial 80 with value: 0.3014506697026106.
[I 2025-12-06 07:41:59,430] Trial 85 finished with value: 0.3011612995010913 and parameters: {'model_type': 'mlp', 'hidden_dims': '[512, 256]', 'dropout': 0.26300958786198314, 'batch_norm': False, 'lr': 1.2775554179281577e-05, 'weight_decay': 2.5863783296665344e-07, 'epochs': 73, 'loss': 'mse', 'optimizer': 'adam', 'graph_mode': 'off', 'use_snp_selection': True, 'num_snps': 54174}. Best is trial 80 with value: 0.3014506697026106.
[I 2025-12-06 07:42:47,732] Trial 86 finished with value: 0.28270152473829097 and parameters: {'model_type': 'mlp', 'hidden_dims': '[512, 256]', 'dropout': 0.2082841620862962, 'batch_norm': True, 'lr': 3.249856972654852e-05, 'weight_decay': 2.738786137720347e-07, 'epochs': 72, 'loss': 'mse', 'optimizer': 'adam', 'graph_mode': 'off', 'use_snp_selection': True, 'num_snps': 55625}. Best is trial 80 with value: 0.3014506697026106.
[I 2025-12-06 07:43:32,204] Trial 87 finished with value: 0.270049068308909 and parameters: {'model_type': 'mlp', 'hidden_dims': '[512, 128]', 'dropout': 0.2495998219859837, 'batch_norm': False, 'lr': 0.0009759757218298173, 'weight_decay': 3.8254088963014156e-07, 'epochs': 54, 'loss': 'mse', 'optimizer': 'adam', 'graph_mode': 'off', 'use_snp_selection': True, 'num_snps': 53794}. Best is trial 80 with value: 0.3014506697026106.
[I 2025-12-06 07:43:44,016] Trial 88 finished with value: 0.29673783642690416 and parameters: {'model_type': 'mlp', 'hidden_dims': '[256, 128]', 'dropout': 0.2748278526216552, 'batch_norm': False, 'lr': 1.884805738813636e-05, 'weight_decay': 7.426700163059975e-07, 'epochs': 79, 'loss': 'mse', 'optimizer': 'adam', 'graph_mode': 'off', 'use_snp_selection': False}. Best is trial 80 with value: 0.3014506697026106.
[I 2025-12-06 07:44:29,021] Trial 89 finished with value: 0.27698208066602514 and parameters: {'model_type': 'mlp', 'hidden_dims': '[512, 256]', 'dropout': 0.22919149269284303, 'batch_norm': False, 'lr': 1.3564890681375343e-05, 'weight_decay': 1.7327599239299191e-07, 'epochs': 40, 'loss': 'mse', 'optimizer': 'adam', 'graph_mode': 'off', 'use_snp_selection': True, 'num_snps': 59888}. Best is trial 80 with value: 0.3014506697026106.
