[I 2025-12-05 16:11:05,923] Trial 104 finished with value: 0.24234497183698864 and parameters: {'model_type': 'mlp', 'hidden_dims': '[512, 256]', 'dropout': 0.47909160563404435, 'batch_norm': True, 'lr': 8.431220408536005e-05, 'weight_decay': 0.00017746857103590166, 'epochs': 312, 'loss': 'mae', 'optimizer': 'adam', 'graph_mode': 'off', 'use_snp_selection': False}. Best is trial 77 with value: 0.252926157531937.
[I 2025-12-05 16:11:59,091] Trial 105 finished with value: 0.24584276772649657 and parameters: {'model_type': 'mlp', 'hidden_dims': '[256, 128]', 'dropout': 0.5100751847631607, 'batch_norm': True, 'lr': 6.356788394558712e-05, 'weight_decay': 4.4065654434692004e-05, 'epochs': 328, 'loss': 'mae', 'optimizer': 'adam', 'graph_mode': 'off', 'use_snp_selection': False}. Best is trial 77 with value: 0.252926157531937.
[I 2025-12-05 16:13:06,766] Trial 106 finished with value: 0.2441520175522797 and parameters: {'model_type': 'mlp', 'hidden_dims': '[512, 256]', 'dropout': 0.5484804258311482, 'batch_norm': True, 'lr': 2.7655065028834726e-05, 'weight_decay': 2.7913700401228465e-05, 'epochs': 215, 'loss': 'mae', 'optimizer': 'adam', 'graph_mode': 'off', 'use_snp_selection': False}. Best is trial 77 with value: 0.252926157531937.
[I 2025-12-05 16:14:20,594] Trial 107 finished with value: 0.2328512600945804 and parameters: {'model_type': 'mlp', 'hidden_dims': '[512, 256]', 'dropout': 0.4156098922060844, 'batch_norm': True, 'lr': 1.5017343691326222e-05, 'weight_decay': 4.972178762675186e-05, 'epochs': 237, 'loss': 'mae', 'optimizer': 'adam', 'graph_mode': 'off', 'use_snp_selection': False}. Best is trial 77 with value: 0.252926157531937.
[I 2025-12-05 16:15:23,500] Trial 108 finished with value: 0.2510810019016823 and parameters: {'model_type': 'mlp', 'hidden_dims': '[256, 128]', 'dropout': 0.5304976866622312, 'batch_norm': True, 'lr': 3.65958360094368e-05, 'weight_decay': 3.123067888532026e-06, 'epochs': 250, 'loss': 'mae', 'optimizer': 'adam', 'graph_mode': 'off', 'use_snp_selection': True, 'num_snps': 35885}. Best is trial 77 with value: 0.252926157531937.
[I 2025-12-05 16:16:28,877] Trial 109 finished with value: 0.24471559210943927 and parameters: {'model_type': 'mlp', 'hidden_dims': '[256, 128]', 'dropout': 0.4908583548569699, 'batch_norm': True, 'lr': 3.729020079113729e-05, 'weight_decay': 1.9243006361248917e-06, 'epochs': 251, 'loss': 'mae', 'optimizer': 'adam', 'graph_mode': 'off', 'use_snp_selection': True, 'num_snps': 38361}. Best is trial 77 with value: 0.252926157531937.
[I 2025-12-05 16:17:23,960] Trial 110 finished with value: 0.22824815680805255 and parameters: {'model_type': 'mlp', 'hidden_dims': '[256, 128]', 'dropout': 0.5296970982989524, 'batch_norm': True, 'lr': 2.130797258302005e-05, 'weight_decay': 3.0731254846795097e-06, 'epochs': 278, 'loss': 'mse', 'optimizer': 'adam', 'graph_mode': 'off', 'use_snp_selection': True, 'num_snps': 25841}. Best is trial 77 with value: 0.252926157531937.
[I 2025-12-05 16:18:04,903] Trial 111 finished with value: 0.24608088421212831 and parameters: {'model_type': 'mlp', 'hidden_dims': '[256, 128]', 'dropout': 0.5428184531464948, 'batch_norm': True, 'lr': 4.7126243956919054e-05, 'weight_decay': 9.084079708695625e-06, 'epochs': 245, 'loss': 'mae', 'optimizer': 'adam', 'graph_mode': 'off', 'use_snp_selection': False}. Best is trial 77 with value: 0.252926157531937.
[I 2025-12-05 16:18:47,001] Trial 112 finished with value: 0.2419466755652782 and parameters: {'model_type': 'mlp', 'hidden_dims': '[256, 128]', 'dropout': 0.4729211277832406, 'batch_norm': True, 'lr': 3.0285375347486493e-05, 'weight_decay': 7.132662720895686e-06, 'epochs': 271, 'loss': 'mae', 'optimizer': 'adam', 'graph_mode': 'off', 'use_snp_selection': True, 'num_snps': 12489}. Best is trial 77 with value: 0.252926157531937.
[I 2025-12-05 16:20:27,970] Trial 113 finished with value: 0.2473341575642778 and parameters: {'model_type': 'mlp', 'hidden_dims': '[512, 256]', 'dropout': 0.5604006115853539, 'batch_norm': True, 'lr': 5.7685430808174075e-05, 'weight_decay': 4.096902666709634e-06, 'epochs': 229, 'loss': 'mae', 'optimizer': 'adam', 'graph_mode': 'off', 'use_snp_selection': True, 'num_snps': 52602}. Best is trial 77 with value: 0.252926157531937.
[I 2025-12-05 16:21:31,177] Trial 114 finished with value: 0.25521585344163544 and parameters: {'model_type': 'mlp', 'hidden_dims': '[256, 128]', 'dropout': 0.5720921545360955, 'batch_norm': True, 'lr': 7.343513002353154e-05, 'weight_decay': 1.5803837785540326e-06, 'epochs': 303, 'loss': 'mae', 'optimizer': 'adam', 'graph_mode': 'off', 'use_snp_selection': True, 'num_snps': 32056}. Best is trial 114 with value: 0.25521585344163544.
[I 2025-12-05 16:22:30,828] Trial 115 finished with value: 0.2583957738581959 and parameters: {'model_type': 'mlp', 'hidden_dims': '[256, 128]', 'dropout': 0.5860591378324617, 'batch_norm': True, 'lr': 2.4926515135448788e-05, 'weight_decay': 1.5398413390211534e-06, 'epochs': 291, 'loss': 'mae', 'optimizer': 'adam', 'graph_mode': 'off', 'use_snp_selection': True, 'num_snps': 29798}. Best is trial 115 with value: 0.2583957738581959.
[I 2025-12-05 16:23:31,395] Trial 116 finished with value: 0.24757308524597255 and parameters: {'model_type': 'mlp', 'hidden_dims': '[256, 128]', 'dropout': 0.5987069074498351, 'batch_norm': True, 'lr': 2.4115939749065497e-05, 'weight_decay': 9.282483901394103e-07, 'epochs': 303, 'loss': 'mae', 'optimizer': 'adam', 'graph_mode': 'off', 'use_snp_selection': True, 'num_snps': 29959}. Best is trial 115 with value: 0.2583957738581959.
[I 2025-12-05 16:24:37,801] Trial 117 finished with value: 0.23683748297100085 and parameters: {'model_type': 'mlp', 'hidden_dims': '[256, 128]', 'dropout': 0.5785074083827974, 'batch_norm': True, 'lr': 1.8377407728092436e-05, 'weight_decay': 1.550919989902031e-06, 'epochs': 290, 'loss': 'mae', 'optimizer': 'adam', 'graph_mode': 'off', 'use_snp_selection': True, 'num_snps': 36575}. Best is trial 115 with value: 0.2583957738581959.
[I 2025-12-05 16:25:38,665] Trial 118 finished with value: 0.24640816597395973 and parameters: {'model_type': 'mlp', 'hidden_dims': '[256, 128]', 'dropout': 0.5697944128454548, 'batch_norm': True, 'lr': 5.1493362528846376e-05, 'weight_decay': 1.1690869619923592e-06, 'epochs': 308, 'loss': 'mae', 'optimizer': 'adam', 'graph_mode': 'off', 'use_snp_selection': True, 'num_snps': 30000}. Best is trial 115 with value: 0.2583957738581959.
[I 2025-12-05 16:26:47,489] Trial 119 finished with value: 0.25200278019851036 and parameters: {'model_type': 'mlp', 'hidden_dims': '[256, 128]', 'dropout': 0.5883351827135235, 'batch_norm': False, 'lr': 3.097257872973087e-05, 'weight_decay': 6.206455972575264e-07, 'epochs': 284, 'loss': 'mae', 'optimizer': 'adam', 'graph_mode': 'off', 'use_snp_selection': True, 'num_snps': 40402}. Best is trial 115 with value: 0.2583957738581959.
[I 2025-12-05 16:27:56,985] Trial 120 finished with value: 0.24944228482189948 and parameters: {'model_type': 'mlp', 'hidden_dims': '[256, 128]', 'dropout': 0.5868877909297872, 'batch_norm': False, 'lr': 2.769490383021167e-05, 'weight_decay': 5.829925268023311e-07, 'epochs': 281, 'loss': 'mae', 'optimizer': 'adam', 'graph_mode': 'off', 'use_snp_selection': True, 'num_snps': 41246}. Best is trial 115 with value: 0.2583957738581959.
[I 2025-12-05 16:29:05,647] Trial 121 finished with value: 0.24544693913915533 and parameters: {'model_type': 'mlp', 'hidden_dims': '[256, 128]', 'dropout': 0.5860018494496315, 'batch_norm': False, 'lr': 2.6318534307046277e-05, 'weight_decay': 1.033660511622857e-06, 'epochs': 283, 'loss': 'mae', 'optimizer': 'adam', 'graph_mode': 'off', 'use_snp_selection': True, 'num_snps': 40015}. Best is trial 115 with value: 0.2583957738581959.
[I 2025-12-05 16:30:08,768] Trial 122 finished with value: 0.2579693785233393 and parameters: {'model_type': 'mlp', 'hidden_dims': '[256, 128]', 'dropout': 0.5697919289240762, 'batch_norm': False, 'lr': 3.1475513580564015e-05, 'weight_decay': 6.336997386657614e-07, 'epochs': 296, 'loss': 'mae', 'optimizer': 'adam', 'graph_mode': 'off', 'use_snp_selection': True, 'num_snps': 32979}. Best is trial 115 with value: 0.2583957738581959.
[I 2025-12-05 16:31:13,268] Trial 123 finished with value: 0.24606922502162715 and parameters: {'model_type': 'mlp', 'hidden_dims': '[256, 128]', 'dropout': 0.5870389207501435, 'batch_norm': False, 'lr': 1.641759479144047e-05, 'weight_decay': 5.403523043117508e-07, 'epochs': 297, 'loss': 'mae', 'optimizer': 'adam', 'graph_mode': 'off', 'use_snp_selection': True, 'num_snps': 34231}. Best is trial 115 with value: 0.2583957738581959.
[I 2025-12-05 16:32:24,499] Trial 124 finished with value: 0.2465093115350608 and parameters: {'model_type': 'mlp', 'hidden_dims': '[256, 128]', 'dropout': 0.5990969150527217, 'batch_norm': False, 'lr': 3.004241911804198e-05, 'weight_decay': 4.2534022914678965e-07, 'epochs': 279, 'loss': 'mae', 'optimizer': 'adam', 'graph_mode': 'off', 'use_snp_selection': True, 'num_snps': 42099}. Best is trial 115 with value: 0.2583957738581959.
[I 2025-12-05 16:33:23,829] Trial 125 finished with value: 0.2570491547396719 and parameters: {'model_type': 'mlp', 'hidden_dims': '[256, 128]', 'dropout': 0.5569382905494205, 'batch_norm': False, 'lr': 2.080821276417543e-05, 'weight_decay': 2.775182777882262e-07, 'epochs': 294, 'loss': 'mae', 'optimizer': 'adam', 'graph_mode': 'off', 'use_snp_selection': True, 'num_snps': 28896}. Best is trial 115 with value: 0.2583957738581959.
[I 2025-12-05 16:34:22,116] Trial 126 finished with value: 0.254776612975499 and parameters: {'model_type': 'mlp', 'hidden_dims': '[256, 128]', 'dropout': 0.5571267769653095, 'batch_norm': False, 'lr': 2.0871089861593665e-05, 'weight_decay': 3.1655422898712494e-07, 'epochs': 292, 'loss': 'mae', 'optimizer': 'adam', 'graph_mode': 'off', 'use_snp_selection': True, 'num_snps': 27817}. Best is trial 115 with value: 0.2583957738581959.
[I 2025-12-05 16:35:20,771] Trial 127 finished with value: 0.2552914967762657 and parameters: {'model_type': 'mlp', 'hidden_dims': '[256, 128]', 'dropout': 0.5581309229596381, 'batch_norm': False, 'lr': 2.09282183099441e-05, 'weight_decay': 2.9402427316262103e-07, 'epochs': 295, 'loss': 'mae', 'optimizer': 'adam', 'graph_mode': 'off', 'use_snp_selection': True, 'num_snps': 28196}. Best is trial 115 with value: 0.2583957738581959.
[I 2025-12-05 16:36:16,643] Trial 128 finished with value: 0.2434330193017243 and parameters: {'model_type': 'mlp', 'hidden_dims': '[256, 128]', 'dropout': 0.5573055335999763, 'batch_norm': False, 'lr': 1.1269407724033086e-05, 'weight_decay': 2.9957055785138615e-07, 'epochs': 291, 'loss': 'mae', 'optimizer': 'adam', 'graph_mode': 'off', 'use_snp_selection': True, 'num_snps': 26137}. Best is trial 115 with value: 0.2583957738581959.
[I 2025-12-05 16:37:13,436] Trial 129 finished with value: 0.25012909658098614 and parameters: {'model_type': 'mlp', 'hidden_dims': '[256, 128]', 'dropout': 0.5659145033290621, 'batch_norm': False, 'lr': 2.0912898350974402e-05, 'weight_decay': 1.867368014800323e-07, 'epochs': 271, 'loss': 'mae', 'optimizer': 'adam', 'graph_mode': 'off', 'use_snp_selection': True, 'num_snps': 27877}. Best is trial 115 with value: 0.2583957738581959.
[I 2025-12-05 16:38:16,634] Trial 130 finished with value: 0.2462938452501283 and parameters: {'model_type': 'mlp', 'hidden_dims': '[256, 128]', 'dropout': 0.5514724910920852, 'batch_norm': False, 'lr': 1.769996338071692e-05, 'weight_decay': 1.893084624215868e-07, 'epochs': 296, 'loss': 'mae', 'optimizer': 'adam', 'graph_mode': 'off', 'use_snp_selection': True, 'num_snps': 33532}. Best is trial 115 with value: 0.2583957738581959.
[I 2025-12-05 16:39:20,047] Trial 131 finished with value: 0.25522335171196586 and parameters: {'model_type': 'mlp', 'hidden_dims': '[256, 128]', 'dropout': 0.5754858138097411, 'batch_norm': False, 'lr': 2.0807707599728627e-05, 'weight_decay': 3.137734760050496e-07, 'epochs': 305, 'loss': 'mae', 'optimizer': 'adam', 'graph_mode': 'off', 'use_snp_selection': True, 'num_snps': 33117}. Best is trial 115 with value: 0.2583957738581959.
[I 2025-12-05 16:40:21,933] Trial 132 finished with value: 0.2534869564182473 and parameters: {'model_type': 'mlp', 'hidden_dims': '[256, 128]', 'dropout': 0.5751919181590777, 'batch_norm': False, 'lr': 2.4511539781110227e-05, 'weight_decay': 3.1556067834891497e-07, 'epochs': 291, 'loss': 'mae', 'optimizer': 'adam', 'graph_mode': 'off', 'use_snp_selection': True, 'num_snps': 32115}. Best is trial 115 with value: 0.2583957738581959.
[I 2025-12-05 16:41:23,106] Trial 133 finished with value: 0.25595011505480875 and parameters: {'model_type': 'mlp', 'hidden_dims': '[256, 128]', 'dropout': 0.574349709701436, 'batch_norm': False, 'lr': 1.39299644639499e-05, 'weight_decay': 3.2196928701424855e-07, 'epochs': 286, 'loss': 'mae', 'optimizer': 'adam', 'graph_mode': 'off', 'use_snp_selection': True, 'num_snps': 31602}. Best is trial 115 with value: 0.2583957738581959.
[I 2025-12-05 16:42:24,735] Trial 134 finished with value: 0.2528252466966966 and parameters: {'model_type': 'mlp', 'hidden_dims': '[256, 128]', 'dropout': 0.5823177350818161, 'batch_norm': False, 'lr': 2.3491509589876067e-05, 'weight_decay': 1.4954952804957593e-07, 'epochs': 284, 'loss': 'mae', 'optimizer': 'adam', 'graph_mode': 'off', 'use_snp_selection': True, 'num_snps': 32542}. Best is trial 115 with value: 0.2583957738581959.
[I 2025-12-05 16:43:26,093] Trial 135 finished with value: 0.2478337750500394 and parameters: {'model_type': 'mlp', 'hidden_dims': '[256, 128]', 'dropout': 0.5754997667569172, 'batch_norm': False, 'lr': 2.4094202939920284e-05, 'weight_decay': 1.295919584337548e-07, 'epochs': 285, 'loss': 'mae', 'optimizer': 'adam', 'graph_mode': 'off', 'use_snp_selection': True, 'num_snps': 32171}. Best is trial 115 with value: 0.2583957738581959.
[I 2025-12-05 16:44:26,034] Trial 136 finished with value: 0.24896478919901463 and parameters: {'model_type': 'mlp', 'hidden_dims': '[256, 128]', 'dropout': 0.5776278163973846, 'batch_norm': False, 'lr': 1.437717744841362e-05, 'weight_decay': 2.3691166032469116e-07, 'epochs': 300, 'loss': 'mae', 'optimizer': 'adam', 'graph_mode': 'off', 'use_snp_selection': True, 'num_snps': 29914}. Best is trial 115 with value: 0.2583957738581959.
[I 2025-12-05 16:45:31,624] Trial 137 finished with value: 0.24798927485592212 and parameters: {'model_type': 'mlp', 'hidden_dims': '[256, 128]', 'dropout': 0.5640616634522252, 'batch_norm': False, 'lr': 2.0234595087071332e-05, 'weight_decay': 3.3189988211147377e-07, 'epochs': 293, 'loss': 'mae', 'optimizer': 'adam', 'graph_mode': 'off', 'use_snp_selection': True, 'num_snps': 35463}. Best is trial 115 with value: 0.2583957738581959.
[I 2025-12-05 16:46:34,484] Trial 138 finished with value: 0.2564215866899023 and parameters: {'model_type': 'mlp', 'hidden_dims': '[256, 128]', 'dropout': 0.5836434842752897, 'batch_norm': False, 'lr': 1.3028902540928644e-05, 'weight_decay': 1.462369814006673e-07, 'epochs': 302, 'loss': 'mae', 'optimizer': 'adam', 'graph_mode': 'off', 'use_snp_selection': True, 'num_snps': 32085}. Best is trial 115 with value: 0.2583957738581959.
[I 2025-12-05 16:47:32,073] Trial 139 finished with value: 0.2589940443699869 and parameters: {'model_type': 'mlp', 'hidden_dims': '[256, 128]', 'dropout': 0.5923331707173063, 'batch_norm': False, 'lr': 1.4358989085437927e-05, 'weight_decay': 1.0043261205724522e-07, 'epochs': 286, 'loss': 'mae', 'optimizer': 'adam', 'graph_mode': 'off', 'use_snp_selection': True, 'num_snps': 27960}. Best is trial 139 with value: 0.2589940443699869.
[I 2025-12-05 16:48:30,934] Trial 140 finished with value: 0.24391545619165123 and parameters: {'model_type': 'mlp', 'hidden_dims': '[256, 128]', 'dropout': 0.5952998859471459, 'batch_norm': False, 'lr': 1.2201059029831906e-05, 'weight_decay': 1.134986240961032e-07, 'epochs': 303, 'loss': 'mse', 'optimizer': 'adam', 'graph_mode': 'off', 'use_snp_selection': True, 'num_snps': 28145}. Best is trial 139 with value: 0.2589940443699869.
[I 2025-12-05 16:49:31,927] Trial 141 finished with value: 0.2507397782248968 and parameters: {'model_type': 'mlp', 'hidden_dims': '[256, 128]', 'dropout': 0.5839387592681823, 'batch_norm': False, 'lr': 9.06564159686822e-06, 'weight_decay': 1.461178524788921e-07, 'epochs': 287, 'loss': 'mae', 'optimizer': 'adam', 'graph_mode': 'off', 'use_snp_selection': True, 'num_snps': 31201}. Best is trial 139 with value: 0.2589940443699869.
[I 2025-12-05 16:50:33,166] Trial 142 finished with value: 0.25555793640292845 and parameters: {'model_type': 'mlp', 'hidden_dims': '[256, 128]', 'dropout': 0.5719740468232876, 'batch_norm': False, 'lr': 1.3935697626135236e-05, 'weight_decay': 1.0064851303829727e-07, 'epochs': 275, 'loss': 'mae', 'optimizer': 'adam', 'graph_mode': 'off', 'use_snp_selection': True, 'num_snps': 32835}. Best is trial 139 with value: 0.2589940443699869.
[I 2025-12-05 16:51:35,613] Trial 143 finished with value: 0.2570926164929983 and parameters: {'model_type': 'mlp', 'hidden_dims': '[256, 128]', 'dropout': 0.5696279634467762, 'batch_norm': False, 'lr': 1.3708989560081453e-05, 'weight_decay': 1.5224968914732072e-07, 'epochs': 295, 'loss': 'mae', 'optimizer': 'adam', 'graph_mode': 'off', 'use_snp_selection': True, 'num_snps': 32417}. Best is trial 139 with value: 0.2589940443699869.
[I 2025-12-05 16:52:36,598] Trial 144 finished with value: 0.247285494693323 and parameters: {'model_type': 'mlp', 'hidden_dims': '[256, 128]', 'dropout': 0.5721776584334468, 'batch_norm': False, 'lr': 1.4399032681829493e-05, 'weight_decay': 1.5730255601900604e-07, 'epochs': 276, 'loss': 'mae', 'optimizer': 'adam', 'graph_mode': 'off', 'use_snp_selection': True, 'num_snps': 32137}. Best is trial 139 with value: 0.2589940443699869.
[I 2025-12-05 16:53:39,513] Trial 145 finished with value: 0.2547171665504557 and parameters: {'model_type': 'mlp', 'hidden_dims': '[256, 128]', 'dropout': 0.5553486118068348, 'batch_norm': False, 'lr': 1.30588183255371e-05, 'weight_decay': 2.706152092066049e-07, 'epochs': 296, 'loss': 'mae', 'optimizer': 'adam', 'graph_mode': 'off', 'use_snp_selection': True, 'num_snps': 32609}. Best is trial 139 with value: 0.2589940443699869.
[I 2025-12-05 16:54:36,797] Trial 146 finished with value: 0.25748262258190907 and parameters: {'model_type': 'mlp', 'hidden_dims': '[256, 128]', 'dropout': 0.55488314243038, 'batch_norm': False, 'lr': 8.419754682251445e-06, 'weight_decay': 1.0397034603429328e-07, 'epochs': 297, 'loss': 'mae', 'optimizer': 'adam', 'graph_mode': 'off', 'use_snp_selection': True, 'num_snps': 27442}. Best is trial 139 with value: 0.2589940443699869.
[I 2025-12-05 16:55:33,869] Trial 147 finished with value: 0.2420042278293722 and parameters: {'model_type': 'mlp', 'hidden_dims': '[256, 128]', 'dropout': 0.5579641757283822, 'batch_norm': False, 'lr': 5.7255320031197576e-06, 'weight_decay': 2.6498053274816335e-07, 'epochs': 298, 'loss': 'mae', 'optimizer': 'adam', 'graph_mode': 'off', 'use_snp_selection': True, 'num_snps': 27226}. Best is trial 139 with value: 0.2589940443699869.
[I 2025-12-05 16:56:34,066] Trial 148 finished with value: 0.2521224624684948 and parameters: {'model_type': 'mlp', 'hidden_dims': '[256, 128]', 'dropout': 0.5488949064501187, 'batch_norm': False, 'lr': 8.360242509538953e-06, 'weight_decay': 1.0839008866609792e-07, 'epochs': 305, 'loss': 'mae', 'optimizer': 'adam', 'graph_mode': 'off', 'use_snp_selection': True, 'num_snps': 29520}. Best is trial 139 with value: 0.2589940443699869.
[I 2025-12-05 16:57:30,215] Trial 149 finished with value: 0.2456235616077377 and parameters: {'model_type': 'mlp', 'hidden_dims': '[256, 128]', 'dropout': 0.567496356976976, 'batch_norm': False, 'lr': 1.0152411398054863e-05, 'weight_decay': 2.1956948755733113e-07, 'epochs': 320, 'loss': 'mae', 'optimizer': 'adam', 'graph_mode': 'off', 'use_snp_selection': True, 'num_snps': 24402}. Best is trial 139 with value: 0.2589940443699869.
[I 2025-12-05 16:58:39,420] Trial 0 finished with value: 0.18988351815957308 and parameters: {'model_type': 'mlp', 'hidden_dims': '[128, 64]', 'dropout': 0.199031432379812, 'batch_norm': True, 'lr': 1.8408544111075837e-06, 'weight_decay': 5.5136510071208614e-05, 'epochs': 336, 'loss': 'mae', 'optimizer': 'adam', 'graph_mode': 'off', 'use_snp_selection': True, 'num_snps': 43862}. Best is trial 0 with value: 0.18988351815957308.
[I 2025-12-05 16:59:20,100] Trial 1 finished with value: 0.22368203866317757 and parameters: {'model_type': 'mlp', 'hidden_dims': '[256, 128]', 'dropout': 0.4370668075331726, 'batch_norm': True, 'lr': 7.133471581159139e-05, 'weight_decay': 1.128633586803549e-05, 'epochs': 242, 'loss': 'mae', 'optimizer': 'adam', 'graph_mode': 'off', 'use_snp_selection': False}. Best is trial 1 with value: 0.22368203866317757.
[I 2025-12-05 16:59:58,600] Trial 2 finished with value: 0.20083622381149208 and parameters: {'model_type': 'mlp', 'hidden_dims': '[256, 128, 64]', 'dropout': 0.41314357415569625, 'batch_norm': False, 'lr': 3.952233718592101e-06, 'weight_decay': 0.00026754769258252603, 'epochs': 149, 'loss': 'mse', 'optimizer': 'adam', 'graph_mode': 'off', 'use_snp_selection': True, 'num_snps': 11571}. Best is trial 1 with value: 0.22368203866317757.
[I 2025-12-05 17:01:33,651] Trial 3 finished with value: 0.23340910603345705 and parameters: {'model_type': 'mlp', 'hidden_dims': '[512, 64]', 'dropout': 0.5938127374509361, 'batch_norm': False, 'lr': 5.67704586114731e-06, 'weight_decay': 2.4518087630137052e-05, 'epochs': 320, 'loss': 'mae', 'optimizer': 'adam', 'graph_mode': 'off', 'use_snp_selection': False}. Best is trial 3 with value: 0.23340910603345705.
