[I 2025-12-05 14:24:50,039] Trial 6 finished with value: 0.037603241819477995 and parameters: {'model_type': 'mlp', 'hidden_dims': '[256, 128]', 'dropout': 0.3930109900265879, 'batch_norm': False, 'lr': 4.892964372128395e-05, 'weight_decay': 1.5809549317992182e-06, 'epochs': 199, 'loss': 'mse', 'optimizer': 'adam', 'graph_mode': 'off', 'use_snp_selection': False}. Best is trial 2 with value: 0.08225658756223755.
[I 2025-12-05 14:24:51,270] Trial 7 finished with value: 0.04391679992905247 and parameters: {'model_type': 'mlp', 'hidden_dims': '[512, 256]', 'dropout': 0.15343979219678458, 'batch_norm': True, 'lr': 6.234003099047341e-05, 'weight_decay': 3.894760610535477e-07, 'epochs': 97, 'loss': 'mse', 'optimizer': 'adam', 'graph_mode': 'off', 'use_snp_selection': False}. Best is trial 2 with value: 0.08225658756223755.
[I 2025-12-05 14:24:53,719] Trial 8 finished with value: 0.04206572201787274 and parameters: {'model_type': 'mlp', 'hidden_dims': '[512, 128]', 'dropout': 0.10743001231661406, 'batch_norm': True, 'lr': 0.00023728538449271062, 'weight_decay': 1.7629071578048637e-05, 'epochs': 312, 'loss': 'mae', 'optimizer': 'adam', 'graph_mode': 'off', 'use_snp_selection': False}. Best is trial 2 with value: 0.08225658756223755.
[I 2025-12-05 14:24:55,389] Trial 9 finished with value: 0.06097747016887759 and parameters: {'model_type': 'mlp', 'hidden_dims': '[512, 64]', 'dropout': 0.14505336736221927, 'batch_norm': True, 'lr': 5.8619638388111826e-05, 'weight_decay': 6.200156172669308e-07, 'epochs': 175, 'loss': 'mse', 'optimizer': 'adam', 'graph_mode': 'off', 'use_snp_selection': False}. Best is trial 2 with value: 0.08225658756223755.
[I 2025-12-05 14:24:56,179] Trial 10 finished with value: 0.0280826444469126 and parameters: {'model_type': 'mlp', 'hidden_dims': '[256, 128, 64]', 'dropout': 0.5344471988899759, 'batch_norm': False, 'lr': 1.080428984628536e-05, 'weight_decay': 0.0001397766261378007, 'epochs': 43, 'loss': 'mse', 'optimizer': 'adam', 'graph_mode': 'off', 'use_snp_selection': True, 'num_snps': 4154}. Best is trial 2 with value: 0.08225658756223755.
[I 2025-12-05 14:24:57,198] Trial 11 finished with value: 0.04349776338159966 and parameters: {'model_type': 'mlp', 'hidden_dims': '[256, 128, 64]', 'dropout': 0.3372576707439438, 'batch_norm': False, 'lr': 0.0007921087285388968, 'weight_decay': 1.739837781886653e-06, 'epochs': 156, 'loss': 'mse', 'optimizer': 'adam', 'graph_mode': 'off', 'use_snp_selection': True, 'num_snps': 6849}. Best is trial 2 with value: 0.08225658756223755.
[I 2025-12-05 14:24:58,304] Trial 12 finished with value: 0.06258686494533548 and parameters: {'model_type': 'mlp', 'hidden_dims': '[256, 128, 64]', 'dropout': 0.28681524965375393, 'batch_norm': False, 'lr': 1.5265784808841314e-05, 'weight_decay': 2.1464896791204936e-07, 'epochs': 191, 'loss': 'mse', 'optimizer': 'adam', 'graph_mode': 'off', 'use_snp_selection': False}. Best is trial 2 with value: 0.08225658756223755.
[I 2025-12-05 14:25:01,204] Trial 13 finished with value: 0.062101035703007845 and parameters: {'model_type': 'mlp', 'hidden_dims': '[256, 128, 64]', 'dropout': 0.2877057569069463, 'batch_norm': False, 'lr': 1.09190189634402e-05, 'weight_decay': 3.7904135004281887e-06, 'epochs': 223, 'loss': 'mse', 'optimizer': 'adam', 'graph_mode': 'off', 'use_snp_selection': True, 'num_snps': 59978}. Best is trial 2 with value: 0.08225658756223755.
[I 2025-12-05 14:25:02,102] Trial 14 finished with value: 0.02114230307988568 and parameters: {'model_type': 'mlp', 'hidden_dims': '[256, 128, 64]', 'dropout': 0.4694336147469494, 'batch_norm': False, 'lr': 4.247776473637225e-06, 'weight_decay': 1.9066300525955814e-07, 'epochs': 107, 'loss': 'mse', 'optimizer': 'adam', 'graph_mode': 'off', 'use_snp_selection': False}. Best is trial 2 with value: 0.08225658756223755.
[I 2025-12-05 14:25:03,340] Trial 15 finished with value: 0.07219480328678016 and parameters: {'model_type': 'mlp', 'hidden_dims': '[256, 128, 64]', 'dropout': 0.3084012447347816, 'batch_norm': False, 'lr': 1.8269911924095828e-05, 'weight_decay': 7.706714155290709e-05, 'epochs': 124, 'loss': 'mse', 'optimizer': 'adam', 'graph_mode': 'off', 'use_snp_selection': True, 'num_snps': 16489}. Best is trial 2 with value: 0.08225658756223755.
[I 2025-12-05 14:25:04,571] Trial 16 finished with value: 0.05630120808454554 and parameters: {'model_type': 'mlp', 'hidden_dims': '[128, 64]', 'dropout': 0.49763080593120324, 'batch_norm': False, 'lr': 2.3463147452458174e-05, 'weight_decay': 9.466956766327209e-05, 'epochs': 99, 'loss': 'mse', 'optimizer': 'adam', 'graph_mode': 'off', 'use_snp_selection': True, 'num_snps': 18342}. Best is trial 2 with value: 0.08225658756223755.
[I 2025-12-05 14:25:05,720] Trial 17 finished with value: -0.00019708145492957027 and parameters: {'model_type': 'mlp', 'hidden_dims': '[256, 128, 64]', 'dropout': 0.22715079499641555, 'batch_norm': False, 'lr': 3.960505226702058e-06, 'weight_decay': 0.0008053345231252287, 'epochs': 43, 'loss': 'mse', 'optimizer': 'adam', 'graph_mode': 'off', 'use_snp_selection': True, 'num_snps': 17193}. Best is trial 2 with value: 0.08225658756223755.
[I 2025-12-05 14:25:07,124] Trial 18 finished with value: 0.03807631857912345 and parameters: {'model_type': 'mlp', 'hidden_dims': '[512, 256]', 'dropout': 0.3516830433503848, 'batch_norm': False, 'lr': 0.00018099441799153068, 'weight_decay': 0.0002338188996154211, 'epochs': 133, 'loss': 'mse', 'optimizer': 'adam', 'graph_mode': 'off', 'use_snp_selection': True, 'num_snps': 18393}. Best is trial 2 with value: 0.08225658756223755.
[I 2025-12-05 14:25:08,202] Trial 19 finished with value: 0.03191142573221485 and parameters: {'model_type': 'mlp', 'hidden_dims': '[256, 128, 64]', 'dropout': 0.4150619793902027, 'batch_norm': False, 'lr': 7.1912567995704705e-06, 'weight_decay': 3.2519139811105935e-05, 'epochs': 85, 'loss': 'mse', 'optimizer': 'adam', 'graph_mode': 'off', 'use_snp_selection': True, 'num_snps': 12687}. Best is trial 2 with value: 0.08225658756223755.
[I 2025-12-05 14:25:09,712] Trial 20 finished with value: 0.06500973606757733 and parameters: {'model_type': 'mlp', 'hidden_dims': '[256, 128, 64]', 'dropout': 0.32810353737477305, 'batch_norm': False, 'lr': 2.3662126974470643e-05, 'weight_decay': 0.00027424508686970316, 'epochs': 128, 'loss': 'mse', 'optimizer': 'adam', 'graph_mode': 'off', 'use_snp_selection': True, 'num_snps': 25251}. Best is trial 2 with value: 0.08225658756223755.
[I 2025-12-05 14:25:11,270] Trial 21 finished with value: 0.07499174702677598 and parameters: {'model_type': 'mlp', 'hidden_dims': '[256, 128, 64]', 'dropout': 0.3255647713657572, 'batch_norm': False, 'lr': 2.6919239533625652e-05, 'weight_decay': 0.0003379140219075955, 'epochs': 128, 'loss': 'mse', 'optimizer': 'adam', 'graph_mode': 'off', 'use_snp_selection': True, 'num_snps': 25554}. Best is trial 2 with value: 0.08225658756223755.
[I 2025-12-05 14:25:12,737] Trial 22 finished with value: 0.02899660905911013 and parameters: {'model_type': 'mlp', 'hidden_dims': '[256, 128, 64]', 'dropout': 0.3005942405645958, 'batch_norm': False, 'lr': 2.711137090948438e-06, 'weight_decay': 6.632720892541019e-05, 'epochs': 75, 'loss': 'mse', 'optimizer': 'adam', 'graph_mode': 'off', 'use_snp_selection': True, 'num_snps': 25786}. Best is trial 2 with value: 0.08225658756223755.
[I 2025-12-05 14:25:13,934] Trial 23 finished with value: 0.03907489776305744 and parameters: {'model_type': 'mlp', 'hidden_dims': '[256, 128, 64]', 'dropout': 0.3666117052210743, 'batch_norm': False, 'lr': 0.00016491682390326086, 'weight_decay': 0.00046244489246544465, 'epochs': 162, 'loss': 'mse', 'optimizer': 'adam', 'graph_mode': 'off', 'use_snp_selection': True, 'num_snps': 12829}. Best is trial 2 with value: 0.08225658756223755.
[I 2025-12-05 14:25:15,435] Trial 24 finished with value: 0.0631213374428371 and parameters: {'model_type': 'mlp', 'hidden_dims': '[256, 128, 64]', 'dropout': 0.4415497612352959, 'batch_norm': False, 'lr': 3.3653784445665744e-05, 'weight_decay': 0.00014524811240248663, 'epochs': 122, 'loss': 'mse', 'optimizer': 'adam', 'graph_mode': 'off', 'use_snp_selection': True, 'num_snps': 24915}. Best is trial 2 with value: 0.08225658756223755.
[I 2025-12-05 14:25:16,425] Trial 25 finished with value: 0.06834043180843595 and parameters: {'model_type': 'mlp', 'hidden_dims': '[512, 128]', 'dropout': 0.23427272126181023, 'batch_norm': False, 'lr': 1.4588088735613506e-05, 'weight_decay': 4.0969154614606966e-05, 'epochs': 73, 'loss': 'mse', 'optimizer': 'adam', 'graph_mode': 'off', 'use_snp_selection': True, 'num_snps': 9865}. Best is trial 2 with value: 0.08225658756223755.
[I 2025-12-05 14:25:17,343] Trial 26 finished with value: 0.04476556904793287 and parameters: {'model_type': 'mlp', 'hidden_dims': '[512, 256]', 'dropout': 0.3224024165299102, 'batch_norm': False, 'lr': 0.00011734771583578605, 'weight_decay': 0.0001407369004949915, 'epochs': 207, 'loss': 'mae', 'optimizer': 'adam', 'graph_mode': 'off', 'use_snp_selection': True, 'num_snps': 2015}. Best is trial 2 with value: 0.08225658756223755.
[I 2025-12-05 14:25:19,474] Trial 27 finished with value: 0.08028240025545617 and parameters: {'model_type': 'mlp', 'hidden_dims': '[256, 128]', 'dropout': 0.5150409390816639, 'batch_norm': False, 'lr': 8.035734155050868e-06, 'weight_decay': 0.0005031701947404598, 'epochs': 173, 'loss': 'mse', 'optimizer': 'adam', 'graph_mode': 'off', 'use_snp_selection': True, 'num_snps': 41849}. Best is trial 2 with value: 0.08225658756223755.
[I 2025-12-05 14:25:21,781] Trial 28 finished with value: 0.04969258319880616 and parameters: {'model_type': 'mlp', 'hidden_dims': '[256, 128]', 'dropout': 0.5318905474354262, 'batch_norm': False, 'lr': 7.689130294692111e-06, 'weight_decay': 0.0006012169033086211, 'epochs': 180, 'loss': 'mse', 'optimizer': 'adam', 'graph_mode': 'off', 'use_snp_selection': True, 'num_snps': 45325}. Best is trial 2 with value: 0.08225658756223755.
[I 2025-12-05 14:25:23,953] Trial 29 finished with value: 0.029127534275653948 and parameters: {'model_type': 'mlp', 'hidden_dims': '[128, 64]', 'dropout': 0.5456019540569096, 'batch_norm': False, 'lr': 2.23065132988567e-06, 'weight_decay': 0.0009985228973016622, 'epochs': 239, 'loss': 'mae', 'optimizer': 'adam', 'graph_mode': 'off', 'use_snp_selection': True, 'num_snps': 44754}. Best is trial 2 with value: 0.08225658756223755.
[I 2025-12-05 14:25:25,955] Trial 30 finished with value: 0.01292450149215069 and parameters: {'model_type': 'mlp', 'hidden_dims': '[256, 128]', 'dropout': 0.4842997766062874, 'batch_norm': False, 'lr': 3.4164847678392196e-06, 'weight_decay': 0.00035981011987221194, 'epochs': 163, 'loss': 'mse', 'optimizer': 'adam', 'graph_mode': 'off', 'use_snp_selection': True, 'num_snps': 37653}. Best is trial 2 with value: 0.08225658756223755.
[I 2025-12-05 14:25:27,310] Trial 31 finished with value: 0.05747420277914856 and parameters: {'model_type': 'mlp', 'hidden_dims': '[256, 128]', 'dropout': 0.40970608335568903, 'batch_norm': False, 'lr': 1.986059140469125e-05, 'weight_decay': 8.822340236655884e-05, 'epochs': 115, 'loss': 'mse', 'optimizer': 'adam', 'graph_mode': 'off', 'use_snp_selection': True, 'num_snps': 21492}. Best is trial 2 with value: 0.08225658756223755.
[I 2025-12-05 14:25:29,769] Trial 32 finished with value: 0.06546210841481254 and parameters: {'model_type': 'mlp', 'hidden_dims': '[256, 128]', 'dropout': 0.4442020283950822, 'batch_norm': False, 'lr': 3.9334151280692156e-05, 'weight_decay': 0.00021142873231059974, 'epochs': 138, 'loss': 'mse', 'optimizer': 'adam', 'graph_mode': 'off', 'use_snp_selection': True, 'num_snps': 53458}. Best is trial 2 with value: 0.08225658756223755.
[I 2025-12-05 14:25:31,487] Trial 33 finished with value: 0.03970834637057336 and parameters: {'model_type': 'mlp', 'hidden_dims': '[128, 64]', 'dropout': 0.5633206090777448, 'batch_norm': False, 'lr': 5.726525985305637e-06, 'weight_decay': 1.0598046786721706e-05, 'epochs': 146, 'loss': 'mse', 'optimizer': 'adam', 'graph_mode': 'off', 'use_snp_selection': True, 'num_snps': 31455}. Best is trial 2 with value: 0.08225658756223755.
[I 2025-12-05 14:25:32,937] Trial 34 finished with value: 0.05193484867285691 and parameters: {'model_type': 'mlp', 'hidden_dims': '[256, 128, 64]', 'dropout': 0.5023830386684375, 'batch_norm': True, 'lr': 1.0014694982364897e-05, 'weight_decay': 0.00045232429581847956, 'epochs': 266, 'loss': 'mae', 'optimizer': 'adam', 'graph_mode': 'off', 'use_snp_selection': True, 'num_snps': 11389}. Best is trial 2 with value: 0.08225658756223755.
[I 2025-12-05 14:25:35,183] Trial 35 finished with value: 0.03830864578805105 and parameters: {'model_type': 'mlp', 'hidden_dims': '[512, 64]', 'dropout': 0.2710196062608231, 'batch_norm': False, 'lr': 0.00010211508515549598, 'weight_decay': 7.07766304739465e-05, 'epochs': 178, 'loss': 'mse', 'optimizer': 'adam', 'graph_mode': 'off', 'use_snp_selection': True, 'num_snps': 37375}. Best is trial 2 with value: 0.08225658756223755.
[I 2025-12-05 14:25:36,506] Trial 36 finished with value: 0.02069803985324475 and parameters: {'model_type': 'mlp', 'hidden_dims': '[256, 128]', 'dropout': 0.3725124770563044, 'batch_norm': False, 'lr': 1.0458299915643019e-06, 'weight_decay': 1.9332224284225527e-05, 'epochs': 222, 'loss': 'mae', 'optimizer': 'adam', 'graph_mode': 'off', 'use_snp_selection': True, 'num_snps': 15888}. Best is trial 2 with value: 0.08225658756223755.
[I 2025-12-05 14:25:37,885] Trial 37 finished with value: 0.04512363047699738 and parameters: {'model_type': 'mlp', 'hidden_dims': '[512, 128]', 'dropout': 0.24116347162244656, 'batch_norm': True, 'lr': 6.414796975422841e-06, 'weight_decay': 0.00020168718942934773, 'epochs': 62, 'loss': 'mse', 'optimizer': 'adam', 'graph_mode': 'off', 'use_snp_selection': True, 'num_snps': 22047}. Best is trial 2 with value: 0.08225658756223755.
[I 2025-12-05 14:25:40,258] Trial 38 finished with value: 0.04946954209416101 and parameters: {'model_type': 'mlp', 'hidden_dims': '[256, 128, 64]', 'dropout': 0.1989641801589635, 'batch_norm': False, 'lr': 1.637234935601916e-05, 'weight_decay': 0.0006348995642038462, 'epochs': 150, 'loss': 'mse', 'optimizer': 'adam', 'graph_mode': 'off', 'use_snp_selection': True, 'num_snps': 49711}. Best is trial 2 with value: 0.08225658756223755.
[I 2025-12-05 14:25:41,150] Trial 39 finished with value: 0.038796048354821186 and parameters: {'model_type': 'mlp', 'hidden_dims': '[256, 128]', 'dropout': 0.401013532350549, 'batch_norm': True, 'lr': 2.8700665544121357e-05, 'weight_decay': 4.552523346208344e-05, 'epochs': 110, 'loss': 'mae', 'optimizer': 'adam', 'graph_mode': 'off', 'use_snp_selection': False}. Best is trial 2 with value: 0.08225658756223755.
[I 2025-12-05 14:25:43,679] Trial 40 finished with value: 0.05482408078927299 and parameters: {'model_type': 'mlp', 'hidden_dims': '[512, 64]', 'dropout': 0.5937685227205456, 'batch_norm': False, 'lr': 1.526411048822013e-06, 'weight_decay': 0.00039977757372387893, 'epochs': 204, 'loss': 'mse', 'optimizer': 'adam', 'graph_mode': 'off', 'use_snp_selection': True, 'num_snps': 41129}. Best is trial 2 with value: 0.08225658756223755.
[I 2025-12-05 14:25:44,573] Trial 41 finished with value: 0.04510580296299331 and parameters: {'model_type': 'mlp', 'hidden_dims': '[512, 128]', 'dropout': 0.2070622207178377, 'batch_norm': False, 'lr': 1.1954785555404103e-05, 'weight_decay': 5.205920649771671e-05, 'epochs': 66, 'loss': 'mse', 'optimizer': 'adam', 'graph_mode': 'off', 'use_snp_selection': True, 'num_snps': 6922}. Best is trial 2 with value: 0.08225658756223755.
[I 2025-12-05 14:25:45,552] Trial 42 finished with value: 0.05756754664954608 and parameters: {'model_type': 'mlp', 'hidden_dims': '[512, 128]', 'dropout': 0.29972777349475993, 'batch_norm': False, 'lr': 1.7682516521591626e-05, 'weight_decay': 2.83204366690651e-05, 'epochs': 80, 'loss': 'mse', 'optimizer': 'adam', 'graph_mode': 'off', 'use_snp_selection': True, 'num_snps': 9044}. Best is trial 2 with value: 0.08225658756223755.
[I 2025-12-05 14:25:47,242] Trial 43 finished with value: 0.05873920247063021 and parameters: {'model_type': 'mlp', 'hidden_dims': '[512, 128]', 'dropout': 0.18237780398311135, 'batch_norm': False, 'lr': 3.9854631161184415e-05, 'weight_decay': 0.00013741260991715964, 'epochs': 92, 'loss': 'mse', 'optimizer': 'adam', 'graph_mode': 'off', 'use_snp_selection': True, 'num_snps': 28100}. Best is trial 2 with value: 0.08225658756223755.
[I 2025-12-05 14:25:48,874] Trial 44 finished with value: 0.04694520167006257 and parameters: {'model_type': 'mlp', 'hidden_dims': '[512, 128]', 'dropout': 0.2610390819555806, 'batch_norm': False, 'lr': 4.613016394136153e-06, 'weight_decay': 4.9710557376933104e-06, 'epochs': 168, 'loss': 'mse', 'optimizer': 'adam', 'graph_mode': 'off', 'use_snp_selection': False}. Best is trial 2 with value: 0.08225658756223755.
[I 2025-12-05 14:25:50,422] Trial 45 finished with value: 0.01262978241567462 and parameters: {'model_type': 'mlp', 'hidden_dims': '[512, 256]', 'dropout': 0.3550522969778546, 'batch_norm': True, 'lr': 1.2995523406334973e-05, 'weight_decay': 9.968493032991673e-05, 'epochs': 339, 'loss': 'mse', 'optimizer': 'adam', 'graph_mode': 'off', 'use_snp_selection': True, 'num_snps': 14538}. Best is trial 2 with value: 0.08225658756223755.
[I 2025-12-05 14:25:51,473] Trial 46 finished with value: 0.048382566580710606 and parameters: {'model_type': 'mlp', 'hidden_dims': '[256, 128, 64]', 'dropout': 0.3164699866943368, 'batch_norm': False, 'lr': 2.962018475618369e-06, 'weight_decay': 3.972065010884909e-05, 'epochs': 121, 'loss': 'mse', 'optimizer': 'adam', 'graph_mode': 'off', 'use_snp_selection': True, 'num_snps': 8629}. Best is trial 2 with value: 0.08225658756223755.
[I 2025-12-05 14:25:53,101] Trial 47 finished with value: 0.04479866830634123 and parameters: {'model_type': 'mlp', 'hidden_dims': '[512, 128]', 'dropout': 0.241250746959202, 'batch_norm': False, 'lr': 8.117603509772983e-06, 'weight_decay': 1.756580040435782e-05, 'epochs': 189, 'loss': 'mse', 'optimizer': 'adam', 'graph_mode': 'off', 'use_snp_selection': True, 'num_snps': 20969}. Best is trial 2 with value: 0.08225658756223755.
[I 2025-12-05 14:25:54,045] Trial 48 finished with value: 0.04986553749520562 and parameters: {'model_type': 'mlp', 'hidden_dims': '[256, 128, 64]', 'dropout': 0.14602797692756056, 'batch_norm': False, 'lr': 0.0004267219519466116, 'weight_decay': 0.0002689993592497013, 'epochs': 141, 'loss': 'mse', 'optimizer': 'adam', 'graph_mode': 'off', 'use_snp_selection': False}. Best is trial 2 with value: 0.08225658756223755.
[I 2025-12-05 14:25:55,700] Trial 49 finished with value: 0.03864956889334112 and parameters: {'model_type': 'mlp', 'hidden_dims': '[128, 64]', 'dropout': 0.11690046999177686, 'batch_norm': False, 'lr': 8.058283942608738e-05, 'weight_decay': 0.00017248198532458572, 'epochs': 60, 'loss': 'mse', 'optimizer': 'adam', 'graph_mode': 'off', 'use_snp_selection': True, 'num_snps': 34590}. Best is trial 2 with value: 0.08225658756223755.
[I 2025-12-05 14:25:56,610] Trial 50 finished with value: 0.0621973722131236 and parameters: {'model_type': 'mlp', 'hidden_dims': '[512, 64]', 'dropout': 0.46025241576779896, 'batch_norm': True, 'lr': 5.225505756349642e-05, 'weight_decay': 0.0007450597321029728, 'epochs': 104, 'loss': 'mse', 'optimizer': 'adam', 'graph_mode': 'off', 'use_snp_selection': True, 'num_snps': 4743}. Best is trial 2 with value: 0.08225658756223755.
[I 2025-12-05 14:25:59,125] Trial 51 finished with value: 0.05718426689428781 and parameters: {'model_type': 'mlp', 'hidden_dims': '[256, 128]', 'dropout': 0.43457089523233067, 'batch_norm': False, 'lr': 4.0979861775915936e-05, 'weight_decay': 0.000302563301642103, 'epochs': 143, 'loss': 'mse', 'optimizer': 'adam', 'graph_mode': 'off', 'use_snp_selection': True, 'num_snps': 53796}. Best is trial 2 with value: 0.08225658756223755.
[I 2025-12-05 14:26:01,977] Trial 52 finished with value: 0.06528729223304629 and parameters: {'model_type': 'mlp', 'hidden_dims': '[256, 128]', 'dropout': 0.3904399623253736, 'batch_norm': False, 'lr': 2.9682042972771424e-05, 'weight_decay': 0.00023309104931087856, 'epochs': 124, 'loss': 'mse', 'optimizer': 'adam', 'graph_mode': 'off', 'use_snp_selection': True, 'num_snps': 59885}. Best is trial 2 with value: 0.08225658756223755.
[I 2025-12-05 14:26:04,642] Trial 53 finished with value: 0.08147931320727239 and parameters: {'model_type': 'mlp', 'hidden_dims': '[256, 128]', 'dropout': 0.4286815103245691, 'batch_norm': False, 'lr': 9.56542049923618e-06, 'weight_decay': 7.167645713073718e-06, 'epochs': 134, 'loss': 'mse', 'optimizer': 'adam', 'graph_mode': 'off', 'use_snp_selection': True, 'num_snps': 53588}. Best is trial 2 with value: 0.08225658756223755.
[I 2025-12-05 14:26:06,782] Trial 54 finished with value: 0.04656379101893121 and parameters: {'model_type': 'mlp', 'hidden_dims': '[256, 128]', 'dropout': 0.3440842303155681, 'batch_norm': False, 'lr': 8.839898630940266e-06, 'weight_decay': 4.869326709911344e-06, 'epochs': 157, 'loss': 'mse', 'optimizer': 'adam', 'graph_mode': 'off', 'use_snp_selection': True, 'num_snps': 41114}. Best is trial 2 with value: 0.08225658756223755.
[I 2025-12-05 14:26:07,822] Trial 55 finished with value: 0.055095613341231545 and parameters: {'model_type': 'mlp', 'hidden_dims': '[256, 128, 64]', 'dropout': 0.28517032570149486, 'batch_norm': False, 'lr': 1.5095245160164061e-05, 'weight_decay': 1.0482857635365353e-06, 'epochs': 94, 'loss': 'mse', 'optimizer': 'adam', 'graph_mode': 'off', 'use_snp_selection': True, 'num_snps': 10256}. Best is trial 2 with value: 0.08225658756223755.
