[I 2025-12-05 22:50:12,051] Trial 121 finished with value: 0.2116529697239203 and parameters: {'model_type': 'mlp', 'hidden_dims': '[512, 256]', 'dropout': 0.1848049684392489, 'batch_norm': False, 'lr': 0.00025003048272696283, 'weight_decay': 1.2650811994477636e-07, 'epochs': 91, 'loss': 'mae', 'optimizer': 'adam', 'graph_mode': 'off', 'use_snp_selection': False}. Best is trial 33 with value: 0.21897778420797964.
[I 2025-12-05 22:50:45,223] Trial 122 finished with value: 0.21333431360483107 and parameters: {'model_type': 'mlp', 'hidden_dims': '[512, 256]', 'dropout': 0.18882579414895218, 'batch_norm': False, 'lr': 0.00021497313875891292, 'weight_decay': 1.8592186702303375e-07, 'epochs': 94, 'loss': 'mae', 'optimizer': 'adam', 'graph_mode': 'off', 'use_snp_selection': False}. Best is trial 33 with value: 0.21897778420797964.
[I 2025-12-05 22:51:20,562] Trial 123 finished with value: 0.2075474661178128 and parameters: {'model_type': 'mlp', 'hidden_dims': '[512, 256]', 'dropout': 0.2096509029762905, 'batch_norm': False, 'lr': 0.00018414284567183322, 'weight_decay': 1.8432910176389262e-07, 'epochs': 102, 'loss': 'mae', 'optimizer': 'adam', 'graph_mode': 'off', 'use_snp_selection': False}. Best is trial 33 with value: 0.21897778420797964.
[I 2025-12-05 22:51:45,555] Trial 124 finished with value: 0.2145392630338841 and parameters: {'model_type': 'mlp', 'hidden_dims': '[512, 256]', 'dropout': 0.32148098945322445, 'batch_norm': False, 'lr': 0.00016459044813809038, 'weight_decay': 2.2831806182551283e-07, 'epochs': 64, 'loss': 'mae', 'optimizer': 'adam', 'graph_mode': 'off', 'use_snp_selection': False}. Best is trial 33 with value: 0.21897778420797964.
[I 2025-12-05 22:52:10,826] Trial 125 finished with value: 0.2070455904480629 and parameters: {'model_type': 'mlp', 'hidden_dims': '[512, 256]', 'dropout': 0.32008729809186276, 'batch_norm': False, 'lr': 0.00015582779733296033, 'weight_decay': 2.502915034554607e-07, 'epochs': 65, 'loss': 'mae', 'optimizer': 'adam', 'graph_mode': 'off', 'use_snp_selection': False}. Best is trial 33 with value: 0.21897778420797964.
[I 2025-12-05 22:52:38,753] Trial 126 finished with value: 0.20713446845895467 and parameters: {'model_type': 'mlp', 'hidden_dims': '[512, 64]', 'dropout': 0.39308460046099863, 'batch_norm': False, 'lr': 7.63454838476026e-05, 'weight_decay': 1.6543811214867707e-05, 'epochs': 75, 'loss': 'mae', 'optimizer': 'adam', 'graph_mode': 'off', 'use_snp_selection': False}. Best is trial 33 with value: 0.21897778420797964.
[I 2025-12-05 22:53:29,778] Trial 127 finished with value: 0.20369419019425922 and parameters: {'model_type': 'mlp', 'hidden_dims': '[512, 256]', 'dropout': 0.2952130924378221, 'batch_norm': False, 'lr': 0.00010928856412587043, 'weight_decay': 3.6606036870280864e-07, 'epochs': 160, 'loss': 'mae', 'optimizer': 'adam', 'graph_mode': 'off', 'use_snp_selection': False}. Best is trial 33 with value: 0.21897778420797964.
[I 2025-12-05 22:53:53,672] Trial 128 finished with value: 0.19207333747139982 and parameters: {'model_type': 'mlp', 'hidden_dims': '[512, 256]', 'dropout': 0.2675750556319825, 'batch_norm': False, 'lr': 0.00021046498414242591, 'weight_decay': 6.579261777858526e-07, 'epochs': 60, 'loss': 'mae', 'optimizer': 'adam', 'graph_mode': 'off', 'use_snp_selection': False}. Best is trial 33 with value: 0.21897778420797964.
[I 2025-12-05 22:54:34,910] Trial 129 finished with value: 0.14624254379495222 and parameters: {'model_type': 'mlp', 'hidden_dims': '[512, 128]', 'dropout': 0.33913434624099087, 'batch_norm': False, 'lr': 0.0006418252825585591, 'weight_decay': 0.00019818373171827147, 'epochs': 209, 'loss': 'mae', 'optimizer': 'adam', 'graph_mode': 'off', 'use_snp_selection': True, 'num_snps': 9760}. Best is trial 33 with value: 0.21897778420797964.
[I 2025-12-05 22:54:59,050] Trial 130 finished with value: 0.21571457522064233 and parameters: {'model_type': 'mlp', 'hidden_dims': '[256, 128, 64]', 'dropout': 0.24304134138636374, 'batch_norm': False, 'lr': 0.0003426104979352198, 'weight_decay': 1.632417530384307e-07, 'epochs': 128, 'loss': 'mae', 'optimizer': 'adam', 'graph_mode': 'off', 'use_snp_selection': False}. Best is trial 33 with value: 0.21897778420797964.
[I 2025-12-05 22:55:23,600] Trial 131 finished with value: 0.19931032545383015 and parameters: {'model_type': 'mlp', 'hidden_dims': '[256, 128, 64]', 'dropout': 0.31116409196211225, 'batch_norm': False, 'lr': 0.0003476379721889064, 'weight_decay': 1.5192692169147925e-07, 'epochs': 131, 'loss': 'mae', 'optimizer': 'adam', 'graph_mode': 'off', 'use_snp_selection': False}. Best is trial 33 with value: 0.21897778420797964.
[I 2025-12-05 22:55:46,184] Trial 132 finished with value: 0.20890531717753635 and parameters: {'model_type': 'mlp', 'hidden_dims': '[256, 128, 64]', 'dropout': 0.23871217983016993, 'batch_norm': False, 'lr': 0.000422898276311271, 'weight_decay': 2.3352920322617005e-07, 'epochs': 116, 'loss': 'mae', 'optimizer': 'adam', 'graph_mode': 'off', 'use_snp_selection': False}. Best is trial 33 with value: 0.21897778420797964.
[I 2025-12-05 22:56:13,269] Trial 133 finished with value: 0.20207704776198487 and parameters: {'model_type': 'mlp', 'hidden_dims': '[256, 128, 64]', 'dropout': 0.22861354616409943, 'batch_norm': False, 'lr': 0.0002759618157471821, 'weight_decay': 2.9409818309868955e-07, 'epochs': 148, 'loss': 'mae', 'optimizer': 'adam', 'graph_mode': 'off', 'use_snp_selection': False}. Best is trial 33 with value: 0.21897778420797964.
[I 2025-12-05 22:56:34,633] Trial 134 finished with value: 0.20469657581268788 and parameters: {'model_type': 'mlp', 'hidden_dims': '[256, 128, 64]', 'dropout': 0.11094950301740486, 'batch_norm': False, 'lr': 0.00031426945315664594, 'weight_decay': 1.2695342622909806e-07, 'epochs': 106, 'loss': 'mae', 'optimizer': 'adam', 'graph_mode': 'off', 'use_snp_selection': False}. Best is trial 33 with value: 0.21897778420797964.
[I 2025-12-05 22:57:32,419] Trial 135 finished with value: 0.2085733547390392 and parameters: {'model_type': 'mlp', 'hidden_dims': '[512, 256]', 'dropout': 0.25942944331884094, 'batch_norm': False, 'lr': 6.252967248321517e-06, 'weight_decay': 1.6664714768563333e-07, 'epochs': 179, 'loss': 'mae', 'optimizer': 'adam', 'graph_mode': 'off', 'use_snp_selection': False}. Best is trial 33 with value: 0.21897778420797964.
[I 2025-12-05 22:58:14,215] Trial 136 finished with value: 0.2163196141480434 and parameters: {'model_type': 'mlp', 'hidden_dims': '[512, 256]', 'dropout': 0.2855416060167185, 'batch_norm': False, 'lr': 0.0003770613738003109, 'weight_decay': 2.3272466738541603e-07, 'epochs': 125, 'loss': 'mse', 'optimizer': 'adam', 'graph_mode': 'off', 'use_snp_selection': False}. Best is trial 33 with value: 0.21897778420797964.
[I 2025-12-05 22:58:58,873] Trial 137 finished with value: 0.15068138518421853 and parameters: {'model_type': 'mlp', 'hidden_dims': '[512, 64]', 'dropout': 0.2453930732582993, 'batch_norm': False, 'lr': 0.00038937534472350746, 'weight_decay': 4.1482576735050373e-07, 'epochs': 136, 'loss': 'mse', 'optimizer': 'adam', 'graph_mode': 'off', 'use_snp_selection': False}. Best is trial 33 with value: 0.21897778420797964.
[I 2025-12-05 22:59:41,786] Trial 138 finished with value: 0.1999430558231879 and parameters: {'model_type': 'mlp', 'hidden_dims': '[512, 256]', 'dropout': 0.2871744554059304, 'batch_norm': False, 'lr': 0.00047507024266519346, 'weight_decay': 2.21484079735485e-07, 'epochs': 129, 'loss': 'mse', 'optimizer': 'adam', 'graph_mode': 'off', 'use_snp_selection': False}. Best is trial 33 with value: 0.21897778420797964.
[I 2025-12-05 23:00:23,615] Trial 139 finished with value: 0.18937735311473353 and parameters: {'model_type': 'mlp', 'hidden_dims': '[512, 256]', 'dropout': 0.30254973818182035, 'batch_norm': False, 'lr': 0.0005622116353860057, 'weight_decay': 5.342200544475908e-07, 'epochs': 125, 'loss': 'mse', 'optimizer': 'adam', 'graph_mode': 'off', 'use_snp_selection': False}. Best is trial 33 with value: 0.21897778420797964.
[I 2025-12-05 23:00:47,660] Trial 140 finished with value: 0.19433168531542327 and parameters: {'model_type': 'mlp', 'hidden_dims': '[256, 128, 64]', 'dropout': 0.32794947975911215, 'batch_norm': True, 'lr': 0.0001250248233031505, 'weight_decay': 8.042213830470495e-06, 'epochs': 121, 'loss': 'mse', 'optimizer': 'adam', 'graph_mode': 'off', 'use_snp_selection': False}. Best is trial 33 with value: 0.21897778420797964.
[I 2025-12-05 23:01:18,746] Trial 141 finished with value: 0.19515801321909815 and parameters: {'model_type': 'mlp', 'hidden_dims': '[512, 256]', 'dropout': 0.25294092730613615, 'batch_norm': False, 'lr': 0.0003084686459920305, 'weight_decay': 1.5405273620299873e-07, 'epochs': 86, 'loss': 'mse', 'optimizer': 'adam', 'graph_mode': 'off', 'use_snp_selection': False}. Best is trial 33 with value: 0.21897778420797964.
[I 2025-12-05 23:01:57,177] Trial 142 finished with value: 0.20798324580498018 and parameters: {'model_type': 'mlp', 'hidden_dims': '[512, 256]', 'dropout': 0.26546259258216615, 'batch_norm': False, 'lr': 0.0003649751215105221, 'weight_decay': 2.00449453467272e-07, 'epochs': 113, 'loss': 'mae', 'optimizer': 'adam', 'graph_mode': 'off', 'use_snp_selection': False}. Best is trial 33 with value: 0.21897778420797964.
[I 2025-12-05 23:02:31,563] Trial 143 finished with value: 0.21207953916174954 and parameters: {'model_type': 'mlp', 'hidden_dims': '[512, 256]', 'dropout': 0.35139068579190935, 'batch_norm': False, 'lr': 0.00025653448271848134, 'weight_decay': 1.0177465294368742e-07, 'epochs': 98, 'loss': 'mse', 'optimizer': 'adam', 'graph_mode': 'off', 'use_snp_selection': False}. Best is trial 33 with value: 0.21897778420797964.
[I 2025-12-05 23:03:01,351] Trial 144 finished with value: 0.2173372808845539 and parameters: {'model_type': 'mlp', 'hidden_dims': '[512, 256]', 'dropout': 0.12679511844145572, 'batch_norm': False, 'lr': 0.0004658829253648717, 'weight_decay': 3.0072836374474674e-07, 'epochs': 81, 'loss': 'mae', 'optimizer': 'adam', 'graph_mode': 'off', 'use_snp_selection': False}. Best is trial 33 with value: 0.21897778420797964.
[I 2025-12-05 23:03:31,337] Trial 145 finished with value: 0.20621762059294851 and parameters: {'model_type': 'mlp', 'hidden_dims': '[512, 256]', 'dropout': 0.28032905533025965, 'batch_norm': False, 'lr': 0.0004675383750673042, 'weight_decay': 3.466322404708708e-07, 'epochs': 82, 'loss': 'mae', 'optimizer': 'adam', 'graph_mode': 'off', 'use_snp_selection': False}. Best is trial 33 with value: 0.21897778420797964.
[I 2025-12-05 23:04:07,942] Trial 146 finished with value: 0.21138579451887685 and parameters: {'model_type': 'mlp', 'hidden_dims': '[512, 256]', 'dropout': 0.21716140986850427, 'batch_norm': False, 'lr': 0.000649628912982836, 'weight_decay': 2.8619043122156055e-07, 'epochs': 106, 'loss': 'mae', 'optimizer': 'adam', 'graph_mode': 'off', 'use_snp_selection': False}. Best is trial 33 with value: 0.21897778420797964.
[I 2025-12-05 23:04:24,621] Trial 147 finished with value: 0.2038073874116499 and parameters: {'model_type': 'mlp', 'hidden_dims': '[256, 128]', 'dropout': 0.12313425349083743, 'batch_norm': False, 'lr': 0.0004196160920358995, 'weight_decay': 4.832609372610765e-07, 'epochs': 73, 'loss': 'mse', 'optimizer': 'adam', 'graph_mode': 'off', 'use_snp_selection': False}. Best is trial 33 with value: 0.21897778420797964.
[I 2025-12-05 23:04:47,131] Trial 148 finished with value: 0.11839487642674126 and parameters: {'model_type': 'mlp', 'hidden_dims': '[512, 64]', 'dropout': 0.11098571321621438, 'batch_norm': False, 'lr': 0.0005274207488222244, 'weight_decay': 2.5439344242311994e-07, 'epochs': 55, 'loss': 'mae', 'optimizer': 'adam', 'graph_mode': 'off', 'use_snp_selection': False}. Best is trial 33 with value: 0.21897778420797964.
[I 2025-12-05 23:05:07,015] Trial 149 finished with value: 0.1755447851214073 and parameters: {'model_type': 'mlp', 'hidden_dims': '[512, 256]', 'dropout': 0.19426670916156105, 'batch_norm': False, 'lr': 0.00021070864334359578, 'weight_decay': 3.2162912041363624e-07, 'epochs': 45, 'loss': 'mae', 'optimizer': 'adam', 'graph_mode': 'off', 'use_snp_selection': False}. Best is trial 33 with value: 0.21897778420797964.
[I 2025-12-05 23:06:08,405] Trial 0 finished with value: 0.16745725834174507 and parameters: {'model_type': 'mlp', 'hidden_dims': '[128, 64]', 'dropout': 0.199031432379812, 'batch_norm': True, 'lr': 1.8408544111075837e-06, 'weight_decay': 5.5136510071208614e-05, 'epochs': 336, 'loss': 'mae', 'optimizer': 'adam', 'graph_mode': 'off', 'use_snp_selection': True, 'num_snps': 43862}. Best is trial 0 with value: 0.16745725834174507.
[I 2025-12-05 23:06:46,195] Trial 1 finished with value: 0.20138390882094326 and parameters: {'model_type': 'mlp', 'hidden_dims': '[256, 128]', 'dropout': 0.4370668075331726, 'batch_norm': True, 'lr': 7.133471581159139e-05, 'weight_decay': 1.128633586803549e-05, 'epochs': 242, 'loss': 'mae', 'optimizer': 'adam', 'graph_mode': 'off', 'use_snp_selection': False}. Best is trial 1 with value: 0.20138390882094326.
[I 2025-12-05 23:07:19,774] Trial 2 finished with value: 0.18931446666011723 and parameters: {'model_type': 'mlp', 'hidden_dims': '[256, 128, 64]', 'dropout': 0.41314357415569625, 'batch_norm': False, 'lr': 3.952233718592101e-06, 'weight_decay': 0.00026754769258252603, 'epochs': 149, 'loss': 'mse', 'optimizer': 'adam', 'graph_mode': 'off', 'use_snp_selection': True, 'num_snps': 11571}. Best is trial 1 with value: 0.20138390882094326.
[I 2025-12-05 23:08:47,735] Trial 3 finished with value: 0.2065755749379914 and parameters: {'model_type': 'mlp', 'hidden_dims': '[512, 64]', 'dropout': 0.5938127374509361, 'batch_norm': False, 'lr': 5.67704586114731e-06, 'weight_decay': 2.4518087630137052e-05, 'epochs': 320, 'loss': 'mae', 'optimizer': 'adam', 'graph_mode': 'off', 'use_snp_selection': False}. Best is trial 3 with value: 0.2065755749379914.
[I 2025-12-05 23:10:05,768] Trial 4 finished with value: 0.13456559752541866 and parameters: {'model_type': 'mlp', 'hidden_dims': '[512, 128]', 'dropout': 0.25746343592134413, 'batch_norm': True, 'lr': 1.3467657668402788e-06, 'weight_decay': 0.00033087251918647806, 'epochs': 277, 'loss': 'mse', 'optimizer': 'adam', 'graph_mode': 'off', 'use_snp_selection': True, 'num_snps': 36675}. Best is trial 3 with value: 0.2065755749379914.
[I 2025-12-05 23:11:00,551] Trial 5 finished with value: 0.16291328479918063 and parameters: {'model_type': 'mlp', 'hidden_dims': '[512, 64]', 'dropout': 0.38275350994408375, 'batch_norm': True, 'lr': 1.5586664309232824e-06, 'weight_decay': 0.0008227664668621182, 'epochs': 145, 'loss': 'mae', 'optimizer': 'adam', 'graph_mode': 'off', 'use_snp_selection': True, 'num_snps': 32148}. Best is trial 3 with value: 0.2065755749379914.
[I 2025-12-05 23:11:32,049] Trial 6 finished with value: 0.20609964609701228 and parameters: {'model_type': 'mlp', 'hidden_dims': '[256, 128]', 'dropout': 0.3930109900265879, 'batch_norm': False, 'lr': 4.892964372128395e-05, 'weight_decay': 1.5809549317992182e-06, 'epochs': 199, 'loss': 'mse', 'optimizer': 'adam', 'graph_mode': 'off', 'use_snp_selection': False}. Best is trial 3 with value: 0.2065755749379914.
[I 2025-12-05 23:12:04,204] Trial 7 finished with value: 0.18618855545737306 and parameters: {'model_type': 'mlp', 'hidden_dims': '[512, 256]', 'dropout': 0.15343979219678458, 'batch_norm': True, 'lr': 6.234003099047341e-05, 'weight_decay': 3.894760610535477e-07, 'epochs': 97, 'loss': 'mse', 'optimizer': 'adam', 'graph_mode': 'off', 'use_snp_selection': False}. Best is trial 3 with value: 0.2065755749379914.
[I 2025-12-05 23:13:32,418] Trial 8 finished with value: 0.20631005878541786 and parameters: {'model_type': 'mlp', 'hidden_dims': '[512, 128]', 'dropout': 0.10743001231661406, 'batch_norm': True, 'lr': 0.00023728538449271062, 'weight_decay': 1.7629071578048637e-05, 'epochs': 312, 'loss': 'mae', 'optimizer': 'adam', 'graph_mode': 'off', 'use_snp_selection': False}. Best is trial 3 with value: 0.2065755749379914.
[I 2025-12-05 23:14:25,035] Trial 9 finished with value: 0.2096573648089227 and parameters: {'model_type': 'mlp', 'hidden_dims': '[512, 64]', 'dropout': 0.14505336736221927, 'batch_norm': True, 'lr': 5.8619638388111826e-05, 'weight_decay': 6.200156172669308e-07, 'epochs': 175, 'loss': 'mse', 'optimizer': 'adam', 'graph_mode': 'off', 'use_snp_selection': False}. Best is trial 9 with value: 0.2096573648089227.
[I 2025-12-05 23:14:43,253] Trial 10 finished with value: 0.05980159911002325 and parameters: {'model_type': 'mlp', 'hidden_dims': '[512, 64]', 'dropout': 0.27531666245262887, 'batch_norm': False, 'lr': 0.00032393778075602147, 'weight_decay': 1.1714031539166647e-07, 'epochs': 44, 'loss': 'mse', 'optimizer': 'adam', 'graph_mode': 'off', 'use_snp_selection': False}. Best is trial 9 with value: 0.2096573648089227.
[I 2025-12-05 23:15:44,636] Trial 11 finished with value: 0.20919315596928462 and parameters: {'model_type': 'mlp', 'hidden_dims': '[512, 64]', 'dropout': 0.583942291816117, 'batch_norm': False, 'lr': 1.422933652790185e-05, 'weight_decay': 1.969664044175748e-06, 'epochs': 213, 'loss': 'mae', 'optimizer': 'adam', 'graph_mode': 'off', 'use_snp_selection': False}. Best is trial 9 with value: 0.2096573648089227.
[I 2025-12-05 23:16:45,232] Trial 12 finished with value: 0.21276081721259446 and parameters: {'model_type': 'mlp', 'hidden_dims': '[512, 64]', 'dropout': 0.5723595538175295, 'batch_norm': False, 'lr': 1.3209655691727925e-05, 'weight_decay': 2.0975627484345868e-06, 'epochs': 208, 'loss': 'mae', 'optimizer': 'adam', 'graph_mode': 'off', 'use_snp_selection': False}. Best is trial 12 with value: 0.21276081721259446.
[I 2025-12-05 23:17:32,464] Trial 13 finished with value: 0.19858843698599346 and parameters: {'model_type': 'mlp', 'hidden_dims': '[512, 64]', 'dropout': 0.4914835046718194, 'batch_norm': False, 'lr': 1.537109700844877e-05, 'weight_decay': 2.1978369390547452e-06, 'epochs': 157, 'loss': 'mse', 'optimizer': 'adam', 'graph_mode': 'off', 'use_snp_selection': False}. Best is trial 12 with value: 0.21276081721259446.
[I 2025-12-05 23:17:55,464] Trial 14 finished with value: 0.20296612957281424 and parameters: {'model_type': 'mlp', 'hidden_dims': '[128, 64]', 'dropout': 0.3012984444538551, 'batch_norm': True, 'lr': 0.0001457690241539883, 'weight_decay': 5.850950730213006e-07, 'epochs': 254, 'loss': 'mse', 'optimizer': 'adam', 'graph_mode': 'off', 'use_snp_selection': False}. Best is trial 12 with value: 0.21276081721259446.
[I 2025-12-05 23:18:29,756] Trial 15 finished with value: 0.20527987785116805 and parameters: {'model_type': 'mlp', 'hidden_dims': '[512, 256]', 'dropout': 0.4988905657458984, 'batch_norm': False, 'lr': 1.89989485263331e-05, 'weight_decay': 4.647398975110266e-06, 'epochs': 106, 'loss': 'mae', 'optimizer': 'adam', 'graph_mode': 'off', 'use_snp_selection': False}. Best is trial 12 with value: 0.21276081721259446.
[I 2025-12-05 23:19:00,875] Trial 16 finished with value: 0.19861030017353082 and parameters: {'model_type': 'mlp', 'hidden_dims': '[256, 128, 64]', 'dropout': 0.21424452218420753, 'batch_norm': True, 'lr': 0.0006624584306992511, 'weight_decay': 1.0661008213867922e-07, 'epochs': 186, 'loss': 'mae', 'optimizer': 'adam', 'graph_mode': 'off', 'use_snp_selection': False}. Best is trial 12 with value: 0.21276081721259446.
[I 2025-12-05 23:20:07,135] Trial 17 finished with value: 0.2009223615295476 and parameters: {'model_type': 'mlp', 'hidden_dims': '[512, 64]', 'dropout': 0.32888830259108426, 'batch_norm': False, 'lr': 7.474904384339106e-06, 'weight_decay': 4.4639962184346194e-07, 'epochs': 230, 'loss': 'mse', 'optimizer': 'adam', 'graph_mode': 'off', 'use_snp_selection': False}. Best is trial 12 with value: 0.21276081721259446.
[I 2025-12-05 23:21:54,248] Trial 18 finished with value: 0.19662100923909728 and parameters: {'model_type': 'mlp', 'hidden_dims': '[512, 64]', 'dropout': 0.5273948638225143, 'batch_norm': False, 'lr': 2.9871432947539384e-05, 'weight_decay': 5.399175074092964e-06, 'epochs': 282, 'loss': 'mae', 'optimizer': 'adam', 'graph_mode': 'off', 'use_snp_selection': True, 'num_snps': 58241}. Best is trial 12 with value: 0.21276081721259446.
[I 2025-12-05 23:22:30,175] Trial 19 finished with value: 0.20346557492848275 and parameters: {'model_type': 'mlp', 'hidden_dims': '[512, 64]', 'dropout': 0.12092024350718522, 'batch_norm': True, 'lr': 0.0001339917175887314, 'weight_decay': 9.224522637322544e-07, 'epochs': 112, 'loss': 'mse', 'optimizer': 'adam', 'graph_mode': 'off', 'use_snp_selection': False}. Best is trial 12 with value: 0.21276081721259446.
[I 2025-12-05 23:23:23,660] Trial 20 finished with value: 0.1948291979365021 and parameters: {'model_type': 'mlp', 'hidden_dims': '[512, 128]', 'dropout': 0.4513672923341566, 'batch_norm': True, 'lr': 9.069170483771495e-06, 'weight_decay': 1.9828202531875164e-07, 'epochs': 179, 'loss': 'mse', 'optimizer': 'adam', 'graph_mode': 'off', 'use_snp_selection': False}. Best is trial 12 with value: 0.21276081721259446.
[I 2025-12-05 23:24:25,379] Trial 21 finished with value: 0.207365471470139 and parameters: {'model_type': 'mlp', 'hidden_dims': '[512, 64]', 'dropout': 0.5801943431504863, 'batch_norm': False, 'lr': 2.206007941726312e-05, 'weight_decay': 2.7102426450438144e-06, 'epochs': 215, 'loss': 'mae', 'optimizer': 'adam', 'graph_mode': 'off', 'use_snp_selection': False}. Best is trial 12 with value: 0.21276081721259446.
[I 2025-12-05 23:25:25,472] Trial 22 finished with value: 0.20390393337597512 and parameters: {'model_type': 'mlp', 'hidden_dims': '[512, 64]', 'dropout': 0.5447308805905808, 'batch_norm': False, 'lr': 1.3031913276341235e-05, 'weight_decay': 1.1065191859010336e-06, 'epochs': 207, 'loss': 'mae', 'optimizer': 'adam', 'graph_mode': 'off', 'use_snp_selection': False}. Best is trial 12 with value: 0.21276081721259446.
