[I 2025-12-05 15:59:30,527] Trial 98 finished with value: 0.10121538343836799 and parameters: {'model_type': 'mlp', 'hidden_dims': '[512, 128]', 'dropout': 0.2437040926149166, 'batch_norm': False, 'lr': 0.0004718883037583602, 'weight_decay': 1.1809717999887184e-06, 'epochs': 218, 'loss': 'mae', 'optimizer': 'adam', 'graph_mode': 'off', 'use_snp_selection': False}. Best is trial 68 with value: 0.13608435133868688.
[I 2025-12-05 15:59:32,497] Trial 99 finished with value: 0.07639765693616704 and parameters: {'model_type': 'mlp', 'hidden_dims': '[512, 128]', 'dropout': 0.23359810461669736, 'batch_norm': False, 'lr': 0.0005707546573765281, 'weight_decay': 2.3591583888207377e-06, 'epochs': 168, 'loss': 'mae', 'optimizer': 'adam', 'graph_mode': 'off', 'use_snp_selection': False}. Best is trial 68 with value: 0.13608435133868688.
[I 2025-12-05 15:59:34,577] Trial 100 finished with value: 0.08163242101941971 and parameters: {'model_type': 'mlp', 'hidden_dims': '[512, 128]', 'dropout': 0.27413519405444087, 'batch_norm': True, 'lr': 0.0006797656855494323, 'weight_decay': 1.760789528968948e-06, 'epochs': 180, 'loss': 'mae', 'optimizer': 'adam', 'graph_mode': 'off', 'use_snp_selection': False}. Best is trial 68 with value: 0.13608435133868688.
[I 2025-12-05 15:59:36,944] Trial 101 finished with value: 0.09877252465512482 and parameters: {'model_type': 'mlp', 'hidden_dims': '[512, 128]', 'dropout': 0.2589705301845675, 'batch_norm': False, 'lr': 0.0002716603012972685, 'weight_decay': 5.327890189719775e-06, 'epochs': 223, 'loss': 'mae', 'optimizer': 'adam', 'graph_mode': 'off', 'use_snp_selection': False}. Best is trial 68 with value: 0.13608435133868688.
[I 2025-12-05 15:59:39,422] Trial 102 finished with value: 0.10323486958356769 and parameters: {'model_type': 'mlp', 'hidden_dims': '[512, 128]', 'dropout': 0.5126017984255059, 'batch_norm': False, 'lr': 0.00021006812511281515, 'weight_decay': 8.129729388597353e-07, 'epochs': 237, 'loss': 'mae', 'optimizer': 'adam', 'graph_mode': 'off', 'use_snp_selection': False}. Best is trial 68 with value: 0.13608435133868688.
[I 2025-12-05 15:59:41,599] Trial 103 finished with value: 0.11018941925876656 and parameters: {'model_type': 'mlp', 'hidden_dims': '[512, 128]', 'dropout': 0.22097153134263983, 'batch_norm': False, 'lr': 0.00016680096739698884, 'weight_decay': 2.13245794502879e-06, 'epochs': 197, 'loss': 'mae', 'optimizer': 'adam', 'graph_mode': 'off', 'use_snp_selection': False}. Best is trial 68 with value: 0.13608435133868688.
[I 2025-12-05 15:59:43,751] Trial 104 finished with value: 0.11641350031100732 and parameters: {'model_type': 'mlp', 'hidden_dims': '[512, 128]', 'dropout': 0.18878475591464744, 'batch_norm': False, 'lr': 0.00017911782494273428, 'weight_decay': 2.109679089318926e-06, 'epochs': 191, 'loss': 'mae', 'optimizer': 'adam', 'graph_mode': 'off', 'use_snp_selection': False}. Best is trial 68 with value: 0.13608435133868688.
[I 2025-12-05 15:59:45,885] Trial 105 finished with value: 0.10739962110588798 and parameters: {'model_type': 'mlp', 'hidden_dims': '[512, 128]', 'dropout': 0.16782820382050592, 'batch_norm': False, 'lr': 0.0003955152217999235, 'weight_decay': 1.2419327457495765e-06, 'epochs': 191, 'loss': 'mae', 'optimizer': 'adam', 'graph_mode': 'off', 'use_snp_selection': False}. Best is trial 68 with value: 0.13608435133868688.
[I 2025-12-05 15:59:48,166] Trial 106 finished with value: 0.09807629614633744 and parameters: {'model_type': 'mlp', 'hidden_dims': '[512, 128]', 'dropout': 0.20620686381067185, 'batch_norm': False, 'lr': 9.830916233892472e-05, 'weight_decay': 3.902544518587094e-06, 'epochs': 210, 'loss': 'mse', 'optimizer': 'adam', 'graph_mode': 'off', 'use_snp_selection': False}. Best is trial 68 with value: 0.13608435133868688.
[I 2025-12-05 15:59:50,977] Trial 107 finished with value: 0.10194232143623053 and parameters: {'model_type': 'mlp', 'hidden_dims': '[512, 128]', 'dropout': 0.1867196911282722, 'batch_norm': False, 'lr': 0.00013559592745592284, 'weight_decay': 2.503120593971032e-06, 'epochs': 204, 'loss': 'mae', 'optimizer': 'adam', 'graph_mode': 'off', 'use_snp_selection': True, 'num_snps': 37972}. Best is trial 68 with value: 0.13608435133868688.
[I 2025-12-05 15:59:53,023] Trial 108 finished with value: 0.09216430068200668 and parameters: {'model_type': 'mlp', 'hidden_dims': '[512, 128]', 'dropout': 0.2350223587704062, 'batch_norm': False, 'lr': 0.0002824688008147056, 'weight_decay': 1.5412101036067886e-06, 'epochs': 179, 'loss': 'mae', 'optimizer': 'adam', 'graph_mode': 'off', 'use_snp_selection': False}. Best is trial 68 with value: 0.13608435133868688.
[I 2025-12-05 15:59:55,562] Trial 109 finished with value: 0.0984370093237112 and parameters: {'model_type': 'mlp', 'hidden_dims': '[512, 256]', 'dropout': 0.1477749855033162, 'batch_norm': False, 'lr': 0.00024046301414503197, 'weight_decay': 2.952042715958973e-06, 'epochs': 244, 'loss': 'mae', 'optimizer': 'adam', 'graph_mode': 'off', 'use_snp_selection': False}. Best is trial 68 with value: 0.13608435133868688.
[I 2025-12-05 15:59:57,762] Trial 110 finished with value: 0.10005146090624756 and parameters: {'model_type': 'mlp', 'hidden_dims': '[512, 64]', 'dropout': 0.1875485860151055, 'batch_norm': False, 'lr': 0.0009741614186533236, 'weight_decay': 7.762125819667566e-06, 'epochs': 200, 'loss': 'mae', 'optimizer': 'adam', 'graph_mode': 'off', 'use_snp_selection': False}. Best is trial 68 with value: 0.13608435133868688.
[I 2025-12-05 15:59:59,911] Trial 111 finished with value: 0.09331625553006255 and parameters: {'model_type': 'mlp', 'hidden_dims': '[512, 128]', 'dropout': 0.21820218968693345, 'batch_norm': False, 'lr': 0.00020556659665365066, 'weight_decay': 1.9074202144329694e-06, 'epochs': 193, 'loss': 'mae', 'optimizer': 'adam', 'graph_mode': 'off', 'use_snp_selection': False}. Best is trial 68 with value: 0.13608435133868688.
[I 2025-12-05 16:00:01,989] Trial 112 finished with value: 0.11441011062238426 and parameters: {'model_type': 'mlp', 'hidden_dims': '[512, 128]', 'dropout': 0.22274868890576824, 'batch_norm': False, 'lr': 0.00016293947961171706, 'weight_decay': 2.0573869518737414e-06, 'epochs': 185, 'loss': 'mae', 'optimizer': 'adam', 'graph_mode': 'off', 'use_snp_selection': False}. Best is trial 68 with value: 0.13608435133868688.
[I 2025-12-05 16:00:04,628] Trial 113 finished with value: 0.0956447553580458 and parameters: {'model_type': 'mlp', 'hidden_dims': '[512, 128]', 'dropout': 0.20214679184199802, 'batch_norm': False, 'lr': 0.0003304650003204354, 'weight_decay': 5.748889736568604e-07, 'epochs': 255, 'loss': 'mae', 'optimizer': 'adam', 'graph_mode': 'off', 'use_snp_selection': False}. Best is trial 68 with value: 0.13608435133868688.
[I 2025-12-05 16:00:06,512] Trial 114 finished with value: 0.10855697006328152 and parameters: {'model_type': 'mlp', 'hidden_dims': '[512, 128]', 'dropout': 0.2478388992302833, 'batch_norm': False, 'lr': 0.0001707575951381724, 'weight_decay': 5.0976794104256425e-06, 'epochs': 158, 'loss': 'mae', 'optimizer': 'adam', 'graph_mode': 'off', 'use_snp_selection': False}. Best is trial 68 with value: 0.13608435133868688.
[I 2025-12-05 16:00:08,858] Trial 115 finished with value: 0.1124931165859832 and parameters: {'model_type': 'mlp', 'hidden_dims': '[512, 128]', 'dropout': 0.2812309839821312, 'batch_norm': False, 'lr': 0.0004033897054670873, 'weight_decay': 1.0293110462733473e-07, 'epochs': 219, 'loss': 'mae', 'optimizer': 'adam', 'graph_mode': 'off', 'use_snp_selection': False}. Best is trial 68 with value: 0.13608435133868688.
[I 2025-12-05 16:00:11,203] Trial 116 finished with value: 0.1044275372055374 and parameters: {'model_type': 'mlp', 'hidden_dims': '[512, 128]', 'dropout': 0.32253984515043566, 'batch_norm': False, 'lr': 0.00038437604031804287, 'weight_decay': 1.1847004203682852e-07, 'epochs': 218, 'loss': 'mae', 'optimizer': 'adam', 'graph_mode': 'off', 'use_snp_selection': False}. Best is trial 68 with value: 0.13608435133868688.
[I 2025-12-05 16:00:13,632] Trial 117 finished with value: 0.10227101207583143 and parameters: {'model_type': 'mlp', 'hidden_dims': '[512, 128]', 'dropout': 0.2993827292300723, 'batch_norm': False, 'lr': 0.0004388792116332891, 'weight_decay': 1.5248270056043768e-07, 'epochs': 230, 'loss': 'mae', 'optimizer': 'adam', 'graph_mode': 'off', 'use_snp_selection': False}. Best is trial 68 with value: 0.13608435133868688.
[I 2025-12-05 16:00:15,913] Trial 118 finished with value: 0.10101794357956136 and parameters: {'model_type': 'mlp', 'hidden_dims': '[512, 128]', 'dropout': 0.16104982171748475, 'batch_norm': False, 'lr': 0.0002415966393714814, 'weight_decay': 1.2090505630300555e-07, 'epochs': 210, 'loss': 'mae', 'optimizer': 'adam', 'graph_mode': 'off', 'use_snp_selection': False}. Best is trial 68 with value: 0.13608435133868688.
[I 2025-12-05 16:00:18,322] Trial 119 finished with value: 0.07688902357221347 and parameters: {'model_type': 'mlp', 'hidden_dims': '[512, 128]', 'dropout': 0.28098972267142114, 'batch_norm': True, 'lr': 0.0005554650208328262, 'weight_decay': 1.052427038133006e-06, 'epochs': 221, 'loss': 'mae', 'optimizer': 'adam', 'graph_mode': 'off', 'use_snp_selection': False}. Best is trial 68 with value: 0.13608435133868688.
[I 2025-12-05 16:00:20,795] Trial 120 finished with value: 0.12641720078902874 and parameters: {'model_type': 'mlp', 'hidden_dims': '[512, 128]', 'dropout': 0.2908531595589828, 'batch_norm': False, 'lr': 0.00031613907572818577, 'weight_decay': 1.9830361694667786e-07, 'epochs': 236, 'loss': 'mae', 'optimizer': 'adam', 'graph_mode': 'off', 'use_snp_selection': False}. Best is trial 68 with value: 0.13608435133868688.
[I 2025-12-05 16:00:23,334] Trial 121 finished with value: 0.108259398331278 and parameters: {'model_type': 'mlp', 'hidden_dims': '[512, 128]', 'dropout': 0.2893479142563183, 'batch_norm': False, 'lr': 0.0003457190754555819, 'weight_decay': 1.0675684630220521e-07, 'epochs': 244, 'loss': 'mae', 'optimizer': 'adam', 'graph_mode': 'off', 'use_snp_selection': False}. Best is trial 68 with value: 0.13608435133868688.
[I 2025-12-05 16:00:25,775] Trial 122 finished with value: 0.09781939384321953 and parameters: {'model_type': 'mlp', 'hidden_dims': '[512, 128]', 'dropout': 0.2673084260546471, 'batch_norm': False, 'lr': 0.0007109928316731658, 'weight_decay': 2.238267960347523e-07, 'epochs': 232, 'loss': 'mae', 'optimizer': 'adam', 'graph_mode': 'off', 'use_snp_selection': False}. Best is trial 68 with value: 0.13608435133868688.
[I 2025-12-05 16:00:29,001] Trial 123 finished with value: 0.08257556795533842 and parameters: {'model_type': 'mlp', 'hidden_dims': '[512, 128]', 'dropout': 0.3116543785296141, 'batch_norm': False, 'lr': 0.0005101575254872077, 'weight_decay': 1.368593146475641e-07, 'epochs': 330, 'loss': 'mae', 'optimizer': 'adam', 'graph_mode': 'off', 'use_snp_selection': False}. Best is trial 68 with value: 0.13608435133868688.
[I 2025-12-05 16:00:31,493] Trial 124 finished with value: 0.10359398726302745 and parameters: {'model_type': 'mlp', 'hidden_dims': '[512, 128]', 'dropout': 0.30386091359593326, 'batch_norm': False, 'lr': 0.0002723012301492093, 'weight_decay': 2.084926273984895e-07, 'epochs': 238, 'loss': 'mae', 'optimizer': 'adam', 'graph_mode': 'off', 'use_snp_selection': False}. Best is trial 68 with value: 0.13608435133868688.
[I 2025-12-05 16:00:32,481] Trial 125 finished with value: 0.08506351892349351 and parameters: {'model_type': 'mlp', 'hidden_dims': '[128, 64]', 'dropout': 0.2294555557070808, 'batch_norm': False, 'lr': 0.000220653602113069, 'weight_decay': 3.514072369899276e-07, 'epochs': 251, 'loss': 'mae', 'optimizer': 'adam', 'graph_mode': 'off', 'use_snp_selection': False}. Best is trial 68 with value: 0.13608435133868688.
[I 2025-12-05 16:00:34,853] Trial 126 finished with value: 0.09237227612951286 and parameters: {'model_type': 'mlp', 'hidden_dims': '[512, 128]', 'dropout': 0.24027109834004728, 'batch_norm': False, 'lr': 0.00014493615787270208, 'weight_decay': 2.0152896398334496e-07, 'epochs': 227, 'loss': 'mse', 'optimizer': 'adam', 'graph_mode': 'off', 'use_snp_selection': True, 'num_snps': 28304}. Best is trial 68 with value: 0.13608435133868688.
[I 2025-12-05 16:00:36,826] Trial 127 finished with value: 0.08671266511149892 and parameters: {'model_type': 'mlp', 'hidden_dims': '[512, 128]', 'dropout': 0.2780510483661558, 'batch_norm': False, 'lr': 0.0006778638284773658, 'weight_decay': 2.8174643437580356e-07, 'epochs': 172, 'loss': 'mae', 'optimizer': 'adam', 'graph_mode': 'off', 'use_snp_selection': False}. Best is trial 68 with value: 0.13608435133868688.
[I 2025-12-05 16:00:39,277] Trial 128 finished with value: 0.11381744946174156 and parameters: {'model_type': 'mlp', 'hidden_dims': '[512, 128]', 'dropout': 0.33868826086361625, 'batch_norm': False, 'lr': 0.00043974968003645073, 'weight_decay': 3.8107333474747223e-06, 'epochs': 235, 'loss': 'mae', 'optimizer': 'adam', 'graph_mode': 'off', 'use_snp_selection': False}. Best is trial 68 with value: 0.13608435133868688.
[I 2025-12-05 16:00:41,558] Trial 129 finished with value: 0.10254966576360204 and parameters: {'model_type': 'mlp', 'hidden_dims': '[512, 128]', 'dropout': 0.17699071285309156, 'batch_norm': False, 'lr': 0.00029703046923083696, 'weight_decay': 3.4546703545225863e-06, 'epochs': 213, 'loss': 'mae', 'optimizer': 'adam', 'graph_mode': 'off', 'use_snp_selection': False}. Best is trial 68 with value: 0.13608435133868688.
[I 2025-12-05 16:00:43,654] Trial 130 finished with value: 0.10852004653729247 and parameters: {'model_type': 'mlp', 'hidden_dims': '[512, 128]', 'dropout': 0.19544559143508303, 'batch_norm': False, 'lr': 0.0007753435151041026, 'weight_decay': 2.645218157618644e-06, 'epochs': 188, 'loss': 'mae', 'optimizer': 'adam', 'graph_mode': 'off', 'use_snp_selection': False}. Best is trial 68 with value: 0.13608435133868688.
[I 2025-12-05 16:00:45,053] Trial 131 finished with value: 0.09240934884456499 and parameters: {'model_type': 'mlp', 'hidden_dims': '[256, 128, 64]', 'dropout': 0.3347818771528407, 'batch_norm': False, 'lr': 0.0003590807211819489, 'weight_decay': 2.1958706334190603e-06, 'epochs': 226, 'loss': 'mae', 'optimizer': 'adam', 'graph_mode': 'off', 'use_snp_selection': False}. Best is trial 68 with value: 0.13608435133868688.
[I 2025-12-05 16:00:47,521] Trial 132 finished with value: 0.10620786280924302 and parameters: {'model_type': 'mlp', 'hidden_dims': '[512, 128]', 'dropout': 0.31965485085032724, 'batch_norm': False, 'lr': 0.00019119082067383194, 'weight_decay': 1.0264098602215276e-07, 'epochs': 237, 'loss': 'mae', 'optimizer': 'adam', 'graph_mode': 'off', 'use_snp_selection': False}. Best is trial 68 with value: 0.13608435133868688.
[I 2025-12-05 16:00:50,181] Trial 133 finished with value: 0.10041654266676993 and parameters: {'model_type': 'mlp', 'hidden_dims': '[512, 128]', 'dropout': 0.29151263032115826, 'batch_norm': False, 'lr': 0.00044045573084008276, 'weight_decay': 4.1806536493979364e-06, 'epochs': 262, 'loss': 'mae', 'optimizer': 'adam', 'graph_mode': 'off', 'use_snp_selection': False}. Best is trial 68 with value: 0.13608435133868688.
[I 2025-12-05 16:00:51,545] Trial 134 finished with value: 0.07494485762346928 and parameters: {'model_type': 'mlp', 'hidden_dims': '[256, 128]', 'dropout': 0.34073284919482966, 'batch_norm': False, 'lr': 0.0004882101406385548, 'weight_decay': 1.5509644008063759e-06, 'epochs': 219, 'loss': 'mae', 'optimizer': 'adam', 'graph_mode': 'off', 'use_snp_selection': False}. Best is trial 68 with value: 0.13608435133868688.
[I 2025-12-05 16:00:54,007] Trial 135 finished with value: 0.10160188673511317 and parameters: {'model_type': 'mlp', 'hidden_dims': '[512, 128]', 'dropout': 0.35792755217372363, 'batch_norm': False, 'lr': 8.047046361778729e-05, 'weight_decay': 1.7270737279254627e-07, 'epochs': 233, 'loss': 'mae', 'optimizer': 'adam', 'graph_mode': 'off', 'use_snp_selection': False}. Best is trial 68 with value: 0.13608435133868688.
[I 2025-12-05 16:00:55,468] Trial 136 finished with value: 0.06450380860672343 and parameters: {'model_type': 'mlp', 'hidden_dims': '[256, 128]', 'dropout': 0.4899923225839221, 'batch_norm': False, 'lr': 0.00025013834526715445, 'weight_decay': 2.7844201247859345e-06, 'epochs': 246, 'loss': 'mae', 'optimizer': 'adam', 'graph_mode': 'off', 'use_snp_selection': False}. Best is trial 68 with value: 0.13608435133868688.
[I 2025-12-05 16:00:57,701] Trial 137 finished with value: 0.09903057449248037 and parameters: {'model_type': 'mlp', 'hidden_dims': '[512, 64]', 'dropout': 0.21454675589328018, 'batch_norm': False, 'lr': 0.00010552998835441078, 'weight_decay': 6.245590972619755e-06, 'epochs': 205, 'loss': 'mae', 'optimizer': 'adam', 'graph_mode': 'off', 'use_snp_selection': False}. Best is trial 68 with value: 0.13608435133868688.
[I 2025-12-05 16:01:00,212] Trial 138 finished with value: 0.09227882081615274 and parameters: {'model_type': 'mlp', 'hidden_dims': '[512, 128]', 'dropout': 0.3048632883740852, 'batch_norm': False, 'lr': 0.0004166713536667504, 'weight_decay': 1.3508217195151034e-07, 'epochs': 240, 'loss': 'mae', 'optimizer': 'adam', 'graph_mode': 'off', 'use_snp_selection': False}. Best is trial 68 with value: 0.13608435133868688.
[I 2025-12-05 16:01:01,590] Trial 139 finished with value: 0.09179255203384941 and parameters: {'model_type': 'mlp', 'hidden_dims': '[256, 128]', 'dropout': 0.32579946809324384, 'batch_norm': False, 'lr': 0.000334926341202718, 'weight_decay': 3.6161388400495805e-06, 'epochs': 222, 'loss': 'mae', 'optimizer': 'adam', 'graph_mode': 'off', 'use_snp_selection': False}. Best is trial 68 with value: 0.13608435133868688.
[I 2025-12-05 16:01:04,392] Trial 140 finished with value: 0.02290157552226373 and parameters: {'model_type': 'mlp', 'hidden_dims': '[512, 128]', 'dropout': 0.5468028390382208, 'batch_norm': True, 'lr': 9.964539927590545e-06, 'weight_decay': 1.3942274298029887e-06, 'epochs': 273, 'loss': 'mae', 'optimizer': 'adam', 'graph_mode': 'off', 'use_snp_selection': False}. Best is trial 68 with value: 0.13608435133868688.
[I 2025-12-05 16:01:06,371] Trial 141 finished with value: 0.11625210128927455 and parameters: {'model_type': 'mlp', 'hidden_dims': '[512, 256]', 'dropout': 0.2607999284782738, 'batch_norm': False, 'lr': 1.4705434092834877e-05, 'weight_decay': 9.125284810596751e-06, 'epochs': 167, 'loss': 'mae', 'optimizer': 'adam', 'graph_mode': 'off', 'use_snp_selection': False}. Best is trial 68 with value: 0.13608435133868688.
[I 2025-12-05 16:01:08,325] Trial 142 finished with value: 0.10117978617670402 and parameters: {'model_type': 'mlp', 'hidden_dims': '[512, 256]', 'dropout': 0.2531713469465052, 'batch_norm': False, 'lr': 1.1748704251738608e-05, 'weight_decay': 1.20324119131329e-05, 'epochs': 166, 'loss': 'mae', 'optimizer': 'adam', 'graph_mode': 'off', 'use_snp_selection': False}. Best is trial 68 with value: 0.13608435133868688.
[I 2025-12-05 16:01:10,646] Trial 143 finished with value: 0.0914318041715208 and parameters: {'model_type': 'mlp', 'hidden_dims': '[512, 256]', 'dropout': 0.22630310064472361, 'batch_norm': False, 'lr': 2.6559761587254416e-05, 'weight_decay': 2.101392991561403e-06, 'epochs': 215, 'loss': 'mae', 'optimizer': 'adam', 'graph_mode': 'off', 'use_snp_selection': False}. Best is trial 68 with value: 0.13608435133868688.
[I 2025-12-05 16:01:13,086] Trial 144 finished with value: 0.11480213281504408 and parameters: {'model_type': 'mlp', 'hidden_dims': '[512, 256]', 'dropout': 0.26639478325498783, 'batch_norm': False, 'lr': 3.532500030437444e-05, 'weight_decay': 4.302460031706933e-06, 'epochs': 228, 'loss': 'mae', 'optimizer': 'adam', 'graph_mode': 'off', 'use_snp_selection': False}. Best is trial 68 with value: 0.13608435133868688.
[I 2025-12-05 16:01:15,104] Trial 145 finished with value: 0.11016115512911956 and parameters: {'model_type': 'mlp', 'hidden_dims': '[512, 256]', 'dropout': 0.266846166500993, 'batch_norm': False, 'lr': 3.417267540219732e-05, 'weight_decay': 4.61979369388912e-06, 'epochs': 175, 'loss': 'mae', 'optimizer': 'adam', 'graph_mode': 'off', 'use_snp_selection': False}. Best is trial 68 with value: 0.13608435133868688.
[I 2025-12-05 16:01:16,932] Trial 146 finished with value: 0.10863455882954275 and parameters: {'model_type': 'mlp', 'hidden_dims': '[512, 256]', 'dropout': 0.2754826090146002, 'batch_norm': False, 'lr': 5.5419078304337236e-05, 'weight_decay': 3.3769202689040904e-06, 'epochs': 152, 'loss': 'mae', 'optimizer': 'adam', 'graph_mode': 'off', 'use_snp_selection': False}. Best is trial 68 with value: 0.13608435133868688.
[I 2025-12-05 16:01:19,122] Trial 147 finished with value: 0.11908971852127331 and parameters: {'model_type': 'mlp', 'hidden_dims': '[512, 256]', 'dropout': 0.25028232945980833, 'batch_norm': False, 'lr': 4.2070200502418917e-05, 'weight_decay': 5.903575705703148e-06, 'epochs': 198, 'loss': 'mae', 'optimizer': 'adam', 'graph_mode': 'off', 'use_snp_selection': False}. Best is trial 68 with value: 0.13608435133868688.
[I 2025-12-05 16:01:21,323] Trial 148 finished with value: 0.1156471104294919 and parameters: {'model_type': 'mlp', 'hidden_dims': '[512, 256]', 'dropout': 0.2479016977530385, 'batch_norm': False, 'lr': 4.012314627748546e-05, 'weight_decay': 9.717423291680872e-06, 'epochs': 199, 'loss': 'mae', 'optimizer': 'adam', 'graph_mode': 'off', 'use_snp_selection': False}. Best is trial 68 with value: 0.13608435133868688.
[I 2025-12-05 16:01:22,811] Trial 149 finished with value: 0.08157255167976935 and parameters: {'model_type': 'mlp', 'hidden_dims': '[512, 256]', 'dropout': 0.24756399424118863, 'batch_norm': False, 'lr': 4.432866443763854e-05, 'weight_decay': 8.661246225718514e-06, 'epochs': 196, 'loss': 'mae', 'optimizer': 'adam', 'graph_mode': 'off', 'use_snp_selection': True, 'num_snps': 12822}. Best is trial 68 with value: 0.13608435133868688.
