[I 2025-12-05 18:12:02,038] Trial 53 finished with value: 0.3167070945708928 and parameters: {'model_type': 'mlp', 'hidden_dims': '[256, 128]', 'dropout': 0.5756401350899658, 'batch_norm': False, 'lr': 1.0247559065854295e-05, 'weight_decay': 3.573507472817944e-05, 'epochs': 308, 'loss': 'mae', 'optimizer': 'adam', 'graph_mode': 'off', 'use_snp_selection': False}. Best is trial 53 with value: 0.3167070945708928.
[I 2025-12-05 18:12:21,249] Trial 54 finished with value: 0.3074213604224146 and parameters: {'model_type': 'mlp', 'hidden_dims': '[128, 64]', 'dropout': 0.5685205074567202, 'batch_norm': False, 'lr': 1.4984694671455485e-05, 'weight_decay': 3.5323494726419926e-05, 'epochs': 287, 'loss': 'mae', 'optimizer': 'adam', 'graph_mode': 'off', 'use_snp_selection': False}. Best is trial 53 with value: 0.3167070945708928.
[I 2025-12-05 18:12:55,099] Trial 55 finished with value: 0.29896419597767976 and parameters: {'model_type': 'mlp', 'hidden_dims': '[256, 128]', 'dropout': 0.5791517312645493, 'batch_norm': False, 'lr': 8.644011960314135e-05, 'weight_decay': 4.012982341241758e-05, 'epochs': 323, 'loss': 'mae', 'optimizer': 'adam', 'graph_mode': 'off', 'use_snp_selection': False}. Best is trial 53 with value: 0.3167070945708928.
[I 2025-12-05 18:13:23,742] Trial 56 finished with value: 0.29147262888462505 and parameters: {'model_type': 'mlp', 'hidden_dims': '[256, 128, 64]', 'dropout': 0.5807192795190023, 'batch_norm': False, 'lr': 7.407514108089171e-06, 'weight_decay': 0.00010186231298846797, 'epochs': 264, 'loss': 'mae', 'optimizer': 'adam', 'graph_mode': 'off', 'use_snp_selection': False}. Best is trial 53 with value: 0.3167070945708928.
[I 2025-12-05 18:13:53,764] Trial 57 finished with value: 0.30916579606781125 and parameters: {'model_type': 'mlp', 'hidden_dims': '[256, 128]', 'dropout': 0.5499129843177032, 'batch_norm': True, 'lr': 1.4680521159079617e-05, 'weight_decay': 2.4902348994701532e-05, 'epochs': 277, 'loss': 'mae', 'optimizer': 'adam', 'graph_mode': 'off', 'use_snp_selection': False}. Best is trial 53 with value: 0.3167070945708928.
[I 2025-12-05 18:14:10,586] Trial 58 finished with value: 0.3116423663727927 and parameters: {'model_type': 'mlp', 'hidden_dims': '[128, 64]', 'dropout': 0.5028484285117489, 'batch_norm': False, 'lr': 1.9213808290015706e-05, 'weight_decay': 4.94980924336001e-05, 'epochs': 241, 'loss': 'mse', 'optimizer': 'adam', 'graph_mode': 'off', 'use_snp_selection': False}. Best is trial 53 with value: 0.3167070945708928.
[I 2025-12-05 18:14:31,827] Trial 59 finished with value: 0.12913922559663407 and parameters: {'model_type': 'mlp', 'hidden_dims': '[256, 128]', 'dropout': 0.4753741922108535, 'batch_norm': False, 'lr': 0.0008124203504309952, 'weight_decay': 0.0003464672799364246, 'epochs': 183, 'loss': 'mae', 'optimizer': 'adam', 'graph_mode': 'off', 'use_snp_selection': False}. Best is trial 53 with value: 0.3167070945708928.
[I 2025-12-05 18:15:29,414] Trial 60 finished with value: 0.3108365764615575 and parameters: {'model_type': 'mlp', 'hidden_dims': '[512, 256]', 'dropout': 0.5995020488206142, 'batch_norm': False, 'lr': 1.0576847236910425e-05, 'weight_decay': 7.701562781638573e-07, 'epochs': 301, 'loss': 'mae', 'optimizer': 'adam', 'graph_mode': 'off', 'use_snp_selection': False}. Best is trial 53 with value: 0.3167070945708928.
[I 2025-12-05 18:16:02,300] Trial 61 finished with value: 0.3117901681089444 and parameters: {'model_type': 'mlp', 'hidden_dims': '[256, 128]', 'dropout': 0.5428427059947641, 'batch_norm': False, 'lr': 1.0195334560947539e-05, 'weight_decay': 1.2068050000959288e-06, 'epochs': 311, 'loss': 'mae', 'optimizer': 'adam', 'graph_mode': 'off', 'use_snp_selection': False}. Best is trial 53 with value: 0.3167070945708928.
[I 2025-12-05 18:16:34,907] Trial 62 finished with value: 0.31412038030360134 and parameters: {'model_type': 'mlp', 'hidden_dims': '[256, 128]', 'dropout': 0.5343071385708305, 'batch_norm': False, 'lr': 8.099790863248174e-06, 'weight_decay': 9.437879191754387e-06, 'epochs': 307, 'loss': 'mae', 'optimizer': 'adam', 'graph_mode': 'off', 'use_snp_selection': False}. Best is trial 53 with value: 0.3167070945708928.
[I 2025-12-05 18:17:06,325] Trial 63 finished with value: 0.3115335073405731 and parameters: {'model_type': 'mlp', 'hidden_dims': '[256, 128]', 'dropout': 0.5766284699365525, 'batch_norm': False, 'lr': 6.842035322034108e-06, 'weight_decay': 1.0357310792528033e-05, 'epochs': 294, 'loss': 'mae', 'optimizer': 'adam', 'graph_mode': 'off', 'use_snp_selection': False}. Best is trial 53 with value: 0.3167070945708928.
[I 2025-12-05 18:17:17,859] Trial 64 finished with value: 0.29521255363838994 and parameters: {'model_type': 'mlp', 'hidden_dims': '[256, 128]', 'dropout': 0.5282722014433447, 'batch_norm': False, 'lr': 1.3257488487838836e-05, 'weight_decay': 2.168254592543841e-05, 'epochs': 75, 'loss': 'mae', 'optimizer': 'adam', 'graph_mode': 'off', 'use_snp_selection': False}. Best is trial 53 with value: 0.3167070945708928.
[I 2025-12-05 18:17:53,667] Trial 65 finished with value: 0.31320152176149274 and parameters: {'model_type': 'mlp', 'hidden_dims': '[256, 128]', 'dropout': 0.49245912597128394, 'batch_norm': False, 'lr': 8.402934444399414e-06, 'weight_decay': 5.432195414487921e-06, 'epochs': 342, 'loss': 'mae', 'optimizer': 'adam', 'graph_mode': 'off', 'use_snp_selection': False}. Best is trial 53 with value: 0.3167070945708928.
[I 2025-12-05 18:18:58,746] Trial 66 finished with value: 0.3053276083050155 and parameters: {'model_type': 'mlp', 'hidden_dims': '[512, 64]', 'dropout': 0.44562559802686613, 'batch_norm': False, 'lr': 2.756476398991573e-05, 'weight_decay': 3.1726125585134944e-05, 'epochs': 346, 'loss': 'mae', 'optimizer': 'adam', 'graph_mode': 'off', 'use_snp_selection': False}. Best is trial 53 with value: 0.3167070945708928.
[I 2025-12-05 18:19:37,154] Trial 67 finished with value: 0.3057801574876644 and parameters: {'model_type': 'mlp', 'hidden_dims': '[256, 128]', 'dropout': 0.5028017799564809, 'batch_norm': False, 'lr': 4.177959857308655e-06, 'weight_decay': 2.0768710163467764e-06, 'epochs': 332, 'loss': 'mae', 'optimizer': 'adam', 'graph_mode': 'off', 'use_snp_selection': True, 'num_snps': 22951}. Best is trial 53 with value: 0.3167070945708928.
[I 2025-12-05 18:19:58,177] Trial 68 finished with value: 0.31070023453076107 and parameters: {'model_type': 'mlp', 'hidden_dims': '[128, 64]', 'dropout': 0.5536119768083817, 'batch_norm': False, 'lr': 2.195308846916755e-05, 'weight_decay': 6.008248258503636e-06, 'epochs': 323, 'loss': 'mae', 'optimizer': 'adam', 'graph_mode': 'off', 'use_snp_selection': False}. Best is trial 53 with value: 0.3167070945708928.
[I 2025-12-05 18:20:30,587] Trial 69 finished with value: 0.3140517228653012 and parameters: {'model_type': 'mlp', 'hidden_dims': '[256, 128]', 'dropout': 0.49101567417054875, 'batch_norm': False, 'lr': 8.80109101618419e-06, 'weight_decay': 5.612362399311181e-05, 'epochs': 307, 'loss': 'mae', 'optimizer': 'adam', 'graph_mode': 'off', 'use_snp_selection': False}. Best is trial 53 with value: 0.3167070945708928.
[I 2025-12-05 18:21:06,192] Trial 70 finished with value: 0.3107521397715656 and parameters: {'model_type': 'mlp', 'hidden_dims': '[256, 128]', 'dropout': 0.13452214782112018, 'batch_norm': False, 'lr': 8.723008221314225e-06, 'weight_decay': 7.958036069649608e-05, 'epochs': 340, 'loss': 'mae', 'optimizer': 'adam', 'graph_mode': 'off', 'use_snp_selection': False}. Best is trial 53 with value: 0.3167070945708928.
[I 2025-12-05 18:21:38,932] Trial 71 finished with value: 0.3086050094613052 and parameters: {'model_type': 'mlp', 'hidden_dims': '[256, 128]', 'dropout': 0.49068570766355113, 'batch_norm': False, 'lr': 1.622356950776427e-05, 'weight_decay': 4.9702631775552696e-05, 'epochs': 310, 'loss': 'mae', 'optimizer': 'adam', 'graph_mode': 'off', 'use_snp_selection': False}. Best is trial 53 with value: 0.3167070945708928.
[I 2025-12-05 18:22:13,222] Trial 72 finished with value: 0.31030071417145744 and parameters: {'model_type': 'mlp', 'hidden_dims': '[256, 128]', 'dropout': 0.5242728778728151, 'batch_norm': False, 'lr': 1.0667627126810758e-05, 'weight_decay': 0.0001934014256053514, 'epochs': 326, 'loss': 'mae', 'optimizer': 'adam', 'graph_mode': 'off', 'use_snp_selection': False}. Best is trial 53 with value: 0.3167070945708928.
[I 2025-12-05 18:22:43,497] Trial 73 finished with value: 0.31348266182430184 and parameters: {'model_type': 'mlp', 'hidden_dims': '[256, 128]', 'dropout': 0.47944029057832593, 'batch_norm': False, 'lr': 6.315274992782154e-06, 'weight_decay': 2.3358310516252799e-07, 'epochs': 281, 'loss': 'mae', 'optimizer': 'adam', 'graph_mode': 'off', 'use_snp_selection': False}. Best is trial 53 with value: 0.3167070945708928.
[I 2025-12-05 18:23:15,947] Trial 74 finished with value: 0.3130536145425431 and parameters: {'model_type': 'mlp', 'hidden_dims': '[256, 128]', 'dropout': 0.4709992045194187, 'batch_norm': False, 'lr': 6.2406704478707595e-06, 'weight_decay': 2.424493944698557e-07, 'epochs': 305, 'loss': 'mae', 'optimizer': 'adam', 'graph_mode': 'off', 'use_snp_selection': False}. Best is trial 53 with value: 0.3167070945708928.
[I 2025-12-05 18:23:44,681] Trial 75 finished with value: 0.295187119381736 and parameters: {'model_type': 'mlp', 'hidden_dims': '[256, 128]', 'dropout': 0.5807984468736918, 'batch_norm': False, 'lr': 3.008297045537543e-06, 'weight_decay': 1.3036043363037001e-05, 'epochs': 265, 'loss': 'mae', 'optimizer': 'adam', 'graph_mode': 'off', 'use_snp_selection': False}. Best is trial 53 with value: 0.3167070945708928.
[I 2025-12-05 18:24:14,890] Trial 76 finished with value: 0.31375344021813134 and parameters: {'model_type': 'mlp', 'hidden_dims': '[256, 128]', 'dropout': 0.42311935424052194, 'batch_norm': False, 'lr': 8.071613069475953e-06, 'weight_decay': 8.338030966585164e-06, 'epochs': 280, 'loss': 'mae', 'optimizer': 'adam', 'graph_mode': 'off', 'use_snp_selection': False}. Best is trial 53 with value: 0.3167070945708928.
[I 2025-12-05 18:24:45,301] Trial 77 finished with value: 0.30167919109840385 and parameters: {'model_type': 'mlp', 'hidden_dims': '[256, 128]', 'dropout': 0.5341100992298475, 'batch_norm': True, 'lr': 4.55780038084242e-06, 'weight_decay': 1.3790075310670526e-07, 'epochs': 280, 'loss': 'mae', 'optimizer': 'adam', 'graph_mode': 'off', 'use_snp_selection': False}. Best is trial 53 with value: 0.3167070945708928.
[I 2025-12-05 18:25:08,288] Trial 78 finished with value: 0.26771388109875394 and parameters: {'model_type': 'mlp', 'hidden_dims': '[256, 128]', 'dropout': 0.37641570682603914, 'batch_norm': False, 'lr': 5.1496563259230015e-06, 'weight_decay': 1.9986009716439145e-05, 'epochs': 298, 'loss': 'mse', 'optimizer': 'adam', 'graph_mode': 'off', 'use_snp_selection': True, 'num_snps': 2246}. Best is trial 53 with value: 0.3167070945708928.
[I 2025-12-05 18:25:58,438] Trial 79 finished with value: 0.3161443241967683 and parameters: {'model_type': 'mlp', 'hidden_dims': '[512, 128]', 'dropout': 0.4168097062885565, 'batch_norm': False, 'lr': 7.1821885378129524e-06, 'weight_decay': 8.544857661292563e-06, 'epochs': 259, 'loss': 'mae', 'optimizer': 'adam', 'graph_mode': 'off', 'use_snp_selection': False}. Best is trial 53 with value: 0.3167070945708928.
[I 2025-12-05 18:26:48,111] Trial 80 finished with value: 0.31298647931129475 and parameters: {'model_type': 'mlp', 'hidden_dims': '[512, 128]', 'dropout': 0.41916407677634904, 'batch_norm': False, 'lr': 1.2969593671941955e-05, 'weight_decay': 8.759746504811429e-06, 'epochs': 256, 'loss': 'mae', 'optimizer': 'adam', 'graph_mode': 'off', 'use_snp_selection': False}. Best is trial 53 with value: 0.3167070945708928.
[I 2025-12-05 18:27:41,197] Trial 81 finished with value: 0.31530723681452855 and parameters: {'model_type': 'mlp', 'hidden_dims': '[512, 128]', 'dropout': 0.38904097448077163, 'batch_norm': False, 'lr': 6.852148043778438e-06, 'weight_decay': 3.187275104940774e-05, 'epochs': 274, 'loss': 'mae', 'optimizer': 'adam', 'graph_mode': 'off', 'use_snp_selection': False}. Best is trial 53 with value: 0.3167070945708928.
[I 2025-12-05 18:28:25,351] Trial 82 finished with value: 0.31248521166808124 and parameters: {'model_type': 'mlp', 'hidden_dims': '[512, 128]', 'dropout': 0.40092991867250266, 'batch_norm': False, 'lr': 7.571820265242276e-06, 'weight_decay': 2.843420317611077e-05, 'epochs': 223, 'loss': 'mae', 'optimizer': 'adam', 'graph_mode': 'off', 'use_snp_selection': False}. Best is trial 53 with value: 0.3167070945708928.
[I 2025-12-05 18:29:17,886] Trial 83 finished with value: 0.3110139846433791 and parameters: {'model_type': 'mlp', 'hidden_dims': '[512, 128]', 'dropout': 0.3287819498458352, 'batch_norm': False, 'lr': 9.269328632699694e-06, 'weight_decay': 6.366992093182508e-05, 'epochs': 271, 'loss': 'mae', 'optimizer': 'adam', 'graph_mode': 'off', 'use_snp_selection': False}. Best is trial 53 with value: 0.3167070945708928.
[I 2025-12-05 18:30:05,002] Trial 84 finished with value: 0.31460700370492367 and parameters: {'model_type': 'mlp', 'hidden_dims': '[512, 128]', 'dropout': 0.35400364331978534, 'batch_norm': False, 'lr': 3.929136831224068e-06, 'weight_decay': 4.774150216671067e-05, 'epochs': 240, 'loss': 'mae', 'optimizer': 'adam', 'graph_mode': 'off', 'use_snp_selection': False}. Best is trial 53 with value: 0.3167070945708928.
[I 2025-12-05 18:31:05,214] Trial 85 finished with value: 0.31672912691660354 and parameters: {'model_type': 'mlp', 'hidden_dims': '[512, 128]', 'dropout': 0.3777026233804489, 'batch_norm': False, 'lr': 3.945914238154551e-06, 'weight_decay': 1.668459589023045e-05, 'epochs': 315, 'loss': 'mae', 'optimizer': 'adam', 'graph_mode': 'off', 'use_snp_selection': False}. Best is trial 85 with value: 0.31672912691660354.
[I 2025-12-05 18:32:05,604] Trial 86 finished with value: 0.30787740402938607 and parameters: {'model_type': 'mlp', 'hidden_dims': '[512, 128]', 'dropout': 0.38224571826467635, 'batch_norm': False, 'lr': 1.9773320890320178e-06, 'weight_decay': 1.6700935548245884e-05, 'epochs': 316, 'loss': 'mae', 'optimizer': 'adam', 'graph_mode': 'off', 'use_snp_selection': False}. Best is trial 85 with value: 0.31672912691660354.
[I 2025-12-05 18:32:53,942] Trial 87 finished with value: 0.2971205320926 and parameters: {'model_type': 'mlp', 'hidden_dims': '[512, 128]', 'dropout': 0.3413446681105166, 'batch_norm': False, 'lr': 1.3945153597292273e-06, 'weight_decay': 0.00010133620207067208, 'epochs': 247, 'loss': 'mae', 'optimizer': 'adam', 'graph_mode': 'off', 'use_snp_selection': False}. Best is trial 85 with value: 0.31672912691660354.
[I 2025-12-05 18:33:52,865] Trial 88 finished with value: 0.2857381992624704 and parameters: {'model_type': 'mlp', 'hidden_dims': '[512, 128]', 'dropout': 0.3671175105267389, 'batch_norm': True, 'lr': 3.3411729098846228e-06, 'weight_decay': 0.0001393786081886934, 'epochs': 306, 'loss': 'mae', 'optimizer': 'adam', 'graph_mode': 'off', 'use_snp_selection': False}. Best is trial 85 with value: 0.31672912691660354.
[I 2025-12-05 18:34:48,099] Trial 89 finished with value: 0.3064975988599191 and parameters: {'model_type': 'mlp', 'hidden_dims': '[512, 128]', 'dropout': 0.29972652057074456, 'batch_norm': False, 'lr': 1.7081534129763304e-06, 'weight_decay': 6.194641806785432e-05, 'epochs': 286, 'loss': 'mae', 'optimizer': 'adam', 'graph_mode': 'off', 'use_snp_selection': False}. Best is trial 85 with value: 0.31672912691660354.
[I 2025-12-05 18:36:02,860] Trial 90 finished with value: 0.31637453789044984 and parameters: {'model_type': 'mlp', 'hidden_dims': '[512, 128]', 'dropout': 0.3485342000602061, 'batch_norm': False, 'lr': 2.359493867960876e-06, 'weight_decay': 1.89526388083453e-05, 'epochs': 298, 'loss': 'mse', 'optimizer': 'adam', 'graph_mode': 'off', 'use_snp_selection': True, 'num_snps': 48165}. Best is trial 85 with value: 0.31672912691660354.
[I 2025-12-05 18:37:17,239] Trial 91 finished with value: 0.3151649730488554 and parameters: {'model_type': 'mlp', 'hidden_dims': '[512, 128]', 'dropout': 0.3515873002821805, 'batch_norm': False, 'lr': 2.4427523268529387e-06, 'weight_decay': 1.3601985485442676e-05, 'epochs': 296, 'loss': 'mse', 'optimizer': 'adam', 'graph_mode': 'off', 'use_snp_selection': True, 'num_snps': 48276}. Best is trial 85 with value: 0.31672912691660354.
[I 2025-12-05 18:38:31,033] Trial 92 finished with value: 0.3121797440575295 and parameters: {'model_type': 'mlp', 'hidden_dims': '[512, 128]', 'dropout': 0.3579659029088511, 'batch_norm': False, 'lr': 2.428261582064114e-06, 'weight_decay': 2.9799328922688044e-05, 'epochs': 297, 'loss': 'mse', 'optimizer': 'adam', 'graph_mode': 'off', 'use_snp_selection': True, 'num_snps': 47303}. Best is trial 85 with value: 0.31672912691660354.
[I 2025-12-05 18:39:45,849] Trial 93 finished with value: 0.30548673605899157 and parameters: {'model_type': 'mlp', 'hidden_dims': '[512, 128]', 'dropout': 0.33611665499901056, 'batch_norm': False, 'lr': 1.0012747605243703e-06, 'weight_decay': 1.9109221235811412e-05, 'epochs': 272, 'loss': 'mse', 'optimizer': 'adam', 'graph_mode': 'off', 'use_snp_selection': True, 'num_snps': 51626}. Best is trial 85 with value: 0.31672912691660354.
[I 2025-12-05 18:40:52,007] Trial 94 finished with value: 0.3136489688920857 and parameters: {'model_type': 'mlp', 'hidden_dims': '[512, 128]', 'dropout': 0.3886368842990062, 'batch_norm': False, 'lr': 3.6441668392720702e-06, 'weight_decay': 4.554978236204958e-05, 'epochs': 317, 'loss': 'mse', 'optimizer': 'adam', 'graph_mode': 'off', 'use_snp_selection': True, 'num_snps': 38862}. Best is trial 85 with value: 0.31672912691660354.
[I 2025-12-05 18:42:10,326] Trial 95 finished with value: 0.3172677545951165 and parameters: {'model_type': 'mlp', 'hidden_dims': '[512, 128]', 'dropout': 0.30783301342142005, 'batch_norm': False, 'lr': 2.5297180179266372e-06, 'weight_decay': 1.216508471096168e-05, 'epochs': 290, 'loss': 'mse', 'optimizer': 'adam', 'graph_mode': 'off', 'use_snp_selection': True, 'num_snps': 52148}. Best is trial 95 with value: 0.3172677545951165.
[I 2025-12-05 18:43:28,263] Trial 96 finished with value: 0.31340296566584513 and parameters: {'model_type': 'mlp', 'hidden_dims': '[512, 128]', 'dropout': 0.31026569460297904, 'batch_norm': False, 'lr': 2.3322166463663925e-06, 'weight_decay': 9.78374313271271e-06, 'epochs': 289, 'loss': 'mse', 'optimizer': 'adam', 'graph_mode': 'off', 'use_snp_selection': True, 'num_snps': 51857}. Best is trial 95 with value: 0.3172677545951165.
[I 2025-12-05 18:44:39,784] Trial 97 finished with value: 0.3145288500791563 and parameters: {'model_type': 'mlp', 'hidden_dims': '[512, 128]', 'dropout': 0.2864324279909376, 'batch_norm': False, 'lr': 3.079688736951232e-06, 'weight_decay': 1.266256073386155e-05, 'epochs': 239, 'loss': 'mse', 'optimizer': 'adam', 'graph_mode': 'off', 'use_snp_selection': True, 'num_snps': 52993}. Best is trial 95 with value: 0.3172677545951165.
[I 2025-12-05 18:45:49,515] Trial 98 finished with value: 0.3103492437081782 and parameters: {'model_type': 'mlp', 'hidden_dims': '[512, 128]', 'dropout': 0.27302619363910025, 'batch_norm': False, 'lr': 3.070548074614886e-06, 'weight_decay': 1.3088930939516712e-05, 'epochs': 238, 'loss': 'mse', 'optimizer': 'adam', 'graph_mode': 'off', 'use_snp_selection': True, 'num_snps': 51358}. Best is trial 95 with value: 0.3172677545951165.
[I 2025-12-05 18:46:49,200] Trial 99 finished with value: 0.3066198580348517 and parameters: {'model_type': 'mlp', 'hidden_dims': '[512, 128]', 'dropout': 0.28512096729406977, 'batch_norm': False, 'lr': 1.5101923443980152e-06, 'weight_decay': 2.6699719443643423e-05, 'epochs': 228, 'loss': 'mse', 'optimizer': 'adam', 'graph_mode': 'off', 'use_snp_selection': True, 'num_snps': 41877}. Best is trial 95 with value: 0.3172677545951165.
[I 2025-12-05 18:47:56,829] Trial 100 finished with value: 0.31273149069165534 and parameters: {'model_type': 'mlp', 'hidden_dims': '[512, 128]', 'dropout': 0.24959412364823105, 'batch_norm': False, 'lr': 2.4803416474311785e-06, 'weight_decay': 3.507239281198367e-05, 'epochs': 204, 'loss': 'mse', 'optimizer': 'adam', 'graph_mode': 'off', 'use_snp_selection': True, 'num_snps': 54957}. Best is trial 95 with value: 0.3172677545951165.
[I 2025-12-05 18:49:03,947] Trial 101 finished with value: 0.31213068304366764 and parameters: {'model_type': 'mlp', 'hidden_dims': '[512, 128]', 'dropout': 0.35185212830639434, 'batch_norm': False, 'lr': 3.92581637393996e-06, 'weight_decay': 1.1730756132378465e-05, 'epochs': 249, 'loss': 'mse', 'optimizer': 'adam', 'graph_mode': 'off', 'use_snp_selection': True, 'num_snps': 47252}. Best is trial 95 with value: 0.3172677545951165.
[I 2025-12-05 18:50:21,633] Trial 102 finished with value: 0.30754791468282044 and parameters: {'model_type': 'mlp', 'hidden_dims': '[512, 128]', 'dropout': 0.31786145709473435, 'batch_norm': False, 'lr': 1.2594017837483995e-06, 'weight_decay': 1.814004160377266e-05, 'epochs': 271, 'loss': 'mse', 'optimizer': 'adam', 'graph_mode': 'off', 'use_snp_selection': True, 'num_snps': 54909}. Best is trial 95 with value: 0.3172677545951165.
[I 2025-12-05 18:51:20,235] Trial 103 finished with value: 0.308452230277376 and parameters: {'model_type': 'mlp', 'hidden_dims': '[512, 128]', 'dropout': 0.4061847392651552, 'batch_norm': False, 'lr': 1.754703915318376e-06, 'weight_decay': 4.017552036128016e-06, 'epochs': 295, 'loss': 'mse', 'optimizer': 'adam', 'graph_mode': 'off', 'use_snp_selection': True, 'num_snps': 34500}. Best is trial 95 with value: 0.3172677545951165.
[I 2025-12-05 18:52:23,565] Trial 104 finished with value: 0.31331940114388634 and parameters: {'model_type': 'mlp', 'hidden_dims': '[512, 128]', 'dropout': 0.343341494898523, 'batch_norm': False, 'lr': 4.972026367860653e-06, 'weight_decay': 7.462082352440774e-06, 'epochs': 259, 'loss': 'mse', 'optimizer': 'adam', 'graph_mode': 'off', 'use_snp_selection': True, 'num_snps': 42102}. Best is trial 95 with value: 0.3172677545951165.
