[I 2025-12-05 21:37:50,939] Trial 19 finished with value: 0.2883855713655776 and parameters: {'model_type': 'mlp', 'hidden_dims': '[512, 64]', 'dropout': 0.47355279224247543, 'batch_norm': False, 'lr': 3.776052753656041e-06, 'weight_decay': 2.8130326038007742e-05, 'epochs': 314, 'loss': 'mae', 'optimizer': 'adam', 'graph_mode': 'off', 'use_snp_selection': True, 'num_snps': 55667}. Best is trial 18 with value: 0.292005467600474.
[I 2025-12-05 21:39:11,132] Trial 20 finished with value: 0.2871354022191966 and parameters: {'model_type': 'mlp', 'hidden_dims': '[512, 256]', 'dropout': 0.34258156279977026, 'batch_norm': False, 'lr': 2.8365080110951606e-06, 'weight_decay': 0.00017680016161656075, 'epochs': 266, 'loss': 'mae', 'optimizer': 'adam', 'graph_mode': 'off', 'use_snp_selection': True, 'num_snps': 57703}. Best is trial 18 with value: 0.292005467600474.
[I 2025-12-05 21:39:39,158] Trial 21 finished with value: 0.26778908061679263 and parameters: {'model_type': 'mlp', 'hidden_dims': '[256, 128]', 'dropout': 0.5675598050602048, 'batch_norm': False, 'lr': 6.788409120150372e-06, 'weight_decay': 1.044089997714747e-05, 'epochs': 224, 'loss': 'mse', 'optimizer': 'adam', 'graph_mode': 'off', 'use_snp_selection': True, 'num_snps': 11878}. Best is trial 18 with value: 0.292005467600474.
[I 2025-12-05 21:40:14,508] Trial 22 finished with value: 0.2694215736480882 and parameters: {'model_type': 'mlp', 'hidden_dims': '[256, 128]', 'dropout': 0.4606876289530824, 'batch_norm': False, 'lr': 2.4880512057502122e-05, 'weight_decay': 4.902902559033757e-06, 'epochs': 258, 'loss': 'mse', 'optimizer': 'adam', 'graph_mode': 'off', 'use_snp_selection': True, 'num_snps': 22259}. Best is trial 18 with value: 0.292005467600474.
[I 2025-12-05 21:41:10,016] Trial 23 finished with value: 0.2852722263614109 and parameters: {'model_type': 'mlp', 'hidden_dims': '[256, 128]', 'dropout': 0.5457724774320233, 'batch_norm': False, 'lr': 2.590096042123008e-06, 'weight_decay': 0.0001172650810773634, 'epochs': 324, 'loss': 'mse', 'optimizer': 'adam', 'graph_mode': 'off', 'use_snp_selection': True, 'num_snps': 46925}. Best is trial 18 with value: 0.292005467600474.
[I 2025-12-05 21:41:41,775] Trial 24 finished with value: 0.2569690630847174 and parameters: {'model_type': 'mlp', 'hidden_dims': '[256, 128]', 'dropout': 0.5997927039447736, 'batch_norm': False, 'lr': 1.039365661316365e-06, 'weight_decay': 1.728055951158896e-05, 'epochs': 300, 'loss': 'mse', 'optimizer': 'adam', 'graph_mode': 'off', 'use_snp_selection': False}. Best is trial 18 with value: 0.292005467600474.
[I 2025-12-05 21:42:06,304] Trial 25 finished with value: 0.2932565658465382 and parameters: {'model_type': 'mlp', 'hidden_dims': '[256, 128, 64]', 'dropout': 0.5082623722482305, 'batch_norm': False, 'lr': 7.57803033512188e-06, 'weight_decay': 2.1646471474967044e-06, 'epochs': 219, 'loss': 'mse', 'optimizer': 'adam', 'graph_mode': 'off', 'use_snp_selection': False}. Best is trial 25 with value: 0.2932565658465382.
[I 2025-12-05 21:42:28,537] Trial 26 finished with value: 0.22760617128450505 and parameters: {'model_type': 'mlp', 'hidden_dims': '[256, 128, 64]', 'dropout': 0.5021320494797137, 'batch_norm': False, 'lr': 7.427408284141827e-06, 'weight_decay': 1.0921072183740921e-06, 'epochs': 172, 'loss': 'mse', 'optimizer': 'adam', 'graph_mode': 'off', 'use_snp_selection': True, 'num_snps': 2344}. Best is trial 25 with value: 0.2932565658465382.
[I 2025-12-05 21:42:52,170] Trial 27 finished with value: 0.2851410508145926 and parameters: {'model_type': 'mlp', 'hidden_dims': '[256, 128, 64]', 'dropout': 0.46354598096857513, 'batch_norm': False, 'lr': 5.734533291014392e-06, 'weight_decay': 2.677922139666298e-07, 'epochs': 209, 'loss': 'mse', 'optimizer': 'adam', 'graph_mode': 'off', 'use_snp_selection': False}. Best is trial 25 with value: 0.2932565658465382.
[I 2025-12-05 21:43:45,609] Trial 28 finished with value: 0.2844800516833793 and parameters: {'model_type': 'mlp', 'hidden_dims': '[256, 128, 64]', 'dropout': 0.5368392599721372, 'batch_norm': False, 'lr': 2.4241776229057106e-05, 'weight_decay': 2.9216091049296347e-05, 'epochs': 274, 'loss': 'mae', 'optimizer': 'adam', 'graph_mode': 'off', 'use_snp_selection': True, 'num_snps': 48700}. Best is trial 25 with value: 0.2932565658465382.
[I 2025-12-05 21:44:21,448] Trial 29 finished with value: 0.2609158860941571 and parameters: {'model_type': 'mlp', 'hidden_dims': '[128, 64]', 'dropout': 0.3410026008167736, 'batch_norm': False, 'lr': 2.013127950335488e-06, 'weight_decay': 7.136198737480179e-05, 'epochs': 348, 'loss': 'mae', 'optimizer': 'adam', 'graph_mode': 'off', 'use_snp_selection': True, 'num_snps': 26940}. Best is trial 25 with value: 0.2932565658465382.
[I 2025-12-05 21:45:23,248] Trial 30 finished with value: 0.2661572486487855 and parameters: {'model_type': 'mlp', 'hidden_dims': '[512, 128]', 'dropout': 0.44130222136633734, 'batch_norm': False, 'lr': 3.654672262847388e-05, 'weight_decay': 5.032654394007813e-06, 'epochs': 326, 'loss': 'mse', 'optimizer': 'adam', 'graph_mode': 'off', 'use_snp_selection': False}. Best is trial 25 with value: 0.2932565658465382.
[I 2025-12-05 21:45:38,933] Trial 31 finished with value: 0.28828097256956886 and parameters: {'model_type': 'mlp', 'hidden_dims': '[128, 64]', 'dropout': 0.5617876478359802, 'batch_norm': False, 'lr': 1.2001161366087648e-05, 'weight_decay': 2.0303710796254367e-06, 'epochs': 220, 'loss': 'mse', 'optimizer': 'adam', 'graph_mode': 'off', 'use_snp_selection': False}. Best is trial 25 with value: 0.2932565658465382.
[I 2025-12-05 21:46:05,305] Trial 32 finished with value: 0.29111297454919605 and parameters: {'model_type': 'mlp', 'hidden_dims': '[256, 128]', 'dropout': 0.5120572945021377, 'batch_norm': False, 'lr': 9.368769560127443e-06, 'weight_decay': 8.741234522748179e-06, 'epochs': 240, 'loss': 'mse', 'optimizer': 'adam', 'graph_mode': 'off', 'use_snp_selection': False}. Best is trial 25 with value: 0.2932565658465382.
[I 2025-12-05 21:46:26,149] Trial 33 finished with value: 0.2684993563735231 and parameters: {'model_type': 'mlp', 'hidden_dims': '[256, 128, 64]', 'dropout': 0.4981472019620859, 'batch_norm': False, 'lr': 3.245316491535749e-06, 'weight_decay': 8.59447002637945e-06, 'epochs': 178, 'loss': 'mse', 'optimizer': 'adam', 'graph_mode': 'off', 'use_snp_selection': False}. Best is trial 25 with value: 0.2932565658465382.
[I 2025-12-05 21:47:15,209] Trial 34 finished with value: 0.2729435583093056 and parameters: {'model_type': 'mlp', 'hidden_dims': '[512, 64]', 'dropout': 0.4288331668452211, 'batch_norm': True, 'lr': 4.886772043508892e-06, 'weight_decay': 1.4425915527039603e-05, 'epochs': 249, 'loss': 'mse', 'optimizer': 'adam', 'graph_mode': 'off', 'use_snp_selection': False}. Best is trial 25 with value: 0.2932565658465382.
[I 2025-12-05 21:47:33,014] Trial 35 finished with value: 0.29325691394572695 and parameters: {'model_type': 'mlp', 'hidden_dims': '[256, 128]', 'dropout': 0.5134384588990412, 'batch_norm': False, 'lr': 9.26207715258732e-06, 'weight_decay': 2.542829425208171e-05, 'epochs': 144, 'loss': 'mse', 'optimizer': 'adam', 'graph_mode': 'off', 'use_snp_selection': False}. Best is trial 35 with value: 0.29325691394572695.
[I 2025-12-05 21:47:48,313] Trial 36 finished with value: 0.289780747888514 and parameters: {'model_type': 'mlp', 'hidden_dims': '[256, 128]', 'dropout': 0.47665069595857895, 'batch_norm': False, 'lr': 9.012181327596543e-06, 'weight_decay': 8.184265994087156e-05, 'epochs': 117, 'loss': 'mse', 'optimizer': 'adam', 'graph_mode': 'off', 'use_snp_selection': False}. Best is trial 35 with value: 0.29325691394572695.
[I 2025-12-05 21:48:28,273] Trial 37 finished with value: 0.2692242084492874 and parameters: {'model_type': 'mlp', 'hidden_dims': '[256, 128]', 'dropout': 0.39016201574650633, 'batch_norm': False, 'lr': 2.0503184115062543e-06, 'weight_decay': 6.7149500466045235e-06, 'epochs': 149, 'loss': 'mse', 'optimizer': 'adam', 'graph_mode': 'off', 'use_snp_selection': True, 'num_snps': 38290}. Best is trial 35 with value: 0.29325691394572695.
[I 2025-12-05 21:48:44,215] Trial 38 finished with value: 0.2801262333224879 and parameters: {'model_type': 'mlp', 'hidden_dims': '[256, 128]', 'dropout': 0.5190621442734947, 'batch_norm': True, 'lr': 9.250692288620987e-05, 'weight_decay': 7.693332628041968e-07, 'epochs': 120, 'loss': 'mse', 'optimizer': 'adam', 'graph_mode': 'off', 'use_snp_selection': False}. Best is trial 35 with value: 0.29325691394572695.
[I 2025-12-05 21:49:37,504] Trial 39 finished with value: 0.28124875289192525 and parameters: {'model_type': 'mlp', 'hidden_dims': '[256, 128]', 'dropout': 0.23472685141223326, 'batch_norm': False, 'lr': 1.8842944064517208e-05, 'weight_decay': 0.0005796356212594659, 'epochs': 183, 'loss': 'mse', 'optimizer': 'adam', 'graph_mode': 'off', 'use_snp_selection': True, 'num_snps': 59978}. Best is trial 35 with value: 0.29325691394572695.
[I 2025-12-05 21:49:56,968] Trial 40 finished with value: 0.2740232240463437 and parameters: {'model_type': 'mlp', 'hidden_dims': '[256, 128, 64]', 'dropout': 0.4241206339341783, 'batch_norm': True, 'lr': 3.7260176703947365e-05, 'weight_decay': 2.8694421062573714e-05, 'epochs': 162, 'loss': 'mse', 'optimizer': 'adam', 'graph_mode': 'off', 'use_snp_selection': False}. Best is trial 35 with value: 0.29325691394572695.
[I 2025-12-05 21:50:52,568] Trial 41 finished with value: 0.29286042887917174 and parameters: {'model_type': 'mlp', 'hidden_dims': '[512, 128]', 'dropout': 0.5589232404295662, 'batch_norm': False, 'lr': 4.197132957062296e-06, 'weight_decay': 2.252931127141142e-05, 'epochs': 290, 'loss': 'mse', 'optimizer': 'adam', 'graph_mode': 'off', 'use_snp_selection': False}. Best is trial 35 with value: 0.29325691394572695.
[I 2025-12-05 21:51:47,066] Trial 42 finished with value: 0.29417822467010557 and parameters: {'model_type': 'mlp', 'hidden_dims': '[512, 128]', 'dropout': 0.5618236931925369, 'batch_norm': False, 'lr': 4.447618088136288e-06, 'weight_decay': 1.469272359952922e-05, 'epochs': 283, 'loss': 'mse', 'optimizer': 'adam', 'graph_mode': 'off', 'use_snp_selection': False}. Best is trial 42 with value: 0.29417822467010557.
[I 2025-12-05 21:52:42,460] Trial 43 finished with value: 0.29441347602737666 and parameters: {'model_type': 'mlp', 'hidden_dims': '[512, 128]', 'dropout': 0.5637688519566673, 'batch_norm': False, 'lr': 4.178276593298317e-06, 'weight_decay': 1.5536977202872865e-05, 'epochs': 288, 'loss': 'mse', 'optimizer': 'adam', 'graph_mode': 'off', 'use_snp_selection': False}. Best is trial 43 with value: 0.29441347602737666.
[I 2025-12-05 21:53:38,280] Trial 44 finished with value: 0.27987514608759473 and parameters: {'model_type': 'mlp', 'hidden_dims': '[512, 128]', 'dropout': 0.5635330179220248, 'batch_norm': False, 'lr': 1.3359264270583485e-06, 'weight_decay': 4.1701380667262434e-05, 'epochs': 290, 'loss': 'mse', 'optimizer': 'adam', 'graph_mode': 'off', 'use_snp_selection': False}. Best is trial 43 with value: 0.29441347602737666.
[I 2025-12-05 21:53:56,149] Trial 45 finished with value: 0.2701299612132635 and parameters: {'model_type': 'mlp', 'hidden_dims': '[512, 128]', 'dropout': 0.5577985758098085, 'batch_norm': False, 'lr': 4.89088272078228e-06, 'weight_decay': 2.5238635078405776e-05, 'epochs': 73, 'loss': 'mse', 'optimizer': 'adam', 'graph_mode': 'off', 'use_snp_selection': False}. Best is trial 43 with value: 0.29441347602737666.
[I 2025-12-05 21:54:22,779] Trial 46 finished with value: 0.25741409693327716 and parameters: {'model_type': 'mlp', 'hidden_dims': '[512, 128]', 'dropout': 0.5768532713981189, 'batch_norm': True, 'lr': 2.2340380920062175e-06, 'weight_decay': 0.00011016295257321644, 'epochs': 122, 'loss': 'mse', 'optimizer': 'adam', 'graph_mode': 'off', 'use_snp_selection': False}. Best is trial 43 with value: 0.29441347602737666.
[I 2025-12-05 21:55:21,000] Trial 47 finished with value: 0.28543440760506117 and parameters: {'model_type': 'mlp', 'hidden_dims': '[512, 128]', 'dropout': 0.5283425993336275, 'batch_norm': False, 'lr': 6.706426652191669e-06, 'weight_decay': 4.091926865390614e-06, 'epochs': 304, 'loss': 'mse', 'optimizer': 'adam', 'graph_mode': 'off', 'use_snp_selection': False}. Best is trial 43 with value: 0.29441347602737666.
[I 2025-12-05 21:56:15,080] Trial 48 finished with value: 0.28702191179018754 and parameters: {'model_type': 'mlp', 'hidden_dims': '[512, 128]', 'dropout': 0.5396210795721057, 'batch_norm': False, 'lr': 1.5125904623320387e-06, 'weight_decay': 1.799345812328361e-05, 'epochs': 280, 'loss': 'mse', 'optimizer': 'adam', 'graph_mode': 'off', 'use_snp_selection': False}. Best is trial 43 with value: 0.29441347602737666.
[I 2025-12-05 21:56:44,402] Trial 49 finished with value: 0.29080657677419014 and parameters: {'model_type': 'mlp', 'hidden_dims': '[512, 128]', 'dropout': 0.3705412610296772, 'batch_norm': False, 'lr': 4.419671336236749e-06, 'weight_decay': 1.2887751646940294e-05, 'epochs': 138, 'loss': 'mse', 'optimizer': 'adam', 'graph_mode': 'off', 'use_snp_selection': False}. Best is trial 43 with value: 0.29441347602737666.
[I 2025-12-05 21:57:05,117] Trial 50 finished with value: 0.2813336526046151 and parameters: {'model_type': 'mlp', 'hidden_dims': '[512, 128]', 'dropout': 0.45545096616737346, 'batch_norm': False, 'lr': 3.0237093987015347e-06, 'weight_decay': 2.8522235303494337e-06, 'epochs': 89, 'loss': 'mse', 'optimizer': 'adam', 'graph_mode': 'off', 'use_snp_selection': False}. Best is trial 43 with value: 0.29441347602737666.
[I 2025-12-05 21:57:55,482] Trial 51 finished with value: 0.2942009157608041 and parameters: {'model_type': 'mlp', 'hidden_dims': '[512, 128]', 'dropout': 0.5789253020956329, 'batch_norm': False, 'lr': 3.970535833543874e-06, 'weight_decay': 3.986967220004005e-05, 'epochs': 259, 'loss': 'mse', 'optimizer': 'adam', 'graph_mode': 'off', 'use_snp_selection': False}. Best is trial 43 with value: 0.29441347602737666.
[I 2025-12-05 21:58:50,852] Trial 52 finished with value: 0.2818819294959011 and parameters: {'model_type': 'mlp', 'hidden_dims': '[512, 128]', 'dropout': 0.599633118831174, 'batch_norm': False, 'lr': 1.2092069369949137e-05, 'weight_decay': 4.340611389233299e-05, 'epochs': 289, 'loss': 'mse', 'optimizer': 'adam', 'graph_mode': 'off', 'use_snp_selection': False}. Best is trial 43 with value: 0.29441347602737666.
[I 2025-12-05 21:59:43,526] Trial 53 finished with value: 0.2930109552647792 and parameters: {'model_type': 'mlp', 'hidden_dims': '[512, 128]', 'dropout': 0.5785552743542098, 'batch_norm': False, 'lr': 3.715219834196554e-06, 'weight_decay': 2.1218748371864156e-05, 'epochs': 272, 'loss': 'mse', 'optimizer': 'adam', 'graph_mode': 'off', 'use_snp_selection': False}. Best is trial 43 with value: 0.29441347602737666.
[I 2025-12-05 22:00:26,038] Trial 54 finished with value: 0.28952708684592854 and parameters: {'model_type': 'mlp', 'hidden_dims': '[512, 128]', 'dropout': 0.5218972733965546, 'batch_norm': False, 'lr': 6.62487901611983e-06, 'weight_decay': 3.678056590127026e-05, 'epochs': 214, 'loss': 'mse', 'optimizer': 'adam', 'graph_mode': 'off', 'use_snp_selection': False}. Best is trial 43 with value: 0.29441347602737666.
[I 2025-12-05 22:01:04,868] Trial 55 finished with value: 0.2908942602235923 and parameters: {'model_type': 'mlp', 'hidden_dims': '[512, 256]', 'dropout': 0.5802972732818791, 'batch_norm': False, 'lr': 8.896019040082957e-06, 'weight_decay': 6.287554808686227e-05, 'epochs': 193, 'loss': 'mse', 'optimizer': 'adam', 'graph_mode': 'off', 'use_snp_selection': False}. Best is trial 43 with value: 0.29441347602737666.
[I 2025-12-05 22:01:54,190] Trial 56 finished with value: 0.2953210845001857 and parameters: {'model_type': 'mlp', 'hidden_dims': '[512, 128]', 'dropout': 0.5762822683312581, 'batch_norm': False, 'lr': 3.4682103116430296e-06, 'weight_decay': 0.0002550092677797578, 'epochs': 253, 'loss': 'mse', 'optimizer': 'adam', 'graph_mode': 'off', 'use_snp_selection': False}. Best is trial 56 with value: 0.2953210845001857.
[I 2025-12-05 22:02:44,206] Trial 57 finished with value: 0.2763417624709058 and parameters: {'model_type': 'mlp', 'hidden_dims': '[512, 128]', 'dropout': 0.47963068726774516, 'batch_norm': True, 'lr': 1.5774181020254716e-05, 'weight_decay': 0.0002759561752072223, 'epochs': 255, 'loss': 'mse', 'optimizer': 'adam', 'graph_mode': 'off', 'use_snp_selection': False}. Best is trial 56 with value: 0.2953210845001857.
[I 2025-12-05 22:03:35,470] Trial 58 finished with value: 0.29522886345592775 and parameters: {'model_type': 'mlp', 'hidden_dims': '[512, 128]', 'dropout': 0.5493230512024708, 'batch_norm': False, 'lr': 2.6711666401047657e-06, 'weight_decay': 0.0005071115398300709, 'epochs': 264, 'loss': 'mse', 'optimizer': 'adam', 'graph_mode': 'off', 'use_snp_selection': False}. Best is trial 56 with value: 0.2953210845001857.
[I 2025-12-05 22:04:27,209] Trial 59 finished with value: 0.287849875595393 and parameters: {'model_type': 'mlp', 'hidden_dims': '[512, 128]', 'dropout': 0.5394975629963056, 'batch_norm': False, 'lr': 1.644968958188075e-06, 'weight_decay': 0.000520965502847818, 'epochs': 267, 'loss': 'mse', 'optimizer': 'adam', 'graph_mode': 'off', 'use_snp_selection': False}. Best is trial 56 with value: 0.2953210845001857.
[I 2025-12-05 22:05:30,711] Trial 60 finished with value: 0.2853482138880891 and parameters: {'model_type': 'mlp', 'hidden_dims': '[512, 128]', 'dropout': 0.5501367669686338, 'batch_norm': False, 'lr': 1.0504296020606348e-06, 'weight_decay': 0.0009009739537573237, 'epochs': 334, 'loss': 'mse', 'optimizer': 'adam', 'graph_mode': 'off', 'use_snp_selection': False}. Best is trial 56 with value: 0.2953210845001857.
[I 2025-12-05 22:06:17,627] Trial 61 finished with value: 0.2935916882597188 and parameters: {'model_type': 'mlp', 'hidden_dims': '[512, 128]', 'dropout': 0.5733924410008119, 'batch_norm': False, 'lr': 3.063501925569355e-06, 'weight_decay': 0.00015096666456085992, 'epochs': 239, 'loss': 'mse', 'optimizer': 'adam', 'graph_mode': 'off', 'use_snp_selection': False}. Best is trial 56 with value: 0.2953210845001857.
[I 2025-12-05 22:07:04,163] Trial 62 finished with value: 0.2849206136453328 and parameters: {'model_type': 'mlp', 'hidden_dims': '[512, 128]', 'dropout': 0.5822552970722674, 'batch_norm': False, 'lr': 2.4350342513479927e-06, 'weight_decay': 0.00048810457629545114, 'epochs': 237, 'loss': 'mse', 'optimizer': 'adam', 'graph_mode': 'off', 'use_snp_selection': False}. Best is trial 56 with value: 0.2953210845001857.
[I 2025-12-05 22:07:53,031] Trial 63 finished with value: 0.28813407472254066 and parameters: {'model_type': 'mlp', 'hidden_dims': '[512, 128]', 'dropout': 0.5705002457405705, 'batch_norm': False, 'lr': 3.3914567559019702e-06, 'weight_decay': 0.00016929330029676737, 'epochs': 250, 'loss': 'mse', 'optimizer': 'adam', 'graph_mode': 'off', 'use_snp_selection': False}. Best is trial 56 with value: 0.2953210845001857.
[I 2025-12-05 22:08:38,465] Trial 64 finished with value: 0.2937913410343487 and parameters: {'model_type': 'mlp', 'hidden_dims': '[512, 128]', 'dropout': 0.5982087870321916, 'batch_norm': False, 'lr': 2.7661669990082324e-06, 'weight_decay': 0.0001919080612127862, 'epochs': 230, 'loss': 'mse', 'optimizer': 'adam', 'graph_mode': 'off', 'use_snp_selection': False}. Best is trial 56 with value: 0.2953210845001857.
[I 2025-12-05 22:09:23,376] Trial 65 finished with value: 0.26190538280515596 and parameters: {'model_type': 'mlp', 'hidden_dims': '[512, 128]', 'dropout': 0.5991728151874395, 'batch_norm': False, 'lr': 2.44435942479824e-06, 'weight_decay': 0.00019672046311066324, 'epochs': 227, 'loss': 'mae', 'optimizer': 'adam', 'graph_mode': 'off', 'use_snp_selection': False}. Best is trial 56 with value: 0.2953210845001857.
[I 2025-12-05 22:10:10,006] Trial 66 finished with value: 0.2896422888429016 and parameters: {'model_type': 'mlp', 'hidden_dims': '[512, 128]', 'dropout': 0.5508769184923817, 'batch_norm': False, 'lr': 2.916679392626715e-06, 'weight_decay': 0.000335870746437424, 'epochs': 237, 'loss': 'mse', 'optimizer': 'adam', 'graph_mode': 'off', 'use_snp_selection': False}. Best is trial 56 with value: 0.2953210845001857.
[I 2025-12-05 22:11:00,624] Trial 67 finished with value: 0.27301994356396575 and parameters: {'model_type': 'mlp', 'hidden_dims': '[512, 128]', 'dropout': 0.5840644466113039, 'batch_norm': False, 'lr': 1.3165185462113516e-06, 'weight_decay': 0.00011981815216528063, 'epochs': 260, 'loss': 'mse', 'optimizer': 'adam', 'graph_mode': 'off', 'use_snp_selection': False}. Best is trial 56 with value: 0.2953210845001857.
[I 2025-12-05 22:11:17,518] Trial 68 finished with value: 0.29042207480990445 and parameters: {'model_type': 'mlp', 'hidden_dims': '[128, 64]', 'dropout': 0.5299555701760311, 'batch_norm': False, 'lr': 5.6131943569503305e-06, 'weight_decay': 0.00037045429041055177, 'epochs': 244, 'loss': 'mse', 'optimizer': 'adam', 'graph_mode': 'off', 'use_snp_selection': False}. Best is trial 56 with value: 0.2953210845001857.
[I 2025-12-05 22:12:17,009] Trial 69 finished with value: 0.24828698254728293 and parameters: {'model_type': 'mlp', 'hidden_dims': '[512, 128]', 'dropout': 0.5697714737280479, 'batch_norm': False, 'lr': 0.0007293645081247914, 'weight_decay': 0.00022606030965216718, 'epochs': 313, 'loss': 'mse', 'optimizer': 'adam', 'graph_mode': 'off', 'use_snp_selection': False}. Best is trial 56 with value: 0.2953210845001857.
[I 2025-12-05 22:13:11,117] Trial 70 finished with value: 0.28468903907196885 and parameters: {'model_type': 'mlp', 'hidden_dims': '[512, 256]', 'dropout': 0.18289640113290792, 'batch_norm': False, 'lr': 1.710995518881256e-06, 'weight_decay': 0.0007595497711537285, 'epochs': 278, 'loss': 'mae', 'optimizer': 'adam', 'graph_mode': 'off', 'use_snp_selection': False}. Best is trial 56 with value: 0.2953210845001857.
