[I 2025-12-06 11:41:19,271] Trial 42 finished with value: 0.21524446278872955 and parameters: {'model_type': 'mlp', 'hidden_dims': '[256, 128]', 'dropout': 0.49024957609049985, 'batch_norm': False, 'lr': 4.304169520475021e-05, 'weight_decay': 3.6236068740547687e-07, 'epochs': 121, 'loss': 'mse', 'optimizer': 'adam', 'graph_mode': 'off', 'use_snp_selection': True, 'num_snps': 51467}. Best is trial 22 with value: 0.22194273407423243.
[I 2025-12-06 11:42:29,804] Trial 43 finished with value: 0.20915298678129002 and parameters: {'model_type': 'mlp', 'hidden_dims': '[256, 128, 64]', 'dropout': 0.4575849553616506, 'batch_norm': False, 'lr': 6.003858267862098e-05, 'weight_decay': 1.555710595063908e-07, 'epochs': 159, 'loss': 'mse', 'optimizer': 'adam', 'graph_mode': 'off', 'use_snp_selection': True, 'num_snps': 59884}. Best is trial 22 with value: 0.22194273407423243.
[I 2025-12-06 11:43:33,866] Trial 44 finished with value: 0.20303808973643217 and parameters: {'model_type': 'mlp', 'hidden_dims': '[256, 128]', 'dropout': 0.5303430811613288, 'batch_norm': False, 'lr': 1.6332146519395614e-05, 'weight_decay': 2.6020630253175326e-07, 'epochs': 179, 'loss': 'mse', 'optimizer': 'adam', 'graph_mode': 'off', 'use_snp_selection': True, 'num_snps': 47583}. Best is trial 22 with value: 0.22194273407423243.
[I 2025-12-06 11:44:34,490] Trial 45 finished with value: 0.2145716946631639 and parameters: {'model_type': 'mlp', 'hidden_dims': '[512, 256]', 'dropout': 0.5660027361257725, 'batch_norm': False, 'lr': 8.163857235443954e-05, 'weight_decay': 4.5313697714978003e-07, 'epochs': 91, 'loss': 'mse', 'optimizer': 'adam', 'graph_mode': 'off', 'use_snp_selection': True, 'num_snps': 43150}. Best is trial 22 with value: 0.22194273407423243.
[I 2025-12-06 11:45:09,305] Trial 46 finished with value: 0.14757277366083932 and parameters: {'model_type': 'mlp', 'hidden_dims': '[256, 128]', 'dropout': 0.49974678163215097, 'batch_norm': True, 'lr': 1.0547247122947064e-06, 'weight_decay': 7.463916550180229e-07, 'epochs': 201, 'loss': 'mse', 'optimizer': 'adam', 'graph_mode': 'off', 'use_snp_selection': False}. Best is trial 22 with value: 0.22194273407423243.
[I 2025-12-06 11:45:33,900] Trial 47 finished with value: 0.20419226434797783 and parameters: {'model_type': 'mlp', 'hidden_dims': '[512, 64]', 'dropout': 0.3774176455553676, 'batch_norm': False, 'lr': 5.1433305634108225e-05, 'weight_decay': 1.2486010297933627e-05, 'epochs': 63, 'loss': 'mae', 'optimizer': 'adam', 'graph_mode': 'off', 'use_snp_selection': False}. Best is trial 22 with value: 0.22194273407423243.
[I 2025-12-06 11:46:47,739] Trial 48 finished with value: 0.21897690909261108 and parameters: {'model_type': 'mlp', 'hidden_dims': '[512, 128]', 'dropout': 0.4660132881232479, 'batch_norm': False, 'lr': 7.609269552839253e-06, 'weight_decay': 1.3977859634171417e-06, 'epochs': 102, 'loss': 'mse', 'optimizer': 'adam', 'graph_mode': 'off', 'use_snp_selection': True, 'num_snps': 55621}. Best is trial 22 with value: 0.22194273407423243.
[I 2025-12-06 11:47:03,469] Trial 49 finished with value: 0.2227882899695933 and parameters: {'model_type': 'mlp', 'hidden_dims': '[128, 64]', 'dropout': 0.3132878981160882, 'batch_norm': False, 'lr': 1.2367764265878962e-05, 'weight_decay': 2.5842538994095037e-06, 'epochs': 138, 'loss': 'mse', 'optimizer': 'adam', 'graph_mode': 'off', 'use_snp_selection': False}. Best is trial 49 with value: 0.2227882899695933.
[I 2025-12-06 11:47:19,388] Trial 50 finished with value: 0.22180736703705736 and parameters: {'model_type': 'mlp', 'hidden_dims': '[128, 64]', 'dropout': 0.283262237345182, 'batch_norm': False, 'lr': 1.1308193878738026e-05, 'weight_decay': 2.416995684563506e-06, 'epochs': 140, 'loss': 'mse', 'optimizer': 'adam', 'graph_mode': 'off', 'use_snp_selection': False}. Best is trial 49 with value: 0.2227882899695933.
[I 2025-12-06 11:47:35,590] Trial 51 finished with value: 0.21673202884838005 and parameters: {'model_type': 'mlp', 'hidden_dims': '[128, 64]', 'dropout': 0.28126539077828683, 'batch_norm': False, 'lr': 1.2398075700153091e-05, 'weight_decay': 3.475048131732111e-06, 'epochs': 144, 'loss': 'mse', 'optimizer': 'adam', 'graph_mode': 'off', 'use_snp_selection': False}. Best is trial 49 with value: 0.2227882899695933.
[I 2025-12-06 11:47:53,636] Trial 52 finished with value: 0.21967351115774042 and parameters: {'model_type': 'mlp', 'hidden_dims': '[128, 64]', 'dropout': 0.22541396594048596, 'batch_norm': False, 'lr': 4.628630744366413e-06, 'weight_decay': 1.781620836331124e-06, 'epochs': 169, 'loss': 'mse', 'optimizer': 'adam', 'graph_mode': 'off', 'use_snp_selection': False}. Best is trial 49 with value: 0.2227882899695933.
[I 2025-12-06 11:48:18,487] Trial 53 finished with value: 0.21830549452202966 and parameters: {'model_type': 'mlp', 'hidden_dims': '[128, 64]', 'dropout': 0.3184117262933617, 'batch_norm': False, 'lr': 2.025823155109107e-05, 'weight_decay': 8.459027322532137e-06, 'epochs': 265, 'loss': 'mse', 'optimizer': 'adam', 'graph_mode': 'off', 'use_snp_selection': False}. Best is trial 49 with value: 0.2227882899695933.
[I 2025-12-06 11:48:34,048] Trial 54 finished with value: 0.21566135657913602 and parameters: {'model_type': 'mlp', 'hidden_dims': '[128, 64]', 'dropout': 0.2740468206780581, 'batch_norm': False, 'lr': 6.609276464685159e-06, 'weight_decay': 3.3972028951530524e-06, 'epochs': 134, 'loss': 'mse', 'optimizer': 'adam', 'graph_mode': 'off', 'use_snp_selection': False}. Best is trial 49 with value: 0.2227882899695933.
[I 2025-12-06 11:48:48,504] Trial 55 finished with value: 0.21436039870304047 and parameters: {'model_type': 'mlp', 'hidden_dims': '[128, 64]', 'dropout': 0.19159789512673586, 'batch_norm': False, 'lr': 8.4945843647548e-06, 'weight_decay': 2.180355642674218e-06, 'epochs': 119, 'loss': 'mae', 'optimizer': 'adam', 'graph_mode': 'off', 'use_snp_selection': False}. Best is trial 49 with value: 0.2227882899695933.
[I 2025-12-06 11:49:07,875] Trial 56 finished with value: 0.21431227816330334 and parameters: {'model_type': 'mlp', 'hidden_dims': '[128, 64]', 'dropout': 0.339001506221774, 'batch_norm': False, 'lr': 1.2546396191240791e-05, 'weight_decay': 1.0451915653493824e-06, 'epochs': 187, 'loss': 'mse', 'optimizer': 'adam', 'graph_mode': 'off', 'use_snp_selection': False}. Best is trial 49 with value: 0.2227882899695933.
[I 2025-12-06 11:49:25,040] Trial 57 finished with value: 0.1962696113136095 and parameters: {'model_type': 'mlp', 'hidden_dims': '[128, 64]', 'dropout': 0.30490412979572473, 'batch_norm': True, 'lr': 1.7733885768187958e-05, 'weight_decay': 3.973420960328917e-06, 'epochs': 155, 'loss': 'mse', 'optimizer': 'adam', 'graph_mode': 'off', 'use_snp_selection': False}. Best is trial 49 with value: 0.2227882899695933.
[I 2025-12-06 11:49:43,552] Trial 58 finished with value: 0.2256172933198795 and parameters: {'model_type': 'mlp', 'hidden_dims': '[256, 128, 64]', 'dropout': 0.2392452507476142, 'batch_norm': False, 'lr': 2.7643084526537024e-05, 'weight_decay': 2.8766591148662924e-05, 'epochs': 85, 'loss': 'mse', 'optimizer': 'adam', 'graph_mode': 'off', 'use_snp_selection': False}. Best is trial 58 with value: 0.2256172933198795.
[I 2025-12-06 11:50:20,503] Trial 59 finished with value: 0.21567784211847596 and parameters: {'model_type': 'mlp', 'hidden_dims': '[256, 128, 64]', 'dropout': 0.21006986056192578, 'batch_norm': False, 'lr': 1.0344068529610192e-05, 'weight_decay': 8.137631935183342e-05, 'epochs': 213, 'loss': 'mae', 'optimizer': 'adam', 'graph_mode': 'off', 'use_snp_selection': False}. Best is trial 58 with value: 0.2256172933198795.
[I 2025-12-06 11:50:46,383] Trial 60 finished with value: 0.21357849007011814 and parameters: {'model_type': 'mlp', 'hidden_dims': '[256, 128, 64]', 'dropout': 0.24538608194377265, 'batch_norm': False, 'lr': 2.461658913484316e-05, 'weight_decay': 2.8108133083083554e-05, 'epochs': 136, 'loss': 'mse', 'optimizer': 'adam', 'graph_mode': 'off', 'use_snp_selection': False}. Best is trial 58 with value: 0.2256172933198795.
[I 2025-12-06 11:51:05,130] Trial 61 finished with value: 0.22084766137660003 and parameters: {'model_type': 'mlp', 'hidden_dims': '[256, 128, 64]', 'dropout': 0.2884232928106663, 'batch_norm': False, 'lr': 1.3758790958697655e-05, 'weight_decay': 2.155950765345083e-05, 'epochs': 86, 'loss': 'mse', 'optimizer': 'adam', 'graph_mode': 'off', 'use_snp_selection': False}. Best is trial 58 with value: 0.2256172933198795.
[I 2025-12-06 11:51:39,430] Trial 62 finished with value: 0.21565959317937242 and parameters: {'model_type': 'mlp', 'hidden_dims': '[512, 64]', 'dropout': 0.1581418398374142, 'batch_norm': False, 'lr': 2.9908700530419557e-05, 'weight_decay': 1.0046887323596128e-05, 'epochs': 97, 'loss': 'mse', 'optimizer': 'adam', 'graph_mode': 'off', 'use_snp_selection': False}. Best is trial 58 with value: 0.2256172933198795.
[I 2025-12-06 11:52:21,776] Trial 63 finished with value: 0.2189198835024096 and parameters: {'model_type': 'mlp', 'hidden_dims': '[512, 256]', 'dropout': 0.30188370108724616, 'batch_norm': False, 'lr': 4.629019383428623e-05, 'weight_decay': 3.752117562510244e-05, 'epochs': 126, 'loss': 'mse', 'optimizer': 'adam', 'graph_mode': 'off', 'use_snp_selection': False}. Best is trial 58 with value: 0.2256172933198795.
[I 2025-12-06 11:52:34,032] Trial 64 finished with value: 0.206002335935008 and parameters: {'model_type': 'mlp', 'hidden_dims': '[256, 128, 64]', 'dropout': 0.2582335897330156, 'batch_norm': False, 'lr': 2.0181023382153024e-05, 'weight_decay': 9.127765379016898e-05, 'epochs': 41, 'loss': 'mse', 'optimizer': 'adam', 'graph_mode': 'off', 'use_snp_selection': False}. Best is trial 58 with value: 0.2256172933198795.
[I 2025-12-06 11:52:45,775] Trial 65 finished with value: 0.21548579971438545 and parameters: {'model_type': 'mlp', 'hidden_dims': '[128, 64]', 'dropout': 0.2366725637095856, 'batch_norm': False, 'lr': 1.4778193696872093e-05, 'weight_decay': 7.713805892423444e-07, 'epochs': 82, 'loss': 'mse', 'optimizer': 'adam', 'graph_mode': 'off', 'use_snp_selection': False}. Best is trial 58 with value: 0.2256172933198795.
[I 2025-12-06 11:53:01,133] Trial 66 finished with value: 0.2239828248818708 and parameters: {'model_type': 'mlp', 'hidden_dims': '[256, 128, 64]', 'dropout': 0.18380414387141555, 'batch_norm': False, 'lr': 3.518092273109803e-05, 'weight_decay': 0.0004917783154403117, 'epochs': 63, 'loss': 'mse', 'optimizer': 'adam', 'graph_mode': 'off', 'use_snp_selection': False}. Best is trial 58 with value: 0.2256172933198795.
[I 2025-12-06 11:53:16,238] Trial 67 finished with value: 0.22377607781594647 and parameters: {'model_type': 'mlp', 'hidden_dims': '[256, 128, 64]', 'dropout': 0.18066737646945435, 'batch_norm': False, 'lr': 0.00010755616390925655, 'weight_decay': 0.0005267153851345957, 'epochs': 62, 'loss': 'mse', 'optimizer': 'adam', 'graph_mode': 'off', 'use_snp_selection': False}. Best is trial 58 with value: 0.2256172933198795.
[I 2025-12-06 11:53:30,327] Trial 68 finished with value: 0.21424763069781066 and parameters: {'model_type': 'mlp', 'hidden_dims': '[256, 128, 64]', 'dropout': 0.17551941425237808, 'batch_norm': False, 'lr': 0.0003068313996901224, 'weight_decay': 0.0006672619834062628, 'epochs': 55, 'loss': 'mse', 'optimizer': 'adam', 'graph_mode': 'off', 'use_snp_selection': False}. Best is trial 58 with value: 0.2256172933198795.
[I 2025-12-06 11:53:47,356] Trial 69 finished with value: 0.2195314358153441 and parameters: {'model_type': 'mlp', 'hidden_dims': '[256, 128, 64]', 'dropout': 0.13506601598706525, 'batch_norm': False, 'lr': 0.0004004313656196961, 'weight_decay': 0.0006112832839589293, 'epochs': 76, 'loss': 'mse', 'optimizer': 'adam', 'graph_mode': 'off', 'use_snp_selection': False}. Best is trial 58 with value: 0.2256172933198795.
[I 2025-12-06 11:54:00,907] Trial 70 finished with value: 0.21248281793127188 and parameters: {'model_type': 'mlp', 'hidden_dims': '[256, 128, 64]', 'dropout': 0.1238216024649849, 'batch_norm': False, 'lr': 8.96088678079723e-06, 'weight_decay': 0.0003330351831503235, 'epochs': 50, 'loss': 'mse', 'optimizer': 'adam', 'graph_mode': 'off', 'use_snp_selection': False}. Best is trial 58 with value: 0.2256172933198795.
[I 2025-12-06 11:54:16,553] Trial 71 finished with value: 0.21708310467842074 and parameters: {'model_type': 'mlp', 'hidden_dims': '[256, 128, 64]', 'dropout': 0.20642973648738033, 'batch_norm': False, 'lr': 0.00011313586892098809, 'weight_decay': 0.0004119354435008008, 'epochs': 66, 'loss': 'mse', 'optimizer': 'adam', 'graph_mode': 'off', 'use_snp_selection': False}. Best is trial 58 with value: 0.2256172933198795.
[I 2025-12-06 11:54:39,358] Trial 72 finished with value: 0.21840292844545725 and parameters: {'model_type': 'mlp', 'hidden_dims': '[256, 128, 64]', 'dropout': 0.1618783022917173, 'batch_norm': False, 'lr': 0.0001937044889248006, 'weight_decay': 0.00020189441601307933, 'epochs': 117, 'loss': 'mse', 'optimizer': 'adam', 'graph_mode': 'off', 'use_snp_selection': False}. Best is trial 58 with value: 0.2256172933198795.
[I 2025-12-06 11:54:55,019] Trial 73 finished with value: 0.22420043100534262 and parameters: {'model_type': 'mlp', 'hidden_dims': '[256, 128, 64]', 'dropout': 0.17475286967324413, 'batch_norm': False, 'lr': 0.00013084559432961125, 'weight_decay': 2.4042710635844648e-06, 'epochs': 66, 'loss': 'mse', 'optimizer': 'adam', 'graph_mode': 'off', 'use_snp_selection': False}. Best is trial 58 with value: 0.2256172933198795.
[I 2025-12-06 11:55:10,525] Trial 74 finished with value: 0.224650380101365 and parameters: {'model_type': 'mlp', 'hidden_dims': '[256, 128, 64]', 'dropout': 0.18550299228622688, 'batch_norm': False, 'lr': 0.0001316619825544908, 'weight_decay': 2.3051248699302214e-06, 'epochs': 65, 'loss': 'mse', 'optimizer': 'adam', 'graph_mode': 'off', 'use_snp_selection': False}. Best is trial 58 with value: 0.2256172933198795.
[I 2025-12-06 11:55:25,313] Trial 75 finished with value: 0.2202164101373954 and parameters: {'model_type': 'mlp', 'hidden_dims': '[256, 128, 64]', 'dropout': 0.18729620919375767, 'batch_norm': False, 'lr': 0.00013614556673928864, 'weight_decay': 1.5732180378798396e-05, 'epochs': 60, 'loss': 'mse', 'optimizer': 'adam', 'graph_mode': 'off', 'use_snp_selection': False}. Best is trial 58 with value: 0.2256172933198795.
[I 2025-12-06 11:55:41,830] Trial 76 finished with value: 0.222366225241988 and parameters: {'model_type': 'mlp', 'hidden_dims': '[256, 128, 64]', 'dropout': 0.22765837298586888, 'batch_norm': True, 'lr': 7.261081499142725e-05, 'weight_decay': 0.0009762198110247783, 'epochs': 70, 'loss': 'mse', 'optimizer': 'adam', 'graph_mode': 'off', 'use_snp_selection': False}. Best is trial 58 with value: 0.2256172933198795.
[I 2025-12-06 11:55:55,016] Trial 77 finished with value: 0.2021083374825036 and parameters: {'model_type': 'mlp', 'hidden_dims': '[256, 128, 64]', 'dropout': 0.17271028345928138, 'batch_norm': True, 'lr': 7.806502530874149e-05, 'weight_decay': 0.0007849510735439246, 'epochs': 47, 'loss': 'mse', 'optimizer': 'adam', 'graph_mode': 'off', 'use_snp_selection': False}. Best is trial 58 with value: 0.2256172933198795.
[I 2025-12-06 11:56:11,529] Trial 78 finished with value: 0.19991473541740257 and parameters: {'model_type': 'mlp', 'hidden_dims': '[256, 128, 64]', 'dropout': 0.2177217707809037, 'batch_norm': True, 'lr': 0.00010617060295877646, 'weight_decay': 0.0009750134769181882, 'epochs': 70, 'loss': 'mae', 'optimizer': 'adam', 'graph_mode': 'off', 'use_snp_selection': False}. Best is trial 58 with value: 0.2256172933198795.
[I 2025-12-06 11:56:29,637] Trial 79 finished with value: 0.20863419483572404 and parameters: {'model_type': 'mlp', 'hidden_dims': '[256, 128, 64]', 'dropout': 0.19768537408432393, 'batch_norm': True, 'lr': 6.727678516717575e-05, 'weight_decay': 0.000502097291845963, 'epochs': 81, 'loss': 'mse', 'optimizer': 'adam', 'graph_mode': 'off', 'use_snp_selection': False}. Best is trial 58 with value: 0.2256172933198795.
[I 2025-12-06 11:56:44,705] Trial 80 finished with value: 0.21377969298046065 and parameters: {'model_type': 'mlp', 'hidden_dims': '[256, 128, 64]', 'dropout': 0.10137916642201776, 'batch_norm': True, 'lr': 0.00023655172553458217, 'weight_decay': 0.0002443651090472198, 'epochs': 60, 'loss': 'mse', 'optimizer': 'adam', 'graph_mode': 'off', 'use_snp_selection': False}. Best is trial 58 with value: 0.2256172933198795.
[I 2025-12-06 11:57:01,364] Trial 81 finished with value: 0.21945860118198043 and parameters: {'model_type': 'mlp', 'hidden_dims': '[256, 128, 64]', 'dropout': 0.23051899045147722, 'batch_norm': True, 'lr': 0.0001730903892685226, 'weight_decay': 6.8069488310955426e-06, 'epochs': 71, 'loss': 'mse', 'optimizer': 'adam', 'graph_mode': 'off', 'use_snp_selection': False}. Best is trial 58 with value: 0.2256172933198795.
[I 2025-12-06 11:57:14,761] Trial 82 finished with value: 0.22035776646647784 and parameters: {'model_type': 'mlp', 'hidden_dims': '[256, 128, 64]', 'dropout': 0.14172081319895682, 'batch_norm': False, 'lr': 0.00014002836979842365, 'weight_decay': 0.0001511122964434908, 'epochs': 50, 'loss': 'mse', 'optimizer': 'adam', 'graph_mode': 'off', 'use_snp_selection': False}. Best is trial 58 with value: 0.2256172933198795.
[I 2025-12-06 11:57:34,059] Trial 83 finished with value: 0.21714452182742788 and parameters: {'model_type': 'mlp', 'hidden_dims': '[256, 128, 64]', 'dropout': 0.17467516111170256, 'batch_norm': False, 'lr': 9.743904429794589e-05, 'weight_decay': 0.00044227514129122644, 'epochs': 92, 'loss': 'mse', 'optimizer': 'adam', 'graph_mode': 'off', 'use_snp_selection': False}. Best is trial 58 with value: 0.2256172933198795.
[I 2025-12-06 11:57:51,456] Trial 84 finished with value: 0.21235500613901617 and parameters: {'model_type': 'mlp', 'hidden_dims': '[256, 128, 64]', 'dropout': 0.2658006733864346, 'batch_norm': False, 'lr': 5.799378338255147e-05, 'weight_decay': 0.0009853293614751932, 'epochs': 78, 'loss': 'mse', 'optimizer': 'adam', 'graph_mode': 'off', 'use_snp_selection': False}. Best is trial 58 with value: 0.2256172933198795.
[I 2025-12-06 11:58:06,648] Trial 85 finished with value: 0.21391568425071594 and parameters: {'model_type': 'mlp', 'hidden_dims': '[256, 128, 64]', 'dropout': 0.12449638714546933, 'batch_norm': True, 'lr': 0.0001277441743454281, 'weight_decay': 5.32537273988624e-06, 'epochs': 61, 'loss': 'mse', 'optimizer': 'adam', 'graph_mode': 'off', 'use_snp_selection': False}. Best is trial 58 with value: 0.2256172933198795.
[I 2025-12-06 11:58:32,792] Trial 86 finished with value: 0.22734500484490874 and parameters: {'model_type': 'mlp', 'hidden_dims': '[512, 128]', 'dropout': 0.18288152712475456, 'batch_norm': False, 'lr': 3.941062735824379e-05, 'weight_decay': 0.000354782315015303, 'epochs': 68, 'loss': 'mse', 'optimizer': 'adam', 'graph_mode': 'off', 'use_snp_selection': False}. Best is trial 86 with value: 0.22734500484490874.
[I 2025-12-06 11:58:51,489] Trial 87 finished with value: 0.20124174537353534 and parameters: {'model_type': 'mlp', 'hidden_dims': '[512, 128]', 'dropout': 0.18207692554283159, 'batch_norm': False, 'lr': 7.37918002765187e-05, 'weight_decay': 0.0006128285111846119, 'epochs': 41, 'loss': 'mse', 'optimizer': 'adam', 'graph_mode': 'off', 'use_snp_selection': False}. Best is trial 86 with value: 0.22734500484490874.
[I 2025-12-06 11:59:17,101] Trial 88 finished with value: 0.2210003516719222 and parameters: {'model_type': 'mlp', 'hidden_dims': '[512, 128]', 'dropout': 0.20276798621030365, 'batch_norm': False, 'lr': 3.833822152972299e-05, 'weight_decay': 0.00012238890802616787, 'epochs': 66, 'loss': 'mse', 'optimizer': 'adam', 'graph_mode': 'off', 'use_snp_selection': False}. Best is trial 86 with value: 0.22734500484490874.
[I 2025-12-06 11:59:39,113] Trial 89 finished with value: 0.21004490356267694 and parameters: {'model_type': 'mlp', 'hidden_dims': '[512, 128]', 'dropout': 0.15035678769897942, 'batch_norm': False, 'lr': 5.506212727176067e-05, 'weight_decay': 0.0003145213254241753, 'epochs': 53, 'loss': 'mse', 'optimizer': 'adam', 'graph_mode': 'off', 'use_snp_selection': False}. Best is trial 86 with value: 0.22734500484490874.
[I 2025-12-06 12:00:10,731] Trial 90 finished with value: 0.22287360218603122 and parameters: {'model_type': 'mlp', 'hidden_dims': '[512, 128]', 'dropout': 0.1615611209079204, 'batch_norm': False, 'lr': 9.072408054788884e-05, 'weight_decay': 0.0003578829718590277, 'epochs': 88, 'loss': 'mse', 'optimizer': 'adam', 'graph_mode': 'off', 'use_snp_selection': False}. Best is trial 86 with value: 0.22734500484490874.
[I 2025-12-06 12:00:42,101] Trial 91 finished with value: 0.2259283586298813 and parameters: {'model_type': 'mlp', 'hidden_dims': '[512, 128]', 'dropout': 0.16782442468855632, 'batch_norm': False, 'lr': 8.879166903317205e-05, 'weight_decay': 0.0002597985524611284, 'epochs': 87, 'loss': 'mse', 'optimizer': 'adam', 'graph_mode': 'off', 'use_snp_selection': False}. Best is trial 86 with value: 0.22734500484490874.
[I 2025-12-06 12:01:12,919] Trial 92 finished with value: 0.22276670363608947 and parameters: {'model_type': 'mlp', 'hidden_dims': '[512, 128]', 'dropout': 0.16419512697008465, 'batch_norm': False, 'lr': 9.0204873987491e-05, 'weight_decay': 0.00028804505583740036, 'epochs': 85, 'loss': 'mse', 'optimizer': 'adam', 'graph_mode': 'off', 'use_snp_selection': False}. Best is trial 86 with value: 0.22734500484490874.
[I 2025-12-06 12:01:43,777] Trial 93 finished with value: 0.22386292261052004 and parameters: {'model_type': 'mlp', 'hidden_dims': '[512, 128]', 'dropout': 0.16594636514500002, 'batch_norm': False, 'lr': 9.081528583677972e-05, 'weight_decay': 0.0002425691184489667, 'epochs': 85, 'loss': 'mse', 'optimizer': 'adam', 'graph_mode': 'off', 'use_snp_selection': False}. Best is trial 86 with value: 0.22734500484490874.
