[I 2025-12-05 16:08:06,937] Trial 105 finished with value: 0.12692575471567377 and parameters: {'model_type': 'mlp', 'hidden_dims': '[512, 64]', 'dropout': 0.12012055866168625, 'batch_norm': True, 'lr': 0.0006523474752948454, 'weight_decay': 2.7135983523808955e-05, 'epochs': 98, 'loss': 'mae', 'optimizer': 'adam', 'graph_mode': 'off', 'use_snp_selection': False}. Best is trial 29 with value: 0.14327701317958927.
[I 2025-12-05 16:08:09,255] Trial 106 finished with value: 0.11820718335115132 and parameters: {'model_type': 'mlp', 'hidden_dims': '[512, 64]', 'dropout': 0.129494545302968, 'batch_norm': True, 'lr': 0.00046184029036972494, 'weight_decay': 2.3837353545285545e-05, 'epochs': 129, 'loss': 'mae', 'optimizer': 'adam', 'graph_mode': 'off', 'use_snp_selection': False}. Best is trial 29 with value: 0.14327701317958927.
[I 2025-12-05 16:08:10,098] Trial 107 finished with value: 0.12664748012257954 and parameters: {'model_type': 'mlp', 'hidden_dims': '[128, 64]', 'dropout': 0.15237721054377454, 'batch_norm': True, 'lr': 0.0008177134872982366, 'weight_decay': 6.548035074193832e-05, 'epochs': 89, 'loss': 'mae', 'optimizer': 'adam', 'graph_mode': 'off', 'use_snp_selection': False}. Best is trial 29 with value: 0.14327701317958927.
[I 2025-12-05 16:08:11,558] Trial 108 finished with value: 0.14011199276612496 and parameters: {'model_type': 'mlp', 'hidden_dims': '[512, 256]', 'dropout': 0.17179258138053285, 'batch_norm': True, 'lr': 0.0003299343150472405, 'weight_decay': 0.00012032722318363802, 'epochs': 59, 'loss': 'mae', 'optimizer': 'adam', 'graph_mode': 'off', 'use_snp_selection': False}. Best is trial 29 with value: 0.14327701317958927.
[I 2025-12-05 16:08:13,029] Trial 109 finished with value: 0.13055111132696173 and parameters: {'model_type': 'mlp', 'hidden_dims': '[512, 256]', 'dropout': 0.21817621445167745, 'batch_norm': True, 'lr': 0.0003230793367032531, 'weight_decay': 0.0001203280209768367, 'epochs': 60, 'loss': 'mae', 'optimizer': 'adam', 'graph_mode': 'off', 'use_snp_selection': False}. Best is trial 29 with value: 0.14327701317958927.
[I 2025-12-05 16:08:14,575] Trial 110 finished with value: 0.10902851373589724 and parameters: {'model_type': 'mlp', 'hidden_dims': '[512, 128]', 'dropout': 0.10696160360077492, 'batch_norm': True, 'lr': 0.0003768667235928451, 'weight_decay': 1.650436383648199e-05, 'epochs': 68, 'loss': 'mae', 'optimizer': 'adam', 'graph_mode': 'off', 'use_snp_selection': True, 'num_snps': 6748}. Best is trial 29 with value: 0.14327701317958927.
[I 2025-12-05 16:08:16,367] Trial 111 finished with value: 0.14687557664425274 and parameters: {'model_type': 'mlp', 'hidden_dims': '[512, 256]', 'dropout': 0.13678523116304783, 'batch_norm': True, 'lr': 0.0006035996358118255, 'weight_decay': 9.871403658260002e-05, 'epochs': 82, 'loss': 'mae', 'optimizer': 'adam', 'graph_mode': 'off', 'use_snp_selection': False}. Best is trial 111 with value: 0.14687557664425274.
[I 2025-12-05 16:08:18,097] Trial 112 finished with value: 0.1364172019702127 and parameters: {'model_type': 'mlp', 'hidden_dims': '[512, 256]', 'dropout': 0.17007534150092585, 'batch_norm': True, 'lr': 0.000581323230545051, 'weight_decay': 0.0001059844728756919, 'epochs': 81, 'loss': 'mae', 'optimizer': 'adam', 'graph_mode': 'off', 'use_snp_selection': False}. Best is trial 111 with value: 0.14687557664425274.
[I 2025-12-05 16:08:19,789] Trial 113 finished with value: 0.1313766303236088 and parameters: {'model_type': 'mlp', 'hidden_dims': '[512, 256]', 'dropout': 0.17034721429485247, 'batch_norm': True, 'lr': 0.0006175090058327413, 'weight_decay': 0.00010831424680319558, 'epochs': 78, 'loss': 'mae', 'optimizer': 'adam', 'graph_mode': 'off', 'use_snp_selection': False}. Best is trial 111 with value: 0.14687557664425274.
[I 2025-12-05 16:08:21,075] Trial 114 finished with value: 0.13566769479622753 and parameters: {'model_type': 'mlp', 'hidden_dims': '[512, 256]', 'dropout': 0.19681408304961467, 'batch_norm': True, 'lr': 0.0005423242583790015, 'weight_decay': 0.00015165079707221777, 'epochs': 45, 'loss': 'mae', 'optimizer': 'adam', 'graph_mode': 'off', 'use_snp_selection': False}. Best is trial 111 with value: 0.14687557664425274.
[I 2025-12-05 16:08:22,362] Trial 115 finished with value: 0.11293141796505823 and parameters: {'model_type': 'mlp', 'hidden_dims': '[512, 256]', 'dropout': 0.2074841389272662, 'batch_norm': True, 'lr': 0.0005446759555536164, 'weight_decay': 0.00014791485030934552, 'epochs': 45, 'loss': 'mae', 'optimizer': 'adam', 'graph_mode': 'off', 'use_snp_selection': False}. Best is trial 111 with value: 0.14687557664425274.
[I 2025-12-05 16:08:23,786] Trial 116 finished with value: 0.12693434518025976 and parameters: {'model_type': 'mlp', 'hidden_dims': '[512, 256]', 'dropout': 0.19456365979857845, 'batch_norm': True, 'lr': 0.0004896789447139931, 'weight_decay': 8.865679238943795e-05, 'epochs': 55, 'loss': 'mae', 'optimizer': 'adam', 'graph_mode': 'off', 'use_snp_selection': False}. Best is trial 111 with value: 0.14687557664425274.
[I 2025-12-05 16:08:25,345] Trial 117 finished with value: 0.11947487533948145 and parameters: {'model_type': 'mlp', 'hidden_dims': '[512, 256]', 'dropout': 0.22607112766912768, 'batch_norm': False, 'lr': 0.0006889964530187683, 'weight_decay': 0.00019963655076571678, 'epochs': 66, 'loss': 'mae', 'optimizer': 'adam', 'graph_mode': 'off', 'use_snp_selection': False}. Best is trial 111 with value: 0.14687557664425274.
[I 2025-12-05 16:08:26,731] Trial 118 finished with value: 0.11607233522679967 and parameters: {'model_type': 'mlp', 'hidden_dims': '[512, 256]', 'dropout': 0.17804834684329252, 'batch_norm': True, 'lr': 0.0003405250796349435, 'weight_decay': 0.0001698918481064385, 'epochs': 53, 'loss': 'mae', 'optimizer': 'adam', 'graph_mode': 'off', 'use_snp_selection': False}. Best is trial 111 with value: 0.14687557664425274.
[I 2025-12-05 16:08:28,460] Trial 119 finished with value: 0.11922597475552836 and parameters: {'model_type': 'mlp', 'hidden_dims': '[512, 256]', 'dropout': 0.16068467458623958, 'batch_norm': True, 'lr': 0.00041300666612865354, 'weight_decay': 8.156946896785209e-05, 'epochs': 81, 'loss': 'mae', 'optimizer': 'adam', 'graph_mode': 'off', 'use_snp_selection': False}. Best is trial 111 with value: 0.14687557664425274.
[I 2025-12-05 16:08:29,966] Trial 120 finished with value: 0.12141399319451653 and parameters: {'model_type': 'mlp', 'hidden_dims': '[512, 256]', 'dropout': 0.25360428322741974, 'batch_norm': True, 'lr': 0.0006144928231514374, 'weight_decay': 0.00013376477330395215, 'epochs': 63, 'loss': 'mae', 'optimizer': 'adam', 'graph_mode': 'off', 'use_snp_selection': False}. Best is trial 111 with value: 0.14687557664425274.
[I 2025-12-05 16:08:31,223] Trial 121 finished with value: 0.12360615063209385 and parameters: {'model_type': 'mlp', 'hidden_dims': '[512, 256]', 'dropout': 0.13610494757299146, 'batch_norm': True, 'lr': 0.0008497004234688828, 'weight_decay': 6.296324394018524e-05, 'epochs': 42, 'loss': 'mae', 'optimizer': 'adam', 'graph_mode': 'off', 'use_snp_selection': False}. Best is trial 111 with value: 0.14687557664425274.
[I 2025-12-05 16:08:33,239] Trial 122 finished with value: 0.1186979436367946 and parameters: {'model_type': 'mlp', 'hidden_dims': '[512, 256]', 'dropout': 0.15360572446097295, 'batch_norm': True, 'lr': 0.000740314538173556, 'weight_decay': 0.00010107298200915804, 'epochs': 102, 'loss': 'mae', 'optimizer': 'adam', 'graph_mode': 'off', 'use_snp_selection': False}. Best is trial 111 with value: 0.14687557664425274.
[I 2025-12-05 16:08:34,861] Trial 123 finished with value: 0.11815571445237343 and parameters: {'model_type': 'mlp', 'hidden_dims': '[512, 256]', 'dropout': 0.11642094538344844, 'batch_norm': True, 'lr': 0.0009955464027342107, 'weight_decay': 5.8670402817964144e-05, 'epochs': 72, 'loss': 'mae', 'optimizer': 'adam', 'graph_mode': 'off', 'use_snp_selection': False}. Best is trial 111 with value: 0.14687557664425274.
[I 2025-12-05 16:08:36,695] Trial 124 finished with value: 0.13271796555189966 and parameters: {'model_type': 'mlp', 'hidden_dims': '[512, 256]', 'dropout': 0.13161622321872338, 'batch_norm': True, 'lr': 0.000534890865804566, 'weight_decay': 3.666168089629065e-05, 'epochs': 89, 'loss': 'mae', 'optimizer': 'adam', 'graph_mode': 'off', 'use_snp_selection': False}. Best is trial 111 with value: 0.14687557664425274.
[I 2025-12-05 16:08:37,555] Trial 125 finished with value: 0.12768962391658117 and parameters: {'model_type': 'mlp', 'hidden_dims': '[128, 64]', 'dropout': 0.19980482719699855, 'batch_norm': True, 'lr': 0.000464919096377981, 'weight_decay': 4.7281165844202503e-05, 'epochs': 95, 'loss': 'mae', 'optimizer': 'adam', 'graph_mode': 'off', 'use_snp_selection': False}. Best is trial 111 with value: 0.14687557664425274.
[I 2025-12-05 16:08:41,584] Trial 126 finished with value: 0.13292052273546262 and parameters: {'model_type': 'mlp', 'hidden_dims': '[512, 256]', 'dropout': 0.18519267003314865, 'batch_norm': True, 'lr': 0.0007107412978828914, 'weight_decay': 7.311700244285662e-05, 'epochs': 112, 'loss': 'mae', 'optimizer': 'adam', 'graph_mode': 'off', 'use_snp_selection': True, 'num_snps': 53241}. Best is trial 111 with value: 0.14687557664425274.
[I 2025-12-05 16:08:42,746] Trial 127 finished with value: 0.14049040041452399 and parameters: {'model_type': 'mlp', 'hidden_dims': '[256, 128, 64]', 'dropout': 0.10006117403296914, 'batch_norm': True, 'lr': 0.0008326415688435643, 'weight_decay': 0.00011904640685204382, 'epochs': 81, 'loss': 'mae', 'optimizer': 'adam', 'graph_mode': 'off', 'use_snp_selection': False}. Best is trial 111 with value: 0.14687557664425274.
[I 2025-12-05 16:08:43,753] Trial 128 finished with value: 0.12053705031645864 and parameters: {'model_type': 'mlp', 'hidden_dims': '[256, 128, 64]', 'dropout': 0.10537571639977347, 'batch_norm': True, 'lr': 0.0005875005738973805, 'weight_decay': 0.0002989810645366984, 'epochs': 58, 'loss': 'mae', 'optimizer': 'adam', 'graph_mode': 'off', 'use_snp_selection': False}. Best is trial 111 with value: 0.14687557664425274.
[I 2025-12-05 16:08:44,863] Trial 129 finished with value: 0.12388013319154673 and parameters: {'model_type': 'mlp', 'hidden_dims': '[256, 128, 64]', 'dropout': 0.1221472848907805, 'batch_norm': True, 'lr': 0.00026915982946732755, 'weight_decay': 0.00012276599707771572, 'epochs': 73, 'loss': 'mae', 'optimizer': 'adam', 'graph_mode': 'off', 'use_snp_selection': False}. Best is trial 111 with value: 0.14687557664425274.
[I 2025-12-05 16:08:46,025] Trial 130 finished with value: 0.13588081269133193 and parameters: {'model_type': 'mlp', 'hidden_dims': '[256, 128, 64]', 'dropout': 0.10038037114003573, 'batch_norm': True, 'lr': 0.00039482645118657603, 'weight_decay': 0.0002176954922505834, 'epochs': 79, 'loss': 'mae', 'optimizer': 'adam', 'graph_mode': 'off', 'use_snp_selection': False}. Best is trial 111 with value: 0.14687557664425274.
[I 2025-12-05 16:08:47,189] Trial 131 finished with value: 0.12950501512785378 and parameters: {'model_type': 'mlp', 'hidden_dims': '[256, 128, 64]', 'dropout': 0.10247231618430411, 'batch_norm': True, 'lr': 0.00038920620527243264, 'weight_decay': 0.00023306637121180897, 'epochs': 81, 'loss': 'mae', 'optimizer': 'adam', 'graph_mode': 'off', 'use_snp_selection': False}. Best is trial 111 with value: 0.14687557664425274.
[I 2025-12-05 16:08:48,272] Trial 132 finished with value: 0.1350119228903323 and parameters: {'model_type': 'mlp', 'hidden_dims': '[256, 128, 64]', 'dropout': 0.10124094740777694, 'batch_norm': True, 'lr': 0.0004901937646055026, 'weight_decay': 0.00017417526375616848, 'epochs': 69, 'loss': 'mae', 'optimizer': 'adam', 'graph_mode': 'off', 'use_snp_selection': False}. Best is trial 111 with value: 0.14687557664425274.
[I 2025-12-05 16:08:49,345] Trial 133 finished with value: 0.13019904646327238 and parameters: {'model_type': 'mlp', 'hidden_dims': '[256, 128, 64]', 'dropout': 0.11641184886285316, 'batch_norm': True, 'lr': 0.0006403061708036693, 'weight_decay': 0.00018000422644069407, 'epochs': 67, 'loss': 'mae', 'optimizer': 'adam', 'graph_mode': 'off', 'use_snp_selection': False}. Best is trial 111 with value: 0.14687557664425274.
[I 2025-12-05 16:08:50,292] Trial 134 finished with value: 0.13068601274149794 and parameters: {'model_type': 'mlp', 'hidden_dims': '[256, 128, 64]', 'dropout': 0.12584265855205784, 'batch_norm': True, 'lr': 0.0004780853604992762, 'weight_decay': 0.0001344870862177538, 'epochs': 49, 'loss': 'mae', 'optimizer': 'adam', 'graph_mode': 'off', 'use_snp_selection': False}. Best is trial 111 with value: 0.14687557664425274.
[I 2025-12-05 16:08:51,483] Trial 135 finished with value: 0.12373285146083725 and parameters: {'model_type': 'mlp', 'hidden_dims': '[256, 128, 64]', 'dropout': 0.11237213924090275, 'batch_norm': True, 'lr': 0.0003009876844435787, 'weight_decay': 0.00022182789064191836, 'epochs': 84, 'loss': 'mae', 'optimizer': 'adam', 'graph_mode': 'off', 'use_snp_selection': False}. Best is trial 111 with value: 0.14687557664425274.
[I 2025-12-05 16:08:52,504] Trial 136 finished with value: 0.12923047673727958 and parameters: {'model_type': 'mlp', 'hidden_dims': '[256, 128, 64]', 'dropout': 0.10041141852805399, 'batch_norm': True, 'lr': 0.000862961032414429, 'weight_decay': 0.0002815943225455783, 'epochs': 60, 'loss': 'mae', 'optimizer': 'adam', 'graph_mode': 'off', 'use_snp_selection': False}. Best is trial 111 with value: 0.14687557664425274.
[I 2025-12-05 16:08:53,632] Trial 137 finished with value: 0.13285309068949255 and parameters: {'model_type': 'mlp', 'hidden_dims': '[256, 128, 64]', 'dropout': 0.14073429817597916, 'batch_norm': True, 'lr': 0.0005406032890190662, 'weight_decay': 1.142242432603372e-06, 'epochs': 76, 'loss': 'mae', 'optimizer': 'adam', 'graph_mode': 'off', 'use_snp_selection': False}. Best is trial 111 with value: 0.14687557664425274.
[I 2025-12-05 16:08:56,300] Trial 138 finished with value: 0.12253022118102691 and parameters: {'model_type': 'mlp', 'hidden_dims': '[256, 128, 64]', 'dropout': 0.16625247049463668, 'batch_norm': True, 'lr': 0.0007395947451538687, 'weight_decay': 0.00010321277827547946, 'epochs': 40, 'loss': 'mae', 'optimizer': 'adam', 'graph_mode': 'off', 'use_snp_selection': True, 'num_snps': 41040}. Best is trial 111 with value: 0.14687557664425274.
[I 2025-12-05 16:08:57,433] Trial 139 finished with value: 0.11538693553399566 and parameters: {'model_type': 'mlp', 'hidden_dims': '[256, 128, 64]', 'dropout': 0.14919141670490274, 'batch_norm': False, 'lr': 0.0004192913844723767, 'weight_decay': 3.1312208638249734e-06, 'epochs': 72, 'loss': 'mae', 'optimizer': 'adam', 'graph_mode': 'off', 'use_snp_selection': False}. Best is trial 111 with value: 0.14687557664425274.
[I 2025-12-05 16:08:58,874] Trial 140 finished with value: 0.1366407341322457 and parameters: {'model_type': 'mlp', 'hidden_dims': '[512, 128]', 'dropout': 0.11692042245022251, 'batch_norm': True, 'lr': 0.0003716483364152713, 'weight_decay': 0.00016616695202601944, 'epochs': 54, 'loss': 'mae', 'optimizer': 'adam', 'graph_mode': 'off', 'use_snp_selection': False}. Best is trial 111 with value: 0.14687557664425274.
[I 2025-12-05 16:09:00,223] Trial 141 finished with value: 0.14330734554626465 and parameters: {'model_type': 'mlp', 'hidden_dims': '[512, 128]', 'dropout': 0.12133814181713644, 'batch_norm': True, 'lr': 0.00032983062618972, 'weight_decay': 0.00017543910750574402, 'epochs': 50, 'loss': 'mae', 'optimizer': 'adam', 'graph_mode': 'off', 'use_snp_selection': False}. Best is trial 111 with value: 0.14687557664425274.
[I 2025-12-05 16:09:01,607] Trial 142 finished with value: 0.13461637707288557 and parameters: {'model_type': 'mlp', 'hidden_dims': '[512, 128]', 'dropout': 0.13178269400549764, 'batch_norm': True, 'lr': 0.0003520568709804551, 'weight_decay': 0.00035847183087012847, 'epochs': 53, 'loss': 'mae', 'optimizer': 'adam', 'graph_mode': 'off', 'use_snp_selection': False}. Best is trial 111 with value: 0.14687557664425274.
[I 2025-12-05 16:09:02,903] Trial 143 finished with value: 0.13171938954541507 and parameters: {'model_type': 'mlp', 'hidden_dims': '[512, 128]', 'dropout': 0.12035154331153189, 'batch_norm': True, 'lr': 0.0002520036231111255, 'weight_decay': 0.0001460480601932058, 'epochs': 46, 'loss': 'mae', 'optimizer': 'adam', 'graph_mode': 'off', 'use_snp_selection': False}. Best is trial 111 with value: 0.14687557664425274.
[I 2025-12-05 16:09:04,343] Trial 144 finished with value: 0.12948637775288074 and parameters: {'model_type': 'mlp', 'hidden_dims': '[512, 128]', 'dropout': 0.11334119943828343, 'batch_norm': True, 'lr': 0.00023060350153251519, 'weight_decay': 0.00010878539800139226, 'epochs': 58, 'loss': 'mae', 'optimizer': 'adam', 'graph_mode': 'off', 'use_snp_selection': False}. Best is trial 111 with value: 0.14687557664425274.
[I 2025-12-05 16:09:05,782] Trial 145 finished with value: 0.124952826792388 and parameters: {'model_type': 'mlp', 'hidden_dims': '[512, 128]', 'dropout': 0.14439317372587082, 'batch_norm': True, 'lr': 0.0003351530483299009, 'weight_decay': 0.00016511783376347322, 'epochs': 53, 'loss': 'mae', 'optimizer': 'adam', 'graph_mode': 'off', 'use_snp_selection': False}. Best is trial 111 with value: 0.14687557664425274.
[I 2025-12-05 16:09:07,334] Trial 146 finished with value: 0.1302614474399969 and parameters: {'model_type': 'mlp', 'hidden_dims': '[512, 128]', 'dropout': 0.12914836467543908, 'batch_norm': True, 'lr': 0.0005827858531873286, 'weight_decay': 0.00020476619227079837, 'epochs': 63, 'loss': 'mae', 'optimizer': 'adam', 'graph_mode': 'off', 'use_snp_selection': False}. Best is trial 111 with value: 0.14687557664425274.
[I 2025-12-05 16:09:09,127] Trial 147 finished with value: 0.14693100563085226 and parameters: {'model_type': 'mlp', 'hidden_dims': '[512, 128]', 'dropout': 0.1592234353071365, 'batch_norm': True, 'lr': 0.00028653124032452186, 'weight_decay': 0.0001242909527337557, 'epochs': 86, 'loss': 'mae', 'optimizer': 'adam', 'graph_mode': 'off', 'use_snp_selection': False}. Best is trial 147 with value: 0.14693100563085226.
[I 2025-12-05 16:09:10,925] Trial 148 finished with value: 0.13957461414999045 and parameters: {'model_type': 'mlp', 'hidden_dims': '[512, 128]', 'dropout': 0.15691077606063267, 'batch_norm': True, 'lr': 0.0001754059928957738, 'weight_decay': 1.0456737169785056e-05, 'epochs': 84, 'loss': 'mae', 'optimizer': 'adam', 'graph_mode': 'off', 'use_snp_selection': False}. Best is trial 147 with value: 0.14693100563085226.
[I 2025-12-05 16:09:12,731] Trial 149 finished with value: 0.12115882365449528 and parameters: {'model_type': 'mlp', 'hidden_dims': '[512, 128]', 'dropout': 0.1707675502441096, 'batch_norm': True, 'lr': 0.00021837612966680285, 'weight_decay': 8.041276475727506e-06, 'epochs': 87, 'loss': 'mae', 'optimizer': 'adam', 'graph_mode': 'off', 'use_snp_selection': False}. Best is trial 147 with value: 0.14693100563085226.
[I 2025-12-05 16:09:15,210] Trial 0 finished with value: -0.011067148415485497 and parameters: {'model_type': 'mlp', 'hidden_dims': '[128, 64]', 'dropout': 0.199031432379812, 'batch_norm': True, 'lr': 1.8408544111075837e-06, 'weight_decay': 5.5136510071208614e-05, 'epochs': 336, 'loss': 'mae', 'optimizer': 'adam', 'graph_mode': 'off', 'use_snp_selection': True, 'num_snps': 43862}. Best is trial 0 with value: -0.011067148415485497.
[I 2025-12-05 16:09:16,555] Trial 1 finished with value: 0.06518428255743186 and parameters: {'model_type': 'mlp', 'hidden_dims': '[256, 128]', 'dropout': 0.4370668075331726, 'batch_norm': True, 'lr': 7.133471581159139e-05, 'weight_decay': 1.128633586803549e-05, 'epochs': 242, 'loss': 'mae', 'optimizer': 'adam', 'graph_mode': 'off', 'use_snp_selection': False}. Best is trial 1 with value: 0.06518428255743186.
[I 2025-12-05 16:09:17,719] Trial 2 finished with value: 0.027884206874000245 and parameters: {'model_type': 'mlp', 'hidden_dims': '[256, 128, 64]', 'dropout': 0.41314357415569625, 'batch_norm': False, 'lr': 3.952233718592101e-06, 'weight_decay': 0.00026754769258252603, 'epochs': 149, 'loss': 'mse', 'optimizer': 'adam', 'graph_mode': 'off', 'use_snp_selection': True, 'num_snps': 11571}. Best is trial 1 with value: 0.06518428255743186.
[I 2025-12-05 16:09:20,317] Trial 3 finished with value: 0.028472956094562303 and parameters: {'model_type': 'mlp', 'hidden_dims': '[512, 64]', 'dropout': 0.5938127374509361, 'batch_norm': False, 'lr': 5.67704586114731e-06, 'weight_decay': 2.4518087630137052e-05, 'epochs': 320, 'loss': 'mae', 'optimizer': 'adam', 'graph_mode': 'off', 'use_snp_selection': False}. Best is trial 1 with value: 0.06518428255743186.
[I 2025-12-05 16:09:23,045] Trial 4 finished with value: 0.03887833397526118 and parameters: {'model_type': 'mlp', 'hidden_dims': '[512, 128]', 'dropout': 0.25746343592134413, 'batch_norm': True, 'lr': 1.3467657668402788e-06, 'weight_decay': 0.00033087251918647806, 'epochs': 277, 'loss': 'mse', 'optimizer': 'adam', 'graph_mode': 'off', 'use_snp_selection': True, 'num_snps': 36675}. Best is trial 1 with value: 0.06518428255743186.
[I 2025-12-05 16:09:25,200] Trial 5 finished with value: 0.026668510118074598 and parameters: {'model_type': 'mlp', 'hidden_dims': '[512, 64]', 'dropout': 0.38275350994408375, 'batch_norm': True, 'lr': 1.5586664309232824e-06, 'weight_decay': 0.0008227664668621182, 'epochs': 145, 'loss': 'mae', 'optimizer': 'adam', 'graph_mode': 'off', 'use_snp_selection': True, 'num_snps': 32148}. Best is trial 1 with value: 0.06518428255743186.
[I 2025-12-05 16:09:26,398] Trial 6 finished with value: 0.05248686691878383 and parameters: {'model_type': 'mlp', 'hidden_dims': '[256, 128]', 'dropout': 0.3930109900265879, 'batch_norm': False, 'lr': 4.892964372128395e-05, 'weight_decay': 1.5809549317992182e-06, 'epochs': 199, 'loss': 'mse', 'optimizer': 'adam', 'graph_mode': 'off', 'use_snp_selection': False}. Best is trial 1 with value: 0.06518428255743186.
