[I 2025-12-05 15:24:37,963] Trial 64 finished with value: 0.11205348252741563 and parameters: {'model_type': 'mlp', 'hidden_dims': '[512, 128]', 'dropout': 0.2517800577534641, 'batch_norm': False, 'lr': 4.1281022723785595e-05, 'weight_decay': 0.0001184167769453884, 'epochs': 266, 'loss': 'mse', 'optimizer': 'adam', 'graph_mode': 'off', 'use_snp_selection': True, 'num_snps': 13927}. Best is trial 31 with value: 0.13489085392412814.
[I 2025-12-05 15:24:39,689] Trial 65 finished with value: 0.11901435371987103 and parameters: {'model_type': 'mlp', 'hidden_dims': '[512, 128]', 'dropout': 0.19602657198038026, 'batch_norm': False, 'lr': 9.709487419223954e-05, 'weight_decay': 2.6575254835710315e-07, 'epochs': 295, 'loss': 'mse', 'optimizer': 'adam', 'graph_mode': 'off', 'use_snp_selection': True, 'num_snps': 4732}. Best is trial 31 with value: 0.13489085392412814.
[I 2025-12-05 15:24:43,501] Trial 66 finished with value: 0.10648793364805392 and parameters: {'model_type': 'mlp', 'hidden_dims': '[512, 128]', 'dropout': 0.3140314774642771, 'batch_norm': False, 'lr': 0.00017460704321092344, 'weight_decay': 7.542946010915808e-05, 'epochs': 248, 'loss': 'mse', 'optimizer': 'adam', 'graph_mode': 'off', 'use_snp_selection': True, 'num_snps': 31796}. Best is trial 31 with value: 0.13489085392412814.
[I 2025-12-05 15:24:45,816] Trial 67 finished with value: 0.1329400143407503 and parameters: {'model_type': 'mlp', 'hidden_dims': '[256, 128]', 'dropout': 0.2874939341771156, 'batch_norm': False, 'lr': 5.0982628651247704e-05, 'weight_decay': 0.00024041551903301414, 'epochs': 221, 'loss': 'mae', 'optimizer': 'adam', 'graph_mode': 'off', 'use_snp_selection': True, 'num_snps': 18529}. Best is trial 31 with value: 0.13489085392412814.
[I 2025-12-05 15:24:48,134] Trial 68 finished with value: 0.13746207369756264 and parameters: {'model_type': 'mlp', 'hidden_dims': '[256, 128]', 'dropout': 0.34939556903984165, 'batch_norm': False, 'lr': 4.74267900820668e-05, 'weight_decay': 0.0002999142300419172, 'epochs': 212, 'loss': 'mae', 'optimizer': 'adam', 'graph_mode': 'off', 'use_snp_selection': True, 'num_snps': 18977}. Best is trial 68 with value: 0.13746207369756264.
[I 2025-12-05 15:24:50,811] Trial 69 finished with value: 0.12283378487797542 and parameters: {'model_type': 'mlp', 'hidden_dims': '[256, 128]', 'dropout': 0.3660556149022205, 'batch_norm': False, 'lr': 5.3696227889069e-05, 'weight_decay': 3.826484777095569e-05, 'epochs': 217, 'loss': 'mae', 'optimizer': 'adam', 'graph_mode': 'off', 'use_snp_selection': True, 'num_snps': 25967}. Best is trial 68 with value: 0.13746207369756264.
[I 2025-12-05 15:24:53,140] Trial 70 finished with value: 0.02949619796365212 and parameters: {'model_type': 'mlp', 'hidden_dims': '[256, 128]', 'dropout': 0.3441369784890138, 'batch_norm': True, 'lr': 1.295269186043636e-06, 'weight_decay': 1.1921619790739136e-05, 'epochs': 223, 'loss': 'mae', 'optimizer': 'adam', 'graph_mode': 'off', 'use_snp_selection': True, 'num_snps': 18658}. Best is trial 68 with value: 0.13746207369756264.
[I 2025-12-05 15:24:55,659] Trial 71 finished with value: 0.10056340806232716 and parameters: {'model_type': 'mlp', 'hidden_dims': '[256, 128]', 'dropout': 0.3609942674105704, 'batch_norm': False, 'lr': 5.3901910634883903e-05, 'weight_decay': 0.00031237282961893615, 'epochs': 211, 'loss': 'mae', 'optimizer': 'adam', 'graph_mode': 'off', 'use_snp_selection': True, 'num_snps': 24083}. Best is trial 68 with value: 0.13746207369756264.
[I 2025-12-05 15:24:58,394] Trial 72 finished with value: 0.1175491551272046 and parameters: {'model_type': 'mlp', 'hidden_dims': '[256, 128]', 'dropout': 0.39306795589951016, 'batch_norm': False, 'lr': 4.454569666875617e-05, 'weight_decay': 4.500024677111584e-05, 'epochs': 215, 'loss': 'mae', 'optimizer': 'adam', 'graph_mode': 'off', 'use_snp_selection': True, 'num_snps': 26609}. Best is trial 68 with value: 0.13746207369756264.
[I 2025-12-05 15:25:00,809] Trial 73 finished with value: 0.09592710304054954 and parameters: {'model_type': 'mlp', 'hidden_dims': '[256, 128]', 'dropout': 0.38495688138176865, 'batch_norm': False, 'lr': 2.6627684259200002e-05, 'weight_decay': 9.521670606407489e-05, 'epochs': 179, 'loss': 'mae', 'optimizer': 'adam', 'graph_mode': 'off', 'use_snp_selection': True, 'num_snps': 22553}. Best is trial 68 with value: 0.13746207369756264.
[I 2025-12-05 15:25:03,175] Trial 74 finished with value: 0.10920039055664311 and parameters: {'model_type': 'mlp', 'hidden_dims': '[256, 128]', 'dropout': 0.3379844450116367, 'batch_norm': False, 'lr': 6.532080952649099e-05, 'weight_decay': 0.00016748781620809654, 'epochs': 199, 'loss': 'mae', 'optimizer': 'adam', 'graph_mode': 'off', 'use_snp_selection': True, 'num_snps': 19697}. Best is trial 68 with value: 0.13746207369756264.
[I 2025-12-05 15:25:05,246] Trial 75 finished with value: 0.10959818846572816 and parameters: {'model_type': 'mlp', 'hidden_dims': '[256, 128]', 'dropout': 0.2898897984796332, 'batch_norm': False, 'lr': 3.520355055067688e-05, 'weight_decay': 3.3131509646789603e-06, 'epochs': 234, 'loss': 'mae', 'optimizer': 'adam', 'graph_mode': 'off', 'use_snp_selection': True, 'num_snps': 13463}. Best is trial 68 with value: 0.13746207369756264.
[I 2025-12-05 15:25:08,276] Trial 76 finished with value: 0.10097283675876982 and parameters: {'model_type': 'mlp', 'hidden_dims': '[256, 128]', 'dropout': 0.3681420838866868, 'batch_norm': False, 'lr': 9.220922568486511e-05, 'weight_decay': 0.0002209502481413318, 'epochs': 165, 'loss': 'mae', 'optimizer': 'adam', 'graph_mode': 'off', 'use_snp_selection': True, 'num_snps': 35157}. Best is trial 68 with value: 0.13746207369756264.
[I 2025-12-05 15:25:11,849] Trial 77 finished with value: 0.11466380556238406 and parameters: {'model_type': 'mlp', 'hidden_dims': '[256, 128]', 'dropout': 0.41052446257966835, 'batch_norm': False, 'lr': 4.992079055380666e-05, 'weight_decay': 0.0008214066554145456, 'epochs': 223, 'loss': 'mae', 'optimizer': 'adam', 'graph_mode': 'off', 'use_snp_selection': True, 'num_snps': 42932}. Best is trial 68 with value: 0.13746207369756264.
[I 2025-12-05 15:25:14,065] Trial 78 finished with value: 0.10415757009645227 and parameters: {'model_type': 'mlp', 'hidden_dims': '[256, 128]', 'dropout': 0.3056182805359186, 'batch_norm': False, 'lr': 2.120333475404962e-06, 'weight_decay': 3.729985358167112e-05, 'epochs': 242, 'loss': 'mae', 'optimizer': 'adam', 'graph_mode': 'off', 'use_snp_selection': False}. Best is trial 68 with value: 0.13746207369756264.
[I 2025-12-05 15:25:16,520] Trial 79 finished with value: 0.12189429720312016 and parameters: {'model_type': 'mlp', 'hidden_dims': '[128, 64]', 'dropout': 0.4448670763381676, 'batch_norm': False, 'lr': 3.88716298326105e-05, 'weight_decay': 0.000296414147701369, 'epochs': 206, 'loss': 'mae', 'optimizer': 'adam', 'graph_mode': 'off', 'use_snp_selection': True, 'num_snps': 30473}. Best is trial 68 with value: 0.13746207369756264.
[I 2025-12-05 15:25:19,223] Trial 80 finished with value: 0.10718979846639508 and parameters: {'model_type': 'mlp', 'hidden_dims': '[256, 128]', 'dropout': 0.35176917584621836, 'batch_norm': True, 'lr': 1.987451267775263e-05, 'weight_decay': 2.665667601105324e-05, 'epochs': 182, 'loss': 'mae', 'optimizer': 'adam', 'graph_mode': 'off', 'use_snp_selection': True, 'num_snps': 27868}. Best is trial 68 with value: 0.13746207369756264.
[I 2025-12-05 15:25:21,552] Trial 81 finished with value: 0.11145899522004063 and parameters: {'model_type': 'mlp', 'hidden_dims': '[256, 128, 64]', 'dropout': 0.2713295834552007, 'batch_norm': False, 'lr': 2.9622861004179017e-05, 'weight_decay': 0.000366940439201965, 'epochs': 228, 'loss': 'mae', 'optimizer': 'adam', 'graph_mode': 'off', 'use_snp_selection': True, 'num_snps': 18288}. Best is trial 68 with value: 0.13746207369756264.
[I 2025-12-05 15:25:24,069] Trial 82 finished with value: 0.12409124413255047 and parameters: {'model_type': 'mlp', 'hidden_dims': '[256, 128, 64]', 'dropout': 0.28807952092515626, 'batch_norm': False, 'lr': 2.2273898310242857e-05, 'weight_decay': 0.000523537974482246, 'epochs': 252, 'loss': 'mae', 'optimizer': 'adam', 'graph_mode': 'off', 'use_snp_selection': True, 'num_snps': 21065}. Best is trial 68 with value: 0.13746207369756264.
[I 2025-12-05 15:25:27,462] Trial 83 finished with value: 0.1313975209048862 and parameters: {'model_type': 'mlp', 'hidden_dims': '[512, 256]', 'dropout': 0.2854647864748346, 'batch_norm': False, 'lr': 2.3625309827883135e-05, 'weight_decay': 0.0005738289129278101, 'epochs': 252, 'loss': 'mae', 'optimizer': 'adam', 'graph_mode': 'off', 'use_snp_selection': True, 'num_snps': 25099}. Best is trial 68 with value: 0.13746207369756264.
[I 2025-12-05 15:25:30,527] Trial 84 finished with value: 0.11986279567019663 and parameters: {'model_type': 'mlp', 'hidden_dims': '[512, 256]', 'dropout': 0.2881885344699894, 'batch_norm': False, 'lr': 1.3795330530319705e-05, 'weight_decay': 0.0005259995537736869, 'epochs': 258, 'loss': 'mae', 'optimizer': 'adam', 'graph_mode': 'off', 'use_snp_selection': True, 'num_snps': 20903}. Best is trial 68 with value: 0.13746207369756264.
[I 2025-12-05 15:25:33,869] Trial 85 finished with value: 0.1043823264202555 and parameters: {'model_type': 'mlp', 'hidden_dims': '[512, 256]', 'dropout': 0.31935792046827327, 'batch_norm': False, 'lr': 1.0520083115931715e-05, 'weight_decay': 0.0007018239171724789, 'epochs': 267, 'loss': 'mae', 'optimizer': 'adam', 'graph_mode': 'off', 'use_snp_selection': True, 'num_snps': 24155}. Best is trial 68 with value: 0.13746207369756264.
[I 2025-12-05 15:25:39,841] Trial 86 finished with value: 0.11086190616457264 and parameters: {'model_type': 'mlp', 'hidden_dims': '[512, 256]', 'dropout': 0.263374811408993, 'batch_norm': False, 'lr': 2.2925106935675973e-05, 'weight_decay': 0.000509002824582657, 'epochs': 252, 'loss': 'mae', 'optimizer': 'adam', 'graph_mode': 'off', 'use_snp_selection': True, 'num_snps': 59796}. Best is trial 68 with value: 0.13746207369756264.
[I 2025-12-05 15:25:42,091] Trial 87 finished with value: 0.10510701981736519 and parameters: {'model_type': 'mlp', 'hidden_dims': '[256, 128, 64]', 'dropout': 0.27696770454017666, 'batch_norm': False, 'lr': 1.6371725258055333e-05, 'weight_decay': 0.0008486049497572096, 'epochs': 239, 'loss': 'mae', 'optimizer': 'adam', 'graph_mode': 'off', 'use_snp_selection': True, 'num_snps': 16403}. Best is trial 68 with value: 0.13746207369756264.
[I 2025-12-05 15:25:45,273] Trial 88 finished with value: 0.10276982538727028 and parameters: {'model_type': 'mlp', 'hidden_dims': '[512, 64]', 'dropout': 0.2321019816073241, 'batch_norm': False, 'lr': 1.0129775344623088e-06, 'weight_decay': 0.00038277498849796974, 'epochs': 272, 'loss': 'mae', 'optimizer': 'adam', 'graph_mode': 'off', 'use_snp_selection': True, 'num_snps': 22193}. Best is trial 68 with value: 0.13746207369756264.
[I 2025-12-05 15:25:47,730] Trial 89 finished with value: 0.06833384716382226 and parameters: {'model_type': 'mlp', 'hidden_dims': '[512, 256]', 'dropout': 0.32665221132728817, 'batch_norm': True, 'lr': 1.751921679316475e-06, 'weight_decay': 0.0001307895672712012, 'epochs': 231, 'loss': 'mae', 'optimizer': 'adam', 'graph_mode': 'off', 'use_snp_selection': True, 'num_snps': 14232}. Best is trial 68 with value: 0.13746207369756264.
[I 2025-12-05 15:25:50,079] Trial 90 finished with value: 0.10922906448004693 and parameters: {'model_type': 'mlp', 'hidden_dims': '[256, 128, 64]', 'dropout': 0.12147177673186882, 'batch_norm': False, 'lr': 6.174748344096263e-05, 'weight_decay': 0.0005778756557628792, 'epochs': 262, 'loss': 'mae', 'optimizer': 'adam', 'graph_mode': 'off', 'use_snp_selection': False}. Best is trial 68 with value: 0.13746207369756264.
[I 2025-12-05 15:25:52,673] Trial 91 finished with value: 0.12165340870960499 and parameters: {'model_type': 'mlp', 'hidden_dims': '[256, 128]', 'dropout': 0.2974519481253407, 'batch_norm': False, 'lr': 5.042903457497515e-05, 'weight_decay': 0.00020564349415288512, 'epochs': 215, 'loss': 'mae', 'optimizer': 'adam', 'graph_mode': 'off', 'use_snp_selection': True, 'num_snps': 25655}. Best is trial 68 with value: 0.13746207369756264.
[I 2025-12-05 15:25:55,070] Trial 92 finished with value: 0.09791601438573762 and parameters: {'model_type': 'mlp', 'hidden_dims': '[256, 128, 64]', 'dropout': 0.47031067973682594, 'batch_norm': False, 'lr': 2.9289084854327876e-05, 'weight_decay': 0.0002789446003367669, 'epochs': 247, 'loss': 'mae', 'optimizer': 'adam', 'graph_mode': 'off', 'use_snp_selection': True, 'num_snps': 19673}. Best is trial 68 with value: 0.13746207369756264.
[I 2025-12-05 15:25:58,049] Trial 93 finished with value: 0.1315991788355865 and parameters: {'model_type': 'mlp', 'hidden_dims': '[256, 128, 64]', 'dropout': 0.2054240520847813, 'batch_norm': False, 'lr': 7.914883033639347e-05, 'weight_decay': 0.00043074897162566394, 'epochs': 192, 'loss': 'mae', 'optimizer': 'adam', 'graph_mode': 'off', 'use_snp_selection': True, 'num_snps': 33710}. Best is trial 68 with value: 0.13746207369756264.
[I 2025-12-05 15:26:01,000] Trial 94 finished with value: 0.11199549094724663 and parameters: {'model_type': 'mlp', 'hidden_dims': '[256, 128, 64]', 'dropout': 0.16966436206107494, 'batch_norm': False, 'lr': 0.00014378782137592787, 'weight_decay': 0.00043870794512420577, 'epochs': 196, 'loss': 'mae', 'optimizer': 'adam', 'graph_mode': 'off', 'use_snp_selection': True, 'num_snps': 33078}. Best is trial 68 with value: 0.13746207369756264.
[I 2025-12-05 15:26:03,271] Trial 95 finished with value: 0.12298873084179886 and parameters: {'model_type': 'mlp', 'hidden_dims': '[256, 128, 64]', 'dropout': 0.20278597781803837, 'batch_norm': False, 'lr': 7.775954891857207e-05, 'weight_decay': 0.0003221656383182996, 'epochs': 243, 'loss': 'mae', 'optimizer': 'adam', 'graph_mode': 'off', 'use_snp_selection': True, 'num_snps': 16751}. Best is trial 68 with value: 0.13746207369756264.
[I 2025-12-05 15:26:06,348] Trial 96 finished with value: 0.06713341709304825 and parameters: {'model_type': 'mlp', 'hidden_dims': '[256, 128, 64]', 'dropout': 0.18303994590857084, 'batch_norm': False, 'lr': 3.3451601509388075e-06, 'weight_decay': 0.00015700762986749434, 'epochs': 185, 'loss': 'mae', 'optimizer': 'adam', 'graph_mode': 'off', 'use_snp_selection': True, 'num_snps': 36643}. Best is trial 68 with value: 0.13746207369756264.
[I 2025-12-05 15:26:09,531] Trial 97 finished with value: 0.12547696164043995 and parameters: {'model_type': 'mlp', 'hidden_dims': '[256, 128, 64]', 'dropout': 0.24506086401659133, 'batch_norm': False, 'lr': 9.405741273850522e-05, 'weight_decay': 0.0007614755230420235, 'epochs': 169, 'loss': 'mse', 'optimizer': 'adam', 'graph_mode': 'off', 'use_snp_selection': True, 'num_snps': 39330}. Best is trial 68 with value: 0.13746207369756264.
[I 2025-12-05 15:26:12,756] Trial 98 finished with value: 0.11026879068709412 and parameters: {'model_type': 'mlp', 'hidden_dims': '[256, 128, 64]', 'dropout': 0.2086183348886958, 'batch_norm': True, 'lr': 0.00010231464662540548, 'weight_decay': 0.0008640962137027392, 'epochs': 170, 'loss': 'mse', 'optimizer': 'adam', 'graph_mode': 'off', 'use_snp_selection': True, 'num_snps': 40192}. Best is trial 68 with value: 0.13746207369756264.
[I 2025-12-05 15:26:15,676] Trial 99 finished with value: 0.11623326362575331 and parameters: {'model_type': 'mlp', 'hidden_dims': '[128, 64]', 'dropout': 0.2221005044751379, 'batch_norm': False, 'lr': 8.717527860279949e-05, 'weight_decay': 0.00023978716468565141, 'epochs': 161, 'loss': 'mse', 'optimizer': 'adam', 'graph_mode': 'off', 'use_snp_selection': True, 'num_snps': 42124}. Best is trial 68 with value: 0.13746207369756264.
[I 2025-12-05 15:26:19,183] Trial 100 finished with value: 0.11687978612241985 and parameters: {'model_type': 'mlp', 'hidden_dims': '[512, 256]', 'dropout': 0.2458445078983428, 'batch_norm': False, 'lr': 7.101559849208808e-05, 'weight_decay': 0.0006736721444016712, 'epochs': 146, 'loss': 'mse', 'optimizer': 'adam', 'graph_mode': 'off', 'use_snp_selection': True, 'num_snps': 37998}. Best is trial 68 with value: 0.13746207369756264.
[I 2025-12-05 15:26:22,177] Trial 101 finished with value: 0.10935498484699571 and parameters: {'model_type': 'mlp', 'hidden_dims': '[256, 128, 64]', 'dropout': 0.26368598516883185, 'batch_norm': False, 'lr': 5.076541722543189e-06, 'weight_decay': 0.0004450195346148194, 'epochs': 188, 'loss': 'mse', 'optimizer': 'adam', 'graph_mode': 'off', 'use_snp_selection': True, 'num_snps': 34310}. Best is trial 68 with value: 0.13746207369756264.
[I 2025-12-05 15:26:24,753] Trial 102 finished with value: 0.11002221162414479 and parameters: {'model_type': 'mlp', 'hidden_dims': '[256, 128, 64]', 'dropout': 0.1422111261744604, 'batch_norm': False, 'lr': 0.00014492287687308808, 'weight_decay': 0.000524891761934882, 'epochs': 274, 'loss': 'mse', 'optimizer': 'adam', 'graph_mode': 'off', 'use_snp_selection': True, 'num_snps': 21405}. Best is trial 68 with value: 0.13746207369756264.
[I 2025-12-05 15:26:28,351] Trial 103 finished with value: 0.10521621785128805 and parameters: {'model_type': 'mlp', 'hidden_dims': '[256, 128, 64]', 'dropout': 0.2815414898263995, 'batch_norm': False, 'lr': 4.4385329245346775e-05, 'weight_decay': 0.0003824522962777505, 'epochs': 288, 'loss': 'mse', 'optimizer': 'adam', 'graph_mode': 'off', 'use_snp_selection': True, 'num_snps': 38441}. Best is trial 68 with value: 0.13746207369756264.
[I 2025-12-05 15:26:31,768] Trial 104 finished with value: 0.1152398848370279 and parameters: {'model_type': 'mlp', 'hidden_dims': '[256, 128, 64]', 'dropout': 0.23611580428360987, 'batch_norm': False, 'lr': 3.5590754198472836e-05, 'weight_decay': 0.0007278826737820623, 'epochs': 154, 'loss': 'mse', 'optimizer': 'adam', 'graph_mode': 'off', 'use_snp_selection': True, 'num_snps': 46749}. Best is trial 68 with value: 0.13746207369756264.
[I 2025-12-05 15:26:34,132] Trial 105 finished with value: 0.11354016565695536 and parameters: {'model_type': 'mlp', 'hidden_dims': '[256, 128, 64]', 'dropout': 0.2542830551235378, 'batch_norm': False, 'lr': 6.176759925910383e-05, 'weight_decay': 0.000603607542154537, 'epochs': 252, 'loss': 'mae', 'optimizer': 'adam', 'graph_mode': 'off', 'use_snp_selection': True, 'num_snps': 17934}. Best is trial 68 with value: 0.13746207369756264.
[I 2025-12-05 15:26:36,247] Trial 106 finished with value: 0.07142306591100062 and parameters: {'model_type': 'mlp', 'hidden_dims': '[512, 64]', 'dropout': 0.3049888168266365, 'batch_norm': False, 'lr': 6.574661497058242e-06, 'weight_decay': 0.00028702291904947097, 'epochs': 203, 'loss': 'mse', 'optimizer': 'adam', 'graph_mode': 'off', 'use_snp_selection': True, 'num_snps': 11150}. Best is trial 68 with value: 0.13746207369756264.
[I 2025-12-05 15:26:38,811] Trial 107 finished with value: 0.07360557482639159 and parameters: {'model_type': 'mlp', 'hidden_dims': '[256, 128, 64]', 'dropout': 0.19135345290989372, 'batch_norm': False, 'lr': 1.1996131582864524e-06, 'weight_decay': 0.0002116332634287654, 'epochs': 221, 'loss': 'mse', 'optimizer': 'adam', 'graph_mode': 'off', 'use_snp_selection': True, 'num_snps': 23182}. Best is trial 68 with value: 0.13746207369756264.
[I 2025-12-05 15:26:41,402] Trial 108 finished with value: 0.0752288993188413 and parameters: {'model_type': 'mlp', 'hidden_dims': '[256, 128, 64]', 'dropout': 0.24824318665841144, 'batch_norm': True, 'lr': 1.9170226409952816e-05, 'weight_decay': 0.00038911210013114827, 'epochs': 129, 'loss': 'mae', 'optimizer': 'adam', 'graph_mode': 'off', 'use_snp_selection': True, 'num_snps': 29620}. Best is trial 68 with value: 0.13746207369756264.
[I 2025-12-05 15:26:44,317] Trial 109 finished with value: 0.09652848173374155 and parameters: {'model_type': 'mlp', 'hidden_dims': '[512, 128]', 'dropout': 0.22264485641852633, 'batch_norm': False, 'lr': 2.2403343732429342e-05, 'weight_decay': 0.0001927601468119609, 'epochs': 175, 'loss': 'mse', 'optimizer': 'adam', 'graph_mode': 'off', 'use_snp_selection': False}. Best is trial 68 with value: 0.13746207369756264.
[I 2025-12-05 15:26:46,366] Trial 110 finished with value: 0.1186158893719109 and parameters: {'model_type': 'mlp', 'hidden_dims': '[256, 128, 64]', 'dropout': 0.27259971302512065, 'batch_norm': False, 'lr': 0.00021110590994815912, 'weight_decay': 0.000988623682431225, 'epochs': 209, 'loss': 'mse', 'optimizer': 'adam', 'graph_mode': 'off', 'use_snp_selection': True, 'num_snps': 15138}. Best is trial 68 with value: 0.13746207369756264.
[I 2025-12-05 15:26:48,632] Trial 111 finished with value: 0.1240548189559597 and parameters: {'model_type': 'mlp', 'hidden_dims': '[256, 128, 64]', 'dropout': 0.20688572935083638, 'batch_norm': False, 'lr': 7.3569814021016e-05, 'weight_decay': 0.0003311145731945144, 'epochs': 241, 'loss': 'mae', 'optimizer': 'adam', 'graph_mode': 'off', 'use_snp_selection': True, 'num_snps': 16682}. Best is trial 68 with value: 0.13746207369756264.
[I 2025-12-05 15:26:50,955] Trial 112 finished with value: 0.1155440475657532 and parameters: {'model_type': 'mlp', 'hidden_dims': '[256, 128, 64]', 'dropout': 0.2606871709456787, 'batch_norm': False, 'lr': 7.876785657255293e-05, 'weight_decay': 0.0002645829166256561, 'epochs': 237, 'loss': 'mae', 'optimizer': 'adam', 'graph_mode': 'off', 'use_snp_selection': True, 'num_snps': 20072}. Best is trial 68 with value: 0.13746207369756264.
[I 2025-12-05 15:26:52,965] Trial 113 finished with value: 0.1279193193013639 and parameters: {'model_type': 'mlp', 'hidden_dims': '[256, 128, 64]', 'dropout': 0.21432642657062265, 'batch_norm': False, 'lr': 4.744195140919349e-05, 'weight_decay': 0.00046445255678560543, 'epochs': 264, 'loss': 'mae', 'optimizer': 'adam', 'graph_mode': 'off', 'use_snp_selection': True, 'num_snps': 13025}. Best is trial 68 with value: 0.13746207369756264.
