[I 2025-12-05 15:40:07,070] Trial 51 finished with value: 0.3118508676503233 and parameters: {'model_type': 'mlp', 'hidden_dims': '[512, 64]', 'dropout': 0.20616042779752686, 'batch_norm': False, 'lr': 4.114510680305439e-06, 'weight_decay': 0.00016187032092235826, 'epochs': 305, 'loss': 'mae', 'optimizer': 'adam', 'graph_mode': 'off', 'use_snp_selection': True, 'num_snps': 52604}. Best is trial 32 with value: 0.3129934650752792.
[I 2025-12-05 15:41:17,454] Trial 52 finished with value: 0.31201482414390946 and parameters: {'model_type': 'mlp', 'hidden_dims': '[512, 64]', 'dropout': 0.20987284268229173, 'batch_norm': False, 'lr': 5.624805730564504e-06, 'weight_decay': 0.00035098517271319114, 'epochs': 225, 'loss': 'mae', 'optimizer': 'adam', 'graph_mode': 'off', 'use_snp_selection': True, 'num_snps': 54288}. Best is trial 32 with value: 0.3129934650752792.
[I 2025-12-05 15:42:06,042] Trial 53 finished with value: 0.2986627760854374 and parameters: {'model_type': 'mlp', 'hidden_dims': '[512, 64]', 'dropout': 0.1854897429932727, 'batch_norm': False, 'lr': 6.752132224621172e-06, 'weight_decay': 0.00034156436649169527, 'epochs': 76, 'loss': 'mae', 'optimizer': 'adam', 'graph_mode': 'off', 'use_snp_selection': True, 'num_snps': 54793}. Best is trial 32 with value: 0.3129934650752792.
[I 2025-12-05 15:43:15,669] Trial 54 finished with value: 0.29811795468743923 and parameters: {'model_type': 'mlp', 'hidden_dims': '[512, 64]', 'dropout': 0.21928810942304194, 'batch_norm': False, 'lr': 1.551335859129218e-06, 'weight_decay': 0.0006698237142572578, 'epochs': 223, 'loss': 'mae', 'optimizer': 'adam', 'graph_mode': 'off', 'use_snp_selection': True, 'num_snps': 53712}. Best is trial 32 with value: 0.3129934650752792.
[I 2025-12-05 15:44:19,758] Trial 55 finished with value: 0.305051248207309 and parameters: {'model_type': 'mlp', 'hidden_dims': '[512, 64]', 'dropout': 0.16178758109407781, 'batch_norm': False, 'lr': 3.5667488963416626e-06, 'weight_decay': 5.219168278019918e-05, 'epochs': 168, 'loss': 'mae', 'optimizer': 'adam', 'graph_mode': 'off', 'use_snp_selection': True, 'num_snps': 56566}. Best is trial 32 with value: 0.3129934650752792.
[I 2025-12-05 15:44:59,498] Trial 56 finished with value: 0.29201928795867493 and parameters: {'model_type': 'mlp', 'hidden_dims': '[128, 64]', 'dropout': 0.3616854438926411, 'batch_norm': False, 'lr': 5.11364686559193e-06, 'weight_decay': 0.00012471698953903044, 'epochs': 128, 'loss': 'mae', 'optimizer': 'adam', 'graph_mode': 'off', 'use_snp_selection': True, 'num_snps': 48696}. Best is trial 32 with value: 0.3129934650752792.
[I 2025-12-05 15:45:50,136] Trial 57 finished with value: 0.28326288641135144 and parameters: {'model_type': 'mlp', 'hidden_dims': '[512, 128]', 'dropout': 0.10370092836426767, 'batch_norm': True, 'lr': 5.5955997408288825e-06, 'weight_decay': 0.00023507976853068954, 'epochs': 323, 'loss': 'mae', 'optimizer': 'adam', 'graph_mode': 'off', 'use_snp_selection': True, 'num_snps': 24972}. Best is trial 32 with value: 0.3129934650752792.
[I 2025-12-05 15:47:17,738] Trial 58 finished with value: 0.3095276867770245 and parameters: {'model_type': 'mlp', 'hidden_dims': '[512, 64]', 'dropout': 0.24627493747216406, 'batch_norm': False, 'lr': 1.4601125164675175e-05, 'weight_decay': 0.00036389041512742475, 'epochs': 309, 'loss': 'mae', 'optimizer': 'adam', 'graph_mode': 'off', 'use_snp_selection': True, 'num_snps': 58705}. Best is trial 32 with value: 0.3129934650752792.
[I 2025-12-05 15:48:43,934] Trial 59 finished with value: 0.3076108516594975 and parameters: {'model_type': 'mlp', 'hidden_dims': '[512, 256]', 'dropout': 0.28097746928352485, 'batch_norm': False, 'lr': 2.0954036675952456e-05, 'weight_decay': 1.3614921539371797e-05, 'epochs': 339, 'loss': 'mae', 'optimizer': 'adam', 'graph_mode': 'off', 'use_snp_selection': True, 'num_snps': 52963}. Best is trial 32 with value: 0.3129934650752792.
[I 2025-12-05 15:49:33,244] Trial 60 finished with value: 0.3089992676558936 and parameters: {'model_type': 'mlp', 'hidden_dims': '[256, 128, 64]', 'dropout': 0.1909719102745576, 'batch_norm': False, 'lr': 0.0009345964829140513, 'weight_decay': 3.4639418904313566e-05, 'epochs': 232, 'loss': 'mae', 'optimizer': 'adam', 'graph_mode': 'off', 'use_snp_selection': True, 'num_snps': 46260}. Best is trial 32 with value: 0.3129934650752792.
[I 2025-12-05 15:50:57,545] Trial 61 finished with value: 0.30950453220858754 and parameters: {'model_type': 'mlp', 'hidden_dims': '[512, 64]', 'dropout': 0.21393038695735792, 'batch_norm': False, 'lr': 4.031354413175564e-06, 'weight_decay': 0.00016428568684240906, 'epochs': 298, 'loss': 'mae', 'optimizer': 'adam', 'graph_mode': 'off', 'use_snp_selection': True, 'num_snps': 56769}. Best is trial 32 with value: 0.3129934650752792.
[I 2025-12-05 15:52:11,262] Trial 62 finished with value: 0.3131797351825902 and parameters: {'model_type': 'mlp', 'hidden_dims': '[512, 64]', 'dropout': 0.31441949630634874, 'batch_norm': False, 'lr': 8.44779635686218e-06, 'weight_decay': 8.30826002222821e-05, 'epochs': 285, 'loss': 'mae', 'optimizer': 'adam', 'graph_mode': 'off', 'use_snp_selection': True, 'num_snps': 48774}. Best is trial 62 with value: 0.3131797351825902.
[I 2025-12-05 15:53:20,444] Trial 63 finished with value: 0.3052936422942755 and parameters: {'model_type': 'mlp', 'hidden_dims': '[512, 64]', 'dropout': 0.31836607705466, 'batch_norm': False, 'lr': 8.499985383088916e-06, 'weight_decay': 8.540520025706256e-05, 'epochs': 279, 'loss': 'mae', 'optimizer': 'adam', 'graph_mode': 'off', 'use_snp_selection': True, 'num_snps': 45408}. Best is trial 62 with value: 0.3131797351825902.
[I 2025-12-05 15:54:43,331] Trial 64 finished with value: 0.30901623226851804 and parameters: {'model_type': 'mlp', 'hidden_dims': '[512, 64]', 'dropout': 0.3410868536079887, 'batch_norm': False, 'lr': 2.5033658436914816e-06, 'weight_decay': 6.123961314635407e-05, 'epochs': 319, 'loss': 'mae', 'optimizer': 'adam', 'graph_mode': 'off', 'use_snp_selection': True, 'num_snps': 52679}. Best is trial 62 with value: 0.3131797351825902.
[I 2025-12-05 15:56:01,009] Trial 65 finished with value: 0.30418800502971377 and parameters: {'model_type': 'mlp', 'hidden_dims': '[512, 64]', 'dropout': 0.26423123058975845, 'batch_norm': False, 'lr': 3.4584454701639005e-05, 'weight_decay': 2.1976004226593113e-05, 'epochs': 326, 'loss': 'mae', 'optimizer': 'adam', 'graph_mode': 'off', 'use_snp_selection': True, 'num_snps': 48103}. Best is trial 62 with value: 0.3131797351825902.
[I 2025-12-05 15:57:18,379] Trial 66 finished with value: 0.3068301160638901 and parameters: {'model_type': 'mlp', 'hidden_dims': '[512, 64]', 'dropout': 0.23682675343486803, 'batch_norm': False, 'lr': 1.2003004459745416e-05, 'weight_decay': 0.0006420440802920034, 'epochs': 254, 'loss': 'mae', 'optimizer': 'adam', 'graph_mode': 'off', 'use_snp_selection': True, 'num_snps': 56661}. Best is trial 62 with value: 0.3131797351825902.
[I 2025-12-05 15:58:53,979] Trial 67 finished with value: 0.30801153853040397 and parameters: {'model_type': 'mlp', 'hidden_dims': '[512, 64]', 'dropout': 0.3011541741152861, 'batch_norm': False, 'lr': 6.565199337852481e-06, 'weight_decay': 4.5042207073607264e-05, 'epochs': 342, 'loss': 'mae', 'optimizer': 'adam', 'graph_mode': 'off', 'use_snp_selection': True, 'num_snps': 59907}. Best is trial 62 with value: 0.3131797351825902.
[I 2025-12-05 15:59:54,780] Trial 68 finished with value: 0.3025338379589238 and parameters: {'model_type': 'mlp', 'hidden_dims': '[512, 64]', 'dropout': 0.38729709836775017, 'batch_norm': False, 'lr': 1.7735683327038252e-05, 'weight_decay': 1.8046448664708175e-07, 'epochs': 188, 'loss': 'mse', 'optimizer': 'adam', 'graph_mode': 'off', 'use_snp_selection': True, 'num_snps': 48913}. Best is trial 62 with value: 0.3131797351825902.
[I 2025-12-05 16:01:16,235] Trial 69 finished with value: 0.3133309376882862 and parameters: {'model_type': 'mlp', 'hidden_dims': '[512, 64]', 'dropout': 0.44212645272697293, 'batch_norm': False, 'lr': 8.276044240739168e-06, 'weight_decay': 0.0001330889216078569, 'epochs': 311, 'loss': 'mae', 'optimizer': 'adam', 'graph_mode': 'off', 'use_snp_selection': True, 'num_snps': 52456}. Best is trial 69 with value: 0.3133309376882862.
[I 2025-12-05 16:02:34,581] Trial 70 finished with value: 0.31216781846187447 and parameters: {'model_type': 'mlp', 'hidden_dims': '[512, 128]', 'dropout': 0.43156199708867526, 'batch_norm': False, 'lr': 7.391809783656135e-06, 'weight_decay': 0.00013106501110565717, 'epochs': 288, 'loss': 'mae', 'optimizer': 'adam', 'graph_mode': 'off', 'use_snp_selection': True, 'num_snps': 52400}. Best is trial 69 with value: 0.3133309376882862.
[I 2025-12-05 16:03:53,443] Trial 71 finished with value: 0.31316975569388317 and parameters: {'model_type': 'mlp', 'hidden_dims': '[512, 128]', 'dropout': 0.44473099911844655, 'batch_norm': False, 'lr': 8.14636708041951e-06, 'weight_decay': 0.00022695563097094678, 'epochs': 288, 'loss': 'mae', 'optimizer': 'adam', 'graph_mode': 'off', 'use_snp_selection': True, 'num_snps': 53017}. Best is trial 69 with value: 0.3133309376882862.
[I 2025-12-05 16:05:15,499] Trial 72 finished with value: 0.3113881534104316 and parameters: {'model_type': 'mlp', 'hidden_dims': '[512, 128]', 'dropout': 0.4328565234816328, 'batch_norm': False, 'lr': 9.382009332180542e-06, 'weight_decay': 0.00022989037568336718, 'epochs': 288, 'loss': 'mae', 'optimizer': 'adam', 'graph_mode': 'off', 'use_snp_selection': True, 'num_snps': 55793}. Best is trial 69 with value: 0.3133309376882862.
[I 2025-12-05 16:06:28,556] Trial 73 finished with value: 0.31142693113885056 and parameters: {'model_type': 'mlp', 'hidden_dims': '[512, 128]', 'dropout': 0.4424705996586582, 'batch_norm': False, 'lr': 8.394806181673557e-06, 'weight_decay': 0.0001252723966712689, 'epochs': 253, 'loss': 'mae', 'optimizer': 'adam', 'graph_mode': 'off', 'use_snp_selection': True, 'num_snps': 52344}. Best is trial 69 with value: 0.3133309376882862.
[I 2025-12-05 16:06:58,516] Trial 74 finished with value: 0.2947220351734921 and parameters: {'model_type': 'mlp', 'hidden_dims': '[512, 128]', 'dropout': 0.47321871410963307, 'batch_norm': False, 'lr': 1.4444546216447777e-05, 'weight_decay': 0.00044547260830773733, 'epochs': 275, 'loss': 'mae', 'optimizer': 'adam', 'graph_mode': 'off', 'use_snp_selection': True, 'num_snps': 8357}. Best is trial 69 with value: 0.3133309376882862.
[I 2025-12-05 16:08:16,911] Trial 75 finished with value: 0.31126457154786846 and parameters: {'model_type': 'mlp', 'hidden_dims': '[512, 128]', 'dropout': 0.4185422356349301, 'batch_norm': False, 'lr': 7.403657214875426e-06, 'weight_decay': 7.683594102032172e-05, 'epochs': 311, 'loss': 'mae', 'optimizer': 'adam', 'graph_mode': 'off', 'use_snp_selection': True, 'num_snps': 49652}. Best is trial 69 with value: 0.3133309376882862.
[I 2025-12-05 16:09:07,527] Trial 76 finished with value: 0.3069254455892753 and parameters: {'model_type': 'mlp', 'hidden_dims': '[512, 128]', 'dropout': 0.4624957916605081, 'batch_norm': False, 'lr': 1.13045252491176e-05, 'weight_decay': 0.00032177435542975056, 'epochs': 261, 'loss': 'mae', 'optimizer': 'adam', 'graph_mode': 'off', 'use_snp_selection': False}. Best is trial 69 with value: 0.3133309376882862.
[I 2025-12-05 16:10:28,033] Trial 77 finished with value: 0.3086991914241023 and parameters: {'model_type': 'mlp', 'hidden_dims': '[512, 128]', 'dropout': 0.5177265284418147, 'batch_norm': True, 'lr': 5.739538025580319e-06, 'weight_decay': 9.921589540937838e-05, 'epochs': 284, 'loss': 'mae', 'optimizer': 'adam', 'graph_mode': 'off', 'use_snp_selection': True, 'num_snps': 55138}. Best is trial 69 with value: 0.3133309376882862.
[I 2025-12-05 16:11:10,100] Trial 78 finished with value: 0.30057473817348435 and parameters: {'model_type': 'mlp', 'hidden_dims': '[512, 128]', 'dropout': 0.3719915064061128, 'batch_norm': False, 'lr': 3.2407345820129766e-06, 'weight_decay': 0.00020858949582978713, 'epochs': 238, 'loss': 'mae', 'optimizer': 'adam', 'graph_mode': 'off', 'use_snp_selection': True, 'num_snps': 22132}. Best is trial 69 with value: 0.3133309376882862.
[I 2025-12-05 16:11:49,149] Trial 79 finished with value: 0.3052847904283087 and parameters: {'model_type': 'mlp', 'hidden_dims': '[128, 64]', 'dropout': 0.4797856151691908, 'batch_norm': False, 'lr': 9.995155589821014e-06, 'weight_decay': 0.00013660475128899046, 'epochs': 214, 'loss': 'mae', 'optimizer': 'adam', 'graph_mode': 'off', 'use_snp_selection': True, 'num_snps': 40415}. Best is trial 69 with value: 0.3133309376882862.
[I 2025-12-05 16:12:45,964] Trial 80 finished with value: 0.3000394042299318 and parameters: {'model_type': 'mlp', 'hidden_dims': '[256, 128, 64]', 'dropout': 0.4532863031441869, 'batch_norm': False, 'lr': 2.3978725466777624e-05, 'weight_decay': 0.0006495519381001628, 'epochs': 296, 'loss': 'mse', 'optimizer': 'adam', 'graph_mode': 'off', 'use_snp_selection': True, 'num_snps': 51031}. Best is trial 69 with value: 0.3133309376882862.
[I 2025-12-05 16:14:06,628] Trial 81 finished with value: 0.3134854573083974 and parameters: {'model_type': 'mlp', 'hidden_dims': '[512, 64]', 'dropout': 0.4032012526032946, 'batch_norm': False, 'lr': 4.006065012992621e-06, 'weight_decay': 0.0001488539622646765, 'epochs': 306, 'loss': 'mae', 'optimizer': 'adam', 'graph_mode': 'off', 'use_snp_selection': True, 'num_snps': 52326}. Best is trial 81 with value: 0.3134854573083974.
[I 2025-12-05 16:15:34,660] Trial 82 finished with value: 0.3092322922894104 and parameters: {'model_type': 'mlp', 'hidden_dims': '[512, 256]', 'dropout': 0.41899985636657244, 'batch_norm': False, 'lr': 5.586973060808938e-06, 'weight_decay': 0.0002755939001646974, 'epochs': 317, 'loss': 'mae', 'optimizer': 'adam', 'graph_mode': 'off', 'use_snp_selection': True, 'num_snps': 57365}. Best is trial 81 with value: 0.3134854573083974.
[I 2025-12-05 16:16:50,036] Trial 83 finished with value: 0.3020193822305853 and parameters: {'model_type': 'mlp', 'hidden_dims': '[512, 64]', 'dropout': 0.401592720797214, 'batch_norm': False, 'lr': 2.208615669664387e-06, 'weight_decay': 0.00019781265203692143, 'epochs': 271, 'loss': 'mae', 'optimizer': 'adam', 'graph_mode': 'off', 'use_snp_selection': True, 'num_snps': 51989}. Best is trial 81 with value: 0.3134854573083974.
[I 2025-12-05 16:18:08,250] Trial 84 finished with value: 0.310906037407535 and parameters: {'model_type': 'mlp', 'hidden_dims': '[512, 64]', 'dropout': 0.4895461982682139, 'batch_norm': False, 'lr': 7.826922060273895e-06, 'weight_decay': 0.00013407781533741528, 'epochs': 331, 'loss': 'mae', 'optimizer': 'adam', 'graph_mode': 'off', 'use_snp_selection': True, 'num_snps': 47587}. Best is trial 81 with value: 0.3134854573083974.
[I 2025-12-05 16:19:19,833] Trial 85 finished with value: 0.3101105687528111 and parameters: {'model_type': 'mlp', 'hidden_dims': '[512, 128]', 'dropout': 0.4352630900729477, 'batch_norm': False, 'lr': 1.2739690554391914e-05, 'weight_decay': 0.0004004315220902291, 'epochs': 305, 'loss': 'mae', 'optimizer': 'adam', 'graph_mode': 'off', 'use_snp_selection': True, 'num_snps': 44691}. Best is trial 81 with value: 0.3134854573083974.
[I 2025-12-05 16:20:15,788] Trial 86 finished with value: 0.3091773831820259 and parameters: {'model_type': 'mlp', 'hidden_dims': '[512, 64]', 'dropout': 0.3755260443269661, 'batch_norm': False, 'lr': 3.1031237146925873e-06, 'weight_decay': 9.599569972603446e-05, 'epochs': 292, 'loss': 'mae', 'optimizer': 'adam', 'graph_mode': 'off', 'use_snp_selection': False}. Best is trial 81 with value: 0.3134854573083974.
[I 2025-12-05 16:21:16,478] Trial 87 finished with value: 0.30898636782652156 and parameters: {'model_type': 'mlp', 'hidden_dims': '[256, 128]', 'dropout': 0.35190535211567153, 'batch_norm': False, 'lr': 6.374565126442838e-06, 'weight_decay': 0.0002733757480458514, 'epochs': 323, 'loss': 'mae', 'optimizer': 'adam', 'graph_mode': 'off', 'use_snp_selection': True, 'num_snps': 54385}. Best is trial 81 with value: 0.3134854573083974.
[I 2025-12-05 16:22:31,248] Trial 88 finished with value: 0.30231901891082896 and parameters: {'model_type': 'mlp', 'hidden_dims': '[512, 64]', 'dropout': 0.5662838734257122, 'batch_norm': True, 'lr': 3.949392969376431e-06, 'weight_decay': 5.5228581527853473e-05, 'epochs': 283, 'loss': 'mae', 'optimizer': 'adam', 'graph_mode': 'off', 'use_snp_selection': True, 'num_snps': 49755}. Best is trial 81 with value: 0.3134854573083974.
[I 2025-12-05 16:23:59,060] Trial 89 finished with value: 0.310862205464557 and parameters: {'model_type': 'mlp', 'hidden_dims': '[512, 64]', 'dropout': 0.5090530535689348, 'batch_norm': False, 'lr': 4.96064793865592e-06, 'weight_decay': 0.00014667433658559697, 'epochs': 313, 'loss': 'mae', 'optimizer': 'adam', 'graph_mode': 'off', 'use_snp_selection': True, 'num_snps': 58146}. Best is trial 81 with value: 0.3134854573083974.
[I 2025-12-05 16:25:11,320] Trial 90 finished with value: 0.3042564093645136 and parameters: {'model_type': 'mlp', 'hidden_dims': '[512, 128]', 'dropout': 0.3939970456196898, 'batch_norm': False, 'lr': 1.6037838105887488e-06, 'weight_decay': 0.00011529203475544202, 'epochs': 336, 'loss': 'mae', 'optimizer': 'adam', 'graph_mode': 'off', 'use_snp_selection': True, 'num_snps': 41885}. Best is trial 81 with value: 0.3134854573083974.
[I 2025-12-05 16:26:31,372] Trial 91 finished with value: 0.3090777032061517 and parameters: {'model_type': 'mlp', 'hidden_dims': '[512, 64]', 'dropout': 0.4463050362646761, 'batch_norm': False, 'lr': 7.247049658178839e-06, 'weight_decay': 0.0001806013052668676, 'epochs': 300, 'loss': 'mae', 'optimizer': 'adam', 'graph_mode': 'off', 'use_snp_selection': True, 'num_snps': 52627}. Best is trial 81 with value: 0.3134854573083974.
[I 2025-12-05 16:27:53,056] Trial 92 finished with value: 0.31065657129419055 and parameters: {'model_type': 'mlp', 'hidden_dims': '[512, 64]', 'dropout': 0.4216123958699789, 'batch_norm': False, 'lr': 4.302655675950503e-06, 'weight_decay': 7.776329035134425e-05, 'epochs': 306, 'loss': 'mae', 'optimizer': 'adam', 'graph_mode': 'off', 'use_snp_selection': True, 'num_snps': 53692}. Best is trial 81 with value: 0.3134854573083974.
[I 2025-12-05 16:28:49,732] Trial 93 finished with value: 0.3061538231507184 and parameters: {'model_type': 'mlp', 'hidden_dims': '[512, 64]', 'dropout': 0.31167578344842606, 'batch_norm': False, 'lr': 3.929278742604792e-06, 'weight_decay': 0.00016110530679530255, 'epochs': 154, 'loss': 'mae', 'optimizer': 'adam', 'graph_mode': 'off', 'use_snp_selection': True, 'num_snps': 49792}. Best is trial 81 with value: 0.3134854573083974.
[I 2025-12-05 16:30:12,365] Trial 94 finished with value: 0.30662039700295357 and parameters: {'model_type': 'mlp', 'hidden_dims': '[512, 64]', 'dropout': 0.15448393156314713, 'batch_norm': False, 'lr': 9.880877976007379e-06, 'weight_decay': 0.0003018652522918534, 'epochs': 329, 'loss': 'mae', 'optimizer': 'adam', 'graph_mode': 'off', 'use_snp_selection': True, 'num_snps': 51278}. Best is trial 81 with value: 0.3134854573083974.
[I 2025-12-05 16:31:24,985] Trial 95 finished with value: 0.3089105154410121 and parameters: {'model_type': 'mlp', 'hidden_dims': '[512, 64]', 'dropout': 0.33173808100991703, 'batch_norm': False, 'lr': 3.078456448888273e-06, 'weight_decay': 9.808362226040555e-05, 'epochs': 291, 'loss': 'mae', 'optimizer': 'adam', 'graph_mode': 'off', 'use_snp_selection': True, 'num_snps': 46781}. Best is trial 81 with value: 0.3134854573083974.
[I 2025-12-05 16:32:51,024] Trial 96 finished with value: 0.30821705106167363 and parameters: {'model_type': 'mlp', 'hidden_dims': '[512, 64]', 'dropout': 0.19433363189255942, 'batch_norm': False, 'lr': 1.7359774497982462e-05, 'weight_decay': 0.00019170081864858167, 'epochs': 318, 'loss': 'mae', 'optimizer': 'adam', 'graph_mode': 'off', 'use_snp_selection': True, 'num_snps': 55553}. Best is trial 81 with value: 0.3134854573083974.
[I 2025-12-05 16:34:18,520] Trial 97 finished with value: 0.3095242722830439 and parameters: {'model_type': 'mlp', 'hidden_dims': '[512, 64]', 'dropout': 0.5289575906551864, 'batch_norm': False, 'lr': 5.473318087085058e-06, 'weight_decay': 0.0002384878195222951, 'epochs': 344, 'loss': 'mse', 'optimizer': 'adam', 'graph_mode': 'off', 'use_snp_selection': True, 'num_snps': 53754}. Best is trial 81 with value: 0.3134854573083974.
[I 2025-12-05 16:34:38,752] Trial 98 finished with value: 0.30663829885679367 and parameters: {'model_type': 'mlp', 'hidden_dims': '[128, 64]', 'dropout': 0.17969966898712855, 'batch_norm': False, 'lr': 3.82157281483341e-06, 'weight_decay': 9.406218077331198e-07, 'epochs': 307, 'loss': 'mae', 'optimizer': 'adam', 'graph_mode': 'off', 'use_snp_selection': False}. Best is trial 81 with value: 0.3134854573083974.
[I 2025-12-05 16:35:31,744] Trial 99 finished with value: 0.2967140617561878 and parameters: {'model_type': 'mlp', 'hidden_dims': '[256, 128, 64]', 'dropout': 0.21454109457699283, 'batch_norm': False, 'lr': 2.210544861705914e-06, 'weight_decay': 0.0005556766787509672, 'epochs': 269, 'loss': 'mae', 'optimizer': 'adam', 'graph_mode': 'off', 'use_snp_selection': True, 'num_snps': 48304}. Best is trial 81 with value: 0.3134854573083974.
[I 2025-12-05 16:36:54,984] Trial 100 finished with value: 0.2847384483487042 and parameters: {'model_type': 'mlp', 'hidden_dims': '[512, 256]', 'dropout': 0.2901025378574088, 'batch_norm': True, 'lr': 2.7360604817120486e-06, 'weight_decay': 0.0007955671311687918, 'epochs': 325, 'loss': 'mae', 'optimizer': 'adam', 'graph_mode': 'off', 'use_snp_selection': True, 'num_snps': 51726}. Best is trial 81 with value: 0.3134854573083974.
