[I 2025-12-05 15:32:21,145] Trial 72 finished with value: 0.06992331764977518 and parameters: {'model_type': 'mlp', 'hidden_dims': '[256, 128, 64]', 'dropout': 0.16154762073624185, 'batch_norm': True, 'lr': 6.391867053129784e-05, 'weight_decay': 1.2681293219211694e-05, 'epochs': 58, 'loss': 'mae', 'optimizer': 'adam', 'graph_mode': 'off', 'use_snp_selection': False}. Best is trial 54 with value: 0.11315491601227236.
[I 2025-12-05 15:32:22,071] Trial 73 finished with value: 0.09171434988315037 and parameters: {'model_type': 'mlp', 'hidden_dims': '[256, 128, 64]', 'dropout': 0.14472295789643136, 'batch_norm': True, 'lr': 0.00011352188841507976, 'weight_decay': 3.1506354229574334e-06, 'epochs': 91, 'loss': 'mae', 'optimizer': 'adam', 'graph_mode': 'off', 'use_snp_selection': False}. Best is trial 54 with value: 0.11315491601227236.
[I 2025-12-05 15:32:22,869] Trial 74 finished with value: 0.06919748565806459 and parameters: {'model_type': 'mlp', 'hidden_dims': '[256, 128, 64]', 'dropout': 0.2032527390527233, 'batch_norm': True, 'lr': 9.594910943864756e-05, 'weight_decay': 2.99992328547713e-07, 'epochs': 45, 'loss': 'mae', 'optimizer': 'adam', 'graph_mode': 'off', 'use_snp_selection': False}. Best is trial 54 with value: 0.11315491601227236.
[I 2025-12-05 15:32:23,749] Trial 75 finished with value: 0.04925886290886058 and parameters: {'model_type': 'mlp', 'hidden_dims': '[256, 128, 64]', 'dropout': 0.18623595736528847, 'batch_norm': True, 'lr': 4.2220752399122185e-05, 'weight_decay': 5.669406621890533e-06, 'epochs': 73, 'loss': 'mae', 'optimizer': 'adam', 'graph_mode': 'off', 'use_snp_selection': False}. Best is trial 54 with value: 0.11315491601227236.
[I 2025-12-05 15:32:24,587] Trial 76 finished with value: 0.029424711725767192 and parameters: {'model_type': 'mlp', 'hidden_dims': '[256, 128, 64]', 'dropout': 0.2819118965900608, 'batch_norm': True, 'lr': 0.00012366337228257438, 'weight_decay': 1.1297897195802514e-05, 'epochs': 40, 'loss': 'mse', 'optimizer': 'adam', 'graph_mode': 'off', 'use_snp_selection': True, 'num_snps': 3325}. Best is trial 54 with value: 0.11315491601227236.
[I 2025-12-05 15:32:25,408] Trial 77 finished with value: 0.07042872338512451 and parameters: {'model_type': 'mlp', 'hidden_dims': '[256, 128, 64]', 'dropout': 0.12963177422803387, 'batch_norm': True, 'lr': 0.0004890442799158434, 'weight_decay': 1.4857737232715256e-05, 'epochs': 55, 'loss': 'mae', 'optimizer': 'adam', 'graph_mode': 'off', 'use_snp_selection': False}. Best is trial 54 with value: 0.11315491601227236.
[I 2025-12-05 15:32:27,305] Trial 78 finished with value: 0.07842837938220436 and parameters: {'model_type': 'mlp', 'hidden_dims': '[512, 256]', 'dropout': 0.16887409637317632, 'batch_norm': True, 'lr': 0.0007219341482317221, 'weight_decay': 2.2393515571180757e-05, 'epochs': 201, 'loss': 'mae', 'optimizer': 'adam', 'graph_mode': 'off', 'use_snp_selection': False}. Best is trial 54 with value: 0.11315491601227236.
[I 2025-12-05 15:32:28,622] Trial 79 finished with value: 0.04914250120476843 and parameters: {'model_type': 'mlp', 'hidden_dims': '[512, 64]', 'dropout': 0.15342286904993985, 'batch_norm': True, 'lr': 0.00023557080627988018, 'weight_decay': 3.403497087950365e-05, 'epochs': 94, 'loss': 'mae', 'optimizer': 'adam', 'graph_mode': 'off', 'use_snp_selection': False}. Best is trial 54 with value: 0.11315491601227236.
[I 2025-12-05 15:32:29,499] Trial 80 finished with value: 0.058787639434283306 and parameters: {'model_type': 'mlp', 'hidden_dims': '[256, 128, 64]', 'dropout': 0.11395399864611991, 'batch_norm': False, 'lr': 0.00034850348708190314, 'weight_decay': 4.914546426332756e-05, 'epochs': 86, 'loss': 'mse', 'optimizer': 'adam', 'graph_mode': 'off', 'use_snp_selection': False}. Best is trial 54 with value: 0.11315491601227236.
[I 2025-12-05 15:32:30,897] Trial 81 finished with value: 0.09263406381029554 and parameters: {'model_type': 'mlp', 'hidden_dims': '[512, 128]', 'dropout': 0.12479978591296022, 'batch_norm': True, 'lr': 0.0001965502593093472, 'weight_decay': 1.5659374223796684e-07, 'epochs': 114, 'loss': 'mae', 'optimizer': 'adam', 'graph_mode': 'off', 'use_snp_selection': False}. Best is trial 54 with value: 0.11315491601227236.
[I 2025-12-05 15:32:32,354] Trial 82 finished with value: 0.09529676980929588 and parameters: {'model_type': 'mlp', 'hidden_dims': '[512, 128]', 'dropout': 0.12986258343074258, 'batch_norm': True, 'lr': 0.0001565908328688942, 'weight_decay': 1.0157712132708005e-07, 'epochs': 120, 'loss': 'mae', 'optimizer': 'adam', 'graph_mode': 'off', 'use_snp_selection': False}. Best is trial 54 with value: 0.11315491601227236.
[I 2025-12-05 15:32:33,820] Trial 83 finished with value: 0.08960985240592037 and parameters: {'model_type': 'mlp', 'hidden_dims': '[512, 128]', 'dropout': 0.14990688768023033, 'batch_norm': True, 'lr': 0.00015160598513490125, 'weight_decay': 1.2092915401383762e-07, 'epochs': 118, 'loss': 'mae', 'optimizer': 'adam', 'graph_mode': 'off', 'use_snp_selection': False}. Best is trial 54 with value: 0.11315491601227236.
[I 2025-12-05 15:32:35,234] Trial 84 finished with value: 0.06405629813274366 and parameters: {'model_type': 'mlp', 'hidden_dims': '[512, 128]', 'dropout': 0.12915776649034266, 'batch_norm': True, 'lr': 0.00018105476892700106, 'weight_decay': 2.7338351048555884e-07, 'epochs': 108, 'loss': 'mae', 'optimizer': 'adam', 'graph_mode': 'off', 'use_snp_selection': False}. Best is trial 54 with value: 0.11315491601227236.
[I 2025-12-05 15:32:36,317] Trial 85 finished with value: 0.05075686740471921 and parameters: {'model_type': 'mlp', 'hidden_dims': '[256, 128]', 'dropout': 0.4214633908769001, 'batch_norm': True, 'lr': 6.947796504311778e-05, 'weight_decay': 1.6811157349209253e-07, 'epochs': 146, 'loss': 'mae', 'optimizer': 'adam', 'graph_mode': 'off', 'use_snp_selection': False}. Best is trial 54 with value: 0.11315491601227236.
[I 2025-12-05 15:32:37,851] Trial 86 finished with value: 0.0812911094960913 and parameters: {'model_type': 'mlp', 'hidden_dims': '[512, 128]', 'dropout': 0.13807767696145884, 'batch_norm': True, 'lr': 0.0001332221694403572, 'weight_decay': 5.456056974253127e-07, 'epochs': 132, 'loss': 'mae', 'optimizer': 'adam', 'graph_mode': 'off', 'use_snp_selection': False}. Best is trial 54 with value: 0.11315491601227236.
[I 2025-12-05 15:32:39,303] Trial 87 finished with value: 0.050359051888676974 and parameters: {'model_type': 'mlp', 'hidden_dims': '[512, 256]', 'dropout': 0.49366927730510624, 'batch_norm': True, 'lr': 9.490617710886524e-05, 'weight_decay': 1.4362658911593772e-07, 'epochs': 114, 'loss': 'mae', 'optimizer': 'adam', 'graph_mode': 'off', 'use_snp_selection': False}. Best is trial 54 with value: 0.11315491601227236.
[I 2025-12-05 15:32:41,561] Trial 88 finished with value: 0.067136333548984 and parameters: {'model_type': 'mlp', 'hidden_dims': '[128, 64]', 'dropout': 0.1651741885039174, 'batch_norm': True, 'lr': 5.0369120496617694e-05, 'weight_decay': 4.077561712909856e-07, 'epochs': 100, 'loss': 'mae', 'optimizer': 'adam', 'graph_mode': 'off', 'use_snp_selection': True, 'num_snps': 48766}. Best is trial 54 with value: 0.11315491601227236.
[I 2025-12-05 15:32:42,805] Trial 89 finished with value: 0.05447300553135288 and parameters: {'model_type': 'mlp', 'hidden_dims': '[512, 128]', 'dropout': 0.18185008649699566, 'batch_norm': True, 'lr': 7.70711192280856e-05, 'weight_decay': 2.1589096186479563e-07, 'epochs': 78, 'loss': 'mse', 'optimizer': 'adam', 'graph_mode': 'off', 'use_snp_selection': False}. Best is trial 54 with value: 0.11315491601227236.
[I 2025-12-05 15:32:43,868] Trial 90 finished with value: 0.08742976159628722 and parameters: {'model_type': 'mlp', 'hidden_dims': '[256, 128, 64]', 'dropout': 0.12225877793807947, 'batch_norm': True, 'lr': 0.0002087250084088948, 'weight_decay': 1.5883413832484844e-07, 'epochs': 150, 'loss': 'mae', 'optimizer': 'adam', 'graph_mode': 'off', 'use_snp_selection': False}. Best is trial 54 with value: 0.11315491601227236.
[I 2025-12-05 15:32:45,604] Trial 91 finished with value: 0.08398812082475574 and parameters: {'model_type': 'mlp', 'hidden_dims': '[512, 128]', 'dropout': 0.10826627206768351, 'batch_norm': True, 'lr': 0.00040576449745523724, 'weight_decay': 2.528449602328972e-07, 'epochs': 173, 'loss': 'mae', 'optimizer': 'adam', 'graph_mode': 'off', 'use_snp_selection': False}. Best is trial 54 with value: 0.11315491601227236.
[I 2025-12-05 15:32:46,778] Trial 92 finished with value: 0.08926547741769889 and parameters: {'model_type': 'mlp', 'hidden_dims': '[512, 128]', 'dropout': 0.14761599594768646, 'batch_norm': True, 'lr': 0.00029583411313137696, 'weight_decay': 1.3210901000568247e-07, 'epochs': 63, 'loss': 'mae', 'optimizer': 'adam', 'graph_mode': 'off', 'use_snp_selection': False}. Best is trial 54 with value: 0.11315491601227236.
[I 2025-12-05 15:32:48,298] Trial 93 finished with value: 0.05679012027265459 and parameters: {'model_type': 'mlp', 'hidden_dims': '[512, 128]', 'dropout': 0.1253578423271119, 'batch_norm': True, 'lr': 2.637402777958862e-05, 'weight_decay': 8.644991753376155e-07, 'epochs': 124, 'loss': 'mae', 'optimizer': 'adam', 'graph_mode': 'off', 'use_snp_selection': False}. Best is trial 54 with value: 0.11315491601227236.
[I 2025-12-05 15:32:49,673] Trial 94 finished with value: 0.09430275016873213 and parameters: {'model_type': 'mlp', 'hidden_dims': '[512, 128]', 'dropout': 0.1094703283561812, 'batch_norm': True, 'lr': 0.00023466372605160176, 'weight_decay': 8.560894628071254e-06, 'epochs': 99, 'loss': 'mae', 'optimizer': 'adam', 'graph_mode': 'off', 'use_snp_selection': False}. Best is trial 54 with value: 0.11315491601227236.
[I 2025-12-05 15:32:51,003] Trial 95 finished with value: 0.08646910663887158 and parameters: {'model_type': 'mlp', 'hidden_dims': '[512, 128]', 'dropout': 0.11008338784735776, 'batch_norm': True, 'lr': 0.00015837460882503867, 'weight_decay': 7.96957759608094e-06, 'epochs': 93, 'loss': 'mae', 'optimizer': 'adam', 'graph_mode': 'off', 'use_snp_selection': False}. Best is trial 54 with value: 0.11315491601227236.
[I 2025-12-05 15:32:52,380] Trial 96 finished with value: 0.08919133350523939 and parameters: {'model_type': 'mlp', 'hidden_dims': '[512, 256]', 'dropout': 0.13623539177890823, 'batch_norm': True, 'lr': 0.0002202812884953292, 'weight_decay': 1.076488648882428e-07, 'epochs': 101, 'loss': 'mae', 'optimizer': 'adam', 'graph_mode': 'off', 'use_snp_selection': False}. Best is trial 54 with value: 0.11315491601227236.
[I 2025-12-05 15:32:53,625] Trial 97 finished with value: 0.08150602493343287 and parameters: {'model_type': 'mlp', 'hidden_dims': '[512, 128]', 'dropout': 0.19714440912865455, 'batch_norm': True, 'lr': 0.0005985065621893014, 'weight_decay': 2.002627574106814e-05, 'epochs': 78, 'loss': 'mae', 'optimizer': 'adam', 'graph_mode': 'off', 'use_snp_selection': False}. Best is trial 54 with value: 0.11315491601227236.
[I 2025-12-05 15:32:54,866] Trial 98 finished with value: 0.06083965612711449 and parameters: {'model_type': 'mlp', 'hidden_dims': '[512, 128]', 'dropout': 0.35512399171040904, 'batch_norm': False, 'lr': 3.687988856455168e-05, 'weight_decay': 9.930974359874581e-06, 'epochs': 85, 'loss': 'mae', 'optimizer': 'adam', 'graph_mode': 'off', 'use_snp_selection': False}. Best is trial 54 with value: 0.11315491601227236.
[I 2025-12-05 15:32:55,997] Trial 99 finished with value: -0.009001291955390674 and parameters: {'model_type': 'mlp', 'hidden_dims': '[512, 64]', 'dropout': 0.15956908175060974, 'batch_norm': True, 'lr': 2.3294687156157485e-06, 'weight_decay': 2.614150931322767e-05, 'epochs': 66, 'loss': 'mse', 'optimizer': 'adam', 'graph_mode': 'off', 'use_snp_selection': False}. Best is trial 54 with value: 0.11315491601227236.
[I 2025-12-05 15:32:57,042] Trial 100 finished with value: 0.06487478804202827 and parameters: {'model_type': 'mlp', 'hidden_dims': '[512, 256]', 'dropout': 0.11928441542386578, 'batch_norm': True, 'lr': 0.00026933288471943606, 'weight_decay': 4.660913518918216e-06, 'epochs': 49, 'loss': 'mae', 'optimizer': 'adam', 'graph_mode': 'off', 'use_snp_selection': False}. Best is trial 54 with value: 0.11315491601227236.
[I 2025-12-05 15:32:59,625] Trial 101 finished with value: 0.08213747435262655 and parameters: {'model_type': 'mlp', 'hidden_dims': '[512, 128]', 'dropout': 0.10133479544937098, 'batch_norm': True, 'lr': 0.00045206040039710876, 'weight_decay': 2.9399261233118153e-06, 'epochs': 322, 'loss': 'mae', 'optimizer': 'adam', 'graph_mode': 'off', 'use_snp_selection': False}. Best is trial 54 with value: 0.11315491601227236.
[I 2025-12-05 15:33:01,187] Trial 102 finished with value: 0.0648372605662984 and parameters: {'model_type': 'mlp', 'hidden_dims': '[512, 128]', 'dropout': 0.12949620525143174, 'batch_norm': True, 'lr': 0.0001842133614293638, 'weight_decay': 1.4585378882093055e-06, 'epochs': 131, 'loss': 'mae', 'optimizer': 'adam', 'graph_mode': 'off', 'use_snp_selection': False}. Best is trial 54 with value: 0.11315491601227236.
[I 2025-12-05 15:33:02,407] Trial 103 finished with value: 0.07332828786004643 and parameters: {'model_type': 'mlp', 'hidden_dims': '[512, 128]', 'dropout': 0.10901370733943871, 'batch_norm': True, 'lr': 0.00031769767466955344, 'weight_decay': 2.0487705216137278e-06, 'epochs': 73, 'loss': 'mae', 'optimizer': 'adam', 'graph_mode': 'off', 'use_snp_selection': False}. Best is trial 54 with value: 0.11315491601227236.
[I 2025-12-05 15:33:04,292] Trial 104 finished with value: 0.08145710082716952 and parameters: {'model_type': 'mlp', 'hidden_dims': '[512, 128]', 'dropout': 0.15160531174510283, 'batch_norm': True, 'lr': 0.0002553691278563689, 'weight_decay': 1.391446132814643e-05, 'epochs': 190, 'loss': 'mae', 'optimizer': 'adam', 'graph_mode': 'off', 'use_snp_selection': False}. Best is trial 54 with value: 0.11315491601227236.
[I 2025-12-05 15:33:05,803] Trial 105 finished with value: 0.053523339585701504 and parameters: {'model_type': 'mlp', 'hidden_dims': '[512, 128]', 'dropout': 0.13856048606820834, 'batch_norm': True, 'lr': 1.3355851180271997e-05, 'weight_decay': 4.3028360229641564e-07, 'epochs': 124, 'loss': 'mae', 'optimizer': 'adam', 'graph_mode': 'off', 'use_snp_selection': False}. Best is trial 54 with value: 0.11315491601227236.
[I 2025-12-05 15:33:08,459] Trial 106 finished with value: 0.08442904995390975 and parameters: {'model_type': 'mlp', 'hidden_dims': '[512, 256]', 'dropout': 0.11702786294101532, 'batch_norm': True, 'lr': 0.0005320163069784646, 'weight_decay': 6.014399165552963e-06, 'epochs': 329, 'loss': 'mae', 'optimizer': 'adam', 'graph_mode': 'off', 'use_snp_selection': False}. Best is trial 54 with value: 0.11315491601227236.
[I 2025-12-05 15:33:10,440] Trial 107 finished with value: 0.08976445247242604 and parameters: {'model_type': 'mlp', 'hidden_dims': '[256, 128, 64]', 'dropout': 0.17771356420246587, 'batch_norm': True, 'lr': 0.00012264197947475198, 'weight_decay': 3.832660960013802e-06, 'epochs': 108, 'loss': 'mae', 'optimizer': 'adam', 'graph_mode': 'off', 'use_snp_selection': True, 'num_snps': 37972}. Best is trial 54 with value: 0.11315491601227236.
[I 2025-12-05 15:33:11,543] Trial 108 finished with value: 0.08051468224570485 and parameters: {'model_type': 'mlp', 'hidden_dims': '[512, 128]', 'dropout': 0.146075435028982, 'batch_norm': True, 'lr': 0.0009661243662410611, 'weight_decay': 1.0609819764861282e-06, 'epochs': 55, 'loss': 'mae', 'optimizer': 'adam', 'graph_mode': 'off', 'use_snp_selection': False}. Best is trial 54 with value: 0.11315491601227236.
[I 2025-12-05 15:33:12,456] Trial 109 finished with value: 0.07193907616084992 and parameters: {'model_type': 'mlp', 'hidden_dims': '[128, 64]', 'dropout': 0.16589950419837224, 'batch_norm': True, 'lr': 0.000817760852744681, 'weight_decay': 1.6099657361249323e-05, 'epochs': 220, 'loss': 'mse', 'optimizer': 'adam', 'graph_mode': 'off', 'use_snp_selection': False}. Best is trial 54 with value: 0.11315491601227236.
[I 2025-12-05 15:33:13,386] Trial 110 finished with value: 0.08029884601765705 and parameters: {'model_type': 'mlp', 'hidden_dims': '[256, 128]', 'dropout': 0.10055742912899425, 'batch_norm': True, 'lr': 0.00015018137989669222, 'weight_decay': 2.4287719228204687e-06, 'epochs': 90, 'loss': 'mae', 'optimizer': 'adam', 'graph_mode': 'off', 'use_snp_selection': False}. Best is trial 54 with value: 0.11315491601227236.
[I 2025-12-05 15:33:16,173] Trial 111 finished with value: 0.07860769611611125 and parameters: {'model_type': 'mlp', 'hidden_dims': '[512, 128]', 'dropout': 0.12409117849969732, 'batch_norm': True, 'lr': 0.00019886537070947058, 'weight_decay': 1.1493439921215233e-05, 'epochs': 349, 'loss': 'mae', 'optimizer': 'adam', 'graph_mode': 'off', 'use_snp_selection': False}. Best is trial 54 with value: 0.11315491601227236.
[I 2025-12-05 15:33:18,873] Trial 112 finished with value: 0.09496002346446387 and parameters: {'model_type': 'mlp', 'hidden_dims': '[512, 128]', 'dropout': 0.10969285292824907, 'batch_norm': True, 'lr': 0.0001027851862293837, 'weight_decay': 2.030072509946885e-05, 'epochs': 334, 'loss': 'mae', 'optimizer': 'adam', 'graph_mode': 'off', 'use_snp_selection': False}. Best is trial 54 with value: 0.11315491601227236.
[I 2025-12-05 15:33:21,370] Trial 113 finished with value: 0.0819877615505746 and parameters: {'model_type': 'mlp', 'hidden_dims': '[512, 128]', 'dropout': 0.13475997242136728, 'batch_norm': True, 'lr': 0.00010476052042964687, 'weight_decay': 2.0364140521156773e-05, 'epochs': 305, 'loss': 'mae', 'optimizer': 'adam', 'graph_mode': 'off', 'use_snp_selection': False}. Best is trial 54 with value: 0.11315491601227236.
[I 2025-12-05 15:33:23,941] Trial 114 finished with value: 0.06953136433016273 and parameters: {'model_type': 'mlp', 'hidden_dims': '[512, 128]', 'dropout': 0.11261751363478677, 'batch_norm': True, 'lr': 9.51967322390235e-05, 'weight_decay': 3.275075410741313e-05, 'epochs': 319, 'loss': 'mae', 'optimizer': 'adam', 'graph_mode': 'off', 'use_snp_selection': False}. Best is trial 54 with value: 0.11315491601227236.
[I 2025-12-05 15:33:25,292] Trial 115 finished with value: 0.08691439042974877 and parameters: {'model_type': 'mlp', 'hidden_dims': '[512, 256]', 'dropout': 0.12179739925169641, 'batch_norm': True, 'lr': 8.492946978652643e-05, 'weight_decay': 4.065089339590086e-05, 'epochs': 103, 'loss': 'mae', 'optimizer': 'adam', 'graph_mode': 'off', 'use_snp_selection': False}. Best is trial 54 with value: 0.11315491601227236.
[I 2025-12-05 15:33:27,991] Trial 116 finished with value: 0.07943594173268137 and parameters: {'model_type': 'mlp', 'hidden_dims': '[512, 128]', 'dropout': 0.14134526433792982, 'batch_norm': True, 'lr': 0.000663929572926171, 'weight_decay': 9.116205675313539e-06, 'epochs': 332, 'loss': 'mae', 'optimizer': 'adam', 'graph_mode': 'off', 'use_snp_selection': False}. Best is trial 54 with value: 0.11315491601227236.
[I 2025-12-05 15:33:29,484] Trial 117 finished with value: 0.0810988844715606 and parameters: {'model_type': 'mlp', 'hidden_dims': '[256, 128, 64]', 'dropout': 0.15476739080298946, 'batch_norm': False, 'lr': 0.00013850790874705317, 'weight_decay': 1.0267980810040617e-07, 'epochs': 294, 'loss': 'mae', 'optimizer': 'adam', 'graph_mode': 'off', 'use_snp_selection': False}. Best is trial 54 with value: 0.11315491601227236.
[I 2025-12-05 15:33:31,793] Trial 118 finished with value: 0.07111130978664536 and parameters: {'model_type': 'mlp', 'hidden_dims': '[512, 128]', 'dropout': 0.1108148168223369, 'batch_norm': True, 'lr': 0.00017251970820186902, 'weight_decay': 2.421589011361767e-05, 'epochs': 267, 'loss': 'mae', 'optimizer': 'adam', 'graph_mode': 'off', 'use_snp_selection': False}. Best is trial 54 with value: 0.11315491601227236.
[I 2025-12-05 15:33:34,510] Trial 119 finished with value: 0.06536435140669657 and parameters: {'model_type': 'mlp', 'hidden_dims': '[512, 256]', 'dropout': 0.13198627089564008, 'batch_norm': True, 'lr': 0.00043256193090629983, 'weight_decay': 7.120449572929337e-06, 'epochs': 344, 'loss': 'mse', 'optimizer': 'adam', 'graph_mode': 'off', 'use_snp_selection': False}. Best is trial 54 with value: 0.11315491601227236.
[I 2025-12-05 15:33:36,667] Trial 120 finished with value: 0.06051489098067347 and parameters: {'model_type': 'mlp', 'hidden_dims': '[512, 128]', 'dropout': 0.10795581358707597, 'batch_norm': True, 'lr': 7.90845463355888e-06, 'weight_decay': 7.176631921869519e-07, 'epochs': 241, 'loss': 'mae', 'optimizer': 'adam', 'graph_mode': 'off', 'use_snp_selection': False}. Best is trial 54 with value: 0.11315491601227236.
[I 2025-12-05 15:33:39,311] Trial 121 finished with value: 0.08692907575914749 and parameters: {'model_type': 'mlp', 'hidden_dims': '[512, 128]', 'dropout': 0.12137523548876564, 'batch_norm': True, 'lr': 0.00035653984060008147, 'weight_decay': 1.7764731301159374e-05, 'epochs': 325, 'loss': 'mae', 'optimizer': 'adam', 'graph_mode': 'off', 'use_snp_selection': False}. Best is trial 54 with value: 0.11315491601227236.
[I 2025-12-05 15:33:42,045] Trial 122 finished with value: 0.08039951396660115 and parameters: {'model_type': 'mlp', 'hidden_dims': '[512, 128]', 'dropout': 0.14409733363821584, 'batch_norm': True, 'lr': 5.808875044188588e-05, 'weight_decay': 1.4611686258074154e-05, 'epochs': 338, 'loss': 'mae', 'optimizer': 'adam', 'graph_mode': 'off', 'use_snp_selection': False}. Best is trial 54 with value: 0.11315491601227236.
[I 2025-12-05 15:33:44,808] Trial 123 finished with value: 0.07832326656897377 and parameters: {'model_type': 'mlp', 'hidden_dims': '[512, 128]', 'dropout': 0.10181498834651935, 'batch_norm': True, 'lr': 0.00011067175300579984, 'weight_decay': 5.267018243449326e-05, 'epochs': 344, 'loss': 'mae', 'optimizer': 'adam', 'graph_mode': 'off', 'use_snp_selection': False}. Best is trial 54 with value: 0.11315491601227236.
