[I 2025-12-06 05:36:03,398] Trial 38 finished with value: 0.303687188637643 and parameters: {'model_type': 'mlp', 'hidden_dims': '[512, 128]', 'dropout': 0.3096992090430488, 'batch_norm': True, 'lr': 0.00015932169225696098, 'weight_decay': 1.4718740952094895e-05, 'epochs': 234, 'loss': 'mse', 'optimizer': 'adam', 'graph_mode': 'off', 'use_snp_selection': True, 'num_snps': 19911}. Best is trial 31 with value: 0.3136372669321699.
[I 2025-12-06 05:36:36,320] Trial 39 finished with value: 0.3050369918736161 and parameters: {'model_type': 'mlp', 'hidden_dims': '[512, 256]', 'dropout': 0.1286920745015838, 'batch_norm': False, 'lr': 4.87968932128582e-05, 'weight_decay': 3.1454796673030104e-05, 'epochs': 159, 'loss': 'mae', 'optimizer': 'adam', 'graph_mode': 'off', 'use_snp_selection': False}. Best is trial 31 with value: 0.3136372669321699.
[I 2025-12-06 05:37:42,706] Trial 40 finished with value: 0.3077858808500445 and parameters: {'model_type': 'mlp', 'hidden_dims': '[512, 64]', 'dropout': 0.41872599347796824, 'batch_norm': True, 'lr': 0.00010299837783030175, 'weight_decay': 1.7316139411097262e-07, 'epochs': 349, 'loss': 'mse', 'optimizer': 'adam', 'graph_mode': 'off', 'use_snp_selection': False}. Best is trial 31 with value: 0.3136372669321699.
[I 2025-12-06 05:38:12,124] Trial 41 finished with value: 0.3105705062992682 and parameters: {'model_type': 'mlp', 'hidden_dims': '[512, 256]', 'dropout': 0.1657908136346095, 'batch_norm': True, 'lr': 8.450977121281036e-05, 'weight_decay': 3.0430633098966544e-07, 'epochs': 137, 'loss': 'mse', 'optimizer': 'adam', 'graph_mode': 'off', 'use_snp_selection': False}. Best is trial 31 with value: 0.3136372669321699.
[I 2025-12-06 05:38:32,721] Trial 42 finished with value: 0.3052843204904932 and parameters: {'model_type': 'mlp', 'hidden_dims': '[512, 256]', 'dropout': 0.20382545450657277, 'batch_norm': True, 'lr': 0.0002203188081565345, 'weight_decay': 1.5146140641341394e-07, 'epochs': 87, 'loss': 'mse', 'optimizer': 'adam', 'graph_mode': 'off', 'use_snp_selection': False}. Best is trial 31 with value: 0.3136372669321699.
[I 2025-12-06 05:39:14,442] Trial 43 finished with value: 0.3066454940781023 and parameters: {'model_type': 'mlp', 'hidden_dims': '[512, 256]', 'dropout': 0.260584060586878, 'batch_norm': True, 'lr': 6.20008220191395e-05, 'weight_decay': 1.0988005173512803e-06, 'epochs': 207, 'loss': 'mse', 'optimizer': 'adam', 'graph_mode': 'off', 'use_snp_selection': False}. Best is trial 31 with value: 0.3136372669321699.
[I 2025-12-06 05:39:45,402] Trial 44 finished with value: 0.3083330750961649 and parameters: {'model_type': 'mlp', 'hidden_dims': '[512, 256]', 'dropout': 0.19439810442300925, 'batch_norm': True, 'lr': 2.6873045963741912e-05, 'weight_decay': 0.00010040081007592979, 'epochs': 146, 'loss': 'mse', 'optimizer': 'adam', 'graph_mode': 'off', 'use_snp_selection': False}. Best is trial 31 with value: 0.3136372669321699.
[I 2025-12-06 05:40:00,592] Trial 45 finished with value: 0.30888134593830446 and parameters: {'model_type': 'mlp', 'hidden_dims': '[256, 128]', 'dropout': 0.1209637568453093, 'batch_norm': True, 'lr': 9.858420492960566e-05, 'weight_decay': 3.5744899383807156e-07, 'epochs': 114, 'loss': 'mse', 'optimizer': 'adam', 'graph_mode': 'off', 'use_snp_selection': False}. Best is trial 31 with value: 0.3136372669321699.
[I 2025-12-06 05:40:43,933] Trial 46 finished with value: 0.30092923579178554 and parameters: {'model_type': 'mlp', 'hidden_dims': '[512, 64]', 'dropout': 0.2115647940237752, 'batch_norm': False, 'lr': 4.4965691834450155e-05, 'weight_decay': 1.0708221000884473e-07, 'epochs': 220, 'loss': 'mae', 'optimizer': 'adam', 'graph_mode': 'off', 'use_snp_selection': False}. Best is trial 31 with value: 0.3136372669321699.
[I 2025-12-06 05:41:21,786] Trial 47 finished with value: 0.30737798036861425 and parameters: {'model_type': 'mlp', 'hidden_dims': '[512, 256]', 'dropout': 0.16216987361420723, 'batch_norm': True, 'lr': 0.0003368406379275874, 'weight_decay': 4.359220944131404e-07, 'epochs': 185, 'loss': 'mse', 'optimizer': 'adam', 'graph_mode': 'off', 'use_snp_selection': False}. Best is trial 31 with value: 0.3136372669321699.
[I 2025-12-06 05:41:52,890] Trial 48 finished with value: 0.3014296580390551 and parameters: {'model_type': 'mlp', 'hidden_dims': '[512, 128]', 'dropout': 0.24243566892127894, 'batch_norm': False, 'lr': 2.006848689371543e-05, 'weight_decay': 1.5135665513770524e-06, 'epochs': 149, 'loss': 'mae', 'optimizer': 'adam', 'graph_mode': 'off', 'use_snp_selection': False}. Best is trial 31 with value: 0.3136372669321699.
[I 2025-12-06 05:42:40,021] Trial 49 finished with value: 0.3071151523146235 and parameters: {'model_type': 'mlp', 'hidden_dims': '[512, 64]', 'dropout': 0.37552058304187724, 'batch_norm': True, 'lr': 0.00017143009952740759, 'weight_decay': 6.816893673459415e-07, 'epochs': 92, 'loss': 'mse', 'optimizer': 'adam', 'graph_mode': 'off', 'use_snp_selection': True, 'num_snps': 46888}. Best is trial 31 with value: 0.3136372669321699.
[I 2025-12-06 05:42:58,767] Trial 50 finished with value: 0.30864376798766224 and parameters: {'model_type': 'mlp', 'hidden_dims': '[128, 64]', 'dropout': 0.2829989429510382, 'batch_norm': False, 'lr': 1.066448292384531e-05, 'weight_decay': 2.33053647668558e-07, 'epochs': 278, 'loss': 'mse', 'optimizer': 'adam', 'graph_mode': 'off', 'use_snp_selection': False}. Best is trial 31 with value: 0.3136372669321699.
[I 2025-12-06 05:43:25,832] Trial 51 finished with value: 0.3099396550318163 and parameters: {'model_type': 'mlp', 'hidden_dims': '[512, 256]', 'dropout': 0.2248341754967692, 'batch_norm': True, 'lr': 0.00010275493957121496, 'weight_decay': 1.0501874332130037e-07, 'epochs': 124, 'loss': 'mse', 'optimizer': 'adam', 'graph_mode': 'off', 'use_snp_selection': False}. Best is trial 31 with value: 0.3136372669321699.
[I 2025-12-06 05:43:55,594] Trial 52 finished with value: 0.3118163098256542 and parameters: {'model_type': 'mlp', 'hidden_dims': '[512, 256]', 'dropout': 0.18559765932227268, 'batch_norm': True, 'lr': 0.0001248920271100488, 'weight_decay': 1.6798506676544875e-07, 'epochs': 139, 'loss': 'mse', 'optimizer': 'adam', 'graph_mode': 'off', 'use_snp_selection': False}. Best is trial 31 with value: 0.3136372669321699.
[I 2025-12-06 05:44:31,291] Trial 53 finished with value: 0.30936549000112173 and parameters: {'model_type': 'mlp', 'hidden_dims': '[512, 256]', 'dropout': 0.18660971585936337, 'batch_norm': True, 'lr': 3.642105149184889e-05, 'weight_decay': 1.5806757272143013e-07, 'epochs': 173, 'loss': 'mse', 'optimizer': 'adam', 'graph_mode': 'off', 'use_snp_selection': False}. Best is trial 31 with value: 0.3136372669321699.
[I 2025-12-06 05:45:00,672] Trial 54 finished with value: 0.31238447587499085 and parameters: {'model_type': 'mlp', 'hidden_dims': '[512, 256]', 'dropout': 0.15080355608683899, 'batch_norm': True, 'lr': 6.451402657820422e-05, 'weight_decay': 0.0004926813436281601, 'epochs': 137, 'loss': 'mse', 'optimizer': 'adam', 'graph_mode': 'off', 'use_snp_selection': False}. Best is trial 31 with value: 0.3136372669321699.
[I 2025-12-06 05:45:30,266] Trial 55 finished with value: 0.3087527984006657 and parameters: {'model_type': 'mlp', 'hidden_dims': '[512, 256]', 'dropout': 0.14502993278511933, 'batch_norm': True, 'lr': 6.404203714890321e-05, 'weight_decay': 0.00035560338763413406, 'epochs': 138, 'loss': 'mse', 'optimizer': 'adam', 'graph_mode': 'off', 'use_snp_selection': False}. Best is trial 31 with value: 0.3136372669321699.
[I 2025-12-06 05:45:49,372] Trial 56 finished with value: 0.3101799826425301 and parameters: {'model_type': 'mlp', 'hidden_dims': '[256, 128, 64]', 'dropout': 0.11955827982394159, 'batch_norm': True, 'lr': 0.00012023128622836383, 'weight_decay': 0.0007143387529339339, 'epochs': 156, 'loss': 'mse', 'optimizer': 'adam', 'graph_mode': 'off', 'use_snp_selection': False}. Best is trial 31 with value: 0.3136372669321699.
[I 2025-12-06 05:46:26,516] Trial 57 finished with value: 0.31131880457261557 and parameters: {'model_type': 'mlp', 'hidden_dims': '[512, 256]', 'dropout': 0.1542439081641482, 'batch_norm': True, 'lr': 5.716556783959154e-05, 'weight_decay': 7.673730266922275e-05, 'epochs': 181, 'loss': 'mae', 'optimizer': 'adam', 'graph_mode': 'off', 'use_snp_selection': False}. Best is trial 31 with value: 0.3136372669321699.
[I 2025-12-06 05:47:06,576] Trial 58 finished with value: 0.30998096347562765 and parameters: {'model_type': 'mlp', 'hidden_dims': '[512, 64]', 'dropout': 0.5500703113503709, 'batch_norm': True, 'lr': 3.0133039753769105e-05, 'weight_decay': 2.9113034918014194e-06, 'epochs': 199, 'loss': 'mse', 'optimizer': 'adam', 'graph_mode': 'off', 'use_snp_selection': False}. Best is trial 31 with value: 0.3136372669321699.
[I 2025-12-06 05:47:48,856] Trial 59 finished with value: 0.30421715649210335 and parameters: {'model_type': 'mlp', 'hidden_dims': '[512, 256]', 'dropout': 0.17582366151634415, 'batch_norm': False, 'lr': 0.00014987398851440013, 'weight_decay': 2.3308401050180202e-05, 'epochs': 213, 'loss': 'mse', 'optimizer': 'adam', 'graph_mode': 'off', 'use_snp_selection': False}. Best is trial 31 with value: 0.3136372669321699.
[I 2025-12-06 05:48:23,141] Trial 60 finished with value: 0.30637998344829737 and parameters: {'model_type': 'mlp', 'hidden_dims': '[512, 256]', 'dropout': 0.2524567085119976, 'batch_norm': True, 'lr': 0.0002804461550905401, 'weight_decay': 7.950069022175179e-06, 'epochs': 165, 'loss': 'mae', 'optimizer': 'adam', 'graph_mode': 'off', 'use_snp_selection': False}. Best is trial 31 with value: 0.3136372669321699.
[I 2025-12-06 05:48:59,912] Trial 61 finished with value: 0.3090137285194676 and parameters: {'model_type': 'mlp', 'hidden_dims': '[512, 256]', 'dropout': 0.1515067925443975, 'batch_norm': True, 'lr': 5.719513936823811e-05, 'weight_decay': 0.00021755320293341158, 'epochs': 179, 'loss': 'mae', 'optimizer': 'adam', 'graph_mode': 'off', 'use_snp_selection': False}. Best is trial 31 with value: 0.3136372669321699.
[I 2025-12-06 05:49:49,369] Trial 62 finished with value: 0.31250810785741956 and parameters: {'model_type': 'mlp', 'hidden_dims': '[512, 256]', 'dropout': 0.10752536667101459, 'batch_norm': True, 'lr': 4.511227909556337e-05, 'weight_decay': 0.00012519301635561264, 'epochs': 251, 'loss': 'mae', 'optimizer': 'adam', 'graph_mode': 'off', 'use_snp_selection': False}. Best is trial 31 with value: 0.3136372669321699.
[I 2025-12-06 05:50:37,432] Trial 63 finished with value: 0.30876691225232084 and parameters: {'model_type': 'mlp', 'hidden_dims': '[512, 256]', 'dropout': 0.10016807443803044, 'batch_norm': True, 'lr': 1.903562793457636e-05, 'weight_decay': 0.00026755827610339946, 'epochs': 243, 'loss': 'mae', 'optimizer': 'adam', 'graph_mode': 'off', 'use_snp_selection': False}. Best is trial 31 with value: 0.3136372669321699.
[I 2025-12-06 05:51:27,293] Trial 64 finished with value: 0.30782293076129835 and parameters: {'model_type': 'mlp', 'hidden_dims': '[512, 256]', 'dropout': 0.12423758551166617, 'batch_norm': True, 'lr': 4.203420555478012e-05, 'weight_decay': 0.0005636346257981805, 'epochs': 253, 'loss': 'mae', 'optimizer': 'adam', 'graph_mode': 'off', 'use_snp_selection': False}. Best is trial 31 with value: 0.3136372669321699.
[I 2025-12-06 05:52:26,085] Trial 65 finished with value: 0.3102113443110445 and parameters: {'model_type': 'mlp', 'hidden_dims': '[512, 256]', 'dropout': 0.13884367583713692, 'batch_norm': True, 'lr': 7.854471284114555e-05, 'weight_decay': 0.0004970123900921025, 'epochs': 304, 'loss': 'mae', 'optimizer': 'adam', 'graph_mode': 'off', 'use_snp_selection': False}. Best is trial 31 with value: 0.3136372669321699.
[I 2025-12-06 05:53:02,566] Trial 66 finished with value: 0.29283983134538694 and parameters: {'model_type': 'mlp', 'hidden_dims': '[256, 128]', 'dropout': 0.21039350286626224, 'batch_norm': True, 'lr': 1.179272692413773e-05, 'weight_decay': 0.00012574414015276286, 'epochs': 279, 'loss': 'mse', 'optimizer': 'adam', 'graph_mode': 'off', 'use_snp_selection': True, 'num_snps': 22881}. Best is trial 31 with value: 0.3136372669321699.
[I 2025-12-06 05:53:12,418] Trial 67 finished with value: 0.2091787715744886 and parameters: {'model_type': 'mlp', 'hidden_dims': '[128, 64]', 'dropout': 0.10930745073888215, 'batch_norm': False, 'lr': 1.038788092140181e-06, 'weight_decay': 0.0009446634395666504, 'epochs': 106, 'loss': 'mae', 'optimizer': 'adam', 'graph_mode': 'off', 'use_snp_selection': False}. Best is trial 31 with value: 0.3136372669321699.
[I 2025-12-06 05:54:03,938] Trial 68 finished with value: 0.30853284376942325 and parameters: {'model_type': 'mlp', 'hidden_dims': '[512, 256]', 'dropout': 0.17866977391074426, 'batch_norm': True, 'lr': 0.00018770215260130625, 'weight_decay': 0.0001800713349091098, 'epochs': 263, 'loss': 'mse', 'optimizer': 'adam', 'graph_mode': 'off', 'use_snp_selection': False}. Best is trial 31 with value: 0.3136372669321699.
[I 2025-12-06 05:54:49,485] Trial 69 finished with value: 0.3103635820390875 and parameters: {'model_type': 'mlp', 'hidden_dims': '[512, 128]', 'dropout': 0.4645955723545978, 'batch_norm': True, 'lr': 2.6529542509001745e-05, 'weight_decay': 4.0397264089390675e-05, 'epochs': 230, 'loss': 'mse', 'optimizer': 'adam', 'graph_mode': 'off', 'use_snp_selection': False}. Best is trial 31 with value: 0.3136372669321699.
[I 2025-12-06 05:55:31,800] Trial 70 finished with value: 0.2890359017152013 and parameters: {'model_type': 'mlp', 'hidden_dims': '[512, 64]', 'dropout': 0.16731621973559654, 'batch_norm': True, 'lr': 7.415720658223562e-06, 'weight_decay': 1.528276756235825e-07, 'epochs': 212, 'loss': 'mae', 'optimizer': 'adam', 'graph_mode': 'off', 'use_snp_selection': False}. Best is trial 31 with value: 0.3136372669321699.
[I 2025-12-06 05:56:11,496] Trial 71 finished with value: 0.31394110948476106 and parameters: {'model_type': 'mlp', 'hidden_dims': '[512, 256]', 'dropout': 0.15681928031764658, 'batch_norm': True, 'lr': 6.62950021663468e-05, 'weight_decay': 6.094122853893812e-05, 'epochs': 196, 'loss': 'mae', 'optimizer': 'adam', 'graph_mode': 'off', 'use_snp_selection': False}. Best is trial 71 with value: 0.31394110948476106.
[I 2025-12-06 05:56:55,479] Trial 72 finished with value: 0.31264141057010375 and parameters: {'model_type': 'mlp', 'hidden_dims': '[512, 256]', 'dropout': 0.13867481170324678, 'batch_norm': True, 'lr': 0.0001318498247582992, 'weight_decay': 6.539724519313568e-05, 'epochs': 220, 'loss': 'mae', 'optimizer': 'adam', 'graph_mode': 'off', 'use_snp_selection': False}. Best is trial 71 with value: 0.31394110948476106.
[I 2025-12-06 05:57:40,059] Trial 73 finished with value: 0.31174966403780424 and parameters: {'model_type': 'mlp', 'hidden_dims': '[512, 256]', 'dropout': 0.13906217678225852, 'batch_norm': True, 'lr': 0.00013500758100738186, 'weight_decay': 5.7215567161630716e-05, 'epochs': 223, 'loss': 'mae', 'optimizer': 'adam', 'graph_mode': 'off', 'use_snp_selection': False}. Best is trial 71 with value: 0.31394110948476106.
[I 2025-12-06 05:58:19,319] Trial 74 finished with value: 0.3114663931338731 and parameters: {'model_type': 'mlp', 'hidden_dims': '[512, 256]', 'dropout': 0.11253804929328463, 'batch_norm': True, 'lr': 0.000122312062215026, 'weight_decay': 0.00015866741877573924, 'epochs': 193, 'loss': 'mae', 'optimizer': 'adam', 'graph_mode': 'off', 'use_snp_selection': False}. Best is trial 71 with value: 0.31394110948476106.
[I 2025-12-06 05:58:34,583] Trial 75 finished with value: 0.3078167313991644 and parameters: {'model_type': 'mlp', 'hidden_dims': '[256, 128, 64]', 'dropout': 0.1555639968828049, 'batch_norm': True, 'lr': 3.9701274288260885e-05, 'weight_decay': 8.139184839423675e-05, 'epochs': 115, 'loss': 'mae', 'optimizer': 'adam', 'graph_mode': 'off', 'use_snp_selection': False}. Best is trial 71 with value: 0.31394110948476106.
[I 2025-12-06 05:59:17,877] Trial 76 finished with value: 0.3020607860042828 and parameters: {'model_type': 'mlp', 'hidden_dims': '[512, 256]', 'dropout': 0.13370265774546572, 'batch_norm': False, 'lr': 6.358250371399127e-05, 'weight_decay': 6.160112405014174e-05, 'epochs': 219, 'loss': 'mae', 'optimizer': 'adam', 'graph_mode': 'off', 'use_snp_selection': False}. Best is trial 71 with value: 0.31394110948476106.
[I 2025-12-06 06:00:04,840] Trial 77 finished with value: 0.3120996932161391 and parameters: {'model_type': 'mlp', 'hidden_dims': '[512, 256]', 'dropout': 0.40985774493594435, 'batch_norm': True, 'lr': 4.749996605456406e-05, 'weight_decay': 1.4612363888006028e-05, 'epochs': 237, 'loss': 'mae', 'optimizer': 'adam', 'graph_mode': 'off', 'use_snp_selection': False}. Best is trial 71 with value: 0.31394110948476106.
[I 2025-12-06 06:00:28,376] Trial 78 finished with value: 0.26964754826570164 and parameters: {'model_type': 'mlp', 'hidden_dims': '[512, 256]', 'dropout': 0.18303693227294487, 'batch_norm': True, 'lr': 4.890219622522525e-05, 'weight_decay': 1.7816055620599113e-05, 'epochs': 240, 'loss': 'mae', 'optimizer': 'adam', 'graph_mode': 'off', 'use_snp_selection': True, 'num_snps': 2246}. Best is trial 71 with value: 0.31394110948476106.
[I 2025-12-06 06:00:57,861] Trial 79 finished with value: 0.30784583171063123 and parameters: {'model_type': 'mlp', 'hidden_dims': '[512, 256]', 'dropout': 0.40518909263762226, 'batch_norm': True, 'lr': 7.331418748524945e-05, 'weight_decay': 4.0833795719694596e-05, 'epochs': 138, 'loss': 'mae', 'optimizer': 'adam', 'graph_mode': 'off', 'use_snp_selection': False}. Best is trial 71 with value: 0.31394110948476106.
[I 2025-12-06 06:01:47,032] Trial 80 finished with value: 0.3047496420690886 and parameters: {'model_type': 'mlp', 'hidden_dims': '[512, 64]', 'dropout': 0.16656749302866944, 'batch_norm': True, 'lr': 0.00025380976806978835, 'weight_decay': 2.8381553231302442e-05, 'epochs': 251, 'loss': 'mae', 'optimizer': 'adam', 'graph_mode': 'off', 'use_snp_selection': False}. Best is trial 71 with value: 0.31394110948476106.
[I 2025-12-06 06:02:32,776] Trial 81 finished with value: 0.3090359748689606 and parameters: {'model_type': 'mlp', 'hidden_dims': '[512, 256]', 'dropout': 0.42630169984277094, 'batch_norm': True, 'lr': 8.825675119022617e-05, 'weight_decay': 1.161019525311404e-05, 'epochs': 230, 'loss': 'mae', 'optimizer': 'adam', 'graph_mode': 'off', 'use_snp_selection': False}. Best is trial 71 with value: 0.31394110948476106.
[I 2025-12-06 06:03:00,924] Trial 82 finished with value: 0.30970432948411925 and parameters: {'model_type': 'mlp', 'hidden_dims': '[512, 256]', 'dropout': 0.3595563362268052, 'batch_norm': True, 'lr': 6.96599868717968e-05, 'weight_decay': 0.0003712667765749897, 'epochs': 130, 'loss': 'mae', 'optimizer': 'adam', 'graph_mode': 'off', 'use_snp_selection': False}. Best is trial 71 with value: 0.31394110948476106.
[I 2025-12-06 06:03:47,393] Trial 83 finished with value: 0.3047337954883168 and parameters: {'model_type': 'mlp', 'hidden_dims': '[512, 256]', 'dropout': 0.4668545203033994, 'batch_norm': True, 'lr': 3.340020940172577e-05, 'weight_decay': 3.89324024569472e-06, 'epochs': 234, 'loss': 'mae', 'optimizer': 'adam', 'graph_mode': 'off', 'use_snp_selection': False}. Best is trial 71 with value: 0.31394110948476106.
[I 2025-12-06 06:04:39,713] Trial 84 finished with value: 0.3124068537631298 and parameters: {'model_type': 'mlp', 'hidden_dims': '[512, 256]', 'dropout': 0.5138913824442527, 'batch_norm': True, 'lr': 1.5976142313566443e-05, 'weight_decay': 6.971501952681316e-06, 'epochs': 267, 'loss': 'mae', 'optimizer': 'adam', 'graph_mode': 'off', 'use_snp_selection': False}. Best is trial 71 with value: 0.31394110948476106.
[I 2025-12-06 06:05:36,073] Trial 85 finished with value: 0.3092488214359865 and parameters: {'model_type': 'mlp', 'hidden_dims': '[512, 256]', 'dropout': 0.5468898321477262, 'batch_norm': True, 'lr': 0.00010747443007488487, 'weight_decay': 7.456009226171794e-06, 'epochs': 290, 'loss': 'mae', 'optimizer': 'adam', 'graph_mode': 'off', 'use_snp_selection': False}. Best is trial 71 with value: 0.31394110948476106.
[I 2025-12-06 06:06:29,228] Trial 86 finished with value: 0.3109559394367646 and parameters: {'model_type': 'mlp', 'hidden_dims': '[512, 256]', 'dropout': 0.569516270739662, 'batch_norm': True, 'lr': 4.3370839526505226e-05, 'weight_decay': 0.00013677982458598317, 'epochs': 272, 'loss': 'mae', 'optimizer': 'adam', 'graph_mode': 'off', 'use_snp_selection': False}. Best is trial 71 with value: 0.31394110948476106.
[I 2025-12-06 06:07:18,840] Trial 87 finished with value: 0.31208881184236115 and parameters: {'model_type': 'mlp', 'hidden_dims': '[512, 256]', 'dropout': 0.5168738915965863, 'batch_norm': True, 'lr': 1.766535652071042e-05, 'weight_decay': 2.060814004540105e-05, 'epochs': 252, 'loss': 'mae', 'optimizer': 'adam', 'graph_mode': 'off', 'use_snp_selection': False}. Best is trial 71 with value: 0.31394110948476106.
[I 2025-12-06 06:07:49,737] Trial 88 finished with value: 0.3082745060166478 and parameters: {'model_type': 'mlp', 'hidden_dims': '[256, 128]', 'dropout': 0.5692276327074907, 'batch_norm': True, 'lr': 1.7140220035801728e-05, 'weight_decay': 2.1908280050527887e-05, 'epochs': 286, 'loss': 'mae', 'optimizer': 'adam', 'graph_mode': 'off', 'use_snp_selection': False}. Best is trial 71 with value: 0.31394110948476106.
[I 2025-12-06 06:08:07,692] Trial 89 finished with value: 0.3034379954023444 and parameters: {'model_type': 'mlp', 'hidden_dims': '[128, 64]', 'dropout': 0.5150246470839959, 'batch_norm': True, 'lr': 1.465158914244712e-05, 'weight_decay': 1.195191399830631e-05, 'epochs': 262, 'loss': 'mae', 'optimizer': 'adam', 'graph_mode': 'off', 'use_snp_selection': False}. Best is trial 71 with value: 0.31394110948476106.
