[I 2025-12-05 14:27:19,881] Trial 53 finished with value: 0.09020840815630976 and parameters: {'model_type': 'mlp', 'hidden_dims': '[128, 64]', 'dropout': 0.1186946937571326, 'batch_norm': False, 'lr': 1.3875581004664756e-05, 'weight_decay': 2.7199235259652056e-06, 'epochs': 163, 'loss': 'mse', 'optimizer': 'adam', 'graph_mode': 'off', 'use_snp_selection': False}. Best is trial 32 with value: 0.13515378067215644.
[I 2025-12-05 14:27:20,703] Trial 54 finished with value: 0.07324230538016238 and parameters: {'model_type': 'mlp', 'hidden_dims': '[128, 64]', 'dropout': 0.5554305273428004, 'batch_norm': False, 'lr': 1.9652532391415686e-05, 'weight_decay': 3.517698673306285e-06, 'epochs': 182, 'loss': 'mse', 'optimizer': 'adam', 'graph_mode': 'off', 'use_snp_selection': False}. Best is trial 32 with value: 0.13515378067215644.
[I 2025-12-05 14:27:21,695] Trial 55 finished with value: 0.1122704195210183 and parameters: {'model_type': 'mlp', 'hidden_dims': '[256, 128, 64]', 'dropout': 0.14144912390816483, 'batch_norm': False, 'lr': 4.4956356740130195e-05, 'weight_decay': 6.243951212418788e-06, 'epochs': 140, 'loss': 'mse', 'optimizer': 'adam', 'graph_mode': 'off', 'use_snp_selection': False}. Best is trial 32 with value: 0.13515378067215644.
[I 2025-12-05 14:27:22,996] Trial 56 finished with value: 0.09112985254582656 and parameters: {'model_type': 'mlp', 'hidden_dims': '[512, 256]', 'dropout': 0.20723482567033083, 'batch_norm': False, 'lr': 2.5232396841974224e-05, 'weight_decay': 8.986873113123327e-06, 'epochs': 121, 'loss': 'mse', 'optimizer': 'adam', 'graph_mode': 'off', 'use_snp_selection': False}. Best is trial 32 with value: 0.13515378067215644.
[I 2025-12-05 14:27:23,895] Trial 57 finished with value: 0.01851717778747406 and parameters: {'model_type': 'mlp', 'hidden_dims': '[128, 64]', 'dropout': 0.11317799250661459, 'batch_norm': True, 'lr': 1.7850350083766033e-05, 'weight_decay': 1.251875803041207e-06, 'epochs': 229, 'loss': 'mse', 'optimizer': 'adam', 'graph_mode': 'off', 'use_snp_selection': False}. Best is trial 32 with value: 0.13515378067215644.
[I 2025-12-05 14:27:24,820] Trial 58 finished with value: 0.06985955787275154 and parameters: {'model_type': 'mlp', 'hidden_dims': '[128, 64]', 'dropout': 0.40228275019692983, 'batch_norm': False, 'lr': 3.482030172827792e-05, 'weight_decay': 2.2477070839287677e-07, 'epochs': 250, 'loss': 'mse', 'optimizer': 'adam', 'graph_mode': 'off', 'use_snp_selection': False}. Best is trial 32 with value: 0.13515378067215644.
[I 2025-12-05 14:27:26,493] Trial 59 finished with value: 0.09436936143933933 and parameters: {'model_type': 'mlp', 'hidden_dims': '[512, 128]', 'dropout': 0.18035985899555357, 'batch_norm': False, 'lr': 0.0008124203504309952, 'weight_decay': 1.6095119219102066e-05, 'epochs': 205, 'loss': 'mae', 'optimizer': 'adam', 'graph_mode': 'off', 'use_snp_selection': False}. Best is trial 32 with value: 0.13515378067215644.
[I 2025-12-05 14:27:27,301] Trial 60 finished with value: 0.0967459028938718 and parameters: {'model_type': 'mlp', 'hidden_dims': '[128, 64]', 'dropout': 0.15335169141890997, 'batch_norm': False, 'lr': 0.00043133481604813837, 'weight_decay': 4.5438398370986673e-07, 'epochs': 170, 'loss': 'mse', 'optimizer': 'adam', 'graph_mode': 'off', 'use_snp_selection': False}. Best is trial 32 with value: 0.13515378067215644.
[I 2025-12-05 14:27:28,309] Trial 61 finished with value: 0.09726445781904533 and parameters: {'model_type': 'mlp', 'hidden_dims': '[128, 64]', 'dropout': 0.42417783964919636, 'batch_norm': False, 'lr': 1.4667279612009411e-05, 'weight_decay': 5.265420082018611e-06, 'epochs': 323, 'loss': 'mse', 'optimizer': 'adam', 'graph_mode': 'off', 'use_snp_selection': False}. Best is trial 32 with value: 0.13515378067215644.
[I 2025-12-05 14:27:29,929] Trial 62 finished with value: 0.12145473114954466 and parameters: {'model_type': 'mlp', 'hidden_dims': '[512, 64]', 'dropout': 0.2619096547272056, 'batch_norm': False, 'lr': 9.828598465107153e-05, 'weight_decay': 2.3403908729500482e-06, 'epochs': 195, 'loss': 'mse', 'optimizer': 'adam', 'graph_mode': 'off', 'use_snp_selection': False}. Best is trial 32 with value: 0.13515378067215644.
[I 2025-12-05 14:27:31,548] Trial 63 finished with value: 0.0958758229232004 and parameters: {'model_type': 'mlp', 'hidden_dims': '[512, 64]', 'dropout': 0.25875103824540396, 'batch_norm': False, 'lr': 8.675624172235488e-05, 'weight_decay': 2.270771614683329e-06, 'epochs': 195, 'loss': 'mse', 'optimizer': 'adam', 'graph_mode': 'off', 'use_snp_selection': False}. Best is trial 32 with value: 0.13515378067215644.
[I 2025-12-05 14:27:33,254] Trial 64 finished with value: 0.10883556881134335 and parameters: {'model_type': 'mlp', 'hidden_dims': '[512, 64]', 'dropout': 0.2239990070408105, 'batch_norm': False, 'lr': 6.234442381955288e-05, 'weight_decay': 1.7733323284792036e-06, 'epochs': 214, 'loss': 'mse', 'optimizer': 'adam', 'graph_mode': 'off', 'use_snp_selection': False}. Best is trial 32 with value: 0.13515378067215644.
[I 2025-12-05 14:27:35,014] Trial 65 finished with value: 0.10301095117328313 and parameters: {'model_type': 'mlp', 'hidden_dims': '[512, 64]', 'dropout': 0.27431643323506383, 'batch_norm': False, 'lr': 0.00018869177560690645, 'weight_decay': 3.4219717879258484e-06, 'epochs': 227, 'loss': 'mse', 'optimizer': 'adam', 'graph_mode': 'off', 'use_snp_selection': False}. Best is trial 32 with value: 0.13515378067215644.
[I 2025-12-05 14:27:36,056] Trial 66 finished with value: 0.12189360421905776 and parameters: {'model_type': 'mlp', 'hidden_dims': '[256, 128, 64]', 'dropout': 0.19292468281661163, 'batch_norm': False, 'lr': 0.0001451714882864813, 'weight_decay': 1.0637987852399143e-05, 'epochs': 159, 'loss': 'mse', 'optimizer': 'adam', 'graph_mode': 'off', 'use_snp_selection': False}. Best is trial 32 with value: 0.13515378067215644.
[I 2025-12-05 14:27:37,530] Trial 67 finished with value: 0.09072139012448294 and parameters: {'model_type': 'mlp', 'hidden_dims': '[256, 128, 64]', 'dropout': 0.16382820091128858, 'batch_norm': False, 'lr': 0.00010117023530751639, 'weight_decay': 9.784436058703147e-06, 'epochs': 160, 'loss': 'mse', 'optimizer': 'adam', 'graph_mode': 'off', 'use_snp_selection': True, 'num_snps': 22951}. Best is trial 32 with value: 0.13515378067215644.
[I 2025-12-05 14:27:38,419] Trial 68 finished with value: 0.11399655236284599 and parameters: {'model_type': 'mlp', 'hidden_dims': '[256, 128, 64]', 'dropout': 0.2413634428779904, 'batch_norm': False, 'lr': 0.00016755649471864395, 'weight_decay': 3.1700909471688773e-05, 'epochs': 100, 'loss': 'mse', 'optimizer': 'adam', 'graph_mode': 'off', 'use_snp_selection': False}. Best is trial 32 with value: 0.13515378067215644.
[I 2025-12-05 14:27:39,381] Trial 69 finished with value: 0.12421754689178985 and parameters: {'model_type': 'mlp', 'hidden_dims': '[256, 128, 64]', 'dropout': 0.18812176609661943, 'batch_norm': False, 'lr': 0.00014318145283036076, 'weight_decay': 6.595652061021439e-05, 'epochs': 128, 'loss': 'mse', 'optimizer': 'adam', 'graph_mode': 'off', 'use_snp_selection': False}. Best is trial 32 with value: 0.13515378067215644.
[I 2025-12-05 14:27:40,358] Trial 70 finished with value: 0.10090987893097535 and parameters: {'model_type': 'mlp', 'hidden_dims': '[256, 128, 64]', 'dropout': 0.19360268240308265, 'batch_norm': True, 'lr': 0.0003822585889589598, 'weight_decay': 5.086777359657183e-05, 'epochs': 126, 'loss': 'mse', 'optimizer': 'adam', 'graph_mode': 'off', 'use_snp_selection': False}. Best is trial 32 with value: 0.13515378067215644.
[I 2025-12-05 14:27:41,362] Trial 71 finished with value: 0.11821950384445556 and parameters: {'model_type': 'mlp', 'hidden_dims': '[256, 128, 64]', 'dropout': 0.32274848447996735, 'batch_norm': False, 'lr': 0.00015062140816132655, 'weight_decay': 8.616750940028173e-05, 'epochs': 146, 'loss': 'mse', 'optimizer': 'adam', 'graph_mode': 'off', 'use_snp_selection': False}. Best is trial 32 with value: 0.13515378067215644.
[I 2025-12-05 14:27:42,339] Trial 72 finished with value: 0.10559051415929607 and parameters: {'model_type': 'mlp', 'hidden_dims': '[256, 128, 64]', 'dropout': 0.21139126402253924, 'batch_norm': False, 'lr': 0.00023676752513205335, 'weight_decay': 2.3162919759372352e-05, 'epochs': 133, 'loss': 'mse', 'optimizer': 'adam', 'graph_mode': 'off', 'use_snp_selection': False}. Best is trial 32 with value: 0.13515378067215644.
[I 2025-12-05 14:27:43,364] Trial 73 finished with value: 0.10784522905353196 and parameters: {'model_type': 'mlp', 'hidden_dims': '[256, 128, 64]', 'dropout': 0.14054857443194282, 'batch_norm': False, 'lr': 0.00013155715287520878, 'weight_decay': 0.0009723175659163882, 'epochs': 154, 'loss': 'mse', 'optimizer': 'adam', 'graph_mode': 'off', 'use_snp_selection': False}. Best is trial 32 with value: 0.13515378067215644.
[I 2025-12-05 14:27:44,437] Trial 74 finished with value: 0.1145434089025355 and parameters: {'model_type': 'mlp', 'hidden_dims': '[256, 128, 64]', 'dropout': 0.1894291071674457, 'batch_norm': False, 'lr': 9.664252229541963e-05, 'weight_decay': 7.116383013612008e-07, 'epochs': 173, 'loss': 'mse', 'optimizer': 'adam', 'graph_mode': 'off', 'use_snp_selection': False}. Best is trial 32 with value: 0.13515378067215644.
[I 2025-12-05 14:27:45,834] Trial 75 finished with value: 0.10848488175050103 and parameters: {'model_type': 'mlp', 'hidden_dims': '[512, 64]', 'dropout': 0.17107203593109696, 'batch_norm': False, 'lr': 5.724083892853339e-05, 'weight_decay': 0.00017931749187760477, 'epochs': 145, 'loss': 'mse', 'optimizer': 'adam', 'graph_mode': 'off', 'use_snp_selection': False}. Best is trial 32 with value: 0.13515378067215644.
[I 2025-12-05 14:27:47,504] Trial 76 finished with value: 0.08213146206437921 and parameters: {'model_type': 'mlp', 'hidden_dims': '[512, 256]', 'dropout': 0.2854655745816253, 'batch_norm': False, 'lr': 0.00024158650905020475, 'weight_decay': 1.2603386144276095e-05, 'epochs': 205, 'loss': 'mae', 'optimizer': 'adam', 'graph_mode': 'off', 'use_snp_selection': False}. Best is trial 32 with value: 0.13515378067215644.
[I 2025-12-05 14:27:48,429] Trial 77 finished with value: 0.09101221621196667 and parameters: {'model_type': 'mlp', 'hidden_dims': '[256, 128, 64]', 'dropout': 0.11120270878518776, 'batch_norm': False, 'lr': 3.7361534471305115e-05, 'weight_decay': 1.0266448287163067e-07, 'epochs': 111, 'loss': 'mse', 'optimizer': 'adam', 'graph_mode': 'off', 'use_snp_selection': False}. Best is trial 32 with value: 0.13515378067215644.
[I 2025-12-05 14:27:49,280] Trial 78 finished with value: 0.05769966818693643 and parameters: {'model_type': 'mlp', 'hidden_dims': '[512, 64]', 'dropout': 0.243504902048057, 'batch_norm': False, 'lr': 0.000136066909463303, 'weight_decay': 0.0004508963126038782, 'epochs': 167, 'loss': 'mse', 'optimizer': 'adam', 'graph_mode': 'off', 'use_snp_selection': True, 'num_snps': 2246}. Best is trial 32 with value: 0.13515378067215644.
[I 2025-12-05 14:27:50,840] Trial 79 finished with value: 0.1057414328072219 and parameters: {'model_type': 'mlp', 'hidden_dims': '[512, 128]', 'dropout': 0.21549297826151467, 'batch_norm': False, 'lr': 6.402064598370349e-05, 'weight_decay': 1.718877792495129e-07, 'epochs': 181, 'loss': 'mse', 'optimizer': 'adam', 'graph_mode': 'off', 'use_snp_selection': False}. Best is trial 32 with value: 0.13515378067215644.
[I 2025-12-05 14:27:51,548] Trial 80 finished with value: 0.10927607633305157 and parameters: {'model_type': 'mlp', 'hidden_dims': '[128, 64]', 'dropout': 0.36260132427752456, 'batch_norm': False, 'lr': 0.00029402262118328576, 'weight_decay': 0.00011616310943461411, 'epochs': 90, 'loss': 'mse', 'optimizer': 'adam', 'graph_mode': 'off', 'use_snp_selection': False}. Best is trial 32 with value: 0.13515378067215644.
[I 2025-12-05 14:27:52,317] Trial 81 finished with value: 0.09628550809932507 and parameters: {'model_type': 'mlp', 'hidden_dims': '[128, 64]', 'dropout': 0.13603929601956255, 'batch_norm': False, 'lr': 2.4694371283820855e-05, 'weight_decay': 6.339219605213869e-06, 'epochs': 139, 'loss': 'mse', 'optimizer': 'adam', 'graph_mode': 'off', 'use_snp_selection': False}. Best is trial 32 with value: 0.13515378067215644.
[I 2025-12-05 14:27:53,160] Trial 82 finished with value: 0.08587500378727131 and parameters: {'model_type': 'mlp', 'hidden_dims': '[128, 64]', 'dropout': 0.15966315071235737, 'batch_norm': False, 'lr': 1.1513517158903404e-05, 'weight_decay': 3.954784299678465e-06, 'epochs': 187, 'loss': 'mse', 'optimizer': 'adam', 'graph_mode': 'off', 'use_snp_selection': False}. Best is trial 32 with value: 0.13515378067215644.
[I 2025-12-05 14:27:53,834] Trial 83 finished with value: 0.10777175487779271 and parameters: {'model_type': 'mlp', 'hidden_dims': '[128, 64]', 'dropout': 0.12827004624874597, 'batch_norm': False, 'lr': 3.056379657743401e-05, 'weight_decay': 7.032256862240116e-06, 'epochs': 66, 'loss': 'mse', 'optimizer': 'adam', 'graph_mode': 'off', 'use_snp_selection': False}. Best is trial 32 with value: 0.13515378067215644.
[I 2025-12-05 14:27:54,629] Trial 84 finished with value: 0.10836944833895193 and parameters: {'model_type': 'mlp', 'hidden_dims': '[128, 64]', 'dropout': 0.11471933439664198, 'batch_norm': False, 'lr': 4.8093660468377304e-05, 'weight_decay': 5.23924774436573e-06, 'epochs': 156, 'loss': 'mse', 'optimizer': 'adam', 'graph_mode': 'off', 'use_snp_selection': False}. Best is trial 32 with value: 0.13515378067215644.
[I 2025-12-05 14:27:55,461] Trial 85 finished with value: 0.08556395428737293 and parameters: {'model_type': 'mlp', 'hidden_dims': '[128, 64]', 'dropout': 0.14662570837294592, 'batch_norm': False, 'lr': 1.8057221975518167e-05, 'weight_decay': 1.8376400250000554e-05, 'epochs': 188, 'loss': 'mse', 'optimizer': 'adam', 'graph_mode': 'off', 'use_snp_selection': False}. Best is trial 32 with value: 0.13515378067215644.
[I 2025-12-05 14:27:56,235] Trial 86 finished with value: 0.08979336609743903 and parameters: {'model_type': 'mlp', 'hidden_dims': '[128, 64]', 'dropout': 0.19683635815873357, 'batch_norm': True, 'lr': 0.0005275711645160518, 'weight_decay': 1.0473471503554363e-05, 'epochs': 125, 'loss': 'mse', 'optimizer': 'adam', 'graph_mode': 'off', 'use_snp_selection': False}. Best is trial 32 with value: 0.13515378067215644.
[I 2025-12-05 14:27:57,373] Trial 87 finished with value: 0.11419758084602874 and parameters: {'model_type': 'mlp', 'hidden_dims': '[256, 128, 64]', 'dropout': 0.10236652497041372, 'batch_norm': False, 'lr': 8.680272417062177e-05, 'weight_decay': 3.6411066490057486e-05, 'epochs': 198, 'loss': 'mae', 'optimizer': 'adam', 'graph_mode': 'off', 'use_snp_selection': False}. Best is trial 32 with value: 0.13515378067215644.
[I 2025-12-05 14:27:58,196] Trial 88 finished with value: 0.10844032605387517 and parameters: {'model_type': 'mlp', 'hidden_dims': '[128, 64]', 'dropout': 0.18068638805125137, 'batch_norm': False, 'lr': 2.511679147013987e-05, 'weight_decay': 6.689783664069366e-05, 'epochs': 178, 'loss': 'mse', 'optimizer': 'adam', 'graph_mode': 'off', 'use_snp_selection': False}. Best is trial 32 with value: 0.13515378067215644.
[I 2025-12-05 14:28:00,744] Trial 89 finished with value: 0.11671901543608658 and parameters: {'model_type': 'mlp', 'hidden_dims': '[512, 256]', 'dropout': 0.16542810417082224, 'batch_norm': False, 'lr': 4.293610850389766e-05, 'weight_decay': 3.1370407395094013e-07, 'epochs': 166, 'loss': 'mse', 'optimizer': 'adam', 'graph_mode': 'off', 'use_snp_selection': True, 'num_snps': 45058}. Best is trial 32 with value: 0.13515378067215644.
[I 2025-12-05 14:28:01,530] Trial 90 finished with value: 0.10777487681071041 and parameters: {'model_type': 'mlp', 'hidden_dims': '[128, 64]', 'dropout': 0.1315739439957134, 'batch_norm': False, 'lr': 0.00021203801630754871, 'weight_decay': 1.3041418414885172e-05, 'epochs': 151, 'loss': 'mse', 'optimizer': 'adam', 'graph_mode': 'off', 'use_snp_selection': False}. Best is trial 32 with value: 0.13515378067215644.
[I 2025-12-05 14:28:02,548] Trial 91 finished with value: 0.09986202654860143 and parameters: {'model_type': 'mlp', 'hidden_dims': '[256, 128, 64]', 'dropout': 0.29080662214646885, 'batch_norm': False, 'lr': 0.00015238743316962224, 'weight_decay': 7.455337334896211e-05, 'epochs': 145, 'loss': 'mse', 'optimizer': 'adam', 'graph_mode': 'off', 'use_snp_selection': False}. Best is trial 32 with value: 0.13515378067215644.
[I 2025-12-05 14:28:03,538] Trial 92 finished with value: 0.099382455722195 and parameters: {'model_type': 'mlp', 'hidden_dims': '[256, 128, 64]', 'dropout': 0.30978581052933396, 'batch_norm': False, 'lr': 0.00011914642954295611, 'weight_decay': 0.00013560934311126455, 'epochs': 139, 'loss': 'mse', 'optimizer': 'adam', 'graph_mode': 'off', 'use_snp_selection': False}. Best is trial 32 with value: 0.13515378067215644.
[I 2025-12-05 14:28:04,578] Trial 93 finished with value: 0.09816770760240058 and parameters: {'model_type': 'mlp', 'hidden_dims': '[256, 128, 64]', 'dropout': 0.3299708411902782, 'batch_norm': False, 'lr': 3.18383219485886e-05, 'weight_decay': 9.065188637598752e-05, 'epochs': 159, 'loss': 'mse', 'optimizer': 'adam', 'graph_mode': 'off', 'use_snp_selection': False}. Best is trial 32 with value: 0.13515378067215644.
[I 2025-12-05 14:28:05,655] Trial 94 finished with value: 0.08469316008348007 and parameters: {'model_type': 'mlp', 'hidden_dims': '[256, 128, 64]', 'dropout': 0.3702507769664947, 'batch_norm': False, 'lr': 5.325885226229853e-05, 'weight_decay': 8.064487499186008e-06, 'epochs': 173, 'loss': 'mse', 'optimizer': 'adam', 'graph_mode': 'off', 'use_snp_selection': False}. Best is trial 32 with value: 0.13515378067215644.
[I 2025-12-05 14:28:06,483] Trial 95 finished with value: 0.1193389686086183 and parameters: {'model_type': 'mlp', 'hidden_dims': '[128, 64]', 'dropout': 0.11916065964380676, 'batch_norm': False, 'lr': 0.00014621202164419469, 'weight_decay': 0.0003350603424696544, 'epochs': 184, 'loss': 'mse', 'optimizer': 'adam', 'graph_mode': 'off', 'use_snp_selection': False}. Best is trial 32 with value: 0.13515378067215644.
[I 2025-12-05 14:28:07,314] Trial 96 finished with value: 0.12308845961472718 and parameters: {'model_type': 'mlp', 'hidden_dims': '[128, 64]', 'dropout': 0.15187046983355967, 'batch_norm': False, 'lr': 0.0002001102412741325, 'weight_decay': 0.0002759484344017081, 'epochs': 182, 'loss': 'mse', 'optimizer': 'adam', 'graph_mode': 'off', 'use_snp_selection': False}. Best is trial 32 with value: 0.13515378067215644.
[I 2025-12-05 14:28:08,175] Trial 97 finished with value: 0.10418774137757808 and parameters: {'model_type': 'mlp', 'hidden_dims': '[128, 64]', 'dropout': 0.1469998802625936, 'batch_norm': False, 'lr': 3.803691731662481e-05, 'weight_decay': 1.237975518073241e-06, 'epochs': 210, 'loss': 'mse', 'optimizer': 'adam', 'graph_mode': 'off', 'use_snp_selection': False}. Best is trial 32 with value: 0.13515378067215644.
[I 2025-12-05 14:28:09,027] Trial 98 finished with value: 0.13062094993869505 and parameters: {'model_type': 'mlp', 'hidden_dims': '[128, 64]', 'dropout': 0.16108972887922174, 'batch_norm': False, 'lr': 0.00019393617997208343, 'weight_decay': 0.0005829473134780328, 'epochs': 195, 'loss': 'mse', 'optimizer': 'adam', 'graph_mode': 'off', 'use_snp_selection': False}. Best is trial 32 with value: 0.13515378067215644.
[I 2025-12-05 14:28:09,775] Trial 99 finished with value: 0.07213165569106966 and parameters: {'model_type': 'mlp', 'hidden_dims': '[128, 64]', 'dropout': 0.15729825567857583, 'batch_norm': True, 'lr': 0.0001901991483542238, 'weight_decay': 0.0005469826863670576, 'epochs': 119, 'loss': 'mse', 'optimizer': 'adam', 'graph_mode': 'off', 'use_snp_selection': False}. Best is trial 32 with value: 0.13515378067215644.
[I 2025-12-05 14:28:11,384] Trial 100 finished with value: 0.08904551018015043 and parameters: {'model_type': 'mlp', 'hidden_dims': '[512, 64]', 'dropout': 0.22441664933222571, 'batch_norm': False, 'lr': 0.000312338681149906, 'weight_decay': 0.0007572185094770145, 'epochs': 192, 'loss': 'mae', 'optimizer': 'adam', 'graph_mode': 'off', 'use_snp_selection': False}. Best is trial 32 with value: 0.13515378067215644.
[I 2025-12-05 14:28:12,258] Trial 101 finished with value: 0.1275933950611302 and parameters: {'model_type': 'mlp', 'hidden_dims': '[128, 64]', 'dropout': 0.18052371872224163, 'batch_norm': False, 'lr': 1.2696787490635359e-05, 'weight_decay': 0.0006961163579497906, 'epochs': 220, 'loss': 'mse', 'optimizer': 'adam', 'graph_mode': 'off', 'use_snp_selection': False}. Best is trial 32 with value: 0.13515378067215644.
[I 2025-12-05 14:28:13,106] Trial 102 finished with value: 0.10562642482111943 and parameters: {'model_type': 'mlp', 'hidden_dims': '[128, 64]', 'dropout': 0.17836453259713267, 'batch_norm': False, 'lr': 1.2203181430100513e-05, 'weight_decay': 0.0007661933458119826, 'epochs': 200, 'loss': 'mse', 'optimizer': 'adam', 'graph_mode': 'off', 'use_snp_selection': False}. Best is trial 32 with value: 0.13515378067215644.
[I 2025-12-05 14:28:13,981] Trial 103 finished with value: 0.1022827453634638 and parameters: {'model_type': 'mlp', 'hidden_dims': '[128, 64]', 'dropout': 0.1979164557105009, 'batch_norm': False, 'lr': 8.871187215826521e-06, 'weight_decay': 0.00030773389078395975, 'epochs': 219, 'loss': 'mse', 'optimizer': 'adam', 'graph_mode': 'off', 'use_snp_selection': False}. Best is trial 32 with value: 0.13515378067215644.
[I 2025-12-05 14:28:14,869] Trial 104 finished with value: 0.09329216029743372 and parameters: {'model_type': 'mlp', 'hidden_dims': '[128, 64]', 'dropout': 0.16925410861941934, 'batch_norm': False, 'lr': 1.736515338248938e-05, 'weight_decay': 0.0006259552003883731, 'epochs': 227, 'loss': 'mse', 'optimizer': 'adam', 'graph_mode': 'off', 'use_snp_selection': False}. Best is trial 32 with value: 0.13515378067215644.
