[I 2025-12-05 14:49:53,502] Trial 122 finished with value: 0.10848475244259975 and parameters: {'model_type': 'mlp', 'hidden_dims': '[512, 256]', 'dropout': 0.39116227926590996, 'batch_norm': True, 'lr': 0.0009746175216956689, 'weight_decay': 0.0009753556341856119, 'epochs': 277, 'loss': 'mae', 'optimizer': 'adam', 'graph_mode': 'off', 'use_snp_selection': True, 'num_snps': 20333}. Best is trial 23 with value: 0.13083647489442385.
[I 2025-12-05 14:49:55,703] Trial 123 finished with value: 0.0960660203310401 and parameters: {'model_type': 'mlp', 'hidden_dims': '[512, 256]', 'dropout': 0.32699630300606514, 'batch_norm': False, 'lr': 0.0008078964704275496, 'weight_decay': 0.0007659372180637185, 'epochs': 196, 'loss': 'mae', 'optimizer': 'adam', 'graph_mode': 'off', 'use_snp_selection': True, 'num_snps': 29302}. Best is trial 23 with value: 0.13083647489442385.
[I 2025-12-05 14:49:57,693] Trial 124 finished with value: 0.12412369074540333 and parameters: {'model_type': 'mlp', 'hidden_dims': '[512, 256]', 'dropout': 0.315512958750642, 'batch_norm': True, 'lr': 0.0003814308072063585, 'weight_decay': 0.0006414272469987016, 'epochs': 243, 'loss': 'mae', 'optimizer': 'adam', 'graph_mode': 'off', 'use_snp_selection': True, 'num_snps': 23217}. Best is trial 23 with value: 0.13083647489442385.
[I 2025-12-05 14:49:59,604] Trial 125 finished with value: 0.06127823751061201 and parameters: {'model_type': 'mlp', 'hidden_dims': '[512, 256]', 'dropout': 0.2703379458193512, 'batch_norm': True, 'lr': 1.3357169488740265e-05, 'weight_decay': 0.0006379944310293448, 'epochs': 245, 'loss': 'mae', 'optimizer': 'adam', 'graph_mode': 'off', 'use_snp_selection': True, 'num_snps': 22714}. Best is trial 23 with value: 0.13083647489442385.
[I 2025-12-05 14:50:03,069] Trial 126 finished with value: 0.11262078828558855 and parameters: {'model_type': 'mlp', 'hidden_dims': '[512, 128]', 'dropout': 0.30266189680725286, 'batch_norm': True, 'lr': 0.0003946918833500024, 'weight_decay': 0.00038083159041634487, 'epochs': 256, 'loss': 'mse', 'optimizer': 'adam', 'graph_mode': 'off', 'use_snp_selection': True, 'num_snps': 50622}. Best is trial 23 with value: 0.13083647489442385.
[I 2025-12-05 14:50:05,202] Trial 127 finished with value: 0.10998402397870491 and parameters: {'model_type': 'mlp', 'hidden_dims': '[512, 256]', 'dropout': 0.1273455068924411, 'batch_norm': True, 'lr': 0.0005415245465243896, 'weight_decay': 7.687992181229412e-06, 'epochs': 239, 'loss': 'mae', 'optimizer': 'adam', 'graph_mode': 'off', 'use_snp_selection': False}. Best is trial 23 with value: 0.13083647489442385.
[I 2025-12-05 14:50:07,653] Trial 128 finished with value: 0.09351073125550655 and parameters: {'model_type': 'mlp', 'hidden_dims': '[512, 64]', 'dropout': 0.3448197103137761, 'batch_norm': False, 'lr': 0.0006220873021240454, 'weight_decay': 0.0004551800823218775, 'epochs': 211, 'loss': 'mse', 'optimizer': 'adam', 'graph_mode': 'off', 'use_snp_selection': True, 'num_snps': 33246}. Best is trial 23 with value: 0.13083647489442385.
[I 2025-12-05 14:50:08,746] Trial 129 finished with value: 0.09785148433566512 and parameters: {'model_type': 'mlp', 'hidden_dims': '[256, 128]', 'dropout': 0.36898564769883674, 'batch_norm': False, 'lr': 2.5713798570736484e-05, 'weight_decay': 4.282768319733975e-05, 'epochs': 164, 'loss': 'mse', 'optimizer': 'adam', 'graph_mode': 'off', 'use_snp_selection': False}. Best is trial 23 with value: 0.13083647489442385.
[I 2025-12-05 14:50:10,212] Trial 130 finished with value: 0.10930677114843813 and parameters: {'model_type': 'mlp', 'hidden_dims': '[256, 128, 64]', 'dropout': 0.28600660065384775, 'batch_norm': False, 'lr': 0.00010512716537234822, 'weight_decay': 1.0057357633576401e-07, 'epochs': 229, 'loss': 'mse', 'optimizer': 'adam', 'graph_mode': 'off', 'use_snp_selection': True, 'num_snps': 15652}. Best is trial 23 with value: 0.13083647489442385.
[I 2025-12-05 14:50:11,945] Trial 131 finished with value: 0.07065928674074795 and parameters: {'model_type': 'mlp', 'hidden_dims': '[512, 256]', 'dropout': 0.3190772893305554, 'batch_norm': True, 'lr': 3.2033851387890855e-05, 'weight_decay': 0.0008478543297979425, 'epochs': 285, 'loss': 'mae', 'optimizer': 'adam', 'graph_mode': 'off', 'use_snp_selection': True, 'num_snps': 18049}. Best is trial 23 with value: 0.13083647489442385.
[I 2025-12-05 14:50:13,368] Trial 132 finished with value: 0.10064146313547817 and parameters: {'model_type': 'mlp', 'hidden_dims': '[512, 256]', 'dropout': 0.3344977055178537, 'batch_norm': True, 'lr': 0.0007056879651746279, 'weight_decay': 0.0004995500727768363, 'epochs': 273, 'loss': 'mae', 'optimizer': 'adam', 'graph_mode': 'off', 'use_snp_selection': True, 'num_snps': 12413}. Best is trial 23 with value: 0.13083647489442385.
[I 2025-12-05 14:50:15,117] Trial 133 finished with value: 0.11799480373388173 and parameters: {'model_type': 'mlp', 'hidden_dims': '[512, 256]', 'dropout': 0.35593979786624225, 'batch_norm': True, 'lr': 0.00029583738887787697, 'weight_decay': 0.0005444561964628673, 'epochs': 262, 'loss': 'mae', 'optimizer': 'adam', 'graph_mode': 'off', 'use_snp_selection': True, 'num_snps': 18908}. Best is trial 23 with value: 0.13083647489442385.
[I 2025-12-05 14:50:17,190] Trial 134 finished with value: 0.11550537243250342 and parameters: {'model_type': 'mlp', 'hidden_dims': '[512, 256]', 'dropout': 0.38612830301476014, 'batch_norm': True, 'lr': 0.0009764654543677021, 'weight_decay': 0.00030234637640237075, 'epochs': 250, 'loss': 'mae', 'optimizer': 'adam', 'graph_mode': 'off', 'use_snp_selection': True, 'num_snps': 25038}. Best is trial 23 with value: 0.13083647489442385.
[I 2025-12-05 14:50:19,082] Trial 135 finished with value: 0.1315061961065276 and parameters: {'model_type': 'mlp', 'hidden_dims': '[512, 256]', 'dropout': 0.30633744867215235, 'batch_norm': True, 'lr': 0.00046404842255569123, 'weight_decay': 4.374101075545949e-06, 'epochs': 189, 'loss': 'mae', 'optimizer': 'adam', 'graph_mode': 'off', 'use_snp_selection': True, 'num_snps': 22047}. Best is trial 135 with value: 0.1315061961065276.
[I 2025-12-05 14:50:20,261] Trial 136 finished with value: 0.11688947527035075 and parameters: {'model_type': 'mlp', 'hidden_dims': '[256, 128]', 'dropout': 0.4762469876221724, 'batch_norm': True, 'lr': 0.00044776936726226974, 'weight_decay': 5.576366438044733e-07, 'epochs': 185, 'loss': 'mae', 'optimizer': 'adam', 'graph_mode': 'off', 'use_snp_selection': False}. Best is trial 135 with value: 0.1315061961065276.
[I 2025-12-05 14:50:22,076] Trial 137 finished with value: 0.10107377234925687 and parameters: {'model_type': 'mlp', 'hidden_dims': '[512, 256]', 'dropout': 0.4376107105921358, 'batch_norm': False, 'lr': 0.0005049572084732798, 'weight_decay': 4.967128291099063e-06, 'epochs': 174, 'loss': 'mse', 'optimizer': 'adam', 'graph_mode': 'off', 'use_snp_selection': True, 'num_snps': 23221}. Best is trial 135 with value: 0.1315061961065276.
[I 2025-12-05 14:50:23,119] Trial 138 finished with value: 0.11397142587433458 and parameters: {'model_type': 'mlp', 'hidden_dims': '[256, 128]', 'dropout': 0.2794082704365696, 'batch_norm': True, 'lr': 0.00037583540808752404, 'weight_decay': 3.510910896095122e-06, 'epochs': 154, 'loss': 'mse', 'optimizer': 'adam', 'graph_mode': 'off', 'use_snp_selection': False}. Best is trial 135 with value: 0.1315061961065276.
[I 2025-12-05 14:50:24,004] Trial 139 finished with value: 0.08924170949087545 and parameters: {'model_type': 'mlp', 'hidden_dims': '[128, 64]', 'dropout': 0.30628204575524165, 'batch_norm': False, 'lr': 1.9050553097846558e-05, 'weight_decay': 1.149309105007945e-06, 'epochs': 221, 'loss': 'mae', 'optimizer': 'adam', 'graph_mode': 'off', 'use_snp_selection': False}. Best is trial 135 with value: 0.1315061961065276.
[I 2025-12-05 14:50:25,711] Trial 140 finished with value: 0.08549389848840465 and parameters: {'model_type': 'mlp', 'hidden_dims': '[512, 128]', 'dropout': 0.4029554103670554, 'batch_norm': False, 'lr': 1.1056025258698454e-05, 'weight_decay': 2.763046522485649e-06, 'epochs': 192, 'loss': 'mse', 'optimizer': 'adam', 'graph_mode': 'off', 'use_snp_selection': True, 'num_snps': 21015}. Best is trial 135 with value: 0.1315061961065276.
[I 2025-12-05 14:50:27,210] Trial 141 finished with value: 0.11127987179642032 and parameters: {'model_type': 'mlp', 'hidden_dims': '[512, 256]', 'dropout': 0.31175038308521585, 'batch_norm': True, 'lr': 0.0008786363515199435, 'weight_decay': 0.0006538063002663128, 'epochs': 200, 'loss': 'mae', 'optimizer': 'adam', 'graph_mode': 'off', 'use_snp_selection': True, 'num_snps': 15823}. Best is trial 135 with value: 0.1315061961065276.
[I 2025-12-05 14:50:29,740] Trial 142 finished with value: 0.11775558868690666 and parameters: {'model_type': 'mlp', 'hidden_dims': '[512, 256]', 'dropout': 0.33964276746676186, 'batch_norm': True, 'lr': 0.0002616100167675517, 'weight_decay': 8.405238702255845e-07, 'epochs': 291, 'loss': 'mae', 'optimizer': 'adam', 'graph_mode': 'off', 'use_snp_selection': True, 'num_snps': 29795}. Best is trial 135 with value: 0.1315061961065276.
[I 2025-12-05 14:50:33,555] Trial 143 finished with value: 0.11663864818507896 and parameters: {'model_type': 'mlp', 'hidden_dims': '[512, 256]', 'dropout': 0.2955525400681437, 'batch_norm': True, 'lr': 0.0006136585485188869, 'weight_decay': 4.599346617327948e-06, 'epochs': 207, 'loss': 'mae', 'optimizer': 'adam', 'graph_mode': 'off', 'use_snp_selection': True, 'num_snps': 58129}. Best is trial 135 with value: 0.1315061961065276.
[I 2025-12-05 14:50:34,693] Trial 144 finished with value: 0.0766716102910298 and parameters: {'model_type': 'mlp', 'hidden_dims': '[512, 256]', 'dropout': 0.33025828109056005, 'batch_norm': True, 'lr': 0.0008102132148910974, 'weight_decay': 6.297307566386988e-06, 'epochs': 268, 'loss': 'mae', 'optimizer': 'adam', 'graph_mode': 'off', 'use_snp_selection': True, 'num_snps': 2068}. Best is trial 135 with value: 0.1315061961065276.
[I 2025-12-05 14:50:36,093] Trial 145 finished with value: 0.11014985318350809 and parameters: {'model_type': 'mlp', 'hidden_dims': '[512, 256]', 'dropout': 0.3650440269436054, 'batch_norm': True, 'lr': 0.0007262266713283983, 'weight_decay': 0.00023661582315792217, 'epochs': 282, 'loss': 'mae', 'optimizer': 'adam', 'graph_mode': 'off', 'use_snp_selection': True, 'num_snps': 10324}. Best is trial 135 with value: 0.1315061961065276.
[I 2025-12-05 14:50:37,299] Trial 146 finished with value: 0.10294617670897113 and parameters: {'model_type': 'mlp', 'hidden_dims': '[256, 128]', 'dropout': 0.32273713771848944, 'batch_norm': False, 'lr': 2.3586205543042294e-05, 'weight_decay': 0.00015114428942584885, 'epochs': 215, 'loss': 'mse', 'optimizer': 'adam', 'graph_mode': 'off', 'use_snp_selection': False}. Best is trial 135 with value: 0.1315061961065276.
[I 2025-12-05 14:50:39,572] Trial 147 finished with value: 0.07739645213267517 and parameters: {'model_type': 'mlp', 'hidden_dims': '[512, 64]', 'dropout': 0.5854541189420855, 'batch_norm': True, 'lr': 2.834323500782216e-05, 'weight_decay': 1.2671035074676207e-05, 'epochs': 299, 'loss': 'mse', 'optimizer': 'adam', 'graph_mode': 'off', 'use_snp_selection': True, 'num_snps': 27245}. Best is trial 135 with value: 0.1315061961065276.
[I 2025-12-05 14:50:40,884] Trial 148 finished with value: 0.09778194941258511 and parameters: {'model_type': 'mlp', 'hidden_dims': '[256, 128, 64]', 'dropout': 0.34616002925858497, 'batch_norm': False, 'lr': 0.000159377940010418, 'weight_decay': 9.222822429135834e-06, 'epochs': 236, 'loss': 'mae', 'optimizer': 'adam', 'graph_mode': 'off', 'use_snp_selection': False}. Best is trial 135 with value: 0.1315061961065276.
[I 2025-12-05 14:50:42,063] Trial 149 finished with value: 0.11305121057235085 and parameters: {'model_type': 'mlp', 'hidden_dims': '[256, 128]', 'dropout': 0.3772364692474178, 'batch_norm': False, 'lr': 1.7161189442000404e-05, 'weight_decay': 0.0008373934321403354, 'epochs': 190, 'loss': 'mse', 'optimizer': 'adam', 'graph_mode': 'off', 'use_snp_selection': False}. Best is trial 135 with value: 0.1315061961065276.
[I 2025-12-05 14:50:44,495] Trial 0 finished with value: -0.015743438220333257 and parameters: {'model_type': 'mlp', 'hidden_dims': '[128, 64]', 'dropout': 0.199031432379812, 'batch_norm': True, 'lr': 1.8408544111075837e-06, 'weight_decay': 5.5136510071208614e-05, 'epochs': 336, 'loss': 'mae', 'optimizer': 'adam', 'graph_mode': 'off', 'use_snp_selection': True, 'num_snps': 43862}. Best is trial 0 with value: -0.015743438220333257.
[I 2025-12-05 14:50:45,739] Trial 1 finished with value: 0.027934070159991546 and parameters: {'model_type': 'mlp', 'hidden_dims': '[256, 128]', 'dropout': 0.4370668075331726, 'batch_norm': True, 'lr': 7.133471581159139e-05, 'weight_decay': 1.128633586803549e-05, 'epochs': 242, 'loss': 'mae', 'optimizer': 'adam', 'graph_mode': 'off', 'use_snp_selection': False}. Best is trial 1 with value: 0.027934070159991546.
[I 2025-12-05 14:50:46,923] Trial 2 finished with value: -0.001094590988044376 and parameters: {'model_type': 'mlp', 'hidden_dims': '[256, 128, 64]', 'dropout': 0.41314357415569625, 'batch_norm': False, 'lr': 3.952233718592101e-06, 'weight_decay': 0.00026754769258252603, 'epochs': 149, 'loss': 'mse', 'optimizer': 'adam', 'graph_mode': 'off', 'use_snp_selection': True, 'num_snps': 11571}. Best is trial 1 with value: 0.027934070159991546.
[I 2025-12-05 14:50:49,116] Trial 3 finished with value: 0.02634447654475987 and parameters: {'model_type': 'mlp', 'hidden_dims': '[512, 64]', 'dropout': 0.5938127374509361, 'batch_norm': False, 'lr': 5.67704586114731e-06, 'weight_decay': 2.4518087630137052e-05, 'epochs': 320, 'loss': 'mae', 'optimizer': 'adam', 'graph_mode': 'off', 'use_snp_selection': False}. Best is trial 1 with value: 0.027934070159991546.
[I 2025-12-05 14:50:51,726] Trial 4 finished with value: 0.03505763346835983 and parameters: {'model_type': 'mlp', 'hidden_dims': '[512, 128]', 'dropout': 0.25746343592134413, 'batch_norm': True, 'lr': 1.3467657668402788e-06, 'weight_decay': 0.00033087251918647806, 'epochs': 277, 'loss': 'mse', 'optimizer': 'adam', 'graph_mode': 'off', 'use_snp_selection': True, 'num_snps': 36675}. Best is trial 4 with value: 0.03505763346835983.
[I 2025-12-05 14:50:53,752] Trial 5 finished with value: 0.018607449514160757 and parameters: {'model_type': 'mlp', 'hidden_dims': '[512, 64]', 'dropout': 0.38275350994408375, 'batch_norm': True, 'lr': 1.5586664309232824e-06, 'weight_decay': 0.0008227664668621182, 'epochs': 145, 'loss': 'mae', 'optimizer': 'adam', 'graph_mode': 'off', 'use_snp_selection': True, 'num_snps': 32148}. Best is trial 4 with value: 0.03505763346835983.
[I 2025-12-05 14:50:54,876] Trial 6 finished with value: 0.027814021724755 and parameters: {'model_type': 'mlp', 'hidden_dims': '[256, 128]', 'dropout': 0.3930109900265879, 'batch_norm': False, 'lr': 4.892964372128395e-05, 'weight_decay': 1.5809549317992182e-06, 'epochs': 199, 'loss': 'mse', 'optimizer': 'adam', 'graph_mode': 'off', 'use_snp_selection': False}. Best is trial 4 with value: 0.03505763346835983.
[I 2025-12-05 14:50:56,068] Trial 7 finished with value: 0.04229040321643808 and parameters: {'model_type': 'mlp', 'hidden_dims': '[512, 256]', 'dropout': 0.15343979219678458, 'batch_norm': True, 'lr': 6.234003099047341e-05, 'weight_decay': 3.894760610535477e-07, 'epochs': 97, 'loss': 'mse', 'optimizer': 'adam', 'graph_mode': 'off', 'use_snp_selection': False}. Best is trial 7 with value: 0.04229040321643808.
[I 2025-12-05 14:50:58,261] Trial 8 finished with value: 0.02897178905800414 and parameters: {'model_type': 'mlp', 'hidden_dims': '[512, 128]', 'dropout': 0.10743001231661406, 'batch_norm': True, 'lr': 0.00023728538449271062, 'weight_decay': 1.7629071578048637e-05, 'epochs': 312, 'loss': 'mae', 'optimizer': 'adam', 'graph_mode': 'off', 'use_snp_selection': False}. Best is trial 7 with value: 0.04229040321643808.
[I 2025-12-05 14:50:59,829] Trial 9 finished with value: 0.01777590095899975 and parameters: {'model_type': 'mlp', 'hidden_dims': '[512, 64]', 'dropout': 0.14505336736221927, 'batch_norm': True, 'lr': 5.8619638388111826e-05, 'weight_decay': 6.200156172669308e-07, 'epochs': 175, 'loss': 'mse', 'optimizer': 'adam', 'graph_mode': 'off', 'use_snp_selection': False}. Best is trial 7 with value: 0.04229040321643808.
[I 2025-12-05 14:51:00,747] Trial 10 finished with value: 0.019828221335492554 and parameters: {'model_type': 'mlp', 'hidden_dims': '[512, 256]', 'dropout': 0.2736992815328032, 'batch_norm': False, 'lr': 0.00032393778075602147, 'weight_decay': 1.1511946696017092e-07, 'epochs': 41, 'loss': 'mse', 'optimizer': 'adam', 'graph_mode': 'off', 'use_snp_selection': False}. Best is trial 7 with value: 0.04229040321643808.
[I 2025-12-05 14:51:03,754] Trial 11 finished with value: 0.026896506288944397 and parameters: {'model_type': 'mlp', 'hidden_dims': '[512, 128]', 'dropout': 0.2623643428657267, 'batch_norm': True, 'lr': 1.533469452994329e-05, 'weight_decay': 2.0596806983850726e-06, 'epochs': 77, 'loss': 'mse', 'optimizer': 'adam', 'graph_mode': 'off', 'use_snp_selection': True, 'num_snps': 59915}. Best is trial 7 with value: 0.04229040321643808.
[I 2025-12-05 14:51:05,013] Trial 12 finished with value: 0.03036929441330405 and parameters: {'model_type': 'mlp', 'hidden_dims': '[512, 256]', 'dropout': 0.25807641507477735, 'batch_norm': True, 'lr': 0.0008000655871733662, 'weight_decay': 1.0259745923634681e-07, 'epochs': 258, 'loss': 'mse', 'optimizer': 'adam', 'graph_mode': 'off', 'use_snp_selection': True, 'num_snps': 8741}. Best is trial 7 with value: 0.04229040321643808.
[I 2025-12-05 14:51:06,778] Trial 13 finished with value: 0.021728016122364278 and parameters: {'model_type': 'mlp', 'hidden_dims': '[512, 256]', 'dropout': 0.1930659080005594, 'batch_norm': True, 'lr': 1.6270445776492303e-05, 'weight_decay': 0.00012560873309796632, 'epochs': 110, 'loss': 'mse', 'optimizer': 'adam', 'graph_mode': 'off', 'use_snp_selection': True, 'num_snps': 28162}. Best is trial 7 with value: 0.04229040321643808.
[I 2025-12-05 14:51:08,713] Trial 14 finished with value: 0.0334961213822159 and parameters: {'model_type': 'mlp', 'hidden_dims': '[512, 128]', 'dropout': 0.31062099212656447, 'batch_norm': True, 'lr': 0.0001413832908566095, 'weight_decay': 3.3175944679884834e-06, 'epochs': 252, 'loss': 'mse', 'optimizer': 'adam', 'graph_mode': 'off', 'use_snp_selection': False}. Best is trial 7 with value: 0.04229040321643808.
[I 2025-12-05 14:51:11,101] Trial 15 finished with value: 0.023971308316920764 and parameters: {'model_type': 'mlp', 'hidden_dims': '[128, 64]', 'dropout': 0.19854270091213388, 'batch_norm': True, 'lr': 1.544404094249274e-05, 'weight_decay': 5.249844431645073e-07, 'epochs': 284, 'loss': 'mse', 'optimizer': 'adam', 'graph_mode': 'off', 'use_snp_selection': True, 'num_snps': 45389}. Best is trial 7 with value: 0.04229040321643808.
[I 2025-12-05 14:51:12,335] Trial 16 finished with value: 0.00678868694557912 and parameters: {'model_type': 'mlp', 'hidden_dims': '[256, 128, 64]', 'dropout': 0.10718099317830179, 'batch_norm': True, 'lr': 4.820472307986099e-06, 'weight_decay': 0.0007506786497695699, 'epochs': 222, 'loss': 'mse', 'optimizer': 'adam', 'graph_mode': 'off', 'use_snp_selection': False}. Best is trial 7 with value: 0.04229040321643808.
[I 2025-12-05 14:51:14,008] Trial 17 finished with value: -0.024951580269268286 and parameters: {'model_type': 'mlp', 'hidden_dims': '[512, 128]', 'dropout': 0.4978127166512159, 'batch_norm': True, 'lr': 1.0138541947475892e-06, 'weight_decay': 6.096638592570255e-06, 'epochs': 107, 'loss': 'mse', 'optimizer': 'adam', 'graph_mode': 'off', 'use_snp_selection': True, 'num_snps': 25400}. Best is trial 7 with value: 0.04229040321643808.
[I 2025-12-05 14:51:17,085] Trial 18 finished with value: 0.01800657709157573 and parameters: {'model_type': 'mlp', 'hidden_dims': '[512, 256]', 'dropout': 0.31964330750999637, 'batch_norm': False, 'lr': 2.6615913728336986e-05, 'weight_decay': 4.301765474639332e-07, 'epochs': 286, 'loss': 'mse', 'optimizer': 'adam', 'graph_mode': 'off', 'use_snp_selection': True, 'num_snps': 43778}. Best is trial 7 with value: 0.04229040321643808.
[I 2025-12-05 14:51:18,788] Trial 19 finished with value: 0.02007622917594827 and parameters: {'model_type': 'mlp', 'hidden_dims': '[512, 128]', 'dropout': 0.16803181016244945, 'batch_norm': True, 'lr': 0.00013847822027307616, 'weight_decay': 0.00020846015481649854, 'epochs': 188, 'loss': 'mse', 'optimizer': 'adam', 'graph_mode': 'off', 'use_snp_selection': False}. Best is trial 7 with value: 0.04229040321643808.
[I 2025-12-05 14:51:19,717] Trial 20 finished with value: -0.002864616354627456 and parameters: {'model_type': 'mlp', 'hidden_dims': '[512, 256]', 'dropout': 0.23532633731657354, 'batch_norm': True, 'lr': 8.403949108231083e-06, 'weight_decay': 4.530970896402522e-05, 'epochs': 48, 'loss': 'mse', 'optimizer': 'adam', 'graph_mode': 'off', 'use_snp_selection': False}. Best is trial 7 with value: 0.04229040321643808.
[I 2025-12-05 14:51:21,754] Trial 21 finished with value: 0.03819937481400051 and parameters: {'model_type': 'mlp', 'hidden_dims': '[512, 128]', 'dropout': 0.2984493919507456, 'batch_norm': True, 'lr': 0.00012494186908621662, 'weight_decay': 3.874324776853865e-06, 'epochs': 272, 'loss': 'mse', 'optimizer': 'adam', 'graph_mode': 'off', 'use_snp_selection': False}. Best is trial 7 with value: 0.04229040321643808.
[I 2025-12-05 14:51:23,830] Trial 22 finished with value: 0.036723443187437886 and parameters: {'model_type': 'mlp', 'hidden_dims': '[512, 128]', 'dropout': 0.3330412066246554, 'batch_norm': True, 'lr': 0.00011140724096605452, 'weight_decay': 2.4967409861885564e-07, 'epochs': 286, 'loss': 'mse', 'optimizer': 'adam', 'graph_mode': 'off', 'use_snp_selection': False}. Best is trial 7 with value: 0.04229040321643808.
