[I 2025-12-06 07:39:20,273] Trial 135 finished with value: 0.24277162854443754 and parameters: {'model_type': 'mlp', 'hidden_dims': '[512, 64]', 'dropout': 0.16540676974627058, 'batch_norm': True, 'lr': 4.6867903680115083e-05, 'weight_decay': 2.6222940011410878e-06, 'epochs': 308, 'loss': 'mae', 'optimizer': 'adam', 'graph_mode': 'off', 'use_snp_selection': False}. Best is trial 134 with value: 0.2558381167454596.
[I 2025-12-06 07:40:50,398] Trial 136 finished with value: 0.24396272371486677 and parameters: {'model_type': 'mlp', 'hidden_dims': '[512, 64]', 'dropout': 0.2012060577023541, 'batch_norm': True, 'lr': 9.05922948462505e-05, 'weight_decay': 2.111583062451929e-06, 'epochs': 299, 'loss': 'mae', 'optimizer': 'adam', 'graph_mode': 'off', 'use_snp_selection': False}. Best is trial 134 with value: 0.2558381167454596.
[I 2025-12-06 07:42:22,229] Trial 137 finished with value: 0.24552364725917694 and parameters: {'model_type': 'mlp', 'hidden_dims': '[512, 64]', 'dropout': 0.1780413539277547, 'batch_norm': True, 'lr': 3.787501279347114e-05, 'weight_decay': 2.490368200971553e-07, 'epochs': 305, 'loss': 'mae', 'optimizer': 'adam', 'graph_mode': 'off', 'use_snp_selection': False}. Best is trial 134 with value: 0.2558381167454596.
[I 2025-12-06 07:43:58,765] Trial 138 finished with value: 0.24103621342457307 and parameters: {'model_type': 'mlp', 'hidden_dims': '[512, 64]', 'dropout': 0.14397068449275588, 'batch_norm': True, 'lr': 3.2964830358161046e-05, 'weight_decay': 3.2506461684907358e-06, 'epochs': 322, 'loss': 'mae', 'optimizer': 'adam', 'graph_mode': 'off', 'use_snp_selection': False}. Best is trial 134 with value: 0.2558381167454596.
[I 2025-12-06 07:45:31,111] Trial 139 finished with value: 0.2366254271931977 and parameters: {'model_type': 'mlp', 'hidden_dims': '[512, 64]', 'dropout': 0.15664441872608031, 'batch_norm': False, 'lr': 5.9396712140397174e-05, 'weight_decay': 4.104874413139077e-06, 'epochs': 315, 'loss': 'mae', 'optimizer': 'adam', 'graph_mode': 'off', 'use_snp_selection': False}. Best is trial 134 with value: 0.2558381167454596.
[I 2025-12-06 07:47:10,959] Trial 140 finished with value: 0.23914568717300236 and parameters: {'model_type': 'mlp', 'hidden_dims': '[512, 64]', 'dropout': 0.1919293173773398, 'batch_norm': True, 'lr': 2.5202965038294654e-05, 'weight_decay': 3.382337149618224e-07, 'epochs': 334, 'loss': 'mae', 'optimizer': 'adam', 'graph_mode': 'off', 'use_snp_selection': False}. Best is trial 134 with value: 0.2558381167454596.
[I 2025-12-06 07:48:14,202] Trial 141 finished with value: 0.2412492172572603 and parameters: {'model_type': 'mlp', 'hidden_dims': '[512, 256]', 'dropout': 0.13074437102417036, 'batch_norm': True, 'lr': 5.29726975061367e-05, 'weight_decay': 5.121767177165211e-07, 'epochs': 201, 'loss': 'mae', 'optimizer': 'adam', 'graph_mode': 'off', 'use_snp_selection': False}. Best is trial 134 with value: 0.2558381167454596.
[I 2025-12-06 07:49:43,834] Trial 142 finished with value: 0.23941803287349192 and parameters: {'model_type': 'mlp', 'hidden_dims': '[512, 128]', 'dropout': 0.12619722761525226, 'batch_norm': True, 'lr': 4.1300660687056016e-05, 'weight_decay': 1.5228894962293309e-06, 'epochs': 297, 'loss': 'mae', 'optimizer': 'adam', 'graph_mode': 'off', 'use_snp_selection': False}. Best is trial 134 with value: 0.2558381167454596.
[I 2025-12-06 07:50:17,427] Trial 143 finished with value: 0.23185785611308546 and parameters: {'model_type': 'mlp', 'hidden_dims': '[512, 64]', 'dropout': 0.14601684315686825, 'batch_norm': True, 'lr': 3.0265774772730888e-05, 'weight_decay': 5.283542966543947e-06, 'epochs': 95, 'loss': 'mae', 'optimizer': 'adam', 'graph_mode': 'off', 'use_snp_selection': False}. Best is trial 134 with value: 0.2558381167454596.
[I 2025-12-06 07:50:40,992] Trial 144 finished with value: 0.24320457506961696 and parameters: {'model_type': 'mlp', 'hidden_dims': '[128, 64]', 'dropout': 0.16803133404208037, 'batch_norm': True, 'lr': 4.740092993725397e-05, 'weight_decay': 1.2289280356522766e-05, 'epochs': 246, 'loss': 'mae', 'optimizer': 'adam', 'graph_mode': 'off', 'use_snp_selection': False}. Best is trial 134 with value: 0.2558381167454596.
[I 2025-12-06 07:52:14,820] Trial 145 finished with value: 0.23925394684187262 and parameters: {'model_type': 'mlp', 'hidden_dims': '[512, 64]', 'dropout': 0.12011442329419358, 'batch_norm': True, 'lr': 6.544975959670389e-05, 'weight_decay': 2.229289110215523e-06, 'epochs': 312, 'loss': 'mae', 'optimizer': 'adam', 'graph_mode': 'off', 'use_snp_selection': False}. Best is trial 134 with value: 0.2558381167454596.
[I 2025-12-06 07:53:47,827] Trial 146 finished with value: 0.24344662442174073 and parameters: {'model_type': 'mlp', 'hidden_dims': '[512, 256]', 'dropout': 0.13606751232166697, 'batch_norm': True, 'lr': 0.0005730048948219389, 'weight_decay': 7.447406122492268e-06, 'epochs': 307, 'loss': 'mae', 'optimizer': 'adam', 'graph_mode': 'off', 'use_snp_selection': False}. Best is trial 134 with value: 0.2558381167454596.
[I 2025-12-06 07:54:25,093] Trial 147 finished with value: 0.24146157628460757 and parameters: {'model_type': 'mlp', 'hidden_dims': '[256, 128]', 'dropout': 0.154666319526023, 'batch_norm': True, 'lr': 0.000817388119437476, 'weight_decay': 7.719107036493962e-07, 'epochs': 217, 'loss': 'mae', 'optimizer': 'adam', 'graph_mode': 'off', 'use_snp_selection': False}. Best is trial 134 with value: 0.2558381167454596.
[I 2025-12-06 07:55:52,869] Trial 148 finished with value: 0.23385627267266584 and parameters: {'model_type': 'mlp', 'hidden_dims': '[512, 64]', 'dropout': 0.18429670434343767, 'batch_norm': True, 'lr': 0.000481622625232666, 'weight_decay': 1.9155990322265595e-06, 'epochs': 291, 'loss': 'mse', 'optimizer': 'adam', 'graph_mode': 'off', 'use_snp_selection': False}. Best is trial 134 with value: 0.2558381167454596.
[I 2025-12-06 07:57:00,901] Trial 149 finished with value: 0.22701692643482435 and parameters: {'model_type': 'mlp', 'hidden_dims': '[256, 128, 64]', 'dropout': 0.11354971128779218, 'batch_norm': True, 'lr': 3.536804633691537e-05, 'weight_decay': 0.0002918639147682043, 'epochs': 302, 'loss': 'mae', 'optimizer': 'adam', 'graph_mode': 'off', 'use_snp_selection': True, 'num_snps': 38365}. Best is trial 134 with value: 0.2558381167454596.
[I 2025-12-06 07:58:12,173] Trial 0 finished with value: 0.12215883189928907 and parameters: {'model_type': 'mlp', 'hidden_dims': '[128, 64]', 'dropout': 0.199031432379812, 'batch_norm': True, 'lr': 1.8408544111075837e-06, 'weight_decay': 5.5136510071208614e-05, 'epochs': 336, 'loss': 'mae', 'optimizer': 'adam', 'graph_mode': 'off', 'use_snp_selection': True, 'num_snps': 43862}. Best is trial 0 with value: 0.12215883189928907.
[I 2025-12-06 07:58:53,026] Trial 1 finished with value: 0.18582314106886821 and parameters: {'model_type': 'mlp', 'hidden_dims': '[256, 128]', 'dropout': 0.4370668075331726, 'batch_norm': True, 'lr': 7.133471581159139e-05, 'weight_decay': 1.128633586803549e-05, 'epochs': 242, 'loss': 'mae', 'optimizer': 'adam', 'graph_mode': 'off', 'use_snp_selection': False}. Best is trial 1 with value: 0.18582314106886821.
[I 2025-12-06 07:59:30,200] Trial 2 finished with value: 0.14348724941383662 and parameters: {'model_type': 'mlp', 'hidden_dims': '[256, 128, 64]', 'dropout': 0.41314357415569625, 'batch_norm': False, 'lr': 3.952233718592101e-06, 'weight_decay': 0.00026754769258252603, 'epochs': 149, 'loss': 'mse', 'optimizer': 'adam', 'graph_mode': 'off', 'use_snp_selection': True, 'num_snps': 11571}. Best is trial 1 with value: 0.18582314106886821.
[I 2025-12-06 08:01:06,437] Trial 3 finished with value: 0.18756807608101508 and parameters: {'model_type': 'mlp', 'hidden_dims': '[512, 64]', 'dropout': 0.5938127374509361, 'batch_norm': False, 'lr': 5.67704586114731e-06, 'weight_decay': 2.4518087630137052e-05, 'epochs': 320, 'loss': 'mae', 'optimizer': 'adam', 'graph_mode': 'off', 'use_snp_selection': False}. Best is trial 3 with value: 0.18756807608101508.
[I 2025-12-06 08:02:32,294] Trial 4 finished with value: 0.12444998603039023 and parameters: {'model_type': 'mlp', 'hidden_dims': '[512, 128]', 'dropout': 0.25746343592134413, 'batch_norm': True, 'lr': 1.3467657668402788e-06, 'weight_decay': 0.00033087251918647806, 'epochs': 277, 'loss': 'mse', 'optimizer': 'adam', 'graph_mode': 'off', 'use_snp_selection': True, 'num_snps': 36675}. Best is trial 3 with value: 0.18756807608101508.
[I 2025-12-06 08:03:32,377] Trial 5 finished with value: 0.12914349867583255 and parameters: {'model_type': 'mlp', 'hidden_dims': '[512, 64]', 'dropout': 0.38275350994408375, 'batch_norm': True, 'lr': 1.5586664309232824e-06, 'weight_decay': 0.0008227664668621182, 'epochs': 145, 'loss': 'mae', 'optimizer': 'adam', 'graph_mode': 'off', 'use_snp_selection': True, 'num_snps': 32148}. Best is trial 3 with value: 0.18756807608101508.
[I 2025-12-06 08:04:06,280] Trial 6 finished with value: 0.18857316635747673 and parameters: {'model_type': 'mlp', 'hidden_dims': '[256, 128]', 'dropout': 0.3930109900265879, 'batch_norm': False, 'lr': 4.892964372128395e-05, 'weight_decay': 1.5809549317992182e-06, 'epochs': 199, 'loss': 'mse', 'optimizer': 'adam', 'graph_mode': 'off', 'use_snp_selection': False}. Best is trial 6 with value: 0.18857316635747673.
[I 2025-12-06 08:04:41,136] Trial 7 finished with value: 0.17108422544121923 and parameters: {'model_type': 'mlp', 'hidden_dims': '[512, 256]', 'dropout': 0.15343979219678458, 'batch_norm': True, 'lr': 6.234003099047341e-05, 'weight_decay': 3.894760610535477e-07, 'epochs': 97, 'loss': 'mse', 'optimizer': 'adam', 'graph_mode': 'off', 'use_snp_selection': False}. Best is trial 6 with value: 0.18857316635747673.
[I 2025-12-06 08:06:17,139] Trial 8 finished with value: 0.19276028163203954 and parameters: {'model_type': 'mlp', 'hidden_dims': '[512, 128]', 'dropout': 0.10743001231661406, 'batch_norm': True, 'lr': 0.00023728538449271062, 'weight_decay': 1.7629071578048637e-05, 'epochs': 312, 'loss': 'mae', 'optimizer': 'adam', 'graph_mode': 'off', 'use_snp_selection': False}. Best is trial 8 with value: 0.19276028163203954.
[I 2025-12-06 08:07:14,288] Trial 9 finished with value: 0.18290721356269715 and parameters: {'model_type': 'mlp', 'hidden_dims': '[512, 64]', 'dropout': 0.14505336736221927, 'batch_norm': True, 'lr': 5.8619638388111826e-05, 'weight_decay': 6.200156172669308e-07, 'epochs': 175, 'loss': 'mse', 'optimizer': 'adam', 'graph_mode': 'off', 'use_snp_selection': False}. Best is trial 8 with value: 0.19276028163203954.
[I 2025-12-06 08:07:36,858] Trial 10 finished with value: 0.11794805673379224 and parameters: {'model_type': 'mlp', 'hidden_dims': '[512, 128]', 'dropout': 0.2800030442581858, 'batch_norm': False, 'lr': 0.0004919806695968258, 'weight_decay': 2.9953888095455486e-06, 'epochs': 55, 'loss': 'mae', 'optimizer': 'adam', 'graph_mode': 'off', 'use_snp_selection': False}. Best is trial 8 with value: 0.19276028163203954.
[I 2025-12-06 08:08:16,456] Trial 11 finished with value: 0.185835997044841 and parameters: {'model_type': 'mlp', 'hidden_dims': '[256, 128]', 'dropout': 0.5025533409127559, 'batch_norm': False, 'lr': 0.00034089430505247417, 'weight_decay': 2.512571353186099e-06, 'epochs': 239, 'loss': 'mse', 'optimizer': 'adam', 'graph_mode': 'off', 'use_snp_selection': False}. Best is trial 8 with value: 0.19276028163203954.
[I 2025-12-06 08:09:22,956] Trial 12 finished with value: 0.18918889758330856 and parameters: {'model_type': 'mlp', 'hidden_dims': '[512, 128]', 'dropout': 0.33506312640228997, 'batch_norm': False, 'lr': 1.764783267762576e-05, 'weight_decay': 1.3081036432574914e-07, 'epochs': 211, 'loss': 'mae', 'optimizer': 'adam', 'graph_mode': 'off', 'use_snp_selection': False}. Best is trial 8 with value: 0.19276028163203954.
[I 2025-12-06 08:10:51,114] Trial 13 finished with value: 0.17656877351141584 and parameters: {'model_type': 'mlp', 'hidden_dims': '[512, 128]', 'dropout': 0.29592074422710474, 'batch_norm': False, 'lr': 1.3373175420781734e-05, 'weight_decay': 1.0885943577911259e-07, 'epochs': 287, 'loss': 'mae', 'optimizer': 'adam', 'graph_mode': 'off', 'use_snp_selection': False}. Best is trial 8 with value: 0.19276028163203954.
[I 2025-12-06 08:12:03,667] Trial 14 finished with value: 0.19011555989816517 and parameters: {'model_type': 'mlp', 'hidden_dims': '[512, 128]', 'dropout': 0.22073574320403697, 'batch_norm': True, 'lr': 0.00017558188744418174, 'weight_decay': 5.724103314313124e-05, 'epochs': 229, 'loss': 'mae', 'optimizer': 'adam', 'graph_mode': 'off', 'use_snp_selection': False}. Best is trial 8 with value: 0.19276028163203954.
[I 2025-12-06 08:13:32,695] Trial 15 finished with value: 0.19362247078269118 and parameters: {'model_type': 'mlp', 'hidden_dims': '[512, 128]', 'dropout': 0.10283653531299912, 'batch_norm': True, 'lr': 0.00018728330685798084, 'weight_decay': 6.682546297843178e-05, 'epochs': 287, 'loss': 'mae', 'optimizer': 'adam', 'graph_mode': 'off', 'use_snp_selection': False}. Best is trial 15 with value: 0.19362247078269118.
[I 2025-12-06 08:14:30,244] Trial 16 finished with value: 0.18260892883255395 and parameters: {'model_type': 'mlp', 'hidden_dims': '[256, 128, 64]', 'dropout': 0.11103107575065131, 'batch_norm': True, 'lr': 0.0008608834321780825, 'weight_decay': 0.00011431726695115916, 'epochs': 350, 'loss': 'mae', 'optimizer': 'adam', 'graph_mode': 'off', 'use_snp_selection': False}. Best is trial 15 with value: 0.19362247078269118.
[I 2025-12-06 08:14:57,289] Trial 17 finished with value: 0.18755338466616486 and parameters: {'model_type': 'mlp', 'hidden_dims': '[128, 64]', 'dropout': 0.10230308008198463, 'batch_norm': True, 'lr': 0.00016378525744660302, 'weight_decay': 7.470963505970814e-06, 'epochs': 287, 'loss': 'mae', 'optimizer': 'adam', 'graph_mode': 'off', 'use_snp_selection': False}. Best is trial 15 with value: 0.19362247078269118.
[I 2025-12-06 08:17:06,840] Trial 18 finished with value: 0.18994291684045111 and parameters: {'model_type': 'mlp', 'hidden_dims': '[512, 256]', 'dropout': 0.21759080685139784, 'batch_norm': True, 'lr': 0.00016259758042430926, 'weight_decay': 1.1159800528998372e-05, 'epochs': 311, 'loss': 'mae', 'optimizer': 'adam', 'graph_mode': 'off', 'use_snp_selection': True, 'num_snps': 58241}. Best is trial 15 with value: 0.19362247078269118.
[I 2025-12-06 08:18:29,271] Trial 19 finished with value: 0.18774365069025695 and parameters: {'model_type': 'mlp', 'hidden_dims': '[512, 128]', 'dropout': 0.17048398216292915, 'batch_norm': True, 'lr': 0.0003251383087518385, 'weight_decay': 2.8130326038007742e-05, 'epochs': 265, 'loss': 'mae', 'optimizer': 'adam', 'graph_mode': 'off', 'use_snp_selection': False}. Best is trial 15 with value: 0.19362247078269118.
[I 2025-12-06 08:20:05,095] Trial 20 finished with value: 0.1856139034143684 and parameters: {'model_type': 'mlp', 'hidden_dims': '[512, 128]', 'dropout': 0.4697817576417166, 'batch_norm': True, 'lr': 0.0006950420206610456, 'weight_decay': 0.00013085730167205134, 'epochs': 311, 'loss': 'mae', 'optimizer': 'adam', 'graph_mode': 'off', 'use_snp_selection': False}. Best is trial 15 with value: 0.19362247078269118.
[I 2025-12-06 08:21:19,033] Trial 21 finished with value: 0.19403468051277564 and parameters: {'model_type': 'mlp', 'hidden_dims': '[512, 128]', 'dropout': 0.22906894083362722, 'batch_norm': True, 'lr': 0.00017228730194886107, 'weight_decay': 4.5722986306944646e-05, 'epochs': 234, 'loss': 'mae', 'optimizer': 'adam', 'graph_mode': 'off', 'use_snp_selection': False}. Best is trial 21 with value: 0.19403468051277564.
[I 2025-12-06 08:22:40,957] Trial 22 finished with value: 0.19039912225981956 and parameters: {'model_type': 'mlp', 'hidden_dims': '[512, 128]', 'dropout': 0.13096596943730135, 'batch_norm': True, 'lr': 0.00013125309290784544, 'weight_decay': 2.7995357335812167e-05, 'epochs': 262, 'loss': 'mae', 'optimizer': 'adam', 'graph_mode': 'off', 'use_snp_selection': False}. Best is trial 21 with value: 0.19403468051277564.
[I 2025-12-06 08:24:13,715] Trial 23 finished with value: 0.1869858416394356 and parameters: {'model_type': 'mlp', 'hidden_dims': '[512, 128]', 'dropout': 0.18499711800392665, 'batch_norm': True, 'lr': 0.0003016140254855497, 'weight_decay': 6.64537555519221e-05, 'epochs': 300, 'loss': 'mae', 'optimizer': 'adam', 'graph_mode': 'off', 'use_snp_selection': False}. Best is trial 21 with value: 0.19403468051277564.
[I 2025-12-06 08:25:35,779] Trial 24 finished with value: 0.18366513392718148 and parameters: {'model_type': 'mlp', 'hidden_dims': '[512, 128]', 'dropout': 0.24847547362830263, 'batch_norm': True, 'lr': 2.7013005792357815e-05, 'weight_decay': 6.7226048662231935e-06, 'epochs': 263, 'loss': 'mae', 'optimizer': 'adam', 'graph_mode': 'off', 'use_snp_selection': False}. Best is trial 21 with value: 0.19403468051277564.
[I 2025-12-06 08:27:16,978] Trial 25 finished with value: 0.18858310052066005 and parameters: {'model_type': 'mlp', 'hidden_dims': '[512, 128]', 'dropout': 0.15342603120290954, 'batch_norm': True, 'lr': 0.000126719185414079, 'weight_decay': 0.0002756324218043095, 'epochs': 330, 'loss': 'mae', 'optimizer': 'adam', 'graph_mode': 'off', 'use_snp_selection': False}. Best is trial 21 with value: 0.19403468051277564.
[I 2025-12-06 08:27:50,521] Trial 26 finished with value: 0.11692823029971659 and parameters: {'model_type': 'mlp', 'hidden_dims': '[256, 128, 64]', 'dropout': 0.31988872796561907, 'batch_norm': True, 'lr': 0.00024325361102471118, 'weight_decay': 2.4757082441940512e-05, 'epochs': 227, 'loss': 'mae', 'optimizer': 'adam', 'graph_mode': 'off', 'use_snp_selection': True, 'num_snps': 3842}. Best is trial 21 with value: 0.19403468051277564.
[I 2025-12-06 08:28:09,898] Trial 27 finished with value: 0.1825910477075605 and parameters: {'model_type': 'mlp', 'hidden_dims': '[128, 64]', 'dropout': 0.10754661799083128, 'batch_norm': True, 'lr': 9.977200514453853e-05, 'weight_decay': 0.00014813677612658376, 'epochs': 186, 'loss': 'mae', 'optimizer': 'adam', 'graph_mode': 'off', 'use_snp_selection': False}. Best is trial 21 with value: 0.19403468051277564.
[I 2025-12-06 08:29:29,057] Trial 28 finished with value: 0.18795180554605534 and parameters: {'model_type': 'mlp', 'hidden_dims': '[512, 256]', 'dropout': 0.219196935871986, 'batch_norm': True, 'lr': 0.0009922892755849526, 'weight_decay': 0.0006082525645697501, 'epochs': 253, 'loss': 'mae', 'optimizer': 'adam', 'graph_mode': 'off', 'use_snp_selection': False}. Best is trial 21 with value: 0.19403468051277564.
[I 2025-12-06 08:30:12,792] Trial 29 finished with value: 0.15398599424571074 and parameters: {'model_type': 'mlp', 'hidden_dims': '[128, 64]', 'dropout': 0.18237528142678736, 'batch_norm': True, 'lr': 0.0004833042125177663, 'weight_decay': 5.174609461592316e-05, 'epochs': 334, 'loss': 'mae', 'optimizer': 'adam', 'graph_mode': 'off', 'use_snp_selection': True, 'num_snps': 19468}. Best is trial 21 with value: 0.19403468051277564.
[I 2025-12-06 08:31:43,233] Trial 30 finished with value: 0.18040756606489156 and parameters: {'model_type': 'mlp', 'hidden_dims': '[512, 128]', 'dropout': 0.20060662045883715, 'batch_norm': True, 'lr': 3.159135169829923e-05, 'weight_decay': 1.3771801492741568e-05, 'epochs': 295, 'loss': 'mae', 'optimizer': 'adam', 'graph_mode': 'off', 'use_snp_selection': False}. Best is trial 21 with value: 0.19403468051277564.
[I 2025-12-06 08:33:07,492] Trial 31 finished with value: 0.19078558973902762 and parameters: {'model_type': 'mlp', 'hidden_dims': '[512, 128]', 'dropout': 0.1454756198620008, 'batch_norm': True, 'lr': 9.776988556525792e-05, 'weight_decay': 3.2067724142943156e-05, 'epochs': 271, 'loss': 'mae', 'optimizer': 'adam', 'graph_mode': 'off', 'use_snp_selection': False}. Best is trial 21 with value: 0.19403468051277564.
[I 2025-12-06 08:34:33,010] Trial 32 finished with value: 0.19343336068901573 and parameters: {'model_type': 'mlp', 'hidden_dims': '[512, 128]', 'dropout': 0.1309114368911928, 'batch_norm': True, 'lr': 8.39797631231144e-05, 'weight_decay': 7.294051332393753e-05, 'epochs': 275, 'loss': 'mae', 'optimizer': 'adam', 'graph_mode': 'off', 'use_snp_selection': False}. Best is trial 21 with value: 0.19403468051277564.
[I 2025-12-06 08:36:19,643] Trial 33 finished with value: 0.18852622768616906 and parameters: {'model_type': 'mlp', 'hidden_dims': '[512, 128]', 'dropout': 0.12675256597286702, 'batch_norm': True, 'lr': 8.613404321373549e-05, 'weight_decay': 8.822340236655884e-05, 'epochs': 349, 'loss': 'mae', 'optimizer': 'adam', 'graph_mode': 'off', 'use_snp_selection': False}. Best is trial 21 with value: 0.19403468051277564.
[I 2025-12-06 08:36:57,303] Trial 34 finished with value: 0.19383030598513512 and parameters: {'model_type': 'mlp', 'hidden_dims': '[256, 128]', 'dropout': 0.2491009705664879, 'batch_norm': True, 'lr': 0.00021690022206913968, 'weight_decay': 0.00019045202435599498, 'epochs': 216, 'loss': 'mae', 'optimizer': 'adam', 'graph_mode': 'off', 'use_snp_selection': False}. Best is trial 21 with value: 0.19403468051277564.
[I 2025-12-06 08:37:28,835] Trial 35 finished with value: 0.18729233380680538 and parameters: {'model_type': 'mlp', 'hidden_dims': '[256, 128]', 'dropout': 0.26115265936569665, 'batch_norm': True, 'lr': 4.012484088360648e-05, 'weight_decay': 0.00037038220311700904, 'epochs': 174, 'loss': 'mae', 'optimizer': 'adam', 'graph_mode': 'off', 'use_snp_selection': False}. Best is trial 21 with value: 0.19403468051277564.
[I 2025-12-06 08:38:46,606] Trial 36 finished with value: 0.18659892442287618 and parameters: {'model_type': 'mlp', 'hidden_dims': '[256, 128]', 'dropout': 0.23702632196593623, 'batch_norm': True, 'lr': 0.00042233665781132607, 'weight_decay': 0.00021204426037896198, 'epochs': 214, 'loss': 'mse', 'optimizer': 'adam', 'graph_mode': 'off', 'use_snp_selection': True, 'num_snps': 58661}. Best is trial 21 with value: 0.19403468051277564.
