[I 2025-12-05 16:07:39,533] Trial 104 finished with value: 0.15813611152191542 and parameters: {'model_type': 'mlp', 'hidden_dims': '[512, 128]', 'dropout': 0.10987407325260126, 'batch_norm': True, 'lr': 7.657825217732921e-05, 'weight_decay': 9.072238697594089e-06, 'epochs': 279, 'loss': 'mae', 'optimizer': 'adam', 'graph_mode': 'off', 'use_snp_selection': False}. Best is trial 24 with value: 0.17902410124327034.
[I 2025-12-05 16:07:44,083] Trial 105 finished with value: 0.1660303444891445 and parameters: {'model_type': 'mlp', 'hidden_dims': '[512, 128]', 'dropout': 0.14424360158822414, 'batch_norm': True, 'lr': 0.00010541223016089613, 'weight_decay': 1.2401356848991871e-06, 'epochs': 312, 'loss': 'mae', 'optimizer': 'adam', 'graph_mode': 'off', 'use_snp_selection': False}. Best is trial 24 with value: 0.17902410124327034.
[I 2025-12-05 16:07:47,306] Trial 106 finished with value: 0.16470569223720857 and parameters: {'model_type': 'mlp', 'hidden_dims': '[512, 128]', 'dropout': 0.1015303994252696, 'batch_norm': True, 'lr': 8.076890406383138e-05, 'weight_decay': 5.894939259861662e-06, 'epochs': 205, 'loss': 'mae', 'optimizer': 'adam', 'graph_mode': 'off', 'use_snp_selection': False}. Best is trial 24 with value: 0.17902410124327034.
[I 2025-12-05 16:07:52,068] Trial 107 finished with value: 0.16822717091374143 and parameters: {'model_type': 'mlp', 'hidden_dims': '[512, 128]', 'dropout': 0.12113499229478947, 'batch_norm': True, 'lr': 0.00012527758641583419, 'weight_decay': 8.138295206159912e-06, 'epochs': 330, 'loss': 'mae', 'optimizer': 'adam', 'graph_mode': 'off', 'use_snp_selection': False}. Best is trial 24 with value: 0.17902410124327034.
[I 2025-12-05 16:07:56,096] Trial 108 finished with value: 0.13317140648794387 and parameters: {'model_type': 'mlp', 'hidden_dims': '[512, 128]', 'dropout': 0.3881748199195363, 'batch_norm': True, 'lr': 2.3654177980622096e-05, 'weight_decay': 2.124200184365336e-06, 'epochs': 271, 'loss': 'mse', 'optimizer': 'adam', 'graph_mode': 'off', 'use_snp_selection': False}. Best is trial 24 with value: 0.17902410124327034.
[I 2025-12-05 16:07:57,505] Trial 109 finished with value: 0.15166515685677773 and parameters: {'model_type': 'mlp', 'hidden_dims': '[128, 64]', 'dropout': 0.4036891581554769, 'batch_norm': True, 'lr': 9.615142867905557e-05, 'weight_decay': 2.638110634348939e-06, 'epochs': 283, 'loss': 'mae', 'optimizer': 'adam', 'graph_mode': 'off', 'use_snp_selection': False}. Best is trial 24 with value: 0.17902410124327034.
[I 2025-12-05 16:08:01,933] Trial 110 finished with value: 0.12599572321644154 and parameters: {'model_type': 'mlp', 'hidden_dims': '[512, 128]', 'dropout': 0.507900960538141, 'batch_norm': True, 'lr': 6.517655247531109e-05, 'weight_decay': 4.490240793423375e-06, 'epochs': 303, 'loss': 'mae', 'optimizer': 'adam', 'graph_mode': 'off', 'use_snp_selection': False}. Best is trial 24 with value: 0.17902410124327034.
[I 2025-12-05 16:08:06,147] Trial 111 finished with value: 0.16614702376553822 and parameters: {'model_type': 'mlp', 'hidden_dims': '[512, 128]', 'dropout': 0.11052872795161627, 'batch_norm': True, 'lr': 0.00019361358814693822, 'weight_decay': 2.3448976721953326e-05, 'epochs': 286, 'loss': 'mae', 'optimizer': 'adam', 'graph_mode': 'off', 'use_snp_selection': False}. Best is trial 24 with value: 0.17902410124327034.
[I 2025-12-05 16:08:08,673] Trial 112 finished with value: 0.1643738279736488 and parameters: {'model_type': 'mlp', 'hidden_dims': '[256, 128]', 'dropout': 0.12255609566381488, 'batch_norm': True, 'lr': 0.00014441983797057817, 'weight_decay': 1.1409721325282842e-05, 'epochs': 291, 'loss': 'mae', 'optimizer': 'adam', 'graph_mode': 'off', 'use_snp_selection': False}. Best is trial 24 with value: 0.17902410124327034.
[I 2025-12-05 16:08:11,571] Trial 113 finished with value: 0.16671672339309546 and parameters: {'model_type': 'mlp', 'hidden_dims': '[512, 256]', 'dropout': 0.1367639060547043, 'batch_norm': True, 'lr': 5.470498033375908e-05, 'weight_decay': 1.574970697095721e-05, 'epochs': 179, 'loss': 'mae', 'optimizer': 'adam', 'graph_mode': 'off', 'use_snp_selection': False}. Best is trial 24 with value: 0.17902410124327034.
[I 2025-12-05 16:08:16,242] Trial 114 finished with value: 0.15681692794796692 and parameters: {'model_type': 'mlp', 'hidden_dims': '[512, 128]', 'dropout': 0.14878676199138297, 'batch_norm': True, 'lr': 0.00016186209560839862, 'weight_decay': 5.905921416822657e-06, 'epochs': 322, 'loss': 'mae', 'optimizer': 'adam', 'graph_mode': 'off', 'use_snp_selection': False}. Best is trial 24 with value: 0.17902410124327034.
[I 2025-12-05 16:08:20,644] Trial 115 finished with value: 0.15455083086926855 and parameters: {'model_type': 'mlp', 'hidden_dims': '[512, 64]', 'dropout': 0.16040466658161046, 'batch_norm': False, 'lr': 8.992274621769791e-05, 'weight_decay': 4.534573531296859e-05, 'epochs': 309, 'loss': 'mae', 'optimizer': 'adam', 'graph_mode': 'off', 'use_snp_selection': False}. Best is trial 24 with value: 0.17902410124327034.
[I 2025-12-05 16:08:22,366] Trial 116 finished with value: 0.14515442386700667 and parameters: {'model_type': 'mlp', 'hidden_dims': '[256, 128, 64]', 'dropout': 0.3115064855257863, 'batch_norm': True, 'lr': 0.0002108532881237267, 'weight_decay': 3.09290277221839e-05, 'epochs': 169, 'loss': 'mse', 'optimizer': 'adam', 'graph_mode': 'off', 'use_snp_selection': False}. Best is trial 24 with value: 0.17902410124327034.
[I 2025-12-05 16:08:24,088] Trial 117 finished with value: 0.1400684317779497 and parameters: {'model_type': 'mlp', 'hidden_dims': '[512, 128]', 'dropout': 0.13312925001196718, 'batch_norm': True, 'lr': 0.00010311443810834084, 'weight_decay': 1.8850019648243656e-06, 'epochs': 85, 'loss': 'mae', 'optimizer': 'adam', 'graph_mode': 'off', 'use_snp_selection': False}. Best is trial 24 with value: 0.17902410124327034.
[I 2025-12-05 16:08:26,489] Trial 118 finished with value: 0.1563255294043818 and parameters: {'model_type': 'mlp', 'hidden_dims': '[512, 128]', 'dropout': 0.10040123531539921, 'batch_norm': True, 'lr': 0.00011872356142500057, 'weight_decay': 0.0001073368518415138, 'epochs': 140, 'loss': 'mae', 'optimizer': 'adam', 'graph_mode': 'off', 'use_snp_selection': False}. Best is trial 24 with value: 0.17902410124327034.
[I 2025-12-05 16:08:28,665] Trial 119 finished with value: 0.10306298059114831 and parameters: {'model_type': 'mlp', 'hidden_dims': '[512, 128]', 'dropout': 0.5990127129355303, 'batch_norm': True, 'lr': 0.00013927465918496193, 'weight_decay': 7.158901528557606e-05, 'epochs': 253, 'loss': 'mae', 'optimizer': 'adam', 'graph_mode': 'off', 'use_snp_selection': True, 'num_snps': 11101}. Best is trial 24 with value: 0.17902410124327034.
[I 2025-12-05 16:08:31,243] Trial 120 finished with value: 0.14297601976096225 and parameters: {'model_type': 'mlp', 'hidden_dims': '[256, 128]', 'dropout': 0.11313495397249995, 'batch_norm': True, 'lr': 3.507554178901007e-05, 'weight_decay': 0.00033998118875843813, 'epochs': 300, 'loss': 'mse', 'optimizer': 'adam', 'graph_mode': 'off', 'use_snp_selection': False}. Best is trial 24 with value: 0.17902410124327034.
[I 2025-12-05 16:08:35,820] Trial 121 finished with value: 0.16674332904278052 and parameters: {'model_type': 'mlp', 'hidden_dims': '[512, 128]', 'dropout': 0.1272777727198535, 'batch_norm': True, 'lr': 0.00036871665546750145, 'weight_decay': 1.6280061560133937e-06, 'epochs': 315, 'loss': 'mae', 'optimizer': 'adam', 'graph_mode': 'off', 'use_snp_selection': False}. Best is trial 24 with value: 0.17902410124327034.
[I 2025-12-05 16:08:40,711] Trial 122 finished with value: 0.16466875753651922 and parameters: {'model_type': 'mlp', 'hidden_dims': '[512, 128]', 'dropout': 0.2077674224440741, 'batch_norm': True, 'lr': 0.00026900267282506634, 'weight_decay': 3.4046624852353993e-06, 'epochs': 340, 'loss': 'mae', 'optimizer': 'adam', 'graph_mode': 'off', 'use_snp_selection': False}. Best is trial 24 with value: 0.17902410124327034.
[I 2025-12-05 16:08:45,044] Trial 123 finished with value: 0.16709180211511598 and parameters: {'model_type': 'mlp', 'hidden_dims': '[512, 128]', 'dropout': 0.17342085048736472, 'batch_norm': True, 'lr': 0.0002339541116067819, 'weight_decay': 9.718743901933764e-07, 'epochs': 293, 'loss': 'mae', 'optimizer': 'adam', 'graph_mode': 'off', 'use_snp_selection': False}. Best is trial 24 with value: 0.17902410124327034.
[I 2025-12-05 16:08:49,526] Trial 124 finished with value: 0.164706931051331 and parameters: {'model_type': 'mlp', 'hidden_dims': '[512, 128]', 'dropout': 0.14273086920686323, 'batch_norm': True, 'lr': 0.00033875074167016953, 'weight_decay': 1.4168352443909575e-06, 'epochs': 307, 'loss': 'mae', 'optimizer': 'adam', 'graph_mode': 'off', 'use_snp_selection': False}. Best is trial 24 with value: 0.17902410124327034.
[I 2025-12-05 16:08:54,132] Trial 125 finished with value: 0.1653844700077345 and parameters: {'model_type': 'mlp', 'hidden_dims': '[512, 128]', 'dropout': 0.11925854993365878, 'batch_norm': True, 'lr': 0.00019341882997845776, 'weight_decay': 3.0210830316977033e-06, 'epochs': 316, 'loss': 'mae', 'optimizer': 'adam', 'graph_mode': 'off', 'use_snp_selection': False}. Best is trial 24 with value: 0.17902410124327034.
[I 2025-12-05 16:08:57,226] Trial 126 finished with value: 0.1598441861478501 and parameters: {'model_type': 'mlp', 'hidden_dims': '[512, 64]', 'dropout': 0.2274063625364863, 'batch_norm': True, 'lr': 0.00015994395227072696, 'weight_decay': 3.6985859249546703e-07, 'epochs': 196, 'loss': 'mae', 'optimizer': 'adam', 'graph_mode': 'off', 'use_snp_selection': False}. Best is trial 24 with value: 0.17902410124327034.
[I 2025-12-05 16:09:01,628] Trial 127 finished with value: 0.1586626494745647 and parameters: {'model_type': 'mlp', 'hidden_dims': '[512, 128]', 'dropout': 0.36369222312154414, 'batch_norm': True, 'lr': 7.87346218165383e-05, 'weight_decay': 6.776195938217756e-07, 'epochs': 301, 'loss': 'mae', 'optimizer': 'adam', 'graph_mode': 'off', 'use_snp_selection': False}. Best is trial 24 with value: 0.17902410124327034.
[I 2025-12-05 16:09:05,767] Trial 128 finished with value: 0.09964764269619514 and parameters: {'model_type': 'mlp', 'hidden_dims': '[512, 256]', 'dropout': 0.1876036301694715, 'batch_norm': True, 'lr': 2.3732095640054574e-06, 'weight_decay': 2.0283050780129625e-05, 'epochs': 279, 'loss': 'mae', 'optimizer': 'adam', 'graph_mode': 'off', 'use_snp_selection': False}. Best is trial 24 with value: 0.17902410124327034.
[I 2025-12-05 16:09:09,637] Trial 129 finished with value: 0.14107174210703433 and parameters: {'model_type': 'mlp', 'hidden_dims': '[512, 128]', 'dropout': 0.15210047161257367, 'batch_norm': False, 'lr': 0.00011450350717504504, 'weight_decay': 4.254739340829382e-06, 'epochs': 265, 'loss': 'mse', 'optimizer': 'adam', 'graph_mode': 'off', 'use_snp_selection': False}. Best is trial 24 with value: 0.17902410124327034.
[I 2025-12-05 16:09:10,660] Trial 130 finished with value: 0.1416609819714686 and parameters: {'model_type': 'mlp', 'hidden_dims': '[128, 64]', 'dropout': 0.11022139083969582, 'batch_norm': True, 'lr': 4.832209796618146e-05, 'weight_decay': 2.0961097469288272e-06, 'epochs': 157, 'loss': 'mae', 'optimizer': 'adam', 'graph_mode': 'off', 'use_snp_selection': False}. Best is trial 24 with value: 0.17902410124327034.
[I 2025-12-05 16:09:14,829] Trial 131 finished with value: 0.16673589188939497 and parameters: {'model_type': 'mlp', 'hidden_dims': '[512, 128]', 'dropout': 0.15961933466955305, 'batch_norm': True, 'lr': 9.482744595473143e-05, 'weight_decay': 2.3901491342903997e-06, 'epochs': 282, 'loss': 'mae', 'optimizer': 'adam', 'graph_mode': 'off', 'use_snp_selection': False}. Best is trial 24 with value: 0.17902410124327034.
[I 2025-12-05 16:09:19,106] Trial 132 finished with value: 0.15629455042631413 and parameters: {'model_type': 'mlp', 'hidden_dims': '[512, 128]', 'dropout': 0.1290958891366967, 'batch_norm': True, 'lr': 6.894597084096187e-05, 'weight_decay': 2.680394889422048e-06, 'epochs': 291, 'loss': 'mae', 'optimizer': 'adam', 'graph_mode': 'off', 'use_snp_selection': False}. Best is trial 24 with value: 0.17902410124327034.
[I 2025-12-05 16:09:23,226] Trial 133 finished with value: 0.15218015144289965 and parameters: {'model_type': 'mlp', 'hidden_dims': '[512, 128]', 'dropout': 0.1517794952339407, 'batch_norm': True, 'lr': 6.030885637654902e-05, 'weight_decay': 0.0009074436729028626, 'epochs': 278, 'loss': 'mae', 'optimizer': 'adam', 'graph_mode': 'off', 'use_snp_selection': False}. Best is trial 24 with value: 0.17902410124327034.
[I 2025-12-05 16:09:27,727] Trial 134 finished with value: 0.16090936221907942 and parameters: {'model_type': 'mlp', 'hidden_dims': '[512, 128]', 'dropout': 0.10047917598374444, 'batch_norm': True, 'lr': 0.00010402766550058213, 'weight_decay': 0.0004831094724703739, 'epochs': 309, 'loss': 'mae', 'optimizer': 'adam', 'graph_mode': 'off', 'use_snp_selection': False}. Best is trial 24 with value: 0.17902410124327034.
[I 2025-12-05 16:09:32,393] Trial 135 finished with value: 0.17488559467642384 and parameters: {'model_type': 'mlp', 'hidden_dims': '[512, 128]', 'dropout': 0.13800672982011927, 'batch_norm': True, 'lr': 0.0001747947235227701, 'weight_decay': 3.6986129705516593e-06, 'epochs': 322, 'loss': 'mae', 'optimizer': 'adam', 'graph_mode': 'off', 'use_snp_selection': False}. Best is trial 24 with value: 0.17902410124327034.
[I 2025-12-05 16:09:37,088] Trial 136 finished with value: 0.16545304230229482 and parameters: {'model_type': 'mlp', 'hidden_dims': '[512, 128]', 'dropout': 0.12021828271792093, 'batch_norm': True, 'lr': 0.000182686254472977, 'weight_decay': 7.531556772579002e-06, 'epochs': 324, 'loss': 'mae', 'optimizer': 'adam', 'graph_mode': 'off', 'use_snp_selection': False}. Best is trial 24 with value: 0.17902410124327034.
[I 2025-12-05 16:09:39,890] Trial 137 finished with value: 0.15827139651487085 and parameters: {'model_type': 'mlp', 'hidden_dims': '[256, 128]', 'dropout': 0.1388924229443373, 'batch_norm': True, 'lr': 0.00013090608317029454, 'weight_decay': 0.00019651113309395439, 'epochs': 332, 'loss': 'mae', 'optimizer': 'adam', 'graph_mode': 'off', 'use_snp_selection': False}. Best is trial 24 with value: 0.17902410124327034.
[I 2025-12-05 16:09:43,242] Trial 138 finished with value: 0.1776992844021846 and parameters: {'model_type': 'mlp', 'hidden_dims': '[512, 128]', 'dropout': 0.11050905715900147, 'batch_norm': True, 'lr': 0.00026745647473222354, 'weight_decay': 3.3760120704221476e-06, 'epochs': 216, 'loss': 'mse', 'optimizer': 'adam', 'graph_mode': 'off', 'use_snp_selection': False}. Best is trial 24 with value: 0.17902410124327034.
[I 2025-12-05 16:09:46,279] Trial 139 finished with value: 0.15940411028528237 and parameters: {'model_type': 'mlp', 'hidden_dims': '[512, 128]', 'dropout': 0.1160172179530085, 'batch_norm': True, 'lr': 0.0002711199876950111, 'weight_decay': 3.857776419986307e-06, 'epochs': 189, 'loss': 'mse', 'optimizer': 'adam', 'graph_mode': 'off', 'use_snp_selection': False}. Best is trial 24 with value: 0.17902410124327034.
[I 2025-12-05 16:09:49,650] Trial 140 finished with value: 0.16293029793563377 and parameters: {'model_type': 'mlp', 'hidden_dims': '[512, 64]', 'dropout': 0.108767304944177, 'batch_norm': True, 'lr': 0.0004164529577726972, 'weight_decay': 1.0136784332278618e-05, 'epochs': 218, 'loss': 'mse', 'optimizer': 'adam', 'graph_mode': 'off', 'use_snp_selection': False}. Best is trial 24 with value: 0.17902410124327034.
[I 2025-12-05 16:09:54,277] Trial 141 finished with value: 0.17430944168718443 and parameters: {'model_type': 'mlp', 'hidden_dims': '[512, 128]', 'dropout': 0.12560838024752907, 'batch_norm': True, 'lr': 0.00022599891246176653, 'weight_decay': 4.738720885824883e-06, 'epochs': 319, 'loss': 'mse', 'optimizer': 'adam', 'graph_mode': 'off', 'use_snp_selection': False}. Best is trial 24 with value: 0.17902410124327034.
[I 2025-12-05 16:09:58,869] Trial 142 finished with value: 0.1633881460062525 and parameters: {'model_type': 'mlp', 'hidden_dims': '[512, 128]', 'dropout': 0.1290511986920289, 'batch_norm': True, 'lr': 0.0002268219958922453, 'weight_decay': 5.435171013424454e-06, 'epochs': 316, 'loss': 'mse', 'optimizer': 'adam', 'graph_mode': 'off', 'use_snp_selection': False}. Best is trial 24 with value: 0.17902410124327034.
[I 2025-12-05 16:10:03,651] Trial 143 finished with value: 0.16924238117717152 and parameters: {'model_type': 'mlp', 'hidden_dims': '[512, 128]', 'dropout': 0.10009116458159102, 'batch_norm': True, 'lr': 0.00017640043478056155, 'weight_decay': 4.783761299729058e-06, 'epochs': 328, 'loss': 'mse', 'optimizer': 'adam', 'graph_mode': 'off', 'use_snp_selection': False}. Best is trial 24 with value: 0.17902410124327034.
[I 2025-12-05 16:10:08,010] Trial 144 finished with value: 0.16099666449750644 and parameters: {'model_type': 'mlp', 'hidden_dims': '[512, 128]', 'dropout': 0.12468990566212587, 'batch_norm': True, 'lr': 0.0003046134542985794, 'weight_decay': 6.988064371623549e-06, 'epochs': 297, 'loss': 'mse', 'optimizer': 'adam', 'graph_mode': 'off', 'use_snp_selection': False}. Best is trial 24 with value: 0.17902410124327034.
[I 2025-12-05 16:10:11,895] Trial 145 finished with value: 0.1590413780917681 and parameters: {'model_type': 'mlp', 'hidden_dims': '[512, 128]', 'dropout': 0.14179202893373136, 'batch_norm': True, 'lr': 0.0001527171274353701, 'weight_decay': 3.631541492448705e-06, 'epochs': 321, 'loss': 'mse', 'optimizer': 'adam', 'graph_mode': 'off', 'use_snp_selection': True, 'num_snps': 28608}. Best is trial 24 with value: 0.17902410124327034.
[I 2025-12-05 16:10:16,781] Trial 146 finished with value: 0.17079635423692938 and parameters: {'model_type': 'mlp', 'hidden_dims': '[512, 128]', 'dropout': 0.11292002507815291, 'batch_norm': True, 'lr': 0.0002188849609208011, 'weight_decay': 2.8913484517254285e-06, 'epochs': 341, 'loss': 'mse', 'optimizer': 'adam', 'graph_mode': 'off', 'use_snp_selection': False}. Best is trial 24 with value: 0.17902410124327034.
[I 2025-12-05 16:10:19,462] Trial 147 finished with value: 0.1645815003263257 and parameters: {'model_type': 'mlp', 'hidden_dims': '[256, 128, 64]', 'dropout': 0.13651462554243424, 'batch_norm': True, 'lr': 0.00026362369112657626, 'weight_decay': 6.2188421744371355e-06, 'epochs': 312, 'loss': 'mse', 'optimizer': 'adam', 'graph_mode': 'off', 'use_snp_selection': False}. Best is trial 24 with value: 0.17902410124327034.
[I 2025-12-05 16:10:23,481] Trial 148 finished with value: 0.165258794032509 and parameters: {'model_type': 'mlp', 'hidden_dims': '[512, 256]', 'dropout': 0.16800360588175772, 'batch_norm': True, 'lr': 8.696505184202827e-05, 'weight_decay': 4.3005052528458045e-06, 'epochs': 270, 'loss': 'mse', 'optimizer': 'adam', 'graph_mode': 'off', 'use_snp_selection': False}. Best is trial 24 with value: 0.17902410124327034.
[I 2025-12-05 16:10:28,311] Trial 149 finished with value: 0.16297284080106983 and parameters: {'model_type': 'mlp', 'hidden_dims': '[512, 128]', 'dropout': 0.12301779840095489, 'batch_norm': True, 'lr': 0.00019812896802704562, 'weight_decay': 1.3621223637615287e-05, 'epochs': 336, 'loss': 'mse', 'optimizer': 'adam', 'graph_mode': 'off', 'use_snp_selection': False}. Best is trial 24 with value: 0.17902410124327034.
[I 2025-12-05 16:10:30,603] Trial 0 finished with value: 0.043675836426202506 and parameters: {'model_type': 'mlp', 'hidden_dims': '[128, 64]', 'dropout': 0.199031432379812, 'batch_norm': True, 'lr': 1.8408544111075837e-06, 'weight_decay': 5.5136510071208614e-05, 'epochs': 336, 'loss': 'mae', 'optimizer': 'adam', 'graph_mode': 'off', 'use_snp_selection': True, 'num_snps': 43862}. Best is trial 0 with value: 0.043675836426202506.
[I 2025-12-05 16:10:31,880] Trial 1 finished with value: 0.10990955341679692 and parameters: {'model_type': 'mlp', 'hidden_dims': '[256, 128]', 'dropout': 0.4370668075331726, 'batch_norm': True, 'lr': 7.133471581159139e-05, 'weight_decay': 1.128633586803549e-05, 'epochs': 242, 'loss': 'mae', 'optimizer': 'adam', 'graph_mode': 'off', 'use_snp_selection': False}. Best is trial 1 with value: 0.10990955341679692.
[I 2025-12-05 16:10:33,054] Trial 2 finished with value: 0.033084107032635104 and parameters: {'model_type': 'mlp', 'hidden_dims': '[256, 128, 64]', 'dropout': 0.41314357415569625, 'batch_norm': False, 'lr': 3.952233718592101e-06, 'weight_decay': 0.00026754769258252603, 'epochs': 149, 'loss': 'mse', 'optimizer': 'adam', 'graph_mode': 'off', 'use_snp_selection': True, 'num_snps': 11571}. Best is trial 1 with value: 0.10990955341679692.
[I 2025-12-05 16:10:35,631] Trial 3 finished with value: 0.07596755395148064 and parameters: {'model_type': 'mlp', 'hidden_dims': '[512, 64]', 'dropout': 0.5938127374509361, 'batch_norm': False, 'lr': 5.67704586114731e-06, 'weight_decay': 2.4518087630137052e-05, 'epochs': 320, 'loss': 'mae', 'optimizer': 'adam', 'graph_mode': 'off', 'use_snp_selection': False}. Best is trial 1 with value: 0.10990955341679692.
[I 2025-12-05 16:10:38,284] Trial 4 finished with value: 0.07372346830393055 and parameters: {'model_type': 'mlp', 'hidden_dims': '[512, 128]', 'dropout': 0.25746343592134413, 'batch_norm': True, 'lr': 1.3467657668402788e-06, 'weight_decay': 0.00033087251918647806, 'epochs': 277, 'loss': 'mse', 'optimizer': 'adam', 'graph_mode': 'off', 'use_snp_selection': True, 'num_snps': 36675}. Best is trial 1 with value: 0.10990955341679692.
[I 2025-12-05 16:10:40,291] Trial 5 finished with value: 0.039257542006260714 and parameters: {'model_type': 'mlp', 'hidden_dims': '[512, 64]', 'dropout': 0.38275350994408375, 'batch_norm': True, 'lr': 1.5586664309232824e-06, 'weight_decay': 0.0008227664668621182, 'epochs': 145, 'loss': 'mae', 'optimizer': 'adam', 'graph_mode': 'off', 'use_snp_selection': True, 'num_snps': 32148}. Best is trial 1 with value: 0.10990955341679692.
